[Measurement for 10kb at 12:43:40 20.43.2014] 
Tshark:

  1   0.000000 172.31.8.238 -> 172.31.0.2   DNS 89 Standard query 0xfb15  A d3m1c4hwkgedal.cloudfront.net
  2   0.000037 172.31.8.238 -> 172.31.0.2   DNS 89 Standard query 0xd50f  AAAA d3m1c4hwkgedal.cloudfront.net
  3   0.000688   172.31.0.2 -> 172.31.8.238 DNS 217 Standard query response 0xfb15  A 54.230.116.44 A 54.230.116.72 A 54.230.118.248 A 54.239.132.26 A 54.239.132.83 A 54.239.132.98 A 54.239.132.103 A 54.192.118.239
  4   0.000698   172.31.0.2 -> 172.31.8.238 DNS 174 Standard query response 0xd50f 
  5   0.003883 172.31.8.238 -> 54.230.116.44 TCP 74 53725 > http [SYN] Seq=0 Win=26883 Len=0 MSS=8961 SACK_PERM=1 TSval=17761965 TSecr=0 WS=128
  6   0.004585 54.230.116.44 -> 172.31.8.238 TCP 74 http > 53725 [SYN, ACK] Seq=0 Ack=1 Win=14480 Len=0 MSS=1460 SACK_PERM=1 TSval=1688342310 TSecr=17761965 WS=128
  7   0.004601 172.31.8.238 -> 54.230.116.44 TCP 66 53725 > http [ACK] Seq=1 Ack=1 Win=27008 Len=0 TSval=17761965 TSecr=1688342310
  8   0.004650 172.31.8.238 -> 54.230.116.44 HTTP 163 GET /10kb HTTP/1.1 
  9   0.005278 54.230.116.44 -> 172.31.8.238 TCP 66 http > 53725 [ACK] Seq=1 Ack=98 Win=14592 Len=0 TSval=1688342310 TSecr=17761965
 10   0.006576 54.230.116.44 -> 172.31.8.238 TCP 2580 [TCP segment of a reassembled PDU]
 11   0.006584 172.31.8.238 -> 54.230.116.44 TCP 66 53725 > http [ACK] Seq=98 Ack=2515 Win=32000 Len=0 TSval=17761966 TSecr=1688342311
 12   0.006682 54.230.116.44 -> 172.31.8.238 HTTP 8247 HTTP/1.1 200 OK  (application/octet-stream)
 13   0.006692 172.31.8.238 -> 54.230.116.44 TCP 66 53725 > http [ACK] Seq=98 Ack=10696 Win=48384 Len=0 TSval=17761966 TSecr=1688342311
 14   0.006834 172.31.8.238 -> 54.230.116.44 TCP 66 53725 > http [FIN, ACK] Seq=98 Ack=10696 Win=48384 Len=0 TSval=17761966 TSecr=1688342311
 15   0.007312 54.230.116.44 -> 172.31.8.238 TCP 66 http > 53725 [FIN, ACK] Seq=10696 Ack=99 Win=14592 Len=0 TSval=1688342311 TSecr=17761966
 16   0.007320 172.31.8.238 -> 54.230.116.44 TCP 66 53725 > http [ACK] Seq=99 Ack=10697 Win=48384 Len=0 TSval=17761966 TSecr=1688342311
