[Measurement for 10kb at 09:44:09 20.44.2014] 
Tshark:

  1   0.000000 172.31.8.238 -> 172.31.0.2   DNS 89 Standard query 0x3418  A d3m1c4hwkgedal.cloudfront.net
  2   0.000029 172.31.8.238 -> 172.31.0.2   DNS 89 Standard query 0x9b1b  AAAA d3m1c4hwkgedal.cloudfront.net
  3   0.000630   172.31.0.2 -> 172.31.8.238 DNS 217 Standard query response 0x3418  A 54.192.118.238 A 54.230.116.82 A 54.230.117.21 A 54.230.117.37 A 54.239.132.74 A 54.239.132.83 A 54.192.118.219 A 54.192.118.228
  4   0.000641   172.31.0.2 -> 172.31.8.238 DNS 174 Standard query response 0x9b1b 
  5   0.003877 172.31.8.238 -> 54.192.118.238 TCP 74 53194 > http [SYN] Seq=0 Win=26883 Len=0 MSS=8961 SACK_PERM=1 TSval=15069353 TSecr=0 WS=128
  6   0.004596 54.192.118.238 -> 172.31.8.238 TCP 74 http > 53194 [SYN, ACK] Seq=0 Ack=1 Win=14480 Len=0 MSS=1460 SACK_PERM=1 TSval=1583783654 TSecr=15069353 WS=128
  7   0.004612 172.31.8.238 -> 54.192.118.238 TCP 66 53194 > http [ACK] Seq=1 Ack=1 Win=27008 Len=0 TSval=15069353 TSecr=1583783654
  8   0.004649 172.31.8.238 -> 54.192.118.238 HTTP 163 GET /10kb HTTP/1.1 
  9   0.005334 54.192.118.238 -> 172.31.8.238 TCP 66 http > 53194 [ACK] Seq=1 Ack=98 Win=14592 Len=0 TSval=1583783654 TSecr=15069353
 10   0.007091 54.192.118.238 -> 172.31.8.238 TCP 2580 [TCP segment of a reassembled PDU]
 11   0.007099 172.31.8.238 -> 54.192.118.238 TCP 66 53194 > http [ACK] Seq=98 Ack=2515 Win=32000 Len=0 TSval=15069354 TSecr=1583783654
 12   0.007189 54.192.118.238 -> 172.31.8.238 HTTP 8247 HTTP/1.1 200 OK  (application/octet-stream)
 13   0.007198 172.31.8.238 -> 54.192.118.238 TCP 66 53194 > http [ACK] Seq=98 Ack=10696 Win=48384 Len=0 TSval=15069354 TSecr=1583783654
 14   0.007340 172.31.8.238 -> 54.192.118.238 TCP 66 53194 > http [FIN, ACK] Seq=98 Ack=10696 Win=48384 Len=0 TSval=15069354 TSecr=1583783654
 15   0.008156 54.192.118.238 -> 172.31.8.238 TCP 66 http > 53194 [FIN, ACK] Seq=10696 Ack=99 Win=14592 Len=0 TSval=1583783654 TSecr=15069354
 16   0.008165 172.31.8.238 -> 54.192.118.238 TCP 66 53194 > http [ACK] Seq=99 Ack=10697 Win=48384 Len=0 TSval=15069354 TSecr=1583783654
