[Measurement for 10kb at 20:43:39 19.43.2014] 
Tshark:

  1   0.000000 172.31.8.238 -> 172.31.0.2   DNS 89 Standard query 0xd24b  A d3m1c4hwkgedal.cloudfront.net
  2   0.000026 172.31.8.238 -> 172.31.0.2   DNS 89 Standard query 0xdfa9  AAAA d3m1c4hwkgedal.cloudfront.net
  3   0.000639   172.31.0.2 -> 172.31.8.238 DNS 174 Standard query response 0xdfa9 
  4   0.000660   172.31.0.2 -> 172.31.8.238 DNS 217 Standard query response 0xd24b  A 54.230.118.239 A 54.239.132.41 A 54.192.118.222 A 54.192.118.237 A 54.192.118.239 A 54.192.118.240 A 54.230.116.82 A 54.230.117.152
  5   0.003873 172.31.8.238 -> 54.230.118.239 TCP 74 35966 > http [SYN] Seq=0 Win=26883 Len=0 MSS=8961 SACK_PERM=1 TSval=3361783 TSecr=0 WS=128
  6   0.004556 54.230.118.239 -> 172.31.8.238 TCP 74 http > 35966 [SYN, ACK] Seq=0 Ack=1 Win=14480 Len=0 MSS=1460 SACK_PERM=1 TSval=1683406764 TSecr=3361783 WS=128
  7   0.004571 172.31.8.238 -> 54.230.118.239 TCP 66 35966 > http [ACK] Seq=1 Ack=1 Win=27008 Len=0 TSval=3361783 TSecr=1683406764
  8   0.004611 172.31.8.238 -> 54.230.118.239 HTTP 163 GET /10kb HTTP/1.1 
  9   0.005306 54.230.118.239 -> 172.31.8.238 TCP 66 http > 35966 [ACK] Seq=1 Ack=98 Win=14592 Len=0 TSval=1683406764 TSecr=3361783
 10   0.007141 54.230.118.239 -> 172.31.8.238 TCP 2581 [TCP segment of a reassembled PDU]
 11   0.007148 172.31.8.238 -> 54.230.118.239 TCP 66 35966 > http [ACK] Seq=98 Ack=2516 Win=32000 Len=0 TSval=3361784 TSecr=1683406764
 12   0.007242 54.230.118.239 -> 172.31.8.238 HTTP 8245 HTTP/1.1 200 OK  (application/octet-stream)
 13   0.007251 172.31.8.238 -> 54.230.118.239 TCP 66 35966 > http [ACK] Seq=98 Ack=10695 Win=48384 Len=0 TSval=3361784 TSecr=1683406764
 14   0.007375 172.31.8.238 -> 54.230.118.239 TCP 66 35966 > http [FIN, ACK] Seq=98 Ack=10695 Win=48384 Len=0 TSval=3361784 TSecr=1683406764
 15   0.007871 54.230.118.239 -> 172.31.8.238 TCP 66 http > 35966 [FIN, ACK] Seq=10695 Ack=99 Win=14592 Len=0 TSval=1683406764 TSecr=3361784
 16   0.007879 172.31.8.238 -> 54.230.118.239 TCP 66 35966 > http [ACK] Seq=99 Ack=10696 Win=48384 Len=0 TSval=3361784 TSecr=1683406764
