[Measurement for 10mb at 22:41:25 19.41.2014] 
Tshark:

  1   0.000000 172.31.8.238 -> 172.31.0.2   DNS 89 Standard query 0x3297  A d1xvcg6dfvgaki.cloudfront.net
  2   0.000041 172.31.8.238 -> 172.31.0.2   DNS 89 Standard query 0xb038  AAAA d1xvcg6dfvgaki.cloudfront.net
  3   0.000745   172.31.0.2 -> 172.31.8.238 DNS 217 Standard query response 0x3297  A 54.239.132.249 A 54.192.118.232 A 54.192.118.238 A 54.230.117.156 A 54.230.119.106 A 54.239.132.166 A 54.239.132.173 A 54.239.132.233
  4   0.000755   172.31.0.2 -> 172.31.8.238 DNS 170 Standard query response 0xb038 
  5   0.003900 172.31.8.238 -> 54.239.132.249 TCP 74 55334 > http [SYN] Seq=0 Win=26883 Len=0 MSS=8961 SACK_PERM=1 TSval=5128254 TSecr=0 WS=128
  6   0.004743 54.239.132.249 -> 172.31.8.238 TCP 74 http > 55334 [SYN, ACK] Seq=0 Ack=1 Win=14480 Len=0 MSS=1460 SACK_PERM=1 TSval=1680614664 TSecr=5128254 WS=128
  7   0.004757 172.31.8.238 -> 54.239.132.249 TCP 66 55334 > http [ACK] Seq=1 Ack=1 Win=27008 Len=0 TSval=5128254 TSecr=1680614664
  8   0.004798 172.31.8.238 -> 54.239.132.249 HTTP 163 GET /10mb HTTP/1.1 
  9   0.005436 54.239.132.249 -> 172.31.8.238 TCP 66 http > 55334 [ACK] Seq=1 Ack=98 Win=14592 Len=0 TSval=1680614664 TSecr=5128254
 10   0.007521 54.239.132.249 -> 172.31.8.238 TCP 1132 [TCP segment of a reassembled PDU]
 11   0.007528 172.31.8.238 -> 54.239.132.249 TCP 66 55334 > http [ACK] Seq=98 Ack=1067 Win=29056 Len=0 TSval=5128255 TSecr=1680614664
 12   0.007699 54.239.132.249 -> 172.31.8.238 TCP 13098 [TCP segment of a reassembled PDU]
 13   0.007710 172.31.8.238 -> 54.239.132.249 TCP 66 55334 > http [ACK] Seq=98 Ack=14099 Win=55168 Len=0 TSval=5128255 TSecr=1680614664
 14   0.008289 54.239.132.249 -> 172.31.8.238 TCP 4410 [TCP segment of a reassembled PDU]
 15   0.008295 172.31.8.238 -> 54.239.132.249 TCP 66 55334 > http [ACK] Seq=98 Ack=18443 Win=63872 Len=0 TSval=5128255 TSecr=1680614664
 16   0.008382 54.239.132.249 -> 172.31.8.238 TCP 8754 [TCP segment of a reassembled PDU]
 17   0.008389 172.31.8.238 -> 54.239.132.249 TCP 66 55334 > http [ACK] Seq=98 Ack=27131 Win=81152 Len=0 TSval=5128255 TSecr=1680614664
 18   0.009069 54.239.132.249 -> 172.31.8.238 TCP 1514 [TCP segment of a reassembled PDU]
 19   0.009074 172.31.8.238 -> 54.239.132.249 TCP 66 55334 > http [ACK] Seq=98 Ack=28579 Win=84096 Len=0 TSval=5128255 TSecr=1680614664
 20   0.009192 54.239.132.249 -> 172.31.8.238 TCP 18890 [TCP segment of a reassembled PDU]
 21   0.009203 172.31.8.238 -> 54.239.132.249 TCP 66 55334 > http [ACK] Seq=98 Ack=47403 Win=86912 Len=0 TSval=5128255 TSecr=1680614664
 22   0.009877 54.239.132.249 -> 172.31.8.238 TCP 5858 [TCP segment of a reassembled PDU]
 23   0.009883 172.31.8.238 -> 54.239.132.249 TCP 66 55334 > http [ACK] Seq=98 Ack=53195 Win=108416 Len=0 TSval=5128255 TSecr=1680614664
 24   0.009973 54.239.132.249 -> 172.31.8.238 TCP 13098 [TCP segment of a reassembled PDU]
 25   0.009981 172.31.8.238 -> 54.239.132.249 TCP 66 55334 > http [ACK] Seq=98 Ack=66227 Win=96512 Len=0 TSval=5128255 TSecr=1680614664
 26   0.010657 54.239.132.249 -> 172.31.8.238 TCP 13098 [TCP segment of a reassembled PDU]
 27   0.010666 172.31.8.238 -> 54.239.132.249 TCP 66 55334 > http [ACK] Seq=98 Ack=79259 Win=96512 Len=0 TSval=5128256 TSecr=1680614664
 28   0.010721 54.239.132.249 -> 172.31.8.238 TCP 13098 [TCP segment of a reassembled PDU]
 29   0.010730 172.31.8.238 -> 54.239.132.249 TCP 66 55334 > http [ACK] Seq=98 Ack=92291 Win=135168 Len=0 TSval=5128256 TSecr=1680614664
 30   0.011402 54.239.132.249 -> 172.31.8.238 TCP 8754 [TCP segment of a reassembled PDU]
 31   0.011410 172.31.8.238 -> 54.239.132.249 TCP 66 55334 > http [ACK] Seq=98 Ack=100979 Win=152448 Len=0 TSval=5128256 TSecr=1680614665
 32   0.011509 54.239.132.249 -> 172.31.8.238 TCP 20338 [TCP segment of a reassembled PDU]
 33   0.011520 172.31.8.238 -> 54.239.132.249 TCP 66 55334 > http [ACK] Seq=98 Ack=121251 Win=193024 Len=0 TSval=5128256 TSecr=1680614665
 34   0.012174 54.239.132.249 -> 172.31.8.238 TCP 8754 [TCP segment of a reassembled PDU]
 35   0.012182 172.31.8.238 -> 54.239.132.249 TCP 66 55334 > http [ACK] Seq=98 Ack=129939 Win=210432 Len=0 TSval=5128256 TSecr=1680614665
 36   0.012278 54.239.132.249 -> 172.31.8.238 TCP 4410 [TCP segment of a reassembled PDU]
 37   0.012283 172.31.8.238 -> 54.239.132.249 TCP 66 55334 > http [ACK] Seq=98 Ack=134283 Win=219136 Len=0 TSval=5128256 TSecr=1680614665
 38   0.012332 54.239.132.249 -> 172.31.8.238 TCP 18890 [TCP segment of a reassembled PDU]
 39   0.012342 172.31.8.238 -> 54.239.132.249 TCP 66 55334 > http [ACK] Seq=98 Ack=153107 Win=256768 Len=0 TSval=5128256 TSecr=1680614665
 40   0.012943 54.239.132.249 -> 172.31.8.238 TCP 14546 [TCP segment of a reassembled PDU]
 41   0.012953 172.31.8.238 -> 54.239.132.249 TCP 66 55334 > http [ACK] Seq=98 Ack=167587 Win=285696 Len=0 TSval=5128256 TSecr=1680614665
 42   0.013052 54.239.132.249 -> 172.31.8.238 TCP 21786 [TCP segment of a reassembled PDU]
 43   0.013064 172.31.8.238 -> 54.239.132.249 TCP 66 55334 > http [ACK] Seq=98 Ack=189307 Win=329216 Len=0 TSval=5128256 TSecr=1680614665
 44   0.013712 54.239.132.249 -> 172.31.8.238 TCP 17442 [TCP segment of a reassembled PDU]
 45   0.013722 172.31.8.238 -> 54.239.132.249 TCP 66 55334 > http [ACK] Seq=98 Ack=206683 Win=363904 Len=0 TSval=5128256 TSecr=1680614665
 46   0.013754 54.239.132.249 -> 172.31.8.238 TCP 10202 [TCP segment of a reassembled PDU]
 47   0.013761 172.31.8.238 -> 54.239.132.249 TCP 66 55334 > http [ACK] Seq=98 Ack=216819 Win=384128 Len=0 TSval=5128256 TSecr=1680614665
 48   0.014474 54.239.132.249 -> 172.31.8.238 TCP 15994 [TCP segment of a reassembled PDU]
 49   0.014484 172.31.8.238 -> 54.239.132.249 TCP 66 55334 > http [ACK] Seq=98 Ack=232747 Win=416000 Len=0 TSval=5128257 TSecr=1680614665
 50   0.014570 54.239.132.249 -> 172.31.8.238 TCP 14546 [TCP segment of a reassembled PDU]
 51   0.014579 172.31.8.238 -> 54.239.132.249 TCP 66 55334 > http [ACK] Seq=98 Ack=247227 Win=445056 Len=0 TSval=5128257 TSecr=1680614665
 52   0.014938 54.239.132.249 -> 172.31.8.238 TCP 7306 [TCP segment of a reassembled PDU]
 53   0.014945 172.31.8.238 -> 54.239.132.249 TCP 66 55334 > http [ACK] Seq=98 Ack=254467 Win=459520 Len=0 TSval=5128257 TSecr=1680614665
 54   0.015074 54.239.132.249 -> 172.31.8.238 TCP 15994 [TCP segment of a reassembled PDU]
 55   0.015083 172.31.8.238 -> 54.239.132.249 TCP 66 55334 > http [ACK] Seq=98 Ack=270395 Win=491392 Len=0 TSval=5128257 TSecr=1680614665
 56   0.015368 54.239.132.249 -> 172.31.8.238 TCP 21786 [TCP segment of a reassembled PDU]
 57   0.015380 172.31.8.238 -> 54.239.132.249 TCP 66 55334 > http [ACK] Seq=98 Ack=292115 Win=534784 Len=0 TSval=5128257 TSecr=1680614665
 58   0.015704 54.239.132.249 -> 172.31.8.238 TCP 4410 [TCP segment of a reassembled PDU]
 59   0.015710 172.31.8.238 -> 54.239.132.249 TCP 66 55334 > http [ACK] Seq=98 Ack=296459 Win=543488 Len=0 TSval=5128257 TSecr=1680614665
 60   0.015873 54.239.132.249 -> 172.31.8.238 TCP 20338 [TCP segment of a reassembled PDU]
 61   0.015892 172.31.8.238 -> 54.239.132.249 TCP 66 55334 > http [ACK] Seq=98 Ack=316731 Win=584064 Len=0 TSval=5128257 TSecr=1680614665
 62   0.015898 54.239.132.249 -> 172.31.8.238 TCP 1514 [TCP segment of a reassembled PDU]
 63   0.015900 172.31.8.238 -> 54.239.132.249 TCP 66 55334 > http [ACK] Seq=98 Ack=318179 Win=586880 Len=0 TSval=5128257 TSecr=1680614665
 64   0.016093 54.239.132.249 -> 172.31.8.238 TCP 23234 [TCP segment of a reassembled PDU]
 65   0.016105 172.31.8.238 -> 54.239.132.249 TCP 66 55334 > http [ACK] Seq=98 Ack=341347 Win=633216 Len=0 TSval=5128257 TSecr=1680614665
 66   0.016503 54.239.132.249 -> 172.31.8.238 TCP 7306 [TCP segment of a reassembled PDU]
 67   0.016510 172.31.8.238 -> 54.239.132.249 TCP 66 55334 > http [ACK] Seq=98 Ack=348587 Win=647680 Len=0 TSval=5128257 TSecr=1680614665
 68   0.016657 54.239.132.249 -> 172.31.8.238 TCP 20338 [TCP segment of a reassembled PDU]
 69   0.016669 172.31.8.238 -> 54.239.132.249 TCP 66 55334 > http [ACK] Seq=98 Ack=368859 Win=688256 Len=0 TSval=5128257 TSecr=1680614665
 70   0.016750 54.239.132.249 -> 172.31.8.238 TCP 10202 [TCP segment of a reassembled PDU]
 71   0.016758 172.31.8.238 -> 54.239.132.249 TCP 66 55334 > http [ACK] Seq=98 Ack=378995 Win=708480 Len=0 TSval=5128257 TSecr=1680614665
 72   0.016884 54.239.132.249 -> 172.31.8.238 TCP 10202 [TCP segment of a reassembled PDU]
 73   0.016891 172.31.8.238 -> 54.239.132.249 TCP 66 55334 > http [ACK] Seq=98 Ack=389131 Win=728832 Len=0 TSval=5128257 TSecr=1680614665
 74   0.017235 54.239.132.249 -> 172.31.8.238 TCP 5858 [TCP segment of a reassembled PDU]
 75   0.017242 172.31.8.238 -> 54.239.132.249 TCP 66 55334 > http [ACK] Seq=98 Ack=394923 Win=740352 Len=0 TSval=5128257 TSecr=1680614665
 76   0.017410 54.239.132.249 -> 172.31.8.238 TCP 26130 [TCP segment of a reassembled PDU]
 77   0.017422 172.31.8.238 -> 54.239.132.249 TCP 66 55334 > http [ACK] Seq=98 Ack=420987 Win=792576 Len=0 TSval=5128257 TSecr=1680614665
 78   0.017430 54.239.132.249 -> 172.31.8.238 TCP 5858 [TCP segment of a reassembled PDU]
 79   0.017437 172.31.8.238 -> 54.239.132.249 TCP 66 55334 > http [ACK] Seq=98 Ack=426779 Win=804096 Len=0 TSval=5128257 TSecr=1680614665
 80   0.017647 54.239.132.249 -> 172.31.8.238 TCP 23234 [TCP segment of a reassembled PDU]
 81   0.017660 172.31.8.238 -> 54.239.132.249 TCP 66 55334 > http [ACK] Seq=98 Ack=449947 Win=850432 Len=0 TSval=5128257 TSecr=1680614665
 82   0.018030 54.239.132.249 -> 172.31.8.238 TCP 7306 [TCP segment of a reassembled PDU]
 83   0.018037 172.31.8.238 -> 54.239.132.249 TCP 66 55334 > http [ACK] Seq=98 Ack=457187 Win=864896 Len=0 TSval=5128257 TSecr=1680614665
 84   0.018205 54.239.132.249 -> 172.31.8.238 TCP 26130 [TCP segment of a reassembled PDU]
 85   0.018218 172.31.8.238 -> 54.239.132.249 TCP 66 55334 > http [ACK] Seq=98 Ack=483251 Win=858240 Len=0 TSval=5128258 TSecr=1680614665
 86   0.018233 54.239.132.249 -> 172.31.8.238 TCP 1514 [TCP segment of a reassembled PDU]
 87   0.018238 172.31.8.238 -> 54.239.132.249 TCP 66 55334 > http [ACK] Seq=98 Ack=484699 Win=856832 Len=0 TSval=5128258 TSecr=1680614665
 88   0.018300 54.239.132.249 -> 172.31.8.238 TCP 10202 [TCP segment of a reassembled PDU]
 89   0.018307 172.31.8.238 -> 54.239.132.249 TCP 66 55334 > http [ACK] Seq=98 Ack=494835 Win=885248 Len=0 TSval=5128258 TSecr=1680614665
 90   0.018446 54.239.132.249 -> 172.31.8.238 TCP 21786 [TCP segment of a reassembled PDU]
 91   0.018458 172.31.8.238 -> 54.239.132.249 TCP 66 55334 > http [ACK] Seq=98 Ack=516555 Win=928640 Len=0 TSval=5128258 TSecr=1680614665
 92   0.018832 54.239.132.249 -> 172.31.8.238 TCP 2962 [TCP segment of a reassembled PDU]
 93   0.018838 172.31.8.238 -> 54.239.132.249 TCP 66 55334 > http [ACK] Seq=98 Ack=519451 Win=934400 Len=0 TSval=5128258 TSecr=1680614665
 94   0.018959 54.239.132.249 -> 172.31.8.238 TCP 26130 [TCP segment of a reassembled PDU]
 95   0.018972 172.31.8.238 -> 54.239.132.249 TCP 66 55334 > http [ACK] Seq=98 Ack=545515 Win=986496 Len=0 TSval=5128258 TSecr=1680614665
 96   0.019122 54.239.132.249 -> 172.31.8.238 TCP 39162 [TCP segment of a reassembled PDU]
 97   0.019141 172.31.8.238 -> 54.239.132.249 TCP 66 55334 > http [ACK] Seq=98 Ack=584611 Win=1064704 Len=0 TSval=5128258 TSecr=1680614665
 98   0.019588 54.239.132.249 -> 172.31.8.238 TCP 1514 [TCP segment of a reassembled PDU]
 99   0.019593 172.31.8.238 -> 54.239.132.249 TCP 66 55334 > http [ACK] Seq=98 Ack=586059 Win=1067648 Len=0 TSval=5128258 TSecr=1680614665
100   0.019761 54.239.132.249 -> 172.31.8.238 TCP 21786 [TCP segment of a reassembled PDU]
101   0.019773 172.31.8.238 -> 54.239.132.249 TCP 66 55334 > http [ACK] Seq=98 Ack=607779 Win=1111040 Len=0 TSval=5128258 TSecr=1680614665
102   0.019892 54.239.132.249 -> 172.31.8.238 TCP 30474 [TCP segment of a reassembled PDU]
103   0.019906 172.31.8.238 -> 54.239.132.249 TCP 66 55334 > http [ACK] Seq=98 Ack=638187 Win=1171840 Len=0 TSval=5128258 TSecr=1680614665
104   0.019915 54.239.132.249 -> 172.31.8.238 TCP 11650 [TCP segment of a reassembled PDU]
105   0.019921 172.31.8.238 -> 54.239.132.249 TCP 66 55334 > http [ACK] Seq=98 Ack=649771 Win=1183360 Len=0 TSval=5128258 TSecr=1680614665
106   0.020381 54.239.132.249 -> 172.31.8.238 TCP 4410 [TCP segment of a reassembled PDU]
107   0.020387 172.31.8.238 -> 54.239.132.249 TCP 66 55334 > http [ACK] Seq=98 Ack=654115 Win=1203712 Len=0 TSval=5128258 TSecr=1680614665
108   0.020564 54.239.132.249 -> 172.31.8.238 TCP 26130 [TCP segment of a reassembled PDU]
109   0.020577 172.31.8.238 -> 54.239.132.249 TCP 66 55334 > http [ACK] Seq=98 Ack=680179 Win=1209600 Len=0 TSval=5128258 TSecr=1680614665
110   0.020597 54.239.132.249 -> 172.31.8.238 TCP 8754 [TCP segment of a reassembled PDU]
111   0.020602 172.31.8.238 -> 54.239.132.249 TCP 66 55334 > http [ACK] Seq=98 Ack=688867 Win=1201024 Len=0 TSval=5128258 TSecr=1680614665
112   0.020669 54.239.132.249 -> 172.31.8.238 TCP 14546 [TCP segment of a reassembled PDU]
113   0.020678 172.31.8.238 -> 54.239.132.249 TCP 66 55334 > http [ACK] Seq=98 Ack=703347 Win=1228544 Len=0 TSval=5128258 TSecr=1680614665
114   0.020774 54.239.132.249 -> 172.31.8.238 TCP 11650 [TCP segment of a reassembled PDU]
115   0.020782 172.31.8.238 -> 54.239.132.249 TCP 66 55334 > http [ACK] Seq=98 Ack=714931 Win=1233408 Len=0 TSval=5128258 TSecr=1680614665
116   0.021416 54.239.132.249 -> 172.31.8.238 TCP 1514 [TCP segment of a reassembled PDU]
117   0.021421 172.31.8.238 -> 54.239.132.249 TCP 66 55334 > http [ACK] Seq=98 Ack=716379 Win=1249664 Len=0 TSval=5128258 TSecr=1680614666
118   0.021591 54.239.132.249 -> 172.31.8.238 TCP 26130 [TCP segment of a reassembled PDU]
119   0.021604 172.31.8.238 -> 54.239.132.249 TCP 66 55334 > http [ACK] Seq=98 Ack=742443 Win=1223680 Len=0 TSval=5128258 TSecr=1680614666
120   0.021659 54.239.132.249 -> 172.31.8.238 TCP 23234 [TCP segment of a reassembled PDU]
121   0.021670 172.31.8.238 -> 54.239.132.249 TCP 66 55334 > http [ACK] Seq=98 Ack=765611 Win=1214336 Len=0 TSval=5128258 TSecr=1680614666
122   0.021729 54.239.132.249 -> 172.31.8.238 TCP 14546 [TCP segment of a reassembled PDU]
123   0.021823 172.31.8.238 -> 54.239.132.249 TCP 66 55334 > http [ACK] Seq=98 Ack=780091 Win=1199872 Len=0 TSval=5128258 TSecr=1680614666
124   0.022400 54.239.132.249 -> 172.31.8.238 TCP 2962 [TCP segment of a reassembled PDU]
125   0.022406 172.31.8.238 -> 54.239.132.249 TCP 66 55334 > http [ACK] Seq=98 Ack=782987 Win=1247616 Len=0 TSval=5128259 TSecr=1680614666
126   0.022581 54.239.132.249 -> 172.31.8.238 TCP 26130 [TCP segment of a reassembled PDU]
127   0.022605 172.31.8.238 -> 54.239.132.249 TCP 66 55334 > http [ACK] Seq=98 Ack=809051 Win=1221632 Len=0 TSval=5128259 TSecr=1680614666
128   0.022643 54.239.132.249 -> 172.31.8.238 TCP 18890 [TCP segment of a reassembled PDU]
129   0.022665 172.31.8.238 -> 54.239.132.249 TCP 66 55334 > http [ACK] Seq=98 Ack=827875 Win=1221504 Len=0 TSval=5128259 TSecr=1680614666
130   0.022717 54.239.132.249 -> 172.31.8.238 TCP 17442 [TCP segment of a reassembled PDU]
131   0.022727 172.31.8.238 -> 54.239.132.249 TCP 66 55334 > http [ACK] Seq=98 Ack=845251 Win=1223808 Len=0 TSval=5128259 TSecr=1680614666
132   0.022971 54.239.132.249 -> 172.31.8.238 TCP 23234 [TCP segment of a reassembled PDU]
133   0.022996 172.31.8.238 -> 54.239.132.249 TCP 66 55334 > http [ACK] Seq=98 Ack=868419 Win=1214336 Len=0 TSval=5128259 TSecr=1680614666
134   0.023088 54.239.132.249 -> 172.31.8.238 TCP 13098 [TCP segment of a reassembled PDU]
135   0.023096 172.31.8.238 -> 54.239.132.249 TCP 66 55334 > http [ACK] Seq=98 Ack=881451 Win=1231104 Len=0 TSval=5128259 TSecr=1680614666
136   0.023512 54.239.132.249 -> 172.31.8.238 TCP 4410 [TCP segment of a reassembled PDU]
137   0.023518 172.31.8.238 -> 54.239.132.249 TCP 66 55334 > http [ACK] Seq=98 Ack=885795 Win=1245312 Len=0 TSval=5128259 TSecr=1680614666
138   0.023679 54.239.132.249 -> 172.31.8.238 TCP 24682 [TCP segment of a reassembled PDU]
139   0.023704 172.31.8.238 -> 54.239.132.249 TCP 66 55334 > http [ACK] Seq=98 Ack=910411 Win=1220736 Len=0 TSval=5128259 TSecr=1680614666
140   0.023758 54.239.132.249 -> 172.31.8.238 TCP 26130 [TCP segment of a reassembled PDU]
141   0.023782 172.31.8.238 -> 54.239.132.249 TCP 66 55334 > http [ACK] Seq=98 Ack=936475 Win=1209600 Len=0 TSval=5128259 TSecr=1680614666
142   0.023854 54.239.132.249 -> 172.31.8.238 TCP 26130 [TCP segment of a reassembled PDU]
143   0.023868 172.31.8.238 -> 54.239.132.249 TCP 66 55334 > http [ACK] Seq=98 Ack=962539 Win=1209600 Len=0 TSval=5128259 TSecr=1680614666
144   0.023909 54.239.132.249 -> 172.31.8.238 TCP 13098 [TCP segment of a reassembled PDU]
145   0.023917 172.31.8.238 -> 54.239.132.249 TCP 66 55334 > http [ACK] Seq=98 Ack=975571 Win=1231104 Len=0 TSval=5128259 TSecr=1680614666
146   0.024454 54.239.132.249 -> 172.31.8.238 TCP 4410 [TCP segment of a reassembled PDU]
147   0.024461 172.31.8.238 -> 54.239.132.249 TCP 66 55334 > http [ACK] Seq=98 Ack=979915 Win=1245312 Len=0 TSval=5128259 TSecr=1680614666
148   0.024617 54.239.132.249 -> 172.31.8.238 TCP 18890 [TCP segment of a reassembled PDU]
149   0.024639 172.31.8.238 -> 54.239.132.249 TCP 66 55334 > http [ACK] Seq=98 Ack=998739 Win=1226496 Len=0 TSval=5128259 TSecr=1680614666
150   0.024802 54.239.132.249 -> 172.31.8.238 TCP 59434 [TCP segment of a reassembled PDU]
151   0.024828 54.239.132.249 -> 172.31.8.238 TCP 2962 [TCP segment of a reassembled PDU]
152   0.024843 172.31.8.238 -> 54.239.132.249 TCP 66 55334 > http [ACK] Seq=98 Ack=1061003 Win=1164288 Len=0 TSval=5128259 TSecr=1680614666
153   0.024879 54.239.132.249 -> 172.31.8.238 TCP 23234 [TCP segment of a reassembled PDU]
154   0.024893 172.31.8.238 -> 54.239.132.249 TCP 66 55334 > http [ACK] Seq=98 Ack=1084171 Win=1214336 Len=0 TSval=5128259 TSecr=1680614666
155   0.024923 54.239.132.249 -> 172.31.8.238 TCP 4410 [TCP segment of a reassembled PDU]
156   0.024928 172.31.8.238 -> 54.239.132.249 TCP 66 55334 > http [ACK] Seq=98 Ack=1088515 Win=1245312 Len=0 TSval=5128259 TSecr=1680614666
157   0.025291 54.239.132.249 -> 172.31.8.238 TCP 17442 [TCP segment of a reassembled PDU]
158   0.025312 172.31.8.238 -> 54.239.132.249 TCP 66 55334 > http [ACK] Seq=98 Ack=1105891 Win=1228032 Len=0 TSval=5128259 TSecr=1680614666
159   0.025594 54.239.132.249 -> 172.31.8.238 TCP 26130 [TCP segment of a reassembled PDU]
160   0.025621 172.31.8.238 -> 54.239.132.249 TCP 66 55334 > http [ACK] Seq=98 Ack=1131955 Win=1209600 Len=0 TSval=5128259 TSecr=1680614666
161   0.025685 54.239.132.249 -> 172.31.8.238 TCP 26130 [TCP segment of a reassembled PDU]
162   0.025698 172.31.8.238 -> 54.239.132.249 TCP 66 55334 > http [ACK] Seq=98 Ack=1158019 Win=1209600 Len=0 TSval=5128259 TSecr=1680614666
163   0.025741 54.239.132.249 -> 172.31.8.238 TCP 13098 [TCP segment of a reassembled PDU]
164   0.025750 172.31.8.238 -> 54.239.132.249 TCP 66 55334 > http [ACK] Seq=98 Ack=1171051 Win=1231104 Len=0 TSval=5128259 TSecr=1680614666
165   0.026107 54.239.132.249 -> 172.31.8.238 TCP 26130 [TCP segment of a reassembled PDU]
166   0.026131 172.31.8.238 -> 54.239.132.249 TCP 66 55334 > http [ACK] Seq=98 Ack=1197115 Win=1209600 Len=0 TSval=5128259 TSecr=1680614666
167   0.026176 54.239.132.249 -> 172.31.8.238 TCP 23234 [TCP segment of a reassembled PDU]
168   0.026188 172.31.8.238 -> 54.239.132.249 TCP 66 55334 > http [ACK] Seq=98 Ack=1220283 Win=1214336 Len=0 TSval=5128259 TSecr=1680614666
169   0.026243 54.239.132.249 -> 172.31.8.238 TCP 15994 [TCP segment of a reassembled PDU]
170   0.026250 172.31.8.238 -> 54.239.132.249 TCP 66 55334 > http [ACK] Seq=98 Ack=1236211 Win=1281536 Len=0 TSval=5128260 TSecr=1680614666
171   0.026597 54.239.132.249 -> 172.31.8.238 TCP 13098 [TCP segment of a reassembled PDU]
172   0.026606 172.31.8.238 -> 54.239.132.249 TCP 66 55334 > http [ACK] Seq=98 Ack=1249243 Win=1307648 Len=0 TSval=5128260 TSecr=1680614666
173   0.026752 54.239.132.249 -> 172.31.8.238 TCP 26130 [TCP segment of a reassembled PDU]
174   0.026766 172.31.8.238 -> 54.239.132.249 TCP 66 55334 > http [ACK] Seq=98 Ack=1275307 Win=1359744 Len=0 TSval=5128260 TSecr=1680614666
175   0.026820 54.239.132.249 -> 172.31.8.238 TCP 26130 [TCP segment of a reassembled PDU]
176   0.026834 172.31.8.238 -> 54.239.132.249 TCP 66 55334 > http [ACK] Seq=98 Ack=1301371 Win=1411840 Len=0 TSval=5128260 TSecr=1680614666
177   0.027131 54.239.132.249 -> 172.31.8.238 TCP 1514 [TCP segment of a reassembled PDU]
178   0.027136 172.31.8.238 -> 54.239.132.249 TCP 66 55334 > http [ACK] Seq=98 Ack=1302819 Win=1414784 Len=0 TSval=5128260 TSecr=1680614666
179   0.027313 54.239.132.249 -> 172.31.8.238 TCP 26130 [TCP segment of a reassembled PDU]
180   0.027326 172.31.8.238 -> 54.239.132.249 TCP 66 55334 > http [ACK] Seq=98 Ack=1328883 Win=1466880 Len=0 TSval=5128260 TSecr=1680614666
181   0.027368 54.239.132.249 -> 172.31.8.238 TCP 20338 [TCP segment of a reassembled PDU]
182   0.027378 172.31.8.238 -> 54.239.132.249 TCP 66 55334 > http [ACK] Seq=98 Ack=1349155 Win=1480448 Len=0 TSval=5128260 TSecr=1680614666
183   0.027437 54.239.132.249 -> 172.31.8.238 TCP 17442 [TCP segment of a reassembled PDU]
184   0.027520 172.31.8.238 -> 54.239.132.249 TCP 66 55334 > http [ACK] Seq=98 Ack=1366531 Win=1463168 Len=0 TSval=5128260 TSecr=1680614666
185   0.027611 54.239.132.249 -> 172.31.8.238 TCP 15994 [TCP segment of a reassembled PDU]
186   0.027622 172.31.8.238 -> 54.239.132.249 TCP 66 55334 > http [ACK] Seq=98 Ack=1382459 Win=1487488 Len=0 TSval=5128260 TSecr=1680614666
187   0.027729 54.239.132.249 -> 172.31.8.238 TCP 26130 [TCP segment of a reassembled PDU]
188   0.027753 172.31.8.238 -> 54.239.132.249 TCP 66 55334 > http [ACK] Seq=98 Ack=1408523 Win=1470976 Len=0 TSval=5128260 TSecr=1680614666
189   0.027783 54.239.132.249 -> 172.31.8.238 TCP 23234 [TCP segment of a reassembled PDU]
190   0.027794 172.31.8.238 -> 54.239.132.249 TCP 66 55334 > http [ACK] Seq=98 Ack=1431691 Win=1475712 Len=0 TSval=5128260 TSecr=1680614666
191   0.028077 54.239.132.249 -> 172.31.8.238 TCP 1514 [TCP segment of a reassembled PDU]
192   0.028237 54.239.132.249 -> 172.31.8.238 TCP 26130 [TCP segment of a reassembled PDU]
193   0.028264 172.31.8.238 -> 54.239.132.249 TCP 66 55334 > http [ACK] Seq=98 Ack=1459203 Win=1470976 Len=0 TSval=5128260 TSecr=1680614666
194   0.028306 54.239.132.249 -> 172.31.8.238 TCP 26130 [TCP segment of a reassembled PDU]
195   0.028318 172.31.8.238 -> 54.239.132.249 TCP 66 55334 > http [ACK] Seq=98 Ack=1485267 Win=1470976 Len=0 TSval=5128260 TSecr=1680614666
196   0.028363 54.239.132.249 -> 172.31.8.238 TCP 11650 [TCP segment of a reassembled PDU]
197   0.028371 172.31.8.238 -> 54.239.132.249 TCP 66 55334 > http [ACK] Seq=98 Ack=1496851 Win=1494784 Len=0 TSval=5128260 TSecr=1680614666
198   0.028624 54.239.132.249 -> 172.31.8.238 TCP 24682 [TCP segment of a reassembled PDU]
199   0.028649 172.31.8.238 -> 54.239.132.249 TCP 66 55334 > http [ACK] Seq=98 Ack=1521467 Win=1473280 Len=0 TSval=5128260 TSecr=1680614666
200   0.028772 54.239.132.249 -> 172.31.8.238 TCP 26130 [TCP segment of a reassembled PDU]
201   0.028796 172.31.8.238 -> 54.239.132.249 TCP 66 55334 > http [ACK] Seq=98 Ack=1547531 Win=1470976 Len=0 TSval=5128260 TSecr=1680614666
202   0.028819 54.239.132.249 -> 172.31.8.238 TCP 14546 [TCP segment of a reassembled PDU]
203   0.028827 172.31.8.238 -> 54.239.132.249 TCP 66 55334 > http [ACK] Seq=98 Ack=1562011 Win=1489920 Len=0 TSval=5128260 TSecr=1680614666
204   0.029188 54.239.132.249 -> 172.31.8.238 TCP 15994 [TCP segment of a reassembled PDU]
205   0.029211 172.31.8.238 -> 54.239.132.249 TCP 66 55334 > http [ACK] Seq=98 Ack=1577939 Win=1506432 Len=0 TSval=5128260 TSecr=1680614666
206   0.029314 54.239.132.249 -> 172.31.8.238 TCP 23234 [TCP segment of a reassembled PDU]
207   0.029338 172.31.8.238 -> 54.239.132.249 TCP 66 55334 > http [ACK] Seq=98 Ack=1601107 Win=1483264 Len=0 TSval=5128260 TSecr=1680614666
208   0.029437 54.239.132.249 -> 172.31.8.238 TCP 26130 [TCP segment of a reassembled PDU]
209   0.029465 172.31.8.238 -> 54.239.132.249 TCP 66 55334 > http [ACK] Seq=98 Ack=1627171 Win=1470976 Len=0 TSval=5128260 TSecr=1680614666
210   0.029759 54.239.132.249 -> 172.31.8.238 TCP 2962 [TCP segment of a reassembled PDU]
211   0.029764 172.31.8.238 -> 54.239.132.249 TCP 66 55334 > http [ACK] Seq=98 Ack=1630067 Win=1506432 Len=0 TSval=5128260 TSecr=1680614666
212   0.029926 54.239.132.249 -> 172.31.8.238 TCP 26130 [TCP segment of a reassembled PDU]
213   0.029949 172.31.8.238 -> 54.239.132.249 TCP 66 55334 > http [ACK] Seq=98 Ack=1656131 Win=1480448 Len=0 TSval=5128260 TSecr=1680614666
214   0.029979 54.239.132.249 -> 172.31.8.238 TCP 18890 [TCP segment of a reassembled PDU]
215   0.029989 172.31.8.238 -> 54.239.132.249 TCP 66 55334 > http [ACK] Seq=98 Ack=1674955 Win=1482752 Len=0 TSval=5128260 TSecr=1680614666
216   0.030042 54.239.132.249 -> 172.31.8.238 TCP 15994 [TCP segment of a reassembled PDU]
217   0.030052 172.31.8.238 -> 54.239.132.249 TCP 66 55334 > http [ACK] Seq=98 Ack=1690883 Win=1487488 Len=0 TSval=5128260 TSecr=1680614666
218   0.030131 54.239.132.249 -> 172.31.8.238 TCP 1514 [TCP segment of a reassembled PDU]
219   0.030493 54.239.132.249 -> 172.31.8.238 TCP 2962 [TCP segment of a reassembled PDU]
220   0.030499 172.31.8.238 -> 54.239.132.249 TCP 66 55334 > http [ACK] Seq=98 Ack=1695227 Win=1506432 Len=0 TSval=5128261 TSecr=1680614666
221   0.030658 54.239.132.249 -> 172.31.8.238 TCP 21786 [TCP segment of a reassembled PDU]
222   0.030681 172.31.8.238 -> 54.239.132.249 TCP 66 55334 > http [ACK] Seq=98 Ack=1716947 Win=1484800 Len=0 TSval=5128261 TSecr=1680614666
223   0.030738 54.239.132.249 -> 172.31.8.238 TCP 26130 [TCP segment of a reassembled PDU]
224   0.030762 172.31.8.238 -> 54.239.132.249 TCP 66 55334 > http [ACK] Seq=98 Ack=1743011 Win=1470976 Len=0 TSval=5128261 TSecr=1680614666
225   0.030798 54.239.132.249 -> 172.31.8.238 TCP 14546 [TCP segment of a reassembled PDU]
226   0.030808 172.31.8.238 -> 54.239.132.249 TCP 66 55334 > http [ACK] Seq=98 Ack=1757491 Win=1489920 Len=0 TSval=5128261 TSecr=1680614666
227   0.030973 54.239.132.249 -> 172.31.8.238 TCP 21786 [TCP segment of a reassembled PDU]
228   0.030993 54.239.132.249 -> 172.31.8.238 TCP 1514 [TCP segment of a reassembled PDU]
229   0.031003 172.31.8.238 -> 54.239.132.249 TCP 66 55334 > http [ACK] Seq=98 Ack=1780659 Win=1475584 Len=0 TSval=5128261 TSecr=1680614666
230   0.031128 54.239.132.249 -> 172.31.8.238 TCP 26130 [TCP segment of a reassembled PDU]
231   0.031148 54.239.132.249 -> 172.31.8.238 TCP 15994 [TCP segment of a reassembled PDU]
232   0.031167 172.31.8.238 -> 54.239.132.249 TCP 66 55334 > http [ACK] Seq=98 Ack=1822651 Win=1444608 Len=0 TSval=5128261 TSecr=1680614666
233   0.031590 54.239.132.249 -> 172.31.8.238 TCP 1514 [TCP segment of a reassembled PDU]
234   0.031732 54.239.132.249 -> 172.31.8.238 TCP 17442 [TCP segment of a reassembled PDU]
235   0.031742 172.31.8.238 -> 54.239.132.249 TCP 66 55334 > http [ACK] Seq=98 Ack=1841475 Win=1485184 Len=0 TSval=5128261 TSecr=1680614667
236   0.031748 54.239.132.249 -> 172.31.8.238 TCP 2962 [TCP segment of a reassembled PDU]
237   0.031766 172.31.8.238 -> 54.239.132.249 TCP 66 55334 > http [ACK] Seq=98 Ack=1844371 Win=1482368 Len=0 TSval=5128261 TSecr=1680614667
238   0.031899 54.239.132.249 -> 172.31.8.238 TCP 26130 [TCP segment of a reassembled PDU]
239   0.031924 54.239.132.249 -> 172.31.8.238 TCP 26130 [TCP segment of a reassembled PDU]
240   0.031946 172.31.8.238 -> 54.239.132.249 TCP 66 55334 > http [ACK] Seq=98 Ack=1896499 Win=1430272 Len=0 TSval=5128261 TSecr=1680614667
241   0.031999 54.239.132.249 -> 172.31.8.238 TCP 26130 [TCP segment of a reassembled PDU]
242   0.032007 172.31.8.238 -> 54.239.132.249 TCP 66 55334 > http [ACK] Seq=98 Ack=1922563 Win=1470976 Len=0 TSval=5128261 TSecr=1680614667
243   0.032080 54.239.132.249 -> 172.31.8.238 TCP 26130 [TCP segment of a reassembled PDU]
244   0.032087 172.31.8.238 -> 54.239.132.249 TCP 66 55334 > http [ACK] Seq=98 Ack=1948627 Win=1470976 Len=0 TSval=5128261 TSecr=1680614667
245   0.032124 54.239.132.249 -> 172.31.8.238 TCP 4410 [TCP segment of a reassembled PDU]
246   0.032226 172.31.8.238 -> 54.239.132.249 TCP 66 55334 > http [ACK] Seq=98 Ack=1952971 Win=1466752 Len=0 TSval=5128261 TSecr=1680614667
247   0.032484 54.239.132.249 -> 172.31.8.238 TCP 11650 [TCP segment of a reassembled PDU]
248   0.032490 172.31.8.238 -> 54.239.132.249 TCP 66 55334 > http [ACK] Seq=98 Ack=1964555 Win=1494784 Len=0 TSval=5128261 TSecr=1680614667
249   0.032629 54.239.132.249 -> 172.31.8.238 TCP 26130 [TCP segment of a reassembled PDU]
250   0.032647 172.31.8.238 -> 54.239.132.249 TCP 66 55334 > http [ACK] Seq=98 Ack=1990619 Win=1470976 Len=0 TSval=5128261 TSecr=1680614667
251   0.032699 54.239.132.249 -> 172.31.8.238 TCP 20338 [TCP segment of a reassembled PDU]
252   0.032718 172.31.8.238 -> 54.239.132.249 TCP 66 55334 > http [ACK] Seq=98 Ack=2010891 Win=1480448 Len=0 TSval=5128261 TSecr=1680614667
253   0.032860 54.239.132.249 -> 172.31.8.238 TCP 31922 [TCP segment of a reassembled PDU]
254   0.032879 54.239.132.249 -> 172.31.8.238 TCP 26130 [TCP segment of a reassembled PDU]
255   0.032909 172.31.8.238 -> 54.239.132.249 TCP 66 55334 > http [ACK] Seq=98 Ack=2068811 Win=1422592 Len=0 TSval=5128261 TSecr=1680614667
256   0.032933 54.239.132.249 -> 172.31.8.238 TCP 14546 [TCP segment of a reassembled PDU]
257   0.032941 172.31.8.238 -> 54.239.132.249 TCP 66 55334 > http [ACK] Seq=98 Ack=2083291 Win=1447040 Len=0 TSval=5128261 TSecr=1680614667
258   0.033289 54.239.132.249 -> 172.31.8.238 TCP 14546 [TCP segment of a reassembled PDU]
259   0.033295 172.31.8.238 -> 54.239.132.249 TCP 66 55334 > http [ACK] Seq=98 Ack=2097771 Win=1489920 Len=0 TSval=5128261 TSecr=1680614667
260   0.033433 54.239.132.249 -> 172.31.8.238 TCP 26130 [TCP segment of a reassembled PDU]
261   0.033451 172.31.8.238 -> 54.239.132.249 TCP 66 55334 > http [ACK] Seq=98 Ack=2123835 Win=1470976 Len=0 TSval=5128261 TSecr=1680614667
262   0.033493 54.239.132.249 -> 172.31.8.238 TCP 24682 [TCP segment of a reassembled PDU]
263   0.033500 172.31.8.238 -> 54.239.132.249 TCP 66 55334 > http [ACK] Seq=98 Ack=2148451 Win=1473280 Len=0 TSval=5128261 TSecr=1680614667
264   0.033771 54.239.132.249 -> 172.31.8.238 TCP 8754 [TCP segment of a reassembled PDU]
265   0.033777 172.31.8.238 -> 54.239.132.249 TCP 66 55334 > http [ACK] Seq=98 Ack=2157139 Win=1499520 Len=0 TSval=5128261 TSecr=1680614667
266   0.033926 54.239.132.249 -> 172.31.8.238 TCP 26130 [TCP segment of a reassembled PDU]
267   0.033945 172.31.8.238 -> 54.239.132.249 TCP 66 55334 > http [ACK] Seq=98 Ack=2183203 Win=1473536 Len=0 TSval=5128261 TSecr=1680614667
268   0.033996 54.239.132.249 -> 172.31.8.238 TCP 26130 [TCP segment of a reassembled PDU]
269   0.034028 172.31.8.238 -> 54.239.132.249 TCP 66 55334 > http [ACK] Seq=98 Ack=2209267 Win=1470976 Len=0 TSval=5128261 TSecr=1680614667
270   0.034111 54.239.132.249 -> 172.31.8.238 TCP 26130 [TCP segment of a reassembled PDU]
271   0.034118 172.31.8.238 -> 54.239.132.249 TCP 66 55334 > http [ACK] Seq=98 Ack=2235331 Win=1470976 Len=0 TSval=5128261 TSecr=1680614667
272   0.034196 54.239.132.249 -> 172.31.8.238 TCP 26130 [TCP segment of a reassembled PDU]
273   0.034204 172.31.8.238 -> 54.239.132.249 TCP 66 55334 > http [ACK] Seq=98 Ack=2261395 Win=1470976 Len=0 TSval=5128262 TSecr=1680614667
274   0.034256 54.239.132.249 -> 172.31.8.238 TCP 17442 [TCP segment of a reassembled PDU]
275   0.034262 172.31.8.238 -> 54.239.132.249 TCP 66 55334 > http [ACK] Seq=98 Ack=2278771 Win=1485184 Len=0 TSval=5128262 TSecr=1680614667
276   0.034458 54.239.132.249 -> 172.31.8.238 TCP 18890 [TCP segment of a reassembled PDU]
277   0.034475 172.31.8.238 -> 54.239.132.249 TCP 66 55334 > http [ACK] Seq=98 Ack=2297595 Win=1482752 Len=0 TSval=5128262 TSecr=1680614667
278   0.034598 54.239.132.249 -> 172.31.8.238 TCP 33370 [TCP segment of a reassembled PDU]
279   0.034613 54.239.132.249 -> 172.31.8.238 TCP 13098 [TCP segment of a reassembled PDU]
280   0.034633 172.31.8.238 -> 54.239.132.249 TCP 66 55334 > http [ACK] Seq=98 Ack=2343931 Win=1437568 Len=0 TSval=5128262 TSecr=1680614667
281   0.034951 54.239.132.249 -> 172.31.8.238 TCP 26130 [TCP segment of a reassembled PDU]
282   0.034958 172.31.8.238 -> 54.239.132.249 TCP 66 55334 > http [ACK] Seq=98 Ack=2369995 Win=1470976 Len=0 TSval=5128262 TSecr=1680614667
283   0.035028 54.239.132.249 -> 172.31.8.238 TCP 26130 [TCP segment of a reassembled PDU]
284   0.035035 172.31.8.238 -> 54.239.132.249 TCP 66 55334 > http [ACK] Seq=98 Ack=2396059 Win=1470976 Len=0 TSval=5128262 TSecr=1680614667
285   0.035095 54.239.132.249 -> 172.31.8.238 TCP 13098 [TCP segment of a reassembled PDU]
286   0.035178 54.239.132.249 -> 172.31.8.238 TCP 26130 [TCP segment of a reassembled PDU]
287   0.035193 172.31.8.238 -> 54.239.132.249 TCP 66 55334 > http [ACK] Seq=98 Ack=2435155 Win=1431936 Len=0 TSval=5128262 TSecr=1680614667
288   0.035243 54.239.132.249 -> 172.31.8.238 TCP 23234 [TCP segment of a reassembled PDU]
289   0.035250 172.31.8.238 -> 54.239.132.249 TCP 66 55334 > http [ACK] Seq=98 Ack=2458323 Win=1475712 Len=0 TSval=5128262 TSecr=1680614667
290   0.035334 54.239.132.249 -> 172.31.8.238 TCP 15994 [TCP segment of a reassembled PDU]
291   0.035340 172.31.8.238 -> 54.239.132.249 TCP 66 55334 > http [ACK] Seq=98 Ack=2474251 Win=1487488 Len=0 TSval=5128262 TSecr=1680614667
292   0.035512 54.239.132.249 -> 172.31.8.238 TCP 26130 [TCP segment of a reassembled PDU]
293   0.035554 172.31.8.238 -> 54.239.132.249 TCP 66 55334 > http [ACK] Seq=98 Ack=2500315 Win=1470976 Len=0 TSval=5128262 TSecr=1680614667
294   0.035585 54.239.132.249 -> 172.31.8.238 TCP 20338 [TCP segment of a reassembled PDU]
295   0.035596 172.31.8.238 -> 54.239.132.249 TCP 66 55334 > http [ACK] Seq=98 Ack=2520587 Win=1480448 Len=0 TSval=5128262 TSecr=1680614667
296   0.035670 54.239.132.249 -> 172.31.8.238 TCP 18890 [TCP segment of a reassembled PDU]
297   0.035676 172.31.8.238 -> 54.239.132.249 TCP 66 55334 > http [ACK] Seq=98 Ack=2539411 Win=1482752 Len=0 TSval=5128262 TSecr=1680614667
298   0.035925 54.239.132.249 -> 172.31.8.238 TCP 13098 [TCP segment of a reassembled PDU]
299   0.035931 172.31.8.238 -> 54.239.132.249 TCP 66 55334 > http [ACK] Seq=98 Ack=2552443 Win=1492352 Len=0 TSval=5128262 TSecr=1680614667
300   0.036076 54.239.132.249 -> 172.31.8.238 TCP 26130 [TCP segment of a reassembled PDU]
301   0.036096 172.31.8.238 -> 54.239.132.249 TCP 66 55334 > http [ACK] Seq=98 Ack=2578507 Win=1470976 Len=0 TSval=5128262 TSecr=1680614667
302   0.036146 54.239.132.249 -> 172.31.8.238 TCP 26130 [TCP segment of a reassembled PDU]
303   0.036153 172.31.8.238 -> 54.239.132.249 TCP 66 55334 > http [ACK] Seq=98 Ack=2604571 Win=1470976 Len=0 TSval=5128262 TSecr=1680614667
304   0.036249 54.239.132.249 -> 172.31.8.238 TCP 26130 [TCP segment of a reassembled PDU]
305   0.036255 172.31.8.238 -> 54.239.132.249 TCP 66 55334 > http [ACK] Seq=98 Ack=2630635 Win=1470976 Len=0 TSval=5128262 TSecr=1680614667
306   0.036330 54.239.132.249 -> 172.31.8.238 TCP 26130 [TCP segment of a reassembled PDU]
307   0.036389 54.239.132.249 -> 172.31.8.238 TCP 13098 [TCP segment of a reassembled PDU]
308   0.036409 172.31.8.238 -> 54.239.132.249 TCP 66 55334 > http [ACK] Seq=98 Ack=2669731 Win=1431936 Len=0 TSval=5128262 TSecr=1680614667
309   0.036443 54.239.132.249 -> 172.31.8.238 TCP 23234 [TCP segment of a reassembled PDU]
310   0.036458 172.31.8.238 -> 54.239.132.249 TCP 66 55334 > http [ACK] Seq=98 Ack=2692899 Win=1411328 Len=0 TSval=5128262 TSecr=1680614667
311   0.036603 54.239.132.249 -> 172.31.8.238 TCP 42058 [TCP segment of a reassembled PDU]
312   0.036612 172.31.8.238 -> 54.239.132.249 TCP 66 55334 > http [ACK] Seq=98 Ack=2734891 Win=1444608 Len=0 TSval=5128262 TSecr=1680614667
313   0.036877 54.239.132.249 -> 172.31.8.238 TCP 5858 [TCP segment of a reassembled PDU]
314   0.036883 172.31.8.238 -> 54.239.132.249 TCP 66 55334 > http [ACK] Seq=98 Ack=2740683 Win=1504256 Len=0 TSval=5128262 TSecr=1680614667
315   0.037061 54.239.132.249 -> 172.31.8.238 TCP 26130 [TCP segment of a reassembled PDU]
316   0.037081 172.31.8.238 -> 54.239.132.249 TCP 66 55334 > http [ACK] Seq=98 Ack=2766747 Win=1478272 Len=0 TSval=5128262 TSecr=1680614667
317   0.037136 54.239.132.249 -> 172.31.8.238 TCP 26130 [TCP segment of a reassembled PDU]
318   0.037155 172.31.8.238 -> 54.239.132.249 TCP 66 55334 > http [ACK] Seq=98 Ack=2792811 Win=1470976 Len=0 TSval=5128262 TSecr=1680614667
319   0.037222 54.239.132.249 -> 172.31.8.238 TCP 26130 [TCP segment of a reassembled PDU]
320   0.037231 172.31.8.238 -> 54.239.132.249 TCP 66 55334 > http [ACK] Seq=98 Ack=2818875 Win=1470976 Len=0 TSval=5128262 TSecr=1680614667
321   0.037309 54.239.132.249 -> 172.31.8.238 TCP 26130 [TCP segment of a reassembled PDU]
322   0.037316 172.31.8.238 -> 54.239.132.249 TCP 66 55334 > http [ACK] Seq=98 Ack=2844939 Win=1470976 Len=0 TSval=5128262 TSecr=1680614667
323   0.037380 54.239.132.249 -> 172.31.8.238 TCP 10202 [TCP segment of a reassembled PDU]
324   0.037385 172.31.8.238 -> 54.239.132.249 TCP 66 55334 > http [ACK] Seq=98 Ack=2855075 Win=1497088 Len=0 TSval=5128262 TSecr=1680614667
325   0.037490 54.239.132.249 -> 172.31.8.238 TCP 42058 [TCP segment of a reassembled PDU]
326   0.037544 172.31.8.238 -> 54.239.132.249 TCP 66 55334 > http [ACK] Seq=98 Ack=2897067 Win=1455104 Len=0 TSval=5128262 TSecr=1680614667
327   0.037583 54.239.132.249 -> 172.31.8.238 TCP 33370 [TCP segment of a reassembled PDU]
328   0.037595 172.31.8.238 -> 54.239.132.249 TCP 66 55334 > http [ACK] Seq=98 Ack=2930371 Win=1421824 Len=0 TSval=5128262 TSecr=1680614667
329   0.037636 54.239.132.249 -> 172.31.8.238 TCP 10202 [TCP segment of a reassembled PDU]
330   0.037641 172.31.8.238 -> 54.239.132.249 TCP 66 55334 > http [ACK] Seq=98 Ack=2940507 Win=1497088 Len=0 TSval=5128262 TSecr=1680614667
331   0.037771 54.239.132.249 -> 172.31.8.238 TCP 18890 [TCP segment of a reassembled PDU]
332   0.037789 172.31.8.238 -> 54.239.132.249 TCP 66 55334 > http [ACK] Seq=98 Ack=2959331 Win=1482752 Len=0 TSval=5128262 TSecr=1680614667
333   0.037934 54.239.132.249 -> 172.31.8.238 TCP 36266 [TCP segment of a reassembled PDU]
334   0.037979 172.31.8.238 -> 54.239.132.249 TCP 66 55334 > http [ACK] Seq=98 Ack=2995531 Win=1454208 Len=0 TSval=5128262 TSecr=1680614667
335   0.038248 54.239.132.249 -> 172.31.8.238 TCP 26130 [TCP segment of a reassembled PDU]
336   0.038255 172.31.8.238 -> 54.239.132.249 TCP 66 55334 > http [ACK] Seq=98 Ack=3021595 Win=1470976 Len=0 TSval=5128263 TSecr=1680614667
337   0.038370 54.239.132.249 -> 172.31.8.238 TCP 26130 [TCP segment of a reassembled PDU]
338   0.038378 172.31.8.238 -> 54.239.132.249 TCP 66 55334 > http [ACK] Seq=98 Ack=3047659 Win=1558528 Len=0 TSval=5128263 TSecr=1680614667
339   0.038398 54.239.132.249 -> 172.31.8.238 TCP 26130 [TCP segment of a reassembled PDU]
340   0.038404 172.31.8.238 -> 54.239.132.249 TCP 66 55334 > http [ACK] Seq=98 Ack=3073723 Win=1610624 Len=0 TSval=5128263 TSecr=1680614667
341   0.038508 54.239.132.249 -> 172.31.8.238 TCP 26130 [TCP segment of a reassembled PDU]
342   0.038514 172.31.8.238 -> 54.239.132.249 TCP 66 55334 > http [ACK] Seq=98 Ack=3099787 Win=1610624 Len=0 TSval=5128263 TSecr=1680614667
343   0.038612 54.239.132.249 -> 172.31.8.238 TCP 26130 [TCP segment of a reassembled PDU]
344   0.038618 172.31.8.238 -> 54.239.132.249 TCP 66 55334 > http [ACK] Seq=98 Ack=3125851 Win=1610624 Len=0 TSval=5128263 TSecr=1680614667
345   0.038712 54.239.132.249 -> 172.31.8.238 TCP 26130 [TCP segment of a reassembled PDU]
346   0.038720 172.31.8.238 -> 54.239.132.249 TCP 66 55334 > http [ACK] Seq=98 Ack=3151915 Win=1610624 Len=0 TSval=5128263 TSecr=1680614667
347   0.038815 54.239.132.249 -> 172.31.8.238 TCP 36266 [TCP segment of a reassembled PDU]
348   0.038825 172.31.8.238 -> 54.239.132.249 TCP 66 55334 > http [ACK] Seq=98 Ack=3188115 Win=1610624 Len=0 TSval=5128263 TSecr=1680614667
