[Measurement for 10mb at 05:41:25 20.41.2014] 
Tshark:

  1   0.000000 172.31.8.238 -> 172.31.0.2   DNS 89 Standard query 0x12c5  A d1xvcg6dfvgaki.cloudfront.net
  2   0.000029 172.31.8.238 -> 172.31.0.2   DNS 89 Standard query 0xba82  AAAA d1xvcg6dfvgaki.cloudfront.net
  3   0.000637   172.31.0.2 -> 172.31.8.238 DNS 217 Standard query response 0x12c5  A 54.239.132.173 A 54.239.132.249 A 54.192.118.232 A 54.192.118.234 A 54.192.118.246 A 54.230.117.50 A 54.230.119.18 A 54.230.119.94
  4   0.000650   172.31.0.2 -> 172.31.8.238 DNS 170 Standard query response 0xba82 
  5   0.003788 172.31.8.238 -> 54.239.132.173 TCP 74 45856 > http [SYN] Seq=0 Win=26883 Len=0 MSS=8961 SACK_PERM=1 TSval=11428205 TSecr=0 WS=128
  6   0.004414 54.239.132.173 -> 172.31.8.238 TCP 74 http > 45856 [SYN, ACK] Seq=0 Ack=1 Win=14480 Len=0 MSS=1460 SACK_PERM=1 TSval=1685650376 TSecr=11428205 WS=128
  7   0.004428 172.31.8.238 -> 54.239.132.173 TCP 66 45856 > http [ACK] Seq=1 Ack=1 Win=27008 Len=0 TSval=11428205 TSecr=1685650376
  8   0.004472 172.31.8.238 -> 54.239.132.173 HTTP 163 GET /10mb HTTP/1.1 
  9   0.004921 54.239.132.173 -> 172.31.8.238 TCP 66 http > 45856 [ACK] Seq=1 Ack=98 Win=14592 Len=0 TSval=1685650376 TSecr=11428205
 10   0.007345 54.239.132.173 -> 172.31.8.238 TCP 13098 [TCP segment of a reassembled PDU]
 11   0.007359 172.31.8.238 -> 54.239.132.173 TCP 66 45856 > http [ACK] Seq=98 Ack=13033 Win=52992 Len=0 TSval=11428205 TSecr=1685650376
 12   0.007826 54.239.132.173 -> 172.31.8.238 TCP 4410 [TCP segment of a reassembled PDU]
 13   0.007833 172.31.8.238 -> 54.239.132.173 TCP 66 45856 > http [ACK] Seq=98 Ack=17377 Win=61696 Len=0 TSval=11428206 TSecr=1685650376
 14   0.007843 54.239.132.173 -> 172.31.8.238 TCP 8754 [TCP segment of a reassembled PDU]
 15   0.007848 172.31.8.238 -> 54.239.132.173 TCP 66 45856 > http [ACK] Seq=98 Ack=26065 Win=79104 Len=0 TSval=11428206 TSecr=1685650376
 16   0.008310 54.239.132.173 -> 172.31.8.238 TCP 8754 [TCP segment of a reassembled PDU]
 17   0.008317 172.31.8.238 -> 54.239.132.173 TCP 66 45856 > http [ACK] Seq=98 Ack=34753 Win=96512 Len=0 TSval=11428206 TSecr=1685650376
 18   0.008372 54.239.132.173 -> 172.31.8.238 TCP 4410 [TCP segment of a reassembled PDU]
 19   0.008377 172.31.8.238 -> 54.239.132.173 TCP 66 45856 > http [ACK] Seq=98 Ack=39097 Win=105088 Len=0 TSval=11428206 TSecr=1685650376
 20   0.008950 54.239.132.173 -> 172.31.8.238 TCP 13098 [TCP segment of a reassembled PDU]
 21   0.008959 172.31.8.238 -> 54.239.132.173 TCP 66 45856 > http [ACK] Seq=98 Ack=52129 Win=96512 Len=0 TSval=11428206 TSecr=1685650376
 22   0.008974 54.239.132.173 -> 172.31.8.238 TCP 8754 [TCP segment of a reassembled PDU]
 23   0.008980 172.31.8.238 -> 54.239.132.173 TCP 66 45856 > http [ACK] Seq=98 Ack=60817 Win=87936 Len=0 TSval=11428206 TSecr=1685650376
 24   0.009654 54.239.132.173 -> 172.31.8.238 TCP 17442 [TCP segment of a reassembled PDU]
 25   0.009665 172.31.8.238 -> 54.239.132.173 TCP 66 45856 > http [ACK] Seq=98 Ack=78193 Win=89344 Len=0 TSval=11428206 TSecr=1685650376
 26   0.010159 54.239.132.173 -> 172.31.8.238 TCP 4410 [TCP segment of a reassembled PDU]
 27   0.010165 172.31.8.238 -> 54.239.132.173 TCP 66 45856 > http [ACK] Seq=98 Ack=82537 Win=109056 Len=0 TSval=11428206 TSecr=1685650376
 28   0.010184 54.239.132.173 -> 172.31.8.238 TCP 21786 [TCP segment of a reassembled PDU]
 29   0.010197 172.31.8.238 -> 54.239.132.173 TCP 66 45856 > http [ACK] Seq=98 Ack=104257 Win=87424 Len=0 TSval=11428206 TSecr=1685650376
 30   0.010963 54.239.132.173 -> 172.31.8.238 TCP 18890 [TCP segment of a reassembled PDU]
 31   0.010974 172.31.8.238 -> 54.239.132.173 TCP 66 45856 > http [ACK] Seq=98 Ack=123081 Win=86912 Len=0 TSval=11428206 TSecr=1685650376
 32   0.011034 54.239.132.173 -> 172.31.8.238 TCP 7306 [TCP segment of a reassembled PDU]
 33   0.011042 172.31.8.238 -> 54.239.132.173 TCP 66 45856 > http [ACK] Seq=98 Ack=130321 Win=105984 Len=0 TSval=11428206 TSecr=1685650376
 34   0.011633 54.239.132.173 -> 172.31.8.238 TCP 1514 [TCP segment of a reassembled PDU]
 35   0.011640 172.31.8.238 -> 54.239.132.173 TCP 66 45856 > http [ACK] Seq=98 Ack=131769 Win=109056 Len=0 TSval=11428206 TSecr=1685650376
 36   0.011864 54.239.132.173 -> 172.31.8.238 TCP 7306 [TCP segment of a reassembled PDU]
 37   0.011871 172.31.8.238 -> 54.239.132.173 TCP 66 45856 > http [ACK] Seq=98 Ack=139009 Win=123520 Len=0 TSval=11428207 TSecr=1685650376
 38   0.011967 54.239.132.173 -> 172.31.8.238 TCP 17442 [TCP segment of a reassembled PDU]
 39   0.011978 172.31.8.238 -> 54.239.132.173 TCP 66 45856 > http [ACK] Seq=98 Ack=156385 Win=158336 Len=0 TSval=11428207 TSecr=1685650376
 40   0.012413 54.239.132.173 -> 172.31.8.238 TCP 8754 [TCP segment of a reassembled PDU]
 41   0.012421 172.31.8.238 -> 54.239.132.173 TCP 66 45856 > http [ACK] Seq=98 Ack=165073 Win=175616 Len=0 TSval=11428207 TSecr=1685650376
 42   0.012525 54.239.132.173 -> 172.31.8.238 TCP 17442 [TCP segment of a reassembled PDU]
 43   0.012536 172.31.8.238 -> 54.239.132.173 TCP 66 45856 > http [ACK] Seq=98 Ack=182449 Win=210432 Len=0 TSval=11428207 TSecr=1685650376
 44   0.013156 54.239.132.173 -> 172.31.8.238 TCP 7306 [TCP segment of a reassembled PDU]
 45   0.013163 172.31.8.238 -> 54.239.132.173 TCP 66 45856 > http [ACK] Seq=98 Ack=189689 Win=224896 Len=0 TSval=11428207 TSecr=1685650376
 46   0.013383 54.239.132.173 -> 172.31.8.238 TCP 31922 [TCP segment of a reassembled PDU]
 47   0.013400 172.31.8.238 -> 54.239.132.173 TCP 66 45856 > http [ACK] Seq=98 Ack=221545 Win=288640 Len=0 TSval=11428207 TSecr=1685650376
 48   0.013923 54.239.132.173 -> 172.31.8.238 TCP 7306 [TCP segment of a reassembled PDU]
 49   0.013930 172.31.8.238 -> 54.239.132.173 TCP 66 45856 > http [ACK] Seq=98 Ack=228785 Win=303104 Len=0 TSval=11428207 TSecr=1685650377
 50   0.014116 54.239.132.173 -> 172.31.8.238 TCP 31922 [TCP segment of a reassembled PDU]
 51   0.014133 172.31.8.238 -> 54.239.132.173 TCP 66 45856 > http [ACK] Seq=98 Ack=260641 Win=366848 Len=0 TSval=11428207 TSecr=1685650377
 52   0.014699 54.239.132.173 -> 172.31.8.238 TCP 8754 [TCP segment of a reassembled PDU]
 53   0.014707 172.31.8.238 -> 54.239.132.173 TCP 66 45856 > http [ACK] Seq=98 Ack=269329 Win=384128 Len=0 TSval=11428207 TSecr=1685650377
 54   0.014874 54.239.132.173 -> 172.31.8.238 TCP 21786 [TCP segment of a reassembled PDU]
 55   0.014887 172.31.8.238 -> 54.239.132.173 TCP 66 45856 > http [ACK] Seq=98 Ack=291049 Win=427648 Len=0 TSval=11428207 TSecr=1685650377
 56   0.014922 54.239.132.173 -> 172.31.8.238 TCP 4410 [TCP segment of a reassembled PDU]
 57   0.014928 172.31.8.238 -> 54.239.132.173 TCP 66 45856 > http [ACK] Seq=98 Ack=295393 Win=436352 Len=0 TSval=11428207 TSecr=1685650377
 58   0.014984 54.239.132.173 -> 172.31.8.238 TCP 10202 [TCP segment of a reassembled PDU]
 59   0.014992 172.31.8.238 -> 54.239.132.173 TCP 66 45856 > http [ACK] Seq=98 Ack=305529 Win=456576 Len=0 TSval=11428207 TSecr=1685650377
 60   0.015476 54.239.132.173 -> 172.31.8.238 TCP 8754 [TCP segment of a reassembled PDU]
 61   0.015483 172.31.8.238 -> 54.239.132.173 TCP 66 45856 > http [ACK] Seq=98 Ack=314217 Win=473984 Len=0 TSval=11428207 TSecr=1685650377
 62   0.015674 54.239.132.173 -> 172.31.8.238 TCP 39162 [TCP segment of a reassembled PDU]
 63   0.015692 172.31.8.238 -> 54.239.132.173 TCP 66 45856 > http [ACK] Seq=98 Ack=353313 Win=552192 Len=0 TSval=11428207 TSecr=1685650377
 64   0.015699 54.239.132.173 -> 172.31.8.238 TCP 2962 [TCP segment of a reassembled PDU]
 65   0.015702 172.31.8.238 -> 54.239.132.173 TCP 66 45856 > http [ACK] Seq=98 Ack=356209 Win=557952 Len=0 TSval=11428207 TSecr=1685650377
 66   0.016228 54.239.132.173 -> 172.31.8.238 TCP 7306 [TCP segment of a reassembled PDU]
 67   0.016236 172.31.8.238 -> 54.239.132.173 TCP 66 45856 > http [ACK] Seq=98 Ack=363449 Win=572416 Len=0 TSval=11428208 TSecr=1685650377
 68   0.016507 54.239.132.173 -> 172.31.8.238 TCP 43506 [TCP segment of a reassembled PDU]
 69   0.016528 172.31.8.238 -> 54.239.132.173 TCP 66 45856 > http [ACK] Seq=98 Ack=406889 Win=659328 Len=0 TSval=11428208 TSecr=1685650377
 70   0.016804 54.239.132.173 -> 172.31.8.238 TCP 11650 [TCP segment of a reassembled PDU]
 71   0.016813 172.31.8.238 -> 54.239.132.173 TCP 66 45856 > http [ACK] Seq=98 Ack=418473 Win=682496 Len=0 TSval=11428208 TSecr=1685650377
 72   0.017199 54.239.132.173 -> 172.31.8.238 TCP 46402 [TCP segment of a reassembled PDU]
 73   0.017222 172.31.8.238 -> 54.239.132.173 TCP 66 45856 > http [ACK] Seq=98 Ack=464809 Win=775168 Len=0 TSval=11428208 TSecr=1685650377
 74   0.017346 54.239.132.173 -> 172.31.8.238 TCP 7306 [TCP segment of a reassembled PDU]
 75   0.017353 172.31.8.238 -> 54.239.132.173 TCP 66 45856 > http [ACK] Seq=98 Ack=472049 Win=789632 Len=0 TSval=11428208 TSecr=1685650377
 76   0.018021 54.239.132.173 -> 172.31.8.238 TCP 10202 [TCP segment of a reassembled PDU]
 77   0.018030 172.31.8.238 -> 54.239.132.173 TCP 66 45856 > http [ACK] Seq=98 Ack=482185 Win=809856 Len=0 TSval=11428208 TSecr=1685650377
 78   0.018277 54.239.132.173 -> 172.31.8.238 TCP 43506 [TCP segment of a reassembled PDU]
 79   0.018296 172.31.8.238 -> 54.239.132.173 TCP 66 45856 > http [ACK] Seq=98 Ack=525625 Win=896768 Len=0 TSval=11428208 TSecr=1685650377
 80   0.018810 54.239.132.173 -> 172.31.8.238 TCP 7306 [TCP segment of a reassembled PDU]
 81   0.018818 172.31.8.238 -> 54.239.132.173 TCP 66 45856 > http [ACK] Seq=98 Ack=532865 Win=911232 Len=0 TSval=11428208 TSecr=1685650377
 82   0.019134 54.239.132.173 -> 172.31.8.238 TCP 55090 [TCP segment of a reassembled PDU]
 83   0.019157 172.31.8.238 -> 54.239.132.173 TCP 66 45856 > http [ACK] Seq=98 Ack=587889 Win=990720 Len=0 TSval=11428208 TSecr=1685650377
 84   0.019165 54.239.132.173 -> 172.31.8.238 TCP 2962 [TCP segment of a reassembled PDU]
 85   0.019184 172.31.8.238 -> 54.239.132.173 TCP 66 45856 > http [ACK] Seq=98 Ack=590785 Win=987904 Len=0 TSval=11428208 TSecr=1685650377
 86   0.019828 54.239.132.173 -> 172.31.8.238 TCP 7306 [TCP segment of a reassembled PDU]
 87   0.019835 172.31.8.238 -> 54.239.132.173 TCP 66 45856 > http [ACK] Seq=98 Ack=598025 Win=1035776 Len=0 TSval=11428209 TSecr=1685650377
 88   0.020138 54.239.132.173 -> 172.31.8.238 TCP 52194 [TCP segment of a reassembled PDU]
 89   0.020174 172.31.8.238 -> 54.239.132.173 TCP 66 45856 > http [ACK] Seq=98 Ack=650153 Win=995584 Len=0 TSval=11428209 TSecr=1685650377
 90   0.020189 54.239.132.173 -> 172.31.8.238 TCP 5858 [TCP segment of a reassembled PDU]
 91   0.020205 172.31.8.238 -> 54.239.132.173 TCP 66 45856 > http [ACK] Seq=98 Ack=655945 Win=989824 Len=0 TSval=11428209 TSecr=1685650377
 92   0.020628 54.239.132.173 -> 172.31.8.238 TCP 13098 [TCP segment of a reassembled PDU]
 93   0.020638 172.31.8.238 -> 54.239.132.173 TCP 66 45856 > http [ACK] Seq=98 Ack=668977 Win=1059840 Len=0 TSval=11428209 TSecr=1685650377
 94   0.020902 54.239.132.173 -> 172.31.8.238 TCP 43506 [TCP segment of a reassembled PDU]
 95   0.020934 54.239.132.173 -> 172.31.8.238 TCP 8754 [TCP segment of a reassembled PDU]
 96   0.020947 172.31.8.238 -> 54.239.132.173 TCP 66 45856 > http [ACK] Seq=98 Ack=721105 Win=1007744 Len=0 TSval=11428209 TSecr=1685650377
 97   0.021612 54.239.132.173 -> 172.31.8.238 TCP 8754 [TCP segment of a reassembled PDU]
 98   0.021620 172.31.8.238 -> 54.239.132.173 TCP 66 45856 > http [ACK] Seq=98 Ack=729793 Win=1067008 Len=0 TSval=11428209 TSecr=1685650377
 99   0.021912 54.239.132.173 -> 172.31.8.238 TCP 44954 [TCP segment of a reassembled PDU]
100   0.021958 54.239.132.173 -> 172.31.8.238 TCP 7306 [TCP segment of a reassembled PDU]
101   0.021964 54.239.132.173 -> 172.31.8.238 TCP 1514 [TCP segment of a reassembled PDU]
102   0.021967 54.239.132.173 -> 172.31.8.238 TCP 2962 [TCP segment of a reassembled PDU]
103   0.021979 172.31.8.238 -> 54.239.132.173 TCP 66 45856 > http [ACK] Seq=98 Ack=786265 Win=1010560 Len=0 TSval=11428209 TSecr=1685650377
104   0.022834 54.239.132.173 -> 172.31.8.238 TCP 50746 [TCP segment of a reassembled PDU]
105   0.022857 54.239.132.173 -> 172.31.8.238 TCP 1514 [TCP segment of a reassembled PDU]
106   0.022872 172.31.8.238 -> 54.239.132.173 TCP 66 45856 > http [ACK] Seq=98 Ack=838393 Win=995456 Len=0 TSval=11428209 TSecr=1685650377
107   0.022896 54.239.132.173 -> 172.31.8.238 TCP 13098 [TCP segment of a reassembled PDU]
108   0.022911 172.31.8.238 -> 54.239.132.173 TCP 66 45856 > http [ACK] Seq=98 Ack=851425 Win=982528 Len=0 TSval=11428209 TSecr=1685650377
109   0.023393 54.239.132.173 -> 172.31.8.238 TCP 5858 [TCP segment of a reassembled PDU]
110   0.023400 172.31.8.238 -> 54.239.132.173 TCP 66 45856 > http [ACK] Seq=98 Ack=857217 Win=1071744 Len=0 TSval=11428209 TSecr=1685650378
111   0.023699 54.239.132.173 -> 172.31.8.238 TCP 42058 [TCP segment of a reassembled PDU]
112   0.023734 54.239.132.173 -> 172.31.8.238 TCP 10202 [TCP segment of a reassembled PDU]
113   0.023748 54.239.132.173 -> 172.31.8.238 TCP 7306 [TCP segment of a reassembled PDU]
114   0.023756 172.31.8.238 -> 54.239.132.173 TCP 66 45856 > http [ACK] Seq=98 Ack=916585 Win=1012480 Len=0 TSval=11428210 TSecr=1685650378
115   0.024420 54.239.132.173 -> 172.31.8.238 TCP 7306 [TCP segment of a reassembled PDU]
116   0.024427 172.31.8.238 -> 54.239.132.173 TCP 66 45856 > http [ACK] Seq=98 Ack=923825 Win=1069312 Len=0 TSval=11428210 TSecr=1685650378
117   0.024733 54.239.132.173 -> 172.31.8.238 TCP 37714 [TCP segment of a reassembled PDU]
118   0.024763 172.31.8.238 -> 54.239.132.173 TCP 66 45856 > http [ACK] Seq=98 Ack=961473 Win=1031680 Len=0 TSval=11428210 TSecr=1685650378
119   0.024781 54.239.132.173 -> 172.31.8.238 TCP 20338 [TCP segment of a reassembled PDU]
120   0.024804 172.31.8.238 -> 54.239.132.173 TCP 66 45856 > http [ACK] Seq=98 Ack=981745 Win=1011456 Len=0 TSval=11428210 TSecr=1685650378
121   0.025140 54.239.132.173 -> 172.31.8.238 TCP 29026 [TCP segment of a reassembled PDU]
122   0.025156 172.31.8.238 -> 54.239.132.173 TCP 66 45856 > http [ACK] Seq=98 Ack=1010705 Win=1033600 Len=0 TSval=11428210 TSecr=1685650378
123   0.025173 54.239.132.173 -> 172.31.8.238 TCP 2962 [TCP segment of a reassembled PDU]
124   0.025186 172.31.8.238 -> 54.239.132.173 TCP 66 45856 > http [ACK] Seq=98 Ack=1013601 Win=1030784 Len=0 TSval=11428210 TSecr=1685650378
125   0.025385 54.239.132.173 -> 172.31.8.238 TCP 33370 [TCP segment of a reassembled PDU]
126   0.025414 172.31.8.238 -> 54.239.132.173 TCP 66 45856 > http [ACK] Seq=98 Ack=1046905 Win=1026432 Len=0 TSval=11428210 TSecr=1685650378
127   0.025710 54.239.132.173 -> 172.31.8.238 TCP 4410 [TCP segment of a reassembled PDU]
128   0.025716 172.31.8.238 -> 54.239.132.173 TCP 66 45856 > http [ACK] Seq=98 Ack=1051249 Win=1074048 Len=0 TSval=11428210 TSecr=1685650378
129   0.025954 54.239.132.173 -> 172.31.8.238 TCP 21786 [TCP segment of a reassembled PDU]
130   0.025979 54.239.132.173 -> 172.31.8.238 TCP 4410 [TCP segment of a reassembled PDU]
131   0.025987 172.31.8.238 -> 54.239.132.173 TCP 66 45856 > http [ACK] Seq=98 Ack=1077313 Win=1048064 Len=0 TSval=11428210 TSecr=1685650378
132   0.026092 54.239.132.173 -> 172.31.8.238 TCP 24682 [TCP segment of a reassembled PDU]
133   0.026117 172.31.8.238 -> 54.239.132.173 TCP 66 45856 > http [ACK] Seq=98 Ack=1101929 Win=1040768 Len=0 TSval=11428210 TSecr=1685650378
134   0.026131 54.239.132.173 -> 172.31.8.238 TCP 10202 [TCP segment of a reassembled PDU]
135   0.026161 172.31.8.238 -> 54.239.132.173 TCP 66 45856 > http [ACK] Seq=98 Ack=1112065 Win=1064576 Len=0 TSval=11428210 TSecr=1685650378
136   0.026260 54.239.132.173 -> 172.31.8.238 TCP 11650 [TCP segment of a reassembled PDU]
137   0.026335 172.31.8.238 -> 54.239.132.173 TCP 66 45856 > http [ACK] Seq=98 Ack=1123649 Win=1079168 Len=0 TSval=11428210 TSecr=1685650378
138   0.026374 54.239.132.173 -> 172.31.8.238 TCP 23234 [TCP segment of a reassembled PDU]
139   0.026398 172.31.8.238 -> 54.239.132.173 TCP 66 45856 > http [ACK] Seq=98 Ack=1146817 Win=1056000 Len=0 TSval=11428210 TSecr=1685650378
140   0.026715 54.239.132.173 -> 172.31.8.238 TCP 5858 [TCP segment of a reassembled PDU]
141   0.026722 172.31.8.238 -> 54.239.132.173 TCP 66 45856 > http [ACK] Seq=98 Ack=1152609 Win=1071744 Len=0 TSval=11428210 TSecr=1685650378
142   0.027009 54.239.132.173 -> 172.31.8.238 TCP 33370 [TCP segment of a reassembled PDU]
143   0.027037 172.31.8.238 -> 54.239.132.173 TCP 66 45856 > http [ACK] Seq=98 Ack=1185913 Win=1038464 Len=0 TSval=11428210 TSecr=1685650378
144   0.027056 54.239.132.173 -> 172.31.8.238 TCP 18890 [TCP segment of a reassembled PDU]
145   0.027073 172.31.8.238 -> 54.239.132.173 TCP 66 45856 > http [ACK] Seq=98 Ack=1204737 Win=1019648 Len=0 TSval=11428210 TSecr=1685650378
146   0.027193 54.239.132.173 -> 172.31.8.238 TCP 37714 [TCP segment of a reassembled PDU]
147   0.027222 172.31.8.238 -> 54.239.132.173 TCP 66 45856 > http [ACK] Seq=98 Ack=1242385 Win=1019392 Len=0 TSval=11428210 TSecr=1685650378
148   0.027547 54.239.132.173 -> 172.31.8.238 TCP 1514 [TCP segment of a reassembled PDU]
149   0.027698 54.239.132.173 -> 172.31.8.238 TCP 20338 [TCP segment of a reassembled PDU]
150   0.027711 172.31.8.238 -> 54.239.132.173 TCP 66 45856 > http [ACK] Seq=98 Ack=1264105 Win=1047936 Len=0 TSval=11428211 TSecr=1685650378
151   0.027823 54.239.132.173 -> 172.31.8.238 TCP 18890 [TCP segment of a reassembled PDU]
152   0.027834 172.31.8.238 -> 54.239.132.173 TCP 66 45856 > http [ACK] Seq=98 Ack=1282929 Win=1116928 Len=0 TSval=11428211 TSecr=1685650378
153   0.028032 54.239.132.173 -> 172.31.8.238 TCP 21786 [TCP segment of a reassembled PDU]
154   0.028044 172.31.8.238 -> 54.239.132.173 TCP 66 45856 > http [ACK] Seq=98 Ack=1304649 Win=1160320 Len=0 TSval=11428211 TSecr=1685650378
155   0.028075 54.239.132.173 -> 172.31.8.238 TCP 1514 [TCP segment of a reassembled PDU]
156   0.028079 172.31.8.238 -> 54.239.132.173 TCP 66 45856 > http [ACK] Seq=98 Ack=1306097 Win=1163264 Len=0 TSval=11428211 TSecr=1685650378
157   0.028173 54.239.132.173 -> 172.31.8.238 TCP 44954 [TCP segment of a reassembled PDU]
158   0.028194 172.31.8.238 -> 54.239.132.173 TCP 66 45856 > http [ACK] Seq=98 Ack=1350985 Win=1252992 Len=0 TSval=11428211 TSecr=1685650378
159   0.028253 54.239.132.173 -> 172.31.8.238 TCP 2962 [TCP segment of a reassembled PDU]
160   0.028257 172.31.8.238 -> 54.239.132.173 TCP 66 45856 > http [ACK] Seq=98 Ack=1353881 Win=1258752 Len=0 TSval=11428211 TSecr=1685650378
161   0.028365 54.239.132.173 -> 172.31.8.238 TCP 18890 [TCP segment of a reassembled PDU]
162   0.028375 172.31.8.238 -> 54.239.132.173 TCP 66 45856 > http [ACK] Seq=98 Ack=1372705 Win=1296384 Len=0 TSval=11428211 TSecr=1685650378
163   0.028705 54.239.132.173 -> 172.31.8.238 TCP 40610 [TCP segment of a reassembled PDU]
164   0.028725 172.31.8.238 -> 54.239.132.173 TCP 66 45856 > http [ACK] Seq=98 Ack=1413249 Win=1311872 Len=0 TSval=11428211 TSecr=1685650378
165   0.028734 54.239.132.173 -> 172.31.8.238 TCP 4410 [TCP segment of a reassembled PDU]
166   0.028753 172.31.8.238 -> 54.239.132.173 TCP 66 45856 > http [ACK] Seq=98 Ack=1417593 Win=1307648 Len=0 TSval=11428211 TSecr=1685650378
167   0.028874 54.239.132.173 -> 172.31.8.238 TCP 20338 [TCP segment of a reassembled PDU]
168   0.028895 172.31.8.238 -> 54.239.132.173 TCP 66 45856 > http [ACK] Seq=98 Ack=1437865 Win=1345280 Len=0 TSval=11428211 TSecr=1685650378
169   0.029194 54.239.132.173 -> 172.31.8.238 TCP 37714 [TCP segment of a reassembled PDU]
170   0.029233 54.239.132.173 -> 172.31.8.238 TCP 15994 [TCP segment of a reassembled PDU]
171   0.029242 172.31.8.238 -> 54.239.132.173 TCP 66 45856 > http [ACK] Seq=98 Ack=1475513 Win=1316736 Len=0 TSval=11428211 TSecr=1685650378
172   0.029256 172.31.8.238 -> 54.239.132.173 TCP 66 45856 > http [ACK] Seq=98 Ack=1491441 Win=1300864 Len=0 TSval=11428211 TSecr=1685650378
173   0.029404 54.239.132.173 -> 172.31.8.238 TCP 11650 [TCP segment of a reassembled PDU]
174   0.029412 172.31.8.238 -> 54.239.132.173 TCP 66 45856 > http [ACK] Seq=98 Ack=1503025 Win=1359616 Len=0 TSval=11428211 TSecr=1685650378
175   0.029702 54.239.132.173 -> 172.31.8.238 TCP 34818 [TCP segment of a reassembled PDU]
176   0.029729 172.31.8.238 -> 54.239.132.173 TCP 66 45856 > http [ACK] Seq=98 Ack=1537777 Win=1324928 Len=0 TSval=11428211 TSecr=1685650378
177   0.029746 54.239.132.173 -> 172.31.8.238 TCP 17442 [TCP segment of a reassembled PDU]
178   0.029764 172.31.8.238 -> 54.239.132.173 TCP 66 45856 > http [ACK] Seq=98 Ack=1555153 Win=1307648 Len=0 TSval=11428211 TSecr=1685650378
179   0.029994 54.239.132.173 -> 172.31.8.238 TCP 44954 [TCP segment of a reassembled PDU]
180   0.030032 54.239.132.173 -> 172.31.8.238 TCP 13098 [TCP segment of a reassembled PDU]
181   0.030041 54.239.132.173 -> 172.31.8.238 TCP 4410 [TCP segment of a reassembled PDU]
182   0.030049 172.31.8.238 -> 54.239.132.173 TCP 66 45856 > http [ACK] Seq=98 Ack=1617417 Win=1276032 Len=0 TSval=11428211 TSecr=1685650378
183   0.030386 54.239.132.173 -> 172.31.8.238 TCP 15994 [TCP segment of a reassembled PDU]
184   0.030396 172.31.8.238 -> 54.239.132.173 TCP 66 45856 > http [ACK] Seq=98 Ack=1633345 Win=1352320 Len=0 TSval=11428211 TSecr=1685650378
185   0.030877 54.239.132.173 -> 172.31.8.238 TCP 29026 [TCP segment of a reassembled PDU]
186   0.030903 172.31.8.238 -> 54.239.132.173 TCP 66 45856 > http [ACK] Seq=98 Ack=1662305 Win=1330944 Len=0 TSval=11428211 TSecr=1685650378
187   0.030933 54.239.132.173 -> 172.31.8.238 TCP 23234 [TCP segment of a reassembled PDU]
188   0.030945 172.31.8.238 -> 54.239.132.173 TCP 66 45856 > http [ACK] Seq=98 Ack=1685473 Win=1340544 Len=0 TSval=11428211 TSecr=1685650378
189   0.031046 54.239.132.173 -> 172.31.8.238 TCP 39162 [TCP segment of a reassembled PDU]
190   0.031102 54.239.132.173 -> 172.31.8.238 TCP 13098 [TCP segment of a reassembled PDU]
191   0.031134 54.239.132.173 -> 172.31.8.238 TCP 26130 [TCP segment of a reassembled PDU]
192   0.031203 172.31.8.238 -> 54.239.132.173 TCP 66 45856 > http [ACK] Seq=98 Ack=1763665 Win=1262464 Len=0 TSval=11428211 TSecr=1685650378
193   0.031647 54.239.132.173 -> 172.31.8.238 TCP 5858 [TCP segment of a reassembled PDU]
194   0.031654 172.31.8.238 -> 54.239.132.173 TCP 66 45856 > http [ACK] Seq=98 Ack=1769457 Win=1369088 Len=0 TSval=11428211 TSecr=1685650378
195   0.032073 54.239.132.173 -> 172.31.8.238 TCP 17442 [TCP segment of a reassembled PDU]
196   0.032085 172.31.8.238 -> 54.239.132.173 TCP 66 45856 > http [ACK] Seq=98 Ack=1786833 Win=1409408 Len=0 TSval=11428212 TSecr=1685650378
197   0.032107 54.239.132.173 -> 172.31.8.238 TCP 8754 [TCP segment of a reassembled PDU]
198   0.032113 172.31.8.238 -> 54.239.132.173 TCP 66 45856 > http [ACK] Seq=98 Ack=1795521 Win=1426816 Len=0 TSval=11428212 TSecr=1685650378
199   0.032260 54.239.132.173 -> 172.31.8.238 TCP 52194 [TCP segment of a reassembled PDU]
200   0.032281 172.31.8.238 -> 54.239.132.173 TCP 66 45856 > http [ACK] Seq=98 Ack=1847649 Win=1531008 Len=0 TSval=11428212 TSecr=1685650378
201   0.032335 54.239.132.173 -> 172.31.8.238 TCP 26130 [TCP segment of a reassembled PDU]
202   0.032348 172.31.8.238 -> 54.239.132.173 TCP 66 45856 > http [ACK] Seq=98 Ack=1873713 Win=1583232 Len=0 TSval=11428212 TSecr=1685650378
203   0.032426 54.239.132.173 -> 172.31.8.238 TCP 20338 [TCP segment of a reassembled PDU]
204   0.032439 172.31.8.238 -> 54.239.132.173 TCP 66 45856 > http [ACK] Seq=98 Ack=1893985 Win=1583232 Len=0 TSval=11428212 TSecr=1685650378
205   0.032962 54.239.132.173 -> 172.31.8.238 TCP 13098 [TCP segment of a reassembled PDU]
206   0.032972 172.31.8.238 -> 54.239.132.173 TCP 66 45856 > http [ACK] Seq=98 Ack=1907017 Win=1583232 Len=0 TSval=11428212 TSecr=1685650378
207   0.033385 54.239.132.173 -> 172.31.8.238 TCP 49298 [TCP segment of a reassembled PDU]
208   0.033405 172.31.8.238 -> 54.239.132.173 TCP 66 45856 > http [ACK] Seq=98 Ack=1956249 Win=1583232 Len=0 TSval=11428212 TSecr=1685650378
209   0.033424 54.239.132.173 -> 172.31.8.238 TCP 2962 [TCP segment of a reassembled PDU]
210   0.033427 172.31.8.238 -> 54.239.132.173 TCP 66 45856 > http [ACK] Seq=98 Ack=1959145 Win=1583232 Len=0 TSval=11428212 TSecr=1685650378
211   0.033567 54.239.132.173 -> 172.31.8.238 TCP 59434 [TCP segment of a reassembled PDU]
212   0.033590 172.31.8.238 -> 54.239.132.173 TCP 66 45856 > http [ACK] Seq=98 Ack=2018513 Win=1583232 Len=0 TSval=11428212 TSecr=1685650378
213   0.033609 54.239.132.173 -> 172.31.8.238 TCP 5858 [TCP segment of a reassembled PDU]
214   0.033614 172.31.8.238 -> 54.239.132.173 TCP 66 45856 > http [ACK] Seq=98 Ack=2024305 Win=1583232 Len=0 TSval=11428212 TSecr=1685650378
215   0.034309 54.239.132.173 -> 172.31.8.238 TCP 56538 [TCP segment of a reassembled PDU]
216   0.034331 172.31.8.238 -> 54.239.132.173 TCP 66 45856 > http [ACK] Seq=98 Ack=2080777 Win=1583232 Len=0 TSval=11428212 TSecr=1685650379
217   0.034599 54.239.132.173 -> 172.31.8.238 TCP 62330 [TCP segment of a reassembled PDU]
218   0.034626 172.31.8.238 -> 54.239.132.173 TCP 66 45856 > http [ACK] Seq=98 Ack=2143041 Win=1583232 Len=0 TSval=11428212 TSecr=1685650379
219   0.034647 54.239.132.173 -> 172.31.8.238 TCP 11650 [TCP segment of a reassembled PDU]
220   0.034654 172.31.8.238 -> 54.239.132.173 TCP 66 45856 > http [ACK] Seq=98 Ack=2154625 Win=1583232 Len=0 TSval=11428212 TSecr=1685650379
221   0.035307 54.239.132.173 -> 172.31.8.238 TCP 5858 [TCP segment of a reassembled PDU]
222   0.035315 172.31.8.238 -> 54.239.132.173 TCP 66 45856 > http [ACK] Seq=98 Ack=2160417 Win=1583232 Len=0 TSval=11428212 TSecr=1685650379
223   0.035787 54.239.132.173 -> 172.31.8.238 TCP 44954 [TCP segment of a reassembled PDU]
224   0.035807 172.31.8.238 -> 54.239.132.173 TCP 66 45856 > http [ACK] Seq=98 Ack=2205305 Win=1583232 Len=0 TSval=11428213 TSecr=1685650379
225   0.035850 54.239.132.173 -> 172.31.8.238 TCP 14546 [TCP segment of a reassembled PDU]
226   0.035859 172.31.8.238 -> 54.239.132.173 TCP 66 45856 > http [ACK] Seq=98 Ack=2219785 Win=1583232 Len=0 TSval=11428213 TSecr=1685650379
227   0.035988 54.239.132.173 -> 172.31.8.238 TCP 47850 [TCP segment of a reassembled PDU]
228   0.036008 172.31.8.238 -> 54.239.132.173 TCP 66 45856 > http [ACK] Seq=98 Ack=2267569 Win=1583232 Len=0 TSval=11428213 TSecr=1685650379
229   0.036050 54.239.132.173 -> 172.31.8.238 TCP 17442 [TCP segment of a reassembled PDU]
230   0.036064 172.31.8.238 -> 54.239.132.173 TCP 66 45856 > http [ACK] Seq=98 Ack=2284945 Win=1583232 Len=0 TSval=11428213 TSecr=1685650379
231   0.036731 54.239.132.173 -> 172.31.8.238 TCP 44954 [TCP segment of a reassembled PDU]
232   0.036750 172.31.8.238 -> 54.239.132.173 TCP 66 45856 > http [ACK] Seq=98 Ack=2329833 Win=1583232 Len=0 TSval=11428213 TSecr=1685650379
233   0.036763 54.239.132.173 -> 172.31.8.238 TCP 7306 [TCP segment of a reassembled PDU]
234   0.036767 172.31.8.238 -> 54.239.132.173 TCP 66 45856 > http [ACK] Seq=98 Ack=2337073 Win=1583232 Len=0 TSval=11428213 TSecr=1685650379
235   0.036916 54.239.132.173 -> 172.31.8.238 TCP 55090 [TCP segment of a reassembled PDU]
236   0.036938 172.31.8.238 -> 54.239.132.173 TCP 66 45856 > http [ACK] Seq=98 Ack=2392097 Win=1583232 Len=0 TSval=11428213 TSecr=1685650379
237   0.036992 54.239.132.173 -> 172.31.8.238 TCP 23234 [TCP segment of a reassembled PDU]
238   0.037002 172.31.8.238 -> 54.239.132.173 TCP 66 45856 > http [ACK] Seq=98 Ack=2415265 Win=1583232 Len=0 TSval=11428213 TSecr=1685650379
239   0.037452 54.239.132.173 -> 172.31.8.238 TCP 5858 [TCP segment of a reassembled PDU]
240   0.037458 172.31.8.238 -> 54.239.132.173 TCP 66 45856 > http [ACK] Seq=98 Ack=2421057 Win=1583232 Len=0 TSval=11428213 TSecr=1685650379
241   0.037913 54.239.132.173 -> 172.31.8.238 TCP 33370 [TCP segment of a reassembled PDU]
242   0.037928 172.31.8.238 -> 54.239.132.173 TCP 66 45856 > http [ACK] Seq=98 Ack=2454361 Win=1583232 Len=0 TSval=11428213 TSecr=1685650379
243   0.037964 54.239.132.173 -> 172.31.8.238 TCP 18890 [TCP segment of a reassembled PDU]
244   0.037976 172.31.8.238 -> 54.239.132.173 TCP 66 45856 > http [ACK] Seq=98 Ack=2473185 Win=1583232 Len=0 TSval=11428213 TSecr=1685650379
245   0.038087 54.239.132.173 -> 172.31.8.238 TCP 43506 [TCP segment of a reassembled PDU]
246   0.038119 172.31.8.238 -> 54.239.132.173 TCP 66 45856 > http [ACK] Seq=98 Ack=2516625 Win=1583232 Len=0 TSval=11428213 TSecr=1685650379
247   0.038150 54.239.132.173 -> 172.31.8.238 TCP 8754 [TCP segment of a reassembled PDU]
248   0.038156 172.31.8.238 -> 54.239.132.173 TCP 66 45856 > http [ACK] Seq=98 Ack=2525313 Win=1583232 Len=0 TSval=11428213 TSecr=1685650379
249   0.038245 54.239.132.173 -> 172.31.8.238 TCP 20338 [TCP segment of a reassembled PDU]
250   0.038254 172.31.8.238 -> 54.239.132.173 TCP 66 45856 > http [ACK] Seq=98 Ack=2545585 Win=1583232 Len=0 TSval=11428213 TSecr=1685650379
251   0.038782 54.239.132.173 -> 172.31.8.238 TCP 5858 [TCP segment of a reassembled PDU]
252   0.038789 172.31.8.238 -> 54.239.132.173 TCP 66 45856 > http [ACK] Seq=98 Ack=2551377 Win=1583232 Len=0 TSval=11428213 TSecr=1685650379
253   0.039224 54.239.132.173 -> 172.31.8.238 TCP 27578 [TCP segment of a reassembled PDU]
254   0.039235 172.31.8.238 -> 54.239.132.173 TCP 66 45856 > http [ACK] Seq=98 Ack=2578889 Win=1583232 Len=0 TSval=11428213 TSecr=1685650379
255   0.039283 54.239.132.173 -> 172.31.8.238 TCP 24682 [TCP segment of a reassembled PDU]
256   0.039294 172.31.8.238 -> 54.239.132.173 TCP 66 45856 > http [ACK] Seq=98 Ack=2603505 Win=1583232 Len=0 TSval=11428213 TSecr=1685650379
257   0.039382 54.239.132.173 -> 172.31.8.238 TCP 37714 [TCP segment of a reassembled PDU]
258   0.039408 172.31.8.238 -> 54.239.132.173 TCP 66 45856 > http [ACK] Seq=98 Ack=2641153 Win=1583232 Len=0 TSval=11428213 TSecr=1685650379
259   0.039468 54.239.132.173 -> 172.31.8.238 TCP 34818 [TCP segment of a reassembled PDU]
260   0.039483 172.31.8.238 -> 54.239.132.173 TCP 66 45856 > http [ACK] Seq=98 Ack=2675905 Win=1583232 Len=0 TSval=11428213 TSecr=1685650379
261   0.039849 54.239.132.173 -> 172.31.8.238 TCP 2962 [TCP segment of a reassembled PDU]
262   0.039855 172.31.8.238 -> 54.239.132.173 TCP 66 45856 > http [ACK] Seq=98 Ack=2678801 Win=1583232 Len=0 TSval=11428214 TSecr=1685650379
263   0.040303 54.239.132.173 -> 172.31.8.238 TCP 24682 [TCP segment of a reassembled PDU]
264   0.040315 172.31.8.238 -> 54.239.132.173 TCP 66 45856 > http [ACK] Seq=98 Ack=2703417 Win=1583232 Len=0 TSval=11428214 TSecr=1685650379
265   0.040330 54.239.132.173 -> 172.31.8.238 TCP 1514 [TCP segment of a reassembled PDU]
266   0.040474 54.239.132.173 -> 172.31.8.238 TCP 60882 [TCP segment of a reassembled PDU]
267   0.040498 172.31.8.238 -> 54.239.132.173 TCP 66 45856 > http [ACK] Seq=98 Ack=2765681 Win=1583232 Len=0 TSval=11428214 TSecr=1685650379
268   0.040529 54.239.132.173 -> 172.31.8.238 TCP 17442 [TCP segment of a reassembled PDU]
269   0.040537 172.31.8.238 -> 54.239.132.173 TCP 66 45856 > http [ACK] Seq=98 Ack=2783057 Win=1583232 Len=0 TSval=11428214 TSecr=1685650379
270   0.040621 54.239.132.173 -> 172.31.8.238 TCP 23234 [TCP segment of a reassembled PDU]
271   0.040631 172.31.8.238 -> 54.239.132.173 TCP 66 45856 > http [ACK] Seq=98 Ack=2806225 Win=1583232 Len=0 TSval=11428214 TSecr=1685650379
272   0.041100 54.239.132.173 -> 172.31.8.238 TCP 21786 [TCP segment of a reassembled PDU]
273   0.041124 172.31.8.238 -> 54.239.132.173 TCP 66 45856 > http [ACK] Seq=98 Ack=2827945 Win=1583232 Len=0 TSval=11428214 TSecr=1685650379
274   0.041200 54.239.132.173 -> 172.31.8.238 TCP 29026 [TCP segment of a reassembled PDU]
275   0.041214 172.31.8.238 -> 54.239.132.173 TCP 66 45856 > http [ACK] Seq=98 Ack=2856905 Win=1583232 Len=0 TSval=11428214 TSecr=1685650379
276   0.041429 54.239.132.173 -> 172.31.8.238 TCP 33370 [TCP segment of a reassembled PDU]
277   0.041444 172.31.8.238 -> 54.239.132.173 TCP 66 45856 > http [ACK] Seq=98 Ack=2890209 Win=1583232 Len=0 TSval=11428214 TSecr=1685650379
278   0.041534 54.239.132.173 -> 172.31.8.238 TCP 46402 [TCP segment of a reassembled PDU]
279   0.041554 172.31.8.238 -> 54.239.132.173 TCP 66 45856 > http [ACK] Seq=98 Ack=2936545 Win=1583232 Len=0 TSval=11428214 TSecr=1685650379
280   0.041946 54.239.132.173 -> 172.31.8.238 TCP 62330 [TCP segment of a reassembled PDU]
281   0.041969 172.31.8.238 -> 54.239.132.173 TCP 66 45856 > http [ACK] Seq=98 Ack=2998809 Win=1583232 Len=0 TSval=11428214 TSecr=1685650379
282   0.041976 54.239.132.173 -> 172.31.8.238 TCP 2962 [TCP segment of a reassembled PDU]
283   0.041979 172.31.8.238 -> 54.239.132.173 TCP 66 45856 > http [ACK] Seq=98 Ack=3001705 Win=1583232 Len=0 TSval=11428214 TSecr=1685650379
284   0.042596 54.239.132.173 -> 172.31.8.238 TCP 59434 [TCP segment of a reassembled PDU]
285   0.042618 172.31.8.238 -> 54.239.132.173 TCP 66 45856 > http [ACK] Seq=98 Ack=3061073 Win=1583232 Len=0 TSval=11428214 TSecr=1685650379
286   0.042642 54.239.132.173 -> 172.31.8.238 TCP 18890 [TCP segment of a reassembled PDU]
287   0.042650 172.31.8.238 -> 54.239.132.173 TCP 66 45856 > http [ACK] Seq=98 Ack=3079897 Win=1583232 Len=0 TSval=11428214 TSecr=1685650379
288   0.042794 54.239.132.173 -> 172.31.8.238 TCP 43506 [TCP segment of a reassembled PDU]
289   0.042810 172.31.8.238 -> 54.239.132.173 TCP 66 45856 > http [ACK] Seq=98 Ack=3123337 Win=1583232 Len=0 TSval=11428214 TSecr=1685650379
290   0.043121 54.239.132.173 -> 172.31.8.238 TCP 62330 [TCP segment of a reassembled PDU]
291   0.043138 172.31.8.238 -> 54.239.132.173 TCP 66 45856 > http [ACK] Seq=98 Ack=3185601 Win=1583232 Len=0 TSval=11428214 TSecr=1685650379
292   0.043229 54.239.132.173 -> 172.31.8.238 TCP 11650 [TCP segment of a reassembled PDU]
293   0.043236 172.31.8.238 -> 54.239.132.173 TCP 66 45856 > http [ACK] Seq=98 Ack=3197185 Win=1583232 Len=0 TSval=11428214 TSecr=1685650379
294   0.043559 54.239.132.173 -> 172.31.8.238 TCP 8754 [TCP segment of a reassembled PDU]
295   0.043566 172.31.8.238 -> 54.239.132.173 TCP 66 45856 > http [ACK] Seq=98 Ack=3205873 Win=1583232 Len=0 TSval=11428214 TSecr=1685650379
296   0.043698 54.239.132.173 -> 172.31.8.238 TCP 42058 [TCP segment of a reassembled PDU]
297   0.043715 172.31.8.238 -> 54.239.132.173 TCP 66 45856 > http [ACK] Seq=98 Ack=3247865 Win=1583232 Len=0 TSval=11428215 TSecr=1685650379
298   0.044262 54.239.132.173 -> 172.31.8.238 TCP 14546 [TCP segment of a reassembled PDU]
299   0.044270 172.31.8.238 -> 54.239.132.173 TCP 66 45856 > http [ACK] Seq=98 Ack=3262345 Win=1583232 Len=0 TSval=11428215 TSecr=1685650379
300   0.044300 54.239.132.173 -> 172.31.8.238 TCP 47850 [TCP segment of a reassembled PDU]
301   0.044311 172.31.8.238 -> 54.239.132.173 TCP 66 45856 > http [ACK] Seq=98 Ack=3310129 Win=1583232 Len=0 TSval=11428215 TSecr=1685650380
302   0.044458 54.239.132.173 -> 172.31.8.238 TCP 46402 [TCP segment of a reassembled PDU]
303   0.044472 172.31.8.238 -> 54.239.132.173 TCP 66 45856 > http [ACK] Seq=98 Ack=3356465 Win=1583232 Len=0 TSval=11428215 TSecr=1685650380
304   0.044568 54.239.132.173 -> 172.31.8.238 TCP 36266 [TCP segment of a reassembled PDU]
305   0.044579 172.31.8.238 -> 54.239.132.173 TCP 66 45856 > http [ACK] Seq=98 Ack=3392665 Win=1583232 Len=0 TSval=11428215 TSecr=1685650380
306   0.045157 54.239.132.173 -> 172.31.8.238 TCP 26130 [TCP segment of a reassembled PDU]
307   0.045167 172.31.8.238 -> 54.239.132.173 TCP 66 45856 > http [ACK] Seq=98 Ack=3418729 Win=1583232 Len=0 TSval=11428215 TSecr=1685650380
308   0.045316 54.239.132.173 -> 172.31.8.238 TCP 39162 [TCP segment of a reassembled PDU]
309   0.045327 172.31.8.238 -> 54.239.132.173 TCP 66 45856 > http [ACK] Seq=98 Ack=3457825 Win=1583232 Len=0 TSval=11428215 TSecr=1685650380
310   0.045345 54.239.132.173 -> 172.31.8.238 TCP 15994 [TCP segment of a reassembled PDU]
311   0.045353 172.31.8.238 -> 54.239.132.173 TCP 66 45856 > http [ACK] Seq=98 Ack=3473753 Win=1583232 Len=0 TSval=11428215 TSecr=1685650380
312   0.045360 54.239.132.173 -> 172.31.8.238 TCP 7306 [TCP segment of a reassembled PDU]
313   0.045364 172.31.8.238 -> 54.239.132.173 TCP 66 45856 > http [ACK] Seq=98 Ack=3480993 Win=1583232 Len=0 TSval=11428215 TSecr=1685650380
314   0.045797 54.239.132.173 -> 172.31.8.238 TCP 44954 [TCP segment of a reassembled PDU]
315   0.045809 172.31.8.238 -> 54.239.132.173 TCP 66 45856 > http [ACK] Seq=98 Ack=3525881 Win=1583232 Len=0 TSval=11428215 TSecr=1685650380
316   0.045814 54.239.132.173 -> 172.31.8.238 TCP 1514 [TCP Previous segment not captured] [TCP segment of a reassembled PDU]
317   0.045817 172.31.8.238 -> 54.239.132.173 TCP 78 [TCP Dup ACK 315#1] 45856 > http [ACK] Seq=98 Ack=3525881 Win=1583232 Len=0 TSval=11428215 TSecr=1685650380 SLE=3527329 SRE=3528777
318   0.045818 54.239.132.173 -> 172.31.8.238 TCP 1514 [TCP Out-Of-Order] [TCP segment of a reassembled PDU]
319   0.045820 172.31.8.238 -> 54.239.132.173 TCP 66 45856 > http [ACK] Seq=98 Ack=3528777 Win=1583232 Len=0 TSval=11428215 TSecr=1685650380
320   0.045833 54.239.132.173 -> 172.31.8.238 TCP 7306 [TCP segment of a reassembled PDU]
321   0.045836 172.31.8.238 -> 54.239.132.173 TCP 66 45856 > http [ACK] Seq=98 Ack=3536017 Win=1583232 Len=0 TSval=11428215 TSecr=1685650380
322   0.045992 54.239.132.173 -> 172.31.8.238 TCP 52194 [TCP segment of a reassembled PDU]
323   0.046004 172.31.8.238 -> 54.239.132.173 TCP 66 45856 > http [ACK] Seq=98 Ack=3588145 Win=1583232 Len=0 TSval=11428215 TSecr=1685650380
324   0.046529 54.239.132.173 -> 172.31.8.238 TCP 62330 [TCP segment of a reassembled PDU]
325   0.046546 172.31.8.238 -> 54.239.132.173 TCP 66 45856 > http [ACK] Seq=98 Ack=3650409 Win=1583232 Len=0 TSval=11428215 TSecr=1685650380
326   0.046851 54.239.132.173 -> 172.31.8.238 TCP 20338 [TCP segment of a reassembled PDU]
327   0.046860 172.31.8.238 -> 54.239.132.173 TCP 66 45856 > http [ACK] Seq=98 Ack=3670681 Win=1583232 Len=0 TSval=11428215 TSecr=1685650380
328   0.046988 54.239.132.173 -> 172.31.8.238 TCP 42058 [TCP segment of a reassembled PDU]
329   0.047002 172.31.8.238 -> 54.239.132.173 TCP 66 45856 > http [ACK] Seq=98 Ack=3712673 Win=1583232 Len=0 TSval=11428215 TSecr=1685650380
330   0.047038 54.239.132.173 -> 172.31.8.238 TCP 10202 [TCP segment of a reassembled PDU]
331   0.047044 172.31.8.238 -> 54.239.132.173 TCP 66 45856 > http [ACK] Seq=98 Ack=3722809 Win=1583232 Len=0 TSval=11428215 TSecr=1685650380
332   0.047401 54.239.132.173 -> 172.31.8.238 TCP 20338 [TCP segment of a reassembled PDU]
333   0.047410 172.31.8.238 -> 54.239.132.173 TCP 66 45856 > http [ACK] Seq=98 Ack=3743081 Win=1583232 Len=0 TSval=11428215 TSecr=1685650380
334   0.047513 54.239.132.173 -> 172.31.8.238 TCP 31922 [TCP segment of a reassembled PDU]
335   0.047523 172.31.8.238 -> 54.239.132.173 TCP 66 45856 > http [ACK] Seq=98 Ack=3774937 Win=1583232 Len=0 TSval=11428215 TSecr=1685650380
336   0.047577 54.239.132.173 -> 172.31.8.238 TCP 8754 [TCP segment of a reassembled PDU]
337   0.047584 172.31.8.238 -> 54.239.132.173 TCP 66 45856 > http [ACK] Seq=98 Ack=3783625 Win=1583232 Len=0 TSval=11428215 TSecr=1685650380
338   0.048033 54.239.132.173 -> 172.31.8.238 TCP 53642 [TCP segment of a reassembled PDU]
339   0.048048 172.31.8.238 -> 54.239.132.173 TCP 66 45856 > http [ACK] Seq=98 Ack=3837201 Win=1583232 Len=0 TSval=11428216 TSecr=1685650380
340   0.048105 54.239.132.173 -> 172.31.8.238 TCP 24682 [TCP segment of a reassembled PDU]
341   0.048112 172.31.8.238 -> 54.239.132.173 TCP 66 45856 > http [ACK] Seq=98 Ack=3861817 Win=1583232 Len=0 TSval=11428216 TSecr=1685650380
342   0.048204 54.239.132.173 -> 172.31.8.238 TCP 37714 [TCP segment of a reassembled PDU]
343   0.048213 172.31.8.238 -> 54.239.132.173 TCP 66 45856 > http [ACK] Seq=98 Ack=3899465 Win=1583232 Len=0 TSval=11428216 TSecr=1685650380
344   0.048670 54.239.132.173 -> 172.31.8.238 TCP 57986 [TCP segment of a reassembled PDU]
345   0.048685 172.31.8.238 -> 54.239.132.173 TCP 66 45856 > http [ACK] Seq=98 Ack=3957385 Win=1583232 Len=0 TSval=11428216 TSecr=1685650380
346   0.048690 54.239.132.173 -> 172.31.8.238 TCP 1514 [TCP Previous segment not captured] [TCP segment of a reassembled PDU]
347   0.048693 172.31.8.238 -> 54.239.132.173 TCP 78 [TCP Dup ACK 345#1] 45856 > http [ACK] Seq=98 Ack=3957385 Win=1583232 Len=0 TSval=11428216 TSecr=1685650380 SLE=3958833 SRE=3960281
348   0.048694 54.239.132.173 -> 172.31.8.238 TCP 1514 [TCP Out-Of-Order] [TCP segment of a reassembled PDU]
349   0.048696 172.31.8.238 -> 54.239.132.173 TCP 66 45856 > http [ACK] Seq=98 Ack=3960281 Win=1583232 Len=0 TSval=11428216 TSecr=1685650380
350   0.048708 54.239.132.173 -> 172.31.8.238 TCP 1514 [TCP segment of a reassembled PDU]
351   0.048710 172.31.8.238 -> 54.239.132.173 TCP 66 45856 > http [ACK] Seq=98 Ack=3961729 Win=1583232 Len=0 TSval=11428216 TSecr=1685650380
352   0.049151 54.239.132.173 -> 172.31.8.238 TCP 17442 [TCP segment of a reassembled PDU]
353   0.049158 172.31.8.238 -> 54.239.132.173 TCP 66 45856 > http [ACK] Seq=98 Ack=3979105 Win=1583232 Len=0 TSval=11428216 TSecr=1685650380
354   0.049184 54.239.132.173 -> 172.31.8.238 TCP 44954 [TCP segment of a reassembled PDU]
355   0.049192 172.31.8.238 -> 54.239.132.173 TCP 66 45856 > http [ACK] Seq=98 Ack=4023993 Win=1583232 Len=0 TSval=11428216 TSecr=1685650380
356   0.049209 54.239.132.173 -> 172.31.8.238 TCP 7306 [TCP segment of a reassembled PDU]
357   0.049213 172.31.8.238 -> 54.239.132.173 TCP 66 45856 > http [ACK] Seq=98 Ack=4031233 Win=1583232 Len=0 TSval=11428216 TSecr=1685650380
358   0.049606 54.239.132.173 -> 172.31.8.238 TCP 55090 [TCP segment of a reassembled PDU]
359   0.049620 172.31.8.238 -> 54.239.132.173 TCP 66 45856 > http [ACK] Seq=98 Ack=4086257 Win=1583232 Len=0 TSval=11428216 TSecr=1685650380
360   0.049677 54.239.132.173 -> 172.31.8.238 TCP 23234 [TCP segment of a reassembled PDU]
361   0.049685 172.31.8.238 -> 54.239.132.173 TCP 66 45856 > http [ACK] Seq=98 Ack=4109425 Win=1583232 Len=0 TSval=11428216 TSecr=1685650380
362   0.049789 54.239.132.173 -> 172.31.8.238 TCP 4410 [TCP segment of a reassembled PDU]
363   0.049793 172.31.8.238 -> 54.239.132.173 TCP 66 45856 > http [ACK] Seq=98 Ack=4113769 Win=1583232 Len=0 TSval=11428216 TSecr=1685650380
364   0.050277 54.239.132.173 -> 172.31.8.238 TCP 14546 [TCP segment of a reassembled PDU]
365   0.050284 172.31.8.238 -> 54.239.132.173 TCP 66 45856 > http [ACK] Seq=98 Ack=4128249 Win=1583232 Len=0 TSval=11428216 TSecr=1685650380
366   0.050651 54.239.132.173 -> 172.31.8.238 TCP 20338 [TCP segment of a reassembled PDU]
367   0.050659 172.31.8.238 -> 54.239.132.173 TCP 66 45856 > http [ACK] Seq=98 Ack=4148521 Win=1583232 Len=0 TSval=11428216 TSecr=1685650380
368   0.050754 54.239.132.173 -> 172.31.8.238 TCP 31922 [TCP segment of a reassembled PDU]
369   0.050763 172.31.8.238 -> 54.239.132.173 TCP 66 45856 > http [ACK] Seq=98 Ack=4180377 Win=1583232 Len=0 TSval=11428216 TSecr=1685650380
370   0.050885 54.239.132.173 -> 172.31.8.238 TCP 30474 [TCP segment of a reassembled PDU]
371   0.050893 172.31.8.238 -> 54.239.132.173 TCP 66 45856 > http [ACK] Seq=98 Ack=4210785 Win=1583232 Len=0 TSval=11428216 TSecr=1685650380
372   0.050972 54.239.132.173 -> 172.31.8.238 TCP 29026 [TCP segment of a reassembled PDU]
373   0.050980 172.31.8.238 -> 54.239.132.173 TCP 66 45856 > http [ACK] Seq=98 Ack=4239745 Win=1583232 Len=0 TSval=11428216 TSecr=1685650380
374   0.051279 54.239.132.173 -> 172.31.8.238 TCP 11650 [TCP segment of a reassembled PDU]
375   0.051285 172.31.8.238 -> 54.239.132.173 TCP 66 45856 > http [ACK] Seq=98 Ack=4251329 Win=1583232 Len=0 TSval=11428216 TSecr=1685650380
376   0.051365 54.239.132.173 -> 172.31.8.238 TCP 21786 [TCP segment of a reassembled PDU]
377   0.051372 172.31.8.238 -> 54.239.132.173 TCP 66 45856 > http [ACK] Seq=98 Ack=4273049 Win=1583232 Len=0 TSval=11428216 TSecr=1685650380
378   0.051448 54.239.132.173 -> 172.31.8.238 TCP 23234 [TCP segment of a reassembled PDU]
379   0.051456 172.31.8.238 -> 54.239.132.173 TCP 66 45856 > http [ACK] Seq=98 Ack=4296217 Win=1583232 Len=0 TSval=11428216 TSecr=1685650380
380   0.051679 54.239.132.173 -> 172.31.8.238 TCP 8754 [TCP segment of a reassembled PDU]
381   0.051685 172.31.8.238 -> 54.239.132.173 TCP 66 45856 > http [ACK] Seq=98 Ack=4304905 Win=1583232 Len=0 TSval=11428217 TSecr=1685650380
382   0.052200 54.239.132.173 -> 172.31.8.238 TCP 30474 [TCP segment of a reassembled PDU]
383   0.052208 172.31.8.238 -> 54.239.132.173 TCP 66 45856 > http [ACK] Seq=98 Ack=4335313 Win=1583232 Len=0 TSval=11428217 TSecr=1685650380
384   0.052258 54.239.132.173 -> 172.31.8.238 TCP 21786 [TCP segment of a reassembled PDU]
385   0.052265 172.31.8.238 -> 54.239.132.173 TCP 66 45856 > http [ACK] Seq=98 Ack=4357033 Win=1583232 Len=0 TSval=11428217 TSecr=1685650380
386   0.052395 54.239.132.173 -> 172.31.8.238 TCP 40610 [TCP segment of a reassembled PDU]
387   0.052403 172.31.8.238 -> 54.239.132.173 TCP 66 45856 > http [ACK] Seq=98 Ack=4397577 Win=1583232 Len=0 TSval=11428217 TSecr=1685650380
388   0.052515 54.239.132.173 -> 172.31.8.238 TCP 37714 [TCP segment of a reassembled PDU]
389   0.052525 172.31.8.238 -> 54.239.132.173 TCP 66 45856 > http [ACK] Seq=98 Ack=4435225 Win=1583232 Len=0 TSval=11428217 TSecr=1685650380
390   0.052939 54.239.132.173 -> 172.31.8.238 TCP 7306 [TCP segment of a reassembled PDU]
391   0.052944 172.31.8.238 -> 54.239.132.173 TCP 66 45856 > http [ACK] Seq=98 Ack=4442465 Win=1583232 Len=0 TSval=11428217 TSecr=1685650380
392   0.053369 54.239.132.173 -> 172.31.8.238 TCP 17442 [TCP segment of a reassembled PDU]
393   0.053375 172.31.8.238 -> 54.239.132.173 TCP 66 45856 > http [ACK] Seq=98 Ack=4459841 Win=1583232 Len=0 TSval=11428217 TSecr=1685650380
394   0.053404 54.239.132.173 -> 172.31.8.238 TCP 8754 [TCP segment of a reassembled PDU]
395   0.053409 172.31.8.238 -> 54.239.132.173 TCP 66 45856 > http [ACK] Seq=98 Ack=4468529 Win=1583232 Len=0 TSval=11428217 TSecr=1685650380
396   0.053559 54.239.132.173 -> 172.31.8.238 TCP 53642 [TCP segment of a reassembled PDU]
397   0.053569 172.31.8.238 -> 54.239.132.173 TCP 66 45856 > http [ACK] Seq=98 Ack=4522105 Win=1583232 Len=0 TSval=11428217 TSecr=1685650380
398   0.053651 54.239.132.173 -> 172.31.8.238 TCP 43506 [TCP segment of a reassembled PDU]
399   0.053660 172.31.8.238 -> 54.239.132.173 TCP 66 45856 > http [ACK] Seq=98 Ack=4565545 Win=1583232 Len=0 TSval=11428217 TSecr=1685650380
400   0.054008 54.239.132.173 -> 172.31.8.238 TCP 10202 [TCP segment of a reassembled PDU]
401   0.054014 172.31.8.238 -> 54.239.132.173 TCP 66 45856 > http [ACK] Seq=98 Ack=4575681 Win=1583232 Len=0 TSval=11428217 TSecr=1685650381
402   0.054526 54.239.132.173 -> 172.31.8.238 TCP 62330 [TCP segment of a reassembled PDU]
403   0.054541 172.31.8.238 -> 54.239.132.173 TCP 66 45856 > http [ACK] Seq=98 Ack=4637945 Win=1583232 Len=0 TSval=11428217 TSecr=1685650381
404   0.054584 54.239.132.173 -> 172.31.8.238 TCP 15994 [TCP segment of a reassembled PDU]
405   0.054594 172.31.8.238 -> 54.239.132.173 TCP 66 45856 > http [ACK] Seq=98 Ack=4653873 Win=1583232 Len=0 TSval=11428217 TSecr=1685650381
406   0.054686 54.239.132.173 -> 172.31.8.238 TCP 42058 [TCP segment of a reassembled PDU]
407   0.054696 172.31.8.238 -> 54.239.132.173 TCP 66 45856 > http [ACK] Seq=98 Ack=4695865 Win=1583232 Len=0 TSval=11428217 TSecr=1685650381
408   0.055058 54.239.132.173 -> 172.31.8.238 TCP 14546 [TCP segment of a reassembled PDU]
409   0.055065 172.31.8.238 -> 54.239.132.173 TCP 66 45856 > http [ACK] Seq=98 Ack=4710345 Win=1583232 Len=0 TSval=11428217 TSecr=1685650381
410   0.055658 54.239.132.173 -> 172.31.8.238 TCP 47850 [TCP segment of a reassembled PDU]
411   0.055670 172.31.8.238 -> 54.239.132.173 TCP 66 45856 > http [ACK] Seq=98 Ack=4758129 Win=1583232 Len=0 TSval=11428217 TSecr=1685650381
412   0.055718 54.239.132.173 -> 172.31.8.238 TCP 4410 [TCP segment of a reassembled PDU]
413   0.055723 172.31.8.238 -> 54.239.132.173 TCP 66 45856 > http [ACK] Seq=98 Ack=4762473 Win=1583232 Len=0 TSval=11428218 TSecr=1685650381
414   0.055890 54.239.132.173 -> 172.31.8.238 TCP 57986 [TCP segment of a reassembled PDU]
415   0.055904 172.31.8.238 -> 54.239.132.173 TCP 66 45856 > http [ACK] Seq=98 Ack=4820393 Win=1583232 Len=0 TSval=11428218 TSecr=1685650381
416   0.056004 54.239.132.173 -> 172.31.8.238 TCP 43506 [TCP segment of a reassembled PDU]
417   0.056016 172.31.8.238 -> 54.239.132.173 TCP 66 45856 > http [ACK] Seq=98 Ack=4863833 Win=1583232 Len=0 TSval=11428218 TSecr=1685650381
418   0.056083 54.239.132.173 -> 172.31.8.238 TCP 18890 [TCP segment of a reassembled PDU]
419   0.056089 172.31.8.238 -> 54.239.132.173 TCP 66 45856 > http [ACK] Seq=98 Ack=4882657 Win=1583232 Len=0 TSval=11428218 TSecr=1685650381
420   0.056162 54.239.132.173 -> 172.31.8.238 TCP 8754 [TCP segment of a reassembled PDU]
421   0.056167 172.31.8.238 -> 54.239.132.173 TCP 66 45856 > http [ACK] Seq=98 Ack=4891345 Win=1583232 Len=0 TSval=11428218 TSecr=1685650381
422   0.056318 54.239.132.173 -> 172.31.8.238 TCP 11650 [TCP segment of a reassembled PDU]
423   0.056325 172.31.8.238 -> 54.239.132.173 TCP 66 45856 > http [ACK] Seq=98 Ack=4902929 Win=1583232 Len=0 TSval=11428218 TSecr=1685650381
424   0.057059 54.239.132.173 -> 172.31.8.238 TCP 42058 [TCP segment of a reassembled PDU]
425   0.057072 172.31.8.238 -> 54.239.132.173 TCP 66 45856 > http [ACK] Seq=98 Ack=4944921 Win=1583232 Len=0 TSval=11428218 TSecr=1685650381
426   0.057122 54.239.132.173 -> 172.31.8.238 TCP 11650 [TCP segment of a reassembled PDU]
427   0.057129 172.31.8.238 -> 54.239.132.173 TCP 66 45856 > http [ACK] Seq=98 Ack=4956505 Win=1583232 Len=0 TSval=11428218 TSecr=1685650381
428   0.057294 54.239.132.173 -> 172.31.8.238 TCP 50746 [TCP segment of a reassembled PDU]
429   0.057305 172.31.8.238 -> 54.239.132.173 TCP 66 45856 > http [ACK] Seq=98 Ack=5007185 Win=1583232 Len=0 TSval=11428218 TSecr=1685650381
430   0.057340 54.239.132.173 -> 172.31.8.238 TCP 1514 [TCP segment of a reassembled PDU]
431   0.057512 54.239.132.173 -> 172.31.8.238 TCP 60882 [TCP segment of a reassembled PDU]
432   0.057527 172.31.8.238 -> 54.239.132.173 TCP 66 45856 > http [ACK] Seq=98 Ack=5069449 Win=1583232 Len=0 TSval=11428218 TSecr=1685650381
433   0.057560 54.239.132.173 -> 172.31.8.238 TCP 17442 [TCP segment of a reassembled PDU]
434   0.057565 172.31.8.238 -> 54.239.132.173 TCP 66 45856 > http [ACK] Seq=98 Ack=5086825 Win=1583232 Len=0 TSval=11428218 TSecr=1685650381
435   0.058553 54.239.132.173 -> 172.31.8.238 TCP 44954 [TCP segment of a reassembled PDU]
436   0.058563 172.31.8.238 -> 54.239.132.173 TCP 66 45856 > http [ACK] Seq=98 Ack=5131713 Win=1583232 Len=0 TSval=11428218 TSecr=1685650381
437   0.058584 54.239.132.173 -> 172.31.8.238 TCP 7306 [TCP segment of a reassembled PDU]
438   0.058588 172.31.8.238 -> 54.239.132.173 TCP 66 45856 > http [ACK] Seq=98 Ack=5138953 Win=1583232 Len=0 TSval=11428218 TSecr=1685650381
439   0.058713 54.239.132.173 -> 172.31.8.238 TCP 13098 [TCP segment of a reassembled PDU]
440   0.058719 172.31.8.238 -> 54.239.132.173 TCP 66 45856 > http [ACK] Seq=98 Ack=5151985 Win=1583232 Len=0 TSval=11428218 TSecr=1685650381
441   0.058745 54.239.132.173 -> 172.31.8.238 TCP 42058 [TCP segment of a reassembled PDU]
442   0.058752 172.31.8.238 -> 54.239.132.173 TCP 66 45856 > http [ACK] Seq=98 Ack=5193977 Win=1583232 Len=0 TSval=11428218 TSecr=1685650381
443   0.058793 54.239.132.173 -> 172.31.8.238 TCP 10202 [TCP segment of a reassembled PDU]
444   0.058797 172.31.8.238 -> 54.239.132.173 TCP 66 45856 > http [ACK] Seq=98 Ack=5204113 Win=1583232 Len=0 TSval=11428218 TSecr=1685650381
445   0.058994 54.239.132.173 -> 172.31.8.238 TCP 52194 [TCP segment of a reassembled PDU]
446   0.059004 172.31.8.238 -> 54.239.132.173 TCP 66 45856 > http [ACK] Seq=98 Ack=5256241 Win=1583232 Len=0 TSval=11428218 TSecr=1685650381
447   0.059507 54.239.132.173 -> 172.31.8.238 TCP 30474 [TCP segment of a reassembled PDU]
448   0.059515 172.31.8.238 -> 54.239.132.173 TCP 66 45856 > http [ACK] Seq=98 Ack=5286649 Win=1583232 Len=0 TSval=11428218 TSecr=1685650381
449   0.059554 54.239.132.173 -> 172.31.8.238 TCP 31922 [TCP segment of a reassembled PDU]
450   0.059564 172.31.8.238 -> 54.239.132.173 TCP 66 45856 > http [ACK] Seq=98 Ack=5318505 Win=1583232 Len=0 TSval=11428218 TSecr=1685650381
451   0.059722 54.239.132.173 -> 172.31.8.238 TCP 46402 [TCP segment of a reassembled PDU]
452   0.059732 172.31.8.238 -> 54.239.132.173 TCP 66 45856 > http [ACK] Seq=98 Ack=5364841 Win=1583232 Len=0 TSval=11428219 TSecr=1685650381
453   0.060027 54.239.132.173 -> 172.31.8.238 TCP 62330 [TCP segment of a reassembled PDU]
454   0.060039 172.31.8.238 -> 54.239.132.173 TCP 66 45856 > http [ACK] Seq=98 Ack=5427105 Win=1583232 Len=0 TSval=11428219 TSecr=1685650381
455   0.060087 54.239.132.173 -> 172.31.8.238 TCP 14546 [TCP segment of a reassembled PDU]
456   0.060092 172.31.8.238 -> 54.239.132.173 TCP 66 45856 > http [ACK] Seq=98 Ack=5441585 Win=1583232 Len=0 TSval=11428219 TSecr=1685650381
457   0.060190 54.239.132.173 -> 172.31.8.238 TCP 36266 [TCP segment of a reassembled PDU]
458   0.060198 172.31.8.238 -> 54.239.132.173 TCP 66 45856 > http [ACK] Seq=98 Ack=5477785 Win=1583232 Len=0 TSval=11428219 TSecr=1685650381
459   0.061066 54.239.132.173 -> 172.31.8.238 TCP 62330 [TCP segment of a reassembled PDU]
460   0.061078 172.31.8.238 -> 54.239.132.173 TCP 66 45856 > http [ACK] Seq=98 Ack=5540049 Win=1583232 Len=0 TSval=11428219 TSecr=1685650381
461   0.061095 54.239.132.173 -> 172.31.8.238 TCP 2962 [TCP segment of a reassembled PDU]
462   0.061100 172.31.8.238 -> 54.239.132.173 TCP 66 45856 > http [ACK] Seq=98 Ack=5542945 Win=1583232 Len=0 TSval=11428219 TSecr=1685650381
463   0.061274 54.239.132.173 -> 172.31.8.238 TCP 59434 [TCP segment of a reassembled PDU]
464   0.061287 172.31.8.238 -> 54.239.132.173 TCP 66 45856 > http [ACK] Seq=98 Ack=5602313 Win=1583232 Len=0 TSval=11428219 TSecr=1685650381
465   0.061340 54.239.132.173 -> 172.31.8.238 TCP 18890 [TCP segment of a reassembled PDU]
466   0.061346 172.31.8.238 -> 54.239.132.173 TCP 66 45856 > http [ACK] Seq=98 Ack=5621137 Win=1583232 Len=0 TSval=11428219 TSecr=1685650381
467   0.061476 54.239.132.173 -> 172.31.8.238 TCP 43506 [TCP segment of a reassembled PDU]
468   0.061485 172.31.8.238 -> 54.239.132.173 TCP 66 45856 > http [ACK] Seq=98 Ack=5664577 Win=1583232 Len=0 TSval=11428219 TSecr=1685650381
469   0.061545 54.239.132.173 -> 172.31.8.238 TCP 8754 [TCP segment of a reassembled PDU]
470   0.061550 172.31.8.238 -> 54.239.132.173 TCP 66 45856 > http [ACK] Seq=98 Ack=5673265 Win=1583232 Len=0 TSval=11428219 TSecr=1685650381
471   0.062117 54.239.132.173 -> 172.31.8.238 TCP 53642 [TCP segment of a reassembled PDU]
472   0.062129 172.31.8.238 -> 54.239.132.173 TCP 66 45856 > http [ACK] Seq=98 Ack=5726841 Win=1583232 Len=0 TSval=11428219 TSecr=1685650381
473   0.062236 54.239.132.173 -> 172.31.8.238 TCP 24682 [TCP segment of a reassembled PDU]
474   0.062244 172.31.8.238 -> 54.239.132.173 TCP 66 45856 > http [ACK] Seq=98 Ack=5751457 Win=1583232 Len=0 TSval=11428219 TSecr=1685650381
475   0.062481 54.239.132.173 -> 172.31.8.238 TCP 37714 [TCP segment of a reassembled PDU]
476   0.062490 172.31.8.238 -> 54.239.132.173 TCP 66 45856 > http [ACK] Seq=98 Ack=5789105 Win=1583232 Len=0 TSval=11428219 TSecr=1685650381
477   0.062568 54.239.132.173 -> 172.31.8.238 TCP 18890 [TCP segment of a reassembled PDU]
478   0.062575 172.31.8.238 -> 54.239.132.173 TCP 66 45856 > http [ACK] Seq=98 Ack=5807929 Win=1583232 Len=0 TSval=11428219 TSecr=1685650381
479   0.062680 54.239.132.173 -> 172.31.8.238 TCP 43506 [TCP segment of a reassembled PDU]
480   0.062689 172.31.8.238 -> 54.239.132.173 TCP 66 45856 > http [ACK] Seq=98 Ack=5851369 Win=1583232 Len=0 TSval=11428219 TSecr=1685650381
481   0.062802 54.239.132.173 -> 172.31.8.238 TCP 24682 [TCP segment of a reassembled PDU]
482   0.062809 172.31.8.238 -> 54.239.132.173 TCP 66 45856 > http [ACK] Seq=98 Ack=5875985 Win=1583232 Len=0 TSval=11428219 TSecr=1685650381
483   0.063144 54.239.132.173 -> 172.31.8.238 TCP 37714 [TCP segment of a reassembled PDU]
484   0.063153 172.31.8.238 -> 54.239.132.173 TCP 66 45856 > http [ACK] Seq=98 Ack=5913633 Win=1583232 Len=0 TSval=11428219 TSecr=1685650381
485   0.063210 54.239.132.173 -> 172.31.8.238 TCP 20338 [TCP segment of a reassembled PDU]
486   0.063217 172.31.8.238 -> 54.239.132.173 TCP 66 45856 > http [ACK] Seq=98 Ack=5933905 Win=1583232 Len=0 TSval=11428219 TSecr=1685650381
487   0.063739 54.239.132.173 -> 172.31.8.238 TCP 42058 [TCP segment of a reassembled PDU]
488   0.063748 172.31.8.238 -> 54.239.132.173 TCP 66 45856 > http [ACK] Seq=98 Ack=5975897 Win=1583232 Len=0 TSval=11428220 TSecr=1685650381
489   0.063783 54.239.132.173 -> 172.31.8.238 TCP 17442 [TCP segment of a reassembled PDU]
490   0.063790 172.31.8.238 -> 54.239.132.173 TCP 66 45856 > http [ACK] Seq=98 Ack=5993273 Win=1583232 Len=0 TSval=11428220 TSecr=1685650381
491   0.063882 54.239.132.173 -> 172.31.8.238 TCP 5858 [TCP segment of a reassembled PDU]
492   0.063887 172.31.8.238 -> 54.239.132.173 TCP 66 45856 > http [ACK] Seq=98 Ack=5999065 Win=1583232 Len=0 TSval=11428220 TSecr=1685650381
493   0.063910 54.239.132.173 -> 172.31.8.238 TCP 39162 [TCP segment of a reassembled PDU]
494   0.063917 172.31.8.238 -> 54.239.132.173 TCP 66 45856 > http [ACK] Seq=98 Ack=6038161 Win=1583232 Len=0 TSval=11428220 TSecr=1685650382
495   0.064050 54.239.132.173 -> 172.31.8.238 TCP 26130 [TCP segment of a reassembled PDU]
496   0.064058 172.31.8.238 -> 54.239.132.173 TCP 66 45856 > http [ACK] Seq=98 Ack=6064225 Win=1583232 Len=0 TSval=11428220 TSecr=1685650382
497   0.064535 54.239.132.173 -> 172.31.8.238 TCP 36266 [TCP segment of a reassembled PDU]
498   0.064543 172.31.8.238 -> 54.239.132.173 TCP 66 45856 > http [ACK] Seq=98 Ack=6100425 Win=1583232 Len=0 TSval=11428220 TSecr=1685650382
499   0.064617 54.239.132.173 -> 172.31.8.238 TCP 29026 [TCP segment of a reassembled PDU]
500   0.064624 172.31.8.238 -> 54.239.132.173 TCP 66 45856 > http [ACK] Seq=98 Ack=6129385 Win=1583232 Len=0 TSval=11428220 TSecr=1685650382
501   0.064732 54.239.132.173 -> 172.31.8.238 TCP 33370 [TCP segment of a reassembled PDU]
502   0.064740 172.31.8.238 -> 54.239.132.173 TCP 66 45856 > http [ACK] Seq=98 Ack=6162689 Win=1583232 Len=0 TSval=11428220 TSecr=1685650382
503   0.064825 54.239.132.173 -> 172.31.8.238 TCP 31922 [TCP segment of a reassembled PDU]
504   0.064833 172.31.8.238 -> 54.239.132.173 TCP 66 45856 > http [ACK] Seq=98 Ack=6194545 Win=1583232 Len=0 TSval=11428220 TSecr=1685650382
505   0.065789 54.239.132.173 -> 172.31.8.238 TCP 30474 [TCP segment of a reassembled PDU]
506   0.065797 172.31.8.238 -> 54.239.132.173 TCP 66 45856 > http [ACK] Seq=98 Ack=6224953 Win=1583232 Len=0 TSval=11428220 TSecr=1685650382
507   0.065839 54.239.132.173 -> 172.31.8.238 TCP 21786 [TCP segment of a reassembled PDU]
508   0.065844 172.31.8.238 -> 54.239.132.173 TCP 66 45856 > http [ACK] Seq=98 Ack=6246673 Win=1583232 Len=0 TSval=11428220 TSecr=1685650382
509   0.065949 54.239.132.173 -> 172.31.8.238 TCP 40610 [TCP segment of a reassembled PDU]
510   0.065958 172.31.8.238 -> 54.239.132.173 TCP 66 45856 > http [ACK] Seq=98 Ack=6287217 Win=1583232 Len=0 TSval=11428220 TSecr=1685650382
511   0.066004 54.239.132.173 -> 172.31.8.238 TCP 11650 [TCP segment of a reassembled PDU]
512   0.066009 172.31.8.238 -> 54.239.132.173 TCP 66 45856 > http [ACK] Seq=98 Ack=6298801 Win=1583232 Len=0 TSval=11428220 TSecr=1685650382
513   0.066113 54.239.132.173 -> 172.31.8.238 TCP 26130 [TCP segment of a reassembled PDU]
514   0.066119 172.31.8.238 -> 54.239.132.173 TCP 66 45856 > http [ACK] Seq=98 Ack=6324865 Win=1583232 Len=0 TSval=11428220 TSecr=1685650382
515   0.066140 54.239.132.173 -> 172.31.8.238 TCP 24682 [TCP segment of a reassembled PDU]
516   0.066145 172.31.8.238 -> 54.239.132.173 TCP 66 45856 > http [ACK] Seq=98 Ack=6349481 Win=1583232 Len=0 TSval=11428220 TSecr=1685650382
517   0.066179 54.239.132.173 -> 172.31.8.238 TCP 1514 [TCP segment of a reassembled PDU]
518   0.066384 54.239.132.173 -> 172.31.8.238 TCP 60882 [TCP segment of a reassembled PDU]
519   0.066395 172.31.8.238 -> 54.239.132.173 TCP 66 45856 > http [ACK] Seq=98 Ack=6411745 Win=1583232 Len=0 TSval=11428220 TSecr=1685650382
520   0.066442 54.239.132.173 -> 172.31.8.238 TCP 17442 [TCP segment of a reassembled PDU]
521   0.066450 172.31.8.238 -> 54.239.132.173 TCP 66 45856 > http [ACK] Seq=98 Ack=6429121 Win=1583232 Len=0 TSval=11428220 TSecr=1685650382
522   0.066568 54.239.132.173 -> 172.31.8.238 TCP 26130 [TCP segment of a reassembled PDU]
523   0.066574 172.31.8.238 -> 54.239.132.173 TCP 66 45856 > http [ACK] Seq=98 Ack=6455185 Win=1583232 Len=0 TSval=11428220 TSecr=1685650382
524   0.067385 54.239.132.173 -> 172.31.8.238 TCP 10202 [TCP segment of a reassembled PDU]
525   0.067391 172.31.8.238 -> 54.239.132.173 TCP 66 45856 > http [ACK] Seq=98 Ack=6465321 Win=1583232 Len=0 TSval=11428220 TSecr=1685650382
526   0.067399 54.239.132.173 -> 172.31.8.238 TCP 8754 [TCP segment of a reassembled PDU]
527   0.067402 172.31.8.238 -> 54.239.132.173 TCP 66 45856 > http [ACK] Seq=98 Ack=6474009 Win=1583232 Len=0 TSval=11428220 TSecr=1685650382
528   0.067428 54.239.132.173 -> 172.31.8.238 TCP 17442 [TCP segment of a reassembled PDU]
529   0.067433 172.31.8.238 -> 54.239.132.173 TCP 66 45856 > http [ACK] Seq=98 Ack=6491385 Win=1583232 Len=0 TSval=11428220 TSecr=1685650382
530   0.067592 54.239.132.173 -> 172.31.8.238 TCP 36266 [TCP segment of a reassembled PDU]
531   0.067600 172.31.8.238 -> 54.239.132.173 TCP 66 45856 > http [ACK] Seq=98 Ack=6527585 Win=1583232 Len=0 TSval=11428220 TSecr=1685650382
532   0.067690 54.239.132.173 -> 172.31.8.238 TCP 42058 [TCP segment of a reassembled PDU]
533   0.067700 172.31.8.238 -> 54.239.132.173 TCP 66 45856 > http [ACK] Seq=98 Ack=6569577 Win=1583232 Len=0 TSval=11428221 TSecr=1685650382
534   0.067781 54.239.132.173 -> 172.31.8.238 TCP 20338 [TCP segment of a reassembled PDU]
535   0.067787 172.31.8.238 -> 54.239.132.173 TCP 66 45856 > http [ACK] Seq=98 Ack=6589849 Win=1583232 Len=0 TSval=11428221 TSecr=1685650382
536   0.067896 54.239.132.173 -> 172.31.8.238 TCP 31922 [TCP segment of a reassembled PDU]
537   0.067903 172.31.8.238 -> 54.239.132.173 TCP 66 45856 > http [ACK] Seq=98 Ack=6621705 Win=1583232 Len=0 TSval=11428221 TSecr=1685650382
538   0.067997 54.239.132.173 -> 172.31.8.238 TCP 30474 [TCP segment of a reassembled PDU]
539   0.068006 172.31.8.238 -> 54.239.132.173 TCP 66 45856 > http [ACK] Seq=98 Ack=6652113 Win=1583232 Len=0 TSval=11428221 TSecr=1685650382
540   0.068093 54.239.132.173 -> 172.31.8.238 TCP 37714 [TCP segment of a reassembled PDU]
541   0.068102 172.31.8.238 -> 54.239.132.173 TCP 66 45856 > http [ACK] Seq=98 Ack=6689761 Win=1583232 Len=0 TSval=11428221 TSecr=1685650382
542   0.068183 54.239.132.173 -> 172.31.8.238 TCP 24682 [TCP segment of a reassembled PDU]
543   0.068190 172.31.8.238 -> 54.239.132.173 TCP 66 45856 > http [ACK] Seq=98 Ack=6714377 Win=1583232 Len=0 TSval=11428221 TSecr=1685650382
544   0.068225 54.239.132.173 -> 172.31.8.238 TCP 1514 [TCP segment of a reassembled PDU]
545   0.068478 54.239.132.173 -> 172.31.8.238 TCP 20338 [TCP segment of a reassembled PDU]
546   0.068485 172.31.8.238 -> 54.239.132.173 TCP 66 45856 > http [ACK] Seq=98 Ack=6736097 Win=1583232 Len=0 TSval=11428221 TSecr=1685650382
547   0.069166 54.239.132.173 -> 172.31.8.238 TCP 40610 [TCP segment of a reassembled PDU]
548   0.069175 172.31.8.238 -> 54.239.132.173 TCP 66 45856 > http [ACK] Seq=98 Ack=6776641 Win=1583232 Len=0 TSval=11428221 TSecr=1685650382
549   0.069249 54.239.132.173 -> 172.31.8.238 TCP 4410 [TCP segment of a reassembled PDU]
550   0.069256 172.31.8.238 -> 54.239.132.173 TCP 66 45856 > http [ACK] Seq=98 Ack=6780985 Win=1583232 Len=0 TSval=11428221 TSecr=1685650382
551   0.069270 54.239.132.173 -> 172.31.8.238 TCP 26130 [TCP segment of a reassembled PDU]
552   0.069275 172.31.8.238 -> 54.239.132.173 TCP 66 45856 > http [ACK] Seq=98 Ack=6807049 Win=1583232 Len=0 TSval=11428221 TSecr=1685650382
553   0.069358 54.239.132.173 -> 172.31.8.238 TCP 31922 [TCP segment of a reassembled PDU]
554   0.069366 172.31.8.238 -> 54.239.132.173 TCP 66 45856 > http [ACK] Seq=98 Ack=6838905 Win=1583232 Len=0 TSval=11428221 TSecr=1685650382
555   0.069557 54.239.132.173 -> 172.31.8.238 TCP 62330 [TCP segment of a reassembled PDU]
556   0.069569 172.31.8.238 -> 54.239.132.173 TCP 66 45856 > http [ACK] Seq=98 Ack=6901169 Win=1583232 Len=0 TSval=11428221 TSecr=1685650382
557   0.069607 54.239.132.173 -> 172.31.8.238 TCP 10202 [TCP segment of a reassembled PDU]
558   0.069612 172.31.8.238 -> 54.239.132.173 TCP 66 45856 > http [ACK] Seq=98 Ack=6911305 Win=1583232 Len=0 TSval=11428221 TSecr=1685650382
559   0.069744 54.239.132.173 -> 172.31.8.238 TCP 52194 [TCP segment of a reassembled PDU]
560   0.069754 172.31.8.238 -> 54.239.132.173 TCP 66 45856 > http [ACK] Seq=98 Ack=6963433 Win=1583232 Len=0 TSval=11428221 TSecr=1685650382
561   0.069802 54.239.132.173 -> 172.31.8.238 TCP 13098 [TCP segment of a reassembled PDU]
562   0.069807 172.31.8.238 -> 54.239.132.173 TCP 66 45856 > http [ACK] Seq=98 Ack=6976465 Win=1583232 Len=0 TSval=11428221 TSecr=1685650382
563   0.070083 54.239.132.173 -> 172.31.8.238 TCP 13098 [TCP segment of a reassembled PDU]
564   0.070089 172.31.8.238 -> 54.239.132.173 TCP 66 45856 > http [ACK] Seq=98 Ack=6989497 Win=1583232 Len=0 TSval=11428221 TSecr=1685650382
565   0.070814 54.239.132.173 -> 172.31.8.238 TCP 36266 [TCP segment of a reassembled PDU]
566   0.070822 172.31.8.238 -> 54.239.132.173 TCP 66 45856 > http [ACK] Seq=98 Ack=7025697 Win=1583232 Len=0 TSval=11428221 TSecr=1685650382
567   0.070868 54.239.132.173 -> 172.31.8.238 TCP 7306 [TCP segment of a reassembled PDU]
568   0.070873 172.31.8.238 -> 54.239.132.173 TCP 66 45856 > http [ACK] Seq=98 Ack=7032937 Win=1583232 Len=0 TSval=11428221 TSecr=1685650382
569   0.070878 54.239.132.173 -> 172.31.8.238 TCP 1514 [TCP Previous segment not captured] [TCP segment of a reassembled PDU]
570   0.070881 172.31.8.238 -> 54.239.132.173 TCP 78 [TCP Dup ACK 568#1] 45856 > http [ACK] Seq=98 Ack=7032937 Win=1583232 Len=0 TSval=11428221 TSecr=1685650382 SLE=7034385 SRE=7035833
571   0.070980 54.239.132.173 -> 172.31.8.238 TCP 1514 [TCP Out-Of-Order] [TCP segment of a reassembled PDU]
572   0.070986 172.31.8.238 -> 54.239.132.173 TCP 66 45856 > http [ACK] Seq=98 Ack=7035833 Win=1583232 Len=0 TSval=11428221 TSecr=1685650382
573   0.071013 54.239.132.173 -> 172.31.8.238 TCP 52194 [TCP segment of a reassembled PDU]
574   0.071021 172.31.8.238 -> 54.239.132.173 TCP 66 45856 > http [ACK] Seq=98 Ack=7087961 Win=1583232 Len=0 TSval=11428221 TSecr=1685650382
575   0.071183 54.239.132.173 -> 172.31.8.238 TCP 62330 [TCP segment of a reassembled PDU]
576   0.071195 172.31.8.238 -> 54.239.132.173 TCP 66 45856 > http [ACK] Seq=98 Ack=7150225 Win=1583232 Len=0 TSval=11428221 TSecr=1685650382
577   0.071350 54.239.132.173 -> 172.31.8.238 TCP 62330 [TCP segment of a reassembled PDU]
578   0.071361 172.31.8.238 -> 54.239.132.173 TCP 66 45856 > http [ACK] Seq=98 Ack=7212489 Win=1583232 Len=0 TSval=11428221 TSecr=1685650382
579   0.071590 54.239.132.173 -> 172.31.8.238 TCP 5858 [TCP segment of a reassembled PDU]
580   0.071595 172.31.8.238 -> 54.239.132.173 TCP 66 45856 > http [ACK] Seq=98 Ack=7218281 Win=1583232 Len=0 TSval=11428221 TSecr=1685650382
581   0.071721 54.239.132.173 -> 172.31.8.238 TCP 56538 [TCP segment of a reassembled PDU]
582   0.071731 172.31.8.238 -> 54.239.132.173 TCP 66 45856 > http [ACK] Seq=98 Ack=7274753 Win=1583232 Len=0 TSval=11428222 TSecr=1685650382
583   0.071812 54.239.132.173 -> 172.31.8.238 TCP 31922 [TCP segment of a reassembled PDU]
584   0.071820 172.31.8.238 -> 54.239.132.173 TCP 66 45856 > http [ACK] Seq=98 Ack=7306609 Win=1583232 Len=0 TSval=11428222 TSecr=1685650382
585   0.072096 54.239.132.173 -> 172.31.8.238 TCP 30474 [TCP segment of a reassembled PDU]
586   0.072104 172.31.8.238 -> 54.239.132.173 TCP 66 45856 > http [ACK] Seq=98 Ack=7337017 Win=1583232 Len=0 TSval=11428222 TSecr=1685650382
587   0.072179 54.239.132.173 -> 172.31.8.238 TCP 30474 [TCP segment of a reassembled PDU]
588   0.072187 172.31.8.238 -> 54.239.132.173 TCP 66 45856 > http [ACK] Seq=98 Ack=7367425 Win=1583232 Len=0 TSval=11428222 TSecr=1685650382
589   0.072535 54.239.132.173 -> 172.31.8.238 TCP 21786 [TCP segment of a reassembled PDU]
590   0.072542 172.31.8.238 -> 54.239.132.173 TCP 66 45856 > http [ACK] Seq=98 Ack=7389145 Win=1583232 Len=0 TSval=11428222 TSecr=1685650382
591   0.073188 54.239.132.173 -> 172.31.8.238 TCP 62330 [TCP segment of a reassembled PDU]
592   0.073212 172.31.8.238 -> 54.239.132.173 TCP 66 45856 > http [ACK] Seq=98 Ack=7451409 Win=1583232 Len=0 TSval=11428222 TSecr=1685650382
593   0.073258 54.239.132.173 -> 172.31.8.238 TCP 15994 [TCP segment of a reassembled PDU]
594   0.073266 172.31.8.238 -> 54.239.132.173 TCP 66 45856 > http [ACK] Seq=98 Ack=7467337 Win=1583232 Len=0 TSval=11428222 TSecr=1685650382
595   0.073359 54.239.132.173 -> 172.31.8.238 TCP 30474 [TCP segment of a reassembled PDU]
596   0.073365 172.31.8.238 -> 54.239.132.173 TCP 66 45856 > http [ACK] Seq=98 Ack=7497745 Win=1583232 Len=0 TSval=11428222 TSecr=1685650382
597   0.073385 54.239.132.173 -> 172.31.8.238 TCP 15994 [TCP segment of a reassembled PDU]
598   0.073393 172.31.8.238 -> 54.239.132.173 TCP 66 45856 > http [ACK] Seq=98 Ack=7513673 Win=1583232 Len=0 TSval=11428222 TSecr=1685650382
599   0.073425 54.239.132.173 -> 172.31.8.238 TCP 10202 [TCP segment of a reassembled PDU]
600   0.073430 172.31.8.238 -> 54.239.132.173 TCP 66 45856 > http [ACK] Seq=98 Ack=7523809 Win=1583232 Len=0 TSval=11428222 TSecr=1685650382
601   0.073619 54.239.132.173 -> 172.31.8.238 TCP 52194 [TCP segment of a reassembled PDU]
602   0.073628 172.31.8.238 -> 54.239.132.173 TCP 66 45856 > http [ACK] Seq=98 Ack=7575937 Win=1583232 Len=0 TSval=11428222 TSecr=1685650382
603   0.073872 54.239.132.173 -> 172.31.8.238 TCP 52194 [TCP segment of a reassembled PDU]
604   0.073883 172.31.8.238 -> 54.239.132.173 TCP 66 45856 > http [ACK] Seq=98 Ack=7628065 Win=1583232 Len=0 TSval=11428222 TSecr=1685650382
605   0.073893 54.239.132.173 -> 172.31.8.238 TCP 10202 [TCP segment of a reassembled PDU]
606   0.073897 172.31.8.238 -> 54.239.132.173 TCP 66 45856 > http [ACK] Seq=98 Ack=7638201 Win=1583232 Len=0 TSval=11428222 TSecr=1685650383
607   0.074155 54.239.132.173 -> 172.31.8.238 TCP 52194 [TCP segment of a reassembled PDU]
608   0.074166 172.31.8.238 -> 54.239.132.173 TCP 66 45856 > http [ACK] Seq=98 Ack=7690329 Win=1583232 Len=0 TSval=11428222 TSecr=1685650383
609   0.074689 54.239.132.173 -> 172.31.8.238 TCP 62330 [TCP segment of a reassembled PDU]
610   0.074701 172.31.8.238 -> 54.239.132.173 TCP 66 45856 > http [ACK] Seq=98 Ack=7752593 Win=1583232 Len=0 TSval=11428222 TSecr=1685650383
611   0.074744 54.239.132.173 -> 172.31.8.238 TCP 11650 [TCP segment of a reassembled PDU]
612   0.074749 172.31.8.238 -> 54.239.132.173 TCP 66 45856 > http [ACK] Seq=98 Ack=7764177 Win=1583232 Len=0 TSval=11428222 TSecr=1685650383
613   0.074879 54.239.132.173 -> 172.31.8.238 TCP 50746 [TCP segment of a reassembled PDU]
614   0.074889 172.31.8.238 -> 54.239.132.173 TCP 66 45856 > http [ACK] Seq=98 Ack=7814857 Win=1583232 Len=0 TSval=11428222 TSecr=1685650383
615   0.074923 54.239.132.173 -> 172.31.8.238 TCP 8754 [TCP segment of a reassembled PDU]
616   0.074927 172.31.8.238 -> 54.239.132.173 TCP 66 45856 > http [ACK] Seq=98 Ack=7823545 Win=1583232 Len=0 TSval=11428222 TSecr=1685650383
617   0.075721 54.239.132.173 -> 172.31.8.238 TCP 53642 [TCP segment of a reassembled PDU]
618   0.075732 172.31.8.238 -> 54.239.132.173 TCP 66 45856 > http [ACK] Seq=98 Ack=7877121 Win=1583232 Len=0 TSval=11428223 TSecr=1685650383
619   0.075775 54.239.132.173 -> 172.31.8.238 TCP 24682 [TCP segment of a reassembled PDU]
620   0.075782 172.31.8.238 -> 54.239.132.173 TCP 66 45856 > http [ACK] Seq=98 Ack=7901737 Win=1583232 Len=0 TSval=11428223 TSecr=1685650383
621   0.075888 54.239.132.173 -> 172.31.8.238 TCP 37714 [TCP segment of a reassembled PDU]
622   0.075895 172.31.8.238 -> 54.239.132.173 TCP 66 45856 > http [ACK] Seq=98 Ack=7939385 Win=1583232 Len=0 TSval=11428223 TSecr=1685650383
623   0.075986 54.239.132.173 -> 172.31.8.238 TCP 40610 [TCP segment of a reassembled PDU]
624   0.075994 172.31.8.238 -> 54.239.132.173 TCP 66 45856 > http [ACK] Seq=98 Ack=7979929 Win=1583232 Len=0 TSval=11428223 TSecr=1685650383
625   0.076058 54.239.132.173 -> 172.31.8.238 TCP 21786 [TCP segment of a reassembled PDU]
626   0.076064 172.31.8.238 -> 54.239.132.173 TCP 66 45856 > http [ACK] Seq=98 Ack=8001649 Win=1583232 Len=0 TSval=11428223 TSecr=1685650383
627   0.076145 54.239.132.173 -> 172.31.8.238 TCP 30474 [TCP segment of a reassembled PDU]
628   0.076153 172.31.8.238 -> 54.239.132.173 TCP 66 45856 > http [ACK] Seq=98 Ack=8032057 Win=1583232 Len=0 TSval=11428223 TSecr=1685650383
629   0.076241 54.239.132.173 -> 172.31.8.238 TCP 31922 [TCP segment of a reassembled PDU]
630   0.076248 172.31.8.238 -> 54.239.132.173 TCP 66 45856 > http [ACK] Seq=98 Ack=8063913 Win=1583232 Len=0 TSval=11428223 TSecr=1685650383
631   0.076306 54.239.132.173 -> 172.31.8.238 TCP 20338 [TCP segment of a reassembled PDU]
632   0.076311 172.31.8.238 -> 54.239.132.173 TCP 66 45856 > http [ACK] Seq=98 Ack=8084185 Win=1583232 Len=0 TSval=11428223 TSecr=1685650383
633   0.076459 54.239.132.173 -> 172.31.8.238 TCP 26130 [TCP segment of a reassembled PDU]
634   0.076466 172.31.8.238 -> 54.239.132.173 TCP 66 45856 > http [ACK] Seq=98 Ack=8110249 Win=1583232 Len=0 TSval=11428223 TSecr=1685650383
635   0.077102 54.239.132.173 -> 172.31.8.238 TCP 62330 [TCP segment of a reassembled PDU]
636   0.077114 172.31.8.238 -> 54.239.132.173 TCP 66 45856 > http [ACK] Seq=98 Ack=8172513 Win=1583232 Len=0 TSval=11428223 TSecr=1685650383
637   0.077159 54.239.132.173 -> 172.31.8.238 TCP 15994 [TCP segment of a reassembled PDU]
638   0.077168 172.31.8.238 -> 54.239.132.173 TCP 66 45856 > http [ACK] Seq=98 Ack=8188441 Win=1583232 Len=0 TSval=11428223 TSecr=1685650383
639   0.077278 54.239.132.173 -> 172.31.8.238 TCP 46402 [TCP segment of a reassembled PDU]
640   0.077287 172.31.8.238 -> 54.239.132.173 TCP 66 45856 > http [ACK] Seq=98 Ack=8234777 Win=1583232 Len=0 TSval=11428223 TSecr=1685650383
641   0.077323 54.239.132.173 -> 172.31.8.238 TCP 5858 [TCP segment of a reassembled PDU]
642   0.077329 172.31.8.238 -> 54.239.132.173 TCP 66 45856 > http [ACK] Seq=98 Ack=8240569 Win=1583232 Len=0 TSval=11428223 TSecr=1685650383
643   0.077459 54.239.132.173 -> 172.31.8.238 TCP 56538 [TCP segment of a reassembled PDU]
644   0.077482 172.31.8.238 -> 54.239.132.173 TCP 66 45856 > http [ACK] Seq=98 Ack=8297041 Win=1583232 Len=0 TSval=11428223 TSecr=1685650383
645   0.077755 54.239.132.173 -> 172.31.8.238 TCP 62330 [TCP segment of a reassembled PDU]
646   0.077766 172.31.8.238 -> 54.239.132.173 TCP 66 45856 > http [ACK] Seq=98 Ack=8359305 Win=1583232 Len=0 TSval=11428223 TSecr=1685650383
647   0.077920 54.239.132.173 -> 172.31.8.238 TCP 11650 [TCP segment of a reassembled PDU]
648   0.077925 172.31.8.238 -> 54.239.132.173 TCP 66 45856 > http [ACK] Seq=98 Ack=8370889 Win=1583232 Len=0 TSval=11428223 TSecr=1685650383
649   0.078278 54.239.132.173 -> 172.31.8.238 TCP 50746 [TCP segment of a reassembled PDU]
650   0.078288 172.31.8.238 -> 54.239.132.173 TCP 66 45856 > http [ACK] Seq=98 Ack=8421569 Win=1583232 Len=0 TSval=11428223 TSecr=1685650383
651   0.078319 54.239.132.173 -> 172.31.8.238 TCP 14546 [TCP segment of a reassembled PDU]
652   0.078324 172.31.8.238 -> 54.239.132.173 TCP 66 45856 > http [ACK] Seq=98 Ack=8436049 Win=1583232 Len=0 TSval=11428223 TSecr=1685650383
653   0.078581 54.239.132.173 -> 172.31.8.238 TCP 47850 [TCP segment of a reassembled PDU]
654   0.078591 172.31.8.238 -> 54.239.132.173 TCP 66 45856 > http [ACK] Seq=98 Ack=8483833 Win=1583232 Len=0 TSval=11428223 TSecr=1685650383
655   0.079068 54.239.132.173 -> 172.31.8.238 TCP 62330 [TCP segment of a reassembled PDU]
656   0.079080 172.31.8.238 -> 54.239.132.173 TCP 66 45856 > http [ACK] Seq=98 Ack=8546097 Win=1583232 Len=0 TSval=11428223 TSecr=1685650383
657   0.079172 54.239.132.173 -> 172.31.8.238 TCP 20338 [TCP segment of a reassembled PDU]
658   0.079178 172.31.8.238 -> 54.239.132.173 TCP 66 45856 > http [ACK] Seq=98 Ack=8566369 Win=1583232 Len=0 TSval=11428223 TSecr=1685650383
659   0.079465 54.239.132.173 -> 172.31.8.238 TCP 42058 [TCP segment of a reassembled PDU]
660   0.079474 172.31.8.238 -> 54.239.132.173 TCP 66 45856 > http [ACK] Seq=98 Ack=8608361 Win=1583232 Len=0 TSval=11428223 TSecr=1685650383
661   0.079541 54.239.132.173 -> 172.31.8.238 TCP 23234 [TCP segment of a reassembled PDU]
662   0.079548 172.31.8.238 -> 54.239.132.173 TCP 66 45856 > http [ACK] Seq=98 Ack=8631529 Win=1583232 Len=0 TSval=11428223 TSecr=1685650383
663   0.079632 54.239.132.173 -> 172.31.8.238 TCP 39162 [TCP segment of a reassembled PDU]
664   0.079639 172.31.8.238 -> 54.239.132.173 TCP 66 45856 > http [ACK] Seq=98 Ack=8670625 Win=1583232 Len=0 TSval=11428223 TSecr=1685650383
665   0.079825 54.239.132.173 -> 172.31.8.238 TCP 62330 [TCP segment of a reassembled PDU]
666   0.079836 172.31.8.238 -> 54.239.132.173 TCP 66 45856 > http [ACK] Seq=98 Ack=8732889 Win=1583232 Len=0 TSval=11428224 TSecr=1685650383
667   0.079843 54.239.132.173 -> 172.31.8.238 TCP 1514 [TCP segment of a reassembled PDU]
668   0.079845 54.239.132.173 -> 172.31.8.238 TCP 1514 [TCP segment of a reassembled PDU]
669   0.079850 172.31.8.238 -> 54.239.132.173 TCP 66 45856 > http [ACK] Seq=98 Ack=8735785 Win=1583232 Len=0 TSval=11428224 TSecr=1685650383
670   0.080275 54.239.132.173 -> 172.31.8.238 TCP 59434 [TCP segment of a reassembled PDU]
671   0.080287 172.31.8.238 -> 54.239.132.173 TCP 66 45856 > http [ACK] Seq=98 Ack=8795153 Win=1583232 Len=0 TSval=11428224 TSecr=1685650383
672   0.080359 54.239.132.173 -> 172.31.8.238 TCP 5858 [TCP segment of a reassembled PDU]
673   0.080363 172.31.8.238 -> 54.239.132.173 TCP 66 45856 > http [ACK] Seq=98 Ack=8800945 Win=1583232 Len=0 TSval=11428224 TSecr=1685650383
674   0.080822 54.239.132.173 -> 172.31.8.238 TCP 56538 [TCP segment of a reassembled PDU]
675   0.080833 172.31.8.238 -> 54.239.132.173 TCP 66 45856 > http [ACK] Seq=98 Ack=8857417 Win=1583232 Len=0 TSval=11428224 TSecr=1685650383
676   0.080894 54.239.132.173 -> 172.31.8.238 TCP 21786 [TCP segment of a reassembled PDU]
677   0.080901 172.31.8.238 -> 54.239.132.173 TCP 66 45856 > http [ACK] Seq=98 Ack=8879137 Win=1583232 Len=0 TSval=11428224 TSecr=1685650383
678   0.081005 54.239.132.173 -> 172.31.8.238 TCP 40610 [TCP segment of a reassembled PDU]
679   0.081014 172.31.8.238 -> 54.239.132.173 TCP 66 45856 > http [ACK] Seq=98 Ack=8919681 Win=1583232 Len=0 TSval=11428224 TSecr=1685650383
680   0.081283 54.239.132.173 -> 172.31.8.238 TCP 62330 [TCP segment of a reassembled PDU]
681   0.081295 172.31.8.238 -> 54.239.132.173 TCP 66 45856 > http [ACK] Seq=98 Ack=8981945 Win=1583232 Len=0 TSval=11428224 TSecr=1685650383
682   0.081311 54.239.132.173 -> 172.31.8.238 TCP 1514 [TCP segment of a reassembled PDU]
683   0.081425 54.239.132.173 -> 172.31.8.238 TCP 13098 [TCP segment of a reassembled PDU]
684   0.081431 172.31.8.238 -> 54.239.132.173 TCP 66 45856 > http [ACK] Seq=98 Ack=8996425 Win=1583232 Len=0 TSval=11428224 TSecr=1685650383
685   0.081460 54.239.132.173 -> 172.31.8.238 TCP 47850 [TCP segment of a reassembled PDU]
686   0.081468 172.31.8.238 -> 54.239.132.173 TCP 66 45856 > http [ACK] Seq=98 Ack=9044209 Win=1583232 Len=0 TSval=11428224 TSecr=1685650383
687   0.081576 54.239.132.173 -> 172.31.8.238 TCP 43506 [TCP segment of a reassembled PDU]
688   0.081584 172.31.8.238 -> 54.239.132.173 TCP 66 45856 > http [ACK] Seq=98 Ack=9087649 Win=1583232 Len=0 TSval=11428224 TSecr=1685650383
689   0.081787 54.239.132.173 -> 172.31.8.238 TCP 18890 [TCP segment of a reassembled PDU]
690   0.081794 172.31.8.238 -> 54.239.132.173 TCP 66 45856 > http [ACK] Seq=98 Ack=9106473 Win=1583232 Len=0 TSval=11428224 TSecr=1685650383
691   0.081858 54.239.132.173 -> 172.31.8.238 TCP 20338 [TCP segment of a reassembled PDU]
692   0.081864 172.31.8.238 -> 54.239.132.173 TCP 66 45856 > http [ACK] Seq=98 Ack=9126745 Win=1583232 Len=0 TSval=11428224 TSecr=1685650383
693   0.081967 54.239.132.173 -> 172.31.8.238 TCP 42058 [TCP segment of a reassembled PDU]
694   0.081975 172.31.8.238 -> 54.239.132.173 TCP 66 45856 > http [ACK] Seq=98 Ack=9168737 Win=1583232 Len=0 TSval=11428224 TSecr=1685650383
695   0.082133 54.239.132.173 -> 172.31.8.238 TCP 44954 [TCP segment of a reassembled PDU]
696   0.082142 172.31.8.238 -> 54.239.132.173 TCP 66 45856 > http [ACK] Seq=98 Ack=9213625 Win=1583232 Len=0 TSval=11428224 TSecr=1685650383
697   0.082955 54.239.132.173 -> 172.31.8.238 TCP 4410 [TCP segment of a reassembled PDU]
698   0.082961 172.31.8.238 -> 54.239.132.173 TCP 66 45856 > http [ACK] Seq=98 Ack=9217969 Win=1583232 Len=0 TSval=11428224 TSecr=1685650383
699   0.082965 54.239.132.173 -> 172.31.8.238 TCP 1514 [TCP Previous segment not captured] [TCP segment of a reassembled PDU]
700   0.082967 172.31.8.238 -> 54.239.132.173 TCP 78 [TCP Dup ACK 698#1] 45856 > http [ACK] Seq=98 Ack=9217969 Win=1583232 Len=0 TSval=11428224 TSecr=1685650383 SLE=9219417 SRE=9220865
701   0.082969 54.239.132.173 -> 172.31.8.238 TCP 1514 [TCP Out-Of-Order] [TCP segment of a reassembled PDU]
702   0.082971 172.31.8.238 -> 54.239.132.173 TCP 66 45856 > http [ACK] Seq=98 Ack=9220865 Win=1583232 Len=0 TSval=11428224 TSecr=1685650383
703   0.082980 54.239.132.173 -> 172.31.8.238 TCP 10202 [TCP segment of a reassembled PDU]
704   0.082983 172.31.8.238 -> 54.239.132.173 TCP 66 45856 > http [ACK] Seq=98 Ack=9231001 Win=1583232 Len=0 TSval=11428224 TSecr=1685650383
705   0.083043 54.239.132.173 -> 172.31.8.238 TCP 15994 [TCP segment of a reassembled PDU]
706   0.083049 172.31.8.238 -> 54.239.132.173 TCP 66 45856 > http [ACK] Seq=98 Ack=9246929 Win=1583232 Len=0 TSval=11428224 TSecr=1685650383
707   0.083371 54.239.132.173 -> 172.31.8.238 TCP 46402 [TCP segment of a reassembled PDU]
708   0.083381 172.31.8.238 -> 54.239.132.173 TCP 66 45856 > http [ACK] Seq=98 Ack=9293265 Win=1583232 Len=0 TSval=11428224 TSecr=1685650383
709   0.083476 54.239.132.173 -> 172.31.8.238 TCP 31922 [TCP segment of a reassembled PDU]
710   0.083484 172.31.8.238 -> 54.239.132.173 TCP 66 45856 > http [ACK] Seq=98 Ack=9325121 Win=1583232 Len=0 TSval=11428224 TSecr=1685650383
711   0.083568 54.239.132.173 -> 172.31.8.238 TCP 30474 [TCP segment of a reassembled PDU]
712   0.083575 172.31.8.238 -> 54.239.132.173 TCP 66 45856 > http [ACK] Seq=98 Ack=9355529 Win=1583232 Len=0 TSval=11428224 TSecr=1685650383
713   0.083681 54.239.132.173 -> 172.31.8.238 TCP 47850 [TCP segment of a reassembled PDU]
714   0.083691 172.31.8.238 -> 54.239.132.173 TCP 66 45856 > http [ACK] Seq=98 Ack=9403313 Win=1583232 Len=0 TSval=11428225 TSecr=1685650383
715   0.083853 54.239.132.173 -> 172.31.8.238 TCP 62330 [TCP segment of a reassembled PDU]
716   0.083863 172.31.8.238 -> 54.239.132.173 TCP 66 45856 > http [ACK] Seq=98 Ack=9465577 Win=1583232 Len=0 TSval=11428225 TSecr=1685650383
717   0.083906 54.239.132.173 -> 172.31.8.238 TCP 15994 [TCP segment of a reassembled PDU]
718   0.083915 172.31.8.238 -> 54.239.132.173 TCP 66 45856 > http [ACK] Seq=98 Ack=9481505 Win=1583232 Len=0 TSval=11428225 TSecr=1685650383
719   0.084013 54.239.132.173 -> 172.31.8.238 TCP 36266 [TCP segment of a reassembled PDU]
720   0.084022 172.31.8.238 -> 54.239.132.173 TCP 66 45856 > http [ACK] Seq=98 Ack=9517705 Win=1583232 Len=0 TSval=11428225 TSecr=1685650383
721   0.084034 54.239.132.173 -> 172.31.8.238 TCP 4410 [TCP segment of a reassembled PDU]
722   0.084037 172.31.8.238 -> 54.239.132.173 TCP 66 45856 > http [ACK] Seq=98 Ack=9522049 Win=1583232 Len=0 TSval=11428225 TSecr=1685650384
723   0.084818 54.239.132.173 -> 172.31.8.238 TCP 62330 [TCP segment of a reassembled PDU]
724   0.084832 172.31.8.238 -> 54.239.132.173 TCP 66 45856 > http [ACK] Seq=98 Ack=9584313 Win=1583232 Len=0 TSval=11428225 TSecr=1685650384
725   0.084976 54.239.132.173 -> 172.31.8.238 TCP 62330 [TCP segment of a reassembled PDU]
726   0.084989 172.31.8.238 -> 54.239.132.173 TCP 66 45856 > http [ACK] Seq=98 Ack=9646577 Win=1583232 Len=0 TSval=11428225 TSecr=1685650384
727   0.085010 54.239.132.173 -> 172.31.8.238 TCP 1514 [TCP segment of a reassembled PDU]
728   0.085013 172.31.8.238 -> 54.239.132.173 TCP 66 45856 > http [ACK] Seq=98 Ack=9648025 Win=1583232 Len=0 TSval=11428225 TSecr=1685650384
729   0.085151 54.239.132.173 -> 172.31.8.238 TCP 60882 [TCP segment of a reassembled PDU]
730   0.085163 172.31.8.238 -> 54.239.132.173 TCP 66 45856 > http [ACK] Seq=98 Ack=9708841 Win=1583232 Len=0 TSval=11428225 TSecr=1685650384
731   0.085224 54.239.132.173 -> 172.31.8.238 TCP 30474 [TCP segment of a reassembled PDU]
732   0.085231 172.31.8.238 -> 54.239.132.173 TCP 66 45856 > http [ACK] Seq=98 Ack=9739249 Win=1583232 Len=0 TSval=11428225 TSecr=1685650384
733   0.085322 54.239.132.173 -> 172.31.8.238 TCP 31922 [TCP segment of a reassembled PDU]
734   0.085329 172.31.8.238 -> 54.239.132.173 TCP 66 45856 > http [ACK] Seq=98 Ack=9771105 Win=1583232 Len=0 TSval=11428225 TSecr=1685650384
735   0.085369 54.239.132.173 -> 172.31.8.238 TCP 7306 [TCP segment of a reassembled PDU]
736   0.085373 172.31.8.238 -> 54.239.132.173 TCP 66 45856 > http [ACK] Seq=98 Ack=9778345 Win=1583232 Len=0 TSval=11428225 TSecr=1685650384
737   0.086588 54.239.132.173 -> 172.31.8.238 TCP 55090 [TCP segment of a reassembled PDU]
738   0.086599 172.31.8.238 -> 54.239.132.173 TCP 66 45856 > http [ACK] Seq=98 Ack=9833369 Win=1583232 Len=0 TSval=11428225 TSecr=1685650384
739   0.086639 54.239.132.173 -> 172.31.8.238 TCP 23234 [TCP segment of a reassembled PDU]
740   0.086645 172.31.8.238 -> 54.239.132.173 TCP 66 45856 > http [ACK] Seq=98 Ack=9856537 Win=1583232 Len=0 TSval=11428225 TSecr=1685650384
741   0.086748 54.239.132.173 -> 172.31.8.238 TCP 39162 [TCP segment of a reassembled PDU]
742   0.086756 172.31.8.238 -> 54.239.132.173 TCP 66 45856 > http [ACK] Seq=98 Ack=9895633 Win=1583232 Len=0 TSval=11428225 TSecr=1685650384
743   0.086802 54.239.132.173 -> 172.31.8.238 TCP 13098 [TCP segment of a reassembled PDU]
744   0.086807 172.31.8.238 -> 54.239.132.173 TCP 66 45856 > http [ACK] Seq=98 Ack=9908665 Win=1583232 Len=0 TSval=11428225 TSecr=1685650384
745   0.086939 54.239.132.173 -> 172.31.8.238 TCP 49298 [TCP segment of a reassembled PDU]
746   0.086949 172.31.8.238 -> 54.239.132.173 TCP 66 45856 > http [ACK] Seq=98 Ack=9957897 Win=1583232 Len=0 TSval=11428225 TSecr=1685650384
747   0.087022 54.239.132.173 -> 172.31.8.238 TCP 26130 [TCP segment of a reassembled PDU]
748   0.087029 172.31.8.238 -> 54.239.132.173 TCP 66 45856 > http [ACK] Seq=98 Ack=9983961 Win=1583232 Len=0 TSval=11428225 TSecr=1685650384
749   0.087115 54.239.132.173 -> 172.31.8.238 TCP 1514 [TCP Previous segment not captured] [TCP segment of a reassembled PDU]
750   0.087119 172.31.8.238 -> 54.239.132.173 TCP 78 [TCP Dup ACK 748#1] 45856 > http [ACK] Seq=98 Ack=9983961 Win=1583232 Len=0 TSval=11428225 TSecr=1685650384 SLE=9985409 SRE=9986857
751   0.087124 54.239.132.173 -> 172.31.8.238 TCP 1514 [TCP Out-Of-Order] [TCP segment of a reassembled PDU]
752   0.087128 172.31.8.238 -> 54.239.132.173 TCP 66 45856 > http [ACK] Seq=98 Ack=9986857 Win=1583232 Len=0 TSval=11428225 TSecr=1685650384
753   0.087146 54.239.132.173 -> 172.31.8.238 TCP 33370 [TCP segment of a reassembled PDU]
754   0.087151 172.31.8.238 -> 54.239.132.173 TCP 66 45856 > http [ACK] Seq=98 Ack=10020161 Win=1583232 Len=0 TSval=11428225 TSecr=1685650384
755   0.087194 54.239.132.173 -> 172.31.8.238 TCP 18890 [TCP segment of a reassembled PDU]
756   0.087199 172.31.8.238 -> 54.239.132.173 TCP 66 45856 > http [ACK] Seq=98 Ack=10038985 Win=1583232 Len=0 TSval=11428225 TSecr=1685650384
757   0.087552 54.239.132.173 -> 172.31.8.238 TCP 43506 [TCP segment of a reassembled PDU]
758   0.087561 172.31.8.238 -> 54.239.132.173 TCP 66 45856 > http [ACK] Seq=98 Ack=10082425 Win=1583232 Len=0 TSval=11428225 TSecr=1685650384
759   0.088023 54.239.132.173 -> 172.31.8.238 TCP 21786 [TCP segment of a reassembled PDU]
760   0.088031 172.31.8.238 -> 54.239.132.173 TCP 66 45856 > http [ACK] Seq=98 Ack=10104145 Win=1583232 Len=0 TSval=11428226 TSecr=1685650384
761   0.088058 54.239.132.173 -> 172.31.8.238 TCP 40610 [TCP segment of a reassembled PDU]
762   0.088065 172.31.8.238 -> 54.239.132.173 TCP 66 45856 > http [ACK] Seq=98 Ack=10144689 Win=1583232 Len=0 TSval=11428226 TSecr=1685650384
763   0.088093 54.239.132.173 -> 172.31.8.238 TCP 2962 [TCP segment of a reassembled PDU]
764   0.088098 172.31.8.238 -> 54.239.132.173 TCP 66 45856 > http [ACK] Seq=98 Ack=10147585 Win=1583232 Len=0 TSval=11428226 TSecr=1685650384
765   0.088341 54.239.132.173 -> 172.31.8.238 TCP 59434 [TCP segment of a reassembled PDU]
766   0.088352 172.31.8.238 -> 54.239.132.173 TCP 66 45856 > http [ACK] Seq=98 Ack=10206953 Win=1583232 Len=0 TSval=11428226 TSecr=1685650384
767   0.088426 54.239.132.173 -> 172.31.8.238 TCP 33370 [TCP segment of a reassembled PDU]
768   0.088434 172.31.8.238 -> 54.239.132.173 TCP 66 45856 > http [ACK] Seq=98 Ack=10240257 Win=1583232 Len=0 TSval=11428226 TSecr=1685650384
769   0.088516 54.239.132.173 -> 172.31.8.238 TCP 29026 [TCP segment of a reassembled PDU]
770   0.088523 172.31.8.238 -> 54.239.132.173 TCP 66 45856 > http [ACK] Seq=98 Ack=10269217 Win=1583232 Len=0 TSval=11428226 TSecr=1685650384
771   0.088671 54.239.132.173 -> 172.31.8.238 TCP 34818 [TCP segment of a reassembled PDU]
772   0.088679 172.31.8.238 -> 54.239.132.173 TCP 66 45856 > http [ACK] Seq=98 Ack=10303969 Win=1583232 Len=0 TSval=11428226 TSecr=1685650384
773   0.089035 54.239.132.173 -> 172.31.8.238 TCP 27578 [TCP segment of a reassembled PDU]
774   0.089042 172.31.8.238 -> 54.239.132.173 TCP 66 45856 > http [ACK] Seq=98 Ack=10331481 Win=1583232 Len=0 TSval=11428226 TSecr=1685650384
775   0.089126 54.239.132.173 -> 172.31.8.238 TCP 33370 [TCP segment of a reassembled PDU]
776   0.089134 172.31.8.238 -> 54.239.132.173 TCP 66 45856 > http [ACK] Seq=98 Ack=10364785 Win=1583232 Len=0 TSval=11428226 TSecr=1685650384
777   0.089212 54.239.132.173 -> 172.31.8.238 TCP 29026 [TCP segment of a reassembled PDU]
778   0.089218 172.31.8.238 -> 54.239.132.173 TCP 66 45856 > http [ACK] Seq=98 Ack=10393745 Win=1583232 Len=0 TSval=11428226 TSecr=1685650384
779   0.089521 54.239.132.173 -> 172.31.8.238 TCP 62330 [TCP segment of a reassembled PDU]
780   0.089533 172.31.8.238 -> 54.239.132.173 TCP 66 45856 > http [ACK] Seq=98 Ack=10456009 Win=1583232 Len=0 TSval=11428226 TSecr=1685650384
781   0.089645 54.239.132.173 -> 172.31.8.238 HTTP 30276 HTTP/1.1 200 OK  (application/octet-stream)
782   0.089653 172.31.8.238 -> 54.239.132.173 TCP 66 45856 > http [ACK] Seq=98 Ack=10486219 Win=1583232 Len=0 TSval=11428226 TSecr=1685650384
783   0.089799 172.31.8.238 -> 54.239.132.173 TCP 66 45856 > http [FIN, ACK] Seq=98 Ack=10486219 Win=1583232 Len=0 TSval=11428226 TSecr=1685650384
784   0.090508 54.239.132.173 -> 172.31.8.238 TCP 66 http > 45856 [FIN, ACK] Seq=10486219 Ack=99 Win=14592 Len=0 TSval=1685650384 TSecr=11428226
785   0.090515 172.31.8.238 -> 54.239.132.173 TCP 66 45856 > http [ACK] Seq=99 Ack=10486220 Win=1583232 Len=0 TSval=11428226 TSecr=1685650384
