[Measurement for 10mb at 17:41:57 19.41.2014] 
Tshark:

  1   0.000000 172.31.8.238 -> 172.31.0.2   DNS 89 Standard query 0xdbae  A d1xvcg6dfvgaki.cloudfront.net
  2   0.000038 172.31.8.238 -> 172.31.0.2   DNS 89 Standard query 0xe777  AAAA d1xvcg6dfvgaki.cloudfront.net
  3   0.000670   172.31.0.2 -> 172.31.8.238 DNS 217 Standard query response 0xdbae  A 205.251.215.126 A 205.251.215.191 A 54.192.141.198 A 54.230.140.231 A 54.230.141.96 A 54.230.142.4 A 54.230.143.62 A 54.230.143.233
  4   0.000680   172.31.0.2 -> 172.31.8.238 DNS 170 Standard query response 0xe777 
  5   0.003935 172.31.8.238 -> 205.251.215.126 TCP 74 bacnet > http [SYN] Seq=0 Win=26883 Len=0 MSS=8961 SACK_PERM=1 TSval=636392 TSecr=0 WS=128
  6   0.007013 205.251.215.126 -> 172.31.8.238 TCP 74 http > bacnet [SYN, ACK] Seq=0 Ack=1 Win=14480 Len=0 MSS=1460 SACK_PERM=1 TSval=873827401 TSecr=636392 WS=128
  7   0.007028 172.31.8.238 -> 205.251.215.126 TCP 66 bacnet > http [ACK] Seq=1 Ack=1 Win=27008 Len=0 TSval=636393 TSecr=873827401
  8   0.007085 172.31.8.238 -> 205.251.215.126 HTTP 163 GET /10mb HTTP/1.1 
  9   0.010012 205.251.215.126 -> 172.31.8.238 TCP 66 http > bacnet [ACK] Seq=1 Ack=98 Win=14592 Len=0 TSval=873827402 TSecr=636393
 10   0.498687 205.251.215.126 -> 172.31.8.238 TCP 2962 [TCP segment of a reassembled PDU]
 11   0.498728 172.31.8.238 -> 205.251.215.126 TCP 66 bacnet > http [ACK] Seq=98 Ack=2897 Win=32768 Len=0 TSval=636516 TSecr=873827450
 12   0.498852 205.251.215.126 -> 172.31.8.238 TCP 2605 [TCP segment of a reassembled PDU]
 13   0.498859 172.31.8.238 -> 205.251.215.126 TCP 66 bacnet > http [ACK] Seq=98 Ack=5436 Win=37760 Len=0 TSval=636516 TSecr=873827450
 14   0.498939 205.251.215.126 -> 172.31.8.238 TCP 1514 [TCP segment of a reassembled PDU]
 15   0.498944 172.31.8.238 -> 205.251.215.126 TCP 66 bacnet > http [ACK] Seq=98 Ack=6884 Win=40704 Len=0 TSval=636516 TSecr=873827450
 16   0.498949 205.251.215.126 -> 172.31.8.238 TCP 554 [TCP segment of a reassembled PDU]
 17   0.498951 172.31.8.238 -> 205.251.215.126 TCP 66 bacnet > http [ACK] Seq=98 Ack=7372 Win=43648 Len=0 TSval=636516 TSecr=873827450
 18   0.508322 205.251.215.126 -> 172.31.8.238 TCP 1514 [TCP segment of a reassembled PDU]
 19   0.508343 172.31.8.238 -> 205.251.215.126 TCP 66 bacnet > http [ACK] Seq=98 Ack=8820 Win=46464 Len=0 TSval=636518 TSecr=873827451
 20   0.508532 205.251.215.126 -> 172.31.8.238 TCP 2962 [TCP segment of a reassembled PDU]
 21   0.508539 172.31.8.238 -> 205.251.215.126 TCP 66 bacnet > http [ACK] Seq=98 Ack=11716 Win=52352 Len=0 TSval=636518 TSecr=873827451
 22   0.508622 205.251.215.126 -> 172.31.8.238 TCP 1514 [TCP segment of a reassembled PDU]
 23   0.508626 172.31.8.238 -> 205.251.215.126 TCP 66 bacnet > http [ACK] Seq=98 Ack=13164 Win=55168 Len=0 TSval=636518 TSecr=873827451
 24   0.508631 205.251.215.126 -> 172.31.8.238 TCP 354 [TCP segment of a reassembled PDU]
 25   0.508633 172.31.8.238 -> 205.251.215.126 TCP 66 bacnet > http [ACK] Seq=98 Ack=13452 Win=58112 Len=0 TSval=636518 TSecr=873827451
 26   0.675883 205.251.215.126 -> 172.31.8.238 TCP 4410 [TCP segment of a reassembled PDU]
 27   0.675909 172.31.8.238 -> 205.251.215.126 TCP 66 bacnet > http [ACK] Seq=98 Ack=17796 Win=66816 Len=0 TSval=636560 TSecr=873827468
 28   0.676040 205.251.215.126 -> 172.31.8.238 TCP 1562 [TCP segment of a reassembled PDU]
 29   0.676049 172.31.8.238 -> 205.251.215.126 TCP 66 bacnet > http [ACK] Seq=98 Ack=19292 Win=69760 Len=0 TSval=636560 TSecr=873827468
 30   0.676296 205.251.215.126 -> 172.31.8.238 TCP 1514 [TCP segment of a reassembled PDU]
 31   0.676302 172.31.8.238 -> 205.251.215.126 TCP 66 bacnet > http [ACK] Seq=98 Ack=20740 Win=72704 Len=0 TSval=636560 TSecr=873827468
 32   0.676570 205.251.215.126 -> 172.31.8.238 TCP 5858 [TCP segment of a reassembled PDU]
 33   0.676577 172.31.8.238 -> 205.251.215.126 TCP 66 bacnet > http [ACK] Seq=98 Ack=26532 Win=84224 Len=0 TSval=636560 TSecr=873827468
 34   0.678942 205.251.215.126 -> 172.31.8.238 TCP 2962 [TCP segment of a reassembled PDU]
 35   0.678949 172.31.8.238 -> 205.251.215.126 TCP 66 bacnet > http [ACK] Seq=98 Ack=29428 Win=89984 Len=0 TSval=636561 TSecr=873827468
 36   0.679223 205.251.215.126 -> 172.31.8.238 TCP 2962 [TCP segment of a reassembled PDU]
 37   0.679229 172.31.8.238 -> 205.251.215.126 TCP 66 bacnet > http [ACK] Seq=98 Ack=32324 Win=95872 Len=0 TSval=636561 TSecr=873827468
 38   0.679464 205.251.215.126 -> 172.31.8.238 TCP 4410 [TCP segment of a reassembled PDU]
 39   0.679470 172.31.8.238 -> 205.251.215.126 TCP 66 bacnet > http [ACK] Seq=98 Ack=36668 Win=104576 Len=0 TSval=636561 TSecr=873827469
 40   0.679564 205.251.215.126 -> 172.31.8.238 TCP 2962 [TCP segment of a reassembled PDU]
 41   0.679569 172.31.8.238 -> 205.251.215.126 TCP 66 bacnet > http [ACK] Seq=98 Ack=39564 Win=110336 Len=0 TSval=636561 TSecr=873827469
 42   0.679801 205.251.215.126 -> 172.31.8.238 TCP 7306 [TCP segment of a reassembled PDU]
 43   0.679807 172.31.8.238 -> 205.251.215.126 TCP 66 bacnet > http [ACK] Seq=98 Ack=46804 Win=124800 Len=0 TSval=636561 TSecr=873827469
 44   0.682089 205.251.215.126 -> 172.31.8.238 TCP 2962 [TCP segment of a reassembled PDU]
 45   0.682094 172.31.8.238 -> 205.251.215.126 TCP 66 bacnet > http [ACK] Seq=98 Ack=49700 Win=130560 Len=0 TSval=636562 TSecr=873827469
 46   0.682386 205.251.215.126 -> 172.31.8.238 TCP 3238 [TCP segment of a reassembled PDU]
 47   0.682392 172.31.8.238 -> 205.251.215.126 TCP 66 bacnet > http [ACK] Seq=98 Ack=52872 Win=136960 Len=0 TSval=636562 TSecr=873827469
 48   0.855487 205.251.215.126 -> 172.31.8.238 TCP 1514 [TCP segment of a reassembled PDU]
 49   0.855500 172.31.8.238 -> 205.251.215.126 TCP 66 bacnet > http [ACK] Seq=98 Ack=54320 Win=139776 Len=0 TSval=636605 TSecr=873827486
 50   0.855608 205.251.215.126 -> 172.31.8.238 TCP 1514 [TCP segment of a reassembled PDU]
 51   0.855613 172.31.8.238 -> 205.251.215.126 TCP 66 bacnet > http [ACK] Seq=98 Ack=55768 Win=142720 Len=0 TSval=636605 TSecr=873827486
 52   0.855878 205.251.215.126 -> 172.31.8.238 TCP 4410 [TCP segment of a reassembled PDU]
 53   0.855884 172.31.8.238 -> 205.251.215.126 TCP 66 bacnet > http [ACK] Seq=98 Ack=60112 Win=151424 Len=0 TSval=636605 TSecr=873827486
 54   0.855957 205.251.215.126 -> 172.31.8.238 TCP 1586 [TCP segment of a reassembled PDU]
 55   0.855962 172.31.8.238 -> 205.251.215.126 TCP 66 bacnet > http [ACK] Seq=98 Ack=61632 Win=154496 Len=0 TSval=636605 TSecr=873827486
 56   0.859973 205.251.215.126 -> 172.31.8.238 TCP 2962 [TCP segment of a reassembled PDU]
 57   0.859980 172.31.8.238 -> 205.251.215.126 TCP 66 bacnet > http [ACK] Seq=98 Ack=64528 Win=160256 Len=0 TSval=636606 TSecr=873827487
 58   0.860224 205.251.215.126 -> 172.31.8.238 TCP 2962 [TCP segment of a reassembled PDU]
 59   0.860229 172.31.8.238 -> 205.251.215.126 TCP 66 bacnet > http [ACK] Seq=98 Ack=67424 Win=166016 Len=0 TSval=636606 TSecr=873827487
 60   0.860363 205.251.215.126 -> 172.31.8.238 TCP 20338 [TCP segment of a reassembled PDU]
 61   0.860376 172.31.8.238 -> 205.251.215.126 TCP 66 bacnet > http [ACK] Seq=98 Ack=87696 Win=164864 Len=0 TSval=636606 TSecr=873827487
 62   0.862937 205.251.215.126 -> 172.31.8.238 TCP 282 [TCP segment of a reassembled PDU]
 63   0.862943 172.31.8.238 -> 205.251.215.126 TCP 66 bacnet > http [ACK] Seq=98 Ack=87912 Win=168960 Len=0 TSval=636607 TSecr=873827487
 64   1.034492 205.251.215.126 -> 172.31.8.238 TCP 1514 [TCP segment of a reassembled PDU]
 65   1.034517 172.31.8.238 -> 205.251.215.126 TCP 66 bacnet > http [ACK] Seq=98 Ack=89360 Win=171776 Len=0 TSval=636650 TSecr=873827504
 66   1.034537 205.251.215.126 -> 172.31.8.238 TCP 2962 [TCP segment of a reassembled PDU]
 67   1.034541 172.31.8.238 -> 205.251.215.126 TCP 66 bacnet > http [ACK] Seq=98 Ack=92256 Win=177664 Len=0 TSval=636650 TSecr=873827504
 68   1.034697 205.251.215.126 -> 172.31.8.238 TCP 2962 [TCP segment of a reassembled PDU]
 69   1.034702 172.31.8.238 -> 205.251.215.126 TCP 66 bacnet > http [ACK] Seq=98 Ack=95152 Win=183424 Len=0 TSval=636650 TSecr=873827504
 70   1.034785 205.251.215.126 -> 172.31.8.238 TCP 126 [TCP segment of a reassembled PDU]
 71   1.034789 172.31.8.238 -> 205.251.215.126 TCP 66 bacnet > http [ACK] Seq=98 Ack=95212 Win=183424 Len=0 TSval=636650 TSecr=873827504
 72   1.034962 205.251.215.126 -> 172.31.8.238 TCP 4410 [TCP segment of a reassembled PDU]
 73   1.034968 172.31.8.238 -> 205.251.215.126 TCP 66 bacnet > http [ACK] Seq=98 Ack=99556 Win=192128 Len=0 TSval=636650 TSecr=873827504
 74   1.035194 205.251.215.126 -> 172.31.8.238 TCP 1514 [TCP segment of a reassembled PDU]
 75   1.035199 172.31.8.238 -> 205.251.215.126 TCP 66 bacnet > http [ACK] Seq=98 Ack=101004 Win=194944 Len=0 TSval=636650 TSecr=873827504
 76   1.035315 205.251.215.126 -> 172.31.8.238 TCP 14546 [TCP segment of a reassembled PDU]
 77   1.035324 172.31.8.238 -> 205.251.215.126 TCP 66 bacnet > http [ACK] Seq=98 Ack=115484 Win=224000 Len=0 TSval=636650 TSecr=873827504
 78   1.038038 205.251.215.126 -> 172.31.8.238 TCP 2962 [TCP segment of a reassembled PDU]
 79   1.038043 172.31.8.238 -> 205.251.215.126 TCP 66 bacnet > http [ACK] Seq=98 Ack=118380 Win=229760 Len=0 TSval=636651 TSecr=873827504
 80   1.038290 205.251.215.126 -> 172.31.8.238 TCP 2962 [TCP segment of a reassembled PDU]
 81   1.038295 172.31.8.238 -> 205.251.215.126 TCP 66 bacnet > http [ACK] Seq=98 Ack=121276 Win=235520 Len=0 TSval=636651 TSecr=873827504
 82   1.038402 205.251.215.126 -> 172.31.8.238 TCP 8754 [TCP segment of a reassembled PDU]
 83   1.038410 172.31.8.238 -> 205.251.215.126 TCP 66 bacnet > http [ACK] Seq=98 Ack=129964 Win=252928 Len=0 TSval=636651 TSecr=873827504
 84   1.038563 205.251.215.126 -> 172.31.8.238 TCP 5858 [TCP segment of a reassembled PDU]
 85   1.038569 172.31.8.238 -> 205.251.215.126 TCP 66 bacnet > http [ACK] Seq=98 Ack=135756 Win=264448 Len=0 TSval=636651 TSecr=873827504
 86   1.038673 205.251.215.126 -> 172.31.8.238 TCP 13542 [TCP segment of a reassembled PDU]
 87   1.038683 172.31.8.238 -> 205.251.215.126 TCP 66 bacnet > http [ACK] Seq=98 Ack=149232 Win=291456 Len=0 TSval=636651 TSecr=873827504
 88   1.218482 205.251.215.126 -> 172.31.8.238 TCP 2962 [TCP segment of a reassembled PDU]
 89   1.218509 172.31.8.238 -> 205.251.215.126 TCP 66 bacnet > http [ACK] Seq=98 Ack=152128 Win=297216 Len=0 TSval=636696 TSecr=873827522
 90   1.218686 205.251.215.126 -> 172.31.8.238 TCP 5858 [TCP segment of a reassembled PDU]
 91   1.218695 172.31.8.238 -> 205.251.215.126 TCP 66 bacnet > http [ACK] Seq=98 Ack=157920 Win=308864 Len=0 TSval=636696 TSecr=873827522
 92   1.218817 205.251.215.126 -> 172.31.8.238 TCP 16198 [TCP segment of a reassembled PDU]
 93   1.218828 172.31.8.238 -> 205.251.215.126 TCP 66 bacnet > http [ACK] Seq=98 Ack=174052 Win=341120 Len=0 TSval=636696 TSecr=873827522
 94   1.219941 205.251.215.126 -> 172.31.8.238 TCP 1514 [TCP segment of a reassembled PDU]
 95   1.219948 172.31.8.238 -> 205.251.215.126 TCP 66 bacnet > http [ACK] Seq=98 Ack=175500 Win=343936 Len=0 TSval=636696 TSecr=873827523
 96   1.220200 205.251.215.126 -> 172.31.8.238 TCP 5858 [TCP segment of a reassembled PDU]
 97   1.220206 172.31.8.238 -> 205.251.215.126 TCP 66 bacnet > http [ACK] Seq=98 Ack=181292 Win=355584 Len=0 TSval=636696 TSecr=873827523
 98   1.220281 205.251.215.126 -> 172.31.8.238 TCP 1514 [TCP segment of a reassembled PDU]
 99   1.220286 172.31.8.238 -> 205.251.215.126 TCP 66 bacnet > http [ACK] Seq=98 Ack=182740 Win=358528 Len=0 TSval=636696 TSecr=873827523
100   1.221959 205.251.215.126 -> 172.31.8.238 TCP 1514 [TCP segment of a reassembled PDU]
101   1.221964 172.31.8.238 -> 205.251.215.126 TCP 66 bacnet > http [ACK] Seq=98 Ack=184188 Win=361344 Len=0 TSval=636697 TSecr=873827523
102   1.222224 205.251.215.126 -> 172.31.8.238 TCP 4410 [TCP segment of a reassembled PDU]
103   1.222230 172.31.8.238 -> 205.251.215.126 TCP 66 bacnet > http [ACK] Seq=98 Ack=188532 Win=370048 Len=0 TSval=636697 TSecr=873827523
104   1.222383 205.251.215.126 -> 172.31.8.238 TCP 21786 [TCP segment of a reassembled PDU]
105   1.222395 172.31.8.238 -> 205.251.215.126 TCP 66 bacnet > http [ACK] Seq=98 Ack=210252 Win=413440 Len=0 TSval=636697 TSecr=873827523
106   1.222403 205.251.215.126 -> 172.31.8.238 TCP 3286 [TCP segment of a reassembled PDU]
107   1.222409 172.31.8.238 -> 205.251.215.126 TCP 66 bacnet > http [ACK] Seq=98 Ack=213472 Win=419968 Len=0 TSval=636697 TSecr=873827523
108   1.393240 205.251.215.126 -> 172.31.8.238 TCP 5858 [TCP segment of a reassembled PDU]
109   1.393268 172.31.8.238 -> 205.251.215.126 TCP 66 bacnet > http [ACK] Seq=98 Ack=219264 Win=431488 Len=0 TSval=636739 TSecr=873827540
110   1.393283 205.251.215.126 -> 172.31.8.238 TCP 1514 [TCP segment of a reassembled PDU]
111   1.393291 172.31.8.238 -> 205.251.215.126 TCP 66 bacnet > http [ACK] Seq=98 Ack=220712 Win=434432 Len=0 TSval=636739 TSecr=873827540
112   1.393378 205.251.215.126 -> 172.31.8.238 TCP 1586 [TCP segment of a reassembled PDU]
113   1.393384 172.31.8.238 -> 205.251.215.126 TCP 66 bacnet > http [ACK] Seq=98 Ack=222232 Win=437504 Len=0 TSval=636740 TSecr=873827540
114   1.394491 205.251.215.126 -> 172.31.8.238 TCP 1514 [TCP segment of a reassembled PDU]
115   1.394500 172.31.8.238 -> 205.251.215.126 TCP 66 bacnet > http [ACK] Seq=98 Ack=223680 Win=440320 Len=0 TSval=636740 TSecr=873827540
116   1.394509 205.251.215.126 -> 172.31.8.238 TCP 2962 [TCP segment of a reassembled PDU]
117   1.394516 172.31.8.238 -> 205.251.215.126 TCP 66 bacnet > http [ACK] Seq=98 Ack=226576 Win=446080 Len=0 TSval=636740 TSecr=873827540
118   1.394526 205.251.215.126 -> 172.31.8.238 TCP 11650 [TCP segment of a reassembled PDU]
119   1.394533 172.31.8.238 -> 205.251.215.126 TCP 66 bacnet > http [ACK] Seq=98 Ack=238160 Win=469248 Len=0 TSval=636740 TSecr=873827540
120   1.394818 205.251.215.126 -> 172.31.8.238 TCP 13170 [TCP segment of a reassembled PDU]
121   1.394833 172.31.8.238 -> 205.251.215.126 TCP 66 bacnet > http [ACK] Seq=98 Ack=251264 Win=495488 Len=0 TSval=636740 TSecr=873827540
122   1.396290 205.251.215.126 -> 172.31.8.238 TCP 4410 [TCP segment of a reassembled PDU]
123   1.396301 172.31.8.238 -> 205.251.215.126 TCP 66 bacnet > http [ACK] Seq=98 Ack=255608 Win=504192 Len=0 TSval=636740 TSecr=873827540
124   1.397463 205.251.215.126 -> 172.31.8.238 TCP 13098 [TCP segment of a reassembled PDU]
125   1.397478 172.31.8.238 -> 205.251.215.126 TCP 66 bacnet > http [ACK] Seq=98 Ack=268640 Win=501248 Len=0 TSval=636741 TSecr=873827540
