[Measurement for 10mb at 04:41:25 20.41.2014] 
Tshark:

  1   0.000000 172.31.8.238 -> 172.31.0.2   DNS 89 Standard query 0xbd17  A d1xvcg6dfvgaki.cloudfront.net
  2   0.000037 172.31.8.238 -> 172.31.0.2   DNS 89 Standard query 0xc52b  AAAA d1xvcg6dfvgaki.cloudfront.net
  3   0.000763   172.31.0.2 -> 172.31.8.238 DNS 170 Standard query response 0xc52b 
  4   0.000775   172.31.0.2 -> 172.31.8.238 DNS 217 Standard query response 0xbd17  A 54.230.116.98 A 54.230.117.10 A 54.239.132.86 A 54.239.132.250 A 54.192.118.222 A 54.192.118.232 A 54.192.118.237 A 54.192.118.242
  5   0.003801 172.31.8.238 -> 54.230.116.98 TCP 74 39752 > http [SYN] Seq=0 Win=26883 Len=0 MSS=8961 SACK_PERM=1 TSval=10528245 TSecr=0 WS=128
  6   0.004376 54.230.116.98 -> 172.31.8.238 TCP 74 http > 39752 [SYN, ACK] Seq=0 Ack=1 Win=14480 Len=0 MSS=1460 SACK_PERM=1 TSval=1684745190 TSecr=10528245 WS=128
  7   0.004389 172.31.8.238 -> 54.230.116.98 TCP 66 39752 > http [ACK] Seq=1 Ack=1 Win=27008 Len=0 TSval=10528245 TSecr=1684745190
  8   0.004429 172.31.8.238 -> 54.230.116.98 HTTP 163 GET /10mb HTTP/1.1 
  9   0.005167 54.230.116.98 -> 172.31.8.238 TCP 66 http > 39752 [ACK] Seq=1 Ack=98 Win=14592 Len=0 TSval=1684745190 TSecr=10528245
 10   0.006965 54.230.116.98 -> 172.31.8.238 TCP 524 [TCP segment of a reassembled PDU]
 11   0.006972 172.31.8.238 -> 54.230.116.98 TCP 66 39752 > http [ACK] Seq=98 Ack=459 Win=28032 Len=0 TSval=10528245 TSecr=1684745190
 12   0.007082 54.230.116.98 -> 172.31.8.238 TCP 13098 [TCP segment of a reassembled PDU]
 13   0.007091 172.31.8.238 -> 54.230.116.98 TCP 66 39752 > http [ACK] Seq=98 Ack=13491 Win=54144 Len=0 TSval=10528245 TSecr=1684745190
 14   0.007829 54.230.116.98 -> 172.31.8.238 TCP 13098 [TCP segment of a reassembled PDU]
 15   0.007838 172.31.8.238 -> 54.230.116.98 TCP 66 39752 > http [ACK] Seq=98 Ack=26523 Win=80128 Len=0 TSval=10528246 TSecr=1684745190
 16   0.008515 54.230.116.98 -> 172.31.8.238 TCP 7306 [TCP segment of a reassembled PDU]
 17   0.008522 172.31.8.238 -> 54.230.116.98 TCP 66 39752 > http [ACK] Seq=98 Ack=33763 Win=94592 Len=0 TSval=10528246 TSecr=1684745190
 18   0.008608 54.230.116.98 -> 172.31.8.238 TCP 5858 [TCP segment of a reassembled PDU]
 19   0.008614 172.31.8.238 -> 54.230.116.98 TCP 66 39752 > http [ACK] Seq=98 Ack=39555 Win=106240 Len=0 TSval=10528246 TSecr=1684745190
 20   0.009314 54.230.116.98 -> 172.31.8.238 TCP 21786 [TCP segment of a reassembled PDU]
 21   0.009326 172.31.8.238 -> 54.230.116.98 TCP 66 39752 > http [ACK] Seq=98 Ack=61275 Win=84608 Len=0 TSval=10528246 TSecr=1684745191
 22   0.010057 54.230.116.98 -> 172.31.8.238 TCP 4410 [TCP segment of a reassembled PDU]
 23   0.010063 172.31.8.238 -> 54.230.116.98 TCP 66 39752 > http [ACK] Seq=98 Ack=65619 Win=109056 Len=0 TSval=10528246 TSecr=1684745191
 24   0.010162 54.230.116.98 -> 172.31.8.238 TCP 13098 [TCP segment of a reassembled PDU]
 25   0.010170 172.31.8.238 -> 54.230.116.98 TCP 66 39752 > http [ACK] Seq=98 Ack=78651 Win=96512 Len=0 TSval=10528246 TSecr=1684745191
 26   0.010786 54.230.116.98 -> 172.31.8.238 TCP 5858 [TCP segment of a reassembled PDU]
 27   0.010793 172.31.8.238 -> 54.230.116.98 TCP 66 39752 > http [ACK] Seq=98 Ack=84443 Win=108416 Len=0 TSval=10528246 TSecr=1684745191
 28   0.010903 54.230.116.98 -> 172.31.8.238 TCP 17442 [TCP segment of a reassembled PDU]
 29   0.010913 172.31.8.238 -> 54.230.116.98 TCP 66 39752 > http [ACK] Seq=98 Ack=101819 Win=91136 Len=0 TSval=10528246 TSecr=1684745191
 30   0.010919 54.230.116.98 -> 172.31.8.238 TCP 1514 [TCP segment of a reassembled PDU]
 31   0.010922 172.31.8.238 -> 54.230.116.98 TCP 66 39752 > http [ACK] Seq=98 Ack=103267 Win=89728 Len=0 TSval=10528246 TSecr=1684745191
 32   0.010929 54.230.116.98 -> 172.31.8.238 TCP 1514 [TCP segment of a reassembled PDU]
 33   0.010932 172.31.8.238 -> 54.230.116.98 TCP 66 39752 > http [ACK] Seq=98 Ack=104715 Win=88320 Len=0 TSval=10528246 TSecr=1684745191
 34   0.011554 54.230.116.98 -> 172.31.8.238 TCP 1514 [TCP segment of a reassembled PDU]
 35   0.011559 172.31.8.238 -> 54.230.116.98 TCP 66 39752 > http [ACK] Seq=98 Ack=106163 Win=109056 Len=0 TSval=10528246 TSecr=1684745191
 36   0.011666 54.230.116.98 -> 172.31.8.238 TCP 24682 [TCP segment of a reassembled PDU]
 37   0.011677 172.31.8.238 -> 54.230.116.98 TCP 66 39752 > http [ACK] Seq=98 Ack=130779 Win=84480 Len=0 TSval=10528246 TSecr=1684745191
 38   0.012374 54.230.116.98 -> 172.31.8.238 TCP 10202 [TCP segment of a reassembled PDU]
 39   0.012382 172.31.8.238 -> 54.230.116.98 TCP 66 39752 > http [ACK] Seq=98 Ack=140915 Win=129280 Len=0 TSval=10528247 TSecr=1684745191
 40   0.012481 54.230.116.98 -> 172.31.8.238 TCP 15994 [TCP segment of a reassembled PDU]
 41   0.012491 172.31.8.238 -> 54.230.116.98 TCP 66 39752 > http [ACK] Seq=98 Ack=156843 Win=161152 Len=0 TSval=10528247 TSecr=1684745191
 42   0.013082 54.230.116.98 -> 172.31.8.238 TCP 5858 [TCP segment of a reassembled PDU]
 43   0.013088 172.31.8.238 -> 54.230.116.98 TCP 66 39752 > http [ACK] Seq=98 Ack=162635 Win=172800 Len=0 TSval=10528247 TSecr=1684745191
 44   0.013201 54.230.116.98 -> 172.31.8.238 TCP 20338 [TCP segment of a reassembled PDU]
 45   0.013212 172.31.8.238 -> 54.230.116.98 TCP 66 39752 > http [ACK] Seq=98 Ack=182907 Win=213376 Len=0 TSval=10528247 TSecr=1684745191
 46   0.013738 54.230.116.98 -> 172.31.8.238 TCP 5858 [TCP segment of a reassembled PDU]
 47   0.013744 172.31.8.238 -> 54.230.116.98 TCP 66 39752 > http [ACK] Seq=98 Ack=188699 Win=224896 Len=0 TSval=10528247 TSecr=1684745191
 48   0.013851 54.230.116.98 -> 172.31.8.238 TCP 26130 [TCP segment of a reassembled PDU]
 49   0.013864 172.31.8.238 -> 54.230.116.98 TCP 66 39752 > http [ACK] Seq=98 Ack=214763 Win=276992 Len=0 TSval=10528247 TSecr=1684745191
 50   0.013947 54.230.116.98 -> 172.31.8.238 TCP 8754 [TCP segment of a reassembled PDU]
 51   0.013953 172.31.8.238 -> 54.230.116.98 TCP 66 39752 > http [ACK] Seq=98 Ack=223451 Win=294400 Len=0 TSval=10528247 TSecr=1684745191
 52   0.014406 54.230.116.98 -> 172.31.8.238 TCP 17442 [TCP segment of a reassembled PDU]
 53   0.014416 172.31.8.238 -> 54.230.116.98 TCP 66 39752 > http [ACK] Seq=98 Ack=240827 Win=329216 Len=0 TSval=10528247 TSecr=1684745191
 54   0.014515 54.230.116.98 -> 172.31.8.238 TCP 17442 [TCP segment of a reassembled PDU]
 55   0.014524 172.31.8.238 -> 54.230.116.98 TCP 66 39752 > http [ACK] Seq=98 Ack=258203 Win=363904 Len=0 TSval=10528247 TSecr=1684745191
 56   0.014717 54.230.116.98 -> 172.31.8.238 TCP 2962 [TCP segment of a reassembled PDU]
 57   0.014723 172.31.8.238 -> 54.230.116.98 TCP 66 39752 > http [ACK] Seq=98 Ack=261099 Win=369664 Len=0 TSval=10528247 TSecr=1684745191
 58   0.015163 54.230.116.98 -> 172.31.8.238 TCP 15994 [TCP segment of a reassembled PDU]
 59   0.015173 172.31.8.238 -> 54.230.116.98 TCP 66 39752 > http [ACK] Seq=98 Ack=277027 Win=401536 Len=0 TSval=10528247 TSecr=1684745191
 60   0.015285 54.230.116.98 -> 172.31.8.238 TCP 26130 [TCP segment of a reassembled PDU]
 61   0.015299 172.31.8.238 -> 54.230.116.98 TCP 66 39752 > http [ACK] Seq=98 Ack=303091 Win=453632 Len=0 TSval=10528247 TSecr=1684745191
 62   0.015306 54.230.116.98 -> 172.31.8.238 TCP 2962 [TCP segment of a reassembled PDU]
 63   0.015308 172.31.8.238 -> 54.230.116.98 TCP 66 39752 > http [ACK] Seq=98 Ack=305987 Win=459520 Len=0 TSval=10528247 TSecr=1684745191
 64   0.015923 54.230.116.98 -> 172.31.8.238 TCP 4410 [TCP segment of a reassembled PDU]
 65   0.015942 172.31.8.238 -> 54.230.116.98 TCP 66 39752 > http [ACK] Seq=98 Ack=310331 Win=468224 Len=0 TSval=10528248 TSecr=1684745191
 66   0.016086 54.230.116.98 -> 172.31.8.238 TCP 26130 [TCP segment of a reassembled PDU]
 67   0.016100 172.31.8.238 -> 54.230.116.98 TCP 66 39752 > http [ACK] Seq=98 Ack=336395 Win=520320 Len=0 TSval=10528248 TSecr=1684745191
 68   0.016152 54.230.116.98 -> 172.31.8.238 TCP 18890 [TCP segment of a reassembled PDU]
 69   0.016163 172.31.8.238 -> 54.230.116.98 TCP 66 39752 > http [ACK] Seq=98 Ack=355219 Win=557952 Len=0 TSval=10528248 TSecr=1684745191
 70   0.016647 54.230.116.98 -> 172.31.8.238 TCP 5858 [TCP segment of a reassembled PDU]
 71   0.016654 172.31.8.238 -> 54.230.116.98 TCP 66 39752 > http [ACK] Seq=98 Ack=361011 Win=569472 Len=0 TSval=10528248 TSecr=1684745191
 72   0.016834 54.230.116.98 -> 172.31.8.238 TCP 26130 [TCP segment of a reassembled PDU]
 73   0.016859 172.31.8.238 -> 54.230.116.98 TCP 66 39752 > http [ACK] Seq=98 Ack=387075 Win=621696 Len=0 TSval=10528248 TSecr=1684745191
 74   0.016877 54.230.116.98 -> 172.31.8.238 TCP 5858 [TCP segment of a reassembled PDU]
 75   0.016881 172.31.8.238 -> 54.230.116.98 TCP 66 39752 > http [ACK] Seq=98 Ack=392867 Win=633216 Len=0 TSval=10528248 TSecr=1684745191
 76   0.016942 54.230.116.98 -> 172.31.8.238 TCP 7306 [TCP segment of a reassembled PDU]
 77   0.016949 172.31.8.238 -> 54.230.116.98 TCP 66 39752 > http [ACK] Seq=98 Ack=400107 Win=647680 Len=0 TSval=10528248 TSecr=1684745191
 78   0.017080 54.230.116.98 -> 172.31.8.238 TCP 13098 [TCP segment of a reassembled PDU]
 79   0.017089 172.31.8.238 -> 54.230.116.98 TCP 66 39752 > http [ACK] Seq=98 Ack=413139 Win=673792 Len=0 TSval=10528248 TSecr=1684745191
 80   0.017199 54.230.116.98 -> 172.31.8.238 TCP 7306 [TCP segment of a reassembled PDU]
 81   0.017205 172.31.8.238 -> 54.230.116.98 TCP 66 39752 > http [ACK] Seq=98 Ack=420379 Win=688256 Len=0 TSval=10528248 TSecr=1684745191
 82   0.017415 54.230.116.98 -> 172.31.8.238 TCP 2962 [TCP segment of a reassembled PDU]
 83   0.017419 172.31.8.238 -> 54.230.116.98 TCP 66 39752 > http [ACK] Seq=98 Ack=423275 Win=694016 Len=0 TSval=10528248 TSecr=1684745191
 84   0.017581 54.230.116.98 -> 172.31.8.238 TCP 24682 [TCP segment of a reassembled PDU]
 85   0.017593 172.31.8.238 -> 54.230.116.98 TCP 66 39752 > http [ACK] Seq=98 Ack=447891 Win=743296 Len=0 TSval=10528248 TSecr=1684745191
 86   0.017824 54.230.116.98 -> 172.31.8.238 TCP 26130 [TCP segment of a reassembled PDU]
 87   0.017834 172.31.8.238 -> 54.230.116.98 TCP 66 39752 > http [ACK] Seq=98 Ack=473955 Win=795392 Len=0 TSval=10528248 TSecr=1684745191
 88   0.018185 54.230.116.98 -> 172.31.8.238 TCP 4410 [TCP segment of a reassembled PDU]
 89   0.018191 172.31.8.238 -> 54.230.116.98 TCP 66 39752 > http [ACK] Seq=98 Ack=478299 Win=804096 Len=0 TSval=10528248 TSecr=1684745191
 90   0.018364 54.230.116.98 -> 172.31.8.238 TCP 26130 [TCP segment of a reassembled PDU]
 91   0.018377 172.31.8.238 -> 54.230.116.98 TCP 66 39752 > http [ACK] Seq=98 Ack=504363 Win=856192 Len=0 TSval=10528248 TSecr=1684745191
 92   0.018408 54.230.116.98 -> 172.31.8.238 TCP 13098 [TCP segment of a reassembled PDU]
 93   0.018416 172.31.8.238 -> 54.230.116.98 TCP 66 39752 > http [ACK] Seq=98 Ack=517395 Win=882304 Len=0 TSval=10528248 TSecr=1684745191
 94   0.018528 54.230.116.98 -> 172.31.8.238 TCP 18890 [TCP segment of a reassembled PDU]
 95   0.018538 172.31.8.238 -> 54.230.116.98 TCP 66 39752 > http [ACK] Seq=98 Ack=536219 Win=919936 Len=0 TSval=10528248 TSecr=1684745191
 96   0.018606 54.230.116.98 -> 172.31.8.238 TCP 2962 [TCP segment of a reassembled PDU]
 97   0.018611 172.31.8.238 -> 54.230.116.98 TCP 66 39752 > http [ACK] Seq=98 Ack=539115 Win=925696 Len=0 TSval=10528248 TSecr=1684745191
 98   0.018959 54.230.116.98 -> 172.31.8.238 TCP 10202 [TCP segment of a reassembled PDU]
 99   0.018965 172.31.8.238 -> 54.230.116.98 TCP 66 39752 > http [ACK] Seq=98 Ack=549251 Win=946048 Len=0 TSval=10528248 TSecr=1684745192
100   0.019132 54.230.116.98 -> 172.31.8.238 TCP 26130 [TCP segment of a reassembled PDU]
101   0.019145 172.31.8.238 -> 54.230.116.98 TCP 66 39752 > http [ACK] Seq=98 Ack=575315 Win=993408 Len=0 TSval=10528248 TSecr=1684745192
102   0.019152 54.230.116.98 -> 172.31.8.238 TCP 2962 [TCP segment of a reassembled PDU]
103   0.019155 172.31.8.238 -> 54.230.116.98 TCP 66 39752 > http [ACK] Seq=98 Ack=578211 Win=990592 Len=0 TSval=10528248 TSecr=1684745192
104   0.019262 54.230.116.98 -> 172.31.8.238 TCP 4410 [TCP segment of a reassembled PDU]
105   0.019267 172.31.8.238 -> 54.230.116.98 TCP 66 39752 > http [ACK] Seq=98 Ack=582555 Win=1006848 Len=0 TSval=10528248 TSecr=1684745192
106   0.019383 54.230.116.98 -> 172.31.8.238 TCP 21786 [TCP segment of a reassembled PDU]
107   0.019395 172.31.8.238 -> 54.230.116.98 TCP 66 39752 > http [ACK] Seq=98 Ack=604275 Win=1000448 Len=0 TSval=10528248 TSecr=1684745192
108   0.019720 54.230.116.98 -> 172.31.8.238 TCP 7306 [TCP segment of a reassembled PDU]
109   0.019727 172.31.8.238 -> 54.230.116.98 TCP 66 39752 > http [ACK] Seq=98 Ack=611515 Win=1021312 Len=0 TSval=10528249 TSecr=1684745192
110   0.019894 54.230.116.98 -> 172.31.8.238 TCP 26130 [TCP segment of a reassembled PDU]
111   0.019907 172.31.8.238 -> 54.230.116.98 TCP 66 39752 > http [ACK] Seq=98 Ack=637579 Win=1073408 Len=0 TSval=10528249 TSecr=1684745192
112   0.019965 54.230.116.98 -> 172.31.8.238 TCP 18890 [TCP segment of a reassembled PDU]
113   0.019975 172.31.8.238 -> 54.230.116.98 TCP 66 39752 > http [ACK] Seq=98 Ack=656403 Win=1111040 Len=0 TSval=10528249 TSecr=1684745192
114   0.020030 54.230.116.98 -> 172.31.8.238 TCP 13098 [TCP segment of a reassembled PDU]
115   0.020039 172.31.8.238 -> 54.230.116.98 TCP 66 39752 > http [ACK] Seq=98 Ack=669435 Win=1137152 Len=0 TSval=10528249 TSecr=1684745192
116   0.020405 54.230.116.98 -> 172.31.8.238 TCP 26130 [TCP segment of a reassembled PDU]
117   0.020418 172.31.8.238 -> 54.230.116.98 TCP 66 39752 > http [ACK] Seq=98 Ack=695499 Win=1189248 Len=0 TSval=10528249 TSecr=1684745192
118   0.020425 54.230.116.98 -> 172.31.8.238 TCP 2962 [TCP segment of a reassembled PDU]
119   0.020428 172.31.8.238 -> 54.230.116.98 TCP 66 39752 > http [ACK] Seq=98 Ack=698395 Win=1195008 Len=0 TSval=10528249 TSecr=1684745192
120   0.020547 54.230.116.98 -> 172.31.8.238 TCP 11650 [TCP segment of a reassembled PDU]
121   0.020556 172.31.8.238 -> 54.230.116.98 TCP 66 39752 > http [ACK] Seq=98 Ack=709979 Win=1218176 Len=0 TSval=10528249 TSecr=1684745192
122   0.020678 54.230.116.98 -> 172.31.8.238 TCP 24682 [TCP segment of a reassembled PDU]
123   0.020690 172.31.8.238 -> 54.230.116.98 TCP 66 39752 > http [ACK] Seq=98 Ack=734595 Win=1267456 Len=0 TSval=10528249 TSecr=1684745192
124   0.021045 54.230.116.98 -> 172.31.8.238 TCP 4410 [TCP segment of a reassembled PDU]
125   0.021051 172.31.8.238 -> 54.230.116.98 TCP 66 39752 > http [ACK] Seq=98 Ack=738939 Win=1276160 Len=0 TSval=10528249 TSecr=1684745192
126   0.021214 54.230.116.98 -> 172.31.8.238 TCP 18890 [TCP segment of a reassembled PDU]
127   0.021225 172.31.8.238 -> 54.230.116.98 TCP 66 39752 > http [ACK] Seq=98 Ack=757763 Win=1313792 Len=0 TSval=10528249 TSecr=1684745192
128   0.021333 54.230.116.98 -> 172.31.8.238 TCP 33370 [TCP segment of a reassembled PDU]
129   0.021348 172.31.8.238 -> 54.230.116.98 TCP 66 39752 > http [ACK] Seq=98 Ack=791067 Win=1380352 Len=0 TSval=10528249 TSecr=1684745192
130   0.021356 54.230.116.98 -> 172.31.8.238 TCP 8754 [TCP segment of a reassembled PDU]
131   0.021362 172.31.8.238 -> 54.230.116.98 TCP 66 39752 > http [ACK] Seq=98 Ack=799755 Win=1397760 Len=0 TSval=10528249 TSecr=1684745192
132   0.021819 54.230.116.98 -> 172.31.8.238 TCP 7306 [TCP segment of a reassembled PDU]
133   0.021826 172.31.8.238 -> 54.230.116.98 TCP 66 39752 > http [ACK] Seq=98 Ack=806995 Win=1412224 Len=0 TSval=10528249 TSecr=1684745192
134   0.021990 54.230.116.98 -> 172.31.8.238 TCP 26130 [TCP segment of a reassembled PDU]
135   0.022003 172.31.8.238 -> 54.230.116.98 TCP 66 39752 > http [ACK] Seq=98 Ack=833059 Win=1452928 Len=0 TSval=10528249 TSecr=1684745192
136   0.022011 54.230.116.98 -> 172.31.8.238 TCP 4410 [TCP segment of a reassembled PDU]
137   0.022014 172.31.8.238 -> 54.230.116.98 TCP 66 39752 > http [ACK] Seq=98 Ack=837403 Win=1448704 Len=0 TSval=10528249 TSecr=1684745192
138   0.022236 54.230.116.98 -> 172.31.8.238 TCP 26130 [TCP segment of a reassembled PDU]
139   0.022249 172.31.8.238 -> 54.230.116.98 TCP 66 39752 > http [ACK] Seq=98 Ack=863467 Win=1452928 Len=0 TSval=10528249 TSecr=1684745192
140   0.022295 54.230.116.98 -> 172.31.8.238 TCP 21786 [TCP segment of a reassembled PDU]
141   0.022306 172.31.8.238 -> 54.230.116.98 TCP 66 39752 > http [ACK] Seq=98 Ack=885187 Win=1459968 Len=0 TSval=10528249 TSecr=1684745192
142   0.022360 54.230.116.98 -> 172.31.8.238 TCP 17442 [TCP segment of a reassembled PDU]
143   0.022370 172.31.8.238 -> 54.230.116.98 TCP 66 39752 > http [ACK] Seq=98 Ack=902563 Win=1467136 Len=0 TSval=10528249 TSecr=1684745192
144   0.022572 54.230.116.98 -> 172.31.8.238 TCP 2962 [TCP segment of a reassembled PDU]
145   0.022577 172.31.8.238 -> 54.230.116.98 TCP 66 39752 > http [ACK] Seq=98 Ack=905459 Win=1490944 Len=0 TSval=10528249 TSecr=1684745192
146   0.022733 54.230.116.98 -> 172.31.8.238 TCP 20338 [TCP segment of a reassembled PDU]
147   0.022755 54.230.116.98 -> 172.31.8.238 TCP 4410 [TCP segment of a reassembled PDU]
148   0.022760 172.31.8.238 -> 54.230.116.98 TCP 66 39752 > http [ACK] Seq=98 Ack=925731 Win=1470720 Len=0 TSval=10528249 TSecr=1684745192
149   0.022774 172.31.8.238 -> 54.230.116.98 TCP 66 39752 > http [ACK] Seq=98 Ack=930075 Win=1491200 Len=0 TSval=10528249 TSecr=1684745192
150   0.022878 54.230.116.98 -> 172.31.8.238 TCP 5858 [TCP segment of a reassembled PDU]
151   0.022890 172.31.8.238 -> 54.230.116.98 TCP 66 39752 > http [ACK] Seq=98 Ack=935867 Win=1491200 Len=0 TSval=10528249 TSecr=1684745192
152   0.022998 54.230.116.98 -> 172.31.8.238 TCP 26130 [TCP segment of a reassembled PDU]
153   0.023039 54.230.116.98 -> 172.31.8.238 TCP 10202 [TCP segment of a reassembled PDU]
154   0.023088 54.230.116.98 -> 172.31.8.238 TCP 5858 [TCP segment of a reassembled PDU]
155   0.023108 172.31.8.238 -> 54.230.116.98 TCP 66 39752 > http [ACK] Seq=98 Ack=977859 Win=1449216 Len=0 TSval=10528249 TSecr=1684745192
156   0.023243 54.230.116.98 -> 172.31.8.238 TCP 17442 [TCP segment of a reassembled PDU]
157   0.023253 172.31.8.238 -> 54.230.116.98 TCP 66 39752 > http [ACK] Seq=98 Ack=995235 Win=1467136 Len=0 TSval=10528249 TSecr=1684745192
158   0.023368 54.230.116.98 -> 172.31.8.238 TCP 10202 [TCP segment of a reassembled PDU]
159   0.023375 172.31.8.238 -> 54.230.116.98 TCP 66 39752 > http [ACK] Seq=98 Ack=1005371 Win=1479040 Len=0 TSval=10528249 TSecr=1684745192
160   0.023521 54.230.116.98 -> 172.31.8.238 TCP 26130 [TCP segment of a reassembled PDU]
161   0.023542 172.31.8.238 -> 54.230.116.98 TCP 66 39752 > http [ACK] Seq=98 Ack=1031435 Win=1453056 Len=0 TSval=10528249 TSecr=1684745192
162   0.023555 54.230.116.98 -> 172.31.8.238 TCP 8754 [TCP segment of a reassembled PDU]
163   0.023572 172.31.8.238 -> 54.230.116.98 TCP 66 39752 > http [ACK] Seq=98 Ack=1040123 Win=1481472 Len=0 TSval=10528249 TSecr=1684745192
164   0.023859 54.230.116.98 -> 172.31.8.238 TCP 7306 [TCP segment of a reassembled PDU]
165   0.023866 172.31.8.238 -> 54.230.116.98 TCP 66 39752 > http [ACK] Seq=98 Ack=1047363 Win=1483776 Len=0 TSval=10528250 TSecr=1684745192
166   0.024049 54.230.116.98 -> 172.31.8.238 TCP 26130 [TCP segment of a reassembled PDU]
167   0.024063 172.31.8.238 -> 54.230.116.98 TCP 66 39752 > http [ACK] Seq=98 Ack=1073427 Win=1489024 Len=0 TSval=10528250 TSecr=1684745192
168   0.024119 54.230.116.98 -> 172.31.8.238 TCP 20338 [TCP segment of a reassembled PDU]
169   0.024130 172.31.8.238 -> 54.230.116.98 TCP 66 39752 > http [ACK] Seq=98 Ack=1093699 Win=1498496 Len=0 TSval=10528250 TSecr=1684745192
170   0.024170 54.230.116.98 -> 172.31.8.238 TCP 5858 [TCP segment of a reassembled PDU]
171   0.024260 54.230.116.98 -> 172.31.8.238 TCP 26130 [TCP segment of a reassembled PDU]
172   0.024360 172.31.8.238 -> 54.230.116.98 TCP 66 39752 > http [ACK] Seq=98 Ack=1125555 Win=1466752 Len=0 TSval=10528250 TSecr=1684745192
173   0.024652 54.230.116.98 -> 172.31.8.238 TCP 2962 [TCP segment of a reassembled PDU]
174   0.024658 172.31.8.238 -> 54.230.116.98 TCP 66 39752 > http [ACK] Seq=98 Ack=1128451 Win=1522432 Len=0 TSval=10528250 TSecr=1684745192
175   0.024822 54.230.116.98 -> 172.31.8.238 TCP 26130 [TCP segment of a reassembled PDU]
176   0.024846 172.31.8.238 -> 54.230.116.98 TCP 66 39752 > http [ACK] Seq=98 Ack=1154515 Win=1496448 Len=0 TSval=10528250 TSecr=1684745192
177   0.024890 54.230.116.98 -> 172.31.8.238 TCP 26130 [TCP segment of a reassembled PDU]
178   0.024916 172.31.8.238 -> 54.230.116.98 TCP 66 39752 > http [ACK] Seq=98 Ack=1180579 Win=1489024 Len=0 TSval=10528250 TSecr=1684745192
179   0.024947 54.230.116.98 -> 172.31.8.238 TCP 10202 [TCP segment of a reassembled PDU]
180   0.024954 172.31.8.238 -> 54.230.116.98 TCP 66 39752 > http [ACK] Seq=98 Ack=1190715 Win=1515136 Len=0 TSval=10528250 TSecr=1684745192
181   0.025281 54.230.116.98 -> 172.31.8.238 TCP 26130 [TCP segment of a reassembled PDU]
182   0.025306 172.31.8.238 -> 54.230.116.98 TCP 66 39752 > http [ACK] Seq=98 Ack=1216779 Win=1489152 Len=0 TSval=10528250 TSecr=1684745192
183   0.025423 54.230.116.98 -> 172.31.8.238 TCP 39162 [TCP segment of a reassembled PDU]
184   0.025452 172.31.8.238 -> 54.230.116.98 TCP 66 39752 > http [ACK] Seq=98 Ack=1255875 Win=1467520 Len=0 TSval=10528250 TSecr=1684745192
185   0.025674 54.230.116.98 -> 172.31.8.238 TCP 4410 [TCP segment of a reassembled PDU]
186   0.025680 172.31.8.238 -> 54.230.116.98 TCP 66 39752 > http [ACK] Seq=98 Ack=1260219 Win=1522432 Len=0 TSval=10528250 TSecr=1684745192
187   0.025866 54.230.116.98 -> 172.31.8.238 TCP 18890 [TCP segment of a reassembled PDU]
188   0.025889 172.31.8.238 -> 54.230.116.98 TCP 66 39752 > http [ACK] Seq=98 Ack=1279043 Win=1503616 Len=0 TSval=10528250 TSecr=1684745192
189   0.025940 54.230.116.98 -> 172.31.8.238 TCP 7306 [TCP segment of a reassembled PDU]
190   0.025947 172.31.8.238 -> 54.230.116.98 TCP 66 39752 > http [ACK] Seq=98 Ack=1286283 Win=1519872 Len=0 TSval=10528250 TSecr=1684745192
191   0.026060 54.230.116.98 -> 172.31.8.238 TCP 34818 [TCP segment of a reassembled PDU]
192   0.026111 54.230.116.98 -> 172.31.8.238 TCP 8754 [TCP segment of a reassembled PDU]
193   0.026190 54.230.116.98 -> 172.31.8.238 TCP 26130 [TCP segment of a reassembled PDU]
194   0.026227 172.31.8.238 -> 54.230.116.98 TCP 66 39752 > http [ACK] Seq=98 Ack=1355787 Win=1450368 Len=0 TSval=10528250 TSecr=1684745192
195   0.026271 54.230.116.98 -> 172.31.8.238 TCP 26130 [TCP segment of a reassembled PDU]
196   0.026293 172.31.8.238 -> 54.230.116.98 TCP 66 39752 > http [ACK] Seq=98 Ack=1381851 Win=1446144 Len=0 TSval=10528250 TSecr=1684745192
197   0.026319 54.230.116.98 -> 172.31.8.238 TCP 4410 [TCP segment of a reassembled PDU]
198   0.026326 172.31.8.238 -> 54.230.116.98 TCP 66 39752 > http [ACK] Seq=98 Ack=1386195 Win=1522432 Len=0 TSval=10528250 TSecr=1684745192
199   0.026994 54.230.116.98 -> 172.31.8.238 TCP 2962 [TCP segment of a reassembled PDU]
200   0.026999 172.31.8.238 -> 54.230.116.98 TCP 66 39752 > http [ACK] Seq=98 Ack=1389091 Win=1522432 Len=0 TSval=10528250 TSecr=1684745192
201   0.027171 54.230.116.98 -> 172.31.8.238 TCP 26130 [TCP segment of a reassembled PDU]
202   0.027195 172.31.8.238 -> 54.230.116.98 TCP 66 39752 > http [ACK] Seq=98 Ack=1415155 Win=1496448 Len=0 TSval=10528250 TSecr=1684745192
203   0.027241 54.230.116.98 -> 172.31.8.238 TCP 26130 [TCP segment of a reassembled PDU]
204   0.027335 54.230.116.98 -> 172.31.8.238 TCP 26130 [TCP segment of a reassembled PDU]
205   0.027411 54.230.116.98 -> 172.31.8.238 TCP 26130 [TCP segment of a reassembled PDU]
206   0.027468 54.230.116.98 -> 172.31.8.238 TCP 23234 [TCP segment of a reassembled PDU]
207   0.027496 172.31.8.238 -> 54.230.116.98 TCP 66 39752 > http [ACK] Seq=98 Ack=1516515 Win=1395200 Len=0 TSval=10528250 TSecr=1684745192
208   0.028189 54.230.116.98 -> 172.31.8.238 TCP 5858 [TCP segment of a reassembled PDU]
209   0.028196 172.31.8.238 -> 54.230.116.98 TCP 66 39752 > http [ACK] Seq=98 Ack=1522307 Win=1522304 Len=0 TSval=10528251 TSecr=1684745192
210   0.028365 54.230.116.98 -> 172.31.8.238 TCP 26130 [TCP segment of a reassembled PDU]
211   0.028390 172.31.8.238 -> 54.230.116.98 TCP 66 39752 > http [ACK] Seq=98 Ack=1548371 Win=1496320 Len=0 TSval=10528251 TSecr=1684745192
212   0.028429 54.230.116.98 -> 172.31.8.238 TCP 26130 [TCP segment of a reassembled PDU]
213   0.028453 172.31.8.238 -> 54.230.116.98 TCP 66 39752 > http [ACK] Seq=98 Ack=1574435 Win=1489024 Len=0 TSval=10528251 TSecr=1684745192
214   0.028505 54.230.116.98 -> 172.31.8.238 TCP 26130 [TCP segment of a reassembled PDU]
215   0.028519 172.31.8.238 -> 54.230.116.98 TCP 66 39752 > http [ACK] Seq=98 Ack=1600499 Win=1489024 Len=0 TSval=10528251 TSecr=1684745192
216   0.028579 54.230.116.98 -> 172.31.8.238 TCP 26130 [TCP segment of a reassembled PDU]
217   0.028593 172.31.8.238 -> 54.230.116.98 TCP 66 39752 > http [ACK] Seq=98 Ack=1626563 Win=1489024 Len=0 TSval=10528251 TSecr=1684745192
218   0.028647 54.230.116.98 -> 172.31.8.238 TCP 20338 [TCP segment of a reassembled PDU]
219   0.028658 172.31.8.238 -> 54.230.116.98 TCP 66 39752 > http [ACK] Seq=98 Ack=1646835 Win=1498496 Len=0 TSval=10528251 TSecr=1684745192
220   0.029077 54.230.116.98 -> 172.31.8.238 TCP 5858 [TCP segment of a reassembled PDU]
221   0.029084 172.31.8.238 -> 54.230.116.98 TCP 66 39752 > http [ACK] Seq=98 Ack=1652627 Win=1522304 Len=0 TSval=10528251 TSecr=1684745193
222   0.029235 54.230.116.98 -> 172.31.8.238 TCP 26130 [TCP segment of a reassembled PDU]
223   0.029260 172.31.8.238 -> 54.230.116.98 TCP 66 39752 > http [ACK] Seq=98 Ack=1678691 Win=1496320 Len=0 TSval=10528251 TSecr=1684745193
224   0.029309 54.230.116.98 -> 172.31.8.238 TCP 26130 [TCP segment of a reassembled PDU]
225   0.029347 172.31.8.238 -> 54.230.116.98 TCP 66 39752 > http [ACK] Seq=98 Ack=1704755 Win=1489024 Len=0 TSval=10528251 TSecr=1684745193
226   0.029413 54.230.116.98 -> 172.31.8.238 TCP 26130 [TCP segment of a reassembled PDU]
227   0.029426 172.31.8.238 -> 54.230.116.98 TCP 66 39752 > http [ACK] Seq=98 Ack=1730819 Win=1489024 Len=0 TSval=10528251 TSecr=1684745193
228   0.029496 54.230.116.98 -> 172.31.8.238 TCP 26130 [TCP segment of a reassembled PDU]
229   0.029510 172.31.8.238 -> 54.230.116.98 TCP 66 39752 > http [ACK] Seq=98 Ack=1756883 Win=1489024 Len=0 TSval=10528251 TSecr=1684745193
230   0.029562 54.230.116.98 -> 172.31.8.238 TCP 20338 [TCP segment of a reassembled PDU]
231   0.029572 172.31.8.238 -> 54.230.116.98 TCP 66 39752 > http [ACK] Seq=98 Ack=1777155 Win=1498496 Len=0 TSval=10528251 TSecr=1684745193
232   0.029983 54.230.116.98 -> 172.31.8.238 TCP 2962 [TCP segment of a reassembled PDU]
233   0.029989 172.31.8.238 -> 54.230.116.98 TCP 66 39752 > http [ACK] Seq=98 Ack=1780051 Win=1522432 Len=0 TSval=10528251 TSecr=1684745193
234   0.030158 54.230.116.98 -> 172.31.8.238 TCP 26130 [TCP segment of a reassembled PDU]
235   0.030182 172.31.8.238 -> 54.230.116.98 TCP 66 39752 > http [ACK] Seq=98 Ack=1806115 Win=1496448 Len=0 TSval=10528251 TSecr=1684745193
236   0.030224 54.230.116.98 -> 172.31.8.238 TCP 26130 [TCP segment of a reassembled PDU]
237   0.030248 172.31.8.238 -> 54.230.116.98 TCP 66 39752 > http [ACK] Seq=98 Ack=1832179 Win=1489024 Len=0 TSval=10528251 TSecr=1684745193
238   0.030303 54.230.116.98 -> 172.31.8.238 TCP 26130 [TCP segment of a reassembled PDU]
239   0.030315 172.31.8.238 -> 54.230.116.98 TCP 66 39752 > http [ACK] Seq=98 Ack=1858243 Win=1489024 Len=0 TSval=10528251 TSecr=1684745193
240   0.030380 54.230.116.98 -> 172.31.8.238 TCP 26130 [TCP segment of a reassembled PDU]
241   0.030388 172.31.8.238 -> 54.230.116.98 TCP 66 39752 > http [ACK] Seq=98 Ack=1884307 Win=1489024 Len=0 TSval=10528251 TSecr=1684745193
242   0.030447 54.230.116.98 -> 172.31.8.238 TCP 23234 [TCP segment of a reassembled PDU]
243   0.030453 172.31.8.238 -> 54.230.116.98 TCP 66 39752 > http [ACK] Seq=98 Ack=1907475 Win=1493760 Len=0 TSval=10528251 TSecr=1684745193
244   0.030880 54.230.116.98 -> 172.31.8.238 TCP 2962 [TCP segment of a reassembled PDU]
245   0.030885 172.31.8.238 -> 54.230.116.98 TCP 66 39752 > http [ACK] Seq=98 Ack=1910371 Win=1522432 Len=0 TSval=10528251 TSecr=1684745193
246   0.031052 54.230.116.98 -> 172.31.8.238 TCP 26130 [TCP segment of a reassembled PDU]
247   0.031070 172.31.8.238 -> 54.230.116.98 TCP 66 39752 > http [ACK] Seq=98 Ack=1936435 Win=1496448 Len=0 TSval=10528251 TSecr=1684745193
248   0.031124 54.230.116.98 -> 172.31.8.238 TCP 26130 [TCP segment of a reassembled PDU]
249   0.031155 172.31.8.238 -> 54.230.116.98 TCP 66 39752 > http [ACK] Seq=98 Ack=1962499 Win=1489024 Len=0 TSval=10528251 TSecr=1684745193
250   0.031213 54.230.116.98 -> 172.31.8.238 TCP 26130 [TCP segment of a reassembled PDU]
251   0.031220 172.31.8.238 -> 54.230.116.98 TCP 66 39752 > http [ACK] Seq=98 Ack=1988563 Win=1489024 Len=0 TSval=10528251 TSecr=1684745193
252   0.031289 54.230.116.98 -> 172.31.8.238 TCP 26130 [TCP segment of a reassembled PDU]
253   0.031295 172.31.8.238 -> 54.230.116.98 TCP 66 39752 > http [ACK] Seq=98 Ack=2014627 Win=1489024 Len=0 TSval=10528251 TSecr=1684745193
254   0.031353 54.230.116.98 -> 172.31.8.238 TCP 23234 [TCP segment of a reassembled PDU]
255   0.031420 172.31.8.238 -> 54.230.116.98 TCP 66 39752 > http [ACK] Seq=98 Ack=2037795 Win=1465856 Len=0 TSval=10528251 TSecr=1684745193
256   0.031828 54.230.116.98 -> 172.31.8.238 TCP 2962 [TCP segment of a reassembled PDU]
257   0.031832 172.31.8.238 -> 54.230.116.98 TCP 66 39752 > http [ACK] Seq=98 Ack=2040691 Win=1522432 Len=0 TSval=10528252 TSecr=1684745193
258   0.032015 54.230.116.98 -> 172.31.8.238 TCP 26130 [TCP segment of a reassembled PDU]
259   0.032034 172.31.8.238 -> 54.230.116.98 TCP 66 39752 > http [ACK] Seq=98 Ack=2066755 Win=1496448 Len=0 TSval=10528252 TSecr=1684745193
260   0.032085 54.230.116.98 -> 172.31.8.238 TCP 26130 [TCP segment of a reassembled PDU]
261   0.032104 172.31.8.238 -> 54.230.116.98 TCP 66 39752 > http [ACK] Seq=98 Ack=2092819 Win=1489024 Len=0 TSval=10528252 TSecr=1684745193
262   0.032169 54.230.116.98 -> 172.31.8.238 TCP 26130 [TCP segment of a reassembled PDU]
263   0.032176 172.31.8.238 -> 54.230.116.98 TCP 66 39752 > http [ACK] Seq=98 Ack=2118883 Win=1489024 Len=0 TSval=10528252 TSecr=1684745193
264   0.032241 54.230.116.98 -> 172.31.8.238 TCP 15994 [TCP segment of a reassembled PDU]
265   0.032307 172.31.8.238 -> 54.230.116.98 TCP 66 39752 > http [ACK] Seq=98 Ack=2134811 Win=1473152 Len=0 TSval=10528252 TSecr=1684745193
266   0.032364 54.230.116.98 -> 172.31.8.238 TCP 26130 [TCP segment of a reassembled PDU]
267   0.032370 172.31.8.238 -> 54.230.116.98 TCP 66 39752 > http [ACK] Seq=98 Ack=2160875 Win=1489024 Len=0 TSval=10528252 TSecr=1684745193
268   0.032417 54.230.116.98 -> 172.31.8.238 TCP 7306 [TCP segment of a reassembled PDU]
269   0.032421 172.31.8.238 -> 54.230.116.98 TCP 66 39752 > http [ACK] Seq=98 Ack=2168115 Win=1519872 Len=0 TSval=10528252 TSecr=1684745193
270   0.032854 54.230.116.98 -> 172.31.8.238 TCP 2962 [TCP segment of a reassembled PDU]
271   0.032859 172.31.8.238 -> 54.230.116.98 TCP 66 39752 > http [ACK] Seq=98 Ack=2171011 Win=1522432 Len=0 TSval=10528252 TSecr=1684745193
272   0.033043 54.230.116.98 -> 172.31.8.238 TCP 26130 [TCP segment of a reassembled PDU]
273   0.033061 172.31.8.238 -> 54.230.116.98 TCP 66 39752 > http [ACK] Seq=98 Ack=2197075 Win=1496448 Len=0 TSval=10528252 TSecr=1684745193
274   0.033127 54.230.116.98 -> 172.31.8.238 TCP 26130 [TCP segment of a reassembled PDU]
275   0.033205 54.230.116.98 -> 172.31.8.238 TCP 26130 [TCP segment of a reassembled PDU]
276   0.033285 54.230.116.98 -> 172.31.8.238 TCP 26130 [TCP segment of a reassembled PDU]
277   0.033307 172.31.8.238 -> 54.230.116.98 TCP 66 39752 > http [ACK] Seq=98 Ack=2275267 Win=1418368 Len=0 TSval=10528252 TSecr=1684745193
278   0.033356 54.230.116.98 -> 172.31.8.238 TCP 26130 [TCP segment of a reassembled PDU]
279   0.033362 172.31.8.238 -> 54.230.116.98 TCP 66 39752 > http [ACK] Seq=98 Ack=2301331 Win=1489024 Len=0 TSval=10528252 TSecr=1684745193
280   0.033446 54.230.116.98 -> 172.31.8.238 TCP 26130 [TCP segment of a reassembled PDU]
281   0.033452 172.31.8.238 -> 54.230.116.98 TCP 66 39752 > http [ACK] Seq=98 Ack=2327395 Win=1489024 Len=0 TSval=10528252 TSecr=1684745193
282   0.033520 54.230.116.98 -> 172.31.8.238 TCP 26130 [TCP segment of a reassembled PDU]
283   0.033526 172.31.8.238 -> 54.230.116.98 TCP 66 39752 > http [ACK] Seq=98 Ack=2353459 Win=1489024 Len=0 TSval=10528252 TSecr=1684745193
284   0.033574 54.230.116.98 -> 172.31.8.238 TCP 10202 [TCP segment of a reassembled PDU]
285   0.033578 172.31.8.238 -> 54.230.116.98 TCP 66 39752 > http [ACK] Seq=98 Ack=2363595 Win=1515136 Len=0 TSval=10528252 TSecr=1684745193
286   0.034180 54.230.116.98 -> 172.31.8.238 TCP 5858 [TCP segment of a reassembled PDU]
287   0.034185 172.31.8.238 -> 54.230.116.98 TCP 66 39752 > http [ACK] Seq=98 Ack=2369387 Win=1522304 Len=0 TSval=10528252 TSecr=1684745193
288   0.034339 54.230.116.98 -> 172.31.8.238 TCP 20338 [TCP segment of a reassembled PDU]
289   0.034356 172.31.8.238 -> 54.230.116.98 TCP 66 39752 > http [ACK] Seq=98 Ack=2389659 Win=1502080 Len=0 TSval=10528252 TSecr=1684745193
290   0.034529 54.230.116.98 -> 172.31.8.238 TCP 57986 [TCP segment of a reassembled PDU]
291   0.034541 54.230.116.98 -> 172.31.8.238 TCP 4410 [TCP segment of a reassembled PDU]
292   0.034555 172.31.8.238 -> 54.230.116.98 TCP 66 39752 > http [ACK] Seq=98 Ack=2451923 Win=1439872 Len=0 TSval=10528252 TSecr=1684745193
293   0.034605 54.230.116.98 -> 172.31.8.238 TCP 21786 [TCP segment of a reassembled PDU]
294   0.034611 172.31.8.238 -> 54.230.116.98 TCP 66 39752 > http [ACK] Seq=98 Ack=2473643 Win=1496064 Len=0 TSval=10528252 TSecr=1684745193
295   0.034743 54.230.116.98 -> 172.31.8.238 TCP 36266 [TCP segment of a reassembled PDU]
296   0.034760 172.31.8.238 -> 54.230.116.98 TCP 66 39752 > http [ACK] Seq=98 Ack=2509843 Win=1472256 Len=0 TSval=10528252 TSecr=1684745193
297   0.034895 54.230.116.98 -> 172.31.8.238 TCP 49298 [TCP segment of a reassembled PDU]
298   0.034917 172.31.8.238 -> 54.230.116.98 TCP 66 39752 > http [ACK] Seq=98 Ack=2559075 Win=1450880 Len=0 TSval=10528252 TSecr=1684745193
299   0.035264 54.230.116.98 -> 172.31.8.238 TCP 2962 [TCP segment of a reassembled PDU]
300   0.035269 172.31.8.238 -> 54.230.116.98 TCP 66 39752 > http [ACK] Seq=98 Ack=2561971 Win=1522432 Len=0 TSval=10528252 TSecr=1684745193
301   0.035437 54.230.116.98 -> 172.31.8.238 TCP 26130 [TCP segment of a reassembled PDU]
302   0.035455 172.31.8.238 -> 54.230.116.98 TCP 66 39752 > http [ACK] Seq=98 Ack=2588035 Win=1496448 Len=0 TSval=10528252 TSecr=1684745193
303   0.035505 54.230.116.98 -> 172.31.8.238 TCP 26130 [TCP segment of a reassembled PDU]
304   0.035523 172.31.8.238 -> 54.230.116.98 TCP 66 39752 > http [ACK] Seq=98 Ack=2614099 Win=1489024 Len=0 TSval=10528252 TSecr=1684745193
305   0.035562 54.230.116.98 -> 172.31.8.238 TCP 10202 [TCP segment of a reassembled PDU]
306   0.035568 172.31.8.238 -> 54.230.116.98 TCP 66 39752 > http [ACK] Seq=98 Ack=2624235 Win=1515136 Len=0 TSval=10528252 TSecr=1684745193
307   0.035646 54.230.116.98 -> 172.31.8.238 TCP 26130 [TCP segment of a reassembled PDU]
308   0.035664 172.31.8.238 -> 54.230.116.98 TCP 66 39752 > http [ACK] Seq=98 Ack=2650299 Win=1489152 Len=0 TSval=10528252 TSecr=1684745193
309   0.035727 54.230.116.98 -> 172.31.8.238 TCP 26130 [TCP segment of a reassembled PDU]
310   0.035744 172.31.8.238 -> 54.230.116.98 TCP 66 39752 > http [ACK] Seq=98 Ack=2676363 Win=1489024 Len=0 TSval=10528252 TSecr=1684745193
311   0.035820 54.230.116.98 -> 172.31.8.238 TCP 13098 [TCP segment of a reassembled PDU]
312   0.035825 172.31.8.238 -> 54.230.116.98 TCP 66 39752 > http [ACK] Seq=98 Ack=2689395 Win=1510400 Len=0 TSval=10528253 TSecr=1684745193
313   0.035955 54.230.116.98 -> 172.31.8.238 TCP 26130 [TCP segment of a reassembled PDU]
314   0.035962 172.31.8.238 -> 54.230.116.98 TCP 66 39752 > http [ACK] Seq=98 Ack=2715459 Win=1574528 Len=0 TSval=10528253 TSecr=1684745193
315   0.036021 54.230.116.98 -> 172.31.8.238 TCP 23234 [TCP segment of a reassembled PDU]
316   0.036028 172.31.8.238 -> 54.230.116.98 TCP 66 39752 > http [ACK] Seq=98 Ack=2738627 Win=1574528 Len=0 TSval=10528253 TSecr=1684745193
317   0.036091 54.230.116.98 -> 172.31.8.238 TCP 15994 [TCP segment of a reassembled PDU]
318   0.036097 172.31.8.238 -> 54.230.116.98 TCP 66 39752 > http [ACK] Seq=98 Ack=2754555 Win=1574528 Len=0 TSval=10528253 TSecr=1684745193
319   0.036157 54.230.116.98 -> 172.31.8.238 TCP 20338 [TCP segment of a reassembled PDU]
320   0.036162 172.31.8.238 -> 54.230.116.98 TCP 66 39752 > http [ACK] Seq=98 Ack=2774827 Win=1574528 Len=0 TSval=10528253 TSecr=1684745193
321   0.036285 54.230.116.98 -> 172.31.8.238 TCP 26130 [TCP segment of a reassembled PDU]
322   0.036291 172.31.8.238 -> 54.230.116.98 TCP 66 39752 > http [ACK] Seq=98 Ack=2800891 Win=1574528 Len=0 TSval=10528253 TSecr=1684745193
323   0.036397 54.230.116.98 -> 172.31.8.238 TCP 30474 [TCP segment of a reassembled PDU]
324   0.036405 172.31.8.238 -> 54.230.116.98 TCP 66 39752 > http [ACK] Seq=98 Ack=2831299 Win=1574528 Len=0 TSval=10528253 TSecr=1684745193
325   0.036525 54.230.116.98 -> 172.31.8.238 TCP 26130 [TCP segment of a reassembled PDU]
326   0.036532 172.31.8.238 -> 54.230.116.98 TCP 66 39752 > http [ACK] Seq=98 Ack=2857363 Win=1574528 Len=0 TSval=10528253 TSecr=1684745193
327   0.036651 54.230.116.98 -> 172.31.8.238 TCP 27578 [TCP segment of a reassembled PDU]
328   0.036658 172.31.8.238 -> 54.230.116.98 TCP 66 39752 > http [ACK] Seq=98 Ack=2884875 Win=1574528 Len=0 TSval=10528253 TSecr=1684745193
329   0.036714 54.230.116.98 -> 172.31.8.238 TCP 26130 [TCP segment of a reassembled PDU]
330   0.036720 172.31.8.238 -> 54.230.116.98 TCP 66 39752 > http [ACK] Seq=98 Ack=2910939 Win=1574528 Len=0 TSval=10528253 TSecr=1684745193
331   0.036788 54.230.116.98 -> 172.31.8.238 TCP 26130 [TCP segment of a reassembled PDU]
332   0.036794 172.31.8.238 -> 54.230.116.98 TCP 66 39752 > http [ACK] Seq=98 Ack=2937003 Win=1574528 Len=0 TSval=10528253 TSecr=1684745193
333   0.036856 54.230.116.98 -> 172.31.8.238 TCP 20338 [TCP segment of a reassembled PDU]
334   0.036874 172.31.8.238 -> 54.230.116.98 TCP 66 39752 > http [ACK] Seq=98 Ack=2957275 Win=1574528 Len=0 TSval=10528253 TSecr=1684745193
335   0.037003 54.230.116.98 -> 172.31.8.238 TCP 26130 [TCP segment of a reassembled PDU]
336   0.037015 172.31.8.238 -> 54.230.116.98 TCP 66 39752 > http [ACK] Seq=98 Ack=2983339 Win=1574528 Len=0 TSval=10528253 TSecr=1684745193
337   0.037032 54.230.116.98 -> 172.31.8.238 TCP 26130 [TCP segment of a reassembled PDU]
338   0.037037 172.31.8.238 -> 54.230.116.98 TCP 66 39752 > http [ACK] Seq=98 Ack=3009403 Win=1574528 Len=0 TSval=10528253 TSecr=1684745193
339   0.037190 54.230.116.98 -> 172.31.8.238 TCP 20338 [TCP segment of a reassembled PDU]
340   0.037196 172.31.8.238 -> 54.230.116.98 TCP 66 39752 > http [ACK] Seq=98 Ack=3029675 Win=1574528 Len=0 TSval=10528253 TSecr=1684745193
341   0.037320 54.230.116.98 -> 172.31.8.238 TCP 26130 [TCP segment of a reassembled PDU]
342   0.037327 172.31.8.238 -> 54.230.116.98 TCP 66 39752 > http [ACK] Seq=98 Ack=3055739 Win=1574528 Len=0 TSval=10528253 TSecr=1684745193
343   0.037377 54.230.116.98 -> 172.31.8.238 TCP 26130 [TCP segment of a reassembled PDU]
344   0.037384 172.31.8.238 -> 54.230.116.98 TCP 66 39752 > http [ACK] Seq=98 Ack=3081803 Win=1574528 Len=0 TSval=10528253 TSecr=1684745193
345   0.037552 54.230.116.98 -> 172.31.8.238 TCP 26130 [TCP segment of a reassembled PDU]
346   0.037559 172.31.8.238 -> 54.230.116.98 TCP 66 39752 > http [ACK] Seq=98 Ack=3107867 Win=1574528 Len=0 TSval=10528253 TSecr=1684745193
347   0.037568 54.230.116.98 -> 172.31.8.238 TCP 10202 [TCP segment of a reassembled PDU]
348   0.037574 172.31.8.238 -> 54.230.116.98 TCP 66 39752 > http [ACK] Seq=98 Ack=3118003 Win=1574528 Len=0 TSval=10528253 TSecr=1684745193
349   0.037676 54.230.116.98 -> 172.31.8.238 TCP 33370 [TCP segment of a reassembled PDU]
350   0.037683 172.31.8.238 -> 54.230.116.98 TCP 66 39752 > http [ACK] Seq=98 Ack=3151307 Win=1574528 Len=0 TSval=10528253 TSecr=1684745193
