[Measurement for 100kb at 10:38:14 20.38.2014] 
Tshark:

  1   0.000000 172.31.29.138 -> 172.31.0.2   DNS 89 Standard query 0x6d7c  A d1n0gskdvzj94j.cloudfront.net
  2   0.000041 172.31.29.138 -> 172.31.0.2   DNS 89 Standard query 0xd8e3  AAAA d1n0gskdvzj94j.cloudfront.net
  3   0.000661   172.31.0.2 -> 172.31.29.138 DNS 176 Standard query response 0xd8e3 
  4   0.000671   172.31.0.2 -> 172.31.29.138 DNS 217 Standard query response 0x6d7c  A 54.230.150.154 A 54.230.150.155 A 54.230.148.75 A 54.230.149.38 A 54.230.149.227 A 54.230.149.232 A 54.230.150.27 A 54.230.150.151
  5   0.003888 172.31.29.138 -> 54.230.150.154 TCP 74 46837 > http [SYN] Seq=0 Win=26883 Len=0 MSS=8961 SACK_PERM=1 TSval=15941923 TSecr=0 WS=128
  6   0.005188 54.230.150.154 -> 172.31.29.138 TCP 74 http > 46837 [SYN, ACK] Seq=0 Ack=1 Win=14480 Len=0 MSS=1460 SACK_PERM=1 TSval=1455691344 TSecr=15941923 WS=128
  7   0.005203 172.31.29.138 -> 54.230.150.154 TCP 66 46837 > http [ACK] Seq=1 Ack=1 Win=27008 Len=0 TSval=15941924 TSecr=1455691344
  8   0.005244 172.31.29.138 -> 54.230.150.154 HTTP 164 GET /100kb HTTP/1.1 
  9   0.006473 54.230.150.154 -> 172.31.29.138 TCP 66 http > 46837 [ACK] Seq=1 Ack=99 Win=14592 Len=0 TSval=1455691344 TSecr=15941924
 10   0.007995 54.230.150.154 -> 172.31.29.138 TCP 522 [TCP segment of a reassembled PDU]
 11   0.008002 172.31.29.138 -> 54.230.150.154 TCP 66 46837 > http [ACK] Seq=99 Ack=457 Win=28032 Len=0 TSval=15941924 TSecr=1455691344
 12   0.008101 54.230.150.154 -> 172.31.29.138 TCP 13098 [TCP segment of a reassembled PDU]
 13   0.008112 172.31.29.138 -> 54.230.150.154 TCP 66 46837 > http [ACK] Seq=99 Ack=13489 Win=54144 Len=0 TSval=15941924 TSecr=1455691344
 14   0.009280 54.230.150.154 -> 172.31.29.138 TCP 2962 [TCP segment of a reassembled PDU]
 15   0.009287 172.31.29.138 -> 54.230.150.154 TCP 66 46837 > http [ACK] Seq=99 Ack=16385 Win=59904 Len=0 TSval=15941925 TSecr=1455691345
 16   0.009378 54.230.150.154 -> 172.31.29.138 TCP 10202 [TCP segment of a reassembled PDU]
 17   0.009386 172.31.29.138 -> 54.230.150.154 TCP 66 46837 > http [ACK] Seq=99 Ack=26521 Win=80128 Len=0 TSval=15941925 TSecr=1455691345
 18   0.010609 54.230.150.154 -> 172.31.29.138 TCP 2962 [TCP segment of a reassembled PDU]
 19   0.010615 172.31.29.138 -> 54.230.150.154 TCP 66 46837 > http [ACK] Seq=99 Ack=29417 Win=85888 Len=0 TSval=15941925 TSecr=1455691345
 20   0.010711 54.230.150.154 -> 172.31.29.138 TCP 13098 [TCP segment of a reassembled PDU]
 21   0.010720 172.31.29.138 -> 54.230.150.154 TCP 66 46837 > http [ACK] Seq=99 Ack=42449 Win=96512 Len=0 TSval=15941925 TSecr=1455691345
 22   0.010729 54.230.150.154 -> 172.31.29.138 TCP 4410 [TCP segment of a reassembled PDU]
 23   0.010734 172.31.29.138 -> 54.230.150.154 TCP 66 46837 > http [ACK] Seq=99 Ack=46793 Win=92288 Len=0 TSval=15941925 TSecr=1455691345
 24   0.012099 54.230.150.154 -> 172.31.29.138 TCP 2962 [TCP segment of a reassembled PDU]
 25   0.012104 172.31.29.138 -> 54.230.150.154 TCP 66 46837 > http [ACK] Seq=99 Ack=49689 Win=109056 Len=0 TSval=15941925 TSecr=1455691345
 26   0.012137 54.230.150.154 -> 172.31.29.138 TCP 2962 [TCP segment of a reassembled PDU]
 27   0.012142 172.31.29.138 -> 54.230.150.154 TCP 66 46837 > http [ACK] Seq=99 Ack=52585 Win=109056 Len=0 TSval=15941925 TSecr=1455691345
 28   0.012234 54.230.150.154 -> 172.31.29.138 TCP 13098 [TCP segment of a reassembled PDU]
 29   0.012243 172.31.29.138 -> 54.230.150.154 TCP 66 46837 > http [ACK] Seq=99 Ack=65617 Win=96512 Len=0 TSval=15941925 TSecr=1455691345
 30   0.013386 54.230.150.154 -> 172.31.29.138 TCP 2962 [TCP segment of a reassembled PDU]
 31   0.013391 172.31.29.138 -> 54.230.150.154 TCP 66 46837 > http [ACK] Seq=99 Ack=68513 Win=109056 Len=0 TSval=15941926 TSecr=1455691345
 32   0.013474 54.230.150.154 -> 172.31.29.138 TCP 10202 [TCP segment of a reassembled PDU]
 33   0.013482 172.31.29.138 -> 54.230.150.154 TCP 66 46837 > http [ACK] Seq=99 Ack=78649 Win=129280 Len=0 TSval=15941926 TSecr=1455691345
 34   0.013901 54.230.150.154 -> 172.31.29.138 TCP 5858 [TCP segment of a reassembled PDU]
 35   0.013908 172.31.29.138 -> 54.230.150.154 TCP 66 46837 > http [ACK] Seq=99 Ack=84441 Win=140928 Len=0 TSval=15941926 TSecr=1455691345
 36   0.013988 54.230.150.154 -> 172.31.29.138 TCP 10202 [TCP segment of a reassembled PDU]
 37   0.013996 172.31.29.138 -> 54.230.150.154 TCP 66 46837 > http [ACK] Seq=99 Ack=94577 Win=161152 Len=0 TSval=15941926 TSecr=1455691345
 38   0.014909 54.230.150.154 -> 172.31.29.138 TCP 2962 [TCP segment of a reassembled PDU]
 39   0.014914 172.31.29.138 -> 54.230.150.154 TCP 66 46837 > http [ACK] Seq=99 Ack=97473 Win=167040 Len=0 TSval=15941926 TSecr=1455691345
 40   0.015000 54.230.150.154 -> 172.31.29.138 HTTP 5450 HTTP/1.1 200 OK  (application/octet-stream)
 41   0.015006 172.31.29.138 -> 54.230.150.154 TCP 66 46837 > http [ACK] Seq=99 Ack=102857 Win=177792 Len=0 TSval=15941926 TSecr=1455691345
 42   0.015152 172.31.29.138 -> 54.230.150.154 TCP 66 46837 > http [FIN, ACK] Seq=99 Ack=102857 Win=177792 Len=0 TSval=15941926 TSecr=1455691345
 43   0.016427 54.230.150.154 -> 172.31.29.138 TCP 66 http > 46837 [FIN, ACK] Seq=102857 Ack=100 Win=14592 Len=0 TSval=1455691345 TSecr=15941926
 44   0.016436 172.31.29.138 -> 54.230.150.154 TCP 66 46837 > http [ACK] Seq=100 Ack=102858 Win=177792 Len=0 TSval=15941926 TSecr=1455691345
