[Measurement for 100kb at 17:40:27 19.40.2014] 
Tshark:

  1   0.000000 172.31.29.138 -> 172.31.0.2   DNS 89 Standard query 0xb127  A d1n0gskdvzj94j.cloudfront.net
  2   0.000070 172.31.29.138 -> 172.31.0.2   DNS 89 Standard query 0xa46a  AAAA d1n0gskdvzj94j.cloudfront.net
  3   0.000527   172.31.0.2 -> 172.31.29.138 DNS 217 Standard query response 0xb127  A 54.192.159.157 A 54.230.158.80 A 54.230.158.137 A 54.230.158.179 A 54.230.158.202 A 54.230.158.252 A 54.192.159.72 A 54.192.159.76
  4   0.000538   172.31.0.2 -> 172.31.29.138 DNS 176 Standard query response 0xa46a 
  5   0.003871 172.31.29.138 -> 54.192.159.157 TCP 74 41066 > http [SYN] Seq=0 Win=26883 Len=0 MSS=8961 SACK_PERM=1 TSval=674991 TSecr=0 WS=128
  6   0.004441 54.192.159.157 -> 172.31.29.138 TCP 74 http > 41066 [SYN, ACK] Seq=0 Ack=1 Win=14480 Len=0 MSS=1460 SACK_PERM=1 TSval=726520682 TSecr=674991 WS=128
  7   0.004456 172.31.29.138 -> 54.192.159.157 TCP 66 41066 > http [ACK] Seq=1 Ack=1 Win=27008 Len=0 TSval=674992 TSecr=726520682
  8   0.004508 172.31.29.138 -> 54.192.159.157 HTTP 164 GET /100kb HTTP/1.1 
  9   0.005196 54.192.159.157 -> 172.31.29.138 TCP 66 http > 41066 [ACK] Seq=1 Ack=99 Win=14592 Len=0 TSval=726520682 TSecr=674992
 10   0.287447 54.192.159.157 -> 172.31.29.138 TCP 8849 [TCP segment of a reassembled PDU]
 11   0.287470 172.31.29.138 -> 54.192.159.157 TCP 66 41066 > http [ACK] Seq=99 Ack=8784 Win=44544 Len=0 TSval=675062 TSecr=726520710
 12   0.287498 54.192.159.157 -> 172.31.29.138 TCP 4410 [TCP segment of a reassembled PDU]
 13   0.287503 172.31.29.138 -> 54.192.159.157 TCP 66 41066 > http [ACK] Seq=99 Ack=13128 Win=53248 Len=0 TSval=675062 TSecr=726520710
 14   0.288114 54.192.159.157 -> 172.31.29.138 TCP 7306 [TCP segment of a reassembled PDU]
 15   0.288122 172.31.29.138 -> 54.192.159.157 TCP 66 41066 > http [ACK] Seq=99 Ack=20368 Win=67712 Len=0 TSval=675063 TSecr=726520710
 16   0.288131 54.192.159.157 -> 172.31.29.138 TCP 5858 [TCP segment of a reassembled PDU]
 17   0.288135 172.31.29.138 -> 54.192.159.157 TCP 66 41066 > http [ACK] Seq=99 Ack=26160 Win=79232 Len=0 TSval=675063 TSecr=726520710
 18   0.288603 54.192.159.157 -> 172.31.29.138 TCP 5858 [TCP segment of a reassembled PDU]
 19   0.288609 172.31.29.138 -> 54.192.159.157 TCP 66 41066 > http [ACK] Seq=99 Ack=31952 Win=90880 Len=0 TSval=675063 TSecr=726520710
 20   0.288660 54.192.159.157 -> 172.31.29.138 TCP 7118 [TCP segment of a reassembled PDU]
 21   0.288666 172.31.29.138 -> 54.192.159.157 TCP 66 41066 > http [ACK] Seq=99 Ack=39004 Win=104960 Len=0 TSval=675063 TSecr=726520710
 22   0.473040 54.192.159.157 -> 172.31.29.138 TCP 7306 [TCP segment of a reassembled PDU]
 23   0.473074 172.31.29.138 -> 54.192.159.157 TCP 66 41066 > http [ACK] Seq=99 Ack=46244 Win=119424 Len=0 TSval=675109 TSecr=726520729
 24   0.473095 54.192.159.157 -> 172.31.29.138 TCP 4482 [TCP segment of a reassembled PDU]
 25   0.473099 172.31.29.138 -> 54.192.159.157 TCP 66 41066 > http [ACK] Seq=99 Ack=50660 Win=128256 Len=0 TSval=675109 TSecr=726520729
 26   0.473126 54.192.159.157 -> 172.31.29.138 TCP 7306 [TCP segment of a reassembled PDU]
 27   0.473133 172.31.29.138 -> 54.192.159.157 TCP 66 41066 > http [ACK] Seq=99 Ack=57900 Win=142720 Len=0 TSval=675109 TSecr=726520729
 28   0.473839 54.192.159.157 -> 172.31.29.138 TCP 22050 [TCP segment of a reassembled PDU]
 29   0.473849 172.31.29.138 -> 54.192.159.157 TCP 66 41066 > http [ACK] Seq=99 Ack=79884 Win=160128 Len=0 TSval=675109 TSecr=726520729
 30   0.661271 54.192.159.157 -> 172.31.29.138 HTTP 23028 HTTP/1.1 200 OK  (application/octet-stream)
 31   0.661295 172.31.29.138 -> 54.192.159.157 TCP 66 41066 > http [ACK] Seq=99 Ack=102846 Win=160128 Len=0 TSval=675156 TSecr=726520747
 32   0.661502 172.31.29.138 -> 54.192.159.157 TCP 66 41066 > http [FIN, ACK] Seq=99 Ack=102846 Win=186752 Len=0 TSval=675156 TSecr=726520747
 33   0.662147 54.192.159.157 -> 172.31.29.138 TCP 66 http > 41066 [FIN, ACK] Seq=102846 Ack=100 Win=14592 Len=0 TSval=726520748 TSecr=675156
 34   0.662157 172.31.29.138 -> 54.192.159.157 TCP 66 41066 > http [ACK] Seq=100 Ack=102847 Win=186752 Len=0 TSval=675156 TSecr=726520748
