[Measurement for 100kb at 18:38:14 19.38.2014] 
Tshark:

  1   0.000000 06:38:16:87:8c:c2 -> 06:4e:73:56:a6:a6 ARP 60 Who has 172.31.29.138?  Tell 172.31.16.1
  2   0.000018 06:4e:73:56:a6:a6 -> 06:38:16:87:8c:c2 ARP 42 172.31.29.138 is at 06:4e:73:56:a6:a6
  3   0.469982 172.31.29.138 -> 172.31.0.2   DNS 89 Standard query 0x8dd0  A d1n0gskdvzj94j.cloudfront.net
  4   0.470008 172.31.29.138 -> 172.31.0.2   DNS 89 Standard query 0xecbb  AAAA d1n0gskdvzj94j.cloudfront.net
  5   0.470535   172.31.0.2 -> 172.31.29.138 DNS 217 Standard query response 0x8dd0  A 54.192.156.106 A 54.192.156.109 A 54.192.157.138 A 54.192.157.141 A 54.192.157.146 A 54.192.157.151 A 54.230.158.80 A 54.230.159.147
  6   0.470545   172.31.0.2 -> 172.31.29.138 DNS 176 Standard query response 0xecbb 
  7   0.473840 172.31.29.138 -> 54.192.156.106 TCP 74 57180 > http [SYN] Seq=0 Win=26883 Len=0 MSS=8961 SACK_PERM=1 TSval=1541793 TSecr=0 WS=128
  8   0.474527 54.192.156.106 -> 172.31.29.138 TCP 74 http > 57180 [SYN, ACK] Seq=0 Ack=1 Win=14480 Len=0 MSS=1460 SACK_PERM=1 TSval=806797902 TSecr=1541793 WS=128
  9   0.474542 172.31.29.138 -> 54.192.156.106 TCP 66 57180 > http [ACK] Seq=1 Ack=1 Win=27008 Len=0 TSval=1541793 TSecr=806797902
 10   0.474584 172.31.29.138 -> 54.192.156.106 HTTP 164 GET /100kb HTTP/1.1 
 11   0.475235 54.192.156.106 -> 172.31.29.138 TCP 66 http > 57180 [ACK] Seq=1 Ack=99 Win=14592 Len=0 TSval=806797903 TSecr=1541793
 12   0.483435 54.192.156.106 -> 172.31.29.138 TCP 2593 [TCP segment of a reassembled PDU]
 13   0.483443 172.31.29.138 -> 54.192.156.106 TCP 66 57180 > http [ACK] Seq=99 Ack=2528 Win=32000 Len=0 TSval=1541795 TSecr=806797903
 14   0.483454 54.192.156.106 -> 172.31.29.138 TCP 5858 [TCP segment of a reassembled PDU]
 15   0.483469 172.31.29.138 -> 54.192.156.106 TCP 66 57180 > http [ACK] Seq=99 Ack=8320 Win=43648 Len=0 TSval=1541795 TSecr=806797903
 16   0.483505 54.192.156.106 -> 172.31.29.138 TCP 5858 [TCP segment of a reassembled PDU]
 17   0.483512 172.31.29.138 -> 54.192.156.106 TCP 66 57180 > http [ACK] Seq=99 Ack=14112 Win=55168 Len=0 TSval=1541795 TSecr=806797903
 18   0.484248 54.192.156.106 -> 172.31.29.138 TCP 13098 [TCP segment of a reassembled PDU]
 19   0.484259 172.31.29.138 -> 54.192.156.106 TCP 66 57180 > http [ACK] Seq=99 Ack=27144 Win=81280 Len=0 TSval=1541795 TSecr=806797903
 20   0.484959 54.192.156.106 -> 172.31.29.138 TCP 4410 [TCP segment of a reassembled PDU]
 21   0.484966 172.31.29.138 -> 54.192.156.106 TCP 66 57180 > http [ACK] Seq=99 Ack=31488 Win=89984 Len=0 TSval=1541796 TSecr=806797904
 22   0.485054 54.192.156.106 -> 172.31.29.138 TCP 15994 [TCP segment of a reassembled PDU]
 23   0.485064 172.31.29.138 -> 54.192.156.106 TCP 66 57180 > http [ACK] Seq=99 Ack=47416 Win=91648 Len=0 TSval=1541796 TSecr=806797904
 24   0.485708 54.192.156.106 -> 172.31.29.138 TCP 5858 [TCP segment of a reassembled PDU]
 25   0.485715 172.31.29.138 -> 54.192.156.106 TCP 66 57180 > http [ACK] Seq=99 Ack=53208 Win=108416 Len=0 TSval=1541796 TSecr=806797904
 26   0.485768 54.192.156.106 -> 172.31.29.138 TCP 14546 [TCP segment of a reassembled PDU]
 27   0.485775 172.31.29.138 -> 54.192.156.106 TCP 66 57180 > http [ACK] Seq=99 Ack=67688 Win=94080 Len=0 TSval=1541796 TSecr=806797904
 28   0.486225 54.192.156.106 -> 172.31.29.138 TCP 2962 [TCP segment of a reassembled PDU]
 29   0.486230 172.31.29.138 -> 54.192.156.106 TCP 66 57180 > http [ACK] Seq=99 Ack=70584 Win=109056 Len=0 TSval=1541796 TSecr=806797904
 30   0.486352 54.192.156.106 -> 172.31.29.138 TCP 17442 [TCP segment of a reassembled PDU]
 31   0.486363 172.31.29.138 -> 54.192.156.106 TCP 66 57180 > http [ACK] Seq=99 Ack=87960 Win=91776 Len=0 TSval=1541796 TSecr=806797904
 32   0.487015 54.192.156.106 -> 172.31.29.138 TCP 7306 [TCP segment of a reassembled PDU]
 33   0.487022 172.31.29.138 -> 54.192.156.106 TCP 66 57180 > http [ACK] Seq=99 Ack=95200 Win=105984 Len=0 TSval=1541796 TSecr=806797904
 34   0.487068 54.192.156.106 -> 172.31.29.138 HTTP 7722 HTTP/1.1 200 OK  (application/octet-stream)
 35   0.487076 172.31.29.138 -> 54.192.156.106 TCP 66 57180 > http [ACK] Seq=99 Ack=102856 Win=103680 Len=0 TSval=1541796 TSecr=806797904
 36   0.487223 172.31.29.138 -> 54.192.156.106 TCP 66 57180 > http [FIN, ACK] Seq=99 Ack=102856 Win=109056 Len=0 TSval=1541796 TSecr=806797904
 37   0.487738 54.192.156.106 -> 172.31.29.138 TCP 66 http > 57180 [FIN, ACK] Seq=102856 Ack=100 Win=14592 Len=0 TSval=806797904 TSecr=1541796
 38   0.487746 172.31.29.138 -> 54.192.156.106 TCP 66 57180 > http [ACK] Seq=100 Ack=102857 Win=109056 Len=0 TSval=1541796 TSecr=806797904
