[Measurement for 100kb at 01:38:14 20.38.2014] 
Tshark:

  1   0.000000 172.31.29.138 -> 172.31.0.2   DNS 89 Standard query 0x0bfd  A d1n0gskdvzj94j.cloudfront.net
  2   0.000021 172.31.29.138 -> 172.31.0.2   DNS 89 Standard query 0x2efd  AAAA d1n0gskdvzj94j.cloudfront.net
  3   0.000722   172.31.0.2 -> 172.31.29.138 DNS 217 Standard query response 0x0bfd  A 54.230.158.80 A 54.230.158.146 A 54.230.158.182 A 54.230.158.189 A 54.230.158.217 A 54.230.159.153 A 54.192.156.102 A 54.192.159.174
  4   0.000732   172.31.0.2 -> 172.31.29.138 DNS 176 Standard query response 0x2efd 
  5   0.003854 172.31.29.138 -> 54.230.158.80 TCP 74 48845 > http [SYN] Seq=0 Win=26883 Len=0 MSS=8961 SACK_PERM=1 TSval=7841732 TSecr=0 WS=128
  6   0.004669 54.230.158.80 -> 172.31.29.138 TCP 74 http > 48845 [SYN, ACK] Seq=0 Ack=1 Win=14480 Len=0 MSS=1460 SACK_PERM=1 TSval=729386906 TSecr=7841732 WS=128
  7   0.004683 172.31.29.138 -> 54.230.158.80 TCP 66 48845 > http [ACK] Seq=1 Ack=1 Win=27008 Len=0 TSval=7841732 TSecr=729386906
  8   0.004721 172.31.29.138 -> 54.230.158.80 HTTP 164 GET /100kb HTTP/1.1 
  9   0.005456 54.230.158.80 -> 172.31.29.138 TCP 66 http > 48845 [ACK] Seq=1 Ack=99 Win=14592 Len=0 TSval=729386906 TSecr=7841732
 10   0.006883 54.230.158.80 -> 172.31.29.138 TCP 522 [TCP segment of a reassembled PDU]
 11   0.006891 172.31.29.138 -> 54.230.158.80 TCP 66 48845 > http [ACK] Seq=99 Ack=457 Win=28032 Len=0 TSval=7841732 TSecr=729386907
 12   0.007158 54.230.158.80 -> 172.31.29.138 TCP 5858 [TCP segment of a reassembled PDU]
 13   0.007167 172.31.29.138 -> 54.230.158.80 TCP 66 48845 > http [ACK] Seq=99 Ack=6249 Win=39552 Len=0 TSval=7841732 TSecr=729386907
 14   0.007204 54.230.158.80 -> 172.31.29.138 TCP 7306 [TCP segment of a reassembled PDU]
 15   0.007211 172.31.29.138 -> 54.230.158.80 TCP 66 48845 > http [ACK] Seq=99 Ack=13489 Win=54144 Len=0 TSval=7841732 TSecr=729386907
 16   0.007908 54.230.158.80 -> 172.31.29.138 TCP 2962 [TCP segment of a reassembled PDU]
 17   0.007914 172.31.29.138 -> 54.230.158.80 TCP 66 48845 > http [ACK] Seq=99 Ack=16385 Win=59904 Len=0 TSval=7841733 TSecr=729386907
 18   0.007988 54.230.158.80 -> 172.31.29.138 TCP 10202 [TCP segment of a reassembled PDU]
 19   0.007996 172.31.29.138 -> 54.230.158.80 TCP 66 48845 > http [ACK] Seq=99 Ack=26521 Win=80128 Len=0 TSval=7841733 TSecr=729386907
 20   0.008420 54.230.158.80 -> 172.31.29.138 TCP 4410 [TCP segment of a reassembled PDU]
 21   0.008426 172.31.29.138 -> 54.230.158.80 TCP 66 48845 > http [ACK] Seq=99 Ack=30865 Win=88832 Len=0 TSval=7841733 TSecr=729386907
 22   0.008464 54.230.158.80 -> 172.31.29.138 TCP 5858 [TCP segment of a reassembled PDU]
 23   0.008470 172.31.29.138 -> 54.230.158.80 TCP 66 48845 > http [ACK] Seq=99 Ack=36657 Win=100480 Len=0 TSval=7841733 TSecr=729386907
 24   0.008671 54.230.158.80 -> 172.31.29.138 TCP 1514 [TCP segment of a reassembled PDU]
 25   0.008675 172.31.29.138 -> 54.230.158.80 TCP 66 48845 > http [ACK] Seq=99 Ack=38105 Win=103296 Len=0 TSval=7841733 TSecr=729386907
 26   0.008746 54.230.158.80 -> 172.31.29.138 TCP 8754 [TCP segment of a reassembled PDU]
 27   0.008752 172.31.29.138 -> 54.230.158.80 TCP 66 48845 > http [ACK] Seq=99 Ack=46793 Win=103680 Len=0 TSval=7841733 TSecr=729386907
 28   0.008757 54.230.158.80 -> 172.31.29.138 TCP 1514 [TCP segment of a reassembled PDU]
 29   0.008760 172.31.29.138 -> 54.230.158.80 TCP 66 48845 > http [ACK] Seq=99 Ack=48241 Win=102272 Len=0 TSval=7841733 TSecr=729386907
 30   0.008929 54.230.158.80 -> 172.31.29.138 TCP 4410 [TCP segment of a reassembled PDU]
 31   0.008935 172.31.29.138 -> 54.230.158.80 TCP 66 48845 > http [ACK] Seq=99 Ack=52585 Win=109056 Len=0 TSval=7841733 TSecr=729386907
 32   0.009161 54.230.158.80 -> 172.31.29.138 TCP 1514 [TCP segment of a reassembled PDU]
 33   0.009166 172.31.29.138 -> 54.230.158.80 TCP 66 48845 > http [ACK] Seq=99 Ack=54033 Win=109056 Len=0 TSval=7841733 TSecr=729386907
 34   0.009265 54.230.158.80 -> 172.31.29.138 TCP 7306 [TCP segment of a reassembled PDU]
 35   0.009272 172.31.29.138 -> 54.230.158.80 TCP 66 48845 > http [ACK] Seq=99 Ack=61273 Win=105984 Len=0 TSval=7841733 TSecr=729386907
 36   0.009481 54.230.158.80 -> 172.31.29.138 TCP 5858 [TCP segment of a reassembled PDU]
 37   0.009487 172.31.29.138 -> 54.230.158.80 TCP 66 48845 > http [ACK] Seq=99 Ack=67065 Win=108416 Len=0 TSval=7841733 TSecr=729386907
 38   0.009588 54.230.158.80 -> 172.31.29.138 TCP 11650 [TCP segment of a reassembled PDU]
 39   0.009596 172.31.29.138 -> 54.230.158.80 TCP 66 48845 > http [ACK] Seq=99 Ack=78649 Win=98944 Len=0 TSval=7841733 TSecr=729386907
 40   0.009963 54.230.158.80 -> 172.31.29.138 TCP 8754 [TCP segment of a reassembled PDU]
 41   0.009970 172.31.29.138 -> 54.230.158.80 TCP 66 48845 > http [ACK] Seq=99 Ack=87337 Win=103680 Len=0 TSval=7841733 TSecr=729386907
 42   0.010039 54.230.158.80 -> 172.31.29.138 TCP 4410 [TCP segment of a reassembled PDU]
 43   0.010044 172.31.29.138 -> 54.230.158.80 TCP 66 48845 > http [ACK] Seq=99 Ack=91681 Win=109056 Len=0 TSval=7841733 TSecr=729386907
 44   0.010242 54.230.158.80 -> 172.31.29.138 TCP 5858 [TCP segment of a reassembled PDU]
 45   0.010248 172.31.29.138 -> 54.230.158.80 TCP 66 48845 > http [ACK] Seq=99 Ack=97473 Win=108416 Len=0 TSval=7841733 TSecr=729386907
 46   0.010353 54.230.158.80 -> 172.31.29.138 HTTP 5450 HTTP/1.1 200 OK  (application/octet-stream)
 47   0.010359 172.31.29.138 -> 54.230.158.80 TCP 66 48845 > http [ACK] Seq=99 Ack=102857 Win=108416 Len=0 TSval=7841733 TSecr=729386907
 48   0.010505 172.31.29.138 -> 54.230.158.80 TCP 66 48845 > http [FIN, ACK] Seq=99 Ack=102857 Win=109056 Len=0 TSval=7841733 TSecr=729386907
 49   0.011253 54.230.158.80 -> 172.31.29.138 TCP 66 http > 48845 [FIN, ACK] Seq=102857 Ack=100 Win=14592 Len=0 TSval=729386907 TSecr=7841733
 50   0.011261 172.31.29.138 -> 54.230.158.80 TCP 66 48845 > http [ACK] Seq=100 Ack=102858 Win=109056 Len=0 TSval=7841733 TSecr=729386907
