[Measurement for 10kb at 11:00:49 17.00.2014] 
Tshark:

  1   0.000000  192.168.1.2 -> 50.16.240.122 TCP 54 52488→80 [FIN, ACK] Seq=1 Ack=1 Win=252 Len=0
  2   0.000233  192.168.1.2 -> 54.243.28.148 TCP 54 52487→80 [FIN, ACK] Seq=1 Ack=1 Win=252 Len=0
  3   0.144608 54.243.28.148 -> 192.168.1.2  TCP 54 80→52487 [ACK] Seq=1 Ack=2 Win=67 Len=0
  4   0.145523 50.16.240.122 -> 192.168.1.2  TCP 54 80→52488 [ACK] Seq=1 Ack=2 Win=66 Len=0
  5   0.692824 HuaweiTe_25:83:d4 -> IntelCor_3f:fc:98 ARP 42 Who has 192.168.1.2?  Tell 192.168.1.1
  6   0.692863 IntelCor_3f:fc:98 -> HuaweiTe_25:83:d4 ARP 42 192.168.1.2 is at 00:24:d7:3f:fc:98
  7   0.804709  192.168.1.2 -> 54.230.98.33 TCP 66 52501→80 [SYN] Seq=0 Win=8192 Len=0 MSS=1460 WS=256 SACK_PERM=1
  8   0.855547 54.230.98.33 -> 192.168.1.2  TCP 66 80→52501 [SYN, ACK] Seq=0 Ack=1 Win=14600 Len=0 MSS=1400 SACK_PERM=1 WS=128
  9   0.855713  192.168.1.2 -> 54.230.98.33 TCP 54 52501→80 [ACK] Seq=1 Ack=1 Win=65792 Len=0
 10   0.855913  192.168.1.2 -> 54.230.98.33 HTTP 151 GET /10kb HTTP/1.1 
 11   0.893571 54.230.98.33 -> 192.168.1.2  TCP 54 80→52501 [ACK] Seq=1 Ack=98 Win=14720 Len=0
 12   0.894271 54.230.98.33 -> 192.168.1.2  TCP 1454 [TCP segment of a reassembled PDU]
 13   0.896815 54.230.98.33 -> 192.168.1.2  TCP 1168 [TCP segment of a reassembled PDU]
 14   0.896817 54.230.98.33 -> 192.168.1.2  TCP 1454 [TCP segment of a reassembled PDU]
 15   0.896818 54.230.98.33 -> 192.168.1.2  TCP 1454 [TCP segment of a reassembled PDU]
 16   0.896821 54.230.98.33 -> 192.168.1.2  TCP 1454 [TCP segment of a reassembled PDU]
 17   0.896822 54.230.98.33 -> 192.168.1.2  TCP 1454 [TCP segment of a reassembled PDU]
 18   0.896823 54.230.98.33 -> 192.168.1.2  TCP 1454 [TCP segment of a reassembled PDU]
 19   0.896825 54.230.98.33 -> 192.168.1.2  HTTP 1235 HTTP/1.1 200 OK  (application/octet-stream)
 20   0.897046  192.168.1.2 -> 54.230.98.33 TCP 54 52501→80 [ACK] Seq=98 Ack=10696 Win=65792 Len=0
 21   0.897143  192.168.1.2 -> 54.230.98.33 TCP 54 52501→80 [FIN, ACK] Seq=98 Ack=10696 Win=65792 Len=0
 22   0.923739 54.230.98.33 -> 192.168.1.2  TCP 54 80→52501 [FIN, ACK] Seq=10696 Ack=99 Win=14720 Len=0
 23   0.923893  192.168.1.2 -> 54.230.98.33 TCP 54 52501→80 [ACK] Seq=99 Ack=10697 Win=65792 Len=0
 24   1.818301 54.231.15.16 -> 192.168.1.2  TLSv1.2 107 Encrypted Alert
 25   1.867611  192.168.1.2 -> 54.231.15.16 TCP 54 52498→443 [ACK] Seq=1 Ack=54 Win=255 Len=0
