[Measurement for 10kb at 03:38:11 20.38.2014] 
Tshark:

  1   0.000000 172.31.29.138 -> 172.31.0.2   DNS 89 Standard query 0x44b3  A d1n0gskdvzj94j.cloudfront.net
  2   0.000038 172.31.29.138 -> 172.31.0.2   DNS 89 Standard query 0xf065  AAAA d1n0gskdvzj94j.cloudfront.net
  3   0.000534   172.31.0.2 -> 172.31.29.138 DNS 217 Standard query response 0x44b3  A 54.230.148.75 A 54.230.149.156 A 54.230.149.226 A 54.230.150.30 A 54.230.150.38 A 54.230.150.40 A 54.230.150.52 A 54.230.150.69
  4   0.000547   172.31.0.2 -> 172.31.29.138 DNS 176 Standard query response 0xf065 
  5   0.003873 172.31.29.138 -> 54.230.148.75 TCP 74 39306 > http [SYN] Seq=0 Win=26883 Len=0 MSS=8961 SACK_PERM=1 TSval=9640961 TSecr=0 WS=128
  6   0.005579 54.230.148.75 -> 172.31.29.138 TCP 74 http > 39306 [SYN, ACK] Seq=0 Ack=1 Win=14480 Len=0 MSS=1460 SACK_PERM=1 TSval=1453687240 TSecr=9640961 WS=128
  7   0.005593 172.31.29.138 -> 54.230.148.75 TCP 66 39306 > http [ACK] Seq=1 Ack=1 Win=27008 Len=0 TSval=9640961 TSecr=1453687240
  8   0.005633 172.31.29.138 -> 54.230.148.75 HTTP 163 GET /10kb HTTP/1.1 
  9   0.007057 54.230.148.75 -> 172.31.29.138 TCP 66 http > 39306 [ACK] Seq=1 Ack=98 Win=14592 Len=0 TSval=1453687241 TSecr=9640961
 10   0.009925 54.230.148.75 -> 172.31.29.138 TCP 2962 [TCP segment of a reassembled PDU]
 11   0.009933 172.31.29.138 -> 54.230.148.75 TCP 66 39306 > http [ACK] Seq=98 Ack=2897 Win=32768 Len=0 TSval=9640962 TSecr=1453687241
 12   0.009974 54.230.148.75 -> 172.31.29.138 HTTP 7865 HTTP/1.1 200 OK  (application/octet-stream)
 13   0.009983 172.31.29.138 -> 54.230.148.75 TCP 66 39306 > http [ACK] Seq=98 Ack=10696 Win=48384 Len=0 TSval=9640962 TSecr=1453687241
 14   0.010147 172.31.29.138 -> 54.230.148.75 TCP 66 39306 > http [FIN, ACK] Seq=98 Ack=10696 Win=48384 Len=0 TSval=9640962 TSecr=1453687241
 15   0.011675 54.230.148.75 -> 172.31.29.138 TCP 66 http > 39306 [FIN, ACK] Seq=10696 Ack=99 Win=14592 Len=0 TSval=1453687241 TSecr=9640962
 16   0.011684 172.31.29.138 -> 54.230.148.75 TCP 66 39306 > http [ACK] Seq=99 Ack=10697 Win=48384 Len=0 TSval=9640963 TSecr=1453687241
