[Measurement for 10kb at 22:38:21 19.38.2014] 
Tshark:

  1   0.000000 172.31.29.138 -> 172.31.0.2   DNS 89 Standard query 0x650f  A d1n0gskdvzj94j.cloudfront.net
  2   0.000023 172.31.29.138 -> 172.31.0.2   DNS 89 Standard query 0xd72e  AAAA d1n0gskdvzj94j.cloudfront.net
  3   0.000626   172.31.0.2 -> 172.31.29.138 DNS 176 Standard query response 0xd72e 
  4   0.000636   172.31.0.2 -> 172.31.29.138 DNS 217 Standard query response 0x650f  A 54.230.158.152 A 54.230.159.4 A 54.230.159.7 A 54.230.159.132 A 54.230.159.153 A 54.192.156.109 A 54.192.159.174 A 54.230.157.230
  5   0.003912 172.31.29.138 -> 54.230.158.152 TCP 74 37028 > http [SYN] Seq=0 Win=26883 Len=0 MSS=8961 SACK_PERM=1 TSval=5143554 TSecr=0 WS=128
  6   0.004620 54.230.158.152 -> 172.31.29.138 TCP 74 http > 37028 [SYN, ACK] Seq=0 Ack=1 Win=14480 Len=0 MSS=1460 SACK_PERM=1 TSval=806294819 TSecr=5143554 WS=128
  7   0.004635 172.31.29.138 -> 54.230.158.152 TCP 66 37028 > http [ACK] Seq=1 Ack=1 Win=27008 Len=0 TSval=5143554 TSecr=806294819
  8   0.004684 172.31.29.138 -> 54.230.158.152 HTTP 163 GET /10kb HTTP/1.1 
  9   0.005346 54.230.158.152 -> 172.31.29.138 TCP 66 http > 37028 [ACK] Seq=1 Ack=98 Win=14592 Len=0 TSval=806294819 TSecr=5143554
 10   0.007658 54.230.158.152 -> 172.31.29.138 TCP 1144 [TCP segment of a reassembled PDU]
 11   0.007667 172.31.29.138 -> 54.230.158.152 TCP 66 37028 > http [ACK] Seq=98 Ack=1079 Win=29056 Len=0 TSval=5143555 TSecr=806294820
 12   0.007708 54.230.158.152 -> 172.31.29.138 HTTP 9683 HTTP/1.1 200 OK  (application/octet-stream)
 13   0.007717 172.31.29.138 -> 54.230.158.152 TCP 66 37028 > http [ACK] Seq=98 Ack=10696 Win=48384 Len=0 TSval=5143555 TSecr=806294820
 14   0.007868 172.31.29.138 -> 54.230.158.152 TCP 66 37028 > http [FIN, ACK] Seq=98 Ack=10696 Win=48384 Len=0 TSval=5143555 TSecr=806294820
 15   0.008397 54.230.158.152 -> 172.31.29.138 TCP 66 http > 37028 [FIN, ACK] Seq=10696 Ack=99 Win=14592 Len=0 TSval=806294820 TSecr=5143555
 16   0.008406 172.31.29.138 -> 54.230.158.152 TCP 66 37028 > http [ACK] Seq=99 Ack=10697 Win=48384 Len=0 TSval=5143555 TSecr=806294820
