[Measurement for 10kb at 08:38:10 20.38.2014] 
Tshark:

  1   0.000000 172.31.29.138 -> 172.31.0.2   DNS 89 Standard query 0x78ce  A d1n0gskdvzj94j.cloudfront.net
  2   0.000035 172.31.29.138 -> 172.31.0.2   DNS 89 Standard query 0xc28d  AAAA d1n0gskdvzj94j.cloudfront.net
  3   0.000736   172.31.0.2 -> 172.31.29.138 DNS 176 Standard query response 0xc28d 
  4   0.000746   172.31.0.2 -> 172.31.29.138 DNS 217 Standard query response 0x78ce  A 54.230.151.236 A 54.230.148.165 A 54.230.149.156 A 54.230.150.26 A 54.230.150.40 A 54.230.150.45 A 54.230.150.69 A 54.230.151.182
  5   0.003887 172.31.29.138 -> 54.230.151.236 TCP 74 56391 > http [SYN] Seq=0 Win=26883 Len=0 MSS=8961 SACK_PERM=1 TSval=14140831 TSecr=0 WS=128
  6   0.005416 54.230.151.236 -> 172.31.29.138 TCP 74 http > 56391 [SYN, ACK] Seq=0 Ack=1 Win=14480 Len=0 MSS=1460 SACK_PERM=1 TSval=1455721701 TSecr=14140831 WS=128
  7   0.005430 172.31.29.138 -> 54.230.151.236 TCP 66 56391 > http [ACK] Seq=1 Ack=1 Win=27008 Len=0 TSval=14140831 TSecr=1455721701
  8   0.005484 172.31.29.138 -> 54.230.151.236 HTTP 163 GET /10kb HTTP/1.1 
  9   0.006809 54.230.151.236 -> 172.31.29.138 TCP 66 http > 56391 [ACK] Seq=1 Ack=98 Win=14592 Len=0 TSval=1455721701 TSecr=14140831
 10   0.008432 54.230.151.236 -> 172.31.29.138 TCP 5858 [TCP segment of a reassembled PDU]
 11   0.008440 172.31.29.138 -> 54.230.151.236 TCP 66 56391 > http [ACK] Seq=98 Ack=5793 Win=38528 Len=0 TSval=14140832 TSecr=1455721701
 12   0.008448 54.230.151.236 -> 172.31.29.138 HTTP 4969 HTTP/1.1 200 OK  (application/octet-stream)
 13   0.008454 172.31.29.138 -> 54.230.151.236 TCP 66 56391 > http [ACK] Seq=98 Ack=10696 Win=48384 Len=0 TSval=14140832 TSecr=1455721701
 14   0.008606 172.31.29.138 -> 54.230.151.236 TCP 66 56391 > http [FIN, ACK] Seq=98 Ack=10696 Win=48384 Len=0 TSval=14140832 TSecr=1455721701
 15   0.009881 54.230.151.236 -> 172.31.29.138 TCP 66 http > 56391 [FIN, ACK] Seq=10696 Ack=99 Win=14592 Len=0 TSval=1455721702 TSecr=14140832
 16   0.009889 172.31.29.138 -> 54.230.151.236 TCP 66 56391 > http [ACK] Seq=99 Ack=10697 Win=48384 Len=0 TSval=14140832 TSecr=1455721702
