[Measurement for 10kb at 05:38:11 20.38.2014] 
Tshark:

  1   0.000000 172.31.29.138 -> 172.31.0.2   DNS 89 Standard query 0xc319  A d1n0gskdvzj94j.cloudfront.net
  2   0.000028 172.31.29.138 -> 172.31.0.2   DNS 89 Standard query 0x9a2e  AAAA d1n0gskdvzj94j.cloudfront.net
  3   0.000617   172.31.0.2 -> 172.31.29.138 DNS 217 Standard query response 0xc319  A 54.230.158.152 A 54.230.158.199 A 54.230.158.214 A 54.230.158.238 A 54.192.157.137 A 54.192.159.97 A 54.192.159.165 A 54.192.159.171
  4   0.000628   172.31.0.2 -> 172.31.29.138 DNS 176 Standard query response 0x9a2e 
  5   0.003856 172.31.29.138 -> 54.230.158.152 TCP 74 37343 > http [SYN] Seq=0 Win=26883 Len=0 MSS=8961 SACK_PERM=1 TSval=11440997 TSecr=0 WS=128
  6   0.004390 54.230.158.152 -> 172.31.29.138 TCP 74 http > 37343 [SYN, ACK] Seq=0 Ack=1 Win=14480 Len=0 MSS=1460 SACK_PERM=1 TSval=836004720 TSecr=11440997 WS=128
  7   0.004405 172.31.29.138 -> 54.230.158.152 TCP 66 37343 > http [ACK] Seq=1 Ack=1 Win=27008 Len=0 TSval=11440997 TSecr=836004720
  8   0.004450 172.31.29.138 -> 54.230.158.152 HTTP 163 GET /10kb HTTP/1.1 
  9   0.005102 54.230.158.152 -> 172.31.29.138 TCP 66 http > 37343 [ACK] Seq=1 Ack=98 Win=14592 Len=0 TSval=836004720 TSecr=11440997
 10   0.007941 54.230.158.152 -> 172.31.29.138 TCP 2592 [TCP segment of a reassembled PDU]
 11   0.007950 172.31.29.138 -> 54.230.158.152 TCP 66 37343 > http [ACK] Seq=98 Ack=2527 Win=32000 Len=0 TSval=11440998 TSecr=836004721
 12   0.007962 54.230.158.152 -> 172.31.29.138 HTTP 8235 HTTP/1.1 200 OK  (application/octet-stream)
 13   0.007972 172.31.29.138 -> 54.230.158.152 TCP 66 37343 > http [ACK] Seq=98 Ack=10696 Win=48384 Len=0 TSval=11440998 TSecr=836004721
 14   0.008139 172.31.29.138 -> 54.230.158.152 TCP 66 37343 > http [FIN, ACK] Seq=98 Ack=10696 Win=48384 Len=0 TSval=11440998 TSecr=836004721
 15   0.008672 54.230.158.152 -> 172.31.29.138 TCP 66 http > 37343 [FIN, ACK] Seq=10696 Ack=99 Win=14592 Len=0 TSval=836004721 TSecr=11440998
 16   0.008680 172.31.29.138 -> 54.230.158.152 TCP 66 37343 > http [ACK] Seq=99 Ack=10697 Win=48384 Len=0 TSval=11440998 TSecr=836004721
 17   0.905120 06:38:16:87:8c:c2 -> 06:4e:73:56:a6:a6 ARP 60 Who has 172.31.29.138?  Tell 172.31.16.1
 18   0.905140 06:4e:73:56:a6:a6 -> 06:38:16:87:8c:c2 ARP 42 172.31.29.138 is at 06:4e:73:56:a6:a6
