[Measurement for 10kb at 12:38:11 20.38.2014] 
Tshark:

  1   0.000000 06:38:16:87:8c:c2 -> 06:4e:73:56:a6:a6 ARP 60 Who has 172.31.29.138?  Tell 172.31.16.1
  2   0.000016 06:4e:73:56:a6:a6 -> 06:38:16:87:8c:c2 ARP 42 172.31.29.138 is at 06:4e:73:56:a6:a6
  3   0.002822 172.31.29.138 -> 172.31.0.2   DNS 89 Standard query 0x5750  A d1n0gskdvzj94j.cloudfront.net
  4   0.002838 172.31.29.138 -> 172.31.0.2   DNS 89 Standard query 0x1689  AAAA d1n0gskdvzj94j.cloudfront.net
  5   0.003211   172.31.0.2 -> 172.31.29.138 DNS 217 Standard query response 0x5750  A 54.230.158.173 A 54.230.159.143 A 54.192.157.139 A 54.192.159.106 A 54.192.159.169 A 54.230.157.230 A 54.230.158.80 A 54.230.158.149
  6   0.003220   172.31.0.2 -> 172.31.29.138 DNS 176 Standard query response 0x1689 
  7   0.006685 172.31.29.138 -> 54.230.158.173 TCP 74 53404 > http [SYN] Seq=0 Win=26883 Len=0 MSS=8961 SACK_PERM=1 TSval=17740974 TSecr=0 WS=128
  8   0.007423 54.230.158.173 -> 172.31.29.138 TCP 74 http > 53404 [SYN, ACK] Seq=0 Ack=1 Win=14480 Len=0 MSS=1460 SACK_PERM=1 TSval=811298228 TSecr=17740974 WS=128
  9   0.007437 172.31.29.138 -> 54.230.158.173 TCP 66 53404 > http [ACK] Seq=1 Ack=1 Win=27008 Len=0 TSval=17740975 TSecr=811298228
 10   0.007478 172.31.29.138 -> 54.230.158.173 HTTP 163 GET /10kb HTTP/1.1 
 11   0.008128 54.230.158.173 -> 172.31.29.138 TCP 66 http > 53404 [ACK] Seq=1 Ack=98 Win=14592 Len=0 TSval=811298228 TSecr=17740975
 12   0.012037 54.230.158.173 -> 172.31.29.138 HTTP 10761 HTTP/1.1 200 OK  (application/octet-stream)
 13   0.012047 172.31.29.138 -> 54.230.158.173 TCP 66 53404 > http [ACK] Seq=98 Ack=10696 Win=48384 Len=0 TSval=17740976 TSecr=811298228
 14   0.012210 172.31.29.138 -> 54.230.158.173 TCP 66 53404 > http [FIN, ACK] Seq=98 Ack=10696 Win=48384 Len=0 TSval=17740976 TSecr=811298228
 15   0.012757 54.230.158.173 -> 172.31.29.138 TCP 66 http > 53404 [FIN, ACK] Seq=10696 Ack=99 Win=14592 Len=0 TSval=811298228 TSecr=17740976
 16   0.012765 172.31.29.138 -> 54.230.158.173 TCP 66 53404 > http [ACK] Seq=99 Ack=10697 Win=48384 Len=0 TSval=17740976 TSecr=811298228
