[Measurement for 10kb at 09:38:10 20.38.2014] 
Tshark:

  1   0.000000 172.31.29.138 -> 172.31.0.2   DNS 89 Standard query 0x5fab  A d1n0gskdvzj94j.cloudfront.net
  2   0.000028 172.31.29.138 -> 172.31.0.2   DNS 89 Standard query 0xc546  AAAA d1n0gskdvzj94j.cloudfront.net
  3   0.000593   172.31.0.2 -> 172.31.29.138 DNS 176 Standard query response 0xc546 
  4   0.000603   172.31.0.2 -> 172.31.29.138 DNS 217 Standard query response 0x5fab  A 54.230.150.23 A 54.230.150.78 A 54.230.150.220 A 54.230.151.236 A 204.246.164.163 A 54.230.149.215 A 54.230.150.12 A 54.230.150.16
  5   0.003886 172.31.29.138 -> 54.230.150.23 TCP 74 48800 > http [SYN] Seq=0 Win=26883 Len=0 MSS=8961 SACK_PERM=1 TSval=15040930 TSecr=0 WS=128
  6   0.005410 54.230.150.23 -> 172.31.29.138 TCP 74 http > 48800 [SYN, ACK] Seq=0 Ack=1 Win=14480 Len=0 MSS=1460 SACK_PERM=1 TSval=1455513243 TSecr=15040930 WS=128
  7   0.005424 172.31.29.138 -> 54.230.150.23 TCP 66 48800 > http [ACK] Seq=1 Ack=1 Win=27008 Len=0 TSval=15040930 TSecr=1455513243
  8   0.005461 172.31.29.138 -> 54.230.150.23 HTTP 163 GET /10kb HTTP/1.1 
  9   0.006892 54.230.150.23 -> 172.31.29.138 TCP 66 http > 48800 [ACK] Seq=1 Ack=98 Win=14592 Len=0 TSval=1455513243 TSecr=15040930
 10   0.009566 54.230.150.23 -> 172.31.29.138 HTTP 10761 HTTP/1.1 200 OK  (application/octet-stream)
 11   0.009581 172.31.29.138 -> 54.230.150.23 TCP 66 48800 > http [ACK] Seq=98 Ack=10696 Win=48384 Len=0 TSval=15040931 TSecr=1455513244
 12   0.009760 172.31.29.138 -> 54.230.150.23 TCP 66 48800 > http [FIN, ACK] Seq=98 Ack=10696 Win=48384 Len=0 TSval=15040931 TSecr=1455513244
 13   0.011284 54.230.150.23 -> 172.31.29.138 TCP 66 http > 48800 [FIN, ACK] Seq=10696 Ack=99 Win=14592 Len=0 TSval=1455513244 TSecr=15040931
 14   0.011292 172.31.29.138 -> 54.230.150.23 TCP 66 48800 > http [ACK] Seq=99 Ack=10697 Win=48384 Len=0 TSval=15040931 TSecr=1455513244
