[Measurement for 10kb at 10:03:16 17.03.2014] 
Tshark:

  1   0.000000  192.168.1.2 -> 64.233.164.125 TCP 55 [TCP segment of a reassembled PDU]
  2   0.063984 64.233.164.125 -> 192.168.1.2  TCP 66 5222→50147 [ACK] Seq=1 Ack=2 Win=1033 Len=0 SLE=1 SRE=2
  3   0.606864  192.168.1.2 -> 54.230.98.71 TCP 66 52034→80 [SYN] Seq=0 Win=8192 Len=0 MSS=1460 WS=256 SACK_PERM=1
  4   0.657856 54.230.98.71 -> 192.168.1.2  TCP 66 80→52034 [SYN, ACK] Seq=0 Ack=1 Win=14600 Len=0 MSS=1400 SACK_PERM=1 WS=128
  5   0.658008  192.168.1.2 -> 54.230.98.71 TCP 54 52034→80 [ACK] Seq=1 Ack=1 Win=65792 Len=0
  6   0.667726  192.168.1.2 -> 54.230.98.71 HTTP 151 GET /10kb HTTP/1.1 
  7   0.695259 54.230.98.71 -> 192.168.1.2  TCP 54 80→52034 [ACK] Seq=1 Ack=98 Win=14720 Len=0
  8   0.697814 54.230.98.71 -> 192.168.1.2  TCP 1454 [TCP segment of a reassembled PDU]
  9   0.699408 54.230.98.71 -> 192.168.1.2  TCP 1454 [TCP segment of a reassembled PDU]
 10   0.699498  192.168.1.2 -> 54.230.98.71 TCP 54 52034→80 [ACK] Seq=98 Ack=2801 Win=65792 Len=0
 11   0.701239 54.230.98.71 -> 192.168.1.2  TCP 1454 [TCP segment of a reassembled PDU]
 12   0.701240 54.230.98.71 -> 192.168.1.2  TCP 1454 [TCP segment of a reassembled PDU]
 13   0.701242 54.230.98.71 -> 192.168.1.2  TCP 1454 [TCP segment of a reassembled PDU]
 14   0.701244 54.230.98.71 -> 192.168.1.2  TCP 1454 [TCP segment of a reassembled PDU]
 15   0.701246 54.230.98.71 -> 192.168.1.2  TCP 1408 [TCP segment of a reassembled PDU]
 16   0.701247 54.230.98.71 -> 192.168.1.2  HTTP 995 HTTP/1.1 200 OK  (application/octet-stream)
 17   0.701408  192.168.1.2 -> 54.230.98.71 TCP 54 52034→80 [ACK] Seq=98 Ack=10696 Win=65792 Len=0
 18   0.701498  192.168.1.2 -> 54.230.98.71 TCP 54 52034→80 [FIN, ACK] Seq=98 Ack=10696 Win=65792 Len=0
 19   0.727926 54.230.98.71 -> 192.168.1.2  TCP 54 80→52034 [FIN, ACK] Seq=10696 Ack=99 Win=14720 Len=0
 20   0.728077  192.168.1.2 -> 54.230.98.71 TCP 54 52034→80 [ACK] Seq=99 Ack=10697 Win=65792 Len=0
 21   2.754836  192.168.1.2 -> 54.221.227.112 TLSv1.2 90 Application Data
