[Measurement for 10kb at 22:35:43 19.35.2014] 
Tshark:

  1   0.000000 172.31.29.138 -> 172.31.0.2   DNS 89 Standard query 0x2138  A d3796nkzln59xv.cloudfront.net
  2   0.000027 172.31.29.138 -> 172.31.0.2   DNS 89 Standard query 0x9a80  AAAA d3796nkzln59xv.cloudfront.net
  3   0.000686   172.31.0.2 -> 172.31.29.138 DNS 217 Standard query response 0x2138  A 54.192.159.173 A 54.230.156.193 A 54.230.157.230 A 54.230.158.246 A 54.230.159.4 A 54.230.159.153 A 54.192.156.109 A 54.192.157.144
  4   0.000696   172.31.0.2 -> 172.31.29.138 DNS 170 Standard query response 0x9a80 
  5   0.003836 172.31.29.138 -> 54.192.159.173 TCP 74 42218 > http [SYN] Seq=0 Win=26883 Len=0 MSS=8961 SACK_PERM=1 TSval=5104188 TSecr=0 WS=128
  6   0.004467 54.192.159.173 -> 172.31.29.138 TCP 74 http > 42218 [SYN, ACK] Seq=0 Ack=1 Win=14480 Len=0 MSS=1460 SACK_PERM=1 TSval=808294173 TSecr=5104188 WS=128
  7   0.004481 172.31.29.138 -> 54.192.159.173 TCP 66 42218 > http [ACK] Seq=1 Ack=1 Win=27008 Len=0 TSval=5104188 TSecr=808294173
  8   0.004522 172.31.29.138 -> 54.192.159.173 HTTP 163 GET /10kb HTTP/1.1 
  9   0.005196 54.192.159.173 -> 172.31.29.138 TCP 66 http > 42218 [ACK] Seq=1 Ack=98 Win=14592 Len=0 TSval=808294173 TSecr=5104188
 10   0.007450 54.192.159.173 -> 172.31.29.138 TCP 8754 [TCP segment of a reassembled PDU]
 11   0.007461 172.31.29.138 -> 54.192.159.173 TCP 66 42218 > http [ACK] Seq=98 Ack=8689 Win=44288 Len=0 TSval=5104188 TSecr=808294173
 12   0.007468 54.192.159.173 -> 172.31.29.138 HTTP 2073 HTTP/1.1 200 OK  (application/octet-stream)
 13   0.007472 172.31.29.138 -> 54.192.159.173 TCP 66 42218 > http [ACK] Seq=98 Ack=10696 Win=48384 Len=0 TSval=5104188 TSecr=808294173
 14   0.007624 172.31.29.138 -> 54.192.159.173 TCP 66 42218 > http [FIN, ACK] Seq=98 Ack=10696 Win=48384 Len=0 TSval=5104188 TSecr=808294173
 15   0.008149 54.192.159.173 -> 172.31.29.138 TCP 66 http > 42218 [FIN, ACK] Seq=10696 Ack=99 Win=14592 Len=0 TSval=808294173 TSecr=5104188
 16   0.008157 172.31.29.138 -> 54.192.159.173 TCP 66 42218 > http [ACK] Seq=99 Ack=10697 Win=48384 Len=0 TSval=5104189 TSecr=808294173
