[Measurement for 10kb at 09:35:43 20.35.2014] 
Tshark:

  1   0.000000 122.225.109.195 -> 172.31.29.138 TCP 62 17618 > ssh [SYN] Seq=0 Win=65535 Len=0 MSS=1460 SACK_PERM=1
  2   0.000030 172.31.29.138 -> 122.225.109.195 TCP 62 ssh > 17618 [SYN, ACK] Seq=0 Ack=1 Win=26883 Len=0 MSS=8961 SACK_PERM=1
  3   0.219714 122.225.109.195 -> 172.31.29.138 TCP 54 17618 > ssh [ACK] Seq=1 Ack=1 Win=65535 Len=0
  4   0.219747 122.225.109.195 -> 172.31.29.138 SSH 77 Client Protocol: SSH-2.0-libssh2_1.4.2\r
  5   0.219757 172.31.29.138 -> 122.225.109.195 TCP 54 ssh > 17618 [ACK] Seq=1 Ack=24 Win=26883 Len=0
  6   0.229212 172.31.29.138 -> 122.225.109.195 SSHv2 95 Server Protocol: SSH-2.0-OpenSSH_6.6.1p1 Ubuntu-2ubuntu2\r
  7   0.229615 172.31.29.138 -> 122.225.109.195 TCP 1514 [TCP segment of a reassembled PDU]
  8   0.448410 122.225.109.195 -> 172.31.29.138 SSHv2 862 Client: Key Exchange Init
  9   0.448444 172.31.29.138 -> 122.225.109.195 SSHv2 226 Server: Key Exchange Init
 10   0.602518 122.225.109.195 -> 172.31.29.138 TCP 54 17618 > ssh [ACK] Seq=832 Ack=1502 Win=65535 Len=0
 11   0.671162 122.225.109.195 -> 172.31.29.138 SSHv2 566 Client: Diffie-Hellman Key Exchange Init
 12   0.673775 172.31.29.138 -> 122.225.109.195 SSHv2 902 Server: New Keys
 13   0.895623 122.225.109.195 -> 172.31.29.138 SSHv2 238 Client: New Keys
 14   0.930355 172.31.29.138 -> 172.31.0.2   DNS 89 Standard query 0xb818  A d3796nkzln59xv.cloudfront.net
 15   0.930376 172.31.29.138 -> 172.31.0.2   DNS 89 Standard query 0x4223  AAAA d3796nkzln59xv.cloudfront.net
 16   0.931022   172.31.0.2 -> 172.31.29.138 DNS 170 Standard query response 0x4223 
 17   0.931033   172.31.0.2 -> 172.31.29.138 DNS 217 Standard query response 0xb818  A 54.230.150.122 A 54.230.150.152 A 54.230.150.220 A 54.230.149.38 A 54.230.149.227 A 54.230.149.232 A 54.230.150.42 A 54.230.150.74
 18   0.933001 172.31.29.138 -> 122.225.109.195 TCP 54 ssh > 17618 [ACK] Seq=2522 Ack=1528 Win=31512 Len=0
 19   0.934225 172.31.29.138 -> 54.230.150.122 TCP 74 46425 > http [SYN] Seq=0 Win=26883 Len=0 MSS=8961 SACK_PERM=1 TSval=15004167 TSecr=0 WS=128
 20   0.936037 54.230.150.122 -> 172.31.29.138 TCP 74 http > 46425 [SYN, ACK] Seq=0 Ack=1 Win=14480 Len=0 MSS=1460 SACK_PERM=1 TSval=1455518433 TSecr=15004167 WS=128
 21   0.936054 172.31.29.138 -> 54.230.150.122 TCP 66 46425 > http [ACK] Seq=1 Ack=1 Win=27008 Len=0 TSval=15004167 TSecr=1455518433
 22   0.936102 172.31.29.138 -> 54.230.150.122 HTTP 163 GET /10kb HTTP/1.1 
 23   0.937494 54.230.150.122 -> 172.31.29.138 TCP 66 http > 46425 [ACK] Seq=1 Ack=98 Win=14592 Len=0 TSval=1455518433 TSecr=15004167
 24   0.940359 54.230.150.122 -> 172.31.29.138 TCP 2592 [TCP segment of a reassembled PDU]
 25   0.940368 172.31.29.138 -> 54.230.150.122 TCP 66 46425 > http [ACK] Seq=98 Ack=2527 Win=32000 Len=0 TSval=15004168 TSecr=1455518433
 26   0.940405 54.230.150.122 -> 172.31.29.138 HTTP 8235 HTTP/1.1 200 OK  (application/octet-stream)
 27   0.940413 172.31.29.138 -> 54.230.150.122 TCP 66 46425 > http [ACK] Seq=98 Ack=10696 Win=48384 Len=0 TSval=15004168 TSecr=1455518433
 28   0.940572 172.31.29.138 -> 54.230.150.122 TCP 66 46425 > http [FIN, ACK] Seq=98 Ack=10696 Win=48384 Len=0 TSval=15004168 TSecr=1455518433
 29   0.942086 54.230.150.122 -> 172.31.29.138 TCP 66 http > 46425 [FIN, ACK] Seq=10696 Ack=99 Win=14592 Len=0 TSval=1455518433 TSecr=15004168
 30   0.942095 172.31.29.138 -> 54.230.150.122 TCP 66 46425 > http [ACK] Seq=99 Ack=10697 Win=48384 Len=0 TSval=15004169 TSecr=1455518433
 31   1.154661 122.225.109.195 -> 172.31.29.138 SSHv2 186 Encrypted request packet len=132
 32   1.154686 172.31.29.138 -> 122.225.109.195 TCP 54 ssh > 17618 [ACK] Seq=2522 Ack=1660 Win=33128 Len=0
 33   1.154751 172.31.29.138 -> 122.225.109.195 SSHv2 106 Encrypted response packet len=52
 34   1.374061 122.225.109.195 -> 172.31.29.138 SSHv2 154 Encrypted request packet len=100
 35   1.374461 172.31.29.138 -> 172.31.0.2   DNS 88 Standard query 0x81b6  PTR 195.109.225.122.in-addr.arpa
 36   1.375000   172.31.0.2 -> 172.31.29.138 DNS 145 Standard query response 0x81b6 No such name
 37   1.376567 172.31.29.138 -> 122.225.109.195 SSHv2 106 Encrypted response packet len=52
 38   1.595771 122.225.109.195 -> 172.31.29.138 TCP 54 17618 > ssh [FIN, ACK] Seq=1760 Ack=2626 Win=64411 Len=0
 39   1.596757 172.31.29.138 -> 122.225.109.195 TCP 54 ssh > 17618 [FIN, ACK] Seq=2626 Ack=1761 Win=33128 Len=0
 40   1.815611 122.225.109.195 -> 172.31.29.138 TCP 54 17618 > ssh [ACK] Seq=1761 Ack=2627 Win=64411 Len=0
