[Measurement for 10kb at 18:35:43 19.35.2014] 
Tshark:

  1   0.000000 172.31.29.138 -> 172.31.0.2   DNS 89 Standard query 0x5436  A d3796nkzln59xv.cloudfront.net
  2   0.000023 172.31.29.138 -> 172.31.0.2   DNS 89 Standard query 0xed84  AAAA d3796nkzln59xv.cloudfront.net
  3   0.000814   172.31.0.2 -> 172.31.29.138 DNS 170 Standard query response 0xed84 
  4   0.000824   172.31.0.2 -> 172.31.29.138 DNS 217 Standard query response 0x5436  A 54.192.159.72 A 54.230.156.193 A 54.230.157.230 A 54.230.158.223 A 54.230.159.6 A 54.240.168.128 A 54.240.168.150 A 54.192.156.106
  5   0.003918 172.31.29.138 -> 54.192.159.72 TCP 74 43959 > http [SYN] Seq=0 Win=26883 Len=0 MSS=8961 SACK_PERM=1 TSval=1504101 TSecr=0 WS=128
  6   0.004689 54.192.159.72 -> 172.31.29.138 TCP 74 http > 43959 [SYN, ACK] Seq=0 Ack=1 Win=14480 Len=0 MSS=1460 SACK_PERM=1 TSval=726855731 TSecr=1504101 WS=128
  7   0.004703 172.31.29.138 -> 54.192.159.72 TCP 66 43959 > http [ACK] Seq=1 Ack=1 Win=27008 Len=0 TSval=1504102 TSecr=726855731
  8   0.004745 172.31.29.138 -> 54.192.159.72 HTTP 163 GET /10kb HTTP/1.1 
  9   0.005468 54.192.159.72 -> 172.31.29.138 TCP 66 http > 43959 [ACK] Seq=1 Ack=98 Win=14592 Len=0 TSval=726855731 TSecr=1504102
 10   0.007215 54.192.159.72 -> 172.31.29.138 HTTP 10760 HTTP/1.1 200 OK  (application/octet-stream)
 11   0.007225 172.31.29.138 -> 54.192.159.72 TCP 66 43959 > http [ACK] Seq=98 Ack=10695 Win=48384 Len=0 TSval=1504102 TSecr=726855731
 12   0.007370 172.31.29.138 -> 54.192.159.72 TCP 66 43959 > http [FIN, ACK] Seq=98 Ack=10695 Win=48384 Len=0 TSval=1504102 TSecr=726855731
 13   0.008036 54.192.159.72 -> 172.31.29.138 TCP 66 http > 43959 [FIN, ACK] Seq=10695 Ack=99 Win=14592 Len=0 TSval=726855731 TSecr=1504102
 14   0.008054 172.31.29.138 -> 54.192.159.72 TCP 66 43959 > http [ACK] Seq=99 Ack=10696 Win=48384 Len=0 TSval=1504102 TSecr=726855731
