[Measurement for 10kb at 07:35:44 20.35.2014] 
Tshark:

  1   0.000000 172.31.29.138 -> 172.31.0.2   DNS 89 Standard query 0xe6c9  A d3796nkzln59xv.cloudfront.net
  2   0.000027 172.31.29.138 -> 172.31.0.2   DNS 89 Standard query 0xcf8c  AAAA d3796nkzln59xv.cloudfront.net
  3   0.000499   172.31.0.2 -> 172.31.29.138 DNS 170 Standard query response 0xcf8c 
  4   0.000509   172.31.0.2 -> 172.31.29.138 DNS 217 Standard query response 0xe6c9  A 54.230.150.74 A 54.230.151.62 A 54.230.151.214 A 54.230.151.234 A 54.230.149.221 A 54.230.150.16 A 54.230.150.31 A 54.230.150.54
  5   0.003847 172.31.29.138 -> 54.230.150.74 TCP 74 39149 > http [SYN] Seq=0 Win=26883 Len=0 MSS=8961 SACK_PERM=1 TSval=13204309 TSecr=0 WS=128
  6   0.005208 54.230.150.74 -> 172.31.29.138 TCP 74 http > 39149 [SYN, ACK] Seq=0 Ack=1 Win=14480 Len=0 MSS=1460 SACK_PERM=1 TSval=445278986 TSecr=13204309 WS=128
  7   0.005224 172.31.29.138 -> 54.230.150.74 TCP 66 39149 > http [ACK] Seq=1 Ack=1 Win=27008 Len=0 TSval=13204310 TSecr=445278986
  8   0.005268 172.31.29.138 -> 54.230.150.74 HTTP 163 GET /10kb HTTP/1.1 
  9   0.006497 54.230.150.74 -> 172.31.29.138 TCP 66 http > 39149 [ACK] Seq=1 Ack=98 Win=14592 Len=0 TSval=445278986 TSecr=13204310
 10   0.009284 54.230.150.74 -> 172.31.29.138 TCP 2592 [TCP segment of a reassembled PDU]
 11   0.009293 172.31.29.138 -> 54.230.150.74 TCP 66 39149 > http [ACK] Seq=98 Ack=2527 Win=32000 Len=0 TSval=13204311 TSecr=445278986
 12   0.009318 54.230.150.74 -> 172.31.29.138 HTTP 8235 HTTP/1.1 200 OK  (application/octet-stream)
 13   0.009339 172.31.29.138 -> 54.230.150.74 TCP 66 39149 > http [ACK] Seq=98 Ack=10696 Win=48384 Len=0 TSval=13204311 TSecr=445278986
 14   0.009490 172.31.29.138 -> 54.230.150.74 TCP 66 39149 > http [FIN, ACK] Seq=98 Ack=10696 Win=48384 Len=0 TSval=13204311 TSecr=445278986
 15   0.010839 54.230.150.74 -> 172.31.29.138 TCP 66 http > 39149 [FIN, ACK] Seq=10696 Ack=99 Win=14592 Len=0 TSval=445278986 TSecr=13204311
 16   0.010847 172.31.29.138 -> 54.230.150.74 TCP 66 39149 > http [ACK] Seq=99 Ack=10697 Win=48384 Len=0 TSval=13204311 TSecr=445278986
