[Measurement for 10kb at 05:35:44 20.35.2014] 
Tshark:

  1   0.000000 172.31.29.138 -> 172.31.0.2   DNS 89 Standard query 0xb39c  A d3796nkzln59xv.cloudfront.net
  2   0.000048 172.31.29.138 -> 172.31.0.2   DNS 89 Standard query 0x8c34  AAAA d3796nkzln59xv.cloudfront.net
  3   0.000642   172.31.0.2 -> 172.31.29.138 DNS 170 Standard query response 0x8c34 
  4   0.000652   172.31.0.2 -> 172.31.29.138 DNS 217 Standard query response 0xb39c  A 54.230.159.132 A 54.192.159.168 A 54.192.159.171 A 54.230.158.146 A 54.230.158.152 A 54.230.158.211 A 54.230.158.231 A 54.230.159.4
  5   0.003887 172.31.29.138 -> 54.230.159.132 TCP 74 51470 > http [SYN] Seq=0 Win=26883 Len=0 MSS=8961 SACK_PERM=1 TSval=11404345 TSecr=0 WS=128
  6   0.004522 54.230.159.132 -> 172.31.29.138 TCP 74 http > 51470 [SYN, ACK] Seq=0 Ack=1 Win=14480 Len=0 MSS=1460 SACK_PERM=1 TSval=833068256 TSecr=11404345 WS=128
  7   0.004536 172.31.29.138 -> 54.230.159.132 TCP 66 51470 > http [ACK] Seq=1 Ack=1 Win=27008 Len=0 TSval=11404345 TSecr=833068256
  8   0.004575 172.31.29.138 -> 54.230.159.132 HTTP 163 GET /10kb HTTP/1.1 
  9   0.005047 54.230.159.132 -> 172.31.29.138 TCP 66 http > 51470 [ACK] Seq=1 Ack=98 Win=14592 Len=0 TSval=833068256 TSecr=11404345
 10   0.010420 54.230.159.132 -> 172.31.29.138 TCP 7306 [TCP segment of a reassembled PDU]
 11   0.010431 172.31.29.138 -> 54.230.159.132 TCP 66 51470 > http [ACK] Seq=98 Ack=7241 Win=41472 Len=0 TSval=11404347 TSecr=833068257
 12   0.010438 54.230.159.132 -> 172.31.29.138 HTTP 3521 HTTP/1.1 200 OK  (application/octet-stream)
 13   0.010443 172.31.29.138 -> 54.230.159.132 TCP 66 51470 > http [ACK] Seq=98 Ack=10696 Win=48384 Len=0 TSval=11404347 TSecr=833068257
 14   0.010598 172.31.29.138 -> 54.230.159.132 TCP 66 51470 > http [FIN, ACK] Seq=98 Ack=10696 Win=48384 Len=0 TSval=11404347 TSecr=833068257
 15   0.011353 54.230.159.132 -> 172.31.29.138 TCP 66 http > 51470 [FIN, ACK] Seq=10696 Ack=99 Win=14592 Len=0 TSval=833068257 TSecr=11404347
 16   0.011362 172.31.29.138 -> 54.230.159.132 TCP 66 51470 > http [ACK] Seq=99 Ack=10697 Win=48384 Len=0 TSval=11404347 TSecr=833068257
