[Measurement for 10kb at 23:35:43 19.35.2014] 
Tshark:

  1   0.000000 172.31.29.138 -> 172.31.0.2   DNS 89 Standard query 0x4a0d  A d3796nkzln59xv.cloudfront.net
  2   0.000023 172.31.29.138 -> 172.31.0.2   DNS 89 Standard query 0xda2d  AAAA d3796nkzln59xv.cloudfront.net
  3   0.000553   172.31.0.2 -> 172.31.29.138 DNS 217 Standard query response 0x4a0d  A 54.230.158.214 A 54.230.159.132 A 54.230.159.150 A 54.192.157.149 A 54.192.159.173 A 54.230.156.193 A 54.230.157.230 A 54.230.158.182
  4   0.000563   172.31.0.2 -> 172.31.29.138 DNS 170 Standard query response 0xda2d 
  5   0.003900 172.31.29.138 -> 54.230.158.214 TCP 74 48762 > http [SYN] Seq=0 Win=26883 Len=0 MSS=8961 SACK_PERM=1 TSval=6004124 TSecr=0 WS=128
  6   0.004566 54.230.158.214 -> 172.31.29.138 TCP 74 http > 48762 [SYN, ACK] Seq=0 Ack=1 Win=14480 Len=0 MSS=1460 SACK_PERM=1 TSval=833997254 TSecr=6004124 WS=128
  7   0.004579 172.31.29.138 -> 54.230.158.214 TCP 66 48762 > http [ACK] Seq=1 Ack=1 Win=27008 Len=0 TSval=6004125 TSecr=833997254
  8   0.004635 172.31.29.138 -> 54.230.158.214 HTTP 163 GET /10kb HTTP/1.1 
  9   0.005248 54.230.158.214 -> 172.31.29.138 TCP 66 http > 48762 [ACK] Seq=1 Ack=98 Win=14592 Len=0 TSval=833997254 TSecr=6004125
 10   0.007420 54.230.158.214 -> 172.31.29.138 HTTP 10761 HTTP/1.1 200 OK  (application/octet-stream)
 11   0.007432 172.31.29.138 -> 54.230.158.214 TCP 66 48762 > http [ACK] Seq=98 Ack=10696 Win=48384 Len=0 TSval=6004125 TSecr=833997254
 12   0.007581 172.31.29.138 -> 54.230.158.214 TCP 66 48762 > http [FIN, ACK] Seq=98 Ack=10696 Win=48384 Len=0 TSval=6004125 TSecr=833997254
 13   0.008285 54.230.158.214 -> 172.31.29.138 TCP 66 http > 48762 [FIN, ACK] Seq=10696 Ack=99 Win=14592 Len=0 TSval=833997254 TSecr=6004125
 14   0.008293 172.31.29.138 -> 54.230.158.214 TCP 66 48762 > http [ACK] Seq=99 Ack=10697 Win=48384 Len=0 TSval=6004125 TSecr=833997254
