[Measurement for 1mb at 21:33:09 19.33.2014] 
Tshark:

  1   0.000000 172.31.36.109 -> 172.31.0.2   DNS 89 Standard query 0x60b2  A d1xzxs93r3iphc.cloudfront.net
  2   0.000023 172.31.36.109 -> 172.31.0.2   DNS 89 Standard query 0x6163  AAAA d1xzxs93r3iphc.cloudfront.net
  3   0.000548   172.31.0.2 -> 172.31.36.109 DNS 170 Standard query response 0x6163 
  4   0.000567   172.31.0.2 -> 172.31.36.109 DNS 217 Standard query response 0x60b2  A 54.230.31.8 A 54.192.29.219 A 54.192.30.214 A 54.192.30.220 A 54.230.30.28 A 54.230.30.209 A 54.230.30.213 A 54.230.30.226
  5   0.003907 172.31.36.109 -> 54.230.31.8  TCP 74 42986 > http [SYN] Seq=0 Win=26883 Len=0 MSS=8961 SACK_PERM=1 TSval=24119097 TSecr=0 WS=128
  6   0.005234  54.230.31.8 -> 172.31.36.109 TCP 74 http > 42986 [SYN, ACK] Seq=0 Ack=1 Win=14480 Len=0 MSS=1460 SACK_PERM=1 TSval=829615648 TSecr=24119097 WS=128
  7   0.005268 172.31.36.109 -> 54.230.31.8  TCP 66 42986 > http [ACK] Seq=1 Ack=1 Win=27008 Len=0 TSval=24119097 TSecr=829615648
  8   0.005305 172.31.36.109 -> 54.230.31.8  HTTP 162 GET /1mb HTTP/1.1 
  9   0.006439  54.230.31.8 -> 172.31.36.109 TCP 66 http > 42986 [ACK] Seq=1 Ack=97 Win=14592 Len=0 TSval=829615649 TSecr=24119097
 10   0.064603  54.230.31.8 -> 172.31.36.109 TCP 13098 [TCP segment of a reassembled PDU]
 11   0.064616 172.31.36.109 -> 54.230.31.8  TCP 66 42986 > http [ACK] Seq=97 Ack=13033 Win=52992 Len=0 TSval=24119112 TSecr=829615654
 12   0.064749  54.230.31.8 -> 172.31.36.109 TCP 1514 [TCP segment of a reassembled PDU]
 13   0.064754 172.31.36.109 -> 54.230.31.8  TCP 66 42986 > http [ACK] Seq=97 Ack=14481 Win=55936 Len=0 TSval=24119112 TSecr=829615654
 14   0.066034  54.230.31.8 -> 172.31.36.109 TCP 4410 [TCP segment of a reassembled PDU]
 15   0.066041 172.31.36.109 -> 54.230.31.8  TCP 66 42986 > http [ACK] Seq=97 Ack=18825 Win=64640 Len=0 TSval=24119112 TSecr=829615654
 16   0.066103  54.230.31.8 -> 172.31.36.109 TCP 8754 [TCP segment of a reassembled PDU]
 17   0.066110 172.31.36.109 -> 54.230.31.8  TCP 66 42986 > http [ACK] Seq=97 Ack=27513 Win=81920 Len=0 TSval=24119112 TSecr=829615654
 18   0.067138  54.230.31.8 -> 172.31.36.109 TCP 5858 [TCP segment of a reassembled PDU]
 19   0.067145 172.31.36.109 -> 54.230.31.8  TCP 66 42986 > http [ACK] Seq=97 Ack=33305 Win=93568 Len=0 TSval=24119113 TSecr=829615655
 20   0.067169  54.230.31.8 -> 172.31.36.109 TCP 7306 [TCP segment of a reassembled PDU]
 21   0.067174 172.31.36.109 -> 54.230.31.8  TCP 66 42986 > http [ACK] Seq=97 Ack=40545 Win=96512 Len=0 TSval=24119113 TSecr=829615655
 22   0.067359  54.230.31.8 -> 172.31.36.109 TCP 7306 [TCP segment of a reassembled PDU]
 23   0.067366 172.31.36.109 -> 54.230.31.8  TCP 66 42986 > http [ACK] Seq=97 Ack=47785 Win=122496 Len=0 TSval=24119113 TSecr=829615655
 24   0.068155  54.230.31.8 -> 172.31.36.109 TCP 5858 [TCP segment of a reassembled PDU]
 25   0.068161 172.31.36.109 -> 54.230.31.8  TCP 66 42986 > http [ACK] Seq=97 Ack=53577 Win=134144 Len=0 TSval=24119113 TSecr=829615655
 26   0.068427  54.230.31.8 -> 172.31.36.109 TCP 10202 [TCP segment of a reassembled PDU]
 27   0.068434 172.31.36.109 -> 54.230.31.8  TCP 66 42986 > http [ACK] Seq=97 Ack=63713 Win=154368 Len=0 TSval=24119113 TSecr=829615655
 28   0.068716  54.230.31.8 -> 172.31.36.109 TCP 8754 [TCP segment of a reassembled PDU]
 29   0.068722 172.31.36.109 -> 54.230.31.8  TCP 66 42986 > http [ACK] Seq=97 Ack=72401 Win=171776 Len=0 TSval=24119113 TSecr=829615655
 30   0.069662  54.230.31.8 -> 172.31.36.109 TCP 5858 [TCP segment of a reassembled PDU]
 31   0.069669 172.31.36.109 -> 54.230.31.8  TCP 66 42986 > http [ACK] Seq=97 Ack=78193 Win=183296 Len=0 TSval=24119113 TSecr=829615655
 32   0.070009  54.230.31.8 -> 172.31.36.109 TCP 13098 [TCP segment of a reassembled PDU]
 33   0.070019 172.31.36.109 -> 54.230.31.8  TCP 66 42986 > http [ACK] Seq=97 Ack=91225 Win=176896 Len=0 TSval=24119113 TSecr=829615655
 34   0.070128  54.230.31.8 -> 172.31.36.109 TCP 2962 [TCP segment of a reassembled PDU]
 35   0.070133 172.31.36.109 -> 54.230.31.8  TCP 66 42986 > http [ACK] Seq=97 Ack=94121 Win=189184 Len=0 TSval=24119113 TSecr=829615655
 36   0.071018  54.230.31.8 -> 172.31.36.109 TCP 10202 [TCP segment of a reassembled PDU]
 37   0.071025 172.31.36.109 -> 54.230.31.8  TCP 66 42986 > http [ACK] Seq=97 Ack=104257 Win=181632 Len=0 TSval=24119114 TSecr=829615655
 38   0.071118  54.230.31.8 -> 172.31.36.109 TCP 4410 [TCP segment of a reassembled PDU]
 39   0.071123 172.31.36.109 -> 54.230.31.8  TCP 66 42986 > http [ACK] Seq=97 Ack=108601 Win=197760 Len=0 TSval=24119114 TSecr=829615655
 40   0.071346  54.230.31.8 -> 172.31.36.109 TCP 14546 [TCP segment of a reassembled PDU]
 41   0.071354 172.31.36.109 -> 54.230.31.8  TCP 66 42986 > http [ACK] Seq=97 Ack=123081 Win=226816 Len=0 TSval=24119114 TSecr=829615655
 42   0.072354  54.230.31.8 -> 172.31.36.109 TCP 2962 [TCP segment of a reassembled PDU]
 43   0.072360 172.31.36.109 -> 54.230.31.8  TCP 66 42986 > http [ACK] Seq=97 Ack=125977 Win=232576 Len=0 TSval=24119114 TSecr=829615655
 44   0.072638  54.230.31.8 -> 172.31.36.109 TCP 27578 [TCP segment of a reassembled PDU]
 45   0.072653 172.31.36.109 -> 54.230.31.8  TCP 66 42986 > http [ACK] Seq=97 Ack=153489 Win=287616 Len=0 TSval=24119114 TSecr=829615655
 46   0.072867  54.230.31.8 -> 172.31.36.109 TCP 7306 [TCP segment of a reassembled PDU]
 47   0.072874 172.31.36.109 -> 54.230.31.8  TCP 66 42986 > http [ACK] Seq=97 Ack=160729 Win=302080 Len=0 TSval=24119114 TSecr=829615655
 48   0.073842  54.230.31.8 -> 172.31.36.109 TCP 11650 [TCP segment of a reassembled PDU]
 49   0.073849 172.31.36.109 -> 54.230.31.8  TCP 66 42986 > http [ACK] Seq=97 Ack=172313 Win=325248 Len=0 TSval=24119114 TSecr=829615655
 50   0.073980  54.230.31.8 -> 172.31.36.109 TCP 14546 [TCP segment of a reassembled PDU]
 51   0.073989 172.31.36.109 -> 54.230.31.8  TCP 66 42986 > http [ACK] Seq=97 Ack=186793 Win=354176 Len=0 TSval=24119114 TSecr=829615655
 52   0.074042  54.230.31.8 -> 172.31.36.109 TCP 5858 [TCP segment of a reassembled PDU]
 53   0.074048 172.31.36.109 -> 54.230.31.8  TCP 66 42986 > http [ACK] Seq=97 Ack=192585 Win=365824 Len=0 TSval=24119114 TSecr=829615655
 54   0.074225  54.230.31.8 -> 172.31.36.109 TCP 10202 [TCP segment of a reassembled PDU]
 55   0.074233 172.31.36.109 -> 54.230.31.8  TCP 66 42986 > http [ACK] Seq=97 Ack=202721 Win=386048 Len=0 TSval=24119114 TSecr=829615655
 56   0.075139  54.230.31.8 -> 172.31.36.109 TCP 2962 [TCP segment of a reassembled PDU]
 57   0.075145 172.31.36.109 -> 54.230.31.8  TCP 66 42986 > http [ACK] Seq=97 Ack=205617 Win=391808 Len=0 TSval=24119115 TSecr=829615655
 58   0.075267  54.230.31.8 -> 172.31.36.109 TCP 24682 [TCP segment of a reassembled PDU]
 59   0.075290 172.31.36.109 -> 54.230.31.8  TCP 66 42986 > http [ACK] Seq=97 Ack=230233 Win=441088 Len=0 TSval=24119115 TSecr=829615655
 60   0.075417  54.230.31.8 -> 172.31.36.109 TCP 20338 [TCP segment of a reassembled PDU]
 61   0.075428 172.31.36.109 -> 54.230.31.8  TCP 66 42986 > http [ACK] Seq=97 Ack=250505 Win=481664 Len=0 TSval=24119115 TSecr=829615655
 62   0.076655  54.230.31.8 -> 172.31.36.109 TCP 10202 [TCP segment of a reassembled PDU]
 63   0.076663 172.31.36.109 -> 54.230.31.8  TCP 66 42986 > http [ACK] Seq=97 Ack=260641 Win=501888 Len=0 TSval=24119115 TSecr=829615656
 64   0.076783  54.230.31.8 -> 172.31.36.109 TCP 10202 [TCP segment of a reassembled PDU]
 65   0.076802 172.31.36.109 -> 54.230.31.8  TCP 66 42986 > http [ACK] Seq=97 Ack=270777 Win=522112 Len=0 TSval=24119115 TSecr=829615656
 66   0.077082  54.230.31.8 -> 172.31.36.109 TCP 30474 [TCP segment of a reassembled PDU]
 67   0.077097 172.31.36.109 -> 54.230.31.8  TCP 66 42986 > http [ACK] Seq=97 Ack=301185 Win=583040 Len=0 TSval=24119115 TSecr=829615656
 68   0.077104  54.230.31.8 -> 172.31.36.109 TCP 1514 [TCP segment of a reassembled PDU]
 69   0.077106 172.31.36.109 -> 54.230.31.8  TCP 66 42986 > http [ACK] Seq=97 Ack=302633 Win=585856 Len=0 TSval=24119115 TSecr=829615656
 70   0.078007  54.230.31.8 -> 172.31.36.109 TCP 4410 [TCP segment of a reassembled PDU]
 71   0.078013 172.31.36.109 -> 54.230.31.8  TCP 66 42986 > http [ACK] Seq=97 Ack=306977 Win=594560 Len=0 TSval=24119115 TSecr=829615656
 72   0.078057  54.230.31.8 -> 172.31.36.109 TCP 1514 [TCP segment of a reassembled PDU]
 73   0.078061 172.31.36.109 -> 54.230.31.8  TCP 66 42986 > http [ACK] Seq=97 Ack=308425 Win=597504 Len=0 TSval=24119115 TSecr=829615656
 74   0.078281  54.230.31.8 -> 172.31.36.109 TCP 13098 [TCP segment of a reassembled PDU]
 75   0.078289 172.31.36.109 -> 54.230.31.8  TCP 66 42986 > http [ACK] Seq=97 Ack=321457 Win=623488 Len=0 TSval=24119115 TSecr=829615656
 76   0.078397  54.230.31.8 -> 172.31.36.109 TCP 4410 [TCP segment of a reassembled PDU]
 77   0.078403 172.31.36.109 -> 54.230.31.8  TCP 66 42986 > http [ACK] Seq=97 Ack=325801 Win=632192 Len=0 TSval=24119115 TSecr=829615656
 78   0.078806  54.230.31.8 -> 172.31.36.109 TCP 2962 [TCP segment of a reassembled PDU]
 79   0.078811 172.31.36.109 -> 54.230.31.8  TCP 66 42986 > http [ACK] Seq=97 Ack=328697 Win=637952 Len=0 TSval=24119115 TSecr=829615656
 80   0.079043  54.230.31.8 -> 172.31.36.109 TCP 5858 [TCP segment of a reassembled PDU]
 81   0.079048 172.31.36.109 -> 54.230.31.8  TCP 66 42986 > http [ACK] Seq=97 Ack=334489 Win=649600 Len=0 TSval=24119116 TSecr=829615656
 82   0.079179  54.230.31.8 -> 172.31.36.109 TCP 23234 [TCP segment of a reassembled PDU]
 83   0.079191 172.31.36.109 -> 54.230.31.8  TCP 66 42986 > http [ACK] Seq=97 Ack=357657 Win=655744 Len=0 TSval=24119116 TSecr=829615656
 84   0.079594  54.230.31.8 -> 172.31.36.109 TCP 5858 [TCP segment of a reassembled PDU]
 85   0.079600 172.31.36.109 -> 54.230.31.8  TCP 66 42986 > http [ACK] Seq=97 Ack=363449 Win=684288 Len=0 TSval=24119116 TSecr=829615656
 86   0.079701  54.230.31.8 -> 172.31.36.109 TCP 20338 [TCP segment of a reassembled PDU]
 87   0.079712 172.31.36.109 -> 54.230.31.8  TCP 66 42986 > http [ACK] Seq=97 Ack=383721 Win=664064 Len=0 TSval=24119116 TSecr=829615656
 88   0.080082  54.230.31.8 -> 172.31.36.109 TCP 5858 [TCP segment of a reassembled PDU]
 89   0.080089 172.31.36.109 -> 54.230.31.8  TCP 66 42986 > http [ACK] Seq=97 Ack=389513 Win=684288 Len=0 TSval=24119116 TSecr=829615656
 90   0.080230  54.230.31.8 -> 172.31.36.109 TCP 4410 [TCP segment of a reassembled PDU]
 91   0.080236 172.31.36.109 -> 54.230.31.8  TCP 66 42986 > http [ACK] Seq=97 Ack=393857 Win=686592 Len=0 TSval=24119116 TSecr=829615656
 92   0.080243  54.230.31.8 -> 172.31.36.109 TCP 2962 [TCP segment of a reassembled PDU]
 93   0.080256 172.31.36.109 -> 54.230.31.8  TCP 66 42986 > http [ACK] Seq=97 Ack=396753 Win=691840 Len=0 TSval=24119116 TSecr=829615656
 94   0.080274  54.230.31.8 -> 172.31.36.109 TCP 1514 [TCP segment of a reassembled PDU]
 95   0.080476  54.230.31.8 -> 172.31.36.109 TCP 21786 [TCP segment of a reassembled PDU]
 96   0.080498  54.230.31.8 -> 172.31.36.109 TCP 2962 [TCP segment of a reassembled PDU]
 97   0.080508 172.31.36.109 -> 54.230.31.8  TCP 66 42986 > http [ACK] Seq=97 Ack=422817 Win=665856 Len=0 TSval=24119116 TSecr=829615656
 98   0.080595  54.230.31.8 -> 172.31.36.109 TCP 2962 [TCP segment of a reassembled PDU]
 99   0.080600 172.31.36.109 -> 54.230.31.8  TCP 66 42986 > http [ACK] Seq=97 Ack=425713 Win=689024 Len=0 TSval=24119116 TSecr=829615656
100   0.080807  54.230.31.8 -> 172.31.36.109 TCP 1514 [TCP segment of a reassembled PDU]
101   0.080988  54.230.31.8 -> 172.31.36.109 TCP 27578 [TCP segment of a reassembled PDU]
102   0.081013 172.31.36.109 -> 54.230.31.8  TCP 66 42986 > http [ACK] Seq=97 Ack=454673 Win=660096 Len=0 TSval=24119116 TSecr=829615656
103   0.081324  54.230.31.8 -> 172.31.36.109 TCP 2962 [TCP segment of a reassembled PDU]
104   0.081330 172.31.36.109 -> 54.230.31.8  TCP 66 42986 > http [ACK] Seq=97 Ack=457569 Win=689024 Len=0 TSval=24119116 TSecr=829615656
105   0.081430  54.230.31.8 -> 172.31.36.109 TCP 1514 [TCP segment of a reassembled PDU]
106   0.081833  54.230.31.8 -> 172.31.36.109 TCP 4410 [TCP segment of a reassembled PDU]
107   0.081847 172.31.36.109 -> 54.230.31.8  TCP 66 42986 > http [ACK] Seq=97 Ack=463361 Win=691840 Len=0 TSval=24119116 TSecr=829615656
108   0.081979  54.230.31.8 -> 172.31.36.109 TCP 18890 [TCP segment of a reassembled PDU]
109   0.082000 172.31.36.109 -> 54.230.31.8  TCP 66 42986 > http [ACK] Seq=97 Ack=482185 Win=673024 Len=0 TSval=24119116 TSecr=829615656
110   0.082014  54.230.31.8 -> 172.31.36.109 TCP 7306 [TCP segment of a reassembled PDU]
111   0.082028 172.31.36.109 -> 54.230.31.8  TCP 66 42986 > http [ACK] Seq=97 Ack=489425 Win=691840 Len=0 TSval=24119116 TSecr=829615656
112   0.082043  54.230.31.8 -> 172.31.36.109 TCP 4410 [TCP segment of a reassembled PDU]
113   0.082050 172.31.36.109 -> 54.230.31.8  TCP 66 42986 > http [ACK] Seq=97 Ack=493769 Win=691840 Len=0 TSval=24119116 TSecr=829615656
114   0.082122  54.230.31.8 -> 172.31.36.109 TCP 7306 [TCP segment of a reassembled PDU]
115   0.082216  54.230.31.8 -> 172.31.36.109 TCP 2962 [TCP segment of a reassembled PDU]
116   0.082259 172.31.36.109 -> 54.230.31.8  TCP 66 42986 > http [ACK] Seq=97 Ack=503905 Win=691840 Len=0 TSval=24119116 TSecr=829615656
117   0.082336  54.230.31.8 -> 172.31.36.109 TCP 1514 [TCP segment of a reassembled PDU]
118   0.082485  54.230.31.8 -> 172.31.36.109 TCP 18890 [TCP segment of a reassembled PDU]
119   0.082506 172.31.36.109 -> 54.230.31.8  TCP 66 42986 > http [ACK] Seq=97 Ack=524177 Win=671616 Len=0 TSval=24119116 TSecr=829615656
120   0.083124  54.230.31.8 -> 172.31.36.109 TCP 1514 [TCP segment of a reassembled PDU]
121   0.083340  54.230.31.8 -> 172.31.36.109 TCP 18890 [TCP segment of a reassembled PDU]
122   0.083351 172.31.36.109 -> 54.230.31.8  TCP 66 42986 > http [ACK] Seq=97 Ack=544449 Win=729472 Len=0 TSval=24119117 TSecr=829615656
123   0.083374  54.230.31.8 -> 172.31.36.109 TCP 7306 [TCP segment of a reassembled PDU]
124   0.083381 172.31.36.109 -> 54.230.31.8  TCP 66 42986 > http [ACK] Seq=97 Ack=551689 Win=743936 Len=0 TSval=24119117 TSecr=829615656
125   0.083465  54.230.31.8 -> 172.31.36.109 TCP 24682 [TCP segment of a reassembled PDU]
126   0.083478 172.31.36.109 -> 54.230.31.8  TCP 66 42986 > http [ACK] Seq=97 Ack=576305 Win=752512 Len=0 TSval=24119117 TSecr=829615656
127   0.083550  54.230.31.8 -> 172.31.36.109 TCP 13098 [TCP segment of a reassembled PDU]
128   0.083558 172.31.36.109 -> 54.230.31.8  TCP 66 42986 > http [ACK] Seq=97 Ack=589337 Win=771584 Len=0 TSval=24119117 TSecr=829615656
129   0.084741  54.230.31.8 -> 172.31.36.109 TCP 2962 [TCP segment of a reassembled PDU]
130   0.084746 172.31.36.109 -> 54.230.31.8  TCP 66 42986 > http [ACK] Seq=97 Ack=592233 Win=788096 Len=0 TSval=24119117 TSecr=829615656
131   0.085011  54.230.31.8 -> 172.31.36.109 TCP 18890 [TCP segment of a reassembled PDU]
132   0.085033  54.230.31.8 -> 172.31.36.109 TCP 15994 [TCP segment of a reassembled PDU]
133   0.085053 172.31.36.109 -> 54.230.31.8  TCP 66 42986 > http [ACK] Seq=97 Ack=626985 Win=753408 Len=0 TSval=24119117 TSecr=829615656
134   0.085193  54.230.31.8 -> 172.31.36.109 TCP 10202 [TCP segment of a reassembled PDU]
135   0.085200 172.31.36.109 -> 54.230.31.8  TCP 66 42986 > http [ACK] Seq=97 Ack=637121 Win=776320 Len=0 TSval=24119117 TSecr=829615656
136   0.085311  54.230.31.8 -> 172.31.36.109 TCP 17442 [TCP segment of a reassembled PDU]
137   0.085350 172.31.36.109 -> 54.230.31.8  TCP 66 42986 > http [ACK] Seq=97 Ack=654497 Win=764288 Len=0 TSval=24119117 TSecr=829615656
138   0.086017  54.230.31.8 -> 172.31.36.109 TCP 5858 [TCP segment of a reassembled PDU]
139   0.086024 172.31.36.109 -> 54.230.31.8  TCP 66 42986 > http [ACK] Seq=97 Ack=660289 Win=783360 Len=0 TSval=24119117 TSecr=829615657
140   0.086168  54.230.31.8 -> 172.31.36.109 TCP 13098 [TCP segment of a reassembled PDU]
141   0.086197 172.31.36.109 -> 54.230.31.8  TCP 66 42986 > http [ACK] Seq=97 Ack=673321 Win=788224 Len=0 TSval=24119117 TSecr=829615657
142   0.086301  54.230.31.8 -> 172.31.36.109 TCP 11650 [TCP segment of a reassembled PDU]
143   0.086320 172.31.36.109 -> 54.230.31.8  TCP 66 42986 > http [ACK] Seq=97 Ack=684905 Win=788224 Len=0 TSval=24119117 TSecr=829615657
144   0.086389  54.230.31.8 -> 172.31.36.109 TCP 18890 [TCP segment of a reassembled PDU]
145   0.086410 172.31.36.109 -> 54.230.31.8  TCP 66 42986 > http [ACK] Seq=97 Ack=703729 Win=769408 Len=0 TSval=24119117 TSecr=829615657
146   0.086518  54.230.31.8 -> 172.31.36.109 TCP 4410 [TCP segment of a reassembled PDU]
147   0.086523 172.31.36.109 -> 54.230.31.8  TCP 66 42986 > http [ACK] Seq=97 Ack=708073 Win=785792 Len=0 TSval=24119117 TSecr=829615657
148   0.086628  54.230.31.8 -> 172.31.36.109 TCP 14546 [TCP segment of a reassembled PDU]
149   0.086648 172.31.36.109 -> 54.230.31.8  TCP 66 42986 > http [ACK] Seq=97 Ack=722553 Win=788224 Len=0 TSval=24119117 TSecr=829615657
150   0.086723  54.230.31.8 -> 172.31.36.109 TCP 5858 [TCP segment of a reassembled PDU]
151   0.086739 172.31.36.109 -> 54.230.31.8  TCP 66 42986 > http [ACK] Seq=97 Ack=728345 Win=788224 Len=0 TSval=24119117 TSecr=829615657
152   0.086852  54.230.31.8 -> 172.31.36.109 TCP 18890 [TCP segment of a reassembled PDU]
153   0.086873 172.31.36.109 -> 54.230.31.8  TCP 66 42986 > http [ACK] Seq=97 Ack=747169 Win=769408 Len=0 TSval=24119117 TSecr=829615657
154   0.086959  54.230.31.8 -> 172.31.36.109 TCP 8754 [TCP segment of a reassembled PDU]
155   0.086965 172.31.36.109 -> 54.230.31.8  TCP 66 42986 > http [ACK] Seq=97 Ack=755857 Win=778624 Len=0 TSval=24119117 TSecr=829615657
156   0.087501  54.230.31.8 -> 172.31.36.109 TCP 2962 [TCP segment of a reassembled PDU]
157   0.087507 172.31.36.109 -> 54.230.31.8  TCP 66 42986 > http [ACK] Seq=97 Ack=758753 Win=788096 Len=0 TSval=24119118 TSecr=829615657
158   0.087637  54.230.31.8 -> 172.31.36.109 TCP 10202 [TCP segment of a reassembled PDU]
159   0.087655 172.31.36.109 -> 54.230.31.8  TCP 66 42986 > http [ACK] Seq=97 Ack=768889 Win=788224 Len=0 TSval=24119118 TSecr=829615657
160   0.087746  54.230.31.8 -> 172.31.36.109 TCP 4410 [TCP segment of a reassembled PDU]
161   0.087761 172.31.36.109 -> 54.230.31.8  TCP 66 42986 > http [ACK] Seq=97 Ack=773233 Win=788224 Len=0 TSval=24119118 TSecr=829615657
162   0.087883  54.230.31.8 -> 172.31.36.109 TCP 11650 [TCP segment of a reassembled PDU]
163   0.087901 172.31.36.109 -> 54.230.31.8  TCP 66 42986 > http [ACK] Seq=97 Ack=784817 Win=788224 Len=0 TSval=24119118 TSecr=829615657
164   0.088117  54.230.31.8 -> 172.31.36.109 TCP 4410 [TCP segment of a reassembled PDU]
165   0.088131 172.31.36.109 -> 54.230.31.8  TCP 66 42986 > http [ACK] Seq=97 Ack=789161 Win=788224 Len=0 TSval=24119118 TSecr=829615657
166   0.088247  54.230.31.8 -> 172.31.36.109 TCP 10202 [TCP segment of a reassembled PDU]
167   0.088265 172.31.36.109 -> 54.230.31.8  TCP 66 42986 > http [ACK] Seq=97 Ack=799297 Win=788224 Len=0 TSval=24119118 TSecr=829615657
168   0.088368  54.230.31.8 -> 172.31.36.109 TCP 8754 [TCP segment of a reassembled PDU]
169   0.088385 172.31.36.109 -> 54.230.31.8  TCP 66 42986 > http [ACK] Seq=97 Ack=807985 Win=788224 Len=0 TSval=24119118 TSecr=829615657
170   0.088519  54.230.31.8 -> 172.31.36.109 TCP 21786 [TCP segment of a reassembled PDU]
171   0.088541 172.31.36.109 -> 54.230.31.8  TCP 66 42986 > http [ACK] Seq=97 Ack=829705 Win=766592 Len=0 TSval=24119118 TSecr=829615657
172   0.088614  54.230.31.8 -> 172.31.36.109 TCP 5858 [TCP segment of a reassembled PDU]
173   0.088620 172.31.36.109 -> 54.230.31.8  TCP 66 42986 > http [ACK] Seq=97 Ack=835497 Win=783360 Len=0 TSval=24119118 TSecr=829615657
174   0.088733  54.230.31.8 -> 172.31.36.109 TCP 7306 [TCP segment of a reassembled PDU]
175   0.088749 172.31.36.109 -> 54.230.31.8  TCP 66 42986 > http [ACK] Seq=97 Ack=842737 Win=788224 Len=0 TSval=24119118 TSecr=829615657
176   0.088856  54.230.31.8 -> 172.31.36.109 TCP 7306 [TCP segment of a reassembled PDU]
177   0.088873 172.31.36.109 -> 54.230.31.8  TCP 66 42986 > http [ACK] Seq=97 Ack=849977 Win=788224 Len=0 TSval=24119118 TSecr=829615657
178   0.089152  54.230.31.8 -> 172.31.36.109 TCP 20338 [TCP segment of a reassembled PDU]
179   0.089179  54.230.31.8 -> 172.31.36.109 TCP 5858 [TCP segment of a reassembled PDU]
180   0.089186  54.230.31.8 -> 172.31.36.109 TCP 5858 [TCP segment of a reassembled PDU]
181   0.089192 172.31.36.109 -> 54.230.31.8  TCP 66 42986 > http [ACK] Seq=97 Ack=870249 Win=768000 Len=0 TSval=24119118 TSecr=829615657
182   0.089206 172.31.36.109 -> 54.230.31.8  TCP 66 42986 > http [ACK] Seq=97 Ack=881833 Win=788224 Len=0 TSval=24119118 TSecr=829615657
183   0.089359  54.230.31.8 -> 172.31.36.109 TCP 8754 [TCP segment of a reassembled PDU]
184   0.089412 172.31.36.109 -> 54.230.31.8  TCP 66 42986 > http [ACK] Seq=97 Ack=890521 Win=788224 Len=0 TSval=24119118 TSecr=829615657
185   0.089611  54.230.31.8 -> 172.31.36.109 TCP 1514 [TCP segment of a reassembled PDU]
186   0.089802  54.230.31.8 -> 172.31.36.109 TCP 2962 [TCP segment of a reassembled PDU]
187   0.089816 172.31.36.109 -> 54.230.31.8  TCP 66 42986 > http [ACK] Seq=97 Ack=894865 Win=788224 Len=0 TSval=24119118 TSecr=829615657
188   0.089932  54.230.31.8 -> 172.31.36.109 TCP 13098 [TCP segment of a reassembled PDU]
189   0.089951 172.31.36.109 -> 54.230.31.8  TCP 66 42986 > http [ACK] Seq=97 Ack=907897 Win=788224 Len=0 TSval=24119118 TSecr=829615657
190   0.090041  54.230.31.8 -> 172.31.36.109 TCP 7306 [TCP segment of a reassembled PDU]
191   0.090057 172.31.36.109 -> 54.230.31.8  TCP 66 42986 > http [ACK] Seq=97 Ack=915137 Win=788224 Len=0 TSval=24119118 TSecr=829615657
192   0.090165  54.230.31.8 -> 172.31.36.109 TCP 17442 [TCP segment of a reassembled PDU]
193   0.090185  54.230.31.8 -> 172.31.36.109 TCP 2962 [TCP segment of a reassembled PDU]
194   0.090194 172.31.36.109 -> 54.230.31.8  TCP 66 42986 > http [ACK] Seq=97 Ack=935409 Win=768000 Len=0 TSval=24119118 TSecr=829615657
195   0.090408  54.230.31.8 -> 172.31.36.109 TCP 26130 [TCP segment of a reassembled PDU]
196   0.090434 172.31.36.109 -> 54.230.31.8  TCP 66 42986 > http [ACK] Seq=97 Ack=961473 Win=750080 Len=0 TSval=24119118 TSecr=829615657
197   0.090607  54.230.31.8 -> 172.31.36.109 TCP 10202 [TCP segment of a reassembled PDU]
198   0.090614 172.31.36.109 -> 54.230.31.8  TCP 66 42986 > http [ACK] Seq=97 Ack=971609 Win=776320 Len=0 TSval=24119118 TSecr=829615657
199   0.090724  54.230.31.8 -> 172.31.36.109 TCP 10202 [TCP segment of a reassembled PDU]
200   0.090731 172.31.36.109 -> 54.230.31.8  TCP 66 42986 > http [ACK] Seq=97 Ack=981745 Win=776320 Len=0 TSval=24119118 TSecr=829615657
201   0.090846  54.230.31.8 -> 172.31.36.109 TCP 10202 [TCP segment of a reassembled PDU]
202   0.090854 172.31.36.109 -> 54.230.31.8  TCP 66 42986 > http [ACK] Seq=97 Ack=991881 Win=776320 Len=0 TSval=24119118 TSecr=829615657
203   0.090998  54.230.31.8 -> 172.31.36.109 TCP 10202 [TCP segment of a reassembled PDU]
204   0.091006  54.230.31.8 -> 172.31.36.109 TCP 1514 [TCP Previous segment not captured] [TCP segment of a reassembled PDU]
205   0.091009 172.31.36.109 -> 54.230.31.8  TCP 78 42986 > http [ACK] Seq=97 Ack=1002017 Win=766208 Len=0 TSval=24119119 TSecr=829615657 SLE=1003465 SRE=1004913
206   0.091014  54.230.31.8 -> 172.31.36.109 TCP 1514 [TCP Out-Of-Order] [TCP segment of a reassembled PDU]
207   0.091017 172.31.36.109 -> 54.230.31.8  TCP 66 42986 > http [ACK] Seq=97 Ack=1004913 Win=763392 Len=0 TSval=24119119 TSecr=829615657
208   0.091020  54.230.31.8 -> 172.31.36.109 TCP 1514 [TCP segment of a reassembled PDU]
209   0.091022 172.31.36.109 -> 54.230.31.8  TCP 66 42986 > http [ACK] Seq=97 Ack=1006361 Win=761984 Len=0 TSval=24119119 TSecr=829615657
210   0.091237  54.230.31.8 -> 172.31.36.109 TCP 5858 [TCP segment of a reassembled PDU]
211   0.091244 172.31.36.109 -> 54.230.31.8  TCP 66 42986 > http [ACK] Seq=97 Ack=1012153 Win=783360 Len=0 TSval=24119119 TSecr=829615657
212   0.091251  54.230.31.8 -> 172.31.36.109 TCP 1514 [TCP segment of a reassembled PDU]
213   0.091253 172.31.36.109 -> 54.230.31.8  TCP 66 42986 > http [ACK] Seq=97 Ack=1013601 Win=781952 Len=0 TSval=24119119 TSecr=829615657
214   0.091276  54.230.31.8 -> 172.31.36.109 TCP 30474 [TCP segment of a reassembled PDU]
215   0.091292 172.31.36.109 -> 54.230.31.8  TCP 66 42986 > http [ACK] Seq=97 Ack=1044009 Win=751616 Len=0 TSval=24119119 TSecr=829615657
216   0.091316  54.230.31.8 -> 172.31.36.109 TCP 1514 [TCP segment of a reassembled PDU]
217   0.091319 172.31.36.109 -> 54.230.31.8  TCP 66 42986 > http [ACK] Seq=97 Ack=1045457 Win=750208 Len=0 TSval=24119119 TSecr=829615657
218   0.091636  54.230.31.8 -> 172.31.36.109 HTTP 3643 HTTP/1.1 200 OK  (application/octet-stream)
219   0.091642 172.31.36.109 -> 54.230.31.8  TCP 66 42986 > http [ACK] Seq=97 Ack=1049034 Win=785792 Len=0 TSval=24119119 TSecr=829615657
220   0.091765 172.31.36.109 -> 54.230.31.8  TCP 66 42986 > http [FIN, ACK] Seq=97 Ack=1049034 Win=788224 Len=0 TSval=24119119 TSecr=829615657
221   0.093673  54.230.31.8 -> 172.31.36.109 TCP 66 http > 42986 [FIN, ACK] Seq=1049034 Ack=98 Win=14592 Len=0 TSval=829615657 TSecr=24119119
222   0.093681 172.31.36.109 -> 54.230.31.8  TCP 66 42986 > http [ACK] Seq=98 Ack=1049035 Win=788224 Len=0 TSval=24119119 TSecr=829615657
