[Measurement for 1mb at 02:32:25 20.32.2014] 
Tshark:

  1   0.000000 172.31.36.109 -> 172.31.0.2   DNS 89 Standard query 0x3446  A d1xzxs93r3iphc.cloudfront.net
  2   0.000022 172.31.36.109 -> 172.31.0.2   DNS 89 Standard query 0x737d  AAAA d1xzxs93r3iphc.cloudfront.net
  3   0.000484   172.31.0.2 -> 172.31.36.109 DNS 170 Standard query response 0x737d 
  4   0.000493   172.31.0.2 -> 172.31.36.109 DNS 217 Standard query response 0x3446  A 54.230.20.174 A 54.230.21.108 A 54.230.22.176 A 54.230.23.30 A 54.230.23.241 A 216.137.41.24 A 216.137.41.134 A 216.137.41.227
  5   0.003872 172.31.36.109 -> 54.230.20.174 TCP 74 32868 > http [SYN] Seq=0 Win=26883 Len=0 MSS=8961 SACK_PERM=1 TSval=28608096 TSecr=0 WS=128
  6   0.093467 54.230.20.174 -> 172.31.36.109 TCP 74 http > 32868 [SYN, ACK] Seq=0 Ack=1 Win=14480 Len=0 MSS=1460 SACK_PERM=1 TSval=898952314 TSecr=28608096 WS=128
  7   0.093482 172.31.36.109 -> 54.230.20.174 TCP 66 32868 > http [ACK] Seq=1 Ack=1 Win=27008 Len=0 TSval=28608118 TSecr=898952314
  8   0.093528 172.31.36.109 -> 54.230.20.174 HTTP 162 GET /1mb HTTP/1.1 
  9   0.183339 54.230.20.174 -> 172.31.36.109 TCP 66 http > 32868 [ACK] Seq=1 Ack=97 Win=14592 Len=0 TSval=898952323 TSecr=28608118
 10   0.206609 54.230.20.174 -> 172.31.36.109 TCP 5488 [TCP segment of a reassembled PDU]
 11   0.206619 172.31.36.109 -> 54.230.20.174 TCP 66 32868 > http [ACK] Seq=97 Ack=5423 Win=37760 Len=0 TSval=28608146 TSecr=898952325
 12   0.206824 54.230.20.174 -> 172.31.36.109 TCP 8754 [TCP segment of a reassembled PDU]
 13   0.206834 172.31.36.109 -> 54.230.20.174 TCP 66 32868 > http [ACK] Seq=97 Ack=14111 Win=55168 Len=0 TSval=28608146 TSecr=898952325
 14   0.296385 54.230.20.174 -> 172.31.36.109 TCP 10202 [TCP segment of a reassembled PDU]
 15   0.296394 172.31.36.109 -> 54.230.20.174 TCP 66 32868 > http [ACK] Seq=97 Ack=24247 Win=75392 Len=0 TSval=28608169 TSecr=898952334
 16   0.296460 54.230.20.174 -> 172.31.36.109 TCP 2962 [TCP segment of a reassembled PDU]
 17   0.296466 172.31.36.109 -> 54.230.20.174 TCP 66 32868 > http [ACK] Seq=97 Ack=27143 Win=81280 Len=0 TSval=28608169 TSecr=898952334
 18   0.386012 54.230.20.174 -> 172.31.36.109 TCP 2962 [TCP segment of a reassembled PDU]
 19   0.386041 172.31.36.109 -> 54.230.20.174 TCP 66 32868 > http [ACK] Seq=97 Ack=30039 Win=87040 Len=0 TSval=28608191 TSecr=898952343
 20   0.386192 54.230.20.174 -> 172.31.36.109 TCP 8754 [TCP segment of a reassembled PDU]
 21   0.386200 172.31.36.109 -> 54.230.20.174 TCP 66 32868 > http [ACK] Seq=97 Ack=38727 Win=103680 Len=0 TSval=28608191 TSecr=898952343
 22   0.386253 54.230.20.174 -> 172.31.36.109 TCP 8754 [TCP segment of a reassembled PDU]
 23   0.386259 172.31.36.109 -> 54.230.20.174 TCP 66 32868 > http [ACK] Seq=97 Ack=47415 Win=103680 Len=0 TSval=28608191 TSecr=898952343
 24   0.475844 54.230.20.174 -> 172.31.36.109 TCP 5858 [TCP segment of a reassembled PDU]
 25   0.475866 172.31.36.109 -> 54.230.20.174 TCP 66 32868 > http [ACK] Seq=97 Ack=53207 Win=108416 Len=0 TSval=28608214 TSecr=898952352
 26   0.475902 54.230.20.174 -> 172.31.36.109 TCP 13098 [TCP segment of a reassembled PDU]
 27   0.475910 172.31.36.109 -> 54.230.20.174 TCP 66 32868 > http [ACK] Seq=97 Ack=66239 Win=96512 Len=0 TSval=28608214 TSecr=898952352
 28   0.565533 54.230.20.174 -> 172.31.36.109 TCP 13098 [TCP segment of a reassembled PDU]
 29   0.565542 172.31.36.109 -> 54.230.20.174 TCP 66 32868 > http [ACK] Seq=97 Ack=79271 Win=96512 Len=0 TSval=28608236 TSecr=898952361
 30   0.565674 54.230.20.174 -> 172.31.36.109 TCP 7306 [TCP segment of a reassembled PDU]
 31   0.565680 172.31.36.109 -> 54.230.20.174 TCP 66 32868 > http [ACK] Seq=97 Ack=86511 Win=123520 Len=0 TSval=28608236 TSecr=898952361
 32   0.565706 54.230.20.174 -> 172.31.36.109 TCP 7306 [TCP segment of a reassembled PDU]
 33   0.565711 172.31.36.109 -> 54.230.20.174 TCP 66 32868 > http [ACK] Seq=97 Ack=93751 Win=137984 Len=0 TSval=28608236 TSecr=898952361
 34   0.655136 54.230.20.174 -> 172.31.36.109 TCP 13098 [TCP segment of a reassembled PDU]
 35   0.655146 172.31.36.109 -> 54.230.20.174 TCP 66 32868 > http [ACK] Seq=97 Ack=106783 Win=164096 Len=0 TSval=28608258 TSecr=898952370
 36   0.655282 54.230.20.174 -> 172.31.36.109 TCP 2962 [TCP segment of a reassembled PDU]
 37   0.655288 172.31.36.109 -> 54.230.20.174 TCP 66 32868 > http [ACK] Seq=97 Ack=109679 Win=169856 Len=0 TSval=28608258 TSecr=898952370
 38   0.655539 54.230.20.174 -> 172.31.36.109 TCP 1514 [TCP segment of a reassembled PDU]
 39   0.655543 172.31.36.109 -> 54.230.20.174 TCP 66 32868 > http [ACK] Seq=97 Ack=111127 Win=172800 Len=0 TSval=28608259 TSecr=898952370
 40   0.655618 54.230.20.174 -> 172.31.36.109 TCP 5858 [TCP segment of a reassembled PDU]
 41   0.655624 172.31.36.109 -> 54.230.20.174 TCP 66 32868 > http [ACK] Seq=97 Ack=116919 Win=184320 Len=0 TSval=28608259 TSecr=898952370
 42   0.744740 54.230.20.174 -> 172.31.36.109 TCP 2962 [TCP segment of a reassembled PDU]
 43   0.744762 172.31.36.109 -> 54.230.20.174 TCP 66 32868 > http [ACK] Seq=97 Ack=119815 Win=190208 Len=0 TSval=28608281 TSecr=898952379
 44   0.744769 54.230.20.174 -> 172.31.36.109 TCP 1514 [TCP segment of a reassembled PDU]
 45   0.744771 172.31.36.109 -> 54.230.20.174 TCP 66 32868 > http [ACK] Seq=97 Ack=121263 Win=193024 Len=0 TSval=28608281 TSecr=898952379
 46   0.744888 54.230.20.174 -> 172.31.36.109 TCP 13098 [TCP segment of a reassembled PDU]
 47   0.744897 172.31.36.109 -> 54.230.20.174 TCP 66 32868 > http [ACK] Seq=97 Ack=134295 Win=219136 Len=0 TSval=28608281 TSecr=898952379
 48   0.745122 54.230.20.174 -> 172.31.36.109 TCP 1514 [TCP segment of a reassembled PDU]
 49   0.745126 172.31.36.109 -> 54.230.20.174 TCP 66 32868 > http [ACK] Seq=97 Ack=135743 Win=221952 Len=0 TSval=28608281 TSecr=898952379
 50   0.745408 54.230.20.174 -> 172.31.36.109 TCP 4410 [TCP segment of a reassembled PDU]
 51   0.745421 172.31.36.109 -> 54.230.20.174 TCP 66 32868 > http [ACK] Seq=97 Ack=140087 Win=230656 Len=0 TSval=28608281 TSecr=898952379
 52   0.745510 54.230.20.174 -> 172.31.36.109 TCP 7306 [TCP segment of a reassembled PDU]
 53   0.745525 172.31.36.109 -> 54.230.20.174 TCP 66 32868 > http [ACK] Seq=97 Ack=147327 Win=245120 Len=0 TSval=28608281 TSecr=898952379
 54   0.834237 54.230.20.174 -> 172.31.36.109 TCP 1514 [TCP segment of a reassembled PDU]
 55   0.834244 172.31.36.109 -> 54.230.20.174 TCP 66 32868 > http [ACK] Seq=97 Ack=148775 Win=248064 Len=0 TSval=28608303 TSecr=898952388
 56   0.834297 54.230.20.174 -> 172.31.36.109 TCP 2962 [TCP segment of a reassembled PDU]
 57   0.834302 172.31.36.109 -> 54.230.20.174 TCP 66 32868 > http [ACK] Seq=97 Ack=151671 Win=253824 Len=0 TSval=28608303 TSecr=898952388
 58   0.834471 54.230.20.174 -> 172.31.36.109 TCP 10202 [TCP segment of a reassembled PDU]
 59   0.834478 172.31.36.109 -> 54.230.20.174 TCP 66 32868 > http [ACK] Seq=97 Ack=161807 Win=274176 Len=0 TSval=28608303 TSecr=898952388
 60   0.834656 54.230.20.174 -> 172.31.36.109 TCP 5858 [TCP segment of a reassembled PDU]
 61   0.834662 172.31.36.109 -> 54.230.20.174 TCP 66 32868 > http [ACK] Seq=97 Ack=167599 Win=285696 Len=0 TSval=28608303 TSecr=898952388
 62   0.834759 54.230.20.174 -> 172.31.36.109 TCP 4410 [TCP segment of a reassembled PDU]
 63   0.834790 172.31.36.109 -> 54.230.20.174 TCP 66 32868 > http [ACK] Seq=97 Ack=171943 Win=294400 Len=0 TSval=28608303 TSecr=898952388
 64   0.835057 54.230.20.174 -> 172.31.36.109 TCP 4410 [TCP segment of a reassembled PDU]
 65   0.835091 172.31.36.109 -> 54.230.20.174 TCP 66 32868 > http [ACK] Seq=97 Ack=176287 Win=303104 Len=0 TSval=28608303 TSecr=898952388
 66   0.835446 54.230.20.174 -> 172.31.36.109 TCP 4410 [TCP segment of a reassembled PDU]
 67   0.835451 172.31.36.109 -> 54.230.20.174 TCP 66 32868 > http [ACK] Seq=97 Ack=180631 Win=311808 Len=0 TSval=28608303 TSecr=898952388
 68   0.835591 54.230.20.174 -> 172.31.36.109 TCP 8754 [TCP segment of a reassembled PDU]
 69   0.835598 172.31.36.109 -> 54.230.20.174 TCP 66 32868 > http [ACK] Seq=97 Ack=189319 Win=329216 Len=0 TSval=28608304 TSecr=898952388
 70   0.923809 54.230.20.174 -> 172.31.36.109 TCP 7306 [TCP segment of a reassembled PDU]
 71   0.923817 172.31.36.109 -> 54.230.20.174 TCP 66 32868 > http [ACK] Seq=97 Ack=196559 Win=343680 Len=0 TSval=28608326 TSecr=898952397
 72   0.924543 54.230.20.174 -> 172.31.36.109 TCP 5858 [TCP segment of a reassembled PDU]
 73   0.924550 172.31.36.109 -> 54.230.20.174 TCP 66 32868 > http [ACK] Seq=97 Ack=202351 Win=355200 Len=0 TSval=28608326 TSecr=898952397
 74   0.924604 54.230.20.174 -> 172.31.36.109 TCP 14546 [TCP segment of a reassembled PDU]
 75   0.924626 172.31.36.109 -> 54.230.20.174 TCP 66 32868 > http [ACK] Seq=97 Ack=216831 Win=384128 Len=0 TSval=28608326 TSecr=898952397
 76   0.925144 54.230.20.174 -> 172.31.36.109 TCP 18890 [TCP segment of a reassembled PDU]
 77   0.925154 172.31.36.109 -> 54.230.20.174 TCP 66 32868 > http [ACK] Seq=97 Ack=235655 Win=421888 Len=0 TSval=28608326 TSecr=898952397
 78   0.925170 54.230.20.174 -> 172.31.36.109 TCP 1514 [TCP segment of a reassembled PDU]
 79   0.925172 172.31.36.109 -> 54.230.20.174 TCP 66 32868 > http [ACK] Seq=97 Ack=237103 Win=424704 Len=0 TSval=28608326 TSecr=898952397
 80   1.013454 54.230.20.174 -> 172.31.36.109 TCP 18890 [TCP segment of a reassembled PDU]
 81   1.013466 172.31.36.109 -> 54.230.20.174 TCP 66 32868 > http [ACK] Seq=97 Ack=255927 Win=455552 Len=0 TSval=28608348 TSecr=898952406
 82   1.014365 54.230.20.174 -> 172.31.36.109 TCP 1514 [TCP segment of a reassembled PDU]
 83   1.014371 172.31.36.109 -> 54.230.20.174 TCP 66 32868 > http [ACK] Seq=97 Ack=257375 Win=465280 Len=0 TSval=28608348 TSecr=898952406
 84   1.014455 54.230.20.174 -> 172.31.36.109 TCP 10202 [TCP segment of a reassembled PDU]
 85   1.014463 172.31.36.109 -> 54.230.20.174 TCP 66 32868 > http [ACK] Seq=97 Ack=267511 Win=469888 Len=0 TSval=28608348 TSecr=898952406
 86   1.014889 54.230.20.174 -> 172.31.36.109 TCP 2962 [TCP segment of a reassembled PDU]
 87   1.014915 172.31.36.109 -> 54.230.20.174 TCP 66 32868 > http [ACK] Seq=97 Ack=270407 Win=481792 Len=0 TSval=28608348 TSecr=898952406
 88   1.014996 54.230.20.174 -> 172.31.36.109 TCP 8754 [TCP segment of a reassembled PDU]
 89   1.015010 172.31.36.109 -> 54.230.20.174 TCP 66 32868 > http [ACK] Seq=97 Ack=279095 Win=473216 Len=0 TSval=28608348 TSecr=898952406
 90   1.015170 54.230.20.174 -> 172.31.36.109 TCP 5858 [TCP segment of a reassembled PDU]
 91   1.015183 172.31.36.109 -> 54.230.20.174 TCP 66 32868 > http [ACK] Seq=97 Ack=284887 Win=477056 Len=0 TSval=28608348 TSecr=898952406
 92   1.015274 54.230.20.174 -> 172.31.36.109 TCP 14546 [TCP segment of a reassembled PDU]
 93   1.015283 172.31.36.109 -> 54.230.20.174 TCP 66 32868 > http [ACK] Seq=97 Ack=299367 Win=462720 Len=0 TSval=28608348 TSecr=898952406
 94   1.103198 54.230.20.174 -> 172.31.36.109 TCP 18890 [TCP segment of a reassembled PDU]
