[Measurement for 1mb at 13:33:05 20.33.2014] 
Tshark:

  1   0.000000 172.31.36.109 -> 172.31.0.2   DNS 89 Standard query 0x82bc  A d1xzxs93r3iphc.cloudfront.net
  2   0.000037 172.31.36.109 -> 172.31.0.2   DNS 89 Standard query 0xfa4c  AAAA d1xzxs93r3iphc.cloudfront.net
  3   0.000437   172.31.0.2 -> 172.31.36.109 DNS 170 Standard query response 0xfa4c 
  4   0.000449   172.31.0.2 -> 172.31.36.109 DNS 217 Standard query response 0x82bc  A 54.230.23.48 A 216.137.41.10 A 216.137.41.20 A 216.137.41.254 A 54.230.20.155 A 54.230.20.159 A 54.230.20.214 A 54.230.21.79
  5   0.003887 172.31.36.109 -> 54.230.23.48 TCP 74 57871 > http [SYN] Seq=0 Win=26883 Len=0 MSS=8961 SACK_PERM=1 TSval=38517912 TSecr=0 WS=128
  6   0.093542 54.230.23.48 -> 172.31.36.109 TCP 74 http > 57871 [SYN, ACK] Seq=0 Ack=1 Win=28960 Len=0 MSS=1460 SACK_PERM=1 TSval=298647820 TSecr=38517912 WS=128
  7   0.093582 172.31.36.109 -> 54.230.23.48 TCP 66 57871 > http [ACK] Seq=1 Ack=1 Win=27008 Len=0 TSval=38517934 TSecr=298647820
  8   0.093703 172.31.36.109 -> 54.230.23.48 HTTP 162 GET /1mb HTTP/1.1 
  9   0.183196 54.230.23.48 -> 172.31.36.109 TCP 66 http > 57871 [ACK] Seq=1 Ack=97 Win=29056 Len=0 TSval=298647829 TSecr=38517934
 10   0.186989 54.230.23.48 -> 172.31.36.109 TCP 4410 [TCP segment of a reassembled PDU]
 11   0.187005 172.31.36.109 -> 54.230.23.48 TCP 66 57871 > http [ACK] Seq=97 Ack=4345 Win=35584 Len=0 TSval=38517958 TSecr=298647830
 12   0.187043 54.230.23.48 -> 172.31.36.109 TCP 9832 [TCP segment of a reassembled PDU]
 13   0.187052 172.31.36.109 -> 54.230.23.48 TCP 66 57871 > http [ACK] Seq=97 Ack=14111 Win=55168 Len=0 TSval=38517958 TSecr=298647830
 14   0.276511 54.230.23.48 -> 172.31.36.109 TCP 8754 [TCP segment of a reassembled PDU]
 15   0.276538 172.31.36.109 -> 54.230.23.48 TCP 66 57871 > http [ACK] Seq=97 Ack=22799 Win=72576 Len=0 TSval=38517980 TSecr=298647839
 16   0.276669 54.230.23.48 -> 172.31.36.109 TCP 4410 [TCP segment of a reassembled PDU]
 17   0.276675 172.31.36.109 -> 54.230.23.48 TCP 66 57871 > http [ACK] Seq=97 Ack=27143 Win=81280 Len=0 TSval=38517980 TSecr=298647839
 18   0.276774 54.230.23.48 -> 172.31.36.109 TCP 14546 [TCP segment of a reassembled PDU]
 19   0.276783 172.31.36.109 -> 54.230.23.48 TCP 66 57871 > http [ACK] Seq=97 Ack=41623 Win=94080 Len=0 TSval=38517980 TSecr=298647839
 20   0.276911 54.230.23.48 -> 172.31.36.109 TCP 1514 [TCP segment of a reassembled PDU]
 21   0.276921 172.31.36.109 -> 54.230.23.48 TCP 66 57871 > http [ACK] Seq=97 Ack=43071 Win=112000 Len=0 TSval=38517980 TSecr=298647839
 22   0.366094 54.230.23.48 -> 172.31.36.109 TCP 5858 [TCP segment of a reassembled PDU]
 23   0.366121 172.31.36.109 -> 54.230.23.48 TCP 66 57871 > http [ACK] Seq=97 Ack=48863 Win=123520 Len=0 TSval=38518002 TSecr=298647848
 24   0.366137 54.230.23.48 -> 172.31.36.109 TCP 4410 [TCP segment of a reassembled PDU]
 25   0.366143 172.31.36.109 -> 54.230.23.48 TCP 66 57871 > http [ACK] Seq=97 Ack=53207 Win=132224 Len=0 TSval=38518002 TSecr=298647848
 26   0.366229 54.230.23.48 -> 172.31.36.109 TCP 2962 [TCP segment of a reassembled PDU]
 27   0.366235 172.31.36.109 -> 54.230.23.48 TCP 66 57871 > http [ACK] Seq=97 Ack=56103 Win=137984 Len=0 TSval=38518002 TSecr=298647848
 28   0.366299 54.230.23.48 -> 172.31.36.109 TCP 1514 [TCP segment of a reassembled PDU]
 29   0.366302 172.31.36.109 -> 54.230.23.48 TCP 66 57871 > http [ACK] Seq=97 Ack=57551 Win=140928 Len=0 TSval=38518002 TSecr=298647848
 30   0.366342 54.230.23.48 -> 172.31.36.109 TCP 5858 [TCP segment of a reassembled PDU]
 31   0.366347 172.31.36.109 -> 54.230.23.48 TCP 66 57871 > http [ACK] Seq=97 Ack=63343 Win=152448 Len=0 TSval=38518002 TSecr=298647848
 32   0.366446 54.230.23.48 -> 172.31.36.109 TCP 14546 [TCP segment of a reassembled PDU]
 33   0.366456 172.31.36.109 -> 54.230.23.48 TCP 66 57871 > http [ACK] Seq=97 Ack=77823 Win=181504 Len=0 TSval=38518002 TSecr=298647848
 34   0.366463 54.230.23.48 -> 172.31.36.109 TCP 2962 [TCP segment of a reassembled PDU]
 35   0.366468 172.31.36.109 -> 54.230.23.48 TCP 66 57871 > http [ACK] Seq=97 Ack=80719 Win=187264 Len=0 TSval=38518002 TSecr=298647848
 36   0.366477 54.230.23.48 -> 172.31.36.109 TCP 2962 [TCP segment of a reassembled PDU]
 37   0.366480 172.31.36.109 -> 54.230.23.48 TCP 66 57871 > http [ACK] Seq=97 Ack=83615 Win=193024 Len=0 TSval=38518002 TSecr=298647848
 38   0.366577 54.230.23.48 -> 172.31.36.109 TCP 14546 [TCP segment of a reassembled PDU]
 39   0.366586 172.31.36.109 -> 54.230.23.48 TCP 66 57871 > http [ACK] Seq=97 Ack=98095 Win=221952 Len=0 TSval=38518002 TSecr=298647848
 40   0.366609 54.230.23.48 -> 172.31.36.109 TCP 2962 [TCP segment of a reassembled PDU]
 41   0.366613 172.31.36.109 -> 54.230.23.48 TCP 66 57871 > http [ACK] Seq=97 Ack=100991 Win=227840 Len=0 TSval=38518003 TSecr=298647848
 42   0.455779 54.230.23.48 -> 172.31.36.109 TCP 2962 [TCP segment of a reassembled PDU]
 43   0.455802 172.31.36.109 -> 54.230.23.48 TCP 66 57871 > http [ACK] Seq=97 Ack=103887 Win=233600 Len=0 TSval=38518025 TSecr=298647857
 44   0.455814 54.230.23.48 -> 172.31.36.109 TCP 5858 [TCP segment of a reassembled PDU]
 45   0.455819 172.31.36.109 -> 54.230.23.48 TCP 66 57871 > http [ACK] Seq=97 Ack=109679 Win=245120 Len=0 TSval=38518025 TSecr=298647857
 46   0.455843 54.230.23.48 -> 172.31.36.109 TCP 5858 [TCP segment of a reassembled PDU]
 47   0.455848 172.31.36.109 -> 54.230.23.48 TCP 66 57871 > http [ACK] Seq=97 Ack=115471 Win=256768 Len=0 TSval=38518025 TSecr=298647857
 48   0.456055 54.230.23.48 -> 172.31.36.109 TCP 8754 [TCP segment of a reassembled PDU]
 49   0.456064 172.31.36.109 -> 54.230.23.48 TCP 66 57871 > http [ACK] Seq=97 Ack=124159 Win=274176 Len=0 TSval=38518025 TSecr=298647857
 50   0.456126 54.230.23.48 -> 172.31.36.109 TCP 20338 [TCP segment of a reassembled PDU]
 51   0.456139 172.31.36.109 -> 54.230.23.48 TCP 66 57871 > http [ACK] Seq=97 Ack=144431 Win=314624 Len=0 TSval=38518025 TSecr=298647857
 52   0.456157 54.230.23.48 -> 172.31.36.109 TCP 2962 [TCP segment of a reassembled PDU]
 53   0.456160 172.31.36.109 -> 54.230.23.48 TCP 66 57871 > http [ACK] Seq=97 Ack=147327 Win=320512 Len=0 TSval=38518025 TSecr=298647857
 54   0.456294 54.230.23.48 -> 172.31.36.109 TCP 5858 [TCP segment of a reassembled PDU]
 55   0.456314 172.31.36.109 -> 54.230.23.48 TCP 66 57871 > http [ACK] Seq=97 Ack=153119 Win=332032 Len=0 TSval=38518025 TSecr=298647857
 56   0.456368 54.230.23.48 -> 172.31.36.109 TCP 14546 [TCP segment of a reassembled PDU]
 57   0.456378 172.31.36.109 -> 54.230.23.48 TCP 66 57871 > http [ACK] Seq=97 Ack=167599 Win=360960 Len=0 TSval=38518025 TSecr=298647857
 58   0.456407 54.230.23.48 -> 172.31.36.109 TCP 4410 [TCP segment of a reassembled PDU]
 59   0.456413 172.31.36.109 -> 54.230.23.48 TCP 66 57871 > http [ACK] Seq=97 Ack=171943 Win=369664 Len=0 TSval=38518025 TSecr=298647857
 60   0.456440 54.230.23.48 -> 172.31.36.109 TCP 4410 [TCP segment of a reassembled PDU]
 61   0.456445 172.31.36.109 -> 54.230.23.48 TCP 66 57871 > http [ACK] Seq=97 Ack=176287 Win=378368 Len=0 TSval=38518025 TSecr=298647857
 62   0.456550 54.230.23.48 -> 172.31.36.109 TCP 5858 [TCP segment of a reassembled PDU]
 63   0.456556 172.31.36.109 -> 54.230.23.48 TCP 66 57871 > http [ACK] Seq=97 Ack=182079 Win=390016 Len=0 TSval=38518025 TSecr=298647857
 64   0.456599 54.230.23.48 -> 172.31.36.109 TCP 11650 [TCP segment of a reassembled PDU]
 65   0.456607 172.31.36.109 -> 54.230.23.48 TCP 66 57871 > http [ACK] Seq=97 Ack=193663 Win=413184 Len=0 TSval=38518025 TSecr=298647857
 66   0.456829 54.230.23.48 -> 172.31.36.109 TCP 14546 [TCP segment of a reassembled PDU]
 67   0.456839 172.31.36.109 -> 54.230.23.48 TCP 66 57871 > http [ACK] Seq=97 Ack=208143 Win=442112 Len=0 TSval=38518025 TSecr=298647857
 68   0.456849 54.230.23.48 -> 172.31.36.109 TCP 2962 [TCP segment of a reassembled PDU]
 69   0.456851 172.31.36.109 -> 54.230.23.48 TCP 66 57871 > http [ACK] Seq=97 Ack=211039 Win=447872 Len=0 TSval=38518025 TSecr=298647857
 70   0.457003 54.230.23.48 -> 172.31.36.109 TCP 5858 [TCP segment of a reassembled PDU]
 71   0.457014 172.31.36.109 -> 54.230.23.48 TCP 66 57871 > http [ACK] Seq=97 Ack=216831 Win=459520 Len=0 TSval=38518025 TSecr=298647857
 72   0.545421 54.230.23.48 -> 172.31.36.109 TCP 8754 [TCP segment of a reassembled PDU]
 73   0.545446 172.31.36.109 -> 54.230.23.48 TCP 66 57871 > http [ACK] Seq=97 Ack=225519 Win=476800 Len=0 TSval=38518047 TSecr=298647866
 74   0.545462 54.230.23.48 -> 172.31.36.109 TCP 8754 [TCP segment of a reassembled PDU]
 75   0.545469 172.31.36.109 -> 54.230.23.48 TCP 66 57871 > http [ACK] Seq=97 Ack=234207 Win=484992 Len=0 TSval=38518047 TSecr=298647866
 76   0.545475 54.230.23.48 -> 172.31.36.109 TCP 1514 [TCP segment of a reassembled PDU]
 77   0.545478 172.31.36.109 -> 54.230.23.48 TCP 66 57871 > http [ACK] Seq=97 Ack=235655 Win=483584 Len=0 TSval=38518047 TSecr=298647866
 78   0.545486 54.230.23.48 -> 172.31.36.109 TCP 4410 [TCP segment of a reassembled PDU]
 79   0.545490 172.31.36.109 -> 54.230.23.48 TCP 66 57871 > http [ACK] Seq=97 Ack=239999 Win=479360 Len=0 TSval=38518047 TSecr=298647866
 80   0.545648 54.230.23.48 -> 172.31.36.109 TCP 14546 [TCP segment of a reassembled PDU]
 81   0.545658 172.31.36.109 -> 54.230.23.48 TCP 66 57871 > http [ACK] Seq=97 Ack=254479 Win=464896 Len=0 TSval=38518047 TSecr=298647866
 82   0.545736 54.230.23.48 -> 172.31.36.109 TCP 2962 [TCP segment of a reassembled PDU]
 83   0.545741 172.31.36.109 -> 54.230.23.48 TCP 66 57871 > http [ACK] Seq=97 Ack=257375 Win=462080 Len=0 TSval=38518047 TSecr=298647866
 84   0.545749 54.230.23.48 -> 172.31.36.109 TCP 5858 [TCP segment of a reassembled PDU]
 85   0.545753 172.31.36.109 -> 54.230.23.48 TCP 66 57871 > http [ACK] Seq=97 Ack=263167 Win=456320 Len=0 TSval=38518047 TSecr=298647866
 86   0.545794 54.230.23.48 -> 172.31.36.109 TCP 14546 [TCP segment of a reassembled PDU]
 87   0.545803 172.31.36.109 -> 54.230.23.48 TCP 66 57871 > http [ACK] Seq=97 Ack=277647 Win=441856 Len=0 TSval=38518047 TSecr=298647866
 88   0.545923 54.230.23.48 -> 172.31.36.109 TCP 10202 [TCP segment of a reassembled PDU]
 89   0.545932 172.31.36.109 -> 54.230.23.48 TCP 66 57871 > http [ACK] Seq=97 Ack=287783 Win=431744 Len=0 TSval=38518047 TSecr=298647866
 90   0.546039 54.230.23.48 -> 172.31.36.109 TCP 14546 [TCP segment of a reassembled PDU]
 91   0.546059 172.31.36.109 -> 54.230.23.48 TCP 66 57871 > http [ACK] Seq=97 Ack=302263 Win=523136 Len=0 TSval=38518047 TSecr=298647866
 92   0.546226 54.230.23.48 -> 172.31.36.109 TCP 21786 [TCP segment of a reassembled PDU]
 93   0.546240 172.31.36.109 -> 54.230.23.48 TCP 66 57871 > http [ACK] Seq=97 Ack=323983 Win=566656 Len=0 TSval=38518047 TSecr=298647866
 94   0.546370 54.230.23.48 -> 172.31.36.109 TCP 4410 [TCP segment of a reassembled PDU]
 95   0.546387 172.31.36.109 -> 54.230.23.48 TCP 66 57871 > http [ACK] Seq=97 Ack=328327 Win=575360 Len=0 TSval=38518047 TSecr=298647866
 96   0.546569 54.230.23.48 -> 172.31.36.109 TCP 26130 [TCP segment of a reassembled PDU]
 97   0.546583 172.31.36.109 -> 54.230.23.48 TCP 66 57871 > http [ACK] Seq=97 Ack=354391 Win=627456 Len=0 TSval=38518047 TSecr=298647866
 98   0.546595 54.230.23.48 -> 172.31.36.109 TCP 8754 [TCP segment of a reassembled PDU]
 99   0.546601 172.31.36.109 -> 54.230.23.48 TCP 66 57871 > http [ACK] Seq=97 Ack=363079 Win=644864 Len=0 TSval=38518047 TSecr=298647866
100   0.546603 54.230.23.48 -> 172.31.36.109 TCP 1514 [TCP segment of a reassembled PDU]
101   0.546605 172.31.36.109 -> 54.230.23.48 TCP 66 57871 > http [ACK] Seq=97 Ack=364527 Win=647680 Len=0 TSval=38518047 TSecr=298647866
102   0.546710 54.230.23.48 -> 172.31.36.109 TCP 17442 [TCP segment of a reassembled PDU]
103   0.546720 172.31.36.109 -> 54.230.23.48 TCP 66 57871 > http [ACK] Seq=97 Ack=381903 Win=682496 Len=0 TSval=38518048 TSecr=298647866
104   0.546747 54.230.23.48 -> 172.31.36.109 TCP 6610 [TCP segment of a reassembled PDU]
105   0.546753 172.31.36.109 -> 54.230.23.48 TCP 66 57871 > http [ACK] Seq=97 Ack=388447 Win=695552 Len=0 TSval=38518048 TSecr=298647866
106   0.546798 54.230.23.48 -> 172.31.36.109 TCP 10202 [TCP segment of a reassembled PDU]
107   0.546914 172.31.36.109 -> 54.230.23.48 TCP 66 57871 > http [ACK] Seq=97 Ack=398583 Win=690560 Len=0 TSval=38518048 TSecr=298647866
108   0.547000 54.230.23.48 -> 172.31.36.109 TCP 2962 [TCP segment of a reassembled PDU]
109   0.547006 172.31.36.109 -> 54.230.23.48 TCP 66 57871 > http [ACK] Seq=97 Ack=401479 Win=701312 Len=0 TSval=38518048 TSecr=298647866
110   0.547266 54.230.23.48 -> 172.31.36.109 TCP 42058 [TCP segment of a reassembled PDU]
111   0.547299 54.230.23.48 -> 172.31.36.109 TCP 4410 [TCP segment of a reassembled PDU]
112   0.547310 172.31.36.109 -> 54.230.23.48 TCP 66 57871 > http [ACK] Seq=97 Ack=447815 Win=671488 Len=0 TSval=38518048 TSecr=298647866
113   0.635154 54.230.23.48 -> 172.31.36.109 TCP 13098 [TCP segment of a reassembled PDU]
114   0.635187 172.31.36.109 -> 54.230.23.48 TCP 66 57871 > http [ACK] Seq=97 Ack=460847 Win=726528 Len=0 TSval=38518070 TSecr=298647874
115   0.635242 54.230.23.48 -> 172.31.36.109 TCP 2962 [TCP segment of a reassembled PDU]
116   0.635263 172.31.36.109 -> 54.230.23.48 TCP 66 57871 > http [ACK] Seq=97 Ack=463743 Win=727424 Len=0 TSval=38518070 TSecr=298647874
117   0.635419 54.230.23.48 -> 172.31.36.109 TCP 23234 [TCP segment of a reassembled PDU]
118   0.635434 172.31.36.109 -> 54.230.23.48 TCP 66 57871 > http [ACK] Seq=97 Ack=486911 Win=773760 Len=0 TSval=38518070 TSecr=298647874
119   0.635499 54.230.23.48 -> 172.31.36.109 TCP 4410 [TCP segment of a reassembled PDU]
120   0.635504 172.31.36.109 -> 54.230.23.48 TCP 66 57871 > http [ACK] Seq=97 Ack=491255 Win=782464 Len=0 TSval=38518070 TSecr=298647874
121   0.635608 54.230.23.48 -> 172.31.36.109 TCP 7306 [TCP segment of a reassembled PDU]
122   0.635616 172.31.36.109 -> 54.230.23.48 TCP 66 57871 > http [ACK] Seq=97 Ack=498495 Win=796928 Len=0 TSval=38518070 TSecr=298647874
123   0.635712 54.230.23.48 -> 172.31.36.109 TCP 1514 [TCP segment of a reassembled PDU]
124   0.635718 172.31.36.109 -> 54.230.23.48 TCP 66 57871 > http [ACK] Seq=97 Ack=499943 Win=799872 Len=0 TSval=38518070 TSecr=298647874
125   0.635854 54.230.23.48 -> 172.31.36.109 TCP 5858 [TCP segment of a reassembled PDU]
126   0.635860 172.31.36.109 -> 54.230.23.48 TCP 66 57871 > http [ACK] Seq=97 Ack=505735 Win=811392 Len=0 TSval=38518070 TSecr=298647874
127   0.635868 54.230.23.48 -> 172.31.36.109 TCP 2962 [TCP segment of a reassembled PDU]
128   0.635871 172.31.36.109 -> 54.230.23.48 TCP 66 57871 > http [ACK] Seq=97 Ack=508631 Win=817152 Len=0 TSval=38518070 TSecr=298647875
129   0.636241 54.230.23.48 -> 172.31.36.109 TCP 8754 [TCP segment of a reassembled PDU]
130   0.636250 172.31.36.109 -> 54.230.23.48 TCP 66 57871 > http [ACK] Seq=97 Ack=517319 Win=834560 Len=0 TSval=38518070 TSecr=298647875
131   0.636415 54.230.23.48 -> 172.31.36.109 TCP 26130 [TCP segment of a reassembled PDU]
132   0.636430 172.31.36.109 -> 54.230.23.48 TCP 66 57871 > http [ACK] Seq=97 Ack=543383 Win=886656 Len=0 TSval=38518070 TSecr=298647875
133   0.636451 54.230.23.48 -> 172.31.36.109 TCP 15994 [TCP segment of a reassembled PDU]
134   0.636460 172.31.36.109 -> 54.230.23.48 TCP 66 57871 > http [ACK] Seq=97 Ack=559311 Win=918528 Len=0 TSval=38518070 TSecr=298647875
135   0.636743 54.230.23.48 -> 172.31.36.109 TCP 11650 [TCP segment of a reassembled PDU]
136   0.636758 172.31.36.109 -> 54.230.23.48 TCP 66 57871 > http [ACK] Seq=97 Ack=570895 Win=941696 Len=0 TSval=38518070 TSecr=298647875
137   0.636939 54.230.23.48 -> 172.31.36.109 TCP 26130 [TCP segment of a reassembled PDU]
138   0.636953 172.31.36.109 -> 54.230.23.48 TCP 66 57871 > http [ACK] Seq=97 Ack=596959 Win=993792 Len=0 TSval=38518070 TSecr=298647875
139   0.636975 54.230.23.48 -> 172.31.36.109 TCP 18890 [TCP segment of a reassembled PDU]
140   0.636984 172.31.36.109 -> 54.230.23.48 TCP 66 57871 > http [ACK] Seq=97 Ack=615783 Win=1031552 Len=0 TSval=38518070 TSecr=298647875
141   0.637307 54.230.23.48 -> 172.31.36.109 TCP 23234 [TCP segment of a reassembled PDU]
142   0.637321 172.31.36.109 -> 54.230.23.48 TCP 66 57871 > http [ACK] Seq=97 Ack=638951 Win=1077888 Len=0 TSval=38518070 TSecr=298647875
143   0.637383 54.230.23.48 -> 172.31.36.109 TCP 11650 [TCP segment of a reassembled PDU]
144   0.637393 172.31.36.109 -> 54.230.23.48 TCP 66 57871 > http [ACK] Seq=97 Ack=650535 Win=1101056 Len=0 TSval=38518070 TSecr=298647875
145   0.637439 54.230.23.48 -> 172.31.36.109 TCP 20338 [TCP segment of a reassembled PDU]
146   0.637450 172.31.36.109 -> 54.230.23.48 TCP 66 57871 > http [ACK] Seq=97 Ack=670807 Win=1141504 Len=0 TSval=38518070 TSecr=298647875
147   0.637478 54.230.23.48 -> 172.31.36.109 TCP 8754 [TCP segment of a reassembled PDU]
148   0.637484 172.31.36.109 -> 54.230.23.48 TCP 66 57871 > http [ACK] Seq=97 Ack=679495 Win=1158912 Len=0 TSval=38518070 TSecr=298647875
149   0.637615 54.230.23.48 -> 172.31.36.109 TCP 13098 [TCP segment of a reassembled PDU]
150   0.637625 172.31.36.109 -> 54.230.23.48 TCP 66 57871 > http [ACK] Seq=97 Ack=692527 Win=1185024 Len=0 TSval=38518070 TSecr=298647875
151   0.637852 54.230.23.48 -> 172.31.36.109 TCP 11650 [TCP segment of a reassembled PDU]
152   0.637874 172.31.36.109 -> 54.230.23.48 TCP 66 57871 > http [ACK] Seq=97 Ack=704111 Win=1208192 Len=0 TSval=38518070 TSecr=298647875
153   0.638034 54.230.23.48 -> 172.31.36.109 TCP 26130 [TCP segment of a reassembled PDU]
154   0.638053 54.230.23.48 -> 172.31.36.109 TCP 7306 [TCP segment of a reassembled PDU]
155   0.638086 54.230.23.48 -> 172.31.36.109 TCP 2962 [TCP segment of a reassembled PDU]
156   0.638144 172.31.36.109 -> 54.230.23.48 TCP 66 57871 > http [ACK] Seq=97 Ack=740311 Win=1174912 Len=0 TSval=38518070 TSecr=298647875
157   0.638446 54.230.23.48 -> 172.31.36.109 TCP 23234 [TCP segment of a reassembled PDU]
158   0.638459 172.31.36.109 -> 54.230.23.48 TCP 66 57871 > http [ACK] Seq=97 Ack=763479 Win=1196416 Len=0 TSval=38518070 TSecr=298647875
159   0.724746 54.230.23.48 -> 172.31.36.109 TCP 7306 [TCP segment of a reassembled PDU]
160   0.724777 172.31.36.109 -> 54.230.23.48 TCP 66 57871 > http [ACK] Seq=97 Ack=770719 Win=1222528 Len=0 TSval=38518092 TSecr=298647883
161   0.724828 54.230.23.48 -> 172.31.36.109 TCP 2962 [TCP segment of a reassembled PDU]
162   0.724848 172.31.36.109 -> 54.230.23.48 TCP 66 57871 > http [ACK] Seq=97 Ack=773615 Win=1222656 Len=0 TSval=38518092 TSecr=298647883
163   0.724936 54.230.23.48 -> 172.31.36.109 TCP 8754 [TCP segment of a reassembled PDU]
164   0.724965 172.31.36.109 -> 54.230.23.48 TCP 66 57871 > http [ACK] Seq=97 Ack=782303 Win=1222656 Len=0 TSval=38518092 TSecr=298647883
165   0.725139 54.230.23.48 -> 172.31.36.109 TCP 24682 [TCP segment of a reassembled PDU]
166   0.725178 54.230.23.48 -> 172.31.36.109 TCP 10202 [TCP segment of a reassembled PDU]
167   0.725198 172.31.36.109 -> 54.230.23.48 TCP 66 57871 > http [ACK] Seq=97 Ack=806919 Win=1198080 Len=0 TSval=38518092 TSecr=298647883
168   0.725216 172.31.36.109 -> 54.230.23.48 TCP 66 57871 > http [ACK] Seq=97 Ack=817055 Win=1217792 Len=0 TSval=38518092 TSecr=298647883
169   0.725352 54.230.23.48 -> 172.31.36.109 TCP 1514 [TCP segment of a reassembled PDU]
170   0.725357 172.31.36.109 -> 54.230.23.48 TCP 66 57871 > http [ACK] Seq=97 Ack=818503 Win=1225472 Len=0 TSval=38518092 TSecr=298647883
171   0.725541 54.230.23.48 -> 172.31.36.109 TCP 26130 [TCP segment of a reassembled PDU]
172   0.725563 54.230.23.48 -> 172.31.36.109 TCP 8754 [TCP segment of a reassembled PDU]
173   0.725581 172.31.36.109 -> 54.230.23.48 TCP 66 57871 > http [ACK] Seq=97 Ack=853255 Win=1190784 Len=0 TSval=38518092 TSecr=298647883
174   0.725606 54.230.23.48 -> 172.31.36.109 TCP 11650 [TCP segment of a reassembled PDU]
175   0.725623 172.31.36.109 -> 54.230.23.48 TCP 66 57871 > http [ACK] Seq=97 Ack=864839 Win=1201152 Len=0 TSval=38518092 TSecr=298647883
176   0.725940 54.230.23.48 -> 172.31.36.109 TCP 13098 [TCP segment of a reassembled PDU]
177   0.725951 172.31.36.109 -> 54.230.23.48 TCP 66 57871 > http [ACK] Seq=97 Ack=877871 Win=1213056 Len=0 TSval=38518092 TSecr=298647884
178   0.726068 54.230.23.48 -> 172.31.36.109 TCP 14546 [TCP segment of a reassembled PDU]
179   0.726088 172.31.36.109 -> 54.230.23.48 TCP 66 57871 > http [ACK] Seq=97 Ack=892351 Win=1225472 Len=0 TSval=38518092 TSecr=298647884
180   0.726159 54.230.23.48 -> 172.31.36.109 TCP 5858 [TCP segment of a reassembled PDU]
181   0.726177 172.31.36.109 -> 54.230.23.48 TCP 66 57871 > http [ACK] Seq=97 Ack=898143 Win=1225472 Len=0 TSval=38518092 TSecr=298647884
182   0.726293 54.230.23.48 -> 172.31.36.109 TCP 14546 [TCP segment of a reassembled PDU]
183   0.726316 172.31.36.109 -> 54.230.23.48 TCP 66 57871 > http [ACK] Seq=97 Ack=912623 Win=1225472 Len=0 TSval=38518092 TSecr=298647884
184   0.726375 54.230.23.48 -> 172.31.36.109 TCP 1514 [TCP segment of a reassembled PDU]
185   0.726380 172.31.36.109 -> 54.230.23.48 TCP 66 57871 > http [ACK] Seq=97 Ack=914071 Win=1227776 Len=0 TSval=38518092 TSecr=298647884
186   0.726538 54.230.23.48 -> 172.31.36.109 TCP 23234 [TCP segment of a reassembled PDU]
187   0.726562 172.31.36.109 -> 54.230.23.48 TCP 66 57871 > http [ACK] Seq=97 Ack=937239 Win=1204608 Len=0 TSval=38518092 TSecr=298647884
188   0.726642 54.230.23.48 -> 172.31.36.109 TCP 11650 [TCP segment of a reassembled PDU]
