[Measurement for 1mb at 14:42:49 20.42.2014] 
Tshark:

  1   0.000000 172.31.8.238 -> 172.31.0.2   DNS 88 Standard query 0x713c  A dm53kc3eax57k.cloudfront.net
  2   0.000029 172.31.8.238 -> 172.31.0.2   DNS 88 Standard query 0x4f5c  AAAA dm53kc3eax57k.cloudfront.net
  3   0.000521   172.31.0.2 -> 172.31.8.238 DNS 175 Standard query response 0x4f5c 
  4   0.000534   172.31.0.2 -> 172.31.8.238 DNS 216 Standard query response 0x713c  A 54.239.132.84 A 54.192.118.221 A 54.192.118.224 A 54.230.117.15 A 54.230.118.114 A 54.230.118.143 A 54.230.119.58 A 54.230.119.106
  5   0.003869 172.31.8.238 -> 54.239.132.84 TCP 74 45034 > http [SYN] Seq=0 Win=26883 Len=0 MSS=8961 SACK_PERM=1 TSval=19549192 TSecr=0 WS=128
  6   0.004759 54.239.132.84 -> 172.31.8.238 TCP 74 http > 45034 [SYN, ACK] Seq=0 Ack=1 Win=14480 Len=0 MSS=1460 SACK_PERM=1 TSval=1688668215 TSecr=19549192 WS=128
  7   0.004773 172.31.8.238 -> 54.239.132.84 TCP 66 45034 > http [ACK] Seq=1 Ack=1 Win=27008 Len=0 TSval=19549192 TSecr=1688668215
  8   0.004815 172.31.8.238 -> 54.239.132.84 HTTP 161 GET /1mb HTTP/1.1 
  9   0.005471 54.239.132.84 -> 172.31.8.238 TCP 66 http > 45034 [ACK] Seq=1 Ack=96 Win=14592 Len=0 TSval=1688668215 TSecr=19549192
 10   0.007068 54.239.132.84 -> 172.31.8.238 TCP 2580 [TCP segment of a reassembled PDU]
 11   0.007076 172.31.8.238 -> 54.239.132.84 TCP 66 45034 > http [ACK] Seq=96 Ack=2515 Win=32000 Len=0 TSval=19549193 TSecr=1688668215
 12   0.007232 54.239.132.84 -> 172.31.8.238 TCP 7306 [TCP segment of a reassembled PDU]
 13   0.007241 172.31.8.238 -> 54.239.132.84 TCP 66 45034 > http [ACK] Seq=96 Ack=9755 Win=46464 Len=0 TSval=19549193 TSecr=1688668215
 14   0.007365 54.239.132.84 -> 172.31.8.238 TCP 4410 [TCP segment of a reassembled PDU]
 15   0.007371 172.31.8.238 -> 54.239.132.84 TCP 66 45034 > http [ACK] Seq=96 Ack=14099 Win=55168 Len=0 TSval=19549193 TSecr=1688668215
 16   0.008066 54.239.132.84 -> 172.31.8.238 TCP 5858 [TCP segment of a reassembled PDU]
 17   0.008073 172.31.8.238 -> 54.239.132.84 TCP 66 45034 > http [ACK] Seq=96 Ack=19891 Win=66688 Len=0 TSval=19549193 TSecr=1688668215
 18   0.008195 54.239.132.84 -> 172.31.8.238 TCP 7306 [TCP segment of a reassembled PDU]
 19   0.008202 172.31.8.238 -> 54.239.132.84 TCP 66 45034 > http [ACK] Seq=96 Ack=27131 Win=81152 Len=0 TSval=19549193 TSecr=1688668215
 20   0.008845 54.239.132.84 -> 172.31.8.238 TCP 4410 [TCP segment of a reassembled PDU]
 21   0.008851 172.31.8.238 -> 54.239.132.84 TCP 66 45034 > http [ACK] Seq=96 Ack=31475 Win=89856 Len=0 TSval=19549193 TSecr=1688668215
 22   0.008982 54.239.132.84 -> 172.31.8.238 TCP 17442 [TCP segment of a reassembled PDU]
 23   0.008994 172.31.8.238 -> 54.239.132.84 TCP 66 45034 > http [ACK] Seq=96 Ack=48851 Win=89344 Len=0 TSval=19549193 TSecr=1688668215
 24   0.009578 54.239.132.84 -> 172.31.8.238 TCP 4410 [TCP segment of a reassembled PDU]
 25   0.009584 172.31.8.238 -> 54.239.132.84 TCP 66 45034 > http [ACK] Seq=96 Ack=53195 Win=98560 Len=0 TSval=19549193 TSecr=1688668215
 26   0.009826 54.239.132.84 -> 172.31.8.238 TCP 2962 [TCP segment of a reassembled PDU]
 27   0.009831 172.31.8.238 -> 54.239.132.84 TCP 66 45034 > http [ACK] Seq=96 Ack=56091 Win=104320 Len=0 TSval=19549193 TSecr=1688668215
 28   0.009941 54.239.132.84 -> 172.31.8.238 TCP 10202 [TCP segment of a reassembled PDU]
 29   0.009949 172.31.8.238 -> 54.239.132.84 TCP 66 45034 > http [ACK] Seq=96 Ack=66227 Win=101248 Len=0 TSval=19549193 TSecr=1688668215
 30   0.010216 54.239.132.84 -> 172.31.8.238 TCP 8754 [TCP segment of a reassembled PDU]
 31   0.010223 172.31.8.238 -> 54.239.132.84 TCP 66 45034 > http [ACK] Seq=96 Ack=74915 Win=103680 Len=0 TSval=19549193 TSecr=1688668215
 32   0.010343 54.239.132.84 -> 172.31.8.238 TCP 4410 [TCP segment of a reassembled PDU]
 33   0.010348 172.31.8.238 -> 54.239.132.84 TCP 66 45034 > http [ACK] Seq=96 Ack=79259 Win=109056 Len=0 TSval=19549193 TSecr=1688668215
 34   0.010468 54.239.132.84 -> 172.31.8.238 TCP 10202 [TCP segment of a reassembled PDU]
 35   0.010475 172.31.8.238 -> 54.239.132.84 TCP 66 45034 > http [ACK] Seq=96 Ack=89395 Win=101248 Len=0 TSval=19549193 TSecr=1688668215
 36   0.010658 54.239.132.84 -> 172.31.8.238 TCP 5858 [TCP segment of a reassembled PDU]
 37   0.010665 172.31.8.238 -> 54.239.132.84 TCP 66 45034 > http [ACK] Seq=96 Ack=95187 Win=108416 Len=0 TSval=19549193 TSecr=1688668215
 38   0.010948 54.239.132.84 -> 172.31.8.238 TCP 21786 [TCP segment of a reassembled PDU]
 39   0.010960 172.31.8.238 -> 54.239.132.84 TCP 66 45034 > http [ACK] Seq=96 Ack=116907 Win=86784 Len=0 TSval=19549193 TSecr=1688668215
 40   0.011104 54.239.132.84 -> 172.31.8.238 TCP 2962 [TCP segment of a reassembled PDU]
 41   0.011109 172.31.8.238 -> 54.239.132.84 TCP 66 45034 > http [ACK] Seq=96 Ack=119803 Win=109056 Len=0 TSval=19549194 TSecr=1688668215
 42   0.011244 54.239.132.84 -> 172.31.8.238 TCP 2962 [TCP segment of a reassembled PDU]
 43   0.011250 172.31.8.238 -> 54.239.132.84 TCP 66 45034 > http [ACK] Seq=96 Ack=122699 Win=114816 Len=0 TSval=19549194 TSecr=1688668215
 44   0.011509 54.239.132.84 -> 172.31.8.238 TCP 4410 [TCP segment of a reassembled PDU]
 45   0.011516 172.31.8.238 -> 54.239.132.84 TCP 66 45034 > http [ACK] Seq=96 Ack=127043 Win=123520 Len=0 TSval=19549194 TSecr=1688668215
 46   0.011648 54.239.132.84 -> 172.31.8.238 TCP 5858 [TCP segment of a reassembled PDU]
 47   0.011654 172.31.8.238 -> 54.239.132.84 TCP 66 45034 > http [ACK] Seq=96 Ack=132835 Win=135168 Len=0 TSval=19549194 TSecr=1688668215
 48   0.011803 54.239.132.84 -> 172.31.8.238 TCP 20338 [TCP segment of a reassembled PDU]
 49   0.011815 172.31.8.238 -> 54.239.132.84 TCP 66 45034 > http [ACK] Seq=96 Ack=153107 Win=175616 Len=0 TSval=19549194 TSecr=1688668215
 50   0.011972 54.239.132.84 -> 172.31.8.238 TCP 1514 [TCP segment of a reassembled PDU]
 51   0.011978 172.31.8.238 -> 54.239.132.84 TCP 66 45034 > http [ACK] Seq=96 Ack=154555 Win=178560 Len=0 TSval=19549194 TSecr=1688668215
 52   0.012250 54.239.132.84 -> 172.31.8.238 TCP 18890 [TCP segment of a reassembled PDU]
 53   0.012261 172.31.8.238 -> 54.239.132.84 TCP 66 45034 > http [ACK] Seq=96 Ack=173379 Win=216192 Len=0 TSval=19549194 TSecr=1688668215
 54   0.012353 54.239.132.84 -> 172.31.8.238 TCP 1514 [TCP segment of a reassembled PDU]
 55   0.012358 172.31.8.238 -> 54.239.132.84 TCP 66 45034 > http [ACK] Seq=96 Ack=174827 Win=219136 Len=0 TSval=19549194 TSecr=1688668215
 56   0.012656 54.239.132.84 -> 172.31.8.238 TCP 4410 [TCP segment of a reassembled PDU]
 57   0.012661 172.31.8.238 -> 54.239.132.84 TCP 66 45034 > http [ACK] Seq=96 Ack=179171 Win=227840 Len=0 TSval=19549194 TSecr=1688668215
 58   0.012767 54.239.132.84 -> 172.31.8.238 TCP 18890 [TCP segment of a reassembled PDU]
 59   0.012778 172.31.8.238 -> 54.239.132.84 TCP 66 45034 > http [ACK] Seq=96 Ack=197995 Win=265472 Len=0 TSval=19549194 TSecr=1688668215
 60   0.012816 54.239.132.84 -> 172.31.8.238 TCP 7306 [TCP segment of a reassembled PDU]
 61   0.012822 172.31.8.238 -> 54.239.132.84 TCP 66 45034 > http [ACK] Seq=96 Ack=205235 Win=279936 Len=0 TSval=19549194 TSecr=1688668215
 62   0.012924 54.239.132.84 -> 172.31.8.238 TCP 4410 [TCP segment of a reassembled PDU]
 63   0.012930 172.31.8.238 -> 54.239.132.84 TCP 66 45034 > http [ACK] Seq=96 Ack=209579 Win=288640 Len=0 TSval=19549194 TSecr=1688668215
 64   0.013413 54.239.132.84 -> 172.31.8.238 TCP 4410 [TCP segment of a reassembled PDU]
 65   0.013419 172.31.8.238 -> 54.239.132.84 TCP 66 45034 > http [ACK] Seq=96 Ack=213923 Win=297344 Len=0 TSval=19549194 TSecr=1688668215
 66   0.013597 54.239.132.84 -> 172.31.8.238 TCP 21786 [TCP segment of a reassembled PDU]
 67   0.013609 172.31.8.238 -> 54.239.132.84 TCP 66 45034 > http [ACK] Seq=96 Ack=235643 Win=340736 Len=0 TSval=19549194 TSecr=1688668215
 68   0.013639 54.239.132.84 -> 172.31.8.238 TCP 4410 [TCP segment of a reassembled PDU]
 69   0.013643 172.31.8.238 -> 54.239.132.84 TCP 66 45034 > http [ACK] Seq=96 Ack=239987 Win=349440 Len=0 TSval=19549194 TSecr=1688668215
 70   0.013734 54.239.132.84 -> 172.31.8.238 TCP 8754 [TCP segment of a reassembled PDU]
 71   0.013742 172.31.8.238 -> 54.239.132.84 TCP 66 45034 > http [ACK] Seq=96 Ack=248675 Win=366848 Len=0 TSval=19549194 TSecr=1688668215
 72   0.013751 54.239.132.84 -> 172.31.8.238 TCP 5858 [TCP segment of a reassembled PDU]
 73   0.013755 172.31.8.238 -> 54.239.132.84 TCP 66 45034 > http [ACK] Seq=96 Ack=254467 Win=378368 Len=0 TSval=19549194 TSecr=1688668216
 74   0.014468 54.239.132.84 -> 172.31.8.238 TCP 4410 [TCP segment of a reassembled PDU]
 75   0.014479 172.31.8.238 -> 54.239.132.84 TCP 66 45034 > http [ACK] Seq=96 Ack=258811 Win=387072 Len=0 TSval=19549194 TSecr=1688668216
 76   0.014614 54.239.132.84 -> 172.31.8.238 TCP 26130 [TCP segment of a reassembled PDU]
 77   0.014629 172.31.8.238 -> 54.239.132.84 TCP 66 45034 > http [ACK] Seq=96 Ack=284875 Win=439168 Len=0 TSval=19549194 TSecr=1688668216
 78   0.014664 54.239.132.84 -> 172.31.8.238 TCP 14546 [TCP segment of a reassembled PDU]
 79   0.014672 172.31.8.238 -> 54.239.132.84 TCP 66 45034 > http [ACK] Seq=96 Ack=299355 Win=468224 Len=0 TSval=19549194 TSecr=1688668216
 80   0.015206 54.239.132.84 -> 172.31.8.238 TCP 4410 [TCP segment of a reassembled PDU]
 81   0.015212 172.31.8.238 -> 54.239.132.84 TCP 66 45034 > http [ACK] Seq=96 Ack=303699 Win=476800 Len=0 TSval=19549195 TSecr=1688668216
 82   0.015386 54.239.132.84 -> 172.31.8.238 TCP 26130 [TCP segment of a reassembled PDU]
 83   0.015400 172.31.8.238 -> 54.239.132.84 TCP 66 45034 > http [ACK] Seq=96 Ack=329763 Win=529024 Len=0 TSval=19549195 TSecr=1688668216
 84   0.015449 54.239.132.84 -> 172.31.8.238 TCP 14546 [TCP segment of a reassembled PDU]
 85   0.015458 172.31.8.238 -> 54.239.132.84 TCP 66 45034 > http [ACK] Seq=96 Ack=344243 Win=557952 Len=0 TSval=19549195 TSecr=1688668216
 86   0.015977 54.239.132.84 -> 172.31.8.238 TCP 4410 [TCP segment of a reassembled PDU]
 87   0.015997 172.31.8.238 -> 54.239.132.84 TCP 66 45034 > http [ACK] Seq=96 Ack=348587 Win=566656 Len=0 TSval=19549195 TSecr=1688668216
 88   0.016156 54.239.132.84 -> 172.31.8.238 TCP 26130 [TCP segment of a reassembled PDU]
 89   0.016169 172.31.8.238 -> 54.239.132.84 TCP 66 45034 > http [ACK] Seq=96 Ack=374651 Win=618752 Len=0 TSval=19549195 TSecr=1688668216
 90   0.016220 54.239.132.84 -> 172.31.8.238 TCP 18890 [TCP segment of a reassembled PDU]
 91   0.016232 172.31.8.238 -> 54.239.132.84 TCP 66 45034 > http [ACK] Seq=96 Ack=393475 Win=656384 Len=0 TSval=19549195 TSecr=1688668216
 92   0.016276 54.239.132.84 -> 172.31.8.238 TCP 4410 [TCP segment of a reassembled PDU]
 93   0.016282 172.31.8.238 -> 54.239.132.84 TCP 66 45034 > http [ACK] Seq=96 Ack=397819 Win=665088 Len=0 TSval=19549195 TSecr=1688668216
 94   0.017003 54.239.132.84 -> 172.31.8.238 TCP 5858 [TCP segment of a reassembled PDU]
 95   0.017011 172.31.8.238 -> 54.239.132.84 TCP 66 45034 > http [ACK] Seq=96 Ack=403611 Win=676736 Len=0 TSval=19549195 TSecr=1688668216
 96   0.017196 54.239.132.84 -> 172.31.8.238 TCP 26130 [TCP segment of a reassembled PDU]
 97   0.017210 172.31.8.238 -> 54.239.132.84 TCP 66 45034 > http [ACK] Seq=96 Ack=429675 Win=728832 Len=0 TSval=19549195 TSecr=1688668216
 98   0.017270 54.239.132.84 -> 172.31.8.238 TCP 21786 [TCP segment of a reassembled PDU]
 99   0.017283 172.31.8.238 -> 54.239.132.84 TCP 66 45034 > http [ACK] Seq=96 Ack=451395 Win=772224 Len=0 TSval=19549195 TSecr=1688668216
100   0.017762 54.239.132.84 -> 172.31.8.238 TCP 4410 [TCP segment of a reassembled PDU]
101   0.017767 172.31.8.238 -> 54.239.132.84 TCP 66 45034 > http [ACK] Seq=96 Ack=455739 Win=780928 Len=0 TSval=19549195 TSecr=1688668216
102   0.017942 54.239.132.84 -> 172.31.8.238 TCP 26130 [TCP segment of a reassembled PDU]
103   0.017956 172.31.8.238 -> 54.239.132.84 TCP 66 45034 > http [ACK] Seq=96 Ack=481803 Win=833024 Len=0 TSval=19549195 TSecr=1688668216
104   0.018001 54.239.132.84 -> 172.31.8.238 TCP 17442 [TCP segment of a reassembled PDU]
105   0.018012 172.31.8.238 -> 54.239.132.84 TCP 66 45034 > http [ACK] Seq=96 Ack=499179 Win=867840 Len=0 TSval=19549195 TSecr=1688668216
106   0.018058 54.239.132.84 -> 172.31.8.238 TCP 5858 [TCP segment of a reassembled PDU]
107   0.018064 172.31.8.238 -> 54.239.132.84 TCP 66 45034 > http [ACK] Seq=96 Ack=504971 Win=879360 Len=0 TSval=19549195 TSecr=1688668216
108   0.018527 54.239.132.84 -> 172.31.8.238 TCP 2962 [TCP segment of a reassembled PDU]
109   0.018534 172.31.8.238 -> 54.239.132.84 TCP 66 45034 > http [ACK] Seq=96 Ack=507867 Win=885248 Len=0 TSval=19549195 TSecr=1688668216
110   0.018709 54.239.132.84 -> 172.31.8.238 TCP 26130 [TCP segment of a reassembled PDU]
111   0.018723 172.31.8.238 -> 54.239.132.84 TCP 66 45034 > http [ACK] Seq=96 Ack=533931 Win=937344 Len=0 TSval=19549195 TSecr=1688668216
112   0.018788 54.239.132.84 -> 172.31.8.238 TCP 26130 [TCP segment of a reassembled PDU]
113   0.018802 172.31.8.238 -> 54.239.132.84 TCP 66 45034 > http [ACK] Seq=96 Ack=559995 Win=984320 Len=0 TSval=19549195 TSecr=1688668216
114   0.018851 54.239.132.84 -> 172.31.8.238 TCP 10202 [TCP segment of a reassembled PDU]
115   0.018859 172.31.8.238 -> 54.239.132.84 TCP 66 45034 > http [ACK] Seq=96 Ack=570131 Win=1009664 Len=0 TSval=19549195 TSecr=1688668216
116   0.019552 54.239.132.84 -> 172.31.8.238 TCP 2962 [TCP segment of a reassembled PDU]
117   0.019558 172.31.8.238 -> 54.239.132.84 TCP 66 45034 > http [ACK] Seq=96 Ack=573027 Win=1015552 Len=0 TSval=19549196 TSecr=1688668216
118   0.019738 54.239.132.84 -> 172.31.8.238 TCP 26130 [TCP segment of a reassembled PDU]
119   0.019765 172.31.8.238 -> 54.239.132.84 TCP 66 45034 > http [ACK] Seq=96 Ack=599091 Win=989568 Len=0 TSval=19549196 TSecr=1688668216
120   0.019821 54.239.132.84 -> 172.31.8.238 TCP 23234 [TCP segment of a reassembled PDU]
121   0.019849 172.31.8.238 -> 54.239.132.84 TCP 66 45034 > http [ACK] Seq=96 Ack=622259 Win=989056 Len=0 TSval=19549196 TSecr=1688668216
122   0.019878 54.239.132.84 -> 172.31.8.238 TCP 2962 [TCP segment of a reassembled PDU]
123   0.019883 172.31.8.238 -> 54.239.132.84 TCP 66 45034 > http [ACK] Seq=96 Ack=625155 Win=1021312 Len=0 TSval=19549196 TSecr=1688668216
124   0.019945 54.239.132.84 -> 172.31.8.238 TCP 10202 [TCP segment of a reassembled PDU]
125   0.019965 172.31.8.238 -> 54.239.132.84 TCP 66 45034 > http [ACK] Seq=96 Ack=635291 Win=1021312 Len=0 TSval=19549196 TSecr=1688668216
126   0.020578 54.239.132.84 -> 172.31.8.238 TCP 4410 [TCP segment of a reassembled PDU]
127   0.020597 172.31.8.238 -> 54.239.132.84 TCP 66 45034 > http [ACK] Seq=96 Ack=639635 Win=1021312 Len=0 TSval=19549196 TSecr=1688668216
128   0.020776 54.239.132.84 -> 172.31.8.238 TCP 26130 [TCP segment of a reassembled PDU]
129   0.020803 172.31.8.238 -> 54.239.132.84 TCP 66 45034 > http [ACK] Seq=96 Ack=665699 Win=995328 Len=0 TSval=19549196 TSecr=1688668216
130   0.020856 54.239.132.84 -> 172.31.8.238 TCP 18890 [TCP segment of a reassembled PDU]
131   0.020869 172.31.8.238 -> 54.239.132.84 TCP 66 45034 > http [ACK] Seq=96 Ack=684523 Win=996224 Len=0 TSval=19549196 TSecr=1688668216
132   0.020925 54.239.132.84 -> 172.31.8.238 TCP 7306 [TCP segment of a reassembled PDU]
133   0.020933 172.31.8.238 -> 54.239.132.84 TCP 66 45034 > http [ACK] Seq=96 Ack=691763 Win=1015296 Len=0 TSval=19549196 TSecr=1688668216
134   0.021025 54.239.132.84 -> 172.31.8.238 TCP 26130 [TCP segment of a reassembled PDU]
135   0.021066 172.31.8.238 -> 54.239.132.84 TCP 66 45034 > http [ACK] Seq=96 Ack=717827 Win=989312 Len=0 TSval=19549196 TSecr=1688668216
136   0.021099 54.239.132.84 -> 172.31.8.238 TCP 15994 [TCP segment of a reassembled PDU]
137   0.021110 172.31.8.238 -> 54.239.132.84 TCP 66 45034 > http [ACK] Seq=96 Ack=733755 Win=1000960 Len=0 TSval=19549196 TSecr=1688668216
138   0.021522 54.239.132.84 -> 172.31.8.238 TCP 2962 [TCP segment of a reassembled PDU]
139   0.021529 172.31.8.238 -> 54.239.132.84 TCP 66 45034 > http [ACK] Seq=96 Ack=736651 Win=1021952 Len=0 TSval=19549196 TSecr=1688668216
140   0.021707 54.239.132.84 -> 172.31.8.238 TCP 26130 [TCP segment of a reassembled PDU]
141   0.021732 172.31.8.238 -> 54.239.132.84 TCP 66 45034 > http [ACK] Seq=96 Ack=762715 Win=995968 Len=0 TSval=19549196 TSecr=1688668216
142   0.021780 54.239.132.84 -> 172.31.8.238 TCP 26130 [TCP segment of a reassembled PDU]
143   0.021937 54.239.132.84 -> 172.31.8.238 TCP 26130 [TCP segment of a reassembled PDU]
144   0.021954 54.239.132.84 -> 172.31.8.238 TCP 7306 [TCP segment of a reassembled PDU]
145   0.021960 54.239.132.84 -> 172.31.8.238 TCP 8754 [TCP segment of a reassembled PDU]
146   0.022018 172.31.8.238 -> 54.239.132.84 TCP 66 45034 > http [ACK] Seq=96 Ack=830771 Win=928000 Len=0 TSval=19549196 TSecr=1688668216
147   0.022343 54.239.132.84 -> 172.31.8.238 TCP 20338 [TCP segment of a reassembled PDU]
148   0.022357 172.31.8.238 -> 54.239.132.84 TCP 66 45034 > http [ACK] Seq=96 Ack=851043 Win=993792 Len=0 TSval=19549196 TSecr=1688668216
149   0.022386 54.239.132.84 -> 172.31.8.238 TCP 5858 [TCP segment of a reassembled PDU]
150   0.022398 172.31.8.238 -> 54.239.132.84 TCP 66 45034 > http [ACK] Seq=96 Ack=856835 Win=1017600 Len=0 TSval=19549196 TSecr=1688668216
151   0.022456 54.239.132.84 -> 172.31.8.238 TCP 14546 [TCP segment of a reassembled PDU]
152   0.022478 172.31.8.238 -> 54.239.132.84 TCP 66 45034 > http [ACK] Seq=96 Ack=871315 Win=1021952 Len=0 TSval=19549196 TSecr=1688668216
153   0.022606 54.239.132.84 -> 172.31.8.238 TCP 26130 [TCP segment of a reassembled PDU]
154   0.022665 172.31.8.238 -> 54.239.132.84 TCP 66 45034 > http [ACK] Seq=96 Ack=897379 Win=995968 Len=0 TSval=19549196 TSecr=1688668216
155   0.022688 54.239.132.84 -> 172.31.8.238 TCP 26130 [TCP segment of a reassembled PDU]
156   0.022714 172.31.8.238 -> 54.239.132.84 TCP 66 45034 > http [ACK] Seq=96 Ack=923443 Win=984320 Len=0 TSval=19549196 TSecr=1688668216
157   0.022785 54.239.132.84 -> 172.31.8.238 TCP 18890 [TCP segment of a reassembled PDU]
158   0.022797 172.31.8.238 -> 54.239.132.84 TCP 66 45034 > http [ACK] Seq=96 Ack=942267 Win=996224 Len=0 TSval=19549196 TSecr=1688668216
159   0.023059 54.239.132.84 -> 172.31.8.238 TCP 17442 [TCP segment of a reassembled PDU]
160   0.023070 172.31.8.238 -> 54.239.132.84 TCP 66 45034 > http [ACK] Seq=96 Ack=959643 Win=998528 Len=0 TSval=19549197 TSecr=1688668216
161   0.023079 54.239.132.84 -> 172.31.8.238 TCP 1514 [TCP segment of a reassembled PDU]
162   0.023364 54.239.132.84 -> 172.31.8.238 TCP 26130 [TCP segment of a reassembled PDU]
163   0.023378 172.31.8.238 -> 54.239.132.84 TCP 66 45034 > http [ACK] Seq=96 Ack=987155 Win=1074176 Len=0 TSval=19549197 TSecr=1688668216
164   0.023435 54.239.132.84 -> 172.31.8.238 TCP 26130 [TCP segment of a reassembled PDU]
165   0.023449 172.31.8.238 -> 54.239.132.84 TCP 66 45034 > http [ACK] Seq=96 Ack=1013219 Win=1126272 Len=0 TSval=19549197 TSecr=1688668216
166   0.023504 54.239.132.84 -> 172.31.8.238 TCP 13098 [TCP segment of a reassembled PDU]
167   0.023513 172.31.8.238 -> 54.239.132.84 TCP 66 45034 > http [ACK] Seq=96 Ack=1026251 Win=1152384 Len=0 TSval=19549197 TSecr=1688668216
168   0.023568 54.239.132.84 -> 172.31.8.238 TCP 13098 [TCP segment of a reassembled PDU]
169   0.023577 172.31.8.238 -> 54.239.132.84 TCP 66 45034 > http [ACK] Seq=96 Ack=1039283 Win=1178368 Len=0 TSval=19549197 TSecr=1688668217
170   0.023670 54.239.132.84 -> 172.31.8.238 HTTP 9817 HTTP/1.1 200 OK  (application/octet-stream)
171   0.023679 172.31.8.238 -> 54.239.132.84 TCP 66 45034 > http [ACK] Seq=96 Ack=1049034 Win=1197952 Len=0 TSval=19549197 TSecr=1688668217
172   0.023798 172.31.8.238 -> 54.239.132.84 TCP 66 45034 > http [FIN, ACK] Seq=96 Ack=1049034 Win=1197952 Len=0 TSval=19549197 TSecr=1688668217
173   0.024246 54.239.132.84 -> 172.31.8.238 TCP 66 http > 45034 [FIN, ACK] Seq=1049034 Ack=97 Win=14592 Len=0 TSval=1688668217 TSecr=19549197
174   0.024253 172.31.8.238 -> 54.239.132.84 TCP 66 45034 > http [ACK] Seq=97 Ack=1049035 Win=1197952 Len=0 TSval=19549197 TSecr=1688668217
