[Measurement for 1mb at 20:42:48 19.42.2014] 
Tshark:

  1   0.000000 172.31.8.238 -> 172.31.0.2   DNS 88 Standard query 0x441d  A dm53kc3eax57k.cloudfront.net
  2   0.000030 172.31.8.238 -> 172.31.0.2   DNS 88 Standard query 0x5d4c  AAAA dm53kc3eax57k.cloudfront.net
  3   0.000965   172.31.0.2 -> 172.31.8.238 DNS 216 Standard query response 0x441d  A 54.230.119.12 A 54.230.119.55 A 54.230.119.165 A 54.192.118.218 A 54.192.118.238 A 54.230.117.42 A 54.230.117.50 A 54.230.118.136
  4   0.000978   172.31.0.2 -> 172.31.8.238 DNS 175 Standard query response 0x5d4c 
  5   0.003878 172.31.8.238 -> 54.230.119.12 TCP 74 51358 > http [SYN] Seq=0 Win=26883 Len=0 MSS=8961 SACK_PERM=1 TSval=3349159 TSecr=0 WS=128
  6   0.004810 54.230.119.12 -> 172.31.8.238 TCP 74 http > 51358 [SYN, ACK] Seq=0 Ack=1 Win=14480 Len=0 MSS=1460 SACK_PERM=1 TSval=803486380 TSecr=3349159 WS=128
  7   0.004826 172.31.8.238 -> 54.230.119.12 TCP 66 51358 > http [ACK] Seq=1 Ack=1 Win=27008 Len=0 TSval=3349159 TSecr=803486380
  8   0.004868 172.31.8.238 -> 54.230.119.12 HTTP 161 GET /1mb HTTP/1.1 
  9   0.005580 54.230.119.12 -> 172.31.8.238 TCP 66 http > 51358 [ACK] Seq=1 Ack=96 Win=14592 Len=0 TSval=803486380 TSecr=3349159
 10   0.007499 54.230.119.12 -> 172.31.8.238 TCP 1133 [TCP segment of a reassembled PDU]
 11   0.007506 172.31.8.238 -> 54.230.119.12 TCP 66 51358 > http [ACK] Seq=96 Ack=1068 Win=29056 Len=0 TSval=3349160 TSecr=803486380
 12   0.007626 54.230.119.12 -> 172.31.8.238 TCP 13098 [TCP segment of a reassembled PDU]
 13   0.007636 172.31.8.238 -> 54.230.119.12 TCP 66 51358 > http [ACK] Seq=96 Ack=14100 Win=55168 Len=0 TSval=3349160 TSecr=803486380
 14   0.008348 54.230.119.12 -> 172.31.8.238 TCP 13098 [TCP segment of a reassembled PDU]
 15   0.008357 172.31.8.238 -> 54.230.119.12 TCP 66 51358 > http [ACK] Seq=96 Ack=27132 Win=81152 Len=0 TSval=3349160 TSecr=803486381
 16   0.009056 54.230.119.12 -> 172.31.8.238 TCP 4410 [TCP segment of a reassembled PDU]
 17   0.009062 172.31.8.238 -> 54.230.119.12 TCP 66 51358 > http [ACK] Seq=96 Ack=31476 Win=89856 Len=0 TSval=3349160 TSecr=803486381
 18   0.009167 54.230.119.12 -> 172.31.8.238 TCP 8754 [TCP segment of a reassembled PDU]
 19   0.009174 172.31.8.238 -> 54.230.119.12 TCP 66 51358 > http [ACK] Seq=96 Ack=40164 Win=103680 Len=0 TSval=3349160 TSecr=803486381
 20   0.009810 54.230.119.12 -> 172.31.8.238 TCP 4410 [TCP segment of a reassembled PDU]
 21   0.009816 172.31.8.238 -> 54.230.119.12 TCP 66 51358 > http [ACK] Seq=96 Ack=44508 Win=109056 Len=0 TSval=3349160 TSecr=803486381
 22   0.009935 54.230.119.12 -> 172.31.8.238 TCP 17442 [TCP segment of a reassembled PDU]
 23   0.009945 172.31.8.238 -> 54.230.119.12 TCP 66 51358 > http [ACK] Seq=96 Ack=61884 Win=91776 Len=0 TSval=3349160 TSecr=803486381
 24   0.010318 54.230.119.12 -> 172.31.8.238 TCP 2962 [TCP segment of a reassembled PDU]
 25   0.010324 172.31.8.238 -> 54.230.119.12 TCP 66 51358 > http [ACK] Seq=96 Ack=64780 Win=109056 Len=0 TSval=3349160 TSecr=803486381
 26   0.010421 54.230.119.12 -> 172.31.8.238 TCP 1514 [TCP segment of a reassembled PDU]
 27   0.010426 172.31.8.238 -> 54.230.119.12 TCP 66 51358 > http [ACK] Seq=96 Ack=66228 Win=112000 Len=0 TSval=3349161 TSecr=803486381
 28   0.010578 54.230.119.12 -> 172.31.8.238 TCP 4410 [TCP segment of a reassembled PDU]
 29   0.010584 172.31.8.238 -> 54.230.119.12 TCP 66 51358 > http [ACK] Seq=96 Ack=70572 Win=120704 Len=0 TSval=3349161 TSecr=803486381
 30   0.010691 54.230.119.12 -> 172.31.8.238 TCP 8754 [TCP segment of a reassembled PDU]
 31   0.010698 172.31.8.238 -> 54.230.119.12 TCP 66 51358 > http [ACK] Seq=96 Ack=79260 Win=137984 Len=0 TSval=3349161 TSecr=803486381
 32   0.010830 54.230.119.12 -> 172.31.8.238 TCP 1514 [TCP segment of a reassembled PDU]
 33   0.010835 172.31.8.238 -> 54.230.119.12 TCP 66 51358 > http [ACK] Seq=96 Ack=80708 Win=140928 Len=0 TSval=3349161 TSecr=803486381
 34   0.010938 54.230.119.12 -> 172.31.8.238 TCP 10202 [TCP segment of a reassembled PDU]
 35   0.010946 172.31.8.238 -> 54.230.119.12 TCP 66 51358 > http [ACK] Seq=96 Ack=90844 Win=161152 Len=0 TSval=3349161 TSecr=803486381
 36   0.011347 54.230.119.12 -> 172.31.8.238 TCP 4410 [TCP segment of a reassembled PDU]
 37   0.011353 172.31.8.238 -> 54.230.119.12 TCP 66 51358 > http [ACK] Seq=96 Ack=95188 Win=169856 Len=0 TSval=3349161 TSecr=803486381
 38   0.011458 54.230.119.12 -> 172.31.8.238 TCP 11650 [TCP segment of a reassembled PDU]
 39   0.011465 172.31.8.238 -> 54.230.119.12 TCP 66 51358 > http [ACK] Seq=96 Ack=106772 Win=193024 Len=0 TSval=3349161 TSecr=803486381
 40   0.011609 54.230.119.12 -> 172.31.8.238 TCP 4410 [TCP segment of a reassembled PDU]
 41   0.011615 172.31.8.238 -> 54.230.119.12 TCP 66 51358 > http [ACK] Seq=96 Ack=111116 Win=201728 Len=0 TSval=3349161 TSecr=803486381
 42   0.011720 54.230.119.12 -> 172.31.8.238 TCP 13098 [TCP segment of a reassembled PDU]
 43   0.011729 172.31.8.238 -> 54.230.119.12 TCP 66 51358 > http [ACK] Seq=96 Ack=124148 Win=227840 Len=0 TSval=3349161 TSecr=803486381
 44   0.012119 54.230.119.12 -> 172.31.8.238 TCP 4410 [TCP segment of a reassembled PDU]
 45   0.012126 172.31.8.238 -> 54.230.119.12 TCP 66 51358 > http [ACK] Seq=96 Ack=128492 Win=236544 Len=0 TSval=3349161 TSecr=803486381
 46   0.012220 54.230.119.12 -> 172.31.8.238 TCP 5858 [TCP segment of a reassembled PDU]
 47   0.012226 172.31.8.238 -> 54.230.119.12 TCP 66 51358 > http [ACK] Seq=96 Ack=134284 Win=248064 Len=0 TSval=3349161 TSecr=803486381
 48   0.012351 54.230.119.12 -> 172.31.8.238 TCP 15994 [TCP segment of a reassembled PDU]
 49   0.012362 172.31.8.238 -> 54.230.119.12 TCP 66 51358 > http [ACK] Seq=96 Ack=150212 Win=279936 Len=0 TSval=3349161 TSecr=803486381
 50   0.012485 54.230.119.12 -> 172.31.8.238 TCP 11650 [TCP segment of a reassembled PDU]
 51   0.012494 172.31.8.238 -> 54.230.119.12 TCP 66 51358 > http [ACK] Seq=96 Ack=161796 Win=303104 Len=0 TSval=3349161 TSecr=803486381
 52   0.012904 54.230.119.12 -> 172.31.8.238 TCP 10202 [TCP segment of a reassembled PDU]
 53   0.012912 172.31.8.238 -> 54.230.119.12 TCP 66 51358 > http [ACK] Seq=96 Ack=171932 Win=323328 Len=0 TSval=3349161 TSecr=803486381
 54   0.013005 54.230.119.12 -> 172.31.8.238 TCP 4410 [TCP segment of a reassembled PDU]
 55   0.013011 172.31.8.238 -> 54.230.119.12 TCP 66 51358 > http [ACK] Seq=96 Ack=176276 Win=332032 Len=0 TSval=3349161 TSecr=803486381
 56   0.013192 54.230.119.12 -> 172.31.8.238 TCP 11650 [TCP segment of a reassembled PDU]
 57   0.013200 172.31.8.238 -> 54.230.119.12 TCP 66 51358 > http [ACK] Seq=96 Ack=187860 Win=355200 Len=0 TSval=3349161 TSecr=803486381
 58   0.013316 54.230.119.12 -> 172.31.8.238 TCP 18890 [TCP segment of a reassembled PDU]
 59   0.013328 172.31.8.238 -> 54.230.119.12 TCP 66 51358 > http [ACK] Seq=96 Ack=206684 Win=392832 Len=0 TSval=3349161 TSecr=803486381
 60   0.013636 54.230.119.12 -> 172.31.8.238 TCP 4410 [TCP segment of a reassembled PDU]
 61   0.013642 172.31.8.238 -> 54.230.119.12 TCP 66 51358 > http [ACK] Seq=96 Ack=211028 Win=401536 Len=0 TSval=3349161 TSecr=803486381
 62   0.013758 54.230.119.12 -> 172.31.8.238 TCP 5858 [TCP segment of a reassembled PDU]
 63   0.013765 172.31.8.238 -> 54.230.119.12 TCP 66 51358 > http [ACK] Seq=96 Ack=216820 Win=413184 Len=0 TSval=3349161 TSecr=803486381
 64   0.014022 54.230.119.12 -> 172.31.8.238 TCP 21786 [TCP segment of a reassembled PDU]
 65   0.014036 172.31.8.238 -> 54.230.119.12 TCP 66 51358 > http [ACK] Seq=96 Ack=238540 Win=456576 Len=0 TSval=3349161 TSecr=803486381
 66   0.014059 54.230.119.12 -> 172.31.8.238 TCP 4410 [TCP segment of a reassembled PDU]
 67   0.014075 172.31.8.238 -> 54.230.119.12 TCP 66 51358 > http [ACK] Seq=96 Ack=242884 Win=465280 Len=0 TSval=3349161 TSecr=803486381
 68   0.014165 54.230.119.12 -> 172.31.8.238 TCP 14546 [TCP segment of a reassembled PDU]
 69   0.014175 172.31.8.238 -> 54.230.119.12 TCP 66 51358 > http [ACK] Seq=96 Ack=257364 Win=494208 Len=0 TSval=3349161 TSecr=803486381
 70   0.014475 54.230.119.12 -> 172.31.8.238 TCP 13098 [TCP segment of a reassembled PDU]
 71   0.014485 172.31.8.238 -> 54.230.119.12 TCP 66 51358 > http [ACK] Seq=96 Ack=270396 Win=520320 Len=0 TSval=3349162 TSecr=803486381
 72   0.014677 54.230.119.12 -> 172.31.8.238 TCP 4410 [TCP segment of a reassembled PDU]
 73   0.014683 172.31.8.238 -> 54.230.119.12 TCP 66 51358 > http [ACK] Seq=96 Ack=274740 Win=529024 Len=0 TSval=3349162 TSecr=803486381
 74   0.014843 54.230.119.12 -> 172.31.8.238 TCP 18890 [TCP segment of a reassembled PDU]
 75   0.014854 172.31.8.238 -> 54.230.119.12 TCP 66 51358 > http [ACK] Seq=96 Ack=293564 Win=566656 Len=0 TSval=3349162 TSecr=803486381
 76   0.015079 54.230.119.12 -> 172.31.8.238 TCP 21786 [TCP segment of a reassembled PDU]
 77   0.015092 172.31.8.238 -> 54.230.119.12 TCP 66 51358 > http [ACK] Seq=96 Ack=315284 Win=610048 Len=0 TSval=3349162 TSecr=803486381
 78   0.015225 54.230.119.12 -> 172.31.8.238 TCP 4410 [TCP segment of a reassembled PDU]
 79   0.015230 172.31.8.238 -> 54.230.119.12 TCP 66 51358 > http [ACK] Seq=96 Ack=319628 Win=618752 Len=0 TSval=3349162 TSecr=803486381
 80   0.015329 54.230.119.12 -> 172.31.8.238 TCP 4410 [TCP segment of a reassembled PDU]
 81   0.015334 172.31.8.238 -> 54.230.119.12 TCP 66 51358 > http [ACK] Seq=96 Ack=323972 Win=627456 Len=0 TSval=3349162 TSecr=803486381
 82   0.015661 54.230.119.12 -> 172.31.8.238 TCP 26130 [TCP segment of a reassembled PDU]
 83   0.015674 172.31.8.238 -> 54.230.119.12 TCP 66 51358 > http [ACK] Seq=96 Ack=350036 Win=679552 Len=0 TSval=3349162 TSecr=803486381
 84   0.015700 54.230.119.12 -> 172.31.8.238 TCP 5858 [TCP segment of a reassembled PDU]
 85   0.015705 172.31.8.238 -> 54.230.119.12 TCP 66 51358 > http [ACK] Seq=96 Ack=355828 Win=691200 Len=0 TSval=3349162 TSecr=803486381
 86   0.015850 54.230.119.12 -> 172.31.8.238 TCP 21786 [TCP segment of a reassembled PDU]
 87   0.015864 172.31.8.238 -> 54.230.119.12 TCP 66 51358 > http [ACK] Seq=96 Ack=377548 Win=734592 Len=0 TSval=3349162 TSecr=803486381
 88   0.016290 54.230.119.12 -> 172.31.8.238 TCP 18890 [TCP segment of a reassembled PDU]
 89   0.016302 172.31.8.238 -> 54.230.119.12 TCP 66 51358 > http [ACK] Seq=96 Ack=396372 Win=772224 Len=0 TSval=3349162 TSecr=803486381
 90   0.016421 54.230.119.12 -> 172.31.8.238 TCP 26130 [TCP segment of a reassembled PDU]
 91   0.016436 172.31.8.238 -> 54.230.119.12 TCP 66 51358 > http [ACK] Seq=96 Ack=422436 Win=824320 Len=0 TSval=3349162 TSecr=803486381
 92   0.016479 54.230.119.12 -> 172.31.8.238 TCP 15994 [TCP segment of a reassembled PDU]
 93   0.016489 172.31.8.238 -> 54.230.119.12 TCP 66 51358 > http [ACK] Seq=96 Ack=438364 Win=856192 Len=0 TSval=3349162 TSecr=803486381
 94   0.016534 54.230.119.12 -> 172.31.8.238 TCP 4410 [TCP segment of a reassembled PDU]
 95   0.016540 172.31.8.238 -> 54.230.119.12 TCP 66 51358 > http [ACK] Seq=96 Ack=442708 Win=864896 Len=0 TSval=3349162 TSecr=803486381
 96   0.016976 54.230.119.12 -> 172.31.8.238 TCP 4410 [TCP segment of a reassembled PDU]
 97   0.016992 172.31.8.238 -> 54.230.119.12 TCP 66 51358 > http [ACK] Seq=96 Ack=447052 Win=873600 Len=0 TSval=3349162 TSecr=803486381
 98   0.017151 54.230.119.12 -> 172.31.8.238 TCP 26130 [TCP segment of a reassembled PDU]
 99   0.017165 172.31.8.238 -> 54.230.119.12 TCP 66 51358 > http [ACK] Seq=96 Ack=473116 Win=925696 Len=0 TSval=3349162 TSecr=803486381
100   0.017229 54.230.119.12 -> 172.31.8.238 TCP 26130 [TCP segment of a reassembled PDU]
101   0.017244 172.31.8.238 -> 54.230.119.12 TCP 66 51358 > http [ACK] Seq=96 Ack=499180 Win=977920 Len=0 TSval=3349162 TSecr=803486381
102   0.017302 54.230.119.12 -> 172.31.8.238 TCP 8754 [TCP segment of a reassembled PDU]
103   0.017308 172.31.8.238 -> 54.230.119.12 TCP 66 51358 > http [ACK] Seq=96 Ack=507868 Win=995200 Len=0 TSval=3349162 TSecr=803486381
104   0.017731 54.230.119.12 -> 172.31.8.238 TCP 1514 [TCP segment of a reassembled PDU]
105   0.017736 172.31.8.238 -> 54.230.119.12 TCP 66 51358 > http [ACK] Seq=96 Ack=509316 Win=998144 Len=0 TSval=3349162 TSecr=803486382
106   0.017910 54.230.119.12 -> 172.31.8.238 TCP 26130 [TCP segment of a reassembled PDU]
107   0.017924 172.31.8.238 -> 54.230.119.12 TCP 66 51358 > http [ACK] Seq=96 Ack=535380 Win=1020416 Len=0 TSval=3349162 TSecr=803486382
108   0.017984 54.230.119.12 -> 172.31.8.238 TCP 24682 [TCP segment of a reassembled PDU]
109   0.017997 172.31.8.238 -> 54.230.119.12 TCP 66 51358 > http [ACK] Seq=96 Ack=559996 Win=1022848 Len=0 TSval=3349162 TSecr=803486382
110   0.018034 54.230.119.12 -> 172.31.8.238 TCP 2962 [TCP segment of a reassembled PDU]
111   0.018039 172.31.8.238 -> 54.230.119.12 TCP 66 51358 > http [ACK] Seq=96 Ack=562892 Win=1056000 Len=0 TSval=3349162 TSecr=803486382
112   0.018143 54.230.119.12 -> 172.31.8.238 TCP 10202 [TCP segment of a reassembled PDU]
113   0.018150 172.31.8.238 -> 54.230.119.12 TCP 66 51358 > http [ACK] Seq=96 Ack=573028 Win=1046656 Len=0 TSval=3349162 TSecr=803486382
114   0.018535 54.230.119.12 -> 172.31.8.238 TCP 1514 [TCP segment of a reassembled PDU]
115   0.018540 172.31.8.238 -> 54.230.119.12 TCP 66 51358 > http [ACK] Seq=96 Ack=574476 Win=1056768 Len=0 TSval=3349163 TSecr=803486382
116   0.018712 54.230.119.12 -> 172.31.8.238 TCP 26130 [TCP segment of a reassembled PDU]
117   0.018725 172.31.8.238 -> 54.230.119.12 TCP 66 51358 > http [ACK] Seq=96 Ack=600540 Win=1108864 Len=0 TSval=3349163 TSecr=803486382
118   0.018786 54.230.119.12 -> 172.31.8.238 TCP 21786 [TCP segment of a reassembled PDU]
119   0.018798 172.31.8.238 -> 54.230.119.12 TCP 66 51358 > http [ACK] Seq=96 Ack=622260 Win=1152384 Len=0 TSval=3349163 TSecr=803486382
120   0.018856 54.230.119.12 -> 172.31.8.238 TCP 15994 [TCP segment of a reassembled PDU]
121   0.018865 172.31.8.238 -> 54.230.119.12 TCP 66 51358 > http [ACK] Seq=96 Ack=638188 Win=1184128 Len=0 TSval=3349163 TSecr=803486382
122   0.019267 54.230.119.12 -> 172.31.8.238 TCP 2962 [TCP segment of a reassembled PDU]
123   0.019273 172.31.8.238 -> 54.230.119.12 TCP 66 51358 > http [ACK] Seq=96 Ack=641084 Win=1190016 Len=0 TSval=3349163 TSecr=803486382
124   0.019430 54.230.119.12 -> 172.31.8.238 TCP 26130 [TCP segment of a reassembled PDU]
125   0.019443 172.31.8.238 -> 54.230.119.12 TCP 66 51358 > http [ACK] Seq=96 Ack=667148 Win=1242112 Len=0 TSval=3349163 TSecr=803486382
126   0.019497 54.230.119.12 -> 172.31.8.238 TCP 17442 [TCP segment of a reassembled PDU]
127   0.019508 172.31.8.238 -> 54.230.119.12 TCP 66 51358 > http [ACK] Seq=96 Ack=684524 Win=1276800 Len=0 TSval=3349163 TSecr=803486382
128   0.019560 54.230.119.12 -> 172.31.8.238 TCP 11650 [TCP segment of a reassembled PDU]
129   0.019569 172.31.8.238 -> 54.230.119.12 TCP 66 51358 > http [ACK] Seq=96 Ack=696108 Win=1299968 Len=0 TSval=3349163 TSecr=803486382
130   0.019662 54.230.119.12 -> 172.31.8.238 TCP 7306 [TCP segment of a reassembled PDU]
131   0.019669 172.31.8.238 -> 54.230.119.12 TCP 66 51358 > http [ACK] Seq=96 Ack=703348 Win=1314560 Len=0 TSval=3349163 TSecr=803486382
132   0.020053 54.230.119.12 -> 172.31.8.238 TCP 7306 [TCP segment of a reassembled PDU]
133   0.020059 172.31.8.238 -> 54.230.119.12 TCP 66 51358 > http [ACK] Seq=96 Ack=710588 Win=1329024 Len=0 TSval=3349163 TSecr=803486382
134   0.020224 54.230.119.12 -> 172.31.8.238 TCP 26130 [TCP segment of a reassembled PDU]
135   0.020238 172.31.8.238 -> 54.230.119.12 TCP 66 51358 > http [ACK] Seq=96 Ack=736652 Win=1381120 Len=0 TSval=3349163 TSecr=803486382
136   0.020244 54.230.119.12 -> 172.31.8.238 TCP 1514 [TCP segment of a reassembled PDU]
137   0.020246 172.31.8.238 -> 54.230.119.12 TCP 66 51358 > http [ACK] Seq=96 Ack=738100 Win=1384064 Len=0 TSval=3349163 TSecr=803486382
138   0.020384 54.230.119.12 -> 172.31.8.238 TCP 5858 [TCP segment of a reassembled PDU]
139   0.020390 172.31.8.238 -> 54.230.119.12 TCP 66 51358 > http [ACK] Seq=96 Ack=743892 Win=1395584 Len=0 TSval=3349163 TSecr=803486382
140   0.020513 54.230.119.12 -> 172.31.8.238 TCP 26130 [TCP segment of a reassembled PDU]
141   0.020528 172.31.8.238 -> 54.230.119.12 TCP 66 51358 > http [ACK] Seq=96 Ack=769956 Win=1447680 Len=0 TSval=3349163 TSecr=803486382
142   0.020536 54.230.119.12 -> 172.31.8.238 TCP 2962 [TCP segment of a reassembled PDU]
143   0.020539 172.31.8.238 -> 54.230.119.12 TCP 66 51358 > http [ACK] Seq=96 Ack=772852 Win=1453568 Len=0 TSval=3349163 TSecr=803486382
144   0.020552 54.230.119.12 -> 172.31.8.238 TCP 23234 [TCP segment of a reassembled PDU]
145   0.020563 172.31.8.238 -> 54.230.119.12 TCP 66 51358 > http [ACK] Seq=96 Ack=796020 Win=1473024 Len=0 TSval=3349163 TSecr=803486382
146   0.020674 54.230.119.12 -> 172.31.8.238 TCP 10202 [TCP segment of a reassembled PDU]
147   0.020682 172.31.8.238 -> 54.230.119.12 TCP 66 51358 > http [ACK] Seq=96 Ack=806156 Win=1520128 Len=0 TSval=3349163 TSecr=803486382
148   0.020895 54.230.119.12 -> 172.31.8.238 TCP 10202 [TCP segment of a reassembled PDU]
149   0.020904 172.31.8.238 -> 54.230.119.12 TCP 66 51358 > http [ACK] Seq=96 Ack=816292 Win=1540352 Len=0 TSval=3349163 TSecr=803486382
150   0.021035 54.230.119.12 -> 172.31.8.238 TCP 17442 [TCP segment of a reassembled PDU]
151   0.021045 172.31.8.238 -> 54.230.119.12 TCP 66 51358 > http [ACK] Seq=96 Ack=833668 Win=1530240 Len=0 TSval=3349163 TSecr=803486382
152   0.021186 54.230.119.12 -> 172.31.8.238 TCP 24682 [TCP segment of a reassembled PDU]
153   0.021199 172.31.8.238 -> 54.230.119.12 TCP 66 51358 > http [ACK] Seq=96 Ack=858284 Win=1518336 Len=0 TSval=3349163 TSecr=803486382
154   0.021204 54.230.119.12 -> 172.31.8.238 TCP 1514 [TCP segment of a reassembled PDU]
155   0.021207 172.31.8.238 -> 54.230.119.12 TCP 66 51358 > http [ACK] Seq=96 Ack=859732 Win=1516928 Len=0 TSval=3349163 TSecr=803486382
156   0.021309 54.230.119.12 -> 172.31.8.238 TCP 15994 [TCP segment of a reassembled PDU]
157   0.021317 172.31.8.238 -> 54.230.119.12 TCP 66 51358 > http [ACK] Seq=96 Ack=875660 Win=1532544 Len=0 TSval=3349163 TSecr=803486382
158   0.021412 54.230.119.12 -> 172.31.8.238 TCP 4410 [TCP segment of a reassembled PDU]
159   0.021417 172.31.8.238 -> 54.230.119.12 TCP 66 51358 > http [ACK] Seq=96 Ack=880004 Win=1528320 Len=0 TSval=3349163 TSecr=803486382
160   0.021555 54.230.119.12 -> 172.31.8.238 TCP 18890 [TCP segment of a reassembled PDU]
161   0.021570 172.31.8.238 -> 54.230.119.12 TCP 66 51358 > http [ACK] Seq=96 Ack=898828 Win=1527808 Len=0 TSval=3349163 TSecr=803486382
162   0.021800 54.230.119.12 -> 172.31.8.238 TCP 21786 [TCP segment of a reassembled PDU]
163   0.021828 54.230.119.12 -> 172.31.8.238 TCP 4410 [TCP segment of a reassembled PDU]
164   0.021837 172.31.8.238 -> 54.230.119.12 TCP 66 51358 > http [ACK] Seq=96 Ack=924892 Win=1515904 Len=0 TSval=3349163 TSecr=803486382
165   0.021901 54.230.119.12 -> 172.31.8.238 TCP 26130 [TCP segment of a reassembled PDU]
166   0.021915 172.31.8.238 -> 54.230.119.12 TCP 66 51358 > http [ACK] Seq=96 Ack=950956 Win=1516032 Len=0 TSval=3349163 TSecr=803486382
167   0.021954 54.230.119.12 -> 172.31.8.238 TCP 7306 [TCP segment of a reassembled PDU]
168   0.021960 172.31.8.238 -> 54.230.119.12 TCP 66 51358 > http [ACK] Seq=96 Ack=958196 Win=1546880 Len=0 TSval=3349163 TSecr=803486382
169   0.022016 54.230.119.12 -> 172.31.8.238 TCP 5858 [TCP segment of a reassembled PDU]
170   0.022023 172.31.8.238 -> 54.230.119.12 TCP 66 51358 > http [ACK] Seq=96 Ack=963988 Win=1549312 Len=0 TSval=3349163 TSecr=803486382
171   0.022290 54.230.119.12 -> 172.31.8.238 TCP 18890 [TCP segment of a reassembled PDU]
172   0.022316 172.31.8.238 -> 54.230.119.12 TCP 66 51358 > http [ACK] Seq=96 Ack=982812 Win=1530496 Len=0 TSval=3349163 TSecr=803486382
173   0.022353 54.230.119.12 -> 172.31.8.238 TCP 7306 [TCP segment of a reassembled PDU]
174   0.022359 172.31.8.238 -> 54.230.119.12 TCP 66 51358 > http [ACK] Seq=96 Ack=990052 Win=1546880 Len=0 TSval=3349164 TSecr=803486382
175   0.022451 54.230.119.12 -> 172.31.8.238 TCP 33370 [TCP segment of a reassembled PDU]
176   0.022479 172.31.8.238 -> 54.230.119.12 TCP 66 51358 > http [ACK] Seq=96 Ack=1023356 Win=1513600 Len=0 TSval=3349164 TSecr=803486382
177   0.022721 54.230.119.12 -> 172.31.8.238 TCP 5858 [TCP segment of a reassembled PDU]
178   0.022728 172.31.8.238 -> 54.230.119.12 TCP 66 51358 > http [ACK] Seq=96 Ack=1029148 Win=1549312 Len=0 TSval=3349164 TSecr=803486382
179   0.022836 54.230.119.12 -> 172.31.8.238 HTTP 19951 HTTP/1.1 200 OK  (application/octet-stream)
180   0.022863 172.31.8.238 -> 54.230.119.12 TCP 66 51358 > http [ACK] Seq=96 Ack=1049033 Win=1529472 Len=0 TSval=3349164 TSecr=803486382
181   0.023007 172.31.8.238 -> 54.230.119.12 TCP 66 51358 > http [FIN, ACK] Seq=96 Ack=1049033 Win=1554816 Len=0 TSval=3349164 TSecr=803486382
182   0.023611 54.230.119.12 -> 172.31.8.238 TCP 66 http > 51358 [FIN, ACK] Seq=1049033 Ack=97 Win=14592 Len=0 TSval=803486382 TSecr=3349164
183   0.023619 172.31.8.238 -> 54.230.119.12 TCP 66 51358 > http [ACK] Seq=97 Ack=1049034 Win=1554816 Len=0 TSval=3349164 TSecr=803486382
