[Measurement for 1mb at 06:42:49 20.42.2014] 
Tshark:

  1   0.000000 172.31.8.238 -> 172.31.0.2   DNS 88 Standard query 0x0b3e  A dm53kc3eax57k.cloudfront.net
  2   0.000030 172.31.8.238 -> 172.31.0.2   DNS 88 Standard query 0x1371  AAAA dm53kc3eax57k.cloudfront.net
  3   0.000598   172.31.0.2 -> 172.31.8.238 DNS 216 Standard query response 0x0b3e  A 54.239.132.55 A 54.239.132.90 A 54.239.132.173 A 54.230.117.5 A 54.230.117.21 A 54.230.118.136 A 54.230.119.11 A 54.230.119.94
  4   0.000610   172.31.0.2 -> 172.31.8.238 DNS 175 Standard query response 0x1371 
  5   0.003871 172.31.8.238 -> 54.239.132.55 TCP 74 35830 > http [SYN] Seq=0 Win=26883 Len=0 MSS=8961 SACK_PERM=1 TSval=12349187 TSecr=0 WS=128
  6   0.004875 54.239.132.55 -> 172.31.8.238 TCP 74 http > 35830 [SYN, ACK] Seq=0 Ack=1 Win=14480 Len=0 MSS=1460 SACK_PERM=1 TSval=1686899177 TSecr=12349187 WS=128
  7   0.004891 172.31.8.238 -> 54.239.132.55 TCP 66 35830 > http [ACK] Seq=1 Ack=1 Win=27008 Len=0 TSval=12349187 TSecr=1686899177
  8   0.004934 172.31.8.238 -> 54.239.132.55 HTTP 161 GET /1mb HTTP/1.1 
  9   0.005393 54.239.132.55 -> 172.31.8.238 TCP 66 http > 35830 [ACK] Seq=1 Ack=96 Win=14592 Len=0 TSval=1686899178 TSecr=12349187
 10   0.007267 54.239.132.55 -> 172.31.8.238 TCP 523 [TCP segment of a reassembled PDU]
 11   0.007276 172.31.8.238 -> 54.239.132.55 TCP 66 35830 > http [ACK] Seq=96 Ack=458 Win=28032 Len=0 TSval=12349188 TSecr=1686899178
 12   0.007421 54.239.132.55 -> 172.31.8.238 TCP 13098 [TCP segment of a reassembled PDU]
 13   0.007432 172.31.8.238 -> 54.239.132.55 TCP 66 35830 > http [ACK] Seq=96 Ack=13490 Win=54144 Len=0 TSval=12349188 TSecr=1686899178
 14   0.008043 54.239.132.55 -> 172.31.8.238 TCP 5858 [TCP segment of a reassembled PDU]
 15   0.008050 172.31.8.238 -> 54.239.132.55 TCP 66 35830 > http [ACK] Seq=96 Ack=19282 Win=65664 Len=0 TSval=12349188 TSecr=1686899178
 16   0.008175 54.239.132.55 -> 172.31.8.238 TCP 7306 [TCP segment of a reassembled PDU]
 17   0.008182 172.31.8.238 -> 54.239.132.55 TCP 66 35830 > http [ACK] Seq=96 Ack=26522 Win=80128 Len=0 TSval=12349188 TSecr=1686899178
 18   0.008555 54.239.132.55 -> 172.31.8.238 TCP 4410 [TCP segment of a reassembled PDU]
 19   0.008562 172.31.8.238 -> 54.239.132.55 TCP 66 35830 > http [ACK] Seq=96 Ack=30866 Win=88832 Len=0 TSval=12349188 TSecr=1686899178
 20   0.008686 54.239.132.55 -> 172.31.8.238 TCP 7306 [TCP segment of a reassembled PDU]
 21   0.008693 172.31.8.238 -> 54.239.132.55 TCP 66 35830 > http [ACK] Seq=96 Ack=38106 Win=103296 Len=0 TSval=12349188 TSecr=1686899178
 22   0.008856 54.239.132.55 -> 172.31.8.238 TCP 8754 [TCP segment of a reassembled PDU]
 23   0.008864 172.31.8.238 -> 54.239.132.55 TCP 66 35830 > http [ACK] Seq=96 Ack=46794 Win=103680 Len=0 TSval=12349188 TSecr=1686899178
 24   0.009092 54.239.132.55 -> 172.31.8.238 TCP 5858 [TCP segment of a reassembled PDU]
 25   0.009099 172.31.8.238 -> 54.239.132.55 TCP 66 35830 > http [ACK] Seq=96 Ack=52586 Win=108416 Len=0 TSval=12349188 TSecr=1686899178
 26   0.009329 54.239.132.55 -> 172.31.8.238 TCP 8754 [TCP segment of a reassembled PDU]
 27   0.009336 172.31.8.238 -> 54.239.132.55 TCP 66 35830 > http [ACK] Seq=96 Ack=61274 Win=103680 Len=0 TSval=12349188 TSecr=1686899178
 28   0.009567 54.239.132.55 -> 172.31.8.238 TCP 4410 [TCP segment of a reassembled PDU]
 29   0.009573 172.31.8.238 -> 54.239.132.55 TCP 66 35830 > http [ACK] Seq=96 Ack=65618 Win=117760 Len=0 TSval=12349189 TSecr=1686899178
 30   0.009683 54.239.132.55 -> 172.31.8.238 TCP 13098 [TCP segment of a reassembled PDU]
 31   0.009692 172.31.8.238 -> 54.239.132.55 TCP 66 35830 > http [ACK] Seq=96 Ack=78650 Win=143872 Len=0 TSval=12349189 TSecr=1686899178
 32   0.009843 54.239.132.55 -> 172.31.8.238 TCP 10202 [TCP segment of a reassembled PDU]
 33   0.009851 172.31.8.238 -> 54.239.132.55 TCP 66 35830 > http [ACK] Seq=96 Ack=88786 Win=164096 Len=0 TSval=12349189 TSecr=1686899178
 34   0.010064 54.239.132.55 -> 172.31.8.238 TCP 2962 [TCP segment of a reassembled PDU]
 35   0.010070 172.31.8.238 -> 54.239.132.55 TCP 66 35830 > http [ACK] Seq=96 Ack=91682 Win=169856 Len=0 TSval=12349189 TSecr=1686899178
 36   0.010325 54.239.132.55 -> 172.31.8.238 TCP 4410 [TCP segment of a reassembled PDU]
 37   0.010331 172.31.8.238 -> 54.239.132.55 TCP 66 35830 > http [ACK] Seq=96 Ack=96026 Win=178560 Len=0 TSval=12349189 TSecr=1686899178
 38   0.010458 54.239.132.55 -> 172.31.8.238 TCP 21786 [TCP segment of a reassembled PDU]
 39   0.010470 172.31.8.238 -> 54.239.132.55 TCP 66 35830 > http [ACK] Seq=96 Ack=117746 Win=221952 Len=0 TSval=12349189 TSecr=1686899178
 40   0.010845 54.239.132.55 -> 172.31.8.238 TCP 5858 [TCP segment of a reassembled PDU]
 41   0.010852 172.31.8.238 -> 54.239.132.55 TCP 66 35830 > http [ACK] Seq=96 Ack=123538 Win=233600 Len=0 TSval=12349189 TSecr=1686899178
 42   0.010959 54.239.132.55 -> 172.31.8.238 TCP 7306 [TCP segment of a reassembled PDU]
 43   0.010967 172.31.8.238 -> 54.239.132.55 TCP 66 35830 > http [ACK] Seq=96 Ack=130778 Win=248064 Len=0 TSval=12349189 TSecr=1686899178
 44   0.011142 54.239.132.55 -> 172.31.8.238 TCP 13098 [TCP segment of a reassembled PDU]
 45   0.011151 172.31.8.238 -> 54.239.132.55 TCP 66 35830 > http [ACK] Seq=96 Ack=143810 Win=274176 Len=0 TSval=12349189 TSecr=1686899178
 46   0.011429 54.239.132.55 -> 172.31.8.238 TCP 13098 [TCP segment of a reassembled PDU]
 47   0.011439 172.31.8.238 -> 54.239.132.55 TCP 66 35830 > http [ACK] Seq=96 Ack=156842 Win=300160 Len=0 TSval=12349189 TSecr=1686899178
 48   0.011733 54.239.132.55 -> 172.31.8.238 TCP 13098 [TCP segment of a reassembled PDU]
 49   0.011743 172.31.8.238 -> 54.239.132.55 TCP 66 35830 > http [ACK] Seq=96 Ack=169874 Win=326272 Len=0 TSval=12349189 TSecr=1686899178
 50   0.011794 54.239.132.55 -> 172.31.8.238 TCP 13098 [TCP segment of a reassembled PDU]
 51   0.011803 172.31.8.238 -> 54.239.132.55 TCP 66 35830 > http [ACK] Seq=96 Ack=182906 Win=352384 Len=0 TSval=12349189 TSecr=1686899178
 52   0.012133 54.239.132.55 -> 172.31.8.238 TCP 2962 [TCP segment of a reassembled PDU]
 53   0.012138 172.31.8.238 -> 54.239.132.55 TCP 66 35830 > http [ACK] Seq=96 Ack=185802 Win=358144 Len=0 TSval=12349189 TSecr=1686899178
 54   0.012265 54.239.132.55 -> 172.31.8.238 TCP 10202 [TCP segment of a reassembled PDU]
 55   0.012272 172.31.8.238 -> 54.239.132.55 TCP 66 35830 > http [ACK] Seq=96 Ack=195938 Win=378368 Len=0 TSval=12349189 TSecr=1686899178
 56   0.012359 54.239.132.55 -> 172.31.8.238 TCP 2962 [TCP segment of a reassembled PDU]
 57   0.012364 172.31.8.238 -> 54.239.132.55 TCP 66 35830 > http [ACK] Seq=96 Ack=198834 Win=384128 Len=0 TSval=12349189 TSecr=1686899178
 58   0.012508 54.239.132.55 -> 172.31.8.238 TCP 14546 [TCP segment of a reassembled PDU]
 59   0.012517 172.31.8.238 -> 54.239.132.55 TCP 66 35830 > http [ACK] Seq=96 Ack=213314 Win=413184 Len=0 TSval=12349189 TSecr=1686899178
 60   0.012757 54.239.132.55 -> 172.31.8.238 TCP 18890 [TCP segment of a reassembled PDU]
 61   0.012768 172.31.8.238 -> 54.239.132.55 TCP 66 35830 > http [ACK] Seq=96 Ack=232138 Win=446592 Len=0 TSval=12349189 TSecr=1686899178
 62   0.013168 54.239.132.55 -> 172.31.8.238 TCP 4410 [TCP segment of a reassembled PDU]
 63   0.013174 172.31.8.238 -> 54.239.132.55 TCP 66 35830 > http [ACK] Seq=96 Ack=236482 Win=459520 Len=0 TSval=12349189 TSecr=1686899178
 64   0.013318 54.239.132.55 -> 172.31.8.238 TCP 13098 [TCP segment of a reassembled PDU]
 65   0.013326 172.31.8.238 -> 54.239.132.55 TCP 66 35830 > http [ACK] Seq=96 Ack=249514 Win=456192 Len=0 TSval=12349189 TSecr=1686899178
 66   0.013463 54.239.132.55 -> 172.31.8.238 TCP 18890 [TCP segment of a reassembled PDU]
 67   0.013474 172.31.8.238 -> 54.239.132.55 TCP 66 35830 > http [ACK] Seq=96 Ack=268338 Win=497152 Len=0 TSval=12349190 TSecr=1686899178
 68   0.013579 54.239.132.55 -> 172.31.8.238 TCP 15994 [TCP segment of a reassembled PDU]
 69   0.013589 172.31.8.238 -> 54.239.132.55 TCP 66 35830 > http [ACK] Seq=96 Ack=284266 Win=529024 Len=0 TSval=12349190 TSecr=1686899178
 70   0.013919 54.239.132.55 -> 172.31.8.238 TCP 4410 [TCP segment of a reassembled PDU]
 71   0.013926 172.31.8.238 -> 54.239.132.55 TCP 66 35830 > http [ACK] Seq=96 Ack=288610 Win=537728 Len=0 TSval=12349190 TSecr=1686899178
 72   0.014118 54.239.132.55 -> 172.31.8.238 TCP 14546 [TCP segment of a reassembled PDU]
 73   0.014127 172.31.8.238 -> 54.239.132.55 TCP 66 35830 > http [ACK] Seq=96 Ack=303090 Win=566656 Len=0 TSval=12349190 TSecr=1686899178
 74   0.014245 54.239.132.55 -> 172.31.8.238 TCP 5858 [TCP segment of a reassembled PDU]
 75   0.014252 172.31.8.238 -> 54.239.132.55 TCP 66 35830 > http [ACK] Seq=96 Ack=308882 Win=578176 Len=0 TSval=12349190 TSecr=1686899178
 76   0.014423 54.239.132.55 -> 172.31.8.238 TCP 15994 [TCP segment of a reassembled PDU]
 77   0.014433 172.31.8.238 -> 54.239.132.55 TCP 66 35830 > http [ACK] Seq=96 Ack=324810 Win=610048 Len=0 TSval=12349190 TSecr=1686899178
 78   0.014602 54.239.132.55 -> 172.31.8.238 TCP 21786 [TCP segment of a reassembled PDU]
 79   0.014615 172.31.8.238 -> 54.239.132.55 TCP 66 35830 > http [ACK] Seq=96 Ack=346530 Win=653568 Len=0 TSval=12349190 TSecr=1686899178
 80   0.014638 54.239.132.55 -> 172.31.8.238 TCP 1514 [TCP segment of a reassembled PDU]
 81   0.014641 172.31.8.238 -> 54.239.132.55 TCP 66 35830 > http [ACK] Seq=96 Ack=347978 Win=656384 Len=0 TSval=12349190 TSecr=1686899178
 82   0.014803 54.239.132.55 -> 172.31.8.238 TCP 8754 [TCP segment of a reassembled PDU]
 83   0.014810 172.31.8.238 -> 54.239.132.55 TCP 66 35830 > http [ACK] Seq=96 Ack=356666 Win=673792 Len=0 TSval=12349190 TSecr=1686899179
 84   0.015024 54.239.132.55 -> 172.31.8.238 TCP 23234 [TCP segment of a reassembled PDU]
 85   0.015037 172.31.8.238 -> 54.239.132.55 TCP 66 35830 > http [ACK] Seq=96 Ack=379834 Win=720128 Len=0 TSval=12349190 TSecr=1686899179
 86   0.015154 54.239.132.55 -> 172.31.8.238 TCP 8754 [TCP segment of a reassembled PDU]
 87   0.015161 172.31.8.238 -> 54.239.132.55 TCP 66 35830 > http [ACK] Seq=96 Ack=388522 Win=737536 Len=0 TSval=12349190 TSecr=1686899179
 88   0.015289 54.239.132.55 -> 172.31.8.238 TCP 20338 [TCP segment of a reassembled PDU]
 89   0.015301 172.31.8.238 -> 54.239.132.55 TCP 66 35830 > http [ACK] Seq=96 Ack=408794 Win=777984 Len=0 TSval=12349190 TSecr=1686899179
 90   0.015319 54.239.132.55 -> 172.31.8.238 TCP 1514 [TCP segment of a reassembled PDU]
 91   0.015327 172.31.8.238 -> 54.239.132.55 TCP 66 35830 > http [ACK] Seq=96 Ack=410242 Win=780928 Len=0 TSval=12349190 TSecr=1686899179
 92   0.015385 54.239.132.55 -> 172.31.8.238 TCP 1514 [TCP segment of a reassembled PDU]
 93   0.015389 172.31.8.238 -> 54.239.132.55 TCP 66 35830 > http [ACK] Seq=96 Ack=411690 Win=783872 Len=0 TSval=12349190 TSecr=1686899179
 94   0.015520 54.239.132.55 -> 172.31.8.238 TCP 10202 [TCP segment of a reassembled PDU]
 95   0.015531 172.31.8.238 -> 54.239.132.55 TCP 66 35830 > http [ACK] Seq=96 Ack=421826 Win=804096 Len=0 TSval=12349190 TSecr=1686899179
 96   0.015883 54.239.132.55 -> 172.31.8.238 TCP 26130 [TCP segment of a reassembled PDU]
 97   0.015897 172.31.8.238 -> 54.239.132.55 TCP 66 35830 > http [ACK] Seq=96 Ack=447890 Win=856192 Len=0 TSval=12349190 TSecr=1686899179
 98   0.015903 54.239.132.55 -> 172.31.8.238 TCP 1514 [TCP segment of a reassembled PDU]
 99   0.015905 172.31.8.238 -> 54.239.132.55 TCP 66 35830 > http [ACK] Seq=96 Ack=449338 Win=859136 Len=0 TSval=12349190 TSecr=1686899179
100   0.016087 54.239.132.55 -> 172.31.8.238 TCP 10202 [TCP segment of a reassembled PDU]
101   0.016095 172.31.8.238 -> 54.239.132.55 TCP 66 35830 > http [ACK] Seq=96 Ack=459474 Win=879360 Len=0 TSval=12349190 TSecr=1686899179
102   0.016160 54.239.132.55 -> 172.31.8.238 TCP 26130 [TCP segment of a reassembled PDU]
103   0.016174 172.31.8.238 -> 54.239.132.55 TCP 66 35830 > http [ACK] Seq=96 Ack=485538 Win=931584 Len=0 TSval=12349190 TSecr=1686899179
104   0.016210 54.239.132.55 -> 172.31.8.238 TCP 1514 [TCP segment of a reassembled PDU]
105   0.016214 172.31.8.238 -> 54.239.132.55 TCP 66 35830 > http [ACK] Seq=96 Ack=486986 Win=934400 Len=0 TSval=12349190 TSecr=1686899179
106   0.016482 54.239.132.55 -> 172.31.8.238 TCP 4410 [TCP segment of a reassembled PDU]
107   0.016488 172.31.8.238 -> 54.239.132.55 TCP 66 35830 > http [ACK] Seq=96 Ack=491330 Win=943104 Len=0 TSval=12349190 TSecr=1686899179
108   0.016648 54.239.132.55 -> 172.31.8.238 TCP 26130 [TCP segment of a reassembled PDU]
109   0.016662 172.31.8.238 -> 54.239.132.55 TCP 66 35830 > http [ACK] Seq=96 Ack=517394 Win=995200 Len=0 TSval=12349190 TSecr=1686899179
110   0.016687 54.239.132.55 -> 172.31.8.238 TCP 8754 [TCP segment of a reassembled PDU]
111   0.016695 172.31.8.238 -> 54.239.132.55 TCP 66 35830 > http [ACK] Seq=96 Ack=526082 Win=988032 Len=0 TSval=12349190 TSecr=1686899179
112   0.016755 54.239.132.55 -> 172.31.8.238 TCP 8754 [TCP segment of a reassembled PDU]
113   0.016763 172.31.8.238 -> 54.239.132.55 TCP 66 35830 > http [ACK] Seq=96 Ack=534770 Win=1012608 Len=0 TSval=12349190 TSecr=1686899179
114   0.016892 54.239.132.55 -> 172.31.8.238 TCP 17442 [TCP segment of a reassembled PDU]
115   0.016903 172.31.8.238 -> 54.239.132.55 TCP 66 35830 > http [ACK] Seq=96 Ack=552146 Win=1016576 Len=0 TSval=12349190 TSecr=1686899179
116   0.017236 54.239.132.55 -> 172.31.8.238 TCP 2962 [TCP segment of a reassembled PDU]
117   0.017241 172.31.8.238 -> 54.239.132.55 TCP 66 35830 > http [ACK] Seq=96 Ack=555042 Win=1039360 Len=0 TSval=12349190 TSecr=1686899179
118   0.017430 54.239.132.55 -> 172.31.8.238 TCP 24682 [TCP segment of a reassembled PDU]
119   0.017443 172.31.8.238 -> 54.239.132.55 TCP 66 35830 > http [ACK] Seq=96 Ack=579658 Win=1014784 Len=0 TSval=12349191 TSecr=1686899179
120   0.017565 54.239.132.55 -> 172.31.8.238 TCP 27578 [TCP segment of a reassembled PDU]
121   0.017580 172.31.8.238 -> 54.239.132.55 TCP 66 35830 > http [ACK] Seq=96 Ack=607170 Win=1094400 Len=0 TSval=12349191 TSecr=1686899179
122   0.017589 54.239.132.55 -> 172.31.8.238 TCP 10202 [TCP segment of a reassembled PDU]
123   0.017594 172.31.8.238 -> 54.239.132.55 TCP 66 35830 > http [ACK] Seq=96 Ack=617306 Win=1114624 Len=0 TSval=12349191 TSecr=1686899179
124   0.018001 54.239.132.55 -> 172.31.8.238 TCP 4410 [TCP segment of a reassembled PDU]
125   0.018008 172.31.8.238 -> 54.239.132.55 TCP 66 35830 > http [ACK] Seq=96 Ack=621650 Win=1123328 Len=0 TSval=12349191 TSecr=1686899179
126   0.018175 54.239.132.55 -> 172.31.8.238 TCP 20338 [TCP segment of a reassembled PDU]
127   0.018186 172.31.8.238 -> 54.239.132.55 TCP 66 35830 > http [ACK] Seq=96 Ack=641922 Win=1163904 Len=0 TSval=12349191 TSecr=1686899179
128   0.018205 54.239.132.55 -> 172.31.8.238 TCP 5858 [TCP segment of a reassembled PDU]
129   0.018210 172.31.8.238 -> 54.239.132.55 TCP 66 35830 > http [ACK] Seq=96 Ack=647714 Win=1175552 Len=0 TSval=12349191 TSecr=1686899179
130   0.018301 54.239.132.55 -> 172.31.8.238 TCP 26130 [TCP segment of a reassembled PDU]
131   0.018314 172.31.8.238 -> 54.239.132.55 TCP 66 35830 > http [ACK] Seq=96 Ack=673778 Win=1227648 Len=0 TSval=12349191 TSecr=1686899179
132   0.018347 54.239.132.55 -> 172.31.8.238 TCP 8754 [TCP segment of a reassembled PDU]
133   0.018355 172.31.8.238 -> 54.239.132.55 TCP 66 35830 > http [ACK] Seq=96 Ack=682466 Win=1245056 Len=0 TSval=12349191 TSecr=1686899179
134   0.018764 54.239.132.55 -> 172.31.8.238 TCP 2962 [TCP segment of a reassembled PDU]
135   0.018770 172.31.8.238 -> 54.239.132.55 TCP 66 35830 > http [ACK] Seq=96 Ack=685362 Win=1250816 Len=0 TSval=12349191 TSecr=1686899179
136   0.018948 54.239.132.55 -> 172.31.8.238 TCP 18890 [TCP segment of a reassembled PDU]
137   0.018959 172.31.8.238 -> 54.239.132.55 TCP 66 35830 > http [ACK] Seq=96 Ack=704186 Win=1288448 Len=0 TSval=12349191 TSecr=1686899179
138   0.018996 54.239.132.55 -> 172.31.8.238 TCP 7306 [TCP segment of a reassembled PDU]
139   0.019002 172.31.8.238 -> 54.239.132.55 TCP 66 35830 > http [ACK] Seq=96 Ack=711426 Win=1302912 Len=0 TSval=12349191 TSecr=1686899179
140   0.019089 54.239.132.55 -> 172.31.8.238 TCP 26130 [TCP segment of a reassembled PDU]
141   0.019102 172.31.8.238 -> 54.239.132.55 TCP 66 35830 > http [ACK] Seq=96 Ack=737490 Win=1355008 Len=0 TSval=12349191 TSecr=1686899179
142   0.019179 54.239.132.55 -> 172.31.8.238 TCP 26130 [TCP segment of a reassembled PDU]
143   0.019193 172.31.8.238 -> 54.239.132.55 TCP 66 35830 > http [ACK] Seq=96 Ack=763554 Win=1407232 Len=0 TSval=12349191 TSecr=1686899179
144   0.019250 54.239.132.55 -> 172.31.8.238 TCP 23234 [TCP segment of a reassembled PDU]
145   0.019263 172.31.8.238 -> 54.239.132.55 TCP 66 35830 > http [ACK] Seq=96 Ack=786722 Win=1453056 Len=0 TSval=12349191 TSecr=1686899179
146   0.019653 54.239.132.55 -> 172.31.8.238 TCP 2962 [TCP segment of a reassembled PDU]
147   0.019659 172.31.8.238 -> 54.239.132.55 TCP 66 35830 > http [ACK] Seq=96 Ack=789618 Win=1459328 Len=0 TSval=12349191 TSecr=1686899179
148   0.019817 54.239.132.55 -> 172.31.8.238 TCP 23234 [TCP segment of a reassembled PDU]
149   0.019830 172.31.8.238 -> 54.239.132.55 TCP 66 35830 > http [ACK] Seq=96 Ack=812786 Win=1505664 Len=0 TSval=12349191 TSecr=1686899179
150   0.019917 54.239.132.55 -> 172.31.8.238 TCP 4410 [TCP segment of a reassembled PDU]
151   0.019923 172.31.8.238 -> 54.239.132.55 TCP 66 35830 > http [ACK] Seq=96 Ack=817130 Win=1514368 Len=0 TSval=12349191 TSecr=1686899179
152   0.020085 54.239.132.55 -> 172.31.8.238 TCP 26130 [TCP segment of a reassembled PDU]
153   0.020098 172.31.8.238 -> 54.239.132.55 TCP 66 35830 > http [ACK] Seq=96 Ack=843194 Win=1534080 Len=0 TSval=12349191 TSecr=1686899179
154   0.020163 54.239.132.55 -> 172.31.8.238 TCP 26130 [TCP segment of a reassembled PDU]
155   0.020176 172.31.8.238 -> 54.239.132.55 TCP 66 35830 > http [ACK] Seq=96 Ack=869258 Win=1534080 Len=0 TSval=12349191 TSecr=1686899179
156   0.020218 54.239.132.55 -> 172.31.8.238 TCP 8754 [TCP segment of a reassembled PDU]
157   0.020225 172.31.8.238 -> 54.239.132.55 TCP 66 35830 > http [ACK] Seq=96 Ack=877946 Win=1525504 Len=0 TSval=12349191 TSecr=1686899179
158   0.020522 54.239.132.55 -> 172.31.8.238 TCP 20338 [TCP segment of a reassembled PDU]
159   0.020535 172.31.8.238 -> 54.239.132.55 TCP 66 35830 > http [ACK] Seq=96 Ack=898218 Win=1543552 Len=0 TSval=12349191 TSecr=1686899179
160   0.020691 54.239.132.55 -> 172.31.8.238 TCP 26130 [TCP segment of a reassembled PDU]
161   0.020704 172.31.8.238 -> 54.239.132.55 TCP 66 35830 > http [ACK] Seq=96 Ack=924282 Win=1534080 Len=0 TSval=12349191 TSecr=1686899179
162   0.020747 54.239.132.55 -> 172.31.8.238 TCP 18890 [TCP segment of a reassembled PDU]
163   0.020758 172.31.8.238 -> 54.239.132.55 TCP 66 35830 > http [ACK] Seq=96 Ack=943106 Win=1545856 Len=0 TSval=12349191 TSecr=1686899179
164   0.020931 54.239.132.55 -> 172.31.8.238 TCP 15994 [TCP segment of a reassembled PDU]
165   0.020942 172.31.8.238 -> 54.239.132.55 TCP 66 35830 > http [ACK] Seq=96 Ack=959034 Win=1550592 Len=0 TSval=12349191 TSecr=1686899179
166   0.021138 54.239.132.55 -> 172.31.8.238 TCP 14546 [TCP segment of a reassembled PDU]
167   0.021148 172.31.8.238 -> 54.239.132.55 TCP 66 35830 > http [ACK] Seq=96 Ack=973514 Win=1553024 Len=0 TSval=12349191 TSecr=1686899179
168   0.021286 54.239.132.55 -> 172.31.8.238 TCP 34818 [TCP segment of a reassembled PDU]
169   0.021303 172.31.8.238 -> 54.239.132.55 TCP 66 35830 > http [ACK] Seq=96 Ack=1008266 Win=1519744 Len=0 TSval=12349191 TSecr=1686899179
170   0.021458 54.239.132.55 -> 172.31.8.238 TCP 4410 [TCP segment of a reassembled PDU]
171   0.021464 172.31.8.238 -> 54.239.132.55 TCP 66 35830 > http [ACK] Seq=96 Ack=1012610 Win=1569664 Len=0 TSval=12349192 TSecr=1686899179
172   0.021710 54.239.132.55 -> 172.31.8.238 TCP 23234 [TCP segment of a reassembled PDU]
173   0.021738 54.239.132.55 -> 172.31.8.238 TCP 2962 [TCP segment of a reassembled PDU]
174   0.021743 172.31.8.238 -> 54.239.132.55 TCP 66 35830 > http [ACK] Seq=96 Ack=1035778 Win=1546496 Len=0 TSval=12349192 TSecr=1686899179
175   0.021756 172.31.8.238 -> 54.239.132.55 TCP 66 35830 > http [ACK] Seq=96 Ack=1038674 Win=1574016 Len=0 TSval=12349192 TSecr=1686899179
176   0.021787 54.239.132.55 -> 172.31.8.238 HTTP 10426 HTTP/1.1 200 OK  (application/octet-stream)
177   0.021809 172.31.8.238 -> 54.239.132.55 TCP 66 35830 > http [ACK] Seq=96 Ack=1049034 Win=1574016 Len=0 TSval=12349192 TSecr=1686899179
178   0.021952 172.31.8.238 -> 54.239.132.55 TCP 66 35830 > http [FIN, ACK] Seq=96 Ack=1049034 Win=1574016 Len=0 TSval=12349192 TSecr=1686899179
179   0.022724 54.239.132.55 -> 172.31.8.238 TCP 66 http > 35830 [FIN, ACK] Seq=1049034 Ack=97 Win=14592 Len=0 TSval=1686899179 TSecr=12349192
180   0.022733 172.31.8.238 -> 54.239.132.55 TCP 66 35830 > http [ACK] Seq=97 Ack=1049035 Win=1574016 Len=0 TSval=12349192 TSecr=1686899179
