[Measurement for 1mb at 23:42:48 19.42.2014] 
Tshark:

  1   0.000000 172.31.8.238 -> 172.31.0.2   DNS 88 Standard query 0x02db  A dm53kc3eax57k.cloudfront.net
  2   0.000028 172.31.8.238 -> 172.31.0.2   DNS 88 Standard query 0x2ec2  AAAA dm53kc3eax57k.cloudfront.net
  3   0.000583   172.31.0.2 -> 172.31.8.238 DNS 175 Standard query response 0x2ec2 
  4   0.000593   172.31.0.2 -> 172.31.8.238 DNS 216 Standard query response 0x02db  A 54.230.116.73 A 54.230.117.86 A 54.230.117.198 A 54.230.119.125 A 54.239.132.83 A 54.239.132.249 A 54.192.118.222 A 54.192.118.240
  5   0.003887 172.31.8.238 -> 54.230.116.73 TCP 74 34184 > http [SYN] Seq=0 Win=26883 Len=0 MSS=8961 SACK_PERM=1 TSval=6049148 TSecr=0 WS=128
  6   0.004569 54.230.116.73 -> 172.31.8.238 TCP 74 http > 34184 [SYN, ACK] Seq=0 Ack=1 Win=14480 Len=0 MSS=1460 SACK_PERM=1 TSval=1682431225 TSecr=6049148 WS=128
  7   0.004583 172.31.8.238 -> 54.230.116.73 TCP 66 34184 > http [ACK] Seq=1 Ack=1 Win=27008 Len=0 TSval=6049148 TSecr=1682431225
  8   0.004624 172.31.8.238 -> 54.230.116.73 HTTP 161 GET /1mb HTTP/1.1 
  9   0.005040 54.230.116.73 -> 172.31.8.238 TCP 66 http > 34184 [ACK] Seq=1 Ack=96 Win=14592 Len=0 TSval=1682431225 TSecr=6049148
 10   0.006389 54.230.116.73 -> 172.31.8.238 TCP 2580 [TCP segment of a reassembled PDU]
 11   0.006397 172.31.8.238 -> 54.230.116.73 TCP 66 34184 > http [ACK] Seq=96 Ack=2515 Win=32000 Len=0 TSval=6049149 TSecr=1682431225
 12   0.006521 54.230.116.73 -> 172.31.8.238 TCP 11650 [TCP segment of a reassembled PDU]
 13   0.006532 172.31.8.238 -> 54.230.116.73 TCP 66 34184 > http [ACK] Seq=96 Ack=14099 Win=55168 Len=0 TSval=6049149 TSecr=1682431225
 14   0.007163 54.230.116.73 -> 172.31.8.238 TCP 7306 [TCP segment of a reassembled PDU]
 15   0.007170 172.31.8.238 -> 54.230.116.73 TCP 66 34184 > http [ACK] Seq=96 Ack=21339 Win=69632 Len=0 TSval=6049149 TSecr=1682431225
 16   0.007262 54.230.116.73 -> 172.31.8.238 TCP 5858 [TCP segment of a reassembled PDU]
 17   0.007269 172.31.8.238 -> 54.230.116.73 TCP 66 34184 > http [ACK] Seq=96 Ack=27131 Win=81152 Len=0 TSval=6049149 TSecr=1682431225
 18   0.007691 54.230.116.73 -> 172.31.8.238 TCP 11650 [TCP segment of a reassembled PDU]
 19   0.007700 172.31.8.238 -> 54.230.116.73 TCP 66 34184 > http [ACK] Seq=96 Ack=38715 Win=98944 Len=0 TSval=6049149 TSecr=1682431225
 20   0.007769 54.230.116.73 -> 172.31.8.238 TCP 1514 [TCP segment of a reassembled PDU]
 21   0.007774 172.31.8.238 -> 54.230.116.73 TCP 66 34184 > http [ACK] Seq=96 Ack=40163 Win=107264 Len=0 TSval=6049149 TSecr=1682431225
 22   0.007893 54.230.116.73 -> 172.31.8.238 TCP 7306 [TCP segment of a reassembled PDU]
 23   0.007900 172.31.8.238 -> 54.230.116.73 TCP 66 34184 > http [ACK] Seq=96 Ack=47403 Win=105984 Len=0 TSval=6049149 TSecr=1682431225
 24   0.008169 54.230.116.73 -> 172.31.8.238 TCP 1514 [TCP segment of a reassembled PDU]
 25   0.008173 172.31.8.238 -> 54.230.116.73 TCP 66 34184 > http [ACK] Seq=96 Ack=48851 Win=109056 Len=0 TSval=6049149 TSecr=1682431225
 26   0.008266 54.230.116.73 -> 172.31.8.238 TCP 11650 [TCP segment of a reassembled PDU]
 27   0.008272 172.31.8.238 -> 54.230.116.73 TCP 66 34184 > http [ACK] Seq=96 Ack=60435 Win=98944 Len=0 TSval=6049149 TSecr=1682431225
 28   0.008438 54.230.116.73 -> 172.31.8.238 TCP 5858 [TCP segment of a reassembled PDU]
 29   0.008445 172.31.8.238 -> 54.230.116.73 TCP 66 34184 > http [ACK] Seq=96 Ack=66227 Win=108416 Len=0 TSval=6049149 TSecr=1682431225
 30   0.008770 54.230.116.73 -> 172.31.8.238 TCP 5858 [TCP segment of a reassembled PDU]
 31   0.008777 172.31.8.238 -> 54.230.116.73 TCP 66 34184 > http [ACK] Seq=96 Ack=72019 Win=108416 Len=0 TSval=6049149 TSecr=1682431225
 32   0.008863 54.230.116.73 -> 172.31.8.238 TCP 2962 [TCP segment of a reassembled PDU]
 33   0.008868 172.31.8.238 -> 54.230.116.73 TCP 66 34184 > http [ACK] Seq=96 Ack=74915 Win=109056 Len=0 TSval=6049149 TSecr=1682431225
 34   0.008952 54.230.116.73 -> 172.31.8.238 TCP 2962 [TCP segment of a reassembled PDU]
 35   0.008970 172.31.8.238 -> 54.230.116.73 TCP 66 34184 > http [ACK] Seq=96 Ack=77811 Win=109056 Len=0 TSval=6049149 TSecr=1682431225
 36   0.009064 54.230.116.73 -> 172.31.8.238 TCP 17442 [TCP segment of a reassembled PDU]
 37   0.009075 172.31.8.238 -> 54.230.116.73 TCP 66 34184 > http [ACK] Seq=96 Ack=95187 Win=91776 Len=0 TSval=6049149 TSecr=1682431225
 38   0.009429 54.230.116.73 -> 172.31.8.238 TCP 4410 [TCP segment of a reassembled PDU]
 39   0.009434 172.31.8.238 -> 54.230.116.73 TCP 66 34184 > http [ACK] Seq=96 Ack=99531 Win=109056 Len=0 TSval=6049149 TSecr=1682431225
 40   0.009522 54.230.116.73 -> 172.31.8.238 TCP 11650 [TCP segment of a reassembled PDU]
 41   0.009546 172.31.8.238 -> 54.230.116.73 TCP 66 34184 > http [ACK] Seq=96 Ack=111115 Win=109056 Len=0 TSval=6049149 TSecr=1682431225
 42   0.009680 54.230.116.73 -> 172.31.8.238 TCP 1514 [TCP segment of a reassembled PDU]
 43   0.009877 54.230.116.73 -> 172.31.8.238 TCP 14546 [TCP segment of a reassembled PDU]
 44   0.010132 172.31.8.238 -> 54.230.116.73 TCP 66 34184 > http [ACK] Seq=96 Ack=127043 Win=109056 Len=0 TSval=6049149 TSecr=1682431225
 45   0.010219 54.230.116.73 -> 172.31.8.238 TCP 2962 [TCP segment of a reassembled PDU]
 46   0.010225 172.31.8.238 -> 54.230.116.73 TCP 66 34184 > http [ACK] Seq=96 Ack=129939 Win=109056 Len=0 TSval=6049150 TSecr=1682431225
 47   0.010318 54.230.116.73 -> 172.31.8.238 TCP 13098 [TCP segment of a reassembled PDU]
 48   0.010340 172.31.8.238 -> 54.230.116.73 TCP 66 34184 > http [ACK] Seq=96 Ack=142971 Win=135168 Len=0 TSval=6049150 TSecr=1682431225
 49   0.010721 54.230.116.73 -> 172.31.8.238 TCP 11650 [TCP segment of a reassembled PDU]
 50   0.010730 172.31.8.238 -> 54.230.116.73 TCP 66 34184 > http [ACK] Seq=96 Ack=154555 Win=158336 Len=0 TSval=6049150 TSecr=1682431225
 51   0.010821 54.230.116.73 -> 172.31.8.238 TCP 4410 [TCP segment of a reassembled PDU]
 52   0.010827 172.31.8.238 -> 54.230.116.73 TCP 66 34184 > http [ACK] Seq=96 Ack=158899 Win=167040 Len=0 TSval=6049150 TSecr=1682431225
 53   0.011060 54.230.116.73 -> 172.31.8.238 TCP 26130 [TCP segment of a reassembled PDU]
 54   0.011075 172.31.8.238 -> 54.230.116.73 TCP 66 34184 > http [ACK] Seq=96 Ack=184963 Win=219136 Len=0 TSval=6049150 TSecr=1682431225
 55   0.011196 54.230.116.73 -> 172.31.8.238 TCP 1514 [TCP segment of a reassembled PDU]
 56   0.011201 172.31.8.238 -> 54.230.116.73 TCP 66 34184 > http [ACK] Seq=96 Ack=186411 Win=221952 Len=0 TSval=6049150 TSecr=1682431225
 57   0.011507 54.230.116.73 -> 172.31.8.238 TCP 10202 [TCP segment of a reassembled PDU]
 58   0.011515 172.31.8.238 -> 54.230.116.73 TCP 66 34184 > http [ACK] Seq=96 Ack=196547 Win=242304 Len=0 TSval=6049150 TSecr=1682431225
 59   0.011596 54.230.116.73 -> 172.31.8.238 TCP 7306 [TCP segment of a reassembled PDU]
 60   0.011603 172.31.8.238 -> 54.230.116.73 TCP 66 34184 > http [ACK] Seq=96 Ack=203787 Win=256768 Len=0 TSval=6049150 TSecr=1682431225
 61   0.011822 54.230.116.73 -> 172.31.8.238 TCP 26130 [TCP segment of a reassembled PDU]
 62   0.011837 172.31.8.238 -> 54.230.116.73 TCP 66 34184 > http [ACK] Seq=96 Ack=229851 Win=308864 Len=0 TSval=6049150 TSecr=1682431225
 63   0.011843 54.230.116.73 -> 172.31.8.238 TCP 1514 [TCP segment of a reassembled PDU]
 64   0.011846 172.31.8.238 -> 54.230.116.73 TCP 66 34184 > http [ACK] Seq=96 Ack=231299 Win=311808 Len=0 TSval=6049150 TSecr=1682431225
 65   0.012286 54.230.116.73 -> 172.31.8.238 TCP 10202 [TCP segment of a reassembled PDU]
 66   0.012294 172.31.8.238 -> 54.230.116.73 TCP 66 34184 > http [ACK] Seq=96 Ack=241435 Win=332032 Len=0 TSval=6049150 TSecr=1682431225
 67   0.012387 54.230.116.73 -> 172.31.8.238 TCP 13098 [TCP segment of a reassembled PDU]
 68   0.012396 172.31.8.238 -> 54.230.116.73 TCP 66 34184 > http [ACK] Seq=96 Ack=254467 Win=358144 Len=0 TSval=6049150 TSecr=1682431225
 69   0.012574 54.230.116.73 -> 172.31.8.238 TCP 13098 [TCP segment of a reassembled PDU]
 70   0.012585 172.31.8.238 -> 54.230.116.73 TCP 66 34184 > http [ACK] Seq=96 Ack=267499 Win=384128 Len=0 TSval=6049150 TSecr=1682431225
 71   0.012759 54.230.116.73 -> 172.31.8.238 TCP 5858 [TCP segment of a reassembled PDU]
 72   0.012766 172.31.8.238 -> 54.230.116.73 TCP 66 34184 > http [ACK] Seq=96 Ack=273291 Win=395776 Len=0 TSval=6049150 TSecr=1682431225
 73   0.012882 54.230.116.73 -> 172.31.8.238 TCP 20338 [TCP segment of a reassembled PDU]
 74   0.012895 172.31.8.238 -> 54.230.116.73 TCP 66 34184 > http [ACK] Seq=96 Ack=293563 Win=436352 Len=0 TSval=6049150 TSecr=1682431225
 75   0.012901 54.230.116.73 -> 172.31.8.238 TCP 2962 [TCP segment of a reassembled PDU]
 76   0.012904 172.31.8.238 -> 54.230.116.73 TCP 66 34184 > http [ACK] Seq=96 Ack=296459 Win=442112 Len=0 TSval=6049150 TSecr=1682431225
 77   0.013314 54.230.116.73 -> 172.31.8.238 TCP 13098 [TCP segment of a reassembled PDU]
 78   0.013324 172.31.8.238 -> 54.230.116.73 TCP 66 34184 > http [ACK] Seq=96 Ack=309491 Win=468224 Len=0 TSval=6049150 TSecr=1682431226
 79   0.013417 54.230.116.73 -> 172.31.8.238 TCP 11650 [TCP segment of a reassembled PDU]
 80   0.013426 172.31.8.238 -> 54.230.116.73 TCP 66 34184 > http [ACK] Seq=96 Ack=321075 Win=491392 Len=0 TSval=6049150 TSecr=1682431226
 81   0.013619 54.230.116.73 -> 172.31.8.238 TCP 26130 [TCP segment of a reassembled PDU]
 82   0.013632 172.31.8.238 -> 54.230.116.73 TCP 66 34184 > http [ACK] Seq=96 Ack=347139 Win=543488 Len=0 TSval=6049150 TSecr=1682431226
 83   0.013658 54.230.116.73 -> 172.31.8.238 TCP 7306 [TCP segment of a reassembled PDU]
 84   0.013663 172.31.8.238 -> 54.230.116.73 TCP 66 34184 > http [ACK] Seq=96 Ack=354379 Win=557952 Len=0 TSval=6049150 TSecr=1682431226
 85   0.014037 54.230.116.73 -> 172.31.8.238 TCP 11650 [TCP segment of a reassembled PDU]
 86   0.014046 172.31.8.238 -> 54.230.116.73 TCP 66 34184 > http [ACK] Seq=96 Ack=365963 Win=581120 Len=0 TSval=6049150 TSecr=1682431226
 87   0.014157 54.230.116.73 -> 172.31.8.238 TCP 8754 [TCP segment of a reassembled PDU]
 88   0.014164 172.31.8.238 -> 54.230.116.73 TCP 66 34184 > http [ACK] Seq=96 Ack=374651 Win=598528 Len=0 TSval=6049150 TSecr=1682431226
 89   0.014454 54.230.116.73 -> 172.31.8.238 TCP 26130 [TCP segment of a reassembled PDU]
 90   0.014469 172.31.8.238 -> 54.230.116.73 TCP 66 34184 > http [ACK] Seq=96 Ack=400715 Win=650624 Len=0 TSval=6049151 TSecr=1682431226
 91   0.014518 54.230.116.73 -> 172.31.8.238 TCP 13098 [TCP segment of a reassembled PDU]
 92   0.014526 172.31.8.238 -> 54.230.116.73 TCP 66 34184 > http [ACK] Seq=96 Ack=413747 Win=676736 Len=0 TSval=6049151 TSecr=1682431226
 93   0.014578 54.230.116.73 -> 172.31.8.238 TCP 5858 [TCP segment of a reassembled PDU]
 94   0.014585 172.31.8.238 -> 54.230.116.73 TCP 66 34184 > http [ACK] Seq=96 Ack=419539 Win=688256 Len=0 TSval=6049151 TSecr=1682431226
 95   0.014699 54.230.116.73 -> 172.31.8.238 TCP 8754 [TCP segment of a reassembled PDU]
 96   0.014707 172.31.8.238 -> 54.230.116.73 TCP 66 34184 > http [ACK] Seq=96 Ack=428227 Win=705664 Len=0 TSval=6049151 TSecr=1682431226
 97   0.015062 54.230.116.73 -> 172.31.8.238 TCP 8754 [TCP segment of a reassembled PDU]
 98   0.015070 172.31.8.238 -> 54.230.116.73 TCP 66 34184 > http [ACK] Seq=96 Ack=436915 Win=723072 Len=0 TSval=6049151 TSecr=1682431226
 99   0.015252 54.230.116.73 -> 172.31.8.238 TCP 26130 [TCP segment of a reassembled PDU]
100   0.015267 172.31.8.238 -> 54.230.116.73 TCP 66 34184 > http [ACK] Seq=96 Ack=462979 Win=775168 Len=0 TSval=6049151 TSecr=1682431226
101   0.015323 54.230.116.73 -> 172.31.8.238 TCP 18890 [TCP segment of a reassembled PDU]
102   0.015335 172.31.8.238 -> 54.230.116.73 TCP 66 34184 > http [ACK] Seq=96 Ack=481803 Win=812800 Len=0 TSval=6049151 TSecr=1682431226
103   0.015798 54.230.116.73 -> 172.31.8.238 TCP 26130 [TCP segment of a reassembled PDU]
104   0.015812 172.31.8.238 -> 54.230.116.73 TCP 66 34184 > http [ACK] Seq=96 Ack=507867 Win=864896 Len=0 TSval=6049151 TSecr=1682431226
105   0.015848 54.230.116.73 -> 172.31.8.238 TCP 11650 [TCP segment of a reassembled PDU]
106   0.015856 172.31.8.238 -> 54.230.116.73 TCP 66 34184 > http [ACK] Seq=96 Ack=519451 Win=888064 Len=0 TSval=6049151 TSecr=1682431226
107   0.016012 54.230.116.73 -> 172.31.8.238 TCP 26130 [TCP segment of a reassembled PDU]
108   0.016025 172.31.8.238 -> 54.230.116.73 TCP 66 34184 > http [ACK] Seq=96 Ack=545515 Win=940160 Len=0 TSval=6049151 TSecr=1682431226
109   0.016041 54.230.116.73 -> 172.31.8.238 TCP 17442 [TCP segment of a reassembled PDU]
110   0.016050 172.31.8.238 -> 54.230.116.73 TCP 66 34184 > http [ACK] Seq=96 Ack=562891 Win=974976 Len=0 TSval=6049151 TSecr=1682431226
111   0.016387 54.230.116.73 -> 172.31.8.238 TCP 18890 [TCP segment of a reassembled PDU]
112   0.016399 172.31.8.238 -> 54.230.116.73 TCP 66 34184 > http [ACK] Seq=96 Ack=581715 Win=1012608 Len=0 TSval=6049151 TSecr=1682431226
113   0.016414 54.230.116.73 -> 172.31.8.238 TCP 4410 [TCP segment of a reassembled PDU]
114   0.016418 172.31.8.238 -> 54.230.116.73 TCP 66 34184 > http [ACK] Seq=96 Ack=586059 Win=1021312 Len=0 TSval=6049151 TSecr=1682431226
115   0.016496 54.230.116.73 -> 172.31.8.238 TCP 14546 [TCP segment of a reassembled PDU]
116   0.016506 172.31.8.238 -> 54.230.116.73 TCP 66 34184 > http [ACK] Seq=96 Ack=600539 Win=1050240 Len=0 TSval=6049151 TSecr=1682431226
117   0.016621 54.230.116.73 -> 172.31.8.238 TCP 1514 [TCP segment of a reassembled PDU]
118   0.016626 172.31.8.238 -> 54.230.116.73 TCP 66 34184 > http [ACK] Seq=96 Ack=601987 Win=1053184 Len=0 TSval=6049151 TSecr=1682431226
119   0.016753 54.230.116.73 -> 172.31.8.238 TCP 26130 [TCP segment of a reassembled PDU]
120   0.016768 172.31.8.238 -> 54.230.116.73 TCP 66 34184 > http [ACK] Seq=96 Ack=628051 Win=1105280 Len=0 TSval=6049151 TSecr=1682431226
121   0.016784 54.230.116.73 -> 172.31.8.238 TCP 2962 [TCP segment of a reassembled PDU]
122   0.016787 172.31.8.238 -> 54.230.116.73 TCP 66 34184 > http [ACK] Seq=96 Ack=630947 Win=1111040 Len=0 TSval=6049151 TSecr=1682431226
123   0.016922 54.230.116.73 -> 172.31.8.238 TCP 15994 [TCP segment of a reassembled PDU]
124   0.016943 172.31.8.238 -> 54.230.116.73 TCP 66 34184 > http [ACK] Seq=96 Ack=646875 Win=1142912 Len=0 TSval=6049151 TSecr=1682431226
125   0.017049 54.230.116.73 -> 172.31.8.238 TCP 18890 [TCP segment of a reassembled PDU]
126   0.017061 172.31.8.238 -> 54.230.116.73 TCP 66 34184 > http [ACK] Seq=96 Ack=665699 Win=1180544 Len=0 TSval=6049151 TSecr=1682431226
127   0.017474 54.230.116.73 -> 172.31.8.238 TCP 24682 [TCP segment of a reassembled PDU]
128   0.017486 172.31.8.238 -> 54.230.116.73 TCP 66 34184 > http [ACK] Seq=96 Ack=690315 Win=1193984 Len=0 TSval=6049151 TSecr=1682431226
129   0.017492 54.230.116.73 -> 172.31.8.238 TCP 1514 [TCP segment of a reassembled PDU]
130   0.017586 54.230.116.73 -> 172.31.8.238 TCP 26130 [TCP segment of a reassembled PDU]
131   0.017603 54.230.116.73 -> 172.31.8.238 TCP 13098 [TCP segment of a reassembled PDU]
132   0.017621 172.31.8.238 -> 54.230.116.73 TCP 66 34184 > http [ACK] Seq=96 Ack=730859 Win=1170176 Len=0 TSval=6049151 TSecr=1682431226
133   0.017725 54.230.116.73 -> 172.31.8.238 TCP 21786 [TCP segment of a reassembled PDU]
134   0.017737 172.31.8.238 -> 54.230.116.73 TCP 66 34184 > http [ACK] Seq=96 Ack=752579 Win=1198720 Len=0 TSval=6049151 TSecr=1682431226
135   0.017769 54.230.116.73 -> 172.31.8.238 TCP 11650 [TCP segment of a reassembled PDU]
136   0.017776 172.31.8.238 -> 54.230.116.73 TCP 66 34184 > http [ACK] Seq=96 Ack=764163 Win=1215488 Len=0 TSval=6049151 TSecr=1682431226
137   0.018160 54.230.116.73 -> 172.31.8.238 TCP 10202 [TCP segment of a reassembled PDU]
138   0.018168 172.31.8.238 -> 54.230.116.73 TCP 66 34184 > http [ACK] Seq=96 Ack=774299 Win=1217792 Len=0 TSval=6049152 TSecr=1682431226
139   0.018324 54.230.116.73 -> 172.31.8.238 TCP 26130 [TCP segment of a reassembled PDU]
140   0.018338 172.31.8.238 -> 54.230.116.73 TCP 66 34184 > http [ACK] Seq=96 Ack=800363 Win=1281920 Len=0 TSval=6049152 TSecr=1682431226
141   0.018395 54.230.116.73 -> 172.31.8.238 TCP 26130 [TCP segment of a reassembled PDU]
142   0.018410 172.31.8.238 -> 54.230.116.73 TCP 66 34184 > http [ACK] Seq=96 Ack=826427 Win=1334016 Len=0 TSval=6049152 TSecr=1682431226
143   0.018475 54.230.116.73 -> 172.31.8.238 TCP 26130 [TCP segment of a reassembled PDU]
144   0.018490 172.31.8.238 -> 54.230.116.73 TCP 66 34184 > http [ACK] Seq=96 Ack=852491 Win=1386240 Len=0 TSval=6049152 TSecr=1682431226
145   0.018528 54.230.116.73 -> 172.31.8.238 TCP 8754 [TCP segment of a reassembled PDU]
146   0.018535 172.31.8.238 -> 54.230.116.73 TCP 66 34184 > http [ACK] Seq=96 Ack=861179 Win=1403520 Len=0 TSval=6049152 TSecr=1682431226
147   0.018989 54.230.116.73 -> 172.31.8.238 TCP 26130 [TCP segment of a reassembled PDU]
148   0.019004 172.31.8.238 -> 54.230.116.73 TCP 66 34184 > http [ACK] Seq=96 Ack=887243 Win=1455744 Len=0 TSval=6049152 TSecr=1682431226
149   0.019059 54.230.116.73 -> 172.31.8.238 TCP 26130 [TCP segment of a reassembled PDU]
150   0.019074 172.31.8.238 -> 54.230.116.73 TCP 66 34184 > http [ACK] Seq=96 Ack=913307 Win=1507840 Len=0 TSval=6049152 TSecr=1682431226
151   0.019127 54.230.116.73 -> 172.31.8.238 TCP 13098 [TCP segment of a reassembled PDU]
152   0.019134 172.31.8.238 -> 54.230.116.73 TCP 66 34184 > http [ACK] Seq=96 Ack=926339 Win=1533952 Len=0 TSval=6049152 TSecr=1682431226
153   0.019200 54.230.116.73 -> 172.31.8.238 TCP 21786 [TCP segment of a reassembled PDU]
154   0.019212 172.31.8.238 -> 54.230.116.73 TCP 66 34184 > http [ACK] Seq=96 Ack=948059 Win=1577344 Len=0 TSval=6049152 TSecr=1682431226
155   0.019328 54.230.116.73 -> 172.31.8.238 TCP 24682 [TCP segment of a reassembled PDU]
156   0.019342 172.31.8.238 -> 54.230.116.73 TCP 66 34184 > http [ACK] Seq=96 Ack=972675 Win=1577344 Len=0 TSval=6049152 TSecr=1682431226
157   0.019655 54.230.116.73 -> 172.31.8.238 TCP 2962 [TCP segment of a reassembled PDU]
158   0.019660 172.31.8.238 -> 54.230.116.73 TCP 66 34184 > http [ACK] Seq=96 Ack=975571 Win=1577344 Len=0 TSval=6049152 TSecr=1682431226
159   0.019840 54.230.116.73 -> 172.31.8.238 TCP 26130 [TCP segment of a reassembled PDU]
160   0.019855 172.31.8.238 -> 54.230.116.73 TCP 66 34184 > http [ACK] Seq=96 Ack=1001635 Win=1577344 Len=0 TSval=6049152 TSecr=1682431226
161   0.019910 54.230.116.73 -> 172.31.8.238 TCP 26130 [TCP segment of a reassembled PDU]
162   0.019937 172.31.8.238 -> 54.230.116.73 TCP 66 34184 > http [ACK] Seq=96 Ack=1027699 Win=1577344 Len=0 TSval=6049152 TSecr=1682431226
163   0.019992 54.230.116.73 -> 172.31.8.238 HTTP 21401 HTTP/1.1 200 OK  (application/octet-stream)
164   0.020002 172.31.8.238 -> 54.230.116.73 TCP 66 34184 > http [ACK] Seq=96 Ack=1049034 Win=1577344 Len=0 TSval=6049152 TSecr=1682431226
165   0.020278 172.31.8.238 -> 54.230.116.73 TCP 66 34184 > http [FIN, ACK] Seq=96 Ack=1049034 Win=1577344 Len=0 TSval=6049152 TSecr=1682431226
166   0.021181 54.230.116.73 -> 172.31.8.238 TCP 66 http > 34184 [FIN, ACK] Seq=1049034 Ack=97 Win=14592 Len=0 TSval=1682431226 TSecr=6049152
167   0.021190 172.31.8.238 -> 54.230.116.73 TCP 66 34184 > http [ACK] Seq=97 Ack=1049035 Win=1577344 Len=0 TSval=6049152 TSecr=1682431226
