[Measurement for 10kb at 14:03:50 16.03.2014] 
Tshark:

  1   0.000000  192.168.1.2 -> 74.125.232.195 TCP 1454 [TCP segment of a reassembled PDU]
  2   0.000024  192.168.1.2 -> 74.125.232.195 TCP 1454 [TCP segment of a reassembled PDU]
  3   0.000038  192.168.1.2 -> 74.125.232.195 TLSv1.2 517 Application Data
  4   0.000426  192.168.1.2 -> 74.125.232.195 TLSv1.2 87 Application Data
  5   0.000697  192.168.1.2 -> 74.125.232.195 TCP 1454 [TCP segment of a reassembled PDU]
  6   0.000722  192.168.1.2 -> 74.125.232.195 TCP 1454 [TCP segment of a reassembled PDU]
  7   0.000742  192.168.1.2 -> 74.125.232.195 TLSv1.2 135 Application Data
  8   0.001093  192.168.1.2 -> 74.125.232.195 TLSv1.2 621 Application Data
  9   0.055078 74.125.232.195 -> 192.168.1.2  TCP 54 443→61714 [ACK] Seq=1 Ack=1401 Win=7780 Len=0
 10   0.060230 74.125.232.195 -> 192.168.1.2  TCP 54 443→61714 [ACK] Seq=1 Ack=2801 Win=7780 Len=0
 11   0.061385 74.125.232.195 -> 192.168.1.2  TCP 54 443→61714 [ACK] Seq=1 Ack=3264 Win=7780 Len=0
 12   0.064606 74.125.232.195 -> 192.168.1.2  TCP 54 443→61714 [ACK] Seq=1 Ack=3297 Win=7780 Len=0
 13   0.065233 74.125.232.195 -> 192.168.1.2  TLSv1.2 87 Application Data
 14   0.071168 74.125.232.195 -> 192.168.1.2  TCP 54 443→61714 [ACK] Seq=34 Ack=6097 Win=7780 Len=0
 15   0.072990 74.125.232.195 -> 192.168.1.2  TCP 54 443→61714 [ACK] Seq=34 Ack=6745 Win=7780 Len=0
 16   0.100031 74.125.232.195 -> 192.168.1.2  TLSv1.2 104 Application Data
 17   0.100089  192.168.1.2 -> 74.125.232.195 TCP 54 61714→443 [ACK] Seq=6745 Ack=84 Win=254 Len=0
 18   0.103261 74.125.232.195 -> 192.168.1.2  TLSv1.2 132 Application Data
 19   0.106001 74.125.232.195 -> 192.168.1.2  TLSv1.2 93 Application Data
 20   0.106058  192.168.1.2 -> 74.125.232.195 TCP 54 61714→443 [ACK] Seq=6745 Ack=201 Win=254 Len=0
 21   0.106202 74.125.232.195 -> 192.168.1.2  TLSv1.2 87 Application Data
 22   0.106833  192.168.1.2 -> 74.125.232.195 TLSv1.2 87 Application Data
 23   0.178167 74.125.232.195 -> 192.168.1.2  TCP 54 443→61714 [ACK] Seq=234 Ack=6778 Win=7780 Len=0
 24   0.911397  192.168.1.2 -> 54.230.98.182 TCP 66 61930→80 [SYN] Seq=0 Win=8192 Len=0 MSS=1460 WS=256 SACK_PERM=1
 25   0.964152 54.230.98.182 -> 192.168.1.2  TCP 66 80→61930 [SYN, ACK] Seq=0 Ack=1 Win=14600 Len=0 MSS=1400 SACK_PERM=1 WS=128
 26   0.964334  192.168.1.2 -> 54.230.98.182 TCP 54 61930→80 [ACK] Seq=1 Ack=1 Win=65792 Len=0
 27   0.973814  192.168.1.2 -> 54.230.98.182 HTTP 151 GET /10kb HTTP/1.1 
 28   1.005746 54.230.98.182 -> 192.168.1.2  TCP 54 80→61930 [ACK] Seq=1 Ack=98 Win=14720 Len=0
 29   1.006990 54.230.98.182 -> 192.168.1.2  TCP 1454 [TCP segment of a reassembled PDU]
 30   1.010705 54.230.98.182 -> 192.168.1.2  TCP 1454 [TCP segment of a reassembled PDU]
 31   1.010830  192.168.1.2 -> 54.230.98.182 TCP 54 61930→80 [ACK] Seq=98 Ack=2801 Win=65792 Len=0
 32   1.017689 54.230.98.182 -> 192.168.1.2  TCP 1454 [TCP segment of a reassembled PDU]
 33   1.037654  192.168.1.2 -> 54.230.98.182 TCP 54 61930→80 [ACK] Seq=98 Ack=4201 Win=65792 Len=0
 34   1.043843 54.230.98.182 -> 192.168.1.2  TCP 1454 [TCP segment of a reassembled PDU]
 35   1.043926 54.230.98.182 -> 192.168.1.2  TCP 1454 [TCP segment of a reassembled PDU]
 36   1.043977  192.168.1.2 -> 54.230.98.182 TCP 54 61930→80 [ACK] Seq=98 Ack=7001 Win=65792 Len=0
 37   1.044083 54.230.98.182 -> 192.168.1.2  TCP 1454 [TCP segment of a reassembled PDU]
 38   1.044153 54.230.98.182 -> 192.168.1.2  TCP 1454 [TCP segment of a reassembled PDU]
 39   1.044193  192.168.1.2 -> 54.230.98.182 TCP 54 61930→80 [ACK] Seq=98 Ack=9801 Win=65792 Len=0
 40   1.044279 54.230.98.182 -> 192.168.1.2  HTTP 948 HTTP/1.1 200 OK  (application/octet-stream)
 41   1.044493  192.168.1.2 -> 54.230.98.182 TCP 54 61930→80 [FIN, ACK] Seq=98 Ack=10695 Win=64768 Len=0
 42   1.099575 54.230.98.182 -> 192.168.1.2  TCP 54 80→61930 [FIN, ACK] Seq=10695 Ack=99 Win=14720 Len=0
 43   1.099697  192.168.1.2 -> 54.230.98.182 TCP 54 61930→80 [ACK] Seq=99 Ack=10696 Win=64768 Len=0
