[Measurement for 10kb at 18:02:42 16.02.2014] 
Tshark:

  1   0.000000  192.168.1.2 -> 54.230.99.162 TCP 66 63754→80 [SYN] Seq=0 Win=8192 Len=0 MSS=1460 WS=256 SACK_PERM=1
  2   0.063317 54.230.99.162 -> 192.168.1.2  TCP 66 80→63754 [SYN, ACK] Seq=0 Ack=1 Win=14600 Len=0 MSS=1400 SACK_PERM=1 WS=128
  3   0.063483  192.168.1.2 -> 54.230.99.162 TCP 54 63754→80 [ACK] Seq=1 Ack=1 Win=65792 Len=0
  4   0.063678  192.168.1.2 -> 54.230.99.162 HTTP 151 GET /10kb HTTP/1.1 
  5   0.092053 54.230.99.162 -> 192.168.1.2  TCP 54 80→63754 [ACK] Seq=1 Ack=98 Win=14720 Len=0
  6   0.095301 54.230.99.162 -> 192.168.1.2  TCP 1132 [TCP segment of a reassembled PDU]
  7   0.100511 54.230.99.162 -> 192.168.1.2  TCP 1454 [TCP segment of a reassembled PDU]
  8   0.100627  192.168.1.2 -> 54.230.99.162 TCP 54 63754→80 [ACK] Seq=98 Ack=2479 Win=65792 Len=0
  9   0.102030 54.230.99.162 -> 192.168.1.2  TCP 1454 [TCP segment of a reassembled PDU]
 10   0.102082 54.230.99.162 -> 192.168.1.2  TCP 1454 [TCP segment of a reassembled PDU]
 11   0.102144  192.168.1.2 -> 54.230.99.162 TCP 54 63754→80 [ACK] Seq=98 Ack=5279 Win=65792 Len=0
 12   0.102236 54.230.99.162 -> 192.168.1.2  TCP 1454 [TCP segment of a reassembled PDU]
 13   0.102301 54.230.99.162 -> 192.168.1.2  TCP 1454 [TCP segment of a reassembled PDU]
 14   0.102353  192.168.1.2 -> 54.230.99.162 TCP 54 63754→80 [ACK] Seq=98 Ack=8079 Win=65792 Len=0
 15   0.102445 54.230.99.162 -> 192.168.1.2  TCP 1454 [TCP segment of a reassembled PDU]
 16   0.102485 54.230.99.162 -> 192.168.1.2  HTTP 1271 HTTP/1.1 200 OK  (application/octet-stream)
 17   0.102532  192.168.1.2 -> 54.230.99.162 TCP 54 63754→80 [ACK] Seq=98 Ack=10696 Win=65792 Len=0
 18   0.102632  192.168.1.2 -> 54.230.99.162 TCP 54 63754→80 [FIN, ACK] Seq=98 Ack=10696 Win=65792 Len=0
 19   0.129346 54.230.99.162 -> 192.168.1.2  TCP 54 80→63754 [FIN, ACK] Seq=10696 Ack=99 Win=14720 Len=0
 20   0.129503  192.168.1.2 -> 54.230.99.162 TCP 54 63754→80 [ACK] Seq=99 Ack=10697 Win=65792 Len=0
 21   0.483087 54.231.18.128 -> 192.168.1.2  TCP 54 443→63750 [FIN, ACK] Seq=1 Ack=1 Win=280 Len=0
 22   0.483165  192.168.1.2 -> 54.231.18.128 TCP 54 63750→443 [ACK] Seq=1 Ack=2 Win=255 Len=0
