[Measurement for 10kb at 04:05:12 17.05.2014] 
Tshark:

  1   0.000000  192.168.1.2 -> 54.230.99.196 TCP 66 50016→80 [SYN] Seq=0 Win=8192 Len=0 MSS=1460 WS=256 SACK_PERM=1
  2   0.064141 54.230.99.196 -> 192.168.1.2  TCP 66 80→50016 [SYN, ACK] Seq=0 Ack=1 Win=14600 Len=0 MSS=1400 SACK_PERM=1 WS=128
  3   0.064261  192.168.1.2 -> 54.230.99.196 TCP 54 50016→80 [ACK] Seq=1 Ack=1 Win=65792 Len=0
  4   0.064550  192.168.1.2 -> 54.230.99.196 HTTP 150 GET /10kb HTTP/1.1 
  5   0.091582 54.230.99.196 -> 192.168.1.2  TCP 54 80→50016 [ACK] Seq=1 Ack=97 Win=14720 Len=0
  6   0.094368 54.230.99.196 -> 192.168.1.2  TCP 1454 [TCP segment of a reassembled PDU]
  7   0.098907 54.230.99.196 -> 192.168.1.2  TCP 1180 [TCP segment of a reassembled PDU]
  8   0.099010  192.168.1.2 -> 54.230.99.196 TCP 54 50016→80 [ACK] Seq=97 Ack=2527 Win=65792 Len=0
  9   0.099196 54.230.99.196 -> 192.168.1.2  TCP 1454 [TCP segment of a reassembled PDU]
 10   0.099255 54.230.99.196 -> 192.168.1.2  TCP 1454 [TCP segment of a reassembled PDU]
 11   0.099311  192.168.1.2 -> 54.230.99.196 TCP 54 50016→80 [ACK] Seq=97 Ack=5327 Win=65792 Len=0
 12   0.099450 54.230.99.196 -> 192.168.1.2  TCP 1454 [TCP segment of a reassembled PDU]
 13   0.099514 54.230.99.196 -> 192.168.1.2  TCP 1454 [TCP segment of a reassembled PDU]
 14   0.099563  192.168.1.2 -> 54.230.99.196 TCP 54 50016→80 [ACK] Seq=97 Ack=8127 Win=65792 Len=0
 15   0.099693 54.230.99.196 -> 192.168.1.2  TCP 1454 [TCP segment of a reassembled PDU]
 16   0.100931 54.230.99.196 -> 192.168.1.2  HTTP 1223 HTTP/1.1 200 OK  (application/octet-stream)
 17   0.101006  192.168.1.2 -> 54.230.99.196 TCP 54 50016→80 [ACK] Seq=97 Ack=10696 Win=65792 Len=0
 18   0.101139  192.168.1.2 -> 54.230.99.196 TCP 54 50016→80 [FIN, ACK] Seq=97 Ack=10696 Win=65792 Len=0
 19   0.128727 54.230.99.196 -> 192.168.1.2  TCP 54 80→50016 [FIN, ACK] Seq=10696 Ack=98 Win=14720 Len=0
 20   0.128883  192.168.1.2 -> 54.230.99.196 TCP 54 50016→80 [ACK] Seq=98 Ack=10697 Win=65792 Len=0
