[Measurement for 10kb at 22:34:56 19.34.2014] 
Tshark:

  1   0.000000 172.31.36.109 -> 172.31.0.2   DNS 89 Standard query 0x3d2b  A d2pcb72msibvx3.cloudfront.net
  2   0.000021 172.31.36.109 -> 172.31.0.2   DNS 89 Standard query 0x8651  AAAA d2pcb72msibvx3.cloudfront.net
  3   0.000516   172.31.0.2 -> 172.31.36.109 DNS 217 Standard query response 0x3d2b  A 54.230.30.59 A 54.230.30.253 A 54.192.30.137 A 54.192.30.219 A 54.192.30.224 A 54.192.30.225 A 54.230.29.243 A 54.230.30.41
  4   0.000526   172.31.0.2 -> 172.31.36.109 DNS 169 Standard query response 0x8651 
  5   0.003923 172.31.36.109 -> 54.230.30.59 TCP 74 36253 > http [SYN] Seq=0 Win=26883 Len=0 MSS=8961 SACK_PERM=1 TSval=25045734 TSecr=0 WS=128
  6   0.005206 54.230.30.59 -> 172.31.36.109 TCP 74 http > 36253 [SYN, ACK] Seq=0 Ack=1 Win=14480 Len=0 MSS=1460 SACK_PERM=1 TSval=829919335 TSecr=25045734 WS=128
  7   0.005243 172.31.36.109 -> 54.230.30.59 TCP 66 36253 > http [ACK] Seq=1 Ack=1 Win=27008 Len=0 TSval=25045734 TSecr=829919335
  8   0.005280 172.31.36.109 -> 54.230.30.59 HTTP 163 GET /10kb HTTP/1.1 
  9   0.006625 54.230.30.59 -> 172.31.36.109 TCP 66 http > 36253 [ACK] Seq=1 Ack=98 Win=14592 Len=0 TSval=829919335 TSecr=25045734
 10   0.026189 54.230.30.59 -> 172.31.36.109 TCP 1144 [TCP segment of a reassembled PDU]
 11   0.026219 172.31.36.109 -> 54.230.30.59 TCP 66 36253 > http [ACK] Seq=98 Ack=1079 Win=29056 Len=0 TSval=25045739 TSecr=829919337
 12   0.026230 54.230.30.59 -> 172.31.36.109 HTTP 9683 HTTP/1.1 200 OK  (application/octet-stream)
 13   0.026237 172.31.36.109 -> 54.230.30.59 TCP 66 36253 > http [ACK] Seq=98 Ack=10696 Win=48384 Len=0 TSval=25045739 TSecr=829919337
 14   0.026393 172.31.36.109 -> 54.230.30.59 TCP 66 36253 > http [FIN, ACK] Seq=98 Ack=10696 Win=48384 Len=0 TSval=25045739 TSecr=829919337
 15   0.027732 54.230.30.59 -> 172.31.36.109 TCP 66 http > 36253 [FIN, ACK] Seq=10696 Ack=99 Win=14592 Len=0 TSval=829919337 TSecr=25045739
 16   0.027758 172.31.36.109 -> 54.230.30.59 TCP 66 36253 > http [ACK] Seq=99 Ack=10697 Win=48384 Len=0 TSval=25045740 TSecr=829919337
