[Measurement for 10kb at 03:34:25 20.34.2014] 
Tshark:

  1   0.000000 172.31.36.109 -> 172.31.0.2   DNS 89 Standard query 0xf070  A d2pcb72msibvx3.cloudfront.net
  2   0.000027 172.31.36.109 -> 172.31.0.2   DNS 89 Standard query 0xbacf  AAAA d2pcb72msibvx3.cloudfront.net
  3   0.000530   172.31.0.2 -> 172.31.36.109 DNS 217 Standard query response 0xf070  A 54.230.30.243 A 54.230.30.245 A 54.192.30.188 A 54.230.30.37 A 54.230.30.73 A 54.230.30.189 A 54.230.30.210 A 54.230.30.213
  4   0.000540   172.31.0.2 -> 172.31.36.109 DNS 169 Standard query response 0xbacf 
  5   0.003864 172.31.36.109 -> 54.230.30.243 TCP 74 60144 > http [SYN] Seq=0 Win=26883 Len=0 MSS=8961 SACK_PERM=1 TSval=29538087 TSecr=0 WS=128
  6   0.004887 54.230.30.243 -> 172.31.36.109 TCP 74 http > 60144 [SYN, ACK] Seq=0 Ack=1 Win=14480 Len=0 MSS=1460 SACK_PERM=1 TSval=634985155 TSecr=29538087 WS=128
  7   0.004901 172.31.36.109 -> 54.230.30.243 TCP 66 60144 > http [ACK] Seq=1 Ack=1 Win=27008 Len=0 TSval=29538087 TSecr=634985155
  8   0.004941 172.31.36.109 -> 54.230.30.243 HTTP 163 GET /10kb HTTP/1.1 
  9   0.006140 54.230.30.243 -> 172.31.36.109 TCP 66 http > 60144 [ACK] Seq=1 Ack=98 Win=14592 Len=0 TSval=634985155 TSecr=29538087
 10   0.023127 54.230.30.243 -> 172.31.36.109 HTTP 10761 HTTP/1.1 200 OK  (application/octet-stream)
 11   0.023139 172.31.36.109 -> 54.230.30.243 TCP 66 60144 > http [ACK] Seq=98 Ack=10696 Win=48384 Len=0 TSval=29538091 TSecr=634985157
 12   0.023281 172.31.36.109 -> 54.230.30.243 TCP 66 60144 > http [FIN, ACK] Seq=98 Ack=10696 Win=48384 Len=0 TSval=29538091 TSecr=634985157
 13   0.024323 54.230.30.243 -> 172.31.36.109 TCP 66 http > 60144 [FIN, ACK] Seq=10696 Ack=99 Win=14592 Len=0 TSval=634985157 TSecr=29538091
 14   0.024332 172.31.36.109 -> 54.230.30.243 TCP 66 60144 > http [ACK] Seq=99 Ack=10697 Win=48384 Len=0 TSval=29538092 TSecr=634985157
