[Measurement for 10kb at 07:35:11 20.35.2014] 
Tshark:

  1   0.000000 172.31.36.109 -> 172.31.0.2   DNS 89 Standard query 0x95ca  A d2pcb72msibvx3.cloudfront.net
  2   0.000034 172.31.36.109 -> 172.31.0.2   DNS 89 Standard query 0x4477  AAAA d2pcb72msibvx3.cloudfront.net
  3   0.000624   172.31.0.2 -> 172.31.36.109 DNS 169 Standard query response 0x4477 
  4   0.000634   172.31.0.2 -> 172.31.36.109 DNS 217 Standard query response 0x95ca  A 54.192.30.214 A 54.230.30.6 A 54.230.30.53 A 54.230.30.69 A 54.230.30.207 A 54.230.30.218 A 54.192.29.221 A 54.192.30.194
  5   0.003848 172.31.36.109 -> 54.192.30.214 TCP 74 50534 > http [SYN] Seq=0 Win=26883 Len=0 MSS=8961 SACK_PERM=1 TSval=33149592 TSecr=0 WS=128
  6   0.005285 54.192.30.214 -> 172.31.36.109 TCP 74 http > 50534 [SYN, ACK] Seq=0 Ack=1 Win=14480 Len=0 MSS=1460 SACK_PERM=1 TSval=682387069 TSecr=33149592 WS=128
  7   0.005299 172.31.36.109 -> 54.192.30.214 TCP 66 50534 > http [ACK] Seq=1 Ack=1 Win=27008 Len=0 TSval=33149593 TSecr=682387069
  8   0.005341 172.31.36.109 -> 54.192.30.214 HTTP 163 GET /10kb HTTP/1.1 
  9   0.006475 54.192.30.214 -> 172.31.36.109 TCP 66 http > 50534 [ACK] Seq=1 Ack=98 Win=14592 Len=0 TSval=682387069 TSecr=33149593
 10   0.033937 54.192.30.214 -> 172.31.36.109 HTTP 10761 HTTP/1.1 200 OK  (application/octet-stream)
 11   0.033949 172.31.36.109 -> 54.192.30.214 TCP 66 50534 > http [ACK] Seq=98 Ack=10696 Win=48384 Len=0 TSval=33149600 TSecr=682387072
 12   0.034108 172.31.36.109 -> 54.192.30.214 TCP 66 50534 > http [FIN, ACK] Seq=98 Ack=10696 Win=48384 Len=0 TSval=33149600 TSecr=682387072
 13   0.035255 54.192.30.214 -> 172.31.36.109 TCP 66 http > 50534 [FIN, ACK] Seq=10696 Ack=99 Win=14592 Len=0 TSval=682387072 TSecr=33149600
 14   0.035264 172.31.36.109 -> 54.192.30.214 TCP 66 50534 > http [ACK] Seq=99 Ack=10697 Win=48384 Len=0 TSval=33149600 TSecr=682387072
