[Measurement for 10kb at 02:34:34 20.34.2014] 
Tshark:

  1   0.000000 172.31.36.109 -> 172.31.0.2   DNS 89 Standard query 0x5785  A d2pcb72msibvx3.cloudfront.net
  2   0.000029 172.31.36.109 -> 172.31.0.2   DNS 89 Standard query 0xddfc  AAAA d2pcb72msibvx3.cloudfront.net
  3   0.000481   172.31.0.2 -> 172.31.36.109 DNS 169 Standard query response 0xddfc 
  4   0.000506   172.31.0.2 -> 172.31.36.109 DNS 217 Standard query response 0x5785  A 54.230.23.13 A 54.230.23.224 A 216.137.41.45 A 216.137.41.134 A 216.137.41.199 A 54.230.20.27 A 54.230.22.101 A 54.230.22.112
  5   0.003873 172.31.36.109 -> 54.230.23.13 TCP 74 58429 > http [SYN] Seq=0 Win=26883 Len=0 MSS=8961 SACK_PERM=1 TSval=28640144 TSecr=0 WS=128
  6   0.093683 54.230.23.13 -> 172.31.36.109 TCP 74 http > 58429 [SYN, ACK] Seq=0 Ack=1 Win=14480 Len=0 MSS=1460 SACK_PERM=1 TSval=978592040 TSecr=28640144 WS=128
  7   0.093699 172.31.36.109 -> 54.230.23.13 TCP 66 58429 > http [ACK] Seq=1 Ack=1 Win=27008 Len=0 TSval=28640167 TSecr=978592040
  8   0.093760 172.31.36.109 -> 54.230.23.13 HTTP 163 GET /10kb HTTP/1.1 
  9   0.183656 54.230.23.13 -> 172.31.36.109 TCP 66 http > 58429 [ACK] Seq=1 Ack=98 Win=14592 Len=0 TSval=978592049 TSecr=28640167
 10   0.187244 54.230.23.13 -> 172.31.36.109 TCP 8754 [TCP segment of a reassembled PDU]
 11   0.187256 172.31.36.109 -> 54.230.23.13 TCP 66 58429 > http [ACK] Seq=98 Ack=8689 Win=44288 Len=0 TSval=28640190 TSecr=978592050
 12   0.187411 54.230.23.13 -> 172.31.36.109 HTTP 2073 HTTP/1.1 200 OK  (application/octet-stream)
 13   0.187430 172.31.36.109 -> 54.230.23.13 TCP 66 58429 > http [ACK] Seq=98 Ack=10696 Win=48384 Len=0 TSval=28640190 TSecr=978592050
 14   0.187542 172.31.36.109 -> 54.230.23.13 TCP 66 58429 > http [FIN, ACK] Seq=98 Ack=10696 Win=48384 Len=0 TSval=28640190 TSecr=978592050
 15   0.277601 54.230.23.13 -> 172.31.36.109 TCP 66 http > 58429 [FIN, ACK] Seq=10696 Ack=99 Win=14592 Len=0 TSval=978592059 TSecr=28640190
 16   0.277626 172.31.36.109 -> 54.230.23.13 TCP 66 58429 > http [ACK] Seq=99 Ack=10697 Win=48384 Len=0 TSval=28640213 TSecr=978592059
 17   0.360246 172.31.36.109 -> 172.31.32.1  DHCP 342 DHCP Request  - Transaction ID 0xa8b9d71d
 18   0.360853  172.31.32.1 -> 172.31.36.109 DHCP 372 DHCP ACK      - Transaction ID 0xa8b9d71d
