[Measurement for 10mb at 09:36:54 20.36.2014] 
Tshark:

  1   0.000000 172.31.29.138 -> 172.31.0.2   DNS 89 Standard query 0xb54a  A d1dx94olpiqj0t.cloudfront.net
  2   0.000035 172.31.29.138 -> 172.31.0.2   DNS 89 Standard query 0x3d87  AAAA d1dx94olpiqj0t.cloudfront.net
  3   0.000649   172.31.0.2 -> 172.31.29.138 DNS 217 Standard query response 0xb54a  A 54.230.158.246 A 54.230.159.124 A 54.230.159.137 A 54.192.157.145 A 54.192.159.104 A 54.192.159.171 A 54.230.158.80 A 54.230.158.190
  4   0.000660   172.31.0.2 -> 172.31.29.138 DNS 176 Standard query response 0x3d87 
  5   0.003858 172.31.29.138 -> 54.230.158.246 TCP 74 46238 > http [SYN] Seq=0 Win=26883 Len=0 MSS=8961 SACK_PERM=1 TSval=15021938 TSecr=0 WS=128
  6   0.004511 54.230.158.246 -> 172.31.29.138 TCP 74 http > 46238 [SYN, ACK] Seq=0 Ack=1 Win=14480 Len=0 MSS=1460 SACK_PERM=1 TSval=732258399 TSecr=15021938 WS=128
  7   0.004524 172.31.29.138 -> 54.230.158.246 TCP 66 46238 > http [ACK] Seq=1 Ack=1 Win=27008 Len=0 TSval=15021938 TSecr=732258399
  8   0.004566 172.31.29.138 -> 54.230.158.246 HTTP 163 GET /10mb HTTP/1.1 
  9   0.005280 54.230.158.246 -> 172.31.29.138 TCP 66 http > 46238 [ACK] Seq=1 Ack=98 Win=14592 Len=0 TSval=732258399 TSecr=15021938
 10   0.010403 54.230.158.246 -> 172.31.29.138 TCP 1514 [TCP segment of a reassembled PDU]
 11   0.010411 172.31.29.138 -> 54.230.158.246 TCP 66 46238 > http [ACK] Seq=98 Ack=1449 Win=29824 Len=0 TSval=15021940 TSecr=732258400
 12   0.010418 54.230.158.246 -> 172.31.29.138 TCP 1514 [TCP segment of a reassembled PDU]
 13   0.010422 172.31.29.138 -> 54.230.158.246 TCP 66 46238 > http [ACK] Seq=98 Ack=2897 Win=32768 Len=0 TSval=15021940 TSecr=732258400
 14   0.010440 54.230.158.246 -> 172.31.29.138 TCP 10202 [TCP segment of a reassembled PDU]
 15   0.010447 172.31.29.138 -> 54.230.158.246 TCP 66 46238 > http [ACK] Seq=98 Ack=13033 Win=52992 Len=0 TSval=15021940 TSecr=732258400
 16   0.011180 54.230.158.246 -> 172.31.29.138 TCP 13098 [TCP segment of a reassembled PDU]
 17   0.011190 172.31.29.138 -> 54.230.158.246 TCP 66 46238 > http [ACK] Seq=98 Ack=26065 Win=79104 Len=0 TSval=15021940 TSecr=732258400
 18   0.011694 54.230.158.246 -> 172.31.29.138 TCP 4410 [TCP segment of a reassembled PDU]
 19   0.011701 172.31.29.138 -> 54.230.158.246 TCP 66 46238 > http [ACK] Seq=98 Ack=30409 Win=87808 Len=0 TSval=15021940 TSecr=732258400
 20   0.011740 54.230.158.246 -> 172.31.29.138 TCP 15994 [TCP segment of a reassembled PDU]
 21   0.011751 172.31.29.138 -> 54.230.158.246 TCP 66 46238 > http [ACK] Seq=98 Ack=46337 Win=91648 Len=0 TSval=15021940 TSecr=732258400
 22   0.012168 54.230.158.246 -> 172.31.29.138 TCP 7306 [TCP segment of a reassembled PDU]
 23   0.012175 172.31.29.138 -> 54.230.158.246 TCP 66 46238 > http [ACK] Seq=98 Ack=53577 Win=105984 Len=0 TSval=15021940 TSecr=732258400
 24   0.012239 54.230.158.246 -> 172.31.29.138 TCP 11650 [TCP segment of a reassembled PDU]
 25   0.012247 172.31.29.138 -> 54.230.158.246 TCP 66 46238 > http [ACK] Seq=98 Ack=65161 Win=98944 Len=0 TSval=15021940 TSecr=732258400
 26   0.012674 54.230.158.246 -> 172.31.29.138 TCP 1514 [TCP segment of a reassembled PDU]
 27   0.012689 172.31.29.138 -> 54.230.158.246 TCP 66 46238 > http [ACK] Seq=98 Ack=66609 Win=109056 Len=0 TSval=15021940 TSecr=732258400
 28   0.012819 54.230.158.246 -> 172.31.29.138 TCP 24682 [TCP segment of a reassembled PDU]
 29   0.012834 172.31.29.138 -> 54.230.158.246 TCP 66 46238 > http [ACK] Seq=98 Ack=91225 Win=84480 Len=0 TSval=15021940 TSecr=732258400
 30   0.013481 54.230.158.246 -> 172.31.29.138 TCP 8754 [TCP segment of a reassembled PDU]
 31   0.013489 172.31.29.138 -> 54.230.158.246 TCP 66 46238 > http [ACK] Seq=98 Ack=99913 Win=103680 Len=0 TSval=15021940 TSecr=732258400
 32   0.013642 54.230.158.246 -> 172.31.29.138 TCP 20338 [TCP segment of a reassembled PDU]
 33   0.013664 172.31.29.138 -> 54.230.158.246 TCP 66 46238 > http [ACK] Seq=98 Ack=120185 Win=84608 Len=0 TSval=15021940 TSecr=732258400
 34   0.013988 54.230.158.246 -> 172.31.29.138 TCP 7306 [TCP segment of a reassembled PDU]
 35   0.013996 172.31.29.138 -> 54.230.158.246 TCP 66 46238 > http [ACK] Seq=98 Ack=127425 Win=105984 Len=0 TSval=15021940 TSecr=732258400
 36   0.014055 54.230.158.246 -> 172.31.29.138 TCP 2962 [TCP segment of a reassembled PDU]
 37   0.014060 172.31.29.138 -> 54.230.158.246 TCP 66 46238 > http [ACK] Seq=98 Ack=130321 Win=103168 Len=0 TSval=15021940 TSecr=732258400
 38   0.014473 54.230.158.246 -> 172.31.29.138 TCP 2962 [TCP segment of a reassembled PDU]
 39   0.014487 172.31.29.138 -> 54.230.158.246 TCP 66 46238 > http [ACK] Seq=98 Ack=133217 Win=114816 Len=0 TSval=15021941 TSecr=732258400
 40   0.014657 54.230.158.246 -> 172.31.29.138 TCP 18890 [TCP segment of a reassembled PDU]
 41   0.014669 172.31.29.138 -> 54.230.158.246 TCP 66 46238 > http [ACK] Seq=98 Ack=152041 Win=152448 Len=0 TSval=15021941 TSecr=732258400
 42   0.014803 54.230.158.246 -> 172.31.29.138 TCP 13098 [TCP segment of a reassembled PDU]
 43   0.014812 172.31.29.138 -> 54.230.158.246 TCP 66 46238 > http [ACK] Seq=98 Ack=165073 Win=178560 Len=0 TSval=15021941 TSecr=732258400
 44   0.015281 54.230.158.246 -> 172.31.29.138 TCP 10202 [TCP segment of a reassembled PDU]
 45   0.015289 172.31.29.138 -> 54.230.158.246 TCP 66 46238 > http [ACK] Seq=98 Ack=175209 Win=198784 Len=0 TSval=15021941 TSecr=732258400
 46   0.015416 54.230.158.246 -> 172.31.29.138 TCP 5858 [TCP segment of a reassembled PDU]
 47   0.015423 172.31.29.138 -> 54.230.158.246 TCP 66 46238 > http [ACK] Seq=98 Ack=181001 Win=210432 Len=0 TSval=15021941 TSecr=732258400
 48   0.015651 54.230.158.246 -> 172.31.29.138 TCP 23234 [TCP segment of a reassembled PDU]
 49   0.015664 172.31.29.138 -> 54.230.158.246 TCP 66 46238 > http [ACK] Seq=98 Ack=204169 Win=256768 Len=0 TSval=15021941 TSecr=732258400
 50   0.016020 54.230.158.246 -> 172.31.29.138 TCP 2962 [TCP segment of a reassembled PDU]
 51   0.016035 172.31.29.138 -> 54.230.158.246 TCP 66 46238 > http [ACK] Seq=98 Ack=207065 Win=262528 Len=0 TSval=15021941 TSecr=732258400
 52   0.016205 54.230.158.246 -> 172.31.29.138 TCP 15994 [TCP segment of a reassembled PDU]
 53   0.016215 172.31.29.138 -> 54.230.158.246 TCP 66 46238 > http [ACK] Seq=98 Ack=222993 Win=294400 Len=0 TSval=15021941 TSecr=732258400
 54   0.016567 54.230.158.246 -> 172.31.29.138 TCP 11650 [TCP segment of a reassembled PDU]
 55   0.016576 172.31.29.138 -> 54.230.158.246 TCP 66 46238 > http [ACK] Seq=98 Ack=234577 Win=317568 Len=0 TSval=15021941 TSecr=732258401
 56   0.016724 54.230.158.246 -> 172.31.29.138 TCP 13098 [TCP segment of a reassembled PDU]
 57   0.016743 172.31.29.138 -> 54.230.158.246 TCP 66 46238 > http [ACK] Seq=98 Ack=247609 Win=343680 Len=0 TSval=15021941 TSecr=732258401
 58   0.017098 54.230.158.246 -> 172.31.29.138 TCP 18890 [TCP segment of a reassembled PDU]
 59   0.017110 172.31.29.138 -> 54.230.158.246 TCP 66 46238 > http [ACK] Seq=98 Ack=266433 Win=381312 Len=0 TSval=15021941 TSecr=732258401
 60   0.017133 54.230.158.246 -> 172.31.29.138 TCP 7306 [TCP segment of a reassembled PDU]
 61   0.017139 172.31.29.138 -> 54.230.158.246 TCP 66 46238 > http [ACK] Seq=98 Ack=273673 Win=395776 Len=0 TSval=15021941 TSecr=732258401
 62   0.017175 54.230.158.246 -> 172.31.29.138 TCP 5858 [TCP segment of a reassembled PDU]
 63   0.017181 172.31.29.138 -> 54.230.158.246 TCP 66 46238 > http [ACK] Seq=98 Ack=279465 Win=407296 Len=0 TSval=15021941 TSecr=732258401
 64   0.017438 54.230.158.246 -> 172.31.29.138 TCP 17442 [TCP segment of a reassembled PDU]
 65   0.017450 172.31.29.138 -> 54.230.158.246 TCP 66 46238 > http [ACK] Seq=98 Ack=296841 Win=442112 Len=0 TSval=15021941 TSecr=732258401
 66   0.017558 54.230.158.246 -> 172.31.29.138 TCP 10202 [TCP segment of a reassembled PDU]
 67   0.017566 172.31.29.138 -> 54.230.158.246 TCP 66 46238 > http [ACK] Seq=98 Ack=306977 Win=462336 Len=0 TSval=15021941 TSecr=732258401
 68   0.017703 54.230.158.246 -> 172.31.29.138 TCP 20338 [TCP segment of a reassembled PDU]
 69   0.017715 172.31.29.138 -> 54.230.158.246 TCP 66 46238 > http [ACK] Seq=98 Ack=327249 Win=502912 Len=0 TSval=15021941 TSecr=732258401
 70   0.017785 54.230.158.246 -> 172.31.29.138 TCP 2962 [TCP segment of a reassembled PDU]
 71   0.017791 172.31.29.138 -> 54.230.158.246 TCP 66 46238 > http [ACK] Seq=98 Ack=330145 Win=508672 Len=0 TSval=15021941 TSecr=732258401
 72   0.017920 54.230.158.246 -> 172.31.29.138 TCP 2962 [TCP segment of a reassembled PDU]
 73   0.017925 172.31.29.138 -> 54.230.158.246 TCP 66 46238 > http [ACK] Seq=98 Ack=333041 Win=514560 Len=0 TSval=15021941 TSecr=732258401
 74   0.018032 54.230.158.246 -> 172.31.29.138 TCP 2962 [TCP segment of a reassembled PDU]
 75   0.018037 172.31.29.138 -> 54.230.158.246 TCP 66 46238 > http [ACK] Seq=98 Ack=335937 Win=520320 Len=0 TSval=15021941 TSecr=732258401
 76   0.018206 54.230.158.246 -> 172.31.29.138 TCP 15994 [TCP segment of a reassembled PDU]
 77   0.018216 172.31.29.138 -> 54.230.158.246 TCP 66 46238 > http [ACK] Seq=98 Ack=351865 Win=552192 Len=0 TSval=15021942 TSecr=732258401
 78   0.018322 54.230.158.246 -> 172.31.29.138 TCP 13098 [TCP segment of a reassembled PDU]
 79   0.018331 172.31.29.138 -> 54.230.158.246 TCP 66 46238 > http [ACK] Seq=98 Ack=364897 Win=578176 Len=0 TSval=15021942 TSecr=732258401
 80   0.018477 54.230.158.246 -> 172.31.29.138 TCP 18890 [TCP segment of a reassembled PDU]
 81   0.018489 172.31.29.138 -> 54.230.158.246 TCP 66 46238 > http [ACK] Seq=98 Ack=383721 Win=615808 Len=0 TSval=15021942 TSecr=732258401
 82   0.018669 54.230.158.246 -> 172.31.29.138 TCP 2962 [TCP segment of a reassembled PDU]
 83   0.018674 172.31.29.138 -> 54.230.158.246 TCP 66 46238 > http [ACK] Seq=98 Ack=386617 Win=621696 Len=0 TSval=15021942 TSecr=732258401
 84   0.018989 54.230.158.246 -> 172.31.29.138 TCP 26130 [TCP segment of a reassembled PDU]
 85   0.019003 172.31.29.138 -> 54.230.158.246 TCP 66 46238 > http [ACK] Seq=98 Ack=412681 Win=673792 Len=0 TSval=15021942 TSecr=732258401
 86   0.019060 54.230.158.246 -> 172.31.29.138 TCP 26130 [TCP segment of a reassembled PDU]
 87   0.019074 172.31.29.138 -> 54.230.158.246 TCP 66 46238 > http [ACK] Seq=98 Ack=438745 Win=725888 Len=0 TSval=15021942 TSecr=732258401
 88   0.019096 54.230.158.246 -> 172.31.29.138 TCP 11650 [TCP segment of a reassembled PDU]
 89   0.019116 172.31.29.138 -> 54.230.158.246 TCP 66 46238 > http [ACK] Seq=98 Ack=450329 Win=749056 Len=0 TSval=15021942 TSecr=732258401
 90   0.019121 54.230.158.246 -> 172.31.29.138 TCP 1514 [TCP segment of a reassembled PDU]
 91   0.019123 172.31.29.138 -> 54.230.158.246 TCP 66 46238 > http [ACK] Seq=98 Ack=451777 Win=752000 Len=0 TSval=15021942 TSecr=732258401
 92   0.019618 54.230.158.246 -> 172.31.29.138 TCP 5858 [TCP segment of a reassembled PDU]
 93   0.019625 172.31.29.138 -> 54.230.158.246 TCP 66 46238 > http [ACK] Seq=98 Ack=457569 Win=763520 Len=0 TSval=15021942 TSecr=732258401
 94   0.019753 54.230.158.246 -> 172.31.29.138 TCP 21786 [TCP segment of a reassembled PDU]
 95   0.019765 172.31.29.138 -> 54.230.158.246 TCP 66 46238 > http [ACK] Seq=98 Ack=479289 Win=807040 Len=0 TSval=15021942 TSecr=732258401
 96   0.019917 54.230.158.246 -> 172.31.29.138 TCP 13098 [TCP segment of a reassembled PDU]
 97   0.019926 172.31.29.138 -> 54.230.158.246 TCP 66 46238 > http [ACK] Seq=98 Ack=492321 Win=833024 Len=0 TSval=15021942 TSecr=732258401
 98   0.020060 54.230.158.246 -> 172.31.29.138 TCP 24682 [TCP segment of a reassembled PDU]
 99   0.020073 172.31.29.138 -> 54.230.158.246 TCP 66 46238 > http [ACK] Seq=98 Ack=516937 Win=882304 Len=0 TSval=15021942 TSecr=732258401
100   0.020380 54.230.158.246 -> 172.31.29.138 TCP 4410 [TCP segment of a reassembled PDU]
101   0.020387 172.31.29.138 -> 54.230.158.246 TCP 66 46238 > http [ACK] Seq=98 Ack=521281 Win=891008 Len=0 TSval=15021942 TSecr=732258401
102   0.020579 54.230.158.246 -> 172.31.29.138 TCP 26130 [TCP segment of a reassembled PDU]
103   0.020593 172.31.29.138 -> 54.230.158.246 TCP 66 46238 > http [ACK] Seq=98 Ack=547345 Win=943104 Len=0 TSval=15021942 TSecr=732258401
104   0.020604 54.230.158.246 -> 172.31.29.138 TCP 8754 [TCP segment of a reassembled PDU]
105   0.020608 172.31.29.138 -> 54.230.158.246 TCP 66 46238 > http [ACK] Seq=98 Ack=556033 Win=960512 Len=0 TSval=15021942 TSecr=732258401
106   0.020722 54.230.158.246 -> 172.31.29.138 TCP 7306 [TCP segment of a reassembled PDU]
107   0.020729 172.31.29.138 -> 54.230.158.246 TCP 66 46238 > http [ACK] Seq=98 Ack=563273 Win=974976 Len=0 TSval=15021942 TSecr=732258401
108   0.020847 54.230.158.246 -> 172.31.29.138 TCP 18890 [TCP segment of a reassembled PDU]
109   0.020858 172.31.29.138 -> 54.230.158.246 TCP 66 46238 > http [ACK] Seq=98 Ack=582097 Win=1012608 Len=0 TSval=15021942 TSecr=732258401
110   0.021162 54.230.158.246 -> 172.31.29.138 TCP 10202 [TCP segment of a reassembled PDU]
111   0.021170 172.31.29.138 -> 54.230.158.246 TCP 66 46238 > http [ACK] Seq=98 Ack=592233 Win=1032832 Len=0 TSval=15021942 TSecr=732258401
112   0.021340 54.230.158.246 -> 172.31.29.138 TCP 17442 [TCP segment of a reassembled PDU]
113   0.021351 172.31.29.138 -> 54.230.158.246 TCP 66 46238 > http [ACK] Seq=98 Ack=609609 Win=1067648 Len=0 TSval=15021942 TSecr=732258401
114   0.021378 54.230.158.246 -> 172.31.29.138 TCP 8754 [TCP segment of a reassembled PDU]
115   0.021385 172.31.29.138 -> 54.230.158.246 TCP 66 46238 > http [ACK] Seq=98 Ack=618297 Win=1085056 Len=0 TSval=15021942 TSecr=732258401
116   0.021458 54.230.158.246 -> 172.31.29.138 TCP 29026 [TCP segment of a reassembled PDU]
117   0.021472 172.31.29.138 -> 54.230.158.246 TCP 66 46238 > http [ACK] Seq=98 Ack=647257 Win=1132672 Len=0 TSval=15021942 TSecr=732258401
118   0.021951 54.230.158.246 -> 172.31.29.138 TCP 4410 [TCP segment of a reassembled PDU]
119   0.021958 172.31.29.138 -> 54.230.158.246 TCP 66 46238 > http [ACK] Seq=98 Ack=651601 Win=1151616 Len=0 TSval=15021942 TSecr=732258401
120   0.022149 54.230.158.246 -> 172.31.29.138 TCP 20338 [TCP segment of a reassembled PDU]
121   0.022177 54.230.158.246 -> 172.31.29.138 TCP 5858 [TCP segment of a reassembled PDU]
122   0.022184 172.31.29.138 -> 54.230.158.246 TCP 66 46238 > http [ACK] Seq=98 Ack=671873 Win=1147008 Len=0 TSval=15021943 TSecr=732258401
123   0.022197 172.31.29.138 -> 54.230.158.246 TCP 66 46238 > http [ACK] Seq=98 Ack=677665 Win=1151616 Len=0 TSval=15021943 TSecr=732258401
124   0.022283 54.230.158.246 -> 172.31.29.138 TCP 34818 [TCP segment of a reassembled PDU]
125   0.022317 172.31.29.138 -> 54.230.158.246 TCP 66 46238 > http [ACK] Seq=98 Ack=712417 Win=1123200 Len=0 TSval=15021943 TSecr=732258401
126   0.022522 54.230.158.246 -> 172.31.29.138 TCP 11650 [TCP segment of a reassembled PDU]
127   0.022532 172.31.29.138 -> 54.230.158.246 TCP 66 46238 > http [ACK] Seq=98 Ack=724001 Win=1161344 Len=0 TSval=15021943 TSecr=732258401
128   0.022674 54.230.158.246 -> 172.31.29.138 TCP 21786 [TCP segment of a reassembled PDU]
129   0.022698 172.31.29.138 -> 54.230.158.246 TCP 66 46238 > http [ACK] Seq=98 Ack=745721 Win=1144704 Len=0 TSval=15021943 TSecr=732258401
130   0.022959 54.230.158.246 -> 172.31.29.138 TCP 4410 [TCP segment of a reassembled PDU]
131   0.022965 172.31.29.138 -> 54.230.158.246 TCP 66 46238 > http [ACK] Seq=98 Ack=750065 Win=1172608 Len=0 TSval=15021943 TSecr=732258401
132   0.023145 54.230.158.246 -> 172.31.29.138 TCP 26130 [TCP segment of a reassembled PDU]
133   0.023165 54.230.158.246 -> 172.31.29.138 TCP 10202 [TCP segment of a reassembled PDU]
134   0.023192 54.230.158.246 -> 172.31.29.138 TCP 15994 [TCP segment of a reassembled PDU]
135   0.023206 54.230.158.246 -> 172.31.29.138 TCP 8754 [TCP segment of a reassembled PDU]
136   0.023228 54.230.158.246 -> 172.31.29.138 TCP 4410 [TCP segment of a reassembled PDU]
137   0.023236 172.31.29.138 -> 54.230.158.246 TCP 66 46238 > http [ACK] Seq=98 Ack=810881 Win=1111808 Len=0 TSval=15021943 TSecr=732258401
138   0.023251 172.31.29.138 -> 54.230.158.246 TCP 66 46238 > http [ACK] Seq=98 Ack=815225 Win=1116032 Len=0 TSval=15021943 TSecr=732258401
139   0.023409 54.230.158.246 -> 172.31.29.138 TCP 23234 [TCP segment of a reassembled PDU]
140   0.023422 172.31.29.138 -> 54.230.158.246 TCP 66 46238 > http [ACK] Seq=98 Ack=838393 Win=1142272 Len=0 TSval=15021943 TSecr=732258401
141   0.023431 54.230.158.246 -> 172.31.29.138 TCP 2962 [TCP segment of a reassembled PDU]
142   0.023460 172.31.29.138 -> 54.230.158.246 TCP 66 46238 > http [ACK] Seq=98 Ack=841289 Win=1139456 Len=0 TSval=15021943 TSecr=732258401
143   0.023469 54.230.158.246 -> 172.31.29.138 TCP 1514 [TCP segment of a reassembled PDU]
144   0.023776 54.230.158.246 -> 172.31.29.138 TCP 7306 [TCP segment of a reassembled PDU]
145   0.023783 172.31.29.138 -> 54.230.158.246 TCP 66 46238 > http [ACK] Seq=98 Ack=849977 Win=1168512 Len=0 TSval=15021943 TSecr=732258401
146   0.023952 54.230.158.246 -> 172.31.29.138 TCP 26130 [TCP segment of a reassembled PDU]
147   0.023978 172.31.29.138 -> 54.230.158.246 TCP 66 46238 > http [ACK] Seq=98 Ack=876041 Win=1142528 Len=0 TSval=15021943 TSecr=732258401
148   0.024010 54.230.158.246 -> 172.31.29.138 TCP 24682 [TCP segment of a reassembled PDU]
149   0.024030 172.31.29.138 -> 54.230.158.246 TCP 66 46238 > http [ACK] Seq=98 Ack=900657 Win=1139968 Len=0 TSval=15021943 TSecr=732258401
150   0.024039 54.230.158.246 -> 172.31.29.138 TCP 1514 [TCP segment of a reassembled PDU]
151   0.024088 54.230.158.246 -> 172.31.29.138 TCP 18890 [TCP segment of a reassembled PDU]
152   0.024098 172.31.29.138 -> 54.230.158.246 TCP 66 46238 > http [ACK] Seq=98 Ack=920929 Win=1149440 Len=0 TSval=15021943 TSecr=732258401
153   0.024511 54.230.158.246 -> 172.31.29.138 TCP 4410 [TCP segment of a reassembled PDU]
154   0.024518 172.31.29.138 -> 54.230.158.246 TCP 66 46238 > http [ACK] Seq=98 Ack=925273 Win=1172608 Len=0 TSval=15021943 TSecr=732258401
155   0.024699 54.230.158.246 -> 172.31.29.138 TCP 26130 [TCP segment of a reassembled PDU]
156   0.024719 54.230.158.246 -> 172.31.29.138 TCP 11650 [TCP segment of a reassembled PDU]
157   0.024741 172.31.29.138 -> 54.230.158.246 TCP 66 46238 > http [ACK] Seq=98 Ack=962921 Win=1134976 Len=0 TSval=15021943 TSecr=732258401
158   0.024757 54.230.158.246 -> 172.31.29.138 TCP 18890 [TCP segment of a reassembled PDU]
159   0.024769 54.230.158.246 -> 172.31.29.138 TCP 1118 [TCP segment of a reassembled PDU]
160   0.024783 172.31.29.138 -> 54.230.158.246 TCP 66 46238 > http [ACK] Seq=98 Ack=982797 Win=1127808 Len=0 TSval=15021943 TSecr=732258401
161   0.025810 54.230.158.246 -> 172.31.29.138 TCP 4410 [TCP segment of a reassembled PDU]
162   0.025817 172.31.29.138 -> 54.230.158.246 TCP 66 46238 > http [ACK] Seq=98 Ack=987141 Win=1172608 Len=0 TSval=15021943 TSecr=732258401
163   0.026000 54.230.158.246 -> 172.31.29.138 TCP 26130 [TCP segment of a reassembled PDU]
164   0.026025 172.31.29.138 -> 54.230.158.246 TCP 66 46238 > http [ACK] Seq=98 Ack=1013205 Win=1146624 Len=0 TSval=15021943 TSecr=732258401
165   0.026069 54.230.158.246 -> 172.31.29.138 TCP 14546 [TCP segment of a reassembled PDU]
166   0.026078 172.31.29.138 -> 54.230.158.246 TCP 66 46238 > http [ACK] Seq=98 Ack=1027685 Win=1156480 Len=0 TSval=15021943 TSecr=732258401
167   0.026145 54.230.158.246 -> 172.31.29.138 TCP 20714 [TCP segment of a reassembled PDU]
168   0.026172 172.31.29.138 -> 54.230.158.246 TCP 66 46238 > http [ACK] Seq=98 Ack=1048333 Win=1144704 Len=0 TSval=15021944 TSecr=732258401
169   0.026817 54.230.158.246 -> 172.31.29.138 TCP 2962 [TCP segment of a reassembled PDU]
170   0.026822 172.31.29.138 -> 54.230.158.246 TCP 66 46238 > http [ACK] Seq=98 Ack=1051229 Win=1172608 Len=0 TSval=15021944 TSecr=732258402
171   0.027104 54.230.158.246 -> 172.31.29.138 TCP 10202 [TCP segment of a reassembled PDU]
172   0.027123 172.31.29.138 -> 54.230.158.246 TCP 66 46238 > http [ACK] Seq=98 Ack=1061365 Win=1172608 Len=0 TSval=15021944 TSecr=732258402
173   0.027295 54.230.158.246 -> 172.31.29.138 TCP 26130 [TCP segment of a reassembled PDU]
174   0.027316 54.230.158.246 -> 172.31.29.138 TCP 17442 [TCP segment of a reassembled PDU]
175   0.027345 54.230.158.246 -> 172.31.29.138 TCP 9130 [TCP segment of a reassembled PDU]
176   0.027356 172.31.29.138 -> 54.230.158.246 TCP 66 46238 > http [ACK] Seq=98 Ack=1104805 Win=1129216 Len=0 TSval=15021944 TSecr=732258402
177   0.027371 172.31.29.138 -> 54.230.158.246 TCP 66 46238 > http [ACK] Seq=98 Ack=1113869 Win=1135104 Len=0 TSval=15021944 TSecr=732258402
178   0.028858 54.230.158.246 -> 172.31.29.138 TCP 2962 [TCP segment of a reassembled PDU]
179   0.028864 172.31.29.138 -> 54.230.158.246 TCP 66 46238 > http [ACK] Seq=98 Ack=1116765 Win=1172608 Len=0 TSval=15021944 TSecr=732258402
180   0.029127 54.230.158.246 -> 172.31.29.138 TCP 8754 [TCP segment of a reassembled PDU]
181   0.029146 172.31.29.138 -> 54.230.158.246 TCP 66 46238 > http [ACK] Seq=98 Ack=1125453 Win=1172608 Len=0 TSval=15021944 TSecr=732258402
182   0.029299 54.230.158.246 -> 172.31.29.138 TCP 26130 [TCP segment of a reassembled PDU]
183   0.029327 172.31.29.138 -> 54.230.158.246 TCP 66 46238 > http [ACK] Seq=98 Ack=1151517 Win=1146624 Len=0 TSval=15021944 TSecr=732258402
184   0.029354 54.230.158.246 -> 172.31.29.138 TCP 24682 [TCP segment of a reassembled PDU]
185   0.029376 172.31.29.138 -> 54.230.158.246 TCP 66 46238 > http [ACK] Seq=98 Ack=1176133 Win=1139968 Len=0 TSval=15021944 TSecr=732258402
186   0.029391 54.230.158.246 -> 172.31.29.138 TCP 3338 [TCP segment of a reassembled PDU]
187   0.029400 172.31.29.138 -> 54.230.158.246 TCP 66 46238 > http [ACK] Seq=98 Ack=1179405 Win=1136768 Len=0 TSval=15021944 TSecr=732258402
188   0.031100 54.230.158.246 -> 172.31.29.138 TCP 2962 [TCP segment of a reassembled PDU]
189   0.031105 172.31.29.138 -> 54.230.158.246 TCP 66 46238 > http [ACK] Seq=98 Ack=1182301 Win=1172608 Len=0 TSval=15021945 TSecr=732258402
190   0.031223 54.230.158.246 -> 172.31.29.138 TCP 26130 [TCP segment of a reassembled PDU]
191   0.031257 54.230.158.246 -> 172.31.29.138 TCP 26130 [TCP segment of a reassembled PDU]
192   0.031270 54.230.158.246 -> 172.31.29.138 TCP 2962 [TCP segment of a reassembled PDU]
193   0.031288 54.230.158.246 -> 172.31.29.138 TCP 7682 [TCP segment of a reassembled PDU]
194   0.031300 172.31.29.138 -> 54.230.158.246 TCP 66 46238 > http [ACK] Seq=98 Ack=1244941 Win=1110016 Len=0 TSval=15021945 TSecr=732258402
195   0.032909 54.230.158.246 -> 172.31.29.138 TCP 2962 [TCP segment of a reassembled PDU]
196   0.032916 172.31.29.138 -> 54.230.158.246 TCP 66 46238 > http [ACK] Seq=98 Ack=1247837 Win=1172608 Len=0 TSval=15021945 TSecr=732258402
197   0.033171 54.230.158.246 -> 172.31.29.138 TCP 4410 [TCP segment of a reassembled PDU]
198   0.033177 172.31.29.138 -> 54.230.158.246 TCP 66 46238 > http [ACK] Seq=98 Ack=1252181 Win=1172608 Len=0 TSval=15021945 TSecr=732258402
199   0.033355 54.230.158.246 -> 172.31.29.138 TCP 26130 [TCP segment of a reassembled PDU]
200   0.033392 54.230.158.246 -> 172.31.29.138 TCP 17442 [TCP segment of a reassembled PDU]
201   0.033421 172.31.29.138 -> 54.230.158.246 TCP 66 46238 > http [ACK] Seq=98 Ack=1295621 Win=1129216 Len=0 TSval=15021945 TSecr=732258402
202   0.033442 54.230.158.246 -> 172.31.29.138 TCP 8754 [TCP segment of a reassembled PDU]
203   0.033454 172.31.29.138 -> 54.230.158.246 TCP 66 46238 > http [ACK] Seq=98 Ack=1304309 Win=1137408 Len=0 TSval=15021945 TSecr=732258402
204   0.033482 54.230.158.246 -> 172.31.29.138 TCP 6234 [TCP segment of a reassembled PDU]
205   0.033488 172.31.29.138 -> 54.230.158.246 TCP 66 46238 > http [ACK] Seq=98 Ack=1310477 Win=1168512 Len=0 TSval=15021945 TSecr=732258402
206   0.037329 54.230.158.246 -> 172.31.29.138 TCP 7306 [TCP segment of a reassembled PDU]
207   0.037336 172.31.29.138 -> 54.230.158.246 TCP 66 46238 > http [ACK] Seq=98 Ack=1317717 Win=1168512 Len=0 TSval=15021946 TSecr=732258403
208   0.037506 54.230.158.246 -> 172.31.29.138 TCP 26130 [TCP segment of a reassembled PDU]
209   0.037528 54.230.158.246 -> 172.31.29.138 TCP 13098 [TCP segment of a reassembled PDU]
210   0.037551 54.230.158.246 -> 172.31.29.138 TCP 13098 [TCP segment of a reassembled PDU]
211   0.037560 54.230.158.246 -> 172.31.29.138 TCP 6234 [TCP segment of a reassembled PDU]
212   0.037577 54.230.158.246 -> 172.31.29.138 TCP 2962 [TCP segment of a reassembled PDU]
213   0.037671 54.230.158.246 -> 172.31.29.138 TCP 26130 [TCP segment of a reassembled PDU]
214   0.037727 54.230.158.246 -> 172.31.29.138 TCP 11650 [TCP segment of a reassembled PDU]
215   0.037795 172.31.29.138 -> 54.230.158.246 TCP 66 46238 > http [ACK] Seq=98 Ack=1416557 Win=1069696 Len=0 TSval=15021946 TSecr=732258403
216   0.038339 54.230.158.246 -> 172.31.29.138 TCP 4410 [TCP segment of a reassembled PDU]
217   0.038345 172.31.29.138 -> 54.230.158.246 TCP 66 46238 > http [ACK] Seq=98 Ack=1420901 Win=1172608 Len=0 TSval=15021947 TSecr=732258403
218   0.038524 54.230.158.246 -> 172.31.29.138 TCP 26130 [TCP segment of a reassembled PDU]
219   0.038539 54.230.158.246 -> 172.31.29.138 TCP 1514 [TCP segment of a reassembled PDU]
220   0.038553 54.230.158.246 -> 172.31.29.138 TCP 13098 [TCP segment of a reassembled PDU]
221   0.038563 54.230.158.246 -> 172.31.29.138 TCP 5858 [TCP segment of a reassembled PDU]
222   0.038580 54.230.158.246 -> 172.31.29.138 TCP 5858 [TCP segment of a reassembled PDU]
223   0.038591 172.31.29.138 -> 54.230.158.246 TCP 66 46238 > http [ACK] Seq=98 Ack=1473029 Win=1120512 Len=0 TSval=15021947 TSecr=732258403
224   0.038647 54.230.158.246 -> 172.31.29.138 TCP 24682 [TCP segment of a reassembled PDU]
225   0.038659 172.31.29.138 -> 54.230.158.246 TCP 66 46238 > http [ACK] Seq=98 Ack=1497645 Win=1139968 Len=0 TSval=15021947 TSecr=732258403
226   0.038858 54.230.158.246 -> 172.31.29.138 TCP 5858 [TCP segment of a reassembled PDU]
227   0.038865 172.31.29.138 -> 54.230.158.246 TCP 66 46238 > http [ACK] Seq=98 Ack=1503437 Win=1170816 Len=0 TSval=15021947 TSecr=732258403
228   0.038975 54.230.158.246 -> 172.31.29.138 TCP 3714 [TCP segment of a reassembled PDU]
229   0.038981 172.31.29.138 -> 54.230.158.246 TCP 66 46238 > http [ACK] Seq=98 Ack=1507085 Win=1172608 Len=0 TSval=15021947 TSecr=732258403
230   0.040127 54.230.158.246 -> 172.31.29.138 TCP 2962 [TCP segment of a reassembled PDU]
231   0.040132 172.31.29.138 -> 54.230.158.246 TCP 66 46238 > http [ACK] Seq=98 Ack=1509981 Win=1172608 Len=0 TSval=15021947 TSecr=732258403
232   0.040314 54.230.158.246 -> 172.31.29.138 TCP 26130 [TCP segment of a reassembled PDU]
233   0.040340 172.31.29.138 -> 54.230.158.246 TCP 66 46238 > http [ACK] Seq=98 Ack=1536045 Win=1146624 Len=0 TSval=15021947 TSecr=732258403
234   0.040369 54.230.158.246 -> 172.31.29.138 TCP 26130 [TCP segment of a reassembled PDU]
235   0.040384 54.230.158.246 -> 172.31.29.138 TCP 7306 [TCP segment of a reassembled PDU]
236   0.040398 54.230.158.246 -> 172.31.29.138 TCP 3338 [TCP segment of a reassembled PDU]
237   0.040410 172.31.29.138 -> 54.230.158.246 TCP 66 46238 > http [ACK] Seq=98 Ack=1572621 Win=1118464 Len=0 TSval=15021947 TSecr=732258403
238   0.043083 54.230.158.246 -> 172.31.29.138 TCP 2962 [TCP segment of a reassembled PDU]
239   0.043089 172.31.29.138 -> 54.230.158.246 TCP 66 46238 > http [ACK] Seq=98 Ack=1575517 Win=1172608 Len=0 TSval=15021948 TSecr=732258403
240   0.043201 54.230.158.246 -> 172.31.29.138 TCP 24682 [TCP segment of a reassembled PDU]
241   0.043233 54.230.158.246 -> 172.31.29.138 TCP 23234 [TCP segment of a reassembled PDU]
242   0.043257 54.230.158.246 -> 172.31.29.138 TCP 2962 [TCP segment of a reassembled PDU]
243   0.043292 54.230.158.246 -> 172.31.29.138 TCP 12026 [TCP segment of a reassembled PDU]
244   0.043390 172.31.29.138 -> 54.230.158.246 TCP 66 46238 > http [ACK] Seq=98 Ack=1638157 Win=1110016 Len=0 TSval=15021948 TSecr=732258403
245   0.045798 54.230.158.246 -> 172.31.29.138 TCP 2962 [TCP segment of a reassembled PDU]
246   0.045803 172.31.29.138 -> 54.230.158.246 TCP 66 46238 > http [ACK] Seq=98 Ack=1641053 Win=1172608 Len=0 TSval=15021948 TSecr=732258403
247   0.045986 54.230.158.246 -> 172.31.29.138 TCP 26130 [TCP segment of a reassembled PDU]
248   0.046016 54.230.158.246 -> 172.31.29.138 TCP 17442 [TCP segment of a reassembled PDU]
249   0.046037 172.31.29.138 -> 54.230.158.246 TCP 66 46238 > http [ACK] Seq=98 Ack=1684493 Win=1129216 Len=0 TSval=15021948 TSecr=732258403
250   0.046054 54.230.158.246 -> 172.31.29.138 TCP 8754 [TCP segment of a reassembled PDU]
251   0.046069 172.31.29.138 -> 54.230.158.246 TCP 66 46238 > http [ACK] Seq=98 Ack=1693181 Win=1137408 Len=0 TSval=15021948 TSecr=732258403
252   0.046099 54.230.158.246 -> 172.31.29.138 TCP 10577 [TCP segment of a reassembled PDU]
253   0.046106 172.31.29.138 -> 54.230.158.246 TCP 66 46238 > http [ACK] Seq=98 Ack=1703692 Win=1161344 Len=0 TSval=15021948 TSecr=732258403
254   0.046112 54.230.158.246 -> 172.31.29.138 TCP 67 [TCP segment of a reassembled PDU]
255   0.046126 172.31.29.138 -> 54.230.158.246 TCP 66 46238 > http [ACK] Seq=98 Ack=1703693 Win=1172608 Len=0 TSval=15021948 TSecr=732258403
256   0.046917 54.230.158.246 -> 172.31.29.138 TCP 14546 [TCP segment of a reassembled PDU]
257   0.046960 172.31.29.138 -> 54.230.158.246 TCP 66 46238 > http [ACK] Seq=98 Ack=1718173 Win=1172608 Len=0 TSval=15021949 TSecr=732258404
258   0.047026 54.230.158.246 -> 172.31.29.138 TCP 21786 [TCP segment of a reassembled PDU]
259   0.047052 54.230.158.246 -> 172.31.29.138 TCP 4410 [TCP segment of a reassembled PDU]
260   0.047063 172.31.29.138 -> 54.230.158.246 TCP 66 46238 > http [ACK] Seq=98 Ack=1744237 Win=1146624 Len=0 TSval=15021949 TSecr=732258404
261   0.047104 54.230.158.246 -> 172.31.29.138 TCP 21786 [TCP segment of a reassembled PDU]
262   0.047127 54.230.158.246 -> 172.31.29.138 TCP 3338 [TCP segment of a reassembled PDU]
263   0.047138 172.31.29.138 -> 54.230.158.246 TCP 66 46238 > http [ACK] Seq=98 Ack=1769229 Win=1137408 Len=0 TSval=15021949 TSecr=732258404
264   0.048894 54.230.158.246 -> 172.31.29.138 TCP 4410 [TCP segment of a reassembled PDU]
265   0.048900 172.31.29.138 -> 54.230.158.246 TCP 66 46238 > http [ACK] Seq=98 Ack=1773573 Win=1172608 Len=0 TSval=15021949 TSecr=732258404
266   0.049069 54.230.158.246 -> 172.31.29.138 TCP 27578 [TCP segment of a reassembled PDU]
267   0.049094 54.230.158.246 -> 172.31.29.138 TCP 4410 [TCP segment of a reassembled PDU]
268   0.049104 172.31.29.138 -> 54.230.158.246 TCP 66 46238 > http [ACK] Seq=98 Ack=1805429 Win=1140864 Len=0 TSval=15021949 TSecr=732258404
269   0.049127 54.230.158.246 -> 172.31.29.138 TCP 2962 [TCP segment of a reassembled PDU]
270   0.049131 172.31.29.138 -> 54.230.158.246 TCP 66 46238 > http [ACK] Seq=98 Ack=1808325 Win=1172608 Len=0 TSval=15021949 TSecr=732258404
271   0.049317 54.230.158.246 -> 172.31.29.138 TCP 13170 [TCP segment of a reassembled PDU]
272   0.049339 172.31.29.138 -> 54.230.158.246 TCP 66 46238 > http [ACK] Seq=98 Ack=1821429 Win=1172608 Len=0 TSval=15021949 TSecr=732258404
273   0.049374 54.230.158.246 -> 172.31.29.138 TCP 13402 [TCP segment of a reassembled PDU]
274   0.049523 172.31.29.138 -> 54.230.158.246 TCP 66 46238 > http [ACK] Seq=98 Ack=1834765 Win=1172608 Len=0 TSval=15021949 TSecr=732258404
275   0.049905 54.230.158.246 -> 172.31.29.138 TCP 4410 [TCP segment of a reassembled PDU]
276   0.049911 172.31.29.138 -> 54.230.158.246 TCP 66 46238 > http [ACK] Seq=98 Ack=1839109 Win=1172608 Len=0 TSval=15021949 TSecr=732258404
277   0.050051 54.230.158.246 -> 172.31.29.138 TCP 11722 [TCP segment of a reassembled PDU]
278   0.050073 172.31.29.138 -> 54.230.158.246 TCP 66 46238 > http [ACK] Seq=98 Ack=1850765 Win=1172608 Len=0 TSval=15021949 TSecr=732258404
279   0.050119 54.230.158.246 -> 172.31.29.138 TCP 17370 [TCP segment of a reassembled PDU]
280   0.050143 172.31.29.138 -> 54.230.158.246 TCP 66 46238 > http [ACK] Seq=98 Ack=1868069 Win=1155328 Len=0 TSval=15021950 TSecr=732258404
281   0.050187 54.230.158.246 -> 172.31.29.138 TCP 26130 [TCP segment of a reassembled PDU]
282   0.050202 54.230.158.246 -> 172.31.29.138 TCP 2962 [TCP segment of a reassembled PDU]
283   0.050206 54.230.158.246 -> 172.31.29.138 TCP 1514 [TCP segment of a reassembled PDU]
284   0.050209 54.230.158.246 -> 172.31.29.138 TCP 1890 [TCP segment of a reassembled PDU]
285   0.050223 172.31.29.138 -> 54.230.158.246 TCP 66 46238 > http [ACK] Seq=98 Ack=1900301 Win=1125632 Len=0 TSval=15021950 TSecr=732258404
286   0.050670 54.230.158.246 -> 172.31.29.138 TCP 2962 [TCP segment of a reassembled PDU]
287   0.050675 172.31.29.138 -> 54.230.158.246 TCP 66 46238 > http [ACK] Seq=98 Ack=1903197 Win=1172608 Len=0 TSval=15021950 TSecr=732258404
288   0.050976 54.230.158.246 -> 172.31.29.138 TCP 7306 [TCP segment of a reassembled PDU]
289   0.050994 172.31.29.138 -> 54.230.158.246 TCP 66 46238 > http [ACK] Seq=98 Ack=1910437 Win=1172608 Len=0 TSval=15021950 TSecr=732258404
290   0.051126 54.230.158.246 -> 172.31.29.138 TCP 26130 [TCP segment of a reassembled PDU]
291   0.051152 54.230.158.246 -> 172.31.29.138 TCP 18890 [TCP segment of a reassembled PDU]
292   0.051165 54.230.158.246 -> 172.31.29.138 TCP 4410 [TCP segment of a reassembled PDU]
293   0.051175 172.31.29.138 -> 54.230.158.246 TCP 66 46238 > http [ACK] Seq=98 Ack=1959669 Win=1123456 Len=0 TSval=15021950 TSecr=732258404
294   0.051193 54.230.158.246 -> 172.31.29.138 TCP 6234 [TCP segment of a reassembled PDU]
295   0.051203 172.31.29.138 -> 54.230.158.246 TCP 66 46238 > http [ACK] Seq=98 Ack=1965837 Win=1130368 Len=0 TSval=15021950 TSecr=732258404
296   0.051455 54.230.158.246 -> 172.31.29.138 TCP 2962 [TCP segment of a reassembled PDU]
297   0.051460 172.31.29.138 -> 54.230.158.246 TCP 66 46238 > http [ACK] Seq=98 Ack=1968733 Win=1172608 Len=0 TSval=15021950 TSecr=732258404
298   0.051765 54.230.158.246 -> 172.31.29.138 TCP 1514 [TCP segment of a reassembled PDU]
299   0.051876 54.230.158.246 -> 172.31.29.138 TCP 1514 [TCP Previous segment not captured] [TCP segment of a reassembled PDU]
300   0.051880 172.31.29.138 -> 54.230.158.246 TCP 78 46238 > http [ACK] Seq=98 Ack=1970181 Win=1172608 Len=0 TSval=15021950 TSecr=732258404 SLE=1971629 SRE=1973077
301   0.051898 54.230.158.246 -> 172.31.29.138 TCP 1514 [TCP Out-Of-Order] [TCP segment of a reassembled PDU]
302   0.051902 172.31.29.138 -> 54.230.158.246 TCP 66 46238 > http [ACK] Seq=98 Ack=1973077 Win=1172608 Len=0 TSval=15021950 TSecr=732258404
303   0.051998 54.230.158.246 -> 172.31.29.138 TCP 26130 [TCP segment of a reassembled PDU]
304   0.052006 172.31.29.138 -> 54.230.158.246 TCP 66 46238 > http [ACK] Seq=98 Ack=1999141 Win=1146624 Len=0 TSval=15021950 TSecr=732258404
305   0.052037 54.230.158.246 -> 172.31.29.138 TCP 17442 [TCP segment of a reassembled PDU]
306   0.052042 172.31.29.138 -> 54.230.158.246 TCP 66 46238 > http [ACK] Seq=98 Ack=2016517 Win=1129344 Len=0 TSval=15021950 TSecr=732258404
307   0.052072 54.230.158.246 -> 172.31.29.138 TCP 8754 [TCP segment of a reassembled PDU]
308   0.052076 172.31.29.138 -> 54.230.158.246 TCP 66 46238 > http [ACK] Seq=98 Ack=2025205 Win=1137408 Len=0 TSval=15021950 TSecr=732258404
309   0.052116 54.230.158.246 -> 172.31.29.138 TCP 6234 [TCP segment of a reassembled PDU]
310   0.052120 172.31.29.138 -> 54.230.158.246 TCP 66 46238 > http [ACK] Seq=98 Ack=2031373 Win=1168512 Len=0 TSval=15021950 TSecr=732258404
311   0.052286 54.230.158.246 -> 172.31.29.138 TCP 2962 [TCP segment of a reassembled PDU]
312   0.052291 172.31.29.138 -> 54.230.158.246 TCP 66 46238 > http [ACK] Seq=98 Ack=2034269 Win=1172608 Len=0 TSval=15021950 TSecr=732258404
313   0.052625 54.230.158.246 -> 172.31.29.138 TCP 26130 [TCP segment of a reassembled PDU]
314   0.052640 172.31.29.138 -> 54.230.158.246 TCP 66 46238 > http [ACK] Seq=98 Ack=2060333 Win=1146624 Len=0 TSval=15021950 TSecr=732258404
315   0.052668 54.230.158.246 -> 172.31.29.138 TCP 17442 [TCP segment of a reassembled PDU]
316   0.052674 172.31.29.138 -> 54.230.158.246 TCP 66 46238 > http [ACK] Seq=98 Ack=2077709 Win=1129344 Len=0 TSval=15021950 TSecr=732258404
317   0.052714 54.230.158.246 -> 172.31.29.138 TCP 8754 [TCP segment of a reassembled PDU]
318   0.052720 172.31.29.138 -> 54.230.158.246 TCP 66 46238 > http [ACK] Seq=98 Ack=2086397 Win=1120768 Len=0 TSval=15021950 TSecr=732258404
319   0.052752 54.230.158.246 -> 172.31.29.138 TCP 10578 [TCP segment of a reassembled PDU]
320   0.052757 172.31.29.138 -> 54.230.158.246 TCP 66 46238 > http [ACK] Seq=98 Ack=2096909 Win=1118336 Len=0 TSval=15021950 TSecr=732258404
321   0.054399 54.230.158.246 -> 172.31.29.138 TCP 8754 [TCP segment of a reassembled PDU]
322   0.054406 172.31.29.138 -> 54.230.158.246 TCP 66 46238 > http [ACK] Seq=98 Ack=2105597 Win=1166080 Len=0 TSval=15021951 TSecr=732258404
323   0.054531 54.230.158.246 -> 172.31.29.138 TCP 26130 [TCP segment of a reassembled PDU]
324   0.054540 172.31.29.138 -> 54.230.158.246 TCP 66 46238 > http [ACK] Seq=98 Ack=2131661 Win=1140096 Len=0 TSval=15021951 TSecr=732258404
325   0.054550 54.230.158.246 -> 172.31.29.138 TCP 7306 [TCP segment of a reassembled PDU]
326   0.054553 172.31.29.138 -> 54.230.158.246 TCP 66 46238 > http [ACK] Seq=98 Ack=2138901 Win=1132928 Len=0 TSval=15021951 TSecr=732258404
327   0.054585 54.230.158.246 -> 172.31.29.138 TCP 18890 [TCP segment of a reassembled PDU]
328   0.054591 172.31.29.138 -> 54.230.158.246 TCP 66 46238 > http [ACK] Seq=98 Ack=2157725 Win=1114112 Len=0 TSval=15021951 TSecr=732258404
329   0.054640 54.230.158.246 -> 172.31.29.138 TCP 4785 [TCP segment of a reassembled PDU]
330   0.054646 172.31.29.138 -> 54.230.158.246 TCP 66 46238 > http [ACK] Seq=98 Ack=2162444 Win=1170816 Len=0 TSval=15021951 TSecr=732258404
331   0.054650 54.230.158.246 -> 172.31.29.138 TCP 67 [TCP segment of a reassembled PDU]
332   0.054669 172.31.29.138 -> 54.230.158.246 TCP 66 46238 > http [ACK] Seq=98 Ack=2162445 Win=1172608 Len=0 TSval=15021951 TSecr=732258404
333   0.054833 54.230.158.246 -> 172.31.29.138 TCP 2962 [TCP segment of a reassembled PDU]
334   0.054838 172.31.29.138 -> 54.230.158.246 TCP 66 46238 > http [ACK] Seq=98 Ack=2165341 Win=1172608 Len=0 TSval=15021951 TSecr=732258404
335   0.055127 54.230.158.246 -> 172.31.29.138 TCP 15994 [TCP segment of a reassembled PDU]
336   0.055148 172.31.29.138 -> 54.230.158.246 TCP 66 46238 > http [ACK] Seq=98 Ack=2181269 Win=1172608 Len=0 TSval=15021951 TSecr=732258404
337   0.055255 54.230.158.246 -> 172.31.29.138 TCP 23234 [TCP segment of a reassembled PDU]
338   0.055279 172.31.29.138 -> 54.230.158.246 TCP 66 46238 > http [ACK] Seq=98 Ack=2204437 Win=1149440 Len=0 TSval=15021951 TSecr=732258404
339   0.055309 54.230.158.246 -> 172.31.29.138 TCP 23610 [TCP segment of a reassembled PDU]
340   0.055328 172.31.29.138 -> 54.230.158.246 TCP 66 46238 > http [ACK] Seq=98 Ack=2227981 Win=1139968 Len=0 TSval=15021951 TSecr=732258404
341   0.055697 54.230.158.246 -> 172.31.29.138 TCP 7306 [TCP segment of a reassembled PDU]
342   0.055704 172.31.29.138 -> 54.230.158.246 TCP 66 46238 > http [ACK] Seq=98 Ack=2235221 Win=1168512 Len=0 TSval=15021951 TSecr=732258404
343   0.055857 54.230.158.246 -> 172.31.29.138 TCP 26130 [TCP segment of a reassembled PDU]
344   0.055869 54.230.158.246 -> 172.31.29.138 TCP 7306 [TCP segment of a reassembled PDU]
345   0.055886 172.31.29.138 -> 54.230.158.246 TCP 66 46238 > http [ACK] Seq=98 Ack=2268525 Win=1135232 Len=0 TSval=15021951 TSecr=732258404
346   0.055942 54.230.158.246 -> 172.31.29.138 TCP 21786 [TCP segment of a reassembled PDU]
347   0.055951 172.31.29.138 -> 54.230.158.246 TCP 66 46238 > http [ACK] Seq=98 Ack=2290245 Win=1144704 Len=0 TSval=15021951 TSecr=732258404
348   0.055961 54.230.158.246 -> 172.31.29.138 TCP 3338 [TCP segment of a reassembled PDU]
349   0.055979 172.31.29.138 -> 54.230.158.246 TCP 66 46238 > http [ACK] Seq=98 Ack=2293517 Win=1141504 Len=0 TSval=15021951 TSecr=732258404
350   0.056706 54.230.158.246 -> 172.31.29.138 TCP 7306 [TCP segment of a reassembled PDU]
351   0.056712 172.31.29.138 -> 54.230.158.246 TCP 66 46238 > http [ACK] Seq=98 Ack=2300757 Win=1168512 Len=0 TSval=15021951 TSecr=732258405
