[Measurement for 10mb at 08:36:54 20.36.2014] 
Tshark:

  1   0.000000 172.31.29.138 -> 172.31.0.2   DNS 89 Standard query 0x7854  A d1dx94olpiqj0t.cloudfront.net
  2   0.000022 172.31.29.138 -> 172.31.0.2   DNS 89 Standard query 0xd09b  AAAA d1dx94olpiqj0t.cloudfront.net
  3   0.000569   172.31.0.2 -> 172.31.29.138 DNS 176 Standard query response 0xd09b 
  4   0.000589   172.31.0.2 -> 172.31.29.138 DNS 217 Standard query response 0x7854  A 54.230.150.159 A 54.230.150.221 A 54.230.148.165 A 54.230.150.15 A 54.230.150.29 A 54.230.150.35 A 54.230.150.47 A 54.230.150.156
  5   0.003865 172.31.29.138 -> 54.230.150.159 TCP 74 53937 > http [SYN] Seq=0 Win=26883 Len=0 MSS=8961 SACK_PERM=1 TSval=14121824 TSecr=0 WS=128
  6   0.005510 54.230.150.159 -> 172.31.29.138 TCP 74 http > 53937 [SYN, ACK] Seq=0 Ack=1 Win=14480 Len=0 MSS=1460 SACK_PERM=1 TSval=1454995794 TSecr=14121824 WS=128
  7   0.005546 172.31.29.138 -> 54.230.150.159 TCP 66 53937 > http [ACK] Seq=1 Ack=1 Win=27008 Len=0 TSval=14121824 TSecr=1454995794
  8   0.005583 172.31.29.138 -> 54.230.150.159 HTTP 163 GET /10mb HTTP/1.1 
  9   0.007004 54.230.150.159 -> 172.31.29.138 TCP 66 http > 53937 [ACK] Seq=1 Ack=98 Win=14592 Len=0 TSval=1454995794 TSecr=14121824
 10   0.009647 54.230.150.159 -> 172.31.29.138 TCP 2580 [TCP segment of a reassembled PDU]
 11   0.009655 172.31.29.138 -> 54.230.150.159 TCP 66 53937 > http [ACK] Seq=98 Ack=2515 Win=32000 Len=0 TSval=14121825 TSecr=1454995795
 12   0.009871 54.230.150.159 -> 172.31.29.138 TCP 4410 [TCP segment of a reassembled PDU]
 13   0.009877 172.31.29.138 -> 54.230.150.159 TCP 66 53937 > http [ACK] Seq=98 Ack=6859 Win=40704 Len=0 TSval=14121825 TSecr=1454995795
 14   0.009893 54.230.150.159 -> 172.31.29.138 TCP 7306 [TCP segment of a reassembled PDU]
 15   0.009916 172.31.29.138 -> 54.230.150.159 TCP 66 53937 > http [ACK] Seq=98 Ack=14099 Win=55168 Len=0 TSval=14121825 TSecr=1454995795
 16   0.011455 54.230.150.159 -> 172.31.29.138 TCP 13098 [TCP segment of a reassembled PDU]
 17   0.011467 172.31.29.138 -> 54.230.150.159 TCP 66 53937 > http [ACK] Seq=98 Ack=27131 Win=81152 Len=0 TSval=14121826 TSecr=1454995795
 18   0.012993 54.230.150.159 -> 172.31.29.138 TCP 7306 [TCP segment of a reassembled PDU]
 19   0.013001 172.31.29.138 -> 54.230.150.159 TCP 66 53937 > http [ACK] Seq=98 Ack=34371 Win=95744 Len=0 TSval=14121826 TSecr=1454995795
 20   0.013018 54.230.150.159 -> 172.31.29.138 TCP 13098 [TCP segment of a reassembled PDU]
 21   0.013041 172.31.29.138 -> 54.230.150.159 TCP 66 53937 > http [ACK] Seq=98 Ack=47403 Win=84608 Len=0 TSval=14121826 TSecr=1454995795
 22   0.014451 54.230.150.159 -> 172.31.29.138 TCP 2962 [TCP segment of a reassembled PDU]
 23   0.014457 172.31.29.138 -> 54.230.150.159 TCP 66 53937 > http [ACK] Seq=98 Ack=50299 Win=101504 Len=0 TSval=14121826 TSecr=1454995795
 24   0.014552 54.230.150.159 -> 172.31.29.138 TCP 2962 [TCP segment of a reassembled PDU]
 25   0.014557 172.31.29.138 -> 54.230.150.159 TCP 66 53937 > http [ACK] Seq=98 Ack=53195 Win=107264 Len=0 TSval=14121826 TSecr=1454995795
 26   0.014572 54.230.150.159 -> 172.31.29.138 TCP 13098 [TCP segment of a reassembled PDU]
 27   0.014581 172.31.29.138 -> 54.230.150.159 TCP 66 53937 > http [ACK] Seq=98 Ack=66227 Win=94336 Len=0 TSval=14121826 TSecr=1454995795
 28   0.015995 54.230.150.159 -> 172.31.29.138 TCP 4410 [TCP segment of a reassembled PDU]
 29   0.016002 172.31.29.138 -> 54.230.150.159 TCP 66 53937 > http [ACK] Seq=98 Ack=70571 Win=109056 Len=0 TSval=14121827 TSecr=1454995795
 30   0.016114 54.230.150.159 -> 172.31.29.138 TCP 23234 [TCP segment of a reassembled PDU]
 31   0.016127 172.31.29.138 -> 54.230.150.159 TCP 66 53937 > http [ACK] Seq=98 Ack=93739 Win=155392 Len=0 TSval=14121827 TSecr=1454995795
 32   0.017528 54.230.150.159 -> 172.31.29.138 TCP 5858 [TCP segment of a reassembled PDU]
 33   0.017535 172.31.29.138 -> 54.230.150.159 TCP 66 53937 > http [ACK] Seq=98 Ack=99531 Win=167040 Len=0 TSval=14121827 TSecr=1454995795
 34   0.017730 54.230.150.159 -> 172.31.29.138 TCP 11650 [TCP segment of a reassembled PDU]
 35   0.017738 172.31.29.138 -> 54.230.150.159 TCP 66 53937 > http [ACK] Seq=98 Ack=111115 Win=190208 Len=0 TSval=14121827 TSecr=1454995795
 36   0.017755 54.230.150.159 -> 172.31.29.138 TCP 13098 [TCP segment of a reassembled PDU]
 37   0.017765 172.31.29.138 -> 54.230.150.159 TCP 66 53937 > http [ACK] Seq=98 Ack=124147 Win=216192 Len=0 TSval=14121827 TSecr=1454995795
 38   0.019172 54.230.150.159 -> 172.31.29.138 TCP 18890 [TCP segment of a reassembled PDU]
 39   0.019194 172.31.29.138 -> 54.230.150.159 TCP 66 53937 > http [ACK] Seq=98 Ack=142971 Win=253824 Len=0 TSval=14121828 TSecr=1454995796
 40   0.019351 54.230.150.159 -> 172.31.29.138 TCP 11650 [TCP segment of a reassembled PDU]
 41   0.019359 172.31.29.138 -> 54.230.150.159 TCP 66 53937 > http [ACK] Seq=98 Ack=154555 Win=276992 Len=0 TSval=14121828 TSecr=1454995796
 42   0.019476 54.230.150.159 -> 172.31.29.138 TCP 4410 [TCP segment of a reassembled PDU]
 43   0.019481 172.31.29.138 -> 54.230.150.159 TCP 66 53937 > http [ACK] Seq=98 Ack=158899 Win=285696 Len=0 TSval=14121828 TSecr=1454995796
 44   0.020594 54.230.150.159 -> 172.31.29.138 TCP 4410 [TCP segment of a reassembled PDU]
 45   0.020601 172.31.29.138 -> 54.230.150.159 TCP 66 53937 > http [ACK] Seq=98 Ack=163243 Win=294400 Len=0 TSval=14121828 TSecr=1454995796
 46   0.020719 54.230.150.159 -> 172.31.29.138 TCP 11650 [TCP segment of a reassembled PDU]
 47   0.020727 172.31.29.138 -> 54.230.150.159 TCP 66 53937 > http [ACK] Seq=98 Ack=174827 Win=317568 Len=0 TSval=14121828 TSecr=1454995796
 48   0.020958 54.230.150.159 -> 172.31.29.138 TCP 15994 [TCP segment of a reassembled PDU]
 49   0.020967 172.31.29.138 -> 54.230.150.159 TCP 66 53937 > http [ACK] Seq=98 Ack=190755 Win=349440 Len=0 TSval=14121828 TSecr=1454995796
 50   0.022147 54.230.150.159 -> 172.31.29.138 TCP 2962 [TCP segment of a reassembled PDU]
 51   0.022154 172.31.29.138 -> 54.230.150.159 TCP 66 53937 > http [ACK] Seq=98 Ack=193651 Win=355200 Len=0 TSval=14121828 TSecr=1454995796
 52   0.022309 54.230.150.159 -> 172.31.29.138 TCP 23234 [TCP segment of a reassembled PDU]
 53   0.022322 172.31.29.138 -> 54.230.150.159 TCP 66 53937 > http [ACK] Seq=98 Ack=216819 Win=401536 Len=0 TSval=14121828 TSecr=1454995796
 54   0.022431 54.230.150.159 -> 172.31.29.138 TCP 11650 [TCP segment of a reassembled PDU]
 55   0.022439 172.31.29.138 -> 54.230.150.159 TCP 66 53937 > http [ACK] Seq=98 Ack=228403 Win=424704 Len=0 TSval=14121828 TSecr=1454995796
 56   0.022533 54.230.150.159 -> 172.31.29.138 TCP 5858 [TCP segment of a reassembled PDU]
 57   0.022539 172.31.29.138 -> 54.230.150.159 TCP 66 53937 > http [ACK] Seq=98 Ack=234195 Win=436352 Len=0 TSval=14121828 TSecr=1454995796
 58   0.023673 54.230.150.159 -> 172.31.29.138 TCP 5858 [TCP segment of a reassembled PDU]
 59   0.023680 172.31.29.138 -> 54.230.150.159 TCP 66 53937 > http [ACK] Seq=98 Ack=239987 Win=447872 Len=0 TSval=14121829 TSecr=1454995796
 60   0.023832 54.230.150.159 -> 172.31.29.138 TCP 23234 [TCP segment of a reassembled PDU]
 61   0.023846 172.31.29.138 -> 54.230.150.159 TCP 66 53937 > http [ACK] Seq=98 Ack=263155 Win=494208 Len=0 TSval=14121829 TSecr=1454995796
 62   0.023955 54.230.150.159 -> 172.31.29.138 TCP 4410 [TCP segment of a reassembled PDU]
 63   0.023960 172.31.29.138 -> 54.230.150.159 TCP 66 53937 > http [ACK] Seq=98 Ack=267499 Win=502912 Len=0 TSval=14121829 TSecr=1454995796
 64   0.024099 54.230.150.159 -> 172.31.29.138 TCP 15994 [TCP segment of a reassembled PDU]
 65   0.024109 172.31.29.138 -> 54.230.150.159 TCP 66 53937 > http [ACK] Seq=98 Ack=283427 Win=534144 Len=0 TSval=14121829 TSecr=1454995796
 66   0.025209 54.230.150.159 -> 172.31.29.138 TCP 4410 [TCP segment of a reassembled PDU]
 67   0.025216 172.31.29.138 -> 54.230.150.159 TCP 66 53937 > http [ACK] Seq=98 Ack=287771 Win=543488 Len=0 TSval=14121829 TSecr=1454995796
 68   0.025407 54.230.150.159 -> 172.31.29.138 TCP 27578 [TCP segment of a reassembled PDU]
 69   0.025421 172.31.29.138 -> 54.230.150.159 TCP 66 53937 > http [ACK] Seq=98 Ack=315283 Win=522368 Len=0 TSval=14121829 TSecr=1454995796
 70   0.025477 54.230.150.159 -> 172.31.29.138 TCP 4410 [TCP segment of a reassembled PDU]
 71   0.025483 172.31.29.138 -> 54.230.150.159 TCP 66 53937 > http [ACK] Seq=98 Ack=319627 Win=552192 Len=0 TSval=14121829 TSecr=1454995796
 72   0.025627 54.230.150.159 -> 172.31.29.138 TCP 18890 [TCP segment of a reassembled PDU]
 73   0.025638 172.31.29.138 -> 54.230.150.159 TCP 66 53937 > http [ACK] Seq=98 Ack=338451 Win=536704 Len=0 TSval=14121829 TSecr=1454995796
 74   0.026998 54.230.150.159 -> 172.31.29.138 TCP 1514 [TCP segment of a reassembled PDU]
 75   0.027005 172.31.29.138 -> 54.230.150.159 TCP 66 53937 > http [ACK] Seq=98 Ack=339899 Win=555008 Len=0 TSval=14121830 TSecr=1454995796
 76   0.027319 54.230.150.159 -> 172.31.29.138 TCP 59434 [TCP segment of a reassembled PDU]
 77   0.027356 172.31.29.138 -> 54.230.150.159 TCP 66 53937 > http [ACK] Seq=98 Ack=399267 Win=495744 Len=0 TSval=14121830 TSecr=1454995796
 78   0.028793 54.230.150.159 -> 172.31.29.138 TCP 4410 [TCP segment of a reassembled PDU]
 79   0.028800 172.31.29.138 -> 54.230.150.159 TCP 66 53937 > http [ACK] Seq=98 Ack=403611 Win=560512 Len=0 TSval=14121830 TSecr=1454995797
 80   0.029117 54.230.150.159 -> 172.31.29.138 TCP 57986 [TCP segment of a reassembled PDU]
 81   0.029141 54.230.150.159 -> 172.31.29.138 TCP 1514 [TCP segment of a reassembled PDU]
 82   0.029155 172.31.29.138 -> 54.230.150.159 TCP 66 53937 > http [ACK] Seq=98 Ack=462979 Win=501248 Len=0 TSval=14121830 TSecr=1454995797
 83   0.030598 54.230.150.159 -> 172.31.29.138 TCP 1514 [TCP segment of a reassembled PDU]
 84   0.030602 172.31.29.138 -> 54.230.150.159 TCP 66 53937 > http [ACK] Seq=98 Ack=464427 Win=565248 Len=0 TSval=14121830 TSecr=1454995797
 85   0.030922 54.230.150.159 -> 172.31.29.138 TCP 17442 [TCP segment of a reassembled PDU]
 86   0.030973 54.230.150.159 -> 172.31.29.138 TCP 42058 [TCP segment of a reassembled PDU]
 87   0.031008 54.230.150.159 -> 172.31.29.138 TCP 5858 [TCP segment of a reassembled PDU]
 88   0.031025 172.31.29.138 -> 54.230.150.159 TCP 66 53937 > http [ACK] Seq=98 Ack=529587 Win=532352 Len=0 TSval=14121831 TSecr=1454995797
 89   0.032459 54.230.150.159 -> 172.31.29.138 TCP 18890 [TCP segment of a reassembled PDU]
 90   0.032471 172.31.29.138 -> 54.230.150.159 TCP 66 53937 > http [ACK] Seq=98 Ack=548411 Win=603904 Len=0 TSval=14121831 TSecr=1454995797
 91   0.032556 54.230.150.159 -> 172.31.29.138 TCP 24682 [TCP segment of a reassembled PDU]
 92   0.032581 172.31.29.138 -> 54.230.150.159 TCP 66 53937 > http [ACK] Seq=98 Ack=573027 Win=599296 Len=0 TSval=14121831 TSecr=1454995797
 93   0.032663 54.230.150.159 -> 172.31.29.138 TCP 26130 [TCP segment of a reassembled PDU]
 94   0.032698 172.31.29.138 -> 54.230.150.159 TCP 66 53937 > http [ACK] Seq=98 Ack=599091 Win=596992 Len=0 TSval=14121831 TSecr=1454995797
 95   0.033960 54.230.150.159 -> 172.31.29.138 TCP 4410 [TCP segment of a reassembled PDU]
 96   0.033966 172.31.29.138 -> 54.230.150.159 TCP 66 53937 > http [ACK] Seq=98 Ack=603435 Win=612608 Len=0 TSval=14121831 TSecr=1454995797
 97   0.034224 54.230.150.159 -> 172.31.29.138 TCP 31922 [TCP segment of a reassembled PDU]
 98   0.034255 172.31.29.138 -> 54.230.150.159 TCP 66 53937 > http [ACK] Seq=98 Ack=635291 Win=587392 Len=0 TSval=14121831 TSecr=1454995797
 99   0.034292 54.230.150.159 -> 172.31.29.138 TCP 20338 [TCP segment of a reassembled PDU]
100   0.034313 172.31.29.138 -> 54.230.150.159 TCP 66 53937 > http [ACK] Seq=98 Ack=655563 Win=606464 Len=0 TSval=14121831 TSecr=1454995797
101   0.034348 54.230.150.159 -> 172.31.29.138 TCP 17442 [TCP segment of a reassembled PDU]
102   0.034358 172.31.29.138 -> 54.230.150.159 TCP 66 53937 > http [ACK] Seq=98 Ack=672939 Win=611200 Len=0 TSval=14121831 TSecr=1454995797
103   0.035512 54.230.150.159 -> 172.31.29.138 TCP 4410 [TCP segment of a reassembled PDU]
104   0.035518 172.31.29.138 -> 54.230.150.159 TCP 66 53937 > http [ACK] Seq=98 Ack=677283 Win=621312 Len=0 TSval=14121832 TSecr=1454995797
105   0.035974 54.230.150.159 -> 172.31.29.138 TCP 20338 [TCP segment of a reassembled PDU]
106   0.035985 172.31.29.138 -> 54.230.150.159 TCP 66 53937 > http [ACK] Seq=98 Ack=697555 Win=661888 Len=0 TSval=14121832 TSecr=1454995797
107   0.036005 54.230.150.159 -> 172.31.29.138 TCP 5858 [TCP segment of a reassembled PDU]
108   0.036010 172.31.29.138 -> 54.230.150.159 TCP 66 53937 > http [ACK] Seq=98 Ack=703347 Win=673408 Len=0 TSval=14121832 TSecr=1454995797
109   0.036107 54.230.150.159 -> 172.31.29.138 TCP 34818 [TCP segment of a reassembled PDU]
110   0.036132 172.31.29.138 -> 54.230.150.159 TCP 66 53937 > http [ACK] Seq=98 Ack=738099 Win=742912 Len=0 TSval=14121832 TSecr=1454995797
111   0.036142 54.230.150.159 -> 172.31.29.138 TCP 4410 [TCP segment of a reassembled PDU]
112   0.036278 172.31.29.138 -> 54.230.150.159 TCP 66 53937 > http [ACK] Seq=98 Ack=742443 Win=738688 Len=0 TSval=14121832 TSecr=1454995797
113   0.037587 54.230.150.159 -> 172.31.29.138 TCP 4410 [TCP segment of a reassembled PDU]
114   0.037617 172.31.29.138 -> 54.230.150.159 TCP 66 53937 > http [ACK] Seq=98 Ack=746787 Win=751616 Len=0 TSval=14121832 TSecr=1454995797
115   0.037936 54.230.150.159 -> 172.31.29.138 TCP 60882 [TCP segment of a reassembled PDU]
116   0.037975 172.31.29.138 -> 54.230.150.159 TCP 66 53937 > http [ACK] Seq=98 Ack=807603 Win=701952 Len=0 TSval=14121832 TSecr=1454995797
117   0.039366 54.230.150.159 -> 172.31.29.138 TCP 7306 [TCP segment of a reassembled PDU]
118   0.039372 172.31.29.138 -> 54.230.150.159 TCP 66 53937 > http [ACK] Seq=98 Ack=814843 Win=766080 Len=0 TSval=14121833 TSecr=1454995798
119   0.039629 54.230.150.159 -> 172.31.29.138 TCP 55090 [TCP segment of a reassembled PDU]
120   0.039666 172.31.29.138 -> 54.230.150.159 TCP 66 53937 > http [ACK] Seq=98 Ack=869867 Win=711424 Len=0 TSval=14121833 TSecr=1454995798
121   0.039688 54.230.150.159 -> 172.31.29.138 TCP 2962 [TCP segment of a reassembled PDU]
122   0.039713 172.31.29.138 -> 54.230.150.159 TCP 66 53937 > http [ACK] Seq=98 Ack=872763 Win=708608 Len=0 TSval=14121833 TSecr=1454995798
123   0.040650 54.230.150.159 -> 172.31.29.138 TCP 2962 [TCP segment of a reassembled PDU]
124   0.040666 172.31.29.138 -> 54.230.150.159 TCP 66 53937 > http [ACK] Seq=98 Ack=875659 Win=771840 Len=0 TSval=14121833 TSecr=1454995798
125   0.040928 54.230.150.159 -> 172.31.29.138 TCP 8754 [TCP segment of a reassembled PDU]
126   0.040959 172.31.29.138 -> 54.230.150.159 TCP 66 53937 > http [ACK] Seq=98 Ack=884347 Win=787712 Len=0 TSval=14121833 TSecr=1454995798
127   0.041220 54.230.150.159 -> 172.31.29.138 TCP 47850 [TCP segment of a reassembled PDU]
128   0.041243 54.230.150.159 -> 172.31.29.138 TCP 5858 [TCP segment of a reassembled PDU]
129   0.041259 172.31.29.138 -> 54.230.150.159 TCP 66 53937 > http [ACK] Seq=98 Ack=937923 Win=734208 Len=0 TSval=14121833 TSecr=1454995798
130   0.041951 54.230.150.159 -> 172.31.29.138 TCP 5858 [TCP segment of a reassembled PDU]
131   0.041958 172.31.29.138 -> 54.230.150.159 TCP 66 53937 > http [ACK] Seq=98 Ack=943715 Win=792448 Len=0 TSval=14121833 TSecr=1454995798
132   0.042081 54.230.150.159 -> 172.31.29.138 TCP 18890 [TCP segment of a reassembled PDU]
133   0.042102 172.31.29.138 -> 54.230.150.159 TCP 66 53937 > http [ACK] Seq=98 Ack=962539 Win=773632 Len=0 TSval=14121833 TSecr=1454995798
134   0.042135 54.230.150.159 -> 172.31.29.138 TCP 4410 [TCP segment of a reassembled PDU]
135   0.042140 172.31.29.138 -> 54.230.150.159 TCP 66 53937 > http [ACK] Seq=98 Ack=966883 Win=794752 Len=0 TSval=14121833 TSecr=1454995798
136   0.042316 54.230.150.159 -> 172.31.29.138 TCP 4410 [TCP segment of a reassembled PDU]
137   0.042336 172.31.29.138 -> 54.230.150.159 TCP 66 53937 > http [ACK] Seq=98 Ack=971227 Win=800896 Len=0 TSval=14121833 TSecr=1454995798
138   0.042698 54.230.150.159 -> 172.31.29.138 TCP 4410 [TCP segment of a reassembled PDU]
139   0.042737 172.31.29.138 -> 54.230.150.159 TCP 66 53937 > http [ACK] Seq=98 Ack=975571 Win=800896 Len=0 TSval=14121834 TSecr=1454995798
140   0.042956 54.230.150.159 -> 172.31.29.138 TCP 18890 [TCP segment of a reassembled PDU]
141   0.042979 172.31.29.138 -> 54.230.150.159 TCP 66 53937 > http [ACK] Seq=98 Ack=994395 Win=782080 Len=0 TSval=14121834 TSecr=1454995798
142   0.043154 54.230.150.159 -> 172.31.29.138 TCP 33370 [TCP segment of a reassembled PDU]
143   0.043174 54.230.150.159 -> 172.31.29.138 TCP 8754 [TCP segment of a reassembled PDU]
144   0.043212 172.31.29.138 -> 54.230.150.159 TCP 66 53937 > http [ACK] Seq=98 Ack=1036387 Win=740096 Len=0 TSval=14121834 TSecr=1454995798
145   0.043578 54.230.150.159 -> 172.31.29.138 TCP 20338 [TCP segment of a reassembled PDU]
146   0.043590 172.31.29.138 -> 54.230.150.159 TCP 66 53937 > http [ACK] Seq=98 Ack=1056659 Win=768640 Len=0 TSval=14121834 TSecr=1454995798
147   0.043658 54.230.150.159 -> 172.31.29.138 TCP 5858 [TCP segment of a reassembled PDU]
148   0.043676 172.31.29.138 -> 54.230.150.159 TCP 66 53937 > http [ACK] Seq=98 Ack=1062451 Win=792448 Len=0 TSval=14121834 TSecr=1454995798
149   0.043806 54.230.150.159 -> 172.31.29.138 TCP 5858 [TCP segment of a reassembled PDU]
150   0.043812 172.31.29.138 -> 54.230.150.159 TCP 66 53937 > http [ACK] Seq=98 Ack=1068243 Win=792448 Len=0 TSval=14121834 TSecr=1454995798
151   0.044740 54.230.150.159 -> 172.31.29.138 TCP 7306 [TCP segment of a reassembled PDU]
152   0.044765 172.31.29.138 -> 54.230.150.159 TCP 66 53937 > http [ACK] Seq=98 Ack=1075483 Win=800896 Len=0 TSval=14121834 TSecr=1454995798
153   0.045094 54.230.150.159 -> 172.31.29.138 TCP 26130 [TCP segment of a reassembled PDU]
154   0.045104 54.230.150.159 -> 172.31.29.138 TCP 1514 [TCP Previous segment not captured] [TCP segment of a reassembled PDU]
155   0.045108 172.31.29.138 -> 54.230.150.159 TCP 78 53937 > http [ACK] Seq=98 Ack=1101547 Win=774912 Len=0 TSval=14121834 TSecr=1454995798 SLE=1102995 SRE=1104443
156   0.045113 54.230.150.159 -> 172.31.29.138 TCP 1514 [TCP Out-Of-Order] [TCP segment of a reassembled PDU]
157   0.045115 172.31.29.138 -> 54.230.150.159 TCP 66 53937 > http [ACK] Seq=98 Ack=1104443 Win=772096 Len=0 TSval=14121834 TSecr=1454995798
158   0.045134 54.230.150.159 -> 172.31.29.138 TCP 14546 [TCP segment of a reassembled PDU]
159   0.045141 172.31.29.138 -> 54.230.150.159 TCP 66 53937 > http [ACK] Seq=98 Ack=1118923 Win=757632 Len=0 TSval=14121834 TSecr=1454995798
160   0.045287 54.230.150.159 -> 172.31.29.138 TCP 53642 [TCP segment of a reassembled PDU]
161   0.045308 172.31.29.138 -> 54.230.150.159 TCP 66 53937 > http [ACK] Seq=98 Ack=1172499 Win=713728 Len=0 TSval=14121834 TSecr=1454995798
162   0.045314 54.230.150.159 -> 172.31.29.138 TCP 1514 [TCP segment of a reassembled PDU]
163   0.045317 172.31.29.138 -> 54.230.150.159 TCP 66 53937 > http [ACK] Seq=98 Ack=1173947 Win=712320 Len=0 TSval=14121834 TSecr=1454995798
164   0.046522 54.230.150.159 -> 172.31.29.138 TCP 2962 [TCP segment of a reassembled PDU]
165   0.046527 172.31.29.138 -> 54.230.150.159 TCP 66 53937 > http [ACK] Seq=98 Ack=1176843 Win=797184 Len=0 TSval=14121834 TSecr=1454995798
166   0.046580 54.230.150.159 -> 172.31.29.138 TCP 1514 [TCP segment of a reassembled PDU]
167   0.046584 172.31.29.138 -> 54.230.150.159 TCP 66 53937 > http [ACK] Seq=98 Ack=1178291 Win=799488 Len=0 TSval=14121834 TSecr=1454995798
168   0.046889 54.230.150.159 -> 172.31.29.138 TCP 17442 [TCP segment of a reassembled PDU]
169   0.046899 172.31.29.138 -> 54.230.150.159 TCP 66 53937 > http [ACK] Seq=98 Ack=1195667 Win=782208 Len=0 TSval=14121835 TSecr=1454995798
170   0.046920 54.230.150.159 -> 172.31.29.138 TCP 24682 [TCP segment of a reassembled PDU]
171   0.046931 172.31.29.138 -> 54.230.150.159 TCP 66 53937 > http [ACK] Seq=98 Ack=1220283 Win=757632 Len=0 TSval=14121835 TSecr=1454995798
172   0.046995 54.230.150.159 -> 172.31.29.138 TCP 23234 [TCP segment of a reassembled PDU]
173   0.047019 172.31.29.138 -> 54.230.150.159 TCP 66 53937 > http [ACK] Seq=98 Ack=1243451 Win=763904 Len=0 TSval=14121835 TSecr=1454995798
174   0.047097 54.230.150.159 -> 172.31.29.138 TCP 8754 [TCP segment of a reassembled PDU]
175   0.047103 172.31.29.138 -> 54.230.150.159 TCP 66 53937 > http [ACK] Seq=98 Ack=1252139 Win=755328 Len=0 TSval=14121835 TSecr=1454995798
176   0.048335 54.230.150.159 -> 172.31.29.138 TCP 4410 [TCP segment of a reassembled PDU]
177   0.048362 172.31.29.138 -> 54.230.150.159 TCP 66 53937 > http [ACK] Seq=98 Ack=1256483 Win=794752 Len=0 TSval=14121835 TSecr=1454995799
178   0.048479 54.230.150.159 -> 172.31.29.138 TCP 7306 [TCP segment of a reassembled PDU]
179   0.048505 172.31.29.138 -> 54.230.150.159 TCP 66 53937 > http [ACK] Seq=98 Ack=1263723 Win=790016 Len=0 TSval=14121835 TSecr=1454995799
180   0.048546 54.230.150.159 -> 172.31.29.138 TCP 1514 [TCP segment of a reassembled PDU]
181   0.048550 172.31.29.138 -> 54.230.150.159 TCP 66 53937 > http [ACK] Seq=98 Ack=1265171 Win=799488 Len=0 TSval=14121835 TSecr=1454995799
182   0.048778 54.230.150.159 -> 172.31.29.138 TCP 17442 [TCP segment of a reassembled PDU]
183   0.048789 172.31.29.138 -> 54.230.150.159 TCP 66 53937 > http [ACK] Seq=98 Ack=1282547 Win=782208 Len=0 TSval=14121835 TSecr=1454995799
184   0.048948 54.230.150.159 -> 172.31.29.138 TCP 34818 [TCP segment of a reassembled PDU]
185   0.048964 172.31.29.138 -> 54.230.150.159 TCP 66 53937 > http [ACK] Seq=98 Ack=1317299 Win=747520 Len=0 TSval=14121835 TSecr=1454995799
186   0.048972 54.230.150.159 -> 172.31.29.138 TCP 2962 [TCP segment of a reassembled PDU]
187   0.048982 54.230.150.159 -> 172.31.29.138 TCP 8754 [TCP segment of a reassembled PDU]
188   0.049002 172.31.29.138 -> 54.230.150.159 TCP 66 53937 > http [ACK] Seq=98 Ack=1328883 Win=736000 Len=0 TSval=14121835 TSecr=1454995799
189   0.050393 54.230.150.159 -> 172.31.29.138 TCP 7306 [TCP segment of a reassembled PDU]
190   0.050413 172.31.29.138 -> 54.230.150.159 TCP 66 53937 > http [ACK] Seq=98 Ack=1336123 Win=790016 Len=0 TSval=14121835 TSecr=1454995799
191   0.050618 54.230.150.159 -> 172.31.29.138 TCP 49298 [TCP segment of a reassembled PDU]
192   0.050642 54.230.150.159 -> 172.31.29.138 TCP 5858 [TCP segment of a reassembled PDU]
193   0.050658 172.31.29.138 -> 54.230.150.159 TCP 66 53937 > http [ACK] Seq=98 Ack=1391147 Win=735104 Len=0 TSval=14121835 TSecr=1454995799
194   0.050739 54.230.150.159 -> 172.31.29.138 TCP 30474 [TCP segment of a reassembled PDU]
195   0.050753 172.31.29.138 -> 54.230.150.159 TCP 66 53937 > http [ACK] Seq=98 Ack=1421555 Win=751872 Len=0 TSval=14121836 TSecr=1454995799
196   0.050793 54.230.150.159 -> 172.31.29.138 TCP 5858 [TCP segment of a reassembled PDU]
197   0.050799 172.31.29.138 -> 54.230.150.159 TCP 66 53937 > http [ACK] Seq=98 Ack=1427347 Win=792448 Len=0 TSval=14121836 TSecr=1454995799
198   0.052033 54.230.150.159 -> 172.31.29.138 TCP 5858 [TCP segment of a reassembled PDU]
199   0.052047 172.31.29.138 -> 54.230.150.159 TCP 66 53937 > http [ACK] Seq=98 Ack=1433139 Win=792448 Len=0 TSval=14121836 TSecr=1454995799
200   0.052363 54.230.150.159 -> 172.31.29.138 TCP 26130 [TCP segment of a reassembled PDU]
201   0.052401 54.230.150.159 -> 172.31.29.138 TCP 36266 [TCP segment of a reassembled PDU]
202   0.052427 172.31.29.138 -> 54.230.150.159 TCP 66 53937 > http [ACK] Seq=98 Ack=1495403 Win=730240 Len=0 TSval=14121836 TSecr=1454995799
203   0.052442 54.230.150.159 -> 172.31.29.138 TCP 10202 [TCP segment of a reassembled PDU]
204   0.052458 172.31.29.138 -> 54.230.150.159 TCP 66 53937 > http [ACK] Seq=98 Ack=1505539 Win=725760 Len=0 TSval=14121836 TSecr=1454995799
205   0.052515 54.230.150.159 -> 172.31.29.138 TCP 18890 [TCP segment of a reassembled PDU]
206   0.052524 172.31.29.138 -> 54.230.150.159 TCP 66 53937 > http [ACK] Seq=98 Ack=1524363 Win=770944 Len=0 TSval=14121836 TSecr=1454995799
207   0.053738 54.230.150.159 -> 172.31.29.138 TCP 13098 [TCP segment of a reassembled PDU]
208   0.053748 172.31.29.138 -> 54.230.150.159 TCP 66 53937 > http [ACK] Seq=98 Ack=1537395 Win=780544 Len=0 TSval=14121836 TSecr=1454995799
209   0.053882 54.230.150.159 -> 172.31.29.138 TCP 20338 [TCP segment of a reassembled PDU]
210   0.053905 172.31.29.138 -> 54.230.150.159 TCP 66 53937 > http [ACK] Seq=98 Ack=1557667 Win=768640 Len=0 TSval=14121836 TSecr=1454995799
211   0.054048 54.230.150.159 -> 172.31.29.138 TCP 31922 [TCP segment of a reassembled PDU]
212   0.054075 172.31.29.138 -> 54.230.150.159 TCP 66 53937 > http [ACK] Seq=98 Ack=1589523 Win=749568 Len=0 TSval=14121836 TSecr=1454995799
213   0.054238 54.230.150.159 -> 172.31.29.138 TCP 21786 [TCP segment of a reassembled PDU]
214   0.054247 172.31.29.138 -> 54.230.150.159 TCP 66 53937 > http [ACK] Seq=98 Ack=1611243 Win=766208 Len=0 TSval=14121836 TSecr=1454995799
215   0.054254 54.230.150.159 -> 172.31.29.138 TCP 1514 [TCP Previous segment not captured] [TCP segment of a reassembled PDU]
216   0.054257 172.31.29.138 -> 54.230.150.159 TCP 78 [TCP Dup ACK 214#1] 53937 > http [ACK] Seq=98 Ack=1611243 Win=766208 Len=0 TSval=14121836 TSecr=1454995799 SLE=1612691 SRE=1614139
217   0.054258 54.230.150.159 -> 172.31.29.138 TCP 1514 [TCP Out-Of-Order] [TCP segment of a reassembled PDU]
218   0.054261 172.31.29.138 -> 54.230.150.159 TCP 66 53937 > http [ACK] Seq=98 Ack=1614139 Win=763392 Len=0 TSval=14121836 TSecr=1454995799
219   0.054272 54.230.150.159 -> 172.31.29.138 TCP 5858 [TCP segment of a reassembled PDU]
220   0.054276 172.31.29.138 -> 54.230.150.159 TCP 66 53937 > http [ACK] Seq=98 Ack=1619931 Win=757632 Len=0 TSval=14121836 TSecr=1454995799
221   0.054401 54.230.150.159 -> 172.31.29.138 TCP 14546 [TCP segment of a reassembled PDU]
222   0.054412 172.31.29.138 -> 54.230.150.159 TCP 66 53937 > http [ACK] Seq=98 Ack=1634411 Win=778112 Len=0 TSval=14121836 TSecr=1454995799
223   0.055546 54.230.150.159 -> 172.31.29.138 TCP 5858 [TCP segment of a reassembled PDU]
224   0.055552 172.31.29.138 -> 54.230.150.159 TCP 66 53937 > http [ACK] Seq=98 Ack=1640203 Win=792448 Len=0 TSval=14121837 TSecr=1454995799
225   0.055836 54.230.150.159 -> 172.31.29.138 TCP 42058 [TCP segment of a reassembled PDU]
226   0.055854 172.31.29.138 -> 54.230.150.159 TCP 66 53937 > http [ACK] Seq=98 Ack=1682195 Win=750464 Len=0 TSval=14121837 TSecr=1454995799
227   0.055873 54.230.150.159 -> 172.31.29.138 TCP 10202 [TCP segment of a reassembled PDU]
228   0.055879 172.31.29.138 -> 54.230.150.159 TCP 66 53937 > http [ACK] Seq=98 Ack=1692331 Win=740352 Len=0 TSval=14121837 TSecr=1454995799
229   0.056017 54.230.150.159 -> 172.31.29.138 TCP 27578 [TCP segment of a reassembled PDU]
230   0.056041 172.31.29.138 -> 54.230.150.159 TCP 66 53937 > http [ACK] Seq=98 Ack=1719843 Win=756608 Len=0 TSval=14121837 TSecr=1454995799
231   0.056053 54.230.150.159 -> 172.31.29.138 TCP 4410 [TCP segment of a reassembled PDU]
232   0.056057 172.31.29.138 -> 54.230.150.159 TCP 66 53937 > http [ACK] Seq=98 Ack=1724187 Win=752384 Len=0 TSval=14121837 TSecr=1454995799
233   0.057435 54.230.150.159 -> 172.31.29.138 TCP 13098 [TCP segment of a reassembled PDU]
234   0.057453 172.31.29.138 -> 54.230.150.159 TCP 66 53937 > http [ACK] Seq=98 Ack=1737219 Win=780544 Len=0 TSval=14121837 TSecr=1454995799
235   0.057794 54.230.150.159 -> 172.31.29.138 TCP 62330 [TCP segment of a reassembled PDU]
236   0.057818 172.31.29.138 -> 54.230.150.159 TCP 66 53937 > http [ACK] Seq=98 Ack=1799483 Win=718336 Len=0 TSval=14121837 TSecr=1454995799
237   0.057927 54.230.150.159 -> 172.31.29.138 TCP 42058 [TCP segment of a reassembled PDU]
238   0.057945 172.31.29.138 -> 54.230.150.159 TCP 66 53937 > http [ACK] Seq=98 Ack=1841475 Win=732800 Len=0 TSval=14121837 TSecr=1454995799
239   0.059171 54.230.150.159 -> 172.31.29.138 TCP 8754 [TCP segment of a reassembled PDU]
240   0.059180 172.31.29.138 -> 54.230.150.159 TCP 66 53937 > http [ACK] Seq=98 Ack=1850163 Win=787712 Len=0 TSval=14121838 TSecr=1454995800
241   0.059404 54.230.150.159 -> 172.31.29.138 TCP 10202 [TCP segment of a reassembled PDU]
242   0.059412 172.31.29.138 -> 54.230.150.159 TCP 66 53937 > http [ACK] Seq=98 Ack=1860299 Win=785280 Len=0 TSval=14121838 TSecr=1454995800
243   0.059656 54.230.150.159 -> 172.31.29.138 TCP 50746 [TCP segment of a reassembled PDU]
244   0.059676 172.31.29.138 -> 54.230.150.159 TCP 66 53937 > http [ACK] Seq=98 Ack=1910979 Win=734720 Len=0 TSval=14121838 TSecr=1454995800
245   0.059683 54.230.150.159 -> 172.31.29.138 TCP 1514 [TCP segment of a reassembled PDU]
246   0.059685 172.31.29.138 -> 54.230.150.159 TCP 66 53937 > http [ACK] Seq=98 Ack=1912427 Win=733312 Len=0 TSval=14121838 TSecr=1454995800
247   0.059898 54.230.150.159 -> 172.31.29.138 TCP 56538 [TCP segment of a reassembled PDU]
248   0.059944 172.31.29.138 -> 54.230.150.159 TCP 66 53937 > http [ACK] Seq=98 Ack=1968899 Win=708992 Len=0 TSval=14121838 TSecr=1454995800
249   0.061124 54.230.150.159 -> 172.31.29.138 TCP 8754 [TCP segment of a reassembled PDU]
250   0.061155 172.31.29.138 -> 54.230.150.159 TCP 66 53937 > http [ACK] Seq=98 Ack=1977587 Win=787712 Len=0 TSval=14121838 TSecr=1454995800
251   0.061421 54.230.150.159 -> 172.31.29.138 TCP 53642 [TCP segment of a reassembled PDU]
252   0.061448 172.31.29.138 -> 54.230.150.159 TCP 66 53937 > http [ACK] Seq=98 Ack=2031163 Win=734208 Len=0 TSval=14121838 TSecr=1454995800
253   0.061634 54.230.150.159 -> 172.31.29.138 TCP 18890 [TCP segment of a reassembled PDU]
254   0.061640 172.31.29.138 -> 54.230.150.159 TCP 66 53937 > http [ACK] Seq=98 Ack=2049987 Win=770944 Len=0 TSval=14121838 TSecr=1454995800
255   0.061696 54.230.150.159 -> 172.31.29.138 TCP 43506 [TCP segment of a reassembled PDU]
256   0.061710 172.31.29.138 -> 54.230.150.159 TCP 66 53937 > http [ACK] Seq=98 Ack=2093427 Win=730496 Len=0 TSval=14121838 TSecr=1454995800
257   0.061735 54.230.150.159 -> 172.31.29.138 TCP 10202 [TCP segment of a reassembled PDU]
258   0.061741 172.31.29.138 -> 54.230.150.159 TCP 66 53937 > http [ACK] Seq=98 Ack=2103563 Win=785280 Len=0 TSval=14121838 TSecr=1454995800
259   0.062850 54.230.150.159 -> 172.31.29.138 TCP 2962 [TCP segment of a reassembled PDU]
260   0.062878 172.31.29.138 -> 54.230.150.159 TCP 66 53937 > http [ACK] Seq=98 Ack=2106459 Win=797184 Len=0 TSval=14121839 TSecr=1454995800
261   0.062992 54.230.150.159 -> 172.31.29.138 TCP 4410 [TCP segment of a reassembled PDU]
262   0.063030 172.31.29.138 -> 54.230.150.159 TCP 66 53937 > http [ACK] Seq=98 Ack=2110803 Win=800896 Len=0 TSval=14121839 TSecr=1454995800
263   0.063037 54.230.150.159 -> 172.31.29.138 TCP 1514 [TCP segment of a reassembled PDU]
264   0.063445 54.230.150.159 -> 172.31.29.138 TCP 43506 [TCP segment of a reassembled PDU]
265   0.063482 172.31.29.138 -> 54.230.150.159 TCP 66 53937 > http [ACK] Seq=98 Ack=2155691 Win=756096 Len=0 TSval=14121839 TSecr=1454995800
266   0.063592 54.230.150.159 -> 172.31.29.138 TCP 30474 [TCP segment of a reassembled PDU]
267   0.063638 172.31.29.138 -> 54.230.150.159 TCP 66 53937 > http [ACK] Seq=98 Ack=2186099 Win=751872 Len=0 TSval=14121839 TSecr=1454995800
268   0.063682 54.230.150.159 -> 172.31.29.138 TCP 31922 [TCP segment of a reassembled PDU]
269   0.063703 172.31.29.138 -> 54.230.150.159 TCP 66 53937 > http [ACK] Seq=98 Ack=2217955 Win=749568 Len=0 TSval=14121839 TSecr=1454995800
270   0.063776 54.230.150.159 -> 172.31.29.138 TCP 23234 [TCP segment of a reassembled PDU]
271   0.063784 172.31.29.138 -> 54.230.150.159 TCP 66 53937 > http [ACK] Seq=98 Ack=2241123 Win=763904 Len=0 TSval=14121839 TSecr=1454995800
272   0.065090 54.230.150.159 -> 172.31.29.138 TCP 2962 [TCP segment of a reassembled PDU]
273   0.065096 172.31.29.138 -> 54.230.150.159 TCP 66 53937 > http [ACK] Seq=98 Ack=2244019 Win=797184 Len=0 TSval=14121839 TSecr=1454995800
274   0.065339 54.230.150.159 -> 172.31.29.138 TCP 36266 [TCP segment of a reassembled PDU]
275   0.065377 172.31.29.138 -> 54.230.150.159 TCP 66 53937 > http [ACK] Seq=98 Ack=2280219 Win=761088 Len=0 TSval=14121839 TSecr=1454995800
276   0.065602 54.230.150.159 -> 172.31.29.138 TCP 56538 [TCP segment of a reassembled PDU]
277   0.065618 54.230.150.159 -> 172.31.29.138 TCP 5858 [TCP segment of a reassembled PDU]
278   0.065634 172.31.29.138 -> 54.230.150.159 TCP 66 53937 > http [ACK] Seq=98 Ack=2342483 Win=699392 Len=0 TSval=14121839 TSecr=1454995800
279   0.065694 54.230.150.159 -> 172.31.29.138 TCP 17442 [TCP segment of a reassembled PDU]
280   0.065700 172.31.29.138 -> 54.230.150.159 TCP 66 53937 > http [ACK] Seq=98 Ack=2359859 Win=773376 Len=0 TSval=14121839 TSecr=1454995800
281   0.065732 54.230.150.159 -> 172.31.29.138 TCP 11650 [TCP segment of a reassembled PDU]
282   0.065864 172.31.29.138 -> 54.230.150.159 TCP 66 53937 > http [ACK] Seq=98 Ack=2371443 Win=761856 Len=0 TSval=14121839 TSecr=1454995800
283   0.066894 54.230.150.159 -> 172.31.29.138 TCP 2962 [TCP segment of a reassembled PDU]
284   0.066899 172.31.29.138 -> 54.230.150.159 TCP 66 53937 > http [ACK] Seq=98 Ack=2374339 Win=797184 Len=0 TSval=14121840 TSecr=1454995800
285   0.067097 54.230.150.159 -> 172.31.29.138 TCP 24682 [TCP segment of a reassembled PDU]
286   0.067118 172.31.29.138 -> 54.230.150.159 TCP 66 53937 > http [ACK] Seq=98 Ack=2398955 Win=772608 Len=0 TSval=14121840 TSecr=1454995800
287   0.067194 54.230.150.159 -> 172.31.29.138 TCP 27578 [TCP segment of a reassembled PDU]
288   0.067215 172.31.29.138 -> 54.230.150.159 TCP 66 53937 > http [ACK] Seq=98 Ack=2426467 Win=756608 Len=0 TSval=14121840 TSecr=1454995800
289   0.067296 54.230.150.159 -> 172.31.29.138 TCP 20338 [TCP segment of a reassembled PDU]
290   0.067303 172.31.29.138 -> 54.230.150.159 TCP 66 53937 > http [ACK] Seq=98 Ack=2446739 Win=768640 Len=0 TSval=14121840 TSecr=1454995800
291   0.067344 54.230.150.159 -> 172.31.29.138 TCP 20338 [TCP segment of a reassembled PDU]
292   0.067423 172.31.29.138 -> 54.230.150.159 TCP 66 53937 > http [ACK] Seq=98 Ack=2467011 Win=748416 Len=0 TSval=14121840 TSecr=1454995800
293   0.067496 54.230.150.159 -> 172.31.29.138 TCP 34818 [TCP segment of a reassembled PDU]
294   0.067518 172.31.29.138 -> 54.230.150.159 TCP 66 53937 > http [ACK] Seq=98 Ack=2501763 Win=744832 Len=0 TSval=14121840 TSecr=1454995800
295   0.068678 54.230.150.159 -> 172.31.29.138 TCP 4410 [TCP segment of a reassembled PDU]
296   0.068684 172.31.29.138 -> 54.230.150.159 TCP 66 53937 > http [ACK] Seq=98 Ack=2506107 Win=794752 Len=0 TSval=14121840 TSecr=1454995801
297   0.068981 54.230.150.159 -> 172.31.29.138 TCP 57986 [TCP segment of a reassembled PDU]
298   0.069006 172.31.29.138 -> 54.230.150.159 TCP 66 53937 > http [ACK] Seq=98 Ack=2564027 Win=736896 Len=0 TSval=14121840 TSecr=1454995801
299   0.069222 54.230.150.159 -> 172.31.29.138 TCP 60882 [TCP segment of a reassembled PDU]
300   0.069238 54.230.150.159 -> 172.31.29.138 TCP 1514 [TCP segment of a reassembled PDU]
301   0.069253 54.230.150.159 -> 172.31.29.138 TCP 5858 [TCP segment of a reassembled PDU]
302   0.069262 172.31.29.138 -> 54.230.150.159 TCP 66 53937 > http [ACK] Seq=98 Ack=2632083 Win=689920 Len=0 TSval=14121840 TSecr=1454995801
303   0.070764 54.230.150.159 -> 172.31.29.138 TCP 14546 [TCP segment of a reassembled PDU]
304   0.070772 172.31.29.138 -> 54.230.150.159 TCP 66 53937 > http [ACK] Seq=98 Ack=2646563 Win=778112 Len=0 TSval=14121841 TSecr=1454995801
305   0.070865 54.230.150.159 -> 172.31.29.138 TCP 26130 [TCP segment of a reassembled PDU]
306   0.070948 172.31.29.138 -> 54.230.150.159 TCP 66 53937 > http [ACK] Seq=98 Ack=2672627 Win=759168 Len=0 TSval=14121841 TSecr=1454995801
307   0.071106 54.230.150.159 -> 172.31.29.138 TCP 47850 [TCP segment of a reassembled PDU]
308   0.071126 54.230.150.159 -> 172.31.29.138 TCP 11650 [TCP segment of a reassembled PDU]
309   0.071142 172.31.29.138 -> 54.230.150.159 TCP 66 53937 > http [ACK] Seq=98 Ack=2731995 Win=704256 Len=0 TSval=14121841 TSecr=1454995801
310   0.071273 54.230.150.159 -> 172.31.29.138 TCP 30474 [TCP segment of a reassembled PDU]
311   0.071282 172.31.29.138 -> 54.230.150.159 TCP 66 53937 > http [ACK] Seq=98 Ack=2762403 Win=751872 Len=0 TSval=14121841 TSecr=1454995801
312   0.072519 54.230.150.159 -> 172.31.29.138 TCP 10202 [TCP segment of a reassembled PDU]
313   0.072526 172.31.29.138 -> 54.230.150.159 TCP 66 53937 > http [ACK] Seq=98 Ack=2772539 Win=785280 Len=0 TSval=14121841 TSecr=1454995801
314   0.072857 54.230.150.159 -> 172.31.29.138 TCP 62330 [TCP segment of a reassembled PDU]
315   0.072885 172.31.29.138 -> 54.230.150.159 TCP 66 53937 > http [ACK] Seq=98 Ack=2834803 Win=723072 Len=0 TSval=14121841 TSecr=1454995801
316   0.073000 54.230.150.159 -> 172.31.29.138 TCP 46402 [TCP segment of a reassembled PDU]
317   0.073013 172.31.29.138 -> 54.230.150.159 TCP 66 53937 > http [ACK] Seq=98 Ack=2881139 Win=725760 Len=0 TSval=14121841 TSecr=1454995801
318   0.073067 54.230.150.159 -> 172.31.29.138 TCP 11650 [TCP segment of a reassembled PDU]
319   0.073073 172.31.29.138 -> 54.230.150.159 TCP 66 53937 > http [ACK] Seq=98 Ack=2892723 Win=782976 Len=0 TSval=14121841 TSecr=1454995801
320   0.074559 54.230.150.159 -> 172.31.29.138 TCP 5858 [TCP segment of a reassembled PDU]
321   0.074565 172.31.29.138 -> 54.230.150.159 TCP 66 53937 > http [ACK] Seq=98 Ack=2898515 Win=792448 Len=0 TSval=14121841 TSecr=1454995801
322   0.074845 54.230.150.159 -> 172.31.29.138 TCP 44954 [TCP segment of a reassembled PDU]
323   0.074871 172.31.29.138 -> 54.230.150.159 TCP 66 53937 > http [ACK] Seq=98 Ack=2943403 Win=747648 Len=0 TSval=14121842 TSecr=1454995801
324   0.075062 54.230.150.159 -> 172.31.29.138 TCP 14546 [TCP segment of a reassembled PDU]
325   0.075069 172.31.29.138 -> 54.230.150.159 TCP 66 53937 > http [ACK] Seq=98 Ack=2957883 Win=778112 Len=0 TSval=14121842 TSecr=1454995801
326   0.075105 54.230.150.159 -> 172.31.29.138 TCP 47850 [TCP segment of a reassembled PDU]
327   0.075133 172.31.29.138 -> 54.230.150.159 TCP 66 53937 > http [ACK] Seq=98 Ack=3005667 Win=730368 Len=0 TSval=14121842 TSecr=1454995801
328   0.075162 54.230.150.159 -> 172.31.29.138 TCP 17442 [TCP segment of a reassembled PDU]
329   0.075174 172.31.29.138 -> 54.230.150.159 TCP 66 53937 > http [ACK] Seq=98 Ack=3023043 Win=713088 Len=0 TSval=14121842 TSecr=1454995801
330   0.076570 54.230.150.159 -> 172.31.29.138 TCP 7306 [TCP segment of a reassembled PDU]
331   0.076576 172.31.29.138 -> 54.230.150.159 TCP 66 53937 > http [ACK] Seq=98 Ack=3030283 Win=790016 Len=0 TSval=14121842 TSecr=1454995801
332   0.076849 54.230.150.159 -> 172.31.29.138 TCP 37714 [TCP segment of a reassembled PDU]
333   0.076884 172.31.29.138 -> 54.230.150.159 TCP 66 53937 > http [ACK] Seq=98 Ack=3067931 Win=752384 Len=0 TSval=14121842 TSecr=1454995801
334   0.076991 54.230.150.159 -> 172.31.29.138 TCP 14546 [TCP segment of a reassembled PDU]
335   0.076997 172.31.29.138 -> 54.230.150.159 TCP 66 53937 > http [ACK] Seq=98 Ack=3082411 Win=778112 Len=0 TSval=14121842 TSecr=1454995801
336   0.077134 54.230.150.159 -> 172.31.29.138 TCP 47850 [TCP segment of a reassembled PDU]
337   0.077169 54.230.150.159 -> 172.31.29.138 TCP 2962 [TCP segment of a reassembled PDU]
338   0.077180 172.31.29.138 -> 54.230.150.159 TCP 66 53937 > http [ACK] Seq=98 Ack=3133091 Win=727552 Len=0 TSval=14121842 TSecr=1454995801
339   0.077216 54.230.150.159 -> 172.31.29.138 TCP 15994 [TCP segment of a reassembled PDU]
340   0.077222 172.31.29.138 -> 54.230.150.159 TCP 66 53937 > http [ACK] Seq=98 Ack=3149019 Win=770816 Len=0 TSval=14121842 TSecr=1454995801
341   0.077247 54.230.150.159 -> 172.31.29.138 TCP 4410 [TCP segment of a reassembled PDU]
342   0.077251 172.31.29.138 -> 54.230.150.159 TCP 66 53937 > http [ACK] Seq=98 Ack=3153363 Win=794752 Len=0 TSval=14121842 TSecr=1454995801
343   0.078364 54.230.150.159 -> 172.31.29.138 TCP 11650 [TCP segment of a reassembled PDU]
344   0.078386 172.31.29.138 -> 54.230.150.159 TCP 66 53937 > http [ACK] Seq=98 Ack=3164947 Win=800896 Len=0 TSval=14121842 TSecr=1454995802
345   0.078623 54.230.150.159 -> 172.31.29.138 TCP 27578 [TCP segment of a reassembled PDU]
