[Measurement for 10mb at 05:36:55 20.36.2014] 
Tshark:

  1   0.000000 172.31.29.138 -> 172.31.0.2   DNS 89 Standard query 0x94ee  A d1dx94olpiqj0t.cloudfront.net
  2   0.000025 172.31.29.138 -> 172.31.0.2   DNS 89 Standard query 0x37da  AAAA d1dx94olpiqj0t.cloudfront.net
  3   0.000593   172.31.0.2 -> 172.31.29.138 DNS 217 Standard query response 0x94ee  A 54.230.150.15 A 54.230.150.42 A 54.230.150.65 A 54.230.150.109 A 54.230.150.114 A 54.230.151.182 A 54.230.151.234 A 54.230.150.12
  4   0.000603   172.31.0.2 -> 172.31.29.138 DNS 176 Standard query response 0x37da 
  5   0.003871 172.31.29.138 -> 54.230.150.15 TCP 74 57554 > http [SYN] Seq=0 Win=26883 Len=0 MSS=8961 SACK_PERM=1 TSval=11422063 TSecr=0 WS=128
  6   0.005401 54.230.150.15 -> 172.31.29.138 TCP 74 http > 57554 [SYN, ACK] Seq=0 Ack=1 Win=14480 Len=0 MSS=1460 SACK_PERM=1 TSval=1454064391 TSecr=11422063 WS=128
  7   0.005414 172.31.29.138 -> 54.230.150.15 TCP 66 57554 > http [ACK] Seq=1 Ack=1 Win=27008 Len=0 TSval=11422063 TSecr=1454064391
  8   0.005465 172.31.29.138 -> 54.230.150.15 HTTP 163 GET /10mb HTTP/1.1 
  9   0.006834 54.230.150.15 -> 172.31.29.138 TCP 66 http > 57554 [ACK] Seq=1 Ack=98 Win=14592 Len=0 TSval=1454064392 TSecr=11422063
 10   0.008739 54.230.150.15 -> 172.31.29.138 TCP 524 [TCP segment of a reassembled PDU]
 11   0.008745 172.31.29.138 -> 54.230.150.15 TCP 66 57554 > http [ACK] Seq=98 Ack=459 Win=28032 Len=0 TSval=11422064 TSecr=1454064392
 12   0.008778 54.230.150.15 -> 172.31.29.138 TCP 4410 [TCP segment of a reassembled PDU]
 13   0.008784 172.31.29.138 -> 54.230.150.15 TCP 66 57554 > http [ACK] Seq=98 Ack=4803 Win=36736 Len=0 TSval=11422064 TSecr=1454064392
 14   0.008825 54.230.150.15 -> 172.31.29.138 TCP 8754 [TCP segment of a reassembled PDU]
 15   0.008831 172.31.29.138 -> 54.230.150.15 TCP 66 57554 > http [ACK] Seq=98 Ack=13491 Win=54144 Len=0 TSval=11422064 TSecr=1454064392
 16   0.010298 54.230.150.15 -> 172.31.29.138 TCP 2962 [TCP segment of a reassembled PDU]
 17   0.010316 172.31.29.138 -> 54.230.150.15 TCP 66 57554 > http [ACK] Seq=98 Ack=16387 Win=59904 Len=0 TSval=11422065 TSecr=1454064392
 18   0.010361 54.230.150.15 -> 172.31.29.138 TCP 10202 [TCP segment of a reassembled PDU]
 19   0.010370 172.31.29.138 -> 54.230.150.15 TCP 66 57554 > http [ACK] Seq=98 Ack=26523 Win=80128 Len=0 TSval=11422065 TSecr=1454064392
 20   0.011885 54.230.150.15 -> 172.31.29.138 TCP 5858 [TCP segment of a reassembled PDU]
 21   0.011892 172.31.29.138 -> 54.230.150.15 TCP 66 57554 > http [ACK] Seq=98 Ack=32315 Win=91776 Len=0 TSval=11422065 TSecr=1454064392
 22   0.012025 54.230.150.15 -> 172.31.29.138 TCP 15994 [TCP segment of a reassembled PDU]
 23   0.012035 172.31.29.138 -> 54.230.150.15 TCP 66 57554 > http [ACK] Seq=98 Ack=48243 Win=91648 Len=0 TSval=11422065 TSecr=1454064392
 24   0.013390 54.230.150.15 -> 172.31.29.138 TCP 4410 [TCP segment of a reassembled PDU]
 25   0.013397 172.31.29.138 -> 54.230.150.15 TCP 66 57554 > http [ACK] Seq=98 Ack=52587 Win=100480 Len=0 TSval=11422065 TSecr=1454064392
 26   0.013642 54.230.150.15 -> 172.31.29.138 TCP 4410 [TCP segment of a reassembled PDU]
 27   0.013648 172.31.29.138 -> 54.230.150.15 TCP 66 57554 > http [ACK] Seq=98 Ack=56931 Win=109056 Len=0 TSval=11422066 TSecr=1454064392
 28   0.013706 54.230.150.15 -> 172.31.29.138 TCP 8754 [TCP segment of a reassembled PDU]
 29   0.013713 172.31.29.138 -> 54.230.150.15 TCP 66 57554 > http [ACK] Seq=98 Ack=65619 Win=126464 Len=0 TSval=11422066 TSecr=1454064392
 30   0.014970 54.230.150.15 -> 172.31.29.138 TCP 11650 [TCP segment of a reassembled PDU]
 31   0.014978 172.31.29.138 -> 54.230.150.15 TCP 66 57554 > http [ACK] Seq=98 Ack=77203 Win=149632 Len=0 TSval=11422066 TSecr=1454064392
 32   0.014984 54.230.150.15 -> 172.31.29.138 TCP 1514 [TCP segment of a reassembled PDU]
 33   0.014987 172.31.29.138 -> 54.230.150.15 TCP 66 57554 > http [ACK] Seq=98 Ack=78651 Win=152448 Len=0 TSval=11422066 TSecr=1454064392
 34   0.015199 54.230.150.15 -> 172.31.29.138 TCP 1514 [TCP segment of a reassembled PDU]
 35   0.015204 172.31.29.138 -> 54.230.150.15 TCP 66 57554 > http [ACK] Seq=98 Ack=80099 Win=155392 Len=0 TSval=11422066 TSecr=1454064392
 36   0.015286 54.230.150.15 -> 172.31.29.138 TCP 14546 [TCP segment of a reassembled PDU]
 37   0.015295 172.31.29.138 -> 54.230.150.15 TCP 66 57554 > http [ACK] Seq=98 Ack=94579 Win=184320 Len=0 TSval=11422066 TSecr=1454064392
 38   0.016496 54.230.150.15 -> 172.31.29.138 TCP 5858 [TCP segment of a reassembled PDU]
 39   0.016503 172.31.29.138 -> 54.230.150.15 TCP 66 57554 > http [ACK] Seq=98 Ack=100371 Win=195968 Len=0 TSval=11422066 TSecr=1454064392
 40   0.016536 54.230.150.15 -> 172.31.29.138 TCP 4410 [TCP segment of a reassembled PDU]
 41   0.016541 172.31.29.138 -> 54.230.150.15 TCP 66 57554 > http [ACK] Seq=98 Ack=104715 Win=204672 Len=0 TSval=11422066 TSecr=1454064392
 42   0.016572 54.230.150.15 -> 172.31.29.138 TCP 4410 [TCP segment of a reassembled PDU]
 43   0.016577 172.31.29.138 -> 54.230.150.15 TCP 66 57554 > http [ACK] Seq=98 Ack=109059 Win=213376 Len=0 TSval=11422066 TSecr=1454064393
 44   0.016809 54.230.150.15 -> 172.31.29.138 TCP 20338 [TCP segment of a reassembled PDU]
 45   0.016822 172.31.29.138 -> 54.230.150.15 TCP 66 57554 > http [ACK] Seq=98 Ack=129331 Win=253824 Len=0 TSval=11422066 TSecr=1454064393
 46   0.018005 54.230.150.15 -> 172.31.29.138 TCP 1514 [TCP segment of a reassembled PDU]
 47   0.018011 172.31.29.138 -> 54.230.150.15 TCP 66 57554 > http [ACK] Seq=98 Ack=130779 Win=256768 Len=0 TSval=11422067 TSecr=1454064393
 48   0.018094 54.230.150.15 -> 172.31.29.138 TCP 17442 [TCP segment of a reassembled PDU]
 49   0.018104 172.31.29.138 -> 54.230.150.15 TCP 66 57554 > http [ACK] Seq=98 Ack=148155 Win=291456 Len=0 TSval=11422067 TSecr=1454064393
 50   0.018318 54.230.150.15 -> 172.31.29.138 TCP 8754 [TCP segment of a reassembled PDU]
 51   0.018325 172.31.29.138 -> 54.230.150.15 TCP 66 57554 > http [ACK] Seq=98 Ack=156843 Win=308864 Len=0 TSval=11422067 TSecr=1454064393
 52   0.019549 54.230.150.15 -> 172.31.29.138 TCP 7306 [TCP segment of a reassembled PDU]
 53   0.019564 172.31.29.138 -> 54.230.150.15 TCP 66 57554 > http [ACK] Seq=98 Ack=164083 Win=323328 Len=0 TSval=11422067 TSecr=1454064393
 54   0.019682 54.230.150.15 -> 172.31.29.138 TCP 18890 [TCP segment of a reassembled PDU]
 55   0.019691 172.31.29.138 -> 54.230.150.15 TCP 66 57554 > http [ACK] Seq=98 Ack=182907 Win=360960 Len=0 TSval=11422067 TSecr=1454064393
 56   0.019708 54.230.150.15 -> 172.31.29.138 TCP 8754 [TCP segment of a reassembled PDU]
 57   0.019713 172.31.29.138 -> 54.230.150.15 TCP 66 57554 > http [ACK] Seq=98 Ack=191595 Win=378368 Len=0 TSval=11422067 TSecr=1454064393
 58   0.019730 54.230.150.15 -> 172.31.29.138 TCP 10202 [TCP segment of a reassembled PDU]
 59   0.019737 172.31.29.138 -> 54.230.150.15 TCP 66 57554 > http [ACK] Seq=98 Ack=201731 Win=398720 Len=0 TSval=11422067 TSecr=1454064393
 60   0.021053 54.230.150.15 -> 172.31.29.138 TCP 2962 [TCP segment of a reassembled PDU]
 61   0.021058 172.31.29.138 -> 54.230.150.15 TCP 66 57554 > http [ACK] Seq=98 Ack=204627 Win=404480 Len=0 TSval=11422067 TSecr=1454064393
 62   0.021264 54.230.150.15 -> 172.31.29.138 TCP 26130 [TCP segment of a reassembled PDU]
 63   0.021278 172.31.29.138 -> 54.230.150.15 TCP 66 57554 > http [ACK] Seq=98 Ack=230691 Win=456576 Len=0 TSval=11422067 TSecr=1454064393
 64   0.021296 54.230.150.15 -> 172.31.29.138 TCP 15994 [TCP segment of a reassembled PDU]
 65   0.021305 172.31.29.138 -> 54.230.150.15 TCP 66 57554 > http [ACK] Seq=98 Ack=246619 Win=488448 Len=0 TSval=11422067 TSecr=1454064393
 66   0.021313 54.230.150.15 -> 172.31.29.138 TCP 5858 [TCP segment of a reassembled PDU]
 67   0.021320 172.31.29.138 -> 54.230.150.15 TCP 66 57554 > http [ACK] Seq=98 Ack=252411 Win=499968 Len=0 TSval=11422067 TSecr=1454064393
 68   0.022617 54.230.150.15 -> 172.31.29.138 TCP 1514 [TCP segment of a reassembled PDU]
 69   0.022622 172.31.29.138 -> 54.230.150.15 TCP 66 57554 > http [ACK] Seq=98 Ack=253859 Win=502912 Len=0 TSval=11422068 TSecr=1454064393
 70   0.022879 54.230.150.15 -> 172.31.29.138 TCP 4410 [TCP segment of a reassembled PDU]
 71   0.022885 172.31.29.138 -> 54.230.150.15 TCP 66 57554 > http [ACK] Seq=98 Ack=258203 Win=511616 Len=0 TSval=11422068 TSecr=1454064393
 72   0.023004 54.230.150.15 -> 172.31.29.138 TCP 18890 [TCP segment of a reassembled PDU]
 73   0.023013 172.31.29.138 -> 54.230.150.15 TCP 66 57554 > http [ACK] Seq=98 Ack=277027 Win=549248 Len=0 TSval=11422068 TSecr=1454064393
 74   0.023021 54.230.150.15 -> 172.31.29.138 TCP 1514 [TCP Previous segment not captured] [TCP segment of a reassembled PDU]
 75   0.023023 172.31.29.138 -> 54.230.150.15 TCP 78 [TCP Window Update] 57554 > http [ACK] Seq=98 Ack=277027 Win=552192 Len=0 TSval=11422068 TSecr=1454064393 SLE=278475 SRE=279923
 76   0.023026 54.230.150.15 -> 172.31.29.138 TCP 1514 [TCP Out-Of-Order] [TCP segment of a reassembled PDU]
 77   0.023028 172.31.29.138 -> 54.230.150.15 TCP 66 57554 > http [ACK] Seq=98 Ack=279923 Win=549760 Len=0 TSval=11422068 TSecr=1454064393
 78   0.023145 54.230.150.15 -> 172.31.29.138 TCP 18890 [TCP segment of a reassembled PDU]
 79   0.023156 172.31.29.138 -> 54.230.150.15 TCP 66 57554 > http [ACK] Seq=98 Ack=298747 Win=554752 Len=0 TSval=11422068 TSecr=1454064393
 80   0.024580 54.230.150.15 -> 172.31.29.138 TCP 26130 [TCP segment of a reassembled PDU]
 81   0.024593 172.31.29.138 -> 54.230.150.15 TCP 66 57554 > http [ACK] Seq=98 Ack=324811 Win=542848 Len=0 TSval=11422068 TSecr=1454064393
 82   0.024612 54.230.150.15 -> 172.31.29.138 TCP 18890 [TCP segment of a reassembled PDU]
 83   0.024621 172.31.29.138 -> 54.230.150.15 TCP 66 57554 > http [ACK] Seq=98 Ack=343635 Win=524032 Len=0 TSval=11422068 TSecr=1454064393
 84   0.026177 54.230.150.15 -> 172.31.29.138 TCP 4410 [TCP segment of a reassembled PDU]
 85   0.026183 172.31.29.138 -> 54.230.150.15 TCP 66 57554 > http [ACK] Seq=98 Ack=347979 Win=578560 Len=0 TSval=11422069 TSecr=1454064393
 86   0.026365 54.230.150.15 -> 172.31.29.138 TCP 26130 [TCP segment of a reassembled PDU]
 87   0.026378 172.31.29.138 -> 54.230.150.15 TCP 66 57554 > http [ACK] Seq=98 Ack=374043 Win=552576 Len=0 TSval=11422069 TSecr=1454064393
 88   0.026394 54.230.150.15 -> 172.31.29.138 TCP 13098 [TCP segment of a reassembled PDU]
 89   0.026401 172.31.29.138 -> 54.230.150.15 TCP 66 57554 > http [ACK] Seq=98 Ack=387075 Win=539648 Len=0 TSval=11422069 TSecr=1454064393
 90   0.026457 54.230.150.15 -> 172.31.29.138 TCP 21786 [TCP segment of a reassembled PDU]
 91   0.026468 172.31.29.138 -> 54.230.150.15 TCP 66 57554 > http [ACK] Seq=98 Ack=408795 Win=518016 Len=0 TSval=11422069 TSecr=1454064393
 92   0.028071 54.230.150.15 -> 172.31.29.138 TCP 8754 [TCP segment of a reassembled PDU]
 93   0.028099 172.31.29.138 -> 54.230.150.15 TCP 66 57554 > http [ACK] Seq=98 Ack=417483 Win=580480 Len=0 TSval=11422069 TSecr=1454064394
 94   0.028194 54.230.150.15 -> 172.31.29.138 TCP 18890 [TCP segment of a reassembled PDU]
 95   0.028205 172.31.29.138 -> 54.230.150.15 TCP 66 57554 > http [ACK] Seq=98 Ack=436307 Win=563712 Len=0 TSval=11422069 TSecr=1454064394
 96   0.028230 54.230.150.15 -> 172.31.29.138 TCP 7306 [TCP segment of a reassembled PDU]
 97   0.028235 172.31.29.138 -> 54.230.150.15 TCP 66 57554 > http [ACK] Seq=98 Ack=443547 Win=556544 Len=0 TSval=11422069 TSecr=1454064394
 98   0.028313 54.230.150.15 -> 172.31.29.138 TCP 30474 [TCP segment of a reassembled PDU]
 99   0.028327 172.31.29.138 -> 54.230.150.15 TCP 66 57554 > http [ACK] Seq=98 Ack=473955 Win=544640 Len=0 TSval=11422069 TSecr=1454064394
100   0.029758 54.230.150.15 -> 172.31.29.138 TCP 2962 [TCP segment of a reassembled PDU]
101   0.029764 172.31.29.138 -> 54.230.150.15 TCP 66 57554 > http [ACK] Seq=98 Ack=476851 Win=587648 Len=0 TSval=11422070 TSecr=1454064394
102   0.029954 54.230.150.15 -> 172.31.29.138 TCP 21786 [TCP segment of a reassembled PDU]
103   0.029965 172.31.29.138 -> 54.230.150.15 TCP 66 57554 > http [ACK] Seq=98 Ack=498571 Win=566016 Len=0 TSval=11422070 TSecr=1454064394
104   0.029982 54.230.150.15 -> 172.31.29.138 TCP 4410 [TCP segment of a reassembled PDU]
105   0.029985 172.31.29.138 -> 54.230.150.15 TCP 66 57554 > http [ACK] Seq=98 Ack=502915 Win=561792 Len=0 TSval=11422070 TSecr=1454064394
106   0.030132 54.230.150.15 -> 172.31.29.138 TCP 36266 [TCP segment of a reassembled PDU]
107   0.030148 172.31.29.138 -> 54.230.150.15 TCP 66 57554 > http [ACK] Seq=98 Ack=539115 Win=535168 Len=0 TSval=11422070 TSecr=1454064394
108   0.031592 54.230.150.15 -> 172.31.29.138 TCP 7306 [TCP segment of a reassembled PDU]
109   0.031599 172.31.29.138 -> 54.230.150.15 TCP 66 57554 > http [ACK] Seq=98 Ack=546355 Win=582784 Len=0 TSval=11422070 TSecr=1454064394
110   0.031729 54.230.150.15 -> 172.31.29.138 TCP 26130 [TCP segment of a reassembled PDU]
111   0.031752 172.31.29.138 -> 54.230.150.15 TCP 66 57554 > http [ACK] Seq=98 Ack=572419 Win=556800 Len=0 TSval=11422070 TSecr=1454064394
112   0.031779 54.230.150.15 -> 172.31.29.138 TCP 26130 [TCP segment of a reassembled PDU]
113   0.031793 54.230.150.15 -> 172.31.29.138 TCP 5858 [TCP segment of a reassembled PDU]
114   0.031807 172.31.29.138 -> 54.230.150.15 TCP 66 57554 > http [ACK] Seq=98 Ack=604275 Win=542336 Len=0 TSval=11422070 TSecr=1454064394
115   0.033200 54.230.150.15 -> 172.31.29.138 TCP 8754 [TCP segment of a reassembled PDU]
116   0.033209 172.31.29.138 -> 54.230.150.15 TCP 66 57554 > http [ACK] Seq=98 Ack=612963 Win=580480 Len=0 TSval=11422070 TSecr=1454064394
117   0.033325 54.230.150.15 -> 172.31.29.138 TCP 26130 [TCP segment of a reassembled PDU]
118   0.033369 54.230.150.15 -> 172.31.29.138 TCP 21786 [TCP segment of a reassembled PDU]
119   0.033380 172.31.29.138 -> 54.230.150.15 TCP 66 57554 > http [ACK] Seq=98 Ack=639027 Win=554496 Len=0 TSval=11422070 TSecr=1454064394
120   0.033397 54.230.150.15 -> 172.31.29.138 TCP 4410 [TCP segment of a reassembled PDU]
121   0.033407 172.31.29.138 -> 54.230.150.15 TCP 66 57554 > http [ACK] Seq=98 Ack=665091 Win=551808 Len=0 TSval=11422070 TSecr=1454064394
122   0.033444 54.230.150.15 -> 172.31.29.138 TCP 4410 [TCP segment of a reassembled PDU]
123   0.033450 172.31.29.138 -> 54.230.150.15 TCP 66 57554 > http [ACK] Seq=98 Ack=669435 Win=587520 Len=0 TSval=11422070 TSecr=1454064394
124   0.034436 54.230.150.15 -> 172.31.29.138 TCP 5858 [TCP segment of a reassembled PDU]
125   0.034454 172.31.29.138 -> 54.230.150.15 TCP 66 57554 > http [ACK] Seq=98 Ack=675227 Win=587648 Len=0 TSval=11422071 TSecr=1454064394
126   0.034637 54.230.150.15 -> 172.31.29.138 TCP 27578 [TCP segment of a reassembled PDU]
127   0.034650 172.31.29.138 -> 54.230.150.15 TCP 66 57554 > http [ACK] Seq=98 Ack=702739 Win=642688 Len=0 TSval=11422071 TSecr=1454064394
128   0.035018 54.230.150.15 -> 172.31.29.138 TCP 20338 [TCP segment of a reassembled PDU]
129   0.035029 172.31.29.138 -> 54.230.150.15 TCP 66 57554 > http [ACK] Seq=98 Ack=723011 Win=683136 Len=0 TSval=11422071 TSecr=1454064394
130   0.035043 54.230.150.15 -> 172.31.29.138 TCP 2962 [TCP segment of a reassembled PDU]
131   0.035046 172.31.29.138 -> 54.230.150.15 TCP 66 57554 > http [ACK] Seq=98 Ack=725907 Win=689024 Len=0 TSval=11422071 TSecr=1454064394
132   0.035101 54.230.150.15 -> 172.31.29.138 TCP 8754 [TCP segment of a reassembled PDU]
133   0.035109 172.31.29.138 -> 54.230.150.15 TCP 66 57554 > http [ACK] Seq=98 Ack=734595 Win=706304 Len=0 TSval=11422071 TSecr=1454064394
134   0.035743 54.230.150.15 -> 172.31.29.138 TCP 1514 [TCP segment of a reassembled PDU]
135   0.035748 172.31.29.138 -> 54.230.150.15 TCP 66 57554 > http [ACK] Seq=98 Ack=736043 Win=709248 Len=0 TSval=11422071 TSecr=1454064394
136   0.035900 54.230.150.15 -> 172.31.29.138 TCP 26130 [TCP segment of a reassembled PDU]
137   0.035913 172.31.29.138 -> 54.230.150.15 TCP 66 57554 > http [ACK] Seq=98 Ack=762107 Win=761344 Len=0 TSval=11422071 TSecr=1454064394
138   0.035925 54.230.150.15 -> 172.31.29.138 TCP 8754 [TCP segment of a reassembled PDU]
139   0.035930 172.31.29.138 -> 54.230.150.15 TCP 66 57554 > http [ACK] Seq=98 Ack=770795 Win=778752 Len=0 TSval=11422071 TSecr=1454064394
140   0.035988 54.230.150.15 -> 172.31.29.138 TCP 10202 [TCP segment of a reassembled PDU]
141   0.035996 172.31.29.138 -> 54.230.150.15 TCP 66 57554 > http [ACK] Seq=98 Ack=780931 Win=798976 Len=0 TSval=11422071 TSecr=1454064394
142   0.036151 54.230.150.15 -> 172.31.29.138 TCP 18890 [TCP segment of a reassembled PDU]
143   0.036161 172.31.29.138 -> 54.230.150.15 TCP 66 57554 > http [ACK] Seq=98 Ack=799755 Win=836608 Len=0 TSval=11422071 TSecr=1454064394
144   0.036765 54.230.150.15 -> 172.31.29.138 TCP 10202 [TCP segment of a reassembled PDU]
145   0.036773 172.31.29.138 -> 54.230.150.15 TCP 66 57554 > http [ACK] Seq=98 Ack=809891 Win=856960 Len=0 TSval=11422071 TSecr=1454064395
146   0.036880 54.230.150.15 -> 172.31.29.138 TCP 23234 [TCP segment of a reassembled PDU]
147   0.036892 172.31.29.138 -> 54.230.150.15 TCP 66 57554 > http [ACK] Seq=98 Ack=833059 Win=903296 Len=0 TSval=11422071 TSecr=1454064395
148   0.036899 54.230.150.15 -> 172.31.29.138 TCP 1514 [TCP segment of a reassembled PDU]
149   0.036901 172.31.29.138 -> 54.230.150.15 TCP 66 57554 > http [ACK] Seq=98 Ack=834507 Win=906112 Len=0 TSval=11422071 TSecr=1454064395
150   0.036908 54.230.150.15 -> 172.31.29.138 TCP 1514 [TCP segment of a reassembled PDU]
151   0.036911 172.31.29.138 -> 54.230.150.15 TCP 66 57554 > http [ACK] Seq=98 Ack=835955 Win=909056 Len=0 TSval=11422071 TSecr=1454064395
152   0.037263 54.230.150.15 -> 172.31.29.138 TCP 7306 [TCP segment of a reassembled PDU]
153   0.037270 172.31.29.138 -> 54.230.150.15 TCP 66 57554 > http [ACK] Seq=98 Ack=843195 Win=923520 Len=0 TSval=11422071 TSecr=1454064395
154   0.037451 54.230.150.15 -> 172.31.29.138 TCP 21786 [TCP segment of a reassembled PDU]
155   0.037475 172.31.29.138 -> 54.230.150.15 TCP 66 57554 > http [ACK] Seq=98 Ack=864915 Win=967040 Len=0 TSval=11422071 TSecr=1454064395
156   0.037748 54.230.150.15 -> 172.31.29.138 TCP 11650 [TCP segment of a reassembled PDU]
157   0.037757 172.31.29.138 -> 54.230.150.15 TCP 66 57554 > http [ACK] Seq=98 Ack=876499 Win=990208 Len=0 TSval=11422072 TSecr=1454064395
158   0.037886 54.230.150.15 -> 172.31.29.138 TCP 18890 [TCP segment of a reassembled PDU]
159   0.037897 172.31.29.138 -> 54.230.150.15 TCP 66 57554 > http [ACK] Seq=98 Ack=895323 Win=1027840 Len=0 TSval=11422072 TSecr=1454064395
160   0.037921 54.230.150.15 -> 172.31.29.138 TCP 7306 [TCP segment of a reassembled PDU]
161   0.037925 172.31.29.138 -> 54.230.150.15 TCP 66 57554 > http [ACK] Seq=98 Ack=902563 Win=1038336 Len=0 TSval=11422072 TSecr=1454064395
162   0.037956 54.230.150.15 -> 172.31.29.138 TCP 5858 [TCP segment of a reassembled PDU]
163   0.037963 172.31.29.138 -> 54.230.150.15 TCP 66 57554 > http [ACK] Seq=98 Ack=908355 Win=1053824 Len=0 TSval=11422072 TSecr=1454064395
164   0.038469 54.230.150.15 -> 172.31.29.138 TCP 4410 [TCP segment of a reassembled PDU]
165   0.038475 172.31.29.138 -> 54.230.150.15 TCP 66 57554 > http [ACK] Seq=98 Ack=912699 Win=1062528 Len=0 TSval=11422072 TSecr=1454064395
166   0.038625 54.230.150.15 -> 172.31.29.138 TCP 17442 [TCP segment of a reassembled PDU]
167   0.038646 172.31.29.138 -> 54.230.150.15 TCP 66 57554 > http [ACK] Seq=98 Ack=930075 Win=1052672 Len=0 TSval=11422072 TSecr=1454064395
168   0.038960 54.230.150.15 -> 172.31.29.138 TCP 1514 [TCP segment of a reassembled PDU]
169   0.038965 172.31.29.138 -> 54.230.150.15 TCP 66 57554 > http [ACK] Seq=98 Ack=931523 Win=1065472 Len=0 TSval=11422072 TSecr=1454064395
170   0.039127 54.230.150.15 -> 172.31.29.138 TCP 17442 [TCP segment of a reassembled PDU]
171   0.039138 54.230.150.15 -> 172.31.29.138 TCP 1514 [TCP Previous segment not captured] [TCP segment of a reassembled PDU]
172   0.039141 172.31.29.138 -> 54.230.150.15 TCP 78 57554 > http [ACK] Seq=98 Ack=948899 Win=1050112 Len=0 TSval=11422072 TSecr=1454064395 SLE=950347 SRE=951795
173   0.039147 54.230.150.15 -> 172.31.29.138 TCP 1514 [TCP Out-Of-Order] [TCP segment of a reassembled PDU]
174   0.039150 172.31.29.138 -> 54.230.150.15 TCP 66 57554 > http [ACK] Seq=98 Ack=951795 Win=1047680 Len=0 TSval=11422072 TSecr=1454064395
175   0.039268 54.230.150.15 -> 172.31.29.138 TCP 30474 [TCP segment of a reassembled PDU]
176   0.039283 172.31.29.138 -> 54.230.150.15 TCP 66 57554 > http [ACK] Seq=98 Ack=982203 Win=1031168 Len=0 TSval=11422072 TSecr=1454064395
177   0.039296 54.230.150.15 -> 172.31.29.138 TCP 13098 [TCP segment of a reassembled PDU]
178   0.039303 172.31.29.138 -> 54.230.150.15 TCP 66 57554 > http [ACK] Seq=98 Ack=995235 Win=1018240 Len=0 TSval=11422072 TSecr=1454064395
179   0.039997 54.230.150.15 -> 172.31.29.138 TCP 2962 [TCP segment of a reassembled PDU]
180   0.040003 172.31.29.138 -> 54.230.150.15 TCP 66 57554 > http [ACK] Seq=98 Ack=998131 Win=1071232 Len=0 TSval=11422072 TSecr=1454064395
181   0.040181 54.230.150.15 -> 172.31.29.138 TCP 26130 [TCP segment of a reassembled PDU]
182   0.040195 172.31.29.138 -> 54.230.150.15 TCP 66 57554 > http [ACK] Seq=98 Ack=1024195 Win=1045248 Len=0 TSval=11422072 TSecr=1454064395
183   0.040208 54.230.150.15 -> 172.31.29.138 TCP 13098 [TCP segment of a reassembled PDU]
184   0.040213 172.31.29.138 -> 54.230.150.15 TCP 66 57554 > http [ACK] Seq=98 Ack=1037227 Win=1032320 Len=0 TSval=11422072 TSecr=1454064395
185   0.040775 54.230.150.15 -> 172.31.29.138 TCP 4410 [TCP segment of a reassembled PDU]
186   0.040781 172.31.29.138 -> 54.230.150.15 TCP 66 57554 > http [ACK] Seq=98 Ack=1041571 Win=1074048 Len=0 TSval=11422072 TSecr=1454064395
187   0.040943 54.230.150.15 -> 172.31.29.138 TCP 18890 [TCP segment of a reassembled PDU]
188   0.040954 172.31.29.138 -> 54.230.150.15 TCP 66 57554 > http [ACK] Seq=98 Ack=1060395 Win=1055232 Len=0 TSval=11422072 TSecr=1454064395
189   0.041550 54.230.150.15 -> 172.31.29.138 TCP 5858 [TCP segment of a reassembled PDU]
190   0.041556 172.31.29.138 -> 54.230.150.15 TCP 66 57554 > http [ACK] Seq=98 Ack=1066187 Win=1071744 Len=0 TSval=11422073 TSecr=1454064395
191   0.041729 54.230.150.15 -> 172.31.29.138 TCP 26130 [TCP segment of a reassembled PDU]
192   0.041743 172.31.29.138 -> 54.230.150.15 TCP 66 57554 > http [ACK] Seq=98 Ack=1092251 Win=1045760 Len=0 TSval=11422073 TSecr=1454064395
193   0.041784 54.230.150.15 -> 172.31.29.138 TCP 26130 [TCP segment of a reassembled PDU]
194   0.041796 172.31.29.138 -> 54.230.150.15 TCP 66 57554 > http [ACK] Seq=98 Ack=1118315 Win=1019776 Len=0 TSval=11422073 TSecr=1454064395
195   0.041808 54.230.150.15 -> 172.31.29.138 TCP 7306 [TCP segment of a reassembled PDU]
196   0.041812 172.31.29.138 -> 54.230.150.15 TCP 66 57554 > http [ACK] Seq=98 Ack=1125555 Win=1012608 Len=0 TSval=11422073 TSecr=1454064395
197   0.042334 54.230.150.15 -> 172.31.29.138 TCP 1514 [TCP segment of a reassembled PDU]
198   0.042339 172.31.29.138 -> 54.230.150.15 TCP 66 57554 > http [ACK] Seq=98 Ack=1127003 Win=1078784 Len=0 TSval=11422073 TSecr=1454064395
199   0.042531 54.230.150.15 -> 172.31.29.138 TCP 26130 [TCP segment of a reassembled PDU]
200   0.042544 172.31.29.138 -> 54.230.150.15 TCP 66 57554 > http [ACK] Seq=98 Ack=1153067 Win=1052800 Len=0 TSval=11422073 TSecr=1454064395
201   0.042556 54.230.150.15 -> 172.31.29.138 TCP 10202 [TCP segment of a reassembled PDU]
202   0.042561 172.31.29.138 -> 54.230.150.15 TCP 66 57554 > http [ACK] Seq=98 Ack=1163203 Win=1042688 Len=0 TSval=11422073 TSecr=1454064395
203   0.043146 54.230.150.15 -> 172.31.29.138 TCP 10202 [TCP segment of a reassembled PDU]
204   0.043153 172.31.29.138 -> 54.230.150.15 TCP 66 57554 > http [ACK] Seq=98 Ack=1173339 Win=1064576 Len=0 TSval=11422073 TSecr=1454064395
205   0.043272 54.230.150.15 -> 172.31.29.138 TCP 17442 [TCP segment of a reassembled PDU]
206   0.043282 172.31.29.138 -> 54.230.150.15 TCP 66 57554 > http [ACK] Seq=98 Ack=1190715 Win=1052672 Len=0 TSval=11422073 TSecr=1454064395
207   0.043339 54.230.150.15 -> 172.31.29.138 TCP 26130 [TCP segment of a reassembled PDU]
208   0.043374 172.31.29.138 -> 54.230.150.15 TCP 66 57554 > http [ACK] Seq=98 Ack=1216779 Win=1038464 Len=0 TSval=11422073 TSecr=1454064395
209   0.043399 54.230.150.15 -> 172.31.29.138 TCP 17442 [TCP segment of a reassembled PDU]
210   0.043414 172.31.29.138 -> 54.230.150.15 TCP 66 57554 > http [ACK] Seq=98 Ack=1234155 Win=1052672 Len=0 TSval=11422073 TSecr=1454064395
211   0.043889 54.230.150.15 -> 172.31.29.138 TCP 5858 [TCP segment of a reassembled PDU]
212   0.043896 172.31.29.138 -> 54.230.150.15 TCP 66 57554 > http [ACK] Seq=98 Ack=1239947 Win=1071744 Len=0 TSval=11422073 TSecr=1454064395
213   0.044033 54.230.150.15 -> 172.31.29.138 TCP 15994 [TCP segment of a reassembled PDU]
214   0.044054 172.31.29.138 -> 54.230.150.15 TCP 66 57554 > http [ACK] Seq=98 Ack=1255875 Win=1079936 Len=0 TSval=11422073 TSecr=1454064395
215   0.044673 54.230.150.15 -> 172.31.29.138 TCP 5858 [TCP segment of a reassembled PDU]
216   0.044698 172.31.29.138 -> 54.230.150.15 TCP 66 57554 > http [ACK] Seq=98 Ack=1261667 Win=1079936 Len=0 TSval=11422073 TSecr=1454064395
217   0.044855 54.230.150.15 -> 172.31.29.138 TCP 26130 [TCP segment of a reassembled PDU]
218   0.044873 54.230.150.15 -> 172.31.29.138 TCP 8754 [TCP segment of a reassembled PDU]
219   0.044889 172.31.29.138 -> 54.230.150.15 TCP 66 57554 > http [ACK] Seq=98 Ack=1296419 Win=1045248 Len=0 TSval=11422073 TSecr=1454064395
220   0.044907 54.230.150.15 -> 172.31.29.138 TCP 17442 [TCP segment of a reassembled PDU]
221   0.044926 172.31.29.138 -> 54.230.150.15 TCP 66 57554 > http [ACK] Seq=98 Ack=1313795 Win=1038336 Len=0 TSval=11422073 TSecr=1454064395
222   0.044941 54.230.150.15 -> 172.31.29.138 TCP 7306 [TCP segment of a reassembled PDU]
223   0.044953 172.31.29.138 -> 54.230.150.15 TCP 66 57554 > http [ACK] Seq=98 Ack=1321035 Win=1040640 Len=0 TSval=11422073 TSecr=1454064395
224   0.045452 54.230.150.15 -> 172.31.29.138 TCP 4410 [TCP segment of a reassembled PDU]
225   0.045458 172.31.29.138 -> 54.230.150.15 TCP 66 57554 > http [ACK] Seq=98 Ack=1325379 Win=1074048 Len=0 TSval=11422074 TSecr=1454064395
226   0.045630 54.230.150.15 -> 172.31.29.138 TCP 24682 [TCP segment of a reassembled PDU]
227   0.045650 54.230.150.15 -> 172.31.29.138 TCP 1514 [TCP segment of a reassembled PDU]
228   0.045660 172.31.29.138 -> 54.230.150.15 TCP 66 57554 > http [ACK] Seq=98 Ack=1351443 Win=1048064 Len=0 TSval=11422074 TSecr=1454064395
229   0.045723 54.230.150.15 -> 172.31.29.138 TCP 26130 [TCP segment of a reassembled PDU]
230   0.045747 172.31.29.138 -> 54.230.150.15 TCP 66 57554 > http [ACK] Seq=98 Ack=1377507 Win=1038464 Len=0 TSval=11422074 TSecr=1454064395
231   0.046304 54.230.150.15 -> 172.31.29.138 TCP 5858 [TCP segment of a reassembled PDU]
232   0.046311 172.31.29.138 -> 54.230.150.15 TCP 66 57554 > http [ACK] Seq=98 Ack=1383299 Win=1071744 Len=0 TSval=11422074 TSecr=1454064395
233   0.046481 54.230.150.15 -> 172.31.29.138 TCP 26130 [TCP segment of a reassembled PDU]
234   0.046496 54.230.150.15 -> 172.31.29.138 TCP 2962 [TCP segment of a reassembled PDU]
235   0.046511 172.31.29.138 -> 54.230.150.15 TCP 66 57554 > http [ACK] Seq=98 Ack=1412259 Win=1042816 Len=0 TSval=11422074 TSecr=1454064395
236   0.046553 54.230.150.15 -> 172.31.29.138 TCP 23234 [TCP segment of a reassembled PDU]
237   0.046567 172.31.29.138 -> 54.230.150.15 TCP 66 57554 > http [ACK] Seq=98 Ack=1435427 Win=1043200 Len=0 TSval=11422074 TSecr=1454064395
238   0.046577 54.230.150.15 -> 172.31.29.138 TCP 4410 [TCP segment of a reassembled PDU]
239   0.046591 172.31.29.138 -> 54.230.150.15 TCP 66 57554 > http [ACK] Seq=98 Ack=1439771 Win=1038976 Len=0 TSval=11422074 TSecr=1454064395
240   0.046766 54.230.150.15 -> 172.31.29.138 TCP 2962 [TCP segment of a reassembled PDU]
241   0.046772 172.31.29.138 -> 54.230.150.15 TCP 66 57554 > http [ACK] Seq=98 Ack=1442667 Win=1076480 Len=0 TSval=11422074 TSecr=1454064396
242   0.046885 54.230.150.15 -> 172.31.29.138 TCP 8754 [TCP segment of a reassembled PDU]
243   0.046958 172.31.29.138 -> 54.230.150.15 TCP 66 57554 > http [ACK] Seq=98 Ack=1451355 Win=1079936 Len=0 TSval=11422074 TSecr=1454064396
244   0.047149 54.230.150.15 -> 172.31.29.138 TCP 14546 [TCP segment of a reassembled PDU]
245   0.047171 172.31.29.138 -> 54.230.150.15 TCP 66 57554 > http [ACK] Seq=98 Ack=1465835 Win=1079936 Len=0 TSval=11422074 TSecr=1454064396
246   0.047303 54.230.150.15 -> 172.31.29.138 TCP 26130 [TCP segment of a reassembled PDU]
247   0.047326 54.230.150.15 -> 172.31.29.138 TCP 17442 [TCP segment of a reassembled PDU]
248   0.047343 172.31.29.138 -> 54.230.150.15 TCP 66 57554 > http [ACK] Seq=98 Ack=1509275 Win=1036544 Len=0 TSval=11422074 TSecr=1454064396
249   0.047798 54.230.150.15 -> 172.31.29.138 TCP 7306 [TCP segment of a reassembled PDU]
250   0.047805 172.31.29.138 -> 54.230.150.15 TCP 66 57554 > http [ACK] Seq=98 Ack=1516515 Win=1069312 Len=0 TSval=11422074 TSecr=1454064396
251   0.048037 54.230.150.15 -> 172.31.29.138 TCP 2962 [TCP segment of a reassembled PDU]
252   0.048042 172.31.29.138 -> 54.230.150.15 TCP 66 57554 > http [ACK] Seq=98 Ack=1519411 Win=1076480 Len=0 TSval=11422074 TSecr=1454064396
253   0.048259 54.230.150.15 -> 172.31.29.138 TCP 26130 [TCP segment of a reassembled PDU]
254   0.048298 54.230.150.15 -> 172.31.29.138 TCP 26130 [TCP segment of a reassembled PDU]
255   0.048315 54.230.150.15 -> 172.31.29.138 TCP 7306 [TCP segment of a reassembled PDU]
256   0.048321 54.230.150.15 -> 172.31.29.138 TCP 2962 [TCP segment of a reassembled PDU]
257   0.048490 172.31.29.138 -> 54.230.150.15 TCP 66 57554 > http [ACK] Seq=98 Ack=1581675 Win=1014272 Len=0 TSval=11422074 TSecr=1454064396
258   0.048897 54.230.150.15 -> 172.31.29.138 TCP 7306 [TCP segment of a reassembled PDU]
259   0.048906 172.31.29.138 -> 54.230.150.15 TCP 66 57554 > http [ACK] Seq=98 Ack=1588915 Win=1069312 Len=0 TSval=11422074 TSecr=1454064396
260   0.049023 54.230.150.15 -> 172.31.29.138 TCP 26130 [TCP segment of a reassembled PDU]
261   0.049055 54.230.150.15 -> 172.31.29.138 TCP 18890 [TCP segment of a reassembled PDU]
262   0.049077 172.31.29.138 -> 54.230.150.15 TCP 66 57554 > http [ACK] Seq=98 Ack=1633803 Win=1024512 Len=0 TSval=11422074 TSecr=1454064396
263   0.049092 54.230.150.15 -> 172.31.29.138 TCP 7306 [TCP segment of a reassembled PDU]
264   0.049108 172.31.29.138 -> 54.230.150.15 TCP 66 57554 > http [ACK] Seq=98 Ack=1641043 Win=1038336 Len=0 TSval=11422074 TSecr=1454064396
265   0.049126 54.230.150.15 -> 172.31.29.138 TCP 5858 [TCP segment of a reassembled PDU]
266   0.049135 172.31.29.138 -> 54.230.150.15 TCP 66 57554 > http [ACK] Seq=98 Ack=1646835 Win=1059840 Len=0 TSval=11422074 TSecr=1454064396
267   0.049827 54.230.150.15 -> 172.31.29.138 TCP 2962 [TCP segment of a reassembled PDU]
268   0.049833 172.31.29.138 -> 54.230.150.15 TCP 66 57554 > http [ACK] Seq=98 Ack=1649731 Win=1076480 Len=0 TSval=11422075 TSecr=1454064396
269   0.050008 54.230.150.15 -> 172.31.29.138 TCP 26130 [TCP segment of a reassembled PDU]
270   0.050023 172.31.29.138 -> 54.230.150.15 TCP 66 57554 > http [ACK] Seq=98 Ack=1675795 Win=1132032 Len=0 TSval=11422075 TSecr=1454064396
271   0.050047 54.230.150.15 -> 172.31.29.138 TCP 20338 [TCP segment of a reassembled PDU]
272   0.050072 172.31.29.138 -> 54.230.150.15 TCP 66 57554 > http [ACK] Seq=98 Ack=1696067 Win=1113216 Len=0 TSval=11422075 TSecr=1454064396
273   0.050117 54.230.150.15 -> 172.31.29.138 TCP 15994 [TCP segment of a reassembled PDU]
274   0.050128 172.31.29.138 -> 54.230.150.15 TCP 66 57554 > http [ACK] Seq=98 Ack=1711995 Win=1163136 Len=0 TSval=11422075 TSecr=1454064396
275   0.050408 54.230.150.15 -> 172.31.29.138 TCP 13098 [TCP segment of a reassembled PDU]
276   0.050418 172.31.29.138 -> 54.230.150.15 TCP 66 57554 > http [ACK] Seq=98 Ack=1725027 Win=1168000 Len=0 TSval=11422075 TSecr=1454064396
277   0.050581 54.230.150.15 -> 172.31.29.138 TCP 26130 [TCP segment of a reassembled PDU]
278   0.050599 54.230.150.15 -> 172.31.29.138 TCP 7306 [TCP segment of a reassembled PDU]
279   0.050629 54.230.150.15 -> 172.31.29.138 TCP 18890 [TCP segment of a reassembled PDU]
280   0.050639 172.31.29.138 -> 54.230.150.15 TCP 66 57554 > http [ACK] Seq=98 Ack=1758331 Win=1134720 Len=0 TSval=11422075 TSecr=1454064396
281   0.050655 172.31.29.138 -> 54.230.150.15 TCP 66 57554 > http [ACK] Seq=98 Ack=1777155 Win=1146496 Len=0 TSval=11422075 TSecr=1454064396
282   0.051445 54.230.150.15 -> 172.31.29.138 TCP 7306 [TCP segment of a reassembled PDU]
283   0.051452 172.31.29.138 -> 54.230.150.15 TCP 66 57554 > http [ACK] Seq=98 Ack=1784395 Win=1177472 Len=0 TSval=11422075 TSecr=1454064396
284   0.051609 54.230.150.15 -> 172.31.29.138 TCP 26130 [TCP segment of a reassembled PDU]
285   0.051623 54.230.150.15 -> 172.31.29.138 TCP 2962 [TCP segment of a reassembled PDU]
286   0.051679 54.230.150.15 -> 172.31.29.138 TCP 23234 [TCP segment of a reassembled PDU]
287   0.051694 54.230.150.15 -> 172.31.29.138 TCP 5858 [TCP segment of a reassembled PDU]
288   0.051716 172.31.29.138 -> 54.230.150.15 TCP 66 57554 > http [ACK] Seq=98 Ack=1842315 Win=1119616 Len=0 TSval=11422075 TSecr=1454064396
289   0.052007 54.230.150.15 -> 172.31.29.138 TCP 13098 [TCP segment of a reassembled PDU]
290   0.052027 172.31.29.138 -> 54.230.150.15 TCP 66 57554 > http [ACK] Seq=98 Ack=1855347 Win=1168000 Len=0 TSval=11422075 TSecr=1454064396
291   0.052166 54.230.150.15 -> 172.31.29.138 TCP 17442 [TCP segment of a reassembled PDU]
292   0.052189 172.31.29.138 -> 54.230.150.15 TCP 66 57554 > http [ACK] Seq=98 Ack=1872723 Win=1160832 Len=0 TSval=11422075 TSecr=1454064396
293   0.052202 54.230.150.15 -> 172.31.29.138 TCP 8754 [TCP segment of a reassembled PDU]
294   0.052221 172.31.29.138 -> 54.230.150.15 TCP 66 57554 > http [ACK] Seq=98 Ack=1881411 Win=1187840 Len=0 TSval=11422075 TSecr=1454064396
295   0.052287 54.230.150.15 -> 172.31.29.138 TCP 26130 [TCP segment of a reassembled PDU]
296   0.052308 172.31.29.138 -> 54.230.150.15 TCP 66 57554 > http [ACK] Seq=98 Ack=1907475 Win=1161856 Len=0 TSval=11422075 TSecr=1454064396
297   0.053264 54.230.150.15 -> 172.31.29.138 TCP 14546 [TCP segment of a reassembled PDU]
298   0.053289 172.31.29.138 -> 54.230.150.15 TCP 66 57554 > http [ACK] Seq=98 Ack=1921955 Win=1165568 Len=0 TSval=11422075 TSecr=1454064396
299   0.053388 54.230.150.15 -> 172.31.29.138 TCP 26130 [TCP segment of a reassembled PDU]
300   0.053412 172.31.29.138 -> 54.230.150.15 TCP 66 57554 > http [ACK] Seq=98 Ack=1948019 Win=1146624 Len=0 TSval=11422075 TSecr=1454064396
301   0.053435 54.230.150.15 -> 172.31.29.138 TCP 24682 [TCP segment of a reassembled PDU]
302   0.053452 172.31.29.138 -> 54.230.150.15 TCP 66 57554 > http [ACK] Seq=98 Ack=1972635 Win=1148928 Len=0 TSval=11422075 TSecr=1454064396
303   0.053710 54.230.150.15 -> 172.31.29.138 TCP 13098 [TCP segment of a reassembled PDU]
304   0.053716 172.31.29.138 -> 54.230.150.15 TCP 66 57554 > http [ACK] Seq=98 Ack=1985667 Win=1168000 Len=0 TSval=11422076 TSecr=1454064396
305   0.053871 54.230.150.15 -> 172.31.29.138 TCP 26130 [TCP segment of a reassembled PDU]
306   0.053902 172.31.29.138 -> 54.230.150.15 TCP 66 57554 > http [ACK] Seq=98 Ack=2011731 Win=1146624 Len=0 TSval=11422076 TSecr=1454064396
307   0.053929 54.230.150.15 -> 172.31.29.138 TCP 23234 [TCP segment of a reassembled PDU]
308   0.053946 172.31.29.138 -> 54.230.150.15 TCP 66 57554 > http [ACK] Seq=98 Ack=2034899 Win=1151360 Len=0 TSval=11422076 TSecr=1454064396
309   0.053962 54.230.150.15 -> 172.31.29.138 TCP 2962 [TCP segment of a reassembled PDU]
310   0.053972 172.31.29.138 -> 54.230.150.15 TCP 66 57554 > http [ACK] Seq=98 Ack=2037795 Win=1187840 Len=0 TSval=11422076 TSecr=1454064396
311   0.054682 54.230.150.15 -> 172.31.29.138 TCP 5858 [TCP segment of a reassembled PDU]
312   0.054699 172.31.29.138 -> 54.230.150.15 TCP 66 57554 > http [ACK] Seq=98 Ack=2043587 Win=1187840 Len=0 TSval=11422076 TSecr=1454064396
313   0.054858 54.230.150.15 -> 172.31.29.138 TCP 26130 [TCP segment of a reassembled PDU]
314   0.054879 172.31.29.138 -> 54.230.150.15 TCP 66 57554 > http [ACK] Seq=98 Ack=2069651 Win=1161856 Len=0 TSval=11422076 TSecr=1454064396
315   0.054914 54.230.150.15 -> 172.31.29.138 TCP 27578 [TCP segment of a reassembled PDU]
316   0.054931 172.31.29.138 -> 54.230.150.15 TCP 66 57554 > http [ACK] Seq=98 Ack=2097163 Win=1144064 Len=0 TSval=11422076 TSecr=1454064396
317   0.054956 54.230.150.15 -> 172.31.29.138 TCP 5858 [TCP segment of a reassembled PDU]
318   0.054960 172.31.29.138 -> 54.230.150.15 TCP 66 57554 > http [ACK] Seq=98 Ack=2102955 Win=1179904 Len=0 TSval=11422076 TSecr=1454064396
319   0.055122 54.230.150.15 -> 172.31.29.138 TCP 26130 [TCP segment of a reassembled PDU]
320   0.055171 54.230.150.15 -> 172.31.29.138 TCP 26130 [TCP segment of a reassembled PDU]
321   0.055180 54.230.150.15 -> 172.31.29.138 TCP 4410 [TCP segment of a reassembled PDU]
322   0.055196 54.230.150.15 -> 172.31.29.138 TCP 4410 [TCP segment of a reassembled PDU]
323   0.055216 54.230.150.15 -> 172.31.29.138 TCP 4410 [TCP segment of a reassembled PDU]
324   0.055338 172.31.29.138 -> 54.230.150.15 TCP 66 57554 > http [ACK] Seq=98 Ack=2168115 Win=1114752 Len=0 TSval=11422076 TSecr=1454064396
325   0.056286 54.230.150.15 -> 172.31.29.138 TCP 2962 [TCP segment of a reassembled PDU]
326   0.056292 172.31.29.138 -> 54.230.150.15 TCP 66 57554 > http [ACK] Seq=98 Ack=2171011 Win=1184640 Len=0 TSval=11422076 TSecr=1454064396
327   0.056485 54.230.150.15 -> 172.31.29.138 TCP 26130 [TCP segment of a reassembled PDU]
328   0.056506 172.31.29.138 -> 54.230.150.15 TCP 66 57554 > http [ACK] Seq=98 Ack=2197075 Win=1158656 Len=0 TSval=11422076 TSecr=1454064396
329   0.056531 54.230.150.15 -> 172.31.29.138 TCP 20338 [TCP segment of a reassembled PDU]
330   0.056548 172.31.29.138 -> 54.230.150.15 TCP 66 57554 > http [ACK] Seq=98 Ack=2217347 Win=1156096 Len=0 TSval=11422076 TSecr=1454064396
331   0.056599 54.230.150.15 -> 172.31.29.138 TCP 15994 [TCP segment of a reassembled PDU]
332   0.056606 172.31.29.138 -> 54.230.150.15 TCP 66 57554 > http [ACK] Seq=98 Ack=2233275 Win=1163136 Len=0 TSval=11422076 TSecr=1454064396
333   0.056919 54.230.150.15 -> 172.31.29.138 TCP 24682 [TCP segment of a reassembled PDU]
334   0.056942 172.31.29.138 -> 54.230.150.15 TCP 66 57554 > http [ACK] Seq=98 Ack=2257891 Win=1148928 Len=0 TSval=11422076 TSecr=1454064397
335   0.057008 54.230.150.15 -> 172.31.29.138 TCP 21786 [TCP segment of a reassembled PDU]
336   0.057016 172.31.29.138 -> 54.230.150.15 TCP 66 57554 > http [ACK] Seq=98 Ack=2279611 Win=1153664 Len=0 TSval=11422076 TSecr=1454064397
337   0.057033 54.230.150.15 -> 172.31.29.138 TCP 4410 [TCP segment of a reassembled PDU]
338   0.057044 172.31.29.138 -> 54.230.150.15 TCP 66 57554 > http [ACK] Seq=98 Ack=2283955 Win=1149440 Len=0 TSval=11422076 TSecr=1454064397
339   0.057081 54.230.150.15 -> 172.31.29.138 TCP 14546 [TCP segment of a reassembled PDU]
340   0.057095 172.31.29.138 -> 54.230.150.15 TCP 66 57554 > http [ACK] Seq=98 Ack=2298435 Win=1165568 Len=0 TSval=11422076 TSecr=1454064397
341   0.057861 54.230.150.15 -> 172.31.29.138 TCP 10202 [TCP segment of a reassembled PDU]
342   0.057867 172.31.29.138 -> 54.230.150.15 TCP 66 57554 > http [ACK] Seq=98 Ack=2308571 Win=1172736 Len=0 TSval=11422077 TSecr=1454064397
343   0.058033 54.230.150.15 -> 172.31.29.138 TCP 26130 [TCP segment of a reassembled PDU]
344   0.058046 54.230.150.15 -> 172.31.29.138 TCP 7306 [TCP segment of a reassembled PDU]
345   0.058062 172.31.29.138 -> 54.230.150.15 TCP 66 57554 > http [ACK] Seq=98 Ack=2341875 Win=1139456 Len=0 TSval=11422077 TSecr=1454064397
346   0.058088 54.230.150.15 -> 172.31.29.138 TCP 18890 [TCP segment of a reassembled PDU]
347   0.058102 172.31.29.138 -> 54.230.150.15 TCP 66 57554 > http [ACK] Seq=98 Ack=2360699 Win=1146496 Len=0 TSval=11422077 TSecr=1454064397
348   0.058113 54.230.150.15 -> 172.31.29.138 TCP 2962 [TCP segment of a reassembled PDU]
