[Measurement for 10mb at 18:36:54 19.36.2014] 
Tshark:

  1   0.000000 172.31.29.138 -> 172.31.0.2   DNS 89 Standard query 0xe733  A d1dx94olpiqj0t.cloudfront.net
  2   0.000022 172.31.29.138 -> 172.31.0.2   DNS 89 Standard query 0x6b81  AAAA d1dx94olpiqj0t.cloudfront.net
  3   0.000686   172.31.0.2 -> 172.31.29.138 DNS 176 Standard query response 0x6b81 
  4   0.000697   172.31.0.2 -> 172.31.29.138 DNS 217 Standard query response 0xe733  A 54.192.159.177 A 54.230.158.80 A 54.230.158.148 A 54.230.158.198 A 54.230.159.132 A 54.240.168.128 A 54.192.156.104 A 54.192.157.146
  5   0.003924 172.31.29.138 -> 54.192.159.177 TCP 74 34873 > http [SYN] Seq=0 Win=26883 Len=0 MSS=8961 SACK_PERM=1 TSval=1521771 TSecr=0 WS=128
  6   0.004681 54.192.159.177 -> 172.31.29.138 TCP 74 http > 34873 [SYN, ACK] Seq=0 Ack=1 Win=14480 Len=0 MSS=1460 SACK_PERM=1 TSval=804816399 TSecr=1521771 WS=128
  7   0.004696 172.31.29.138 -> 54.192.159.177 TCP 66 34873 > http [ACK] Seq=1 Ack=1 Win=27008 Len=0 TSval=1521771 TSecr=804816399
  8   0.004747 172.31.29.138 -> 54.192.159.177 HTTP 163 GET /10mb HTTP/1.1 
  9   0.005384 54.192.159.177 -> 172.31.29.138 TCP 66 http > 34873 [ACK] Seq=1 Ack=98 Win=14592 Len=0 TSval=804816399 TSecr=1521771
 10   0.010060 54.192.159.177 -> 172.31.29.138 TCP 523 [TCP segment of a reassembled PDU]
 11   0.010068 172.31.29.138 -> 54.192.159.177 TCP 66 34873 > http [ACK] Seq=98 Ack=458 Win=28032 Len=0 TSval=1521772 TSecr=804816399
 12   0.010099 54.192.159.177 -> 172.31.29.138 TCP 13098 [TCP segment of a reassembled PDU]
 13   0.010108 172.31.29.138 -> 54.192.159.177 TCP 66 34873 > http [ACK] Seq=98 Ack=13490 Win=54144 Len=0 TSval=1521772 TSecr=804816399
 14   0.010764 54.192.159.177 -> 172.31.29.138 TCP 8754 [TCP segment of a reassembled PDU]
 15   0.010773 172.31.29.138 -> 54.192.159.177 TCP 66 34873 > http [ACK] Seq=98 Ack=22178 Win=71424 Len=0 TSval=1521772 TSecr=804816399
 16   0.010795 54.192.159.177 -> 172.31.29.138 TCP 4410 [TCP segment of a reassembled PDU]
 17   0.010801 172.31.29.138 -> 54.192.159.177 TCP 66 34873 > http [ACK] Seq=98 Ack=26522 Win=80128 Len=0 TSval=1521772 TSecr=804816399
 18   0.011542 54.192.159.177 -> 172.31.29.138 TCP 4410 [TCP segment of a reassembled PDU]
 19   0.011548 172.31.29.138 -> 54.192.159.177 TCP 66 34873 > http [ACK] Seq=98 Ack=30866 Win=88832 Len=0 TSval=1521772 TSecr=804816399
 20   0.011635 54.192.159.177 -> 172.31.29.138 TCP 15994 [TCP segment of a reassembled PDU]
 21   0.011645 172.31.29.138 -> 54.192.159.177 TCP 66 34873 > http [ACK] Seq=98 Ack=46794 Win=91648 Len=0 TSval=1521772 TSecr=804816399
 22   0.012307 54.192.159.177 -> 172.31.29.138 TCP 5858 [TCP segment of a reassembled PDU]
 23   0.012314 172.31.29.138 -> 54.192.159.177 TCP 66 34873 > http [ACK] Seq=98 Ack=52586 Win=120704 Len=0 TSval=1521773 TSecr=804816400
 24   0.012360 54.192.159.177 -> 172.31.29.138 TCP 10202 [TCP segment of a reassembled PDU]
 25   0.012367 172.31.29.138 -> 54.192.159.177 TCP 66 34873 > http [ACK] Seq=98 Ack=62722 Win=140928 Len=0 TSval=1521773 TSecr=804816400
 26   0.012391 54.192.159.177 -> 172.31.29.138 TCP 7306 [TCP segment of a reassembled PDU]
 27   0.012397 172.31.29.138 -> 54.192.159.177 TCP 66 34873 > http [ACK] Seq=98 Ack=69962 Win=155392 Len=0 TSval=1521773 TSecr=804816400
 28   0.013058 54.192.159.177 -> 172.31.29.138 TCP 4410 [TCP segment of a reassembled PDU]
 29   0.013063 172.31.29.138 -> 54.192.159.177 TCP 66 34873 > http [ACK] Seq=98 Ack=74306 Win=164096 Len=0 TSval=1521773 TSecr=804816400
 30   0.013141 54.192.159.177 -> 172.31.29.138 TCP 11650 [TCP segment of a reassembled PDU]
 31   0.013150 172.31.29.138 -> 54.192.159.177 TCP 66 34873 > http [ACK] Seq=98 Ack=85890 Win=187264 Len=0 TSval=1521773 TSecr=804816400
 32   0.013159 54.192.159.177 -> 172.31.29.138 TCP 5858 [TCP segment of a reassembled PDU]
 33   0.013164 172.31.29.138 -> 54.192.159.177 TCP 66 34873 > http [ACK] Seq=98 Ack=91682 Win=198784 Len=0 TSval=1521773 TSecr=804816400
 34   0.013835 54.192.159.177 -> 172.31.29.138 TCP 4410 [TCP segment of a reassembled PDU]
 35   0.013841 172.31.29.138 -> 54.192.159.177 TCP 66 34873 > http [ACK] Seq=98 Ack=96026 Win=207488 Len=0 TSval=1521773 TSecr=804816400
 36   0.013934 54.192.159.177 -> 172.31.29.138 TCP 18890 [TCP segment of a reassembled PDU]
 37   0.013946 172.31.29.138 -> 54.192.159.177 TCP 66 34873 > http [ACK] Seq=98 Ack=114850 Win=245120 Len=0 TSval=1521773 TSecr=804816400
 38   0.013952 54.192.159.177 -> 172.31.29.138 TCP 1514 [TCP segment of a reassembled PDU]
 39   0.013955 172.31.29.138 -> 54.192.159.177 TCP 66 34873 > http [ACK] Seq=98 Ack=116298 Win=248064 Len=0 TSval=1521773 TSecr=804816400
 40   0.014627 54.192.159.177 -> 172.31.29.138 TCP 5858 [TCP segment of a reassembled PDU]
 41   0.014633 172.31.29.138 -> 54.192.159.177 TCP 66 34873 > http [ACK] Seq=98 Ack=122090 Win=259712 Len=0 TSval=1521773 TSecr=804816400
 42   0.014723 54.192.159.177 -> 172.31.29.138 TCP 20338 [TCP segment of a reassembled PDU]
 43   0.014734 172.31.29.138 -> 54.192.159.177 TCP 66 34873 > http [ACK] Seq=98 Ack=142362 Win=300160 Len=0 TSval=1521773 TSecr=804816400
 44   0.014745 54.192.159.177 -> 172.31.29.138 TCP 7306 [TCP segment of a reassembled PDU]
 45   0.014752 172.31.29.138 -> 54.192.159.177 TCP 66 34873 > http [ACK] Seq=98 Ack=149602 Win=314624 Len=0 TSval=1521773 TSecr=804816400
 46   0.015394 54.192.159.177 -> 172.31.29.138 TCP 5858 [TCP segment of a reassembled PDU]
 47   0.015401 172.31.29.138 -> 54.192.159.177 TCP 66 34873 > http [ACK] Seq=98 Ack=155394 Win=326272 Len=0 TSval=1521773 TSecr=804816400
 48   0.015508 54.192.159.177 -> 172.31.29.138 TCP 26130 [TCP segment of a reassembled PDU]
 49   0.015522 172.31.29.138 -> 54.192.159.177 TCP 66 34873 > http [ACK] Seq=98 Ack=181458 Win=378368 Len=0 TSval=1521773 TSecr=804816400
 50   0.016156 54.192.159.177 -> 172.31.29.138 TCP 1514 [TCP segment of a reassembled PDU]
 51   0.016160 172.31.29.138 -> 54.192.159.177 TCP 66 34873 > http [ACK] Seq=98 Ack=182906 Win=381312 Len=0 TSval=1521774 TSecr=804816400
 52   0.016273 54.192.159.177 -> 172.31.29.138 TCP 13524 [TCP segment of a reassembled PDU]
 53   0.016293 172.31.29.138 -> 54.192.159.177 TCP 66 34873 > http [ACK] Seq=98 Ack=196364 Win=408192 Len=0 TSval=1521774 TSecr=804816400
 54   0.016402 54.192.159.177 -> 172.31.29.138 TCP 2962 [TCP segment of a reassembled PDU]
 55   0.016407 172.31.29.138 -> 54.192.159.177 TCP 66 34873 > http [ACK] Seq=98 Ack=199260 Win=413952 Len=0 TSval=1521774 TSecr=804816400
 56   0.016497 54.192.159.177 -> 172.31.29.138 TCP 24682 [TCP segment of a reassembled PDU]
 57   0.016510 172.31.29.138 -> 54.192.159.177 TCP 66 34873 > http [ACK] Seq=98 Ack=223876 Win=463232 Len=0 TSval=1521774 TSecr=804816400
 58   0.016983 54.192.159.177 -> 172.31.29.138 TCP 17442 [TCP segment of a reassembled PDU]
 59   0.016994 172.31.29.138 -> 54.192.159.177 TCP 66 34873 > http [ACK] Seq=98 Ack=241252 Win=497920 Len=0 TSval=1521774 TSecr=804816400
 60   0.017018 54.192.159.177 -> 172.31.29.138 TCP 1514 [TCP segment of a reassembled PDU]
 61   0.017022 172.31.29.138 -> 54.192.159.177 TCP 66 34873 > http [ACK] Seq=98 Ack=242700 Win=500864 Len=0 TSval=1521774 TSecr=804816400
 62   0.017233 54.192.159.177 -> 172.31.29.138 TCP 19266 [TCP segment of a reassembled PDU]
 63   0.017244 172.31.29.138 -> 54.192.159.177 TCP 66 34873 > http [ACK] Seq=98 Ack=261900 Win=539264 Len=0 TSval=1521774 TSecr=804816400
 64   0.017446 54.192.159.177 -> 172.31.29.138 TCP 10202 [TCP segment of a reassembled PDU]
 65   0.017453 172.31.29.138 -> 54.192.159.177 TCP 66 34873 > http [ACK] Seq=98 Ack=272036 Win=559488 Len=0 TSval=1521774 TSecr=804816400
 66   0.017685 54.192.159.177 -> 172.31.29.138 TCP 7306 [TCP segment of a reassembled PDU]
 67   0.017692 172.31.29.138 -> 54.192.159.177 TCP 66 34873 > http [ACK] Seq=98 Ack=279276 Win=574080 Len=0 TSval=1521774 TSecr=804816400
 68   0.017832 54.192.159.177 -> 172.31.29.138 TCP 24682 [TCP segment of a reassembled PDU]
 69   0.017844 172.31.29.138 -> 54.192.159.177 TCP 66 34873 > http [ACK] Seq=98 Ack=303892 Win=623232 Len=0 TSval=1521774 TSecr=804816400
 70   0.017850 54.192.159.177 -> 172.31.29.138 TCP 1514 [TCP segment of a reassembled PDU]
 71   0.017852 172.31.29.138 -> 54.192.159.177 TCP 66 34873 > http [ACK] Seq=98 Ack=305340 Win=626176 Len=0 TSval=1521774 TSecr=804816400
 72   0.017927 54.192.159.177 -> 172.31.29.138 TCP 10202 [TCP segment of a reassembled PDU]
 73   0.017935 172.31.29.138 -> 54.192.159.177 TCP 66 34873 > http [ACK] Seq=98 Ack=315476 Win=646400 Len=0 TSval=1521774 TSecr=804816400
 74   0.018427 54.192.159.177 -> 172.31.29.138 TCP 2962 [TCP segment of a reassembled PDU]
 75   0.018431 172.31.29.138 -> 54.192.159.177 TCP 66 34873 > http [ACK] Seq=98 Ack=318372 Win=652160 Len=0 TSval=1521774 TSecr=804816400
 76   0.018531 54.192.159.177 -> 172.31.29.138 TCP 9130 [TCP segment of a reassembled PDU]
 77   0.018538 172.31.29.138 -> 54.192.159.177 TCP 66 34873 > http [ACK] Seq=98 Ack=327436 Win=670336 Len=0 TSval=1521774 TSecr=804816400
 78   0.018944 54.192.159.177 -> 172.31.29.138 TCP 2962 [TCP segment of a reassembled PDU]
 79   0.018949 172.31.29.138 -> 54.192.159.177 TCP 66 34873 > http [ACK] Seq=98 Ack=330332 Win=676096 Len=0 TSval=1521774 TSecr=804816400
 80   0.018982 54.192.159.177 -> 172.31.29.138 TCP 5858 [TCP segment of a reassembled PDU]
 81   0.018988 172.31.29.138 -> 54.192.159.177 TCP 66 34873 > http [ACK] Seq=98 Ack=336124 Win=687744 Len=0 TSval=1521774 TSecr=804816400
 82   0.019130 54.192.159.177 -> 172.31.29.138 TCP 29026 [TCP segment of a reassembled PDU]
 83   0.019144 172.31.29.138 -> 54.192.159.177 TCP 66 34873 > http [ACK] Seq=98 Ack=365084 Win=745600 Len=0 TSval=1521774 TSecr=804816400
 84   0.019157 54.192.159.177 -> 172.31.29.138 TCP 7306 [TCP segment of a reassembled PDU]
 85   0.019162 172.31.29.138 -> 54.192.159.177 TCP 66 34873 > http [ACK] Seq=98 Ack=372324 Win=760064 Len=0 TSval=1521774 TSecr=804816400
 86   0.019702 54.192.159.177 -> 172.31.29.138 TCP 2962 [TCP segment of a reassembled PDU]
 87   0.019708 172.31.29.138 -> 54.192.159.177 TCP 66 34873 > http [ACK] Seq=98 Ack=375220 Win=765952 Len=0 TSval=1521775 TSecr=804816400
 88   0.019855 54.192.159.177 -> 172.31.29.138 TCP 17818 [TCP segment of a reassembled PDU]
 89   0.019865 172.31.29.138 -> 54.192.159.177 TCP 66 34873 > http [ACK] Seq=98 Ack=392972 Win=797952 Len=0 TSval=1521775 TSecr=804816400
 90   0.020499 54.192.159.177 -> 172.31.29.138 TCP 2962 [TCP segment of a reassembled PDU]
 91   0.020504 172.31.29.138 -> 54.192.159.177 TCP 66 34873 > http [ACK] Seq=98 Ack=395868 Win=807168 Len=0 TSval=1521775 TSecr=804816400
 92   0.020734 54.192.159.177 -> 172.31.29.138 TCP 4410 [TCP segment of a reassembled PDU]
 93   0.020740 172.31.29.138 -> 54.192.159.177 TCP 66 34873 > http [ACK] Seq=98 Ack=400212 Win=815872 Len=0 TSval=1521775 TSecr=804816400
 94   0.020894 54.192.159.177 -> 172.31.29.138 TCP 18890 [TCP segment of a reassembled PDU]
 95   0.020905 172.31.29.138 -> 54.192.159.177 TCP 66 34873 > http [ACK] Seq=98 Ack=419036 Win=797952 Len=0 TSval=1521775 TSecr=804816400
 96   0.020913 54.192.159.177 -> 172.31.29.138 TCP 1514 [TCP Previous segment not captured] [TCP segment of a reassembled PDU]
 97   0.020916 172.31.29.138 -> 54.192.159.177 TCP 78 [TCP Dup ACK 95#1] 34873 > http [ACK] Seq=98 Ack=419036 Win=797952 Len=0 TSval=1521775 TSecr=804816400 SLE=420484 SRE=421932
 98   0.020918 54.192.159.177 -> 172.31.29.138 TCP 1514 [TCP Out-Of-Order] [TCP segment of a reassembled PDU]
 99   0.020921 172.31.29.138 -> 54.192.159.177 TCP 66 34873 > http [ACK] Seq=98 Ack=421932 Win=795136 Len=0 TSval=1521775 TSecr=804816400
100   0.021034 54.192.159.177 -> 172.31.29.138 TCP 36266 [TCP segment of a reassembled PDU]
101   0.021048 172.31.29.138 -> 54.192.159.177 TCP 66 34873 > http [ACK] Seq=98 Ack=458132 Win=769408 Len=0 TSval=1521775 TSecr=804816400
102   0.021256 54.192.159.177 -> 172.31.29.138 TCP 442 [TCP segment of a reassembled PDU]
103   0.021261 172.31.29.138 -> 54.192.159.177 TCP 66 34873 > http [ACK] Seq=98 Ack=458508 Win=815872 Len=0 TSval=1521775 TSecr=804816400
104   0.022257 54.192.159.177 -> 172.31.29.138 TCP 1514 [TCP segment of a reassembled PDU]
105   0.022261 172.31.29.138 -> 54.192.159.177 TCP 66 34873 > http [ACK] Seq=98 Ack=459956 Win=818816 Len=0 TSval=1521775 TSecr=804816401
106   0.022515 54.192.159.177 -> 172.31.29.138 TCP 2962 [TCP segment of a reassembled PDU]
107   0.022520 172.31.29.138 -> 54.192.159.177 TCP 66 34873 > http [ACK] Seq=98 Ack=462852 Win=824192 Len=0 TSval=1521775 TSecr=804816401
108   0.022651 54.192.159.177 -> 172.31.29.138 TCP 18890 [TCP segment of a reassembled PDU]
109   0.022662 172.31.29.138 -> 54.192.159.177 TCP 66 34873 > http [ACK] Seq=98 Ack=481676 Win=805376 Len=0 TSval=1521775 TSecr=804816401
110   0.022671 54.192.159.177 -> 172.31.29.138 TCP 2962 [TCP segment of a reassembled PDU]
111   0.022675 172.31.29.138 -> 54.192.159.177 TCP 66 34873 > http [ACK] Seq=98 Ack=484572 Win=802560 Len=0 TSval=1521775 TSecr=804816401
112   0.022732 54.192.159.177 -> 172.31.29.138 TCP 17442 [TCP segment of a reassembled PDU]
113   0.022742 172.31.29.138 -> 54.192.159.177 TCP 66 34873 > http [ACK] Seq=98 Ack=501948 Win=800384 Len=0 TSval=1521775 TSecr=804816401
114   0.023295 54.192.159.177 -> 172.31.29.138 TCP 2962 [TCP segment of a reassembled PDU]
115   0.023301 172.31.29.138 -> 54.192.159.177 TCP 66 34873 > http [ACK] Seq=98 Ack=504844 Win=824192 Len=0 TSval=1521775 TSecr=804816401
116   0.023434 54.192.159.177 -> 172.31.29.138 TCP 19266 [TCP segment of a reassembled PDU]
117   0.023442 172.31.29.138 -> 54.192.159.177 TCP 66 34873 > http [ACK] Seq=98 Ack=524044 Win=804992 Len=0 TSval=1521775 TSecr=804816401
118   0.026121 54.192.159.177 -> 172.31.29.138 TCP 2962 [TCP segment of a reassembled PDU]
119   0.026127 172.31.29.138 -> 54.192.159.177 TCP 66 34873 > http [ACK] Seq=98 Ack=526940 Win=824192 Len=0 TSval=1521776 TSecr=804816401
120   0.026292 54.192.159.177 -> 172.31.29.138 TCP 26130 [TCP segment of a reassembled PDU]
121   0.026306 172.31.29.138 -> 54.192.159.177 TCP 66 34873 > http [ACK] Seq=98 Ack=553004 Win=798208 Len=0 TSval=1521776 TSecr=804816401
122   0.026327 54.192.159.177 -> 172.31.29.138 TCP 20338 [TCP segment of a reassembled PDU]
123   0.026337 172.31.29.138 -> 54.192.159.177 TCP 66 34873 > http [ACK] Seq=98 Ack=573276 Win=777984 Len=0 TSval=1521776 TSecr=804816401
124   0.026342 54.192.159.177 -> 172.31.29.138 TCP 1514 [TCP segment of a reassembled PDU]
125   0.026344 172.31.29.138 -> 54.192.159.177 TCP 66 34873 > http [ACK] Seq=98 Ack=574724 Win=776576 Len=0 TSval=1521776 TSecr=804816401
126   0.026919 54.192.159.177 -> 172.31.29.138 TCP 8754 [TCP segment of a reassembled PDU]
127   0.026927 172.31.29.138 -> 54.192.159.177 TCP 66 34873 > http [ACK] Seq=98 Ack=583412 Win=814720 Len=0 TSval=1521776 TSecr=804816401
128   0.027095 54.192.159.177 -> 172.31.29.138 TCP 26130 [TCP segment of a reassembled PDU]
129   0.027109 172.31.29.138 -> 54.192.159.177 TCP 66 34873 > http [ACK] Seq=98 Ack=609476 Win=788736 Len=0 TSval=1521776 TSecr=804816401
130   0.027131 54.192.159.177 -> 172.31.29.138 TCP 18890 [TCP segment of a reassembled PDU]
131   0.027141 172.31.29.138 -> 54.192.159.177 TCP 66 34873 > http [ACK] Seq=98 Ack=628300 Win=769920 Len=0 TSval=1521776 TSecr=804816401
132   0.027659 54.192.159.177 -> 172.31.29.138 TCP 4410 [TCP segment of a reassembled PDU]
133   0.027665 172.31.29.138 -> 54.192.159.177 TCP 66 34873 > http [ACK] Seq=98 Ack=632644 Win=821760 Len=0 TSval=1521777 TSecr=804816401
134   0.027825 54.192.159.177 -> 172.31.29.138 TCP 22538 [TCP segment of a reassembled PDU]
135   0.027849 172.31.29.138 -> 54.192.159.177 TCP 66 34873 > http [ACK] Seq=98 Ack=655116 Win=799360 Len=0 TSval=1521777 TSecr=804816401
136   0.028415 54.192.159.177 -> 172.31.29.138 TCP 2962 [TCP segment of a reassembled PDU]
137   0.028420 172.31.29.138 -> 54.192.159.177 TCP 66 34873 > http [ACK] Seq=98 Ack=658012 Win=824192 Len=0 TSval=1521777 TSecr=804816401
138   0.028465 54.192.159.177 -> 172.31.29.138 TCP 11650 [TCP segment of a reassembled PDU]
139   0.028485 172.31.29.138 -> 54.192.159.177 TCP 66 34873 > http [ACK] Seq=98 Ack=669596 Win=824576 Len=0 TSval=1521777 TSecr=804816401
140   0.028604 54.192.159.177 -> 172.31.29.138 TCP 20338 [TCP segment of a reassembled PDU]
141   0.028627 54.192.159.177 -> 172.31.29.138 TCP 5858 [TCP segment of a reassembled PDU]
142   0.028639 172.31.29.138 -> 54.192.159.177 TCP 66 34873 > http [ACK] Seq=98 Ack=695660 Win=798592 Len=0 TSval=1521777 TSecr=804816401
143   0.028681 54.192.159.177 -> 172.31.29.138 TCP 20338 [TCP segment of a reassembled PDU]
144   0.028702 172.31.29.138 -> 54.192.159.177 TCP 66 34873 > http [ACK] Seq=98 Ack=715932 Win=795648 Len=0 TSval=1521777 TSecr=804816401
145   0.029167 54.192.159.177 -> 172.31.29.138 TCP 1514 [TCP segment of a reassembled PDU]
146   0.029172 172.31.29.138 -> 54.192.159.177 TCP 66 34873 > http [ACK] Seq=98 Ack=717380 Win=826496 Len=0 TSval=1521777 TSecr=804816401
147   0.029295 54.192.159.177 -> 172.31.29.138 TCP 3338 [TCP segment of a reassembled PDU]
148   0.029325 172.31.29.138 -> 54.192.159.177 TCP 66 34873 > http [ACK] Seq=98 Ack=720652 Win=827520 Len=0 TSval=1521777 TSecr=804816401
149   0.029705 54.192.159.177 -> 172.31.29.138 TCP 1514 [TCP segment of a reassembled PDU]
150   0.029937 54.192.159.177 -> 172.31.29.138 TCP 1514 [TCP segment of a reassembled PDU]
151   0.029951 172.31.29.138 -> 54.192.159.177 TCP 66 34873 > http [ACK] Seq=98 Ack=723548 Win=827520 Len=0 TSval=1521777 TSecr=804816401
152   0.030112 54.192.159.177 -> 172.31.29.138 TCP 27578 [TCP segment of a reassembled PDU]
153   0.030154 54.192.159.177 -> 172.31.29.138 TCP 18890 [TCP segment of a reassembled PDU]
154   0.030307 172.31.29.138 -> 54.192.159.177 TCP 66 34873 > http [ACK] Seq=98 Ack=769884 Win=781184 Len=0 TSval=1521777 TSecr=804816401
155   0.030720 54.192.159.177 -> 172.31.29.138 TCP 5858 [TCP segment of a reassembled PDU]
156   0.030727 172.31.29.138 -> 54.192.159.177 TCP 66 34873 > http [ACK] Seq=98 Ack=775676 Win=819456 Len=0 TSval=1521777 TSecr=804816401
157   0.030852 54.192.159.177 -> 172.31.29.138 TCP 14546 [TCP segment of a reassembled PDU]
158   0.030872 172.31.29.138 -> 54.192.159.177 TCP 66 34873 > http [ACK] Seq=98 Ack=790156 Win=827520 Len=0 TSval=1521777 TSecr=804816401
159   0.031051 54.192.159.177 -> 172.31.29.138 TCP 17442 [TCP segment of a reassembled PDU]
160   0.031074 172.31.29.138 -> 54.192.159.177 TCP 66 34873 > http [ACK] Seq=98 Ack=807532 Win=810240 Len=0 TSval=1521777 TSecr=804816401
161   0.031191 54.192.159.177 -> 172.31.29.138 TCP 30474 [TCP segment of a reassembled PDU]
162   0.031230 172.31.29.138 -> 54.192.159.177 TCP 66 34873 > http [ACK] Seq=98 Ack=837940 Win=779904 Len=0 TSval=1521777 TSecr=804816401
163   0.031733 54.192.159.177 -> 172.31.29.138 TCP 5858 [TCP segment of a reassembled PDU]
164   0.031739 172.31.29.138 -> 54.192.159.177 TCP 66 34873 > http [ACK] Seq=98 Ack=843732 Win=819456 Len=0 TSval=1521778 TSecr=804816402
165   0.031852 54.192.159.177 -> 172.31.29.138 TCP 8058 [TCP segment of a reassembled PDU]
166   0.031862 54.192.159.177 -> 172.31.29.138 TCP 2962 [TCP segment of a reassembled PDU]
167   0.031993 54.192.159.177 -> 172.31.29.138 TCP 2962 [TCP segment of a reassembled PDU]
168   0.032037 172.31.29.138 -> 54.192.159.177 TCP 66 34873 > http [ACK] Seq=98 Ack=857516 Win=827520 Len=0 TSval=1521778 TSecr=804816402
169   0.032180 54.192.159.177 -> 172.31.29.138 TCP 29026 [TCP segment of a reassembled PDU]
170   0.032207 172.31.29.138 -> 54.192.159.177 TCP 66 34873 > http [ACK] Seq=98 Ack=886476 Win=798592 Len=0 TSval=1521778 TSecr=804816402
171   0.032231 54.192.159.177 -> 172.31.29.138 TCP 18890 [TCP segment of a reassembled PDU]
172   0.032248 172.31.29.138 -> 54.192.159.177 TCP 66 34873 > http [ACK] Seq=98 Ack=905300 Win=797952 Len=0 TSval=1521778 TSecr=804816402
173   0.032266 54.192.159.177 -> 172.31.29.138 TCP 5858 [TCP segment of a reassembled PDU]
174   0.032275 172.31.29.138 -> 54.192.159.177 TCP 66 34873 > http [ACK] Seq=98 Ack=911092 Win=819456 Len=0 TSval=1521778 TSecr=804816402
175   0.032775 54.192.159.177 -> 172.31.29.138 TCP 2962 [TCP segment of a reassembled PDU]
176   0.032780 172.31.29.138 -> 54.192.159.177 TCP 66 34873 > http [ACK] Seq=98 Ack=913988 Win=824192 Len=0 TSval=1521778 TSecr=804816402
177   0.032895 54.192.159.177 -> 172.31.29.138 TCP 3338 [TCP segment of a reassembled PDU]
178   0.032911 172.31.29.138 -> 54.192.159.177 TCP 66 34873 > http [ACK] Seq=98 Ack=917260 Win=827520 Len=0 TSval=1521778 TSecr=804816402
179   0.033123 54.192.159.177 -> 172.31.29.138 TCP 1514 [TCP segment of a reassembled PDU]
180   0.033210 54.192.159.177 -> 172.31.29.138 TCP 26130 [TCP segment of a reassembled PDU]
181   0.033234 54.192.159.177 -> 172.31.29.138 TCP 17442 [TCP segment of a reassembled PDU]
182   0.033255 172.31.29.138 -> 54.192.159.177 TCP 66 34873 > http [ACK] Seq=98 Ack=962148 Win=782720 Len=0 TSval=1521778 TSecr=804816402
183   0.033276 54.192.159.177 -> 172.31.29.138 TCP 13098 [TCP segment of a reassembled PDU]
184   0.033290 172.31.29.138 -> 54.192.159.177 TCP 66 34873 > http [ACK] Seq=98 Ack=975180 Win=778880 Len=0 TSval=1521778 TSecr=804816402
185   0.033385 54.192.159.177 -> 172.31.29.138 TCP 7682 [TCP segment of a reassembled PDU]
186   0.033392 172.31.29.138 -> 54.192.159.177 TCP 66 34873 > http [ACK] Seq=98 Ack=982796 Win=814720 Len=0 TSval=1521778 TSecr=804816402
187   0.035094 54.192.159.177 -> 172.31.29.138 TCP 2962 [TCP segment of a reassembled PDU]
188   0.035100 172.31.29.138 -> 54.192.159.177 TCP 66 34873 > http [ACK] Seq=98 Ack=985692 Win=824192 Len=0 TSval=1521778 TSecr=804816402
189   0.035159 54.192.159.177 -> 172.31.29.138 TCP 14546 [TCP segment of a reassembled PDU]
190   0.035182 172.31.29.138 -> 54.192.159.177 TCP 66 34873 > http [ACK] Seq=98 Ack=1000172 Win=827520 Len=0 TSval=1521778 TSecr=804816402
191   0.035228 54.192.159.177 -> 172.31.29.138 TCP 4410 [TCP segment of a reassembled PDU]
192   0.035243 172.31.29.138 -> 54.192.159.177 TCP 66 34873 > http [ACK] Seq=98 Ack=1004516 Win=827520 Len=0 TSval=1521778 TSecr=804816402
193   0.035250 54.192.159.177 -> 172.31.29.138 TCP 1514 [TCP Previous segment not captured] [TCP segment of a reassembled PDU]
194   0.035254 172.31.29.138 -> 54.192.159.177 TCP 78 [TCP Dup ACK 192#1] 34873 > http [ACK] Seq=98 Ack=1004516 Win=827520 Len=0 TSval=1521778 TSecr=804816402 SLE=1005964 SRE=1007412
195   0.035263 54.192.159.177 -> 172.31.29.138 TCP 1514 [TCP Out-Of-Order] [TCP segment of a reassembled PDU]
196   0.035266 172.31.29.138 -> 54.192.159.177 TCP 66 34873 > http [ACK] Seq=98 Ack=1007412 Win=824704 Len=0 TSval=1521778 TSecr=804816402
197   0.035367 54.192.159.177 -> 172.31.29.138 TCP 26130 [TCP segment of a reassembled PDU]
198   0.035380 172.31.29.138 -> 54.192.159.177 TCP 66 34873 > http [ACK] Seq=98 Ack=1033476 Win=798720 Len=0 TSval=1521778 TSecr=804816402
199   0.035405 54.192.159.177 -> 172.31.29.138 TCP 14922 [TCP segment of a reassembled PDU]
200   0.035412 172.31.29.138 -> 54.192.159.177 TCP 66 34873 > http [ACK] Seq=98 Ack=1048332 Win=783872 Len=0 TSval=1521778 TSecr=804816402
201   0.036387 54.192.159.177 -> 172.31.29.138 TCP 2962 [TCP segment of a reassembled PDU]
202   0.036392 172.31.29.138 -> 54.192.159.177 TCP 66 34873 > http [ACK] Seq=98 Ack=1051228 Win=824192 Len=0 TSval=1521779 TSecr=804816402
203   0.036716 54.192.159.177 -> 172.31.29.138 TCP 5858 [TCP segment of a reassembled PDU]
204   0.036723 172.31.29.138 -> 54.192.159.177 TCP 66 34873 > http [ACK] Seq=98 Ack=1057020 Win=819456 Len=0 TSval=1521779 TSecr=804816402
205   0.036897 54.192.159.177 -> 172.31.29.138 TCP 26130 [TCP segment of a reassembled PDU]
206   0.036910 172.31.29.138 -> 54.192.159.177 TCP 66 34873 > http [ACK] Seq=98 Ack=1083084 Win=793472 Len=0 TSval=1521779 TSecr=804816402
207   0.036923 54.192.159.177 -> 172.31.29.138 TCP 13098 [TCP segment of a reassembled PDU]
208   0.036931 172.31.29.138 -> 54.192.159.177 TCP 66 34873 > http [ACK] Seq=98 Ack=1096116 Win=780544 Len=0 TSval=1521779 TSecr=804816402
209   0.037436 54.192.159.177 -> 172.31.29.138 TCP 2962 [TCP segment of a reassembled PDU]
210   0.037441 172.31.29.138 -> 54.192.159.177 TCP 66 34873 > http [ACK] Seq=98 Ack=1099012 Win=824192 Len=0 TSval=1521779 TSecr=804816402
211   0.037573 54.192.159.177 -> 172.31.29.138 TCP 14922 [TCP segment of a reassembled PDU]
212   0.037582 172.31.29.138 -> 54.192.159.177 TCP 66 34873 > http [ACK] Seq=98 Ack=1113868 Win=809344 Len=0 TSval=1521779 TSecr=804816402
213   0.038417 54.192.159.177 -> 172.31.29.138 TCP 1514 [TCP segment of a reassembled PDU]
214   0.038422 172.31.29.138 -> 54.192.159.177 TCP 66 34873 > http [ACK] Seq=98 Ack=1115316 Win=826496 Len=0 TSval=1521779 TSecr=804816402
215   0.038685 54.192.159.177 -> 172.31.29.138 TCP 2962 [TCP segment of a reassembled PDU]
216   0.038690 172.31.29.138 -> 54.192.159.177 TCP 66 34873 > http [ACK] Seq=98 Ack=1118212 Win=824192 Len=0 TSval=1521779 TSecr=804816402
217   0.038844 54.192.159.177 -> 172.31.29.138 TCP 26130 [TCP segment of a reassembled PDU]
218   0.038856 172.31.29.138 -> 54.192.159.177 TCP 66 34873 > http [ACK] Seq=98 Ack=1144276 Win=798208 Len=0 TSval=1521779 TSecr=804816402
219   0.038879 54.192.159.177 -> 172.31.29.138 TCP 21786 [TCP segment of a reassembled PDU]
220   0.038901 172.31.29.138 -> 54.192.159.177 TCP 66 34873 > http [ACK] Seq=98 Ack=1165996 Win=776576 Len=0 TSval=1521779 TSecr=804816402
221   0.039474 54.192.159.177 -> 172.31.29.138 TCP 2962 [TCP segment of a reassembled PDU]
222   0.039480 172.31.29.138 -> 54.192.159.177 TCP 66 34873 > http [ACK] Seq=98 Ack=1168892 Win=824192 Len=0 TSval=1521779 TSecr=804816402
223   0.039600 54.192.159.177 -> 172.31.29.138 TCP 10578 [TCP segment of a reassembled PDU]
224   0.039608 172.31.29.138 -> 54.192.159.177 TCP 66 34873 > http [ACK] Seq=98 Ack=1179404 Win=813696 Len=0 TSval=1521779 TSecr=804816402
225   0.040493 54.192.159.177 -> 172.31.29.138 TCP 1514 [TCP segment of a reassembled PDU]
226   0.040497 172.31.29.138 -> 54.192.159.177 TCP 66 34873 > http [ACK] Seq=98 Ack=1180852 Win=826496 Len=0 TSval=1521780 TSecr=804816402
227   0.040753 54.192.159.177 -> 172.31.29.138 TCP 4410 [TCP segment of a reassembled PDU]
228   0.040768 172.31.29.138 -> 54.192.159.177 TCP 66 34873 > http [ACK] Seq=98 Ack=1185196 Win=829056 Len=0 TSval=1521780 TSecr=804816402
229   0.040915 54.192.159.177 -> 172.31.29.138 TCP 26130 [TCP segment of a reassembled PDU]
230   0.040932 54.192.159.177 -> 172.31.29.138 TCP 7306 [TCP segment of a reassembled PDU]
231   0.040937 54.192.159.177 -> 172.31.29.138 TCP 1514 [TCP Previous segment not captured] [TCP segment of a reassembled PDU]
232   0.040940 172.31.29.138 -> 54.192.159.177 TCP 78 34873 > http [ACK] Seq=98 Ack=1218500 Win=795776 Len=0 TSval=1521780 TSecr=804816402 SLE=1219948 SRE=1221396
233   0.040946 54.192.159.177 -> 172.31.29.138 TCP 1514 [TCP Out-Of-Order] [TCP segment of a reassembled PDU]
234   0.040949 172.31.29.138 -> 54.192.159.177 TCP 66 34873 > http [ACK] Seq=98 Ack=1221396 Win=792960 Len=0 TSval=1521780 TSecr=804816402
235   0.041036 54.192.159.177 -> 172.31.29.138 TCP 14546 [TCP segment of a reassembled PDU]
236   0.041046 172.31.29.138 -> 54.192.159.177 TCP 66 34873 > http [ACK] Seq=98 Ack=1235876 Win=805120 Len=0 TSval=1521780 TSecr=804816402
237   0.041756 54.192.159.177 -> 172.31.29.138 TCP 5858 [TCP segment of a reassembled PDU]
238   0.041763 172.31.29.138 -> 54.192.159.177 TCP 66 34873 > http [ACK] Seq=98 Ack=1241668 Win=819456 Len=0 TSval=1521780 TSecr=804816403
239   0.041853 54.192.159.177 -> 172.31.29.138 TCP 3338 [TCP segment of a reassembled PDU]
240   0.041858 172.31.29.138 -> 54.192.159.177 TCP 66 34873 > http [ACK] Seq=98 Ack=1244940 Win=821760 Len=0 TSval=1521780 TSecr=804816403
241   0.043037 54.192.159.177 -> 172.31.29.138 TCP 2962 [TCP segment of a reassembled PDU]
242   0.043042 172.31.29.138 -> 54.192.159.177 TCP 66 34873 > http [ACK] Seq=98 Ack=1247836 Win=824192 Len=0 TSval=1521780 TSecr=804816403
243   0.043067 54.192.159.177 -> 172.31.29.138 TCP 5858 [TCP segment of a reassembled PDU]
244   0.043071 172.31.29.138 -> 54.192.159.177 TCP 66 34873 > http [ACK] Seq=98 Ack=1253628 Win=819456 Len=0 TSval=1521780 TSecr=804816403
245   0.043181 54.192.159.177 -> 172.31.29.138 TCP 14546 [TCP segment of a reassembled PDU]
246   0.043190 172.31.29.138 -> 54.192.159.177 TCP 66 34873 > http [ACK] Seq=98 Ack=1268108 Win=805120 Len=0 TSval=1521780 TSecr=804816403
247   0.043558 54.192.159.177 -> 172.31.29.138 TCP 2962 [TCP segment of a reassembled PDU]
248   0.043563 172.31.29.138 -> 54.192.159.177 TCP 66 34873 > http [ACK] Seq=98 Ack=1271004 Win=824192 Len=0 TSval=1521780 TSecr=804816403
249   0.043744 54.192.159.177 -> 172.31.29.138 TCP 24682 [TCP segment of a reassembled PDU]
250   0.043757 172.31.29.138 -> 54.192.159.177 TCP 66 34873 > http [ACK] Seq=98 Ack=1295620 Win=799616 Len=0 TSval=1521781 TSecr=804816403
251   0.044567 54.192.159.177 -> 172.31.29.138 TCP 4410 [TCP segment of a reassembled PDU]
252   0.044572 172.31.29.138 -> 54.192.159.177 TCP 66 34873 > http [ACK] Seq=98 Ack=1299964 Win=821760 Len=0 TSval=1521781 TSecr=804816403
253   0.044701 54.192.159.177 -> 172.31.29.138 TCP 10578 [TCP segment of a reassembled PDU]
254   0.044709 172.31.29.138 -> 54.192.159.177 TCP 66 34873 > http [ACK] Seq=98 Ack=1310476 Win=811264 Len=0 TSval=1521781 TSecr=804816403
255   0.045879 54.192.159.177 -> 172.31.29.138 TCP 2962 [TCP segment of a reassembled PDU]
256   0.045884 172.31.29.138 -> 54.192.159.177 TCP 66 34873 > http [ACK] Seq=98 Ack=1313372 Win=824192 Len=0 TSval=1521781 TSecr=804816403
257   0.046019 54.192.159.177 -> 172.31.29.138 TCP 10202 [TCP segment of a reassembled PDU]
258   0.046026 172.31.29.138 -> 54.192.159.177 TCP 66 34873 > http [ACK] Seq=98 Ack=1323508 Win=814080 Len=0 TSval=1521781 TSecr=804816403
259   0.046032 54.192.159.177 -> 172.31.29.138 TCP 1514 [TCP Previous segment not captured] [TCP segment of a reassembled PDU]
260   0.046034 172.31.29.138 -> 54.192.159.177 TCP 78 [TCP Dup ACK 258#1] 34873 > http [ACK] Seq=98 Ack=1323508 Win=814080 Len=0 TSval=1521781 TSecr=804816403 SLE=1324956 SRE=1326404
261   0.046058 54.192.159.177 -> 172.31.29.138 TCP 1514 [TCP Out-Of-Order] [TCP segment of a reassembled PDU]
262   0.046061 172.31.29.138 -> 54.192.159.177 TCP 66 34873 > http [ACK] Seq=98 Ack=1326404 Win=811264 Len=0 TSval=1521781 TSecr=804816403
263   0.046136 54.192.159.177 -> 172.31.29.138 TCP 14546 [TCP segment of a reassembled PDU]
264   0.046145 172.31.29.138 -> 54.192.159.177 TCP 66 34873 > http [ACK] Seq=98 Ack=1340884 Win=805120 Len=0 TSval=1521781 TSecr=804816403
265   0.046625 54.192.159.177 -> 172.31.29.138 TCP 8754 [TCP segment of a reassembled PDU]
266   0.046632 172.31.29.138 -> 54.192.159.177 TCP 66 34873 > http [ACK] Seq=98 Ack=1349572 Win=814720 Len=0 TSval=1521781 TSecr=804816403
267   0.046795 54.192.159.177 -> 172.31.29.138 TCP 26130 [TCP segment of a reassembled PDU]
268   0.046807 172.31.29.138 -> 54.192.159.177 TCP 66 34873 > http [ACK] Seq=98 Ack=1375636 Win=788736 Len=0 TSval=1521781 TSecr=804816403
269   0.046814 54.192.159.177 -> 172.31.29.138 TCP 442 [TCP segment of a reassembled PDU]
270   0.046816 172.31.29.138 -> 54.192.159.177 TCP 66 34873 > http [ACK] Seq=98 Ack=1376012 Win=788480 Len=0 TSval=1521781 TSecr=804816403
271   0.047646 54.192.159.177 -> 172.31.29.138 TCP 5858 [TCP segment of a reassembled PDU]
272   0.047653 172.31.29.138 -> 54.192.159.177 TCP 66 34873 > http [ACK] Seq=98 Ack=1381804 Win=819456 Len=0 TSval=1521781 TSecr=804816403
273   0.047820 54.192.159.177 -> 172.31.29.138 TCP 26130 [TCP segment of a reassembled PDU]
274   0.047833 172.31.29.138 -> 54.192.159.177 TCP 66 34873 > http [ACK] Seq=98 Ack=1407868 Win=793472 Len=0 TSval=1521782 TSecr=804816403
275   0.047842 54.192.159.177 -> 172.31.29.138 TCP 5858 [TCP segment of a reassembled PDU]
276   0.047846 172.31.29.138 -> 54.192.159.177 TCP 66 34873 > http [ACK] Seq=98 Ack=1413660 Win=787712 Len=0 TSval=1521782 TSecr=804816403
277   0.048441 54.192.159.177 -> 172.31.29.138 TCP 5858 [TCP segment of a reassembled PDU]
278   0.048449 172.31.29.138 -> 54.192.159.177 TCP 66 34873 > http [ACK] Seq=98 Ack=1419452 Win=819456 Len=0 TSval=1521782 TSecr=804816403
279   0.048613 54.192.159.177 -> 172.31.29.138 TCP 17442 [TCP segment of a reassembled PDU]
280   0.048624 172.31.29.138 -> 54.192.159.177 TCP 66 34873 > http [ACK] Seq=98 Ack=1436828 Win=802176 Len=0 TSval=1521782 TSecr=804816403
281   0.048635 54.192.159.177 -> 172.31.29.138 TCP 4786 [TCP segment of a reassembled PDU]
282   0.048639 172.31.29.138 -> 54.192.159.177 TCP 66 34873 > http [ACK] Seq=98 Ack=1441548 Win=797568 Len=0 TSval=1521782 TSecr=804816403
283   0.048790 54.192.159.177 -> 172.31.29.138 TCP 2962 [TCP segment of a reassembled PDU]
284   0.048795 172.31.29.138 -> 54.192.159.177 TCP 66 34873 > http [ACK] Seq=98 Ack=1444444 Win=824192 Len=0 TSval=1521782 TSecr=804816403
285   0.049203 54.192.159.177 -> 172.31.29.138 TCP 11650 [TCP segment of a reassembled PDU]
286   0.049211 172.31.29.138 -> 54.192.159.177 TCP 66 34873 > http [ACK] Seq=98 Ack=1456028 Win=812672 Len=0 TSval=1521782 TSecr=804816403
287   0.049357 54.192.159.177 -> 172.31.29.138 TCP 27578 [TCP segment of a reassembled PDU]
288   0.049371 172.31.29.138 -> 54.192.159.177 TCP 66 34873 > http [ACK] Seq=98 Ack=1483540 Win=785280 Len=0 TSval=1521782 TSecr=804816403
289   0.049947 54.192.159.177 -> 172.31.29.138 TCP 5858 [TCP segment of a reassembled PDU]
290   0.049955 172.31.29.138 -> 54.192.159.177 TCP 66 34873 > http [ACK] Seq=98 Ack=1489332 Win=819456 Len=0 TSval=1521782 TSecr=804816403
291   0.050103 54.192.159.177 -> 172.31.29.138 TCP 17818 [TCP segment of a reassembled PDU]
292   0.050128 172.31.29.138 -> 54.192.159.177 TCP 66 34873 > http [ACK] Seq=98 Ack=1507084 Win=801792 Len=0 TSval=1521782 TSecr=804816403
293   0.050469 54.192.159.177 -> 172.31.29.138 TCP 7306 [TCP segment of a reassembled PDU]
294   0.050475 172.31.29.138 -> 54.192.159.177 TCP 66 34873 > http [ACK] Seq=98 Ack=1514324 Win=817024 Len=0 TSval=1521782 TSecr=804816403
295   0.050652 54.192.159.177 -> 172.31.29.138 TCP 26130 [TCP segment of a reassembled PDU]
296   0.050668 54.192.159.177 -> 172.31.29.138 TCP 4410 [TCP segment of a reassembled PDU]
297   0.050695 54.192.159.177 -> 172.31.29.138 TCP 18890 [TCP segment of a reassembled PDU]
298   0.050707 172.31.29.138 -> 54.192.159.177 TCP 66 34873 > http [ACK] Seq=98 Ack=1544732 Win=786688 Len=0 TSval=1521782 TSecr=804816403
299   0.050737 172.31.29.138 -> 54.192.159.177 TCP 66 34873 > http [ACK] Seq=98 Ack=1563556 Win=797952 Len=0 TSval=1521782 TSecr=804816403
300   0.051231 54.192.159.177 -> 172.31.29.138 TCP 5858 [TCP segment of a reassembled PDU]
301   0.051237 172.31.29.138 -> 54.192.159.177 TCP 66 34873 > http [ACK] Seq=98 Ack=1569348 Win=819456 Len=0 TSval=1521782 TSecr=804816403
302   0.051351 54.192.159.177 -> 172.31.29.138 TCP 3338 [TCP segment of a reassembled PDU]
303   0.051356 172.31.29.138 -> 54.192.159.177 TCP 66 34873 > http [ACK] Seq=98 Ack=1572620 Win=821760 Len=0 TSval=1521782 TSecr=804816403
304   0.053806 54.192.159.177 -> 172.31.29.138 TCP 2962 [TCP segment of a reassembled PDU]
305   0.053811 172.31.29.138 -> 54.192.159.177 TCP 66 34873 > http [ACK] Seq=98 Ack=1575516 Win=824192 Len=0 TSval=1521783 TSecr=804816404
306   0.054021 54.192.159.177 -> 172.31.29.138 TCP 26130 [TCP segment of a reassembled PDU]
307   0.054047 172.31.29.138 -> 54.192.159.177 TCP 66 34873 > http [ACK] Seq=98 Ack=1601580 Win=798208 Len=0 TSval=1521783 TSecr=804816404
308   0.054108 54.192.159.177 -> 172.31.29.138 TCP 26130 [TCP segment of a reassembled PDU]
309   0.054122 54.192.159.177 -> 172.31.29.138 TCP 1514 [TCP segment of a reassembled PDU]
310   0.054126 54.192.159.177 -> 172.31.29.138 TCP 2962 [TCP segment of a reassembled PDU]
311   0.054274 172.31.29.138 -> 54.192.159.177 TCP 66 34873 > http [ACK] Seq=98 Ack=1631988 Win=778880 Len=0 TSval=1521783 TSecr=804816404
312   0.054558 54.192.159.177 -> 172.31.29.138 TCP 2962 [TCP segment of a reassembled PDU]
313   0.054563 172.31.29.138 -> 54.192.159.177 TCP 66 34873 > http [ACK] Seq=98 Ack=1634884 Win=824192 Len=0 TSval=1521783 TSecr=804816404
314   0.054684 54.192.159.177 -> 172.31.29.138 TCP 3338 [TCP segment of a reassembled PDU]
315   0.054712 172.31.29.138 -> 54.192.159.177 TCP 66 34873 > http [ACK] Seq=98 Ack=1638156 Win=829056 Len=0 TSval=1521783 TSecr=804816404
316   0.057651 54.192.159.177 -> 172.31.29.138 TCP 10202 [TCP segment of a reassembled PDU]
317   0.057669 172.31.29.138 -> 54.192.159.177 TCP 66 34873 > http [ACK] Seq=98 Ack=1648292 Win=829056 Len=0 TSval=1521784 TSecr=804816404
318   0.057806 54.192.159.177 -> 172.31.29.138 TCP 26130 [TCP segment of a reassembled PDU]
319   0.057830 172.31.29.138 -> 54.192.159.177 TCP 66 34873 > http [ACK] Seq=98 Ack=1674356 Win=803072 Len=0 TSval=1521784 TSecr=804816404
320   0.057856 54.192.159.177 -> 172.31.29.138 TCP 26130 [TCP segment of a reassembled PDU]
321   0.057876 172.31.29.138 -> 54.192.159.177 TCP 66 34873 > http [ACK] Seq=98 Ack=1700420 Win=786176 Len=0 TSval=1521784 TSecr=804816404
322   0.058400 54.192.159.177 -> 172.31.29.138 TCP 3338 [TCP segment of a reassembled PDU]
323   0.058405 172.31.29.138 -> 54.192.159.177 TCP 66 34873 > http [ACK] Seq=98 Ack=1703692 Win=821760 Len=0 TSval=1521784 TSecr=804816404
324   0.059435 54.192.159.177 -> 172.31.29.138 TCP 2962 [TCP segment of a reassembled PDU]
325   0.059443 172.31.29.138 -> 54.192.159.177 TCP 66 34873 > http [ACK] Seq=98 Ack=1706588 Win=824192 Len=0 TSval=1521784 TSecr=804816404
326   0.059494 54.192.159.177 -> 172.31.29.138 TCP 17442 [TCP segment of a reassembled PDU]
327   0.059610 54.192.159.177 -> 172.31.29.138 TCP 26130 [TCP segment of a reassembled PDU]
328   0.059629 54.192.159.177 -> 172.31.29.138 TCP 11650 [TCP segment of a reassembled PDU]
329   0.059639 54.192.159.177 -> 172.31.29.138 TCP 7306 [TCP segment of a reassembled PDU]
330   0.059711 172.31.29.138 -> 54.192.159.177 TCP 66 34873 > http [ACK] Seq=98 Ack=1768852 Win=761984 Len=0 TSval=1521785 TSecr=804816404
331   0.059928 54.192.159.177 -> 172.31.29.138 TCP 442 [TCP segment of a reassembled PDU]
332   0.059943 172.31.29.138 -> 54.192.159.177 TCP 66 34873 > http [ACK] Seq=98 Ack=1769228 Win=829056 Len=0 TSval=1521785 TSecr=804816404
333   0.061989 54.192.159.177 -> 172.31.29.138 TCP 2962 [TCP segment of a reassembled PDU]
334   0.062004 172.31.29.138 -> 54.192.159.177 TCP 66 34873 > http [ACK] Seq=98 Ack=1772124 Win=829056 Len=0 TSval=1521785 TSecr=804816405
335   0.062022 54.192.159.177 -> 172.31.29.138 TCP 7306 [TCP segment of a reassembled PDU]
336   0.062030 172.31.29.138 -> 54.192.159.177 TCP 66 34873 > http [ACK] Seq=98 Ack=1779364 Win=829056 Len=0 TSval=1521785 TSecr=804816405
337   0.062135 54.192.159.177 -> 172.31.29.138 TCP 20338 [TCP segment of a reassembled PDU]
338   0.062157 172.31.29.138 -> 54.192.159.177 TCP 66 34873 > http [ACK] Seq=98 Ack=1799636 Win=808832 Len=0 TSval=1521785 TSecr=804816405
339   0.062252 54.192.159.177 -> 172.31.29.138 TCP 26130 [TCP segment of a reassembled PDU]
340   0.062276 172.31.29.138 -> 54.192.159.177 TCP 66 34873 > http [ACK] Seq=98 Ack=1825700 Win=786176 Len=0 TSval=1521785 TSecr=804816405
341   0.062308 54.192.159.177 -> 172.31.29.138 TCP 9130 [TCP segment of a reassembled PDU]
342   0.062315 172.31.29.138 -> 54.192.159.177 TCP 66 34873 > http [ACK] Seq=98 Ack=1834764 Win=812288 Len=0 TSval=1521785 TSecr=804816405
343   0.065071 54.192.159.177 -> 172.31.29.138 TCP 1514 [TCP segment of a reassembled PDU]
344   0.065117 54.192.159.177 -> 172.31.29.138 TCP 8754 [TCP segment of a reassembled PDU]
345   0.065124 172.31.29.138 -> 54.192.159.177 TCP 66 34873 > http [ACK] Seq=98 Ack=1844900 Win=814720 Len=0 TSval=1521786 TSecr=804816405
346   0.065240 54.192.159.177 -> 172.31.29.138 TCP 23234 [TCP segment of a reassembled PDU]
