[Measurement for 10mb at 04:36:55 20.36.2014] 
Tshark:

  1   0.000000 172.31.29.138 -> 172.31.0.2   DNS 89 Standard query 0xd30f  A d1dx94olpiqj0t.cloudfront.net
  2   0.000028 172.31.29.138 -> 172.31.0.2   DNS 89 Standard query 0xe61b  AAAA d1dx94olpiqj0t.cloudfront.net
  3   0.000473   172.31.0.2 -> 172.31.29.138 DNS 176 Standard query response 0xe61b 
  4   0.000485   172.31.0.2 -> 172.31.29.138 DNS 217 Standard query response 0xd30f  A 54.230.158.217 A 54.230.159.4 A 54.192.157.144 A 54.192.157.155 A 54.192.159.97 A 54.192.159.180 A 54.230.156.193 A 54.230.158.205
  5   0.003846 172.31.29.138 -> 54.230.158.217 TCP 74 42001 > http [SYN] Seq=0 Win=26883 Len=0 MSS=8961 SACK_PERM=1 TSval=10521974 TSecr=0 WS=128
  6   0.004619 54.230.158.217 -> 172.31.29.138 TCP 74 http > 42001 [SYN, ACK] Seq=0 Ack=1 Win=14480 Len=0 MSS=1460 SACK_PERM=1 TSval=810448396 TSecr=10521974 WS=128
  7   0.004634 172.31.29.138 -> 54.230.158.217 TCP 66 42001 > http [ACK] Seq=1 Ack=1 Win=27008 Len=0 TSval=10521974 TSecr=810448396
  8   0.004673 172.31.29.138 -> 54.230.158.217 HTTP 163 GET /10mb HTTP/1.1 
  9   0.005341 54.230.158.217 -> 172.31.29.138 TCP 66 http > 42001 [ACK] Seq=1 Ack=98 Win=14592 Len=0 TSval=810448396 TSecr=10521974
 10   0.008054 54.230.158.217 -> 172.31.29.138 TCP 7306 [TCP segment of a reassembled PDU]
 11   0.008065 172.31.29.138 -> 54.230.158.217 TCP 66 42001 > http [ACK] Seq=98 Ack=7241 Win=41472 Len=0 TSval=10521975 TSecr=810448397
 12   0.008086 54.230.158.217 -> 172.31.29.138 TCP 5858 [TCP segment of a reassembled PDU]
 13   0.008092 172.31.29.138 -> 54.230.158.217 TCP 66 42001 > http [ACK] Seq=98 Ack=13033 Win=52992 Len=0 TSval=10521975 TSecr=810448397
 14   0.008790 54.230.158.217 -> 172.31.29.138 TCP 4410 [TCP segment of a reassembled PDU]
 15   0.008797 172.31.29.138 -> 54.230.158.217 TCP 66 42001 > http [ACK] Seq=98 Ack=17377 Win=61696 Len=0 TSval=10521975 TSecr=810448397
 16   0.008838 54.230.158.217 -> 172.31.29.138 TCP 8754 [TCP segment of a reassembled PDU]
 17   0.008844 172.31.29.138 -> 54.230.158.217 TCP 66 42001 > http [ACK] Seq=98 Ack=26065 Win=79104 Len=0 TSval=10521975 TSecr=810448397
 18   0.009549 54.230.158.217 -> 172.31.29.138 TCP 4410 [TCP segment of a reassembled PDU]
 19   0.009555 172.31.29.138 -> 54.230.158.217 TCP 66 42001 > http [ACK] Seq=98 Ack=30409 Win=87808 Len=0 TSval=10521975 TSecr=810448397
 20   0.009659 54.230.158.217 -> 172.31.29.138 TCP 15994 [TCP segment of a reassembled PDU]
 21   0.009670 172.31.29.138 -> 54.230.158.217 TCP 66 42001 > http [ACK] Seq=98 Ack=46337 Win=91648 Len=0 TSval=10521975 TSecr=810448397
 22   0.010323 54.230.158.217 -> 172.31.29.138 TCP 2962 [TCP segment of a reassembled PDU]
 23   0.010329 172.31.29.138 -> 54.230.158.217 TCP 66 42001 > http [ACK] Seq=98 Ack=49233 Win=109056 Len=0 TSval=10521975 TSecr=810448397
 24   0.010424 54.230.158.217 -> 172.31.29.138 TCP 15994 [TCP segment of a reassembled PDU]
 25   0.010433 172.31.29.138 -> 54.230.158.217 TCP 66 42001 > http [ACK] Seq=98 Ack=65161 Win=93184 Len=0 TSval=10521975 TSecr=810448397
 26   0.011095 54.230.158.217 -> 172.31.29.138 TCP 4410 [TCP segment of a reassembled PDU]
 27   0.011100 172.31.29.138 -> 54.230.158.217 TCP 66 42001 > http [ACK] Seq=98 Ack=69505 Win=109056 Len=0 TSval=10521975 TSecr=810448397
 28   0.011231 54.230.158.217 -> 172.31.29.138 TCP 21786 [TCP segment of a reassembled PDU]
 29   0.011243 172.31.29.138 -> 54.230.158.217 TCP 66 42001 > http [ACK] Seq=98 Ack=91225 Win=87424 Len=0 TSval=10521975 TSecr=810448397
 30   0.011851 54.230.158.217 -> 172.31.29.138 TCP 2962 [TCP segment of a reassembled PDU]
 31   0.011856 172.31.29.138 -> 54.230.158.217 TCP 66 42001 > http [ACK] Seq=98 Ack=94121 Win=109056 Len=0 TSval=10521976 TSecr=810448397
 32   0.011993 54.230.158.217 -> 172.31.29.138 TCP 26130 [TCP segment of a reassembled PDU]
 33   0.012006 172.31.29.138 -> 54.230.158.217 TCP 66 42001 > http [ACK] Seq=98 Ack=120185 Win=161152 Len=0 TSval=10521976 TSecr=810448397
 34   0.012611 54.230.158.217 -> 172.31.29.138 TCP 2962 [TCP segment of a reassembled PDU]
 35   0.012617 172.31.29.138 -> 54.230.158.217 TCP 66 42001 > http [ACK] Seq=98 Ack=123081 Win=167040 Len=0 TSval=10521976 TSecr=810448397
 36   0.012711 54.230.158.217 -> 172.31.29.138 TCP 7306 [TCP segment of a reassembled PDU]
 37   0.012718 172.31.29.138 -> 54.230.158.217 TCP 66 42001 > http [ACK] Seq=98 Ack=130321 Win=181504 Len=0 TSval=10521976 TSecr=810448397
 38   0.012810 54.230.158.217 -> 172.31.29.138 TCP 21786 [TCP segment of a reassembled PDU]
 39   0.012821 172.31.29.138 -> 54.230.158.217 TCP 66 42001 > http [ACK] Seq=98 Ack=152041 Win=224896 Len=0 TSval=10521976 TSecr=810448397
 40   0.013376 54.230.158.217 -> 172.31.29.138 TCP 2962 [TCP segment of a reassembled PDU]
 41   0.013382 172.31.29.138 -> 54.230.158.217 TCP 66 42001 > http [ACK] Seq=98 Ack=154937 Win=230656 Len=0 TSval=10521976 TSecr=810448397
 42   0.013539 54.230.158.217 -> 172.31.29.138 TCP 26130 [TCP segment of a reassembled PDU]
 43   0.013551 172.31.29.138 -> 54.230.158.217 TCP 66 42001 > http [ACK] Seq=98 Ack=181001 Win=282880 Len=0 TSval=10521976 TSecr=810448397
 44   0.013561 54.230.158.217 -> 172.31.29.138 TCP 7306 [TCP segment of a reassembled PDU]
 45   0.013566 172.31.29.138 -> 54.230.158.217 TCP 66 42001 > http [ACK] Seq=98 Ack=188241 Win=297344 Len=0 TSval=10521976 TSecr=810448397
 46   0.014138 54.230.158.217 -> 172.31.29.138 TCP 2962 [TCP segment of a reassembled PDU]
 47   0.014143 172.31.29.138 -> 54.230.158.217 TCP 66 42001 > http [ACK] Seq=98 Ack=191137 Win=303104 Len=0 TSval=10521976 TSecr=810448397
 48   0.014331 54.230.158.217 -> 172.31.29.138 TCP 23234 [TCP segment of a reassembled PDU]
 49   0.014343 172.31.29.138 -> 54.230.158.217 TCP 66 42001 > http [ACK] Seq=98 Ack=214305 Win=349440 Len=0 TSval=10521976 TSecr=810448397
 50   0.014353 54.230.158.217 -> 172.31.29.138 TCP 2962 [TCP segment of a reassembled PDU]
 51   0.014356 172.31.29.138 -> 54.230.158.217 TCP 66 42001 > http [ACK] Seq=98 Ack=217201 Win=355200 Len=0 TSval=10521976 TSecr=810448397
 52   0.014409 54.230.158.217 -> 172.31.29.138 TCP 11650 [TCP segment of a reassembled PDU]
 53   0.014418 172.31.29.138 -> 54.230.158.217 TCP 66 42001 > http [ACK] Seq=98 Ack=228785 Win=378368 Len=0 TSval=10521976 TSecr=810448397
 54   0.014724 54.230.158.217 -> 172.31.29.138 TCP 2962 [TCP segment of a reassembled PDU]
 55   0.014729 172.31.29.138 -> 54.230.158.217 TCP 66 42001 > http [ACK] Seq=98 Ack=231681 Win=384128 Len=0 TSval=10521976 TSecr=810448397
 56   0.014912 54.230.158.217 -> 172.31.29.138 TCP 26130 [TCP segment of a reassembled PDU]
 57   0.014926 172.31.29.138 -> 54.230.158.217 TCP 66 42001 > http [ACK] Seq=98 Ack=257745 Win=436352 Len=0 TSval=10521976 TSecr=810448397
 58   0.015259 54.230.158.217 -> 172.31.29.138 TCP 5858 [TCP segment of a reassembled PDU]
 59   0.015267 172.31.29.138 -> 54.230.158.217 TCP 66 42001 > http [ACK] Seq=98 Ack=263537 Win=447872 Len=0 TSval=10521976 TSecr=810448397
 60   0.015395 54.230.158.217 -> 172.31.29.138 TCP 15994 [TCP segment of a reassembled PDU]
 61   0.015405 172.31.29.138 -> 54.230.158.217 TCP 66 42001 > http [ACK] Seq=98 Ack=279465 Win=479744 Len=0 TSval=10521976 TSecr=810448397
 62   0.015673 54.230.158.217 -> 172.31.29.138 TCP 27578 [TCP segment of a reassembled PDU]
 63   0.015687 172.31.29.138 -> 54.230.158.217 TCP 66 42001 > http [ACK] Seq=98 Ack=306977 Win=534784 Len=0 TSval=10521976 TSecr=810448397
 64   0.016267 54.230.158.217 -> 172.31.29.138 TCP 2962 [TCP segment of a reassembled PDU]
 65   0.016272 172.31.29.138 -> 54.230.158.217 TCP 66 42001 > http [ACK] Seq=98 Ack=309873 Win=540544 Len=0 TSval=10521977 TSecr=810448397
 66   0.016466 54.230.158.217 -> 172.31.29.138 TCP 26130 [TCP segment of a reassembled PDU]
 67   0.016479 172.31.29.138 -> 54.230.158.217 TCP 66 42001 > http [ACK] Seq=98 Ack=335937 Win=592640 Len=0 TSval=10521977 TSecr=810448397
 68   0.016535 54.230.158.217 -> 172.31.29.138 TCP 24682 [TCP segment of a reassembled PDU]
 69   0.016548 172.31.29.138 -> 54.230.158.217 TCP 66 42001 > http [ACK] Seq=98 Ack=360553 Win=641920 Len=0 TSval=10521977 TSecr=810448397
 70   0.017283 54.230.158.217 -> 172.31.29.138 TCP 2962 [TCP segment of a reassembled PDU]
 71   0.017289 172.31.29.138 -> 54.230.158.217 TCP 66 42001 > http [ACK] Seq=98 Ack=363449 Win=647680 Len=0 TSval=10521977 TSecr=810448398
 72   0.017476 54.230.158.217 -> 172.31.29.138 TCP 26130 [TCP segment of a reassembled PDU]
 73   0.017489 172.31.29.138 -> 54.230.158.217 TCP 66 42001 > http [ACK] Seq=98 Ack=389513 Win=699904 Len=0 TSval=10521977 TSecr=810448398
 74   0.017529 54.230.158.217 -> 172.31.29.138 TCP 26130 [TCP segment of a reassembled PDU]
 75   0.017541 172.31.29.138 -> 54.230.158.217 TCP 66 42001 > http [ACK] Seq=98 Ack=415577 Win=752000 Len=0 TSval=10521977 TSecr=810448398
 76   0.017548 54.230.158.217 -> 172.31.29.138 TCP 2962 [TCP segment of a reassembled PDU]
 77   0.017551 172.31.29.138 -> 54.230.158.217 TCP 66 42001 > http [ACK] Seq=98 Ack=418473 Win=757760 Len=0 TSval=10521977 TSecr=810448398
 78   0.018328 54.230.158.217 -> 172.31.29.138 TCP 4410 [TCP segment of a reassembled PDU]
 79   0.018334 172.31.29.138 -> 54.230.158.217 TCP 66 42001 > http [ACK] Seq=98 Ack=422817 Win=766464 Len=0 TSval=10521977 TSecr=810448398
 80   0.018529 54.230.158.217 -> 172.31.29.138 TCP 26130 [TCP segment of a reassembled PDU]
 81   0.018541 172.31.29.138 -> 54.230.158.217 TCP 66 42001 > http [ACK] Seq=98 Ack=448881 Win=818560 Len=0 TSval=10521977 TSecr=810448398
 82   0.018582 54.230.158.217 -> 172.31.29.138 TCP 26130 [TCP segment of a reassembled PDU]
 83   0.018594 172.31.29.138 -> 54.230.158.217 TCP 66 42001 > http [ACK] Seq=98 Ack=474945 Win=870656 Len=0 TSval=10521977 TSecr=810448398
 84   0.018604 54.230.158.217 -> 172.31.29.138 TCP 2962 [TCP segment of a reassembled PDU]
 85   0.018607 172.31.29.138 -> 54.230.158.217 TCP 66 42001 > http [ACK] Seq=98 Ack=477841 Win=876544 Len=0 TSval=10521977 TSecr=810448398
 86   0.019099 54.230.158.217 -> 172.31.29.138 TCP 1514 [TCP segment of a reassembled PDU]
 87   0.019103 172.31.29.138 -> 54.230.158.217 TCP 66 42001 > http [ACK] Seq=98 Ack=479289 Win=879360 Len=0 TSval=10521977 TSecr=810448398
 88   0.019298 54.230.158.217 -> 172.31.29.138 TCP 26130 [TCP segment of a reassembled PDU]
 89   0.019324 172.31.29.138 -> 54.230.158.217 TCP 66 42001 > http [ACK] Seq=98 Ack=505353 Win=931584 Len=0 TSval=10521977 TSecr=810448398
 90   0.019381 54.230.158.217 -> 172.31.29.138 TCP 26130 [TCP segment of a reassembled PDU]
 91   0.019393 172.31.29.138 -> 54.230.158.217 TCP 66 42001 > http [ACK] Seq=98 Ack=531417 Win=983680 Len=0 TSval=10521977 TSecr=810448398
 92   0.019398 54.230.158.217 -> 172.31.29.138 TCP 1514 [TCP segment of a reassembled PDU]
 93   0.019401 172.31.29.138 -> 54.230.158.217 TCP 66 42001 > http [ACK] Seq=98 Ack=532865 Win=986496 Len=0 TSval=10521977 TSecr=810448398
 94   0.019405 54.230.158.217 -> 172.31.29.138 TCP 4410 [TCP segment of a reassembled PDU]
 95   0.019408 172.31.29.138 -> 54.230.158.217 TCP 66 42001 > http [ACK] Seq=98 Ack=537209 Win=995200 Len=0 TSval=10521977 TSecr=810448398
 96   0.019437 54.230.158.217 -> 172.31.29.138 TCP 5858 [TCP segment of a reassembled PDU]
 97   0.019442 172.31.29.138 -> 54.230.158.217 TCP 66 42001 > http [ACK] Seq=98 Ack=543001 Win=1006848 Len=0 TSval=10521977 TSecr=810448398
 98   0.019879 54.230.158.217 -> 172.31.29.138 TCP 4410 [TCP segment of a reassembled PDU]
 99   0.019885 172.31.29.138 -> 54.230.158.217 TCP 66 42001 > http [ACK] Seq=98 Ack=547345 Win=1015552 Len=0 TSval=10521978 TSecr=810448398
100   0.020048 54.230.158.217 -> 172.31.29.138 TCP 26130 [TCP segment of a reassembled PDU]
101   0.020060 172.31.29.138 -> 54.230.158.217 TCP 66 42001 > http [ACK] Seq=98 Ack=573409 Win=1067648 Len=0 TSval=10521978 TSecr=810448398
102   0.020099 54.230.158.217 -> 172.31.29.138 TCP 20338 [TCP segment of a reassembled PDU]
103   0.020110 172.31.29.138 -> 54.230.158.217 TCP 66 42001 > http [ACK] Seq=98 Ack=593681 Win=1077120 Len=0 TSval=10521978 TSecr=810448398
104   0.020129 54.230.158.217 -> 172.31.29.138 TCP 5858 [TCP segment of a reassembled PDU]
105   0.020133 172.31.29.138 -> 54.230.158.217 TCP 66 42001 > http [ACK] Seq=98 Ack=599473 Win=1110400 Len=0 TSval=10521978 TSecr=810448398
106   0.020165 54.230.158.217 -> 172.31.29.138 TCP 5858 [TCP segment of a reassembled PDU]
107   0.020183 172.31.29.138 -> 54.230.158.217 TCP 66 42001 > http [ACK] Seq=98 Ack=605265 Win=1131392 Len=0 TSval=10521978 TSecr=810448398
108   0.020701 54.230.158.217 -> 172.31.29.138 TCP 4410 [TCP segment of a reassembled PDU]
109   0.020721 172.31.29.138 -> 54.230.158.217 TCP 66 42001 > http [ACK] Seq=98 Ack=609609 Win=1140096 Len=0 TSval=10521978 TSecr=810448398
110   0.020880 54.230.158.217 -> 172.31.29.138 TCP 26130 [TCP segment of a reassembled PDU]
111   0.020893 172.31.29.138 -> 54.230.158.217 TCP 66 42001 > http [ACK] Seq=98 Ack=635673 Win=1114112 Len=0 TSval=10521978 TSecr=810448398
112   0.020903 54.230.158.217 -> 172.31.29.138 TCP 5858 [TCP segment of a reassembled PDU]
113   0.020907 172.31.29.138 -> 54.230.158.217 TCP 66 42001 > http [ACK] Seq=98 Ack=641465 Win=1108352 Len=0 TSval=10521978 TSecr=810448398
114   0.021068 54.230.158.217 -> 172.31.29.138 TCP 34818 [TCP segment of a reassembled PDU]
115   0.021108 172.31.29.138 -> 54.230.158.217 TCP 66 42001 > http [ACK] Seq=98 Ack=676217 Win=1096192 Len=0 TSval=10521978 TSecr=810448398
116   0.021471 54.230.158.217 -> 172.31.29.138 TCP 8754 [TCP segment of a reassembled PDU]
117   0.021480 172.31.29.138 -> 54.230.158.217 TCP 66 42001 > http [ACK] Seq=98 Ack=684905 Win=1139072 Len=0 TSval=10521978 TSecr=810448398
118   0.021623 54.230.158.217 -> 172.31.29.138 TCP 18890 [TCP segment of a reassembled PDU]
119   0.021657 54.230.158.217 -> 172.31.29.138 TCP 2962 [TCP segment of a reassembled PDU]
120   0.021666 172.31.29.138 -> 54.230.158.217 TCP 66 42001 > http [ACK] Seq=98 Ack=706625 Win=1117440 Len=0 TSval=10521978 TSecr=810448398
121   0.021881 54.230.158.217 -> 172.31.29.138 TCP 26130 [TCP segment of a reassembled PDU]
122   0.021908 172.31.29.138 -> 54.230.158.217 TCP 66 42001 > http [ACK] Seq=98 Ack=732689 Win=1110528 Len=0 TSval=10521978 TSecr=810448398
123   0.021934 54.230.158.217 -> 172.31.29.138 TCP 30474 [TCP segment of a reassembled PDU]
124   0.021958 172.31.29.138 -> 54.230.158.217 TCP 66 42001 > http [ACK] Seq=98 Ack=763097 Win=1103232 Len=0 TSval=10521978 TSecr=810448398
125   0.021966 54.230.158.217 -> 172.31.29.138 TCP 1514 [TCP Previous segment not captured] [TCP segment of a reassembled PDU]
126   0.021968 54.230.158.217 -> 172.31.29.138 TCP 1514 [TCP Out-Of-Order] [TCP segment of a reassembled PDU]
127   0.021971 172.31.29.138 -> 54.230.158.217 TCP 78 [TCP Dup ACK 124#1] 42001 > http [ACK] Seq=98 Ack=763097 Win=1103232 Len=0 TSval=10521978 TSecr=810448398 SLE=764545 SRE=765993
128   0.021978 172.31.29.138 -> 54.230.158.217 TCP 66 42001 > http [ACK] Seq=98 Ack=765993 Win=1100416 Len=0 TSval=10521978 TSecr=810448398
129   0.022018 54.230.158.217 -> 172.31.29.138 TCP 5858 [TCP segment of a reassembled PDU]
130   0.022024 172.31.29.138 -> 54.230.158.217 TCP 66 42001 > http [ACK] Seq=98 Ack=771785 Win=1143808 Len=0 TSval=10521978 TSecr=810448398
131   0.022489 54.230.158.217 -> 172.31.29.138 TCP 1514 [TCP segment of a reassembled PDU]
132   0.022494 172.31.29.138 -> 54.230.158.217 TCP 66 42001 > http [ACK] Seq=98 Ack=773233 Win=1149440 Len=0 TSval=10521978 TSecr=810448398
133   0.022678 54.230.158.217 -> 172.31.29.138 TCP 26130 [TCP segment of a reassembled PDU]
134   0.022691 172.31.29.138 -> 54.230.158.217 TCP 66 42001 > http [ACK] Seq=98 Ack=799297 Win=1123456 Len=0 TSval=10521978 TSecr=810448398
135   0.022728 54.230.158.217 -> 172.31.29.138 TCP 26130 [TCP segment of a reassembled PDU]
136   0.022743 172.31.29.138 -> 54.230.158.217 TCP 66 42001 > http [ACK] Seq=98 Ack=825361 Win=1097472 Len=0 TSval=10521978 TSecr=810448398
137   0.022793 54.230.158.217 -> 172.31.29.138 TCP 15994 [TCP segment of a reassembled PDU]
138   0.022802 172.31.29.138 -> 54.230.158.217 TCP 66 42001 > http [ACK] Seq=98 Ack=841289 Win=1127040 Len=0 TSval=10521978 TSecr=810448398
139   0.023271 54.230.158.217 -> 172.31.29.138 TCP 2962 [TCP segment of a reassembled PDU]
140   0.023276 172.31.29.138 -> 54.230.158.217 TCP 66 42001 > http [ACK] Seq=98 Ack=844185 Win=1148544 Len=0 TSval=10521978 TSecr=810448398
141   0.023458 54.230.158.217 -> 172.31.29.138 TCP 26130 [TCP segment of a reassembled PDU]
142   0.023471 172.31.29.138 -> 54.230.158.217 TCP 66 42001 > http [ACK] Seq=98 Ack=870249 Win=1122560 Len=0 TSval=10521978 TSecr=810448398
143   0.023492 54.230.158.217 -> 172.31.29.138 TCP 17442 [TCP segment of a reassembled PDU]
144   0.023501 172.31.29.138 -> 54.230.158.217 TCP 66 42001 > http [ACK] Seq=98 Ack=887625 Win=1105280 Len=0 TSval=10521978 TSecr=810448398
145   0.023550 54.230.158.217 -> 172.31.29.138 TCP 14546 [TCP segment of a reassembled PDU]
146   0.023559 172.31.29.138 -> 54.230.158.217 TCP 66 42001 > http [ACK] Seq=98 Ack=902105 Win=1129472 Len=0 TSval=10521978 TSecr=810448398
147   0.023764 54.230.158.217 -> 172.31.29.138 TCP 4410 [TCP segment of a reassembled PDU]
148   0.023770 172.31.29.138 -> 54.230.158.217 TCP 66 42001 > http [ACK] Seq=98 Ack=906449 Win=1146112 Len=0 TSval=10521979 TSecr=810448398
149   0.023931 54.230.158.217 -> 172.31.29.138 TCP 24682 [TCP segment of a reassembled PDU]
150   0.023944 172.31.29.138 -> 54.230.158.217 TCP 66 42001 > http [ACK] Seq=98 Ack=931065 Win=1198720 Len=0 TSval=10521979 TSecr=810448398
151   0.024021 54.230.158.217 -> 172.31.29.138 TCP 2962 [TCP segment of a reassembled PDU]
152   0.024026 172.31.29.138 -> 54.230.158.217 TCP 66 42001 > http [ACK] Seq=98 Ack=933961 Win=1204480 Len=0 TSval=10521979 TSecr=810448398
153   0.024198 54.230.158.217 -> 172.31.29.138 TCP 26130 [TCP segment of a reassembled PDU]
154   0.024211 172.31.29.138 -> 54.230.158.217 TCP 66 42001 > http [ACK] Seq=98 Ack=960025 Win=1256576 Len=0 TSval=10521979 TSecr=810448398
155   0.024221 54.230.158.217 -> 172.31.29.138 TCP 7306 [TCP segment of a reassembled PDU]
156   0.024226 172.31.29.138 -> 54.230.158.217 TCP 66 42001 > http [ACK] Seq=98 Ack=967265 Win=1271040 Len=0 TSval=10521979 TSecr=810448398
157   0.024295 54.230.158.217 -> 172.31.29.138 TCP 2962 [TCP segment of a reassembled PDU]
158   0.024300 172.31.29.138 -> 54.230.158.217 TCP 66 42001 > http [ACK] Seq=98 Ack=970161 Win=1276800 Len=0 TSval=10521979 TSecr=810448398
159   0.024467 54.230.158.217 -> 172.31.29.138 TCP 26130 [TCP segment of a reassembled PDU]
160   0.024480 172.31.29.138 -> 54.230.158.217 TCP 66 42001 > http [ACK] Seq=98 Ack=996225 Win=1329024 Len=0 TSval=10521979 TSecr=810448398
161   0.024502 54.230.158.217 -> 172.31.29.138 TCP 2962 [TCP segment of a reassembled PDU]
162   0.024507 172.31.29.138 -> 54.230.158.217 TCP 66 42001 > http [ACK] Seq=98 Ack=999121 Win=1334784 Len=0 TSval=10521979 TSecr=810448398
163   0.024790 54.230.158.217 -> 172.31.29.138 TCP 4410 [TCP segment of a reassembled PDU]
164   0.024796 172.31.29.138 -> 54.230.158.217 TCP 66 42001 > http [ACK] Seq=98 Ack=1003465 Win=1343488 Len=0 TSval=10521979 TSecr=810448398
165   0.024969 54.230.158.217 -> 172.31.29.138 TCP 26130 [TCP segment of a reassembled PDU]
166   0.024997 172.31.29.138 -> 54.230.158.217 TCP 66 42001 > http [ACK] Seq=98 Ack=1029529 Win=1395584 Len=0 TSval=10521979 TSecr=810448398
167   0.025009 54.230.158.217 -> 172.31.29.138 TCP 10202 [TCP segment of a reassembled PDU]
168   0.025018 172.31.29.138 -> 54.230.158.217 TCP 66 42001 > http [ACK] Seq=98 Ack=1039665 Win=1415808 Len=0 TSval=10521979 TSecr=810448398
169   0.025034 54.230.158.217 -> 172.31.29.138 TCP 15994 [TCP segment of a reassembled PDU]
170   0.025042 172.31.29.138 -> 54.230.158.217 TCP 66 42001 > http [ACK] Seq=98 Ack=1055593 Win=1447680 Len=0 TSval=10521979 TSecr=810448398
171   0.025055 54.230.158.217 -> 172.31.29.138 TCP 2962 [TCP segment of a reassembled PDU]
172   0.025058 172.31.29.138 -> 54.230.158.217 TCP 66 42001 > http [ACK] Seq=98 Ack=1058489 Win=1453568 Len=0 TSval=10521979 TSecr=810448398
173   0.025134 54.230.158.217 -> 172.31.29.138 TCP 17442 [TCP segment of a reassembled PDU]
174   0.025145 172.31.29.138 -> 54.230.158.217 TCP 66 42001 > http [ACK] Seq=98 Ack=1075865 Win=1488256 Len=0 TSval=10521979 TSecr=810448398
175   0.025354 54.230.158.217 -> 172.31.29.138 TCP 17442 [TCP segment of a reassembled PDU]
176   0.025365 172.31.29.138 -> 54.230.158.217 TCP 66 42001 > http [ACK] Seq=98 Ack=1093241 Win=1523072 Len=0 TSval=10521979 TSecr=810448398
177   0.025459 54.230.158.217 -> 172.31.29.138 TCP 4410 [TCP segment of a reassembled PDU]
178   0.025465 172.31.29.138 -> 54.230.158.217 TCP 66 42001 > http [ACK] Seq=98 Ack=1097585 Win=1531648 Len=0 TSval=10521979 TSecr=810448398
179   0.025600 54.230.158.217 -> 172.31.29.138 TCP 11650 [TCP segment of a reassembled PDU]
180   0.025608 172.31.29.138 -> 54.230.158.217 TCP 66 42001 > http [ACK] Seq=98 Ack=1109169 Win=1554816 Len=0 TSval=10521979 TSecr=810448398
181   0.025752 54.230.158.217 -> 172.31.29.138 TCP 26130 [TCP segment of a reassembled PDU]
182   0.025773 172.31.29.138 -> 54.230.158.217 TCP 66 42001 > http [ACK] Seq=98 Ack=1135233 Win=1607040 Len=0 TSval=10521979 TSecr=810448398
183   0.025825 54.230.158.217 -> 172.31.29.138 TCP 27578 [TCP segment of a reassembled PDU]
184   0.025838 172.31.29.138 -> 54.230.158.217 TCP 66 42001 > http [ACK] Seq=98 Ack=1162745 Win=1607040 Len=0 TSval=10521979 TSecr=810448398
185   0.026124 54.230.158.217 -> 172.31.29.138 TCP 8754 [TCP segment of a reassembled PDU]
186   0.026132 172.31.29.138 -> 54.230.158.217 TCP 66 42001 > http [ACK] Seq=98 Ack=1171433 Win=1607040 Len=0 TSval=10521979 TSecr=810448398
187   0.026287 54.230.158.217 -> 172.31.29.138 TCP 26130 [TCP segment of a reassembled PDU]
188   0.026300 172.31.29.138 -> 54.230.158.217 TCP 66 42001 > http [ACK] Seq=98 Ack=1197497 Win=1607040 Len=0 TSval=10521979 TSecr=810448398
189   0.026310 54.230.158.217 -> 172.31.29.138 TCP 8754 [TCP segment of a reassembled PDU]
190   0.026315 172.31.29.138 -> 54.230.158.217 TCP 66 42001 > http [ACK] Seq=98 Ack=1206185 Win=1607040 Len=0 TSval=10521979 TSecr=810448398
191   0.026373 54.230.158.217 -> 172.31.29.138 TCP 2962 [TCP segment of a reassembled PDU]
192   0.026378 172.31.29.138 -> 54.230.158.217 TCP 66 42001 > http [ACK] Seq=98 Ack=1209081 Win=1607040 Len=0 TSval=10521979 TSecr=810448398
193   0.026654 54.230.158.217 -> 172.31.29.138 TCP 18890 [TCP segment of a reassembled PDU]
194   0.026665 172.31.29.138 -> 54.230.158.217 TCP 66 42001 > http [ACK] Seq=98 Ack=1227905 Win=1607040 Len=0 TSval=10521979 TSecr=810448398
195   0.026732 54.230.158.217 -> 172.31.29.138 TCP 26130 [TCP segment of a reassembled PDU]
196   0.026744 172.31.29.138 -> 54.230.158.217 TCP 66 42001 > http [ACK] Seq=98 Ack=1253969 Win=1607040 Len=0 TSval=10521979 TSecr=810448398
197   0.026784 54.230.158.217 -> 172.31.29.138 TCP 17442 [TCP segment of a reassembled PDU]
198   0.026793 172.31.29.138 -> 54.230.158.217 TCP 66 42001 > http [ACK] Seq=98 Ack=1271345 Win=1607040 Len=0 TSval=10521979 TSecr=810448398
199   0.026815 54.230.158.217 -> 172.31.29.138 TCP 8754 [TCP segment of a reassembled PDU]
200   0.026821 172.31.29.138 -> 54.230.158.217 TCP 66 42001 > http [ACK] Seq=98 Ack=1280033 Win=1607040 Len=0 TSval=10521979 TSecr=810448398
201   0.026861 54.230.158.217 -> 172.31.29.138 TCP 13098 [TCP segment of a reassembled PDU]
202   0.026870 172.31.29.138 -> 54.230.158.217 TCP 66 42001 > http [ACK] Seq=98 Ack=1293065 Win=1607040 Len=0 TSval=10521979 TSecr=810448398
203   0.027351 54.230.158.217 -> 172.31.29.138 TCP 2962 [TCP segment of a reassembled PDU]
204   0.027357 172.31.29.138 -> 54.230.158.217 TCP 66 42001 > http [ACK] Seq=98 Ack=1295961 Win=1607040 Len=0 TSval=10521979 TSecr=810448399
205   0.027512 54.230.158.217 -> 172.31.29.138 TCP 15994 [TCP segment of a reassembled PDU]
206   0.027522 172.31.29.138 -> 54.230.158.217 TCP 66 42001 > http [ACK] Seq=98 Ack=1311889 Win=1607040 Len=0 TSval=10521979 TSecr=810448399
207   0.027529 54.230.158.217 -> 172.31.29.138 TCP 1514 [TCP Previous segment not captured] [TCP segment of a reassembled PDU]
208   0.027534 172.31.29.138 -> 54.230.158.217 TCP 78 [TCP Dup ACK 206#1] 42001 > http [ACK] Seq=98 Ack=1311889 Win=1607040 Len=0 TSval=10521979 TSecr=810448399 SLE=1313337 SRE=1314785
209   0.027539 54.230.158.217 -> 172.31.29.138 TCP 1514 [TCP Out-Of-Order] [TCP segment of a reassembled PDU]
210   0.027542 172.31.29.138 -> 54.230.158.217 TCP 66 42001 > http [ACK] Seq=98 Ack=1314785 Win=1607040 Len=0 TSval=10521979 TSecr=810448399
211   0.027666 54.230.158.217 -> 172.31.29.138 TCP 18890 [TCP segment of a reassembled PDU]
212   0.027677 172.31.29.138 -> 54.230.158.217 TCP 66 42001 > http [ACK] Seq=98 Ack=1333609 Win=1607040 Len=0 TSval=10521979 TSecr=810448399
213   0.027742 54.230.158.217 -> 172.31.29.138 TCP 7306 [TCP segment of a reassembled PDU]
214   0.027750 172.31.29.138 -> 54.230.158.217 TCP 66 42001 > http [ACK] Seq=98 Ack=1340849 Win=1607040 Len=0 TSval=10521980 TSecr=810448399
215   0.027784 54.230.158.217 -> 172.31.29.138 TCP 26130 [TCP segment of a reassembled PDU]
216   0.027797 172.31.29.138 -> 54.230.158.217 TCP 66 42001 > http [ACK] Seq=98 Ack=1366913 Win=1607040 Len=0 TSval=10521980 TSecr=810448399
217   0.027868 54.230.158.217 -> 172.31.29.138 TCP 29026 [TCP segment of a reassembled PDU]
218   0.027881 172.31.29.138 -> 54.230.158.217 TCP 66 42001 > http [ACK] Seq=98 Ack=1395873 Win=1607040 Len=0 TSval=10521980 TSecr=810448399
219   0.027929 54.230.158.217 -> 172.31.29.138 TCP 23234 [TCP segment of a reassembled PDU]
220   0.027940 172.31.29.138 -> 54.230.158.217 TCP 66 42001 > http [ACK] Seq=98 Ack=1419041 Win=1607040 Len=0 TSval=10521980 TSecr=810448399
221   0.027948 54.230.158.217 -> 172.31.29.138 TCP 4410 [TCP segment of a reassembled PDU]
222   0.027951 172.31.29.138 -> 54.230.158.217 TCP 66 42001 > http [ACK] Seq=98 Ack=1423385 Win=1607040 Len=0 TSval=10521980 TSecr=810448399
223   0.028213 54.230.158.217 -> 172.31.29.138 TCP 4410 [TCP segment of a reassembled PDU]
224   0.028219 172.31.29.138 -> 54.230.158.217 TCP 66 42001 > http [ACK] Seq=98 Ack=1427729 Win=1607040 Len=0 TSval=10521980 TSecr=810448399
225   0.028493 54.230.158.217 -> 172.31.29.138 TCP 17442 [TCP segment of a reassembled PDU]
226   0.028503 172.31.29.138 -> 54.230.158.217 TCP 66 42001 > http [ACK] Seq=98 Ack=1445105 Win=1607040 Len=0 TSval=10521980 TSecr=810448399
227   0.028643 54.230.158.217 -> 172.31.29.138 TCP 26130 [TCP segment of a reassembled PDU]
228   0.028656 172.31.29.138 -> 54.230.158.217 TCP 66 42001 > http [ACK] Seq=98 Ack=1471169 Win=1607040 Len=0 TSval=10521980 TSecr=810448399
229   0.028675 54.230.158.217 -> 172.31.29.138 TCP 17442 [TCP segment of a reassembled PDU]
230   0.028683 172.31.29.138 -> 54.230.158.217 TCP 66 42001 > http [ACK] Seq=98 Ack=1488545 Win=1607040 Len=0 TSval=10521980 TSecr=810448399
231   0.028770 54.230.158.217 -> 172.31.29.138 TCP 18890 [TCP segment of a reassembled PDU]
232   0.028780 172.31.29.138 -> 54.230.158.217 TCP 66 42001 > http [ACK] Seq=98 Ack=1507369 Win=1607040 Len=0 TSval=10521980 TSecr=810448399
233   0.028812 54.230.158.217 -> 172.31.29.138 TCP 7306 [TCP segment of a reassembled PDU]
234   0.028817 172.31.29.138 -> 54.230.158.217 TCP 66 42001 > http [ACK] Seq=98 Ack=1514609 Win=1607040 Len=0 TSval=10521980 TSecr=810448399
235   0.028888 54.230.158.217 -> 172.31.29.138 TCP 27578 [TCP segment of a reassembled PDU]
236   0.028900 172.31.29.138 -> 54.230.158.217 TCP 66 42001 > http [ACK] Seq=98 Ack=1542121 Win=1607040 Len=0 TSval=10521980 TSecr=810448399
237   0.028983 54.230.158.217 -> 172.31.29.138 TCP 11650 [TCP segment of a reassembled PDU]
238   0.028994 172.31.29.138 -> 54.230.158.217 TCP 66 42001 > http [ACK] Seq=98 Ack=1553705 Win=1607040 Len=0 TSval=10521980 TSecr=810448399
239   0.029252 54.230.158.217 -> 172.31.29.138 TCP 20338 [TCP segment of a reassembled PDU]
240   0.029263 172.31.29.138 -> 54.230.158.217 TCP 66 42001 > http [ACK] Seq=98 Ack=1573977 Win=1607040 Len=0 TSval=10521980 TSecr=810448399
241   0.029424 54.230.158.217 -> 172.31.29.138 TCP 26130 [TCP segment of a reassembled PDU]
242   0.029438 172.31.29.138 -> 54.230.158.217 TCP 66 42001 > http [ACK] Seq=98 Ack=1600041 Win=1607040 Len=0 TSval=10521980 TSecr=810448399
243   0.029452 54.230.158.217 -> 172.31.29.138 TCP 15994 [TCP segment of a reassembled PDU]
244   0.029459 172.31.29.138 -> 54.230.158.217 TCP 66 42001 > http [ACK] Seq=98 Ack=1615969 Win=1607040 Len=0 TSval=10521980 TSecr=810448399
245   0.029487 54.230.158.217 -> 172.31.29.138 TCP 2962 [TCP segment of a reassembled PDU]
246   0.029491 172.31.29.138 -> 54.230.158.217 TCP 66 42001 > http [ACK] Seq=98 Ack=1618865 Win=1607040 Len=0 TSval=10521980 TSecr=810448399
247   0.029580 54.230.158.217 -> 172.31.29.138 TCP 19358 [TCP segment of a reassembled PDU]
248   0.029588 172.31.29.138 -> 54.230.158.217 TCP 66 42001 > http [ACK] Seq=98 Ack=1638157 Win=1607040 Len=0 TSval=10521980 TSecr=810448399
249   0.029789 54.230.158.217 -> 172.31.29.138 TCP 23234 [TCP segment of a reassembled PDU]
250   0.029802 172.31.29.138 -> 54.230.158.217 TCP 66 42001 > http [ACK] Seq=98 Ack=1661325 Win=1607040 Len=0 TSval=10521980 TSecr=810448399
251   0.029901 54.230.158.217 -> 172.31.29.138 TCP 27578 [TCP segment of a reassembled PDU]
252   0.029914 172.31.29.138 -> 54.230.158.217 TCP 66 42001 > http [ACK] Seq=98 Ack=1688837 Win=1607040 Len=0 TSval=10521980 TSecr=810448399
253   0.030239 54.230.158.217 -> 172.31.29.138 TCP 15994 [TCP segment of a reassembled PDU]
254   0.030249 172.31.29.138 -> 54.230.158.217 TCP 66 42001 > http [ACK] Seq=98 Ack=1704765 Win=1607040 Len=0 TSval=10521980 TSecr=810448399
255   0.030379 54.230.158.217 -> 172.31.29.138 TCP 18890 [TCP segment of a reassembled PDU]
256   0.030389 172.31.29.138 -> 54.230.158.217 TCP 66 42001 > http [ACK] Seq=98 Ack=1723589 Win=1607040 Len=0 TSval=10521980 TSecr=810448399
257   0.030420 54.230.158.217 -> 172.31.29.138 TCP 7306 [TCP segment of a reassembled PDU]
258   0.030425 172.31.29.138 -> 54.230.158.217 TCP 66 42001 > http [ACK] Seq=98 Ack=1730829 Win=1607040 Len=0 TSval=10521980 TSecr=810448399
259   0.030489 54.230.158.217 -> 172.31.29.138 TCP 23234 [TCP segment of a reassembled PDU]
260   0.030500 172.31.29.138 -> 54.230.158.217 TCP 66 42001 > http [ACK] Seq=98 Ack=1753997 Win=1607040 Len=0 TSval=10521980 TSecr=810448399
261   0.030556 54.230.158.217 -> 172.31.29.138 TCP 26130 [TCP segment of a reassembled PDU]
262   0.030568 172.31.29.138 -> 54.230.158.217 TCP 66 42001 > http [ACK] Seq=98 Ack=1780061 Win=1607040 Len=0 TSval=10521980 TSecr=810448399
263   0.030616 54.230.158.217 -> 172.31.29.138 TCP 26130 [TCP segment of a reassembled PDU]
264   0.030628 172.31.29.138 -> 54.230.158.217 TCP 66 42001 > http [ACK] Seq=98 Ack=1806125 Win=1607040 Len=0 TSval=10521980 TSecr=810448399
265   0.030654 54.230.158.217 -> 172.31.29.138 TCP 13098 [TCP segment of a reassembled PDU]
266   0.030662 172.31.29.138 -> 54.230.158.217 TCP 66 42001 > http [ACK] Seq=98 Ack=1819157 Win=1607040 Len=0 TSval=10521980 TSecr=810448399
267   0.031020 54.230.158.217 -> 172.31.29.138 TCP 10202 [TCP segment of a reassembled PDU]
268   0.031029 172.31.29.138 -> 54.230.158.217 TCP 66 42001 > http [ACK] Seq=98 Ack=1829293 Win=1607040 Len=0 TSval=10521980 TSecr=810448399
269   0.031180 54.230.158.217 -> 172.31.29.138 TCP 26130 [TCP segment of a reassembled PDU]
270   0.031203 172.31.29.138 -> 54.230.158.217 TCP 66 42001 > http [ACK] Seq=98 Ack=1855357 Win=1607040 Len=0 TSval=10521980 TSecr=810448399
271   0.031246 54.230.158.217 -> 172.31.29.138 TCP 26130 [TCP segment of a reassembled PDU]
272   0.031258 172.31.29.138 -> 54.230.158.217 TCP 66 42001 > http [ACK] Seq=98 Ack=1881421 Win=1607040 Len=0 TSval=10521980 TSecr=810448399
273   0.031307 54.230.158.217 -> 172.31.29.138 TCP 26130 [TCP segment of a reassembled PDU]
274   0.031320 172.31.29.138 -> 54.230.158.217 TCP 66 42001 > http [ACK] Seq=98 Ack=1907485 Win=1607040 Len=0 TSval=10521980 TSecr=810448399
275   0.031389 54.230.158.217 -> 172.31.29.138 TCP 36266 [TCP segment of a reassembled PDU]
276   0.031398 172.31.29.138 -> 54.230.158.217 TCP 66 42001 > http [ACK] Seq=98 Ack=1943685 Win=1607040 Len=0 TSval=10521980 TSecr=810448399
277   0.031419 54.230.158.217 -> 172.31.29.138 TCP 5858 [TCP segment of a reassembled PDU]
278   0.031422 172.31.29.138 -> 54.230.158.217 TCP 66 42001 > http [ACK] Seq=98 Ack=1949477 Win=1607040 Len=0 TSval=10521980 TSecr=810448399
279   0.031840 54.230.158.217 -> 172.31.29.138 TCP 5858 [TCP segment of a reassembled PDU]
280   0.031845 172.31.29.138 -> 54.230.158.217 TCP 66 42001 > http [ACK] Seq=98 Ack=1955269 Win=1607040 Len=0 TSval=10521981 TSecr=810448399
281   0.032017 54.230.158.217 -> 172.31.29.138 TCP 26130 [TCP segment of a reassembled PDU]
282   0.032024 172.31.29.138 -> 54.230.158.217 TCP 66 42001 > http [ACK] Seq=98 Ack=1981333 Win=1607040 Len=0 TSval=10521981 TSecr=810448399
283   0.032066 54.230.158.217 -> 172.31.29.138 TCP 24682 [TCP segment of a reassembled PDU]
284   0.032072 172.31.29.138 -> 54.230.158.217 TCP 66 42001 > http [ACK] Seq=98 Ack=2005949 Win=1607040 Len=0 TSval=10521981 TSecr=810448399
285   0.032113 54.230.158.217 -> 172.31.29.138 TCP 1514 [TCP segment of a reassembled PDU]
286   0.032164 54.230.158.217 -> 172.31.29.138 TCP 26130 [TCP segment of a reassembled PDU]
287   0.032171 172.31.29.138 -> 54.230.158.217 TCP 66 42001 > http [ACK] Seq=98 Ack=2033461 Win=1607040 Len=0 TSval=10521981 TSecr=810448399
288   0.032198 54.230.158.217 -> 172.31.29.138 TCP 26130 [TCP segment of a reassembled PDU]
289   0.032203 172.31.29.138 -> 54.230.158.217 TCP 66 42001 > http [ACK] Seq=98 Ack=2059525 Win=1607040 Len=0 TSval=10521981 TSecr=810448399
290   0.032212 54.230.158.217 -> 172.31.29.138 TCP 8754 [TCP segment of a reassembled PDU]
291   0.032215 172.31.29.138 -> 54.230.158.217 TCP 66 42001 > http [ACK] Seq=98 Ack=2068213 Win=1607040 Len=0 TSval=10521981 TSecr=810448399
292   0.032241 54.230.158.217 -> 172.31.29.138 TCP 11650 [TCP segment of a reassembled PDU]
293   0.032245 172.31.29.138 -> 54.230.158.217 TCP 66 42001 > http [ACK] Seq=98 Ack=2079797 Win=1607040 Len=0 TSval=10521981 TSecr=810448399
294   0.032335 54.230.158.217 -> 172.31.29.138 TCP 2962 [TCP segment of a reassembled PDU]
295   0.032339 172.31.29.138 -> 54.230.158.217 TCP 66 42001 > http [ACK] Seq=98 Ack=2082693 Win=1607040 Len=0 TSval=10521981 TSecr=810448399
296   0.032523 54.230.158.217 -> 172.31.29.138 TCP 26130 [TCP segment of a reassembled PDU]
297   0.032530 172.31.29.138 -> 54.230.158.217 TCP 66 42001 > http [ACK] Seq=98 Ack=2108757 Win=1607040 Len=0 TSval=10521981 TSecr=810448399
298   0.032539 54.230.158.217 -> 172.31.29.138 TCP 5858 [TCP segment of a reassembled PDU]
299   0.032541 172.31.29.138 -> 54.230.158.217 TCP 66 42001 > http [ACK] Seq=98 Ack=2114549 Win=1607040 Len=0 TSval=10521981 TSecr=810448399
300   0.032890 54.230.158.217 -> 172.31.29.138 TCP 5858 [TCP segment of a reassembled PDU]
301   0.032895 172.31.29.138 -> 54.230.158.217 TCP 66 42001 > http [ACK] Seq=98 Ack=2120341 Win=1607040 Len=0 TSval=10521981 TSecr=810448399
302   0.033073 54.230.158.217 -> 172.31.29.138 TCP 26130 [TCP segment of a reassembled PDU]
303   0.033080 172.31.29.138 -> 54.230.158.217 TCP 66 42001 > http [ACK] Seq=98 Ack=2146405 Win=1607040 Len=0 TSval=10521981 TSecr=810448399
304   0.033093 54.230.158.217 -> 172.31.29.138 TCP 16106 [TCP segment of a reassembled PDU]
305   0.033099 172.31.29.138 -> 54.230.158.217 TCP 66 42001 > http [ACK] Seq=98 Ack=2162445 Win=1607040 Len=0 TSval=10521981 TSecr=810448399
306   0.033137 54.230.158.217 -> 172.31.29.138 TCP 2962 [TCP segment of a reassembled PDU]
307   0.033143 172.31.29.138 -> 54.230.158.217 TCP 66 42001 > http [ACK] Seq=98 Ack=2165341 Win=1607040 Len=0 TSval=10521981 TSecr=810448399
308   0.033209 54.230.158.217 -> 172.31.29.138 TCP 26130 [TCP segment of a reassembled PDU]
309   0.033215 172.31.29.138 -> 54.230.158.217 TCP 66 42001 > http [ACK] Seq=98 Ack=2191405 Win=1607040 Len=0 TSval=10521981 TSecr=810448399
310   0.033234 54.230.158.217 -> 172.31.29.138 TCP 6002 [TCP segment of a reassembled PDU]
311   0.033237 172.31.29.138 -> 54.230.158.217 TCP 66 42001 > http [ACK] Seq=98 Ack=2197341 Win=1607040 Len=0 TSval=10521981 TSecr=810448399
312   0.033308 54.230.158.217 -> 172.31.29.138 TCP 26130 [TCP segment of a reassembled PDU]
313   0.033315 172.31.29.138 -> 54.230.158.217 TCP 66 42001 > http [ACK] Seq=98 Ack=2223405 Win=1607040 Len=0 TSval=10521981 TSecr=810448399
314   0.033360 54.230.158.217 -> 172.31.29.138 TCP 4642 [TCP segment of a reassembled PDU]
315   0.033364 172.31.29.138 -> 54.230.158.217 TCP 66 42001 > http [ACK] Seq=98 Ack=2227981 Win=1607040 Len=0 TSval=10521981 TSecr=810448399
316   0.033743 54.230.158.217 -> 172.31.29.138 TCP 2962 [TCP segment of a reassembled PDU]
317   0.033748 172.31.29.138 -> 54.230.158.217 TCP 66 42001 > http [ACK] Seq=98 Ack=2230877 Win=1607040 Len=0 TSval=10521981 TSecr=810448399
318   0.033777 54.230.158.217 -> 172.31.29.138 TCP 5858 [TCP segment of a reassembled PDU]
319   0.033780 172.31.29.138 -> 54.230.158.217 TCP 66 42001 > http [ACK] Seq=98 Ack=2236669 Win=1607040 Len=0 TSval=10521981 TSecr=810448399
320   0.033944 54.230.158.217 -> 172.31.29.138 TCP 26130 [TCP segment of a reassembled PDU]
321   0.033952 172.31.29.138 -> 54.230.158.217 TCP 66 42001 > http [ACK] Seq=98 Ack=2262733 Win=1607040 Len=0 TSval=10521981 TSecr=810448399
322   0.033962 54.230.158.217 -> 172.31.29.138 TCP 10202 [TCP segment of a reassembled PDU]
323   0.033965 172.31.29.138 -> 54.230.158.217 TCP 66 42001 > http [ACK] Seq=98 Ack=2272869 Win=1607040 Len=0 TSval=10521981 TSecr=810448399
324   0.034064 54.230.158.217 -> 172.31.29.138 TCP 20714 [TCP segment of a reassembled PDU]
325   0.034071 172.31.29.138 -> 54.230.158.217 TCP 66 42001 > http [ACK] Seq=98 Ack=2293517 Win=1607040 Len=0 TSval=10521981 TSecr=810448399
326   0.034780 54.230.158.217 -> 172.31.29.138 TCP 2962 [TCP segment of a reassembled PDU]
327   0.034785 172.31.29.138 -> 54.230.158.217 TCP 66 42001 > http [ACK] Seq=98 Ack=2296413 Win=1607040 Len=0 TSval=10521981 TSecr=810448399
328   0.034956 54.230.158.217 -> 172.31.29.138 TCP 26130 [TCP segment of a reassembled PDU]
329   0.034963 172.31.29.138 -> 54.230.158.217 TCP 66 42001 > http [ACK] Seq=98 Ack=2322477 Win=1607040 Len=0 TSval=10521981 TSecr=810448399
330   0.034977 54.230.158.217 -> 172.31.29.138 TCP 11650 [TCP segment of a reassembled PDU]
331   0.034980 172.31.29.138 -> 54.230.158.217 TCP 66 42001 > http [ACK] Seq=98 Ack=2334061 Win=1607040 Len=0 TSval=10521981 TSecr=810448399
332   0.035051 54.230.158.217 -> 172.31.29.138 TCP 25058 [TCP segment of a reassembled PDU]
333   0.035057 172.31.29.138 -> 54.230.158.217 TCP 66 42001 > http [ACK] Seq=98 Ack=2359053 Win=1607040 Len=0 TSval=10521981 TSecr=810448399
334   0.036060 54.230.158.217 -> 172.31.29.138 TCP 5858 [TCP segment of a reassembled PDU]
335   0.036065 172.31.29.138 -> 54.230.158.217 TCP 66 42001 > http [ACK] Seq=98 Ack=2364845 Win=1607040 Len=0 TSval=10521982 TSecr=810448399
336   0.036215 54.230.158.217 -> 172.31.29.138 TCP 18890 [TCP segment of a reassembled PDU]
337   0.036221 172.31.29.138 -> 54.230.158.217 TCP 66 42001 > http [ACK] Seq=98 Ack=2383669 Win=1607040 Len=0 TSval=10521982 TSecr=810448399
338   0.036257 54.230.158.217 -> 172.31.29.138 TCP 7306 [TCP segment of a reassembled PDU]
339   0.036260 172.31.29.138 -> 54.230.158.217 TCP 66 42001 > http [ACK] Seq=98 Ack=2390909 Win=1607040 Len=0 TSval=10521982 TSecr=810448399
340   0.036360 54.230.158.217 -> 172.31.29.138 TCP 27578 [TCP segment of a reassembled PDU]
341   0.036367 172.31.29.138 -> 54.230.158.217 TCP 66 42001 > http [ACK] Seq=98 Ack=2418421 Win=1607040 Len=0 TSval=10521982 TSecr=810448399
342   0.036375 54.230.158.217 -> 172.31.29.138 TCP 6234 [TCP segment of a reassembled PDU]
