[Measurement for 1kb at 06:31:48 20.31.2014] 
Tshark:

  1   0.000000 172.31.36.109 -> 172.31.0.2   DNS 89 Standard query 0x7b51  A d1dx94olpiqj0t.cloudfront.net
  2   0.000030 172.31.36.109 -> 172.31.0.2   DNS 89 Standard query 0x3688  AAAA d1dx94olpiqj0t.cloudfront.net
  3   0.000535   172.31.0.2 -> 172.31.36.109 DNS 217 Standard query response 0x7b51  A 54.192.30.218 A 54.192.30.221 A 54.230.30.18 A 54.230.30.189 A 54.230.30.221 A 54.230.30.222 A 54.192.30.184 A 54.192.30.188
  4   0.014056   172.31.0.2 -> 172.31.36.109 DNS 176 Standard query response 0x3688 
  5   0.028190 172.31.36.109 -> 54.192.30.218 TCP 74 45953 > http [SYN] Seq=0 Win=26883 Len=0 MSS=8961 SACK_PERM=1 TSval=32198661 TSecr=0 WS=128
  6   0.029601 54.192.30.218 -> 172.31.36.109 TCP 74 http > 45953 [SYN, ACK] Seq=0 Ack=1 Win=14480 Len=0 MSS=1460 SACK_PERM=1 TSval=629947414 TSecr=32198661 WS=128
  7   0.029614 172.31.36.109 -> 54.192.30.218 TCP 66 45953 > http [ACK] Seq=1 Ack=1 Win=27008 Len=0 TSval=32198661 TSecr=629947414
  8   0.029656 172.31.36.109 -> 54.192.30.218 HTTP 162 GET /1kb HTTP/1.1 
  9   0.030877 54.192.30.218 -> 172.31.36.109 TCP 66 http > 45953 [ACK] Seq=1 Ack=97 Win=14592 Len=0 TSval=629947414 TSecr=32198661
 10   0.064985 54.192.30.218 -> 172.31.36.109 HTTP 1544 HTTP/1.1 200 OK  (application/octet-stream)
 11   0.065008 172.31.36.109 -> 54.192.30.218 TCP 66 45953 > http [ACK] Seq=97 Ack=1479 Win=29952 Len=0 TSval=32198670 TSecr=629947418
 12   0.065157 172.31.36.109 -> 54.192.30.218 TCP 66 45953 > http [FIN, ACK] Seq=97 Ack=1479 Win=29952 Len=0 TSval=32198670 TSecr=629947418
 13   0.066448 54.192.30.218 -> 172.31.36.109 TCP 66 http > 45953 [FIN, ACK] Seq=1479 Ack=98 Win=14592 Len=0 TSval=629947418 TSecr=32198670
 14   0.066478 172.31.36.109 -> 54.192.30.218 TCP 66 45953 > http [ACK] Seq=98 Ack=1480 Win=29952 Len=0 TSval=32198670 TSecr=629947418
