[Measurement for 1kb at 20:32:07 19.32.2014] 
Tshark:

  1   0.000000 172.31.36.109 -> 172.31.0.2   DNS 89 Standard query 0x6990  A d1dx94olpiqj0t.cloudfront.net
  2   0.000022 172.31.36.109 -> 172.31.0.2   DNS 89 Standard query 0xfd23  AAAA d1dx94olpiqj0t.cloudfront.net
  3   0.000457   172.31.0.2 -> 172.31.36.109 DNS 217 Standard query response 0x6990  A 54.230.30.51 A 54.230.30.212 A 54.230.30.213 A 54.230.30.214 A 54.230.30.221 A 54.192.29.225 A 54.230.29.240 A 54.230.30.37
  4   0.024011   172.31.0.2 -> 172.31.36.109 DNS 176 Standard query response 0xfd23 
  5   0.028146 172.31.36.109 -> 54.230.30.51 TCP 74 55204 > http [SYN] Seq=0 Win=26883 Len=0 MSS=8961 SACK_PERM=1 TSval=23203495 TSecr=0 WS=128
  6   0.029274 54.230.30.51 -> 172.31.36.109 TCP 74 http > 55204 [SYN, ACK] Seq=0 Ack=1 Win=14480 Len=0 MSS=1460 SACK_PERM=1 TSval=829249418 TSecr=23203495 WS=128
  7   0.029288 172.31.36.109 -> 54.230.30.51 TCP 66 55204 > http [ACK] Seq=1 Ack=1 Win=27008 Len=0 TSval=23203496 TSecr=829249418
  8   0.029343 172.31.36.109 -> 54.230.30.51 HTTP 162 GET /1kb HTTP/1.1 
  9   0.030416 54.230.30.51 -> 172.31.36.109 TCP 66 http > 55204 [ACK] Seq=1 Ack=97 Win=14592 Len=0 TSval=829249418 TSecr=23203496
 10   0.040022 54.230.30.51 -> 172.31.36.109 HTTP 1544 HTTP/1.1 200 OK  (application/octet-stream)
 11   0.040028 172.31.36.109 -> 54.230.30.51 TCP 66 55204 > http [ACK] Seq=97 Ack=1479 Win=29952 Len=0 TSval=23203498 TSecr=829249419
 12   0.040161 172.31.36.109 -> 54.230.30.51 TCP 66 55204 > http [FIN, ACK] Seq=97 Ack=1479 Win=29952 Len=0 TSval=23203498 TSecr=829249419
 13   0.041965 54.230.30.51 -> 172.31.36.109 TCP 66 http > 55204 [FIN, ACK] Seq=1479 Ack=98 Win=14592 Len=0 TSval=829249419 TSecr=23203498
 14   0.041973 172.31.36.109 -> 54.230.30.51 TCP 66 55204 > http [ACK] Seq=98 Ack=1480 Win=29952 Len=0 TSval=23203499 TSecr=829249419
