[Measurement for 1kb at 05:31:58 20.31.2014] 
Tshark:

  1   0.000000 172.31.36.109 -> 172.31.0.2   DNS 89 Standard query 0x0720  A d1dx94olpiqj0t.cloudfront.net
  2   0.000022 172.31.36.109 -> 172.31.0.2   DNS 89 Standard query 0x5329  AAAA d1dx94olpiqj0t.cloudfront.net
  3   0.000584   172.31.0.2 -> 172.31.36.109 DNS 217 Standard query response 0x0720  A 54.192.30.214 A 54.192.30.216 A 54.192.30.222 A 54.192.30.227 A 54.230.30.37 A 54.230.30.72 A 54.230.30.202 A 54.230.30.249
  4   0.023307   172.31.0.2 -> 172.31.36.109 DNS 176 Standard query response 0x5329 
  5   0.028154 172.31.36.109 -> 54.192.30.214 TCP 74 50416 > http [SYN] Seq=0 Win=26883 Len=0 MSS=8961 SACK_PERM=1 TSval=31301140 TSecr=0 WS=128
  6   0.029362 54.192.30.214 -> 172.31.36.109 TCP 74 http > 50416 [SYN, ACK] Seq=0 Ack=1 Win=14480 Len=0 MSS=1460 SACK_PERM=1 TSval=699137703 TSecr=31301140 WS=128
  7   0.029375 172.31.36.109 -> 54.192.30.214 TCP 66 50416 > http [ACK] Seq=1 Ack=1 Win=27008 Len=0 TSval=31301140 TSecr=699137703
  8   0.029416 172.31.36.109 -> 54.192.30.214 HTTP 162 GET /1kb HTTP/1.1 
  9   0.030673 54.192.30.214 -> 172.31.36.109 TCP 66 http > 50416 [ACK] Seq=1 Ack=97 Win=14592 Len=0 TSval=699137703 TSecr=31301140
 10   0.054485 54.192.30.214 -> 172.31.36.109 HTTP 1544 HTTP/1.1 200 OK  (application/octet-stream)
 11   0.054500 172.31.36.109 -> 54.192.30.214 TCP 66 50416 > http [ACK] Seq=97 Ack=1479 Win=29952 Len=0 TSval=31301146 TSecr=699137705
 12   0.054655 172.31.36.109 -> 54.192.30.214 TCP 66 50416 > http [FIN, ACK] Seq=97 Ack=1479 Win=29952 Len=0 TSval=31301146 TSecr=699137705
 13   0.055732 54.192.30.214 -> 172.31.36.109 TCP 66 http > 50416 [FIN, ACK] Seq=1479 Ack=98 Win=14592 Len=0 TSval=699137706 TSecr=31301146
 14   0.055763 172.31.36.109 -> 54.192.30.214 TCP 66 50416 > http [ACK] Seq=98 Ack=1480 Win=29952 Len=0 TSval=31301146 TSecr=699137706
