[Measurement for 10kb at 05:40:14 20.40.2014] 
Tshark:

  1   0.000000 172.31.8.238 -> 172.31.0.2   DNS 89 Standard query 0x340f  A d39wppo36gwqpx.cloudfront.net
  2   0.000029 172.31.8.238 -> 172.31.0.2   DNS 89 Standard query 0x0517  AAAA d39wppo36gwqpx.cloudfront.net
  3   0.000723   172.31.0.2 -> 172.31.8.238 DNS 217 Standard query response 0x340f  A 54.230.118.136 A 54.230.118.138 A 54.230.119.165 A 54.239.132.26 A 54.239.132.98 A 54.192.118.222 A 54.192.118.235 A 54.230.116.239
  4   0.000737   172.31.0.2 -> 172.31.8.238 DNS 170 Standard query response 0x0517 
  5   0.003846 172.31.8.238 -> 54.230.118.136 TCP 74 43496 > http [SYN] Seq=0 Win=26883 Len=0 MSS=8961 SACK_PERM=1 TSval=11410529 TSecr=0 WS=128
  6   0.004423 54.230.118.136 -> 172.31.8.238 TCP 74 http > 43496 [SYN, ACK] Seq=0 Ack=1 Win=14480 Len=0 MSS=1460 SACK_PERM=1 TSval=1685801705 TSecr=11410529 WS=128
  7   0.004438 172.31.8.238 -> 54.230.118.136 TCP 66 43496 > http [ACK] Seq=1 Ack=1 Win=27008 Len=0 TSval=11410530 TSecr=1685801705
  8   0.004476 172.31.8.238 -> 54.230.118.136 HTTP 163 GET /10kb HTTP/1.1 
  9   0.004945 54.230.118.136 -> 172.31.8.238 TCP 66 http > 43496 [ACK] Seq=1 Ack=98 Win=14592 Len=0 TSval=1685801705 TSecr=11410530
 10   0.006537 54.230.118.136 -> 172.31.8.238 HTTP 10761 HTTP/1.1 200 OK  (application/octet-stream)
 11   0.006547 172.31.8.238 -> 54.230.118.136 TCP 66 43496 > http [ACK] Seq=98 Ack=10696 Win=48384 Len=0 TSval=11410530 TSecr=1685801705
 12   0.006695 172.31.8.238 -> 54.230.118.136 TCP 66 43496 > http [FIN, ACK] Seq=98 Ack=10696 Win=48384 Len=0 TSval=11410530 TSecr=1685801705
 13   0.007486 54.230.118.136 -> 172.31.8.238 TCP 66 http > 43496 [FIN, ACK] Seq=10696 Ack=99 Win=14592 Len=0 TSval=1685801705 TSecr=11410530
 14   0.007495 172.31.8.238 -> 54.230.118.136 TCP 66 43496 > http [ACK] Seq=99 Ack=10697 Win=48384 Len=0 TSval=11410530 TSecr=1685801705
