[Measurement for 10kb at 07:40:14 20.40.2014] 
Tshark:

  1   0.000000 06:b0:37:46:8f:13 -> 06:c7:b5:04:b8:d0 ARP 60 Who has 172.31.8.238?  Tell 172.31.0.1
  2   0.000022 06:c7:b5:04:b8:d0 -> 06:b0:37:46:8f:13 ARP 42 172.31.8.238 is at 06:c7:b5:04:b8:d0
  3   0.942561 172.31.8.238 -> 172.31.0.2   DNS 89 Standard query 0x80a6  A d39wppo36gwqpx.cloudfront.net
  4   0.942590 172.31.8.238 -> 172.31.0.2   DNS 89 Standard query 0x0d40  AAAA d39wppo36gwqpx.cloudfront.net
  5   0.943206   172.31.0.2 -> 172.31.8.238 DNS 170 Standard query response 0x0d40 
  6   0.943218   172.31.0.2 -> 172.31.8.238 DNS 217 Standard query response 0x80a6  A 54.230.118.136 A 54.230.119.118 A 54.239.132.74 A 54.239.132.173 A 54.239.132.250 A 54.192.118.234 A 54.230.116.136 A 54.230.117.21
  7   0.946429 172.31.8.238 -> 54.230.118.136 TCP 74 43588 > http [SYN] Seq=0 Win=26883 Len=0 MSS=8961 SACK_PERM=1 TSval=13210512 TSecr=0 WS=128
  8   0.947002 54.230.118.136 -> 172.31.8.238 TCP 74 http > 43588 [SYN, ACK] Seq=0 Ack=1 Win=14480 Len=0 MSS=1460 SACK_PERM=1 TSval=1687077006 TSecr=13210512 WS=128
  9   0.947016 172.31.8.238 -> 54.230.118.136 TCP 66 43588 > http [ACK] Seq=1 Ack=1 Win=27008 Len=0 TSval=13210512 TSecr=1687077006
 10   0.947057 172.31.8.238 -> 54.230.118.136 HTTP 163 GET /10kb HTTP/1.1 
 11   0.947790 54.230.118.136 -> 172.31.8.238 TCP 66 http > 43588 [ACK] Seq=1 Ack=98 Win=14592 Len=0 TSval=1687077006 TSecr=13210512
 12   0.949861 54.230.118.136 -> 172.31.8.238 TCP 1514 [TCP segment of a reassembled PDU]
 13   0.949868 172.31.8.238 -> 54.230.118.136 TCP 66 43588 > http [ACK] Seq=98 Ack=1449 Win=29824 Len=0 TSval=13210513 TSecr=1687077007
 14   0.949998 54.230.118.136 -> 172.31.8.238 HTTP 9313 HTTP/1.1 200 OK  (application/octet-stream)
 15   0.950009 172.31.8.238 -> 54.230.118.136 TCP 66 43588 > http [ACK] Seq=98 Ack=10696 Win=48384 Len=0 TSval=13210513 TSecr=1687077007
 16   0.950140 172.31.8.238 -> 54.230.118.136 TCP 66 43588 > http [FIN, ACK] Seq=98 Ack=10696 Win=48384 Len=0 TSval=13210513 TSecr=1687077007
 17   0.950851 54.230.118.136 -> 172.31.8.238 TCP 66 http > 43588 [FIN, ACK] Seq=10696 Ack=99 Win=14592 Len=0 TSval=1687077007 TSecr=13210513
 18   0.950860 172.31.8.238 -> 54.230.118.136 TCP 66 43588 > http [ACK] Seq=99 Ack=10697 Win=48384 Len=0 TSval=13210513 TSecr=1687077007
