[Measurement for 10kb at 08:40:15 20.40.2014] 
Tshark:

  1   0.000000 172.31.8.238 -> 172.31.0.2   DNS 89 Standard query 0xe2c2  A d39wppo36gwqpx.cloudfront.net
  2   0.000041 172.31.8.238 -> 172.31.0.2   DNS 89 Standard query 0x0c76  AAAA d39wppo36gwqpx.cloudfront.net
  3   0.000556   172.31.0.2 -> 172.31.8.238 DNS 217 Standard query response 0xe2c2  A 54.192.118.221 A 54.192.118.233 A 54.192.118.247 A 54.230.116.73 A 54.230.116.98 A 54.239.132.147 A 54.239.132.173 A 54.192.118.219
  4   0.000568   172.31.0.2 -> 172.31.8.238 DNS 170 Standard query response 0x0c76 
  5   0.003885 172.31.8.238 -> 54.192.118.221 TCP 74 41754 > http [SYN] Seq=0 Win=26883 Len=0 MSS=8961 SACK_PERM=1 TSval=14110728 TSecr=0 WS=128
  6   0.004381 54.192.118.221 -> 172.31.8.238 TCP 74 http > 41754 [SYN, ACK] Seq=0 Ack=1 Win=14480 Len=0 MSS=1460 SACK_PERM=1 TSval=1687859296 TSecr=14110728 WS=128
  7   0.004395 172.31.8.238 -> 54.192.118.221 TCP 66 41754 > http [ACK] Seq=1 Ack=1 Win=27008 Len=0 TSval=14110728 TSecr=1687859296
  8   0.004440 172.31.8.238 -> 54.192.118.221 HTTP 163 GET /10kb HTTP/1.1 
  9   0.004879 54.192.118.221 -> 172.31.8.238 TCP 66 http > 41754 [ACK] Seq=1 Ack=98 Win=14592 Len=0 TSval=1687859296 TSecr=14110728
 10   0.006485 54.192.118.221 -> 172.31.8.238 TCP 7306 [TCP segment of a reassembled PDU]
 11   0.006494 172.31.8.238 -> 54.192.118.221 TCP 66 41754 > http [ACK] Seq=98 Ack=7241 Win=41472 Len=0 TSval=14110728 TSecr=1687859296
 12   0.006530 54.192.118.221 -> 172.31.8.238 HTTP 3521 HTTP/1.1 200 OK  (application/octet-stream)
 13   0.006536 172.31.8.238 -> 54.192.118.221 TCP 66 41754 > http [ACK] Seq=98 Ack=10696 Win=48384 Len=0 TSval=14110728 TSecr=1687859296
 14   0.006658 172.31.8.238 -> 54.192.118.221 TCP 66 41754 > http [FIN, ACK] Seq=98 Ack=10696 Win=48384 Len=0 TSval=14110728 TSecr=1687859296
 15   0.007200 54.192.118.221 -> 172.31.8.238 TCP 66 http > 41754 [FIN, ACK] Seq=10696 Ack=99 Win=14592 Len=0 TSval=1687859296 TSecr=14110728
 16   0.007208 172.31.8.238 -> 54.192.118.221 TCP 66 41754 > http [ACK] Seq=99 Ack=10697 Win=48384 Len=0 TSval=14110729 TSecr=1687859296
