[Measurement for 10kb at 17:40:14 19.40.2014] 
Tshark:

  1   0.000000 172.31.8.238 -> 172.31.0.2   DNS 89 Standard query 0xf3f9  A d39wppo36gwqpx.cloudfront.net
  2   0.000051 172.31.8.238 -> 172.31.0.2   DNS 89 Standard query 0x7910  AAAA d39wppo36gwqpx.cloudfront.net
  3   0.000728   172.31.0.2 -> 172.31.8.238 DNS 170 Standard query response 0x7910 
  4   0.000741   172.31.0.2 -> 172.31.8.238 DNS 217 Standard query response 0xf3f9  A 54.230.140.154 A 54.230.141.154 A 54.230.143.66 A 54.230.143.233 A 205.251.215.241 A 54.192.141.26 A 54.230.140.14 A 54.230.140.141
  5   0.003859 172.31.8.238 -> 54.230.140.154 TCP 74 59173 > http [SYN] Seq=0 Win=26883 Len=0 MSS=8961 SACK_PERM=1 TSval=610641 TSecr=0 WS=128
  6   0.006249 54.230.140.154 -> 172.31.8.238 TCP 74 http > 59173 [SYN, ACK] Seq=0 Ack=1 Win=14480 Len=0 MSS=1460 SACK_PERM=1 TSval=757708098 TSecr=610641 WS=128
  7   0.006264 172.31.8.238 -> 54.230.140.154 TCP 66 59173 > http [ACK] Seq=1 Ack=1 Win=27008 Len=0 TSval=610642 TSecr=757708098
  8   0.006318 172.31.8.238 -> 54.230.140.154 HTTP 163 GET /10kb HTTP/1.1 
  9   0.008743 54.230.140.154 -> 172.31.8.238 TCP 66 http > 59173 [ACK] Seq=1 Ack=98 Win=14592 Len=0 TSval=757708098 TSecr=610642
 10   0.537997 54.230.140.154 -> 172.31.8.238 TCP 5513 [TCP segment of a reassembled PDU]
 11   0.538036 172.31.8.238 -> 54.230.140.154 TCP 66 59173 > http [ACK] Seq=98 Ack=5448 Win=37888 Len=0 TSval=610775 TSecr=757708151
 12   0.538174 54.230.140.154 -> 172.31.8.238 TCP 2002 [TCP segment of a reassembled PDU]
 13   0.538181 172.31.8.238 -> 54.230.140.154 TCP 66 59173 > http [ACK] Seq=98 Ack=7384 Win=41728 Len=0 TSval=610775 TSecr=757708151
 14   0.539292 54.230.140.154 -> 172.31.8.238 TCP 1514 [TCP segment of a reassembled PDU]
 15   0.539299 172.31.8.238 -> 54.230.140.154 TCP 66 59173 > http [ACK] Seq=98 Ack=8832 Win=44672 Len=0 TSval=610775 TSecr=757708151
 16   0.539833 54.230.140.154 -> 172.31.8.238 TCP 1514 [TCP segment of a reassembled PDU]
 17   0.539838 172.31.8.238 -> 54.230.140.154 TCP 66 59173 > http [ACK] Seq=98 Ack=10280 Win=47488 Len=0 TSval=610775 TSecr=757708151
 18   0.540032 54.230.140.154 -> 172.31.8.238 HTTP 471 HTTP/1.1 200 OK  (application/octet-stream)
 19   0.540036 172.31.8.238 -> 54.230.140.154 TCP 66 59173 > http [ACK] Seq=98 Ack=10685 Win=50432 Len=0 TSval=610775 TSecr=757708151
 20   0.540177 172.31.8.238 -> 54.230.140.154 TCP 66 59173 > http [FIN, ACK] Seq=98 Ack=10685 Win=50432 Len=0 TSval=610775 TSecr=757708151
 21   0.542287 54.230.140.154 -> 172.31.8.238 TCP 66 http > 59173 [FIN, ACK] Seq=10685 Ack=99 Win=14592 Len=0 TSval=757708151 TSecr=610775
 22   0.542296 172.31.8.238 -> 54.230.140.154 TCP 66 59173 > http [ACK] Seq=99 Ack=10686 Win=50432 Len=0 TSval=610776 TSecr=757708151
