[Measurement for 10kb at 14:40:14 20.40.2014] 
Tshark:

  1   0.000000 06:b0:37:46:8f:13 -> 06:c7:b5:04:b8:d0 ARP 60 Who has 172.31.8.238?  Tell 172.31.0.1
  2   0.000020 06:c7:b5:04:b8:d0 -> 06:b0:37:46:8f:13 ARP 42 172.31.8.238 is at 06:c7:b5:04:b8:d0
  3   1.004618 172.31.8.238 -> 172.31.0.2   DNS 89 Standard query 0xc636  A d39wppo36gwqpx.cloudfront.net
  4   1.004656 172.31.8.238 -> 172.31.0.2   DNS 89 Standard query 0x6c4d  AAAA d39wppo36gwqpx.cloudfront.net
  5   1.005313   172.31.0.2 -> 172.31.8.238 DNS 170 Standard query response 0x6c4d 
  6   1.005345   172.31.0.2 -> 172.31.8.238 DNS 217 Standard query response 0xc636  A 54.230.117.238 A 54.230.119.18 A 54.230.119.110 A 54.239.132.55 A 54.239.132.147 A 54.192.118.221 A 54.192.118.240 A 54.230.117.50
  7   1.008541 172.31.8.238 -> 54.230.117.238 TCP 74 37522 > http [SYN] Seq=0 Win=26883 Len=0 MSS=8961 SACK_PERM=1 TSval=19510574 TSecr=0 WS=128
  8   1.009331 54.230.117.238 -> 172.31.8.238 TCP 74 http > 37522 [SYN, ACK] Seq=0 Ack=1 Win=14480 Len=0 MSS=1460 SACK_PERM=1 TSval=1687086664 TSecr=19510574 WS=128
  9   1.009346 172.31.8.238 -> 54.230.117.238 TCP 66 37522 > http [ACK] Seq=1 Ack=1 Win=27008 Len=0 TSval=19510575 TSecr=1687086664
 10   1.009409 172.31.8.238 -> 54.230.117.238 HTTP 163 GET /10kb HTTP/1.1 
 11   1.009975 54.230.117.238 -> 172.31.8.238 TCP 66 http > 37522 [ACK] Seq=1 Ack=98 Win=14592 Len=0 TSval=1687086664 TSecr=19510575
 12   1.011290 54.230.117.238 -> 172.31.8.238 TCP 2962 [TCP segment of a reassembled PDU]
 13   1.011297 172.31.8.238 -> 54.230.117.238 TCP 66 37522 > http [ACK] Seq=98 Ack=2897 Win=32768 Len=0 TSval=19510575 TSecr=1687086664
 14   1.011405 54.230.117.238 -> 172.31.8.238 HTTP 7865 HTTP/1.1 200 OK  (application/octet-stream)
 15   1.011414 172.31.8.238 -> 54.230.117.238 TCP 66 37522 > http [ACK] Seq=98 Ack=10696 Win=48384 Len=0 TSval=19510575 TSecr=1687086664
 16   1.011544 172.31.8.238 -> 54.230.117.238 TCP 66 37522 > http [FIN, ACK] Seq=98 Ack=10696 Win=48384 Len=0 TSval=19510575 TSecr=1687086664
 17   1.012255 54.230.117.238 -> 172.31.8.238 TCP 66 http > 37522 [FIN, ACK] Seq=10696 Ack=99 Win=14592 Len=0 TSval=1687086664 TSecr=19510575
 18   1.012263 172.31.8.238 -> 54.230.117.238 TCP 66 37522 > http [ACK] Seq=99 Ack=10697 Win=48384 Len=0 TSval=19510575 TSecr=1687086664
