[Measurement for 10kb at 22:40:14 19.40.2014] 
Tshark:

  1   0.000000 172.31.8.238 -> 172.31.0.2   DNS 89 Standard query 0xc393  A d39wppo36gwqpx.cloudfront.net
  2   0.000039 172.31.8.238 -> 172.31.0.2   DNS 89 Standard query 0x9c34  AAAA d39wppo36gwqpx.cloudfront.net
  3   0.000627   172.31.0.2 -> 172.31.8.238 DNS 217 Standard query response 0xc393  A 54.192.118.222 A 54.230.116.44 A 54.230.116.98 A 54.230.117.87 A 54.230.117.198 A 54.230.117.238 A 54.230.118.187 A 54.230.119.55
  4   0.000638   172.31.0.2 -> 172.31.8.238 DNS 170 Standard query response 0x9c34 
  5   0.003821 172.31.8.238 -> 54.192.118.222 TCP 74 34859 > http [SYN] Seq=0 Win=26883 Len=0 MSS=8961 SACK_PERM=1 TSval=5110586 TSecr=0 WS=128
  6   0.004583 54.192.118.222 -> 172.31.8.238 TCP 74 http > 34859 [SYN, ACK] Seq=0 Ack=1 Win=14480 Len=0 MSS=1460 SACK_PERM=1 TSval=1682892702 TSecr=5110586 WS=128
  7   0.004599 172.31.8.238 -> 54.192.118.222 TCP 66 34859 > http [ACK] Seq=1 Ack=1 Win=27008 Len=0 TSval=5110587 TSecr=1682892702
  8   0.004640 172.31.8.238 -> 54.192.118.222 HTTP 163 GET /10kb HTTP/1.1 
  9   0.005276 54.192.118.222 -> 172.31.8.238 TCP 66 http > 34859 [ACK] Seq=1 Ack=98 Win=14592 Len=0 TSval=1682892702 TSecr=5110587
 10   0.006357 54.192.118.222 -> 172.31.8.238 TCP 2962 [TCP segment of a reassembled PDU]
 11   0.006365 172.31.8.238 -> 54.192.118.222 TCP 66 34859 > http [ACK] Seq=98 Ack=2897 Win=32768 Len=0 TSval=5110587 TSecr=1682892702
 12   0.006487 54.192.118.222 -> 172.31.8.238 HTTP 7865 HTTP/1.1 200 OK  (application/octet-stream)
 13   0.006496 172.31.8.238 -> 54.192.118.222 TCP 66 34859 > http [ACK] Seq=98 Ack=10696 Win=48384 Len=0 TSval=5110587 TSecr=1682892702
 14   0.006616 172.31.8.238 -> 54.192.118.222 TCP 66 34859 > http [FIN, ACK] Seq=98 Ack=10696 Win=48384 Len=0 TSval=5110587 TSecr=1682892702
 15   0.007079 54.192.118.222 -> 172.31.8.238 TCP 66 http > 34859 [FIN, ACK] Seq=10696 Ack=99 Win=14592 Len=0 TSval=1682892702 TSecr=5110587
 16   0.007087 172.31.8.238 -> 54.192.118.222 TCP 66 34859 > http [ACK] Seq=99 Ack=10697 Win=48384 Len=0 TSval=5110587 TSecr=1682892702
 17   0.123031 06:b0:37:46:8f:13 -> 06:c7:b5:04:b8:d0 ARP 60 Who has 172.31.8.238?  Tell 172.31.0.1
 18   0.123051 06:c7:b5:04:b8:d0 -> 06:b0:37:46:8f:13 ARP 42 172.31.8.238 is at 06:c7:b5:04:b8:d0
