[Measurement for 10kb at 12:38:40 20.38.2014] 
Tshark:

  1   0.000000 172.31.29.138 -> 172.31.0.2   DNS 89 Standard query 0x71b2  A d3m1c4hwkgedal.cloudfront.net
  2   0.000029 172.31.29.138 -> 172.31.0.2   DNS 89 Standard query 0x5c4d  AAAA d3m1c4hwkgedal.cloudfront.net
  3   0.000465   172.31.0.2 -> 172.31.29.138 DNS 217 Standard query response 0x71b2  A 54.230.158.141 A 54.230.158.243 A 54.230.159.132 A 54.192.157.142 A 54.192.157.145 A 54.192.159.168 A 54.192.159.169 A 54.192.159.174
  4   0.000476   172.31.0.2 -> 172.31.29.138 DNS 174 Standard query response 0x5c4d 
  5   0.003851 172.31.29.138 -> 54.230.158.141 TCP 74 47967 > http [SYN] Seq=0 Win=26883 Len=0 MSS=8961 SACK_PERM=1 TSval=17748325 TSecr=0 WS=128
  6   0.004617 54.230.158.141 -> 172.31.29.138 TCP 74 http > 47967 [SYN, ACK] Seq=0 Ack=1 Win=14480 Len=0 MSS=1460 SACK_PERM=1 TSval=844505065 TSecr=17748325 WS=128
  7   0.004631 172.31.29.138 -> 54.230.158.141 TCP 66 47967 > http [ACK] Seq=1 Ack=1 Win=27008 Len=0 TSval=17748325 TSecr=844505065
  8   0.004673 172.31.29.138 -> 54.230.158.141 HTTP 163 GET /10kb HTTP/1.1 
  9   0.005350 54.230.158.141 -> 172.31.29.138 TCP 66 http > 47967 [ACK] Seq=1 Ack=98 Win=14592 Len=0 TSval=844505065 TSecr=17748325
 10   0.008220 54.230.158.141 -> 172.31.29.138 TCP 5858 [TCP segment of a reassembled PDU]
 11   0.008230 172.31.29.138 -> 54.230.158.141 TCP 66 47967 > http [ACK] Seq=98 Ack=5793 Win=38528 Len=0 TSval=17748326 TSecr=844505065
 12   0.008267 54.230.158.141 -> 172.31.29.138 HTTP 4969 HTTP/1.1 200 OK  (application/octet-stream)
 13   0.008275 172.31.29.138 -> 54.230.158.141 TCP 66 47967 > http [ACK] Seq=98 Ack=10696 Win=48384 Len=0 TSval=17748326 TSecr=844505065
 14   0.008414 172.31.29.138 -> 54.230.158.141 TCP 66 47967 > http [FIN, ACK] Seq=98 Ack=10696 Win=48384 Len=0 TSval=17748326 TSecr=844505065
 15   0.009209 54.230.158.141 -> 172.31.29.138 TCP 66 http > 47967 [FIN, ACK] Seq=10696 Ack=99 Win=14592 Len=0 TSval=844505065 TSecr=17748326
 16   0.009218 172.31.29.138 -> 54.230.158.141 TCP 66 47967 > http [ACK] Seq=99 Ack=10697 Win=48384 Len=0 TSval=17748326 TSecr=844505065
