[Measurement for 10kb at 18:38:39 19.38.2014] 
Tshark:

  1   0.000000 172.31.29.138 -> 172.31.0.2   DNS 89 Standard query 0xb543  A d3m1c4hwkgedal.cloudfront.net
  2   0.000040 172.31.29.138 -> 172.31.0.2   DNS 89 Standard query 0x45a1  AAAA d3m1c4hwkgedal.cloudfront.net
  3   0.000679   172.31.0.2 -> 172.31.29.138 DNS 174 Standard query response 0x45a1 
  4   0.000690   172.31.0.2 -> 172.31.29.138 DNS 217 Standard query response 0xb543  A 54.230.158.150 A 54.230.158.223 A 54.230.159.147 A 54.240.168.150 A 54.192.156.104 A 54.192.157.151 A 54.230.156.193 A 54.230.158.136
  5   0.003815 172.31.29.138 -> 54.230.158.150 TCP 74 41928 > http [SYN] Seq=0 Win=26883 Len=0 MSS=8961 SACK_PERM=1 TSval=1548117 TSecr=0 WS=128
  6   0.004398 54.230.158.150 -> 172.31.29.138 TCP 74 http > 41928 [SYN, ACK] Seq=0 Ack=1 Win=14480 Len=0 MSS=1460 SACK_PERM=1 TSval=831753635 TSecr=1548117 WS=128
  7   0.004413 172.31.29.138 -> 54.230.158.150 TCP 66 41928 > http [ACK] Seq=1 Ack=1 Win=27008 Len=0 TSval=1548117 TSecr=831753635
  8   0.004452 172.31.29.138 -> 54.230.158.150 HTTP 163 GET /10kb HTTP/1.1 
  9   0.004885 54.230.158.150 -> 172.31.29.138 TCP 66 http > 41928 [ACK] Seq=1 Ack=98 Win=14592 Len=0 TSval=831753635 TSecr=1548117
 10   0.007022 54.230.158.150 -> 172.31.29.138 TCP 7306 [TCP segment of a reassembled PDU]
 11   0.007032 172.31.29.138 -> 54.230.158.150 TCP 66 41928 > http [ACK] Seq=98 Ack=7241 Win=41472 Len=0 TSval=1548118 TSecr=831753635
 12   0.007040 54.230.158.150 -> 172.31.29.138 HTTP 3520 HTTP/1.1 200 OK  (application/octet-stream)
 13   0.007046 172.31.29.138 -> 54.230.158.150 TCP 66 41928 > http [ACK] Seq=98 Ack=10695 Win=48384 Len=0 TSval=1548118 TSecr=831753635
 14   0.007197 172.31.29.138 -> 54.230.158.150 TCP 66 41928 > http [FIN, ACK] Seq=98 Ack=10695 Win=48384 Len=0 TSval=1548118 TSecr=831753635
 15   0.007706 54.230.158.150 -> 172.31.29.138 TCP 66 http > 41928 [FIN, ACK] Seq=10695 Ack=99 Win=14592 Len=0 TSval=831753635 TSecr=1548118
 16   0.007715 172.31.29.138 -> 54.230.158.150 TCP 66 41928 > http [ACK] Seq=99 Ack=10696 Win=48384 Len=0 TSval=1548118 TSecr=831753635
