[Measurement for 10kb at 05:38:40 20.38.2014] 
Tshark:

  1   0.000000 172.31.29.138 -> 172.31.0.2   DNS 89 Standard query 0x2aed  A d3m1c4hwkgedal.cloudfront.net
  2   0.000037 172.31.29.138 -> 172.31.0.2   DNS 89 Standard query 0x77d6  AAAA d3m1c4hwkgedal.cloudfront.net
  3   0.000572   172.31.0.2 -> 172.31.29.138 DNS 174 Standard query response 0x77d6 
  4   0.000582   172.31.0.2 -> 172.31.29.138 DNS 217 Standard query response 0x2aed  A 54.192.157.142 A 54.192.159.97 A 54.192.159.101 A 54.192.159.107 A 54.192.159.168 A 54.230.158.180 A 54.230.158.225 A 54.230.159.150
  5   0.003841 172.31.29.138 -> 54.192.157.142 TCP 74 48580 > http [SYN] Seq=0 Win=26883 Len=0 MSS=8961 SACK_PERM=1 TSval=11448323 TSecr=0 WS=128
  6   0.004737 54.192.157.142 -> 172.31.29.138 TCP 74 http > 48580 [SYN, ACK] Seq=0 Ack=1 Win=14480 Len=0 MSS=1460 SACK_PERM=1 TSval=833707245 TSecr=11448323 WS=128
  7   0.004751 172.31.29.138 -> 54.192.157.142 TCP 66 48580 > http [ACK] Seq=1 Ack=1 Win=27008 Len=0 TSval=11448323 TSecr=833707245
  8   0.004790 172.31.29.138 -> 54.192.157.142 HTTP 163 GET /10kb HTTP/1.1 
  9   0.005418 54.192.157.142 -> 172.31.29.138 TCP 66 http > 48580 [ACK] Seq=1 Ack=98 Win=14592 Len=0 TSval=833707245 TSecr=11448323
 10   0.007852 54.192.157.142 -> 172.31.29.138 HTTP 10761 HTTP/1.1 200 OK  (application/octet-stream)
 11   0.007865 172.31.29.138 -> 54.192.157.142 TCP 66 48580 > http [ACK] Seq=98 Ack=10696 Win=48384 Len=0 TSval=11448324 TSecr=833707245
 12   0.008039 172.31.29.138 -> 54.192.157.142 TCP 66 48580 > http [FIN, ACK] Seq=98 Ack=10696 Win=48384 Len=0 TSval=11448324 TSecr=833707245
 13   0.008495 54.192.157.142 -> 172.31.29.138 TCP 66 http > 48580 [FIN, ACK] Seq=10696 Ack=99 Win=14592 Len=0 TSval=833707245 TSecr=11448324
 14   0.008504 172.31.29.138 -> 54.192.157.142 TCP 66 48580 > http [ACK] Seq=99 Ack=10697 Win=48384 Len=0 TSval=11448324 TSecr=833707245
