[Measurement for 10kb at 04:38:40 20.38.2014] 
Tshark:

  1   0.000000 172.31.29.138 -> 172.31.0.2   DNS 89 Standard query 0x0c89  A d3m1c4hwkgedal.cloudfront.net
  2   0.000036 172.31.29.138 -> 172.31.0.2   DNS 89 Standard query 0x280d  AAAA d3m1c4hwkgedal.cloudfront.net
  3   0.000597   172.31.0.2 -> 172.31.29.138 DNS 174 Standard query response 0x280d 
  4   0.000608   172.31.0.2 -> 172.31.29.138 DNS 217 Standard query response 0x0c89  A 54.192.157.144 A 54.230.157.230 A 54.230.158.184 A 54.230.158.225 A 54.230.159.137 A 54.192.156.100 A 54.192.157.137 A 54.192.157.142
  5   0.003881 172.31.29.138 -> 54.192.157.144 TCP 74 46602 > http [SYN] Seq=0 Win=26883 Len=0 MSS=8961 SACK_PERM=1 TSval=10548234 TSecr=0 WS=128
  6   0.004489 54.192.157.144 -> 172.31.29.138 TCP 74 http > 46602 [SYN, ACK] Seq=0 Ack=1 Win=14480 Len=0 MSS=1460 SACK_PERM=1 TSval=833369105 TSecr=10548234 WS=128
  7   0.004503 172.31.29.138 -> 54.192.157.144 TCP 66 46602 > http [ACK] Seq=1 Ack=1 Win=27008 Len=0 TSval=10548234 TSecr=833369105
  8   0.004543 172.31.29.138 -> 54.192.157.144 HTTP 163 GET /10kb HTTP/1.1 
  9   0.005226 54.192.157.144 -> 172.31.29.138 TCP 66 http > 46602 [ACK] Seq=1 Ack=98 Win=14592 Len=0 TSval=833369105 TSecr=10548234
 10   0.007829 54.192.157.144 -> 172.31.29.138 TCP 2580 [TCP segment of a reassembled PDU]
 11   0.007838 172.31.29.138 -> 54.192.157.144 TCP 66 46602 > http [ACK] Seq=98 Ack=2515 Win=32000 Len=0 TSval=10548235 TSecr=833369105
 12   0.008018 54.192.157.144 -> 172.31.29.138 TCP 2962 [TCP segment of a reassembled PDU]
 13   0.008025 172.31.29.138 -> 54.192.157.144 TCP 66 46602 > http [ACK] Seq=98 Ack=5411 Win=37760 Len=0 TSval=10548235 TSecr=833369105
 14   0.008091 54.192.157.144 -> 172.31.29.138 HTTP 5351 HTTP/1.1 200 OK  (application/octet-stream)
 15   0.008098 172.31.29.138 -> 54.192.157.144 TCP 66 46602 > http [ACK] Seq=98 Ack=10696 Win=48384 Len=0 TSval=10548235 TSecr=833369105
 16   0.008219 172.31.29.138 -> 54.192.157.144 TCP 66 46602 > http [FIN, ACK] Seq=98 Ack=10696 Win=48384 Len=0 TSval=10548235 TSecr=833369105
 17   0.008763 54.192.157.144 -> 172.31.29.138 TCP 66 http > 46602 [FIN, ACK] Seq=10696 Ack=99 Win=14592 Len=0 TSval=833369105 TSecr=10548235
 18   0.008771 172.31.29.138 -> 54.192.157.144 TCP 66 46602 > http [ACK] Seq=99 Ack=10697 Win=48384 Len=0 TSval=10548235 TSecr=833369105
