[Measurement for 1mb at 14:38:48 20.38.2014] 
Tshark:

  1   0.000000 172.31.29.138 -> 172.31.0.2   DNS 89 Standard query 0x0e2d  A d3m1c4hwkgedal.cloudfront.net
  2   0.000027 172.31.29.138 -> 172.31.0.2   DNS 89 Standard query 0xb338  AAAA d3m1c4hwkgedal.cloudfront.net
  3   0.000603   172.31.0.2 -> 172.31.29.138 DNS 174 Standard query response 0xb338 
  4   0.000619   172.31.0.2 -> 172.31.29.138 DNS 217 Standard query response 0x0e2d  A 54.230.159.139 A 54.240.168.24 A 54.192.159.105 A 54.192.159.106 A 54.192.159.180 A 54.230.159.4 A 54.230.159.5 A 54.230.159.137
  5   0.003780 172.31.29.138 -> 54.230.159.139 TCP 74 43929 > http [SYN] Seq=0 Win=26883 Len=0 MSS=8961 SACK_PERM=1 TSval=19550290 TSecr=0 WS=128
  6   0.004291 54.230.159.139 -> 172.31.29.138 TCP 74 http > 43929 [SYN, ACK] Seq=0 Ack=1 Win=14480 Len=0 MSS=1460 SACK_PERM=1 TSval=813595661 TSecr=19550290 WS=128
  7   0.004305 172.31.29.138 -> 54.230.159.139 TCP 66 43929 > http [ACK] Seq=1 Ack=1 Win=27008 Len=0 TSval=19550291 TSecr=813595661
  8   0.004344 172.31.29.138 -> 54.230.159.139 HTTP 162 GET /1mb HTTP/1.1 
  9   0.004748 54.230.159.139 -> 172.31.29.138 TCP 66 http > 43929 [ACK] Seq=1 Ack=97 Win=14592 Len=0 TSval=813595661 TSecr=19550291
 10   0.009464 54.230.159.139 -> 172.31.29.138 TCP 10202 [TCP segment of a reassembled PDU]
 11   0.009474 172.31.29.138 -> 54.230.159.139 TCP 66 43929 > http [ACK] Seq=97 Ack=10137 Win=47232 Len=0 TSval=19550292 TSecr=813595662
 12   0.009482 54.230.159.139 -> 172.31.29.138 TCP 2962 [TCP segment of a reassembled PDU]
 13   0.009486 172.31.29.138 -> 54.230.159.139 TCP 66 43929 > http [ACK] Seq=97 Ack=13033 Win=52992 Len=0 TSval=19550292 TSecr=813595662
 14   0.010168 54.230.159.139 -> 172.31.29.138 TCP 2962 [TCP segment of a reassembled PDU]
 15   0.010174 172.31.29.138 -> 54.230.159.139 TCP 66 43929 > http [ACK] Seq=97 Ack=15929 Win=58752 Len=0 TSval=19550292 TSecr=813595662
 16   0.010269 54.230.159.139 -> 172.31.29.138 TCP 10202 [TCP segment of a reassembled PDU]
 17   0.010277 172.31.29.138 -> 54.230.159.139 TCP 66 43929 > http [ACK] Seq=97 Ack=26065 Win=79104 Len=0 TSval=19550292 TSecr=813595662
 18   0.010696 54.230.159.139 -> 172.31.29.138 TCP 8754 [TCP segment of a reassembled PDU]
 19   0.010705 172.31.29.138 -> 54.230.159.139 TCP 66 43929 > http [ACK] Seq=97 Ack=34753 Win=96512 Len=0 TSval=19550292 TSecr=813595662
 20   0.010956 54.230.159.139 -> 172.31.29.138 TCP 4410 [TCP segment of a reassembled PDU]
 21   0.010962 172.31.29.138 -> 54.230.159.139 TCP 66 43929 > http [ACK] Seq=97 Ack=39097 Win=105088 Len=0 TSval=19550292 TSecr=813595662
 22   0.011003 54.230.159.139 -> 172.31.29.138 TCP 7306 [TCP segment of a reassembled PDU]
 23   0.011009 172.31.29.138 -> 54.230.159.139 TCP 66 43929 > http [ACK] Seq=97 Ack=46337 Win=105984 Len=0 TSval=19550292 TSecr=813595662
 24   0.011226 54.230.159.139 -> 172.31.29.138 TCP 4410 [TCP segment of a reassembled PDU]
 25   0.011232 172.31.29.138 -> 54.230.159.139 TCP 66 43929 > http [ACK] Seq=97 Ack=50681 Win=109056 Len=0 TSval=19550292 TSecr=813595662
 26   0.011251 54.230.159.139 -> 172.31.29.138 TCP 1514 [TCP segment of a reassembled PDU]
 27   0.011260 172.31.29.138 -> 54.230.159.139 TCP 66 43929 > http [ACK] Seq=97 Ack=52129 Win=109056 Len=0 TSval=19550292 TSecr=813595662
 28   0.011509 54.230.159.139 -> 172.31.29.138 TCP 10202 [TCP segment of a reassembled PDU]
 29   0.011517 172.31.29.138 -> 54.230.159.139 TCP 66 43929 > http [ACK] Seq=97 Ack=62265 Win=101248 Len=0 TSval=19550292 TSecr=813595662
 30   0.011705 54.230.159.139 -> 172.31.29.138 TCP 2816 [TCP segment of a reassembled PDU]
 31   0.011710 172.31.29.138 -> 54.230.159.139 TCP 66 43929 > http [ACK] Seq=97 Ack=65015 Win=109056 Len=0 TSval=19550292 TSecr=813595662
 32   0.011968 54.230.159.139 -> 172.31.29.138 TCP 8754 [TCP segment of a reassembled PDU]
 33   0.011975 172.31.29.138 -> 54.230.159.139 TCP 66 43929 > http [ACK] Seq=97 Ack=73703 Win=103680 Len=0 TSval=19550293 TSecr=813595662
 34   0.012050 54.230.159.139 -> 172.31.29.138 TCP 4410 [TCP segment of a reassembled PDU]
 35   0.012055 172.31.29.138 -> 54.230.159.139 TCP 66 43929 > http [ACK] Seq=97 Ack=78047 Win=117760 Len=0 TSval=19550293 TSecr=813595662
 36   0.012319 54.230.159.139 -> 172.31.29.138 TCP 11650 [TCP segment of a reassembled PDU]
 37   0.012327 172.31.29.138 -> 54.230.159.139 TCP 66 43929 > http [ACK] Seq=97 Ack=89631 Win=140928 Len=0 TSval=19550293 TSecr=813595662
 38   0.012570 54.230.159.139 -> 172.31.29.138 TCP 14546 [TCP segment of a reassembled PDU]
 39   0.012579 172.31.29.138 -> 54.230.159.139 TCP 66 43929 > http [ACK] Seq=97 Ack=104111 Win=169856 Len=0 TSval=19550293 TSecr=813595662
 40   0.012988 54.230.159.139 -> 172.31.29.138 TCP 8754 [TCP segment of a reassembled PDU]
 41   0.012995 172.31.29.138 -> 54.230.159.139 TCP 66 43929 > http [ACK] Seq=97 Ack=112799 Win=187264 Len=0 TSval=19550293 TSecr=813595662
 42   0.013081 54.230.159.139 -> 172.31.29.138 TCP 10202 [TCP segment of a reassembled PDU]
 43   0.013089 172.31.29.138 -> 54.230.159.139 TCP 66 43929 > http [ACK] Seq=97 Ack=122935 Win=207488 Len=0 TSval=19550293 TSecr=813595662
 44   0.013276 54.230.159.139 -> 172.31.29.138 TCP 4410 [TCP segment of a reassembled PDU]
 45   0.013282 172.31.29.138 -> 54.230.159.139 TCP 66 43929 > http [ACK] Seq=97 Ack=127279 Win=216192 Len=0 TSval=19550293 TSecr=813595662
 46   0.013378 54.230.159.139 -> 172.31.29.138 TCP 3338 [TCP segment of a reassembled PDU]
 47   0.013383 172.31.29.138 -> 54.230.159.139 TCP 66 43929 > http [ACK] Seq=97 Ack=130551 Win=222720 Len=0 TSval=19550293 TSecr=813595662
 48   0.013998 54.230.159.139 -> 172.31.29.138 TCP 5858 [TCP segment of a reassembled PDU]
 49   0.014005 172.31.29.138 -> 54.230.159.139 TCP 66 43929 > http [ACK] Seq=97 Ack=136343 Win=234368 Len=0 TSval=19550293 TSecr=813595662
 50   0.014176 54.230.159.139 -> 172.31.29.138 TCP 26130 [TCP segment of a reassembled PDU]
 51   0.014190 172.31.29.138 -> 54.230.159.139 TCP 66 43929 > http [ACK] Seq=97 Ack=162407 Win=286464 Len=0 TSval=19550293 TSecr=813595662
 52   0.014547 54.230.159.139 -> 172.31.29.138 TCP 7306 [TCP segment of a reassembled PDU]
 53   0.014554 172.31.29.138 -> 54.230.159.139 TCP 66 43929 > http [ACK] Seq=97 Ack=169647 Win=300928 Len=0 TSval=19550293 TSecr=813595662
 54   0.014652 54.230.159.139 -> 172.31.29.138 TCP 5858 [TCP segment of a reassembled PDU]
 55   0.014658 172.31.29.138 -> 54.230.159.139 TCP 66 43929 > http [ACK] Seq=97 Ack=175439 Win=312576 Len=0 TSval=19550293 TSecr=813595662
 56   0.014780 54.230.159.139 -> 172.31.29.138 TCP 7306 [TCP segment of a reassembled PDU]
 57   0.014787 172.31.29.138 -> 54.230.159.139 TCP 66 43929 > http [ACK] Seq=97 Ack=182679 Win=327040 Len=0 TSval=19550293 TSecr=813595662
 58   0.014980 54.230.159.139 -> 172.31.29.138 TCP 20338 [TCP segment of a reassembled PDU]
 59   0.014996 172.31.29.138 -> 54.230.159.139 TCP 66 43929 > http [ACK] Seq=97 Ack=202951 Win=367616 Len=0 TSval=19550293 TSecr=813595662
 60   0.015296 54.230.159.139 -> 172.31.29.138 TCP 7306 [TCP segment of a reassembled PDU]
 61   0.015304 172.31.29.138 -> 54.230.159.139 TCP 66 43929 > http [ACK] Seq=97 Ack=210191 Win=382080 Len=0 TSval=19550293 TSecr=813595662
 62   0.015414 54.230.159.139 -> 172.31.29.138 TCP 8754 [TCP segment of a reassembled PDU]
 63   0.015422 172.31.29.138 -> 54.230.159.139 TCP 66 43929 > http [ACK] Seq=97 Ack=218879 Win=399360 Len=0 TSval=19550293 TSecr=813595662
 64   0.015801 54.230.159.139 -> 172.31.29.138 TCP 2962 [TCP segment of a reassembled PDU]
 65   0.015807 172.31.29.138 -> 54.230.159.139 TCP 66 43929 > http [ACK] Seq=97 Ack=221775 Win=405248 Len=0 TSval=19550294 TSecr=813595662
 66   0.015994 54.230.159.139 -> 172.31.29.138 TCP 27578 [TCP segment of a reassembled PDU]
 67   0.016008 172.31.29.138 -> 54.230.159.139 TCP 66 43929 > http [ACK] Seq=97 Ack=249287 Win=460288 Len=0 TSval=19550294 TSecr=813595662
 68   0.016118 54.230.159.139 -> 172.31.29.138 TCP 18890 [TCP segment of a reassembled PDU]
 69   0.016130 172.31.29.138 -> 54.230.159.139 TCP 66 43929 > http [ACK] Seq=97 Ack=268111 Win=497920 Len=0 TSval=19550294 TSecr=813595662
 70   0.016584 54.230.159.139 -> 172.31.29.138 TCP 8754 [TCP segment of a reassembled PDU]
 71   0.016593 172.31.29.138 -> 54.230.159.139 TCP 66 43929 > http [ACK] Seq=97 Ack=276799 Win=515200 Len=0 TSval=19550294 TSecr=813595662
 72   0.016774 54.230.159.139 -> 172.31.29.138 TCP 24682 [TCP segment of a reassembled PDU]
 73   0.016791 172.31.29.138 -> 54.230.159.139 TCP 66 43929 > http [ACK] Seq=97 Ack=301415 Win=564480 Len=0 TSval=19550294 TSecr=813595662
 74   0.016801 54.230.159.139 -> 172.31.29.138 TCP 2962 [TCP segment of a reassembled PDU]
 75   0.016805 172.31.29.138 -> 54.230.159.139 TCP 66 43929 > http [ACK] Seq=97 Ack=304311 Win=570240 Len=0 TSval=19550294 TSecr=813595662
 76   0.016996 54.230.159.139 -> 172.31.29.138 TCP 17442 [TCP segment of a reassembled PDU]
 77   0.017008 172.31.29.138 -> 54.230.159.139 TCP 66 43929 > http [ACK] Seq=97 Ack=321687 Win=605056 Len=0 TSval=19550294 TSecr=813595662
 78   0.017623 54.230.159.139 -> 172.31.29.138 TCP 4410 [TCP segment of a reassembled PDU]
 79   0.017629 172.31.29.138 -> 54.230.159.139 TCP 66 43929 > http [ACK] Seq=97 Ack=326031 Win=613760 Len=0 TSval=19550294 TSecr=813595662
 80   0.017802 54.230.159.139 -> 172.31.29.138 TCP 26130 [TCP segment of a reassembled PDU]
 81   0.017816 172.31.29.138 -> 54.230.159.139 TCP 66 43929 > http [ACK] Seq=97 Ack=352095 Win=665856 Len=0 TSval=19550294 TSecr=813595662
 82   0.017865 54.230.159.139 -> 172.31.29.138 TCP 26130 [TCP segment of a reassembled PDU]
 83   0.017880 172.31.29.138 -> 54.230.159.139 TCP 66 43929 > http [ACK] Seq=97 Ack=378159 Win=717952 Len=0 TSval=19550294 TSecr=813595662
 84   0.017902 54.230.159.139 -> 172.31.29.138 TCP 2962 [TCP segment of a reassembled PDU]
 85   0.017907 172.31.29.138 -> 54.230.159.139 TCP 66 43929 > http [ACK] Seq=97 Ack=381055 Win=723712 Len=0 TSval=19550294 TSecr=813595662
 86   0.018382 54.230.159.139 -> 172.31.29.138 TCP 8754 [TCP segment of a reassembled PDU]
 87   0.018391 172.31.29.138 -> 54.230.159.139 TCP 66 43929 > http [ACK] Seq=97 Ack=389743 Win=741120 Len=0 TSval=19550294 TSecr=813595662
 88   0.018560 54.230.159.139 -> 172.31.29.138 TCP 26130 [TCP segment of a reassembled PDU]
 89   0.018575 172.31.29.138 -> 54.230.159.139 TCP 66 43929 > http [ACK] Seq=97 Ack=415807 Win=793216 Len=0 TSval=19550294 TSecr=813595662
 90   0.018621 54.230.159.139 -> 172.31.29.138 TCP 24682 [TCP segment of a reassembled PDU]
 91   0.018635 172.31.29.138 -> 54.230.159.139 TCP 66 43929 > http [ACK] Seq=97 Ack=440423 Win=799744 Len=0 TSval=19550294 TSecr=813595662
 92   0.018654 54.230.159.139 -> 172.31.29.138 TCP 1514 [TCP segment of a reassembled PDU]
 93   0.018658 172.31.29.138 -> 54.230.159.139 TCP 66 43929 > http [ACK] Seq=97 Ack=441871 Win=840064 Len=0 TSval=19550294 TSecr=813595662
 94   0.019231 54.230.159.139 -> 172.31.29.138 TCP 2962 [TCP segment of a reassembled PDU]
 95   0.019238 172.31.29.138 -> 54.230.159.139 TCP 66 43929 > http [ACK] Seq=97 Ack=444767 Win=848256 Len=0 TSval=19550294 TSecr=813595662
 96   0.019432 54.230.159.139 -> 172.31.29.138 TCP 26130 [TCP segment of a reassembled PDU]
 97   0.019460 172.31.29.138 -> 54.230.159.139 TCP 66 43929 > http [ACK] Seq=97 Ack=470831 Win=840192 Len=0 TSval=19550294 TSecr=813595662
 98   0.019496 54.230.159.139 -> 172.31.29.138 TCP 26130 [TCP segment of a reassembled PDU]
 99   0.019517 172.31.29.138 -> 54.230.159.139 TCP 66 43929 > http [ACK] Seq=97 Ack=496895 Win=840192 Len=0 TSval=19550294 TSecr=813595662
100   0.019577 54.230.159.139 -> 172.31.29.138 TCP 13098 [TCP segment of a reassembled PDU]
101   0.019588 172.31.29.138 -> 54.230.159.139 TCP 66 43929 > http [ACK] Seq=97 Ack=509927 Win=861696 Len=0 TSval=19550294 TSecr=813595662
102   0.020043 54.230.159.139 -> 172.31.29.138 TCP 13098 [TCP segment of a reassembled PDU]
103   0.020053 172.31.29.138 -> 54.230.159.139 TCP 66 43929 > http [ACK] Seq=97 Ack=522959 Win=861696 Len=0 TSval=19550295 TSecr=813595663
104   0.020193 54.230.159.139 -> 172.31.29.138 TCP 21786 [TCP segment of a reassembled PDU]
105   0.020205 172.31.29.138 -> 54.230.159.139 TCP 66 43929 > http [ACK] Seq=97 Ack=544679 Win=917760 Len=0 TSval=19550295 TSecr=813595663
106   0.020441 54.230.159.139 -> 172.31.29.138 TCP 27578 [TCP segment of a reassembled PDU]
107   0.020455 172.31.29.138 -> 54.230.159.139 TCP 66 43929 > http [ACK] Seq=97 Ack=572191 Win=972800 Len=0 TSval=19550295 TSecr=813595663
108   0.020823 54.230.159.139 -> 172.31.29.138 TCP 5858 [TCP segment of a reassembled PDU]
109   0.020830 172.31.29.138 -> 54.230.159.139 TCP 66 43929 > http [ACK] Seq=97 Ack=577983 Win=984448 Len=0 TSval=19550295 TSecr=813595663
110   0.021021 54.230.159.139 -> 172.31.29.138 TCP 29026 [TCP segment of a reassembled PDU]
111   0.021037 172.31.29.138 -> 54.230.159.139 TCP 66 43929 > http [ACK] Seq=97 Ack=606943 Win=1042304 Len=0 TSval=19550295 TSecr=813595663
112   0.021174 54.230.159.139 -> 172.31.29.138 TCP 15994 [TCP segment of a reassembled PDU]
113   0.021184 172.31.29.138 -> 54.230.159.139 TCP 66 43929 > http [ACK] Seq=97 Ack=622871 Win=1074176 Len=0 TSval=19550295 TSecr=813595663
114   0.021189 54.230.159.139 -> 172.31.29.138 TCP 1514 [TCP Previous segment not captured] [TCP segment of a reassembled PDU]
115   0.021192 172.31.29.138 -> 54.230.159.139 TCP 78 [TCP Window Update] 43929 > http [ACK] Seq=97 Ack=622871 Win=1077120 Len=0 TSval=19550295 TSecr=813595663 SLE=624319 SRE=625767
116   0.021194 54.230.159.139 -> 172.31.29.138 TCP 1514 [TCP Out-Of-Order] [TCP segment of a reassembled PDU]
117   0.021196 172.31.29.138 -> 54.230.159.139 TCP 66 43929 > http [ACK] Seq=97 Ack=625767 Win=1079936 Len=0 TSval=19550295 TSecr=813595663
118   0.021218 54.230.159.139 -> 172.31.29.138 TCP 27578 [TCP segment of a reassembled PDU]
119   0.021231 172.31.29.138 -> 54.230.159.139 TCP 66 43929 > http [ACK] Seq=97 Ack=653279 Win=1134976 Len=0 TSval=19550295 TSecr=813595663
120   0.021796 54.230.159.139 -> 172.31.29.138 TCP 4410 [TCP segment of a reassembled PDU]
121   0.021803 172.31.29.138 -> 54.230.159.139 TCP 66 43929 > http [ACK] Seq=97 Ack=657623 Win=1143680 Len=0 TSval=19550295 TSecr=813595663
122   0.021993 54.230.159.139 -> 172.31.29.138 TCP 26130 [TCP segment of a reassembled PDU]
123   0.022007 172.31.29.138 -> 54.230.159.139 TCP 66 43929 > http [ACK] Seq=97 Ack=683687 Win=1195776 Len=0 TSval=19550295 TSecr=813595663
124   0.022057 54.230.159.139 -> 172.31.29.138 TCP 26130 [TCP segment of a reassembled PDU]
125   0.022071 172.31.29.138 -> 54.230.159.139 TCP 66 43929 > http [ACK] Seq=97 Ack=709751 Win=1248000 Len=0 TSval=19550295 TSecr=813595663
126   0.022163 54.230.159.139 -> 172.31.29.138 TCP 30474 [TCP segment of a reassembled PDU]
127   0.022178 172.31.29.138 -> 54.230.159.139 TCP 66 43929 > http [ACK] Seq=97 Ack=740159 Win=1308800 Len=0 TSval=19550295 TSecr=813595663
128   0.022600 54.230.159.139 -> 172.31.29.138 TCP 4410 [TCP segment of a reassembled PDU]
129   0.022607 172.31.29.138 -> 54.230.159.139 TCP 66 43929 > http [ACK] Seq=97 Ack=744503 Win=1317504 Len=0 TSval=19550295 TSecr=813595663
130   0.022795 54.230.159.139 -> 172.31.29.138 TCP 26130 [TCP segment of a reassembled PDU]
131   0.022809 172.31.29.138 -> 54.230.159.139 TCP 66 43929 > http [ACK] Seq=97 Ack=770567 Win=1369600 Len=0 TSval=19550295 TSecr=813595663
132   0.022815 54.230.159.139 -> 172.31.29.138 TCP 1514 [TCP segment of a reassembled PDU]
133   0.022817 172.31.29.138 -> 54.230.159.139 TCP 66 43929 > http [ACK] Seq=97 Ack=772015 Win=1372416 Len=0 TSval=19550295 TSecr=813595663
134   0.022897 54.230.159.139 -> 172.31.29.138 TCP 33370 [TCP segment of a reassembled PDU]
135   0.022918 172.31.29.138 -> 54.230.159.139 TCP 66 43929 > http [ACK] Seq=97 Ack=805319 Win=1439104 Len=0 TSval=19550295 TSecr=813595663
136   0.023337 54.230.159.139 -> 172.31.29.138 TCP 2962 [TCP segment of a reassembled PDU]
137   0.023342 172.31.29.138 -> 54.230.159.139 TCP 66 43929 > http [ACK] Seq=97 Ack=808215 Win=1444864 Len=0 TSval=19550295 TSecr=813595663
138   0.023538 54.230.159.139 -> 172.31.29.138 TCP 24682 [TCP segment of a reassembled PDU]
139   0.023551 172.31.29.138 -> 54.230.159.139 TCP 66 43929 > http [ACK] Seq=97 Ack=832831 Win=1455232 Len=0 TSval=19550295 TSecr=813595663
140   0.023598 54.230.159.139 -> 172.31.29.138 TCP 10202 [TCP segment of a reassembled PDU]
141   0.023605 172.31.29.138 -> 54.230.159.139 TCP 66 43929 > http [ACK] Seq=97 Ack=842967 Win=1479040 Len=0 TSval=19550295 TSecr=813595663
142   0.023778 54.230.159.139 -> 172.31.29.138 TCP 26130 [TCP segment of a reassembled PDU]
143   0.023791 172.31.29.138 -> 54.230.159.139 TCP 66 43929 > http [ACK] Seq=97 Ack=869031 Win=1453056 Len=0 TSval=19550295 TSecr=813595663
144   0.023840 54.230.159.139 -> 172.31.29.138 TCP 26130 [TCP segment of a reassembled PDU]
145   0.023862 172.31.29.138 -> 54.230.159.139 TCP 66 43929 > http [ACK] Seq=97 Ack=895095 Win=1452928 Len=0 TSval=19550296 TSecr=813595663
146   0.023902 54.230.159.139 -> 172.31.29.138 TCP 10202 [TCP segment of a reassembled PDU]
147   0.023908 172.31.29.138 -> 54.230.159.139 TCP 66 43929 > http [ACK] Seq=97 Ack=905231 Win=1479040 Len=0 TSval=19550296 TSecr=813595663
148   0.024349 54.230.159.139 -> 172.31.29.138 TCP 2962 [TCP segment of a reassembled PDU]
149   0.024354 172.31.29.138 -> 54.230.159.139 TCP 66 43929 > http [ACK] Seq=97 Ack=908127 Win=1490944 Len=0 TSval=19550296 TSecr=813595663
150   0.024491 54.230.159.139 -> 172.31.29.138 TCP 8922 [TCP segment of a reassembled PDU]
151   0.024499 172.31.29.138 -> 54.230.159.139 TCP 66 43929 > http [ACK] Seq=97 Ack=916983 Win=1482112 Len=0 TSval=19550296 TSecr=813595663
152   0.024876 54.230.159.139 -> 172.31.29.138 TCP 5858 [TCP segment of a reassembled PDU]
153   0.024882 172.31.29.138 -> 54.230.159.139 TCP 66 43929 > http [ACK] Seq=97 Ack=922775 Win=1486208 Len=0 TSval=19550296 TSecr=813595663
154   0.025069 54.230.159.139 -> 172.31.29.138 TCP 26130 [TCP segment of a reassembled PDU]
155   0.025083 172.31.29.138 -> 54.230.159.139 TCP 66 43929 > http [ACK] Seq=97 Ack=948839 Win=1460224 Len=0 TSval=19550296 TSecr=813595663
156   0.025093 54.230.159.139 -> 172.31.29.138 TCP 7306 [TCP segment of a reassembled PDU]
157   0.025098 172.31.29.138 -> 54.230.159.139 TCP 66 43929 > http [ACK] Seq=97 Ack=956079 Win=1453056 Len=0 TSval=19550296 TSecr=813595663
158   0.025151 54.230.159.139 -> 172.31.29.138 TCP 26506 [TCP segment of a reassembled PDU]
159   0.025162 172.31.29.138 -> 54.230.159.139 TCP 66 43929 > http [ACK] Seq=97 Ack=982519 Win=1450368 Len=0 TSval=19550296 TSecr=813595663
160   0.026422 54.230.159.139 -> 172.31.29.138 TCP 2962 [TCP segment of a reassembled PDU]
161   0.026428 172.31.29.138 -> 54.230.159.139 TCP 66 43929 > http [ACK] Seq=97 Ack=985415 Win=1490944 Len=0 TSval=19550296 TSecr=813595663
162   0.026624 54.230.159.139 -> 172.31.29.138 TCP 24682 [TCP segment of a reassembled PDU]
163   0.026637 172.31.29.138 -> 54.230.159.139 TCP 66 43929 > http [ACK] Seq=97 Ack=1010031 Win=1466368 Len=0 TSval=19550296 TSecr=813595663
164   0.026757 54.230.159.139 -> 172.31.29.138 TCP 38090 [TCP segment of a reassembled PDU]
165   0.026771 172.31.29.138 -> 54.230.159.139 TCP 66 43929 > http [ACK] Seq=97 Ack=1048055 Win=1431424 Len=0 TSval=19550296 TSecr=813595663
166   0.026776 54.230.159.139 -> 172.31.29.138 HTTP 1045 HTTP/1.1 200 OK  (application/octet-stream)
167   0.026779 172.31.29.138 -> 54.230.159.139 TCP 66 43929 > http [ACK] Seq=97 Ack=1049034 Win=1430528 Len=0 TSval=19550296 TSecr=813595663
168   0.026948 172.31.29.138 -> 54.230.159.139 TCP 66 43929 > http [FIN, ACK] Seq=97 Ack=1049034 Win=1491200 Len=0 TSval=19550296 TSecr=813595663
169   0.027966 54.230.159.139 -> 172.31.29.138 TCP 66 http > 43929 [FIN, ACK] Seq=1049034 Ack=98 Win=14592 Len=0 TSval=813595663 TSecr=19550296
170   0.027975 172.31.29.138 -> 54.230.159.139 TCP 66 43929 > http [ACK] Seq=98 Ack=1049035 Win=1491200 Len=0 TSval=19550297 TSecr=813595663
