[Measurement for 1mb at 04:38:48 20.38.2014] 
Tshark:

  1   0.000000 172.31.29.138 -> 172.31.0.2   DNS 89 Standard query 0x5c47  A d3m1c4hwkgedal.cloudfront.net
  2   0.000039 172.31.29.138 -> 172.31.0.2   DNS 89 Standard query 0xd489  AAAA d3m1c4hwkgedal.cloudfront.net
  3   0.000516   172.31.0.2 -> 172.31.29.138 DNS 217 Standard query response 0x5c47  A 54.192.157.137 A 54.192.157.142 A 54.192.157.144 A 54.230.157.230 A 54.230.158.184 A 54.230.158.225 A 54.230.159.137 A 54.192.156.100
  4   0.000528   172.31.0.2 -> 172.31.29.138 DNS 174 Standard query response 0xd489 
  5   0.003874 172.31.29.138 -> 54.192.157.137 TCP 74 35450 > http [SYN] Seq=0 Win=26883 Len=0 MSS=8961 SACK_PERM=1 TSval=10550243 TSecr=0 WS=128
  6   0.004512 54.192.157.137 -> 172.31.29.138 TCP 74 http > 35450 [SYN, ACK] Seq=0 Ack=1 Win=14480 Len=0 MSS=1460 SACK_PERM=1 TSval=833369909 TSecr=10550243 WS=128
  7   0.004526 172.31.29.138 -> 54.192.157.137 TCP 66 35450 > http [ACK] Seq=1 Ack=1 Win=27008 Len=0 TSval=10550243 TSecr=833369909
  8   0.004566 172.31.29.138 -> 54.192.157.137 HTTP 162 GET /1mb HTTP/1.1 
  9   0.004982 54.192.157.137 -> 172.31.29.138 TCP 66 http > 35450 [ACK] Seq=1 Ack=97 Win=14592 Len=0 TSval=833369909 TSecr=10550243
 10   0.008845 54.192.157.137 -> 172.31.29.138 TCP 2962 [TCP segment of a reassembled PDU]
 11   0.008853 172.31.29.138 -> 54.192.157.137 TCP 66 35450 > http [ACK] Seq=97 Ack=2897 Win=32768 Len=0 TSval=10550244 TSecr=833369909
 12   0.008900 54.192.157.137 -> 172.31.29.138 TCP 10202 [TCP segment of a reassembled PDU]
 13   0.008909 172.31.29.138 -> 54.192.157.137 TCP 66 35450 > http [ACK] Seq=97 Ack=13033 Win=52992 Len=0 TSval=10550244 TSecr=833369909
 14   0.009360 54.192.157.137 -> 172.31.29.138 TCP 7306 [TCP segment of a reassembled PDU]
 15   0.009368 172.31.29.138 -> 54.192.157.137 TCP 66 35450 > http [ACK] Seq=97 Ack=20273 Win=67456 Len=0 TSval=10550244 TSecr=833369909
 16   0.009397 54.192.157.137 -> 172.31.29.138 TCP 5858 [TCP segment of a reassembled PDU]
 17   0.009403 172.31.29.138 -> 54.192.157.137 TCP 66 35450 > http [ACK] Seq=97 Ack=26065 Win=79104 Len=0 TSval=10550244 TSecr=833369909
 18   0.009889 54.192.157.137 -> 172.31.29.138 TCP 2962 [TCP segment of a reassembled PDU]
 19   0.009895 172.31.29.138 -> 54.192.157.137 TCP 66 35450 > http [ACK] Seq=97 Ack=28961 Win=84864 Len=0 TSval=10550244 TSecr=833369909
 20   0.009992 54.192.157.137 -> 172.31.29.138 TCP 17442 [TCP segment of a reassembled PDU]
 21   0.010004 172.31.29.138 -> 54.192.157.137 TCP 66 35450 > http [ACK] Seq=97 Ack=46337 Win=89344 Len=0 TSval=10550244 TSecr=833369909
 22   0.010660 54.192.157.137 -> 172.31.29.138 TCP 2962 [TCP segment of a reassembled PDU]
 23   0.010666 172.31.29.138 -> 54.192.157.137 TCP 66 35450 > http [ACK] Seq=97 Ack=49233 Win=109056 Len=0 TSval=10550245 TSecr=833369909
 24   0.010729 54.192.157.137 -> 172.31.29.138 TCP 2962 [TCP segment of a reassembled PDU]
 25   0.010734 172.31.29.138 -> 54.192.157.137 TCP 66 35450 > http [ACK] Seq=97 Ack=52129 Win=114816 Len=0 TSval=10550245 TSecr=833369909
 26   0.010784 54.192.157.137 -> 172.31.29.138 TCP 17442 [TCP segment of a reassembled PDU]
 27   0.010794 172.31.29.138 -> 54.192.157.137 TCP 66 35450 > http [ACK] Seq=97 Ack=69505 Win=149632 Len=0 TSval=10550245 TSecr=833369909
 28   0.011455 54.192.157.137 -> 172.31.29.138 TCP 5858 [TCP segment of a reassembled PDU]
 29   0.011461 172.31.29.138 -> 54.192.157.137 TCP 66 35450 > http [ACK] Seq=97 Ack=75297 Win=161152 Len=0 TSval=10550245 TSecr=833369909
 30   0.011566 54.192.157.137 -> 172.31.29.138 TCP 21786 [TCP segment of a reassembled PDU]
 31   0.011578 172.31.29.138 -> 54.192.157.137 TCP 66 35450 > http [ACK] Seq=97 Ack=97017 Win=204672 Len=0 TSval=10550245 TSecr=833369909
 32   0.012206 54.192.157.137 -> 172.31.29.138 TCP 2962 [TCP segment of a reassembled PDU]
 33   0.012211 172.31.29.138 -> 54.192.157.137 TCP 66 35450 > http [ACK] Seq=97 Ack=99913 Win=210432 Len=0 TSval=10550245 TSecr=833369909
 34   0.012335 54.192.157.137 -> 172.31.29.138 TCP 20338 [TCP segment of a reassembled PDU]
 35   0.012346 172.31.29.138 -> 54.192.157.137 TCP 66 35450 > http [ACK] Seq=97 Ack=120185 Win=251008 Len=0 TSval=10550245 TSecr=833369909
 36   0.012735 54.192.157.137 -> 172.31.29.138 TCP 1514 [TCP segment of a reassembled PDU]
 37   0.012739 172.31.29.138 -> 54.192.157.137 TCP 66 35450 > http [ACK] Seq=97 Ack=121633 Win=253824 Len=0 TSval=10550245 TSecr=833369909
 38   0.012850 54.192.157.137 -> 172.31.29.138 TCP 10202 [TCP segment of a reassembled PDU]
 39   0.012859 172.31.29.138 -> 54.192.157.137 TCP 66 35450 > http [ACK] Seq=97 Ack=131769 Win=274176 Len=0 TSval=10550245 TSecr=833369909
 40   0.013019 54.192.157.137 -> 172.31.29.138 TCP 10202 [TCP segment of a reassembled PDU]
 41   0.013028 172.31.29.138 -> 54.192.157.137 TCP 66 35450 > http [ACK] Seq=97 Ack=141905 Win=294400 Len=0 TSval=10550245 TSecr=833369909
 42   0.013112 54.192.157.137 -> 172.31.29.138 TCP 11650 [TCP segment of a reassembled PDU]
 43   0.013120 172.31.29.138 -> 54.192.157.137 TCP 66 35450 > http [ACK] Seq=97 Ack=153489 Win=317568 Len=0 TSval=10550245 TSecr=833369909
 44   0.013497 54.192.157.137 -> 172.31.29.138 TCP 4410 [TCP segment of a reassembled PDU]
 45   0.013503 172.31.29.138 -> 54.192.157.137 TCP 66 35450 > http [ACK] Seq=97 Ack=157833 Win=326272 Len=0 TSval=10550245 TSecr=833369909
 46   0.013634 54.192.157.137 -> 172.31.29.138 TCP 21786 [TCP segment of a reassembled PDU]
 47   0.013646 172.31.29.138 -> 54.192.157.137 TCP 66 35450 > http [ACK] Seq=97 Ack=179553 Win=369664 Len=0 TSval=10550245 TSecr=833369909
 48   0.013812 54.192.157.137 -> 172.31.29.138 TCP 13098 [TCP segment of a reassembled PDU]
 49   0.013822 172.31.29.138 -> 54.192.157.137 TCP 66 35450 > http [ACK] Seq=97 Ack=192585 Win=395776 Len=0 TSval=10550245 TSecr=833369909
 50   0.014250 54.192.157.137 -> 172.31.29.138 TCP 2962 [TCP segment of a reassembled PDU]
 51   0.014257 172.31.29.138 -> 54.192.157.137 TCP 66 35450 > http [ACK] Seq=97 Ack=195481 Win=401536 Len=0 TSval=10550246 TSecr=833369909
 52   0.014415 54.192.157.137 -> 172.31.29.138 TCP 20338 [TCP segment of a reassembled PDU]
 53   0.014427 172.31.29.138 -> 54.192.157.137 TCP 66 35450 > http [ACK] Seq=97 Ack=215753 Win=442112 Len=0 TSval=10550246 TSecr=833369909
 54   0.014436 54.192.157.137 -> 172.31.29.138 TCP 4410 [TCP segment of a reassembled PDU]
 55   0.014443 172.31.29.138 -> 54.192.157.137 TCP 66 35450 > http [ACK] Seq=97 Ack=220097 Win=450816 Len=0 TSval=10550246 TSecr=833369909
 56   0.014449 54.192.157.137 -> 172.31.29.138 TCP 1514 [TCP segment of a reassembled PDU]
 57   0.014451 172.31.29.138 -> 54.192.157.137 TCP 66 35450 > http [ACK] Seq=97 Ack=221545 Win=453632 Len=0 TSval=10550246 TSecr=833369909
 58   0.014586 54.192.157.137 -> 172.31.29.138 TCP 5858 [TCP segment of a reassembled PDU]
 59   0.014592 172.31.29.138 -> 54.192.157.137 TCP 66 35450 > http [ACK] Seq=97 Ack=227337 Win=465280 Len=0 TSval=10550246 TSecr=833369910
 60   0.015025 54.192.157.137 -> 172.31.29.138 TCP 2962 [TCP segment of a reassembled PDU]
 61   0.015030 172.31.29.138 -> 54.192.157.137 TCP 66 35450 > http [ACK] Seq=97 Ack=230233 Win=471040 Len=0 TSval=10550246 TSecr=833369910
 62   0.015212 54.192.157.137 -> 172.31.29.138 TCP 26130 [TCP segment of a reassembled PDU]
 63   0.015226 172.31.29.138 -> 54.192.157.137 TCP 66 35450 > http [ACK] Seq=97 Ack=256297 Win=523136 Len=0 TSval=10550246 TSecr=833369910
 64   0.015237 54.192.157.137 -> 172.31.29.138 TCP 5858 [TCP segment of a reassembled PDU]
 65   0.015241 172.31.29.138 -> 54.192.157.137 TCP 66 35450 > http [ACK] Seq=97 Ack=262089 Win=534784 Len=0 TSval=10550246 TSecr=833369910
 66   0.015631 54.192.157.137 -> 172.31.29.138 TCP 20338 [TCP segment of a reassembled PDU]
 67   0.015643 172.31.29.138 -> 54.192.157.137 TCP 66 35450 > http [ACK] Seq=97 Ack=282361 Win=575360 Len=0 TSval=10550246 TSecr=833369910
 68   0.015951 54.192.157.137 -> 172.31.29.138 TCP 26130 [TCP segment of a reassembled PDU]
 69   0.015965 172.31.29.138 -> 54.192.157.137 TCP 66 35450 > http [ACK] Seq=97 Ack=308425 Win=627456 Len=0 TSval=10550246 TSecr=833369910
 70   0.015978 54.192.157.137 -> 172.31.29.138 TCP 8754 [TCP segment of a reassembled PDU]
 71   0.015984 172.31.29.138 -> 54.192.157.137 TCP 66 35450 > http [ACK] Seq=97 Ack=317113 Win=644864 Len=0 TSval=10550246 TSecr=833369910
 72   0.016380 54.192.157.137 -> 172.31.29.138 TCP 21786 [TCP segment of a reassembled PDU]
 73   0.016392 172.31.29.138 -> 54.192.157.137 TCP 66 35450 > http [ACK] Seq=97 Ack=338833 Win=688256 Len=0 TSval=10550246 TSecr=833369910
 74   0.016680 54.192.157.137 -> 172.31.29.138 TCP 18890 [TCP segment of a reassembled PDU]
 75   0.016691 172.31.29.138 -> 54.192.157.137 TCP 66 35450 > http [ACK] Seq=97 Ack=357657 Win=725888 Len=0 TSval=10550246 TSecr=833369910
 76   0.017066 54.192.157.137 -> 172.31.29.138 TCP 7306 [TCP segment of a reassembled PDU]
 77   0.017073 172.31.29.138 -> 54.192.157.137 TCP 66 35450 > http [ACK] Seq=97 Ack=364897 Win=740352 Len=0 TSval=10550246 TSecr=833369910
 78   0.017244 54.192.157.137 -> 172.31.29.138 TCP 26130 [TCP segment of a reassembled PDU]
 79   0.017257 172.31.29.138 -> 54.192.157.137 TCP 66 35450 > http [ACK] Seq=97 Ack=390961 Win=792576 Len=0 TSval=10550246 TSecr=833369910
 80   0.017271 54.192.157.137 -> 172.31.29.138 TCP 8754 [TCP segment of a reassembled PDU]
 81   0.017277 172.31.29.138 -> 54.192.157.137 TCP 66 35450 > http [ACK] Seq=97 Ack=399649 Win=809856 Len=0 TSval=10550246 TSecr=833369910
 82   0.017581 54.192.157.137 -> 172.31.29.138 TCP 7306 [TCP segment of a reassembled PDU]
 83   0.017588 172.31.29.138 -> 54.192.157.137 TCP 66 35450 > http [ACK] Seq=97 Ack=406889 Win=824320 Len=0 TSval=10550246 TSecr=833369910
 84   0.017727 54.192.157.137 -> 172.31.29.138 TCP 15994 [TCP segment of a reassembled PDU]
 85   0.017737 172.31.29.138 -> 54.192.157.137 TCP 66 35450 > http [ACK] Seq=97 Ack=422817 Win=847744 Len=0 TSval=10550246 TSecr=833369910
 86   0.017819 54.192.157.137 -> 172.31.29.138 TCP 4410 [TCP segment of a reassembled PDU]
 87   0.017825 172.31.29.138 -> 54.192.157.137 TCP 66 35450 > http [ACK] Seq=97 Ack=427161 Win=864896 Len=0 TSval=10550246 TSecr=833369910
 88   0.018014 54.192.157.137 -> 172.31.29.138 TCP 29026 [TCP segment of a reassembled PDU]
 89   0.018029 172.31.29.138 -> 54.192.157.137 TCP 66 35450 > http [ACK] Seq=97 Ack=456121 Win=835968 Len=0 TSval=10550246 TSecr=833369910
 90   0.018328 54.192.157.137 -> 172.31.29.138 TCP 2174 [TCP segment of a reassembled PDU]
 91   0.018333 172.31.29.138 -> 54.192.157.137 TCP 66 35450 > http [ACK] Seq=97 Ack=458229 Win=864896 Len=0 TSval=10550247 TSecr=833369910
 92   0.018438 54.192.157.137 -> 172.31.29.138 TCP 24682 [TCP segment of a reassembled PDU]
 93   0.018451 172.31.29.138 -> 54.192.157.137 TCP 66 35450 > http [ACK] Seq=97 Ack=482845 Win=914176 Len=0 TSval=10550247 TSecr=833369910
 94   0.018487 54.192.157.137 -> 172.31.29.138 TCP 13098 [TCP segment of a reassembled PDU]
 95   0.018497 172.31.29.138 -> 54.192.157.137 TCP 66 35450 > http [ACK] Seq=97 Ack=495877 Win=940160 Len=0 TSval=10550247 TSecr=833369910
 96   0.018770 54.192.157.137 -> 172.31.29.138 TCP 21786 [TCP segment of a reassembled PDU]
 97   0.018783 172.31.29.138 -> 54.192.157.137 TCP 66 35450 > http [ACK] Seq=97 Ack=517597 Win=983680 Len=0 TSval=10550247 TSecr=833369910
 98   0.018791 54.192.157.137 -> 172.31.29.138 TCP 4410 [TCP segment of a reassembled PDU]
 99   0.018798 172.31.29.138 -> 54.192.157.137 TCP 66 35450 > http [ACK] Seq=97 Ack=521941 Win=992384 Len=0 TSval=10550247 TSecr=833369910
100   0.018838 54.192.157.137 -> 172.31.29.138 TCP 1890 [TCP segment of a reassembled PDU]
101   0.018844 172.31.29.138 -> 54.192.157.137 TCP 66 35450 > http [ACK] Seq=97 Ack=523765 Win=992384 Len=0 TSval=10550247 TSecr=833369910
102   0.019145 54.192.157.137 -> 172.31.29.138 TCP 2962 [TCP segment of a reassembled PDU]
103   0.019150 172.31.29.138 -> 54.192.157.137 TCP 66 35450 > http [ACK] Seq=97 Ack=526661 Win=998144 Len=0 TSval=10550247 TSecr=833369910
104   0.019343 54.192.157.137 -> 172.31.29.138 TCP 26130 [TCP segment of a reassembled PDU]
105   0.019356 172.31.29.138 -> 54.192.157.137 TCP 66 35450 > http [ACK] Seq=97 Ack=552725 Win=1050240 Len=0 TSval=10550247 TSecr=833369910
106   0.019406 54.192.157.137 -> 172.31.29.138 TCP 26130 [TCP segment of a reassembled PDU]
107   0.019421 172.31.29.138 -> 54.192.157.137 TCP 66 35450 > http [ACK] Seq=97 Ack=578789 Win=1102336 Len=0 TSval=10550247 TSecr=833369910
108   0.019463 54.192.157.137 -> 172.31.29.138 TCP 10578 [TCP segment of a reassembled PDU]
109   0.019472 172.31.29.138 -> 54.192.157.137 TCP 66 35450 > http [ACK] Seq=97 Ack=589301 Win=1123456 Len=0 TSval=10550247 TSecr=833369910
110   0.019914 54.192.157.137 -> 172.31.29.138 TCP 2962 [TCP segment of a reassembled PDU]
111   0.019919 172.31.29.138 -> 54.192.157.137 TCP 66 35450 > http [ACK] Seq=97 Ack=592197 Win=1129216 Len=0 TSval=10550247 TSecr=833369910
112   0.020109 54.192.157.137 -> 172.31.29.138 TCP 26130 [TCP segment of a reassembled PDU]
113   0.020123 172.31.29.138 -> 54.192.157.137 TCP 66 35450 > http [ACK] Seq=97 Ack=618261 Win=1181312 Len=0 TSval=10550247 TSecr=833369910
114   0.020164 54.192.157.137 -> 172.31.29.138 TCP 21786 [TCP segment of a reassembled PDU]
115   0.020176 172.31.29.138 -> 54.192.157.137 TCP 66 35450 > http [ACK] Seq=97 Ack=639981 Win=1200896 Len=0 TSval=10550247 TSecr=833369910
116   0.020192 54.192.157.137 -> 172.31.29.138 TCP 4410 [TCP segment of a reassembled PDU]
117   0.020196 172.31.29.138 -> 54.192.157.137 TCP 66 35450 > http [ACK] Seq=97 Ack=644325 Win=1196672 Len=0 TSval=10550247 TSecr=833369910
118   0.020238 54.192.157.137 -> 172.31.29.138 TCP 10578 [TCP segment of a reassembled PDU]
119   0.020245 172.31.29.138 -> 54.192.157.137 TCP 66 35450 > http [ACK] Seq=97 Ack=654837 Win=1245824 Len=0 TSval=10550247 TSecr=833369910
120   0.020708 54.192.157.137 -> 172.31.29.138 TCP 4410 [TCP segment of a reassembled PDU]
121   0.020715 172.31.29.138 -> 54.192.157.137 TCP 66 35450 > http [ACK] Seq=97 Ack=659181 Win=1254528 Len=0 TSval=10550247 TSecr=833369910
122   0.020901 54.192.157.137 -> 172.31.29.138 TCP 26130 [TCP segment of a reassembled PDU]
123   0.020920 54.192.157.137 -> 172.31.29.138 TCP 7306 [TCP segment of a reassembled PDU]
124   0.020929 54.192.157.137 -> 172.31.29.138 TCP 8754 [TCP segment of a reassembled PDU]
125   0.020945 172.31.29.138 -> 54.192.157.137 TCP 66 35450 > http [ACK] Seq=97 Ack=701173 Win=1212544 Len=0 TSval=10550247 TSecr=833369910
126   0.020987 54.192.157.137 -> 172.31.29.138 TCP 19266 [TCP segment of a reassembled PDU]
127   0.020997 172.31.29.138 -> 54.192.157.137 TCP 66 35450 > http [ACK] Seq=97 Ack=720373 Win=1246208 Len=0 TSval=10550247 TSecr=833369910
128   0.023291 54.192.157.137 -> 172.31.29.138 TCP 4410 [TCP segment of a reassembled PDU]
129   0.023297 172.31.29.138 -> 54.192.157.137 TCP 66 35450 > http [ACK] Seq=97 Ack=724717 Win=1263232 Len=0 TSval=10550248 TSecr=833369910
130   0.023468 54.192.157.137 -> 172.31.29.138 TCP 21786 [TCP segment of a reassembled PDU]
131   0.023498 54.192.157.137 -> 172.31.29.138 TCP 4410 [TCP segment of a reassembled PDU]
132   0.023538 172.31.29.138 -> 54.192.157.137 TCP 66 35450 > http [ACK] Seq=97 Ack=750781 Win=1237248 Len=0 TSval=10550248 TSecr=833369910
133   0.023590 54.192.157.137 -> 172.31.29.138 TCP 35194 [TCP segment of a reassembled PDU]
134   0.023622 172.31.29.138 -> 54.192.157.137 TCP 66 35450 > http [ACK] Seq=97 Ack=785909 Win=1219968 Len=0 TSval=10550248 TSecr=833369910
135   0.026352 54.192.157.137 -> 172.31.29.138 TCP 2962 [TCP segment of a reassembled PDU]
136   0.026358 172.31.29.138 -> 54.192.157.137 TCP 66 35450 > http [ACK] Seq=97 Ack=788805 Win=1268992 Len=0 TSval=10550249 TSecr=833369911
137   0.026533 54.192.157.137 -> 172.31.29.138 TCP 18890 [TCP segment of a reassembled PDU]
138   0.026552 172.31.29.138 -> 54.192.157.137 TCP 66 35450 > http [ACK] Seq=97 Ack=807629 Win=1250176 Len=0 TSval=10550249 TSecr=833369911
139   0.026576 54.192.157.137 -> 172.31.29.138 TCP 7306 [TCP segment of a reassembled PDU]
140   0.026582 172.31.29.138 -> 54.192.157.137 TCP 66 35450 > http [ACK] Seq=97 Ack=814869 Win=1267584 Len=0 TSval=10550249 TSecr=833369911
141   0.026711 54.192.157.137 -> 172.31.29.138 TCP 36642 [TCP segment of a reassembled PDU]
142   0.026740 172.31.29.138 -> 54.192.157.137 TCP 66 35450 > http [ACK] Seq=97 Ack=851445 Win=1231104 Len=0 TSval=10550249 TSecr=833369911
143   0.027384 54.192.157.137 -> 172.31.29.138 TCP 5858 [TCP segment of a reassembled PDU]
144   0.027391 172.31.29.138 -> 54.192.157.137 TCP 66 35450 > http [ACK] Seq=97 Ack=857237 Win=1270016 Len=0 TSval=10550249 TSecr=833369911
145   0.027573 54.192.157.137 -> 172.31.29.138 TCP 26130 [TCP segment of a reassembled PDU]
146   0.027593 54.192.157.137 -> 172.31.29.138 TCP 8754 [TCP segment of a reassembled PDU]
147   0.027610 54.192.157.137 -> 172.31.29.138 TCP 17442 [TCP segment of a reassembled PDU]
148   0.027622 54.192.157.137 -> 172.31.29.138 TCP 7682 [TCP segment of a reassembled PDU]
149   0.027637 172.31.29.138 -> 54.192.157.137 TCP 66 35450 > http [ACK] Seq=97 Ack=916981 Win=1210368 Len=0 TSval=10550249 TSecr=833369911
150   0.029561 54.192.157.137 -> 172.31.29.138 TCP 4410 [TCP segment of a reassembled PDU]
151   0.029567 172.31.29.138 -> 54.192.157.137 TCP 66 35450 > http [ACK] Seq=97 Ack=921325 Win=1272320 Len=0 TSval=10550249 TSecr=833369911
152   0.029757 54.192.157.137 -> 172.31.29.138 TCP 26130 [TCP segment of a reassembled PDU]
153   0.029772 54.192.157.137 -> 172.31.29.138 TCP 1514 [TCP segment of a reassembled PDU]
154   0.029783 54.192.157.137 -> 172.31.29.138 TCP 8754 [TCP segment of a reassembled PDU]
155   0.029796 54.192.157.137 -> 172.31.29.138 TCP 13098 [TCP segment of a reassembled PDU]
156   0.029817 54.192.157.137 -> 172.31.29.138 TCP 2962 [TCP segment of a reassembled PDU]
157   0.029828 172.31.29.138 -> 54.192.157.137 TCP 66 35450 > http [ACK] Seq=97 Ack=973453 Win=1220224 Len=0 TSval=10550249 TSecr=833369911
158   0.029856 54.192.157.137 -> 172.31.29.138 TCP 9130 [TCP segment of a reassembled PDU]
159   0.029870 172.31.29.138 -> 54.192.157.137 TCP 66 35450 > http [ACK] Seq=97 Ack=982517 Win=1236736 Len=0 TSval=10550249 TSecr=833369911
160   0.030561 54.192.157.137 -> 172.31.29.138 TCP 2962 [TCP segment of a reassembled PDU]
161   0.030568 172.31.29.138 -> 54.192.157.137 TCP 66 35450 > http [ACK] Seq=97 Ack=985413 Win=1274752 Len=0 TSval=10550250 TSecr=833369911
162   0.030765 54.192.157.137 -> 172.31.29.138 TCP 27578 [TCP segment of a reassembled PDU]
163   0.030781 54.192.157.137 -> 172.31.29.138 TCP 1514 [TCP Previous segment not captured] [TCP segment of a reassembled PDU]
164   0.030785 172.31.29.138 -> 54.192.157.137 TCP 78 35450 > http [ACK] Seq=97 Ack=1012925 Win=1247360 Len=0 TSval=10550250 TSecr=833369911 SLE=1014373 SRE=1015821
165   0.030790 54.192.157.137 -> 172.31.29.138 TCP 1514 [TCP Out-Of-Order] [TCP segment of a reassembled PDU]
166   0.030793 172.31.29.138 -> 54.192.157.137 TCP 66 35450 > http [ACK] Seq=97 Ack=1015821 Win=1244544 Len=0 TSval=10550250 TSecr=833369911
167   0.030979 54.192.157.137 -> 172.31.29.138 TCP 32298 [TCP segment of a reassembled PDU]
168   0.030992 172.31.29.138 -> 54.192.157.137 TCP 66 35450 > http [ACK] Seq=97 Ack=1048053 Win=1224704 Len=0 TSval=10550250 TSecr=833369911
169   0.030997 54.192.157.137 -> 172.31.29.138 HTTP 1047 HTTP/1.1 200 OK  (application/octet-stream)
170   0.030999 172.31.29.138 -> 54.192.157.137 TCP 66 35450 > http [ACK] Seq=97 Ack=1049034 Win=1223808 Len=0 TSval=10550250 TSecr=833369911
171   0.031135 172.31.29.138 -> 54.192.157.137 TCP 66 35450 > http [FIN, ACK] Seq=97 Ack=1049034 Win=1278720 Len=0 TSval=10550250 TSecr=833369911
172   0.031594 54.192.157.137 -> 172.31.29.138 TCP 66 http > 35450 [FIN, ACK] Seq=1049034 Ack=98 Win=14592 Len=0 TSval=833369911 TSecr=10550250
173   0.031602 172.31.29.138 -> 54.192.157.137 TCP 66 35450 > http [ACK] Seq=98 Ack=1049035 Win=1278720 Len=0 TSval=10550250 TSecr=833369911
