[Measurement for 1mb at 01:38:47 20.38.2014] 
Tshark:

  1   0.000000 172.31.29.138 -> 172.31.0.2   DNS 89 Standard query 0xb1e3  A d3m1c4hwkgedal.cloudfront.net
  2   0.000024 172.31.29.138 -> 172.31.0.2   DNS 89 Standard query 0x7bcb  AAAA d3m1c4hwkgedal.cloudfront.net
  3   0.000742   172.31.0.2 -> 172.31.29.138 DNS 217 Standard query response 0xb1e3  A 54.230.158.80 A 54.230.158.139 A 54.230.158.152 A 54.230.159.4 A 54.192.157.146 A 54.192.159.174 A 54.230.156.40 A 54.230.156.193
  4   0.000753   172.31.0.2 -> 172.31.29.138 DNS 174 Standard query response 0x7bcb 
  5   0.003889 172.31.29.138 -> 54.230.158.80 TCP 74 48851 > http [SYN] Seq=0 Win=26883 Len=0 MSS=8961 SACK_PERM=1 TSval=7850062 TSecr=0 WS=128
  6   0.004808 54.230.158.80 -> 172.31.29.138 TCP 74 http > 48851 [SYN, ACK] Seq=0 Ack=1 Win=14480 Len=0 MSS=1460 SACK_PERM=1 TSval=832588141 TSecr=7850062 WS=128
  7   0.004823 172.31.29.138 -> 54.230.158.80 TCP 66 48851 > http [ACK] Seq=1 Ack=1 Win=27008 Len=0 TSval=7850062 TSecr=832588141
  8   0.004865 172.31.29.138 -> 54.230.158.80 HTTP 162 GET /1mb HTTP/1.1 
  9   0.005487 54.230.158.80 -> 172.31.29.138 TCP 66 http > 48851 [ACK] Seq=1 Ack=97 Win=14592 Len=0 TSval=832588141 TSecr=7850062
 10   0.007612 54.230.158.80 -> 172.31.29.138 TCP 2580 [TCP segment of a reassembled PDU]
 11   0.007621 172.31.29.138 -> 54.230.158.80 TCP 66 48851 > http [ACK] Seq=97 Ack=2515 Win=32000 Len=0 TSval=7850063 TSecr=832588141
 12   0.007767 54.230.158.80 -> 172.31.29.138 TCP 11650 [TCP segment of a reassembled PDU]
 13   0.007779 172.31.29.138 -> 54.230.158.80 TCP 66 48851 > http [ACK] Seq=97 Ack=14099 Win=55168 Len=0 TSval=7850063 TSecr=832588141
 14   0.008374 54.230.158.80 -> 172.31.29.138 TCP 4410 [TCP segment of a reassembled PDU]
 15   0.008381 172.31.29.138 -> 54.230.158.80 TCP 66 48851 > http [ACK] Seq=97 Ack=18443 Win=63872 Len=0 TSval=7850063 TSecr=832588141
 16   0.008424 54.230.158.80 -> 172.31.29.138 TCP 8754 [TCP segment of a reassembled PDU]
 17   0.008431 172.31.29.138 -> 54.230.158.80 TCP 66 48851 > http [ACK] Seq=97 Ack=27131 Win=81152 Len=0 TSval=7850063 TSecr=832588141
 18   0.008911 54.230.158.80 -> 172.31.29.138 TCP 5858 [TCP segment of a reassembled PDU]
 19   0.008919 172.31.29.138 -> 54.230.158.80 TCP 66 48851 > http [ACK] Seq=97 Ack=32923 Win=92800 Len=0 TSval=7850063 TSecr=832588141
 20   0.008992 54.230.158.80 -> 172.31.29.138 TCP 14546 [TCP segment of a reassembled PDU]
 21   0.009002 172.31.29.138 -> 54.230.158.80 TCP 66 48851 > http [ACK] Seq=97 Ack=47403 Win=94080 Len=0 TSval=7850063 TSecr=832588141
 22   0.009623 54.230.158.80 -> 172.31.29.138 TCP 5858 [TCP segment of a reassembled PDU]
 23   0.009630 172.31.29.138 -> 54.230.158.80 TCP 66 48851 > http [ACK] Seq=97 Ack=53195 Win=108416 Len=0 TSval=7850063 TSecr=832588141
 24   0.009686 54.230.158.80 -> 172.31.29.138 TCP 13098 [TCP segment of a reassembled PDU]
 25   0.009696 172.31.29.138 -> 54.230.158.80 TCP 66 48851 > http [ACK] Seq=97 Ack=66227 Win=96512 Len=0 TSval=7850063 TSecr=832588141
 26   0.010189 54.230.158.80 -> 172.31.29.138 TCP 7306 [TCP segment of a reassembled PDU]
 27   0.010196 172.31.29.138 -> 54.230.158.80 TCP 66 48851 > http [ACK] Seq=97 Ack=73467 Win=105984 Len=0 TSval=7850063 TSecr=832588141
 28   0.010228 54.230.158.80 -> 172.31.29.138 TCP 5858 [TCP segment of a reassembled PDU]
 29   0.010234 172.31.29.138 -> 54.230.158.80 TCP 66 48851 > http [ACK] Seq=97 Ack=79259 Win=108416 Len=0 TSval=7850063 TSecr=832588141
 30   0.010291 54.230.158.80 -> 172.31.29.138 TCP 13098 [TCP segment of a reassembled PDU]
 31   0.010301 172.31.29.138 -> 54.230.158.80 TCP 66 48851 > http [ACK] Seq=97 Ack=92291 Win=96512 Len=0 TSval=7850063 TSecr=832588141
 32   0.010653 54.230.158.80 -> 172.31.29.138 TCP 2962 [TCP segment of a reassembled PDU]
 33   0.010658 172.31.29.138 -> 54.230.158.80 TCP 66 48851 > http [ACK] Seq=97 Ack=95187 Win=109056 Len=0 TSval=7850063 TSecr=832588142
 34   0.010881 54.230.158.80 -> 172.31.29.138 TCP 2962 [TCP segment of a reassembled PDU]
 35   0.010886 172.31.29.138 -> 54.230.158.80 TCP 66 48851 > http [ACK] Seq=97 Ack=98083 Win=109056 Len=0 TSval=7850063 TSecr=832588142
 36   0.010961 54.230.158.80 -> 172.31.29.138 TCP 13098 [TCP segment of a reassembled PDU]
 37   0.010970 172.31.29.138 -> 54.230.158.80 TCP 66 48851 > http [ACK] Seq=97 Ack=111115 Win=96512 Len=0 TSval=7850063 TSecr=832588142
 38   0.010983 54.230.158.80 -> 172.31.29.138 TCP 1514 [TCP segment of a reassembled PDU]
 39   0.010992 54.230.158.80 -> 172.31.29.138 TCP 2962 [TCP segment of a reassembled PDU]
 40   0.011013 172.31.29.138 -> 54.230.158.80 TCP 66 48851 > http [ACK] Seq=97 Ack=115459 Win=109056 Len=0 TSval=7850063 TSecr=832588142
 41   0.011045 54.230.158.80 -> 172.31.29.138 TCP 7306 [TCP segment of a reassembled PDU]
 42   0.011065 172.31.29.138 -> 54.230.158.80 TCP 66 48851 > http [ACK] Seq=97 Ack=122699 Win=109056 Len=0 TSval=7850063 TSecr=832588142
 43   0.011160 54.230.158.80 -> 172.31.29.138 TCP 1514 [TCP segment of a reassembled PDU]
 44   0.011235 54.230.158.80 -> 172.31.29.138 TCP 2962 [TCP segment of a reassembled PDU]
 45   0.011241 172.31.29.138 -> 54.230.158.80 TCP 66 48851 > http [ACK] Seq=97 Ack=127043 Win=109056 Len=0 TSval=7850064 TSecr=832588142
 46   0.011657 54.230.158.80 -> 172.31.29.138 TCP 4410 [TCP segment of a reassembled PDU]
 47   0.011663 172.31.29.138 -> 54.230.158.80 TCP 66 48851 > http [ACK] Seq=97 Ack=131387 Win=117760 Len=0 TSval=7850064 TSecr=832588142
 48   0.011758 54.230.158.80 -> 172.31.29.138 TCP 11650 [TCP segment of a reassembled PDU]
 49   0.011766 172.31.29.138 -> 54.230.158.80 TCP 66 48851 > http [ACK] Seq=97 Ack=142971 Win=140928 Len=0 TSval=7850064 TSecr=832588142
 50   0.011906 54.230.158.80 -> 172.31.29.138 TCP 4410 [TCP segment of a reassembled PDU]
 51   0.011912 172.31.29.138 -> 54.230.158.80 TCP 66 48851 > http [ACK] Seq=97 Ack=147315 Win=149632 Len=0 TSval=7850064 TSecr=832588142
 52   0.012017 54.230.158.80 -> 172.31.29.138 TCP 11650 [TCP segment of a reassembled PDU]
 53   0.012026 172.31.29.138 -> 54.230.158.80 TCP 66 48851 > http [ACK] Seq=97 Ack=158899 Win=172800 Len=0 TSval=7850064 TSecr=832588142
 54   0.012418 54.230.158.80 -> 172.31.29.138 TCP 4410 [TCP segment of a reassembled PDU]
 55   0.012424 172.31.29.138 -> 54.230.158.80 TCP 66 48851 > http [ACK] Seq=97 Ack=163243 Win=181504 Len=0 TSval=7850064 TSecr=832588142
 56   0.012528 54.230.158.80 -> 172.31.29.138 TCP 11650 [TCP segment of a reassembled PDU]
 57   0.012536 172.31.29.138 -> 54.230.158.80 TCP 66 48851 > http [ACK] Seq=97 Ack=174827 Win=204672 Len=0 TSval=7850064 TSecr=832588142
 58   0.012578 54.230.158.80 -> 172.31.29.138 TCP 15994 [TCP segment of a reassembled PDU]
 59   0.012588 172.31.29.138 -> 54.230.158.80 TCP 66 48851 > http [ACK] Seq=97 Ack=190755 Win=236544 Len=0 TSval=7850064 TSecr=832588142
 60   0.012973 54.230.158.80 -> 172.31.29.138 TCP 4410 [TCP segment of a reassembled PDU]
 61   0.012979 172.31.29.138 -> 54.230.158.80 TCP 66 48851 > http [ACK] Seq=97 Ack=195099 Win=245120 Len=0 TSval=7850064 TSecr=832588142
 62   0.013145 54.230.158.80 -> 172.31.29.138 TCP 26130 [TCP segment of a reassembled PDU]
 63   0.013160 172.31.29.138 -> 54.230.158.80 TCP 66 48851 > http [ACK] Seq=97 Ack=221163 Win=297344 Len=0 TSval=7850064 TSecr=832588142
 64   0.013237 54.230.158.80 -> 172.31.29.138 TCP 15994 [TCP segment of a reassembled PDU]
 65   0.013248 172.31.29.138 -> 54.230.158.80 TCP 66 48851 > http [ACK] Seq=97 Ack=237091 Win=329216 Len=0 TSval=7850064 TSecr=832588142
 66   0.013724 54.230.158.80 -> 172.31.29.138 TCP 5858 [TCP segment of a reassembled PDU]
 67   0.013730 172.31.29.138 -> 54.230.158.80 TCP 66 48851 > http [ACK] Seq=97 Ack=242883 Win=340736 Len=0 TSval=7850064 TSecr=832588142
 68   0.013896 54.230.158.80 -> 172.31.29.138 TCP 26130 [TCP segment of a reassembled PDU]
 69   0.013910 172.31.29.138 -> 54.230.158.80 TCP 66 48851 > http [ACK] Seq=97 Ack=268947 Win=392832 Len=0 TSval=7850064 TSecr=832588142
 70   0.013924 54.230.158.80 -> 172.31.29.138 TCP 14546 [TCP segment of a reassembled PDU]
 71   0.013935 172.31.29.138 -> 54.230.158.80 TCP 66 48851 > http [ACK] Seq=97 Ack=283427 Win=421888 Len=0 TSval=7850064 TSecr=832588142
 72   0.014736 54.230.158.80 -> 172.31.29.138 TCP 5858 [TCP segment of a reassembled PDU]
 73   0.014743 172.31.29.138 -> 54.230.158.80 TCP 66 48851 > http [ACK] Seq=97 Ack=289219 Win=433408 Len=0 TSval=7850064 TSecr=832588142
 74   0.014912 54.230.158.80 -> 172.31.29.138 TCP 26130 [TCP segment of a reassembled PDU]
 75   0.014927 172.31.29.138 -> 54.230.158.80 TCP 66 48851 > http [ACK] Seq=97 Ack=315283 Win=485504 Len=0 TSval=7850064 TSecr=832588142
 76   0.014948 54.230.158.80 -> 172.31.29.138 TCP 21786 [TCP segment of a reassembled PDU]
 77   0.014959 172.31.29.138 -> 54.230.158.80 TCP 66 48851 > http [ACK] Seq=97 Ack=337003 Win=529024 Len=0 TSval=7850064 TSecr=832588142
 78   0.015749 54.230.158.80 -> 172.31.29.138 TCP 2962 [TCP segment of a reassembled PDU]
 79   0.015756 172.31.29.138 -> 54.230.158.80 TCP 66 48851 > http [ACK] Seq=97 Ack=339899 Win=534784 Len=0 TSval=7850065 TSecr=832588142
 80   0.015936 54.230.158.80 -> 172.31.29.138 TCP 26130 [TCP segment of a reassembled PDU]
 81   0.015949 172.31.29.138 -> 54.230.158.80 TCP 66 48851 > http [ACK] Seq=97 Ack=365963 Win=586880 Len=0 TSval=7850065 TSecr=832588142
 82   0.015963 54.230.158.80 -> 172.31.29.138 TCP 11650 [TCP segment of a reassembled PDU]
 83   0.015973 172.31.29.138 -> 54.230.158.80 TCP 66 48851 > http [ACK] Seq=97 Ack=377547 Win=610048 Len=0 TSval=7850065 TSecr=832588142
 84   0.015985 54.230.158.80 -> 172.31.29.138 TCP 13098 [TCP segment of a reassembled PDU]
 85   0.015991 172.31.29.138 -> 54.230.158.80 TCP 66 48851 > http [ACK] Seq=97 Ack=390579 Win=636160 Len=0 TSval=7850065 TSecr=832588142
 86   0.016578 54.230.158.80 -> 172.31.29.138 TCP 2962 [TCP segment of a reassembled PDU]
 87   0.016584 172.31.29.138 -> 54.230.158.80 TCP 66 48851 > http [ACK] Seq=97 Ack=393475 Win=641920 Len=0 TSval=7850065 TSecr=832588142
 88   0.016774 54.230.158.80 -> 172.31.29.138 TCP 26130 [TCP segment of a reassembled PDU]
 89   0.016788 172.31.29.138 -> 54.230.158.80 TCP 66 48851 > http [ACK] Seq=97 Ack=419539 Win=694016 Len=0 TSval=7850065 TSecr=832588142
 90   0.016813 54.230.158.80 -> 172.31.29.138 TCP 8754 [TCP segment of a reassembled PDU]
 91   0.016821 172.31.29.138 -> 54.230.158.80 TCP 66 48851 > http [ACK] Seq=97 Ack=428227 Win=711424 Len=0 TSval=7850065 TSecr=832588142
 92   0.016835 54.230.158.80 -> 172.31.29.138 TCP 15994 [TCP segment of a reassembled PDU]
 93   0.016842 172.31.29.138 -> 54.230.158.80 TCP 66 48851 > http [ACK] Seq=97 Ack=444155 Win=743296 Len=0 TSval=7850065 TSecr=832588142
 94   0.017554 54.230.158.80 -> 172.31.29.138 TCP 5858 [TCP segment of a reassembled PDU]
 95   0.017561 172.31.29.138 -> 54.230.158.80 TCP 66 48851 > http [ACK] Seq=97 Ack=449947 Win=754816 Len=0 TSval=7850065 TSecr=832588142
 96   0.017724 54.230.158.80 -> 172.31.29.138 TCP 26130 [TCP segment of a reassembled PDU]
 97   0.017738 172.31.29.138 -> 54.230.158.80 TCP 66 48851 > http [ACK] Seq=97 Ack=476011 Win=807040 Len=0 TSval=7850065 TSecr=832588142
 98   0.017747 54.230.158.80 -> 172.31.29.138 TCP 5858 [TCP segment of a reassembled PDU]
 99   0.017751 172.31.29.138 -> 54.230.158.80 TCP 66 48851 > http [ACK] Seq=97 Ack=481803 Win=818560 Len=0 TSval=7850065 TSecr=832588142
100   0.017767 54.230.158.80 -> 172.31.29.138 TCP 15994 [TCP segment of a reassembled PDU]
101   0.017773 172.31.29.138 -> 54.230.158.80 TCP 66 48851 > http [ACK] Seq=97 Ack=497731 Win=850432 Len=0 TSval=7850065 TSecr=832588142
102   0.018088 54.230.158.80 -> 172.31.29.138 TCP 5858 [TCP segment of a reassembled PDU]
103   0.018095 172.31.29.138 -> 54.230.158.80 TCP 66 48851 > http [ACK] Seq=97 Ack=503523 Win=862080 Len=0 TSval=7850065 TSecr=832588142
104   0.018256 54.230.158.80 -> 172.31.29.138 TCP 21786 [TCP segment of a reassembled PDU]
105   0.018268 172.31.29.138 -> 54.230.158.80 TCP 66 48851 > http [ACK] Seq=97 Ack=525243 Win=905472 Len=0 TSval=7850065 TSecr=832588142
106   0.018341 54.230.158.80 -> 172.31.29.138 TCP 4410 [TCP segment of a reassembled PDU]
107   0.018347 172.31.29.138 -> 54.230.158.80 TCP 66 48851 > http [ACK] Seq=97 Ack=529587 Win=914176 Len=0 TSval=7850065 TSecr=832588142
108   0.018508 54.230.158.80 -> 172.31.29.138 TCP 21786 [TCP segment of a reassembled PDU]
109   0.018519 172.31.29.138 -> 54.230.158.80 TCP 66 48851 > http [ACK] Seq=97 Ack=551307 Win=957568 Len=0 TSval=7850065 TSecr=832588142
110   0.018663 54.230.158.80 -> 172.31.29.138 TCP 10202 [TCP segment of a reassembled PDU]
111   0.018671 172.31.29.138 -> 54.230.158.80 TCP 66 48851 > http [ACK] Seq=97 Ack=561443 Win=977920 Len=0 TSval=7850065 TSecr=832588142
112   0.018831 54.230.158.80 -> 172.31.29.138 TCP 23234 [TCP segment of a reassembled PDU]
113   0.018843 172.31.29.138 -> 54.230.158.80 TCP 66 48851 > http [ACK] Seq=97 Ack=584611 Win=1024256 Len=0 TSval=7850065 TSecr=832588142
114   0.018947 54.230.158.80 -> 172.31.29.138 TCP 29026 [TCP segment of a reassembled PDU]
115   0.018962 172.31.29.138 -> 54.230.158.80 TCP 66 48851 > http [ACK] Seq=97 Ack=613571 Win=1082112 Len=0 TSval=7850065 TSecr=832588142
116   0.019157 54.230.158.80 -> 172.31.29.138 TCP 11650 [TCP segment of a reassembled PDU]
117   0.019167 172.31.29.138 -> 54.230.158.80 TCP 66 48851 > http [ACK] Seq=97 Ack=625155 Win=1105280 Len=0 TSval=7850066 TSecr=832588142
118   0.019321 54.230.158.80 -> 172.31.29.138 TCP 21786 [TCP segment of a reassembled PDU]
119   0.019332 172.31.29.138 -> 54.230.158.80 TCP 66 48851 > http [ACK] Seq=97 Ack=646875 Win=1108608 Len=0 TSval=7850066 TSecr=832588142
120   0.019351 54.230.158.80 -> 172.31.29.138 TCP 1514 [TCP segment of a reassembled PDU]
121   0.019711 54.230.158.80 -> 172.31.29.138 TCP 26130 [TCP segment of a reassembled PDU]
122   0.019737 172.31.29.138 -> 54.230.158.80 TCP 66 48851 > http [ACK] Seq=97 Ack=674387 Win=1101568 Len=0 TSval=7850066 TSecr=832588142
123   0.019775 54.230.158.80 -> 172.31.29.138 TCP 7306 [TCP segment of a reassembled PDU]
124   0.019781 172.31.29.138 -> 54.230.158.80 TCP 66 48851 > http [ACK] Seq=97 Ack=681627 Win=1132416 Len=0 TSval=7850066 TSecr=832588142
125   0.019879 54.230.158.80 -> 172.31.29.138 TCP 27578 [TCP segment of a reassembled PDU]
126   0.019907 54.230.158.80 -> 172.31.29.138 TCP 7306 [TCP segment of a reassembled PDU]
127   0.019931 172.31.29.138 -> 54.230.158.80 TCP 66 48851 > http [ACK] Seq=97 Ack=716379 Win=1097728 Len=0 TSval=7850066 TSecr=832588142
128   0.020388 54.230.158.80 -> 172.31.29.138 TCP 8754 [TCP segment of a reassembled PDU]
129   0.020396 172.31.29.138 -> 54.230.158.80 TCP 66 48851 > http [ACK] Seq=97 Ack=725067 Win=1130112 Len=0 TSval=7850066 TSecr=832588142
130   0.020544 54.230.158.80 -> 172.31.29.138 TCP 21786 [TCP segment of a reassembled PDU]
131   0.020568 172.31.29.138 -> 54.230.158.80 TCP 66 48851 > http [ACK] Seq=97 Ack=746787 Win=1108608 Len=0 TSval=7850066 TSecr=832588142
132   0.020598 54.230.158.80 -> 172.31.29.138 TCP 2962 [TCP segment of a reassembled PDU]
133   0.020603 172.31.29.138 -> 54.230.158.80 TCP 66 48851 > http [ACK] Seq=97 Ack=749683 Win=1137792 Len=0 TSval=7850066 TSecr=832588143
134   0.020801 54.230.158.80 -> 172.31.29.138 TCP 21786 [TCP segment of a reassembled PDU]
135   0.020823 54.230.158.80 -> 172.31.29.138 TCP 4410 [TCP segment of a reassembled PDU]
136   0.020834 172.31.29.138 -> 54.230.158.80 TCP 66 48851 > http [ACK] Seq=97 Ack=775747 Win=1111808 Len=0 TSval=7850066 TSecr=832588143
137   0.020885 54.230.158.80 -> 172.31.29.138 TCP 26130 [TCP segment of a reassembled PDU]
138   0.020917 54.230.158.80 -> 172.31.29.138 TCP 10202 [TCP segment of a reassembled PDU]
139   0.020925 172.31.29.138 -> 54.230.158.80 TCP 66 48851 > http [ACK] Seq=97 Ack=801811 Win=1101568 Len=0 TSval=7850066 TSecr=832588143
140   0.020940 172.31.29.138 -> 54.230.158.80 TCP 66 48851 > http [ACK] Seq=97 Ack=811947 Win=1127680 Len=0 TSval=7850066 TSecr=832588143
141   0.021380 54.230.158.80 -> 172.31.29.138 TCP 4410 [TCP segment of a reassembled PDU]
142   0.021386 172.31.29.138 -> 54.230.158.80 TCP 66 48851 > http [ACK] Seq=97 Ack=816291 Win=1137152 Len=0 TSval=7850066 TSecr=832588143
143   0.021557 54.230.158.80 -> 172.31.29.138 TCP 17442 [TCP segment of a reassembled PDU]
144   0.021580 172.31.29.138 -> 54.230.158.80 TCP 66 48851 > http [ACK] Seq=97 Ack=833667 Win=1119872 Len=0 TSval=7850066 TSecr=832588143
145   0.021622 54.230.158.80 -> 172.31.29.138 TCP 8754 [TCP segment of a reassembled PDU]
146   0.021628 172.31.29.138 -> 54.230.158.80 TCP 66 48851 > http [ACK] Seq=97 Ack=842355 Win=1130112 Len=0 TSval=7850066 TSecr=832588143
147   0.021704 54.230.158.80 -> 172.31.29.138 TCP 34818 [TCP segment of a reassembled PDU]
148   0.021765 54.230.158.80 -> 172.31.29.138 TCP 18890 [TCP segment of a reassembled PDU]
149   0.021792 54.230.158.80 -> 172.31.29.138 TCP 7306 [TCP segment of a reassembled PDU]
150   0.021818 54.230.158.80 -> 172.31.29.138 TCP 14546 [TCP segment of a reassembled PDU]
151   0.021933 172.31.29.138 -> 54.230.158.80 TCP 66 48851 > http [ACK] Seq=97 Ack=917651 Win=1054848 Len=0 TSval=7850066 TSecr=832588143
152   0.022403 54.230.158.80 -> 172.31.29.138 TCP 5858 [TCP segment of a reassembled PDU]
153   0.022410 172.31.29.138 -> 54.230.158.80 TCP 66 48851 > http [ACK] Seq=97 Ack=923443 Win=1134848 Len=0 TSval=7850066 TSecr=832588143
154   0.022600 54.230.158.80 -> 172.31.29.138 TCP 26130 [TCP segment of a reassembled PDU]
155   0.022618 54.230.158.80 -> 172.31.29.138 TCP 8754 [TCP segment of a reassembled PDU]
156   0.022636 172.31.29.138 -> 54.230.158.80 TCP 66 48851 > http [ACK] Seq=97 Ack=958195 Win=1100160 Len=0 TSval=7850066 TSecr=832588143
157   0.022659 54.230.158.80 -> 172.31.29.138 TCP 17442 [TCP segment of a reassembled PDU]
158   0.022676 172.31.29.138 -> 54.230.158.80 TCP 66 48851 > http [ACK] Seq=97 Ack=975571 Win=1101440 Len=0 TSval=7850066 TSecr=832588143
159   0.022745 54.230.158.80 -> 172.31.29.138 TCP 31922 [TCP segment of a reassembled PDU]
160   0.022883 172.31.29.138 -> 54.230.158.80 TCP 66 48851 > http [ACK] Seq=97 Ack=1007427 Win=1091968 Len=0 TSval=7850066 TSecr=832588143
161   0.023428 54.230.158.80 -> 172.31.29.138 TCP 2962 [TCP segment of a reassembled PDU]
162   0.023434 172.31.29.138 -> 54.230.158.80 TCP 66 48851 > http [ACK] Seq=97 Ack=1010323 Win=1137792 Len=0 TSval=7850067 TSecr=832588143
163   0.023638 54.230.158.80 -> 172.31.29.138 TCP 26130 [TCP segment of a reassembled PDU]
164   0.023653 172.31.29.138 -> 54.230.158.80 TCP 66 48851 > http [ACK] Seq=97 Ack=1036387 Win=1190016 Len=0 TSval=7850067 TSecr=832588143
165   0.023666 54.230.158.80 -> 172.31.29.138 HTTP 12713 HTTP/1.1 200 OK  (application/octet-stream)
166   0.023676 172.31.29.138 -> 54.230.158.80 TCP 66 48851 > http [ACK] Seq=97 Ack=1049034 Win=1215232 Len=0 TSval=7850067 TSecr=832588143
167   0.023819 172.31.29.138 -> 54.230.158.80 TCP 66 48851 > http [FIN, ACK] Seq=97 Ack=1049034 Win=1215232 Len=0 TSval=7850067 TSecr=832588143
168   0.024247 54.230.158.80 -> 172.31.29.138 TCP 66 http > 48851 [FIN, ACK] Seq=1049034 Ack=98 Win=14592 Len=0 TSval=832588143 TSecr=7850067
169   0.024253 172.31.29.138 -> 54.230.158.80 TCP 66 48851 > http [ACK] Seq=98 Ack=1049035 Win=1215232 Len=0 TSval=7850067 TSecr=832588143
