[Measurement for 1mb at 05:38:48 20.38.2014] 
Tshark:

  1   0.000000 172.31.29.138 -> 172.31.0.2   DNS 89 Standard query 0x6d24  A d3m1c4hwkgedal.cloudfront.net
  2   0.000041 172.31.29.138 -> 172.31.0.2   DNS 89 Standard query 0x1b42  AAAA d3m1c4hwkgedal.cloudfront.net
  3   0.000544   172.31.0.2 -> 172.31.29.138 DNS 174 Standard query response 0x1b42 
  4   0.000643   172.31.0.2 -> 172.31.29.138 DNS 217 Standard query response 0x6d24  A 54.230.158.225 A 54.230.159.150 A 54.192.157.142 A 54.192.159.97 A 54.192.159.101 A 54.192.159.107 A 54.192.159.168 A 54.230.158.180
  5   0.003573 172.31.29.138 -> 54.230.158.225 TCP 74 38829 > http [SYN] Seq=0 Win=26883 Len=0 MSS=8961 SACK_PERM=1 TSval=11450333 TSecr=0 WS=128
  6   0.004162 54.230.158.225 -> 172.31.29.138 TCP 74 http > 38829 [SYN, ACK] Seq=0 Ack=1 Win=14480 Len=0 MSS=1460 SACK_PERM=1 TSval=730830752 TSecr=11450333 WS=128
  7   0.004176 172.31.29.138 -> 54.230.158.225 TCP 66 38829 > http [ACK] Seq=1 Ack=1 Win=27008 Len=0 TSval=11450333 TSecr=730830752
  8   0.004216 172.31.29.138 -> 54.230.158.225 HTTP 162 GET /1mb HTTP/1.1 
  9   0.004867 54.230.158.225 -> 172.31.29.138 TCP 66 http > 38829 [ACK] Seq=1 Ack=97 Win=14592 Len=0 TSval=730830752 TSecr=11450333
 10   0.007989 54.230.158.225 -> 172.31.29.138 TCP 523 [TCP segment of a reassembled PDU]
 11   0.007996 172.31.29.138 -> 54.230.158.225 TCP 66 38829 > http [ACK] Seq=97 Ack=458 Win=28032 Len=0 TSval=11450334 TSecr=730830752
 12   0.008027 54.230.158.225 -> 172.31.29.138 TCP 13098 [TCP segment of a reassembled PDU]
 13   0.008036 172.31.29.138 -> 54.230.158.225 TCP 66 38829 > http [ACK] Seq=97 Ack=13490 Win=54144 Len=0 TSval=11450334 TSecr=730830752
 14   0.008688 54.230.158.225 -> 172.31.29.138 TCP 1514 [TCP segment of a reassembled PDU]
 15   0.008694 172.31.29.138 -> 54.230.158.225 TCP 66 38829 > http [ACK] Seq=97 Ack=14938 Win=56960 Len=0 TSval=11450334 TSecr=730830752
 16   0.008943 54.230.158.225 -> 172.31.29.138 TCP 2962 [TCP segment of a reassembled PDU]
 17   0.008948 172.31.29.138 -> 54.230.158.225 TCP 66 38829 > http [ACK] Seq=97 Ack=17834 Win=62720 Len=0 TSval=11450334 TSecr=730830752
 18   0.008983 54.230.158.225 -> 172.31.29.138 TCP 8754 [TCP segment of a reassembled PDU]
 19   0.008989 172.31.29.138 -> 54.230.158.225 TCP 66 38829 > http [ACK] Seq=97 Ack=26522 Win=80128 Len=0 TSval=11450334 TSecr=730830752
 20   0.009446 54.230.158.225 -> 172.31.29.138 TCP 2962 [TCP segment of a reassembled PDU]
 21   0.009462 172.31.29.138 -> 54.230.158.225 TCP 66 38829 > http [ACK] Seq=97 Ack=29418 Win=85888 Len=0 TSval=11450334 TSecr=730830752
 22   0.009499 54.230.158.225 -> 172.31.29.138 TCP 10202 [TCP segment of a reassembled PDU]
 23   0.009507 172.31.29.138 -> 54.230.158.225 TCP 66 38829 > http [ACK] Seq=97 Ack=39554 Win=101248 Len=0 TSval=11450334 TSecr=730830752
 24   0.009531 54.230.158.225 -> 172.31.29.138 TCP 4410 [TCP segment of a reassembled PDU]
 25   0.009537 172.31.29.138 -> 54.230.158.225 TCP 66 38829 > http [ACK] Seq=97 Ack=43898 Win=109056 Len=0 TSval=11450334 TSecr=730830752
 26   0.009702 54.230.158.225 -> 172.31.29.138 TCP 2962 [TCP segment of a reassembled PDU]
 27   0.009716 172.31.29.138 -> 54.230.158.225 TCP 66 38829 > http [ACK] Seq=97 Ack=46794 Win=109056 Len=0 TSval=11450334 TSecr=730830752
 28   0.009734 54.230.158.225 -> 172.31.29.138 TCP 1514 [TCP segment of a reassembled PDU]
 29   0.009738 172.31.29.138 -> 54.230.158.225 TCP 66 38829 > http [ACK] Seq=97 Ack=48242 Win=109056 Len=0 TSval=11450334 TSecr=730830752
 30   0.010035 54.230.158.225 -> 172.31.29.138 TCP 4410 [TCP segment of a reassembled PDU]
 31   0.010041 172.31.29.138 -> 54.230.158.225 TCP 66 38829 > http [ACK] Seq=97 Ack=52586 Win=109056 Len=0 TSval=11450334 TSecr=730830752
 32   0.010078 54.230.158.225 -> 172.31.29.138 TCP 13098 [TCP segment of a reassembled PDU]
 33   0.010086 172.31.29.138 -> 54.230.158.225 TCP 66 38829 > http [ACK] Seq=97 Ack=65618 Win=96512 Len=0 TSval=11450334 TSecr=730830752
 34   0.010469 54.230.158.225 -> 172.31.29.138 TCP 2962 [TCP segment of a reassembled PDU]
 35   0.010483 172.31.29.138 -> 54.230.158.225 TCP 66 38829 > http [ACK] Seq=97 Ack=68514 Win=109056 Len=0 TSval=11450335 TSecr=730830752
 36   0.010664 54.230.158.225 -> 172.31.29.138 TCP 23234 [TCP segment of a reassembled PDU]
 37   0.010686 172.31.29.138 -> 54.230.158.225 TCP 66 38829 > http [ACK] Seq=97 Ack=91682 Win=155392 Len=0 TSval=11450335 TSecr=730830752
 38   0.010716 54.230.158.225 -> 172.31.29.138 TCP 4410 [TCP segment of a reassembled PDU]
 39   0.010721 172.31.29.138 -> 54.230.158.225 TCP 66 38829 > http [ACK] Seq=97 Ack=96026 Win=164096 Len=0 TSval=11450335 TSecr=730830752
 40   0.010779 54.230.158.225 -> 172.31.29.138 TCP 1514 [TCP segment of a reassembled PDU]
 41   0.010783 172.31.29.138 -> 54.230.158.225 TCP 66 38829 > http [ACK] Seq=97 Ack=97474 Win=167040 Len=0 TSval=11450335 TSecr=730830752
 42   0.011259 54.230.158.225 -> 172.31.29.138 TCP 2962 [TCP segment of a reassembled PDU]
 43   0.011274 172.31.29.138 -> 54.230.158.225 TCP 66 38829 > http [ACK] Seq=97 Ack=100370 Win=172800 Len=0 TSval=11450335 TSecr=730830753
 44   0.011423 54.230.158.225 -> 172.31.29.138 TCP 23234 [TCP segment of a reassembled PDU]
 45   0.011437 172.31.29.138 -> 54.230.158.225 TCP 66 38829 > http [ACK] Seq=97 Ack=123538 Win=219136 Len=0 TSval=11450335 TSecr=730830753
 46   0.011542 54.230.158.225 -> 172.31.29.138 TCP 7306 [TCP segment of a reassembled PDU]
 47   0.011550 172.31.29.138 -> 54.230.158.225 TCP 66 38829 > http [ACK] Seq=97 Ack=130778 Win=233600 Len=0 TSval=11450335 TSecr=730830753
 48   0.012033 54.230.158.225 -> 172.31.29.138 TCP 2962 [TCP segment of a reassembled PDU]
 49   0.012049 172.31.29.138 -> 54.230.158.225 TCP 66 38829 > http [ACK] Seq=97 Ack=133674 Win=239360 Len=0 TSval=11450335 TSecr=730830753
 50   0.013303 54.230.158.225 -> 172.31.29.138 TCP 20338 [TCP segment of a reassembled PDU]
 51   0.013317 172.31.29.138 -> 54.230.158.225 TCP 66 38829 > http [ACK] Seq=97 Ack=153946 Win=279936 Len=0 TSval=11450335 TSecr=730830753
 52   0.013342 54.230.158.225 -> 172.31.29.138 TCP 5858 [TCP segment of a reassembled PDU]
 53   0.013347 172.31.29.138 -> 54.230.158.225 TCP 66 38829 > http [ACK] Seq=97 Ack=159738 Win=291456 Len=0 TSval=11450335 TSecr=730830753
 54   0.013391 54.230.158.225 -> 172.31.29.138 TCP 13098 [TCP segment of a reassembled PDU]
 55   0.013401 172.31.29.138 -> 54.230.158.225 TCP 66 38829 > http [ACK] Seq=97 Ack=172770 Win=317568 Len=0 TSval=11450335 TSecr=730830753
 56   0.013827 54.230.158.225 -> 172.31.29.138 TCP 5858 [TCP segment of a reassembled PDU]
 57   0.013833 172.31.29.138 -> 54.230.158.225 TCP 66 38829 > http [ACK] Seq=97 Ack=178562 Win=329216 Len=0 TSval=11450335 TSecr=730830753
 58   0.013930 54.230.158.225 -> 172.31.29.138 TCP 4410 [TCP segment of a reassembled PDU]
 59   0.013936 172.31.29.138 -> 54.230.158.225 TCP 66 38829 > http [ACK] Seq=97 Ack=182906 Win=337792 Len=0 TSval=11450335 TSecr=730830753
 60   0.014076 54.230.158.225 -> 172.31.29.138 TCP 26130 [TCP segment of a reassembled PDU]
 61   0.014090 172.31.29.138 -> 54.230.158.225 TCP 66 38829 > http [ACK] Seq=97 Ack=208970 Win=390016 Len=0 TSval=11450335 TSecr=730830753
 62   0.014105 54.230.158.225 -> 172.31.29.138 TCP 7306 [TCP segment of a reassembled PDU]
 63   0.014110 172.31.29.138 -> 54.230.158.225 TCP 66 38829 > http [ACK] Seq=97 Ack=216210 Win=404480 Len=0 TSval=11450335 TSecr=730830753
 64   0.014116 54.230.158.225 -> 172.31.29.138 TCP 2962 [TCP segment of a reassembled PDU]
 65   0.014119 172.31.29.138 -> 54.230.158.225 TCP 66 38829 > http [ACK] Seq=97 Ack=219106 Win=410240 Len=0 TSval=11450335 TSecr=730830753
 66   0.014140 54.230.158.225 -> 172.31.29.138 TCP 1514 [TCP segment of a reassembled PDU]
 67   0.014144 172.31.29.138 -> 54.230.158.225 TCP 66 38829 > http [ACK] Seq=97 Ack=220554 Win=413184 Len=0 TSval=11450335 TSecr=730830753
 68   0.014334 54.230.158.225 -> 172.31.29.138 TCP 1514 [TCP segment of a reassembled PDU]
 69   0.014339 172.31.29.138 -> 54.230.158.225 TCP 66 38829 > http [ACK] Seq=97 Ack=222002 Win=416000 Len=0 TSval=11450335 TSecr=730830753
 70   0.014594 54.230.158.225 -> 172.31.29.138 TCP 4410 [TCP segment of a reassembled PDU]
 71   0.014599 172.31.29.138 -> 54.230.158.225 TCP 66 38829 > http [ACK] Seq=97 Ack=226346 Win=424704 Len=0 TSval=11450336 TSecr=730830753
 72   0.014750 54.230.158.225 -> 172.31.29.138 TCP 26130 [TCP segment of a reassembled PDU]
 73   0.014764 172.31.29.138 -> 54.230.158.225 TCP 66 38829 > http [ACK] Seq=97 Ack=252410 Win=476800 Len=0 TSval=11450336 TSecr=730830753
 74   0.014784 54.230.158.225 -> 172.31.29.138 TCP 17442 [TCP segment of a reassembled PDU]
 75   0.014796 172.31.29.138 -> 54.230.158.225 TCP 66 38829 > http [ACK] Seq=97 Ack=269786 Win=511616 Len=0 TSval=11450336 TSecr=730830753
 76   0.014801 54.230.158.225 -> 172.31.29.138 TCP 1514 [TCP segment of a reassembled PDU]
 77   0.014803 172.31.29.138 -> 54.230.158.225 TCP 66 38829 > http [ACK] Seq=97 Ack=271234 Win=514560 Len=0 TSval=11450336 TSecr=730830753
 78   0.014830 54.230.158.225 -> 172.31.29.138 TCP 2962 [TCP segment of a reassembled PDU]
 79   0.014834 172.31.29.138 -> 54.230.158.225 TCP 66 38829 > http [ACK] Seq=97 Ack=274130 Win=520320 Len=0 TSval=11450336 TSecr=730830753
 80   0.014878 54.230.158.225 -> 172.31.29.138 TCP 1514 [TCP segment of a reassembled PDU]
 81   0.014882 172.31.29.138 -> 54.230.158.225 TCP 66 38829 > http [ACK] Seq=97 Ack=275578 Win=523136 Len=0 TSval=11450336 TSecr=730830753
 82   0.015365 54.230.158.225 -> 172.31.29.138 TCP 4410 [TCP segment of a reassembled PDU]
 83   0.015372 172.31.29.138 -> 54.230.158.225 TCP 66 38829 > http [ACK] Seq=97 Ack=279922 Win=531840 Len=0 TSval=11450336 TSecr=730830753
 84   0.015504 54.230.158.225 -> 172.31.29.138 TCP 26130 [TCP segment of a reassembled PDU]
 85   0.015518 172.31.29.138 -> 54.230.158.225 TCP 66 38829 > http [ACK] Seq=97 Ack=305986 Win=584064 Len=0 TSval=11450336 TSecr=730830753
 86   0.015534 54.230.158.225 -> 172.31.29.138 TCP 14546 [TCP segment of a reassembled PDU]
 87   0.015545 172.31.29.138 -> 54.230.158.225 TCP 66 38829 > http [ACK] Seq=97 Ack=320466 Win=612992 Len=0 TSval=11450336 TSecr=730830753
 88   0.015648 54.230.158.225 -> 172.31.29.138 TCP 8754 [TCP segment of a reassembled PDU]
 89   0.015656 172.31.29.138 -> 54.230.158.225 TCP 66 38829 > http [ACK] Seq=97 Ack=329154 Win=630400 Len=0 TSval=11450336 TSecr=730830753
 90   0.016431 54.230.158.225 -> 172.31.29.138 TCP 4410 [TCP segment of a reassembled PDU]
 91   0.016437 172.31.29.138 -> 54.230.158.225 TCP 66 38829 > http [ACK] Seq=97 Ack=333498 Win=638976 Len=0 TSval=11450336 TSecr=730830753
 92   0.016605 54.230.158.225 -> 172.31.29.138 TCP 26130 [TCP segment of a reassembled PDU]
 93   0.016619 172.31.29.138 -> 54.230.158.225 TCP 66 38829 > http [ACK] Seq=97 Ack=359562 Win=691200 Len=0 TSval=11450336 TSecr=730830753
 94   0.016657 54.230.158.225 -> 172.31.29.138 TCP 23234 [TCP segment of a reassembled PDU]
 95   0.016668 172.31.29.138 -> 54.230.158.225 TCP 66 38829 > http [ACK] Seq=97 Ack=382730 Win=737536 Len=0 TSval=11450336 TSecr=730830753
 96   0.017024 54.230.158.225 -> 172.31.29.138 TCP 14546 [TCP segment of a reassembled PDU]
 97   0.017033 172.31.29.138 -> 54.230.158.225 TCP 66 38829 > http [ACK] Seq=97 Ack=397210 Win=766464 Len=0 TSval=11450336 TSecr=730830753
 98   0.017123 54.230.158.225 -> 172.31.29.138 TCP 2962 [TCP segment of a reassembled PDU]
 99   0.017129 172.31.29.138 -> 54.230.158.225 TCP 66 38829 > http [ACK] Seq=97 Ack=400106 Win=772224 Len=0 TSval=11450336 TSecr=730830753
100   0.017299 54.230.158.225 -> 172.31.29.138 TCP 26130 [TCP segment of a reassembled PDU]
101   0.017321 172.31.29.138 -> 54.230.158.225 TCP 66 38829 > http [ACK] Seq=97 Ack=426170 Win=824320 Len=0 TSval=11450336 TSecr=730830753
102   0.017336 54.230.158.225 -> 172.31.29.138 TCP 14546 [TCP segment of a reassembled PDU]
103   0.017347 172.31.29.138 -> 54.230.158.225 TCP 66 38829 > http [ACK] Seq=97 Ack=440650 Win=852352 Len=0 TSval=11450336 TSecr=730830753
104   0.017482 54.230.158.225 -> 172.31.29.138 TCP 7306 [TCP segment of a reassembled PDU]
105   0.017489 172.31.29.138 -> 54.230.158.225 TCP 66 38829 > http [ACK] Seq=97 Ack=447890 Win=867840 Len=0 TSval=11450336 TSecr=730830753
106   0.017704 54.230.158.225 -> 172.31.29.138 TCP 14546 [TCP segment of a reassembled PDU]
107   0.017714 172.31.29.138 -> 54.230.158.225 TCP 66 38829 > http [ACK] Seq=97 Ack=462370 Win=895232 Len=0 TSval=11450336 TSecr=730830753
108   0.017795 54.230.158.225 -> 172.31.29.138 TCP 10202 [TCP segment of a reassembled PDU]
109   0.017802 172.31.29.138 -> 54.230.158.225 TCP 66 38829 > http [ACK] Seq=97 Ack=472506 Win=885120 Len=0 TSval=11450336 TSecr=730830753
110   0.017909 54.230.158.225 -> 172.31.29.138 TCP 7306 [TCP segment of a reassembled PDU]
111   0.017917 172.31.29.138 -> 54.230.158.225 TCP 66 38829 > http [ACK] Seq=97 Ack=479746 Win=907136 Len=0 TSval=11450336 TSecr=730830753
112   0.018088 54.230.158.225 -> 172.31.29.138 TCP 23234 [TCP segment of a reassembled PDU]
113   0.018101 172.31.29.138 -> 54.230.158.225 TCP 66 38829 > http [ACK] Seq=97 Ack=502914 Win=883968 Len=0 TSval=11450336 TSecr=730830753
114   0.018110 54.230.158.225 -> 172.31.29.138 TCP 1514 [TCP segment of a reassembled PDU]
115   0.018112 172.31.29.138 -> 54.230.158.225 TCP 66 38829 > http [ACK] Seq=97 Ack=504362 Win=882560 Len=0 TSval=11450336 TSecr=730830753
116   0.018145 54.230.158.225 -> 172.31.29.138 TCP 2962 [TCP segment of a reassembled PDU]
117   0.018150 172.31.29.138 -> 54.230.158.225 TCP 66 38829 > http [ACK] Seq=97 Ack=507258 Win=914304 Len=0 TSval=11450336 TSecr=730830753
118   0.018315 54.230.158.225 -> 172.31.29.138 TCP 26130 [TCP segment of a reassembled PDU]
119   0.018328 172.31.29.138 -> 54.230.158.225 TCP 66 38829 > http [ACK] Seq=97 Ack=533322 Win=888320 Len=0 TSval=11450336 TSecr=730830753
120   0.018342 54.230.158.225 -> 172.31.29.138 TCP 14546 [TCP segment of a reassembled PDU]
121   0.018353 172.31.29.138 -> 54.230.158.225 TCP 66 38829 > http [ACK] Seq=97 Ack=547802 Win=873856 Len=0 TSval=11450336 TSecr=730830753
122   0.018647 54.230.158.225 -> 172.31.29.138 TCP 1514 [TCP segment of a reassembled PDU]
123   0.018652 172.31.29.138 -> 54.230.158.225 TCP 66 38829 > http [ACK] Seq=97 Ack=549250 Win=916608 Len=0 TSval=11450337 TSecr=730830753
124   0.018915 54.230.158.225 -> 172.31.29.138 TCP 2962 [TCP segment of a reassembled PDU]
125   0.018920 172.31.29.138 -> 54.230.158.225 TCP 66 38829 > http [ACK] Seq=97 Ack=552146 Win=922880 Len=0 TSval=11450337 TSecr=730830753
126   0.019077 54.230.158.225 -> 172.31.29.138 TCP 26130 [TCP segment of a reassembled PDU]
127   0.019091 172.31.29.138 -> 54.230.158.225 TCP 66 38829 > http [ACK] Seq=97 Ack=578210 Win=974976 Len=0 TSval=11450337 TSecr=730830753
128   0.019097 54.230.158.225 -> 172.31.29.138 TCP 1514 [TCP segment of a reassembled PDU]
129   0.019099 172.31.29.138 -> 54.230.158.225 TCP 66 38829 > http [ACK] Seq=97 Ack=579658 Win=977920 Len=0 TSval=11450337 TSecr=730830753
130   0.019113 54.230.158.225 -> 172.31.29.138 TCP 18890 [TCP segment of a reassembled PDU]
131   0.019122 172.31.29.138 -> 54.230.158.225 TCP 66 38829 > http [ACK] Seq=97 Ack=598482 Win=1015552 Len=0 TSval=11450337 TSecr=730830753
132   0.019129 54.230.158.225 -> 172.31.29.138 TCP 2962 [TCP segment of a reassembled PDU]
133   0.019132 172.31.29.138 -> 54.230.158.225 TCP 66 38829 > http [ACK] Seq=97 Ack=601378 Win=1021312 Len=0 TSval=11450337 TSecr=730830753
134   0.019196 54.230.158.225 -> 172.31.29.138 TCP 20338 [TCP segment of a reassembled PDU]
135   0.019210 172.31.29.138 -> 54.230.158.225 TCP 66 38829 > http [ACK] Seq=97 Ack=621650 Win=1061888 Len=0 TSval=11450337 TSecr=730830753
136   0.019269 54.230.158.225 -> 172.31.29.138 TCP 18890 [TCP segment of a reassembled PDU]
137   0.019279 172.31.29.138 -> 54.230.158.225 TCP 66 38829 > http [ACK] Seq=97 Ack=640474 Win=1099520 Len=0 TSval=11450337 TSecr=730830753
138   0.019335 54.230.158.225 -> 172.31.29.138 TCP 2962 [TCP segment of a reassembled PDU]
139   0.019339 172.31.29.138 -> 54.230.158.225 TCP 66 38829 > http [ACK] Seq=97 Ack=643370 Win=1105280 Len=0 TSval=11450337 TSecr=730830753
140   0.019809 54.230.158.225 -> 172.31.29.138 TCP 2962 [TCP segment of a reassembled PDU]
141   0.019815 172.31.29.138 -> 54.230.158.225 TCP 66 38829 > http [ACK] Seq=97 Ack=646266 Win=1111040 Len=0 TSval=11450337 TSecr=730830753
142   0.019987 54.230.158.225 -> 172.31.29.138 TCP 26130 [TCP segment of a reassembled PDU]
143   0.020000 172.31.29.138 -> 54.230.158.225 TCP 66 38829 > http [ACK] Seq=97 Ack=672330 Win=1163264 Len=0 TSval=11450337 TSecr=730830753
144   0.020057 54.230.158.225 -> 172.31.29.138 TCP 26130 [TCP segment of a reassembled PDU]
145   0.020070 172.31.29.138 -> 54.230.158.225 TCP 66 38829 > http [ACK] Seq=97 Ack=698394 Win=1215360 Len=0 TSval=11450337 TSecr=730830753
146   0.020082 54.230.158.225 -> 172.31.29.138 TCP 7306 [TCP segment of a reassembled PDU]
147   0.020088 172.31.29.138 -> 54.230.158.225 TCP 66 38829 > http [ACK] Seq=97 Ack=705634 Win=1229824 Len=0 TSval=11450337 TSecr=730830753
148   0.020093 54.230.158.225 -> 172.31.29.138 TCP 2962 [TCP segment of a reassembled PDU]
149   0.020097 172.31.29.138 -> 54.230.158.225 TCP 66 38829 > http [ACK] Seq=97 Ack=708530 Win=1235584 Len=0 TSval=11450337 TSecr=730830753
150   0.020150 54.230.158.225 -> 172.31.29.138 TCP 23234 [TCP segment of a reassembled PDU]
151   0.020164 172.31.29.138 -> 54.230.158.225 TCP 66 38829 > http [ACK] Seq=97 Ack=731698 Win=1281920 Len=0 TSval=11450337 TSecr=730830753
152   0.020206 54.230.158.225 -> 172.31.29.138 TCP 11650 [TCP segment of a reassembled PDU]
153   0.020214 172.31.29.138 -> 54.230.158.225 TCP 66 38829 > http [ACK] Seq=97 Ack=743282 Win=1305088 Len=0 TSval=11450337 TSecr=730830753
154   0.020271 54.230.158.225 -> 172.31.29.138 TCP 4410 [TCP segment of a reassembled PDU]
155   0.020277 172.31.29.138 -> 54.230.158.225 TCP 66 38829 > http [ACK] Seq=97 Ack=747626 Win=1313792 Len=0 TSval=11450337 TSecr=730830753
156   0.020727 54.230.158.225 -> 172.31.29.138 TCP 2962 [TCP segment of a reassembled PDU]
157   0.020733 172.31.29.138 -> 54.230.158.225 TCP 66 38829 > http [ACK] Seq=97 Ack=750522 Win=1319552 Len=0 TSval=11450337 TSecr=730830753
158   0.020910 54.230.158.225 -> 172.31.29.138 TCP 26130 [TCP segment of a reassembled PDU]
159   0.020924 172.31.29.138 -> 54.230.158.225 TCP 66 38829 > http [ACK] Seq=97 Ack=776586 Win=1371776 Len=0 TSval=11450337 TSecr=730830753
160   0.020967 54.230.158.225 -> 172.31.29.138 TCP 26130 [TCP segment of a reassembled PDU]
161   0.020979 172.31.29.138 -> 54.230.158.225 TCP 66 38829 > http [ACK] Seq=97 Ack=802650 Win=1423872 Len=0 TSval=11450337 TSecr=730830753
162   0.020992 54.230.158.225 -> 172.31.29.138 TCP 8754 [TCP segment of a reassembled PDU]
163   0.020997 172.31.29.138 -> 54.230.158.225 TCP 66 38829 > http [ACK] Seq=97 Ack=811338 Win=1441280 Len=0 TSval=11450337 TSecr=730830753
164   0.021052 54.230.158.225 -> 172.31.29.138 TCP 18890 [TCP segment of a reassembled PDU]
165   0.021062 172.31.29.138 -> 54.230.158.225 TCP 66 38829 > http [ACK] Seq=97 Ack=830162 Win=1478912 Len=0 TSval=11450337 TSecr=730830754
166   0.021149 54.230.158.225 -> 172.31.29.138 TCP 8754 [TCP segment of a reassembled PDU]
167   0.021156 172.31.29.138 -> 54.230.158.225 TCP 66 38829 > http [ACK] Seq=97 Ack=838850 Win=1496192 Len=0 TSval=11450337 TSecr=730830754
168   0.021656 54.230.158.225 -> 172.31.29.138 TCP 4410 [TCP segment of a reassembled PDU]
169   0.021663 172.31.29.138 -> 54.230.158.225 TCP 66 38829 > http [ACK] Seq=97 Ack=843194 Win=1504896 Len=0 TSval=11450337 TSecr=730830754
170   0.021840 54.230.158.225 -> 172.31.29.138 TCP 21786 [TCP segment of a reassembled PDU]
171   0.021851 172.31.29.138 -> 54.230.158.225 TCP 66 38829 > http [ACK] Seq=97 Ack=864914 Win=1548416 Len=0 TSval=11450337 TSecr=730830754
172   0.021868 54.230.158.225 -> 172.31.29.138 TCP 4410 [TCP segment of a reassembled PDU]
173   0.021872 172.31.29.138 -> 54.230.158.225 TCP 66 38829 > http [ACK] Seq=97 Ack=869258 Win=1544192 Len=0 TSval=11450337 TSecr=730830754
174   0.021969 54.230.158.225 -> 172.31.29.138 TCP 31922 [TCP segment of a reassembled PDU]
175   0.021985 172.31.29.138 -> 54.230.158.225 TCP 66 38829 > http [ACK] Seq=97 Ack=901114 Win=1533440 Len=0 TSval=11450337 TSecr=730830754
176   0.021996 54.230.158.225 -> 172.31.29.138 TCP 7306 [TCP segment of a reassembled PDU]
177   0.022017 172.31.29.138 -> 54.230.158.225 TCP 66 38829 > http [ACK] Seq=97 Ack=908354 Win=1526272 Len=0 TSval=11450337 TSecr=730830754
178   0.022077 54.230.158.225 -> 172.31.29.138 TCP 18890 [TCP segment of a reassembled PDU]
179   0.022088 172.31.29.138 -> 54.230.158.225 TCP 66 38829 > http [ACK] Seq=97 Ack=927178 Win=1554816 Len=0 TSval=11450337 TSecr=730830754
180   0.022096 54.230.158.225 -> 172.31.29.138 TCP 2962 [TCP segment of a reassembled PDU]
181   0.022233 54.230.158.225 -> 172.31.29.138 TCP 26130 [TCP segment of a reassembled PDU]
182   0.022247 54.230.158.225 -> 172.31.29.138 TCP 2962 [TCP segment of a reassembled PDU]
183   0.022260 54.230.158.225 -> 172.31.29.138 TCP 2962 [TCP segment of a reassembled PDU]
184   0.022303 172.31.29.138 -> 54.230.158.225 TCP 66 38829 > http [ACK] Seq=97 Ack=961930 Win=1520128 Len=0 TSval=11450337 TSecr=730830754
185   0.022431 54.230.158.225 -> 172.31.29.138 TCP 2962 [TCP segment of a reassembled PDU]
186   0.022437 172.31.29.138 -> 54.230.158.225 TCP 66 38829 > http [ACK] Seq=97 Ack=964826 Win=1577984 Len=0 TSval=11450337 TSecr=730830754
187   0.022550 54.230.158.225 -> 172.31.29.138 TCP 4410 [TCP segment of a reassembled PDU]
188   0.022555 172.31.29.138 -> 54.230.158.225 TCP 66 38829 > http [ACK] Seq=97 Ack=969170 Win=1577984 Len=0 TSval=11450338 TSecr=730830754
189   0.022857 54.230.158.225 -> 172.31.29.138 TCP 20338 [TCP segment of a reassembled PDU]
190   0.022886 54.230.158.225 -> 172.31.29.138 TCP 5858 [TCP segment of a reassembled PDU]
191   0.022892 172.31.29.138 -> 54.230.158.225 TCP 66 38829 > http [ACK] Seq=97 Ack=989442 Win=1557760 Len=0 TSval=11450338 TSecr=730830754
192   0.022908 172.31.29.138 -> 54.230.158.225 TCP 66 38829 > http [ACK] Seq=97 Ack=995234 Win=1577984 Len=0 TSval=11450338 TSecr=730830754
193   0.022963 54.230.158.225 -> 172.31.29.138 TCP 26130 [TCP segment of a reassembled PDU]
194   0.022993 172.31.29.138 -> 54.230.158.225 TCP 66 38829 > http [ACK] Seq=97 Ack=1021298 Win=1552000 Len=0 TSval=11450338 TSecr=730830754
195   0.023022 54.230.158.225 -> 172.31.29.138 TCP 13098 [TCP segment of a reassembled PDU]
196   0.023029 172.31.29.138 -> 54.230.158.225 TCP 66 38829 > http [ACK] Seq=97 Ack=1034330 Win=1564416 Len=0 TSval=11450338 TSecr=730830754
197   0.023064 54.230.158.225 -> 172.31.29.138 HTTP 14770 HTTP/1.1 200 OK  (application/octet-stream)
198   0.023247 172.31.29.138 -> 54.230.158.225 TCP 66 38829 > http [ACK] Seq=97 Ack=1049034 Win=1577984 Len=0 TSval=11450338 TSecr=730830754
199   0.023369 172.31.29.138 -> 54.230.158.225 TCP 66 38829 > http [FIN, ACK] Seq=97 Ack=1049034 Win=1577984 Len=0 TSval=11450338 TSecr=730830754
200   0.023813 54.230.158.225 -> 172.31.29.138 TCP 66 http > 38829 [FIN, ACK] Seq=1049034 Ack=98 Win=14592 Len=0 TSval=730830754 TSecr=11450338
201   0.023821 172.31.29.138 -> 54.230.158.225 TCP 66 38829 > http [ACK] Seq=98 Ack=1049035 Win=1577984 Len=0 TSval=11450338 TSecr=730830754
