[Measurement for 1mb at 13:38:48 20.38.2014] 
Tshark:

  1   0.000000 172.31.29.138 -> 172.31.0.2   DNS 89 Standard query 0xf9f0  A d3m1c4hwkgedal.cloudfront.net
  2   0.000029 172.31.29.138 -> 172.31.0.2   DNS 89 Standard query 0xa4c4  AAAA d3m1c4hwkgedal.cloudfront.net
  3   0.000554   172.31.0.2 -> 172.31.29.138 DNS 217 Standard query response 0xf9f0  A 54.192.157.139 A 54.192.159.107 A 54.192.159.161 A 54.192.159.169 A 54.192.159.180 A 54.230.158.142 A 54.230.158.176 A 54.230.158.182
  4   0.000578   172.31.0.2 -> 172.31.29.138 DNS 174 Standard query response 0xa4c4 
  5   0.003852 172.31.29.138 -> 54.192.157.139 TCP 74 53869 > http [SYN] Seq=0 Win=26883 Len=0 MSS=8961 SACK_PERM=1 TSval=18650190 TSecr=0 WS=128
  6   0.004287 54.192.157.139 -> 172.31.29.138 TCP 74 http > 53869 [SYN, ACK] Seq=0 Ack=1 Win=14480 Len=0 MSS=1460 SACK_PERM=1 TSval=835845111 TSecr=18650190 WS=128
  7   0.004301 172.31.29.138 -> 54.192.157.139 TCP 66 53869 > http [ACK] Seq=1 Ack=1 Win=27008 Len=0 TSval=18650191 TSecr=835845111
  8   0.004340 172.31.29.138 -> 54.192.157.139 HTTP 162 GET /1mb HTTP/1.1 
  9   0.004789 54.192.157.139 -> 172.31.29.138 TCP 66 http > 53869 [ACK] Seq=1 Ack=97 Win=14592 Len=0 TSval=835845111 TSecr=18650191
 10   0.009473 54.192.157.139 -> 172.31.29.138 TCP 8754 [TCP segment of a reassembled PDU]
 11   0.009484 172.31.29.138 -> 54.192.157.139 TCP 66 53869 > http [ACK] Seq=97 Ack=8689 Win=44288 Len=0 TSval=18650192 TSecr=835845112
 12   0.009494 54.192.157.139 -> 172.31.29.138 TCP 4410 [TCP segment of a reassembled PDU]
 13   0.009502 172.31.29.138 -> 54.192.157.139 TCP 66 53869 > http [ACK] Seq=97 Ack=13033 Win=52992 Len=0 TSval=18650192 TSecr=835845112
 14   0.009954 54.192.157.139 -> 172.31.29.138 TCP 2962 [TCP segment of a reassembled PDU]
 15   0.009960 172.31.29.138 -> 54.192.157.139 TCP 66 53869 > http [ACK] Seq=97 Ack=15929 Win=58752 Len=0 TSval=18650192 TSecr=835845112
 16   0.010027 54.192.157.139 -> 172.31.29.138 TCP 10202 [TCP segment of a reassembled PDU]
 17   0.010035 172.31.29.138 -> 54.192.157.139 TCP 66 53869 > http [ACK] Seq=97 Ack=26065 Win=79104 Len=0 TSval=18650192 TSecr=835845112
 18   0.010469 54.192.157.139 -> 172.31.29.138 TCP 10202 [TCP segment of a reassembled PDU]
 19   0.010477 172.31.29.138 -> 54.192.157.139 TCP 66 53869 > http [ACK] Seq=97 Ack=36201 Win=99328 Len=0 TSval=18650192 TSecr=835845112
 20   0.010527 54.192.157.139 -> 172.31.29.138 TCP 10202 [TCP segment of a reassembled PDU]
 21   0.010534 172.31.29.138 -> 54.192.157.139 TCP 66 53869 > http [ACK] Seq=97 Ack=46337 Win=101248 Len=0 TSval=18650192 TSecr=835845112
 22   0.010954 54.192.157.139 -> 172.31.29.138 TCP 5858 [TCP segment of a reassembled PDU]
 23   0.010961 172.31.29.138 -> 54.192.157.139 TCP 66 53869 > http [ACK] Seq=97 Ack=52129 Win=108416 Len=0 TSval=18650192 TSecr=835845112
 24   0.011011 54.192.157.139 -> 172.31.29.138 TCP 13098 [TCP segment of a reassembled PDU]
 25   0.011020 172.31.29.138 -> 54.192.157.139 TCP 66 53869 > http [ACK] Seq=97 Ack=65161 Win=96512 Len=0 TSval=18650192 TSecr=835845112
 26   0.011477 54.192.157.139 -> 172.31.29.138 TCP 8754 [TCP segment of a reassembled PDU]
 27   0.011484 172.31.29.138 -> 54.192.157.139 TCP 66 53869 > http [ACK] Seq=97 Ack=73849 Win=103680 Len=0 TSval=18650192 TSecr=835845112
 28   0.011567 54.192.157.139 -> 172.31.29.138 TCP 17442 [TCP segment of a reassembled PDU]
 29   0.011592 172.31.29.138 -> 54.192.157.139 TCP 66 53869 > http [ACK] Seq=97 Ack=91225 Win=89344 Len=0 TSval=18650192 TSecr=835845112
 30   0.012007 54.192.157.139 -> 172.31.29.138 TCP 10202 [TCP segment of a reassembled PDU]
 31   0.012015 172.31.29.138 -> 54.192.157.139 TCP 66 53869 > http [ACK] Seq=97 Ack=101361 Win=101248 Len=0 TSval=18650192 TSecr=835845112
 32   0.012060 54.192.157.139 -> 172.31.29.138 TCP 11650 [TCP segment of a reassembled PDU]
 33   0.012068 172.31.29.138 -> 54.192.157.139 TCP 66 53869 > http [ACK] Seq=97 Ack=112945 Win=98944 Len=0 TSval=18650192 TSecr=835845112
 34   0.012314 54.192.157.139 -> 172.31.29.138 TCP 7306 [TCP segment of a reassembled PDU]
 35   0.012321 172.31.29.138 -> 54.192.157.139 TCP 66 53869 > http [ACK] Seq=97 Ack=120185 Win=105984 Len=0 TSval=18650193 TSecr=835845112
 36   0.012512 54.192.157.139 -> 172.31.29.138 TCP 5858 [TCP segment of a reassembled PDU]
 37   0.012519 172.31.29.138 -> 54.192.157.139 TCP 66 53869 > http [ACK] Seq=97 Ack=125977 Win=120704 Len=0 TSval=18650193 TSecr=835845112
 38   0.012622 54.192.157.139 -> 172.31.29.138 TCP 14546 [TCP segment of a reassembled PDU]
 39   0.012632 172.31.29.138 -> 54.192.157.139 TCP 66 53869 > http [ACK] Seq=97 Ack=140457 Win=149632 Len=0 TSval=18650193 TSecr=835845112
 40   0.012998 54.192.157.139 -> 172.31.29.138 TCP 4410 [TCP segment of a reassembled PDU]
 41   0.013005 172.31.29.138 -> 54.192.157.139 TCP 66 53869 > http [ACK] Seq=97 Ack=144801 Win=158336 Len=0 TSval=18650193 TSecr=835845112
 42   0.013118 54.192.157.139 -> 172.31.29.138 TCP 8754 [TCP segment of a reassembled PDU]
 43   0.013125 172.31.29.138 -> 54.192.157.139 TCP 66 53869 > http [ACK] Seq=97 Ack=153489 Win=175616 Len=0 TSval=18650193 TSecr=835845112
 44   0.013348 54.192.157.139 -> 172.31.29.138 TCP 23234 [TCP segment of a reassembled PDU]
 45   0.013360 172.31.29.138 -> 54.192.157.139 TCP 66 53869 > http [ACK] Seq=97 Ack=176657 Win=221952 Len=0 TSval=18650193 TSecr=835845112
 46   0.014028 54.192.157.139 -> 172.31.29.138 TCP 7306 [TCP segment of a reassembled PDU]
 47   0.014035 172.31.29.138 -> 54.192.157.139 TCP 66 53869 > http [ACK] Seq=97 Ack=183897 Win=236544 Len=0 TSval=18650193 TSecr=835845112
 48   0.014160 54.192.157.139 -> 172.31.29.138 TCP 12535 [TCP segment of a reassembled PDU]
 49   0.014168 172.31.29.138 -> 54.192.157.139 TCP 66 53869 > http [ACK] Seq=97 Ack=196366 Win=261376 Len=0 TSval=18650193 TSecr=835845112
 50   0.014837 54.192.157.139 -> 172.31.29.138 TCP 11650 [TCP segment of a reassembled PDU]
 51   0.014845 172.31.29.138 -> 54.192.157.139 TCP 66 53869 > http [ACK] Seq=97 Ack=207950 Win=284544 Len=0 TSval=18650193 TSecr=835845112
 52   0.014995 54.192.157.139 -> 172.31.29.138 TCP 26130 [TCP segment of a reassembled PDU]
 53   0.015009 172.31.29.138 -> 54.192.157.139 TCP 66 53869 > http [ACK] Seq=97 Ack=234014 Win=336768 Len=0 TSval=18650193 TSecr=835845112
 54   0.015018 54.192.157.139 -> 172.31.29.138 TCP 4410 [TCP segment of a reassembled PDU]
 55   0.015025 172.31.29.138 -> 54.192.157.139 TCP 66 53869 > http [ACK] Seq=97 Ack=238358 Win=345472 Len=0 TSval=18650193 TSecr=835845112
 56   0.015822 54.192.157.139 -> 172.31.29.138 TCP 1514 [TCP segment of a reassembled PDU]
 57   0.015827 172.31.29.138 -> 54.192.157.139 TCP 66 53869 > http [ACK] Seq=97 Ack=239806 Win=348288 Len=0 TSval=18650193 TSecr=835845112
 58   0.016011 54.192.157.139 -> 172.31.29.138 TCP 22162 [TCP segment of a reassembled PDU]
 59   0.016020 172.31.29.138 -> 54.192.157.139 TCP 66 53869 > http [ACK] Seq=97 Ack=261902 Win=392448 Len=0 TSval=18650193 TSecr=835845112
 60   0.020602 54.192.157.139 -> 172.31.29.138 TCP 1514 [TCP Previous segment not captured] [TCP segment of a reassembled PDU]
 61   0.020608 172.31.29.138 -> 54.192.157.139 TCP 78 [TCP Window Update] 53869 > http [ACK] Seq=97 Ack=261902 Win=395392 Len=0 TSval=18650195 TSecr=835845112 SLE=263350 SRE=264798
 62   0.020624 54.192.157.139 -> 172.31.29.138 TCP 1514 [TCP Out-Of-Order] [TCP segment of a reassembled PDU]
 63   0.020628 172.31.29.138 -> 54.192.157.139 TCP 66 53869 > http [ACK] Seq=97 Ack=264798 Win=398336 Len=0 TSval=18650195 TSecr=835845113
 64   0.020737 54.192.157.139 -> 172.31.29.138 TCP 26130 [TCP segment of a reassembled PDU]
 65   0.020751 172.31.29.138 -> 54.192.157.139 TCP 66 53869 > http [ACK] Seq=97 Ack=290862 Win=450432 Len=0 TSval=18650195 TSecr=835845113
 66   0.020782 54.192.157.139 -> 172.31.29.138 TCP 15994 [TCP segment of a reassembled PDU]
 67   0.020790 172.31.29.138 -> 54.192.157.139 TCP 66 53869 > http [ACK] Seq=97 Ack=306790 Win=482304 Len=0 TSval=18650195 TSecr=835845113
 68   0.021373 54.192.157.139 -> 172.31.29.138 TCP 10202 [TCP segment of a reassembled PDU]
 69   0.021381 172.31.29.138 -> 54.192.157.139 TCP 66 53869 > http [ACK] Seq=97 Ack=316926 Win=502528 Len=0 TSval=18650195 TSecr=835845113
 70   0.021534 54.192.157.139 -> 172.31.29.138 TCP 26130 [TCP segment of a reassembled PDU]
 71   0.021547 172.31.29.138 -> 54.192.157.139 TCP 66 53869 > http [ACK] Seq=97 Ack=342990 Win=554624 Len=0 TSval=18650195 TSecr=835845113
 72   0.021564 54.192.157.139 -> 172.31.29.138 TCP 13098 [TCP segment of a reassembled PDU]
 73   0.021570 172.31.29.138 -> 54.192.157.139 TCP 66 53869 > http [ACK] Seq=97 Ack=356022 Win=580736 Len=0 TSval=18650195 TSecr=835845113
 74   0.022157 54.192.157.139 -> 172.31.29.138 TCP 10202 [TCP segment of a reassembled PDU]
 75   0.022165 172.31.29.138 -> 54.192.157.139 TCP 66 53869 > http [ACK] Seq=97 Ack=366158 Win=600960 Len=0 TSval=18650195 TSecr=835845113
 76   0.022308 54.192.157.139 -> 172.31.29.138 TCP 29026 [TCP segment of a reassembled PDU]
 77   0.022323 172.31.29.138 -> 54.192.157.139 TCP 66 53869 > http [ACK] Seq=97 Ack=395118 Win=658944 Len=0 TSval=18650195 TSecr=835845113
 78   0.022895 54.192.157.139 -> 172.31.29.138 TCP 4410 [TCP segment of a reassembled PDU]
 79   0.022901 172.31.29.138 -> 54.192.157.139 TCP 66 53869 > http [ACK] Seq=97 Ack=399462 Win=667648 Len=0 TSval=18650195 TSecr=835845113
 80   0.023093 54.192.157.139 -> 172.31.29.138 TCP 29026 [TCP segment of a reassembled PDU]
 81   0.023108 172.31.29.138 -> 54.192.157.139 TCP 66 53869 > http [ACK] Seq=97 Ack=428422 Win=664192 Len=0 TSval=18650195 TSecr=835845113
 82   0.023116 54.192.157.139 -> 172.31.29.138 TCP 4410 [TCP segment of a reassembled PDU]
 83   0.023123 172.31.29.138 -> 54.192.157.139 TCP 66 53869 > http [ACK] Seq=97 Ack=432766 Win=659968 Len=0 TSval=18650195 TSecr=835845113
 84   0.023129 54.192.157.139 -> 172.31.29.138 TCP 4410 [TCP segment of a reassembled PDU]
 85   0.023133 172.31.29.138 -> 54.192.157.139 TCP 66 53869 > http [ACK] Seq=97 Ack=437110 Win=655744 Len=0 TSval=18650195 TSecr=835845113
 86   0.023679 54.192.157.139 -> 172.31.29.138 TCP 4410 [TCP segment of a reassembled PDU]
 87   0.023685 172.31.29.138 -> 54.192.157.139 TCP 66 53869 > http [ACK] Seq=97 Ack=441454 Win=676352 Len=0 TSval=18650195 TSecr=835845113
 88   0.023859 54.192.157.139 -> 172.31.29.138 TCP 26130 [TCP segment of a reassembled PDU]
 89   0.023872 172.31.29.138 -> 54.192.157.139 TCP 66 53869 > http [ACK] Seq=97 Ack=467518 Win=669056 Len=0 TSval=18650195 TSecr=835845113
 90   0.023893 54.192.157.139 -> 172.31.29.138 TCP 18890 [TCP segment of a reassembled PDU]
 91   0.023901 172.31.29.138 -> 54.192.157.139 TCP 66 53869 > http [ACK] Seq=97 Ack=486342 Win=650240 Len=0 TSval=18650195 TSecr=835845113
 92   0.023906 54.192.157.139 -> 172.31.29.138 TCP 1514 [TCP segment of a reassembled PDU]
 93   0.023908 172.31.29.138 -> 54.192.157.139 TCP 66 53869 > http [ACK] Seq=97 Ack=487790 Win=648832 Len=0 TSval=18650195 TSecr=835845113
 94   0.024443 54.192.157.139 -> 172.31.29.138 TCP 7306 [TCP segment of a reassembled PDU]
 95   0.024451 172.31.29.138 -> 54.192.157.139 TCP 66 53869 > http [ACK] Seq=97 Ack=495030 Win=690816 Len=0 TSval=18650196 TSecr=835845113
 96   0.024552 54.192.157.139 -> 172.31.29.138 TCP 7306 [TCP segment of a reassembled PDU]
 97   0.024558 172.31.29.138 -> 54.192.157.139 TCP 66 53869 > http [ACK] Seq=97 Ack=502270 Win=705280 Len=0 TSval=18650196 TSecr=835845113
 98   0.024857 54.192.157.139 -> 172.31.29.138 TCP 26130 [TCP segment of a reassembled PDU]
 99   0.024872 172.31.29.138 -> 54.192.157.139 TCP 66 53869 > http [ACK] Seq=97 Ack=528334 Win=757376 Len=0 TSval=18650196 TSecr=835845113
100   0.024905 54.192.157.139 -> 172.31.29.138 TCP 20338 [TCP segment of a reassembled PDU]
101   0.024915 172.31.29.138 -> 54.192.157.139 TCP 66 53869 > http [ACK] Seq=97 Ack=548606 Win=797952 Len=0 TSval=18650196 TSecr=835845113
102   0.024954 54.192.157.139 -> 172.31.29.138 TCP 7306 [TCP segment of a reassembled PDU]
103   0.024962 172.31.29.138 -> 54.192.157.139 TCP 66 53869 > http [ACK] Seq=97 Ack=555846 Win=812416 Len=0 TSval=18650196 TSecr=835845113
104   0.025259 54.192.157.139 -> 172.31.29.138 TCP 11650 [TCP segment of a reassembled PDU]
105   0.025267 172.31.29.138 -> 54.192.157.139 TCP 66 53869 > http [ACK] Seq=97 Ack=567430 Win=835584 Len=0 TSval=18650196 TSecr=835845113
106   0.025548 54.192.157.139 -> 172.31.29.138 TCP 21786 [TCP segment of a reassembled PDU]
107   0.025560 172.31.29.138 -> 54.192.157.139 TCP 66 53869 > http [ACK] Seq=97 Ack=589150 Win=878976 Len=0 TSval=18650196 TSecr=835845113
108   0.025706 54.192.157.139 -> 172.31.29.138 TCP 21786 [TCP segment of a reassembled PDU]
109   0.025718 172.31.29.138 -> 54.192.157.139 TCP 66 53869 > http [ACK] Seq=97 Ack=610870 Win=922496 Len=0 TSval=18650196 TSecr=835845113
110   0.025773 54.192.157.139 -> 172.31.29.138 TCP 20338 [TCP segment of a reassembled PDU]
111   0.025784 172.31.29.138 -> 54.192.157.139 TCP 66 53869 > http [ACK] Seq=97 Ack=631142 Win=963072 Len=0 TSval=18650196 TSecr=835845113
112   0.026002 54.192.157.139 -> 172.31.29.138 TCP 1514 [TCP segment of a reassembled PDU]
113   0.026007 172.31.29.138 -> 54.192.157.139 TCP 66 53869 > http [ACK] Seq=97 Ack=632590 Win=965888 Len=0 TSval=18650196 TSecr=835845114
114   0.026246 54.192.157.139 -> 172.31.29.138 TCP 4410 [TCP segment of a reassembled PDU]
115   0.026252 172.31.29.138 -> 54.192.157.139 TCP 66 53869 > http [ACK] Seq=97 Ack=636934 Win=974592 Len=0 TSval=18650196 TSecr=835845114
116   0.026417 54.192.157.139 -> 172.31.29.138 TCP 26130 [TCP segment of a reassembled PDU]
117   0.026430 172.31.29.138 -> 54.192.157.139 TCP 66 53869 > http [ACK] Seq=97 Ack=662998 Win=1026688 Len=0 TSval=18650196 TSecr=835845114
118   0.026442 54.192.157.139 -> 172.31.29.138 TCP 10202 [TCP segment of a reassembled PDU]
119   0.026448 172.31.29.138 -> 54.192.157.139 TCP 66 53869 > http [ACK] Seq=97 Ack=673134 Win=1047040 Len=0 TSval=18650196 TSecr=835845114
120   0.026476 54.192.157.139 -> 172.31.29.138 TCP 15994 [TCP segment of a reassembled PDU]
121   0.026486 172.31.29.138 -> 54.192.157.139 TCP 66 53869 > http [ACK] Seq=97 Ack=689062 Win=1078912 Len=0 TSval=18650196 TSecr=835845114
122   0.026555 54.192.157.139 -> 172.31.29.138 TCP 8754 [TCP segment of a reassembled PDU]
123   0.026563 172.31.29.138 -> 54.192.157.139 TCP 66 53869 > http [ACK] Seq=97 Ack=697750 Win=1096192 Len=0 TSval=18650196 TSecr=835845114
124   0.027290 54.192.157.139 -> 172.31.29.138 TCP 14546 [TCP segment of a reassembled PDU]
125   0.027300 172.31.29.138 -> 54.192.157.139 TCP 66 53869 > http [ACK] Seq=97 Ack=712230 Win=1125248 Len=0 TSval=18650196 TSecr=835845114
126   0.027413 54.192.157.139 -> 172.31.29.138 TCP 26130 [TCP segment of a reassembled PDU]
127   0.027428 172.31.29.138 -> 54.192.157.139 TCP 66 53869 > http [ACK] Seq=97 Ack=738294 Win=1173632 Len=0 TSval=18650196 TSecr=835845114
128   0.027463 54.192.157.139 -> 172.31.29.138 TCP 24682 [TCP segment of a reassembled PDU]
129   0.027475 172.31.29.138 -> 54.192.157.139 TCP 66 53869 > http [ACK] Seq=97 Ack=762910 Win=1149056 Len=0 TSval=18650196 TSecr=835845114
130   0.028028 54.192.157.139 -> 172.31.29.138 TCP 4410 [TCP segment of a reassembled PDU]
131   0.028034 172.31.29.138 -> 54.192.157.139 TCP 66 53869 > http [ACK] Seq=97 Ack=767254 Win=1186048 Len=0 TSval=18650196 TSecr=835845114
132   0.028202 54.192.157.139 -> 172.31.29.138 TCP 26130 [TCP segment of a reassembled PDU]
133   0.028215 172.31.29.138 -> 54.192.157.139 TCP 66 53869 > http [ACK] Seq=97 Ack=793318 Win=1173632 Len=0 TSval=18650197 TSecr=835845114
134   0.028257 54.192.157.139 -> 172.31.29.138 TCP 26130 [TCP segment of a reassembled PDU]
135   0.028269 172.31.29.138 -> 54.192.157.139 TCP 66 53869 > http [ACK] Seq=97 Ack=819382 Win=1147648 Len=0 TSval=18650197 TSecr=835845114
136   0.028293 54.192.157.139 -> 172.31.29.138 TCP 8754 [TCP segment of a reassembled PDU]
137   0.028301 172.31.29.138 -> 54.192.157.139 TCP 66 53869 > http [ACK] Seq=97 Ack=828070 Win=1159296 Len=0 TSval=18650197 TSecr=835845114
138   0.028786 54.192.157.139 -> 172.31.29.138 TCP 1514 [TCP segment of a reassembled PDU]
139   0.028791 172.31.29.138 -> 54.192.157.139 TCP 66 53869 > http [ACK] Seq=97 Ack=829518 Win=1188864 Len=0 TSval=18650197 TSecr=835845114
140   0.028972 54.192.157.139 -> 172.31.29.138 TCP 26130 [TCP segment of a reassembled PDU]
141   0.028986 172.31.29.138 -> 54.192.157.139 TCP 66 53869 > http [ACK] Seq=97 Ack=855582 Win=1173632 Len=0 TSval=18650197 TSecr=835845114
142   0.028996 54.192.157.139 -> 172.31.29.138 TCP 7306 [TCP segment of a reassembled PDU]
143   0.029000 172.31.29.138 -> 54.192.157.139 TCP 66 53869 > http [ACK] Seq=97 Ack=862822 Win=1166464 Len=0 TSval=18650197 TSecr=835845114
144   0.029040 54.192.157.139 -> 172.31.29.138 TCP 18890 [TCP segment of a reassembled PDU]
145   0.029058 172.31.29.138 -> 54.192.157.139 TCP 66 53869 > http [ACK] Seq=97 Ack=881646 Win=1173504 Len=0 TSval=18650197 TSecr=835845114
146   0.029171 54.192.157.139 -> 172.31.29.138 TCP 46402 [TCP segment of a reassembled PDU]
147   0.029301 172.31.29.138 -> 54.192.157.139 TCP 66 53869 > http [ACK] Seq=97 Ack=927982 Win=1140224 Len=0 TSval=18650197 TSecr=835845114
148   0.029852 54.192.157.139 -> 172.31.29.138 TCP 8754 [TCP segment of a reassembled PDU]
149   0.029859 172.31.29.138 -> 54.192.157.139 TCP 66 53869 > http [ACK] Seq=97 Ack=936670 Win=1202176 Len=0 TSval=18650197 TSecr=835845114
150   0.030021 54.192.157.139 -> 172.31.29.138 TCP 26130 [TCP segment of a reassembled PDU]
151   0.030048 172.31.29.138 -> 54.192.157.139 TCP 66 53869 > http [ACK] Seq=97 Ack=962734 Win=1176192 Len=0 TSval=18650197 TSecr=835845114
152   0.030080 54.192.157.139 -> 172.31.29.138 TCP 26130 [TCP segment of a reassembled PDU]
153   0.030101 172.31.29.138 -> 54.192.157.139 TCP 66 53869 > http [ACK] Seq=97 Ack=988798 Win=1173632 Len=0 TSval=18650197 TSecr=835845114
154   0.030146 54.192.157.139 -> 172.31.29.138 TCP 26130 [TCP segment of a reassembled PDU]
155   0.030159 172.31.29.138 -> 54.192.157.139 TCP 66 53869 > http [ACK] Seq=97 Ack=1014862 Win=1173632 Len=0 TSval=18650197 TSecr=835845114
156   0.030174 54.192.157.139 -> 172.31.29.138 TCP 8754 [TCP segment of a reassembled PDU]
157   0.030192 172.31.29.138 -> 54.192.157.139 TCP 66 53869 > http [ACK] Seq=97 Ack=1023550 Win=1165056 Len=0 TSval=18650197 TSecr=835845114
158   0.030844 54.192.157.139 -> 172.31.29.138 TCP 1514 [TCP segment of a reassembled PDU]
159   0.030850 172.31.29.138 -> 54.192.157.139 TCP 66 53869 > http [ACK] Seq=97 Ack=1024998 Win=1209216 Len=0 TSval=18650197 TSecr=835845114
160   0.031012 54.192.157.139 -> 172.31.29.138 HTTP 24102 HTTP/1.1 200 OK  (application/octet-stream)
161   0.031037 172.31.29.138 -> 54.192.157.139 TCP 66 53869 > http [ACK] Seq=97 Ack=1049034 Win=1185280 Len=0 TSval=18650197 TSecr=835845114
162   0.031174 172.31.29.138 -> 54.192.157.139 TCP 66 53869 > http [FIN, ACK] Seq=97 Ack=1049034 Win=1209216 Len=0 TSval=18650197 TSecr=835845114
163   0.031857 54.192.157.139 -> 172.31.29.138 TCP 66 http > 53869 [FIN, ACK] Seq=1049034 Ack=98 Win=14592 Len=0 TSval=835845114 TSecr=18650197
164   0.031865 172.31.29.138 -> 54.192.157.139 TCP 66 53869 > http [ACK] Seq=98 Ack=1049035 Win=1209216 Len=0 TSval=18650197 TSecr=835845114
