[Measurement for 1mb at 19:39:22 19.39.2014] 
Tshark:

  1   0.000000 172.31.29.138 -> 172.31.0.2   DNS 89 Standard query 0x9eea  A d3m1c4hwkgedal.cloudfront.net
  2   0.000028 172.31.29.138 -> 172.31.0.2   DNS 89 Standard query 0x9af8  AAAA d3m1c4hwkgedal.cloudfront.net
  3   0.000566   172.31.0.2 -> 172.31.29.138 DNS 217 Standard query response 0x9eea  A 54.230.158.246 A 54.230.158.252 A 54.240.168.128 A 54.192.159.173 A 54.230.156.193 A 54.230.158.139 A 54.230.158.152 A 54.230.158.182
  4   0.000655   172.31.0.2 -> 172.31.29.138 DNS 174 Standard query response 0x9af8 
  5   0.003875 172.31.29.138 -> 54.230.158.246 TCP 74 45625 > http [SYN] Seq=0 Win=26883 Len=0 MSS=8961 SACK_PERM=1 TSval=2458855 TSecr=0 WS=128
  6   0.004736 54.230.158.246 -> 172.31.29.138 TCP 74 http > 45625 [SYN, ACK] Seq=0 Ack=1 Win=14480 Len=0 MSS=1460 SACK_PERM=1 TSval=727233134 TSecr=2458855 WS=128
  7   0.004750 172.31.29.138 -> 54.230.158.246 TCP 66 45625 > http [ACK] Seq=1 Ack=1 Win=27008 Len=0 TSval=2458855 TSecr=727233134
  8   0.004793 172.31.29.138 -> 54.230.158.246 HTTP 162 GET /1mb HTTP/1.1 
  9   0.005477 54.230.158.246 -> 172.31.29.138 TCP 66 http > 45625 [ACK] Seq=1 Ack=97 Win=14592 Len=0 TSval=727233135 TSecr=2458855
 10   0.007030 54.230.158.246 -> 172.31.29.138 TCP 522 [TCP segment of a reassembled PDU]
 11   0.007038 172.31.29.138 -> 54.230.158.246 TCP 66 45625 > http [ACK] Seq=97 Ack=457 Win=28032 Len=0 TSval=2458856 TSecr=727233135
 12   0.007098 54.230.158.246 -> 172.31.29.138 TCP 11650 [TCP segment of a reassembled PDU]
 13   0.007108 172.31.29.138 -> 54.230.158.246 TCP 66 45625 > http [ACK] Seq=97 Ack=12041 Win=51200 Len=0 TSval=2458856 TSecr=727233135
 14   0.007134 54.230.158.246 -> 172.31.29.138 TCP 1514 [TCP segment of a reassembled PDU]
 15   0.007141 172.31.29.138 -> 54.230.158.246 TCP 66 45625 > http [ACK] Seq=97 Ack=13489 Win=54144 Len=0 TSval=2458856 TSecr=727233135
 16   0.007831 54.230.158.246 -> 172.31.29.138 TCP 8754 [TCP segment of a reassembled PDU]
 17   0.007839 172.31.29.138 -> 54.230.158.246 TCP 66 45625 > http [ACK] Seq=97 Ack=22177 Win=71424 Len=0 TSval=2458856 TSecr=727233135
 18   0.007864 54.230.158.246 -> 172.31.29.138 TCP 4410 [TCP segment of a reassembled PDU]
 19   0.007870 172.31.29.138 -> 54.230.158.246 TCP 66 45625 > http [ACK] Seq=97 Ack=26521 Win=80128 Len=0 TSval=2458856 TSecr=727233135
 20   0.008330 54.230.158.246 -> 172.31.29.138 TCP 7306 [TCP segment of a reassembled PDU]
 21   0.008337 172.31.29.138 -> 54.230.158.246 TCP 66 45625 > http [ACK] Seq=97 Ack=33761 Win=94592 Len=0 TSval=2458856 TSecr=727233135
 22   0.008447 54.230.158.246 -> 172.31.29.138 TCP 14546 [TCP segment of a reassembled PDU]
 23   0.008469 172.31.29.138 -> 54.230.158.246 TCP 66 45625 > http [ACK] Seq=97 Ack=48241 Win=94080 Len=0 TSval=2458856 TSecr=727233135
 24   0.008840 54.230.158.246 -> 172.31.29.138 TCP 4410 [TCP segment of a reassembled PDU]
 25   0.008846 172.31.29.138 -> 54.230.158.246 TCP 66 45625 > http [ACK] Seq=97 Ack=52585 Win=103296 Len=0 TSval=2458856 TSecr=727233135
 26   0.009094 54.230.158.246 -> 172.31.29.138 TCP 4410 [TCP segment of a reassembled PDU]
 27   0.009100 172.31.29.138 -> 54.230.158.246 TCP 66 45625 > http [ACK] Seq=97 Ack=56929 Win=109056 Len=0 TSval=2458856 TSecr=727233135
 28   0.009189 54.230.158.246 -> 172.31.29.138 TCP 8754 [TCP segment of a reassembled PDU]
 29   0.009196 172.31.29.138 -> 54.230.158.246 TCP 66 45625 > http [ACK] Seq=97 Ack=65617 Win=103680 Len=0 TSval=2458856 TSecr=727233135
 30   0.009366 54.230.158.246 -> 172.31.29.138 TCP 7306 [TCP segment of a reassembled PDU]
 31   0.009373 172.31.29.138 -> 54.230.158.246 TCP 66 45625 > http [ACK] Seq=97 Ack=72857 Win=105984 Len=0 TSval=2458856 TSecr=727233135
 32   0.009410 54.230.158.246 -> 172.31.29.138 TCP 5858 [TCP segment of a reassembled PDU]
 33   0.009416 172.31.29.138 -> 54.230.158.246 TCP 66 45625 > http [ACK] Seq=97 Ack=78649 Win=108416 Len=0 TSval=2458856 TSecr=727233135
 34   0.009963 54.230.158.246 -> 172.31.29.138 TCP 13098 [TCP segment of a reassembled PDU]
 35   0.009972 172.31.29.138 -> 54.230.158.246 TCP 66 45625 > http [ACK] Seq=97 Ack=91681 Win=96512 Len=0 TSval=2458856 TSecr=727233135
 36   0.009981 54.230.158.246 -> 172.31.29.138 TCP 1514 [TCP segment of a reassembled PDU]
 37   0.009983 172.31.29.138 -> 54.230.158.246 TCP 66 45625 > http [ACK] Seq=97 Ack=93129 Win=95104 Len=0 TSval=2458856 TSecr=727233135
 38   0.009995 54.230.158.246 -> 172.31.29.138 TCP 11650 [TCP segment of a reassembled PDU]
 39   0.010002 172.31.29.138 -> 54.230.158.246 TCP 66 45625 > http [ACK] Seq=97 Ack=104713 Win=83584 Len=0 TSval=2458856 TSecr=727233135
 40   0.010634 54.230.158.246 -> 172.31.29.138 TCP 5858 [TCP segment of a reassembled PDU]
 41   0.010641 172.31.29.138 -> 54.230.158.246 TCP 66 45625 > http [ACK] Seq=97 Ack=110505 Win=108416 Len=0 TSval=2458857 TSecr=727233135
 42   0.010726 54.230.158.246 -> 172.31.29.138 TCP 7306 [TCP segment of a reassembled PDU]
 43   0.010733 172.31.29.138 -> 54.230.158.246 TCP 66 45625 > http [ACK] Seq=97 Ack=117745 Win=123520 Len=0 TSval=2458857 TSecr=727233135
 44   0.010791 54.230.158.246 -> 172.31.29.138 TCP 13098 [TCP segment of a reassembled PDU]
 45   0.010800 172.31.29.138 -> 54.230.158.246 TCP 66 45625 > http [ACK] Seq=97 Ack=130777 Win=149632 Len=0 TSval=2458857 TSecr=727233135
 46   0.011133 54.230.158.246 -> 172.31.29.138 TCP 4410 [TCP segment of a reassembled PDU]
 47   0.011140 172.31.29.138 -> 54.230.158.246 TCP 66 45625 > http [ACK] Seq=97 Ack=135121 Win=158336 Len=0 TSval=2458857 TSecr=727233135
 48   0.011249 54.230.158.246 -> 172.31.29.138 TCP 8754 [TCP segment of a reassembled PDU]
 49   0.011257 172.31.29.138 -> 54.230.158.246 TCP 66 45625 > http [ACK] Seq=97 Ack=143809 Win=175616 Len=0 TSval=2458857 TSecr=727233135
 50   0.011533 54.230.158.246 -> 172.31.29.138 TCP 26130 [TCP segment of a reassembled PDU]
 51   0.011544 172.31.29.138 -> 54.230.158.246 TCP 66 45625 > http [ACK] Seq=97 Ack=169873 Win=227840 Len=0 TSval=2458857 TSecr=727233135
 52   0.011913 54.230.158.246 -> 172.31.29.138 TCP 7306 [TCP segment of a reassembled PDU]
 53   0.011920 172.31.29.138 -> 54.230.158.246 TCP 66 45625 > http [ACK] Seq=97 Ack=177113 Win=242304 Len=0 TSval=2458857 TSecr=727233135
 54   0.012034 54.230.158.246 -> 172.31.29.138 TCP 5858 [TCP segment of a reassembled PDU]
 55   0.012045 172.31.29.138 -> 54.230.158.246 TCP 66 45625 > http [ACK] Seq=97 Ack=182905 Win=253824 Len=0 TSval=2458857 TSecr=727233135
 56   0.012271 54.230.158.246 -> 172.31.29.138 TCP 13098 [TCP segment of a reassembled PDU]
 57   0.012281 172.31.29.138 -> 54.230.158.246 TCP 66 45625 > http [ACK] Seq=97 Ack=195937 Win=279936 Len=0 TSval=2458857 TSecr=727233135
 58   0.012354 54.230.158.246 -> 172.31.29.138 TCP 18890 [TCP segment of a reassembled PDU]
 59   0.012365 172.31.29.138 -> 54.230.158.246 TCP 66 45625 > http [ACK] Seq=97 Ack=214761 Win=317568 Len=0 TSval=2458857 TSecr=727233135
 60   0.012781 54.230.158.246 -> 172.31.29.138 TCP 15994 [TCP segment of a reassembled PDU]
 61   0.012791 172.31.29.138 -> 54.230.158.246 TCP 66 45625 > http [ACK] Seq=97 Ack=230689 Win=349440 Len=0 TSval=2458857 TSecr=727233135
 62   0.012941 54.230.158.246 -> 172.31.29.138 TCP 5858 [TCP segment of a reassembled PDU]
 63   0.012948 172.31.29.138 -> 54.230.158.246 TCP 66 45625 > http [ACK] Seq=97 Ack=236481 Win=360960 Len=0 TSval=2458857 TSecr=727233135
 64   0.013152 54.230.158.246 -> 172.31.29.138 TCP 26130 [TCP segment of a reassembled PDU]
 65   0.013166 172.31.29.138 -> 54.230.158.246 TCP 66 45625 > http [ACK] Seq=97 Ack=262545 Win=413184 Len=0 TSval=2458857 TSecr=727233135
 66   0.013174 54.230.158.246 -> 172.31.29.138 TCP 2962 [TCP segment of a reassembled PDU]
 67   0.013179 172.31.29.138 -> 54.230.158.246 TCP 66 45625 > http [ACK] Seq=97 Ack=265441 Win=418944 Len=0 TSval=2458857 TSecr=727233135
 68   0.013465 54.230.158.246 -> 172.31.29.138 TCP 5858 [TCP segment of a reassembled PDU]
 69   0.013473 172.31.29.138 -> 54.230.158.246 TCP 66 45625 > http [ACK] Seq=97 Ack=271233 Win=430464 Len=0 TSval=2458857 TSecr=727233135
 70   0.013623 54.230.158.246 -> 172.31.29.138 TCP 17442 [TCP segment of a reassembled PDU]
 71   0.013634 172.31.29.138 -> 54.230.158.246 TCP 66 45625 > http [ACK] Seq=97 Ack=288609 Win=465280 Len=0 TSval=2458857 TSecr=727233135
 72   0.013710 54.230.158.246 -> 172.31.29.138 TCP 7306 [TCP segment of a reassembled PDU]
 73   0.013717 172.31.29.138 -> 54.230.158.246 TCP 66 45625 > http [ACK] Seq=97 Ack=295849 Win=479744 Len=0 TSval=2458857 TSecr=727233135
 74   0.013845 54.230.158.246 -> 172.31.29.138 TCP 13098 [TCP segment of a reassembled PDU]
 75   0.013855 172.31.29.138 -> 54.230.158.246 TCP 66 45625 > http [ACK] Seq=97 Ack=308881 Win=505856 Len=0 TSval=2458857 TSecr=727233135
 76   0.014080 54.230.158.246 -> 172.31.29.138 TCP 8754 [TCP segment of a reassembled PDU]
 77   0.014089 172.31.29.138 -> 54.230.158.246 TCP 66 45625 > http [ACK] Seq=97 Ack=317569 Win=523136 Len=0 TSval=2458857 TSecr=727233135
 78   0.014198 54.230.158.246 -> 172.31.29.138 TCP 4410 [TCP segment of a reassembled PDU]
 79   0.014205 172.31.29.138 -> 54.230.158.246 TCP 66 45625 > http [ACK] Seq=97 Ack=321913 Win=531840 Len=0 TSval=2458858 TSecr=727233135
 80   0.014404 54.230.158.246 -> 172.31.29.138 TCP 20338 [TCP segment of a reassembled PDU]
 81   0.014416 172.31.29.138 -> 54.230.158.246 TCP 66 45625 > http [ACK] Seq=97 Ack=342185 Win=572416 Len=0 TSval=2458858 TSecr=727233135
 82   0.014650 54.230.158.246 -> 172.31.29.138 TCP 29026 [TCP segment of a reassembled PDU]
 83   0.014665 172.31.29.138 -> 54.230.158.246 TCP 66 45625 > http [ACK] Seq=97 Ack=371145 Win=630400 Len=0 TSval=2458858 TSecr=727233135
 84   0.015043 54.230.158.246 -> 172.31.29.138 TCP 17442 [TCP segment of a reassembled PDU]
 85   0.015055 172.31.29.138 -> 54.230.158.246 TCP 66 45625 > http [ACK] Seq=97 Ack=388521 Win=665088 Len=0 TSval=2458858 TSecr=727233135
 86   0.015092 54.230.158.246 -> 172.31.29.138 TCP 2962 [TCP segment of a reassembled PDU]
 87   0.015097 172.31.29.138 -> 54.230.158.246 TCP 66 45625 > http [ACK] Seq=97 Ack=391417 Win=670848 Len=0 TSval=2458858 TSecr=727233135
 88   0.015220 54.230.158.246 -> 172.31.29.138 TCP 4410 [TCP segment of a reassembled PDU]
 89   0.015225 172.31.29.138 -> 54.230.158.246 TCP 66 45625 > http [ACK] Seq=97 Ack=395761 Win=679552 Len=0 TSval=2458858 TSecr=727233135
 90   0.015404 54.230.158.246 -> 172.31.29.138 TCP 26130 [TCP segment of a reassembled PDU]
 91   0.015417 172.31.29.138 -> 54.230.158.246 TCP 66 45625 > http [ACK] Seq=97 Ack=421825 Win=731648 Len=0 TSval=2458858 TSecr=727233136
 92   0.015428 54.230.158.246 -> 172.31.29.138 TCP 7306 [TCP segment of a reassembled PDU]
 93   0.015434 172.31.29.138 -> 54.230.158.246 TCP 66 45625 > http [ACK] Seq=97 Ack=429065 Win=746240 Len=0 TSval=2458858 TSecr=727233136
 94   0.015604 54.230.158.246 -> 172.31.29.138 TCP 10202 [TCP segment of a reassembled PDU]
 95   0.015613 172.31.29.138 -> 54.230.158.246 TCP 66 45625 > http [ACK] Seq=97 Ack=439201 Win=766464 Len=0 TSval=2458858 TSecr=727233136
 96   0.015739 54.230.158.246 -> 172.31.29.138 TCP 4410 [TCP segment of a reassembled PDU]
 97   0.015745 172.31.29.138 -> 54.230.158.246 TCP 66 45625 > http [ACK] Seq=97 Ack=443545 Win=775168 Len=0 TSval=2458858 TSecr=727233136
 98   0.015868 54.230.158.246 -> 172.31.29.138 TCP 5858 [TCP segment of a reassembled PDU]
 99   0.015875 172.31.29.138 -> 54.230.158.246 TCP 66 45625 > http [ACK] Seq=97 Ack=449337 Win=786688 Len=0 TSval=2458858 TSecr=727233136
100   0.016011 54.230.158.246 -> 172.31.29.138 TCP 5858 [TCP segment of a reassembled PDU]
101   0.016018 172.31.29.138 -> 54.230.158.246 TCP 66 45625 > http [ACK] Seq=97 Ack=455129 Win=798336 Len=0 TSval=2458858 TSecr=727233136
102   0.016186 54.230.158.246 -> 172.31.29.138 TCP 26130 [TCP segment of a reassembled PDU]
103   0.016200 172.31.29.138 -> 54.230.158.246 TCP 66 45625 > http [ACK] Seq=97 Ack=481193 Win=850432 Len=0 TSval=2458858 TSecr=727233136
104   0.016216 54.230.158.246 -> 172.31.29.138 TCP 14546 [TCP segment of a reassembled PDU]
105   0.016228 172.31.29.138 -> 54.230.158.246 TCP 66 45625 > http [ACK] Seq=97 Ack=495673 Win=879360 Len=0 TSval=2458858 TSecr=727233136
106   0.016413 54.230.158.246 -> 172.31.29.138 TCP 18890 [TCP segment of a reassembled PDU]
107   0.016424 172.31.29.138 -> 54.230.158.246 TCP 66 45625 > http [ACK] Seq=97 Ack=514497 Win=916992 Len=0 TSval=2458858 TSecr=727233136
108   0.016783 54.230.158.246 -> 172.31.29.138 TCP 5858 [TCP segment of a reassembled PDU]
109   0.016790 172.31.29.138 -> 54.230.158.246 TCP 66 45625 > http [ACK] Seq=97 Ack=520289 Win=928640 Len=0 TSval=2458858 TSecr=727233136
110   0.016985 54.230.158.246 -> 172.31.29.138 TCP 26130 [TCP segment of a reassembled PDU]
111   0.017000 172.31.29.138 -> 54.230.158.246 TCP 66 45625 > http [ACK] Seq=97 Ack=546353 Win=980736 Len=0 TSval=2458858 TSecr=727233136
112   0.017016 54.230.158.246 -> 172.31.29.138 TCP 11650 [TCP segment of a reassembled PDU]
113   0.017022 172.31.29.138 -> 54.230.158.246 TCP 66 45625 > http [ACK] Seq=97 Ack=557937 Win=1003904 Len=0 TSval=2458858 TSecr=727233136
114   0.017095 54.230.158.246 -> 172.31.29.138 TCP 21786 [TCP segment of a reassembled PDU]
115   0.017108 172.31.29.138 -> 54.230.158.246 TCP 66 45625 > http [ACK] Seq=97 Ack=579657 Win=1047424 Len=0 TSval=2458858 TSecr=727233136
116   0.017547 54.230.158.246 -> 172.31.29.138 TCP 5858 [TCP segment of a reassembled PDU]
117   0.017554 172.31.29.138 -> 54.230.158.246 TCP 66 45625 > http [ACK] Seq=97 Ack=585449 Win=1058944 Len=0 TSval=2458858 TSecr=727233136
118   0.017730 54.230.158.246 -> 172.31.29.138 TCP 23234 [TCP segment of a reassembled PDU]
119   0.017742 172.31.29.138 -> 54.230.158.246 TCP 66 45625 > http [ACK] Seq=97 Ack=608617 Win=1097216 Len=0 TSval=2458858 TSecr=727233136
120   0.017758 54.230.158.246 -> 172.31.29.138 TCP 2962 [TCP segment of a reassembled PDU]
121   0.017762 172.31.29.138 -> 54.230.158.246 TCP 66 45625 > http [ACK] Seq=97 Ack=611513 Win=1094400 Len=0 TSval=2458858 TSecr=727233136
122   0.017868 54.230.158.246 -> 172.31.29.138 TCP 33370 [TCP segment of a reassembled PDU]
123   0.017884 172.31.29.138 -> 54.230.158.246 TCP 66 45625 > http [ACK] Seq=97 Ack=644817 Win=1080576 Len=0 TSval=2458858 TSecr=727233136
124   0.018093 54.230.158.246 -> 172.31.29.138 TCP 13098 [TCP segment of a reassembled PDU]
125   0.018103 172.31.29.138 -> 54.230.158.246 TCP 66 45625 > http [ACK] Seq=97 Ack=657849 Win=1113984 Len=0 TSval=2458858 TSecr=727233136
126   0.018222 54.230.158.246 -> 172.31.29.138 TCP 13098 [TCP segment of a reassembled PDU]
127   0.018232 172.31.29.138 -> 54.230.158.246 TCP 66 45625 > http [ACK] Seq=97 Ack=670881 Win=1113984 Len=0 TSval=2458859 TSecr=727233136
128   0.018320 54.230.158.246 -> 172.31.29.138 TCP 7306 [TCP segment of a reassembled PDU]
129   0.018327 172.31.29.138 -> 54.230.158.246 TCP 66 45625 > http [ACK] Seq=97 Ack=678121 Win=1145856 Len=0 TSval=2458859 TSecr=727233136
130   0.018731 54.230.158.246 -> 172.31.29.138 TCP 26130 [TCP segment of a reassembled PDU]
131   0.018746 172.31.29.138 -> 54.230.158.246 TCP 66 45625 > http [ACK] Seq=97 Ack=704185 Win=1197952 Len=0 TSval=2458859 TSecr=727233136
132   0.018756 54.230.158.246 -> 172.31.29.138 TCP 5858 [TCP segment of a reassembled PDU]
133   0.018761 172.31.29.138 -> 54.230.158.246 TCP 66 45625 > http [ACK] Seq=97 Ack=709977 Win=1209600 Len=0 TSval=2458859 TSecr=727233136
134   0.018984 54.230.158.246 -> 172.31.29.138 TCP 26130 [TCP segment of a reassembled PDU]
135   0.018999 172.31.29.138 -> 54.230.158.246 TCP 66 45625 > http [ACK] Seq=97 Ack=736041 Win=1261696 Len=0 TSval=2458859 TSecr=727233136
136   0.019007 54.230.158.246 -> 172.31.29.138 TCP 1514 [TCP segment of a reassembled PDU]
137   0.019009 172.31.29.138 -> 54.230.158.246 TCP 66 45625 > http [ACK] Seq=97 Ack=737489 Win=1264512 Len=0 TSval=2458859 TSecr=727233136
138   0.019024 54.230.158.246 -> 172.31.29.138 TCP 18890 [TCP segment of a reassembled PDU]
139   0.019032 172.31.29.138 -> 54.230.158.246 TCP 66 45625 > http [ACK] Seq=97 Ack=756313 Win=1302272 Len=0 TSval=2458859 TSecr=727233136
140   0.019121 54.230.158.246 -> 172.31.29.138 TCP 18890 [TCP segment of a reassembled PDU]
141   0.019131 172.31.29.138 -> 54.230.158.246 TCP 66 45625 > http [ACK] Seq=97 Ack=775137 Win=1339904 Len=0 TSval=2458859 TSecr=727233136
142   0.019421 54.230.158.246 -> 172.31.29.138 TCP 23234 [TCP segment of a reassembled PDU]
143   0.019434 172.31.29.138 -> 54.230.158.246 TCP 66 45625 > http [ACK] Seq=97 Ack=798305 Win=1386240 Len=0 TSval=2458859 TSecr=727233136
144   0.019535 54.230.158.246 -> 172.31.29.138 TCP 15994 [TCP segment of a reassembled PDU]
145   0.019545 172.31.29.138 -> 54.230.158.246 TCP 66 45625 > http [ACK] Seq=97 Ack=814233 Win=1418112 Len=0 TSval=2458859 TSecr=727233136
146   0.019652 54.230.158.246 -> 172.31.29.138 TCP 14546 [TCP segment of a reassembled PDU]
147   0.019661 172.31.29.138 -> 54.230.158.246 TCP 66 45625 > http [ACK] Seq=97 Ack=828713 Win=1447040 Len=0 TSval=2458859 TSecr=727233136
148   0.019791 54.230.158.246 -> 172.31.29.138 TCP 26130 [TCP segment of a reassembled PDU]
149   0.019806 172.31.29.138 -> 54.230.158.246 TCP 66 45625 > http [ACK] Seq=97 Ack=854777 Win=1499136 Len=0 TSval=2458859 TSecr=727233136
150   0.019832 54.230.158.246 -> 172.31.29.138 TCP 21786 [TCP segment of a reassembled PDU]
151   0.019843 172.31.29.138 -> 54.230.158.246 TCP 66 45625 > http [ACK] Seq=97 Ack=876497 Win=1542528 Len=0 TSval=2458859 TSecr=727233136
152   0.019881 54.230.158.246 -> 172.31.29.138 TCP 8754 [TCP segment of a reassembled PDU]
153   0.019887 172.31.29.138 -> 54.230.158.246 TCP 66 45625 > http [ACK] Seq=97 Ack=885185 Win=1559936 Len=0 TSval=2458859 TSecr=727233136
154   0.020186 54.230.158.246 -> 172.31.29.138 TCP 18890 [TCP segment of a reassembled PDU]
155   0.020198 172.31.29.138 -> 54.230.158.246 TCP 66 45625 > http [ACK] Seq=97 Ack=904009 Win=1597568 Len=0 TSval=2458859 TSecr=727233136
156   0.020281 54.230.158.246 -> 172.31.29.138 TCP 1514 [TCP segment of a reassembled PDU]
157   0.020286 172.31.29.138 -> 54.230.158.246 TCP 66 45625 > http [ACK] Seq=97 Ack=905457 Win=1597568 Len=0 TSval=2458859 TSecr=727233136
158   0.020430 54.230.158.246 -> 172.31.29.138 TCP 18890 [TCP segment of a reassembled PDU]
159   0.020441 172.31.29.138 -> 54.230.158.246 TCP 66 45625 > http [ACK] Seq=97 Ack=924281 Win=1597568 Len=0 TSval=2458859 TSecr=727233136
160   0.020563 54.230.158.246 -> 172.31.29.138 TCP 26130 [TCP segment of a reassembled PDU]
161   0.020577 172.31.29.138 -> 54.230.158.246 TCP 66 45625 > http [ACK] Seq=97 Ack=950345 Win=1597568 Len=0 TSval=2458859 TSecr=727233136
162   0.020592 54.230.158.246 -> 172.31.29.138 TCP 15994 [TCP segment of a reassembled PDU]
163   0.020600 172.31.29.138 -> 54.230.158.246 TCP 66 45625 > http [ACK] Seq=97 Ack=966273 Win=1597568 Len=0 TSval=2458859 TSecr=727233136
164   0.020719 54.230.158.246 -> 172.31.29.138 TCP 4410 [TCP segment of a reassembled PDU]
165   0.020724 172.31.29.138 -> 54.230.158.246 TCP 66 45625 > http [ACK] Seq=97 Ack=970617 Win=1597568 Len=0 TSval=2458859 TSecr=727233136
166   0.021032 54.230.158.246 -> 172.31.29.138 TCP 26130 [TCP segment of a reassembled PDU]
167   0.021046 172.31.29.138 -> 54.230.158.246 TCP 66 45625 > http [ACK] Seq=97 Ack=996681 Win=1597568 Len=0 TSval=2458859 TSecr=727233136
168   0.021095 54.230.158.246 -> 172.31.29.138 TCP 26130 [TCP segment of a reassembled PDU]
169   0.021108 172.31.29.138 -> 54.230.158.246 TCP 66 45625 > http [ACK] Seq=97 Ack=1022745 Win=1597568 Len=0 TSval=2458859 TSecr=727233136
170   0.021162 54.230.158.246 -> 172.31.29.138 TCP 13098 [TCP segment of a reassembled PDU]
171   0.021171 172.31.29.138 -> 54.230.158.246 TCP 66 45625 > http [ACK] Seq=97 Ack=1035777 Win=1597568 Len=0 TSval=2458859 TSecr=727233136
172   0.021284 54.230.158.246 -> 172.31.29.138 HTTP 13322 HTTP/1.1 200 OK  (application/octet-stream)
173   0.021294 172.31.29.138 -> 54.230.158.246 TCP 66 45625 > http [ACK] Seq=97 Ack=1049033 Win=1597568 Len=0 TSval=2458859 TSecr=727233136
174   0.021426 172.31.29.138 -> 54.230.158.246 TCP 66 45625 > http [FIN, ACK] Seq=97 Ack=1049033 Win=1597568 Len=0 TSval=2458859 TSecr=727233136
175   0.021876 54.230.158.246 -> 172.31.29.138 TCP 66 http > 45625 [FIN, ACK] Seq=1049033 Ack=98 Win=14592 Len=0 TSval=727233136 TSecr=2458859
176   0.021883 172.31.29.138 -> 54.230.158.246 TCP 66 45625 > http [ACK] Seq=98 Ack=1049034 Win=1597568 Len=0 TSval=2458859 TSecr=727233136
