[Measurement for 10kb at 14:39:09 20.39.2014] 
Tshark:

  1   0.000000 86.50.146.105 -> 172.31.29.138 TCP 78 53852 > ssh [ACK] Seq=1 Ack=1 Win=5322 Len=0 TSval=17993755 TSecr=19553849 SLE=42409 SRE=42853
  2   0.000032 172.31.29.138 -> 86.50.146.105 SSH 1434 Encrypted response packet len=1368
  3   0.000044 172.31.29.138 -> 86.50.146.105 SSH 1434 Encrypted response packet len=1368
  4   0.134472 86.50.146.105 -> 172.31.29.138 TCP 78 53852 > ssh [ACK] Seq=1 Ack=1369 Win=5322 Len=0 TSval=17993789 TSecr=19554404 SLE=42409 SRE=42853
  5   0.134503 172.31.29.138 -> 86.50.146.105 SSH 1434 Encrypted response packet len=1368
  6   0.134514 172.31.29.138 -> 86.50.146.105 SSH 1434 Encrypted response packet len=1368
  7   0.165103 86.50.146.105 -> 172.31.29.138 TCP 78 53852 > ssh [ACK] Seq=1 Ack=2737 Win=5322 Len=0 TSval=17993795 TSecr=19554404 SLE=42409 SRE=42853
  8   0.165116 172.31.29.138 -> 86.50.146.105 SSH 1434 Encrypted response packet len=1368
  9   0.165124 172.31.29.138 -> 86.50.146.105 SSH 1434 Encrypted response packet len=1368
 10   0.166124 86.50.146.105 -> 172.31.29.138 TCP 78 53852 > ssh [ACK] Seq=1 Ack=4105 Win=5322 Len=0 TSval=17993796 TSecr=19555011 SLE=42409 SRE=42853
 11   0.166131 172.31.29.138 -> 86.50.146.105 SSH 1434 Encrypted response packet len=1368
 12   0.166136 172.31.29.138 -> 86.50.146.105 SSH 1434 Encrypted response packet len=1368
 13   0.168400 86.50.146.105 -> 172.31.29.138 TCP 78 53852 > ssh [ACK] Seq=1 Ack=5473 Win=5322 Len=0 TSval=17993796 TSecr=19555011 SLE=42409 SRE=42853
 14   0.168405 172.31.29.138 -> 86.50.146.105 SSH 1434 Encrypted response packet len=1368
 15   0.168410 172.31.29.138 -> 86.50.146.105 SSH 1434 Encrypted response packet len=1368
 16   0.930977 172.31.29.138 -> 172.31.0.2   DNS 89 Standard query 0x33c2  A d2pcb72msibvx3.cloudfront.net
 17   0.931006 172.31.29.138 -> 172.31.0.2   DNS 89 Standard query 0x0e61  AAAA d2pcb72msibvx3.cloudfront.net
 18   0.931666   172.31.0.2 -> 172.31.29.138 DNS 217 Standard query response 0x33c2  A 54.230.150.42 A 54.230.150.107 A 54.230.150.123 A 54.230.150.154 A 54.230.149.38 A 54.230.149.97 A 54.230.150.16 A 54.230.150.29
 19   0.931683   172.31.0.2 -> 172.31.29.138 DNS 169 Standard query response 0x0e61 
 20   0.934919 172.31.29.138 -> 54.230.150.42 TCP 74 39857 > http [SYN] Seq=0 Win=26883 Len=0 MSS=8961 SACK_PERM=1 TSval=19555622 TSecr=0 WS=128
 21   0.936373 54.230.150.42 -> 172.31.29.138 TCP 74 http > 39857 [SYN, ACK] Seq=0 Ack=1 Win=14480 Len=0 MSS=1460 SACK_PERM=1 TSval=447813733 TSecr=19555622 WS=128
 22   0.936387 172.31.29.138 -> 54.230.150.42 TCP 66 39857 > http [ACK] Seq=1 Ack=1 Win=27008 Len=0 TSval=19555622 TSecr=447813733
 23   0.936427 172.31.29.138 -> 54.230.150.42 HTTP 163 GET /10kb HTTP/1.1 
 24   0.937881 54.230.150.42 -> 172.31.29.138 TCP 66 http > 39857 [ACK] Seq=1 Ack=98 Win=14592 Len=0 TSval=447813733 TSecr=19555622
 25   0.939717 54.230.150.42 -> 172.31.29.138 TCP 4410 [TCP segment of a reassembled PDU]
 26   0.939725 172.31.29.138 -> 54.230.150.42 TCP 66 39857 > http [ACK] Seq=98 Ack=4345 Win=35584 Len=0 TSval=19555623 TSecr=447813733
 27   0.939762 54.230.150.42 -> 172.31.29.138 HTTP 6417 HTTP/1.1 200 OK  (application/octet-stream)
 28   0.939770 172.31.29.138 -> 54.230.150.42 TCP 66 39857 > http [ACK] Seq=98 Ack=10696 Win=48384 Len=0 TSval=19555623 TSecr=447813733
 29   0.939913 172.31.29.138 -> 54.230.150.42 TCP 66 39857 > http [FIN, ACK] Seq=98 Ack=10696 Win=48384 Len=0 TSval=19555623 TSecr=447813733
 30   0.941491 54.230.150.42 -> 172.31.29.138 TCP 66 http > 39857 [FIN, ACK] Seq=10696 Ack=99 Win=14592 Len=0 TSval=447813734 TSecr=19555623
 31   0.941500 172.31.29.138 -> 54.230.150.42 TCP 66 39857 > http [ACK] Seq=99 Ack=10697 Win=48384 Len=0 TSval=19555623 TSecr=447813734
