[Measurement for 10kb at 23:39:37 19.39.2014] 
Tshark:

  1   0.000000 172.31.29.138 -> 172.31.0.2   DNS 89 Standard query 0x3c04  A d2pcb72msibvx3.cloudfront.net
  2   0.000025 172.31.29.138 -> 172.31.0.2   DNS 89 Standard query 0x6112  AAAA d2pcb72msibvx3.cloudfront.net
  3   0.000429   172.31.0.2 -> 172.31.29.138 DNS 169 Standard query response 0x6112 
  4   0.000452   172.31.0.2 -> 172.31.29.138 DNS 217 Standard query response 0x3c04  A 54.192.157.149 A 54.230.156.193 A 54.230.158.214 A 54.230.159.4 A 54.230.159.150 A 54.230.159.153 A 54.192.156.109 A 54.192.157.144
  5   0.003834 172.31.29.138 -> 54.192.157.149 TCP 74 50368 > http [SYN] Seq=0 Win=26883 Len=0 MSS=8961 SACK_PERM=1 TSval=6062459 TSecr=0 WS=128
  6   0.004404 54.192.157.149 -> 172.31.29.138 TCP 74 http > 50368 [SYN, ACK] Seq=0 Ack=1 Win=14480 Len=0 MSS=1460 SACK_PERM=1 TSval=806560696 TSecr=6062459 WS=128
  7   0.004418 172.31.29.138 -> 54.192.157.149 TCP 66 50368 > http [ACK] Seq=1 Ack=1 Win=27008 Len=0 TSval=6062459 TSecr=806560696
  8   0.004459 172.31.29.138 -> 54.192.157.149 HTTP 163 GET /10kb HTTP/1.1 
  9   0.004984 54.192.157.149 -> 172.31.29.138 TCP 66 http > 50368 [ACK] Seq=1 Ack=98 Win=14592 Len=0 TSval=806560696 TSecr=6062459
 10   0.007871 54.192.157.149 -> 172.31.29.138 HTTP 10761 HTTP/1.1 200 OK  (application/octet-stream)
 11   0.007882 172.31.29.138 -> 54.192.157.149 TCP 66 50368 > http [ACK] Seq=98 Ack=10696 Win=48384 Len=0 TSval=6062460 TSecr=806560697
 12   0.008053 172.31.29.138 -> 54.192.157.149 TCP 66 50368 > http [FIN, ACK] Seq=98 Ack=10696 Win=48384 Len=0 TSval=6062460 TSecr=806560697
 13   0.008833 54.192.157.149 -> 172.31.29.138 TCP 66 http > 50368 [FIN, ACK] Seq=10696 Ack=99 Win=14592 Len=0 TSval=806560697 TSecr=6062460
 14   0.008842 172.31.29.138 -> 54.192.157.149 TCP 66 50368 > http [ACK] Seq=99 Ack=10697 Win=48384 Len=0 TSval=6062460 TSecr=806560697
