[Measurement for 10kb at 22:39:20 19.39.2014] 
Tshark:

  1   0.000000 172.31.29.138 -> 172.31.0.2   DNS 89 Standard query 0x4409  A d2pcb72msibvx3.cloudfront.net
  2   0.000027 172.31.29.138 -> 172.31.0.2   DNS 89 Standard query 0x8121  AAAA d2pcb72msibvx3.cloudfront.net
  3   0.000593   172.31.0.2 -> 172.31.29.138 DNS 169 Standard query response 0x8121 
  4   0.000604   172.31.0.2 -> 172.31.29.138 DNS 217 Standard query response 0x4409  A 54.230.150.30 A 54.230.150.34 A 54.230.150.57 A 54.230.150.122 A 54.230.151.226 A 54.230.149.71 A 54.230.150.10 A 54.230.150.12
  5   0.003837 172.31.29.138 -> 54.230.150.30 TCP 74 54493 > http [SYN] Seq=0 Win=26883 Len=0 MSS=8961 SACK_PERM=1 TSval=5158205 TSecr=0 WS=128
  6   0.005133 54.230.150.30 -> 172.31.29.138 TCP 74 http > 54493 [SYN, ACK] Seq=0 Ack=1 Win=14480 Len=0 MSS=1460 SACK_PERM=1 TSval=441938130 TSecr=5158205 WS=128
  7   0.005147 172.31.29.138 -> 54.230.150.30 TCP 66 54493 > http [ACK] Seq=1 Ack=1 Win=27008 Len=0 TSval=5158206 TSecr=441938130
  8   0.005193 172.31.29.138 -> 54.230.150.30 HTTP 163 GET /10kb HTTP/1.1 
  9   0.006665 54.230.150.30 -> 172.31.29.138 TCP 66 http > 54493 [ACK] Seq=1 Ack=98 Win=14592 Len=0 TSval=441938130 TSecr=5158206
 10   0.008742 54.230.150.30 -> 172.31.29.138 TCP 2592 [TCP segment of a reassembled PDU]
 11   0.008749 172.31.29.138 -> 54.230.150.30 TCP 66 54493 > http [ACK] Seq=98 Ack=2527 Win=32000 Len=0 TSval=5158206 TSecr=441938130
 12   0.008839 54.230.150.30 -> 172.31.29.138 HTTP 8235 HTTP/1.1 200 OK  (application/octet-stream)
 13   0.008848 172.31.29.138 -> 54.230.150.30 TCP 66 54493 > http [ACK] Seq=98 Ack=10696 Win=48384 Len=0 TSval=5158206 TSecr=441938130
 14   0.008971 172.31.29.138 -> 54.230.150.30 TCP 66 54493 > http [FIN, ACK] Seq=98 Ack=10696 Win=48384 Len=0 TSval=5158206 TSecr=441938130
 15   0.010298 54.230.150.30 -> 172.31.29.138 TCP 66 http > 54493 [FIN, ACK] Seq=10696 Ack=99 Win=14592 Len=0 TSval=441938130 TSecr=5158206
 16   0.010307 172.31.29.138 -> 54.230.150.30 TCP 66 54493 > http [ACK] Seq=99 Ack=10697 Win=48384 Len=0 TSval=5158207 TSecr=441938130
