[Measurement for 10kb at 21:39:09 19.39.2014] 
Tshark:

  1   0.000000 172.31.29.138 -> 172.31.0.2   DNS 89 Standard query 0x7801  A d2pcb72msibvx3.cloudfront.net
  2   0.000033 172.31.29.138 -> 172.31.0.2   DNS 89 Standard query 0xaa11  AAAA d2pcb72msibvx3.cloudfront.net
  3   0.000616   172.31.0.2 -> 172.31.29.138 DNS 217 Standard query response 0x7801  A 54.230.150.65 A 54.230.150.114 A 54.230.151.150 A 54.230.150.10 A 54.230.150.12 A 54.230.150.29 A 54.230.150.34 A 54.230.150.63
  4   0.000627   172.31.0.2 -> 172.31.29.138 DNS 169 Standard query response 0xaa11 
  5   0.003845 172.31.29.138 -> 54.230.150.65 TCP 74 35923 > http [SYN] Seq=0 Win=26883 Len=0 MSS=8961 SACK_PERM=1 TSval=4255538 TSecr=0 WS=128
  6   0.005233 54.230.150.65 -> 172.31.29.138 TCP 74 http > 35923 [SYN, ACK] Seq=0 Ack=1 Win=14480 Len=0 MSS=1460 SACK_PERM=1 TSval=443044661 TSecr=4255538 WS=128
  7   0.005247 172.31.29.138 -> 54.230.150.65 TCP 66 35923 > http [ACK] Seq=1 Ack=1 Win=27008 Len=0 TSval=4255538 TSecr=443044661
  8   0.005286 172.31.29.138 -> 54.230.150.65 HTTP 163 GET /10kb HTTP/1.1 
  9   0.006823 54.230.150.65 -> 172.31.29.138 TCP 66 http > 35923 [ACK] Seq=1 Ack=98 Win=14592 Len=0 TSval=443044661 TSecr=4255538
 10   0.009105 54.230.150.65 -> 172.31.29.138 HTTP 10761 HTTP/1.1 200 OK  (application/octet-stream)
 11   0.009117 172.31.29.138 -> 54.230.150.65 TCP 66 35923 > http [ACK] Seq=98 Ack=10696 Win=48384 Len=0 TSval=4255539 TSecr=443044661
 12   0.009275 172.31.29.138 -> 54.230.150.65 TCP 66 35923 > http [FIN, ACK] Seq=98 Ack=10696 Win=48384 Len=0 TSval=4255539 TSecr=443044661
 13   0.010742 54.230.150.65 -> 172.31.29.138 TCP 66 http > 35923 [FIN, ACK] Seq=10696 Ack=99 Win=14592 Len=0 TSval=443044661 TSecr=4255539
 14   0.010751 172.31.29.138 -> 54.230.150.65 TCP 66 35923 > http [ACK] Seq=99 Ack=10697 Win=48384 Len=0 TSval=4255540 TSecr=443044661
