[Measurement for 10kb at 19:39:44 19.39.2014] 
Tshark:

  1   0.000000 172.31.29.138 -> 172.31.0.2   DNS 89 Standard query 0xe131  A d2pcb72msibvx3.cloudfront.net
  2   0.000028 172.31.29.138 -> 172.31.0.2   DNS 89 Standard query 0x027b  AAAA d2pcb72msibvx3.cloudfront.net
  3   0.000550   172.31.0.2 -> 172.31.29.138 DNS 169 Standard query response 0x027b 
  4   0.000561   172.31.0.2 -> 172.31.29.138 DNS 217 Standard query response 0xe131  A 54.230.158.182 A 54.192.156.109 A 54.192.157.146 A 54.192.159.173 A 54.230.157.230 A 54.230.158.80 A 54.230.158.139 A 54.230.158.152
  5   0.003866 172.31.29.138 -> 54.230.158.182 TCP 74 42852 > http [SYN] Seq=0 Win=26883 Len=0 MSS=8961 SACK_PERM=1 TSval=2464231 TSecr=0 WS=128
  6   0.004465 54.230.158.182 -> 172.31.29.138 TCP 74 http > 42852 [SYN, ACK] Seq=0 Ack=1 Win=14480 Len=0 MSS=1460 SACK_PERM=1 TSval=807216788 TSecr=2464231 WS=128
  7   0.004480 172.31.29.138 -> 54.230.158.182 TCP 66 42852 > http [ACK] Seq=1 Ack=1 Win=27008 Len=0 TSval=2464231 TSecr=807216788
  8   0.004521 172.31.29.138 -> 54.230.158.182 HTTP 163 GET /10kb HTTP/1.1 
  9   0.005217 54.230.158.182 -> 172.31.29.138 TCP 66 http > 42852 [ACK] Seq=1 Ack=98 Win=14592 Len=0 TSval=807216789 TSecr=2464231
 10   0.007826 54.230.158.182 -> 172.31.29.138 TCP 5858 [TCP segment of a reassembled PDU]
 11   0.007835 172.31.29.138 -> 54.230.158.182 TCP 66 42852 > http [ACK] Seq=98 Ack=5793 Win=38528 Len=0 TSval=2464232 TSecr=807216789
 12   0.007859 54.230.158.182 -> 172.31.29.138 HTTP 4968 HTTP/1.1 200 OK  (application/octet-stream)
 13   0.007867 172.31.29.138 -> 54.230.158.182 TCP 66 42852 > http [ACK] Seq=98 Ack=10695 Win=48384 Len=0 TSval=2464232 TSecr=807216789
 14   0.008013 172.31.29.138 -> 54.230.158.182 TCP 66 42852 > http [FIN, ACK] Seq=98 Ack=10695 Win=48384 Len=0 TSval=2464232 TSecr=807216789
 15   0.008780 54.230.158.182 -> 172.31.29.138 TCP 66 http > 42852 [FIN, ACK] Seq=10695 Ack=99 Win=14592 Len=0 TSval=807216789 TSecr=2464232
 16   0.008790 172.31.29.138 -> 54.230.158.182 TCP 66 42852 > http [ACK] Seq=99 Ack=10696 Win=48384 Len=0 TSval=2464232 TSecr=807216789
