[Measurement for 10kb at 02:05:19 17.05.2014] 
Tshark:

  1   0.000000  192.168.1.2 -> 54.230.99.196 TCP 66 49819→80 [SYN] Seq=0 Win=8192 Len=0 MSS=1460 WS=256 SACK_PERM=1
  2   0.059558 54.230.99.196 -> 192.168.1.2  TCP 66 80→49819 [SYN, ACK] Seq=0 Ack=1 Win=14600 Len=0 MSS=1400 SACK_PERM=1 WS=128
  3   0.059713  192.168.1.2 -> 54.230.99.196 TCP 54 49819→80 [ACK] Seq=1 Ack=1 Win=65792 Len=0
  4   0.059860  192.168.1.2 -> 54.230.99.196 HTTP 150 GET /10kb HTTP/1.1 
  5   0.086992 54.230.99.196 -> 192.168.1.2  TCP 54 80→49819 [ACK] Seq=1 Ack=97 Win=14720 Len=0
  6   0.091783 54.230.99.196 -> 192.168.1.2  TCP 1454 [TCP segment of a reassembled PDU]
  7   0.093323 54.230.99.196 -> 192.168.1.2  TCP 1180 [TCP segment of a reassembled PDU]
  8   0.093394  192.168.1.2 -> 54.230.99.196 TCP 54 49819→80 [ACK] Seq=97 Ack=2527 Win=65792 Len=0
  9   0.093511 54.230.99.196 -> 192.168.1.2  TCP 1454 [TCP segment of a reassembled PDU]
 10   0.097256 54.230.99.196 -> 192.168.1.2  TCP 1454 [TCP segment of a reassembled PDU]
 11   0.097306  192.168.1.2 -> 54.230.99.196 TCP 54 49819→80 [ACK] Seq=97 Ack=5327 Win=65792 Len=0
 12   0.097369 54.230.99.196 -> 192.168.1.2  TCP 1454 [TCP segment of a reassembled PDU]
 13   0.097406 54.230.99.196 -> 192.168.1.2  TCP 1454 [TCP segment of a reassembled PDU]
 14   0.097436  192.168.1.2 -> 54.230.99.196 TCP 54 49819→80 [ACK] Seq=97 Ack=8127 Win=65792 Len=0
 15   0.097501 54.230.99.196 -> 192.168.1.2  TCP 1454 [TCP segment of a reassembled PDU]
 16   0.097532 54.230.99.196 -> 192.168.1.2  HTTP 1223 HTTP/1.1 200 OK  (application/octet-stream)
 17   0.097564  192.168.1.2 -> 54.230.99.196 TCP 54 49819→80 [ACK] Seq=97 Ack=10696 Win=65792 Len=0
 18   0.097645  192.168.1.2 -> 54.230.99.196 TCP 54 49819→80 [FIN, ACK] Seq=97 Ack=10696 Win=65792 Len=0
 19   0.124959 54.230.99.196 -> 192.168.1.2  TCP 54 80→49819 [FIN, ACK] Seq=10696 Ack=98 Win=14720 Len=0
 20   0.125077  192.168.1.2 -> 54.230.99.196 TCP 54 49819→80 [ACK] Seq=98 Ack=10697 Win=65792 Len=0
 21   1.067955  192.168.1.2 -> 239.255.255.250 SSDP 175 M-SEARCH * HTTP/1.1 
 22   1.070003  192.168.1.1 -> 192.168.1.2  SSDP 482 HTTP/1.1 200 OK 
