[Measurement for 10mb at 12:43:22 20.43.2014] 
Tshark:

  1   0.000000 172.31.8.238 -> 172.31.0.2   DNS 89 Standard query 0x71d1  A d1n0gskdvzj94j.cloudfront.net
  2   0.000028 172.31.8.238 -> 172.31.0.2   DNS 89 Standard query 0xb686  AAAA d1n0gskdvzj94j.cloudfront.net
  3   0.000662   172.31.0.2 -> 172.31.8.238 DNS 176 Standard query response 0xb686 
  4   0.000675   172.31.0.2 -> 172.31.8.238 DNS 217 Standard query response 0x71d1  A 54.230.117.42 A 54.230.117.154 A 54.230.117.238 A 54.230.118.114 A 54.239.132.41 A 54.239.132.98 A 54.239.132.173 A 54.230.117.37
  5   0.003848 172.31.8.238 -> 54.230.117.42 TCP 74 39941 > http [SYN] Seq=0 Win=26883 Len=0 MSS=8961 SACK_PERM=1 TSval=17757647 TSecr=0 WS=128
  6   0.004438 54.230.117.42 -> 172.31.8.238 TCP 74 http > 39941 [SYN, ACK] Seq=0 Ack=1 Win=14480 Len=0 MSS=1460 SACK_PERM=1 TSval=1687592280 TSecr=17757647 WS=128
  7   0.004452 172.31.8.238 -> 54.230.117.42 TCP 66 39941 > http [ACK] Seq=1 Ack=1 Win=27008 Len=0 TSval=17757647 TSecr=1687592280
  8   0.004493 172.31.8.238 -> 54.230.117.42 HTTP 163 GET /10mb HTTP/1.1 
  9   0.004943 54.230.117.42 -> 172.31.8.238 TCP 66 http > 39941 [ACK] Seq=1 Ack=98 Win=14592 Len=0 TSval=1687592280 TSecr=17757647
 10   0.005826 54.230.117.42 -> 172.31.8.238 TCP 2962 [TCP segment of a reassembled PDU]
 11   0.005833 172.31.8.238 -> 54.230.117.42 TCP 66 39941 > http [ACK] Seq=98 Ack=2897 Win=32768 Len=0 TSval=17757647 TSecr=1687592280
 12   0.005959 54.230.117.42 -> 172.31.8.238 TCP 10202 [TCP segment of a reassembled PDU]
 13   0.005969 172.31.8.238 -> 54.230.117.42 TCP 66 39941 > http [ACK] Seq=98 Ack=13033 Win=52992 Len=0 TSval=17757647 TSecr=1687592280
 14   0.006282 54.230.117.42 -> 172.31.8.238 TCP 2962 [TCP segment of a reassembled PDU]
 15   0.006288 172.31.8.238 -> 54.230.117.42 TCP 66 39941 > http [ACK] Seq=98 Ack=15929 Win=58752 Len=0 TSval=17757647 TSecr=1687592280
 16   0.006389 54.230.117.42 -> 172.31.8.238 TCP 2962 [TCP segment of a reassembled PDU]
 17   0.006394 172.31.8.238 -> 54.230.117.42 TCP 66 39941 > http [ACK] Seq=98 Ack=18825 Win=64640 Len=0 TSval=17757647 TSecr=1687592280
 18   0.006540 54.230.117.42 -> 172.31.8.238 TCP 7306 [TCP segment of a reassembled PDU]
 19   0.006546 172.31.8.238 -> 54.230.117.42 TCP 66 39941 > http [ACK] Seq=98 Ack=26065 Win=79104 Len=0 TSval=17757647 TSecr=1687592280
 20   0.006912 54.230.117.42 -> 172.31.8.238 TCP 5858 [TCP segment of a reassembled PDU]
 21   0.006918 172.31.8.238 -> 54.230.117.42 TCP 66 39941 > http [ACK] Seq=98 Ack=31857 Win=90624 Len=0 TSval=17757647 TSecr=1687592280
 22   0.007024 54.230.117.42 -> 172.31.8.238 TCP 1514 [TCP segment of a reassembled PDU]
 23   0.007028 172.31.8.238 -> 54.230.117.42 TCP 66 39941 > http [ACK] Seq=98 Ack=33305 Win=93568 Len=0 TSval=17757647 TSecr=1687592280
 24   0.007067 54.230.117.42 -> 172.31.8.238 TCP 5858 [TCP segment of a reassembled PDU]
 25   0.007073 172.31.8.238 -> 54.230.117.42 TCP 66 39941 > http [ACK] Seq=98 Ack=39097 Win=105088 Len=0 TSval=17757647 TSecr=1687592280
 26   0.007559 54.230.117.42 -> 172.31.8.238 TCP 7306 [TCP segment of a reassembled PDU]
 27   0.007566 172.31.8.238 -> 54.230.117.42 TCP 66 39941 > http [ACK] Seq=98 Ack=46337 Win=105984 Len=0 TSval=17757648 TSecr=1687592280
 28   0.007668 54.230.117.42 -> 172.31.8.238 TCP 5858 [TCP segment of a reassembled PDU]
 29   0.007675 172.31.8.238 -> 54.230.117.42 TCP 66 39941 > http [ACK] Seq=98 Ack=52129 Win=120704 Len=0 TSval=17757648 TSecr=1687592280
 30   0.008068 54.230.117.42 -> 172.31.8.238 TCP 5858 [TCP segment of a reassembled PDU]
 31   0.008074 172.31.8.238 -> 54.230.117.42 TCP 66 39941 > http [ACK] Seq=98 Ack=57921 Win=132224 Len=0 TSval=17757648 TSecr=1687592280
 32   0.008189 54.230.117.42 -> 172.31.8.238 TCP 5858 [TCP segment of a reassembled PDU]
 33   0.008196 172.31.8.238 -> 54.230.117.42 TCP 66 39941 > http [ACK] Seq=98 Ack=63713 Win=143872 Len=0 TSval=17757648 TSecr=1687592280
 34   0.008416 54.230.117.42 -> 172.31.8.238 TCP 1514 [TCP segment of a reassembled PDU]
 35   0.008421 172.31.8.238 -> 54.230.117.42 TCP 66 39941 > http [ACK] Seq=98 Ack=65161 Win=146688 Len=0 TSval=17757648 TSecr=1687592281
 36   0.008672 54.230.117.42 -> 172.31.8.238 TCP 10202 [TCP segment of a reassembled PDU]
 37   0.008679 172.31.8.238 -> 54.230.117.42 TCP 66 39941 > http [ACK] Seq=98 Ack=75297 Win=167040 Len=0 TSval=17757648 TSecr=1687592281
 38   0.008888 54.230.117.42 -> 172.31.8.238 TCP 2962 [TCP segment of a reassembled PDU]
 39   0.008893 172.31.8.238 -> 54.230.117.42 TCP 66 39941 > http [ACK] Seq=98 Ack=78193 Win=172800 Len=0 TSval=17757648 TSecr=1687592281
 40   0.009130 54.230.117.42 -> 172.31.8.238 TCP 8754 [TCP segment of a reassembled PDU]
 41   0.009137 172.31.8.238 -> 54.230.117.42 TCP 66 39941 > http [ACK] Seq=98 Ack=86881 Win=190208 Len=0 TSval=17757648 TSecr=1687592281
 42   0.009266 54.230.117.42 -> 172.31.8.238 TCP 5858 [TCP segment of a reassembled PDU]
 43   0.009273 172.31.8.238 -> 54.230.117.42 TCP 66 39941 > http [ACK] Seq=98 Ack=92673 Win=201728 Len=0 TSval=17757648 TSecr=1687592281
 44   0.009578 54.230.117.42 -> 172.31.8.238 TCP 2962 [TCP segment of a reassembled PDU]
 45   0.009583 172.31.8.238 -> 54.230.117.42 TCP 66 39941 > http [ACK] Seq=98 Ack=95569 Win=207488 Len=0 TSval=17757648 TSecr=1687592281
 46   0.009695 54.230.117.42 -> 172.31.8.238 TCP 8754 [TCP segment of a reassembled PDU]
 47   0.009702 172.31.8.238 -> 54.230.117.42 TCP 66 39941 > http [ACK] Seq=98 Ack=104257 Win=224896 Len=0 TSval=17757648 TSecr=1687592281
 48   0.009885 54.230.117.42 -> 172.31.8.238 TCP 7306 [TCP segment of a reassembled PDU]
 49   0.009891 172.31.8.238 -> 54.230.117.42 TCP 66 39941 > http [ACK] Seq=98 Ack=111497 Win=239360 Len=0 TSval=17757648 TSecr=1687592281
 50   0.010207 54.230.117.42 -> 172.31.8.238 TCP 11650 [TCP segment of a reassembled PDU]
 51   0.010216 172.31.8.238 -> 54.230.117.42 TCP 66 39941 > http [ACK] Seq=98 Ack=123081 Win=262528 Len=0 TSval=17757648 TSecr=1687592281
 52   0.010358 54.230.117.42 -> 172.31.8.238 TCP 1514 [TCP segment of a reassembled PDU]
 53   0.010363 172.31.8.238 -> 54.230.117.42 TCP 66 39941 > http [ACK] Seq=98 Ack=124529 Win=265472 Len=0 TSval=17757648 TSecr=1687592281
 54   0.010485 54.230.117.42 -> 172.31.8.238 TCP 5858 [TCP segment of a reassembled PDU]
 55   0.010492 172.31.8.238 -> 54.230.117.42 TCP 66 39941 > http [ACK] Seq=98 Ack=130321 Win=276992 Len=0 TSval=17757648 TSecr=1687592281
 56   0.010902 54.230.117.42 -> 172.31.8.238 TCP 1514 [TCP segment of a reassembled PDU]
 57   0.010907 172.31.8.238 -> 54.230.117.42 TCP 66 39941 > http [ACK] Seq=98 Ack=131769 Win=279936 Len=0 TSval=17757648 TSecr=1687592281
 58   0.011023 54.230.117.42 -> 172.31.8.238 TCP 10202 [TCP segment of a reassembled PDU]
 59   0.011031 172.31.8.238 -> 54.230.117.42 TCP 66 39941 > http [ACK] Seq=98 Ack=141905 Win=300160 Len=0 TSval=17757648 TSecr=1687592281
 60   0.011203 54.230.117.42 -> 172.31.8.238 TCP 7306 [TCP segment of a reassembled PDU]
 61   0.011210 172.31.8.238 -> 54.230.117.42 TCP 66 39941 > http [ACK] Seq=98 Ack=149145 Win=314624 Len=0 TSval=17757648 TSecr=1687592281
 62   0.011889 54.230.117.42 -> 172.31.8.238 TCP 1514 [TCP segment of a reassembled PDU]
 63   0.011894 172.31.8.238 -> 54.230.117.42 TCP 66 39941 > http [ACK] Seq=98 Ack=150593 Win=317568 Len=0 TSval=17757649 TSecr=1687592281
 64   0.012055 54.230.117.42 -> 172.31.8.238 TCP 17442 [TCP segment of a reassembled PDU]
 65   0.012065 172.31.8.238 -> 54.230.117.42 TCP 66 39941 > http [ACK] Seq=98 Ack=167969 Win=352384 Len=0 TSval=17757649 TSecr=1687592281
 66   0.012689 54.230.117.42 -> 172.31.8.238 TCP 2962 [TCP segment of a reassembled PDU]
 67   0.012694 172.31.8.238 -> 54.230.117.42 TCP 66 39941 > http [ACK] Seq=98 Ack=170865 Win=358144 Len=0 TSval=17757649 TSecr=1687592281
 68   0.012811 54.230.117.42 -> 172.31.8.238 TCP 11650 [TCP segment of a reassembled PDU]
 69   0.012819 172.31.8.238 -> 54.230.117.42 TCP 66 39941 > http [ACK] Seq=98 Ack=182449 Win=381312 Len=0 TSval=17757649 TSecr=1687592281
 70   0.013162 54.230.117.42 -> 172.31.8.238 TCP 2962 [TCP segment of a reassembled PDU]
 71   0.013167 172.31.8.238 -> 54.230.117.42 TCP 66 39941 > http [ACK] Seq=98 Ack=185345 Win=387072 Len=0 TSval=17757649 TSecr=1687592281
 72   0.013287 54.230.117.42 -> 172.31.8.238 TCP 5858 [TCP segment of a reassembled PDU]
 73   0.013293 172.31.8.238 -> 54.230.117.42 TCP 66 39941 > http [ACK] Seq=98 Ack=191137 Win=398720 Len=0 TSval=17757649 TSecr=1687592281
 74   0.013508 54.230.117.42 -> 172.31.8.238 TCP 11650 [TCP segment of a reassembled PDU]
 75   0.013516 172.31.8.238 -> 54.230.117.42 TCP 66 39941 > http [ACK] Seq=98 Ack=202721 Win=421888 Len=0 TSval=17757649 TSecr=1687592281
 76   0.013947 54.230.117.42 -> 172.31.8.238 TCP 5858 [TCP segment of a reassembled PDU]
 77   0.013953 172.31.8.238 -> 54.230.117.42 TCP 66 39941 > http [ACK] Seq=98 Ack=208513 Win=433408 Len=0 TSval=17757649 TSecr=1687592281
 78   0.014094 54.230.117.42 -> 172.31.8.238 TCP 14546 [TCP segment of a reassembled PDU]
 79   0.014103 172.31.8.238 -> 54.230.117.42 TCP 66 39941 > http [ACK] Seq=98 Ack=222993 Win=462336 Len=0 TSval=17757649 TSecr=1687592281
 80   0.014800 54.230.117.42 -> 172.31.8.238 TCP 20338 [TCP segment of a reassembled PDU]
 81   0.014812 172.31.8.238 -> 54.230.117.42 TCP 66 39941 > http [ACK] Seq=98 Ack=243265 Win=502912 Len=0 TSval=17757649 TSecr=1687592281
 82   0.015493 54.230.117.42 -> 172.31.8.238 TCP 1514 [TCP segment of a reassembled PDU]
 83   0.015498 172.31.8.238 -> 54.230.117.42 TCP 66 39941 > http [ACK] Seq=98 Ack=244713 Win=505856 Len=0 TSval=17757650 TSecr=1687592281
 84   0.015668 54.230.117.42 -> 172.31.8.238 TCP 18890 [TCP segment of a reassembled PDU]
 85   0.015680 172.31.8.238 -> 54.230.117.42 TCP 66 39941 > http [ACK] Seq=98 Ack=263537 Win=543488 Len=0 TSval=17757650 TSecr=1687592281
 86   0.016256 54.230.117.42 -> 172.31.8.238 TCP 7306 [TCP segment of a reassembled PDU]
 87   0.016263 172.31.8.238 -> 54.230.117.42 TCP 66 39941 > http [ACK] Seq=98 Ack=270777 Win=557952 Len=0 TSval=17757650 TSecr=1687592281
 88   0.016393 54.230.117.42 -> 172.31.8.238 TCP 13098 [TCP segment of a reassembled PDU]
 89   0.016401 172.31.8.238 -> 54.230.117.42 TCP 66 39941 > http [ACK] Seq=98 Ack=283809 Win=584064 Len=0 TSval=17757650 TSecr=1687592281
 90   0.016756 54.230.117.42 -> 172.31.8.238 TCP 5858 [TCP segment of a reassembled PDU]
 91   0.016762 172.31.8.238 -> 54.230.117.42 TCP 66 39941 > http [ACK] Seq=98 Ack=289601 Win=595584 Len=0 TSval=17757650 TSecr=1687592281
 92   0.016863 54.230.117.42 -> 172.31.8.238 TCP 1514 [TCP segment of a reassembled PDU]
 93   0.016868 172.31.8.238 -> 54.230.117.42 TCP 66 39941 > http [ACK] Seq=98 Ack=291049 Win=598528 Len=0 TSval=17757650 TSecr=1687592281
 94   0.017257 54.230.117.42 -> 172.31.8.238 TCP 4410 [TCP segment of a reassembled PDU]
 95   0.017263 172.31.8.238 -> 54.230.117.42 TCP 66 39941 > http [ACK] Seq=98 Ack=295393 Win=607232 Len=0 TSval=17757650 TSecr=1687592281
 96   0.017373 54.230.117.42 -> 172.31.8.238 TCP 15994 [TCP segment of a reassembled PDU]
 97   0.017383 172.31.8.238 -> 54.230.117.42 TCP 66 39941 > http [ACK] Seq=98 Ack=311321 Win=638976 Len=0 TSval=17757650 TSecr=1687592281
 98   0.018043 54.230.117.42 -> 172.31.8.238 TCP 2962 [TCP segment of a reassembled PDU]
 99   0.018048 172.31.8.238 -> 54.230.117.42 TCP 66 39941 > http [ACK] Seq=98 Ack=314217 Win=644864 Len=0 TSval=17757650 TSecr=1687592281
100   0.018186 54.230.117.42 -> 172.31.8.238 TCP 18890 [TCP segment of a reassembled PDU]
101   0.018196 172.31.8.238 -> 54.230.117.42 TCP 66 39941 > http [ACK] Seq=98 Ack=333041 Win=671872 Len=0 TSval=17757650 TSecr=1687592281
102   0.018815 54.230.117.42 -> 172.31.8.238 TCP 2962 [TCP segment of a reassembled PDU]
103   0.018820 172.31.8.238 -> 54.230.117.42 TCP 66 39941 > http [ACK] Seq=98 Ack=335937 Win=688256 Len=0 TSval=17757650 TSecr=1687592282
104   0.018913 54.230.117.42 -> 172.31.8.238 TCP 2962 [TCP segment of a reassembled PDU]
105   0.018918 172.31.8.238 -> 54.230.117.42 TCP 66 39941 > http [ACK] Seq=98 Ack=338833 Win=694016 Len=0 TSval=17757650 TSecr=1687592282
106   0.019024 54.230.117.42 -> 172.31.8.238 TCP 15994 [TCP segment of a reassembled PDU]
107   0.019034 172.31.8.238 -> 54.230.117.42 TCP 66 39941 > http [ACK] Seq=98 Ack=354761 Win=678144 Len=0 TSval=17757650 TSecr=1687592282
108   0.019577 54.230.117.42 -> 172.31.8.238 TCP 5858 [TCP segment of a reassembled PDU]
109   0.019584 172.31.8.238 -> 54.230.117.42 TCP 66 39941 > http [ACK] Seq=98 Ack=360553 Win=693248 Len=0 TSval=17757651 TSecr=1687592282
110   0.019697 54.230.117.42 -> 172.31.8.238 TCP 15994 [TCP segment of a reassembled PDU]
111   0.019707 172.31.8.238 -> 54.230.117.42 TCP 66 39941 > http [ACK] Seq=98 Ack=376481 Win=677376 Len=0 TSval=17757651 TSecr=1687592282
112   0.020338 54.230.117.42 -> 172.31.8.238 TCP 5858 [TCP segment of a reassembled PDU]
113   0.020344 172.31.8.238 -> 54.230.117.42 TCP 66 39941 > http [ACK] Seq=98 Ack=382273 Win=693248 Len=0 TSval=17757651 TSecr=1687592282
114   0.020485 54.230.117.42 -> 172.31.8.238 TCP 15994 [TCP segment of a reassembled PDU]
115   0.020494 172.31.8.238 -> 54.230.117.42 TCP 66 39941 > http [ACK] Seq=98 Ack=398201 Win=677376 Len=0 TSval=17757651 TSecr=1687592282
116   0.020889 54.230.117.42 -> 172.31.8.238 TCP 4410 [TCP segment of a reassembled PDU]
117   0.020895 172.31.8.238 -> 54.230.117.42 TCP 66 39941 > http [ACK] Seq=98 Ack=402545 Win=695680 Len=0 TSval=17757651 TSecr=1687592282
118   0.020987 54.230.117.42 -> 172.31.8.238 TCP 1514 [TCP segment of a reassembled PDU]
119   0.020992 172.31.8.238 -> 54.230.117.42 TCP 66 39941 > http [ACK] Seq=98 Ack=403993 Win=700416 Len=0 TSval=17757651 TSecr=1687592282
120   0.021171 54.230.117.42 -> 172.31.8.238 TCP 15994 [TCP segment of a reassembled PDU]
121   0.021181 172.31.8.238 -> 54.230.117.42 TCP 66 39941 > http [ACK] Seq=98 Ack=419921 Win=684544 Len=0 TSval=17757651 TSecr=1687592282
122   0.021632 54.230.117.42 -> 172.31.8.238 TCP 2962 [TCP segment of a reassembled PDU]
123   0.021637 172.31.8.238 -> 54.230.117.42 TCP 66 39941 > http [ACK] Seq=98 Ack=422817 Win=697984 Len=0 TSval=17757651 TSecr=1687592282
124   0.021788 54.230.117.42 -> 172.31.8.238 TCP 18890 [TCP segment of a reassembled PDU]
125   0.021810 172.31.8.238 -> 54.230.117.42 TCP 66 39941 > http [ACK] Seq=98 Ack=441641 Win=679168 Len=0 TSval=17757651 TSecr=1687592282
126   0.022391 54.230.117.42 -> 172.31.8.238 TCP 2962 [TCP segment of a reassembled PDU]
127   0.022396 172.31.8.238 -> 54.230.117.42 TCP 66 39941 > http [ACK] Seq=98 Ack=444537 Win=697984 Len=0 TSval=17757651 TSecr=1687592282
128   0.022551 54.230.117.42 -> 172.31.8.238 TCP 18890 [TCP segment of a reassembled PDU]
129   0.022573 172.31.8.238 -> 54.230.117.42 TCP 66 39941 > http [ACK] Seq=98 Ack=463361 Win=679168 Len=0 TSval=17757651 TSecr=1687592282
130   0.023145 54.230.117.42 -> 172.31.8.238 TCP 2962 [TCP segment of a reassembled PDU]
131   0.023150 172.31.8.238 -> 54.230.117.42 TCP 66 39941 > http [ACK] Seq=98 Ack=466257 Win=697984 Len=0 TSval=17757651 TSecr=1687592282
132   0.023271 54.230.117.42 -> 172.31.8.238 TCP 2962 [TCP segment of a reassembled PDU]
133   0.023365 172.31.8.238 -> 54.230.117.42 TCP 66 39941 > http [ACK] Seq=98 Ack=469153 Win=702720 Len=0 TSval=17757651 TSecr=1687592282
134   0.023556 54.230.117.42 -> 172.31.8.238 TCP 17442 [TCP segment of a reassembled PDU]
135   0.023580 172.31.8.238 -> 54.230.117.42 TCP 66 39941 > http [ACK] Seq=98 Ack=486529 Win=685440 Len=0 TSval=17757652 TSecr=1687592282
136   0.024204 54.230.117.42 -> 172.31.8.238 TCP 4410 [TCP segment of a reassembled PDU]
137   0.024209 172.31.8.238 -> 54.230.117.42 TCP 66 39941 > http [ACK] Seq=98 Ack=490873 Win=695680 Len=0 TSval=17757652 TSecr=1687592282
138   0.024365 54.230.117.42 -> 172.31.8.238 TCP 18890 [TCP segment of a reassembled PDU]
139   0.024387 172.31.8.238 -> 54.230.117.42 TCP 66 39941 > http [ACK] Seq=98 Ack=509697 Win=676864 Len=0 TSval=17757652 TSecr=1687592282
140   0.025087 54.230.117.42 -> 172.31.8.238 TCP 8754 [TCP segment of a reassembled PDU]
141   0.025095 172.31.8.238 -> 54.230.117.42 TCP 66 39941 > http [ACK] Seq=98 Ack=518385 Win=688512 Len=0 TSval=17757652 TSecr=1687592282
142   0.025205 54.230.117.42 -> 172.31.8.238 TCP 14546 [TCP segment of a reassembled PDU]
143   0.025226 172.31.8.238 -> 54.230.117.42 TCP 66 39941 > http [ACK] Seq=98 Ack=532865 Win=702720 Len=0 TSval=17757652 TSecr=1687592282
144   0.025701 54.230.117.42 -> 172.31.8.238 TCP 1514 [TCP segment of a reassembled PDU]
145   0.025973 54.230.117.42 -> 172.31.8.238 TCP 2962 [TCP segment of a reassembled PDU]
146   0.025988 172.31.8.238 -> 54.230.117.42 TCP 66 39941 > http [ACK] Seq=98 Ack=537209 Win=702720 Len=0 TSval=17757652 TSecr=1687592282
147   0.026208 54.230.117.42 -> 172.31.8.238 TCP 18890 [TCP segment of a reassembled PDU]
148   0.026230 172.31.8.238 -> 54.230.117.42 TCP 66 39941 > http [ACK] Seq=98 Ack=556033 Win=683904 Len=0 TSval=17757652 TSecr=1687592282
149   0.027044 54.230.117.42 -> 172.31.8.238 TCP 5858 [TCP segment of a reassembled PDU]
150   0.027050 172.31.8.238 -> 54.230.117.42 TCP 66 39941 > http [ACK] Seq=98 Ack=561825 Win=693248 Len=0 TSval=17757652 TSecr=1687592282
151   0.027209 54.230.117.42 -> 172.31.8.238 TCP 17442 [TCP segment of a reassembled PDU]
152   0.027231 172.31.8.238 -> 54.230.117.42 TCP 66 39941 > http [ACK] Seq=98 Ack=579201 Win=675968 Len=0 TSval=17757652 TSecr=1687592282
153   0.027763 54.230.117.42 -> 172.31.8.238 TCP 2962 [TCP segment of a reassembled PDU]
154   0.027768 172.31.8.238 -> 54.230.117.42 TCP 66 39941 > http [ACK] Seq=98 Ack=582097 Win=697984 Len=0 TSval=17757653 TSecr=1687592282
155   0.027916 54.230.117.42 -> 172.31.8.238 TCP 17442 [TCP segment of a reassembled PDU]
156   0.028105 172.31.8.238 -> 54.230.117.42 TCP 66 39941 > http [ACK] Seq=98 Ack=599473 Win=680704 Len=0 TSval=17757653 TSecr=1687592282
157   0.028796 54.230.117.42 -> 172.31.8.238 TCP 5858 [TCP segment of a reassembled PDU]
158   0.028803 172.31.8.238 -> 54.230.117.42 TCP 66 39941 > http [ACK] Seq=98 Ack=605265 Win=693248 Len=0 TSval=17757653 TSecr=1687592283
159   0.028966 54.230.117.42 -> 172.31.8.238 TCP 17442 [TCP segment of a reassembled PDU]
160   0.028987 172.31.8.238 -> 54.230.117.42 TCP 66 39941 > http [ACK] Seq=98 Ack=622641 Win=675968 Len=0 TSval=17757653 TSecr=1687592283
161   0.029548 54.230.117.42 -> 172.31.8.238 TCP 5858 [TCP segment of a reassembled PDU]
162   0.029553 172.31.8.238 -> 54.230.117.42 TCP 66 39941 > http [ACK] Seq=98 Ack=628433 Win=693248 Len=0 TSval=17757653 TSecr=1687592283
163   0.029703 54.230.117.42 -> 172.31.8.238 TCP 17442 [TCP segment of a reassembled PDU]
164   0.029723 172.31.8.238 -> 54.230.117.42 TCP 66 39941 > http [ACK] Seq=98 Ack=645809 Win=675968 Len=0 TSval=17757653 TSecr=1687592283
165   0.030338 54.230.117.42 -> 172.31.8.238 TCP 8754 [TCP segment of a reassembled PDU]
166   0.030345 172.31.8.238 -> 54.230.117.42 TCP 66 39941 > http [ACK] Seq=98 Ack=654497 Win=688512 Len=0 TSval=17757653 TSecr=1687592283
167   0.030469 54.230.117.42 -> 172.31.8.238 TCP 10202 [TCP segment of a reassembled PDU]
168   0.030500 172.31.8.238 -> 54.230.117.42 TCP 66 39941 > http [ACK] Seq=98 Ack=664633 Win=702720 Len=0 TSval=17757653 TSecr=1687592283
169   0.031103 54.230.117.42 -> 172.31.8.238 TCP 4410 [TCP segment of a reassembled PDU]
170   0.031132 172.31.8.238 -> 54.230.117.42 TCP 66 39941 > http [ACK] Seq=98 Ack=668977 Win=702720 Len=0 TSval=17757653 TSecr=1687592283
171   0.031269 54.230.117.42 -> 172.31.8.238 TCP 20338 [TCP segment of a reassembled PDU]
172   0.031294 172.31.8.238 -> 54.230.117.42 TCP 66 39941 > http [ACK] Seq=98 Ack=689249 Win=682496 Len=0 TSval=17757653 TSecr=1687592283
173   0.031871 54.230.117.42 -> 172.31.8.238 TCP 5858 [TCP segment of a reassembled PDU]
174   0.031877 172.31.8.238 -> 54.230.117.42 TCP 66 39941 > http [ACK] Seq=98 Ack=695041 Win=693248 Len=0 TSval=17757654 TSecr=1687592283
175   0.032051 54.230.117.42 -> 172.31.8.238 TCP 18890 [TCP segment of a reassembled PDU]
176   0.032268 172.31.8.238 -> 54.230.117.42 TCP 66 39941 > http [ACK] Seq=98 Ack=713865 Win=674432 Len=0 TSval=17757654 TSecr=1687592283
177   0.032889 54.230.117.42 -> 172.31.8.238 TCP 7306 [TCP segment of a reassembled PDU]
178   0.032899 172.31.8.238 -> 54.230.117.42 TCP 66 39941 > http [ACK] Seq=98 Ack=721105 Win=690944 Len=0 TSval=17757654 TSecr=1687592283
179   0.033012 54.230.117.42 -> 172.31.8.238 TCP 8754 [TCP segment of a reassembled PDU]
180   0.033033 172.31.8.238 -> 54.230.117.42 TCP 66 39941 > http [ACK] Seq=98 Ack=729793 Win=702720 Len=0 TSval=17757654 TSecr=1687592283
181   0.033062 54.230.117.42 -> 172.31.8.238 TCP 8754 [TCP segment of a reassembled PDU]
182   0.033082 172.31.8.238 -> 54.230.117.42 TCP 66 39941 > http [ACK] Seq=98 Ack=738481 Win=702720 Len=0 TSval=17757654 TSecr=1687592283
183   0.033674 54.230.117.42 -> 172.31.8.238 TCP 1514 [TCP segment of a reassembled PDU]
184   0.033841 54.230.117.42 -> 172.31.8.238 TCP 17442 [TCP segment of a reassembled PDU]
185   0.033863 172.31.8.238 -> 54.230.117.42 TCP 66 39941 > http [ACK] Seq=98 Ack=757305 Win=683904 Len=0 TSval=17757654 TSecr=1687592283
186   0.033877 54.230.117.42 -> 172.31.8.238 TCP 5858 [TCP segment of a reassembled PDU]
187   0.033892 172.31.8.238 -> 54.230.117.42 TCP 66 39941 > http [ACK] Seq=98 Ack=763097 Win=702720 Len=0 TSval=17757654 TSecr=1687592283
188   0.034336 54.230.117.42 -> 172.31.8.238 TCP 4410 [TCP segment of a reassembled PDU]
189   0.034352 172.31.8.238 -> 54.230.117.42 TCP 66 39941 > http [ACK] Seq=98 Ack=767441 Win=702720 Len=0 TSval=17757654 TSecr=1687592283
190   0.034477 54.230.117.42 -> 172.31.8.238 TCP 14546 [TCP segment of a reassembled PDU]
191   0.034499 172.31.8.238 -> 54.230.117.42 TCP 66 39941 > http [ACK] Seq=98 Ack=781921 Win=702720 Len=0 TSval=17757654 TSecr=1687592283
192   0.034886 54.230.117.42 -> 172.31.8.238 TCP 7306 [TCP segment of a reassembled PDU]
193   0.034910 172.31.8.238 -> 54.230.117.42 TCP 66 39941 > http [ACK] Seq=98 Ack=789161 Win=702720 Len=0 TSval=17757654 TSecr=1687592283
194   0.035003 54.230.117.42 -> 172.31.8.238 TCP 2962 [TCP segment of a reassembled PDU]
195   0.035024 172.31.8.238 -> 54.230.117.42 TCP 66 39941 > http [ACK] Seq=98 Ack=792057 Win=702720 Len=0 TSval=17757654 TSecr=1687592283
196   0.035379 54.230.117.42 -> 172.31.8.238 TCP 14546 [TCP segment of a reassembled PDU]
197   0.035402 172.31.8.238 -> 54.230.117.42 TCP 66 39941 > http [ACK] Seq=98 Ack=806537 Win=702720 Len=0 TSval=17757654 TSecr=1687592283
198   0.035740 54.230.117.42 -> 172.31.8.238 TCP 5858 [TCP segment of a reassembled PDU]
199   0.035758 172.31.8.238 -> 54.230.117.42 TCP 66 39941 > http [ACK] Seq=98 Ack=812329 Win=702720 Len=0 TSval=17757655 TSecr=1687592283
200   0.035878 54.230.117.42 -> 172.31.8.238 TCP 4410 [TCP segment of a reassembled PDU]
201   0.035910 172.31.8.238 -> 54.230.117.42 TCP 66 39941 > http [ACK] Seq=98 Ack=816673 Win=702720 Len=0 TSval=17757655 TSecr=1687592283
202   0.036009 54.230.117.42 -> 172.31.8.238 TCP 1514 [TCP segment of a reassembled PDU]
203   0.036108 54.230.117.42 -> 172.31.8.238 TCP 13098 [TCP segment of a reassembled PDU]
204   0.036336 172.31.8.238 -> 54.230.117.42 TCP 66 39941 > http [ACK] Seq=98 Ack=831153 Win=702720 Len=0 TSval=17757655 TSecr=1687592283
205   0.036508 54.230.117.42 -> 172.31.8.238 TCP 11650 [TCP segment of a reassembled PDU]
206   0.036529 172.31.8.238 -> 54.230.117.42 TCP 66 39941 > http [ACK] Seq=98 Ack=842737 Win=702720 Len=0 TSval=17757655 TSecr=1687592283
207   0.037001 54.230.117.42 -> 172.31.8.238 TCP 5858 [TCP segment of a reassembled PDU]
208   0.037017 172.31.8.238 -> 54.230.117.42 TCP 66 39941 > http [ACK] Seq=98 Ack=848529 Win=702720 Len=0 TSval=17757655 TSecr=1687592283
209   0.037130 54.230.117.42 -> 172.31.8.238 TCP 11650 [TCP segment of a reassembled PDU]
210   0.037153 172.31.8.238 -> 54.230.117.42 TCP 66 39941 > http [ACK] Seq=98 Ack=860113 Win=702720 Len=0 TSval=17757655 TSecr=1687592283
211   0.037189 54.230.117.42 -> 172.31.8.238 TCP 8754 [TCP segment of a reassembled PDU]
212   0.037207 172.31.8.238 -> 54.230.117.42 TCP 66 39941 > http [ACK] Seq=98 Ack=868801 Win=702720 Len=0 TSval=17757655 TSecr=1687592283
213   0.037772 54.230.117.42 -> 172.31.8.238 TCP 5858 [TCP segment of a reassembled PDU]
214   0.037789 172.31.8.238 -> 54.230.117.42 TCP 66 39941 > http [ACK] Seq=98 Ack=874593 Win=702720 Len=0 TSval=17757655 TSecr=1687592283
215   0.037940 54.230.117.42 -> 172.31.8.238 TCP 20338 [TCP segment of a reassembled PDU]
216   0.037963 172.31.8.238 -> 54.230.117.42 TCP 66 39941 > http [ACK] Seq=98 Ack=894865 Win=682496 Len=0 TSval=17757655 TSecr=1687592283
217   0.038573 54.230.117.42 -> 172.31.8.238 TCP 5858 [TCP segment of a reassembled PDU]
218   0.038580 172.31.8.238 -> 54.230.117.42 TCP 66 39941 > http [ACK] Seq=98 Ack=900657 Win=693248 Len=0 TSval=17757655 TSecr=1687592284
219   0.038722 54.230.117.42 -> 172.31.8.238 TCP 20338 [TCP segment of a reassembled PDU]
220   0.038747 172.31.8.238 -> 54.230.117.42 TCP 66 39941 > http [ACK] Seq=98 Ack=920929 Win=673024 Len=0 TSval=17757655 TSecr=1687592284
221   0.039039 54.230.117.42 -> 172.31.8.238 TCP 4410 [TCP segment of a reassembled PDU]
222   0.039045 172.31.8.238 -> 54.230.117.42 TCP 66 39941 > http [ACK] Seq=98 Ack=925273 Win=695680 Len=0 TSval=17757655 TSecr=1687592284
223   0.039345 54.230.117.42 -> 172.31.8.238 TCP 10202 [TCP segment of a reassembled PDU]
224   0.039366 172.31.8.238 -> 54.230.117.42 TCP 66 39941 > http [ACK] Seq=98 Ack=935409 Win=702720 Len=0 TSval=17757655 TSecr=1687592284
225   0.039474 54.230.117.42 -> 172.31.8.238 TCP 11650 [TCP segment of a reassembled PDU]
226   0.039664 172.31.8.238 -> 54.230.117.42 TCP 66 39941 > http [ACK] Seq=98 Ack=946993 Win=702720 Len=0 TSval=17757656 TSecr=1687592284
227   0.039818 54.230.117.42 -> 172.31.8.238 TCP 5858 [TCP segment of a reassembled PDU]
228   0.039838 172.31.8.238 -> 54.230.117.42 TCP 66 39941 > http [ACK] Seq=98 Ack=952785 Win=702720 Len=0 TSval=17757656 TSecr=1687592284
229   0.039954 54.230.117.42 -> 172.31.8.238 TCP 8754 [TCP segment of a reassembled PDU]
230   0.039973 172.31.8.238 -> 54.230.117.42 TCP 66 39941 > http [ACK] Seq=98 Ack=961473 Win=702720 Len=0 TSval=17757656 TSecr=1687592284
231   0.040333 54.230.117.42 -> 172.31.8.238 TCP 5858 [TCP segment of a reassembled PDU]
232   0.040350 172.31.8.238 -> 54.230.117.42 TCP 66 39941 > http [ACK] Seq=98 Ack=967265 Win=702720 Len=0 TSval=17757656 TSecr=1687592284
233   0.040464 54.230.117.42 -> 172.31.8.238 TCP 5858 [TCP segment of a reassembled PDU]
234   0.040481 172.31.8.238 -> 54.230.117.42 TCP 66 39941 > http [ACK] Seq=98 Ack=973057 Win=702720 Len=0 TSval=17757656 TSecr=1687592284
235   0.040724 54.230.117.42 -> 172.31.8.238 TCP 14546 [TCP segment of a reassembled PDU]
236   0.040745 172.31.8.238 -> 54.230.117.42 TCP 66 39941 > http [ACK] Seq=98 Ack=987537 Win=702720 Len=0 TSval=17757656 TSecr=1687592284
237   0.040865 54.230.117.42 -> 172.31.8.238 TCP 2962 [TCP segment of a reassembled PDU]
238   0.040881 172.31.8.238 -> 54.230.117.42 TCP 66 39941 > http [ACK] Seq=98 Ack=990433 Win=702720 Len=0 TSval=17757656 TSecr=1687592284
239   0.041130 54.230.117.42 -> 172.31.8.238 TCP 8754 [TCP segment of a reassembled PDU]
240   0.041151 172.31.8.238 -> 54.230.117.42 TCP 66 39941 > http [ACK] Seq=98 Ack=999121 Win=702720 Len=0 TSval=17757656 TSecr=1687592284
241   0.041472 54.230.117.42 -> 172.31.8.238 TCP 14546 [TCP segment of a reassembled PDU]
242   0.041495 172.31.8.238 -> 54.230.117.42 TCP 66 39941 > http [ACK] Seq=98 Ack=1013601 Win=702720 Len=0 TSval=17757656 TSecr=1687592284
243   0.041863 54.230.117.42 -> 172.31.8.238 TCP 5858 [TCP segment of a reassembled PDU]
244   0.041884 172.31.8.238 -> 54.230.117.42 TCP 66 39941 > http [ACK] Seq=98 Ack=1019393 Win=702720 Len=0 TSval=17757656 TSecr=1687592284
245   0.041998 54.230.117.42 -> 172.31.8.238 TCP 7306 [TCP segment of a reassembled PDU]
246   0.042017 172.31.8.238 -> 54.230.117.42 TCP 66 39941 > http [ACK] Seq=98 Ack=1026633 Win=702720 Len=0 TSval=17757656 TSecr=1687592284
247   0.042110 54.230.117.42 -> 172.31.8.238 TCP 1514 [TCP segment of a reassembled PDU]
248   0.042253 54.230.117.42 -> 172.31.8.238 TCP 13098 [TCP segment of a reassembled PDU]
249   0.042275 172.31.8.238 -> 54.230.117.42 TCP 66 39941 > http [ACK] Seq=98 Ack=1041113 Win=702720 Len=0 TSval=17757656 TSecr=1687592284
250   0.042637 54.230.117.42 -> 172.31.8.238 TCP 7306 [TCP segment of a reassembled PDU]
251   0.042656 172.31.8.238 -> 54.230.117.42 TCP 66 39941 > http [ACK] Seq=98 Ack=1048353 Win=702720 Len=0 TSval=17757656 TSecr=1687592284
252   0.042769 54.230.117.42 -> 172.31.8.238 TCP 5858 [TCP segment of a reassembled PDU]
253   0.042787 172.31.8.238 -> 54.230.117.42 TCP 66 39941 > http [ACK] Seq=98 Ack=1054145 Win=702720 Len=0 TSval=17757656 TSecr=1687592284
254   0.042994 54.230.117.42 -> 172.31.8.238 TCP 14546 [TCP segment of a reassembled PDU]
255   0.043216 172.31.8.238 -> 54.230.117.42 TCP 66 39941 > http [ACK] Seq=98 Ack=1068625 Win=702720 Len=0 TSval=17757656 TSecr=1687592284
256   0.043521 54.230.117.42 -> 172.31.8.238 TCP 13098 [TCP segment of a reassembled PDU]
257   0.043544 172.31.8.238 -> 54.230.117.42 TCP 66 39941 > http [ACK] Seq=98 Ack=1081657 Win=702720 Len=0 TSval=17757657 TSecr=1687592284
258   0.043915 54.230.117.42 -> 172.31.8.238 TCP 1514 [TCP segment of a reassembled PDU]
259   0.044060 54.230.117.42 -> 172.31.8.238 TCP 13098 [TCP segment of a reassembled PDU]
260   0.044081 172.31.8.238 -> 54.230.117.42 TCP 66 39941 > http [ACK] Seq=98 Ack=1096137 Win=702720 Len=0 TSval=17757657 TSecr=1687592284
261   0.044178 54.230.117.42 -> 172.31.8.238 TCP 1514 [TCP segment of a reassembled PDU]
262   0.044300 54.230.117.42 -> 172.31.8.238 TCP 11650 [TCP segment of a reassembled PDU]
263   0.044319 172.31.8.238 -> 54.230.117.42 TCP 66 39941 > http [ACK] Seq=98 Ack=1109169 Win=702720 Len=0 TSval=17757657 TSecr=1687592284
264   0.044754 54.230.117.42 -> 172.31.8.238 TCP 4410 [TCP segment of a reassembled PDU]
265   0.044770 172.31.8.238 -> 54.230.117.42 TCP 66 39941 > http [ACK] Seq=98 Ack=1113513 Win=702720 Len=0 TSval=17757657 TSecr=1687592284
266   0.044886 54.230.117.42 -> 172.31.8.238 TCP 7306 [TCP segment of a reassembled PDU]
267   0.044909 172.31.8.238 -> 54.230.117.42 TCP 66 39941 > http [ACK] Seq=98 Ack=1120753 Win=702720 Len=0 TSval=17757657 TSecr=1687592284
268   0.045021 54.230.117.42 -> 172.31.8.238 TCP 8754 [TCP segment of a reassembled PDU]
269   0.045042 172.31.8.238 -> 54.230.117.42 TCP 66 39941 > http [ACK] Seq=98 Ack=1129441 Win=702720 Len=0 TSval=17757657 TSecr=1687592284
270   0.045077 54.230.117.42 -> 172.31.8.238 TCP 7306 [TCP segment of a reassembled PDU]
271   0.045096 172.31.8.238 -> 54.230.117.42 TCP 66 39941 > http [ACK] Seq=98 Ack=1136681 Win=702720 Len=0 TSval=17757657 TSecr=1687592284
272   0.045496 54.230.117.42 -> 172.31.8.238 TCP 11650 [TCP segment of a reassembled PDU]
273   0.045517 172.31.8.238 -> 54.230.117.42 TCP 66 39941 > http [ACK] Seq=98 Ack=1148265 Win=702720 Len=0 TSval=17757657 TSecr=1687592284
274   0.045828 54.230.117.42 -> 172.31.8.238 TCP 15994 [TCP segment of a reassembled PDU]
275   0.045852 172.31.8.238 -> 54.230.117.42 TCP 66 39941 > http [ACK] Seq=98 Ack=1164193 Win=702720 Len=0 TSval=17757657 TSecr=1687592284
276   0.046213 54.230.117.42 -> 172.31.8.238 TCP 1514 [TCP segment of a reassembled PDU]
277   0.046357 54.230.117.42 -> 172.31.8.238 TCP 10202 [TCP segment of a reassembled PDU]
278   0.046378 172.31.8.238 -> 54.230.117.42 TCP 66 39941 > http [ACK] Seq=98 Ack=1175777 Win=702720 Len=0 TSval=17757657 TSecr=1687592284
279   0.046484 54.230.117.42 -> 172.31.8.238 TCP 7306 [TCP segment of a reassembled PDU]
280   0.046578 54.230.117.42 -> 172.31.8.238 TCP 2962 [TCP segment of a reassembled PDU]
281   0.046721 172.31.8.238 -> 54.230.117.42 TCP 66 39941 > http [ACK] Seq=98 Ack=1185913 Win=702720 Len=0 TSval=17757657 TSecr=1687592284
282   0.047012 54.230.117.42 -> 172.31.8.238 TCP 8754 [TCP segment of a reassembled PDU]
283   0.047032 172.31.8.238 -> 54.230.117.42 TCP 66 39941 > http [ACK] Seq=98 Ack=1194601 Win=702720 Len=0 TSval=17757657 TSecr=1687592284
284   0.047139 54.230.117.42 -> 172.31.8.238 TCP 8754 [TCP segment of a reassembled PDU]
285   0.047158 172.31.8.238 -> 54.230.117.42 TCP 66 39941 > http [ACK] Seq=98 Ack=1203289 Win=702720 Len=0 TSval=17757657 TSecr=1687592284
286   0.047326 54.230.117.42 -> 172.31.8.238 TCP 2962 [TCP segment of a reassembled PDU]
287   0.047341 172.31.8.238 -> 54.230.117.42 TCP 66 39941 > http [ACK] Seq=98 Ack=1206185 Win=702720 Len=0 TSval=17757657 TSecr=1687592284
288   0.047454 54.230.117.42 -> 172.31.8.238 TCP 7306 [TCP segment of a reassembled PDU]
289   0.047471 172.31.8.238 -> 54.230.117.42 TCP 66 39941 > http [ACK] Seq=98 Ack=1213425 Win=702720 Len=0 TSval=17757657 TSecr=1687592284
290   0.047801 54.230.117.42 -> 172.31.8.238 TCP 7306 [TCP segment of a reassembled PDU]
291   0.047819 172.31.8.238 -> 54.230.117.42 TCP 66 39941 > http [ACK] Seq=98 Ack=1220665 Win=702720 Len=0 TSval=17757658 TSecr=1687592284
292   0.047940 54.230.117.42 -> 172.31.8.238 TCP 11650 [TCP segment of a reassembled PDU]
293   0.047961 172.31.8.238 -> 54.230.117.42 TCP 66 39941 > http [ACK] Seq=98 Ack=1232249 Win=702720 Len=0 TSval=17757658 TSecr=1687592284
294   0.048065 54.230.117.42 -> 172.31.8.238 TCP 7306 [TCP segment of a reassembled PDU]
295   0.048083 172.31.8.238 -> 54.230.117.42 TCP 66 39941 > http [ACK] Seq=98 Ack=1239489 Win=702720 Len=0 TSval=17757658 TSecr=1687592284
296   0.048190 54.230.117.42 -> 172.31.8.238 TCP 2962 [TCP segment of a reassembled PDU]
297   0.048206 172.31.8.238 -> 54.230.117.42 TCP 66 39941 > http [ACK] Seq=98 Ack=1242385 Win=702720 Len=0 TSval=17757658 TSecr=1687592284
298   0.048538 54.230.117.42 -> 172.31.8.238 TCP 2962 [TCP segment of a reassembled PDU]
299   0.048554 172.31.8.238 -> 54.230.117.42 TCP 66 39941 > http [ACK] Seq=98 Ack=1245281 Win=702720 Len=0 TSval=17757658 TSecr=1687592285
300   0.048673 54.230.117.42 -> 172.31.8.238 TCP 5858 [TCP segment of a reassembled PDU]
301   0.048692 172.31.8.238 -> 54.230.117.42 TCP 66 39941 > http [ACK] Seq=98 Ack=1251073 Win=702720 Len=0 TSval=17757658 TSecr=1687592285
302   0.048740 54.230.117.42 -> 172.31.8.238 TCP 10202 [TCP segment of a reassembled PDU]
303   0.048760 172.31.8.238 -> 54.230.117.42 TCP 66 39941 > http [ACK] Seq=98 Ack=1261209 Win=702720 Len=0 TSval=17757658 TSecr=1687592285
304   0.048810 54.230.117.42 -> 172.31.8.238 TCP 10202 [TCP segment of a reassembled PDU]
305   0.048830 172.31.8.238 -> 54.230.117.42 TCP 66 39941 > http [ACK] Seq=98 Ack=1271345 Win=702720 Len=0 TSval=17757658 TSecr=1687592285
306   0.049298 54.230.117.42 -> 172.31.8.238 TCP 5858 [TCP segment of a reassembled PDU]
307   0.049317 172.31.8.238 -> 54.230.117.42 TCP 66 39941 > http [ACK] Seq=98 Ack=1277137 Win=702720 Len=0 TSval=17757658 TSecr=1687592285
308   0.049445 54.230.117.42 -> 172.31.8.238 TCP 13098 [TCP segment of a reassembled PDU]
309   0.049468 172.31.8.238 -> 54.230.117.42 TCP 66 39941 > http [ACK] Seq=98 Ack=1290169 Win=702720 Len=0 TSval=17757658 TSecr=1687592285
310   0.049676 54.230.117.42 -> 172.31.8.238 TCP 10202 [TCP segment of a reassembled PDU]
311   0.049696 172.31.8.238 -> 54.230.117.42 TCP 66 39941 > http [ACK] Seq=98 Ack=1300305 Win=702720 Len=0 TSval=17757658 TSecr=1687592285
312   0.050061 54.230.117.42 -> 172.31.8.238 TCP 7306 [TCP segment of a reassembled PDU]
313   0.050203 54.230.117.42 -> 172.31.8.238 TCP 8754 [TCP segment of a reassembled PDU]
314   0.050331 54.230.117.42 -> 172.31.8.238 TCP 7306 [TCP segment of a reassembled PDU]
315   0.050347 172.31.8.238 -> 54.230.117.42 TCP 66 39941 > http [ACK] Seq=98 Ack=1323473 Win=690944 Len=0 TSval=17757658 TSecr=1687592285
316   0.050452 54.230.117.42 -> 172.31.8.238 TCP 5858 [TCP segment of a reassembled PDU]
317   0.050459 172.31.8.238 -> 54.230.117.42 TCP 66 39941 > http [ACK] Seq=98 Ack=1329265 Win=693248 Len=0 TSval=17757658 TSecr=1687592285
318   0.050841 54.230.117.42 -> 172.31.8.238 TCP 5858 [TCP segment of a reassembled PDU]
319   0.050848 172.31.8.238 -> 54.230.117.42 TCP 66 39941 > http [ACK] Seq=98 Ack=1335057 Win=693248 Len=0 TSval=17757658 TSecr=1687592285
320   0.050997 54.230.117.42 -> 172.31.8.238 TCP 17442 [TCP segment of a reassembled PDU]
321   0.051019 172.31.8.238 -> 54.230.117.42 TCP 66 39941 > http [ACK] Seq=98 Ack=1352433 Win=675968 Len=0 TSval=17757658 TSecr=1687592285
322   0.051337 54.230.117.42 -> 172.31.8.238 TCP 5858 [TCP segment of a reassembled PDU]
323   0.051344 172.31.8.238 -> 54.230.117.42 TCP 66 39941 > http [ACK] Seq=98 Ack=1358225 Win=693248 Len=0 TSval=17757658 TSecr=1687592285
324   0.051471 54.230.117.42 -> 172.31.8.238 TCP 5858 [TCP segment of a reassembled PDU]
325   0.051477 172.31.8.238 -> 54.230.117.42 TCP 66 39941 > http [ACK] Seq=98 Ack=1364017 Win=693248 Len=0 TSval=17757658 TSecr=1687592285
326   0.051709 54.230.117.42 -> 172.31.8.238 TCP 4410 [TCP segment of a reassembled PDU]
327   0.051715 172.31.8.238 -> 54.230.117.42 TCP 66 39941 > http [ACK] Seq=98 Ack=1368361 Win=695680 Len=0 TSval=17757659 TSecr=1687592285
328   0.051868 54.230.117.42 -> 172.31.8.238 TCP 13098 [TCP segment of a reassembled PDU]
329   0.051888 172.31.8.238 -> 54.230.117.42 TCP 66 39941 > http [ACK] Seq=98 Ack=1381393 Win=702720 Len=0 TSval=17757659 TSecr=1687592285
330   0.052223 54.230.117.42 -> 172.31.8.238 TCP 11650 [TCP segment of a reassembled PDU]
331   0.052243 172.31.8.238 -> 54.230.117.42 TCP 66 39941 > http [ACK] Seq=98 Ack=1392977 Win=702720 Len=0 TSval=17757659 TSecr=1687592285
332   0.052488 54.230.117.42 -> 172.31.8.238 TCP 18890 [TCP segment of a reassembled PDU]
333   0.052510 172.31.8.238 -> 54.230.117.42 TCP 66 39941 > http [ACK] Seq=98 Ack=1411801 Win=683904 Len=0 TSval=17757659 TSecr=1687592285
334   0.052874 54.230.117.42 -> 172.31.8.238 TCP 4410 [TCP segment of a reassembled PDU]
335   0.052880 172.31.8.238 -> 54.230.117.42 TCP 66 39941 > http [ACK] Seq=98 Ack=1416145 Win=695680 Len=0 TSval=17757659 TSecr=1687592285
336   0.053030 54.230.117.42 -> 172.31.8.238 TCP 7306 [TCP segment of a reassembled PDU]
337   0.053049 172.31.8.238 -> 54.230.117.42 TCP 66 39941 > http [ACK] Seq=98 Ack=1423385 Win=702720 Len=0 TSval=17757659 TSecr=1687592285
338   0.053141 54.230.117.42 -> 172.31.8.238 TCP 4410 [TCP segment of a reassembled PDU]
339   0.053285 54.230.117.42 -> 172.31.8.238 TCP 14546 [TCP segment of a reassembled PDU]
340   0.053381 172.31.8.238 -> 54.230.117.42 TCP 66 39941 > http [ACK] Seq=98 Ack=1442209 Win=683904 Len=0 TSval=17757659 TSecr=1687592285
341   0.053519 54.230.117.42 -> 172.31.8.238 TCP 4410 [TCP segment of a reassembled PDU]
342   0.053525 172.31.8.238 -> 54.230.117.42 TCP 66 39941 > http [ACK] Seq=98 Ack=1446553 Win=695680 Len=0 TSval=17757659 TSecr=1687592285
343   0.053882 54.230.117.42 -> 172.31.8.238 TCP 1514 [TCP segment of a reassembled PDU]
344   0.054054 54.230.117.42 -> 172.31.8.238 TCP 24682 [TCP segment of a reassembled PDU]
345   0.054092 172.31.8.238 -> 54.230.117.42 TCP 66 39941 > http [ACK] Seq=98 Ack=1472617 Win=669696 Len=0 TSval=17757659 TSecr=1687592285
346   0.054661 54.230.117.42 -> 172.31.8.238 TCP 5858 [TCP segment of a reassembled PDU]
347   0.054667 172.31.8.238 -> 54.230.117.42 TCP 66 39941 > http [ACK] Seq=98 Ack=1478409 Win=693248 Len=0 TSval=17757659 TSecr=1687592285
348   0.054843 54.230.117.42 -> 172.31.8.238 TCP 24682 [TCP segment of a reassembled PDU]
349   0.054868 172.31.8.238 -> 54.230.117.42 TCP 66 39941 > http [ACK] Seq=98 Ack=1503025 Win=668672 Len=0 TSval=17757659 TSecr=1687592285
350   0.055425 54.230.117.42 -> 172.31.8.238 TCP 1514 [TCP segment of a reassembled PDU]
351   0.055592 54.230.117.42 -> 172.31.8.238 TCP 26130 [TCP segment of a reassembled PDU]
352   0.055607 54.230.117.42 -> 172.31.8.238 TCP 2962 [TCP segment of a reassembled PDU]
