[Measurement for 10mb at 23:43:22 19.43.2014] 
Tshark:

  1   0.000000 172.31.8.238 -> 172.31.0.2   DNS 89 Standard query 0xde82  A d1n0gskdvzj94j.cloudfront.net
  2   0.000029 172.31.8.238 -> 172.31.0.2   DNS 89 Standard query 0x640f  AAAA d1n0gskdvzj94j.cloudfront.net
  3   0.000716   172.31.0.2 -> 172.31.8.238 DNS 176 Standard query response 0x640f 
  4   0.000730   172.31.0.2 -> 172.31.8.238 DNS 217 Standard query response 0xde82  A 54.230.117.86 A 54.230.118.138 A 54.230.119.110 A 54.230.119.189 A 54.239.132.86 A 54.192.118.236 A 54.192.118.240 A 54.230.116.154
  5   0.003857 172.31.8.238 -> 54.230.117.86 TCP 74 51752 > http [SYN] Seq=0 Win=26883 Len=0 MSS=8961 SACK_PERM=1 TSval=6057479 TSecr=0 WS=128
  6   0.004553 54.230.117.86 -> 172.31.8.238 TCP 74 http > 51752 [SYN, ACK] Seq=0 Ack=1 Win=14480 Len=0 MSS=1460 SACK_PERM=1 TSval=1681428458 TSecr=6057479 WS=128
  7   0.004567 172.31.8.238 -> 54.230.117.86 TCP 66 51752 > http [ACK] Seq=1 Ack=1 Win=27008 Len=0 TSval=6057479 TSecr=1681428458
  8   0.004609 172.31.8.238 -> 54.230.117.86 HTTP 163 GET /10mb HTTP/1.1 
  9   0.005293 54.230.117.86 -> 172.31.8.238 TCP 66 http > 51752 [ACK] Seq=1 Ack=98 Win=14592 Len=0 TSval=1681428458 TSecr=6057479
 10   0.007112 54.230.117.86 -> 172.31.8.238 TCP 524 [TCP segment of a reassembled PDU]
 11   0.007121 172.31.8.238 -> 54.230.117.86 TCP 66 51752 > http [ACK] Seq=98 Ack=459 Win=28032 Len=0 TSval=6057480 TSecr=1681428458
 12   0.007229 54.230.117.86 -> 172.31.8.238 TCP 13098 [TCP segment of a reassembled PDU]
 13   0.007240 172.31.8.238 -> 54.230.117.86 TCP 66 51752 > http [ACK] Seq=98 Ack=13491 Win=54144 Len=0 TSval=6057480 TSecr=1681428458
 14   0.007944 54.230.117.86 -> 172.31.8.238 TCP 5858 [TCP segment of a reassembled PDU]
 15   0.007951 172.31.8.238 -> 54.230.117.86 TCP 66 51752 > http [ACK] Seq=98 Ack=19283 Win=65664 Len=0 TSval=6057480 TSecr=1681428458
 16   0.008059 54.230.117.86 -> 172.31.8.238 TCP 7306 [TCP segment of a reassembled PDU]
 17   0.008066 172.31.8.238 -> 54.230.117.86 TCP 66 51752 > http [ACK] Seq=98 Ack=26523 Win=80128 Len=0 TSval=6057480 TSecr=1681428458
 18   0.008463 54.230.117.86 -> 172.31.8.238 TCP 4410 [TCP segment of a reassembled PDU]
 19   0.008470 172.31.8.238 -> 54.230.117.86 TCP 66 51752 > http [ACK] Seq=98 Ack=30867 Win=88832 Len=0 TSval=6057480 TSecr=1681428458
 20   0.008562 54.230.117.86 -> 172.31.8.238 TCP 7306 [TCP segment of a reassembled PDU]
 21   0.008568 172.31.8.238 -> 54.230.117.86 TCP 66 51752 > http [ACK] Seq=98 Ack=38107 Win=103296 Len=0 TSval=6057480 TSecr=1681428458
 22   0.008736 54.230.117.86 -> 172.31.8.238 TCP 5858 [TCP segment of a reassembled PDU]
 23   0.008743 172.31.8.238 -> 54.230.117.86 TCP 66 51752 > http [ACK] Seq=98 Ack=43899 Win=108416 Len=0 TSval=6057480 TSecr=1681428458
 24   0.008825 54.230.117.86 -> 172.31.8.238 TCP 2962 [TCP segment of a reassembled PDU]
 25   0.008830 172.31.8.238 -> 54.230.117.86 TCP 66 51752 > http [ACK] Seq=98 Ack=46795 Win=109056 Len=0 TSval=6057480 TSecr=1681428458
 26   0.008981 54.230.117.86 -> 172.31.8.238 TCP 5858 [TCP segment of a reassembled PDU]
 27   0.008988 172.31.8.238 -> 54.230.117.86 TCP 66 51752 > http [ACK] Seq=98 Ack=52587 Win=108416 Len=0 TSval=6057481 TSecr=1681428458
 28   0.009461 54.230.117.86 -> 172.31.8.238 TCP 4410 [TCP segment of a reassembled PDU]
 29   0.009467 172.31.8.238 -> 54.230.117.86 TCP 66 51752 > http [ACK] Seq=98 Ack=56931 Win=117760 Len=0 TSval=6057481 TSecr=1681428458
 30   0.009574 54.230.117.86 -> 172.31.8.238 TCP 8754 [TCP segment of a reassembled PDU]
 31   0.009581 172.31.8.238 -> 54.230.117.86 TCP 66 51752 > http [ACK] Seq=98 Ack=65619 Win=135168 Len=0 TSval=6057481 TSecr=1681428458
 32   0.009677 54.230.117.86 -> 172.31.8.238 TCP 13098 [TCP segment of a reassembled PDU]
 33   0.009686 172.31.8.238 -> 54.230.117.86 TCP 66 51752 > http [ACK] Seq=98 Ack=78651 Win=161152 Len=0 TSval=6057481 TSecr=1681428458
 34   0.009980 54.230.117.86 -> 172.31.8.238 TCP 5858 [TCP segment of a reassembled PDU]
 35   0.009987 172.31.8.238 -> 54.230.117.86 TCP 66 51752 > http [ACK] Seq=98 Ack=84443 Win=172800 Len=0 TSval=6057481 TSecr=1681428458
 36   0.010075 54.230.117.86 -> 172.31.8.238 TCP 7306 [TCP segment of a reassembled PDU]
 37   0.010082 172.31.8.238 -> 54.230.117.86 TCP 66 51752 > http [ACK] Seq=98 Ack=91683 Win=187264 Len=0 TSval=6057481 TSecr=1681428458
 38   0.010304 54.230.117.86 -> 172.31.8.238 TCP 13098 [TCP segment of a reassembled PDU]
 39   0.010313 172.31.8.238 -> 54.230.117.86 TCP 66 51752 > http [ACK] Seq=98 Ack=104715 Win=213376 Len=0 TSval=6057481 TSecr=1681428458
 40   0.010538 54.230.117.86 -> 172.31.8.238 TCP 13098 [TCP segment of a reassembled PDU]
 41   0.010547 172.31.8.238 -> 54.230.117.86 TCP 66 51752 > http [ACK] Seq=98 Ack=117747 Win=239360 Len=0 TSval=6057481 TSecr=1681428458
 42   0.010800 54.230.117.86 -> 172.31.8.238 TCP 13098 [TCP segment of a reassembled PDU]
 43   0.010809 172.31.8.238 -> 54.230.117.86 TCP 66 51752 > http [ACK] Seq=98 Ack=130779 Win=265472 Len=0 TSval=6057481 TSecr=1681428458
 44   0.011050 54.230.117.86 -> 172.31.8.238 TCP 11650 [TCP segment of a reassembled PDU]
 45   0.011059 172.31.8.238 -> 54.230.117.86 TCP 66 51752 > http [ACK] Seq=98 Ack=142363 Win=288640 Len=0 TSval=6057481 TSecr=1681428458
 46   0.011194 54.230.117.86 -> 172.31.8.238 TCP 13098 [TCP segment of a reassembled PDU]
 47   0.011204 172.31.8.238 -> 54.230.117.86 TCP 66 51752 > http [ACK] Seq=98 Ack=155395 Win=312064 Len=0 TSval=6057481 TSecr=1681428458
 48   0.011367 54.230.117.86 -> 172.31.8.238 TCP 14546 [TCP segment of a reassembled PDU]
 49   0.011377 172.31.8.238 -> 54.230.117.86 TCP 66 51752 > http [ACK] Seq=98 Ack=169875 Win=309504 Len=0 TSval=6057481 TSecr=1681428458
 50   0.011514 54.230.117.86 -> 172.31.8.238 TCP 8754 [TCP segment of a reassembled PDU]
 51   0.011521 172.31.8.238 -> 54.230.117.86 TCP 66 51752 > http [ACK] Seq=98 Ack=178563 Win=319104 Len=0 TSval=6057481 TSecr=1681428458
 52   0.011611 54.230.117.86 -> 172.31.8.238 TCP 4410 [TCP segment of a reassembled PDU]
 53   0.011616 172.31.8.238 -> 54.230.117.86 TCP 66 51752 > http [ACK] Seq=98 Ack=182907 Win=326272 Len=0 TSval=6057481 TSecr=1681428458
 54   0.011867 54.230.117.86 -> 172.31.8.238 TCP 14546 [TCP segment of a reassembled PDU]
 55   0.011876 172.31.8.238 -> 54.230.117.86 TCP 66 51752 > http [ACK] Seq=98 Ack=197387 Win=311808 Len=0 TSval=6057481 TSecr=1681428458
 56   0.012035 54.230.117.86 -> 172.31.8.238 TCP 2962 [TCP segment of a reassembled PDU]
 57   0.012040 172.31.8.238 -> 54.230.117.86 TCP 66 51752 > http [ACK] Seq=98 Ack=200283 Win=328576 Len=0 TSval=6057481 TSecr=1681428458
 58   0.012195 54.230.117.86 -> 172.31.8.238 TCP 26130 [TCP segment of a reassembled PDU]
 59   0.012208 172.31.8.238 -> 54.230.117.86 TCP 66 51752 > http [ACK] Seq=98 Ack=226347 Win=302592 Len=0 TSval=6057481 TSecr=1681428458
 60   0.012215 54.230.117.86 -> 172.31.8.238 TCP 1514 [TCP segment of a reassembled PDU]
 61   0.012217 172.31.8.238 -> 54.230.117.86 TCP 66 51752 > http [ACK] Seq=98 Ack=227795 Win=301184 Len=0 TSval=6057481 TSecr=1681428458
 62   0.012225 54.230.117.86 -> 172.31.8.238 TCP 1514 [TCP segment of a reassembled PDU]
 63   0.012227 172.31.8.238 -> 54.230.117.86 TCP 66 51752 > http [ACK] Seq=98 Ack=229243 Win=299776 Len=0 TSval=6057481 TSecr=1681428458
 64   0.012301 54.230.117.86 -> 172.31.8.238 TCP 10202 [TCP segment of a reassembled PDU]
 65   0.012322 172.31.8.238 -> 54.230.117.86 TCP 66 51752 > http [ACK] Seq=98 Ack=239379 Win=316800 Len=0 TSval=6057481 TSecr=1681428458
 66   0.012445 54.230.117.86 -> 172.31.8.238 TCP 5858 [TCP segment of a reassembled PDU]
 67   0.012451 172.31.8.238 -> 54.230.117.86 TCP 66 51752 > http [ACK] Seq=98 Ack=245171 Win=323840 Len=0 TSval=6057481 TSecr=1681428458
 68   0.012815 54.230.117.86 -> 172.31.8.238 TCP 7306 [TCP segment of a reassembled PDU]
 69   0.012823 172.31.8.238 -> 54.230.117.86 TCP 66 51752 > http [ACK] Seq=98 Ack=252411 Win=321536 Len=0 TSval=6057481 TSecr=1681428458
 70   0.012990 54.230.117.86 -> 172.31.8.238 TCP 26130 [TCP segment of a reassembled PDU]
 71   0.013004 172.31.8.238 -> 54.230.117.86 TCP 66 51752 > http [ACK] Seq=98 Ack=278475 Win=295552 Len=0 TSval=6057482 TSecr=1681428458
 72   0.013011 54.230.117.86 -> 172.31.8.238 TCP 1514 [TCP segment of a reassembled PDU]
 73   0.013013 172.31.8.238 -> 54.230.117.86 TCP 66 51752 > http [ACK] Seq=98 Ack=279923 Win=294144 Len=0 TSval=6057482 TSecr=1681428458
 74   0.013172 54.230.117.86 -> 172.31.8.238 TCP 15994 [TCP segment of a reassembled PDU]
 75   0.013182 172.31.8.238 -> 54.230.117.86 TCP 66 51752 > http [ACK] Seq=98 Ack=295851 Win=363904 Len=0 TSval=6057482 TSecr=1681428458
 76   0.013209 54.230.117.86 -> 172.31.8.238 TCP 5858 [TCP segment of a reassembled PDU]
 77   0.013214 172.31.8.238 -> 54.230.117.86 TCP 66 51752 > http [ACK] Seq=98 Ack=301643 Win=375552 Len=0 TSval=6057482 TSecr=1681428458
 78   0.013579 54.230.117.86 -> 172.31.8.238 TCP 1514 [TCP segment of a reassembled PDU]
 79   0.013583 172.31.8.238 -> 54.230.117.86 TCP 66 51752 > http [ACK] Seq=98 Ack=303091 Win=378368 Len=0 TSval=6057482 TSecr=1681428458
 80   0.013773 54.230.117.86 -> 172.31.8.238 TCP 26130 [TCP segment of a reassembled PDU]
 81   0.013787 172.31.8.238 -> 54.230.117.86 TCP 66 51752 > http [ACK] Seq=98 Ack=329155 Win=430464 Len=0 TSval=6057482 TSecr=1681428458
 82   0.013814 54.230.117.86 -> 172.31.8.238 TCP 8754 [TCP segment of a reassembled PDU]
 83   0.013821 172.31.8.238 -> 54.230.117.86 TCP 66 51752 > http [ACK] Seq=98 Ack=337843 Win=447872 Len=0 TSval=6057482 TSecr=1681428458
 84   0.013962 54.230.117.86 -> 172.31.8.238 TCP 20338 [TCP segment of a reassembled PDU]
 85   0.013974 172.31.8.238 -> 54.230.117.86 TCP 66 51752 > http [ACK] Seq=98 Ack=358115 Win=488448 Len=0 TSval=6057482 TSecr=1681428458
 86   0.014009 54.230.117.86 -> 172.31.8.238 TCP 7306 [TCP segment of a reassembled PDU]
 87   0.014015 172.31.8.238 -> 54.230.117.86 TCP 66 51752 > http [ACK] Seq=98 Ack=365355 Win=502912 Len=0 TSval=6057482 TSecr=1681428458
 88   0.014333 54.230.117.86 -> 172.31.8.238 TCP 2962 [TCP segment of a reassembled PDU]
 89   0.014339 172.31.8.238 -> 54.230.117.86 TCP 66 51752 > http [ACK] Seq=98 Ack=368251 Win=508672 Len=0 TSval=6057482 TSecr=1681428459
 90   0.014520 54.230.117.86 -> 172.31.8.238 TCP 26130 [TCP segment of a reassembled PDU]
 91   0.014533 172.31.8.238 -> 54.230.117.86 TCP 66 51752 > http [ACK] Seq=98 Ack=394315 Win=560896 Len=0 TSval=6057482 TSecr=1681428459
 92   0.014576 54.230.117.86 -> 172.31.8.238 TCP 11650 [TCP segment of a reassembled PDU]
 93   0.014587 172.31.8.238 -> 54.230.117.86 TCP 66 51752 > http [ACK] Seq=98 Ack=405899 Win=584064 Len=0 TSval=6057482 TSecr=1681428459
 94   0.014735 54.230.117.86 -> 172.31.8.238 TCP 26130 [TCP segment of a reassembled PDU]
 95   0.014749 172.31.8.238 -> 54.230.117.86 TCP 66 51752 > http [ACK] Seq=98 Ack=431963 Win=636160 Len=0 TSval=6057482 TSecr=1681428459
 96   0.014756 54.230.117.86 -> 172.31.8.238 TCP 4410 [TCP segment of a reassembled PDU]
 97   0.014760 172.31.8.238 -> 54.230.117.86 TCP 66 51752 > http [ACK] Seq=98 Ack=436307 Win=644864 Len=0 TSval=6057482 TSecr=1681428459
 98   0.015180 54.230.117.86 -> 172.31.8.238 TCP 21786 [TCP segment of a reassembled PDU]
 99   0.015193 172.31.8.238 -> 54.230.117.86 TCP 66 51752 > http [ACK] Seq=98 Ack=458027 Win=688256 Len=0 TSval=6057482 TSecr=1681428459
100   0.015314 54.230.117.86 -> 172.31.8.238 TCP 23234 [TCP segment of a reassembled PDU]
101   0.015327 172.31.8.238 -> 54.230.117.86 TCP 66 51752 > http [ACK] Seq=98 Ack=481195 Win=734592 Len=0 TSval=6057482 TSecr=1681428459
102   0.015637 54.230.117.86 -> 172.31.8.238 TCP 10202 [TCP segment of a reassembled PDU]
103   0.015645 172.31.8.238 -> 54.230.117.86 TCP 66 51752 > http [ACK] Seq=98 Ack=491331 Win=754816 Len=0 TSval=6057482 TSecr=1681428459
104   0.015792 54.230.117.86 -> 172.31.8.238 TCP 20338 [TCP segment of a reassembled PDU]
105   0.015804 172.31.8.238 -> 54.230.117.86 TCP 66 51752 > http [ACK] Seq=98 Ack=511603 Win=795392 Len=0 TSval=6057482 TSecr=1681428459
106   0.016069 54.230.117.86 -> 172.31.8.238 TCP 26130 [TCP segment of a reassembled PDU]
107   0.016083 172.31.8.238 -> 54.230.117.86 TCP 66 51752 > http [ACK] Seq=98 Ack=537667 Win=847488 Len=0 TSval=6057482 TSecr=1681428459
108   0.016186 54.230.117.86 -> 172.31.8.238 TCP 24682 [TCP segment of a reassembled PDU]
109   0.016199 172.31.8.238 -> 54.230.117.86 TCP 66 51752 > http [ACK] Seq=98 Ack=562283 Win=896768 Len=0 TSval=6057482 TSecr=1681428459
110   0.016472 54.230.117.86 -> 172.31.8.238 TCP 14546 [TCP segment of a reassembled PDU]
111   0.016481 172.31.8.238 -> 54.230.117.86 TCP 66 51752 > http [ACK] Seq=98 Ack=576763 Win=925696 Len=0 TSval=6057482 TSecr=1681428459
112   0.016814 54.230.117.86 -> 172.31.8.238 TCP 26130 [TCP segment of a reassembled PDU]
113   0.016828 172.31.8.238 -> 54.230.117.86 TCP 66 51752 > http [ACK] Seq=98 Ack=602827 Win=977920 Len=0 TSval=6057482 TSecr=1681428459
114   0.016956 54.230.117.86 -> 172.31.8.238 TCP 21786 [TCP segment of a reassembled PDU]
115   0.016968 172.31.8.238 -> 54.230.117.86 TCP 66 51752 > http [ACK] Seq=98 Ack=624547 Win=1021312 Len=0 TSval=6057483 TSecr=1681428459
116   0.017011 54.230.117.86 -> 172.31.8.238 TCP 17442 [TCP segment of a reassembled PDU]
117   0.017021 172.31.8.238 -> 54.230.117.86 TCP 66 51752 > http [ACK] Seq=98 Ack=641923 Win=1056000 Len=0 TSval=6057483 TSecr=1681428459
118   0.017453 54.230.117.86 -> 172.31.8.238 TCP 8754 [TCP segment of a reassembled PDU]
119   0.017461 172.31.8.238 -> 54.230.117.86 TCP 66 51752 > http [ACK] Seq=98 Ack=650611 Win=1073408 Len=0 TSval=6057483 TSecr=1681428459
120   0.017629 54.230.117.86 -> 172.31.8.238 TCP 26130 [TCP segment of a reassembled PDU]
121   0.017643 172.31.8.238 -> 54.230.117.86 TCP 66 51752 > http [ACK] Seq=98 Ack=676675 Win=1125504 Len=0 TSval=6057483 TSecr=1681428459
122   0.017703 54.230.117.86 -> 172.31.8.238 TCP 15994 [TCP segment of a reassembled PDU]
123   0.017712 172.31.8.238 -> 54.230.117.86 TCP 66 51752 > http [ACK] Seq=98 Ack=692603 Win=1157376 Len=0 TSval=6057483 TSecr=1681428459
124   0.017779 54.230.117.86 -> 172.31.8.238 TCP 14546 [TCP segment of a reassembled PDU]
125   0.017789 172.31.8.238 -> 54.230.117.86 TCP 66 51752 > http [ACK] Seq=98 Ack=707083 Win=1186432 Len=0 TSval=6057483 TSecr=1681428459
126   0.017977 54.230.117.86 -> 172.31.8.238 TCP 18890 [TCP segment of a reassembled PDU]
127   0.017989 172.31.8.238 -> 54.230.117.86 TCP 66 51752 > http [ACK] Seq=98 Ack=725907 Win=1224064 Len=0 TSval=6057483 TSecr=1681428459
128   0.018136 54.230.117.86 -> 172.31.8.238 TCP 18890 [TCP segment of a reassembled PDU]
129   0.018147 172.31.8.238 -> 54.230.117.86 TCP 66 51752 > http [ACK] Seq=98 Ack=744731 Win=1261696 Len=0 TSval=6057483 TSecr=1681428459
130   0.018269 54.230.117.86 -> 172.31.8.238 TCP 23234 [TCP segment of a reassembled PDU]
131   0.018281 172.31.8.238 -> 54.230.117.86 TCP 66 51752 > http [ACK] Seq=98 Ack=767899 Win=1308032 Len=0 TSval=6057483 TSecr=1681428459
132   0.018360 54.230.117.86 -> 172.31.8.238 TCP 4410 [TCP segment of a reassembled PDU]
133   0.018365 172.31.8.238 -> 54.230.117.86 TCP 66 51752 > http [ACK] Seq=98 Ack=772243 Win=1316736 Len=0 TSval=6057483 TSecr=1681428459
134   0.018475 54.230.117.86 -> 172.31.8.238 TCP 13098 [TCP segment of a reassembled PDU]
135   0.018485 172.31.8.238 -> 54.230.117.86 TCP 66 51752 > http [ACK] Seq=98 Ack=785275 Win=1342720 Len=0 TSval=6057483 TSecr=1681428459
136   0.018623 54.230.117.86 -> 172.31.8.238 TCP 20338 [TCP segment of a reassembled PDU]
137   0.018635 172.31.8.238 -> 54.230.117.86 TCP 66 51752 > http [ACK] Seq=98 Ack=805547 Win=1383296 Len=0 TSval=6057483 TSecr=1681428459
138   0.018729 54.230.117.86 -> 172.31.8.238 TCP 15994 [TCP segment of a reassembled PDU]
139   0.018739 172.31.8.238 -> 54.230.117.86 TCP 66 51752 > http [ACK] Seq=98 Ack=821475 Win=1415168 Len=0 TSval=6057483 TSecr=1681428459
140   0.018847 54.230.117.86 -> 172.31.8.238 TCP 15994 [TCP segment of a reassembled PDU]
141   0.018855 172.31.8.238 -> 54.230.117.86 TCP 66 51752 > http [ACK] Seq=98 Ack=837403 Win=1447040 Len=0 TSval=6057483 TSecr=1681428459
142   0.018982 54.230.117.86 -> 172.31.8.238 TCP 11650 [TCP segment of a reassembled PDU]
143   0.018990 172.31.8.238 -> 54.230.117.86 TCP 66 51752 > http [ACK] Seq=98 Ack=848987 Win=1470208 Len=0 TSval=6057483 TSecr=1681428459
144   0.019132 54.230.117.86 -> 172.31.8.238 TCP 26130 [TCP segment of a reassembled PDU]
145   0.019145 172.31.8.238 -> 54.230.117.86 TCP 66 51752 > http [ACK] Seq=98 Ack=875051 Win=1522304 Len=0 TSval=6057483 TSecr=1681428459
146   0.019152 54.230.117.86 -> 172.31.8.238 TCP 1514 [TCP segment of a reassembled PDU]
147   0.019154 172.31.8.238 -> 54.230.117.86 TCP 66 51752 > http [ACK] Seq=98 Ack=876499 Win=1525248 Len=0 TSval=6057483 TSecr=1681428459
148   0.019291 54.230.117.86 -> 172.31.8.238 TCP 18890 [TCP segment of a reassembled PDU]
149   0.019302 172.31.8.238 -> 54.230.117.86 TCP 66 51752 > http [ACK] Seq=98 Ack=895323 Win=1562880 Len=0 TSval=6057483 TSecr=1681428459
150   0.019397 54.230.117.86 -> 172.31.8.238 TCP 7306 [TCP segment of a reassembled PDU]
151   0.019404 172.31.8.238 -> 54.230.117.86 TCP 66 51752 > http [ACK] Seq=98 Ack=902563 Win=1577344 Len=0 TSval=6057483 TSecr=1681428459
152   0.019483 54.230.117.86 -> 172.31.8.238 TCP 2962 [TCP segment of a reassembled PDU]
153   0.019489 172.31.8.238 -> 54.230.117.86 TCP 66 51752 > http [ACK] Seq=98 Ack=905459 Win=1577344 Len=0 TSval=6057483 TSecr=1681428459
154   0.019568 54.230.117.86 -> 172.31.8.238 TCP 1514 [TCP Previous segment not captured] [TCP segment of a reassembled PDU]
155   0.019573 172.31.8.238 -> 54.230.117.86 TCP 78 [TCP Dup ACK 153#1] 51752 > http [ACK] Seq=98 Ack=905459 Win=1577344 Len=0 TSval=6057483 TSecr=1681428459 SLE=906907 SRE=908355
156   0.019578 54.230.117.86 -> 172.31.8.238 TCP 1514 [TCP Out-Of-Order] [TCP segment of a reassembled PDU]
157   0.019581 172.31.8.238 -> 54.230.117.86 TCP 66 51752 > http [ACK] Seq=98 Ack=908355 Win=1577344 Len=0 TSval=6057483 TSecr=1681428459
158   0.019738 54.230.117.86 -> 172.31.8.238 TCP 29026 [TCP segment of a reassembled PDU]
159   0.019753 172.31.8.238 -> 54.230.117.86 TCP 66 51752 > http [ACK] Seq=98 Ack=937315 Win=1577344 Len=0 TSval=6057483 TSecr=1681428459
160   0.019845 54.230.117.86 -> 172.31.8.238 TCP 39162 [TCP segment of a reassembled PDU]
161   0.019864 172.31.8.238 -> 54.230.117.86 TCP 66 51752 > http [ACK] Seq=98 Ack=976411 Win=1577344 Len=0 TSval=6057483 TSecr=1681428459
162   0.019925 54.230.117.86 -> 172.31.8.238 TCP 21786 [TCP segment of a reassembled PDU]
163   0.019937 172.31.8.238 -> 54.230.117.86 TCP 66 51752 > http [ACK] Seq=98 Ack=998131 Win=1577344 Len=0 TSval=6057483 TSecr=1681428459
164   0.019981 54.230.117.86 -> 172.31.8.238 TCP 13098 [TCP segment of a reassembled PDU]
165   0.019989 172.31.8.238 -> 54.230.117.86 TCP 66 51752 > http [ACK] Seq=98 Ack=1011163 Win=1577344 Len=0 TSval=6057483 TSecr=1681428459
166   0.020275 54.230.117.86 -> 172.31.8.238 TCP 4410 [TCP segment of a reassembled PDU]
167   0.020282 172.31.8.238 -> 54.230.117.86 TCP 66 51752 > http [ACK] Seq=98 Ack=1015507 Win=1577344 Len=0 TSval=6057483 TSecr=1681428459
168   0.020561 54.230.117.86 -> 172.31.8.238 TCP 18890 [TCP segment of a reassembled PDU]
169   0.020572 172.31.8.238 -> 54.230.117.86 TCP 66 51752 > http [ACK] Seq=98 Ack=1034331 Win=1577344 Len=0 TSval=6057483 TSecr=1681428459
170   0.020739 54.230.117.86 -> 172.31.8.238 TCP 26130 [TCP segment of a reassembled PDU]
171   0.020752 172.31.8.238 -> 54.230.117.86 TCP 66 51752 > http [ACK] Seq=98 Ack=1060395 Win=1577344 Len=0 TSval=6057483 TSecr=1681428459
172   0.020874 54.230.117.86 -> 172.31.8.238 TCP 37714 [TCP segment of a reassembled PDU]
173   0.020891 172.31.8.238 -> 54.230.117.86 TCP 66 51752 > http [ACK] Seq=98 Ack=1098043 Win=1577344 Len=0 TSval=6057483 TSecr=1681428459
174   0.021048 54.230.117.86 -> 172.31.8.238 TCP 17442 [TCP segment of a reassembled PDU]
175   0.021059 172.31.8.238 -> 54.230.117.86 TCP 66 51752 > http [ACK] Seq=98 Ack=1115419 Win=1577344 Len=0 TSval=6057484 TSecr=1681428459
176   0.021220 54.230.117.86 -> 172.31.8.238 TCP 26130 [TCP segment of a reassembled PDU]
177   0.021234 172.31.8.238 -> 54.230.117.86 TCP 66 51752 > http [ACK] Seq=98 Ack=1141483 Win=1577344 Len=0 TSval=6057484 TSecr=1681428459
178   0.021263 54.230.117.86 -> 172.31.8.238 TCP 11650 [TCP segment of a reassembled PDU]
179   0.021269 172.31.8.238 -> 54.230.117.86 TCP 66 51752 > http [ACK] Seq=98 Ack=1153067 Win=1577344 Len=0 TSval=6057484 TSecr=1681428459
180   0.021351 54.230.117.86 -> 172.31.8.238 TCP 10202 [TCP segment of a reassembled PDU]
181   0.021360 172.31.8.238 -> 54.230.117.86 TCP 66 51752 > http [ACK] Seq=98 Ack=1163203 Win=1577344 Len=0 TSval=6057484 TSecr=1681428459
182   0.021592 54.230.117.86 -> 172.31.8.238 TCP 14546 [TCP segment of a reassembled PDU]
183   0.021602 172.31.8.238 -> 54.230.117.86 TCP 66 51752 > http [ACK] Seq=98 Ack=1177683 Win=1577344 Len=0 TSval=6057484 TSecr=1681428459
184   0.021777 54.230.117.86 -> 172.31.8.238 TCP 26130 [TCP segment of a reassembled PDU]
185   0.021791 172.31.8.238 -> 54.230.117.86 TCP 66 51752 > http [ACK] Seq=98 Ack=1203747 Win=1577344 Len=0 TSval=6057484 TSecr=1681428459
186   0.021905 54.230.117.86 -> 172.31.8.238 TCP 15994 [TCP segment of a reassembled PDU]
187   0.021915 172.31.8.238 -> 54.230.117.86 TCP 66 51752 > http [ACK] Seq=98 Ack=1219675 Win=1577344 Len=0 TSval=6057484 TSecr=1681428459
188   0.022052 54.230.117.86 -> 172.31.8.238 TCP 26130 [TCP segment of a reassembled PDU]
189   0.022066 172.31.8.238 -> 54.230.117.86 TCP 66 51752 > http [ACK] Seq=98 Ack=1245739 Win=1577344 Len=0 TSval=6057484 TSecr=1681428459
190   0.022072 54.230.117.86 -> 172.31.8.238 TCP 1514 [TCP segment of a reassembled PDU]
191   0.022084 54.230.117.86 -> 172.31.8.238 TCP 15994 [TCP segment of a reassembled PDU]
192   0.022092 172.31.8.238 -> 54.230.117.86 TCP 66 51752 > http [ACK] Seq=98 Ack=1263115 Win=1577344 Len=0 TSval=6057484 TSecr=1681428459
193   0.022103 54.230.117.86 -> 172.31.8.238 TCP 8754 [TCP segment of a reassembled PDU]
194   0.022108 172.31.8.238 -> 54.230.117.86 TCP 66 51752 > http [ACK] Seq=98 Ack=1271803 Win=1577344 Len=0 TSval=6057484 TSecr=1681428459
195   0.022157 54.230.117.86 -> 172.31.8.238 TCP 7306 [TCP segment of a reassembled PDU]
196   0.022163 172.31.8.238 -> 54.230.117.86 TCP 66 51752 > http [ACK] Seq=98 Ack=1279043 Win=1577344 Len=0 TSval=6057484 TSecr=1681428459
197   0.022343 54.230.117.86 -> 172.31.8.238 TCP 14546 [TCP segment of a reassembled PDU]
198   0.022353 172.31.8.238 -> 54.230.117.86 TCP 66 51752 > http [ACK] Seq=98 Ack=1293523 Win=1577344 Len=0 TSval=6057484 TSecr=1681428459
199   0.022637 54.230.117.86 -> 172.31.8.238 TCP 11650 [TCP segment of a reassembled PDU]
200   0.022646 172.31.8.238 -> 54.230.117.86 TCP 66 51752 > http [ACK] Seq=98 Ack=1305107 Win=1577344 Len=0 TSval=6057484 TSecr=1681428459
201   0.022841 54.230.117.86 -> 172.31.8.238 TCP 26130 [TCP segment of a reassembled PDU]
202   0.022856 172.31.8.238 -> 54.230.117.86 TCP 66 51752 > http [ACK] Seq=98 Ack=1331171 Win=1577344 Len=0 TSval=6057484 TSecr=1681428459
203   0.022951 54.230.117.86 -> 172.31.8.238 TCP 26130 [TCP segment of a reassembled PDU]
204   0.022965 172.31.8.238 -> 54.230.117.86 TCP 66 51752 > http [ACK] Seq=98 Ack=1357235 Win=1577344 Len=0 TSval=6057484 TSecr=1681428459
205   0.023070 54.230.117.86 -> 172.31.8.238 TCP 36266 [TCP segment of a reassembled PDU]
206   0.023099 172.31.8.238 -> 54.230.117.86 TCP 66 51752 > http [ACK] Seq=98 Ack=1393435 Win=1577344 Len=0 TSval=6057484 TSecr=1681428459
207   0.023212 54.230.117.86 -> 172.31.8.238 TCP 30474 [TCP segment of a reassembled PDU]
208   0.023227 172.31.8.238 -> 54.230.117.86 TCP 66 51752 > http [ACK] Seq=98 Ack=1423843 Win=1577344 Len=0 TSval=6057484 TSecr=1681428459
209   0.023693 54.230.117.86 -> 172.31.8.238 TCP 5858 [TCP segment of a reassembled PDU]
210   0.023700 172.31.8.238 -> 54.230.117.86 TCP 66 51752 > http [ACK] Seq=98 Ack=1429635 Win=1577344 Len=0 TSval=6057484 TSecr=1681428459
211   0.023870 54.230.117.86 -> 172.31.8.238 TCP 26130 [TCP segment of a reassembled PDU]
212   0.023884 172.31.8.238 -> 54.230.117.86 TCP 66 51752 > http [ACK] Seq=98 Ack=1455699 Win=1577344 Len=0 TSval=6057484 TSecr=1681428459
213   0.024004 54.230.117.86 -> 172.31.8.238 TCP 26130 [TCP segment of a reassembled PDU]
214   0.024018 172.31.8.238 -> 54.230.117.86 TCP 66 51752 > http [ACK] Seq=98 Ack=1481763 Win=1577344 Len=0 TSval=6057484 TSecr=1681428459
215   0.024039 54.230.117.86 -> 172.31.8.238 TCP 26130 [TCP segment of a reassembled PDU]
216   0.024051 172.31.8.238 -> 54.230.117.86 TCP 66 51752 > http [ACK] Seq=98 Ack=1507827 Win=1577344 Len=0 TSval=6057484 TSecr=1681428459
217   0.024141 54.230.117.86 -> 172.31.8.238 TCP 26130 [TCP segment of a reassembled PDU]
218   0.024154 172.31.8.238 -> 54.230.117.86 TCP 66 51752 > http [ACK] Seq=98 Ack=1533891 Win=1577344 Len=0 TSval=6057484 TSecr=1681428459
219   0.024231 54.230.117.86 -> 172.31.8.238 TCP 20338 [TCP segment of a reassembled PDU]
220   0.024241 172.31.8.238 -> 54.230.117.86 TCP 66 51752 > http [ACK] Seq=98 Ack=1554163 Win=1577344 Len=0 TSval=6057484 TSecr=1681428459
221   0.024418 54.230.117.86 -> 172.31.8.238 TCP 26130 [TCP segment of a reassembled PDU]
222   0.024433 172.31.8.238 -> 54.230.117.86 TCP 66 51752 > http [ACK] Seq=98 Ack=1580227 Win=1577344 Len=0 TSval=6057484 TSecr=1681428460
223   0.024485 54.230.117.86 -> 172.31.8.238 TCP 24682 [TCP segment of a reassembled PDU]
224   0.024499 172.31.8.238 -> 54.230.117.86 TCP 66 51752 > http [ACK] Seq=98 Ack=1604843 Win=1577344 Len=0 TSval=6057484 TSecr=1681428460
225   0.024694 54.230.117.86 -> 172.31.8.238 TCP 14546 [TCP segment of a reassembled PDU]
226   0.024704 172.31.8.238 -> 54.230.117.86 TCP 66 51752 > http [ACK] Seq=98 Ack=1619323 Win=1577344 Len=0 TSval=6057484 TSecr=1681428460
227   0.024960 54.230.117.86 -> 172.31.8.238 TCP 26130 [TCP segment of a reassembled PDU]
228   0.024973 172.31.8.238 -> 54.230.117.86 TCP 66 51752 > http [ACK] Seq=98 Ack=1645387 Win=1577344 Len=0 TSval=6057485 TSecr=1681428460
229   0.025110 54.230.117.86 -> 172.31.8.238 TCP 21786 [TCP segment of a reassembled PDU]
230   0.025123 172.31.8.238 -> 54.230.117.86 TCP 66 51752 > http [ACK] Seq=98 Ack=1667107 Win=1577344 Len=0 TSval=6057485 TSecr=1681428460
231   0.025284 54.230.117.86 -> 172.31.8.238 TCP 56538 [TCP segment of a reassembled PDU]
232   0.025308 172.31.8.238 -> 54.230.117.86 TCP 66 51752 > http [ACK] Seq=98 Ack=1723579 Win=1577344 Len=0 TSval=6057485 TSecr=1681428460
233   0.025317 54.230.117.86 -> 172.31.8.238 TCP 5858 [TCP segment of a reassembled PDU]
234   0.025324 172.31.8.238 -> 54.230.117.86 TCP 66 51752 > http [ACK] Seq=98 Ack=1729371 Win=1577344 Len=0 TSval=6057485 TSecr=1681428460
235   0.025337 54.230.117.86 -> 172.31.8.238 TCP 20338 [TCP segment of a reassembled PDU]
236   0.025360 172.31.8.238 -> 54.230.117.86 TCP 66 51752 > http [ACK] Seq=98 Ack=1749643 Win=1576064 Len=0 TSval=6057485 TSecr=1681428460
237   0.025631 54.230.117.86 -> 172.31.8.238 TCP 8754 [TCP segment of a reassembled PDU]
238   0.025639 172.31.8.238 -> 54.230.117.86 TCP 66 51752 > http [ACK] Seq=98 Ack=1758331 Win=1577344 Len=0 TSval=6057485 TSecr=1681428460
239   0.025789 54.230.117.86 -> 172.31.8.238 TCP 26130 [TCP segment of a reassembled PDU]
240   0.025803 172.31.8.238 -> 54.230.117.86 TCP 66 51752 > http [ACK] Seq=98 Ack=1784395 Win=1577344 Len=0 TSval=6057485 TSecr=1681428460
241   0.025862 54.230.117.86 -> 172.31.8.238 TCP 26130 [TCP segment of a reassembled PDU]
242   0.025876 172.31.8.238 -> 54.230.117.86 TCP 66 51752 > http [ACK] Seq=98 Ack=1810459 Win=1577344 Len=0 TSval=6057485 TSecr=1681428460
243   0.025948 54.230.117.86 -> 172.31.8.238 TCP 26130 [TCP segment of a reassembled PDU]
244   0.025961 172.31.8.238 -> 54.230.117.86 TCP 66 51752 > http [ACK] Seq=98 Ack=1836523 Win=1577344 Len=0 TSval=6057485 TSecr=1681428460
245   0.026031 54.230.117.86 -> 172.31.8.238 TCP 26130 [TCP segment of a reassembled PDU]
246   0.026044 172.31.8.238 -> 54.230.117.86 TCP 66 51752 > http [ACK] Seq=98 Ack=1862587 Win=1577344 Len=0 TSval=6057485 TSecr=1681428460
247   0.026101 54.230.117.86 -> 172.31.8.238 TCP 17442 [TCP segment of a reassembled PDU]
248   0.026110 172.31.8.238 -> 54.230.117.86 TCP 66 51752 > http [ACK] Seq=98 Ack=1879963 Win=1577344 Len=0 TSval=6057485 TSecr=1681428460
249   0.026420 54.230.117.86 -> 172.31.8.238 TCP 18890 [TCP segment of a reassembled PDU]
250   0.026431 172.31.8.238 -> 54.230.117.86 TCP 66 51752 > http [ACK] Seq=98 Ack=1898787 Win=1577344 Len=0 TSval=6057485 TSecr=1681428460
251   0.026543 54.230.117.86 -> 172.31.8.238 TCP 33370 [TCP segment of a reassembled PDU]
252   0.026553 172.31.8.238 -> 54.230.117.86 TCP 66 51752 > http [ACK] Seq=98 Ack=1932091 Win=1577344 Len=0 TSval=6057485 TSecr=1681428460
253   0.026565 54.230.117.86 -> 172.31.8.238 TCP 13098 [TCP segment of a reassembled PDU]
254   0.026569 172.31.8.238 -> 54.230.117.86 TCP 66 51752 > http [ACK] Seq=98 Ack=1945123 Win=1577344 Len=0 TSval=6057485 TSecr=1681428460
255   0.026670 54.230.117.86 -> 172.31.8.238 TCP 5858 [TCP segment of a reassembled PDU]
256   0.026674 172.31.8.238 -> 54.230.117.86 TCP 66 51752 > http [ACK] Seq=98 Ack=1950915 Win=1577344 Len=0 TSval=6057485 TSecr=1681428460
257   0.026784 54.230.117.86 -> 172.31.8.238 TCP 26130 [TCP segment of a reassembled PDU]
258   0.026793 172.31.8.238 -> 54.230.117.86 TCP 66 51752 > http [ACK] Seq=98 Ack=1976979 Win=1577344 Len=0 TSval=6057485 TSecr=1681428460
259   0.026847 54.230.117.86 -> 172.31.8.238 TCP 26130 [TCP segment of a reassembled PDU]
260   0.026856 172.31.8.238 -> 54.230.117.86 TCP 66 51752 > http [ACK] Seq=98 Ack=2003043 Win=1577344 Len=0 TSval=6057485 TSecr=1681428460
261   0.026920 54.230.117.86 -> 172.31.8.238 TCP 15994 [TCP segment of a reassembled PDU]
262   0.026927 172.31.8.238 -> 54.230.117.86 TCP 66 51752 > http [ACK] Seq=98 Ack=2018971 Win=1577344 Len=0 TSval=6057485 TSecr=1681428460
263   0.026999 54.230.117.86 -> 172.31.8.238 TCP 26130 [TCP segment of a reassembled PDU]
264   0.027007 172.31.8.238 -> 54.230.117.86 TCP 66 51752 > http [ACK] Seq=98 Ack=2045035 Win=1577344 Len=0 TSval=6057485 TSecr=1681428460
265   0.027125 54.230.117.86 -> 172.31.8.238 TCP 20338 [TCP segment of a reassembled PDU]
266   0.027131 172.31.8.238 -> 54.230.117.86 TCP 66 51752 > http [ACK] Seq=98 Ack=2065307 Win=1577344 Len=0 TSval=6057485 TSecr=1681428460
267   0.027166 54.230.117.86 -> 172.31.8.238 TCP 10202 [TCP segment of a reassembled PDU]
268   0.027170 172.31.8.238 -> 54.230.117.86 TCP 66 51752 > http [ACK] Seq=98 Ack=2075443 Win=1577344 Len=0 TSval=6057485 TSecr=1681428460
269   0.027503 54.230.117.86 -> 172.31.8.238 TCP 26130 [TCP segment of a reassembled PDU]
270   0.027511 172.31.8.238 -> 54.230.117.86 TCP 66 51752 > http [ACK] Seq=98 Ack=2101507 Win=1577344 Len=0 TSval=6057485 TSecr=1681428460
271   0.027588 54.230.117.86 -> 172.31.8.238 TCP 26130 [TCP segment of a reassembled PDU]
272   0.027597 172.31.8.238 -> 54.230.117.86 TCP 66 51752 > http [ACK] Seq=98 Ack=2127571 Win=1577344 Len=0 TSval=6057485 TSecr=1681428460
273   0.027724 54.230.117.86 -> 172.31.8.238 TCP 10202 [TCP segment of a reassembled PDU]
274   0.027730 172.31.8.238 -> 54.230.117.86 TCP 66 51752 > http [ACK] Seq=98 Ack=2137707 Win=1577344 Len=0 TSval=6057485 TSecr=1681428460
275   0.027735 54.230.117.86 -> 172.31.8.238 TCP 1514 [TCP Previous segment not captured] [TCP segment of a reassembled PDU]
276   0.027737 172.31.8.238 -> 54.230.117.86 TCP 78 [TCP Dup ACK 274#1] 51752 > http [ACK] Seq=98 Ack=2137707 Win=1577344 Len=0 TSval=6057485 TSecr=1681428460 SLE=2140603 SRE=2142051
277   0.027740 54.230.117.86 -> 172.31.8.238 TCP 1514 [TCP Out-Of-Order] [TCP segment of a reassembled PDU]
278   0.027743 172.31.8.238 -> 54.230.117.86 TCP 78 51752 > http [ACK] Seq=98 Ack=2139155 Win=1577344 Len=0 TSval=6057485 TSecr=1681428460 SLE=2140603 SRE=2142051
279   0.027971 54.230.117.86 -> 172.31.8.238 TCP 1514 [TCP segment of a reassembled PDU]
280   0.027976 172.31.8.238 -> 54.230.117.86 TCP 78 [TCP Dup ACK 278#1] 51752 > http [ACK] Seq=98 Ack=2139155 Win=1577344 Len=0 TSval=6057485 TSecr=1681428460 SLE=2140603 SRE=2143499
281   0.027980 54.230.117.86 -> 172.31.8.238 TCP 1514 [TCP Out-Of-Order] [TCP segment of a reassembled PDU]
282   0.027984 172.31.8.238 -> 54.230.117.86 TCP 66 51752 > http [ACK] Seq=98 Ack=2143499 Win=1577344 Len=0 TSval=6057485 TSecr=1681428460
283   0.027996 54.230.117.86 -> 172.31.8.238 TCP 26130 [TCP segment of a reassembled PDU]
284   0.028001 172.31.8.238 -> 54.230.117.86 TCP 66 51752 > http [ACK] Seq=98 Ack=2169563 Win=1577344 Len=0 TSval=6057485 TSecr=1681428460
285   0.028038 54.230.117.86 -> 172.31.8.238 TCP 20338 [TCP segment of a reassembled PDU]
286   0.028044 172.31.8.238 -> 54.230.117.86 TCP 66 51752 > http [ACK] Seq=98 Ack=2189835 Win=1577344 Len=0 TSval=6057485 TSecr=1681428460
287   0.028198 54.230.117.86 -> 172.31.8.238 TCP 15994 [TCP segment of a reassembled PDU]
288   0.028206 172.31.8.238 -> 54.230.117.86 TCP 66 51752 > http [ACK] Seq=98 Ack=2205763 Win=1577344 Len=0 TSval=6057485 TSecr=1681428460
289   0.028353 54.230.117.86 -> 172.31.8.238 TCP 26130 [TCP segment of a reassembled PDU]
290   0.028361 172.31.8.238 -> 54.230.117.86 TCP 66 51752 > http [ACK] Seq=98 Ack=2231827 Win=1577344 Len=0 TSval=6057485 TSecr=1681428460
291   0.028390 54.230.117.86 -> 172.31.8.238 TCP 20338 [TCP segment of a reassembled PDU]
292   0.028396 172.31.8.238 -> 54.230.117.86 TCP 66 51752 > http [ACK] Seq=98 Ack=2252099 Win=1577344 Len=0 TSval=6057485 TSecr=1681428460
293   0.028472 54.230.117.86 -> 172.31.8.238 TCP 26130 [TCP segment of a reassembled PDU]
294   0.028480 172.31.8.238 -> 54.230.117.86 TCP 66 51752 > http [ACK] Seq=98 Ack=2278163 Win=1577344 Len=0 TSval=6057485 TSecr=1681428460
295   0.028837 54.230.117.86 -> 172.31.8.238 TCP 26130 [TCP segment of a reassembled PDU]
296   0.028844 172.31.8.238 -> 54.230.117.86 TCP 66 51752 > http [ACK] Seq=98 Ack=2304227 Win=1577344 Len=0 TSval=6057485 TSecr=1681428460
297   0.028898 54.230.117.86 -> 172.31.8.238 TCP 26130 [TCP segment of a reassembled PDU]
298   0.028906 172.31.8.238 -> 54.230.117.86 TCP 66 51752 > http [ACK] Seq=98 Ack=2330291 Win=1577344 Len=0 TSval=6057485 TSecr=1681428460
299   0.028959 54.230.117.86 -> 172.31.8.238 TCP 5858 [TCP segment of a reassembled PDU]
300   0.028963 172.31.8.238 -> 54.230.117.86 TCP 66 51752 > http [ACK] Seq=98 Ack=2336083 Win=1577344 Len=0 TSval=6057486 TSecr=1681428460
301   0.029029 54.230.117.86 -> 172.31.8.238 TCP 15994 [TCP segment of a reassembled PDU]
302   0.029035 172.31.8.238 -> 54.230.117.86 TCP 66 51752 > http [ACK] Seq=98 Ack=2352011 Win=1577344 Len=0 TSval=6057486 TSecr=1681428460
303   0.029170 54.230.117.86 -> 172.31.8.238 TCP 26130 [TCP segment of a reassembled PDU]
304   0.029178 172.31.8.238 -> 54.230.117.86 TCP 66 51752 > http [ACK] Seq=98 Ack=2378075 Win=1577344 Len=0 TSval=6057486 TSecr=1681428460
305   0.029280 54.230.117.86 -> 172.31.8.238 TCP 23234 [TCP segment of a reassembled PDU]
306   0.029287 172.31.8.238 -> 54.230.117.86 TCP 66 51752 > http [ACK] Seq=98 Ack=2401243 Win=1577344 Len=0 TSval=6057486 TSecr=1681428460
307   0.029517 54.230.117.86 -> 172.31.8.238 TCP 23234 [TCP segment of a reassembled PDU]
308   0.029525 172.31.8.238 -> 54.230.117.86 TCP 66 51752 > http [ACK] Seq=98 Ack=2424411 Win=1577344 Len=0 TSval=6057486 TSecr=1681428460
309   0.029671 54.230.117.86 -> 172.31.8.238 TCP 26130 [TCP segment of a reassembled PDU]
310   0.029678 172.31.8.238 -> 54.230.117.86 TCP 66 51752 > http [ACK] Seq=98 Ack=2450475 Win=1577344 Len=0 TSval=6057486 TSecr=1681428460
311   0.029734 54.230.117.86 -> 172.31.8.238 TCP 15994 [TCP segment of a reassembled PDU]
312   0.029740 172.31.8.238 -> 54.230.117.86 TCP 66 51752 > http [ACK] Seq=98 Ack=2466403 Win=1577344 Len=0 TSval=6057486 TSecr=1681428460
313   0.029875 54.230.117.86 -> 172.31.8.238 TCP 26130 [TCP segment of a reassembled PDU]
314   0.029882 172.31.8.238 -> 54.230.117.86 TCP 66 51752 > http [ACK] Seq=98 Ack=2492467 Win=1577344 Len=0 TSval=6057486 TSecr=1681428460
315   0.029938 54.230.117.86 -> 172.31.8.238 TCP 20338 [TCP segment of a reassembled PDU]
316   0.029958 172.31.8.238 -> 54.230.117.86 TCP 66 51752 > http [ACK] Seq=98 Ack=2512739 Win=1577344 Len=0 TSval=6057486 TSecr=1681428460
317   0.030033 54.230.117.86 -> 172.31.8.238 TCP 18890 [TCP segment of a reassembled PDU]
318   0.030052 172.31.8.238 -> 54.230.117.86 TCP 66 51752 > http [ACK] Seq=98 Ack=2531563 Win=1577344 Len=0 TSval=6057486 TSecr=1681428460
319   0.030278 54.230.117.86 -> 172.31.8.238 TCP 21786 [TCP segment of a reassembled PDU]
320   0.030298 172.31.8.238 -> 54.230.117.86 TCP 66 51752 > http [ACK] Seq=98 Ack=2553283 Win=1577344 Len=0 TSval=6057486 TSecr=1681428460
321   0.030403 54.230.117.86 -> 172.31.8.238 TCP 15994 [TCP segment of a reassembled PDU]
322   0.030409 172.31.8.238 -> 54.230.117.86 TCP 66 51752 > http [ACK] Seq=98 Ack=2569211 Win=1577344 Len=0 TSval=6057486 TSecr=1681428460
323   0.030539 54.230.117.86 -> 172.31.8.238 TCP 26130 [TCP segment of a reassembled PDU]
324   0.030547 172.31.8.238 -> 54.230.117.86 TCP 66 51752 > http [ACK] Seq=98 Ack=2595275 Win=1577344 Len=0 TSval=6057486 TSecr=1681428460
325   0.030580 54.230.117.86 -> 172.31.8.238 TCP 24682 [TCP segment of a reassembled PDU]
326   0.030587 172.31.8.238 -> 54.230.117.86 TCP 66 51752 > http [ACK] Seq=98 Ack=2619891 Win=1577344 Len=0 TSval=6057486 TSecr=1681428460
327   0.030741 54.230.117.86 -> 172.31.8.238 TCP 42058 [TCP segment of a reassembled PDU]
328   0.030751 172.31.8.238 -> 54.230.117.86 TCP 66 51752 > http [ACK] Seq=98 Ack=2661883 Win=1577344 Len=0 TSval=6057486 TSecr=1681428460
329   0.030882 54.230.117.86 -> 172.31.8.238 TCP 20338 [TCP segment of a reassembled PDU]
330   0.030888 172.31.8.238 -> 54.230.117.86 TCP 66 51752 > http [ACK] Seq=98 Ack=2682155 Win=1577344 Len=0 TSval=6057486 TSecr=1681428460
331   0.031014 54.230.117.86 -> 172.31.8.238 TCP 37714 [TCP segment of a reassembled PDU]
332   0.031022 172.31.8.238 -> 54.230.117.86 TCP 66 51752 > http [ACK] Seq=98 Ack=2719803 Win=1577344 Len=0 TSval=6057486 TSecr=1681428460
333   0.031071 54.230.117.86 -> 172.31.8.238 TCP 7306 [TCP segment of a reassembled PDU]
334   0.031076 172.31.8.238 -> 54.230.117.86 TCP 66 51752 > http [ACK] Seq=98 Ack=2727043 Win=1577344 Len=0 TSval=6057486 TSecr=1681428460
335   0.031235 54.230.117.86 -> 172.31.8.238 TCP 2962 [TCP segment of a reassembled PDU]
336   0.031240 172.31.8.238 -> 54.230.117.86 TCP 66 51752 > http [ACK] Seq=98 Ack=2729939 Win=1577344 Len=0 TSval=6057486 TSecr=1681428460
337   0.031420 54.230.117.86 -> 172.31.8.238 TCP 26130 [TCP segment of a reassembled PDU]
338   0.031428 172.31.8.238 -> 54.230.117.86 TCP 66 51752 > http [ACK] Seq=98 Ack=2756003 Win=1577344 Len=0 TSval=6057486 TSecr=1681428460
339   0.031550 54.230.117.86 -> 172.31.8.238 TCP 26130 [TCP segment of a reassembled PDU]
340   0.031557 172.31.8.238 -> 54.230.117.86 TCP 66 51752 > http [ACK] Seq=98 Ack=2782067 Win=1577344 Len=0 TSval=6057486 TSecr=1681428460
341   0.031567 54.230.117.86 -> 172.31.8.238 TCP 10202 [TCP segment of a reassembled PDU]
342   0.031570 172.31.8.238 -> 54.230.117.86 TCP 66 51752 > http [ACK] Seq=98 Ack=2792203 Win=1577344 Len=0 TSval=6057486 TSecr=1681428460
343   0.031584 54.230.117.86 -> 172.31.8.238 TCP 11650 [TCP segment of a reassembled PDU]
344   0.031588 172.31.8.238 -> 54.230.117.86 TCP 66 51752 > http [ACK] Seq=98 Ack=2803787 Win=1577344 Len=0 TSval=6057486 TSecr=1681428460
345   0.031734 54.230.117.86 -> 172.31.8.238 TCP 26130 [TCP segment of a reassembled PDU]
346   0.031742 172.31.8.238 -> 54.230.117.86 TCP 66 51752 > http [ACK] Seq=98 Ack=2829851 Win=1577344 Len=0 TSval=6057486 TSecr=1681428460
347   0.031857 54.230.117.86 -> 172.31.8.238 TCP 27578 [TCP segment of a reassembled PDU]
