[Measurement for 1mb at 06:33:01 20.33.2014] 
Tshark:

  1   0.000000 172.31.36.109 -> 172.31.0.2   DNS 88 Standard query 0x75b3  A dm53kc3eax57k.cloudfront.net
  2   0.000023 172.31.36.109 -> 172.31.0.2   DNS 88 Standard query 0x504e  AAAA dm53kc3eax57k.cloudfront.net
  3   0.000479   172.31.0.2 -> 172.31.36.109 DNS 216 Standard query response 0x75b3  A 54.230.30.189 A 54.230.30.245 A 54.192.30.139 A 54.192.30.184 A 54.192.30.216 A 54.192.30.218 A 54.192.30.221 A 54.230.30.7
  4   0.000489   172.31.0.2 -> 172.31.36.109 DNS 175 Standard query response 0x504e 
  5   0.003854 172.31.36.109 -> 54.230.30.189 TCP 74 42228 > http [SYN] Seq=0 Win=26883 Len=0 MSS=8961 SACK_PERM=1 TSval=32217041 TSecr=0 WS=128
  6   0.005153 54.230.30.189 -> 172.31.36.109 TCP 74 http > 42228 [SYN, ACK] Seq=0 Ack=1 Win=14480 Len=0 MSS=1460 SACK_PERM=1 TSval=696602281 TSecr=32217041 WS=128
  7   0.005167 172.31.36.109 -> 54.230.30.189 TCP 66 42228 > http [ACK] Seq=1 Ack=1 Win=27008 Len=0 TSval=32217041 TSecr=696602281
  8   0.005204 172.31.36.109 -> 54.230.30.189 HTTP 161 GET /1mb HTTP/1.1 
  9   0.006388 54.230.30.189 -> 172.31.36.109 TCP 66 http > 42228 [ACK] Seq=1 Ack=96 Win=14592 Len=0 TSval=696602281 TSecr=32217041
 10   0.025467 54.230.30.189 -> 172.31.36.109 TCP 13098 [TCP segment of a reassembled PDU]
 11   0.025480 172.31.36.109 -> 54.230.30.189 TCP 66 42228 > http [ACK] Seq=96 Ack=13033 Win=52992 Len=0 TSval=32217046 TSecr=696602283
 12   0.027011 54.230.30.189 -> 172.31.36.109 TCP 13098 [TCP segment of a reassembled PDU]
 13   0.027021 172.31.36.109 -> 54.230.30.189 TCP 66 42228 > http [ACK] Seq=96 Ack=26065 Win=79104 Len=0 TSval=32217046 TSecr=696602283
 14   0.028324 54.230.30.189 -> 172.31.36.109 TCP 13098 [TCP segment of a reassembled PDU]
 15   0.028333 172.31.36.109 -> 54.230.30.189 TCP 66 42228 > http [ACK] Seq=96 Ack=39097 Win=96512 Len=0 TSval=32217047 TSecr=696602283
 16   0.029504 54.230.30.189 -> 172.31.36.109 TCP 5858 [TCP segment of a reassembled PDU]
 17   0.029527 172.31.36.109 -> 54.230.30.189 TCP 66 42228 > http [ACK] Seq=96 Ack=44889 Win=108416 Len=0 TSval=32217047 TSecr=696602284
 18   0.029549 54.230.30.189 -> 172.31.36.109 TCP 5858 [TCP segment of a reassembled PDU]
 19   0.029554 172.31.36.109 -> 54.230.30.189 TCP 66 42228 > http [ACK] Seq=96 Ack=50681 Win=102656 Len=0 TSval=32217047 TSecr=696602284
 20   0.029701 54.230.30.189 -> 172.31.36.109 TCP 1514 [TCP segment of a reassembled PDU]
 21   0.029706 172.31.36.109 -> 54.230.30.189 TCP 66 42228 > http [ACK] Seq=96 Ack=52129 Win=112000 Len=0 TSval=32217047 TSecr=696602284
 22   0.030731 54.230.30.189 -> 172.31.36.109 TCP 2962 [TCP segment of a reassembled PDU]
 23   0.030743 172.31.36.109 -> 54.230.30.189 TCP 66 42228 > http [ACK] Seq=96 Ack=55025 Win=117760 Len=0 TSval=32217047 TSecr=696602284
 24   0.030893 54.230.30.189 -> 172.31.36.109 TCP 17442 [TCP segment of a reassembled PDU]
 25   0.030904 172.31.36.109 -> 54.230.30.189 TCP 66 42228 > http [ACK] Seq=96 Ack=72401 Win=152448 Len=0 TSval=32217047 TSecr=696602284
 26   0.031984 54.230.30.189 -> 172.31.36.109 TCP 2962 [TCP segment of a reassembled PDU]
 27   0.031990 172.31.36.109 -> 54.230.30.189 TCP 66 42228 > http [ACK] Seq=96 Ack=75297 Win=158336 Len=0 TSval=32217048 TSecr=696602284
 28   0.032071 54.230.30.189 -> 172.31.36.109 TCP 8754 [TCP segment of a reassembled PDU]
 29   0.032083 172.31.36.109 -> 54.230.30.189 TCP 66 42228 > http [ACK] Seq=96 Ack=83985 Win=175616 Len=0 TSval=32217048 TSecr=696602284
 30   0.032167 54.230.30.189 -> 172.31.36.109 TCP 11650 [TCP segment of a reassembled PDU]
 31   0.032176 172.31.36.109 -> 54.230.30.189 TCP 66 42228 > http [ACK] Seq=96 Ack=95569 Win=198784 Len=0 TSval=32217048 TSecr=696602284
 32   0.032264 54.230.30.189 -> 172.31.36.109 TCP 2962 [TCP segment of a reassembled PDU]
 33   0.032269 172.31.36.109 -> 54.230.30.189 TCP 66 42228 > http [ACK] Seq=96 Ack=98465 Win=204672 Len=0 TSval=32217048 TSecr=696602284
 34   0.033393 54.230.30.189 -> 172.31.36.109 TCP 2962 [TCP segment of a reassembled PDU]
 35   0.033399 172.31.36.109 -> 54.230.30.189 TCP 66 42228 > http [ACK] Seq=96 Ack=101361 Win=210432 Len=0 TSval=32217048 TSecr=696602284
 36   0.033528 54.230.30.189 -> 172.31.36.109 TCP 23234 [TCP segment of a reassembled PDU]
 37   0.033540 172.31.36.109 -> 54.230.30.189 TCP 66 42228 > http [ACK] Seq=96 Ack=124529 Win=256768 Len=0 TSval=32217048 TSecr=696602284
 38   0.033549 54.230.30.189 -> 172.31.36.109 TCP 4410 [TCP segment of a reassembled PDU]
 39   0.033553 172.31.36.109 -> 54.230.30.189 TCP 66 42228 > http [ACK] Seq=96 Ack=128873 Win=265472 Len=0 TSval=32217048 TSecr=696602284
 40   0.033585 54.230.30.189 -> 172.31.36.109 TCP 1514 [TCP segment of a reassembled PDU]
 41   0.033589 172.31.36.109 -> 54.230.30.189 TCP 66 42228 > http [ACK] Seq=96 Ack=130321 Win=268288 Len=0 TSval=32217048 TSecr=696602284
 42   0.034815 54.230.30.189 -> 172.31.36.109 TCP 295 [TCP segment of a reassembled PDU]
 43   0.034820 172.31.36.109 -> 54.230.30.189 TCP 66 42228 > http [ACK] Seq=96 Ack=130550 Win=268288 Len=0 TSval=32217048 TSecr=696602284
 44   0.037166 54.230.30.189 -> 172.31.36.109 TCP 2962 [TCP segment of a reassembled PDU]
 45   0.037171 172.31.36.109 -> 54.230.30.189 TCP 66 42228 > http [ACK] Seq=96 Ack=133446 Win=274176 Len=0 TSval=32217049 TSecr=696602284
 46   0.037183 54.230.30.189 -> 172.31.36.109 TCP 7306 [TCP segment of a reassembled PDU]
 47   0.037188 172.31.36.109 -> 54.230.30.189 TCP 66 42228 > http [ACK] Seq=96 Ack=140686 Win=288640 Len=0 TSval=32217049 TSecr=696602284
 48   0.037407 54.230.30.189 -> 172.31.36.109 TCP 2962 [TCP segment of a reassembled PDU]
 49   0.037412 172.31.36.109 -> 54.230.30.189 TCP 66 42228 > http [ACK] Seq=96 Ack=143582 Win=294400 Len=0 TSval=32217049 TSecr=696602284
 50   0.037473 54.230.30.189 -> 172.31.36.109 TCP 8754 [TCP segment of a reassembled PDU]
 51   0.037480 172.31.36.109 -> 54.230.30.189 TCP 66 42228 > http [ACK] Seq=96 Ack=152270 Win=311808 Len=0 TSval=32217049 TSecr=696602284
 52   0.037527 54.230.30.189 -> 172.31.36.109 TCP 11650 [TCP segment of a reassembled PDU]
 53   0.037535 172.31.36.109 -> 54.230.30.189 TCP 66 42228 > http [ACK] Seq=96 Ack=163854 Win=334976 Len=0 TSval=32217049 TSecr=696602284
 54   0.037623 54.230.30.189 -> 172.31.36.109 TCP 1514 [TCP segment of a reassembled PDU]
 55   0.037627 172.31.36.109 -> 54.230.30.189 TCP 66 42228 > http [ACK] Seq=96 Ack=165302 Win=337792 Len=0 TSval=32217049 TSecr=696602284
 56   0.038396 54.230.30.189 -> 172.31.36.109 TCP 4410 [TCP segment of a reassembled PDU]
 57   0.038415 172.31.36.109 -> 54.230.30.189 TCP 66 42228 > http [ACK] Seq=96 Ack=169646 Win=346496 Len=0 TSval=32217049 TSecr=696602284
 58   0.038483 54.230.30.189 -> 172.31.36.109 TCP 8754 [TCP segment of a reassembled PDU]
 59   0.038491 172.31.36.109 -> 54.230.30.189 TCP 66 42228 > http [ACK] Seq=96 Ack=178334 Win=363904 Len=0 TSval=32217049 TSecr=696602284
 60   0.038812 54.230.30.189 -> 172.31.36.109 TCP 20338 [TCP segment of a reassembled PDU]
 61   0.038824 172.31.36.109 -> 54.230.30.189 TCP 66 42228 > http [ACK] Seq=96 Ack=198606 Win=404480 Len=0 TSval=32217049 TSecr=696602284
 62   0.038918 54.230.30.189 -> 172.31.36.109 TCP 1514 [TCP segment of a reassembled PDU]
 63   0.038923 172.31.36.109 -> 54.230.30.189 TCP 66 42228 > http [ACK] Seq=96 Ack=200054 Win=407296 Len=0 TSval=32217049 TSecr=696602284
 64   0.039004 54.230.30.189 -> 172.31.36.109 TCP 8754 [TCP segment of a reassembled PDU]
 65   0.039010 172.31.36.109 -> 54.230.30.189 TCP 66 42228 > http [ACK] Seq=96 Ack=208742 Win=424704 Len=0 TSval=32217049 TSecr=696602284
 66   0.039682 54.230.30.189 -> 172.31.36.109 TCP 2962 [TCP segment of a reassembled PDU]
 67   0.039687 172.31.36.109 -> 54.230.30.189 TCP 66 42228 > http [ACK] Seq=96 Ack=211638 Win=430464 Len=0 TSval=32217049 TSecr=696602285
 68   0.039806 54.230.30.189 -> 172.31.36.109 TCP 11650 [TCP segment of a reassembled PDU]
 69   0.039814 172.31.36.109 -> 54.230.30.189 TCP 66 42228 > http [ACK] Seq=96 Ack=223222 Win=453632 Len=0 TSval=32217050 TSecr=696602285
 70   0.039977 54.230.30.189 -> 172.31.36.109 TCP 10202 [TCP segment of a reassembled PDU]
 71   0.039985 172.31.36.109 -> 54.230.30.189 TCP 66 42228 > http [ACK] Seq=96 Ack=233358 Win=473984 Len=0 TSval=32217050 TSecr=696602285
 72   0.040097 54.230.30.189 -> 172.31.36.109 TCP 10202 [TCP segment of a reassembled PDU]
 73   0.040105 172.31.36.109 -> 54.230.30.189 TCP 66 42228 > http [ACK] Seq=96 Ack=243494 Win=494208 Len=0 TSval=32217050 TSecr=696602285
 74   0.040154 54.230.30.189 -> 172.31.36.109 TCP 1514 [TCP segment of a reassembled PDU]
 75   0.040158 172.31.36.109 -> 54.230.30.189 TCP 66 42228 > http [ACK] Seq=96 Ack=244942 Win=497152 Len=0 TSval=32217050 TSecr=696602285
 76   0.040242 54.230.30.189 -> 172.31.36.109 TCP 1514 [TCP segment of a reassembled PDU]
 77   0.040247 172.31.36.109 -> 54.230.30.189 TCP 66 42228 > http [ACK] Seq=96 Ack=246390 Win=499968 Len=0 TSval=32217050 TSecr=696602285
 78   0.040964 54.230.30.189 -> 172.31.36.109 TCP 4410 [TCP segment of a reassembled PDU]
 79   0.040970 172.31.36.109 -> 54.230.30.189 TCP 66 42228 > http [ACK] Seq=96 Ack=250734 Win=508672 Len=0 TSval=32217050 TSecr=696602285
 80   0.041074 54.230.30.189 -> 172.31.36.109 TCP 13098 [TCP segment of a reassembled PDU]
 81   0.041083 172.31.36.109 -> 54.230.30.189 TCP 66 42228 > http [ACK] Seq=96 Ack=263766 Win=521088 Len=0 TSval=32217050 TSecr=696602285
 82   0.041247 54.230.30.189 -> 172.31.36.109 TCP 5858 [TCP segment of a reassembled PDU]
 83   0.041253 172.31.36.109 -> 54.230.30.189 TCP 66 42228 > http [ACK] Seq=96 Ack=269558 Win=515328 Len=0 TSval=32217050 TSecr=696602285
 84   0.041356 54.230.30.189 -> 172.31.36.109 TCP 15994 [TCP segment of a reassembled PDU]
 85   0.041380 172.31.36.109 -> 54.230.30.189 TCP 66 42228 > http [ACK] Seq=96 Ack=285486 Win=523392 Len=0 TSval=32217050 TSecr=696602285
 86   0.041545 54.230.30.189 -> 172.31.36.109 TCP 10202 [TCP segment of a reassembled PDU]
 87   0.041552 172.31.36.109 -> 54.230.30.189 TCP 66 42228 > http [ACK] Seq=96 Ack=295622 Win=532992 Len=0 TSval=32217050 TSecr=696602285
 88   0.042270 54.230.30.189 -> 172.31.36.109 TCP 2962 [TCP segment of a reassembled PDU]
 89   0.042277 172.31.36.109 -> 54.230.30.189 TCP 66 42228 > http [ACK] Seq=96 Ack=298518 Win=540544 Len=0 TSval=32217050 TSecr=696602285
 90   0.042423 54.230.30.189 -> 172.31.36.109 TCP 18890 [TCP segment of a reassembled PDU]
 91   0.042444 172.31.36.109 -> 54.230.30.189 TCP 66 42228 > http [ACK] Seq=96 Ack=317342 Win=521728 Len=0 TSval=32217050 TSecr=696602285
 92   0.042589 54.230.30.189 -> 172.31.36.109 TCP 18890 [TCP segment of a reassembled PDU]
 93   0.042610 172.31.36.109 -> 54.230.30.189 TCP 66 42228 > http [ACK] Seq=96 Ack=336166 Win=518656 Len=0 TSval=32217050 TSecr=696602285
 94   0.042676 54.230.30.189 -> 172.31.36.109 TCP 10202 [TCP segment of a reassembled PDU]
 95   0.042683 172.31.36.109 -> 54.230.30.189 TCP 66 42228 > http [ACK] Seq=96 Ack=346302 Win=532992 Len=0 TSval=32217050 TSecr=696602285
 96   0.042802 54.230.30.189 -> 172.31.36.109 TCP 11650 [TCP segment of a reassembled PDU]
 97   0.042821 172.31.36.109 -> 54.230.30.189 TCP 66 42228 > http [ACK] Seq=96 Ack=357886 Win=540544 Len=0 TSval=32217050 TSecr=696602285
 98   0.042878 54.230.30.189 -> 172.31.36.109 TCP 2962 [TCP segment of a reassembled PDU]
 99   0.042883 172.31.36.109 -> 54.230.30.189 TCP 66 42228 > http [ACK] Seq=96 Ack=360782 Win=544896 Len=0 TSval=32217050 TSecr=696602285
100   0.043516 54.230.30.189 -> 172.31.36.109 TCP 2962 [TCP segment of a reassembled PDU]
101   0.043520 172.31.36.109 -> 54.230.30.189 TCP 66 42228 > http [ACK] Seq=96 Ack=363678 Win=544896 Len=0 TSval=32217050 TSecr=696602285
102   0.043678 54.230.30.189 -> 172.31.36.109 TCP 23234 [TCP segment of a reassembled PDU]
103   0.043703 172.31.36.109 -> 54.230.30.189 TCP 66 42228 > http [ACK] Seq=96 Ack=386846 Win=546304 Len=0 TSval=32217051 TSecr=696602285
104   0.043996 54.230.30.189 -> 172.31.36.109 TCP 2962 [TCP segment of a reassembled PDU]
105   0.044002 172.31.36.109 -> 54.230.30.189 TCP 66 42228 > http [ACK] Seq=96 Ack=389742 Win=552192 Len=0 TSval=32217051 TSecr=696602285
106   0.044145 54.230.30.189 -> 172.31.36.109 TCP 18890 [TCP segment of a reassembled PDU]
107   0.044158 172.31.36.109 -> 54.230.30.189 TCP 66 42228 > http [ACK] Seq=96 Ack=408566 Win=589824 Len=0 TSval=32217051 TSecr=696602285
108   0.044166 54.230.30.189 -> 172.31.36.109 TCP 2962 [TCP segment of a reassembled PDU]
109   0.044169 172.31.36.109 -> 54.230.30.189 TCP 66 42228 > http [ACK] Seq=96 Ack=411462 Win=595584 Len=0 TSval=32217051 TSecr=696602285
110   0.044176 54.230.30.189 -> 172.31.36.109 TCP 1514 [TCP segment of a reassembled PDU]
111   0.044178 172.31.36.109 -> 54.230.30.189 TCP 66 42228 > http [ACK] Seq=96 Ack=412910 Win=598528 Len=0 TSval=32217051 TSecr=696602285
112   0.044366 54.230.30.189 -> 172.31.36.109 TCP 13098 [TCP segment of a reassembled PDU]
113   0.044375 172.31.36.109 -> 54.230.30.189 TCP 66 42228 > http [ACK] Seq=96 Ack=425942 Win=624512 Len=0 TSval=32217051 TSecr=696602285
114   0.044801 54.230.30.189 -> 172.31.36.109 TCP 2962 [TCP segment of a reassembled PDU]
115   0.044806 172.31.36.109 -> 54.230.30.189 TCP 66 42228 > http [ACK] Seq=96 Ack=428838 Win=630400 Len=0 TSval=32217051 TSecr=696602285
116   0.044962 54.230.30.189 -> 172.31.36.109 TCP 17442 [TCP segment of a reassembled PDU]
117   0.044971 172.31.36.109 -> 54.230.30.189 TCP 66 42228 > http [ACK] Seq=96 Ack=446214 Win=665088 Len=0 TSval=32217051 TSecr=696602285
118   0.045078 54.230.30.189 -> 172.31.36.109 TCP 8754 [TCP segment of a reassembled PDU]
119   0.045085 172.31.36.109 -> 54.230.30.189 TCP 66 42228 > http [ACK] Seq=96 Ack=454902 Win=682496 Len=0 TSval=32217051 TSecr=696602285
120   0.045195 54.230.30.189 -> 172.31.36.109 TCP 10202 [TCP segment of a reassembled PDU]
121   0.045202 172.31.36.109 -> 54.230.30.189 TCP 66 42228 > http [ACK] Seq=96 Ack=465038 Win=702720 Len=0 TSval=32217051 TSecr=696602285
122   0.045462 54.230.30.189 -> 172.31.36.109 TCP 21786 [TCP segment of a reassembled PDU]
123   0.045474 172.31.36.109 -> 54.230.30.189 TCP 66 42228 > http [ACK] Seq=96 Ack=486758 Win=746240 Len=0 TSval=32217051 TSecr=696602285
124   0.045569 54.230.30.189 -> 172.31.36.109 TCP 4410 [TCP segment of a reassembled PDU]
125   0.045575 172.31.36.109 -> 54.230.30.189 TCP 66 42228 > http [ACK] Seq=96 Ack=491102 Win=754816 Len=0 TSval=32217051 TSecr=696602285
126   0.046073 54.230.30.189 -> 172.31.36.109 TCP 4410 [TCP segment of a reassembled PDU]
127   0.046079 172.31.36.109 -> 54.230.30.189 TCP 66 42228 > http [ACK] Seq=96 Ack=495446 Win=763520 Len=0 TSval=32217051 TSecr=696602285
128   0.046261 54.230.30.189 -> 172.31.36.109 TCP 21786 [TCP segment of a reassembled PDU]
129   0.046273 172.31.36.109 -> 54.230.30.189 TCP 66 42228 > http [ACK] Seq=96 Ack=517166 Win=807040 Len=0 TSval=32217051 TSecr=696602285
130   0.046303 54.230.30.189 -> 172.31.36.109 TCP 4410 [TCP segment of a reassembled PDU]
131   0.046307 172.31.36.109 -> 54.230.30.189 TCP 66 42228 > http [ACK] Seq=96 Ack=521510 Win=815744 Len=0 TSval=32217051 TSecr=696602285
132   0.046320 54.230.30.189 -> 172.31.36.109 TCP 1514 [TCP segment of a reassembled PDU]
133   0.046323 172.31.36.109 -> 54.230.30.189 TCP 66 42228 > http [ACK] Seq=96 Ack=522958 Win=818560 Len=0 TSval=32217051 TSecr=696602285
134   0.046517 54.230.30.189 -> 172.31.36.109 TCP 24682 [TCP segment of a reassembled PDU]
135   0.046530 172.31.36.109 -> 54.230.30.189 TCP 66 42228 > http [ACK] Seq=96 Ack=547574 Win=867840 Len=0 TSval=32217051 TSecr=696602285
136   0.046575 54.230.30.189 -> 172.31.36.109 TCP 7306 [TCP segment of a reassembled PDU]
137   0.046584 172.31.36.109 -> 54.230.30.189 TCP 66 42228 > http [ACK] Seq=96 Ack=554814 Win=882304 Len=0 TSval=32217051 TSecr=696602285
138   0.046667 54.230.30.189 -> 172.31.36.109 TCP 1514 [TCP segment of a reassembled PDU]
139   0.046671 172.31.36.109 -> 54.230.30.189 TCP 66 42228 > http [ACK] Seq=96 Ack=556262 Win=885248 Len=0 TSval=32217051 TSecr=696602285
140   0.047377 54.230.30.189 -> 172.31.36.109 TCP 4410 [TCP segment of a reassembled PDU]
141   0.047384 172.31.36.109 -> 54.230.30.189 TCP 66 42228 > http [ACK] Seq=96 Ack=560606 Win=893824 Len=0 TSval=32217051 TSecr=696602285
142   0.047566 54.230.30.189 -> 172.31.36.109 TCP 18890 [TCP segment of a reassembled PDU]
143   0.047577 172.31.36.109 -> 54.230.30.189 TCP 66 42228 > http [ACK] Seq=96 Ack=579430 Win=931584 Len=0 TSval=32217051 TSecr=696602285
144   0.047601 54.230.30.189 -> 172.31.36.109 TCP 7306 [TCP segment of a reassembled PDU]
145   0.047617 172.31.36.109 -> 54.230.30.189 TCP 66 42228 > http [ACK] Seq=96 Ack=586670 Win=931584 Len=0 TSval=32217051 TSecr=696602285
146   0.047638 54.230.30.189 -> 172.31.36.109 TCP 2962 [TCP segment of a reassembled PDU]
147   0.047655 172.31.36.109 -> 54.230.30.189 TCP 66 42228 > http [ACK] Seq=96 Ack=589566 Win=937344 Len=0 TSval=32217051 TSecr=696602285
148   0.047860 54.230.30.189 -> 172.31.36.109 TCP 31922 [TCP segment of a reassembled PDU]
149   0.047889 172.31.36.109 -> 54.230.30.189 TCP 66 42228 > http [ACK] Seq=96 Ack=621422 Win=911744 Len=0 TSval=32217052 TSecr=696602285
150   0.047981 54.230.30.189 -> 172.31.36.109 TCP 20338 [TCP segment of a reassembled PDU]
151   0.047991 172.31.36.109 -> 54.230.30.189 TCP 66 42228 > http [ACK] Seq=96 Ack=641694 Win=930816 Len=0 TSval=32217052 TSecr=696602285
152   0.048093 54.230.30.189 -> 172.31.36.109 TCP 7306 [TCP segment of a reassembled PDU]
153   0.048152 172.31.36.109 -> 54.230.30.189 TCP 66 42228 > http [ACK] Seq=96 Ack=648934 Win=923648 Len=0 TSval=32217052 TSecr=696602285
154   0.048209 54.230.30.189 -> 172.31.36.109 TCP 8754 [TCP segment of a reassembled PDU]
155   0.048216 172.31.36.109 -> 54.230.30.189 TCP 66 42228 > http [ACK] Seq=96 Ack=657622 Win=949888 Len=0 TSval=32217052 TSecr=696602285
156   0.048882 54.230.30.189 -> 172.31.36.109 TCP 1514 [TCP segment of a reassembled PDU]
157   0.048886 172.31.36.109 -> 54.230.30.189 TCP 66 42228 > http [ACK] Seq=96 Ack=659070 Win=957568 Len=0 TSval=32217052 TSecr=696602286
158   0.049096 54.230.30.189 -> 172.31.36.109 TCP 27578 [TCP segment of a reassembled PDU]
159   0.049121 172.31.36.109 -> 54.230.30.189 TCP 66 42228 > http [ACK] Seq=96 Ack=686582 Win=930176 Len=0 TSval=32217052 TSecr=696602286
160   0.049211 54.230.30.189 -> 172.31.36.109 TCP 11650 [TCP segment of a reassembled PDU]
161   0.049219 172.31.36.109 -> 54.230.30.189 TCP 66 42228 > http [ACK] Seq=96 Ack=698166 Win=945152 Len=0 TSval=32217052 TSecr=696602286
162   0.049311 54.230.30.189 -> 172.31.36.109 TCP 7306 [TCP segment of a reassembled PDU]
163   0.049317 172.31.36.109 -> 54.230.30.189 TCP 66 42228 > http [ACK] Seq=96 Ack=705406 Win=952192 Len=0 TSval=32217052 TSecr=696602286
164   0.049418 54.230.30.189 -> 172.31.36.109 TCP 5858 [TCP segment of a reassembled PDU]
165   0.049424 172.31.36.109 -> 54.230.30.189 TCP 66 42228 > http [ACK] Seq=96 Ack=711198 Win=954624 Len=0 TSval=32217052 TSecr=696602286
166   0.049544 54.230.30.189 -> 172.31.36.109 TCP 20338 [TCP segment of a reassembled PDU]
167   0.049565 172.31.36.109 -> 54.230.30.189 TCP 66 42228 > http [ACK] Seq=96 Ack=731470 Win=934400 Len=0 TSval=32217052 TSecr=696602286
168   0.049600 54.230.30.189 -> 172.31.36.109 TCP 2962 [TCP segment of a reassembled PDU]
169   0.049605 172.31.36.109 -> 54.230.30.189 TCP 66 42228 > http [ACK] Seq=96 Ack=734366 Win=959360 Len=0 TSval=32217052 TSecr=696602286
170   0.049769 54.230.30.189 -> 172.31.36.109 TCP 17442 [TCP segment of a reassembled PDU]
171   0.049797 172.31.36.109 -> 54.230.30.189 TCP 66 42228 > http [ACK] Seq=96 Ack=751742 Win=942080 Len=0 TSval=32217052 TSecr=696602286
172   0.050422 54.230.30.189 -> 172.31.36.109 TCP 2962 [TCP segment of a reassembled PDU]
173   0.050427 172.31.36.109 -> 54.230.30.189 TCP 66 42228 > http [ACK] Seq=96 Ack=754638 Win=959360 Len=0 TSval=32217052 TSecr=696602286
174   0.050575 54.230.30.189 -> 172.31.36.109 TCP 21786 [TCP segment of a reassembled PDU]
175   0.050597 172.31.36.109 -> 54.230.30.189 TCP 66 42228 > http [ACK] Seq=96 Ack=776358 Win=937728 Len=0 TSval=32217052 TSecr=696602286
176   0.050876 54.230.30.189 -> 172.31.36.109 TCP 30474 [TCP segment of a reassembled PDU]
177   0.050902 172.31.36.109 -> 54.230.30.189 TCP 66 42228 > http [ACK] Seq=96 Ack=806766 Win=914048 Len=0 TSval=32217052 TSecr=696602286
178   0.051124 54.230.30.189 -> 172.31.36.109 TCP 31922 [TCP segment of a reassembled PDU]
179   0.051152 172.31.36.109 -> 54.230.30.189 TCP 66 42228 > http [ACK] Seq=96 Ack=838622 Win=911744 Len=0 TSval=32217052 TSecr=696602286
180   0.051298 54.230.30.189 -> 172.31.36.109 TCP 20338 [TCP segment of a reassembled PDU]
181   0.051309 172.31.36.109 -> 54.230.30.189 TCP 66 42228 > http [ACK] Seq=96 Ack=858894 Win=930816 Len=0 TSval=32217052 TSecr=696602286
182   0.051456 54.230.30.189 -> 172.31.36.109 TCP 1514 [TCP segment of a reassembled PDU]
183   0.051667 54.230.30.189 -> 172.31.36.109 TCP 2962 [TCP segment of a reassembled PDU]
184   0.051672 172.31.36.109 -> 54.230.30.189 TCP 66 42228 > http [ACK] Seq=96 Ack=863238 Win=959360 Len=0 TSval=32217052 TSecr=696602286
185   0.051790 54.230.30.189 -> 172.31.36.109 TCP 13098 [TCP segment of a reassembled PDU]
186   0.051811 172.31.36.109 -> 54.230.30.189 TCP 66 42228 > http [ACK] Seq=96 Ack=876270 Win=960128 Len=0 TSval=32217053 TSecr=696602286
187   0.051993 54.230.30.189 -> 172.31.36.109 TCP 5858 [TCP segment of a reassembled PDU]
188   0.052022 172.31.36.109 -> 54.230.30.189 TCP 66 42228 > http [ACK] Seq=96 Ack=882062 Win=960128 Len=0 TSval=32217053 TSecr=696602286
189   0.052208 54.230.30.189 -> 172.31.36.109 TCP 2962 [TCP segment of a reassembled PDU]
190   0.052223 172.31.36.109 -> 54.230.30.189 TCP 66 42228 > http [ACK] Seq=96 Ack=884958 Win=960128 Len=0 TSval=32217053 TSecr=696602286
191   0.052374 54.230.30.189 -> 172.31.36.109 TCP 23234 [TCP segment of a reassembled PDU]
192   0.052409 172.31.36.109 -> 54.230.30.189 TCP 66 42228 > http [ACK] Seq=96 Ack=908126 Win=936960 Len=0 TSval=32217053 TSecr=696602286
193   0.052610 54.230.30.189 -> 172.31.36.109 TCP 26130 [TCP segment of a reassembled PDU]
194   0.052634 172.31.36.109 -> 54.230.30.189 TCP 66 42228 > http [ACK] Seq=96 Ack=934190 Win=921344 Len=0 TSval=32217053 TSecr=696602286
195   0.052675 54.230.30.189 -> 172.31.36.109 TCP 5858 [TCP segment of a reassembled PDU]
196   0.052681 172.31.36.109 -> 54.230.30.189 TCP 66 42228 > http [ACK] Seq=96 Ack=939982 Win=954624 Len=0 TSval=32217053 TSecr=696602286
197   0.052829 54.230.30.189 -> 172.31.36.109 TCP 20338 [TCP segment of a reassembled PDU]
198   0.052863 172.31.36.109 -> 54.230.30.189 TCP 66 42228 > http [ACK] Seq=96 Ack=960254 Win=934400 Len=0 TSval=32217053 TSecr=696602286
199   0.052937 54.230.30.189 -> 172.31.36.109 TCP 13098 [TCP segment of a reassembled PDU]
200   0.052945 172.31.36.109 -> 54.230.30.189 TCP 66 42228 > http [ACK] Seq=96 Ack=973286 Win=942720 Len=0 TSval=32217053 TSecr=696602286
201   0.053040 54.230.30.189 -> 172.31.36.109 TCP 9298 [TCP segment of a reassembled PDU]
202   0.053047 172.31.36.109 -> 54.230.30.189 TCP 66 42228 > http [ACK] Seq=96 Ack=982518 Win=947456 Len=0 TSval=32217053 TSecr=696602286
203   0.053789 54.230.30.189 -> 172.31.36.109 TCP 4410 [TCP segment of a reassembled PDU]
204   0.053795 172.31.36.109 -> 54.230.30.189 TCP 66 42228 > http [ACK] Seq=96 Ack=986862 Win=956928 Len=0 TSval=32217053 TSecr=696602286
205   0.053899 54.230.30.189 -> 172.31.36.109 TCP 8754 [TCP segment of a reassembled PDU]
206   0.053917 172.31.36.109 -> 54.230.30.189 TCP 66 42228 > http [ACK] Seq=96 Ack=995550 Win=960128 Len=0 TSval=32217053 TSecr=696602286
207   0.054187 54.230.30.189 -> 172.31.36.109 TCP 20338 [TCP segment of a reassembled PDU]
208   0.054208 172.31.36.109 -> 54.230.30.189 TCP 66 42228 > http [ACK] Seq=96 Ack=1015822 Win=939904 Len=0 TSval=32217053 TSecr=696602286
209   0.054320 54.230.30.189 -> 172.31.36.109 TCP 26130 [TCP segment of a reassembled PDU]
210   0.054343 172.31.36.109 -> 54.230.30.189 TCP 66 42228 > http [ACK] Seq=96 Ack=1041886 Win=921344 Len=0 TSval=32217053 TSecr=696602286
211   0.054407 54.230.30.189 -> 172.31.36.109 TCP 6234 [TCP segment of a reassembled PDU]
212   0.054413 172.31.36.109 -> 54.230.30.189 TCP 66 42228 > http [ACK] Seq=96 Ack=1048054 Win=952192 Len=0 TSval=32217053 TSecr=696602286
213   0.054417 54.230.30.189 -> 172.31.36.109 HTTP 1046 HTTP/1.1 200 OK  (application/octet-stream)
214   0.054430 172.31.36.109 -> 54.230.30.189 TCP 66 42228 > http [ACK] Seq=96 Ack=1049034 Win=960128 Len=0 TSval=32217053 TSecr=696602286
215   0.054550 172.31.36.109 -> 54.230.30.189 TCP 66 42228 > http [FIN, ACK] Seq=96 Ack=1049034 Win=960128 Len=0 TSval=32217053 TSecr=696602286
216   0.055865 54.230.30.189 -> 172.31.36.109 TCP 66 http > 42228 [FIN, ACK] Seq=1049034 Ack=97 Win=14592 Len=0 TSval=696602286 TSecr=32217053
217   0.055873 172.31.36.109 -> 54.230.30.189 TCP 66 42228 > http [ACK] Seq=97 Ack=1049035 Win=960128 Len=0 TSval=32217054 TSecr=696602286
