[Measurement for 1mb at 07:33:39 20.33.2014] 
Tshark:

  1   0.000000 172.31.36.109 -> 172.31.0.2   DNS 88 Standard query 0x0696  A dm53kc3eax57k.cloudfront.net
  2   0.000023 172.31.36.109 -> 172.31.0.2   DNS 88 Standard query 0x5011  AAAA dm53kc3eax57k.cloudfront.net
  3   0.000547   172.31.0.2 -> 172.31.36.109 DNS 216 Standard query response 0x0696  A 54.230.30.58 A 54.230.30.207 A 54.230.30.221 A 54.230.30.245 A 54.230.31.7 A 54.192.30.184 A 54.230.30.19 A 54.230.30.52
  4   0.000556   172.31.0.2 -> 172.31.36.109 DNS 175 Standard query response 0x5011 
  5   0.003916 172.31.36.109 -> 54.230.30.58 TCP 74 34162 > http [SYN] Seq=0 Win=26883 Len=0 MSS=8961 SACK_PERM=1 TSval=33126406 TSecr=0 WS=128
  6   0.005319 54.230.30.58 -> 172.31.36.109 TCP 74 http > 34162 [SYN, ACK] Seq=0 Ack=1 Win=14480 Len=0 MSS=1460 SACK_PERM=1 TSval=636420443 TSecr=33126406 WS=128
  7   0.005333 172.31.36.109 -> 54.230.30.58 TCP 66 34162 > http [ACK] Seq=1 Ack=1 Win=27008 Len=0 TSval=33126407 TSecr=636420443
  8   0.005374 172.31.36.109 -> 54.230.30.58 HTTP 161 GET /1mb HTTP/1.1 
  9   0.006785 54.230.30.58 -> 172.31.36.109 TCP 66 http > 34162 [ACK] Seq=1 Ack=96 Win=14592 Len=0 TSval=636420443 TSecr=33126407
 10   0.044314 54.230.30.58 -> 172.31.36.109 TCP 13098 [TCP segment of a reassembled PDU]
 11   0.044328 172.31.36.109 -> 54.230.30.58 TCP 66 34162 > http [ACK] Seq=96 Ack=13033 Win=52992 Len=0 TSval=33126416 TSecr=636420447
 12   0.044431 54.230.30.58 -> 172.31.36.109 TCP 1514 [TCP segment of a reassembled PDU]
 13   0.044437 172.31.36.109 -> 54.230.30.58 TCP 66 34162 > http [ACK] Seq=96 Ack=14481 Win=55936 Len=0 TSval=33126416 TSecr=636420447
 14   0.045456 54.230.30.58 -> 172.31.36.109 TCP 2962 [TCP segment of a reassembled PDU]
 15   0.045463 172.31.36.109 -> 54.230.30.58 TCP 66 34162 > http [ACK] Seq=96 Ack=17377 Win=61696 Len=0 TSval=33126417 TSecr=636420447
 16   0.045503 54.230.30.58 -> 172.31.36.109 TCP 1514 [TCP segment of a reassembled PDU]
 17   0.045508 172.31.36.109 -> 54.230.30.58 TCP 66 34162 > http [ACK] Seq=96 Ack=18825 Win=64640 Len=0 TSval=33126417 TSecr=636420447
 18   0.045785 54.230.30.58 -> 172.31.36.109 TCP 10202 [TCP segment of a reassembled PDU]
 19   0.045794 172.31.36.109 -> 54.230.30.58 TCP 66 34162 > http [ACK] Seq=96 Ack=28961 Win=84864 Len=0 TSval=33126417 TSecr=636420447
 20   0.046753 54.230.30.58 -> 172.31.36.109 TCP 1514 [TCP segment of a reassembled PDU]
 21   0.046767 172.31.36.109 -> 54.230.30.58 TCP 66 34162 > http [ACK] Seq=96 Ack=30409 Win=87808 Len=0 TSval=33126417 TSecr=636420447
 22   0.046819 54.230.30.58 -> 172.31.36.109 TCP 1514 [TCP segment of a reassembled PDU]
 23   0.046824 172.31.36.109 -> 54.230.30.58 TCP 66 34162 > http [ACK] Seq=96 Ack=31857 Win=90624 Len=0 TSval=33126417 TSecr=636420447
 24   0.047012 54.230.30.58 -> 172.31.36.109 TCP 4410 [TCP segment of a reassembled PDU]
 25   0.047017 172.31.36.109 -> 54.230.30.58 TCP 66 34162 > http [ACK] Seq=96 Ack=36201 Win=99328 Len=0 TSval=33126417 TSecr=636420447
 26   0.047085 54.230.30.58 -> 172.31.36.109 TCP 11650 [TCP segment of a reassembled PDU]
 27   0.047094 172.31.36.109 -> 54.230.30.58 TCP 66 34162 > http [ACK] Seq=96 Ack=47785 Win=98944 Len=0 TSval=33126417 TSecr=636420447
 28   0.047315 54.230.30.58 -> 172.31.36.109 TCP 2962 [TCP segment of a reassembled PDU]
 29   0.047321 172.31.36.109 -> 54.230.30.58 TCP 66 34162 > http [ACK] Seq=96 Ack=50681 Win=105088 Len=0 TSval=33126417 TSecr=636420447
 30   0.048314 54.230.30.58 -> 172.31.36.109 TCP 4410 [TCP segment of a reassembled PDU]
 31   0.048319 172.31.36.109 -> 54.230.30.58 TCP 66 34162 > http [ACK] Seq=96 Ack=55025 Win=113792 Len=0 TSval=33126417 TSecr=636420447
 32   0.048658 54.230.30.58 -> 172.31.36.109 TCP 20338 [TCP segment of a reassembled PDU]
 33   0.048670 172.31.36.109 -> 54.230.30.58 TCP 66 34162 > http [ACK] Seq=96 Ack=75297 Win=154368 Len=0 TSval=33126417 TSecr=636420447
 34   0.049874 54.230.30.58 -> 172.31.36.109 TCP 10202 [TCP segment of a reassembled PDU]
 35   0.049882 172.31.36.109 -> 54.230.30.58 TCP 66 34162 > http [ACK] Seq=96 Ack=85433 Win=174592 Len=0 TSval=33126418 TSecr=636420447
 36   0.050128 54.230.30.58 -> 172.31.36.109 TCP 11650 [TCP segment of a reassembled PDU]
 37   0.050145 172.31.36.109 -> 54.230.30.58 TCP 66 34162 > http [ACK] Seq=96 Ack=97017 Win=197760 Len=0 TSval=33126418 TSecr=636420447
 38   0.051139 54.230.30.58 -> 172.31.36.109 TCP 4410 [TCP segment of a reassembled PDU]
 39   0.051152 172.31.36.109 -> 54.230.30.58 TCP 66 34162 > http [ACK] Seq=96 Ack=101361 Win=206464 Len=0 TSval=33126418 TSecr=636420448
 40   0.051174 54.230.30.58 -> 172.31.36.109 TCP 2962 [TCP segment of a reassembled PDU]
 41   0.051178 172.31.36.109 -> 54.230.30.58 TCP 66 34162 > http [ACK] Seq=96 Ack=104257 Win=212352 Len=0 TSval=33126418 TSecr=636420448
 42   0.051180 54.230.30.58 -> 172.31.36.109 TCP 1514 [TCP segment of a reassembled PDU]
 43   0.051182 172.31.36.109 -> 54.230.30.58 TCP 66 34162 > http [ACK] Seq=96 Ack=105705 Win=215168 Len=0 TSval=33126418 TSecr=636420448
 44   0.051390 54.230.30.58 -> 172.31.36.109 TCP 8754 [TCP segment of a reassembled PDU]
 45   0.051398 172.31.36.109 -> 54.230.30.58 TCP 66 34162 > http [ACK] Seq=96 Ack=114393 Win=232576 Len=0 TSval=33126418 TSecr=636420448
 46   0.051475 54.230.30.58 -> 172.31.36.109 TCP 16504 [TCP segment of a reassembled PDU]
 47   0.051486 172.31.36.109 -> 54.230.30.58 TCP 66 34162 > http [ACK] Seq=96 Ack=130831 Win=265472 Len=0 TSval=33126418 TSecr=636420448
 48   0.052411 54.230.30.58 -> 172.31.36.109 TCP 1514 [TCP segment of a reassembled PDU]
 49   0.052436 172.31.36.109 -> 54.230.30.58 TCP 66 34162 > http [ACK] Seq=96 Ack=132279 Win=268288 Len=0 TSval=33126418 TSecr=636420448
 50   0.052749 54.230.30.58 -> 172.31.36.109 TCP 8754 [TCP segment of a reassembled PDU]
 51   0.052760 172.31.36.109 -> 54.230.30.58 TCP 66 34162 > http [ACK] Seq=96 Ack=140967 Win=285696 Len=0 TSval=33126418 TSecr=636420448
 52   0.053056 54.230.30.58 -> 172.31.36.109 TCP 18890 [TCP segment of a reassembled PDU]
 53   0.053065 172.31.36.109 -> 54.230.30.58 TCP 66 34162 > http [ACK] Seq=96 Ack=159791 Win=284416 Len=0 TSval=33126419 TSecr=636420448
 54   0.053675 54.230.30.58 -> 172.31.36.109 TCP 2962 [TCP segment of a reassembled PDU]
 55   0.053680 172.31.36.109 -> 54.230.30.58 TCP 66 34162 > http [ACK] Seq=96 Ack=162687 Win=291456 Len=0 TSval=33126419 TSecr=636420448
 56   0.053925 54.230.30.58 -> 172.31.36.109 TCP 7306 [TCP segment of a reassembled PDU]
 57   0.053940 172.31.36.109 -> 54.230.30.58 TCP 66 34162 > http [ACK] Seq=96 Ack=169927 Win=305920 Len=0 TSval=33126419 TSecr=636420448
 58   0.054027 54.230.30.58 -> 172.31.36.109 TCP 5858 [TCP segment of a reassembled PDU]
 59   0.054033 172.31.36.109 -> 54.230.30.58 TCP 66 34162 > http [ACK] Seq=96 Ack=175719 Win=317568 Len=0 TSval=33126419 TSecr=636420448
 60   0.054469 54.230.30.58 -> 172.31.36.109 TCP 7306 [TCP segment of a reassembled PDU]
 61   0.054476 172.31.36.109 -> 54.230.30.58 TCP 66 34162 > http [ACK] Seq=96 Ack=182959 Win=332032 Len=0 TSval=33126419 TSecr=636420448
 62   0.054873 54.230.30.58 -> 172.31.36.109 TCP 23234 [TCP segment of a reassembled PDU]
 63   0.054886 172.31.36.109 -> 54.230.30.58 TCP 66 34162 > http [ACK] Seq=96 Ack=206127 Win=378368 Len=0 TSval=33126419 TSecr=636420448
 64   0.055245 54.230.30.58 -> 172.31.36.109 TCP 4410 [TCP segment of a reassembled PDU]
 65   0.055270 172.31.36.109 -> 54.230.30.58 TCP 66 34162 > http [ACK] Seq=96 Ack=210471 Win=387072 Len=0 TSval=33126419 TSecr=636420448
 66   0.055386 54.230.30.58 -> 172.31.36.109 TCP 10202 [TCP segment of a reassembled PDU]
 67   0.055414 172.31.36.109 -> 54.230.30.58 TCP 66 34162 > http [ACK] Seq=96 Ack=220607 Win=407296 Len=0 TSval=33126419 TSecr=636420448
 68   0.055520 54.230.30.58 -> 172.31.36.109 TCP 5858 [TCP segment of a reassembled PDU]
 69   0.055549 172.31.36.109 -> 54.230.30.58 TCP 66 34162 > http [ACK] Seq=96 Ack=226399 Win=418944 Len=0 TSval=33126419 TSecr=636420448
 70   0.056269 54.230.30.58 -> 172.31.36.109 TCP 5858 [TCP segment of a reassembled PDU]
 71   0.056300 172.31.36.109 -> 54.230.30.58 TCP 66 34162 > http [ACK] Seq=96 Ack=232191 Win=430464 Len=0 TSval=33126419 TSecr=636420448
 72   0.056391 54.230.30.58 -> 172.31.36.109 TCP 2962 [TCP segment of a reassembled PDU]
 73   0.056403 172.31.36.109 -> 54.230.30.58 TCP 66 34162 > http [ACK] Seq=96 Ack=235087 Win=436352 Len=0 TSval=33126419 TSecr=636420448
 74   0.056541 54.230.30.58 -> 172.31.36.109 TCP 13098 [TCP segment of a reassembled PDU]
 75   0.056550 172.31.36.109 -> 54.230.30.58 TCP 66 34162 > http [ACK] Seq=96 Ack=248119 Win=462336 Len=0 TSval=33126419 TSecr=636420448
 76   0.056603 54.230.30.58 -> 172.31.36.109 TCP 11650 [TCP segment of a reassembled PDU]
 77   0.056611 172.31.36.109 -> 54.230.30.58 TCP 66 34162 > http [ACK] Seq=96 Ack=259703 Win=485504 Len=0 TSval=33126419 TSecr=636420448
 78   0.056833 54.230.30.58 -> 172.31.36.109 TCP 7306 [TCP segment of a reassembled PDU]
 79   0.056840 172.31.36.109 -> 54.230.30.58 TCP 66 34162 > http [ACK] Seq=96 Ack=266943 Win=499968 Len=0 TSval=33126419 TSecr=636420448
 80   0.057208 54.230.30.58 -> 172.31.36.109 TCP 17442 [TCP segment of a reassembled PDU]
 81   0.057218 172.31.36.109 -> 54.230.30.58 TCP 66 34162 > http [ACK] Seq=96 Ack=284319 Win=534784 Len=0 TSval=33126420 TSecr=636420448
 82   0.057798 54.230.30.58 -> 172.31.36.109 TCP 2962 [TCP segment of a reassembled PDU]
 83   0.057810 172.31.36.109 -> 54.230.30.58 TCP 66 34162 > http [ACK] Seq=96 Ack=287215 Win=540544 Len=0 TSval=33126420 TSecr=636420448
 84   0.057965 54.230.30.58 -> 172.31.36.109 TCP 4410 [TCP segment of a reassembled PDU]
 85   0.057978 172.31.36.109 -> 54.230.30.58 TCP 66 34162 > http [ACK] Seq=96 Ack=291559 Win=549248 Len=0 TSval=33126420 TSecr=636420448
 86   0.058002 54.230.30.58 -> 172.31.36.109 TCP 10202 [TCP segment of a reassembled PDU]
 87   0.058010 172.31.36.109 -> 54.230.30.58 TCP 66 34162 > http [ACK] Seq=96 Ack=301695 Win=569472 Len=0 TSval=33126420 TSecr=636420448
 88   0.058018 54.230.30.58 -> 172.31.36.109 TCP 7306 [TCP segment of a reassembled PDU]
 89   0.058023 172.31.36.109 -> 54.230.30.58 TCP 66 34162 > http [ACK] Seq=96 Ack=308935 Win=583936 Len=0 TSval=33126420 TSecr=636420448
 90   0.058247 54.230.30.58 -> 172.31.36.109 TCP 14546 [TCP segment of a reassembled PDU]
 91   0.058256 172.31.36.109 -> 54.230.30.58 TCP 66 34162 > http [ACK] Seq=96 Ack=323415 Win=612992 Len=0 TSval=33126420 TSecr=636420448
 92   0.058552 54.230.30.58 -> 172.31.36.109 TCP 4410 [TCP segment of a reassembled PDU]
 93   0.058557 172.31.36.109 -> 54.230.30.58 TCP 66 34162 > http [ACK] Seq=96 Ack=327759 Win=621696 Len=0 TSval=33126420 TSecr=636420448
 94   0.058851 54.230.30.58 -> 172.31.36.109 TCP 8754 [TCP segment of a reassembled PDU]
 95   0.058858 172.31.36.109 -> 54.230.30.58 TCP 66 34162 > http [ACK] Seq=96 Ack=336447 Win=638976 Len=0 TSval=33126420 TSecr=636420448
 96   0.058933 54.230.30.58 -> 172.31.36.109 TCP 14546 [TCP segment of a reassembled PDU]
 97   0.058942 172.31.36.109 -> 54.230.30.58 TCP 66 34162 > http [ACK] Seq=96 Ack=350927 Win=668032 Len=0 TSval=33126420 TSecr=636420448
 98   0.059281 54.230.30.58 -> 172.31.36.109 TCP 5858 [TCP segment of a reassembled PDU]
 99   0.059287 172.31.36.109 -> 54.230.30.58 TCP 66 34162 > http [ACK] Seq=96 Ack=356719 Win=679552 Len=0 TSval=33126420 TSecr=636420448
100   0.059399 54.230.30.58 -> 172.31.36.109 TCP 2962 [TCP segment of a reassembled PDU]
101   0.059404 172.31.36.109 -> 54.230.30.58 TCP 66 34162 > http [ACK] Seq=96 Ack=359615 Win=685312 Len=0 TSval=33126420 TSecr=636420448
102   0.059689 54.230.30.58 -> 172.31.36.109 TCP 21786 [TCP segment of a reassembled PDU]
103   0.059700 172.31.36.109 -> 54.230.30.58 TCP 66 34162 > http [ACK] Seq=96 Ack=381335 Win=728832 Len=0 TSval=33126420 TSecr=636420448
104   0.060051 54.230.30.58 -> 172.31.36.109 TCP 1514 [TCP segment of a reassembled PDU]
105   0.060057 172.31.36.109 -> 54.230.30.58 TCP 66 34162 > http [ACK] Seq=96 Ack=382783 Win=731648 Len=0 TSval=33126420 TSecr=636420448
106   0.060305 54.230.30.58 -> 172.31.36.109 TCP 5858 [TCP segment of a reassembled PDU]
107   0.060311 172.31.36.109 -> 54.230.30.58 TCP 66 34162 > http [ACK] Seq=96 Ack=388575 Win=743296 Len=0 TSval=33126420 TSecr=636420448
108   0.060410 54.230.30.58 -> 172.31.36.109 TCP 4466 [TCP segment of a reassembled PDU]
109   0.060416 172.31.36.109 -> 54.230.30.58 TCP 66 34162 > http [ACK] Seq=96 Ack=392975 Win=752128 Len=0 TSval=33126420 TSecr=636420448
110   0.061837 54.230.30.58 -> 172.31.36.109 TCP 4410 [TCP segment of a reassembled PDU]
111   0.061855 172.31.36.109 -> 54.230.30.58 TCP 66 34162 > http [ACK] Seq=96 Ack=397319 Win=760704 Len=0 TSval=33126421 TSecr=636420449
112   0.061993 54.230.30.58 -> 172.31.36.109 TCP 2962 [TCP segment of a reassembled PDU]
113   0.062005 172.31.36.109 -> 54.230.30.58 TCP 66 34162 > http [ACK] Seq=96 Ack=400215 Win=766592 Len=0 TSval=33126421 TSecr=636420449
114   0.062196 54.230.30.58 -> 172.31.36.109 TCP 24682 [TCP segment of a reassembled PDU]
115   0.062207 172.31.36.109 -> 54.230.30.58 TCP 66 34162 > http [ACK] Seq=96 Ack=424831 Win=752512 Len=0 TSval=33126421 TSecr=636420449
116   0.062526 54.230.30.58 -> 172.31.36.109 TCP 18890 [TCP segment of a reassembled PDU]
117   0.062535 172.31.36.109 -> 54.230.30.58 TCP 66 34162 > http [ACK] Seq=96 Ack=443655 Win=761984 Len=0 TSval=33126421 TSecr=636420449
118   0.062643 54.230.30.58 -> 172.31.36.109 TCP 14922 [TCP segment of a reassembled PDU]
119   0.062651 172.31.36.109 -> 54.230.30.58 TCP 66 34162 > http [ACK] Seq=96 Ack=458511 Win=766720 Len=0 TSval=33126421 TSecr=636420449
120   0.078527 54.230.30.58 -> 172.31.36.109 TCP 1514 [TCP segment of a reassembled PDU]
121   0.078531 172.31.36.109 -> 54.230.30.58 TCP 66 34162 > http [ACK] Seq=96 Ack=459959 Win=790272 Len=0 TSval=33126425 TSecr=636420450
122   0.078750 54.230.30.58 -> 172.31.36.109 TCP 5858 [TCP segment of a reassembled PDU]
123   0.078757 172.31.36.109 -> 54.230.30.58 TCP 66 34162 > http [ACK] Seq=96 Ack=465751 Win=784512 Len=0 TSval=33126425 TSecr=636420450
124   0.078888 54.230.30.58 -> 172.31.36.109 TCP 18890 [TCP segment of a reassembled PDU]
125   0.078908 54.230.30.58 -> 172.31.36.109 TCP 11650 [TCP segment of a reassembled PDU]
126   0.079045 54.230.30.58 -> 172.31.36.109 TCP 10202 [TCP segment of a reassembled PDU]
127   0.079055 54.230.30.58 -> 172.31.36.109 TCP 2962 [TCP segment of a reassembled PDU]
128   0.079140 172.31.36.109 -> 54.230.30.58 TCP 66 34162 > http [ACK] Seq=96 Ack=509191 Win=741120 Len=0 TSval=33126425 TSecr=636420450
129   0.079169 54.230.30.58 -> 172.31.36.109 TCP 14546 [TCP segment of a reassembled PDU]
130   0.079184 172.31.36.109 -> 54.230.30.58 TCP 66 34162 > http [ACK] Seq=96 Ack=523671 Win=747648 Len=0 TSval=33126425 TSecr=636420450
131   0.079447 54.230.30.58 -> 172.31.36.109 TCP 7306 [TCP segment of a reassembled PDU]
132   0.079470 172.31.36.109 -> 54.230.30.58 TCP 66 34162 > http [ACK] Seq=96 Ack=530911 Win=781056 Len=0 TSval=33126425 TSecr=636420450
133   0.080540 54.230.30.58 -> 172.31.36.109 TCP 2962 [TCP segment of a reassembled PDU]
134   0.080566 172.31.36.109 -> 54.230.30.58 TCP 66 34162 > http [ACK] Seq=96 Ack=533807 Win=788096 Len=0 TSval=33126425 TSecr=636420450
135   0.080749 54.230.30.58 -> 172.31.36.109 TCP 24682 [TCP segment of a reassembled PDU]
136   0.080771 54.230.30.58 -> 172.31.36.109 TCP 1514 [TCP segment of a reassembled PDU]
137   0.080781 172.31.36.109 -> 54.230.30.58 TCP 66 34162 > http [ACK] Seq=96 Ack=559871 Win=762112 Len=0 TSval=33126425 TSecr=636420450
138   0.080818 54.230.30.58 -> 172.31.36.109 TCP 18890 [TCP segment of a reassembled PDU]
139   0.080838 172.31.36.109 -> 54.230.30.58 TCP 66 34162 > http [ACK] Seq=96 Ack=578695 Win=761984 Len=0 TSval=33126425 TSecr=636420450
140   0.080876 54.230.30.58 -> 172.31.36.109 TCP 10954 [TCP segment of a reassembled PDU]
141   0.080883 172.31.36.109 -> 54.230.30.58 TCP 66 34162 > http [ACK] Seq=96 Ack=589583 Win=773888 Len=0 TSval=33126425 TSecr=636420450
142   0.082617 54.230.30.58 -> 172.31.36.109 TCP 1514 [TCP segment of a reassembled PDU]
143   0.082883 54.230.30.58 -> 172.31.36.109 TCP 5858 [TCP segment of a reassembled PDU]
144   0.082889 172.31.36.109 -> 54.230.30.58 TCP 66 34162 > http [ACK] Seq=96 Ack=596823 Win=783360 Len=0 TSval=33126426 TSecr=636420451
145   0.082963 54.230.30.58 -> 172.31.36.109 TCP 5858 [TCP segment of a reassembled PDU]
146   0.082968 172.31.36.109 -> 54.230.30.58 TCP 66 34162 > http [ACK] Seq=96 Ack=602615 Win=783360 Len=0 TSval=33126426 TSecr=636420451
147   0.083253 54.230.30.58 -> 172.31.36.109 TCP 13098 [TCP segment of a reassembled PDU]
148   0.083382 54.230.30.58 -> 172.31.36.109 TCP 5858 [TCP segment of a reassembled PDU]
149   0.083458 172.31.36.109 -> 54.230.30.58 TCP 66 34162 > http [ACK] Seq=96 Ack=621439 Win=783360 Len=0 TSval=33126426 TSecr=636420451
150   0.083548 54.230.30.58 -> 172.31.36.109 TCP 10202 [TCP segment of a reassembled PDU]
151   0.083588 172.31.36.109 -> 54.230.30.58 TCP 66 34162 > http [ACK] Seq=96 Ack=631575 Win=790272 Len=0 TSval=33126426 TSecr=636420451
152   0.083755 54.230.30.58 -> 172.31.36.109 TCP 5858 [TCP segment of a reassembled PDU]
153   0.083795 54.230.30.58 -> 172.31.36.109 TCP 17818 [TCP segment of a reassembled PDU]
154   0.083819 172.31.36.109 -> 54.230.30.58 TCP 66 34162 > http [ACK] Seq=96 Ack=655119 Win=766848 Len=0 TSval=33126426 TSecr=636420451
155   0.089893 54.230.30.58 -> 172.31.36.109 TCP 1514 [TCP segment of a reassembled PDU]
156   0.090293 54.230.30.58 -> 172.31.36.109 TCP 5858 [TCP segment of a reassembled PDU]
157   0.090317 172.31.36.109 -> 54.230.30.58 TCP 66 34162 > http [ACK] Seq=96 Ack=662359 Win=783360 Len=0 TSval=33126428 TSecr=636420451
158   0.090445 54.230.30.58 -> 172.31.36.109 TCP 17442 [TCP segment of a reassembled PDU]
159   0.090456 54.230.30.58 -> 172.31.36.109 TCP 4410 [TCP segment of a reassembled PDU]
160   0.090475 172.31.36.109 -> 54.230.30.58 TCP 66 34162 > http [ACK] Seq=96 Ack=684079 Win=761728 Len=0 TSval=33126428 TSecr=636420451
161   0.090711 54.230.30.58 -> 172.31.36.109 TCP 26130 [TCP segment of a reassembled PDU]
162   0.090745 54.230.30.58 -> 172.31.36.109 TCP 10578 [TCP segment of a reassembled PDU]
163   0.090769 172.31.36.109 -> 54.230.30.58 TCP 66 34162 > http [ACK] Seq=96 Ack=720655 Win=731008 Len=0 TSval=33126428 TSecr=636420451
164   0.162286 54.230.30.58 -> 172.31.36.109 TCP 1514 [TCP segment of a reassembled PDU]
165   0.162514 54.230.30.58 -> 172.31.36.109 TCP 4410 [TCP segment of a reassembled PDU]
166   0.162521 172.31.36.109 -> 54.230.30.58 TCP 66 34162 > http [ACK] Seq=96 Ack=726447 Win=785792 Len=0 TSval=33126446 TSecr=636420459
167   0.162651 54.230.30.58 -> 172.31.36.109 TCP 23234 [TCP segment of a reassembled PDU]
168   0.162719 172.31.36.109 -> 54.230.30.58 TCP 66 34162 > http [ACK] Seq=96 Ack=749615 Win=762624 Len=0 TSval=33126446 TSecr=636420459
169   0.162741 54.230.30.58 -> 172.31.36.109 TCP 2962 [TCP segment of a reassembled PDU]
170   0.162746 172.31.36.109 -> 54.230.30.58 TCP 66 34162 > http [ACK] Seq=96 Ack=752511 Win=788096 Len=0 TSval=33126446 TSecr=636420459
171   0.162757 54.230.30.58 -> 172.31.36.109 TCP 10202 [TCP segment of a reassembled PDU]
172   0.162827 54.230.30.58 -> 172.31.36.109 TCP 8754 [TCP segment of a reassembled PDU]
173   0.163079 54.230.30.58 -> 172.31.36.109 TCP 4410 [TCP segment of a reassembled PDU]
174   0.163094 54.230.30.58 -> 172.31.36.109 TCP 23610 [TCP segment of a reassembled PDU]
175   0.163475 54.230.30.58 -> 172.31.36.109 TCP 4410 [TCP segment of a reassembled PDU]
176   0.163594 54.230.30.58 -> 172.31.36.109 TCP 8754 [TCP segment of a reassembled PDU]
177   0.163987 54.230.30.58 -> 172.31.36.109 TCP 1514 [TCP segment of a reassembled PDU]
178   0.164245 54.230.30.58 -> 172.31.36.109 TCP 5858 [TCP segment of a reassembled PDU]
179   0.164386 54.230.30.58 -> 172.31.36.109 TCP 24682 [TCP segment of a reassembled PDU]
180   0.165009 172.31.36.109 -> 54.230.30.58 TCP 66 34162 > http [ACK] Seq=96 Ack=844111 Win=696576 Len=0 TSval=33126447 TSecr=636420459
181   0.166281 54.230.30.58 -> 172.31.36.109 TCP 1514 [TCP segment of a reassembled PDU]
182   0.166505 54.230.30.58 -> 172.31.36.109 TCP 31922 [TCP segment of a reassembled PDU]
183   0.166521 172.31.36.109 -> 54.230.30.58 TCP 66 34162 > http [ACK] Seq=96 Ack=877415 Win=740480 Len=0 TSval=33126447 TSecr=636420459
184   0.166567 54.230.30.58 -> 172.31.36.109 TCP 2962 [TCP segment of a reassembled PDU]
185   0.166707 54.230.30.58 -> 172.31.36.109 TCP 24682 [TCP segment of a reassembled PDU]
186   0.166736 172.31.36.109 -> 54.230.30.58 TCP 66 34162 > http [ACK] Seq=96 Ack=904927 Win=713088 Len=0 TSval=33126447 TSecr=636420459
187   0.166824 54.230.30.58 -> 172.31.36.109 TCP 4410 [TCP segment of a reassembled PDU]
188   0.166830 172.31.36.109 -> 54.230.30.58 TCP 66 34162 > http [ACK] Seq=96 Ack=909271 Win=785792 Len=0 TSval=33126447 TSecr=636420459
189   0.166977 54.230.30.58 -> 172.31.36.109 TCP 29026 [TCP segment of a reassembled PDU]
190   0.166999 172.31.36.109 -> 54.230.30.58 TCP 66 34162 > http [ACK] Seq=96 Ack=938231 Win=756864 Len=0 TSval=33126447 TSecr=636420459
191   0.167177 54.230.30.58 -> 172.31.36.109 TCP 4410 [TCP segment of a reassembled PDU]
192   0.167183 172.31.36.109 -> 54.230.30.58 TCP 66 34162 > http [ACK] Seq=96 Ack=942575 Win=785792 Len=0 TSval=33126447 TSecr=636420459
193   0.167614 54.230.30.58 -> 172.31.36.109 TCP 1514 [TCP segment of a reassembled PDU]
194   0.167863 54.230.30.58 -> 172.31.36.109 TCP 7306 [TCP segment of a reassembled PDU]
195   0.167892 172.31.36.109 -> 54.230.30.58 TCP 66 34162 > http [ACK] Seq=96 Ack=951263 Win=790272 Len=0 TSval=33126447 TSecr=636420459
196   0.168030 54.230.30.58 -> 172.31.36.109 TCP 26130 [TCP segment of a reassembled PDU]
197   0.168173 54.230.30.58 -> 172.31.36.109 TCP 2962 [TCP segment of a reassembled PDU]
198   0.168237 172.31.36.109 -> 54.230.30.58 TCP 66 34162 > http [ACK] Seq=96 Ack=980223 Win=761344 Len=0 TSval=33126447 TSecr=636420459
199   0.168360 54.230.30.58 -> 172.31.36.109 TCP 8754 [TCP segment of a reassembled PDU]
200   0.168367 172.31.36.109 -> 54.230.30.58 TCP 66 34162 > http [ACK] Seq=96 Ack=988911 Win=778624 Len=0 TSval=33126447 TSecr=636420459
201   0.168541 54.230.30.58 -> 172.31.36.109 TCP 31922 [TCP segment of a reassembled PDU]
202   0.168565 172.31.36.109 -> 54.230.30.58 TCP 66 34162 > http [ACK] Seq=96 Ack=1020767 Win=746880 Len=0 TSval=33126447 TSecr=636420459
203   0.168712 54.230.30.58 -> 172.31.36.109 TCP 21786 [TCP segment of a reassembled PDU]
204   0.168724 172.31.36.109 -> 54.230.30.58 TCP 66 34162 > http [ACK] Seq=96 Ack=1042487 Win=757248 Len=0 TSval=33126447 TSecr=636420459
205   0.169671 54.230.30.58 -> 172.31.36.109 HTTP 6613 HTTP/1.1 200 OK  (application/octet-stream)
206   0.169700 172.31.36.109 -> 54.230.30.58 TCP 66 34162 > http [ACK] Seq=96 Ack=1049034 Win=781056 Len=0 TSval=33126448 TSecr=636420459
207   0.169850 172.31.36.109 -> 54.230.30.58 TCP 66 34162 > http [FIN, ACK] Seq=96 Ack=1049034 Win=790272 Len=0 TSval=33126448 TSecr=636420459
208   0.171213 54.230.30.58 -> 172.31.36.109 TCP 66 http > 34162 [FIN, ACK] Seq=1049034 Ack=97 Win=14592 Len=0 TSval=636420460 TSecr=33126448
209   0.171222 172.31.36.109 -> 54.230.30.58 TCP 66 34162 > http [ACK] Seq=97 Ack=1049035 Win=790272 Len=0 TSval=33126448 TSecr=636420460
