[Measurement for 1mb at 04:32:59 20.32.2014] 
Tshark:

  1   0.000000 172.31.36.109 -> 172.31.0.2   DNS 88 Standard query 0x10ee  A dm53kc3eax57k.cloudfront.net
  2   0.000024 172.31.36.109 -> 172.31.0.2   DNS 88 Standard query 0xf0cb  AAAA dm53kc3eax57k.cloudfront.net
  3   0.000485   172.31.0.2 -> 172.31.36.109 DNS 216 Standard query response 0x10ee  A 54.192.30.184 A 54.192.30.214 A 54.192.30.218 A 54.230.30.3 A 54.230.30.37 A 54.230.30.50 A 54.230.30.53 A 54.230.30.221
  4   0.000495   172.31.0.2 -> 172.31.36.109 DNS 175 Standard query response 0xf0cb 
  5   0.003902 172.31.36.109 -> 54.192.30.184 TCP 74 34406 > http [SYN] Seq=0 Win=26883 Len=0 MSS=8961 SACK_PERM=1 TSval=30416396 TSecr=0 WS=128
  6   0.005354 54.192.30.184 -> 172.31.36.109 TCP 74 http > 34406 [SYN, ACK] Seq=0 Ack=1 Win=14480 Len=0 MSS=1460 SACK_PERM=1 TSval=695882043 TSecr=30416396 WS=128
  7   0.005369 172.31.36.109 -> 54.192.30.184 TCP 66 34406 > http [ACK] Seq=1 Ack=1 Win=27008 Len=0 TSval=30416396 TSecr=695882043
  8   0.005410 172.31.36.109 -> 54.192.30.184 HTTP 161 GET /1mb HTTP/1.1 
  9   0.006820 54.192.30.184 -> 172.31.36.109 TCP 66 http > 34406 [ACK] Seq=1 Ack=96 Win=14592 Len=0 TSval=695882043 TSecr=30416396
 10   0.017412 54.192.30.184 -> 172.31.36.109 TCP 1514 [TCP segment of a reassembled PDU]
 11   0.017438 172.31.36.109 -> 54.192.30.184 TCP 66 34406 > http [ACK] Seq=96 Ack=1449 Win=29824 Len=0 TSval=30416399 TSecr=695882044
 12   0.017448 54.192.30.184 -> 172.31.36.109 TCP 2962 [TCP segment of a reassembled PDU]
 13   0.017452 172.31.36.109 -> 54.192.30.184 TCP 66 34406 > http [ACK] Seq=96 Ack=4345 Win=35584 Len=0 TSval=30416399 TSecr=695882044
 14   0.017657 54.192.30.184 -> 172.31.36.109 TCP 10202 [TCP segment of a reassembled PDU]
 15   0.017666 172.31.36.109 -> 54.192.30.184 TCP 66 34406 > http [ACK] Seq=96 Ack=14481 Win=55936 Len=0 TSval=30416399 TSecr=695882044
 16   0.018624 54.192.30.184 -> 172.31.36.109 TCP 1514 [TCP segment of a reassembled PDU]
 17   0.018649 172.31.36.109 -> 54.192.30.184 TCP 66 34406 > http [ACK] Seq=96 Ack=15929 Win=58752 Len=0 TSval=30416400 TSecr=695882045
 18   0.018660 54.192.30.184 -> 172.31.36.109 TCP 5858 [TCP segment of a reassembled PDU]
 19   0.018664 172.31.36.109 -> 54.192.30.184 TCP 66 34406 > http [ACK] Seq=96 Ack=21721 Win=70400 Len=0 TSval=30416400 TSecr=695882045
 20   0.018850 54.192.30.184 -> 172.31.36.109 TCP 2962 [TCP segment of a reassembled PDU]
 21   0.018863 172.31.36.109 -> 54.192.30.184 TCP 66 34406 > http [ACK] Seq=96 Ack=24617 Win=76160 Len=0 TSval=30416400 TSecr=695882045
 22   0.018887 54.192.30.184 -> 172.31.36.109 TCP 2962 [TCP segment of a reassembled PDU]
 23   0.018890 172.31.36.109 -> 54.192.30.184 TCP 66 34406 > http [ACK] Seq=96 Ack=27513 Win=81920 Len=0 TSval=30416400 TSecr=695882045
 24   0.019949 54.192.30.184 -> 172.31.36.109 TCP 2962 [TCP segment of a reassembled PDU]
 25   0.019954 172.31.36.109 -> 54.192.30.184 TCP 66 34406 > http [ACK] Seq=96 Ack=30409 Win=87808 Len=0 TSval=30416400 TSecr=695882045
 26   0.020009 54.192.30.184 -> 172.31.36.109 TCP 5858 [TCP segment of a reassembled PDU]
 27   0.020015 172.31.36.109 -> 54.192.30.184 TCP 66 34406 > http [ACK] Seq=96 Ack=36201 Win=99328 Len=0 TSval=30416400 TSecr=695882045
 28   0.020062 54.192.30.184 -> 172.31.36.109 TCP 5858 [TCP segment of a reassembled PDU]
 29   0.020085 172.31.36.109 -> 54.192.30.184 TCP 66 34406 > http [ACK] Seq=96 Ack=41993 Win=108416 Len=0 TSval=30416400 TSecr=695882045
 30   0.020172 54.192.30.184 -> 172.31.36.109 TCP 10202 [TCP segment of a reassembled PDU]
 31   0.020180 172.31.36.109 -> 54.192.30.184 TCP 66 34406 > http [ACK] Seq=96 Ack=52129 Win=101248 Len=0 TSval=30416400 TSecr=695882045
 32   0.021233 54.192.30.184 -> 172.31.36.109 TCP 11650 [TCP segment of a reassembled PDU]
 33   0.021242 172.31.36.109 -> 54.192.30.184 TCP 66 34406 > http [ACK] Seq=96 Ack=63713 Win=98944 Len=0 TSval=30416400 TSecr=695882045
 34   0.021384 54.192.30.184 -> 172.31.36.109 TCP 4410 [TCP segment of a reassembled PDU]
 35   0.021418 172.31.36.109 -> 54.192.30.184 TCP 66 34406 > http [ACK] Seq=96 Ack=68057 Win=109056 Len=0 TSval=30416400 TSecr=695882045
 36   0.021533 54.192.30.184 -> 172.31.36.109 TCP 11650 [TCP segment of a reassembled PDU]
 37   0.021566 172.31.36.109 -> 54.192.30.184 TCP 66 34406 > http [ACK] Seq=96 Ack=79641 Win=98944 Len=0 TSval=30416400 TSecr=695882045
 38   0.022553 54.192.30.184 -> 172.31.36.109 TCP 11650 [TCP segment of a reassembled PDU]
 39   0.022561 172.31.36.109 -> 54.192.30.184 TCP 66 34406 > http [ACK] Seq=96 Ack=91225 Win=98944 Len=0 TSval=30416400 TSecr=695882045
 40   0.022608 54.192.30.184 -> 172.31.36.109 TCP 5858 [TCP segment of a reassembled PDU]
 41   0.022614 172.31.36.109 -> 54.192.30.184 TCP 66 34406 > http [ACK] Seq=96 Ack=97017 Win=120704 Len=0 TSval=30416401 TSecr=695882045
 42   0.022786 54.192.30.184 -> 172.31.36.109 TCP 1514 [TCP segment of a reassembled PDU]
 43   0.022804 172.31.36.109 -> 54.192.30.184 TCP 66 34406 > http [ACK] Seq=96 Ack=98465 Win=123520 Len=0 TSval=30416401 TSecr=695882045
 44   0.022964 54.192.30.184 -> 172.31.36.109 TCP 11650 [TCP segment of a reassembled PDU]
 45   0.022971 172.31.36.109 -> 54.192.30.184 TCP 66 34406 > http [ACK] Seq=96 Ack=110049 Win=146688 Len=0 TSval=30416401 TSecr=695882045
 46   0.023124 54.192.30.184 -> 172.31.36.109 TCP 4410 [TCP segment of a reassembled PDU]
 47   0.023137 172.31.36.109 -> 54.192.30.184 TCP 66 34406 > http [ACK] Seq=96 Ack=114393 Win=155392 Len=0 TSval=30416401 TSecr=695882045
 48   0.023751 54.192.30.184 -> 172.31.36.109 TCP 7306 [TCP segment of a reassembled PDU]
 49   0.023783 172.31.36.109 -> 54.192.30.184 TCP 66 34406 > http [ACK] Seq=96 Ack=121633 Win=169856 Len=0 TSval=30416401 TSecr=695882045
 50   0.023882 54.192.30.184 -> 172.31.36.109 TCP 5858 [TCP segment of a reassembled PDU]
 51   0.023908 172.31.36.109 -> 54.192.30.184 TCP 66 34406 > http [ACK] Seq=96 Ack=127425 Win=181504 Len=0 TSval=30416401 TSecr=695882045
 52   0.024231 54.192.30.184 -> 172.31.36.109 TCP 2962 [TCP segment of a reassembled PDU]
 53   0.024237 172.31.36.109 -> 54.192.30.184 TCP 66 34406 > http [ACK] Seq=96 Ack=130321 Win=187264 Len=0 TSval=30416401 TSecr=695882045
 54   0.024356 54.192.30.184 -> 172.31.36.109 TCP 20338 [TCP segment of a reassembled PDU]
 55   0.024378 172.31.36.109 -> 54.192.30.184 TCP 66 34406 > http [ACK] Seq=96 Ack=150593 Win=227840 Len=0 TSval=30416401 TSecr=695882045
 56   0.025078 54.192.30.184 -> 172.31.36.109 TCP 10202 [TCP segment of a reassembled PDU]
 57   0.025107 172.31.36.109 -> 54.192.30.184 TCP 66 34406 > http [ACK] Seq=96 Ack=160729 Win=248064 Len=0 TSval=30416401 TSecr=695882045
 58   0.025188 54.192.30.184 -> 172.31.36.109 TCP 4410 [TCP segment of a reassembled PDU]
 59   0.025193 172.31.36.109 -> 54.192.30.184 TCP 66 34406 > http [ACK] Seq=96 Ack=165073 Win=256768 Len=0 TSval=30416401 TSecr=695882045
 60   0.025239 54.192.30.184 -> 172.31.36.109 TCP 2962 [TCP segment of a reassembled PDU]
 61   0.025256 172.31.36.109 -> 54.192.30.184 TCP 66 34406 > http [ACK] Seq=96 Ack=167969 Win=262528 Len=0 TSval=30416401 TSecr=695882045
 62   0.025779 54.192.30.184 -> 172.31.36.109 TCP 2962 [TCP segment of a reassembled PDU]
 63   0.025809 172.31.36.109 -> 54.192.30.184 TCP 66 34406 > http [ACK] Seq=96 Ack=170865 Win=268288 Len=0 TSval=30416401 TSecr=695882045
 64   0.026022 54.192.30.184 -> 172.31.36.109 TCP 27578 [TCP segment of a reassembled PDU]
 65   0.026046 172.31.36.109 -> 54.192.30.184 TCP 66 34406 > http [ACK] Seq=96 Ack=198377 Win=323328 Len=0 TSval=30416401 TSecr=695882045
 66   0.026447 54.192.30.184 -> 172.31.36.109 TCP 2962 [TCP segment of a reassembled PDU]
 67   0.026459 172.31.36.109 -> 54.192.30.184 TCP 66 34406 > http [ACK] Seq=96 Ack=201273 Win=329216 Len=0 TSval=30416401 TSecr=695882045
 68   0.026602 54.192.30.184 -> 172.31.36.109 TCP 10202 [TCP segment of a reassembled PDU]
 69   0.026624 172.31.36.109 -> 54.192.30.184 TCP 66 34406 > http [ACK] Seq=96 Ack=211409 Win=349440 Len=0 TSval=30416402 TSecr=695882045
 70   0.026666 54.192.30.184 -> 172.31.36.109 TCP 4410 [TCP segment of a reassembled PDU]
 71   0.026684 172.31.36.109 -> 54.192.30.184 TCP 66 34406 > http [ACK] Seq=96 Ack=215753 Win=358144 Len=0 TSval=30416402 TSecr=695882045
 72   0.027088 54.192.30.184 -> 172.31.36.109 TCP 4410 [TCP segment of a reassembled PDU]
 73   0.027121 172.31.36.109 -> 54.192.30.184 TCP 66 34406 > http [ACK] Seq=96 Ack=220097 Win=366848 Len=0 TSval=30416402 TSecr=695882045
 74   0.027221 54.192.30.184 -> 172.31.36.109 TCP 1514 [TCP segment of a reassembled PDU]
 75   0.027231 172.31.36.109 -> 54.192.30.184 TCP 66 34406 > http [ACK] Seq=96 Ack=221545 Win=369664 Len=0 TSval=30416402 TSecr=695882045
 76   0.027360 54.192.30.184 -> 172.31.36.109 TCP 21786 [TCP segment of a reassembled PDU]
 77   0.027371 172.31.36.109 -> 54.192.30.184 TCP 66 34406 > http [ACK] Seq=96 Ack=243265 Win=413184 Len=0 TSval=30416402 TSecr=695882045
 78   0.027677 54.192.30.184 -> 172.31.36.109 TCP 10202 [TCP segment of a reassembled PDU]
 79   0.027701 172.31.36.109 -> 54.192.30.184 TCP 66 34406 > http [ACK] Seq=96 Ack=253401 Win=433408 Len=0 TSval=30416402 TSecr=695882045
 80   0.027780 54.192.30.184 -> 172.31.36.109 TCP 2962 [TCP segment of a reassembled PDU]
 81   0.027785 172.31.36.109 -> 54.192.30.184 TCP 66 34406 > http [ACK] Seq=96 Ack=256297 Win=439168 Len=0 TSval=30416402 TSecr=695882046
 82   0.027928 54.192.30.184 -> 172.31.36.109 TCP 18890 [TCP segment of a reassembled PDU]
 83   0.027939 172.31.36.109 -> 54.192.30.184 TCP 66 34406 > http [ACK] Seq=96 Ack=275121 Win=476800 Len=0 TSval=30416402 TSecr=695882046
 84   0.028554 54.192.30.184 -> 172.31.36.109 TCP 2962 [TCP segment of a reassembled PDU]
 85   0.028567 172.31.36.109 -> 54.192.30.184 TCP 66 34406 > http [ACK] Seq=96 Ack=278017 Win=482688 Len=0 TSval=30416402 TSecr=695882046
 86   0.028691 54.192.30.184 -> 172.31.36.109 TCP 8754 [TCP segment of a reassembled PDU]
 87   0.028718 172.31.36.109 -> 54.192.30.184 TCP 66 34406 > http [ACK] Seq=96 Ack=286705 Win=499968 Len=0 TSval=30416402 TSecr=695882046
 88   0.028936 54.192.30.184 -> 172.31.36.109 TCP 21786 [TCP segment of a reassembled PDU]
 89   0.028948 172.31.36.109 -> 54.192.30.184 TCP 66 34406 > http [ACK] Seq=96 Ack=308425 Win=543488 Len=0 TSval=30416402 TSecr=695882046
 90   0.029025 54.192.30.184 -> 172.31.36.109 TCP 7306 [TCP segment of a reassembled PDU]
 91   0.029032 172.31.36.109 -> 54.192.30.184 TCP 66 34406 > http [ACK] Seq=96 Ack=315665 Win=557952 Len=0 TSval=30416402 TSecr=695882046
 92   0.029148 54.192.30.184 -> 172.31.36.109 TCP 7306 [TCP segment of a reassembled PDU]
 93   0.029154 172.31.36.109 -> 54.192.30.184 TCP 66 34406 > http [ACK] Seq=96 Ack=322905 Win=572416 Len=0 TSval=30416402 TSecr=695882046
 94   0.029415 54.192.30.184 -> 172.31.36.109 TCP 17442 [TCP segment of a reassembled PDU]
 95   0.029425 172.31.36.109 -> 54.192.30.184 TCP 66 34406 > http [ACK] Seq=96 Ack=340281 Win=607232 Len=0 TSval=30416402 TSecr=695882046
 96   0.029494 54.192.30.184 -> 172.31.36.109 TCP 2962 [TCP segment of a reassembled PDU]
 97   0.029499 172.31.36.109 -> 54.192.30.184 TCP 66 34406 > http [ACK] Seq=96 Ack=343177 Win=612992 Len=0 TSval=30416402 TSecr=695882046
 98   0.029837 54.192.30.184 -> 172.31.36.109 TCP 2962 [TCP segment of a reassembled PDU]
 99   0.029841 172.31.36.109 -> 54.192.30.184 TCP 66 34406 > http [ACK] Seq=96 Ack=346073 Win=618752 Len=0 TSval=30416402 TSecr=695882046
100   0.029967 54.192.30.184 -> 172.31.36.109 TCP 5858 [TCP segment of a reassembled PDU]
101   0.029973 172.31.36.109 -> 54.192.30.184 TCP 66 34406 > http [ACK] Seq=96 Ack=351865 Win=630400 Len=0 TSval=30416402 TSecr=695882046
102   0.030099 54.192.30.184 -> 172.31.36.109 TCP 8754 [TCP segment of a reassembled PDU]
103   0.030106 172.31.36.109 -> 54.192.30.184 TCP 66 34406 > http [ACK] Seq=96 Ack=360553 Win=647680 Len=0 TSval=30416402 TSecr=695882046
104   0.030246 54.192.30.184 -> 172.31.36.109 TCP 20338 [TCP segment of a reassembled PDU]
105   0.030256 172.31.36.109 -> 54.192.30.184 TCP 66 34406 > http [ACK] Seq=96 Ack=380825 Win=688256 Len=0 TSval=30416402 TSecr=695882046
106   0.030605 54.192.30.184 -> 172.31.36.109 TCP 5858 [TCP segment of a reassembled PDU]
107   0.030624 172.31.36.109 -> 54.192.30.184 TCP 66 34406 > http [ACK] Seq=96 Ack=386617 Win=699904 Len=0 TSval=30416403 TSecr=695882046
108   0.030730 54.192.30.184 -> 172.31.36.109 TCP 6424 [TCP segment of a reassembled PDU]
109   0.030737 172.31.36.109 -> 54.192.30.184 TCP 66 34406 > http [ACK] Seq=96 Ack=392975 Win=712576 Len=0 TSval=30416403 TSecr=695882046
110   0.031119 54.192.30.184 -> 172.31.36.109 TCP 1514 [TCP segment of a reassembled PDU]
111   0.031123 172.31.36.109 -> 54.192.30.184 TCP 66 34406 > http [ACK] Seq=96 Ack=394423 Win=715520 Len=0 TSval=30416403 TSecr=695882046
112   0.031445 54.192.30.184 -> 172.31.36.109 TCP 2962 [TCP segment of a reassembled PDU]
113   0.031450 172.31.36.109 -> 54.192.30.184 TCP 66 34406 > http [ACK] Seq=96 Ack=397319 Win=721280 Len=0 TSval=30416403 TSecr=695882046
114   0.031559 54.192.30.184 -> 172.31.36.109 TCP 10202 [TCP segment of a reassembled PDU]
115   0.031566 172.31.36.109 -> 54.192.30.184 TCP 66 34406 > http [ACK] Seq=96 Ack=407455 Win=741504 Len=0 TSval=30416403 TSecr=695882046
116   0.031642 54.192.30.184 -> 172.31.36.109 TCP 1514 [TCP segment of a reassembled PDU]
117   0.031646 172.31.36.109 -> 54.192.30.184 TCP 66 34406 > http [ACK] Seq=96 Ack=408903 Win=744448 Len=0 TSval=30416403 TSecr=695882046
118   0.031794 54.192.30.184 -> 172.31.36.109 TCP 10202 [TCP segment of a reassembled PDU]
119   0.031801 172.31.36.109 -> 54.192.30.184 TCP 66 34406 > http [ACK] Seq=96 Ack=419039 Win=749312 Len=0 TSval=30416403 TSecr=695882046
120   0.031813 54.192.30.184 -> 172.31.36.109 TCP 11650 [TCP segment of a reassembled PDU]
121   0.031819 172.31.36.109 -> 54.192.30.184 TCP 66 34406 > http [ACK] Seq=96 Ack=430623 Win=737792 Len=0 TSval=30416403 TSecr=695882046
122   0.031858 54.192.30.184 -> 172.31.36.109 TCP 7306 [TCP segment of a reassembled PDU]
123   0.031865 172.31.36.109 -> 54.192.30.184 TCP 66 34406 > http [ACK] Seq=96 Ack=437863 Win=754048 Len=0 TSval=30416403 TSecr=695882046
124   0.032053 54.192.30.184 -> 172.31.36.109 TCP 1514 [TCP segment of a reassembled PDU]
125   0.032062 54.192.30.184 -> 172.31.36.109 TCP 8754 [TCP segment of a reassembled PDU]
126   0.032077 172.31.36.109 -> 54.192.30.184 TCP 66 34406 > http [ACK] Seq=96 Ack=447999 Win=764672 Len=0 TSval=30416403 TSecr=695882046
127   0.032131 54.192.30.184 -> 172.31.36.109 TCP 4410 [TCP segment of a reassembled PDU]
128   0.032145 172.31.36.109 -> 54.192.30.184 TCP 66 34406 > http [ACK] Seq=96 Ack=452343 Win=764672 Len=0 TSval=30416403 TSecr=695882046
129   0.032237 54.192.30.184 -> 172.31.36.109 TCP 6234 [TCP segment of a reassembled PDU]
130   0.032256 172.31.36.109 -> 54.192.30.184 TCP 66 34406 > http [ACK] Seq=96 Ack=458511 Win=764672 Len=0 TSval=30416403 TSecr=695882046
131   0.047852 54.192.30.184 -> 172.31.36.109 TCP 1514 [TCP segment of a reassembled PDU]
132   0.048068 54.192.30.184 -> 172.31.36.109 TCP 2962 [TCP segment of a reassembled PDU]
133   0.048106 172.31.36.109 -> 54.192.30.184 TCP 66 34406 > http [ACK] Seq=96 Ack=462855 Win=764672 Len=0 TSval=30416407 TSecr=695882048
134   0.048193 54.192.30.184 -> 172.31.36.109 TCP 8754 [TCP segment of a reassembled PDU]
135   0.048232 172.31.36.109 -> 54.192.30.184 TCP 66 34406 > http [ACK] Seq=96 Ack=471543 Win=764672 Len=0 TSval=30416407 TSecr=695882048
136   0.048383 54.192.30.184 -> 172.31.36.109 TCP 10202 [TCP segment of a reassembled PDU]
137   0.048417 172.31.36.109 -> 54.192.30.184 TCP 66 34406 > http [ACK] Seq=96 Ack=481679 Win=764672 Len=0 TSval=30416407 TSecr=695882048
138   0.048519 54.192.30.184 -> 172.31.36.109 TCP 4410 [TCP segment of a reassembled PDU]
139   0.048554 54.192.30.184 -> 172.31.36.109 TCP 14546 [TCP segment of a reassembled PDU]
140   0.048566 54.192.30.184 -> 172.31.36.109 TCP 5858 [TCP segment of a reassembled PDU]
141   0.048712 54.192.30.184 -> 172.31.36.109 TCP 5858 [TCP segment of a reassembled PDU]
142   0.048726 54.192.30.184 -> 172.31.36.109 TCP 15994 [TCP segment of a reassembled PDU]
143   0.048819 54.192.30.184 -> 172.31.36.109 TCP 2962 [TCP segment of a reassembled PDU]
144   0.048833 172.31.36.109 -> 54.192.30.184 TCP 66 34406 > http [ACK] Seq=96 Ack=530911 Win=715520 Len=0 TSval=30416407 TSecr=695882048
145   0.048923 54.192.30.184 -> 172.31.36.109 TCP 1514 [TCP segment of a reassembled PDU]
146   0.049892 54.192.30.184 -> 172.31.36.109 TCP 4410 [TCP segment of a reassembled PDU]
147   0.049898 172.31.36.109 -> 54.192.30.184 TCP 66 34406 > http [ACK] Seq=96 Ack=536703 Win=758784 Len=0 TSval=30416407 TSecr=695882048
148   0.049990 54.192.30.184 -> 172.31.36.109 TCP 14546 [TCP segment of a reassembled PDU]
149   0.050011 172.31.36.109 -> 54.192.30.184 TCP 66 34406 > http [ACK] Seq=96 Ack=551183 Win=764672 Len=0 TSval=30416407 TSecr=695882048
150   0.050295 54.192.30.184 -> 172.31.36.109 TCP 17442 [TCP segment of a reassembled PDU]
151   0.050317 172.31.36.109 -> 54.192.30.184 TCP 66 34406 > http [ACK] Seq=96 Ack=568559 Win=747392 Len=0 TSval=30416407 TSecr=695882048
152   0.050429 54.192.30.184 -> 172.31.36.109 TCP 8754 [TCP segment of a reassembled PDU]
153   0.050453 172.31.36.109 -> 54.192.30.184 TCP 66 34406 > http [ACK] Seq=96 Ack=577247 Win=751616 Len=0 TSval=30416407 TSecr=695882048
154   0.050475 54.192.30.184 -> 172.31.36.109 TCP 12402 [TCP segment of a reassembled PDU]
155   0.050496 172.31.36.109 -> 54.192.30.184 TCP 66 34406 > http [ACK] Seq=96 Ack=589583 Win=744576 Len=0 TSval=30416407 TSecr=695882048
156   0.068857 54.192.30.184 -> 172.31.36.109 TCP 1514 [TCP segment of a reassembled PDU]
157   0.069131 54.192.30.184 -> 172.31.36.109 TCP 4410 [TCP segment of a reassembled PDU]
158   0.069144 172.31.36.109 -> 54.192.30.184 TCP 66 34406 > http [ACK] Seq=96 Ack=595375 Win=758784 Len=0 TSval=30416412 TSecr=695882050
159   0.069254 54.192.30.184 -> 172.31.36.109 TCP 21786 [TCP segment of a reassembled PDU]
160   0.069276 172.31.36.109 -> 54.192.30.184 TCP 66 34406 > http [ACK] Seq=96 Ack=617095 Win=737152 Len=0 TSval=30416412 TSecr=695882050
161   0.069345 54.192.30.184 -> 172.31.36.109 TCP 8754 [TCP segment of a reassembled PDU]
162   0.069364 172.31.36.109 -> 54.192.30.184 TCP 66 34406 > http [ACK] Seq=96 Ack=625783 Win=751616 Len=0 TSval=30416412 TSecr=695882050
163   0.069374 54.192.30.184 -> 172.31.36.109 TCP 5858 [TCP segment of a reassembled PDU]
164   0.069433 54.192.30.184 -> 172.31.36.109 TCP 13098 [TCP segment of a reassembled PDU]
165   0.069517 172.31.36.109 -> 54.192.30.184 TCP 66 34406 > http [ACK] Seq=96 Ack=644607 Win=744576 Len=0 TSval=30416412 TSecr=695882050
166   0.069699 54.192.30.184 -> 172.31.36.109 TCP 5858 [TCP segment of a reassembled PDU]
167   0.069725 172.31.36.109 -> 54.192.30.184 TCP 66 34406 > http [ACK] Seq=96 Ack=650399 Win=756352 Len=0 TSval=30416412 TSecr=695882050
168   0.069738 54.192.30.184 -> 172.31.36.109 TCP 20338 [TCP segment of a reassembled PDU]
169   0.069766 172.31.36.109 -> 54.192.30.184 TCP 66 34406 > http [ACK] Seq=96 Ack=670671 Win=736128 Len=0 TSval=30416412 TSecr=695882050
170   0.070572 54.192.30.184 -> 172.31.36.109 TCP 2962 [TCP segment of a reassembled PDU]
171   0.070577 172.31.36.109 -> 54.192.30.184 TCP 66 34406 > http [ACK] Seq=96 Ack=673567 Win=761088 Len=0 TSval=30416413 TSecr=695882050
172   0.070738 54.192.30.184 -> 172.31.36.109 TCP 4410 [TCP segment of a reassembled PDU]
173   0.070776 172.31.36.109 -> 54.192.30.184 TCP 66 34406 > http [ACK] Seq=96 Ack=677911 Win=764672 Len=0 TSval=30416413 TSecr=695882050
174   0.070917 54.192.30.184 -> 172.31.36.109 TCP 13098 [TCP segment of a reassembled PDU]
175   0.070940 172.31.36.109 -> 54.192.30.184 TCP 66 34406 > http [ACK] Seq=96 Ack=690943 Win=764672 Len=0 TSval=30416413 TSecr=695882050
176   0.070969 54.192.30.184 -> 172.31.36.109 TCP 18890 [TCP segment of a reassembled PDU]
177   0.070988 172.31.36.109 -> 54.192.30.184 TCP 66 34406 > http [ACK] Seq=96 Ack=709767 Win=745856 Len=0 TSval=30416413 TSecr=695882050
178   0.071079 54.192.30.184 -> 172.31.36.109 TCP 10954 [TCP segment of a reassembled PDU]
179   0.071108 172.31.36.109 -> 54.192.30.184 TCP 66 34406 > http [ACK] Seq=96 Ack=720655 Win=746880 Len=0 TSval=30416413 TSecr=695882050
180   0.107431 54.192.30.184 -> 172.31.36.109 TCP 1514 [TCP segment of a reassembled PDU]
181   0.107442 54.192.30.184 -> 172.31.36.109 TCP 10202 [TCP segment of a reassembled PDU]
182   0.107448 172.31.36.109 -> 54.192.30.184 TCP 66 34406 > http [ACK] Seq=96 Ack=732239 Win=746880 Len=0 TSval=30416422 TSecr=695882053
183   0.107458 54.192.30.184 -> 172.31.36.109 TCP 4410 [TCP segment of a reassembled PDU]
184   0.107481 172.31.36.109 -> 54.192.30.184 TCP 66 34406 > http [ACK] Seq=96 Ack=736583 Win=764672 Len=0 TSval=30416422 TSecr=695882053
185   0.107537 54.192.30.184 -> 172.31.36.109 TCP 1514 [TCP segment of a reassembled PDU]
186   0.107764 54.192.30.184 -> 172.31.36.109 TCP 1514 [TCP segment of a reassembled PDU]
187   0.107778 172.31.36.109 -> 54.192.30.184 TCP 66 34406 > http [ACK] Seq=96 Ack=739479 Win=764672 Len=0 TSval=30416422 TSecr=695882053
188   0.107877 54.192.30.184 -> 172.31.36.109 TCP 13098 [TCP segment of a reassembled PDU]
189   0.107897 172.31.36.109 -> 54.192.30.184 TCP 66 34406 > http [ACK] Seq=96 Ack=752511 Win=764672 Len=0 TSval=30416422 TSecr=695882053
190   0.107960 54.192.30.184 -> 172.31.36.109 TCP 10202 [TCP segment of a reassembled PDU]
191   0.107979 172.31.36.109 -> 54.192.30.184 TCP 66 34406 > http [ACK] Seq=96 Ack=762647 Win=764672 Len=0 TSval=30416422 TSecr=695882053
192   0.108069 54.192.30.184 -> 172.31.36.109 TCP 20338 [TCP segment of a reassembled PDU]
193   0.108090 54.192.30.184 -> 172.31.36.109 TCP 2962 [TCP segment of a reassembled PDU]
194   0.108100 172.31.36.109 -> 54.192.30.184 TCP 66 34406 > http [ACK] Seq=96 Ack=785815 Win=741504 Len=0 TSval=30416422 TSecr=695882053
195   0.108369 54.192.30.184 -> 172.31.36.109 TCP 14546 [TCP segment of a reassembled PDU]
196   0.108397 172.31.36.109 -> 54.192.30.184 TCP 66 34406 > http [ACK] Seq=96 Ack=800295 Win=742016 Len=0 TSval=30416422 TSecr=695882054
197   0.108405 54.192.30.184 -> 172.31.36.109 TCP 7306 [TCP segment of a reassembled PDU]
198   0.108425 172.31.36.109 -> 54.192.30.184 TCP 66 34406 > http [ACK] Seq=96 Ack=807535 Win=754048 Len=0 TSval=30416422 TSecr=695882054
199   0.108558 54.192.30.184 -> 172.31.36.109 TCP 13098 [TCP segment of a reassembled PDU]
200   0.108578 172.31.36.109 -> 54.192.30.184 TCP 66 34406 > http [ACK] Seq=96 Ack=820567 Win=764672 Len=0 TSval=30416422 TSecr=695882054
201   0.109258 54.192.30.184 -> 172.31.36.109 TCP 5858 [TCP segment of a reassembled PDU]
202   0.109274 172.31.36.109 -> 54.192.30.184 TCP 66 34406 > http [ACK] Seq=96 Ack=826359 Win=764672 Len=0 TSval=30416422 TSecr=695882054
203   0.109446 54.192.30.184 -> 172.31.36.109 TCP 18890 [TCP segment of a reassembled PDU]
204   0.109498 54.192.30.184 -> 172.31.36.109 TCP 10202 [TCP segment of a reassembled PDU]
205   0.109510 172.31.36.109 -> 54.192.30.184 TCP 66 34406 > http [ACK] Seq=96 Ack=855319 Win=735744 Len=0 TSval=30416422 TSecr=695882054
206   0.109645 54.192.30.184 -> 172.31.36.109 TCP 18890 [TCP segment of a reassembled PDU]
207   0.109712 54.192.30.184 -> 172.31.36.109 TCP 20338 [TCP segment of a reassembled PDU]
208   0.109782 172.31.36.109 -> 54.192.30.184 TCP 66 34406 > http [ACK] Seq=96 Ack=894415 Win=701568 Len=0 TSval=30416422 TSecr=695882054
209   0.110075 54.192.30.184 -> 172.31.36.109 TCP 7306 [TCP segment of a reassembled PDU]
210   0.110082 172.31.36.109 -> 54.192.30.184 TCP 66 34406 > http [ACK] Seq=96 Ack=901655 Win=754048 Len=0 TSval=30416422 TSecr=695882054
211   0.110198 54.192.30.184 -> 172.31.36.109 TCP 8754 [TCP segment of a reassembled PDU]
212   0.110215 172.31.36.109 -> 54.192.30.184 TCP 66 34406 > http [ACK] Seq=96 Ack=910343 Win=764672 Len=0 TSval=30416422 TSecr=695882054
213   0.110349 54.192.30.184 -> 172.31.36.109 TCP 23234 [TCP segment of a reassembled PDU]
214   0.110375 172.31.36.109 -> 54.192.30.184 TCP 66 34406 > http [ACK] Seq=96 Ack=933511 Win=741504 Len=0 TSval=30416422 TSecr=695882054
215   0.110798 54.192.30.184 -> 172.31.36.109 TCP 5858 [TCP segment of a reassembled PDU]
216   0.110829 172.31.36.109 -> 54.192.30.184 TCP 66 34406 > http [ACK] Seq=96 Ack=939303 Win=756352 Len=0 TSval=30416423 TSecr=695882054
217   0.110913 54.192.30.184 -> 172.31.36.109 TCP 4410 [TCP segment of a reassembled PDU]
218   0.110919 172.31.36.109 -> 54.192.30.184 TCP 66 34406 > http [ACK] Seq=96 Ack=943647 Win=758784 Len=0 TSval=30416423 TSecr=695882054
219   0.110993 54.192.30.184 -> 172.31.36.109 TCP 2962 [TCP segment of a reassembled PDU]
220   0.110997 172.31.36.109 -> 54.192.30.184 TCP 66 34406 > http [ACK] Seq=96 Ack=946543 Win=761088 Len=0 TSval=30416423 TSecr=695882054
221   0.111215 54.192.30.184 -> 172.31.36.109 TCP 13098 [TCP segment of a reassembled PDU]
222   0.111235 172.31.36.109 -> 54.192.30.184 TCP 66 34406 > http [ACK] Seq=96 Ack=959575 Win=764672 Len=0 TSval=30416423 TSecr=695882054
223   0.111333 54.192.30.184 -> 172.31.36.109 TCP 2962 [TCP segment of a reassembled PDU]
224   0.111375 172.31.36.109 -> 54.192.30.184 TCP 66 34406 > http [ACK] Seq=96 Ack=962471 Win=764672 Len=0 TSval=30416423 TSecr=695882054
225   0.111591 54.192.30.184 -> 172.31.36.109 TCP 43506 [TCP segment of a reassembled PDU]
226   0.111613 54.192.30.184 -> 172.31.36.109 TCP 4410 [TCP segment of a reassembled PDU]
227   0.111617 54.192.30.184 -> 172.31.36.109 TCP 1514 [TCP segment of a reassembled PDU]
228   0.111631 172.31.36.109 -> 54.192.30.184 TCP 66 34406 > http [ACK] Seq=96 Ack=1011703 Win=715520 Len=0 TSval=30416423 TSecr=695882054
229   0.111682 54.192.30.184 -> 172.31.36.109 TCP 7306 [TCP segment of a reassembled PDU]
230   0.111688 172.31.36.109 -> 54.192.30.184 TCP 66 34406 > http [ACK] Seq=96 Ack=1018943 Win=754048 Len=0 TSval=30416423 TSecr=695882054
231   0.111774 54.192.30.184 -> 172.31.36.109 TCP 5858 [TCP segment of a reassembled PDU]
232   0.111897 172.31.36.109 -> 54.192.30.184 TCP 66 34406 > http [ACK] Seq=96 Ack=1024735 Win=764672 Len=0 TSval=30416423 TSecr=695882054
233   0.112120 54.192.30.184 -> 172.31.36.109 TCP 20338 [TCP segment of a reassembled PDU]
234   0.112141 172.31.36.109 -> 54.192.30.184 TCP 66 34406 > http [ACK] Seq=96 Ack=1045007 Win=764672 Len=0 TSval=30416423 TSecr=695882054
235   0.112332 54.192.30.184 -> 172.31.36.109 HTTP 4093 HTTP/1.1 200 OK  (application/octet-stream)
236   0.112336 172.31.36.109 -> 54.192.30.184 TCP 66 34406 > http [ACK] Seq=96 Ack=1049034 Win=772736 Len=0 TSval=30416423 TSecr=695882054
237   0.112458 172.31.36.109 -> 54.192.30.184 TCP 66 34406 > http [FIN, ACK] Seq=96 Ack=1049034 Win=772736 Len=0 TSval=30416423 TSecr=695882054
238   0.113603 54.192.30.184 -> 172.31.36.109 TCP 66 http > 34406 [FIN, ACK] Seq=1049034 Ack=97 Win=14592 Len=0 TSval=695882054 TSecr=30416423
239   0.113624 172.31.36.109 -> 54.192.30.184 TCP 66 34406 > http [ACK] Seq=97 Ack=1049035 Win=772736 Len=0 TSval=30416423 TSecr=695882054
