[Measurement for 1kb at 22:00:53 16.00.2014] 
Tshark:

  1   0.000000  192.168.1.2 -> 54.230.98.50 TCP 66 49200→80 [SYN] Seq=0 Win=8192 Len=0 MSS=1460 WS=256 SACK_PERM=1
  2   0.058091 54.230.98.50 -> 192.168.1.2  TCP 66 80→49200 [SYN, ACK] Seq=0 Ack=1 Win=14600 Len=0 MSS=1400 SACK_PERM=1 WS=128
  3   0.058278  192.168.1.2 -> 54.230.98.50 TCP 54 49200→80 [ACK] Seq=1 Ack=1 Win=65792 Len=0
  4   0.068201  192.168.1.2 -> 54.230.98.50 HTTP 150 GET /1kb HTTP/1.1 
  5   0.099196 54.230.98.50 -> 192.168.1.2  TCP 54 80→49200 [ACK] Seq=1 Ack=97 Win=14720 Len=0
  6   0.102457 54.230.98.50 -> 192.168.1.2  TCP 1454 [TCP segment of a reassembled PDU]
  7   0.103358 54.230.98.50 -> 192.168.1.2  HTTP 132 HTTP/1.1 200 OK  (application/octet-stream)
  8   0.103495  192.168.1.2 -> 54.230.98.50 TCP 54 49200→80 [ACK] Seq=97 Ack=1479 Win=65792 Len=0
  9   0.103593  192.168.1.2 -> 54.230.98.50 TCP 54 49200→80 [FIN, ACK] Seq=97 Ack=1479 Win=65792 Len=0
 10   0.132423 54.230.98.50 -> 192.168.1.2  TCP 54 80→49200 [FIN, ACK] Seq=1479 Ack=98 Win=14720 Len=0
 11   0.132541  192.168.1.2 -> 54.230.98.50 TCP 54 49200→80 [ACK] Seq=98 Ack=1480 Win=65792 Len=0
 12   0.434756  192.168.1.2 -> 74.125.232.200 TCP 1454 [TCP segment of a reassembled PDU]
 13   0.434791  192.168.1.2 -> 74.125.232.200 TCP 1454 [TCP segment of a reassembled PDU]
 14   0.434814  192.168.1.2 -> 74.125.232.200 TLSv1.2 512 Application Data
 15   0.435374  192.168.1.2 -> 74.125.232.200 TLSv1.2 87 Application Data
 16   0.435694  192.168.1.2 -> 74.125.232.200 TCP 1454 [TCP segment of a reassembled PDU]
 17   0.435725  192.168.1.2 -> 74.125.232.200 TLSv1.2 389 Application Data
 18   0.490301 74.125.232.200 -> 192.168.1.2  TCP 54 443→65381 [ACK] Seq=1 Ack=1401 Win=6103 Len=0
 19   0.494464 74.125.232.200 -> 192.168.1.2  TCP 54 443→65381 [ACK] Seq=1 Ack=2801 Win=6103 Len=0
 20   0.495287 74.125.232.200 -> 192.168.1.2  TCP 54 443→65381 [ACK] Seq=1 Ack=3259 Win=6103 Len=0
 21   0.495287 74.125.232.200 -> 192.168.1.2  TCP 54 443→65381 [ACK] Seq=1 Ack=3292 Win=6103 Len=0
 22   0.495288 74.125.232.200 -> 192.168.1.2  TCP 54 443→65381 [ACK] Seq=1 Ack=4692 Win=6103 Len=0
 23   0.495289 74.125.232.200 -> 192.168.1.2  TCP 54 443→65381 [ACK] Seq=1 Ack=5027 Win=6103 Len=0
 24   0.495289 74.125.232.200 -> 192.168.1.2  TLSv1.2 87 Application Data
 25   0.522402 74.125.232.200 -> 192.168.1.2  TLSv1.2 105 Application Data
 26   0.522499  192.168.1.2 -> 74.125.232.200 TCP 54 65381→443 [ACK] Seq=5027 Ack=85 Win=253 Len=0
 27   0.524359 74.125.232.200 -> 192.168.1.2  TLSv1.2 132 Application Data
 28   0.525759 74.125.232.200 -> 192.168.1.2  TLSv1.2 93 Application Data
 29   0.525761 74.125.232.200 -> 192.168.1.2  TLSv1.2 87 Application Data
 30   0.525826  192.168.1.2 -> 74.125.232.200 TCP 54 65381→443 [ACK] Seq=5027 Ack=235 Win=252 Len=0
 31   0.527770  192.168.1.2 -> 74.125.232.200 TLSv1.2 87 Application Data
 32   0.601236 74.125.232.200 -> 192.168.1.2  TCP 54 443→65381 [ACK] Seq=235 Ack=5060 Win=6103 Len=0
 33   0.694517 fe80::446a:b521:8794:ef65 -> fe80::5ef9:6aff:fe25:83d4 DNS 96 Standard query 0x4d1b  A s3.amazonaws.com
 34   0.733716 fe80::5ef9:6aff:fe25:83d4 -> fe80::446a:b521:8794:ef65 DNS 154 Standard query response 0x4d1b  CNAME s3.a-geo.amazonaws.com CNAME s3-1.amazonaws.com A 54.231.96.112
 35   0.735042  192.168.1.2 -> 54.231.96.112 TCP 66 49201→443 [SYN] Seq=0 Win=8192 Len=0 MSS=1460 WS=256 SACK_PERM=1
 36   0.873372 54.231.96.112 -> 192.168.1.2  TCP 66 443→49201 [SYN, ACK] Seq=0 Ack=1 Win=8190 Len=0 MSS=1360 WS=64 SACK_PERM=1
 37   0.873501  192.168.1.2 -> 54.231.96.112 TCP 54 49201→443 [ACK] Seq=1 Ack=1 Win=66560 Len=0
 38   0.874008  192.168.1.2 -> 54.231.96.112 SSL 298 Client Hello
 39   0.995929  192.168.1.2 -> 64.233.164.125 TCP 55 [TCP segment of a reassembled PDU]
 40   1.012931 54.231.96.112 -> 192.168.1.2  TCP 54 [TCP Window Update] 443→49201 [ACK] Seq=1 Ack=1 Win=8128 Len=0
 41   1.017287 54.231.96.112 -> 192.168.1.2  TCP 54 443→49201 [ACK] Seq=1 Ack=245 Win=7936 Len=0
 42   1.022890 54.231.96.112 -> 192.168.1.2  TLSv1.2 1414 Server Hello
 43   1.022891 54.231.96.112 -> 192.168.1.2  TCP 1414 [TCP segment of a reassembled PDU]
 44   1.022892 54.231.96.112 -> 192.168.1.2  TCP 1414 [TCP segment of a reassembled PDU]
 45   1.022991  192.168.1.2 -> 54.231.96.112 TCP 54 49201→443 [ACK] Seq=245 Ack=4081 Win=66560 Len=0
