[Measurement for 1kb at 13:38:59 16.38.2014] 
Ping request could not find host d2j3h070v7ssnq.cloudfront.net. Please check the name and try again.

Tshark:

  1   0.000000   82.96.58.7 -> 192.168.1.2  SSL 1400 Continuation Data
  2   0.000002   82.96.58.7 -> 192.168.1.2  TCP 1454 [TCP segment of a reassembled PDU]
  3   0.000003   82.96.58.7 -> 192.168.1.2  TCP 1454 [TCP segment of a reassembled PDU]
  4   0.000005   82.96.58.7 -> 192.168.1.2  TLSv1.2 1400 Application Data
  5   0.000006   82.96.58.7 -> 192.168.1.2  TCP 1454 [TCP segment of a reassembled PDU]
  6   0.000007   82.96.58.7 -> 192.168.1.2  TCP 1454 [TCP segment of a reassembled PDU]
  7   0.000009   82.96.58.7 -> 192.168.1.2  TLSv1.2 1303 Application Data
  8   0.000010   82.96.58.7 -> 192.168.1.2  TCP 1454 [TCP segment of a reassembled PDU]
  9   0.000011   82.96.58.7 -> 192.168.1.2  TCP 1454 [TCP segment of a reassembled PDU]
 10   0.000012   82.96.58.7 -> 192.168.1.2  TLSv1.2 1400 Application Data
 11   0.000090  192.168.1.2 -> 82.96.58.7   TCP 74 [TCP ACKed unseen segment] 61649→443 [ACK] Seq=1 Ack=20634 Win=568 Len=0 SLE=1 SRE=1347 SLE=27634 SRE=54234
 12   0.000230  192.168.1.2 -> 82.96.58.7   TCP 74 [TCP Dup ACK 11#1] [TCP ACKed unseen segment] 61649→443 [ACK] Seq=1 Ack=20634 Win=568 Len=0 SLE=1347 SRE=2747 SLE=27634 SRE=54234
 13   0.000302  192.168.1.2 -> 82.96.58.7   TCP 74 [TCP Dup ACK 11#2] [TCP ACKed unseen segment] 61649→443 [ACK] Seq=1 Ack=20634 Win=568 Len=0 SLE=2747 SRE=4147 SLE=27634 SRE=54234
 14   0.000376  192.168.1.2 -> 82.96.58.7   TCP 74 [TCP Dup ACK 11#3] [TCP ACKed unseen segment] 61649→443 [ACK] Seq=1 Ack=20634 Win=568 Len=0 SLE=4147 SRE=5493 SLE=27634 SRE=54234
 15   0.000451  192.168.1.2 -> 82.96.58.7   TCP 74 [TCP Dup ACK 11#4] [TCP ACKed unseen segment] 61649→443 [ACK] Seq=1 Ack=20634 Win=568 Len=0 SLE=5493 SRE=6893 SLE=27634 SRE=54234
 16   0.000524  192.168.1.2 -> 82.96.58.7   TCP 74 [TCP Dup ACK 11#5] [TCP ACKed unseen segment] 61649→443 [ACK] Seq=1 Ack=20634 Win=568 Len=0 SLE=6893 SRE=8293 SLE=27634 SRE=54234
 17   0.000593  192.168.1.2 -> 82.96.58.7   TCP 74 [TCP Dup ACK 11#6] [TCP ACKed unseen segment] 61649→443 [ACK] Seq=1 Ack=20634 Win=568 Len=0 SLE=8293 SRE=9542 SLE=27634 SRE=54234
 18   0.000654  192.168.1.2 -> 82.96.58.7   TCP 74 [TCP Dup ACK 11#7] [TCP ACKed unseen segment] 61649→443 [ACK] Seq=1 Ack=20634 Win=568 Len=0 SLE=9542 SRE=10942 SLE=27634 SRE=54234
 19   0.000706  192.168.1.2 -> 82.96.58.7   TCP 74 [TCP Dup ACK 11#8] [TCP ACKed unseen segment] 61649→443 [ACK] Seq=1 Ack=20634 Win=568 Len=0 SLE=10942 SRE=12342 SLE=27634 SRE=54234
 20   0.000759  192.168.1.2 -> 82.96.58.7   TCP 74 [TCP Dup ACK 11#9] [TCP ACKed unseen segment] 61649→443 [ACK] Seq=1 Ack=20634 Win=568 Len=0 SLE=12342 SRE=13688 SLE=27634 SRE=54234
 21   0.000836   82.96.58.7 -> 192.168.1.2  TCP 1454 [TCP segment of a reassembled PDU]
 22   0.000837   82.96.58.7 -> 192.168.1.2  TCP 1454 [TCP segment of a reassembled PDU]
 23   0.000838   82.96.58.7 -> 192.168.1.2  TLSv1.2 1400 Application Data
 24   0.000839   82.96.58.7 -> 192.168.1.2  TCP 1454 [TCP segment of a reassembled PDU]
 25   0.000841   82.96.58.7 -> 192.168.1.2  TCP 1454 [TCP segment of a reassembled PDU]
 26   0.000842   82.96.58.7 -> 192.168.1.2  TLSv1.2 1454 Application Data
 27   0.000843   82.96.58.7 -> 192.168.1.2  TCP 1454 [TCP segment of a reassembled PDU]
 28   0.000844   82.96.58.7 -> 192.168.1.2  TCP 1454 [TCP segment of a reassembled PDU]
 29   0.000845   82.96.58.7 -> 192.168.1.2  TLSv1.2 1454 Application Data
 30   0.000846   82.96.58.7 -> 192.168.1.2  TCP 1454 [TCP segment of a reassembled PDU]
 31   0.000876  192.168.1.2 -> 82.96.58.7   TCP 74 [TCP Dup ACK 11#10] 61649→443 [ACK] Seq=1 Ack=20634 Win=568 Len=0 SLE=13688 SRE=15088 SLE=27634 SRE=54234
 32   0.000952  192.168.1.2 -> 82.96.58.7   TCP 74 [TCP Dup ACK 11#11] 61649→443 [ACK] Seq=1 Ack=20634 Win=568 Len=0 SLE=15088 SRE=16488 SLE=27634 SRE=54234
 33   0.001029  192.168.1.2 -> 82.96.58.7   TCP 74 [TCP Dup ACK 11#12] 61649→443 [ACK] Seq=1 Ack=20634 Win=568 Len=0 SLE=16488 SRE=17834 SLE=27634 SRE=54234
 34   0.001101  192.168.1.2 -> 82.96.58.7   TCP 74 [TCP Dup ACK 11#13] 61649→443 [ACK] Seq=1 Ack=20634 Win=568 Len=0 SLE=17834 SRE=19234 SLE=27634 SRE=54234
 35   0.001154  192.168.1.2 -> 82.96.58.7   TCP 74 [TCP Dup ACK 11#14] 61649→443 [ACK] Seq=1 Ack=20634 Win=568 Len=0 SLE=19234 SRE=20634 SLE=27634 SRE=54234
 36   0.001223  192.168.1.2 -> 82.96.58.7   TCP 66 61649→443 [ACK] Seq=1 Ack=22034 Win=585 Len=0 SLE=27634 SRE=54234
 37   0.001285  192.168.1.2 -> 82.96.58.7   TCP 66 61649→443 [ACK] Seq=1 Ack=23434 Win=585 Len=0 SLE=27634 SRE=54234
 38   0.001340  192.168.1.2 -> 82.96.58.7   TCP 66 61649→443 [ACK] Seq=1 Ack=24834 Win=585 Len=0 SLE=27634 SRE=54234
 39   0.001394  192.168.1.2 -> 82.96.58.7   TCP 66 61649→443 [ACK] Seq=1 Ack=26234 Win=585 Len=0 SLE=27634 SRE=54234
 40   0.001502  192.168.1.2 -> 82.96.58.7   TCP 54 [TCP ACKed unseen segment] 61649→443 [ACK] Seq=1 Ack=54234 Win=585 Len=0
 41   0.001654   82.96.58.7 -> 192.168.1.2  TCP 1454 [TCP segment of a reassembled PDU]
 42   0.001655   82.96.58.7 -> 192.168.1.2  TLSv1.2 1454 Application Data
 43   0.001656   82.96.58.7 -> 192.168.1.2  TCP 1454 [TCP segment of a reassembled PDU]
 44   0.001657   82.96.58.7 -> 192.168.1.2  TCP 1454 [TCP segment of a reassembled PDU]
 45   0.001659   82.96.58.7 -> 192.168.1.2  TLSv1.2 1454 Application Data
 46   0.001660   82.96.58.7 -> 192.168.1.2  TCP 1454 [TCP segment of a reassembled PDU]
 47   0.001661   82.96.58.7 -> 192.168.1.2  TCP 1454 [TCP segment of a reassembled PDU]
 48   0.001662   82.96.58.7 -> 192.168.1.2  TLSv1.2 1454 Application Data
 49   0.001664   82.96.58.7 -> 192.168.1.2  TCP 1454 [TCP segment of a reassembled PDU]
 50   0.001665   82.96.58.7 -> 192.168.1.2  TCP 1454 [TCP segment of a reassembled PDU]
 51   0.001696  192.168.1.2 -> 82.96.58.7   TCP 66 [TCP Dup ACK 40#1] [TCP ACKed unseen segment] 61649→443 [ACK] Seq=1 Ack=54234 Win=585 Len=0 SLE=27634 SRE=29034
 52   0.001771  192.168.1.2 -> 82.96.58.7   TCP 66 [TCP Dup ACK 40#2] [TCP ACKed unseen segment] 61649→443 [ACK] Seq=1 Ack=54234 Win=585 Len=0 SLE=29034 SRE=30434
 53   0.001837  192.168.1.2 -> 82.96.58.7   TCP 66 [TCP Dup ACK 40#3] [TCP ACKed unseen segment] 61649→443 [ACK] Seq=1 Ack=54234 Win=585 Len=0 SLE=30434 SRE=31834
 54   0.001907  192.168.1.2 -> 82.96.58.7   TCP 66 [TCP Dup ACK 40#4] [TCP ACKed unseen segment] 61649→443 [ACK] Seq=1 Ack=54234 Win=585 Len=0 SLE=31834 SRE=33234
 55   0.001972  192.168.1.2 -> 82.96.58.7   TCP 66 [TCP Dup ACK 40#5] [TCP ACKed unseen segment] 61649→443 [ACK] Seq=1 Ack=54234 Win=585 Len=0 SLE=33234 SRE=34634
 56   0.002025  192.168.1.2 -> 82.96.58.7   TCP 66 [TCP Dup ACK 40#6] [TCP ACKed unseen segment] 61649→443 [ACK] Seq=1 Ack=54234 Win=585 Len=0 SLE=34634 SRE=36034
 57   0.002075  192.168.1.2 -> 82.96.58.7   TCP 66 [TCP Dup ACK 40#7] [TCP ACKed unseen segment] 61649→443 [ACK] Seq=1 Ack=54234 Win=585 Len=0 SLE=36034 SRE=37434
 58   0.002138  192.168.1.2 -> 82.96.58.7   TCP 66 [TCP Dup ACK 40#8] [TCP ACKed unseen segment] 61649→443 [ACK] Seq=1 Ack=54234 Win=585 Len=0 SLE=37434 SRE=38834
 59   0.002195  192.168.1.2 -> 82.96.58.7   TCP 66 [TCP Dup ACK 40#9] [TCP ACKed unseen segment] 61649→443 [ACK] Seq=1 Ack=54234 Win=585 Len=0 SLE=38834 SRE=40234
 60   0.002245  192.168.1.2 -> 82.96.58.7   TCP 66 [TCP Dup ACK 40#10] [TCP ACKed unseen segment] 61649→443 [ACK] Seq=1 Ack=54234 Win=585 Len=0 SLE=40234 SRE=41634
 61   0.002394   82.96.58.7 -> 192.168.1.2  TLSv1.2 1454 Application Data
 62   0.002395   82.96.58.7 -> 192.168.1.2  TCP 1454 [TCP segment of a reassembled PDU]
 63   0.002395   82.96.58.7 -> 192.168.1.2  TCP 1454 [TCP segment of a reassembled PDU]
 64   0.002397   82.96.58.7 -> 192.168.1.2  TLSv1.2 1454 Application Data
 65   0.002398   82.96.58.7 -> 192.168.1.2  TCP 1454 [TCP segment of a reassembled PDU]
 66   0.002399   82.96.58.7 -> 192.168.1.2  TCP 1454 [TCP segment of a reassembled PDU]
 67   0.002400   82.96.58.7 -> 192.168.1.2  TLSv1.2 1454 Application Data
 68   0.002401   82.96.58.7 -> 192.168.1.2  TCP 1454 [TCP segment of a reassembled PDU]
 69   0.002402   82.96.58.7 -> 192.168.1.2  TCP 1454 [TCP segment of a reassembled PDU]
 70   0.002403   82.96.58.7 -> 192.168.1.2  TLSv1.2 1454 Application Data
 71   0.002440  192.168.1.2 -> 82.96.58.7   TCP 66 [TCP Dup ACK 40#11] 61649→443 [ACK] Seq=1 Ack=54234 Win=585 Len=0 SLE=41634 SRE=43034
 72   0.002519  192.168.1.2 -> 82.96.58.7   TCP 66 [TCP Dup ACK 40#12] 61649→443 [ACK] Seq=1 Ack=54234 Win=585 Len=0 SLE=43034 SRE=44434
 73   0.002586  192.168.1.2 -> 82.96.58.7   TCP 66 [TCP Dup ACK 40#13] 61649→443 [ACK] Seq=1 Ack=54234 Win=585 Len=0 SLE=44434 SRE=45834
 74   0.002639  192.168.1.2 -> 82.96.58.7   TCP 66 [TCP Dup ACK 40#14] 61649→443 [ACK] Seq=1 Ack=54234 Win=585 Len=0 SLE=45834 SRE=47234
 75   0.002688  192.168.1.2 -> 82.96.58.7   TCP 66 [TCP Dup ACK 40#15] 61649→443 [ACK] Seq=1 Ack=54234 Win=585 Len=0 SLE=47234 SRE=48634
 76   0.002780  192.168.1.2 -> 82.96.58.7   TCP 66 [TCP Dup ACK 40#16] 61649→443 [ACK] Seq=1 Ack=54234 Win=585 Len=0 SLE=48634 SRE=50034
 77   0.002835  192.168.1.2 -> 82.96.58.7   TCP 66 [TCP Dup ACK 40#17] 61649→443 [ACK] Seq=1 Ack=54234 Win=585 Len=0 SLE=50034 SRE=51434
 78   0.002894  192.168.1.2 -> 82.96.58.7   TCP 66 [TCP Dup ACK 40#18] 61649→443 [ACK] Seq=1 Ack=54234 Win=585 Len=0 SLE=51434 SRE=52834
 79   0.002985  192.168.1.2 -> 82.96.58.7   TCP 66 [TCP Dup ACK 40#19] 61649→443 [ACK] Seq=1 Ack=54234 Win=585 Len=0 SLE=52834 SRE=54234
 80   0.003156   82.96.58.7 -> 192.168.1.2  TCP 1454 [TCP segment of a reassembled PDU]
 81   0.003156   82.96.58.7 -> 192.168.1.2  TCP 1454 [TCP segment of a reassembled PDU]
 82   0.003157   82.96.58.7 -> 192.168.1.2  TLSv1.2 1454 Application Data
 83   0.003159   82.96.58.7 -> 192.168.1.2  TCP 1454 [TCP segment of a reassembled PDU]
 84   0.003160   82.96.58.7 -> 192.168.1.2  TCP 1454 [TCP segment of a reassembled PDU]
 85   0.003160   82.96.58.7 -> 192.168.1.2  TLSv1.2 1454 Application Data
 86   0.003161   82.96.58.7 -> 192.168.1.2  TCP 1454 [TCP segment of a reassembled PDU]
 87   0.003162   82.96.58.7 -> 192.168.1.2  TCP 1454 [TCP segment of a reassembled PDU]
 88   0.003163   82.96.58.7 -> 192.168.1.2  TLSv1.2 1454 Application Data
 89   0.003164   82.96.58.7 -> 192.168.1.2  TLSv1.2 141 Application Data
 90   0.003210  192.168.1.2 -> 82.96.58.7   TCP 54 61649→443 [ACK] Seq=1 Ack=68321 Win=585 Len=0
 91   0.003384   82.96.58.7 -> 192.168.1.2  TCP 1454 [TCP Out-Of-Order] 443→61649 [ACK] Seq=20634 Ack=1 Win=887 Len=1400[Reassembly error, protocol TCP: New fragment overlaps old data (retransmission?)]
 92   0.003416  192.168.1.2 -> 82.96.58.7   TCP 66 [TCP Dup ACK 90#1] 61649→443 [ACK] Seq=1 Ack=68321 Win=585 Len=0 SLE=20634 SRE=22034
 93   0.604934   82.96.58.7 -> 192.168.1.2  TCP 1454 [TCP Spurious Retransmission] 443→61649 [ACK] Seq=22034 Ack=1 Win=887 Len=1400[Reassembly error, protocol TCP: New fragment overlaps old data (retransmission?)]
 94   0.605055  192.168.1.2 -> 82.96.58.7   TCP 66 [TCP Dup ACK 90#2] 61649→443 [ACK] Seq=1 Ack=68321 Win=585 Len=0 SLE=22034 SRE=23434
 95   0.608435   82.96.58.7 -> 192.168.1.2  TCP 1454 [TCP Spurious Retransmission] 443→61649 [ACK] Seq=26234 Ack=1 Win=887 Len=1400[Reassembly error, protocol TCP: New fragment overlaps old data (retransmission?)]
 96   0.608437   82.96.58.7 -> 192.168.1.2  TCP 1454 [TCP Spurious Retransmission] 443→61649 [ACK] Seq=54234 Ack=1 Win=887 Len=1400[Reassembly error, protocol TCP: New fragment overlaps old data (retransmission?)]
 97   0.608493  192.168.1.2 -> 82.96.58.7   TCP 66 [TCP Dup ACK 90#3] 61649→443 [ACK] Seq=1 Ack=68321 Win=585 Len=0 SLE=26234 SRE=27634
 98   0.608617  192.168.1.2 -> 82.96.58.7   TCP 66 [TCP Dup ACK 90#4] 61649→443 [ACK] Seq=1 Ack=68321 Win=585 Len=0 SLE=54234 SRE=55634
 99   0.612736   82.96.58.7 -> 192.168.1.2  TCP 1454 [TCP Spurious Retransmission] 443→61649 [ACK] Seq=57034 Ack=1 Win=887 Len=1400[Reassembly error, protocol TCP: New fragment overlaps old data (retransmission?)]
100   0.612738   82.96.58.7 -> 192.168.1.2  TCP 1454 [TCP Spurious Retransmission] 443→61649 [ACK] Seq=58434 Ack=1 Win=887 Len=1400[Reassembly error, protocol TCP: New fragment overlaps old data (retransmission?)]
101   0.612807  192.168.1.2 -> 82.96.58.7   TCP 66 [TCP Dup ACK 90#5] 61649→443 [ACK] Seq=1 Ack=68321 Win=585 Len=0 SLE=57034 SRE=58434
102   0.612935  192.168.1.2 -> 82.96.58.7   TCP 66 [TCP Dup ACK 90#6] 61649→443 [ACK] Seq=1 Ack=68321 Win=585 Len=0 SLE=58434 SRE=59834
103   2.012211 fe80::446a:b521:8794:ef65 -> fe80::5ef9:6aff:fe25:83d4 DNS 98 Standard query 0x4163  A www.googleapis.com
104   2.137533  192.168.1.2 -> 192.168.1.1  DNS 78 Standard query 0x4163  A www.googleapis.com
105   2.428020  192.168.1.2 -> 74.125.232.193 TCP 1454 [TCP segment of a reassembled PDU]
106   2.428043  192.168.1.2 -> 74.125.232.193 TCP 1454 [TCP segment of a reassembled PDU]
107   2.428056  192.168.1.2 -> 74.125.232.193 TLSv1.2 517 Application Data
108   2.428623  192.168.1.2 -> 74.125.232.193 TCP 1454 [TCP segment of a reassembled PDU]
109   2.428641  192.168.1.2 -> 74.125.232.193 TLSv1.2 381 Application Data
110   2.728070  192.168.1.2 -> 74.125.232.193 TCP 1454 [TCP Retransmission] 61130→443 [ACK] Seq=1 Ack=1 Win=254 Len=1400
111   2.870494  192.168.1.1 -> 192.168.1.2  DNS 94 Standard query response 0x4163  A 64.233.164.95
112   2.871631  192.168.1.2 -> 64.233.164.95 TCP 66 61684→443 [SYN] Seq=0 Win=8192 Len=0 MSS=1460 WS=256 SACK_PERM=1
113   2.871725 74.125.232.193 -> 192.168.1.2  TCP 54 443→61130 [ACK] Seq=1 Ack=1401 Win=1373 Len=0
114   2.871726 74.125.232.193 -> 192.168.1.2  TCP 54 443→61130 [ACK] Seq=1 Ack=2801 Win=1363 Len=0
115   2.871727 74.125.232.193 -> 192.168.1.2  TCP 54 443→61130 [ACK] Seq=1 Ack=3264 Win=1360 Len=0
116   2.871727 74.125.232.193 -> 192.168.1.2  TCP 54 443→61130 [ACK] Seq=1 Ack=4664 Win=1350 Len=0
117   2.871792  192.168.1.2 -> 74.125.232.193 TCP 381 [TCP Retransmission] 61130→443 [PSH, ACK] Seq=4664 Ack=1 Win=254 Len=327[Reassembly error, protocol TCP: New fragment overlaps old data (retransmission?)]
118   2.902153 74.125.232.193 -> 192.168.1.2  TCP 66 [TCP Previous segment not captured] 443→61130 [ACK] Seq=200 Ack=4991 Win=1373 Len=0 SLE=4664 SRE=4991
119   2.905405 64.233.164.95 -> 192.168.1.2  TCP 66 443→61684 [SYN, ACK] Seq=0 Ack=1 Win=42900 Len=0 MSS=1400 SACK_PERM=1 WS=128
120   2.905534  192.168.1.2 -> 64.233.164.95 TCP 54 61684→443 [ACK] Seq=1 Ack=1 Win=65792 Len=0
121   2.906045  192.168.1.2 -> 64.233.164.95 SSL 571 Client Hello
122   2.942685 64.233.164.95 -> 192.168.1.2  TCP 54 443→61684 [ACK] Seq=1 Ack=518 Win=44032 Len=0
123   2.945800 64.233.164.95 -> 192.168.1.2  TLSv1.2 198 Server Hello, Change Cipher Spec, Encrypted Handshake Message
124   2.946666  192.168.1.2 -> 64.233.164.95 TLSv1.2 97 Change Cipher Spec, Encrypted Handshake Message
125   2.947743  192.168.1.2 -> 64.233.164.95 TLSv1.2 103 Application Data
126   2.947918  192.168.1.2 -> 64.233.164.95 TLSv1.2 91 Application Data
127   2.948049  192.168.1.2 -> 64.233.164.95 TLSv1.2 111 Application Data
128   2.948678  192.168.1.2 -> 64.233.164.95 TLSv1.2 428 Application Data
129   2.948884  192.168.1.2 -> 64.233.164.95 TLSv1.2 1129 Application Data
130   2.995133 64.233.164.95 -> 192.168.1.2  TLSv1.2 103 Application Data
131   2.997287 64.233.164.95 -> 192.168.1.2  TLSv1.2 91 Application Data
132   2.997382  192.168.1.2 -> 64.233.164.95 TCP 54 61684→443 [ACK] Seq=2153 Ack=231 Win=65536 Len=0
133   3.000514 64.233.164.95 -> 192.168.1.2  TCP 54 443→61684 [ACK] Seq=231 Ack=647 Win=44032 Len=0
134   3.008538 64.233.164.95 -> 192.168.1.2  TCP 54 443→61684 [ACK] Seq=231 Ack=1078 Win=45056 Len=0
135   3.042498 64.233.164.95 -> 192.168.1.2  TLSv1.2 415 Application Data
136   3.046194 64.233.164.95 -> 192.168.1.2  TLSv1.2 178 Application Data
137   3.046195 64.233.164.95 -> 192.168.1.2  TLSv1.2 87 Application Data
138   3.046283  192.168.1.2 -> 64.233.164.95 TCP 54 61684→443 [ACK] Seq=2153 Ack=749 Win=65024 Len=0
139   3.046863  192.168.1.2 -> 64.233.164.95 TLSv1.2 87 Application Data
140   3.058508 fe80::446a:b521:8794:ef65 -> fe80::5ef9:6aff:fe25:83d4 DNS 99 Standard query 0x6a5e  A maps.googleapis.com
141   3.089969 fe80::5ef9:6aff:fe25:83d4 -> fe80::446a:b521:8794:ef65 DNS 149 Standard query response 0x6a5e  CNAME googleapis.l.google.com A 64.233.164.95
142   3.090980  192.168.1.2 -> 64.233.164.95 TCP 66 61685→443 [SYN] Seq=0 Win=8192 Len=0 MSS=1460 WS=256 SACK_PERM=1
143   3.123463 64.233.164.95 -> 192.168.1.2  TCP 54 443→61684 [ACK] Seq=749 Ack=2186 Win=47232 Len=0
144   3.124420 64.233.164.95 -> 192.168.1.2  TCP 66 443→61685 [SYN, ACK] Seq=0 Ack=1 Win=42900 Len=0 MSS=1400 SACK_PERM=1 WS=128
145   3.124525  192.168.1.2 -> 64.233.164.95 TCP 54 61685→443 [ACK] Seq=1 Ack=1 Win=65792 Len=0
146   3.124867  192.168.1.2 -> 64.233.164.95 SSL 571 Client Hello
147   3.166890 64.233.164.95 -> 192.168.1.2  TCP 54 443→61685 [ACK] Seq=1 Ack=518 Win=44032 Len=0
148   3.167376 64.233.164.95 -> 192.168.1.2  TLSv1.2 198 Server Hello, Change Cipher Spec, Encrypted Handshake Message
149   3.167870  192.168.1.2 -> 64.233.164.95 TLSv1.2 97 Change Cipher Spec, Encrypted Handshake Message
150   3.168784  192.168.1.2 -> 64.233.164.95 TLSv1.2 103 Application Data
151   3.168883  192.168.1.2 -> 64.233.164.95 TLSv1.2 91 Application Data
152   3.168955  192.168.1.2 -> 64.233.164.95 TLSv1.2 111 Application Data
153   3.169525  192.168.1.2 -> 64.233.164.95 TLSv1.2 575 Application Data
154   3.201610 64.233.164.95 -> 192.168.1.2  TLSv1.2 103 Application Data
155   3.202449 64.233.164.95 -> 192.168.1.2  TLSv1.2 91 Application Data
156   3.202510  192.168.1.2 -> 64.233.164.95 TCP 54 61685→443 [ACK] Seq=1225 Ack=231 Win=65536 Len=0
157   3.207814 64.233.164.95 -> 192.168.1.2  TCP 54 443→61685 [ACK] Seq=231 Ack=647 Win=44032 Len=0
158   3.211618 64.233.164.95 -> 192.168.1.2  TCP 54 443→61685 [ACK] Seq=231 Ack=1225 Win=45056 Len=0
159   3.217876 64.233.164.95 -> 192.168.1.2  TLSv1.2 331 Application Data
160   3.219078 64.233.164.95 -> 192.168.1.2  TLSv1.2 211 Application Data
161   3.219079 64.233.164.95 -> 192.168.1.2  TLSv1.2 87 Application Data
162   3.219135  192.168.1.2 -> 64.233.164.95 TCP 54 61685→443 [ACK] Seq=1225 Ack=698 Win=65024 Len=0
163   3.219450  192.168.1.2 -> 64.233.164.95 TLSv1.2 87 Application Data
164   3.292600 64.233.164.95 -> 192.168.1.2  TCP 54 443→61685 [ACK] Seq=698 Ack=1258 Win=45056 Len=0
165   3.355402 74.125.232.193 -> 192.168.1.2  TLSv1.2 103 [TCP Retransmission] Application Data
166   3.405649  192.168.1.2 -> 74.125.232.193 TCP 54 61130→443 [ACK] Seq=4991 Ack=50 Win=253 Len=0
167   3.432797 74.125.232.193 -> 192.168.1.2  TLSv1.2 132 [TCP Retransmission] Application Data
168   3.440615 74.125.232.193 -> 192.168.1.2  TLSv1.2 93 [TCP Retransmission] Application Data
169   3.440687  192.168.1.2 -> 74.125.232.193 TCP 54 61130→443 [ACK] Seq=4991 Ack=167 Win=253 Len=0
170   3.468512 74.125.232.193 -> 192.168.1.2  TLSv1.2 87 [TCP Retransmission] Application Data
171   3.468886  192.168.1.2 -> 74.125.232.193 TLSv1.2 87 Application Data
172   3.497663 74.125.232.193 -> 192.168.1.2  TCP 54 443→61130 [ACK] Seq=200 Ack=5024 Win=1373 Len=0
173   5.050591 fe80::446a:b521:8794:ef65 -> fe80::5ef9:6aff:fe25:83d4 DNS 99 Standard query 0xa7bd  A clients4.google.com
174   5.096285 fe80::5ef9:6aff:fe25:83d4 -> fe80::446a:b521:8794:ef65 DNS 299 Standard query response 0xa7bd  CNAME clients.l.google.com A 74.125.232.206 A 74.125.232.201 A 74.125.232.193 A 74.125.232.196 A 74.125.232.195 A 74.125.232.197 A 74.125.232.200 A 74.125.232.192 A 74.125.232.199 A 74.125.232.194 A 74.125.232.198
175   5.097442  192.168.1.2 -> 74.125.232.206 TCP 66 61686→443 [SYN] Seq=0 Win=8192 Len=0 MSS=1460 WS=256 SACK_PERM=1
176   5.156156 74.125.232.206 -> 192.168.1.2  TCP 66 443→61686 [SYN, ACK] Seq=0 Ack=1 Win=42900 Len=0 MSS=1400 SACK_PERM=1 WS=128
177   5.156285  192.168.1.2 -> 74.125.232.206 TCP 54 61686→443 [ACK] Seq=1 Ack=1 Win=65792 Len=0
178   5.156631  192.168.1.2 -> 74.125.232.206 SSL 571 Client Hello
179   5.187511 74.125.232.206 -> 192.168.1.2  TCP 54 443→61686 [ACK] Seq=1 Ack=518 Win=44032 Len=0
180   5.189906 74.125.232.206 -> 192.168.1.2  TLSv1.2 198 Server Hello, Change Cipher Spec, Encrypted Handshake Message
181   5.190465  192.168.1.2 -> 74.125.232.206 TLSv1.2 97 Change Cipher Spec, Encrypted Handshake Message
182   5.191351  192.168.1.2 -> 74.125.232.206 TLSv1.2 103 Application Data
183   5.191482  192.168.1.2 -> 74.125.232.206 TLSv1.2 91 Application Data
184   5.191580  192.168.1.2 -> 74.125.232.206 TLSv1.2 111 Application Data
185   5.192027  192.168.1.2 -> 74.125.232.206 TLSv1.2 464 Application Data
186   5.192246  192.168.1.2 -> 74.125.232.206 TCP 1454 [TCP segment of a reassembled PDU]
187   5.192257  192.168.1.2 -> 74.125.232.206 TCP 1454 [TCP segment of a reassembled PDU]
188   5.192274  192.168.1.2 -> 74.125.232.206 TLSv1.2 135 Application Data
189   5.192547  192.168.1.2 -> 74.125.232.206 TCP 1454 [TCP segment of a reassembled PDU]
190   5.192557  192.168.1.2 -> 74.125.232.206 TLSv1.2 502 Application Data
191   5.214980 74.125.232.206 -> 192.168.1.2  TLSv1.2 103 Application Data
192   5.215964 74.125.232.206 -> 192.168.1.2  TLSv1.2 91 Application Data
193   5.216549  192.168.1.2 -> 74.125.232.206 TCP 54 61686→443 [ACK] Seq=5843 Ack=231 Win=65536 Len=0
194   5.219714 74.125.232.206 -> 192.168.1.2  TCP 54 443→61686 [ACK] Seq=231 Ack=647 Win=44032 Len=0
195   5.223973 74.125.232.206 -> 192.168.1.2  TCP 54 443→61686 [ACK] Seq=231 Ack=1114 Win=45056 Len=0
196   5.237658 74.125.232.206 -> 192.168.1.2  TCP 54 443→61686 [ACK] Seq=231 Ack=3914 Win=50688 Len=0
197   5.242020 74.125.232.206 -> 192.168.1.2  TCP 54 443→61686 [ACK] Seq=231 Ack=5395 Win=53504 Len=0
198   5.246415 74.125.232.206 -> 192.168.1.2  TLSv1.2 357 Application Data
199   5.247507 74.125.232.206 -> 192.168.1.2  TLSv1.2 1454 Application Data
200   5.247569  192.168.1.2 -> 74.125.232.206 TCP 54 61686→443 [ACK] Seq=5843 Ack=1934 Win=65792 Len=0
201   5.254121 74.125.232.206 -> 192.168.1.2  TLSv1.2 1454 Application Data
202   5.254127 74.125.232.206 -> 192.168.1.2  TLSv1.2 1423 Application Data
203   5.254128 74.125.232.206 -> 192.168.1.2  TLSv1.2 538 Application Data
204   5.254129 74.125.232.206 -> 192.168.1.2  TLSv1.2 87 Application Data
205   5.254211  192.168.1.2 -> 74.125.232.206 TCP 54 61686→443 [ACK] Seq=5843 Ack=5220 Win=65792 Len=0
206   5.254686  192.168.1.2 -> 74.125.232.206 TLSv1.2 87 Application Data
207   5.256979  192.168.1.2 -> 74.125.232.206 TLSv1.2 310 Application Data
208   5.257179  192.168.1.2 -> 74.125.232.206 TCP 1454 [TCP segment of a reassembled PDU]
209   5.257187  192.168.1.2 -> 74.125.232.206 TCP 1454 [TCP segment of a reassembled PDU]
210   5.257193  192.168.1.2 -> 74.125.232.206 TLSv1.2 135 Application Data
211   5.257394  192.168.1.2 -> 74.125.232.206 TCP 1454 [TCP segment of a reassembled PDU]
212   5.257405  192.168.1.2 -> 74.125.232.206 TLSv1.2 486 Application Data
213   5.284769 74.125.232.206 -> 192.168.1.2  TCP 54 443→61686 [ACK] Seq=5220 Ack=6132 Win=59136 Len=0
