[Measurement for 100kb at 18:34:03 19.34.2014] 
Tshark:

  1   0.000000 172.31.36.109 -> 172.31.0.2   DNS 89 Standard query 0x6bd9  A d1dx94olpiqj0t.cloudfront.net
  2   0.000027 172.31.36.109 -> 172.31.0.2   DNS 89 Standard query 0x11be  AAAA d1dx94olpiqj0t.cloudfront.net
  3   0.000651   172.31.0.2 -> 172.31.36.109 DNS 176 Standard query response 0x11be 
  4   0.000662   172.31.0.2 -> 172.31.36.109 DNS 217 Standard query response 0x6bd9  A 54.230.30.250 A 54.192.29.218 A 54.230.29.237 A 54.230.30.9 A 54.230.30.17 A 54.230.30.55 A 54.230.30.73 A 54.230.30.248
  5   0.003865 172.31.36.109 -> 54.230.30.250 TCP 74 56025 > http [SYN] Seq=0 Win=26883 Len=0 MSS=8961 SACK_PERM=1 TSval=21432602 TSecr=0 WS=128
  6   0.005116 54.230.30.250 -> 172.31.36.109 TCP 74 http > 56025 [SYN, ACK] Seq=0 Ack=1 Win=14480 Len=0 MSS=1460 SACK_PERM=1 TSval=724189209 TSecr=21432602 WS=128
  7   0.005130 172.31.36.109 -> 54.230.30.250 TCP 66 56025 > http [ACK] Seq=1 Ack=1 Win=27008 Len=0 TSval=21432602 TSecr=724189209
  8   0.005170 172.31.36.109 -> 54.230.30.250 HTTP 164 GET /100kb HTTP/1.1 
  9   0.006365 54.230.30.250 -> 172.31.36.109 TCP 66 http > 56025 [ACK] Seq=1 Ack=99 Win=14592 Len=0 TSval=724189209 TSecr=21432602
 10   0.141638 54.230.30.250 -> 172.31.36.109 TCP 5858 [TCP segment of a reassembled PDU]
 11   0.141667 172.31.36.109 -> 54.230.30.250 TCP 66 56025 > http [ACK] Seq=99 Ack=5793 Win=38528 Len=0 TSval=21432636 TSecr=724189223
 12   0.141681 54.230.30.250 -> 172.31.36.109 TCP 8385 [TCP segment of a reassembled PDU]
 13   0.141687 172.31.36.109 -> 54.230.30.250 TCP 66 56025 > http [ACK] Seq=99 Ack=14112 Win=55168 Len=0 TSval=21432636 TSecr=724189223
 14   0.142925 54.230.30.250 -> 172.31.36.109 TCP 4410 [TCP segment of a reassembled PDU]
 15   0.142932 172.31.36.109 -> 54.230.30.250 TCP 66 56025 > http [ACK] Seq=99 Ack=18456 Win=63872 Len=0 TSval=21432636 TSecr=724189223
 16   0.143106 54.230.30.250 -> 172.31.36.109 TCP 8754 [TCP segment of a reassembled PDU]
 17   0.143114 172.31.36.109 -> 54.230.30.250 TCP 66 56025 > http [ACK] Seq=99 Ack=27144 Win=81280 Len=0 TSval=21432637 TSecr=724189223
 18   0.144128 54.230.30.250 -> 172.31.36.109 TCP 4410 [TCP segment of a reassembled PDU]
 19   0.144134 172.31.36.109 -> 54.230.30.250 TCP 66 56025 > http [ACK] Seq=99 Ack=31488 Win=89984 Len=0 TSval=21432637 TSecr=724189223
 20   0.144356 54.230.30.250 -> 172.31.36.109 TCP 4410 [TCP segment of a reassembled PDU]
 21   0.144362 172.31.36.109 -> 54.230.30.250 TCP 66 56025 > http [ACK] Seq=99 Ack=35832 Win=98560 Len=0 TSval=21432637 TSecr=724189223
 22   0.144428 54.230.30.250 -> 172.31.36.109 TCP 1514 [TCP segment of a reassembled PDU]
 23   0.144432 172.31.36.109 -> 54.230.30.250 TCP 66 56025 > http [ACK] Seq=99 Ack=37280 Win=101504 Len=0 TSval=21432637 TSecr=724189223
 24   0.144437 54.230.30.250 -> 172.31.36.109 TCP 2962 [TCP segment of a reassembled PDU]
 25   0.144441 172.31.36.109 -> 54.230.30.250 TCP 66 56025 > http [ACK] Seq=99 Ack=40176 Win=107264 Len=0 TSval=21432637 TSecr=724189223
 26   0.144459 54.230.30.250 -> 172.31.36.109 TCP 2962 [TCP segment of a reassembled PDU]
 27   0.144463 172.31.36.109 -> 54.230.30.250 TCP 66 56025 > http [ACK] Seq=99 Ack=43072 Win=113152 Len=0 TSval=21432637 TSecr=724189223
 28   0.144623 54.230.30.250 -> 172.31.36.109 TCP 4410 [TCP segment of a reassembled PDU]
 29   0.144629 172.31.36.109 -> 54.230.30.250 TCP 66 56025 > http [ACK] Seq=99 Ack=47416 Win=121728 Len=0 TSval=21432637 TSecr=724189223
 30   0.145413 54.230.30.250 -> 172.31.36.109 TCP 1514 [TCP segment of a reassembled PDU]
 31   0.145419 172.31.36.109 -> 54.230.30.250 TCP 66 56025 > http [ACK] Seq=99 Ack=48864 Win=124672 Len=0 TSval=21432637 TSecr=724189223
 32   0.145478 54.230.30.250 -> 172.31.36.109 TCP 1514 [TCP segment of a reassembled PDU]
 33   0.145482 172.31.36.109 -> 54.230.30.250 TCP 66 56025 > http [ACK] Seq=99 Ack=50312 Win=127616 Len=0 TSval=21432637 TSecr=724189223
 34   0.145648 54.230.30.250 -> 172.31.36.109 TCP 2962 [TCP segment of a reassembled PDU]
 35   0.145653 172.31.36.109 -> 54.230.30.250 TCP 66 56025 > http [ACK] Seq=99 Ack=53208 Win=133376 Len=0 TSval=21432637 TSecr=724189223
 36   0.145907 54.230.30.250 -> 172.31.36.109 TCP 4410 [TCP segment of a reassembled PDU]
 37   0.145912 172.31.36.109 -> 54.230.30.250 TCP 66 56025 > http [ACK] Seq=99 Ack=57552 Win=142080 Len=0 TSval=21432637 TSecr=724189223
 38   0.145996 54.230.30.250 -> 172.31.36.109 TCP 7817 [TCP segment of a reassembled PDU]
 39   0.146003 172.31.36.109 -> 54.230.30.250 TCP 66 56025 > http [ACK] Seq=99 Ack=65303 Win=157568 Len=0 TSval=21432637 TSecr=724189223
 40   0.164120 54.230.30.250 -> 172.31.36.109 TCP 1514 [TCP segment of a reassembled PDU]
 41   0.164134 172.31.36.109 -> 54.230.30.250 TCP 66 56025 > http [ACK] Seq=99 Ack=66751 Win=160384 Len=0 TSval=21432642 TSecr=724189225
 42   0.164554 54.230.30.250 -> 172.31.36.109 TCP 2962 [TCP segment of a reassembled PDU]
 43   0.164560 172.31.36.109 -> 54.230.30.250 TCP 66 56025 > http [ACK] Seq=99 Ack=69647 Win=166272 Len=0 TSval=21432642 TSecr=724189225
 44   0.164660 54.230.30.250 -> 172.31.36.109 TCP 15994 [TCP segment of a reassembled PDU]
 45   0.164670 172.31.36.109 -> 54.230.30.250 TCP 66 56025 > http [ACK] Seq=99 Ack=85575 Win=172032 Len=0 TSval=21432642 TSecr=724189225
 46   0.165621 54.230.30.250 -> 172.31.36.109 TCP 5858 [TCP segment of a reassembled PDU]
 47   0.165628 172.31.36.109 -> 54.230.30.250 TCP 66 56025 > http [ACK] Seq=99 Ack=91367 Win=188672 Len=0 TSval=21432642 TSecr=724189225
 48   0.165715 54.230.30.250 -> 172.31.36.109 TCP 5858 [TCP segment of a reassembled PDU]
 49   0.165721 172.31.36.109 -> 54.230.30.250 TCP 66 56025 > http [ACK] Seq=99 Ack=97159 Win=188672 Len=0 TSval=21432642 TSecr=724189225
 50   0.166128 54.230.30.250 -> 172.31.36.109 TCP 2962 [TCP segment of a reassembled PDU]
 51   0.166133 172.31.36.109 -> 54.230.30.250 TCP 66 56025 > http [ACK] Seq=99 Ack=100055 Win=193408 Len=0 TSval=21432642 TSecr=724189225
 52   0.166229 54.230.30.250 -> 172.31.36.109 HTTP 2867 HTTP/1.1 200 OK  (application/octet-stream)
 53   0.166234 172.31.36.109 -> 54.230.30.250 TCP 66 56025 > http [ACK] Seq=99 Ack=102856 Win=193408 Len=0 TSval=21432642 TSecr=724189225
 54   0.166395 172.31.36.109 -> 54.230.30.250 TCP 66 56025 > http [FIN, ACK] Seq=99 Ack=102856 Win=198144 Len=0 TSval=21432642 TSecr=724189225
 55   0.168179 54.230.30.250 -> 172.31.36.109 TCP 66 http > 56025 [FIN, ACK] Seq=102856 Ack=100 Win=14592 Len=0 TSval=724189225 TSecr=21432642
 56   0.168190 172.31.36.109 -> 54.230.30.250 TCP 66 56025 > http [ACK] Seq=100 Ack=102857 Win=198144 Len=0 TSval=21432643 TSecr=724189225
