[Measurement for 100kb at 03:31:56 20.31.2014] 
Tshark:

  1   0.000000 172.31.36.109 -> 172.31.0.2   DNS 89 Standard query 0x9de0  A d1dx94olpiqj0t.cloudfront.net
  2   0.000023 172.31.36.109 -> 172.31.0.2   DNS 89 Standard query 0xb7af  AAAA d1dx94olpiqj0t.cloudfront.net
  3   0.000535   172.31.0.2 -> 172.31.36.109 DNS 176 Standard query response 0xb7af 
  4   0.000546   172.31.0.2 -> 172.31.36.109 DNS 217 Standard query response 0x9de0  A 54.230.30.243 A 54.230.30.245 A 54.230.30.3 A 54.230.30.50 A 54.230.30.72 A 54.230.30.202 A 54.230.30.213 A 54.230.30.221
  5   0.003915 172.31.36.109 -> 54.230.30.243 TCP 74 60120 > http [SYN] Seq=0 Win=26883 Len=0 MSS=8961 SACK_PERM=1 TSval=29500784 TSecr=0 WS=128
  6   0.005179 54.230.30.243 -> 172.31.36.109 TCP 74 http > 60120 [SYN, ACK] Seq=0 Ack=1 Win=14480 Len=0 MSS=1460 SACK_PERM=1 TSval=831701309 TSecr=29500784 WS=128
  7   0.005193 172.31.36.109 -> 54.230.30.243 TCP 66 60120 > http [ACK] Seq=1 Ack=1 Win=27008 Len=0 TSval=29500785 TSecr=831701309
  8   0.005231 172.31.36.109 -> 54.230.30.243 HTTP 164 GET /100kb HTTP/1.1 
  9   0.006396 54.230.30.243 -> 172.31.36.109 TCP 66 http > 60120 [ACK] Seq=1 Ack=99 Win=14592 Len=0 TSval=831701309 TSecr=29500785
 10   0.088205 54.230.30.243 -> 172.31.36.109 TCP 1144 [TCP segment of a reassembled PDU]
 11   0.088212 172.31.36.109 -> 54.230.30.243 TCP 66 60120 > http [ACK] Seq=99 Ack=1079 Win=29056 Len=0 TSval=29500805 TSecr=831701317
 12   0.088400 54.230.30.243 -> 172.31.36.109 TCP 2962 [TCP segment of a reassembled PDU]
 13   0.088406 172.31.36.109 -> 54.230.30.243 TCP 66 60120 > http [ACK] Seq=99 Ack=3975 Win=34944 Len=0 TSval=29500806 TSecr=831701317
 14   0.088456 54.230.30.243 -> 172.31.36.109 TCP 10202 [TCP segment of a reassembled PDU]
 15   0.088465 172.31.36.109 -> 54.230.30.243 TCP 66 60120 > http [ACK] Seq=99 Ack=14111 Win=55168 Len=0 TSval=29500806 TSecr=831701317
 16   0.089771 54.230.30.243 -> 172.31.36.109 TCP 7306 [TCP segment of a reassembled PDU]
 17   0.089778 172.31.36.109 -> 54.230.30.243 TCP 66 60120 > http [ACK] Seq=99 Ack=21351 Win=69632 Len=0 TSval=29500806 TSecr=831701318
 18   0.089787 54.230.30.243 -> 172.31.36.109 TCP 5858 [TCP segment of a reassembled PDU]
 19   0.089791 172.31.36.109 -> 54.230.30.243 TCP 66 60120 > http [ACK] Seq=99 Ack=27143 Win=81280 Len=0 TSval=29500806 TSecr=831701318
 20   0.091065 54.230.30.243 -> 172.31.36.109 TCP 2962 [TCP segment of a reassembled PDU]
 21   0.091071 172.31.36.109 -> 54.230.30.243 TCP 66 60120 > http [ACK] Seq=99 Ack=30039 Win=87040 Len=0 TSval=29500806 TSecr=831701318
 22   0.091186 54.230.30.243 -> 172.31.36.109 TCP 18890 [TCP segment of a reassembled PDU]
 23   0.091207 172.31.36.109 -> 54.230.30.243 TCP 66 60120 > http [ACK] Seq=99 Ack=48863 Win=124672 Len=0 TSval=29500806 TSecr=831701318
 24   0.092306 54.230.30.243 -> 172.31.36.109 TCP 4410 [TCP segment of a reassembled PDU]
 25   0.092340 172.31.36.109 -> 54.230.30.243 TCP 66 60120 > http [ACK] Seq=99 Ack=53207 Win=133376 Len=0 TSval=29500806 TSecr=831701318
 26   0.092639 54.230.30.243 -> 172.31.36.109 TCP 5858 [TCP segment of a reassembled PDU]
 27   0.092671 172.31.36.109 -> 54.230.30.243 TCP 66 60120 > http [ACK] Seq=99 Ack=58999 Win=144896 Len=0 TSval=29500807 TSecr=831701318
 28   0.092801 54.230.30.243 -> 172.31.36.109 TCP 7306 [TCP segment of a reassembled PDU]
 29   0.092808 172.31.36.109 -> 54.230.30.243 TCP 66 60120 > http [ACK] Seq=99 Ack=66239 Win=159360 Len=0 TSval=29500807 TSecr=831701318
 30   0.093637 54.230.30.243 -> 172.31.36.109 TCP 5858 [TCP segment of a reassembled PDU]
 31   0.093643 172.31.36.109 -> 54.230.30.243 TCP 66 60120 > http [ACK] Seq=99 Ack=72031 Win=171008 Len=0 TSval=29500807 TSecr=831701318
 32   0.093729 54.230.30.243 -> 172.31.36.109 TCP 7306 [TCP segment of a reassembled PDU]
 33   0.093736 172.31.36.109 -> 54.230.30.243 TCP 66 60120 > http [ACK] Seq=99 Ack=79271 Win=185472 Len=0 TSval=29500807 TSecr=831701318
 34   0.094103 54.230.30.243 -> 172.31.36.109 TCP 7306 [TCP segment of a reassembled PDU]
 35   0.094110 172.31.36.109 -> 54.230.30.243 TCP 66 60120 > http [ACK] Seq=99 Ack=86511 Win=186368 Len=0 TSval=29500807 TSecr=831701318
 36   0.094176 54.230.30.243 -> 172.31.36.109 TCP 1514 [TCP segment of a reassembled PDU]
 37   0.094181 172.31.36.109 -> 54.230.30.243 TCP 66 60120 > http [ACK] Seq=99 Ack=87959 Win=195840 Len=0 TSval=29500807 TSecr=831701318
 38   0.094442 54.230.30.243 -> 172.31.36.109 TCP 5858 [TCP segment of a reassembled PDU]
 39   0.094448 172.31.36.109 -> 54.230.30.243 TCP 66 60120 > http [ACK] Seq=99 Ack=93751 Win=190080 Len=0 TSval=29500807 TSecr=831701318
 40   0.095139 54.230.30.243 -> 172.31.36.109 TCP 1514 [TCP segment of a reassembled PDU]
 41   0.095150 172.31.36.109 -> 54.230.30.243 TCP 66 60120 > http [ACK] Seq=99 Ack=95199 Win=195840 Len=0 TSval=29500807 TSecr=831701318
 42   0.095286 54.230.30.243 -> 172.31.36.109 HTTP 7724 HTTP/1.1 200 OK  (application/octet-stream)
 43   0.095310 172.31.36.109 -> 54.230.30.243 TCP 66 60120 > http [ACK] Seq=99 Ack=102857 Win=188288 Len=0 TSval=29500807 TSecr=831701318
 44   0.095456 172.31.36.109 -> 54.230.30.243 TCP 66 60120 > http [FIN, ACK] Seq=99 Ack=102857 Win=198272 Len=0 TSval=29500807 TSecr=831701318
 45   0.096930 54.230.30.243 -> 172.31.36.109 TCP 66 http > 60120 [FIN, ACK] Seq=102857 Ack=100 Win=14592 Len=0 TSval=831701318 TSecr=29500807
 46   0.096937 172.31.36.109 -> 54.230.30.243 TCP 66 60120 > http [ACK] Seq=100 Ack=102858 Win=198272 Len=0 TSval=29500808 TSecr=831701318
