[Measurement for 100kb at 00:31:54 20.31.2014] 
Tshark:

  1   0.000000 172.31.36.109 -> 172.31.0.2   DNS 89 Standard query 0x676b  A d1dx94olpiqj0t.cloudfront.net
  2   0.000029 172.31.36.109 -> 172.31.0.2   DNS 89 Standard query 0xb4cc  AAAA d1dx94olpiqj0t.cloudfront.net
  3   0.000321   172.31.0.2 -> 172.31.36.109 DNS 176 Standard query response 0xb4cc 
  4   0.000332   172.31.0.2 -> 172.31.36.109 DNS 217 Standard query response 0x676b  A 54.192.29.218 A 54.192.30.135 A 54.192.30.219 A 54.230.29.243 A 54.230.30.53 A 54.230.30.73 A 54.230.30.205 A 54.230.30.209
  5   0.003869 172.31.36.109 -> 54.192.29.218 TCP 74 50432 > http [SYN] Seq=0 Win=26883 Len=0 MSS=8961 SACK_PERM=1 TSval=26800305 TSecr=0 WS=128
  6   0.005004 54.192.29.218 -> 172.31.36.109 TCP 74 http > 50432 [SYN, ACK] Seq=0 Ack=1 Win=14480 Len=0 MSS=1460 SACK_PERM=1 TSval=679847422 TSecr=26800305 WS=128
  7   0.005018 172.31.36.109 -> 54.192.29.218 TCP 66 50432 > http [ACK] Seq=1 Ack=1 Win=27008 Len=0 TSval=26800305 TSecr=679847422
  8   0.005056 172.31.36.109 -> 54.192.29.218 HTTP 164 GET /100kb HTTP/1.1 
  9   0.006270 54.192.29.218 -> 172.31.36.109 TCP 66 http > 50432 [ACK] Seq=1 Ack=99 Win=14592 Len=0 TSval=679847422 TSecr=26800305
 10   0.044729 54.192.29.218 -> 172.31.36.109 TCP 6936 [TCP segment of a reassembled PDU]
 11   0.044740 172.31.36.109 -> 54.192.29.218 TCP 66 50432 > http [ACK] Seq=99 Ack=6871 Win=40704 Len=0 TSval=26800315 TSecr=679847426
 12   0.044761 54.192.29.218 -> 172.31.36.109 TCP 7306 [TCP segment of a reassembled PDU]
 13   0.044766 172.31.36.109 -> 54.192.29.218 TCP 66 50432 > http [ACK] Seq=99 Ack=14111 Win=55168 Len=0 TSval=26800315 TSecr=679847426
 14   0.046080 54.192.29.218 -> 172.31.36.109 TCP 13098 [TCP segment of a reassembled PDU]
 15   0.046090 172.31.36.109 -> 54.192.29.218 TCP 66 50432 > http [ACK] Seq=99 Ack=27143 Win=81280 Len=0 TSval=26800315 TSecr=679847426
 16   0.047241 54.192.29.218 -> 172.31.36.109 TCP 5858 [TCP segment of a reassembled PDU]
 17   0.047249 172.31.36.109 -> 54.192.29.218 TCP 66 50432 > http [ACK] Seq=99 Ack=32935 Win=92800 Len=0 TSval=26800316 TSecr=679847426
 18   0.047255 54.192.29.218 -> 172.31.36.109 TCP 1514 [TCP segment of a reassembled PDU]
 19   0.047257 172.31.36.109 -> 54.192.29.218 TCP 66 50432 > http [ACK] Seq=99 Ack=34383 Win=95744 Len=0 TSval=26800316 TSecr=679847426
 20   0.047457 54.192.29.218 -> 172.31.36.109 TCP 4410 [TCP segment of a reassembled PDU]
 21   0.047462 172.31.36.109 -> 54.192.29.218 TCP 66 50432 > http [ACK] Seq=99 Ack=38727 Win=104448 Len=0 TSval=26800316 TSecr=679847426
 22   0.047484 54.192.29.218 -> 172.31.36.109 TCP 1514 [TCP segment of a reassembled PDU]
 23   0.047488 172.31.36.109 -> 54.192.29.218 TCP 66 50432 > http [ACK] Seq=99 Ack=40175 Win=107264 Len=0 TSval=26800316 TSecr=679847426
 24   0.048503 54.192.29.218 -> 172.31.36.109 TCP 2962 [TCP segment of a reassembled PDU]
 25   0.048508 172.31.36.109 -> 54.192.29.218 TCP 66 50432 > http [ACK] Seq=99 Ack=43071 Win=113024 Len=0 TSval=26800316 TSecr=679847427
 26   0.048594 54.192.29.218 -> 172.31.36.109 TCP 8754 [TCP segment of a reassembled PDU]
 27   0.048601 172.31.36.109 -> 54.192.29.218 TCP 66 50432 > http [ACK] Seq=99 Ack=51759 Win=130432 Len=0 TSval=26800316 TSecr=679847427
 28   0.048743 54.192.29.218 -> 172.31.36.109 TCP 4410 [TCP segment of a reassembled PDU]
 29   0.048758 172.31.36.109 -> 54.192.29.218 TCP 66 50432 > http [ACK] Seq=99 Ack=56103 Win=139136 Len=0 TSval=26800316 TSecr=679847427
 30   0.048859 54.192.29.218 -> 172.31.36.109 TCP 5858 [TCP segment of a reassembled PDU]
 31   0.048865 172.31.36.109 -> 54.192.29.218 TCP 66 50432 > http [ACK] Seq=99 Ack=61895 Win=150784 Len=0 TSval=26800316 TSecr=679847427
 32   0.049806 54.192.29.218 -> 172.31.36.109 TCP 3475 [TCP segment of a reassembled PDU]
 33   0.049812 172.31.36.109 -> 54.192.29.218 TCP 66 50432 > http [ACK] Seq=99 Ack=65304 Win=157568 Len=0 TSval=26800316 TSecr=679847427
 34   0.061055 54.192.29.218 -> 172.31.36.109 TCP 1514 [TCP segment of a reassembled PDU]
 35   0.061077 172.31.36.109 -> 54.192.29.218 TCP 66 50432 > http [ACK] Seq=99 Ack=66752 Win=160512 Len=0 TSval=26800319 TSecr=679847428
 36   0.061289 54.192.29.218 -> 172.31.36.109 TCP 2962 [TCP segment of a reassembled PDU]
 37   0.061294 172.31.36.109 -> 54.192.29.218 TCP 66 50432 > http [ACK] Seq=99 Ack=69648 Win=166272 Len=0 TSval=26800319 TSecr=679847428
 38   0.061444 54.192.29.218 -> 172.31.36.109 TCP 15994 [TCP segment of a reassembled PDU]
 39   0.061453 172.31.36.109 -> 54.192.29.218 TCP 66 50432 > http [ACK] Seq=99 Ack=85576 Win=180992 Len=0 TSval=26800319 TSecr=679847428
 40   0.061461 54.192.29.218 -> 172.31.36.109 TCP 2962 [TCP segment of a reassembled PDU]
 41   0.061464 172.31.36.109 -> 54.192.29.218 TCP 66 50432 > http [ACK] Seq=99 Ack=88472 Win=178176 Len=0 TSval=26800319 TSecr=679847428
 42   0.061521 54.192.29.218 -> 172.31.36.109 TCP 1514 [TCP segment of a reassembled PDU]
 43   0.061525 172.31.36.109 -> 54.192.29.218 TCP 66 50432 > http [ACK] Seq=99 Ack=89920 Win=200960 Len=0 TSval=26800319 TSecr=679847428
 44   0.062569 54.192.29.218 -> 172.31.36.109 TCP 2962 [TCP segment of a reassembled PDU]
 45   0.062574 172.31.36.109 -> 54.192.29.218 TCP 66 50432 > http [ACK] Seq=99 Ack=92816 Win=202496 Len=0 TSval=26800320 TSecr=679847428
 46   0.062654 54.192.29.218 -> 172.31.36.109 TCP 2962 [TCP segment of a reassembled PDU]
 47   0.062659 172.31.36.109 -> 54.192.29.218 TCP 66 50432 > http [ACK] Seq=99 Ack=95712 Win=202496 Len=0 TSval=26800320 TSecr=679847428
 48   0.062728 54.192.29.218 -> 172.31.36.109 HTTP 7211 HTTP/1.1 200 OK  (application/octet-stream)
 49   0.062734 172.31.36.109 -> 54.192.29.218 TCP 66 50432 > http [ACK] Seq=99 Ack=102857 Win=195456 Len=0 TSval=26800320 TSecr=679847428
 50   0.062849 172.31.36.109 -> 54.192.29.218 TCP 66 50432 > http [FIN, ACK] Seq=99 Ack=102857 Win=206848 Len=0 TSval=26800320 TSecr=679847428
 51   0.064098 54.192.29.218 -> 172.31.36.109 TCP 66 http > 50432 [FIN, ACK] Seq=102857 Ack=100 Win=14592 Len=0 TSval=679847428 TSecr=26800320
 52   0.064126 172.31.36.109 -> 54.192.29.218 TCP 66 50432 > http [ACK] Seq=100 Ack=102858 Win=206848 Len=0 TSval=26800320 TSecr=679847428
