[Measurement for 100kb at 04:31:49 20.31.2014] 
Tshark:

  1   0.000000 172.31.36.109 -> 172.31.0.2   DNS 89 Standard query 0x70db  A d1dx94olpiqj0t.cloudfront.net
  2   0.000023 172.31.36.109 -> 172.31.0.2   DNS 89 Standard query 0x2aa2  AAAA d1dx94olpiqj0t.cloudfront.net
  3   0.000510   172.31.0.2 -> 172.31.36.109 DNS 176 Standard query response 0x2aa2 
  4   0.000520   172.31.0.2 -> 172.31.36.109 DNS 217 Standard query response 0x70db  A 54.230.22.176 A 54.230.23.13 A 54.230.23.46 A 216.137.41.11 A 216.137.41.107 A 54.230.20.118 A 54.230.21.115 A 54.230.21.120
  5   0.003894 172.31.36.109 -> 54.230.22.176 TCP 74 55113 > http [SYN] Seq=0 Win=26883 Len=0 MSS=8961 SACK_PERM=1 TSval=30398988 TSecr=0 WS=128
  6   0.090541 54.230.22.176 -> 172.31.36.109 TCP 74 http > 55113 [SYN, ACK] Seq=0 Ack=1 Win=14480 Len=0 MSS=1460 SACK_PERM=1 TSval=926109858 TSecr=30398988 WS=128
  7   0.090557 172.31.36.109 -> 54.230.22.176 TCP 66 55113 > http [ACK] Seq=1 Ack=1 Win=27008 Len=0 TSval=30399010 TSecr=926109858
  8   0.090713 172.31.36.109 -> 54.230.22.176 HTTP 164 GET /100kb HTTP/1.1 
  9   0.177531 54.230.22.176 -> 172.31.36.109 TCP 66 http > 55113 [ACK] Seq=1 Ack=99 Win=14592 Len=0 TSval=926109867 TSecr=30399010
 10   0.186298 54.230.22.176 -> 172.31.36.109 TCP 13098 [TCP segment of a reassembled PDU]
 11   0.186316 172.31.36.109 -> 54.230.22.176 TCP 66 55113 > http [ACK] Seq=99 Ack=13033 Win=52992 Len=0 TSval=30399034 TSecr=926109868
 12   0.273624 54.230.22.176 -> 172.31.36.109 TCP 13098 [TCP segment of a reassembled PDU]
 13   0.273636 172.31.36.109 -> 54.230.22.176 TCP 66 55113 > http [ACK] Seq=99 Ack=26065 Win=79104 Len=0 TSval=30399056 TSecr=926109876
 14   0.360294 54.230.22.176 -> 172.31.36.109 TCP 13098 [TCP segment of a reassembled PDU]
 15   0.360306 172.31.36.109 -> 54.230.22.176 TCP 66 55113 > http [ACK] Seq=99 Ack=39097 Win=96512 Len=0 TSval=30399077 TSecr=926109885
 16   0.447067 54.230.22.176 -> 172.31.36.109 TCP 13098 [TCP segment of a reassembled PDU]
