[Measurement for 100kb at 09:32:08 20.32.2014] 
Tshark:

  1   0.000000 172.31.36.109 -> 172.31.0.2   DNS 89 Standard query 0xef62  A d1dx94olpiqj0t.cloudfront.net
  2   0.000022 172.31.36.109 -> 172.31.0.2   DNS 89 Standard query 0xf7a4  AAAA d1dx94olpiqj0t.cloudfront.net
  3   0.000602   172.31.0.2 -> 172.31.36.109 DNS 217 Standard query response 0xef62  A 54.230.30.213 A 54.230.30.217 A 54.230.30.233 A 54.192.30.139 A 54.192.30.229 A 54.230.29.254 A 54.230.30.50 A 54.230.30.69
  4   0.000612   172.31.0.2 -> 172.31.36.109 DNS 176 Standard query response 0xf7a4 
  5   0.003937 172.31.36.109 -> 54.230.30.213 TCP 74 54926 > http [SYN] Seq=0 Win=26883 Len=0 MSS=8961 SACK_PERM=1 TSval=34903841 TSecr=0 WS=128
  6   0.004934 54.230.30.213 -> 172.31.36.109 TCP 74 http > 54926 [SYN, ACK] Seq=0 Ack=1 Win=14480 Len=0 MSS=1460 SACK_PERM=1 TSval=681479175 TSecr=34903841 WS=128
  7   0.004949 172.31.36.109 -> 54.230.30.213 TCP 66 54926 > http [ACK] Seq=1 Ack=1 Win=27008 Len=0 TSval=34903841 TSecr=681479175
  8   0.004986 172.31.36.109 -> 54.230.30.213 HTTP 164 GET /100kb HTTP/1.1 
  9   0.005999 54.230.30.213 -> 172.31.36.109 TCP 66 http > 54926 [ACK] Seq=1 Ack=99 Win=14592 Len=0 TSval=681479175 TSecr=34903841
 10   0.052715 54.230.30.213 -> 172.31.36.109 TCP 6936 [TCP segment of a reassembled PDU]
 11   0.052725 172.31.36.109 -> 54.230.30.213 TCP 66 54926 > http [ACK] Seq=99 Ack=6871 Win=40704 Len=0 TSval=34903853 TSecr=681479179
 12   0.052734 54.230.30.213 -> 172.31.36.109 TCP 4410 [TCP segment of a reassembled PDU]
 13   0.052738 172.31.36.109 -> 54.230.30.213 TCP 66 54926 > http [ACK] Seq=99 Ack=11215 Win=49408 Len=0 TSval=34903853 TSecr=681479179
 14   0.052830 54.230.30.213 -> 172.31.36.109 TCP 2962 [TCP segment of a reassembled PDU]
 15   0.052836 172.31.36.109 -> 54.230.30.213 TCP 66 54926 > http [ACK] Seq=99 Ack=14111 Win=55168 Len=0 TSval=34903853 TSecr=681479179
 16   0.053840 54.230.30.213 -> 172.31.36.109 TCP 5858 [TCP segment of a reassembled PDU]
 17   0.053847 172.31.36.109 -> 54.230.30.213 TCP 66 54926 > http [ACK] Seq=99 Ack=19903 Win=66688 Len=0 TSval=34903853 TSecr=681479180
 18   0.053878 54.230.30.213 -> 172.31.36.109 TCP 7306 [TCP segment of a reassembled PDU]
 19   0.053885 172.31.36.109 -> 54.230.30.213 TCP 66 54926 > http [ACK] Seq=99 Ack=27143 Win=81280 Len=0 TSval=34903853 TSecr=681479180
 20   0.055096 54.230.30.213 -> 172.31.36.109 TCP 7306 [TCP segment of a reassembled PDU]
 21   0.055123 172.31.36.109 -> 54.230.30.213 TCP 66 54926 > http [ACK] Seq=99 Ack=34383 Win=95744 Len=0 TSval=34903853 TSecr=681479180
 22   0.055131 54.230.30.213 -> 172.31.36.109 TCP 5858 [TCP segment of a reassembled PDU]
 23   0.055135 172.31.36.109 -> 54.230.30.213 TCP 66 54926 > http [ACK] Seq=99 Ack=40175 Win=96512 Len=0 TSval=34903853 TSecr=681479180
 24   0.055142 54.230.30.213 -> 172.31.36.109 TCP 2962 [TCP segment of a reassembled PDU]
 25   0.055145 172.31.36.109 -> 54.230.30.213 TCP 66 54926 > http [ACK] Seq=99 Ack=43071 Win=93696 Len=0 TSval=34903853 TSecr=681479180
 26   0.055329 54.230.30.213 -> 172.31.36.109 TCP 5858 [TCP segment of a reassembled PDU]
 27   0.055335 172.31.36.109 -> 54.230.30.213 TCP 66 54926 > http [ACK] Seq=99 Ack=48863 Win=108416 Len=0 TSval=34903853 TSecr=681479180
 28   0.056381 54.230.30.213 -> 172.31.36.109 TCP 7306 [TCP segment of a reassembled PDU]
 29   0.056388 172.31.36.109 -> 54.230.30.213 TCP 66 54926 > http [ACK] Seq=99 Ack=56103 Win=105984 Len=0 TSval=34903854 TSecr=681479180
 30   0.056409 54.230.30.213 -> 172.31.36.109 TCP 2962 [TCP segment of a reassembled PDU]
 31   0.056414 172.31.36.109 -> 54.230.30.213 TCP 66 54926 > http [ACK] Seq=99 Ack=58999 Win=103168 Len=0 TSval=34903854 TSecr=681479180
 32   0.056666 54.230.30.213 -> 172.31.36.109 TCP 6371 [TCP segment of a reassembled PDU]
 33   0.056672 172.31.36.109 -> 54.230.30.213 TCP 66 54926 > http [ACK] Seq=99 Ack=65304 Win=121728 Len=0 TSval=34903854 TSecr=681479180
 34   0.069190 54.230.30.213 -> 172.31.36.109 TCP 1514 [TCP segment of a reassembled PDU]
 35   0.069215 172.31.36.109 -> 54.230.30.213 TCP 66 54926 > http [ACK] Seq=99 Ack=66752 Win=124544 Len=0 TSval=34903857 TSecr=681479181
 36   0.069227 54.230.30.213 -> 172.31.36.109 TCP 11650 [TCP segment of a reassembled PDU]
 37   0.069236 172.31.36.109 -> 54.230.30.213 TCP 66 54926 > http [ACK] Seq=99 Ack=78336 Win=147712 Len=0 TSval=34903857 TSecr=681479181
 38   0.069524 54.230.30.213 -> 172.31.36.109 TCP 14546 [TCP segment of a reassembled PDU]
 39   0.069533 172.31.36.109 -> 54.230.30.213 TCP 66 54926 > http [ACK] Seq=99 Ack=92816 Win=176640 Len=0 TSval=34903857 TSecr=681479181
 40   0.070431 54.230.30.213 -> 172.31.36.109 TCP 1514 [TCP segment of a reassembled PDU]
 41   0.070436 172.31.36.109 -> 54.230.30.213 TCP 66 54926 > http [ACK] Seq=99 Ack=94264 Win=179584 Len=0 TSval=34903857 TSecr=681479181
 42   0.070543 54.230.30.213 -> 172.31.36.109 HTTP 8659 HTTP/1.1 200 OK  (application/octet-stream)
 43   0.070562 172.31.36.109 -> 54.230.30.213 TCP 66 54926 > http [ACK] Seq=99 Ack=102857 Win=196736 Len=0 TSval=34903857 TSecr=681479181
 44   0.070691 172.31.36.109 -> 54.230.30.213 TCP 66 54926 > http [FIN, ACK] Seq=99 Ack=102857 Win=196736 Len=0 TSval=34903857 TSecr=681479181
 45   0.074526 54.230.30.213 -> 172.31.36.109 TCP 66 http > 54926 [FIN, ACK] Seq=102857 Ack=100 Win=14592 Len=0 TSval=681479182 TSecr=34903857
 46   0.074534 172.31.36.109 -> 54.230.30.213 TCP 66 54926 > http [ACK] Seq=100 Ack=102858 Win=196736 Len=0 TSval=34903858 TSecr=681479182
