[Measurement for 1mb at 03:40:22 20.40.2014] 
Tshark:

  1   0.000000 172.31.8.238 -> 172.31.0.2   DNS 89 Standard query 0xea44  A d39wppo36gwqpx.cloudfront.net
  2   0.000027 172.31.8.238 -> 172.31.0.2   DNS 89 Standard query 0xe489  AAAA d39wppo36gwqpx.cloudfront.net
  3   0.000729   172.31.0.2 -> 172.31.8.238 DNS 170 Standard query response 0xe489 
  4   0.000742   172.31.0.2 -> 172.31.8.238 DNS 217 Standard query response 0xea44  A 54.230.119.55 A 54.239.132.26 A 54.239.132.41 A 54.239.132.74 A 54.192.118.219 A 54.192.118.240 A 54.192.118.242 A 54.192.118.243
  5   0.003841 172.31.8.238 -> 54.230.119.55 TCP 74 42954 > http [SYN] Seq=0 Win=26883 Len=0 MSS=8961 SACK_PERM=1 TSval=9612626 TSecr=0 WS=128
  6   0.004482 54.230.119.55 -> 172.31.8.238 TCP 74 http > 42954 [SYN, ACK] Seq=0 Ack=1 Win=14480 Len=0 MSS=1460 SACK_PERM=1 TSval=1684588836 TSecr=9612626 WS=128
  7   0.004495 172.31.8.238 -> 54.230.119.55 TCP 66 42954 > http [ACK] Seq=1 Ack=1 Win=27008 Len=0 TSval=9612626 TSecr=1684588836
  8   0.004533 172.31.8.238 -> 54.230.119.55 HTTP 162 GET /1mb HTTP/1.1 
  9   0.005196 54.230.119.55 -> 172.31.8.238 TCP 66 http > 42954 [ACK] Seq=1 Ack=97 Win=14592 Len=0 TSval=1684588836 TSecr=9612626
 10   0.006519 54.230.119.55 -> 172.31.8.238 TCP 2962 [TCP segment of a reassembled PDU]
 11   0.006527 172.31.8.238 -> 54.230.119.55 TCP 66 42954 > http [ACK] Seq=97 Ack=2897 Win=32768 Len=0 TSval=9612626 TSecr=1684588836
 12   0.006643 54.230.119.55 -> 172.31.8.238 TCP 8754 [TCP segment of a reassembled PDU]
 13   0.006652 172.31.8.238 -> 54.230.119.55 TCP 66 42954 > http [ACK] Seq=97 Ack=11585 Win=50176 Len=0 TSval=9612626 TSecr=1684588836
 14   0.006659 54.230.119.55 -> 172.31.8.238 TCP 2962 [TCP segment of a reassembled PDU]
 15   0.006663 172.31.8.238 -> 54.230.119.55 TCP 66 42954 > http [ACK] Seq=97 Ack=14481 Win=55936 Len=0 TSval=9612626 TSecr=1684588836
 16   0.007277 54.230.119.55 -> 172.31.8.238 TCP 2962 [TCP segment of a reassembled PDU]
 17   0.007282 172.31.8.238 -> 54.230.119.55 TCP 66 42954 > http [ACK] Seq=97 Ack=17377 Win=61696 Len=0 TSval=9612626 TSecr=1684588836
 18   0.007382 54.230.119.55 -> 172.31.8.238 TCP 10202 [TCP segment of a reassembled PDU]
 19   0.007389 172.31.8.238 -> 54.230.119.55 TCP 66 42954 > http [ACK] Seq=97 Ack=27513 Win=81920 Len=0 TSval=9612626 TSecr=1684588836
 20   0.007842 54.230.119.55 -> 172.31.8.238 TCP 5858 [TCP segment of a reassembled PDU]
 21   0.007849 172.31.8.238 -> 54.230.119.55 TCP 66 42954 > http [ACK] Seq=97 Ack=33305 Win=93568 Len=0 TSval=9612627 TSecr=1684588836
 22   0.007935 54.230.119.55 -> 172.31.8.238 TCP 4410 [TCP segment of a reassembled PDU]
 23   0.007941 172.31.8.238 -> 54.230.119.55 TCP 66 42954 > http [ACK] Seq=97 Ack=37649 Win=102272 Len=0 TSval=9612627 TSecr=1684588836
 24   0.008142 54.230.119.55 -> 172.31.8.238 TCP 5858 [TCP segment of a reassembled PDU]
 25   0.008153 172.31.8.238 -> 54.230.119.55 TCP 66 42954 > http [ACK] Seq=97 Ack=43441 Win=113792 Len=0 TSval=9612627 TSecr=1684588836
 26   0.008166 54.230.119.55 -> 172.31.8.238 TCP 5858 [TCP segment of a reassembled PDU]
 27   0.008174 172.31.8.238 -> 54.230.119.55 TCP 66 42954 > http [ACK] Seq=97 Ack=49233 Win=125440 Len=0 TSval=9612627 TSecr=1684588836
 28   0.008623 54.230.119.55 -> 172.31.8.238 TCP 5858 [TCP segment of a reassembled PDU]
 29   0.008630 172.31.8.238 -> 54.230.119.55 TCP 66 42954 > http [ACK] Seq=97 Ack=55025 Win=136960 Len=0 TSval=9612627 TSecr=1684588836
 30   0.008668 54.230.119.55 -> 172.31.8.238 TCP 7306 [TCP segment of a reassembled PDU]
 31   0.008675 172.31.8.238 -> 54.230.119.55 TCP 66 42954 > http [ACK] Seq=97 Ack=62265 Win=151424 Len=0 TSval=9612627 TSecr=1684588836
 32   0.008839 54.230.119.55 -> 172.31.8.238 TCP 4410 [TCP segment of a reassembled PDU]
 33   0.008845 172.31.8.238 -> 54.230.119.55 TCP 66 42954 > http [ACK] Seq=97 Ack=66609 Win=160128 Len=0 TSval=9612627 TSecr=1684588836
 34   0.008939 54.230.119.55 -> 172.31.8.238 TCP 10202 [TCP segment of a reassembled PDU]
 35   0.008947 172.31.8.238 -> 54.230.119.55 TCP 66 42954 > http [ACK] Seq=97 Ack=76745 Win=180480 Len=0 TSval=9612627 TSecr=1684588836
 36   0.009315 54.230.119.55 -> 172.31.8.238 TCP 1514 [TCP segment of a reassembled PDU]
 37   0.009320 172.31.8.238 -> 54.230.119.55 TCP 66 42954 > http [ACK] Seq=97 Ack=78193 Win=183296 Len=0 TSval=9612627 TSecr=1684588836
 38   0.009446 54.230.119.55 -> 172.31.8.238 TCP 17442 [TCP segment of a reassembled PDU]
 39   0.009458 172.31.8.238 -> 54.230.119.55 TCP 66 42954 > http [ACK] Seq=97 Ack=95569 Win=178688 Len=0 TSval=9612627 TSecr=1684588836
 40   0.009587 54.230.119.55 -> 172.31.8.238 TCP 5858 [TCP segment of a reassembled PDU]
 41   0.009594 172.31.8.238 -> 54.230.119.55 TCP 66 42954 > http [ACK] Seq=97 Ack=101361 Win=194944 Len=0 TSval=9612627 TSecr=1684588836
 42   0.009703 54.230.119.55 -> 172.31.8.238 TCP 8754 [TCP segment of a reassembled PDU]
 43   0.009711 172.31.8.238 -> 54.230.119.55 TCP 66 42954 > http [ACK] Seq=97 Ack=110049 Win=193024 Len=0 TSval=9612627 TSecr=1684588836
 44   0.009838 54.230.119.55 -> 172.31.8.238 TCP 1514 [TCP segment of a reassembled PDU]
 45   0.009842 172.31.8.238 -> 54.230.119.55 TCP 66 42954 > http [ACK] Seq=97 Ack=111497 Win=197760 Len=0 TSval=9612627 TSecr=1684588836
 46   0.010085 54.230.119.55 -> 172.31.8.238 TCP 2962 [TCP segment of a reassembled PDU]
 47   0.010092 172.31.8.238 -> 54.230.119.55 TCP 66 42954 > http [ACK] Seq=97 Ack=114393 Win=202496 Len=0 TSval=9612627 TSecr=1684588836
 48   0.010195 54.230.119.55 -> 172.31.8.238 TCP 13098 [TCP segment of a reassembled PDU]
 49   0.010205 172.31.8.238 -> 54.230.119.55 TCP 66 42954 > http [ACK] Seq=97 Ack=127425 Win=189568 Len=0 TSval=9612627 TSecr=1684588836
 50   0.010353 54.230.119.55 -> 172.31.8.238 TCP 4410 [TCP segment of a reassembled PDU]
 51   0.010369 172.31.8.238 -> 54.230.119.55 TCP 66 42954 > http [ACK] Seq=97 Ack=131769 Win=185344 Len=0 TSval=9612627 TSecr=1684588836
 52   0.010478 54.230.119.55 -> 172.31.8.238 TCP 17442 [TCP segment of a reassembled PDU]
 53   0.010489 172.31.8.238 -> 54.230.119.55 TCP 66 42954 > http [ACK] Seq=97 Ack=149145 Win=168064 Len=0 TSval=9612627 TSecr=1684588836
 54   0.010630 54.230.119.55 -> 172.31.8.238 TCP 5858 [TCP segment of a reassembled PDU]
 55   0.010637 172.31.8.238 -> 54.230.119.55 TCP 66 42954 > http [ACK] Seq=97 Ack=154937 Win=197760 Len=0 TSval=9612627 TSecr=1684588836
 56   0.010930 54.230.119.55 -> 172.31.8.238 TCP 15994 [TCP segment of a reassembled PDU]
 57   0.010953 172.31.8.238 -> 54.230.119.55 TCP 66 42954 > http [ACK] Seq=97 Ack=170865 Win=203648 Len=0 TSval=9612627 TSecr=1684588836
 58   0.011114 54.230.119.55 -> 172.31.8.238 TCP 5858 [TCP segment of a reassembled PDU]
 59   0.011131 172.31.8.238 -> 54.230.119.55 TCP 66 42954 > http [ACK] Seq=97 Ack=176657 Win=203648 Len=0 TSval=9612627 TSecr=1684588836
 60   0.011280 54.230.119.55 -> 172.31.8.238 TCP 26130 [TCP segment of a reassembled PDU]
 61   0.011306 172.31.8.238 -> 54.230.119.55 TCP 66 42954 > http [ACK] Seq=97 Ack=202721 Win=177664 Len=0 TSval=9612627 TSecr=1684588836
 62   0.011616 54.230.119.55 -> 172.31.8.238 TCP 2962 [TCP segment of a reassembled PDU]
 63   0.011621 172.31.8.238 -> 54.230.119.55 TCP 66 42954 > http [ACK] Seq=97 Ack=205617 Win=202496 Len=0 TSval=9612627 TSecr=1684588836
 64   0.011743 54.230.119.55 -> 172.31.8.238 TCP 7306 [TCP segment of a reassembled PDU]
 65   0.011762 172.31.8.238 -> 54.230.119.55 TCP 66 42954 > http [ACK] Seq=97 Ack=212857 Win=203648 Len=0 TSval=9612628 TSecr=1684588836
 66   0.011992 54.230.119.55 -> 172.31.8.238 TCP 20338 [TCP segment of a reassembled PDU]
 67   0.012003 172.31.8.238 -> 54.230.119.55 TCP 66 42954 > http [ACK] Seq=97 Ack=233129 Win=244096 Len=0 TSval=9612628 TSecr=1684588836
 68   0.012124 54.230.119.55 -> 172.31.8.238 TCP 21786 [TCP segment of a reassembled PDU]
 69   0.012136 172.31.8.238 -> 54.230.119.55 TCP 66 42954 > http [ACK] Seq=97 Ack=254849 Win=287616 Len=0 TSval=9612628 TSecr=1684588836
 70   0.012652 54.230.119.55 -> 172.31.8.238 TCP 2962 [TCP segment of a reassembled PDU]
 71   0.012659 172.31.8.238 -> 54.230.119.55 TCP 66 42954 > http [ACK] Seq=97 Ack=257745 Win=293376 Len=0 TSval=9612628 TSecr=1684588836
 72   0.012825 54.230.119.55 -> 172.31.8.238 TCP 26130 [TCP segment of a reassembled PDU]
 73   0.012839 172.31.8.238 -> 54.230.119.55 TCP 66 42954 > http [ACK] Seq=97 Ack=283809 Win=345472 Len=0 TSval=9612628 TSecr=1684588836
 74   0.012894 54.230.119.55 -> 172.31.8.238 TCP 23234 [TCP segment of a reassembled PDU]
 75   0.012919 172.31.8.238 -> 54.230.119.55 TCP 66 42954 > http [ACK] Seq=97 Ack=306977 Win=391808 Len=0 TSval=9612628 TSecr=1684588836
 76   0.012964 54.230.119.55 -> 172.31.8.238 TCP 5858 [TCP segment of a reassembled PDU]
 77   0.012970 172.31.8.238 -> 54.230.119.55 TCP 66 42954 > http [ACK] Seq=97 Ack=312769 Win=403456 Len=0 TSval=9612628 TSecr=1684588836
 78   0.013445 54.230.119.55 -> 172.31.8.238 TCP 2962 [TCP segment of a reassembled PDU]
 79   0.013450 172.31.8.238 -> 54.230.119.55 TCP 66 42954 > http [ACK] Seq=97 Ack=315665 Win=409216 Len=0 TSval=9612628 TSecr=1684588837
 80   0.013630 54.230.119.55 -> 172.31.8.238 TCP 26130 [TCP segment of a reassembled PDU]
 81   0.013644 172.31.8.238 -> 54.230.119.55 TCP 66 42954 > http [ACK] Seq=97 Ack=341729 Win=461312 Len=0 TSval=9612628 TSecr=1684588837
 82   0.013698 54.230.119.55 -> 172.31.8.238 TCP 20338 [TCP segment of a reassembled PDU]
 83   0.013709 172.31.8.238 -> 54.230.119.55 TCP 66 42954 > http [ACK] Seq=97 Ack=362001 Win=501888 Len=0 TSval=9612628 TSecr=1684588837
 84   0.013753 54.230.119.55 -> 172.31.8.238 TCP 7306 [TCP segment of a reassembled PDU]
 85   0.013759 172.31.8.238 -> 54.230.119.55 TCP 66 42954 > http [ACK] Seq=97 Ack=369241 Win=516352 Len=0 TSval=9612628 TSecr=1684588837
 86   0.014247 54.230.119.55 -> 172.31.8.238 TCP 1514 [TCP segment of a reassembled PDU]
 87   0.014253 172.31.8.238 -> 54.230.119.55 TCP 66 42954 > http [ACK] Seq=97 Ack=370689 Win=519296 Len=0 TSval=9612628 TSecr=1684588837
 88   0.014445 54.230.119.55 -> 172.31.8.238 TCP 26130 [TCP segment of a reassembled PDU]
 89   0.014458 172.31.8.238 -> 54.230.119.55 TCP 66 42954 > http [ACK] Seq=97 Ack=396753 Win=571392 Len=0 TSval=9612628 TSecr=1684588837
 90   0.014518 54.230.119.55 -> 172.31.8.238 TCP 26130 [TCP segment of a reassembled PDU]
 91   0.014532 172.31.8.238 -> 54.230.119.55 TCP 66 42954 > http [ACK] Seq=97 Ack=422817 Win=623488 Len=0 TSval=9612628 TSecr=1684588837
 92   0.014586 54.230.119.55 -> 172.31.8.238 TCP 7306 [TCP segment of a reassembled PDU]
 93   0.014592 172.31.8.238 -> 54.230.119.55 TCP 66 42954 > http [ACK] Seq=97 Ack=430057 Win=637952 Len=0 TSval=9612628 TSecr=1684588837
 94   0.015080 54.230.119.55 -> 172.31.8.238 TCP 2962 [TCP segment of a reassembled PDU]
 95   0.015085 172.31.8.238 -> 54.230.119.55 TCP 66 42954 > http [ACK] Seq=97 Ack=432953 Win=643840 Len=0 TSval=9612628 TSecr=1684588837
 96   0.015243 54.230.119.55 -> 172.31.8.238 TCP 26130 [TCP segment of a reassembled PDU]
 97   0.015256 172.31.8.238 -> 54.230.119.55 TCP 66 42954 > http [ACK] Seq=97 Ack=459017 Win=695936 Len=0 TSval=9612628 TSecr=1684588837
 98   0.015288 54.230.119.55 -> 172.31.8.238 TCP 8754 [TCP segment of a reassembled PDU]
 99   0.015296 172.31.8.238 -> 54.230.119.55 TCP 66 42954 > http [ACK] Seq=97 Ack=467705 Win=713344 Len=0 TSval=9612628 TSecr=1684588837
100   0.015414 54.230.119.55 -> 172.31.8.238 TCP 11650 [TCP segment of a reassembled PDU]
101   0.015423 172.31.8.238 -> 54.230.119.55 TCP 66 42954 > http [ACK] Seq=97 Ack=479289 Win=736512 Len=0 TSval=9612628 TSecr=1684588837
102   0.015521 54.230.119.55 -> 172.31.8.238 TCP 17442 [TCP segment of a reassembled PDU]
103   0.015532 172.31.8.238 -> 54.230.119.55 TCP 66 42954 > http [ACK] Seq=97 Ack=496665 Win=771200 Len=0 TSval=9612628 TSecr=1684588837
104   0.015890 54.230.119.55 -> 172.31.8.238 TCP 2962 [TCP segment of a reassembled PDU]
105   0.015897 172.31.8.238 -> 54.230.119.55 TCP 66 42954 > http [ACK] Seq=97 Ack=499561 Win=776960 Len=0 TSval=9612629 TSecr=1684588837
106   0.016074 54.230.119.55 -> 172.31.8.238 TCP 26130 [TCP segment of a reassembled PDU]
107   0.016099 172.31.8.238 -> 54.230.119.55 TCP 66 42954 > http [ACK] Seq=97 Ack=525625 Win=829184 Len=0 TSval=9612629 TSecr=1684588837
108   0.016159 54.230.119.55 -> 172.31.8.238 TCP 26130 [TCP segment of a reassembled PDU]
109   0.016172 172.31.8.238 -> 54.230.119.55 TCP 66 42954 > http [ACK] Seq=97 Ack=551689 Win=881280 Len=0 TSval=9612629 TSecr=1684588837
110   0.016228 54.230.119.55 -> 172.31.8.238 TCP 8754 [TCP segment of a reassembled PDU]
111   0.016235 172.31.8.238 -> 54.230.119.55 TCP 66 42954 > http [ACK] Seq=97 Ack=560377 Win=898688 Len=0 TSval=9612629 TSecr=1684588837
112   0.016678 54.230.119.55 -> 172.31.8.238 TCP 4410 [TCP segment of a reassembled PDU]
113   0.016683 172.31.8.238 -> 54.230.119.55 TCP 66 42954 > http [ACK] Seq=97 Ack=564721 Win=907392 Len=0 TSval=9612629 TSecr=1684588837
114   0.016860 54.230.119.55 -> 172.31.8.238 TCP 23234 [TCP segment of a reassembled PDU]
115   0.016872 172.31.8.238 -> 54.230.119.55 TCP 66 42954 > http [ACK] Seq=97 Ack=587889 Win=953728 Len=0 TSval=9612629 TSecr=1684588837
116   0.016992 54.230.119.55 -> 172.31.8.238 TCP 10202 [TCP segment of a reassembled PDU]
117   0.017005 172.31.8.238 -> 54.230.119.55 TCP 66 42954 > http [ACK] Seq=97 Ack=598025 Win=973952 Len=0 TSval=9612629 TSecr=1684588837
118   0.017034 54.230.119.55 -> 172.31.8.238 TCP 26130 [TCP segment of a reassembled PDU]
119   0.017047 172.31.8.238 -> 54.230.119.55 TCP 66 42954 > http [ACK] Seq=97 Ack=624089 Win=1026048 Len=0 TSval=9612629 TSecr=1684588837
120   0.017105 54.230.119.55 -> 172.31.8.238 TCP 14546 [TCP segment of a reassembled PDU]
121   0.017114 172.31.8.238 -> 54.230.119.55 TCP 66 42954 > http [ACK] Seq=97 Ack=638569 Win=1054976 Len=0 TSval=9612629 TSecr=1684588837
122   0.017490 54.230.119.55 -> 172.31.8.238 TCP 10202 [TCP segment of a reassembled PDU]
123   0.017499 172.31.8.238 -> 54.230.119.55 TCP 66 42954 > http [ACK] Seq=97 Ack=648705 Win=1075328 Len=0 TSval=9612629 TSecr=1684588837
124   0.017666 54.230.119.55 -> 172.31.8.238 TCP 26130 [TCP segment of a reassembled PDU]
125   0.017681 172.31.8.238 -> 54.230.119.55 TCP 66 42954 > http [ACK] Seq=97 Ack=674769 Win=1127424 Len=0 TSval=9612629 TSecr=1684588837
126   0.017755 54.230.119.55 -> 172.31.8.238 TCP 26130 [TCP segment of a reassembled PDU]
127   0.017768 172.31.8.238 -> 54.230.119.55 TCP 66 42954 > http [ACK] Seq=97 Ack=700833 Win=1179520 Len=0 TSval=9612629 TSecr=1684588837
128   0.017890 54.230.119.55 -> 172.31.8.238 TCP 27578 [TCP segment of a reassembled PDU]
129   0.017905 172.31.8.238 -> 54.230.119.55 TCP 66 42954 > http [ACK] Seq=97 Ack=728345 Win=1234560 Len=0 TSval=9612629 TSecr=1684588837
130   0.018285 54.230.119.55 -> 172.31.8.238 TCP 2962 [TCP segment of a reassembled PDU]
131   0.018292 172.31.8.238 -> 54.230.119.55 TCP 66 42954 > http [ACK] Seq=97 Ack=731241 Win=1240320 Len=0 TSval=9612629 TSecr=1684588837
132   0.018468 54.230.119.55 -> 172.31.8.238 TCP 26130 [TCP segment of a reassembled PDU]
133   0.018482 172.31.8.238 -> 54.230.119.55 TCP 66 42954 > http [ACK] Seq=97 Ack=757305 Win=1292544 Len=0 TSval=9612629 TSecr=1684588837
134   0.018542 54.230.119.55 -> 172.31.8.238 TCP 26130 [TCP segment of a reassembled PDU]
135   0.018557 172.31.8.238 -> 54.230.119.55 TCP 66 42954 > http [ACK] Seq=97 Ack=783369 Win=1344640 Len=0 TSval=9612629 TSecr=1684588837
136   0.018636 54.230.119.55 -> 172.31.8.238 TCP 26130 [TCP segment of a reassembled PDU]
137   0.018650 172.31.8.238 -> 54.230.119.55 TCP 66 42954 > http [ACK] Seq=97 Ack=809433 Win=1396736 Len=0 TSval=9612629 TSecr=1684588837
138   0.018713 54.230.119.55 -> 172.31.8.238 TCP 20338 [TCP segment of a reassembled PDU]
139   0.018725 172.31.8.238 -> 54.230.119.55 TCP 66 42954 > http [ACK] Seq=97 Ack=829705 Win=1408384 Len=0 TSval=9612629 TSecr=1684588837
140   0.019162 54.230.119.55 -> 172.31.8.238 TCP 2962 [TCP segment of a reassembled PDU]
141   0.019168 172.31.8.238 -> 54.230.119.55 TCP 66 42954 > http [ACK] Seq=97 Ack=832601 Win=1433216 Len=0 TSval=9612629 TSecr=1684588837
142   0.019339 54.230.119.55 -> 172.31.8.238 TCP 26130 [TCP segment of a reassembled PDU]
143   0.019365 172.31.8.238 -> 54.230.119.55 TCP 66 42954 > http [ACK] Seq=97 Ack=858665 Win=1407232 Len=0 TSval=9612629 TSecr=1684588837
144   0.019418 54.230.119.55 -> 172.31.8.238 TCP 26130 [TCP segment of a reassembled PDU]
145   0.019444 172.31.8.238 -> 54.230.119.55 TCP 66 42954 > http [ACK] Seq=97 Ack=884729 Win=1398912 Len=0 TSval=9612629 TSecr=1684588837
146   0.019506 54.230.119.55 -> 172.31.8.238 TCP 26130 [TCP segment of a reassembled PDU]
147   0.019520 172.31.8.238 -> 54.230.119.55 TCP 66 42954 > http [ACK] Seq=97 Ack=910793 Win=1398912 Len=0 TSval=9612629 TSecr=1684588837
148   0.019569 54.230.119.55 -> 172.31.8.238 TCP 13098 [TCP segment of a reassembled PDU]
149   0.019579 172.31.8.238 -> 54.230.119.55 TCP 66 42954 > http [ACK] Seq=97 Ack=923825 Win=1420288 Len=0 TSval=9612629 TSecr=1684588837
150   0.020115 54.230.119.55 -> 172.31.8.238 TCP 4410 [TCP segment of a reassembled PDU]
151   0.020123 172.31.8.238 -> 54.230.119.55 TCP 66 42954 > http [ACK] Seq=97 Ack=928169 Win=1433216 Len=0 TSval=9612630 TSecr=1684588837
152   0.020285 54.230.119.55 -> 172.31.8.238 TCP 26130 [TCP segment of a reassembled PDU]
153   0.020298 172.31.8.238 -> 54.230.119.55 TCP 66 42954 > http [ACK] Seq=97 Ack=954233 Win=1461888 Len=0 TSval=9612630 TSecr=1684588837
