[Measurement for 1mb at 08:40:23 20.40.2014] 
Tshark:

  1   0.000000 172.31.8.238 -> 172.31.0.2   DNS 89 Standard query 0xf892  A d39wppo36gwqpx.cloudfront.net
  2   0.000029 172.31.8.238 -> 172.31.0.2   DNS 89 Standard query 0x1017  AAAA d39wppo36gwqpx.cloudfront.net
  3   0.000557   172.31.0.2 -> 172.31.8.238 DNS 170 Standard query response 0x1017 
  4   0.000570   172.31.0.2 -> 172.31.8.238 DNS 217 Standard query response 0xf892  A 54.239.132.173 A 54.192.118.219 A 54.192.118.221 A 54.192.118.233 A 54.192.118.247 A 54.230.116.73 A 54.230.116.98 A 54.239.132.147
  5   0.003890 172.31.8.238 -> 54.239.132.173 TCP 74 45982 > http [SYN] Seq=0 Win=26883 Len=0 MSS=8961 SACK_PERM=1 TSval=14112736 TSecr=0 WS=128
  6   0.004413 54.239.132.173 -> 172.31.8.238 TCP 74 http > 45982 [SYN, ACK] Seq=0 Ack=1 Win=14480 Len=0 MSS=1460 SACK_PERM=1 TSval=1685960210 TSecr=14112736 WS=128
  7   0.004427 172.31.8.238 -> 54.239.132.173 TCP 66 45982 > http [ACK] Seq=1 Ack=1 Win=27008 Len=0 TSval=14112736 TSecr=1685960210
  8   0.004464 172.31.8.238 -> 54.239.132.173 HTTP 162 GET /1mb HTTP/1.1 
  9   0.005186 54.239.132.173 -> 172.31.8.238 TCP 66 http > 45982 [ACK] Seq=1 Ack=97 Win=14592 Len=0 TSval=1685960210 TSecr=14112736
 10   0.006670 54.239.132.173 -> 172.31.8.238 TCP 523 [TCP segment of a reassembled PDU]
 11   0.006679 172.31.8.238 -> 54.239.132.173 TCP 66 45982 > http [ACK] Seq=97 Ack=458 Win=28032 Len=0 TSval=14112737 TSecr=1685960210
 12   0.006830 54.239.132.173 -> 172.31.8.238 TCP 13098 [TCP segment of a reassembled PDU]
 13   0.006840 172.31.8.238 -> 54.239.132.173 TCP 66 45982 > http [ACK] Seq=97 Ack=13490 Win=54144 Len=0 TSval=14112737 TSecr=1685960210
 14   0.007474 54.239.132.173 -> 172.31.8.238 TCP 5858 [TCP segment of a reassembled PDU]
 15   0.007481 172.31.8.238 -> 54.239.132.173 TCP 66 45982 > http [ACK] Seq=97 Ack=19282 Win=65664 Len=0 TSval=14112737 TSecr=1685960210
 16   0.007595 54.239.132.173 -> 172.31.8.238 TCP 7306 [TCP segment of a reassembled PDU]
 17   0.007602 172.31.8.238 -> 54.239.132.173 TCP 66 45982 > http [ACK] Seq=97 Ack=26522 Win=80128 Len=0 TSval=14112737 TSecr=1685960210
 18   0.007989 54.239.132.173 -> 172.31.8.238 TCP 4410 [TCP segment of a reassembled PDU]
 19   0.007996 172.31.8.238 -> 54.239.132.173 TCP 66 45982 > http [ACK] Seq=97 Ack=30866 Win=88832 Len=0 TSval=14112737 TSecr=1685960210
 20   0.008075 54.239.132.173 -> 172.31.8.238 TCP 7306 [TCP segment of a reassembled PDU]
 21   0.008081 172.31.8.238 -> 54.239.132.173 TCP 66 45982 > http [ACK] Seq=97 Ack=38106 Win=103296 Len=0 TSval=14112737 TSecr=1685960210
 22   0.008234 54.239.132.173 -> 172.31.8.238 TCP 5858 [TCP segment of a reassembled PDU]
 23   0.008241 172.31.8.238 -> 54.239.132.173 TCP 66 45982 > http [ACK] Seq=97 Ack=43898 Win=108416 Len=0 TSval=14112737 TSecr=1685960210
 24   0.008337 54.239.132.173 -> 172.31.8.238 TCP 2962 [TCP segment of a reassembled PDU]
 25   0.008343 172.31.8.238 -> 54.239.132.173 TCP 66 45982 > http [ACK] Seq=97 Ack=46794 Win=109056 Len=0 TSval=14112737 TSecr=1685960210
 26   0.008726 54.239.132.173 -> 172.31.8.238 TCP 5858 [TCP segment of a reassembled PDU]
 27   0.008733 172.31.8.238 -> 54.239.132.173 TCP 66 45982 > http [ACK] Seq=97 Ack=52586 Win=108416 Len=0 TSval=14112737 TSecr=1685960210
 28   0.008838 54.239.132.173 -> 172.31.8.238 TCP 13098 [TCP segment of a reassembled PDU]
 29   0.008847 172.31.8.238 -> 54.239.132.173 TCP 66 45982 > http [ACK] Seq=97 Ack=65618 Win=96512 Len=0 TSval=14112737 TSecr=1685960210
 30   0.009265 54.239.132.173 -> 172.31.8.238 TCP 5858 [TCP segment of a reassembled PDU]
 31   0.009272 172.31.8.238 -> 54.239.132.173 TCP 66 45982 > http [ACK] Seq=97 Ack=71410 Win=108416 Len=0 TSval=14112738 TSecr=1685960210
 32   0.009364 54.239.132.173 -> 172.31.8.238 TCP 7306 [TCP segment of a reassembled PDU]
 33   0.009371 172.31.8.238 -> 54.239.132.173 TCP 66 45982 > http [ACK] Seq=97 Ack=78650 Win=123520 Len=0 TSval=14112738 TSecr=1685960210
 34   0.009546 54.239.132.173 -> 172.31.8.238 TCP 8754 [TCP segment of a reassembled PDU]
 35   0.009566 172.31.8.238 -> 54.239.132.173 TCP 66 45982 > http [ACK] Seq=97 Ack=87338 Win=140928 Len=0 TSval=14112738 TSecr=1685960210
 36   0.009656 54.239.132.173 -> 172.31.8.238 TCP 4410 [TCP segment of a reassembled PDU]
 37   0.009662 172.31.8.238 -> 54.239.132.173 TCP 66 45982 > http [ACK] Seq=97 Ack=91682 Win=149632 Len=0 TSval=14112738 TSecr=1685960210
 38   0.009843 54.239.132.173 -> 172.31.8.238 TCP 10202 [TCP segment of a reassembled PDU]
 39   0.009851 172.31.8.238 -> 54.239.132.173 TCP 66 45982 > http [ACK] Seq=97 Ack=101818 Win=169856 Len=0 TSval=14112738 TSecr=1685960210
 40   0.009997 54.239.132.173 -> 172.31.8.238 TCP 2962 [TCP segment of a reassembled PDU]
 41   0.010002 172.31.8.238 -> 54.239.132.173 TCP 66 45982 > http [ACK] Seq=97 Ack=104714 Win=175616 Len=0 TSval=14112738 TSecr=1685960210
 42   0.010312 54.239.132.173 -> 172.31.8.238 TCP 1514 [TCP segment of a reassembled PDU]
 43   0.010316 172.31.8.238 -> 54.239.132.173 TCP 66 45982 > http [ACK] Seq=97 Ack=106162 Win=178560 Len=0 TSval=14112738 TSecr=1685960210
 44   0.010430 54.239.132.173 -> 172.31.8.238 TCP 11650 [TCP segment of a reassembled PDU]
 45   0.010438 172.31.8.238 -> 54.239.132.173 TCP 66 45982 > http [ACK] Seq=97 Ack=117746 Win=201728 Len=0 TSval=14112738 TSecr=1685960210
 46   0.010607 54.239.132.173 -> 172.31.8.238 TCP 13098 [TCP segment of a reassembled PDU]
 47   0.010616 172.31.8.238 -> 54.239.132.173 TCP 66 45982 > http [ACK] Seq=97 Ack=130778 Win=227840 Len=0 TSval=14112738 TSecr=1685960210
 48   0.010901 54.239.132.173 -> 172.31.8.238 TCP 13098 [TCP segment of a reassembled PDU]
 49   0.010912 172.31.8.238 -> 54.239.132.173 TCP 66 45982 > http [ACK] Seq=97 Ack=143810 Win=253824 Len=0 TSval=14112738 TSecr=1685960210
 50   0.011049 54.239.132.173 -> 172.31.8.238 TCP 8754 [TCP segment of a reassembled PDU]
 51   0.011057 172.31.8.238 -> 54.239.132.173 TCP 66 45982 > http [ACK] Seq=97 Ack=152498 Win=271232 Len=0 TSval=14112738 TSecr=1685960210
 52   0.011145 54.239.132.173 -> 172.31.8.238 TCP 4410 [TCP segment of a reassembled PDU]
 53   0.011151 172.31.8.238 -> 54.239.132.173 TCP 66 45982 > http [ACK] Seq=97 Ack=156842 Win=279936 Len=0 TSval=14112738 TSecr=1685960210
 54   0.011399 54.239.132.173 -> 172.31.8.238 TCP 21786 [TCP segment of a reassembled PDU]
 55   0.011412 172.31.8.238 -> 54.239.132.173 TCP 66 45982 > http [ACK] Seq=97 Ack=178562 Win=323328 Len=0 TSval=14112738 TSecr=1685960210
 56   0.011441 54.239.132.173 -> 172.31.8.238 TCP 4410 [TCP segment of a reassembled PDU]
 57   0.011445 172.31.8.238 -> 54.239.132.173 TCP 66 45982 > http [ACK] Seq=97 Ack=182906 Win=332032 Len=0 TSval=14112738 TSecr=1685960210
 58   0.011872 54.239.132.173 -> 172.31.8.238 TCP 11650 [TCP segment of a reassembled PDU]
 59   0.011881 172.31.8.238 -> 54.239.132.173 TCP 66 45982 > http [ACK] Seq=97 Ack=194490 Win=355200 Len=0 TSval=14112738 TSecr=1685960210
 60   0.011995 54.239.132.173 -> 172.31.8.238 TCP 8754 [TCP segment of a reassembled PDU]
 61   0.012003 172.31.8.238 -> 54.239.132.173 TCP 66 45982 > http [ACK] Seq=97 Ack=203178 Win=372608 Len=0 TSval=14112738 TSecr=1685960210
 62   0.012150 54.239.132.173 -> 172.31.8.238 TCP 20338 [TCP segment of a reassembled PDU]
 63   0.012163 172.31.8.238 -> 54.239.132.173 TCP 66 45982 > http [ACK] Seq=97 Ack=223450 Win=413184 Len=0 TSval=14112738 TSecr=1685960210
 64   0.012190 54.239.132.173 -> 172.31.8.238 TCP 2962 [TCP segment of a reassembled PDU]
 65   0.012194 172.31.8.238 -> 54.239.132.173 TCP 66 45982 > http [ACK] Seq=97 Ack=226346 Win=418944 Len=0 TSval=14112738 TSecr=1685960210
 66   0.012454 54.239.132.173 -> 172.31.8.238 TCP 18890 [TCP segment of a reassembled PDU]
 67   0.012465 172.31.8.238 -> 54.239.132.173 TCP 66 45982 > http [ACK] Seq=97 Ack=245170 Win=456576 Len=0 TSval=14112738 TSecr=1685960210
 68   0.012857 54.239.132.173 -> 172.31.8.238 TCP 10202 [TCP segment of a reassembled PDU]
 69   0.012866 172.31.8.238 -> 54.239.132.173 TCP 66 45982 > http [ACK] Seq=97 Ack=255306 Win=476800 Len=0 TSval=14112738 TSecr=1685960210
 70   0.013028 54.239.132.173 -> 172.31.8.238 TCP 26130 [TCP segment of a reassembled PDU]
 71   0.013066 172.31.8.238 -> 54.239.132.173 TCP 66 45982 > http [ACK] Seq=97 Ack=281370 Win=454016 Len=0 TSval=14112739 TSecr=1685960210
 72   0.013119 54.239.132.173 -> 172.31.8.238 TCP 18890 [TCP segment of a reassembled PDU]
 73   0.013131 172.31.8.238 -> 54.239.132.173 TCP 66 45982 > http [ACK] Seq=97 Ack=300194 Win=514560 Len=0 TSval=14112739 TSecr=1685960211
 74   0.013176 54.239.132.173 -> 172.31.8.238 TCP 1514 [TCP segment of a reassembled PDU]
 75   0.013183 172.31.8.238 -> 54.239.132.173 TCP 66 45982 > http [ACK] Seq=97 Ack=301642 Win=517376 Len=0 TSval=14112739 TSecr=1685960211
 76   0.013660 54.239.132.173 -> 172.31.8.238 TCP 23234 [TCP segment of a reassembled PDU]
 77   0.013673 172.31.8.238 -> 54.239.132.173 TCP 66 45982 > http [ACK] Seq=97 Ack=324810 Win=563712 Len=0 TSval=14112739 TSecr=1685960211
 78   0.013780 54.239.132.173 -> 172.31.8.238 TCP 15994 [TCP segment of a reassembled PDU]
 79   0.013790 172.31.8.238 -> 54.239.132.173 TCP 66 45982 > http [ACK] Seq=97 Ack=340738 Win=595584 Len=0 TSval=14112739 TSecr=1685960211
 80   0.013886 54.239.132.173 -> 172.31.8.238 TCP 4410 [TCP segment of a reassembled PDU]
 81   0.013892 172.31.8.238 -> 54.239.132.173 TCP 66 45982 > http [ACK] Seq=97 Ack=345082 Win=604288 Len=0 TSval=14112739 TSecr=1685960211
 82   0.013983 54.239.132.173 -> 172.31.8.238 TCP 15994 [TCP segment of a reassembled PDU]
 83   0.013992 172.31.8.238 -> 54.239.132.173 TCP 66 45982 > http [ACK] Seq=97 Ack=361010 Win=636160 Len=0 TSval=14112739 TSecr=1685960211
 84   0.014365 54.239.132.173 -> 172.31.8.238 TCP 10202 [TCP segment of a reassembled PDU]
 85   0.014373 172.31.8.238 -> 54.239.132.173 TCP 66 45982 > http [ACK] Seq=97 Ack=371146 Win=656384 Len=0 TSval=14112739 TSecr=1685960211
 86   0.014504 54.239.132.173 -> 172.31.8.238 TCP 26130 [TCP segment of a reassembled PDU]
 87   0.014517 172.31.8.238 -> 54.239.132.173 TCP 66 45982 > http [ACK] Seq=97 Ack=397210 Win=708480 Len=0 TSval=14112739 TSecr=1685960211
 88   0.014545 54.239.132.173 -> 172.31.8.238 TCP 8754 [TCP segment of a reassembled PDU]
 89   0.014554 172.31.8.238 -> 54.239.132.173 TCP 66 45982 > http [ACK] Seq=97 Ack=405898 Win=725888 Len=0 TSval=14112739 TSecr=1685960211
 90   0.014615 54.239.132.173 -> 172.31.8.238 TCP 5858 [TCP segment of a reassembled PDU]
 91   0.014621 172.31.8.238 -> 54.239.132.173 TCP 66 45982 > http [ACK] Seq=97 Ack=411690 Win=737536 Len=0 TSval=14112739 TSecr=1685960211
 92   0.014738 54.239.132.173 -> 172.31.8.238 TCP 17442 [TCP segment of a reassembled PDU]
 93   0.014747 172.31.8.238 -> 54.239.132.173 TCP 66 45982 > http [ACK] Seq=97 Ack=429066 Win=772224 Len=0 TSval=14112739 TSecr=1685960211
 94   0.015177 54.239.132.173 -> 172.31.8.238 TCP 13098 [TCP segment of a reassembled PDU]
 95   0.015187 172.31.8.238 -> 54.239.132.173 TCP 66 45982 > http [ACK] Seq=97 Ack=442098 Win=798336 Len=0 TSval=14112739 TSecr=1685960211
 96   0.015315 54.239.132.173 -> 172.31.8.238 TCP 17442 [TCP segment of a reassembled PDU]
 97   0.015326 172.31.8.238 -> 54.239.132.173 TCP 66 45982 > http [ACK] Seq=97 Ack=459474 Win=833024 Len=0 TSval=14112739 TSecr=1685960211
 98   0.015348 54.239.132.173 -> 172.31.8.238 TCP 8754 [TCP segment of a reassembled PDU]
 99   0.015356 172.31.8.238 -> 54.239.132.173 TCP 66 45982 > http [ACK] Seq=97 Ack=468162 Win=850432 Len=0 TSval=14112739 TSecr=1685960211
100   0.015423 54.239.132.173 -> 172.31.8.238 TCP 11650 [TCP segment of a reassembled PDU]
101   0.015431 172.31.8.238 -> 54.239.132.173 TCP 66 45982 > http [ACK] Seq=97 Ack=479746 Win=873600 Len=0 TSval=14112739 TSecr=1685960211
102   0.015500 54.239.132.173 -> 172.31.8.238 TCP 24682 [TCP segment of a reassembled PDU]
103   0.015513 172.31.8.238 -> 54.239.132.173 TCP 66 45982 > http [ACK] Seq=97 Ack=504362 Win=922880 Len=0 TSval=14112739 TSecr=1685960211
104   0.015678 54.239.132.173 -> 172.31.8.238 TCP 7306 [TCP segment of a reassembled PDU]
105   0.015684 172.31.8.238 -> 54.239.132.173 TCP 66 45982 > http [ACK] Seq=97 Ack=511602 Win=937344 Len=0 TSval=14112739 TSecr=1685960211
106   0.016015 54.239.132.173 -> 172.31.8.238 TCP 26130 [TCP segment of a reassembled PDU]
107   0.016029 172.31.8.238 -> 54.239.132.173 TCP 66 45982 > http [ACK] Seq=97 Ack=537666 Win=984320 Len=0 TSval=14112739 TSecr=1685960211
108   0.016204 54.239.132.173 -> 172.31.8.238 TCP 13098 [TCP segment of a reassembled PDU]
109   0.016213 172.31.8.238 -> 54.239.132.173 TCP 66 45982 > http [ACK] Seq=97 Ack=550698 Win=1005824 Len=0 TSval=14112739 TSecr=1685960211
110   0.016334 54.239.132.173 -> 172.31.8.238 TCP 23234 [TCP segment of a reassembled PDU]
111   0.016347 172.31.8.238 -> 54.239.132.173 TCP 66 45982 > http [ACK] Seq=97 Ack=573866 Win=989056 Len=0 TSval=14112739 TSecr=1685960211
112   0.016352 54.239.132.173 -> 172.31.8.238 TCP 2962 [TCP segment of a reassembled PDU]
113   0.016358 172.31.8.238 -> 54.239.132.173 TCP 66 45982 > http [ACK] Seq=97 Ack=576762 Win=986240 Len=0 TSval=14112739 TSecr=1685960211
114   0.016698 54.239.132.173 -> 172.31.8.238 TCP 14546 [TCP segment of a reassembled PDU]
115   0.016708 172.31.8.238 -> 54.239.132.173 TCP 66 45982 > http [ACK] Seq=97 Ack=591242 Win=1003264 Len=0 TSval=14112739 TSecr=1685960211
116   0.016842 54.239.132.173 -> 172.31.8.238 TCP 26130 [TCP segment of a reassembled PDU]
117   0.016855 172.31.8.238 -> 54.239.132.173 TCP 66 45982 > http [ACK] Seq=97 Ack=617306 Win=984320 Len=0 TSval=14112739 TSecr=1685960211
118   0.016889 54.239.132.173 -> 172.31.8.238 TCP 5858 [TCP segment of a reassembled PDU]
119   0.016896 172.31.8.238 -> 54.239.132.173 TCP 66 45982 > http [ACK] Seq=97 Ack=623098 Win=978560 Len=0 TSval=14112739 TSecr=1685960211
120   0.017117 54.239.132.173 -> 172.31.8.238 TCP 18890 [TCP segment of a reassembled PDU]
121   0.017128 172.31.8.238 -> 54.239.132.173 TCP 66 45982 > http [ACK] Seq=97 Ack=641922 Win=996224 Len=0 TSval=14112740 TSecr=1685960211
122   0.017217 54.239.132.173 -> 172.31.8.238 TCP 7306 [TCP segment of a reassembled PDU]
123   0.017224 172.31.8.238 -> 54.239.132.173 TCP 66 45982 > http [ACK] Seq=97 Ack=649162 Win=1030016 Len=0 TSval=14112740 TSecr=1685960211
124   0.017393 54.239.132.173 -> 172.31.8.238 TCP 26130 [TCP segment of a reassembled PDU]
125   0.017407 172.31.8.238 -> 54.239.132.173 TCP 66 45982 > http [ACK] Seq=97 Ack=675226 Win=1082112 Len=0 TSval=14112740 TSecr=1685960211
126   0.017452 54.239.132.173 -> 172.31.8.238 TCP 10202 [TCP segment of a reassembled PDU]
127   0.017458 172.31.8.238 -> 54.239.132.173 TCP 66 45982 > http [ACK] Seq=97 Ack=685362 Win=1102336 Len=0 TSval=14112740 TSecr=1685960211
128   0.017595 54.239.132.173 -> 172.31.8.238 TCP 21786 [TCP segment of a reassembled PDU]
129   0.017620 172.31.8.238 -> 54.239.132.173 TCP 66 45982 > http [ACK] Seq=97 Ack=707082 Win=1145856 Len=0 TSval=14112740 TSecr=1685960211
130   0.017838 54.239.132.173 -> 172.31.8.238 TCP 26130 [TCP segment of a reassembled PDU]
131   0.017853 172.31.8.238 -> 54.239.132.173 TCP 66 45982 > http [ACK] Seq=97 Ack=733146 Win=1197952 Len=0 TSval=14112740 TSecr=1685960211
132   0.017899 54.239.132.173 -> 172.31.8.238 TCP 13098 [TCP segment of a reassembled PDU]
133   0.017907 172.31.8.238 -> 54.239.132.173 TCP 66 45982 > http [ACK] Seq=97 Ack=746178 Win=1224064 Len=0 TSval=14112740 TSecr=1685960211
134   0.017981 54.239.132.173 -> 172.31.8.238 TCP 11650 [TCP segment of a reassembled PDU]
135   0.017988 172.31.8.238 -> 54.239.132.173 TCP 66 45982 > http [ACK] Seq=97 Ack=757762 Win=1247232 Len=0 TSval=14112740 TSecr=1685960211
136   0.018106 54.239.132.173 -> 172.31.8.238 TCP 14546 [TCP segment of a reassembled PDU]
137   0.018114 172.31.8.238 -> 54.239.132.173 TCP 66 45982 > http [ACK] Seq=97 Ack=772242 Win=1276160 Len=0 TSval=14112740 TSecr=1685960211
138   0.018337 54.239.132.173 -> 172.31.8.238 TCP 13098 [TCP segment of a reassembled PDU]
139   0.018346 172.31.8.238 -> 54.239.132.173 TCP 66 45982 > http [ACK] Seq=97 Ack=785274 Win=1302272 Len=0 TSval=14112740 TSecr=1685960211
140   0.018471 54.239.132.173 -> 172.31.8.238 TCP 23234 [TCP segment of a reassembled PDU]
141   0.018483 172.31.8.238 -> 54.239.132.173 TCP 66 45982 > http [ACK] Seq=97 Ack=808442 Win=1348608 Len=0 TSval=14112740 TSecr=1685960211
142   0.018609 54.239.132.173 -> 172.31.8.238 TCP 26130 [TCP segment of a reassembled PDU]
143   0.018623 172.31.8.238 -> 54.239.132.173 TCP 66 45982 > http [ACK] Seq=97 Ack=834506 Win=1400704 Len=0 TSval=14112740 TSecr=1685960211
144   0.018630 54.239.132.173 -> 172.31.8.238 TCP 2962 [TCP segment of a reassembled PDU]
145   0.018633 172.31.8.238 -> 54.239.132.173 TCP 66 45982 > http [ACK] Seq=97 Ack=837402 Win=1406464 Len=0 TSval=14112740 TSecr=1685960211
146   0.018735 54.239.132.173 -> 172.31.8.238 TCP 2962 [TCP segment of a reassembled PDU]
147   0.018740 172.31.8.238 -> 54.239.132.173 TCP 66 45982 > http [ACK] Seq=97 Ack=840298 Win=1412224 Len=0 TSval=14112740 TSecr=1685960211
148   0.018886 54.239.132.173 -> 172.31.8.238 TCP 26130 [TCP segment of a reassembled PDU]
149   0.018899 172.31.8.238 -> 54.239.132.173 TCP 66 45982 > http [ACK] Seq=97 Ack=866362 Win=1464448 Len=0 TSval=14112740 TSecr=1685960211
150   0.018934 54.239.132.173 -> 172.31.8.238 TCP 13098 [TCP segment of a reassembled PDU]
151   0.018942 172.31.8.238 -> 54.239.132.173 TCP 66 45982 > http [ACK] Seq=97 Ack=879394 Win=1490432 Len=0 TSval=14112740 TSecr=1685960211
152   0.019058 54.239.132.173 -> 172.31.8.238 TCP 17442 [TCP segment of a reassembled PDU]
153   0.019068 172.31.8.238 -> 54.239.132.173 TCP 66 45982 > http [ACK] Seq=97 Ack=896770 Win=1525248 Len=0 TSval=14112740 TSecr=1685960211
154   0.019074 54.239.132.173 -> 172.31.8.238 TCP 1514 [TCP segment of a reassembled PDU]
155   0.019079 172.31.8.238 -> 54.239.132.173 TCP 66 45982 > http [ACK] Seq=97 Ack=898218 Win=1528064 Len=0 TSval=14112740 TSecr=1685960211
156   0.019087 54.239.132.173 -> 172.31.8.238 TCP 4410 [TCP segment of a reassembled PDU]
157   0.019090 172.31.8.238 -> 54.239.132.173 TCP 66 45982 > http [ACK] Seq=97 Ack=902562 Win=1536768 Len=0 TSval=14112740 TSecr=1685960211
158   0.019242 54.239.132.173 -> 172.31.8.238 TCP 8754 [TCP segment of a reassembled PDU]
159   0.019250 172.31.8.238 -> 54.239.132.173 TCP 66 45982 > http [ACK] Seq=97 Ack=911250 Win=1554176 Len=0 TSval=14112740 TSecr=1685960211
160   0.019410 54.239.132.173 -> 172.31.8.238 TCP 26130 [TCP segment of a reassembled PDU]
161   0.019424 172.31.8.238 -> 54.239.132.173 TCP 66 45982 > http [ACK] Seq=97 Ack=937314 Win=1606272 Len=0 TSval=14112740 TSecr=1685960211
162   0.019450 54.239.132.173 -> 172.31.8.238 TCP 8754 [TCP segment of a reassembled PDU]
163   0.019456 172.31.8.238 -> 54.239.132.173 TCP 66 45982 > http [ACK] Seq=97 Ack=946002 Win=1606272 Len=0 TSval=14112740 TSecr=1685960211
164   0.019535 54.239.132.173 -> 172.31.8.238 TCP 11650 [TCP segment of a reassembled PDU]
165   0.019543 172.31.8.238 -> 54.239.132.173 TCP 66 45982 > http [ACK] Seq=97 Ack=957586 Win=1606272 Len=0 TSval=14112740 TSecr=1685960211
166   0.019641 54.239.132.173 -> 172.31.8.238 TCP 10202 [TCP segment of a reassembled PDU]
167   0.019649 172.31.8.238 -> 54.239.132.173 TCP 66 45982 > http [ACK] Seq=97 Ack=967722 Win=1606272 Len=0 TSval=14112740 TSecr=1685960211
168   0.019801 54.239.132.173 -> 172.31.8.238 TCP 14546 [TCP segment of a reassembled PDU]
169   0.019809 172.31.8.238 -> 54.239.132.173 TCP 66 45982 > http [ACK] Seq=97 Ack=982202 Win=1606272 Len=0 TSval=14112740 TSecr=1685960211
170   0.019953 54.239.132.173 -> 172.31.8.238 TCP 26130 [TCP segment of a reassembled PDU]
171   0.019967 172.31.8.238 -> 54.239.132.173 TCP 66 45982 > http [ACK] Seq=97 Ack=1008266 Win=1606272 Len=0 TSval=14112740 TSecr=1685960211
172   0.020097 54.239.132.173 -> 172.31.8.238 HTTP 40834 HTTP/1.1 200 OK  (application/octet-stream)
173   0.020117 172.31.8.238 -> 54.239.132.173 TCP 66 45982 > http [ACK] Seq=97 Ack=1049034 Win=1606272 Len=0 TSval=14112740 TSecr=1685960211
174   0.020249 172.31.8.238 -> 54.239.132.173 TCP 66 45982 > http [FIN, ACK] Seq=97 Ack=1049034 Win=1606272 Len=0 TSval=14112740 TSecr=1685960211
175   0.020736 54.239.132.173 -> 172.31.8.238 TCP 66 http > 45982 [FIN, ACK] Seq=1049034 Ack=98 Win=14592 Len=0 TSval=1685960211 TSecr=14112740
176   0.020742 172.31.8.238 -> 54.239.132.173 TCP 66 45982 > http [ACK] Seq=98 Ack=1049035 Win=1606272 Len=0 TSval=14112740 TSecr=1685960211
