[Measurement for 1mb at 02:40:22 20.40.2014] 
Tshark:

  1   0.000000 172.31.8.238 -> 172.31.0.2   DNS 89 Standard query 0x819f  A d39wppo36gwqpx.cloudfront.net
  2   0.000040 172.31.8.238 -> 172.31.0.2   DNS 89 Standard query 0x9440  AAAA d39wppo36gwqpx.cloudfront.net
  3   0.000679   172.31.0.2 -> 172.31.8.238 DNS 217 Standard query response 0x819f  A 54.239.132.55 A 54.239.132.84 A 54.239.132.196 A 54.192.118.228 A 54.192.118.247 A 54.230.116.136 A 54.230.119.58 A 54.230.119.118
  4   0.000691   172.31.0.2 -> 172.31.8.238 DNS 170 Standard query response 0x9440 
  5   0.003879 172.31.8.238 -> 54.239.132.55 TCP 74 35623 > http [SYN] Seq=0 Win=26883 Len=0 MSS=8961 SACK_PERM=1 TSval=8712666 TSecr=0 WS=128
  6   0.004521 54.239.132.55 -> 172.31.8.238 TCP 74 http > 35623 [SYN, ACK] Seq=0 Ack=1 Win=14480 Len=0 MSS=1460 SACK_PERM=1 TSval=1685444551 TSecr=8712666 WS=128
  7   0.004535 172.31.8.238 -> 54.239.132.55 TCP 66 35623 > http [ACK] Seq=1 Ack=1 Win=27008 Len=0 TSval=8712666 TSecr=1685444551
  8   0.004583 172.31.8.238 -> 54.239.132.55 HTTP 162 GET /1mb HTTP/1.1 
  9   0.005421 54.239.132.55 -> 172.31.8.238 TCP 66 http > 35623 [ACK] Seq=1 Ack=97 Win=14592 Len=0 TSval=1685444551 TSecr=8712666
 10   0.007092 54.239.132.55 -> 172.31.8.238 TCP 2592 [TCP segment of a reassembled PDU]
 11   0.007099 172.31.8.238 -> 54.239.132.55 TCP 66 35623 > http [ACK] Seq=97 Ack=2527 Win=32000 Len=0 TSval=8712667 TSecr=1685444552
 12   0.007255 54.239.132.55 -> 172.31.8.238 TCP 11650 [TCP segment of a reassembled PDU]
 13   0.007267 172.31.8.238 -> 54.239.132.55 TCP 66 35623 > http [ACK] Seq=97 Ack=14111 Win=55168 Len=0 TSval=8712667 TSecr=1685444552
 14   0.008004 54.239.132.55 -> 172.31.8.238 TCP 13098 [TCP segment of a reassembled PDU]
 15   0.008013 172.31.8.238 -> 54.239.132.55 TCP 66 35623 > http [ACK] Seq=97 Ack=27143 Win=81280 Len=0 TSval=8712667 TSecr=1685444552
 16   0.008746 54.239.132.55 -> 172.31.8.238 TCP 5858 [TCP segment of a reassembled PDU]
 17   0.008753 172.31.8.238 -> 54.239.132.55 TCP 66 35623 > http [ACK] Seq=97 Ack=32935 Win=92800 Len=0 TSval=8712667 TSecr=1685444552
 18   0.008861 54.239.132.55 -> 172.31.8.238 TCP 7306 [TCP segment of a reassembled PDU]
 19   0.008868 172.31.8.238 -> 54.239.132.55 TCP 66 35623 > http [ACK] Seq=97 Ack=40175 Win=107264 Len=0 TSval=8712668 TSecr=1685444552
 20   0.009522 54.239.132.55 -> 172.31.8.238 TCP 7306 [TCP segment of a reassembled PDU]
 21   0.009529 172.31.8.238 -> 54.239.132.55 TCP 66 35623 > http [ACK] Seq=97 Ack=47415 Win=121728 Len=0 TSval=8712668 TSecr=1685444552
 22   0.009628 54.239.132.55 -> 172.31.8.238 TCP 5858 [TCP segment of a reassembled PDU]
 23   0.009647 172.31.8.238 -> 54.239.132.55 TCP 66 35623 > http [ACK] Seq=97 Ack=53207 Win=133376 Len=0 TSval=8712668 TSecr=1685444552
 24   0.009660 54.239.132.55 -> 172.31.8.238 TCP 8754 [TCP segment of a reassembled PDU]
 25   0.009668 172.31.8.238 -> 54.239.132.55 TCP 66 35623 > http [ACK] Seq=97 Ack=61895 Win=150784 Len=0 TSval=8712668 TSecr=1685444552
 26   0.010348 54.239.132.55 -> 172.31.8.238 TCP 4410 [TCP segment of a reassembled PDU]
 27   0.010354 172.31.8.238 -> 54.239.132.55 TCP 66 35623 > http [ACK] Seq=97 Ack=66239 Win=159360 Len=0 TSval=8712668 TSecr=1685444552
 28   0.010468 54.239.132.55 -> 172.31.8.238 TCP 21786 [TCP segment of a reassembled PDU]
 29   0.010480 172.31.8.238 -> 54.239.132.55 TCP 66 35623 > http [ACK] Seq=97 Ack=87959 Win=162560 Len=0 TSval=8712668 TSecr=1685444552
 30   0.011084 54.239.132.55 -> 172.31.8.238 TCP 15994 [TCP segment of a reassembled PDU]
 31   0.011094 172.31.8.238 -> 54.239.132.55 TCP 66 35623 > http [ACK] Seq=97 Ack=103887 Win=172032 Len=0 TSval=8712668 TSecr=1685444552
 32   0.011137 54.239.132.55 -> 172.31.8.238 TCP 13098 [TCP segment of a reassembled PDU]
 33   0.011146 172.31.8.238 -> 54.239.132.55 TCP 66 35623 > http [ACK] Seq=97 Ack=116919 Win=176896 Len=0 TSval=8712668 TSecr=1685444552
 34   0.011812 54.239.132.55 -> 172.31.8.238 TCP 10202 [TCP segment of a reassembled PDU]
 35   0.011833 172.31.8.238 -> 54.239.132.55 TCP 66 35623 > http [ACK] Seq=97 Ack=127055 Win=181632 Len=0 TSval=8712668 TSecr=1685444552
 36   0.011922 54.239.132.55 -> 172.31.8.238 TCP 7306 [TCP segment of a reassembled PDU]
 37   0.011929 172.31.8.238 -> 54.239.132.55 TCP 66 35623 > http [ACK] Seq=97 Ack=134295 Win=174464 Len=0 TSval=8712668 TSecr=1685444552
 38   0.011968 54.239.132.55 -> 172.31.8.238 TCP 14546 [TCP segment of a reassembled PDU]
 39   0.011976 172.31.8.238 -> 54.239.132.55 TCP 66 35623 > http [ACK] Seq=97 Ack=148775 Win=160000 Len=0 TSval=8712668 TSecr=1685444552
 40   0.012559 54.239.132.55 -> 172.31.8.238 TCP 2962 [TCP segment of a reassembled PDU]
 41   0.012565 172.31.8.238 -> 54.239.132.55 TCP 66 35623 > http [ACK] Seq=97 Ack=151671 Win=193408 Len=0 TSval=8712668 TSecr=1685444552
 42   0.012698 54.239.132.55 -> 172.31.8.238 TCP 26130 [TCP segment of a reassembled PDU]
 43   0.012711 172.31.8.238 -> 54.239.132.55 TCP 66 35623 > http [ACK] Seq=97 Ack=177735 Win=167424 Len=0 TSval=8712668 TSecr=1685444552
 44   0.012735 54.239.132.55 -> 172.31.8.238 TCP 7306 [TCP segment of a reassembled PDU]
 45   0.012740 172.31.8.238 -> 54.239.132.55 TCP 66 35623 > http [ACK] Seq=97 Ack=184975 Win=160256 Len=0 TSval=8712669 TSecr=1685444552
 46   0.013332 54.239.132.55 -> 172.31.8.238 TCP 5858 [TCP segment of a reassembled PDU]
 47   0.013339 172.31.8.238 -> 54.239.132.55 TCP 66 35623 > http [ACK] Seq=97 Ack=190767 Win=214400 Len=0 TSval=8712669 TSecr=1685444552
 48   0.013472 54.239.132.55 -> 172.31.8.238 TCP 26130 [TCP segment of a reassembled PDU]
 49   0.013485 172.31.8.238 -> 54.239.132.55 TCP 66 35623 > http [ACK] Seq=97 Ack=216831 Win=266624 Len=0 TSval=8712669 TSecr=1685444552
 50   0.014101 54.239.132.55 -> 172.31.8.238 TCP 5858 [TCP segment of a reassembled PDU]
 51   0.014108 172.31.8.238 -> 54.239.132.55 TCP 66 35623 > http [ACK] Seq=97 Ack=222623 Win=278144 Len=0 TSval=8712669 TSecr=1685444552
 52   0.014284 54.239.132.55 -> 172.31.8.238 TCP 24682 [TCP segment of a reassembled PDU]
 53   0.014297 172.31.8.238 -> 54.239.132.55 TCP 66 35623 > http [ACK] Seq=97 Ack=247239 Win=327424 Len=0 TSval=8712669 TSecr=1685444552
 54   0.014303 54.239.132.55 -> 172.31.8.238 TCP 1514 [TCP segment of a reassembled PDU]
 55   0.014305 172.31.8.238 -> 54.239.132.55 TCP 66 35623 > http [ACK] Seq=97 Ack=248687 Win=330240 Len=0 TSval=8712669 TSecr=1685444552
 56   0.014415 54.239.132.55 -> 172.31.8.238 TCP 11650 [TCP segment of a reassembled PDU]
 57   0.014422 172.31.8.238 -> 54.239.132.55 TCP 66 35623 > http [ACK] Seq=97 Ack=260271 Win=353408 Len=0 TSval=8712669 TSecr=1685444552
 58   0.014849 54.239.132.55 -> 172.31.8.238 TCP 5858 [TCP segment of a reassembled PDU]
 59   0.014857 172.31.8.238 -> 54.239.132.55 TCP 66 35623 > http [ACK] Seq=97 Ack=266063 Win=365056 Len=0 TSval=8712669 TSecr=1685444552
 60   0.014990 54.239.132.55 -> 172.31.8.238 TCP 15994 [TCP segment of a reassembled PDU]
 61   0.015000 172.31.8.238 -> 54.239.132.55 TCP 66 35623 > http [ACK] Seq=97 Ack=281991 Win=396928 Len=0 TSval=8712669 TSecr=1685444552
 62   0.015237 54.239.132.55 -> 172.31.8.238 TCP 26130 [TCP segment of a reassembled PDU]
 63   0.015250 172.31.8.238 -> 54.239.132.55 TCP 66 35623 > http [ACK] Seq=97 Ack=308055 Win=449024 Len=0 TSval=8712669 TSecr=1685444552
 64   0.015256 54.239.132.55 -> 172.31.8.238 TCP 1514 [TCP segment of a reassembled PDU]
 65   0.015258 172.31.8.238 -> 54.239.132.55 TCP 66 35623 > http [ACK] Seq=97 Ack=309503 Win=451968 Len=0 TSval=8712669 TSecr=1685444552
 66   0.015622 54.239.132.55 -> 172.31.8.238 TCP 7306 [TCP segment of a reassembled PDU]
 67   0.015629 172.31.8.238 -> 54.239.132.55 TCP 66 35623 > http [ACK] Seq=97 Ack=316743 Win=466432 Len=0 TSval=8712669 TSecr=1685444553
 68   0.015770 54.239.132.55 -> 172.31.8.238 TCP 17442 [TCP segment of a reassembled PDU]
 69   0.015780 172.31.8.238 -> 54.239.132.55 TCP 66 35623 > http [ACK] Seq=97 Ack=334119 Win=501120 Len=0 TSval=8712669 TSecr=1685444553
 70   0.015998 54.239.132.55 -> 172.31.8.238 TCP 13098 [TCP segment of a reassembled PDU]
 71   0.016007 172.31.8.238 -> 54.239.132.55 TCP 66 35623 > http [ACK] Seq=97 Ack=347151 Win=527232 Len=0 TSval=8712669 TSecr=1685444553
 72   0.016398 54.239.132.55 -> 172.31.8.238 TCP 7306 [TCP segment of a reassembled PDU]
 73   0.016405 172.31.8.238 -> 54.239.132.55 TCP 66 35623 > http [ACK] Seq=97 Ack=354391 Win=541696 Len=0 TSval=8712669 TSecr=1685444553
 74   0.016524 54.239.132.55 -> 172.31.8.238 TCP 18890 [TCP segment of a reassembled PDU]
 75   0.016534 172.31.8.238 -> 54.239.132.55 TCP 66 35623 > http [ACK] Seq=97 Ack=373215 Win=579328 Len=0 TSval=8712669 TSecr=1685444553
 76   0.016764 54.239.132.55 -> 172.31.8.238 TCP 26130 [TCP segment of a reassembled PDU]
 77   0.016778 172.31.8.238 -> 54.239.132.55 TCP 66 35623 > http [ACK] Seq=97 Ack=399279 Win=631424 Len=0 TSval=8712670 TSecr=1685444553
 78   0.016787 54.239.132.55 -> 172.31.8.238 TCP 4410 [TCP segment of a reassembled PDU]
 79   0.016794 172.31.8.238 -> 54.239.132.55 TCP 66 35623 > http [ACK] Seq=97 Ack=403623 Win=640128 Len=0 TSval=8712670 TSecr=1685444553
 80   0.016799 54.239.132.55 -> 172.31.8.238 TCP 2962 [TCP segment of a reassembled PDU]
 81   0.016802 172.31.8.238 -> 54.239.132.55 TCP 66 35623 > http [ACK] Seq=97 Ack=406519 Win=645888 Len=0 TSval=8712670 TSecr=1685444553
 82   0.017183 54.239.132.55 -> 172.31.8.238 TCP 5858 [TCP segment of a reassembled PDU]
 83   0.017190 172.31.8.238 -> 54.239.132.55 TCP 66 35623 > http [ACK] Seq=97 Ack=412311 Win=657536 Len=0 TSval=8712670 TSecr=1685444553
 84   0.017293 54.239.132.55 -> 172.31.8.238 TCP 23234 [TCP segment of a reassembled PDU]
 85   0.017305 172.31.8.238 -> 54.239.132.55 TCP 66 35623 > http [ACK] Seq=97 Ack=435479 Win=703872 Len=0 TSval=8712670 TSecr=1685444553
 86   0.017452 54.239.132.55 -> 172.31.8.238 TCP 11650 [TCP segment of a reassembled PDU]
 87   0.017461 172.31.8.238 -> 54.239.132.55 TCP 66 35623 > http [ACK] Seq=97 Ack=447063 Win=727040 Len=0 TSval=8712670 TSecr=1685444553
 88   0.017582 54.239.132.55 -> 172.31.8.238 TCP 15994 [TCP segment of a reassembled PDU]
 89   0.017591 172.31.8.238 -> 54.239.132.55 TCP 66 35623 > http [ACK] Seq=97 Ack=462991 Win=758912 Len=0 TSval=8712670 TSecr=1685444553
 90   0.017911 54.239.132.55 -> 172.31.8.238 TCP 4410 [TCP segment of a reassembled PDU]
 91   0.017917 172.31.8.238 -> 54.239.132.55 TCP 66 35623 > http [ACK] Seq=97 Ack=467335 Win=767616 Len=0 TSval=8712670 TSecr=1685444553
 92   0.018104 54.239.132.55 -> 172.31.8.238 TCP 26130 [TCP segment of a reassembled PDU]
 93   0.018118 172.31.8.238 -> 54.239.132.55 TCP 66 35623 > http [ACK] Seq=97 Ack=493399 Win=819712 Len=0 TSval=8712670 TSecr=1685444553
 94   0.018180 54.239.132.55 -> 172.31.8.238 TCP 26130 [TCP segment of a reassembled PDU]
 95   0.018194 172.31.8.238 -> 54.239.132.55 TCP 66 35623 > http [ACK] Seq=97 Ack=519463 Win=871808 Len=0 TSval=8712670 TSecr=1685444553
 96   0.018247 54.239.132.55 -> 172.31.8.238 TCP 15994 [TCP segment of a reassembled PDU]
 97   0.018257 172.31.8.238 -> 54.239.132.55 TCP 66 35623 > http [ACK] Seq=97 Ack=535391 Win=903680 Len=0 TSval=8712670 TSecr=1685444553
 98   0.018725 54.239.132.55 -> 172.31.8.238 TCP 4410 [TCP segment of a reassembled PDU]
 99   0.018731 172.31.8.238 -> 54.239.132.55 TCP 66 35623 > http [ACK] Seq=97 Ack=539735 Win=912384 Len=0 TSval=8712670 TSecr=1685444553
100   0.018900 54.239.132.55 -> 172.31.8.238 TCP 26130 [TCP segment of a reassembled PDU]
101   0.018913 172.31.8.238 -> 54.239.132.55 TCP 66 35623 > http [ACK] Seq=97 Ack=565799 Win=964480 Len=0 TSval=8712670 TSecr=1685444553
102   0.018920 54.239.132.55 -> 172.31.8.238 TCP 2962 [TCP segment of a reassembled PDU]
103   0.018923 172.31.8.238 -> 54.239.132.55 TCP 66 35623 > http [ACK] Seq=97 Ack=568695 Win=970240 Len=0 TSval=8712670 TSecr=1685444553
104   0.019062 54.239.132.55 -> 172.31.8.238 TCP 21786 [TCP segment of a reassembled PDU]
105   0.019074 172.31.8.238 -> 54.239.132.55 TCP 66 35623 > http [ACK] Seq=97 Ack=590415 Win=1013760 Len=0 TSval=8712670 TSecr=1685444553
106   0.019171 54.239.132.55 -> 172.31.8.238 TCP 17442 [TCP segment of a reassembled PDU]
107   0.019181 172.31.8.238 -> 54.239.132.55 TCP 66 35623 > http [ACK] Seq=97 Ack=607791 Win=1048448 Len=0 TSval=8712670 TSecr=1685444553
108   0.019709 54.239.132.55 -> 172.31.8.238 TCP 2962 [TCP segment of a reassembled PDU]
109   0.019715 172.31.8.238 -> 54.239.132.55 TCP 66 35623 > http [ACK] Seq=97 Ack=610687 Win=1054336 Len=0 TSval=8712670 TSecr=1685444553
110   0.019887 54.239.132.55 -> 172.31.8.238 TCP 17442 [TCP segment of a reassembled PDU]
111   0.019897 172.31.8.238 -> 54.239.132.55 TCP 66 35623 > http [ACK] Seq=97 Ack=628063 Win=1089024 Len=0 TSval=8712670 TSecr=1685444553
112   0.019925 54.239.132.55 -> 172.31.8.238 TCP 8754 [TCP segment of a reassembled PDU]
113   0.019932 172.31.8.238 -> 54.239.132.55 TCP 66 35623 > http [ACK] Seq=97 Ack=636751 Win=1106432 Len=0 TSval=8712670 TSecr=1685444553
114   0.020035 54.239.132.55 -> 172.31.8.238 TCP 26130 [TCP segment of a reassembled PDU]
115   0.020049 172.31.8.238 -> 54.239.132.55 TCP 66 35623 > http [ACK] Seq=97 Ack=662815 Win=1137536 Len=0 TSval=8712670 TSecr=1685444553
116   0.020086 54.239.132.55 -> 172.31.8.238 TCP 10202 [TCP segment of a reassembled PDU]
117   0.020093 172.31.8.238 -> 54.239.132.55 TCP 66 35623 > http [ACK] Seq=97 Ack=672951 Win=1163776 Len=0 TSval=8712670 TSecr=1685444553
118   0.020499 54.239.132.55 -> 172.31.8.238 TCP 5858 [TCP segment of a reassembled PDU]
119   0.020505 172.31.8.238 -> 54.239.132.55 TCP 66 35623 > http [ACK] Seq=97 Ack=678743 Win=1170816 Len=0 TSval=8712670 TSecr=1685444553
120   0.020690 54.239.132.55 -> 172.31.8.238 TCP 26130 [TCP segment of a reassembled PDU]
121   0.020716 172.31.8.238 -> 54.239.132.55 TCP 66 35623 > http [ACK] Seq=97 Ack=704807 Win=1144832 Len=0 TSval=8712670 TSecr=1685444553
122   0.020770 54.239.132.55 -> 172.31.8.238 TCP 26130 [TCP segment of a reassembled PDU]
123   0.020798 172.31.8.238 -> 54.239.132.55 TCP 66 35623 > http [ACK] Seq=97 Ack=730871 Win=1172608 Len=0 TSval=8712671 TSecr=1685444553
124   0.020825 54.239.132.55 -> 172.31.8.238 TCP 7306 [TCP segment of a reassembled PDU]
125   0.020830 172.31.8.238 -> 54.239.132.55 TCP 66 35623 > http [ACK] Seq=97 Ack=738111 Win=1187072 Len=0 TSval=8712671 TSecr=1685444553
126   0.021257 54.239.132.55 -> 172.31.8.238 TCP 4410 [TCP segment of a reassembled PDU]
127   0.021264 172.31.8.238 -> 54.239.132.55 TCP 66 35623 > http [ACK] Seq=97 Ack=742455 Win=1195776 Len=0 TSval=8712671 TSecr=1685444553
128   0.021445 54.239.132.55 -> 172.31.8.238 TCP 26130 [TCP segment of a reassembled PDU]
129   0.021468 54.239.132.55 -> 172.31.8.238 TCP 4410 [TCP segment of a reassembled PDU]
130   0.021478 172.31.8.238 -> 54.239.132.55 TCP 66 35623 > http [ACK] Seq=97 Ack=772863 Win=1166336 Len=0 TSval=8712671 TSecr=1685444553
131   0.021586 54.239.132.55 -> 172.31.8.238 TCP 20338 [TCP segment of a reassembled PDU]
132   0.021597 172.31.8.238 -> 54.239.132.55 TCP 66 35623 > http [ACK] Seq=97 Ack=793135 Win=1183104 Len=0 TSval=8712671 TSecr=1685444553
133   0.021721 54.239.132.55 -> 172.31.8.238 TCP 43506 [TCP segment of a reassembled PDU]
134   0.021752 172.31.8.238 -> 54.239.132.55 TCP 66 35623 > http [ACK] Seq=97 Ack=836575 Win=1144960 Len=0 TSval=8712671 TSecr=1685444553
135   0.022276 54.239.132.55 -> 172.31.8.238 TCP 2962 [TCP segment of a reassembled PDU]
136   0.022282 172.31.8.238 -> 54.239.132.55 TCP 66 35623 > http [ACK] Seq=97 Ack=839471 Win=1201536 Len=0 TSval=8712671 TSecr=1685444553
137   0.022474 54.239.132.55 -> 172.31.8.238 TCP 26130 [TCP segment of a reassembled PDU]
138   0.022496 54.239.132.55 -> 172.31.8.238 TCP 2962 [TCP segment of a reassembled PDU]
139   0.022507 172.31.8.238 -> 54.239.132.55 TCP 66 35623 > http [ACK] Seq=97 Ack=868431 Win=1172608 Len=0 TSval=8712671 TSecr=1685444553
140   0.022614 54.239.132.55 -> 172.31.8.238 TCP 14546 [TCP segment of a reassembled PDU]
141   0.022623 172.31.8.238 -> 54.239.132.55 TCP 66 35623 > http [ACK] Seq=97 Ack=882911 Win=1192576 Len=0 TSval=8712671 TSecr=1685444553
142   0.022677 54.239.132.55 -> 172.31.8.238 TCP 18890 [TCP segment of a reassembled PDU]
143   0.022700 172.31.8.238 -> 54.239.132.55 TCP 66 35623 > http [ACK] Seq=97 Ack=901735 Win=1185408 Len=0 TSval=8712671 TSecr=1685444553
144   0.022776 54.239.132.55 -> 172.31.8.238 TCP 31922 [TCP segment of a reassembled PDU]
145   0.022803 172.31.8.238 -> 54.239.132.55 TCP 66 35623 > http [ACK] Seq=97 Ack=933591 Win=1164032 Len=0 TSval=8712671 TSecr=1685444553
146   0.023313 54.239.132.55 -> 172.31.8.238 TCP 4410 [TCP segment of a reassembled PDU]
147   0.023320 172.31.8.238 -> 54.239.132.55 TCP 66 35623 > http [ACK] Seq=97 Ack=937935 Win=1209216 Len=0 TSval=8712671 TSecr=1685444553
148   0.023506 54.239.132.55 -> 172.31.8.238 TCP 26130 [TCP segment of a reassembled PDU]
149   0.023531 172.31.8.238 -> 54.239.132.55 TCP 66 35623 > http [ACK] Seq=97 Ack=963999 Win=1183232 Len=0 TSval=8712671 TSecr=1685444553
150   0.023695 54.239.132.55 -> 172.31.8.238 TCP 52194 [TCP segment of a reassembled PDU]
151   0.023723 54.239.132.55 -> 172.31.8.238 TCP 10202 [TCP segment of a reassembled PDU]
152   0.023754 172.31.8.238 -> 54.239.132.55 TCP 66 35623 > http [ACK] Seq=97 Ack=1026263 Win=1121024 Len=0 TSval=8712671 TSecr=1685444553
153   0.023775 54.239.132.55 -> 172.31.8.238 TCP 18890 [TCP segment of a reassembled PDU]
154   0.023794 172.31.8.238 -> 54.239.132.55 TCP 66 35623 > http [ACK] Seq=97 Ack=1045087 Win=1102208 Len=0 TSval=8712671 TSecr=1685444553
155   0.024166 54.239.132.55 -> 172.31.8.238 HTTP 4013 HTTP/1.1 200 OK  (application/octet-stream)
156   0.024172 172.31.8.238 -> 54.239.132.55 TCP 66 35623 > http [ACK] Seq=97 Ack=1049034 Win=1209216 Len=0 TSval=8712671 TSecr=1685444553
157   0.024289 172.31.8.238 -> 54.239.132.55 TCP 66 35623 > http [FIN, ACK] Seq=97 Ack=1049034 Win=1209600 Len=0 TSval=8712671 TSecr=1685444553
158   0.024878 54.239.132.55 -> 172.31.8.238 TCP 66 http > 35623 [FIN, ACK] Seq=1049034 Ack=98 Win=14592 Len=0 TSval=1685444553 TSecr=8712671
159   0.024886 172.31.8.238 -> 54.239.132.55 TCP 66 35623 > http [ACK] Seq=98 Ack=1049035 Win=1209600 Len=0 TSval=8712672 TSecr=1685444553
