[Measurement for 1mb at 17:40:25 19.40.2014] 
Tshark:

  1   0.000000 172.31.8.238 -> 172.31.0.2   DNS 89 Standard query 0xaf3c  A d39wppo36gwqpx.cloudfront.net
  2   0.000028 172.31.8.238 -> 172.31.0.2   DNS 89 Standard query 0x3994  AAAA d39wppo36gwqpx.cloudfront.net
  3   0.000651   172.31.0.2 -> 172.31.8.238 DNS 170 Standard query response 0x3994 
  4   0.000678   172.31.0.2 -> 172.31.8.238 DNS 217 Standard query response 0xaf3c  A 54.230.140.14 A 54.230.140.141 A 54.230.140.154 A 54.230.141.154 A 54.230.143.66 A 54.230.143.233 A 205.251.215.241 A 54.192.141.26
  5   0.003848 172.31.8.238 -> 54.230.140.14 TCP 74 53249 > http [SYN] Seq=0 Win=26883 Len=0 MSS=8961 SACK_PERM=1 TSval=613205 TSecr=0 WS=128
  6   0.006957 54.230.140.14 -> 172.31.8.238 TCP 74 http > 53249 [SYN, ACK] Seq=0 Ack=1 Win=14480 Len=0 MSS=1460 SACK_PERM=1 TSval=738984722 TSecr=613205 WS=128
  7   0.006972 172.31.8.238 -> 54.230.140.14 TCP 66 53249 > http [ACK] Seq=1 Ack=1 Win=27008 Len=0 TSval=613206 TSecr=738984722
  8   0.007016 172.31.8.238 -> 54.230.140.14 HTTP 162 GET /1mb HTTP/1.1 
  9   0.009850 54.230.140.14 -> 172.31.8.238 TCP 66 http > 53249 [ACK] Seq=1 Ack=97 Win=14592 Len=0 TSval=738984722 TSecr=613206
 10   0.594018 54.230.140.14 -> 172.31.8.238 TCP 1514 [TCP segment of a reassembled PDU]
 11   0.594042 172.31.8.238 -> 54.230.140.14 TCP 66 53249 > http [ACK] Seq=97 Ack=1449 Win=29824 Len=0 TSval=613352 TSecr=738984781
 12   0.594208 54.230.140.14 -> 172.31.8.238 TCP 2962 [TCP segment of a reassembled PDU]
 13   0.594215 172.31.8.238 -> 54.230.140.14 TCP 66 53249 > http [ACK] Seq=97 Ack=4345 Win=35584 Len=0 TSval=613352 TSecr=738984781
 14   0.594261 54.230.140.14 -> 172.31.8.238 TCP 185 [TCP segment of a reassembled PDU]
 15   0.594265 172.31.8.238 -> 54.230.140.14 TCP 66 53249 > http [ACK] Seq=97 Ack=4464 Win=35584 Len=0 TSval=613352 TSecr=738984781
 16   0.792028 54.230.140.14 -> 172.31.8.238 TCP 1526 [TCP segment of a reassembled PDU]
 17   0.792041 172.31.8.238 -> 54.230.140.14 TCP 66 53249 > http [ACK] Seq=97 Ack=5924 Win=38528 Len=0 TSval=613402 TSecr=738984801
 18   0.792275 54.230.140.14 -> 172.31.8.238 TCP 1514 [TCP segment of a reassembled PDU]
 19   0.792281 172.31.8.238 -> 54.230.140.14 TCP 66 53249 > http [ACK] Seq=97 Ack=7372 Win=41472 Len=0 TSval=613402 TSecr=738984801
 20   0.792526 54.230.140.14 -> 172.31.8.238 TCP 2962 [TCP segment of a reassembled PDU]
 21   0.792531 172.31.8.238 -> 54.230.140.14 TCP 66 53249 > http [ACK] Seq=97 Ack=10268 Win=47232 Len=0 TSval=613402 TSecr=738984801
 22   0.792634 54.230.140.14 -> 172.31.8.238 TCP 1514 [TCP segment of a reassembled PDU]
 23   0.792638 172.31.8.238 -> 54.230.140.14 TCP 66 53249 > http [ACK] Seq=97 Ack=11716 Win=50176 Len=0 TSval=613402 TSecr=738984801
 24   0.792643 54.230.140.14 -> 172.31.8.238 TCP 114 [TCP segment of a reassembled PDU]
 25   0.792646 172.31.8.238 -> 54.230.140.14 TCP 66 53249 > http [ACK] Seq=97 Ack=11764 Win=50176 Len=0 TSval=613402 TSecr=738984801
 26   1.000612 54.230.140.14 -> 172.31.8.238 TCP 4410 [TCP segment of a reassembled PDU]
 27   1.000630 172.31.8.238 -> 54.230.140.14 TCP 66 53249 > http [ACK] Seq=97 Ack=16108 Win=58880 Len=0 TSval=613454 TSecr=738984821
 28   1.000793 54.230.140.14 -> 172.31.8.238 TCP 2962 [TCP segment of a reassembled PDU]
 29   1.000799 172.31.8.238 -> 54.230.140.14 TCP 66 53249 > http [ACK] Seq=97 Ack=19004 Win=64640 Len=0 TSval=613454 TSecr=738984821
 30   1.001181 54.230.140.14 -> 172.31.8.238 TCP 1514 [TCP segment of a reassembled PDU]
 31   1.001186 172.31.8.238 -> 54.230.140.14 TCP 66 53249 > http [ACK] Seq=97 Ack=20452 Win=67456 Len=0 TSval=613454 TSecr=738984821
 32   1.001394 54.230.140.14 -> 172.31.8.238 TCP 1514 [TCP segment of a reassembled PDU]
 33   1.001397 172.31.8.238 -> 54.230.140.14 TCP 66 53249 > http [ACK] Seq=97 Ack=21900 Win=70400 Len=0 TSval=613454 TSecr=738984821
 34   1.001541 54.230.140.14 -> 172.31.8.238 TCP 150 [TCP segment of a reassembled PDU]
 35   1.001544 172.31.8.238 -> 54.230.140.14 TCP 66 53249 > http [ACK] Seq=97 Ack=21984 Win=70400 Len=0 TSval=613454 TSecr=738984821
 36   1.190522 54.230.140.14 -> 172.31.8.238 TCP 2962 [TCP segment of a reassembled PDU]
