[Measurement for 1mb at 00:40:22 20.40.2014] 
Tshark:

  1   0.000000 172.31.8.238 -> 172.31.0.2   DNS 89 Standard query 0xe2eb  A d39wppo36gwqpx.cloudfront.net
  2   0.000039 172.31.8.238 -> 172.31.0.2   DNS 89 Standard query 0xcadf  AAAA d39wppo36gwqpx.cloudfront.net
  3   0.000749   172.31.0.2 -> 172.31.8.238 DNS 217 Standard query response 0xe2eb  A 54.230.119.55 A 54.239.132.166 A 54.192.118.240 A 54.192.118.241 A 54.230.116.141 A 54.230.117.37 A 54.230.117.87 A 54.230.118.239
  4   0.000918   172.31.0.2 -> 172.31.8.238 DNS 170 Standard query response 0xcadf 
  5   0.003903 172.31.8.238 -> 54.230.119.55 TCP 74 42819 > http [SYN] Seq=0 Win=26883 Len=0 MSS=8961 SACK_PERM=1 TSval=6912509 TSecr=0 WS=128
  6   0.004504 54.230.119.55 -> 172.31.8.238 TCP 74 http > 42819 [SYN, ACK] Seq=0 Ack=1 Win=14480 Len=0 MSS=1460 SACK_PERM=1 TSval=1685494177 TSecr=6912509 WS=128
  7   0.004518 172.31.8.238 -> 54.230.119.55 TCP 66 42819 > http [ACK] Seq=1 Ack=1 Win=27008 Len=0 TSval=6912510 TSecr=1685494177
  8   0.004558 172.31.8.238 -> 54.230.119.55 HTTP 162 GET /1mb HTTP/1.1 
  9   0.005273 54.230.119.55 -> 172.31.8.238 TCP 66 http > 42819 [ACK] Seq=1 Ack=97 Win=14592 Len=0 TSval=1685494177 TSecr=6912510
 10   0.007273 54.230.119.55 -> 172.31.8.238 TCP 523 [TCP segment of a reassembled PDU]
 11   0.007281 172.31.8.238 -> 54.230.119.55 TCP 66 42819 > http [ACK] Seq=97 Ack=458 Win=28032 Len=0 TSval=6912510 TSecr=1685494177
 12   0.007394 54.230.119.55 -> 172.31.8.238 TCP 13098 [TCP segment of a reassembled PDU]
 13   0.007404 172.31.8.238 -> 54.230.119.55 TCP 66 42819 > http [ACK] Seq=97 Ack=13490 Win=54144 Len=0 TSval=6912510 TSecr=1685494177
 14   0.008171 54.230.119.55 -> 172.31.8.238 TCP 5858 [TCP segment of a reassembled PDU]
 15   0.008179 172.31.8.238 -> 54.230.119.55 TCP 66 42819 > http [ACK] Seq=97 Ack=19282 Win=65664 Len=0 TSval=6912510 TSecr=1685494177
 16   0.008272 54.230.119.55 -> 172.31.8.238 TCP 7306 [TCP segment of a reassembled PDU]
 17   0.008279 172.31.8.238 -> 54.230.119.55 TCP 66 42819 > http [ACK] Seq=97 Ack=26522 Win=80128 Len=0 TSval=6912510 TSecr=1685494177
 18   0.008815 54.230.119.55 -> 172.31.8.238 TCP 2962 [TCP segment of a reassembled PDU]
 19   0.008821 172.31.8.238 -> 54.230.119.55 TCP 66 42819 > http [ACK] Seq=97 Ack=29418 Win=85888 Len=0 TSval=6912511 TSecr=1685494177
 20   0.008915 54.230.119.55 -> 172.31.8.238 TCP 8754 [TCP segment of a reassembled PDU]
 21   0.008921 172.31.8.238 -> 54.230.119.55 TCP 66 42819 > http [ACK] Seq=97 Ack=38106 Win=103296 Len=0 TSval=6912511 TSecr=1685494177
 22   0.009094 54.230.119.55 -> 172.31.8.238 TCP 8754 [TCP segment of a reassembled PDU]
 23   0.009101 172.31.8.238 -> 54.230.119.55 TCP 66 42819 > http [ACK] Seq=97 Ack=46794 Win=120704 Len=0 TSval=6912511 TSecr=1685494177
 24   0.009341 54.230.119.55 -> 172.31.8.238 TCP 2962 [TCP segment of a reassembled PDU]
 25   0.009346 172.31.8.238 -> 54.230.119.55 TCP 66 42819 > http [ACK] Seq=97 Ack=49690 Win=126464 Len=0 TSval=6912511 TSecr=1685494177
 26   0.009427 54.230.119.55 -> 172.31.8.238 TCP 2962 [TCP segment of a reassembled PDU]
 27   0.009432 172.31.8.238 -> 54.230.119.55 TCP 66 42819 > http [ACK] Seq=97 Ack=52586 Win=132224 Len=0 TSval=6912511 TSecr=1685494177
 28   0.009472 54.230.119.55 -> 172.31.8.238 TCP 8754 [TCP segment of a reassembled PDU]
 29   0.009479 172.31.8.238 -> 54.230.119.55 TCP 66 42819 > http [ACK] Seq=97 Ack=61274 Win=149632 Len=0 TSval=6912511 TSecr=1685494177
 30   0.009624 54.230.119.55 -> 172.31.8.238 TCP 4410 [TCP segment of a reassembled PDU]
 31   0.009630 172.31.8.238 -> 54.230.119.55 TCP 66 42819 > http [ACK] Seq=97 Ack=65618 Win=158336 Len=0 TSval=6912511 TSecr=1685494177
 32   0.009856 54.230.119.55 -> 172.31.8.238 TCP 2962 [TCP segment of a reassembled PDU]
 33   0.009863 172.31.8.238 -> 54.230.119.55 TCP 66 42819 > http [ACK] Seq=97 Ack=68514 Win=164096 Len=0 TSval=6912511 TSecr=1685494177
 34   0.009949 54.230.119.55 -> 172.31.8.238 TCP 7306 [TCP segment of a reassembled PDU]
 35   0.009955 172.31.8.238 -> 54.230.119.55 TCP 66 42819 > http [ACK] Seq=97 Ack=75754 Win=178560 Len=0 TSval=6912511 TSecr=1685494177
 36   0.010231 54.230.119.55 -> 172.31.8.238 TCP 1514 [TCP segment of a reassembled PDU]
 37   0.010235 172.31.8.238 -> 54.230.119.55 TCP 66 42819 > http [ACK] Seq=97 Ack=77202 Win=181504 Len=0 TSval=6912511 TSecr=1685494177
 38   0.010342 54.230.119.55 -> 172.31.8.238 TCP 14546 [TCP segment of a reassembled PDU]
 39   0.010351 172.31.8.238 -> 54.230.119.55 TCP 66 42819 > http [ACK] Seq=97 Ack=91682 Win=174336 Len=0 TSval=6912511 TSecr=1685494177
 40   0.010670 54.230.119.55 -> 172.31.8.238 TCP 7306 [TCP segment of a reassembled PDU]
 41   0.010677 172.31.8.238 -> 54.230.119.55 TCP 66 42819 > http [ACK] Seq=97 Ack=98922 Win=186368 Len=0 TSval=6912511 TSecr=1685494177
 42   0.010770 54.230.119.55 -> 172.31.8.238 TCP 5858 [TCP segment of a reassembled PDU]
 43   0.010777 172.31.8.238 -> 54.230.119.55 TCP 66 42819 > http [ACK] Seq=97 Ack=104714 Win=188672 Len=0 TSval=6912511 TSecr=1685494177
 44   0.010929 54.230.119.55 -> 172.31.8.238 TCP 13098 [TCP segment of a reassembled PDU]
 45   0.010937 172.31.8.238 -> 54.230.119.55 TCP 66 42819 > http [ACK] Seq=97 Ack=117746 Win=176896 Len=0 TSval=6912511 TSecr=1685494177
 46   0.011261 54.230.119.55 -> 172.31.8.238 TCP 4410 [TCP segment of a reassembled PDU]
 47   0.011268 172.31.8.238 -> 54.230.119.55 TCP 66 42819 > http [ACK] Seq=97 Ack=122090 Win=191104 Len=0 TSval=6912511 TSecr=1685494177
 48   0.011380 54.230.119.55 -> 172.31.8.238 TCP 8754 [TCP segment of a reassembled PDU]
 49   0.011388 172.31.8.238 -> 54.230.119.55 TCP 66 42819 > http [ACK] Seq=97 Ack=130778 Win=183936 Len=0 TSval=6912511 TSecr=1685494177
 50   0.011589 54.230.119.55 -> 172.31.8.238 TCP 20338 [TCP segment of a reassembled PDU]
 51   0.011601 172.31.8.238 -> 54.230.119.55 TCP 66 42819 > http [ACK] Seq=97 Ack=151050 Win=163712 Len=0 TSval=6912511 TSecr=1685494177
 52   0.011684 54.230.119.55 -> 172.31.8.238 TCP 5858 [TCP segment of a reassembled PDU]
 53   0.011689 172.31.8.238 -> 54.230.119.55 TCP 66 42819 > http [ACK] Seq=97 Ack=156842 Win=157952 Len=0 TSval=6912511 TSecr=1685494177
 54   0.012111 54.230.119.55 -> 172.31.8.238 TCP 7306 [TCP segment of a reassembled PDU]
 55   0.012119 172.31.8.238 -> 54.230.119.55 TCP 66 42819 > http [ACK] Seq=97 Ack=164082 Win=186368 Len=0 TSval=6912511 TSecr=1685494177
 56   0.012228 54.230.119.55 -> 172.31.8.238 TCP 5858 [TCP segment of a reassembled PDU]
 57   0.012234 172.31.8.238 -> 54.230.119.55 TCP 66 42819 > http [ACK] Seq=97 Ack=169874 Win=188672 Len=0 TSval=6912511 TSecr=1685494177
 58   0.012455 54.230.119.55 -> 172.31.8.238 TCP 13098 [TCP segment of a reassembled PDU]
 59   0.012464 172.31.8.238 -> 54.230.119.55 TCP 66 42819 > http [ACK] Seq=97 Ack=182906 Win=176896 Len=0 TSval=6912512 TSecr=1685494177
 60   0.012578 54.230.119.55 -> 172.31.8.238 TCP 20338 [TCP segment of a reassembled PDU]
 61   0.012589 172.31.8.238 -> 54.230.119.55 TCP 66 42819 > http [ACK] Seq=97 Ack=203178 Win=236544 Len=0 TSval=6912512 TSecr=1685494177
 62   0.012669 54.230.119.55 -> 172.31.8.238 TCP 5858 [TCP segment of a reassembled PDU]
 63   0.012675 172.31.8.238 -> 54.230.119.55 TCP 66 42819 > http [ACK] Seq=97 Ack=208970 Win=248064 Len=0 TSval=6912512 TSecr=1685494178
 64   0.013135 54.230.119.55 -> 172.31.8.238 TCP 7306 [TCP segment of a reassembled PDU]
 65   0.013143 172.31.8.238 -> 54.230.119.55 TCP 66 42819 > http [ACK] Seq=97 Ack=216210 Win=262656 Len=0 TSval=6912512 TSecr=1685494178
 66   0.013329 54.230.119.55 -> 172.31.8.238 TCP 26130 [TCP segment of a reassembled PDU]
 67   0.013343 172.31.8.238 -> 54.230.119.55 TCP 66 42819 > http [ACK] Seq=97 Ack=242274 Win=314752 Len=0 TSval=6912512 TSecr=1685494178
 68   0.013374 54.230.119.55 -> 172.31.8.238 TCP 13098 [TCP segment of a reassembled PDU]
 69   0.013384 172.31.8.238 -> 54.230.119.55 TCP 66 42819 > http [ACK] Seq=97 Ack=255306 Win=340736 Len=0 TSval=6912512 TSecr=1685494178
 70   0.013896 54.230.119.55 -> 172.31.8.238 TCP 5858 [TCP segment of a reassembled PDU]
 71   0.013904 172.31.8.238 -> 54.230.119.55 TCP 66 42819 > http [ACK] Seq=97 Ack=261098 Win=352384 Len=0 TSval=6912512 TSecr=1685494178
 72   0.014064 54.230.119.55 -> 172.31.8.238 TCP 17442 [TCP segment of a reassembled PDU]
 73   0.014074 172.31.8.238 -> 54.230.119.55 TCP 66 42819 > http [ACK] Seq=97 Ack=278474 Win=387072 Len=0 TSval=6912512 TSecr=1685494178
 74   0.014094 54.230.119.55 -> 172.31.8.238 TCP 8754 [TCP segment of a reassembled PDU]
 75   0.014099 172.31.8.238 -> 54.230.119.55 TCP 66 42819 > http [ACK] Seq=97 Ack=287162 Win=404480 Len=0 TSval=6912512 TSecr=1685494178
 76   0.014155 54.230.119.55 -> 172.31.8.238 TCP 11650 [TCP segment of a reassembled PDU]
 77   0.014163 172.31.8.238 -> 54.230.119.55 TCP 66 42819 > http [ACK] Seq=97 Ack=298746 Win=427648 Len=0 TSval=6912512 TSecr=1685494178
 78   0.014524 54.230.119.55 -> 172.31.8.238 TCP 15994 [TCP segment of a reassembled PDU]
 79   0.014533 172.31.8.238 -> 54.230.119.55 TCP 66 42819 > http [ACK] Seq=97 Ack=314674 Win=459520 Len=0 TSval=6912512 TSecr=1685494178
 80   0.014653 54.230.119.55 -> 172.31.8.238 TCP 5858 [TCP segment of a reassembled PDU]
 81   0.014659 172.31.8.238 -> 54.230.119.55 TCP 66 42819 > http [ACK] Seq=97 Ack=320466 Win=471168 Len=0 TSval=6912512 TSecr=1685494178
 82   0.014830 54.230.119.55 -> 172.31.8.238 TCP 20338 [TCP segment of a reassembled PDU]
 83   0.014842 172.31.8.238 -> 54.230.119.55 TCP 66 42819 > http [ACK] Seq=97 Ack=340738 Win=511616 Len=0 TSval=6912512 TSecr=1685494178
 84   0.014860 54.230.119.55 -> 172.31.8.238 TCP 5858 [TCP segment of a reassembled PDU]
 85   0.014865 172.31.8.238 -> 54.230.119.55 TCP 66 42819 > http [ACK] Seq=97 Ack=346530 Win=523264 Len=0 TSval=6912512 TSecr=1685494178
 86   0.014923 54.230.119.55 -> 172.31.8.238 TCP 2962 [TCP segment of a reassembled PDU]
 87   0.014929 172.31.8.238 -> 54.230.119.55 TCP 66 42819 > http [ACK] Seq=97 Ack=349426 Win=529024 Len=0 TSval=6912512 TSecr=1685494178
 88   0.015219 54.230.119.55 -> 172.31.8.238 TCP 26130 [TCP segment of a reassembled PDU]
 89   0.015233 172.31.8.238 -> 54.230.119.55 TCP 66 42819 > http [ACK] Seq=97 Ack=375490 Win=581120 Len=0 TSval=6912512 TSecr=1685494178
 90   0.015242 54.230.119.55 -> 172.31.8.238 TCP 4410 [TCP segment of a reassembled PDU]
 91   0.015246 172.31.8.238 -> 54.230.119.55 TCP 66 42819 > http [ACK] Seq=97 Ack=379834 Win=589824 Len=0 TSval=6912512 TSecr=1685494178
 92   0.015550 54.230.119.55 -> 172.31.8.238 TCP 23234 [TCP segment of a reassembled PDU]
 93   0.015564 172.31.8.238 -> 54.230.119.55 TCP 66 42819 > http [ACK] Seq=97 Ack=403002 Win=636160 Len=0 TSval=6912512 TSecr=1685494178
 94   0.015570 54.230.119.55 -> 172.31.8.238 TCP 2962 [TCP segment of a reassembled PDU]
 95   0.015573 172.31.8.238 -> 54.230.119.55 TCP 66 42819 > http [ACK] Seq=97 Ack=405898 Win=641920 Len=0 TSval=6912512 TSecr=1685494178
 96   0.015697 54.230.119.55 -> 172.31.8.238 TCP 10202 [TCP segment of a reassembled PDU]
 97   0.015706 172.31.8.238 -> 54.230.119.55 TCP 66 42819 > http [ACK] Seq=97 Ack=416034 Win=662272 Len=0 TSval=6912512 TSecr=1685494178
 98   0.015823 54.230.119.55 -> 172.31.8.238 TCP 26130 [TCP segment of a reassembled PDU]
 99   0.015836 172.31.8.238 -> 54.230.119.55 TCP 66 42819 > http [ACK] Seq=97 Ack=442098 Win=714368 Len=0 TSval=6912512 TSecr=1685494178
100   0.015844 54.230.119.55 -> 172.31.8.238 TCP 5858 [TCP segment of a reassembled PDU]
101   0.015849 172.31.8.238 -> 54.230.119.55 TCP 66 42819 > http [ACK] Seq=97 Ack=447890 Win=726016 Len=0 TSval=6912512 TSecr=1685494178
102   0.016037 54.230.119.55 -> 172.31.8.238 TCP 10202 [TCP segment of a reassembled PDU]
103   0.016045 172.31.8.238 -> 54.230.119.55 TCP 66 42819 > http [ACK] Seq=97 Ack=458026 Win=746240 Len=0 TSval=6912512 TSecr=1685494178
104   0.016345 54.230.119.55 -> 172.31.8.238 TCP 23234 [TCP segment of a reassembled PDU]
105   0.016358 172.31.8.238 -> 54.230.119.55 TCP 66 42819 > http [ACK] Seq=97 Ack=481194 Win=792576 Len=0 TSval=6912513 TSecr=1685494178
106   0.016494 54.230.119.55 -> 172.31.8.238 TCP 26130 [TCP segment of a reassembled PDU]
107   0.016507 172.31.8.238 -> 54.230.119.55 TCP 66 42819 > http [ACK] Seq=97 Ack=507258 Win=844672 Len=0 TSval=6912513 TSecr=1685494178
108   0.016550 54.230.119.55 -> 172.31.8.238 TCP 15994 [TCP segment of a reassembled PDU]
109   0.016558 172.31.8.238 -> 54.230.119.55 TCP 66 42819 > http [ACK] Seq=97 Ack=523186 Win=876544 Len=0 TSval=6912513 TSecr=1685494178
110   0.016981 54.230.119.55 -> 172.31.8.238 TCP 4410 [TCP segment of a reassembled PDU]
111   0.016988 172.31.8.238 -> 54.230.119.55 TCP 66 42819 > http [ACK] Seq=97 Ack=527530 Win=885248 Len=0 TSval=6912513 TSecr=1685494178
112   0.017162 54.230.119.55 -> 172.31.8.238 TCP 26130 [TCP segment of a reassembled PDU]
113   0.017176 172.31.8.238 -> 54.230.119.55 TCP 66 42819 > http [ACK] Seq=97 Ack=553594 Win=937344 Len=0 TSval=6912513 TSecr=1685494178
114   0.017236 54.230.119.55 -> 172.31.8.238 TCP 26130 [TCP segment of a reassembled PDU]
115   0.017249 172.31.8.238 -> 54.230.119.55 TCP 66 42819 > http [ACK] Seq=97 Ack=579658 Win=989440 Len=0 TSval=6912513 TSecr=1685494178
116   0.017293 54.230.119.55 -> 172.31.8.238 TCP 8754 [TCP segment of a reassembled PDU]
117   0.017300 172.31.8.238 -> 54.230.119.55 TCP 66 42819 > http [ACK] Seq=97 Ack=588346 Win=1006848 Len=0 TSval=6912513 TSecr=1685494178
118   0.017929 54.230.119.55 -> 172.31.8.238 TCP 7306 [TCP segment of a reassembled PDU]
119   0.017937 172.31.8.238 -> 54.230.119.55 TCP 66 42819 > http [ACK] Seq=97 Ack=595586 Win=1021312 Len=0 TSval=6912513 TSecr=1685494178
120   0.018111 54.230.119.55 -> 172.31.8.238 TCP 20338 [TCP segment of a reassembled PDU]
121   0.018123 172.31.8.238 -> 54.230.119.55 TCP 66 42819 > http [ACK] Seq=97 Ack=615858 Win=1061888 Len=0 TSval=6912513 TSecr=1685494178
122   0.018139 54.230.119.55 -> 172.31.8.238 TCP 5858 [TCP segment of a reassembled PDU]
123   0.018144 172.31.8.238 -> 54.230.119.55 TCP 66 42819 > http [ACK] Seq=97 Ack=621650 Win=1073536 Len=0 TSval=6912513 TSecr=1685494178
124   0.018232 54.230.119.55 -> 172.31.8.238 TCP 26130 [TCP segment of a reassembled PDU]
125   0.018245 172.31.8.238 -> 54.230.119.55 TCP 66 42819 > http [ACK] Seq=97 Ack=647714 Win=1125632 Len=0 TSval=6912513 TSecr=1685494178
126   0.018278 54.230.119.55 -> 172.31.8.238 TCP 5858 [TCP segment of a reassembled PDU]
127   0.018283 172.31.8.238 -> 54.230.119.55 TCP 66 42819 > http [ACK] Seq=97 Ack=653506 Win=1137152 Len=0 TSval=6912513 TSecr=1685494178
128   0.018685 54.230.119.55 -> 172.31.8.238 TCP 15994 [TCP segment of a reassembled PDU]
129   0.018695 172.31.8.238 -> 54.230.119.55 TCP 66 42819 > http [ACK] Seq=97 Ack=669434 Win=1169024 Len=0 TSval=6912513 TSecr=1685494178
130   0.018832 54.230.119.55 -> 172.31.8.238 TCP 20338 [TCP segment of a reassembled PDU]
131   0.018843 172.31.8.238 -> 54.230.119.55 TCP 66 42819 > http [ACK] Seq=97 Ack=689706 Win=1209600 Len=0 TSval=6912513 TSecr=1685494178
132   0.018940 54.230.119.55 -> 172.31.8.238 TCP 13098 [TCP segment of a reassembled PDU]
133   0.018949 172.31.8.238 -> 54.230.119.55 TCP 66 42819 > http [ACK] Seq=97 Ack=702738 Win=1235712 Len=0 TSval=6912513 TSecr=1685494178
134   0.019124 54.230.119.55 -> 172.31.8.238 TCP 26130 [TCP segment of a reassembled PDU]
135   0.019139 172.31.8.238 -> 54.230.119.55 TCP 66 42819 > http [ACK] Seq=97 Ack=728802 Win=1287808 Len=0 TSval=6912513 TSecr=1685494178
136   0.019185 54.230.119.55 -> 172.31.8.238 TCP 24682 [TCP segment of a reassembled PDU]
137   0.019198 172.31.8.238 -> 54.230.119.55 TCP 66 42819 > http [ACK] Seq=97 Ack=753418 Win=1336960 Len=0 TSval=6912513 TSecr=1685494178
138   0.019500 54.230.119.55 -> 172.31.8.238 TCP 14546 [TCP segment of a reassembled PDU]
139   0.019510 172.31.8.238 -> 54.230.119.55 TCP 66 42819 > http [ACK] Seq=97 Ack=767898 Win=1366016 Len=0 TSval=6912513 TSecr=1685494178
140   0.019632 54.230.119.55 -> 172.31.8.238 TCP 15994 [TCP segment of a reassembled PDU]
141   0.019642 172.31.8.238 -> 54.230.119.55 TCP 66 42819 > http [ACK] Seq=97 Ack=783826 Win=1397888 Len=0 TSval=6912513 TSecr=1685494178
142   0.019764 54.230.119.55 -> 172.31.8.238 TCP 23234 [TCP segment of a reassembled PDU]
143   0.019776 172.31.8.238 -> 54.230.119.55 TCP 66 42819 > http [ACK] Seq=97 Ack=806994 Win=1421568 Len=0 TSval=6912513 TSecr=1685494178
144   0.019906 54.230.119.55 -> 172.31.8.238 TCP 26130 [TCP segment of a reassembled PDU]
145   0.019919 172.31.8.238 -> 54.230.119.55 TCP 66 42819 > http [ACK] Seq=97 Ack=833058 Win=1416832 Len=0 TSval=6912513 TSecr=1685494178
146   0.019937 54.230.119.55 -> 172.31.8.238 TCP 4410 [TCP segment of a reassembled PDU]
147   0.019941 172.31.8.238 -> 54.230.119.55 TCP 66 42819 > http [ACK] Seq=97 Ack=837402 Win=1412608 Len=0 TSval=6912513 TSecr=1685494178
148   0.020010 54.230.119.55 -> 172.31.8.238 TCP 11650 [TCP segment of a reassembled PDU]
149   0.020018 172.31.8.238 -> 54.230.119.55 TCP 66 42819 > http [ACK] Seq=97 Ack=848986 Win=1440640 Len=0 TSval=6912513 TSecr=1685494178
150   0.020289 54.230.119.55 -> 172.31.8.238 TCP 26130 [TCP segment of a reassembled PDU]
151   0.020303 172.31.8.238 -> 54.230.119.55 TCP 66 42819 > http [ACK] Seq=97 Ack=875050 Win=1416832 Len=0 TSval=6912513 TSecr=1685494178
152   0.020356 54.230.119.55 -> 172.31.8.238 TCP 20338 [TCP segment of a reassembled PDU]
153   0.020380 172.31.8.238 -> 54.230.119.55 TCP 66 42819 > http [ACK] Seq=97 Ack=895322 Win=1426304 Len=0 TSval=6912514 TSecr=1685494178
154   0.020445 54.230.119.55 -> 172.31.8.238 TCP 18890 [TCP segment of a reassembled PDU]
155   0.020456 172.31.8.238 -> 54.230.119.55 TCP 66 42819 > http [ACK] Seq=97 Ack=914146 Win=1437696 Len=0 TSval=6912514 TSecr=1685494178
156   0.020716 54.230.119.55 -> 172.31.8.238 TCP 8754 [TCP segment of a reassembled PDU]
157   0.020724 172.31.8.238 -> 54.230.119.55 TCP 66 42819 > http [ACK] Seq=97 Ack=922834 Win=1454464 Len=0 TSval=6912514 TSecr=1685494178
158   0.020872 54.230.119.55 -> 172.31.8.238 TCP 26130 [TCP segment of a reassembled PDU]
159   0.020898 172.31.8.238 -> 54.230.119.55 TCP 66 42819 > http [ACK] Seq=97 Ack=948898 Win=1428480 Len=0 TSval=6912514 TSecr=1685494178
160   0.020922 54.230.119.55 -> 172.31.8.238 TCP 15994 [TCP segment of a reassembled PDU]
161   0.020933 172.31.8.238 -> 54.230.119.55 TCP 66 42819 > http [ACK] Seq=97 Ack=964826 Win=1442432 Len=0 TSval=6912514 TSecr=1685494178
162   0.020993 54.230.119.55 -> 172.31.8.238 TCP 14546 [TCP segment of a reassembled PDU]
163   0.021002 172.31.8.238 -> 54.230.119.55 TCP 66 42819 > http [ACK] Seq=97 Ack=979306 Win=1444864 Len=0 TSval=6912514 TSecr=1685494178
164   0.021473 54.230.119.55 -> 172.31.8.238 TCP 5858 [TCP segment of a reassembled PDU]
165   0.021481 172.31.8.238 -> 54.230.119.55 TCP 66 42819 > http [ACK] Seq=97 Ack=985098 Win=1459200 Len=0 TSval=6912514 TSecr=1685494178
166   0.021656 54.230.119.55 -> 172.31.8.238 TCP 26130 [TCP segment of a reassembled PDU]
167   0.021694 172.31.8.238 -> 54.230.119.55 TCP 66 42819 > http [ACK] Seq=97 Ack=1011162 Win=1433216 Len=0 TSval=6912514 TSecr=1685494178
168   0.021808 54.230.119.55 -> 172.31.8.238 HTTP 37938 HTTP/1.1 200 OK  (application/octet-stream)
169   0.021840 172.31.8.238 -> 54.230.119.55 TCP 66 42819 > http [ACK] Seq=97 Ack=1049034 Win=1404416 Len=0 TSval=6912514 TSecr=1685494178
170   0.021962 172.31.8.238 -> 54.230.119.55 TCP 66 42819 > http [FIN, ACK] Seq=97 Ack=1049034 Win=1461504 Len=0 TSval=6912514 TSecr=1685494178
171   0.022466 54.230.119.55 -> 172.31.8.238 TCP 66 http > 42819 [FIN, ACK] Seq=1049034 Ack=98 Win=14592 Len=0 TSval=1685494178 TSecr=6912514
172   0.022472 172.31.8.238 -> 54.230.119.55 TCP 66 42819 > http [ACK] Seq=98 Ack=1049035 Win=1461504 Len=0 TSval=6912514 TSecr=1685494178
