[Measurement for 100kb at 01:43:43 20.43.2014] 
Tshark:

  1   0.000000 172.31.8.238 -> 172.31.0.2   DNS 89 Standard query 0xc09c  A d3m1c4hwkgedal.cloudfront.net
  2   0.000052 172.31.8.238 -> 172.31.0.2   DNS 89 Standard query 0x503c  AAAA d3m1c4hwkgedal.cloudfront.net
  3   0.000624   172.31.0.2 -> 172.31.8.238 DNS 174 Standard query response 0x503c 
  4   0.000637   172.31.0.2 -> 172.31.8.238 DNS 217 Standard query response 0xc09c  A 54.192.118.235 A 54.230.117.86 A 54.230.117.154 A 54.230.119.11 A 54.239.132.26 A 54.239.132.103 A 54.192.118.220 A 54.192.118.234
  5   0.003872 172.31.8.238 -> 54.192.118.235 TCP 74 53285 > http [SYN] Seq=0 Win=26883 Len=0 MSS=8961 SACK_PERM=1 TSval=7862722 TSecr=0 WS=128
  6   0.004501 54.192.118.235 -> 172.31.8.238 TCP 74 http > 53285 [SYN, ACK] Seq=0 Ack=1 Win=14480 Len=0 MSS=1460 SACK_PERM=1 TSval=1684467769 TSecr=7862722 WS=128
  7   0.004515 172.31.8.238 -> 54.192.118.235 TCP 66 53285 > http [ACK] Seq=1 Ack=1 Win=27008 Len=0 TSval=7862722 TSecr=1684467769
  8   0.004562 172.31.8.238 -> 54.192.118.235 HTTP 164 GET /100kb HTTP/1.1 
  9   0.005229 54.192.118.235 -> 172.31.8.238 TCP 66 http > 53285 [ACK] Seq=1 Ack=99 Win=14592 Len=0 TSval=1684467769 TSecr=7862722
 10   0.006633 54.192.118.235 -> 172.31.8.238 TCP 11650 [TCP segment of a reassembled PDU]
 11   0.006644 172.31.8.238 -> 54.192.118.235 TCP 66 53285 > http [ACK] Seq=99 Ack=11585 Win=50176 Len=0 TSval=7862723 TSecr=1684467769
 12   0.006669 54.192.118.235 -> 172.31.8.238 TCP 1514 [TCP segment of a reassembled PDU]
 13   0.006679 172.31.8.238 -> 54.192.118.235 TCP 66 53285 > http [ACK] Seq=99 Ack=13033 Win=52992 Len=0 TSval=7862723 TSecr=1684467769
 14   0.007322 54.192.118.235 -> 172.31.8.238 TCP 4410 [TCP segment of a reassembled PDU]
 15   0.007329 172.31.8.238 -> 54.192.118.235 TCP 66 53285 > http [ACK] Seq=99 Ack=17377 Win=61696 Len=0 TSval=7862723 TSecr=1684467770
 16   0.007404 54.192.118.235 -> 172.31.8.238 TCP 8754 [TCP segment of a reassembled PDU]
 17   0.007412 172.31.8.238 -> 54.192.118.235 TCP 66 53285 > http [ACK] Seq=99 Ack=26065 Win=79104 Len=0 TSval=7862723 TSecr=1684467770
 18   0.008116 54.192.118.235 -> 172.31.8.238 TCP 2962 [TCP segment of a reassembled PDU]
 19   0.008121 172.31.8.238 -> 54.192.118.235 TCP 66 53285 > http [ACK] Seq=99 Ack=28961 Win=84864 Len=0 TSval=7862723 TSecr=1684467770
 20   0.008242 54.192.118.235 -> 172.31.8.238 TCP 17442 [TCP segment of a reassembled PDU]
 21   0.008253 172.31.8.238 -> 54.192.118.235 TCP 66 53285 > http [ACK] Seq=99 Ack=46337 Win=89344 Len=0 TSval=7862723 TSecr=1684467770
 22   0.008612 54.192.118.235 -> 172.31.8.238 TCP 1514 [TCP segment of a reassembled PDU]
 23   0.008617 172.31.8.238 -> 54.192.118.235 TCP 66 53285 > http [ACK] Seq=99 Ack=47785 Win=109056 Len=0 TSval=7862723 TSecr=1684467770
 24   0.008714 54.192.118.235 -> 172.31.8.238 TCP 4410 [TCP segment of a reassembled PDU]
 25   0.008720 172.31.8.238 -> 54.192.118.235 TCP 66 53285 > http [ACK] Seq=99 Ack=52129 Win=109056 Len=0 TSval=7862723 TSecr=1684467770
 26   0.008760 54.192.118.235 -> 172.31.8.238 TCP 13098 [TCP segment of a reassembled PDU]
 27   0.008768 172.31.8.238 -> 54.192.118.235 TCP 66 53285 > http [ACK] Seq=99 Ack=65161 Win=96512 Len=0 TSval=7862723 TSecr=1684467770
 28   0.009164 54.192.118.235 -> 172.31.8.238 TCP 10202 [TCP segment of a reassembled PDU]
 29   0.009171 172.31.8.238 -> 54.192.118.235 TCP 66 53285 > http [ACK] Seq=99 Ack=75297 Win=101248 Len=0 TSval=7862724 TSecr=1684467770
 30   0.009210 54.192.118.235 -> 172.31.8.238 TCP 2962 [TCP segment of a reassembled PDU]
 31   0.009215 172.31.8.238 -> 54.192.118.235 TCP 66 53285 > http [ACK] Seq=99 Ack=78193 Win=114816 Len=0 TSval=7862724 TSecr=1684467770
 32   0.009297 54.192.118.235 -> 172.31.8.238 TCP 14546 [TCP segment of a reassembled PDU]
 33   0.009306 172.31.8.238 -> 54.192.118.235 TCP 66 53285 > http [ACK] Seq=99 Ack=92673 Win=143872 Len=0 TSval=7862724 TSecr=1684467770
 34   0.009659 54.192.118.235 -> 172.31.8.238 TCP 1514 [TCP segment of a reassembled PDU]
 35   0.009663 172.31.8.238 -> 54.192.118.235 TCP 66 53285 > http [ACK] Seq=99 Ack=94121 Win=146688 Len=0 TSval=7862724 TSecr=1684467770
 36   0.009767 54.192.118.235 -> 172.31.8.238 TCP 8754 [TCP segment of a reassembled PDU]
 37   0.009774 172.31.8.238 -> 54.192.118.235 TCP 66 53285 > http [ACK] Seq=99 Ack=102809 Win=164096 Len=0 TSval=7862724 TSecr=1684467770
 38   0.009789 54.192.118.235 -> 172.31.8.238 HTTP 114 HTTP/1.1 200 OK  (application/octet-stream)
 39   0.009795 172.31.8.238 -> 54.192.118.235 TCP 66 53285 > http [ACK] Seq=99 Ack=102857 Win=164096 Len=0 TSval=7862724 TSecr=1684467770
 40   0.009909 172.31.8.238 -> 54.192.118.235 TCP 66 53285 > http [FIN, ACK] Seq=99 Ack=102857 Win=164096 Len=0 TSval=7862724 TSecr=1684467770
 41   0.010392 54.192.118.235 -> 172.31.8.238 TCP 66 http > 53285 [FIN, ACK] Seq=102857 Ack=100 Win=14592 Len=0 TSval=1684467770 TSecr=7862724
 42   0.010400 172.31.8.238 -> 54.192.118.235 TCP 66 53285 > http [ACK] Seq=100 Ack=102858 Win=164096 Len=0 TSval=7862724 TSecr=1684467770
