[Measurement for 100kb at 02:43:44 20.43.2014] 
Tshark:

  1   0.000000 172.31.8.238 -> 172.31.0.2   DNS 89 Standard query 0x4379  A d3m1c4hwkgedal.cloudfront.net
  2   0.000039 172.31.8.238 -> 172.31.0.2   DNS 89 Standard query 0x31f3  AAAA d3m1c4hwkgedal.cloudfront.net
  3   0.000880   172.31.0.2 -> 172.31.8.238 DNS 217 Standard query response 0x4379  A 54.230.119.189 A 54.192.118.233 A 54.192.118.239 A 54.230.116.98 A 54.230.116.136 A 54.230.117.5 A 54.230.117.86 A 54.230.118.214
  4   0.000890   172.31.0.2 -> 172.31.8.238 DNS 174 Standard query response 0x31f3 
  5   0.003847 172.31.8.238 -> 54.230.119.189 TCP 74 50273 > http [SYN] Seq=0 Win=26883 Len=0 MSS=8961 SACK_PERM=1 TSval=8762947 TSecr=0 WS=128
  6   0.004362 54.230.119.189 -> 172.31.8.238 TCP 74 http > 50273 [SYN, ACK] Seq=0 Ack=1 Win=14480 Len=0 MSS=1460 SACK_PERM=1 TSval=1289081845 TSecr=8762947 WS=128
  7   0.004378 172.31.8.238 -> 54.230.119.189 TCP 66 50273 > http [ACK] Seq=1 Ack=1 Win=27008 Len=0 TSval=8762947 TSecr=1289081845
  8   0.004418 172.31.8.238 -> 54.230.119.189 HTTP 164 GET /100kb HTTP/1.1 
  9   0.005039 54.230.119.189 -> 172.31.8.238 TCP 66 http > 50273 [ACK] Seq=1 Ack=99 Win=14592 Len=0 TSval=1289081845 TSecr=8762947
 10   0.006619 54.230.119.189 -> 172.31.8.238 TCP 522 [TCP segment of a reassembled PDU]
 11   0.006625 172.31.8.238 -> 54.230.119.189 TCP 66 50273 > http [ACK] Seq=99 Ack=457 Win=28032 Len=0 TSval=8762947 TSecr=1289081845
 12   0.006741 54.230.119.189 -> 172.31.8.238 TCP 13098 [TCP segment of a reassembled PDU]
 13   0.006752 172.31.8.238 -> 54.230.119.189 TCP 66 50273 > http [ACK] Seq=99 Ack=13489 Win=54144 Len=0 TSval=8762947 TSecr=1289081845
 14   0.007421 54.230.119.189 -> 172.31.8.238 TCP 7306 [TCP segment of a reassembled PDU]
 15   0.007429 172.31.8.238 -> 54.230.119.189 TCP 66 50273 > http [ACK] Seq=99 Ack=20729 Win=68608 Len=0 TSval=8762947 TSecr=1289081845
 16   0.007514 54.230.119.189 -> 172.31.8.238 TCP 5858 [TCP segment of a reassembled PDU]
 17   0.007521 172.31.8.238 -> 54.230.119.189 TCP 66 50273 > http [ACK] Seq=99 Ack=26521 Win=80128 Len=0 TSval=8762947 TSecr=1289081845
 18   0.007926 54.230.119.189 -> 172.31.8.238 TCP 1514 [TCP segment of a reassembled PDU]
 19   0.007932 172.31.8.238 -> 54.230.119.189 TCP 66 50273 > http [ACK] Seq=99 Ack=27969 Win=83072 Len=0 TSval=8762948 TSecr=1289081845
 20   0.008055 54.230.119.189 -> 172.31.8.238 TCP 11650 [TCP segment of a reassembled PDU]
 21   0.008065 172.31.8.238 -> 54.230.119.189 TCP 66 50273 > http [ACK] Seq=99 Ack=39553 Win=106240 Len=0 TSval=8762948 TSecr=1289081845
 22   0.008187 54.230.119.189 -> 172.31.8.238 TCP 7306 [TCP segment of a reassembled PDU]
 23   0.008195 172.31.8.238 -> 54.230.119.189 TCP 66 50273 > http [ACK] Seq=99 Ack=46793 Win=120704 Len=0 TSval=8762948 TSecr=1289081845
 24   0.008645 54.230.119.189 -> 172.31.8.238 TCP 1514 [TCP segment of a reassembled PDU]
 25   0.008650 172.31.8.238 -> 54.230.119.189 TCP 66 50273 > http [ACK] Seq=99 Ack=48241 Win=123648 Len=0 TSval=8762948 TSecr=1289081845
 26   0.008772 54.230.119.189 -> 172.31.8.238 TCP 17442 [TCP segment of a reassembled PDU]
 27   0.008783 172.31.8.238 -> 54.230.119.189 TCP 66 50273 > http [ACK] Seq=99 Ack=65617 Win=158336 Len=0 TSval=8762948 TSecr=1289081845
 28   0.009248 54.230.119.189 -> 172.31.8.238 TCP 8754 [TCP segment of a reassembled PDU]
 29   0.009255 172.31.8.238 -> 54.230.119.189 TCP 66 50273 > http [ACK] Seq=99 Ack=74305 Win=175744 Len=0 TSval=8762948 TSecr=1289081845
 30   0.009507 54.230.119.189 -> 172.31.8.238 TCP 17442 [TCP segment of a reassembled PDU]
 31   0.009518 172.31.8.238 -> 54.230.119.189 TCP 66 50273 > http [ACK] Seq=99 Ack=91681 Win=169600 Len=0 TSval=8762948 TSecr=1289081845
 32   0.010066 54.230.119.189 -> 172.31.8.238 HTTP 11242 HTTP/1.1 200 OK  (application/octet-stream)
 33   0.010080 172.31.8.238 -> 54.230.119.189 TCP 66 50273 > http [ACK] Seq=99 Ack=102857 Win=179200 Len=0 TSval=8762948 TSecr=1289081845
 34   0.010227 172.31.8.238 -> 54.230.119.189 TCP 66 50273 > http [FIN, ACK] Seq=99 Ack=102857 Win=198016 Len=0 TSval=8762948 TSecr=1289081845
 35   0.010770 54.230.119.189 -> 172.31.8.238 TCP 66 http > 50273 [FIN, ACK] Seq=102857 Ack=100 Win=14592 Len=0 TSval=1289081845 TSecr=8762948
 36   0.010778 172.31.8.238 -> 54.230.119.189 TCP 66 50273 > http [ACK] Seq=100 Ack=102858 Win=198016 Len=0 TSval=8762948 TSecr=1289081845
