[Measurement for 100kb at 09:44:13 20.44.2014] 
Tshark:

  1   0.000000 172.31.8.238 -> 172.31.0.2   DNS 89 Standard query 0x113e  A d3m1c4hwkgedal.cloudfront.net
  2   0.000030 172.31.8.238 -> 172.31.0.2   DNS 89 Standard query 0x3267  AAAA d3m1c4hwkgedal.cloudfront.net
  3   0.000662   172.31.0.2 -> 172.31.8.238 DNS 174 Standard query response 0x3267 
  4   0.000675   172.31.0.2 -> 172.31.8.238 DNS 217 Standard query response 0x113e  A 54.192.118.228 A 54.192.118.238 A 54.230.116.82 A 54.230.117.21 A 54.230.117.37 A 54.239.132.74 A 54.239.132.83 A 54.192.118.219
  5   0.003810 172.31.8.238 -> 54.192.118.228 TCP 74 55230 > http [SYN] Seq=0 Win=26883 Len=0 MSS=8961 SACK_PERM=1 TSval=15070357 TSecr=0 WS=128
  6   0.004510 54.192.118.228 -> 172.31.8.238 TCP 74 http > 55230 [SYN, ACK] Seq=0 Ack=1 Win=14480 Len=0 MSS=1460 SACK_PERM=1 TSval=1583798756 TSecr=15070357 WS=128
  7   0.004523 172.31.8.238 -> 54.192.118.228 TCP 66 55230 > http [ACK] Seq=1 Ack=1 Win=27008 Len=0 TSval=15070357 TSecr=1583798756
  8   0.004564 172.31.8.238 -> 54.192.118.228 HTTP 164 GET /100kb HTTP/1.1 
  9   0.005224 54.192.118.228 -> 172.31.8.238 TCP 66 http > 55230 [ACK] Seq=1 Ack=99 Win=14592 Len=0 TSval=1583798756 TSecr=15070357
 10   0.006856 54.192.118.228 -> 172.31.8.238 TCP 522 [TCP segment of a reassembled PDU]
 11   0.006863 172.31.8.238 -> 54.192.118.228 TCP 66 55230 > http [ACK] Seq=99 Ack=457 Win=28032 Len=0 TSval=15070358 TSecr=1583798756
 12   0.006992 54.192.118.228 -> 172.31.8.238 TCP 13098 [TCP segment of a reassembled PDU]
 13   0.007003 172.31.8.238 -> 54.192.118.228 TCP 66 55230 > http [ACK] Seq=99 Ack=13489 Win=54144 Len=0 TSval=15070358 TSecr=1583798756
 14   0.007581 54.192.118.228 -> 172.31.8.238 TCP 1514 [TCP segment of a reassembled PDU]
 15   0.007587 172.31.8.238 -> 54.192.118.228 TCP 66 55230 > http [ACK] Seq=99 Ack=14937 Win=56960 Len=0 TSval=15070358 TSecr=1583798757
 16   0.007698 54.192.118.228 -> 172.31.8.238 TCP 11650 [TCP segment of a reassembled PDU]
 17   0.007706 172.31.8.238 -> 54.192.118.228 TCP 66 55230 > http [ACK] Seq=99 Ack=26521 Win=80128 Len=0 TSval=15070358 TSecr=1583798757
 18   0.008349 54.192.118.228 -> 172.31.8.238 TCP 1514 [TCP segment of a reassembled PDU]
 19   0.008367 172.31.8.238 -> 54.192.118.228 TCP 66 55230 > http [ACK] Seq=99 Ack=27969 Win=83072 Len=0 TSval=15070358 TSecr=1583798757
 20   0.008492 54.192.118.228 -> 172.31.8.238 TCP 18890 [TCP segment of a reassembled PDU]
 21   0.008504 172.31.8.238 -> 54.192.118.228 TCP 66 55230 > http [ACK] Seq=99 Ack=46793 Win=86912 Len=0 TSval=15070358 TSecr=1583798757
 22   0.009161 54.192.118.228 -> 172.31.8.238 TCP 13098 [TCP segment of a reassembled PDU]
 23   0.009171 172.31.8.238 -> 54.192.118.228 TCP 66 55230 > http [ACK] Seq=99 Ack=59825 Win=96512 Len=0 TSval=15070358 TSecr=1583798757
 24   0.009261 54.192.118.228 -> 172.31.8.238 TCP 5858 [TCP segment of a reassembled PDU]
 25   0.009267 172.31.8.238 -> 54.192.118.228 TCP 66 55230 > http [ACK] Seq=99 Ack=65617 Win=108416 Len=0 TSval=15070358 TSecr=1583798757
 26   0.009920 54.192.118.228 -> 172.31.8.238 TCP 8754 [TCP segment of a reassembled PDU]
 27   0.009928 172.31.8.238 -> 54.192.118.228 TCP 66 55230 > http [ACK] Seq=99 Ack=74305 Win=103680 Len=0 TSval=15070359 TSecr=1583798757
 28   0.010064 54.192.118.228 -> 172.31.8.238 TCP 17442 [TCP segment of a reassembled PDU]
 29   0.010077 172.31.8.238 -> 54.192.118.228 TCP 66 55230 > http [ACK] Seq=99 Ack=91681 Win=143872 Len=0 TSval=15070359 TSecr=1583798757
 30   0.010668 54.192.118.228 -> 172.31.8.238 HTTP 11242 HTTP/1.1 200 OK  (application/octet-stream)
 31   0.010678 172.31.8.238 -> 54.192.118.228 TCP 66 55230 > http [ACK] Seq=99 Ack=102857 Win=166144 Len=0 TSval=15070359 TSecr=1583798757
 32   0.010849 172.31.8.238 -> 54.192.118.228 TCP 66 55230 > http [FIN, ACK] Seq=99 Ack=102857 Win=166144 Len=0 TSval=15070359 TSecr=1583798757
 33   0.011650 54.192.118.228 -> 172.31.8.238 TCP 66 http > 55230 [FIN, ACK] Seq=102857 Ack=100 Win=14592 Len=0 TSval=1583798757 TSecr=15070359
 34   0.011660 172.31.8.238 -> 54.192.118.228 TCP 66 55230 > http [ACK] Seq=100 Ack=102858 Win=166144 Len=0 TSval=15070359 TSecr=1583798757
