[Measurement for 100kb at 18:44:41 19.44.2014] 
Tshark:

  1   0.000000 85.76.134.238 -> 172.31.8.238 SSH 102 Encrypted request packet len=48
  2   0.000145 172.31.8.238 -> 85.76.134.238 SSH 102 Encrypted response packet len=48
  3   0.137588 85.76.134.238 -> 172.31.8.238 SSH 102 Encrypted request packet len=48
  4   0.137615 85.76.134.238 -> 172.31.8.238 SSH 102 Encrypted request packet len=48
  5   0.137658 172.31.8.238 -> 85.76.134.238 TCP 54 ssh > 29664 [ACK] Seq=49 Ack=145 Win=258 Len=0
  6   0.137757 172.31.8.238 -> 85.76.134.238 SSH 102 Encrypted response packet len=48
  7   0.606942 85.76.134.238 -> 172.31.8.238 SSH 102 Encrypted request packet len=48
  8   0.607114 172.31.8.238 -> 85.76.134.238 SSH 102 Encrypted response packet len=48
  9   0.740052 85.76.134.238 -> 172.31.8.238 SSH 102 Encrypted request packet len=48
 10   0.743156 172.31.8.238 -> 85.76.134.238 SSH 102 Encrypted response packet len=48
 11   1.176033 85.76.134.238 -> 172.31.8.238 SSH 102 Encrypted request packet len=48
 12   1.176056 85.76.134.238 -> 172.31.8.238 TCP 54 29664 > ssh [ACK] Seq=289 Ack=193 Win=252 Len=0
 13   1.176159 172.31.8.238 -> 85.76.134.238 SSH 102 Encrypted response packet len=48
 14   1.176370 172.31.8.238 -> 85.76.134.238 SSH 134 Encrypted response packet len=80
 15   1.523507 172.31.8.238 -> 172.31.0.2   DNS 89 Standard query 0xa9a5  A d3m1c4hwkgedal.cloudfront.net
 16   1.523530 172.31.8.238 -> 172.31.0.2   DNS 89 Standard query 0x0a60  AAAA d3m1c4hwkgedal.cloudfront.net
 17   1.524327   172.31.0.2 -> 172.31.8.238 DNS 217 Standard query response 0xa9a5  A 54.230.119.66 A 54.230.119.110 A 54.239.132.41 A 54.239.132.86 A 54.239.132.250 A 54.230.117.50 A 54.230.117.154 A 54.230.117.238
 18   1.524337   172.31.0.2 -> 172.31.8.238 DNS 174 Standard query response 0x0a60 
 19   1.527374 172.31.8.238 -> 54.230.119.66 TCP 74 36625 > http [SYN] Seq=0 Win=26883 Len=0 MSS=8961 SACK_PERM=1 TSval=1577197 TSecr=0 WS=128
 20   1.528064 54.230.119.66 -> 172.31.8.238 TCP 74 http > 36625 [SYN, ACK] Seq=0 Ack=1 Win=14480 Len=0 MSS=1460 SACK_PERM=1 TSval=1679636323 TSecr=1577197 WS=128
 21   1.528078 172.31.8.238 -> 54.230.119.66 TCP 66 36625 > http [ACK] Seq=1 Ack=1 Win=27008 Len=0 TSval=1577197 TSecr=1679636323
 22   1.528124 172.31.8.238 -> 54.230.119.66 HTTP 164 GET /100kb HTTP/1.1 
 23   1.528865 54.230.119.66 -> 172.31.8.238 TCP 66 http > 36625 [ACK] Seq=1 Ack=99 Win=14592 Len=0 TSval=1679636324 TSecr=1577197
 24   1.612930 85.76.134.238 -> 172.31.8.238 TCP 54 29664 > ssh [ACK] Seq=289 Ack=321 Win=252 Len=0
 25   1.827053 54.230.119.66 -> 172.31.8.238 TCP 1514 [TCP segment of a reassembled PDU]
 26   1.827085 172.31.8.238 -> 54.230.119.66 TCP 66 36625 > http [ACK] Seq=99 Ack=1449 Win=29824 Len=0 TSval=1577272 TSecr=1679636353
 27   1.827118 54.230.119.66 -> 172.31.8.238 TCP 4410 [TCP segment of a reassembled PDU]
 28   1.827124 172.31.8.238 -> 54.230.119.66 TCP 66 36625 > http [ACK] Seq=99 Ack=5793 Win=38528 Len=0 TSval=1577272 TSecr=1679636353
 29   1.827148 54.230.119.66 -> 172.31.8.238 TCP 185 [TCP segment of a reassembled PDU]
 30   1.827151 172.31.8.238 -> 54.230.119.66 TCP 66 36625 > http [ACK] Seq=99 Ack=5912 Win=38528 Len=0 TSval=1577272 TSecr=1679636353
 31   1.829069 54.230.119.66 -> 172.31.8.238 TCP 2962 [TCP segment of a reassembled PDU]
 32   1.829076 172.31.8.238 -> 54.230.119.66 TCP 66 36625 > http [ACK] Seq=99 Ack=8808 Win=44288 Len=0 TSval=1577273 TSecr=1679636354
 33   1.829092 54.230.119.66 -> 172.31.8.238 TCP 90 [TCP segment of a reassembled PDU]
 34   1.829095 172.31.8.238 -> 54.230.119.66 TCP 66 36625 > http [ACK] Seq=99 Ack=8832 Win=44288 Len=0 TSval=1577273 TSecr=1679636354
 35   1.831418 54.230.119.66 -> 172.31.8.238 TCP 306 [TCP segment of a reassembled PDU]
 36   1.831424 172.31.8.238 -> 54.230.119.66 TCP 66 36625 > http [ACK] Seq=99 Ack=9072 Win=47232 Len=0 TSval=1577273 TSecr=1679636354
 37   1.834070 54.230.119.66 -> 172.31.8.238 TCP 2962 [TCP segment of a reassembled PDU]
 38   1.834076 172.31.8.238 -> 54.230.119.66 TCP 66 36625 > http [ACK] Seq=99 Ack=11968 Win=52992 Len=0 TSval=1577274 TSecr=1679636354
 39   1.834093 54.230.119.66 -> 172.31.8.238 TCP 90 [TCP segment of a reassembled PDU]
 40   1.834097 172.31.8.238 -> 54.230.119.66 TCP 66 36625 > http [ACK] Seq=99 Ack=11992 Win=52992 Len=0 TSval=1577274 TSecr=1679636354
 41   1.836433 54.230.119.66 -> 172.31.8.238 TCP 1526 [TCP segment of a reassembled PDU]
 42   1.836442 172.31.8.238 -> 54.230.119.66 TCP 66 36625 > http [ACK] Seq=99 Ack=13452 Win=55936 Len=0 TSval=1577274 TSecr=1679636354
 43   1.952426 54.230.119.66 -> 172.31.8.238 TCP 1514 [TCP segment of a reassembled PDU]
 44   1.952451 172.31.8.238 -> 54.230.119.66 TCP 66 36625 > http [ACK] Seq=99 Ack=14900 Win=58880 Len=0 TSval=1577303 TSecr=1679636366
 45   1.952460 54.230.119.66 -> 172.31.8.238 TCP 1514 [TCP segment of a reassembled PDU]
 46   1.952464 172.31.8.238 -> 54.230.119.66 TCP 66 36625 > http [ACK] Seq=99 Ack=16348 Win=61696 Len=0 TSval=1577303 TSecr=1679636366
 47   1.952641 54.230.119.66 -> 172.31.8.238 TCP 11650 [TCP segment of a reassembled PDU]
 48   1.952653 172.31.8.238 -> 54.230.119.66 TCP 66 36625 > http [ACK] Seq=99 Ack=27932 Win=84864 Len=0 TSval=1577304 TSecr=1679636366
 49   1.953153 54.230.119.66 -> 172.31.8.238 TCP 2962 [TCP segment of a reassembled PDU]
 50   1.953161 172.31.8.238 -> 54.230.119.66 TCP 66 36625 > http [ACK] Seq=99 Ack=30828 Win=89216 Len=0 TSval=1577304 TSecr=1679636366
 51   1.953184 54.230.119.66 -> 172.31.8.238 TCP 210 [TCP segment of a reassembled PDU]
 52   1.953189 172.31.8.238 -> 54.230.119.66 TCP 66 36625 > http [ACK] Seq=99 Ack=30972 Win=89088 Len=0 TSval=1577304 TSecr=1679636366
 53   1.954719 54.230.119.66 -> 172.31.8.238 TCP 2962 [TCP segment of a reassembled PDU]
 54   1.954726 172.31.8.238 -> 54.230.119.66 TCP 66 36625 > http [ACK] Seq=99 Ack=33868 Win=96512 Len=0 TSval=1577304 TSecr=1679636366
 55   1.954757 54.230.119.66 -> 172.31.8.238 TCP 90 [TCP segment of a reassembled PDU]
 56   1.954770 172.31.8.238 -> 54.230.119.66 TCP 66 36625 > http [ACK] Seq=99 Ack=33892 Win=96512 Len=0 TSval=1577304 TSecr=1679636366
 57   1.954827 54.230.119.66 -> 172.31.8.238 TCP 2962 [TCP segment of a reassembled PDU]
 58   1.954832 172.31.8.238 -> 54.230.119.66 TCP 66 36625 > http [ACK] Seq=99 Ack=36788 Win=102272 Len=0 TSval=1577304 TSecr=1679636366
 59   1.954899 54.230.119.66 -> 172.31.8.238 TCP 90 [TCP segment of a reassembled PDU]
 60   1.954910 172.31.8.238 -> 54.230.119.66 TCP 66 36625 > http [ACK] Seq=99 Ack=36812 Win=102272 Len=0 TSval=1577304 TSecr=1679636366
 61   1.958063 54.230.119.66 -> 172.31.8.238 TCP 2962 [TCP segment of a reassembled PDU]
 62   1.958069 172.31.8.238 -> 54.230.119.66 TCP 66 36625 > http [ACK] Seq=99 Ack=39708 Win=108032 Len=0 TSval=1577305 TSecr=1679636366
 63   1.958117 54.230.119.66 -> 172.31.8.238 TCP 90 [TCP segment of a reassembled PDU]
 64   1.958129 172.31.8.238 -> 54.230.119.66 TCP 66 36625 > http [ACK] Seq=99 Ack=39732 Win=108032 Len=0 TSval=1577305 TSecr=1679636366
 65   1.961669 54.230.119.66 -> 172.31.8.238 TCP 2962 [TCP segment of a reassembled PDU]
 66   1.961676 172.31.8.238 -> 54.230.119.66 TCP 66 36625 > http [ACK] Seq=99 Ack=42628 Win=109056 Len=0 TSval=1577306 TSecr=1679636367
 67   1.961699 54.230.119.66 -> 172.31.8.238 TCP 90 [TCP segment of a reassembled PDU]
 68   1.961711 172.31.8.238 -> 54.230.119.66 TCP 66 36625 > http [ACK] Seq=99 Ack=42652 Win=109056 Len=0 TSval=1577306 TSecr=1679636367
 69   1.965238 54.230.119.66 -> 172.31.8.238 TCP 1514 [TCP segment of a reassembled PDU]
 70   1.965485 54.230.119.66 -> 172.31.8.238 TCP 1538 [TCP segment of a reassembled PDU]
 71   1.965491 172.31.8.238 -> 54.230.119.66 TCP 66 36625 > http [ACK] Seq=99 Ack=45572 Win=109056 Len=0 TSval=1577307 TSecr=1679636367
 72   1.969880 54.230.119.66 -> 172.31.8.238 TCP 2962 [TCP segment of a reassembled PDU]
 73   1.969886 172.31.8.238 -> 54.230.119.66 TCP 66 36625 > http [ACK] Seq=99 Ack=48468 Win=109056 Len=0 TSval=1577308 TSecr=1679636368
 74   1.969913 54.230.119.66 -> 172.31.8.238 TCP 90 [TCP segment of a reassembled PDU]
 75   1.969927 172.31.8.238 -> 54.230.119.66 TCP 66 36625 > http [ACK] Seq=99 Ack=48492 Win=109056 Len=0 TSval=1577308 TSecr=1679636368
 76   1.972933 54.230.119.66 -> 172.31.8.238 TCP 1526 [TCP segment of a reassembled PDU]
 77   1.972939 172.31.8.238 -> 54.230.119.66 TCP 66 36625 > http [ACK] Seq=99 Ack=49952 Win=109056 Len=0 TSval=1577309 TSecr=1679636368
 78   1.972967 54.230.119.66 -> 172.31.8.238 TCP 1526 [TCP segment of a reassembled PDU]
 79   1.972971 172.31.8.238 -> 54.230.119.66 TCP 66 36625 > http [ACK] Seq=99 Ack=51412 Win=109056 Len=0 TSval=1577309 TSecr=1679636368
 80   2.078352 54.230.119.66 -> 172.31.8.238 TCP 2962 [TCP segment of a reassembled PDU]
 81   2.078376 172.31.8.238 -> 54.230.119.66 TCP 66 36625 > http [ACK] Seq=99 Ack=54308 Win=109056 Len=0 TSval=1577335 TSecr=1679636378
 82   2.078382 54.230.119.66 -> 172.31.8.238 TCP 90 [TCP segment of a reassembled PDU]
 83   2.078410 54.230.119.66 -> 172.31.8.238 TCP 1514 [TCP segment of a reassembled PDU]
 84   2.078442 172.31.8.238 -> 54.230.119.66 TCP 66 36625 > http [ACK] Seq=99 Ack=55780 Win=109056 Len=0 TSval=1577335 TSecr=1679636378
 85   2.078529 54.230.119.66 -> 172.31.8.238 TCP 7306 [TCP segment of a reassembled PDU]
 86   2.078536 172.31.8.238 -> 54.230.119.66 TCP 66 36625 > http [ACK] Seq=99 Ack=63020 Win=123520 Len=0 TSval=1577335 TSecr=1679636378
 87   2.078578 54.230.119.66 -> 172.31.8.238 TCP 138 [TCP segment of a reassembled PDU]
 88   2.078593 172.31.8.238 -> 54.230.119.66 TCP 66 36625 > http [ACK] Seq=99 Ack=63092 Win=123520 Len=0 TSval=1577335 TSecr=1679636378
 89   2.080606 54.230.119.66 -> 172.31.8.238 TCP 4410 [TCP segment of a reassembled PDU]
 90   2.080613 172.31.8.238 -> 54.230.119.66 TCP 66 36625 > http [ACK] Seq=99 Ack=67436 Win=132224 Len=0 TSval=1577336 TSecr=1679636379
 91   2.080748 54.230.119.66 -> 172.31.8.238 TCP 11650 [TCP segment of a reassembled PDU]
 92   2.080756 172.31.8.238 -> 54.230.119.66 TCP 66 36625 > http [ACK] Seq=99 Ack=79020 Win=155392 Len=0 TSval=1577336 TSecr=1679636379
 93   2.080770 54.230.119.66 -> 172.31.8.238 TCP 198 [TCP segment of a reassembled PDU]
 94   2.080783 172.31.8.238 -> 54.230.119.66 TCP 66 36625 > http [ACK] Seq=99 Ack=79152 Win=155392 Len=0 TSval=1577336 TSecr=1679636379
 95   2.081162 54.230.119.66 -> 172.31.8.238 TCP 1526 [TCP segment of a reassembled PDU]
 96   2.081166 172.31.8.238 -> 54.230.119.66 TCP 66 36625 > http [ACK] Seq=99 Ack=80612 Win=158336 Len=0 TSval=1577336 TSecr=1679636379
 97   2.083913 54.230.119.66 -> 172.31.8.238 TCP 1514 [TCP segment of a reassembled PDU]
 98   2.083917 172.31.8.238 -> 54.230.119.66 TCP 66 36625 > http [ACK] Seq=99 Ack=82060 Win=161152 Len=0 TSval=1577336 TSecr=1679636379
 99   2.084016 54.230.119.66 -> 172.31.8.238 TCP 1538 [TCP segment of a reassembled PDU]
100   2.084021 172.31.8.238 -> 54.230.119.66 TCP 66 36625 > http [ACK] Seq=99 Ack=83532 Win=164096 Len=0 TSval=1577336 TSecr=1679636379
101   2.087521 54.230.119.66 -> 172.31.8.238 TCP 1526 [TCP segment of a reassembled PDU]
102   2.087527 172.31.8.238 -> 54.230.119.66 TCP 66 36625 > http [ACK] Seq=99 Ack=84992 Win=167040 Len=0 TSval=1577337 TSecr=1679636379
103   2.087566 54.230.119.66 -> 172.31.8.238 TCP 2962 [TCP segment of a reassembled PDU]
104   2.087574 172.31.8.238 -> 54.230.119.66 TCP 66 36625 > http [ACK] Seq=99 Ack=87888 Win=172928 Len=0 TSval=1577337 TSecr=1679636379
105   2.087646 54.230.119.66 -> 172.31.8.238 TCP 1550 [TCP segment of a reassembled PDU]
106   2.087650 172.31.8.238 -> 54.230.119.66 TCP 66 36625 > http [ACK] Seq=99 Ack=89372 Win=175872 Len=0 TSval=1577337 TSecr=1679636379
107   2.091157 54.230.119.66 -> 172.31.8.238 TCP 2962 [TCP segment of a reassembled PDU]
108   2.091162 172.31.8.238 -> 54.230.119.66 TCP 66 36625 > http [ACK] Seq=99 Ack=92268 Win=181632 Len=0 TSval=1577338 TSecr=1679636380
109   2.091190 54.230.119.66 -> 172.31.8.238 TCP 90 [TCP segment of a reassembled PDU]
110   2.091204 172.31.8.238 -> 54.230.119.66 TCP 66 36625 > http [ACK] Seq=99 Ack=92292 Win=181632 Len=0 TSval=1577338 TSecr=1679636380
111   2.094740 54.230.119.66 -> 172.31.8.238 TCP 2962 [TCP segment of a reassembled PDU]
112   2.094745 172.31.8.238 -> 54.230.119.66 TCP 66 36625 > http [ACK] Seq=99 Ack=95188 Win=187392 Len=0 TSval=1577339 TSecr=1679636380
113   2.094766 54.230.119.66 -> 172.31.8.238 TCP 90 [TCP segment of a reassembled PDU]
114   2.094775 172.31.8.238 -> 54.230.119.66 TCP 66 36625 > http [ACK] Seq=99 Ack=95212 Win=187392 Len=0 TSval=1577339 TSecr=1679636380
115   2.098592 54.230.119.66 -> 172.31.8.238 TCP 2962 [TCP segment of a reassembled PDU]
116   2.098597 172.31.8.238 -> 54.230.119.66 TCP 66 36625 > http [ACK] Seq=99 Ack=98108 Win=193152 Len=0 TSval=1577340 TSecr=1679636381
117   2.098619 54.230.119.66 -> 172.31.8.238 TCP 90 [TCP segment of a reassembled PDU]
118   2.098632 172.31.8.238 -> 54.230.119.66 TCP 66 36625 > http [ACK] Seq=99 Ack=98132 Win=193152 Len=0 TSval=1577340 TSecr=1679636381
119   2.098686 54.230.119.66 -> 172.31.8.238 TCP 2962 [TCP segment of a reassembled PDU]
120   2.098691 172.31.8.238 -> 54.230.119.66 TCP 66 36625 > http [ACK] Seq=99 Ack=101028 Win=199040 Len=0 TSval=1577340 TSecr=1679636381
121   2.098742 54.230.119.66 -> 172.31.8.238 TCP 90 [TCP segment of a reassembled PDU]
122   2.098757 172.31.8.238 -> 54.230.119.66 TCP 66 36625 > http [ACK] Seq=99 Ack=101052 Win=199040 Len=0 TSval=1577340 TSecr=1679636381
123   2.132706 54.230.119.66 -> 172.31.8.238 HTTP 1860 HTTP/1.1 200 OK  (application/octet-stream)
124   2.132721 172.31.8.238 -> 54.230.119.66 TCP 66 36625 > http [ACK] Seq=99 Ack=102846 Win=202624 Len=0 TSval=1577349 TSecr=1679636384
125   2.132919 172.31.8.238 -> 54.230.119.66 TCP 66 36625 > http [FIN, ACK] Seq=99 Ack=102846 Win=202624 Len=0 TSval=1577349 TSecr=1679636384
126   2.133629 54.230.119.66 -> 172.31.8.238 TCP 66 http > 36625 [FIN, ACK] Seq=102846 Ack=100 Win=14592 Len=0 TSval=1679636384 TSecr=1577349
127   2.133638 172.31.8.238 -> 54.230.119.66 TCP 66 36625 > http [ACK] Seq=100 Ack=102847 Win=202624 Len=0 TSval=1577349 TSecr=1679636384
