[Measurement for 100kb at 12:43:44 20.43.2014] 
Tshark:

  1   0.000000 172.31.8.238 -> 172.31.0.2   DNS 89 Standard query 0xfdc3  A d3m1c4hwkgedal.cloudfront.net
  2   0.000029 172.31.8.238 -> 172.31.0.2   DNS 89 Standard query 0x816c  AAAA d3m1c4hwkgedal.cloudfront.net
  3   0.000737   172.31.0.2 -> 172.31.8.238 DNS 217 Standard query response 0xfdc3  A 54.192.118.239 A 54.230.116.44 A 54.230.116.72 A 54.230.118.248 A 54.239.132.26 A 54.239.132.83 A 54.239.132.98 A 54.239.132.103
  4   0.000748   172.31.0.2 -> 172.31.8.238 DNS 174 Standard query response 0x816c 
  5   0.003882 172.31.8.238 -> 54.192.118.239 TCP 74 48352 > http [SYN] Seq=0 Win=26883 Len=0 MSS=8961 SACK_PERM=1 TSval=17762969 TSecr=0 WS=128
  6   0.004535 54.192.118.239 -> 172.31.8.238 TCP 74 http > 48352 [SYN, ACK] Seq=0 Ack=1 Win=14480 Len=0 MSS=1460 SACK_PERM=1 TSval=1688362015 TSecr=17762969 WS=128
  7   0.004551 172.31.8.238 -> 54.192.118.239 TCP 66 48352 > http [ACK] Seq=1 Ack=1 Win=27008 Len=0 TSval=17762969 TSecr=1688362015
  8   0.004591 172.31.8.238 -> 54.192.118.239 HTTP 164 GET /100kb HTTP/1.1 
  9   0.005234 54.192.118.239 -> 172.31.8.238 TCP 66 http > 48352 [ACK] Seq=1 Ack=99 Win=14592 Len=0 TSval=1688362015 TSecr=17762969
 10   0.007309 54.192.118.239 -> 172.31.8.238 TCP 2580 [TCP segment of a reassembled PDU]
 11   0.007318 172.31.8.238 -> 54.192.118.239 TCP 66 48352 > http [ACK] Seq=99 Ack=2515 Win=32000 Len=0 TSval=17762970 TSecr=1688362015
 12   0.007426 54.192.118.239 -> 172.31.8.238 TCP 11650 [TCP segment of a reassembled PDU]
 13   0.007436 172.31.8.238 -> 54.192.118.239 TCP 66 48352 > http [ACK] Seq=99 Ack=14099 Win=55168 Len=0 TSval=17762970 TSecr=1688362015
 14   0.008100 54.192.118.239 -> 172.31.8.238 TCP 2962 [TCP segment of a reassembled PDU]
 15   0.008119 172.31.8.238 -> 54.192.118.239 TCP 66 48352 > http [ACK] Seq=99 Ack=16995 Win=60928 Len=0 TSval=17762970 TSecr=1688362015
 16   0.008200 54.192.118.239 -> 172.31.8.238 TCP 10202 [TCP segment of a reassembled PDU]
 17   0.008208 172.31.8.238 -> 54.192.118.239 TCP 66 48352 > http [ACK] Seq=99 Ack=27131 Win=81152 Len=0 TSval=17762970 TSecr=1688362015
 18   0.008866 54.192.118.239 -> 172.31.8.238 TCP 10202 [TCP segment of a reassembled PDU]
 19   0.008875 172.31.8.238 -> 54.192.118.239 TCP 66 48352 > http [ACK] Seq=99 Ack=37267 Win=101248 Len=0 TSval=17762970 TSecr=1688362015
 20   0.008930 54.192.118.239 -> 172.31.8.238 TCP 10202 [TCP segment of a reassembled PDU]
 21   0.008938 172.31.8.238 -> 54.192.118.239 TCP 66 48352 > http [ACK] Seq=99 Ack=47403 Win=101248 Len=0 TSval=17762970 TSecr=1688362015
 22   0.009632 54.192.118.239 -> 172.31.8.238 TCP 8754 [TCP segment of a reassembled PDU]
 23   0.009641 172.31.8.238 -> 54.192.118.239 TCP 66 48352 > http [ACK] Seq=99 Ack=56091 Win=103680 Len=0 TSval=17762970 TSecr=1688362015
 24   0.009707 54.192.118.239 -> 172.31.8.238 TCP 10202 [TCP segment of a reassembled PDU]
 25   0.009716 172.31.8.238 -> 54.192.118.239 TCP 66 48352 > http [ACK] Seq=99 Ack=66227 Win=101248 Len=0 TSval=17762970 TSecr=1688362015
 26   0.010377 54.192.118.239 -> 172.31.8.238 TCP 2962 [TCP segment of a reassembled PDU]
 27   0.010382 172.31.8.238 -> 54.192.118.239 TCP 66 48352 > http [ACK] Seq=99 Ack=69123 Win=109056 Len=0 TSval=17762971 TSecr=1688362015
 28   0.010527 54.192.118.239 -> 172.31.8.238 TCP 21786 [TCP segment of a reassembled PDU]
 29   0.010539 172.31.8.238 -> 54.192.118.239 TCP 66 48352 > http [ACK] Seq=99 Ack=90843 Win=152448 Len=0 TSval=17762971 TSecr=1688362015
 30   0.010545 54.192.118.239 -> 172.31.8.238 TCP 1514 [TCP segment of a reassembled PDU]
 31   0.010547 172.31.8.238 -> 54.192.118.239 TCP 66 48352 > http [ACK] Seq=99 Ack=92291 Win=155392 Len=0 TSval=17762971 TSecr=1688362015
 32   0.010887 54.192.118.239 -> 172.31.8.238 TCP 2962 [TCP segment of a reassembled PDU]
 33   0.010893 172.31.8.238 -> 54.192.118.239 TCP 66 48352 > http [ACK] Seq=99 Ack=95187 Win=161152 Len=0 TSval=17762971 TSecr=1688362015
 34   0.011163 54.192.118.239 -> 172.31.8.238 TCP 4410 [TCP segment of a reassembled PDU]
 35   0.011168 172.31.8.238 -> 54.192.118.239 TCP 66 48352 > http [ACK] Seq=99 Ack=99531 Win=169856 Len=0 TSval=17762971 TSecr=1688362015
 36   0.011269 54.192.118.239 -> 172.31.8.238 HTTP 3392 HTTP/1.1 200 OK  (application/octet-stream)
 37   0.011274 172.31.8.238 -> 54.192.118.239 TCP 66 48352 > http [ACK] Seq=99 Ack=102857 Win=176512 Len=0 TSval=17762971 TSecr=1688362015
 38   0.011398 172.31.8.238 -> 54.192.118.239 TCP 66 48352 > http [FIN, ACK] Seq=99 Ack=102857 Win=176512 Len=0 TSval=17762971 TSecr=1688362015
 39   0.011883 54.192.118.239 -> 172.31.8.238 TCP 66 http > 48352 [FIN, ACK] Seq=102857 Ack=100 Win=14592 Len=0 TSval=1688362015 TSecr=17762971
 40   0.011892 172.31.8.238 -> 54.192.118.239 TCP 66 48352 > http [ACK] Seq=100 Ack=102858 Win=176512 Len=0 TSval=17762971 TSecr=1688362015
