[Measurement for 100kb at 23:43:43 19.43.2014] 
Tshark:

  1   0.000000 172.31.8.238 -> 172.31.0.2   DNS 89 Standard query 0x61d5  A d3m1c4hwkgedal.cloudfront.net
  2   0.000038 172.31.8.238 -> 172.31.0.2   DNS 89 Standard query 0x35b4  AAAA d3m1c4hwkgedal.cloudfront.net
  3   0.000717   172.31.0.2 -> 172.31.8.238 DNS 174 Standard query response 0x35b4 
  4   0.000727   172.31.0.2 -> 172.31.8.238 DNS 217 Standard query response 0x61d5  A 54.230.119.106 A 54.239.132.55 A 54.230.116.73 A 54.230.116.98 A 54.230.116.136 A 54.230.117.50 A 54.230.118.143 A 54.230.119.86
  5   0.003880 172.31.8.238 -> 54.230.119.106 TCP 74 56808 > http [SYN] Seq=0 Win=26883 Len=0 MSS=8961 SACK_PERM=1 TSval=6062795 TSecr=0 WS=128
  6   0.004699 54.230.119.106 -> 172.31.8.238 TCP 74 http > 56808 [SYN, ACK] Seq=0 Ack=1 Win=14480 Len=0 MSS=1460 SACK_PERM=1 TSval=1685242985 TSecr=6062795 WS=128
  7   0.004713 172.31.8.238 -> 54.230.119.106 TCP 66 56808 > http [ACK] Seq=1 Ack=1 Win=27008 Len=0 TSval=6062795 TSecr=1685242985
  8   0.004753 172.31.8.238 -> 54.230.119.106 HTTP 164 GET /100kb HTTP/1.1 
  9   0.005419 54.230.119.106 -> 172.31.8.238 TCP 66 http > 56808 [ACK] Seq=1 Ack=99 Win=14592 Len=0 TSval=1685242985 TSecr=6062795
 10   0.007489 54.230.119.106 -> 172.31.8.238 TCP 522 [TCP segment of a reassembled PDU]
 11   0.007496 172.31.8.238 -> 54.230.119.106 TCP 66 56808 > http [ACK] Seq=99 Ack=457 Win=28032 Len=0 TSval=6062795 TSecr=1685242985
 12   0.007610 54.230.119.106 -> 172.31.8.238 TCP 13098 [TCP segment of a reassembled PDU]
 13   0.007621 172.31.8.238 -> 54.230.119.106 TCP 66 56808 > http [ACK] Seq=99 Ack=13489 Win=54144 Len=0 TSval=6062795 TSecr=1685242985
 14   0.008299 54.230.119.106 -> 172.31.8.238 TCP 7306 [TCP segment of a reassembled PDU]
 15   0.008311 172.31.8.238 -> 54.230.119.106 TCP 66 56808 > http [ACK] Seq=99 Ack=20729 Win=68608 Len=0 TSval=6062796 TSecr=1685242985
 16   0.008342 54.230.119.106 -> 172.31.8.238 TCP 5858 [TCP segment of a reassembled PDU]
 17   0.008353 172.31.8.238 -> 54.230.119.106 TCP 66 56808 > http [ACK] Seq=99 Ack=26521 Win=80128 Len=0 TSval=6062796 TSecr=1685242985
 18   0.009056 54.230.119.106 -> 172.31.8.238 TCP 4410 [TCP segment of a reassembled PDU]
 19   0.009063 172.31.8.238 -> 54.230.119.106 TCP 66 56808 > http [ACK] Seq=99 Ack=30865 Win=88832 Len=0 TSval=6062796 TSecr=1685242985
 20   0.009177 54.230.119.106 -> 172.31.8.238 TCP 15994 [TCP segment of a reassembled PDU]
 21   0.009187 172.31.8.238 -> 54.230.119.106 TCP 66 56808 > http [ACK] Seq=99 Ack=46793 Win=91648 Len=0 TSval=6062796 TSecr=1685242985
 22   0.009819 54.230.119.106 -> 172.31.8.238 TCP 7306 [TCP segment of a reassembled PDU]
 23   0.009827 172.31.8.238 -> 54.230.119.106 TCP 66 56808 > http [ACK] Seq=99 Ack=54033 Win=105984 Len=0 TSval=6062796 TSecr=1685242985
 24   0.009939 54.230.119.106 -> 172.31.8.238 TCP 11650 [TCP segment of a reassembled PDU]
 25   0.009947 172.31.8.238 -> 54.230.119.106 TCP 66 56808 > http [ACK] Seq=99 Ack=65617 Win=98944 Len=0 TSval=6062796 TSecr=1685242985
 26   0.010573 54.230.119.106 -> 172.31.8.238 TCP 5858 [TCP segment of a reassembled PDU]
 27   0.010581 172.31.8.238 -> 54.230.119.106 TCP 66 56808 > http [ACK] Seq=99 Ack=71409 Win=108416 Len=0 TSval=6062796 TSecr=1685242985
 28   0.010693 54.230.119.106 -> 172.31.8.238 TCP 20338 [TCP segment of a reassembled PDU]
 29   0.010707 172.31.8.238 -> 54.230.119.106 TCP 66 56808 > http [ACK] Seq=99 Ack=91681 Win=88192 Len=0 TSval=6062796 TSecr=1685242985
 30   0.011339 54.230.119.106 -> 172.31.8.238 TCP 2962 [TCP segment of a reassembled PDU]
 31   0.011345 172.31.8.238 -> 54.230.119.106 TCP 66 56808 > http [ACK] Seq=99 Ack=94577 Win=109056 Len=0 TSval=6062796 TSecr=1685242986
 32   0.011434 54.230.119.106 -> 172.31.8.238 HTTP 8346 HTTP/1.1 200 OK  (application/octet-stream)
 33   0.011442 172.31.8.238 -> 54.230.119.106 TCP 66 56808 > http [ACK] Seq=99 Ack=102857 Win=103680 Len=0 TSval=6062796 TSecr=1685242986
 34   0.011569 172.31.8.238 -> 54.230.119.106 TCP 66 56808 > http [FIN, ACK] Seq=99 Ack=102857 Win=109056 Len=0 TSval=6062796 TSecr=1685242986
 35   0.012093 54.230.119.106 -> 172.31.8.238 TCP 66 http > 56808 [FIN, ACK] Seq=102857 Ack=100 Win=14592 Len=0 TSval=1685242986 TSecr=6062796
 36   0.012101 172.31.8.238 -> 54.230.119.106 TCP 66 56808 > http [ACK] Seq=100 Ack=102858 Win=109056 Len=0 TSval=6062797 TSecr=1685242986
