[Measurement for 1kb at 13:41:38 20.41.2014] 
Tshark:

  1   0.000000 172.31.8.238 -> 172.31.0.2   DNS 89 Standard query 0x5f52  A d1dx94olpiqj0t.cloudfront.net
  2   0.000028 172.31.8.238 -> 172.31.0.2   DNS 89 Standard query 0x158b  AAAA d1dx94olpiqj0t.cloudfront.net
  3   0.000695   172.31.0.2 -> 172.31.8.238 DNS 217 Standard query response 0x5f52  A 54.230.116.98 A 54.230.117.50 A 54.230.117.152 A 54.230.118.235 A 54.230.119.12 A 54.230.119.71 A 54.192.118.221 A 54.230.116.72
  4   0.005752   172.31.0.2 -> 172.31.8.238 DNS 176 Standard query response 0x158b 
  5   0.012019 172.31.8.238 -> 54.230.116.98 TCP 74 40160 > http [SYN] Seq=0 Win=26883 Len=0 MSS=8961 SACK_PERM=1 TSval=18631580 TSecr=0 WS=128
  6   0.012836 54.230.116.98 -> 172.31.8.238 TCP 74 http > 40160 [SYN, ACK] Seq=0 Ack=1 Win=14480 Len=0 MSS=1460 SACK_PERM=1 TSval=1688249460 TSecr=18631580 WS=128
  7   0.012849 172.31.8.238 -> 54.230.116.98 TCP 66 40160 > http [ACK] Seq=1 Ack=1 Win=27008 Len=0 TSval=18631580 TSecr=1688249460
  8   0.012906 172.31.8.238 -> 54.230.116.98 HTTP 162 GET /1kb HTTP/1.1 
  9   0.013530 54.230.116.98 -> 172.31.8.238 TCP 66 http > 40160 [ACK] Seq=1 Ack=97 Win=14592 Len=0 TSval=1688249460 TSecr=18631580
 10   0.015438 54.230.116.98 -> 172.31.8.238 HTTP 1544 HTTP/1.1 200 OK  (application/octet-stream)
 11   0.015444 172.31.8.238 -> 54.230.116.98 TCP 66 40160 > http [ACK] Seq=97 Ack=1479 Win=29952 Len=0 TSval=18631581 TSecr=1688249460
 12   0.015604 172.31.8.238 -> 54.230.116.98 TCP 66 40160 > http [FIN, ACK] Seq=97 Ack=1479 Win=29952 Len=0 TSval=18631581 TSecr=1688249460
 13   0.016425 54.230.116.98 -> 172.31.8.238 TCP 66 http > 40160 [FIN, ACK] Seq=1479 Ack=98 Win=14592 Len=0 TSval=1688249460 TSecr=18631581
 14   0.016434 172.31.8.238 -> 54.230.116.98 TCP 66 40160 > http [ACK] Seq=98 Ack=1480 Win=29952 Len=0 TSval=18631581 TSecr=1688249460
