[Measurement for 1kb at 09:41:38 20.41.2014] 
Tshark:

  1   0.000000 172.31.8.238 -> 172.31.0.2   DNS 89 Standard query 0xb545  A d1dx94olpiqj0t.cloudfront.net
  2   0.000029 172.31.8.238 -> 172.31.0.2   DNS 89 Standard query 0x0f7c  AAAA d1dx94olpiqj0t.cloudfront.net
  3   0.000629   172.31.0.2 -> 172.31.8.238 DNS 217 Standard query response 0xb545  A 54.230.118.114 A 54.230.118.138 A 54.230.119.12 A 54.230.119.118 A 54.192.118.218 A 54.192.118.242 A 54.230.116.239 A 54.230.117.21
  4   0.005120   172.31.0.2 -> 172.31.8.238 DNS 176 Standard query response 0x0f7c 
  5   0.006481 172.31.8.238 -> 54.230.118.114 TCP 74 45853 > http [SYN] Seq=0 Win=26883 Len=0 MSS=8961 SACK_PERM=1 TSval=15031614 TSecr=0 WS=128
  6   0.007362 54.230.118.114 -> 172.31.8.238 TCP 74 http > 45853 [SYN, ACK] Seq=0 Ack=1 Win=14480 Len=0 MSS=1460 SACK_PERM=1 TSval=1685611658 TSecr=15031614 WS=128
  7   0.007377 172.31.8.238 -> 54.230.118.114 TCP 66 45853 > http [ACK] Seq=1 Ack=1 Win=27008 Len=0 TSval=15031614 TSecr=1685611658
  8   0.007417 172.31.8.238 -> 54.230.118.114 HTTP 162 GET /1kb HTTP/1.1 
  9   0.008308 54.230.118.114 -> 172.31.8.238 TCP 66 http > 45853 [ACK] Seq=1 Ack=97 Win=14592 Len=0 TSval=1685611658 TSecr=15031614
 10   0.009567 54.230.118.114 -> 172.31.8.238 HTTP 1544 HTTP/1.1 200 OK  (application/octet-stream)
 11   0.009574 172.31.8.238 -> 54.230.118.114 TCP 66 45853 > http [ACK] Seq=97 Ack=1479 Win=29952 Len=0 TSval=15031615 TSecr=1685611659
 12   0.009718 172.31.8.238 -> 54.230.118.114 TCP 66 45853 > http [FIN, ACK] Seq=97 Ack=1479 Win=29952 Len=0 TSval=15031615 TSecr=1685611659
 13   0.010148 54.230.118.114 -> 172.31.8.238 TCP 66 http > 45853 [FIN, ACK] Seq=1479 Ack=98 Win=14592 Len=0 TSval=1685611659 TSecr=15031615
 14   0.010155 172.31.8.238 -> 54.230.118.114 TCP 66 45853 > http [ACK] Seq=98 Ack=1480 Win=29952 Len=0 TSval=15031615 TSecr=1685611659
