[Measurement for 1kb at 20:41:38 19.41.2014] 
Tshark:

  1   0.000000 172.31.8.238 -> 172.31.0.2   DNS 89 Standard query 0xf7ae  A d1dx94olpiqj0t.cloudfront.net
  2   0.000044 172.31.8.238 -> 172.31.0.2   DNS 89 Standard query 0x0b6d  AAAA d1dx94olpiqj0t.cloudfront.net
  3   0.000604   172.31.0.2 -> 172.31.8.238 DNS 217 Standard query response 0xf7ae  A 54.192.118.221 A 54.192.118.230 A 54.192.118.239 A 54.230.116.44 A 54.230.116.154 A 54.230.119.110 A 54.239.132.86 A 54.192.118.220
  4   0.003326   172.31.0.2 -> 172.31.8.238 DNS 176 Standard query response 0x0b6d 
  5   0.003950 172.31.8.238 -> 54.192.118.221 TCP 74 41226 > http [SYN] Seq=0 Win=26883 Len=0 MSS=8961 SACK_PERM=1 TSval=3331513 TSecr=0 WS=128
  6   0.004508 54.192.118.221 -> 172.31.8.238 TCP 74 http > 41226 [SYN, ACK] Seq=0 Ack=1 Win=14480 Len=0 MSS=1460 SACK_PERM=1 TSval=1683547557 TSecr=3331513 WS=128
  7   0.004522 172.31.8.238 -> 54.192.118.221 TCP 66 41226 > http [ACK] Seq=1 Ack=1 Win=27008 Len=0 TSval=3331513 TSecr=1683547557
  8   0.004567 172.31.8.238 -> 54.192.118.221 HTTP 162 GET /1kb HTTP/1.1 
  9   0.005145 54.192.118.221 -> 172.31.8.238 TCP 66 http > 41226 [ACK] Seq=1 Ack=97 Win=14592 Len=0 TSval=1683547557 TSecr=3331513
 10   0.007216 54.192.118.221 -> 172.31.8.238 HTTP 1543 HTTP/1.1 200 OK  (application/octet-stream)
 11   0.007223 172.31.8.238 -> 54.192.118.221 TCP 66 41226 > http [ACK] Seq=97 Ack=1478 Win=29952 Len=0 TSval=3331514 TSecr=1683547558
 12   0.007363 172.31.8.238 -> 54.192.118.221 TCP 66 41226 > http [FIN, ACK] Seq=97 Ack=1478 Win=29952 Len=0 TSval=3331514 TSecr=1683547558
 13   0.007937 54.192.118.221 -> 172.31.8.238 TCP 66 http > 41226 [FIN, ACK] Seq=1478 Ack=98 Win=14592 Len=0 TSval=1683547558 TSecr=3331514
 14   0.007945 172.31.8.238 -> 54.192.118.221 TCP 66 41226 > http [ACK] Seq=98 Ack=1479 Win=29952 Len=0 TSval=3331514 TSecr=1683547558
