[Measurement for 1kb at 06:41:38 20.41.2014] 
Tshark:

  1   0.000000 172.31.8.238 -> 172.31.0.2   DNS 89 Standard query 0x2558  A d1dx94olpiqj0t.cloudfront.net
  2   0.000028 172.31.8.238 -> 172.31.0.2   DNS 89 Standard query 0x87a8  AAAA d1dx94olpiqj0t.cloudfront.net
  3   0.000506   172.31.0.2 -> 172.31.8.238 DNS 217 Standard query response 0x2558  A 54.230.117.156 A 54.230.118.143 A 54.230.119.11 A 54.192.118.235 A 54.230.117.5 A 54.230.117.10 A 54.230.117.50 A 54.230.117.86
  4   0.007841   172.31.0.2 -> 172.31.8.238 DNS 176 Standard query response 0x87a8 
  5   0.014158 172.31.8.238 -> 54.230.117.156 TCP 74 41304 > http [SYN] Seq=0 Win=26883 Len=0 MSS=8961 SACK_PERM=1 TSval=12331547 TSecr=0 WS=128
  6   0.015013 54.230.117.156 -> 172.31.8.238 TCP 74 http > 41304 [SYN, ACK] Seq=0 Ack=1 Win=14480 Len=0 MSS=1460 SACK_PERM=1 TSval=1686725416 TSecr=12331547 WS=128
  7   0.015027 172.31.8.238 -> 54.230.117.156 TCP 66 41304 > http [ACK] Seq=1 Ack=1 Win=27008 Len=0 TSval=12331547 TSecr=1686725416
  8   0.015067 172.31.8.238 -> 54.230.117.156 HTTP 162 GET /1kb HTTP/1.1 
  9   0.015537 54.230.117.156 -> 172.31.8.238 TCP 66 http > 41304 [ACK] Seq=1 Ack=97 Win=14592 Len=0 TSval=1686725416 TSecr=12331547
 10   0.017564 54.230.117.156 -> 172.31.8.238 HTTP 1544 HTTP/1.1 200 OK  (application/octet-stream)
 11   0.017571 172.31.8.238 -> 54.230.117.156 TCP 66 41304 > http [ACK] Seq=97 Ack=1479 Win=29952 Len=0 TSval=12331548 TSecr=1686725417
 12   0.017739 172.31.8.238 -> 54.230.117.156 TCP 66 41304 > http [FIN, ACK] Seq=97 Ack=1479 Win=29952 Len=0 TSval=12331548 TSecr=1686725417
 13   0.018536 54.230.117.156 -> 172.31.8.238 TCP 66 http > 41304 [FIN, ACK] Seq=1479 Ack=98 Win=14592 Len=0 TSval=1686725417 TSecr=12331548
 14   0.018544 172.31.8.238 -> 54.230.117.156 TCP 66 41304 > http [ACK] Seq=98 Ack=1480 Win=29952 Len=0 TSval=12331548 TSecr=1686725417
