[Measurement for 100kb at 03:34:00 20.34.2014] 
Tshark:

  1   0.000000 172.31.36.109 -> 172.31.0.2   DNS 89 Standard query 0x86b5  A d3m1c4hwkgedal.cloudfront.net
  2   0.000026 172.31.36.109 -> 172.31.0.2   DNS 89 Standard query 0x3e5a  AAAA d3m1c4hwkgedal.cloudfront.net
  3   0.000471   172.31.0.2 -> 172.31.36.109 DNS 217 Standard query response 0x86b5  A 54.230.30.210 A 54.230.30.221 A 54.230.30.249 A 54.192.30.188 A 54.192.30.216 A 54.192.30.218 A 54.230.30.37 A 54.230.30.73
  4   0.000482   172.31.0.2 -> 172.31.36.109 DNS 174 Standard query response 0x3e5a 
  5   0.003846 172.31.36.109 -> 54.230.30.210 TCP 74 51971 > http [SYN] Seq=0 Win=26883 Len=0 MSS=8961 SACK_PERM=1 TSval=29531678 TSecr=0 WS=128
  6   0.005238 54.230.30.210 -> 172.31.36.109 TCP 74 http > 51971 [SYN, ACK] Seq=0 Ack=1 Win=14480 Len=0 MSS=1460 SACK_PERM=1 TSval=831696846 TSecr=29531678 WS=128
  7   0.005252 172.31.36.109 -> 54.230.30.210 TCP 66 51971 > http [ACK] Seq=1 Ack=1 Win=27008 Len=0 TSval=29531678 TSecr=831696846
  8   0.005291 172.31.36.109 -> 54.230.30.210 HTTP 164 GET /100kb HTTP/1.1 
  9   0.006519 54.230.30.210 -> 172.31.36.109 TCP 66 http > 51971 [ACK] Seq=1 Ack=99 Win=14592 Len=0 TSval=831696846 TSecr=29531678
 10   0.042973 54.230.30.210 -> 172.31.36.109 TCP 13098 [TCP segment of a reassembled PDU]
 11   0.042985 172.31.36.109 -> 54.230.30.210 TCP 66 51971 > http [ACK] Seq=99 Ack=13033 Win=52992 Len=0 TSval=29531688 TSecr=831696850
 12   0.044241 54.230.30.210 -> 172.31.36.109 TCP 13098 [TCP segment of a reassembled PDU]
 13   0.044250 172.31.36.109 -> 54.230.30.210 TCP 66 51971 > http [ACK] Seq=99 Ack=26065 Win=79104 Len=0 TSval=29531688 TSecr=831696850
 14   0.045488 54.230.30.210 -> 172.31.36.109 TCP 13098 [TCP segment of a reassembled PDU]
 15   0.045497 172.31.36.109 -> 54.230.30.210 TCP 66 51971 > http [ACK] Seq=99 Ack=39097 Win=96512 Len=0 TSval=29531689 TSecr=831696850
 16   0.046749 54.230.30.210 -> 172.31.36.109 TCP 5858 [TCP segment of a reassembled PDU]
 17   0.046774 172.31.36.109 -> 54.230.30.210 TCP 66 51971 > http [ACK] Seq=99 Ack=44889 Win=108416 Len=0 TSval=29531689 TSecr=831696851
 18   0.046785 54.230.30.210 -> 172.31.36.109 TCP 7306 [TCP segment of a reassembled PDU]
 19   0.046790 172.31.36.109 -> 54.230.30.210 TCP 66 51971 > http [ACK] Seq=99 Ack=52129 Win=101248 Len=0 TSval=29531689 TSecr=831696851
 20   0.048103 54.230.30.210 -> 172.31.36.109 TCP 13098 [TCP segment of a reassembled PDU]
 21   0.048113 172.31.36.109 -> 54.230.30.210 TCP 66 51971 > http [ACK] Seq=99 Ack=65161 Win=135168 Len=0 TSval=29531689 TSecr=831696851
 22   0.048128 54.230.30.210 -> 172.31.36.109 TCP 8754 [TCP segment of a reassembled PDU]
 23   0.048137 172.31.36.109 -> 54.230.30.210 TCP 66 51971 > http [ACK] Seq=99 Ack=73849 Win=152448 Len=0 TSval=29531689 TSecr=831696851
 24   0.049083 54.230.30.210 -> 172.31.36.109 TCP 5858 [TCP segment of a reassembled PDU]
 25   0.049090 172.31.36.109 -> 54.230.30.210 TCP 66 51971 > http [ACK] Seq=99 Ack=79641 Win=164096 Len=0 TSval=29531689 TSecr=831696851
 26   0.049379 54.230.30.210 -> 172.31.36.109 TCP 8754 [TCP segment of a reassembled PDU]
 27   0.049387 172.31.36.109 -> 54.230.30.210 TCP 66 51971 > http [ACK] Seq=99 Ack=88329 Win=181504 Len=0 TSval=29531690 TSecr=831696851
 28   0.049516 54.230.30.210 -> 172.31.36.109 TCP 1514 [TCP segment of a reassembled PDU]
 29   0.049536 172.31.36.109 -> 54.230.30.210 TCP 66 51971 > http [ACK] Seq=99 Ack=89777 Win=184320 Len=0 TSval=29531690 TSecr=831696851
 30   0.049642 54.230.30.210 -> 172.31.36.109 TCP 8754 [TCP segment of a reassembled PDU]
 31   0.049649 172.31.36.109 -> 54.230.30.210 TCP 66 51971 > http [ACK] Seq=99 Ack=98465 Win=201728 Len=0 TSval=29531690 TSecr=831696851
 32   0.050577 54.230.30.210 -> 172.31.36.109 TCP 2962 [TCP segment of a reassembled PDU]
 33   0.050583 172.31.36.109 -> 54.230.30.210 TCP 66 51971 > http [ACK] Seq=99 Ack=101361 Win=207488 Len=0 TSval=29531690 TSecr=831696851
 34   0.050830 54.230.30.210 -> 172.31.36.109 HTTP 1562 HTTP/1.1 200 OK  (application/octet-stream)
 35   0.050848 172.31.36.109 -> 54.230.30.210 TCP 66 51971 > http [ACK] Seq=99 Ack=102857 Win=210560 Len=0 TSval=29531690 TSecr=831696851
 36   0.050967 172.31.36.109 -> 54.230.30.210 TCP 66 51971 > http [FIN, ACK] Seq=99 Ack=102857 Win=210560 Len=0 TSval=29531690 TSecr=831696851
 37   0.052094 54.230.30.210 -> 172.31.36.109 TCP 66 http > 51971 [FIN, ACK] Seq=102857 Ack=100 Win=14592 Len=0 TSval=831696851 TSecr=29531690
 38   0.052104 172.31.36.109 -> 54.230.30.210 TCP 66 51971 > http [ACK] Seq=100 Ack=102858 Win=210560 Len=0 TSval=29531690 TSecr=831696851
