[Measurement for 100kb at 04:33:55 20.33.2014] 
Tshark:

  1   0.000000 172.31.36.109 -> 172.31.0.2   DNS 89 Standard query 0xe41c  A d3m1c4hwkgedal.cloudfront.net
  2   0.000022 172.31.36.109 -> 172.31.0.2   DNS 89 Standard query 0xaa24  AAAA d3m1c4hwkgedal.cloudfront.net
  3   0.000536   172.31.0.2 -> 172.31.36.109 DNS 217 Standard query response 0xe41c  A 54.230.22.45 A 54.230.22.217 A 216.137.41.42 A 216.137.41.64 A 216.137.41.227 A 54.230.21.17 A 54.230.21.120 A 54.230.21.160
  4   0.000546   172.31.0.2 -> 172.31.36.109 DNS 174 Standard query response 0xaa24 
  5   0.003939 172.31.36.109 -> 54.230.22.45 TCP 74 41406 > http [SYN] Seq=0 Win=26883 Len=0 MSS=8961 SACK_PERM=1 TSval=30430520 TSecr=0 WS=128
  6   0.089829 54.230.22.45 -> 172.31.36.109 TCP 74 http > 41406 [SYN, ACK] Seq=0 Ack=1 Win=14480 Len=0 MSS=1460 SACK_PERM=1 TSval=909712169 TSecr=30430520 WS=128
  7   0.089865 172.31.36.109 -> 54.230.22.45 TCP 66 41406 > http [ACK] Seq=1 Ack=1 Win=27008 Len=0 TSval=30430542 TSecr=909712169
  8   0.089909 172.31.36.109 -> 54.230.22.45 HTTP 164 GET /100kb HTTP/1.1 
  9   0.176352 54.230.22.45 -> 172.31.36.109 TCP 66 http > 41406 [ACK] Seq=1 Ack=99 Win=14592 Len=0 TSval=909712178 TSecr=30430542
 10   0.181753 54.230.22.45 -> 172.31.36.109 TCP 13098 [TCP segment of a reassembled PDU]
 11   0.181767 172.31.36.109 -> 54.230.22.45 TCP 66 41406 > http [ACK] Seq=99 Ack=13033 Win=52992 Len=0 TSval=30430565 TSecr=909712178
 12   0.267744 54.230.22.45 -> 172.31.36.109 TCP 2962 [TCP segment of a reassembled PDU]
 13   0.267752 172.31.36.109 -> 54.230.22.45 TCP 66 41406 > http [ACK] Seq=99 Ack=15929 Win=58752 Len=0 TSval=30430586 TSecr=909712187
 14   0.267962 54.230.22.45 -> 172.31.36.109 TCP 10202 [TCP segment of a reassembled PDU]
 15   0.267970 172.31.36.109 -> 54.230.22.45 TCP 66 41406 > http [ACK] Seq=99 Ack=26065 Win=79104 Len=0 TSval=30430586 TSecr=909712187
 16   0.353543 54.230.22.45 -> 172.31.36.109 TCP 5858 [TCP segment of a reassembled PDU]
 17   0.353566 172.31.36.109 -> 54.230.22.45 TCP 66 41406 > http [ACK] Seq=99 Ack=31857 Win=90624 Len=0 TSval=30430608 TSecr=909712195
 18   0.353686 54.230.22.45 -> 172.31.36.109 TCP 1514 [TCP segment of a reassembled PDU]
 19   0.353690 172.31.36.109 -> 54.230.22.45 TCP 66 41406 > http [ACK] Seq=99 Ack=33305 Win=93568 Len=0 TSval=30430608 TSecr=909712195
 20   0.353760 54.230.22.45 -> 172.31.36.109 TCP 4410 [TCP segment of a reassembled PDU]
 21   0.353766 172.31.36.109 -> 54.230.22.45 TCP 66 41406 > http [ACK] Seq=99 Ack=37649 Win=102272 Len=0 TSval=30430608 TSecr=909712195
 22   0.353809 54.230.22.45 -> 172.31.36.109 TCP 1514 [TCP segment of a reassembled PDU]
 23   0.353813 172.31.36.109 -> 54.230.22.45 TCP 66 41406 > http [ACK] Seq=99 Ack=39097 Win=105088 Len=0 TSval=30430608 TSecr=909712195
 24   0.439877 54.230.22.45 -> 172.31.36.109 TCP 13098 [TCP segment of a reassembled PDU]
