[Measurement for 100kb at 00:33:56 20.33.2014] 
Tshark:

  1   0.000000 172.31.36.109 -> 172.31.0.2   DNS 89 Standard query 0x4d87  A d3m1c4hwkgedal.cloudfront.net
  2   0.000032 172.31.36.109 -> 172.31.0.2   DNS 89 Standard query 0x2f05  AAAA d3m1c4hwkgedal.cloudfront.net
  3   0.000459   172.31.0.2 -> 172.31.36.109 DNS 217 Standard query response 0x4d87  A 54.192.30.225 A 54.192.30.227 A 54.230.29.240 A 54.230.30.229 A 54.230.30.245 A 54.230.30.251 A 54.230.31.5 A 54.192.29.224
  4   0.000470   172.31.0.2 -> 172.31.36.109 DNS 174 Standard query response 0x2f05 
  5   0.003832 172.31.36.109 -> 54.192.30.225 TCP 74 46679 > http [SYN] Seq=0 Win=26883 Len=0 MSS=8961 SACK_PERM=1 TSval=26830842 TSecr=0 WS=128
  6   0.004928 54.192.30.225 -> 172.31.36.109 TCP 74 http > 46679 [SYN, ACK] Seq=0 Ack=1 Win=14480 Len=0 MSS=1460 SACK_PERM=1 TSval=688730143 TSecr=26830842 WS=128
  7   0.004942 172.31.36.109 -> 54.192.30.225 TCP 66 46679 > http [ACK] Seq=1 Ack=1 Win=27008 Len=0 TSval=26830843 TSecr=688730143
  8   0.004987 172.31.36.109 -> 54.192.30.225 HTTP 164 GET /100kb HTTP/1.1 
  9   0.006199 54.192.30.225 -> 172.31.36.109 TCP 66 http > 46679 [ACK] Seq=1 Ack=99 Win=14592 Len=0 TSval=688730143 TSecr=26830843
 10   0.227661 54.192.30.225 -> 172.31.36.109 TCP 13098 [TCP segment of a reassembled PDU]
 11   0.227673 172.31.36.109 -> 54.192.30.225 TCP 66 46679 > http [ACK] Seq=99 Ack=13033 Win=52992 Len=0 TSval=26830898 TSecr=688730165
 12   0.228891 54.192.30.225 -> 172.31.36.109 TCP 13098 [TCP segment of a reassembled PDU]
 13   0.228902 172.31.36.109 -> 54.192.30.225 TCP 66 46679 > http [ACK] Seq=99 Ack=26065 Win=79104 Len=0 TSval=26830899 TSecr=688730165
 14   0.230378 54.192.30.225 -> 172.31.36.109 TCP 4410 [TCP segment of a reassembled PDU]
 15   0.230385 172.31.36.109 -> 54.192.30.225 TCP 66 46679 > http [ACK] Seq=99 Ack=30409 Win=87808 Len=0 TSval=26830899 TSecr=688730165
 16   0.230442 54.192.30.225 -> 172.31.36.109 TCP 8754 [TCP segment of a reassembled PDU]
 17   0.230449 172.31.36.109 -> 54.192.30.225 TCP 66 46679 > http [ACK] Seq=99 Ack=39097 Win=103680 Len=0 TSval=26830899 TSecr=688730165
 18   0.231697 54.192.30.225 -> 172.31.36.109 TCP 5858 [TCP segment of a reassembled PDU]
 19   0.231703 172.31.36.109 -> 54.192.30.225 TCP 66 46679 > http [ACK] Seq=99 Ack=44889 Win=108416 Len=0 TSval=26830899 TSecr=688730165
 20   0.231714 54.192.30.225 -> 172.31.36.109 TCP 7306 [TCP segment of a reassembled PDU]
 21   0.231719 172.31.36.109 -> 54.192.30.225 TCP 66 46679 > http [ACK] Seq=99 Ack=52129 Win=101248 Len=0 TSval=26830899 TSecr=688730165
 22   0.231733 54.192.30.225 -> 172.31.36.109 TCP 7306 [TCP segment of a reassembled PDU]
 23   0.231738 172.31.36.109 -> 54.192.30.225 TCP 66 46679 > http [ACK] Seq=99 Ack=59369 Win=94080 Len=0 TSval=26830899 TSecr=688730165
 24   0.232827 54.192.30.225 -> 172.31.36.109 TCP 2962 [TCP segment of a reassembled PDU]
 25   0.232832 172.31.36.109 -> 54.192.30.225 TCP 66 46679 > http [ACK] Seq=99 Ack=62265 Win=109056 Len=0 TSval=26830900 TSecr=688730166
 26   0.232907 54.192.30.225 -> 172.31.36.109 TCP 8754 [TCP segment of a reassembled PDU]
 27   0.232914 172.31.36.109 -> 54.192.30.225 TCP 66 46679 > http [ACK] Seq=99 Ack=70953 Win=126464 Len=0 TSval=26830900 TSecr=688730166
 28   0.233136 54.192.30.225 -> 172.31.36.109 TCP 7306 [TCP segment of a reassembled PDU]
 29   0.233143 172.31.36.109 -> 54.192.30.225 TCP 66 46679 > http [ACK] Seq=99 Ack=78193 Win=140928 Len=0 TSval=26830900 TSecr=688730166
 30   0.234412 54.192.30.225 -> 172.31.36.109 TCP 1514 [TCP segment of a reassembled PDU]
 31   0.234417 172.31.36.109 -> 54.192.30.225 TCP 66 46679 > http [ACK] Seq=99 Ack=79641 Win=143872 Len=0 TSval=26830900 TSecr=688730166
 32   0.234623 54.192.30.225 -> 172.31.36.109 TCP 1514 [TCP segment of a reassembled PDU]
 33   0.234629 172.31.36.109 -> 54.192.30.225 TCP 66 46679 > http [ACK] Seq=99 Ack=81089 Win=146688 Len=0 TSval=26830900 TSecr=688730166
 34   0.234742 54.192.30.225 -> 172.31.36.109 TCP 17442 [TCP segment of a reassembled PDU]
 35   0.234762 172.31.36.109 -> 54.192.30.225 TCP 66 46679 > http [ACK] Seq=99 Ack=98465 Win=181504 Len=0 TSval=26830900 TSecr=688730166
 36   0.235677 54.192.30.225 -> 172.31.36.109 TCP 1514 [TCP segment of a reassembled PDU]
 37   0.235682 172.31.36.109 -> 54.192.30.225 TCP 66 46679 > http [ACK] Seq=99 Ack=99913 Win=184320 Len=0 TSval=26830900 TSecr=688730166
 38   0.235748 54.192.30.225 -> 172.31.36.109 HTTP 3010 HTTP/1.1 200 OK  (application/octet-stream)
 39   0.235754 172.31.36.109 -> 54.192.30.225 TCP 66 46679 > http [ACK] Seq=99 Ack=102857 Win=190208 Len=0 TSval=26830900 TSecr=688730166
 40   0.235866 172.31.36.109 -> 54.192.30.225 TCP 66 46679 > http [FIN, ACK] Seq=99 Ack=102857 Win=190208 Len=0 TSval=26830900 TSecr=688730166
 41   0.236955 54.192.30.225 -> 172.31.36.109 TCP 66 http > 46679 [FIN, ACK] Seq=102857 Ack=100 Win=14592 Len=0 TSval=688730166 TSecr=26830900
 42   0.236964 172.31.36.109 -> 54.192.30.225 TCP 66 46679 > http [ACK] Seq=100 Ack=102858 Win=190208 Len=0 TSval=26830901 TSecr=688730166
