[Measurement for 1kb at 07:35:40 20.35.2014] 
Tshark:

  1   0.000000 172.31.29.138 -> 172.31.0.2   DNS 89 Standard query 0x0e7e  A d3796nkzln59xv.cloudfront.net
  2   0.000027 172.31.29.138 -> 172.31.0.2   DNS 89 Standard query 0x15f3  AAAA d3796nkzln59xv.cloudfront.net
  3   0.000569   172.31.0.2 -> 172.31.29.138 DNS 217 Standard query response 0x0e7e  A 54.230.151.62 A 54.230.151.214 A 54.230.151.234 A 54.230.149.221 A 54.230.150.16 A 54.230.150.31 A 54.230.150.54 A 54.230.150.74
  4   0.003455   172.31.0.2 -> 172.31.29.138 DNS 170 Standard query response 0x15f3 
  5   0.003871 172.31.29.138 -> 54.230.151.62 TCP 74 35211 > http [SYN] Seq=0 Win=26883 Len=0 MSS=8961 SACK_PERM=1 TSval=13203305 TSecr=0 WS=128
  6   0.005448 54.230.151.62 -> 172.31.29.138 TCP 74 http > 35211 [SYN, ACK] Seq=0 Ack=1 Win=14480 Len=0 MSS=1460 SACK_PERM=1 TSval=445262886 TSecr=13203305 WS=128
  7   0.005472 172.31.29.138 -> 54.230.151.62 TCP 66 35211 > http [ACK] Seq=1 Ack=1 Win=27008 Len=0 TSval=13203305 TSecr=445262886
  8   0.005511 172.31.29.138 -> 54.230.151.62 HTTP 162 GET /1kb HTTP/1.1 
  9   0.006976 54.230.151.62 -> 172.31.29.138 TCP 66 http > 35211 [ACK] Seq=1 Ack=97 Win=14592 Len=0 TSval=445262886 TSecr=13203305
 10   0.008814 54.230.151.62 -> 172.31.29.138 HTTP 1544 HTTP/1.1 200 OK  (application/octet-stream)
 11   0.008822 172.31.29.138 -> 54.230.151.62 TCP 66 35211 > http [ACK] Seq=97 Ack=1479 Win=29952 Len=0 TSval=13203306 TSecr=445262886
 12   0.008963 172.31.29.138 -> 54.230.151.62 TCP 66 35211 > http [FIN, ACK] Seq=97 Ack=1479 Win=29952 Len=0 TSval=13203306 TSecr=445262886
 13   0.010536 54.230.151.62 -> 172.31.29.138 TCP 66 http > 35211 [FIN, ACK] Seq=1479 Ack=98 Win=14592 Len=0 TSval=445262886 TSecr=13203306
 14   0.010544 172.31.29.138 -> 54.230.151.62 TCP 66 35211 > http [ACK] Seq=98 Ack=1480 Win=29952 Len=0 TSval=13203307 TSecr=445262886
