[Measurement for 1kb at 01:35:39 20.35.2014] 
Tshark:

  1   0.000000 172.31.29.138 -> 172.31.0.2   DNS 89 Standard query 0x10a7  A d3796nkzln59xv.cloudfront.net
  2   0.000028 172.31.29.138 -> 172.31.0.2   DNS 89 Standard query 0x0b57  AAAA d3796nkzln59xv.cloudfront.net
  3   0.000507   172.31.0.2 -> 172.31.29.138 DNS 217 Standard query response 0x10a7  A 54.230.159.142 A 54.192.156.102 A 54.192.157.144 A 54.192.159.168 A 54.192.159.180 A 54.230.156.40 A 54.230.158.146 A 54.230.158.205
  4   0.004255   172.31.0.2 -> 172.31.29.138 DNS 170 Standard query response 0x0b57 
  5   0.011851 172.31.29.138 -> 54.230.159.142 TCP 74 58500 > http [SYN] Seq=0 Win=26883 Len=0 MSS=8961 SACK_PERM=1 TSval=7803090 TSecr=0 WS=128
  6   0.012359 54.230.159.142 -> 172.31.29.138 TCP 74 http > 58500 [SYN, ACK] Seq=0 Ack=1 Win=14480 Len=0 MSS=1460 SACK_PERM=1 TSval=809352346 TSecr=7803090 WS=128
  7   0.012373 172.31.29.138 -> 54.230.159.142 TCP 66 58500 > http [ACK] Seq=1 Ack=1 Win=27008 Len=0 TSval=7803090 TSecr=809352346
  8   0.012416 172.31.29.138 -> 54.230.159.142 HTTP 162 GET /1kb HTTP/1.1 
  9   0.012848 54.230.159.142 -> 172.31.29.138 TCP 66 http > 58500 [ACK] Seq=1 Ack=97 Win=14592 Len=0 TSval=809352346 TSecr=7803090
 10   0.014909 54.230.159.142 -> 172.31.29.138 HTTP 1544 HTTP/1.1 200 OK  (application/octet-stream)
 11   0.014916 172.31.29.138 -> 54.230.159.142 TCP 66 58500 > http [ACK] Seq=97 Ack=1479 Win=29952 Len=0 TSval=7803090 TSecr=809352346
 12   0.015097 172.31.29.138 -> 54.230.159.142 TCP 66 58500 > http [FIN, ACK] Seq=97 Ack=1479 Win=29952 Len=0 TSval=7803090 TSecr=809352346
 13   0.015643 54.230.159.142 -> 172.31.29.138 TCP 66 http > 58500 [FIN, ACK] Seq=1479 Ack=98 Win=14592 Len=0 TSval=809352346 TSecr=7803090
 14   0.015651 172.31.29.138 -> 54.230.159.142 TCP 66 58500 > http [ACK] Seq=98 Ack=1480 Win=29952 Len=0 TSval=7803090 TSecr=809352346
