[Measurement for 1kb at 22:35:39 19.35.2014] 
Tshark:

  1   0.000000 172.31.29.138 -> 172.31.0.2   DNS 89 Standard query 0x0f31  A d3796nkzln59xv.cloudfront.net
  2   0.000026 172.31.29.138 -> 172.31.0.2   DNS 89 Standard query 0x706f  AAAA d3796nkzln59xv.cloudfront.net
  3   0.000753   172.31.0.2 -> 172.31.29.138 DNS 217 Standard query response 0x0f31  A 54.230.156.193 A 54.230.157.230 A 54.230.158.246 A 54.230.159.4 A 54.230.159.153 A 54.192.156.109 A 54.192.157.144 A 54.192.159.173
  4   0.003599   172.31.0.2 -> 172.31.29.138 DNS 170 Standard query response 0x706f 
  5   0.003826 172.31.29.138 -> 54.230.156.193 TCP 74 38881 > http [SYN] Seq=0 Win=26883 Len=0 MSS=8961 SACK_PERM=1 TSval=5103183 TSecr=0 WS=128
  6   0.004639 54.230.156.193 -> 172.31.29.138 TCP 74 http > 38881 [SYN, ACK] Seq=0 Ack=1 Win=14480 Len=0 MSS=1460 SACK_PERM=1 TSval=808293977 TSecr=5103183 WS=128
  7   0.004654 172.31.29.138 -> 54.230.156.193 TCP 66 38881 > http [ACK] Seq=1 Ack=1 Win=27008 Len=0 TSval=5103184 TSecr=808293977
  8   0.004694 172.31.29.138 -> 54.230.156.193 HTTP 162 GET /1kb HTTP/1.1 
  9   0.005344 54.230.156.193 -> 172.31.29.138 TCP 66 http > 38881 [ACK] Seq=1 Ack=97 Win=14592 Len=0 TSval=808293978 TSecr=5103184
 10   0.007533 54.230.156.193 -> 172.31.29.138 HTTP 1544 HTTP/1.1 200 OK  (application/octet-stream)
 11   0.007542 172.31.29.138 -> 54.230.156.193 TCP 66 38881 > http [ACK] Seq=97 Ack=1479 Win=29952 Len=0 TSval=5103184 TSecr=808293978
 12   0.007726 172.31.29.138 -> 54.230.156.193 TCP 66 38881 > http [FIN, ACK] Seq=97 Ack=1479 Win=29952 Len=0 TSval=5103184 TSecr=808293978
 13   0.008515 54.230.156.193 -> 172.31.29.138 TCP 66 http > 38881 [FIN, ACK] Seq=1479 Ack=98 Win=14592 Len=0 TSval=808293978 TSecr=5103184
 14   0.008524 172.31.29.138 -> 54.230.156.193 TCP 66 38881 > http [ACK] Seq=98 Ack=1480 Win=29952 Len=0 TSval=5103185 TSecr=808293978
