[Measurement for 1kb at 09:35:39 20.35.2014] 
Tshark:

  1   0.000000 172.31.29.138 -> 172.31.0.2   DNS 89 Standard query 0x6876  A d3796nkzln59xv.cloudfront.net
  2   0.000026 172.31.29.138 -> 172.31.0.2   DNS 89 Standard query 0xf3db  AAAA d3796nkzln59xv.cloudfront.net
  3   0.000520   172.31.0.2 -> 172.31.29.138 DNS 217 Standard query response 0x6876  A 54.230.150.152 A 54.230.150.220 A 54.230.149.38 A 54.230.149.227 A 54.230.149.232 A 54.230.150.42 A 54.230.150.74 A 54.230.150.122
  4   0.004613   172.31.0.2 -> 172.31.29.138 DNS 170 Standard query response 0xf3db 
  5   0.012004 172.31.29.138 -> 54.230.150.152 TCP 74 47704 > http [SYN] Seq=0 Win=26883 Len=0 MSS=8961 SACK_PERM=1 TSval=15003162 TSecr=0 WS=128
  6   0.013392 54.230.150.152 -> 172.31.29.138 TCP 74 http > 47704 [SYN, ACK] Seq=0 Ack=1 Win=14480 Len=0 MSS=1460 SACK_PERM=1 TSval=1455509430 TSecr=15003162 WS=128
  7   0.013407 172.31.29.138 -> 54.230.150.152 TCP 66 47704 > http [ACK] Seq=1 Ack=1 Win=27008 Len=0 TSval=15003163 TSecr=1455509430
  8   0.013453 172.31.29.138 -> 54.230.150.152 HTTP 162 GET /1kb HTTP/1.1 
  9   0.014936 54.230.150.152 -> 172.31.29.138 TCP 66 http > 47704 [ACK] Seq=1 Ack=97 Win=14592 Len=0 TSval=1455509430 TSecr=15003163
 10   0.017564 54.230.150.152 -> 172.31.29.138 HTTP 1544 HTTP/1.1 200 OK  (application/octet-stream)
 11   0.017573 172.31.29.138 -> 54.230.150.152 TCP 66 47704 > http [ACK] Seq=97 Ack=1479 Win=29952 Len=0 TSval=15003164 TSecr=1455509430
 12   0.017759 172.31.29.138 -> 54.230.150.152 TCP 66 47704 > http [FIN, ACK] Seq=97 Ack=1479 Win=29952 Len=0 TSval=15003164 TSecr=1455509430
 13   0.019372 54.230.150.152 -> 172.31.29.138 TCP 66 http > 47704 [FIN, ACK] Seq=1479 Ack=98 Win=14592 Len=0 TSval=1455509431 TSecr=15003164
 14   0.019381 172.31.29.138 -> 54.230.150.152 TCP 66 47704 > http [ACK] Seq=98 Ack=1480 Win=29952 Len=0 TSval=15003164 TSecr=1455509431
