[Measurement for 1kb at 03:40:10 20.40.2014] 
Tshark:

  1   0.000000 06:b0:37:46:8f:13 -> 06:c7:b5:04:b8:d0 ARP 60 Who has 172.31.8.238?  Tell 172.31.0.1
  2   0.000020 06:c7:b5:04:b8:d0 -> 06:b0:37:46:8f:13 ARP 42 172.31.8.238 is at 06:c7:b5:04:b8:d0
  3   0.446790 172.31.8.238 -> 172.31.0.2   DNS 89 Standard query 0x5335  A d39wppo36gwqpx.cloudfront.net
  4   0.446831 172.31.8.238 -> 172.31.0.2   DNS 89 Standard query 0x6e6a  AAAA d39wppo36gwqpx.cloudfront.net
  5   0.447551   172.31.0.2 -> 172.31.8.238 DNS 217 Standard query response 0x5335  A 54.239.132.74 A 54.192.118.219 A 54.192.118.240 A 54.192.118.242 A 54.192.118.243 A 54.230.119.55 A 54.239.132.26 A 54.239.132.41
  6   0.453966   172.31.0.2 -> 172.31.8.238 DNS 170 Standard query response 0x6e6a 
  7   0.458824 172.31.8.238 -> 54.239.132.74 TCP 74 60229 > http [SYN] Seq=0 Win=26883 Len=0 MSS=8961 SACK_PERM=1 TSval=9609613 TSecr=0 WS=128
  8   0.459548 54.239.132.74 -> 172.31.8.238 TCP 74 http > 60229 [SYN, ACK] Seq=0 Ack=1 Win=14480 Len=0 MSS=1460 SACK_PERM=1 TSval=1684396134 TSecr=9609613 WS=128
  9   0.459562 172.31.8.238 -> 54.239.132.74 TCP 66 60229 > http [ACK] Seq=1 Ack=1 Win=27008 Len=0 TSval=9609613 TSecr=1684396134
 10   0.459612 172.31.8.238 -> 54.239.132.74 HTTP 162 GET /1kb HTTP/1.1 
 11   0.460313 54.239.132.74 -> 172.31.8.238 TCP 66 http > 60229 [ACK] Seq=1 Ack=97 Win=14592 Len=0 TSval=1684396134 TSecr=9609613
 12   0.462105 54.239.132.74 -> 172.31.8.238 HTTP 1544 HTTP/1.1 200 OK  (application/octet-stream)
 13   0.462113 172.31.8.238 -> 54.239.132.74 TCP 66 60229 > http [ACK] Seq=97 Ack=1479 Win=29952 Len=0 TSval=9609614 TSecr=1684396134
 14   0.462271 172.31.8.238 -> 54.239.132.74 TCP 66 60229 > http [FIN, ACK] Seq=97 Ack=1479 Win=29952 Len=0 TSval=9609614 TSecr=1684396134
 15   0.462865 54.239.132.74 -> 172.31.8.238 TCP 66 http > 60229 [FIN, ACK] Seq=1479 Ack=98 Win=14592 Len=0 TSval=1684396134 TSecr=9609614
 16   0.462874 172.31.8.238 -> 54.239.132.74 TCP 66 60229 > http [ACK] Seq=98 Ack=1480 Win=29952 Len=0 TSval=9609614 TSecr=1684396134
