[Measurement for 1kb at 12:40:10 20.40.2014] 
Tshark:

  1   0.000000 172.31.8.238 -> 172.31.0.2   DNS 89 Standard query 0x92e5  A d39wppo36gwqpx.cloudfront.net
  2   0.000025 172.31.8.238 -> 172.31.0.2   DNS 89 Standard query 0x7caf  AAAA d39wppo36gwqpx.cloudfront.net
  3   0.000636   172.31.0.2 -> 172.31.8.238 DNS 217 Standard query response 0x92e5  A 54.230.116.136 A 54.230.116.167 A 54.230.117.69 A 54.230.117.152 A 54.230.118.114 A 54.230.119.94 A 54.239.132.103 A 54.192.118.219
  4   0.006042   172.31.0.2 -> 172.31.8.238 DNS 170 Standard query response 0x7caf 
  5   0.012017 172.31.8.238 -> 54.230.116.136 TCP 74 34927 > http [SYN] Seq=0 Win=26883 Len=0 MSS=8961 SACK_PERM=1 TSval=17709671 TSecr=0 WS=128
  6   0.012827 54.230.116.136 -> 172.31.8.238 TCP 74 http > 34927 [SYN, ACK] Seq=0 Ack=1 Win=14480 Len=0 MSS=1460 SACK_PERM=1 TSval=1686869597 TSecr=17709671 WS=128
  7   0.012842 172.31.8.238 -> 54.230.116.136 TCP 66 34927 > http [ACK] Seq=1 Ack=1 Win=27008 Len=0 TSval=17709671 TSecr=1686869597
  8   0.012906 172.31.8.238 -> 54.230.116.136 HTTP 162 GET /1kb HTTP/1.1 
  9   0.013547 54.230.116.136 -> 172.31.8.238 TCP 66 http > 34927 [ACK] Seq=1 Ack=97 Win=14592 Len=0 TSval=1686869597 TSecr=17709671
 10   0.015589 54.230.116.136 -> 172.31.8.238 HTTP 1544 HTTP/1.1 200 OK  (application/octet-stream)
 11   0.015596 172.31.8.238 -> 54.230.116.136 TCP 66 34927 > http [ACK] Seq=97 Ack=1479 Win=29952 Len=0 TSval=17709672 TSecr=1686869597
 12   0.015739 172.31.8.238 -> 54.230.116.136 TCP 66 34927 > http [FIN, ACK] Seq=97 Ack=1479 Win=29952 Len=0 TSval=17709672 TSecr=1686869597
 13   0.016314 54.230.116.136 -> 172.31.8.238 TCP 66 http > 34927 [FIN, ACK] Seq=1479 Ack=98 Win=14592 Len=0 TSval=1686869597 TSecr=17709672
 14   0.016322 172.31.8.238 -> 54.230.116.136 TCP 66 34927 > http [ACK] Seq=98 Ack=1480 Win=29952 Len=0 TSval=17709672 TSecr=1686869597
