[Measurement for 1kb at 08:37:07 20.37.2014] 
Tshark:

  1   0.000000 172.31.29.138 -> 172.31.0.2   DNS 89 Standard query 0x75b4  A d1xzxs93r3iphc.cloudfront.net
  2   0.000038 172.31.29.138 -> 172.31.0.2   DNS 89 Standard query 0x305b  AAAA d1xzxs93r3iphc.cloudfront.net
  3   0.000593   172.31.0.2 -> 172.31.29.138 DNS 217 Standard query response 0x75b4  A 54.230.151.252 A 54.230.149.156 A 54.230.149.229 A 54.230.149.232 A 54.230.150.27 A 54.230.150.38 A 54.230.150.47 A 54.230.150.159
  4   0.004045   172.31.0.2 -> 172.31.29.138 DNS 170 Standard query response 0x305b 
  5   0.011996 172.31.29.138 -> 54.230.151.252 TCP 74 60509 > http [SYN] Seq=0 Win=26883 Len=0 MSS=8961 SACK_PERM=1 TSval=14125115 TSecr=0 WS=128
  6   0.013347 54.230.151.252 -> 172.31.29.138 TCP 74 http > 60509 [SYN, ACK] Seq=0 Ack=1 Win=14480 Len=0 MSS=1460 SACK_PERM=1 TSval=1454826507 TSecr=14125115 WS=128
  7   0.013361 172.31.29.138 -> 54.230.151.252 TCP 66 60509 > http [ACK] Seq=1 Ack=1 Win=27008 Len=0 TSval=14125115 TSecr=1454826507
  8   0.013405 172.31.29.138 -> 54.230.151.252 HTTP 162 GET /1kb HTTP/1.1 
  9   0.014652 54.230.151.252 -> 172.31.29.138 TCP 66 http > 60509 [ACK] Seq=1 Ack=97 Win=14592 Len=0 TSval=1454826507 TSecr=14125115
 10   0.016140 54.230.151.252 -> 172.31.29.138 HTTP 1544 HTTP/1.1 200 OK  (application/octet-stream)
 11   0.016148 172.31.29.138 -> 54.230.151.252 TCP 66 60509 > http [ACK] Seq=97 Ack=1479 Win=29952 Len=0 TSval=14125116 TSecr=1454826507
 12   0.016296 172.31.29.138 -> 54.230.151.252 TCP 66 60509 > http [FIN, ACK] Seq=97 Ack=1479 Win=29952 Len=0 TSval=14125116 TSecr=1454826507
 13   0.017728 54.230.151.252 -> 172.31.29.138 TCP 66 http > 60509 [FIN, ACK] Seq=1479 Ack=98 Win=14592 Len=0 TSval=1454826507 TSecr=14125116
 14   0.017737 172.31.29.138 -> 54.230.151.252 TCP 66 60509 > http [ACK] Seq=98 Ack=1480 Win=29952 Len=0 TSval=14125116 TSecr=1454826507
