[Measurement for 1kb at 00:37:07 20.37.2014] 
Tshark:

  1   0.000000 172.31.29.138 -> 172.31.0.2   DNS 89 Standard query 0xda0f  A d1xzxs93r3iphc.cloudfront.net
  2   0.000023 172.31.29.138 -> 172.31.0.2   DNS 89 Standard query 0x6a26  AAAA d1xzxs93r3iphc.cloudfront.net
  3   0.000628   172.31.0.2 -> 172.31.29.138 DNS 217 Standard query response 0xda0f  A 54.230.150.74 A 54.230.151.219 A 54.230.149.221 A 54.230.150.31 A 54.230.150.45 A 54.230.150.57 A 54.230.150.65 A 54.230.150.69
  4   0.003811   172.31.0.2 -> 172.31.29.138 DNS 170 Standard query response 0x6a26 
  5   0.006040 172.31.29.138 -> 54.230.150.74 TCP 74 38846 > http [SYN] Seq=0 Win=26883 Len=0 MSS=8961 SACK_PERM=1 TSval=6925123 TSecr=0 WS=128
  6   0.007580 54.230.150.74 -> 172.31.29.138 TCP 74 http > 38846 [SYN, ACK] Seq=0 Ack=1 Win=14480 Len=0 MSS=1460 SACK_PERM=1 TSval=1452256197 TSecr=6925123 WS=128
  7   0.007603 172.31.29.138 -> 54.230.150.74 TCP 66 38846 > http [ACK] Seq=1 Ack=1 Win=27008 Len=0 TSval=6925123 TSecr=1452256197
  8   0.007636 172.31.29.138 -> 54.230.150.74 HTTP 162 GET /1kb HTTP/1.1 
  9   0.009264 54.230.150.74 -> 172.31.29.138 TCP 66 http > 38846 [ACK] Seq=1 Ack=97 Win=14592 Len=0 TSval=1452256198 TSecr=6925123
 10   0.011379 54.230.150.74 -> 172.31.29.138 HTTP 1543 HTTP/1.1 200 OK  (application/octet-stream)
 11   0.011388 172.31.29.138 -> 54.230.150.74 TCP 66 38846 > http [ACK] Seq=97 Ack=1478 Win=29952 Len=0 TSval=6925124 TSecr=1452256198
 12   0.011533 172.31.29.138 -> 54.230.150.74 TCP 66 38846 > http [FIN, ACK] Seq=97 Ack=1478 Win=29952 Len=0 TSval=6925124 TSecr=1452256198
 13   0.012840 54.230.150.74 -> 172.31.29.138 TCP 66 http > 38846 [FIN, ACK] Seq=1478 Ack=98 Win=14592 Len=0 TSval=1452256198 TSecr=6925124
 14   0.012847 172.31.29.138 -> 54.230.150.74 TCP 66 38846 > http [ACK] Seq=98 Ack=1479 Win=29952 Len=0 TSval=6925125 TSecr=1452256198
