[Measurement for 1kb at 17:38:44 19.38.2014] 
Tshark:

  1   0.000000 172.31.29.138 -> 172.31.0.2   DNS 89 Standard query 0xc699  A d1xzxs93r3iphc.cloudfront.net
  2   0.000037 172.31.29.138 -> 172.31.0.2   DNS 89 Standard query 0xfc4d  AAAA d1xzxs93r3iphc.cloudfront.net
  3   0.000702   172.31.0.2 -> 172.31.29.138 DNS 217 Standard query response 0xc699  A 54.230.159.6 A 54.240.168.128 A 54.192.156.101 A 54.192.156.110 A 54.192.159.78 A 54.192.159.157 A 54.230.156.193 A 54.230.158.80
  4   0.004058   172.31.0.2 -> 172.31.29.138 DNS 170 Standard query response 0xfc4d 
  5   0.012032 172.31.29.138 -> 54.230.159.6 TCP 74 46643 > http [SYN] Seq=0 Win=26883 Len=0 MSS=8961 SACK_PERM=1 TSval=649296 TSecr=0 WS=128
  6   0.012863 54.230.159.6 -> 172.31.29.138 TCP 74 http > 46643 [SYN, ACK] Seq=0 Ack=1 Win=14480 Len=0 MSS=1460 SACK_PERM=1 TSval=829618407 TSecr=649296 WS=128
  7   0.012877 172.31.29.138 -> 54.230.159.6 TCP 66 46643 > http [ACK] Seq=1 Ack=1 Win=27008 Len=0 TSval=649296 TSecr=829618407
  8   0.012924 172.31.29.138 -> 54.230.159.6 HTTP 162 GET /1kb HTTP/1.1 
  9   0.013551 54.230.159.6 -> 172.31.29.138 TCP 66 http > 46643 [ACK] Seq=1 Ack=97 Win=14592 Len=0 TSval=829618407 TSecr=649296
 10   0.262410 54.230.159.6 -> 172.31.29.138 HTTP 1533 HTTP/1.1 200 OK  (application/octet-stream)
 11   0.262432 172.31.29.138 -> 54.230.159.6 TCP 66 46643 > http [ACK] Seq=97 Ack=1468 Win=29824 Len=0 TSval=649358 TSecr=829618432
 12   0.262635 172.31.29.138 -> 54.230.159.6 TCP 66 46643 > http [FIN, ACK] Seq=97 Ack=1468 Win=29824 Len=0 TSval=649358 TSecr=829618432
 13   0.263139 54.230.159.6 -> 172.31.29.138 TCP 66 http > 46643 [FIN, ACK] Seq=1468 Ack=98 Win=14592 Len=0 TSval=829618432 TSecr=649358
 14   0.263158 172.31.29.138 -> 54.230.159.6 TCP 66 46643 > http [ACK] Seq=98 Ack=1469 Win=29824 Len=0 TSval=649358 TSecr=829618432
