[Measurement for 1kb at 14:37:08 20.37.2014] 
Tshark:

  1   0.000000 86.50.146.105 -> 172.31.29.138 TCP 78 53852 > ssh [ACK] Seq=1 Ack=1 Win=5322 Len=0 TSval=17963264 TSecr=19524804 SLE=2737 SRE=3085
  2   0.000023 86.50.146.105 -> 172.31.29.138 TCP 78 53852 > ssh [ACK] Seq=1 Ack=1369 Win=5322 Len=0 TSval=17963264 TSecr=19524804 SLE=2737 SRE=3085
  3   0.000026 86.50.146.105 -> 172.31.29.138 TCP 66 53852 > ssh [ACK] Seq=1 Ack=3085 Win=5322 Len=0 TSval=17963264 TSecr=19524804
  4   0.000034 86.50.146.105 -> 172.31.29.138 SSH 102 Encrypted request packet len=36
  5   0.000166 172.31.29.138 -> 86.50.146.105 SSH 134 Encrypted response packet len=68
  6   0.370113 86.50.146.105 -> 172.31.29.138 SSH 102 Encrypted request packet len=36
  7   0.370311 172.31.29.138 -> 86.50.146.105 SSH 2802 Encrypted response packet len=2736
  8   0.370323 172.31.29.138 -> 86.50.146.105 SSH 1434 Encrypted response packet len=1368
  9   0.370325 172.31.29.138 -> 86.50.146.105 SSH 654 Encrypted response packet len=588
 10   0.746605 86.50.146.105 -> 172.31.29.138 TCP 66 53852 > ssh [ACK] Seq=73 Ack=5889 Win=5322 Len=0 TSval=17963452 TSecr=19524991
 11   0.746739 86.50.146.105 -> 172.31.29.138 TCP 78 [TCP Dup ACK 10#1] 53852 > ssh [ACK] Seq=73 Ack=5889 Win=5322 Len=0 TSval=17963452 TSecr=19524991 SLE=7257 SRE=7845
 12   0.746759 86.50.146.105 -> 172.31.29.138 TCP 66 53852 > ssh [ACK] Seq=73 Ack=7845 Win=5322 Len=0 TSval=17963452 TSecr=19524991
 13   0.746784 86.50.146.105 -> 172.31.29.138 SSH 102 Encrypted request packet len=36
 14   0.746892 172.31.29.138 -> 86.50.146.105 SSH 134 Encrypted response packet len=68
 15   1.118580 86.50.146.105 -> 172.31.29.138 SSH 102 Encrypted request packet len=36
 16   1.118731 172.31.29.138 -> 86.50.146.105 SSH 2802 Encrypted response packet len=2736
 17   1.118742 172.31.29.138 -> 86.50.146.105 SSH 2802 Encrypted response packet len=2736
 18   1.118746 172.31.29.138 -> 86.50.146.105 SSH 166 Encrypted response packet len=100
 19   1.488689 86.50.146.105 -> 172.31.29.138 TCP 66 53852 > ssh [ACK] Seq=145 Ack=10649 Win=5322 Len=0 TSval=17963637 TSecr=19525178
 20   1.488792 86.50.146.105 -> 172.31.29.138 TCP 78 [TCP Dup ACK 19#1] 53852 > ssh [ACK] Seq=145 Ack=10649 Win=5322 Len=0 TSval=17963638 TSecr=19525178 SLE=13385 SRE=13485
 21   1.488813 86.50.146.105 -> 172.31.29.138 TCP 78 53852 > ssh [ACK] Seq=145 Ack=12017 Win=5322 Len=0 TSval=17963638 TSecr=19525178 SLE=13385 SRE=13485
 22   1.489044 86.50.146.105 -> 172.31.29.138 TCP 66 53852 > ssh [ACK] Seq=145 Ack=13485 Win=5322 Len=0 TSval=17963638 TSecr=19525178
 23   1.489300 86.50.146.105 -> 172.31.29.138 SSH 102 Encrypted request packet len=36
 24   1.489395 172.31.29.138 -> 86.50.146.105 SSH 134 Encrypted response packet len=68
 25   1.538726 172.31.29.138 -> 172.31.0.2   DNS 89 Standard query 0x8b55  A d1xzxs93r3iphc.cloudfront.net
 26   1.538740 172.31.29.138 -> 172.31.0.2   DNS 89 Standard query 0xec8a  AAAA d1xzxs93r3iphc.cloudfront.net
 27   1.539292   172.31.0.2 -> 172.31.29.138 DNS 217 Standard query response 0x8b55  A 54.192.157.139 A 54.230.158.107 A 54.230.158.142 A 54.230.158.182 A 54.230.158.204 A 54.230.158.217 A 54.230.158.223 A 54.230.158.246
 28   1.543680   172.31.0.2 -> 172.31.29.138 DNS 170 Standard query response 0xec8a 
 29   1.545880 172.31.29.138 -> 54.192.157.139 TCP 74 53896 > http [SYN] Seq=0 Win=26883 Len=0 MSS=8961 SACK_PERM=1 TSval=19525285 TSecr=0 WS=128
 30   1.546672 54.192.157.139 -> 172.31.29.138 TCP 74 http > 53896 [SYN, ACK] Seq=0 Ack=1 Win=14480 Len=0 MSS=1460 SACK_PERM=1 TSval=811945862 TSecr=19525285 WS=128
 31   1.546683 172.31.29.138 -> 54.192.157.139 TCP 66 53896 > http [ACK] Seq=1 Ack=1 Win=27008 Len=0 TSval=19525285 TSecr=811945862
 32   1.546721 172.31.29.138 -> 54.192.157.139 HTTP 162 GET /1kb HTTP/1.1 
 33   1.547413 54.192.157.139 -> 172.31.29.138 TCP 66 http > 53896 [ACK] Seq=1 Ack=97 Win=14592 Len=0 TSval=811945862 TSecr=19525285
 34   1.550283 54.192.157.139 -> 172.31.29.138 HTTP 1544 HTTP/1.1 200 OK  (application/octet-stream)
 35   1.550289 172.31.29.138 -> 54.192.157.139 TCP 66 53896 > http [ACK] Seq=97 Ack=1479 Win=29952 Len=0 TSval=19525286 TSecr=811945862
 36   1.550428 172.31.29.138 -> 54.192.157.139 TCP 66 53896 > http [FIN, ACK] Seq=97 Ack=1479 Win=29952 Len=0 TSval=19525286 TSecr=811945862
 37   1.550988 54.192.157.139 -> 172.31.29.138 TCP 66 http > 53896 [FIN, ACK] Seq=1479 Ack=98 Win=14592 Len=0 TSval=811945862 TSecr=19525286
 38   1.550996 172.31.29.138 -> 54.192.157.139 TCP 66 53896 > http [ACK] Seq=98 Ack=1480 Win=29952 Len=0 TSval=19525287 TSecr=811945862
 39   1.856690 86.50.146.105 -> 172.31.29.138 SSH 102 Encrypted request packet len=36
 40   1.856831 172.31.29.138 -> 86.50.146.105 SSH 470 Encrypted response packet len=404
 41   2.223660 86.50.146.105 -> 172.31.29.138 SSH 102 Encrypted request packet len=36
 42   2.223798 172.31.29.138 -> 86.50.146.105 SSH 134 Encrypted response packet len=68
 43   2.589635 86.50.146.105 -> 172.31.29.138 SSH 102 Encrypted request packet len=36
