[Measurement for 1kb at 22:37:08 19.37.2014] 
Tshark:

  1   0.000000 172.31.29.138 -> 172.31.0.2   DNS 89 Standard query 0x7ade  A d1xzxs93r3iphc.cloudfront.net
  2   0.000029 172.31.29.138 -> 172.31.0.2   DNS 89 Standard query 0x28cb  AAAA d1xzxs93r3iphc.cloudfront.net
  3   0.000504   172.31.0.2 -> 172.31.29.138 DNS 217 Standard query response 0x7ade  A 54.230.150.63 A 54.230.150.65 A 54.230.150.114 A 54.230.150.122 A 54.230.149.156 A 54.230.150.10 A 54.230.150.34 A 54.230.150.36
  4   0.061559   172.31.0.2 -> 172.31.29.138 DNS 170 Standard query response 0x28cb 
  5   0.124425 172.31.29.138 -> 54.230.150.63 TCP 74 48965 > http [SYN] Seq=0 Win=26883 Len=0 MSS=8961 SACK_PERM=1 TSval=5125228 TSecr=0 WS=128
  6   0.125668 54.230.150.63 -> 172.31.29.138 TCP 74 http > 48965 [SYN, ACK] Seq=0 Ack=1 Win=14480 Len=0 MSS=1460 SACK_PERM=1 TSval=441948935 TSecr=5125228 WS=128
  7   0.125684 172.31.29.138 -> 54.230.150.63 TCP 66 48965 > http [ACK] Seq=1 Ack=1 Win=27008 Len=0 TSval=5125229 TSecr=441948935
  8   0.125735 172.31.29.138 -> 54.230.150.63 HTTP 162 GET /1kb HTTP/1.1 
  9   0.126953 54.230.150.63 -> 172.31.29.138 TCP 66 http > 48965 [ACK] Seq=1 Ack=97 Win=14592 Len=0 TSval=441948935 TSecr=5125229
 10   0.409172 54.230.150.63 -> 172.31.29.138 HTTP 1533 HTTP/1.1 200 OK  (application/octet-stream)
 11   0.409200 172.31.29.138 -> 54.230.150.63 TCP 66 48965 > http [ACK] Seq=97 Ack=1468 Win=29824 Len=0 TSval=5125299 TSecr=441948964
 12   0.409431 172.31.29.138 -> 54.230.150.63 TCP 66 48965 > http [FIN, ACK] Seq=97 Ack=1468 Win=29824 Len=0 TSval=5125299 TSecr=441948964
 13   0.410841 54.230.150.63 -> 172.31.29.138 TCP 66 http > 48965 [FIN, ACK] Seq=1468 Ack=98 Win=14592 Len=0 TSval=441948964 TSecr=5125299
 14   0.410851 172.31.29.138 -> 54.230.150.63 TCP 66 48965 > http [ACK] Seq=98 Ack=1469 Win=29824 Len=0 TSval=5125300 TSecr=441948964
