[Measurement for 1mb at 05:36:51 20.36.2014] 
Tshark:

  1   0.000000 172.31.29.138 -> 172.31.0.2   DNS 89 Standard query 0x4a45  A d1dx94olpiqj0t.cloudfront.net
  2   0.000025 172.31.29.138 -> 172.31.0.2   DNS 89 Standard query 0x7786  AAAA d1dx94olpiqj0t.cloudfront.net
  3   0.000571   172.31.0.2 -> 172.31.29.138 DNS 176 Standard query response 0x7786 
  4   0.000581   172.31.0.2 -> 172.31.29.138 DNS 217 Standard query response 0x4a45  A 54.230.150.42 A 54.230.150.65 A 54.230.150.109 A 54.230.150.114 A 54.230.151.182 A 54.230.151.234 A 54.230.150.12 A 54.230.150.15
  5   0.003855 172.31.29.138 -> 54.230.150.42 TCP 74 39427 > http [SYN] Seq=0 Win=26883 Len=0 MSS=8961 SACK_PERM=1 TSval=11421051 TSecr=0 WS=128
  6   0.005280 54.230.150.42 -> 172.31.29.138 TCP 74 http > 39427 [SYN, ACK] Seq=0 Ack=1 Win=14480 Len=0 MSS=1460 SACK_PERM=1 TSval=1454649483 TSecr=11421051 WS=128
  7   0.005317 172.31.29.138 -> 54.230.150.42 TCP 66 39427 > http [ACK] Seq=1 Ack=1 Win=27008 Len=0 TSval=11421052 TSecr=1454649483
  8   0.005358 172.31.29.138 -> 54.230.150.42 HTTP 162 GET /1mb HTTP/1.1 
  9   0.006769 54.230.150.42 -> 172.31.29.138 TCP 66 http > 39427 [ACK] Seq=1 Ack=97 Win=14592 Len=0 TSval=1454649483 TSecr=11421052
 10   0.008962 54.230.150.42 -> 172.31.29.138 TCP 523 [TCP segment of a reassembled PDU]
 11   0.008968 172.31.29.138 -> 54.230.150.42 TCP 66 39427 > http [ACK] Seq=97 Ack=458 Win=28032 Len=0 TSval=11421053 TSecr=1454649483
 12   0.008990 54.230.150.42 -> 172.31.29.138 TCP 13098 [TCP segment of a reassembled PDU]
 13   0.008998 172.31.29.138 -> 54.230.150.42 TCP 66 39427 > http [ACK] Seq=97 Ack=13490 Win=54144 Len=0 TSval=11421053 TSecr=1454649483
 14   0.010382 54.230.150.42 -> 172.31.29.138 TCP 2962 [TCP segment of a reassembled PDU]
 15   0.010388 172.31.29.138 -> 54.230.150.42 TCP 66 39427 > http [ACK] Seq=97 Ack=16386 Win=59904 Len=0 TSval=11421053 TSecr=1454649483
 16   0.010400 54.230.150.42 -> 172.31.29.138 TCP 10202 [TCP segment of a reassembled PDU]
 17   0.010406 172.31.29.138 -> 54.230.150.42 TCP 66 39427 > http [ACK] Seq=97 Ack=26522 Win=80128 Len=0 TSval=11421053 TSecr=1454649483
 18   0.011662 54.230.150.42 -> 172.31.29.138 TCP 4410 [TCP segment of a reassembled PDU]
 19   0.011669 172.31.29.138 -> 54.230.150.42 TCP 66 39427 > http [ACK] Seq=97 Ack=30866 Win=88832 Len=0 TSval=11421053 TSecr=1454649483
 20   0.011702 54.230.150.42 -> 172.31.29.138 TCP 4410 [TCP segment of a reassembled PDU]
 21   0.011707 172.31.29.138 -> 54.230.150.42 TCP 66 39427 > http [ACK] Seq=97 Ack=35210 Win=97536 Len=0 TSval=11421053 TSecr=1454649483
 22   0.011912 54.230.150.42 -> 172.31.29.138 TCP 4410 [TCP segment of a reassembled PDU]
 23   0.011918 172.31.29.138 -> 54.230.150.42 TCP 66 39427 > http [ACK] Seq=97 Ack=39554 Win=106240 Len=0 TSval=11421053 TSecr=1454649483
 24   0.011959 54.230.150.42 -> 172.31.29.138 TCP 7306 [TCP segment of a reassembled PDU]
 25   0.011965 172.31.29.138 -> 54.230.150.42 TCP 66 39427 > http [ACK] Seq=97 Ack=46794 Win=105984 Len=0 TSval=11421053 TSecr=1454649483
 26   0.012970 54.230.150.42 -> 172.31.29.138 TCP 5858 [TCP segment of a reassembled PDU]
 27   0.012976 172.31.29.138 -> 54.230.150.42 TCP 66 39427 > http [ACK] Seq=97 Ack=52586 Win=108416 Len=0 TSval=11421054 TSecr=1454649483
 28   0.013222 54.230.150.42 -> 172.31.29.138 TCP 11650 [TCP segment of a reassembled PDU]
 29   0.013250 172.31.29.138 -> 54.230.150.42 TCP 66 39427 > http [ACK] Seq=97 Ack=64170 Win=132224 Len=0 TSval=11421054 TSecr=1454649483
 30   0.013463 54.230.150.42 -> 172.31.29.138 TCP 1514 [TCP segment of a reassembled PDU]
 31   0.013467 172.31.29.138 -> 54.230.150.42 TCP 66 39427 > http [ACK] Seq=97 Ack=65618 Win=135168 Len=0 TSval=11421054 TSecr=1454649483
 32   0.014499 54.230.150.42 -> 172.31.29.138 TCP 13098 [TCP segment of a reassembled PDU]
 33   0.014507 172.31.29.138 -> 54.230.150.42 TCP 66 39427 > http [ACK] Seq=97 Ack=78650 Win=161152 Len=0 TSval=11421054 TSecr=1454649484
 34   0.014717 54.230.150.42 -> 172.31.29.138 TCP 10202 [TCP segment of a reassembled PDU]
 35   0.014725 172.31.29.138 -> 54.230.150.42 TCP 66 39427 > http [ACK] Seq=97 Ack=88786 Win=181504 Len=0 TSval=11421054 TSecr=1454649484
 36   0.014780 54.230.150.42 -> 172.31.29.138 TCP 2962 [TCP segment of a reassembled PDU]
 37   0.014785 172.31.29.138 -> 54.230.150.42 TCP 66 39427 > http [ACK] Seq=97 Ack=91682 Win=187264 Len=0 TSval=11421054 TSecr=1454649484
 38   0.016054 54.230.150.42 -> 172.31.29.138 TCP 15994 [TCP segment of a reassembled PDU]
 39   0.016064 172.31.29.138 -> 54.230.150.42 TCP 66 39427 > http [ACK] Seq=97 Ack=107610 Win=219136 Len=0 TSval=11421054 TSecr=1454649484
 40   0.016091 54.230.150.42 -> 172.31.29.138 TCP 10202 [TCP segment of a reassembled PDU]
 41   0.016107 172.31.29.138 -> 54.230.150.42 TCP 66 39427 > http [ACK] Seq=97 Ack=117746 Win=239360 Len=0 TSval=11421054 TSecr=1454649484
 42   0.017562 54.230.150.42 -> 172.31.29.138 TCP 11650 [TCP segment of a reassembled PDU]
 43   0.017571 172.31.29.138 -> 54.230.150.42 TCP 66 39427 > http [ACK] Seq=97 Ack=129330 Win=262528 Len=0 TSval=11421055 TSecr=1454649484
 44   0.017653 54.230.150.42 -> 172.31.29.138 TCP 14546 [TCP segment of a reassembled PDU]
 45   0.017662 172.31.29.138 -> 54.230.150.42 TCP 66 39427 > http [ACK] Seq=97 Ack=143810 Win=291456 Len=0 TSval=11421055 TSecr=1454649484
 46   0.019160 54.230.150.42 -> 172.31.29.138 TCP 17442 [TCP segment of a reassembled PDU]
 47   0.019184 172.31.29.138 -> 54.230.150.42 TCP 66 39427 > http [ACK] Seq=97 Ack=161186 Win=326272 Len=0 TSval=11421055 TSecr=1454649484
 48   0.019327 54.230.150.42 -> 172.31.29.138 TCP 18890 [TCP segment of a reassembled PDU]
 49   0.019338 172.31.29.138 -> 54.230.150.42 TCP 66 39427 > http [ACK] Seq=97 Ack=180010 Win=363904 Len=0 TSval=11421055 TSecr=1454649484
 50   0.019344 54.230.150.42 -> 172.31.29.138 TCP 1514 [TCP segment of a reassembled PDU]
 51   0.019346 172.31.29.138 -> 54.230.150.42 TCP 66 39427 > http [ACK] Seq=97 Ack=181458 Win=366848 Len=0 TSval=11421055 TSecr=1454649484
 52   0.019354 54.230.150.42 -> 172.31.29.138 TCP 1514 [TCP segment of a reassembled PDU]
 53   0.019356 172.31.29.138 -> 54.230.150.42 TCP 66 39427 > http [ACK] Seq=97 Ack=182906 Win=369664 Len=0 TSval=11421055 TSecr=1454649484
 54   0.020673 54.230.150.42 -> 172.31.29.138 TCP 13098 [TCP segment of a reassembled PDU]
 55   0.020692 172.31.29.138 -> 54.230.150.42 TCP 66 39427 > http [ACK] Seq=97 Ack=195938 Win=395776 Len=0 TSval=11421055 TSecr=1454649484
 56   0.020807 54.230.150.42 -> 172.31.29.138 TCP 27578 [TCP segment of a reassembled PDU]
 57   0.020821 172.31.29.138 -> 54.230.150.42 TCP 66 39427 > http [ACK] Seq=97 Ack=223450 Win=450304 Len=0 TSval=11421056 TSecr=1454649484
 58   0.022135 54.230.150.42 -> 172.31.29.138 TCP 4410 [TCP segment of a reassembled PDU]
 59   0.022141 172.31.29.138 -> 54.230.150.42 TCP 66 39427 > http [ACK] Seq=97 Ack=227794 Win=459520 Len=0 TSval=11421056 TSecr=1454649484
 60   0.022275 54.230.150.42 -> 172.31.29.138 TCP 15994 [TCP segment of a reassembled PDU]
 61   0.022285 172.31.29.138 -> 54.230.150.42 TCP 66 39427 > http [ACK] Seq=97 Ack=243722 Win=469376 Len=0 TSval=11421056 TSecr=1454649484
 62   0.022319 54.230.150.42 -> 172.31.29.138 TCP 17442 [TCP segment of a reassembled PDU]
 63   0.022331 172.31.29.138 -> 54.230.150.42 TCP 66 39427 > http [ACK] Seq=97 Ack=261098 Win=466944 Len=0 TSval=11421056 TSecr=1454649484
 64   0.023498 54.230.150.42 -> 172.31.29.138 TCP 14546 [TCP segment of a reassembled PDU]
 65   0.023528 172.31.29.138 -> 54.230.150.42 TCP 66 39427 > http [ACK] Seq=97 Ack=275578 Win=471680 Len=0 TSval=11421056 TSecr=1454649484
 66   0.023557 54.230.150.42 -> 172.31.29.138 TCP 2962 [TCP segment of a reassembled PDU]
 67   0.023561 172.31.29.138 -> 54.230.150.42 TCP 66 39427 > http [ACK] Seq=97 Ack=278474 Win=490752 Len=0 TSval=11421056 TSecr=1454649484
 68   0.023642 54.230.150.42 -> 172.31.29.138 TCP 4410 [TCP segment of a reassembled PDU]
 69   0.023648 172.31.29.138 -> 54.230.150.42 TCP 66 39427 > http [ACK] Seq=97 Ack=282818 Win=488448 Len=0 TSval=11421056 TSecr=1454649485
 70   0.023872 54.230.150.42 -> 172.31.29.138 TCP 26130 [TCP segment of a reassembled PDU]
 71   0.023885 172.31.29.138 -> 54.230.150.42 TCP 66 39427 > http [ACK] Seq=97 Ack=308882 Win=462464 Len=0 TSval=11421056 TSecr=1454649485
 72   0.023893 54.230.150.42 -> 172.31.29.138 TCP 4410 [TCP segment of a reassembled PDU]
 73   0.023896 172.31.29.138 -> 54.230.150.42 TCP 66 39427 > http [ACK] Seq=97 Ack=313226 Win=458240 Len=0 TSval=11421056 TSecr=1454649485
 74   0.024980 54.230.150.42 -> 172.31.29.138 TCP 15994 [TCP segment of a reassembled PDU]
 75   0.024990 172.31.29.138 -> 54.230.150.42 TCP 66 39427 > http [ACK] Seq=97 Ack=329154 Win=469376 Len=0 TSval=11421057 TSecr=1454649485
 76   0.025058 54.230.150.42 -> 172.31.29.138 TCP 5858 [TCP segment of a reassembled PDU]
 77   0.025064 172.31.29.138 -> 54.230.150.42 TCP 66 39427 > http [ACK] Seq=97 Ack=334946 Win=502912 Len=0 TSval=11421057 TSecr=1454649485
 78   0.025396 54.230.150.42 -> 172.31.29.138 TCP 27578 [TCP segment of a reassembled PDU]
 79   0.025409 172.31.29.138 -> 54.230.150.42 TCP 66 39427 > http [ACK] Seq=97 Ack=362458 Win=557952 Len=0 TSval=11421057 TSecr=1454649485
 80   0.025417 54.230.150.42 -> 172.31.29.138 TCP 2962 [TCP segment of a reassembled PDU]
 81   0.025420 172.31.29.138 -> 54.230.150.42 TCP 66 39427 > http [ACK] Seq=97 Ack=365354 Win=563712 Len=0 TSval=11421057 TSecr=1454649485
 82   0.026492 54.230.150.42 -> 172.31.29.138 TCP 8754 [TCP segment of a reassembled PDU]
 83   0.026500 172.31.29.138 -> 54.230.150.42 TCP 66 39427 > http [ACK] Seq=97 Ack=374042 Win=581120 Len=0 TSval=11421057 TSecr=1454649485
 84   0.026633 54.230.150.42 -> 172.31.29.138 TCP 17442 [TCP segment of a reassembled PDU]
 85   0.026643 172.31.29.138 -> 54.230.150.42 TCP 66 39427 > http [ACK] Seq=97 Ack=391418 Win=615808 Len=0 TSval=11421057 TSecr=1454649485
 86   0.026731 54.230.150.42 -> 172.31.29.138 TCP 8754 [TCP segment of a reassembled PDU]
 87   0.026739 172.31.29.138 -> 54.230.150.42 TCP 66 39427 > http [ACK] Seq=97 Ack=400106 Win=633216 Len=0 TSval=11421057 TSecr=1454649485
 88   0.026973 54.230.150.42 -> 172.31.29.138 TCP 29026 [TCP segment of a reassembled PDU]
 89   0.026987 172.31.29.138 -> 54.230.150.42 TCP 66 39427 > http [ACK] Seq=97 Ack=429066 Win=691200 Len=0 TSval=11421057 TSecr=1454649485
 90   0.026993 54.230.150.42 -> 172.31.29.138 TCP 1514 [TCP segment of a reassembled PDU]
 91   0.026995 172.31.29.138 -> 54.230.150.42 TCP 66 39427 > http [ACK] Seq=97 Ack=430514 Win=694016 Len=0 TSval=11421057 TSecr=1454649485
 92   0.028048 54.230.150.42 -> 172.31.29.138 TCP 2962 [TCP segment of a reassembled PDU]
 93   0.028054 172.31.29.138 -> 54.230.150.42 TCP 66 39427 > http [ACK] Seq=97 Ack=433410 Win=699904 Len=0 TSval=11421057 TSecr=1454649485
 94   0.028200 54.230.150.42 -> 172.31.29.138 TCP 20338 [TCP segment of a reassembled PDU]
 95   0.028212 172.31.29.138 -> 54.230.150.42 TCP 66 39427 > http [ACK] Seq=97 Ack=453682 Win=740352 Len=0 TSval=11421057 TSecr=1454649485
 96   0.028243 54.230.150.42 -> 172.31.29.138 TCP 5858 [TCP segment of a reassembled PDU]
 97   0.028249 172.31.29.138 -> 54.230.150.42 TCP 66 39427 > http [ACK] Seq=97 Ack=459474 Win=752000 Len=0 TSval=11421057 TSecr=1454649485
 98   0.028273 54.230.150.42 -> 172.31.29.138 TCP 1514 [TCP segment of a reassembled PDU]
 99   0.028277 172.31.29.138 -> 54.230.150.42 TCP 66 39427 > http [ACK] Seq=97 Ack=460922 Win=754816 Len=0 TSval=11421057 TSecr=1454649485
100   0.028474 54.230.150.42 -> 172.31.29.138 TCP 26130 [TCP segment of a reassembled PDU]
101   0.028487 172.31.29.138 -> 54.230.150.42 TCP 66 39427 > http [ACK] Seq=97 Ack=486986 Win=777088 Len=0 TSval=11421057 TSecr=1454649485
102   0.028498 54.230.150.42 -> 172.31.29.138 TCP 8754 [TCP segment of a reassembled PDU]
103   0.028503 172.31.29.138 -> 54.230.150.42 TCP 66 39427 > http [ACK] Seq=97 Ack=495674 Win=768512 Len=0 TSval=11421057 TSecr=1454649485
104   0.029580 54.230.150.42 -> 172.31.29.138 TCP 5858 [TCP segment of a reassembled PDU]
105   0.029587 172.31.29.138 -> 54.230.150.42 TCP 66 39427 > http [ACK] Seq=97 Ack=501466 Win=810368 Len=0 TSval=11421058 TSecr=1454649485
106   0.029729 54.230.150.42 -> 172.31.29.138 TCP 29026 [TCP segment of a reassembled PDU]
107   0.029743 172.31.29.138 -> 54.230.150.42 TCP 66 39427 > http [ACK] Seq=97 Ack=530426 Win=781440 Len=0 TSval=11421058 TSecr=1454649485
108   0.029809 54.230.150.42 -> 172.31.29.138 TCP 7306 [TCP segment of a reassembled PDU]
109   0.029816 172.31.29.138 -> 54.230.150.42 TCP 66 39427 > http [ACK] Seq=97 Ack=537666 Win=808064 Len=0 TSval=11421058 TSecr=1454649485
110   0.030004 54.230.150.42 -> 172.31.29.138 TCP 23234 [TCP segment of a reassembled PDU]
111   0.030032 172.31.29.138 -> 54.230.150.42 TCP 66 39427 > http [ACK] Seq=97 Ack=560834 Win=784896 Len=0 TSval=11421058 TSecr=1454649485
112   0.031086 54.230.150.42 -> 172.31.29.138 TCP 4410 [TCP segment of a reassembled PDU]
113   0.031092 172.31.29.138 -> 54.230.150.42 TCP 66 39427 > http [ACK] Seq=97 Ack=565178 Win=812800 Len=0 TSval=11421058 TSecr=1454649485
114   0.031328 54.230.150.42 -> 172.31.29.138 TCP 26130 [TCP segment of a reassembled PDU]
115   0.031355 172.31.29.138 -> 54.230.150.42 TCP 66 39427 > http [ACK] Seq=97 Ack=591242 Win=786816 Len=0 TSval=11421058 TSecr=1454649485
116   0.031381 54.230.150.42 -> 172.31.29.138 TCP 24682 [TCP segment of a reassembled PDU]
117   0.031400 54.230.150.42 -> 172.31.29.138 TCP 7306 [TCP segment of a reassembled PDU]
118   0.031417 172.31.29.138 -> 54.230.150.42 TCP 66 39427 > http [ACK] Seq=97 Ack=623098 Win=767488 Len=0 TSval=11421058 TSecr=1454649485
119   0.031426 54.230.150.42 -> 172.31.29.138 TCP 2962 [TCP segment of a reassembled PDU]
120   0.031441 172.31.29.138 -> 54.230.150.42 TCP 66 39427 > http [ACK] Seq=97 Ack=625994 Win=764672 Len=0 TSval=11421058 TSecr=1454649485
121   0.032631 54.230.150.42 -> 172.31.29.138 TCP 4410 [TCP segment of a reassembled PDU]
122   0.032638 172.31.29.138 -> 54.230.150.42 TCP 66 39427 > http [ACK] Seq=97 Ack=630338 Win=812800 Len=0 TSval=11421058 TSecr=1454649485
123   0.032831 54.230.150.42 -> 172.31.29.138 TCP 26130 [TCP segment of a reassembled PDU]
124   0.032856 172.31.29.138 -> 54.230.150.42 TCP 66 39427 > http [ACK] Seq=97 Ack=656402 Win=786816 Len=0 TSval=11421059 TSecr=1454649485
125   0.032884 54.230.150.42 -> 172.31.29.138 TCP 21786 [TCP segment of a reassembled PDU]
126   0.032904 172.31.29.138 -> 54.230.150.42 TCP 66 39427 > http [ACK] Seq=97 Ack=678122 Win=784256 Len=0 TSval=11421059 TSecr=1454649485
127   0.032941 54.230.150.42 -> 172.31.29.138 TCP 13098 [TCP segment of a reassembled PDU]
128   0.032949 172.31.29.138 -> 54.230.150.42 TCP 66 39427 > http [ACK] Seq=97 Ack=691154 Win=798592 Len=0 TSval=11421059 TSecr=1454649485
129   0.034015 54.230.150.42 -> 172.31.29.138 TCP 18890 [TCP segment of a reassembled PDU]
130   0.034032 172.31.29.138 -> 54.230.150.42 TCP 66 39427 > http [ACK] Seq=97 Ack=709978 Win=788992 Len=0 TSval=11421059 TSecr=1454649486
131   0.034107 54.230.150.42 -> 172.31.29.138 TCP 15994 [TCP segment of a reassembled PDU]
132   0.034130 172.31.29.138 -> 54.230.150.42 TCP 66 39427 > http [ACK] Seq=97 Ack=725906 Win=793728 Len=0 TSval=11421059 TSecr=1454649486
133   0.034188 54.230.150.42 -> 172.31.29.138 TCP 2962 [TCP segment of a reassembled PDU]
134   0.034193 172.31.29.138 -> 54.230.150.42 TCP 66 39427 > http [ACK] Seq=97 Ack=728802 Win=815104 Len=0 TSval=11421059 TSecr=1454649486
135   0.034377 54.230.150.42 -> 172.31.29.138 TCP 30474 [TCP segment of a reassembled PDU]
136   0.034399 172.31.29.138 -> 54.230.150.42 TCP 66 39427 > http [ACK] Seq=97 Ack=759210 Win=784768 Len=0 TSval=11421059 TSecr=1454649486
137   0.034412 54.230.150.42 -> 172.31.29.138 TCP 4410 [TCP segment of a reassembled PDU]
138   0.034443 172.31.29.138 -> 54.230.150.42 TCP 66 39427 > http [ACK] Seq=97 Ack=763554 Win=812800 Len=0 TSval=11421059 TSecr=1454649486
139   0.034592 54.230.150.42 -> 172.31.29.138 TCP 24682 [TCP segment of a reassembled PDU]
140   0.034611 54.230.150.42 -> 172.31.29.138 TCP 1514 [TCP segment of a reassembled PDU]
141   0.034619 172.31.29.138 -> 54.230.150.42 TCP 66 39427 > http [ACK] Seq=97 Ack=789618 Win=786816 Len=0 TSval=11421059 TSecr=1454649486
142   0.034626 54.230.150.42 -> 172.31.29.138 TCP 1514 [TCP segment of a reassembled PDU]
143   0.035455 54.230.150.42 -> 172.31.29.138 TCP 5858 [TCP segment of a reassembled PDU]
144   0.035461 172.31.29.138 -> 54.230.150.42 TCP 66 39427 > http [ACK] Seq=97 Ack=796858 Win=810368 Len=0 TSval=11421059 TSecr=1454649486
145   0.035613 54.230.150.42 -> 172.31.29.138 TCP 24682 [TCP segment of a reassembled PDU]
146   0.035632 172.31.29.138 -> 54.230.150.42 TCP 66 39427 > http [ACK] Seq=97 Ack=821474 Win=785792 Len=0 TSval=11421059 TSecr=1454649486
147   0.035686 54.230.150.42 -> 172.31.29.138 TCP 1514 [TCP segment of a reassembled PDU]
148   0.035871 54.230.150.42 -> 172.31.29.138 TCP 27578 [TCP segment of a reassembled PDU]
149   0.035892 172.31.29.138 -> 54.230.150.42 TCP 66 39427 > http [ACK] Seq=97 Ack=850434 Win=774656 Len=0 TSval=11421059 TSecr=1454649486
150   0.035917 54.230.150.42 -> 172.31.29.138 TCP 14546 [TCP segment of a reassembled PDU]
151   0.035927 172.31.29.138 -> 54.230.150.42 TCP 66 39427 > http [ACK] Seq=97 Ack=864914 Win=796032 Len=0 TSval=11421059 TSecr=1454649486
152   0.035947 54.230.150.42 -> 172.31.29.138 TCP 4410 [TCP segment of a reassembled PDU]
153   0.035952 172.31.29.138 -> 54.230.150.42 TCP 66 39427 > http [ACK] Seq=97 Ack=869258 Win=812800 Len=0 TSval=11421059 TSecr=1454649486
154   0.036084 54.230.150.42 -> 172.31.29.138 TCP 17442 [TCP segment of a reassembled PDU]
155   0.036132 172.31.29.138 -> 54.230.150.42 TCP 66 39427 > http [ACK] Seq=97 Ack=886634 Win=795520 Len=0 TSval=11421059 TSecr=1454649486
156   0.036968 54.230.150.42 -> 172.31.29.138 TCP 4410 [TCP segment of a reassembled PDU]
157   0.036974 172.31.29.138 -> 54.230.150.42 TCP 66 39427 > http [ACK] Seq=97 Ack=890978 Win=812800 Len=0 TSval=11421060 TSecr=1454649486
158   0.037136 54.230.150.42 -> 172.31.29.138 TCP 21786 [TCP segment of a reassembled PDU]
159   0.037149 172.31.29.138 -> 54.230.150.42 TCP 66 39427 > http [ACK] Seq=97 Ack=912698 Win=862080 Len=0 TSval=11421060 TSecr=1454649486
160   0.037155 54.230.150.42 -> 172.31.29.138 TCP 1514 [TCP segment of a reassembled PDU]
161   0.037157 172.31.29.138 -> 54.230.150.42 TCP 66 39427 > http [ACK] Seq=97 Ack=914146 Win=864896 Len=0 TSval=11421060 TSecr=1454649486
162   0.037166 54.230.150.42 -> 172.31.29.138 TCP 2962 [TCP segment of a reassembled PDU]
163   0.037168 172.31.29.138 -> 54.230.150.42 TCP 66 39427 > http [ACK] Seq=97 Ack=917042 Win=870656 Len=0 TSval=11421060 TSecr=1454649486
164   0.037223 54.230.150.42 -> 172.31.29.138 TCP 15994 [TCP segment of a reassembled PDU]
165   0.037235 172.31.29.138 -> 54.230.150.42 TCP 66 39427 > http [ACK] Seq=97 Ack=932970 Win=902528 Len=0 TSval=11421060 TSecr=1454649486
166   0.037342 54.230.150.42 -> 172.31.29.138 TCP 18890 [TCP segment of a reassembled PDU]
167   0.037353 172.31.29.138 -> 54.230.150.42 TCP 66 39427 > http [ACK] Seq=97 Ack=951794 Win=915072 Len=0 TSval=11421060 TSecr=1454649486
168   0.037588 54.230.150.42 -> 172.31.29.138 TCP 23234 [TCP segment of a reassembled PDU]
169   0.037613 172.31.29.138 -> 54.230.150.42 TCP 66 39427 > http [ACK] Seq=97 Ack=974962 Win=908032 Len=0 TSval=11421060 TSecr=1454649486
170   0.037711 54.230.150.42 -> 172.31.29.138 TCP 29026 [TCP segment of a reassembled PDU]
171   0.037737 172.31.29.138 -> 54.230.150.42 TCP 66 39427 > http [ACK] Seq=97 Ack=1003922 Win=898432 Len=0 TSval=11421060 TSecr=1454649486
172   0.038505 54.230.150.42 -> 172.31.29.138 TCP 2962 [TCP segment of a reassembled PDU]
173   0.038510 172.31.29.138 -> 54.230.150.42 TCP 66 39427 > http [ACK] Seq=97 Ack=1006818 Win=941312 Len=0 TSval=11421060 TSecr=1454649486
174   0.038660 54.230.150.42 -> 172.31.29.138 TCP 10202 [TCP segment of a reassembled PDU]
175   0.038678 172.31.29.138 -> 54.230.150.42 TCP 66 39427 > http [ACK] Seq=97 Ack=1016954 Win=946048 Len=0 TSval=11421060 TSecr=1454649486
176   0.038950 54.230.150.42 -> 172.31.29.138 TCP 20338 [TCP segment of a reassembled PDU]
177   0.038977 54.230.150.42 -> 172.31.29.138 TCP 5858 [TCP segment of a reassembled PDU]
178   0.038983 54.230.150.42 -> 172.31.29.138 TCP 4410 [TCP segment of a reassembled PDU]
179   0.038986 54.230.150.42 -> 172.31.29.138 HTTP 1738 HTTP/1.1 200 OK  (application/octet-stream)
180   0.038990 172.31.29.138 -> 54.230.150.42 TCP 66 39427 > http [ACK] Seq=97 Ack=1037226 Win=925824 Len=0 TSval=11421060 TSecr=1454649486
181   0.039005 172.31.29.138 -> 54.230.150.42 TCP 66 39427 > http [ACK] Seq=97 Ack=1049034 Win=946048 Len=0 TSval=11421060 TSecr=1454649486
182   0.039109 172.31.29.138 -> 54.230.150.42 TCP 66 39427 > http [FIN, ACK] Seq=97 Ack=1049034 Win=946048 Len=0 TSval=11421060 TSecr=1454649486
183   0.040545 54.230.150.42 -> 172.31.29.138 TCP 66 http > 39427 [FIN, ACK] Seq=1049034 Ack=98 Win=14592 Len=0 TSval=1454649486 TSecr=11421060
184   0.040553 172.31.29.138 -> 54.230.150.42 TCP 66 39427 > http [ACK] Seq=98 Ack=1049035 Win=946048 Len=0 TSval=11421060 TSecr=1454649486
