[Measurement for 1mb at 10:36:50 20.36.2014] 
Tshark:

  1   0.000000 172.31.29.138 -> 172.31.0.2   DNS 89 Standard query 0x1f5c  A d1dx94olpiqj0t.cloudfront.net
  2   0.000036 172.31.29.138 -> 172.31.0.2   DNS 89 Standard query 0xc9a1  AAAA d1dx94olpiqj0t.cloudfront.net
  3   0.000558   172.31.0.2 -> 172.31.29.138 DNS 176 Standard query response 0xc9a1 
  4   0.000570   172.31.0.2 -> 172.31.29.138 DNS 217 Standard query response 0x1f5c  A 54.230.149.215 A 54.230.149.229 A 54.230.150.30 A 54.230.150.57 A 54.230.151.150 A 54.230.151.182 A 54.230.151.252 A 54.230.148.75
  5   0.003861 172.31.29.138 -> 54.230.149.215 TCP 74 34639 > http [SYN] Seq=0 Win=26883 Len=0 MSS=8961 SACK_PERM=1 TSval=15920934 TSecr=0 WS=128
  6   0.005570 54.230.149.215 -> 172.31.29.138 TCP 74 http > 34639 [SYN, ACK] Seq=0 Ack=1 Win=14480 Len=0 MSS=1460 SACK_PERM=1 TSval=1456447046 TSecr=15920934 WS=128
  7   0.005585 172.31.29.138 -> 54.230.149.215 TCP 66 34639 > http [ACK] Seq=1 Ack=1 Win=27008 Len=0 TSval=15920934 TSecr=1456447046
  8   0.005626 172.31.29.138 -> 54.230.149.215 HTTP 162 GET /1mb HTTP/1.1 
  9   0.006995 54.230.149.215 -> 172.31.29.138 TCP 66 http > 34639 [ACK] Seq=1 Ack=97 Win=14592 Len=0 TSval=1456447046 TSecr=15920934
 10   0.010973 54.230.149.215 -> 172.31.29.138 TCP 8754 [TCP segment of a reassembled PDU]
 11   0.010983 172.31.29.138 -> 54.230.149.215 TCP 66 34639 > http [ACK] Seq=97 Ack=8689 Win=44288 Len=0 TSval=15920936 TSecr=1456447047
 12   0.010993 54.230.149.215 -> 172.31.29.138 TCP 5858 [TCP segment of a reassembled PDU]
 13   0.010998 172.31.29.138 -> 54.230.149.215 TCP 66 34639 > http [ACK] Seq=97 Ack=14481 Win=55936 Len=0 TSval=15920936 TSecr=1456447047
 14   0.012426 54.230.149.215 -> 172.31.29.138 TCP 4410 [TCP segment of a reassembled PDU]
 15   0.012433 172.31.29.138 -> 54.230.149.215 TCP 66 34639 > http [ACK] Seq=97 Ack=18825 Win=64640 Len=0 TSval=15920936 TSecr=1456447047
 16   0.012477 54.230.149.215 -> 172.31.29.138 TCP 7306 [TCP segment of a reassembled PDU]
 17   0.012484 172.31.29.138 -> 54.230.149.215 TCP 66 34639 > http [ACK] Seq=97 Ack=26065 Win=79104 Len=0 TSval=15920936 TSecr=1456447047
 18   0.012505 54.230.149.215 -> 172.31.29.138 TCP 1514 [TCP segment of a reassembled PDU]
 19   0.012508 172.31.29.138 -> 54.230.149.215 TCP 66 34639 > http [ACK] Seq=97 Ack=27513 Win=81920 Len=0 TSval=15920936 TSecr=1456447047
 20   0.013974 54.230.149.215 -> 172.31.29.138 TCP 2962 [TCP segment of a reassembled PDU]
 21   0.013980 172.31.29.138 -> 54.230.149.215 TCP 66 34639 > http [ACK] Seq=97 Ack=30409 Win=87808 Len=0 TSval=15920936 TSecr=1456447047
 22   0.014024 54.230.149.215 -> 172.31.29.138 TCP 10202 [TCP segment of a reassembled PDU]
 23   0.014032 172.31.29.138 -> 54.230.149.215 TCP 66 34639 > http [ACK] Seq=97 Ack=40545 Win=101248 Len=0 TSval=15920936 TSecr=1456447047
 24   0.014075 54.230.149.215 -> 172.31.29.138 TCP 8754 [TCP segment of a reassembled PDU]
 25   0.014094 172.31.29.138 -> 54.230.149.215 TCP 66 34639 > http [ACK] Seq=97 Ack=49233 Win=103680 Len=0 TSval=15920936 TSecr=1456447047
 26   0.015503 54.230.149.215 -> 172.31.29.138 TCP 5858 [TCP segment of a reassembled PDU]
 27   0.015509 172.31.29.138 -> 54.230.149.215 TCP 66 34639 > http [ACK] Seq=97 Ack=55025 Win=108416 Len=0 TSval=15920937 TSecr=1456447047
 28   0.015549 54.230.149.215 -> 172.31.29.138 TCP 10202 [TCP segment of a reassembled PDU]
 29   0.015556 172.31.29.138 -> 54.230.149.215 TCP 66 34639 > http [ACK] Seq=97 Ack=65161 Win=129280 Len=0 TSval=15920937 TSecr=1456447047
 30   0.015571 54.230.149.215 -> 172.31.29.138 TCP 199 [TCP segment of a reassembled PDU]
 31   0.015575 172.31.29.138 -> 54.230.149.215 TCP 66 34639 > http [ACK] Seq=97 Ack=65294 Win=129280 Len=0 TSval=15920937 TSecr=1456447047
 32   0.019628 54.230.149.215 -> 172.31.29.138 TCP 11650 [TCP segment of a reassembled PDU]
 33   0.019636 172.31.29.138 -> 54.230.149.215 TCP 66 34639 > http [ACK] Seq=97 Ack=76878 Win=152448 Len=0 TSval=15920938 TSecr=1456447048
 34   0.019683 54.230.149.215 -> 172.31.29.138 TCP 14546 [TCP segment of a reassembled PDU]
 35   0.019692 172.31.29.138 -> 54.230.149.215 TCP 66 34639 > http [ACK] Seq=97 Ack=91358 Win=181504 Len=0 TSval=15920938 TSecr=1456447048
 36   0.021184 54.230.149.215 -> 172.31.29.138 TCP 13098 [TCP segment of a reassembled PDU]
 37   0.021193 172.31.29.138 -> 54.230.149.215 TCP 66 34639 > http [ACK] Seq=97 Ack=104390 Win=207488 Len=0 TSval=15920938 TSecr=1456447048
 38   0.021284 54.230.149.215 -> 172.31.29.138 TCP 15994 [TCP segment of a reassembled PDU]
 39   0.021294 172.31.29.138 -> 54.230.149.215 TCP 66 34639 > http [ACK] Seq=97 Ack=120318 Win=239360 Len=0 TSval=15920938 TSecr=1456447048
 40   0.022658 54.230.149.215 -> 172.31.29.138 TCP 2962 [TCP segment of a reassembled PDU]
 41   0.022664 172.31.29.138 -> 54.230.149.215 TCP 66 34639 > http [ACK] Seq=97 Ack=123214 Win=245120 Len=0 TSval=15920938 TSecr=1456447048
 42   0.022753 54.230.149.215 -> 172.31.29.138 TCP 7682 [TCP segment of a reassembled PDU]
 43   0.022761 172.31.29.138 -> 54.230.149.215 TCP 66 34639 > http [ACK] Seq=97 Ack=130830 Win=260352 Len=0 TSval=15920939 TSecr=1456447048
 44   0.024195 54.230.149.215 -> 172.31.29.138 TCP 5858 [TCP segment of a reassembled PDU]
 45   0.024203 172.31.29.138 -> 54.230.149.215 TCP 66 34639 > http [ACK] Seq=97 Ack=136622 Win=272000 Len=0 TSval=15920939 TSecr=1456447048
 46   0.024370 54.230.149.215 -> 172.31.29.138 TCP 26130 [TCP segment of a reassembled PDU]
 47   0.024384 172.31.29.138 -> 54.230.149.215 TCP 66 34639 > http [ACK] Seq=97 Ack=162686 Win=324096 Len=0 TSval=15920939 TSecr=1456447048
 48   0.025978 54.230.149.215 -> 172.31.29.138 TCP 8754 [TCP segment of a reassembled PDU]
 49   0.025985 172.31.29.138 -> 54.230.149.215 TCP 66 34639 > http [ACK] Seq=97 Ack=171374 Win=341504 Len=0 TSval=15920939 TSecr=1456447048
 50   0.026138 54.230.149.215 -> 172.31.29.138 TCP 26130 [TCP segment of a reassembled PDU]
 51   0.026152 172.31.29.138 -> 54.230.149.215 TCP 66 34639 > http [ACK] Seq=97 Ack=197438 Win=393600 Len=0 TSval=15920939 TSecr=1456447048
 52   0.027519 54.230.149.215 -> 172.31.29.138 TCP 5858 [TCP segment of a reassembled PDU]
 53   0.027527 172.31.29.138 -> 54.230.149.215 TCP 66 34639 > http [ACK] Seq=97 Ack=203230 Win=405248 Len=0 TSval=15920940 TSecr=1456447048
 54   0.027626 54.230.149.215 -> 172.31.29.138 TCP 7306 [TCP segment of a reassembled PDU]
 55   0.027633 172.31.29.138 -> 54.230.149.215 TCP 66 34639 > http [ACK] Seq=97 Ack=210470 Win=419712 Len=0 TSval=15920940 TSecr=1456447048
 56   0.027639 54.230.149.215 -> 172.31.29.138 TCP 1514 [TCP Previous segment not captured] [TCP segment of a reassembled PDU]
 57   0.027642 172.31.29.138 -> 54.230.149.215 TCP 78 [TCP Window Update] 34639 > http [ACK] Seq=97 Ack=210470 Win=422528 Len=0 TSval=15920940 TSecr=1456447048 SLE=211918 SRE=213366
 58   0.027657 54.230.149.215 -> 172.31.29.138 TCP 1514 [TCP Out-Of-Order] [TCP segment of a reassembled PDU]
 59   0.027662 172.31.29.138 -> 54.230.149.215 TCP 66 34639 > http [ACK] Seq=97 Ack=213366 Win=425472 Len=0 TSval=15920940 TSecr=1456447048
 60   0.027751 54.230.149.215 -> 172.31.29.138 TCP 14546 [TCP segment of a reassembled PDU]
 61   0.027759 172.31.29.138 -> 54.230.149.215 TCP 66 34639 > http [ACK] Seq=97 Ack=227846 Win=444672 Len=0 TSval=15920940 TSecr=1456447048
 62   0.029054 54.230.149.215 -> 172.31.29.138 TCP 4410 [TCP segment of a reassembled PDU]
 63   0.029060 172.31.29.138 -> 54.230.149.215 TCP 66 34639 > http [ACK] Seq=97 Ack=232190 Win=461440 Len=0 TSval=15920940 TSecr=1456447048
 64   0.029206 54.230.149.215 -> 172.31.29.138 TCP 14546 [TCP segment of a reassembled PDU]
 65   0.029215 172.31.29.138 -> 54.230.149.215 TCP 66 34639 > http [ACK] Seq=97 Ack=246670 Win=446976 Len=0 TSval=15920940 TSecr=1456447048
 66   0.029314 54.230.149.215 -> 172.31.29.138 TCP 11650 [TCP segment of a reassembled PDU]
 67   0.029322 172.31.29.138 -> 54.230.149.215 TCP 66 34639 > http [ACK] Seq=97 Ack=258254 Win=449536 Len=0 TSval=15920940 TSecr=1456447048
 68   0.029431 54.230.149.215 -> 172.31.29.138 TCP 7306 [TCP segment of a reassembled PDU]
 69   0.029437 172.31.29.138 -> 54.230.149.215 TCP 66 34639 > http [ACK] Seq=97 Ack=265494 Win=442368 Len=0 TSval=15920940 TSecr=1456447048
 70   0.030568 54.230.149.215 -> 172.31.29.138 TCP 2962 [TCP segment of a reassembled PDU]
 71   0.030574 172.31.29.138 -> 54.230.149.215 TCP 66 34639 > http [ACK] Seq=97 Ack=268390 Win=463744 Len=0 TSval=15920940 TSecr=1456447049
 72   0.030740 54.230.149.215 -> 172.31.29.138 TCP 18890 [TCP segment of a reassembled PDU]
 73   0.030763 172.31.29.138 -> 54.230.149.215 TCP 66 34639 > http [ACK] Seq=97 Ack=287214 Win=444928 Len=0 TSval=15920941 TSecr=1456447049
 74   0.030835 54.230.149.215 -> 172.31.29.138 TCP 8754 [TCP segment of a reassembled PDU]
 75   0.030842 172.31.29.138 -> 54.230.149.215 TCP 66 34639 > http [ACK] Seq=97 Ack=295902 Win=454272 Len=0 TSval=15920941 TSecr=1456447049
 76   0.030975 54.230.149.215 -> 172.31.29.138 TCP 13098 [TCP segment of a reassembled PDU]
 77   0.030984 172.31.29.138 -> 54.230.149.215 TCP 66 34639 > http [ACK] Seq=97 Ack=308934 Win=447232 Len=0 TSval=15920941 TSecr=1456447049
 78   0.032117 54.230.149.215 -> 172.31.29.138 TCP 8754 [TCP segment of a reassembled PDU]
 79   0.032124 172.31.29.138 -> 54.230.149.215 TCP 66 34639 > http [ACK] Seq=97 Ack=317622 Win=454272 Len=0 TSval=15920941 TSecr=1456447049
 80   0.032262 54.230.149.215 -> 172.31.29.138 TCP 15994 [TCP segment of a reassembled PDU]
 81   0.032271 172.31.29.138 -> 54.230.149.215 TCP 66 34639 > http [ACK] Seq=97 Ack=333550 Win=442368 Len=0 TSval=15920941 TSecr=1456447049
 82   0.032551 54.230.149.215 -> 172.31.29.138 TCP 24682 [TCP segment of a reassembled PDU]
 83   0.032563 172.31.29.138 -> 54.230.149.215 TCP 66 34639 > http [ACK] Seq=97 Ack=358166 Win=428160 Len=0 TSval=15920941 TSecr=1456447049
 84   0.033654 54.230.149.215 -> 172.31.29.138 TCP 2962 [TCP segment of a reassembled PDU]
 85   0.033662 172.31.29.138 -> 54.230.149.215 TCP 66 34639 > http [ACK] Seq=97 Ack=361062 Win=463744 Len=0 TSval=15920941 TSecr=1456447049
 86   0.033871 54.230.149.215 -> 172.31.29.138 TCP 24682 [TCP segment of a reassembled PDU]
 87   0.033885 172.31.29.138 -> 54.230.149.215 TCP 66 34639 > http [ACK] Seq=97 Ack=385678 Win=439168 Len=0 TSval=15920941 TSecr=1456447049
 88   0.033891 54.230.149.215 -> 172.31.29.138 TCP 1514 [TCP segment of a reassembled PDU]
 89   0.033894 172.31.29.138 -> 54.230.149.215 TCP 66 34639 > http [ACK] Seq=97 Ack=387126 Win=437760 Len=0 TSval=15920941 TSecr=1456447049
 90   0.034107 54.230.149.215 -> 172.31.29.138 TCP 24682 [TCP segment of a reassembled PDU]
 91   0.034120 172.31.29.138 -> 54.230.149.215 TCP 66 34639 > http [ACK] Seq=97 Ack=411742 Win=413184 Len=0 TSval=15920941 TSecr=1456447049
 92   0.035434 54.230.149.215 -> 172.31.29.138 TCP 4410 [TCP segment of a reassembled PDU]
 93   0.035440 172.31.29.138 -> 54.230.149.215 TCP 66 34639 > http [ACK] Seq=97 Ack=416086 Win=461440 Len=0 TSval=15920942 TSecr=1456447049
 94   0.035604 54.230.149.215 -> 172.31.29.138 TCP 26130 [TCP segment of a reassembled PDU]
 95   0.035617 172.31.29.138 -> 54.230.149.215 TCP 66 34639 > http [ACK] Seq=97 Ack=442150 Win=521088 Len=0 TSval=15920942 TSecr=1456447049
 96   0.035842 54.230.149.215 -> 172.31.29.138 TCP 29026 [TCP segment of a reassembled PDU]
 97   0.035857 172.31.29.138 -> 54.230.149.215 TCP 66 34639 > http [ACK] Seq=97 Ack=471110 Win=578944 Len=0 TSval=15920942 TSecr=1456447049
 98   0.036992 54.230.149.215 -> 172.31.29.138 TCP 7306 [TCP segment of a reassembled PDU]
 99   0.036999 172.31.29.138 -> 54.230.149.215 TCP 66 34639 > http [ACK] Seq=97 Ack=478350 Win=593408 Len=0 TSval=15920942 TSecr=1456447049
100   0.037119 54.230.149.215 -> 172.31.29.138 TCP 10202 [TCP segment of a reassembled PDU]
101   0.037127 172.31.29.138 -> 54.230.149.215 TCP 66 34639 > http [ACK] Seq=97 Ack=488486 Win=613760 Len=0 TSval=15920942 TSecr=1456447049
102   0.037388 54.230.149.215 -> 172.31.29.138 TCP 26130 [TCP segment of a reassembled PDU]
103   0.037401 172.31.29.138 -> 54.230.149.215 TCP 66 34639 > http [ACK] Seq=97 Ack=514550 Win=665856 Len=0 TSval=15920942 TSecr=1456447049
104   0.037425 54.230.149.215 -> 172.31.29.138 TCP 18890 [TCP segment of a reassembled PDU]
105   0.037434 172.31.29.138 -> 54.230.149.215 TCP 66 34639 > http [ACK] Seq=97 Ack=533374 Win=703488 Len=0 TSval=15920942 TSecr=1456447049
106   0.037459 54.230.149.215 -> 172.31.29.138 TCP 1514 [TCP segment of a reassembled PDU]
107   0.037462 172.31.29.138 -> 54.230.149.215 TCP 66 34639 > http [ACK] Seq=97 Ack=534822 Win=706432 Len=0 TSval=15920942 TSecr=1456447049
108   0.038544 54.230.149.215 -> 172.31.29.138 TCP 4410 [TCP segment of a reassembled PDU]
109   0.038550 172.31.29.138 -> 54.230.149.215 TCP 66 34639 > http [ACK] Seq=97 Ack=539166 Win=715136 Len=0 TSval=15920942 TSecr=1456447049
110   0.038696 54.230.149.215 -> 172.31.29.138 TCP 14546 [TCP segment of a reassembled PDU]
111   0.038705 172.31.29.138 -> 54.230.149.215 TCP 66 34639 > http [ACK] Seq=97 Ack=553646 Win=744064 Len=0 TSval=15920942 TSecr=1456447049
112   0.038993 54.230.149.215 -> 172.31.29.138 TCP 29026 [TCP segment of a reassembled PDU]
113   0.039007 172.31.29.138 -> 54.230.149.215 TCP 66 34639 > http [ACK] Seq=97 Ack=582606 Win=763264 Len=0 TSval=15920943 TSecr=1456447049
114   0.040073 54.230.149.215 -> 172.31.29.138 TCP 2962 [TCP segment of a reassembled PDU]
115   0.040079 172.31.29.138 -> 54.230.149.215 TCP 66 34639 > http [ACK] Seq=97 Ack=585502 Win=806144 Len=0 TSval=15920943 TSecr=1456447050
116   0.040264 54.230.149.215 -> 172.31.29.138 TCP 26130 [TCP segment of a reassembled PDU]
117   0.040281 54.230.149.215 -> 172.31.29.138 TCP 7306 [TCP segment of a reassembled PDU]
118   0.040298 172.31.29.138 -> 54.230.149.215 TCP 66 34639 > http [ACK] Seq=97 Ack=618806 Win=772864 Len=0 TSval=15920943 TSecr=1456447050
119   0.040612 54.230.149.215 -> 172.31.29.138 TCP 7306 [TCP segment of a reassembled PDU]
120   0.040620 172.31.29.138 -> 54.230.149.215 TCP 66 34639 > http [ACK] Seq=97 Ack=626046 Win=799104 Len=0 TSval=15920943 TSecr=1456447050
121   0.040770 54.230.149.215 -> 172.31.29.138 TCP 18890 [TCP segment of a reassembled PDU]
122   0.040800 54.230.149.215 -> 172.31.29.138 TCP 7306 [TCP segment of a reassembled PDU]
123   0.040805 172.31.29.138 -> 54.230.149.215 TCP 66 34639 > http [ACK] Seq=97 Ack=644870 Win=780288 Len=0 TSval=15920943 TSecr=1456447050
124   0.040816 54.230.149.215 -> 172.31.29.138 TCP 5858 [TCP segment of a reassembled PDU]
125   0.040835 172.31.29.138 -> 54.230.149.215 TCP 66 34639 > http [ACK] Seq=97 Ack=657902 Win=807808 Len=0 TSval=15920943 TSecr=1456447050
126   0.041882 54.230.149.215 -> 172.31.29.138 TCP 4410 [TCP segment of a reassembled PDU]
127   0.041903 172.31.29.138 -> 54.230.149.215 TCP 66 34639 > http [ACK] Seq=97 Ack=662246 Win=807808 Len=0 TSval=15920943 TSecr=1456447050
128   0.042050 54.230.149.215 -> 172.31.29.138 TCP 21786 [TCP segment of a reassembled PDU]
129   0.042073 172.31.29.138 -> 54.230.149.215 TCP 66 34639 > http [ACK] Seq=97 Ack=683966 Win=786176 Len=0 TSval=15920943 TSecr=1456447050
130   0.042415 54.230.149.215 -> 172.31.29.138 TCP 5858 [TCP segment of a reassembled PDU]
131   0.042422 172.31.29.138 -> 54.230.149.215 TCP 66 34639 > http [ACK] Seq=97 Ack=689758 Win=801408 Len=0 TSval=15920943 TSecr=1456447050
132   0.042596 54.230.149.215 -> 172.31.29.138 TCP 17442 [TCP segment of a reassembled PDU]
133   0.042618 172.31.29.138 -> 54.230.149.215 TCP 66 34639 > http [ACK] Seq=97 Ack=707134 Win=784128 Len=0 TSval=15920943 TSecr=1456447050
134   0.042632 54.230.149.215 -> 172.31.29.138 TCP 8754 [TCP segment of a reassembled PDU]
135   0.042647 172.31.29.138 -> 54.230.149.215 TCP 66 34639 > http [ACK] Seq=97 Ack=715822 Win=807808 Len=0 TSval=15920943 TSecr=1456447050
136   0.042687 54.230.149.215 -> 172.31.29.138 TCP 10202 [TCP segment of a reassembled PDU]
137   0.042707 172.31.29.138 -> 54.230.149.215 TCP 66 34639 > http [ACK] Seq=97 Ack=725958 Win=807808 Len=0 TSval=15920943 TSecr=1456447050
138   0.043663 54.230.149.215 -> 172.31.29.138 TCP 5858 [TCP segment of a reassembled PDU]
139   0.043682 172.31.29.138 -> 54.230.149.215 TCP 66 34639 > http [ACK] Seq=97 Ack=731750 Win=807808 Len=0 TSval=15920944 TSecr=1456447050
140   0.043817 54.230.149.215 -> 172.31.29.138 TCP 17442 [TCP segment of a reassembled PDU]
141   0.044008 172.31.29.138 -> 54.230.149.215 TCP 66 34639 > http [ACK] Seq=97 Ack=749126 Win=790528 Len=0 TSval=15920944 TSecr=1456447050
142   0.044284 54.230.149.215 -> 172.31.29.138 TCP 18890 [TCP segment of a reassembled PDU]
143   0.044307 172.31.29.138 -> 54.230.149.215 TCP 66 34639 > http [ACK] Seq=97 Ack=767950 Win=780032 Len=0 TSval=15920944 TSecr=1456447050
144   0.044430 54.230.149.215 -> 172.31.29.138 TCP 26130 [TCP segment of a reassembled PDU]
145   0.044449 54.230.149.215 -> 172.31.29.138 TCP 8754 [TCP segment of a reassembled PDU]
146   0.044459 54.230.149.215 -> 172.31.29.138 TCP 11650 [TCP segment of a reassembled PDU]
147   0.044489 172.31.29.138 -> 54.230.149.215 TCP 66 34639 > http [ACK] Seq=97 Ack=814286 Win=734720 Len=0 TSval=15920944 TSecr=1456447050
148   0.045739 54.230.149.215 -> 172.31.29.138 TCP 7306 [TCP segment of a reassembled PDU]
149   0.045746 172.31.29.138 -> 54.230.149.215 TCP 66 34639 > http [ACK] Seq=97 Ack=821526 Win=799104 Len=0 TSval=15920944 TSecr=1456447050
150   0.045907 54.230.149.215 -> 172.31.29.138 TCP 26130 [TCP segment of a reassembled PDU]
151   0.045935 172.31.29.138 -> 54.230.149.215 TCP 66 34639 > http [ACK] Seq=97 Ack=847590 Win=773120 Len=0 TSval=15920944 TSecr=1456447050
152   0.045966 54.230.149.215 -> 172.31.29.138 TCP 29026 [TCP segment of a reassembled PDU]
153   0.045990 172.31.29.138 -> 54.230.149.215 TCP 66 34639 > http [ACK] Seq=97 Ack=876550 Win=763264 Len=0 TSval=15920944 TSecr=1456447050
154   0.046000 54.230.149.215 -> 172.31.29.138 TCP 2962 [TCP segment of a reassembled PDU]
155   0.046010 172.31.29.138 -> 54.230.149.215 TCP 66 34639 > http [ACK] Seq=97 Ack=879446 Win=760448 Len=0 TSval=15920944 TSecr=1456447050
156   0.047251 54.230.149.215 -> 172.31.29.138 TCP 5858 [TCP segment of a reassembled PDU]
157   0.047258 172.31.29.138 -> 54.230.149.215 TCP 66 34639 > http [ACK] Seq=97 Ack=885238 Win=801408 Len=0 TSval=15920945 TSecr=1456447050
158   0.047445 54.230.149.215 -> 172.31.29.138 TCP 26130 [TCP segment of a reassembled PDU]
159   0.047463 54.230.149.215 -> 172.31.29.138 TCP 8754 [TCP segment of a reassembled PDU]
160   0.047480 172.31.29.138 -> 54.230.149.215 TCP 66 34639 > http [ACK] Seq=97 Ack=919990 Win=766720 Len=0 TSval=15920945 TSecr=1456447050
161   0.047502 54.230.149.215 -> 172.31.29.138 TCP 5858 [TCP segment of a reassembled PDU]
162   0.047509 172.31.29.138 -> 54.230.149.215 TCP 66 34639 > http [ACK] Seq=97 Ack=925782 Win=787072 Len=0 TSval=15920945 TSecr=1456447050
163   0.047695 54.230.149.215 -> 172.31.29.138 TCP 26130 [TCP segment of a reassembled PDU]
164   0.047742 54.230.149.215 -> 172.31.29.138 TCP 26130 [TCP segment of a reassembled PDU]
165   0.047756 54.230.149.215 -> 172.31.29.138 TCP 4410 [TCP segment of a reassembled PDU]
166   0.047762 172.31.29.138 -> 54.230.149.215 TCP 66 34639 > http [ACK] Seq=97 Ack=951846 Win=768128 Len=0 TSval=15920945 TSecr=1456447050
167   0.047778 172.31.29.138 -> 54.230.149.215 TCP 66 34639 > http [ACK] Seq=97 Ack=982254 Win=760960 Len=0 TSval=15920945 TSecr=1456447050
168   0.049036 54.230.149.215 -> 172.31.29.138 TCP 4410 [TCP segment of a reassembled PDU]
169   0.049043 172.31.29.138 -> 54.230.149.215 TCP 66 34639 > http [ACK] Seq=97 Ack=986598 Win=803840 Len=0 TSval=15920945 TSecr=1456447050
170   0.049217 54.230.149.215 -> 172.31.29.138 TCP 23234 [TCP segment of a reassembled PDU]
171   0.049255 172.31.29.138 -> 54.230.149.215 TCP 66 34639 > http [ACK] Seq=97 Ack=1009766 Win=780672 Len=0 TSval=15920945 TSecr=1456447050
172   0.049321 54.230.149.215 -> 172.31.29.138 TCP 5858 [TCP segment of a reassembled PDU]
173   0.049327 172.31.29.138 -> 54.230.149.215 TCP 66 34639 > http [ACK] Seq=97 Ack=1015558 Win=801408 Len=0 TSval=15920945 TSecr=1456447050
174   0.049474 54.230.149.215 -> 172.31.29.138 TCP 24682 [TCP segment of a reassembled PDU]
175   0.049496 54.230.149.215 -> 172.31.29.138 TCP 1514 [TCP segment of a reassembled PDU]
176   0.049507 172.31.29.138 -> 54.230.149.215 TCP 66 34639 > http [ACK] Seq=97 Ack=1041622 Win=775424 Len=0 TSval=15920945 TSecr=1456447050
177   0.049527 54.230.149.215 -> 172.31.29.138 HTTP 7478 HTTP/1.1 200 OK  (application/octet-stream)
178   0.049539 172.31.29.138 -> 54.230.149.215 TCP 66 34639 > http [ACK] Seq=97 Ack=1049034 Win=794368 Len=0 TSval=15920945 TSecr=1456447050
179   0.049649 172.31.29.138 -> 54.230.149.215 TCP 66 34639 > http [FIN, ACK] Seq=97 Ack=1049034 Win=807808 Len=0 TSval=15920945 TSecr=1456447050
180   0.051076 54.230.149.215 -> 172.31.29.138 TCP 66 http > 34639 [FIN, ACK] Seq=1049034 Ack=98 Win=14592 Len=0 TSval=1456447051 TSecr=15920945
181   0.051084 172.31.29.138 -> 54.230.149.215 TCP 66 34639 > http [ACK] Seq=98 Ack=1049035 Win=807808 Len=0 TSval=15920946 TSecr=1456447051
