[Measurement for 1mb at 20:37:48 19.37.2014] 
Tshark:

  1   0.000000 172.31.29.138 -> 172.31.0.2   DNS 89 Standard query 0x638b  A d1dx94olpiqj0t.cloudfront.net
  2   0.000027 172.31.29.138 -> 172.31.0.2   DNS 89 Standard query 0xfb2a  AAAA d1dx94olpiqj0t.cloudfront.net
  3   0.000489   172.31.0.2 -> 172.31.29.138 DNS 217 Standard query response 0x638b  A 54.230.158.246 A 54.230.159.7 A 54.192.156.109 A 54.192.157.146 A 54.192.159.173 A 54.192.159.174 A 54.230.158.80 A 54.230.158.223
  4   0.000500   172.31.0.2 -> 172.31.29.138 DNS 176 Standard query response 0xfb2a 
  5   0.003849 172.31.29.138 -> 54.230.158.246 TCP 74 45650 > http [SYN] Seq=0 Win=26883 Len=0 MSS=8961 SACK_PERM=1 TSval=3335222 TSecr=0 WS=128
  6   0.004365 54.230.158.246 -> 172.31.29.138 TCP 74 http > 45650 [SYN, ACK] Seq=0 Ack=1 Win=14480 Len=0 MSS=1460 SACK_PERM=1 TSval=727584785 TSecr=3335222 WS=128
  7   0.004379 172.31.29.138 -> 54.230.158.246 TCP 66 45650 > http [ACK] Seq=1 Ack=1 Win=27008 Len=0 TSval=3335222 TSecr=727584785
  8   0.004419 172.31.29.138 -> 54.230.158.246 HTTP 162 GET /1mb HTTP/1.1 
  9   0.005117 54.230.158.246 -> 172.31.29.138 TCP 66 http > 45650 [ACK] Seq=1 Ack=97 Win=14592 Len=0 TSval=727584785 TSecr=3335222
 10   0.007191 54.230.158.246 -> 172.31.29.138 TCP 523 [TCP segment of a reassembled PDU]
 11   0.007199 172.31.29.138 -> 54.230.158.246 TCP 66 45650 > http [ACK] Seq=97 Ack=458 Win=28032 Len=0 TSval=3335223 TSecr=727584785
 12   0.007526 54.230.158.246 -> 172.31.29.138 TCP 13098 [TCP segment of a reassembled PDU]
 13   0.007537 172.31.29.138 -> 54.230.158.246 TCP 66 45650 > http [ACK] Seq=97 Ack=13490 Win=54144 Len=0 TSval=3335223 TSecr=727584785
 14   0.008277 54.230.158.246 -> 172.31.29.138 TCP 13098 [TCP segment of a reassembled PDU]
 15   0.008287 172.31.29.138 -> 54.230.158.246 TCP 66 45650 > http [ACK] Seq=97 Ack=26522 Win=80128 Len=0 TSval=3335223 TSecr=727584785
 16   0.009043 54.230.158.246 -> 172.31.29.138 TCP 13098 [TCP segment of a reassembled PDU]
 17   0.009053 172.31.29.138 -> 54.230.158.246 TCP 66 45650 > http [ACK] Seq=97 Ack=39554 Win=96512 Len=0 TSval=3335223 TSecr=727584786
 18   0.009800 54.230.158.246 -> 172.31.29.138 TCP 13098 [TCP segment of a reassembled PDU]
 19   0.009810 172.31.29.138 -> 54.230.158.246 TCP 66 45650 > http [ACK] Seq=97 Ack=52586 Win=96512 Len=0 TSval=3335223 TSecr=727584786
 20   0.009841 54.230.158.246 -> 172.31.29.138 TCP 7306 [TCP segment of a reassembled PDU]
 21   0.009848 172.31.29.138 -> 54.230.158.246 TCP 66 45650 > http [ACK] Seq=97 Ack=59826 Win=89344 Len=0 TSval=3335223 TSecr=727584786
 22   0.010510 54.230.158.246 -> 172.31.29.138 TCP 1514 [TCP segment of a reassembled PDU]
 23   0.010515 172.31.29.138 -> 54.230.158.246 TCP 66 45650 > http [ACK] Seq=97 Ack=61274 Win=109056 Len=0 TSval=3335224 TSecr=727584786
 24   0.010650 54.230.158.246 -> 172.31.29.138 TCP 17442 [TCP segment of a reassembled PDU]
 25   0.010659 172.31.29.138 -> 54.230.158.246 TCP 66 45650 > http [ACK] Seq=97 Ack=78650 Win=143872 Len=0 TSval=3335224 TSecr=727584786
 26   0.011338 54.230.158.246 -> 172.31.29.138 TCP 13098 [TCP segment of a reassembled PDU]
 27   0.011347 172.31.29.138 -> 54.230.158.246 TCP 66 45650 > http [ACK] Seq=97 Ack=91682 Win=169856 Len=0 TSval=3335224 TSecr=727584786
 28   0.011385 54.230.158.246 -> 172.31.29.138 TCP 13098 [TCP segment of a reassembled PDU]
 29   0.011394 172.31.29.138 -> 54.230.158.246 TCP 66 45650 > http [ACK] Seq=97 Ack=104714 Win=195968 Len=0 TSval=3335224 TSecr=727584786
 30   0.011860 54.230.158.246 -> 172.31.29.138 TCP 13098 [TCP segment of a reassembled PDU]
 31   0.011869 172.31.29.138 -> 54.230.158.246 TCP 66 45650 > http [ACK] Seq=97 Ack=117746 Win=221952 Len=0 TSval=3335224 TSecr=727584786
 32   0.011918 54.230.158.246 -> 172.31.29.138 TCP 13098 [TCP segment of a reassembled PDU]
 33   0.011928 172.31.29.138 -> 54.230.158.246 TCP 66 45650 > http [ACK] Seq=97 Ack=130778 Win=248064 Len=0 TSval=3335224 TSecr=727584786
 34   0.012567 54.230.158.246 -> 172.31.29.138 TCP 1514 [TCP segment of a reassembled PDU]
 35   0.012573 172.31.29.138 -> 54.230.158.246 TCP 66 45650 > http [ACK] Seq=97 Ack=132226 Win=251008 Len=0 TSval=3335224 TSecr=727584786
 36   0.012714 54.230.158.246 -> 172.31.29.138 TCP 11650 [TCP segment of a reassembled PDU]
 37   0.012722 172.31.29.138 -> 54.230.158.246 TCP 66 45650 > http [ACK] Seq=97 Ack=143810 Win=274176 Len=0 TSval=3335224 TSecr=727584786
 38   0.012804 54.230.158.246 -> 172.31.29.138 TCP 13098 [TCP segment of a reassembled PDU]
 39   0.012813 172.31.29.138 -> 54.230.158.246 TCP 66 45650 > http [ACK] Seq=97 Ack=156842 Win=300160 Len=0 TSval=3335224 TSecr=727584786
 40   0.013385 54.230.158.246 -> 172.31.29.138 TCP 13098 [TCP segment of a reassembled PDU]
 41   0.013394 172.31.29.138 -> 54.230.158.246 TCP 66 45650 > http [ACK] Seq=97 Ack=169874 Win=326272 Len=0 TSval=3335224 TSecr=727584786
 42   0.013439 54.230.158.246 -> 172.31.29.138 TCP 13098 [TCP segment of a reassembled PDU]
 43   0.013448 172.31.29.138 -> 54.230.158.246 TCP 66 45650 > http [ACK] Seq=97 Ack=182906 Win=352384 Len=0 TSval=3335224 TSecr=727584786
 44   0.013903 54.230.158.246 -> 172.31.29.138 TCP 10202 [TCP segment of a reassembled PDU]
 45   0.013911 172.31.29.138 -> 54.230.158.246 TCP 66 45650 > http [ACK] Seq=97 Ack=193042 Win=372608 Len=0 TSval=3335224 TSecr=727584786
 46   0.013985 54.230.158.246 -> 172.31.29.138 TCP 2962 [TCP segment of a reassembled PDU]
 47   0.013991 172.31.29.138 -> 54.230.158.246 TCP 66 45650 > http [ACK] Seq=97 Ack=195938 Win=378368 Len=0 TSval=3335225 TSecr=727584786
 48   0.014141 54.230.158.246 -> 172.31.29.138 TCP 23234 [TCP segment of a reassembled PDU]
 49   0.014154 172.31.29.138 -> 54.230.158.246 TCP 66 45650 > http [ACK] Seq=97 Ack=219106 Win=424704 Len=0 TSval=3335225 TSecr=727584786
 50   0.014164 54.230.158.246 -> 172.31.29.138 TCP 2962 [TCP segment of a reassembled PDU]
 51   0.014168 172.31.29.138 -> 54.230.158.246 TCP 66 45650 > http [ACK] Seq=97 Ack=222002 Win=430464 Len=0 TSval=3335225 TSecr=727584786
 52   0.014632 54.230.158.246 -> 172.31.29.138 TCP 2962 [TCP segment of a reassembled PDU]
 53   0.014637 172.31.29.138 -> 54.230.158.246 TCP 66 45650 > http [ACK] Seq=97 Ack=224898 Win=436352 Len=0 TSval=3335225 TSecr=727584786
 54   0.014829 54.230.158.246 -> 172.31.29.138 TCP 26130 [TCP segment of a reassembled PDU]
 55   0.014843 172.31.29.138 -> 54.230.158.246 TCP 66 45650 > http [ACK] Seq=97 Ack=250962 Win=488448 Len=0 TSval=3335225 TSecr=727584786
 56   0.014860 54.230.158.246 -> 172.31.29.138 TCP 11650 [TCP segment of a reassembled PDU]
 57   0.014867 172.31.29.138 -> 54.230.158.246 TCP 66 45650 > http [ACK] Seq=97 Ack=262546 Win=511616 Len=0 TSval=3335225 TSecr=727584786
 58   0.015431 54.230.158.246 -> 172.31.29.138 TCP 8754 [TCP segment of a reassembled PDU]
 59   0.015440 172.31.29.138 -> 54.230.158.246 TCP 66 45650 > http [ACK] Seq=97 Ack=271234 Win=529024 Len=0 TSval=3335225 TSecr=727584786
 60   0.015597 54.230.158.246 -> 172.31.29.138 TCP 26130 [TCP segment of a reassembled PDU]
 61   0.015611 172.31.29.138 -> 54.230.158.246 TCP 66 45650 > http [ACK] Seq=97 Ack=297298 Win=581120 Len=0 TSval=3335225 TSecr=727584786
 62   0.015630 54.230.158.246 -> 172.31.29.138 TCP 14546 [TCP segment of a reassembled PDU]
 63   0.015637 172.31.29.138 -> 54.230.158.246 TCP 66 45650 > http [ACK] Seq=97 Ack=311778 Win=610048 Len=0 TSval=3335225 TSecr=727584786
 64   0.016346 54.230.158.246 -> 172.31.29.138 TCP 21786 [TCP segment of a reassembled PDU]
 65   0.016358 172.31.29.138 -> 54.230.158.246 TCP 66 45650 > http [ACK] Seq=97 Ack=333498 Win=653568 Len=0 TSval=3335225 TSecr=727584786
 66   0.016387 54.230.158.246 -> 172.31.29.138 TCP 4410 [TCP segment of a reassembled PDU]
 67   0.016394 172.31.29.138 -> 54.230.158.246 TCP 66 45650 > http [ACK] Seq=97 Ack=337842 Win=662144 Len=0 TSval=3335225 TSecr=727584786
 68   0.016459 54.230.158.246 -> 172.31.29.138 TCP 1514 [TCP segment of a reassembled PDU]
 69   0.016464 172.31.29.138 -> 54.230.158.246 TCP 66 45650 > http [ACK] Seq=97 Ack=339290 Win=665088 Len=0 TSval=3335225 TSecr=727584786
 70   0.016488 54.230.158.246 -> 172.31.29.138 TCP 26130 [TCP segment of a reassembled PDU]
 71   0.016499 172.31.29.138 -> 54.230.158.246 TCP 66 45650 > http [ACK] Seq=97 Ack=365354 Win=717184 Len=0 TSval=3335225 TSecr=727584786
 72   0.016940 54.230.158.246 -> 172.31.29.138 TCP 5858 [TCP segment of a reassembled PDU]
 73   0.016948 172.31.29.138 -> 54.230.158.246 TCP 66 45650 > http [ACK] Seq=97 Ack=371146 Win=728832 Len=0 TSval=3335225 TSecr=727584786
 74   0.017099 54.230.158.246 -> 172.31.29.138 TCP 17442 [TCP segment of a reassembled PDU]
 75   0.017110 172.31.29.138 -> 54.230.158.246 TCP 66 45650 > http [ACK] Seq=97 Ack=388522 Win=763520 Len=0 TSval=3335225 TSecr=727584786
 76   0.017376 54.230.158.246 -> 172.31.29.138 TCP 26130 [TCP segment of a reassembled PDU]
 77   0.017390 172.31.29.138 -> 54.230.158.246 TCP 66 45650 > http [ACK] Seq=97 Ack=414586 Win=786176 Len=0 TSval=3335225 TSecr=727584786
 78   0.017402 54.230.158.246 -> 172.31.29.138 TCP 10202 [TCP segment of a reassembled PDU]
 79   0.017412 172.31.29.138 -> 54.230.158.246 TCP 66 45650 > http [ACK] Seq=97 Ack=424722 Win=776064 Len=0 TSval=3335225 TSecr=727584786
 80   0.017853 54.230.158.246 -> 172.31.29.138 TCP 26130 [TCP segment of a reassembled PDU]
 81   0.017867 172.31.29.138 -> 54.230.158.246 TCP 66 45650 > http [ACK] Seq=97 Ack=450786 Win=786176 Len=0 TSval=3335225 TSecr=727584786
 82   0.018072 54.230.158.246 -> 172.31.29.138 TCP 18890 [TCP segment of a reassembled PDU]
 83   0.018084 172.31.29.138 -> 54.230.158.246 TCP 66 45650 > http [ACK] Seq=97 Ack=469610 Win=797952 Len=0 TSval=3335226 TSecr=727584786
 84   0.018469 54.230.158.246 -> 172.31.29.138 TCP 4410 [TCP segment of a reassembled PDU]
 85   0.018477 172.31.29.138 -> 54.230.158.246 TCP 66 45650 > http [ACK] Seq=97 Ack=473954 Win=824320 Len=0 TSval=3335226 TSecr=727584787
 86   0.018671 54.230.158.246 -> 172.31.29.138 TCP 26130 [TCP segment of a reassembled PDU]
 87   0.018685 172.31.29.138 -> 54.230.158.246 TCP 66 45650 > http [ACK] Seq=97 Ack=500018 Win=876544 Len=0 TSval=3335226 TSecr=727584787
 88   0.018721 54.230.158.246 -> 172.31.29.138 TCP 17442 [TCP segment of a reassembled PDU]
 89   0.018731 172.31.29.138 -> 54.230.158.246 TCP 66 45650 > http [ACK] Seq=97 Ack=517394 Win=911232 Len=0 TSval=3335226 TSecr=727584787
 90   0.018785 54.230.158.246 -> 172.31.29.138 TCP 17442 [TCP segment of a reassembled PDU]
 91   0.018797 172.31.29.138 -> 54.230.158.246 TCP 66 45650 > http [ACK] Seq=97 Ack=534770 Win=946048 Len=0 TSval=3335226 TSecr=727584787
 92   0.019233 54.230.158.246 -> 172.31.29.138 TCP 2962 [TCP segment of a reassembled PDU]
 93   0.019239 172.31.29.138 -> 54.230.158.246 TCP 66 45650 > http [ACK] Seq=97 Ack=537666 Win=951808 Len=0 TSval=3335226 TSecr=727584787
 94   0.019435 54.230.158.246 -> 172.31.29.138 TCP 24682 [TCP segment of a reassembled PDU]
 95   0.019450 172.31.29.138 -> 54.230.158.246 TCP 66 45650 > http [ACK] Seq=97 Ack=562282 Win=1001088 Len=0 TSval=3335226 TSecr=727584787
 96   0.019502 54.230.158.246 -> 172.31.29.138 TCP 17442 [TCP segment of a reassembled PDU]
 97   0.019513 172.31.29.138 -> 54.230.158.246 TCP 66 45650 > http [ACK] Seq=97 Ack=579658 Win=1035776 Len=0 TSval=3335226 TSecr=727584787
 98   0.019664 54.230.158.246 -> 172.31.29.138 TCP 20338 [TCP segment of a reassembled PDU]
 99   0.019675 172.31.29.138 -> 54.230.158.246 TCP 66 45650 > http [ACK] Seq=97 Ack=599930 Win=1076352 Len=0 TSval=3335226 TSecr=727584787
100   0.020004 54.230.158.246 -> 172.31.29.138 TCP 4410 [TCP segment of a reassembled PDU]
101   0.020011 172.31.29.138 -> 54.230.158.246 TCP 66 45650 > http [ACK] Seq=97 Ack=604274 Win=1085056 Len=0 TSval=3335226 TSecr=727584787
102   0.020190 54.230.158.246 -> 172.31.29.138 TCP 20338 [TCP segment of a reassembled PDU]
103   0.020202 172.31.29.138 -> 54.230.158.246 TCP 66 45650 > http [ACK] Seq=97 Ack=624546 Win=1125504 Len=0 TSval=3335226 TSecr=727584787
104   0.020240 54.230.158.246 -> 172.31.29.138 TCP 14546 [TCP segment of a reassembled PDU]
105   0.020249 172.31.29.138 -> 54.230.158.246 TCP 66 45650 > http [ACK] Seq=97 Ack=639026 Win=1154560 Len=0 TSval=3335226 TSecr=727584787
106   0.020273 54.230.158.246 -> 172.31.29.138 TCP 4410 [TCP segment of a reassembled PDU]
107   0.020278 172.31.29.138 -> 54.230.158.246 TCP 66 45650 > http [ACK] Seq=97 Ack=643370 Win=1163264 Len=0 TSval=3335226 TSecr=727584787
108   0.020443 54.230.158.246 -> 172.31.29.138 TCP 21786 [TCP segment of a reassembled PDU]
109   0.020456 172.31.29.138 -> 54.230.158.246 TCP 66 45650 > http [ACK] Seq=97 Ack=665090 Win=1206656 Len=0 TSval=3335226 TSecr=727584787
110   0.020795 54.230.158.246 -> 172.31.29.138 TCP 5858 [TCP segment of a reassembled PDU]
111   0.020801 172.31.29.138 -> 54.230.158.246 TCP 66 45650 > http [ACK] Seq=97 Ack=670882 Win=1218176 Len=0 TSval=3335226 TSecr=727584787
112   0.020972 54.230.158.246 -> 172.31.29.138 TCP 26130 [TCP segment of a reassembled PDU]
113   0.020986 172.31.29.138 -> 54.230.158.246 TCP 66 45650 > http [ACK] Seq=97 Ack=696946 Win=1270400 Len=0 TSval=3335226 TSecr=727584787
114   0.020999 54.230.158.246 -> 172.31.29.138 TCP 10202 [TCP segment of a reassembled PDU]
115   0.021008 172.31.29.138 -> 54.230.158.246 TCP 66 45650 > http [ACK] Seq=97 Ack=707082 Win=1290624 Len=0 TSval=3335226 TSecr=727584787
116   0.021103 54.230.158.246 -> 172.31.29.138 TCP 23234 [TCP segment of a reassembled PDU]
117   0.021115 172.31.29.138 -> 54.230.158.246 TCP 66 45650 > http [ACK] Seq=97 Ack=730250 Win=1336960 Len=0 TSval=3335226 TSecr=727584787
118   0.021627 54.230.158.246 -> 172.31.29.138 TCP 21786 [TCP segment of a reassembled PDU]
119   0.021641 172.31.29.138 -> 54.230.158.246 TCP 66 45650 > http [ACK] Seq=97 Ack=751970 Win=1342848 Len=0 TSval=3335226 TSecr=727584787
120   0.021756 54.230.158.246 -> 172.31.29.138 TCP 26130 [TCP segment of a reassembled PDU]
121   0.021770 172.31.29.138 -> 54.230.158.246 TCP 66 45650 > http [ACK] Seq=97 Ack=778034 Win=1335808 Len=0 TSval=3335226 TSecr=727584787
122   0.021806 54.230.158.246 -> 172.31.29.138 TCP 17442 [TCP segment of a reassembled PDU]
123   0.021815 172.31.29.138 -> 54.230.158.246 TCP 66 45650 > http [ACK] Seq=97 Ack=795410 Win=1318528 Len=0 TSval=3335226 TSecr=727584787
124   0.022321 54.230.158.246 -> 172.31.29.138 TCP 5858 [TCP segment of a reassembled PDU]
125   0.022328 172.31.29.138 -> 54.230.158.246 TCP 66 45650 > http [ACK] Seq=97 Ack=801202 Win=1369088 Len=0 TSval=3335227 TSecr=727584787
126   0.022505 54.230.158.246 -> 172.31.29.138 TCP 26130 [TCP segment of a reassembled PDU]
127   0.022518 172.31.29.138 -> 54.230.158.246 TCP 66 45650 > http [ACK] Seq=97 Ack=827266 Win=1343104 Len=0 TSval=3335227 TSecr=727584787
128   0.022577 54.230.158.246 -> 172.31.29.138 TCP 26130 [TCP segment of a reassembled PDU]
129   0.022590 172.31.29.138 -> 54.230.158.246 TCP 66 45650 > http [ACK] Seq=97 Ack=853330 Win=1335808 Len=0 TSval=3335227 TSecr=727584787
130   0.022597 54.230.158.246 -> 172.31.29.138 TCP 1514 [TCP segment of a reassembled PDU]
131   0.022600 172.31.29.138 -> 54.230.158.246 TCP 66 45650 > http [ACK] Seq=97 Ack=854778 Win=1334400 Len=0 TSval=3335227 TSecr=727584787
132   0.022610 54.230.158.246 -> 172.31.29.138 TCP 5858 [TCP segment of a reassembled PDU]
133   0.022614 172.31.29.138 -> 54.230.158.246 TCP 66 45650 > http [ACK] Seq=97 Ack=860570 Win=1328640 Len=0 TSval=3335227 TSecr=727584787
134   0.022960 54.230.158.246 -> 172.31.29.138 TCP 26130 [TCP segment of a reassembled PDU]
135   0.022974 172.31.29.138 -> 54.230.158.246 TCP 66 45650 > http [ACK] Seq=97 Ack=886634 Win=1335808 Len=0 TSval=3335227 TSecr=727584787
136   0.023009 54.230.158.246 -> 172.31.29.138 TCP 17442 [TCP segment of a reassembled PDU]
137   0.023019 172.31.29.138 -> 54.230.158.246 TCP 66 45650 > http [ACK] Seq=97 Ack=904010 Win=1318528 Len=0 TSval=3335227 TSecr=727584787
138   0.023229 54.230.158.246 -> 172.31.29.138 TCP 21786 [TCP segment of a reassembled PDU]
139   0.023242 172.31.29.138 -> 54.230.158.246 TCP 66 45650 > http [ACK] Seq=97 Ack=925730 Win=1342848 Len=0 TSval=3335227 TSecr=727584787
140   0.023359 54.230.158.246 -> 172.31.29.138 TCP 5858 [TCP segment of a reassembled PDU]
141   0.023365 172.31.29.138 -> 54.230.158.246 TCP 66 45650 > http [ACK] Seq=97 Ack=931522 Win=1369088 Len=0 TSval=3335227 TSecr=727584787
142   0.023534 54.230.158.246 -> 172.31.29.138 TCP 17442 [TCP segment of a reassembled PDU]
143   0.023556 172.31.29.138 -> 54.230.158.246 TCP 66 45650 > http [ACK] Seq=97 Ack=948898 Win=1351808 Len=0 TSval=3335227 TSecr=727584787
144   0.023590 54.230.158.246 -> 172.31.29.138 TCP 15994 [TCP segment of a reassembled PDU]
145   0.023600 172.31.29.138 -> 54.230.158.246 TCP 66 45650 > http [ACK] Seq=97 Ack=964826 Win=1352320 Len=0 TSval=3335227 TSecr=727584787
146   0.023661 54.230.158.246 -> 172.31.29.138 TCP 26130 [TCP segment of a reassembled PDU]
147   0.023687 172.31.29.138 -> 54.230.158.246 TCP 66 45650 > http [ACK] Seq=97 Ack=990890 Win=1335808 Len=0 TSval=3335227 TSecr=727584787
148   0.023861 54.230.158.246 -> 172.31.29.138 TCP 4410 [TCP segment of a reassembled PDU]
149   0.023867 172.31.29.138 -> 54.230.158.246 TCP 66 45650 > http [ACK] Seq=97 Ack=995234 Win=1371392 Len=0 TSval=3335227 TSecr=727584787
150   0.024058 54.230.158.246 -> 172.31.29.138 TCP 26130 [TCP segment of a reassembled PDU]
151   0.024092 54.230.158.246 -> 172.31.29.138 TCP 13098 [TCP segment of a reassembled PDU]
152   0.024111 172.31.29.138 -> 54.230.158.246 TCP 66 45650 > http [ACK] Seq=97 Ack=1034330 Win=1332352 Len=0 TSval=3335227 TSecr=727584787
153   0.024219 54.230.158.246 -> 172.31.29.138 HTTP 14770 HTTP/1.1 200 OK  (application/octet-stream)
154   0.024229 172.31.29.138 -> 54.230.158.246 TCP 66 45650 > http [ACK] Seq=97 Ack=1049034 Win=1352320 Len=0 TSval=3335227 TSecr=727584787
155   0.024449 172.31.29.138 -> 54.230.158.246 TCP 66 45650 > http [FIN, ACK] Seq=97 Ack=1049034 Win=1371392 Len=0 TSval=3335227 TSecr=727584787
156   0.025105 54.230.158.246 -> 172.31.29.138 TCP 66 http > 45650 [FIN, ACK] Seq=1049034 Ack=98 Win=14592 Len=0 TSval=727584787 TSecr=3335227
157   0.025114 172.31.29.138 -> 54.230.158.246 TCP 66 45650 > http [ACK] Seq=98 Ack=1049035 Win=1371392 Len=0 TSval=3335227 TSecr=727584787
