[Measurement for 1mb at 02:36:50 20.36.2014] 
Tshark:

  1   0.000000 172.31.29.138 -> 172.31.0.2   DNS 89 Standard query 0x7396  A d1dx94olpiqj0t.cloudfront.net
  2   0.000027 172.31.29.138 -> 172.31.0.2   DNS 89 Standard query 0x6031  AAAA d1dx94olpiqj0t.cloudfront.net
  3   0.000495   172.31.0.2 -> 172.31.29.138 DNS 217 Standard query response 0x7396  A 54.192.159.165 A 54.230.156.40 A 54.230.158.223 A 54.230.158.229 A 54.230.159.137 A 54.192.156.102 A 54.192.156.109 A 54.192.157.149
  4   0.000561   172.31.0.2 -> 172.31.29.138 DNS 176 Standard query response 0x6031 
  5   0.003880 172.31.29.138 -> 54.192.159.165 TCP 74 46162 > http [SYN] Seq=0 Win=26883 Len=0 MSS=8961 SACK_PERM=1 TSval=8720717 TSecr=0 WS=128
  6   0.004537 54.192.159.165 -> 172.31.29.138 TCP 74 http > 46162 [SYN, ACK] Seq=0 Ack=1 Win=14480 Len=0 MSS=1460 SACK_PERM=1 TSval=729738993 TSecr=8720717 WS=128
  7   0.004560 172.31.29.138 -> 54.192.159.165 TCP 66 46162 > http [ACK] Seq=1 Ack=1 Win=27008 Len=0 TSval=8720718 TSecr=729738993
  8   0.004638 172.31.29.138 -> 54.192.159.165 HTTP 162 GET /1mb HTTP/1.1 
  9   0.005517 54.192.159.165 -> 172.31.29.138 TCP 66 http > 46162 [ACK] Seq=1 Ack=97 Win=14592 Len=0 TSval=729738994 TSecr=8720718
 10   0.009938 54.192.159.165 -> 172.31.29.138 TCP 523 [TCP segment of a reassembled PDU]
 11   0.009945 172.31.29.138 -> 54.192.159.165 TCP 66 46162 > http [ACK] Seq=97 Ack=458 Win=28032 Len=0 TSval=8720719 TSecr=729738994
 12   0.010049 54.192.159.165 -> 172.31.29.138 TCP 13098 [TCP segment of a reassembled PDU]
 13   0.010061 172.31.29.138 -> 54.192.159.165 TCP 66 46162 > http [ACK] Seq=97 Ack=13490 Win=54144 Len=0 TSval=8720719 TSecr=729738994
 14   0.010688 54.192.159.165 -> 172.31.29.138 TCP 2962 [TCP segment of a reassembled PDU]
 15   0.010694 172.31.29.138 -> 54.192.159.165 TCP 66 46162 > http [ACK] Seq=97 Ack=16386 Win=59904 Len=0 TSval=8720719 TSecr=729738994
 16   0.010788 54.192.159.165 -> 172.31.29.138 TCP 10202 [TCP segment of a reassembled PDU]
 17   0.010795 172.31.29.138 -> 54.192.159.165 TCP 66 46162 > http [ACK] Seq=97 Ack=26522 Win=80128 Len=0 TSval=8720719 TSecr=729738994
 18   0.011211 54.192.159.165 -> 172.31.29.138 TCP 7306 [TCP segment of a reassembled PDU]
 19   0.011218 172.31.29.138 -> 54.192.159.165 TCP 66 46162 > http [ACK] Seq=97 Ack=33762 Win=94592 Len=0 TSval=8720719 TSecr=729738994
 20   0.011232 54.192.159.165 -> 172.31.29.138 TCP 1514 [TCP segment of a reassembled PDU]
 21   0.011239 172.31.29.138 -> 54.192.159.165 TCP 66 46162 > http [ACK] Seq=97 Ack=35210 Win=97536 Len=0 TSval=8720719 TSecr=729738994
 22   0.011481 54.192.159.165 -> 172.31.29.138 TCP 11650 [TCP segment of a reassembled PDU]
 23   0.011490 172.31.29.138 -> 54.192.159.165 TCP 66 46162 > http [ACK] Seq=97 Ack=46794 Win=98944 Len=0 TSval=8720719 TSecr=729738994
 24   0.011700 54.192.159.165 -> 172.31.29.138 TCP 5858 [TCP segment of a reassembled PDU]
 25   0.011719 172.31.29.138 -> 54.192.159.165 TCP 66 46162 > http [ACK] Seq=97 Ack=52586 Win=108416 Len=0 TSval=8720719 TSecr=729738994
 26   0.011993 54.192.159.165 -> 172.31.29.138 TCP 10202 [TCP segment of a reassembled PDU]
 27   0.012001 172.31.29.138 -> 54.192.159.165 TCP 66 46162 > http [ACK] Seq=97 Ack=62722 Win=101248 Len=0 TSval=8720719 TSecr=729738994
 28   0.012067 54.192.159.165 -> 172.31.29.138 TCP 8754 [TCP segment of a reassembled PDU]
 29   0.012075 172.31.29.138 -> 54.192.159.165 TCP 66 46162 > http [ACK] Seq=97 Ack=71410 Win=103680 Len=0 TSval=8720719 TSecr=729738994
 30   0.012723 54.192.159.165 -> 172.31.29.138 TCP 4410 [TCP segment of a reassembled PDU]
 31   0.012728 172.31.29.138 -> 54.192.159.165 TCP 66 46162 > http [ACK] Seq=97 Ack=75754 Win=109056 Len=0 TSval=8720720 TSecr=729738994
 32   0.012839 54.192.159.165 -> 172.31.29.138 TCP 15994 [TCP segment of a reassembled PDU]
 33   0.012849 172.31.29.138 -> 54.192.159.165 TCP 66 46162 > http [ACK] Seq=97 Ack=91682 Win=140928 Len=0 TSval=8720720 TSecr=729738994
 34   0.013251 54.192.159.165 -> 172.31.29.138 TCP 7306 [TCP segment of a reassembled PDU]
 35   0.013258 172.31.29.138 -> 54.192.159.165 TCP 66 46162 > http [ACK] Seq=97 Ack=98922 Win=155392 Len=0 TSval=8720720 TSecr=729738994
 36   0.013284 54.192.159.165 -> 172.31.29.138 TCP 1514 [TCP segment of a reassembled PDU]
 37   0.013290 172.31.29.138 -> 54.192.159.165 TCP 66 46162 > http [ACK] Seq=97 Ack=100370 Win=158336 Len=0 TSval=8720720 TSecr=729738994
 38   0.013620 54.192.159.165 -> 172.31.29.138 TCP 23234 [TCP segment of a reassembled PDU]
 39   0.013634 172.31.29.138 -> 54.192.159.165 TCP 66 46162 > http [ACK] Seq=97 Ack=123538 Win=204672 Len=0 TSval=8720720 TSecr=729738994
 40   0.013758 54.192.159.165 -> 172.31.29.138 TCP 8754 [TCP segment of a reassembled PDU]
 41   0.013766 172.31.29.138 -> 54.192.159.165 TCP 66 46162 > http [ACK] Seq=97 Ack=132226 Win=221952 Len=0 TSval=8720720 TSecr=729738994
 42   0.013796 54.192.159.165 -> 172.31.29.138 TCP 2962 [TCP segment of a reassembled PDU]
 43   0.013800 172.31.29.138 -> 54.192.159.165 TCP 66 46162 > http [ACK] Seq=97 Ack=135122 Win=227840 Len=0 TSval=8720720 TSecr=729738994
 44   0.014317 54.192.159.165 -> 172.31.29.138 TCP 15994 [TCP segment of a reassembled PDU]
 45   0.014328 172.31.29.138 -> 54.192.159.165 TCP 66 46162 > http [ACK] Seq=97 Ack=151050 Win=259712 Len=0 TSval=8720720 TSecr=729738994
 46   0.014403 54.192.159.165 -> 172.31.29.138 TCP 18890 [TCP segment of a reassembled PDU]
 47   0.014414 172.31.29.138 -> 54.192.159.165 TCP 66 46162 > http [ACK] Seq=97 Ack=169874 Win=297344 Len=0 TSval=8720720 TSecr=729738994
 48   0.015069 54.192.159.165 -> 172.31.29.138 TCP 17442 [TCP segment of a reassembled PDU]
 49   0.015080 172.31.29.138 -> 54.192.159.165 TCP 66 46162 > http [ACK] Seq=97 Ack=187250 Win=332032 Len=0 TSval=8720720 TSecr=729738994
 50   0.015180 54.192.159.165 -> 172.31.29.138 TCP 24682 [TCP segment of a reassembled PDU]
 51   0.015193 172.31.29.138 -> 54.192.159.165 TCP 66 46162 > http [ACK] Seq=97 Ack=211866 Win=381312 Len=0 TSval=8720720 TSecr=729738994
 52   0.015579 54.192.159.165 -> 172.31.29.138 TCP 10202 [TCP segment of a reassembled PDU]
 53   0.015588 172.31.29.138 -> 54.192.159.165 TCP 66 46162 > http [ACK] Seq=97 Ack=222002 Win=401536 Len=0 TSval=8720720 TSecr=729738995
 54   0.015671 54.192.159.165 -> 172.31.29.138 TCP 8754 [TCP segment of a reassembled PDU]
 55   0.015679 172.31.29.138 -> 54.192.159.165 TCP 66 46162 > http [ACK] Seq=97 Ack=230690 Win=418944 Len=0 TSval=8720720 TSecr=729738995
 56   0.015939 54.192.159.165 -> 172.31.29.138 TCP 26130 [TCP segment of a reassembled PDU]
 57   0.015953 172.31.29.138 -> 54.192.159.165 TCP 66 46162 > http [ACK] Seq=97 Ack=256754 Win=471040 Len=0 TSval=8720720 TSecr=729738995
 58   0.016348 54.192.159.165 -> 172.31.29.138 TCP 6662 [TCP segment of a reassembled PDU]
 59   0.016356 172.31.29.138 -> 54.192.159.165 TCP 66 46162 > http [ACK] Seq=97 Ack=263350 Win=484224 Len=0 TSval=8720720 TSecr=729738995
 60   0.016606 54.192.159.165 -> 172.31.29.138 TCP 17442 [TCP segment of a reassembled PDU]
 61   0.016617 172.31.29.138 -> 54.192.159.165 TCP 66 46162 > http [ACK] Seq=97 Ack=280726 Win=503040 Len=0 TSval=8720721 TSecr=729738995
 62   0.016744 54.192.159.165 -> 172.31.29.138 TCP 24682 [TCP segment of a reassembled PDU]
 63   0.016758 172.31.29.138 -> 54.192.159.165 TCP 66 46162 > http [ACK] Seq=97 Ack=305342 Win=568192 Len=0 TSval=8720721 TSecr=729738995
 64   0.017143 54.192.159.165 -> 172.31.29.138 TCP 20338 [TCP segment of a reassembled PDU]
 65   0.017155 172.31.29.138 -> 54.192.159.165 TCP 66 46162 > http [ACK] Seq=97 Ack=325614 Win=608768 Len=0 TSval=8720721 TSecr=729738995
 66   0.017179 54.192.159.165 -> 172.31.29.138 TCP 1890 [TCP segment of a reassembled PDU]
 67   0.017183 172.31.29.138 -> 54.192.159.165 TCP 66 46162 > http [ACK] Seq=97 Ack=327438 Win=612480 Len=0 TSval=8720721 TSecr=729738995
 68   0.018089 54.192.159.165 -> 172.31.29.138 TCP 1514 [TCP segment of a reassembled PDU]
 69   0.018094 172.31.29.138 -> 54.192.159.165 TCP 66 46162 > http [ACK] Seq=97 Ack=328886 Win=615296 Len=0 TSval=8720721 TSecr=729738995
 70   0.018374 54.192.159.165 -> 172.31.29.138 TCP 7306 [TCP segment of a reassembled PDU]
 71   0.018381 172.31.29.138 -> 54.192.159.165 TCP 66 46162 > http [ACK] Seq=97 Ack=336126 Win=629760 Len=0 TSval=8720721 TSecr=729738995
 72   0.018514 54.192.159.165 -> 172.31.29.138 TCP 26130 [TCP segment of a reassembled PDU]
 73   0.018529 172.31.29.138 -> 54.192.159.165 TCP 66 46162 > http [ACK] Seq=97 Ack=362190 Win=681984 Len=0 TSval=8720721 TSecr=729738995
 74   0.018561 54.192.159.165 -> 172.31.29.138 TCP 18890 [TCP segment of a reassembled PDU]
 75   0.018585 172.31.29.138 -> 54.192.159.165 TCP 66 46162 > http [ACK] Seq=97 Ack=381014 Win=719616 Len=0 TSval=8720721 TSecr=729738995
 76   0.019167 54.192.159.165 -> 172.31.29.138 TCP 8754 [TCP segment of a reassembled PDU]
 77   0.019175 172.31.29.138 -> 54.192.159.165 TCP 66 46162 > http [ACK] Seq=97 Ack=389702 Win=736896 Len=0 TSval=8720721 TSecr=729738995
 78   0.019279 54.192.159.165 -> 172.31.29.138 TCP 3338 [TCP segment of a reassembled PDU]
 79   0.019285 172.31.29.138 -> 54.192.159.165 TCP 66 46162 > http [ACK] Seq=97 Ack=392974 Win=743552 Len=0 TSval=8720721 TSecr=729738995
 80   0.019880 54.192.159.165 -> 172.31.29.138 TCP 2962 [TCP segment of a reassembled PDU]
 81   0.019885 172.31.29.138 -> 54.192.159.165 TCP 66 46162 > http [ACK] Seq=97 Ack=395870 Win=749312 Len=0 TSval=8720721 TSecr=729738995
 82   0.020009 54.192.159.165 -> 172.31.29.138 TCP 26130 [TCP segment of a reassembled PDU]
 83   0.020023 172.31.29.138 -> 54.192.159.165 TCP 66 46162 > http [ACK] Seq=97 Ack=421934 Win=801408 Len=0 TSval=8720721 TSecr=729738995
 84   0.020048 54.192.159.165 -> 172.31.29.138 TCP 20338 [TCP segment of a reassembled PDU]
 85   0.020057 172.31.29.138 -> 54.192.159.165 TCP 66 46162 > http [ACK] Seq=97 Ack=442206 Win=841984 Len=0 TSval=8720721 TSecr=729738995
 86   0.020114 54.192.159.165 -> 172.31.29.138 TCP 4410 [TCP segment of a reassembled PDU]
 87   0.020119 172.31.29.138 -> 54.192.159.165 TCP 66 46162 > http [ACK] Seq=97 Ack=446550 Win=850688 Len=0 TSval=8720721 TSecr=729738995
 88   0.020679 54.192.159.165 -> 172.31.29.138 TCP 12026 [TCP segment of a reassembled PDU]
 89   0.020688 172.31.29.138 -> 54.192.159.165 TCP 66 46162 > http [ACK] Seq=97 Ack=458510 Win=874624 Len=0 TSval=8720722 TSecr=729738995
 90   0.021667 54.192.159.165 -> 172.31.29.138 TCP 2962 [TCP segment of a reassembled PDU]
 91   0.021673 172.31.29.138 -> 54.192.159.165 TCP 66 46162 > http [ACK] Seq=97 Ack=461406 Win=880384 Len=0 TSval=8720722 TSecr=729738995
 92   0.021787 54.192.159.165 -> 172.31.29.138 TCP 24682 [TCP segment of a reassembled PDU]
 93   0.021801 172.31.29.138 -> 54.192.159.165 TCP 66 46162 > http [ACK] Seq=97 Ack=486022 Win=929536 Len=0 TSval=8720722 TSecr=729738995
 94   0.021819 54.192.159.165 -> 172.31.29.138 TCP 10202 [TCP segment of a reassembled PDU]
 95   0.021825 172.31.29.138 -> 54.192.159.165 TCP 66 46162 > http [ACK] Seq=97 Ack=496158 Win=949888 Len=0 TSval=8720722 TSecr=729738995
 96   0.021833 54.192.159.165 -> 172.31.29.138 TCP 7306 [TCP segment of a reassembled PDU]
 97   0.021838 172.31.29.138 -> 54.192.159.165 TCP 66 46162 > http [ACK] Seq=97 Ack=503398 Win=964352 Len=0 TSval=8720722 TSecr=729738995
 98   0.021864 54.192.159.165 -> 172.31.29.138 TCP 8754 [TCP segment of a reassembled PDU]
 99   0.021871 172.31.29.138 -> 54.192.159.165 TCP 66 46162 > http [ACK] Seq=97 Ack=512086 Win=981760 Len=0 TSval=8720722 TSecr=729738995
100   0.021940 54.192.159.165 -> 172.31.29.138 TCP 8754 [TCP segment of a reassembled PDU]
101   0.021947 172.31.29.138 -> 54.192.159.165 TCP 66 46162 > http [ACK] Seq=97 Ack=520774 Win=999040 Len=0 TSval=8720722 TSecr=729738995
102   0.022465 54.192.159.165 -> 172.31.29.138 TCP 3338 [TCP segment of a reassembled PDU]
103   0.022472 172.31.29.138 -> 54.192.159.165 TCP 66 46162 > http [ACK] Seq=97 Ack=524046 Win=999040 Len=0 TSval=8720722 TSecr=729738995
104   0.023454 54.192.159.165 -> 172.31.29.138 TCP 2962 [TCP segment of a reassembled PDU]
105   0.023459 172.31.29.138 -> 54.192.159.165 TCP 66 46162 > http [ACK] Seq=97 Ack=526942 Win=1004928 Len=0 TSval=8720722 TSecr=729738995
106   0.023488 54.192.159.165 -> 172.31.29.138 TCP 7306 [TCP segment of a reassembled PDU]
107   0.023494 172.31.29.138 -> 54.192.159.165 TCP 66 46162 > http [ACK] Seq=97 Ack=534182 Win=1019392 Len=0 TSval=8720722 TSecr=729738995
108   0.023695 54.192.159.165 -> 172.31.29.138 TCP 23234 [TCP segment of a reassembled PDU]
109   0.023708 172.31.29.138 -> 54.192.159.165 TCP 66 46162 > http [ACK] Seq=97 Ack=557350 Win=1065728 Len=0 TSval=8720722 TSecr=729738995
110   0.023716 54.192.159.165 -> 172.31.29.138 TCP 2962 [TCP segment of a reassembled PDU]
111   0.023723 172.31.29.138 -> 54.192.159.165 TCP 66 46162 > http [ACK] Seq=97 Ack=560246 Win=1065344 Len=0 TSval=8720722 TSecr=729738995
112   0.023804 54.192.159.165 -> 172.31.29.138 TCP 26130 [TCP segment of a reassembled PDU]
113   0.023818 172.31.29.138 -> 54.192.159.165 TCP 66 46162 > http [ACK] Seq=97 Ack=586310 Win=1065472 Len=0 TSval=8720722 TSecr=729738995
114   0.023825 54.192.159.165 -> 172.31.29.138 TCP 2962 [TCP segment of a reassembled PDU]
115   0.023829 172.31.29.138 -> 54.192.159.165 TCP 66 46162 > http [ACK] Seq=97 Ack=589206 Win=1062656 Len=0 TSval=8720722 TSecr=729738995
116   0.024054 54.192.159.165 -> 172.31.29.138 TCP 442 [TCP segment of a reassembled PDU]
117   0.024060 172.31.29.138 -> 54.192.159.165 TCP 66 46162 > http [ACK] Seq=97 Ack=589582 Win=1065728 Len=0 TSval=8720722 TSecr=729738995
118   0.025251 54.192.159.165 -> 172.31.29.138 TCP 1514 [TCP segment of a reassembled PDU]
119   0.025255 172.31.29.138 -> 54.192.159.165 TCP 66 46162 > http [ACK] Seq=97 Ack=591030 Win=1068544 Len=0 TSval=8720723 TSecr=729738996
120   0.026298 54.192.159.165 -> 172.31.29.138 TCP 5858 [TCP segment of a reassembled PDU]
121   0.026304 172.31.29.138 -> 54.192.159.165 TCP 66 46162 > http [ACK] Seq=97 Ack=596822 Win=1080192 Len=0 TSval=8720723 TSecr=729738996
122   0.026450 54.192.159.165 -> 172.31.29.138 TCP 21786 [TCP segment of a reassembled PDU]
123   0.026462 172.31.29.138 -> 54.192.159.165 TCP 66 46162 > http [ACK] Seq=97 Ack=618542 Win=1072640 Len=0 TSval=8720723 TSecr=729738996
124   0.026479 54.192.159.165 -> 172.31.29.138 TCP 4410 [TCP segment of a reassembled PDU]
125   0.026483 172.31.29.138 -> 54.192.159.165 TCP 66 46162 > http [ACK] Seq=97 Ack=622886 Win=1068416 Len=0 TSval=8720723 TSecr=729738996
126   0.026569 54.192.159.165 -> 172.31.29.138 TCP 32298 [TCP segment of a reassembled PDU]
127   0.026583 172.31.29.138 -> 54.192.159.165 TCP 66 46162 > http [ACK] Seq=97 Ack=655118 Win=1053568 Len=0 TSval=8720723 TSecr=729738996
128   0.027045 54.192.159.165 -> 172.31.29.138 TCP 5858 [TCP segment of a reassembled PDU]
129   0.027052 172.31.29.138 -> 54.192.159.165 TCP 66 46162 > http [ACK] Seq=97 Ack=660910 Win=1091712 Len=0 TSval=8720723 TSecr=729738996
130   0.027192 54.192.159.165 -> 172.31.29.138 TCP 18890 [TCP segment of a reassembled PDU]
131   0.027204 172.31.29.138 -> 54.192.159.165 TCP 66 46162 > http [ACK] Seq=97 Ack=679734 Win=1077376 Len=0 TSval=8720723 TSecr=729738996
132   0.027226 54.192.159.165 -> 172.31.29.138 TCP 7306 [TCP segment of a reassembled PDU]
133   0.027231 172.31.29.138 -> 54.192.159.165 TCP 66 46162 > http [ACK] Seq=97 Ack=686974 Win=1070208 Len=0 TSval=8720723 TSecr=729738996
134   0.027315 54.192.159.165 -> 172.31.29.138 TCP 33746 [TCP segment of a reassembled PDU]
135   0.027348 172.31.29.138 -> 54.192.159.165 TCP 66 46162 > http [ACK] Seq=97 Ack=720654 Win=1051136 Len=0 TSval=8720723 TSecr=729738996
136   0.028442 54.192.159.165 -> 172.31.29.138 TCP 15994 [TCP segment of a reassembled PDU]
137   0.028453 172.31.29.138 -> 54.192.159.165 TCP 66 46162 > http [ACK] Seq=97 Ack=736582 Win=1082112 Len=0 TSval=8720723 TSecr=729738996
138   0.028574 54.192.159.165 -> 172.31.29.138 TCP 26130 [TCP segment of a reassembled PDU]
139   0.028613 54.192.159.165 -> 172.31.29.138 TCP 23609 [TCP segment of a reassembled PDU]
140   0.028620 54.192.159.165 -> 172.31.29.138 TCP 67 [TCP segment of a reassembled PDU]
141   0.028628 172.31.29.138 -> 54.192.159.165 TCP 66 46162 > http [ACK] Seq=97 Ack=762646 Win=1065472 Len=0 TSval=8720724 TSecr=729738996
142   0.028659 172.31.29.138 -> 54.192.159.165 TCP 66 46162 > http [ACK] Seq=97 Ack=786190 Win=1065344 Len=0 TSval=8720724 TSecr=729738996
143   0.029631 54.192.159.165 -> 172.31.29.138 TCP 8754 [TCP segment of a reassembled PDU]
144   0.029638 172.31.29.138 -> 54.192.159.165 TCP 66 46162 > http [ACK] Seq=97 Ack=794878 Win=1094016 Len=0 TSval=8720724 TSecr=729738996
145   0.029809 54.192.159.165 -> 172.31.29.138 TCP 26130 [TCP segment of a reassembled PDU]
146   0.029827 54.192.159.165 -> 172.31.29.138 TCP 8754 [TCP segment of a reassembled PDU]
147   0.029846 172.31.29.138 -> 54.192.159.165 TCP 66 46162 > http [ACK] Seq=97 Ack=829630 Win=1059328 Len=0 TSval=8720724 TSecr=729738996
148   0.029962 54.192.159.165 -> 172.31.29.138 TCP 18890 [TCP segment of a reassembled PDU]
149   0.029973 172.31.29.138 -> 54.192.159.165 TCP 66 46162 > http [ACK] Seq=97 Ack=848454 Win=1077376 Len=0 TSval=8720724 TSecr=729738996
150   0.029994 54.192.159.165 -> 172.31.29.138 TCP 3338 [TCP segment of a reassembled PDU]
151   0.030053 172.31.29.138 -> 54.192.159.165 TCP 66 46162 > http [ACK] Seq=97 Ack=851726 Win=1074176 Len=0 TSval=8720724 TSecr=729738996
152   0.030623 54.192.159.165 -> 172.31.29.138 TCP 2962 [TCP segment of a reassembled PDU]
153   0.030628 172.31.29.138 -> 54.192.159.165 TCP 66 46162 > http [ACK] Seq=97 Ack=854622 Win=1102336 Len=0 TSval=8720724 TSecr=729738996
154   0.030968 54.192.159.165 -> 172.31.29.138 TCP 10202 [TCP segment of a reassembled PDU]
155   0.030988 172.31.29.138 -> 54.192.159.165 TCP 66 46162 > http [ACK] Seq=97 Ack=864758 Win=1102336 Len=0 TSval=8720724 TSecr=729738996
156   0.031084 54.192.159.165 -> 172.31.29.138 TCP 26130 [TCP segment of a reassembled PDU]
157   0.031111 172.31.29.138 -> 54.192.159.165 TCP 66 46162 > http [ACK] Seq=97 Ack=890822 Win=1076352 Len=0 TSval=8720724 TSecr=729738996
158   0.031157 54.192.159.165 -> 172.31.29.138 TCP 18890 [TCP segment of a reassembled PDU]
159   0.031169 172.31.29.138 -> 54.192.159.165 TCP 66 46162 > http [ACK] Seq=97 Ack=909646 Win=1077376 Len=0 TSval=8720724 TSecr=729738996
160   0.031210 54.192.159.165 -> 172.31.29.138 TCP 1514 [TCP segment of a reassembled PDU]
161   0.031217 54.192.159.165 -> 172.31.29.138 TCP 6234 [TCP segment of a reassembled PDU]
162   0.031238 172.31.29.138 -> 54.192.159.165 TCP 66 46162 > http [ACK] Seq=97 Ack=917262 Win=1094016 Len=0 TSval=8720724 TSecr=729738996
163   0.031656 54.192.159.165 -> 172.31.29.138 TCP 4410 [TCP segment of a reassembled PDU]
164   0.031662 172.31.29.138 -> 54.192.159.165 TCP 66 46162 > http [ACK] Seq=97 Ack=921606 Win=1101184 Len=0 TSval=8720724 TSecr=729738996
165   0.031877 54.192.159.165 -> 172.31.29.138 TCP 26130 [TCP segment of a reassembled PDU]
166   0.031910 54.192.159.165 -> 172.31.29.138 TCP 23234 [TCP segment of a reassembled PDU]
167   0.031933 172.31.29.138 -> 54.192.159.165 TCP 66 46162 > http [ACK] Seq=97 Ack=970838 Win=1052032 Len=0 TSval=8720724 TSecr=729738996
168   0.031946 54.192.159.165 -> 172.31.29.138 TCP 2962 [TCP segment of a reassembled PDU]
169   0.031961 172.31.29.138 -> 54.192.159.165 TCP 66 46162 > http [ACK] Seq=97 Ack=973734 Win=1065344 Len=0 TSval=8720724 TSecr=729738996
170   0.032002 54.192.159.165 -> 172.31.29.138 TCP 9130 [TCP segment of a reassembled PDU]
171   0.032012 172.31.29.138 -> 54.192.159.165 TCP 66 46162 > http [ACK] Seq=97 Ack=982798 Win=1091712 Len=0 TSval=8720724 TSecr=729738996
172   0.032510 54.192.159.165 -> 172.31.29.138 TCP 5858 [TCP segment of a reassembled PDU]
173   0.032517 172.31.29.138 -> 54.192.159.165 TCP 66 46162 > http [ACK] Seq=97 Ack=988590 Win=1098752 Len=0 TSval=8720725 TSecr=729738996
174   0.032634 54.192.159.165 -> 172.31.29.138 TCP 26130 [TCP segment of a reassembled PDU]
175   0.032663 54.192.159.165 -> 172.31.29.138 TCP 17442 [TCP segment of a reassembled PDU]
176   0.032683 172.31.29.138 -> 54.192.159.165 TCP 66 46162 > http [ACK] Seq=97 Ack=1032030 Win=1055360 Len=0 TSval=8720725 TSecr=729738996
177   0.032703 54.192.159.165 -> 172.31.29.138 TCP 8754 [TCP segment of a reassembled PDU]
178   0.032717 172.31.29.138 -> 54.192.159.165 TCP 66 46162 > http [ACK] Seq=97 Ack=1040718 Win=1065344 Len=0 TSval=8720725 TSecr=729738996
179   0.032764 54.192.159.165 -> 172.31.29.138 HTTP 8382 HTTP/1.1 200 OK  (application/octet-stream)
180   0.032772 172.31.29.138 -> 54.192.159.165 TCP 66 46162 > http [ACK] Seq=97 Ack=1049034 Win=1094016 Len=0 TSval=8720725 TSecr=729738996
181   0.032915 172.31.29.138 -> 54.192.159.165 TCP 66 46162 > http [FIN, ACK] Seq=97 Ack=1049034 Win=1102336 Len=0 TSval=8720725 TSecr=729738996
182   0.033452 54.192.159.165 -> 172.31.29.138 TCP 66 http > 46162 [FIN, ACK] Seq=1049034 Ack=98 Win=14592 Len=0 TSval=729738996 TSecr=8720725
183   0.033460 172.31.29.138 -> 54.192.159.165 TCP 66 46162 > http [ACK] Seq=98 Ack=1049035 Win=1102336 Len=0 TSval=8720725 TSecr=729738996
