[Measurement for 1mb at 19:37:05 19.37.2014] 
Tshark:

  1   0.000000 172.31.29.138 -> 172.31.0.2   DNS 89 Standard query 0x8105  A d1dx94olpiqj0t.cloudfront.net
  2   0.000028 172.31.29.138 -> 172.31.0.2   DNS 89 Standard query 0xce21  AAAA d1dx94olpiqj0t.cloudfront.net
  3   0.000518   172.31.0.2 -> 172.31.29.138 DNS 217 Standard query response 0x8105  A 54.230.158.152 A 54.230.158.179 A 54.230.159.4 A 54.192.156.106 A 54.192.157.138 A 54.192.159.177 A 54.230.158.139 A 54.230.158.150
  4   0.000528   172.31.0.2 -> 172.31.29.138 DNS 176 Standard query response 0xce21 
  5   0.003867 172.31.29.138 -> 54.230.158.152 TCP 74 36880 > http [SYN] Seq=0 Win=26883 Len=0 MSS=8961 SACK_PERM=1 TSval=2424449 TSecr=0 WS=128
  6   0.004617 54.230.158.152 -> 172.31.29.138 TCP 74 http > 36880 [SYN, ACK] Seq=0 Ack=1 Win=14480 Len=0 MSS=1460 SACK_PERM=1 TSval=805171577 TSecr=2424449 WS=128
  7   0.004631 172.31.29.138 -> 54.230.158.152 TCP 66 36880 > http [ACK] Seq=1 Ack=1 Win=27008 Len=0 TSval=2424449 TSecr=805171577
  8   0.004679 172.31.29.138 -> 54.230.158.152 HTTP 162 GET /1mb HTTP/1.1 
  9   0.005366 54.230.158.152 -> 172.31.29.138 TCP 66 http > 36880 [ACK] Seq=1 Ack=97 Win=14592 Len=0 TSval=805171578 TSecr=2424449
 10   0.008801 54.230.158.152 -> 172.31.29.138 TCP 13098 [TCP segment of a reassembled PDU]
 11   0.008813 172.31.29.138 -> 54.230.158.152 TCP 66 36880 > http [ACK] Seq=97 Ack=13033 Win=52992 Len=0 TSval=2424450 TSecr=805171578
 12   0.009521 54.230.158.152 -> 172.31.29.138 TCP 4410 [TCP segment of a reassembled PDU]
 13   0.009529 172.31.29.138 -> 54.230.158.152 TCP 66 36880 > http [ACK] Seq=97 Ack=17377 Win=61696 Len=0 TSval=2424450 TSecr=805171578
 14   0.009556 54.230.158.152 -> 172.31.29.138 TCP 8754 [TCP segment of a reassembled PDU]
 15   0.009564 172.31.29.138 -> 54.230.158.152 TCP 66 36880 > http [ACK] Seq=97 Ack=26065 Win=79104 Len=0 TSval=2424450 TSecr=805171578
 16   0.010253 54.230.158.152 -> 172.31.29.138 TCP 4410 [TCP segment of a reassembled PDU]
 17   0.010259 172.31.29.138 -> 54.230.158.152 TCP 66 36880 > http [ACK] Seq=97 Ack=30409 Win=87808 Len=0 TSval=2424450 TSecr=805171578
 18   0.010361 54.230.158.152 -> 172.31.29.138 TCP 8754 [TCP segment of a reassembled PDU]
 19   0.010368 172.31.29.138 -> 54.230.158.152 TCP 66 36880 > http [ACK] Seq=97 Ack=39097 Win=103680 Len=0 TSval=2424450 TSecr=805171578
 20   0.011013 54.230.158.152 -> 172.31.29.138 TCP 4410 [TCP segment of a reassembled PDU]
 21   0.011018 172.31.29.138 -> 54.230.158.152 TCP 66 36880 > http [ACK] Seq=97 Ack=43441 Win=109056 Len=0 TSval=2424451 TSecr=805171578
 22   0.011053 54.230.158.152 -> 172.31.29.138 TCP 5858 [TCP segment of a reassembled PDU]
 23   0.011059 172.31.29.138 -> 54.230.158.152 TCP 66 36880 > http [ACK] Seq=97 Ack=49233 Win=120704 Len=0 TSval=2424451 TSecr=805171578
 24   0.011130 54.230.158.152 -> 172.31.29.138 TCP 11650 [TCP segment of a reassembled PDU]
 25   0.011138 172.31.29.138 -> 54.230.158.152 TCP 66 36880 > http [ACK] Seq=97 Ack=60817 Win=143872 Len=0 TSval=2424451 TSecr=805171578
 26   0.011825 54.230.158.152 -> 172.31.29.138 TCP 8754 [TCP segment of a reassembled PDU]
 27   0.011832 172.31.29.138 -> 54.230.158.152 TCP 66 36880 > http [ACK] Seq=97 Ack=69505 Win=161152 Len=0 TSval=2424451 TSecr=805171578
 28   0.011922 54.230.158.152 -> 172.31.29.138 TCP 17442 [TCP segment of a reassembled PDU]
 29   0.011934 172.31.29.138 -> 54.230.158.152 TCP 66 36880 > http [ACK] Seq=97 Ack=86881 Win=169600 Len=0 TSval=2424451 TSecr=805171578
 30   0.012580 54.230.158.152 -> 172.31.29.138 TCP 8754 [TCP segment of a reassembled PDU]
 31   0.012587 172.31.29.138 -> 54.230.158.152 TCP 66 36880 > http [ACK] Seq=97 Ack=95569 Win=183936 Len=0 TSval=2424451 TSecr=805171578
 32   0.012681 54.230.158.152 -> 172.31.29.138 TCP 20338 [TCP segment of a reassembled PDU]
 33   0.012692 172.31.29.138 -> 54.230.158.152 TCP 66 36880 > http [ACK] Seq=97 Ack=115841 Win=164864 Len=0 TSval=2424451 TSecr=805171578
 34   0.013342 54.230.158.152 -> 172.31.29.138 TCP 4410 [TCP segment of a reassembled PDU]
 35   0.013348 172.31.29.138 -> 54.230.158.152 TCP 66 36880 > http [ACK] Seq=97 Ack=120185 Win=191104 Len=0 TSval=2424451 TSecr=805171578
 36   0.013419 54.230.158.152 -> 172.31.29.138 TCP 10202 [TCP segment of a reassembled PDU]
 37   0.013427 172.31.29.138 -> 54.230.158.152 TCP 66 36880 > http [ACK] Seq=97 Ack=130321 Win=181632 Len=0 TSval=2424451 TSecr=805171578
 38   0.013478 54.230.158.152 -> 172.31.29.138 TCP 17442 [TCP segment of a reassembled PDU]
 39   0.013488 172.31.29.138 -> 54.230.158.152 TCP 66 36880 > http [ACK] Seq=97 Ack=147697 Win=164352 Len=0 TSval=2424451 TSecr=805171578
 40   0.014113 54.230.158.152 -> 172.31.29.138 TCP 4410 [TCP segment of a reassembled PDU]
 41   0.014120 172.31.29.138 -> 54.230.158.152 TCP 66 36880 > http [ACK] Seq=97 Ack=152041 Win=191104 Len=0 TSval=2424451 TSecr=805171578
 42   0.014249 54.230.158.152 -> 172.31.29.138 TCP 26130 [TCP segment of a reassembled PDU]
 43   0.014263 172.31.29.138 -> 54.230.158.152 TCP 66 36880 > http [ACK] Seq=97 Ack=178105 Win=165120 Len=0 TSval=2424451 TSecr=805171578
 44   0.014270 54.230.158.152 -> 172.31.29.138 TCP 4410 [TCP segment of a reassembled PDU]
 45   0.014274 172.31.29.138 -> 54.230.158.152 TCP 66 36880 > http [ACK] Seq=97 Ack=182449 Win=160896 Len=0 TSval=2424451 TSecr=805171578
 46   0.014866 54.230.158.152 -> 172.31.29.138 TCP 7306 [TCP segment of a reassembled PDU]
 47   0.014873 172.31.29.138 -> 54.230.158.152 TCP 66 36880 > http [ACK] Seq=97 Ack=189689 Win=186368 Len=0 TSval=2424452 TSecr=805171578
 48   0.015021 54.230.158.152 -> 172.31.29.138 TCP 18890 [TCP segment of a reassembled PDU]
 49   0.015030 172.31.29.138 -> 54.230.158.152 TCP 66 36880 > http [ACK] Seq=97 Ack=208513 Win=233600 Len=0 TSval=2424452 TSecr=805171578
 50   0.015041 54.230.158.152 -> 172.31.29.138 TCP 1514 [TCP segment of a reassembled PDU]
 51   0.015044 172.31.29.138 -> 54.230.158.152 TCP 66 36880 > http [ACK] Seq=97 Ack=209961 Win=236544 Len=0 TSval=2424452 TSecr=805171579
 52   0.015151 54.230.158.152 -> 172.31.29.138 TCP 13098 [TCP segment of a reassembled PDU]
 53   0.015160 172.31.29.138 -> 54.230.158.152 TCP 66 36880 > http [ACK] Seq=97 Ack=222993 Win=262528 Len=0 TSval=2424452 TSecr=805171579
 54   0.015625 54.230.158.152 -> 172.31.29.138 TCP 4410 [TCP segment of a reassembled PDU]
 55   0.015631 172.31.29.138 -> 54.230.158.152 TCP 66 36880 > http [ACK] Seq=97 Ack=227337 Win=271232 Len=0 TSval=2424452 TSecr=805171579
 56   0.015778 54.230.158.152 -> 172.31.29.138 TCP 18890 [TCP segment of a reassembled PDU]
 57   0.015789 172.31.29.138 -> 54.230.158.152 TCP 66 36880 > http [ACK] Seq=97 Ack=246161 Win=308864 Len=0 TSval=2424452 TSecr=805171579
 58   0.015796 54.230.158.152 -> 172.31.29.138 TCP 1514 [TCP Previous segment not captured] [TCP segment of a reassembled PDU]
 59   0.015799 172.31.29.138 -> 54.230.158.152 TCP 78 [TCP Window Update] 36880 > http [ACK] Seq=97 Ack=246161 Win=311808 Len=0 TSval=2424452 TSecr=805171579 SLE=247609 SRE=249057
 60   0.015801 54.230.158.152 -> 172.31.29.138 TCP 1514 [TCP Out-Of-Order] [TCP segment of a reassembled PDU]
 61   0.015804 172.31.29.138 -> 54.230.158.152 TCP 66 36880 > http [ACK] Seq=97 Ack=249057 Win=314624 Len=0 TSval=2424452 TSecr=805171579
 62   0.015918 54.230.158.152 -> 172.31.29.138 TCP 18890 [TCP segment of a reassembled PDU]
 63   0.015929 172.31.29.138 -> 54.230.158.152 TCP 66 36880 > http [ACK] Seq=97 Ack=267881 Win=352384 Len=0 TSval=2424452 TSecr=805171579
 64   0.016405 54.230.158.152 -> 172.31.29.138 TCP 8754 [TCP segment of a reassembled PDU]
 65   0.016413 172.31.29.138 -> 54.230.158.152 TCP 66 36880 > http [ACK] Seq=97 Ack=276569 Win=369664 Len=0 TSval=2424452 TSecr=805171579
 66   0.016570 54.230.158.152 -> 172.31.29.138 TCP 21786 [TCP segment of a reassembled PDU]
 67   0.016582 172.31.29.138 -> 54.230.158.152 TCP 66 36880 > http [ACK] Seq=97 Ack=298289 Win=413184 Len=0 TSval=2424452 TSecr=805171579
 68   0.016797 54.230.158.152 -> 172.31.29.138 TCP 21786 [TCP segment of a reassembled PDU]
 69   0.016809 172.31.29.138 -> 54.230.158.152 TCP 66 36880 > http [ACK] Seq=97 Ack=320009 Win=456576 Len=0 TSval=2424452 TSecr=805171579
 70   0.017431 54.230.158.152 -> 172.31.29.138 TCP 10202 [TCP segment of a reassembled PDU]
 71   0.017439 172.31.29.138 -> 54.230.158.152 TCP 66 36880 > http [ACK] Seq=97 Ack=330145 Win=476800 Len=0 TSval=2424452 TSecr=805171579
 72   0.017599 54.230.158.152 -> 172.31.29.138 TCP 26130 [TCP segment of a reassembled PDU]
 73   0.017612 172.31.29.138 -> 54.230.158.152 TCP 66 36880 > http [ACK] Seq=97 Ack=356209 Win=529024 Len=0 TSval=2424452 TSecr=805171579
 74   0.017634 54.230.158.152 -> 172.31.29.138 TCP 20338 [TCP segment of a reassembled PDU]
 75   0.017643 172.31.29.138 -> 54.230.158.152 TCP 66 36880 > http [ACK] Seq=97 Ack=376481 Win=569472 Len=0 TSval=2424452 TSecr=805171579
 76   0.018443 54.230.158.152 -> 172.31.29.138 TCP 1514 [TCP segment of a reassembled PDU]
 77   0.018448 172.31.29.138 -> 54.230.158.152 TCP 66 36880 > http [ACK] Seq=97 Ack=377929 Win=572416 Len=0 TSval=2424452 TSecr=805171579
 78   0.018629 54.230.158.152 -> 172.31.29.138 TCP 20338 [TCP segment of a reassembled PDU]
 79   0.018638 172.31.29.138 -> 54.230.158.152 TCP 66 36880 > http [ACK] Seq=97 Ack=398201 Win=612992 Len=0 TSval=2424453 TSecr=805171579
 80   0.018713 54.230.158.152 -> 172.31.29.138 TCP 26130 [TCP segment of a reassembled PDU]
 81   0.018726 172.31.29.138 -> 54.230.158.152 TCP 66 36880 > http [ACK] Seq=97 Ack=424265 Win=665088 Len=0 TSval=2424453 TSecr=805171579
 82   0.018761 54.230.158.152 -> 172.31.29.138 TCP 13098 [TCP segment of a reassembled PDU]
 83   0.018772 172.31.29.138 -> 54.230.158.152 TCP 66 36880 > http [ACK] Seq=97 Ack=437297 Win=691200 Len=0 TSval=2424453 TSecr=805171579
 84   0.019469 54.230.158.152 -> 172.31.29.138 TCP 8754 [TCP segment of a reassembled PDU]
 85   0.019477 172.31.29.138 -> 54.230.158.152 TCP 66 36880 > http [ACK] Seq=97 Ack=445985 Win=708480 Len=0 TSval=2424453 TSecr=805171579
 86   0.019632 54.230.158.152 -> 172.31.29.138 TCP 26130 [TCP segment of a reassembled PDU]
 87   0.019645 172.31.29.138 -> 54.230.158.152 TCP 66 36880 > http [ACK] Seq=97 Ack=472049 Win=760704 Len=0 TSval=2424453 TSecr=805171579
 88   0.019664 54.230.158.152 -> 172.31.29.138 TCP 17442 [TCP segment of a reassembled PDU]
 89   0.019672 172.31.29.138 -> 54.230.158.152 TCP 66 36880 > http [ACK] Seq=97 Ack=489425 Win=795392 Len=0 TSval=2424453 TSecr=805171579
 90   0.020055 54.230.158.152 -> 172.31.29.138 TCP 4410 [TCP segment of a reassembled PDU]
 91   0.020062 172.31.29.138 -> 54.230.158.152 TCP 66 36880 > http [ACK] Seq=97 Ack=493769 Win=804096 Len=0 TSval=2424453 TSecr=805171579
 92   0.020241 54.230.158.152 -> 172.31.29.138 TCP 26130 [TCP segment of a reassembled PDU]
 93   0.020255 172.31.29.138 -> 54.230.158.152 TCP 66 36880 > http [ACK] Seq=97 Ack=519833 Win=831232 Len=0 TSval=2424453 TSecr=805171579
 94   0.020265 54.230.158.152 -> 172.31.29.138 TCP 8754 [TCP segment of a reassembled PDU]
 95   0.020273 172.31.29.138 -> 54.230.158.152 TCP 66 36880 > http [ACK] Seq=97 Ack=528521 Win=822656 Len=0 TSval=2424453 TSecr=805171579
 96   0.020462 54.230.158.152 -> 172.31.29.138 TCP 26130 [TCP segment of a reassembled PDU]
 97   0.020475 172.31.29.138 -> 54.230.158.152 TCP 66 36880 > http [ACK] Seq=97 Ack=554585 Win=831232 Len=0 TSval=2424453 TSecr=805171579
 98   0.020485 54.230.158.152 -> 172.31.29.138 TCP 5858 [TCP segment of a reassembled PDU]
 99   0.020488 172.31.29.138 -> 54.230.158.152 TCP 66 36880 > http [ACK] Seq=97 Ack=560377 Win=825472 Len=0 TSval=2424453 TSecr=805171579
100   0.020841 54.230.158.152 -> 172.31.29.138 TCP 7306 [TCP segment of a reassembled PDU]
101   0.020848 172.31.29.138 -> 54.230.158.152 TCP 66 36880 > http [ACK] Seq=97 Ack=567617 Win=862080 Len=0 TSval=2424453 TSecr=805171579
102   0.021010 54.230.158.152 -> 172.31.29.138 TCP 26130 [TCP segment of a reassembled PDU]
103   0.021023 172.31.29.138 -> 54.230.158.152 TCP 66 36880 > http [ACK] Seq=97 Ack=593681 Win=836096 Len=0 TSval=2424453 TSecr=805171579
104   0.021141 54.230.158.152 -> 172.31.29.138 TCP 26130 [TCP segment of a reassembled PDU]
105   0.021155 172.31.29.138 -> 54.230.158.152 TCP 66 36880 > http [ACK] Seq=97 Ack=619745 Win=831232 Len=0 TSval=2424453 TSecr=805171579
106   0.021167 54.230.158.152 -> 172.31.29.138 TCP 11650 [TCP segment of a reassembled PDU]
107   0.021176 172.31.29.138 -> 54.230.158.152 TCP 66 36880 > http [ACK] Seq=97 Ack=631329 Win=819712 Len=0 TSval=2424453 TSecr=805171579
108   0.021622 54.230.158.152 -> 172.31.29.138 TCP 4410 [TCP segment of a reassembled PDU]
109   0.021629 172.31.29.138 -> 54.230.158.152 TCP 66 36880 > http [ACK] Seq=97 Ack=635673 Win=866816 Len=0 TSval=2424453 TSecr=805171579
110   0.021801 54.230.158.152 -> 172.31.29.138 TCP 26130 [TCP segment of a reassembled PDU]
111   0.021815 172.31.29.138 -> 54.230.158.152 TCP 66 36880 > http [ACK] Seq=97 Ack=661737 Win=840832 Len=0 TSval=2424453 TSecr=805171579
112   0.021857 54.230.158.152 -> 172.31.29.138 TCP 20338 [TCP segment of a reassembled PDU]
113   0.021868 172.31.29.138 -> 54.230.158.152 TCP 66 36880 > http [ACK] Seq=97 Ack=682009 Win=820608 Len=0 TSval=2424453 TSecr=805171579
114   0.021882 54.230.158.152 -> 172.31.29.138 TCP 5858 [TCP segment of a reassembled PDU]
115   0.021886 172.31.29.138 -> 54.230.158.152 TCP 66 36880 > http [ACK] Seq=97 Ack=687801 Win=814848 Len=0 TSval=2424453 TSecr=805171579
116   0.021935 54.230.158.152 -> 172.31.29.138 TCP 14546 [TCP segment of a reassembled PDU]
117   0.021944 172.31.29.138 -> 54.230.158.152 TCP 66 36880 > http [ACK] Seq=97 Ack=702281 Win=840576 Len=0 TSval=2424453 TSecr=805171579
118   0.022348 54.230.158.152 -> 172.31.29.138 TCP 4410 [TCP segment of a reassembled PDU]
119   0.022354 172.31.29.138 -> 54.230.158.152 TCP 66 36880 > http [ACK] Seq=97 Ack=706625 Win=866816 Len=0 TSval=2424453 TSecr=805171579
120   0.022556 54.230.158.152 -> 172.31.29.138 TCP 26130 [TCP segment of a reassembled PDU]
121   0.022569 172.31.29.138 -> 54.230.158.152 TCP 66 36880 > http [ACK] Seq=97 Ack=732689 Win=840832 Len=0 TSval=2424453 TSecr=805171579
122   0.022582 54.230.158.152 -> 172.31.29.138 TCP 11650 [TCP segment of a reassembled PDU]
123   0.022587 172.31.29.138 -> 54.230.158.152 TCP 66 36880 > http [ACK] Seq=97 Ack=744273 Win=829312 Len=0 TSval=2424453 TSecr=805171579
124   0.022610 54.230.158.152 -> 172.31.29.138 TCP 14546 [TCP segment of a reassembled PDU]
125   0.022618 172.31.29.138 -> 54.230.158.152 TCP 66 36880 > http [ACK] Seq=97 Ack=758753 Win=814848 Len=0 TSval=2424454 TSecr=805171579
126   0.022708 54.230.158.152 -> 172.31.29.138 TCP 30474 [TCP segment of a reassembled PDU]
127   0.022722 172.31.29.138 -> 54.230.158.152 TCP 66 36880 > http [ACK] Seq=97 Ack=789161 Win=931584 Len=0 TSval=2424454 TSecr=805171579
128   0.023120 54.230.158.152 -> 172.31.29.138 TCP 7306 [TCP segment of a reassembled PDU]
129   0.023127 172.31.29.138 -> 54.230.158.152 TCP 66 36880 > http [ACK] Seq=97 Ack=796401 Win=946048 Len=0 TSval=2424454 TSecr=805171579
130   0.023295 54.230.158.152 -> 172.31.29.138 TCP 27578 [TCP segment of a reassembled PDU]
131   0.023309 172.31.29.138 -> 54.230.158.152 TCP 66 36880 > http [ACK] Seq=97 Ack=823913 Win=1001088 Len=0 TSval=2424454 TSecr=805171579
132   0.023316 54.230.158.152 -> 172.31.29.138 TCP 2962 [TCP segment of a reassembled PDU]
133   0.023319 172.31.29.138 -> 54.230.158.152 TCP 66 36880 > http [ACK] Seq=97 Ack=826809 Win=1006848 Len=0 TSval=2424454 TSecr=805171579
134   0.023381 54.230.158.152 -> 172.31.29.138 TCP 24682 [TCP segment of a reassembled PDU]
135   0.023397 172.31.29.138 -> 54.230.158.152 TCP 66 36880 > http [ACK] Seq=97 Ack=851425 Win=1056000 Len=0 TSval=2424454 TSecr=805171579
136   0.023423 54.230.158.152 -> 172.31.29.138 TCP 2962 [TCP segment of a reassembled PDU]
137   0.023427 172.31.29.138 -> 54.230.158.152 TCP 66 36880 > http [ACK] Seq=97 Ack=854321 Win=1061888 Len=0 TSval=2424454 TSecr=805171579
138   0.023501 54.230.158.152 -> 172.31.29.138 TCP 33370 [TCP segment of a reassembled PDU]
139   0.023516 172.31.29.138 -> 54.230.158.152 TCP 66 36880 > http [ACK] Seq=97 Ack=887625 Win=1128448 Len=0 TSval=2424454 TSecr=805171579
140   0.023893 54.230.158.152 -> 172.31.29.138 TCP 7306 [TCP segment of a reassembled PDU]
141   0.023900 172.31.29.138 -> 54.230.158.152 TCP 66 36880 > http [ACK] Seq=97 Ack=894865 Win=1142912 Len=0 TSval=2424454 TSecr=805171579
142   0.024057 54.230.158.152 -> 172.31.29.138 TCP 18890 [TCP segment of a reassembled PDU]
143   0.024068 172.31.29.138 -> 54.230.158.152 TCP 66 36880 > http [ACK] Seq=97 Ack=913689 Win=1180544 Len=0 TSval=2424454 TSecr=805171579
144   0.024076 54.230.158.152 -> 172.31.29.138 TCP 4410 [TCP segment of a reassembled PDU]
145   0.024083 172.31.29.138 -> 54.230.158.152 TCP 66 36880 > http [ACK] Seq=97 Ack=918033 Win=1189248 Len=0 TSval=2424454 TSecr=805171579
146   0.024088 54.230.158.152 -> 172.31.29.138 TCP 2962 [TCP segment of a reassembled PDU]
147   0.024092 172.31.29.138 -> 54.230.158.152 TCP 66 36880 > http [ACK] Seq=97 Ack=920929 Win=1195008 Len=0 TSval=2424454 TSecr=805171579
148   0.024184 54.230.158.152 -> 172.31.29.138 TCP 43506 [TCP segment of a reassembled PDU]
149   0.024203 172.31.29.138 -> 54.230.158.152 TCP 66 36880 > http [ACK] Seq=97 Ack=964369 Win=1281920 Len=0 TSval=2424454 TSecr=805171579
150   0.024297 54.230.158.152 -> 172.31.29.138 TCP 20338 [TCP segment of a reassembled PDU]
151   0.024307 172.31.29.138 -> 54.230.158.152 TCP 66 36880 > http [ACK] Seq=97 Ack=984641 Win=1322496 Len=0 TSval=2424454 TSecr=805171579
152   0.024663 54.230.158.152 -> 172.31.29.138 TCP 2962 [TCP segment of a reassembled PDU]
153   0.024669 172.31.29.138 -> 54.230.158.152 TCP 66 36880 > http [ACK] Seq=97 Ack=987537 Win=1328256 Len=0 TSval=2424454 TSecr=805171579
154   0.024877 54.230.158.152 -> 172.31.29.138 TCP 26130 [TCP segment of a reassembled PDU]
155   0.024891 172.31.29.138 -> 54.230.158.152 TCP 66 36880 > http [ACK] Seq=97 Ack=1013601 Win=1380352 Len=0 TSval=2424454 TSecr=805171579
156   0.024906 54.230.158.152 -> 172.31.29.138 TCP 13098 [TCP segment of a reassembled PDU]
157   0.024912 172.31.29.138 -> 54.230.158.152 TCP 66 36880 > http [ACK] Seq=97 Ack=1026633 Win=1406464 Len=0 TSval=2424454 TSecr=805171579
158   0.024929 54.230.158.152 -> 172.31.29.138 TCP 13098 [TCP segment of a reassembled PDU]
159   0.024934 172.31.29.138 -> 54.230.158.152 TCP 66 36880 > http [ACK] Seq=97 Ack=1039665 Win=1432576 Len=0 TSval=2424454 TSecr=805171579
160   0.024964 54.230.158.152 -> 172.31.29.138 HTTP 9434 HTTP/1.1 200 OK  (application/octet-stream)
161   0.024976 172.31.29.138 -> 54.230.158.152 TCP 66 36880 > http [ACK] Seq=97 Ack=1049033 Win=1451264 Len=0 TSval=2424454 TSecr=805171579
162   0.025102 172.31.29.138 -> 54.230.158.152 TCP 66 36880 > http [FIN, ACK] Seq=97 Ack=1049033 Win=1451264 Len=0 TSval=2424454 TSecr=805171579
163   0.025653 54.230.158.152 -> 172.31.29.138 TCP 66 http > 36880 [FIN, ACK] Seq=1049033 Ack=98 Win=14592 Len=0 TSval=805171580 TSecr=2424454
164   0.025659 172.31.29.138 -> 54.230.158.152 TCP 66 36880 > http [ACK] Seq=98 Ack=1049034 Win=1451264 Len=0 TSval=2424454 TSecr=805171580
