[Measurement for 1mb at 07:36:51 20.36.2014] 
Tshark:

  1   0.000000 172.31.29.138 -> 172.31.0.2   DNS 89 Standard query 0x98d8  A d1dx94olpiqj0t.cloudfront.net
  2   0.000040 172.31.29.138 -> 172.31.0.2   DNS 89 Standard query 0x7ea6  AAAA d1dx94olpiqj0t.cloudfront.net
  3   0.000503   172.31.0.2 -> 172.31.29.138 DNS 217 Standard query response 0x98d8  A 54.192.159.158 A 54.192.159.162 A 54.230.158.142 A 54.230.158.205 A 54.230.159.141 A 54.192.157.136 A 54.192.157.155 A 54.192.157.156
  4   0.000547   172.31.0.2 -> 172.31.29.138 DNS 176 Standard query response 0x7ea6 
  5   0.003874 172.31.29.138 -> 54.192.159.158 TCP 74 60997 > http [SYN] Seq=0 Win=26883 Len=0 MSS=8961 SACK_PERM=1 TSval=13220965 TSecr=0 WS=128
  6   0.004597 54.192.159.158 -> 172.31.29.138 TCP 74 http > 60997 [SYN, ACK] Seq=0 Ack=1 Win=14480 Len=0 MSS=1460 SACK_PERM=1 TSval=834416306 TSecr=13220965 WS=128
  7   0.004612 172.31.29.138 -> 54.192.159.158 TCP 66 60997 > http [ACK] Seq=1 Ack=1 Win=27008 Len=0 TSval=13220965 TSecr=834416306
  8   0.004668 172.31.29.138 -> 54.192.159.158 HTTP 162 GET /1mb HTTP/1.1 
  9   0.005339 54.192.159.158 -> 172.31.29.138 TCP 66 http > 60997 [ACK] Seq=1 Ack=97 Win=14592 Len=0 TSval=834416306 TSecr=13220965
 10   0.009272 54.192.159.158 -> 172.31.29.138 TCP 13098 [TCP segment of a reassembled PDU]
 11   0.009286 172.31.29.138 -> 54.192.159.158 TCP 66 60997 > http [ACK] Seq=97 Ack=13033 Win=52992 Len=0 TSval=13220966 TSecr=834416306
 12   0.010059 54.192.159.158 -> 172.31.29.138 TCP 13098 [TCP segment of a reassembled PDU]
 13   0.010069 172.31.29.138 -> 54.192.159.158 TCP 66 60997 > http [ACK] Seq=97 Ack=26065 Win=79104 Len=0 TSval=13220966 TSecr=834416306
 14   0.010837 54.192.159.158 -> 172.31.29.138 TCP 13098 [TCP segment of a reassembled PDU]
 15   0.010847 172.31.29.138 -> 54.192.159.158 TCP 66 60997 > http [ACK] Seq=97 Ack=39097 Win=96512 Len=0 TSval=13220967 TSecr=834416306
 16   0.011513 54.192.159.158 -> 172.31.29.138 TCP 7306 [TCP segment of a reassembled PDU]
 17   0.011519 172.31.29.138 -> 54.192.159.158 TCP 66 60997 > http [ACK] Seq=97 Ack=46337 Win=105984 Len=0 TSval=13220967 TSecr=834416307
 18   0.011549 54.192.159.158 -> 172.31.29.138 TCP 5858 [TCP segment of a reassembled PDU]
 19   0.011555 172.31.29.138 -> 54.192.159.158 TCP 66 60997 > http [ACK] Seq=97 Ack=52129 Win=108416 Len=0 TSval=13220967 TSecr=834416307
 20   0.012281 54.192.159.158 -> 172.31.29.138 TCP 8754 [TCP segment of a reassembled PDU]
 21   0.012288 172.31.29.138 -> 54.192.159.158 TCP 66 60997 > http [ACK] Seq=97 Ack=60817 Win=103680 Len=0 TSval=13220967 TSecr=834416307
 22   0.012369 54.192.159.158 -> 172.31.29.138 TCP 13098 [TCP segment of a reassembled PDU]
 23   0.012377 172.31.29.138 -> 54.192.159.158 TCP 66 60997 > http [ACK] Seq=97 Ack=73849 Win=96512 Len=0 TSval=13220967 TSecr=834416307
 24   0.013088 54.192.159.158 -> 172.31.29.138 TCP 2962 [TCP segment of a reassembled PDU]
 25   0.013094 172.31.29.138 -> 54.192.159.158 TCP 66 60997 > http [ACK] Seq=97 Ack=76745 Win=109056 Len=0 TSval=13220967 TSecr=834416307
 26   0.013239 54.192.159.158 -> 172.31.29.138 TCP 21786 [TCP segment of a reassembled PDU]
 27   0.013251 172.31.29.138 -> 54.192.159.158 TCP 66 60997 > http [ACK] Seq=97 Ack=98465 Win=87424 Len=0 TSval=13220967 TSecr=834416307
 28   0.013829 54.192.159.158 -> 172.31.29.138 TCP 4410 [TCP segment of a reassembled PDU]
 29   0.013835 172.31.29.138 -> 54.192.159.158 TCP 66 60997 > http [ACK] Seq=97 Ack=102809 Win=109056 Len=0 TSval=13220967 TSecr=834416307
 30   0.013973 54.192.159.158 -> 172.31.29.138 TCP 20338 [TCP segment of a reassembled PDU]
 31   0.013984 172.31.29.138 -> 54.192.159.158 TCP 66 60997 > http [ACK] Seq=97 Ack=123081 Win=88832 Len=0 TSval=13220967 TSecr=834416307
 32   0.013995 54.192.159.158 -> 172.31.29.138 TCP 2962 [TCP segment of a reassembled PDU]
 33   0.014012 172.31.29.138 -> 54.192.159.158 TCP 66 60997 > http [ACK] Seq=97 Ack=125977 Win=86016 Len=0 TSval=13220967 TSecr=834416307
 34   0.014390 54.192.159.158 -> 172.31.29.138 TCP 4410 [TCP segment of a reassembled PDU]
 35   0.014397 172.31.29.138 -> 54.192.159.158 TCP 66 60997 > http [ACK] Seq=97 Ack=130321 Win=109056 Len=0 TSval=13220967 TSecr=834416307
 36   0.014745 54.192.159.158 -> 172.31.29.138 TCP 26130 [TCP segment of a reassembled PDU]
 37   0.014769 172.31.29.138 -> 54.192.159.158 TCP 66 60997 > http [ACK] Seq=97 Ack=156385 Win=109056 Len=0 TSval=13220968 TSecr=834416307
 38   0.015347 54.192.159.158 -> 172.31.29.138 TCP 7306 [TCP segment of a reassembled PDU]
 39   0.015354 172.31.29.138 -> 54.192.159.158 TCP 66 60997 > http [ACK] Seq=97 Ack=163625 Win=123520 Len=0 TSval=13220968 TSecr=834416307
 40   0.015493 54.192.159.158 -> 172.31.29.138 TCP 18890 [TCP segment of a reassembled PDU]
 41   0.015504 172.31.29.138 -> 54.192.159.158 TCP 66 60997 > http [ACK] Seq=97 Ack=182449 Win=161152 Len=0 TSval=13220968 TSecr=834416307
 42   0.015900 54.192.159.158 -> 172.31.29.138 TCP 5858 [TCP segment of a reassembled PDU]
 43   0.015906 172.31.29.138 -> 54.192.159.158 TCP 66 60997 > http [ACK] Seq=97 Ack=188241 Win=172800 Len=0 TSval=13220968 TSecr=834416307
 44   0.016031 54.192.159.158 -> 172.31.29.138 TCP 11650 [TCP segment of a reassembled PDU]
 45   0.016039 172.31.29.138 -> 54.192.159.158 TCP 66 60997 > http [ACK] Seq=97 Ack=199825 Win=195968 Len=0 TSval=13220968 TSecr=834416307
 46   0.016136 54.192.159.158 -> 172.31.29.138 TCP 8754 [TCP segment of a reassembled PDU]
 47   0.016143 172.31.29.138 -> 54.192.159.158 TCP 66 60997 > http [ACK] Seq=97 Ack=208513 Win=213376 Len=0 TSval=13220968 TSecr=834416307
 48   0.016275 54.192.159.158 -> 172.31.29.138 TCP 11650 [TCP segment of a reassembled PDU]
 49   0.016283 172.31.29.138 -> 54.192.159.158 TCP 66 60997 > http [ACK] Seq=97 Ack=220097 Win=236544 Len=0 TSval=13220968 TSecr=834416307
 50   0.016347 54.192.159.158 -> 172.31.29.138 TCP 1514 [TCP segment of a reassembled PDU]
 51   0.016352 172.31.29.138 -> 54.192.159.158 TCP 66 60997 > http [ACK] Seq=97 Ack=221545 Win=239360 Len=0 TSval=13220968 TSecr=834416307
 52   0.016643 54.192.159.158 -> 172.31.29.138 TCP 4410 [TCP segment of a reassembled PDU]
 53   0.016649 172.31.29.138 -> 54.192.159.158 TCP 66 60997 > http [ACK] Seq=97 Ack=225889 Win=248064 Len=0 TSval=13220968 TSecr=834416307
 54   0.016770 54.192.159.158 -> 172.31.29.138 TCP 14546 [TCP segment of a reassembled PDU]
 55   0.016780 172.31.29.138 -> 54.192.159.158 TCP 66 60997 > http [ACK] Seq=97 Ack=240369 Win=276992 Len=0 TSval=13220968 TSecr=834416307
 56   0.017151 54.192.159.158 -> 172.31.29.138 TCP 8754 [TCP segment of a reassembled PDU]
 57   0.017158 172.31.29.138 -> 54.192.159.158 TCP 66 60997 > http [ACK] Seq=97 Ack=249057 Win=294400 Len=0 TSval=13220968 TSecr=834416307
 58   0.017268 54.192.159.158 -> 172.31.29.138 TCP 14546 [TCP segment of a reassembled PDU]
 59   0.017278 172.31.29.138 -> 54.192.159.158 TCP 66 60997 > http [ACK] Seq=97 Ack=263537 Win=323328 Len=0 TSval=13220968 TSecr=834416307
 60   0.017471 54.192.159.158 -> 172.31.29.138 TCP 11650 [TCP segment of a reassembled PDU]
 61   0.017480 172.31.29.138 -> 54.192.159.158 TCP 66 60997 > http [ACK] Seq=97 Ack=275121 Win=346496 Len=0 TSval=13220968 TSecr=834416307
 62   0.017768 54.192.159.158 -> 172.31.29.138 TCP 23234 [TCP segment of a reassembled PDU]
 63   0.017790 172.31.29.138 -> 54.192.159.158 TCP 66 60997 > http [ACK] Seq=97 Ack=298289 Win=392832 Len=0 TSval=13220968 TSecr=834416307
 64   0.018184 54.192.159.158 -> 172.31.29.138 TCP 1514 [TCP segment of a reassembled PDU]
 65   0.018190 172.31.29.138 -> 54.192.159.158 TCP 66 60997 > http [ACK] Seq=97 Ack=299737 Win=395776 Len=0 TSval=13220968 TSecr=834416307
 66   0.018395 54.192.159.158 -> 172.31.29.138 TCP 26130 [TCP segment of a reassembled PDU]
 67   0.018408 172.31.29.138 -> 54.192.159.158 TCP 66 60997 > http [ACK] Seq=97 Ack=325801 Win=447872 Len=0 TSval=13220968 TSecr=834416307
 68   0.018414 54.192.159.158 -> 172.31.29.138 TCP 1514 [TCP segment of a reassembled PDU]
 69   0.018430 172.31.29.138 -> 54.192.159.158 TCP 66 60997 > http [ACK] Seq=97 Ack=327249 Win=450816 Len=0 TSval=13220968 TSecr=834416307
 70   0.018617 54.192.159.158 -> 172.31.29.138 TCP 24682 [TCP segment of a reassembled PDU]
 71   0.018630 172.31.29.138 -> 54.192.159.158 TCP 66 60997 > http [ACK] Seq=97 Ack=351865 Win=499968 Len=0 TSval=13220968 TSecr=834416307
 72   0.018959 54.192.159.158 -> 172.31.29.138 TCP 2962 [TCP segment of a reassembled PDU]
 73   0.018964 172.31.29.138 -> 54.192.159.158 TCP 66 60997 > http [ACK] Seq=97 Ack=354761 Win=505856 Len=0 TSval=13220969 TSecr=834416307
 74   0.019106 54.192.159.158 -> 172.31.29.138 TCP 27578 [TCP segment of a reassembled PDU]
 75   0.019119 172.31.29.138 -> 54.192.159.158 TCP 66 60997 > http [ACK] Seq=97 Ack=382273 Win=560896 Len=0 TSval=13220969 TSecr=834416307
 76   0.019337 54.192.159.158 -> 172.31.29.138 TCP 29026 [TCP segment of a reassembled PDU]
 77   0.019352 172.31.29.138 -> 54.192.159.158 TCP 66 60997 > http [ACK] Seq=97 Ack=411233 Win=618752 Len=0 TSval=13220969 TSecr=834416307
 78   0.019706 54.192.159.158 -> 172.31.29.138 TCP 4410 [TCP segment of a reassembled PDU]
 79   0.019712 172.31.29.138 -> 54.192.159.158 TCP 66 60997 > http [ACK] Seq=97 Ack=415577 Win=627456 Len=0 TSval=13220969 TSecr=834416307
 80   0.019881 54.192.159.158 -> 172.31.29.138 TCP 20338 [TCP segment of a reassembled PDU]
 81   0.019892 172.31.29.138 -> 54.192.159.158 TCP 66 60997 > http [ACK] Seq=97 Ack=435849 Win=668032 Len=0 TSval=13220969 TSecr=834416307
 82   0.019968 54.192.159.158 -> 172.31.29.138 TCP 4410 [TCP segment of a reassembled PDU]
 83   0.019974 172.31.29.138 -> 54.192.159.158 TCP 66 60997 > http [ACK] Seq=97 Ack=440193 Win=676736 Len=0 TSval=13220969 TSecr=834416307
 84   0.020158 54.192.159.158 -> 172.31.29.138 TCP 26130 [TCP segment of a reassembled PDU]
 85   0.020171 172.31.29.138 -> 54.192.159.158 TCP 66 60997 > http [ACK] Seq=97 Ack=466257 Win=728832 Len=0 TSval=13220969 TSecr=834416307
 86   0.020182 54.192.159.158 -> 172.31.29.138 TCP 8754 [TCP segment of a reassembled PDU]
 87   0.020186 172.31.29.138 -> 54.192.159.158 TCP 66 60997 > http [ACK] Seq=97 Ack=474945 Win=746240 Len=0 TSval=13220969 TSecr=834416307
 88   0.020550 54.192.159.158 -> 172.31.29.138 TCP 14546 [TCP segment of a reassembled PDU]
 89   0.020559 172.31.29.138 -> 54.192.159.158 TCP 66 60997 > http [ACK] Seq=97 Ack=489425 Win=775168 Len=0 TSval=13220969 TSecr=834416307
 90   0.020858 54.192.159.158 -> 172.31.29.138 TCP 26130 [TCP segment of a reassembled PDU]
 91   0.020872 172.31.29.138 -> 54.192.159.158 TCP 66 60997 > http [ACK] Seq=97 Ack=515489 Win=827264 Len=0 TSval=13220969 TSecr=834416307
 92   0.020886 54.192.159.158 -> 172.31.29.138 TCP 13098 [TCP segment of a reassembled PDU]
 93   0.020892 172.31.29.138 -> 54.192.159.158 TCP 66 60997 > http [ACK] Seq=97 Ack=528521 Win=853376 Len=0 TSval=13220969 TSecr=834416307
 94   0.020908 54.192.159.158 -> 172.31.29.138 TCP 13098 [TCP segment of a reassembled PDU]
 95   0.020915 172.31.29.138 -> 54.192.159.158 TCP 66 60997 > http [ACK] Seq=97 Ack=541553 Win=879360 Len=0 TSval=13220969 TSecr=834416307
 96   0.020929 54.192.159.158 -> 172.31.29.138 TCP 1514 [TCP segment of a reassembled PDU]
 97   0.020932 172.31.29.138 -> 54.192.159.158 TCP 66 60997 > http [ACK] Seq=97 Ack=543001 Win=882304 Len=0 TSval=13220969 TSecr=834416307
 98   0.021518 54.192.159.158 -> 172.31.29.138 TCP 4410 [TCP segment of a reassembled PDU]
 99   0.021525 172.31.29.138 -> 54.192.159.158 TCP 66 60997 > http [ACK] Seq=97 Ack=547345 Win=891008 Len=0 TSval=13220969 TSecr=834416308
100   0.021726 54.192.159.158 -> 172.31.29.138 TCP 26130 [TCP segment of a reassembled PDU]
101   0.021739 172.31.29.138 -> 54.192.159.158 TCP 66 60997 > http [ACK] Seq=97 Ack=573409 Win=943104 Len=0 TSval=13220969 TSecr=834416308
102   0.021747 54.192.159.158 -> 172.31.29.138 TCP 4410 [TCP segment of a reassembled PDU]
103   0.021751 172.31.29.138 -> 54.192.159.158 TCP 66 60997 > http [ACK] Seq=97 Ack=577753 Win=951808 Len=0 TSval=13220969 TSecr=834416308
104   0.021788 54.192.159.158 -> 172.31.29.138 TCP 21786 [TCP segment of a reassembled PDU]
105   0.021800 172.31.29.138 -> 54.192.159.158 TCP 66 60997 > http [ACK] Seq=97 Ack=599473 Win=995200 Len=0 TSval=13220969 TSecr=834416308
106   0.021851 54.192.159.158 -> 172.31.29.138 TCP 8754 [TCP segment of a reassembled PDU]
107   0.021859 172.31.29.138 -> 54.192.159.158 TCP 66 60997 > http [ACK] Seq=97 Ack=608161 Win=1012608 Len=0 TSval=13220969 TSecr=834416308
108   0.022273 54.192.159.158 -> 172.31.29.138 TCP 4410 [TCP segment of a reassembled PDU]
109   0.022279 172.31.29.138 -> 54.192.159.158 TCP 66 60997 > http [ACK] Seq=97 Ack=612505 Win=1021312 Len=0 TSval=13220969 TSecr=834416308
110   0.022461 54.192.159.158 -> 172.31.29.138 TCP 23234 [TCP segment of a reassembled PDU]
111   0.022473 172.31.29.138 -> 54.192.159.158 TCP 66 60997 > http [ACK] Seq=97 Ack=635673 Win=1043200 Len=0 TSval=13220969 TSecr=834416308
112   0.022484 54.192.159.158 -> 172.31.29.138 TCP 2962 [TCP segment of a reassembled PDU]
113   0.022501 172.31.29.138 -> 54.192.159.158 TCP 66 60997 > http [ACK] Seq=97 Ack=638569 Win=1040384 Len=0 TSval=13220969 TSecr=834416308
114   0.022569 54.192.159.158 -> 172.31.29.138 TCP 29026 [TCP segment of a reassembled PDU]
115   0.022596 172.31.29.138 -> 54.192.159.158 TCP 66 60997 > http [ACK] Seq=97 Ack=667529 Win=1033600 Len=0 TSval=13220969 TSecr=834416308
116   0.022658 54.192.159.158 -> 172.31.29.138 TCP 5858 [TCP segment of a reassembled PDU]
117   0.022665 172.31.29.138 -> 54.192.159.158 TCP 66 60997 > http [ACK] Seq=97 Ack=673321 Win=1071744 Len=0 TSval=13220970 TSecr=834416308
118   0.023037 54.192.159.158 -> 172.31.29.138 TCP 4410 [TCP segment of a reassembled PDU]
119   0.023043 172.31.29.138 -> 54.192.159.158 TCP 66 60997 > http [ACK] Seq=97 Ack=677665 Win=1082880 Len=0 TSval=13220970 TSecr=834416308
120   0.023212 54.192.159.158 -> 172.31.29.138 TCP 20338 [TCP segment of a reassembled PDU]
121   0.023224 172.31.29.138 -> 54.192.159.158 TCP 66 60997 > http [ACK] Seq=97 Ack=697937 Win=1123328 Len=0 TSval=13220970 TSecr=834416308
122   0.023255 54.192.159.158 -> 172.31.29.138 TCP 5858 [TCP segment of a reassembled PDU]
123   0.023260 172.31.29.138 -> 54.192.159.158 TCP 66 60997 > http [ACK] Seq=97 Ack=703729 Win=1134976 Len=0 TSval=13220970 TSecr=834416308
124   0.023330 54.192.159.158 -> 172.31.29.138 TCP 24682 [TCP segment of a reassembled PDU]
125   0.023344 172.31.29.138 -> 54.192.159.158 TCP 66 60997 > http [ACK] Seq=97 Ack=728345 Win=1184128 Len=0 TSval=13220970 TSecr=834416308
126   0.023413 54.192.159.158 -> 172.31.29.138 TCP 10202 [TCP segment of a reassembled PDU]
127   0.023420 172.31.29.138 -> 54.192.159.158 TCP 66 60997 > http [ACK] Seq=97 Ack=738481 Win=1204480 Len=0 TSval=13220970 TSecr=834416308
128   0.023716 54.192.159.158 -> 172.31.29.138 TCP 21786 [TCP segment of a reassembled PDU]
129   0.023729 172.31.29.138 -> 54.192.159.158 TCP 66 60997 > http [ACK] Seq=97 Ack=760201 Win=1247872 Len=0 TSval=13220970 TSecr=834416308
130   0.023741 54.192.159.158 -> 172.31.29.138 TCP 4410 [TCP segment of a reassembled PDU]
131   0.023745 172.31.29.138 -> 54.192.159.158 TCP 66 60997 > http [ACK] Seq=97 Ack=764545 Win=1256576 Len=0 TSval=13220970 TSecr=834416308
132   0.023788 54.192.159.158 -> 172.31.29.138 TCP 7306 [TCP segment of a reassembled PDU]
133   0.023795 172.31.29.138 -> 54.192.159.158 TCP 66 60997 > http [ACK] Seq=97 Ack=771785 Win=1271040 Len=0 TSval=13220970 TSecr=834416308
134   0.024057 54.192.159.158 -> 172.31.29.138 TCP 2962 [TCP segment of a reassembled PDU]
135   0.024062 172.31.29.138 -> 54.192.159.158 TCP 66 60997 > http [ACK] Seq=97 Ack=774681 Win=1276800 Len=0 TSval=13220970 TSecr=834416308
136   0.024244 54.192.159.158 -> 172.31.29.138 TCP 26130 [TCP segment of a reassembled PDU]
137   0.024258 172.31.29.138 -> 54.192.159.158 TCP 66 60997 > http [ACK] Seq=97 Ack=800745 Win=1329024 Len=0 TSval=13220970 TSecr=834416308
138   0.024266 54.192.159.158 -> 172.31.29.138 TCP 2962 [TCP segment of a reassembled PDU]
139   0.024269 172.31.29.138 -> 54.192.159.158 TCP 66 60997 > http [ACK] Seq=97 Ack=803641 Win=1334784 Len=0 TSval=13220970 TSecr=834416308
140   0.024286 54.192.159.158 -> 172.31.29.138 TCP 18890 [TCP segment of a reassembled PDU]
141   0.024295 172.31.29.138 -> 54.192.159.158 TCP 66 60997 > http [ACK] Seq=97 Ack=822465 Win=1372416 Len=0 TSval=13220970 TSecr=834416308
142   0.024386 54.192.159.158 -> 172.31.29.138 TCP 30474 [TCP segment of a reassembled PDU]
143   0.024402 172.31.29.138 -> 54.192.159.158 TCP 66 60997 > http [ACK] Seq=97 Ack=852873 Win=1433216 Len=0 TSval=13220970 TSecr=834416308
144   0.024483 54.192.159.158 -> 172.31.29.138 TCP 15994 [TCP segment of a reassembled PDU]
145   0.024492 172.31.29.138 -> 54.192.159.158 TCP 66 60997 > http [ACK] Seq=97 Ack=868801 Win=1465088 Len=0 TSval=13220970 TSecr=834416308
146   0.024850 54.192.159.158 -> 172.31.29.138 TCP 1514 [TCP segment of a reassembled PDU]
147   0.024856 172.31.29.138 -> 54.192.159.158 TCP 66 60997 > http [ACK] Seq=97 Ack=870249 Win=1468032 Len=0 TSval=13220970 TSecr=834416308
148   0.025050 54.192.159.158 -> 172.31.29.138 TCP 26130 [TCP segment of a reassembled PDU]
149   0.025063 172.31.29.138 -> 54.192.159.158 TCP 66 60997 > http [ACK] Seq=97 Ack=896313 Win=1520128 Len=0 TSval=13220970 TSecr=834416308
150   0.025077 54.192.159.158 -> 172.31.29.138 TCP 11650 [TCP segment of a reassembled PDU]
151   0.025086 172.31.29.138 -> 54.192.159.158 TCP 66 60997 > http [ACK] Seq=97 Ack=907897 Win=1543296 Len=0 TSval=13220970 TSecr=834416308
152   0.025153 54.192.159.158 -> 172.31.29.138 TCP 17442 [TCP segment of a reassembled PDU]
153   0.025164 172.31.29.138 -> 54.192.159.158 TCP 66 60997 > http [ACK] Seq=97 Ack=925273 Win=1577984 Len=0 TSval=13220970 TSecr=834416308
154   0.025271 54.192.159.158 -> 172.31.29.138 TCP 26130 [TCP segment of a reassembled PDU]
155   0.025297 172.31.29.138 -> 54.192.159.158 TCP 66 60997 > http [ACK] Seq=97 Ack=951337 Win=1570048 Len=0 TSval=13220970 TSecr=834416308
156   0.025330 54.192.159.158 -> 172.31.29.138 TCP 26130 [TCP segment of a reassembled PDU]
157   0.025360 54.192.159.158 -> 172.31.29.138 TCP 4410 [TCP segment of a reassembled PDU]
158   0.025371 172.31.29.138 -> 54.192.159.158 TCP 66 60997 > http [ACK] Seq=97 Ack=981745 Win=1562880 Len=0 TSval=13220970 TSecr=834416308
159   0.025592 54.192.159.158 -> 172.31.29.138 TCP 5858 [TCP segment of a reassembled PDU]
160   0.025600 172.31.29.138 -> 54.192.159.158 TCP 66 60997 > http [ACK] Seq=97 Ack=987537 Win=1577984 Len=0 TSval=13220970 TSecr=834416308
161   0.025746 54.192.159.158 -> 172.31.29.138 TCP 11650 [TCP segment of a reassembled PDU]
162   0.025754 172.31.29.138 -> 54.192.159.158 TCP 66 60997 > http [ACK] Seq=97 Ack=999121 Win=1577984 Len=0 TSval=13220970 TSecr=834416308
163   0.026021 54.192.159.158 -> 172.31.29.138 TCP 26130 [TCP segment of a reassembled PDU]
164   0.026044 54.192.159.158 -> 172.31.29.138 TCP 14546 [TCP segment of a reassembled PDU]
165   0.026056 54.192.159.158 -> 172.31.29.138 HTTP 9435 HTTP/1.1 200 OK  (application/octet-stream)
166   0.026076 172.31.29.138 -> 54.192.159.158 TCP 66 60997 > http [ACK] Seq=97 Ack=1049034 Win=1529472 Len=0 TSval=13220970 TSecr=834416308
167   0.026206 172.31.29.138 -> 54.192.159.158 TCP 66 60997 > http [FIN, ACK] Seq=97 Ack=1049034 Win=1577984 Len=0 TSval=13220970 TSecr=834416308
168   0.026854 54.192.159.158 -> 172.31.29.138 TCP 66 http > 60997 [FIN, ACK] Seq=1049034 Ack=98 Win=14592 Len=0 TSval=834416308 TSecr=13220970
169   0.026862 172.31.29.138 -> 54.192.159.158 TCP 66 60997 > http [ACK] Seq=98 Ack=1049035 Win=1577984 Len=0 TSval=13220971 TSecr=834416308
