[Measurement for 1mb at 04:36:51 20.36.2014] 
Tshark:

  1   0.000000 172.31.29.138 -> 172.31.0.2   DNS 89 Standard query 0xac65  A d1dx94olpiqj0t.cloudfront.net
  2   0.000036 172.31.29.138 -> 172.31.0.2   DNS 89 Standard query 0x70c8  AAAA d1dx94olpiqj0t.cloudfront.net
  3   0.000537   172.31.0.2 -> 172.31.29.138 DNS 217 Standard query response 0xac65  A 54.230.159.4 A 54.192.157.144 A 54.192.157.155 A 54.192.159.97 A 54.192.159.180 A 54.230.156.193 A 54.230.158.205 A 54.230.158.217
  4   0.000547   172.31.0.2 -> 172.31.29.138 DNS 176 Standard query response 0x70c8 
  5   0.003874 172.31.29.138 -> 54.230.159.4 TCP 74 46966 > http [SYN] Seq=0 Win=26883 Len=0 MSS=8961 SACK_PERM=1 TSval=10520966 TSecr=0 WS=128
  6   0.004825 54.230.159.4 -> 172.31.29.138 TCP 74 http > 46966 [SYN, ACK] Seq=0 Ack=1 Win=14480 Len=0 MSS=1460 SACK_PERM=1 TSval=833378800 TSecr=10520966 WS=128
  7   0.004838 172.31.29.138 -> 54.230.159.4 TCP 66 46966 > http [ACK] Seq=1 Ack=1 Win=27008 Len=0 TSval=10520966 TSecr=833378800
  8   0.004876 172.31.29.138 -> 54.230.159.4 HTTP 162 GET /1mb HTTP/1.1 
  9   0.005516 54.230.159.4 -> 172.31.29.138 TCP 66 http > 46966 [ACK] Seq=1 Ack=97 Win=14592 Len=0 TSval=833378800 TSecr=10520966
 10   0.008808 54.230.159.4 -> 172.31.29.138 TCP 13098 [TCP segment of a reassembled PDU]
 11   0.008820 172.31.29.138 -> 54.230.159.4 TCP 66 46966 > http [ACK] Seq=97 Ack=13033 Win=52992 Len=0 TSval=10520967 TSecr=833378800
 12   0.009474 54.230.159.4 -> 172.31.29.138 TCP 1514 [TCP segment of a reassembled PDU]
 13   0.009480 172.31.29.138 -> 54.230.159.4 TCP 66 46966 > http [ACK] Seq=97 Ack=14481 Win=55936 Len=0 TSval=10520967 TSecr=833378800
 14   0.009513 54.230.159.4 -> 172.31.29.138 TCP 11650 [TCP segment of a reassembled PDU]
 15   0.009521 172.31.29.138 -> 54.230.159.4 TCP 66 46966 > http [ACK] Seq=97 Ack=26065 Win=79104 Len=0 TSval=10520967 TSecr=833378800
 16   0.009989 54.230.159.4 -> 172.31.29.138 TCP 4410 [TCP segment of a reassembled PDU]
 17   0.009995 172.31.29.138 -> 54.230.159.4 TCP 66 46966 > http [ACK] Seq=97 Ack=30409 Win=87808 Len=0 TSval=10520967 TSecr=833378800
 18   0.010021 54.230.159.4 -> 172.31.29.138 TCP 8754 [TCP segment of a reassembled PDU]
 19   0.010028 172.31.29.138 -> 54.230.159.4 TCP 66 46966 > http [ACK] Seq=97 Ack=39097 Win=96512 Len=0 TSval=10520967 TSecr=833378800
 20   0.010504 54.230.159.4 -> 172.31.29.138 TCP 4410 [TCP segment of a reassembled PDU]
 21   0.010510 172.31.29.138 -> 54.230.159.4 TCP 66 46966 > http [ACK] Seq=97 Ack=43441 Win=109056 Len=0 TSval=10520967 TSecr=833378800
 22   0.010551 54.230.159.4 -> 172.31.29.138 TCP 11650 [TCP segment of a reassembled PDU]
 23   0.010559 172.31.29.138 -> 54.230.159.4 TCP 66 46966 > http [ACK] Seq=97 Ack=55025 Win=98944 Len=0 TSval=10520967 TSecr=833378800
 24   0.010598 54.230.159.4 -> 172.31.29.138 TCP 5858 [TCP segment of a reassembled PDU]
 25   0.010604 172.31.29.138 -> 54.230.159.4 TCP 66 46966 > http [ACK] Seq=97 Ack=60817 Win=93184 Len=0 TSval=10520967 TSecr=833378800
 26   0.011006 54.230.159.4 -> 172.31.29.138 TCP 4410 [TCP segment of a reassembled PDU]
 27   0.011012 172.31.29.138 -> 54.230.159.4 TCP 66 46966 > http [ACK] Seq=97 Ack=65161 Win=109056 Len=0 TSval=10520967 TSecr=833378800
 28   0.011254 54.230.159.4 -> 172.31.29.138 TCP 2962 [TCP segment of a reassembled PDU]
 29   0.011259 172.31.29.138 -> 54.230.159.4 TCP 66 46966 > http [ACK] Seq=97 Ack=68057 Win=109056 Len=0 TSval=10520967 TSecr=833378800
 30   0.011378 54.230.159.4 -> 172.31.29.138 TCP 18890 [TCP segment of a reassembled PDU]
 31   0.011389 172.31.29.138 -> 54.230.159.4 TCP 66 46966 > http [ACK] Seq=97 Ack=86881 Win=90240 Len=0 TSval=10520967 TSecr=833378800
 32   0.011833 54.230.159.4 -> 172.31.29.138 TCP 2962 [TCP segment of a reassembled PDU]
 33   0.011838 172.31.29.138 -> 54.230.159.4 TCP 66 46966 > http [ACK] Seq=97 Ack=89777 Win=109056 Len=0 TSval=10520968 TSecr=833378800
 34   0.011912 54.230.159.4 -> 172.31.29.138 TCP 7306 [TCP segment of a reassembled PDU]
 35   0.011918 172.31.29.138 -> 54.230.159.4 TCP 66 46966 > http [ACK] Seq=97 Ack=97017 Win=123520 Len=0 TSval=10520968 TSecr=833378800
 36   0.012117 54.230.159.4 -> 172.31.29.138 TCP 8754 [TCP segment of a reassembled PDU]
 37   0.012134 172.31.29.138 -> 54.230.159.4 TCP 66 46966 > http [ACK] Seq=97 Ack=105705 Win=140928 Len=0 TSval=10520968 TSecr=833378800
 38   0.012215 54.230.159.4 -> 172.31.29.138 TCP 11650 [TCP segment of a reassembled PDU]
 39   0.012223 172.31.29.138 -> 54.230.159.4 TCP 66 46966 > http [ACK] Seq=97 Ack=117289 Win=164096 Len=0 TSval=10520968 TSecr=833378800
 40   0.012606 54.230.159.4 -> 172.31.29.138 TCP 4410 [TCP segment of a reassembled PDU]
 41   0.012612 172.31.29.138 -> 54.230.159.4 TCP 66 46966 > http [ACK] Seq=97 Ack=121633 Win=172800 Len=0 TSval=10520968 TSecr=833378800
 42   0.012720 54.230.159.4 -> 172.31.29.138 TCP 8754 [TCP segment of a reassembled PDU]
 43   0.012727 172.31.29.138 -> 54.230.159.4 TCP 66 46966 > http [ACK] Seq=97 Ack=130321 Win=190208 Len=0 TSval=10520968 TSecr=833378800
 44   0.012982 54.230.159.4 -> 172.31.29.138 TCP 18890 [TCP segment of a reassembled PDU]
 45   0.012993 172.31.29.138 -> 54.230.159.4 TCP 66 46966 > http [ACK] Seq=97 Ack=149145 Win=227840 Len=0 TSval=10520968 TSecr=833378800
 46   0.013016 54.230.159.4 -> 172.31.29.138 TCP 4410 [TCP segment of a reassembled PDU]
 47   0.013022 172.31.29.138 -> 54.230.159.4 TCP 66 46966 > http [ACK] Seq=97 Ack=153489 Win=236544 Len=0 TSval=10520968 TSecr=833378800
 48   0.013111 54.230.159.4 -> 172.31.29.138 TCP 2962 [TCP segment of a reassembled PDU]
 49   0.013117 172.31.29.138 -> 54.230.159.4 TCP 66 46966 > http [ACK] Seq=97 Ack=156385 Win=242304 Len=0 TSval=10520968 TSecr=833378800
 50   0.013470 54.230.159.4 -> 172.31.29.138 TCP 13098 [TCP segment of a reassembled PDU]
 51   0.013479 172.31.29.138 -> 54.230.159.4 TCP 66 46966 > http [ACK] Seq=97 Ack=169417 Win=268288 Len=0 TSval=10520968 TSecr=833378801
 52   0.013776 54.230.159.4 -> 172.31.29.138 TCP 27578 [TCP segment of a reassembled PDU]
 53   0.013790 172.31.29.138 -> 54.230.159.4 TCP 66 46966 > http [ACK] Seq=97 Ack=196929 Win=323328 Len=0 TSval=10520968 TSecr=833378801
 54   0.013798 54.230.159.4 -> 172.31.29.138 TCP 2962 [TCP segment of a reassembled PDU]
 55   0.013801 172.31.29.138 -> 54.230.159.4 TCP 66 46966 > http [ACK] Seq=97 Ack=199825 Win=329216 Len=0 TSval=10520968 TSecr=833378801
 56   0.014371 54.230.159.4 -> 172.31.29.138 TCP 5858 [TCP segment of a reassembled PDU]
 57   0.014377 172.31.29.138 -> 54.230.159.4 TCP 66 46966 > http [ACK] Seq=97 Ack=205617 Win=340736 Len=0 TSval=10520968 TSecr=833378801
 58   0.014550 54.230.159.4 -> 172.31.29.138 TCP 26130 [TCP segment of a reassembled PDU]
 59   0.014562 172.31.29.138 -> 54.230.159.4 TCP 66 46966 > http [ACK] Seq=97 Ack=231681 Win=392832 Len=0 TSval=10520968 TSecr=833378801
 60   0.014580 54.230.159.4 -> 172.31.29.138 TCP 15994 [TCP segment of a reassembled PDU]
 61   0.014591 172.31.29.138 -> 54.230.159.4 TCP 66 46966 > http [ACK] Seq=97 Ack=247609 Win=424704 Len=0 TSval=10520968 TSecr=833378801
 62   0.015171 54.230.159.4 -> 172.31.29.138 TCP 7306 [TCP segment of a reassembled PDU]
 63   0.015178 172.31.29.138 -> 54.230.159.4 TCP 66 46966 > http [ACK] Seq=97 Ack=254849 Win=439168 Len=0 TSval=10520968 TSecr=833378801
 64   0.015332 54.230.159.4 -> 172.31.29.138 TCP 26130 [TCP segment of a reassembled PDU]
 65   0.015344 172.31.29.138 -> 54.230.159.4 TCP 66 46966 > http [ACK] Seq=97 Ack=280913 Win=491392 Len=0 TSval=10520968 TSecr=833378801
 66   0.015350 54.230.159.4 -> 172.31.29.138 TCP 2962 [TCP segment of a reassembled PDU]
 67   0.015353 172.31.29.138 -> 54.230.159.4 TCP 66 46966 > http [ACK] Seq=97 Ack=283809 Win=497152 Len=0 TSval=10520968 TSecr=833378801
 68   0.015946 54.230.159.4 -> 172.31.29.138 TCP 10202 [TCP segment of a reassembled PDU]
 69   0.015954 172.31.29.138 -> 54.230.159.4 TCP 66 46966 > http [ACK] Seq=97 Ack=293945 Win=517376 Len=0 TSval=10520969 TSecr=833378801
 70   0.016120 54.230.159.4 -> 172.31.29.138 TCP 26130 [TCP segment of a reassembled PDU]
 71   0.016133 172.31.29.138 -> 54.230.159.4 TCP 66 46966 > http [ACK] Seq=97 Ack=320009 Win=569472 Len=0 TSval=10520969 TSecr=833378801
 72   0.016153 54.230.159.4 -> 172.31.29.138 TCP 17442 [TCP segment of a reassembled PDU]
 73   0.016161 172.31.29.138 -> 54.230.159.4 TCP 66 46966 > http [ACK] Seq=97 Ack=337385 Win=604288 Len=0 TSval=10520969 TSecr=833378801
 74   0.016729 54.230.159.4 -> 172.31.29.138 TCP 4410 [TCP segment of a reassembled PDU]
 75   0.016735 172.31.29.138 -> 54.230.159.4 TCP 66 46966 > http [ACK] Seq=97 Ack=341729 Win=612992 Len=0 TSval=10520969 TSecr=833378801
 76   0.016928 54.230.159.4 -> 172.31.29.138 TCP 26130 [TCP segment of a reassembled PDU]
 77   0.016941 172.31.29.138 -> 54.230.159.4 TCP 66 46966 > http [ACK] Seq=97 Ack=367793 Win=665088 Len=0 TSval=10520969 TSecr=833378801
 78   0.016977 54.230.159.4 -> 172.31.29.138 TCP 23234 [TCP segment of a reassembled PDU]
 79   0.016989 172.31.29.138 -> 54.230.159.4 TCP 66 46966 > http [ACK] Seq=97 Ack=390961 Win=711424 Len=0 TSval=10520969 TSecr=833378801
 80   0.017510 54.230.159.4 -> 172.31.29.138 TCP 7306 [TCP segment of a reassembled PDU]
 81   0.017517 172.31.29.138 -> 54.230.159.4 TCP 66 46966 > http [ACK] Seq=97 Ack=398201 Win=725888 Len=0 TSval=10520969 TSecr=833378801
 82   0.017673 54.230.159.4 -> 172.31.29.138 TCP 26130 [TCP segment of a reassembled PDU]
 83   0.017686 172.31.29.138 -> 54.230.159.4 TCP 66 46966 > http [ACK] Seq=97 Ack=424265 Win=777984 Len=0 TSval=10520969 TSecr=833378801
 84   0.017745 54.230.159.4 -> 172.31.29.138 TCP 26130 [TCP segment of a reassembled PDU]
 85   0.017761 172.31.29.138 -> 54.230.159.4 TCP 66 46966 > http [ACK] Seq=97 Ack=450329 Win=830208 Len=0 TSval=10520969 TSecr=833378801
 86   0.017772 54.230.159.4 -> 172.31.29.138 TCP 5858 [TCP segment of a reassembled PDU]
 87   0.017776 172.31.29.138 -> 54.230.159.4 TCP 66 46966 > http [ACK] Seq=97 Ack=456121 Win=841728 Len=0 TSval=10520969 TSecr=833378801
 88   0.018279 54.230.159.4 -> 172.31.29.138 TCP 4410 [TCP segment of a reassembled PDU]
 89   0.018285 172.31.29.138 -> 54.230.159.4 TCP 66 46966 > http [ACK] Seq=97 Ack=460465 Win=850432 Len=0 TSval=10520969 TSecr=833378801
 90   0.018462 54.230.159.4 -> 172.31.29.138 TCP 26130 [TCP segment of a reassembled PDU]
 91   0.018475 172.31.29.138 -> 54.230.159.4 TCP 66 46966 > http [ACK] Seq=97 Ack=486529 Win=902528 Len=0 TSval=10520969 TSecr=833378801
 92   0.018484 54.230.159.4 -> 172.31.29.138 TCP 5858 [TCP segment of a reassembled PDU]
 93   0.018488 172.31.29.138 -> 54.230.159.4 TCP 66 46966 > http [ACK] Seq=97 Ack=492321 Win=914176 Len=0 TSval=10520969 TSecr=833378801
 94   0.018565 54.230.159.4 -> 172.31.29.138 TCP 7306 [TCP segment of a reassembled PDU]
 95   0.018585 172.31.29.138 -> 54.230.159.4 TCP 66 46966 > http [ACK] Seq=97 Ack=499561 Win=928640 Len=0 TSval=10520969 TSecr=833378801
 96   0.018695 54.230.159.4 -> 172.31.29.138 TCP 21786 [TCP segment of a reassembled PDU]
 97   0.018706 172.31.29.138 -> 54.230.159.4 TCP 66 46966 > http [ACK] Seq=97 Ack=521281 Win=972032 Len=0 TSval=10520969 TSecr=833378801
 98   0.019018 54.230.159.4 -> 172.31.29.138 TCP 1514 [TCP segment of a reassembled PDU]
 99   0.019024 172.31.29.138 -> 54.230.159.4 TCP 66 46966 > http [ACK] Seq=97 Ack=522729 Win=974976 Len=0 TSval=10520969 TSecr=833378801
100   0.019229 54.230.159.4 -> 172.31.29.138 TCP 26130 [TCP segment of a reassembled PDU]
101   0.019242 172.31.29.138 -> 54.230.159.4 TCP 66 46966 > http [ACK] Seq=97 Ack=548793 Win=1027072 Len=0 TSval=10520969 TSecr=833378801
102   0.019254 54.230.159.4 -> 172.31.29.138 TCP 11650 [TCP segment of a reassembled PDU]
103   0.019262 172.31.29.138 -> 54.230.159.4 TCP 66 46966 > http [ACK] Seq=97 Ack=560377 Win=1046400 Len=0 TSval=10520969 TSecr=833378801
104   0.019303 54.230.159.4 -> 172.31.29.138 TCP 4410 [TCP segment of a reassembled PDU]
105   0.019309 172.31.29.138 -> 54.230.159.4 TCP 66 46966 > http [ACK] Seq=97 Ack=564721 Win=1058944 Len=0 TSval=10520969 TSecr=833378801
106   0.019435 54.230.159.4 -> 172.31.29.138 TCP 21786 [TCP segment of a reassembled PDU]
107   0.019444 172.31.29.138 -> 54.230.159.4 TCP 66 46966 > http [ACK] Seq=97 Ack=586441 Win=1072640 Len=0 TSval=10520969 TSecr=833378801
108   0.019801 54.230.159.4 -> 172.31.29.138 TCP 7306 [TCP segment of a reassembled PDU]
109   0.019808 172.31.29.138 -> 54.230.159.4 TCP 66 46966 > http [ACK] Seq=97 Ack=593681 Win=1096448 Len=0 TSval=10520970 TSecr=833378801
110   0.019956 54.230.159.4 -> 172.31.29.138 TCP 17442 [TCP segment of a reassembled PDU]
111   0.019966 172.31.29.138 -> 54.230.159.4 TCP 66 46966 > http [ACK] Seq=97 Ack=611057 Win=1088640 Len=0 TSval=10520970 TSecr=833378801
112   0.019991 54.230.159.4 -> 172.31.29.138 TCP 8754 [TCP segment of a reassembled PDU]
113   0.020006 172.31.29.138 -> 54.230.159.4 TCP 66 46966 > http [ACK] Seq=97 Ack=619745 Win=1102336 Len=0 TSval=10520970 TSecr=833378801
114   0.020039 54.230.159.4 -> 172.31.29.138 TCP 10202 [TCP segment of a reassembled PDU]
115   0.020057 172.31.29.138 -> 54.230.159.4 TCP 66 46966 > http [ACK] Seq=97 Ack=629881 Win=1102336 Len=0 TSval=10520970 TSecr=833378801
116   0.020200 54.230.159.4 -> 172.31.29.138 TCP 21786 [TCP segment of a reassembled PDU]
117   0.020279 172.31.29.138 -> 54.230.159.4 TCP 66 46966 > http [ACK] Seq=97 Ack=651601 Win=1081600 Len=0 TSval=10520970 TSecr=833378801
118   0.020569 54.230.159.4 -> 172.31.29.138 TCP 7306 [TCP segment of a reassembled PDU]
119   0.020576 172.31.29.138 -> 54.230.159.4 TCP 66 46966 > http [ACK] Seq=97 Ack=658841 Win=1105408 Len=0 TSval=10520970 TSecr=833378801
120   0.020756 54.230.159.4 -> 172.31.29.138 TCP 26130 [TCP segment of a reassembled PDU]
121   0.020782 172.31.29.138 -> 54.230.159.4 TCP 66 46966 > http [ACK] Seq=97 Ack=684905 Win=1079424 Len=0 TSval=10520970 TSecr=833378801
122   0.020818 54.230.159.4 -> 172.31.29.138 TCP 26130 [TCP segment of a reassembled PDU]
123   0.020839 172.31.29.138 -> 54.230.159.4 TCP 66 46966 > http [ACK] Seq=97 Ack=710969 Win=1074432 Len=0 TSval=10520970 TSecr=833378801
124   0.020847 54.230.159.4 -> 172.31.29.138 TCP 5858 [TCP segment of a reassembled PDU]
125   0.020864 172.31.29.138 -> 54.230.159.4 TCP 66 46966 > http [ACK] Seq=97 Ack=716761 Win=1113984 Len=0 TSval=10520970 TSecr=833378801
126   0.021147 54.230.159.4 -> 172.31.29.138 TCP 24682 [TCP segment of a reassembled PDU]
127   0.021171 172.31.29.138 -> 54.230.159.4 TCP 66 46966 > http [ACK] Seq=97 Ack=741377 Win=1089408 Len=0 TSval=10520970 TSecr=833378801
128   0.021242 54.230.159.4 -> 172.31.29.138 TCP 11650 [TCP segment of a reassembled PDU]
129   0.021250 172.31.29.138 -> 54.230.159.4 TCP 66 46966 > http [ACK] Seq=97 Ack=752961 Win=1098240 Len=0 TSval=10520970 TSecr=833378801
130   0.021349 54.230.159.4 -> 172.31.29.138 TCP 8754 [TCP segment of a reassembled PDU]
131   0.021356 172.31.29.138 -> 54.230.159.4 TCP 66 46966 > http [ACK] Seq=97 Ack=761649 Win=1102976 Len=0 TSval=10520970 TSecr=833378801
132   0.021507 54.230.159.4 -> 172.31.29.138 TCP 20338 [TCP segment of a reassembled PDU]
133   0.021530 172.31.29.138 -> 54.230.159.4 TCP 66 46966 > http [ACK] Seq=97 Ack=781921 Win=1083904 Len=0 TSval=10520970 TSecr=833378801
134   0.021789 54.230.159.4 -> 172.31.29.138 TCP 30474 [TCP segment of a reassembled PDU]
135   0.021808 54.230.159.4 -> 172.31.29.138 TCP 2962 [TCP segment of a reassembled PDU]
136   0.021826 172.31.29.138 -> 54.230.159.4 TCP 66 46966 > http [ACK] Seq=97 Ack=815225 Win=1062400 Len=0 TSval=10520970 TSecr=833378801
137   0.021858 54.230.159.4 -> 172.31.29.138 TCP 7306 [TCP segment of a reassembled PDU]
138   0.021865 172.31.29.138 -> 54.230.159.4 TCP 66 46966 > http [ACK] Seq=97 Ack=822465 Win=1105408 Len=0 TSval=10520970 TSecr=833378801
139   0.022051 54.230.159.4 -> 172.31.29.138 TCP 24682 [TCP segment of a reassembled PDU]
140   0.022075 172.31.29.138 -> 54.230.159.4 TCP 66 46966 > http [ACK] Seq=97 Ack=847081 Win=1080832 Len=0 TSval=10520970 TSecr=833378801
141   0.022283 54.230.159.4 -> 172.31.29.138 TCP 27578 [TCP segment of a reassembled PDU]
142   0.022308 172.31.29.138 -> 54.230.159.4 TCP 66 46966 > http [ACK] Seq=97 Ack=874593 Win=1072000 Len=0 TSval=10520970 TSecr=833378801
143   0.022323 54.230.159.4 -> 172.31.29.138 TCP 11650 [TCP segment of a reassembled PDU]
144   0.022341 172.31.29.138 -> 54.230.159.4 TCP 66 46966 > http [ACK] Seq=97 Ack=886177 Win=1098240 Len=0 TSval=10520970 TSecr=833378801
145   0.022372 54.230.159.4 -> 172.31.29.138 TCP 5858 [TCP segment of a reassembled PDU]
146   0.022377 172.31.29.138 -> 54.230.159.4 TCP 66 46966 > http [ACK] Seq=97 Ack=891969 Win=1107712 Len=0 TSval=10520970 TSecr=833378801
147   0.022518 54.230.159.4 -> 172.31.29.138 TCP 20338 [TCP segment of a reassembled PDU]
148   0.022537 172.31.29.138 -> 54.230.159.4 TCP 66 46966 > http [ACK] Seq=97 Ack=912241 Win=1087488 Len=0 TSval=10520970 TSecr=833378801
149   0.022626 54.230.159.4 -> 172.31.29.138 TCP 4410 [TCP segment of a reassembled PDU]
150   0.022631 172.31.29.138 -> 54.230.159.4 TCP 66 46966 > http [ACK] Seq=97 Ack=916585 Win=1110144 Len=0 TSval=10520970 TSecr=833378801
151   0.022802 54.230.159.4 -> 172.31.29.138 TCP 20338 [TCP segment of a reassembled PDU]
152   0.022828 54.230.159.4 -> 172.31.29.138 TCP 5858 [TCP segment of a reassembled PDU]
153   0.022835 172.31.29.138 -> 54.230.159.4 TCP 66 46966 > http [ACK] Seq=97 Ack=936857 Win=1089920 Len=0 TSval=10520970 TSecr=833378801
154   0.022848 172.31.29.138 -> 54.230.159.4 TCP 66 46966 > http [ACK] Seq=97 Ack=942649 Win=1113984 Len=0 TSval=10520970 TSecr=833378801
155   0.022894 54.230.159.4 -> 172.31.29.138 TCP 26130 [TCP segment of a reassembled PDU]
156   0.022923 172.31.29.138 -> 54.230.159.4 TCP 66 46966 > http [ACK] Seq=97 Ack=968713 Win=1088000 Len=0 TSval=10520970 TSecr=833378801
157   0.022949 54.230.159.4 -> 172.31.29.138 TCP 8754 [TCP segment of a reassembled PDU]
158   0.022954 172.31.29.138 -> 54.230.159.4 TCP 66 46966 > http [ACK] Seq=97 Ack=977401 Win=1102976 Len=0 TSval=10520970 TSecr=833378801
159   0.023316 54.230.159.4 -> 172.31.29.138 TCP 21786 [TCP segment of a reassembled PDU]
160   0.023341 54.230.159.4 -> 172.31.29.138 TCP 4410 [TCP segment of a reassembled PDU]
161   0.023350 172.31.29.138 -> 54.230.159.4 TCP 66 46966 > http [ACK] Seq=97 Ack=1003465 Win=1076992 Len=0 TSval=10520970 TSecr=833378801
162   0.023403 54.230.159.4 -> 172.31.29.138 TCP 23234 [TCP segment of a reassembled PDU]
163   0.023415 172.31.29.138 -> 54.230.159.4 TCP 66 46966 > http [ACK] Seq=97 Ack=1026633 Win=1079168 Len=0 TSval=10520970 TSecr=833378801
164   0.023452 54.230.159.4 -> 172.31.29.138 TCP 15994 [TCP segment of a reassembled PDU]
165   0.023462 172.31.29.138 -> 54.230.159.4 TCP 66 46966 > http [ACK] Seq=97 Ack=1042561 Win=1091072 Len=0 TSval=10520970 TSecr=833378802
166   0.023769 54.230.159.4 -> 172.31.29.138 HTTP 6539 HTTP/1.1 200 OK  (application/octet-stream)
167   0.023776 172.31.29.138 -> 54.230.159.4 TCP 66 46966 > http [ACK] Seq=97 Ack=1049034 Win=1105408 Len=0 TSval=10520971 TSecr=833378802
168   0.023896 172.31.29.138 -> 54.230.159.4 TCP 66 46966 > http [FIN, ACK] Seq=97 Ack=1049034 Win=1113984 Len=0 TSval=10520971 TSecr=833378802
169   0.024369 54.230.159.4 -> 172.31.29.138 TCP 66 http > 46966 [FIN, ACK] Seq=1049034 Ack=98 Win=14592 Len=0 TSval=833378802 TSecr=10520971
170   0.024377 172.31.29.138 -> 54.230.159.4 TCP 66 46966 > http [ACK] Seq=98 Ack=1049035 Win=1113984 Len=0 TSval=10520971 TSecr=833378802
