[Measurement for 10mb at 22:44:21 19.44.2014] 
Tshark:

  1   0.000000 172.31.8.238 -> 172.31.0.2   DNS 89 Standard query 0xd70a  A d2pcb72msibvx3.cloudfront.net
  2   0.000040 172.31.8.238 -> 172.31.0.2   DNS 89 Standard query 0x6921  AAAA d2pcb72msibvx3.cloudfront.net
  3   0.000761   172.31.0.2 -> 172.31.8.238 DNS 217 Standard query response 0xd70a  A 54.239.132.86 A 54.239.132.103 A 54.192.118.228 A 54.192.118.234 A 54.230.116.141 A 54.230.117.198 A 54.230.119.3 A 54.239.132.83
  4   0.000772   172.31.0.2 -> 172.31.8.238 DNS 169 Standard query response 0x6921 
  5   0.003829 172.31.8.238 -> 54.239.132.86 TCP 74 49925 > http [SYN] Seq=0 Win=26883 Len=0 MSS=8961 SACK_PERM=1 TSval=5172210 TSecr=0 WS=128
  6   0.004710 54.239.132.86 -> 172.31.8.238 TCP 74 http > 49925 [SYN, ACK] Seq=0 Ack=1 Win=14480 Len=0 MSS=1460 SACK_PERM=1 TSval=1684827649 TSecr=5172210 WS=128
  7   0.004724 172.31.8.238 -> 54.239.132.86 TCP 66 49925 > http [ACK] Seq=1 Ack=1 Win=27008 Len=0 TSval=5172210 TSecr=1684827649
  8   0.004766 172.31.8.238 -> 54.239.132.86 HTTP 163 GET /10mb HTTP/1.1 
  9   0.005463 54.239.132.86 -> 172.31.8.238 TCP 66 http > 49925 [ACK] Seq=1 Ack=98 Win=14592 Len=0 TSval=1684827649 TSecr=5172210
 10   0.007491 54.239.132.86 -> 172.31.8.238 TCP 524 [TCP segment of a reassembled PDU]
 11   0.007498 172.31.8.238 -> 54.239.132.86 TCP 66 49925 > http [ACK] Seq=98 Ack=459 Win=28032 Len=0 TSval=5172211 TSecr=1684827649
 12   0.007619 54.239.132.86 -> 172.31.8.238 TCP 13098 [TCP segment of a reassembled PDU]
 13   0.007630 172.31.8.238 -> 54.239.132.86 TCP 66 49925 > http [ACK] Seq=98 Ack=13491 Win=54144 Len=0 TSval=5172211 TSecr=1684827649
 14   0.008271 54.239.132.86 -> 172.31.8.238 TCP 4410 [TCP segment of a reassembled PDU]
 15   0.008279 172.31.8.238 -> 54.239.132.86 TCP 66 49925 > http [ACK] Seq=98 Ack=17835 Win=62720 Len=0 TSval=5172211 TSecr=1684827649
 16   0.008378 54.239.132.86 -> 172.31.8.238 TCP 8754 [TCP segment of a reassembled PDU]
 17   0.008385 172.31.8.238 -> 54.239.132.86 TCP 66 49925 > http [ACK] Seq=98 Ack=26523 Win=80128 Len=0 TSval=5172211 TSecr=1684827649
 18   0.009043 54.239.132.86 -> 172.31.8.238 TCP 2962 [TCP segment of a reassembled PDU]
 19   0.009049 172.31.8.238 -> 54.239.132.86 TCP 66 49925 > http [ACK] Seq=98 Ack=29419 Win=85888 Len=0 TSval=5172211 TSecr=1684827649
 20   0.009175 54.239.132.86 -> 172.31.8.238 TCP 17442 [TCP segment of a reassembled PDU]
 21   0.009185 172.31.8.238 -> 54.239.132.86 TCP 66 49925 > http [ACK] Seq=98 Ack=46795 Win=89344 Len=0 TSval=5172211 TSecr=1684827649
 22   0.009849 54.239.132.86 -> 172.31.8.238 TCP 11650 [TCP segment of a reassembled PDU]
 23   0.009858 172.31.8.238 -> 54.239.132.86 TCP 66 49925 > http [ACK] Seq=98 Ack=58379 Win=98944 Len=0 TSval=5172211 TSecr=1684827649
 24   0.009944 54.239.132.86 -> 172.31.8.238 TCP 7306 [TCP segment of a reassembled PDU]
 25   0.009951 172.31.8.238 -> 54.239.132.86 TCP 66 49925 > http [ACK] Seq=98 Ack=65619 Win=105984 Len=0 TSval=5172211 TSecr=1684827649
 26   0.010576 54.239.132.86 -> 172.31.8.238 TCP 7306 [TCP segment of a reassembled PDU]
 27   0.010583 172.31.8.238 -> 54.239.132.86 TCP 66 49925 > http [ACK] Seq=98 Ack=72859 Win=105984 Len=0 TSval=5172211 TSecr=1684827649
 28   0.010692 54.239.132.86 -> 172.31.8.238 TCP 18890 [TCP segment of a reassembled PDU]
 29   0.010704 172.31.8.238 -> 54.239.132.86 TCP 66 49925 > http [ACK] Seq=98 Ack=91683 Win=87168 Len=0 TSval=5172211 TSecr=1684827649
 30   0.011119 54.239.132.86 -> 172.31.8.238 TCP 7306 [TCP segment of a reassembled PDU]
 31   0.011127 172.31.8.238 -> 54.239.132.86 TCP 66 49925 > http [ACK] Seq=98 Ack=98923 Win=105984 Len=0 TSval=5172212 TSecr=1684827649
 32   0.011241 54.239.132.86 -> 172.31.8.238 TCP 21786 [TCP segment of a reassembled PDU]
 33   0.011253 172.31.8.238 -> 54.239.132.86 TCP 66 49925 > http [ACK] Seq=98 Ack=120643 Win=152448 Len=0 TSval=5172212 TSecr=1684827649
 34   0.011885 54.239.132.86 -> 172.31.8.238 TCP 5858 [TCP segment of a reassembled PDU]
 35   0.011892 172.31.8.238 -> 54.239.132.86 TCP 66 49925 > http [ACK] Seq=98 Ack=126435 Win=164096 Len=0 TSval=5172212 TSecr=1684827649
 36   0.012023 54.239.132.86 -> 172.31.8.238 TCP 26130 [TCP segment of a reassembled PDU]
 37   0.012037 172.31.8.238 -> 54.239.132.86 TCP 66 49925 > http [ACK] Seq=98 Ack=152499 Win=216192 Len=0 TSval=5172212 TSecr=1684827649
 38   0.012466 54.239.132.86 -> 172.31.8.238 TCP 4410 [TCP segment of a reassembled PDU]
 39   0.012473 172.31.8.238 -> 54.239.132.86 TCP 66 49925 > http [ACK] Seq=98 Ack=156843 Win=224896 Len=0 TSval=5172212 TSecr=1684827649
 40   0.012650 54.239.132.86 -> 172.31.8.238 TCP 4410 [TCP segment of a reassembled PDU]
 41   0.012655 172.31.8.238 -> 54.239.132.86 TCP 66 49925 > http [ACK] Seq=98 Ack=161187 Win=233600 Len=0 TSval=5172212 TSecr=1684827649
 42   0.012796 54.239.132.86 -> 172.31.8.238 TCP 21786 [TCP segment of a reassembled PDU]
 43   0.012808 172.31.8.238 -> 54.239.132.86 TCP 66 49925 > http [ACK] Seq=98 Ack=182907 Win=276992 Len=0 TSval=5172212 TSecr=1684827649
 44   0.013161 54.239.132.86 -> 172.31.8.238 TCP 4410 [TCP segment of a reassembled PDU]
 45   0.013168 172.31.8.238 -> 54.239.132.86 TCP 66 49925 > http [ACK] Seq=98 Ack=187251 Win=285696 Len=0 TSval=5172212 TSecr=1684827649
 46   0.013295 54.239.132.86 -> 172.31.8.238 TCP 11650 [TCP segment of a reassembled PDU]
 47   0.013304 172.31.8.238 -> 54.239.132.86 TCP 66 49925 > http [ACK] Seq=98 Ack=198835 Win=308864 Len=0 TSval=5172212 TSecr=1684827649
 48   0.013519 54.239.132.86 -> 172.31.8.238 TCP 23234 [TCP segment of a reassembled PDU]
 49   0.013532 172.31.8.238 -> 54.239.132.86 TCP 66 49925 > http [ACK] Seq=98 Ack=222003 Win=355200 Len=0 TSval=5172212 TSecr=1684827649
 50   0.013743 54.239.132.86 -> 172.31.8.238 TCP 18890 [TCP segment of a reassembled PDU]
 51   0.013754 172.31.8.238 -> 54.239.132.86 TCP 66 49925 > http [ACK] Seq=98 Ack=240827 Win=392832 Len=0 TSval=5172212 TSecr=1684827649
 52   0.014031 54.239.132.86 -> 172.31.8.238 TCP 11650 [TCP segment of a reassembled PDU]
 53   0.014039 172.31.8.238 -> 54.239.132.86 TCP 66 49925 > http [ACK] Seq=98 Ack=252411 Win=416000 Len=0 TSval=5172212 TSecr=1684827650
 54   0.014179 54.239.132.86 -> 172.31.8.238 TCP 5858 [TCP segment of a reassembled PDU]
 55   0.014185 172.31.8.238 -> 54.239.132.86 TCP 66 49925 > http [ACK] Seq=98 Ack=258203 Win=427648 Len=0 TSval=5172212 TSecr=1684827650
 56   0.014358 54.239.132.86 -> 172.31.8.238 TCP 26130 [TCP segment of a reassembled PDU]
 57   0.014372 172.31.8.238 -> 54.239.132.86 TCP 66 49925 > http [ACK] Seq=98 Ack=284267 Win=479744 Len=0 TSval=5172212 TSecr=1684827650
 58   0.014379 54.239.132.86 -> 172.31.8.238 TCP 1514 [TCP segment of a reassembled PDU]
 59   0.014381 172.31.8.238 -> 54.239.132.86 TCP 66 49925 > http [ACK] Seq=98 Ack=285715 Win=482688 Len=0 TSval=5172212 TSecr=1684827650
 60   0.014694 54.239.132.86 -> 172.31.8.238 TCP 4410 [TCP segment of a reassembled PDU]
 61   0.014700 172.31.8.238 -> 54.239.132.86 TCP 66 49925 > http [ACK] Seq=98 Ack=290059 Win=491392 Len=0 TSval=5172212 TSecr=1684827650
 62   0.014827 54.239.132.86 -> 172.31.8.238 TCP 5858 [TCP segment of a reassembled PDU]
 63   0.014833 172.31.8.238 -> 54.239.132.86 TCP 66 49925 > http [ACK] Seq=98 Ack=295851 Win=502912 Len=0 TSval=5172212 TSecr=1684827650
 64   0.015218 54.239.132.86 -> 172.31.8.238 TCP 8754 [TCP segment of a reassembled PDU]
 65   0.015225 172.31.8.238 -> 54.239.132.86 TCP 66 49925 > http [ACK] Seq=98 Ack=304539 Win=520320 Len=0 TSval=5172213 TSecr=1684827650
 66   0.015390 54.239.132.86 -> 172.31.8.238 TCP 26130 [TCP segment of a reassembled PDU]
 67   0.015403 172.31.8.238 -> 54.239.132.86 TCP 66 49925 > http [ACK] Seq=98 Ack=330603 Win=572416 Len=0 TSval=5172213 TSecr=1684827650
 68   0.015423 54.239.132.86 -> 172.31.8.238 TCP 8754 [TCP segment of a reassembled PDU]
 69   0.015429 172.31.8.238 -> 54.239.132.86 TCP 66 49925 > http [ACK] Seq=98 Ack=339291 Win=589824 Len=0 TSval=5172213 TSecr=1684827650
 70   0.015726 54.239.132.86 -> 172.31.8.238 TCP 1514 [TCP segment of a reassembled PDU]
 71   0.015731 172.31.8.238 -> 54.239.132.86 TCP 66 49925 > http [ACK] Seq=98 Ack=340739 Win=592640 Len=0 TSval=5172213 TSecr=1684827650
 72   0.015985 54.239.132.86 -> 172.31.8.238 TCP 4410 [TCP segment of a reassembled PDU]
 73   0.015991 172.31.8.238 -> 54.239.132.86 TCP 66 49925 > http [ACK] Seq=98 Ack=345083 Win=601344 Len=0 TSval=5172213 TSecr=1684827650
 74   0.016146 54.239.132.86 -> 172.31.8.238 TCP 21786 [TCP segment of a reassembled PDU]
 75   0.016159 172.31.8.238 -> 54.239.132.86 TCP 66 49925 > http [ACK] Seq=98 Ack=366803 Win=644864 Len=0 TSval=5172213 TSecr=1684827650
 76   0.016174 54.239.132.86 -> 172.31.8.238 TCP 4410 [TCP segment of a reassembled PDU]
 77   0.016178 172.31.8.238 -> 54.239.132.86 TCP 66 49925 > http [ACK] Seq=98 Ack=371147 Win=653568 Len=0 TSval=5172213 TSecr=1684827650
 78   0.016250 54.239.132.86 -> 172.31.8.238 TCP 15994 [TCP segment of a reassembled PDU]
 79   0.016260 172.31.8.238 -> 54.239.132.86 TCP 66 49925 > http [ACK] Seq=98 Ack=387075 Win=685312 Len=0 TSval=5172213 TSecr=1684827650
 80   0.016565 54.239.132.86 -> 172.31.8.238 TCP 14546 [TCP segment of a reassembled PDU]
 81   0.016575 172.31.8.238 -> 54.239.132.86 TCP 66 49925 > http [ACK] Seq=98 Ack=401555 Win=714368 Len=0 TSval=5172213 TSecr=1684827650
 82   0.016872 54.239.132.86 -> 172.31.8.238 TCP 26130 [TCP segment of a reassembled PDU]
 83   0.016886 172.31.8.238 -> 54.239.132.86 TCP 66 49925 > http [ACK] Seq=98 Ack=427619 Win=766464 Len=0 TSval=5172213 TSecr=1684827650
 84   0.016939 54.239.132.86 -> 172.31.8.238 TCP 24682 [TCP segment of a reassembled PDU]
 85   0.016952 172.31.8.238 -> 54.239.132.86 TCP 66 49925 > http [ACK] Seq=98 Ack=452235 Win=815744 Len=0 TSval=5172213 TSecr=1684827650
 86   0.017582 54.239.132.86 -> 172.31.8.238 TCP 4410 [TCP segment of a reassembled PDU]
 87   0.017588 172.31.8.238 -> 54.239.132.86 TCP 66 49925 > http [ACK] Seq=98 Ack=456579 Win=824320 Len=0 TSval=5172213 TSecr=1684827650
 88   0.017758 54.239.132.86 -> 172.31.8.238 TCP 26130 [TCP segment of a reassembled PDU]
 89   0.017772 172.31.8.238 -> 54.239.132.86 TCP 66 49925 > http [ACK] Seq=98 Ack=482643 Win=876544 Len=0 TSval=5172213 TSecr=1684827650
 90   0.017824 54.239.132.86 -> 172.31.8.238 TCP 21786 [TCP segment of a reassembled PDU]
 91   0.017837 172.31.8.238 -> 54.239.132.86 TCP 66 49925 > http [ACK] Seq=98 Ack=504363 Win=919936 Len=0 TSval=5172213 TSecr=1684827650
 92   0.017896 54.239.132.86 -> 172.31.8.238 TCP 17442 [TCP segment of a reassembled PDU]
 93   0.017907 172.31.8.238 -> 54.239.132.86 TCP 66 49925 > http [ACK] Seq=98 Ack=521739 Win=954752 Len=0 TSval=5172213 TSecr=1684827650
 94   0.018301 54.239.132.86 -> 172.31.8.238 TCP 4410 [TCP segment of a reassembled PDU]
 95   0.018308 172.31.8.238 -> 54.239.132.86 TCP 66 49925 > http [ACK] Seq=98 Ack=526083 Win=963328 Len=0 TSval=5172213 TSecr=1684827650
 96   0.018435 54.239.132.86 -> 172.31.8.238 TCP 8754 [TCP segment of a reassembled PDU]
 97   0.018443 172.31.8.238 -> 54.239.132.86 TCP 66 49925 > http [ACK] Seq=98 Ack=534771 Win=980736 Len=0 TSval=5172213 TSecr=1684827650
 98   0.018564 54.239.132.86 -> 172.31.8.238 TCP 26130 [TCP segment of a reassembled PDU]
 99   0.018578 172.31.8.238 -> 54.239.132.86 TCP 66 49925 > http [ACK] Seq=98 Ack=560835 Win=1032832 Len=0 TSval=5172213 TSecr=1684827650
100   0.018603 54.239.132.86 -> 172.31.8.238 TCP 17442 [TCP segment of a reassembled PDU]
101   0.018612 172.31.8.238 -> 54.239.132.86 TCP 66 49925 > http [ACK] Seq=98 Ack=578211 Win=1036800 Len=0 TSval=5172213 TSecr=1684827650
102   0.018919 54.239.132.86 -> 172.31.8.238 TCP 18890 [TCP segment of a reassembled PDU]
103   0.018930 172.31.8.238 -> 54.239.132.86 TCP 66 49925 > http [ACK] Seq=98 Ack=597035 Win=1077376 Len=0 TSval=5172213 TSecr=1684827650
104   0.018937 54.239.132.86 -> 172.31.8.238 TCP 2962 [TCP segment of a reassembled PDU]
105   0.018940 172.31.8.238 -> 54.239.132.86 TCP 66 49925 > http [ACK] Seq=98 Ack=599931 Win=1074560 Len=0 TSval=5172213 TSecr=1684827650
106   0.019083 54.239.132.86 -> 172.31.8.238 TCP 5858 [TCP segment of a reassembled PDU]
107   0.019090 172.31.8.238 -> 54.239.132.86 TCP 66 49925 > http [ACK] Seq=98 Ack=605723 Win=1098752 Len=0 TSval=5172213 TSecr=1684827650
108   0.019250 54.239.132.86 -> 172.31.8.238 TCP 26130 [TCP segment of a reassembled PDU]
109   0.019265 172.31.8.238 -> 54.239.132.86 TCP 66 49925 > http [ACK] Seq=98 Ack=631787 Win=1074432 Len=0 TSval=5172214 TSecr=1684827650
110   0.019287 54.239.132.86 -> 172.31.8.238 TCP 8754 [TCP segment of a reassembled PDU]
111   0.019296 172.31.8.238 -> 54.239.132.86 TCP 66 49925 > http [ACK] Seq=98 Ack=640475 Win=1065856 Len=0 TSval=5172214 TSecr=1684827650
112   0.019425 54.239.132.86 -> 172.31.8.238 TCP 18890 [TCP segment of a reassembled PDU]
113   0.019436 172.31.8.238 -> 54.239.132.86 TCP 66 49925 > http [ACK] Seq=98 Ack=659299 Win=1086336 Len=0 TSval=5172214 TSecr=1684827650
114   0.019448 54.239.132.86 -> 172.31.8.238 TCP 5858 [TCP segment of a reassembled PDU]
115   0.019452 172.31.8.238 -> 54.239.132.86 TCP 66 49925 > http [ACK] Seq=98 Ack=665091 Win=1080576 Len=0 TSval=5172214 TSecr=1684827650
116   0.019904 54.239.132.86 -> 172.31.8.238 TCP 5858 [TCP segment of a reassembled PDU]
117   0.019912 172.31.8.238 -> 54.239.132.86 TCP 66 49925 > http [ACK] Seq=98 Ack=670883 Win=1107712 Len=0 TSval=5172214 TSecr=1684827650
118   0.020086 54.239.132.86 -> 172.31.8.238 TCP 26130 [TCP segment of a reassembled PDU]
119   0.020101 172.31.8.238 -> 54.239.132.86 TCP 66 49925 > http [ACK] Seq=98 Ack=696947 Win=1081728 Len=0 TSval=5172214 TSecr=1684827650
120   0.020172 54.239.132.86 -> 172.31.8.238 TCP 24682 [TCP segment of a reassembled PDU]
121   0.020186 172.31.8.238 -> 54.239.132.86 TCP 66 49925 > http [ACK] Seq=98 Ack=721563 Win=1076864 Len=0 TSval=5172214 TSecr=1684827650
122   0.020232 54.239.132.86 -> 172.31.8.238 TCP 8754 [TCP segment of a reassembled PDU]
123   0.020239 172.31.8.238 -> 54.239.132.86 TCP 66 49925 > http [ACK] Seq=98 Ack=730251 Win=1102976 Len=0 TSval=5172214 TSecr=1684827650
124   0.020413 54.239.132.86 -> 172.31.8.238 TCP 18890 [TCP segment of a reassembled PDU]
125   0.020425 172.31.8.238 -> 54.239.132.86 TCP 66 49925 > http [ACK] Seq=98 Ack=749075 Win=1086336 Len=0 TSval=5172214 TSecr=1684827650
126   0.020528 54.239.132.86 -> 172.31.8.238 TCP 14546 [TCP segment of a reassembled PDU]
127   0.020537 172.31.8.238 -> 54.239.132.86 TCP 66 49925 > http [ACK] Seq=98 Ack=763555 Win=1093376 Len=0 TSval=5172214 TSecr=1684827650
128   0.020676 54.239.132.86 -> 172.31.8.238 TCP 17442 [TCP segment of a reassembled PDU]
129   0.020698 172.31.8.238 -> 54.239.132.86 TCP 66 49925 > http [ACK] Seq=98 Ack=780931 Win=1088640 Len=0 TSval=5172214 TSecr=1684827650
130   0.020821 54.239.132.86 -> 172.31.8.238 TCP 14546 [TCP segment of a reassembled PDU]
131   0.020831 172.31.8.238 -> 54.239.132.86 TCP 66 49925 > http [ACK] Seq=98 Ack=795411 Win=1093376 Len=0 TSval=5172214 TSecr=1684827650
132   0.020930 54.239.132.86 -> 172.31.8.238 TCP 7306 [TCP segment of a reassembled PDU]
133   0.020937 172.31.8.238 -> 54.239.132.86 TCP 66 49925 > http [ACK] Seq=98 Ack=802651 Win=1105408 Len=0 TSval=5172214 TSecr=1684827650
134   0.021015 54.239.132.86 -> 172.31.8.238 TCP 26130 [TCP segment of a reassembled PDU]
135   0.021042 172.31.8.238 -> 54.239.132.86 TCP 66 49925 > http [ACK] Seq=98 Ack=828715 Win=1079424 Len=0 TSval=5172214 TSecr=1684827650
136   0.021097 54.239.132.86 -> 172.31.8.238 TCP 18890 [TCP segment of a reassembled PDU]
137   0.021109 172.31.8.238 -> 54.239.132.86 TCP 66 49925 > http [ACK] Seq=98 Ack=847539 Win=1086336 Len=0 TSval=5172214 TSecr=1684827650
138   0.021186 54.239.132.86 -> 172.31.8.238 TCP 13098 [TCP segment of a reassembled PDU]
139   0.021195 172.31.8.238 -> 54.239.132.86 TCP 66 49925 > http [ACK] Seq=98 Ack=860571 Win=1095936 Len=0 TSval=5172214 TSecr=1684827650
140   0.021403 54.239.132.86 -> 172.31.8.238 TCP 14546 [TCP segment of a reassembled PDU]
141   0.021427 172.31.8.238 -> 54.239.132.86 TCP 66 49925 > http [ACK] Seq=98 Ack=875051 Win=1116928 Len=0 TSval=5172214 TSecr=1684827650
142   0.021554 54.239.132.86 -> 172.31.8.238 TCP 23234 [TCP segment of a reassembled PDU]
143   0.021578 172.31.8.238 -> 54.239.132.86 TCP 66 49925 > http [ACK] Seq=98 Ack=898219 Win=1093760 Len=0 TSval=5172214 TSecr=1684827650
144   0.021683 54.239.132.86 -> 172.31.8.238 TCP 14546 [TCP segment of a reassembled PDU]
145   0.021705 172.31.8.238 -> 54.239.132.86 TCP 66 49925 > http [ACK] Seq=98 Ack=912699 Win=1116928 Len=0 TSval=5172214 TSecr=1684827650
146   0.021831 54.239.132.86 -> 172.31.8.238 TCP 24682 [TCP segment of a reassembled PDU]
147   0.021856 172.31.8.238 -> 54.239.132.86 TCP 66 49925 > http [ACK] Seq=98 Ack=937315 Win=1092352 Len=0 TSval=5172214 TSecr=1684827650
148   0.021865 54.239.132.86 -> 172.31.8.238 TCP 1514 [TCP segment of a reassembled PDU]
149   0.021967 54.239.132.86 -> 172.31.8.238 TCP 30474 [TCP segment of a reassembled PDU]
150   0.021995 172.31.8.238 -> 54.239.132.86 TCP 66 49925 > http [ACK] Seq=98 Ack=969171 Win=1067264 Len=0 TSval=5172214 TSecr=1684827650
151   0.022268 54.239.132.86 -> 172.31.8.238 TCP 20338 [TCP segment of a reassembled PDU]
152   0.022280 172.31.8.238 -> 54.239.132.86 TCP 66 49925 > http [ACK] Seq=98 Ack=989443 Win=1083904 Len=0 TSval=5172214 TSecr=1684827650
153   0.022399 54.239.132.86 -> 172.31.8.238 TCP 1514 [TCP segment of a reassembled PDU]
154   0.022682 54.239.132.86 -> 172.31.8.238 TCP 7306 [TCP segment of a reassembled PDU]
155   0.022690 172.31.8.238 -> 54.239.132.86 TCP 66 49925 > http [ACK] Seq=98 Ack=998131 Win=1105408 Len=0 TSval=5172214 TSecr=1684827650
156   0.022834 54.239.132.86 -> 172.31.8.238 TCP 26130 [TCP segment of a reassembled PDU]
157   0.022860 172.31.8.238 -> 54.239.132.86 TCP 66 49925 > http [ACK] Seq=98 Ack=1024195 Win=1079424 Len=0 TSval=5172214 TSecr=1684827650
158   0.022908 54.239.132.86 -> 172.31.8.238 TCP 26130 [TCP segment of a reassembled PDU]
159   0.022935 172.31.8.238 -> 54.239.132.86 TCP 66 49925 > http [ACK] Seq=98 Ack=1050259 Win=1074432 Len=0 TSval=5172214 TSecr=1684827650
160   0.022963 54.239.132.86 -> 172.31.8.238 TCP 5858 [TCP segment of a reassembled PDU]
161   0.022970 172.31.8.238 -> 54.239.132.86 TCP 66 49925 > http [ACK] Seq=98 Ack=1056051 Win=1107712 Len=0 TSval=5172214 TSecr=1684827650
162   0.023056 54.239.132.86 -> 172.31.8.238 TCP 26130 [TCP segment of a reassembled PDU]
163   0.023082 172.31.8.238 -> 54.239.132.86 TCP 66 49925 > http [ACK] Seq=98 Ack=1082115 Win=1081728 Len=0 TSval=5172214 TSecr=1684827650
164   0.023136 54.239.132.86 -> 172.31.8.238 TCP 24682 [TCP segment of a reassembled PDU]
165   0.023163 172.31.8.238 -> 54.239.132.86 TCP 66 49925 > http [ACK] Seq=98 Ack=1106731 Win=1116928 Len=0 TSval=5172215 TSecr=1684827650
166   0.023490 54.239.132.86 -> 172.31.8.238 TCP 18890 [TCP segment of a reassembled PDU]
167   0.023502 172.31.8.238 -> 54.239.132.86 TCP 66 49925 > http [ACK] Seq=98 Ack=1125555 Win=1154560 Len=0 TSval=5172215 TSecr=1684827650
168   0.023628 54.239.132.86 -> 172.31.8.238 TCP 26130 [TCP segment of a reassembled PDU]
169   0.023642 172.31.8.238 -> 54.239.132.86 TCP 66 49925 > http [ACK] Seq=98 Ack=1151619 Win=1206656 Len=0 TSval=5172215 TSecr=1684827650
170   0.023692 54.239.132.86 -> 172.31.8.238 TCP 17442 [TCP segment of a reassembled PDU]
171   0.023703 172.31.8.238 -> 54.239.132.86 TCP 66 49925 > http [ACK] Seq=98 Ack=1168995 Win=1241344 Len=0 TSval=5172215 TSecr=1684827650
172   0.023785 54.239.132.86 -> 172.31.8.238 TCP 17442 [TCP segment of a reassembled PDU]
173   0.023796 172.31.8.238 -> 54.239.132.86 TCP 66 49925 > http [ACK] Seq=98 Ack=1186371 Win=1276160 Len=0 TSval=5172215 TSecr=1684827650
174   0.023940 54.239.132.86 -> 172.31.8.238 TCP 26130 [TCP segment of a reassembled PDU]
175   0.023954 172.31.8.238 -> 54.239.132.86 TCP 66 49925 > http [ACK] Seq=98 Ack=1212435 Win=1328256 Len=0 TSval=5172215 TSecr=1684827650
176   0.023974 54.239.132.86 -> 172.31.8.238 TCP 18890 [TCP segment of a reassembled PDU]
177   0.023983 172.31.8.238 -> 54.239.132.86 TCP 66 49925 > http [ACK] Seq=98 Ack=1231259 Win=1365888 Len=0 TSval=5172215 TSecr=1684827650
178   0.024032 54.239.132.86 -> 172.31.8.238 TCP 1514 [TCP segment of a reassembled PDU]
179   0.024036 172.31.8.238 -> 54.239.132.86 TCP 66 49925 > http [ACK] Seq=98 Ack=1232707 Win=1368832 Len=0 TSval=5172215 TSecr=1684827650
180   0.024258 54.239.132.86 -> 172.31.8.238 TCP 24682 [TCP segment of a reassembled PDU]
181   0.024272 172.31.8.238 -> 54.239.132.86 TCP 66 49925 > http [ACK] Seq=98 Ack=1257323 Win=1418112 Len=0 TSval=5172215 TSecr=1684827651
182   0.024390 54.239.132.86 -> 172.31.8.238 TCP 26130 [TCP segment of a reassembled PDU]
183   0.024405 172.31.8.238 -> 54.239.132.86 TCP 66 49925 > http [ACK] Seq=98 Ack=1283387 Win=1470208 Len=0 TSval=5172215 TSecr=1684827651
184   0.024451 54.239.132.86 -> 172.31.8.238 TCP 15994 [TCP segment of a reassembled PDU]
185   0.024460 172.31.8.238 -> 54.239.132.86 TCP 66 49925 > http [ACK] Seq=98 Ack=1299315 Win=1502080 Len=0 TSval=5172215 TSecr=1684827651
186   0.024594 54.239.132.86 -> 172.31.8.238 TCP 26130 [TCP segment of a reassembled PDU]
187   0.024608 172.31.8.238 -> 54.239.132.86 TCP 66 49925 > http [ACK] Seq=98 Ack=1325379 Win=1554176 Len=0 TSval=5172215 TSecr=1684827651
188   0.024626 54.239.132.86 -> 172.31.8.238 TCP 20338 [TCP segment of a reassembled PDU]
189   0.024639 172.31.8.238 -> 54.239.132.86 TCP 66 49925 > http [ACK] Seq=98 Ack=1345651 Win=1594752 Len=0 TSval=5172215 TSecr=1684827651
190   0.024735 54.239.132.86 -> 172.31.8.238 TCP 29026 [TCP segment of a reassembled PDU]
191   0.024749 172.31.8.238 -> 54.239.132.86 TCP 66 49925 > http [ACK] Seq=98 Ack=1374611 Win=1594752 Len=0 TSval=5172215 TSecr=1684827651
192   0.024835 54.239.132.86 -> 172.31.8.238 TCP 7306 [TCP segment of a reassembled PDU]
193   0.024841 172.31.8.238 -> 54.239.132.86 TCP 66 49925 > http [ACK] Seq=98 Ack=1381851 Win=1594752 Len=0 TSval=5172215 TSecr=1684827651
194   0.025103 54.239.132.86 -> 172.31.8.238 TCP 26130 [TCP segment of a reassembled PDU]
195   0.025118 172.31.8.238 -> 54.239.132.86 TCP 66 49925 > http [ACK] Seq=98 Ack=1407915 Win=1594752 Len=0 TSval=5172215 TSecr=1684827651
196   0.025248 54.239.132.86 -> 172.31.8.238 TCP 31922 [TCP segment of a reassembled PDU]
197   0.025265 172.31.8.238 -> 54.239.132.86 TCP 66 49925 > http [ACK] Seq=98 Ack=1439771 Win=1594752 Len=0 TSval=5172215 TSecr=1684827651
198   0.025273 54.239.132.86 -> 172.31.8.238 TCP 7306 [TCP segment of a reassembled PDU]
199   0.025278 172.31.8.238 -> 54.239.132.86 TCP 66 49925 > http [ACK] Seq=98 Ack=1447011 Win=1594752 Len=0 TSval=5172215 TSecr=1684827651
200   0.025551 54.239.132.86 -> 172.31.8.238 TCP 23234 [TCP segment of a reassembled PDU]
201   0.025565 172.31.8.238 -> 54.239.132.86 TCP 66 49925 > http [ACK] Seq=98 Ack=1470179 Win=1594752 Len=0 TSval=5172215 TSecr=1684827651
202   0.025582 54.239.132.86 -> 172.31.8.238 TCP 2962 [TCP segment of a reassembled PDU]
203   0.025585 172.31.8.238 -> 54.239.132.86 TCP 66 49925 > http [ACK] Seq=98 Ack=1473075 Win=1594752 Len=0 TSval=5172215 TSecr=1684827651
204   0.025687 54.239.132.86 -> 172.31.8.238 TCP 26130 [TCP segment of a reassembled PDU]
205   0.025701 172.31.8.238 -> 54.239.132.86 TCP 66 49925 > http [ACK] Seq=98 Ack=1499139 Win=1594752 Len=0 TSval=5172215 TSecr=1684827651
206   0.025757 54.239.132.86 -> 172.31.8.238 TCP 13098 [TCP segment of a reassembled PDU]
207   0.025766 172.31.8.238 -> 54.239.132.86 TCP 66 49925 > http [ACK] Seq=98 Ack=1512171 Win=1594752 Len=0 TSval=5172215 TSecr=1684827651
208   0.025832 54.239.132.86 -> 172.31.8.238 TCP 20338 [TCP segment of a reassembled PDU]
209   0.025844 172.31.8.238 -> 54.239.132.86 TCP 66 49925 > http [ACK] Seq=98 Ack=1532443 Win=1594752 Len=0 TSval=5172215 TSecr=1684827651
210   0.025882 54.239.132.86 -> 172.31.8.238 TCP 1514 [TCP segment of a reassembled PDU]
211   0.025983 54.239.132.86 -> 172.31.8.238 TCP 26130 [TCP segment of a reassembled PDU]
212   0.025996 172.31.8.238 -> 54.239.132.86 TCP 66 49925 > http [ACK] Seq=98 Ack=1559955 Win=1594752 Len=0 TSval=5172215 TSecr=1684827651
213   0.026009 54.239.132.86 -> 172.31.8.238 TCP 17442 [TCP segment of a reassembled PDU]
214   0.026018 172.31.8.238 -> 54.239.132.86 TCP 66 49925 > http [ACK] Seq=98 Ack=1577331 Win=1594752 Len=0 TSval=5172215 TSecr=1684827651
215   0.026321 54.239.132.86 -> 172.31.8.238 TCP 17442 [TCP segment of a reassembled PDU]
216   0.026332 172.31.8.238 -> 54.239.132.86 TCP 66 49925 > http [ACK] Seq=98 Ack=1594707 Win=1594752 Len=0 TSval=5172215 TSecr=1684827651
217   0.026355 54.239.132.86 -> 172.31.8.238 TCP 8754 [TCP segment of a reassembled PDU]
218   0.026361 172.31.8.238 -> 54.239.132.86 TCP 66 49925 > http [ACK] Seq=98 Ack=1603395 Win=1594752 Len=0 TSval=5172215 TSecr=1684827651
219   0.026525 54.239.132.86 -> 172.31.8.238 TCP 39162 [TCP segment of a reassembled PDU]
220   0.026544 172.31.8.238 -> 54.239.132.86 TCP 66 49925 > http [ACK] Seq=98 Ack=1642491 Win=1594752 Len=0 TSval=5172215 TSecr=1684827651
221   0.026896 54.239.132.86 -> 172.31.8.238 TCP 24682 [TCP segment of a reassembled PDU]
222   0.026910 172.31.8.238 -> 54.239.132.86 TCP 66 49925 > http [ACK] Seq=98 Ack=1667107 Win=1594752 Len=0 TSval=5172215 TSecr=1684827651
223   0.027041 54.239.132.86 -> 172.31.8.238 TCP 26130 [TCP segment of a reassembled PDU]
224   0.027054 172.31.8.238 -> 54.239.132.86 TCP 66 49925 > http [ACK] Seq=98 Ack=1693171 Win=1594752 Len=0 TSval=5172215 TSecr=1684827651
225   0.027123 54.239.132.86 -> 172.31.8.238 TCP 26130 [TCP segment of a reassembled PDU]
226   0.027137 172.31.8.238 -> 54.239.132.86 TCP 66 49925 > http [ACK] Seq=98 Ack=1719235 Win=1594752 Len=0 TSval=5172215 TSecr=1684827651
227   0.027217 54.239.132.86 -> 172.31.8.238 TCP 26130 [TCP segment of a reassembled PDU]
228   0.027232 172.31.8.238 -> 54.239.132.86 TCP 66 49925 > http [ACK] Seq=98 Ack=1745299 Win=1594752 Len=0 TSval=5172216 TSecr=1684827651
229   0.027301 54.239.132.86 -> 172.31.8.238 TCP 26130 [TCP segment of a reassembled PDU]
230   0.027315 172.31.8.238 -> 54.239.132.86 TCP 66 49925 > http [ACK] Seq=98 Ack=1771363 Win=1594752 Len=0 TSval=5172216 TSecr=1684827651
231   0.027339 54.239.132.86 -> 172.31.8.238 TCP 1514 [TCP segment of a reassembled PDU]
232   0.027665 54.239.132.86 -> 172.31.8.238 TCP 5858 [TCP segment of a reassembled PDU]
233   0.027672 172.31.8.238 -> 54.239.132.86 TCP 66 49925 > http [ACK] Seq=98 Ack=1778603 Win=1594752 Len=0 TSval=5172216 TSecr=1684827651
234   0.027844 54.239.132.86 -> 172.31.8.238 TCP 26130 [TCP segment of a reassembled PDU]
235   0.027858 172.31.8.238 -> 54.239.132.86 TCP 66 49925 > http [ACK] Seq=98 Ack=1804667 Win=1594752 Len=0 TSval=5172216 TSecr=1684827651
236   0.027917 54.239.132.86 -> 172.31.8.238 TCP 26130 [TCP segment of a reassembled PDU]
237   0.027932 172.31.8.238 -> 54.239.132.86 TCP 66 49925 > http [ACK] Seq=98 Ack=1830731 Win=1594752 Len=0 TSval=5172216 TSecr=1684827651
238   0.027976 54.239.132.86 -> 172.31.8.238 TCP 7306 [TCP segment of a reassembled PDU]
239   0.027983 172.31.8.238 -> 54.239.132.86 TCP 66 49925 > http [ACK] Seq=98 Ack=1837971 Win=1594752 Len=0 TSval=5172216 TSecr=1684827651
240   0.028070 54.239.132.86 -> 172.31.8.238 TCP 26130 [TCP segment of a reassembled PDU]
241   0.028084 172.31.8.238 -> 54.239.132.86 TCP 66 49925 > http [ACK] Seq=98 Ack=1864035 Win=1594752 Len=0 TSval=5172216 TSecr=1684827651
242   0.028155 54.239.132.86 -> 172.31.8.238 TCP 26130 [TCP segment of a reassembled PDU]
243   0.028169 172.31.8.238 -> 54.239.132.86 TCP 66 49925 > http [ACK] Seq=98 Ack=1890099 Win=1594752 Len=0 TSval=5172216 TSecr=1684827651
244   0.028210 54.239.132.86 -> 172.31.8.238 TCP 13098 [TCP segment of a reassembled PDU]
245   0.028216 172.31.8.238 -> 54.239.132.86 TCP 66 49925 > http [ACK] Seq=98 Ack=1903131 Win=1594752 Len=0 TSval=5172216 TSecr=1684827651
246   0.028489 54.239.132.86 -> 172.31.8.238 TCP 15994 [TCP segment of a reassembled PDU]
247   0.028496 172.31.8.238 -> 54.239.132.86 TCP 66 49925 > http [ACK] Seq=98 Ack=1919059 Win=1594752 Len=0 TSval=5172216 TSecr=1684827651
248   0.028650 54.239.132.86 -> 172.31.8.238 TCP 26130 [TCP segment of a reassembled PDU]
249   0.028658 172.31.8.238 -> 54.239.132.86 TCP 66 49925 > http [ACK] Seq=98 Ack=1945123 Win=1594752 Len=0 TSval=5172216 TSecr=1684827651
250   0.028721 54.239.132.86 -> 172.31.8.238 TCP 26130 [TCP segment of a reassembled PDU]
251   0.028729 172.31.8.238 -> 54.239.132.86 TCP 66 49925 > http [ACK] Seq=98 Ack=1971187 Win=1594752 Len=0 TSval=5172216 TSecr=1684827651
252   0.028802 54.239.132.86 -> 172.31.8.238 TCP 26130 [TCP segment of a reassembled PDU]
253   0.028810 172.31.8.238 -> 54.239.132.86 TCP 66 49925 > http [ACK] Seq=98 Ack=1997251 Win=1594752 Len=0 TSval=5172216 TSecr=1684827651
254   0.028883 54.239.132.86 -> 172.31.8.238 TCP 26130 [TCP segment of a reassembled PDU]
255   0.028891 172.31.8.238 -> 54.239.132.86 TCP 66 49925 > http [ACK] Seq=98 Ack=2023315 Win=1594752 Len=0 TSval=5172216 TSecr=1684827651
256   0.028941 54.239.132.86 -> 172.31.8.238 TCP 10202 [TCP segment of a reassembled PDU]
257   0.028946 172.31.8.238 -> 54.239.132.86 TCP 66 49925 > http [ACK] Seq=98 Ack=2033451 Win=1594752 Len=0 TSval=5172216 TSecr=1684827651
258   0.029145 54.239.132.86 -> 172.31.8.238 TCP 26130 [TCP segment of a reassembled PDU]
259   0.029154 172.31.8.238 -> 54.239.132.86 TCP 66 49925 > http [ACK] Seq=98 Ack=2059515 Win=1594752 Len=0 TSval=5172216 TSecr=1684827651
260   0.029219 54.239.132.86 -> 172.31.8.238 TCP 26130 [TCP segment of a reassembled PDU]
261   0.029227 172.31.8.238 -> 54.239.132.86 TCP 66 49925 > http [ACK] Seq=98 Ack=2085579 Win=1594752 Len=0 TSval=5172216 TSecr=1684827651
262   0.029278 54.239.132.86 -> 172.31.8.238 TCP 13098 [TCP segment of a reassembled PDU]
263   0.029283 172.31.8.238 -> 54.239.132.86 TCP 66 49925 > http [ACK] Seq=98 Ack=2098611 Win=1594752 Len=0 TSval=5172216 TSecr=1684827651
264   0.029540 54.239.132.86 -> 172.31.8.238 TCP 7306 [TCP segment of a reassembled PDU]
265   0.029545 172.31.8.238 -> 54.239.132.86 TCP 66 49925 > http [ACK] Seq=98 Ack=2105851 Win=1594752 Len=0 TSval=5172216 TSecr=1684827651
266   0.029718 54.239.132.86 -> 172.31.8.238 TCP 26130 [TCP segment of a reassembled PDU]
267   0.029725 172.31.8.238 -> 54.239.132.86 TCP 66 49925 > http [ACK] Seq=98 Ack=2131915 Win=1594752 Len=0 TSval=5172216 TSecr=1684827651
268   0.029785 54.239.132.86 -> 172.31.8.238 TCP 26130 [TCP segment of a reassembled PDU]
269   0.029792 172.31.8.238 -> 54.239.132.86 TCP 66 49925 > http [ACK] Seq=98 Ack=2157979 Win=1594752 Len=0 TSval=5172216 TSecr=1684827651
270   0.029870 54.239.132.86 -> 172.31.8.238 TCP 24682 [TCP segment of a reassembled PDU]
271   0.029877 172.31.8.238 -> 54.239.132.86 TCP 66 49925 > http [ACK] Seq=98 Ack=2182595 Win=1594752 Len=0 TSval=5172216 TSecr=1684827651
272   0.029918 54.239.132.86 -> 172.31.8.238 TCP 2962 [TCP segment of a reassembled PDU]
273   0.029922 172.31.8.238 -> 54.239.132.86 TCP 66 49925 > http [ACK] Seq=98 Ack=2185491 Win=1594752 Len=0 TSval=5172216 TSecr=1684827651
274   0.030192 54.239.132.86 -> 172.31.8.238 TCP 26130 [TCP segment of a reassembled PDU]
275   0.030200 172.31.8.238 -> 54.239.132.86 TCP 66 49925 > http [ACK] Seq=98 Ack=2211555 Win=1594752 Len=0 TSval=5172216 TSecr=1684827651
276   0.030264 54.239.132.86 -> 172.31.8.238 TCP 26130 [TCP segment of a reassembled PDU]
277   0.030271 172.31.8.238 -> 54.239.132.86 TCP 66 49925 > http [ACK] Seq=98 Ack=2237619 Win=1594752 Len=0 TSval=5172216 TSecr=1684827651
278   0.030349 54.239.132.86 -> 172.31.8.238 TCP 26130 [TCP segment of a reassembled PDU]
279   0.030355 172.31.8.238 -> 54.239.132.86 TCP 66 49925 > http [ACK] Seq=98 Ack=2263683 Win=1594752 Len=0 TSval=5172216 TSecr=1684827651
280   0.030434 54.239.132.86 -> 172.31.8.238 TCP 26130 [TCP segment of a reassembled PDU]
281   0.030441 172.31.8.238 -> 54.239.132.86 TCP 66 49925 > http [ACK] Seq=98 Ack=2289747 Win=1594752 Len=0 TSval=5172216 TSecr=1684827651
282   0.030480 54.239.132.86 -> 172.31.8.238 TCP 4410 [TCP segment of a reassembled PDU]
283   0.030484 172.31.8.238 -> 54.239.132.86 TCP 66 49925 > http [ACK] Seq=98 Ack=2294091 Win=1594752 Len=0 TSval=5172216 TSecr=1684827651
284   0.030685 54.239.132.86 -> 172.31.8.238 TCP 26130 [TCP segment of a reassembled PDU]
285   0.030693 172.31.8.238 -> 54.239.132.86 TCP 66 49925 > http [ACK] Seq=98 Ack=2320155 Win=1594752 Len=0 TSval=5172216 TSecr=1684827651
286   0.030772 54.239.132.86 -> 172.31.8.238 TCP 26130 [TCP segment of a reassembled PDU]
287   0.030780 172.31.8.238 -> 54.239.132.86 TCP 66 49925 > http [ACK] Seq=98 Ack=2346219 Win=1594752 Len=0 TSval=5172216 TSecr=1684827651
288   0.030840 54.239.132.86 -> 172.31.8.238 TCP 13098 [TCP segment of a reassembled PDU]
289   0.030845 172.31.8.238 -> 54.239.132.86 TCP 66 49925 > http [ACK] Seq=98 Ack=2359251 Win=1594752 Len=0 TSval=5172216 TSecr=1684827651
290   0.031164 54.239.132.86 -> 172.31.8.238 TCP 26130 [TCP segment of a reassembled PDU]
291   0.031172 172.31.8.238 -> 54.239.132.86 TCP 66 49925 > http [ACK] Seq=98 Ack=2385315 Win=1594752 Len=0 TSval=5172217 TSecr=1684827651
292   0.031234 54.239.132.86 -> 172.31.8.238 TCP 23234 [TCP segment of a reassembled PDU]
293   0.031241 172.31.8.238 -> 54.239.132.86 TCP 66 49925 > http [ACK] Seq=98 Ack=2408483 Win=1594752 Len=0 TSval=5172217 TSecr=1684827651
294   0.031374 54.239.132.86 -> 172.31.8.238 TCP 29026 [TCP segment of a reassembled PDU]
295   0.031382 172.31.8.238 -> 54.239.132.86 TCP 66 49925 > http [ACK] Seq=98 Ack=2437443 Win=1594752 Len=0 TSval=5172217 TSecr=1684827651
296   0.031400 54.239.132.86 -> 172.31.8.238 TCP 26130 [TCP segment of a reassembled PDU]
297   0.031409 172.31.8.238 -> 54.239.132.86 TCP 66 49925 > http [ACK] Seq=98 Ack=2463507 Win=1594752 Len=0 TSval=5172217 TSecr=1684827651
298   0.031499 54.239.132.86 -> 172.31.8.238 TCP 26130 [TCP segment of a reassembled PDU]
299   0.031505 172.31.8.238 -> 54.239.132.86 TCP 66 49925 > http [ACK] Seq=98 Ack=2489571 Win=1594752 Len=0 TSval=5172217 TSecr=1684827651
300   0.031591 54.239.132.86 -> 172.31.8.238 TCP 26130 [TCP segment of a reassembled PDU]
301   0.031598 172.31.8.238 -> 54.239.132.86 TCP 66 49925 > http [ACK] Seq=98 Ack=2515635 Win=1594752 Len=0 TSval=5172217 TSecr=1684827651
302   0.031672 54.239.132.86 -> 172.31.8.238 TCP 26130 [TCP segment of a reassembled PDU]
303   0.031679 172.31.8.238 -> 54.239.132.86 TCP 66 49925 > http [ACK] Seq=98 Ack=2541699 Win=1594752 Len=0 TSval=5172217 TSecr=1684827651
304   0.031725 54.239.132.86 -> 172.31.8.238 TCP 13098 [TCP segment of a reassembled PDU]
305   0.031729 172.31.8.238 -> 54.239.132.86 TCP 66 49925 > http [ACK] Seq=98 Ack=2554731 Win=1594752 Len=0 TSval=5172217 TSecr=1684827651
306   0.032143 54.239.132.86 -> 172.31.8.238 TCP 23234 [TCP segment of a reassembled PDU]
307   0.032151 172.31.8.238 -> 54.239.132.86 TCP 66 49925 > http [ACK] Seq=98 Ack=2577899 Win=1594752 Len=0 TSval=5172217 TSecr=1684827651
308   0.032258 54.239.132.86 -> 172.31.8.238 TCP 29026 [TCP segment of a reassembled PDU]
309   0.032265 172.31.8.238 -> 54.239.132.86 TCP 66 49925 > http [ACK] Seq=98 Ack=2606859 Win=1594752 Len=0 TSval=5172217 TSecr=1684827651
310   0.032288 54.239.132.86 -> 172.31.8.238 TCP 26130 [TCP segment of a reassembled PDU]
311   0.032293 172.31.8.238 -> 54.239.132.86 TCP 66 49925 > http [ACK] Seq=98 Ack=2632923 Win=1594752 Len=0 TSval=5172217 TSecr=1684827651
312   0.032386 54.239.132.86 -> 172.31.8.238 TCP 26130 [TCP segment of a reassembled PDU]
313   0.032393 172.31.8.238 -> 54.239.132.86 TCP 66 49925 > http [ACK] Seq=98 Ack=2658987 Win=1594752 Len=0 TSval=5172217 TSecr=1684827651
314   0.032471 54.239.132.86 -> 172.31.8.238 TCP 26130 [TCP segment of a reassembled PDU]
315   0.032478 172.31.8.238 -> 54.239.132.86 TCP 66 49925 > http [ACK] Seq=98 Ack=2685051 Win=1594752 Len=0 TSval=5172217 TSecr=1684827651
316   0.032553 54.239.132.86 -> 172.31.8.238 TCP 26130 [TCP segment of a reassembled PDU]
317   0.032560 172.31.8.238 -> 54.239.132.86 TCP 66 49925 > http [ACK] Seq=98 Ack=2711115 Win=1594752 Len=0 TSval=5172217 TSecr=1684827651
318   0.032640 54.239.132.86 -> 172.31.8.238 TCP 26130 [TCP segment of a reassembled PDU]
319   0.032647 172.31.8.238 -> 54.239.132.86 TCP 66 49925 > http [ACK] Seq=98 Ack=2737179 Win=1594752 Len=0 TSval=5172217 TSecr=1684827651
320   0.032693 54.239.132.86 -> 172.31.8.238 TCP 13098 [TCP segment of a reassembled PDU]
321   0.032697 172.31.8.238 -> 54.239.132.86 TCP 66 49925 > http [ACK] Seq=98 Ack=2750211 Win=1594752 Len=0 TSval=5172217 TSecr=1684827651
322   0.032944 54.239.132.86 -> 172.31.8.238 TCP 1514 [TCP segment of a reassembled PDU]
323   0.033116 54.239.132.86 -> 172.31.8.238 TCP 26130 [TCP segment of a reassembled PDU]
324   0.033123 172.31.8.238 -> 54.239.132.86 TCP 66 49925 > http [ACK] Seq=98 Ack=2777723 Win=1594752 Len=0 TSval=5172217 TSecr=1684827651
325   0.033184 54.239.132.86 -> 172.31.8.238 TCP 21786 [TCP segment of a reassembled PDU]
326   0.033192 172.31.8.238 -> 54.239.132.86 TCP 66 49925 > http [ACK] Seq=98 Ack=2799443 Win=1594752 Len=0 TSval=5172217 TSecr=1684827651
327   0.033243 54.239.132.86 -> 172.31.8.238 TCP 4410 [TCP segment of a reassembled PDU]
328   0.033248 172.31.8.238 -> 54.239.132.86 TCP 66 49925 > http [ACK] Seq=98 Ack=2803787 Win=1594752 Len=0 TSval=5172217 TSecr=1684827651
329   0.033314 54.239.132.86 -> 172.31.8.238 TCP 7306 [TCP segment of a reassembled PDU]
330   0.033319 172.31.8.238 -> 54.239.132.86 TCP 66 49925 > http [ACK] Seq=98 Ack=2811027 Win=1594752 Len=0 TSval=5172217 TSecr=1684827651
331   0.033325 54.239.132.86 -> 172.31.8.238 TCP 1514 [TCP Previous segment not captured] [TCP segment of a reassembled PDU]
332   0.033328 172.31.8.238 -> 54.239.132.86 TCP 78 [TCP Dup ACK 330#1] 49925 > http [ACK] Seq=98 Ack=2811027 Win=1594752 Len=0 TSval=5172217 TSecr=1684827651 SLE=2812475 SRE=2813923
333   0.033330 54.239.132.86 -> 172.31.8.238 TCP 1514 [TCP Out-Of-Order] [TCP segment of a reassembled PDU]
334   0.033333 172.31.8.238 -> 54.239.132.86 TCP 66 49925 > http [ACK] Seq=98 Ack=2813923 Win=1594752 Len=0 TSval=5172217 TSecr=1684827651
335   0.033607 54.239.132.86 -> 172.31.8.238 TCP 47850 [TCP segment of a reassembled PDU]
336   0.033617 172.31.8.238 -> 54.239.132.86 TCP 66 49925 > http [ACK] Seq=98 Ack=2861707 Win=1594752 Len=0 TSval=5172217 TSecr=1684827651
337   0.033731 54.239.132.86 -> 172.31.8.238 TCP 30474 [TCP segment of a reassembled PDU]
338   0.033739 172.31.8.238 -> 54.239.132.86 TCP 66 49925 > http [ACK] Seq=98 Ack=2892115 Win=1594752 Len=0 TSval=5172217 TSecr=1684827651
339   0.033766 54.239.132.86 -> 172.31.8.238 TCP 31922 [TCP segment of a reassembled PDU]
340   0.033773 172.31.8.238 -> 54.239.132.86 TCP 66 49925 > http [ACK] Seq=98 Ack=2923971 Win=1594752 Len=0 TSval=5172217 TSecr=1684827651
341   0.033842 54.239.132.86 -> 172.31.8.238 TCP 21786 [TCP segment of a reassembled PDU]
342   0.033848 172.31.8.238 -> 54.239.132.86 TCP 66 49925 > http [ACK] Seq=98 Ack=2945691 Win=1594752 Len=0 TSval=5172217 TSecr=1684827651
343   0.034070 54.239.132.86 -> 172.31.8.238 TCP 26130 [TCP segment of a reassembled PDU]
344   0.034078 172.31.8.238 -> 54.239.132.86 TCP 66 49925 > http [ACK] Seq=98 Ack=2971755 Win=1594752 Len=0 TSval=5172217 TSecr=1684827652
345   0.034140 54.239.132.86 -> 172.31.8.238 TCP 26130 [TCP segment of a reassembled PDU]
346   0.034147 172.31.8.238 -> 54.239.132.86 TCP 66 49925 > http [ACK] Seq=98 Ack=2997819 Win=1594752 Len=0 TSval=5172217 TSecr=1684827652
347   0.034215 54.239.132.86 -> 172.31.8.238 TCP 17442 [TCP segment of a reassembled PDU]
348   0.034226 172.31.8.238 -> 54.239.132.86 TCP 66 49925 > http [ACK] Seq=98 Ack=3015195 Win=1594752 Len=0 TSval=5172217 TSecr=1684827652
349   0.034297 54.239.132.86 -> 172.31.8.238 TCP 18890 [TCP segment of a reassembled PDU]
