[Measurement for 10mb at 10:44:20 20.44.2014] 
Tshark:

  1   0.000000 172.31.8.238 -> 172.31.0.2   DNS 89 Standard query 0x6b83  A d2pcb72msibvx3.cloudfront.net
  2   0.000038 172.31.8.238 -> 172.31.0.2   DNS 89 Standard query 0x8ef4  AAAA d2pcb72msibvx3.cloudfront.net
  3   0.000740   172.31.0.2 -> 172.31.8.238 DNS 217 Standard query response 0x6b83  A 54.192.118.238 A 54.230.118.239 A 54.230.119.12 A 54.230.119.189 A 54.239.132.84 A 54.239.132.196 A 54.239.132.233 A 54.192.118.234
  4   0.000762   172.31.0.2 -> 172.31.8.238 DNS 169 Standard query response 0x8ef4 
  5   0.003849 172.31.8.238 -> 54.192.118.238 TCP 74 53247 > http [SYN] Seq=0 Win=26883 Len=0 MSS=8961 SACK_PERM=1 TSval=15972164 TSecr=0 WS=128
  6   0.004705 54.192.118.238 -> 172.31.8.238 TCP 74 http > 53247 [SYN, ACK] Seq=0 Ack=1 Win=14480 Len=0 MSS=1460 SACK_PERM=1 TSval=1688181681 TSecr=15972164 WS=128
  7   0.004719 172.31.8.238 -> 54.192.118.238 TCP 66 53247 > http [ACK] Seq=1 Ack=1 Win=27008 Len=0 TSval=15972164 TSecr=1688181681
  8   0.004768 172.31.8.238 -> 54.192.118.238 HTTP 163 GET /10mb HTTP/1.1 
  9   0.005240 54.192.118.238 -> 172.31.8.238 TCP 66 http > 53247 [ACK] Seq=1 Ack=98 Win=14592 Len=0 TSval=1688181681 TSecr=15972164
 10   0.007263 54.192.118.238 -> 172.31.8.238 TCP 524 [TCP segment of a reassembled PDU]
 11   0.007269 172.31.8.238 -> 54.192.118.238 TCP 66 53247 > http [ACK] Seq=98 Ack=459 Win=28032 Len=0 TSval=15972164 TSecr=1688181681
 12   0.007416 54.192.118.238 -> 172.31.8.238 TCP 13098 [TCP segment of a reassembled PDU]
 13   0.007427 172.31.8.238 -> 54.192.118.238 TCP 66 53247 > http [ACK] Seq=98 Ack=13491 Win=54144 Len=0 TSval=15972165 TSecr=1688181681
 14   0.008070 54.192.118.238 -> 172.31.8.238 TCP 7306 [TCP segment of a reassembled PDU]
 15   0.008078 172.31.8.238 -> 54.192.118.238 TCP 66 53247 > http [ACK] Seq=98 Ack=20731 Win=68608 Len=0 TSval=15972165 TSecr=1688181681
 16   0.008134 54.192.118.238 -> 172.31.8.238 TCP 5858 [TCP segment of a reassembled PDU]
 17   0.008140 172.31.8.238 -> 54.192.118.238 TCP 66 53247 > http [ACK] Seq=98 Ack=26523 Win=80128 Len=0 TSval=15972165 TSecr=1688181681
 18   0.008829 54.192.118.238 -> 172.31.8.238 TCP 5858 [TCP segment of a reassembled PDU]
 19   0.008837 172.31.8.238 -> 54.192.118.238 TCP 66 53247 > http [ACK] Seq=98 Ack=32315 Win=91776 Len=0 TSval=15972165 TSecr=1688181681
 20   0.008963 54.192.118.238 -> 172.31.8.238 TCP 14546 [TCP segment of a reassembled PDU]
 21   0.008973 172.31.8.238 -> 54.192.118.238 TCP 66 53247 > http [ACK] Seq=98 Ack=46795 Win=94080 Len=0 TSval=15972165 TSecr=1688181681
 22   0.009593 54.192.118.238 -> 172.31.8.238 TCP 5858 [TCP segment of a reassembled PDU]
 23   0.009600 172.31.8.238 -> 54.192.118.238 TCP 66 53247 > http [ACK] Seq=98 Ack=52587 Win=108416 Len=0 TSval=15972165 TSecr=1688181681
 24   0.009716 54.192.118.238 -> 172.31.8.238 TCP 13098 [TCP segment of a reassembled PDU]
 25   0.009725 172.31.8.238 -> 54.192.118.238 TCP 66 53247 > http [ACK] Seq=98 Ack=65619 Win=96512 Len=0 TSval=15972165 TSecr=1688181681
 26   0.010368 54.192.118.238 -> 172.31.8.238 TCP 5858 [TCP segment of a reassembled PDU]
 27   0.010374 172.31.8.238 -> 54.192.118.238 TCP 66 53247 > http [ACK] Seq=98 Ack=71411 Win=108416 Len=0 TSval=15972165 TSecr=1688181681
 28   0.010493 54.192.118.238 -> 172.31.8.238 TCP 20338 [TCP segment of a reassembled PDU]
 29   0.010506 172.31.8.238 -> 54.192.118.238 TCP 66 53247 > http [ACK] Seq=98 Ack=91683 Win=88192 Len=0 TSval=15972165 TSecr=1688181681
 30   0.011124 54.192.118.238 -> 172.31.8.238 TCP 5858 [TCP segment of a reassembled PDU]
 31   0.011130 172.31.8.238 -> 54.192.118.238 TCP 66 53247 > http [ACK] Seq=98 Ack=97475 Win=108416 Len=0 TSval=15972165 TSecr=1688181681
 32   0.011267 54.192.118.238 -> 172.31.8.238 TCP 23234 [TCP segment of a reassembled PDU]
 33   0.011279 172.31.8.238 -> 54.192.118.238 TCP 66 53247 > http [ACK] Seq=98 Ack=120643 Win=85248 Len=0 TSval=15972166 TSecr=1688181681
 34   0.011885 54.192.118.238 -> 172.31.8.238 TCP 5858 [TCP segment of a reassembled PDU]
 35   0.011893 172.31.8.238 -> 54.192.118.238 TCP 66 53247 > http [ACK] Seq=98 Ack=126435 Win=120704 Len=0 TSval=15972166 TSecr=1688181682
 36   0.011984 54.192.118.238 -> 172.31.8.238 TCP 4410 [TCP segment of a reassembled PDU]
 37   0.011991 172.31.8.238 -> 54.192.118.238 TCP 66 53247 > http [ACK] Seq=98 Ack=130779 Win=129280 Len=0 TSval=15972166 TSecr=1688181682
 38   0.012054 54.192.118.238 -> 172.31.8.238 TCP 21786 [TCP segment of a reassembled PDU]
 39   0.012066 172.31.8.238 -> 54.192.118.238 TCP 66 53247 > http [ACK] Seq=98 Ack=152499 Win=172800 Len=0 TSval=15972166 TSecr=1688181682
 40   0.012658 54.192.118.238 -> 172.31.8.238 TCP 7306 [TCP segment of a reassembled PDU]
 41   0.012666 172.31.8.238 -> 54.192.118.238 TCP 66 53247 > http [ACK] Seq=98 Ack=159739 Win=187264 Len=0 TSval=15972166 TSecr=1688181682
 42   0.012796 54.192.118.238 -> 172.31.8.238 TCP 23234 [TCP segment of a reassembled PDU]
 43   0.012809 172.31.8.238 -> 54.192.118.238 TCP 66 53247 > http [ACK] Seq=98 Ack=182907 Win=233600 Len=0 TSval=15972166 TSecr=1688181682
 44   0.013435 54.192.118.238 -> 172.31.8.238 TCP 8754 [TCP segment of a reassembled PDU]
 45   0.013443 172.31.8.238 -> 54.192.118.238 TCP 66 53247 > http [ACK] Seq=98 Ack=191595 Win=251008 Len=0 TSval=15972166 TSecr=1688181682
 46   0.013590 54.192.118.238 -> 172.31.8.238 TCP 26130 [TCP segment of a reassembled PDU]
 47   0.013604 172.31.8.238 -> 54.192.118.238 TCP 66 53247 > http [ACK] Seq=98 Ack=217659 Win=303104 Len=0 TSval=15972166 TSecr=1688181682
 48   0.013613 54.192.118.238 -> 172.31.8.238 TCP 4410 [TCP segment of a reassembled PDU]
 49   0.013616 172.31.8.238 -> 54.192.118.238 TCP 66 53247 > http [ACK] Seq=98 Ack=222003 Win=311808 Len=0 TSval=15972166 TSecr=1688181682
 50   0.014444 54.192.118.238 -> 172.31.8.238 TCP 5858 [TCP segment of a reassembled PDU]
 51   0.014451 172.31.8.238 -> 54.192.118.238 TCP 66 53247 > http [ACK] Seq=98 Ack=227795 Win=323328 Len=0 TSval=15972166 TSecr=1688181682
 52   0.014621 54.192.118.238 -> 172.31.8.238 TCP 17442 [TCP segment of a reassembled PDU]
 53   0.014632 172.31.8.238 -> 54.192.118.238 TCP 66 53247 > http [ACK] Seq=98 Ack=245171 Win=358144 Len=0 TSval=15972166 TSecr=1688181682
 54   0.014655 54.192.118.238 -> 172.31.8.238 TCP 8754 [TCP segment of a reassembled PDU]
 55   0.014662 172.31.8.238 -> 54.192.118.238 TCP 66 53247 > http [ACK] Seq=98 Ack=253859 Win=375552 Len=0 TSval=15972166 TSecr=1688181682
 56   0.014708 54.192.118.238 -> 172.31.8.238 TCP 1514 [TCP segment of a reassembled PDU]
 57   0.014712 172.31.8.238 -> 54.192.118.238 TCP 66 53247 > http [ACK] Seq=98 Ack=255307 Win=378368 Len=0 TSval=15972166 TSecr=1688181682
 58   0.015221 54.192.118.238 -> 172.31.8.238 TCP 5858 [TCP segment of a reassembled PDU]
 59   0.015228 172.31.8.238 -> 54.192.118.238 TCP 66 53247 > http [ACK] Seq=98 Ack=261099 Win=390016 Len=0 TSval=15972166 TSecr=1688181682
 60   0.015382 54.192.118.238 -> 172.31.8.238 TCP 26130 [TCP segment of a reassembled PDU]
 61   0.015395 172.31.8.238 -> 54.192.118.238 TCP 66 53247 > http [ACK] Seq=98 Ack=287163 Win=442112 Len=0 TSval=15972167 TSecr=1688181682
 62   0.015433 54.192.118.238 -> 172.31.8.238 TCP 14546 [TCP segment of a reassembled PDU]
 63   0.015441 172.31.8.238 -> 54.192.118.238 TCP 66 53247 > http [ACK] Seq=98 Ack=301643 Win=471040 Len=0 TSval=15972167 TSecr=1688181682
 64   0.016248 54.192.118.238 -> 172.31.8.238 TCP 5858 [TCP segment of a reassembled PDU]
 65   0.016254 172.31.8.238 -> 54.192.118.238 TCP 66 53247 > http [ACK] Seq=98 Ack=307435 Win=482688 Len=0 TSval=15972167 TSecr=1688181682
 66   0.016441 54.192.118.238 -> 172.31.8.238 TCP 26130 [TCP segment of a reassembled PDU]
 67   0.016455 172.31.8.238 -> 54.192.118.238 TCP 66 53247 > http [ACK] Seq=98 Ack=333499 Win=534784 Len=0 TSval=15972167 TSecr=1688181682
 68   0.016508 54.192.118.238 -> 172.31.8.238 TCP 21786 [TCP segment of a reassembled PDU]
 69   0.016520 172.31.8.238 -> 54.192.118.238 TCP 66 53247 > http [ACK] Seq=98 Ack=355219 Win=578176 Len=0 TSval=15972167 TSecr=1688181682
 70   0.017267 54.192.118.238 -> 172.31.8.238 TCP 7306 [TCP segment of a reassembled PDU]
 71   0.017274 172.31.8.238 -> 54.192.118.238 TCP 66 53247 > http [ACK] Seq=98 Ack=362459 Win=592640 Len=0 TSval=15972167 TSecr=1688181682
 72   0.017441 54.192.118.238 -> 172.31.8.238 TCP 26130 [TCP segment of a reassembled PDU]
 73   0.017454 172.31.8.238 -> 54.192.118.238 TCP 66 53247 > http [ACK] Seq=98 Ack=388523 Win=644864 Len=0 TSval=15972167 TSecr=1688181682
 74   0.017502 54.192.118.238 -> 172.31.8.238 TCP 20338 [TCP segment of a reassembled PDU]
 75   0.017526 172.31.8.238 -> 54.192.118.238 TCP 66 53247 > http [ACK] Seq=98 Ack=408795 Win=685312 Len=0 TSval=15972167 TSecr=1688181682
 76   0.018232 54.192.118.238 -> 172.31.8.238 TCP 1514 [TCP segment of a reassembled PDU]
 77   0.018237 172.31.8.238 -> 54.192.118.238 TCP 66 53247 > http [ACK] Seq=98 Ack=410243 Win=688256 Len=0 TSval=15972167 TSecr=1688181682
 78   0.018414 54.192.118.238 -> 172.31.8.238 TCP 26130 [TCP segment of a reassembled PDU]
 79   0.018427 172.31.8.238 -> 54.192.118.238 TCP 66 53247 > http [ACK] Seq=98 Ack=436307 Win=740352 Len=0 TSval=15972167 TSecr=1688181682
 80   0.018485 54.192.118.238 -> 172.31.8.238 TCP 26130 [TCP segment of a reassembled PDU]
 81   0.018499 172.31.8.238 -> 54.192.118.238 TCP 66 53247 > http [ACK] Seq=98 Ack=462371 Win=792576 Len=0 TSval=15972167 TSecr=1688181682
 82   0.019027 54.192.118.238 -> 172.31.8.238 TCP 7306 [TCP segment of a reassembled PDU]
 83   0.019034 172.31.8.238 -> 54.192.118.238 TCP 66 53247 > http [ACK] Seq=98 Ack=469611 Win=807040 Len=0 TSval=15972167 TSecr=1688181682
 84   0.019205 54.192.118.238 -> 172.31.8.238 TCP 26130 [TCP segment of a reassembled PDU]
 85   0.019219 172.31.8.238 -> 54.192.118.238 TCP 66 53247 > http [ACK] Seq=98 Ack=495675 Win=859136 Len=0 TSval=15972167 TSecr=1688181682
 86   0.019235 54.192.118.238 -> 172.31.8.238 TCP 5858 [TCP segment of a reassembled PDU]
 87   0.019239 172.31.8.238 -> 54.192.118.238 TCP 66 53247 > http [ACK] Seq=98 Ack=501467 Win=870656 Len=0 TSval=15972167 TSecr=1688181682
 88   0.019317 54.192.118.238 -> 172.31.8.238 TCP 14546 [TCP segment of a reassembled PDU]
 89   0.019326 172.31.8.238 -> 54.192.118.238 TCP 66 53247 > http [ACK] Seq=98 Ack=515947 Win=899712 Len=0 TSval=15972168 TSecr=1688181682
 90   0.019792 54.192.118.238 -> 172.31.8.238 TCP 8754 [TCP segment of a reassembled PDU]
 91   0.019800 172.31.8.238 -> 54.192.118.238 TCP 66 53247 > http [ACK] Seq=98 Ack=524635 Win=916992 Len=0 TSval=15972168 TSecr=1688181682
 92   0.019958 54.192.118.238 -> 172.31.8.238 TCP 26130 [TCP segment of a reassembled PDU]
 93   0.019972 172.31.8.238 -> 54.192.118.238 TCP 66 53247 > http [ACK] Seq=98 Ack=550699 Win=903296 Len=0 TSval=15972168 TSecr=1688181682
 94   0.020008 54.192.118.238 -> 172.31.8.238 TCP 14546 [TCP segment of a reassembled PDU]
 95   0.020017 172.31.8.238 -> 54.192.118.238 TCP 66 53247 > http [ACK] Seq=98 Ack=565179 Win=922240 Len=0 TSval=15972168 TSecr=1688181682
 96   0.020082 54.192.118.238 -> 172.31.8.238 TCP 15994 [TCP segment of a reassembled PDU]
 97   0.020092 172.31.8.238 -> 54.192.118.238 TCP 66 53247 > http [ACK] Seq=98 Ack=581107 Win=919808 Len=0 TSval=15972168 TSecr=1688181682
 98   0.020543 54.192.118.238 -> 172.31.8.238 TCP 1514 [TCP segment of a reassembled PDU]
 99   0.020547 172.31.8.238 -> 54.192.118.238 TCP 66 53247 > http [ACK] Seq=98 Ack=582555 Win=940928 Len=0 TSval=15972168 TSecr=1688181682
100   0.020723 54.192.118.238 -> 172.31.8.238 TCP 26130 [TCP segment of a reassembled PDU]
101   0.020737 172.31.8.238 -> 54.192.118.238 TCP 66 53247 > http [ACK] Seq=98 Ack=608619 Win=914944 Len=0 TSval=15972168 TSecr=1688181682
102   0.020793 54.192.118.238 -> 172.31.8.238 TCP 18890 [TCP segment of a reassembled PDU]
103   0.020803 172.31.8.238 -> 54.192.118.238 TCP 66 53247 > http [ACK] Seq=98 Ack=627443 Win=915072 Len=0 TSval=15972168 TSecr=1688181682
104   0.020866 54.192.118.238 -> 172.31.8.238 TCP 18890 [TCP segment of a reassembled PDU]
105   0.020876 172.31.8.238 -> 54.192.118.238 TCP 66 53247 > http [ACK] Seq=98 Ack=646267 Win=896256 Len=0 TSval=15972168 TSecr=1688181682
106   0.021314 54.192.118.238 -> 172.31.8.238 TCP 2962 [TCP segment of a reassembled PDU]
107   0.021321 172.31.8.238 -> 54.192.118.238 TCP 66 53247 > http [ACK] Seq=98 Ack=649163 Win=940928 Len=0 TSval=15972168 TSecr=1688181682
108   0.021513 54.192.118.238 -> 172.31.8.238 TCP 26130 [TCP segment of a reassembled PDU]
109   0.021526 172.31.8.238 -> 54.192.118.238 TCP 66 53247 > http [ACK] Seq=98 Ack=675227 Win=914944 Len=0 TSval=15972168 TSecr=1688181682
110   0.021577 54.192.118.238 -> 172.31.8.238 TCP 14546 [TCP segment of a reassembled PDU]
111   0.021586 172.31.8.238 -> 54.192.118.238 TCP 66 53247 > http [ACK] Seq=98 Ack=689707 Win=900480 Len=0 TSval=15972168 TSecr=1688181682
112   0.021657 54.192.118.238 -> 172.31.8.238 TCP 17442 [TCP segment of a reassembled PDU]
113   0.021668 172.31.8.238 -> 54.192.118.238 TCP 66 53247 > http [ACK] Seq=98 Ack=707083 Win=917504 Len=0 TSval=15972168 TSecr=1688181683
114   0.021765 54.192.118.238 -> 172.31.8.238 TCP 4410 [TCP segment of a reassembled PDU]
115   0.021771 172.31.8.238 -> 54.192.118.238 TCP 66 53247 > http [ACK] Seq=98 Ack=711427 Win=938880 Len=0 TSval=15972168 TSecr=1688181683
116   0.022356 54.192.118.238 -> 172.31.8.238 TCP 2962 [TCP segment of a reassembled PDU]
117   0.022362 172.31.8.238 -> 54.192.118.238 TCP 66 53247 > http [ACK] Seq=98 Ack=714323 Win=940928 Len=0 TSval=15972168 TSecr=1688181683
118   0.022546 54.192.118.238 -> 172.31.8.238 TCP 23234 [TCP segment of a reassembled PDU]
119   0.022572 172.31.8.238 -> 54.192.118.238 TCP 66 53247 > http [ACK] Seq=98 Ack=737491 Win=917760 Len=0 TSval=15972168 TSecr=1688181683
120   0.022603 54.192.118.238 -> 172.31.8.238 TCP 2962 [TCP segment of a reassembled PDU]
121   0.022608 172.31.8.238 -> 54.192.118.238 TCP 66 53247 > http [ACK] Seq=98 Ack=740387 Win=940928 Len=0 TSval=15972168 TSecr=1688181683
122   0.022700 54.192.118.238 -> 172.31.8.238 TCP 36266 [TCP segment of a reassembled PDU]
123   0.022730 172.31.8.238 -> 54.192.118.238 TCP 66 53247 > http [ACK] Seq=98 Ack=776587 Win=904832 Len=0 TSval=15972168 TSecr=1688181683
124   0.023385 54.192.118.238 -> 172.31.8.238 TCP 4410 [TCP segment of a reassembled PDU]
125   0.023391 172.31.8.238 -> 54.192.118.238 TCP 66 53247 > http [ACK] Seq=98 Ack=780931 Win=938880 Len=0 TSval=15972169 TSecr=1688181683
126   0.023563 54.192.118.238 -> 172.31.8.238 TCP 18890 [TCP segment of a reassembled PDU]
127   0.023586 172.31.8.238 -> 54.192.118.238 TCP 66 53247 > http [ACK] Seq=98 Ack=799755 Win=920064 Len=0 TSval=15972169 TSecr=1688181683
128   0.023715 54.192.118.238 -> 172.31.8.238 TCP 42058 [TCP segment of a reassembled PDU]
129   0.023749 172.31.8.238 -> 54.192.118.238 TCP 66 53247 > http [ACK] Seq=98 Ack=841747 Win=878080 Len=0 TSval=15972169 TSecr=1688181683
130   0.024411 54.192.118.238 -> 172.31.8.238 TCP 2962 [TCP segment of a reassembled PDU]
131   0.024418 172.31.8.238 -> 54.192.118.238 TCP 66 53247 > http [ACK] Seq=98 Ack=844643 Win=940928 Len=0 TSval=15972169 TSecr=1688181683
132   0.024597 54.192.118.238 -> 172.31.8.238 TCP 17442 [TCP segment of a reassembled PDU]
133   0.024619 172.31.8.238 -> 54.192.118.238 TCP 66 53247 > http [ACK] Seq=98 Ack=862019 Win=923648 Len=0 TSval=15972169 TSecr=1688181683
134   0.024777 54.192.118.238 -> 172.31.8.238 TCP 34818 [TCP segment of a reassembled PDU]
135   0.024820 172.31.8.238 -> 54.192.118.238 TCP 66 53247 > http [ACK] Seq=98 Ack=896771 Win=888960 Len=0 TSval=15972169 TSecr=1688181683
136   0.024845 54.192.118.238 -> 172.31.8.238 TCP 27578 [TCP segment of a reassembled PDU]
137   0.024869 172.31.8.238 -> 54.192.118.238 TCP 66 53247 > http [ACK] Seq=98 Ack=924283 Win=861568 Len=0 TSval=15972169 TSecr=1688181683
138   0.024923 54.192.118.238 -> 172.31.8.238 TCP 18890 [TCP segment of a reassembled PDU]
139   0.024935 172.31.8.238 -> 54.192.118.238 TCP 66 53247 > http [ACK] Seq=98 Ack=943107 Win=915072 Len=0 TSval=15972169 TSecr=1688181683
140   0.025426 54.192.118.238 -> 172.31.8.238 TCP 4410 [TCP segment of a reassembled PDU]
141   0.025433 172.31.8.238 -> 54.192.118.238 TCP 66 53247 > http [ACK] Seq=98 Ack=947451 Win=938880 Len=0 TSval=15972169 TSecr=1688181683
142   0.025602 54.192.118.238 -> 172.31.8.238 TCP 26130 [TCP segment of a reassembled PDU]
143   0.025627 172.31.8.238 -> 54.192.118.238 TCP 66 53247 > http [ACK] Seq=98 Ack=973515 Win=912896 Len=0 TSval=15972169 TSecr=1688181683
144   0.025673 54.192.118.238 -> 172.31.8.238 TCP 26130 [TCP segment of a reassembled PDU]
145   0.025698 172.31.8.238 -> 54.192.118.238 TCP 66 53247 > http [ACK] Seq=98 Ack=999579 Win=903296 Len=0 TSval=15972169 TSecr=1688181683
146   0.025764 54.192.118.238 -> 172.31.8.238 TCP 26130 [TCP segment of a reassembled PDU]
147   0.025777 172.31.8.238 -> 54.192.118.238 TCP 66 53247 > http [ACK] Seq=98 Ack=1025643 Win=903296 Len=0 TSval=15972169 TSecr=1688181683
148   0.025818 54.192.118.238 -> 172.31.8.238 TCP 11650 [TCP segment of a reassembled PDU]
149   0.025826 172.31.8.238 -> 54.192.118.238 TCP 66 53247 > http [ACK] Seq=98 Ack=1037227 Win=927104 Len=0 TSval=15972169 TSecr=1688181683
150   0.026255 54.192.118.238 -> 172.31.8.238 TCP 8754 [TCP segment of a reassembled PDU]
151   0.026262 172.31.8.238 -> 54.192.118.238 TCP 66 53247 > http [ACK] Seq=98 Ack=1045915 Win=931840 Len=0 TSval=15972169 TSecr=1688181683
152   0.026426 54.192.118.238 -> 172.31.8.238 TCP 26130 [TCP segment of a reassembled PDU]
153   0.026450 172.31.8.238 -> 54.192.118.238 TCP 66 53247 > http [ACK] Seq=98 Ack=1071979 Win=905856 Len=0 TSval=15972169 TSecr=1688181683
154   0.026501 54.192.118.238 -> 172.31.8.238 TCP 26130 [TCP segment of a reassembled PDU]
155   0.026563 54.192.118.238 -> 172.31.8.238 TCP 4410 [TCP segment of a reassembled PDU]
156   0.026669 172.31.8.238 -> 54.192.118.238 TCP 66 53247 > http [ACK] Seq=98 Ack=1102387 Win=896000 Len=0 TSval=15972169 TSecr=1688181683
157   0.026888 54.192.118.238 -> 172.31.8.238 TCP 26130 [TCP segment of a reassembled PDU]
158   0.026902 172.31.8.238 -> 54.192.118.238 TCP 66 53247 > http [ACK] Seq=98 Ack=1128451 Win=903296 Len=0 TSval=15972169 TSecr=1688181683
159   0.026949 54.192.118.238 -> 172.31.8.238 TCP 24682 [TCP segment of a reassembled PDU]
160   0.026962 172.31.8.238 -> 54.192.118.238 TCP 66 53247 > http [ACK] Seq=98 Ack=1153067 Win=905600 Len=0 TSval=15972169 TSecr=1688181683
161   0.027318 54.192.118.238 -> 172.31.8.238 TCP 14546 [TCP segment of a reassembled PDU]
162   0.027328 172.31.8.238 -> 54.192.118.238 TCP 66 53247 > http [ACK] Seq=98 Ack=1167547 Win=922240 Len=0 TSval=15972170 TSecr=1688181683
163   0.027461 54.192.118.238 -> 172.31.8.238 TCP 23234 [TCP segment of a reassembled PDU]
164   0.027474 172.31.8.238 -> 54.192.118.238 TCP 66 53247 > http [ACK] Seq=98 Ack=1190715 Win=987264 Len=0 TSval=15972170 TSecr=1688181683
165   0.027490 54.192.118.238 -> 172.31.8.238 TCP 2962 [TCP segment of a reassembled PDU]
166   0.027493 172.31.8.238 -> 54.192.118.238 TCP 66 53247 > http [ACK] Seq=98 Ack=1193611 Win=993024 Len=0 TSval=15972170 TSecr=1688181683
167   0.027596 54.192.118.238 -> 172.31.8.238 TCP 34818 [TCP segment of a reassembled PDU]
168   0.027612 172.31.8.238 -> 54.192.118.238 TCP 66 53247 > http [ACK] Seq=98 Ack=1228363 Win=1062528 Len=0 TSval=15972170 TSecr=1688181683
169   0.027740 54.192.118.238 -> 172.31.8.238 TCP 24682 [TCP segment of a reassembled PDU]
170   0.027755 172.31.8.238 -> 54.192.118.238 TCP 66 53247 > http [ACK] Seq=98 Ack=1252979 Win=1111808 Len=0 TSval=15972170 TSecr=1688181683
171   0.027762 54.192.118.238 -> 172.31.8.238 TCP 1514 [TCP segment of a reassembled PDU]
172   0.027765 172.31.8.238 -> 54.192.118.238 TCP 66 53247 > http [ACK] Seq=98 Ack=1254427 Win=1114624 Len=0 TSval=15972170 TSecr=1688181683
173   0.027893 54.192.118.238 -> 172.31.8.238 TCP 21786 [TCP segment of a reassembled PDU]
174   0.027905 172.31.8.238 -> 54.192.118.238 TCP 66 53247 > http [ACK] Seq=98 Ack=1276147 Win=1158144 Len=0 TSval=15972170 TSecr=1688181683
175   0.028082 54.192.118.238 -> 172.31.8.238 TCP 21786 [TCP segment of a reassembled PDU]
176   0.028094 172.31.8.238 -> 54.192.118.238 TCP 66 53247 > http [ACK] Seq=98 Ack=1297867 Win=1201536 Len=0 TSval=15972170 TSecr=1688181683
177   0.028388 54.192.118.238 -> 172.31.8.238 TCP 17442 [TCP segment of a reassembled PDU]
178   0.028399 172.31.8.238 -> 54.192.118.238 TCP 66 53247 > http [ACK] Seq=98 Ack=1315243 Win=1236352 Len=0 TSval=15972170 TSecr=1688181683
179   0.028492 54.192.118.238 -> 172.31.8.238 TCP 8754 [TCP segment of a reassembled PDU]
180   0.028499 172.31.8.238 -> 54.192.118.238 TCP 66 53247 > http [ACK] Seq=98 Ack=1323931 Win=1253632 Len=0 TSval=15972170 TSecr=1688181683
181   0.028514 54.192.118.238 -> 172.31.8.238 TCP 20338 [TCP segment of a reassembled PDU]
182   0.028526 172.31.8.238 -> 54.192.118.238 TCP 66 53247 > http [ACK] Seq=98 Ack=1344203 Win=1294208 Len=0 TSval=15972170 TSecr=1688181683
183   0.028539 54.192.118.238 -> 172.31.8.238 TCP 18890 [TCP segment of a reassembled PDU]
184   0.028548 172.31.8.238 -> 54.192.118.238 TCP 66 53247 > http [ACK] Seq=98 Ack=1363027 Win=1299840 Len=0 TSval=15972170 TSecr=1688181683
185   0.028627 54.192.118.238 -> 172.31.8.238 TCP 13098 [TCP segment of a reassembled PDU]
186   0.028637 172.31.8.238 -> 54.192.118.238 TCP 66 53247 > http [ACK] Seq=98 Ack=1376059 Win=1357184 Len=0 TSval=15972170 TSecr=1688181683
187   0.028768 54.192.118.238 -> 172.31.8.238 TCP 26130 [TCP segment of a reassembled PDU]
188   0.028794 172.31.8.238 -> 54.192.118.238 TCP 66 53247 > http [ACK] Seq=98 Ack=1402123 Win=1335808 Len=0 TSval=15972170 TSecr=1688181683
189   0.028847 54.192.118.238 -> 172.31.8.238 TCP 17442 [TCP segment of a reassembled PDU]
190   0.028858 172.31.8.238 -> 54.192.118.238 TCP 66 53247 > http [ACK] Seq=98 Ack=1419499 Win=1350016 Len=0 TSval=15972170 TSecr=1688181683
191   0.028919 54.192.118.238 -> 172.31.8.238 TCP 8754 [TCP segment of a reassembled PDU]
192   0.028925 172.31.8.238 -> 54.192.118.238 TCP 66 53247 > http [ACK] Seq=98 Ack=1428187 Win=1364352 Len=0 TSval=15972170 TSecr=1688181683
193   0.029257 54.192.118.238 -> 172.31.8.238 TCP 5858 [TCP segment of a reassembled PDU]
194   0.029264 172.31.8.238 -> 54.192.118.238 TCP 66 53247 > http [ACK] Seq=98 Ack=1433979 Win=1369088 Len=0 TSval=15972170 TSecr=1688181683
195   0.029429 54.192.118.238 -> 172.31.8.238 TCP 26130 [TCP segment of a reassembled PDU]
196   0.029453 172.31.8.238 -> 54.192.118.238 TCP 66 53247 > http [ACK] Seq=98 Ack=1460043 Win=1343104 Len=0 TSval=15972170 TSecr=1688181683
197   0.029499 54.192.118.238 -> 172.31.8.238 TCP 21786 [TCP segment of a reassembled PDU]
198   0.029524 172.31.8.238 -> 54.192.118.238 TCP 66 53247 > http [ACK] Seq=98 Ack=1481763 Win=1342848 Len=0 TSval=15972170 TSecr=1688181683
199   0.029636 54.192.118.238 -> 172.31.8.238 TCP 30474 [TCP segment of a reassembled PDU]
200   0.029663 54.192.118.238 -> 172.31.8.238 TCP 26130 [TCP segment of a reassembled PDU]
201   0.029686 172.31.8.238 -> 54.192.118.238 TCP 66 53247 > http [ACK] Seq=98 Ack=1538235 Win=1286400 Len=0 TSval=15972170 TSecr=1688181683
202   0.029714 54.192.118.238 -> 172.31.8.238 TCP 20338 [TCP segment of a reassembled PDU]
203   0.029725 172.31.8.238 -> 54.192.118.238 TCP 66 53247 > http [ACK] Seq=98 Ack=1558507 Win=1302400 Len=0 TSval=15972170 TSecr=1688181683
204   0.030053 54.192.118.238 -> 172.31.8.238 TCP 4410 [TCP segment of a reassembled PDU]
205   0.030059 172.31.8.238 -> 54.192.118.238 TCP 66 53247 > http [ACK] Seq=98 Ack=1562851 Win=1371392 Len=0 TSval=15972170 TSecr=1688181683
206   0.030239 54.192.118.238 -> 172.31.8.238 TCP 26130 [TCP segment of a reassembled PDU]
207   0.030265 172.31.8.238 -> 54.192.118.238 TCP 66 53247 > http [ACK] Seq=98 Ack=1588915 Win=1345408 Len=0 TSval=15972170 TSecr=1688181683
208   0.030312 54.192.118.238 -> 172.31.8.238 TCP 26130 [TCP segment of a reassembled PDU]
209   0.030339 172.31.8.238 -> 54.192.118.238 TCP 66 53247 > http [ACK] Seq=98 Ack=1614979 Win=1335808 Len=0 TSval=15972170 TSecr=1688181683
210   0.030373 54.192.118.238 -> 172.31.8.238 TCP 8754 [TCP segment of a reassembled PDU]
211   0.030380 172.31.8.238 -> 54.192.118.238 TCP 66 53247 > http [ACK] Seq=98 Ack=1623667 Win=1364352 Len=0 TSval=15972170 TSecr=1688181683
212   0.030431 54.192.118.238 -> 172.31.8.238 TCP 5858 [TCP segment of a reassembled PDU]
213   0.030436 172.31.8.238 -> 54.192.118.238 TCP 66 53247 > http [ACK] Seq=98 Ack=1629459 Win=1369088 Len=0 TSval=15972170 TSecr=1688181683
214   0.030605 54.192.118.238 -> 172.31.8.238 TCP 5858 [TCP segment of a reassembled PDU]
215   0.030611 172.31.8.238 -> 54.192.118.238 TCP 66 53247 > http [ACK] Seq=98 Ack=1635251 Win=1369088 Len=0 TSval=15972170 TSecr=1688181683
216   0.030774 54.192.118.238 -> 172.31.8.238 TCP 26130 [TCP segment of a reassembled PDU]
217   0.030800 172.31.8.238 -> 54.192.118.238 TCP 66 53247 > http [ACK] Seq=98 Ack=1661315 Win=1343104 Len=0 TSval=15972170 TSecr=1688181683
218   0.030862 54.192.118.238 -> 172.31.8.238 TCP 26130 [TCP segment of a reassembled PDU]
219   0.030928 54.192.118.238 -> 172.31.8.238 TCP 13098 [TCP segment of a reassembled PDU]
220   0.031003 54.192.118.238 -> 172.31.8.238 TCP 26130 [TCP segment of a reassembled PDU]
221   0.031087 54.192.118.238 -> 172.31.8.238 TCP 23234 [TCP segment of a reassembled PDU]
222   0.031108 54.192.118.238 -> 172.31.8.238 TCP 2962 [TCP segment of a reassembled PDU]
223   0.031115 54.192.118.238 -> 172.31.8.238 TCP 1514 [TCP segment of a reassembled PDU]
224   0.031129 172.31.8.238 -> 54.192.118.238 TCP 66 53247 > http [ACK] Seq=98 Ack=1753987 Win=1250432 Len=0 TSval=15972170 TSecr=1688181683
225   0.031409 54.192.118.238 -> 172.31.8.238 TCP 4410 [TCP segment of a reassembled PDU]
226   0.031415 172.31.8.238 -> 54.192.118.238 TCP 66 53247 > http [ACK] Seq=98 Ack=1758331 Win=1371392 Len=0 TSval=15972171 TSecr=1688181683
227   0.031589 54.192.118.238 -> 172.31.8.238 TCP 26130 [TCP segment of a reassembled PDU]
228   0.031603 172.31.8.238 -> 54.192.118.238 TCP 66 53247 > http [ACK] Seq=98 Ack=1784395 Win=1426816 Len=0 TSval=15972171 TSecr=1688181683
229   0.031664 54.192.118.238 -> 172.31.8.238 TCP 26130 [TCP segment of a reassembled PDU]
230   0.031677 172.31.8.238 -> 54.192.118.238 TCP 66 53247 > http [ACK] Seq=98 Ack=1810459 Win=1478912 Len=0 TSval=15972171 TSecr=1688181683
231   0.031740 54.192.118.238 -> 172.31.8.238 TCP 8754 [TCP segment of a reassembled PDU]
232   0.031747 172.31.8.238 -> 54.192.118.238 TCP 66 53247 > http [ACK] Seq=98 Ack=1819147 Win=1496320 Len=0 TSval=15972171 TSecr=1688181683
233   0.031836 54.192.118.238 -> 172.31.8.238 TCP 26130 [TCP segment of a reassembled PDU]
234   0.031861 172.31.8.238 -> 54.192.118.238 TCP 66 53247 > http [ACK] Seq=98 Ack=1845211 Win=1548416 Len=0 TSval=15972171 TSecr=1688181684
235   0.031915 54.192.118.238 -> 172.31.8.238 TCP 13098 [TCP segment of a reassembled PDU]
236   0.031924 172.31.8.238 -> 54.192.118.238 TCP 66 53247 > http [ACK] Seq=98 Ack=1858243 Win=1574528 Len=0 TSval=15972171 TSecr=1688181684
237   0.031932 54.192.118.238 -> 172.31.8.238 TCP 1514 [TCP Previous segment not captured] [TCP segment of a reassembled PDU]
238   0.031935 172.31.8.238 -> 54.192.118.238 TCP 78 [TCP Dup ACK 236#1] 53247 > http [ACK] Seq=98 Ack=1858243 Win=1574528 Len=0 TSval=15972171 TSecr=1688181684 SLE=1859691 SRE=1861139
239   0.031965 54.192.118.238 -> 172.31.8.238 TCP 1514 [TCP Out-Of-Order] [TCP segment of a reassembled PDU]
240   0.031969 172.31.8.238 -> 54.192.118.238 TCP 66 53247 > http [ACK] Seq=98 Ack=1861139 Win=1574528 Len=0 TSval=15972171 TSecr=1688181684
241   0.032092 54.192.118.238 -> 172.31.8.238 TCP 23234 [TCP segment of a reassembled PDU]
242   0.032104 172.31.8.238 -> 54.192.118.238 TCP 66 53247 > http [ACK] Seq=98 Ack=1884307 Win=1574528 Len=0 TSval=15972171 TSecr=1688181684
243   0.032281 54.192.118.238 -> 172.31.8.238 TCP 26130 [TCP segment of a reassembled PDU]
244   0.032289 172.31.8.238 -> 54.192.118.238 TCP 66 53247 > http [ACK] Seq=98 Ack=1910371 Win=1574528 Len=0 TSval=15972171 TSecr=1688181684
245   0.032350 54.192.118.238 -> 172.31.8.238 TCP 26130 [TCP segment of a reassembled PDU]
246   0.032357 172.31.8.238 -> 54.192.118.238 TCP 66 53247 > http [ACK] Seq=98 Ack=1936435 Win=1574528 Len=0 TSval=15972171 TSecr=1688181684
247   0.032432 54.192.118.238 -> 172.31.8.238 TCP 21786 [TCP segment of a reassembled PDU]
248   0.032439 172.31.8.238 -> 54.192.118.238 TCP 66 53247 > http [ACK] Seq=98 Ack=1958155 Win=1574528 Len=0 TSval=15972171 TSecr=1688181684
249   0.032527 54.192.118.238 -> 172.31.8.238 TCP 26130 [TCP segment of a reassembled PDU]
250   0.032547 172.31.8.238 -> 54.192.118.238 TCP 66 53247 > http [ACK] Seq=98 Ack=1984219 Win=1574528 Len=0 TSval=15972171 TSecr=1688181684
251   0.032624 54.192.118.238 -> 172.31.8.238 TCP 26130 [TCP segment of a reassembled PDU]
252   0.032636 172.31.8.238 -> 54.192.118.238 TCP 66 53247 > http [ACK] Seq=98 Ack=2010283 Win=1574528 Len=0 TSval=15972171 TSecr=1688181684
253   0.032673 54.192.118.238 -> 172.31.8.238 TCP 4410 [TCP segment of a reassembled PDU]
254   0.032677 172.31.8.238 -> 54.192.118.238 TCP 66 53247 > http [ACK] Seq=98 Ack=2014627 Win=1574528 Len=0 TSval=15972171 TSecr=1688181684
255   0.032947 54.192.118.238 -> 172.31.8.238 TCP 4410 [TCP segment of a reassembled PDU]
256   0.032952 172.31.8.238 -> 54.192.118.238 TCP 66 53247 > http [ACK] Seq=98 Ack=2018971 Win=1574528 Len=0 TSval=15972171 TSecr=1688181684
257   0.033251 54.192.118.238 -> 172.31.8.238 TCP 26130 [TCP segment of a reassembled PDU]
258   0.033258 172.31.8.238 -> 54.192.118.238 TCP 66 53247 > http [ACK] Seq=98 Ack=2045035 Win=1574528 Len=0 TSval=15972171 TSecr=1688181684
259   0.033328 54.192.118.238 -> 172.31.8.238 TCP 26130 [TCP segment of a reassembled PDU]
260   0.033336 172.31.8.238 -> 54.192.118.238 TCP 66 53247 > http [ACK] Seq=98 Ack=2071099 Win=1574528 Len=0 TSval=15972171 TSecr=1688181684
261   0.033390 54.192.118.238 -> 172.31.8.238 TCP 8754 [TCP segment of a reassembled PDU]
262   0.033395 172.31.8.238 -> 54.192.118.238 TCP 66 53247 > http [ACK] Seq=98 Ack=2079787 Win=1574528 Len=0 TSval=15972171 TSecr=1688181684
263   0.033481 54.192.118.238 -> 172.31.8.238 TCP 26130 [TCP segment of a reassembled PDU]
264   0.033488 172.31.8.238 -> 54.192.118.238 TCP 66 53247 > http [ACK] Seq=98 Ack=2105851 Win=1574528 Len=0 TSval=15972171 TSecr=1688181684
265   0.033559 54.192.118.238 -> 172.31.8.238 TCP 26130 [TCP segment of a reassembled PDU]
266   0.033567 172.31.8.238 -> 54.192.118.238 TCP 66 53247 > http [ACK] Seq=98 Ack=2131915 Win=1574528 Len=0 TSval=15972171 TSecr=1688181684
267   0.033621 54.192.118.238 -> 172.31.8.238 TCP 13098 [TCP segment of a reassembled PDU]
268   0.033628 172.31.8.238 -> 54.192.118.238 TCP 66 53247 > http [ACK] Seq=98 Ack=2144947 Win=1574528 Len=0 TSval=15972171 TSecr=1688181684
269   0.034219 54.192.118.238 -> 172.31.8.238 TCP 4410 [TCP segment of a reassembled PDU]
270   0.034225 172.31.8.238 -> 54.192.118.238 TCP 66 53247 > http [ACK] Seq=98 Ack=2149291 Win=1574528 Len=0 TSval=15972171 TSecr=1688181684
271   0.034387 54.192.118.238 -> 172.31.8.238 TCP 26130 [TCP segment of a reassembled PDU]
272   0.034395 172.31.8.238 -> 54.192.118.238 TCP 66 53247 > http [ACK] Seq=98 Ack=2175355 Win=1574528 Len=0 TSval=15972171 TSecr=1688181684
273   0.034455 54.192.118.238 -> 172.31.8.238 TCP 18890 [TCP segment of a reassembled PDU]
274   0.034462 172.31.8.238 -> 54.192.118.238 TCP 66 53247 > http [ACK] Seq=98 Ack=2194179 Win=1574528 Len=0 TSval=15972171 TSecr=1688181684
275   0.034559 54.192.118.238 -> 172.31.8.238 TCP 33370 [TCP segment of a reassembled PDU]
276   0.034568 172.31.8.238 -> 54.192.118.238 TCP 66 53247 > http [ACK] Seq=98 Ack=2227483 Win=1574528 Len=0 TSval=15972171 TSecr=1688181684
277   0.034642 54.192.118.238 -> 172.31.8.238 TCP 26130 [TCP segment of a reassembled PDU]
278   0.034651 172.31.8.238 -> 54.192.118.238 TCP 66 53247 > http [ACK] Seq=98 Ack=2253547 Win=1574528 Len=0 TSval=15972171 TSecr=1688181684
279   0.034692 54.192.118.238 -> 172.31.8.238 TCP 1514 [TCP Previous segment not captured] [TCP segment of a reassembled PDU]
280   0.034697 172.31.8.238 -> 54.192.118.238 TCP 78 [TCP Dup ACK 278#1] 53247 > http [ACK] Seq=98 Ack=2253547 Win=1574528 Len=0 TSval=15972171 TSecr=1688181684 SLE=2254995 SRE=2256443
281   0.034755 54.192.118.238 -> 172.31.8.238 TCP 1514 [TCP Out-Of-Order] [TCP segment of a reassembled PDU]
282   0.034760 172.31.8.238 -> 54.192.118.238 TCP 66 53247 > http [ACK] Seq=98 Ack=2256443 Win=1574528 Len=0 TSval=15972171 TSecr=1688181684
283   0.034846 54.192.118.238 -> 172.31.8.238 TCP 18890 [TCP segment of a reassembled PDU]
284   0.034853 172.31.8.238 -> 54.192.118.238 TCP 66 53247 > http [ACK] Seq=98 Ack=2275267 Win=1574528 Len=0 TSval=15972171 TSecr=1688181684
285   0.035144 54.192.118.238 -> 172.31.8.238 TCP 26130 [TCP segment of a reassembled PDU]
286   0.035152 172.31.8.238 -> 54.192.118.238 TCP 66 53247 > http [ACK] Seq=98 Ack=2301331 Win=1574528 Len=0 TSval=15972171 TSecr=1688181684
287   0.035210 54.192.118.238 -> 172.31.8.238 TCP 26130 [TCP segment of a reassembled PDU]
288   0.035218 172.31.8.238 -> 54.192.118.238 TCP 66 53247 > http [ACK] Seq=98 Ack=2327395 Win=1574528 Len=0 TSval=15972171 TSecr=1688181684
289   0.035276 54.192.118.238 -> 172.31.8.238 TCP 13098 [TCP segment of a reassembled PDU]
290   0.035282 172.31.8.238 -> 54.192.118.238 TCP 66 53247 > http [ACK] Seq=98 Ack=2340427 Win=1574528 Len=0 TSval=15972172 TSecr=1688181684
291   0.035784 54.192.118.238 -> 172.31.8.238 TCP 1514 [TCP segment of a reassembled PDU]
292   0.035788 172.31.8.238 -> 54.192.118.238 TCP 66 53247 > http [ACK] Seq=98 Ack=2341875 Win=1574528 Len=0 TSval=15972172 TSecr=1688181684
293   0.035958 54.192.118.238 -> 172.31.8.238 TCP 21786 [TCP segment of a reassembled PDU]
294   0.035966 172.31.8.238 -> 54.192.118.238 TCP 66 53247 > http [ACK] Seq=98 Ack=2363595 Win=1574528 Len=0 TSval=15972172 TSecr=1688181684
295   0.036078 54.192.118.238 -> 172.31.8.238 TCP 30474 [TCP segment of a reassembled PDU]
296   0.036086 172.31.8.238 -> 54.192.118.238 TCP 66 53247 > http [ACK] Seq=98 Ack=2394003 Win=1574528 Len=0 TSval=15972172 TSecr=1688181684
297   0.036104 54.192.118.238 -> 172.31.8.238 TCP 26130 [TCP segment of a reassembled PDU]
298   0.036113 172.31.8.238 -> 54.192.118.238 TCP 66 53247 > http [ACK] Seq=98 Ack=2420067 Win=1574528 Len=0 TSval=15972172 TSecr=1688181684
299   0.036216 54.192.118.238 -> 172.31.8.238 TCP 26130 [TCP segment of a reassembled PDU]
300   0.036223 172.31.8.238 -> 54.192.118.238 TCP 66 53247 > http [ACK] Seq=98 Ack=2446131 Win=1574528 Len=0 TSval=15972172 TSecr=1688181684
301   0.036288 54.192.118.238 -> 172.31.8.238 TCP 24682 [TCP segment of a reassembled PDU]
302   0.036295 172.31.8.238 -> 54.192.118.238 TCP 66 53247 > http [ACK] Seq=98 Ack=2470747 Win=1574528 Len=0 TSval=15972172 TSecr=1688181684
303   0.036670 54.192.118.238 -> 172.31.8.238 TCP 26130 [TCP segment of a reassembled PDU]
304   0.036678 172.31.8.238 -> 54.192.118.238 TCP 66 53247 > http [ACK] Seq=98 Ack=2496811 Win=1574528 Len=0 TSval=15972172 TSecr=1688181684
305   0.036739 54.192.118.238 -> 172.31.8.238 TCP 26130 [TCP segment of a reassembled PDU]
306   0.036745 172.31.8.238 -> 54.192.118.238 TCP 66 53247 > http [ACK] Seq=98 Ack=2522875 Win=1574528 Len=0 TSval=15972172 TSecr=1688181684
307   0.036803 54.192.118.238 -> 172.31.8.238 TCP 13098 [TCP segment of a reassembled PDU]
308   0.036809 172.31.8.238 -> 54.192.118.238 TCP 66 53247 > http [ACK] Seq=98 Ack=2535907 Win=1574528 Len=0 TSval=15972172 TSecr=1688181684
309   0.036993 54.192.118.238 -> 172.31.8.238 TCP 26130 [TCP segment of a reassembled PDU]
310   0.037002 172.31.8.238 -> 54.192.118.238 TCP 66 53247 > http [ACK] Seq=98 Ack=2561971 Win=1574528 Len=0 TSval=15972172 TSecr=1688181684
311   0.037061 54.192.118.238 -> 172.31.8.238 TCP 23234 [TCP segment of a reassembled PDU]
312   0.037068 172.31.8.238 -> 54.192.118.238 TCP 66 53247 > http [ACK] Seq=98 Ack=2585139 Win=1574528 Len=0 TSval=15972172 TSecr=1688181684
313   0.037126 54.192.118.238 -> 172.31.8.238 TCP 15994 [TCP segment of a reassembled PDU]
314   0.037132 172.31.8.238 -> 54.192.118.238 TCP 66 53247 > http [ACK] Seq=98 Ack=2601067 Win=1574528 Len=0 TSval=15972172 TSecr=1688181684
315   0.037372 54.192.118.238 -> 172.31.8.238 TCP 7306 [TCP segment of a reassembled PDU]
316   0.037377 172.31.8.238 -> 54.192.118.238 TCP 66 53247 > http [ACK] Seq=98 Ack=2608307 Win=1574528 Len=0 TSval=15972172 TSecr=1688181684
317   0.037538 54.192.118.238 -> 172.31.8.238 TCP 26130 [TCP segment of a reassembled PDU]
318   0.037545 172.31.8.238 -> 54.192.118.238 TCP 66 53247 > http [ACK] Seq=98 Ack=2634371 Win=1574528 Len=0 TSval=15972172 TSecr=1688181684
319   0.037607 54.192.118.238 -> 172.31.8.238 TCP 26130 [TCP segment of a reassembled PDU]
320   0.037614 172.31.8.238 -> 54.192.118.238 TCP 66 53247 > http [ACK] Seq=98 Ack=2660435 Win=1574528 Len=0 TSval=15972172 TSecr=1688181684
321   0.037659 54.192.118.238 -> 172.31.8.238 TCP 5858 [TCP segment of a reassembled PDU]
322   0.037663 172.31.8.238 -> 54.192.118.238 TCP 66 53247 > http [ACK] Seq=98 Ack=2666227 Win=1574528 Len=0 TSval=15972172 TSecr=1688181684
323   0.037748 54.192.118.238 -> 172.31.8.238 TCP 26130 [TCP segment of a reassembled PDU]
324   0.037758 172.31.8.238 -> 54.192.118.238 TCP 66 53247 > http [ACK] Seq=98 Ack=2692291 Win=1574528 Len=0 TSval=15972172 TSecr=1688181684
325   0.037825 54.192.118.238 -> 172.31.8.238 TCP 26130 [TCP segment of a reassembled PDU]
326   0.037832 172.31.8.238 -> 54.192.118.238 TCP 66 53247 > http [ACK] Seq=98 Ack=2718355 Win=1574528 Len=0 TSval=15972172 TSecr=1688181684
327   0.037880 54.192.118.238 -> 172.31.8.238 TCP 13098 [TCP segment of a reassembled PDU]
328   0.037884 172.31.8.238 -> 54.192.118.238 TCP 66 53247 > http [ACK] Seq=98 Ack=2731387 Win=1574528 Len=0 TSval=15972172 TSecr=1688181684
329   0.038324 54.192.118.238 -> 172.31.8.238 TCP 7306 [TCP segment of a reassembled PDU]
330   0.038330 172.31.8.238 -> 54.192.118.238 TCP 66 53247 > http [ACK] Seq=98 Ack=2738627 Win=1574528 Len=0 TSval=15972172 TSecr=1688181684
331   0.038506 54.192.118.238 -> 172.31.8.238 TCP 26130 [TCP segment of a reassembled PDU]
332   0.038513 172.31.8.238 -> 54.192.118.238 TCP 66 53247 > http [ACK] Seq=98 Ack=2764691 Win=1574528 Len=0 TSval=15972172 TSecr=1688181684
333   0.038576 54.192.118.238 -> 172.31.8.238 TCP 26130 [TCP segment of a reassembled PDU]
334   0.038583 172.31.8.238 -> 54.192.118.238 TCP 66 53247 > http [ACK] Seq=98 Ack=2790755 Win=1574528 Len=0 TSval=15972172 TSecr=1688181684
335   0.038657 54.192.118.238 -> 172.31.8.238 TCP 26130 [TCP segment of a reassembled PDU]
336   0.038664 172.31.8.238 -> 54.192.118.238 TCP 66 53247 > http [ACK] Seq=98 Ack=2816819 Win=1574528 Len=0 TSval=15972172 TSecr=1688181684
337   0.038751 54.192.118.238 -> 172.31.8.238 TCP 26130 [TCP segment of a reassembled PDU]
338   0.038758 172.31.8.238 -> 54.192.118.238 TCP 66 53247 > http [ACK] Seq=98 Ack=2842883 Win=1574528 Len=0 TSval=15972172 TSecr=1688181684
339   0.038817 54.192.118.238 -> 172.31.8.238 TCP 18890 [TCP segment of a reassembled PDU]
340   0.038822 172.31.8.238 -> 54.192.118.238 TCP 66 53247 > http [ACK] Seq=98 Ack=2861707 Win=1574528 Len=0 TSval=15972172 TSecr=1688181684
341   0.039175 54.192.118.238 -> 172.31.8.238 TCP 5858 [TCP segment of a reassembled PDU]
342   0.039181 172.31.8.238 -> 54.192.118.238 TCP 66 53247 > http [ACK] Seq=98 Ack=2867499 Win=1574528 Len=0 TSval=15972172 TSecr=1688181684
343   0.039345 54.192.118.238 -> 172.31.8.238 TCP 26130 [TCP segment of a reassembled PDU]
344   0.039352 172.31.8.238 -> 54.192.118.238 TCP 66 53247 > http [ACK] Seq=98 Ack=2893563 Win=1574528 Len=0 TSval=15972173 TSecr=1688181684
345   0.039487 54.192.118.238 -> 172.31.8.238 TCP 26130 [TCP segment of a reassembled PDU]
