[Measurement for 10mb at 02:44:21 20.44.2014] 
Tshark:

  1   0.000000 06:b0:37:46:8f:13 -> 06:c7:b5:04:b8:d0 ARP 60 Who has 172.31.8.238?  Tell 172.31.0.1
  2   0.000016 06:c7:b5:04:b8:d0 -> 06:b0:37:46:8f:13 ARP 42 172.31.8.238 is at 06:c7:b5:04:b8:d0
  3   1.269848 172.31.8.238 -> 172.31.0.2   DNS 89 Standard query 0x223b  A d2pcb72msibvx3.cloudfront.net
  4   1.269888 172.31.8.238 -> 172.31.0.2   DNS 89 Standard query 0x6278  AAAA d2pcb72msibvx3.cloudfront.net
  5   1.270442   172.31.0.2 -> 172.31.8.238 DNS 169 Standard query response 0x6278 
  6   1.270453   172.31.0.2 -> 172.31.8.238 DNS 217 Standard query response 0x223b  A 54.230.117.152 A 54.230.119.86 A 54.230.119.150 A 54.239.132.84 A 54.239.132.86 A 54.239.132.250 A 54.192.118.222 A 54.192.118.243
  7   1.273668 172.31.8.238 -> 54.230.117.152 TCP 74 52796 > http [SYN] Seq=0 Win=26883 Len=0 MSS=8961 SACK_PERM=1 TSval=8772291 TSecr=0 WS=128
  8   1.274408 54.230.117.152 -> 172.31.8.238 TCP 74 http > 52796 [SYN, ACK] Seq=0 Ack=1 Win=14480 Len=0 MSS=1460 SACK_PERM=1 TSval=1686274300 TSecr=8772291 WS=128
  9   1.274423 172.31.8.238 -> 54.230.117.152 TCP 66 52796 > http [ACK] Seq=1 Ack=1 Win=27008 Len=0 TSval=8772292 TSecr=1686274300
 10   1.274476 172.31.8.238 -> 54.230.117.152 HTTP 163 GET /10mb HTTP/1.1 
 11   1.275102 54.230.117.152 -> 172.31.8.238 TCP 66 http > 52796 [ACK] Seq=1 Ack=98 Win=14592 Len=0 TSval=1686274300 TSecr=8772292
 12   1.276906 54.230.117.152 -> 172.31.8.238 TCP 524 [TCP segment of a reassembled PDU]
 13   1.276913 172.31.8.238 -> 54.230.117.152 TCP 66 52796 > http [ACK] Seq=98 Ack=459 Win=28032 Len=0 TSval=8772292 TSecr=1686274301
 14   1.277021 54.230.117.152 -> 172.31.8.238 TCP 4410 [TCP segment of a reassembled PDU]
 15   1.277029 172.31.8.238 -> 54.230.117.152 TCP 66 52796 > http [ACK] Seq=98 Ack=4803 Win=36736 Len=0 TSval=8772292 TSecr=1686274301
 16   1.277178 54.230.117.152 -> 172.31.8.238 TCP 2962 [TCP segment of a reassembled PDU]
 17   1.277184 172.31.8.238 -> 54.230.117.152 TCP 66 52796 > http [ACK] Seq=98 Ack=7699 Win=42496 Len=0 TSval=8772292 TSecr=1686274301
 18   1.277271 54.230.117.152 -> 172.31.8.238 TCP 5858 [TCP segment of a reassembled PDU]
 19   1.277278 172.31.8.238 -> 54.230.117.152 TCP 66 52796 > http [ACK] Seq=98 Ack=13491 Win=54144 Len=0 TSval=8772292 TSecr=1686274301
 20   1.277689 54.230.117.152 -> 172.31.8.238 TCP 2962 [TCP segment of a reassembled PDU]
 21   1.277694 172.31.8.238 -> 54.230.117.152 TCP 66 52796 > http [ACK] Seq=98 Ack=16387 Win=59904 Len=0 TSval=8772292 TSecr=1686274301
 22   1.277792 54.230.117.152 -> 172.31.8.238 TCP 5858 [TCP segment of a reassembled PDU]
 23   1.277798 172.31.8.238 -> 54.230.117.152 TCP 66 52796 > http [ACK] Seq=98 Ack=22179 Win=71424 Len=0 TSval=8772292 TSecr=1686274301
 24   1.277958 54.230.117.152 -> 172.31.8.238 TCP 4410 [TCP segment of a reassembled PDU]
 25   1.277963 172.31.8.238 -> 54.230.117.152 TCP 66 52796 > http [ACK] Seq=98 Ack=26523 Win=80128 Len=0 TSval=8772292 TSecr=1686274301
 26   1.278061 54.230.117.152 -> 172.31.8.238 TCP 7306 [TCP segment of a reassembled PDU]
 27   1.278067 172.31.8.238 -> 54.230.117.152 TCP 66 52796 > http [ACK] Seq=98 Ack=33763 Win=94592 Len=0 TSval=8772293 TSecr=1686274301
 28   1.278461 54.230.117.152 -> 172.31.8.238 TCP 4410 [TCP segment of a reassembled PDU]
 29   1.278467 172.31.8.238 -> 54.230.117.152 TCP 66 52796 > http [ACK] Seq=98 Ack=38107 Win=103296 Len=0 TSval=8772293 TSecr=1686274301
 30   1.278553 54.230.117.152 -> 172.31.8.238 TCP 1514 [TCP segment of a reassembled PDU]
 31   1.278558 172.31.8.238 -> 54.230.117.152 TCP 66 52796 > http [ACK] Seq=98 Ack=39555 Win=106240 Len=0 TSval=8772293 TSecr=1686274301
 32   1.278789 54.230.117.152 -> 172.31.8.238 TCP 11650 [TCP segment of a reassembled PDU]
 33   1.278800 172.31.8.238 -> 54.230.117.152 TCP 66 52796 > http [ACK] Seq=98 Ack=51139 Win=129408 Len=0 TSval=8772293 TSecr=1686274301
 34   1.278806 54.230.117.152 -> 172.31.8.238 TCP 1514 [TCP segment of a reassembled PDU]
 35   1.278809 172.31.8.238 -> 54.230.117.152 TCP 66 52796 > http [ACK] Seq=98 Ack=52587 Win=132224 Len=0 TSval=8772293 TSecr=1686274301
 36   1.279217 54.230.117.152 -> 172.31.8.238 TCP 2962 [TCP segment of a reassembled PDU]
 37   1.279223 172.31.8.238 -> 54.230.117.152 TCP 66 52796 > http [ACK] Seq=98 Ack=55483 Win=138112 Len=0 TSval=8772293 TSecr=1686274301
 38   1.279313 54.230.117.152 -> 172.31.8.238 TCP 10202 [TCP segment of a reassembled PDU]
 39   1.279321 172.31.8.238 -> 54.230.117.152 TCP 66 52796 > http [ACK] Seq=98 Ack=65619 Win=158336 Len=0 TSval=8772293 TSecr=1686274301
 40   1.279566 54.230.117.152 -> 172.31.8.238 TCP 13098 [TCP segment of a reassembled PDU]
 41   1.279575 172.31.8.238 -> 54.230.117.152 TCP 66 52796 > http [ACK] Seq=98 Ack=78651 Win=184448 Len=0 TSval=8772293 TSecr=1686274301
 42   1.279986 54.230.117.152 -> 172.31.8.238 TCP 2962 [TCP segment of a reassembled PDU]
 43   1.279991 172.31.8.238 -> 54.230.117.152 TCP 66 52796 > http [ACK] Seq=98 Ack=81547 Win=190208 Len=0 TSval=8772293 TSecr=1686274301
 44   1.280159 54.230.117.152 -> 172.31.8.238 TCP 26130 [TCP segment of a reassembled PDU]
 45   1.280174 172.31.8.238 -> 54.230.117.152 TCP 66 52796 > http [ACK] Seq=98 Ack=107611 Win=242304 Len=0 TSval=8772293 TSecr=1686274301
 46   1.280180 54.230.117.152 -> 172.31.8.238 TCP 5858 [TCP segment of a reassembled PDU]
 47   1.280184 172.31.8.238 -> 54.230.117.152 TCP 66 52796 > http [ACK] Seq=98 Ack=113403 Win=253952 Len=0 TSval=8772293 TSecr=1686274301
 48   1.281020 54.230.117.152 -> 172.31.8.238 TCP 4410 [TCP segment of a reassembled PDU]
 49   1.281026 172.31.8.238 -> 54.230.117.152 TCP 66 52796 > http [ACK] Seq=98 Ack=117747 Win=262656 Len=0 TSval=8772293 TSecr=1686274301
 50   1.281183 54.230.117.152 -> 172.31.8.238 TCP 26130 [TCP segment of a reassembled PDU]
 51   1.281197 172.31.8.238 -> 54.230.117.152 TCP 66 52796 > http [ACK] Seq=98 Ack=143811 Win=272512 Len=0 TSval=8772293 TSecr=1686274301
 52   1.281204 54.230.117.152 -> 172.31.8.238 TCP 4410 [TCP segment of a reassembled PDU]
 53   1.281207 172.31.8.238 -> 54.230.117.152 TCP 66 52796 > http [ACK] Seq=98 Ack=148155 Win=268288 Len=0 TSval=8772293 TSecr=1686274301
 54   1.282052 54.230.117.152 -> 172.31.8.238 TCP 4410 [TCP segment of a reassembled PDU]
 55   1.282059 172.31.8.238 -> 54.230.117.152 TCP 66 52796 > http [ACK] Seq=98 Ack=152499 Win=308224 Len=0 TSval=8772294 TSecr=1686274301
 56   1.282210 54.230.117.152 -> 172.31.8.238 TCP 17442 [TCP segment of a reassembled PDU]
 57   1.282220 172.31.8.238 -> 54.230.117.152 TCP 66 52796 > http [ACK] Seq=98 Ack=169875 Win=349440 Len=0 TSval=8772294 TSecr=1686274301
 58   1.282241 54.230.117.152 -> 172.31.8.238 TCP 8754 [TCP segment of a reassembled PDU]
 59   1.282249 172.31.8.238 -> 54.230.117.152 TCP 66 52796 > http [ACK] Seq=98 Ack=178563 Win=366848 Len=0 TSval=8772294 TSecr=1686274301
 60   1.282308 54.230.117.152 -> 172.31.8.238 TCP 14546 [TCP segment of a reassembled PDU]
 61   1.282318 172.31.8.238 -> 54.230.117.152 TCP 66 52796 > http [ACK] Seq=98 Ack=193043 Win=395776 Len=0 TSval=8772294 TSecr=1686274301
 62   1.283073 54.230.117.152 -> 172.31.8.238 TCP 2962 [TCP segment of a reassembled PDU]
 63   1.283078 172.31.8.238 -> 54.230.117.152 TCP 66 52796 > http [ACK] Seq=98 Ack=195939 Win=401664 Len=0 TSval=8772294 TSecr=1686274301
 64   1.283270 54.230.117.152 -> 172.31.8.238 TCP 26130 [TCP segment of a reassembled PDU]
 65   1.283284 172.31.8.238 -> 54.230.117.152 TCP 66 52796 > http [ACK] Seq=98 Ack=222003 Win=453760 Len=0 TSval=8772294 TSecr=1686274301
 66   1.283332 54.230.117.152 -> 172.31.8.238 TCP 21786 [TCP segment of a reassembled PDU]
 67   1.283344 172.31.8.238 -> 54.230.117.152 TCP 66 52796 > http [ACK] Seq=98 Ack=243723 Win=497152 Len=0 TSval=8772294 TSecr=1686274301
 68   1.283831 54.230.117.152 -> 172.31.8.238 TCP 4410 [TCP segment of a reassembled PDU]
 69   1.283837 172.31.8.238 -> 54.230.117.152 TCP 66 52796 > http [ACK] Seq=98 Ack=248067 Win=505856 Len=0 TSval=8772294 TSecr=1686274301
 70   1.284018 54.230.117.152 -> 172.31.8.238 TCP 26130 [TCP segment of a reassembled PDU]
 71   1.284032 172.31.8.238 -> 54.230.117.152 TCP 66 52796 > http [ACK] Seq=98 Ack=274131 Win=557952 Len=0 TSval=8772294 TSecr=1686274301
 72   1.284076 54.230.117.152 -> 172.31.8.238 TCP 18890 [TCP segment of a reassembled PDU]
 73   1.284087 172.31.8.238 -> 54.230.117.152 TCP 66 52796 > http [ACK] Seq=98 Ack=292955 Win=595584 Len=0 TSval=8772294 TSecr=1686274301
 74   1.284868 54.230.117.152 -> 172.31.8.238 TCP 5858 [TCP segment of a reassembled PDU]
 75   1.284875 172.31.8.238 -> 54.230.117.152 TCP 66 52796 > http [ACK] Seq=98 Ack=298747 Win=607232 Len=0 TSval=8772294 TSecr=1686274301
 76   1.285066 54.230.117.152 -> 172.31.8.238 TCP 26130 [TCP segment of a reassembled PDU]
 77   1.285079 172.31.8.238 -> 54.230.117.152 TCP 66 52796 > http [ACK] Seq=98 Ack=324811 Win=659328 Len=0 TSval=8772294 TSecr=1686274301
 78   1.285103 54.230.117.152 -> 172.31.8.238 TCP 14546 [TCP segment of a reassembled PDU]
 79   1.285111 172.31.8.238 -> 54.230.117.152 TCP 66 52796 > http [ACK] Seq=98 Ack=339291 Win=688256 Len=0 TSval=8772294 TSecr=1686274301
 80   1.285623 54.230.117.152 -> 172.31.8.238 TCP 4410 [TCP segment of a reassembled PDU]
 81   1.285629 172.31.8.238 -> 54.230.117.152 TCP 66 52796 > http [ACK] Seq=98 Ack=343635 Win=696960 Len=0 TSval=8772294 TSecr=1686274301
 82   1.285810 54.230.117.152 -> 172.31.8.238 TCP 26130 [TCP segment of a reassembled PDU]
 83   1.285824 172.31.8.238 -> 54.230.117.152 TCP 66 52796 > http [ACK] Seq=98 Ack=369699 Win=723072 Len=0 TSval=8772294 TSecr=1686274301
 84   1.285873 54.230.117.152 -> 172.31.8.238 TCP 17442 [TCP segment of a reassembled PDU]
 85   1.285884 172.31.8.238 -> 54.230.117.152 TCP 66 52796 > http [ACK] Seq=98 Ack=387075 Win=737280 Len=0 TSval=8772294 TSecr=1686274301
 86   1.286384 54.230.117.152 -> 172.31.8.238 TCP 2962 [TCP segment of a reassembled PDU]
 87   1.286390 172.31.8.238 -> 54.230.117.152 TCP 66 52796 > http [ACK] Seq=98 Ack=389971 Win=754944 Len=0 TSval=8772295 TSecr=1686274301
 88   1.286537 54.230.117.152 -> 172.31.8.238 TCP 14546 [TCP segment of a reassembled PDU]
 89   1.286546 172.31.8.238 -> 54.230.117.152 TCP 66 52796 > http [ACK] Seq=98 Ack=404451 Win=783872 Len=0 TSval=8772295 TSecr=1686274301
 90   1.286664 54.230.117.152 -> 172.31.8.238 TCP 26130 [TCP segment of a reassembled PDU]
 91   1.286677 172.31.8.238 -> 54.230.117.152 TCP 66 52796 > http [ACK] Seq=98 Ack=430515 Win=835968 Len=0 TSval=8772295 TSecr=1686274302
 92   1.286686 54.230.117.152 -> 172.31.8.238 TCP 5858 [TCP segment of a reassembled PDU]
 93   1.286690 172.31.8.238 -> 54.230.117.152 TCP 66 52796 > http [ACK] Seq=98 Ack=436307 Win=847616 Len=0 TSval=8772295 TSecr=1686274302
 94   1.287193 54.230.117.152 -> 172.31.8.238 TCP 4410 [TCP segment of a reassembled PDU]
 95   1.287199 172.31.8.238 -> 54.230.117.152 TCP 66 52796 > http [ACK] Seq=98 Ack=440651 Win=856320 Len=0 TSval=8772295 TSecr=1686274302
 96   1.287367 54.230.117.152 -> 172.31.8.238 TCP 26130 [TCP segment of a reassembled PDU]
 97   1.287380 172.31.8.238 -> 54.230.117.152 TCP 66 52796 > http [ACK] Seq=98 Ack=466715 Win=908416 Len=0 TSval=8772295 TSecr=1686274302
 98   1.287453 54.230.117.152 -> 172.31.8.238 TCP 26130 [TCP segment of a reassembled PDU]
 99   1.287466 172.31.8.238 -> 54.230.117.152 TCP 66 52796 > http [ACK] Seq=98 Ack=492779 Win=960512 Len=0 TSval=8772295 TSecr=1686274302
100   1.287510 54.230.117.152 -> 172.31.8.238 TCP 10202 [TCP segment of a reassembled PDU]
101   1.287518 172.31.8.238 -> 54.230.117.152 TCP 66 52796 > http [ACK] Seq=98 Ack=502915 Win=980864 Len=0 TSval=8772295 TSecr=1686274302
102   1.288206 54.230.117.152 -> 172.31.8.238 TCP 4410 [TCP segment of a reassembled PDU]
103   1.288215 172.31.8.238 -> 54.230.117.152 TCP 66 52796 > http [ACK] Seq=98 Ack=507259 Win=989440 Len=0 TSval=8772295 TSecr=1686274302
104   1.288393 54.230.117.152 -> 172.31.8.238 TCP 26130 [TCP segment of a reassembled PDU]
105   1.288406 172.31.8.238 -> 54.230.117.152 TCP 66 52796 > http [ACK] Seq=98 Ack=533323 Win=1041664 Len=0 TSval=8772295 TSecr=1686274302
106   1.288465 54.230.117.152 -> 172.31.8.238 TCP 21786 [TCP segment of a reassembled PDU]
107   1.288477 172.31.8.238 -> 54.230.117.152 TCP 66 52796 > http [ACK] Seq=98 Ack=555043 Win=1085056 Len=0 TSval=8772295 TSecr=1686274302
108   1.288529 54.230.117.152 -> 172.31.8.238 TCP 15994 [TCP segment of a reassembled PDU]
109   1.288540 172.31.8.238 -> 54.230.117.152 TCP 66 52796 > http [ACK] Seq=98 Ack=570971 Win=1116928 Len=0 TSval=8772295 TSecr=1686274302
110   1.289125 54.230.117.152 -> 172.31.8.238 TCP 4410 [TCP segment of a reassembled PDU]
111   1.289131 172.31.8.238 -> 54.230.117.152 TCP 66 52796 > http [ACK] Seq=98 Ack=575315 Win=1125632 Len=0 TSval=8772295 TSecr=1686274302
112   1.289313 54.230.117.152 -> 172.31.8.238 TCP 24682 [TCP segment of a reassembled PDU]
113   1.289324 172.31.8.238 -> 54.230.117.152 TCP 66 52796 > http [ACK] Seq=98 Ack=599931 Win=1174784 Len=0 TSval=8772295 TSecr=1686274302
114   1.289437 54.230.117.152 -> 172.31.8.238 TCP 17442 [TCP segment of a reassembled PDU]
115   1.289448 172.31.8.238 -> 54.230.117.152 TCP 66 52796 > http [ACK] Seq=98 Ack=617307 Win=1196800 Len=0 TSval=8772295 TSecr=1686274302
116   1.289453 54.230.117.152 -> 172.31.8.238 TCP 1514 [TCP segment of a reassembled PDU]
117   1.289456 172.31.8.238 -> 54.230.117.152 TCP 66 52796 > http [ACK] Seq=98 Ack=618755 Win=1195392 Len=0 TSval=8772295 TSecr=1686274302
118   1.289465 54.230.117.152 -> 172.31.8.238 TCP 7306 [TCP segment of a reassembled PDU]
119   1.289470 172.31.8.238 -> 54.230.117.152 TCP 66 52796 > http [ACK] Seq=98 Ack=625995 Win=1188224 Len=0 TSval=8772295 TSecr=1686274302
120   1.289521 54.230.117.152 -> 172.31.8.238 TCP 13098 [TCP segment of a reassembled PDU]
121   1.289528 172.31.8.238 -> 54.230.117.152 TCP 66 52796 > http [ACK] Seq=98 Ack=639027 Win=1204096 Len=0 TSval=8772295 TSecr=1686274302
122   1.290023 54.230.117.152 -> 172.31.8.238 TCP 26130 [TCP segment of a reassembled PDU]
123   1.290037 172.31.8.238 -> 54.230.117.152 TCP 66 52796 > http [ACK] Seq=98 Ack=665091 Win=1182592 Len=0 TSval=8772296 TSecr=1686274302
124   1.290272 54.230.117.152 -> 172.31.8.238 TCP 26130 [TCP segment of a reassembled PDU]
125   1.290286 172.31.8.238 -> 54.230.117.152 TCP 66 52796 > http [ACK] Seq=98 Ack=691155 Win=1182592 Len=0 TSval=8772296 TSecr=1686274302
126   1.290436 54.230.117.152 -> 172.31.8.238 TCP 26130 [TCP segment of a reassembled PDU]
127   1.290449 172.31.8.238 -> 54.230.117.152 TCP 66 52796 > http [ACK] Seq=98 Ack=717219 Win=1182592 Len=0 TSval=8772296 TSecr=1686274302
128   1.290482 54.230.117.152 -> 172.31.8.238 TCP 13098 [TCP segment of a reassembled PDU]
129   1.290503 172.31.8.238 -> 54.230.117.152 TCP 66 52796 > http [ACK] Seq=98 Ack=730251 Win=1204096 Len=0 TSval=8772296 TSecr=1686274302
130   1.290915 54.230.117.152 -> 172.31.8.238 TCP 4410 [TCP segment of a reassembled PDU]
131   1.290921 172.31.8.238 -> 54.230.117.152 TCP 66 52796 > http [ACK] Seq=98 Ack=734595 Win=1218304 Len=0 TSval=8772296 TSecr=1686274302
132   1.291097 54.230.117.152 -> 172.31.8.238 TCP 26130 [TCP segment of a reassembled PDU]
133   1.291111 172.31.8.238 -> 54.230.117.152 TCP 66 52796 > http [ACK] Seq=98 Ack=760659 Win=1192320 Len=0 TSval=8772296 TSecr=1686274302
134   1.291136 54.230.117.152 -> 172.31.8.238 TCP 10202 [TCP segment of a reassembled PDU]
135   1.291144 172.31.8.238 -> 54.230.117.152 TCP 66 52796 > http [ACK] Seq=98 Ack=770795 Win=1182208 Len=0 TSval=8772296 TSecr=1686274302
136   1.291230 54.230.117.152 -> 172.31.8.238 TCP 17442 [TCP segment of a reassembled PDU]
137   1.291252 172.31.8.238 -> 54.230.117.152 TCP 66 52796 > http [ACK] Seq=98 Ack=788171 Win=1196800 Len=0 TSval=8772296 TSecr=1686274302
138   1.291384 54.230.117.152 -> 172.31.8.238 TCP 26130 [TCP segment of a reassembled PDU]
139   1.291397 172.31.8.238 -> 54.230.117.152 TCP 66 52796 > http [ACK] Seq=98 Ack=814235 Win=1170816 Len=0 TSval=8772296 TSecr=1686274302
140   1.291439 54.230.117.152 -> 172.31.8.238 TCP 15994 [TCP segment of a reassembled PDU]
141   1.291461 172.31.8.238 -> 54.230.117.152 TCP 66 52796 > http [ACK] Seq=98 Ack=830163 Win=1199232 Len=0 TSval=8772296 TSecr=1686274302
142   1.291792 54.230.117.152 -> 172.31.8.238 TCP 26130 [TCP segment of a reassembled PDU]
143   1.291816 54.230.117.152 -> 172.31.8.238 TCP 4410 [TCP segment of a reassembled PDU]
144   1.291827 172.31.8.238 -> 54.230.117.152 TCP 66 52796 > http [ACK] Seq=98 Ack=860571 Win=1175424 Len=0 TSval=8772296 TSecr=1686274302
145   1.292020 54.230.117.152 -> 172.31.8.238 TCP 14546 [TCP segment of a reassembled PDU]
146   1.292030 172.31.8.238 -> 54.230.117.152 TCP 66 52796 > http [ACK] Seq=98 Ack=875051 Win=1201536 Len=0 TSval=8772296 TSecr=1686274302
147   1.292182 54.230.117.152 -> 172.31.8.238 TCP 17442 [TCP segment of a reassembled PDU]
148   1.292214 54.230.117.152 -> 172.31.8.238 TCP 8754 [TCP segment of a reassembled PDU]
149   1.292257 54.230.117.152 -> 172.31.8.238 TCP 24682 [TCP segment of a reassembled PDU]
150   1.292293 172.31.8.238 -> 54.230.117.152 TCP 66 52796 > http [ACK] Seq=98 Ack=925731 Win=1150976 Len=0 TSval=8772296 TSecr=1686274302
151   1.292608 54.230.117.152 -> 172.31.8.238 TCP 26130 [TCP segment of a reassembled PDU]
152   1.292622 172.31.8.238 -> 54.230.117.152 TCP 66 52796 > http [ACK] Seq=98 Ack=951795 Win=1182592 Len=0 TSval=8772296 TSecr=1686274302
153   1.292720 54.230.117.152 -> 172.31.8.238 TCP 18890 [TCP segment of a reassembled PDU]
154   1.292731 172.31.8.238 -> 54.230.117.152 TCP 66 52796 > http [ACK] Seq=98 Ack=970619 Win=1194496 Len=0 TSval=8772296 TSecr=1686274302
155   1.293072 54.230.117.152 -> 172.31.8.238 TCP 15994 [TCP segment of a reassembled PDU]
156   1.293082 172.31.8.238 -> 54.230.117.152 TCP 66 52796 > http [ACK] Seq=98 Ack=986547 Win=1199232 Len=0 TSval=8772296 TSecr=1686274302
157   1.293233 54.230.117.152 -> 172.31.8.238 TCP 26130 [TCP segment of a reassembled PDU]
158   1.293259 172.31.8.238 -> 54.230.117.152 TCP 66 52796 > http [ACK] Seq=98 Ack=1012611 Win=1182592 Len=0 TSval=8772296 TSecr=1686274302
159   1.293288 54.230.117.152 -> 172.31.8.238 TCP 17442 [TCP segment of a reassembled PDU]
160   1.293297 172.31.8.238 -> 54.230.117.152 TCP 66 52796 > http [ACK] Seq=98 Ack=1029987 Win=1196800 Len=0 TSval=8772296 TSecr=1686274302
161   1.293354 54.230.117.152 -> 172.31.8.238 TCP 14546 [TCP segment of a reassembled PDU]
162   1.293462 54.230.117.152 -> 172.31.8.238 TCP 11650 [TCP segment of a reassembled PDU]
163   1.293486 172.31.8.238 -> 54.230.117.152 TCP 66 52796 > http [ACK] Seq=98 Ack=1056051 Win=1170816 Len=0 TSval=8772296 TSecr=1686274302
164   1.293716 54.230.117.152 -> 172.31.8.238 TCP 14546 [TCP segment of a reassembled PDU]
165   1.293726 172.31.8.238 -> 54.230.117.152 TCP 66 52796 > http [ACK] Seq=98 Ack=1070531 Win=1201536 Len=0 TSval=8772296 TSecr=1686274302
166   1.293877 54.230.117.152 -> 172.31.8.238 TCP 26130 [TCP segment of a reassembled PDU]
167   1.293902 172.31.8.238 -> 54.230.117.152 TCP 66 52796 > http [ACK] Seq=98 Ack=1096595 Win=1182592 Len=0 TSval=8772296 TSecr=1686274302
168   1.293914 54.230.117.152 -> 172.31.8.238 TCP 11650 [TCP segment of a reassembled PDU]
169   1.293932 172.31.8.238 -> 54.230.117.152 TCP 66 52796 > http [ACK] Seq=98 Ack=1108179 Win=1206400 Len=0 TSval=8772296 TSecr=1686274302
170   1.293994 54.230.117.152 -> 172.31.8.238 TCP 7306 [TCP segment of a reassembled PDU]
171   1.294000 172.31.8.238 -> 54.230.117.152 TCP 66 52796 > http [ACK] Seq=98 Ack=1115419 Win=1213568 Len=0 TSval=8772296 TSecr=1686274302
172   1.294100 54.230.117.152 -> 172.31.8.238 TCP 5858 [TCP segment of a reassembled PDU]
173   1.294106 172.31.8.238 -> 54.230.117.152 TCP 66 52796 > http [ACK] Seq=98 Ack=1121211 Win=1229824 Len=0 TSval=8772297 TSecr=1686274302
174   1.294389 54.230.117.152 -> 172.31.8.238 TCP 26130 [TCP segment of a reassembled PDU]
175   1.294403 172.31.8.238 -> 54.230.117.152 TCP 66 52796 > http [ACK] Seq=98 Ack=1147275 Win=1282048 Len=0 TSval=8772297 TSecr=1686274302
176   1.294444 54.230.117.152 -> 172.31.8.238 TCP 20338 [TCP segment of a reassembled PDU]
177   1.294455 172.31.8.238 -> 54.230.117.152 TCP 66 52796 > http [ACK] Seq=98 Ack=1167547 Win=1322496 Len=0 TSval=8772297 TSecr=1686274302
178   1.294513 54.230.117.152 -> 172.31.8.238 TCP 17442 [TCP segment of a reassembled PDU]
179   1.294523 172.31.8.238 -> 54.230.117.152 TCP 66 52796 > http [ACK] Seq=98 Ack=1184923 Win=1357312 Len=0 TSval=8772297 TSecr=1686274302
180   1.294611 54.230.117.152 -> 172.31.8.238 TCP 1514 [TCP segment of a reassembled PDU]
181   1.294616 172.31.8.238 -> 54.230.117.152 TCP 66 52796 > http [ACK] Seq=98 Ack=1186371 Win=1360128 Len=0 TSval=8772297 TSecr=1686274302
182   1.294729 54.230.117.152 -> 172.31.8.238 TCP 26130 [TCP segment of a reassembled PDU]
183   1.294742 172.31.8.238 -> 54.230.117.152 TCP 66 52796 > http [ACK] Seq=98 Ack=1212435 Win=1412352 Len=0 TSval=8772297 TSecr=1686274302
184   1.294768 54.230.117.152 -> 172.31.8.238 TCP 17442 [TCP segment of a reassembled PDU]
185   1.294790 172.31.8.238 -> 54.230.117.152 TCP 66 52796 > http [ACK] Seq=98 Ack=1229811 Win=1447040 Len=0 TSval=8772297 TSecr=1686274302
186   1.294834 54.230.117.152 -> 172.31.8.238 TCP 4410 [TCP segment of a reassembled PDU]
187   1.294841 172.31.8.238 -> 54.230.117.152 TCP 66 52796 > http [ACK] Seq=98 Ack=1234155 Win=1455744 Len=0 TSval=8772297 TSecr=1686274302
188   1.295231 54.230.117.152 -> 172.31.8.238 TCP 26130 [TCP segment of a reassembled PDU]
189   1.295245 172.31.8.238 -> 54.230.117.152 TCP 66 52796 > http [ACK] Seq=98 Ack=1260219 Win=1507840 Len=0 TSval=8772297 TSecr=1686274302
190   1.295302 54.230.117.152 -> 172.31.8.238 TCP 26130 [TCP segment of a reassembled PDU]
191   1.295314 172.31.8.238 -> 54.230.117.152 TCP 66 52796 > http [ACK] Seq=98 Ack=1286283 Win=1560064 Len=0 TSval=8772297 TSecr=1686274302
192   1.295380 54.230.117.152 -> 172.31.8.238 TCP 24682 [TCP segment of a reassembled PDU]
193   1.295392 172.31.8.238 -> 54.230.117.152 TCP 66 52796 > http [ACK] Seq=98 Ack=1310899 Win=1609216 Len=0 TSval=8772297 TSecr=1686274302
194   1.295436 54.230.117.152 -> 172.31.8.238 TCP 8754 [TCP segment of a reassembled PDU]
195   1.295442 172.31.8.238 -> 54.230.117.152 TCP 66 52796 > http [ACK] Seq=98 Ack=1319587 Win=1609216 Len=0 TSval=8772297 TSecr=1686274302
196   1.295589 54.230.117.152 -> 172.31.8.238 TCP 26130 [TCP segment of a reassembled PDU]
197   1.295603 172.31.8.238 -> 54.230.117.152 TCP 66 52796 > http [ACK] Seq=98 Ack=1345651 Win=1609216 Len=0 TSval=8772297 TSecr=1686274302
198   1.295645 54.230.117.152 -> 172.31.8.238 TCP 21786 [TCP segment of a reassembled PDU]
199   1.295656 172.31.8.238 -> 54.230.117.152 TCP 66 52796 > http [ACK] Seq=98 Ack=1367371 Win=1609216 Len=0 TSval=8772297 TSecr=1686274302
200   1.296099 54.230.117.152 -> 172.31.8.238 TCP 2962 [TCP segment of a reassembled PDU]
201   1.296105 172.31.8.238 -> 54.230.117.152 TCP 66 52796 > http [ACK] Seq=98 Ack=1370267 Win=1609216 Len=0 TSval=8772297 TSecr=1686274302
202   1.296275 54.230.117.152 -> 172.31.8.238 TCP 26130 [TCP segment of a reassembled PDU]
203   1.296289 172.31.8.238 -> 54.230.117.152 TCP 66 52796 > http [ACK] Seq=98 Ack=1396331 Win=1609216 Len=0 TSval=8772297 TSecr=1686274302
204   1.296361 54.230.117.152 -> 172.31.8.238 TCP 26130 [TCP segment of a reassembled PDU]
205   1.296374 172.31.8.238 -> 54.230.117.152 TCP 66 52796 > http [ACK] Seq=98 Ack=1422395 Win=1609216 Len=0 TSval=8772297 TSecr=1686274302
206   1.296450 54.230.117.152 -> 172.31.8.238 TCP 26130 [TCP segment of a reassembled PDU]
207   1.296464 172.31.8.238 -> 54.230.117.152 TCP 66 52796 > http [ACK] Seq=98 Ack=1448459 Win=1609216 Len=0 TSval=8772297 TSecr=1686274302
208   1.296520 54.230.117.152 -> 172.31.8.238 TCP 15994 [TCP segment of a reassembled PDU]
209   1.296531 172.31.8.238 -> 54.230.117.152 TCP 66 52796 > http [ACK] Seq=98 Ack=1464387 Win=1609216 Len=0 TSval=8772297 TSecr=1686274302
210   1.296593 54.230.117.152 -> 172.31.8.238 TCP 23234 [TCP segment of a reassembled PDU]
211   1.296606 172.31.8.238 -> 54.230.117.152 TCP 66 52796 > http [ACK] Seq=98 Ack=1487555 Win=1609216 Len=0 TSval=8772297 TSecr=1686274302
212   1.296716 54.230.117.152 -> 172.31.8.238 TCP 23234 [TCP segment of a reassembled PDU]
213   1.296729 172.31.8.238 -> 54.230.117.152 TCP 66 52796 > http [ACK] Seq=98 Ack=1510723 Win=1609216 Len=0 TSval=8772297 TSecr=1686274302
214   1.296735 54.230.117.152 -> 172.31.8.238 TCP 1514 [TCP segment of a reassembled PDU]
215   1.297094 54.230.117.152 -> 172.31.8.238 TCP 26130 [TCP segment of a reassembled PDU]
216   1.297108 172.31.8.238 -> 54.230.117.152 TCP 66 52796 > http [ACK] Seq=98 Ack=1538235 Win=1609216 Len=0 TSval=8772297 TSecr=1686274302
217   1.297172 54.230.117.152 -> 172.31.8.238 TCP 26130 [TCP segment of a reassembled PDU]
218   1.297187 172.31.8.238 -> 54.230.117.152 TCP 66 52796 > http [ACK] Seq=98 Ack=1564299 Win=1609216 Len=0 TSval=8772297 TSecr=1686274303
219   1.297249 54.230.117.152 -> 172.31.8.238 TCP 13098 [TCP segment of a reassembled PDU]
220   1.297258 172.31.8.238 -> 54.230.117.152 TCP 66 52796 > http [ACK] Seq=98 Ack=1577331 Win=1609216 Len=0 TSval=8772297 TSecr=1686274303
221   1.297537 54.230.117.152 -> 172.31.8.238 TCP 21786 [TCP segment of a reassembled PDU]
222   1.297550 172.31.8.238 -> 54.230.117.152 TCP 66 52796 > http [ACK] Seq=98 Ack=1599051 Win=1609216 Len=0 TSval=8772297 TSecr=1686274303
223   1.297703 54.230.117.152 -> 172.31.8.238 TCP 26130 [TCP segment of a reassembled PDU]
224   1.297729 172.31.8.238 -> 54.230.117.152 TCP 66 52796 > http [ACK] Seq=98 Ack=1625115 Win=1609216 Len=0 TSval=8772297 TSecr=1686274303
225   1.297790 54.230.117.152 -> 172.31.8.238 TCP 26130 [TCP segment of a reassembled PDU]
226   1.297806 172.31.8.238 -> 54.230.117.152 TCP 66 52796 > http [ACK] Seq=98 Ack=1651179 Win=1609216 Len=0 TSval=8772297 TSecr=1686274303
227   1.297872 54.230.117.152 -> 172.31.8.238 TCP 26130 [TCP segment of a reassembled PDU]
228   1.297886 172.31.8.238 -> 54.230.117.152 TCP 66 52796 > http [ACK] Seq=98 Ack=1677243 Win=1609216 Len=0 TSval=8772297 TSecr=1686274303
229   1.297949 54.230.117.152 -> 172.31.8.238 TCP 21786 [TCP segment of a reassembled PDU]
230   1.297961 172.31.8.238 -> 54.230.117.152 TCP 66 52796 > http [ACK] Seq=98 Ack=1698963 Win=1609216 Len=0 TSval=8772297 TSecr=1686274303
231   1.298007 54.230.117.152 -> 172.31.8.238 TCP 5858 [TCP segment of a reassembled PDU]
232   1.298013 172.31.8.238 -> 54.230.117.152 TCP 66 52796 > http [ACK] Seq=98 Ack=1704755 Win=1609216 Len=0 TSval=8772298 TSecr=1686274303
233   1.298161 54.230.117.152 -> 172.31.8.238 TCP 26130 [TCP segment of a reassembled PDU]
234   1.298175 172.31.8.238 -> 54.230.117.152 TCP 66 52796 > http [ACK] Seq=98 Ack=1730819 Win=1609216 Len=0 TSval=8772298 TSecr=1686274303
235   1.298232 54.230.117.152 -> 172.31.8.238 TCP 26130 [TCP segment of a reassembled PDU]
236   1.298244 172.31.8.238 -> 54.230.117.152 TCP 66 52796 > http [ACK] Seq=98 Ack=1756883 Win=1609216 Len=0 TSval=8772298 TSecr=1686274303
237   1.298283 54.230.117.152 -> 172.31.8.238 TCP 5858 [TCP segment of a reassembled PDU]
238   1.298288 172.31.8.238 -> 54.230.117.152 TCP 66 52796 > http [ACK] Seq=98 Ack=1762675 Win=1609216 Len=0 TSval=8772298 TSecr=1686274303
239   1.298572 54.230.117.152 -> 172.31.8.238 TCP 10202 [TCP segment of a reassembled PDU]
240   1.298581 172.31.8.238 -> 54.230.117.152 TCP 66 52796 > http [ACK] Seq=98 Ack=1772811 Win=1609216 Len=0 TSval=8772298 TSecr=1686274303
241   1.298887 54.230.117.152 -> 172.31.8.238 TCP 20338 [TCP segment of a reassembled PDU]
242   1.298912 172.31.8.238 -> 54.230.117.152 TCP 66 52796 > http [ACK] Seq=98 Ack=1793083 Win=1609216 Len=0 TSval=8772298 TSecr=1686274303
243   1.298927 54.230.117.152 -> 172.31.8.238 TCP 5858 [TCP segment of a reassembled PDU]
244   1.298931 172.31.8.238 -> 54.230.117.152 TCP 66 52796 > http [ACK] Seq=98 Ack=1798875 Win=1609216 Len=0 TSval=8772298 TSecr=1686274303
245   1.299040 54.230.117.152 -> 172.31.8.238 TCP 39162 [TCP segment of a reassembled PDU]
246   1.299058 172.31.8.238 -> 54.230.117.152 TCP 66 52796 > http [ACK] Seq=98 Ack=1837971 Win=1609216 Len=0 TSval=8772298 TSecr=1686274303
247   1.299100 54.230.117.152 -> 172.31.8.238 TCP 11650 [TCP segment of a reassembled PDU]
248   1.299107 172.31.8.238 -> 54.230.117.152 TCP 66 52796 > http [ACK] Seq=98 Ack=1849555 Win=1609216 Len=0 TSval=8772298 TSecr=1686274303
249   1.299196 54.230.117.152 -> 172.31.8.238 TCP 26130 [TCP segment of a reassembled PDU]
250   1.299208 172.31.8.238 -> 54.230.117.152 TCP 66 52796 > http [ACK] Seq=98 Ack=1875619 Win=1609216 Len=0 TSval=8772298 TSecr=1686274303
251   1.299328 54.230.117.152 -> 172.31.8.238 TCP 26130 [TCP segment of a reassembled PDU]
252   1.299342 172.31.8.238 -> 54.230.117.152 TCP 66 52796 > http [ACK] Seq=98 Ack=1901683 Win=1609216 Len=0 TSval=8772298 TSecr=1686274303
253   1.299348 54.230.117.152 -> 172.31.8.238 TCP 1514 [TCP segment of a reassembled PDU]
254   1.299518 54.230.117.152 -> 172.31.8.238 TCP 5858 [TCP segment of a reassembled PDU]
255   1.299524 172.31.8.238 -> 54.230.117.152 TCP 66 52796 > http [ACK] Seq=98 Ack=1908923 Win=1609216 Len=0 TSval=8772298 TSecr=1686274303
256   1.299688 54.230.117.152 -> 172.31.8.238 TCP 26130 [TCP segment of a reassembled PDU]
257   1.299696 172.31.8.238 -> 54.230.117.152 TCP 66 52796 > http [ACK] Seq=98 Ack=1934987 Win=1609216 Len=0 TSval=8772298 TSecr=1686274303
258   1.299751 54.230.117.152 -> 172.31.8.238 TCP 24682 [TCP segment of a reassembled PDU]
259   1.299757 172.31.8.238 -> 54.230.117.152 TCP 66 52796 > http [ACK] Seq=98 Ack=1959603 Win=1609216 Len=0 TSval=8772298 TSecr=1686274303
260   1.299805 54.230.117.152 -> 172.31.8.238 TCP 11650 [TCP segment of a reassembled PDU]
261   1.299810 172.31.8.238 -> 54.230.117.152 TCP 66 52796 > http [ACK] Seq=98 Ack=1971187 Win=1609216 Len=0 TSval=8772298 TSecr=1686274303
262   1.299975 54.230.117.152 -> 172.31.8.238 TCP 26130 [TCP segment of a reassembled PDU]
263   1.299983 172.31.8.238 -> 54.230.117.152 TCP 66 52796 > http [ACK] Seq=98 Ack=1997251 Win=1609216 Len=0 TSval=8772298 TSecr=1686274303
264   1.300043 54.230.117.152 -> 172.31.8.238 TCP 24682 [TCP segment of a reassembled PDU]
265   1.300050 172.31.8.238 -> 54.230.117.152 TCP 66 52796 > http [ACK] Seq=98 Ack=2021867 Win=1609216 Len=0 TSval=8772298 TSecr=1686274303
266   1.300127 54.230.117.152 -> 172.31.8.238 TCP 17442 [TCP segment of a reassembled PDU]
267   1.300134 172.31.8.238 -> 54.230.117.152 TCP 66 52796 > http [ACK] Seq=98 Ack=2039243 Win=1609216 Len=0 TSval=8772298 TSecr=1686274303
268   1.300196 54.230.117.152 -> 172.31.8.238 TCP 17442 [TCP segment of a reassembled PDU]
269   1.300202 172.31.8.238 -> 54.230.117.152 TCP 66 52796 > http [ACK] Seq=98 Ack=2056619 Win=1609216 Len=0 TSval=8772298 TSecr=1686274303
270   1.300340 54.230.117.152 -> 172.31.8.238 TCP 27578 [TCP segment of a reassembled PDU]
271   1.300347 172.31.8.238 -> 54.230.117.152 TCP 66 52796 > http [ACK] Seq=98 Ack=2084131 Win=1609216 Len=0 TSval=8772298 TSecr=1686274303
272   1.300478 54.230.117.152 -> 172.31.8.238 TCP 14546 [TCP segment of a reassembled PDU]
273   1.300484 172.31.8.238 -> 54.230.117.152 TCP 66 52796 > http [ACK] Seq=98 Ack=2098611 Win=1609216 Len=0 TSval=8772298 TSecr=1686274303
274   1.300501 54.230.117.152 -> 172.31.8.238 TCP 26130 [TCP segment of a reassembled PDU]
275   1.300506 172.31.8.238 -> 54.230.117.152 TCP 66 52796 > http [ACK] Seq=98 Ack=2124675 Win=1609216 Len=0 TSval=8772298 TSecr=1686274303
276   1.300516 54.230.117.152 -> 172.31.8.238 TCP 18890 [TCP segment of a reassembled PDU]
277   1.300520 172.31.8.238 -> 54.230.117.152 TCP 66 52796 > http [ACK] Seq=98 Ack=2143499 Win=1609216 Len=0 TSval=8772298 TSecr=1686274303
278   1.300682 54.230.117.152 -> 172.31.8.238 TCP 20338 [TCP segment of a reassembled PDU]
279   1.300688 172.31.8.238 -> 54.230.117.152 TCP 66 52796 > http [ACK] Seq=98 Ack=2163771 Win=1609216 Len=0 TSval=8772298 TSecr=1686274303
280   1.301015 54.230.117.152 -> 172.31.8.238 TCP 26130 [TCP segment of a reassembled PDU]
281   1.301023 172.31.8.238 -> 54.230.117.152 TCP 66 52796 > http [ACK] Seq=98 Ack=2189835 Win=1609216 Len=0 TSval=8772298 TSecr=1686274303
282   1.301163 54.230.117.152 -> 172.31.8.238 TCP 26130 [TCP segment of a reassembled PDU]
283   1.301170 172.31.8.238 -> 54.230.117.152 TCP 66 52796 > http [ACK] Seq=98 Ack=2215899 Win=1609216 Len=0 TSval=8772298 TSecr=1686274303
284   1.301228 54.230.117.152 -> 172.31.8.238 TCP 26130 [TCP segment of a reassembled PDU]
285   1.301236 172.31.8.238 -> 54.230.117.152 TCP 66 52796 > http [ACK] Seq=98 Ack=2241963 Win=1609216 Len=0 TSval=8772298 TSecr=1686274303
286   1.301302 54.230.117.152 -> 172.31.8.238 TCP 24682 [TCP segment of a reassembled PDU]
287   1.301309 172.31.8.238 -> 54.230.117.152 TCP 66 52796 > http [ACK] Seq=98 Ack=2266579 Win=1609216 Len=0 TSval=8772298 TSecr=1686274303
288   1.301370 54.230.117.152 -> 172.31.8.238 TCP 18890 [TCP segment of a reassembled PDU]
289   1.301376 172.31.8.238 -> 54.230.117.152 TCP 66 52796 > http [ACK] Seq=98 Ack=2285403 Win=1609216 Len=0 TSval=8772298 TSecr=1686274303
290   1.301514 54.230.117.152 -> 172.31.8.238 TCP 18890 [TCP segment of a reassembled PDU]
291   1.301519 172.31.8.238 -> 54.230.117.152 TCP 66 52796 > http [ACK] Seq=98 Ack=2304227 Win=1609216 Len=0 TSval=8772298 TSecr=1686274303
292   1.301543 54.230.117.152 -> 172.31.8.238 TCP 7306 [TCP segment of a reassembled PDU]
293   1.301546 172.31.8.238 -> 54.230.117.152 TCP 66 52796 > http [ACK] Seq=98 Ack=2311467 Win=1609216 Len=0 TSval=8772298 TSecr=1686274303
294   1.301648 54.230.117.152 -> 172.31.8.238 TCP 26130 [TCP segment of a reassembled PDU]
295   1.301656 172.31.8.238 -> 54.230.117.152 TCP 66 52796 > http [ACK] Seq=98 Ack=2337531 Win=1609216 Len=0 TSval=8772298 TSecr=1686274303
296   1.301714 54.230.117.152 -> 172.31.8.238 TCP 21786 [TCP segment of a reassembled PDU]
297   1.301721 172.31.8.238 -> 54.230.117.152 TCP 66 52796 > http [ACK] Seq=98 Ack=2359251 Win=1609216 Len=0 TSval=8772298 TSecr=1686274303
298   1.302020 54.230.117.152 -> 172.31.8.238 TCP 26130 [TCP segment of a reassembled PDU]
299   1.302027 172.31.8.238 -> 54.230.117.152 TCP 66 52796 > http [ACK] Seq=98 Ack=2385315 Win=1609216 Len=0 TSval=8772299 TSecr=1686274303
300   1.302086 54.230.117.152 -> 172.31.8.238 TCP 26130 [TCP segment of a reassembled PDU]
301   1.302094 172.31.8.238 -> 54.230.117.152 TCP 66 52796 > http [ACK] Seq=98 Ack=2411379 Win=1609216 Len=0 TSval=8772299 TSecr=1686274303
302   1.302180 54.230.117.152 -> 172.31.8.238 TCP 24682 [TCP segment of a reassembled PDU]
303   1.302186 172.31.8.238 -> 54.230.117.152 TCP 66 52796 > http [ACK] Seq=98 Ack=2435995 Win=1609216 Len=0 TSval=8772299 TSecr=1686274303
304   1.302252 54.230.117.152 -> 172.31.8.238 TCP 23234 [TCP segment of a reassembled PDU]
305   1.302258 172.31.8.238 -> 54.230.117.152 TCP 66 52796 > http [ACK] Seq=98 Ack=2459163 Win=1609216 Len=0 TSval=8772299 TSecr=1686274303
306   1.302403 54.230.117.152 -> 172.31.8.238 TCP 26130 [TCP segment of a reassembled PDU]
307   1.302410 172.31.8.238 -> 54.230.117.152 TCP 66 52796 > http [ACK] Seq=98 Ack=2485227 Win=1609216 Len=0 TSval=8772299 TSecr=1686274303
308   1.302516 54.230.117.152 -> 172.31.8.238 TCP 13098 [TCP segment of a reassembled PDU]
309   1.302522 172.31.8.238 -> 54.230.117.152 TCP 66 52796 > http [ACK] Seq=98 Ack=2498259 Win=1609216 Len=0 TSval=8772299 TSecr=1686274303
310   1.302553 54.230.117.152 -> 172.31.8.238 TCP 15994 [TCP segment of a reassembled PDU]
311   1.302558 172.31.8.238 -> 54.230.117.152 TCP 66 52796 > http [ACK] Seq=98 Ack=2514187 Win=1609216 Len=0 TSval=8772299 TSecr=1686274303
312   1.302664 54.230.117.152 -> 172.31.8.238 TCP 15994 [TCP segment of a reassembled PDU]
313   1.302670 172.31.8.238 -> 54.230.117.152 TCP 66 52796 > http [ACK] Seq=98 Ack=2530115 Win=1609216 Len=0 TSval=8772299 TSecr=1686274303
314   1.302814 54.230.117.152 -> 172.31.8.238 TCP 24682 [TCP segment of a reassembled PDU]
315   1.302820 172.31.8.238 -> 54.230.117.152 TCP 66 52796 > http [ACK] Seq=98 Ack=2554731 Win=1609216 Len=0 TSval=8772299 TSecr=1686274303
316   1.302941 54.230.117.152 -> 172.31.8.238 TCP 21786 [TCP segment of a reassembled PDU]
317   1.302948 172.31.8.238 -> 54.230.117.152 TCP 66 52796 > http [ACK] Seq=98 Ack=2576451 Win=1609216 Len=0 TSval=8772299 TSecr=1686274303
318   1.302967 54.230.117.152 -> 172.31.8.238 TCP 4410 [TCP segment of a reassembled PDU]
319   1.302969 172.31.8.238 -> 54.230.117.152 TCP 66 52796 > http [ACK] Seq=98 Ack=2580795 Win=1609216 Len=0 TSval=8772299 TSecr=1686274303
320   1.303094 54.230.117.152 -> 172.31.8.238 TCP 50746 [TCP segment of a reassembled PDU]
321   1.303104 172.31.8.238 -> 54.230.117.152 TCP 66 52796 > http [ACK] Seq=98 Ack=2631475 Win=1609216 Len=0 TSval=8772299 TSecr=1686274303
322   1.303153 54.230.117.152 -> 172.31.8.238 TCP 7306 [TCP segment of a reassembled PDU]
323   1.303159 172.31.8.238 -> 54.230.117.152 TCP 66 52796 > http [ACK] Seq=98 Ack=2638715 Win=1609216 Len=0 TSval=8772299 TSecr=1686274303
324   1.303270 54.230.117.152 -> 172.31.8.238 TCP 43506 [TCP segment of a reassembled PDU]
325   1.303280 172.31.8.238 -> 54.230.117.152 TCP 66 52796 > http [ACK] Seq=98 Ack=2682155 Win=1609216 Len=0 TSval=8772299 TSecr=1686274303
326   1.303310 54.230.117.152 -> 172.31.8.238 TCP 11650 [TCP segment of a reassembled PDU]
327   1.303314 172.31.8.238 -> 54.230.117.152 TCP 66 52796 > http [ACK] Seq=98 Ack=2693739 Win=1609216 Len=0 TSval=8772299 TSecr=1686274303
328   1.303453 54.230.117.152 -> 172.31.8.238 TCP 26130 [TCP segment of a reassembled PDU]
329   1.303459 172.31.8.238 -> 54.230.117.152 TCP 66 52796 > http [ACK] Seq=98 Ack=2719803 Win=1609216 Len=0 TSval=8772299 TSecr=1686274303
330   1.303575 54.230.117.152 -> 172.31.8.238 TCP 24682 [TCP segment of a reassembled PDU]
331   1.303582 172.31.8.238 -> 54.230.117.152 TCP 66 52796 > http [ACK] Seq=98 Ack=2744419 Win=1609216 Len=0 TSval=8772299 TSecr=1686274303
332   1.303588 54.230.117.152 -> 172.31.8.238 TCP 1514 [TCP segment of a reassembled PDU]
333   1.303644 54.230.117.152 -> 172.31.8.238 TCP 4410 [TCP segment of a reassembled PDU]
334   1.303649 172.31.8.238 -> 54.230.117.152 TCP 66 52796 > http [ACK] Seq=98 Ack=2750211 Win=1609216 Len=0 TSval=8772299 TSecr=1686274303
335   1.303792 54.230.117.152 -> 172.31.8.238 TCP 23234 [TCP segment of a reassembled PDU]
336   1.303799 172.31.8.238 -> 54.230.117.152 TCP 66 52796 > http [ACK] Seq=98 Ack=2773379 Win=1609216 Len=0 TSval=8772299 TSecr=1686274303
337   1.303935 54.230.117.152 -> 172.31.8.238 TCP 26130 [TCP segment of a reassembled PDU]
338   1.303941 172.31.8.238 -> 54.230.117.152 TCP 66 52796 > http [ACK] Seq=98 Ack=2799443 Win=1609216 Len=0 TSval=8772299 TSecr=1686274303
339   1.304074 54.230.117.152 -> 172.31.8.238 TCP 39162 [TCP segment of a reassembled PDU]
340   1.304083 172.31.8.238 -> 54.230.117.152 TCP 66 52796 > http [ACK] Seq=98 Ack=2838539 Win=1609216 Len=0 TSval=8772299 TSecr=1686274303
341   1.304106 54.230.117.152 -> 172.31.8.238 TCP 8754 [TCP segment of a reassembled PDU]
342   1.304109 172.31.8.238 -> 54.230.117.152 TCP 66 52796 > http [ACK] Seq=98 Ack=2847227 Win=1609216 Len=0 TSval=8772299 TSecr=1686274303
343   1.304285 54.230.117.152 -> 172.31.8.238 TCP 26130 [TCP segment of a reassembled PDU]
344   1.304292 172.31.8.238 -> 54.230.117.152 TCP 66 52796 > http [ACK] Seq=98 Ack=2873291 Win=1609216 Len=0 TSval=8772299 TSecr=1686274303
345   1.304338 54.230.117.152 -> 172.31.8.238 TCP 17442 [TCP segment of a reassembled PDU]
346   1.304345 172.31.8.238 -> 54.230.117.152 TCP 66 52796 > http [ACK] Seq=98 Ack=2890667 Win=1609216 Len=0 TSval=8772299 TSecr=1686274303
347   1.304402 54.230.117.152 -> 172.31.8.238 TCP 10202 [TCP segment of a reassembled PDU]
348   1.304406 172.31.8.238 -> 54.230.117.152 TCP 66 52796 > http [ACK] Seq=98 Ack=2900803 Win=1609216 Len=0 TSval=8772299 TSecr=1686274303
