[Measurement for 10mb at 14:44:21 20.44.2014] 
Tshark:

  1   0.000000 172.31.8.238 -> 172.31.0.2   DNS 89 Standard query 0xaec6  A d2pcb72msibvx3.cloudfront.net
  2   0.000048 172.31.8.238 -> 172.31.0.2   DNS 89 Standard query 0xdc6c  AAAA d2pcb72msibvx3.cloudfront.net
  3   0.000930   172.31.0.2 -> 172.31.8.238 DNS 217 Standard query response 0xaec6  A 54.239.132.90 A 54.239.132.196 A 54.192.118.241 A 54.192.118.243 A 54.230.116.73 A 54.230.117.45 A 54.230.117.50 A 54.239.132.41
  4   0.001066   172.31.0.2 -> 172.31.8.238 DNS 169 Standard query response 0xdc6c 
  5   0.002266 172.31.8.238 -> 54.239.132.90 TCP 74 55985 > http [SYN] Seq=0 Win=26883 Len=0 MSS=8961 SACK_PERM=1 TSval=19572194 TSecr=0 WS=128
  6   0.002928 54.239.132.90 -> 172.31.8.238 TCP 74 http > 55985 [SYN, ACK] Seq=0 Ack=1 Win=14480 Len=0 MSS=1460 SACK_PERM=1 TSval=1585599513 TSecr=19572194 WS=128
  7   0.002942 172.31.8.238 -> 54.239.132.90 TCP 66 55985 > http [ACK] Seq=1 Ack=1 Win=27008 Len=0 TSval=19572195 TSecr=1585599513
  8   0.002984 172.31.8.238 -> 54.239.132.90 HTTP 163 GET /10mb HTTP/1.1 
  9   0.003386 54.239.132.90 -> 172.31.8.238 TCP 66 http > 55985 [ACK] Seq=1 Ack=98 Win=14592 Len=0 TSval=1585599513 TSecr=19572195
 10   0.006041 54.239.132.90 -> 172.31.8.238 TCP 13098 [TCP segment of a reassembled PDU]
 11   0.006053 172.31.8.238 -> 54.239.132.90 TCP 66 55985 > http [ACK] Seq=98 Ack=13033 Win=52992 Len=0 TSval=19572195 TSecr=1585599514
 12   0.006864 54.239.132.90 -> 172.31.8.238 TCP 13098 [TCP segment of a reassembled PDU]
 13   0.006883 172.31.8.238 -> 54.239.132.90 TCP 66 55985 > http [ACK] Seq=98 Ack=26065 Win=79104 Len=0 TSval=19572196 TSecr=1585599514
 14   0.007589 54.239.132.90 -> 172.31.8.238 TCP 13098 [TCP segment of a reassembled PDU]
 15   0.007597 172.31.8.238 -> 54.239.132.90 TCP 66 55985 > http [ACK] Seq=98 Ack=39097 Win=96512 Len=0 TSval=19572196 TSecr=1585599514
 16   0.008257 54.239.132.90 -> 172.31.8.238 TCP 4410 [TCP segment of a reassembled PDU]
 17   0.008263 172.31.8.238 -> 54.239.132.90 TCP 66 55985 > http [ACK] Seq=98 Ack=43441 Win=109056 Len=0 TSval=19572196 TSecr=1585599514
 18   0.008369 54.239.132.90 -> 172.31.8.238 TCP 8754 [TCP segment of a reassembled PDU]
 19   0.008376 172.31.8.238 -> 54.239.132.90 TCP 66 55985 > http [ACK] Seq=98 Ack=52129 Win=103680 Len=0 TSval=19572196 TSecr=1585599514
 20   0.008807 54.239.132.90 -> 172.31.8.238 TCP 2962 [TCP segment of a reassembled PDU]
 21   0.008813 172.31.8.238 -> 54.239.132.90 TCP 66 55985 > http [ACK] Seq=98 Ack=55025 Win=109056 Len=0 TSval=19572196 TSecr=1585599514
 22   0.008937 54.239.132.90 -> 172.31.8.238 TCP 18890 [TCP segment of a reassembled PDU]
 23   0.008949 172.31.8.238 -> 54.239.132.90 TCP 66 55985 > http [ACK] Seq=98 Ack=73849 Win=90240 Len=0 TSval=19572196 TSecr=1585599514
 24   0.009279 54.239.132.90 -> 172.31.8.238 TCP 4410 [TCP segment of a reassembled PDU]
 25   0.009285 172.31.8.238 -> 54.239.132.90 TCP 66 55985 > http [ACK] Seq=98 Ack=78193 Win=109056 Len=0 TSval=19572196 TSecr=1585599514
 26   0.009535 54.239.132.90 -> 172.31.8.238 TCP 1514 [TCP segment of a reassembled PDU]
 27   0.009540 172.31.8.238 -> 54.239.132.90 TCP 66 55985 > http [ACK] Seq=98 Ack=79641 Win=109056 Len=0 TSval=19572196 TSecr=1585599514
 28   0.009645 54.239.132.90 -> 172.31.8.238 TCP 13098 [TCP segment of a reassembled PDU]
 29   0.009654 172.31.8.238 -> 54.239.132.90 TCP 66 55985 > http [ACK] Seq=98 Ack=92673 Win=96512 Len=0 TSval=19572196 TSecr=1585599514
 30   0.009688 54.239.132.90 -> 172.31.8.238 TCP 5858 [TCP segment of a reassembled PDU]
 31   0.009694 172.31.8.238 -> 54.239.132.90 TCP 66 55985 > http [ACK] Seq=98 Ack=98465 Win=108416 Len=0 TSval=19572196 TSecr=1585599514
 32   0.009814 54.239.132.90 -> 172.31.8.238 TCP 5858 [TCP segment of a reassembled PDU]
 33   0.009821 172.31.8.238 -> 54.239.132.90 TCP 66 55985 > http [ACK] Seq=98 Ack=104257 Win=108416 Len=0 TSval=19572196 TSecr=1585599514
 34   0.010303 54.239.132.90 -> 172.31.8.238 TCP 7306 [TCP segment of a reassembled PDU]
 35   0.010322 172.31.8.238 -> 54.239.132.90 TCP 66 55985 > http [ACK] Seq=98 Ack=111497 Win=109056 Len=0 TSval=19572196 TSecr=1585599514
 36   0.010442 54.239.132.90 -> 172.31.8.238 TCP 24682 [TCP segment of a reassembled PDU]
 37   0.010666 172.31.8.238 -> 54.239.132.90 TCP 66 55985 > http [ACK] Seq=98 Ack=136113 Win=84480 Len=0 TSval=19572196 TSecr=1585599514
 38   0.010891 54.239.132.90 -> 172.31.8.238 TCP 7306 [TCP segment of a reassembled PDU]
 39   0.010898 172.31.8.238 -> 54.239.132.90 TCP 66 55985 > http [ACK] Seq=98 Ack=143353 Win=105984 Len=0 TSval=19572197 TSecr=1585599514
 40   0.011177 54.239.132.90 -> 172.31.8.238 TCP 26130 [TCP segment of a reassembled PDU]
 41   0.011190 172.31.8.238 -> 54.239.132.90 TCP 66 55985 > http [ACK] Seq=98 Ack=169417 Win=161152 Len=0 TSval=19572197 TSecr=1585599514
 42   0.011196 54.239.132.90 -> 172.31.8.238 TCP 1514 [TCP segment of a reassembled PDU]
 43   0.011199 172.31.8.238 -> 54.239.132.90 TCP 66 55985 > http [ACK] Seq=98 Ack=170865 Win=164096 Len=0 TSval=19572197 TSecr=1585599514
 44   0.011587 54.239.132.90 -> 172.31.8.238 TCP 4410 [TCP segment of a reassembled PDU]
 45   0.011593 172.31.8.238 -> 54.239.132.90 TCP 66 55985 > http [ACK] Seq=98 Ack=175209 Win=172800 Len=0 TSval=19572197 TSecr=1585599514
 46   0.011701 54.239.132.90 -> 172.31.8.238 TCP 7306 [TCP segment of a reassembled PDU]
 47   0.011707 172.31.8.238 -> 54.239.132.90 TCP 66 55985 > http [ACK] Seq=98 Ack=182449 Win=187264 Len=0 TSval=19572197 TSecr=1585599514
 48   0.011839 54.239.132.90 -> 172.31.8.238 TCP 24682 [TCP segment of a reassembled PDU]
 49   0.011851 172.31.8.238 -> 54.239.132.90 TCP 66 55985 > http [ACK] Seq=98 Ack=207065 Win=236544 Len=0 TSval=19572197 TSecr=1585599514
 50   0.012394 54.239.132.90 -> 172.31.8.238 TCP 5858 [TCP segment of a reassembled PDU]
 51   0.012400 172.31.8.238 -> 54.239.132.90 TCP 66 55985 > http [ACK] Seq=98 Ack=212857 Win=248064 Len=0 TSval=19572197 TSecr=1585599514
 52   0.012576 54.239.132.90 -> 172.31.8.238 TCP 26130 [TCP segment of a reassembled PDU]
 53   0.012589 172.31.8.238 -> 54.239.132.90 TCP 66 55985 > http [ACK] Seq=98 Ack=238921 Win=300160 Len=0 TSval=19572197 TSecr=1585599514
 54   0.012616 54.239.132.90 -> 172.31.8.238 TCP 11650 [TCP segment of a reassembled PDU]
 55   0.012627 172.31.8.238 -> 54.239.132.90 TCP 66 55985 > http [ACK] Seq=98 Ack=250505 Win=323328 Len=0 TSval=19572197 TSecr=1585599514
 56   0.013120 54.239.132.90 -> 172.31.8.238 TCP 7306 [TCP segment of a reassembled PDU]
 57   0.013127 172.31.8.238 -> 54.239.132.90 TCP 66 55985 > http [ACK] Seq=98 Ack=257745 Win=337792 Len=0 TSval=19572197 TSecr=1585599514
 58   0.013294 54.239.132.90 -> 172.31.8.238 TCP 26130 [TCP segment of a reassembled PDU]
 59   0.013307 172.31.8.238 -> 54.239.132.90 TCP 66 55985 > http [ACK] Seq=98 Ack=283809 Win=390016 Len=0 TSval=19572197 TSecr=1585599514
 60   0.013314 54.239.132.90 -> 172.31.8.238 TCP 1514 [TCP segment of a reassembled PDU]
 61   0.013316 172.31.8.238 -> 54.239.132.90 TCP 66 55985 > http [ACK] Seq=98 Ack=285257 Win=392832 Len=0 TSval=19572197 TSecr=1585599514
 62   0.013624 54.239.132.90 -> 172.31.8.238 TCP 5858 [TCP segment of a reassembled PDU]
 63   0.013630 172.31.8.238 -> 54.239.132.90 TCP 66 55985 > http [ACK] Seq=98 Ack=291049 Win=404480 Len=0 TSval=19572197 TSecr=1585599514
 64   0.013756 54.239.132.90 -> 172.31.8.238 TCP 10202 [TCP segment of a reassembled PDU]
 65   0.013763 172.31.8.238 -> 54.239.132.90 TCP 66 55985 > http [ACK] Seq=98 Ack=301185 Win=424704 Len=0 TSval=19572197 TSecr=1585599514
 66   0.014046 54.239.132.90 -> 172.31.8.238 TCP 26130 [TCP segment of a reassembled PDU]
 67   0.014059 172.31.8.238 -> 54.239.132.90 TCP 66 55985 > http [ACK] Seq=98 Ack=327249 Win=476800 Len=0 TSval=19572197 TSecr=1585599514
 68   0.014078 54.239.132.90 -> 172.31.8.238 TCP 7306 [TCP segment of a reassembled PDU]
 69   0.014083 172.31.8.238 -> 54.239.132.90 TCP 66 55985 > http [ACK] Seq=98 Ack=334489 Win=491392 Len=0 TSval=19572197 TSecr=1585599514
 70   0.014457 54.239.132.90 -> 172.31.8.238 TCP 11650 [TCP segment of a reassembled PDU]
 71   0.014465 172.31.8.238 -> 54.239.132.90 TCP 66 55985 > http [ACK] Seq=98 Ack=346073 Win=514560 Len=0 TSval=19572197 TSecr=1585599514
 72   0.014587 54.239.132.90 -> 172.31.8.238 TCP 10202 [TCP segment of a reassembled PDU]
 73   0.014594 172.31.8.238 -> 54.239.132.90 TCP 66 55985 > http [ACK] Seq=98 Ack=356209 Win=534784 Len=0 TSval=19572197 TSecr=1585599514
 74   0.014691 54.239.132.90 -> 172.31.8.238 TCP 1514 [TCP segment of a reassembled PDU]
 75   0.014695 172.31.8.238 -> 54.239.132.90 TCP 66 55985 > http [ACK] Seq=98 Ack=357657 Win=537728 Len=0 TSval=19572197 TSecr=1585599514
 76   0.014882 54.239.132.90 -> 172.31.8.238 TCP 26130 [TCP segment of a reassembled PDU]
 77   0.014896 172.31.8.238 -> 54.239.132.90 TCP 66 55985 > http [ACK] Seq=98 Ack=383721 Win=589824 Len=0 TSval=19572198 TSecr=1585599514
 78   0.014917 54.239.132.90 -> 172.31.8.238 TCP 8754 [TCP segment of a reassembled PDU]
 79   0.014923 172.31.8.238 -> 54.239.132.90 TCP 66 55985 > http [ACK] Seq=98 Ack=392409 Win=607232 Len=0 TSval=19572198 TSecr=1585599514
 80   0.015221 54.239.132.90 -> 172.31.8.238 TCP 23234 [TCP segment of a reassembled PDU]
 81   0.015233 172.31.8.238 -> 54.239.132.90 TCP 66 55985 > http [ACK] Seq=98 Ack=415577 Win=653568 Len=0 TSval=19572198 TSecr=1585599515
 82   0.015330 54.239.132.90 -> 172.31.8.238 TCP 1514 [TCP segment of a reassembled PDU]
 83   0.015334 172.31.8.238 -> 54.239.132.90 TCP 66 55985 > http [ACK] Seq=98 Ack=417025 Win=656384 Len=0 TSval=19572198 TSecr=1585599515
 84   0.015581 54.239.132.90 -> 172.31.8.238 TCP 26130 [TCP segment of a reassembled PDU]
 85   0.015608 172.31.8.238 -> 54.239.132.90 TCP 66 55985 > http [ACK] Seq=98 Ack=443089 Win=708480 Len=0 TSval=19572198 TSecr=1585599515
 86   0.015638 54.239.132.90 -> 172.31.8.238 TCP 14546 [TCP segment of a reassembled PDU]
 87   0.015647 172.31.8.238 -> 54.239.132.90 TCP 66 55985 > http [ACK] Seq=98 Ack=457569 Win=737536 Len=0 TSval=19572198 TSecr=1585599515
 88   0.015704 54.239.132.90 -> 172.31.8.238 TCP 8754 [TCP segment of a reassembled PDU]
 89   0.015712 172.31.8.238 -> 54.239.132.90 TCP 66 55985 > http [ACK] Seq=98 Ack=466257 Win=754816 Len=0 TSval=19572198 TSecr=1585599515
 90   0.015830 54.239.132.90 -> 172.31.8.238 TCP 15994 [TCP segment of a reassembled PDU]
 91   0.015851 172.31.8.238 -> 54.239.132.90 TCP 66 55985 > http [ACK] Seq=98 Ack=482185 Win=786688 Len=0 TSval=19572198 TSecr=1585599515
 92   0.016294 54.239.132.90 -> 172.31.8.238 TCP 7306 [TCP segment of a reassembled PDU]
 93   0.016302 172.31.8.238 -> 54.239.132.90 TCP 66 55985 > http [ACK] Seq=98 Ack=489425 Win=801152 Len=0 TSval=19572198 TSecr=1585599515
 94   0.016454 54.239.132.90 -> 172.31.8.238 TCP 26130 [TCP segment of a reassembled PDU]
 95   0.016467 172.31.8.238 -> 54.239.132.90 TCP 66 55985 > http [ACK] Seq=98 Ack=515489 Win=853376 Len=0 TSval=19572198 TSecr=1585599515
 96   0.016530 54.239.132.90 -> 172.31.8.238 TCP 26130 [TCP segment of a reassembled PDU]
 97   0.016545 172.31.8.238 -> 54.239.132.90 TCP 66 55985 > http [ACK] Seq=98 Ack=541553 Win=905472 Len=0 TSval=19572198 TSecr=1585599515
 98   0.016606 54.239.132.90 -> 172.31.8.238 TCP 14546 [TCP segment of a reassembled PDU]
 99   0.016615 172.31.8.238 -> 54.239.132.90 TCP 66 55985 > http [ACK] Seq=98 Ack=556033 Win=934400 Len=0 TSval=19572198 TSecr=1585599515
100   0.017059 54.239.132.90 -> 172.31.8.238 TCP 14546 [TCP segment of a reassembled PDU]
101   0.017069 172.31.8.238 -> 54.239.132.90 TCP 66 55985 > http [ACK] Seq=98 Ack=570513 Win=963328 Len=0 TSval=19572198 TSecr=1585599515
102   0.017174 54.239.132.90 -> 172.31.8.238 TCP 18865 [TCP segment of a reassembled PDU]
103   0.017182 172.31.8.238 -> 54.239.132.90 TCP 66 55985 > http [ACK] Seq=98 Ack=589312 Win=1000960 Len=0 TSval=19572198 TSecr=1585599515
104   0.018243 54.239.132.90 -> 172.31.8.238 TCP 7306 [TCP segment of a reassembled PDU]
105   0.018250 172.31.8.238 -> 54.239.132.90 TCP 66 55985 > http [ACK] Seq=98 Ack=596552 Win=1015424 Len=0 TSval=19572198 TSecr=1585599515
106   0.018413 54.239.132.90 -> 172.31.8.238 TCP 26130 [TCP segment of a reassembled PDU]
107   0.018426 172.31.8.238 -> 54.239.132.90 TCP 66 55985 > http [ACK] Seq=98 Ack=622616 Win=1067648 Len=0 TSval=19572198 TSecr=1585599515
108   0.018489 54.239.132.90 -> 172.31.8.238 TCP 26130 [TCP segment of a reassembled PDU]
109   0.018502 172.31.8.238 -> 54.239.132.90 TCP 66 55985 > http [ACK] Seq=98 Ack=648680 Win=1119744 Len=0 TSval=19572198 TSecr=1585599515
110   0.018541 54.239.132.90 -> 172.31.8.238 TCP 6234 [TCP segment of a reassembled PDU]
111   0.018636 172.31.8.238 -> 54.239.132.90 TCP 66 55985 > http [ACK] Seq=98 Ack=654848 Win=1118720 Len=0 TSval=19572198 TSecr=1585599515
112   0.019778 54.239.132.90 -> 172.31.8.238 TCP 2962 [TCP segment of a reassembled PDU]
113   0.019784 172.31.8.238 -> 54.239.132.90 TCP 66 55985 > http [ACK] Seq=98 Ack=657744 Win=1125504 Len=0 TSval=19572199 TSecr=1585599515
114   0.019965 54.239.132.90 -> 172.31.8.238 TCP 26130 [TCP segment of a reassembled PDU]
115   0.019979 172.31.8.238 -> 54.239.132.90 TCP 66 55985 > http [ACK] Seq=98 Ack=683808 Win=1173632 Len=0 TSval=19572199 TSecr=1585599515
116   0.020046 54.239.132.90 -> 172.31.8.238 TCP 26130 [TCP segment of a reassembled PDU]
117   0.020059 172.31.8.238 -> 54.239.132.90 TCP 66 55985 > http [ACK] Seq=98 Ack=709872 Win=1173632 Len=0 TSval=19572199 TSecr=1585599515
118   0.020120 54.239.132.90 -> 172.31.8.238 TCP 10578 [TCP segment of a reassembled PDU]
119   0.020129 172.31.8.238 -> 54.239.132.90 TCP 66 55985 > http [ACK] Seq=98 Ack=720384 Win=1197440 Len=0 TSval=19572199 TSecr=1585599515
120   0.021337 54.239.132.90 -> 172.31.8.238 TCP 2962 [TCP segment of a reassembled PDU]
121   0.021343 172.31.8.238 -> 54.239.132.90 TCP 66 55985 > http [ACK] Seq=98 Ack=723280 Win=1204480 Len=0 TSval=19572199 TSecr=1585599515
122   0.021465 54.239.132.90 -> 172.31.8.238 TCP 1514 [TCP Previous segment not captured] [TCP segment of a reassembled PDU]
123   0.021470 172.31.8.238 -> 54.239.132.90 TCP 78 [TCP Window Update] 55985 > http [ACK] Seq=98 Ack=723280 Win=1207296 Len=0 TSval=19572199 TSecr=1585599515 SLE=724728 SRE=726176
124   0.021555 54.239.132.90 -> 172.31.8.238 TCP 1514 [TCP Out-Of-Order] [TCP segment of a reassembled PDU]
125   0.021560 172.31.8.238 -> 54.239.132.90 TCP 66 55985 > http [ACK] Seq=98 Ack=726176 Win=1209216 Len=0 TSval=19572199 TSecr=1585599515
126   0.021620 54.239.132.90 -> 172.31.8.238 TCP 26130 [TCP segment of a reassembled PDU]
127   0.021633 172.31.8.238 -> 54.239.132.90 TCP 66 55985 > http [ACK] Seq=98 Ack=752240 Win=1183232 Len=0 TSval=19572199 TSecr=1585599515
128   0.021695 54.239.132.90 -> 172.31.8.238 TCP 18890 [TCP segment of a reassembled PDU]
129   0.021705 172.31.8.238 -> 54.239.132.90 TCP 66 55985 > http [ACK] Seq=98 Ack=771064 Win=1164416 Len=0 TSval=19572199 TSecr=1585599515
130   0.021758 54.239.132.90 -> 172.31.8.238 TCP 14922 [TCP segment of a reassembled PDU]
131   0.021767 172.31.8.238 -> 54.239.132.90 TCP 66 55985 > http [ACK] Seq=98 Ack=785920 Win=1149568 Len=0 TSval=19572199 TSecr=1585599515
132   0.022105 54.239.132.90 -> 172.31.8.238 TCP 2962 [TCP segment of a reassembled PDU]
133   0.022110 172.31.8.238 -> 54.239.132.90 TCP 66 55985 > http [ACK] Seq=98 Ack=788816 Win=1209216 Len=0 TSval=19572199 TSecr=1585599515
134   0.022228 54.239.132.90 -> 172.31.8.238 TCP 1514 [TCP segment of a reassembled PDU]
135   0.022232 172.31.8.238 -> 54.239.132.90 TCP 66 55985 > http [ACK] Seq=98 Ack=790264 Win=1209216 Len=0 TSval=19572199 TSecr=1585599515
136   0.022348 54.239.132.90 -> 172.31.8.238 TCP 1514 [TCP segment of a reassembled PDU]
137   0.022352 172.31.8.238 -> 54.239.132.90 TCP 66 55985 > http [ACK] Seq=98 Ack=791712 Win=1209216 Len=0 TSval=19572199 TSecr=1585599515
138   0.022513 54.239.132.90 -> 172.31.8.238 TCP 26130 [TCP segment of a reassembled PDU]
139   0.022526 172.31.8.238 -> 54.239.132.90 TCP 66 55985 > http [ACK] Seq=98 Ack=817776 Win=1183232 Len=0 TSval=19572199 TSecr=1585599515
140   0.022583 54.239.132.90 -> 172.31.8.238 TCP 26130 [TCP segment of a reassembled PDU]
141   0.022597 172.31.8.238 -> 54.239.132.90 TCP 66 55985 > http [ACK] Seq=98 Ack=843840 Win=1173632 Len=0 TSval=19572199 TSecr=1585599515
142   0.022640 54.239.132.90 -> 172.31.8.238 TCP 7682 [TCP segment of a reassembled PDU]
143   0.022647 172.31.8.238 -> 54.239.132.90 TCP 66 55985 > http [ACK] Seq=98 Ack=851456 Win=1202176 Len=0 TSval=19572199 TSecr=1585599515
144   0.023153 54.239.132.90 -> 172.31.8.238 TCP 5858 [TCP segment of a reassembled PDU]
145   0.023160 172.31.8.238 -> 54.239.132.90 TCP 66 55985 > http [ACK] Seq=98 Ack=857248 Win=1206912 Len=0 TSval=19572200 TSecr=1585599515
146   0.023328 54.239.132.90 -> 172.31.8.238 TCP 21786 [TCP segment of a reassembled PDU]
147   0.023341 172.31.8.238 -> 54.239.132.90 TCP 66 55985 > http [ACK] Seq=98 Ack=878968 Win=1185280 Len=0 TSval=19572200 TSecr=1585599515
148   0.023457 54.239.132.90 -> 172.31.8.238 TCP 30474 [TCP segment of a reassembled PDU]
149   0.023474 172.31.8.238 -> 54.239.132.90 TCP 66 55985 > http [ACK] Seq=98 Ack=909376 Win=1166336 Len=0 TSval=19572200 TSecr=1585599515
150   0.023483 54.239.132.90 -> 172.31.8.238 TCP 7682 [TCP segment of a reassembled PDU]
151   0.023487 172.31.8.238 -> 54.239.132.90 TCP 66 55985 > http [ACK] Seq=98 Ack=916992 Win=1158784 Len=0 TSval=19572200 TSecr=1585599515
152   0.024150 54.239.132.90 -> 172.31.8.238 TCP 7306 [TCP segment of a reassembled PDU]
153   0.024157 172.31.8.238 -> 54.239.132.90 TCP 66 55985 > http [ACK] Seq=98 Ack=924232 Win=1204480 Len=0 TSval=19572200 TSecr=1585599515
154   0.024321 54.239.132.90 -> 172.31.8.238 TCP 26130 [TCP segment of a reassembled PDU]
155   0.024334 172.31.8.238 -> 54.239.132.90 TCP 66 55985 > http [ACK] Seq=98 Ack=950296 Win=1178496 Len=0 TSval=19572200 TSecr=1585599515
156   0.024399 54.239.132.90 -> 172.31.8.238 TCP 26130 [TCP segment of a reassembled PDU]
157   0.024412 172.31.8.238 -> 54.239.132.90 TCP 66 55985 > http [ACK] Seq=98 Ack=976360 Win=1173632 Len=0 TSval=19572200 TSecr=1585599515
158   0.024447 54.239.132.90 -> 172.31.8.238 TCP 6234 [TCP segment of a reassembled PDU]
159   0.024453 172.31.8.238 -> 54.239.132.90 TCP 66 55985 > http [ACK] Seq=98 Ack=982528 Win=1204480 Len=0 TSval=19572200 TSecr=1585599515
160   0.026196 54.239.132.90 -> 172.31.8.238 TCP 1514 [TCP segment of a reassembled PDU]
161   0.026362 54.239.132.90 -> 172.31.8.238 TCP 26130 [TCP segment of a reassembled PDU]
162   0.026399 172.31.8.238 -> 54.239.132.90 TCP 66 55985 > http [ACK] Seq=98 Ack=1010040 Win=1177088 Len=0 TSval=19572200 TSecr=1585599516
163   0.026442 54.239.132.90 -> 172.31.8.238 TCP 26130 [TCP segment of a reassembled PDU]
164   0.026468 172.31.8.238 -> 54.239.132.90 TCP 66 55985 > http [ACK] Seq=98 Ack=1036104 Win=1173632 Len=0 TSval=19572200 TSecr=1585599516
165   0.026503 54.239.132.90 -> 172.31.8.238 TCP 12026 [TCP segment of a reassembled PDU]
166   0.026511 172.31.8.238 -> 54.239.132.90 TCP 66 55985 > http [ACK] Seq=98 Ack=1048064 Win=1195008 Len=0 TSval=19572200 TSecr=1585599516
167   0.027253 54.239.132.90 -> 172.31.8.238 TCP 2962 [TCP segment of a reassembled PDU]
168   0.027258 172.31.8.238 -> 54.239.132.90 TCP 66 55985 > http [ACK] Seq=98 Ack=1050960 Win=1209216 Len=0 TSval=19572201 TSecr=1585599516
169   0.027415 54.239.132.90 -> 172.31.8.238 TCP 26130 [TCP segment of a reassembled PDU]
170   0.027441 172.31.8.238 -> 54.239.132.90 TCP 66 55985 > http [ACK] Seq=98 Ack=1077024 Win=1183232 Len=0 TSval=19572201 TSecr=1585599516
171   0.027502 54.239.132.90 -> 172.31.8.238 TCP 20338 [TCP segment of a reassembled PDU]
172   0.027525 172.31.8.238 -> 54.239.132.90 TCP 66 55985 > http [ACK] Seq=98 Ack=1097296 Win=1183104 Len=0 TSval=19572201 TSecr=1585599516
173   0.027572 54.239.132.90 -> 172.31.8.238 TCP 16370 [TCP segment of a reassembled PDU]
174   0.027581 172.31.8.238 -> 54.239.132.90 TCP 66 55985 > http [ACK] Seq=98 Ack=1113600 Win=1187840 Len=0 TSval=19572201 TSecr=1585599516
175   0.027986 54.239.132.90 -> 172.31.8.238 TCP 2962 [TCP segment of a reassembled PDU]
176   0.027992 172.31.8.238 -> 54.239.132.90 TCP 66 55985 > http [ACK] Seq=98 Ack=1116496 Win=1209216 Len=0 TSval=19572201 TSecr=1585599516
177   0.028167 54.239.132.90 -> 172.31.8.238 TCP 26130 [TCP segment of a reassembled PDU]
178   0.028192 172.31.8.238 -> 54.239.132.90 TCP 66 55985 > http [ACK] Seq=98 Ack=1142560 Win=1183232 Len=0 TSval=19572201 TSecr=1585599516
179   0.028235 54.239.132.90 -> 172.31.8.238 TCP 26130 [TCP segment of a reassembled PDU]
180   0.028260 172.31.8.238 -> 54.239.132.90 TCP 66 55985 > http [ACK] Seq=98 Ack=1168624 Win=1173632 Len=0 TSval=19572201 TSecr=1585599516
181   0.028295 54.239.132.90 -> 172.31.8.238 TCP 10578 [TCP segment of a reassembled PDU]
182   0.028303 172.31.8.238 -> 54.239.132.90 TCP 66 55985 > http [ACK] Seq=98 Ack=1179136 Win=1197440 Len=0 TSval=19572201 TSecr=1585599516
183   0.029001 54.239.132.90 -> 172.31.8.238 TCP 1514 [TCP segment of a reassembled PDU]
184   0.029167 54.239.132.90 -> 172.31.8.238 TCP 23234 [TCP segment of a reassembled PDU]
185   0.029190 172.31.8.238 -> 54.239.132.90 TCP 66 55985 > http [ACK] Seq=98 Ack=1203752 Win=1178368 Len=0 TSval=19572201 TSecr=1585599516
186   0.029220 54.239.132.90 -> 172.31.8.238 TCP 2962 [TCP segment of a reassembled PDU]
187   0.029225 172.31.8.238 -> 54.239.132.90 TCP 66 55985 > http [ACK] Seq=98 Ack=1206648 Win=1209216 Len=0 TSval=19572201 TSecr=1585599516
188   0.029316 54.239.132.90 -> 172.31.8.238 TCP 31922 [TCP segment of a reassembled PDU]
189   0.029343 172.31.8.238 -> 54.239.132.90 TCP 66 55985 > http [ACK] Seq=98 Ack=1238504 Win=1177472 Len=0 TSval=19572201 TSecr=1585599516
190   0.029361 54.239.132.90 -> 172.31.8.238 TCP 1514 [TCP Previous segment not captured] [TCP segment of a reassembled PDU]
191   0.029363 54.239.132.90 -> 172.31.8.238 TCP 1514 [TCP Out-Of-Order] [TCP segment of a reassembled PDU]
192   0.029368 172.31.8.238 -> 54.239.132.90 TCP 78 [TCP Window Update] 55985 > http [ACK] Seq=98 Ack=1238504 Win=1209216 Len=0 TSval=19572201 TSecr=1585599516 SLE=1239952 SRE=1241400
193   0.029373 172.31.8.238 -> 54.239.132.90 TCP 66 55985 > http [ACK] Seq=98 Ack=1241400 Win=1209216 Len=0 TSval=19572201 TSecr=1585599516
194   0.029417 54.239.132.90 -> 172.31.8.238 TCP 3338 [TCP segment of a reassembled PDU]
195   0.029422 172.31.8.238 -> 54.239.132.90 TCP 66 55985 > http [ACK] Seq=98 Ack=1244672 Win=1209216 Len=0 TSval=19572201 TSecr=1585599516
196   0.029784 54.239.132.90 -> 172.31.8.238 TCP 2962 [TCP segment of a reassembled PDU]
197   0.029790 172.31.8.238 -> 54.239.132.90 TCP 66 55985 > http [ACK] Seq=98 Ack=1247568 Win=1209216 Len=0 TSval=19572201 TSecr=1585599516
198   0.029952 54.239.132.90 -> 172.31.8.238 TCP 17442 [TCP segment of a reassembled PDU]
199   0.029963 172.31.8.238 -> 54.239.132.90 TCP 66 55985 > http [ACK] Seq=98 Ack=1264944 Win=1191936 Len=0 TSval=19572201 TSecr=1585599516
200   0.029986 54.239.132.90 -> 172.31.8.238 TCP 8754 [TCP segment of a reassembled PDU]
201   0.029993 172.31.8.238 -> 54.239.132.90 TCP 66 55985 > http [ACK] Seq=98 Ack=1273632 Win=1183360 Len=0 TSval=19572201 TSecr=1585599516
202   0.030076 54.239.132.90 -> 172.31.8.238 TCP 26130 [TCP segment of a reassembled PDU]
203   0.030088 172.31.8.238 -> 54.239.132.90 TCP 66 55985 > http [ACK] Seq=98 Ack=1299696 Win=1173632 Len=0 TSval=19572201 TSecr=1585599516
204   0.030119 54.239.132.90 -> 172.31.8.238 TCP 10578 [TCP segment of a reassembled PDU]
205   0.030129 172.31.8.238 -> 54.239.132.90 TCP 66 55985 > http [ACK] Seq=98 Ack=1310208 Win=1197440 Len=0 TSval=19572201 TSecr=1585599516
206   0.030835 54.239.132.90 -> 172.31.8.238 TCP 1514 [TCP segment of a reassembled PDU]
207   0.030839 172.31.8.238 -> 54.239.132.90 TCP 66 55985 > http [ACK] Seq=98 Ack=1311656 Win=1209216 Len=0 TSval=19572202 TSecr=1585599516
208   0.031003 54.239.132.90 -> 172.31.8.238 TCP 26130 [TCP segment of a reassembled PDU]
209   0.031017 172.31.8.238 -> 54.239.132.90 TCP 66 55985 > http [ACK] Seq=98 Ack=1337720 Win=1183232 Len=0 TSval=19572202 TSecr=1585599516
210   0.031071 54.239.132.90 -> 172.31.8.238 TCP 26130 [TCP segment of a reassembled PDU]
211   0.031083 172.31.8.238 -> 54.239.132.90 TCP 66 55985 > http [ACK] Seq=98 Ack=1363784 Win=1173632 Len=0 TSval=19572202 TSecr=1585599516
212   0.031128 54.239.132.90 -> 172.31.8.238 TCP 12026 [TCP segment of a reassembled PDU]
213   0.031136 172.31.8.238 -> 54.239.132.90 TCP 66 55985 > http [ACK] Seq=98 Ack=1375744 Win=1161728 Len=0 TSval=19572202 TSecr=1585599516
214   0.031668 54.239.132.90 -> 172.31.8.238 TCP 4410 [TCP segment of a reassembled PDU]
215   0.031674 172.31.8.238 -> 54.239.132.90 TCP 66 55985 > http [ACK] Seq=98 Ack=1380088 Win=1209216 Len=0 TSval=19572202 TSecr=1585599516
216   0.031843 54.239.132.90 -> 172.31.8.238 TCP 26130 [TCP segment of a reassembled PDU]
217   0.031856 172.31.8.238 -> 54.239.132.90 TCP 66 55985 > http [ACK] Seq=98 Ack=1406152 Win=1183232 Len=0 TSval=19572202 TSecr=1585599516
218   0.031904 54.239.132.90 -> 172.31.8.238 TCP 18890 [TCP segment of a reassembled PDU]
219   0.031915 172.31.8.238 -> 54.239.132.90 TCP 66 55985 > http [ACK] Seq=98 Ack=1424976 Win=1185408 Len=0 TSval=19572202 TSecr=1585599516
220   0.031975 54.239.132.90 -> 172.31.8.238 TCP 16370 [TCP segment of a reassembled PDU]
221   0.031983 172.31.8.238 -> 54.239.132.90 TCP 66 55985 > http [ACK] Seq=98 Ack=1441280 Win=1187840 Len=0 TSval=19572202 TSecr=1585599516
222   0.032638 54.239.132.90 -> 172.31.8.238 TCP 7306 [TCP segment of a reassembled PDU]
223   0.032645 172.31.8.238 -> 54.239.132.90 TCP 66 55985 > http [ACK] Seq=98 Ack=1448520 Win=1204480 Len=0 TSval=19572202 TSecr=1585599516
224   0.032812 54.239.132.90 -> 172.31.8.238 TCP 26130 [TCP segment of a reassembled PDU]
225   0.032837 172.31.8.238 -> 54.239.132.90 TCP 66 55985 > http [ACK] Seq=98 Ack=1474584 Win=1178496 Len=0 TSval=19572202 TSecr=1585599516
226   0.032895 54.239.132.90 -> 172.31.8.238 TCP 26130 [TCP segment of a reassembled PDU]
227   0.032921 172.31.8.238 -> 54.239.132.90 TCP 66 55985 > http [ACK] Seq=98 Ack=1500648 Win=1173632 Len=0 TSval=19572202 TSecr=1585599516
228   0.032949 54.239.132.90 -> 172.31.8.238 TCP 6234 [TCP segment of a reassembled PDU]
229   0.032956 172.31.8.238 -> 54.239.132.90 TCP 66 55985 > http [ACK] Seq=98 Ack=1506816 Win=1204480 Len=0 TSval=19572202 TSecr=1585599516
230   0.033942 54.239.132.90 -> 172.31.8.238 TCP 13098 [TCP segment of a reassembled PDU]
231   0.033963 172.31.8.238 -> 54.239.132.90 TCP 66 55985 > http [ACK] Seq=98 Ack=1519848 Win=1209216 Len=0 TSval=19572202 TSecr=1585599516
232   0.034089 54.239.132.90 -> 172.31.8.238 TCP 26130 [TCP segment of a reassembled PDU]
233   0.034126 172.31.8.238 -> 54.239.132.90 TCP 66 55985 > http [ACK] Seq=98 Ack=1545912 Win=1183232 Len=0 TSval=19572202 TSecr=1585599516
234   0.034176 54.239.132.90 -> 172.31.8.238 TCP 26130 [TCP segment of a reassembled PDU]
235   0.034214 172.31.8.238 -> 54.239.132.90 TCP 66 55985 > http [ACK] Seq=98 Ack=1571976 Win=1173632 Len=0 TSval=19572202 TSecr=1585599516
236   0.034231 54.239.132.90 -> 172.31.8.238 TCP 442 [TCP segment of a reassembled PDU]
237   0.034240 172.31.8.238 -> 54.239.132.90 TCP 66 55985 > http [ACK] Seq=98 Ack=1572352 Win=1209216 Len=0 TSval=19572202 TSecr=1585599516
238   0.034689 54.239.132.90 -> 172.31.8.238 TCP 7306 [TCP segment of a reassembled PDU]
239   0.034707 172.31.8.238 -> 54.239.132.90 TCP 66 55985 > http [ACK] Seq=98 Ack=1579592 Win=1209216 Len=0 TSval=19572202 TSecr=1585599516
240   0.034858 54.239.132.90 -> 172.31.8.238 TCP 26130 [TCP segment of a reassembled PDU]
241   0.034883 172.31.8.238 -> 54.239.132.90 TCP 66 55985 > http [ACK] Seq=98 Ack=1605656 Win=1183232 Len=0 TSval=19572203 TSecr=1585599516
242   0.034930 54.239.132.90 -> 172.31.8.238 TCP 26130 [TCP segment of a reassembled PDU]
243   0.034950 172.31.8.238 -> 54.239.132.90 TCP 66 55985 > http [ACK] Seq=98 Ack=1631720 Win=1173632 Len=0 TSval=19572203 TSecr=1585599516
244   0.034980 54.239.132.90 -> 172.31.8.238 TCP 6234 [TCP segment of a reassembled PDU]
245   0.034986 172.31.8.238 -> 54.239.132.90 TCP 66 55985 > http [ACK] Seq=98 Ack=1637888 Win=1204480 Len=0 TSval=19572203 TSecr=1585599516
246   0.035476 54.239.132.90 -> 172.31.8.238 TCP 5858 [TCP segment of a reassembled PDU]
247   0.035482 172.31.8.238 -> 54.239.132.90 TCP 66 55985 > http [ACK] Seq=98 Ack=1643680 Win=1206912 Len=0 TSval=19572203 TSecr=1585599517
248   0.035645 54.239.132.90 -> 172.31.8.238 TCP 26130 [TCP segment of a reassembled PDU]
249   0.035665 172.31.8.238 -> 54.239.132.90 TCP 66 55985 > http [ACK] Seq=98 Ack=1669744 Win=1180928 Len=0 TSval=19572203 TSecr=1585599517
250   0.035678 54.239.132.90 -> 172.31.8.238 TCP 8754 [TCP segment of a reassembled PDU]
251   0.035696 172.31.8.238 -> 54.239.132.90 TCP 66 55985 > http [ACK] Seq=98 Ack=1678432 Win=1202176 Len=0 TSval=19572203 TSecr=1585599517
252   0.035771 54.239.132.90 -> 172.31.8.238 TCP 25058 [TCP segment of a reassembled PDU]
253   0.035881 172.31.8.238 -> 54.239.132.90 TCP 66 55985 > http [ACK] Seq=98 Ack=1703424 Win=1177216 Len=0 TSval=19572203 TSecr=1585599517
254   0.036515 54.239.132.90 -> 172.31.8.238 TCP 7306 [TCP segment of a reassembled PDU]
255   0.036521 172.31.8.238 -> 54.239.132.90 TCP 66 55985 > http [ACK] Seq=98 Ack=1710664 Win=1204480 Len=0 TSval=19572203 TSecr=1585599517
256   0.036677 54.239.132.90 -> 172.31.8.238 TCP 26130 [TCP segment of a reassembled PDU]
257   0.036697 172.31.8.238 -> 54.239.132.90 TCP 66 55985 > http [ACK] Seq=98 Ack=1736728 Win=1178496 Len=0 TSval=19572203 TSecr=1585599517
258   0.036747 54.239.132.90 -> 172.31.8.238 TCP 26130 [TCP segment of a reassembled PDU]
259   0.036767 172.31.8.238 -> 54.239.132.90 TCP 66 55985 > http [ACK] Seq=98 Ack=1762792 Win=1173632 Len=0 TSval=19572203 TSecr=1585599517
260   0.036800 54.239.132.90 -> 172.31.8.238 TCP 6234 [TCP segment of a reassembled PDU]
261   0.036806 172.31.8.238 -> 54.239.132.90 TCP 66 55985 > http [ACK] Seq=98 Ack=1768960 Win=1204480 Len=0 TSval=19572203 TSecr=1585599517
262   0.037300 54.239.132.90 -> 172.31.8.238 TCP 2962 [TCP segment of a reassembled PDU]
263   0.037304 172.31.8.238 -> 54.239.132.90 TCP 66 55985 > http [ACK] Seq=98 Ack=1771856 Win=1209216 Len=0 TSval=19572203 TSecr=1585599517
264   0.037482 54.239.132.90 -> 172.31.8.238 TCP 26130 [TCP segment of a reassembled PDU]
265   0.037503 172.31.8.238 -> 54.239.132.90 TCP 66 55985 > http [ACK] Seq=98 Ack=1797920 Win=1183232 Len=0 TSval=19572203 TSecr=1585599517
266   0.037620 54.239.132.90 -> 172.31.8.238 TCP 36642 [TCP segment of a reassembled PDU]
267   0.037645 172.31.8.238 -> 54.239.132.90 TCP 66 55985 > http [ACK] Seq=98 Ack=1834496 Win=1154560 Len=0 TSval=19572203 TSecr=1585599517
268   0.038302 54.239.132.90 -> 172.31.8.238 TCP 8754 [TCP segment of a reassembled PDU]
269   0.038310 172.31.8.238 -> 54.239.132.90 TCP 66 55985 > http [ACK] Seq=98 Ack=1843184 Win=1202176 Len=0 TSval=19572203 TSecr=1585599517
270   0.038472 54.239.132.90 -> 172.31.8.238 TCP 26130 [TCP segment of a reassembled PDU]
271   0.038492 172.31.8.238 -> 54.239.132.90 TCP 66 55985 > http [ACK] Seq=98 Ack=1869248 Win=1176192 Len=0 TSval=19572203 TSecr=1585599517
272   0.038544 54.239.132.90 -> 172.31.8.238 TCP 26130 [TCP segment of a reassembled PDU]
273   0.038564 172.31.8.238 -> 54.239.132.90 TCP 66 55985 > http [ACK] Seq=98 Ack=1895312 Win=1173632 Len=0 TSval=19572203 TSecr=1585599517
274   0.038594 54.239.132.90 -> 172.31.8.238 TCP 4786 [TCP segment of a reassembled PDU]
275   0.038600 172.31.8.238 -> 54.239.132.90 TCP 66 55985 > http [ACK] Seq=98 Ack=1900032 Win=1206912 Len=0 TSval=19572203 TSecr=1585599517
276   0.039318 54.239.132.90 -> 172.31.8.238 TCP 2962 [TCP segment of a reassembled PDU]
277   0.039323 172.31.8.238 -> 54.239.132.90 TCP 66 55985 > http [ACK] Seq=98 Ack=1902928 Win=1209216 Len=0 TSval=19572204 TSecr=1585599517
278   0.039493 54.239.132.90 -> 172.31.8.238 TCP 26130 [TCP segment of a reassembled PDU]
279   0.039512 172.31.8.238 -> 54.239.132.90 TCP 66 55985 > http [ACK] Seq=98 Ack=1928992 Win=1183232 Len=0 TSval=19572204 TSecr=1585599517
280   0.039578 54.239.132.90 -> 172.31.8.238 TCP 26130 [TCP segment of a reassembled PDU]
281   0.039634 54.239.132.90 -> 172.31.8.238 TCP 10578 [TCP segment of a reassembled PDU]
282   0.039734 172.31.8.238 -> 54.239.132.90 TCP 66 55985 > http [ACK] Seq=98 Ack=1965568 Win=1154560 Len=0 TSval=19572204 TSecr=1585599517
283   0.040343 54.239.132.90 -> 172.31.8.238 TCP 5858 [TCP segment of a reassembled PDU]
284   0.040349 172.31.8.238 -> 54.239.132.90 TCP 66 55985 > http [ACK] Seq=98 Ack=1971360 Win=1206912 Len=0 TSval=19572204 TSecr=1585599517
285   0.040517 54.239.132.90 -> 172.31.8.238 TCP 26130 [TCP segment of a reassembled PDU]
286   0.040548 172.31.8.238 -> 54.239.132.90 TCP 66 55985 > http [ACK] Seq=98 Ack=1997424 Win=1180928 Len=0 TSval=19572204 TSecr=1585599517
287   0.040593 54.239.132.90 -> 172.31.8.238 TCP 18890 [TCP segment of a reassembled PDU]
288   0.040599 172.31.8.238 -> 54.239.132.90 TCP 66 55985 > http [ACK] Seq=98 Ack=2016248 Win=1185408 Len=0 TSval=19572204 TSecr=1585599517
289   0.040656 54.239.132.90 -> 172.31.8.238 TCP 14922 [TCP segment of a reassembled PDU]
290   0.040665 172.31.8.238 -> 54.239.132.90 TCP 66 55985 > http [ACK] Seq=98 Ack=2031104 Win=1190144 Len=0 TSval=19572204 TSecr=1585599517
291   0.041360 54.239.132.90 -> 172.31.8.238 TCP 5858 [TCP segment of a reassembled PDU]
292   0.041365 172.31.8.238 -> 54.239.132.90 TCP 66 55985 > http [ACK] Seq=98 Ack=2036896 Win=1206912 Len=0 TSval=19572204 TSecr=1585599517
293   0.041556 54.239.132.90 -> 172.31.8.238 TCP 26130 [TCP segment of a reassembled PDU]
294   0.041584 172.31.8.238 -> 54.239.132.90 TCP 66 55985 > http [ACK] Seq=98 Ack=2062960 Win=1180928 Len=0 TSval=19572204 TSecr=1585599517
295   0.041628 54.239.132.90 -> 172.31.8.238 TCP 26130 [TCP segment of a reassembled PDU]
296   0.041646 172.31.8.238 -> 54.239.132.90 TCP 66 55985 > http [ACK] Seq=98 Ack=2089024 Win=1173632 Len=0 TSval=19572204 TSecr=1585599517
297   0.041680 54.239.132.90 -> 172.31.8.238 TCP 7682 [TCP segment of a reassembled PDU]
298   0.041685 172.31.8.238 -> 54.239.132.90 TCP 66 55985 > http [ACK] Seq=98 Ack=2096640 Win=1202176 Len=0 TSval=19572204 TSecr=1585599517
299   0.042393 54.239.132.90 -> 172.31.8.238 TCP 7306 [TCP segment of a reassembled PDU]
300   0.042398 172.31.8.238 -> 54.239.132.90 TCP 66 55985 > http [ACK] Seq=98 Ack=2103880 Win=1204480 Len=0 TSval=19572204 TSecr=1585599517
301   0.042560 54.239.132.90 -> 172.31.8.238 TCP 20338 [TCP segment of a reassembled PDU]
302   0.042577 172.31.8.238 -> 54.239.132.90 TCP 66 55985 > http [ACK] Seq=98 Ack=2124152 Win=1184256 Len=0 TSval=19572204 TSecr=1585599517
303   0.042693 54.239.132.90 -> 172.31.8.238 TCP 38090 [TCP segment of a reassembled PDU]
304   0.042718 172.31.8.238 -> 54.239.132.90 TCP 66 55985 > http [ACK] Seq=98 Ack=2162176 Win=1152128 Len=0 TSval=19572204 TSecr=1585599517
305   0.043408 54.239.132.90 -> 172.31.8.238 TCP 5858 [TCP segment of a reassembled PDU]
306   0.043413 172.31.8.238 -> 54.239.132.90 TCP 66 55985 > http [ACK] Seq=98 Ack=2167968 Win=1206912 Len=0 TSval=19572205 TSecr=1585599517
307   0.043573 54.239.132.90 -> 172.31.8.238 TCP 17442 [TCP segment of a reassembled PDU]
308   0.043591 172.31.8.238 -> 54.239.132.90 TCP 66 55985 > http [ACK] Seq=98 Ack=2185344 Win=1189632 Len=0 TSval=19572205 TSecr=1585599517
309   0.043629 54.239.132.90 -> 172.31.8.238 TCP 8754 [TCP segment of a reassembled PDU]
310   0.043634 172.31.8.238 -> 54.239.132.90 TCP 66 55985 > http [ACK] Seq=98 Ack=2194032 Win=1202176 Len=0 TSval=19572205 TSecr=1585599517
311   0.043695 54.239.132.90 -> 172.31.8.238 TCP 5858 [TCP segment of a reassembled PDU]
312   0.043699 172.31.8.238 -> 54.239.132.90 TCP 66 55985 > http [ACK] Seq=98 Ack=2199824 Win=1206912 Len=0 TSval=19572205 TSecr=1585599517
313   0.043704 54.239.132.90 -> 172.31.8.238 TCP 1514 [TCP Previous segment not captured] [TCP segment of a reassembled PDU]
314   0.043706 172.31.8.238 -> 54.239.132.90 TCP 78 [TCP Dup ACK 312#1] 55985 > http [ACK] Seq=98 Ack=2199824 Win=1206912 Len=0 TSval=19572205 TSecr=1585599517 SLE=2201272 SRE=2202720
315   0.043708 54.239.132.90 -> 172.31.8.238 TCP 1514 [TCP Out-Of-Order] [TCP segment of a reassembled PDU]
316   0.043711 172.31.8.238 -> 54.239.132.90 TCP 66 55985 > http [ACK] Seq=98 Ack=2202720 Win=1204096 Len=0 TSval=19572205 TSecr=1585599517
317   0.043975 54.239.132.90 -> 172.31.8.238 TCP 25058 [TCP segment of a reassembled PDU]
318   0.043982 172.31.8.238 -> 54.239.132.90 TCP 66 55985 > http [ACK] Seq=98 Ack=2227712 Win=1179136 Len=0 TSval=19572205 TSecr=1585599517
319   0.044228 54.239.132.90 -> 172.31.8.238 TCP 7306 [TCP segment of a reassembled PDU]
320   0.044233 172.31.8.238 -> 54.239.132.90 TCP 66 55985 > http [ACK] Seq=98 Ack=2234952 Win=1204480 Len=0 TSval=19572205 TSecr=1585599517
321   0.044398 54.239.132.90 -> 172.31.8.238 TCP 26130 [TCP segment of a reassembled PDU]
322   0.044406 172.31.8.238 -> 54.239.132.90 TCP 66 55985 > http [ACK] Seq=98 Ack=2261016 Win=1178496 Len=0 TSval=19572205 TSecr=1585599517
323   0.044446 54.239.132.90 -> 172.31.8.238 TCP 14546 [TCP segment of a reassembled PDU]
324   0.044451 172.31.8.238 -> 54.239.132.90 TCP 66 55985 > http [ACK] Seq=98 Ack=2275496 Win=1192576 Len=0 TSval=19572205 TSecr=1585599517
325   0.044522 54.239.132.90 -> 172.31.8.238 TCP 17818 [TCP segment of a reassembled PDU]
326   0.044528 172.31.8.238 -> 54.239.132.90 TCP 66 55985 > http [ACK] Seq=98 Ack=2293248 Win=1174912 Len=0 TSval=19572205 TSecr=1585599517
327   0.044991 54.239.132.90 -> 172.31.8.238 TCP 2962 [TCP segment of a reassembled PDU]
328   0.044996 172.31.8.238 -> 54.239.132.90 TCP 66 55985 > http [ACK] Seq=98 Ack=2296144 Win=1209216 Len=0 TSval=19572205 TSecr=1585599518
329   0.045166 54.239.132.90 -> 172.31.8.238 TCP 26130 [TCP segment of a reassembled PDU]
330   0.045173 172.31.8.238 -> 54.239.132.90 TCP 66 55985 > http [ACK] Seq=98 Ack=2322208 Win=1183232 Len=0 TSval=19572205 TSecr=1585599518
331   0.045236 54.239.132.90 -> 172.31.8.238 TCP 26130 [TCP segment of a reassembled PDU]
332   0.045244 172.31.8.238 -> 54.239.132.90 TCP 66 55985 > http [ACK] Seq=98 Ack=2348272 Win=1173632 Len=0 TSval=19572205 TSecr=1585599518
333   0.045313 54.239.132.90 -> 172.31.8.238 TCP 10578 [TCP segment of a reassembled PDU]
334   0.045318 172.31.8.238 -> 54.239.132.90 TCP 66 55985 > http [ACK] Seq=98 Ack=2358784 Win=1197440 Len=0 TSval=19572205 TSecr=1585599518
335   0.046042 54.239.132.90 -> 172.31.8.238 TCP 2962 [TCP segment of a reassembled PDU]
336   0.046047 172.31.8.238 -> 54.239.132.90 TCP 66 55985 > http [ACK] Seq=98 Ack=2361680 Win=1209216 Len=0 TSval=19572205 TSecr=1585599518
337   0.046211 54.239.132.90 -> 172.31.8.238 TCP 26130 [TCP segment of a reassembled PDU]
338   0.046218 172.31.8.238 -> 54.239.132.90 TCP 66 55985 > http [ACK] Seq=98 Ack=2387744 Win=1183232 Len=0 TSval=19572205 TSecr=1585599518
339   0.046288 54.239.132.90 -> 172.31.8.238 TCP 21786 [TCP segment of a reassembled PDU]
340   0.046294 172.31.8.238 -> 54.239.132.90 TCP 66 55985 > http [ACK] Seq=98 Ack=2409464 Win=1180672 Len=0 TSval=19572205 TSecr=1585599518
341   0.046372 54.239.132.90 -> 172.31.8.238 TCP 14922 [TCP segment of a reassembled PDU]
342   0.046379 172.31.8.238 -> 54.239.132.90 TCP 66 55985 > http [ACK] Seq=98 Ack=2424320 Win=1165824 Len=0 TSval=19572205 TSecr=1585599518
343   0.046802 54.239.132.90 -> 172.31.8.238 TCP 4410 [TCP segment of a reassembled PDU]
344   0.046807 172.31.8.238 -> 54.239.132.90 TCP 66 55985 > http [ACK] Seq=98 Ack=2428664 Win=1209216 Len=0 TSval=19572205 TSecr=1585599518
345   0.046988 54.239.132.90 -> 172.31.8.238 TCP 26130 [TCP segment of a reassembled PDU]
346   0.047007 172.31.8.238 -> 54.239.132.90 TCP 66 55985 > http [ACK] Seq=98 Ack=2454728 Win=1183232 Len=0 TSval=19572206 TSecr=1585599518
