[Measurement for 1mb at 23:41:21 19.41.2014] 
Tshark:

  1   0.000000 172.31.8.238 -> 172.31.0.2   DNS 89 Standard query 0x44f2  A d1xvcg6dfvgaki.cloudfront.net
  2   0.000036 172.31.8.238 -> 172.31.0.2   DNS 89 Standard query 0xe7eb  AAAA d1xvcg6dfvgaki.cloudfront.net
  3   0.000588   172.31.0.2 -> 172.31.8.238 DNS 217 Standard query response 0x44f2  A 54.239.132.41 A 54.230.116.72 A 54.230.116.164 A 54.230.117.37 A 54.230.117.69 A 54.230.117.157 A 54.230.119.40 A 54.230.119.91
  4   0.000601   172.31.0.2 -> 172.31.8.238 DNS 170 Standard query response 0xe7eb 
  5   0.003905 172.31.8.238 -> 54.239.132.41 TCP 74 54333 > http [SYN] Seq=0 Win=26883 Len=0 MSS=8961 SACK_PERM=1 TSval=6027197 TSecr=0 WS=128
  6   0.004552 54.239.132.41 -> 172.31.8.238 TCP 74 http > 54333 [SYN, ACK] Seq=0 Ack=1 Win=14480 Len=0 MSS=1460 SACK_PERM=1 TSval=1682902655 TSecr=6027197 WS=128
  7   0.004567 172.31.8.238 -> 54.239.132.41 TCP 66 54333 > http [ACK] Seq=1 Ack=1 Win=27008 Len=0 TSval=6027197 TSecr=1682902655
  8   0.004607 172.31.8.238 -> 54.239.132.41 HTTP 162 GET /1mb HTTP/1.1 
  9   0.005038 54.239.132.41 -> 172.31.8.238 TCP 66 http > 54333 [ACK] Seq=1 Ack=97 Win=14592 Len=0 TSval=1682902655 TSecr=6027197
 10   0.007089 54.239.132.41 -> 172.31.8.238 TCP 4028 [TCP segment of a reassembled PDU]
 11   0.007097 172.31.8.238 -> 54.239.132.41 TCP 66 54333 > http [ACK] Seq=97 Ack=3963 Win=34816 Len=0 TSval=6027198 TSecr=1682902656
 12   0.007209 54.239.132.41 -> 172.31.8.238 TCP 10202 [TCP segment of a reassembled PDU]
 13   0.007218 172.31.8.238 -> 54.239.132.41 TCP 66 54333 > http [ACK] Seq=97 Ack=14099 Win=55168 Len=0 TSval=6027198 TSecr=1682902656
 14   0.007632 54.239.132.41 -> 172.31.8.238 TCP 5858 [TCP segment of a reassembled PDU]
 15   0.007639 172.31.8.238 -> 54.239.132.41 TCP 66 54333 > http [ACK] Seq=97 Ack=19891 Win=66688 Len=0 TSval=6027198 TSecr=1682902656
 16   0.007885 54.239.132.41 -> 172.31.8.238 TCP 7306 [TCP segment of a reassembled PDU]
 17   0.007892 172.31.8.238 -> 54.239.132.41 TCP 66 54333 > http [ACK] Seq=97 Ack=27131 Win=81152 Len=0 TSval=6027198 TSecr=1682902656
 18   0.008179 54.239.132.41 -> 172.31.8.238 TCP 4410 [TCP segment of a reassembled PDU]
 19   0.008186 172.31.8.238 -> 54.239.132.41 TCP 66 54333 > http [ACK] Seq=97 Ack=31475 Win=89856 Len=0 TSval=6027198 TSecr=1682902656
 20   0.008271 54.239.132.41 -> 172.31.8.238 TCP 7306 [TCP segment of a reassembled PDU]
 21   0.008277 172.31.8.238 -> 54.239.132.41 TCP 66 54333 > http [ACK] Seq=97 Ack=38715 Win=104320 Len=0 TSval=6027198 TSecr=1682902656
 22   0.008369 54.239.132.41 -> 172.31.8.238 TCP 1514 [TCP segment of a reassembled PDU]
 23   0.008373 172.31.8.238 -> 54.239.132.41 TCP 66 54333 > http [ACK] Seq=97 Ack=40163 Win=107264 Len=0 TSval=6027198 TSecr=1682902656
 24   0.008456 54.239.132.41 -> 172.31.8.238 TCP 7306 [TCP segment of a reassembled PDU]
 25   0.008462 172.31.8.238 -> 54.239.132.41 TCP 66 54333 > http [ACK] Seq=97 Ack=47403 Win=105984 Len=0 TSval=6027198 TSecr=1682902656
 26   0.008618 54.239.132.41 -> 172.31.8.238 TCP 5858 [TCP segment of a reassembled PDU]
 27   0.008624 172.31.8.238 -> 54.239.132.41 TCP 66 54333 > http [ACK] Seq=97 Ack=53195 Win=108416 Len=0 TSval=6027198 TSecr=1682902656
 28   0.008897 54.239.132.41 -> 172.31.8.238 TCP 8754 [TCP segment of a reassembled PDU]
 29   0.008904 172.31.8.238 -> 54.239.132.41 TCP 66 54333 > http [ACK] Seq=97 Ack=61883 Win=103680 Len=0 TSval=6027198 TSecr=1682902656
 30   0.009154 54.239.132.41 -> 172.31.8.238 TCP 13098 [TCP segment of a reassembled PDU]
 31   0.009163 172.31.8.238 -> 54.239.132.41 TCP 66 54333 > http [ACK] Seq=97 Ack=74915 Win=96512 Len=0 TSval=6027199 TSecr=1682902656
 32   0.009193 54.239.132.41 -> 172.31.8.238 TCP 5858 [TCP segment of a reassembled PDU]
 33   0.009199 172.31.8.238 -> 54.239.132.41 TCP 66 54333 > http [ACK] Seq=97 Ack=80707 Win=120704 Len=0 TSval=6027199 TSecr=1682902656
 34   0.009392 54.239.132.41 -> 172.31.8.238 TCP 7306 [TCP segment of a reassembled PDU]
 35   0.009398 172.31.8.238 -> 54.239.132.41 TCP 66 54333 > http [ACK] Seq=97 Ack=87947 Win=135168 Len=0 TSval=6027199 TSecr=1682902656
 36   0.009888 54.239.132.41 -> 172.31.8.238 TCP 5858 [TCP segment of a reassembled PDU]
 37   0.009894 172.31.8.238 -> 54.239.132.41 TCP 66 54333 > http [ACK] Seq=97 Ack=93739 Win=146688 Len=0 TSval=6027199 TSecr=1682902656
 38   0.010036 54.239.132.41 -> 172.31.8.238 TCP 26130 [TCP segment of a reassembled PDU]
 39   0.010050 172.31.8.238 -> 54.239.132.41 TCP 66 54333 > http [ACK] Seq=97 Ack=119803 Win=198784 Len=0 TSval=6027199 TSecr=1682902656
 40   0.010056 54.239.132.41 -> 172.31.8.238 TCP 1514 [TCP segment of a reassembled PDU]
 41   0.010059 172.31.8.238 -> 54.239.132.41 TCP 66 54333 > http [ACK] Seq=97 Ack=121251 Win=201728 Len=0 TSval=6027199 TSecr=1682902656
 42   0.010750 54.239.132.41 -> 172.31.8.238 TCP 7306 [TCP segment of a reassembled PDU]
 43   0.010758 172.31.8.238 -> 54.239.132.41 TCP 66 54333 > http [ACK] Seq=97 Ack=128491 Win=216192 Len=0 TSval=6027199 TSecr=1682902656
 44   0.010867 54.239.132.41 -> 172.31.8.238 TCP 26130 [TCP segment of a reassembled PDU]
 45   0.010880 172.31.8.238 -> 54.239.132.41 TCP 66 54333 > http [ACK] Seq=97 Ack=154555 Win=268288 Len=0 TSval=6027199 TSecr=1682902656
 46   0.010886 54.239.132.41 -> 172.31.8.238 TCP 1514 [TCP segment of a reassembled PDU]
 47   0.010888 172.31.8.238 -> 54.239.132.41 TCP 66 54333 > http [ACK] Seq=97 Ack=156003 Win=271232 Len=0 TSval=6027199 TSecr=1682902656
 48   0.011464 54.239.132.41 -> 172.31.8.238 TCP 2962 [TCP segment of a reassembled PDU]
 49   0.011469 172.31.8.238 -> 54.239.132.41 TCP 66 54333 > http [ACK] Seq=97 Ack=158899 Win=276992 Len=0 TSval=6027199 TSecr=1682902656
 50   0.011597 54.239.132.41 -> 172.31.8.238 TCP 24682 [TCP segment of a reassembled PDU]
 51   0.011610 172.31.8.238 -> 54.239.132.41 TCP 66 54333 > http [ACK] Seq=97 Ack=183515 Win=326272 Len=0 TSval=6027199 TSecr=1682902656
 52   0.011644 54.239.132.41 -> 172.31.8.238 TCP 11650 [TCP segment of a reassembled PDU]
 53   0.011651 172.31.8.238 -> 54.239.132.41 TCP 66 54333 > http [ACK] Seq=97 Ack=195099 Win=349440 Len=0 TSval=6027199 TSecr=1682902656
 54   0.012216 54.239.132.41 -> 172.31.8.238 TCP 7306 [TCP segment of a reassembled PDU]
 55   0.012223 172.31.8.238 -> 54.239.132.41 TCP 66 54333 > http [ACK] Seq=97 Ack=202339 Win=363904 Len=0 TSval=6027199 TSecr=1682902656
 56   0.012381 54.239.132.41 -> 172.31.8.238 TCP 26130 [TCP segment of a reassembled PDU]
 57   0.012394 172.31.8.238 -> 54.239.132.41 TCP 66 54333 > http [ACK] Seq=97 Ack=228403 Win=416000 Len=0 TSval=6027199 TSecr=1682902656
 58   0.012730 54.239.132.41 -> 172.31.8.238 TCP 4410 [TCP segment of a reassembled PDU]
 59   0.012736 172.31.8.238 -> 54.239.132.41 TCP 66 54333 > http [ACK] Seq=97 Ack=232747 Win=424704 Len=0 TSval=6027199 TSecr=1682902656
 60   0.012853 54.239.132.41 -> 172.31.8.238 TCP 15994 [TCP segment of a reassembled PDU]
 61   0.012864 172.31.8.238 -> 54.239.132.41 TCP 66 54333 > http [ACK] Seq=97 Ack=248675 Win=456576 Len=0 TSval=6027199 TSecr=1682902656
 62   0.013132 54.239.132.41 -> 172.31.8.238 TCP 26130 [TCP segment of a reassembled PDU]
 63   0.013146 172.31.8.238 -> 54.239.132.41 TCP 66 54333 > http [ACK] Seq=97 Ack=274739 Win=508672 Len=0 TSval=6027200 TSecr=1682902656
 64   0.013153 54.239.132.41 -> 172.31.8.238 TCP 2962 [TCP segment of a reassembled PDU]
 65   0.013156 172.31.8.238 -> 54.239.132.41 TCP 66 54333 > http [ACK] Seq=97 Ack=277635 Win=514560 Len=0 TSval=6027200 TSecr=1682902656
 66   0.013499 54.239.132.41 -> 172.31.8.238 TCP 4410 [TCP segment of a reassembled PDU]
 67   0.013506 172.31.8.238 -> 54.239.132.41 TCP 66 54333 > http [ACK] Seq=97 Ack=281979 Win=523136 Len=0 TSval=6027200 TSecr=1682902656
 68   0.013655 54.239.132.41 -> 172.31.8.238 TCP 18890 [TCP segment of a reassembled PDU]
 69   0.013666 172.31.8.238 -> 54.239.132.41 TCP 66 54333 > http [ACK] Seq=97 Ack=300803 Win=560896 Len=0 TSval=6027200 TSecr=1682902656
 70   0.013748 54.239.132.41 -> 172.31.8.238 TCP 4410 [TCP segment of a reassembled PDU]
 71   0.013754 172.31.8.238 -> 54.239.132.41 TCP 66 54333 > http [ACK] Seq=97 Ack=305147 Win=569472 Len=0 TSval=6027200 TSecr=1682902656
 72   0.013886 54.239.132.41 -> 172.31.8.238 TCP 23234 [TCP segment of a reassembled PDU]
 73   0.013898 172.31.8.238 -> 54.239.132.41 TCP 66 54333 > http [ACK] Seq=97 Ack=328315 Win=615808 Len=0 TSval=6027200 TSecr=1682902656
 74   0.014236 54.239.132.41 -> 172.31.8.238 TCP 1514 [TCP segment of a reassembled PDU]
 75   0.014241 172.31.8.238 -> 54.239.132.41 TCP 66 54333 > http [ACK] Seq=97 Ack=329763 Win=618752 Len=0 TSval=6027200 TSecr=1682902656
 76   0.014406 54.239.132.41 -> 172.31.8.238 TCP 26130 [TCP segment of a reassembled PDU]
 77   0.014419 172.31.8.238 -> 54.239.132.41 TCP 66 54333 > http [ACK] Seq=97 Ack=355827 Win=670848 Len=0 TSval=6027200 TSecr=1682902656
 78   0.014620 54.239.132.41 -> 172.31.8.238 TCP 26130 [TCP segment of a reassembled PDU]
 79   0.014634 172.31.8.238 -> 54.239.132.41 TCP 66 54333 > http [ACK] Seq=97 Ack=381891 Win=723072 Len=0 TSval=6027200 TSecr=1682902656
 80   0.014651 54.239.132.41 -> 172.31.8.238 TCP 7306 [TCP segment of a reassembled PDU]
 81   0.014656 172.31.8.238 -> 54.239.132.41 TCP 66 54333 > http [ACK] Seq=97 Ack=389131 Win=737536 Len=0 TSval=6027200 TSecr=1682902656
 82   0.015013 54.239.132.41 -> 172.31.8.238 TCP 7306 [TCP segment of a reassembled PDU]
 83   0.015021 172.31.8.238 -> 54.239.132.41 TCP 66 54333 > http [ACK] Seq=97 Ack=396371 Win=752000 Len=0 TSval=6027200 TSecr=1682902656
 84   0.015164 54.239.132.41 -> 172.31.8.238 TCP 23234 [TCP segment of a reassembled PDU]
 85   0.015176 172.31.8.238 -> 54.239.132.41 TCP 66 54333 > http [ACK] Seq=97 Ack=419539 Win=798336 Len=0 TSval=6027200 TSecr=1682902656
 86   0.015391 54.239.132.41 -> 172.31.8.238 TCP 24682 [TCP segment of a reassembled PDU]
 87   0.015405 172.31.8.238 -> 54.239.132.41 TCP 66 54333 > http [ACK] Seq=97 Ack=444155 Win=847488 Len=0 TSval=6027200 TSecr=1682902656
 88   0.015480 54.239.132.41 -> 172.31.8.238 TCP 2962 [TCP segment of a reassembled PDU]
 89   0.015485 172.31.8.238 -> 54.239.132.41 TCP 66 54333 > http [ACK] Seq=97 Ack=447051 Win=853376 Len=0 TSval=6027200 TSecr=1682902656
 90   0.015859 54.239.132.41 -> 172.31.8.238 TCP 26130 [TCP segment of a reassembled PDU]
 91   0.015873 172.31.8.238 -> 54.239.132.41 TCP 66 54333 > http [ACK] Seq=97 Ack=473115 Win=905472 Len=0 TSval=6027200 TSecr=1682902656
 92   0.015904 54.239.132.41 -> 172.31.8.238 TCP 13098 [TCP segment of a reassembled PDU]
 93   0.015914 172.31.8.238 -> 54.239.132.41 TCP 66 54333 > http [ACK] Seq=97 Ack=486147 Win=931584 Len=0 TSval=6027200 TSecr=1682902656
 94   0.016114 54.239.132.41 -> 172.31.8.238 TCP 20338 [TCP segment of a reassembled PDU]
 95   0.016126 172.31.8.238 -> 54.239.132.41 TCP 66 54333 > http [ACK] Seq=97 Ack=506419 Win=972032 Len=0 TSval=6027200 TSecr=1682902656
 96   0.016156 54.239.132.41 -> 172.31.8.238 TCP 8754 [TCP segment of a reassembled PDU]
 97   0.016162 172.31.8.238 -> 54.239.132.41 TCP 66 54333 > http [ACK] Seq=97 Ack=515107 Win=989440 Len=0 TSval=6027200 TSecr=1682902656
 98   0.016342 54.239.132.41 -> 172.31.8.238 TCP 23234 [TCP segment of a reassembled PDU]
 99   0.016355 172.31.8.238 -> 54.239.132.41 TCP 66 54333 > http [ACK] Seq=97 Ack=538275 Win=1007104 Len=0 TSval=6027200 TSecr=1682902656
100   0.016455 54.239.132.41 -> 172.31.8.238 TCP 8754 [TCP segment of a reassembled PDU]
101   0.016463 172.31.8.238 -> 54.239.132.41 TCP 66 54333 > http [ACK] Seq=97 Ack=546963 Win=1030912 Len=0 TSval=6027200 TSecr=1682902656
102   0.016826 54.239.132.41 -> 172.31.8.238 TCP 13098 [TCP segment of a reassembled PDU]
103   0.016835 172.31.8.238 -> 54.239.132.41 TCP 66 54333 > http [ACK] Seq=97 Ack=559995 Win=1023872 Len=0 TSval=6027200 TSecr=1682902657
104   0.016986 54.239.132.41 -> 172.31.8.238 TCP 26130 [TCP segment of a reassembled PDU]
105   0.016999 172.31.8.238 -> 54.239.132.41 TCP 66 54333 > http [ACK] Seq=97 Ack=586059 Win=1002368 Len=0 TSval=6027201 TSecr=1682902657
106   0.017060 54.239.132.41 -> 172.31.8.238 TCP 26130 [TCP segment of a reassembled PDU]
107   0.017074 172.31.8.238 -> 54.239.132.41 TCP 66 54333 > http [ACK] Seq=97 Ack=612123 Win=1087872 Len=0 TSval=6027201 TSecr=1682902657
108   0.017126 54.239.132.41 -> 172.31.8.238 TCP 4410 [TCP segment of a reassembled PDU]
109   0.017131 172.31.8.238 -> 54.239.132.41 TCP 66 54333 > http [ACK] Seq=97 Ack=616467 Win=1096576 Len=0 TSval=6027201 TSecr=1682902657
110   0.017645 54.239.132.41 -> 172.31.8.238 TCP 11650 [TCP segment of a reassembled PDU]
111   0.017654 172.31.8.238 -> 54.239.132.41 TCP 66 54333 > http [ACK] Seq=97 Ack=628051 Win=1119744 Len=0 TSval=6027201 TSecr=1682902657
112   0.017811 54.239.132.41 -> 172.31.8.238 TCP 26130 [TCP segment of a reassembled PDU]
113   0.017824 172.31.8.238 -> 54.239.132.41 TCP 66 54333 > http [ACK] Seq=97 Ack=654115 Win=1171840 Len=0 TSval=6027201 TSecr=1682902657
114   0.017875 54.239.132.41 -> 172.31.8.238 TCP 20338 [TCP segment of a reassembled PDU]
115   0.017886 172.31.8.238 -> 54.239.132.41 TCP 66 54333 > http [ACK] Seq=97 Ack=674387 Win=1212416 Len=0 TSval=6027201 TSecr=1682902657
116   0.017934 54.239.132.41 -> 172.31.8.238 TCP 7306 [TCP segment of a reassembled PDU]
117   0.017940 172.31.8.238 -> 54.239.132.41 TCP 66 54333 > http [ACK] Seq=97 Ack=681627 Win=1226880 Len=0 TSval=6027201 TSecr=1682902657
118   0.018076 54.239.132.41 -> 172.31.8.238 TCP 1514 [TCP segment of a reassembled PDU]
119   0.018080 172.31.8.238 -> 54.239.132.41 TCP 66 54333 > http [ACK] Seq=97 Ack=683075 Win=1229824 Len=0 TSval=6027201 TSecr=1682902657
120   0.018245 54.239.132.41 -> 172.31.8.238 TCP 26130 [TCP segment of a reassembled PDU]
121   0.018259 172.31.8.238 -> 54.239.132.41 TCP 66 54333 > http [ACK] Seq=97 Ack=709139 Win=1281920 Len=0 TSval=6027201 TSecr=1682902657
122   0.018279 54.239.132.41 -> 172.31.8.238 TCP 7306 [TCP segment of a reassembled PDU]
123   0.018287 172.31.8.238 -> 54.239.132.41 TCP 66 54333 > http [ACK] Seq=97 Ack=716379 Win=1296384 Len=0 TSval=6027201 TSecr=1682902657
124   0.018335 54.239.132.41 -> 172.31.8.238 TCP 1514 [TCP segment of a reassembled PDU]
125   0.018339 172.31.8.238 -> 54.239.132.41 TCP 66 54333 > http [ACK] Seq=97 Ack=717827 Win=1299328 Len=0 TSval=6027201 TSecr=1682902657
126   0.018486 54.239.132.41 -> 172.31.8.238 TCP 18890 [TCP segment of a reassembled PDU]
127   0.018496 172.31.8.238 -> 54.239.132.41 TCP 66 54333 > http [ACK] Seq=97 Ack=736651 Win=1336960 Len=0 TSval=6027201 TSecr=1682902657
128   0.018529 54.239.132.41 -> 172.31.8.238 TCP 10202 [TCP segment of a reassembled PDU]
129   0.018537 172.31.8.238 -> 54.239.132.41 TCP 66 54333 > http [ACK] Seq=97 Ack=746787 Win=1357184 Len=0 TSval=6027201 TSecr=1682902657
130   0.018902 54.239.132.41 -> 172.31.8.238 TCP 20338 [TCP segment of a reassembled PDU]
131   0.018913 172.31.8.238 -> 54.239.132.41 TCP 66 54333 > http [ACK] Seq=97 Ack=767059 Win=1397760 Len=0 TSval=6027201 TSecr=1682902657
132   0.019028 54.239.132.41 -> 172.31.8.238 TCP 26130 [TCP segment of a reassembled PDU]
133   0.019042 172.31.8.238 -> 54.239.132.41 TCP 66 54333 > http [ACK] Seq=97 Ack=793123 Win=1449856 Len=0 TSval=6027201 TSecr=1682902657
134   0.019085 54.239.132.41 -> 172.31.8.238 TCP 18890 [TCP segment of a reassembled PDU]
135   0.019096 172.31.8.238 -> 54.239.132.41 TCP 66 54333 > http [ACK] Seq=97 Ack=811947 Win=1487616 Len=0 TSval=6027201 TSecr=1682902657
136   0.019144 54.239.132.41 -> 172.31.8.238 TCP 10202 [TCP segment of a reassembled PDU]
137   0.019152 172.31.8.238 -> 54.239.132.41 TCP 66 54333 > http [ACK] Seq=97 Ack=822083 Win=1507840 Len=0 TSval=6027201 TSecr=1682902657
138   0.019294 54.239.132.41 -> 172.31.8.238 TCP 26130 [TCP segment of a reassembled PDU]
139   0.019317 172.31.8.238 -> 54.239.132.41 TCP 66 54333 > http [ACK] Seq=97 Ack=848147 Win=1497984 Len=0 TSval=6027201 TSecr=1682902657
140   0.019699 54.239.132.41 -> 172.31.8.238 TCP 8754 [TCP segment of a reassembled PDU]
141   0.019707 172.31.8.238 -> 54.239.132.41 TCP 66 54333 > http [ACK] Seq=97 Ack=856835 Win=1525248 Len=0 TSval=6027201 TSecr=1682902657
142   0.019869 54.239.132.41 -> 172.31.8.238 TCP 26130 [TCP segment of a reassembled PDU]
143   0.019893 172.31.8.238 -> 54.239.132.41 TCP 66 54333 > http [ACK] Seq=97 Ack=882899 Win=1499264 Len=0 TSval=6027201 TSecr=1682902657
144   0.019940 54.239.132.41 -> 172.31.8.238 TCP 26130 [TCP segment of a reassembled PDU]
145   0.019965 172.31.8.238 -> 54.239.132.41 TCP 66 54333 > http [ACK] Seq=97 Ack=908963 Win=1497984 Len=0 TSval=6027201 TSecr=1682902657
146   0.020022 54.239.132.41 -> 172.31.8.238 TCP 26130 [TCP segment of a reassembled PDU]
147   0.020035 172.31.8.238 -> 54.239.132.41 TCP 66 54333 > http [ACK] Seq=97 Ack=935027 Win=1497984 Len=0 TSval=6027201 TSecr=1682902657
148   0.020072 54.239.132.41 -> 172.31.8.238 TCP 7306 [TCP segment of a reassembled PDU]
149   0.020078 172.31.8.238 -> 54.239.132.41 TCP 66 54333 > http [ACK] Seq=97 Ack=942267 Win=1528832 Len=0 TSval=6027201 TSecr=1682902657
150   0.020462 54.239.132.41 -> 172.31.8.238 TCP 20338 [TCP segment of a reassembled PDU]
151   0.020484 172.31.8.238 -> 54.239.132.41 TCP 66 54333 > http [ACK] Seq=97 Ack=962539 Win=1508608 Len=0 TSval=6027201 TSecr=1682902657
152   0.020626 54.239.132.41 -> 172.31.8.238 TCP 26130 [TCP segment of a reassembled PDU]
153   0.020653 54.239.132.41 -> 172.31.8.238 TCP 5858 [TCP segment of a reassembled PDU]
154   0.020691 172.31.8.238 -> 54.239.132.41 TCP 66 54333 > http [ACK] Seq=97 Ack=994395 Win=1488384 Len=0 TSval=6027201 TSecr=1682902657
155   0.020992 54.239.132.41 -> 172.31.8.238 TCP 26130 [TCP segment of a reassembled PDU]
156   0.021005 172.31.8.238 -> 54.239.132.41 TCP 66 54333 > http [ACK] Seq=97 Ack=1020459 Win=1497984 Len=0 TSval=6027202 TSecr=1682902657
157   0.021063 54.239.132.41 -> 172.31.8.238 TCP 26130 [TCP segment of a reassembled PDU]
158   0.021076 172.31.8.238 -> 54.239.132.41 TCP 66 54333 > http [ACK] Seq=97 Ack=1046523 Win=1497984 Len=0 TSval=6027202 TSecr=1682902657
159   0.021112 54.239.132.41 -> 172.31.8.238 HTTP 2577 HTTP/1.1 200 OK  (application/octet-stream)
160   0.021117 172.31.8.238 -> 54.239.132.41 TCP 66 54333 > http [ACK] Seq=97 Ack=1049034 Win=1531648 Len=0 TSval=6027202 TSecr=1682902657
161   0.021235 172.31.8.238 -> 54.239.132.41 TCP 66 54333 > http [FIN, ACK] Seq=97 Ack=1049034 Win=1531648 Len=0 TSval=6027202 TSecr=1682902657
162   0.021653 54.239.132.41 -> 172.31.8.238 TCP 66 http > 54333 [FIN, ACK] Seq=1049034 Ack=98 Win=14592 Len=0 TSval=1682902657 TSecr=6027202
163   0.021659 172.31.8.238 -> 54.239.132.41 TCP 66 54333 > http [ACK] Seq=98 Ack=1049035 Win=1531648 Len=0 TSval=6027202 TSecr=1682902657
