[Measurement for 1mb at 19:41:21 19.41.2014] 
Tshark:

  1   0.000000 172.31.8.238 -> 172.31.0.2   DNS 89 Standard query 0x9a47  A d1xvcg6dfvgaki.cloudfront.net
  2   0.000034 172.31.8.238 -> 172.31.0.2   DNS 89 Standard query 0x57a4  AAAA d1xvcg6dfvgaki.cloudfront.net
  3   0.000721   172.31.0.2 -> 172.31.8.238 DNS 170 Standard query response 0x57a4 
  4   0.000742   172.31.0.2 -> 172.31.8.238 DNS 217 Standard query response 0x9a47  A 54.230.116.154 A 54.230.117.154 A 54.230.119.125 A 54.230.119.165 A 54.239.132.26 A 54.239.132.196 A 54.192.118.239 A 54.230.116.128
  5   0.003885 172.31.8.238 -> 54.230.116.154 TCP 74 45238 > http [SYN] Seq=0 Win=26883 Len=0 MSS=8961 SACK_PERM=1 TSval=2427222 TSecr=0 WS=128
  6   0.004599 54.230.116.154 -> 172.31.8.238 TCP 74 http > 45238 [SYN, ACK] Seq=0 Ack=1 Win=14480 Len=0 MSS=1460 SACK_PERM=1 TSval=1683809246 TSecr=2427222 WS=128
  7   0.004614 172.31.8.238 -> 54.230.116.154 TCP 66 45238 > http [ACK] Seq=1 Ack=1 Win=27008 Len=0 TSval=2427222 TSecr=1683809246
  8   0.004664 172.31.8.238 -> 54.230.116.154 HTTP 162 GET /1mb HTTP/1.1 
  9   0.005303 54.230.116.154 -> 172.31.8.238 TCP 66 http > 45238 [ACK] Seq=1 Ack=97 Win=14592 Len=0 TSval=1683809246 TSecr=2427222
 10   0.007627 54.230.116.154 -> 172.31.8.238 TCP 522 [TCP segment of a reassembled PDU]
 11   0.007635 172.31.8.238 -> 54.230.116.154 TCP 66 45238 > http [ACK] Seq=97 Ack=457 Win=28032 Len=0 TSval=2427223 TSecr=1683809246
 12   0.007761 54.230.116.154 -> 172.31.8.238 TCP 13098 [TCP segment of a reassembled PDU]
 13   0.007772 172.31.8.238 -> 54.230.116.154 TCP 66 45238 > http [ACK] Seq=97 Ack=13489 Win=54144 Len=0 TSval=2427223 TSecr=1683809246
 14   0.008380 54.230.116.154 -> 172.31.8.238 TCP 4410 [TCP segment of a reassembled PDU]
 15   0.008386 172.31.8.238 -> 54.230.116.154 TCP 66 45238 > http [ACK] Seq=97 Ack=17833 Win=62720 Len=0 TSval=2427223 TSecr=1683809246
 16   0.008492 54.230.116.154 -> 172.31.8.238 TCP 8754 [TCP segment of a reassembled PDU]
 17   0.008499 172.31.8.238 -> 54.230.116.154 TCP 66 45238 > http [ACK] Seq=97 Ack=26521 Win=80128 Len=0 TSval=2427223 TSecr=1683809246
 18   0.008888 54.230.116.154 -> 172.31.8.238 TCP 8754 [TCP segment of a reassembled PDU]
 19   0.008895 172.31.8.238 -> 54.230.116.154 TCP 66 45238 > http [ACK] Seq=97 Ack=35209 Win=97536 Len=0 TSval=2427223 TSecr=1683809247
 20   0.008922 54.230.116.154 -> 172.31.8.238 TCP 1514 [TCP segment of a reassembled PDU]
 21   0.008926 172.31.8.238 -> 54.230.116.154 TCP 66 45238 > http [ACK] Seq=97 Ack=36657 Win=100480 Len=0 TSval=2427223 TSecr=1683809247
 22   0.009118 54.230.116.154 -> 172.31.8.238 TCP 1514 [TCP segment of a reassembled PDU]
 23   0.009122 172.31.8.238 -> 54.230.116.154 TCP 66 45238 > http [ACK] Seq=97 Ack=38105 Win=103296 Len=0 TSval=2427223 TSecr=1683809247
 24   0.009218 54.230.116.154 -> 172.31.8.238 TCP 8754 [TCP segment of a reassembled PDU]
 25   0.009225 172.31.8.238 -> 54.230.116.154 TCP 66 45238 > http [ACK] Seq=97 Ack=46793 Win=103680 Len=0 TSval=2427223 TSecr=1683809247
 26   0.009428 54.230.116.154 -> 172.31.8.238 TCP 4410 [TCP segment of a reassembled PDU]
 27   0.009434 172.31.8.238 -> 54.230.116.154 TCP 66 45238 > http [ACK] Seq=97 Ack=51137 Win=109056 Len=0 TSval=2427223 TSecr=1683809247
 28   0.009468 54.230.116.154 -> 172.31.8.238 TCP 1514 [TCP segment of a reassembled PDU]
 29   0.009472 172.31.8.238 -> 54.230.116.154 TCP 66 45238 > http [ACK] Seq=97 Ack=52585 Win=109056 Len=0 TSval=2427223 TSecr=1683809247
 30   0.009717 54.230.116.154 -> 172.31.8.238 TCP 10202 [TCP segment of a reassembled PDU]
 31   0.009725 172.31.8.238 -> 54.230.116.154 TCP 66 45238 > http [ACK] Seq=97 Ack=62721 Win=101248 Len=0 TSval=2427223 TSecr=1683809247
 32   0.009951 54.230.116.154 -> 172.31.8.238 TCP 15994 [TCP segment of a reassembled PDU]
 33   0.009974 172.31.8.238 -> 54.230.116.154 TCP 66 45238 > http [ACK] Seq=97 Ack=78649 Win=91648 Len=0 TSval=2427223 TSecr=1683809247
 34   0.010418 54.230.116.154 -> 172.31.8.238 TCP 1514 [TCP segment of a reassembled PDU]
 35   0.010423 172.31.8.238 -> 54.230.116.154 TCP 66 45238 > http [ACK] Seq=97 Ack=80097 Win=109056 Len=0 TSval=2427223 TSecr=1683809247
 36   0.010517 54.230.116.154 -> 172.31.8.238 TCP 11650 [TCP segment of a reassembled PDU]
 37   0.010524 172.31.8.238 -> 54.230.116.154 TCP 66 45238 > http [ACK] Seq=97 Ack=91681 Win=98944 Len=0 TSval=2427223 TSecr=1683809247
 38   0.010616 54.230.116.154 -> 172.31.8.238 TCP 13098 [TCP segment of a reassembled PDU]
 39   0.010625 172.31.8.238 -> 54.230.116.154 TCP 66 45238 > http [ACK] Seq=97 Ack=104713 Win=135168 Len=0 TSval=2427224 TSecr=1683809247
 40   0.010942 54.230.116.154 -> 172.31.8.238 TCP 4410 [TCP segment of a reassembled PDU]
 41   0.010947 172.31.8.238 -> 54.230.116.154 TCP 66 45238 > http [ACK] Seq=97 Ack=109057 Win=143872 Len=0 TSval=2427224 TSecr=1683809247
 42   0.011047 54.230.116.154 -> 172.31.8.238 TCP 8754 [TCP segment of a reassembled PDU]
 43   0.011054 172.31.8.238 -> 54.230.116.154 TCP 66 45238 > http [ACK] Seq=97 Ack=117745 Win=161152 Len=0 TSval=2427224 TSecr=1683809247
 44   0.011229 54.230.116.154 -> 172.31.8.238 TCP 13098 [TCP segment of a reassembled PDU]
 45   0.011238 172.31.8.238 -> 54.230.116.154 TCP 66 45238 > http [ACK] Seq=97 Ack=130777 Win=187264 Len=0 TSval=2427224 TSecr=1683809247
 46   0.011482 54.230.116.154 -> 172.31.8.238 TCP 13098 [TCP segment of a reassembled PDU]
 47   0.011493 172.31.8.238 -> 54.230.116.154 TCP 66 45238 > http [ACK] Seq=97 Ack=143809 Win=213376 Len=0 TSval=2427224 TSecr=1683809247
 48   0.011937 54.230.116.154 -> 172.31.8.238 TCP 5858 [TCP segment of a reassembled PDU]
 49   0.011944 172.31.8.238 -> 54.230.116.154 TCP 66 45238 > http [ACK] Seq=97 Ack=149601 Win=224896 Len=0 TSval=2427224 TSecr=1683809247
 50   0.012058 54.230.116.154 -> 172.31.8.238 TCP 7306 [TCP segment of a reassembled PDU]
 51   0.012064 172.31.8.238 -> 54.230.116.154 TCP 66 45238 > http [ACK] Seq=97 Ack=156841 Win=239360 Len=0 TSval=2427224 TSecr=1683809247
 52   0.012155 54.230.116.154 -> 172.31.8.238 TCP 5858 [TCP segment of a reassembled PDU]
 53   0.012161 172.31.8.238 -> 54.230.116.154 TCP 66 45238 > http [ACK] Seq=97 Ack=162633 Win=251008 Len=0 TSval=2427224 TSecr=1683809247
 54   0.012167 54.230.116.154 -> 172.31.8.238 TCP 1514 [TCP Previous segment not captured] [TCP segment of a reassembled PDU]
 55   0.012170 172.31.8.238 -> 54.230.116.154 TCP 78 [TCP Window Update] 45238 > http [ACK] Seq=97 Ack=162633 Win=253824 Len=0 TSval=2427224 TSecr=1683809247 SLE=164081 SRE=165529
 56   0.012182 54.230.116.154 -> 172.31.8.238 TCP 1514 [TCP Out-Of-Order] [TCP segment of a reassembled PDU]
 57   0.012187 172.31.8.238 -> 54.230.116.154 TCP 66 45238 > http [ACK] Seq=97 Ack=165529 Win=256768 Len=0 TSval=2427224 TSecr=1683809247
 58   0.012325 54.230.116.154 -> 172.31.8.238 TCP 17442 [TCP segment of a reassembled PDU]
 59   0.012334 172.31.8.238 -> 54.230.116.154 TCP 66 45238 > http [ACK] Seq=97 Ack=182905 Win=291456 Len=0 TSval=2427224 TSecr=1683809247
 60   0.012707 54.230.116.154 -> 172.31.8.238 TCP 4410 [TCP segment of a reassembled PDU]
 61   0.012713 172.31.8.238 -> 54.230.116.154 TCP 66 45238 > http [ACK] Seq=97 Ack=187249 Win=300160 Len=0 TSval=2427224 TSecr=1683809247
 62   0.012847 54.230.116.154 -> 172.31.8.238 TCP 13098 [TCP segment of a reassembled PDU]
 63   0.012856 172.31.8.238 -> 54.230.116.154 TCP 66 45238 > http [ACK] Seq=97 Ack=200281 Win=326272 Len=0 TSval=2427224 TSecr=1683809247
 64   0.013066 54.230.116.154 -> 172.31.8.238 TCP 13098 [TCP segment of a reassembled PDU]
 65   0.013074 172.31.8.238 -> 54.230.116.154 TCP 66 45238 > http [ACK] Seq=97 Ack=213313 Win=352384 Len=0 TSval=2427224 TSecr=1683809247
 66   0.013183 54.230.116.154 -> 172.31.8.238 TCP 8754 [TCP segment of a reassembled PDU]
 67   0.013190 172.31.8.238 -> 54.230.116.154 TCP 66 45238 > http [ACK] Seq=97 Ack=222001 Win=369664 Len=0 TSval=2427224 TSecr=1683809247
 68   0.013546 54.230.116.154 -> 172.31.8.238 TCP 20338 [TCP segment of a reassembled PDU]
 69   0.013559 172.31.8.238 -> 54.230.116.154 TCP 66 45238 > http [ACK] Seq=97 Ack=242273 Win=410240 Len=0 TSval=2427224 TSecr=1683809247
 70   0.013759 54.230.116.154 -> 172.31.8.238 TCP 7306 [TCP segment of a reassembled PDU]
 71   0.013765 172.31.8.238 -> 54.230.116.154 TCP 66 45238 > http [ACK] Seq=97 Ack=249513 Win=424704 Len=0 TSval=2427224 TSecr=1683809247
 72   0.013903 54.230.116.154 -> 172.31.8.238 TCP 17442 [TCP segment of a reassembled PDU]
 73   0.013912 172.31.8.238 -> 54.230.116.154 TCP 66 45238 > http [ACK] Seq=97 Ack=266889 Win=459520 Len=0 TSval=2427224 TSecr=1683809247
 74   0.014248 54.230.116.154 -> 172.31.8.238 TCP 8754 [TCP segment of a reassembled PDU]
 75   0.014256 172.31.8.238 -> 54.230.116.154 TCP 66 45238 > http [ACK] Seq=97 Ack=275577 Win=476800 Len=0 TSval=2427224 TSecr=1683809247
 76   0.014401 54.230.116.154 -> 172.31.8.238 TCP 18890 [TCP segment of a reassembled PDU]
 77   0.014412 172.31.8.238 -> 54.230.116.154 TCP 66 45238 > http [ACK] Seq=97 Ack=294401 Win=514560 Len=0 TSval=2427224 TSecr=1683809247
 78   0.014654 54.230.116.154 -> 172.31.8.238 TCP 21786 [TCP segment of a reassembled PDU]
 79   0.014666 172.31.8.238 -> 54.230.116.154 TCP 66 45238 > http [ACK] Seq=97 Ack=316121 Win=557952 Len=0 TSval=2427225 TSecr=1683809247
 80   0.015028 54.230.116.154 -> 172.31.8.238 TCP 7306 [TCP segment of a reassembled PDU]
 81   0.015035 172.31.8.238 -> 54.230.116.154 TCP 66 45238 > http [ACK] Seq=97 Ack=323361 Win=572416 Len=0 TSval=2427225 TSecr=1683809247
 82   0.015189 54.230.116.154 -> 172.31.8.238 TCP 23234 [TCP segment of a reassembled PDU]
 83   0.015201 172.31.8.238 -> 54.230.116.154 TCP 66 45238 > http [ACK] Seq=97 Ack=346529 Win=618752 Len=0 TSval=2427225 TSecr=1683809247
 84   0.015427 54.230.116.154 -> 172.31.8.238 TCP 23234 [TCP segment of a reassembled PDU]
 85   0.015439 172.31.8.238 -> 54.230.116.154 TCP 66 45238 > http [ACK] Seq=97 Ack=369697 Win=665088 Len=0 TSval=2427225 TSecr=1683809247
 86   0.015707 54.230.116.154 -> 172.31.8.238 TCP 10202 [TCP segment of a reassembled PDU]
 87   0.015715 172.31.8.238 -> 54.230.116.154 TCP 66 45238 > http [ACK] Seq=97 Ack=379833 Win=685312 Len=0 TSval=2427225 TSecr=1683809247
 88   0.015877 54.230.116.154 -> 172.31.8.238 TCP 21786 [TCP segment of a reassembled PDU]
 89   0.015888 172.31.8.238 -> 54.230.116.154 TCP 66 45238 > http [ACK] Seq=97 Ack=401553 Win=728832 Len=0 TSval=2427225 TSecr=1683809247
 90   0.016114 54.230.116.154 -> 172.31.8.238 TCP 26130 [TCP segment of a reassembled PDU]
 91   0.016128 172.31.8.238 -> 54.230.116.154 TCP 66 45238 > http [ACK] Seq=97 Ack=427617 Win=780928 Len=0 TSval=2427225 TSecr=1683809247
 92   0.016525 54.230.116.154 -> 172.31.8.238 TCP 5858 [TCP segment of a reassembled PDU]
 93   0.016532 172.31.8.238 -> 54.230.116.154 TCP 66 45238 > http [ACK] Seq=97 Ack=433409 Win=792576 Len=0 TSval=2427225 TSecr=1683809247
 94   0.016683 54.230.116.154 -> 172.31.8.238 TCP 21786 [TCP segment of a reassembled PDU]
 95   0.016694 172.31.8.238 -> 54.230.116.154 TCP 66 45238 > http [ACK] Seq=97 Ack=455129 Win=835968 Len=0 TSval=2427225 TSecr=1683809247
 96   0.017056 54.230.116.154 -> 172.31.8.238 TCP 26130 [TCP segment of a reassembled PDU]
 97   0.017070 172.31.8.238 -> 54.230.116.154 TCP 66 45238 > http [ACK] Seq=97 Ack=481193 Win=888064 Len=0 TSval=2427225 TSecr=1683809247
 98   0.017173 54.230.116.154 -> 172.31.8.238 TCP 8754 [TCP segment of a reassembled PDU]
 99   0.017181 172.31.8.238 -> 54.230.116.154 TCP 66 45238 > http [ACK] Seq=97 Ack=489881 Win=905472 Len=0 TSval=2427225 TSecr=1683809247
100   0.017298 54.230.116.154 -> 172.31.8.238 TCP 11650 [TCP segment of a reassembled PDU]
101   0.017307 172.31.8.238 -> 54.230.116.154 TCP 66 45238 > http [ACK] Seq=97 Ack=501465 Win=928640 Len=0 TSval=2427225 TSecr=1683809247
102   0.017453 54.230.116.154 -> 172.31.8.238 TCP 18890 [TCP segment of a reassembled PDU]
103   0.017463 172.31.8.238 -> 54.230.116.154 TCP 66 45238 > http [ACK] Seq=97 Ack=520289 Win=966272 Len=0 TSval=2427225 TSecr=1683809247
104   0.017551 54.230.116.154 -> 172.31.8.238 TCP 7306 [TCP segment of a reassembled PDU]
105   0.017559 172.31.8.238 -> 54.230.116.154 TCP 66 45238 > http [ACK] Seq=97 Ack=527529 Win=980736 Len=0 TSval=2427225 TSecr=1683809247
106   0.017689 54.230.116.154 -> 172.31.8.238 TCP 20338 [TCP segment of a reassembled PDU]
107   0.017700 172.31.8.238 -> 54.230.116.154 TCP 66 45238 > http [ACK] Seq=97 Ack=547801 Win=1021312 Len=0 TSval=2427225 TSecr=1683809247
108   0.018034 54.230.116.154 -> 172.31.8.238 TCP 14546 [TCP segment of a reassembled PDU]
109   0.018044 172.31.8.238 -> 54.230.116.154 TCP 66 45238 > http [ACK] Seq=97 Ack=562281 Win=1050240 Len=0 TSval=2427225 TSecr=1683809247
110   0.018185 54.230.116.154 -> 172.31.8.238 TCP 23234 [TCP segment of a reassembled PDU]
111   0.018197 172.31.8.238 -> 54.230.116.154 TCP 66 45238 > http [ACK] Seq=97 Ack=585449 Win=1096576 Len=0 TSval=2427225 TSecr=1683809247
112   0.018563 54.230.116.154 -> 172.31.8.238 TCP 13098 [TCP segment of a reassembled PDU]
113   0.018571 172.31.8.238 -> 54.230.116.154 TCP 66 45238 > http [ACK] Seq=97 Ack=598481 Win=1122688 Len=0 TSval=2427226 TSecr=1683809247
114   0.018700 54.230.116.154 -> 172.31.8.238 TCP 23234 [TCP segment of a reassembled PDU]
115   0.018713 172.31.8.238 -> 54.230.116.154 TCP 66 45238 > http [ACK] Seq=97 Ack=621649 Win=1124224 Len=0 TSval=2427226 TSecr=1683809247
116   0.019027 54.230.116.154 -> 172.31.8.238 TCP 5858 [TCP segment of a reassembled PDU]
117   0.019034 172.31.8.238 -> 54.230.116.154 TCP 66 45238 > http [ACK] Seq=97 Ack=627441 Win=1152768 Len=0 TSval=2427226 TSecr=1683809248
118   0.019197 54.230.116.154 -> 172.31.8.238 TCP 23234 [TCP segment of a reassembled PDU]
119   0.019209 172.31.8.238 -> 54.230.116.154 TCP 66 45238 > http [ACK] Seq=97 Ack=650609 Win=1129600 Len=0 TSval=2427226 TSecr=1683809248
120   0.019264 54.230.116.154 -> 172.31.8.238 TCP 26130 [TCP segment of a reassembled PDU]
121   0.019278 172.31.8.238 -> 54.230.116.154 TCP 66 45238 > http [ACK] Seq=97 Ack=676673 Win=1119488 Len=0 TSval=2427226 TSecr=1683809248
122   0.019580 54.230.116.154 -> 172.31.8.238 TCP 21786 [TCP segment of a reassembled PDU]
123   0.019592 172.31.8.238 -> 54.230.116.154 TCP 66 45238 > http [ACK] Seq=97 Ack=698393 Win=1126656 Len=0 TSval=2427226 TSecr=1683809248
124   0.019712 54.230.116.154 -> 172.31.8.238 TCP 10202 [TCP segment of a reassembled PDU]
125   0.019719 172.31.8.238 -> 54.230.116.154 TCP 66 45238 > http [ACK] Seq=97 Ack=708529 Win=1145728 Len=0 TSval=2427226 TSecr=1683809248
126   0.019813 54.230.116.154 -> 172.31.8.238 TCP 5858 [TCP segment of a reassembled PDU]
127   0.019820 172.31.8.238 -> 54.230.116.154 TCP 66 45238 > http [ACK] Seq=97 Ack=714321 Win=1152768 Len=0 TSval=2427226 TSecr=1683809248
128   0.019929 54.230.116.154 -> 172.31.8.238 TCP 1514 [TCP segment of a reassembled PDU]
129   0.019933 172.31.8.238 -> 54.230.116.154 TCP 66 45238 > http [ACK] Seq=97 Ack=715769 Win=1159936 Len=0 TSval=2427226 TSecr=1683809248
130   0.020059 54.230.116.154 -> 172.31.8.238 TCP 26130 [TCP segment of a reassembled PDU]
131   0.020073 172.31.8.238 -> 54.230.116.154 TCP 66 45238 > http [ACK] Seq=97 Ack=741833 Win=1133952 Len=0 TSval=2427226 TSecr=1683809248
132   0.020126 54.230.116.154 -> 172.31.8.238 TCP 18890 [TCP segment of a reassembled PDU]
133   0.020136 172.31.8.238 -> 54.230.116.154 TCP 66 45238 > http [ACK] Seq=97 Ack=760657 Win=1131392 Len=0 TSval=2427226 TSecr=1683809248
134   0.020196 54.230.116.154 -> 172.31.8.238 TCP 20338 [TCP segment of a reassembled PDU]
135   0.020206 172.31.8.238 -> 54.230.116.154 TCP 66 45238 > http [ACK] Seq=97 Ack=780929 Win=1111168 Len=0 TSval=2427226 TSecr=1683809248
136   0.020794 54.230.116.154 -> 172.31.8.238 TCP 4410 [TCP segment of a reassembled PDU]
137   0.020800 172.31.8.238 -> 54.230.116.154 TCP 66 45238 > http [ACK] Seq=97 Ack=785273 Win=1155200 Len=0 TSval=2427226 TSecr=1683809248
138   0.020966 54.230.116.154 -> 172.31.8.238 TCP 26130 [TCP segment of a reassembled PDU]
139   0.020979 172.31.8.238 -> 54.230.116.154 TCP 66 45238 > http [ACK] Seq=97 Ack=811337 Win=1129216 Len=0 TSval=2427226 TSecr=1683809248
140   0.021037 54.230.116.154 -> 172.31.8.238 TCP 26130 [TCP segment of a reassembled PDU]
141   0.021050 172.31.8.238 -> 54.230.116.154 TCP 66 45238 > http [ACK] Seq=97 Ack=837401 Win=1119488 Len=0 TSval=2427226 TSecr=1683809248
142   0.021093 54.230.116.154 -> 172.31.8.238 TCP 8754 [TCP segment of a reassembled PDU]
143   0.021100 172.31.8.238 -> 54.230.116.154 TCP 66 45238 > http [ACK] Seq=97 Ack=846089 Win=1148032 Len=0 TSval=2427226 TSecr=1683809248
144   0.021383 54.230.116.154 -> 172.31.8.238 TCP 13098 [TCP segment of a reassembled PDU]
145   0.021393 172.31.8.238 -> 54.230.116.154 TCP 66 45238 > http [ACK] Seq=97 Ack=859121 Win=1140992 Len=0 TSval=2427226 TSecr=1683809248
146   0.021537 54.230.116.154 -> 172.31.8.238 TCP 21786 [TCP segment of a reassembled PDU]
147   0.021561 172.31.8.238 -> 54.230.116.154 TCP 66 45238 > http [ACK] Seq=97 Ack=880841 Win=1126656 Len=0 TSval=2427226 TSecr=1683809248
148   0.021643 54.230.116.154 -> 172.31.8.238 TCP 4410 [TCP segment of a reassembled PDU]
149   0.021649 172.31.8.238 -> 54.230.116.154 TCP 66 45238 > http [ACK] Seq=97 Ack=885185 Win=1155200 Len=0 TSval=2427226 TSecr=1683809248
150   0.021815 54.230.116.154 -> 172.31.8.238 TCP 26130 [TCP segment of a reassembled PDU]
151   0.021839 172.31.8.238 -> 54.230.116.154 TCP 66 45238 > http [ACK] Seq=97 Ack=911249 Win=1129216 Len=0 TSval=2427226 TSecr=1683809248
152   0.021887 54.230.116.154 -> 172.31.8.238 TCP 26130 [TCP segment of a reassembled PDU]
153   0.021914 172.31.8.238 -> 54.230.116.154 TCP 66 45238 > http [ACK] Seq=97 Ack=937313 Win=1119488 Len=0 TSval=2427226 TSecr=1683809248
154   0.021945 54.230.116.154 -> 172.31.8.238 TCP 8754 [TCP segment of a reassembled PDU]
155   0.021953 172.31.8.238 -> 54.230.116.154 TCP 66 45238 > http [ACK] Seq=97 Ack=946001 Win=1148032 Len=0 TSval=2427226 TSecr=1683809248
156   0.022099 54.230.116.154 -> 172.31.8.238 TCP 7306 [TCP segment of a reassembled PDU]
157   0.022106 172.31.8.238 -> 54.230.116.154 TCP 66 45238 > http [ACK] Seq=97 Ack=953241 Win=1150464 Len=0 TSval=2427226 TSecr=1683809248
158   0.022266 54.230.116.154 -> 172.31.8.238 TCP 20338 [TCP segment of a reassembled PDU]
159   0.022286 54.230.116.154 -> 172.31.8.238 TCP 2962 [TCP segment of a reassembled PDU]
160   0.022297 172.31.8.238 -> 54.230.116.154 TCP 66 45238 > http [ACK] Seq=97 Ack=976409 Win=1127296 Len=0 TSval=2427226 TSecr=1683809248
161   0.022389 54.230.116.154 -> 172.31.8.238 TCP 2962 [TCP segment of a reassembled PDU]
162   0.022394 172.31.8.238 -> 54.230.116.154 TCP 66 45238 > http [ACK] Seq=97 Ack=979305 Win=1157504 Len=0 TSval=2427226 TSecr=1683809248
163   0.022528 54.230.116.154 -> 172.31.8.238 TCP 26130 [TCP segment of a reassembled PDU]
164   0.022562 172.31.8.238 -> 54.230.116.154 TCP 66 45238 > http [ACK] Seq=97 Ack=1005369 Win=1131520 Len=0 TSval=2427226 TSecr=1683809248
165   0.022618 54.230.116.154 -> 172.31.8.238 TCP 26130 [TCP segment of a reassembled PDU]
166   0.022632 172.31.8.238 -> 54.230.116.154 TCP 66 45238 > http [ACK] Seq=97 Ack=1031433 Win=1214976 Len=0 TSval=2427227 TSecr=1683809248
167   0.022688 54.230.116.154 -> 172.31.8.238 TCP 10202 [TCP segment of a reassembled PDU]
168   0.022696 172.31.8.238 -> 54.230.116.154 TCP 66 45238 > http [ACK] Seq=97 Ack=1041569 Win=1235200 Len=0 TSval=2427227 TSecr=1683809248
169   0.022953 54.230.116.154 -> 172.31.8.238 HTTP 7530 HTTP/1.1 200 OK  (application/octet-stream)
170   0.022960 172.31.8.238 -> 54.230.116.154 TCP 66 45238 > http [ACK] Seq=97 Ack=1049033 Win=1250176 Len=0 TSval=2427227 TSecr=1683809248
171   0.023096 172.31.8.238 -> 54.230.116.154 TCP 66 45238 > http [FIN, ACK] Seq=97 Ack=1049033 Win=1250176 Len=0 TSval=2427227 TSecr=1683809248
172   0.023600 54.230.116.154 -> 172.31.8.238 TCP 66 http > 45238 [FIN, ACK] Seq=1049033 Ack=98 Win=14592 Len=0 TSval=1683809248 TSecr=2427227
173   0.023607 172.31.8.238 -> 54.230.116.154 TCP 66 45238 > http [ACK] Seq=98 Ack=1049034 Win=1250176 Len=0 TSval=2427227 TSecr=1683809248
