[Measurement for 1mb at 12:41:21 20.41.2014] 
Tshark:

  1   0.000000 172.31.8.238 -> 172.31.0.2   DNS 89 Standard query 0xaf44  A d1xvcg6dfvgaki.cloudfront.net
  2   0.000025 172.31.8.238 -> 172.31.0.2   DNS 89 Standard query 0xa76c  AAAA d1xvcg6dfvgaki.cloudfront.net
  3   0.000720   172.31.0.2 -> 172.31.8.238 DNS 170 Standard query response 0xa76c 
  4   0.000733   172.31.0.2 -> 172.31.8.238 DNS 217 Standard query response 0xaf44  A 54.192.118.228 A 54.230.116.82 A 54.230.116.141 A 54.230.116.204 A 54.230.117.156 A 54.230.119.66 A 54.230.119.125 A 54.239.132.173
  5   0.003896 172.31.8.238 -> 54.192.118.228 TCP 74 55341 > http [SYN] Seq=0 Win=26883 Len=0 MSS=8961 SACK_PERM=1 TSval=17727344 TSecr=0 WS=128
  6   0.004704 54.192.118.228 -> 172.31.8.238 TCP 74 http > 55341 [SYN, ACK] Seq=0 Ack=1 Win=14480 Len=0 MSS=1460 SACK_PERM=1 TSval=1499010057 TSecr=17727344 WS=128
  7   0.004719 172.31.8.238 -> 54.192.118.228 TCP 66 55341 > http [ACK] Seq=1 Ack=1 Win=27008 Len=0 TSval=17727344 TSecr=1499010057
  8   0.004758 172.31.8.238 -> 54.192.118.228 HTTP 162 GET /1mb HTTP/1.1 
  9   0.005403 54.192.118.228 -> 172.31.8.238 TCP 66 http > 55341 [ACK] Seq=1 Ack=97 Win=14592 Len=0 TSval=1499010057 TSecr=17727344
 10   0.007225 54.192.118.228 -> 172.31.8.238 TCP 523 [TCP segment of a reassembled PDU]
 11   0.007232 172.31.8.238 -> 54.192.118.228 TCP 66 55341 > http [ACK] Seq=97 Ack=458 Win=28032 Len=0 TSval=17727345 TSecr=1499010057
 12   0.007326 54.192.118.228 -> 172.31.8.238 TCP 5858 [TCP segment of a reassembled PDU]
 13   0.007334 172.31.8.238 -> 54.192.118.228 TCP 66 55341 > http [ACK] Seq=97 Ack=6250 Win=39552 Len=0 TSval=17727345 TSecr=1499010057
 14   0.007418 54.192.118.228 -> 172.31.8.238 TCP 2962 [TCP segment of a reassembled PDU]
 15   0.007423 172.31.8.238 -> 54.192.118.228 TCP 66 55341 > http [ACK] Seq=97 Ack=9146 Win=45440 Len=0 TSval=17727345 TSecr=1499010057
 16   0.007509 54.192.118.228 -> 172.31.8.238 TCP 4410 [TCP segment of a reassembled PDU]
 17   0.007515 172.31.8.238 -> 54.192.118.228 TCP 66 55341 > http [ACK] Seq=97 Ack=13490 Win=54144 Len=0 TSval=17727345 TSecr=1499010057
 18   0.008000 54.192.118.228 -> 172.31.8.238 TCP 5858 [TCP segment of a reassembled PDU]
 19   0.008006 172.31.8.238 -> 54.192.118.228 TCP 66 55341 > http [ACK] Seq=97 Ack=19282 Win=65664 Len=0 TSval=17727345 TSecr=1499010057
 20   0.008104 54.192.118.228 -> 172.31.8.238 TCP 7306 [TCP segment of a reassembled PDU]
 21   0.008111 172.31.8.238 -> 54.192.118.228 TCP 66 55341 > http [ACK] Seq=97 Ack=26522 Win=80128 Len=0 TSval=17727345 TSecr=1499010057
 22   0.008207 54.192.118.228 -> 172.31.8.238 TCP 5858 [TCP segment of a reassembled PDU]
 23   0.008213 172.31.8.238 -> 54.192.118.228 TCP 66 55341 > http [ACK] Seq=97 Ack=32314 Win=91776 Len=0 TSval=17727345 TSecr=1499010057
 24   0.008305 54.192.118.228 -> 172.31.8.238 TCP 1514 [TCP segment of a reassembled PDU]
 25   0.008310 172.31.8.238 -> 54.192.118.228 TCP 66 55341 > http [ACK] Seq=97 Ack=33762 Win=94592 Len=0 TSval=17727345 TSecr=1499010057
 26   0.008779 54.192.118.228 -> 172.31.8.238 TCP 4410 [TCP segment of a reassembled PDU]
 27   0.008785 172.31.8.238 -> 54.192.118.228 TCP 66 55341 > http [ACK] Seq=97 Ack=38106 Win=103296 Len=0 TSval=17727345 TSecr=1499010058
 28   0.008891 54.192.118.228 -> 172.31.8.238 TCP 14546 [TCP segment of a reassembled PDU]
 29   0.008900 172.31.8.238 -> 54.192.118.228 TCP 66 55341 > http [ACK] Seq=97 Ack=52586 Win=94080 Len=0 TSval=17727345 TSecr=1499010058
 30   0.009490 54.192.118.228 -> 172.31.8.238 TCP 2962 [TCP segment of a reassembled PDU]
 31   0.009495 172.31.8.238 -> 54.192.118.228 TCP 66 55341 > http [ACK] Seq=97 Ack=55482 Win=109056 Len=0 TSval=17727345 TSecr=1499010058
 32   0.009623 54.192.118.228 -> 172.31.8.238 TCP 20338 [TCP segment of a reassembled PDU]
 33   0.009635 172.31.8.238 -> 54.192.118.228 TCP 66 55341 > http [ACK] Seq=97 Ack=75754 Win=88832 Len=0 TSval=17727345 TSecr=1499010058
 34   0.009641 54.192.118.228 -> 172.31.8.238 TCP 2962 [TCP segment of a reassembled PDU]
 35   0.009645 172.31.8.238 -> 54.192.118.228 TCP 66 55341 > http [ACK] Seq=97 Ack=78650 Win=86016 Len=0 TSval=17727345 TSecr=1499010058
 36   0.010279 54.192.118.228 -> 172.31.8.238 TCP 7306 [TCP segment of a reassembled PDU]
 37   0.010286 172.31.8.238 -> 54.192.118.228 TCP 66 55341 > http [ACK] Seq=97 Ack=85890 Win=105984 Len=0 TSval=17727346 TSecr=1499010058
 38   0.010398 54.192.118.228 -> 172.31.8.238 TCP 14546 [TCP segment of a reassembled PDU]
 39   0.010407 172.31.8.238 -> 54.192.118.228 TCP 66 55341 > http [ACK] Seq=97 Ack=100370 Win=137984 Len=0 TSval=17727346 TSecr=1499010058
 40   0.010438 54.192.118.228 -> 172.31.8.238 TCP 11650 [TCP segment of a reassembled PDU]
 41   0.010446 172.31.8.238 -> 54.192.118.228 TCP 66 55341 > http [ACK] Seq=97 Ack=111954 Win=161152 Len=0 TSval=17727346 TSecr=1499010058
 42   0.010983 54.192.118.228 -> 172.31.8.238 TCP 1514 [TCP segment of a reassembled PDU]
 43   0.010987 172.31.8.238 -> 54.192.118.228 TCP 66 55341 > http [ACK] Seq=97 Ack=113402 Win=164096 Len=0 TSval=17727346 TSecr=1499010058
 44   0.011090 54.192.118.228 -> 172.31.8.238 TCP 2962 [TCP segment of a reassembled PDU]
 45   0.011095 172.31.8.238 -> 54.192.118.228 TCP 66 55341 > http [ACK] Seq=97 Ack=116298 Win=169856 Len=0 TSval=17727346 TSecr=1499010058
 46   0.011212 54.192.118.228 -> 172.31.8.238 TCP 21786 [TCP segment of a reassembled PDU]
 47   0.011225 172.31.8.238 -> 54.192.118.228 TCP 66 55341 > http [ACK] Seq=97 Ack=138018 Win=213376 Len=0 TSval=17727346 TSecr=1499010058
 48   0.011241 54.192.118.228 -> 172.31.8.238 TCP 4410 [TCP segment of a reassembled PDU]
 49   0.011245 172.31.8.238 -> 54.192.118.228 TCP 66 55341 > http [ACK] Seq=97 Ack=142362 Win=221952 Len=0 TSval=17727346 TSecr=1499010058
 50   0.011301 54.192.118.228 -> 172.31.8.238 TCP 7306 [TCP segment of a reassembled PDU]
 51   0.011308 172.31.8.238 -> 54.192.118.228 TCP 66 55341 > http [ACK] Seq=97 Ack=149602 Win=236544 Len=0 TSval=17727346 TSecr=1499010058
 52   0.011815 54.192.118.228 -> 172.31.8.238 TCP 1514 [TCP segment of a reassembled PDU]
 53   0.011821 172.31.8.238 -> 54.192.118.228 TCP 66 55341 > http [ACK] Seq=97 Ack=151050 Win=239360 Len=0 TSval=17727346 TSecr=1499010058
 54   0.011978 54.192.118.228 -> 172.31.8.238 TCP 26130 [TCP segment of a reassembled PDU]
 55   0.011992 172.31.8.238 -> 54.192.118.228 TCP 66 55341 > http [ACK] Seq=97 Ack=177114 Win=291456 Len=0 TSval=17727346 TSecr=1499010058
 56   0.011997 54.192.118.228 -> 172.31.8.238 TCP 1514 [TCP segment of a reassembled PDU]
 57   0.012000 172.31.8.238 -> 54.192.118.228 TCP 66 55341 > http [ACK] Seq=97 Ack=178562 Win=294400 Len=0 TSval=17727346 TSecr=1499010058
 58   0.012146 54.192.118.228 -> 172.31.8.238 TCP 15994 [TCP segment of a reassembled PDU]
 59   0.012156 172.31.8.238 -> 54.192.118.228 TCP 66 55341 > http [ACK] Seq=97 Ack=194490 Win=326272 Len=0 TSval=17727346 TSecr=1499010058
 60   0.012583 54.192.118.228 -> 172.31.8.238 TCP 2962 [TCP segment of a reassembled PDU]
 61   0.012588 172.31.8.238 -> 54.192.118.228 TCP 66 55341 > http [ACK] Seq=97 Ack=197386 Win=332032 Len=0 TSval=17727346 TSecr=1499010058
 62   0.012754 54.192.118.228 -> 172.31.8.238 TCP 26130 [TCP segment of a reassembled PDU]
 63   0.012767 172.31.8.238 -> 54.192.118.228 TCP 66 55341 > http [ACK] Seq=97 Ack=223450 Win=384128 Len=0 TSval=17727346 TSecr=1499010058
 64   0.012824 54.192.118.228 -> 172.31.8.238 TCP 21786 [TCP segment of a reassembled PDU]
 65   0.012835 172.31.8.238 -> 54.192.118.228 TCP 66 55341 > http [ACK] Seq=97 Ack=245170 Win=427648 Len=0 TSval=17727346 TSecr=1499010058
 66   0.013357 54.192.118.228 -> 172.31.8.238 TCP 2962 [TCP segment of a reassembled PDU]
 67   0.013363 172.31.8.238 -> 54.192.118.228 TCP 66 55341 > http [ACK] Seq=97 Ack=248066 Win=433408 Len=0 TSval=17727346 TSecr=1499010058
 68   0.013532 54.192.118.228 -> 172.31.8.238 TCP 26130 [TCP segment of a reassembled PDU]
 69   0.013545 172.31.8.238 -> 54.192.118.228 TCP 66 55341 > http [ACK] Seq=97 Ack=274130 Win=485504 Len=0 TSval=17727346 TSecr=1499010058
 70   0.013601 54.192.118.228 -> 172.31.8.238 TCP 15994 [TCP segment of a reassembled PDU]
 71   0.013611 172.31.8.238 -> 54.192.118.228 TCP 66 55341 > http [ACK] Seq=97 Ack=290058 Win=517376 Len=0 TSval=17727346 TSecr=1499010058
 72   0.014116 54.192.118.228 -> 172.31.8.238 TCP 2962 [TCP segment of a reassembled PDU]
 73   0.014122 172.31.8.238 -> 54.192.118.228 TCP 66 55341 > http [ACK] Seq=97 Ack=292954 Win=523136 Len=0 TSval=17727346 TSecr=1499010058
 74   0.014294 54.192.118.228 -> 172.31.8.238 TCP 26130 [TCP segment of a reassembled PDU]
 75   0.014308 172.31.8.238 -> 54.192.118.228 TCP 66 55341 > http [ACK] Seq=97 Ack=319018 Win=560896 Len=0 TSval=17727347 TSecr=1499010058
 76   0.014343 54.192.118.228 -> 172.31.8.238 TCP 14546 [TCP segment of a reassembled PDU]
 77   0.014354 172.31.8.238 -> 54.192.118.228 TCP 66 55341 > http [ACK] Seq=97 Ack=333498 Win=604288 Len=0 TSval=17727347 TSecr=1499010058
 78   0.014402 54.192.118.228 -> 172.31.8.238 TCP 1514 [TCP segment of a reassembled PDU]
 79   0.014407 172.31.8.238 -> 54.192.118.228 TCP 66 55341 > http [ACK] Seq=97 Ack=334946 Win=607232 Len=0 TSval=17727347 TSecr=1499010058
 80   0.014872 54.192.118.228 -> 172.31.8.238 TCP 1514 [TCP segment of a reassembled PDU]
 81   0.014876 172.31.8.238 -> 54.192.118.228 TCP 66 55341 > http [ACK] Seq=97 Ack=336394 Win=610048 Len=0 TSval=17727347 TSecr=1499010058
 82   0.015018 54.192.118.228 -> 172.31.8.238 TCP 18890 [TCP segment of a reassembled PDU]
 83   0.015029 172.31.8.238 -> 54.192.118.228 TCP 66 55341 > http [ACK] Seq=97 Ack=355218 Win=647680 Len=0 TSval=17727347 TSecr=1499010058
 84   0.015042 54.192.118.228 -> 172.31.8.238 TCP 2962 [TCP segment of a reassembled PDU]
 85   0.015047 172.31.8.238 -> 54.192.118.228 TCP 66 55341 > http [ACK] Seq=97 Ack=358114 Win=653568 Len=0 TSval=17727347 TSecr=1499010058
 86   0.015134 54.192.118.228 -> 172.31.8.238 TCP 23234 [TCP segment of a reassembled PDU]
 87   0.015147 172.31.8.238 -> 54.192.118.228 TCP 66 55341 > http [ACK] Seq=97 Ack=381282 Win=699904 Len=0 TSval=17727347 TSecr=1499010058
 88   0.015202 54.192.118.228 -> 172.31.8.238 TCP 13098 [TCP segment of a reassembled PDU]
 89   0.015209 172.31.8.238 -> 54.192.118.228 TCP 66 55341 > http [ACK] Seq=97 Ack=394314 Win=725888 Len=0 TSval=17727347 TSecr=1499010058
 90   0.015258 54.192.118.228 -> 172.31.8.238 TCP 5858 [TCP segment of a reassembled PDU]
 91   0.015264 172.31.8.238 -> 54.192.118.228 TCP 66 55341 > http [ACK] Seq=97 Ack=400106 Win=737536 Len=0 TSval=17727347 TSecr=1499010058
 92   0.015696 54.192.118.228 -> 172.31.8.238 TCP 1514 [TCP segment of a reassembled PDU]
 93   0.015701 172.31.8.238 -> 54.192.118.228 TCP 66 55341 > http [ACK] Seq=97 Ack=401554 Win=740352 Len=0 TSval=17727347 TSecr=1499010058
 94   0.015862 54.192.118.228 -> 172.31.8.238 TCP 26130 [TCP segment of a reassembled PDU]
 95   0.015876 172.31.8.238 -> 54.192.118.228 TCP 66 55341 > http [ACK] Seq=97 Ack=427618 Win=792576 Len=0 TSval=17727347 TSecr=1499010058
 96   0.015940 54.192.118.228 -> 172.31.8.238 TCP 26130 [TCP segment of a reassembled PDU]
 97   0.015953 172.31.8.238 -> 54.192.118.228 TCP 66 55341 > http [ACK] Seq=97 Ack=453682 Win=844672 Len=0 TSval=17727347 TSecr=1499010058
 98   0.016001 54.192.118.228 -> 172.31.8.238 TCP 11650 [TCP segment of a reassembled PDU]
 99   0.016010 172.31.8.238 -> 54.192.118.228 TCP 66 55341 > http [ACK] Seq=97 Ack=465266 Win=867840 Len=0 TSval=17727347 TSecr=1499010058
100   0.016714 54.192.118.228 -> 172.31.8.238 TCP 4410 [TCP segment of a reassembled PDU]
101   0.016721 172.31.8.238 -> 54.192.118.228 TCP 66 55341 > http [ACK] Seq=97 Ack=469610 Win=876544 Len=0 TSval=17727347 TSecr=1499010058
102   0.016946 54.192.118.228 -> 172.31.8.238 TCP 26130 [TCP segment of a reassembled PDU]
103   0.016973 172.31.8.238 -> 54.192.118.228 TCP 66 55341 > http [ACK] Seq=97 Ack=495674 Win=928640 Len=0 TSval=17727347 TSecr=1499010058
104   0.016991 54.192.118.228 -> 172.31.8.238 TCP 20338 [TCP segment of a reassembled PDU]
105   0.017004 172.31.8.238 -> 54.192.118.228 TCP 66 55341 > http [ACK] Seq=97 Ack=515946 Win=969216 Len=0 TSval=17727347 TSecr=1499010058
106   0.017085 54.192.118.228 -> 172.31.8.238 TCP 14546 [TCP segment of a reassembled PDU]
107   0.017095 172.31.8.238 -> 54.192.118.228 TCP 66 55341 > http [ACK] Seq=97 Ack=530426 Win=998144 Len=0 TSval=17727347 TSecr=1499010058
108   0.017747 54.192.118.228 -> 172.31.8.238 TCP 4410 [TCP segment of a reassembled PDU]
109   0.017753 172.31.8.238 -> 54.192.118.228 TCP 66 55341 > http [ACK] Seq=97 Ack=534770 Win=1006848 Len=0 TSval=17727347 TSecr=1499010058
110   0.017932 54.192.118.228 -> 172.31.8.238 TCP 26130 [TCP segment of a reassembled PDU]
111   0.017945 172.31.8.238 -> 54.192.118.228 TCP 66 55341 > http [ACK] Seq=97 Ack=560834 Win=1058944 Len=0 TSval=17727347 TSecr=1499010058
112   0.018015 54.192.118.228 -> 172.31.8.238 TCP 17442 [TCP segment of a reassembled PDU]
113   0.018025 172.31.8.238 -> 54.192.118.228 TCP 66 55341 > http [ACK] Seq=97 Ack=578210 Win=1093760 Len=0 TSval=17727347 TSecr=1499010058
114   0.018084 54.192.118.228 -> 172.31.8.238 TCP 8754 [TCP segment of a reassembled PDU]
115   0.018091 172.31.8.238 -> 54.192.118.228 TCP 66 55341 > http [ACK] Seq=97 Ack=586898 Win=1111040 Len=0 TSval=17727347 TSecr=1499010058
116   0.018136 54.192.118.228 -> 172.31.8.238 TCP 8754 [TCP segment of a reassembled PDU]
117   0.018143 172.31.8.238 -> 54.192.118.228 TCP 66 55341 > http [ACK] Seq=97 Ack=595586 Win=1128448 Len=0 TSval=17727347 TSecr=1499010058
118   0.018740 54.192.118.228 -> 172.31.8.238 TCP 4410 [TCP segment of a reassembled PDU]
119   0.018747 172.31.8.238 -> 54.192.118.228 TCP 66 55341 > http [ACK] Seq=97 Ack=599930 Win=1137152 Len=0 TSval=17727348 TSecr=1499010059
120   0.018909 54.192.118.228 -> 172.31.8.238 TCP 26130 [TCP segment of a reassembled PDU]
121   0.018922 172.31.8.238 -> 54.192.118.228 TCP 66 55341 > http [ACK] Seq=97 Ack=625994 Win=1137536 Len=0 TSval=17727348 TSecr=1499010059
122   0.018984 54.192.118.228 -> 172.31.8.238 TCP 26130 [TCP segment of a reassembled PDU]
123   0.018998 172.31.8.238 -> 54.192.118.228 TCP 66 55341 > http [ACK] Seq=97 Ack=652058 Win=1137536 Len=0 TSval=17727348 TSecr=1499010059
124   0.019040 54.192.118.228 -> 172.31.8.238 TCP 8754 [TCP segment of a reassembled PDU]
125   0.019047 172.31.8.238 -> 54.192.118.228 TCP 66 55341 > http [ACK] Seq=97 Ack=660746 Win=1166080 Len=0 TSval=17727348 TSecr=1499010059
126   0.019510 54.192.118.228 -> 172.31.8.238 TCP 4410 [TCP segment of a reassembled PDU]
127   0.019515 172.31.8.238 -> 54.192.118.228 TCP 66 55341 > http [ACK] Seq=97 Ack=665090 Win=1173248 Len=0 TSval=17727348 TSecr=1499010059
128   0.019699 54.192.118.228 -> 172.31.8.238 TCP 23234 [TCP segment of a reassembled PDU]
129   0.019712 172.31.8.238 -> 54.192.118.228 TCP 66 55341 > http [ACK] Seq=97 Ack=688258 Win=1150080 Len=0 TSval=17727348 TSecr=1499010059
130   0.019789 54.192.118.228 -> 172.31.8.238 TCP 2962 [TCP segment of a reassembled PDU]
131   0.019794 172.31.8.238 -> 54.192.118.228 TCP 66 55341 > http [ACK] Seq=97 Ack=691154 Win=1175552 Len=0 TSval=17727348 TSecr=1499010059
132   0.019835 54.192.118.228 -> 172.31.8.238 TCP 26130 [TCP segment of a reassembled PDU]
133   0.019849 172.31.8.238 -> 54.192.118.228 TCP 66 55341 > http [ACK] Seq=97 Ack=717218 Win=1149568 Len=0 TSval=17727348 TSecr=1499010059
134   0.019935 54.192.118.228 -> 172.31.8.238 TCP 26130 [TCP segment of a reassembled PDU]
135   0.019947 172.31.8.238 -> 54.192.118.228 TCP 66 55341 > http [ACK] Seq=97 Ack=743282 Win=1137536 Len=0 TSval=17727348 TSecr=1499010059
136   0.019987 54.192.118.228 -> 172.31.8.238 TCP 15994 [TCP segment of a reassembled PDU]
137   0.019996 172.31.8.238 -> 54.192.118.228 TCP 66 55341 > http [ACK] Seq=97 Ack=759210 Win=1121664 Len=0 TSval=17727348 TSecr=1499010059
138   0.020385 54.192.118.228 -> 172.31.8.238 TCP 4410 [TCP segment of a reassembled PDU]
139   0.020391 172.31.8.238 -> 54.192.118.228 TCP 66 55341 > http [ACK] Seq=97 Ack=763554 Win=1173248 Len=0 TSval=17727348 TSecr=1499010059
140   0.020548 54.192.118.228 -> 172.31.8.238 TCP 26130 [TCP segment of a reassembled PDU]
141   0.020561 172.31.8.238 -> 54.192.118.228 TCP 66 55341 > http [ACK] Seq=97 Ack=789618 Win=1147264 Len=0 TSval=17727348 TSecr=1499010059
142   0.020643 54.192.118.228 -> 172.31.8.238 TCP 2962 [TCP segment of a reassembled PDU]
143   0.020648 172.31.8.238 -> 54.192.118.228 TCP 66 55341 > http [ACK] Seq=97 Ack=792514 Win=1175552 Len=0 TSval=17727348 TSecr=1499010059
144   0.020805 54.192.118.228 -> 172.31.8.238 TCP 26130 [TCP segment of a reassembled PDU]
145   0.020827 172.31.8.238 -> 54.192.118.228 TCP 66 55341 > http [ACK] Seq=97 Ack=818578 Win=1149568 Len=0 TSval=17727348 TSecr=1499010059
146   0.020875 54.192.118.228 -> 172.31.8.238 TCP 26130 [TCP segment of a reassembled PDU]
147   0.020901 172.31.8.238 -> 54.192.118.228 TCP 66 55341 > http [ACK] Seq=97 Ack=844642 Win=1137536 Len=0 TSval=17727348 TSecr=1499010059
148   0.020929 54.192.118.228 -> 172.31.8.238 TCP 11650 [TCP segment of a reassembled PDU]
149   0.020936 172.31.8.238 -> 54.192.118.228 TCP 66 55341 > http [ACK] Seq=97 Ack=856226 Win=1161344 Len=0 TSval=17727348 TSecr=1499010059
150   0.021239 54.192.118.228 -> 172.31.8.238 TCP 21786 [TCP segment of a reassembled PDU]
151   0.021262 172.31.8.238 -> 54.192.118.228 TCP 66 55341 > http [ACK] Seq=97 Ack=877946 Win=1144704 Len=0 TSval=17727348 TSecr=1499010059
152   0.021366 54.192.118.228 -> 172.31.8.238 TCP 18890 [TCP segment of a reassembled PDU]
153   0.021378 172.31.8.238 -> 54.192.118.228 TCP 66 55341 > http [ACK] Seq=97 Ack=896770 Win=1149440 Len=0 TSval=17727348 TSecr=1499010059
154   0.021537 54.192.118.228 -> 172.31.8.238 TCP 26130 [TCP segment of a reassembled PDU]
155   0.021562 172.31.8.238 -> 54.192.118.228 TCP 66 55341 > http [ACK] Seq=97 Ack=922834 Win=1137536 Len=0 TSval=17727348 TSecr=1499010059
156   0.021599 54.192.118.228 -> 172.31.8.238 TCP 20338 [TCP segment of a reassembled PDU]
157   0.021623 172.31.8.238 -> 54.192.118.228 TCP 66 55341 > http [ACK] Seq=97 Ack=943106 Win=1147008 Len=0 TSval=17727348 TSecr=1499010059
158   0.021772 54.192.118.228 -> 172.31.8.238 TCP 23234 [TCP segment of a reassembled PDU]
159   0.021797 172.31.8.238 -> 54.192.118.228 TCP 66 55341 > http [ACK] Seq=97 Ack=966274 Win=1142272 Len=0 TSval=17727348 TSecr=1499010059
160   0.021814 54.192.118.228 -> 172.31.8.238 TCP 20338 [TCP segment of a reassembled PDU]
161   0.021837 172.31.8.238 -> 54.192.118.228 TCP 66 55341 > http [ACK] Seq=97 Ack=986546 Win=1147008 Len=0 TSval=17727348 TSecr=1499010059
162   0.022166 54.192.118.228 -> 172.31.8.238 TCP 4410 [TCP segment of a reassembled PDU]
163   0.022173 172.31.8.238 -> 54.192.118.228 TCP 66 55341 > http [ACK] Seq=97 Ack=990890 Win=1173248 Len=0 TSval=17727349 TSecr=1499010059
164   0.022340 54.192.118.228 -> 172.31.8.238 TCP 26130 [TCP segment of a reassembled PDU]
165   0.022355 172.31.8.238 -> 54.192.118.228 TCP 66 55341 > http [ACK] Seq=97 Ack=1016954 Win=1232384 Len=0 TSval=17727349 TSecr=1499010059
166   0.022407 54.192.118.228 -> 172.31.8.238 TCP 26130 [TCP segment of a reassembled PDU]
167   0.022420 172.31.8.238 -> 54.192.118.228 TCP 66 55341 > http [ACK] Seq=97 Ack=1043018 Win=1284480 Len=0 TSval=17727349 TSecr=1499010059
168   0.022458 54.192.118.228 -> 172.31.8.238 HTTP 6082 HTTP/1.1 200 OK  (application/octet-stream)
169   0.022464 172.31.8.238 -> 54.192.118.228 TCP 66 55341 > http [ACK] Seq=97 Ack=1049034 Win=1296512 Len=0 TSval=17727349 TSecr=1499010059
170   0.022581 172.31.8.238 -> 54.192.118.228 TCP 66 55341 > http [FIN, ACK] Seq=97 Ack=1049034 Win=1296512 Len=0 TSval=17727349 TSecr=1499010059
171   0.023179 54.192.118.228 -> 172.31.8.238 TCP 66 http > 55341 [FIN, ACK] Seq=1049034 Ack=98 Win=14592 Len=0 TSval=1499010059 TSecr=17727349
172   0.023188 172.31.8.238 -> 54.192.118.228 TCP 66 55341 > http [ACK] Seq=98 Ack=1049035 Win=1296512 Len=0 TSval=17727349 TSecr=1499010059
