[Measurement for 1mb at 00:41:21 20.41.2014] 
Tshark:

  1   0.000000 172.31.8.238 -> 172.31.0.2   DNS 89 Standard query 0x474e  A d1xvcg6dfvgaki.cloudfront.net
  2   0.000042 172.31.8.238 -> 172.31.0.2   DNS 89 Standard query 0x08a8  AAAA d1xvcg6dfvgaki.cloudfront.net
  3   0.000574   172.31.0.2 -> 172.31.8.238 DNS 217 Standard query response 0x474e  A 54.230.116.82 A 54.230.118.239 A 54.230.119.110 A 54.230.119.189 A 54.239.132.90 A 54.239.132.103 A 54.239.132.249 A 54.230.116.73
  4   0.000584   172.31.0.2 -> 172.31.8.238 DNS 170 Standard query response 0x08a8 
  5   0.003887 172.31.8.238 -> 54.230.116.82 TCP 74 59972 > http [SYN] Seq=0 Win=26883 Len=0 MSS=8961 SACK_PERM=1 TSval=6927234 TSecr=0 WS=128
  6   0.004745 54.230.116.82 -> 172.31.8.238 TCP 74 http > 59972 [SYN, ACK] Seq=0 Ack=1 Win=14480 Len=0 MSS=1460 SACK_PERM=1 TSval=1682782463 TSecr=6927234 WS=128
  7   0.004759 172.31.8.238 -> 54.230.116.82 TCP 66 59972 > http [ACK] Seq=1 Ack=1 Win=27008 Len=0 TSval=6927234 TSecr=1682782463
  8   0.004799 172.31.8.238 -> 54.230.116.82 HTTP 162 GET /1mb HTTP/1.1 
  9   0.005290 54.230.116.82 -> 172.31.8.238 TCP 66 http > 59972 [ACK] Seq=1 Ack=97 Win=14592 Len=0 TSval=1682782463 TSecr=6927234
 10   0.006768 54.230.116.82 -> 172.31.8.238 TCP 523 [TCP segment of a reassembled PDU]
 11   0.006775 172.31.8.238 -> 54.230.116.82 TCP 66 59972 > http [ACK] Seq=97 Ack=458 Win=28032 Len=0 TSval=6927235 TSecr=1682782464
 12   0.006893 54.230.116.82 -> 172.31.8.238 TCP 13098 [TCP segment of a reassembled PDU]
 13   0.006904 172.31.8.238 -> 54.230.116.82 TCP 66 59972 > http [ACK] Seq=97 Ack=13490 Win=54144 Len=0 TSval=6927235 TSecr=1682782464
 14   0.007575 54.230.116.82 -> 172.31.8.238 TCP 4410 [TCP segment of a reassembled PDU]
 15   0.007582 172.31.8.238 -> 54.230.116.82 TCP 66 59972 > http [ACK] Seq=97 Ack=17834 Win=62720 Len=0 TSval=6927235 TSecr=1682782464
 16   0.007679 54.230.116.82 -> 172.31.8.238 TCP 8754 [TCP segment of a reassembled PDU]
 17   0.007686 172.31.8.238 -> 54.230.116.82 TCP 66 59972 > http [ACK] Seq=97 Ack=26522 Win=80128 Len=0 TSval=6927235 TSecr=1682782464
 18   0.008176 54.230.116.82 -> 172.31.8.238 TCP 10202 [TCP segment of a reassembled PDU]
 19   0.008184 172.31.8.238 -> 54.230.116.82 TCP 66 59972 > http [ACK] Seq=97 Ack=36658 Win=100480 Len=0 TSval=6927235 TSecr=1682782464
 20   0.008282 54.230.116.82 -> 172.31.8.238 TCP 10202 [TCP segment of a reassembled PDU]
 21   0.008290 172.31.8.238 -> 54.230.116.82 TCP 66 59972 > http [ACK] Seq=97 Ack=46794 Win=101248 Len=0 TSval=6927235 TSecr=1682782464
 22   0.008597 54.230.116.82 -> 172.31.8.238 TCP 5858 [TCP segment of a reassembled PDU]
 23   0.008604 172.31.8.238 -> 54.230.116.82 TCP 66 59972 > http [ACK] Seq=97 Ack=52586 Win=108416 Len=0 TSval=6927235 TSecr=1682782464
 24   0.009102 54.230.116.82 -> 172.31.8.238 TCP 2962 [TCP segment of a reassembled PDU]
 25   0.009107 172.31.8.238 -> 54.230.116.82 TCP 66 59972 > http [ACK] Seq=97 Ack=55482 Win=109056 Len=0 TSval=6927235 TSecr=1682782464
 26   0.009228 54.230.116.82 -> 172.31.8.238 TCP 21786 [TCP segment of a reassembled PDU]
 27   0.009241 172.31.8.238 -> 54.230.116.82 TCP 66 59972 > http [ACK] Seq=97 Ack=77202 Win=87424 Len=0 TSval=6927235 TSecr=1682782464
 28   0.009605 54.230.116.82 -> 172.31.8.238 TCP 1514 [TCP segment of a reassembled PDU]
 29   0.009609 172.31.8.238 -> 54.230.116.82 TCP 66 59972 > http [ACK] Seq=97 Ack=78650 Win=109056 Len=0 TSval=6927235 TSecr=1682782464
 30   0.009887 54.230.116.82 -> 172.31.8.238 TCP 10202 [TCP segment of a reassembled PDU]
 31   0.009896 172.31.8.238 -> 54.230.116.82 TCP 66 59972 > http [ACK] Seq=97 Ack=88786 Win=101248 Len=0 TSval=6927235 TSecr=1682782464
 32   0.010005 54.230.116.82 -> 172.31.8.238 TCP 15994 [TCP segment of a reassembled PDU]
 33   0.010016 172.31.8.238 -> 54.230.116.82 TCP 66 59972 > http [ACK] Seq=97 Ack=104714 Win=91648 Len=0 TSval=6927235 TSecr=1682782464
 34   0.010391 54.230.116.82 -> 172.31.8.238 TCP 4410 [TCP segment of a reassembled PDU]
 35   0.010396 172.31.8.238 -> 54.230.116.82 TCP 66 59972 > http [ACK] Seq=97 Ack=109058 Win=109056 Len=0 TSval=6927235 TSecr=1682782464
 36   0.010491 54.230.116.82 -> 172.31.8.238 TCP 10202 [TCP segment of a reassembled PDU]
 37   0.010500 172.31.8.238 -> 54.230.116.82 TCP 66 59972 > http [ACK] Seq=97 Ack=119194 Win=101248 Len=0 TSval=6927235 TSecr=1682782464
 38   0.010641 54.230.116.82 -> 172.31.8.238 TCP 8754 [TCP segment of a reassembled PDU]
 39   0.010650 172.31.8.238 -> 54.230.116.82 TCP 66 59972 > http [ACK] Seq=97 Ack=127882 Win=103680 Len=0 TSval=6927235 TSecr=1682782464
 40   0.010740 54.230.116.82 -> 172.31.8.238 TCP 2962 [TCP segment of a reassembled PDU]
 41   0.010746 172.31.8.238 -> 54.230.116.82 TCP 66 59972 > http [ACK] Seq=97 Ack=130778 Win=100864 Len=0 TSval=6927236 TSecr=1682782464
 42   0.010900 54.230.116.82 -> 172.31.8.238 TCP 4410 [TCP segment of a reassembled PDU]
 43   0.010906 172.31.8.238 -> 54.230.116.82 TCP 66 59972 > http [ACK] Seq=97 Ack=135122 Win=96640 Len=0 TSval=6927236 TSecr=1682782464
 44   0.011047 54.230.116.82 -> 172.31.8.238 TCP 18890 [TCP segment of a reassembled PDU]
 45   0.011060 172.31.8.238 -> 54.230.116.82 TCP 66 59972 > http [ACK] Seq=97 Ack=153946 Win=146688 Len=0 TSval=6927236 TSecr=1682782464
 46   0.011191 54.230.116.82 -> 172.31.8.238 TCP 2962 [TCP segment of a reassembled PDU]
 47   0.011197 172.31.8.238 -> 54.230.116.82 TCP 66 59972 > http [ACK] Seq=97 Ack=156842 Win=152448 Len=0 TSval=6927236 TSecr=1682782464
 48   0.011470 54.230.116.82 -> 172.31.8.238 TCP 8754 [TCP segment of a reassembled PDU]
 49   0.011479 172.31.8.238 -> 54.230.116.82 TCP 66 59972 > http [ACK] Seq=97 Ack=165530 Win=169856 Len=0 TSval=6927236 TSecr=1682782464
 50   0.011588 54.230.116.82 -> 172.31.8.238 TCP 8754 [TCP segment of a reassembled PDU]
 51   0.011595 172.31.8.238 -> 54.230.116.82 TCP 66 59972 > http [ACK] Seq=97 Ack=174218 Win=187264 Len=0 TSval=6927236 TSecr=1682782464
 52   0.011697 54.230.116.82 -> 172.31.8.238 TCP 15994 [TCP segment of a reassembled PDU]
 53   0.011708 172.31.8.238 -> 54.230.116.82 TCP 66 59972 > http [ACK] Seq=97 Ack=190146 Win=219136 Len=0 TSval=6927236 TSecr=1682782464
 54   0.011809 54.230.116.82 -> 172.31.8.238 TCP 8754 [TCP segment of a reassembled PDU]
 55   0.011817 172.31.8.238 -> 54.230.116.82 TCP 66 59972 > http [ACK] Seq=97 Ack=198834 Win=236544 Len=0 TSval=6927236 TSecr=1682782464
 56   0.012009 54.230.116.82 -> 172.31.8.238 TCP 10202 [TCP segment of a reassembled PDU]
 57   0.012017 172.31.8.238 -> 54.230.116.82 TCP 66 59972 > http [ACK] Seq=97 Ack=208970 Win=256768 Len=0 TSval=6927236 TSecr=1682782464
 58   0.012319 54.230.116.82 -> 172.31.8.238 TCP 26130 [TCP segment of a reassembled PDU]
 59   0.012332 172.31.8.238 -> 54.230.116.82 TCP 66 59972 > http [ACK] Seq=97 Ack=235034 Win=308864 Len=0 TSval=6927236 TSecr=1682782464
 60   0.012338 54.230.116.82 -> 172.31.8.238 TCP 1514 [TCP segment of a reassembled PDU]
 61   0.012341 172.31.8.238 -> 54.230.116.82 TCP 66 59972 > http [ACK] Seq=97 Ack=236482 Win=311808 Len=0 TSval=6927236 TSecr=1682782464
 62   0.012492 54.230.116.82 -> 172.31.8.238 TCP 15994 [TCP segment of a reassembled PDU]
 63   0.012502 172.31.8.238 -> 54.230.116.82 TCP 66 59972 > http [ACK] Seq=97 Ack=252410 Win=343680 Len=0 TSval=6927236 TSecr=1682782464
 64   0.012591 54.230.116.82 -> 172.31.8.238 TCP 5858 [TCP segment of a reassembled PDU]
 65   0.012597 172.31.8.238 -> 54.230.116.82 TCP 66 59972 > http [ACK] Seq=97 Ack=258202 Win=355200 Len=0 TSval=6927236 TSecr=1682782464
 66   0.012953 54.230.116.82 -> 172.31.8.238 TCP 8754 [TCP segment of a reassembled PDU]
 67   0.012961 172.31.8.238 -> 54.230.116.82 TCP 66 59972 > http [ACK] Seq=97 Ack=266890 Win=372608 Len=0 TSval=6927236 TSecr=1682782464
 68   0.013123 54.230.116.82 -> 172.31.8.238 TCP 26130 [TCP segment of a reassembled PDU]
 69   0.013138 172.31.8.238 -> 54.230.116.82 TCP 66 59972 > http [ACK] Seq=97 Ack=292954 Win=424704 Len=0 TSval=6927236 TSecr=1682782464
 70   0.013173 54.230.116.82 -> 172.31.8.238 TCP 13098 [TCP segment of a reassembled PDU]
 71   0.013181 172.31.8.238 -> 54.230.116.82 TCP 66 59972 > http [ACK] Seq=97 Ack=305986 Win=450816 Len=0 TSval=6927236 TSecr=1682782464
 72   0.013224 54.230.116.82 -> 172.31.8.238 TCP 1514 [TCP segment of a reassembled PDU]
 73   0.013228 172.31.8.238 -> 54.230.116.82 TCP 66 59972 > http [ACK] Seq=97 Ack=307434 Win=453632 Len=0 TSval=6927236 TSecr=1682782464
 74   0.013703 54.230.116.82 -> 172.31.8.238 TCP 4410 [TCP segment of a reassembled PDU]
 75   0.013708 172.31.8.238 -> 54.230.116.82 TCP 66 59972 > http [ACK] Seq=97 Ack=311778 Win=462336 Len=0 TSval=6927236 TSecr=1682782464
 76   0.013864 54.230.116.82 -> 172.31.8.238 TCP 26130 [TCP segment of a reassembled PDU]
 77   0.013877 172.31.8.238 -> 54.230.116.82 TCP 66 59972 > http [ACK] Seq=97 Ack=337842 Win=514560 Len=0 TSval=6927236 TSecr=1682782464
 78   0.013931 54.230.116.82 -> 172.31.8.238 TCP 23234 [TCP segment of a reassembled PDU]
 79   0.013943 172.31.8.238 -> 54.230.116.82 TCP 66 59972 > http [ACK] Seq=97 Ack=361010 Win=560896 Len=0 TSval=6927236 TSecr=1682782464
 80   0.014471 54.230.116.82 -> 172.31.8.238 TCP 4410 [TCP segment of a reassembled PDU]
 81   0.014477 172.31.8.238 -> 54.230.116.82 TCP 66 59972 > http [ACK] Seq=97 Ack=365354 Win=569472 Len=0 TSval=6927236 TSecr=1682782464
 82   0.014634 54.230.116.82 -> 172.31.8.238 TCP 26130 [TCP segment of a reassembled PDU]
 83   0.014647 172.31.8.238 -> 54.230.116.82 TCP 66 59972 > http [ACK] Seq=97 Ack=391418 Win=621696 Len=0 TSval=6927236 TSecr=1682782464
 84   0.014712 54.230.116.82 -> 172.31.8.238 TCP 23234 [TCP segment of a reassembled PDU]
 85   0.014725 172.31.8.238 -> 54.230.116.82 TCP 66 59972 > http [ACK] Seq=97 Ack=414586 Win=668032 Len=0 TSval=6927237 TSecr=1682782464
 86   0.015249 54.230.116.82 -> 172.31.8.238 TCP 2962 [TCP segment of a reassembled PDU]
 87   0.015255 172.31.8.238 -> 54.230.116.82 TCP 66 59972 > http [ACK] Seq=97 Ack=417482 Win=673792 Len=0 TSval=6927237 TSecr=1682782464
 88   0.015423 54.230.116.82 -> 172.31.8.238 TCP 26130 [TCP segment of a reassembled PDU]
 89   0.015438 172.31.8.238 -> 54.230.116.82 TCP 66 59972 > http [ACK] Seq=97 Ack=443546 Win=725888 Len=0 TSval=6927237 TSecr=1682782464
 90   0.015479 54.230.116.82 -> 172.31.8.238 TCP 15994 [TCP segment of a reassembled PDU]
 91   0.015490 172.31.8.238 -> 54.230.116.82 TCP 66 59972 > http [ACK] Seq=97 Ack=459474 Win=757760 Len=0 TSval=6927237 TSecr=1682782464
 92   0.015541 54.230.116.82 -> 172.31.8.238 TCP 8754 [TCP segment of a reassembled PDU]
 93   0.015549 172.31.8.238 -> 54.230.116.82 TCP 66 59972 > http [ACK] Seq=97 Ack=468162 Win=775168 Len=0 TSval=6927237 TSecr=1682782464
 94   0.016000 54.230.116.82 -> 172.31.8.238 TCP 4410 [TCP segment of a reassembled PDU]
 95   0.016006 172.31.8.238 -> 54.230.116.82 TCP 66 59972 > http [ACK] Seq=97 Ack=472506 Win=783872 Len=0 TSval=6927237 TSecr=1682782465
 96   0.016198 54.230.116.82 -> 172.31.8.238 TCP 26130 [TCP segment of a reassembled PDU]
 97   0.016213 172.31.8.238 -> 54.230.116.82 TCP 66 59972 > http [ACK] Seq=97 Ack=498570 Win=835968 Len=0 TSval=6927237 TSecr=1682782465
 98   0.016267 54.230.116.82 -> 172.31.8.238 TCP 23234 [TCP segment of a reassembled PDU]
 99   0.016280 172.31.8.238 -> 54.230.116.82 TCP 66 59972 > http [ACK] Seq=97 Ack=521738 Win=882304 Len=0 TSval=6927237 TSecr=1682782465
100   0.016544 54.230.116.82 -> 172.31.8.238 TCP 11650 [TCP segment of a reassembled PDU]
101   0.016554 172.31.8.238 -> 54.230.116.82 TCP 66 59972 > http [ACK] Seq=97 Ack=533322 Win=905472 Len=0 TSval=6927237 TSecr=1682782465
102   0.016681 54.230.116.82 -> 172.31.8.238 TCP 15994 [TCP segment of a reassembled PDU]
103   0.016691 172.31.8.238 -> 54.230.116.82 TCP 66 59972 > http [ACK] Seq=97 Ack=549250 Win=937344 Len=0 TSval=6927237 TSecr=1682782465
104   0.016937 54.230.116.82 -> 172.31.8.238 TCP 26130 [TCP segment of a reassembled PDU]
105   0.016951 172.31.8.238 -> 54.230.116.82 TCP 66 59972 > http [ACK] Seq=97 Ack=575314 Win=989440 Len=0 TSval=6927237 TSecr=1682782465
106   0.016976 54.230.116.82 -> 172.31.8.238 TCP 11650 [TCP segment of a reassembled PDU]
107   0.016985 172.31.8.238 -> 54.230.116.82 TCP 66 59972 > http [ACK] Seq=97 Ack=586898 Win=1012608 Len=0 TSval=6927237 TSecr=1682782465
108   0.017088 54.230.116.82 -> 172.31.8.238 TCP 8754 [TCP segment of a reassembled PDU]
109   0.017096 172.31.8.238 -> 54.230.116.82 TCP 66 59972 > http [ACK] Seq=97 Ack=595586 Win=1030016 Len=0 TSval=6927237 TSecr=1682782465
110   0.017197 54.230.116.82 -> 172.31.8.238 TCP 18890 [TCP segment of a reassembled PDU]
111   0.017208 172.31.8.238 -> 54.230.116.82 TCP 66 59972 > http [ACK] Seq=97 Ack=614410 Win=1067648 Len=0 TSval=6927237 TSecr=1682782465
112   0.017808 54.230.116.82 -> 172.31.8.238 TCP 8754 [TCP segment of a reassembled PDU]
113   0.017817 172.31.8.238 -> 54.230.116.82 TCP 66 59972 > http [ACK] Seq=97 Ack=623098 Win=1085056 Len=0 TSval=6927237 TSecr=1682782465
114   0.017991 54.230.116.82 -> 172.31.8.238 TCP 26130 [TCP segment of a reassembled PDU]
115   0.018005 172.31.8.238 -> 54.230.116.82 TCP 66 59972 > http [ACK] Seq=97 Ack=649162 Win=1137152 Len=0 TSval=6927237 TSecr=1682782465
116   0.018067 54.230.116.82 -> 172.31.8.238 TCP 26130 [TCP segment of a reassembled PDU]
117   0.018082 172.31.8.238 -> 54.230.116.82 TCP 66 59972 > http [ACK] Seq=97 Ack=675226 Win=1189248 Len=0 TSval=6927237 TSecr=1682782465
118   0.018119 54.230.116.82 -> 172.31.8.238 TCP 7306 [TCP segment of a reassembled PDU]
119   0.018126 172.31.8.238 -> 54.230.116.82 TCP 66 59972 > http [ACK] Seq=97 Ack=682466 Win=1203712 Len=0 TSval=6927237 TSecr=1682782465
120   0.018424 54.230.116.82 -> 172.31.8.238 TCP 21786 [TCP segment of a reassembled PDU]
121   0.018437 172.31.8.238 -> 54.230.116.82 TCP 66 59972 > http [ACK] Seq=97 Ack=704186 Win=1247232 Len=0 TSval=6927237 TSecr=1682782465
122   0.018529 54.230.116.82 -> 172.31.8.238 TCP 8754 [TCP segment of a reassembled PDU]
123   0.018537 172.31.8.238 -> 54.230.116.82 TCP 66 59972 > http [ACK] Seq=97 Ack=712874 Win=1264512 Len=0 TSval=6927237 TSecr=1682782465
124   0.018698 54.230.116.82 -> 172.31.8.238 TCP 24682 [TCP segment of a reassembled PDU]
125   0.018712 172.31.8.238 -> 54.230.116.82 TCP 66 59972 > http [ACK] Seq=97 Ack=737490 Win=1257088 Len=0 TSval=6927238 TSecr=1682782465
126   0.018826 54.230.116.82 -> 172.31.8.238 TCP 30474 [TCP segment of a reassembled PDU]
127   0.018843 172.31.8.238 -> 54.230.116.82 TCP 66 59972 > http [ACK] Seq=97 Ack=767898 Win=1247488 Len=0 TSval=6927238 TSecr=1682782465
128   0.019117 54.230.116.82 -> 172.31.8.238 TCP 14546 [TCP segment of a reassembled PDU]
129   0.019128 172.31.8.238 -> 54.230.116.82 TCP 66 59972 > http [ACK] Seq=97 Ack=782378 Win=1273600 Len=0 TSval=6927238 TSecr=1682782465
130   0.019379 54.230.116.82 -> 172.31.8.238 TCP 17442 [TCP segment of a reassembled PDU]
131   0.019390 172.31.8.238 -> 54.230.116.82 TCP 66 59972 > http [ACK] Seq=97 Ack=799754 Win=1268864 Len=0 TSval=6927238 TSecr=1682782465
132   0.019396 54.230.116.82 -> 172.31.8.238 TCP 1514 [TCP segment of a reassembled PDU]
133   0.019398 172.31.8.238 -> 54.230.116.82 TCP 66 59972 > http [ACK] Seq=97 Ack=801202 Win=1267456 Len=0 TSval=6927238 TSecr=1682782465
134   0.019546 54.230.116.82 -> 172.31.8.238 TCP 26130 [TCP segment of a reassembled PDU]
135   0.019572 172.31.8.238 -> 54.230.116.82 TCP 66 59972 > http [ACK] Seq=97 Ack=827266 Win=1254656 Len=0 TSval=6927238 TSecr=1682782465
136   0.019609 54.230.116.82 -> 172.31.8.238 TCP 21786 [TCP segment of a reassembled PDU]
137   0.019622 172.31.8.238 -> 54.230.116.82 TCP 66 59972 > http [ACK] Seq=97 Ack=848986 Win=1261824 Len=0 TSval=6927238 TSecr=1682782465
138   0.019746 54.230.116.82 -> 172.31.8.238 TCP 26130 [TCP segment of a reassembled PDU]
139   0.019764 54.230.116.82 -> 172.31.8.238 TCP 8754 [TCP segment of a reassembled PDU]
140   0.019825 172.31.8.238 -> 54.230.116.82 TCP 66 59972 > http [ACK] Seq=97 Ack=883738 Win=1240320 Len=0 TSval=6927238 TSecr=1682782465
141   0.020360 54.230.116.82 -> 172.31.8.238 TCP 7306 [TCP segment of a reassembled PDU]
142   0.020368 172.31.8.238 -> 54.230.116.82 TCP 66 59972 > http [ACK] Seq=97 Ack=890978 Win=1285632 Len=0 TSval=6927238 TSecr=1682782465
143   0.020535 54.230.116.82 -> 172.31.8.238 TCP 20338 [TCP segment of a reassembled PDU]
144   0.020562 54.230.116.82 -> 172.31.8.238 TCP 5858 [TCP segment of a reassembled PDU]
145   0.020569 172.31.8.238 -> 54.230.116.82 TCP 66 59972 > http [ACK] Seq=97 Ack=911250 Win=1265408 Len=0 TSval=6927238 TSecr=1682782465
146   0.020582 172.31.8.238 -> 54.230.116.82 TCP 66 59972 > http [ACK] Seq=97 Ack=917042 Win=1290240 Len=0 TSval=6927238 TSecr=1682782465
147   0.020784 54.230.116.82 -> 172.31.8.238 TCP 52194 [TCP segment of a reassembled PDU]
148   0.020814 54.230.116.82 -> 172.31.8.238 TCP 8754 [TCP segment of a reassembled PDU]
149   0.020833 172.31.8.238 -> 54.230.116.82 TCP 66 59972 > http [ACK] Seq=97 Ack=977858 Win=1229440 Len=0 TSval=6927238 TSecr=1682782465
150   0.021150 54.230.116.82 -> 172.31.8.238 TCP 8754 [TCP segment of a reassembled PDU]
151   0.021159 172.31.8.238 -> 54.230.116.82 TCP 66 59972 > http [ACK] Seq=97 Ack=986546 Win=1283200 Len=0 TSval=6927238 TSecr=1682782465
152   0.021348 54.230.116.82 -> 172.31.8.238 TCP 26130 [TCP segment of a reassembled PDU]
153   0.021375 54.230.116.82 -> 172.31.8.238 TCP 10202 [TCP segment of a reassembled PDU]
154   0.021403 172.31.8.238 -> 54.230.116.82 TCP 66 59972 > http [ACK] Seq=97 Ack=1022746 Win=1247104 Len=0 TSval=6927238 TSecr=1682782465
155   0.021465 54.230.116.82 -> 172.31.8.238 TCP 26130 [TCP segment of a reassembled PDU]
156   0.021482 172.31.8.238 -> 54.230.116.82 TCP 66 59972 > http [ACK] Seq=97 Ack=1048810 Win=1254656 Len=0 TSval=6927238 TSecr=1682782465
157   0.021506 54.230.116.82 -> 172.31.8.238 HTTP 290 HTTP/1.1 200 OK  (application/octet-stream)
158   0.021518 172.31.8.238 -> 54.230.116.82 TCP 66 59972 > http [ACK] Seq=97 Ack=1049034 Win=1290240 Len=0 TSval=6927238 TSecr=1682782465
159   0.021651 172.31.8.238 -> 54.230.116.82 TCP 66 59972 > http [FIN, ACK] Seq=97 Ack=1049034 Win=1290240 Len=0 TSval=6927238 TSecr=1682782465
160   0.022127 54.230.116.82 -> 172.31.8.238 TCP 66 http > 59972 [FIN, ACK] Seq=1049034 Ack=98 Win=14592 Len=0 TSval=1682782465 TSecr=6927238
161   0.022136 172.31.8.238 -> 54.230.116.82 TCP 66 59972 > http [ACK] Seq=98 Ack=1049035 Win=1290240 Len=0 TSval=6927238 TSecr=1682782465
