[Measurement for 1mb at 07:41:20 20.41.2014] 
Tshark:

  1   0.000000 172.31.8.238 -> 172.31.0.2   DNS 89 Standard query 0xba7b  A d1xvcg6dfvgaki.cloudfront.net
  2   0.000040 172.31.8.238 -> 172.31.0.2   DNS 89 Standard query 0xe9e9  AAAA d1xvcg6dfvgaki.cloudfront.net
  3   0.000577   172.31.0.2 -> 172.31.8.238 DNS 217 Standard query response 0xba7b  A 54.230.118.248 A 54.230.119.3 A 54.192.118.220 A 54.192.118.247 A 54.230.116.73 A 54.230.116.204 A 54.230.117.21 A 54.230.117.42
  4   0.000599   172.31.0.2 -> 172.31.8.238 DNS 170 Standard query response 0xe9e9 
  5   0.003850 172.31.8.238 -> 54.230.118.248 TCP 74 59296 > http [SYN] Seq=0 Win=26883 Len=0 MSS=8961 SACK_PERM=1 TSval=13227163 TSecr=0 WS=128
  6   0.004628 54.230.118.248 -> 172.31.8.238 TCP 74 http > 59296 [SYN, ACK] Seq=0 Ack=1 Win=14480 Len=0 MSS=1460 SACK_PERM=1 TSval=1685824770 TSecr=13227163 WS=128
  7   0.004642 172.31.8.238 -> 54.230.118.248 TCP 66 59296 > http [ACK] Seq=1 Ack=1 Win=27008 Len=0 TSval=13227163 TSecr=1685824770
  8   0.004682 172.31.8.238 -> 54.230.118.248 HTTP 162 GET /1mb HTTP/1.1 
  9   0.005353 54.230.118.248 -> 172.31.8.238 TCP 66 http > 59296 [ACK] Seq=1 Ack=97 Win=14592 Len=0 TSval=1685824770 TSecr=13227163
 10   0.006771 54.230.118.248 -> 172.31.8.238 TCP 13098 [TCP segment of a reassembled PDU]
 11   0.006783 172.31.8.238 -> 54.230.118.248 TCP 66 59296 > http [ACK] Seq=97 Ack=13033 Win=52992 Len=0 TSval=13227164 TSecr=1685824770
 12   0.007545 54.230.118.248 -> 172.31.8.238 TCP 5858 [TCP segment of a reassembled PDU]
 13   0.007553 172.31.8.238 -> 54.230.118.248 TCP 66 59296 > http [ACK] Seq=97 Ack=18825 Win=64640 Len=0 TSval=13227164 TSecr=1685824770
 14   0.007613 54.230.118.248 -> 172.31.8.238 TCP 7306 [TCP segment of a reassembled PDU]
 15   0.007629 172.31.8.238 -> 54.230.118.248 TCP 66 59296 > http [ACK] Seq=97 Ack=26065 Win=79104 Len=0 TSval=13227164 TSecr=1685824770
 16   0.008086 54.230.118.248 -> 172.31.8.238 TCP 7306 [TCP segment of a reassembled PDU]
 17   0.008094 172.31.8.238 -> 54.230.118.248 TCP 66 59296 > http [ACK] Seq=97 Ack=33305 Win=93568 Len=0 TSval=13227164 TSecr=1685824771
 18   0.008199 54.230.118.248 -> 172.31.8.238 TCP 2962 [TCP segment of a reassembled PDU]
 19   0.008205 172.31.8.238 -> 54.230.118.248 TCP 66 59296 > http [ACK] Seq=97 Ack=36201 Win=99328 Len=0 TSval=13227164 TSecr=1685824771
 20   0.008336 54.230.118.248 -> 172.31.8.238 TCP 2962 [TCP segment of a reassembled PDU]
 21   0.008342 172.31.8.238 -> 54.230.118.248 TCP 66 59296 > http [ACK] Seq=97 Ack=39097 Win=105088 Len=0 TSval=13227164 TSecr=1685824771
 22   0.008625 54.230.118.248 -> 172.31.8.238 TCP 5858 [TCP segment of a reassembled PDU]
 23   0.008632 172.31.8.238 -> 54.230.118.248 TCP 66 59296 > http [ACK] Seq=97 Ack=44889 Win=108416 Len=0 TSval=13227164 TSecr=1685824771
 24   0.008740 54.230.118.248 -> 172.31.8.238 TCP 7306 [TCP segment of a reassembled PDU]
 25   0.008747 172.31.8.238 -> 54.230.118.248 TCP 66 59296 > http [ACK] Seq=97 Ack=52129 Win=105984 Len=0 TSval=13227164 TSecr=1685824771
 26   0.008874 54.230.118.248 -> 172.31.8.238 TCP 2962 [TCP segment of a reassembled PDU]
 27   0.008879 172.31.8.238 -> 54.230.118.248 TCP 66 59296 > http [ACK] Seq=97 Ack=55025 Win=109056 Len=0 TSval=13227164 TSecr=1685824771
 28   0.008982 54.230.118.248 -> 172.31.8.238 TCP 7306 [TCP segment of a reassembled PDU]
 29   0.008989 172.31.8.238 -> 54.230.118.248 TCP 66 59296 > http [ACK] Seq=97 Ack=62265 Win=105984 Len=0 TSval=13227164 TSecr=1685824771
 30   0.009367 54.230.118.248 -> 172.31.8.238 TCP 7306 [TCP segment of a reassembled PDU]
 31   0.009374 172.31.8.238 -> 54.230.118.248 TCP 66 59296 > http [ACK] Seq=97 Ack=69505 Win=105984 Len=0 TSval=13227164 TSecr=1685824771
 32   0.009472 54.230.118.248 -> 172.31.8.238 TCP 8754 [TCP segment of a reassembled PDU]
 33   0.009479 172.31.8.238 -> 54.230.118.248 TCP 66 59296 > http [ACK] Seq=97 Ack=78193 Win=103680 Len=0 TSval=13227164 TSecr=1685824771
 34   0.009621 54.230.118.248 -> 172.31.8.238 TCP 2962 [TCP segment of a reassembled PDU]
 35   0.009626 172.31.8.238 -> 54.230.118.248 TCP 66 59296 > http [ACK] Seq=97 Ack=81089 Win=109056 Len=0 TSval=13227164 TSecr=1685824771
 36   0.009729 54.230.118.248 -> 172.31.8.238 TCP 10202 [TCP segment of a reassembled PDU]
 37   0.009737 172.31.8.238 -> 54.230.118.248 TCP 66 59296 > http [ACK] Seq=97 Ack=91225 Win=101248 Len=0 TSval=13227164 TSecr=1685824771
 38   0.010400 54.230.118.248 -> 172.31.8.238 TCP 7306 [TCP segment of a reassembled PDU]
 39   0.010407 172.31.8.238 -> 54.230.118.248 TCP 66 59296 > http [ACK] Seq=97 Ack=98465 Win=105984 Len=0 TSval=13227164 TSecr=1685824771
 40   0.010568 54.230.118.248 -> 172.31.8.238 TCP 26130 [TCP segment of a reassembled PDU]
 41   0.010585 54.230.118.248 -> 172.31.8.238 TCP 1514 [TCP segment of a reassembled PDU]
 42   0.010824 172.31.8.238 -> 54.230.118.248 TCP 66 59296 > http [ACK] Seq=97 Ack=125977 Win=109056 Len=0 TSval=13227165 TSecr=1685824771
 43   0.010990 54.230.118.248 -> 172.31.8.238 TCP 2962 [TCP segment of a reassembled PDU]
 44   0.010996 172.31.8.238 -> 54.230.118.248 TCP 66 59296 > http [ACK] Seq=97 Ack=128873 Win=114816 Len=0 TSval=13227165 TSecr=1685824771
 45   0.011086 54.230.118.248 -> 172.31.8.238 TCP 1514 [TCP segment of a reassembled PDU]
 46   0.011091 172.31.8.238 -> 54.230.118.248 TCP 66 59296 > http [ACK] Seq=97 Ack=130321 Win=117760 Len=0 TSval=13227165 TSecr=1685824771
 47   0.011444 54.230.118.248 -> 172.31.8.238 TCP 10202 [TCP segment of a reassembled PDU]
 48   0.011453 172.31.8.238 -> 54.230.118.248 TCP 66 59296 > http [ACK] Seq=97 Ack=140457 Win=137984 Len=0 TSval=13227165 TSecr=1685824771
 49   0.011576 54.230.118.248 -> 172.31.8.238 TCP 15994 [TCP segment of a reassembled PDU]
 50   0.011587 172.31.8.238 -> 54.230.118.248 TCP 66 59296 > http [ACK] Seq=97 Ack=156385 Win=169856 Len=0 TSval=13227165 TSecr=1685824771
 51   0.011748 54.230.118.248 -> 172.31.8.238 TCP 14546 [TCP segment of a reassembled PDU]
 52   0.011758 172.31.8.238 -> 54.230.118.248 TCP 66 59296 > http [ACK] Seq=97 Ack=170865 Win=198784 Len=0 TSval=13227165 TSecr=1685824771
 53   0.012177 54.230.118.248 -> 172.31.8.238 TCP 8754 [TCP segment of a reassembled PDU]
 54   0.012185 172.31.8.238 -> 54.230.118.248 TCP 66 59296 > http [ACK] Seq=97 Ack=179553 Win=216192 Len=0 TSval=13227165 TSecr=1685824771
 55   0.012281 54.230.118.248 -> 172.31.8.238 TCP 2962 [TCP segment of a reassembled PDU]
 56   0.012287 172.31.8.238 -> 54.230.118.248 TCP 66 59296 > http [ACK] Seq=97 Ack=182449 Win=221952 Len=0 TSval=13227165 TSecr=1685824771
 57   0.012398 54.230.118.248 -> 172.31.8.238 TCP 17442 [TCP segment of a reassembled PDU]
 58   0.012410 172.31.8.238 -> 54.230.118.248 TCP 66 59296 > http [ACK] Seq=97 Ack=199825 Win=256768 Len=0 TSval=13227165 TSecr=1685824771
 59   0.012535 54.230.118.248 -> 172.31.8.238 TCP 8754 [TCP segment of a reassembled PDU]
 60   0.012543 172.31.8.238 -> 54.230.118.248 TCP 66 59296 > http [ACK] Seq=97 Ack=208513 Win=274176 Len=0 TSval=13227165 TSecr=1685824771
 61   0.012738 54.230.118.248 -> 172.31.8.238 TCP 17442 [TCP segment of a reassembled PDU]
 62   0.012749 172.31.8.238 -> 54.230.118.248 TCP 66 59296 > http [ACK] Seq=97 Ack=225889 Win=308864 Len=0 TSval=13227165 TSecr=1685824771
 63   0.013063 54.230.118.248 -> 172.31.8.238 TCP 23234 [TCP segment of a reassembled PDU]
 64   0.013077 172.31.8.238 -> 54.230.118.248 TCP 66 59296 > http [ACK] Seq=97 Ack=249057 Win=355200 Len=0 TSval=13227165 TSecr=1685824771
 65   0.013473 54.230.118.248 -> 172.31.8.238 TCP 4410 [TCP segment of a reassembled PDU]
 66   0.013479 172.31.8.238 -> 54.230.118.248 TCP 66 59296 > http [ACK] Seq=97 Ack=253401 Win=363904 Len=0 TSval=13227165 TSecr=1685824771
 67   0.013603 54.230.118.248 -> 172.31.8.238 TCP 8754 [TCP segment of a reassembled PDU]
 68   0.013623 172.31.8.238 -> 54.230.118.248 TCP 66 59296 > http [ACK] Seq=97 Ack=262089 Win=381312 Len=0 TSval=13227165 TSecr=1685824771
 69   0.013720 54.230.118.248 -> 172.31.8.238 TCP 4410 [TCP segment of a reassembled PDU]
 70   0.013726 172.31.8.238 -> 54.230.118.248 TCP 66 59296 > http [ACK] Seq=97 Ack=266433 Win=390016 Len=0 TSval=13227165 TSecr=1685824771
 71   0.013884 54.230.118.248 -> 172.31.8.238 TCP 21786 [TCP segment of a reassembled PDU]
 72   0.013897 172.31.8.238 -> 54.230.118.248 TCP 66 59296 > http [ACK] Seq=97 Ack=288153 Win=433408 Len=0 TSval=13227165 TSecr=1685824771
 73   0.013919 54.230.118.248 -> 172.31.8.238 TCP 4410 [TCP segment of a reassembled PDU]
 74   0.013932 172.31.8.238 -> 54.230.118.248 TCP 66 59296 > http [ACK] Seq=97 Ack=292497 Win=442112 Len=0 TSval=13227165 TSecr=1685824771
 75   0.014000 54.230.118.248 -> 172.31.8.238 TCP 10202 [TCP segment of a reassembled PDU]
 76   0.014010 172.31.8.238 -> 54.230.118.248 TCP 66 59296 > http [ACK] Seq=97 Ack=302633 Win=462336 Len=0 TSval=13227165 TSecr=1685824771
 77   0.014327 54.230.118.248 -> 172.31.8.238 TCP 13098 [TCP segment of a reassembled PDU]
 78   0.014336 172.31.8.238 -> 54.230.118.248 TCP 66 59296 > http [ACK] Seq=97 Ack=315665 Win=488448 Len=0 TSval=13227165 TSecr=1685824771
 79   0.014494 54.230.118.248 -> 172.31.8.238 TCP 10202 [TCP segment of a reassembled PDU]
 80   0.014502 172.31.8.238 -> 54.230.118.248 TCP 66 59296 > http [ACK] Seq=97 Ack=325801 Win=508672 Len=0 TSval=13227165 TSecr=1685824771
 81   0.014662 54.230.118.248 -> 172.31.8.238 TCP 21786 [TCP segment of a reassembled PDU]
 82   0.014674 172.31.8.238 -> 54.230.118.248 TCP 66 59296 > http [ACK] Seq=97 Ack=347521 Win=552192 Len=0 TSval=13227166 TSecr=1685824771
 83   0.015000 54.230.118.248 -> 172.31.8.238 TCP 7306 [TCP segment of a reassembled PDU]
 84   0.015008 172.31.8.238 -> 54.230.118.248 TCP 66 59296 > http [ACK] Seq=97 Ack=354761 Win=566656 Len=0 TSval=13227166 TSecr=1685824771
 85   0.015176 54.230.118.248 -> 172.31.8.238 TCP 26130 [TCP segment of a reassembled PDU]
 86   0.015188 172.31.8.238 -> 54.230.118.248 TCP 66 59296 > http [ACK] Seq=97 Ack=380825 Win=618752 Len=0 TSval=13227166 TSecr=1685824771
 87   0.015218 54.230.118.248 -> 172.31.8.238 TCP 10202 [TCP segment of a reassembled PDU]
 88   0.015226 172.31.8.238 -> 54.230.118.248 TCP 66 59296 > http [ACK] Seq=97 Ack=390961 Win=638976 Len=0 TSval=13227166 TSecr=1685824771
 89   0.015355 54.230.118.248 -> 172.31.8.238 TCP 18890 [TCP segment of a reassembled PDU]
 90   0.015367 172.31.8.238 -> 54.230.118.248 TCP 66 59296 > http [ACK] Seq=97 Ack=409785 Win=676736 Len=0 TSval=13227166 TSecr=1685824771
 91   0.015374 54.230.118.248 -> 172.31.8.238 TCP 4410 [TCP segment of a reassembled PDU]
 92   0.015381 172.31.8.238 -> 54.230.118.248 TCP 66 59296 > http [ACK] Seq=97 Ack=414129 Win=685312 Len=0 TSval=13227166 TSecr=1685824771
 93   0.015769 54.230.118.248 -> 172.31.8.238 TCP 11650 [TCP segment of a reassembled PDU]
 94   0.015778 172.31.8.238 -> 54.230.118.248 TCP 66 59296 > http [ACK] Seq=97 Ack=425713 Win=708480 Len=0 TSval=13227166 TSecr=1685824771
 95   0.015928 54.230.118.248 -> 172.31.8.238 TCP 24682 [TCP segment of a reassembled PDU]
 96   0.015942 172.31.8.238 -> 54.230.118.248 TCP 66 59296 > http [ACK] Seq=97 Ack=450329 Win=757760 Len=0 TSval=13227166 TSecr=1685824771
 97   0.016038 54.230.118.248 -> 172.31.8.238 TCP 10202 [TCP segment of a reassembled PDU]
 98   0.016046 172.31.8.238 -> 54.230.118.248 TCP 66 59296 > http [ACK] Seq=97 Ack=460465 Win=777984 Len=0 TSval=13227166 TSecr=1685824771
 99   0.016183 54.230.118.248 -> 172.31.8.238 TCP 21786 [TCP segment of a reassembled PDU]
100   0.016195 172.31.8.238 -> 54.230.118.248 TCP 66 59296 > http [ACK] Seq=97 Ack=482185 Win=821504 Len=0 TSval=13227166 TSecr=1685824771
101   0.016549 54.230.118.248 -> 172.31.8.238 TCP 7306 [TCP segment of a reassembled PDU]
102   0.016556 172.31.8.238 -> 54.230.118.248 TCP 66 59296 > http [ACK] Seq=97 Ack=489425 Win=835968 Len=0 TSval=13227166 TSecr=1685824771
103   0.016717 54.230.118.248 -> 172.31.8.238 TCP 26130 [TCP segment of a reassembled PDU]
104   0.016731 172.31.8.238 -> 54.230.118.248 TCP 66 59296 > http [ACK] Seq=97 Ack=515489 Win=888064 Len=0 TSval=13227166 TSecr=1685824771
105   0.016779 54.230.118.248 -> 172.31.8.238 TCP 23234 [TCP segment of a reassembled PDU]
106   0.016789 172.31.8.238 -> 54.230.118.248 TCP 66 59296 > http [ACK] Seq=97 Ack=538657 Win=934400 Len=0 TSval=13227166 TSecr=1685824771
107   0.017284 54.230.118.248 -> 172.31.8.238 TCP 7306 [TCP segment of a reassembled PDU]
108   0.017290 172.31.8.238 -> 54.230.118.248 TCP 66 59296 > http [ACK] Seq=97 Ack=545897 Win=948864 Len=0 TSval=13227166 TSecr=1685824771
109   0.017466 54.230.118.248 -> 172.31.8.238 TCP 26130 [TCP segment of a reassembled PDU]
110   0.017479 172.31.8.238 -> 54.230.118.248 TCP 66 59296 > http [ACK] Seq=97 Ack=571961 Win=1001088 Len=0 TSval=13227166 TSecr=1685824771
111   0.017538 54.230.118.248 -> 172.31.8.238 TCP 23234 [TCP segment of a reassembled PDU]
112   0.017550 172.31.8.238 -> 54.230.118.248 TCP 66 59296 > http [ACK] Seq=97 Ack=595129 Win=1047424 Len=0 TSval=13227166 TSecr=1685824771
113   0.017881 54.230.118.248 -> 172.31.8.238 TCP 26130 [TCP segment of a reassembled PDU]
114   0.017896 172.31.8.238 -> 54.230.118.248 TCP 66 59296 > http [ACK] Seq=97 Ack=621193 Win=1099520 Len=0 TSval=13227166 TSecr=1685824772
115   0.017919 54.230.118.248 -> 172.31.8.238 TCP 10202 [TCP segment of a reassembled PDU]
116   0.017926 172.31.8.238 -> 54.230.118.248 TCP 66 59296 > http [ACK] Seq=97 Ack=631329 Win=1119744 Len=0 TSval=13227166 TSecr=1685824772
117   0.018098 54.230.118.248 -> 172.31.8.238 TCP 4410 [TCP segment of a reassembled PDU]
118   0.018104 172.31.8.238 -> 54.230.118.248 TCP 66 59296 > http [ACK] Seq=97 Ack=635673 Win=1128448 Len=0 TSval=13227166 TSecr=1685824772
119   0.018264 54.230.118.248 -> 172.31.8.238 TCP 24682 [TCP segment of a reassembled PDU]
120   0.018277 172.31.8.238 -> 54.230.118.248 TCP 66 59296 > http [ACK] Seq=97 Ack=660289 Win=1157888 Len=0 TSval=13227166 TSecr=1685824772
121   0.018413 54.230.118.248 -> 172.31.8.238 TCP 23234 [TCP segment of a reassembled PDU]
122   0.018426 172.31.8.238 -> 54.230.118.248 TCP 66 59296 > http [ACK] Seq=97 Ack=683457 Win=1160320 Len=0 TSval=13227166 TSecr=1685824772
123   0.018442 54.230.118.248 -> 172.31.8.238 TCP 2962 [TCP segment of a reassembled PDU]
124   0.018455 172.31.8.238 -> 54.230.118.248 TCP 66 59296 > http [ACK] Seq=97 Ack=686353 Win=1157504 Len=0 TSval=13227166 TSecr=1685824772
125   0.018527 54.230.118.248 -> 172.31.8.238 TCP 24682 [TCP segment of a reassembled PDU]
126   0.018539 172.31.8.238 -> 54.230.118.248 TCP 66 59296 > http [ACK] Seq=97 Ack=710969 Win=1157888 Len=0 TSval=13227166 TSecr=1685824772
127   0.018659 54.230.118.248 -> 172.31.8.238 TCP 14546 [TCP segment of a reassembled PDU]
128   0.018668 172.31.8.238 -> 54.230.118.248 TCP 66 59296 > http [ACK] Seq=97 Ack=725449 Win=1206656 Len=0 TSval=13227167 TSecr=1685824772
129   0.019156 54.230.118.248 -> 172.31.8.238 TCP 1514 [TCP segment of a reassembled PDU]
130   0.019162 172.31.8.238 -> 54.230.118.248 TCP 66 59296 > http [ACK] Seq=97 Ack=726897 Win=1209600 Len=0 TSval=13227167 TSecr=1685824772
131   0.019342 54.230.118.248 -> 172.31.8.238 TCP 18890 [TCP segment of a reassembled PDU]
132   0.019353 172.31.8.238 -> 54.230.118.248 TCP 66 59296 > http [ACK] Seq=97 Ack=745721 Win=1247232 Len=0 TSval=13227167 TSecr=1685824772
133   0.019434 54.230.118.248 -> 172.31.8.238 TCP 7306 [TCP segment of a reassembled PDU]
134   0.019441 172.31.8.238 -> 54.230.118.248 TCP 66 59296 > http [ACK] Seq=97 Ack=752961 Win=1261696 Len=0 TSval=13227167 TSecr=1685824772
135   0.019468 54.230.118.248 -> 172.31.8.238 TCP 26130 [TCP segment of a reassembled PDU]
136   0.019481 172.31.8.238 -> 54.230.118.248 TCP 66 59296 > http [ACK] Seq=97 Ack=779025 Win=1313792 Len=0 TSval=13227167 TSecr=1685824772
137   0.019537 54.230.118.248 -> 172.31.8.238 TCP 11650 [TCP segment of a reassembled PDU]
138   0.019546 172.31.8.238 -> 54.230.118.248 TCP 66 59296 > http [ACK] Seq=97 Ack=790609 Win=1336960 Len=0 TSval=13227167 TSecr=1685824772
139   0.019614 54.230.118.248 -> 172.31.8.238 TCP 17442 [TCP segment of a reassembled PDU]
140   0.019634 172.31.8.238 -> 54.230.118.248 TCP 66 59296 > http [ACK] Seq=97 Ack=807985 Win=1371776 Len=0 TSval=13227167 TSecr=1685824772
141   0.019660 54.230.118.248 -> 172.31.8.238 TCP 8754 [TCP segment of a reassembled PDU]
142   0.019666 172.31.8.238 -> 54.230.118.248 TCP 66 59296 > http [ACK] Seq=97 Ack=816673 Win=1389056 Len=0 TSval=13227167 TSecr=1685824772
143   0.019728 54.230.118.248 -> 172.31.8.238 TCP 8754 [TCP segment of a reassembled PDU]
144   0.019735 172.31.8.238 -> 54.230.118.248 TCP 66 59296 > http [ACK] Seq=97 Ack=825361 Win=1406464 Len=0 TSval=13227167 TSecr=1685824772
145   0.020155 54.230.118.248 -> 172.31.8.238 TCP 4410 [TCP segment of a reassembled PDU]
146   0.020162 172.31.8.238 -> 54.230.118.248 TCP 66 59296 > http [ACK] Seq=97 Ack=829705 Win=1415168 Len=0 TSval=13227167 TSecr=1685824772
147   0.020283 54.230.118.248 -> 172.31.8.238 TCP 26130 [TCP segment of a reassembled PDU]
148   0.020296 172.31.8.238 -> 54.230.118.248 TCP 66 59296 > http [ACK] Seq=97 Ack=855769 Win=1467264 Len=0 TSval=13227167 TSecr=1685824772
149   0.020355 54.230.118.248 -> 172.31.8.238 TCP 26130 [TCP segment of a reassembled PDU]
150   0.020372 172.31.8.238 -> 54.230.118.248 TCP 66 59296 > http [ACK] Seq=97 Ack=881833 Win=1519360 Len=0 TSval=13227167 TSecr=1685824772
151   0.020445 54.230.118.248 -> 172.31.8.238 TCP 26130 [TCP segment of a reassembled PDU]
152   0.020459 172.31.8.238 -> 54.230.118.248 TCP 66 59296 > http [ACK] Seq=97 Ack=907897 Win=1571584 Len=0 TSval=13227167 TSecr=1685824772
153   0.020506 54.230.118.248 -> 172.31.8.238 TCP 13098 [TCP segment of a reassembled PDU]
154   0.020515 172.31.8.238 -> 54.230.118.248 TCP 66 59296 > http [ACK] Seq=97 Ack=920929 Win=1597568 Len=0 TSval=13227167 TSecr=1685824772
155   0.020894 54.230.118.248 -> 172.31.8.238 TCP 13098 [TCP segment of a reassembled PDU]
156   0.020903 172.31.8.238 -> 54.230.118.248 TCP 66 59296 > http [ACK] Seq=97 Ack=933961 Win=1597568 Len=0 TSval=13227167 TSecr=1685824772
157   0.021064 54.230.118.248 -> 172.31.8.238 TCP 26130 [TCP segment of a reassembled PDU]
158   0.021078 172.31.8.238 -> 54.230.118.248 TCP 66 59296 > http [ACK] Seq=97 Ack=960025 Win=1597568 Len=0 TSval=13227167 TSecr=1685824772
159   0.021148 54.230.118.248 -> 172.31.8.238 TCP 26130 [TCP segment of a reassembled PDU]
160   0.021161 172.31.8.238 -> 54.230.118.248 TCP 66 59296 > http [ACK] Seq=97 Ack=986089 Win=1597568 Len=0 TSval=13227167 TSecr=1685824772
161   0.021205 54.230.118.248 -> 172.31.8.238 TCP 11650 [TCP segment of a reassembled PDU]
162   0.021213 172.31.8.238 -> 54.230.118.248 TCP 66 59296 > http [ACK] Seq=97 Ack=997673 Win=1597568 Len=0 TSval=13227167 TSecr=1685824772
163   0.021354 54.230.118.248 -> 172.31.8.238 TCP 24682 [TCP segment of a reassembled PDU]
164   0.021367 172.31.8.238 -> 54.230.118.248 TCP 66 59296 > http [ACK] Seq=97 Ack=1022289 Win=1597568 Len=0 TSval=13227167 TSecr=1685824772
165   0.021375 54.230.118.248 -> 172.31.8.238 TCP 1514 [TCP segment of a reassembled PDU]
166   0.021426 54.230.118.248 -> 172.31.8.238 TCP 1514 [TCP segment of a reassembled PDU]
167   0.021431 172.31.8.238 -> 54.230.118.248 TCP 66 59296 > http [ACK] Seq=97 Ack=1025185 Win=1597568 Len=0 TSval=13227167 TSecr=1685824772
168   0.021704 54.230.118.248 -> 172.31.8.238 TCP 20338 [TCP segment of a reassembled PDU]
169   0.021716 172.31.8.238 -> 54.230.118.248 TCP 66 59296 > http [ACK] Seq=97 Ack=1045457 Win=1597568 Len=0 TSval=13227167 TSecr=1685824772
170   0.021803 54.230.118.248 -> 172.31.8.238 HTTP 3643 HTTP/1.1 200 OK  (application/octet-stream)
171   0.021809 172.31.8.238 -> 54.230.118.248 TCP 66 59296 > http [ACK] Seq=97 Ack=1049034 Win=1597568 Len=0 TSval=13227167 TSecr=1685824772
172   0.021929 172.31.8.238 -> 54.230.118.248 TCP 66 59296 > http [FIN, ACK] Seq=97 Ack=1049034 Win=1597568 Len=0 TSval=13227167 TSecr=1685824772
173   0.022402 54.230.118.248 -> 172.31.8.238 TCP 66 http > 59296 [FIN, ACK] Seq=1049034 Ack=98 Win=14592 Len=0 TSval=1685824772 TSecr=13227167
174   0.022409 172.31.8.238 -> 54.230.118.248 TCP 66 59296 > http [ACK] Seq=98 Ack=1049035 Win=1597568 Len=0 TSval=13227167 TSecr=1685824772
