[Measurement for 1mb at 10:41:20 20.41.2014] 
Tshark:

  1   0.000000 172.31.8.238 -> 172.31.0.2   DNS 89 Standard query 0x7bb8  A d1xvcg6dfvgaki.cloudfront.net
  2   0.000030 172.31.8.238 -> 172.31.0.2   DNS 89 Standard query 0x635c  AAAA d1xvcg6dfvgaki.cloudfront.net
  3   0.001963   172.31.0.2 -> 172.31.8.238 DNS 217 Standard query response 0x7bb8  A 54.239.132.250 A 54.192.118.236 A 54.192.118.247 A 54.230.117.156 A 54.230.118.248 A 54.230.119.86 A 54.230.119.165 A 54.239.132.98
  4   0.001974   172.31.0.2 -> 172.31.8.238 DNS 170 Standard query response 0x635c 
  5   0.003864 172.31.8.238 -> 54.239.132.250 TCP 74 41293 > http [SYN] Seq=0 Win=26883 Len=0 MSS=8961 SACK_PERM=1 TSval=15927164 TSecr=0 WS=128
  6   0.004718 54.239.132.250 -> 172.31.8.238 TCP 74 http > 41293 [SYN, ACK] Seq=0 Ack=1 Win=14480 Len=0 MSS=1460 SACK_PERM=1 TSval=1684507776 TSecr=15927164 WS=128
  7   0.004732 172.31.8.238 -> 54.239.132.250 TCP 66 41293 > http [ACK] Seq=1 Ack=1 Win=27008 Len=0 TSval=15927165 TSecr=1684507776
  8   0.004794 172.31.8.238 -> 54.239.132.250 HTTP 162 GET /1mb HTTP/1.1 
  9   0.005192 54.239.132.250 -> 172.31.8.238 TCP 66 http > 41293 [ACK] Seq=1 Ack=97 Win=14592 Len=0 TSval=1684507776 TSecr=15927165
 10   0.008093 54.239.132.250 -> 172.31.8.238 TCP 7306 [TCP segment of a reassembled PDU]
 11   0.008103 172.31.8.238 -> 54.239.132.250 TCP 66 41293 > http [ACK] Seq=97 Ack=7241 Win=41472 Len=0 TSval=15927166 TSecr=1684507776
 12   0.008146 54.239.132.250 -> 172.31.8.238 TCP 5858 [TCP segment of a reassembled PDU]
 13   0.008153 172.31.8.238 -> 54.239.132.250 TCP 66 41293 > http [ACK] Seq=97 Ack=13033 Win=52992 Len=0 TSval=15927166 TSecr=1684507776
 14   0.008688 54.239.132.250 -> 172.31.8.238 TCP 13098 [TCP segment of a reassembled PDU]
 15   0.008699 172.31.8.238 -> 54.239.132.250 TCP 66 41293 > http [ACK] Seq=97 Ack=26065 Win=79104 Len=0 TSval=15927166 TSecr=1684507776
 16   0.009372 54.239.132.250 -> 172.31.8.238 TCP 7306 [TCP segment of a reassembled PDU]
 17   0.009379 172.31.8.238 -> 54.239.132.250 TCP 66 41293 > http [ACK] Seq=97 Ack=33305 Win=93568 Len=0 TSval=15927166 TSecr=1684507776
 18   0.009466 54.239.132.250 -> 172.31.8.238 TCP 5858 [TCP segment of a reassembled PDU]
 19   0.009473 172.31.8.238 -> 54.239.132.250 TCP 66 41293 > http [ACK] Seq=97 Ack=39097 Win=105088 Len=0 TSval=15927166 TSecr=1684507776
 20   0.009839 54.239.132.250 -> 172.31.8.238 TCP 2962 [TCP segment of a reassembled PDU]
 21   0.009844 172.31.8.238 -> 54.239.132.250 TCP 66 41293 > http [ACK] Seq=97 Ack=41993 Win=109056 Len=0 TSval=15927166 TSecr=1684507776
 22   0.009943 54.239.132.250 -> 172.31.8.238 TCP 10202 [TCP segment of a reassembled PDU]
 23   0.009951 172.31.8.238 -> 54.239.132.250 TCP 66 41293 > http [ACK] Seq=97 Ack=52129 Win=101248 Len=0 TSval=15927166 TSecr=1684507776
 24   0.009980 54.239.132.250 -> 172.31.8.238 TCP 8754 [TCP segment of a reassembled PDU]
 25   0.009990 172.31.8.238 -> 54.239.132.250 TCP 66 41293 > http [ACK] Seq=97 Ack=60817 Win=103680 Len=0 TSval=15927166 TSecr=1684507776
 26   0.010424 54.239.132.250 -> 172.31.8.238 TCP 10202 [TCP segment of a reassembled PDU]
 27   0.010431 172.31.8.238 -> 54.239.132.250 TCP 66 41293 > http [ACK] Seq=97 Ack=70953 Win=101248 Len=0 TSval=15927166 TSecr=1684507776
 28   0.010472 54.239.132.250 -> 172.31.8.238 TCP 5858 [TCP segment of a reassembled PDU]
 29   0.010479 172.31.8.238 -> 54.239.132.250 TCP 66 41293 > http [ACK] Seq=97 Ack=76745 Win=108416 Len=0 TSval=15927166 TSecr=1684507776
 30   0.010663 54.239.132.250 -> 172.31.8.238 TCP 10202 [TCP segment of a reassembled PDU]
 31   0.010671 172.31.8.238 -> 54.239.132.250 TCP 66 41293 > http [ACK] Seq=97 Ack=86881 Win=101248 Len=0 TSval=15927166 TSecr=1684507776
 32   0.010905 54.239.132.250 -> 172.31.8.238 TCP 11650 [TCP segment of a reassembled PDU]
 33   0.010913 172.31.8.238 -> 54.239.132.250 TCP 66 41293 > http [ACK] Seq=97 Ack=98465 Win=98944 Len=0 TSval=15927166 TSecr=1684507776
 34   0.011175 54.239.132.250 -> 172.31.8.238 TCP 5858 [TCP segment of a reassembled PDU]
 35   0.011182 172.31.8.238 -> 54.239.132.250 TCP 66 41293 > http [ACK] Seq=97 Ack=104257 Win=108416 Len=0 TSval=15927166 TSecr=1684507776
 36   0.011285 54.239.132.250 -> 172.31.8.238 TCP 13098 [TCP segment of a reassembled PDU]
 37   0.011294 172.31.8.238 -> 54.239.132.250 TCP 66 41293 > http [ACK] Seq=97 Ack=117289 Win=96512 Len=0 TSval=15927166 TSecr=1684507776
 38   0.011458 54.239.132.250 -> 172.31.8.238 TCP 13098 [TCP segment of a reassembled PDU]
 39   0.011466 172.31.8.238 -> 54.239.132.250 TCP 66 41293 > http [ACK] Seq=97 Ack=130321 Win=96512 Len=0 TSval=15927166 TSecr=1684507776
 40   0.011945 54.239.132.250 -> 172.31.8.238 TCP 7306 [TCP segment of a reassembled PDU]
 41   0.011952 172.31.8.238 -> 54.239.132.250 TCP 66 41293 > http [ACK] Seq=97 Ack=137561 Win=105984 Len=0 TSval=15927166 TSecr=1684507777
 42   0.012075 54.239.132.250 -> 172.31.8.238 TCP 18890 [TCP segment of a reassembled PDU]
 43   0.012100 172.31.8.238 -> 54.239.132.250 TCP 66 41293 > http [ACK] Seq=97 Ack=156385 Win=109056 Len=0 TSval=15927167 TSecr=1684507777
 44   0.012443 54.239.132.250 -> 172.31.8.238 TCP 4410 [TCP segment of a reassembled PDU]
 45   0.012449 172.31.8.238 -> 54.239.132.250 TCP 66 41293 > http [ACK] Seq=97 Ack=160729 Win=117760 Len=0 TSval=15927167 TSecr=1684507777
 46   0.012587 54.239.132.250 -> 172.31.8.238 TCP 14546 [TCP segment of a reassembled PDU]
 47   0.012596 172.31.8.238 -> 54.239.132.250 TCP 66 41293 > http [ACK] Seq=97 Ack=175209 Win=146688 Len=0 TSval=15927167 TSecr=1684507777
 48   0.012764 54.239.132.250 -> 172.31.8.238 TCP 7306 [TCP segment of a reassembled PDU]
 49   0.012771 172.31.8.238 -> 54.239.132.250 TCP 66 41293 > http [ACK] Seq=97 Ack=182449 Win=161152 Len=0 TSval=15927167 TSecr=1684507777
 50   0.012893 54.239.132.250 -> 172.31.8.238 TCP 13098 [TCP segment of a reassembled PDU]
 51   0.012902 172.31.8.238 -> 54.239.132.250 TCP 66 41293 > http [ACK] Seq=97 Ack=195481 Win=187264 Len=0 TSval=15927167 TSecr=1684507777
 52   0.013209 54.239.132.250 -> 172.31.8.238 TCP 2962 [TCP segment of a reassembled PDU]
 53   0.013214 172.31.8.238 -> 54.239.132.250 TCP 66 41293 > http [ACK] Seq=97 Ack=198377 Win=193024 Len=0 TSval=15927167 TSecr=1684507777
 54   0.013348 54.239.132.250 -> 172.31.8.238 TCP 10202 [TCP segment of a reassembled PDU]
 55   0.013356 172.31.8.238 -> 54.239.132.250 TCP 66 41293 > http [ACK] Seq=97 Ack=208513 Win=213376 Len=0 TSval=15927167 TSecr=1684507777
 56   0.013582 54.239.132.250 -> 172.31.8.238 TCP 17442 [TCP segment of a reassembled PDU]
 57   0.013593 172.31.8.238 -> 54.239.132.250 TCP 66 41293 > http [ACK] Seq=97 Ack=225889 Win=248064 Len=0 TSval=15927167 TSecr=1684507777
 58   0.013720 54.239.132.250 -> 172.31.8.238 TCP 10202 [TCP segment of a reassembled PDU]
 59   0.013728 172.31.8.238 -> 54.239.132.250 TCP 66 41293 > http [ACK] Seq=97 Ack=236025 Win=268288 Len=0 TSval=15927167 TSecr=1684507777
 60   0.013850 54.239.132.250 -> 172.31.8.238 TCP 8754 [TCP segment of a reassembled PDU]
 61   0.013857 172.31.8.238 -> 54.239.132.250 TCP 66 41293 > http [ACK] Seq=97 Ack=244713 Win=285696 Len=0 TSval=15927167 TSecr=1684507777
 62   0.014219 54.239.132.250 -> 172.31.8.238 TCP 2962 [TCP segment of a reassembled PDU]
 63   0.014224 172.31.8.238 -> 54.239.132.250 TCP 66 41293 > http [ACK] Seq=97 Ack=247609 Win=291456 Len=0 TSval=15927167 TSecr=1684507777
 64   0.014441 54.239.132.250 -> 172.31.8.238 TCP 26130 [TCP segment of a reassembled PDU]
 65   0.014455 172.31.8.238 -> 54.239.132.250 TCP 66 41293 > http [ACK] Seq=97 Ack=273673 Win=343680 Len=0 TSval=15927167 TSecr=1684507777
 66   0.014488 54.239.132.250 -> 172.31.8.238 TCP 13098 [TCP segment of a reassembled PDU]
 67   0.014496 172.31.8.238 -> 54.239.132.250 TCP 66 41293 > http [ACK] Seq=97 Ack=286705 Win=369664 Len=0 TSval=15927167 TSecr=1684507777
 68   0.014990 54.239.132.250 -> 172.31.8.238 TCP 1514 [TCP segment of a reassembled PDU]
 69   0.014995 172.31.8.238 -> 54.239.132.250 TCP 66 41293 > http [ACK] Seq=97 Ack=288153 Win=372608 Len=0 TSval=15927167 TSecr=1684507777
 70   0.015163 54.239.132.250 -> 172.31.8.238 TCP 26130 [TCP segment of a reassembled PDU]
 71   0.015177 172.31.8.238 -> 54.239.132.250 TCP 66 41293 > http [ACK] Seq=97 Ack=314217 Win=424704 Len=0 TSval=15927167 TSecr=1684507777
 72   0.015249 54.239.132.250 -> 172.31.8.238 TCP 21786 [TCP segment of a reassembled PDU]
 73   0.015261 172.31.8.238 -> 54.239.132.250 TCP 66 41293 > http [ACK] Seq=97 Ack=335937 Win=468224 Len=0 TSval=15927167 TSecr=1684507777
 74   0.015323 54.239.132.250 -> 172.31.8.238 TCP 7306 [TCP segment of a reassembled PDU]
 75   0.015331 172.31.8.238 -> 54.239.132.250 TCP 66 41293 > http [ACK] Seq=97 Ack=343177 Win=482688 Len=0 TSval=15927167 TSecr=1684507777
 76   0.015727 54.239.132.250 -> 172.31.8.238 TCP 2962 [TCP segment of a reassembled PDU]
 77   0.015733 172.31.8.238 -> 54.239.132.250 TCP 66 41293 > http [ACK] Seq=97 Ack=346073 Win=488448 Len=0 TSval=15927167 TSecr=1684507777
 78   0.015905 54.239.132.250 -> 172.31.8.238 TCP 23234 [TCP segment of a reassembled PDU]
 79   0.015917 172.31.8.238 -> 54.239.132.250 TCP 66 41293 > http [ACK] Seq=97 Ack=369241 Win=534784 Len=0 TSval=15927167 TSecr=1684507777
 80   0.016066 54.239.132.250 -> 172.31.8.238 TCP 27578 [TCP segment of a reassembled PDU]
 81   0.016081 172.31.8.238 -> 54.239.132.250 TCP 66 41293 > http [ACK] Seq=97 Ack=396753 Win=589824 Len=0 TSval=15927168 TSecr=1684507777
 82   0.016748 54.239.132.250 -> 172.31.8.238 TCP 5858 [TCP segment of a reassembled PDU]
 83   0.016755 172.31.8.238 -> 54.239.132.250 TCP 66 41293 > http [ACK] Seq=97 Ack=402545 Win=601344 Len=0 TSval=15927168 TSecr=1684507777
 84   0.016905 54.239.132.250 -> 172.31.8.238 TCP 20338 [TCP segment of a reassembled PDU]
 85   0.016917 172.31.8.238 -> 54.239.132.250 TCP 66 41293 > http [ACK] Seq=97 Ack=422817 Win=641920 Len=0 TSval=15927168 TSecr=1684507777
 86   0.017046 54.239.132.250 -> 172.31.8.238 TCP 26130 [TCP segment of a reassembled PDU]
 87   0.017060 172.31.8.238 -> 54.239.132.250 TCP 66 41293 > http [ACK] Seq=97 Ack=448881 Win=694016 Len=0 TSval=15927168 TSecr=1684507777
 88   0.017074 54.239.132.250 -> 172.31.8.238 TCP 11650 [TCP segment of a reassembled PDU]
 89   0.017080 172.31.8.238 -> 54.239.132.250 TCP 66 41293 > http [ACK] Seq=97 Ack=460465 Win=717184 Len=0 TSval=15927168 TSecr=1684507777
 90   0.017086 54.239.132.250 -> 172.31.8.238 TCP 2962 [TCP segment of a reassembled PDU]
 91   0.017090 172.31.8.238 -> 54.239.132.250 TCP 66 41293 > http [ACK] Seq=97 Ack=463361 Win=723072 Len=0 TSval=15927168 TSecr=1684507777
 92   0.017767 54.239.132.250 -> 172.31.8.238 TCP 4410 [TCP segment of a reassembled PDU]
 93   0.017774 172.31.8.238 -> 54.239.132.250 TCP 66 41293 > http [ACK] Seq=97 Ack=467705 Win=731648 Len=0 TSval=15927168 TSecr=1684507777
 94   0.017943 54.239.132.250 -> 172.31.8.238 TCP 26130 [TCP segment of a reassembled PDU]
 95   0.017957 172.31.8.238 -> 54.239.132.250 TCP 66 41293 > http [ACK] Seq=97 Ack=493769 Win=783872 Len=0 TSval=15927168 TSecr=1684507777
 96   0.018087 54.239.132.250 -> 172.31.8.238 TCP 17442 [TCP segment of a reassembled PDU]
 97   0.018098 172.31.8.238 -> 54.239.132.250 TCP 66 41293 > http [ACK] Seq=97 Ack=511145 Win=818560 Len=0 TSval=15927168 TSecr=1684507777
 98   0.018125 54.239.132.250 -> 172.31.8.238 TCP 8754 [TCP segment of a reassembled PDU]
 99   0.018131 172.31.8.238 -> 54.239.132.250 TCP 66 41293 > http [ACK] Seq=97 Ack=519833 Win=835968 Len=0 TSval=15927168 TSecr=1684507777
100   0.018200 54.239.132.250 -> 172.31.8.238 TCP 10202 [TCP segment of a reassembled PDU]
101   0.018207 172.31.8.238 -> 54.239.132.250 TCP 66 41293 > http [ACK] Seq=97 Ack=529969 Win=856192 Len=0 TSval=15927168 TSecr=1684507777
102   0.018612 54.239.132.250 -> 172.31.8.238 TCP 14546 [TCP segment of a reassembled PDU]
103   0.018622 172.31.8.238 -> 54.239.132.250 TCP 66 41293 > http [ACK] Seq=97 Ack=544449 Win=885248 Len=0 TSval=15927168 TSecr=1684507777
104   0.018805 54.239.132.250 -> 172.31.8.238 TCP 26130 [TCP segment of a reassembled PDU]
105   0.018819 172.31.8.238 -> 54.239.132.250 TCP 66 41293 > http [ACK] Seq=97 Ack=570513 Win=937344 Len=0 TSval=15927168 TSecr=1684507777
106   0.018941 54.239.132.250 -> 172.31.8.238 TCP 24682 [TCP segment of a reassembled PDU]
107   0.018954 172.31.8.238 -> 54.239.132.250 TCP 66 41293 > http [ACK] Seq=97 Ack=595129 Win=986496 Len=0 TSval=15927168 TSecr=1684507777
108   0.019136 54.239.132.250 -> 172.31.8.238 TCP 26130 [TCP segment of a reassembled PDU]
109   0.019149 172.31.8.238 -> 54.239.132.250 TCP 66 41293 > http [ACK] Seq=97 Ack=621193 Win=1038720 Len=0 TSval=15927168 TSecr=1684507777
110   0.019158 54.239.132.250 -> 172.31.8.238 TCP 5858 [TCP segment of a reassembled PDU]
111   0.019162 172.31.8.238 -> 54.239.132.250 TCP 66 41293 > http [ACK] Seq=97 Ack=626985 Win=1050240 Len=0 TSval=15927168 TSecr=1684507777
112   0.019558 54.239.132.250 -> 172.31.8.238 TCP 2962 [TCP segment of a reassembled PDU]
113   0.019564 172.31.8.238 -> 54.239.132.250 TCP 66 41293 > http [ACK] Seq=97 Ack=629881 Win=1056000 Len=0 TSval=15927168 TSecr=1684507777
114   0.019742 54.239.132.250 -> 172.31.8.238 TCP 26130 [TCP segment of a reassembled PDU]
115   0.019756 172.31.8.238 -> 54.239.132.250 TCP 66 41293 > http [ACK] Seq=97 Ack=655945 Win=1108224 Len=0 TSval=15927168 TSecr=1684507777
116   0.019828 54.239.132.250 -> 172.31.8.238 TCP 26130 [TCP segment of a reassembled PDU]
117   0.019841 172.31.8.238 -> 54.239.132.250 TCP 66 41293 > http [ACK] Seq=97 Ack=682009 Win=1160320 Len=0 TSval=15927168 TSecr=1684507777
118   0.019908 54.239.132.250 -> 172.31.8.238 TCP 26130 [TCP segment of a reassembled PDU]
119   0.019921 172.31.8.238 -> 54.239.132.250 TCP 66 41293 > http [ACK] Seq=97 Ack=708073 Win=1173632 Len=0 TSval=15927168 TSecr=1684507777
120   0.020338 54.239.132.250 -> 172.31.8.238 TCP 2962 [TCP segment of a reassembled PDU]
121   0.020344 172.31.8.238 -> 54.239.132.250 TCP 66 41293 > http [ACK] Seq=97 Ack=710969 Win=1211648 Len=0 TSval=15927169 TSecr=1684507777
122   0.020519 54.239.132.250 -> 172.31.8.238 TCP 26130 [TCP segment of a reassembled PDU]
123   0.020545 172.31.8.238 -> 54.239.132.250 TCP 66 41293 > http [ACK] Seq=97 Ack=737033 Win=1185664 Len=0 TSval=15927169 TSecr=1684507777
124   0.020607 54.239.132.250 -> 172.31.8.238 TCP 26130 [TCP segment of a reassembled PDU]
125   0.020634 172.31.8.238 -> 54.239.132.250 TCP 66 41293 > http [ACK] Seq=97 Ack=763097 Win=1173632 Len=0 TSval=15927169 TSecr=1684507777
126   0.020695 54.239.132.250 -> 172.31.8.238 TCP 26130 [TCP segment of a reassembled PDU]
127   0.020709 172.31.8.238 -> 54.239.132.250 TCP 66 41293 > http [ACK] Seq=97 Ack=789161 Win=1173632 Len=0 TSval=15927169 TSecr=1684507777
128   0.020742 54.239.132.250 -> 172.31.8.238 TCP 1514 [TCP segment of a reassembled PDU]
129   0.021107 54.239.132.250 -> 172.31.8.238 TCP 5858 [TCP segment of a reassembled PDU]
130   0.021114 172.31.8.238 -> 54.239.132.250 TCP 66 41293 > http [ACK] Seq=97 Ack=796401 Win=1206912 Len=0 TSval=15927169 TSecr=1684507777
131   0.021307 54.239.132.250 -> 172.31.8.238 TCP 26130 [TCP segment of a reassembled PDU]
132   0.021333 172.31.8.238 -> 54.239.132.250 TCP 66 41293 > http [ACK] Seq=97 Ack=822465 Win=1180928 Len=0 TSval=15927169 TSecr=1684507777
133   0.021382 54.239.132.250 -> 172.31.8.238 TCP 26130 [TCP segment of a reassembled PDU]
134   0.021408 172.31.8.238 -> 54.239.132.250 TCP 66 41293 > http [ACK] Seq=97 Ack=848529 Win=1173632 Len=0 TSval=15927169 TSecr=1684507777
135   0.021461 54.239.132.250 -> 172.31.8.238 TCP 26130 [TCP segment of a reassembled PDU]
136   0.021475 172.31.8.238 -> 54.239.132.250 TCP 66 41293 > http [ACK] Seq=97 Ack=874593 Win=1173632 Len=0 TSval=15927169 TSecr=1684507777
137   0.021558 54.239.132.250 -> 172.31.8.238 TCP 14546 [TCP segment of a reassembled PDU]
138   0.021567 172.31.8.238 -> 54.239.132.250 TCP 66 41293 > http [ACK] Seq=97 Ack=889073 Win=1192576 Len=0 TSval=15927169 TSecr=1684507777
139   0.021976 54.239.132.250 -> 172.31.8.238 TCP 17442 [TCP segment of a reassembled PDU]
140   0.021999 172.31.8.238 -> 54.239.132.250 TCP 66 41293 > http [ACK] Seq=97 Ack=906449 Win=1187840 Len=0 TSval=15927169 TSecr=1684507778
141   0.022107 54.239.132.250 -> 172.31.8.238 TCP 14546 [TCP segment of a reassembled PDU]
142   0.022116 172.31.8.238 -> 54.239.132.250 TCP 66 41293 > http [ACK] Seq=97 Ack=920929 Win=1192576 Len=0 TSval=15927169 TSecr=1684507778
143   0.022263 54.239.132.250 -> 172.31.8.238 TCP 26130 [TCP segment of a reassembled PDU]
144   0.022288 172.31.8.238 -> 54.239.132.250 TCP 66 41293 > http [ACK] Seq=97 Ack=946993 Win=1173632 Len=0 TSval=15927169 TSecr=1684507778
145   0.022413 54.239.132.250 -> 172.31.8.238 TCP 21786 [TCP segment of a reassembled PDU]
146   0.022426 172.31.8.238 -> 54.239.132.250 TCP 66 41293 > http [ACK] Seq=97 Ack=968713 Win=1180672 Len=0 TSval=15927169 TSecr=1684507778
147   0.022455 54.239.132.250 -> 172.31.8.238 TCP 4410 [TCP segment of a reassembled PDU]
148   0.022468 172.31.8.238 -> 54.239.132.250 TCP 66 41293 > http [ACK] Seq=97 Ack=973057 Win=1176448 Len=0 TSval=15927169 TSecr=1684507778
149   0.022534 54.239.132.250 -> 172.31.8.238 TCP 13098 [TCP segment of a reassembled PDU]
150   0.022545 172.31.8.238 -> 54.239.132.250 TCP 66 41293 > http [ACK] Seq=97 Ack=986089 Win=1195008 Len=0 TSval=15927169 TSecr=1684507778
151   0.022747 54.239.132.250 -> 172.31.8.238 TCP 26130 [TCP segment of a reassembled PDU]
152   0.022774 172.31.8.238 -> 54.239.132.250 TCP 66 41293 > http [ACK] Seq=97 Ack=1012153 Win=1173632 Len=0 TSval=15927169 TSecr=1684507778
153   0.022806 54.239.132.250 -> 172.31.8.238 TCP 18890 [TCP segment of a reassembled PDU]
154   0.022816 172.31.8.238 -> 54.239.132.250 TCP 66 41293 > http [ACK] Seq=97 Ack=1030977 Win=1185408 Len=0 TSval=15927169 TSecr=1684507778
155   0.023006 54.239.132.250 -> 172.31.8.238 HTTP 18123 HTTP/1.1 200 OK  (application/octet-stream)
156   0.023016 172.31.8.238 -> 54.239.132.250 TCP 66 41293 > http [ACK] Seq=97 Ack=1049034 Win=1185408 Len=0 TSval=15927169 TSecr=1684507778
157   0.023155 172.31.8.238 -> 54.239.132.250 TCP 66 41293 > http [FIN, ACK] Seq=97 Ack=1049034 Win=1212416 Len=0 TSval=15927169 TSecr=1684507778
158   0.023654 54.239.132.250 -> 172.31.8.238 TCP 66 http > 41293 [FIN, ACK] Seq=1049034 Ack=98 Win=14592 Len=0 TSval=1684507778 TSecr=15927169
159   0.023661 172.31.8.238 -> 54.239.132.250 TCP 66 41293 > http [ACK] Seq=98 Ack=1049035 Win=1212416 Len=0 TSval=15927169 TSecr=1684507778
160   0.992106 06:c7:b5:04:b8:d0 -> 06:b0:37:46:8f:13 ARP 42 Who has 172.31.0.2?  Tell 172.31.8.238
161   0.993066 06:b0:37:46:8f:13 -> 06:c7:b5:04:b8:d0 ARP 60 172.31.0.2 is at 06:b0:37:46:8f:13
