[Measurement for 10kb at 07:41:12 20.41.2014] 
Tshark:

  1   0.000000 172.31.8.238 -> 172.31.0.2   DNS 89 Standard query 0x88ad  A d1xvcg6dfvgaki.cloudfront.net
  2   0.000039 172.31.8.238 -> 172.31.0.2   DNS 89 Standard query 0x9252  AAAA d1xvcg6dfvgaki.cloudfront.net
  3   0.000645   172.31.0.2 -> 172.31.8.238 DNS 170 Standard query response 0x9252 
  4   0.000658   172.31.0.2 -> 172.31.8.238 DNS 217 Standard query response 0x88ad  A 54.192.118.220 A 54.192.118.247 A 54.230.116.73 A 54.230.116.204 A 54.230.117.21 A 54.230.117.42 A 54.230.118.248 A 54.230.119.3
  5   0.003822 172.31.8.238 -> 54.192.118.220 TCP 74 48212 > http [SYN] Seq=0 Win=26883 Len=0 MSS=8961 SACK_PERM=1 TSval=13225153 TSecr=0 WS=128
  6   0.004556 54.192.118.220 -> 172.31.8.238 TCP 74 http > 48212 [SYN, ACK] Seq=0 Ack=1 Win=14480 Len=0 MSS=1460 SACK_PERM=1 TSval=1686466561 TSecr=13225153 WS=128
  7   0.004571 172.31.8.238 -> 54.192.118.220 TCP 66 48212 > http [ACK] Seq=1 Ack=1 Win=27008 Len=0 TSval=13225154 TSecr=1686466561
  8   0.004614 172.31.8.238 -> 54.192.118.220 HTTP 163 GET /10kb HTTP/1.1 
  9   0.005280 54.192.118.220 -> 172.31.8.238 TCP 66 http > 48212 [ACK] Seq=1 Ack=98 Win=14592 Len=0 TSval=1686466561 TSecr=13225154
 10   0.007351 54.192.118.220 -> 172.31.8.238 TCP 2580 [TCP segment of a reassembled PDU]
 11   0.007361 172.31.8.238 -> 54.192.118.220 TCP 66 48212 > http [ACK] Seq=98 Ack=2515 Win=32000 Len=0 TSval=13225154 TSecr=1686466561
 12   0.007419 54.192.118.220 -> 172.31.8.238 HTTP 8247 HTTP/1.1 200 OK  (application/octet-stream)
 13   0.007437 172.31.8.238 -> 54.192.118.220 TCP 66 48212 > http [ACK] Seq=98 Ack=10696 Win=48384 Len=0 TSval=13225154 TSecr=1686466561
 14   0.007604 172.31.8.238 -> 54.192.118.220 TCP 66 48212 > http [FIN, ACK] Seq=98 Ack=10696 Win=48384 Len=0 TSval=13225154 TSecr=1686466561
 15   0.008118 54.192.118.220 -> 172.31.8.238 TCP 66 http > 48212 [FIN, ACK] Seq=10696 Ack=99 Win=14592 Len=0 TSval=1686466561 TSecr=13225154
 16   0.008127 172.31.8.238 -> 54.192.118.220 TCP 66 48212 > http [ACK] Seq=99 Ack=10697 Win=48384 Len=0 TSval=13225155 TSecr=1686466561
