[Measurement for 10kb at 13:41:13 20.41.2014] 
Tshark:

  1   0.000000 172.31.8.238 -> 172.31.0.2   DNS 89 Standard query 0x05d9  A d1xvcg6dfvgaki.cloudfront.net
  2   0.000023 172.31.8.238 -> 172.31.0.2   DNS 89 Standard query 0x6c95  AAAA d1xvcg6dfvgaki.cloudfront.net
  3   0.000760   172.31.0.2 -> 172.31.8.238 DNS 170 Standard query response 0x6c95 
  4   0.000771   172.31.0.2 -> 172.31.8.238 DNS 217 Standard query response 0x05d9  A 54.192.118.247 A 54.230.116.98 A 54.230.117.87 A 54.230.119.91 A 54.239.132.41 A 54.239.132.84 A 54.239.132.98 A 54.192.118.224
  5   0.003837 172.31.8.238 -> 54.192.118.247 TCP 74 40056 > http [SYN] Seq=0 Win=26883 Len=0 MSS=8961 SACK_PERM=1 TSval=18625254 TSecr=0 WS=128
  6   0.004671 54.192.118.247 -> 172.31.8.238 TCP 74 http > 40056 [SYN, ACK] Seq=0 Ack=1 Win=14480 Len=0 MSS=1460 SACK_PERM=1 TSval=1689430935 TSecr=18625254 WS=128
  7   0.004685 172.31.8.238 -> 54.192.118.247 TCP 66 40056 > http [ACK] Seq=1 Ack=1 Win=27008 Len=0 TSval=18625254 TSecr=1689430935
  8   0.004726 172.31.8.238 -> 54.192.118.247 HTTP 163 GET /10kb HTTP/1.1 
  9   0.005322 54.192.118.247 -> 172.31.8.238 TCP 66 http > 40056 [ACK] Seq=1 Ack=98 Win=14592 Len=0 TSval=1689430935 TSecr=18625254
 10   0.006998 54.192.118.247 -> 172.31.8.238 HTTP 10761 HTTP/1.1 200 OK  (application/octet-stream)
 11   0.007012 172.31.8.238 -> 54.192.118.247 TCP 66 40056 > http [ACK] Seq=98 Ack=10696 Win=48384 Len=0 TSval=18625255 TSecr=1689430935
 12   0.007182 172.31.8.238 -> 54.192.118.247 TCP 66 40056 > http [FIN, ACK] Seq=98 Ack=10696 Win=48384 Len=0 TSval=18625255 TSecr=1689430935
 13   0.007872 54.192.118.247 -> 172.31.8.238 TCP 66 http > 40056 [FIN, ACK] Seq=10696 Ack=99 Win=14592 Len=0 TSval=1689430935 TSecr=18625255
 14   0.007881 172.31.8.238 -> 54.192.118.247 TCP 66 40056 > http [ACK] Seq=99 Ack=10697 Win=48384 Len=0 TSval=18625255 TSecr=1689430935
