[Measurement for 10kb at 08:41:13 20.41.2014] 
Tshark:

  1   0.000000 172.31.8.238 -> 172.31.0.2   DNS 89 Standard query 0xb51e  A d1xvcg6dfvgaki.cloudfront.net
  2   0.000037 172.31.8.238 -> 172.31.0.2   DNS 89 Standard query 0x9a2e  AAAA d1xvcg6dfvgaki.cloudfront.net
  3   0.000941   172.31.0.2 -> 172.31.8.238 DNS 217 Standard query response 0xb51e  A 54.192.118.233 A 54.192.118.235 A 54.230.116.167 A 54.230.117.154 A 54.230.119.40 A 54.230.119.55 A 54.239.132.26 A 54.239.132.233
  4   0.000952   172.31.0.2 -> 172.31.8.238 DNS 170 Standard query response 0x9a2e 
  5   0.003900 172.31.8.238 -> 54.192.118.233 TCP 74 36152 > http [SYN] Seq=0 Win=26883 Len=0 MSS=8961 SACK_PERM=1 TSval=14125404 TSecr=0 WS=128
  6   0.004447 54.192.118.233 -> 172.31.8.238 TCP 74 http > 36152 [SYN, ACK] Seq=0 Ack=1 Win=14480 Len=0 MSS=1460 SACK_PERM=1 TSval=1688063572 TSecr=14125404 WS=128
  7   0.004461 172.31.8.238 -> 54.192.118.233 TCP 66 36152 > http [ACK] Seq=1 Ack=1 Win=27008 Len=0 TSval=14125404 TSecr=1688063572
  8   0.004501 172.31.8.238 -> 54.192.118.233 HTTP 163 GET /10kb HTTP/1.1 
  9   0.005142 54.192.118.233 -> 172.31.8.238 TCP 66 http > 36152 [ACK] Seq=1 Ack=98 Win=14592 Len=0 TSval=1688063572 TSecr=14125404
 10   0.006876 54.192.118.233 -> 172.31.8.238 HTTP 10761 HTTP/1.1 200 OK  (application/octet-stream)
 11   0.006887 172.31.8.238 -> 54.192.118.233 TCP 66 36152 > http [ACK] Seq=98 Ack=10696 Win=48384 Len=0 TSval=14125405 TSecr=1688063572
 12   0.007040 172.31.8.238 -> 54.192.118.233 TCP 66 36152 > http [FIN, ACK] Seq=98 Ack=10696 Win=48384 Len=0 TSval=14125405 TSecr=1688063572
 13   0.007771 54.192.118.233 -> 172.31.8.238 TCP 66 http > 36152 [FIN, ACK] Seq=10696 Ack=99 Win=14592 Len=0 TSval=1688063573 TSecr=14125405
 14   0.007780 172.31.8.238 -> 54.192.118.233 TCP 66 36152 > http [ACK] Seq=99 Ack=10697 Win=48384 Len=0 TSval=14125405 TSecr=1688063573
