[Measurement for 10kb at 09:41:13 20.41.2014] 
Tshark:

  1   0.000000 172.31.8.238 -> 172.31.0.2   DNS 89 Standard query 0x6feb  A d1xvcg6dfvgaki.cloudfront.net
  2   0.000029 172.31.8.238 -> 172.31.0.2   DNS 89 Standard query 0x71c7  AAAA d1xvcg6dfvgaki.cloudfront.net
  3   0.000495   172.31.0.2 -> 172.31.8.238 DNS 217 Standard query response 0x6feb  A 54.230.117.10 A 54.230.117.15 A 54.230.117.45 A 54.230.117.87 A 54.230.118.143 A 54.230.119.91 A 54.230.119.125 A 54.192.118.242
  4   0.000518   172.31.0.2 -> 172.31.8.238 DNS 170 Standard query response 0x71c7 
  5   0.003862 172.31.8.238 -> 54.230.117.10 TCP 74 54161 > http [SYN] Seq=0 Win=26883 Len=0 MSS=8961 SACK_PERM=1 TSval=15025294 TSecr=0 WS=128
  6   0.004467 54.230.117.10 -> 172.31.8.238 TCP 74 http > 54161 [SYN, ACK] Seq=0 Ack=1 Win=14480 Len=0 MSS=1460 SACK_PERM=1 TSval=1686218226 TSecr=15025294 WS=128
  7   0.004482 172.31.8.238 -> 54.230.117.10 TCP 66 54161 > http [ACK] Seq=1 Ack=1 Win=27008 Len=0 TSval=15025294 TSecr=1686218226
  8   0.004526 172.31.8.238 -> 54.230.117.10 HTTP 163 GET /10kb HTTP/1.1 
  9   0.005115 54.230.117.10 -> 172.31.8.238 TCP 66 http > 54161 [ACK] Seq=1 Ack=98 Win=14592 Len=0 TSval=1686218226 TSecr=15025294
 10   0.007063 54.230.117.10 -> 172.31.8.238 TCP 2580 [TCP segment of a reassembled PDU]
 11   0.007071 172.31.8.238 -> 54.230.117.10 TCP 66 54161 > http [ACK] Seq=98 Ack=2515 Win=32000 Len=0 TSval=15025295 TSecr=1686218226
 12   0.007191 54.230.117.10 -> 172.31.8.238 HTTP 8247 HTTP/1.1 200 OK  (application/octet-stream)
 13   0.007200 172.31.8.238 -> 54.230.117.10 TCP 66 54161 > http [ACK] Seq=98 Ack=10696 Win=48384 Len=0 TSval=15025295 TSecr=1686218226
 14   0.007337 172.31.8.238 -> 54.230.117.10 TCP 66 54161 > http [FIN, ACK] Seq=98 Ack=10696 Win=48384 Len=0 TSval=15025295 TSecr=1686218226
 15   0.008036 54.230.117.10 -> 172.31.8.238 TCP 66 http > 54161 [FIN, ACK] Seq=10696 Ack=99 Win=14592 Len=0 TSval=1686218226 TSecr=15025295
 16   0.008045 172.31.8.238 -> 54.230.117.10 TCP 66 54161 > http [ACK] Seq=99 Ack=10697 Win=48384 Len=0 TSval=15025295 TSecr=1686218226
 17   0.284491 06:b0:37:46:8f:13 -> 06:c7:b5:04:b8:d0 ARP 60 Who has 172.31.8.238?  Tell 172.31.0.1
 18   0.284509 06:c7:b5:04:b8:d0 -> 06:b0:37:46:8f:13 ARP 42 172.31.8.238 is at 06:c7:b5:04:b8:d0
