[Measurement for 10kb at 17:41:41 19.41.2014] 
Tshark:

  1   0.000000 172.31.8.238 -> 172.31.0.2   DNS 89 Standard query 0x623d  A d1xvcg6dfvgaki.cloudfront.net
  2   0.000027 172.31.8.238 -> 172.31.0.2   DNS 89 Standard query 0x6d0e  AAAA d1xvcg6dfvgaki.cloudfront.net
  3   0.000690   172.31.0.2 -> 172.31.8.238 DNS 217 Standard query response 0x623d  A 54.230.140.231 A 54.230.141.96 A 54.230.142.4 A 54.230.143.62 A 54.230.143.233 A 205.251.215.126 A 205.251.215.191 A 54.192.141.198
  4   0.000701   172.31.0.2 -> 172.31.8.238 DNS 170 Standard query response 0x6d0e 
  5   0.003851 172.31.8.238 -> 54.230.140.231 TCP 74 40206 > http [SYN] Seq=0 Win=26883 Len=0 MSS=8961 SACK_PERM=1 TSval=632286 TSecr=0 WS=128
  6   0.006199 54.230.140.231 -> 172.31.8.238 TCP 74 http > 40206 [SYN, ACK] Seq=0 Ack=1 Win=14480 Len=0 MSS=1460 SACK_PERM=1 TSval=799427157 TSecr=632286 WS=128
  7   0.006214 172.31.8.238 -> 54.230.140.231 TCP 66 40206 > http [ACK] Seq=1 Ack=1 Win=27008 Len=0 TSval=632287 TSecr=799427157
  8   0.006254 172.31.8.238 -> 54.230.140.231 HTTP 163 GET /10kb HTTP/1.1 
  9   0.008214 54.230.140.231 -> 172.31.8.238 TCP 66 http > 40206 [ACK] Seq=1 Ack=98 Win=14592 Len=0 TSval=799427157 TSecr=632287
 10   0.388464 54.230.140.231 -> 172.31.8.238 TCP 1514 [TCP segment of a reassembled PDU]
 11   0.388493 172.31.8.238 -> 54.230.140.231 TCP 66 40206 > http [ACK] Seq=98 Ack=1449 Win=29824 Len=0 TSval=632383 TSecr=799427195
 12   0.388687 54.230.140.231 -> 172.31.8.238 TCP 5501 [TCP segment of a reassembled PDU]
 13   0.388696 172.31.8.238 -> 54.230.140.231 TCP 66 40206 > http [ACK] Seq=98 Ack=6884 Win=40704 Len=0 TSval=632383 TSecr=799427195
 14   0.388716 54.230.140.231 -> 172.31.8.238 TCP 554 [TCP segment of a reassembled PDU]
 15   0.388723 172.31.8.238 -> 54.230.140.231 TCP 66 40206 > http [ACK] Seq=98 Ack=7372 Win=43648 Len=0 TSval=632383 TSecr=799427195
 16   0.568528 54.230.140.231 -> 172.31.8.238 TCP 1514 [TCP segment of a reassembled PDU]
