[Measurement for 10kb at 12:41:13 20.41.2014] 
Tshark:

  1   0.000000 172.31.8.238 -> 172.31.0.2   DNS 89 Standard query 0x79e0  A d1xvcg6dfvgaki.cloudfront.net
  2   0.000028 172.31.8.238 -> 172.31.0.2   DNS 89 Standard query 0x7da5  AAAA d1xvcg6dfvgaki.cloudfront.net
  3   0.000922   172.31.0.2 -> 172.31.8.238 DNS 217 Standard query response 0x79e0  A 54.230.116.141 A 54.230.116.204 A 54.230.117.156 A 54.230.119.66 A 54.230.119.125 A 54.239.132.173 A 54.192.118.228 A 54.230.116.82
  4   0.000934   172.31.0.2 -> 172.31.8.238 DNS 170 Standard query response 0x7da5 
  5   0.003864 172.31.8.238 -> 54.230.116.141 TCP 74 51699 > http [SYN] Seq=0 Win=26883 Len=0 MSS=8961 SACK_PERM=1 TSval=17725335 TSecr=0 WS=128
  6   0.004642 54.230.116.141 -> 172.31.8.238 TCP 74 http > 51699 [SYN, ACK] Seq=0 Ack=1 Win=14480 Len=0 MSS=1460 SACK_PERM=1 TSval=1685980257 TSecr=17725335 WS=128
  7   0.004657 172.31.8.238 -> 54.230.116.141 TCP 66 51699 > http [ACK] Seq=1 Ack=1 Win=27008 Len=0 TSval=17725336 TSecr=1685980257
  8   0.004700 172.31.8.238 -> 54.230.116.141 HTTP 163 GET /10kb HTTP/1.1 
  9   0.005391 54.230.116.141 -> 172.31.8.238 TCP 66 http > 51699 [ACK] Seq=1 Ack=98 Win=14592 Len=0 TSval=1685980257 TSecr=17725336
 10   0.006485 54.230.116.141 -> 172.31.8.238 TCP 8754 [TCP segment of a reassembled PDU]
 11   0.006495 172.31.8.238 -> 54.230.116.141 TCP 66 51699 > http [ACK] Seq=98 Ack=8689 Win=44288 Len=0 TSval=17725336 TSecr=1685980257
 12   0.006526 54.230.116.141 -> 172.31.8.238 HTTP 2073 HTTP/1.1 200 OK  (application/octet-stream)
 13   0.006532 172.31.8.238 -> 54.230.116.141 TCP 66 51699 > http [ACK] Seq=98 Ack=10696 Win=48384 Len=0 TSval=17725336 TSecr=1685980257
 14   0.006685 172.31.8.238 -> 54.230.116.141 TCP 66 51699 > http [FIN, ACK] Seq=98 Ack=10696 Win=48384 Len=0 TSval=17725336 TSecr=1685980257
 15   0.007436 54.230.116.141 -> 172.31.8.238 TCP 66 http > 51699 [FIN, ACK] Seq=10696 Ack=99 Win=14592 Len=0 TSval=1685980257 TSecr=17725336
 16   0.007446 172.31.8.238 -> 54.230.116.141 TCP 66 51699 > http [ACK] Seq=99 Ack=10697 Win=48384 Len=0 TSval=17725336 TSecr=1685980257
