[Measurement for 10kb at 06:41:13 20.41.2014] 
Tshark:

  1   0.000000 172.31.8.238 -> 172.31.0.2   DNS 89 Standard query 0xd210  A d1xvcg6dfvgaki.cloudfront.net
  2   0.000036 172.31.8.238 -> 172.31.0.2   DNS 89 Standard query 0x1617  AAAA d1xvcg6dfvgaki.cloudfront.net
  3   0.000618   172.31.0.2 -> 172.31.8.238 DNS 217 Standard query response 0xd210  A 54.230.119.66 A 54.239.132.86 A 54.192.118.233 A 54.192.118.236 A 54.230.116.44 A 54.230.118.239 A 54.230.118.248 A 54.230.119.55
  4   0.000629   172.31.0.2 -> 172.31.8.238 DNS 170 Standard query response 0x1617 
  5   0.003849 172.31.8.238 -> 54.230.119.66 TCP 74 37141 > http [SYN] Seq=0 Win=26883 Len=0 MSS=8961 SACK_PERM=1 TSval=12325249 TSecr=0 WS=128
  6   0.004528 54.230.119.66 -> 172.31.8.238 TCP 74 http > 37141 [SYN, ACK] Seq=0 Ack=1 Win=14480 Len=0 MSS=1460 SACK_PERM=1 TSval=1582678195 TSecr=12325249 WS=128
  7   0.004542 172.31.8.238 -> 54.230.119.66 TCP 66 37141 > http [ACK] Seq=1 Ack=1 Win=27008 Len=0 TSval=12325249 TSecr=1582678195
  8   0.004596 172.31.8.238 -> 54.230.119.66 HTTP 163 GET /10kb HTTP/1.1 
  9   0.005281 54.230.119.66 -> 172.31.8.238 TCP 66 http > 37141 [ACK] Seq=1 Ack=98 Win=14592 Len=0 TSval=1582678196 TSecr=12325249
 10   0.006102 54.230.119.66 -> 172.31.8.238 TCP 5858 [TCP segment of a reassembled PDU]
 11   0.006111 172.31.8.238 -> 54.230.119.66 TCP 66 37141 > http [ACK] Seq=98 Ack=5793 Win=38528 Len=0 TSval=12325250 TSecr=1582678196
 12   0.006203 54.230.119.66 -> 172.31.8.238 HTTP 4969 HTTP/1.1 200 OK  (application/octet-stream)
 13   0.006210 172.31.8.238 -> 54.230.119.66 TCP 66 37141 > http [ACK] Seq=98 Ack=10696 Win=48384 Len=0 TSval=12325250 TSecr=1582678196
 14   0.006375 172.31.8.238 -> 54.230.119.66 TCP 66 37141 > http [FIN, ACK] Seq=98 Ack=10696 Win=48384 Len=0 TSval=12325250 TSecr=1582678196
 15   0.007066 54.230.119.66 -> 172.31.8.238 TCP 66 http > 37141 [FIN, ACK] Seq=10696 Ack=99 Win=14592 Len=0 TSval=1582678196 TSecr=12325250
 16   0.007075 172.31.8.238 -> 54.230.119.66 TCP 66 37141 > http [ACK] Seq=99 Ack=10697 Win=48384 Len=0 TSval=12325250 TSecr=1582678196
