[Measurement for 10mb at 19:39:26 19.39.2014] 
Tshark:

  1   0.000000 172.31.29.138 -> 172.31.0.2   DNS 89 Standard query 0xac43  A d3m1c4hwkgedal.cloudfront.net
  2   0.000025 172.31.29.138 -> 172.31.0.2   DNS 89 Standard query 0xf19d  AAAA d3m1c4hwkgedal.cloudfront.net
  3   0.000576   172.31.0.2 -> 172.31.29.138 DNS 174 Standard query response 0xf19d 
  4   0.000587   172.31.0.2 -> 172.31.29.138 DNS 217 Standard query response 0xac43  A 54.230.158.182 A 54.230.158.246 A 54.230.158.252 A 54.240.168.128 A 54.192.159.173 A 54.230.156.193 A 54.230.158.139 A 54.230.158.152
  5   0.003871 172.31.29.138 -> 54.230.158.182 TCP 74 42850 > http [SYN] Seq=0 Win=26883 Len=0 MSS=8961 SACK_PERM=1 TSval=2459862 TSecr=0 WS=128
  6   0.004491 54.230.158.182 -> 172.31.29.138 TCP 74 http > 42850 [SYN, ACK] Seq=0 Ack=1 Win=14480 Len=0 MSS=1460 SACK_PERM=1 TSval=832276541 TSecr=2459862 WS=128
  7   0.004504 172.31.29.138 -> 54.230.158.182 TCP 66 42850 > http [ACK] Seq=1 Ack=1 Win=27008 Len=0 TSval=2459863 TSecr=832276541
  8   0.004548 172.31.29.138 -> 54.230.158.182 HTTP 163 GET /10mb HTTP/1.1 
  9   0.005005 54.230.158.182 -> 172.31.29.138 TCP 66 http > 42850 [ACK] Seq=1 Ack=98 Win=14592 Len=0 TSval=832276541 TSecr=2459863
 10   0.007588 54.230.158.182 -> 172.31.29.138 TCP 2581 [TCP segment of a reassembled PDU]
 11   0.007598 172.31.29.138 -> 54.230.158.182 TCP 66 42850 > http [ACK] Seq=98 Ack=2516 Win=32000 Len=0 TSval=2459863 TSecr=832276541
 12   0.007646 54.230.158.182 -> 172.31.29.138 TCP 11650 [TCP segment of a reassembled PDU]
 13   0.007656 172.31.29.138 -> 54.230.158.182 TCP 66 42850 > http [ACK] Seq=98 Ack=14100 Win=55168 Len=0 TSval=2459863 TSecr=832276541
 14   0.008085 54.230.158.182 -> 172.31.29.138 TCP 1514 [TCP segment of a reassembled PDU]
 15   0.008091 172.31.29.138 -> 54.230.158.182 TCP 66 42850 > http [ACK] Seq=98 Ack=15548 Win=57984 Len=0 TSval=2459863 TSecr=832276541
 16   0.008175 54.230.158.182 -> 172.31.29.138 TCP 11650 [TCP segment of a reassembled PDU]
 17   0.008184 172.31.29.138 -> 54.230.158.182 TCP 66 42850 > http [ACK] Seq=98 Ack=27132 Win=81152 Len=0 TSval=2459863 TSecr=832276541
 18   0.008603 54.230.158.182 -> 172.31.29.138 TCP 2962 [TCP segment of a reassembled PDU]
 19   0.008609 172.31.29.138 -> 54.230.158.182 TCP 66 42850 > http [ACK] Seq=98 Ack=30028 Win=87040 Len=0 TSval=2459864 TSecr=832276541
 20   0.008694 54.230.158.182 -> 172.31.29.138 TCP 10202 [TCP segment of a reassembled PDU]
 21   0.008702 172.31.29.138 -> 54.230.158.182 TCP 66 42850 > http [ACK] Seq=98 Ack=40164 Win=107264 Len=0 TSval=2459864 TSecr=832276541
 22   0.009127 54.230.158.182 -> 172.31.29.138 TCP 8754 [TCP segment of a reassembled PDU]
 23   0.009134 172.31.29.138 -> 54.230.158.182 TCP 66 42850 > http [ACK] Seq=98 Ack=48852 Win=124672 Len=0 TSval=2459864 TSecr=832276541
 24   0.009153 54.230.158.182 -> 172.31.29.138 TCP 4410 [TCP segment of a reassembled PDU]
 25   0.009158 172.31.29.138 -> 54.230.158.182 TCP 66 42850 > http [ACK] Seq=98 Ack=53196 Win=133376 Len=0 TSval=2459864 TSecr=832276541
 26   0.009625 54.230.158.182 -> 172.31.29.138 TCP 4410 [TCP segment of a reassembled PDU]
 27   0.009631 172.31.29.138 -> 54.230.158.182 TCP 66 42850 > http [ACK] Seq=98 Ack=57540 Win=142080 Len=0 TSval=2459864 TSecr=832276541
 28   0.009713 54.230.158.182 -> 172.31.29.138 TCP 8754 [TCP segment of a reassembled PDU]
 29   0.009721 172.31.29.138 -> 54.230.158.182 TCP 66 42850 > http [ACK] Seq=98 Ack=66228 Win=159360 Len=0 TSval=2459864 TSecr=832276541
 30   0.010141 54.230.158.182 -> 172.31.29.138 TCP 4410 [TCP segment of a reassembled PDU]
 31   0.010147 172.31.29.138 -> 54.230.158.182 TCP 66 42850 > http [ACK] Seq=98 Ack=70572 Win=168064 Len=0 TSval=2459864 TSecr=832276541
 32   0.010238 54.230.158.182 -> 172.31.29.138 TCP 8754 [TCP segment of a reassembled PDU]
 33   0.010246 172.31.29.138 -> 54.230.158.182 TCP 66 42850 > http [ACK] Seq=98 Ack=79260 Win=183936 Len=0 TSval=2459864 TSecr=832276541
 34   0.010704 54.230.158.182 -> 172.31.29.138 TCP 18890 [TCP segment of a reassembled PDU]
 35   0.010716 172.31.29.138 -> 54.230.158.182 TCP 66 42850 > http [ACK] Seq=98 Ack=98084 Win=167296 Len=0 TSval=2459864 TSecr=832276541
 36   0.011176 54.230.158.182 -> 172.31.29.138 TCP 5858 [TCP segment of a reassembled PDU]
 37   0.011183 172.31.29.138 -> 54.230.158.182 TCP 66 42850 > http [ACK] Seq=98 Ack=103876 Win=188672 Len=0 TSval=2459864 TSecr=832276542
 38   0.011298 54.230.158.182 -> 172.31.29.138 TCP 13098 [TCP segment of a reassembled PDU]
 39   0.011308 172.31.29.138 -> 54.230.158.182 TCP 66 42850 > http [ACK] Seq=98 Ack=116908 Win=176896 Len=0 TSval=2459864 TSecr=832276542
 40   0.011698 54.230.158.182 -> 172.31.29.138 TCP 4410 [TCP segment of a reassembled PDU]
 41   0.011703 172.31.29.138 -> 54.230.158.182 TCP 66 42850 > http [ACK] Seq=98 Ack=121252 Win=191104 Len=0 TSval=2459864 TSecr=832276542
 42   0.011825 54.230.158.182 -> 172.31.29.138 TCP 13098 [TCP segment of a reassembled PDU]
 43   0.011835 172.31.29.138 -> 54.230.158.182 TCP 66 42850 > http [ACK] Seq=98 Ack=134284 Win=178176 Len=0 TSval=2459864 TSecr=832276542
 44   0.012443 54.230.158.182 -> 172.31.29.138 TCP 1514 [TCP segment of a reassembled PDU]
 45   0.012450 172.31.29.138 -> 54.230.158.182 TCP 66 42850 > http [ACK] Seq=98 Ack=135732 Win=195840 Len=0 TSval=2459865 TSecr=832276542
 46   0.012605 54.230.158.182 -> 172.31.29.138 TCP 18890 [TCP segment of a reassembled PDU]
 47   0.012617 172.31.29.138 -> 54.230.158.182 TCP 66 42850 > http [ACK] Seq=98 Ack=154556 Win=234752 Len=0 TSval=2459865 TSecr=832276542
 48   0.013254 54.230.158.182 -> 172.31.29.138 TCP 2962 [TCP segment of a reassembled PDU]
 49   0.013260 172.31.29.138 -> 54.230.158.182 TCP 66 42850 > http [ACK] Seq=98 Ack=157452 Win=240512 Len=0 TSval=2459865 TSecr=832276542
 50   0.013356 54.230.158.182 -> 172.31.29.138 TCP 4410 [TCP segment of a reassembled PDU]
 51   0.013362 172.31.29.138 -> 54.230.158.182 TCP 66 42850 > http [ACK] Seq=98 Ack=161796 Win=249216 Len=0 TSval=2459865 TSecr=832276542
 52   0.013413 54.230.158.182 -> 172.31.29.138 TCP 13098 [TCP segment of a reassembled PDU]
 53   0.013422 172.31.29.138 -> 54.230.158.182 TCP 66 42850 > http [ACK] Seq=98 Ack=174828 Win=275200 Len=0 TSval=2459865 TSecr=832276542
 54   0.014023 54.230.158.182 -> 172.31.29.138 TCP 8754 [TCP segment of a reassembled PDU]
 55   0.014030 172.31.29.138 -> 54.230.158.182 TCP 66 42850 > http [ACK] Seq=98 Ack=183516 Win=292608 Len=0 TSval=2459865 TSecr=832276542
 56   0.014126 54.230.158.182 -> 172.31.29.138 TCP 5858 [TCP segment of a reassembled PDU]
 57   0.014133 172.31.29.138 -> 54.230.158.182 TCP 66 42850 > http [ACK] Seq=98 Ack=189308 Win=304256 Len=0 TSval=2459865 TSecr=832276542
 58   0.014511 54.230.158.182 -> 172.31.29.138 TCP 1514 [TCP segment of a reassembled PDU]
 59   0.014516 172.31.29.138 -> 54.230.158.182 TCP 66 42850 > http [ACK] Seq=98 Ack=190756 Win=307072 Len=0 TSval=2459865 TSecr=832276542
 60   0.014683 54.230.158.182 -> 172.31.29.138 TCP 13098 [TCP segment of a reassembled PDU]
 61   0.014691 172.31.29.138 -> 54.230.158.182 TCP 66 42850 > http [ACK] Seq=98 Ack=203788 Win=333184 Len=0 TSval=2459865 TSecr=832276542
 62   0.015042 54.230.158.182 -> 172.31.29.138 TCP 2962 [TCP segment of a reassembled PDU]
 63   0.015048 172.31.29.138 -> 54.230.158.182 TCP 66 42850 > http [ACK] Seq=98 Ack=206684 Win=338944 Len=0 TSval=2459865 TSecr=832276542
 64   0.015144 54.230.158.182 -> 172.31.29.138 TCP 4410 [TCP segment of a reassembled PDU]
 65   0.015150 172.31.29.138 -> 54.230.158.182 TCP 66 42850 > http [ACK] Seq=98 Ack=211028 Win=347648 Len=0 TSval=2459865 TSecr=832276542
 66   0.015385 54.230.158.182 -> 172.31.29.138 TCP 13098 [TCP segment of a reassembled PDU]
 67   0.015394 172.31.29.138 -> 54.230.158.182 TCP 66 42850 > http [ACK] Seq=98 Ack=224060 Win=373760 Len=0 TSval=2459865 TSecr=832276542
 68   0.015627 54.230.158.182 -> 172.31.29.138 TCP 7306 [TCP segment of a reassembled PDU]
 69   0.015634 172.31.29.138 -> 54.230.158.182 TCP 66 42850 > http [ACK] Seq=98 Ack=231300 Win=388224 Len=0 TSval=2459865 TSecr=832276542
 70   0.015900 54.230.158.182 -> 172.31.29.138 TCP 13098 [TCP segment of a reassembled PDU]
 71   0.015909 172.31.29.138 -> 54.230.158.182 TCP 66 42850 > http [ACK] Seq=98 Ack=244332 Win=414208 Len=0 TSval=2459865 TSecr=832276542
 72   0.016318 54.230.158.182 -> 172.31.29.138 TCP 1514 [TCP segment of a reassembled PDU]
 73   0.016323 172.31.29.138 -> 54.230.158.182 TCP 66 42850 > http [ACK] Seq=98 Ack=245780 Win=417152 Len=0 TSval=2459866 TSecr=832276542
 74   0.016448 54.230.158.182 -> 172.31.29.138 TCP 5858 [TCP segment of a reassembled PDU]
 75   0.016454 172.31.29.138 -> 54.230.158.182 TCP 66 42850 > http [ACK] Seq=98 Ack=251572 Win=428672 Len=0 TSval=2459866 TSecr=832276542
 76   0.016693 54.230.158.182 -> 172.31.29.138 TCP 13098 [TCP segment of a reassembled PDU]
 77   0.016703 172.31.29.138 -> 54.230.158.182 TCP 66 42850 > http [ACK] Seq=98 Ack=264604 Win=454784 Len=0 TSval=2459866 TSecr=832276542
 78   0.017116 54.230.158.182 -> 172.31.29.138 TCP 2962 [TCP segment of a reassembled PDU]
 79   0.017122 172.31.29.138 -> 54.230.158.182 TCP 66 42850 > http [ACK] Seq=98 Ack=267500 Win=460544 Len=0 TSval=2459866 TSecr=832276542
 80   0.017265 54.230.158.182 -> 172.31.29.138 TCP 14546 [TCP segment of a reassembled PDU]
 81   0.017274 172.31.29.138 -> 54.230.158.182 TCP 66 42850 > http [ACK] Seq=98 Ack=281980 Win=489600 Len=0 TSval=2459866 TSecr=832276542
 82   0.017606 54.230.158.182 -> 172.31.29.138 TCP 5858 [TCP segment of a reassembled PDU]
 83   0.017612 172.31.29.138 -> 54.230.158.182 TCP 66 42850 > http [ACK] Seq=98 Ack=287772 Win=501120 Len=0 TSval=2459866 TSecr=832276542
 84   0.017699 54.230.158.182 -> 172.31.29.138 TCP 1514 [TCP segment of a reassembled PDU]
 85   0.017703 172.31.29.138 -> 54.230.158.182 TCP 66 42850 > http [ACK] Seq=98 Ack=289220 Win=504064 Len=0 TSval=2459866 TSecr=832276542
 86   0.017953 54.230.158.182 -> 172.31.29.138 TCP 14546 [TCP segment of a reassembled PDU]
 87   0.017962 172.31.29.138 -> 54.230.158.182 TCP 66 42850 > http [ACK] Seq=98 Ack=303700 Win=532992 Len=0 TSval=2459866 TSecr=832276542
 88   0.018175 54.230.158.182 -> 172.31.29.138 TCP 7306 [TCP segment of a reassembled PDU]
 89   0.018183 172.31.29.138 -> 54.230.158.182 TCP 66 42850 > http [ACK] Seq=98 Ack=310940 Win=547456 Len=0 TSval=2459866 TSecr=832276542
 90   0.018439 54.230.158.182 -> 172.31.29.138 TCP 14546 [TCP segment of a reassembled PDU]
 91   0.018448 172.31.29.138 -> 54.230.158.182 TCP 66 42850 > http [ACK] Seq=98 Ack=325420 Win=576384 Len=0 TSval=2459866 TSecr=832276542
 92   0.018688 54.230.158.182 -> 172.31.29.138 TCP 7306 [TCP segment of a reassembled PDU]
 93   0.018695 172.31.29.138 -> 54.230.158.182 TCP 66 42850 > http [ACK] Seq=98 Ack=332660 Win=590848 Len=0 TSval=2459866 TSecr=832276542
 94   0.018942 54.230.158.182 -> 172.31.29.138 TCP 14546 [TCP segment of a reassembled PDU]
 95   0.018951 172.31.29.138 -> 54.230.158.182 TCP 66 42850 > http [ACK] Seq=98 Ack=347140 Win=619904 Len=0 TSval=2459866 TSecr=832276542
 96   0.019143 54.230.158.182 -> 172.31.29.138 TCP 7306 [TCP segment of a reassembled PDU]
 97   0.019151 172.31.29.138 -> 54.230.158.182 TCP 66 42850 > http [ACK] Seq=98 Ack=354380 Win=634368 Len=0 TSval=2459866 TSecr=832276542
 98   0.019378 54.230.158.182 -> 172.31.29.138 TCP 2962 [TCP segment of a reassembled PDU]
 99   0.019383 172.31.29.138 -> 54.230.158.182 TCP 66 42850 > http [ACK] Seq=98 Ack=357276 Win=640128 Len=0 TSval=2459866 TSecr=832276542
100   0.019521 54.230.158.182 -> 172.31.29.138 TCP 11650 [TCP segment of a reassembled PDU]
101   0.019529 172.31.29.138 -> 54.230.158.182 TCP 66 42850 > http [ACK] Seq=98 Ack=368860 Win=663296 Len=0 TSval=2459866 TSecr=832276542
102   0.019634 54.230.158.182 -> 172.31.29.138 TCP 1514 [TCP segment of a reassembled PDU]
103   0.019639 172.31.29.138 -> 54.230.158.182 TCP 66 42850 > http [ACK] Seq=98 Ack=370308 Win=666240 Len=0 TSval=2459866 TSecr=832276542
104   0.019763 54.230.158.182 -> 172.31.29.138 TCP 5858 [TCP segment of a reassembled PDU]
105   0.019770 172.31.29.138 -> 54.230.158.182 TCP 66 42850 > http [ACK] Seq=98 Ack=376100 Win=677760 Len=0 TSval=2459866 TSecr=832276542
106   0.020169 54.230.158.182 -> 172.31.29.138 TCP 8754 [TCP segment of a reassembled PDU]
107   0.020178 172.31.29.138 -> 54.230.158.182 TCP 66 42850 > http [ACK] Seq=98 Ack=384788 Win=695168 Len=0 TSval=2459866 TSecr=832276542
108   0.020285 54.230.158.182 -> 172.31.29.138 TCP 14546 [TCP segment of a reassembled PDU]
109   0.020295 172.31.29.138 -> 54.230.158.182 TCP 66 42850 > http [ACK] Seq=98 Ack=399268 Win=688000 Len=0 TSval=2459867 TSecr=832276542
110   0.020664 54.230.158.182 -> 172.31.29.138 TCP 5858 [TCP segment of a reassembled PDU]
111   0.020671 172.31.29.138 -> 54.230.158.182 TCP 66 42850 > http [ACK] Seq=98 Ack=405060 Win=702336 Len=0 TSval=2459867 TSecr=832276542
112   0.020765 54.230.158.182 -> 172.31.29.138 TCP 2962 [TCP segment of a reassembled PDU]
113   0.020770 172.31.29.138 -> 54.230.158.182 TCP 66 42850 > http [ACK] Seq=98 Ack=407956 Win=707072 Len=0 TSval=2459867 TSecr=832276542
114   0.021047 54.230.158.182 -> 172.31.29.138 TCP 14546 [TCP segment of a reassembled PDU]
115   0.021068 172.31.29.138 -> 54.230.158.182 TCP 66 42850 > http [ACK] Seq=98 Ack=422436 Win=709248 Len=0 TSval=2459867 TSecr=832276542
116   0.021254 54.230.158.182 -> 172.31.29.138 TCP 8754 [TCP segment of a reassembled PDU]
117   0.021274 172.31.29.138 -> 54.230.158.182 TCP 66 42850 > http [ACK] Seq=98 Ack=431124 Win=709248 Len=0 TSval=2459867 TSecr=832276543
118   0.021703 54.230.158.182 -> 172.31.29.138 TCP 8754 [TCP segment of a reassembled PDU]
119   0.021722 172.31.29.138 -> 54.230.158.182 TCP 66 42850 > http [ACK] Seq=98 Ack=439812 Win=709248 Len=0 TSval=2459867 TSecr=832276543
120   0.021816 54.230.158.182 -> 172.31.29.138 TCP 14546 [TCP segment of a reassembled PDU]
121   0.021839 172.31.29.138 -> 54.230.158.182 TCP 66 42850 > http [ACK] Seq=98 Ack=454292 Win=709248 Len=0 TSval=2459867 TSecr=832276543
122   0.022243 54.230.158.182 -> 172.31.29.138 TCP 8754 [TCP segment of a reassembled PDU]
123   0.022261 172.31.29.138 -> 54.230.158.182 TCP 66 42850 > http [ACK] Seq=98 Ack=462980 Win=709248 Len=0 TSval=2459867 TSecr=832276543
124   0.022602 54.230.158.182 -> 172.31.29.138 TCP 14546 [TCP segment of a reassembled PDU]
125   0.022629 172.31.29.138 -> 54.230.158.182 TCP 66 42850 > http [ACK] Seq=98 Ack=477460 Win=709248 Len=0 TSval=2459867 TSecr=832276543
126   0.022752 54.230.158.182 -> 172.31.29.138 TCP 4410 [TCP segment of a reassembled PDU]
127   0.022770 172.31.29.138 -> 54.230.158.182 TCP 66 42850 > http [ACK] Seq=98 Ack=481804 Win=709248 Len=0 TSval=2459867 TSecr=832276543
128   0.022867 54.230.158.182 -> 172.31.29.138 TCP 4410 [TCP segment of a reassembled PDU]
129   0.022885 172.31.29.138 -> 54.230.158.182 TCP 66 42850 > http [ACK] Seq=98 Ack=486148 Win=709248 Len=0 TSval=2459867 TSecr=832276543
130   0.023260 54.230.158.182 -> 172.31.29.138 TCP 4410 [TCP segment of a reassembled PDU]
131   0.023278 172.31.29.138 -> 54.230.158.182 TCP 66 42850 > http [ACK] Seq=98 Ack=490492 Win=709248 Len=0 TSval=2459867 TSecr=832276543
132   0.023392 54.230.158.182 -> 172.31.29.138 TCP 10202 [TCP segment of a reassembled PDU]
133   0.023605 172.31.29.138 -> 54.230.158.182 TCP 66 42850 > http [ACK] Seq=98 Ack=500628 Win=709248 Len=0 TSval=2459867 TSecr=832276543
134   0.023854 54.230.158.182 -> 172.31.29.138 TCP 8754 [TCP segment of a reassembled PDU]
135   0.023874 172.31.29.138 -> 54.230.158.182 TCP 66 42850 > http [ACK] Seq=98 Ack=509316 Win=709248 Len=0 TSval=2459867 TSecr=832276543
136   0.024145 54.230.158.182 -> 172.31.29.138 TCP 14546 [TCP segment of a reassembled PDU]
137   0.024168 172.31.29.138 -> 54.230.158.182 TCP 66 42850 > http [ACK] Seq=98 Ack=523796 Win=709248 Len=0 TSval=2459867 TSecr=832276543
138   0.024524 54.230.158.182 -> 172.31.29.138 TCP 2962 [TCP segment of a reassembled PDU]
139   0.024541 172.31.29.138 -> 54.230.158.182 TCP 66 42850 > http [ACK] Seq=98 Ack=526692 Win=709248 Len=0 TSval=2459868 TSecr=832276543
140   0.024684 54.230.158.182 -> 172.31.29.138 TCP 5858 [TCP segment of a reassembled PDU]
141   0.024702 172.31.29.138 -> 54.230.158.182 TCP 66 42850 > http [ACK] Seq=98 Ack=532484 Win=709248 Len=0 TSval=2459868 TSecr=832276543
142   0.024779 54.230.158.182 -> 172.31.29.138 TCP 2962 [TCP segment of a reassembled PDU]
143   0.024794 172.31.29.138 -> 54.230.158.182 TCP 66 42850 > http [ACK] Seq=98 Ack=535380 Win=709248 Len=0 TSval=2459868 TSecr=832276543
144   0.024909 54.230.158.182 -> 172.31.29.138 TCP 7306 [TCP segment of a reassembled PDU]
145   0.024927 172.31.29.138 -> 54.230.158.182 TCP 66 42850 > http [ACK] Seq=98 Ack=542620 Win=709248 Len=0 TSval=2459868 TSecr=832276543
146   0.025164 54.230.158.182 -> 172.31.29.138 TCP 8754 [TCP segment of a reassembled PDU]
147   0.025183 172.31.29.138 -> 54.230.158.182 TCP 66 42850 > http [ACK] Seq=98 Ack=551308 Win=709248 Len=0 TSval=2459868 TSecr=832276543
148   0.025298 54.230.158.182 -> 172.31.29.138 TCP 4410 [TCP segment of a reassembled PDU]
149   0.025315 172.31.29.138 -> 54.230.158.182 TCP 66 42850 > http [ACK] Seq=98 Ack=555652 Win=709248 Len=0 TSval=2459868 TSecr=832276543
150   0.025422 54.230.158.182 -> 172.31.29.138 TCP 4410 [TCP segment of a reassembled PDU]
151   0.025439 172.31.29.138 -> 54.230.158.182 TCP 66 42850 > http [ACK] Seq=98 Ack=559996 Win=709248 Len=0 TSval=2459868 TSecr=832276543
152   0.025810 54.230.158.182 -> 172.31.29.138 TCP 1514 [TCP segment of a reassembled PDU]
153   0.025971 54.230.158.182 -> 172.31.29.138 TCP 14546 [TCP segment of a reassembled PDU]
154   0.025995 172.31.29.138 -> 54.230.158.182 TCP 66 42850 > http [ACK] Seq=98 Ack=575924 Win=709248 Len=0 TSval=2459868 TSecr=832276543
155   0.026086 54.230.158.182 -> 172.31.29.138 TCP 8754 [TCP segment of a reassembled PDU]
156   0.026106 172.31.29.138 -> 54.230.158.182 TCP 66 42850 > http [ACK] Seq=98 Ack=584612 Win=709248 Len=0 TSval=2459868 TSecr=832276543
157   0.026588 54.230.158.182 -> 172.31.29.138 TCP 4410 [TCP segment of a reassembled PDU]
158   0.026606 172.31.29.138 -> 54.230.158.182 TCP 66 42850 > http [ACK] Seq=98 Ack=588956 Win=709248 Len=0 TSval=2459868 TSecr=832276543
159   0.026744 54.230.158.182 -> 172.31.29.138 TCP 18890 [TCP segment of a reassembled PDU]
160   0.026771 172.31.29.138 -> 54.230.158.182 TCP 66 42850 > http [ACK] Seq=98 Ack=607780 Win=690432 Len=0 TSval=2459868 TSecr=832276543
161   0.027339 54.230.158.182 -> 172.31.29.138 TCP 2962 [TCP segment of a reassembled PDU]
162   0.027345 172.31.29.138 -> 54.230.158.182 TCP 66 42850 > http [ACK] Seq=98 Ack=610676 Win=707072 Len=0 TSval=2459868 TSecr=832276543
163   0.027515 54.230.158.182 -> 172.31.29.138 TCP 21786 [TCP segment of a reassembled PDU]
164   0.027738 172.31.29.138 -> 54.230.158.182 TCP 66 42850 > http [ACK] Seq=98 Ack=632396 Win=685440 Len=0 TSval=2459868 TSecr=832276543
165   0.028368 54.230.158.182 -> 172.31.29.138 TCP 2962 [TCP segment of a reassembled PDU]
166   0.028374 172.31.29.138 -> 54.230.158.182 TCP 66 42850 > http [ACK] Seq=98 Ack=635292 Win=707072 Len=0 TSval=2459869 TSecr=832276543
167   0.028541 54.230.158.182 -> 172.31.29.138 TCP 21786 [TCP segment of a reassembled PDU]
168   0.028565 172.31.29.138 -> 54.230.158.182 TCP 66 42850 > http [ACK] Seq=98 Ack=657012 Win=685440 Len=0 TSval=2459869 TSecr=832276543
169   0.029156 54.230.158.182 -> 172.31.29.138 TCP 2962 [TCP segment of a reassembled PDU]
170   0.029162 172.31.29.138 -> 54.230.158.182 TCP 66 42850 > http [ACK] Seq=98 Ack=659908 Win=707072 Len=0 TSval=2459869 TSecr=832276543
171   0.029334 54.230.158.182 -> 172.31.29.138 TCP 21786 [TCP segment of a reassembled PDU]
172   0.029358 172.31.29.138 -> 54.230.158.182 TCP 66 42850 > http [ACK] Seq=98 Ack=681628 Win=685440 Len=0 TSval=2459869 TSecr=832276543
173   0.029931 54.230.158.182 -> 172.31.29.138 TCP 5858 [TCP segment of a reassembled PDU]
174   0.029938 172.31.29.138 -> 54.230.158.182 TCP 66 42850 > http [ACK] Seq=98 Ack=687420 Win=702336 Len=0 TSval=2459869 TSecr=832276543
175   0.030093 54.230.158.182 -> 172.31.29.138 TCP 18890 [TCP segment of a reassembled PDU]
176   0.030116 172.31.29.138 -> 54.230.158.182 TCP 66 42850 > http [ACK] Seq=98 Ack=706244 Win=683520 Len=0 TSval=2459869 TSecr=832276543
177   0.030730 54.230.158.182 -> 172.31.29.138 TCP 7306 [TCP segment of a reassembled PDU]
178   0.030737 172.31.29.138 -> 54.230.158.182 TCP 66 42850 > http [ACK] Seq=98 Ack=713484 Win=699904 Len=0 TSval=2459869 TSecr=832276543
179   0.030882 54.230.158.182 -> 172.31.29.138 TCP 18890 [TCP segment of a reassembled PDU]
180   0.030906 172.31.29.138 -> 54.230.158.182 TCP 66 42850 > http [ACK] Seq=98 Ack=732308 Win=681088 Len=0 TSval=2459869 TSecr=832276543
181   0.031229 54.230.158.182 -> 172.31.29.138 TCP 5858 [TCP segment of a reassembled PDU]
182   0.031235 172.31.29.138 -> 54.230.158.182 TCP 66 42850 > http [ACK] Seq=98 Ack=738100 Win=702336 Len=0 TSval=2459869 TSecr=832276544
183   0.031482 54.230.158.182 -> 172.31.29.138 TCP 2962 [TCP segment of a reassembled PDU]
184   0.031488 172.31.29.138 -> 54.230.158.182 TCP 66 42850 > http [ACK] Seq=98 Ack=740996 Win=707072 Len=0 TSval=2459869 TSecr=832276544
185   0.031647 54.230.158.182 -> 172.31.29.138 TCP 17442 [TCP segment of a reassembled PDU]
186   0.031704 172.31.29.138 -> 54.230.158.182 TCP 66 42850 > http [ACK] Seq=98 Ack=758372 Win=689792 Len=0 TSval=2459869 TSecr=832276544
187   0.031994 54.230.158.182 -> 172.31.29.138 TCP 2962 [TCP segment of a reassembled PDU]
188   0.032000 172.31.29.138 -> 54.230.158.182 TCP 66 42850 > http [ACK] Seq=98 Ack=761268 Win=707072 Len=0 TSval=2459869 TSecr=832276544
189   0.032129 54.230.158.182 -> 172.31.29.138 TCP 5858 [TCP segment of a reassembled PDU]
190   0.032146 172.31.29.138 -> 54.230.158.182 TCP 66 42850 > http [ACK] Seq=98 Ack=767060 Win=709248 Len=0 TSval=2459869 TSecr=832276544
191   0.032259 54.230.158.182 -> 172.31.29.138 TCP 7306 [TCP segment of a reassembled PDU]
192   0.032278 172.31.29.138 -> 54.230.158.182 TCP 66 42850 > http [ACK] Seq=98 Ack=774300 Win=709248 Len=0 TSval=2459870 TSecr=832276544
193   0.032393 54.230.158.182 -> 172.31.29.138 TCP 10202 [TCP segment of a reassembled PDU]
194   0.032413 172.31.29.138 -> 54.230.158.182 TCP 66 42850 > http [ACK] Seq=98 Ack=784436 Win=709248 Len=0 TSval=2459870 TSecr=832276544
195   0.032758 54.230.158.182 -> 172.31.29.138 TCP 2962 [TCP segment of a reassembled PDU]
196   0.032774 172.31.29.138 -> 54.230.158.182 TCP 66 42850 > http [ACK] Seq=98 Ack=787332 Win=709248 Len=0 TSval=2459870 TSecr=832276544
197   0.032892 54.230.158.182 -> 172.31.29.138 TCP 5858 [TCP segment of a reassembled PDU]
198   0.032909 172.31.29.138 -> 54.230.158.182 TCP 66 42850 > http [ACK] Seq=98 Ack=793124 Win=709248 Len=0 TSval=2459870 TSecr=832276544
199   0.033029 54.230.158.182 -> 172.31.29.138 TCP 7306 [TCP segment of a reassembled PDU]
200   0.033047 172.31.29.138 -> 54.230.158.182 TCP 66 42850 > http [ACK] Seq=98 Ack=800364 Win=709248 Len=0 TSval=2459870 TSecr=832276544
201   0.033141 54.230.158.182 -> 172.31.29.138 TCP 2962 [TCP segment of a reassembled PDU]
202   0.033156 172.31.29.138 -> 54.230.158.182 TCP 66 42850 > http [ACK] Seq=98 Ack=803260 Win=709248 Len=0 TSval=2459870 TSecr=832276544
203   0.033272 54.230.158.182 -> 172.31.29.138 TCP 4410 [TCP segment of a reassembled PDU]
204   0.033290 172.31.29.138 -> 54.230.158.182 TCP 66 42850 > http [ACK] Seq=98 Ack=807604 Win=709248 Len=0 TSval=2459870 TSecr=832276544
205   0.033399 54.230.158.182 -> 172.31.29.138 TCP 5858 [TCP segment of a reassembled PDU]
206   0.033418 172.31.29.138 -> 54.230.158.182 TCP 66 42850 > http [ACK] Seq=98 Ack=813396 Win=709248 Len=0 TSval=2459870 TSecr=832276544
207   0.033669 54.230.158.182 -> 172.31.29.138 TCP 13098 [TCP segment of a reassembled PDU]
208   0.033692 172.31.29.138 -> 54.230.158.182 TCP 66 42850 > http [ACK] Seq=98 Ack=826428 Win=709248 Len=0 TSval=2459870 TSecr=832276544
209   0.034051 54.230.158.182 -> 172.31.29.138 TCP 7306 [TCP segment of a reassembled PDU]
210   0.034071 172.31.29.138 -> 54.230.158.182 TCP 66 42850 > http [ACK] Seq=98 Ack=833668 Win=709248 Len=0 TSval=2459870 TSecr=832276544
211   0.034171 54.230.158.182 -> 172.31.29.138 TCP 5858 [TCP segment of a reassembled PDU]
212   0.034190 172.31.29.138 -> 54.230.158.182 TCP 66 42850 > http [ACK] Seq=98 Ack=839460 Win=709248 Len=0 TSval=2459870 TSecr=832276544
213   0.034289 54.230.158.182 -> 172.31.29.138 TCP 2962 [TCP segment of a reassembled PDU]
214   0.034305 172.31.29.138 -> 54.230.158.182 TCP 66 42850 > http [ACK] Seq=98 Ack=842356 Win=709248 Len=0 TSval=2459870 TSecr=832276544
215   0.034433 54.230.158.182 -> 172.31.29.138 TCP 10202 [TCP segment of a reassembled PDU]
216   0.034454 172.31.29.138 -> 54.230.158.182 TCP 66 42850 > http [ACK] Seq=98 Ack=852492 Win=709248 Len=0 TSval=2459870 TSecr=832276544
217   0.035081 54.230.158.182 -> 172.31.29.138 TCP 7306 [TCP segment of a reassembled PDU]
218   0.035101 172.31.29.138 -> 54.230.158.182 TCP 66 42850 > http [ACK] Seq=98 Ack=859732 Win=709248 Len=0 TSval=2459870 TSecr=832276544
219   0.035202 54.230.158.182 -> 172.31.29.138 TCP 8754 [TCP segment of a reassembled PDU]
220   0.035248 54.230.158.182 -> 172.31.29.138 TCP 11650 [TCP segment of a reassembled PDU]
221   0.035462 172.31.29.138 -> 54.230.158.182 TCP 66 42850 > http [ACK] Seq=98 Ack=880004 Win=692864 Len=0 TSval=2459870 TSecr=832276544
222   0.036106 54.230.158.182 -> 172.31.29.138 TCP 7306 [TCP segment of a reassembled PDU]
223   0.036114 172.31.29.138 -> 54.230.158.182 TCP 66 42850 > http [ACK] Seq=98 Ack=887244 Win=699904 Len=0 TSval=2459870 TSecr=832276544
224   0.036261 54.230.158.182 -> 172.31.29.138 TCP 20338 [TCP segment of a reassembled PDU]
225   0.036286 172.31.29.138 -> 54.230.158.182 TCP 66 42850 > http [ACK] Seq=98 Ack=907516 Win=679680 Len=0 TSval=2459871 TSecr=832276544
226   0.036874 54.230.158.182 -> 172.31.29.138 TCP 7306 [TCP segment of a reassembled PDU]
227   0.036881 172.31.29.138 -> 54.230.158.182 TCP 66 42850 > http [ACK] Seq=98 Ack=914756 Win=699904 Len=0 TSval=2459871 TSecr=832276544
228   0.037032 54.230.158.182 -> 172.31.29.138 TCP 18890 [TCP segment of a reassembled PDU]
229   0.037055 172.31.29.138 -> 54.230.158.182 TCP 66 42850 > http [ACK] Seq=98 Ack=933580 Win=681088 Len=0 TSval=2459871 TSecr=832276544
230   0.037738 54.230.158.182 -> 172.31.29.138 TCP 1514 [TCP segment of a reassembled PDU]
231   0.037950 54.230.158.182 -> 172.31.29.138 TCP 26130 [TCP segment of a reassembled PDU]
232   0.037976 172.31.29.138 -> 54.230.158.182 TCP 66 42850 > http [ACK] Seq=98 Ack=961092 Win=669056 Len=0 TSval=2459871 TSecr=832276544
233   0.038777 54.230.158.182 -> 172.31.29.138 TCP 1514 [TCP segment of a reassembled PDU]
234   0.038957 54.230.158.182 -> 172.31.29.138 TCP 26130 [TCP segment of a reassembled PDU]
235   0.038972 172.31.29.138 -> 54.230.158.182 TCP 66 42850 > http [ACK] Seq=98 Ack=988604 Win=669056 Len=0 TSval=2459871 TSecr=832276544
236   0.039815 54.230.158.182 -> 172.31.29.138 TCP 7306 [TCP segment of a reassembled PDU]
237   0.039823 172.31.29.138 -> 54.230.158.182 TCP 66 42850 > http [ACK] Seq=98 Ack=995844 Win=699904 Len=0 TSval=2459871 TSecr=832276544
238   0.039894 54.230.158.182 -> 172.31.29.138 TCP 2962 [TCP segment of a reassembled PDU]
239   0.039900 172.31.29.138 -> 54.230.158.182 TCP 66 42850 > http [ACK] Seq=98 Ack=998740 Win=707072 Len=0 TSval=2459871 TSecr=832276544
240   0.039986 54.230.158.182 -> 172.31.29.138 TCP 17442 [TCP segment of a reassembled PDU]
241   0.040008 172.31.29.138 -> 54.230.158.182 TCP 66 42850 > http [ACK] Seq=98 Ack=1016116 Win=689792 Len=0 TSval=2459871 TSecr=832276544
242   0.040595 54.230.158.182 -> 172.31.29.138 TCP 10202 [TCP segment of a reassembled PDU]
243   0.040603 172.31.29.138 -> 54.230.158.182 TCP 66 42850 > http [ACK] Seq=98 Ack=1026252 Win=695168 Len=0 TSval=2459872 TSecr=832276544
244   0.040718 54.230.158.182 -> 172.31.29.138 TCP 17442 [TCP segment of a reassembled PDU]
245   0.040741 172.31.29.138 -> 54.230.158.182 TCP 66 42850 > http [ACK] Seq=98 Ack=1043628 Win=683264 Len=0 TSval=2459872 TSecr=832276544
246   0.041337 54.230.158.182 -> 172.31.29.138 TCP 7306 [TCP segment of a reassembled PDU]
247   0.041344 172.31.29.138 -> 54.230.158.182 TCP 66 42850 > http [ACK] Seq=98 Ack=1050868 Win=699904 Len=0 TSval=2459872 TSecr=832276545
248   0.041443 54.230.158.182 -> 172.31.29.138 TCP 2962 [TCP segment of a reassembled PDU]
249   0.041448 172.31.29.138 -> 54.230.158.182 TCP 66 42850 > http [ACK] Seq=98 Ack=1053764 Win=707072 Len=0 TSval=2459872 TSecr=832276545
250   0.041704 54.230.158.182 -> 172.31.29.138 TCP 10202 [TCP segment of a reassembled PDU]
251   0.041725 172.31.29.138 -> 54.230.158.182 TCP 66 42850 > http [ACK] Seq=98 Ack=1063900 Win=709248 Len=0 TSval=2459872 TSecr=832276545
252   0.042097 54.230.158.182 -> 172.31.29.138 TCP 2962 [TCP segment of a reassembled PDU]
253   0.042114 172.31.29.138 -> 54.230.158.182 TCP 66 42850 > http [ACK] Seq=98 Ack=1066796 Win=709248 Len=0 TSval=2459872 TSecr=832276545
254   0.042278 54.230.158.182 -> 172.31.29.138 TCP 24682 [TCP segment of a reassembled PDU]
255   0.042455 172.31.29.138 -> 54.230.158.182 TCP 66 42850 > http [ACK] Seq=98 Ack=1091412 Win=684672 Len=0 TSval=2459872 TSecr=832276545
256   0.043151 54.230.158.182 -> 172.31.29.138 TCP 8754 [TCP segment of a reassembled PDU]
257   0.043159 172.31.29.138 -> 54.230.158.182 TCP 66 42850 > http [ACK] Seq=98 Ack=1100100 Win=697600 Len=0 TSval=2459872 TSecr=832276545
258   0.043294 54.230.158.182 -> 172.31.29.138 TCP 18890 [TCP segment of a reassembled PDU]
259   0.043317 172.31.29.138 -> 54.230.158.182 TCP 66 42850 > http [ACK] Seq=98 Ack=1118924 Win=680832 Len=0 TSval=2459872 TSecr=832276545
260   0.043897 54.230.158.182 -> 172.31.29.138 TCP 2962 [TCP segment of a reassembled PDU]
261   0.043908 172.31.29.138 -> 54.230.158.182 TCP 66 42850 > http [ACK] Seq=98 Ack=1121820 Win=707072 Len=0 TSval=2459872 TSecr=832276545
262   0.044020 54.230.158.182 -> 172.31.29.138 TCP 7306 [TCP segment of a reassembled PDU]
263   0.044042 172.31.29.138 -> 54.230.158.182 TCP 66 42850 > http [ACK] Seq=98 Ack=1129060 Win=709248 Len=0 TSval=2459872 TSecr=832276545
264   0.044087 54.230.158.182 -> 172.31.29.138 TCP 18890 [TCP segment of a reassembled PDU]
265   0.044111 172.31.29.138 -> 54.230.158.182 TCP 66 42850 > http [ACK] Seq=98 Ack=1147884 Win=690432 Len=0 TSval=2459872 TSecr=832276545
266   0.044713 54.230.158.182 -> 172.31.29.138 TCP 5858 [TCP segment of a reassembled PDU]
267   0.044720 172.31.29.138 -> 54.230.158.182 TCP 66 42850 > http [ACK] Seq=98 Ack=1153676 Win=702336 Len=0 TSval=2459873 TSecr=832276545
268   0.044826 54.230.158.182 -> 172.31.29.138 TCP 4410 [TCP segment of a reassembled PDU]
269   0.044832 172.31.29.138 -> 54.230.158.182 TCP 66 42850 > http [ACK] Seq=98 Ack=1158020 Win=704640 Len=0 TSval=2459873 TSecr=832276545
270   0.044954 54.230.158.182 -> 172.31.29.138 TCP 5858 [TCP segment of a reassembled PDU]
271   0.044973 172.31.29.138 -> 54.230.158.182 TCP 66 42850 > http [ACK] Seq=98 Ack=1163812 Win=709248 Len=0 TSval=2459873 TSecr=832276545
272   0.045100 54.230.158.182 -> 172.31.29.138 TCP 13098 [TCP segment of a reassembled PDU]
273   0.045123 172.31.29.138 -> 54.230.158.182 TCP 66 42850 > http [ACK] Seq=98 Ack=1176844 Win=709248 Len=0 TSval=2459873 TSecr=832276545
274   0.045514 54.230.158.182 -> 172.31.29.138 TCP 4410 [TCP segment of a reassembled PDU]
275   0.045532 172.31.29.138 -> 54.230.158.182 TCP 66 42850 > http [ACK] Seq=98 Ack=1181188 Win=709248 Len=0 TSval=2459873 TSecr=832276545
276   0.045645 54.230.158.182 -> 172.31.29.138 TCP 5858 [TCP segment of a reassembled PDU]
277   0.045664 172.31.29.138 -> 54.230.158.182 TCP 66 42850 > http [ACK] Seq=98 Ack=1186980 Win=709248 Len=0 TSval=2459873 TSecr=832276545
278   0.045755 54.230.158.182 -> 172.31.29.138 TCP 2962 [TCP segment of a reassembled PDU]
279   0.045772 172.31.29.138 -> 54.230.158.182 TCP 66 42850 > http [ACK] Seq=98 Ack=1189876 Win=709248 Len=0 TSval=2459873 TSecr=832276545
280   0.045918 54.230.158.182 -> 172.31.29.138 TCP 15994 [TCP segment of a reassembled PDU]
281   0.046146 172.31.29.138 -> 54.230.158.182 TCP 66 42850 > http [ACK] Seq=98 Ack=1205804 Win=709248 Len=0 TSval=2459873 TSecr=832276545
282   0.046228 54.230.158.182 -> 172.31.29.138 TCP 5858 [TCP segment of a reassembled PDU]
283   0.046247 172.31.29.138 -> 54.230.158.182 TCP 66 42850 > http [ACK] Seq=98 Ack=1211596 Win=709248 Len=0 TSval=2459873 TSecr=832276545
284   0.046350 54.230.158.182 -> 172.31.29.138 TCP 4410 [TCP segment of a reassembled PDU]
285   0.046367 172.31.29.138 -> 54.230.158.182 TCP 66 42850 > http [ACK] Seq=98 Ack=1215940 Win=709248 Len=0 TSval=2459873 TSecr=832276545
286   0.046749 54.230.158.182 -> 172.31.29.138 TCP 1514 [TCP segment of a reassembled PDU]
287   0.046944 54.230.158.182 -> 172.31.29.138 TCP 27578 [TCP segment of a reassembled PDU]
288   0.046970 172.31.29.138 -> 54.230.158.182 TCP 66 42850 > http [ACK] Seq=98 Ack=1244900 Win=680320 Len=0 TSval=2459873 TSecr=832276545
289   0.047508 54.230.158.182 -> 172.31.29.138 TCP 2962 [TCP segment of a reassembled PDU]
290   0.047513 172.31.29.138 -> 54.230.158.182 TCP 66 42850 > http [ACK] Seq=98 Ack=1247796 Win=707072 Len=0 TSval=2459873 TSecr=832276545
291   0.047642 54.230.158.182 -> 172.31.29.138 TCP 11650 [TCP segment of a reassembled PDU]
292   0.047671 54.230.158.182 -> 172.31.29.138 TCP 8754 [TCP segment of a reassembled PDU]
293   0.047680 54.230.158.182 -> 172.31.29.138 TCP 5858 [TCP segment of a reassembled PDU]
294   0.047692 172.31.29.138 -> 54.230.158.182 TCP 66 42850 > http [ACK] Seq=98 Ack=1273860 Win=688000 Len=0 TSval=2459873 TSecr=832276545
295   0.048311 54.230.158.182 -> 172.31.29.138 TCP 4410 [TCP segment of a reassembled PDU]
296   0.048316 172.31.29.138 -> 54.230.158.182 TCP 66 42850 > http [ACK] Seq=98 Ack=1278204 Win=704640 Len=0 TSval=2459874 TSecr=832276545
297   0.048480 54.230.158.182 -> 172.31.29.138 TCP 24682 [TCP segment of a reassembled PDU]
298   0.048507 172.31.29.138 -> 54.230.158.182 TCP 66 42850 > http [ACK] Seq=98 Ack=1302820 Win=680064 Len=0 TSval=2459874 TSecr=832276545
299   0.049090 54.230.158.182 -> 172.31.29.138 TCP 4410 [TCP segment of a reassembled PDU]
300   0.049097 172.31.29.138 -> 54.230.158.182 TCP 66 42850 > http [ACK] Seq=98 Ack=1307164 Win=704640 Len=0 TSval=2459874 TSecr=832276545
301   0.049246 54.230.158.182 -> 172.31.29.138 TCP 17442 [TCP segment of a reassembled PDU]
302   0.049435 172.31.29.138 -> 54.230.158.182 TCP 66 42850 > http [ACK] Seq=98 Ack=1324540 Win=687360 Len=0 TSval=2459874 TSecr=832276545
303   0.049687 54.230.158.182 -> 172.31.29.138 TCP 11650 [TCP segment of a reassembled PDU]
304   0.049696 172.31.29.138 -> 54.230.158.182 TCP 66 42850 > http [ACK] Seq=98 Ack=1336124 Win=692864 Len=0 TSval=2459874 TSecr=832276545
305   0.049967 54.230.158.182 -> 172.31.29.138 TCP 18890 [TCP segment of a reassembled PDU]
306   0.049990 172.31.29.138 -> 54.230.158.182 TCP 66 42850 > http [ACK] Seq=98 Ack=1354948 Win=680832 Len=0 TSval=2459874 TSecr=832276545
307   0.050085 54.230.158.182 -> 172.31.29.138 TCP 1514 [TCP segment of a reassembled PDU]
308   0.050228 54.230.158.182 -> 172.31.29.138 TCP 10202 [TCP segment of a reassembled PDU]
309   0.050236 172.31.29.138 -> 54.230.158.182 TCP 66 42850 > http [ACK] Seq=98 Ack=1366532 Win=695168 Len=0 TSval=2459874 TSecr=832276545
310   0.050620 54.230.158.182 -> 172.31.29.138 TCP 7306 [TCP segment of a reassembled PDU]
311   0.050627 172.31.29.138 -> 54.230.158.182 TCP 66 42850 > http [ACK] Seq=98 Ack=1373772 Win=699904 Len=0 TSval=2459874 TSecr=832276545
312   0.050742 54.230.158.182 -> 172.31.29.138 TCP 11650 [TCP segment of a reassembled PDU]
313   0.050762 172.31.29.138 -> 54.230.158.182 TCP 66 42850 > http [ACK] Seq=98 Ack=1385356 Win=709248 Len=0 TSval=2459874 TSecr=832276545
314   0.050937 54.230.158.182 -> 172.31.29.138 TCP 4410 [TCP segment of a reassembled PDU]
315   0.050957 172.31.29.138 -> 54.230.158.182 TCP 66 42850 > http [ACK] Seq=98 Ack=1389700 Win=709248 Len=0 TSval=2459874 TSecr=832276545
316   0.051223 54.230.158.182 -> 172.31.29.138 TCP 14546 [TCP segment of a reassembled PDU]
317   0.051247 172.31.29.138 -> 54.230.158.182 TCP 66 42850 > http [ACK] Seq=98 Ack=1404180 Win=709248 Len=0 TSval=2459874 TSecr=832276546
318   0.051386 54.230.158.182 -> 172.31.29.138 TCP 5858 [TCP segment of a reassembled PDU]
319   0.051404 172.31.29.138 -> 54.230.158.182 TCP 66 42850 > http [ACK] Seq=98 Ack=1409972 Win=709248 Len=0 TSval=2459874 TSecr=832276546
320   0.051492 54.230.158.182 -> 172.31.29.138 TCP 5858 [TCP segment of a reassembled PDU]
321   0.051510 172.31.29.138 -> 54.230.158.182 TCP 66 42850 > http [ACK] Seq=98 Ack=1415764 Win=709248 Len=0 TSval=2459874 TSecr=832276546
322   0.051885 54.230.158.182 -> 172.31.29.138 TCP 1514 [TCP segment of a reassembled PDU]
323   0.052072 54.230.158.182 -> 172.31.29.138 TCP 29026 [TCP segment of a reassembled PDU]
324   0.052262 172.31.29.138 -> 54.230.158.182 TCP 66 42850 > http [ACK] Seq=98 Ack=1446172 Win=678912 Len=0 TSval=2459874 TSecr=832276546
325   0.052719 54.230.158.182 -> 172.31.29.138 TCP 5858 [TCP segment of a reassembled PDU]
326   0.052726 172.31.29.138 -> 54.230.158.182 TCP 66 42850 > http [ACK] Seq=98 Ack=1451964 Win=702336 Len=0 TSval=2459875 TSecr=832276546
327   0.052851 54.230.158.182 -> 172.31.29.138 TCP 24682 [TCP segment of a reassembled PDU]
328   0.052876 172.31.29.138 -> 54.230.158.182 TCP 66 42850 > http [ACK] Seq=98 Ack=1476580 Win=677760 Len=0 TSval=2459875 TSecr=832276546
329   0.053695 54.230.158.182 -> 172.31.29.138 TCP 2962 [TCP segment of a reassembled PDU]
330   0.053701 172.31.29.138 -> 54.230.158.182 TCP 66 42850 > http [ACK] Seq=98 Ack=1479476 Win=707072 Len=0 TSval=2459875 TSecr=832276546
331   0.053871 54.230.158.182 -> 172.31.29.138 TCP 27578 [TCP segment of a reassembled PDU]
332   0.053898 172.31.29.138 -> 54.230.158.182 TCP 66 42850 > http [ACK] Seq=98 Ack=1506988 Win=679680 Len=0 TSval=2459875 TSecr=832276546
333   0.054724 54.230.158.182 -> 172.31.29.138 TCP 2962 [TCP segment of a reassembled PDU]
334   0.054730 172.31.29.138 -> 54.230.158.182 TCP 66 42850 > http [ACK] Seq=98 Ack=1509884 Win=707072 Len=0 TSval=2459875 TSecr=832276546
335   0.054895 54.230.158.182 -> 172.31.29.138 TCP 27578 [TCP segment of a reassembled PDU]
336   0.054924 172.31.29.138 -> 54.230.158.182 TCP 66 42850 > http [ACK] Seq=98 Ack=1537396 Win=679680 Len=0 TSval=2459875 TSecr=832276546
337   0.055525 54.230.158.182 -> 172.31.29.138 TCP 1514 [TCP segment of a reassembled PDU]
338   0.055720 54.230.158.182 -> 172.31.29.138 TCP 29026 [TCP segment of a reassembled PDU]
339   0.055892 172.31.29.138 -> 54.230.158.182 TCP 66 42850 > http [ACK] Seq=98 Ack=1567804 Win=664192 Len=0 TSval=2459875 TSecr=832276546
340   0.056333 54.230.158.182 -> 172.31.29.138 TCP 1514 [TCP segment of a reassembled PDU]
341   0.056474 54.230.158.182 -> 172.31.29.138 TCP 15994 [TCP segment of a reassembled PDU]
342   0.056485 172.31.29.138 -> 54.230.158.182 TCP 66 42850 > http [ACK] Seq=98 Ack=1585180 Win=685568 Len=0 TSval=2459876 TSecr=832276546
343   0.056504 54.230.158.182 -> 172.31.29.138 TCP 13098 [TCP segment of a reassembled PDU]
344   0.056531 172.31.29.138 -> 54.230.158.182 TCP 66 42850 > http [ACK] Seq=98 Ack=1598212 Win=690432 Len=0 TSval=2459876 TSecr=832276546
345   0.057059 54.230.158.182 -> 172.31.29.138 TCP 7306 [TCP segment of a reassembled PDU]
346   0.057066 172.31.29.138 -> 54.230.158.182 TCP 66 42850 > http [ACK] Seq=98 Ack=1605452 Win=699904 Len=0 TSval=2459876 TSecr=832276546
347   0.057208 54.230.158.182 -> 172.31.29.138 TCP 23234 [TCP segment of a reassembled PDU]
348   0.057233 172.31.29.138 -> 54.230.158.182 TCP 66 42850 > http [ACK] Seq=98 Ack=1628620 Win=676736 Len=0 TSval=2459876 TSecr=832276546
349   0.058090 54.230.158.182 -> 172.31.29.138 TCP 1514 [TCP segment of a reassembled PDU]
