[Measurement for 1mb at 21:35:22 19.35.2014] 
Tshark:

  1   0.000000 172.31.29.138 -> 172.31.0.2   DNS 89 Standard query 0xd19b  A d39wppo36gwqpx.cloudfront.net
  2   0.000041 172.31.29.138 -> 172.31.0.2   DNS 89 Standard query 0xe24c  AAAA d39wppo36gwqpx.cloudfront.net
  3   0.000535   172.31.0.2 -> 172.31.29.138 DNS 170 Standard query response 0xe24c 
  4   0.000545   172.31.0.2 -> 172.31.29.138 DNS 217 Standard query response 0xd19b  A 54.230.158.182 A 54.230.158.217 A 54.230.158.223 A 54.230.158.246 A 54.230.159.4 A 54.230.159.150 A 54.230.159.153 A 54.230.158.152
  5   0.003804 172.31.29.138 -> 54.230.158.182 TCP 74 42904 > http [SYN] Seq=0 Win=26883 Len=0 MSS=8961 SACK_PERM=1 TSval=4198900 TSecr=0 WS=128
  6   0.004423 54.230.158.182 -> 172.31.29.138 TCP 74 http > 42904 [SYN, ACK] Seq=0 Ack=1 Win=14480 Len=0 MSS=1460 SACK_PERM=1 TSval=727929855 TSecr=4198900 WS=128
  7   0.004437 172.31.29.138 -> 54.230.158.182 TCP 66 42904 > http [ACK] Seq=1 Ack=1 Win=27008 Len=0 TSval=4198900 TSecr=727929855
  8   0.004477 172.31.29.138 -> 54.230.158.182 HTTP 162 GET /1mb HTTP/1.1 
  9   0.004927 54.230.158.182 -> 172.31.29.138 TCP 66 http > 42904 [ACK] Seq=1 Ack=97 Win=14592 Len=0 TSval=727929855 TSecr=4198900
 10   0.007171 54.230.158.182 -> 172.31.29.138 TCP 523 [TCP segment of a reassembled PDU]
 11   0.007178 172.31.29.138 -> 54.230.158.182 TCP 66 42904 > http [ACK] Seq=97 Ack=458 Win=28032 Len=0 TSval=4198900 TSecr=727929855
 12   0.007206 54.230.158.182 -> 172.31.29.138 TCP 5858 [TCP segment of a reassembled PDU]
 13   0.007213 172.31.29.138 -> 54.230.158.182 TCP 66 42904 > http [ACK] Seq=97 Ack=6250 Win=39552 Len=0 TSval=4198900 TSecr=727929855
 14   0.007247 54.230.158.182 -> 172.31.29.138 TCP 7306 [TCP segment of a reassembled PDU]
 15   0.007253 172.31.29.138 -> 54.230.158.182 TCP 66 42904 > http [ACK] Seq=97 Ack=13490 Win=54144 Len=0 TSval=4198900 TSecr=727929855
 16   0.007945 54.230.158.182 -> 172.31.29.138 TCP 4410 [TCP segment of a reassembled PDU]
 17   0.007952 172.31.29.138 -> 54.230.158.182 TCP 66 42904 > http [ACK] Seq=97 Ack=17834 Win=62720 Len=0 TSval=4198901 TSecr=727929855
 18   0.007990 54.230.158.182 -> 172.31.29.138 TCP 8754 [TCP segment of a reassembled PDU]
 19   0.007997 172.31.29.138 -> 54.230.158.182 TCP 66 42904 > http [ACK] Seq=97 Ack=26522 Win=80128 Len=0 TSval=4198901 TSecr=727929855
 20   0.008467 54.230.158.182 -> 172.31.29.138 TCP 4410 [TCP segment of a reassembled PDU]
 21   0.008473 172.31.29.138 -> 54.230.158.182 TCP 66 42904 > http [ACK] Seq=97 Ack=30866 Win=88832 Len=0 TSval=4198901 TSecr=727929855
 22   0.008509 54.230.158.182 -> 172.31.29.138 TCP 7306 [TCP segment of a reassembled PDU]
 23   0.008516 172.31.29.138 -> 54.230.158.182 TCP 66 42904 > http [ACK] Seq=97 Ack=38106 Win=103296 Len=0 TSval=4198901 TSecr=727929855
 24   0.008582 54.230.158.182 -> 172.31.29.138 TCP 10202 [TCP segment of a reassembled PDU]
 25   0.008592 172.31.29.138 -> 54.230.158.182 TCP 66 42904 > http [ACK] Seq=97 Ack=48242 Win=101248 Len=0 TSval=4198901 TSecr=727929855
 26   0.009013 54.230.158.182 -> 172.31.29.138 TCP 8754 [TCP segment of a reassembled PDU]
 27   0.009021 172.31.29.138 -> 54.230.158.182 TCP 66 42904 > http [ACK] Seq=97 Ack=56930 Win=103680 Len=0 TSval=4198901 TSecr=727929855
 28   0.009061 54.230.158.182 -> 172.31.29.138 TCP 17442 [TCP segment of a reassembled PDU]
 29   0.009070 172.31.29.138 -> 54.230.158.182 TCP 66 42904 > http [ACK] Seq=97 Ack=74306 Win=89344 Len=0 TSval=4198901 TSecr=727929855
 30   0.009555 54.230.158.182 -> 172.31.29.138 TCP 5858 [TCP segment of a reassembled PDU]
 31   0.009561 172.31.29.138 -> 54.230.158.182 TCP 66 42904 > http [ACK] Seq=97 Ack=80098 Win=108416 Len=0 TSval=4198901 TSecr=727929855
 32   0.009637 54.230.158.182 -> 172.31.29.138 TCP 17442 [TCP segment of a reassembled PDU]
 33   0.009648 172.31.29.138 -> 54.230.158.182 TCP 66 42904 > http [ACK] Seq=97 Ack=97474 Win=91136 Len=0 TSval=4198901 TSecr=727929855
 34   0.010079 54.230.158.182 -> 172.31.29.138 TCP 13098 [TCP segment of a reassembled PDU]
 35   0.010088 172.31.29.138 -> 54.230.158.182 TCP 66 42904 > http [ACK] Seq=97 Ack=110506 Win=96512 Len=0 TSval=4198901 TSecr=727929855
 36   0.010284 54.230.158.182 -> 172.31.29.138 TCP 4410 [TCP segment of a reassembled PDU]
 37   0.010290 172.31.29.138 -> 54.230.158.182 TCP 66 42904 > http [ACK] Seq=97 Ack=114850 Win=109056 Len=0 TSval=4198901 TSecr=727929855
 38   0.010342 54.230.158.182 -> 172.31.29.138 TCP 1514 [TCP segment of a reassembled PDU]
 39   0.010347 172.31.29.138 -> 54.230.158.182 TCP 66 42904 > http [ACK] Seq=97 Ack=116298 Win=109056 Len=0 TSval=4198901 TSecr=727929855
 40   0.010420 54.230.158.182 -> 172.31.29.138 TCP 13098 [TCP segment of a reassembled PDU]
 41   0.010430 172.31.29.138 -> 54.230.158.182 TCP 66 42904 > http [ACK] Seq=97 Ack=129330 Win=96512 Len=0 TSval=4198901 TSecr=727929855
 42   0.010536 54.230.158.182 -> 172.31.29.138 TCP 5858 [TCP segment of a reassembled PDU]
 43   0.010542 172.31.29.138 -> 54.230.158.182 TCP 66 42904 > http [ACK] Seq=97 Ack=135122 Win=90752 Len=0 TSval=4198901 TSecr=727929855
 44   0.010826 54.230.158.182 -> 172.31.29.138 TCP 7306 [TCP segment of a reassembled PDU]
 45   0.010834 172.31.29.138 -> 54.230.158.182 TCP 66 42904 > http [ACK] Seq=97 Ack=142362 Win=105984 Len=0 TSval=4198901 TSecr=727929855
 46   0.010916 54.230.158.182 -> 172.31.29.138 TCP 7306 [TCP segment of a reassembled PDU]
 47   0.010923 172.31.29.138 -> 54.230.158.182 TCP 66 42904 > http [ACK] Seq=97 Ack=149602 Win=105984 Len=0 TSval=4198901 TSecr=727929855
 48   0.011162 54.230.158.182 -> 172.31.29.138 TCP 17442 [TCP segment of a reassembled PDU]
 49   0.011172 172.31.29.138 -> 54.230.158.182 TCP 66 42904 > http [ACK] Seq=97 Ack=166978 Win=89344 Len=0 TSval=4198901 TSecr=727929855
 50   0.011215 54.230.158.182 -> 172.31.29.138 TCP 7306 [TCP segment of a reassembled PDU]
 51   0.011222 172.31.29.138 -> 54.230.158.182 TCP 66 42904 > http [ACK] Seq=97 Ack=174218 Win=105984 Len=0 TSval=4198901 TSecr=727929855
 52   0.011535 54.230.158.182 -> 172.31.29.138 TCP 4410 [TCP segment of a reassembled PDU]
 53   0.011541 172.31.29.138 -> 54.230.158.182 TCP 66 42904 > http [ACK] Seq=97 Ack=178562 Win=109056 Len=0 TSval=4198902 TSecr=727929855
 54   0.011664 54.230.158.182 -> 172.31.29.138 TCP 8754 [TCP segment of a reassembled PDU]
 55   0.011672 172.31.29.138 -> 54.230.158.182 TCP 66 42904 > http [ACK] Seq=97 Ack=187250 Win=126464 Len=0 TSval=4198902 TSecr=727929855
 56   0.011947 54.230.158.182 -> 172.31.29.138 TCP 24682 [TCP segment of a reassembled PDU]
 57   0.011962 172.31.29.138 -> 54.230.158.182 TCP 66 42904 > http [ACK] Seq=97 Ack=211866 Win=175616 Len=0 TSval=4198902 TSecr=727929855
 58   0.011968 54.230.158.182 -> 172.31.29.138 TCP 1514 [TCP segment of a reassembled PDU]
 59   0.011971 172.31.29.138 -> 54.230.158.182 TCP 66 42904 > http [ACK] Seq=97 Ack=213314 Win=178560 Len=0 TSval=4198902 TSecr=727929855
 60   0.012336 54.230.158.182 -> 172.31.29.138 TCP 5858 [TCP segment of a reassembled PDU]
 61   0.012343 172.31.29.138 -> 54.230.158.182 TCP 66 42904 > http [ACK] Seq=97 Ack=219106 Win=190208 Len=0 TSval=4198902 TSecr=727929855
 62   0.012460 54.230.158.182 -> 172.31.29.138 TCP 15994 [TCP segment of a reassembled PDU]
 63   0.012470 172.31.29.138 -> 54.230.158.182 TCP 66 42904 > http [ACK] Seq=97 Ack=235034 Win=221952 Len=0 TSval=4198902 TSecr=727929855
 64   0.012753 54.230.158.182 -> 172.31.29.138 TCP 29026 [TCP segment of a reassembled PDU]
 65   0.012768 172.31.29.138 -> 54.230.158.182 TCP 66 42904 > http [ACK] Seq=97 Ack=263994 Win=279936 Len=0 TSval=4198902 TSecr=727929855
 66   0.013111 54.230.158.182 -> 172.31.29.138 TCP 7306 [TCP segment of a reassembled PDU]
 67   0.013118 172.31.29.138 -> 54.230.158.182 TCP 66 42904 > http [ACK] Seq=97 Ack=271234 Win=294400 Len=0 TSval=4198902 TSecr=727929855
 68   0.013254 54.230.158.182 -> 172.31.29.138 TCP 17442 [TCP segment of a reassembled PDU]
 69   0.013265 172.31.29.138 -> 54.230.158.182 TCP 66 42904 > http [ACK] Seq=97 Ack=288610 Win=329216 Len=0 TSval=4198902 TSecr=727929855
 70   0.013335 54.230.158.182 -> 172.31.29.138 TCP 4410 [TCP segment of a reassembled PDU]
 71   0.013341 172.31.29.138 -> 54.230.158.182 TCP 66 42904 > http [ACK] Seq=97 Ack=292954 Win=337792 Len=0 TSval=4198902 TSecr=727929855
 72   0.013509 54.230.158.182 -> 172.31.29.138 TCP 21786 [TCP segment of a reassembled PDU]
 73   0.013521 172.31.29.138 -> 54.230.158.182 TCP 66 42904 > http [ACK] Seq=97 Ack=314674 Win=381312 Len=0 TSval=4198902 TSecr=727929855
 74   0.013914 54.230.158.182 -> 172.31.29.138 TCP 13098 [TCP segment of a reassembled PDU]
 75   0.013923 172.31.29.138 -> 54.230.158.182 TCP 66 42904 > http [ACK] Seq=97 Ack=327706 Win=407296 Len=0 TSval=4198902 TSecr=727929855
 76   0.014049 54.230.158.182 -> 172.31.29.138 TCP 18890 [TCP segment of a reassembled PDU]
 77   0.014059 172.31.29.138 -> 54.230.158.182 TCP 66 42904 > http [ACK] Seq=97 Ack=346530 Win=445056 Len=0 TSval=4198902 TSecr=727929855
 78   0.014127 54.230.158.182 -> 172.31.29.138 TCP 2962 [TCP segment of a reassembled PDU]
 79   0.014133 172.31.29.138 -> 54.230.158.182 TCP 66 42904 > http [ACK] Seq=97 Ack=349426 Win=450816 Len=0 TSval=4198902 TSecr=727929856
 80   0.014296 54.230.158.182 -> 172.31.29.138 TCP 18890 [TCP segment of a reassembled PDU]
 81   0.014308 172.31.29.138 -> 54.230.158.182 TCP 66 42904 > http [ACK] Seq=97 Ack=368250 Win=488448 Len=0 TSval=4198902 TSecr=727929856
 82   0.014402 54.230.158.182 -> 172.31.29.138 TCP 7306 [TCP segment of a reassembled PDU]
 83   0.014408 172.31.29.138 -> 54.230.158.182 TCP 66 42904 > http [ACK] Seq=97 Ack=375490 Win=502912 Len=0 TSval=4198902 TSecr=727929856
 84   0.014551 54.230.158.182 -> 172.31.29.138 TCP 14546 [TCP segment of a reassembled PDU]
 85   0.014562 172.31.29.138 -> 54.230.158.182 TCP 66 42904 > http [ACK] Seq=97 Ack=389970 Win=531840 Len=0 TSval=4198902 TSecr=727929856
 86   0.014701 54.230.158.182 -> 172.31.29.138 TCP 24682 [TCP segment of a reassembled PDU]
 87   0.014714 172.31.29.138 -> 54.230.158.182 TCP 66 42904 > http [ACK] Seq=97 Ack=414586 Win=581120 Len=0 TSval=4198902 TSecr=727929856
 88   0.014906 54.230.158.182 -> 172.31.29.138 TCP 7306 [TCP segment of a reassembled PDU]
 89   0.014913 172.31.29.138 -> 54.230.158.182 TCP 66 42904 > http [ACK] Seq=97 Ack=421826 Win=595584 Len=0 TSval=4198902 TSecr=727929856
 90   0.015176 54.230.158.182 -> 172.31.29.138 TCP 11650 [TCP segment of a reassembled PDU]
 91   0.015184 172.31.29.138 -> 54.230.158.182 TCP 66 42904 > http [ACK] Seq=97 Ack=433410 Win=618752 Len=0 TSval=4198902 TSecr=727929856
 92   0.015342 54.230.158.182 -> 172.31.29.138 TCP 26130 [TCP segment of a reassembled PDU]
 93   0.015356 172.31.29.138 -> 54.230.158.182 TCP 66 42904 > http [ACK] Seq=97 Ack=459474 Win=670848 Len=0 TSval=4198902 TSecr=727929856
 94   0.015377 54.230.158.182 -> 172.31.29.138 TCP 15994 [TCP segment of a reassembled PDU]
 95   0.015385 172.31.29.138 -> 54.230.158.182 TCP 66 42904 > http [ACK] Seq=97 Ack=475402 Win=702720 Len=0 TSval=4198902 TSecr=727929856
 96   0.015658 54.230.158.182 -> 172.31.29.138 TCP 5858 [TCP segment of a reassembled PDU]
 97   0.015666 172.31.29.138 -> 54.230.158.182 TCP 66 42904 > http [ACK] Seq=97 Ack=481194 Win=714368 Len=0 TSval=4198903 TSecr=727929856
 98   0.015843 54.230.158.182 -> 172.31.29.138 TCP 26130 [TCP segment of a reassembled PDU]
 99   0.015857 172.31.29.138 -> 54.230.158.182 TCP 66 42904 > http [ACK] Seq=97 Ack=507258 Win=766464 Len=0 TSval=4198903 TSecr=727929856
100   0.015930 54.230.158.182 -> 172.31.29.138 TCP 13098 [TCP segment of a reassembled PDU]
101   0.015940 172.31.29.138 -> 54.230.158.182 TCP 66 42904 > http [ACK] Seq=97 Ack=520290 Win=792576 Len=0 TSval=4198903 TSecr=727929856
102   0.016043 54.230.158.182 -> 172.31.29.138 TCP 8754 [TCP segment of a reassembled PDU]
103   0.016050 172.31.29.138 -> 54.230.158.182 TCP 66 42904 > http [ACK] Seq=97 Ack=528978 Win=809856 Len=0 TSval=4198903 TSecr=727929856
104   0.016147 54.230.158.182 -> 172.31.29.138 TCP 1514 [TCP segment of a reassembled PDU]
105   0.016151 172.31.29.138 -> 54.230.158.182 TCP 66 42904 > http [ACK] Seq=97 Ack=530426 Win=812800 Len=0 TSval=4198903 TSecr=727929856
106   0.016348 54.230.158.182 -> 172.31.29.138 TCP 29026 [TCP segment of a reassembled PDU]
107   0.016363 172.31.29.138 -> 54.230.158.182 TCP 66 42904 > http [ACK] Seq=97 Ack=559386 Win=870656 Len=0 TSval=4198903 TSecr=727929856
108   0.016651 54.230.158.182 -> 172.31.29.138 TCP 4410 [TCP segment of a reassembled PDU]
109   0.016658 172.31.29.138 -> 54.230.158.182 TCP 66 42904 > http [ACK] Seq=97 Ack=563730 Win=879360 Len=0 TSval=4198903 TSecr=727929856
110   0.016791 54.230.158.182 -> 172.31.29.138 TCP 18890 [TCP segment of a reassembled PDU]
111   0.016802 172.31.29.138 -> 54.230.158.182 TCP 66 42904 > http [ACK] Seq=97 Ack=582554 Win=916992 Len=0 TSval=4198903 TSecr=727929856
112   0.016830 54.230.158.182 -> 172.31.29.138 TCP 8754 [TCP segment of a reassembled PDU]
113   0.016836 172.31.29.138 -> 54.230.158.182 TCP 66 42904 > http [ACK] Seq=97 Ack=591242 Win=934400 Len=0 TSval=4198903 TSecr=727929856
114   0.016896 54.230.158.182 -> 172.31.29.138 TCP 20338 [TCP segment of a reassembled PDU]
115   0.016908 172.31.29.138 -> 54.230.158.182 TCP 66 42904 > http [ACK] Seq=97 Ack=611514 Win=974976 Len=0 TSval=4198903 TSecr=727929856
116   0.016914 54.230.158.182 -> 172.31.29.138 TCP 1514 [TCP segment of a reassembled PDU]
117   0.016916 172.31.29.138 -> 54.230.158.182 TCP 66 42904 > http [ACK] Seq=97 Ack=612962 Win=977920 Len=0 TSval=4198903 TSecr=727929856
118   0.017068 54.230.158.182 -> 172.31.29.138 TCP 23234 [TCP segment of a reassembled PDU]
119   0.017080 172.31.29.138 -> 54.230.158.182 TCP 66 42904 > http [ACK] Seq=97 Ack=636130 Win=1024256 Len=0 TSval=4198903 TSecr=727929856
120   0.017282 54.230.158.182 -> 172.31.29.138 TCP 26130 [TCP segment of a reassembled PDU]
121   0.017297 172.31.29.138 -> 54.230.158.182 TCP 66 42904 > http [ACK] Seq=97 Ack=662194 Win=1076352 Len=0 TSval=4198903 TSecr=727929856
122   0.017309 54.230.158.182 -> 172.31.29.138 TCP 8754 [TCP segment of a reassembled PDU]
123   0.017318 172.31.29.138 -> 54.230.158.182 TCP 66 42904 > http [ACK] Seq=97 Ack=670882 Win=1093760 Len=0 TSval=4198903 TSecr=727929856
124   0.017670 54.230.158.182 -> 172.31.29.138 TCP 2962 [TCP segment of a reassembled PDU]
125   0.017676 172.31.29.138 -> 54.230.158.182 TCP 66 42904 > http [ACK] Seq=97 Ack=673778 Win=1099520 Len=0 TSval=4198903 TSecr=727929856
126   0.017852 54.230.158.182 -> 172.31.29.138 TCP 24682 [TCP segment of a reassembled PDU]
127   0.017865 172.31.29.138 -> 54.230.158.182 TCP 66 42904 > http [ACK] Seq=97 Ack=698394 Win=1148672 Len=0 TSval=4198903 TSecr=727929856
128   0.017871 54.230.158.182 -> 172.31.29.138 TCP 1514 [TCP segment of a reassembled PDU]
129   0.017874 172.31.29.138 -> 54.230.158.182 TCP 66 42904 > http [ACK] Seq=97 Ack=699842 Win=1151616 Len=0 TSval=4198903 TSecr=727929856
130   0.017997 54.230.158.182 -> 172.31.29.138 TCP 43506 [TCP segment of a reassembled PDU]
131   0.018014 172.31.29.138 -> 54.230.158.182 TCP 66 42904 > http [ACK] Seq=97 Ack=743282 Win=1238528 Len=0 TSval=4198903 TSecr=727929856
132   0.018455 54.230.158.182 -> 172.31.29.138 TCP 4410 [TCP segment of a reassembled PDU]
133   0.018462 172.31.29.138 -> 54.230.158.182 TCP 66 42904 > http [ACK] Seq=97 Ack=747626 Win=1247232 Len=0 TSval=4198903 TSecr=727929856
134   0.018631 54.230.158.182 -> 172.31.29.138 TCP 26130 [TCP segment of a reassembled PDU]
135   0.018646 172.31.29.138 -> 54.230.158.182 TCP 66 42904 > http [ACK] Seq=97 Ack=773690 Win=1299328 Len=0 TSval=4198903 TSecr=727929856
136   0.018653 54.230.158.182 -> 172.31.29.138 TCP 1514 [TCP segment of a reassembled PDU]
137   0.018655 172.31.29.138 -> 54.230.158.182 TCP 66 42904 > http [ACK] Seq=97 Ack=775138 Win=1302272 Len=0 TSval=4198903 TSecr=727929856
138   0.018673 54.230.158.182 -> 172.31.29.138 TCP 20338 [TCP segment of a reassembled PDU]
139   0.018684 172.31.29.138 -> 54.230.158.182 TCP 66 42904 > http [ACK] Seq=97 Ack=795410 Win=1342720 Len=0 TSval=4198903 TSecr=727929856
140   0.018692 54.230.158.182 -> 172.31.29.138 TCP 4410 [TCP segment of a reassembled PDU]
141   0.018695 172.31.29.138 -> 54.230.158.182 TCP 66 42904 > http [ACK] Seq=97 Ack=799754 Win=1351424 Len=0 TSval=4198903 TSecr=727929856
142   0.018828 54.230.158.182 -> 172.31.29.138 TCP 46402 [TCP segment of a reassembled PDU]
143   0.018852 172.31.29.138 -> 54.230.158.182 TCP 66 42904 > http [ACK] Seq=97 Ack=846090 Win=1428480 Len=0 TSval=4198903 TSecr=727929856
144   0.019299 54.230.158.182 -> 172.31.29.138 TCP 5858 [TCP segment of a reassembled PDU]
145   0.019308 172.31.29.138 -> 54.230.158.182 TCP 66 42904 > http [ACK] Seq=97 Ack=851882 Win=1455744 Len=0 TSval=4198903 TSecr=727929856
146   0.019468 54.230.158.182 -> 172.31.29.138 TCP 26130 [TCP segment of a reassembled PDU]
147   0.019482 172.31.29.138 -> 54.230.158.182 TCP 66 42904 > http [ACK] Seq=97 Ack=877946 Win=1461888 Len=0 TSval=4198904 TSecr=727929856
148   0.019490 54.230.158.182 -> 172.31.29.138 TCP 1514 [TCP segment of a reassembled PDU]
149   0.019514 54.230.158.182 -> 172.31.29.138 TCP 15994 [TCP segment of a reassembled PDU]
150   0.019527 54.230.158.182 -> 172.31.29.138 TCP 8754 [TCP segment of a reassembled PDU]
151   0.019550 172.31.29.138 -> 54.230.158.182 TCP 66 42904 > http [ACK] Seq=97 Ack=904010 Win=1435904 Len=0 TSval=4198904 TSecr=727929856
152   0.019580 54.230.158.182 -> 172.31.29.138 TCP 24682 [TCP segment of a reassembled PDU]
153   0.019597 54.230.158.182 -> 172.31.29.138 TCP 1514 [TCP Previous segment not captured] [TCP segment of a reassembled PDU]
154   0.019601 54.230.158.182 -> 172.31.29.138 TCP 1514 [TCP Out-Of-Order] [TCP segment of a reassembled PDU]
155   0.019609 54.230.158.182 -> 172.31.29.138 TCP 7306 [TCP segment of a reassembled PDU]
156   0.019620 172.31.29.138 -> 54.230.158.182 TCP 78 42904 > http [ACK] Seq=97 Ack=928626 Win=1421184 Len=0 TSval=4198904 TSecr=727929856 SLE=930074 SRE=931522
157   0.019627 172.31.29.138 -> 54.230.158.182 TCP 66 42904 > http [ACK] Seq=97 Ack=931522 Win=1418624 Len=0 TSval=4198904 TSecr=727929856
158   0.019629 172.31.29.138 -> 54.230.158.182 TCP 66 42904 > http [ACK] Seq=97 Ack=938762 Win=1411456 Len=0 TSval=4198904 TSecr=727929856
159   0.020072 54.230.158.182 -> 172.31.29.138 TCP 1514 [TCP segment of a reassembled PDU]
160   0.020078 172.31.29.138 -> 54.230.158.182 TCP 66 42904 > http [ACK] Seq=97 Ack=940210 Win=1496960 Len=0 TSval=4198904 TSecr=727929856
161   0.020251 54.230.158.182 -> 172.31.29.138 TCP 17442 [TCP segment of a reassembled PDU]
162   0.020262 172.31.29.138 -> 54.230.158.182 TCP 66 42904 > http [ACK] Seq=97 Ack=957586 Win=1479680 Len=0 TSval=4198904 TSecr=727929856
163   0.020321 54.230.158.182 -> 172.31.29.138 TCP 8754 [TCP segment of a reassembled PDU]
164   0.020329 172.31.29.138 -> 54.230.158.182 TCP 66 42904 > http [ACK] Seq=97 Ack=966274 Win=1490432 Len=0 TSval=4198904 TSecr=727929856
165   0.020372 54.230.158.182 -> 172.31.29.138 TCP 26130 [TCP segment of a reassembled PDU]
166   0.020386 172.31.29.138 -> 54.230.158.182 TCP 66 42904 > http [ACK] Seq=97 Ack=992338 Win=1464448 Len=0 TSval=4198904 TSecr=727929856
167   0.020416 54.230.158.182 -> 172.31.29.138 TCP 15994 [TCP segment of a reassembled PDU]
168   0.020428 172.31.29.138 -> 54.230.158.182 TCP 66 42904 > http [ACK] Seq=97 Ack=1008266 Win=1448576 Len=0 TSval=4198904 TSecr=727929856
169   0.020821 54.230.158.182 -> 172.31.29.138 TCP 4410 [TCP segment of a reassembled PDU]
170   0.020827 172.31.29.138 -> 54.230.158.182 TCP 66 42904 > http [ACK] Seq=97 Ack=1012610 Win=1496960 Len=0 TSval=4198904 TSecr=727929856
171   0.021001 54.230.158.182 -> 172.31.29.138 TCP 26130 [TCP segment of a reassembled PDU]
172   0.021014 172.31.29.138 -> 54.230.158.182 TCP 66 42904 > http [ACK] Seq=97 Ack=1038674 Win=1470976 Len=0 TSval=4198904 TSecr=727929856
173   0.021026 54.230.158.182 -> 172.31.29.138 HTTP 10426 HTTP/1.1 200 OK  (application/octet-stream)
174   0.021036 172.31.29.138 -> 54.230.158.182 TCP 66 42904 > http [ACK] Seq=97 Ack=1049034 Win=1460736 Len=0 TSval=4198904 TSecr=727929856
175   0.021186 172.31.29.138 -> 54.230.158.182 TCP 66 42904 > http [FIN, ACK] Seq=97 Ack=1049034 Win=1496960 Len=0 TSval=4198904 TSecr=727929856
176   0.021803 54.230.158.182 -> 172.31.29.138 TCP 66 http > 42904 [FIN, ACK] Seq=1049034 Ack=98 Win=14592 Len=0 TSval=727929856 TSecr=4198904
177   0.021810 172.31.29.138 -> 54.230.158.182 TCP 66 42904 > http [ACK] Seq=98 Ack=1049035 Win=1496960 Len=0 TSval=4198904 TSecr=727929856
