[Measurement for 1mb at 00:35:22 20.35.2014] 
Tshark:

  1   0.000000 172.31.29.138 -> 172.31.0.2   DNS 89 Standard query 0xeb21  A d39wppo36gwqpx.cloudfront.net
  2   0.000029 172.31.29.138 -> 172.31.0.2   DNS 89 Standard query 0xbf4d  AAAA d39wppo36gwqpx.cloudfront.net
  3   0.000552   172.31.0.2 -> 172.31.29.138 DNS 217 Standard query response 0xeb21  A 54.230.156.193 A 54.230.158.80 A 54.230.158.217 A 54.230.158.249 A 54.230.159.7 A 54.230.159.153 A 54.192.159.180 A 54.230.156.40
  4   0.000563   172.31.0.2 -> 172.31.29.138 DNS 170 Standard query response 0xbf4d 
  5   0.003872 172.31.29.138 -> 54.230.156.193 TCP 74 38969 > http [SYN] Seq=0 Win=26883 Len=0 MSS=8961 SACK_PERM=1 TSval=6898829 TSecr=0 WS=128
  6   0.004356 54.230.156.193 -> 172.31.29.138 TCP 74 http > 38969 [SYN, ACK] Seq=0 Ack=1 Win=14480 Len=0 MSS=1460 SACK_PERM=1 TSval=809012241 TSecr=6898829 WS=128
  7   0.004370 172.31.29.138 -> 54.230.156.193 TCP 66 38969 > http [ACK] Seq=1 Ack=1 Win=27008 Len=0 TSval=6898829 TSecr=809012241
  8   0.004416 172.31.29.138 -> 54.230.156.193 HTTP 162 GET /1mb HTTP/1.1 
  9   0.005053 54.230.156.193 -> 172.31.29.138 TCP 66 http > 38969 [ACK] Seq=1 Ack=97 Win=14592 Len=0 TSval=809012241 TSecr=6898829
 10   0.007078 54.230.156.193 -> 172.31.29.138 TCP 523 [TCP segment of a reassembled PDU]
 11   0.007086 172.31.29.138 -> 54.230.156.193 TCP 66 38969 > http [ACK] Seq=97 Ack=458 Win=28032 Len=0 TSval=6898830 TSecr=809012241
 12   0.007378 54.230.156.193 -> 172.31.29.138 TCP 7306 [TCP segment of a reassembled PDU]
 13   0.007386 172.31.29.138 -> 54.230.156.193 TCP 66 38969 > http [ACK] Seq=97 Ack=7698 Win=42496 Len=0 TSval=6898830 TSecr=809012241
 14   0.007397 54.230.156.193 -> 172.31.29.138 TCP 5858 [TCP segment of a reassembled PDU]
 15   0.007402 172.31.29.138 -> 54.230.156.193 TCP 66 38969 > http [ACK] Seq=97 Ack=13490 Win=54144 Len=0 TSval=6898830 TSecr=809012241
 16   0.007925 54.230.156.193 -> 172.31.29.138 TCP 2962 [TCP segment of a reassembled PDU]
 17   0.007931 172.31.29.138 -> 54.230.156.193 TCP 66 38969 > http [ACK] Seq=97 Ack=16386 Win=59904 Len=0 TSval=6898830 TSecr=809012241
 18   0.007971 54.230.156.193 -> 172.31.29.138 TCP 2962 [TCP segment of a reassembled PDU]
 19   0.007976 172.31.29.138 -> 54.230.156.193 TCP 66 38969 > http [ACK] Seq=97 Ack=19282 Win=65664 Len=0 TSval=6898830 TSecr=809012241
 20   0.008128 54.230.156.193 -> 172.31.29.138 TCP 7306 [TCP segment of a reassembled PDU]
 21   0.008135 172.31.29.138 -> 54.230.156.193 TCP 66 38969 > http [ACK] Seq=97 Ack=26522 Win=80128 Len=0 TSval=6898830 TSecr=809012241
 22   0.008388 54.230.156.193 -> 172.31.29.138 TCP 7306 [TCP segment of a reassembled PDU]
 23   0.008394 172.31.29.138 -> 54.230.156.193 TCP 66 38969 > http [ACK] Seq=97 Ack=33762 Win=94592 Len=0 TSval=6898830 TSecr=809012241
 24   0.008423 54.230.156.193 -> 172.31.29.138 TCP 5858 [TCP segment of a reassembled PDU]
 25   0.008429 172.31.29.138 -> 54.230.156.193 TCP 66 38969 > http [ACK] Seq=97 Ack=39554 Win=106240 Len=0 TSval=6898830 TSecr=809012241
 26   0.008637 54.230.156.193 -> 172.31.29.138 TCP 2962 [TCP segment of a reassembled PDU]
 27   0.008642 172.31.29.138 -> 54.230.156.193 TCP 66 38969 > http [ACK] Seq=97 Ack=42450 Win=109056 Len=0 TSval=6898830 TSecr=809012241
 28   0.008725 54.230.156.193 -> 172.31.29.138 TCP 7306 [TCP segment of a reassembled PDU]
 29   0.008732 172.31.29.138 -> 54.230.156.193 TCP 66 38969 > http [ACK] Seq=97 Ack=49690 Win=105984 Len=0 TSval=6898830 TSecr=809012241
 30   0.008898 54.230.156.193 -> 172.31.29.138 TCP 1514 [TCP segment of a reassembled PDU]
 31   0.008902 172.31.29.138 -> 54.230.156.193 TCP 66 38969 > http [ACK] Seq=97 Ack=51138 Win=109056 Len=0 TSval=6898830 TSecr=809012241
 32   0.008977 54.230.156.193 -> 172.31.29.138 TCP 1514 [TCP segment of a reassembled PDU]
 33   0.008981 172.31.29.138 -> 54.230.156.193 TCP 66 38969 > http [ACK] Seq=97 Ack=52586 Win=109056 Len=0 TSval=6898830 TSecr=809012241
 34   0.009058 54.230.156.193 -> 172.31.29.138 TCP 13098 [TCP segment of a reassembled PDU]
 35   0.009066 172.31.29.138 -> 54.230.156.193 TCP 66 38969 > http [ACK] Seq=97 Ack=65618 Win=96512 Len=0 TSval=6898830 TSecr=809012241
 36   0.009128 54.230.156.193 -> 172.31.29.138 TCP 1514 [TCP segment of a reassembled PDU]
 37   0.009133 172.31.29.138 -> 54.230.156.193 TCP 66 38969 > http [ACK] Seq=97 Ack=67066 Win=109056 Len=0 TSval=6898830 TSecr=809012241
 38   0.009238 54.230.156.193 -> 172.31.29.138 TCP 11650 [TCP segment of a reassembled PDU]
 39   0.009246 172.31.29.138 -> 54.230.156.193 TCP 66 38969 > http [ACK] Seq=97 Ack=78650 Win=98944 Len=0 TSval=6898831 TSecr=809012241
 40   0.009663 54.230.156.193 -> 172.31.29.138 TCP 4410 [TCP segment of a reassembled PDU]
 41   0.009669 172.31.29.138 -> 54.230.156.193 TCP 66 38969 > http [ACK] Seq=97 Ack=82994 Win=117760 Len=0 TSval=6898831 TSecr=809012241
 42   0.009761 54.230.156.193 -> 172.31.29.138 TCP 8754 [TCP segment of a reassembled PDU]
 43   0.009769 172.31.29.138 -> 54.230.156.193 TCP 66 38969 > http [ACK] Seq=97 Ack=91682 Win=135168 Len=0 TSval=6898831 TSecr=809012241
 44   0.009810 54.230.156.193 -> 172.31.29.138 TCP 13098 [TCP segment of a reassembled PDU]
 45   0.009819 172.31.29.138 -> 54.230.156.193 TCP 66 38969 > http [ACK] Seq=97 Ack=104714 Win=161152 Len=0 TSval=6898831 TSecr=809012241
 46   0.010440 54.230.156.193 -> 172.31.29.138 TCP 5858 [TCP segment of a reassembled PDU]
 47   0.010447 172.31.29.138 -> 54.230.156.193 TCP 66 38969 > http [ACK] Seq=97 Ack=110506 Win=172800 Len=0 TSval=6898831 TSecr=809012241
 48   0.010537 54.230.156.193 -> 172.31.29.138 TCP 7306 [TCP segment of a reassembled PDU]
 49   0.010543 172.31.29.138 -> 54.230.156.193 TCP 66 38969 > http [ACK] Seq=97 Ack=117746 Win=187264 Len=0 TSval=6898831 TSecr=809012241
 50   0.010640 54.230.156.193 -> 172.31.29.138 TCP 26130 [TCP segment of a reassembled PDU]
 51   0.010655 172.31.29.138 -> 54.230.156.193 TCP 66 38969 > http [ACK] Seq=97 Ack=143810 Win=239360 Len=0 TSval=6898831 TSecr=809012241
 52   0.010952 54.230.156.193 -> 172.31.29.138 TCP 4410 [TCP segment of a reassembled PDU]
 53   0.010959 172.31.29.138 -> 54.230.156.193 TCP 66 38969 > http [ACK] Seq=97 Ack=148154 Win=248064 Len=0 TSval=6898831 TSecr=809012241
 54   0.011068 54.230.156.193 -> 172.31.29.138 TCP 8754 [TCP segment of a reassembled PDU]
 55   0.011076 172.31.29.138 -> 54.230.156.193 TCP 66 38969 > http [ACK] Seq=97 Ack=156842 Win=265472 Len=0 TSval=6898831 TSecr=809012241
 56   0.011356 54.230.156.193 -> 172.31.29.138 TCP 23234 [TCP segment of a reassembled PDU]
 57   0.011370 172.31.29.138 -> 54.230.156.193 TCP 66 38969 > http [ACK] Seq=97 Ack=180010 Win=311808 Len=0 TSval=6898831 TSecr=809012241
 58   0.011377 54.230.156.193 -> 172.31.29.138 TCP 2962 [TCP segment of a reassembled PDU]
 59   0.011381 172.31.29.138 -> 54.230.156.193 TCP 66 38969 > http [ACK] Seq=97 Ack=182906 Win=317568 Len=0 TSval=6898831 TSecr=809012241
 60   0.011395 54.230.156.193 -> 172.31.29.138 TCP 5858 [TCP segment of a reassembled PDU]
 61   0.011399 172.31.29.138 -> 54.230.156.193 TCP 66 38969 > http [ACK] Seq=97 Ack=188698 Win=329216 Len=0 TSval=6898831 TSecr=809012241
 62   0.011722 54.230.156.193 -> 172.31.29.138 TCP 5858 [TCP segment of a reassembled PDU]
 63   0.011740 172.31.29.138 -> 54.230.156.193 TCP 66 38969 > http [ACK] Seq=97 Ack=194490 Win=340736 Len=0 TSval=6898831 TSecr=809012241
 64   0.011804 54.230.156.193 -> 172.31.29.138 TCP 1514 [TCP segment of a reassembled PDU]
 65   0.011809 172.31.29.138 -> 54.230.156.193 TCP 66 38969 > http [ACK] Seq=97 Ack=195938 Win=343680 Len=0 TSval=6898831 TSecr=809012241
 66   0.012097 54.230.156.193 -> 172.31.29.138 TCP 26130 [TCP segment of a reassembled PDU]
 67   0.012110 172.31.29.138 -> 54.230.156.193 TCP 66 38969 > http [ACK] Seq=97 Ack=222002 Win=395776 Len=0 TSval=6898831 TSecr=809012241
 68   0.012122 54.230.156.193 -> 172.31.29.138 TCP 7306 [TCP segment of a reassembled PDU]
 69   0.012130 172.31.29.138 -> 54.230.156.193 TCP 66 38969 > http [ACK] Seq=97 Ack=229242 Win=410240 Len=0 TSval=6898831 TSecr=809012241
 70   0.012455 54.230.156.193 -> 172.31.29.138 TCP 4410 [TCP segment of a reassembled PDU]
 71   0.012461 172.31.29.138 -> 54.230.156.193 TCP 66 38969 > http [ACK] Seq=97 Ack=233586 Win=418944 Len=0 TSval=6898831 TSecr=809012241
 72   0.012597 54.230.156.193 -> 172.31.29.138 TCP 14546 [TCP segment of a reassembled PDU]
 73   0.012606 172.31.29.138 -> 54.230.156.193 TCP 66 38969 > http [ACK] Seq=97 Ack=248066 Win=447872 Len=0 TSval=6898831 TSecr=809012241
 74   0.012815 54.230.156.193 -> 172.31.29.138 TCP 24682 [TCP segment of a reassembled PDU]
 75   0.012829 172.31.29.138 -> 54.230.156.193 TCP 66 38969 > http [ACK] Seq=97 Ack=272682 Win=497152 Len=0 TSval=6898831 TSecr=809012242
 76   0.012862 54.230.156.193 -> 172.31.29.138 TCP 5858 [TCP segment of a reassembled PDU]
 77   0.012867 172.31.29.138 -> 54.230.156.193 TCP 66 38969 > http [ACK] Seq=97 Ack=278474 Win=508672 Len=0 TSval=6898831 TSecr=809012242
 78   0.013220 54.230.156.193 -> 172.31.29.138 TCP 2962 [TCP segment of a reassembled PDU]
 79   0.013225 172.31.29.138 -> 54.230.156.193 TCP 66 38969 > http [ACK] Seq=97 Ack=281370 Win=514560 Len=0 TSval=6898832 TSecr=809012242
 80   0.013401 54.230.156.193 -> 172.31.29.138 TCP 26130 [TCP segment of a reassembled PDU]
 81   0.013414 172.31.29.138 -> 54.230.156.193 TCP 66 38969 > http [ACK] Seq=97 Ack=307434 Win=566656 Len=0 TSval=6898832 TSecr=809012242
 82   0.013453 54.230.156.193 -> 172.31.29.138 TCP 26130 [TCP segment of a reassembled PDU]
 83   0.013465 172.31.29.138 -> 54.230.156.193 TCP 66 38969 > http [ACK] Seq=97 Ack=333498 Win=618752 Len=0 TSval=6898832 TSecr=809012242
 84   0.013471 54.230.156.193 -> 172.31.29.138 TCP 1514 [TCP segment of a reassembled PDU]
 85   0.013473 172.31.29.138 -> 54.230.156.193 TCP 66 38969 > http [ACK] Seq=97 Ack=334946 Win=621696 Len=0 TSval=6898832 TSecr=809012242
 86   0.013998 54.230.156.193 -> 172.31.29.138 TCP 2962 [TCP segment of a reassembled PDU]
 87   0.014004 172.31.29.138 -> 54.230.156.193 TCP 66 38969 > http [ACK] Seq=97 Ack=337842 Win=627456 Len=0 TSval=6898832 TSecr=809012242
 88   0.014178 54.230.156.193 -> 172.31.29.138 TCP 24682 [TCP segment of a reassembled PDU]
 89   0.014191 172.31.29.138 -> 54.230.156.193 TCP 66 38969 > http [ACK] Seq=97 Ack=362458 Win=676736 Len=0 TSval=6898832 TSecr=809012242
 90   0.014253 54.230.156.193 -> 172.31.29.138 TCP 7306 [TCP segment of a reassembled PDU]
 91   0.014259 172.31.29.138 -> 54.230.156.193 TCP 66 38969 > http [ACK] Seq=97 Ack=369698 Win=691200 Len=0 TSval=6898832 TSecr=809012242
 92   0.014436 54.230.156.193 -> 172.31.29.138 TCP 26130 [TCP segment of a reassembled PDU]
 93   0.014450 172.31.29.138 -> 54.230.156.193 TCP 66 38969 > http [ACK] Seq=97 Ack=395762 Win=743296 Len=0 TSval=6898832 TSecr=809012242
 94   0.014473 54.230.156.193 -> 172.31.29.138 TCP 5858 [TCP segment of a reassembled PDU]
 95   0.014479 172.31.29.138 -> 54.230.156.193 TCP 66 38969 > http [ACK] Seq=97 Ack=401554 Win=754816 Len=0 TSval=6898832 TSecr=809012242
 96   0.015039 54.230.156.193 -> 172.31.29.138 TCP 8754 [TCP segment of a reassembled PDU]
 97   0.015047 172.31.29.138 -> 54.230.156.193 TCP 66 38969 > http [ACK] Seq=97 Ack=410242 Win=772224 Len=0 TSval=6898832 TSecr=809012242
 98   0.015218 54.230.156.193 -> 172.31.29.138 TCP 26130 [TCP segment of a reassembled PDU]
 99   0.015231 172.31.29.138 -> 54.230.156.193 TCP 66 38969 > http [ACK] Seq=97 Ack=436306 Win=824320 Len=0 TSval=6898832 TSecr=809012242
100   0.015250 54.230.156.193 -> 172.31.29.138 TCP 10202 [TCP segment of a reassembled PDU]
101   0.015256 172.31.29.138 -> 54.230.156.193 TCP 66 38969 > http [ACK] Seq=97 Ack=446442 Win=844672 Len=0 TSval=6898832 TSecr=809012242
102   0.015266 54.230.156.193 -> 172.31.29.138 TCP 11650 [TCP segment of a reassembled PDU]
103   0.015271 172.31.29.138 -> 54.230.156.193 TCP 66 38969 > http [ACK] Seq=97 Ack=458026 Win=867840 Len=0 TSval=6898832 TSecr=809012242
104   0.015296 54.230.156.193 -> 172.31.29.138 TCP 13098 [TCP segment of a reassembled PDU]
105   0.015304 172.31.29.138 -> 54.230.156.193 TCP 66 38969 > http [ACK] Seq=97 Ack=471058 Win=893824 Len=0 TSval=6898832 TSecr=809012242
106   0.015823 54.230.156.193 -> 172.31.29.138 TCP 4410 [TCP segment of a reassembled PDU]
107   0.015830 172.31.29.138 -> 54.230.156.193 TCP 66 38969 > http [ACK] Seq=97 Ack=475402 Win=902528 Len=0 TSval=6898832 TSecr=809012242
108   0.015995 54.230.156.193 -> 172.31.29.138 TCP 26130 [TCP segment of a reassembled PDU]
109   0.016008 172.31.29.138 -> 54.230.156.193 TCP 66 38969 > http [ACK] Seq=97 Ack=501466 Win=954752 Len=0 TSval=6898832 TSecr=809012242
110   0.016019 54.230.156.193 -> 172.31.29.138 TCP 7306 [TCP segment of a reassembled PDU]
111   0.016023 172.31.29.138 -> 54.230.156.193 TCP 66 38969 > http [ACK] Seq=97 Ack=508706 Win=969216 Len=0 TSval=6898832 TSecr=809012242
112   0.016062 54.230.156.193 -> 172.31.29.138 TCP 18890 [TCP segment of a reassembled PDU]
113   0.016072 172.31.29.138 -> 54.230.156.193 TCP 66 38969 > http [ACK] Seq=97 Ack=527530 Win=1006848 Len=0 TSval=6898832 TSecr=809012242
114   0.016153 54.230.156.193 -> 172.31.29.138 TCP 20338 [TCP segment of a reassembled PDU]
115   0.016164 172.31.29.138 -> 54.230.156.193 TCP 66 38969 > http [ACK] Seq=97 Ack=547802 Win=1047424 Len=0 TSval=6898832 TSecr=809012242
116   0.016830 54.230.156.193 -> 172.31.29.138 TCP 4410 [TCP segment of a reassembled PDU]
117   0.016836 172.31.29.138 -> 54.230.156.193 TCP 66 38969 > http [ACK] Seq=97 Ack=552146 Win=1056000 Len=0 TSval=6898832 TSecr=809012242
118   0.017020 54.230.156.193 -> 172.31.29.138 TCP 26130 [TCP segment of a reassembled PDU]
119   0.017033 172.31.29.138 -> 54.230.156.193 TCP 66 38969 > http [ACK] Seq=97 Ack=578210 Win=1056512 Len=0 TSval=6898832 TSecr=809012242
120   0.017081 54.230.156.193 -> 172.31.29.138 TCP 26130 [TCP segment of a reassembled PDU]
121   0.017094 172.31.29.138 -> 54.230.156.193 TCP 66 38969 > http [ACK] Seq=97 Ack=604274 Win=1056512 Len=0 TSval=6898832 TSecr=809012242
122   0.017112 54.230.156.193 -> 172.31.29.138 TCP 8754 [TCP segment of a reassembled PDU]
123   0.017121 172.31.29.138 -> 54.230.156.193 TCP 66 38969 > http [ACK] Seq=97 Ack=612962 Win=1047936 Len=0 TSval=6898832 TSecr=809012242
124   0.017606 54.230.156.193 -> 172.31.29.138 TCP 2962 [TCP segment of a reassembled PDU]
125   0.017612 172.31.29.138 -> 54.230.156.193 TCP 66 38969 > http [ACK] Seq=97 Ack=615858 Win=1094528 Len=0 TSval=6898833 TSecr=809012242
126   0.017849 54.230.156.193 -> 172.31.29.138 TCP 26130 [TCP segment of a reassembled PDU]
127   0.017867 172.31.29.138 -> 54.230.156.193 TCP 66 38969 > http [ACK] Seq=97 Ack=641922 Win=1149440 Len=0 TSval=6898833 TSecr=809012242
128   0.017900 54.230.156.193 -> 172.31.29.138 TCP 24682 [TCP segment of a reassembled PDU]
129   0.017912 172.31.29.138 -> 54.230.156.193 TCP 66 38969 > http [ACK] Seq=97 Ack=666538 Win=1198720 Len=0 TSval=6898833 TSecr=809012242
130   0.017920 54.230.156.193 -> 172.31.29.138 TCP 1514 [TCP segment of a reassembled PDU]
131   0.017922 172.31.29.138 -> 54.230.156.193 TCP 66 38969 > http [ACK] Seq=97 Ack=667986 Win=1201536 Len=0 TSval=6898833 TSecr=809012242
132   0.017962 54.230.156.193 -> 172.31.29.138 TCP 10202 [TCP segment of a reassembled PDU]
133   0.017969 172.31.29.138 -> 54.230.156.193 TCP 66 38969 > http [ACK] Seq=97 Ack=678122 Win=1221888 Len=0 TSval=6898833 TSecr=809012242
134   0.018335 54.230.156.193 -> 172.31.29.138 TCP 1514 [TCP segment of a reassembled PDU]
135   0.018341 172.31.29.138 -> 54.230.156.193 TCP 66 38969 > http [ACK] Seq=97 Ack=679570 Win=1224704 Len=0 TSval=6898833 TSecr=809012242
136   0.018532 54.230.156.193 -> 172.31.29.138 TCP 26130 [TCP segment of a reassembled PDU]
137   0.018546 172.31.29.138 -> 54.230.156.193 TCP 66 38969 > http [ACK] Seq=97 Ack=705634 Win=1276800 Len=0 TSval=6898833 TSecr=809012242
138   0.018583 54.230.156.193 -> 172.31.29.138 TCP 23234 [TCP segment of a reassembled PDU]
139   0.018596 172.31.29.138 -> 54.230.156.193 TCP 66 38969 > http [ACK] Seq=97 Ack=728802 Win=1323136 Len=0 TSval=6898833 TSecr=809012242
140   0.018603 54.230.156.193 -> 172.31.29.138 TCP 2962 [TCP segment of a reassembled PDU]
141   0.018606 172.31.29.138 -> 54.230.156.193 TCP 66 38969 > http [ACK] Seq=97 Ack=731698 Win=1329024 Len=0 TSval=6898833 TSecr=809012242
142   0.018741 54.230.156.193 -> 172.31.29.138 TCP 50746 [TCP segment of a reassembled PDU]
143   0.018762 172.31.29.138 -> 54.230.156.193 TCP 66 38969 > http [ACK] Seq=97 Ack=782378 Win=1430400 Len=0 TSval=6898833 TSecr=809012242
144   0.019150 54.230.156.193 -> 172.31.29.138 TCP 4410 [TCP segment of a reassembled PDU]
145   0.019157 172.31.29.138 -> 54.230.156.193 TCP 66 38969 > http [ACK] Seq=97 Ack=786722 Win=1438976 Len=0 TSval=6898833 TSecr=809012242
146   0.019324 54.230.156.193 -> 172.31.29.138 TCP 26130 [TCP segment of a reassembled PDU]
147   0.019338 172.31.29.138 -> 54.230.156.193 TCP 66 38969 > http [ACK] Seq=97 Ack=812786 Win=1491200 Len=0 TSval=6898833 TSecr=809012242
148   0.019345 54.230.156.193 -> 172.31.29.138 TCP 1514 [TCP segment of a reassembled PDU]
149   0.019347 172.31.29.138 -> 54.230.156.193 TCP 66 38969 > http [ACK] Seq=97 Ack=814234 Win=1494016 Len=0 TSval=6898833 TSecr=809012242
150   0.019366 54.230.156.193 -> 172.31.29.138 TCP 15994 [TCP segment of a reassembled PDU]
151   0.019374 172.31.29.138 -> 54.230.156.193 TCP 66 38969 > http [ACK] Seq=97 Ack=830162 Win=1525888 Len=0 TSval=6898833 TSecr=809012242
152   0.019384 54.230.156.193 -> 172.31.29.138 TCP 8754 [TCP segment of a reassembled PDU]
153   0.019402 172.31.29.138 -> 54.230.156.193 TCP 66 38969 > http [ACK] Seq=97 Ack=838850 Win=1543296 Len=0 TSval=6898833 TSecr=809012242
154   0.019473 54.230.156.193 -> 172.31.29.138 TCP 34818 [TCP segment of a reassembled PDU]
155   0.019491 172.31.29.138 -> 54.230.156.193 TCP 66 38969 > http [ACK] Seq=97 Ack=873602 Win=1573760 Len=0 TSval=6898833 TSecr=809012242
156   0.019916 54.230.156.193 -> 172.31.29.138 TCP 2962 [TCP segment of a reassembled PDU]
157   0.019923 172.31.29.138 -> 54.230.156.193 TCP 66 38969 > http [ACK] Seq=97 Ack=876498 Win=1612800 Len=0 TSval=6898833 TSecr=809012242
158   0.020098 54.230.156.193 -> 172.31.29.138 TCP 26130 [TCP segment of a reassembled PDU]
159   0.020112 172.31.29.138 -> 54.230.156.193 TCP 66 38969 > http [ACK] Seq=97 Ack=902562 Win=1588096 Len=0 TSval=6898833 TSecr=809012242
160   0.020154 54.230.156.193 -> 172.31.29.138 TCP 26130 [TCP segment of a reassembled PDU]
161   0.020167 172.31.29.138 -> 54.230.156.193 TCP 66 38969 > http [ACK] Seq=97 Ack=928626 Win=1562112 Len=0 TSval=6898833 TSecr=809012242
162   0.020180 54.230.156.193 -> 172.31.29.138 TCP 7306 [TCP segment of a reassembled PDU]
163   0.020184 172.31.29.138 -> 54.230.156.193 TCP 66 38969 > http [ACK] Seq=97 Ack=935866 Win=1554944 Len=0 TSval=6898833 TSecr=809012242
164   0.020191 54.230.156.193 -> 172.31.29.138 TCP 2962 [TCP segment of a reassembled PDU]
165   0.020194 172.31.29.138 -> 54.230.156.193 TCP 66 38969 > http [ACK] Seq=97 Ack=938762 Win=1552128 Len=0 TSval=6898833 TSecr=809012242
166   0.020289 54.230.156.193 -> 172.31.29.138 TCP 42058 [TCP segment of a reassembled PDU]
167   0.020309 172.31.29.138 -> 54.230.156.193 TCP 66 38969 > http [ACK] Seq=97 Ack=980754 Win=1561728 Len=0 TSval=6898833 TSecr=809012242
168   0.020326 54.230.156.193 -> 172.31.29.138 TCP 13098 [TCP segment of a reassembled PDU]
169   0.020346 172.31.29.138 -> 54.230.156.193 TCP 66 38969 > http [ACK] Seq=97 Ack=993786 Win=1548800 Len=0 TSval=6898833 TSecr=809012242
170   0.020673 54.230.156.193 -> 172.31.29.138 TCP 1514 [TCP segment of a reassembled PDU]
171   0.020858 54.230.156.193 -> 172.31.29.138 TCP 26130 [TCP segment of a reassembled PDU]
172   0.020873 172.31.29.138 -> 54.230.156.193 TCP 66 38969 > http [ACK] Seq=97 Ack=1021298 Win=1588096 Len=0 TSval=6898833 TSecr=809012242
173   0.020899 54.230.156.193 -> 172.31.29.138 TCP 21786 [TCP segment of a reassembled PDU]
174   0.020927 54.230.156.193 -> 172.31.29.138 TCP 2962 [TCP segment of a reassembled PDU]
175   0.020931 54.230.156.193 -> 172.31.29.138 TCP 1514 [TCP Previous segment not captured] [TCP segment of a reassembled PDU]
176   0.020934 172.31.29.138 -> 54.230.156.193 TCP 78 38969 > http [ACK] Seq=97 Ack=1045914 Win=1563520 Len=0 TSval=6898833 TSecr=809012242 SLE=1047362 SRE=1048810
177   0.020939 54.230.156.193 -> 172.31.29.138 TCP 1514 [TCP Out-Of-Order] [TCP segment of a reassembled PDU]
178   0.020942 172.31.29.138 -> 54.230.156.193 TCP 66 38969 > http [ACK] Seq=97 Ack=1048810 Win=1560704 Len=0 TSval=6898833 TSecr=809012242
179   0.020943 54.230.156.193 -> 172.31.29.138 HTTP 290 HTTP/1.1 200 OK  (application/octet-stream)
180   0.020945 172.31.29.138 -> 54.230.156.193 TCP 66 38969 > http [ACK] Seq=97 Ack=1049034 Win=1560576 Len=0 TSval=6898833 TSecr=809012242
181   0.021098 172.31.29.138 -> 54.230.156.193 TCP 66 38969 > http [FIN, ACK] Seq=97 Ack=1049034 Win=1612800 Len=0 TSval=6898833 TSecr=809012242
182   0.021691 54.230.156.193 -> 172.31.29.138 TCP 66 http > 38969 [FIN, ACK] Seq=1049034 Ack=98 Win=14592 Len=0 TSval=809012242 TSecr=6898833
183   0.021699 172.31.29.138 -> 54.230.156.193 TCP 66 38969 > http [ACK] Seq=98 Ack=1049035 Win=1612800 Len=0 TSval=6898834 TSecr=809012242
