[Measurement for 1mb at 11:35:22 20.35.2014] 
Tshark:

  1   0.000000 172.31.29.138 -> 172.31.0.2   DNS 89 Standard query 0xc661  A d39wppo36gwqpx.cloudfront.net
  2   0.000040 172.31.29.138 -> 172.31.0.2   DNS 89 Standard query 0x9aaa  AAAA d39wppo36gwqpx.cloudfront.net
  3   0.000662   172.31.0.2 -> 172.31.29.138 DNS 170 Standard query response 0x9aaa 
  4   0.000672   172.31.0.2 -> 172.31.29.138 DNS 217 Standard query response 0xc661  A 54.192.159.164 A 54.230.157.230 A 54.230.158.149 A 54.230.158.152 A 54.230.158.191 A 54.230.158.230 A 54.230.159.131 A 54.192.157.136
  5   0.003877 172.31.29.138 -> 54.192.159.164 TCP 74 35539 > http [SYN] Seq=0 Win=26883 Len=0 MSS=8961 SACK_PERM=1 TSval=16798883 TSecr=0 WS=128
  6   0.004777 54.192.159.164 -> 172.31.29.138 TCP 74 http > 35539 [SYN, ACK] Seq=0 Ack=1 Win=14480 Len=0 MSS=1460 SACK_PERM=1 TSval=837853981 TSecr=16798883 WS=128
  7   0.004790 172.31.29.138 -> 54.192.159.164 TCP 66 35539 > http [ACK] Seq=1 Ack=1 Win=27008 Len=0 TSval=16798883 TSecr=837853981
  8   0.004845 172.31.29.138 -> 54.192.159.164 HTTP 162 GET /1mb HTTP/1.1 
  9   0.005480 54.192.159.164 -> 172.31.29.138 TCP 66 http > 35539 [ACK] Seq=1 Ack=97 Win=14592 Len=0 TSval=837853981 TSecr=16798884
 10   0.015024 54.192.159.164 -> 172.31.29.138 TCP 11650 [TCP segment of a reassembled PDU]
 11   0.015034 172.31.29.138 -> 54.192.159.164 TCP 66 35539 > http [ACK] Seq=97 Ack=11585 Win=50176 Len=0 TSval=16798886 TSecr=837853982
 12   0.015040 54.192.159.164 -> 172.31.29.138 TCP 1514 [TCP segment of a reassembled PDU]
 13   0.015043 172.31.29.138 -> 54.192.159.164 TCP 66 35539 > http [ACK] Seq=97 Ack=13033 Win=52992 Len=0 TSval=16798886 TSecr=837853982
 14   0.015841 54.192.159.164 -> 172.31.29.138 TCP 13098 [TCP segment of a reassembled PDU]
 15   0.015850 172.31.29.138 -> 54.192.159.164 TCP 66 35539 > http [ACK] Seq=97 Ack=26065 Win=79104 Len=0 TSval=16798886 TSecr=837853982
 16   0.016620 54.192.159.164 -> 172.31.29.138 TCP 13098 [TCP segment of a reassembled PDU]
 17   0.016629 172.31.29.138 -> 54.192.159.164 TCP 66 35539 > http [ACK] Seq=97 Ack=39097 Win=96512 Len=0 TSval=16798886 TSecr=837853982
 18   0.017238 54.192.159.164 -> 172.31.29.138 TCP 1514 [TCP segment of a reassembled PDU]
 19   0.017243 172.31.29.138 -> 54.192.159.164 TCP 66 35539 > http [ACK] Seq=97 Ack=40545 Win=108032 Len=0 TSval=16798887 TSecr=837853982
 20   0.017322 54.192.159.164 -> 172.31.29.138 TCP 11650 [TCP segment of a reassembled PDU]
 21   0.017330 172.31.29.138 -> 54.192.159.164 TCP 66 35539 > http [ACK] Seq=97 Ack=52129 Win=131200 Len=0 TSval=16798887 TSecr=837853982
 22   0.017343 54.192.159.164 -> 172.31.29.138 TCP 7306 [TCP segment of a reassembled PDU]
 23   0.017349 172.31.29.138 -> 54.192.159.164 TCP 66 35539 > http [ACK] Seq=97 Ack=59369 Win=145664 Len=0 TSval=16798887 TSecr=837853982
 24   0.018016 54.192.159.164 -> 172.31.29.138 TCP 4410 [TCP segment of a reassembled PDU]
 25   0.018022 172.31.29.138 -> 54.192.159.164 TCP 66 35539 > http [ACK] Seq=97 Ack=63713 Win=154368 Len=0 TSval=16798887 TSecr=837853983
 26   0.018156 54.192.159.164 -> 172.31.29.138 TCP 14546 [TCP segment of a reassembled PDU]
 27   0.018165 172.31.29.138 -> 54.192.159.164 TCP 66 35539 > http [ACK] Seq=97 Ack=78193 Win=174336 Len=0 TSval=16798887 TSecr=837853983
 28   0.018570 54.192.159.164 -> 172.31.29.138 TCP 8754 [TCP segment of a reassembled PDU]
 29   0.018577 172.31.29.138 -> 54.192.159.164 TCP 66 35539 > http [ACK] Seq=97 Ack=86881 Win=183936 Len=0 TSval=16798887 TSecr=837853983
 30   0.018876 54.192.159.164 -> 172.31.29.138 TCP 4410 [TCP segment of a reassembled PDU]
 31   0.018882 172.31.29.138 -> 54.192.159.164 TCP 66 35539 > http [ACK] Seq=97 Ack=91225 Win=191104 Len=0 TSval=16798887 TSecr=837853983
 32   0.018977 54.192.159.164 -> 172.31.29.138 TCP 13098 [TCP segment of a reassembled PDU]
 33   0.018985 172.31.29.138 -> 54.192.159.164 TCP 66 35539 > http [ACK] Seq=97 Ack=104257 Win=178176 Len=0 TSval=16798887 TSecr=837853983
 34   0.019118 54.192.159.164 -> 172.31.29.138 TCP 11650 [TCP segment of a reassembled PDU]
 35   0.019126 172.31.29.138 -> 54.192.159.164 TCP 66 35539 > http [ACK] Seq=97 Ack=115841 Win=179200 Len=0 TSval=16798887 TSecr=837853983
 36   0.019652 54.192.159.164 -> 172.31.29.138 TCP 14546 [TCP segment of a reassembled PDU]
 37   0.019660 172.31.29.138 -> 54.192.159.164 TCP 66 35539 > http [ACK] Seq=97 Ack=130321 Win=174336 Len=0 TSval=16798887 TSecr=837853983
 38   0.019724 54.192.159.164 -> 172.31.29.138 TCP 18890 [TCP segment of a reassembled PDU]
 39   0.019735 172.31.29.138 -> 54.192.159.164 TCP 66 35539 > http [ACK] Seq=97 Ack=149145 Win=155520 Len=0 TSval=16798887 TSecr=837853983
 40   0.020184 54.192.159.164 -> 172.31.29.138 TCP 7306 [TCP segment of a reassembled PDU]
 41   0.020191 172.31.29.138 -> 54.192.159.164 TCP 66 35539 > http [ACK] Seq=97 Ack=156385 Win=186368 Len=0 TSval=16798887 TSecr=837853983
 42   0.020483 54.192.159.164 -> 172.31.29.138 TCP 26130 [TCP segment of a reassembled PDU]
 43   0.020495 172.31.29.138 -> 54.192.159.164 TCP 66 35539 > http [ACK] Seq=97 Ack=182449 Win=160384 Len=0 TSval=16798887 TSecr=837853983
 44   0.021215 54.192.159.164 -> 172.31.29.138 TCP 11650 [TCP segment of a reassembled PDU]
 45   0.021244 172.31.29.138 -> 54.192.159.164 TCP 66 35539 > http [ACK] Seq=97 Ack=194033 Win=179200 Len=0 TSval=16798888 TSecr=837853983
 46   0.021335 54.192.159.164 -> 172.31.29.138 TCP 17442 [TCP segment of a reassembled PDU]
 47   0.021345 172.31.29.138 -> 54.192.159.164 TCP 66 35539 > http [ACK] Seq=97 Ack=211409 Win=232960 Len=0 TSval=16798888 TSecr=837853983
 48   0.021371 54.192.159.164 -> 172.31.29.138 TCP 8754 [TCP segment of a reassembled PDU]
 49   0.021380 172.31.29.138 -> 54.192.159.164 TCP 66 35539 > http [ACK] Seq=97 Ack=220097 Win=250368 Len=0 TSval=16798888 TSecr=837853983
 50   0.021401 54.192.159.164 -> 172.31.29.138 TCP 1514 [TCP segment of a reassembled PDU]
 51   0.021404 172.31.29.138 -> 54.192.159.164 TCP 66 35539 > http [ACK] Seq=97 Ack=221545 Win=253312 Len=0 TSval=16798888 TSecr=837853983
 52   0.021709 54.192.159.164 -> 172.31.29.138 TCP 8754 [TCP segment of a reassembled PDU]
 53   0.021716 172.31.29.138 -> 54.192.159.164 TCP 66 35539 > http [ACK] Seq=97 Ack=230233 Win=270720 Len=0 TSval=16798888 TSecr=837853983
 54   0.022051 54.192.159.164 -> 172.31.29.138 TCP 18890 [TCP segment of a reassembled PDU]
 55   0.022079 172.31.29.138 -> 54.192.159.164 TCP 66 35539 > http [ACK] Seq=97 Ack=249057 Win=308352 Len=0 TSval=16798888 TSecr=837853983
 56   0.022167 54.192.159.164 -> 172.31.29.138 TCP 13098 [TCP segment of a reassembled PDU]
 57   0.022175 172.31.29.138 -> 54.192.159.164 TCP 66 35539 > http [ACK] Seq=97 Ack=262089 Win=334336 Len=0 TSval=16798888 TSecr=837853983
 58   0.022256 54.192.159.164 -> 172.31.29.138 TCP 14546 [TCP segment of a reassembled PDU]
 59   0.022266 172.31.29.138 -> 54.192.159.164 TCP 66 35539 > http [ACK] Seq=97 Ack=276569 Win=363392 Len=0 TSval=16798888 TSecr=837853983
 60   0.022981 54.192.159.164 -> 172.31.29.138 TCP 17442 [TCP segment of a reassembled PDU]
 61   0.023008 172.31.29.138 -> 54.192.159.164 TCP 66 35539 > http [ACK] Seq=97 Ack=293945 Win=398080 Len=0 TSval=16798888 TSecr=837853983
 62   0.023114 54.192.159.164 -> 172.31.29.138 TCP 27578 [TCP segment of a reassembled PDU]
 63   0.023128 172.31.29.138 -> 54.192.159.164 TCP 66 35539 > http [ACK] Seq=97 Ack=321457 Win=453120 Len=0 TSval=16798888 TSecr=837853983
 64   0.023140 54.192.159.164 -> 172.31.29.138 TCP 5858 [TCP segment of a reassembled PDU]
 65   0.023144 172.31.29.138 -> 54.192.159.164 TCP 66 35539 > http [ACK] Seq=97 Ack=327249 Win=464640 Len=0 TSval=16798888 TSecr=837853983
 66   0.023757 54.192.159.164 -> 172.31.29.138 TCP 15994 [TCP segment of a reassembled PDU]
 67   0.023767 172.31.29.138 -> 54.192.159.164 TCP 66 35539 > http [ACK] Seq=97 Ack=343177 Win=496512 Len=0 TSval=16798888 TSecr=837853983
 68   0.023875 54.192.159.164 -> 172.31.29.138 TCP 26130 [TCP segment of a reassembled PDU]
 69   0.023888 172.31.29.138 -> 54.192.159.164 TCP 66 35539 > http [ACK] Seq=97 Ack=369241 Win=548736 Len=0 TSval=16798888 TSecr=837853983
 70   0.023901 54.192.159.164 -> 172.31.29.138 TCP 13098 [TCP segment of a reassembled PDU]
 71   0.023906 172.31.29.138 -> 54.192.159.164 TCP 66 35539 > http [ACK] Seq=97 Ack=382273 Win=574720 Len=0 TSval=16798888 TSecr=837853983
 72   0.024684 54.192.159.164 -> 172.31.29.138 TCP 5858 [TCP segment of a reassembled PDU]
 73   0.024690 172.31.29.138 -> 54.192.159.164 TCP 66 35539 > http [ACK] Seq=97 Ack=388065 Win=586368 Len=0 TSval=16798888 TSecr=837853983
 74   0.024856 54.192.159.164 -> 172.31.29.138 TCP 26130 [TCP segment of a reassembled PDU]
 75   0.024869 172.31.29.138 -> 54.192.159.164 TCP 66 35539 > http [ACK] Seq=97 Ack=414129 Win=638464 Len=0 TSval=16798889 TSecr=837853983
 76   0.024883 54.192.159.164 -> 172.31.29.138 TCP 11650 [TCP segment of a reassembled PDU]
 77   0.024892 172.31.29.138 -> 54.192.159.164 TCP 66 35539 > http [ACK] Seq=97 Ack=425713 Win=661632 Len=0 TSval=16798889 TSecr=837853983
 78   0.025422 54.192.159.164 -> 172.31.29.138 TCP 2962 [TCP segment of a reassembled PDU]
 79   0.025427 172.31.29.138 -> 54.192.159.164 TCP 66 35539 > http [ACK] Seq=97 Ack=428609 Win=667392 Len=0 TSval=16798889 TSecr=837853983
 80   0.025601 54.192.159.164 -> 172.31.29.138 TCP 20338 [TCP segment of a reassembled PDU]
 81   0.025612 172.31.29.138 -> 54.192.159.164 TCP 66 35539 > http [ACK] Seq=97 Ack=448881 Win=707968 Len=0 TSval=16798889 TSecr=837853983
 82   0.025738 54.192.159.164 -> 172.31.29.138 TCP 9707 [TCP segment of a reassembled PDU]
 83   0.025755 172.31.29.138 -> 54.192.159.164 TCP 66 35539 > http [ACK] Seq=97 Ack=458522 Win=727296 Len=0 TSval=16798889 TSecr=837853983
 84   0.026443 54.192.159.164 -> 172.31.29.138 TCP 2962 [TCP segment of a reassembled PDU]
 85   0.026448 172.31.29.138 -> 54.192.159.164 TCP 66 35539 > http [ACK] Seq=97 Ack=461418 Win=733056 Len=0 TSval=16798889 TSecr=837853983
 86   0.026678 54.192.159.164 -> 172.31.29.138 TCP 26130 [TCP segment of a reassembled PDU]
 87   0.026691 172.31.29.138 -> 54.192.159.164 TCP 66 35539 > http [ACK] Seq=97 Ack=487482 Win=785152 Len=0 TSval=16798889 TSecr=837853983
 88   0.026784 54.192.159.164 -> 172.31.29.138 TCP 24682 [TCP segment of a reassembled PDU]
 89   0.026796 172.31.29.138 -> 54.192.159.164 TCP 66 35539 > http [ACK] Seq=97 Ack=512098 Win=834432 Len=0 TSval=16798889 TSecr=837853983
 90   0.027290 54.192.159.164 -> 172.31.29.138 TCP 12026 [TCP segment of a reassembled PDU]
 91   0.027300 172.31.29.138 -> 54.192.159.164 TCP 66 35539 > http [ACK] Seq=97 Ack=524058 Win=858368 Len=0 TSval=16798889 TSecr=837853983
 92   0.029767 54.192.159.164 -> 172.31.29.138 TCP 17442 [TCP segment of a reassembled PDU]
 93   0.029794 172.31.29.138 -> 54.192.159.164 TCP 66 35539 > http [ACK] Seq=97 Ack=541434 Win=872448 Len=0 TSval=16798890 TSecr=837853984
 94   0.029959 54.192.159.164 -> 172.31.29.138 TCP 26130 [TCP segment of a reassembled PDU]
 95   0.029985 172.31.29.138 -> 54.192.159.164 TCP 66 35539 > http [ACK] Seq=97 Ack=567498 Win=858240 Len=0 TSval=16798890 TSecr=837853984
 96   0.030004 54.192.159.164 -> 172.31.29.138 TCP 22161 [TCP segment of a reassembled PDU]
 97   0.030017 54.192.159.164 -> 172.31.29.138 TCP 67 [TCP segment of a reassembled PDU]
 98   0.030038 172.31.29.138 -> 54.192.159.164 TCP 66 35539 > http [ACK] Seq=97 Ack=589594 Win=860416 Len=0 TSval=16798890 TSecr=837853984
 99   0.032880 54.192.159.164 -> 172.31.29.138 TCP 2962 [TCP segment of a reassembled PDU]
100   0.032886 172.31.29.138 -> 54.192.159.164 TCP 66 35539 > http [ACK] Seq=97 Ack=592490 Win=896256 Len=0 TSval=16798891 TSecr=837853984
101   0.033078 54.192.159.164 -> 172.31.29.138 TCP 26130 [TCP segment of a reassembled PDU]
102   0.033117 172.31.29.138 -> 54.192.159.164 TCP 66 35539 > http [ACK] Seq=97 Ack=618554 Win=870272 Len=0 TSval=16798891 TSecr=837853984
103   0.033146 54.192.159.164 -> 172.31.29.138 TCP 26130 [TCP segment of a reassembled PDU]
104   0.033162 54.192.159.164 -> 172.31.29.138 TCP 7306 [TCP segment of a reassembled PDU]
105   0.033176 54.192.159.164 -> 172.31.29.138 TCP 3338 [TCP segment of a reassembled PDU]
106   0.033188 172.31.29.138 -> 54.192.159.164 TCP 66 35539 > http [ACK] Seq=97 Ack=655130 Win=839168 Len=0 TSval=16798891 TSecr=837853984
107   0.035727 54.192.159.164 -> 172.31.29.138 TCP 2962 [TCP segment of a reassembled PDU]
108   0.035734 172.31.29.138 -> 54.192.159.164 TCP 66 35539 > http [ACK] Seq=97 Ack=658026 Win=896256 Len=0 TSval=16798891 TSecr=837853984
109   0.035843 54.192.159.164 -> 172.31.29.138 TCP 26130 [TCP segment of a reassembled PDU]
110   0.035876 54.192.159.164 -> 172.31.29.138 TCP 21786 [TCP segment of a reassembled PDU]
111   0.035915 54.192.159.164 -> 172.31.29.138 TCP 4410 [TCP segment of a reassembled PDU]
112   0.035922 172.31.29.138 -> 54.192.159.164 TCP 66 35539 > http [ACK] Seq=97 Ack=705810 Win=848512 Len=0 TSval=16798891 TSecr=837853984
113   0.035961 54.192.159.164 -> 172.31.29.138 TCP 10578 [TCP segment of a reassembled PDU]
114   0.035971 172.31.29.138 -> 54.192.159.164 TCP 66 35539 > http [ACK] Seq=97 Ack=710154 Win=858112 Len=0 TSval=16798891 TSecr=837853984
115   0.035984 172.31.29.138 -> 54.192.159.164 TCP 66 35539 > http [ACK] Seq=97 Ack=720666 Win=874752 Len=0 TSval=16798891 TSecr=837853984
116   0.037307 54.192.159.164 -> 172.31.29.138 TCP 7306 [TCP segment of a reassembled PDU]
117   0.037315 172.31.29.138 -> 54.192.159.164 TCP 66 35539 > http [ACK] Seq=97 Ack=727906 Win=889088 Len=0 TSval=16798892 TSecr=837853984
118   0.037430 54.192.159.164 -> 172.31.29.138 TCP 26130 [TCP segment of a reassembled PDU]
119   0.037463 54.192.159.164 -> 172.31.29.138 TCP 13098 [TCP segment of a reassembled PDU]
120   0.037474 54.192.159.164 -> 172.31.29.138 TCP 11650 [TCP segment of a reassembled PDU]
121   0.037495 172.31.29.138 -> 54.192.159.164 TCP 66 35539 > http [ACK] Seq=97 Ack=778586 Win=838528 Len=0 TSval=16798892 TSecr=837853984
122   0.037769 54.192.159.164 -> 172.31.29.138 TCP 5858 [TCP segment of a reassembled PDU]
123   0.037776 172.31.29.138 -> 54.192.159.164 TCP 66 35539 > http [ACK] Seq=97 Ack=784378 Win=891520 Len=0 TSval=16798892 TSecr=837853985
124   0.037923 54.192.159.164 -> 172.31.29.138 TCP 13098 [TCP segment of a reassembled PDU]
125   0.037957 172.31.29.138 -> 54.192.159.164 TCP 66 35539 > http [ACK] Seq=97 Ack=797410 Win=898816 Len=0 TSval=16798892 TSecr=837853985
126   0.038047 54.192.159.164 -> 172.31.29.138 TCP 11650 [TCP segment of a reassembled PDU]
127   0.038067 172.31.29.138 -> 54.192.159.164 TCP 66 35539 > http [ACK] Seq=97 Ack=808994 Win=898816 Len=0 TSval=16798892 TSecr=837853985
128   0.038196 54.192.159.164 -> 172.31.29.138 TCP 26130 [TCP segment of a reassembled PDU]
129   0.038217 54.192.159.164 -> 172.31.29.138 TCP 16746 [TCP segment of a reassembled PDU]
130   0.038238 172.31.29.138 -> 54.192.159.164 TCP 66 35539 > http [ACK] Seq=97 Ack=851738 Win=856192 Len=0 TSval=16798892 TSecr=837853985
131   0.038895 54.192.159.164 -> 172.31.29.138 TCP 15994 [TCP segment of a reassembled PDU]
132   0.038921 172.31.29.138 -> 54.192.159.164 TCP 66 35539 > http [ACK] Seq=97 Ack=867666 Win=874752 Len=0 TSval=16798892 TSecr=837853985
133   0.039025 54.192.159.164 -> 172.31.29.138 TCP 26130 [TCP segment of a reassembled PDU]
134   0.039049 54.192.159.164 -> 172.31.29.138 TCP 23610 [TCP segment of a reassembled PDU]
135   0.039075 172.31.29.138 -> 54.192.159.164 TCP 66 35539 > http [ACK] Seq=97 Ack=917274 Win=825216 Len=0 TSval=16798892 TSecr=837853985
136   0.040137 54.192.159.164 -> 172.31.29.138 TCP 8754 [TCP segment of a reassembled PDU]
137   0.040144 172.31.29.138 -> 54.192.159.164 TCP 66 35539 > http [ACK] Seq=97 Ack=925962 Win=886784 Len=0 TSval=16798892 TSecr=837853985
138   0.040311 54.192.159.164 -> 172.31.29.138 TCP 26130 [TCP segment of a reassembled PDU]
139   0.040335 172.31.29.138 -> 54.192.159.164 TCP 66 35539 > http [ACK] Seq=97 Ack=952026 Win=860800 Len=0 TSval=16798892 TSecr=837853985
140   0.040367 54.192.159.164 -> 172.31.29.138 TCP 26130 [TCP segment of a reassembled PDU]
