[Measurement for 1mb at 12:35:22 20.35.2014] 
Tshark:

  1   0.000000 172.31.29.138 -> 172.31.0.2   DNS 89 Standard query 0x78ab  A d39wppo36gwqpx.cloudfront.net
  2   0.000029 172.31.29.138 -> 172.31.0.2   DNS 89 Standard query 0xfc3f  AAAA d39wppo36gwqpx.cloudfront.net
  3   0.000690   172.31.0.2 -> 172.31.29.138 DNS 217 Standard query response 0x78ab  A 54.230.150.52 A 54.230.150.61 A 54.230.150.106 A 54.230.150.123 A 54.230.148.165 A 54.230.149.231 A 54.230.150.16 A 54.230.150.47
  4   0.000701   172.31.0.2 -> 172.31.29.138 DNS 170 Standard query response 0xfc3f 
  5   0.003858 172.31.29.138 -> 54.230.150.52 TCP 74 44543 > http [SYN] Seq=0 Win=26883 Len=0 MSS=8961 SACK_PERM=1 TSval=17698911 TSecr=0 WS=128
  6   0.005329 54.230.150.52 -> 172.31.29.138 TCP 74 http > 44543 [SYN, ACK] Seq=0 Ack=1 Win=14480 Len=0 MSS=1460 SACK_PERM=1 TSval=447094643 TSecr=17698911 WS=128
  7   0.005344 172.31.29.138 -> 54.230.150.52 TCP 66 44543 > http [ACK] Seq=1 Ack=1 Win=27008 Len=0 TSval=17698911 TSecr=447094643
  8   0.005385 172.31.29.138 -> 54.230.150.52 HTTP 162 GET /1mb HTTP/1.1 
  9   0.006824 54.230.150.52 -> 172.31.29.138 TCP 66 http > 44543 [ACK] Seq=1 Ack=97 Win=14592 Len=0 TSval=447094643 TSecr=17698911
 10   0.010719 54.230.150.52 -> 172.31.29.138 TCP 7306 [TCP segment of a reassembled PDU]
 11   0.010729 172.31.29.138 -> 54.230.150.52 TCP 66 44543 > http [ACK] Seq=97 Ack=7241 Win=41472 Len=0 TSval=17698913 TSecr=447094644
 12   0.010768 54.230.150.52 -> 172.31.29.138 TCP 5858 [TCP segment of a reassembled PDU]
 13   0.010775 172.31.29.138 -> 54.230.150.52 TCP 66 44543 > http [ACK] Seq=97 Ack=13033 Win=52992 Len=0 TSval=17698913 TSecr=447094644
 14   0.012254 54.230.150.52 -> 172.31.29.138 TCP 8754 [TCP segment of a reassembled PDU]
 15   0.012263 172.31.29.138 -> 54.230.150.52 TCP 66 44543 > http [ACK] Seq=97 Ack=21721 Win=70400 Len=0 TSval=17698913 TSecr=447094644
 16   0.012280 54.230.150.52 -> 172.31.29.138 TCP 4410 [TCP segment of a reassembled PDU]
 17   0.012285 172.31.29.138 -> 54.230.150.52 TCP 66 44543 > http [ACK] Seq=97 Ack=26065 Win=79104 Len=0 TSval=17698913 TSecr=447094644
 18   0.013789 54.230.150.52 -> 172.31.29.138 TCP 4410 [TCP segment of a reassembled PDU]
 19   0.013795 172.31.29.138 -> 54.230.150.52 TCP 66 44543 > http [ACK] Seq=97 Ack=30409 Win=87808 Len=0 TSval=17698913 TSecr=447094644
 20   0.013888 54.230.150.52 -> 172.31.29.138 TCP 15994 [TCP segment of a reassembled PDU]
 21   0.013899 172.31.29.138 -> 54.230.150.52 TCP 66 44543 > http [ACK] Seq=97 Ack=46337 Win=91648 Len=0 TSval=17698913 TSecr=447094644
 22   0.015320 54.230.150.52 -> 172.31.29.138 TCP 5858 [TCP segment of a reassembled PDU]
 23   0.015327 172.31.29.138 -> 54.230.150.52 TCP 66 44543 > http [ACK] Seq=97 Ack=52129 Win=108416 Len=0 TSval=17698914 TSecr=447094644
 24   0.015372 54.230.150.52 -> 172.31.29.138 TCP 13098 [TCP segment of a reassembled PDU]
 25   0.015381 172.31.29.138 -> 54.230.150.52 TCP 66 44543 > http [ACK] Seq=97 Ack=65161 Win=135168 Len=0 TSval=17698914 TSecr=447094644
 26   0.016845 54.230.150.52 -> 172.31.29.138 TCP 5858 [TCP segment of a reassembled PDU]
 27   0.016852 172.31.29.138 -> 54.230.150.52 TCP 66 44543 > http [ACK] Seq=97 Ack=70953 Win=146688 Len=0 TSval=17698914 TSecr=447094644
 28   0.016979 54.230.150.52 -> 172.31.29.138 TCP 20338 [TCP segment of a reassembled PDU]
 29   0.016990 172.31.29.138 -> 54.230.150.52 TCP 66 44543 > http [ACK] Seq=97 Ack=91225 Win=187264 Len=0 TSval=17698914 TSecr=447094644
 30   0.018415 54.230.150.52 -> 172.31.29.138 TCP 15994 [TCP segment of a reassembled PDU]
 31   0.018426 172.31.29.138 -> 54.230.150.52 TCP 66 44543 > http [ACK] Seq=97 Ack=107153 Win=219136 Len=0 TSval=17698915 TSecr=447094645
 32   0.018485 54.230.150.52 -> 172.31.29.138 TCP 13098 [TCP segment of a reassembled PDU]
 33   0.018495 172.31.29.138 -> 54.230.150.52 TCP 66 44543 > http [ACK] Seq=97 Ack=120185 Win=245120 Len=0 TSval=17698915 TSecr=447094645
 34   0.019917 54.230.150.52 -> 172.31.29.138 TCP 8754 [TCP segment of a reassembled PDU]
 35   0.019926 172.31.29.138 -> 54.230.150.52 TCP 66 44543 > http [ACK] Seq=97 Ack=128873 Win=262528 Len=0 TSval=17698915 TSecr=447094645
 36   0.020038 54.230.150.52 -> 172.31.29.138 TCP 23234 [TCP segment of a reassembled PDU]
 37   0.020051 172.31.29.138 -> 54.230.150.52 TCP 66 44543 > http [ACK] Seq=97 Ack=152041 Win=308864 Len=0 TSval=17698915 TSecr=447094645
 38   0.021470 54.230.150.52 -> 172.31.29.138 TCP 2962 [TCP segment of a reassembled PDU]
 39   0.021477 172.31.29.138 -> 54.230.150.52 TCP 66 44543 > http [ACK] Seq=97 Ack=154937 Win=314624 Len=0 TSval=17698915 TSecr=447094645
 40   0.021591 54.230.150.52 -> 172.31.29.138 TCP 14546 [TCP segment of a reassembled PDU]
 41   0.021601 172.31.29.138 -> 54.230.150.52 TCP 66 44543 > http [ACK] Seq=97 Ack=169417 Win=343680 Len=0 TSval=17698915 TSecr=447094645
 42   0.021639 54.230.150.52 -> 172.31.29.138 TCP 13098 [TCP segment of a reassembled PDU]
 43   0.021649 172.31.29.138 -> 54.230.150.52 TCP 66 44543 > http [ACK] Seq=97 Ack=182449 Win=369664 Len=0 TSval=17698915 TSecr=447094645
 44   0.021672 54.230.150.52 -> 172.31.29.138 TCP 4410 [TCP segment of a reassembled PDU]
 45   0.021676 172.31.29.138 -> 54.230.150.52 TCP 66 44543 > http [ACK] Seq=97 Ack=186793 Win=378368 Len=0 TSval=17698915 TSecr=447094645
 46   0.022999 54.230.150.52 -> 172.31.29.138 TCP 4410 [TCP segment of a reassembled PDU]
 47   0.023005 172.31.29.138 -> 54.230.150.52 TCP 66 44543 > http [ACK] Seq=97 Ack=191137 Win=387072 Len=0 TSval=17698916 TSecr=447094645
 48   0.023167 54.230.150.52 -> 172.31.29.138 TCP 26130 [TCP segment of a reassembled PDU]
 49   0.023181 172.31.29.138 -> 54.230.150.52 TCP 66 44543 > http [ACK] Seq=97 Ack=217201 Win=439168 Len=0 TSval=17698916 TSecr=447094645
 50   0.023189 54.230.150.52 -> 172.31.29.138 TCP 4410 [TCP segment of a reassembled PDU]
 51   0.023193 172.31.29.138 -> 54.230.150.52 TCP 66 44543 > http [ACK] Seq=97 Ack=221545 Win=447872 Len=0 TSval=17698916 TSecr=447094645
 52   0.024543 54.230.150.52 -> 172.31.29.138 TCP 8754 [TCP segment of a reassembled PDU]
 53   0.024552 172.31.29.138 -> 54.230.150.52 TCP 66 44543 > http [ACK] Seq=97 Ack=230233 Win=465280 Len=0 TSval=17698916 TSecr=447094645
 54   0.024698 54.230.150.52 -> 172.31.29.138 TCP 21786 [TCP segment of a reassembled PDU]
 55   0.024711 172.31.29.138 -> 54.230.150.52 TCP 66 44543 > http [ACK] Seq=97 Ack=251953 Win=508672 Len=0 TSval=17698916 TSecr=447094645
 56   0.026081 54.230.150.52 -> 172.31.29.138 TCP 11650 [TCP segment of a reassembled PDU]
 57   0.026091 172.31.29.138 -> 54.230.150.52 TCP 66 44543 > http [ACK] Seq=97 Ack=263537 Win=531840 Len=0 TSval=17698917 TSecr=447094645
 58   0.026256 54.230.150.52 -> 172.31.29.138 TCP 26130 [TCP segment of a reassembled PDU]
 59   0.026269 172.31.29.138 -> 54.230.150.52 TCP 66 44543 > http [ACK] Seq=97 Ack=289601 Win=578944 Len=0 TSval=17698917 TSecr=447094645
 60   0.026282 54.230.150.52 -> 172.31.29.138 TCP 10202 [TCP segment of a reassembled PDU]
 61   0.026287 172.31.29.138 -> 54.230.150.52 TCP 66 44543 > http [ACK] Seq=97 Ack=299737 Win=568832 Len=0 TSval=17698917 TSecr=447094645
 62   0.027872 54.230.150.52 -> 172.31.29.138 TCP 5858 [TCP segment of a reassembled PDU]
 63   0.027879 172.31.29.138 -> 54.230.150.52 TCP 66 44543 > http [ACK] Seq=97 Ack=305529 Win=595584 Len=0 TSval=17698917 TSecr=447094645
 64   0.028004 54.230.150.52 -> 172.31.29.138 TCP 11650 [TCP segment of a reassembled PDU]
 65   0.028013 172.31.29.138 -> 54.230.150.52 TCP 66 44543 > http [ACK] Seq=97 Ack=317113 Win=602752 Len=0 TSval=17698917 TSecr=447094645
 66   0.028083 54.230.150.52 -> 172.31.29.138 TCP 23234 [TCP segment of a reassembled PDU]
 67   0.028097 172.31.29.138 -> 54.230.150.52 TCP 66 44543 > http [ACK] Seq=97 Ack=340281 Win=583680 Len=0 TSval=17698917 TSecr=447094645
 68   0.029170 54.230.150.52 -> 172.31.29.138 TCP 5858 [TCP segment of a reassembled PDU]
 69   0.029177 172.31.29.138 -> 54.230.150.52 TCP 66 44543 > http [ACK] Seq=97 Ack=346073 Win=612224 Len=0 TSval=17698917 TSecr=447094646
 70   0.029311 54.230.150.52 -> 172.31.29.138 TCP 13098 [TCP segment of a reassembled PDU]
 71   0.029321 172.31.29.138 -> 54.230.150.52 TCP 66 44543 > http [ACK] Seq=97 Ack=359105 Win=600320 Len=0 TSval=17698917 TSecr=447094646
 72   0.029583 54.230.150.52 -> 172.31.29.138 TCP 20338 [TCP segment of a reassembled PDU]
 73   0.029595 172.31.29.138 -> 54.230.150.52 TCP 66 44543 > http [ACK] Seq=97 Ack=379377 Win=588416 Len=0 TSval=17698917 TSecr=447094646
 74   0.029602 54.230.150.52 -> 172.31.29.138 TCP 2962 [TCP segment of a reassembled PDU]
 75   0.029623 172.31.29.138 -> 54.230.150.52 TCP 66 44543 > http [ACK] Seq=97 Ack=382273 Win=585600 Len=0 TSval=17698917 TSecr=447094646
 76   0.030420 54.230.150.52 -> 172.31.29.138 TCP 7306 [TCP segment of a reassembled PDU]
 77   0.030427 172.31.29.138 -> 54.230.150.52 TCP 66 44543 > http [ACK] Seq=97 Ack=389513 Win=609792 Len=0 TSval=17698918 TSecr=447094646
 78   0.030662 54.230.150.52 -> 172.31.29.138 TCP 7306 [TCP segment of a reassembled PDU]
 79   0.030669 172.31.29.138 -> 54.230.150.52 TCP 66 44543 > http [ACK] Seq=97 Ack=396753 Win=633216 Len=0 TSval=17698918 TSecr=447094646
 80   0.030786 54.230.150.52 -> 172.31.29.138 TCP 7306 [TCP segment of a reassembled PDU]
 81   0.030793 172.31.29.138 -> 54.230.150.52 TCP 66 44543 > http [ACK] Seq=97 Ack=403993 Win=647680 Len=0 TSval=17698918 TSecr=447094646
 82   0.031098 54.230.150.52 -> 172.31.29.138 TCP 26130 [TCP segment of a reassembled PDU]
 83   0.031112 172.31.29.138 -> 54.230.150.52 TCP 66 44543 > http [ACK] Seq=97 Ack=430057 Win=699904 Len=0 TSval=17698918 TSecr=447094646
 84   0.031124 54.230.150.52 -> 172.31.29.138 TCP 10202 [TCP segment of a reassembled PDU]
 85   0.031129 172.31.29.138 -> 54.230.150.52 TCP 66 44543 > http [ACK] Seq=97 Ack=440193 Win=720128 Len=0 TSval=17698918 TSecr=447094646
 86   0.031720 54.230.150.52 -> 172.31.29.138 TCP 5858 [TCP segment of a reassembled PDU]
 87   0.031727 172.31.29.138 -> 54.230.150.52 TCP 66 44543 > http [ACK] Seq=97 Ack=445985 Win=731648 Len=0 TSval=17698918 TSecr=447094646
 88   0.031830 54.230.150.52 -> 172.31.29.138 TCP 1514 [TCP segment of a reassembled PDU]
 89   0.031835 172.31.29.138 -> 54.230.150.52 TCP 66 44543 > http [ACK] Seq=97 Ack=447433 Win=734592 Len=0 TSval=17698918 TSecr=447094646
 90   0.032197 54.230.150.52 -> 172.31.29.138 TCP 5858 [TCP segment of a reassembled PDU]
 91   0.032203 172.31.29.138 -> 54.230.150.52 TCP 66 44543 > http [ACK] Seq=97 Ack=453225 Win=746240 Len=0 TSval=17698918 TSecr=447094646
 92   0.032331 54.230.150.52 -> 172.31.29.138 TCP 17442 [TCP segment of a reassembled PDU]
 93   0.032341 172.31.29.138 -> 54.230.150.52 TCP 66 44543 > http [ACK] Seq=97 Ack=470601 Win=764288 Len=0 TSval=17698918 TSecr=447094646
 94   0.032705 54.230.150.52 -> 172.31.29.138 TCP 7306 [TCP segment of a reassembled PDU]
 95   0.032713 172.31.29.138 -> 54.230.150.52 TCP 66 44543 > http [ACK] Seq=97 Ack=477841 Win=781056 Len=0 TSval=17698918 TSecr=447094646
 96   0.032853 54.230.150.52 -> 172.31.29.138 TCP 20338 [TCP segment of a reassembled PDU]
 97   0.032960 172.31.29.138 -> 54.230.150.52 TCP 66 44543 > http [ACK] Seq=97 Ack=498113 Win=760832 Len=0 TSval=17698918 TSecr=447094646
 98   0.033064 54.230.150.52 -> 172.31.29.138 TCP 14546 [TCP segment of a reassembled PDU]
 99   0.033074 172.31.29.138 -> 54.230.150.52 TCP 66 44543 > http [ACK] Seq=97 Ack=512593 Win=769024 Len=0 TSval=17698918 TSecr=447094646
100   0.033765 54.230.150.52 -> 172.31.29.138 TCP 11650 [TCP segment of a reassembled PDU]
101   0.033774 172.31.29.138 -> 54.230.150.52 TCP 66 44543 > http [ACK] Seq=97 Ack=524177 Win=773888 Len=0 TSval=17698918 TSecr=447094646
102   0.033908 54.230.150.52 -> 172.31.29.138 TCP 21786 [TCP segment of a reassembled PDU]
103   0.033933 172.31.29.138 -> 54.230.150.52 TCP 66 44543 > http [ACK] Seq=97 Ack=545897 Win=757248 Len=0 TSval=17698919 TSecr=447094646
104   0.034271 54.230.150.52 -> 172.31.29.138 TCP 5858 [TCP segment of a reassembled PDU]
105   0.034277 172.31.29.138 -> 54.230.150.52 TCP 66 44543 > http [ACK] Seq=97 Ack=551689 Win=783360 Len=0 TSval=17698919 TSecr=447094646
106   0.034437 54.230.150.52 -> 172.31.29.138 TCP 24682 [TCP segment of a reassembled PDU]
107   0.034462 172.31.29.138 -> 54.230.150.52 TCP 66 44543 > http [ACK] Seq=97 Ack=576305 Win=758784 Len=0 TSval=17698919 TSecr=447094646
108   0.034602 54.230.150.52 -> 172.31.29.138 TCP 1514 [TCP segment of a reassembled PDU]
109   0.035268 54.230.150.52 -> 172.31.29.138 TCP 8754 [TCP segment of a reassembled PDU]
110   0.035275 172.31.29.138 -> 54.230.150.52 TCP 66 44543 > http [ACK] Seq=97 Ack=586441 Win=778624 Len=0 TSval=17698919 TSecr=447094646
111   0.035405 54.230.150.52 -> 172.31.29.138 TCP 18890 [TCP segment of a reassembled PDU]
112   0.035428 172.31.29.138 -> 54.230.150.52 TCP 66 44543 > http [ACK] Seq=97 Ack=605265 Win=761984 Len=0 TSval=17698919 TSecr=447094646
113   0.035691 54.230.150.52 -> 172.31.29.138 TCP 30474 [TCP segment of a reassembled PDU]
114   0.035720 172.31.29.138 -> 54.230.150.52 TCP 66 44543 > http [ACK] Seq=97 Ack=635673 Win=742912 Len=0 TSval=17698919 TSecr=447094646
115   0.035846 54.230.150.52 -> 172.31.29.138 TCP 7306 [TCP segment of a reassembled PDU]
116   0.035853 172.31.29.138 -> 54.230.150.52 TCP 66 44543 > http [ACK] Seq=97 Ack=642913 Win=781056 Len=0 TSval=17698919 TSecr=447094646
117   0.036607 54.230.150.52 -> 172.31.29.138 TCP 5858 [TCP segment of a reassembled PDU]
118   0.036613 172.31.29.138 -> 54.230.150.52 TCP 66 44543 > http [ACK] Seq=97 Ack=648705 Win=783360 Len=0 TSval=17698919 TSecr=447094646
119   0.036784 54.230.150.52 -> 172.31.29.138 TCP 24682 [TCP segment of a reassembled PDU]
120   0.036809 172.31.29.138 -> 54.230.150.52 TCP 66 44543 > http [ACK] Seq=97 Ack=673321 Win=758784 Len=0 TSval=17698919 TSecr=447094646
121   0.037146 54.230.150.52 -> 172.31.29.138 TCP 7306 [TCP segment of a reassembled PDU]
122   0.037154 172.31.29.138 -> 54.230.150.52 TCP 66 44543 > http [ACK] Seq=97 Ack=680561 Win=781056 Len=0 TSval=17698919 TSecr=447094646
123   0.037313 54.230.150.52 -> 172.31.29.138 TCP 17442 [TCP segment of a reassembled PDU]
124   0.037335 172.31.29.138 -> 54.230.150.52 TCP 66 44543 > http [ACK] Seq=97 Ack=697937 Win=764288 Len=0 TSval=17698919 TSecr=447094646
125   0.037355 54.230.150.52 -> 172.31.29.138 TCP 8754 [TCP segment of a reassembled PDU]
126   0.037370 172.31.29.138 -> 54.230.150.52 TCP 66 44543 > http [ACK] Seq=97 Ack=706625 Win=790272 Len=0 TSval=17698919 TSecr=447094646
127   0.037381 54.230.150.52 -> 172.31.29.138 TCP 1514 [TCP segment of a reassembled PDU]
128   0.038095 54.230.150.52 -> 172.31.29.138 TCP 7306 [TCP segment of a reassembled PDU]
129   0.038115 172.31.29.138 -> 54.230.150.52 TCP 66 44543 > http [ACK] Seq=97 Ack=715313 Win=790272 Len=0 TSval=17698920 TSecr=447094646
130   0.038272 54.230.150.52 -> 172.31.29.138 TCP 26130 [TCP segment of a reassembled PDU]
131   0.038362 172.31.29.138 -> 54.230.150.52 TCP 66 44543 > http [ACK] Seq=97 Ack=741377 Win=764288 Len=0 TSval=17698920 TSecr=447094647
132   0.038519 54.230.150.52 -> 172.31.29.138 TCP 18890 [TCP segment of a reassembled PDU]
133   0.038550 54.230.150.52 -> 172.31.29.138 TCP 7306 [TCP segment of a reassembled PDU]
134   0.038559 54.230.150.52 -> 172.31.29.138 TCP 5858 [TCP segment of a reassembled PDU]
135   0.038564 172.31.29.138 -> 54.230.150.52 TCP 66 44543 > http [ACK] Seq=97 Ack=760201 Win=761984 Len=0 TSval=17698920 TSecr=447094647
136   0.038580 172.31.29.138 -> 54.230.150.52 TCP 66 44543 > http [ACK] Seq=97 Ack=773233 Win=790272 Len=0 TSval=17698920 TSecr=447094647
137   0.039685 54.230.150.52 -> 172.31.29.138 TCP 2962 [TCP segment of a reassembled PDU]
138   0.039700 172.31.29.138 -> 54.230.150.52 TCP 66 44543 > http [ACK] Seq=97 Ack=776129 Win=790272 Len=0 TSval=17698920 TSecr=447094647
139   0.039877 54.230.150.52 -> 172.31.29.138 TCP 26130 [TCP segment of a reassembled PDU]
140   0.039923 54.230.150.52 -> 172.31.29.138 TCP 20338 [TCP segment of a reassembled PDU]
141   0.039935 172.31.29.138 -> 54.230.150.52 TCP 66 44543 > http [ACK] Seq=97 Ack=802193 Win=764288 Len=0 TSval=17698920 TSecr=447094647
142   0.039954 54.230.150.52 -> 172.31.29.138 TCP 5858 [TCP segment of a reassembled PDU]
143   0.039979 172.31.29.138 -> 54.230.150.52 TCP 66 44543 > http [ACK] Seq=97 Ack=828257 Win=749952 Len=0 TSval=17698920 TSecr=447094647
144   0.040006 54.230.150.52 -> 172.31.29.138 TCP 10202 [TCP segment of a reassembled PDU]
145   0.040014 172.31.29.138 -> 54.230.150.52 TCP 66 44543 > http [ACK] Seq=97 Ack=838393 Win=766720 Len=0 TSval=17698920 TSecr=447094647
146   0.040212 54.230.150.52 -> 172.31.29.138 TCP 4410 [TCP segment of a reassembled PDU]
147   0.040219 172.31.29.138 -> 54.230.150.52 TCP 66 44543 > http [ACK] Seq=97 Ack=842737 Win=785792 Len=0 TSval=17698920 TSecr=447094647
148   0.040412 54.230.150.52 -> 172.31.29.138 TCP 26130 [TCP segment of a reassembled PDU]
149   0.040432 54.230.150.52 -> 172.31.29.138 TCP 8754 [TCP segment of a reassembled PDU]
150   0.040450 172.31.29.138 -> 54.230.150.52 TCP 66 44543 > http [ACK] Seq=97 Ack=877489 Win=751104 Len=0 TSval=17698920 TSecr=447094647
151   0.041255 54.230.150.52 -> 172.31.29.138 TCP 7306 [TCP segment of a reassembled PDU]
152   0.041263 172.31.29.138 -> 54.230.150.52 TCP 66 44543 > http [ACK] Seq=97 Ack=884729 Win=781056 Len=0 TSval=17698920 TSecr=447094647
153   0.041447 54.230.150.52 -> 172.31.29.138 TCP 26130 [TCP segment of a reassembled PDU]
154   0.041491 54.230.150.52 -> 172.31.29.138 TCP 20338 [TCP segment of a reassembled PDU]
155   0.041504 172.31.29.138 -> 54.230.150.52 TCP 66 44543 > http [ACK] Seq=97 Ack=910793 Win=755072 Len=0 TSval=17698920 TSecr=447094647
156   0.041521 54.230.150.52 -> 172.31.29.138 TCP 5858 [TCP segment of a reassembled PDU]
157   0.041534 172.31.29.138 -> 54.230.150.52 TCP 66 44543 > http [ACK] Seq=97 Ack=936857 Win=749952 Len=0 TSval=17698920 TSecr=447094647
158   0.041584 54.230.150.52 -> 172.31.29.138 TCP 11650 [TCP segment of a reassembled PDU]
159   0.041592 172.31.29.138 -> 54.230.150.52 TCP 66 44543 > http [ACK] Seq=97 Ack=948441 Win=773888 Len=0 TSval=17698920 TSecr=447094647
160   0.041793 54.230.150.52 -> 172.31.29.138 TCP 7306 [TCP segment of a reassembled PDU]
161   0.041800 172.31.29.138 -> 54.230.150.52 TCP 66 44543 > http [ACK] Seq=97 Ack=955681 Win=781056 Len=0 TSval=17698920 TSecr=447094647
162   0.041942 54.230.150.52 -> 172.31.29.138 TCP 13098 [TCP segment of a reassembled PDU]
163   0.042134 172.31.29.138 -> 54.230.150.52 TCP 66 44543 > http [ACK] Seq=97 Ack=968713 Win=790272 Len=0 TSval=17698921 TSecr=447094647
164   0.042796 54.230.150.52 -> 172.31.29.138 TCP 2962 [TCP segment of a reassembled PDU]
165   0.042802 172.31.29.138 -> 54.230.150.52 TCP 66 44543 > http [ACK] Seq=97 Ack=971609 Win=796160 Len=0 TSval=17698921 TSecr=447094647
166   0.042985 54.230.150.52 -> 172.31.29.138 TCP 21786 [TCP segment of a reassembled PDU]
167   0.042997 172.31.29.138 -> 54.230.150.52 TCP 66 44543 > http [ACK] Seq=97 Ack=993329 Win=839552 Len=0 TSval=17698921 TSecr=447094647
168   0.043014 54.230.150.52 -> 172.31.29.138 TCP 4410 [TCP segment of a reassembled PDU]
169   0.043018 172.31.29.138 -> 54.230.150.52 TCP 66 44543 > http [ACK] Seq=97 Ack=997673 Win=848256 Len=0 TSval=17698921 TSecr=447094647
170   0.043105 54.230.150.52 -> 172.31.29.138 TCP 26130 [TCP segment of a reassembled PDU]
171   0.043119 172.31.29.138 -> 54.230.150.52 TCP 66 44543 > http [ACK] Seq=97 Ack=1023737 Win=900352 Len=0 TSval=17698921 TSecr=447094647
172   0.043131 54.230.150.52 -> 172.31.29.138 TCP 10202 [TCP segment of a reassembled PDU]
173   0.043136 172.31.29.138 -> 54.230.150.52 TCP 66 44543 > http [ACK] Seq=97 Ack=1033873 Win=913664 Len=0 TSval=17698921 TSecr=447094647
174   0.043335 54.230.150.52 -> 172.31.29.138 HTTP 15227 HTTP/1.1 200 OK  (application/octet-stream)
175   0.043345 172.31.29.138 -> 54.230.150.52 TCP 66 44543 > http [ACK] Seq=97 Ack=1049034 Win=946944 Len=0 TSval=17698921 TSecr=447094647
176   0.043490 172.31.29.138 -> 54.230.150.52 TCP 66 44543 > http [FIN, ACK] Seq=97 Ack=1049034 Win=951040 Len=0 TSval=17698921 TSecr=447094647
177   0.044903 54.230.150.52 -> 172.31.29.138 TCP 66 http > 44543 [FIN, ACK] Seq=1049034 Ack=98 Win=14592 Len=0 TSval=447094647 TSecr=17698921
178   0.044915 172.31.29.138 -> 54.230.150.52 TCP 66 44543 > http [ACK] Seq=98 Ack=1049035 Win=951040 Len=0 TSval=17698921 TSecr=447094647
