[Measurement for 1mb at 09:35:22 20.35.2014] 
Tshark:

  1   0.000000 172.31.29.138 -> 172.31.0.2   DNS 89 Standard query 0x768e  A d39wppo36gwqpx.cloudfront.net
  2   0.000028 172.31.29.138 -> 172.31.0.2   DNS 89 Standard query 0x490c  AAAA d39wppo36gwqpx.cloudfront.net
  3   0.000598   172.31.0.2 -> 172.31.29.138 DNS 170 Standard query response 0x490c 
  4   0.000689   172.31.0.2 -> 172.31.29.138 DNS 217 Standard query response 0x768e  A 54.230.158.217 A 54.230.159.143 A 54.192.157.146 A 54.192.159.171 A 54.192.159.173 A 54.192.159.180 A 54.230.157.230 A 54.230.158.189
  5   0.003853 172.31.29.138 -> 54.230.158.217 TCP 74 42212 > http [SYN] Seq=0 Win=26883 Len=0 MSS=8961 SACK_PERM=1 TSval=14998815 TSecr=0 WS=128
  6   0.004639 54.230.158.217 -> 172.31.29.138 TCP 74 http > 42212 [SYN, ACK] Seq=0 Ack=1 Win=14480 Len=0 MSS=1460 SACK_PERM=1 TSval=812239144 TSecr=14998815 WS=128
  7   0.004653 172.31.29.138 -> 54.230.158.217 TCP 66 42212 > http [ACK] Seq=1 Ack=1 Win=27008 Len=0 TSval=14998815 TSecr=812239144
  8   0.004695 172.31.29.138 -> 54.230.158.217 HTTP 162 GET /1mb HTTP/1.1 
  9   0.005272 54.230.158.217 -> 172.31.29.138 TCP 66 http > 42212 [ACK] Seq=1 Ack=97 Win=14592 Len=0 TSval=812239145 TSecr=14998815
 10   0.010429 54.230.158.217 -> 172.31.29.138 TCP 523 [TCP segment of a reassembled PDU]
 11   0.010443 172.31.29.138 -> 54.230.158.217 TCP 66 42212 > http [ACK] Seq=97 Ack=458 Win=28032 Len=0 TSval=14998817 TSecr=812239145
 12   0.010493 54.230.158.217 -> 172.31.29.138 TCP 13098 [TCP segment of a reassembled PDU]
 13   0.010504 172.31.29.138 -> 54.230.158.217 TCP 66 42212 > http [ACK] Seq=97 Ack=13490 Win=54144 Len=0 TSval=14998817 TSecr=812239145
 14   0.011234 54.230.158.217 -> 172.31.29.138 TCP 5858 [TCP segment of a reassembled PDU]
 15   0.011242 172.31.29.138 -> 54.230.158.217 TCP 66 42212 > http [ACK] Seq=97 Ack=19282 Win=65664 Len=0 TSval=14998817 TSecr=812239145
 16   0.011261 54.230.158.217 -> 172.31.29.138 TCP 7306 [TCP segment of a reassembled PDU]
 17   0.011269 172.31.29.138 -> 54.230.158.217 TCP 66 42212 > http [ACK] Seq=97 Ack=26522 Win=80128 Len=0 TSval=14998817 TSecr=812239145
 18   0.011964 54.230.158.217 -> 172.31.29.138 TCP 5858 [TCP segment of a reassembled PDU]
 19   0.011971 172.31.29.138 -> 54.230.158.217 TCP 66 42212 > http [ACK] Seq=97 Ack=32314 Win=91776 Len=0 TSval=14998817 TSecr=812239145
 20   0.012034 54.230.158.217 -> 172.31.29.138 TCP 14546 [TCP segment of a reassembled PDU]
 21   0.012043 172.31.29.138 -> 54.230.158.217 TCP 66 42212 > http [ACK] Seq=97 Ack=46794 Win=94080 Len=0 TSval=14998817 TSecr=812239145
 22   0.012729 54.230.158.217 -> 172.31.29.138 TCP 5858 [TCP segment of a reassembled PDU]
 23   0.012736 172.31.29.138 -> 54.230.158.217 TCP 66 42212 > http [ACK] Seq=97 Ack=52586 Win=108416 Len=0 TSval=14998817 TSecr=812239145
 24   0.012798 54.230.158.217 -> 172.31.29.138 TCP 15994 [TCP segment of a reassembled PDU]
 25   0.012808 172.31.29.138 -> 54.230.158.217 TCP 66 42212 > http [ACK] Seq=97 Ack=68514 Win=92544 Len=0 TSval=14998817 TSecr=812239145
 26   0.012814 54.230.158.217 -> 172.31.29.138 TCP 1514 [TCP segment of a reassembled PDU]
 27   0.012818 172.31.29.138 -> 54.230.158.217 TCP 66 42212 > http [ACK] Seq=97 Ack=69962 Win=91136 Len=0 TSval=14998817 TSecr=812239145
 28   0.013489 54.230.158.217 -> 172.31.29.138 TCP 4410 [TCP segment of a reassembled PDU]
 29   0.013495 172.31.29.138 -> 54.230.158.217 TCP 66 42212 > http [ACK] Seq=97 Ack=74306 Win=109056 Len=0 TSval=14998818 TSecr=812239145
 30   0.013591 54.230.158.217 -> 172.31.29.138 TCP 17442 [TCP segment of a reassembled PDU]
 31   0.013602 172.31.29.138 -> 54.230.158.217 TCP 66 42212 > http [ACK] Seq=97 Ack=91682 Win=143872 Len=0 TSval=14998818 TSecr=812239145
 32   0.014011 54.230.158.217 -> 172.31.29.138 TCP 5858 [TCP segment of a reassembled PDU]
 33   0.014018 172.31.29.138 -> 54.230.158.217 TCP 66 42212 > http [ACK] Seq=97 Ack=97474 Win=155392 Len=0 TSval=14998818 TSecr=812239145
 34   0.014085 54.230.158.217 -> 172.31.29.138 TCP 5858 [TCP segment of a reassembled PDU]
 35   0.014091 172.31.29.138 -> 54.230.158.217 TCP 66 42212 > http [ACK] Seq=97 Ack=103266 Win=167040 Len=0 TSval=14998818 TSecr=812239145
 36   0.014331 54.230.158.217 -> 172.31.29.138 TCP 18890 [TCP segment of a reassembled PDU]
 37   0.014342 172.31.29.138 -> 54.230.158.217 TCP 66 42212 > http [ACK] Seq=97 Ack=122090 Win=204672 Len=0 TSval=14998818 TSecr=812239145
 38   0.014765 54.230.158.217 -> 172.31.29.138 TCP 2962 [TCP segment of a reassembled PDU]
 39   0.014772 172.31.29.138 -> 54.230.158.217 TCP 66 42212 > http [ACK] Seq=97 Ack=124986 Win=210432 Len=0 TSval=14998818 TSecr=812239145
 40   0.014855 54.230.158.217 -> 172.31.29.138 TCP 5858 [TCP segment of a reassembled PDU]
 41   0.014861 172.31.29.138 -> 54.230.158.217 TCP 66 42212 > http [ACK] Seq=97 Ack=130778 Win=221952 Len=0 TSval=14998818 TSecr=812239145
 42   0.014867 54.230.158.217 -> 172.31.29.138 TCP 130 [TCP segment of a reassembled PDU]
 43   0.014869 172.31.29.138 -> 54.230.158.217 TCP 66 42212 > http [ACK] Seq=97 Ack=130842 Win=221952 Len=0 TSval=14998818 TSecr=812239145
 44   0.015045 54.230.158.217 -> 172.31.29.138 TCP 8754 [TCP segment of a reassembled PDU]
 45   0.015052 172.31.29.138 -> 54.230.158.217 TCP 66 42212 > http [ACK] Seq=97 Ack=139530 Win=239360 Len=0 TSval=14998818 TSecr=812239146
 46   0.015360 54.230.158.217 -> 172.31.29.138 TCP 15994 [TCP segment of a reassembled PDU]
 47   0.015371 172.31.29.138 -> 54.230.158.217 TCP 66 42212 > http [ACK] Seq=97 Ack=155458 Win=271232 Len=0 TSval=14998818 TSecr=812239146
 48   0.015617 54.230.158.217 -> 172.31.29.138 TCP 14546 [TCP segment of a reassembled PDU]
 49   0.015627 172.31.29.138 -> 54.230.158.217 TCP 66 42212 > http [ACK] Seq=97 Ack=169938 Win=300160 Len=0 TSval=14998818 TSecr=812239146
 50   0.016046 54.230.158.217 -> 172.31.29.138 TCP 2962 [TCP segment of a reassembled PDU]
 51   0.016051 172.31.29.138 -> 54.230.158.217 TCP 66 42212 > http [ACK] Seq=97 Ack=172834 Win=306048 Len=0 TSval=14998818 TSecr=812239146
 52   0.016213 54.230.158.217 -> 172.31.29.138 TCP 23610 [TCP segment of a reassembled PDU]
 53   0.016225 172.31.29.138 -> 54.230.158.217 TCP 66 42212 > http [ACK] Seq=97 Ack=196378 Win=353024 Len=0 TSval=14998818 TSecr=812239146
 54   0.017871 54.230.158.217 -> 172.31.29.138 TCP 2962 [TCP segment of a reassembled PDU]
 55   0.017880 172.31.29.138 -> 54.230.158.217 TCP 66 42212 > http [ACK] Seq=97 Ack=199274 Win=358912 Len=0 TSval=14998819 TSecr=812239146
 56   0.018281 54.230.158.217 -> 172.31.29.138 TCP 26130 [TCP segment of a reassembled PDU]
 57   0.018296 172.31.29.138 -> 54.230.158.217 TCP 66 42212 > http [ACK] Seq=97 Ack=225338 Win=411008 Len=0 TSval=14998819 TSecr=812239146
 58   0.018310 54.230.158.217 -> 172.31.29.138 TCP 10202 [TCP segment of a reassembled PDU]
 59   0.018315 172.31.29.138 -> 54.230.158.217 TCP 66 42212 > http [ACK] Seq=97 Ack=235474 Win=431232 Len=0 TSval=14998819 TSecr=812239146
 60   0.018856 54.230.158.217 -> 172.31.29.138 TCP 2962 [TCP segment of a reassembled PDU]
 61   0.018862 172.31.29.138 -> 54.230.158.217 TCP 66 42212 > http [ACK] Seq=97 Ack=238370 Win=437120 Len=0 TSval=14998819 TSecr=812239146
 62   0.019042 54.230.158.217 -> 172.31.29.138 TCP 23610 [TCP segment of a reassembled PDU]
 63   0.019055 172.31.29.138 -> 54.230.158.217 TCP 66 42212 > http [ACK] Seq=97 Ack=261914 Win=484096 Len=0 TSval=14998819 TSecr=812239146
 64   0.022972 54.230.158.217 -> 172.31.29.138 TCP 4410 [TCP segment of a reassembled PDU]
 65   0.022980 172.31.29.138 -> 54.230.158.217 TCP 66 42212 > http [ACK] Seq=97 Ack=266258 Win=492800 Len=0 TSval=14998820 TSecr=812239146
 66   0.023144 54.230.158.217 -> 172.31.29.138 TCP 20338 [TCP segment of a reassembled PDU]
 67   0.023156 172.31.29.138 -> 54.230.158.217 TCP 66 42212 > http [ACK] Seq=97 Ack=286530 Win=533376 Len=0 TSval=14998820 TSecr=812239146
 68   0.023176 54.230.158.217 -> 172.31.29.138 TCP 5858 [TCP segment of a reassembled PDU]
 69   0.023181 172.31.29.138 -> 54.230.158.217 TCP 66 42212 > http [ACK] Seq=97 Ack=292322 Win=545024 Len=0 TSval=14998820 TSecr=812239146
 70   0.023225 54.230.158.217 -> 172.31.29.138 TCP 7306 [TCP segment of a reassembled PDU]
 71   0.023232 172.31.29.138 -> 54.230.158.217 TCP 66 42212 > http [ACK] Seq=97 Ack=299562 Win=559488 Len=0 TSval=14998820 TSecr=812239146
 72   0.023343 54.230.158.217 -> 172.31.29.138 TCP 10202 [TCP segment of a reassembled PDU]
 73   0.023350 172.31.29.138 -> 54.230.158.217 TCP 66 42212 > http [ACK] Seq=97 Ack=309698 Win=579712 Len=0 TSval=14998820 TSecr=812239146
 74   0.023726 54.230.158.217 -> 172.31.29.138 TCP 4410 [TCP segment of a reassembled PDU]
 75   0.023731 172.31.29.138 -> 54.230.158.217 TCP 66 42212 > http [ACK] Seq=97 Ack=314042 Win=588416 Len=0 TSval=14998820 TSecr=812239146
 76   0.023912 54.230.158.217 -> 172.31.29.138 TCP 23234 [TCP segment of a reassembled PDU]
 77   0.023925 172.31.29.138 -> 54.230.158.217 TCP 66 42212 > http [ACK] Seq=97 Ack=337210 Win=634752 Len=0 TSval=14998820 TSecr=812239146
 78   0.023989 54.230.158.217 -> 172.31.29.138 TCP 4410 [TCP segment of a reassembled PDU]
 79   0.023995 172.31.29.138 -> 54.230.158.217 TCP 66 42212 > http [ACK] Seq=97 Ack=341554 Win=643456 Len=0 TSval=14998820 TSecr=812239146
 80   0.024163 54.230.158.217 -> 172.31.29.138 TCP 23234 [TCP segment of a reassembled PDU]
 81   0.024176 172.31.29.138 -> 54.230.158.217 TCP 66 42212 > http [ACK] Seq=97 Ack=364722 Win=689792 Len=0 TSval=14998820 TSecr=812239146
 82   0.024497 54.230.158.217 -> 172.31.29.138 TCP 4410 [TCP segment of a reassembled PDU]
 83   0.024504 172.31.29.138 -> 54.230.158.217 TCP 66 42212 > http [ACK] Seq=97 Ack=369066 Win=698496 Len=0 TSval=14998820 TSecr=812239146
 84   0.024696 54.230.158.217 -> 172.31.29.138 TCP 23986 [TCP segment of a reassembled PDU]
 85   0.024709 172.31.29.138 -> 54.230.158.217 TCP 66 42212 > http [ACK] Seq=97 Ack=392986 Win=736256 Len=0 TSval=14998820 TSecr=812239146
 86   0.024726 54.230.158.217 -> 172.31.29.138 TCP 5858 [TCP segment of a reassembled PDU]
 87   0.024730 172.31.29.138 -> 54.230.158.217 TCP 66 42212 > http [ACK] Seq=97 Ack=398778 Win=730496 Len=0 TSval=14998820 TSecr=812239146
 88   0.024739 54.230.158.217 -> 172.31.29.138 TCP 1514 [TCP segment of a reassembled PDU]
 89   0.024741 172.31.29.138 -> 54.230.158.217 TCP 66 42212 > http [ACK] Seq=97 Ack=400226 Win=729088 Len=0 TSval=14998820 TSecr=812239146
 90   0.024775 54.230.158.217 -> 172.31.29.138 TCP 4410 [TCP segment of a reassembled PDU]
 91   0.024780 172.31.29.138 -> 54.230.158.217 TCP 66 42212 > http [ACK] Seq=97 Ack=404570 Win=724864 Len=0 TSval=14998820 TSecr=812239146
 92   0.024935 54.230.158.217 -> 172.31.29.138 TCP 20338 [TCP segment of a reassembled PDU]
 93   0.024948 172.31.29.138 -> 54.230.158.217 TCP 66 42212 > http [ACK] Seq=97 Ack=424842 Win=750592 Len=0 TSval=14998820 TSecr=812239146
 94   0.025256 54.230.158.217 -> 172.31.29.138 TCP 2962 [TCP segment of a reassembled PDU]
 95   0.025261 172.31.29.138 -> 54.230.158.217 TCP 66 42212 > http [ACK] Seq=97 Ack=427738 Win=779136 Len=0 TSval=14998821 TSecr=812239147
 96   0.025457 54.230.158.217 -> 172.31.29.138 TCP 27578 [TCP segment of a reassembled PDU]
 97   0.025471 172.31.29.138 -> 54.230.158.217 TCP 66 42212 > http [ACK] Seq=97 Ack=455250 Win=751744 Len=0 TSval=14998821 TSecr=812239147
 98   0.025478 54.230.158.217 -> 172.31.29.138 TCP 1514 [TCP segment of a reassembled PDU]
 99   0.025480 172.31.29.138 -> 54.230.158.217 TCP 66 42212 > http [ACK] Seq=97 Ack=456698 Win=750336 Len=0 TSval=14998821 TSecr=812239147
100   0.025550 54.230.158.217 -> 172.31.29.138 TCP 1890 [TCP segment of a reassembled PDU]
101   0.025555 172.31.29.138 -> 54.230.158.217 TCP 66 42212 > http [ACK] Seq=97 Ack=458522 Win=779136 Len=0 TSval=14998821 TSecr=812239147
102   0.027312 54.230.158.217 -> 172.31.29.138 TCP 2962 [TCP segment of a reassembled PDU]
103   0.027320 172.31.29.138 -> 54.230.158.217 TCP 66 42212 > http [ACK] Seq=97 Ack=461418 Win=779136 Len=0 TSval=14998821 TSecr=812239147
104   0.027443 54.230.158.217 -> 172.31.29.138 TCP 20338 [TCP segment of a reassembled PDU]
105   0.027454 172.31.29.138 -> 54.230.158.217 TCP 66 42212 > http [ACK] Seq=97 Ack=481690 Win=758912 Len=0 TSval=14998821 TSecr=812239147
106   0.027593 54.230.158.217 -> 172.31.29.138 TCP 7306 [TCP segment of a reassembled PDU]
107   0.027600 172.31.29.138 -> 54.230.158.217 TCP 66 42212 > http [ACK] Seq=97 Ack=488930 Win=771968 Len=0 TSval=14998821 TSecr=812239147
108   0.027750 54.230.158.217 -> 172.31.29.138 TCP 27578 [TCP segment of a reassembled PDU]
109   0.027781 54.230.158.217 -> 172.31.29.138 TCP 7682 [TCP segment of a reassembled PDU]
110   0.027790 172.31.29.138 -> 54.230.158.217 TCP 66 42212 > http [ACK] Seq=97 Ack=516442 Win=744576 Len=0 TSval=14998821 TSecr=812239147
111   0.027805 172.31.29.138 -> 54.230.158.217 TCP 66 42212 > http [ACK] Seq=97 Ack=524058 Win=769664 Len=0 TSval=14998821 TSecr=812239147
112   0.030579 54.230.158.217 -> 172.31.29.138 TCP 4410 [TCP segment of a reassembled PDU]
113   0.030586 172.31.29.138 -> 54.230.158.217 TCP 66 42212 > http [ACK] Seq=97 Ack=528402 Win=776704 Len=0 TSval=14998822 TSecr=812239147
114   0.030744 54.230.158.217 -> 172.31.29.138 TCP 26130 [TCP segment of a reassembled PDU]
115   0.030771 172.31.29.138 -> 54.230.158.217 TCP 66 42212 > http [ACK] Seq=97 Ack=554466 Win=750720 Len=0 TSval=14998822 TSecr=812239147
116   0.030799 54.230.158.217 -> 172.31.29.138 TCP 23234 [TCP segment of a reassembled PDU]
117   0.030824 172.31.29.138 -> 54.230.158.217 TCP 66 42212 > http [ACK] Seq=97 Ack=577634 Win=745856 Len=0 TSval=14998822 TSecr=812239147
118   0.030851 54.230.158.217 -> 172.31.29.138 TCP 12026 [TCP segment of a reassembled PDU]
119   0.030858 172.31.29.138 -> 54.230.158.217 TCP 66 42212 > http [ACK] Seq=97 Ack=589594 Win=762496 Len=0 TSval=14998822 TSecr=812239147
120   0.033611 54.230.158.217 -> 172.31.29.138 TCP 1514 [TCP segment of a reassembled PDU]
121   0.033685 54.230.158.217 -> 172.31.29.138 TCP 13098 [TCP segment of a reassembled PDU]
122   0.033694 172.31.29.138 -> 54.230.158.217 TCP 66 42212 > http [ACK] Seq=97 Ack=604074 Win=762496 Len=0 TSval=14998823 TSecr=812239147
123   0.033714 54.230.158.217 -> 172.31.29.138 TCP 1514 [TCP segment of a reassembled PDU]
124   0.033937 54.230.158.217 -> 172.31.29.138 TCP 1586 [TCP segment of a reassembled PDU]
125   0.033942 172.31.29.138 -> 54.230.158.217 TCP 66 42212 > http [ACK] Seq=97 Ack=607042 Win=779136 Len=0 TSval=14998823 TSecr=812239147
126   0.034054 54.230.158.217 -> 172.31.29.138 TCP 26130 [TCP segment of a reassembled PDU]
127   0.034071 54.230.158.217 -> 172.31.29.138 TCP 4410 [TCP segment of a reassembled PDU]
128   0.034101 172.31.29.138 -> 54.230.158.217 TCP 66 42212 > http [ACK] Seq=97 Ack=637450 Win=748800 Len=0 TSval=14998823 TSecr=812239147
129   0.034119 54.230.158.217 -> 172.31.29.138 TCP 17370 [TCP segment of a reassembled PDU]
130   0.034127 54.230.158.217 -> 172.31.29.138 TCP 442 [TCP segment of a reassembled PDU]
131   0.034143 172.31.29.138 -> 54.230.158.217 TCP 66 42212 > http [ACK] Seq=97 Ack=655130 Win=752768 Len=0 TSval=14998823 TSecr=812239147
132   0.036685 54.230.158.217 -> 172.31.29.138 TCP 2962 [TCP segment of a reassembled PDU]
133   0.036692 172.31.29.138 -> 54.230.158.217 TCP 66 42212 > http [ACK] Seq=97 Ack=658026 Win=779136 Len=0 TSval=14998823 TSecr=812239148
134   0.036853 54.230.158.217 -> 172.31.29.138 TCP 26130 [TCP segment of a reassembled PDU]
135   0.036873 54.230.158.217 -> 172.31.29.138 TCP 10202 [TCP segment of a reassembled PDU]
136   0.036895 54.230.158.217 -> 172.31.29.138 TCP 13098 [TCP segment of a reassembled PDU]
137   0.036909 172.31.29.138 -> 54.230.158.217 TCP 66 42212 > http [ACK] Seq=97 Ack=707258 Win=729984 Len=0 TSval=14998823 TSecr=812239148
138   0.036924 54.230.158.217 -> 172.31.29.138 TCP 10202 [TCP segment of a reassembled PDU]
139   0.036944 172.31.29.138 -> 54.230.158.217 TCP 66 42212 > http [ACK] Seq=97 Ack=717394 Win=729088 Len=0 TSval=14998823 TSecr=812239148
140   0.037012 54.230.158.217 -> 172.31.29.138 TCP 3338 [TCP segment of a reassembled PDU]
141   0.037018 172.31.29.138 -> 54.230.158.217 TCP 66 42212 > http [ACK] Seq=97 Ack=720666 Win=776704 Len=0 TSval=14998824 TSecr=812239148
142   0.037958 54.230.158.217 -> 172.31.29.138 TCP 2962 [TCP segment of a reassembled PDU]
143   0.037963 172.31.29.138 -> 54.230.158.217 TCP 66 42212 > http [ACK] Seq=97 Ack=723562 Win=779136 Len=0 TSval=14998824 TSecr=812239148
144   0.037979 54.230.158.217 -> 172.31.29.138 TCP 1514 [TCP segment of a reassembled PDU]
145   0.038147 54.230.158.217 -> 172.31.29.138 TCP 20338 [TCP segment of a reassembled PDU]
146   0.038177 54.230.158.217 -> 172.31.29.138 TCP 5858 [TCP segment of a reassembled PDU]
147   0.038250 54.230.158.217 -> 172.31.29.138 TCP 26130 [TCP segment of a reassembled PDU]
148   0.038266 54.230.158.217 -> 172.31.29.138 TCP 9130 [TCP segment of a reassembled PDU]
149   0.038384 172.31.29.138 -> 54.230.158.217 TCP 66 42212 > http [ACK] Seq=97 Ack=786202 Win=716544 Len=0 TSval=14998824 TSecr=812239148
150   0.038986 54.230.158.217 -> 172.31.29.138 TCP 2962 [TCP segment of a reassembled PDU]
151   0.038992 172.31.29.138 -> 54.230.158.217 TCP 66 42212 > http [ACK] Seq=97 Ack=789098 Win=779136 Len=0 TSval=14998824 TSecr=812239148
152   0.039146 54.230.158.217 -> 172.31.29.138 TCP 17442 [TCP segment of a reassembled PDU]
153   0.039170 172.31.29.138 -> 54.230.158.217 TCP 66 42212 > http [ACK] Seq=97 Ack=806474 Win=761856 Len=0 TSval=14998824 TSecr=812239148
154   0.039186 54.230.158.217 -> 172.31.29.138 TCP 8754 [TCP segment of a reassembled PDU]
155   0.039201 172.31.29.138 -> 54.230.158.217 TCP 66 42212 > http [ACK] Seq=97 Ack=815162 Win=784000 Len=0 TSval=14998824 TSecr=812239148
156   0.039277 54.230.158.217 -> 172.31.29.138 TCP 36642 [TCP segment of a reassembled PDU]
157   0.039311 172.31.29.138 -> 54.230.158.217 TCP 66 42212 > http [ACK] Seq=97 Ack=851738 Win=747520 Len=0 TSval=14998824 TSecr=812239148
158   0.039776 54.230.158.217 -> 172.31.29.138 TCP 5858 [TCP segment of a reassembled PDU]
159   0.039783 172.31.29.138 -> 54.230.158.217 TCP 66 42212 > http [ACK] Seq=97 Ack=857530 Win=774400 Len=0 TSval=14998824 TSecr=812239148
160   0.039925 54.230.158.217 -> 172.31.29.138 TCP 26130 [TCP segment of a reassembled PDU]
161   0.039985 54.230.158.217 -> 172.31.29.138 TCP 26130 [TCP segment of a reassembled PDU]
162   0.040000 54.230.158.217 -> 172.31.29.138 TCP 4410 [TCP segment of a reassembled PDU]
163   0.040024 54.230.158.217 -> 172.31.29.138 TCP 3338 [TCP segment of a reassembled PDU]
164   0.040056 172.31.29.138 -> 54.230.158.217 TCP 66 42212 > http [ACK] Seq=97 Ack=917274 Win=714752 Len=0 TSval=14998824 TSecr=812239148
165   0.041874 54.230.158.217 -> 172.31.29.138 TCP 2962 [TCP segment of a reassembled PDU]
166   0.041881 172.31.29.138 -> 54.230.158.217 TCP 66 42212 > http [ACK] Seq=97 Ack=920170 Win=779136 Len=0 TSval=14998825 TSecr=812239148
167   0.042027 54.230.158.217 -> 172.31.29.138 TCP 26130 [TCP segment of a reassembled PDU]
168   0.042055 172.31.29.138 -> 54.230.158.217 TCP 66 42212 > http [ACK] Seq=97 Ack=946234 Win=753152 Len=0 TSval=14998825 TSecr=812239148
169   0.042083 54.230.158.217 -> 172.31.29.138 TCP 23234 [TCP segment of a reassembled PDU]
170   0.042096 54.230.158.217 -> 172.31.29.138 TCP 1514 [TCP segment of a reassembled PDU]
171   0.042111 172.31.29.138 -> 54.230.158.217 TCP 66 42212 > http [ACK] Seq=97 Ack=970850 Win=743296 Len=0 TSval=14998825 TSecr=812239148
172   0.042134 54.230.158.217 -> 172.31.29.138 TCP 7306 [TCP segment of a reassembled PDU]
173   0.042147 172.31.29.138 -> 54.230.158.217 TCP 66 42212 > http [ACK] Seq=97 Ack=978090 Win=784000 Len=0 TSval=14998825 TSecr=812239148
174   0.042202 54.230.158.217 -> 172.31.29.138 TCP 1514 [TCP segment of a reassembled PDU]
175   0.042303 54.230.158.217 -> 172.31.29.138 TCP 1514 [TCP segment of a reassembled PDU]
176   0.042317 172.31.29.138 -> 54.230.158.217 TCP 66 42212 > http [ACK] Seq=97 Ack=980986 Win=784000 Len=0 TSval=14998825 TSecr=812239148
177   0.042403 54.230.158.217 -> 172.31.29.138 TCP 1890 [TCP segment of a reassembled PDU]
178   0.042506 172.31.29.138 -> 54.230.158.217 TCP 66 42212 > http [ACK] Seq=97 Ack=982810 Win=784000 Len=0 TSval=14998825 TSecr=812239148
179   0.044103 54.230.158.217 -> 172.31.29.138 TCP 1514 [TCP segment of a reassembled PDU]
180   0.044152 54.230.158.217 -> 172.31.29.138 TCP 10202 [TCP segment of a reassembled PDU]
181   0.044172 172.31.29.138 -> 54.230.158.217 TCP 66 42212 > http [ACK] Seq=97 Ack=994394 Win=784000 Len=0 TSval=14998825 TSecr=812239148
182   0.044290 54.230.158.217 -> 172.31.29.138 TCP 24682 [TCP segment of a reassembled PDU]
183   0.044320 54.230.158.217 -> 172.31.29.138 TCP 10202 [TCP segment of a reassembled PDU]
184   0.044335 172.31.29.138 -> 54.230.158.217 TCP 66 42212 > http [ACK] Seq=97 Ack=1029146 Win=749312 Len=0 TSval=14998825 TSecr=812239148
185   0.044388 54.230.158.217 -> 172.31.29.138 HTTP 19954 HTTP/1.1 200 OK  (application/octet-stream)
186   0.044400 172.31.29.138 -> 54.230.158.217 TCP 66 42212 > http [ACK] Seq=97 Ack=1049034 Win=750592 Len=0 TSval=14998825 TSecr=812239148
187   0.044557 172.31.29.138 -> 54.230.158.217 TCP 66 42212 > http [FIN, ACK] Seq=97 Ack=1049034 Win=784000 Len=0 TSval=14998825 TSecr=812239148
188   0.045105 54.230.158.217 -> 172.31.29.138 TCP 66 http > 42212 [FIN, ACK] Seq=1049034 Ack=98 Win=14592 Len=0 TSval=812239149 TSecr=14998825
189   0.045114 172.31.29.138 -> 54.230.158.217 TCP 66 42212 > http [ACK] Seq=98 Ack=1049035 Win=784000 Len=0 TSval=14998826 TSecr=812239149
