[Measurement for 10mb at 04:43:51 20.43.2014] 
Tshark:

  1   0.000000 172.31.8.238 -> 172.31.0.2   DNS 89 Standard query 0x28f9  A d3m1c4hwkgedal.cloudfront.net
  2   0.000037 172.31.8.238 -> 172.31.0.2   DNS 89 Standard query 0x1eee  AAAA d3m1c4hwkgedal.cloudfront.net
  3   0.000544   172.31.0.2 -> 172.31.8.238 DNS 217 Standard query response 0x28f9  A 54.192.118.222 A 54.192.118.224 A 54.230.116.73 A 54.230.116.82 A 54.230.116.128 A 54.230.119.125 A 54.239.132.103 A 54.239.132.233
  4   0.000613   172.31.0.2 -> 172.31.8.238 DNS 174 Standard query response 0x1eee 
  5   0.003838 172.31.8.238 -> 54.192.118.222 TCP 74 35167 > http [SYN] Seq=0 Win=26883 Len=0 MSS=8961 SACK_PERM=1 TSval=10564841 TSecr=0 WS=128
  6   0.004459 54.192.118.222 -> 172.31.8.238 TCP 74 http > 35167 [SYN, ACK] Seq=0 Ack=1 Win=14480 Len=0 MSS=1460 SACK_PERM=1 TSval=1685891525 TSecr=10564841 WS=128
  7   0.004474 172.31.8.238 -> 54.192.118.222 TCP 66 35167 > http [ACK] Seq=1 Ack=1 Win=27008 Len=0 TSval=10564841 TSecr=1685891525
  8   0.004510 172.31.8.238 -> 54.192.118.222 HTTP 163 GET /10mb HTTP/1.1 
  9   0.005413 54.192.118.222 -> 172.31.8.238 TCP 66 http > 35167 [ACK] Seq=1 Ack=98 Win=14592 Len=0 TSval=1685891525 TSecr=10564841
 10   0.007385 54.192.118.222 -> 172.31.8.238 TCP 2580 [TCP segment of a reassembled PDU]
 11   0.007393 172.31.8.238 -> 54.192.118.222 TCP 66 35167 > http [ACK] Seq=98 Ack=2515 Win=32000 Len=0 TSval=10564841 TSecr=1685891525
 12   0.007465 54.192.118.222 -> 172.31.8.238 TCP 11650 [TCP segment of a reassembled PDU]
 13   0.007475 172.31.8.238 -> 54.192.118.222 TCP 66 35167 > http [ACK] Seq=98 Ack=14099 Win=55168 Len=0 TSval=10564841 TSecr=1685891525
 14   0.008163 54.192.118.222 -> 172.31.8.238 TCP 8754 [TCP segment of a reassembled PDU]
 15   0.008171 172.31.8.238 -> 54.192.118.222 TCP 66 35167 > http [ACK] Seq=98 Ack=22787 Win=72576 Len=0 TSval=10564842 TSecr=1685891525
 16   0.008209 54.192.118.222 -> 172.31.8.238 TCP 4410 [TCP segment of a reassembled PDU]
 17   0.008215 172.31.8.238 -> 54.192.118.222 TCP 66 35167 > http [ACK] Seq=98 Ack=27131 Win=81152 Len=0 TSval=10564842 TSecr=1685891525
 18   0.008946 54.192.118.222 -> 172.31.8.238 TCP 8754 [TCP segment of a reassembled PDU]
 19   0.008963 172.31.8.238 -> 54.192.118.222 TCP 66 35167 > http [ACK] Seq=98 Ack=35819 Win=98560 Len=0 TSval=10564842 TSecr=1685891525
 20   0.009032 54.192.118.222 -> 172.31.8.238 TCP 11650 [TCP segment of a reassembled PDU]
 21   0.009040 172.31.8.238 -> 54.192.118.222 TCP 66 35167 > http [ACK] Seq=98 Ack=47403 Win=98944 Len=0 TSval=10564842 TSecr=1685891525
 22   0.009722 54.192.118.222 -> 172.31.8.238 TCP 18890 [TCP segment of a reassembled PDU]
 23   0.009734 172.31.8.238 -> 54.192.118.222 TCP 66 35167 > http [ACK] Seq=98 Ack=66227 Win=86912 Len=0 TSval=10564842 TSecr=1685891525
 24   0.010204 54.192.118.222 -> 172.31.8.238 TCP 10202 [TCP segment of a reassembled PDU]
 25   0.010212 172.31.8.238 -> 54.192.118.222 TCP 66 35167 > http [ACK] Seq=98 Ack=76363 Win=101248 Len=0 TSval=10564842 TSecr=1685891525
 26   0.010310 54.192.118.222 -> 172.31.8.238 TCP 14546 [TCP segment of a reassembled PDU]
 27   0.010319 172.31.8.238 -> 54.192.118.222 TCP 66 35167 > http [ACK] Seq=98 Ack=90843 Win=94080 Len=0 TSval=10564842 TSecr=1685891525
 28   0.010728 54.192.118.222 -> 172.31.8.238 TCP 8754 [TCP segment of a reassembled PDU]
 29   0.010735 172.31.8.238 -> 54.192.118.222 TCP 66 35167 > http [ACK] Seq=98 Ack=99531 Win=103680 Len=0 TSval=10564842 TSecr=1685891525
 30   0.010810 54.192.118.222 -> 172.31.8.238 TCP 2962 [TCP segment of a reassembled PDU]
 31   0.010815 172.31.8.238 -> 54.192.118.222 TCP 66 35167 > http [ACK] Seq=98 Ack=102427 Win=109056 Len=0 TSval=10564842 TSecr=1685891525
 32   0.010961 54.192.118.222 -> 172.31.8.238 TCP 11650 [TCP segment of a reassembled PDU]
 33   0.010982 172.31.8.238 -> 54.192.118.222 TCP 66 35167 > http [ACK] Seq=98 Ack=114011 Win=98944 Len=0 TSval=10564842 TSecr=1685891525
 34   0.011060 54.192.118.222 -> 172.31.8.238 TCP 4410 [TCP segment of a reassembled PDU]
 35   0.011066 172.31.8.238 -> 54.192.118.222 TCP 66 35167 > http [ACK] Seq=98 Ack=118355 Win=109056 Len=0 TSval=10564842 TSecr=1685891525
 36   0.011515 54.192.118.222 -> 172.31.8.238 TCP 15994 [TCP segment of a reassembled PDU]
 37   0.011524 172.31.8.238 -> 54.192.118.222 TCP 66 35167 > http [ACK] Seq=98 Ack=134283 Win=93184 Len=0 TSval=10564842 TSecr=1685891525
 38   0.011566 54.192.118.222 -> 172.31.8.238 TCP 11650 [TCP segment of a reassembled PDU]
 39   0.011760 172.31.8.238 -> 54.192.118.222 TCP 66 35167 > http [ACK] Seq=98 Ack=145867 Win=98944 Len=0 TSval=10564842 TSecr=1685891525
 40   0.012019 54.192.118.222 -> 172.31.8.238 TCP 15994 [TCP segment of a reassembled PDU]
 41   0.012030 172.31.8.238 -> 54.192.118.222 TCP 66 35167 > http [ACK] Seq=98 Ack=161795 Win=140928 Len=0 TSval=10564843 TSecr=1685891525
 42   0.012317 54.192.118.222 -> 172.31.8.238 TCP 20338 [TCP segment of a reassembled PDU]
 43   0.012329 172.31.8.238 -> 54.192.118.222 TCP 66 35167 > http [ACK] Seq=98 Ack=182067 Win=181504 Len=0 TSval=10564843 TSecr=1685891525
 44   0.012575 54.192.118.222 -> 172.31.8.238 TCP 7306 [TCP segment of a reassembled PDU]
 45   0.012582 172.31.8.238 -> 54.192.118.222 TCP 66 35167 > http [ACK] Seq=98 Ack=189307 Win=195968 Len=0 TSval=10564843 TSecr=1685891525
 46   0.013002 54.192.118.222 -> 172.31.8.238 TCP 2962 [TCP segment of a reassembled PDU]
 47   0.013007 172.31.8.238 -> 54.192.118.222 TCP 66 35167 > http [ACK] Seq=98 Ack=192203 Win=201728 Len=0 TSval=10564843 TSecr=1685891526
 48   0.013155 54.192.118.222 -> 172.31.8.238 TCP 24682 [TCP segment of a reassembled PDU]
 49   0.013181 172.31.8.238 -> 54.192.118.222 TCP 66 35167 > http [ACK] Seq=98 Ack=216819 Win=251008 Len=0 TSval=10564843 TSecr=1685891526
 50   0.013514 54.192.118.222 -> 172.31.8.238 TCP 2962 [TCP segment of a reassembled PDU]
 51   0.013520 172.31.8.238 -> 54.192.118.222 TCP 66 35167 > http [ACK] Seq=98 Ack=219715 Win=256768 Len=0 TSval=10564843 TSecr=1685891526
 52   0.013644 54.192.118.222 -> 172.31.8.238 TCP 14546 [TCP segment of a reassembled PDU]
 53   0.013653 172.31.8.238 -> 54.192.118.222 TCP 66 35167 > http [ACK] Seq=98 Ack=234195 Win=285696 Len=0 TSval=10564843 TSecr=1685891526
 54   0.014019 54.192.118.222 -> 172.31.8.238 TCP 5858 [TCP segment of a reassembled PDU]
 55   0.014025 172.31.8.238 -> 54.192.118.222 TCP 66 35167 > http [ACK] Seq=98 Ack=239987 Win=297344 Len=0 TSval=10564843 TSecr=1685891526
 56   0.014172 54.192.118.222 -> 172.31.8.238 TCP 20338 [TCP segment of a reassembled PDU]
 57   0.014183 172.31.8.238 -> 54.192.118.222 TCP 66 35167 > http [ACK] Seq=98 Ack=260259 Win=337792 Len=0 TSval=10564843 TSecr=1685891526
 58   0.014367 54.192.118.222 -> 172.31.8.238 TCP 5858 [TCP segment of a reassembled PDU]
 59   0.014374 172.31.8.238 -> 54.192.118.222 TCP 66 35167 > http [ACK] Seq=98 Ack=266051 Win=349440 Len=0 TSval=10564843 TSecr=1685891526
 60   0.014664 54.192.118.222 -> 172.31.8.238 TCP 21786 [TCP segment of a reassembled PDU]
 61   0.014676 172.31.8.238 -> 54.192.118.222 TCP 66 35167 > http [ACK] Seq=98 Ack=287771 Win=392832 Len=0 TSval=10564843 TSecr=1685891526
 62   0.014806 54.192.118.222 -> 172.31.8.238 TCP 7306 [TCP segment of a reassembled PDU]
 63   0.014814 172.31.8.238 -> 54.192.118.222 TCP 66 35167 > http [ACK] Seq=98 Ack=295011 Win=407296 Len=0 TSval=10564843 TSecr=1685891526
 64   0.014954 54.192.118.222 -> 172.31.8.238 TCP 14546 [TCP segment of a reassembled PDU]
 65   0.014963 172.31.8.238 -> 54.192.118.222 TCP 66 35167 > http [ACK] Seq=98 Ack=309491 Win=436352 Len=0 TSval=10564843 TSecr=1685891526
 66   0.015169 54.192.118.222 -> 172.31.8.238 TCP 5858 [TCP segment of a reassembled PDU]
 67   0.015176 172.31.8.238 -> 54.192.118.222 TCP 66 35167 > http [ACK] Seq=98 Ack=315283 Win=447872 Len=0 TSval=10564843 TSecr=1685891526
 68   0.015313 54.192.118.222 -> 172.31.8.238 TCP 4410 [TCP segment of a reassembled PDU]
 69   0.015319 172.31.8.238 -> 54.192.118.222 TCP 66 35167 > http [ACK] Seq=98 Ack=319627 Win=456576 Len=0 TSval=10564843 TSecr=1685891526
 70   0.015503 54.192.118.222 -> 172.31.8.238 TCP 20338 [TCP segment of a reassembled PDU]
 71   0.015514 172.31.8.238 -> 54.192.118.222 TCP 66 35167 > http [ACK] Seq=98 Ack=339899 Win=497152 Len=0 TSval=10564843 TSecr=1685891526
 72   0.015598 54.192.118.222 -> 172.31.8.238 TCP 4410 [TCP segment of a reassembled PDU]
 73   0.015604 172.31.8.238 -> 54.192.118.222 TCP 66 35167 > http [ACK] Seq=98 Ack=344243 Win=505856 Len=0 TSval=10564843 TSecr=1685891526
 74   0.015719 54.192.118.222 -> 172.31.8.238 TCP 20338 [TCP segment of a reassembled PDU]
 75   0.015730 172.31.8.238 -> 54.192.118.222 TCP 66 35167 > http [ACK] Seq=98 Ack=364515 Win=546304 Len=0 TSval=10564843 TSecr=1685891526
 76   0.015933 54.192.118.222 -> 172.31.8.238 TCP 4410 [TCP segment of a reassembled PDU]
 77   0.015940 172.31.8.238 -> 54.192.118.222 TCP 66 35167 > http [ACK] Seq=98 Ack=368859 Win=555008 Len=0 TSval=10564844 TSecr=1685891526
 78   0.016079 54.192.118.222 -> 172.31.8.238 TCP 7306 [TCP segment of a reassembled PDU]
 79   0.016085 172.31.8.238 -> 54.192.118.222 TCP 66 35167 > http [ACK] Seq=98 Ack=376099 Win=569472 Len=0 TSval=10564844 TSecr=1685891526
 80   0.016267 54.192.118.222 -> 172.31.8.238 TCP 23234 [TCP segment of a reassembled PDU]
 81   0.016293 172.31.8.238 -> 54.192.118.222 TCP 66 35167 > http [ACK] Seq=98 Ack=399267 Win=615808 Len=0 TSval=10564844 TSecr=1685891526
 82   0.016486 54.192.118.222 -> 172.31.8.238 TCP 23234 [TCP segment of a reassembled PDU]
 83   0.016499 172.31.8.238 -> 54.192.118.222 TCP 66 35167 > http [ACK] Seq=98 Ack=422435 Win=662144 Len=0 TSval=10564844 TSecr=1685891526
 84   0.016878 54.192.118.222 -> 172.31.8.238 TCP 5858 [TCP segment of a reassembled PDU]
 85   0.016898 172.31.8.238 -> 54.192.118.222 TCP 66 35167 > http [ACK] Seq=98 Ack=428227 Win=673792 Len=0 TSval=10564844 TSecr=1685891526
 86   0.017069 54.192.118.222 -> 172.31.8.238 TCP 26130 [TCP segment of a reassembled PDU]
 87   0.017083 172.31.8.238 -> 54.192.118.222 TCP 66 35167 > http [ACK] Seq=98 Ack=454291 Win=725888 Len=0 TSval=10564844 TSecr=1685891526
 88   0.017110 54.192.118.222 -> 172.31.8.238 TCP 11650 [TCP segment of a reassembled PDU]
 89   0.017118 172.31.8.238 -> 54.192.118.222 TCP 66 35167 > http [ACK] Seq=98 Ack=465875 Win=749056 Len=0 TSval=10564844 TSecr=1685891526
 90   0.017435 54.192.118.222 -> 172.31.8.238 TCP 10202 [TCP segment of a reassembled PDU]
 91   0.017444 172.31.8.238 -> 54.192.118.222 TCP 66 35167 > http [ACK] Seq=98 Ack=476011 Win=769408 Len=0 TSval=10564844 TSecr=1685891526
 92   0.017763 54.192.118.222 -> 172.31.8.238 TCP 26130 [TCP segment of a reassembled PDU]
 93   0.017777 172.31.8.238 -> 54.192.118.222 TCP 66 35167 > http [ACK] Seq=98 Ack=502075 Win=821504 Len=0 TSval=10564844 TSecr=1685891526
 94   0.017830 54.192.118.222 -> 172.31.8.238 TCP 23234 [TCP segment of a reassembled PDU]
 95   0.017842 172.31.8.238 -> 54.192.118.222 TCP 66 35167 > http [ACK] Seq=98 Ack=525243 Win=867840 Len=0 TSval=10564844 TSecr=1685891526
 96   0.018215 54.192.118.222 -> 172.31.8.238 TCP 4410 [TCP segment of a reassembled PDU]
 97   0.018221 172.31.8.238 -> 54.192.118.222 TCP 66 35167 > http [ACK] Seq=98 Ack=529587 Win=876544 Len=0 TSval=10564844 TSecr=1685891526
 98   0.018356 54.192.118.222 -> 172.31.8.238 TCP 11650 [TCP segment of a reassembled PDU]
 99   0.018364 172.31.8.238 -> 54.192.118.222 TCP 66 35167 > http [ACK] Seq=98 Ack=541171 Win=899712 Len=0 TSval=10564844 TSecr=1685891526
100   0.018520 54.192.118.222 -> 172.31.8.238 TCP 23234 [TCP segment of a reassembled PDU]
101   0.018533 172.31.8.238 -> 54.192.118.222 TCP 66 35167 > http [ACK] Seq=98 Ack=564339 Win=946048 Len=0 TSval=10564844 TSecr=1685891526
102   0.018539 54.192.118.222 -> 172.31.8.238 TCP 2962 [TCP segment of a reassembled PDU]
103   0.018542 172.31.8.238 -> 54.192.118.222 TCP 66 35167 > http [ACK] Seq=98 Ack=567235 Win=951808 Len=0 TSval=10564844 TSecr=1685891526
104   0.018631 54.192.118.222 -> 172.31.8.238 TCP 10202 [TCP segment of a reassembled PDU]
105   0.018639 172.31.8.238 -> 54.192.118.222 TCP 66 35167 > http [ACK] Seq=98 Ack=577371 Win=972032 Len=0 TSval=10564844 TSecr=1685891526
106   0.019027 54.192.118.222 -> 172.31.8.238 TCP 26130 [TCP segment of a reassembled PDU]
107   0.019041 172.31.8.238 -> 54.192.118.222 TCP 66 35167 > http [ACK] Seq=98 Ack=603435 Win=1024256 Len=0 TSval=10564844 TSecr=1685891526
108   0.019125 54.192.118.222 -> 172.31.8.238 TCP 23234 [TCP segment of a reassembled PDU]
109   0.019139 172.31.8.238 -> 54.192.118.222 TCP 66 35167 > http [ACK] Seq=98 Ack=626603 Win=1070592 Len=0 TSval=10564844 TSecr=1685891526
110   0.019170 54.192.118.222 -> 172.31.8.238 TCP 2962 [TCP segment of a reassembled PDU]
111   0.019182 172.31.8.238 -> 54.192.118.222 TCP 66 35167 > http [ACK] Seq=98 Ack=629499 Win=1076352 Len=0 TSval=10564844 TSecr=1685891526
112   0.019244 54.192.118.222 -> 172.31.8.238 TCP 15994 [TCP segment of a reassembled PDU]
113   0.019254 172.31.8.238 -> 54.192.118.222 TCP 66 35167 > http [ACK] Seq=98 Ack=645427 Win=1108224 Len=0 TSval=10564844 TSecr=1685891526
114   0.019666 54.192.118.222 -> 172.31.8.238 TCP 4410 [TCP segment of a reassembled PDU]
115   0.019673 172.31.8.238 -> 54.192.118.222 TCP 66 35167 > http [ACK] Seq=98 Ack=649771 Win=1116928 Len=0 TSval=10564844 TSecr=1685891526
116   0.019854 54.192.118.222 -> 172.31.8.238 TCP 26130 [TCP segment of a reassembled PDU]
117   0.019882 172.31.8.238 -> 54.192.118.222 TCP 66 35167 > http [ACK] Seq=98 Ack=675835 Win=1101568 Len=0 TSval=10564845 TSecr=1685891526
118   0.019933 54.192.118.222 -> 172.31.8.238 TCP 26130 [TCP segment of a reassembled PDU]
119   0.019948 172.31.8.238 -> 54.192.118.222 TCP 66 35167 > http [ACK] Seq=98 Ack=701899 Win=1101568 Len=0 TSval=10564845 TSecr=1685891526
120   0.019997 54.192.118.222 -> 172.31.8.238 TCP 11650 [TCP segment of a reassembled PDU]
121   0.020006 172.31.8.238 -> 54.192.118.222 TCP 66 35167 > http [ACK] Seq=98 Ack=713483 Win=1125376 Len=0 TSval=10564845 TSecr=1685891526
122   0.020316 54.192.118.222 -> 172.31.8.238 TCP 23234 [TCP segment of a reassembled PDU]
123   0.020344 172.31.8.238 -> 54.192.118.222 TCP 66 35167 > http [ACK] Seq=98 Ack=736651 Win=1106304 Len=0 TSval=10564845 TSecr=1685891526
124   0.020432 54.192.118.222 -> 172.31.8.238 TCP 1514 [TCP segment of a reassembled PDU]
125   0.020437 172.31.8.238 -> 54.192.118.222 TCP 66 35167 > http [ACK] Seq=98 Ack=738099 Win=1141888 Len=0 TSval=10564845 TSecr=1685891526
126   0.020639 54.192.118.222 -> 172.31.8.238 TCP 26130 [TCP segment of a reassembled PDU]
127   0.020666 172.31.8.238 -> 54.192.118.222 TCP 66 35167 > http [ACK] Seq=98 Ack=764163 Win=1115904 Len=0 TSval=10564845 TSecr=1685891526
128   0.020715 54.192.118.222 -> 172.31.8.238 TCP 26130 [TCP segment of a reassembled PDU]
129   0.020744 172.31.8.238 -> 54.192.118.222 TCP 66 35167 > http [ACK] Seq=98 Ack=790227 Win=1101568 Len=0 TSval=10564845 TSecr=1685891526
130   0.020776 54.192.118.222 -> 172.31.8.238 TCP 11650 [TCP segment of a reassembled PDU]
131   0.020785 172.31.8.238 -> 54.192.118.222 TCP 66 35167 > http [ACK] Seq=98 Ack=801811 Win=1125376 Len=0 TSval=10564845 TSecr=1685891526
132   0.021183 54.192.118.222 -> 172.31.8.238 TCP 5858 [TCP segment of a reassembled PDU]
133   0.021189 172.31.8.238 -> 54.192.118.222 TCP 66 35167 > http [ACK] Seq=98 Ack=807603 Win=1134848 Len=0 TSval=10564845 TSecr=1685891526
134   0.021357 54.192.118.222 -> 172.31.8.238 TCP 26130 [TCP segment of a reassembled PDU]
135   0.021385 172.31.8.238 -> 54.192.118.222 TCP 66 35167 > http [ACK] Seq=98 Ack=833667 Win=1108864 Len=0 TSval=10564845 TSecr=1685891526
136   0.021426 54.192.118.222 -> 172.31.8.238 TCP 18890 [TCP segment of a reassembled PDU]
137   0.021439 172.31.8.238 -> 54.192.118.222 TCP 66 35167 > http [ACK] Seq=98 Ack=852491 Win=1113344 Len=0 TSval=10564845 TSecr=1685891526
138   0.021491 54.192.118.222 -> 172.31.8.238 TCP 7306 [TCP segment of a reassembled PDU]
139   0.021497 172.31.8.238 -> 54.192.118.222 TCP 66 35167 > http [ACK] Seq=98 Ack=859731 Win=1132416 Len=0 TSval=10564845 TSecr=1685891526
140   0.021585 54.192.118.222 -> 172.31.8.238 TCP 26130 [TCP segment of a reassembled PDU]
141   0.021644 54.192.118.222 -> 172.31.8.238 TCP 18890 [TCP segment of a reassembled PDU]
142   0.021709 172.31.8.238 -> 54.192.118.222 TCP 66 35167 > http [ACK] Seq=98 Ack=904619 Win=1087616 Len=0 TSval=10564845 TSecr=1685891526
143   0.021995 54.192.118.222 -> 172.31.8.238 TCP 14546 [TCP segment of a reassembled PDU]
144   0.022005 172.31.8.238 -> 54.192.118.222 TCP 66 35167 > http [ACK] Seq=98 Ack=919099 Win=1120512 Len=0 TSval=10564845 TSecr=1685891526
145   0.022125 54.192.118.222 -> 172.31.8.238 TCP 13098 [TCP segment of a reassembled PDU]
146   0.022134 172.31.8.238 -> 54.192.118.222 TCP 66 35167 > http [ACK] Seq=98 Ack=932131 Win=1122944 Len=0 TSval=10564845 TSecr=1685891526
147   0.022241 54.192.118.222 -> 172.31.8.238 TCP 8754 [TCP segment of a reassembled PDU]
148   0.022249 172.31.8.238 -> 54.192.118.222 TCP 66 35167 > http [ACK] Seq=98 Ack=940819 Win=1130112 Len=0 TSval=10564845 TSecr=1685891526
149   0.022397 54.192.118.222 -> 172.31.8.238 TCP 26130 [TCP segment of a reassembled PDU]
150   0.022422 172.31.8.238 -> 54.192.118.222 TCP 66 35167 > http [ACK] Seq=98 Ack=966883 Win=1104128 Len=0 TSval=10564845 TSecr=1685891526
151   0.022541 54.192.118.222 -> 172.31.8.238 TCP 30474 [TCP segment of a reassembled PDU]
152   0.022621 172.31.8.238 -> 54.192.118.222 TCP 66 35167 > http [ACK] Seq=98 Ack=997291 Win=1094272 Len=0 TSval=10564845 TSecr=1685891526
153   0.022783 54.192.118.222 -> 172.31.8.238 TCP 1514 [TCP segment of a reassembled PDU]
154   0.022942 54.192.118.222 -> 172.31.8.238 TCP 24682 [TCP segment of a reassembled PDU]
155   0.022955 172.31.8.238 -> 54.192.118.222 TCP 66 35167 > http [ACK] Seq=98 Ack=1023355 Win=1103872 Len=0 TSval=10564845 TSecr=1685891527
156   0.023056 54.192.118.222 -> 172.31.8.238 TCP 14546 [TCP segment of a reassembled PDU]
157   0.023065 172.31.8.238 -> 54.192.118.222 TCP 66 35167 > http [ACK] Seq=98 Ack=1037835 Win=1120512 Len=0 TSval=10564845 TSecr=1685891527
158   0.023171 54.192.118.222 -> 172.31.8.238 TCP 24682 [TCP segment of a reassembled PDU]
159   0.023197 172.31.8.238 -> 54.192.118.222 TCP 66 35167 > http [ACK] Seq=98 Ack=1062451 Win=1103872 Len=0 TSval=10564845 TSecr=1685891527
160   0.023391 54.192.118.222 -> 172.31.8.238 TCP 23234 [TCP segment of a reassembled PDU]
161   0.023404 172.31.8.238 -> 54.192.118.222 TCP 66 35167 > http [ACK] Seq=98 Ack=1085619 Win=1106304 Len=0 TSval=10564845 TSecr=1685891527
162   0.023409 54.192.118.222 -> 172.31.8.238 TCP 1514 [TCP segment of a reassembled PDU]
163   0.023412 54.192.118.222 -> 172.31.8.238 TCP 1514 [TCP segment of a reassembled PDU]
164   0.023431 172.31.8.238 -> 54.192.118.222 TCP 66 35167 > http [ACK] Seq=98 Ack=1088515 Win=1103488 Len=0 TSval=10564845 TSecr=1685891527
165   0.023522 54.192.118.222 -> 172.31.8.238 TCP 26130 [TCP segment of a reassembled PDU]
166   0.023571 54.192.118.222 -> 172.31.8.238 TCP 8754 [TCP segment of a reassembled PDU]
167   0.023613 54.192.118.222 -> 172.31.8.238 TCP 4410 [TCP segment of a reassembled PDU]
168   0.023649 172.31.8.238 -> 54.192.118.222 TCP 66 35167 > http [ACK] Seq=98 Ack=1127611 Win=1080064 Len=0 TSval=10564845 TSecr=1685891527
169   0.023880 54.192.118.222 -> 172.31.8.238 TCP 20338 [TCP segment of a reassembled PDU]
170   0.023905 172.31.8.238 -> 54.192.118.222 TCP 66 35167 > http [ACK] Seq=98 Ack=1147883 Win=1111040 Len=0 TSval=10564846 TSecr=1685891527
171   0.024024 54.192.118.222 -> 172.31.8.238 TCP 33370 [TCP segment of a reassembled PDU]
172   0.024040 172.31.8.238 -> 54.192.118.222 TCP 66 35167 > http [ACK] Seq=98 Ack=1181187 Win=1209600 Len=0 TSval=10564846 TSecr=1685891527
173   0.024048 54.192.118.222 -> 172.31.8.238 TCP 2962 [TCP segment of a reassembled PDU]
174   0.024051 172.31.8.238 -> 54.192.118.222 TCP 66 35167 > http [ACK] Seq=98 Ack=1184083 Win=1215360 Len=0 TSval=10564846 TSecr=1685891527
175   0.024072 54.192.118.222 -> 172.31.8.238 TCP 8754 [TCP segment of a reassembled PDU]
176   0.024078 172.31.8.238 -> 54.192.118.222 TCP 66 35167 > http [ACK] Seq=98 Ack=1192771 Win=1232768 Len=0 TSval=10564846 TSecr=1685891527
177   0.024511 54.192.118.222 -> 172.31.8.238 TCP 2962 [TCP segment of a reassembled PDU]
178   0.024517 172.31.8.238 -> 54.192.118.222 TCP 66 35167 > http [ACK] Seq=98 Ack=1195667 Win=1238528 Len=0 TSval=10564846 TSecr=1685891527
179   0.024681 54.192.118.222 -> 172.31.8.238 TCP 26130 [TCP segment of a reassembled PDU]
180   0.024694 172.31.8.238 -> 54.192.118.222 TCP 66 35167 > http [ACK] Seq=98 Ack=1221731 Win=1290624 Len=0 TSval=10564846 TSecr=1685891527
181   0.024750 54.192.118.222 -> 172.31.8.238 TCP 26130 [TCP segment of a reassembled PDU]
182   0.024764 172.31.8.238 -> 54.192.118.222 TCP 66 35167 > http [ACK] Seq=98 Ack=1247795 Win=1342720 Len=0 TSval=10564846 TSecr=1685891527
183   0.024817 54.192.118.222 -> 172.31.8.238 TCP 5858 [TCP segment of a reassembled PDU]
184   0.024823 172.31.8.238 -> 54.192.118.222 TCP 66 35167 > http [ACK] Seq=98 Ack=1253587 Win=1354368 Len=0 TSval=10564846 TSecr=1685891527
185   0.024908 54.192.118.222 -> 172.31.8.238 TCP 26130 [TCP segment of a reassembled PDU]
186   0.024921 172.31.8.238 -> 54.192.118.222 TCP 66 35167 > http [ACK] Seq=98 Ack=1279651 Win=1406464 Len=0 TSval=10564846 TSecr=1685891527
187   0.024996 54.192.118.222 -> 172.31.8.238 TCP 26130 [TCP segment of a reassembled PDU]
188   0.025010 172.31.8.238 -> 54.192.118.222 TCP 66 35167 > http [ACK] Seq=98 Ack=1305715 Win=1458560 Len=0 TSval=10564846 TSecr=1685891527
189   0.025060 54.192.118.222 -> 172.31.8.238 TCP 17442 [TCP segment of a reassembled PDU]
190   0.025070 172.31.8.238 -> 54.192.118.222 TCP 66 35167 > http [ACK] Seq=98 Ack=1323091 Win=1493376 Len=0 TSval=10564846 TSecr=1685891527
191   0.025461 54.192.118.222 -> 172.31.8.238 TCP 26130 [TCP segment of a reassembled PDU]
192   0.025475 172.31.8.238 -> 54.192.118.222 TCP 66 35167 > http [ACK] Seq=98 Ack=1349155 Win=1545472 Len=0 TSval=10564846 TSecr=1685891527
193   0.025538 54.192.118.222 -> 172.31.8.238 TCP 18890 [TCP segment of a reassembled PDU]
194   0.025549 172.31.8.238 -> 54.192.118.222 TCP 66 35167 > http [ACK] Seq=98 Ack=1367979 Win=1583104 Len=0 TSval=10564846 TSecr=1685891527
195   0.025613 54.192.118.222 -> 172.31.8.238 TCP 18890 [TCP segment of a reassembled PDU]
196   0.025624 172.31.8.238 -> 54.192.118.222 TCP 66 35167 > http [ACK] Seq=98 Ack=1386803 Win=1583104 Len=0 TSval=10564846 TSecr=1685891527
197   0.025664 54.192.118.222 -> 172.31.8.238 TCP 1514 [TCP segment of a reassembled PDU]
198   0.025755 54.192.118.222 -> 172.31.8.238 TCP 26130 [TCP segment of a reassembled PDU]
199   0.025768 172.31.8.238 -> 54.192.118.222 TCP 66 35167 > http [ACK] Seq=98 Ack=1414315 Win=1583104 Len=0 TSval=10564846 TSecr=1685891527
200   0.025780 54.192.118.222 -> 172.31.8.238 TCP 15994 [TCP segment of a reassembled PDU]
201   0.025787 172.31.8.238 -> 54.192.118.222 TCP 66 35167 > http [ACK] Seq=98 Ack=1430243 Win=1583104 Len=0 TSval=10564846 TSecr=1685891527
202   0.025789 54.192.118.222 -> 172.31.8.238 TCP 1514 [TCP segment of a reassembled PDU]
203   0.025794 54.192.118.222 -> 172.31.8.238 TCP 8754 [TCP segment of a reassembled PDU]
204   0.025798 172.31.8.238 -> 54.192.118.222 TCP 66 35167 > http [ACK] Seq=98 Ack=1440379 Win=1583104 Len=0 TSval=10564846 TSecr=1685891527
205   0.025909 54.192.118.222 -> 172.31.8.238 TCP 13098 [TCP segment of a reassembled PDU]
206   0.025929 172.31.8.238 -> 54.192.118.222 TCP 66 35167 > http [ACK] Seq=98 Ack=1453411 Win=1583104 Len=0 TSval=10564846 TSecr=1685891527
207   0.026174 54.192.118.222 -> 172.31.8.238 TCP 23234 [TCP segment of a reassembled PDU]
208   0.026187 172.31.8.238 -> 54.192.118.222 TCP 66 35167 > http [ACK] Seq=98 Ack=1476579 Win=1583104 Len=0 TSval=10564846 TSecr=1685891527
209   0.026300 54.192.118.222 -> 172.31.8.238 TCP 29026 [TCP segment of a reassembled PDU]
210   0.026314 172.31.8.238 -> 54.192.118.222 TCP 66 35167 > http [ACK] Seq=98 Ack=1505539 Win=1583104 Len=0 TSval=10564846 TSecr=1685891527
211   0.026325 54.192.118.222 -> 172.31.8.238 TCP 13098 [TCP segment of a reassembled PDU]
212   0.026332 172.31.8.238 -> 54.192.118.222 TCP 66 35167 > http [ACK] Seq=98 Ack=1518571 Win=1583104 Len=0 TSval=10564846 TSecr=1685891527
213   0.026469 54.192.118.222 -> 172.31.8.238 TCP 20338 [TCP segment of a reassembled PDU]
214   0.026481 172.31.8.238 -> 54.192.118.222 TCP 66 35167 > http [ACK] Seq=98 Ack=1538843 Win=1583104 Len=0 TSval=10564846 TSecr=1685891527
215   0.026495 54.192.118.222 -> 172.31.8.238 TCP 1514 [TCP segment of a reassembled PDU]
216   0.026607 54.192.118.222 -> 172.31.8.238 TCP 43506 [TCP segment of a reassembled PDU]
217   0.026625 172.31.8.238 -> 54.192.118.222 TCP 66 35167 > http [ACK] Seq=98 Ack=1583731 Win=1583104 Len=0 TSval=10564846 TSecr=1685891527
218   0.026901 54.192.118.222 -> 172.31.8.238 TCP 17442 [TCP segment of a reassembled PDU]
219   0.026911 172.31.8.238 -> 54.192.118.222 TCP 66 35167 > http [ACK] Seq=98 Ack=1601107 Win=1583104 Len=0 TSval=10564846 TSecr=1685891527
220   0.026931 54.192.118.222 -> 172.31.8.238 TCP 8754 [TCP segment of a reassembled PDU]
221   0.026936 172.31.8.238 -> 54.192.118.222 TCP 66 35167 > http [ACK] Seq=98 Ack=1609795 Win=1583104 Len=0 TSval=10564846 TSecr=1685891527
222   0.027085 54.192.118.222 -> 172.31.8.238 TCP 26130 [TCP segment of a reassembled PDU]
223   0.027098 172.31.8.238 -> 54.192.118.222 TCP 66 35167 > http [ACK] Seq=98 Ack=1635859 Win=1583104 Len=0 TSval=10564846 TSecr=1685891527
224   0.027110 54.192.118.222 -> 172.31.8.238 TCP 13098 [TCP segment of a reassembled PDU]
225   0.027116 172.31.8.238 -> 54.192.118.222 TCP 66 35167 > http [ACK] Seq=98 Ack=1648891 Win=1583104 Len=0 TSval=10564846 TSecr=1685891527
226   0.027302 54.192.118.222 -> 172.31.8.238 TCP 49298 [TCP segment of a reassembled PDU]
227   0.027323 172.31.8.238 -> 54.192.118.222 TCP 66 35167 > http [ACK] Seq=98 Ack=1698123 Win=1583104 Len=0 TSval=10564846 TSecr=1685891527
228   0.027329 54.192.118.222 -> 172.31.8.238 TCP 1514 [TCP Previous segment not captured] [TCP segment of a reassembled PDU]
229   0.027332 172.31.8.238 -> 54.192.118.222 TCP 78 [TCP Dup ACK 227#1] 35167 > http [ACK] Seq=98 Ack=1698123 Win=1583104 Len=0 TSval=10564846 TSecr=1685891527 SLE=1699571 SRE=1701019
230   0.027333 54.192.118.222 -> 172.31.8.238 TCP 1514 [TCP Out-Of-Order] [TCP segment of a reassembled PDU]
231   0.027336 172.31.8.238 -> 54.192.118.222 TCP 66 35167 > http [ACK] Seq=98 Ack=1701019 Win=1583104 Len=0 TSval=10564846 TSecr=1685891527
232   0.027481 54.192.118.222 -> 172.31.8.238 TCP 13098 [TCP segment of a reassembled PDU]
233   0.027489 172.31.8.238 -> 54.192.118.222 TCP 66 35167 > http [ACK] Seq=98 Ack=1714051 Win=1583104 Len=0 TSval=10564846 TSecr=1685891527
234   0.027864 54.192.118.222 -> 172.31.8.238 TCP 7306 [TCP segment of a reassembled PDU]
235   0.027871 172.31.8.238 -> 54.192.118.222 TCP 66 35167 > http [ACK] Seq=98 Ack=1721291 Win=1583104 Len=0 TSval=10564847 TSecr=1685891527
236   0.028040 54.192.118.222 -> 172.31.8.238 TCP 26130 [TCP segment of a reassembled PDU]
237   0.028053 172.31.8.238 -> 54.192.118.222 TCP 66 35167 > http [ACK] Seq=98 Ack=1747355 Win=1583104 Len=0 TSval=10564847 TSecr=1685891527
238   0.028125 54.192.118.222 -> 172.31.8.238 TCP 26130 [TCP segment of a reassembled PDU]
239   0.028138 172.31.8.238 -> 54.192.118.222 TCP 66 35167 > http [ACK] Seq=98 Ack=1773419 Win=1583104 Len=0 TSval=10564847 TSecr=1685891527
240   0.028208 54.192.118.222 -> 172.31.8.238 TCP 26130 [TCP segment of a reassembled PDU]
241   0.028222 172.31.8.238 -> 54.192.118.222 TCP 66 35167 > http [ACK] Seq=98 Ack=1799483 Win=1583104 Len=0 TSval=10564847 TSecr=1685891527
242   0.028295 54.192.118.222 -> 172.31.8.238 TCP 26130 [TCP segment of a reassembled PDU]
243   0.028319 172.31.8.238 -> 54.192.118.222 TCP 66 35167 > http [ACK] Seq=98 Ack=1825547 Win=1583104 Len=0 TSval=10564847 TSecr=1685891527
244   0.028377 54.192.118.222 -> 172.31.8.238 TCP 18890 [TCP segment of a reassembled PDU]
245   0.028387 172.31.8.238 -> 54.192.118.222 TCP 66 35167 > http [ACK] Seq=98 Ack=1844371 Win=1583104 Len=0 TSval=10564847 TSecr=1685891527
246   0.028423 54.192.118.222 -> 172.31.8.238 TCP 4410 [TCP segment of a reassembled PDU]
247   0.028427 172.31.8.238 -> 54.192.118.222 TCP 66 35167 > http [ACK] Seq=98 Ack=1848715 Win=1583104 Len=0 TSval=10564847 TSecr=1685891527
248   0.028684 54.192.118.222 -> 172.31.8.238 TCP 11650 [TCP segment of a reassembled PDU]
249   0.028693 172.31.8.238 -> 54.192.118.222 TCP 66 35167 > http [ACK] Seq=98 Ack=1860299 Win=1583104 Len=0 TSval=10564847 TSecr=1685891527
250   0.028814 54.192.118.222 -> 172.31.8.238 TCP 1514 [TCP Previous segment not captured] [TCP segment of a reassembled PDU]
251   0.028819 172.31.8.238 -> 54.192.118.222 TCP 78 [TCP Dup ACK 249#1] 35167 > http [ACK] Seq=98 Ack=1860299 Win=1583104 Len=0 TSval=10564847 TSecr=1685891527 SLE=1861747 SRE=1863195
252   0.028999 54.192.118.222 -> 172.31.8.238 TCP 1514 [TCP Out-Of-Order] [TCP segment of a reassembled PDU]
253   0.029004 172.31.8.238 -> 54.192.118.222 TCP 66 35167 > http [ACK] Seq=98 Ack=1863195 Win=1583104 Len=0 TSval=10564847 TSecr=1685891527
254   0.029021 54.192.118.222 -> 172.31.8.238 TCP 26130 [TCP segment of a reassembled PDU]
255   0.029032 172.31.8.238 -> 54.192.118.222 TCP 66 35167 > http [ACK] Seq=98 Ack=1889259 Win=1583104 Len=0 TSval=10564847 TSecr=1685891527
256   0.029061 54.192.118.222 -> 172.31.8.238 TCP 21786 [TCP segment of a reassembled PDU]
257   0.029068 172.31.8.238 -> 54.192.118.222 TCP 66 35167 > http [ACK] Seq=98 Ack=1910979 Win=1583104 Len=0 TSval=10564847 TSecr=1685891527
258   0.029213 54.192.118.222 -> 172.31.8.238 TCP 30474 [TCP segment of a reassembled PDU]
259   0.029222 172.31.8.238 -> 54.192.118.222 TCP 66 35167 > http [ACK] Seq=98 Ack=1941387 Win=1583104 Len=0 TSval=10564847 TSecr=1685891527
260   0.029317 54.192.118.222 -> 172.31.8.238 TCP 31922 [TCP segment of a reassembled PDU]
261   0.029339 172.31.8.238 -> 54.192.118.222 TCP 66 35167 > http [ACK] Seq=98 Ack=1973243 Win=1583104 Len=0 TSval=10564847 TSecr=1685891527
262   0.029362 54.192.118.222 -> 172.31.8.238 TCP 1514 [TCP segment of a reassembled PDU]
263   0.029365 172.31.8.238 -> 54.192.118.222 TCP 66 35167 > http [ACK] Seq=98 Ack=1974691 Win=1583104 Len=0 TSval=10564847 TSecr=1685891527
264   0.029488 54.192.118.222 -> 172.31.8.238 TCP 4410 [TCP segment of a reassembled PDU]
265   0.029494 172.31.8.238 -> 54.192.118.222 TCP 66 35167 > http [ACK] Seq=98 Ack=1979035 Win=1583104 Len=0 TSval=10564847 TSecr=1685891527
266   0.029926 54.192.118.222 -> 172.31.8.238 TCP 2962 [TCP segment of a reassembled PDU]
267   0.029930 172.31.8.238 -> 54.192.118.222 TCP 66 35167 > http [ACK] Seq=98 Ack=1981931 Win=1583104 Len=0 TSval=10564847 TSecr=1685891527
268   0.030092 54.192.118.222 -> 172.31.8.238 TCP 26130 [TCP segment of a reassembled PDU]
269   0.030101 172.31.8.238 -> 54.192.118.222 TCP 66 35167 > http [ACK] Seq=98 Ack=2007995 Win=1583104 Len=0 TSval=10564847 TSecr=1685891527
270   0.030162 54.192.118.222 -> 172.31.8.238 TCP 24682 [TCP segment of a reassembled PDU]
271   0.030170 172.31.8.238 -> 54.192.118.222 TCP 66 35167 > http [ACK] Seq=98 Ack=2032611 Win=1583104 Len=0 TSval=10564847 TSecr=1685891527
272   0.030238 54.192.118.222 -> 172.31.8.238 TCP 20338 [TCP segment of a reassembled PDU]
273   0.030244 172.31.8.238 -> 54.192.118.222 TCP 66 35167 > http [ACK] Seq=98 Ack=2052883 Win=1583104 Len=0 TSval=10564847 TSecr=1685891527
274   0.030413 54.192.118.222 -> 172.31.8.238 TCP 26130 [TCP segment of a reassembled PDU]
275   0.030421 172.31.8.238 -> 54.192.118.222 TCP 66 35167 > http [ACK] Seq=98 Ack=2078947 Win=1583104 Len=0 TSval=10564847 TSecr=1685891527
276   0.030483 54.192.118.222 -> 172.31.8.238 TCP 26130 [TCP segment of a reassembled PDU]
277   0.030490 172.31.8.238 -> 54.192.118.222 TCP 66 35167 > http [ACK] Seq=98 Ack=2105011 Win=1583104 Len=0 TSval=10564847 TSecr=1685891527
278   0.030956 54.192.118.222 -> 172.31.8.238 TCP 2962 [TCP segment of a reassembled PDU]
279   0.030961 172.31.8.238 -> 54.192.118.222 TCP 66 35167 > http [ACK] Seq=98 Ack=2107907 Win=1583104 Len=0 TSval=10564847 TSecr=1685891527
280   0.031127 54.192.118.222 -> 172.31.8.238 TCP 26130 [TCP segment of a reassembled PDU]
281   0.031136 172.31.8.238 -> 54.192.118.222 TCP 66 35167 > http [ACK] Seq=98 Ack=2133971 Win=1583104 Len=0 TSval=10564847 TSecr=1685891527
282   0.031193 54.192.118.222 -> 172.31.8.238 TCP 26130 [TCP segment of a reassembled PDU]
283   0.031200 172.31.8.238 -> 54.192.118.222 TCP 66 35167 > http [ACK] Seq=98 Ack=2160035 Win=1583104 Len=0 TSval=10564847 TSecr=1685891527
284   0.031270 54.192.118.222 -> 172.31.8.238 TCP 26130 [TCP segment of a reassembled PDU]
285   0.031277 172.31.8.238 -> 54.192.118.222 TCP 66 35167 > http [ACK] Seq=98 Ack=2186099 Win=1583104 Len=0 TSval=10564847 TSecr=1685891527
286   0.031345 54.192.118.222 -> 172.31.8.238 TCP 26130 [TCP segment of a reassembled PDU]
287   0.031351 172.31.8.238 -> 54.192.118.222 TCP 66 35167 > http [ACK] Seq=98 Ack=2212163 Win=1583104 Len=0 TSval=10564847 TSecr=1685891527
288   0.031427 54.192.118.222 -> 172.31.8.238 TCP 23234 [TCP segment of a reassembled PDU]
289   0.031433 172.31.8.238 -> 54.192.118.222 TCP 66 35167 > http [ACK] Seq=98 Ack=2235331 Win=1583104 Len=0 TSval=10564847 TSecr=1685891527
290   0.031870 54.192.118.222 -> 172.31.8.238 TCP 21786 [TCP segment of a reassembled PDU]
291   0.031877 172.31.8.238 -> 54.192.118.222 TCP 66 35167 > http [ACK] Seq=98 Ack=2257051 Win=1583104 Len=0 TSval=10564848 TSecr=1685891527
292   0.031988 54.192.118.222 -> 172.31.8.238 TCP 26130 [TCP segment of a reassembled PDU]
293   0.031996 172.31.8.238 -> 54.192.118.222 TCP 66 35167 > http [ACK] Seq=98 Ack=2283115 Win=1583104 Len=0 TSval=10564848 TSecr=1685891527
294   0.032064 54.192.118.222 -> 172.31.8.238 TCP 26130 [TCP segment of a reassembled PDU]
295   0.032070 172.31.8.238 -> 54.192.118.222 TCP 66 35167 > http [ACK] Seq=98 Ack=2309179 Win=1583104 Len=0 TSval=10564848 TSecr=1685891527
296   0.032159 54.192.118.222 -> 172.31.8.238 TCP 26130 [TCP segment of a reassembled PDU]
297   0.032165 172.31.8.238 -> 54.192.118.222 TCP 66 35167 > http [ACK] Seq=98 Ack=2335243 Win=1583104 Len=0 TSval=10564848 TSecr=1685891527
298   0.032237 54.192.118.222 -> 172.31.8.238 TCP 26130 [TCP segment of a reassembled PDU]
299   0.032243 172.31.8.238 -> 54.192.118.222 TCP 66 35167 > http [ACK] Seq=98 Ack=2361307 Win=1583104 Len=0 TSval=10564848 TSecr=1685891527
300   0.032306 54.192.118.222 -> 172.31.8.238 TCP 4410 [TCP segment of a reassembled PDU]
301   0.032310 172.31.8.238 -> 54.192.118.222 TCP 66 35167 > http [ACK] Seq=98 Ack=2365651 Win=1583104 Len=0 TSval=10564848 TSecr=1685891527
302   0.032819 54.192.118.222 -> 172.31.8.238 TCP 2962 [TCP segment of a reassembled PDU]
303   0.032824 172.31.8.238 -> 54.192.118.222 TCP 66 35167 > http [ACK] Seq=98 Ack=2368547 Win=1583104 Len=0 TSval=10564848 TSecr=1685891528
304   0.032994 54.192.118.222 -> 172.31.8.238 TCP 26130 [TCP segment of a reassembled PDU]
305   0.033001 172.31.8.238 -> 54.192.118.222 TCP 66 35167 > http [ACK] Seq=98 Ack=2394611 Win=1583104 Len=0 TSval=10564848 TSecr=1685891528
306   0.033076 54.192.118.222 -> 172.31.8.238 TCP 26130 [TCP segment of a reassembled PDU]
307   0.033082 172.31.8.238 -> 54.192.118.222 TCP 66 35167 > http [ACK] Seq=98 Ack=2420675 Win=1583104 Len=0 TSval=10564848 TSecr=1685891528
308   0.033159 54.192.118.222 -> 172.31.8.238 TCP 26130 [TCP segment of a reassembled PDU]
309   0.033166 172.31.8.238 -> 54.192.118.222 TCP 66 35167 > http [ACK] Seq=98 Ack=2446739 Win=1583104 Len=0 TSval=10564848 TSecr=1685891528
310   0.033243 54.192.118.222 -> 172.31.8.238 TCP 26130 [TCP segment of a reassembled PDU]
311   0.033250 172.31.8.238 -> 54.192.118.222 TCP 66 35167 > http [ACK] Seq=98 Ack=2472803 Win=1583104 Len=0 TSval=10564848 TSecr=1685891528
312   0.033315 54.192.118.222 -> 172.31.8.238 TCP 23234 [TCP segment of a reassembled PDU]
313   0.033321 172.31.8.238 -> 54.192.118.222 TCP 66 35167 > http [ACK] Seq=98 Ack=2495971 Win=1583104 Len=0 TSval=10564848 TSecr=1685891528
314   0.033956 54.192.118.222 -> 172.31.8.238 TCP 4410 [TCP segment of a reassembled PDU]
315   0.033962 172.31.8.238 -> 54.192.118.222 TCP 66 35167 > http [ACK] Seq=98 Ack=2500315 Win=1583104 Len=0 TSval=10564848 TSecr=1685891528
316   0.034131 54.192.118.222 -> 172.31.8.238 TCP 26130 [TCP segment of a reassembled PDU]
317   0.034137 172.31.8.238 -> 54.192.118.222 TCP 66 35167 > http [ACK] Seq=98 Ack=2526379 Win=1583104 Len=0 TSval=10564848 TSecr=1685891528
318   0.034229 54.192.118.222 -> 172.31.8.238 TCP 26130 [TCP segment of a reassembled PDU]
319   0.034237 172.31.8.238 -> 54.192.118.222 TCP 66 35167 > http [ACK] Seq=98 Ack=2552443 Win=1583104 Len=0 TSval=10564848 TSecr=1685891528
320   0.034301 54.192.118.222 -> 172.31.8.238 TCP 8754 [TCP segment of a reassembled PDU]
321   0.034307 172.31.8.238 -> 54.192.118.222 TCP 66 35167 > http [ACK] Seq=98 Ack=2561131 Win=1583104 Len=0 TSval=10564848 TSecr=1685891528
322   0.034405 54.192.118.222 -> 172.31.8.238 TCP 26130 [TCP segment of a reassembled PDU]
323   0.034412 172.31.8.238 -> 54.192.118.222 TCP 66 35167 > http [ACK] Seq=98 Ack=2587195 Win=1583104 Len=0 TSval=10564848 TSecr=1685891528
324   0.034488 54.192.118.222 -> 172.31.8.238 TCP 26130 [TCP segment of a reassembled PDU]
325   0.034496 172.31.8.238 -> 54.192.118.222 TCP 66 35167 > http [ACK] Seq=98 Ack=2613259 Win=1583104 Len=0 TSval=10564848 TSecr=1685891528
326   0.034558 54.192.118.222 -> 172.31.8.238 TCP 13098 [TCP segment of a reassembled PDU]
327   0.034563 172.31.8.238 -> 54.192.118.222 TCP 66 35167 > http [ACK] Seq=98 Ack=2626291 Win=1583104 Len=0 TSval=10564848 TSecr=1685891528
328   0.034844 54.192.118.222 -> 172.31.8.238 TCP 26130 [TCP segment of a reassembled PDU]
329   0.034851 172.31.8.238 -> 54.192.118.222 TCP 66 35167 > http [ACK] Seq=98 Ack=2652355 Win=1583104 Len=0 TSval=10564848 TSecr=1685891528
330   0.034926 54.192.118.222 -> 172.31.8.238 TCP 23234 [TCP segment of a reassembled PDU]
331   0.034933 172.31.8.238 -> 54.192.118.222 TCP 66 35167 > http [ACK] Seq=98 Ack=2675523 Win=1583104 Len=0 TSval=10564848 TSecr=1685891528
332   0.034997 54.192.118.222 -> 172.31.8.238 TCP 15994 [TCP segment of a reassembled PDU]
333   0.035003 172.31.8.238 -> 54.192.118.222 TCP 66 35167 > http [ACK] Seq=98 Ack=2691451 Win=1583104 Len=0 TSval=10564848 TSecr=1685891528
334   0.035037 54.192.118.222 -> 172.31.8.238 TCP 2962 [TCP segment of a reassembled PDU]
335   0.035041 172.31.8.238 -> 54.192.118.222 TCP 66 35167 > http [ACK] Seq=98 Ack=2694347 Win=1583104 Len=0 TSval=10564848 TSecr=1685891528
336   0.035139 54.192.118.222 -> 172.31.8.238 TCP 10202 [TCP segment of a reassembled PDU]
337   0.035144 172.31.8.238 -> 54.192.118.222 TCP 66 35167 > http [ACK] Seq=98 Ack=2704483 Win=1583104 Len=0 TSval=10564848 TSecr=1685891528
338   0.035299 54.192.118.222 -> 172.31.8.238 TCP 26130 [TCP segment of a reassembled PDU]
339   0.035306 172.31.8.238 -> 54.192.118.222 TCP 66 35167 > http [ACK] Seq=98 Ack=2730547 Win=1583104 Len=0 TSval=10564848 TSecr=1685891528
340   0.035360 54.192.118.222 -> 172.31.8.238 TCP 21786 [TCP segment of a reassembled PDU]
341   0.035367 172.31.8.238 -> 54.192.118.222 TCP 66 35167 > http [ACK] Seq=98 Ack=2752267 Win=1583104 Len=0 TSval=10564848 TSecr=1685891528
342   0.035410 54.192.118.222 -> 172.31.8.238 TCP 4410 [TCP segment of a reassembled PDU]
343   0.035413 172.31.8.238 -> 54.192.118.222 TCP 66 35167 > http [ACK] Seq=98 Ack=2756611 Win=1583104 Len=0 TSval=10564848 TSecr=1685891528
344   0.035539 54.192.118.222 -> 172.31.8.238 TCP 4410 [TCP segment of a reassembled PDU]
345   0.035544 172.31.8.238 -> 54.192.118.222 TCP 66 35167 > http [ACK] Seq=98 Ack=2760955 Win=1583104 Len=0 TSval=10564848 TSecr=1685891528
