[Measurement for 10mb at 00:43:51 20.43.2014] 
Tshark:

  1   0.000000 172.31.8.238 -> 172.31.0.2   DNS 89 Standard query 0xe9f7  A d3m1c4hwkgedal.cloudfront.net
  2   0.000041 172.31.8.238 -> 172.31.0.2   DNS 89 Standard query 0xcff3  AAAA d3m1c4hwkgedal.cloudfront.net
  3   0.000687   172.31.0.2 -> 172.31.8.238 DNS 174 Standard query response 0xcff3 
  4   0.000697   172.31.0.2 -> 172.31.8.238 DNS 217 Standard query response 0xe9f7  A 54.230.117.50 A 54.230.118.143 A 54.230.118.239 A 54.230.119.91 A 54.239.132.166 A 54.192.118.236 A 54.230.117.21 A 54.230.117.42
  5   0.003885 172.31.8.238 -> 54.230.117.50 TCP 74 51434 > http [SYN] Seq=0 Win=26883 Len=0 MSS=8961 SACK_PERM=1 TSval=6964845 TSecr=0 WS=128
  6   0.004666 54.230.117.50 -> 172.31.8.238 TCP 74 http > 51434 [SYN, ACK] Seq=0 Ack=1 Win=14480 Len=0 MSS=1460 SACK_PERM=1 TSval=1685141714 TSecr=6964845 WS=128
  7   0.004680 172.31.8.238 -> 54.230.117.50 TCP 66 51434 > http [ACK] Seq=1 Ack=1 Win=27008 Len=0 TSval=6964845 TSecr=1685141714
  8   0.004728 172.31.8.238 -> 54.230.117.50 HTTP 163 GET /10mb HTTP/1.1 
  9   0.005149 54.230.117.50 -> 172.31.8.238 TCP 66 http > 51434 [ACK] Seq=1 Ack=98 Win=14592 Len=0 TSval=1685141714 TSecr=6964845
 10   0.006731 54.230.117.50 -> 172.31.8.238 TCP 10202 [TCP segment of a reassembled PDU]
 11   0.006741 172.31.8.238 -> 54.230.117.50 TCP 66 51434 > http [ACK] Seq=98 Ack=10137 Win=47232 Len=0 TSval=6964845 TSecr=1685141714
 12   0.006789 54.230.117.50 -> 172.31.8.238 TCP 4410 [TCP segment of a reassembled PDU]
 13   0.006795 172.31.8.238 -> 54.230.117.50 TCP 66 51434 > http [ACK] Seq=98 Ack=14481 Win=55936 Len=0 TSval=6964845 TSecr=1685141714
 14   0.007244 54.230.117.50 -> 172.31.8.238 TCP 4410 [TCP segment of a reassembled PDU]
 15   0.007250 172.31.8.238 -> 54.230.117.50 TCP 66 51434 > http [ACK] Seq=98 Ack=18825 Win=64640 Len=0 TSval=6964845 TSecr=1685141714
 16   0.007345 54.230.117.50 -> 172.31.8.238 TCP 8754 [TCP segment of a reassembled PDU]
 17   0.007352 172.31.8.238 -> 54.230.117.50 TCP 66 51434 > http [ACK] Seq=98 Ack=27513 Win=81920 Len=0 TSval=6964845 TSecr=1685141714
 18   0.007762 54.230.117.50 -> 172.31.8.238 TCP 10202 [TCP segment of a reassembled PDU]
 19   0.007771 172.31.8.238 -> 54.230.117.50 TCP 66 51434 > http [ACK] Seq=98 Ack=37649 Win=102272 Len=0 TSval=6964846 TSecr=1685141714
 20   0.007997 54.230.117.50 -> 172.31.8.238 TCP 4410 [TCP segment of a reassembled PDU]
 21   0.008003 172.31.8.238 -> 54.230.117.50 TCP 66 51434 > http [ACK] Seq=98 Ack=41993 Win=110976 Len=0 TSval=6964846 TSecr=1685141714
 22   0.008087 54.230.117.50 -> 172.31.8.238 TCP 5858 [TCP segment of a reassembled PDU]
 23   0.008093 172.31.8.238 -> 54.230.117.50 TCP 66 51434 > http [ACK] Seq=98 Ack=47785 Win=122496 Len=0 TSval=6964846 TSecr=1685141714
 24   0.008286 54.230.117.50 -> 172.31.8.238 TCP 5858 [TCP segment of a reassembled PDU]
 25   0.008292 172.31.8.238 -> 54.230.117.50 TCP 66 51434 > http [ACK] Seq=98 Ack=53577 Win=134144 Len=0 TSval=6964846 TSecr=1685141714
 26   0.008510 54.230.117.50 -> 172.31.8.238 TCP 2962 [TCP segment of a reassembled PDU]
 27   0.008528 172.31.8.238 -> 54.230.117.50 TCP 66 51434 > http [ACK] Seq=98 Ack=56473 Win=139904 Len=0 TSval=6964846 TSecr=1685141714
 28   0.008624 54.230.117.50 -> 172.31.8.238 TCP 10202 [TCP segment of a reassembled PDU]
 29   0.008633 172.31.8.238 -> 54.230.117.50 TCP 66 51434 > http [ACK] Seq=98 Ack=66609 Win=160128 Len=0 TSval=6964846 TSecr=1685141714
 30   0.008784 54.230.117.50 -> 172.31.8.238 TCP 10202 [TCP segment of a reassembled PDU]
 31   0.008792 172.31.8.238 -> 54.230.117.50 TCP 66 51434 > http [ACK] Seq=98 Ack=76745 Win=180480 Len=0 TSval=6964846 TSecr=1685141714
 32   0.008868 54.230.117.50 -> 172.31.8.238 TCP 2962 [TCP segment of a reassembled PDU]
 33   0.008873 172.31.8.238 -> 54.230.117.50 TCP 66 51434 > http [ACK] Seq=98 Ack=79641 Win=186240 Len=0 TSval=6964846 TSecr=1685141714
 34   0.009293 54.230.117.50 -> 172.31.8.238 TCP 5858 [TCP segment of a reassembled PDU]
 35   0.009300 172.31.8.238 -> 54.230.117.50 TCP 66 51434 > http [ACK] Seq=98 Ack=85433 Win=188672 Len=0 TSval=6964846 TSecr=1685141714
 36   0.009448 54.230.117.50 -> 172.31.8.238 TCP 21786 [TCP segment of a reassembled PDU]
 37   0.009461 172.31.8.238 -> 54.230.117.50 TCP 66 51434 > http [ACK] Seq=98 Ack=107153 Win=167040 Len=0 TSval=6964846 TSecr=1685141714
 38   0.009818 54.230.117.50 -> 172.31.8.238 TCP 10202 [TCP segment of a reassembled PDU]
 39   0.009826 172.31.8.238 -> 54.230.117.50 TCP 66 51434 > http [ACK] Seq=98 Ack=117289 Win=181632 Len=0 TSval=6964846 TSecr=1685141714
 40   0.009870 54.230.117.50 -> 172.31.8.238 TCP 1514 [TCP segment of a reassembled PDU]
 41   0.009874 172.31.8.238 -> 54.230.117.50 TCP 66 51434 > http [ACK] Seq=98 Ack=118737 Win=195840 Len=0 TSval=6964846 TSecr=1685141714
 42   0.010171 54.230.117.50 -> 172.31.8.238 TCP 15994 [TCP segment of a reassembled PDU]
 43   0.010182 172.31.8.238 -> 54.230.117.50 TCP 66 51434 > http [ACK] Seq=98 Ack=134665 Win=179968 Len=0 TSval=6964846 TSecr=1685141714
 44   0.010308 54.230.117.50 -> 172.31.8.238 TCP 5858 [TCP segment of a reassembled PDU]
 45   0.010314 172.31.8.238 -> 54.230.117.50 TCP 66 51434 > http [ACK] Seq=98 Ack=140457 Win=174208 Len=0 TSval=6964846 TSecr=1685141715
 46   0.010428 54.230.117.50 -> 172.31.8.238 TCP 13098 [TCP segment of a reassembled PDU]
 47   0.010436 172.31.8.238 -> 54.230.117.50 TCP 66 51434 > http [ACK] Seq=98 Ack=153489 Win=161280 Len=0 TSval=6964846 TSecr=1685141715
 48   0.010789 54.230.117.50 -> 172.31.8.238 TCP 2962 [TCP segment of a reassembled PDU]
 49   0.010808 172.31.8.238 -> 54.230.117.50 TCP 66 51434 > http [ACK] Seq=98 Ack=156385 Win=193408 Len=0 TSval=6964846 TSecr=1685141715
 50   0.010940 54.230.117.50 -> 172.31.8.238 TCP 24682 [TCP segment of a reassembled PDU]
 51   0.010954 172.31.8.238 -> 54.230.117.50 TCP 66 51434 > http [ACK] Seq=98 Ack=181001 Win=168832 Len=0 TSval=6964846 TSecr=1685141715
 52   0.011088 54.230.117.50 -> 172.31.8.238 TCP 8754 [TCP segment of a reassembled PDU]
 53   0.011109 172.31.8.238 -> 54.230.117.50 TCP 66 51434 > http [ACK] Seq=98 Ack=189689 Win=183936 Len=0 TSval=6964846 TSecr=1685141715
 54   0.011564 54.230.117.50 -> 172.31.8.238 TCP 2962 [TCP segment of a reassembled PDU]
 55   0.011569 172.31.8.238 -> 54.230.117.50 TCP 66 51434 > http [ACK] Seq=98 Ack=192585 Win=193408 Len=0 TSval=6964847 TSecr=1685141715
 56   0.011732 54.230.117.50 -> 172.31.8.238 TCP 23234 [TCP segment of a reassembled PDU]
 57   0.011745 172.31.8.238 -> 54.230.117.50 TCP 66 51434 > http [ACK] Seq=98 Ack=215753 Win=244096 Len=0 TSval=6964847 TSecr=1685141715
 58   0.011753 54.230.117.50 -> 172.31.8.238 TCP 2962 [TCP segment of a reassembled PDU]
 59   0.011757 172.31.8.238 -> 54.230.117.50 TCP 66 51434 > http [ACK] Seq=98 Ack=218649 Win=249984 Len=0 TSval=6964847 TSecr=1685141715
 60   0.011804 54.230.117.50 -> 172.31.8.238 TCP 2962 [TCP segment of a reassembled PDU]
 61   0.011810 172.31.8.238 -> 54.230.117.50 TCP 66 51434 > http [ACK] Seq=98 Ack=221545 Win=255744 Len=0 TSval=6964847 TSecr=1685141715
 62   0.012133 54.230.117.50 -> 172.31.8.238 TCP 15994 [TCP segment of a reassembled PDU]
 63   0.012143 172.31.8.238 -> 54.230.117.50 TCP 66 51434 > http [ACK] Seq=98 Ack=237473 Win=287616 Len=0 TSval=6964847 TSecr=1685141715
 64   0.012226 54.230.117.50 -> 172.31.8.238 TCP 2962 [TCP segment of a reassembled PDU]
 65   0.012231 172.31.8.238 -> 54.230.117.50 TCP 66 51434 > http [ACK] Seq=98 Ack=240369 Win=293376 Len=0 TSval=6964847 TSecr=1685141715
 66   0.012352 54.230.117.50 -> 172.31.8.238 TCP 8754 [TCP segment of a reassembled PDU]
 67   0.012359 172.31.8.238 -> 54.230.117.50 TCP 66 51434 > http [ACK] Seq=98 Ack=249057 Win=310784 Len=0 TSval=6964847 TSecr=1685141715
 68   0.012480 54.230.117.50 -> 172.31.8.238 TCP 15994 [TCP segment of a reassembled PDU]
 69   0.012489 172.31.8.238 -> 54.230.117.50 TCP 66 51434 > http [ACK] Seq=98 Ack=264985 Win=342656 Len=0 TSval=6964847 TSecr=1685141715
 70   0.012698 54.230.117.50 -> 172.31.8.238 TCP 17442 [TCP segment of a reassembled PDU]
 71   0.012709 172.31.8.238 -> 54.230.117.50 TCP 66 51434 > http [ACK] Seq=98 Ack=282361 Win=377344 Len=0 TSval=6964847 TSecr=1685141715
 72   0.013010 54.230.117.50 -> 172.31.8.238 TCP 23234 [TCP segment of a reassembled PDU]
 73   0.013023 172.31.8.238 -> 54.230.117.50 TCP 66 51434 > http [ACK] Seq=98 Ack=305529 Win=423680 Len=0 TSval=6964847 TSecr=1685141715
 74   0.013117 54.230.117.50 -> 172.31.8.238 TCP 7306 [TCP segment of a reassembled PDU]
 75   0.013124 172.31.8.238 -> 54.230.117.50 TCP 66 51434 > http [ACK] Seq=98 Ack=312769 Win=438144 Len=0 TSval=6964847 TSecr=1685141715
 76   0.013296 54.230.117.50 -> 172.31.8.238 TCP 26130 [TCP segment of a reassembled PDU]
 77   0.013309 172.31.8.238 -> 54.230.117.50 TCP 66 51434 > http [ACK] Seq=98 Ack=338833 Win=490368 Len=0 TSval=6964847 TSecr=1685141715
 78   0.013316 54.230.117.50 -> 172.31.8.238 TCP 2962 [TCP segment of a reassembled PDU]
 79   0.013319 172.31.8.238 -> 54.230.117.50 TCP 66 51434 > http [ACK] Seq=98 Ack=341729 Win=496128 Len=0 TSval=6964847 TSecr=1685141715
 80   0.013693 54.230.117.50 -> 172.31.8.238 TCP 5858 [TCP segment of a reassembled PDU]
 81   0.013699 172.31.8.238 -> 54.230.117.50 TCP 66 51434 > http [ACK] Seq=98 Ack=347521 Win=507648 Len=0 TSval=6964847 TSecr=1685141715
 82   0.013862 54.230.117.50 -> 172.31.8.238 TCP 18890 [TCP segment of a reassembled PDU]
 83   0.013873 172.31.8.238 -> 54.230.117.50 TCP 66 51434 > http [ACK] Seq=98 Ack=366345 Win=545280 Len=0 TSval=6964847 TSecr=1685141715
 84   0.013995 54.230.117.50 -> 172.31.8.238 TCP 26130 [TCP segment of a reassembled PDU]
 85   0.014009 172.31.8.238 -> 54.230.117.50 TCP 66 51434 > http [ACK] Seq=98 Ack=392409 Win=597504 Len=0 TSval=6964847 TSecr=1685141715
 86   0.014118 54.230.117.50 -> 172.31.8.238 TCP 10202 [TCP segment of a reassembled PDU]
 87   0.014126 172.31.8.238 -> 54.230.117.50 TCP 66 51434 > http [ACK] Seq=98 Ack=402545 Win=617728 Len=0 TSval=6964847 TSecr=1685141715
 88   0.014214 54.230.117.50 -> 172.31.8.238 TCP 5858 [TCP segment of a reassembled PDU]
 89   0.014220 172.31.8.238 -> 54.230.117.50 TCP 66 51434 > http [ACK] Seq=98 Ack=408337 Win=629376 Len=0 TSval=6964847 TSecr=1685141715
 90   0.014501 54.230.117.50 -> 172.31.8.238 TCP 20338 [TCP segment of a reassembled PDU]
 91   0.014514 172.31.8.238 -> 54.230.117.50 TCP 66 51434 > http [ACK] Seq=98 Ack=428609 Win=669824 Len=0 TSval=6964847 TSecr=1685141715
 92   0.014524 54.230.117.50 -> 172.31.8.238 TCP 5858 [TCP segment of a reassembled PDU]
 93   0.014528 172.31.8.238 -> 54.230.117.50 TCP 66 51434 > http [ACK] Seq=98 Ack=434401 Win=681472 Len=0 TSval=6964847 TSecr=1685141715
 94   0.014707 54.230.117.50 -> 172.31.8.238 TCP 24682 [TCP segment of a reassembled PDU]
 95   0.014720 172.31.8.238 -> 54.230.117.50 TCP 66 51434 > http [ACK] Seq=98 Ack=459017 Win=730624 Len=0 TSval=6964847 TSecr=1685141715
 96   0.014830 54.230.117.50 -> 172.31.8.238 TCP 14546 [TCP segment of a reassembled PDU]
 97   0.014839 172.31.8.238 -> 54.230.117.50 TCP 66 51434 > http [ACK] Seq=98 Ack=473497 Win=759680 Len=0 TSval=6964847 TSecr=1685141715
 98   0.014927 54.230.117.50 -> 172.31.8.238 TCP 4410 [TCP segment of a reassembled PDU]
 99   0.014933 172.31.8.238 -> 54.230.117.50 TCP 66 51434 > http [ACK] Seq=98 Ack=477841 Win=768384 Len=0 TSval=6964847 TSecr=1685141715
100   0.015108 54.230.117.50 -> 172.31.8.238 TCP 24682 [TCP segment of a reassembled PDU]
101   0.015121 172.31.8.238 -> 54.230.117.50 TCP 66 51434 > http [ACK] Seq=98 Ack=502457 Win=817536 Len=0 TSval=6964847 TSecr=1685141715
102   0.015253 54.230.117.50 -> 172.31.8.238 TCP 21786 [TCP segment of a reassembled PDU]
103   0.015278 172.31.8.238 -> 54.230.117.50 TCP 66 51434 > http [ACK] Seq=98 Ack=524177 Win=861056 Len=0 TSval=6964847 TSecr=1685141715
104   0.015384 54.230.117.50 -> 172.31.8.238 TCP 11650 [TCP segment of a reassembled PDU]
105   0.015392 172.31.8.238 -> 54.230.117.50 TCP 66 51434 > http [ACK] Seq=98 Ack=535761 Win=884224 Len=0 TSval=6964848 TSecr=1685141715
106   0.015422 54.230.117.50 -> 172.31.8.238 TCP 2962 [TCP segment of a reassembled PDU]
107   0.015427 172.31.8.238 -> 54.230.117.50 TCP 66 51434 > http [ACK] Seq=98 Ack=538657 Win=886400 Len=0 TSval=6964848 TSecr=1685141715
108   0.015683 54.230.117.50 -> 172.31.8.238 TCP 4410 [TCP segment of a reassembled PDU]
109   0.015689 172.31.8.238 -> 54.230.117.50 TCP 66 51434 > http [ACK] Seq=98 Ack=543001 Win=898688 Len=0 TSval=6964848 TSecr=1685141715
110   0.015861 54.230.117.50 -> 172.31.8.238 TCP 26130 [TCP segment of a reassembled PDU]
111   0.015875 172.31.8.238 -> 54.230.117.50 TCP 66 51434 > http [ACK] Seq=98 Ack=569065 Win=950784 Len=0 TSval=6964848 TSecr=1685141715
112   0.015915 54.230.117.50 -> 172.31.8.238 TCP 14546 [TCP segment of a reassembled PDU]
113   0.015924 172.31.8.238 -> 54.230.117.50 TCP 66 51434 > http [ACK] Seq=98 Ack=583545 Win=979712 Len=0 TSval=6964848 TSecr=1685141715
114   0.016035 54.230.117.50 -> 172.31.8.238 TCP 15994 [TCP segment of a reassembled PDU]
115   0.016045 172.31.8.238 -> 54.230.117.50 TCP 66 51434 > http [ACK] Seq=98 Ack=599473 Win=1011584 Len=0 TSval=6964848 TSecr=1685141715
116   0.016122 54.230.117.50 -> 172.31.8.238 TCP 4410 [TCP segment of a reassembled PDU]
117   0.016128 172.31.8.238 -> 54.230.117.50 TCP 66 51434 > http [ACK] Seq=98 Ack=603817 Win=1020288 Len=0 TSval=6964848 TSecr=1685141715
118   0.016469 54.230.117.50 -> 172.31.8.238 TCP 2962 [TCP segment of a reassembled PDU]
119   0.016475 172.31.8.238 -> 54.230.117.50 TCP 66 51434 > http [ACK] Seq=98 Ack=606713 Win=1026048 Len=0 TSval=6964848 TSecr=1685141715
120   0.016652 54.230.117.50 -> 172.31.8.238 TCP 26130 [TCP segment of a reassembled PDU]
121   0.016665 172.31.8.238 -> 54.230.117.50 TCP 66 51434 > http [ACK] Seq=98 Ack=632777 Win=1078144 Len=0 TSval=6964848 TSecr=1685141715
122   0.016725 54.230.117.50 -> 172.31.8.238 TCP 26130 [TCP segment of a reassembled PDU]
123   0.016738 172.31.8.238 -> 54.230.117.50 TCP 66 51434 > http [ACK] Seq=98 Ack=658841 Win=1130368 Len=0 TSval=6964848 TSecr=1685141715
124   0.016797 54.230.117.50 -> 172.31.8.238 TCP 10202 [TCP segment of a reassembled PDU]
125   0.016805 172.31.8.238 -> 54.230.117.50 TCP 66 51434 > http [ACK] Seq=98 Ack=668977 Win=1150592 Len=0 TSval=6964848 TSecr=1685141715
126   0.017039 54.230.117.50 -> 172.31.8.238 TCP 23234 [TCP segment of a reassembled PDU]
127   0.017052 172.31.8.238 -> 54.230.117.50 TCP 66 51434 > http [ACK] Seq=98 Ack=692145 Win=1196928 Len=0 TSval=6964848 TSecr=1685141715
128   0.017087 54.230.117.50 -> 172.31.8.238 TCP 8754 [TCP segment of a reassembled PDU]
129   0.017106 172.31.8.238 -> 54.230.117.50 TCP 66 51434 > http [ACK] Seq=98 Ack=700833 Win=1214336 Len=0 TSval=6964848 TSecr=1685141715
130   0.017372 54.230.117.50 -> 172.31.8.238 TCP 26130 [TCP segment of a reassembled PDU]
131   0.017386 172.31.8.238 -> 54.230.117.50 TCP 66 51434 > http [ACK] Seq=98 Ack=726897 Win=1266432 Len=0 TSval=6964848 TSecr=1685141715
132   0.017395 54.230.117.50 -> 172.31.8.238 TCP 7306 [TCP segment of a reassembled PDU]
133   0.017400 172.31.8.238 -> 54.230.117.50 TCP 66 51434 > http [ACK] Seq=98 Ack=734137 Win=1280896 Len=0 TSval=6964848 TSecr=1685141715
134   0.017611 54.230.117.50 -> 172.31.8.238 TCP 20338 [TCP segment of a reassembled PDU]
135   0.017624 172.31.8.238 -> 54.230.117.50 TCP 66 51434 > http [ACK] Seq=98 Ack=754409 Win=1321472 Len=0 TSval=6964848 TSecr=1685141715
136   0.017629 54.230.117.50 -> 172.31.8.238 TCP 1514 [TCP segment of a reassembled PDU]
137   0.017632 172.31.8.238 -> 54.230.117.50 TCP 66 51434 > http [ACK] Seq=98 Ack=755857 Win=1324416 Len=0 TSval=6964848 TSecr=1685141715
138   0.017641 54.230.117.50 -> 172.31.8.238 TCP 4410 [TCP segment of a reassembled PDU]
139   0.017653 172.31.8.238 -> 54.230.117.50 TCP 66 51434 > http [ACK] Seq=98 Ack=760201 Win=1332992 Len=0 TSval=6964848 TSecr=1685141715
140   0.017693 54.230.117.50 -> 172.31.8.238 TCP 7306 [TCP segment of a reassembled PDU]
141   0.017699 172.31.8.238 -> 54.230.117.50 TCP 66 51434 > http [ACK] Seq=98 Ack=767441 Win=1347584 Len=0 TSval=6964848 TSecr=1685141715
142   0.018109 54.230.117.50 -> 172.31.8.238 TCP 26130 [TCP segment of a reassembled PDU]
143   0.018122 172.31.8.238 -> 54.230.117.50 TCP 66 51434 > http [ACK] Seq=98 Ack=793505 Win=1399680 Len=0 TSval=6964848 TSecr=1685141715
144   0.018182 54.230.117.50 -> 172.31.8.238 TCP 23234 [TCP segment of a reassembled PDU]
145   0.018195 172.31.8.238 -> 54.230.117.50 TCP 66 51434 > http [ACK] Seq=98 Ack=816673 Win=1446016 Len=0 TSval=6964848 TSecr=1685141715
146   0.018250 54.230.117.50 -> 172.31.8.238 TCP 21786 [TCP segment of a reassembled PDU]
147   0.018263 172.31.8.238 -> 54.230.117.50 TCP 66 51434 > http [ACK] Seq=98 Ack=838393 Win=1489408 Len=0 TSval=6964848 TSecr=1685141715
148   0.018511 54.230.117.50 -> 172.31.8.238 TCP 7306 [TCP segment of a reassembled PDU]
149   0.018519 172.31.8.238 -> 54.230.117.50 TCP 66 51434 > http [ACK] Seq=98 Ack=845633 Win=1503872 Len=0 TSval=6964848 TSecr=1685141715
150   0.018670 54.230.117.50 -> 172.31.8.238 TCP 18890 [TCP segment of a reassembled PDU]
151   0.018679 172.31.8.238 -> 54.230.117.50 TCP 66 51434 > http [ACK] Seq=98 Ack=864457 Win=1541504 Len=0 TSval=6964848 TSecr=1685141715
152   0.018775 54.230.117.50 -> 172.31.8.238 TCP 5858 [TCP segment of a reassembled PDU]
153   0.018781 172.31.8.238 -> 54.230.117.50 TCP 66 51434 > http [ACK] Seq=98 Ack=870249 Win=1553152 Len=0 TSval=6964848 TSecr=1685141715
154   0.018945 54.230.117.50 -> 172.31.8.238 TCP 26130 [TCP segment of a reassembled PDU]
155   0.018968 172.31.8.238 -> 54.230.117.50 TCP 66 51434 > http [ACK] Seq=98 Ack=896313 Win=1552000 Len=0 TSval=6964848 TSecr=1685141715
156   0.019035 54.230.117.50 -> 172.31.8.238 TCP 26130 [TCP segment of a reassembled PDU]
157   0.019049 172.31.8.238 -> 54.230.117.50 TCP 66 51434 > http [ACK] Seq=98 Ack=922377 Win=1552000 Len=0 TSval=6964848 TSecr=1685141715
158   0.019090 54.230.117.50 -> 172.31.8.238 TCP 7306 [TCP segment of a reassembled PDU]
159   0.019110 172.31.8.238 -> 54.230.117.50 TCP 66 51434 > http [ACK] Seq=98 Ack=929617 Win=1567616 Len=0 TSval=6964848 TSecr=1685141715
160   0.019418 54.230.117.50 -> 172.31.8.238 TCP 26130 [TCP segment of a reassembled PDU]
161   0.019444 172.31.8.238 -> 54.230.117.50 TCP 66 51434 > http [ACK] Seq=98 Ack=955681 Win=1552000 Len=0 TSval=6964849 TSecr=1685141715
162   0.019485 54.230.117.50 -> 172.31.8.238 TCP 26130 [TCP segment of a reassembled PDU]
163   0.019499 172.31.8.238 -> 54.230.117.50 TCP 66 51434 > http [ACK] Seq=98 Ack=981745 Win=1552000 Len=0 TSval=6964849 TSecr=1685141715
164   0.019685 54.230.117.50 -> 172.31.8.238 TCP 26130 [TCP segment of a reassembled PDU]
165   0.019699 172.31.8.238 -> 54.230.117.50 TCP 66 51434 > http [ACK] Seq=98 Ack=1007809 Win=1552000 Len=0 TSval=6964849 TSecr=1685141715
166   0.019751 54.230.117.50 -> 172.31.8.238 TCP 26130 [TCP segment of a reassembled PDU]
167   0.019764 172.31.8.238 -> 54.230.117.50 TCP 66 51434 > http [ACK] Seq=98 Ack=1033873 Win=1552000 Len=0 TSval=6964849 TSecr=1685141715
168   0.019809 54.230.117.50 -> 172.31.8.238 TCP 10202 [TCP segment of a reassembled PDU]
169   0.019817 172.31.8.238 -> 54.230.117.50 TCP 66 51434 > http [ACK] Seq=98 Ack=1044009 Win=1578240 Len=0 TSval=6964849 TSecr=1685141715
170   0.020113 54.230.117.50 -> 172.31.8.238 TCP 26130 [TCP segment of a reassembled PDU]
171   0.020138 172.31.8.238 -> 54.230.117.50 TCP 66 51434 > http [ACK] Seq=98 Ack=1070073 Win=1552256 Len=0 TSval=6964849 TSecr=1685141715
172   0.020265 54.230.117.50 -> 172.31.8.238 TCP 26130 [TCP segment of a reassembled PDU]
173   0.020290 172.31.8.238 -> 54.230.117.50 TCP 66 51434 > http [ACK] Seq=98 Ack=1096137 Win=1552000 Len=0 TSval=6964849 TSecr=1685141715
174   0.020392 54.230.117.50 -> 172.31.8.238 TCP 11650 [TCP segment of a reassembled PDU]
175   0.020399 172.31.8.238 -> 54.230.117.50 TCP 66 51434 > http [ACK] Seq=98 Ack=1107721 Win=1575808 Len=0 TSval=6964849 TSecr=1685141715
176   0.020412 54.230.117.50 -> 172.31.8.238 TCP 13098 [TCP segment of a reassembled PDU]
177   0.020457 54.230.117.50 -> 172.31.8.238 TCP 26130 [TCP segment of a reassembled PDU]
178   0.020512 172.31.8.238 -> 54.230.117.50 TCP 66 51434 > http [ACK] Seq=98 Ack=1146817 Win=1536768 Len=0 TSval=6964849 TSecr=1685141716
179   0.020536 54.230.117.50 -> 172.31.8.238 TCP 26130 [TCP segment of a reassembled PDU]
180   0.020559 172.31.8.238 -> 54.230.117.50 TCP 66 51434 > http [ACK] Seq=98 Ack=1172881 Win=1510784 Len=0 TSval=6964849 TSecr=1685141716
181   0.020588 54.230.117.50 -> 172.31.8.238 TCP 1514 [TCP segment of a reassembled PDU]
182   0.020875 54.230.117.50 -> 172.31.8.238 TCP 15994 [TCP segment of a reassembled PDU]
183   0.020885 172.31.8.238 -> 54.230.117.50 TCP 66 51434 > http [ACK] Seq=98 Ack=1190257 Win=1568640 Len=0 TSval=6964849 TSecr=1685141716
184   0.021177 54.230.117.50 -> 172.31.8.238 TCP 18890 [TCP segment of a reassembled PDU]
185   0.021202 54.230.117.50 -> 172.31.8.238 TCP 7306 [TCP segment of a reassembled PDU]
186   0.021211 172.31.8.238 -> 54.230.117.50 TCP 66 51434 > http [ACK] Seq=98 Ack=1216321 Win=1551872 Len=0 TSval=6964849 TSecr=1685141716
187   0.021260 54.230.117.50 -> 172.31.8.238 TCP 24682 [TCP segment of a reassembled PDU]
188   0.021272 172.31.8.238 -> 54.230.117.50 TCP 66 51434 > http [ACK] Seq=98 Ack=1240937 Win=1554432 Len=0 TSval=6964849 TSecr=1685141716
189   0.021360 54.230.117.50 -> 172.31.8.238 TCP 26130 [TCP segment of a reassembled PDU]
190   0.021438 54.230.117.50 -> 172.31.8.238 TCP 26130 [TCP segment of a reassembled PDU]
191   0.021483 54.230.117.50 -> 172.31.8.238 TCP 26130 [TCP segment of a reassembled PDU]
192   0.021501 54.230.117.50 -> 172.31.8.238 TCP 1514 [TCP segment of a reassembled PDU]
193   0.021635 172.31.8.238 -> 54.230.117.50 TCP 66 51434 > http [ACK] Seq=98 Ack=1320577 Win=1474816 Len=0 TSval=6964849 TSecr=1685141716
194   0.021913 54.230.117.50 -> 172.31.8.238 TCP 4410 [TCP segment of a reassembled PDU]
195   0.021920 172.31.8.238 -> 54.230.117.50 TCP 66 51434 > http [ACK] Seq=98 Ack=1324921 Win=1587712 Len=0 TSval=6964849 TSecr=1685141716
196   0.022084 54.230.117.50 -> 172.31.8.238 TCP 26130 [TCP segment of a reassembled PDU]
197   0.022109 172.31.8.238 -> 54.230.117.50 TCP 66 51434 > http [ACK] Seq=98 Ack=1350985 Win=1561728 Len=0 TSval=6964849 TSecr=1685141716
198   0.022155 54.230.117.50 -> 172.31.8.238 TCP 26130 [TCP segment of a reassembled PDU]
199   0.022180 172.31.8.238 -> 54.230.117.50 TCP 66 51434 > http [ACK] Seq=98 Ack=1377049 Win=1552000 Len=0 TSval=6964849 TSecr=1685141716
200   0.022225 54.230.117.50 -> 172.31.8.238 TCP 15994 [TCP segment of a reassembled PDU]
201   0.022235 172.31.8.238 -> 54.230.117.50 TCP 66 51434 > http [ACK] Seq=98 Ack=1392977 Win=1568640 Len=0 TSval=6964849 TSecr=1685141716
202   0.022312 54.230.117.50 -> 172.31.8.238 TCP 26130 [TCP segment of a reassembled PDU]
203   0.022337 172.31.8.238 -> 54.230.117.50 TCP 66 51434 > http [ACK] Seq=98 Ack=1419041 Win=1552000 Len=0 TSval=6964849 TSecr=1685141716
204   0.022388 54.230.117.50 -> 172.31.8.238 TCP 20338 [TCP segment of a reassembled PDU]
205   0.022400 172.31.8.238 -> 54.230.117.50 TCP 66 51434 > http [ACK] Seq=98 Ack=1439313 Win=1561472 Len=0 TSval=6964849 TSecr=1685141716
206   0.022439 54.230.117.50 -> 172.31.8.238 TCP 11650 [TCP segment of a reassembled PDU]
207   0.022447 172.31.8.238 -> 54.230.117.50 TCP 66 51434 > http [ACK] Seq=98 Ack=1450897 Win=1575808 Len=0 TSval=6964849 TSecr=1685141716
208   0.022854 54.230.117.50 -> 172.31.8.238 TCP 26130 [TCP segment of a reassembled PDU]
209   0.022880 172.31.8.238 -> 54.230.117.50 TCP 66 51434 > http [ACK] Seq=98 Ack=1476961 Win=1552000 Len=0 TSval=6964849 TSecr=1685141716
210   0.022925 54.230.117.50 -> 172.31.8.238 TCP 24682 [TCP segment of a reassembled PDU]
211   0.022938 172.31.8.238 -> 54.230.117.50 TCP 66 51434 > http [ACK] Seq=98 Ack=1501577 Win=1554432 Len=0 TSval=6964849 TSecr=1685141716
212   0.023055 54.230.117.50 -> 172.31.8.238 TCP 27578 [TCP segment of a reassembled PDU]
213   0.023081 54.230.117.50 -> 172.31.8.238 TCP 26130 [TCP segment of a reassembled PDU]
214   0.023104 172.31.8.238 -> 54.230.117.50 TCP 66 51434 > http [ACK] Seq=98 Ack=1555153 Win=1506688 Len=0 TSval=6964849 TSecr=1685141716
215   0.023145 54.230.117.50 -> 172.31.8.238 TCP 26130 [TCP segment of a reassembled PDU]
216   0.023158 172.31.8.238 -> 54.230.117.50 TCP 66 51434 > http [ACK] Seq=98 Ack=1581217 Win=1552000 Len=0 TSval=6964849 TSecr=1685141716
217   0.023518 54.230.117.50 -> 172.31.8.238 TCP 5858 [TCP segment of a reassembled PDU]
218   0.023525 172.31.8.238 -> 54.230.117.50 TCP 66 51434 > http [ACK] Seq=98 Ack=1587009 Win=1585280 Len=0 TSval=6964850 TSecr=1685141716
219   0.023696 54.230.117.50 -> 172.31.8.238 TCP 26130 [TCP segment of a reassembled PDU]
220   0.023710 172.31.8.238 -> 54.230.117.50 TCP 66 51434 > http [ACK] Seq=98 Ack=1613073 Win=1587840 Len=0 TSval=6964850 TSecr=1685141716
221   0.023767 54.230.117.50 -> 172.31.8.238 TCP 26130 [TCP segment of a reassembled PDU]
222   0.023781 172.31.8.238 -> 54.230.117.50 TCP 66 51434 > http [ACK] Seq=98 Ack=1639137 Win=1587840 Len=0 TSval=6964850 TSecr=1685141716
223   0.023837 54.230.117.50 -> 172.31.8.238 TCP 7306 [TCP segment of a reassembled PDU]
224   0.023844 172.31.8.238 -> 54.230.117.50 TCP 66 51434 > http [ACK] Seq=98 Ack=1646377 Win=1587840 Len=0 TSval=6964850 TSecr=1685141716
225   0.023940 54.230.117.50 -> 172.31.8.238 TCP 26130 [TCP segment of a reassembled PDU]
226   0.023953 172.31.8.238 -> 54.230.117.50 TCP 66 51434 > http [ACK] Seq=98 Ack=1672441 Win=1587840 Len=0 TSval=6964850 TSecr=1685141716
227   0.024022 54.230.117.50 -> 172.31.8.238 TCP 26130 [TCP segment of a reassembled PDU]
228   0.024036 172.31.8.238 -> 54.230.117.50 TCP 66 51434 > http [ACK] Seq=98 Ack=1698505 Win=1587840 Len=0 TSval=6964850 TSecr=1685141716
229   0.024076 54.230.117.50 -> 172.31.8.238 TCP 13098 [TCP segment of a reassembled PDU]
230   0.024085 172.31.8.238 -> 54.230.117.50 TCP 66 51434 > http [ACK] Seq=98 Ack=1711537 Win=1587840 Len=0 TSval=6964850 TSecr=1685141716
231   0.024490 54.230.117.50 -> 172.31.8.238 TCP 5858 [TCP segment of a reassembled PDU]
232   0.024497 172.31.8.238 -> 54.230.117.50 TCP 66 51434 > http [ACK] Seq=98 Ack=1717329 Win=1587840 Len=0 TSval=6964850 TSecr=1685141716
233   0.024652 54.230.117.50 -> 172.31.8.238 TCP 17442 [TCP segment of a reassembled PDU]
234   0.024663 172.31.8.238 -> 54.230.117.50 TCP 66 51434 > http [ACK] Seq=98 Ack=1734705 Win=1587840 Len=0 TSval=6964850 TSecr=1685141716
235   0.024683 54.230.117.50 -> 172.31.8.238 TCP 8754 [TCP segment of a reassembled PDU]
236   0.024689 172.31.8.238 -> 54.230.117.50 TCP 66 51434 > http [ACK] Seq=98 Ack=1743393 Win=1587840 Len=0 TSval=6964850 TSecr=1685141716
237   0.024772 54.230.117.50 -> 172.31.8.238 TCP 26130 [TCP segment of a reassembled PDU]
238   0.024785 172.31.8.238 -> 54.230.117.50 TCP 66 51434 > http [ACK] Seq=98 Ack=1769457 Win=1587840 Len=0 TSval=6964850 TSecr=1685141716
239   0.024857 54.230.117.50 -> 172.31.8.238 TCP 26130 [TCP segment of a reassembled PDU]
240   0.024871 172.31.8.238 -> 54.230.117.50 TCP 66 51434 > http [ACK] Seq=98 Ack=1795521 Win=1587840 Len=0 TSval=6964850 TSecr=1685141716
241   0.024932 54.230.117.50 -> 172.31.8.238 TCP 26130 [TCP segment of a reassembled PDU]
242   0.024946 172.31.8.238 -> 54.230.117.50 TCP 66 51434 > http [ACK] Seq=98 Ack=1821585 Win=1587840 Len=0 TSval=6964850 TSecr=1685141716
243   0.024989 54.230.117.50 -> 172.31.8.238 TCP 20338 [TCP segment of a reassembled PDU]
244   0.024999 172.31.8.238 -> 54.230.117.50 TCP 66 51434 > http [ACK] Seq=98 Ack=1841857 Win=1587840 Len=0 TSval=6964850 TSecr=1685141716
245   0.025272 54.230.117.50 -> 172.31.8.238 TCP 26130 [TCP segment of a reassembled PDU]
246   0.025286 172.31.8.238 -> 54.230.117.50 TCP 66 51434 > http [ACK] Seq=98 Ack=1867921 Win=1587840 Len=0 TSval=6964850 TSecr=1685141716
247   0.025352 54.230.117.50 -> 172.31.8.238 TCP 26130 [TCP segment of a reassembled PDU]
248   0.025365 172.31.8.238 -> 54.230.117.50 TCP 66 51434 > http [ACK] Seq=98 Ack=1893985 Win=1587840 Len=0 TSval=6964850 TSecr=1685141716
249   0.025411 54.230.117.50 -> 172.31.8.238 TCP 13098 [TCP segment of a reassembled PDU]
250   0.025420 172.31.8.238 -> 54.230.117.50 TCP 66 51434 > http [ACK] Seq=98 Ack=1907017 Win=1587840 Len=0 TSval=6964850 TSecr=1685141716
251   0.025736 54.230.117.50 -> 172.31.8.238 TCP 23234 [TCP segment of a reassembled PDU]
252   0.025744 172.31.8.238 -> 54.230.117.50 TCP 66 51434 > http [ACK] Seq=98 Ack=1930185 Win=1587840 Len=0 TSval=6964850 TSecr=1685141716
253   0.025885 54.230.117.50 -> 172.31.8.238 TCP 26130 [TCP segment of a reassembled PDU]
254   0.025892 172.31.8.238 -> 54.230.117.50 TCP 66 51434 > http [ACK] Seq=98 Ack=1956249 Win=1587840 Len=0 TSval=6964850 TSecr=1685141716
255   0.026005 54.230.117.50 -> 172.31.8.238 TCP 24682 [TCP segment of a reassembled PDU]
256   0.026013 172.31.8.238 -> 54.230.117.50 TCP 66 51434 > http [ACK] Seq=98 Ack=1980865 Win=1587840 Len=0 TSval=6964850 TSecr=1685141716
257   0.026037 54.230.117.50 -> 172.31.8.238 TCP 26130 [TCP segment of a reassembled PDU]
258   0.026042 172.31.8.238 -> 54.230.117.50 TCP 66 51434 > http [ACK] Seq=98 Ack=2006929 Win=1587840 Len=0 TSval=6964850 TSecr=1685141716
259   0.026135 54.230.117.50 -> 172.31.8.238 TCP 26130 [TCP segment of a reassembled PDU]
260   0.026143 172.31.8.238 -> 54.230.117.50 TCP 66 51434 > http [ACK] Seq=98 Ack=2032993 Win=1587840 Len=0 TSval=6964850 TSecr=1685141716
261   0.026190 54.230.117.50 -> 172.31.8.238 TCP 4410 [TCP segment of a reassembled PDU]
262   0.026194 172.31.8.238 -> 54.230.117.50 TCP 66 51434 > http [ACK] Seq=98 Ack=2037337 Win=1587840 Len=0 TSval=6964850 TSecr=1685141716
263   0.026465 54.230.117.50 -> 172.31.8.238 TCP 24682 [TCP segment of a reassembled PDU]
264   0.026473 172.31.8.238 -> 54.230.117.50 TCP 66 51434 > http [ACK] Seq=98 Ack=2061953 Win=1587840 Len=0 TSval=6964850 TSecr=1685141716
265   0.026626 54.230.117.50 -> 172.31.8.238 TCP 26130 [TCP segment of a reassembled PDU]
266   0.026633 172.31.8.238 -> 54.230.117.50 TCP 66 51434 > http [ACK] Seq=98 Ack=2088017 Win=1587840 Len=0 TSval=6964850 TSecr=1685141716
267   0.026692 54.230.117.50 -> 172.31.8.238 TCP 26130 [TCP segment of a reassembled PDU]
268   0.026699 172.31.8.238 -> 54.230.117.50 TCP 66 51434 > http [ACK] Seq=98 Ack=2114081 Win=1587840 Len=0 TSval=6964850 TSecr=1685141716
269   0.026781 54.230.117.50 -> 172.31.8.238 TCP 26130 [TCP segment of a reassembled PDU]
270   0.026788 172.31.8.238 -> 54.230.117.50 TCP 66 51434 > http [ACK] Seq=98 Ack=2140145 Win=1587840 Len=0 TSval=6964850 TSecr=1685141716
271   0.026911 54.230.117.50 -> 172.31.8.238 TCP 27578 [TCP segment of a reassembled PDU]
272   0.026919 172.31.8.238 -> 54.230.117.50 TCP 66 51434 > http [ACK] Seq=98 Ack=2167657 Win=1587840 Len=0 TSval=6964850 TSecr=1685141716
273   0.027119 54.230.117.50 -> 172.31.8.238 TCP 26130 [TCP segment of a reassembled PDU]
274   0.027127 172.31.8.238 -> 54.230.117.50 TCP 66 51434 > http [ACK] Seq=98 Ack=2193721 Win=1587840 Len=0 TSval=6964850 TSecr=1685141716
275   0.027233 54.230.117.50 -> 172.31.8.238 TCP 26130 [TCP segment of a reassembled PDU]
276   0.027241 172.31.8.238 -> 54.230.117.50 TCP 66 51434 > http [ACK] Seq=98 Ack=2219785 Win=1587840 Len=0 TSval=6964850 TSecr=1685141716
277   0.027307 54.230.117.50 -> 172.31.8.238 TCP 13098 [TCP segment of a reassembled PDU]
278   0.027313 172.31.8.238 -> 54.230.117.50 TCP 66 51434 > http [ACK] Seq=98 Ack=2232817 Win=1587840 Len=0 TSval=6964850 TSecr=1685141716
279   0.027325 54.230.117.50 -> 172.31.8.238 TCP 15994 [TCP segment of a reassembled PDU]
280   0.027329 172.31.8.238 -> 54.230.117.50 TCP 66 51434 > http [ACK] Seq=98 Ack=2248745 Win=1587840 Len=0 TSval=6964850 TSecr=1685141716
281   0.027508 54.230.117.50 -> 172.31.8.238 TCP 33370 [TCP segment of a reassembled PDU]
282   0.027517 172.31.8.238 -> 54.230.117.50 TCP 66 51434 > http [ACK] Seq=98 Ack=2282049 Win=1587840 Len=0 TSval=6964851 TSecr=1685141716
283   0.027539 54.230.117.50 -> 172.31.8.238 TCP 15994 [TCP segment of a reassembled PDU]
284   0.027544 172.31.8.238 -> 54.230.117.50 TCP 66 51434 > http [ACK] Seq=98 Ack=2297977 Win=1587840 Len=0 TSval=6964851 TSecr=1685141716
285   0.027611 54.230.117.50 -> 172.31.8.238 TCP 18890 [TCP segment of a reassembled PDU]
286   0.027617 172.31.8.238 -> 54.230.117.50 TCP 66 51434 > http [ACK] Seq=98 Ack=2316801 Win=1587840 Len=0 TSval=6964851 TSecr=1685141716
287   0.027705 54.230.117.50 -> 172.31.8.238 TCP 26130 [TCP segment of a reassembled PDU]
288   0.027712 172.31.8.238 -> 54.230.117.50 TCP 66 51434 > http [ACK] Seq=98 Ack=2342865 Win=1587840 Len=0 TSval=6964851 TSecr=1685141716
289   0.027779 54.230.117.50 -> 172.31.8.238 TCP 20338 [TCP segment of a reassembled PDU]
290   0.027785 172.31.8.238 -> 54.230.117.50 TCP 66 51434 > http [ACK] Seq=98 Ack=2363137 Win=1587840 Len=0 TSval=6964851 TSecr=1685141716
291   0.027866 54.230.117.50 -> 172.31.8.238 TCP 26130 [TCP segment of a reassembled PDU]
292   0.027873 172.31.8.238 -> 54.230.117.50 TCP 66 51434 > http [ACK] Seq=98 Ack=2389201 Win=1587840 Len=0 TSval=6964851 TSecr=1685141716
293   0.027947 54.230.117.50 -> 172.31.8.238 TCP 26130 [TCP segment of a reassembled PDU]
294   0.027953 172.31.8.238 -> 54.230.117.50 TCP 66 51434 > http [ACK] Seq=98 Ack=2415265 Win=1587840 Len=0 TSval=6964851 TSecr=1685141716
295   0.028005 54.230.117.50 -> 172.31.8.238 TCP 13098 [TCP segment of a reassembled PDU]
296   0.028010 172.31.8.238 -> 54.230.117.50 TCP 66 51434 > http [ACK] Seq=98 Ack=2428297 Win=1587840 Len=0 TSval=6964851 TSecr=1685141716
297   0.028264 54.230.117.50 -> 172.31.8.238 TCP 1514 [TCP segment of a reassembled PDU]
298   0.028433 54.230.117.50 -> 172.31.8.238 TCP 21786 [TCP segment of a reassembled PDU]
299   0.028441 172.31.8.238 -> 54.230.117.50 TCP 66 51434 > http [ACK] Seq=98 Ack=2451465 Win=1587840 Len=0 TSval=6964851 TSecr=1685141716
300   0.028565 54.230.117.50 -> 172.31.8.238 TCP 30474 [TCP segment of a reassembled PDU]
301   0.028573 172.31.8.238 -> 54.230.117.50 TCP 66 51434 > http [ACK] Seq=98 Ack=2481873 Win=1587840 Len=0 TSval=6964851 TSecr=1685141716
302   0.028590 54.230.117.50 -> 172.31.8.238 TCP 26130 [TCP segment of a reassembled PDU]
303   0.028598 172.31.8.238 -> 54.230.117.50 TCP 66 51434 > http [ACK] Seq=98 Ack=2507937 Win=1587840 Len=0 TSval=6964851 TSecr=1685141716
304   0.028686 54.230.117.50 -> 172.31.8.238 TCP 26130 [TCP segment of a reassembled PDU]
305   0.028692 172.31.8.238 -> 54.230.117.50 TCP 66 51434 > http [ACK] Seq=98 Ack=2534001 Win=1587840 Len=0 TSval=6964851 TSecr=1685141716
306   0.028765 54.230.117.50 -> 172.31.8.238 TCP 26130 [TCP segment of a reassembled PDU]
307   0.028771 172.31.8.238 -> 54.230.117.50 TCP 66 51434 > http [ACK] Seq=98 Ack=2560065 Win=1587840 Len=0 TSval=6964851 TSecr=1685141716
308   0.028844 54.230.117.50 -> 172.31.8.238 TCP 26130 [TCP segment of a reassembled PDU]
309   0.028850 172.31.8.238 -> 54.230.117.50 TCP 66 51434 > http [ACK] Seq=98 Ack=2586129 Win=1587840 Len=0 TSval=6964851 TSecr=1685141716
310   0.028942 54.230.117.50 -> 172.31.8.238 TCP 26130 [TCP segment of a reassembled PDU]
311   0.028962 172.31.8.238 -> 54.230.117.50 TCP 66 51434 > http [ACK] Seq=98 Ack=2612193 Win=1587840 Len=0 TSval=6964851 TSecr=1685141716
312   0.029004 54.230.117.50 -> 172.31.8.238 TCP 11650 [TCP segment of a reassembled PDU]
313   0.029009 172.31.8.238 -> 54.230.117.50 TCP 66 51434 > http [ACK] Seq=98 Ack=2623777 Win=1587840 Len=0 TSval=6964851 TSecr=1685141716
314   0.029174 54.230.117.50 -> 172.31.8.238 TCP 26130 [TCP segment of a reassembled PDU]
315   0.029182 172.31.8.238 -> 54.230.117.50 TCP 66 51434 > http [ACK] Seq=98 Ack=2649841 Win=1587840 Len=0 TSval=6964851 TSecr=1685141716
316   0.029266 54.230.117.50 -> 172.31.8.238 TCP 24682 [TCP segment of a reassembled PDU]
317   0.029273 172.31.8.238 -> 54.230.117.50 TCP 66 51434 > http [ACK] Seq=98 Ack=2674457 Win=1587840 Len=0 TSval=6964851 TSecr=1685141716
318   0.029343 54.230.117.50 -> 172.31.8.238 TCP 14546 [TCP segment of a reassembled PDU]
319   0.029349 172.31.8.238 -> 54.230.117.50 TCP 66 51434 > http [ACK] Seq=98 Ack=2688937 Win=1587840 Len=0 TSval=6964851 TSecr=1685141716
320   0.029407 54.230.117.50 -> 172.31.8.238 TCP 14546 [TCP segment of a reassembled PDU]
321   0.029413 172.31.8.238 -> 54.230.117.50 TCP 66 51434 > http [ACK] Seq=98 Ack=2703417 Win=1587840 Len=0 TSval=6964851 TSecr=1685141716
322   0.029546 54.230.117.50 -> 172.31.8.238 TCP 26130 [TCP segment of a reassembled PDU]
323   0.029553 172.31.8.238 -> 54.230.117.50 TCP 66 51434 > http [ACK] Seq=98 Ack=2729481 Win=1587840 Len=0 TSval=6964851 TSecr=1685141716
324   0.029562 54.230.117.50 -> 172.31.8.238 TCP 7306 [TCP segment of a reassembled PDU]
325   0.029564 172.31.8.238 -> 54.230.117.50 TCP 66 51434 > http [ACK] Seq=98 Ack=2736721 Win=1587840 Len=0 TSval=6964851 TSecr=1685141716
326   0.029587 54.230.117.50 -> 172.31.8.238 TCP 17442 [TCP segment of a reassembled PDU]
327   0.029592 172.31.8.238 -> 54.230.117.50 TCP 66 51434 > http [ACK] Seq=98 Ack=2754097 Win=1587840 Len=0 TSval=6964851 TSecr=1685141716
328   0.029702 54.230.117.50 -> 172.31.8.238 TCP 14546 [TCP segment of a reassembled PDU]
329   0.029707 172.31.8.238 -> 54.230.117.50 TCP 66 51434 > http [ACK] Seq=98 Ack=2768577 Win=1587840 Len=0 TSval=6964851 TSecr=1685141716
330   0.029787 54.230.117.50 -> 172.31.8.238 TCP 23234 [TCP segment of a reassembled PDU]
331   0.029793 172.31.8.238 -> 54.230.117.50 TCP 66 51434 > http [ACK] Seq=98 Ack=2791745 Win=1587840 Len=0 TSval=6964851 TSecr=1685141716
332   0.029836 54.230.117.50 -> 172.31.8.238 TCP 2962 [TCP segment of a reassembled PDU]
333   0.029840 172.31.8.238 -> 54.230.117.50 TCP 66 51434 > http [ACK] Seq=98 Ack=2794641 Win=1587840 Len=0 TSval=6964851 TSecr=1685141716
334   0.029942 54.230.117.50 -> 172.31.8.238 TCP 39162 [TCP segment of a reassembled PDU]
335   0.029951 172.31.8.238 -> 54.230.117.50 TCP 66 51434 > http [ACK] Seq=98 Ack=2833737 Win=1587840 Len=0 TSval=6964851 TSecr=1685141716
336   0.030011 54.230.117.50 -> 172.31.8.238 TCP 20338 [TCP segment of a reassembled PDU]
337   0.030017 172.31.8.238 -> 54.230.117.50 TCP 66 51434 > http [ACK] Seq=98 Ack=2854009 Win=1587840 Len=0 TSval=6964851 TSecr=1685141716
338   0.030098 54.230.117.50 -> 172.31.8.238 TCP 30474 [TCP segment of a reassembled PDU]
339   0.030105 172.31.8.238 -> 54.230.117.50 TCP 66 51434 > http [ACK] Seq=98 Ack=2884417 Win=1587840 Len=0 TSval=6964851 TSecr=1685141716
340   0.030143 54.230.117.50 -> 172.31.8.238 TCP 8754 [TCP segment of a reassembled PDU]
341   0.030147 172.31.8.238 -> 54.230.117.50 TCP 66 51434 > http [ACK] Seq=98 Ack=2893105 Win=1587840 Len=0 TSval=6964851 TSecr=1685141716
342   0.030283 54.230.117.50 -> 172.31.8.238 TCP 23234 [TCP segment of a reassembled PDU]
343   0.030291 172.31.8.238 -> 54.230.117.50 TCP 66 51434 > http [ACK] Seq=98 Ack=2916273 Win=1587840 Len=0 TSval=6964851 TSecr=1685141716
344   0.030393 54.230.117.50 -> 172.31.8.238 TCP 33370 [TCP segment of a reassembled PDU]
345   0.030400 172.31.8.238 -> 54.230.117.50 TCP 66 51434 > http [ACK] Seq=98 Ack=2949577 Win=1587840 Len=0 TSval=6964851 TSecr=1685141716
346   0.030432 54.230.117.50 -> 172.31.8.238 TCP 26130 [TCP segment of a reassembled PDU]
347   0.030437 172.31.8.238 -> 54.230.117.50 TCP 66 51434 > http [ACK] Seq=98 Ack=2975641 Win=1587840 Len=0 TSval=6964851 TSecr=1685141717
348   0.030576 54.230.117.50 -> 172.31.8.238 TCP 39162 [TCP segment of a reassembled PDU]
349   0.030583 172.31.8.238 -> 54.230.117.50 TCP 66 51434 > http [ACK] Seq=98 Ack=3014737 Win=1587840 Len=0 TSval=6964851 TSecr=1685141717
350   0.030637 54.230.117.50 -> 172.31.8.238 TCP 23234 [TCP segment of a reassembled PDU]
351   0.030642 172.31.8.238 -> 54.230.117.50 TCP 66 51434 > http [ACK] Seq=98 Ack=3037905 Win=1587840 Len=0 TSval=6964851 TSecr=1685141717
