[Measurement for 10mb at 18:44:51 19.44.2014] 
Tshark:

  1   0.000000 85.76.134.238 -> 172.31.8.238 SSH 102 Encrypted request packet len=48
  2   0.003743 172.31.8.238 -> 85.76.134.238 SSH 118 Encrypted response packet len=64
  3   0.153222 85.76.134.238 -> 172.31.8.238 TCP 54 29664 > ssh [ACK] Seq=49 Ack=49 Win=257 Len=0
  4   0.377218 85.76.134.238 -> 172.31.8.238 TCP 54 29664 > ssh [ACK] Seq=49 Ack=113 Win=256 Len=0
  5   0.960417 85.76.134.238 -> 172.31.8.238 SSH 102 Encrypted request packet len=48
  6   0.961710 172.31.8.238 -> 85.76.134.238 SSH 118 Encrypted response packet len=64
  7   0.961863 172.31.8.238 -> 85.76.134.238 SSH 134 Encrypted response packet len=80
  8   1.303054 85.76.134.238 -> 172.31.8.238 TCP 54 29664 > ssh [ACK] Seq=97 Ack=257 Win=256 Len=0
  9   1.722202 172.31.8.238 -> 172.31.0.2   DNS 89 Standard query 0x17e4  A d3m1c4hwkgedal.cloudfront.net
 10   1.722243 172.31.8.238 -> 172.31.0.2   DNS 89 Standard query 0x4cdd  AAAA d3m1c4hwkgedal.cloudfront.net
 11   1.722848   172.31.0.2 -> 172.31.8.238 DNS 217 Standard query response 0x17e4  A 54.230.117.154 A 54.230.117.238 A 54.230.119.66 A 54.230.119.110 A 54.239.132.41 A 54.239.132.86 A 54.239.132.250 A 54.230.117.50
 12   1.722861   172.31.0.2 -> 172.31.8.238 DNS 174 Standard query response 0x4cdd 
 13   1.726067 172.31.8.238 -> 54.230.117.154 TCP 74 41679 > http [SYN] Seq=0 Win=26883 Len=0 MSS=8961 SACK_PERM=1 TSval=1579727 TSecr=0 WS=128
 14   1.726899 54.230.117.154 -> 172.31.8.238 TCP 74 http > 41679 [SYN, ACK] Seq=0 Ack=1 Win=14480 Len=0 MSS=1460 SACK_PERM=1 TSval=1680643435 TSecr=1579727 WS=128
 15   1.726914 172.31.8.238 -> 54.230.117.154 TCP 66 41679 > http [ACK] Seq=1 Ack=1 Win=27008 Len=0 TSval=1579727 TSecr=1680643435
 16   1.726954 172.31.8.238 -> 54.230.117.154 HTTP 163 GET /10mb HTTP/1.1 
 17   1.727409 54.230.117.154 -> 172.31.8.238 TCP 66 http > 41679 [ACK] Seq=1 Ack=98 Win=14592 Len=0 TSval=1680643435 TSecr=1579727
 18   2.032870 54.230.117.154 -> 172.31.8.238 TCP 13517 [TCP segment of a reassembled PDU]
 19   2.032917 172.31.8.238 -> 54.230.117.154 TCP 66 41679 > http [ACK] Seq=98 Ack=13452 Win=53888 Len=0 TSval=1579804 TSecr=1680643465
 20   2.144340 54.230.117.154 -> 172.31.8.238 TCP 2962 [TCP segment of a reassembled PDU]
 21   2.144367 172.31.8.238 -> 54.230.117.154 TCP 66 41679 > http [ACK] Seq=98 Ack=16348 Win=59648 Len=0 TSval=1579831 TSecr=1680643476
 22   2.144387 54.230.117.154 -> 172.31.8.238 TCP 90 [TCP segment of a reassembled PDU]
 23   2.144390 172.31.8.238 -> 54.230.117.154 TCP 66 41679 > http [ACK] Seq=98 Ack=16372 Win=59648 Len=0 TSval=1579831 TSecr=1680643476
 24   2.145545 54.230.117.154 -> 172.31.8.238 TCP 2962 [TCP segment of a reassembled PDU]
 25   2.145554 172.31.8.238 -> 54.230.117.154 TCP 66 41679 > http [ACK] Seq=98 Ack=19268 Win=65408 Len=0 TSval=1579832 TSecr=1680643477
 26   2.145582 54.230.117.154 -> 172.31.8.238 TCP 90 [TCP segment of a reassembled PDU]
 27   2.145586 172.31.8.238 -> 54.230.117.154 TCP 66 41679 > http [ACK] Seq=98 Ack=19292 Win=65408 Len=0 TSval=1579832 TSecr=1680643477
 28   2.145649 54.230.117.154 -> 172.31.8.238 TCP 1526 [TCP segment of a reassembled PDU]
 29   2.145654 172.31.8.238 -> 54.230.117.154 TCP 66 41679 > http [ACK] Seq=98 Ack=20752 Win=68352 Len=0 TSval=1579832 TSecr=1680643477
 30   2.145762 54.230.117.154 -> 172.31.8.238 TCP 1526 [TCP segment of a reassembled PDU]
 31   2.145767 172.31.8.238 -> 54.230.117.154 TCP 66 41679 > http [ACK] Seq=98 Ack=22212 Win=71296 Len=0 TSval=1579832 TSecr=1680643477
 32   2.147051 54.230.117.154 -> 172.31.8.238 TCP 1526 [TCP segment of a reassembled PDU]
 33   2.147057 172.31.8.238 -> 54.230.117.154 TCP 66 41679 > http [ACK] Seq=98 Ack=23672 Win=74240 Len=0 TSval=1579832 TSecr=1680643477
 34   2.147137 54.230.117.154 -> 172.31.8.238 TCP 1526 [TCP segment of a reassembled PDU]
 35   2.147142 172.31.8.238 -> 54.230.117.154 TCP 66 41679 > http [ACK] Seq=98 Ack=25132 Win=77056 Len=0 TSval=1579832 TSecr=1680643477
 36   2.148161 54.230.117.154 -> 172.31.8.238 TCP 1526 [TCP segment of a reassembled PDU]
 37   2.148167 172.31.8.238 -> 54.230.117.154 TCP 66 41679 > http [ACK] Seq=98 Ack=26592 Win=80000 Len=0 TSval=1579832 TSecr=1680643477
 38   2.148411 54.230.117.154 -> 172.31.8.238 TCP 1526 [TCP segment of a reassembled PDU]
 39   2.148416 172.31.8.238 -> 54.230.117.154 TCP 66 41679 > http [ACK] Seq=98 Ack=28052 Win=82944 Len=0 TSval=1579832 TSecr=1680643477
 40   2.149958 54.230.117.154 -> 172.31.8.238 TCP 1526 [TCP segment of a reassembled PDU]
 41   2.149964 172.31.8.238 -> 54.230.117.154 TCP 66 41679 > http [ACK] Seq=98 Ack=29512 Win=85888 Len=0 TSval=1579833 TSecr=1680643477
 42   2.150000 54.230.117.154 -> 172.31.8.238 TCP 1526 [TCP segment of a reassembled PDU]
 43   2.150005 172.31.8.238 -> 54.230.117.154 TCP 66 41679 > http [ACK] Seq=98 Ack=30972 Win=88832 Len=0 TSval=1579833 TSecr=1680643477
 44   2.150986 54.230.117.154 -> 172.31.8.238 TCP 2962 [TCP segment of a reassembled PDU]
 45   2.150992 172.31.8.238 -> 54.230.117.154 TCP 66 41679 > http [ACK] Seq=98 Ack=33868 Win=94592 Len=0 TSval=1579833 TSecr=1680643477
 46   2.151016 54.230.117.154 -> 172.31.8.238 TCP 90 [TCP segment of a reassembled PDU]
 47   2.151019 172.31.8.238 -> 54.230.117.154 TCP 66 41679 > http [ACK] Seq=98 Ack=33892 Win=94592 Len=0 TSval=1579833 TSecr=1680643477
 48   2.152276 54.230.117.154 -> 172.31.8.238 TCP 1526 [TCP segment of a reassembled PDU]
 49   2.152280 172.31.8.238 -> 54.230.117.154 TCP 66 41679 > http [ACK] Seq=98 Ack=35352 Win=97536 Len=0 TSval=1579833 TSecr=1680643477
 50   2.152530 54.230.117.154 -> 172.31.8.238 TCP 1526 [TCP segment of a reassembled PDU]
 51   2.152535 172.31.8.238 -> 54.230.117.154 TCP 66 41679 > http [ACK] Seq=98 Ack=36812 Win=100480 Len=0 TSval=1579833 TSecr=1680643477
 52   2.153799 54.230.117.154 -> 172.31.8.238 TCP 2962 [TCP segment of a reassembled PDU]
 53   2.153805 172.31.8.238 -> 54.230.117.154 TCP 66 41679 > http [ACK] Seq=98 Ack=39708 Win=106240 Len=0 TSval=1579834 TSecr=1680643477
 54   2.153831 54.230.117.154 -> 172.31.8.238 TCP 90 [TCP segment of a reassembled PDU]
 55   2.153835 172.31.8.238 -> 54.230.117.154 TCP 66 41679 > http [ACK] Seq=98 Ack=39732 Win=106240 Len=0 TSval=1579834 TSecr=1680643477
 56   2.155069 54.230.117.154 -> 172.31.8.238 TCP 1526 [TCP segment of a reassembled PDU]
 57   2.155074 172.31.8.238 -> 54.230.117.154 TCP 66 41679 > http [ACK] Seq=98 Ack=41192 Win=109056 Len=0 TSval=1579834 TSecr=1680643478
 58   2.155155 54.230.117.154 -> 172.31.8.238 TCP 1526 [TCP segment of a reassembled PDU]
 59   2.155159 172.31.8.238 -> 54.230.117.154 TCP 66 41679 > http [ACK] Seq=98 Ack=42652 Win=109056 Len=0 TSval=1579834 TSecr=1680643478
 60   2.156313 54.230.117.154 -> 172.31.8.238 TCP 1526 [TCP segment of a reassembled PDU]
 61   2.156318 172.31.8.238 -> 54.230.117.154 TCP 66 41679 > http [ACK] Seq=98 Ack=44112 Win=109056 Len=0 TSval=1579834 TSecr=1680643478
 62   2.156451 54.230.117.154 -> 172.31.8.238 TCP 1526 [TCP segment of a reassembled PDU]
 63   2.156455 172.31.8.238 -> 54.230.117.154 TCP 66 41679 > http [ACK] Seq=98 Ack=45572 Win=109056 Len=0 TSval=1579834 TSecr=1680643478
 64   2.256970 54.230.117.154 -> 172.31.8.238 TCP 1526 [TCP segment of a reassembled PDU]
 65   2.257007 172.31.8.238 -> 54.230.117.154 TCP 66 41679 > http [ACK] Seq=98 Ack=47032 Win=109056 Len=0 TSval=1579860 TSecr=1680643488
 66   2.257029 54.230.117.154 -> 172.31.8.238 TCP 10202 [TCP segment of a reassembled PDU]
 67   2.257067 54.230.117.154 -> 172.31.8.238 TCP 150 [TCP segment of a reassembled PDU]
 68   2.257102 172.31.8.238 -> 54.230.117.154 TCP 66 41679 > http [ACK] Seq=98 Ack=57252 Win=109056 Len=0 TSval=1579860 TSecr=1680643488
 69   2.257746 54.230.117.154 -> 172.31.8.238 TCP 2962 [TCP segment of a reassembled PDU]
 70   2.257753 172.31.8.238 -> 54.230.117.154 TCP 66 41679 > http [ACK] Seq=98 Ack=60148 Win=114816 Len=0 TSval=1579860 TSecr=1680643488
 71   2.257759 54.230.117.154 -> 172.31.8.238 TCP 90 [TCP segment of a reassembled PDU]
 72   2.257780 172.31.8.238 -> 54.230.117.154 TCP 66 41679 > http [ACK] Seq=98 Ack=60172 Win=114816 Len=0 TSval=1579860 TSecr=1680643488
 73   2.258210 54.230.117.154 -> 172.31.8.238 TCP 2962 [TCP segment of a reassembled PDU]
 74   2.258216 172.31.8.238 -> 54.230.117.154 TCP 66 41679 > http [ACK] Seq=98 Ack=63068 Win=120704 Len=0 TSval=1579860 TSecr=1680643488
 75   2.258240 54.230.117.154 -> 172.31.8.238 TCP 90 [TCP segment of a reassembled PDU]
 76   2.258249 172.31.8.238 -> 54.230.117.154 TCP 66 41679 > http [ACK] Seq=98 Ack=63092 Win=120704 Len=0 TSval=1579860 TSecr=1680643488
 77   2.261435 54.230.117.154 -> 172.31.8.238 TCP 2962 [TCP segment of a reassembled PDU]
 78   2.261441 172.31.8.238 -> 54.230.117.154 TCP 66 41679 > http [ACK] Seq=98 Ack=65988 Win=126464 Len=0 TSval=1579861 TSecr=1680643488
 79   2.261470 54.230.117.154 -> 172.31.8.238 TCP 2962 [TCP segment of a reassembled PDU]
 80   2.261475 172.31.8.238 -> 54.230.117.154 TCP 66 41679 > http [ACK] Seq=98 Ack=68884 Win=132224 Len=0 TSval=1579861 TSecr=1680643488
 81   2.261530 54.230.117.154 -> 172.31.8.238 TCP 114 [TCP segment of a reassembled PDU]
 82   2.261546 172.31.8.238 -> 54.230.117.154 TCP 66 41679 > http [ACK] Seq=98 Ack=68932 Win=132224 Len=0 TSval=1579861 TSecr=1680643488
 83   2.262198 54.230.117.154 -> 172.31.8.238 TCP 1526 [TCP segment of a reassembled PDU]
 84   2.262203 172.31.8.238 -> 54.230.117.154 TCP 66 41679 > http [ACK] Seq=98 Ack=70392 Win=135168 Len=0 TSval=1579861 TSecr=1680643488
 85   2.262289 54.230.117.154 -> 172.31.8.238 TCP 1526 [TCP segment of a reassembled PDU]
 86   2.262293 172.31.8.238 -> 54.230.117.154 TCP 66 41679 > http [ACK] Seq=98 Ack=71852 Win=138112 Len=0 TSval=1579861 TSecr=1680643488
 87   2.263492 54.230.117.154 -> 172.31.8.238 TCP 2962 [TCP segment of a reassembled PDU]
 88   2.263497 172.31.8.238 -> 54.230.117.154 TCP 66 41679 > http [ACK] Seq=98 Ack=74748 Win=143872 Len=0 TSval=1579861 TSecr=1680643488
 89   2.263520 54.230.117.154 -> 172.31.8.238 TCP 90 [TCP segment of a reassembled PDU]
 90   2.263529 172.31.8.238 -> 54.230.117.154 TCP 66 41679 > http [ACK] Seq=98 Ack=74772 Win=143872 Len=0 TSval=1579861 TSecr=1680643488
 91   2.264753 54.230.117.154 -> 172.31.8.238 TCP 2962 [TCP segment of a reassembled PDU]
 92   2.264758 172.31.8.238 -> 54.230.117.154 TCP 66 41679 > http [ACK] Seq=98 Ack=77668 Win=149632 Len=0 TSval=1579862 TSecr=1680643489
 93   2.264789 54.230.117.154 -> 172.31.8.238 TCP 90 [TCP segment of a reassembled PDU]
 94   2.264806 172.31.8.238 -> 54.230.117.154 TCP 66 41679 > http [ACK] Seq=98 Ack=77692 Win=149632 Len=0 TSval=1579862 TSecr=1680643489
 95   2.266295 54.230.117.154 -> 172.31.8.238 TCP 1526 [TCP segment of a reassembled PDU]
 96   2.266300 172.31.8.238 -> 54.230.117.154 TCP 66 41679 > http [ACK] Seq=98 Ack=79152 Win=152576 Len=0 TSval=1579862 TSecr=1680643489
 97   2.266382 54.230.117.154 -> 172.31.8.238 TCP 1526 [TCP segment of a reassembled PDU]
 98   2.266387 172.31.8.238 -> 54.230.117.154 TCP 66 41679 > http [ACK] Seq=98 Ack=80612 Win=155520 Len=0 TSval=1579862 TSecr=1680643489
 99   2.267563 54.230.117.154 -> 172.31.8.238 TCP 1514 [TCP segment of a reassembled PDU]
100   2.267569 172.31.8.238 -> 54.230.117.154 TCP 66 41679 > http [ACK] Seq=98 Ack=82060 Win=158336 Len=0 TSval=1579862 TSecr=1680643489
101   2.267615 54.230.117.154 -> 172.31.8.238 TCP 1538 [TCP segment of a reassembled PDU]
102   2.267620 172.31.8.238 -> 54.230.117.154 TCP 66 41679 > http [ACK] Seq=98 Ack=83532 Win=161280 Len=0 TSval=1579862 TSecr=1680643489
103   2.268802 54.230.117.154 -> 172.31.8.238 TCP 2962 [TCP segment of a reassembled PDU]
104   2.268808 172.31.8.238 -> 54.230.117.154 TCP 66 41679 > http [ACK] Seq=98 Ack=86428 Win=167168 Len=0 TSval=1579863 TSecr=1680643489
105   2.270832 54.230.117.154 -> 172.31.8.238 TCP 90 [TCP segment of a reassembled PDU]
106   2.270852 172.31.8.238 -> 54.230.117.154 TCP 66 41679 > http [ACK] Seq=98 Ack=86452 Win=167168 Len=0 TSval=1579863 TSecr=1680643489
107   2.369524 54.230.117.154 -> 172.31.8.238 TCP 5858 [TCP segment of a reassembled PDU]
108   2.369555 172.31.8.238 -> 54.230.117.154 TCP 66 41679 > http [ACK] Seq=98 Ack=92244 Win=178688 Len=0 TSval=1579888 TSecr=1680643499
109   2.369564 54.230.117.154 -> 172.31.8.238 TCP 90 [TCP segment of a reassembled PDU]
110   2.369609 54.230.117.154 -> 172.31.8.238 TCP 11650 [TCP segment of a reassembled PDU]
111   2.369643 172.31.8.238 -> 54.230.117.154 TCP 66 41679 > http [ACK] Seq=98 Ack=103852 Win=178688 Len=0 TSval=1579888 TSecr=1680643499
112   2.370242 54.230.117.154 -> 172.31.8.238 TCP 5858 [TCP segment of a reassembled PDU]
113   2.370250 172.31.8.238 -> 54.230.117.154 TCP 66 41679 > http [ACK] Seq=98 Ack=109644 Win=188672 Len=0 TSval=1579888 TSecr=1680643499
114   2.370352 54.230.117.154 -> 172.31.8.238 TCP 6074 [TCP segment of a reassembled PDU]
115   2.370376 172.31.8.238 -> 54.230.117.154 TCP 66 41679 > http [ACK] Seq=98 Ack=115652 Win=190336 Len=0 TSval=1579888 TSecr=1680643499
116   2.370739 54.230.117.154 -> 172.31.8.238 TCP 1526 [TCP segment of a reassembled PDU]
117   2.370744 172.31.8.238 -> 54.230.117.154 TCP 66 41679 > http [ACK] Seq=98 Ack=117112 Win=193152 Len=0 TSval=1579888 TSecr=1680643499
118   2.371019 54.230.117.154 -> 172.31.8.238 TCP 1526 [TCP segment of a reassembled PDU]
119   2.371024 172.31.8.238 -> 54.230.117.154 TCP 66 41679 > http [ACK] Seq=98 Ack=118572 Win=193408 Len=0 TSval=1579888 TSecr=1680643499
120   2.372014 54.230.117.154 -> 172.31.8.238 TCP 1514 [TCP segment of a reassembled PDU]
121   2.372066 54.230.117.154 -> 172.31.8.238 TCP 1538 [TCP segment of a reassembled PDU]
122   2.372071 172.31.8.238 -> 54.230.117.154 TCP 66 41679 > http [ACK] Seq=98 Ack=121492 Win=193408 Len=0 TSval=1579888 TSecr=1680643499
123   2.372164 54.230.117.154 -> 172.31.8.238 TCP 2986 [TCP segment of a reassembled PDU]
124   2.372182 172.31.8.238 -> 54.230.117.154 TCP 66 41679 > http [ACK] Seq=98 Ack=124412 Win=196096 Len=0 TSval=1579888 TSecr=1680643499
125   2.373808 54.230.117.154 -> 172.31.8.238 TCP 1514 [TCP segment of a reassembled PDU]
126   2.373865 54.230.117.154 -> 172.31.8.238 TCP 2962 [TCP segment of a reassembled PDU]
127   2.373900 54.230.117.154 -> 172.31.8.238 TCP 90 [TCP segment of a reassembled PDU]
128   2.373955 54.230.117.154 -> 172.31.8.238 TCP 1538 [TCP segment of a reassembled PDU]
129   2.374281 172.31.8.238 -> 54.230.117.154 TCP 66 41679 > http [ACK] Seq=98 Ack=130252 Win=196096 Len=0 TSval=1579889 TSecr=1680643499
130   2.374629 54.230.117.154 -> 172.31.8.238 TCP 1526 [TCP segment of a reassembled PDU]
131   2.374646 172.31.8.238 -> 54.230.117.154 TCP 66 41679 > http [ACK] Seq=98 Ack=131712 Win=196096 Len=0 TSval=1579889 TSecr=1680643500
132   2.374889 54.230.117.154 -> 172.31.8.238 TCP 1526 [TCP segment of a reassembled PDU]
133   2.374907 172.31.8.238 -> 54.230.117.154 TCP 66 41679 > http [ACK] Seq=98 Ack=133172 Win=196096 Len=0 TSval=1579889 TSecr=1680643500
134   2.375938 54.230.117.154 -> 172.31.8.238 TCP 2962 [TCP segment of a reassembled PDU]
135   2.375955 172.31.8.238 -> 54.230.117.154 TCP 66 41679 > http [ACK] Seq=98 Ack=136068 Win=196096 Len=0 TSval=1579889 TSecr=1680643500
136   2.375984 54.230.117.154 -> 172.31.8.238 TCP 90 [TCP segment of a reassembled PDU]
137   2.375999 172.31.8.238 -> 54.230.117.154 TCP 66 41679 > http [ACK] Seq=98 Ack=136092 Win=196096 Len=0 TSval=1579889 TSecr=1680643500
138   2.378407 54.230.117.154 -> 172.31.8.238 TCP 2986 [TCP segment of a reassembled PDU]
139   2.378441 172.31.8.238 -> 54.230.117.154 TCP 66 41679 > http [ACK] Seq=98 Ack=139012 Win=196096 Len=0 TSval=1579890 TSecr=1680643500
140   2.378860 54.230.117.154 -> 172.31.8.238 TCP 2962 [TCP segment of a reassembled PDU]
141   2.378867 172.31.8.238 -> 54.230.117.154 TCP 66 41679 > http [ACK] Seq=98 Ack=141908 Win=201984 Len=0 TSval=1579890 TSecr=1680643500
142   2.378881 54.230.117.154 -> 172.31.8.238 TCP 90 [TCP segment of a reassembled PDU]
143   2.378898 172.31.8.238 -> 54.230.117.154 TCP 66 41679 > http [ACK] Seq=98 Ack=141932 Win=201984 Len=0 TSval=1579890 TSecr=1680643500
144   2.380136 54.230.117.154 -> 172.31.8.238 TCP 2962 [TCP segment of a reassembled PDU]
145   2.380142 172.31.8.238 -> 54.230.117.154 TCP 66 41679 > http [ACK] Seq=98 Ack=144828 Win=207744 Len=0 TSval=1579890 TSecr=1680643500
146   2.380166 54.230.117.154 -> 172.31.8.238 TCP 90 [TCP segment of a reassembled PDU]
147   2.380178 172.31.8.238 -> 54.230.117.154 TCP 66 41679 > http [ACK] Seq=98 Ack=144852 Win=207744 Len=0 TSval=1579890 TSecr=1680643500
148   2.381149 54.230.117.154 -> 172.31.8.238 TCP 2962 [TCP segment of a reassembled PDU]
149   2.381155 172.31.8.238 -> 54.230.117.154 TCP 66 41679 > http [ACK] Seq=98 Ack=147748 Win=213504 Len=0 TSval=1579891 TSecr=1680643500
150   2.381177 54.230.117.154 -> 172.31.8.238 TCP 90 [TCP segment of a reassembled PDU]
151   2.381187 172.31.8.238 -> 54.230.117.154 TCP 66 41679 > http [ACK] Seq=98 Ack=147772 Win=213504 Len=0 TSval=1579891 TSecr=1680643500
152   2.482157 54.230.117.154 -> 172.31.8.238 TCP 2962 [TCP segment of a reassembled PDU]
153   2.482185 172.31.8.238 -> 54.230.117.154 TCP 66 41679 > http [ACK] Seq=98 Ack=150668 Win=219264 Len=0 TSval=1579916 TSecr=1680643510
154   2.482192 54.230.117.154 -> 172.31.8.238 TCP 90 [TCP segment of a reassembled PDU]
155   2.482212 54.230.117.154 -> 172.31.8.238 TCP 2962 [TCP segment of a reassembled PDU]
156   2.482216 172.31.8.238 -> 54.230.117.154 TCP 66 41679 > http [ACK] Seq=98 Ack=153588 Win=225152 Len=0 TSval=1579916 TSecr=1680643510
157   2.482270 54.230.117.154 -> 172.31.8.238 TCP 90 [TCP segment of a reassembled PDU]
158   2.482280 172.31.8.238 -> 54.230.117.154 TCP 66 41679 > http [ACK] Seq=98 Ack=153612 Win=225152 Len=0 TSval=1579916 TSecr=1680643510
159   2.483102 54.230.117.154 -> 172.31.8.238 TCP 1526 [TCP segment of a reassembled PDU]
160   2.483108 172.31.8.238 -> 54.230.117.154 TCP 66 41679 > http [ACK] Seq=98 Ack=155072 Win=227968 Len=0 TSval=1579916 TSecr=1680643510
161   2.483139 54.230.117.154 -> 172.31.8.238 TCP 1526 [TCP segment of a reassembled PDU]
162   2.483156 172.31.8.238 -> 54.230.117.154 TCP 66 41679 > http [ACK] Seq=98 Ack=156532 Win=230912 Len=0 TSval=1579916 TSecr=1680643510
163   2.484163 54.230.117.154 -> 172.31.8.238 TCP 2962 [TCP segment of a reassembled PDU]
164   2.484169 172.31.8.238 -> 54.230.117.154 TCP 66 41679 > http [ACK] Seq=98 Ack=159428 Win=236672 Len=0 TSval=1579916 TSecr=1680643510
165   2.484252 54.230.117.154 -> 172.31.8.238 TCP 90 [TCP segment of a reassembled PDU]
166   2.484266 172.31.8.238 -> 54.230.117.154 TCP 66 41679 > http [ACK] Seq=98 Ack=159452 Win=236672 Len=0 TSval=1579916 TSecr=1680643510
167   2.485147 54.230.117.154 -> 172.31.8.238 TCP 1514 [TCP segment of a reassembled PDU]
168   2.485152 172.31.8.238 -> 54.230.117.154 TCP 66 41679 > http [ACK] Seq=98 Ack=160900 Win=239616 Len=0 TSval=1579917 TSecr=1680643511
169   2.485396 54.230.117.154 -> 172.31.8.238 TCP 1538 [TCP segment of a reassembled PDU]
170   2.485401 172.31.8.238 -> 54.230.117.154 TCP 66 41679 > http [ACK] Seq=98 Ack=162372 Win=242560 Len=0 TSval=1579917 TSecr=1680643511
171   2.486183 54.230.117.154 -> 172.31.8.238 TCP 2962 [TCP segment of a reassembled PDU]
172   2.486188 172.31.8.238 -> 54.230.117.154 TCP 66 41679 > http [ACK] Seq=98 Ack=165268 Win=248320 Len=0 TSval=1579917 TSecr=1680643511
173   2.486221 54.230.117.154 -> 172.31.8.238 TCP 90 [TCP segment of a reassembled PDU]
174   2.486236 172.31.8.238 -> 54.230.117.154 TCP 66 41679 > http [ACK] Seq=98 Ack=165292 Win=248320 Len=0 TSval=1579917 TSecr=1680643511
175   2.487429 54.230.117.154 -> 172.31.8.238 TCP 2962 [TCP segment of a reassembled PDU]
176   2.487434 172.31.8.238 -> 54.230.117.154 TCP 66 41679 > http [ACK] Seq=98 Ack=168188 Win=254208 Len=0 TSval=1579917 TSecr=1680643511
177   2.487460 54.230.117.154 -> 172.31.8.238 TCP 90 [TCP segment of a reassembled PDU]
178   2.487470 172.31.8.238 -> 54.230.117.154 TCP 66 41679 > http [ACK] Seq=98 Ack=168212 Win=254208 Len=0 TSval=1579917 TSecr=1680643511
179   2.488209 54.230.117.154 -> 172.31.8.238 TCP 1526 [TCP segment of a reassembled PDU]
180   2.488213 172.31.8.238 -> 54.230.117.154 TCP 66 41679 > http [ACK] Seq=98 Ack=169672 Win=257024 Len=0 TSval=1579917 TSecr=1680643511
181   2.488443 54.230.117.154 -> 172.31.8.238 TCP 1526 [TCP segment of a reassembled PDU]
182   2.488448 172.31.8.238 -> 54.230.117.154 TCP 66 41679 > http [ACK] Seq=98 Ack=171132 Win=259968 Len=0 TSval=1579917 TSecr=1680643511
183   2.489461 54.230.117.154 -> 172.31.8.238 TCP 2962 [TCP segment of a reassembled PDU]
184   2.489466 172.31.8.238 -> 54.230.117.154 TCP 66 41679 > http [ACK] Seq=98 Ack=174028 Win=265728 Len=0 TSval=1579918 TSecr=1680643511
185   2.489487 54.230.117.154 -> 172.31.8.238 TCP 90 [TCP segment of a reassembled PDU]
186   2.489499 172.31.8.238 -> 54.230.117.154 TCP 66 41679 > http [ACK] Seq=98 Ack=174052 Win=265728 Len=0 TSval=1579918 TSecr=1680643511
187   2.490278 54.230.117.154 -> 172.31.8.238 TCP 1526 [TCP segment of a reassembled PDU]
188   2.490283 172.31.8.238 -> 54.230.117.154 TCP 66 41679 > http [ACK] Seq=98 Ack=175512 Win=268672 Len=0 TSval=1579918 TSecr=1680643511
189   2.490492 54.230.117.154 -> 172.31.8.238 TCP 1526 [TCP segment of a reassembled PDU]
190   2.490497 172.31.8.238 -> 54.230.117.154 TCP 66 41679 > http [ACK] Seq=98 Ack=176972 Win=271616 Len=0 TSval=1579918 TSecr=1680643511
191   2.491501 54.230.117.154 -> 172.31.8.238 TCP 1526 [TCP segment of a reassembled PDU]
192   2.491505 172.31.8.238 -> 54.230.117.154 TCP 66 41679 > http [ACK] Seq=98 Ack=178432 Win=274560 Len=0 TSval=1579918 TSecr=1680643511
193   2.491580 54.230.117.154 -> 172.31.8.238 TCP 1526 [TCP segment of a reassembled PDU]
194   2.491584 172.31.8.238 -> 54.230.117.154 TCP 66 41679 > http [ACK] Seq=98 Ack=179892 Win=277504 Len=0 TSval=1579918 TSecr=1680643511
195   2.492541 54.230.117.154 -> 172.31.8.238 TCP 2962 [TCP segment of a reassembled PDU]
196   2.492546 172.31.8.238 -> 54.230.117.154 TCP 66 41679 > http [ACK] Seq=98 Ack=182788 Win=283264 Len=0 TSval=1579918 TSecr=1680643511
197   2.492571 54.230.117.154 -> 172.31.8.238 TCP 90 [TCP segment of a reassembled PDU]
198   2.492580 172.31.8.238 -> 54.230.117.154 TCP 66 41679 > http [ACK] Seq=98 Ack=182812 Win=283264 Len=0 TSval=1579918 TSecr=1680643511
199   2.493337 54.230.117.154 -> 172.31.8.238 TCP 1526 [TCP segment of a reassembled PDU]
200   2.493342 172.31.8.238 -> 54.230.117.154 TCP 66 41679 > http [ACK] Seq=98 Ack=184272 Win=286208 Len=0 TSval=1579919 TSecr=1680643511
201   2.493556 54.230.117.154 -> 172.31.8.238 TCP 1526 [TCP segment of a reassembled PDU]
202   2.493560 172.31.8.238 -> 54.230.117.154 TCP 66 41679 > http [ACK] Seq=98 Ack=185732 Win=289152 Len=0 TSval=1579919 TSecr=1680643511
203   2.494348 54.230.117.154 -> 172.31.8.238 TCP 1526 [TCP segment of a reassembled PDU]
204   2.494352 172.31.8.238 -> 54.230.117.154 TCP 66 41679 > http [ACK] Seq=98 Ack=187192 Win=291968 Len=0 TSval=1579919 TSecr=1680643511
205   2.494568 54.230.117.154 -> 172.31.8.238 TCP 1514 [TCP segment of a reassembled PDU]
206   2.494573 172.31.8.238 -> 54.230.117.154 TCP 66 41679 > http [ACK] Seq=98 Ack=188640 Win=294912 Len=0 TSval=1579919 TSecr=1680643511
207   2.494640 54.230.117.154 -> 172.31.8.238 TCP 78 [TCP segment of a reassembled PDU]
208   2.494654 172.31.8.238 -> 54.230.117.154 TCP 66 41679 > http [ACK] Seq=98 Ack=188652 Win=294912 Len=0 TSval=1579919 TSecr=1680643512
209   2.495671 54.230.117.154 -> 172.31.8.238 TCP 1526 [TCP segment of a reassembled PDU]
210   2.495676 172.31.8.238 -> 54.230.117.154 TCP 66 41679 > http [ACK] Seq=98 Ack=190112 Win=297856 Len=0 TSval=1579919 TSecr=1680643512
211   2.495682 54.230.117.154 -> 172.31.8.238 TCP 1526 [TCP segment of a reassembled PDU]
212   2.495685 172.31.8.238 -> 54.230.117.154 TCP 66 41679 > http [ACK] Seq=98 Ack=191572 Win=300800 Len=0 TSval=1579919 TSecr=1680643512
213   2.496388 54.230.117.154 -> 172.31.8.238 TCP 1514 [TCP segment of a reassembled PDU]
214   2.496393 172.31.8.238 -> 54.230.117.154 TCP 66 41679 > http [ACK] Seq=98 Ack=193020 Win=303616 Len=0 TSval=1579919 TSecr=1680643512
215   2.496629 54.230.117.154 -> 172.31.8.238 TCP 1538 [TCP segment of a reassembled PDU]
216   2.496634 172.31.8.238 -> 54.230.117.154 TCP 66 41679 > http [ACK] Seq=98 Ack=194492 Win=306560 Len=0 TSval=1579919 TSecr=1680643512
217   2.497477 54.230.117.154 -> 172.31.8.238 TCP 2962 [TCP segment of a reassembled PDU]
218   2.497482 172.31.8.238 -> 54.230.117.154 TCP 66 41679 > http [ACK] Seq=98 Ack=197388 Win=312320 Len=0 TSval=1579920 TSecr=1680643512
219   2.497511 54.230.117.154 -> 172.31.8.238 TCP 90 [TCP segment of a reassembled PDU]
220   2.497525 172.31.8.238 -> 54.230.117.154 TCP 66 41679 > http [ACK] Seq=98 Ack=197412 Win=312320 Len=0 TSval=1579920 TSecr=1680643512
221   2.498431 54.230.117.154 -> 172.31.8.238 TCP 1526 [TCP segment of a reassembled PDU]
222   2.498435 172.31.8.238 -> 54.230.117.154 TCP 66 41679 > http [ACK] Seq=98 Ack=198872 Win=315264 Len=0 TSval=1579920 TSecr=1680643512
223   2.498512 54.230.117.154 -> 172.31.8.238 TCP 1526 [TCP segment of a reassembled PDU]
224   2.498529 172.31.8.238 -> 54.230.117.154 TCP 66 41679 > http [ACK] Seq=98 Ack=200332 Win=318208 Len=0 TSval=1579920 TSecr=1680643512
225   2.499448 54.230.117.154 -> 172.31.8.238 TCP 1514 [TCP segment of a reassembled PDU]
226   2.499452 172.31.8.238 -> 54.230.117.154 TCP 66 41679 > http [ACK] Seq=98 Ack=201780 Win=321152 Len=0 TSval=1579920 TSecr=1680643512
227   2.499529 54.230.117.154 -> 172.31.8.238 TCP 1538 [TCP segment of a reassembled PDU]
228   2.499534 172.31.8.238 -> 54.230.117.154 TCP 66 41679 > http [ACK] Seq=98 Ack=203252 Win=324096 Len=0 TSval=1579920 TSecr=1680643512
229   2.500471 54.230.117.154 -> 172.31.8.238 TCP 1526 [TCP segment of a reassembled PDU]
230   2.500475 172.31.8.238 -> 54.230.117.154 TCP 66 41679 > http [ACK] Seq=98 Ack=204712 Win=327040 Len=0 TSval=1579920 TSecr=1680643512
231   2.500725 54.230.117.154 -> 172.31.8.238 TCP 1526 [TCP segment of a reassembled PDU]
232   2.500729 172.31.8.238 -> 54.230.117.154 TCP 66 41679 > http [ACK] Seq=98 Ack=206172 Win=329856 Len=0 TSval=1579921 TSecr=1680643512
233   2.501489 54.230.117.154 -> 172.31.8.238 TCP 1514 [TCP segment of a reassembled PDU]
234   2.501493 172.31.8.238 -> 54.230.117.154 TCP 66 41679 > http [ACK] Seq=98 Ack=207620 Win=332800 Len=0 TSval=1579921 TSecr=1680643512
235   2.501569 54.230.117.154 -> 172.31.8.238 TCP 1538 [TCP segment of a reassembled PDU]
236   2.501574 172.31.8.238 -> 54.230.117.154 TCP 66 41679 > http [ACK] Seq=98 Ack=209092 Win=335744 Len=0 TSval=1579921 TSecr=1680643512
237   2.502520 54.230.117.154 -> 172.31.8.238 TCP 1514 [TCP segment of a reassembled PDU]
238   2.502525 172.31.8.238 -> 54.230.117.154 TCP 66 41679 > http [ACK] Seq=98 Ack=210540 Win=338688 Len=0 TSval=1579921 TSecr=1680643512
239   2.502624 54.230.117.154 -> 172.31.8.238 TCP 1538 [TCP segment of a reassembled PDU]
240   2.502629 172.31.8.238 -> 54.230.117.154 TCP 66 41679 > http [ACK] Seq=98 Ack=212012 Win=341632 Len=0 TSval=1579921 TSecr=1680643512
241   2.503606 54.230.117.154 -> 172.31.8.238 TCP 1526 [TCP segment of a reassembled PDU]
242   2.503610 172.31.8.238 -> 54.230.117.154 TCP 66 41679 > http [ACK] Seq=98 Ack=213472 Win=344448 Len=0 TSval=1579921 TSecr=1680643512
243   2.503687 54.230.117.154 -> 172.31.8.238 TCP 1526 [TCP segment of a reassembled PDU]
244   2.503691 172.31.8.238 -> 54.230.117.154 TCP 66 41679 > http [ACK] Seq=98 Ack=214932 Win=347392 Len=0 TSval=1579921 TSecr=1680643512
245   2.504586 54.230.117.154 -> 172.31.8.238 TCP 1514 [TCP segment of a reassembled PDU]
246   2.504590 172.31.8.238 -> 54.230.117.154 TCP 66 41679 > http [ACK] Seq=98 Ack=216380 Win=350336 Len=0 TSval=1579921 TSecr=1680643513
247   2.504696 54.230.117.154 -> 172.31.8.238 TCP 1538 [TCP segment of a reassembled PDU]
248   2.504700 172.31.8.238 -> 54.230.117.154 TCP 66 41679 > http [ACK] Seq=98 Ack=217852 Win=353280 Len=0 TSval=1579922 TSecr=1680643513
249   2.505594 54.230.117.154 -> 172.31.8.238 TCP 1526 [TCP segment of a reassembled PDU]
250   2.505600 172.31.8.238 -> 54.230.117.154 TCP 66 41679 > http [ACK] Seq=98 Ack=219312 Win=356224 Len=0 TSval=1579922 TSecr=1680643513
251   2.505677 54.230.117.154 -> 172.31.8.238 TCP 1526 [TCP segment of a reassembled PDU]
252   2.505682 172.31.8.238 -> 54.230.117.154 TCP 66 41679 > http [ACK] Seq=98 Ack=220772 Win=359040 Len=0 TSval=1579922 TSecr=1680643513
253   2.506627 54.230.117.154 -> 172.31.8.238 TCP 1526 [TCP segment of a reassembled PDU]
254   2.506632 172.31.8.238 -> 54.230.117.154 TCP 66 41679 > http [ACK] Seq=98 Ack=222232 Win=361984 Len=0 TSval=1579922 TSecr=1680643513
255   2.506713 54.230.117.154 -> 172.31.8.238 TCP 1526 [TCP segment of a reassembled PDU]
256   2.506717 172.31.8.238 -> 54.230.117.154 TCP 66 41679 > http [ACK] Seq=98 Ack=223692 Win=364928 Len=0 TSval=1579922 TSecr=1680643513
257   2.507646 54.230.117.154 -> 172.31.8.238 TCP 2962 [TCP segment of a reassembled PDU]
258   2.507652 172.31.8.238 -> 54.230.117.154 TCP 66 41679 > http [ACK] Seq=98 Ack=226588 Win=370688 Len=0 TSval=1579922 TSecr=1680643513
259   2.507676 54.230.117.154 -> 172.31.8.238 TCP 90 [TCP segment of a reassembled PDU]
260   2.507685 172.31.8.238 -> 54.230.117.154 TCP 66 41679 > http [ACK] Seq=98 Ack=226612 Win=370688 Len=0 TSval=1579922 TSecr=1680643513
261   2.508670 54.230.117.154 -> 172.31.8.238 TCP 1526 [TCP segment of a reassembled PDU]
262   2.508674 172.31.8.238 -> 54.230.117.154 TCP 66 41679 > http [ACK] Seq=98 Ack=228072 Win=373632 Len=0 TSval=1579923 TSecr=1680643513
263   2.508750 54.230.117.154 -> 172.31.8.238 TCP 1526 [TCP segment of a reassembled PDU]
264   2.508755 172.31.8.238 -> 54.230.117.154 TCP 66 41679 > http [ACK] Seq=98 Ack=229532 Win=376576 Len=0 TSval=1579923 TSecr=1680643513
265   2.509459 54.230.117.154 -> 172.31.8.238 TCP 2962 [TCP segment of a reassembled PDU]
266   2.509465 172.31.8.238 -> 54.230.117.154 TCP 66 41679 > http [ACK] Seq=98 Ack=232428 Win=382336 Len=0 TSval=1579923 TSecr=1680643513
267   2.509488 54.230.117.154 -> 172.31.8.238 TCP 90 [TCP segment of a reassembled PDU]
268   2.509497 172.31.8.238 -> 54.230.117.154 TCP 66 41679 > http [ACK] Seq=98 Ack=232452 Win=382336 Len=0 TSval=1579923 TSecr=1680643513
269   2.594552 54.230.117.154 -> 172.31.8.238 TCP 2986 [TCP segment of a reassembled PDU]
270   2.594574 172.31.8.238 -> 54.230.117.154 TCP 66 41679 > http [ACK] Seq=98 Ack=235372 Win=388224 Len=0 TSval=1579944 TSecr=1680643521
271   2.594584 54.230.117.154 -> 172.31.8.238 TCP 2962 [TCP segment of a reassembled PDU]
272   2.594588 172.31.8.238 -> 54.230.117.154 TCP 66 41679 > http [ACK] Seq=98 Ack=238268 Win=393984 Len=0 TSval=1579944 TSecr=1680643521
273   2.594727 54.230.117.154 -> 172.31.8.238 TCP 3010 [TCP segment of a reassembled PDU]
274   2.594733 172.31.8.238 -> 54.230.117.154 TCP 66 41679 > http [ACK] Seq=98 Ack=241212 Win=399872 Len=0 TSval=1579944 TSecr=1680643521
275   2.594741 54.230.117.154 -> 172.31.8.238 TCP 2962 [TCP segment of a reassembled PDU]
276   2.594744 172.31.8.238 -> 54.230.117.154 TCP 66 41679 > http [ACK] Seq=98 Ack=244108 Win=405632 Len=0 TSval=1579944 TSecr=1680643522
277   2.594756 54.230.117.154 -> 172.31.8.238 TCP 90 [TCP segment of a reassembled PDU]
278   2.595092 172.31.8.238 -> 54.230.117.154 TCP 66 41679 > http [ACK] Seq=98 Ack=244132 Win=405632 Len=0 TSval=1579944 TSecr=1680643522
279   2.595476 54.230.117.154 -> 172.31.8.238 TCP 1514 [TCP segment of a reassembled PDU]
280   2.595482 172.31.8.238 -> 54.230.117.154 TCP 66 41679 > http [ACK] Seq=98 Ack=245580 Win=408576 Len=0 TSval=1579944 TSecr=1680643522
281   2.595716 54.230.117.154 -> 172.31.8.238 TCP 1538 [TCP segment of a reassembled PDU]
282   2.595721 172.31.8.238 -> 54.230.117.154 TCP 66 41679 > http [ACK] Seq=98 Ack=247052 Win=411520 Len=0 TSval=1579944 TSecr=1680643522
283   2.595825 54.230.117.154 -> 172.31.8.238 TCP 1526 [TCP segment of a reassembled PDU]
284   2.595830 172.31.8.238 -> 54.230.117.154 TCP 66 41679 > http [ACK] Seq=98 Ack=248512 Win=414464 Len=0 TSval=1579944 TSecr=1680643522
285   2.595837 54.230.117.154 -> 172.31.8.238 TCP 4410 [TCP segment of a reassembled PDU]
286   2.595841 172.31.8.238 -> 54.230.117.154 TCP 66 41679 > http [ACK] Seq=98 Ack=252856 Win=423168 Len=0 TSval=1579944 TSecr=1680643522
287   2.595936 54.230.117.154 -> 172.31.8.238 TCP 102 [TCP segment of a reassembled PDU]
288   2.595950 172.31.8.238 -> 54.230.117.154 TCP 66 41679 > http [ACK] Seq=98 Ack=252892 Win=423168 Len=0 TSval=1579944 TSecr=1680643522
289   2.596733 54.230.117.154 -> 172.31.8.238 TCP 2962 [TCP segment of a reassembled PDU]
290   2.596740 172.31.8.238 -> 54.230.117.154 TCP 66 41679 > http [ACK] Seq=98 Ack=255788 Win=428928 Len=0 TSval=1579945 TSecr=1680643522
291   2.596767 54.230.117.154 -> 172.31.8.238 TCP 90 [TCP segment of a reassembled PDU]
292   2.596777 172.31.8.238 -> 54.230.117.154 TCP 66 41679 > http [ACK] Seq=98 Ack=255812 Win=428928 Len=0 TSval=1579945 TSecr=1680643522
293   2.596844 54.230.117.154 -> 172.31.8.238 TCP 2962 [TCP segment of a reassembled PDU]
294   2.596849 172.31.8.238 -> 54.230.117.154 TCP 66 41679 > http [ACK] Seq=98 Ack=258708 Win=434688 Len=0 TSval=1579945 TSecr=1680643522
295   2.596997 54.230.117.154 -> 172.31.8.238 TCP 2962 [TCP segment of a reassembled PDU]
296   2.597002 172.31.8.238 -> 54.230.117.154 TCP 66 41679 > http [ACK] Seq=98 Ack=261604 Win=440448 Len=0 TSval=1579945 TSecr=1680643522
297   2.597030 54.230.117.154 -> 172.31.8.238 TCP 114 [TCP segment of a reassembled PDU]
298   2.597045 172.31.8.238 -> 54.230.117.154 TCP 66 41679 > http [ACK] Seq=98 Ack=261652 Win=440448 Len=0 TSval=1579945 TSecr=1680643522
299   2.597783 54.230.117.154 -> 172.31.8.238 TCP 1526 [TCP segment of a reassembled PDU]
300   2.597787 172.31.8.238 -> 54.230.117.154 TCP 66 41679 > http [ACK] Seq=98 Ack=263112 Win=443392 Len=0 TSval=1579945 TSecr=1680643522
301   2.598020 54.230.117.154 -> 172.31.8.238 TCP 2962 [TCP segment of a reassembled PDU]
302   2.598025 172.31.8.238 -> 54.230.117.154 TCP 66 41679 > http [ACK] Seq=98 Ack=266008 Win=449152 Len=0 TSval=1579945 TSecr=1680643522
303   2.598124 54.230.117.154 -> 172.31.8.238 TCP 1550 [TCP segment of a reassembled PDU]
304   2.598128 172.31.8.238 -> 54.230.117.154 TCP 66 41679 > http [ACK] Seq=98 Ack=267492 Win=452224 Len=0 TSval=1579945 TSecr=1680643522
305   2.598532 54.230.117.154 -> 172.31.8.238 TCP 1526 [TCP segment of a reassembled PDU]
306   2.598537 172.31.8.238 -> 54.230.117.154 TCP 66 41679 > http [ACK] Seq=98 Ack=268952 Win=455040 Len=0 TSval=1579945 TSecr=1680643522
307   2.598772 54.230.117.154 -> 172.31.8.238 TCP 1526 [TCP segment of a reassembled PDU]
308   2.598776 172.31.8.238 -> 54.230.117.154 TCP 66 41679 > http [ACK] Seq=98 Ack=270412 Win=457984 Len=0 TSval=1579945 TSecr=1680643522
309   2.599599 54.230.117.154 -> 172.31.8.238 TCP 1526 [TCP segment of a reassembled PDU]
310   2.599604 172.31.8.238 -> 54.230.117.154 TCP 66 41679 > http [ACK] Seq=98 Ack=271872 Win=460928 Len=0 TSval=1579945 TSecr=1680643522
311   2.599821 54.230.117.154 -> 172.31.8.238 TCP 2962 [TCP segment of a reassembled PDU]
312   2.599826 172.31.8.238 -> 54.230.117.154 TCP 66 41679 > http [ACK] Seq=98 Ack=274768 Win=463744 Len=0 TSval=1579945 TSecr=1680643522
313   2.599982 54.230.117.154 -> 172.31.8.238 TCP 1550 [TCP segment of a reassembled PDU]
314   2.599992 172.31.8.238 -> 54.230.117.154 TCP 66 41679 > http [ACK] Seq=98 Ack=276252 Win=463744 Len=0 TSval=1579945 TSecr=1680643522
315   2.600619 54.230.117.154 -> 172.31.8.238 TCP 1514 [TCP segment of a reassembled PDU]
316   2.600668 54.230.117.154 -> 172.31.8.238 TCP 78 [TCP segment of a reassembled PDU]
317   2.600673 172.31.8.238 -> 54.230.117.154 TCP 66 41679 > http [ACK] Seq=98 Ack=277712 Win=466176 Len=0 TSval=1579946 TSecr=1680643522
318   2.600748 54.230.117.154 -> 172.31.8.238 TCP 1526 [TCP segment of a reassembled PDU]
319   2.600765 172.31.8.238 -> 54.230.117.154 TCP 66 41679 > http [ACK] Seq=98 Ack=279172 Win=466688 Len=0 TSval=1579946 TSecr=1680643522
320   2.601624 54.230.117.154 -> 172.31.8.238 TCP 1526 [TCP segment of a reassembled PDU]
321   2.601652 172.31.8.238 -> 54.230.117.154 TCP 66 41679 > http [ACK] Seq=98 Ack=280632 Win=466688 Len=0 TSval=1579946 TSecr=1680643522
322   2.601666 54.230.117.154 -> 172.31.8.238 TCP 1526 [TCP segment of a reassembled PDU]
323   2.601675 172.31.8.238 -> 54.230.117.154 TCP 66 41679 > http [ACK] Seq=98 Ack=282092 Win=466688 Len=0 TSval=1579946 TSecr=1680643522
324   2.602380 54.230.117.154 -> 172.31.8.238 TCP 1526 [TCP segment of a reassembled PDU]
325   2.602397 172.31.8.238 -> 54.230.117.154 TCP 66 41679 > http [ACK] Seq=98 Ack=283552 Win=466688 Len=0 TSval=1579946 TSecr=1680643522
326   2.602633 54.230.117.154 -> 172.31.8.238 TCP 1526 [TCP segment of a reassembled PDU]
327   2.602649 172.31.8.238 -> 54.230.117.154 TCP 66 41679 > http [ACK] Seq=98 Ack=285012 Win=466688 Len=0 TSval=1579946 TSecr=1680643522
328   2.603439 54.230.117.154 -> 172.31.8.238 TCP 1526 [TCP segment of a reassembled PDU]
329   2.603455 172.31.8.238 -> 54.230.117.154 TCP 66 41679 > http [ACK] Seq=98 Ack=286472 Win=466688 Len=0 TSval=1579946 TSecr=1680643522
330   2.603483 54.230.117.154 -> 172.31.8.238 TCP 1526 [TCP segment of a reassembled PDU]
331   2.603501 172.31.8.238 -> 54.230.117.154 TCP 66 41679 > http [ACK] Seq=98 Ack=287932 Win=466688 Len=0 TSval=1579946 TSecr=1680643522
332   2.604245 54.230.117.154 -> 172.31.8.238 TCP 1526 [TCP segment of a reassembled PDU]
333   2.604277 172.31.8.238 -> 54.230.117.154 TCP 66 41679 > http [ACK] Seq=98 Ack=289392 Win=466688 Len=0 TSval=1579946 TSecr=1680643522
334   2.604519 54.230.117.154 -> 172.31.8.238 TCP 1526 [TCP segment of a reassembled PDU]
335   2.604539 172.31.8.238 -> 54.230.117.154 TCP 66 41679 > http [ACK] Seq=98 Ack=290852 Win=466688 Len=0 TSval=1579946 TSecr=1680643522
336   2.605233 54.230.117.154 -> 172.31.8.238 TCP 1526 [TCP segment of a reassembled PDU]
337   2.605252 172.31.8.238 -> 54.230.117.154 TCP 66 41679 > http [ACK] Seq=98 Ack=292312 Win=466688 Len=0 TSval=1579947 TSecr=1680643523
338   2.605480 54.230.117.154 -> 172.31.8.238 TCP 1526 [TCP segment of a reassembled PDU]
339   2.605498 172.31.8.238 -> 54.230.117.154 TCP 66 41679 > http [ACK] Seq=98 Ack=293772 Win=466688 Len=0 TSval=1579947 TSecr=1680643523
340   2.606261 54.230.117.154 -> 172.31.8.238 TCP 2962 [TCP segment of a reassembled PDU]
341   2.606283 172.31.8.238 -> 54.230.117.154 TCP 66 41679 > http [ACK] Seq=98 Ack=296668 Win=466688 Len=0 TSval=1579947 TSecr=1680643523
342   2.606292 54.230.117.154 -> 172.31.8.238 TCP 90 [TCP segment of a reassembled PDU]
343   2.606306 172.31.8.238 -> 54.230.117.154 TCP 66 41679 > http [ACK] Seq=98 Ack=296692 Win=466688 Len=0 TSval=1579947 TSecr=1680643523
344   2.607286 54.230.117.154 -> 172.31.8.238 TCP 1526 [TCP segment of a reassembled PDU]
345   2.607303 172.31.8.238 -> 54.230.117.154 TCP 66 41679 > http [ACK] Seq=98 Ack=298152 Win=466688 Len=0 TSval=1579947 TSecr=1680643523
346   2.607332 54.230.117.154 -> 172.31.8.238 TCP 1526 [TCP segment of a reassembled PDU]
347   2.607349 172.31.8.238 -> 54.230.117.154 TCP 66 41679 > http [ACK] Seq=98 Ack=299612 Win=466688 Len=0 TSval=1579947 TSecr=1680643523
348   2.608059 54.230.117.154 -> 172.31.8.238 TCP 1526 [TCP segment of a reassembled PDU]
349   2.608080 172.31.8.238 -> 54.230.117.154 TCP 66 41679 > http [ACK] Seq=98 Ack=301072 Win=466688 Len=0 TSval=1579947 TSecr=1680643523
350   2.608304 54.230.117.154 -> 172.31.8.238 TCP 1526 [TCP segment of a reassembled PDU]
351   2.608322 172.31.8.238 -> 54.230.117.154 TCP 66 41679 > http [ACK] Seq=98 Ack=302532 Win=466688 Len=0 TSval=1579947 TSecr=1680643523
352   2.609105 54.230.117.154 -> 172.31.8.238 TCP 1526 [TCP segment of a reassembled PDU]
353   2.609123 172.31.8.238 -> 54.230.117.154 TCP 66 41679 > http [ACK] Seq=98 Ack=303992 Win=466688 Len=0 TSval=1579948 TSecr=1680643523
354   2.609151 54.230.117.154 -> 172.31.8.238 TCP 1526 [TCP segment of a reassembled PDU]
355   2.609168 172.31.8.238 -> 54.230.117.154 TCP 66 41679 > http [ACK] Seq=98 Ack=305452 Win=466688 Len=0 TSval=1579948 TSecr=1680643523
356   2.610126 54.230.117.154 -> 172.31.8.238 TCP 2962 [TCP segment of a reassembled PDU]
357   2.610143 172.31.8.238 -> 54.230.117.154 TCP 66 41679 > http [ACK] Seq=98 Ack=308348 Win=466688 Len=0 TSval=1579948 TSecr=1680643523
358   2.610163 54.230.117.154 -> 172.31.8.238 TCP 90 [TCP segment of a reassembled PDU]
359   2.610177 172.31.8.238 -> 54.230.117.154 TCP 66 41679 > http [ACK] Seq=98 Ack=308372 Win=466688 Len=0 TSval=1579948 TSecr=1680643523
360   2.610907 54.230.117.154 -> 172.31.8.238 TCP 1526 [TCP segment of a reassembled PDU]
361   2.610923 172.31.8.238 -> 54.230.117.154 TCP 66 41679 > http [ACK] Seq=98 Ack=309832 Win=466688 Len=0 TSval=1579948 TSecr=1680643523
362   2.611155 54.230.117.154 -> 172.31.8.238 TCP 1526 [TCP segment of a reassembled PDU]
363   2.611171 172.31.8.238 -> 54.230.117.154 TCP 66 41679 > http [ACK] Seq=98 Ack=311292 Win=466688 Len=0 TSval=1579948 TSecr=1680643523
364   2.611909 54.230.117.154 -> 172.31.8.238 TCP 1514 [TCP segment of a reassembled PDU]
365   2.611955 54.230.117.154 -> 172.31.8.238 TCP 1538 [TCP segment of a reassembled PDU]
366   2.611974 172.31.8.238 -> 54.230.117.154 TCP 66 41679 > http [ACK] Seq=98 Ack=314212 Win=466688 Len=0 TSval=1579948 TSecr=1680643523
367   2.612970 54.230.117.154 -> 172.31.8.238 TCP 1526 [TCP segment of a reassembled PDU]
368   2.612987 172.31.8.238 -> 54.230.117.154 TCP 66 41679 > http [ACK] Seq=98 Ack=315672 Win=466688 Len=0 TSval=1579949 TSecr=1680643523
369   2.613018 54.230.117.154 -> 172.31.8.238 TCP 1526 [TCP segment of a reassembled PDU]
370   2.613034 172.31.8.238 -> 54.230.117.154 TCP 66 41679 > http [ACK] Seq=98 Ack=317132 Win=466688 Len=0 TSval=1579949 TSecr=1680643523
371   2.613741 54.230.117.154 -> 172.31.8.238 TCP 1526 [TCP segment of a reassembled PDU]
372   2.613757 172.31.8.238 -> 54.230.117.154 TCP 66 41679 > http [ACK] Seq=98 Ack=318592 Win=466688 Len=0 TSval=1579949 TSecr=1680643523
373   2.614033 54.230.117.154 -> 172.31.8.238 TCP 1526 [TCP segment of a reassembled PDU]
374   2.614049 172.31.8.238 -> 54.230.117.154 TCP 66 41679 > http [ACK] Seq=98 Ack=320052 Win=466688 Len=0 TSval=1579949 TSecr=1680643523
375   2.614731 54.230.117.154 -> 172.31.8.238 TCP 1514 [TCP segment of a reassembled PDU]
376   2.614778 54.230.117.154 -> 172.31.8.238 TCP 1538 [TCP segment of a reassembled PDU]
377   2.614794 172.31.8.238 -> 54.230.117.154 TCP 66 41679 > http [ACK] Seq=98 Ack=322972 Win=466688 Len=0 TSval=1579949 TSecr=1680643524
378   2.615547 54.230.117.154 -> 172.31.8.238 TCP 1526 [TCP segment of a reassembled PDU]
379   2.615567 172.31.8.238 -> 54.230.117.154 TCP 66 41679 > http [ACK] Seq=98 Ack=324432 Win=466688 Len=0 TSval=1579949 TSecr=1680643524
380   2.615781 54.230.117.154 -> 172.31.8.238 TCP 1526 [TCP segment of a reassembled PDU]
381   2.615798 172.31.8.238 -> 54.230.117.154 TCP 66 41679 > http [ACK] Seq=98 Ack=325892 Win=466688 Len=0 TSval=1579949 TSecr=1680643524
382   2.616559 54.230.117.154 -> 172.31.8.238 TCP 1526 [TCP segment of a reassembled PDU]
383   2.616576 172.31.8.238 -> 54.230.117.154 TCP 66 41679 > http [ACK] Seq=98 Ack=327352 Win=466688 Len=0 TSval=1579949 TSecr=1680643524
384   2.616793 54.230.117.154 -> 172.31.8.238 TCP 1526 [TCP segment of a reassembled PDU]
385   2.616809 172.31.8.238 -> 54.230.117.154 TCP 66 41679 > http [ACK] Seq=98 Ack=328812 Win=466688 Len=0 TSval=1579950 TSecr=1680643524
386   2.617549 54.230.117.154 -> 172.31.8.238 TCP 1514 [TCP segment of a reassembled PDU]
387   2.617623 54.230.117.154 -> 172.31.8.238 TCP 1538 [TCP segment of a reassembled PDU]
388   2.617638 172.31.8.238 -> 54.230.117.154 TCP 66 41679 > http [ACK] Seq=98 Ack=331732 Win=466688 Len=0 TSval=1579950 TSecr=1680643524
389   2.618339 54.230.117.154 -> 172.31.8.238 TCP 2962 [TCP segment of a reassembled PDU]
390   2.618355 172.31.8.238 -> 54.230.117.154 TCP 66 41679 > http [ACK] Seq=98 Ack=334628 Win=466688 Len=0 TSval=1579950 TSecr=1680643524
391   2.618380 54.230.117.154 -> 172.31.8.238 TCP 90 [TCP segment of a reassembled PDU]
392   2.618394 172.31.8.238 -> 54.230.117.154 TCP 66 41679 > http [ACK] Seq=98 Ack=334652 Win=466688 Len=0 TSval=1579950 TSecr=1680643524
393   2.619333 54.230.117.154 -> 172.31.8.238 TCP 1526 [TCP segment of a reassembled PDU]
394   2.619349 172.31.8.238 -> 54.230.117.154 TCP 66 41679 > http [ACK] Seq=98 Ack=336112 Win=466688 Len=0 TSval=1579950 TSecr=1680643524
395   2.619592 54.230.117.154 -> 172.31.8.238 TCP 1526 [TCP segment of a reassembled PDU]
396   2.619615 172.31.8.238 -> 54.230.117.154 TCP 66 41679 > http [ACK] Seq=98 Ack=337572 Win=466688 Len=0 TSval=1579950 TSecr=1680643524
397   2.620149 54.230.117.154 -> 172.31.8.238 TCP 2962 [TCP segment of a reassembled PDU]
398   2.620170 172.31.8.238 -> 54.230.117.154 TCP 66 41679 > http [ACK] Seq=98 Ack=340468 Win=466688 Len=0 TSval=1579950 TSecr=1680643524
399   2.620180 54.230.117.154 -> 172.31.8.238 TCP 90 [TCP segment of a reassembled PDU]
400   2.620195 172.31.8.238 -> 54.230.117.154 TCP 66 41679 > http [ACK] Seq=98 Ack=340492 Win=466688 Len=0 TSval=1579950 TSecr=1680643524
401   2.621163 54.230.117.154 -> 172.31.8.238 TCP 2962 [TCP segment of a reassembled PDU]
