[Measurement for 10mb at 17:45:32 19.45.2014] 
Tshark:

  1   0.000000 172.31.8.238 -> 172.31.0.2   DNS 89 Standard query 0x3c9a  A d3m1c4hwkgedal.cloudfront.net
  2   0.000035 172.31.8.238 -> 172.31.0.2   DNS 89 Standard query 0x8e4c  AAAA d3m1c4hwkgedal.cloudfront.net
  3   0.000568   172.31.0.2 -> 172.31.8.238 DNS 174 Standard query response 0x8e4c 
  4   0.000581   172.31.0.2 -> 172.31.8.238 DNS 217 Standard query response 0x3c9a  A 54.230.140.126 A 54.230.140.168 A 54.230.142.13 A 54.230.142.31 A 54.230.143.143 A 205.251.215.126 A 54.192.141.181 A 54.192.141.200
  5   0.003856 172.31.8.238 -> 54.230.140.126 TCP 74 40629 > http [SYN] Seq=0 Win=26883 Len=0 MSS=8961 SACK_PERM=1 TSval=690075 TSecr=0 WS=128
  6   0.005854 54.230.140.126 -> 172.31.8.238 TCP 74 http > 40629 [SYN, ACK] Seq=0 Ack=1 Win=14480 Len=0 MSS=1460 SACK_PERM=1 TSval=783338072 TSecr=690075 WS=128
  7   0.005869 172.31.8.238 -> 54.230.140.126 TCP 66 40629 > http [ACK] Seq=1 Ack=1 Win=27008 Len=0 TSval=690076 TSecr=783338072
  8   0.005914 172.31.8.238 -> 54.230.140.126 HTTP 163 GET /10mb HTTP/1.1 
  9   0.008149 54.230.140.126 -> 172.31.8.238 TCP 66 http > 40629 [ACK] Seq=1 Ack=98 Win=14592 Len=0 TSval=783338072 TSecr=690076
 10   0.175744 54.230.140.126 -> 172.31.8.238 TCP 4410 [TCP segment of a reassembled PDU]
 11   0.175770 172.31.8.238 -> 54.230.140.126 TCP 66 40629 > http [ACK] Seq=98 Ack=4345 Win=35584 Len=0 TSval=690118 TSecr=783338089
 12   0.175861 54.230.140.126 -> 172.31.8.238 TCP 2605 [TCP segment of a reassembled PDU]
 13   0.175868 172.31.8.238 -> 54.230.140.126 TCP 66 40629 > http [ACK] Seq=98 Ack=6884 Win=40704 Len=0 TSval=690118 TSecr=783338089
 14   0.176125 54.230.140.126 -> 172.31.8.238 TCP 6346 [TCP segment of a reassembled PDU]
 15   0.176134 172.31.8.238 -> 54.230.140.126 TCP 66 40629 > http [ACK] Seq=98 Ack=13164 Win=53248 Len=0 TSval=690118 TSecr=783338089
 16   0.177885 54.230.140.126 -> 172.31.8.238 TCP 354 [TCP segment of a reassembled PDU]
 17   0.177891 172.31.8.238 -> 54.230.140.126 TCP 66 40629 > http [ACK] Seq=98 Ack=13452 Win=56192 Len=0 TSval=690119 TSecr=783338089
 18   0.293421 54.230.140.126 -> 172.31.8.238 TCP 1514 [TCP segment of a reassembled PDU]
 19   0.293449 172.31.8.238 -> 54.230.140.126 TCP 66 40629 > http [ACK] Seq=98 Ack=14900 Win=59008 Len=0 TSval=690147 TSecr=783338100
 20   0.293460 54.230.140.126 -> 172.31.8.238 TCP 1514 [TCP segment of a reassembled PDU]
 21   0.293464 172.31.8.238 -> 54.230.140.126 TCP 66 40629 > http [ACK] Seq=98 Ack=16348 Win=61952 Len=0 TSval=690147 TSecr=783338100
 22   0.293636 54.230.140.126 -> 172.31.8.238 TCP 2962 [TCP segment of a reassembled PDU]
 23   0.293642 172.31.8.238 -> 54.230.140.126 TCP 66 40629 > http [ACK] Seq=98 Ack=19244 Win=67712 Len=0 TSval=690148 TSecr=783338100
 24   0.293889 54.230.140.126 -> 172.31.8.238 TCP 1574 [TCP segment of a reassembled PDU]
 25   0.293894 172.31.8.238 -> 54.230.140.126 TCP 66 40629 > http [ACK] Seq=98 Ack=20752 Win=70784 Len=0 TSval=690148 TSecr=783338100
 26   0.293982 54.230.140.126 -> 172.31.8.238 TCP 2962 [TCP segment of a reassembled PDU]
 27   0.293987 172.31.8.238 -> 54.230.140.126 TCP 66 40629 > http [ACK] Seq=98 Ack=23648 Win=76544 Len=0 TSval=690148 TSecr=783338100
 28   0.293993 54.230.140.126 -> 172.31.8.238 TCP 2962 [TCP segment of a reassembled PDU]
 29   0.294011 172.31.8.238 -> 54.230.140.126 TCP 66 40629 > http [ACK] Seq=98 Ack=26544 Win=82304 Len=0 TSval=690148 TSecr=783338100
 30   0.294121 54.230.140.126 -> 172.31.8.238 TCP 1514 [TCP segment of a reassembled PDU]
 31   0.294125 172.31.8.238 -> 54.230.140.126 TCP 66 40629 > http [ACK] Seq=98 Ack=27992 Win=85248 Len=0 TSval=690148 TSecr=783338100
 32   0.295919 54.230.140.126 -> 172.31.8.238 TCP 1514 [TCP segment of a reassembled PDU]
 33   0.295923 172.31.8.238 -> 54.230.140.126 TCP 66 40629 > http [ACK] Seq=98 Ack=29440 Win=88192 Len=0 TSval=690148 TSecr=783338101
 34   0.296183 54.230.140.126 -> 172.31.8.238 TCP 1514 [TCP segment of a reassembled PDU]
 35   0.296187 172.31.8.238 -> 54.230.140.126 TCP 66 40629 > http [ACK] Seq=98 Ack=30888 Win=91008 Len=0 TSval=690148 TSecr=783338101
 36   0.296276 54.230.140.126 -> 172.31.8.238 TCP 2962 [TCP segment of a reassembled PDU]
 37   0.296281 172.31.8.238 -> 54.230.140.126 TCP 66 40629 > http [ACK] Seq=98 Ack=33784 Win=96896 Len=0 TSval=690148 TSecr=783338101
 38   0.296415 54.230.140.126 -> 172.31.8.238 TCP 174 [TCP segment of a reassembled PDU]
 39   0.296419 172.31.8.238 -> 54.230.140.126 TCP 66 40629 > http [ACK] Seq=98 Ack=33892 Win=96896 Len=0 TSval=690148 TSecr=783338101
 40   0.411700 54.230.140.126 -> 172.31.8.238 TCP 1514 [TCP segment of a reassembled PDU]
 41   0.411722 172.31.8.238 -> 54.230.140.126 TCP 66 40629 > http [ACK] Seq=98 Ack=35340 Win=99712 Len=0 TSval=690177 TSecr=783338112
 42   0.411744 54.230.140.126 -> 172.31.8.238 TCP 5858 [TCP segment of a reassembled PDU]
 43   0.411749 172.31.8.238 -> 54.230.140.126 TCP 66 40629 > http [ACK] Seq=98 Ack=41132 Win=105984 Len=0 TSval=690177 TSecr=783338112
 44   0.411810 54.230.140.126 -> 172.31.8.238 TCP 126 [TCP segment of a reassembled PDU]
 45   0.411831 172.31.8.238 -> 54.230.140.126 TCP 66 40629 > http [ACK] Seq=98 Ack=41192 Win=109056 Len=0 TSval=690177 TSecr=783338112
 46   0.412253 54.230.140.126 -> 172.31.8.238 TCP 7306 [TCP segment of a reassembled PDU]
 47   0.412261 172.31.8.238 -> 54.230.140.126 TCP 66 40629 > http [ACK] Seq=98 Ack=48432 Win=105984 Len=0 TSval=690177 TSecr=783338112
 48   0.413949 54.230.140.126 -> 172.31.8.238 TCP 5858 [TCP segment of a reassembled PDU]
