[Measurement for 10mb at 05:43:51 20.43.2014] 
Tshark:

  1   0.000000 172.31.8.238 -> 172.31.0.2   DNS 89 Standard query 0xd4c9  A d3m1c4hwkgedal.cloudfront.net
  2   0.000041 172.31.8.238 -> 172.31.0.2   DNS 89 Standard query 0xf08b  AAAA d3m1c4hwkgedal.cloudfront.net
  3   0.000638   172.31.0.2 -> 172.31.8.238 DNS 174 Standard query response 0xf08b 
  4   0.000662   172.31.0.2 -> 172.31.8.238 DNS 217 Standard query response 0xd4c9  A 54.192.118.232 A 54.192.118.247 A 54.230.116.204 A 54.230.117.86 A 54.230.118.136 A 54.239.132.26 A 54.239.132.147 A 54.239.132.249
  5   0.003909 172.31.8.238 -> 54.192.118.232 TCP 74 39382 > http [SYN] Seq=0 Win=26883 Len=0 MSS=8961 SACK_PERM=1 TSval=11464818 TSecr=0 WS=128
  6   0.004668 54.192.118.232 -> 172.31.8.238 TCP 74 http > 39382 [SYN, ACK] Seq=0 Ack=1 Win=14480 Len=0 MSS=1460 SACK_PERM=1 TSval=1683550924 TSecr=11464818 WS=128
  7   0.004682 172.31.8.238 -> 54.192.118.232 TCP 66 39382 > http [ACK] Seq=1 Ack=1 Win=27008 Len=0 TSval=11464819 TSecr=1683550924
  8   0.004722 172.31.8.238 -> 54.192.118.232 HTTP 163 GET /10mb HTTP/1.1 
  9   0.005507 54.192.118.232 -> 172.31.8.238 TCP 66 http > 39382 [ACK] Seq=1 Ack=98 Win=14592 Len=0 TSval=1683550924 TSecr=11464819
 10   0.007367 54.192.118.232 -> 172.31.8.238 TCP 524 [TCP segment of a reassembled PDU]
 11   0.007374 172.31.8.238 -> 54.192.118.232 TCP 66 39382 > http [ACK] Seq=98 Ack=459 Win=28032 Len=0 TSval=11464819 TSecr=1683550924
 12   0.007391 54.192.118.232 -> 172.31.8.238 TCP 13098 [TCP segment of a reassembled PDU]
 13   0.007401 172.31.8.238 -> 54.192.118.232 TCP 66 39382 > http [ACK] Seq=98 Ack=13491 Win=54144 Len=0 TSval=11464819 TSecr=1683550924
 14   0.008095 54.192.118.232 -> 172.31.8.238 TCP 13098 [TCP segment of a reassembled PDU]
 15   0.008105 172.31.8.238 -> 54.192.118.232 TCP 66 39382 > http [ACK] Seq=98 Ack=26523 Win=80128 Len=0 TSval=11464819 TSecr=1683550924
 16   0.008843 54.192.118.232 -> 172.31.8.238 TCP 2962 [TCP segment of a reassembled PDU]
 17   0.008849 172.31.8.238 -> 54.192.118.232 TCP 66 39382 > http [ACK] Seq=98 Ack=29419 Win=85888 Len=0 TSval=11464820 TSecr=1683550924
 18   0.008862 54.192.118.232 -> 172.31.8.238 TCP 10202 [TCP segment of a reassembled PDU]
 19   0.008871 172.31.8.238 -> 54.192.118.232 TCP 66 39382 > http [ACK] Seq=98 Ack=39555 Win=96512 Len=0 TSval=11464820 TSecr=1683550924
 20   0.009711 54.192.118.232 -> 172.31.8.238 TCP 21786 [TCP segment of a reassembled PDU]
 21   0.009725 172.31.8.238 -> 54.192.118.232 TCP 66 39382 > http [ACK] Seq=98 Ack=61275 Win=149632 Len=0 TSval=11464820 TSecr=1683550924
 22   0.010375 54.192.118.232 -> 172.31.8.238 TCP 1514 [TCP segment of a reassembled PDU]
 23   0.010380 172.31.8.238 -> 54.192.118.232 TCP 66 39382 > http [ACK] Seq=98 Ack=62723 Win=152576 Len=0 TSval=11464820 TSecr=1683550924
 24   0.010464 54.192.118.232 -> 172.31.8.238 TCP 11650 [TCP segment of a reassembled PDU]
 25   0.010472 172.31.8.238 -> 54.192.118.232 TCP 66 39382 > http [ACK] Seq=98 Ack=74307 Win=175744 Len=0 TSval=11464820 TSecr=1683550924
 26   0.010520 54.192.118.232 -> 172.31.8.238 TCP 10202 [TCP segment of a reassembled PDU]
 27   0.010529 172.31.8.238 -> 54.192.118.232 TCP 66 39382 > http [ACK] Seq=98 Ack=84443 Win=195968 Len=0 TSval=11464820 TSecr=1683550924
 28   0.011285 54.192.118.232 -> 172.31.8.238 TCP 7306 [TCP segment of a reassembled PDU]
 29   0.011292 172.31.8.238 -> 54.192.118.232 TCP 66 39382 > http [ACK] Seq=98 Ack=91683 Win=210432 Len=0 TSval=11464820 TSecr=1683550925
 30   0.011305 54.192.118.232 -> 172.31.8.238 TCP 13098 [TCP segment of a reassembled PDU]
 31   0.011314 172.31.8.238 -> 54.192.118.232 TCP 66 39382 > http [ACK] Seq=98 Ack=104715 Win=236544 Len=0 TSval=11464820 TSecr=1683550925
 32   0.011324 54.192.118.232 -> 172.31.8.238 TCP 7306 [TCP segment of a reassembled PDU]
 33   0.011328 172.31.8.238 -> 54.192.118.232 TCP 66 39382 > http [ACK] Seq=98 Ack=111955 Win=251008 Len=0 TSval=11464820 TSecr=1683550925
 34   0.011913 54.192.118.232 -> 172.31.8.238 TCP 5858 [TCP segment of a reassembled PDU]
 35   0.011920 172.31.8.238 -> 54.192.118.232 TCP 66 39382 > http [ACK] Seq=98 Ack=117747 Win=262656 Len=0 TSval=11464820 TSecr=1683550925
 36   0.011927 54.192.118.232 -> 172.31.8.238 TCP 2962 [TCP segment of a reassembled PDU]
 37   0.011930 172.31.8.238 -> 54.192.118.232 TCP 66 39382 > http [ACK] Seq=98 Ack=120643 Win=268416 Len=0 TSval=11464820 TSecr=1683550925
 38   0.011982 54.192.118.232 -> 172.31.8.238 TCP 18890 [TCP segment of a reassembled PDU]
 39   0.011995 172.31.8.238 -> 54.192.118.232 TCP 66 39382 > http [ACK] Seq=98 Ack=139467 Win=302464 Len=0 TSval=11464820 TSecr=1683550925
 40   0.012061 54.192.118.232 -> 172.31.8.238 TCP 4410 [TCP segment of a reassembled PDU]
 41   0.012067 172.31.8.238 -> 54.192.118.232 TCP 66 39382 > http [ACK] Seq=98 Ack=143811 Win=298240 Len=0 TSval=11464820 TSecr=1683550925
 42   0.012803 54.192.118.232 -> 172.31.8.238 TCP 4410 [TCP segment of a reassembled PDU]
 43   0.012810 172.31.8.238 -> 54.192.118.232 TCP 66 39382 > http [ACK] Seq=98 Ack=148155 Win=314752 Len=0 TSval=11464821 TSecr=1683550925
 44   0.012950 54.192.118.232 -> 172.31.8.238 TCP 21786 [TCP segment of a reassembled PDU]
 45   0.012961 172.31.8.238 -> 54.192.118.232 TCP 66 39382 > http [ACK] Seq=98 Ack=169875 Win=358144 Len=0 TSval=11464821 TSecr=1683550925
 46   0.013534 54.192.118.232 -> 172.31.8.238 TCP 10202 [TCP segment of a reassembled PDU]
 47   0.013543 172.31.8.238 -> 54.192.118.232 TCP 66 39382 > http [ACK] Seq=98 Ack=180011 Win=378496 Len=0 TSval=11464821 TSecr=1683550925
 48   0.013686 54.192.118.232 -> 172.31.8.238 TCP 29026 [TCP segment of a reassembled PDU]
 49   0.013701 172.31.8.238 -> 54.192.118.232 TCP 66 39382 > http [ACK] Seq=98 Ack=208971 Win=436352 Len=0 TSval=11464821 TSecr=1683550925
 50   0.014549 54.192.118.232 -> 172.31.8.238 TCP 10202 [TCP segment of a reassembled PDU]
 51   0.014557 172.31.8.238 -> 54.192.118.232 TCP 66 39382 > http [ACK] Seq=98 Ack=219107 Win=456576 Len=0 TSval=11464821 TSecr=1683550925
 52   0.014691 54.192.118.232 -> 172.31.8.238 TCP 29026 [TCP segment of a reassembled PDU]
 53   0.014706 172.31.8.238 -> 54.192.118.232 TCP 66 39382 > http [ACK] Seq=98 Ack=248067 Win=514560 Len=0 TSval=11464821 TSecr=1683550925
 54   0.015304 54.192.118.232 -> 172.31.8.238 TCP 7306 [TCP segment of a reassembled PDU]
 55   0.015311 172.31.8.238 -> 54.192.118.232 TCP 66 39382 > http [ACK] Seq=98 Ack=255307 Win=529024 Len=0 TSval=11464821 TSecr=1683550925
 56   0.015461 54.192.118.232 -> 172.31.8.238 TCP 26130 [TCP segment of a reassembled PDU]
 57   0.015475 172.31.8.238 -> 54.192.118.232 TCP 66 39382 > http [ACK] Seq=98 Ack=281371 Win=581120 Len=0 TSval=11464821 TSecr=1683550925
 58   0.015558 54.192.118.232 -> 172.31.8.238 TCP 13098 [TCP segment of a reassembled PDU]
 59   0.015568 172.31.8.238 -> 54.192.118.232 TCP 66 39382 > http [ACK] Seq=98 Ack=294403 Win=607232 Len=0 TSval=11464821 TSecr=1683550925
 60   0.016038 54.192.118.232 -> 172.31.8.238 TCP 7306 [TCP segment of a reassembled PDU]
 61   0.016044 172.31.8.238 -> 54.192.118.232 TCP 66 39382 > http [ACK] Seq=98 Ack=301643 Win=621696 Len=0 TSval=11464821 TSecr=1683550925
 62   0.016249 54.192.118.232 -> 172.31.8.238 TCP 29026 [TCP segment of a reassembled PDU]
 63   0.016268 172.31.8.238 -> 54.192.118.232 TCP 66 39382 > http [ACK] Seq=98 Ack=330603 Win=673152 Len=0 TSval=11464821 TSecr=1683550925
 64   0.016850 54.192.118.232 -> 172.31.8.238 TCP 8754 [TCP segment of a reassembled PDU]
 65   0.016858 172.31.8.238 -> 54.192.118.232 TCP 66 39382 > http [ACK] Seq=98 Ack=339291 Win=696960 Len=0 TSval=11464822 TSecr=1683550925
 66   0.017096 54.192.118.232 -> 172.31.8.238 TCP 39162 [TCP segment of a reassembled PDU]
 67   0.017116 172.31.8.238 -> 54.192.118.232 TCP 66 39382 > http [ACK] Seq=98 Ack=378387 Win=775168 Len=0 TSval=11464822 TSecr=1683550925
 68   0.017878 54.192.118.232 -> 172.31.8.238 TCP 10202 [TCP segment of a reassembled PDU]
 69   0.017886 172.31.8.238 -> 54.192.118.232 TCP 66 39382 > http [ACK] Seq=98 Ack=388523 Win=795520 Len=0 TSval=11464822 TSecr=1683550925
 70   0.018075 54.192.118.232 -> 172.31.8.238 TCP 46402 [TCP segment of a reassembled PDU]
 71   0.018109 172.31.8.238 -> 54.192.118.232 TCP 66 39382 > http [ACK] Seq=98 Ack=434859 Win=888192 Len=0 TSval=11464822 TSecr=1683550925
 72   0.018629 54.192.118.232 -> 172.31.8.238 TCP 5858 [TCP segment of a reassembled PDU]
 73   0.018636 172.31.8.238 -> 54.192.118.232 TCP 66 39382 > http [ACK] Seq=98 Ack=440651 Win=899712 Len=0 TSval=11464822 TSecr=1683550925
 74   0.018734 54.192.118.232 -> 172.31.8.238 TCP 2962 [TCP segment of a reassembled PDU]
 75   0.018739 172.31.8.238 -> 54.192.118.232 TCP 66 39382 > http [ACK] Seq=98 Ack=443547 Win=905472 Len=0 TSval=11464822 TSecr=1683550925
 76   0.018847 54.192.118.232 -> 172.31.8.238 TCP 7306 [TCP segment of a reassembled PDU]
 77   0.018853 172.31.8.238 -> 54.192.118.232 TCP 66 39382 > http [ACK] Seq=98 Ack=450787 Win=919936 Len=0 TSval=11464822 TSecr=1683550925
 78   0.019100 54.192.118.232 -> 172.31.8.238 TCP 43506 [TCP segment of a reassembled PDU]
 79   0.019121 172.31.8.238 -> 54.192.118.232 TCP 66 39382 > http [ACK] Seq=98 Ack=494227 Win=982784 Len=0 TSval=11464822 TSecr=1683550925
 80   0.019647 54.192.118.232 -> 172.31.8.238 TCP 5858 [TCP segment of a reassembled PDU]
 81   0.019654 172.31.8.238 -> 54.192.118.232 TCP 66 39382 > http [ACK] Seq=98 Ack=500019 Win=1018496 Len=0 TSval=11464822 TSecr=1683550925
 82   0.019946 54.192.118.232 -> 172.31.8.238 TCP 55090 [TCP segment of a reassembled PDU]
 83   0.019970 172.31.8.238 -> 54.192.118.232 TCP 66 39382 > http [ACK] Seq=98 Ack=555043 Win=963712 Len=0 TSval=11464822 TSecr=1683550925
 84   0.020015 54.192.118.232 -> 172.31.8.238 TCP 4410 [TCP segment of a reassembled PDU]
 85   0.020022 172.31.8.238 -> 54.192.118.232 TCP 66 39382 > http [ACK] Seq=98 Ack=559387 Win=1027200 Len=0 TSval=11464822 TSecr=1683550925
 86   0.020682 54.192.118.232 -> 172.31.8.238 TCP 4410 [TCP segment of a reassembled PDU]
 87   0.020687 172.31.8.238 -> 54.192.118.232 TCP 66 39382 > http [ACK] Seq=98 Ack=563731 Win=1035776 Len=0 TSval=11464823 TSecr=1683550925
 88   0.020978 54.192.118.232 -> 172.31.8.238 TCP 53642 [TCP segment of a reassembled PDU]
 89   0.021000 172.31.8.238 -> 54.192.118.232 TCP 66 39382 > http [ACK] Seq=98 Ack=617307 Win=982272 Len=0 TSval=11464823 TSecr=1683550925
 90   0.021008 54.192.118.232 -> 172.31.8.238 TCP 5858 [TCP segment of a reassembled PDU]
 91   0.021012 172.31.8.238 -> 54.192.118.232 TCP 66 39382 > http [ACK] Seq=98 Ack=623099 Win=976512 Len=0 TSval=11464823 TSecr=1683550925
 92   0.021699 54.192.118.232 -> 172.31.8.238 TCP 7306 [TCP segment of a reassembled PDU]
 93   0.021708 172.31.8.238 -> 54.192.118.232 TCP 66 39382 > http [ACK] Seq=98 Ack=630339 Win=1042304 Len=0 TSval=11464823 TSecr=1683550926
 94   0.021958 54.192.118.232 -> 172.31.8.238 TCP 8754 [TCP segment of a reassembled PDU]
 95   0.021965 172.31.8.238 -> 54.192.118.232 TCP 66 39382 > http [ACK] Seq=98 Ack=639027 Win=1040000 Len=0 TSval=11464823 TSecr=1683550926
 96   0.022005 54.192.118.232 -> 172.31.8.238 TCP 40610 [TCP segment of a reassembled PDU]
 97   0.022024 172.31.8.238 -> 54.192.118.232 TCP 66 39382 > http [ACK] Seq=98 Ack=679571 Win=999552 Len=0 TSval=11464823 TSecr=1683550926
 98   0.022064 54.192.118.232 -> 172.31.8.238 TCP 10202 [TCP segment of a reassembled PDU]
 99   0.022074 172.31.8.238 -> 54.192.118.232 TCP 66 39382 > http [ACK] Seq=98 Ack=689707 Win=1037568 Len=0 TSval=11464823 TSecr=1683550926
100   0.022444 54.192.118.232 -> 172.31.8.238 TCP 5858 [TCP segment of a reassembled PDU]
101   0.022451 172.31.8.238 -> 54.192.118.232 TCP 66 39382 > http [ACK] Seq=98 Ack=695499 Win=1044736 Len=0 TSval=11464823 TSecr=1683550926
102   0.022743 54.192.118.232 -> 172.31.8.238 TCP 46402 [TCP segment of a reassembled PDU]
103   0.022766 172.31.8.238 -> 54.192.118.232 TCP 66 39382 > http [ACK] Seq=98 Ack=741835 Win=998400 Len=0 TSval=11464823 TSecr=1683550926
104   0.022774 54.192.118.232 -> 172.31.8.238 TCP 5858 [TCP segment of a reassembled PDU]
105   0.022778 172.31.8.238 -> 54.192.118.232 TCP 66 39382 > http [ACK] Seq=98 Ack=747627 Win=992640 Len=0 TSval=11464823 TSecr=1683550926
106   0.022863 54.192.118.232 -> 172.31.8.238 TCP 21786 [TCP segment of a reassembled PDU]
107   0.022875 172.31.8.238 -> 54.192.118.232 TCP 66 39382 > http [ACK] Seq=98 Ack=769347 Win=1018496 Len=0 TSval=11464823 TSecr=1683550926
108   0.023484 54.192.118.232 -> 172.31.8.238 TCP 2962 [TCP segment of a reassembled PDU]
109   0.023490 172.31.8.238 -> 54.192.118.232 TCP 66 39382 > http [ACK] Seq=98 Ack=772243 Win=1049472 Len=0 TSval=11464823 TSecr=1683550926
110   0.023736 54.192.118.232 -> 172.31.8.238 TCP 31922 [TCP segment of a reassembled PDU]
111   0.023752 172.31.8.238 -> 54.192.118.232 TCP 66 39382 > http [ACK] Seq=98 Ack=804099 Win=1017728 Len=0 TSval=11464823 TSecr=1683550926
112   0.023781 54.192.118.232 -> 172.31.8.238 TCP 20338 [TCP segment of a reassembled PDU]
113   0.023792 172.31.8.238 -> 54.192.118.232 TCP 66 39382 > http [ACK] Seq=98 Ack=824371 Win=997504 Len=0 TSval=11464823 TSecr=1683550926
114   0.023835 54.192.118.232 -> 172.31.8.238 TCP 10202 [TCP segment of a reassembled PDU]
115   0.023843 172.31.8.238 -> 54.192.118.232 TCP 66 39382 > http [ACK] Seq=98 Ack=834507 Win=1037568 Len=0 TSval=11464823 TSecr=1683550926
116   0.024515 54.192.118.232 -> 172.31.8.238 TCP 4410 [TCP segment of a reassembled PDU]
117   0.024522 172.31.8.238 -> 54.192.118.232 TCP 66 39382 > http [ACK] Seq=98 Ack=838851 Win=1047040 Len=0 TSval=11464824 TSecr=1683550926
118   0.024762 54.192.118.232 -> 172.31.8.238 TCP 27578 [TCP segment of a reassembled PDU]
119   0.024787 172.31.8.238 -> 54.192.118.232 TCP 66 39382 > http [ACK] Seq=98 Ack=866363 Win=1019648 Len=0 TSval=11464824 TSecr=1683550926
120   0.024818 54.192.118.232 -> 172.31.8.238 TCP 24682 [TCP segment of a reassembled PDU]
121   0.024836 172.31.8.238 -> 54.192.118.232 TCP 66 39382 > http [ACK] Seq=98 Ack=890979 Win=1013760 Len=0 TSval=11464824 TSecr=1683550926
122   0.024887 54.192.118.232 -> 172.31.8.238 TCP 8754 [TCP segment of a reassembled PDU]
123   0.024894 172.31.8.238 -> 54.192.118.232 TCP 66 39382 > http [ACK] Seq=98 Ack=899667 Win=1040000 Len=0 TSval=11464824 TSecr=1683550926
124   0.025265 54.192.118.232 -> 172.31.8.238 TCP 2962 [TCP segment of a reassembled PDU]
125   0.025270 172.31.8.238 -> 54.192.118.232 TCP 66 39382 > http [ACK] Seq=98 Ack=902563 Win=1049472 Len=0 TSval=11464824 TSecr=1683550926
126   0.025497 54.192.118.232 -> 172.31.8.238 TCP 26130 [TCP segment of a reassembled PDU]
127   0.025522 172.31.8.238 -> 54.192.118.232 TCP 66 39382 > http [ACK] Seq=98 Ack=928627 Win=1023488 Len=0 TSval=11464824 TSecr=1683550926
128   0.025575 54.192.118.232 -> 172.31.8.238 TCP 26130 [TCP segment of a reassembled PDU]
129   0.025601 172.31.8.238 -> 54.192.118.232 TCP 66 39382 > http [ACK] Seq=98 Ack=954691 Win=1011456 Len=0 TSval=11464824 TSecr=1683550926
130   0.025661 54.192.118.232 -> 172.31.8.238 TCP 10202 [TCP segment of a reassembled PDU]
131   0.025669 172.31.8.238 -> 54.192.118.232 TCP 66 39382 > http [ACK] Seq=98 Ack=964827 Win=1037568 Len=0 TSval=11464824 TSecr=1683550926
132   0.025922 54.192.118.232 -> 172.31.8.238 TCP 20338 [TCP segment of a reassembled PDU]
133   0.025945 172.31.8.238 -> 54.192.118.232 TCP 66 39382 > http [ACK] Seq=98 Ack=985099 Win=1020928 Len=0 TSval=11464824 TSecr=1683550926
134   0.026069 54.192.118.232 -> 172.31.8.238 TCP 15994 [TCP segment of a reassembled PDU]
135   0.026079 172.31.8.238 -> 54.192.118.232 TCP 66 39382 > http [ACK] Seq=98 Ack=1001027 Win=1027968 Len=0 TSval=11464824 TSecr=1683550926
136   0.026431 54.192.118.232 -> 172.31.8.238 TCP 23234 [TCP segment of a reassembled PDU]
137   0.026455 172.31.8.238 -> 54.192.118.232 TCP 66 39382 > http [ACK] Seq=98 Ack=1024195 Win=1016192 Len=0 TSval=11464824 TSecr=1683550926
138   0.026557 54.192.118.232 -> 172.31.8.238 TCP 21786 [TCP segment of a reassembled PDU]
139   0.026570 172.31.8.238 -> 54.192.118.232 TCP 66 39382 > http [ACK] Seq=98 Ack=1045915 Win=1018496 Len=0 TSval=11464824 TSecr=1683550926
140   0.026834 54.192.118.232 -> 172.31.8.238 TCP 47850 [TCP segment of a reassembled PDU]
141   0.026870 172.31.8.238 -> 54.192.118.232 TCP 66 39382 > http [ACK] Seq=98 Ack=1093699 Win=975616 Len=0 TSval=11464824 TSecr=1683550926
142   0.026897 54.192.118.232 -> 172.31.8.238 TCP 1514 [TCP segment of a reassembled PDU]
143   0.026901 172.31.8.238 -> 54.192.118.232 TCP 66 39382 > http [ACK] Seq=98 Ack=1095147 Win=1051008 Len=0 TSval=11464824 TSecr=1683550926
144   0.027293 54.192.118.232 -> 172.31.8.238 TCP 2962 [TCP segment of a reassembled PDU]
145   0.027307 172.31.8.238 -> 54.192.118.232 TCP 66 39382 > http [ACK] Seq=98 Ack=1098043 Win=1051008 Len=0 TSval=11464824 TSecr=1683550926
146   0.027575 54.192.118.232 -> 172.31.8.238 TCP 57986 [TCP segment of a reassembled PDU]
147   0.027607 172.31.8.238 -> 54.192.118.232 TCP 66 39382 > http [ACK] Seq=98 Ack=1155963 Win=993152 Len=0 TSval=11464824 TSecr=1683550926
148   0.027667 54.192.118.232 -> 172.31.8.238 TCP 30474 [TCP segment of a reassembled PDU]
149   0.027681 172.31.8.238 -> 54.192.118.232 TCP 66 39382 > http [ACK] Seq=98 Ack=1186371 Win=1004160 Len=0 TSval=11464824 TSecr=1683550926
150   0.027765 54.192.118.232 -> 172.31.8.238 TCP 17442 [TCP segment of a reassembled PDU]
151   0.027774 172.31.8.238 -> 54.192.118.232 TCP 66 39382 > http [ACK] Seq=98 Ack=1203747 Win=1025664 Len=0 TSval=11464824 TSecr=1683550926
152   0.028213 54.192.118.232 -> 172.31.8.238 TCP 2962 [TCP segment of a reassembled PDU]
153   0.028219 172.31.8.238 -> 54.192.118.232 TCP 66 39382 > http [ACK] Seq=98 Ack=1206643 Win=1049472 Len=0 TSval=11464824 TSecr=1683550926
154   0.028544 54.192.118.232 -> 172.31.8.238 TCP 59434 [TCP segment of a reassembled PDU]
155   0.028576 54.192.118.232 -> 172.31.8.238 TCP 14546 [TCP segment of a reassembled PDU]
156   0.028586 54.192.118.232 -> 172.31.8.238 TCP 5858 [TCP segment of a reassembled PDU]
157   0.028591 54.192.118.232 -> 172.31.8.238 TCP 4410 [TCP segment of a reassembled PDU]
158   0.028610 172.31.8.238 -> 54.192.118.232 TCP 66 39382 > http [ACK] Seq=98 Ack=1290627 Win=1051008 Len=0 TSval=11464825 TSecr=1683550926
159   0.029544 54.192.118.232 -> 172.31.8.238 TCP 2962 [TCP segment of a reassembled PDU]
160   0.029551 172.31.8.238 -> 54.192.118.232 TCP 66 39382 > http [ACK] Seq=98 Ack=1293523 Win=1056768 Len=0 TSval=11464825 TSecr=1683550926
161   0.029811 54.192.118.232 -> 172.31.8.238 TCP 34818 [TCP segment of a reassembled PDU]
162   0.029829 172.31.8.238 -> 54.192.118.232 TCP 66 39382 > http [ACK] Seq=98 Ack=1328275 Win=1126272 Len=0 TSval=11464825 TSecr=1683550926
163   0.029854 54.192.118.232 -> 172.31.8.238 TCP 17442 [TCP segment of a reassembled PDU]
164   0.029863 172.31.8.238 -> 54.192.118.232 TCP 66 39382 > http [ACK] Seq=98 Ack=1345651 Win=1160960 Len=0 TSval=11464825 TSecr=1683550926
165   0.030039 54.192.118.232 -> 172.31.8.238 TCP 44954 [TCP segment of a reassembled PDU]
166   0.030061 172.31.8.238 -> 54.192.118.232 TCP 66 39382 > http [ACK] Seq=98 Ack=1390539 Win=1250816 Len=0 TSval=11464825 TSecr=1683550926
167   0.030067 54.192.118.232 -> 172.31.8.238 TCP 2962 [TCP segment of a reassembled PDU]
168   0.030070 172.31.8.238 -> 54.192.118.232 TCP 66 39382 > http [ACK] Seq=98 Ack=1393435 Win=1256576 Len=0 TSval=11464825 TSecr=1683550926
169   0.030100 54.192.118.232 -> 172.31.8.238 TCP 17442 [TCP segment of a reassembled PDU]
170   0.030112 172.31.8.238 -> 54.192.118.232 TCP 66 39382 > http [ACK] Seq=98 Ack=1410811 Win=1262208 Len=0 TSval=11464825 TSecr=1683550926
171   0.030266 54.192.118.232 -> 172.31.8.238 TCP 5858 [TCP segment of a reassembled PDU]
172   0.030272 172.31.8.238 -> 54.192.118.232 TCP 66 39382 > http [ACK] Seq=98 Ack=1416603 Win=1302912 Len=0 TSval=11464825 TSecr=1683550926
173   0.030388 54.192.118.232 -> 172.31.8.238 TCP 4410 [TCP segment of a reassembled PDU]
174   0.030395 172.31.8.238 -> 54.192.118.232 TCP 66 39382 > http [ACK] Seq=98 Ack=1420947 Win=1311616 Len=0 TSval=11464825 TSecr=1683550926
175   0.030763 54.192.118.232 -> 172.31.8.238 TCP 31922 [TCP segment of a reassembled PDU]
176   0.030781 172.31.8.238 -> 54.192.118.232 TCP 66 39382 > http [ACK] Seq=98 Ack=1452803 Win=1317120 Len=0 TSval=11464825 TSecr=1683550926
177   0.030800 54.192.118.232 -> 172.31.8.238 TCP 14546 [TCP segment of a reassembled PDU]
178   0.030817 172.31.8.238 -> 54.192.118.232 TCP 66 39382 > http [ACK] Seq=98 Ack=1467283 Win=1302656 Len=0 TSval=11464825 TSecr=1683550926
179   0.031005 54.192.118.232 -> 172.31.8.238 TCP 18890 [TCP segment of a reassembled PDU]
180   0.031016 172.31.8.238 -> 54.192.118.232 TCP 66 39382 > http [ACK] Seq=98 Ack=1486107 Win=1338624 Len=0 TSval=11464825 TSecr=1683550926
181   0.031036 54.192.118.232 -> 172.31.8.238 TCP 29026 [TCP segment of a reassembled PDU]
182   0.031065 172.31.8.238 -> 54.192.118.232 TCP 66 39382 > http [ACK] Seq=98 Ack=1515067 Win=1309696 Len=0 TSval=11464825 TSecr=1683550927
183   0.031137 54.192.118.232 -> 172.31.8.238 TCP 24682 [TCP segment of a reassembled PDU]
184   0.031151 172.31.8.238 -> 54.192.118.232 TCP 66 39382 > http [ACK] Seq=98 Ack=1539683 Win=1329152 Len=0 TSval=11464825 TSecr=1683550927
185   0.031546 54.192.118.232 -> 172.31.8.238 TCP 11650 [TCP segment of a reassembled PDU]
186   0.031556 172.31.8.238 -> 54.192.118.232 TCP 66 39382 > http [ACK] Seq=98 Ack=1551267 Win=1350528 Len=0 TSval=11464825 TSecr=1683550927
187   0.031766 54.192.118.232 -> 172.31.8.238 TCP 26130 [TCP segment of a reassembled PDU]
188   0.031804 172.31.8.238 -> 54.192.118.232 TCP 66 39382 > http [ACK] Seq=98 Ack=1577331 Win=1326720 Len=0 TSval=11464825 TSecr=1683550927
189   0.031924 54.192.118.232 -> 172.31.8.238 TCP 21786 [TCP segment of a reassembled PDU]
190   0.031938 172.31.8.238 -> 54.192.118.232 TCP 66 39382 > http [ACK] Seq=98 Ack=1599051 Win=1333888 Len=0 TSval=11464825 TSecr=1683550927
191   0.032067 54.192.118.232 -> 172.31.8.238 TCP 40610 [TCP segment of a reassembled PDU]
192   0.032099 172.31.8.238 -> 54.192.118.232 TCP 66 39382 > http [ACK] Seq=98 Ack=1639595 Win=1302784 Len=0 TSval=11464825 TSecr=1683550927
193   0.032199 54.192.118.232 -> 172.31.8.238 TCP 42058 [TCP segment of a reassembled PDU]
194   0.032232 172.31.8.238 -> 54.192.118.232 TCP 66 39382 > http [ACK] Seq=98 Ack=1681587 Win=1300480 Len=0 TSval=11464825 TSecr=1683550927
195   0.032587 54.192.118.232 -> 172.31.8.238 TCP 2962 [TCP segment of a reassembled PDU]
196   0.032594 172.31.8.238 -> 54.192.118.232 TCP 66 39382 > http [ACK] Seq=98 Ack=1684483 Win=1364736 Len=0 TSval=11464826 TSecr=1683550927
197   0.032787 54.192.118.232 -> 172.31.8.238 TCP 17442 [TCP segment of a reassembled PDU]
198   0.032815 54.192.118.232 -> 172.31.8.238 TCP 8754 [TCP segment of a reassembled PDU]
199   0.032821 172.31.8.238 -> 54.192.118.232 TCP 66 39382 > http [ACK] Seq=98 Ack=1701859 Win=1347456 Len=0 TSval=11464826 TSecr=1683550927
200   0.032834 172.31.8.238 -> 54.192.118.232 TCP 66 39382 > http [ACK] Seq=98 Ack=1710547 Win=1367424 Len=0 TSval=11464826 TSecr=1683550927
201   0.033006 54.192.118.232 -> 172.31.8.238 TCP 36266 [TCP segment of a reassembled PDU]
202   0.033033 54.192.118.232 -> 172.31.8.238 TCP 17442 [TCP segment of a reassembled PDU]
203   0.033054 172.31.8.238 -> 54.192.118.232 TCP 66 39382 > http [ACK] Seq=98 Ack=1764123 Win=1313920 Len=0 TSval=11464826 TSecr=1683550927
204   0.033208 54.192.118.232 -> 172.31.8.238 TCP 47850 [TCP segment of a reassembled PDU]
205   0.033242 172.31.8.238 -> 54.192.118.232 TCP 66 39382 > http [ACK] Seq=98 Ack=1811907 Win=1291008 Len=0 TSval=11464826 TSecr=1683550927
206   0.033600 54.192.118.232 -> 172.31.8.238 TCP 1514 [TCP segment of a reassembled PDU]
207   0.033736 54.192.118.232 -> 172.31.8.238 TCP 24682 [TCP segment of a reassembled PDU]
208   0.033751 172.31.8.238 -> 54.192.118.232 TCP 66 39382 > http [ACK] Seq=98 Ack=1837971 Win=1329152 Len=0 TSval=11464826 TSecr=1683550927
209   0.033832 54.192.118.232 -> 172.31.8.238 TCP 18890 [TCP segment of a reassembled PDU]
210   0.033843 172.31.8.238 -> 54.192.118.232 TCP 66 39382 > http [ACK] Seq=98 Ack=1856795 Win=1338624 Len=0 TSval=11464826 TSecr=1683550927
211   0.033965 54.192.118.232 -> 172.31.8.238 TCP 17442 [TCP segment of a reassembled PDU]
212   0.033983 172.31.8.238 -> 54.192.118.232 TCP 66 39382 > http [ACK] Seq=98 Ack=1874171 Win=1340928 Len=0 TSval=11464826 TSecr=1683550927
213   0.034168 54.192.118.232 -> 172.31.8.238 TCP 49298 [TCP segment of a reassembled PDU]
214   0.034190 172.31.8.238 -> 54.192.118.232 TCP 66 39382 > http [ACK] Seq=98 Ack=1923403 Win=1291776 Len=0 TSval=11464826 TSecr=1683550927
215   0.034274 54.192.118.232 -> 172.31.8.238 TCP 18890 [TCP segment of a reassembled PDU]
216   0.034279 172.31.8.238 -> 54.192.118.232 TCP 66 39382 > http [ACK] Seq=98 Ack=1942227 Win=1338624 Len=0 TSval=11464826 TSecr=1683550927
217   0.034739 54.192.118.232 -> 172.31.8.238 TCP 2962 [TCP segment of a reassembled PDU]
218   0.034745 172.31.8.238 -> 54.192.118.232 TCP 66 39382 > http [ACK] Seq=98 Ack=1945123 Win=1364736 Len=0 TSval=11464826 TSecr=1683550927
219   0.035018 54.192.118.232 -> 172.31.8.238 TCP 40610 [TCP segment of a reassembled PDU]
220   0.035039 172.31.8.238 -> 54.192.118.232 TCP 66 39382 > http [ACK] Seq=98 Ack=1985667 Win=1324288 Len=0 TSval=11464826 TSecr=1683550927
221   0.035228 54.192.118.232 -> 172.31.8.238 TCP 11650 [TCP segment of a reassembled PDU]
222   0.035234 172.31.8.238 -> 54.192.118.232 TCP 66 39382 > http [ACK] Seq=98 Ack=1997251 Win=1350528 Len=0 TSval=11464826 TSecr=1683550927
223   0.035338 54.192.118.232 -> 172.31.8.238 TCP 50746 [TCP segment of a reassembled PDU]
224   0.035361 172.31.8.238 -> 54.192.118.232 TCP 66 39382 > http [ACK] Seq=98 Ack=2047931 Win=1299968 Len=0 TSval=11464826 TSecr=1683550927
225   0.035397 54.192.118.232 -> 172.31.8.238 TCP 24682 [TCP segment of a reassembled PDU]
226   0.035417 172.31.8.238 -> 54.192.118.232 TCP 66 39382 > http [ACK] Seq=98 Ack=2072547 Win=1329152 Len=0 TSval=11464826 TSecr=1683550927
227   0.035723 54.192.118.232 -> 172.31.8.238 TCP 2962 [TCP segment of a reassembled PDU]
228   0.035728 172.31.8.238 -> 54.192.118.232 TCP 66 39382 > http [ACK] Seq=98 Ack=2075443 Win=1364736 Len=0 TSval=11464826 TSecr=1683550927
229   0.035980 54.192.118.232 -> 172.31.8.238 TCP 34818 [TCP segment of a reassembled PDU]
230   0.035999 172.31.8.238 -> 54.192.118.232 TCP 66 39382 > http [ACK] Seq=98 Ack=2110195 Win=1330048 Len=0 TSval=11464826 TSecr=1683550927
231   0.036219 54.192.118.232 -> 172.31.8.238 TCP 60882 [TCP segment of a reassembled PDU]
232   0.036242 172.31.8.238 -> 54.192.118.232 TCP 66 39382 > http [ACK] Seq=98 Ack=2171011 Win=1269504 Len=0 TSval=11464826 TSecr=1683550927
233   0.036267 54.192.118.232 -> 172.31.8.238 TCP 26130 [TCP segment of a reassembled PDU]
234   0.036276 172.31.8.238 -> 54.192.118.232 TCP 66 39382 > http [ACK] Seq=98 Ack=2197075 Win=1243520 Len=0 TSval=11464826 TSecr=1683550927
235   0.036325 54.192.118.232 -> 172.31.8.238 TCP 5858 [TCP segment of a reassembled PDU]
236   0.036329 172.31.8.238 -> 54.192.118.232 TCP 66 39382 > http [ACK] Seq=98 Ack=2202867 Win=1360000 Len=0 TSval=11464826 TSecr=1683550927
237   0.036692 54.192.118.232 -> 172.31.8.238 TCP 4410 [TCP segment of a reassembled PDU]
238   0.036699 172.31.8.238 -> 54.192.118.232 TCP 66 39382 > http [ACK] Seq=98 Ack=2207211 Win=1362432 Len=0 TSval=11464827 TSecr=1683550927
239   0.036936 54.192.118.232 -> 172.31.8.238 TCP 26130 [TCP segment of a reassembled PDU]
240   0.036983 172.31.8.238 -> 54.192.118.232 TCP 66 39382 > http [ACK] Seq=98 Ack=2233275 Win=1336448 Len=0 TSval=11464827 TSecr=1683550927
241   0.037228 54.192.118.232 -> 172.31.8.238 TCP 62330 [TCP segment of a reassembled PDU]
242   0.037266 54.192.118.232 -> 172.31.8.238 TCP 5858 [TCP segment of a reassembled PDU]
243   0.037277 172.31.8.238 -> 54.192.118.232 TCP 66 39382 > http [ACK] Seq=98 Ack=2301331 Win=1268480 Len=0 TSval=11464827 TSecr=1683550927
244   0.037284 54.192.118.232 -> 172.31.8.238 TCP 1514 [TCP Previous segment not captured] [TCP segment of a reassembled PDU]
245   0.037285 54.192.118.232 -> 172.31.8.238 TCP 1514 [TCP Out-Of-Order] [TCP segment of a reassembled PDU]
246   0.037288 172.31.8.238 -> 54.192.118.232 TCP 78 [TCP Dup ACK 243#1] 39382 > http [ACK] Seq=98 Ack=2301331 Win=1268480 Len=0 TSval=11464827 TSecr=1683550927 SLE=2302779 SRE=2304227
247   0.037290 172.31.8.238 -> 54.192.118.232 TCP 66 39382 > http [ACK] Seq=98 Ack=2304227 Win=1265664 Len=0 TSval=11464827 TSecr=1683550927
248   0.037448 54.192.118.232 -> 172.31.8.238 TCP 29026 [TCP segment of a reassembled PDU]
249   0.037455 172.31.8.238 -> 54.192.118.232 TCP 66 39382 > http [ACK] Seq=98 Ack=2333187 Win=1321856 Len=0 TSval=11464827 TSecr=1683550927
250   0.037836 54.192.118.232 -> 172.31.8.238 TCP 24682 [TCP segment of a reassembled PDU]
251   0.037846 172.31.8.238 -> 54.192.118.232 TCP 66 39382 > http [ACK] Seq=98 Ack=2357803 Win=1329152 Len=0 TSval=11464827 TSecr=1683550927
252   0.037925 54.192.118.232 -> 172.31.8.238 TCP 26130 [TCP segment of a reassembled PDU]
253   0.037932 172.31.8.238 -> 54.192.118.232 TCP 66 39382 > http [ACK] Seq=98 Ack=2383867 Win=1326720 Len=0 TSval=11464827 TSecr=1683550927
254   0.038014 54.192.118.232 -> 172.31.8.238 TCP 14546 [TCP segment of a reassembled PDU]
255   0.038019 172.31.8.238 -> 54.192.118.232 TCP 66 39382 > http [ACK] Seq=98 Ack=2398347 Win=1345664 Len=0 TSval=11464827 TSecr=1683550927
256   0.038260 54.192.118.232 -> 172.31.8.238 TCP 21786 [TCP segment of a reassembled PDU]
257   0.038267 172.31.8.238 -> 54.192.118.232 TCP 66 39382 > http [ACK] Seq=98 Ack=2420067 Win=1333888 Len=0 TSval=11464827 TSecr=1683550927
258   0.038297 54.192.118.232 -> 172.31.8.238 TCP 4410 [TCP segment of a reassembled PDU]
259   0.038300 172.31.8.238 -> 54.192.118.232 TCP 66 39382 > http [ACK] Seq=98 Ack=2424411 Win=1329664 Len=0 TSval=11464827 TSecr=1683550927
260   0.038465 54.192.118.232 -> 172.31.8.238 TCP 43506 [TCP segment of a reassembled PDU]
261   0.038475 172.31.8.238 -> 54.192.118.232 TCP 66 39382 > http [ACK] Seq=98 Ack=2467851 Win=1298048 Len=0 TSval=11464827 TSecr=1683550927
262   0.038615 54.192.118.232 -> 172.31.8.238 TCP 18890 [TCP segment of a reassembled PDU]
263   0.038626 172.31.8.238 -> 54.192.118.232 TCP 66 39382 > http [ACK] Seq=98 Ack=2486675 Win=1338624 Len=0 TSval=11464827 TSecr=1683550927
264   0.038848 54.192.118.232 -> 172.31.8.238 TCP 42058 [TCP segment of a reassembled PDU]
265   0.038857 172.31.8.238 -> 54.192.118.232 TCP 66 39382 > http [ACK] Seq=98 Ack=2528667 Win=1300480 Len=0 TSval=11464827 TSecr=1683550927
266   0.039140 54.192.118.232 -> 172.31.8.238 TCP 18890 [TCP segment of a reassembled PDU]
267   0.039147 172.31.8.238 -> 54.192.118.232 TCP 66 39382 > http [ACK] Seq=98 Ack=2547491 Win=1338624 Len=0 TSval=11464827 TSecr=1683550927
268   0.039419 54.192.118.232 -> 172.31.8.238 TCP 43506 [TCP segment of a reassembled PDU]
269   0.039428 172.31.8.238 -> 54.192.118.232 TCP 66 39382 > http [ACK] Seq=98 Ack=2590931 Win=1298048 Len=0 TSval=11464827 TSecr=1683550927
270   0.039450 54.192.118.232 -> 172.31.8.238 TCP 8754 [TCP segment of a reassembled PDU]
271   0.039453 172.31.8.238 -> 54.192.118.232 TCP 66 39382 > http [ACK] Seq=98 Ack=2599619 Win=1289472 Len=0 TSval=11464827 TSecr=1683550927
272   0.039536 54.192.118.232 -> 172.31.8.238 TCP 20338 [TCP segment of a reassembled PDU]
273   0.039543 172.31.8.238 -> 54.192.118.232 TCP 66 39382 > http [ACK] Seq=98 Ack=2619891 Win=1336192 Len=0 TSval=11464827 TSecr=1683550927
274   0.039815 54.192.118.232 -> 172.31.8.238 TCP 33370 [TCP segment of a reassembled PDU]
275   0.039823 172.31.8.238 -> 54.192.118.232 TCP 66 39382 > http [ACK] Seq=98 Ack=2653195 Win=1314816 Len=0 TSval=11464827 TSecr=1683550927
276   0.039848 54.192.118.232 -> 172.31.8.238 TCP 11650 [TCP segment of a reassembled PDU]
277   0.039860 172.31.8.238 -> 54.192.118.232 TCP 66 39382 > http [ACK] Seq=98 Ack=2664779 Win=1303296 Len=0 TSval=11464827 TSecr=1683550927
278   0.039976 54.192.118.232 -> 172.31.8.238 TCP 36266 [TCP segment of a reassembled PDU]
279   0.039984 172.31.8.238 -> 54.192.118.232 TCP 66 39382 > http [ACK] Seq=98 Ack=2700979 Win=1310080 Len=0 TSval=11464827 TSecr=1683550927
280   0.040108 54.192.118.232 -> 172.31.8.238 TCP 21786 [TCP segment of a reassembled PDU]
281   0.040117 172.31.8.238 -> 54.192.118.232 TCP 66 39382 > http [ACK] Seq=98 Ack=2722699 Win=1333888 Len=0 TSval=11464827 TSecr=1683550927
282   0.040215 54.192.118.232 -> 172.31.8.238 TCP 14546 [TCP segment of a reassembled PDU]
283   0.040221 172.31.8.238 -> 54.192.118.232 TCP 66 39382 > http [ACK] Seq=98 Ack=2737179 Win=1345664 Len=0 TSval=11464827 TSecr=1683550927
284   0.040435 54.192.118.232 -> 172.31.8.238 TCP 26130 [TCP segment of a reassembled PDU]
285   0.040455 172.31.8.238 -> 54.192.118.232 TCP 66 39382 > http [ACK] Seq=98 Ack=2763243 Win=1326720 Len=0 TSval=11464827 TSecr=1683550927
286   0.040500 54.192.118.232 -> 172.31.8.238 TCP 18890 [TCP segment of a reassembled PDU]
287   0.040506 172.31.8.238 -> 54.192.118.232 TCP 66 39382 > http [ACK] Seq=98 Ack=2782067 Win=1338624 Len=0 TSval=11464827 TSecr=1683550927
288   0.040687 54.192.118.232 -> 172.31.8.238 TCP 7306 [TCP segment of a reassembled PDU]
289   0.040692 172.31.8.238 -> 54.192.118.232 TCP 66 39382 > http [ACK] Seq=98 Ack=2789307 Win=1357696 Len=0 TSval=11464828 TSecr=1683550927
290   0.040703 54.192.118.232 -> 172.31.8.238 TCP 15994 [TCP segment of a reassembled PDU]
291   0.040718 172.31.8.238 -> 54.192.118.232 TCP 66 39382 > http [ACK] Seq=98 Ack=2805235 Win=1343360 Len=0 TSval=11464828 TSecr=1683550927
292   0.040735 54.192.118.232 -> 172.31.8.238 TCP 10202 [TCP segment of a reassembled PDU]
293   0.040738 172.31.8.238 -> 54.192.118.232 TCP 66 39382 > http [ACK] Seq=98 Ack=2815371 Win=1352960 Len=0 TSval=11464828 TSecr=1683550927
294   0.040996 54.192.118.232 -> 172.31.8.238 TCP 39162 [TCP segment of a reassembled PDU]
295   0.041010 54.192.118.232 -> 172.31.8.238 TCP 2962 [TCP segment of a reassembled PDU]
296   0.041024 172.31.8.238 -> 54.192.118.232 TCP 66 39382 > http [ACK] Seq=98 Ack=2857363 Win=1310976 Len=0 TSval=11464828 TSecr=1683550927
297   0.041130 54.192.118.232 -> 172.31.8.238 TCP 20338 [TCP segment of a reassembled PDU]
298   0.041136 172.31.8.238 -> 54.192.118.232 TCP 66 39382 > http [ACK] Seq=98 Ack=2877635 Win=1336192 Len=0 TSval=11464828 TSecr=1683550928
299   0.041259 54.192.118.232 -> 172.31.8.238 TCP 42058 [TCP segment of a reassembled PDU]
300   0.041279 172.31.8.238 -> 54.192.118.232 TCP 66 39382 > http [ACK] Seq=98 Ack=2919627 Win=1300480 Len=0 TSval=11464828 TSecr=1683550928
301   0.041583 54.192.118.232 -> 172.31.8.238 TCP 20338 [TCP segment of a reassembled PDU]
302   0.041591 172.31.8.238 -> 54.192.118.232 TCP 66 39382 > http [ACK] Seq=98 Ack=2939899 Win=1336192 Len=0 TSval=11464828 TSecr=1683550928
303   0.041596 54.192.118.232 -> 172.31.8.238 TCP 1514 [TCP segment of a reassembled PDU]
304   0.041820 54.192.118.232 -> 172.31.8.238 TCP 39162 [TCP segment of a reassembled PDU]
305   0.041833 54.192.118.232 -> 172.31.8.238 TCP 10202 [TCP segment of a reassembled PDU]
306   0.041848 172.31.8.238 -> 54.192.118.232 TCP 66 39382 > http [ACK] Seq=98 Ack=2990579 Win=1288576 Len=0 TSval=11464828 TSecr=1683550928
307   0.041974 54.192.118.232 -> 172.31.8.238 TCP 20338 [TCP segment of a reassembled PDU]
308   0.041980 172.31.8.238 -> 54.192.118.232 TCP 66 39382 > http [ACK] Seq=98 Ack=3010851 Win=1336192 Len=0 TSval=11464828 TSecr=1683550928
309   0.042234 54.192.118.232 -> 172.31.8.238 TCP 42058 [TCP segment of a reassembled PDU]
310   0.042259 54.192.118.232 -> 172.31.8.238 TCP 8754 [TCP segment of a reassembled PDU]
311   0.042267 172.31.8.238 -> 54.192.118.232 TCP 66 39382 > http [ACK] Seq=98 Ack=3052843 Win=1300480 Len=0 TSval=11464828 TSecr=1683550928
312   0.042280 172.31.8.238 -> 54.192.118.232 TCP 66 39382 > http [ACK] Seq=98 Ack=3061531 Win=1291904 Len=0 TSval=11464828 TSecr=1683550928
313   0.042365 54.192.118.232 -> 172.31.8.238 TCP 26130 [TCP segment of a reassembled PDU]
314   0.042372 172.31.8.238 -> 54.192.118.232 TCP 66 39382 > http [ACK] Seq=98 Ack=3087595 Win=1326720 Len=0 TSval=11464828 TSecr=1683550928
315   0.042507 54.192.118.232 -> 172.31.8.238 TCP 15994 [TCP segment of a reassembled PDU]
316   0.042512 172.31.8.238 -> 54.192.118.232 TCP 66 39382 > http [ACK] Seq=98 Ack=3103523 Win=1343360 Len=0 TSval=11464828 TSecr=1683550928
317   0.042622 54.192.118.232 -> 172.31.8.238 TCP 18890 [TCP segment of a reassembled PDU]
318   0.042640 172.31.8.238 -> 54.192.118.232 TCP 66 39382 > http [ACK] Seq=98 Ack=3122347 Win=1338624 Len=0 TSval=11464828 TSecr=1683550928
319   0.042731 54.192.118.232 -> 172.31.8.238 TCP 23234 [TCP segment of a reassembled PDU]
320   0.042749 172.31.8.238 -> 54.192.118.232 TCP 66 39382 > http [ACK] Seq=98 Ack=3145515 Win=1331456 Len=0 TSval=11464828 TSecr=1683550928
321   0.042894 54.192.118.232 -> 172.31.8.238 TCP 20338 [TCP segment of a reassembled PDU]
322   0.042900 172.31.8.238 -> 54.192.118.232 TCP 66 39382 > http [ACK] Seq=98 Ack=3165787 Win=1336192 Len=0 TSval=11464828 TSecr=1683550928
323   0.043136 54.192.118.232 -> 172.31.8.238 TCP 62330 [TCP segment of a reassembled PDU]
324   0.043158 172.31.8.238 -> 54.192.118.232 TCP 66 39382 > http [ACK] Seq=98 Ack=3228051 Win=1273984 Len=0 TSval=11464828 TSecr=1683550928
325   0.043219 54.192.118.232 -> 172.31.8.238 TCP 10202 [TCP segment of a reassembled PDU]
326   0.043223 172.31.8.238 -> 54.192.118.232 TCP 66 39382 > http [ACK] Seq=98 Ack=3238187 Win=1352960 Len=0 TSval=11464828 TSecr=1683550928
327   0.043282 54.192.118.232 -> 172.31.8.238 TCP 24682 [TCP segment of a reassembled PDU]
328   0.043348 172.31.8.238 -> 54.192.118.232 TCP 66 39382 > http [ACK] Seq=98 Ack=3262803 Win=1329152 Len=0 TSval=11464828 TSecr=1683550928
329   0.043468 54.192.118.232 -> 172.31.8.238 TCP 27578 [TCP segment of a reassembled PDU]
330   0.043489 172.31.8.238 -> 54.192.118.232 TCP 66 39382 > http [ACK] Seq=98 Ack=3290315 Win=1324288 Len=0 TSval=11464828 TSecr=1683550928
331   0.043520 54.192.118.232 -> 172.31.8.238 TCP 20338 [TCP segment of a reassembled PDU]
332   0.043525 172.31.8.238 -> 54.192.118.232 TCP 66 39382 > http [ACK] Seq=98 Ack=3310587 Win=1336192 Len=0 TSval=11464828 TSecr=1683550928
333   0.043750 54.192.118.232 -> 172.31.8.238 TCP 24682 [TCP segment of a reassembled PDU]
334   0.043767 172.31.8.238 -> 54.192.118.232 TCP 66 39382 > http [ACK] Seq=98 Ack=3335203 Win=1329152 Len=0 TSval=11464828 TSecr=1683550928
335   0.044002 54.192.118.232 -> 172.31.8.238 TCP 17442 [TCP segment of a reassembled PDU]
336   0.044010 172.31.8.238 -> 54.192.118.232 TCP 66 39382 > http [ACK] Seq=98 Ack=3352579 Win=1340928 Len=0 TSval=11464828 TSecr=1683550928
337   0.044324 54.192.118.232 -> 172.31.8.238 TCP 62330 [TCP segment of a reassembled PDU]
338   0.044347 172.31.8.238 -> 54.192.118.232 TCP 66 39382 > http [ACK] Seq=98 Ack=3414843 Win=1278720 Len=0 TSval=11464828 TSecr=1683550928
339   0.044421 54.192.118.232 -> 172.31.8.238 TCP 23234 [TCP segment of a reassembled PDU]
340   0.044428 172.31.8.238 -> 54.192.118.232 TCP 66 39382 > http [ACK] Seq=98 Ack=3438011 Win=1331456 Len=0 TSval=11464828 TSecr=1683550928
341   0.044489 54.192.118.232 -> 172.31.8.238 TCP 2962 [TCP segment of a reassembled PDU]
342   0.044493 172.31.8.238 -> 54.192.118.232 TCP 66 39382 > http [ACK] Seq=98 Ack=3440907 Win=1364736 Len=0 TSval=11464828 TSecr=1683550928
343   0.044517 54.192.118.232 -> 172.31.8.238 TCP 36266 [TCP segment of a reassembled PDU]
344   0.044546 54.192.118.232 -> 172.31.8.238 TCP 7306 [TCP segment of a reassembled PDU]
345   0.044622 54.192.118.232 -> 172.31.8.238 TCP 21786 [TCP segment of a reassembled PDU]
346   0.044672 172.31.8.238 -> 54.192.118.232 TCP 66 39382 > http [ACK] Seq=98 Ack=3506067 Win=1361408 Len=0 TSval=11464829 TSecr=1683550928
