[Measurement for 10mb at 12:43:52 20.43.2014] 
Tshark:

  1   0.000000 172.31.8.238 -> 172.31.0.2   DNS 89 Standard query 0xda96  A d3m1c4hwkgedal.cloudfront.net
  2   0.000025 172.31.8.238 -> 172.31.0.2   DNS 89 Standard query 0xa911  AAAA d3m1c4hwkgedal.cloudfront.net
  3   0.000514   172.31.0.2 -> 172.31.8.238 DNS 174 Standard query response 0xa911 
  4   0.000526   172.31.0.2 -> 172.31.8.238 DNS 217 Standard query response 0xda96  A 54.239.132.98 A 54.239.132.103 A 54.192.118.239 A 54.230.116.44 A 54.230.116.72 A 54.230.118.248 A 54.239.132.26 A 54.239.132.83
  5   0.003868 172.31.8.238 -> 54.239.132.98 TCP 74 47291 > http [SYN] Seq=0 Win=26883 Len=0 MSS=8961 SACK_PERM=1 TSval=17764983 TSecr=0 WS=128
  6   0.004486 54.239.132.98 -> 172.31.8.238 TCP 74 http > 47291 [SYN, ACK] Seq=0 Ack=1 Win=14480 Len=0 MSS=1460 SACK_PERM=1 TSval=1499025113 TSecr=17764983 WS=128
  7   0.004501 172.31.8.238 -> 54.239.132.98 TCP 66 47291 > http [ACK] Seq=1 Ack=1 Win=27008 Len=0 TSval=17764983 TSecr=1499025113
  8   0.004539 172.31.8.238 -> 54.239.132.98 HTTP 163 GET /10mb HTTP/1.1 
  9   0.005177 54.239.132.98 -> 172.31.8.238 TCP 66 http > 47291 [ACK] Seq=1 Ack=98 Win=14592 Len=0 TSval=1499025113 TSecr=17764983
 10   0.007223 54.239.132.98 -> 172.31.8.238 TCP 524 [TCP segment of a reassembled PDU]
 11   0.007229 172.31.8.238 -> 54.239.132.98 TCP 66 47291 > http [ACK] Seq=98 Ack=459 Win=28032 Len=0 TSval=17764984 TSecr=1499025113
 12   0.007319 54.239.132.98 -> 172.31.8.238 TCP 10202 [TCP segment of a reassembled PDU]
 13   0.007328 172.31.8.238 -> 54.239.132.98 TCP 66 47291 > http [ACK] Seq=98 Ack=10595 Win=48256 Len=0 TSval=17764984 TSecr=1499025113
 14   0.007385 54.239.132.98 -> 172.31.8.238 TCP 2962 [TCP segment of a reassembled PDU]
 15   0.007391 172.31.8.238 -> 54.239.132.98 TCP 66 47291 > http [ACK] Seq=98 Ack=13491 Win=54144 Len=0 TSval=17764984 TSecr=1499025113
 16   0.007765 54.239.132.98 -> 172.31.8.238 TCP 5858 [TCP segment of a reassembled PDU]
 17   0.007772 172.31.8.238 -> 54.239.132.98 TCP 66 47291 > http [ACK] Seq=98 Ack=19283 Win=65664 Len=0 TSval=17764984 TSecr=1499025113
 18   0.007864 54.239.132.98 -> 172.31.8.238 TCP 7306 [TCP segment of a reassembled PDU]
 19   0.007871 172.31.8.238 -> 54.239.132.98 TCP 66 47291 > http [ACK] Seq=98 Ack=26523 Win=80128 Len=0 TSval=17764984 TSecr=1499025113
 20   0.008337 54.239.132.98 -> 172.31.8.238 TCP 4410 [TCP segment of a reassembled PDU]
 21   0.008343 172.31.8.238 -> 54.239.132.98 TCP 66 47291 > http [ACK] Seq=98 Ack=30867 Win=88832 Len=0 TSval=17764984 TSecr=1499025113
 22   0.008473 54.239.132.98 -> 172.31.8.238 TCP 17442 [TCP segment of a reassembled PDU]
 23   0.008484 172.31.8.238 -> 54.239.132.98 TCP 66 47291 > http [ACK] Seq=98 Ack=48243 Win=89344 Len=0 TSval=17764984 TSecr=1499025113
 24   0.008834 54.239.132.98 -> 172.31.8.238 TCP 4410 [TCP segment of a reassembled PDU]
 25   0.008840 172.31.8.238 -> 54.239.132.98 TCP 66 47291 > http [ACK] Seq=98 Ack=52587 Win=109056 Len=0 TSval=17764984 TSecr=1499025113
 26   0.009124 54.239.132.98 -> 172.31.8.238 TCP 10202 [TCP segment of a reassembled PDU]
 27   0.009131 172.31.8.238 -> 54.239.132.98 TCP 66 47291 > http [ACK] Seq=98 Ack=62723 Win=101248 Len=0 TSval=17764984 TSecr=1499025113
 28   0.009164 54.239.132.98 -> 172.31.8.238 TCP 2962 [TCP segment of a reassembled PDU]
 29   0.009169 172.31.8.238 -> 54.239.132.98 TCP 66 47291 > http [ACK] Seq=98 Ack=65619 Win=109056 Len=0 TSval=17764984 TSecr=1499025113
 30   0.009370 54.239.132.98 -> 172.31.8.238 TCP 13098 [TCP segment of a reassembled PDU]
 31   0.009379 172.31.8.238 -> 54.239.132.98 TCP 66 47291 > http [ACK] Seq=98 Ack=78651 Win=96512 Len=0 TSval=17764984 TSecr=1499025113
 32   0.009641 54.239.132.98 -> 172.31.8.238 TCP 11650 [TCP segment of a reassembled PDU]
 33   0.009651 172.31.8.238 -> 54.239.132.98 TCP 66 47291 > http [ACK] Seq=98 Ack=90235 Win=98944 Len=0 TSval=17764984 TSecr=1499025113
 34   0.009923 54.239.132.98 -> 172.31.8.238 TCP 10202 [TCP segment of a reassembled PDU]
 35   0.009931 172.31.8.238 -> 54.239.132.98 TCP 66 47291 > http [ACK] Seq=98 Ack=100371 Win=101248 Len=0 TSval=17764984 TSecr=1499025113
 36   0.009961 54.239.132.98 -> 172.31.8.238 TCP 1514 [TCP segment of a reassembled PDU]
 37   0.009968 172.31.8.238 -> 54.239.132.98 TCP 66 47291 > http [ACK] Seq=98 Ack=101819 Win=109056 Len=0 TSval=17764984 TSecr=1499025113
 38   0.010259 54.239.132.98 -> 172.31.8.238 TCP 20338 [TCP segment of a reassembled PDU]
 39   0.010270 172.31.8.238 -> 54.239.132.98 TCP 66 47291 > http [ACK] Seq=98 Ack=122091 Win=88832 Len=0 TSval=17764984 TSecr=1499025113
 40   0.010609 54.239.132.98 -> 172.31.8.238 TCP 2962 [TCP segment of a reassembled PDU]
 41   0.010614 172.31.8.238 -> 54.239.132.98 TCP 66 47291 > http [ACK] Seq=98 Ack=124987 Win=109056 Len=0 TSval=17764984 TSecr=1499025113
 42   0.010728 54.239.132.98 -> 172.31.8.238 TCP 11650 [TCP segment of a reassembled PDU]
 43   0.010736 172.31.8.238 -> 54.239.132.98 TCP 66 47291 > http [ACK] Seq=98 Ack=136571 Win=97536 Len=0 TSval=17764984 TSecr=1499025113
 44   0.010895 54.239.132.98 -> 172.31.8.238 TCP 11650 [TCP segment of a reassembled PDU]
 45   0.010903 172.31.8.238 -> 54.239.132.98 TCP 66 47291 > http [ACK] Seq=98 Ack=148155 Win=86016 Len=0 TSval=17764984 TSecr=1499025113
 46   0.011194 54.239.132.98 -> 172.31.8.238 TCP 14546 [TCP segment of a reassembled PDU]
 47   0.011204 172.31.8.238 -> 54.239.132.98 TCP 66 47291 > http [ACK] Seq=98 Ack=162635 Win=94080 Len=0 TSval=17764985 TSecr=1499025113
 48   0.011491 54.239.132.98 -> 172.31.8.238 TCP 21786 [TCP segment of a reassembled PDU]
 49   0.011503 172.31.8.238 -> 54.239.132.98 TCP 66 47291 > http [ACK] Seq=98 Ack=184355 Win=152448 Len=0 TSval=17764985 TSecr=1499025113
 50   0.011509 54.239.132.98 -> 172.31.8.238 TCP 1514 [TCP segment of a reassembled PDU]
 51   0.011511 172.31.8.238 -> 54.239.132.98 TCP 66 47291 > http [ACK] Seq=98 Ack=185803 Win=155392 Len=0 TSval=17764985 TSecr=1499025113
 52   0.011519 54.239.132.98 -> 172.31.8.238 TCP 2962 [TCP segment of a reassembled PDU]
 53   0.011522 172.31.8.238 -> 54.239.132.98 TCP 66 47291 > http [ACK] Seq=98 Ack=188699 Win=161152 Len=0 TSval=17764985 TSecr=1499025113
 54   0.011659 54.239.132.98 -> 172.31.8.238 TCP 2962 [TCP segment of a reassembled PDU]
 55   0.011664 172.31.8.238 -> 54.239.132.98 TCP 66 47291 > http [ACK] Seq=98 Ack=191595 Win=167040 Len=0 TSval=17764985 TSecr=1499025114
 56   0.011946 54.239.132.98 -> 172.31.8.238 TCP 2962 [TCP segment of a reassembled PDU]
 57   0.011951 172.31.8.238 -> 54.239.132.98 TCP 66 47291 > http [ACK] Seq=98 Ack=194491 Win=172800 Len=0 TSval=17764985 TSecr=1499025114
 58   0.012250 54.239.132.98 -> 172.31.8.238 TCP 26130 [TCP segment of a reassembled PDU]
 59   0.012263 172.31.8.238 -> 54.239.132.98 TCP 66 47291 > http [ACK] Seq=98 Ack=220555 Win=224896 Len=0 TSval=17764985 TSecr=1499025114
 60   0.012306 54.239.132.98 -> 172.31.8.238 TCP 17442 [TCP segment of a reassembled PDU]
 61   0.012316 172.31.8.238 -> 54.239.132.98 TCP 66 47291 > http [ACK] Seq=98 Ack=237931 Win=259712 Len=0 TSval=17764985 TSecr=1499025114
 62   0.012882 54.239.132.98 -> 172.31.8.238 TCP 5858 [TCP segment of a reassembled PDU]
 63   0.012888 172.31.8.238 -> 54.239.132.98 TCP 66 47291 > http [ACK] Seq=98 Ack=243723 Win=271232 Len=0 TSval=17764985 TSecr=1499025114
 64   0.013051 54.239.132.98 -> 172.31.8.238 TCP 26130 [TCP segment of a reassembled PDU]
 65   0.013065 172.31.8.238 -> 54.239.132.98 TCP 66 47291 > http [ACK] Seq=98 Ack=269787 Win=323328 Len=0 TSval=17764985 TSecr=1499025114
 66   0.013092 54.239.132.98 -> 172.31.8.238 TCP 11650 [TCP segment of a reassembled PDU]
 67   0.013100 172.31.8.238 -> 54.239.132.98 TCP 66 47291 > http [ACK] Seq=98 Ack=281371 Win=346496 Len=0 TSval=17764985 TSecr=1499025114
 68   0.013668 54.239.132.98 -> 172.31.8.238 TCP 4410 [TCP segment of a reassembled PDU]
 69   0.013675 172.31.8.238 -> 54.239.132.98 TCP 66 47291 > http [ACK] Seq=98 Ack=285715 Win=355200 Len=0 TSval=17764985 TSecr=1499025114
 70   0.013832 54.239.132.98 -> 172.31.8.238 TCP 14546 [TCP segment of a reassembled PDU]
 71   0.013842 172.31.8.238 -> 54.239.132.98 TCP 66 47291 > http [ACK] Seq=98 Ack=300195 Win=384128 Len=0 TSval=17764985 TSecr=1499025114
 72   0.013865 54.239.132.98 -> 172.31.8.238 TCP 1514 [TCP Previous segment not captured] [TCP segment of a reassembled PDU]
 73   0.013869 172.31.8.238 -> 54.239.132.98 TCP 78 [TCP Window Update] 47291 > http [ACK] Seq=98 Ack=300195 Win=387072 Len=0 TSval=17764985 TSecr=1499025114 SLE=301643 SRE=303091
 74   0.013928 54.239.132.98 -> 172.31.8.238 TCP 1514 [TCP Out-Of-Order] [TCP segment of a reassembled PDU]
 75   0.013933 172.31.8.238 -> 54.239.132.98 TCP 66 47291 > http [ACK] Seq=98 Ack=303091 Win=390016 Len=0 TSval=17764985 TSecr=1499025114
 76   0.014005 54.239.132.98 -> 172.31.8.238 TCP 21786 [TCP segment of a reassembled PDU]
 77   0.014025 172.31.8.238 -> 54.239.132.98 TCP 66 47291 > http [ACK] Seq=98 Ack=324811 Win=433408 Len=0 TSval=17764985 TSecr=1499025114
 78   0.014467 54.239.132.98 -> 172.31.8.238 TCP 4410 [TCP segment of a reassembled PDU]
 79   0.014473 172.31.8.238 -> 54.239.132.98 TCP 66 47291 > http [ACK] Seq=98 Ack=329155 Win=442112 Len=0 TSval=17764985 TSecr=1499025114
 80   0.014625 54.239.132.98 -> 172.31.8.238 TCP 18890 [TCP segment of a reassembled PDU]
 81   0.014635 172.31.8.238 -> 54.239.132.98 TCP 66 47291 > http [ACK] Seq=98 Ack=347979 Win=479744 Len=0 TSval=17764985 TSecr=1499025114
 82   0.014661 54.239.132.98 -> 172.31.8.238 TCP 7306 [TCP segment of a reassembled PDU]
 83   0.014667 172.31.8.238 -> 54.239.132.98 TCP 66 47291 > http [ACK] Seq=98 Ack=355219 Win=494208 Len=0 TSval=17764985 TSecr=1499025114
 84   0.014741 54.239.132.98 -> 172.31.8.238 TCP 23234 [TCP segment of a reassembled PDU]
 85   0.014753 172.31.8.238 -> 54.239.132.98 TCP 66 47291 > http [ACK] Seq=98 Ack=378387 Win=540544 Len=0 TSval=17764985 TSecr=1499025114
 86   0.015461 54.239.132.98 -> 172.31.8.238 TCP 4410 [TCP segment of a reassembled PDU]
 87   0.015468 172.31.8.238 -> 54.239.132.98 TCP 66 47291 > http [ACK] Seq=98 Ack=382731 Win=549248 Len=0 TSval=17764986 TSecr=1499025114
 88   0.015659 54.239.132.98 -> 172.31.8.238 TCP 26130 [TCP segment of a reassembled PDU]
 89   0.015672 172.31.8.238 -> 54.239.132.98 TCP 66 47291 > http [ACK] Seq=98 Ack=408795 Win=601344 Len=0 TSval=17764986 TSecr=1499025114
 90   0.015725 54.239.132.98 -> 172.31.8.238 TCP 23234 [TCP segment of a reassembled PDU]
 91   0.015738 172.31.8.238 -> 54.239.132.98 TCP 66 47291 > http [ACK] Seq=98 Ack=431963 Win=647680 Len=0 TSval=17764986 TSecr=1499025114
 92   0.016222 54.239.132.98 -> 172.31.8.238 TCP 1514 [TCP segment of a reassembled PDU]
 93   0.016227 172.31.8.238 -> 54.239.132.98 TCP 66 47291 > http [ACK] Seq=98 Ack=433411 Win=650624 Len=0 TSval=17764986 TSecr=1499025114
 94   0.016359 54.239.132.98 -> 172.31.8.238 TCP 26130 [TCP segment of a reassembled PDU]
 95   0.016372 172.31.8.238 -> 54.239.132.98 TCP 66 47291 > http [ACK] Seq=98 Ack=459475 Win=702720 Len=0 TSval=17764986 TSecr=1499025114
 96   0.016439 54.239.132.98 -> 172.31.8.238 TCP 26130 [TCP segment of a reassembled PDU]
 97   0.016453 172.31.8.238 -> 54.239.132.98 TCP 66 47291 > http [ACK] Seq=98 Ack=485539 Win=754816 Len=0 TSval=17764986 TSecr=1499025114
 98   0.017023 54.239.132.98 -> 172.31.8.238 TCP 2962 [TCP segment of a reassembled PDU]
 99   0.017029 172.31.8.238 -> 54.239.132.98 TCP 66 47291 > http [ACK] Seq=98 Ack=488435 Win=760704 Len=0 TSval=17764986 TSecr=1499025114
100   0.017200 54.239.132.98 -> 172.31.8.238 TCP 26130 [TCP segment of a reassembled PDU]
101   0.017213 172.31.8.238 -> 54.239.132.98 TCP 66 47291 > http [ACK] Seq=98 Ack=514499 Win=812800 Len=0 TSval=17764986 TSecr=1499025114
102   0.017288 54.239.132.98 -> 172.31.8.238 TCP 26130 [TCP segment of a reassembled PDU]
103   0.017302 172.31.8.238 -> 54.239.132.98 TCP 66 47291 > http [ACK] Seq=98 Ack=540563 Win=849280 Len=0 TSval=17764986 TSecr=1499025114
104   0.017346 54.239.132.98 -> 172.31.8.238 TCP 10202 [TCP segment of a reassembled PDU]
105   0.017354 172.31.8.238 -> 54.239.132.98 TCP 66 47291 > http [ACK] Seq=98 Ack=550699 Win=875392 Len=0 TSval=17764986 TSecr=1499025114
106   0.017782 54.239.132.98 -> 172.31.8.238 TCP 5858 [TCP segment of a reassembled PDU]
107   0.017788 172.31.8.238 -> 54.239.132.98 TCP 66 47291 > http [ACK] Seq=98 Ack=556491 Win=882560 Len=0 TSval=17764986 TSecr=1499025114
108   0.017980 54.239.132.98 -> 172.31.8.238 TCP 20338 [TCP segment of a reassembled PDU]
109   0.017992 172.31.8.238 -> 54.239.132.98 TCP 66 47291 > http [ACK] Seq=98 Ack=576763 Win=862336 Len=0 TSval=17764986 TSecr=1499025114
110   0.018014 54.239.132.98 -> 172.31.8.238 TCP 5858 [TCP segment of a reassembled PDU]
111   0.018021 172.31.8.238 -> 54.239.132.98 TCP 66 47291 > http [ACK] Seq=98 Ack=582555 Win=856576 Len=0 TSval=17764986 TSecr=1499025114
112   0.018124 54.239.132.98 -> 172.31.8.238 TCP 26130 [TCP segment of a reassembled PDU]
113   0.018138 172.31.8.238 -> 54.239.132.98 TCP 66 47291 > http [ACK] Seq=98 Ack=608619 Win=849280 Len=0 TSval=17764986 TSecr=1499025114
114   0.018182 54.239.132.98 -> 172.31.8.238 TCP 7306 [TCP segment of a reassembled PDU]
115   0.018188 172.31.8.238 -> 54.239.132.98 TCP 66 47291 > http [ACK] Seq=98 Ack=615859 Win=880128 Len=0 TSval=17764986 TSecr=1499025114
116   0.018551 54.239.132.98 -> 172.31.8.238 TCP 4410 [TCP segment of a reassembled PDU]
117   0.018558 172.31.8.238 -> 54.239.132.98 TCP 66 47291 > http [ACK] Seq=98 Ack=620203 Win=884864 Len=0 TSval=17764986 TSecr=1499025114
118   0.018718 54.239.132.98 -> 172.31.8.238 TCP 18890 [TCP segment of a reassembled PDU]
119   0.018728 172.31.8.238 -> 54.239.132.98 TCP 66 47291 > http [ACK] Seq=98 Ack=639027 Win=866048 Len=0 TSval=17764986 TSecr=1499025114
120   0.018751 54.239.132.98 -> 172.31.8.238 TCP 7306 [TCP segment of a reassembled PDU]
121   0.018756 172.31.8.238 -> 54.239.132.98 TCP 66 47291 > http [ACK] Seq=98 Ack=646267 Win=858880 Len=0 TSval=17764986 TSecr=1499025114
122   0.018844 54.239.132.98 -> 172.31.8.238 TCP 26130 [TCP segment of a reassembled PDU]
123   0.018857 172.31.8.238 -> 54.239.132.98 TCP 66 47291 > http [ACK] Seq=98 Ack=672331 Win=849280 Len=0 TSval=17764986 TSecr=1499025114
124   0.018940 54.239.132.98 -> 172.31.8.238 TCP 8754 [TCP segment of a reassembled PDU]
125   0.018947 172.31.8.238 -> 54.239.132.98 TCP 66 47291 > http [ACK] Seq=98 Ack=681019 Win=877824 Len=0 TSval=17764986 TSecr=1499025114
126   0.019071 54.239.132.98 -> 172.31.8.238 TCP 13098 [TCP segment of a reassembled PDU]
127   0.019080 172.31.8.238 -> 54.239.132.98 TCP 66 47291 > http [ACK] Seq=98 Ack=694051 Win=870656 Len=0 TSval=17764987 TSecr=1499025114
128   0.019217 54.239.132.98 -> 172.31.8.238 TCP 17442 [TCP segment of a reassembled PDU]
129   0.019237 172.31.8.238 -> 54.239.132.98 TCP 66 47291 > http [ACK] Seq=98 Ack=711427 Win=919936 Len=0 TSval=17764987 TSecr=1499025114
130   0.019473 54.239.132.98 -> 172.31.8.238 TCP 26130 [TCP segment of a reassembled PDU]
131   0.019486 172.31.8.238 -> 54.239.132.98 TCP 66 47291 > http [ACK] Seq=98 Ack=737491 Win=972032 Len=0 TSval=17764987 TSecr=1499025114
132   0.019493 54.239.132.98 -> 172.31.8.238 TCP 1514 [TCP segment of a reassembled PDU]
133   0.019500 172.31.8.238 -> 54.239.132.98 TCP 66 47291 > http [ACK] Seq=98 Ack=738939 Win=974976 Len=0 TSval=17764987 TSecr=1499025114
134   0.019506 54.239.132.98 -> 172.31.8.238 TCP 7306 [TCP segment of a reassembled PDU]
135   0.019510 172.31.8.238 -> 54.239.132.98 TCP 66 47291 > http [ACK] Seq=98 Ack=746179 Win=989440 Len=0 TSval=17764987 TSecr=1499025114
136   0.019651 54.239.132.98 -> 172.31.8.238 TCP 7306 [TCP segment of a reassembled PDU]
137   0.019658 172.31.8.238 -> 54.239.132.98 TCP 66 47291 > http [ACK] Seq=98 Ack=753419 Win=1003904 Len=0 TSval=17764987 TSecr=1499025114
138   0.019767 54.239.132.98 -> 172.31.8.238 TCP 26130 [TCP segment of a reassembled PDU]
139   0.019780 172.31.8.238 -> 54.239.132.98 TCP 66 47291 > http [ACK] Seq=98 Ack=779483 Win=1056000 Len=0 TSval=17764987 TSecr=1499025114
140   0.019858 54.239.132.98 -> 172.31.8.238 TCP 26130 [TCP segment of a reassembled PDU]
141   0.019872 172.31.8.238 -> 54.239.132.98 TCP 66 47291 > http [ACK] Seq=98 Ack=805547 Win=1108224 Len=0 TSval=17764987 TSecr=1499025114
142   0.019908 54.239.132.98 -> 172.31.8.238 TCP 5858 [TCP segment of a reassembled PDU]
143   0.019914 172.31.8.238 -> 54.239.132.98 TCP 66 47291 > http [ACK] Seq=98 Ack=811339 Win=1119744 Len=0 TSval=17764987 TSecr=1499025114
144   0.020237 54.239.132.98 -> 172.31.8.238 TCP 26130 [TCP segment of a reassembled PDU]
145   0.020250 172.31.8.238 -> 54.239.132.98 TCP 66 47291 > http [ACK] Seq=98 Ack=837403 Win=1110528 Len=0 TSval=17764987 TSecr=1499025114
146   0.020280 54.239.132.98 -> 172.31.8.238 TCP 13098 [TCP segment of a reassembled PDU]
147   0.020290 172.31.8.238 -> 54.239.132.98 TCP 66 47291 > http [ACK] Seq=98 Ack=850435 Win=1131904 Len=0 TSval=17764987 TSecr=1499025114
148   0.020336 54.239.132.98 -> 172.31.8.238 TCP 4410 [TCP segment of a reassembled PDU]
149   0.020341 172.31.8.238 -> 54.239.132.98 TCP 66 47291 > http [ACK] Seq=98 Ack=854779 Win=1146112 Len=0 TSval=17764987 TSecr=1499025114
150   0.020514 54.239.132.98 -> 172.31.8.238 TCP 26130 [TCP segment of a reassembled PDU]
151   0.020528 172.31.8.238 -> 54.239.132.98 TCP 66 47291 > http [ACK] Seq=98 Ack=880843 Win=1120128 Len=0 TSval=17764987 TSecr=1499025114
152   0.020586 54.239.132.98 -> 172.31.8.238 TCP 26130 [TCP segment of a reassembled PDU]
153   0.020600 172.31.8.238 -> 54.239.132.98 TCP 66 47291 > http [ACK] Seq=98 Ack=906907 Win=1110528 Len=0 TSval=17764987 TSecr=1499025114
154   0.020638 54.239.132.98 -> 172.31.8.238 TCP 7306 [TCP segment of a reassembled PDU]
155   0.020644 172.31.8.238 -> 54.239.132.98 TCP 66 47291 > http [ACK] Seq=98 Ack=914147 Win=1141376 Len=0 TSval=17764987 TSecr=1499025114
156   0.020951 54.239.132.98 -> 172.31.8.238 TCP 26130 [TCP segment of a reassembled PDU]
157   0.020965 54.239.132.98 -> 172.31.8.238 TCP 1514 [TCP segment of a reassembled PDU]
158   0.020977 172.31.8.238 -> 54.239.132.98 TCP 66 47291 > http [ACK] Seq=98 Ack=941659 Win=1113984 Len=0 TSval=17764987 TSecr=1499025114
159   0.021289 54.239.132.98 -> 172.31.8.238 TCP 26130 [TCP segment of a reassembled PDU]
160   0.021316 172.31.8.238 -> 54.239.132.98 TCP 66 47291 > http [ACK] Seq=98 Ack=967723 Win=1110528 Len=0 TSval=17764987 TSecr=1499025114
161   0.021358 54.239.132.98 -> 172.31.8.238 TCP 26130 [TCP segment of a reassembled PDU]
162   0.021372 172.31.8.238 -> 54.239.132.98 TCP 66 47291 > http [ACK] Seq=98 Ack=993787 Win=1110528 Len=0 TSval=17764987 TSecr=1499025114
163   0.021421 54.239.132.98 -> 172.31.8.238 TCP 13098 [TCP segment of a reassembled PDU]
164   0.021430 172.31.8.238 -> 54.239.132.98 TCP 66 47291 > http [ACK] Seq=98 Ack=1006819 Win=1131904 Len=0 TSval=17764987 TSecr=1499025114
165   0.021730 54.239.132.98 -> 172.31.8.238 TCP 23234 [TCP segment of a reassembled PDU]
166   0.021753 172.31.8.238 -> 54.239.132.98 TCP 66 47291 > http [ACK] Seq=98 Ack=1029987 Win=1115264 Len=0 TSval=17764987 TSecr=1499025115
167   0.021784 54.239.132.98 -> 172.31.8.238 TCP 2962 [TCP segment of a reassembled PDU]
168   0.021789 172.31.8.238 -> 54.239.132.98 TCP 66 47291 > http [ACK] Seq=98 Ack=1032883 Win=1148544 Len=0 TSval=17764987 TSecr=1499025115
169   0.021879 54.239.132.98 -> 172.31.8.238 TCP 29026 [TCP segment of a reassembled PDU]
170   0.021903 172.31.8.238 -> 54.239.132.98 TCP 66 47291 > http [ACK] Seq=98 Ack=1061843 Win=1119616 Len=0 TSval=17764987 TSecr=1499025115
171   0.021921 54.239.132.98 -> 172.31.8.238 TCP 7306 [TCP segment of a reassembled PDU]
172   0.021932 172.31.8.238 -> 54.239.132.98 TCP 66 47291 > http [ACK] Seq=98 Ack=1069083 Win=1141376 Len=0 TSval=17764987 TSecr=1499025115
173   0.022032 54.239.132.98 -> 172.31.8.238 TCP 2962 [TCP segment of a reassembled PDU]
174   0.022036 172.31.8.238 -> 54.239.132.98 TCP 66 47291 > http [ACK] Seq=98 Ack=1071979 Win=1148544 Len=0 TSval=17764987 TSecr=1499025115
175   0.022148 54.239.132.98 -> 172.31.8.238 TCP 20338 [TCP segment of a reassembled PDU]
176   0.022174 54.239.132.98 -> 172.31.8.238 TCP 5858 [TCP segment of a reassembled PDU]
177   0.022181 172.31.8.238 -> 54.239.132.98 TCP 66 47291 > http [ACK] Seq=98 Ack=1092251 Win=1128320 Len=0 TSval=17764987 TSecr=1499025115
178   0.022194 172.31.8.238 -> 54.239.132.98 TCP 66 47291 > http [ACK] Seq=98 Ack=1098043 Win=1148800 Len=0 TSval=17764987 TSecr=1499025115
179   0.022227 54.239.132.98 -> 172.31.8.238 TCP 18890 [TCP segment of a reassembled PDU]
180   0.022248 172.31.8.238 -> 54.239.132.98 TCP 66 47291 > http [ACK] Seq=98 Ack=1116867 Win=1129984 Len=0 TSval=17764987 TSecr=1499025115
181   0.022504 54.239.132.98 -> 172.31.8.238 TCP 26130 [TCP segment of a reassembled PDU]
182   0.022529 172.31.8.238 -> 54.239.132.98 TCP 66 47291 > http [ACK] Seq=98 Ack=1142931 Win=1110528 Len=0 TSval=17764987 TSecr=1499025115
183   0.022575 54.239.132.98 -> 172.31.8.238 TCP 26130 [TCP segment of a reassembled PDU]
184   0.022588 172.31.8.238 -> 54.239.132.98 TCP 66 47291 > http [ACK] Seq=98 Ack=1168995 Win=1110528 Len=0 TSval=17764987 TSecr=1499025115
185   0.022651 54.239.132.98 -> 172.31.8.238 TCP 21786 [TCP segment of a reassembled PDU]
186   0.022663 172.31.8.238 -> 54.239.132.98 TCP 66 47291 > http [ACK] Seq=98 Ack=1190715 Win=1117568 Len=0 TSval=17764987 TSecr=1499025115
187   0.022708 54.239.132.98 -> 172.31.8.238 TCP 11650 [TCP segment of a reassembled PDU]
188   0.022715 172.31.8.238 -> 54.239.132.98 TCP 66 47291 > http [ACK] Seq=98 Ack=1202299 Win=1134336 Len=0 TSval=17764987 TSecr=1499025115
189   0.022941 54.239.132.98 -> 172.31.8.238 TCP 17442 [TCP segment of a reassembled PDU]
190   0.022965 172.31.8.238 -> 54.239.132.98 TCP 66 47291 > http [ACK] Seq=98 Ack=1219675 Win=1148800 Len=0 TSval=17764988 TSecr=1499025115
191   0.023097 54.239.132.98 -> 172.31.8.238 TCP 26130 [TCP segment of a reassembled PDU]
192   0.023110 172.31.8.238 -> 54.239.132.98 TCP 66 47291 > http [ACK] Seq=98 Ack=1245739 Win=1200896 Len=0 TSval=17764988 TSecr=1499025115
193   0.023145 54.239.132.98 -> 172.31.8.238 TCP 7306 [TCP segment of a reassembled PDU]
194   0.023150 172.31.8.238 -> 54.239.132.98 TCP 66 47291 > http [ACK] Seq=98 Ack=1252979 Win=1215360 Len=0 TSval=17764988 TSecr=1499025115
195   0.023290 54.239.132.98 -> 172.31.8.238 TCP 26130 [TCP segment of a reassembled PDU]
196   0.023303 172.31.8.238 -> 54.239.132.98 TCP 66 47291 > http [ACK] Seq=98 Ack=1279043 Win=1267584 Len=0 TSval=17764988 TSecr=1499025115
197   0.023323 54.239.132.98 -> 172.31.8.238 TCP 26130 [TCP segment of a reassembled PDU]
198   0.023340 172.31.8.238 -> 54.239.132.98 TCP 66 47291 > http [ACK] Seq=98 Ack=1305107 Win=1319680 Len=0 TSval=17764988 TSecr=1499025115
199   0.023433 54.239.132.98 -> 172.31.8.238 TCP 26130 [TCP segment of a reassembled PDU]
200   0.023446 172.31.8.238 -> 54.239.132.98 TCP 66 47291 > http [ACK] Seq=98 Ack=1331171 Win=1371776 Len=0 TSval=17764988 TSecr=1499025115
201   0.023470 54.239.132.98 -> 172.31.8.238 TCP 1514 [TCP segment of a reassembled PDU]
202   0.023473 172.31.8.238 -> 54.239.132.98 TCP 66 47291 > http [ACK] Seq=98 Ack=1332619 Win=1374720 Len=0 TSval=17764988 TSecr=1499025115
203   0.023776 54.239.132.98 -> 172.31.8.238 TCP 26130 [TCP segment of a reassembled PDU]
204   0.023790 172.31.8.238 -> 54.239.132.98 TCP 66 47291 > http [ACK] Seq=98 Ack=1358683 Win=1426816 Len=0 TSval=17764988 TSecr=1499025115
205   0.023847 54.239.132.98 -> 172.31.8.238 TCP 26130 [TCP segment of a reassembled PDU]
206   0.023860 172.31.8.238 -> 54.239.132.98 TCP 66 47291 > http [ACK] Seq=98 Ack=1384747 Win=1478912 Len=0 TSval=17764988 TSecr=1499025115
207   0.023917 54.239.132.98 -> 172.31.8.238 TCP 5858 [TCP segment of a reassembled PDU]
208   0.023923 172.31.8.238 -> 54.239.132.98 TCP 66 47291 > http [ACK] Seq=98 Ack=1390539 Win=1490560 Len=0 TSval=17764988 TSecr=1499025115
209   0.023987 54.239.132.98 -> 172.31.8.238 TCP 1514 [TCP Previous segment not captured] [TCP segment of a reassembled PDU]
210   0.023992 172.31.8.238 -> 54.239.132.98 TCP 78 [TCP Window Update] 47291 > http [ACK] Seq=98 Ack=1390539 Win=1493376 Len=0 TSval=17764988 TSecr=1499025115 SLE=1391987 SRE=1393435
211   0.023996 54.239.132.98 -> 172.31.8.238 TCP 1514 [TCP Out-Of-Order] [TCP segment of a reassembled PDU]
212   0.023999 172.31.8.238 -> 54.239.132.98 TCP 66 47291 > http [ACK] Seq=98 Ack=1393435 Win=1496320 Len=0 TSval=17764988 TSecr=1499025115
213   0.024180 54.239.132.98 -> 172.31.8.238 TCP 27578 [TCP segment of a reassembled PDU]
214   0.024194 172.31.8.238 -> 54.239.132.98 TCP 66 47291 > http [ACK] Seq=98 Ack=1420947 Win=1551360 Len=0 TSval=17764988 TSecr=1499025115
215   0.024235 54.239.132.98 -> 172.31.8.238 TCP 24682 [TCP segment of a reassembled PDU]
216   0.024246 172.31.8.238 -> 54.239.132.98 TCP 66 47291 > http [ACK] Seq=98 Ack=1445563 Win=1600512 Len=0 TSval=17764988 TSecr=1499025115
217   0.024295 54.239.132.98 -> 172.31.8.238 TCP 17442 [TCP segment of a reassembled PDU]
218   0.024304 172.31.8.238 -> 54.239.132.98 TCP 66 47291 > http [ACK] Seq=98 Ack=1462939 Win=1600512 Len=0 TSval=17764988 TSecr=1499025115
219   0.024701 54.239.132.98 -> 172.31.8.238 TCP 5858 [TCP segment of a reassembled PDU]
220   0.024708 172.31.8.238 -> 54.239.132.98 TCP 66 47291 > http [ACK] Seq=98 Ack=1468731 Win=1600512 Len=0 TSval=17764988 TSecr=1499025115
221   0.024866 54.239.132.98 -> 172.31.8.238 TCP 26130 [TCP segment of a reassembled PDU]
222   0.024880 172.31.8.238 -> 54.239.132.98 TCP 66 47291 > http [ACK] Seq=98 Ack=1494795 Win=1600512 Len=0 TSval=17764988 TSecr=1499025115
223   0.024949 54.239.132.98 -> 172.31.8.238 TCP 26130 [TCP segment of a reassembled PDU]
224   0.024962 172.31.8.238 -> 54.239.132.98 TCP 66 47291 > http [ACK] Seq=98 Ack=1520859 Win=1600512 Len=0 TSval=17764988 TSecr=1499025115
225   0.025002 54.239.132.98 -> 172.31.8.238 TCP 7306 [TCP segment of a reassembled PDU]
226   0.025008 172.31.8.238 -> 54.239.132.98 TCP 66 47291 > http [ACK] Seq=98 Ack=1528099 Win=1600512 Len=0 TSval=17764988 TSecr=1499025115
227   0.025086 54.239.132.98 -> 172.31.8.238 TCP 26130 [TCP segment of a reassembled PDU]
228   0.025098 172.31.8.238 -> 54.239.132.98 TCP 66 47291 > http [ACK] Seq=98 Ack=1554163 Win=1600512 Len=0 TSval=17764988 TSecr=1499025115
229   0.025168 54.239.132.98 -> 172.31.8.238 TCP 26130 [TCP segment of a reassembled PDU]
230   0.025180 172.31.8.238 -> 54.239.132.98 TCP 66 47291 > http [ACK] Seq=98 Ack=1580227 Win=1600512 Len=0 TSval=17764988 TSecr=1499025115
231   0.025222 54.239.132.98 -> 172.31.8.238 TCP 13098 [TCP segment of a reassembled PDU]
232   0.025230 172.31.8.238 -> 54.239.132.98 TCP 66 47291 > http [ACK] Seq=98 Ack=1593259 Win=1600512 Len=0 TSval=17764988 TSecr=1499025115
233   0.025511 54.239.132.98 -> 172.31.8.238 TCP 13098 [TCP segment of a reassembled PDU]
234   0.025520 172.31.8.238 -> 54.239.132.98 TCP 66 47291 > http [ACK] Seq=98 Ack=1606291 Win=1600512 Len=0 TSval=17764988 TSecr=1499025115
235   0.025684 54.239.132.98 -> 172.31.8.238 TCP 26130 [TCP segment of a reassembled PDU]
236   0.025697 172.31.8.238 -> 54.239.132.98 TCP 66 47291 > http [ACK] Seq=98 Ack=1632355 Win=1600512 Len=0 TSval=17764988 TSecr=1499025115
237   0.025769 54.239.132.98 -> 172.31.8.238 TCP 26130 [TCP segment of a reassembled PDU]
238   0.025783 172.31.8.238 -> 54.239.132.98 TCP 66 47291 > http [ACK] Seq=98 Ack=1658419 Win=1600512 Len=0 TSval=17764988 TSecr=1499025115
239   0.025923 54.239.132.98 -> 172.31.8.238 TCP 26130 [TCP segment of a reassembled PDU]
240   0.025935 172.31.8.238 -> 54.239.132.98 TCP 66 47291 > http [ACK] Seq=98 Ack=1684483 Win=1600512 Len=0 TSval=17764988 TSecr=1499025115
241   0.025946 54.239.132.98 -> 172.31.8.238 TCP 10202 [TCP segment of a reassembled PDU]
242   0.025950 172.31.8.238 -> 54.239.132.98 TCP 66 47291 > http [ACK] Seq=98 Ack=1694619 Win=1600512 Len=0 TSval=17764988 TSecr=1499025115
243   0.025965 54.239.132.98 -> 172.31.8.238 TCP 15994 [TCP segment of a reassembled PDU]
244   0.025973 172.31.8.238 -> 54.239.132.98 TCP 66 47291 > http [ACK] Seq=98 Ack=1710547 Win=1600512 Len=0 TSval=17764988 TSecr=1499025115
245   0.026071 54.239.132.98 -> 172.31.8.238 TCP 13098 [TCP segment of a reassembled PDU]
246   0.026080 172.31.8.238 -> 54.239.132.98 TCP 66 47291 > http [ACK] Seq=98 Ack=1723579 Win=1600512 Len=0 TSval=17764988 TSecr=1499025115
247   0.026324 54.239.132.98 -> 172.31.8.238 TCP 20338 [TCP segment of a reassembled PDU]
248   0.026335 172.31.8.238 -> 54.239.132.98 TCP 66 47291 > http [ACK] Seq=98 Ack=1743851 Win=1600512 Len=0 TSval=17764988 TSecr=1499025115
249   0.026465 54.239.132.98 -> 172.31.8.238 TCP 26130 [TCP segment of a reassembled PDU]
250   0.026478 172.31.8.238 -> 54.239.132.98 TCP 66 47291 > http [ACK] Seq=98 Ack=1769915 Win=1600512 Len=0 TSval=17764988 TSecr=1499025115
251   0.026545 54.239.132.98 -> 172.31.8.238 TCP 21786 [TCP segment of a reassembled PDU]
252   0.026556 172.31.8.238 -> 54.239.132.98 TCP 66 47291 > http [ACK] Seq=98 Ack=1791635 Win=1600512 Len=0 TSval=17764988 TSecr=1499025115
253   0.026695 54.239.132.98 -> 172.31.8.238 TCP 26130 [TCP segment of a reassembled PDU]
254   0.026708 172.31.8.238 -> 54.239.132.98 TCP 66 47291 > http [ACK] Seq=98 Ack=1817699 Win=1600512 Len=0 TSval=17764988 TSecr=1499025115
255   0.026726 54.239.132.98 -> 172.31.8.238 TCP 26130 [TCP segment of a reassembled PDU]
256   0.026741 172.31.8.238 -> 54.239.132.98 TCP 66 47291 > http [ACK] Seq=98 Ack=1843763 Win=1600512 Len=0 TSval=17764988 TSecr=1499025115
257   0.026813 54.239.132.98 -> 172.31.8.238 TCP 10202 [TCP segment of a reassembled PDU]
258   0.026823 172.31.8.238 -> 54.239.132.98 TCP 66 47291 > http [ACK] Seq=98 Ack=1853899 Win=1600512 Len=0 TSval=17764988 TSecr=1499025115
259   0.027083 54.239.132.98 -> 172.31.8.238 TCP 20338 [TCP segment of a reassembled PDU]
260   0.027090 172.31.8.238 -> 54.239.132.98 TCP 66 47291 > http [ACK] Seq=98 Ack=1874171 Win=1600512 Len=0 TSval=17764989 TSecr=1499025115
261   0.027263 54.239.132.98 -> 172.31.8.238 TCP 26130 [TCP segment of a reassembled PDU]
262   0.027270 172.31.8.238 -> 54.239.132.98 TCP 66 47291 > http [ACK] Seq=98 Ack=1900235 Win=1600512 Len=0 TSval=17764989 TSecr=1499025115
263   0.027321 54.239.132.98 -> 172.31.8.238 TCP 18890 [TCP segment of a reassembled PDU]
264   0.027327 172.31.8.238 -> 54.239.132.98 TCP 66 47291 > http [ACK] Seq=98 Ack=1919059 Win=1600512 Len=0 TSval=17764989 TSecr=1499025115
265   0.027474 54.239.132.98 -> 172.31.8.238 TCP 26130 [TCP segment of a reassembled PDU]
266   0.027482 172.31.8.238 -> 54.239.132.98 TCP 66 47291 > http [ACK] Seq=98 Ack=1945123 Win=1600512 Len=0 TSval=17764989 TSecr=1499025115
267   0.027499 54.239.132.98 -> 172.31.8.238 TCP 17442 [TCP segment of a reassembled PDU]
268   0.027504 172.31.8.238 -> 54.239.132.98 TCP 66 47291 > http [ACK] Seq=98 Ack=1962499 Win=1600512 Len=0 TSval=17764989 TSecr=1499025115
269   0.027600 54.239.132.98 -> 172.31.8.238 TCP 21786 [TCP segment of a reassembled PDU]
270   0.027607 172.31.8.238 -> 54.239.132.98 TCP 66 47291 > http [ACK] Seq=98 Ack=1984219 Win=1600512 Len=0 TSval=17764989 TSecr=1499025115
271   0.027864 54.239.132.98 -> 172.31.8.238 TCP 26130 [TCP segment of a reassembled PDU]
272   0.027884 172.31.8.238 -> 54.239.132.98 TCP 66 47291 > http [ACK] Seq=98 Ack=2010283 Win=1600512 Len=0 TSval=17764989 TSecr=1499025115
273   0.027948 54.239.132.98 -> 172.31.8.238 TCP 26130 [TCP segment of a reassembled PDU]
274   0.027956 172.31.8.238 -> 54.239.132.98 TCP 66 47291 > http [ACK] Seq=98 Ack=2036347 Win=1600512 Len=0 TSval=17764989 TSecr=1499025115
275   0.028012 54.239.132.98 -> 172.31.8.238 TCP 13098 [TCP segment of a reassembled PDU]
276   0.028017 172.31.8.238 -> 54.239.132.98 TCP 66 47291 > http [ACK] Seq=98 Ack=2049379 Win=1600512 Len=0 TSval=17764989 TSecr=1499025115
277   0.028068 54.239.132.98 -> 172.31.8.238 TCP 5858 [TCP segment of a reassembled PDU]
278   0.028072 172.31.8.238 -> 54.239.132.98 TCP 66 47291 > http [ACK] Seq=98 Ack=2055171 Win=1600512 Len=0 TSval=17764989 TSecr=1499025115
279   0.028171 54.239.132.98 -> 172.31.8.238 TCP 7306 [TCP segment of a reassembled PDU]
280   0.028176 172.31.8.238 -> 54.239.132.98 TCP 66 47291 > http [ACK] Seq=98 Ack=2062411 Win=1600512 Len=0 TSval=17764989 TSecr=1499025115
281   0.028206 54.239.132.98 -> 172.31.8.238 TCP 1514 [TCP Previous segment not captured] [TCP segment of a reassembled PDU]
282   0.028210 172.31.8.238 -> 54.239.132.98 TCP 78 [TCP Dup ACK 280#1] 47291 > http [ACK] Seq=98 Ack=2062411 Win=1600512 Len=0 TSval=17764989 TSecr=1499025115 SLE=2063859 SRE=2065307
283   0.028264 54.239.132.98 -> 172.31.8.238 TCP 1514 [TCP Out-Of-Order] [TCP segment of a reassembled PDU]
284   0.028268 172.31.8.238 -> 54.239.132.98 TCP 66 47291 > http [ACK] Seq=98 Ack=2065307 Win=1600512 Len=0 TSval=17764989 TSecr=1499025115
285   0.028407 54.239.132.98 -> 172.31.8.238 TCP 26130 [TCP segment of a reassembled PDU]
286   0.028413 172.31.8.238 -> 54.239.132.98 TCP 66 47291 > http [ACK] Seq=98 Ack=2091371 Win=1600512 Len=0 TSval=17764989 TSecr=1499025115
287   0.028430 54.239.132.98 -> 172.31.8.238 TCP 23234 [TCP segment of a reassembled PDU]
288   0.028437 172.31.8.238 -> 54.239.132.98 TCP 66 47291 > http [ACK] Seq=98 Ack=2114539 Win=1600512 Len=0 TSval=17764989 TSecr=1499025115
289   0.028650 54.239.132.98 -> 172.31.8.238 TCP 26130 [TCP segment of a reassembled PDU]
290   0.028658 172.31.8.238 -> 54.239.132.98 TCP 66 47291 > http [ACK] Seq=98 Ack=2140603 Win=1600512 Len=0 TSval=17764989 TSecr=1499025115
291   0.028722 54.239.132.98 -> 172.31.8.238 TCP 26130 [TCP segment of a reassembled PDU]
292   0.028729 172.31.8.238 -> 54.239.132.98 TCP 66 47291 > http [ACK] Seq=98 Ack=2166667 Win=1600512 Len=0 TSval=17764989 TSecr=1499025115
293   0.028827 54.239.132.98 -> 172.31.8.238 TCP 26130 [TCP segment of a reassembled PDU]
294   0.028838 172.31.8.238 -> 54.239.132.98 TCP 66 47291 > http [ACK] Seq=98 Ack=2192731 Win=1600512 Len=0 TSval=17764989 TSecr=1499025115
295   0.028923 54.239.132.98 -> 172.31.8.238 TCP 26130 [TCP segment of a reassembled PDU]
296   0.028930 172.31.8.238 -> 54.239.132.98 TCP 66 47291 > http [ACK] Seq=98 Ack=2218795 Win=1600512 Len=0 TSval=17764989 TSecr=1499025115
297   0.029006 54.239.132.98 -> 172.31.8.238 TCP 26130 [TCP segment of a reassembled PDU]
298   0.029012 172.31.8.238 -> 54.239.132.98 TCP 66 47291 > http [ACK] Seq=98 Ack=2244859 Win=1600512 Len=0 TSval=17764989 TSecr=1499025115
299   0.029051 54.239.132.98 -> 172.31.8.238 TCP 4410 [TCP segment of a reassembled PDU]
300   0.029054 172.31.8.238 -> 54.239.132.98 TCP 66 47291 > http [ACK] Seq=98 Ack=2249203 Win=1600512 Len=0 TSval=17764989 TSecr=1499025115
301   0.029499 54.239.132.98 -> 172.31.8.238 TCP 26130 [TCP segment of a reassembled PDU]
302   0.029506 172.31.8.238 -> 54.239.132.98 TCP 66 47291 > http [ACK] Seq=98 Ack=2275267 Win=1600512 Len=0 TSval=17764989 TSecr=1499025115
303   0.029568 54.239.132.98 -> 172.31.8.238 TCP 26130 [TCP segment of a reassembled PDU]
304   0.029576 172.31.8.238 -> 54.239.132.98 TCP 66 47291 > http [ACK] Seq=98 Ack=2301331 Win=1600512 Len=0 TSval=17764989 TSecr=1499025115
305   0.029637 54.239.132.98 -> 172.31.8.238 TCP 14546 [TCP segment of a reassembled PDU]
306   0.029647 172.31.8.238 -> 54.239.132.98 TCP 66 47291 > http [ACK] Seq=98 Ack=2315811 Win=1600512 Len=0 TSval=17764989 TSecr=1499025115
307   0.029704 54.239.132.98 -> 172.31.8.238 TCP 14546 [TCP segment of a reassembled PDU]
308   0.029709 172.31.8.238 -> 54.239.132.98 TCP 66 47291 > http [ACK] Seq=98 Ack=2330291 Win=1600512 Len=0 TSval=17764989 TSecr=1499025115
309   0.029858 54.239.132.98 -> 172.31.8.238 TCP 26130 [TCP segment of a reassembled PDU]
310   0.029864 172.31.8.238 -> 54.239.132.98 TCP 66 47291 > http [ACK] Seq=98 Ack=2356355 Win=1600512 Len=0 TSval=17764989 TSecr=1499025115
311   0.029940 54.239.132.98 -> 172.31.8.238 TCP 26130 [TCP segment of a reassembled PDU]
312   0.029946 172.31.8.238 -> 54.239.132.98 TCP 66 47291 > http [ACK] Seq=98 Ack=2382419 Win=1600512 Len=0 TSval=17764989 TSecr=1499025115
313   0.030018 54.239.132.98 -> 172.31.8.238 TCP 26130 [TCP segment of a reassembled PDU]
314   0.030024 172.31.8.238 -> 54.239.132.98 TCP 66 47291 > http [ACK] Seq=98 Ack=2408483 Win=1600512 Len=0 TSval=17764989 TSecr=1499025115
315   0.030152 54.239.132.98 -> 172.31.8.238 TCP 31922 [TCP segment of a reassembled PDU]
316   0.030160 172.31.8.238 -> 54.239.132.98 TCP 66 47291 > http [ACK] Seq=98 Ack=2440339 Win=1600512 Len=0 TSval=17764989 TSecr=1499025115
317   0.030476 54.239.132.98 -> 172.31.8.238 TCP 5858 [TCP segment of a reassembled PDU]
318   0.030481 172.31.8.238 -> 54.239.132.98 TCP 66 47291 > http [ACK] Seq=98 Ack=2446131 Win=1600512 Len=0 TSval=17764989 TSecr=1499025115
319   0.030667 54.239.132.98 -> 172.31.8.238 TCP 26130 [TCP segment of a reassembled PDU]
320   0.030673 172.31.8.238 -> 54.239.132.98 TCP 66 47291 > http [ACK] Seq=98 Ack=2472195 Win=1600512 Len=0 TSval=17764989 TSecr=1499025115
321   0.030739 54.239.132.98 -> 172.31.8.238 TCP 26130 [TCP segment of a reassembled PDU]
322   0.030747 172.31.8.238 -> 54.239.132.98 TCP 66 47291 > http [ACK] Seq=98 Ack=2498259 Win=1600512 Len=0 TSval=17764989 TSecr=1499025115
323   0.030835 54.239.132.98 -> 172.31.8.238 TCP 26130 [TCP segment of a reassembled PDU]
324   0.030842 172.31.8.238 -> 54.239.132.98 TCP 66 47291 > http [ACK] Seq=98 Ack=2524323 Win=1600512 Len=0 TSval=17764989 TSecr=1499025115
325   0.030924 54.239.132.98 -> 172.31.8.238 TCP 26130 [TCP segment of a reassembled PDU]
326   0.030931 172.31.8.238 -> 54.239.132.98 TCP 66 47291 > http [ACK] Seq=98 Ack=2550387 Win=1600512 Len=0 TSval=17764989 TSecr=1499025115
327   0.031075 54.239.132.98 -> 172.31.8.238 TCP 26130 [TCP segment of a reassembled PDU]
328   0.031082 172.31.8.238 -> 54.239.132.98 TCP 66 47291 > http [ACK] Seq=98 Ack=2576451 Win=1600512 Len=0 TSval=17764990 TSecr=1499025115
329   0.031100 54.239.132.98 -> 172.31.8.238 TCP 26130 [TCP segment of a reassembled PDU]
330   0.031107 172.31.8.238 -> 54.239.132.98 TCP 66 47291 > http [ACK] Seq=98 Ack=2602515 Win=1600512 Len=0 TSval=17764990 TSecr=1499025115
331   0.031229 54.239.132.98 -> 172.31.8.238 TCP 26130 [TCP segment of a reassembled PDU]
332   0.031236 172.31.8.238 -> 54.239.132.98 TCP 66 47291 > http [ACK] Seq=98 Ack=2628579 Win=1600512 Len=0 TSval=17764990 TSecr=1499025115
333   0.031281 54.239.132.98 -> 172.31.8.238 TCP 7306 [TCP segment of a reassembled PDU]
334   0.031285 172.31.8.238 -> 54.239.132.98 TCP 66 47291 > http [ACK] Seq=98 Ack=2635819 Win=1600512 Len=0 TSval=17764990 TSecr=1499025115
335   0.031601 54.239.132.98 -> 172.31.8.238 TCP 26130 [TCP segment of a reassembled PDU]
336   0.031608 172.31.8.238 -> 54.239.132.98 TCP 66 47291 > http [ACK] Seq=98 Ack=2661883 Win=1600512 Len=0 TSval=17764990 TSecr=1499025115
337   0.031666 54.239.132.98 -> 172.31.8.238 TCP 26130 [TCP segment of a reassembled PDU]
338   0.031672 172.31.8.238 -> 54.239.132.98 TCP 66 47291 > http [ACK] Seq=98 Ack=2687947 Win=1600512 Len=0 TSval=17764990 TSecr=1499025115
339   0.031729 54.239.132.98 -> 172.31.8.238 TCP 13098 [TCP segment of a reassembled PDU]
340   0.031734 172.31.8.238 -> 54.239.132.98 TCP 66 47291 > http [ACK] Seq=98 Ack=2700979 Win=1600512 Len=0 TSval=17764990 TSecr=1499025115
341   0.031815 54.239.132.98 -> 172.31.8.238 TCP 23234 [TCP segment of a reassembled PDU]
342   0.031820 172.31.8.238 -> 54.239.132.98 TCP 66 47291 > http [ACK] Seq=98 Ack=2724147 Win=1600512 Len=0 TSval=17764990 TSecr=1499025116
343   0.031863 54.239.132.98 -> 172.31.8.238 TCP 2962 [TCP segment of a reassembled PDU]
344   0.031867 172.31.8.238 -> 54.239.132.98 TCP 66 47291 > http [ACK] Seq=98 Ack=2727043 Win=1600512 Len=0 TSval=17764990 TSecr=1499025116
345   0.031980 54.239.132.98 -> 172.31.8.238 TCP 39162 [TCP segment of a reassembled PDU]
