[Measurement for 1kb at 03:02:42 17.02.2014] 
Tshark:

  1   0.000000  192.168.1.2 -> 54.230.98.130 TCP 66 49892→80 [SYN] Seq=0 Win=8192 Len=0 MSS=1460 WS=256 SACK_PERM=1
  2   0.070436 54.230.98.130 -> 192.168.1.2  TCP 66 80→49892 [SYN, ACK] Seq=0 Ack=1 Win=14600 Len=0 MSS=1400 SACK_PERM=1 WS=128
  3   0.070549  192.168.1.2 -> 54.230.98.130 TCP 54 49892→80 [ACK] Seq=1 Ack=1 Win=65792 Len=0
  4   0.070846  192.168.1.2 -> 54.230.98.130 HTTP 150 GET /1kb HTTP/1.1 
  5   0.099503 54.230.98.130 -> 192.168.1.2  TCP 54 80→49892 [ACK] Seq=1 Ack=97 Win=14720 Len=0
  6   0.100575 54.230.98.130 -> 192.168.1.2  TCP 132 [TCP Previous segment not captured] 80→49892 [PSH, ACK] Seq=1401 Ack=97 Win=14720 Len=78
  7   0.100632  192.168.1.2 -> 54.230.98.130 TCP 66 [TCP Dup ACK 4#1] 49892→80 [ACK] Seq=97 Ack=1 Win=65792 Len=0 SLE=1401 SRE=1479
  8   0.101633 54.230.98.130 -> 192.168.1.2  TCP 1454 [TCP Out-Of-Order] [TCP segment of a reassembled PDU]
  9   0.101776  192.168.1.2 -> 54.230.98.130 TCP 54 49892→80 [ACK] Seq=97 Ack=1479 Win=65792 Len=0
 10   0.101974  192.168.1.2 -> 54.230.98.130 TCP 54 49892→80 [FIN, ACK] Seq=97 Ack=1479 Win=65792 Len=0
 11   0.130027 54.230.98.130 -> 192.168.1.2  TCP 54 80→49892 [FIN, ACK] Seq=1479 Ack=98 Win=14720 Len=0
 12   0.130186  192.168.1.2 -> 54.230.98.130 TCP 54 49892→80 [ACK] Seq=98 Ack=1480 Win=65792 Len=0
