[Measurement for 10mb at 08:32:05 20.32.2014] 
Tshark:

  1   0.000000 172.31.36.109 -> 172.31.0.2   DNS 89 Standard query 0x3ed1  A d1dx94olpiqj0t.cloudfront.net
  2   0.000026 172.31.36.109 -> 172.31.0.2   DNS 89 Standard query 0xa584  AAAA d1dx94olpiqj0t.cloudfront.net
  3   0.000536   172.31.0.2 -> 172.31.36.109 DNS 176 Standard query response 0xa584 
  4   0.000549   172.31.0.2 -> 172.31.36.109 DNS 217 Standard query response 0x3ed1  A 216.137.41.243 A 54.230.20.111 A 54.230.21.79 A 54.230.21.133 A 54.230.21.212 A 216.137.41.32 A 216.137.41.101 A 216.137.41.193
  5   0.003898 172.31.36.109 -> 216.137.41.243 TCP 74 46792 > http [SYN] Seq=0 Win=26883 Len=0 MSS=8961 SACK_PERM=1 TSval=34003088 TSecr=0 WS=128
  6   0.091007 216.137.41.243 -> 172.31.36.109 TCP 74 http > 46792 [SYN, ACK] Seq=0 Ack=1 Win=14480 Len=0 MSS=1460 SACK_PERM=1 TSval=939482332 TSecr=34003088 WS=128
  7   0.091040 172.31.36.109 -> 216.137.41.243 TCP 66 46792 > http [ACK] Seq=1 Ack=1 Win=27008 Len=0 TSval=34003110 TSecr=939482332
  8   0.091127 172.31.36.109 -> 216.137.41.243 HTTP 163 GET /10mb HTTP/1.1 
  9   0.178340 216.137.41.243 -> 172.31.36.109 TCP 66 http > 46792 [ACK] Seq=1 Ack=98 Win=14592 Len=0 TSval=939482341 TSecr=34003110
 10   0.180976 216.137.41.243 -> 172.31.36.109 TCP 4410 [TCP segment of a reassembled PDU]
 11   0.180987 172.31.36.109 -> 216.137.41.243 TCP 66 46792 > http [ACK] Seq=98 Ack=4345 Win=35584 Len=0 TSval=34003132 TSecr=939482341
 12   0.181001 216.137.41.243 -> 172.31.36.109 TCP 8754 [TCP segment of a reassembled PDU]
 13   0.181007 172.31.36.109 -> 216.137.41.243 TCP 66 46792 > http [ACK] Seq=98 Ack=13033 Win=52992 Len=0 TSval=34003132 TSecr=939482341
 14   0.269393 216.137.41.243 -> 172.31.36.109 TCP 13098 [TCP segment of a reassembled PDU]
 15   0.269410 172.31.36.109 -> 216.137.41.243 TCP 66 46792 > http [ACK] Seq=98 Ack=26065 Win=79104 Len=0 TSval=34003154 TSecr=939482350
 16   0.356648 216.137.41.243 -> 172.31.36.109 TCP 13098 [TCP segment of a reassembled PDU]
 17   0.356664 172.31.36.109 -> 216.137.41.243 TCP 66 46792 > http [ACK] Seq=98 Ack=39097 Win=96512 Len=0 TSval=34003176 TSecr=939482358
 18   0.443858 216.137.41.243 -> 172.31.36.109 TCP 13098 [TCP segment of a reassembled PDU]
 19   0.443874 172.31.36.109 -> 216.137.41.243 TCP 66 46792 > http [ACK] Seq=98 Ack=52129 Win=96512 Len=0 TSval=34003198 TSecr=939482367
 20   0.443887 216.137.41.243 -> 172.31.36.109 TCP 5858 [TCP segment of a reassembled PDU]
 21   0.443893 172.31.36.109 -> 216.137.41.243 TCP 66 46792 > http [ACK] Seq=98 Ack=57921 Win=90752 Len=0 TSval=34003198 TSecr=939482367
 22   0.443950 216.137.41.243 -> 172.31.36.109 TCP 1514 [TCP segment of a reassembled PDU]
 23   0.443955 172.31.36.109 -> 216.137.41.243 TCP 66 46792 > http [ACK] Seq=98 Ack=59369 Win=108032 Len=0 TSval=34003198 TSecr=939482367
 24   0.531083 216.137.41.243 -> 172.31.36.109 TCP 4410 [TCP segment of a reassembled PDU]
 25   0.531095 172.31.36.109 -> 216.137.41.243 TCP 66 46792 > http [ACK] Seq=98 Ack=63713 Win=109056 Len=0 TSval=34003220 TSecr=939482376
 26   0.531104 216.137.41.243 -> 172.31.36.109 TCP 2962 [TCP segment of a reassembled PDU]
 27   0.531108 172.31.36.109 -> 216.137.41.243 TCP 66 46792 > http [ACK] Seq=98 Ack=66609 Win=106240 Len=0 TSval=34003220 TSecr=939482376
 28   0.531262 216.137.41.243 -> 172.31.36.109 TCP 4410 [TCP segment of a reassembled PDU]
 29   0.531268 172.31.36.109 -> 216.137.41.243 TCP 66 46792 > http [ACK] Seq=98 Ack=70953 Win=109056 Len=0 TSval=34003220 TSecr=939482376
 30   0.531336 216.137.41.243 -> 172.31.36.109 TCP 7306 [TCP segment of a reassembled PDU]
 31   0.531342 172.31.36.109 -> 216.137.41.243 TCP 66 46792 > http [ACK] Seq=98 Ack=78193 Win=105984 Len=0 TSval=34003220 TSecr=939482376
 32   0.618653 216.137.41.243 -> 172.31.36.109 TCP 4410 [TCP segment of a reassembled PDU]
 33   0.618668 172.31.36.109 -> 216.137.41.243 TCP 66 46792 > http [ACK] Seq=98 Ack=82537 Win=109056 Len=0 TSval=34003242 TSecr=939482385
 34   0.618721 216.137.41.243 -> 172.31.36.109 TCP 21786 [TCP segment of a reassembled PDU]
 35   0.618736 172.31.36.109 -> 216.137.41.243 TCP 66 46792 > http [ACK] Seq=98 Ack=104257 Win=87424 Len=0 TSval=34003242 TSecr=939482385
 36   0.705976 216.137.41.243 -> 172.31.36.109 TCP 24682 [TCP segment of a reassembled PDU]
 37   0.705993 172.31.36.109 -> 216.137.41.243 TCP 66 46792 > http [ACK] Seq=98 Ack=128873 Win=77440 Len=0 TSval=34003263 TSecr=939482393
 38   0.706043 216.137.41.243 -> 172.31.36.109 TCP 1514 [TCP segment of a reassembled PDU]
 39   0.706052 172.31.36.109 -> 216.137.41.243 TCP 66 46792 > http [ACK] Seq=98 Ack=130321 Win=112000 Len=0 TSval=34003263 TSecr=939482393
 40   0.793163 216.137.41.243 -> 172.31.36.109 TCP 2962 [TCP segment of a reassembled PDU]
 41   0.793174 172.31.36.109 -> 216.137.41.243 TCP 66 46792 > http [ACK] Seq=98 Ack=133217 Win=117760 Len=0 TSval=34003285 TSecr=939482402
 42   0.793208 216.137.41.243 -> 172.31.36.109 TCP 5858 [TCP segment of a reassembled PDU]
 43   0.793214 172.31.36.109 -> 216.137.41.243 TCP 66 46792 > http [ACK] Seq=98 Ack=139009 Win=129280 Len=0 TSval=34003285 TSecr=939482402
 44   0.793373 216.137.41.243 -> 172.31.36.109 TCP 5858 [TCP segment of a reassembled PDU]
 45   0.793379 172.31.36.109 -> 216.137.41.243 TCP 66 46792 > http [ACK] Seq=98 Ack=144801 Win=140928 Len=0 TSval=34003285 TSecr=939482402
 46   0.793476 216.137.41.243 -> 172.31.36.109 TCP 11650 [TCP segment of a reassembled PDU]
 47   0.793484 172.31.36.109 -> 216.137.41.243 TCP 66 46792 > http [ACK] Seq=98 Ack=156385 Win=164096 Len=0 TSval=34003285 TSecr=939482402
 48   0.880447 216.137.41.243 -> 172.31.36.109 TCP 7306 [TCP segment of a reassembled PDU]
 49   0.880470 172.31.36.109 -> 216.137.41.243 TCP 66 46792 > http [ACK] Seq=98 Ack=163625 Win=178560 Len=0 TSval=34003307 TSecr=939482411
 50   0.880503 216.137.41.243 -> 172.31.36.109 TCP 7306 [TCP segment of a reassembled PDU]
 51   0.880509 172.31.36.109 -> 216.137.41.243 TCP 66 46792 > http [ACK] Seq=98 Ack=170865 Win=193024 Len=0 TSval=34003307 TSecr=939482411
 52   0.880680 216.137.41.243 -> 172.31.36.109 TCP 7306 [TCP segment of a reassembled PDU]
 53   0.880688 172.31.36.109 -> 216.137.41.243 TCP 66 46792 > http [ACK] Seq=98 Ack=178105 Win=207488 Len=0 TSval=34003307 TSecr=939482411
 54   0.880840 216.137.41.243 -> 172.31.36.109 TCP 4410 [TCP segment of a reassembled PDU]
 55   0.880850 172.31.36.109 -> 216.137.41.243 TCP 66 46792 > http [ACK] Seq=98 Ack=182449 Win=216192 Len=0 TSval=34003307 TSecr=939482411
 56   0.880872 216.137.41.243 -> 172.31.36.109 TCP 15994 [TCP segment of a reassembled PDU]
 57   0.880884 172.31.36.109 -> 216.137.41.243 TCP 66 46792 > http [ACK] Seq=98 Ack=198377 Win=248064 Len=0 TSval=34003307 TSecr=939482411
 58   0.967989 216.137.41.243 -> 172.31.36.109 TCP 10202 [TCP segment of a reassembled PDU]
 59   0.968016 172.31.36.109 -> 216.137.41.243 TCP 66 46792 > http [ACK] Seq=98 Ack=208513 Win=268288 Len=0 TSval=34003329 TSecr=939482419
 60   0.968036 216.137.41.243 -> 172.31.36.109 TCP 10202 [TCP segment of a reassembled PDU]
 61   0.968046 172.31.36.109 -> 216.137.41.243 TCP 66 46792 > http [ACK] Seq=98 Ack=218649 Win=288640 Len=0 TSval=34003329 TSecr=939482419
 62   0.968126 216.137.41.243 -> 172.31.36.109 TCP 2962 [TCP segment of a reassembled PDU]
 63   0.968131 172.31.36.109 -> 216.137.41.243 TCP 66 46792 > http [ACK] Seq=98 Ack=221545 Win=294400 Len=0 TSval=34003329 TSecr=939482419
 64   0.968246 216.137.41.243 -> 172.31.36.109 TCP 17442 [TCP segment of a reassembled PDU]
 65   0.968266 172.31.36.109 -> 216.137.41.243 TCP 66 46792 > http [ACK] Seq=98 Ack=238921 Win=295808 Len=0 TSval=34003329 TSecr=939482419
 66   0.968365 216.137.41.243 -> 172.31.36.109 TCP 8754 [TCP segment of a reassembled PDU]
 67   0.968373 172.31.36.109 -> 216.137.41.243 TCP 66 46792 > http [ACK] Seq=98 Ack=247609 Win=310144 Len=0 TSval=34003329 TSecr=939482419
 68   1.055146 216.137.41.243 -> 172.31.36.109 TCP 1514 [TCP segment of a reassembled PDU]
 69   1.055173 216.137.41.243 -> 172.31.36.109 TCP 2962 [TCP segment of a reassembled PDU]
 70   1.055182 172.31.36.109 -> 216.137.41.243 TCP 66 46792 > http [ACK] Seq=98 Ack=251953 Win=317184 Len=0 TSval=34003351 TSecr=939482428
 71   1.055282 216.137.41.243 -> 172.31.36.109 TCP 10202 [TCP segment of a reassembled PDU]
 72   1.055303 172.31.36.109 -> 216.137.41.243 TCP 66 46792 > http [ACK] Seq=98 Ack=262089 Win=324480 Len=0 TSval=34003351 TSecr=939482428
 73   1.055557 216.137.41.243 -> 172.31.36.109 TCP 11650 [TCP segment of a reassembled PDU]
 74   1.055579 172.31.36.109 -> 216.137.41.243 TCP 66 46792 > http [ACK] Seq=98 Ack=273673 Win=324480 Len=0 TSval=34003351 TSecr=939482428
 75   1.055836 216.137.41.243 -> 172.31.36.109 TCP 20338 [TCP segment of a reassembled PDU]
 76   1.055876 172.31.36.109 -> 216.137.41.243 TCP 66 46792 > http [ACK] Seq=98 Ack=293945 Win=304256 Len=0 TSval=34003351 TSecr=939482428
 77   1.142404 216.137.41.243 -> 172.31.36.109 TCP 7306 [TCP segment of a reassembled PDU]
 78   1.142433 172.31.36.109 -> 216.137.41.243 TCP 66 46792 > http [ACK] Seq=98 Ack=301185 Win=312448 Len=0 TSval=34003372 TSecr=939482437
 79   1.142469 216.137.41.243 -> 172.31.36.109 TCP 8754 [TCP segment of a reassembled PDU]
 80   1.142511 172.31.36.109 -> 216.137.41.243 TCP 66 46792 > http [ACK] Seq=98 Ack=309873 Win=324480 Len=0 TSval=34003372 TSecr=939482437
 81   1.142700 216.137.41.243 -> 172.31.36.109 TCP 5858 [TCP segment of a reassembled PDU]
 82   1.142721 172.31.36.109 -> 216.137.41.243 TCP 66 46792 > http [ACK] Seq=98 Ack=315665 Win=324480 Len=0 TSval=34003373 TSecr=939482437
 83   1.143264 216.137.41.243 -> 172.31.36.109 TCP 29026 [TCP segment of a reassembled PDU]
