[Measurement for 10mb at 17:36:52 19.36.2014] 
Tshark:

  1   0.000000 172.31.29.138 -> 172.31.0.2   DNS 89 Standard query 0xe811  A d3796nkzln59xv.cloudfront.net
  2   0.000027 172.31.29.138 -> 172.31.0.2   DNS 89 Standard query 0x8a42  AAAA d3796nkzln59xv.cloudfront.net
  3   0.000567   172.31.0.2 -> 172.31.29.138 DNS 170 Standard query response 0x8a42 
  4   0.000578   172.31.0.2 -> 172.31.29.138 DNS 217 Standard query response 0xe811  A 54.230.159.152 A 54.192.157.152 A 54.192.159.78 A 54.230.158.137 A 54.230.158.223 A 54.230.159.4 A 54.230.159.132 A 54.230.159.144
  5   0.003865 172.31.29.138 -> 54.230.159.152 TCP 74 32983 > http [SYN] Seq=0 Win=26883 Len=0 MSS=8961 SACK_PERM=1 TSval=621328 TSecr=0 WS=128
  6   0.004486 54.230.159.152 -> 172.31.29.138 TCP 74 http > 32983 [SYN, ACK] Seq=0 Ack=1 Win=14480 Len=0 MSS=1460 SACK_PERM=1 TSval=837833429 TSecr=621328 WS=128
  7   0.004501 172.31.29.138 -> 54.230.159.152 TCP 66 32983 > http [ACK] Seq=1 Ack=1 Win=27008 Len=0 TSval=621328 TSecr=837833429
  8   0.004553 172.31.29.138 -> 54.230.159.152 HTTP 163 GET /10mb HTTP/1.1 
  9   0.005236 54.230.159.152 -> 172.31.29.138 TCP 66 http > 32983 [ACK] Seq=1 Ack=98 Win=14592 Len=0 TSval=837833429 TSecr=621328
 10   0.603581 54.230.159.152 -> 172.31.29.138 TCP 7306 [TCP segment of a reassembled PDU]
