[Measurement for 10mb at 04:35:56 20.35.2014] 
Tshark:

  1   0.000000 172.31.29.138 -> 172.31.0.2   DNS 89 Standard query 0x5578  A d3796nkzln59xv.cloudfront.net
  2   0.000036 172.31.29.138 -> 172.31.0.2   DNS 89 Standard query 0x60ec  AAAA d3796nkzln59xv.cloudfront.net
  3   0.000598   172.31.0.2 -> 172.31.29.138 DNS 170 Standard query response 0x60ec 
  4   0.000611   172.31.0.2 -> 172.31.29.138 DNS 217 Standard query response 0x5578  A 54.230.150.38 A 54.230.150.40 A 54.230.150.47 A 54.230.151.62 A 54.230.149.71 A 54.230.149.97 A 54.230.149.227 A 54.230.150.36
  5   0.003895 172.31.29.138 -> 54.230.150.38 TCP 74 53082 > http [SYN] Seq=0 Win=26883 Len=0 MSS=8961 SACK_PERM=1 TSval=10507338 TSecr=0 WS=128
  6   0.005401 54.230.150.38 -> 172.31.29.138 TCP 74 http > 53082 [SYN, ACK] Seq=0 Ack=1 Win=14480 Len=0 MSS=1460 SACK_PERM=1 TSval=1453405691 TSecr=10507338 WS=128
  7   0.005421 172.31.29.138 -> 54.230.150.38 TCP 66 53082 > http [ACK] Seq=1 Ack=1 Win=27008 Len=0 TSval=10507339 TSecr=1453405691
  8   0.005465 172.31.29.138 -> 54.230.150.38 HTTP 163 GET /10mb HTTP/1.1 
  9   0.006871 54.230.150.38 -> 172.31.29.138 TCP 66 http > 53082 [ACK] Seq=1 Ack=98 Win=14592 Len=0 TSval=1453405691 TSecr=10507339
 10   0.010528 54.230.150.38 -> 172.31.29.138 TCP 7306 [TCP segment of a reassembled PDU]
 11   0.010550 172.31.29.138 -> 54.230.150.38 TCP 66 53082 > http [ACK] Seq=98 Ack=7241 Win=41472 Len=0 TSval=10507340 TSecr=1453405692
 12   0.010588 54.230.150.38 -> 172.31.29.138 TCP 7306 [TCP segment of a reassembled PDU]
 13   0.010595 172.31.29.138 -> 54.230.150.38 TCP 66 53082 > http [ACK] Seq=98 Ack=14481 Win=55936 Len=0 TSval=10507340 TSecr=1453405692
 14   0.012072 54.230.150.38 -> 172.31.29.138 TCP 2962 [TCP segment of a reassembled PDU]
 15   0.012078 172.31.29.138 -> 54.230.150.38 TCP 66 53082 > http [ACK] Seq=98 Ack=17377 Win=61696 Len=0 TSval=10507340 TSecr=1453405692
 16   0.012123 54.230.150.38 -> 172.31.29.138 TCP 10202 [TCP segment of a reassembled PDU]
 17   0.012132 172.31.29.138 -> 54.230.150.38 TCP 66 53082 > http [ACK] Seq=98 Ack=27513 Win=81920 Len=0 TSval=10507340 TSecr=1453405692
 18   0.013579 54.230.150.38 -> 172.31.29.138 TCP 4410 [TCP segment of a reassembled PDU]
 19   0.013585 172.31.29.138 -> 54.230.150.38 TCP 66 53082 > http [ACK] Seq=98 Ack=31857 Win=90624 Len=0 TSval=10507341 TSecr=1453405692
 20   0.013678 54.230.150.38 -> 172.31.29.138 TCP 8754 [TCP segment of a reassembled PDU]
 21   0.013685 172.31.29.138 -> 54.230.150.38 TCP 66 53082 > http [ACK] Seq=98 Ack=40545 Win=103680 Len=0 TSval=10507341 TSecr=1453405692
 22   0.013712 54.230.150.38 -> 172.31.29.138 TCP 7306 [TCP segment of a reassembled PDU]
 23   0.013718 172.31.29.138 -> 54.230.150.38 TCP 66 53082 > http [ACK] Seq=98 Ack=47785 Win=96512 Len=0 TSval=10507341 TSecr=1453405692
 24   0.015117 54.230.150.38 -> 172.31.29.138 TCP 2962 [TCP segment of a reassembled PDU]
 25   0.015122 172.31.29.138 -> 54.230.150.38 TCP 66 53082 > http [ACK] Seq=98 Ack=50681 Win=109056 Len=0 TSval=10507341 TSecr=1453405692
 26   0.015260 54.230.150.38 -> 172.31.29.138 TCP 15994 [TCP segment of a reassembled PDU]
 27   0.015270 172.31.29.138 -> 54.230.150.38 TCP 66 53082 > http [ACK] Seq=98 Ack=66609 Win=93184 Len=0 TSval=10507341 TSecr=1453405692
 28   0.016691 54.230.150.38 -> 172.31.29.138 TCP 10202 [TCP segment of a reassembled PDU]
 29   0.016699 172.31.29.138 -> 54.230.150.38 TCP 66 53082 > http [ACK] Seq=98 Ack=76745 Win=101248 Len=0 TSval=10507341 TSecr=1453405692
 30   0.016812 54.230.150.38 -> 172.31.29.138 TCP 17442 [TCP segment of a reassembled PDU]
 31   0.016823 172.31.29.138 -> 54.230.150.38 TCP 66 53082 > http [ACK] Seq=98 Ack=94121 Win=89344 Len=0 TSval=10507341 TSecr=1453405692
 32   0.018073 54.230.150.38 -> 172.31.29.138 TCP 5858 [TCP segment of a reassembled PDU]
 33   0.018080 172.31.29.138 -> 54.230.150.38 TCP 66 53082 > http [ACK] Seq=98 Ack=99913 Win=108416 Len=0 TSval=10507342 TSecr=1453405693
 34   0.018244 54.230.150.38 -> 172.31.29.138 TCP 24682 [TCP segment of a reassembled PDU]
 35   0.018258 172.31.29.138 -> 54.230.150.38 TCP 66 53082 > http [ACK] Seq=98 Ack=124529 Win=158336 Len=0 TSval=10507342 TSecr=1453405693
 36   0.019848 54.230.150.38 -> 172.31.29.138 TCP 14546 [TCP segment of a reassembled PDU]
 37   0.019879 172.31.29.138 -> 54.230.150.38 TCP 66 53082 > http [ACK] Seq=98 Ack=139009 Win=187264 Len=0 TSval=10507342 TSecr=1453405693
 38   0.019949 54.230.150.38 -> 172.31.29.138 TCP 8754 [TCP segment of a reassembled PDU]
 39   0.019955 172.31.29.138 -> 54.230.150.38 TCP 66 53082 > http [ACK] Seq=98 Ack=147697 Win=204672 Len=0 TSval=10507342 TSecr=1453405693
 40   0.021252 54.230.150.38 -> 172.31.29.138 TCP 4410 [TCP segment of a reassembled PDU]
 41   0.021259 172.31.29.138 -> 54.230.150.38 TCP 66 53082 > http [ACK] Seq=98 Ack=152041 Win=213376 Len=0 TSval=10507342 TSecr=1453405693
 42   0.021467 54.230.150.38 -> 172.31.29.138 TCP 21786 [TCP segment of a reassembled PDU]
 43   0.021479 172.31.29.138 -> 54.230.150.38 TCP 66 53082 > http [ACK] Seq=98 Ack=173761 Win=256768 Len=0 TSval=10507343 TSecr=1453405693
 44   0.022798 54.230.150.38 -> 172.31.29.138 TCP 7306 [TCP segment of a reassembled PDU]
 45   0.022806 172.31.29.138 -> 54.230.150.38 TCP 66 53082 > http [ACK] Seq=98 Ack=181001 Win=271232 Len=0 TSval=10507343 TSecr=1453405693
 46   0.022918 54.230.150.38 -> 172.31.29.138 TCP 7306 [TCP segment of a reassembled PDU]
 47   0.022925 172.31.29.138 -> 54.230.150.38 TCP 66 53082 > http [ACK] Seq=98 Ack=188241 Win=285696 Len=0 TSval=10507343 TSecr=1453405693
 48   0.023191 54.230.150.38 -> 172.31.29.138 TCP 21786 [TCP segment of a reassembled PDU]
 49   0.023204 172.31.29.138 -> 54.230.150.38 TCP 66 53082 > http [ACK] Seq=98 Ack=209961 Win=329216 Len=0 TSval=10507343 TSecr=1453405693
 50   0.023215 54.230.150.38 -> 172.31.29.138 TCP 2962 [TCP segment of a reassembled PDU]
 51   0.023231 172.31.29.138 -> 54.230.150.38 TCP 66 53082 > http [ACK] Seq=98 Ack=212857 Win=334976 Len=0 TSval=10507343 TSecr=1453405693
 52   0.024343 54.230.150.38 -> 172.31.29.138 TCP 4410 [TCP segment of a reassembled PDU]
 53   0.024350 172.31.29.138 -> 54.230.150.38 TCP 66 53082 > http [ACK] Seq=98 Ack=217201 Win=343680 Len=0 TSval=10507343 TSecr=1453405693
 54   0.024523 54.230.150.38 -> 172.31.29.138 TCP 26130 [TCP segment of a reassembled PDU]
 55   0.024537 172.31.29.138 -> 54.230.150.38 TCP 66 53082 > http [ACK] Seq=98 Ack=243265 Win=395776 Len=0 TSval=10507343 TSecr=1453405693
 56   0.024549 54.230.150.38 -> 172.31.29.138 TCP 10202 [TCP segment of a reassembled PDU]
 57   0.024559 172.31.29.138 -> 54.230.150.38 TCP 66 53082 > http [ACK] Seq=98 Ack=253401 Win=416000 Len=0 TSval=10507343 TSecr=1453405693
 58   0.025992 54.230.150.38 -> 172.31.29.138 TCP 5858 [TCP segment of a reassembled PDU]
 59   0.026000 172.31.29.138 -> 54.230.150.38 TCP 66 53082 > http [ACK] Seq=98 Ack=259193 Win=427648 Len=0 TSval=10507344 TSecr=1453405693
 60   0.026172 54.230.150.38 -> 172.31.29.138 TCP 26130 [TCP segment of a reassembled PDU]
 61   0.026186 172.31.29.138 -> 54.230.150.38 TCP 66 53082 > http [ACK] Seq=98 Ack=285257 Win=479744 Len=0 TSval=10507344 TSecr=1453405693
 62   0.026195 54.230.150.38 -> 172.31.29.138 TCP 7306 [TCP segment of a reassembled PDU]
 63   0.026199 172.31.29.138 -> 54.230.150.38 TCP 66 53082 > http [ACK] Seq=98 Ack=292497 Win=494208 Len=0 TSval=10507344 TSecr=1453405693
 64   0.027425 54.230.150.38 -> 172.31.29.138 TCP 8754 [TCP segment of a reassembled PDU]
 65   0.027433 172.31.29.138 -> 54.230.150.38 TCP 66 53082 > http [ACK] Seq=98 Ack=301185 Win=511616 Len=0 TSval=10507344 TSecr=1453405694
 66   0.027545 54.230.150.38 -> 172.31.29.138 TCP 8754 [TCP segment of a reassembled PDU]
 67   0.027552 172.31.29.138 -> 54.230.150.38 TCP 66 53082 > http [ACK] Seq=98 Ack=309873 Win=529024 Len=0 TSval=10507344 TSecr=1453405694
 68   0.027695 54.230.150.38 -> 172.31.29.138 TCP 17442 [TCP segment of a reassembled PDU]
 69   0.027704 172.31.29.138 -> 54.230.150.38 TCP 66 53082 > http [ACK] Seq=98 Ack=327249 Win=530048 Len=0 TSval=10507344 TSecr=1453405694
 70   0.027825 54.230.150.38 -> 172.31.29.138 TCP 18890 [TCP segment of a reassembled PDU]
 71   0.027835 172.31.29.138 -> 54.230.150.38 TCP 66 53082 > http [ACK] Seq=98 Ack=346073 Win=527616 Len=0 TSval=10507344 TSecr=1453405694
 72   0.028993 54.230.150.38 -> 172.31.29.138 TCP 2962 [TCP segment of a reassembled PDU]
 73   0.028998 172.31.29.138 -> 54.230.150.38 TCP 66 53082 > http [ACK] Seq=98 Ack=348969 Win=553856 Len=0 TSval=10507344 TSecr=1453405694
 74   0.029187 54.230.150.38 -> 172.31.29.138 TCP 17442 [TCP segment of a reassembled PDU]
 75   0.029209 172.31.29.138 -> 54.230.150.38 TCP 66 53082 > http [ACK] Seq=98 Ack=366345 Win=536576 Len=0 TSval=10507344 TSecr=1453405694
 76   0.029312 54.230.150.38 -> 172.31.29.138 TCP 26130 [TCP segment of a reassembled PDU]
 77   0.029330 54.230.150.38 -> 172.31.29.138 TCP 7306 [TCP segment of a reassembled PDU]
 78   0.029515 172.31.29.138 -> 54.230.150.38 TCP 66 53082 > http [ACK] Seq=98 Ack=399649 Win=530944 Len=0 TSval=10507345 TSecr=1453405694
 79   0.030711 54.230.150.38 -> 172.31.29.138 TCP 1514 [TCP segment of a reassembled PDU]
 80   0.030716 172.31.29.138 -> 54.230.150.38 TCP 66 53082 > http [ACK] Seq=98 Ack=401097 Win=561536 Len=0 TSval=10507345 TSecr=1453405694
 81   0.030926 54.230.150.38 -> 172.31.29.138 TCP 27578 [TCP segment of a reassembled PDU]
 82   0.030951 172.31.29.138 -> 54.230.150.38 TCP 66 53082 > http [ACK] Seq=98 Ack=428609 Win=540416 Len=0 TSval=10507345 TSecr=1453405694
 83   0.031011 54.230.150.38 -> 172.31.29.138 TCP 4410 [TCP segment of a reassembled PDU]
 84   0.031017 172.31.29.138 -> 54.230.150.38 TCP 66 53082 > http [ACK] Seq=98 Ack=432953 Win=570240 Len=0 TSval=10507345 TSecr=1453405694
 85   0.031151 54.230.150.38 -> 172.31.29.138 TCP 20338 [TCP segment of a reassembled PDU]
 86   0.031177 172.31.29.138 -> 54.230.150.38 TCP 66 53082 > http [ACK] Seq=98 Ack=453225 Win=552320 Len=0 TSval=10507345 TSecr=1453405694
 87   0.032537 54.230.150.38 -> 172.31.29.138 TCP 4410 [TCP segment of a reassembled PDU]
 88   0.032544 172.31.29.138 -> 54.230.150.38 TCP 66 53082 > http [ACK] Seq=98 Ack=457569 Win=578560 Len=0 TSval=10507345 TSecr=1453405694
 89   0.032707 54.230.150.38 -> 172.31.29.138 TCP 26130 [TCP segment of a reassembled PDU]
 90   0.032725 54.230.150.38 -> 172.31.29.138 TCP 7306 [TCP segment of a reassembled PDU]
 91   0.032742 172.31.29.138 -> 54.230.150.38 TCP 66 53082 > http [ACK] Seq=98 Ack=490873 Win=545280 Len=0 TSval=10507345 TSecr=1453405694
 92   0.032774 54.230.150.38 -> 172.31.29.138 TCP 18890 [TCP segment of a reassembled PDU]
 93   0.032789 172.31.29.138 -> 54.230.150.38 TCP 66 53082 > http [ACK] Seq=98 Ack=509697 Win=554752 Len=0 TSval=10507345 TSecr=1453405694
 94   0.032811 54.230.150.38 -> 172.31.29.138 TCP 8754 [TCP segment of a reassembled PDU]
 95   0.032816 172.31.29.138 -> 54.230.150.38 TCP 66 53082 > http [ACK] Seq=98 Ack=518385 Win=571392 Len=0 TSval=10507345 TSecr=1453405694
 96   0.034401 54.230.150.38 -> 172.31.29.138 TCP 11650 [TCP segment of a reassembled PDU]
 97   0.034423 172.31.29.138 -> 54.230.150.38 TCP 66 53082 > http [ACK] Seq=98 Ack=529969 Win=578944 Len=0 TSval=10507346 TSecr=1453405694
 98   0.034558 54.230.150.38 -> 172.31.29.138 TCP 26130 [TCP segment of a reassembled PDU]
 99   0.034584 172.31.29.138 -> 54.230.150.38 TCP 66 53082 > http [ACK] Seq=98 Ack=556033 Win=552960 Len=0 TSval=10507346 TSecr=1453405694
100   0.034616 54.230.150.38 -> 172.31.29.138 TCP 26130 [TCP segment of a reassembled PDU]
101   0.034629 54.230.150.38 -> 172.31.29.138 TCP 1514 [TCP segment of a reassembled PDU]
102   0.034639 172.31.29.138 -> 54.230.150.38 TCP 66 53082 > http [ACK] Seq=98 Ack=583545 Win=540416 Len=0 TSval=10507346 TSecr=1453405694
103   0.036144 54.230.150.38 -> 172.31.29.138 TCP 7306 [TCP segment of a reassembled PDU]
104   0.036151 172.31.29.138 -> 54.230.150.38 TCP 66 53082 > http [ACK] Seq=98 Ack=590785 Win=573824 Len=0 TSval=10507346 TSecr=1453405694
105   0.036337 54.230.150.38 -> 172.31.29.138 TCP 26130 [TCP segment of a reassembled PDU]
106   0.036363 172.31.29.138 -> 54.230.150.38 TCP 66 53082 > http [ACK] Seq=98 Ack=616849 Win=547840 Len=0 TSval=10507346 TSecr=1453405694
107   0.036394 54.230.150.38 -> 172.31.29.138 TCP 26130 [TCP segment of a reassembled PDU]
108   0.036418 54.230.150.38 -> 172.31.29.138 TCP 5858 [TCP segment of a reassembled PDU]
109   0.036426 172.31.29.138 -> 54.230.150.38 TCP 66 53082 > http [ACK] Seq=98 Ack=642913 Win=542848 Len=0 TSval=10507346 TSecr=1453405694
110   0.036437 172.31.29.138 -> 54.230.150.38 TCP 66 53082 > http [ACK] Seq=98 Ack=648705 Win=537088 Len=0 TSval=10507346 TSecr=1453405694
111   0.037943 54.230.150.38 -> 172.31.29.138 TCP 4410 [TCP segment of a reassembled PDU]
112   0.037949 172.31.29.138 -> 54.230.150.38 TCP 66 53082 > http [ACK] Seq=98 Ack=653049 Win=578560 Len=0 TSval=10507347 TSecr=1453405695
113   0.038126 54.230.150.38 -> 172.31.29.138 TCP 26130 [TCP segment of a reassembled PDU]
114   0.038151 172.31.29.138 -> 54.230.150.38 TCP 66 53082 > http [ACK] Seq=98 Ack=679113 Win=552576 Len=0 TSval=10507347 TSecr=1453405695
115   0.038195 54.230.150.38 -> 172.31.29.138 TCP 26130 [TCP segment of a reassembled PDU]
116   0.038218 172.31.29.138 -> 54.230.150.38 TCP 66 53082 > http [ACK] Seq=98 Ack=705177 Win=542848 Len=0 TSval=10507347 TSecr=1453405695
117   0.038240 54.230.150.38 -> 172.31.29.138 TCP 8754 [TCP segment of a reassembled PDU]
118   0.038252 172.31.29.138 -> 54.230.150.38 TCP 66 53082 > http [ACK] Seq=98 Ack=713865 Win=578944 Len=0 TSval=10507347 TSecr=1453405695
119   0.039712 54.230.150.38 -> 172.31.29.138 TCP 2962 [TCP segment of a reassembled PDU]
120   0.039717 172.31.29.138 -> 54.230.150.38 TCP 66 53082 > http [ACK] Seq=98 Ack=716761 Win=580864 Len=0 TSval=10507347 TSecr=1453405695
121   0.039906 54.230.150.38 -> 172.31.29.138 TCP 26130 [TCP segment of a reassembled PDU]
122   0.039963 54.230.150.38 -> 172.31.29.138 TCP 24682 [TCP segment of a reassembled PDU]
123   0.039980 54.230.150.38 -> 172.31.29.138 TCP 1514 [TCP segment of a reassembled PDU]
124   0.039988 172.31.29.138 -> 54.230.150.38 TCP 66 53082 > http [ACK] Seq=98 Ack=768889 Win=528768 Len=0 TSval=10507347 TSecr=1453405695
125   0.040016 54.230.150.38 -> 172.31.29.138 TCP 10202 [TCP segment of a reassembled PDU]
126   0.040028 172.31.29.138 -> 54.230.150.38 TCP 66 53082 > http [ACK] Seq=98 Ack=779025 Win=526208 Len=0 TSval=10507347 TSecr=1453405695
127   0.041558 54.230.150.38 -> 172.31.29.138 TCP 7306 [TCP segment of a reassembled PDU]
128   0.041565 172.31.29.138 -> 54.230.150.38 TCP 66 53082 > http [ACK] Seq=98 Ack=786265 Win=573824 Len=0 TSval=10507348 TSecr=1453405695
129   0.041735 54.230.150.38 -> 172.31.29.138 TCP 26130 [TCP segment of a reassembled PDU]
130   0.041762 54.230.150.38 -> 172.31.29.138 TCP 14546 [TCP segment of a reassembled PDU]
131   0.041772 54.230.150.38 -> 172.31.29.138 TCP 2962 [TCP segment of a reassembled PDU]
132   0.041793 54.230.150.38 -> 172.31.29.138 TCP 8754 [TCP segment of a reassembled PDU]
133   0.041803 54.230.150.38 -> 172.31.29.138 TCP 5858 [TCP segment of a reassembled PDU]
134   0.041811 172.31.29.138 -> 54.230.150.38 TCP 66 53082 > http [ACK] Seq=98 Ack=844185 Win=515968 Len=0 TSval=10507348 TSecr=1453405695
135   0.043050 54.230.150.38 -> 172.31.29.138 TCP 4410 [TCP segment of a reassembled PDU]
136   0.043056 172.31.29.138 -> 54.230.150.38 TCP 66 53082 > http [ACK] Seq=98 Ack=848529 Win=578560 Len=0 TSval=10507348 TSecr=1453405695
137   0.043234 54.230.150.38 -> 172.31.29.138 TCP 26130 [TCP segment of a reassembled PDU]
138   0.043256 54.230.150.38 -> 172.31.29.138 TCP 14546 [TCP segment of a reassembled PDU]
139   0.043268 54.230.150.38 -> 172.31.29.138 TCP 10202 [TCP segment of a reassembled PDU]
140   0.043275 54.230.150.38 -> 172.31.29.138 TCP 4410 [TCP segment of a reassembled PDU]
141   0.043280 54.230.150.38 -> 172.31.29.138 TCP 5858 [TCP segment of a reassembled PDU]
142   0.043370 54.230.150.38 -> 172.31.29.138 TCP 27578 [TCP segment of a reassembled PDU]
143   0.043396 54.230.150.38 -> 172.31.29.138 TCP 5858 [TCP segment of a reassembled PDU]
144   0.043483 172.31.29.138 -> 54.230.150.38 TCP 66 53082 > http [ACK] Seq=98 Ack=942649 Win=484480 Len=0 TSval=10507348 TSecr=1453405695
145   0.045119 54.230.150.38 -> 172.31.29.138 TCP 5858 [TCP segment of a reassembled PDU]
146   0.045126 172.31.29.138 -> 54.230.150.38 TCP 66 53082 > http [ACK] Seq=98 Ack=948441 Win=576128 Len=0 TSval=10507348 TSecr=1453405695
147   0.045291 54.230.150.38 -> 172.31.29.138 TCP 26130 [TCP segment of a reassembled PDU]
148   0.045336 54.230.150.38 -> 172.31.29.138 TCP 24682 [TCP segment of a reassembled PDU]
149   0.045348 172.31.29.138 -> 54.230.150.38 TCP 66 53082 > http [ACK] Seq=98 Ack=974505 Win=550144 Len=0 TSval=10507349 TSecr=1453405695
150   0.045356 54.230.150.38 -> 172.31.29.138 TCP 1514 [TCP segment of a reassembled PDU]
151   0.045369 172.31.29.138 -> 54.230.150.38 TCP 66 53082 > http [ACK] Seq=98 Ack=1000569 Win=542720 Len=0 TSval=10507349 TSecr=1453405695
152   0.045461 54.230.150.38 -> 172.31.29.138 TCP 39162 [TCP segment of a reassembled PDU]
153   0.045573 172.31.29.138 -> 54.230.150.38 TCP 66 53082 > http [ACK] Seq=98 Ack=1039665 Win=521472 Len=0 TSval=10507349 TSecr=1453405695
154   0.046671 54.230.150.38 -> 172.31.29.138 TCP 1514 [TCP segment of a reassembled PDU]
155   0.046855 54.230.150.38 -> 172.31.29.138 TCP 20338 [TCP segment of a reassembled PDU]
156   0.046866 172.31.29.138 -> 54.230.150.38 TCP 66 53082 > http [ACK] Seq=98 Ack=1061385 Win=552320 Len=0 TSval=10507349 TSecr=1453405695
157   0.046884 54.230.150.38 -> 172.31.29.138 TCP 5858 [TCP segment of a reassembled PDU]
158   0.046897 172.31.29.138 -> 54.230.150.38 TCP 66 53082 > http [ACK] Seq=98 Ack=1067177 Win=546560 Len=0 TSval=10507349 TSecr=1453405695
159   0.046979 54.230.150.38 -> 172.31.29.138 TCP 37714 [TCP segment of a reassembled PDU]
160   0.047007 172.31.29.138 -> 54.230.150.38 TCP 66 53082 > http [ACK] Seq=98 Ack=1104825 Win=523776 Len=0 TSval=10507349 TSecr=1453405695
161   0.047312 54.230.150.38 -> 172.31.29.138 TCP 18890 [TCP segment of a reassembled PDU]
162   0.047323 172.31.29.138 -> 54.230.150.38 TCP 66 53082 > http [ACK] Seq=98 Ack=1123649 Win=554752 Len=0 TSval=10507349 TSecr=1453405695
163   0.047345 54.230.150.38 -> 172.31.29.138 TCP 7306 [TCP segment of a reassembled PDU]
164   0.047356 172.31.29.138 -> 54.230.150.38 TCP 66 53082 > http [ACK] Seq=98 Ack=1130889 Win=547584 Len=0 TSval=10507349 TSecr=1453405695
165   0.047421 54.230.150.38 -> 172.31.29.138 TCP 15994 [TCP segment of a reassembled PDU]
166   0.047432 172.31.29.138 -> 54.230.150.38 TCP 66 53082 > http [ACK] Seq=98 Ack=1146817 Win=559488 Len=0 TSval=10507349 TSecr=1453405695
167   0.048442 54.230.150.38 -> 172.31.29.138 TCP 2962 [TCP segment of a reassembled PDU]
168   0.048447 172.31.29.138 -> 54.230.150.38 TCP 66 53082 > http [ACK] Seq=98 Ack=1149713 Win=580864 Len=0 TSval=10507349 TSecr=1453405696
169   0.048614 54.230.150.38 -> 172.31.29.138 TCP 26130 [TCP segment of a reassembled PDU]
170   0.048633 54.230.150.38 -> 172.31.29.138 TCP 10202 [TCP segment of a reassembled PDU]
171   0.048646 54.230.150.38 -> 172.31.29.138 TCP 13098 [TCP segment of a reassembled PDU]
172   0.048663 172.31.29.138 -> 54.230.150.38 TCP 66 53082 > http [ACK] Seq=98 Ack=1198945 Win=531712 Len=0 TSval=10507349 TSecr=1453405696
173   0.048717 54.230.150.38 -> 172.31.29.138 TCP 17442 [TCP segment of a reassembled PDU]
174   0.048725 172.31.29.138 -> 54.230.150.38 TCP 66 53082 > http [ACK] Seq=98 Ack=1216321 Win=557056 Len=0 TSval=10507349 TSecr=1453405696
175   0.048825 54.230.150.38 -> 172.31.29.138 TCP 18890 [TCP segment of a reassembled PDU]
176   0.048893 172.31.29.138 -> 54.230.150.38 TCP 66 53082 > http [ACK] Seq=98 Ack=1235145 Win=538240 Len=0 TSval=10507349 TSecr=1453405696
177   0.050045 54.230.150.38 -> 172.31.29.138 TCP 2962 [TCP segment of a reassembled PDU]
178   0.050050 172.31.29.138 -> 54.230.150.38 TCP 66 53082 > http [ACK] Seq=98 Ack=1238041 Win=580864 Len=0 TSval=10507350 TSecr=1453405696
179   0.050227 54.230.150.38 -> 172.31.29.138 TCP 26130 [TCP segment of a reassembled PDU]
180   0.050239 172.31.29.138 -> 54.230.150.38 TCP 66 53082 > http [ACK] Seq=98 Ack=1264105 Win=636800 Len=0 TSval=10507350 TSecr=1453405696
181   0.050281 54.230.150.38 -> 172.31.29.138 TCP 26130 [TCP segment of a reassembled PDU]
182   0.050293 172.31.29.138 -> 54.230.150.38 TCP 66 53082 > http [ACK] Seq=98 Ack=1290169 Win=689024 Len=0 TSval=10507350 TSecr=1453405696
183   0.050330 54.230.150.38 -> 172.31.29.138 TCP 10202 [TCP segment of a reassembled PDU]
184   0.050338 172.31.29.138 -> 54.230.150.38 TCP 66 53082 > http [ACK] Seq=98 Ack=1300305 Win=709248 Len=0 TSval=10507350 TSecr=1453405696
185   0.050386 54.230.150.38 -> 172.31.29.138 TCP 18890 [TCP segment of a reassembled PDU]
186   0.050397 172.31.29.138 -> 54.230.150.38 TCP 66 53082 > http [ACK] Seq=98 Ack=1319129 Win=746880 Len=0 TSval=10507350 TSecr=1453405696
187   0.050518 54.230.150.38 -> 172.31.29.138 TCP 26130 [TCP segment of a reassembled PDU]
188   0.050531 172.31.29.138 -> 54.230.150.38 TCP 66 53082 > http [ACK] Seq=98 Ack=1345193 Win=798976 Len=0 TSval=10507350 TSecr=1453405696
189   0.050547 54.230.150.38 -> 172.31.29.138 TCP 11650 [TCP segment of a reassembled PDU]
190   0.050553 172.31.29.138 -> 54.230.150.38 TCP 66 53082 > http [ACK] Seq=98 Ack=1356777 Win=822144 Len=0 TSval=10507350 TSecr=1453405696
191   0.051577 54.230.150.38 -> 172.31.29.138 TCP 2962 [TCP segment of a reassembled PDU]
192   0.051583 172.31.29.138 -> 54.230.150.38 TCP 66 53082 > http [ACK] Seq=98 Ack=1359673 Win=828032 Len=0 TSval=10507350 TSecr=1453405696
193   0.051709 54.230.150.38 -> 172.31.29.138 TCP 5858 [TCP segment of a reassembled PDU]
194   0.051715 172.31.29.138 -> 54.230.150.38 TCP 66 53082 > http [ACK] Seq=98 Ack=1365465 Win=839552 Len=0 TSval=10507350 TSecr=1453405696
195   0.051812 54.230.150.38 -> 172.31.29.138 TCP 26130 [TCP segment of a reassembled PDU]
196   0.051826 172.31.29.138 -> 54.230.150.38 TCP 66 53082 > http [ACK] Seq=98 Ack=1391529 Win=891648 Len=0 TSval=10507350 TSecr=1453405696
197   0.051842 54.230.150.38 -> 172.31.29.138 TCP 15994 [TCP segment of a reassembled PDU]
198   0.051850 172.31.29.138 -> 54.230.150.38 TCP 66 53082 > http [ACK] Seq=98 Ack=1407457 Win=923520 Len=0 TSval=10507350 TSecr=1453405696
199   0.051859 54.230.150.38 -> 172.31.29.138 TCP 8754 [TCP segment of a reassembled PDU]
200   0.051864 172.31.29.138 -> 54.230.150.38 TCP 66 53082 > http [ACK] Seq=98 Ack=1416145 Win=940928 Len=0 TSval=10507350 TSecr=1453405696
201   0.051887 54.230.150.38 -> 172.31.29.138 TCP 8754 [TCP segment of a reassembled PDU]
202   0.051893 172.31.29.138 -> 54.230.150.38 TCP 66 53082 > http [ACK] Seq=98 Ack=1424833 Win=958336 Len=0 TSval=10507350 TSecr=1453405696
203   0.052028 54.230.150.38 -> 172.31.29.138 TCP 26130 [TCP segment of a reassembled PDU]
204   0.052041 172.31.29.138 -> 54.230.150.38 TCP 66 53082 > http [ACK] Seq=98 Ack=1450897 Win=1010432 Len=0 TSval=10507350 TSecr=1453405696
205   0.052048 54.230.150.38 -> 172.31.29.138 TCP 2962 [TCP segment of a reassembled PDU]
206   0.052051 172.31.29.138 -> 54.230.150.38 TCP 66 53082 > http [ACK] Seq=98 Ack=1453793 Win=1016192 Len=0 TSval=10507350 TSecr=1453405696
207   0.052082 54.230.150.38 -> 172.31.29.138 TCP 21786 [TCP segment of a reassembled PDU]
208   0.052092 172.31.29.138 -> 54.230.150.38 TCP 66 53082 > http [ACK] Seq=98 Ack=1475513 Win=1059712 Len=0 TSval=10507350 TSecr=1453405696
209   0.053121 54.230.150.38 -> 172.31.29.138 TCP 5858 [TCP segment of a reassembled PDU]
210   0.053128 172.31.29.138 -> 54.230.150.38 TCP 66 53082 > http [ACK] Seq=98 Ack=1481305 Win=1071232 Len=0 TSval=10507350 TSecr=1453405696
211   0.053325 54.230.150.38 -> 172.31.29.138 TCP 27578 [TCP segment of a reassembled PDU]
212   0.053339 172.31.29.138 -> 54.230.150.38 TCP 66 53082 > http [ACK] Seq=98 Ack=1508817 Win=1126272 Len=0 TSval=10507351 TSecr=1453405696
213   0.053360 54.230.150.38 -> 172.31.29.138 TCP 2962 [TCP segment of a reassembled PDU]
214   0.053363 172.31.29.138 -> 54.230.150.38 TCP 66 53082 > http [ACK] Seq=98 Ack=1511713 Win=1132032 Len=0 TSval=10507351 TSecr=1453405696
215   0.053546 54.230.150.38 -> 172.31.29.138 TCP 26130 [TCP segment of a reassembled PDU]
216   0.053560 172.31.29.138 -> 54.230.150.38 TCP 66 53082 > http [ACK] Seq=98 Ack=1537777 Win=1184128 Len=0 TSval=10507351 TSecr=1453405696
217   0.053598 54.230.150.38 -> 172.31.29.138 TCP 26130 [TCP segment of a reassembled PDU]
218   0.053614 172.31.29.138 -> 54.230.150.38 TCP 66 53082 > http [ACK] Seq=98 Ack=1563841 Win=1236352 Len=0 TSval=10507351 TSecr=1453405696
219   0.053628 54.230.150.38 -> 172.31.29.138 TCP 7306 [TCP segment of a reassembled PDU]
220   0.053632 172.31.29.138 -> 54.230.150.38 TCP 66 53082 > http [ACK] Seq=98 Ack=1571081 Win=1250816 Len=0 TSval=10507351 TSecr=1453405696
221   0.053735 54.230.150.38 -> 172.31.29.138 TCP 44954 [TCP segment of a reassembled PDU]
222   0.053754 172.31.29.138 -> 54.230.150.38 TCP 66 53082 > http [ACK] Seq=98 Ack=1615969 Win=1313792 Len=0 TSval=10507351 TSecr=1453405696
223   0.053763 54.230.150.38 -> 172.31.29.138 TCP 4410 [TCP segment of a reassembled PDU]
224   0.053863 172.31.29.138 -> 54.230.150.38 TCP 66 53082 > http [ACK] Seq=98 Ack=1620313 Win=1309568 Len=0 TSval=10507351 TSecr=1453405696
225   0.054479 54.230.150.38 -> 172.31.29.138 TCP 5858 [TCP segment of a reassembled PDU]
226   0.054486 172.31.29.138 -> 54.230.150.38 TCP 66 53082 > http [ACK] Seq=98 Ack=1626105 Win=1352192 Len=0 TSval=10507351 TSecr=1453405696
227   0.055015 54.230.150.38 -> 172.31.29.138 TCP 2962 [TCP segment of a reassembled PDU]
228   0.055020 172.31.29.138 -> 54.230.150.38 TCP 66 53082 > http [ACK] Seq=98 Ack=1629001 Win=1357952 Len=0 TSval=10507351 TSecr=1453405696
229   0.055204 54.230.150.38 -> 172.31.29.138 TCP 26130 [TCP segment of a reassembled PDU]
230   0.055247 54.230.150.38 -> 172.31.29.138 TCP 23234 [TCP segment of a reassembled PDU]
231   0.055260 172.31.29.138 -> 54.230.150.38 TCP 66 53082 > http [ACK] Seq=98 Ack=1655065 Win=1344768 Len=0 TSval=10507351 TSecr=1453405696
232   0.055269 54.230.150.38 -> 172.31.29.138 TCP 2962 [TCP segment of a reassembled PDU]
233   0.055283 172.31.29.138 -> 54.230.150.38 TCP 66 53082 > http [ACK] Seq=98 Ack=1681129 Win=1344640 Len=0 TSval=10507351 TSecr=1453405696
234   0.055345 54.230.150.38 -> 172.31.29.138 TCP 26130 [TCP segment of a reassembled PDU]
235   0.055358 172.31.29.138 -> 54.230.150.38 TCP 66 53082 > http [ACK] Seq=98 Ack=1707193 Win=1344768 Len=0 TSval=10507351 TSecr=1453405696
236   0.055461 54.230.150.38 -> 172.31.29.138 TCP 26130 [TCP segment of a reassembled PDU]
237   0.055477 54.230.150.38 -> 172.31.29.138 TCP 7306 [TCP segment of a reassembled PDU]
238   0.055502 54.230.150.38 -> 172.31.29.138 TCP 15994 [TCP segment of a reassembled PDU]
239   0.055550 172.31.29.138 -> 54.230.150.38 TCP 66 53082 > http [ACK] Seq=98 Ack=1756425 Win=1295616 Len=0 TSval=10507351 TSecr=1453405696
240   0.056725 54.230.150.38 -> 172.31.29.138 TCP 4410 [TCP segment of a reassembled PDU]
241   0.056731 172.31.29.138 -> 54.230.150.38 TCP 66 53082 > http [ACK] Seq=98 Ack=1760769 Win=1366656 Len=0 TSval=10507351 TSecr=1453405696
242   0.056908 54.230.150.38 -> 172.31.29.138 TCP 26130 [TCP segment of a reassembled PDU]
243   0.056926 54.230.150.38 -> 172.31.29.138 TCP 8754 [TCP segment of a reassembled PDU]
244   0.056943 172.31.29.138 -> 54.230.150.38 TCP 66 53082 > http [ACK] Seq=98 Ack=1795521 Win=1331968 Len=0 TSval=10507351 TSecr=1453405696
245   0.056960 54.230.150.38 -> 172.31.29.138 TCP 17442 [TCP segment of a reassembled PDU]
246   0.056976 54.230.150.38 -> 172.31.29.138 TCP 8754 [TCP segment of a reassembled PDU]
247   0.056991 172.31.29.138 -> 54.230.150.38 TCP 66 53082 > http [ACK] Seq=98 Ack=1821585 Win=1330304 Len=0 TSval=10507351 TSecr=1453405696
248   0.057243 54.230.150.38 -> 172.31.29.138 TCP 4410 [TCP segment of a reassembled PDU]
249   0.057249 172.31.29.138 -> 54.230.150.38 TCP 66 53082 > http [ACK] Seq=98 Ack=1825929 Win=1375360 Len=0 TSval=10507351 TSecr=1453405696
250   0.057425 54.230.150.38 -> 172.31.29.138 TCP 23234 [TCP segment of a reassembled PDU]
251   0.057450 54.230.150.38 -> 172.31.29.138 TCP 2962 [TCP segment of a reassembled PDU]
252   0.057456 172.31.29.138 -> 54.230.150.38 TCP 66 53082 > http [ACK] Seq=98 Ack=1849097 Win=1352192 Len=0 TSval=10507352 TSecr=1453405696
253   0.057483 172.31.29.138 -> 54.230.150.38 TCP 66 53082 > http [ACK] Seq=98 Ack=1851993 Win=1375360 Len=0 TSval=10507352 TSecr=1453405696
254   0.057529 54.230.150.38 -> 172.31.29.138 TCP 26130 [TCP segment of a reassembled PDU]
255   0.057558 172.31.29.138 -> 54.230.150.38 TCP 66 53082 > http [ACK] Seq=98 Ack=1878057 Win=1349376 Len=0 TSval=10507352 TSecr=1453405696
256   0.057589 54.230.150.38 -> 172.31.29.138 TCP 8754 [TCP segment of a reassembled PDU]
257   0.057596 172.31.29.138 -> 54.230.150.38 TCP 66 53082 > http [ACK] Seq=98 Ack=1886745 Win=1373312 Len=0 TSval=10507352 TSecr=1453405696
258   0.058268 54.230.150.38 -> 172.31.29.138 TCP 4410 [TCP segment of a reassembled PDU]
259   0.058273 172.31.29.138 -> 54.230.150.38 TCP 66 53082 > http [ACK] Seq=98 Ack=1891089 Win=1379328 Len=0 TSval=10507352 TSecr=1453405697
260   0.058450 54.230.150.38 -> 172.31.29.138 TCP 20338 [TCP segment of a reassembled PDU]
261   0.058477 54.230.150.38 -> 172.31.29.138 TCP 5858 [TCP segment of a reassembled PDU]
262   0.058504 172.31.29.138 -> 54.230.150.38 TCP 66 53082 > http [ACK] Seq=98 Ack=1917153 Win=1353344 Len=0 TSval=10507352 TSecr=1453405697
263   0.058559 54.230.150.38 -> 172.31.29.138 TCP 34818 [TCP segment of a reassembled PDU]
264   0.058580 172.31.29.138 -> 54.230.150.38 TCP 66 53082 > http [ACK] Seq=98 Ack=1951905 Win=1330432 Len=0 TSval=10507352 TSecr=1453405697
265   0.058966 54.230.150.38 -> 172.31.29.138 TCP 21786 [TCP segment of a reassembled PDU]
266   0.058974 172.31.29.138 -> 54.230.150.38 TCP 66 53082 > http [ACK] Seq=98 Ack=1973625 Win=1351936 Len=0 TSval=10507352 TSecr=1453405697
267   0.058992 54.230.150.38 -> 172.31.29.138 TCP 4410 [TCP segment of a reassembled PDU]
268   0.059002 172.31.29.138 -> 54.230.150.38 TCP 66 53082 > http [ACK] Seq=98 Ack=1977969 Win=1347712 Len=0 TSval=10507352 TSecr=1453405697
269   0.059119 54.230.150.38 -> 172.31.29.138 TCP 39162 [TCP segment of a reassembled PDU]
270   0.059143 172.31.29.138 -> 54.230.150.38 TCP 66 53082 > http [ACK] Seq=98 Ack=2017065 Win=1323392 Len=0 TSval=10507352 TSecr=1453405697
271   0.059846 54.230.150.38 -> 172.31.29.138 TCP 1514 [TCP segment of a reassembled PDU]
272   0.060024 54.230.150.38 -> 172.31.29.138 TCP 17442 [TCP segment of a reassembled PDU]
273   0.060030 172.31.29.138 -> 54.230.150.38 TCP 66 53082 > http [ACK] Seq=98 Ack=2035889 Win=1358976 Len=0 TSval=10507352 TSecr=1453405697
274   0.060148 54.230.150.38 -> 172.31.29.138 TCP 34818 [TCP segment of a reassembled PDU]
275   0.060164 54.230.150.38 -> 172.31.29.138 TCP 11650 [TCP segment of a reassembled PDU]
276   0.060181 172.31.29.138 -> 54.230.150.38 TCP 66 53082 > http [ACK] Seq=98 Ack=2082225 Win=1312640 Len=0 TSval=10507352 TSecr=1453405697
277   0.060464 54.230.150.38 -> 172.31.29.138 TCP 26130 [TCP segment of a reassembled PDU]
278   0.060472 172.31.29.138 -> 54.230.150.38 TCP 66 53082 > http [ACK] Seq=98 Ack=2108289 Win=1344768 Len=0 TSval=10507352 TSecr=1453405697
279   0.060492 54.230.150.38 -> 172.31.29.138 TCP 18890 [TCP segment of a reassembled PDU]
280   0.060523 172.31.29.138 -> 54.230.150.38 TCP 66 53082 > http [ACK] Seq=98 Ack=2127113 Win=1325952 Len=0 TSval=10507352 TSecr=1453405697
281   0.060552 54.230.150.38 -> 172.31.29.138 TCP 2962 [TCP segment of a reassembled PDU]
282   0.060560 172.31.29.138 -> 54.230.150.38 TCP 66 53082 > http [ACK] Seq=98 Ack=2130009 Win=1351808 Len=0 TSval=10507352 TSecr=1453405697
283   0.060609 54.230.150.38 -> 172.31.29.138 TCP 17442 [TCP segment of a reassembled PDU]
284   0.060614 172.31.29.138 -> 54.230.150.38 TCP 66 53082 > http [ACK] Seq=98 Ack=2147385 Win=1358976 Len=0 TSval=10507352 TSecr=1453405697
285   0.061409 54.230.150.38 -> 172.31.29.138 TCP 2962 [TCP segment of a reassembled PDU]
286   0.061427 172.31.29.138 -> 54.230.150.38 TCP 66 53082 > http [ACK] Seq=98 Ack=2150281 Win=1379328 Len=0 TSval=10507353 TSecr=1453405697
287   0.061558 54.230.150.38 -> 172.31.29.138 TCP 26130 [TCP segment of a reassembled PDU]
288   0.061584 54.230.150.38 -> 172.31.29.138 TCP 15994 [TCP segment of a reassembled PDU]
289   0.061594 54.230.150.38 -> 172.31.29.138 TCP 10202 [TCP segment of a reassembled PDU]
290   0.061611 54.230.150.38 -> 172.31.29.138 TCP 10202 [TCP segment of a reassembled PDU]
291   0.061617 172.31.29.138 -> 54.230.150.38 TCP 66 53082 > http [ACK] Seq=98 Ack=2202409 Win=1327232 Len=0 TSval=10507353 TSecr=1453405697
292   0.061632 172.31.29.138 -> 54.230.150.38 TCP 66 53082 > http [ACK] Seq=98 Ack=2212545 Win=1328000 Len=0 TSval=10507353 TSecr=1453405697
293   0.061907 54.230.150.38 -> 172.31.29.138 TCP 10202 [TCP segment of a reassembled PDU]
294   0.061914 172.31.29.138 -> 54.230.150.38 TCP 66 53082 > http [ACK] Seq=98 Ack=2222681 Win=1371008 Len=0 TSval=10507353 TSecr=1453405697
295   0.062071 54.230.150.38 -> 172.31.29.138 TCP 26130 [TCP segment of a reassembled PDU]
296   0.062091 172.31.29.138 -> 54.230.150.38 TCP 66 53082 > http [ACK] Seq=98 Ack=2248745 Win=1345024 Len=0 TSval=10507353 TSecr=1453405697
297   0.062120 54.230.150.38 -> 172.31.29.138 TCP 26130 [TCP segment of a reassembled PDU]
298   0.062134 172.31.29.138 -> 54.230.150.38 TCP 66 53082 > http [ACK] Seq=98 Ack=2274809 Win=1344768 Len=0 TSval=10507353 TSecr=1453405697
299   0.062144 54.230.150.38 -> 172.31.29.138 TCP 2962 [TCP segment of a reassembled PDU]
300   0.062157 172.31.29.138 -> 54.230.150.38 TCP 66 53082 > http [ACK] Seq=98 Ack=2277705 Win=1341952 Len=0 TSval=10507353 TSecr=1453405697
301   0.062951 54.230.150.38 -> 172.31.29.138 TCP 4410 [TCP segment of a reassembled PDU]
302   0.062956 172.31.29.138 -> 54.230.150.38 TCP 66 53082 > http [ACK] Seq=98 Ack=2282049 Win=1379328 Len=0 TSval=10507353 TSecr=1453405697
303   0.063114 54.230.150.38 -> 172.31.29.138 TCP 26130 [TCP segment of a reassembled PDU]
304   0.063135 172.31.29.138 -> 54.230.150.38 TCP 66 53082 > http [ACK] Seq=98 Ack=2308113 Win=1353344 Len=0 TSval=10507353 TSecr=1453405697
305   0.063168 54.230.150.38 -> 172.31.29.138 TCP 26130 [TCP segment of a reassembled PDU]
306   0.063181 172.31.29.138 -> 54.230.150.38 TCP 66 53082 > http [ACK] Seq=98 Ack=2334177 Win=1344768 Len=0 TSval=10507353 TSecr=1453405697
307   0.063204 54.230.150.38 -> 172.31.29.138 TCP 2962 [TCP segment of a reassembled PDU]
308   0.063208 172.31.29.138 -> 54.230.150.38 TCP 66 53082 > http [ACK] Seq=98 Ack=2337073 Win=1379328 Len=0 TSval=10507353 TSecr=1453405697
309   0.063327 54.230.150.38 -> 172.31.29.138 TCP 49298 [TCP segment of a reassembled PDU]
310   0.063344 54.230.150.38 -> 172.31.29.138 TCP 10202 [TCP segment of a reassembled PDU]
311   0.063365 54.230.150.38 -> 172.31.29.138 TCP 11650 [TCP segment of a reassembled PDU]
312   0.063439 172.31.29.138 -> 54.230.150.38 TCP 66 53082 > http [ACK] Seq=98 Ack=2408025 Win=1308416 Len=0 TSval=10507353 TSecr=1453405697
313   0.063474 54.230.150.38 -> 172.31.29.138 TCP 26130 [TCP segment of a reassembled PDU]
314   0.063488 172.31.29.138 -> 54.230.150.38 TCP 66 53082 > http [ACK] Seq=98 Ack=2434089 Win=1282432 Len=0 TSval=10507353 TSecr=1453405697
315   0.063517 54.230.150.38 -> 172.31.29.138 TCP 14546 [TCP segment of a reassembled PDU]
316   0.063528 172.31.29.138 -> 54.230.150.38 TCP 66 53082 > http [ACK] Seq=98 Ack=2448569 Win=1301760 Len=0 TSval=10507353 TSecr=1453405697
317   0.063579 54.230.150.38 -> 172.31.29.138 TCP 24682 [TCP segment of a reassembled PDU]
318   0.063585 172.31.29.138 -> 54.230.150.38 TCP 66 53082 > http [ACK] Seq=98 Ack=2473185 Win=1347200 Len=0 TSval=10507353 TSecr=1453405697
319   0.064555 54.230.150.38 -> 172.31.29.138 TCP 5858 [TCP segment of a reassembled PDU]
320   0.064561 172.31.29.138 -> 54.230.150.38 TCP 66 53082 > http [ACK] Seq=98 Ack=2478977 Win=1378048 Len=0 TSval=10507353 TSecr=1453405697
321   0.064725 54.230.150.38 -> 172.31.29.138 TCP 17442 [TCP segment of a reassembled PDU]
322   0.064743 172.31.29.138 -> 54.230.150.38 TCP 66 53082 > http [ACK] Seq=98 Ack=2496353 Win=1360768 Len=0 TSval=10507353 TSecr=1453405697
323   0.064857 54.230.150.38 -> 172.31.29.138 TCP 34818 [TCP segment of a reassembled PDU]
324   0.064887 54.230.150.38 -> 172.31.29.138 TCP 27578 [TCP segment of a reassembled PDU]
325   0.064905 172.31.29.138 -> 54.230.150.38 TCP 66 53082 > http [ACK] Seq=98 Ack=2558617 Win=1298560 Len=0 TSval=10507353 TSecr=1453405697
326   0.064955 54.230.150.38 -> 172.31.29.138 TCP 24682 [TCP segment of a reassembled PDU]
327   0.064961 172.31.29.138 -> 54.230.150.38 TCP 66 53082 > http [ACK] Seq=98 Ack=2583233 Win=1347200 Len=0 TSval=10507353 TSecr=1453405697
328   0.065014 54.230.150.38 -> 172.31.29.138 TCP 20338 [TCP segment of a reassembled PDU]
329   0.065090 54.230.150.38 -> 172.31.29.138 TCP 17442 [TCP segment of a reassembled PDU]
330   0.065121 54.230.150.38 -> 172.31.29.138 TCP 8754 [TCP segment of a reassembled PDU]
331   0.065177 54.230.150.38 -> 172.31.29.138 TCP 26130 [TCP segment of a reassembled PDU]
332   0.065190 54.230.150.38 -> 172.31.29.138 TCP 13098 [TCP segment of a reassembled PDU]
333   0.065221 172.31.29.138 -> 54.230.150.38 TCP 66 53082 > http [ACK] Seq=98 Ack=2668665 Win=1261824 Len=0 TSval=10507353 TSecr=1453405697
334   0.066211 54.230.150.38 -> 172.31.29.138 TCP 7306 [TCP segment of a reassembled PDU]
335   0.066218 172.31.29.138 -> 54.230.150.38 TCP 66 53082 > http [ACK] Seq=98 Ack=2675905 Win=1375744 Len=0 TSval=10507354 TSecr=1453405697
336   0.066408 54.230.150.38 -> 172.31.29.138 TCP 26130 [TCP segment of a reassembled PDU]
337   0.066416 172.31.29.138 -> 54.230.150.38 TCP 66 53082 > http [ACK] Seq=98 Ack=2701969 Win=1431424 Len=0 TSval=10507354 TSecr=1453405697
338   0.066469 54.230.150.38 -> 172.31.29.138 TCP 26130 [TCP segment of a reassembled PDU]
339   0.066475 172.31.29.138 -> 54.230.150.38 TCP 66 53082 > http [ACK] Seq=98 Ack=2728033 Win=1483520 Len=0 TSval=10507354 TSecr=1453405697
340   0.066488 54.230.150.38 -> 172.31.29.138 TCP 2962 [TCP segment of a reassembled PDU]
341   0.066491 172.31.29.138 -> 54.230.150.38 TCP 66 53082 > http [ACK] Seq=98 Ack=2730929 Win=1489280 Len=0 TSval=10507354 TSecr=1453405697
342   0.066557 54.230.150.38 -> 172.31.29.138 TCP 23234 [TCP segment of a reassembled PDU]
343   0.066563 172.31.29.138 -> 54.230.150.38 TCP 66 53082 > http [ACK] Seq=98 Ack=2754097 Win=1535616 Len=0 TSval=10507354 TSecr=1453405697
344   0.066640 54.230.150.38 -> 172.31.29.138 TCP 36266 [TCP segment of a reassembled PDU]
345   0.066648 172.31.29.138 -> 54.230.150.38 TCP 66 53082 > http [ACK] Seq=98 Ack=2790297 Win=1608064 Len=0 TSval=10507354 TSecr=1453405697
346   0.066676 54.230.150.38 -> 172.31.29.138 TCP 8754 [TCP segment of a reassembled PDU]
347   0.066693 172.31.29.138 -> 54.230.150.38 TCP 66 53082 > http [ACK] Seq=98 Ack=2798985 Win=1608064 Len=0 TSval=10507354 TSecr=1453405697
348   0.066957 54.230.150.38 -> 172.31.29.138 TCP 26130 [TCP segment of a reassembled PDU]
349   0.066965 172.31.29.138 -> 54.230.150.38 TCP 66 53082 > http [ACK] Seq=98 Ack=2825049 Win=1608064 Len=0 TSval=10507354 TSecr=1453405697
350   0.067013 54.230.150.38 -> 172.31.29.138 TCP 26130 [TCP segment of a reassembled PDU]
351   0.067021 172.31.29.138 -> 54.230.150.38 TCP 66 53082 > http [ACK] Seq=98 Ack=2851113 Win=1608064 Len=0 TSval=10507354 TSecr=1453405697
352   0.067053 54.230.150.38 -> 172.31.29.138 TCP 13098 [TCP segment of a reassembled PDU]
353   0.067057 172.31.29.138 -> 54.230.150.38 TCP 66 53082 > http [ACK] Seq=98 Ack=2864145 Win=1608064 Len=0 TSval=10507354 TSecr=1453405697
