[Measurement for 1mb at 17:40:31 19.40.2014] 
Tshark:

  1   0.000000 172.31.29.138 -> 172.31.0.2   DNS 89 Standard query 0x377c  A d1n0gskdvzj94j.cloudfront.net
  2   0.000025 172.31.29.138 -> 172.31.0.2   DNS 89 Standard query 0xe813  AAAA d1n0gskdvzj94j.cloudfront.net
  3   0.000705   172.31.0.2 -> 172.31.29.138 DNS 176 Standard query response 0xe813 
  4   0.000715   172.31.0.2 -> 172.31.29.138 DNS 217 Standard query response 0x377c  A 54.192.159.76 A 54.192.159.157 A 54.230.158.80 A 54.230.158.137 A 54.230.158.179 A 54.230.158.202 A 54.230.158.252 A 54.192.159.72
  5   0.003897 172.31.29.138 -> 54.192.159.76 TCP 74 52653 > http [SYN] Seq=0 Win=26883 Len=0 MSS=8961 SACK_PERM=1 TSval=676159 TSecr=0 WS=128
  6   0.004666 54.192.159.76 -> 172.31.29.138 TCP 74 http > 52653 [SYN, ACK] Seq=0 Ack=1 Win=14480 Len=0 MSS=1460 SACK_PERM=1 TSval=726548956 TSecr=676159 WS=128
  7   0.004679 172.31.29.138 -> 54.192.159.76 TCP 66 52653 > http [ACK] Seq=1 Ack=1 Win=27008 Len=0 TSval=676159 TSecr=726548956
  8   0.004723 172.31.29.138 -> 54.192.159.76 HTTP 162 GET /1mb HTTP/1.1 
  9   0.005441 54.192.159.76 -> 172.31.29.138 TCP 66 http > 52653 [ACK] Seq=1 Ack=97 Win=14592 Len=0 TSval=726548956 TSecr=676159
 10   0.412593 54.192.159.76 -> 172.31.29.138 TCP 13529 [TCP segment of a reassembled PDU]
 11   0.412627 172.31.29.138 -> 54.192.159.76 TCP 66 52653 > http [ACK] Seq=97 Ack=13464 Win=53888 Len=0 TSval=676261 TSecr=726548997
 12   0.589975 54.192.159.76 -> 172.31.29.138 TCP 1526 [TCP segment of a reassembled PDU]
 13   0.590000 172.31.29.138 -> 54.192.159.76 TCP 66 52653 > http [ACK] Seq=97 Ack=14924 Win=56832 Len=0 TSval=676306 TSecr=726549014
 14   0.590030 54.192.159.76 -> 172.31.29.138 TCP 13098 [TCP segment of a reassembled PDU]
 15   0.590039 172.31.29.138 -> 54.192.159.76 TCP 66 52653 > http [ACK] Seq=97 Ack=27956 Win=82816 Len=0 TSval=676306 TSecr=726549014
 16   0.590651 54.192.159.76 -> 172.31.29.138 TCP 4410 [TCP segment of a reassembled PDU]
 17   0.590657 172.31.29.138 -> 54.192.159.76 TCP 66 52653 > http [ACK] Seq=97 Ack=32300 Win=91520 Len=0 TSval=676306 TSecr=726549014
 18   0.590774 54.192.159.76 -> 172.31.29.138 TCP 14546 [TCP segment of a reassembled PDU]
 19   0.590784 172.31.29.138 -> 54.192.159.76 TCP 66 52653 > http [ACK] Seq=97 Ack=46780 Win=94080 Len=0 TSval=676306 TSecr=726549014
 20   0.591375 54.192.159.76 -> 172.31.29.138 TCP 330 [TCP segment of a reassembled PDU]
 21   0.591379 172.31.29.138 -> 54.192.159.76 TCP 66 52653 > http [ACK] Seq=97 Ack=47044 Win=112000 Len=0 TSval=676306 TSecr=726549015
 22   0.768466 54.192.159.76 -> 172.31.29.138 TCP 17586 [TCP segment of a reassembled PDU]
 23   0.768507 172.31.29.138 -> 54.192.159.76 TCP 66 52653 > http [ACK] Seq=97 Ack=64564 Win=146944 Len=0 TSval=676350 TSecr=726549032
 24   0.769201 54.192.159.76 -> 172.31.29.138 TCP 23234 [TCP segment of a reassembled PDU]
 25   0.769215 172.31.29.138 -> 54.192.159.76 TCP 66 52653 > http [ACK] Seq=97 Ack=87732 Win=169216 Len=0 TSval=676350 TSecr=726549032
 26   0.769826 54.192.159.76 -> 172.31.29.138 TCP 258 [TCP segment of a reassembled PDU]
 27   0.769831 172.31.29.138 -> 54.192.159.76 TCP 66 52653 > http [ACK] Seq=97 Ack=87924 Win=196224 Len=0 TSval=676351 TSecr=726549032
 28   0.946126 54.192.159.76 -> 172.31.29.138 TCP 2986 [TCP segment of a reassembled PDU]
 29   0.946145 172.31.29.138 -> 54.192.159.76 TCP 66 52653 > http [ACK] Seq=97 Ack=90844 Win=200064 Len=0 TSval=676395 TSecr=726549050
 30   0.946265 54.192.159.76 -> 172.31.29.138 TCP 2962 [TCP segment of a reassembled PDU]
 31   0.946271 172.31.29.138 -> 54.192.159.76 TCP 66 52653 > http [ACK] Seq=97 Ack=93740 Win=197248 Len=0 TSval=676395 TSecr=726549050
 32   0.946378 54.192.159.76 -> 172.31.29.138 TCP 7306 [TCP segment of a reassembled PDU]
 33   0.946386 172.31.29.138 -> 54.192.159.76 TCP 66 52653 > http [ACK] Seq=97 Ack=100980 Win=195328 Len=0 TSval=676395 TSecr=726549050
 34   0.946395 54.192.159.76 -> 172.31.29.138 TCP 5990 [TCP segment of a reassembled PDU]
 35   0.946399 172.31.29.138 -> 54.192.159.76 TCP 66 52653 > http [ACK] Seq=97 Ack=106904 Win=189440 Len=0 TSval=676395 TSecr=726549050
 36   0.946837 54.192.159.76 -> 172.31.29.138 TCP 2962 [TCP segment of a reassembled PDU]
 37   0.946843 172.31.29.138 -> 54.192.159.76 TCP 66 52653 > http [ACK] Seq=97 Ack=109800 Win=202496 Len=0 TSval=676395 TSecr=726549050
 38   0.946864 54.192.159.76 -> 172.31.29.138 TCP 5858 [TCP segment of a reassembled PDU]
 39   0.946868 172.31.29.138 -> 54.192.159.76 TCP 66 52653 > http [ACK] Seq=97 Ack=115592 Win=196736 Len=0 TSval=676395 TSecr=726549050
 40   0.947091 54.192.159.76 -> 172.31.29.138 TCP 13098 [TCP segment of a reassembled PDU]
 41   0.947100 172.31.29.138 -> 54.192.159.76 TCP 66 52653 > http [ACK] Seq=97 Ack=128624 Win=185856 Len=0 TSval=676395 TSecr=726549050
 42   0.947546 54.192.159.76 -> 172.31.29.138 TCP 2962 [TCP segment of a reassembled PDU]
 43   0.947551 172.31.29.138 -> 54.192.159.76 TCP 66 52653 > http [ACK] Seq=97 Ack=131520 Win=202496 Len=0 TSval=676395 TSecr=726549050
 44   0.947689 54.192.159.76 -> 172.31.29.138 TCP 14546 [TCP segment of a reassembled PDU]
 45   0.947698 172.31.29.138 -> 54.192.159.76 TCP 66 52653 > http [ACK] Seq=97 Ack=146000 Win=188032 Len=0 TSval=676395 TSecr=726549050
 46   0.947845 54.192.159.76 -> 172.31.29.138 TCP 6230 [TCP segment of a reassembled PDU]
 47   0.947852 172.31.29.138 -> 54.192.159.76 TCP 66 52653 > http [ACK] Seq=97 Ack=152164 Win=195328 Len=0 TSval=676395 TSecr=726549050
 48   1.124482 54.192.159.76 -> 172.31.29.138 TCP 1526 [TCP segment of a reassembled PDU]
 49   1.124502 172.31.29.138 -> 54.192.159.76 TCP 66 52653 > http [ACK] Seq=97 Ack=153624 Win=202496 Len=0 TSval=676439 TSecr=726549068
 50   1.124818 54.192.159.76 -> 172.31.29.138 TCP 4410 [TCP segment of a reassembled PDU]
 51   1.124824 172.31.29.138 -> 54.192.159.76 TCP 66 52653 > http [ACK] Seq=97 Ack=157968 Win=216576 Len=0 TSval=676439 TSecr=726549068
 52   1.124898 54.192.159.76 -> 172.31.29.138 TCP 1538 [TCP segment of a reassembled PDU]
 53   1.124902 172.31.29.138 -> 54.192.159.76 TCP 66 52653 > http [ACK] Seq=97 Ack=159440 Win=219520 Len=0 TSval=676439 TSecr=726549068
 54   1.125010 54.192.159.76 -> 172.31.29.138 TCP 26130 [TCP segment of a reassembled PDU]
 55   1.125023 172.31.29.138 -> 54.192.159.76 TCP 66 52653 > http [ACK] Seq=97 Ack=185504 Win=271616 Len=0 TSval=676439 TSecr=726549068
 56   1.125507 54.192.159.76 -> 172.31.29.138 TCP 4410 [TCP segment of a reassembled PDU]
 57   1.125513 172.31.29.138 -> 54.192.159.76 TCP 66 52653 > http [ACK] Seq=97 Ack=189848 Win=280320 Len=0 TSval=676439 TSecr=726549068
 58   1.125668 54.192.159.76 -> 172.31.29.138 TCP 26130 [TCP segment of a reassembled PDU]
