[Measurement for 1mb at 07:38:19 20.38.2014] 
Tshark:

  1   0.000000 172.31.29.138 -> 172.31.0.2   DNS 89 Standard query 0x2f11  A d1n0gskdvzj94j.cloudfront.net
  2   0.000028 172.31.29.138 -> 172.31.0.2   DNS 89 Standard query 0x5519  AAAA d1n0gskdvzj94j.cloudfront.net
  3   0.000663   172.31.0.2 -> 172.31.29.138 DNS 217 Standard query response 0x2f11  A 54.230.151.234 A 204.246.164.163 A 54.230.148.75 A 54.230.150.15 A 54.230.150.43 A 54.230.150.80 A 54.230.150.114 A 54.230.151.150
  4   0.000673   172.31.0.2 -> 172.31.29.138 DNS 176 Standard query response 0x5519 
  5   0.003917 172.31.29.138 -> 54.230.151.234 TCP 74 55001 > http [SYN] Seq=0 Win=26883 Len=0 MSS=8961 SACK_PERM=1 TSval=13242981 TSecr=0 WS=128
  6   0.005434 54.230.151.234 -> 172.31.29.138 TCP 74 http > 55001 [SYN, ACK] Seq=0 Ack=1 Win=14480 Len=0 MSS=1460 SACK_PERM=1 TSval=445295057 TSecr=13242981 WS=128
  7   0.005449 172.31.29.138 -> 54.230.151.234 TCP 66 55001 > http [ACK] Seq=1 Ack=1 Win=27008 Len=0 TSval=13242981 TSecr=445295057
  8   0.005491 172.31.29.138 -> 54.230.151.234 HTTP 162 GET /1mb HTTP/1.1 
  9   0.006986 54.230.151.234 -> 172.31.29.138 TCP 66 http > 55001 [ACK] Seq=1 Ack=97 Win=14592 Len=0 TSval=445295058 TSecr=13242981
 10   0.009338 54.230.151.234 -> 172.31.29.138 TCP 2962 [TCP segment of a reassembled PDU]
 11   0.009346 172.31.29.138 -> 54.230.151.234 TCP 66 55001 > http [ACK] Seq=97 Ack=2897 Win=32768 Len=0 TSval=13242982 TSecr=445295058
 12   0.009434 54.230.151.234 -> 172.31.29.138 TCP 10202 [TCP segment of a reassembled PDU]
 13   0.009444 172.31.29.138 -> 54.230.151.234 TCP 66 55001 > http [ACK] Seq=97 Ack=13033 Win=52992 Len=0 TSval=13242982 TSecr=445295058
 14   0.010918 54.230.151.234 -> 172.31.29.138 TCP 11650 [TCP segment of a reassembled PDU]
 15   0.010927 172.31.29.138 -> 54.230.151.234 TCP 66 55001 > http [ACK] Seq=97 Ack=24617 Win=76160 Len=0 TSval=13242983 TSecr=445295058
 16   0.010946 54.230.151.234 -> 172.31.29.138 TCP 1514 [TCP segment of a reassembled PDU]
 17   0.010950 172.31.29.138 -> 54.230.151.234 TCP 66 55001 > http [ACK] Seq=97 Ack=26065 Win=79104 Len=0 TSval=13242983 TSecr=445295058
 18   0.012194 54.230.151.234 -> 172.31.29.138 TCP 4410 [TCP segment of a reassembled PDU]
 19   0.012200 172.31.29.138 -> 54.230.151.234 TCP 66 55001 > http [ACK] Seq=97 Ack=30409 Win=87808 Len=0 TSval=13242983 TSecr=445295058
 20   0.012288 54.230.151.234 -> 172.31.29.138 TCP 15994 [TCP segment of a reassembled PDU]
 21   0.012298 172.31.29.138 -> 54.230.151.234 TCP 66 55001 > http [ACK] Seq=97 Ack=46337 Win=91648 Len=0 TSval=13242983 TSecr=445295058
 22   0.013479 54.230.151.234 -> 172.31.29.138 TCP 5858 [TCP segment of a reassembled PDU]
 23   0.013486 172.31.29.138 -> 54.230.151.234 TCP 66 55001 > http [ACK] Seq=97 Ack=52129 Win=108416 Len=0 TSval=13242983 TSecr=445295058
 24   0.013766 54.230.151.234 -> 172.31.29.138 TCP 10202 [TCP segment of a reassembled PDU]
 25   0.013776 172.31.29.138 -> 54.230.151.234 TCP 66 55001 > http [ACK] Seq=97 Ack=62265 Win=101248 Len=0 TSval=13242984 TSecr=445295058
 26   0.013809 54.230.151.234 -> 172.31.29.138 TCP 2962 [TCP segment of a reassembled PDU]
 27   0.013815 172.31.29.138 -> 54.230.151.234 TCP 66 55001 > http [ACK] Seq=97 Ack=65161 Win=114816 Len=0 TSval=13242984 TSecr=445295058
 28   0.014806 54.230.151.234 -> 172.31.29.138 TCP 11650 [TCP segment of a reassembled PDU]
 29   0.014815 172.31.29.138 -> 54.230.151.234 TCP 66 55001 > http [ACK] Seq=97 Ack=76745 Win=137984 Len=0 TSval=13242984 TSecr=445295058
 30   0.015048 54.230.151.234 -> 172.31.29.138 TCP 11650 [TCP segment of a reassembled PDU]
 31   0.015056 172.31.29.138 -> 54.230.151.234 TCP 66 55001 > http [ACK] Seq=97 Ack=88329 Win=161152 Len=0 TSval=13242984 TSecr=445295058
 32   0.016394 54.230.151.234 -> 172.31.29.138 TCP 26130 [TCP segment of a reassembled PDU]
 33   0.016409 172.31.29.138 -> 54.230.151.234 TCP 66 55001 > http [ACK] Seq=97 Ack=114393 Win=213376 Len=0 TSval=13242984 TSecr=445295059
 34   0.016417 54.230.151.234 -> 172.31.29.138 TCP 4410 [TCP segment of a reassembled PDU]
 35   0.016421 172.31.29.138 -> 54.230.151.234 TCP 66 55001 > http [ACK] Seq=97 Ack=118737 Win=221952 Len=0 TSval=13242984 TSecr=445295059
 36   0.017841 54.230.151.234 -> 172.31.29.138 TCP 11650 [TCP segment of a reassembled PDU]
 37   0.017851 172.31.29.138 -> 54.230.151.234 TCP 66 55001 > http [ACK] Seq=97 Ack=130321 Win=245120 Len=0 TSval=13242985 TSecr=445295059
 38   0.017906 54.230.151.234 -> 172.31.29.138 TCP 15994 [TCP segment of a reassembled PDU]
 39   0.017914 172.31.29.138 -> 54.230.151.234 TCP 66 55001 > http [ACK] Seq=97 Ack=146249 Win=276992 Len=0 TSval=13242985 TSecr=445295059
 40   0.019213 54.230.151.234 -> 172.31.29.138 TCP 18890 [TCP segment of a reassembled PDU]
 41   0.019225 172.31.29.138 -> 54.230.151.234 TCP 66 55001 > http [ACK] Seq=97 Ack=165073 Win=314624 Len=0 TSval=13242985 TSecr=445295059
 42   0.019341 54.230.151.234 -> 172.31.29.138 TCP 17442 [TCP segment of a reassembled PDU]
 43   0.019352 172.31.29.138 -> 54.230.151.234 TCP 66 55001 > http [ACK] Seq=97 Ack=182449 Win=349440 Len=0 TSval=13242985 TSecr=445295059
 44   0.020732 54.230.151.234 -> 172.31.29.138 TCP 26130 [TCP segment of a reassembled PDU]
 45   0.020748 172.31.29.138 -> 54.230.151.234 TCP 66 55001 > http [ACK] Seq=97 Ack=208513 Win=401536 Len=0 TSval=13242985 TSecr=445295059
 46   0.020763 54.230.151.234 -> 172.31.29.138 TCP 13098 [TCP segment of a reassembled PDU]
 47   0.020770 172.31.29.138 -> 54.230.151.234 TCP 66 55001 > http [ACK] Seq=97 Ack=221545 Win=427648 Len=0 TSval=13242985 TSecr=445295059
 48   0.022283 54.230.151.234 -> 172.31.29.138 TCP 23234 [TCP segment of a reassembled PDU]
 49   0.022298 172.31.29.138 -> 54.230.151.234 TCP 66 55001 > http [ACK] Seq=97 Ack=244713 Win=473984 Len=0 TSval=13242986 TSecr=445295059
 50   0.022326 54.230.151.234 -> 172.31.29.138 TCP 2962 [TCP segment of a reassembled PDU]
 51   0.022346 172.31.29.138 -> 54.230.151.234 TCP 66 55001 > http [ACK] Seq=97 Ack=247609 Win=479744 Len=0 TSval=13242986 TSecr=445295059
 52   0.022411 54.230.151.234 -> 172.31.29.138 TCP 14546 [TCP segment of a reassembled PDU]
 53   0.022420 172.31.29.138 -> 54.230.151.234 TCP 66 55001 > http [ACK] Seq=97 Ack=262089 Win=508672 Len=0 TSval=13242986 TSecr=445295059
 54   0.023758 54.230.151.234 -> 172.31.29.138 TCP 8754 [TCP segment of a reassembled PDU]
 55   0.023767 172.31.29.138 -> 54.230.151.234 TCP 66 55001 > http [ACK] Seq=97 Ack=270777 Win=526080 Len=0 TSval=13242986 TSecr=445295059
 56   0.023955 54.230.151.234 -> 172.31.29.138 TCP 26130 [TCP segment of a reassembled PDU]
 57   0.023970 172.31.29.138 -> 54.230.151.234 TCP 66 55001 > http [ACK] Seq=97 Ack=296841 Win=578176 Len=0 TSval=13242986 TSecr=445295059
 58   0.023979 54.230.151.234 -> 172.31.29.138 TCP 2962 [TCP segment of a reassembled PDU]
 59   0.023982 172.31.29.138 -> 54.230.151.234 TCP 66 55001 > http [ACK] Seq=97 Ack=299737 Win=584064 Len=0 TSval=13242986 TSecr=445295059
 60   0.023988 54.230.151.234 -> 172.31.29.138 TCP 7306 [TCP segment of a reassembled PDU]
 61   0.023993 172.31.29.138 -> 54.230.151.234 TCP 66 55001 > http [ACK] Seq=97 Ack=306977 Win=598528 Len=0 TSval=13242986 TSecr=445295059
 62   0.025579 54.230.151.234 -> 172.31.29.138 TCP 26130 [TCP segment of a reassembled PDU]
 63   0.025593 172.31.29.138 -> 54.230.151.234 TCP 66 55001 > http [ACK] Seq=97 Ack=333041 Win=650624 Len=0 TSval=13242986 TSecr=445295059
 64   0.025607 54.230.151.234 -> 172.31.29.138 TCP 10202 [TCP segment of a reassembled PDU]
 65   0.025615 172.31.29.138 -> 54.230.151.234 TCP 66 55001 > http [ACK] Seq=97 Ack=343177 Win=661376 Len=0 TSval=13242986 TSecr=445295059
 66   0.025620 54.230.151.234 -> 172.31.29.138 TCP 1514 [TCP segment of a reassembled PDU]
 67   0.025623 172.31.29.138 -> 54.230.151.234 TCP 66 55001 > http [ACK] Seq=97 Ack=344625 Win=659968 Len=0 TSval=13242986 TSecr=445295059
 68   0.027336 54.230.151.234 -> 172.31.29.138 TCP 17442 [TCP segment of a reassembled PDU]
 69   0.027349 172.31.29.138 -> 54.230.151.234 TCP 66 55001 > http [ACK] Seq=97 Ack=362001 Win=692224 Len=0 TSval=13242987 TSecr=445295060
 70   0.027514 54.230.151.234 -> 172.31.29.138 TCP 21786 [TCP segment of a reassembled PDU]
 71   0.027527 172.31.29.138 -> 54.230.151.234 TCP 66 55001 > http [ACK] Seq=97 Ack=383721 Win=685184 Len=0 TSval=13242987 TSecr=445295060
 72   0.028875 54.230.151.234 -> 172.31.29.138 TCP 18890 [TCP segment of a reassembled PDU]
 73   0.028887 172.31.29.138 -> 54.230.151.234 TCP 66 55001 > http [ACK] Seq=97 Ack=402545 Win=689920 Len=0 TSval=13242987 TSecr=445295060
 74   0.029008 54.230.151.234 -> 172.31.29.138 TCP 26130 [TCP segment of a reassembled PDU]
 75   0.029022 172.31.29.138 -> 54.230.151.234 TCP 66 55001 > http [ACK] Seq=97 Ack=428609 Win=678016 Len=0 TSval=13242987 TSecr=445295060
 76   0.029049 54.230.151.234 -> 172.31.29.138 TCP 13098 [TCP segment of a reassembled PDU]
 77   0.029058 172.31.29.138 -> 54.230.151.234 TCP 66 55001 > http [ACK] Seq=97 Ack=441641 Win=665088 Len=0 TSval=13242987 TSecr=445295060
 78   0.030116 54.230.151.234 -> 172.31.29.138 TCP 5858 [TCP segment of a reassembled PDU]
 79   0.030125 172.31.29.138 -> 54.230.151.234 TCP 66 55001 > http [ACK] Seq=97 Ack=447433 Win=711296 Len=0 TSval=13242988 TSecr=445295060
 80   0.030215 54.230.151.234 -> 172.31.29.138 TCP 1514 [TCP segment of a reassembled PDU]
 81   0.030356 54.230.151.234 -> 172.31.29.138 TCP 5858 [TCP segment of a reassembled PDU]
 82   0.030364 172.31.29.138 -> 54.230.151.234 TCP 66 55001 > http [ACK] Seq=97 Ack=454673 Win=711296 Len=0 TSval=13242988 TSecr=445295060
 83   0.030530 54.230.151.234 -> 172.31.29.138 TCP 26130 [TCP segment of a reassembled PDU]
 84   0.030550 54.230.151.234 -> 172.31.29.138 TCP 8754 [TCP segment of a reassembled PDU]
 85   0.030568 172.31.29.138 -> 54.230.151.234 TCP 66 55001 > http [ACK] Seq=97 Ack=489425 Win=676608 Len=0 TSval=13242988 TSecr=445295060
 86   0.031638 54.230.151.234 -> 172.31.29.138 TCP 4410 [TCP segment of a reassembled PDU]
 87   0.031644 172.31.29.138 -> 54.230.151.234 TCP 66 55001 > http [ACK] Seq=97 Ack=493769 Win=713728 Len=0 TSval=13242988 TSecr=445295060
 88   0.031795 54.230.151.234 -> 172.31.29.138 TCP 17442 [TCP segment of a reassembled PDU]
 89   0.031865 172.31.29.138 -> 54.230.151.234 TCP 66 55001 > http [ACK] Seq=97 Ack=511145 Win=696448 Len=0 TSval=13242988 TSecr=445295060
 90   0.032052 54.230.151.234 -> 172.31.29.138 TCP 26130 [TCP segment of a reassembled PDU]
 91   0.032079 172.31.29.138 -> 54.230.151.234 TCP 66 55001 > http [ACK] Seq=97 Ack=537209 Win=678016 Len=0 TSval=13242988 TSecr=445295060
 92   0.032109 54.230.151.234 -> 172.31.29.138 TCP 18890 [TCP segment of a reassembled PDU]
 93   0.032122 172.31.29.138 -> 54.230.151.234 TCP 66 55001 > http [ACK] Seq=97 Ack=556033 Win=689920 Len=0 TSval=13242988 TSecr=445295060
 94   0.033203 54.230.151.234 -> 172.31.29.138 TCP 8754 [TCP segment of a reassembled PDU]
 95   0.033212 172.31.29.138 -> 54.230.151.234 TCP 66 55001 > http [ACK] Seq=97 Ack=564721 Win=706560 Len=0 TSval=13242988 TSecr=445295060
 96   0.033322 54.230.151.234 -> 172.31.29.138 TCP 14546 [TCP segment of a reassembled PDU]
 97   0.033346 172.31.29.138 -> 54.230.151.234 TCP 66 55001 > http [ACK] Seq=97 Ack=579201 Win=716800 Len=0 TSval=13242988 TSecr=445295060
 98   0.033425 54.230.151.234 -> 172.31.29.138 TCP 5858 [TCP segment of a reassembled PDU]
 99   0.033443 172.31.29.138 -> 54.230.151.234 TCP 66 55001 > http [ACK] Seq=97 Ack=584993 Win=716800 Len=0 TSval=13242988 TSecr=445295060
100   0.033646 54.230.151.234 -> 172.31.29.138 TCP 23234 [TCP segment of a reassembled PDU]
101   0.033676 172.31.29.138 -> 54.230.151.234 TCP 66 55001 > http [ACK] Seq=97 Ack=608161 Win=693632 Len=0 TSval=13242988 TSecr=445295060
102   0.034815 54.230.151.234 -> 172.31.29.138 TCP 18890 [TCP segment of a reassembled PDU]
103   0.034850 54.230.151.234 -> 172.31.29.138 TCP 7306 [TCP segment of a reassembled PDU]
104   0.034859 172.31.29.138 -> 54.230.151.234 TCP 66 55001 > http [ACK] Seq=97 Ack=626985 Win=716800 Len=0 TSval=13242989 TSecr=445295060
105   0.034874 54.230.151.234 -> 172.31.29.138 TCP 10202 [TCP segment of a reassembled PDU]
106   0.034894 172.31.29.138 -> 54.230.151.234 TCP 66 55001 > http [ACK] Seq=97 Ack=644361 Win=716800 Len=0 TSval=13242989 TSecr=445295060
107   0.035332 54.230.151.234 -> 172.31.29.138 TCP 26130 [TCP segment of a reassembled PDU]
108   0.035386 54.230.151.234 -> 172.31.29.138 TCP 15994 [TCP segment of a reassembled PDU]
109   0.035399 172.31.29.138 -> 54.230.151.234 TCP 66 55001 > http [ACK] Seq=97 Ack=686353 Win=678784 Len=0 TSval=13242989 TSecr=445295060
110   0.036318 54.230.151.234 -> 172.31.29.138 TCP 23234 [TCP segment of a reassembled PDU]
111   0.036345 172.31.29.138 -> 54.230.151.234 TCP 66 55001 > http [ACK] Seq=97 Ack=709521 Win=709760 Len=0 TSval=13242989 TSecr=445295061
112   0.036833 54.230.151.234 -> 172.31.29.138 TCP 5858 [TCP segment of a reassembled PDU]
113   0.036839 172.31.29.138 -> 54.230.151.234 TCP 66 55001 > http [ACK] Seq=97 Ack=715313 Win=728448 Len=0 TSval=13242989 TSecr=445295061
114   0.037024 54.230.151.234 -> 172.31.29.138 TCP 26130 [TCP segment of a reassembled PDU]
115   0.037051 172.31.29.138 -> 54.230.151.234 TCP 66 55001 > http [ACK] Seq=97 Ack=741377 Win=705024 Len=0 TSval=13242989 TSecr=445295061
116   0.037111 54.230.151.234 -> 172.31.29.138 TCP 26130 [TCP segment of a reassembled PDU]
117   0.037125 172.31.29.138 -> 54.230.151.234 TCP 66 55001 > http [ACK] Seq=97 Ack=767441 Win=705024 Len=0 TSval=13242989 TSecr=445295061
118   0.037139 54.230.151.234 -> 172.31.29.138 TCP 1514 [TCP segment of a reassembled PDU]
119   0.037865 54.230.151.234 -> 172.31.29.138 TCP 5858 [TCP segment of a reassembled PDU]
120   0.037874 172.31.29.138 -> 54.230.151.234 TCP 66 55001 > http [ACK] Seq=97 Ack=774681 Win=738304 Len=0 TSval=13242990 TSecr=445295061
121   0.038617 54.230.151.234 -> 172.31.29.138 TCP 7306 [TCP segment of a reassembled PDU]
122   0.038641 172.31.29.138 -> 54.230.151.234 TCP 66 55001 > http [ACK] Seq=97 Ack=781921 Win=739968 Len=0 TSval=13242990 TSecr=445295061
123   0.038823 54.230.151.234 -> 172.31.29.138 TCP 21786 [TCP segment of a reassembled PDU]
124   0.038860 172.31.29.138 -> 54.230.151.234 TCP 66 55001 > http [ACK] Seq=97 Ack=803641 Win=718336 Len=0 TSval=13242990 TSecr=445295061
125   0.038900 54.230.151.234 -> 172.31.29.138 TCP 4410 [TCP segment of a reassembled PDU]
126   0.038906 172.31.29.138 -> 54.230.151.234 TCP 66 55001 > http [ACK] Seq=97 Ack=807985 Win=740736 Len=0 TSval=13242990 TSecr=445295061
127   0.039005 54.230.151.234 -> 172.31.29.138 TCP 31922 [TCP segment of a reassembled PDU]
128   0.039035 172.31.29.138 -> 54.230.151.234 TCP 66 55001 > http [ACK] Seq=97 Ack=839841 Win=708992 Len=0 TSval=13242990 TSecr=445295061
129   0.040155 54.230.151.234 -> 172.31.29.138 TCP 5858 [TCP segment of a reassembled PDU]
130   0.040162 172.31.29.138 -> 54.230.151.234 TCP 66 55001 > http [ACK] Seq=97 Ack=845633 Win=738304 Len=0 TSval=13242990 TSecr=445295061
131   0.040314 54.230.151.234 -> 172.31.29.138 TCP 20338 [TCP segment of a reassembled PDU]
132   0.040341 54.230.151.234 -> 172.31.29.138 TCP 7306 [TCP segment of a reassembled PDU]
133   0.040375 54.230.151.234 -> 172.31.29.138 TCP 1514 [TCP segment of a reassembled PDU]
134   0.040403 172.31.29.138 -> 54.230.151.234 TCP 66 55001 > http [ACK] Seq=97 Ack=874593 Win=709376 Len=0 TSval=13242990 TSecr=445295061
135   0.040566 54.230.151.234 -> 172.31.29.138 TCP 29026 [TCP segment of a reassembled PDU]
136   0.040581 54.230.151.234 -> 172.31.29.138 TCP 1514 [TCP segment of a reassembled PDU]
137   0.040596 172.31.29.138 -> 54.230.151.234 TCP 66 55001 > http [ACK] Seq=97 Ack=905001 Win=697728 Len=0 TSval=13242990 TSecr=445295061
138   0.041762 54.230.151.234 -> 172.31.29.138 TCP 11650 [TCP segment of a reassembled PDU]
139   0.041771 172.31.29.138 -> 54.230.151.234 TCP 66 55001 > http [ACK] Seq=97 Ack=916585 Win=728832 Len=0 TSval=13242991 TSecr=445295061
140   0.041881 54.230.151.234 -> 172.31.29.138 TCP 26130 [TCP segment of a reassembled PDU]
141   0.041908 172.31.29.138 -> 54.230.151.234 TCP 66 55001 > http [ACK] Seq=97 Ack=942649 Win=705024 Len=0 TSval=13242991 TSecr=445295061
142   0.041949 54.230.151.234 -> 172.31.29.138 TCP 27578 [TCP segment of a reassembled PDU]
143   0.041975 172.31.29.138 -> 54.230.151.234 TCP 66 55001 > http [ACK] Seq=97 Ack=970161 Win=702592 Len=0 TSval=13242991 TSecr=445295061
144   0.042223 54.230.151.234 -> 172.31.29.138 TCP 8754 [TCP segment of a reassembled PDU]
145   0.042231 172.31.29.138 -> 54.230.151.234 TCP 66 55001 > http [ACK] Seq=97 Ack=978849 Win=733568 Len=0 TSval=13242991 TSecr=445295061
146   0.042395 54.230.151.234 -> 172.31.29.138 TCP 26130 [TCP segment of a reassembled PDU]
147   0.042421 172.31.29.138 -> 54.230.151.234 TCP 66 55001 > http [ACK] Seq=97 Ack=1004913 Win=707584 Len=0 TSval=13242991 TSecr=445295061
148   0.043243 54.230.151.234 -> 172.31.29.138 TCP 7306 [TCP segment of a reassembled PDU]
149   0.043250 172.31.29.138 -> 54.230.151.234 TCP 66 55001 > http [ACK] Seq=97 Ack=1012153 Win=736000 Len=0 TSval=13242991 TSecr=445295061
150   0.043402 54.230.151.234 -> 172.31.29.138 TCP 20338 [TCP segment of a reassembled PDU]
151   0.043425 54.230.151.234 -> 172.31.29.138 TCP 2962 [TCP segment of a reassembled PDU]
152   0.043435 172.31.29.138 -> 54.230.151.234 TCP 66 55001 > http [ACK] Seq=97 Ack=1035321 Win=712832 Len=0 TSval=13242991 TSecr=445295061
153   0.043616 54.230.151.234 -> 172.31.29.138 HTTP 13779 HTTP/1.1 200 OK  (application/octet-stream)
154   0.043624 172.31.29.138 -> 54.230.151.234 TCP 66 55001 > http [ACK] Seq=97 Ack=1049034 Win=723968 Len=0 TSval=13242991 TSecr=445295061
155   0.043785 172.31.29.138 -> 54.230.151.234 TCP 66 55001 > http [FIN, ACK] Seq=97 Ack=1049034 Win=746112 Len=0 TSval=13242991 TSecr=445295061
156   0.044989 54.230.151.234 -> 172.31.29.138 TCP 66 http > 55001 [FIN, ACK] Seq=1049034 Ack=98 Win=14592 Len=0 TSval=445295061 TSecr=13242991
157   0.044999 172.31.29.138 -> 54.230.151.234 TCP 66 55001 > http [ACK] Seq=98 Ack=1049035 Win=746112 Len=0 TSval=13242991 TSecr=445295061
