[Measurement for 1mb at 03:38:19 20.38.2014] 
Tshark:

  1   0.000000 06:38:16:87:8c:c2 -> 06:4e:73:56:a6:a6 ARP 60 Who has 172.31.29.138?  Tell 172.31.16.1
  2   0.000022 06:4e:73:56:a6:a6 -> 06:38:16:87:8c:c2 ARP 42 172.31.29.138 is at 06:4e:73:56:a6:a6
  3   1.731817 172.31.29.138 -> 172.31.0.2   DNS 89 Standard query 0xe39d  A d1n0gskdvzj94j.cloudfront.net
  4   1.731845 172.31.29.138 -> 172.31.0.2   DNS 89 Standard query 0x593c  AAAA d1n0gskdvzj94j.cloudfront.net
  5   1.732387   172.31.0.2 -> 172.31.29.138 DNS 176 Standard query response 0x593c 
  6   1.732399   172.31.0.2 -> 172.31.29.138 DNS 217 Standard query response 0xe39d  A 54.230.150.52 A 54.230.150.69 A 54.230.148.75 A 54.230.149.156 A 54.230.149.226 A 54.230.150.30 A 54.230.150.38 A 54.230.150.40
  7   1.735687 172.31.29.138 -> 54.230.150.52 TCP 74 44166 > http [SYN] Seq=0 Win=26883 Len=0 MSS=8961 SACK_PERM=1 TSval=9642973 TSecr=0 WS=128
  8   1.736970 54.230.150.52 -> 172.31.29.138 TCP 74 http > 44166 [SYN, ACK] Seq=0 Ack=1 Win=14480 Len=0 MSS=1460 SACK_PERM=1 TSval=435232748 TSecr=9642973 WS=128
  9   1.736995 172.31.29.138 -> 54.230.150.52 TCP 66 44166 > http [ACK] Seq=1 Ack=1 Win=27008 Len=0 TSval=9642973 TSecr=435232748
 10   1.737037 172.31.29.138 -> 54.230.150.52 HTTP 162 GET /1mb HTTP/1.1 
 11   1.738254 54.230.150.52 -> 172.31.29.138 TCP 66 http > 44166 [ACK] Seq=1 Ack=97 Win=14592 Len=0 TSval=435232748 TSecr=9642973
 12   1.742725 54.230.150.52 -> 172.31.29.138 TCP 10202 [TCP segment of a reassembled PDU]
 13   1.742737 172.31.29.138 -> 54.230.150.52 TCP 66 44166 > http [ACK] Seq=97 Ack=10137 Win=47232 Len=0 TSval=9642974 TSecr=435232748
 14   1.742759 54.230.150.52 -> 172.31.29.138 TCP 4410 [TCP segment of a reassembled PDU]
 15   1.742764 172.31.29.138 -> 54.230.150.52 TCP 66 44166 > http [ACK] Seq=97 Ack=14481 Win=55936 Len=0 TSval=9642974 TSecr=435232748
 16   1.744215 54.230.150.52 -> 172.31.29.138 TCP 2962 [TCP segment of a reassembled PDU]
 17   1.744221 172.31.29.138 -> 54.230.150.52 TCP 66 44166 > http [ACK] Seq=97 Ack=17377 Win=61696 Len=0 TSval=9642975 TSecr=435232749
 18   1.744309 54.230.150.52 -> 172.31.29.138 TCP 10202 [TCP segment of a reassembled PDU]
 19   1.744318 172.31.29.138 -> 54.230.150.52 TCP 66 44166 > http [ACK] Seq=97 Ack=27513 Win=81920 Len=0 TSval=9642975 TSecr=435232749
 20   1.745637 54.230.150.52 -> 172.31.29.138 TCP 8754 [TCP segment of a reassembled PDU]
 21   1.745645 172.31.29.138 -> 54.230.150.52 TCP 66 44166 > http [ACK] Seq=97 Ack=36201 Win=99328 Len=0 TSval=9642975 TSecr=435232749
 22   1.745727 54.230.150.52 -> 172.31.29.138 TCP 2962 [TCP segment of a reassembled PDU]
 23   1.745732 172.31.29.138 -> 54.230.150.52 TCP 66 44166 > http [ACK] Seq=97 Ack=39097 Win=105088 Len=0 TSval=9642975 TSecr=435232749
 24   1.745793 54.230.150.52 -> 172.31.29.138 TCP 1514 [TCP segment of a reassembled PDU]
 25   1.745797 172.31.29.138 -> 54.230.150.52 TCP 66 44166 > http [ACK] Seq=97 Ack=40545 Win=108032 Len=0 TSval=9642975 TSecr=435232749
 26   1.745839 54.230.150.52 -> 172.31.29.138 TCP 7306 [TCP segment of a reassembled PDU]
 27   1.745846 172.31.29.138 -> 54.230.150.52 TCP 66 44166 > http [ACK] Seq=97 Ack=47785 Win=105984 Len=0 TSval=9642975 TSecr=435232749
 28   1.747038 54.230.150.52 -> 172.31.29.138 TCP 5858 [TCP segment of a reassembled PDU]
 29   1.747044 172.31.29.138 -> 54.230.150.52 TCP 66 44166 > http [ACK] Seq=97 Ack=53577 Win=108416 Len=0 TSval=9642976 TSecr=435232749
 30   1.747121 54.230.150.52 -> 172.31.29.138 TCP 8754 [TCP segment of a reassembled PDU]
 31   1.747128 172.31.29.138 -> 54.230.150.52 TCP 66 44166 > http [ACK] Seq=97 Ack=62265 Win=126464 Len=0 TSval=9642976 TSecr=435232749
 32   1.747355 54.230.150.52 -> 172.31.29.138 TCP 11650 [TCP segment of a reassembled PDU]
 33   1.747362 172.31.29.138 -> 54.230.150.52 TCP 66 44166 > http [ACK] Seq=97 Ack=73849 Win=149632 Len=0 TSval=9642976 TSecr=435232749
 34   1.748560 54.230.150.52 -> 172.31.29.138 TCP 1514 [TCP segment of a reassembled PDU]
 35   1.748564 172.31.29.138 -> 54.230.150.52 TCP 66 44166 > http [ACK] Seq=97 Ack=75297 Win=152448 Len=0 TSval=9642976 TSecr=435232749
 36   1.748703 54.230.150.52 -> 172.31.29.138 TCP 15994 [TCP segment of a reassembled PDU]
 37   1.748713 172.31.29.138 -> 54.230.150.52 TCP 66 44166 > http [ACK] Seq=97 Ack=91225 Win=184320 Len=0 TSval=9642976 TSecr=435232749
 38   1.748825 54.230.150.52 -> 172.31.29.138 TCP 1514 [TCP segment of a reassembled PDU]
 39   1.748829 172.31.29.138 -> 54.230.150.52 TCP 66 44166 > http [ACK] Seq=97 Ack=92673 Win=187264 Len=0 TSval=9642976 TSecr=435232749
 40   1.748933 54.230.150.52 -> 172.31.29.138 TCP 11650 [TCP segment of a reassembled PDU]
 41   1.748941 172.31.29.138 -> 54.230.150.52 TCP 66 44166 > http [ACK] Seq=97 Ack=104257 Win=210432 Len=0 TSval=9642976 TSecr=435232749
 42   1.750105 54.230.150.52 -> 172.31.29.138 TCP 2962 [TCP segment of a reassembled PDU]
 43   1.750110 172.31.29.138 -> 54.230.150.52 TCP 66 44166 > http [ACK] Seq=97 Ack=107153 Win=216192 Len=0 TSval=9642976 TSecr=435232749
 44   1.750254 54.230.150.52 -> 172.31.29.138 TCP 17442 [TCP segment of a reassembled PDU]
 45   1.750265 172.31.29.138 -> 54.230.150.52 TCP 66 44166 > http [ACK] Seq=97 Ack=124529 Win=251008 Len=0 TSval=9642976 TSecr=435232749
 46   1.750409 54.230.150.52 -> 172.31.29.138 TCP 10202 [TCP segment of a reassembled PDU]
 47   1.750417 172.31.29.138 -> 54.230.150.52 TCP 66 44166 > http [ACK] Seq=97 Ack=134665 Win=271232 Len=0 TSval=9642976 TSecr=435232749
 48   1.750531 54.230.150.52 -> 172.31.29.138 TCP 5858 [TCP segment of a reassembled PDU]
 49   1.750537 172.31.29.138 -> 54.230.150.52 TCP 66 44166 > http [ACK] Seq=97 Ack=140457 Win=269440 Len=0 TSval=9642976 TSecr=435232749
 50   1.751672 54.230.150.52 -> 172.31.29.138 TCP 4410 [TCP segment of a reassembled PDU]
 51   1.751680 172.31.29.138 -> 54.230.150.52 TCP 66 44166 > http [ACK] Seq=97 Ack=144801 Win=279936 Len=0 TSval=9642977 TSecr=435232749
 52   1.751806 54.230.150.52 -> 172.31.29.138 TCP 18890 [TCP segment of a reassembled PDU]
 53   1.751827 172.31.29.138 -> 54.230.150.52 TCP 66 44166 > http [ACK] Seq=97 Ack=163625 Win=317568 Len=0 TSval=9642977 TSecr=435232749
 54   1.752075 54.230.150.52 -> 172.31.29.138 TCP 18890 [TCP segment of a reassembled PDU]
 55   1.752087 172.31.29.138 -> 54.230.150.52 TCP 66 44166 > http [ACK] Seq=97 Ack=182449 Win=355200 Len=0 TSval=9642977 TSecr=435232749
 56   1.753180 54.230.150.52 -> 172.31.29.138 TCP 10202 [TCP segment of a reassembled PDU]
 57   1.753188 172.31.29.138 -> 54.230.150.52 TCP 66 44166 > http [ACK] Seq=97 Ack=192585 Win=375552 Len=0 TSval=9642977 TSecr=435232750
 58   1.753271 54.230.150.52 -> 172.31.29.138 TCP 15994 [TCP segment of a reassembled PDU]
 59   1.753282 172.31.29.138 -> 54.230.150.52 TCP 66 44166 > http [ACK] Seq=97 Ack=208513 Win=407296 Len=0 TSval=9642977 TSecr=435232750
 60   1.753573 54.230.150.52 -> 172.31.29.138 TCP 20338 [TCP segment of a reassembled PDU]
 61   1.753584 172.31.29.138 -> 54.230.150.52 TCP 66 44166 > http [ACK] Seq=97 Ack=228785 Win=447872 Len=0 TSval=9642977 TSecr=435232750
 62   1.754756 54.230.150.52 -> 172.31.29.138 TCP 5858 [TCP segment of a reassembled PDU]
 63   1.754764 172.31.29.138 -> 54.230.150.52 TCP 66 44166 > http [ACK] Seq=97 Ack=234577 Win=459520 Len=0 TSval=9642977 TSecr=435232750
 64   1.754892 54.230.150.52 -> 172.31.29.138 TCP 10202 [TCP segment of a reassembled PDU]
 65   1.754900 172.31.29.138 -> 54.230.150.52 TCP 66 44166 > http [ACK] Seq=97 Ack=244713 Win=479744 Len=0 TSval=9642978 TSecr=435232750
 66   1.755172 54.230.150.52 -> 172.31.29.138 TCP 26130 [TCP segment of a reassembled PDU]
 67   1.755186 172.31.29.138 -> 54.230.150.52 TCP 66 44166 > http [ACK] Seq=97 Ack=270777 Win=531840 Len=0 TSval=9642978 TSecr=435232750
 68   1.755198 54.230.150.52 -> 172.31.29.138 TCP 8754 [TCP segment of a reassembled PDU]
 69   1.755203 172.31.29.138 -> 54.230.150.52 TCP 66 44166 > http [ACK] Seq=97 Ack=279465 Win=549248 Len=0 TSval=9642978 TSecr=435232750
 70   1.756371 54.230.150.52 -> 172.31.29.138 TCP 14546 [TCP segment of a reassembled PDU]
 71   1.756381 172.31.29.138 -> 54.230.150.52 TCP 66 44166 > http [ACK] Seq=97 Ack=293945 Win=578176 Len=0 TSval=9642978 TSecr=435232750
 72   1.756460 54.230.150.52 -> 172.31.29.138 TCP 4410 [TCP segment of a reassembled PDU]
 73   1.756466 172.31.29.138 -> 54.230.150.52 TCP 66 44166 > http [ACK] Seq=97 Ack=298289 Win=586880 Len=0 TSval=9642978 TSecr=435232750
 74   1.756796 54.230.150.52 -> 172.31.29.138 TCP 26130 [TCP segment of a reassembled PDU]
 75   1.756809 172.31.29.138 -> 54.230.150.52 TCP 66 44166 > http [ACK] Seq=97 Ack=324353 Win=605952 Len=0 TSval=9642978 TSecr=435232750
 76   1.756820 54.230.150.52 -> 172.31.29.138 TCP 7306 [TCP segment of a reassembled PDU]
 77   1.756828 172.31.29.138 -> 54.230.150.52 TCP 66 44166 > http [ACK] Seq=97 Ack=331593 Win=598784 Len=0 TSval=9642978 TSecr=435232750
 78   1.756835 54.230.150.52 -> 172.31.29.138 TCP 4410 [TCP segment of a reassembled PDU]
 79   1.756839 172.31.29.138 -> 54.230.150.52 TCP 66 44166 > http [ACK] Seq=97 Ack=335937 Win=594560 Len=0 TSval=9642978 TSecr=435232750
 80   1.757885 54.230.150.52 -> 172.31.29.138 TCP 2962 [TCP segment of a reassembled PDU]
 81   1.757891 172.31.29.138 -> 54.230.150.52 TCP 66 44166 > http [ACK] Seq=97 Ack=338833 Win=643968 Len=0 TSval=9642978 TSecr=435232750
 82   1.758041 54.230.150.52 -> 172.31.29.138 TCP 18890 [TCP segment of a reassembled PDU]
 83   1.758052 172.31.29.138 -> 54.230.150.52 TCP 66 44166 > http [ACK] Seq=97 Ack=357657 Win=625152 Len=0 TSval=9642978 TSecr=435232750
 84   1.758255 54.230.150.52 -> 172.31.29.138 TCP 17442 [TCP segment of a reassembled PDU]
 85   1.758265 172.31.29.138 -> 54.230.150.52 TCP 66 44166 > http [ACK] Seq=97 Ack=375033 Win=620160 Len=0 TSval=9642978 TSecr=435232750
 86   1.758342 54.230.150.52 -> 172.31.29.138 TCP 1514 [TCP segment of a reassembled PDU]
 87   1.758347 172.31.29.138 -> 54.230.150.52 TCP 66 44166 > http [ACK] Seq=97 Ack=376481 Win=646272 Len=0 TSval=9642978 TSecr=435232750
 88   1.758537 54.230.150.52 -> 172.31.29.138 TCP 17442 [TCP segment of a reassembled PDU]
 89   1.758564 54.230.150.52 -> 172.31.29.138 TCP 5858 [TCP segment of a reassembled PDU]
 90   1.758569 172.31.29.138 -> 54.230.150.52 TCP 66 44166 > http [ACK] Seq=97 Ack=393857 Win=628992 Len=0 TSval=9642978 TSecr=435232750
 91   1.758582 172.31.29.138 -> 54.230.150.52 TCP 66 44166 > http [ACK] Seq=97 Ack=399649 Win=647680 Len=0 TSval=9642978 TSecr=435232750
 92   1.759427 54.230.150.52 -> 172.31.29.138 TCP 10202 [TCP segment of a reassembled PDU]
 93   1.759447 172.31.29.138 -> 54.230.150.52 TCP 66 44166 > http [ACK] Seq=97 Ack=409785 Win=647680 Len=0 TSval=9642979 TSecr=435232750
 94   1.759573 54.230.150.52 -> 172.31.29.138 TCP 14546 [TCP segment of a reassembled PDU]
 95   1.759582 172.31.29.138 -> 54.230.150.52 TCP 66 44166 > http [ACK] Seq=97 Ack=424265 Win=676736 Len=0 TSval=9642979 TSecr=435232750
 96   1.759653 54.230.150.52 -> 172.31.29.138 TCP 4410 [TCP segment of a reassembled PDU]
 97   1.759659 172.31.29.138 -> 54.230.150.52 TCP 66 44166 > http [ACK] Seq=97 Ack=428609 Win=685312 Len=0 TSval=9642979 TSecr=435232750
 98   1.759767 54.230.150.52 -> 172.31.29.138 TCP 11650 [TCP segment of a reassembled PDU]
 99   1.759775 172.31.29.138 -> 54.230.150.52 TCP 66 44166 > http [ACK] Seq=97 Ack=440193 Win=708480 Len=0 TSval=9642979 TSecr=435232750
100   1.760162 54.230.150.52 -> 172.31.29.138 TCP 4410 [TCP segment of a reassembled PDU]
101   1.760168 172.31.29.138 -> 54.230.150.52 TCP 66 44166 > http [ACK] Seq=97 Ack=444537 Win=717184 Len=0 TSval=9642979 TSecr=435232750
102   1.760321 54.230.150.52 -> 172.31.29.138 TCP 20338 [TCP segment of a reassembled PDU]
103   1.760332 172.31.29.138 -> 54.230.150.52 TCP 66 44166 > http [ACK] Seq=97 Ack=464809 Win=757760 Len=0 TSval=9642979 TSecr=435232750
104   1.760940 54.230.150.52 -> 172.31.29.138 TCP 5858 [TCP segment of a reassembled PDU]
105   1.760946 172.31.29.138 -> 54.230.150.52 TCP 66 44166 > http [ACK] Seq=97 Ack=470601 Win=769408 Len=0 TSval=9642979 TSecr=435232750
106   1.761125 54.230.150.52 -> 172.31.29.138 TCP 26130 [TCP segment of a reassembled PDU]
107   1.761138 172.31.29.138 -> 54.230.150.52 TCP 66 44166 > http [ACK] Seq=97 Ack=496665 Win=821504 Len=0 TSval=9642979 TSecr=435232750
108   1.761152 54.230.150.52 -> 172.31.29.138 TCP 8754 [TCP segment of a reassembled PDU]
109   1.761156 172.31.29.138 -> 54.230.150.52 TCP 66 44166 > http [ACK] Seq=97 Ack=505353 Win=838912 Len=0 TSval=9642979 TSecr=435232750
110   1.761744 54.230.150.52 -> 172.31.29.138 TCP 14546 [TCP segment of a reassembled PDU]
111   1.761754 172.31.29.138 -> 54.230.150.52 TCP 66 44166 > http [ACK] Seq=97 Ack=519833 Win=867840 Len=0 TSval=9642979 TSecr=435232750
112   1.761919 54.230.150.52 -> 172.31.29.138 TCP 26130 [TCP segment of a reassembled PDU]
113   1.761932 172.31.29.138 -> 54.230.150.52 TCP 66 44166 > http [ACK] Seq=97 Ack=545897 Win=903296 Len=0 TSval=9642979 TSecr=435232750
114   1.762528 54.230.150.52 -> 172.31.29.138 TCP 7306 [TCP segment of a reassembled PDU]
115   1.762535 172.31.29.138 -> 54.230.150.52 TCP 66 44166 > http [ACK] Seq=97 Ack=553137 Win=934144 Len=0 TSval=9642979 TSecr=435232750
116   1.762662 54.230.150.52 -> 172.31.29.138 TCP 17442 [TCP segment of a reassembled PDU]
117   1.762685 172.31.29.138 -> 54.230.150.52 TCP 66 44166 > http [ACK] Seq=97 Ack=570513 Win=917504 Len=0 TSval=9642979 TSecr=435232750
118   1.763155 54.230.150.52 -> 172.31.29.138 TCP 15994 [TCP segment of a reassembled PDU]
119   1.763165 172.31.29.138 -> 54.230.150.52 TCP 66 44166 > http [ACK] Seq=97 Ack=586441 Win=919808 Len=0 TSval=9642980 TSecr=435232751
120   1.763287 54.230.150.52 -> 172.31.29.138 TCP 20338 [TCP segment of a reassembled PDU]
121   1.763324 172.31.29.138 -> 54.230.150.52 TCP 66 44166 > http [ACK] Seq=97 Ack=606713 Win=912768 Len=0 TSval=9642980 TSecr=435232751
122   1.763901 54.230.150.52 -> 172.31.29.138 TCP 11650 [TCP segment of a reassembled PDU]
123   1.763910 172.31.29.138 -> 54.230.150.52 TCP 66 44166 > http [ACK] Seq=97 Ack=618297 Win=927104 Len=0 TSval=9642980 TSecr=435232751
124   1.764054 54.230.150.52 -> 172.31.29.138 TCP 17442 [TCP segment of a reassembled PDU]
125   1.764076 172.31.29.138 -> 54.230.150.52 TCP 66 44166 > http [ACK] Seq=97 Ack=635673 Win=917504 Len=0 TSval=9642980 TSecr=435232751
126   1.764905 54.230.150.52 -> 172.31.29.138 TCP 10202 [TCP segment of a reassembled PDU]
127   1.764913 172.31.29.138 -> 54.230.150.52 TCP 66 44166 > http [ACK] Seq=97 Ack=645809 Win=929408 Len=0 TSval=9642980 TSecr=435232751
128   1.765079 54.230.150.52 -> 172.31.29.138 TCP 23234 [TCP segment of a reassembled PDU]
129   1.765102 172.31.29.138 -> 54.230.150.52 TCP 66 44166 > http [ACK] Seq=97 Ack=668977 Win=908032 Len=0 TSval=9642980 TSecr=435232751
130   1.765125 54.230.150.52 -> 172.31.29.138 TCP 2962 [TCP segment of a reassembled PDU]
131   1.765129 172.31.29.138 -> 54.230.150.52 TCP 66 44166 > http [ACK] Seq=97 Ack=671873 Win=940160 Len=0 TSval=9642980 TSecr=435232751
132   1.765210 54.230.150.52 -> 172.31.29.138 TCP 29026 [TCP segment of a reassembled PDU]
133   1.765235 172.31.29.138 -> 54.230.150.52 TCP 66 44166 > http [ACK] Seq=97 Ack=700833 Win=911232 Len=0 TSval=9642980 TSecr=435232751
134   1.766225 54.230.150.52 -> 172.31.29.138 TCP 11650 [TCP segment of a reassembled PDU]
135   1.766234 172.31.29.138 -> 54.230.150.52 TCP 66 44166 > http [ACK] Seq=97 Ack=712417 Win=927104 Len=0 TSval=9642980 TSecr=435232751
136   1.766430 54.230.150.52 -> 172.31.29.138 TCP 18890 [TCP segment of a reassembled PDU]
137   1.766453 172.31.29.138 -> 54.230.150.52 TCP 66 44166 > http [ACK] Seq=97 Ack=731241 Win=915072 Len=0 TSval=9642980 TSecr=435232751
138   1.766555 54.230.150.52 -> 172.31.29.138 TCP 13098 [TCP segment of a reassembled PDU]
139   1.766564 172.31.29.138 -> 54.230.150.52 TCP 66 44166 > http [ACK] Seq=97 Ack=744273 Win=924672 Len=0 TSval=9642980 TSecr=435232751
140   1.766572 54.230.150.52 -> 172.31.29.138 TCP 1514 [TCP segment of a reassembled PDU]
141   1.766589 54.230.150.52 -> 172.31.29.138 TCP 17442 [TCP segment of a reassembled PDU]
142   1.766598 54.230.150.52 -> 172.31.29.138 TCP 2962 [TCP segment of a reassembled PDU]
143   1.766701 172.31.29.138 -> 54.230.150.52 TCP 66 44166 > http [ACK] Seq=97 Ack=765993 Win=912640 Len=0 TSval=9642980 TSecr=435232751
144   1.766965 54.230.150.52 -> 172.31.29.138 TCP 5858 [TCP segment of a reassembled PDU]
145   1.766972 172.31.29.138 -> 54.230.150.52 TCP 66 44166 > http [ACK] Seq=97 Ack=771785 Win=936576 Len=0 TSval=9642981 TSecr=435232751
146   1.767138 54.230.150.52 -> 172.31.29.138 TCP 21786 [TCP segment of a reassembled PDU]
147   1.767163 54.230.150.52 -> 172.31.29.138 TCP 4410 [TCP segment of a reassembled PDU]
148   1.767172 172.31.29.138 -> 54.230.150.52 TCP 66 44166 > http [ACK] Seq=97 Ack=797849 Win=910592 Len=0 TSval=9642981 TSecr=435232751
149   1.767183 54.230.150.52 -> 172.31.29.138 TCP 5858 [TCP segment of a reassembled PDU]
150   1.767200 172.31.29.138 -> 54.230.150.52 TCP 66 44166 > http [ACK] Seq=97 Ack=803641 Win=940160 Len=0 TSval=9642981 TSecr=435232751
151   1.767802 54.230.150.52 -> 172.31.29.138 TCP 20338 [TCP segment of a reassembled PDU]
152   1.767825 172.31.29.138 -> 54.230.150.52 TCP 66 44166 > http [ACK] Seq=97 Ack=823913 Win=919936 Len=0 TSval=9642981 TSecr=435232751
153   1.767892 54.230.150.52 -> 172.31.29.138 TCP 7306 [TCP segment of a reassembled PDU]
154   1.767899 172.31.29.138 -> 54.230.150.52 TCP 66 44166 > http [ACK] Seq=97 Ack=831153 Win=934144 Len=0 TSval=9642981 TSecr=435232751
155   1.768261 54.230.150.52 -> 172.31.29.138 TCP 10202 [TCP segment of a reassembled PDU]
156   1.768280 172.31.29.138 -> 54.230.150.52 TCP 66 44166 > http [ACK] Seq=97 Ack=841289 Win=940160 Len=0 TSval=9642981 TSecr=435232751
157   1.768446 54.230.150.52 -> 172.31.29.138 TCP 26130 [TCP segment of a reassembled PDU]
158   1.768465 54.230.150.52 -> 172.31.29.138 TCP 7306 [TCP segment of a reassembled PDU]
159   1.768517 172.31.29.138 -> 54.230.150.52 TCP 66 44166 > http [ACK] Seq=97 Ack=874593 Win=906880 Len=0 TSval=9642981 TSecr=435232751
160   1.768572 54.230.150.52 -> 172.31.29.138 TCP 21786 [TCP segment of a reassembled PDU]
161   1.768584 172.31.29.138 -> 54.230.150.52 TCP 66 44166 > http [ACK] Seq=97 Ack=896313 Win=910336 Len=0 TSval=9642981 TSecr=435232751
162   1.769274 54.230.150.52 -> 172.31.29.138 TCP 4410 [TCP segment of a reassembled PDU]
163   1.769280 172.31.29.138 -> 54.230.150.52 TCP 66 44166 > http [ACK] Seq=97 Ack=900657 Win=938880 Len=0 TSval=9642981 TSecr=435232751
164   1.769535 54.230.150.52 -> 172.31.29.138 TCP 37714 [TCP segment of a reassembled PDU]
165   1.769580 172.31.29.138 -> 54.230.150.52 TCP 66 44166 > http [ACK] Seq=97 Ack=938305 Win=901248 Len=0 TSval=9642981 TSecr=435232751
166   1.769989 54.230.150.52 -> 172.31.29.138 TCP 20338 [TCP segment of a reassembled PDU]
167   1.770003 172.31.29.138 -> 54.230.150.52 TCP 66 44166 > http [ACK] Seq=97 Ack=958577 Win=912768 Len=0 TSval=9642981 TSecr=435232751
168   1.770075 54.230.150.52 -> 172.31.29.138 TCP 11650 [TCP segment of a reassembled PDU]
169   1.770084 172.31.29.138 -> 54.230.150.52 TCP 66 44166 > http [ACK] Seq=97 Ack=970161 Win=927104 Len=0 TSval=9642981 TSecr=435232751
170   1.770172 54.230.150.52 -> 172.31.29.138 TCP 7306 [TCP segment of a reassembled PDU]
171   1.770179 172.31.29.138 -> 54.230.150.52 TCP 66 44166 > http [ACK] Seq=97 Ack=977401 Win=934144 Len=0 TSval=9642981 TSecr=435232751
172   1.770198 54.230.150.52 -> 172.31.29.138 TCP 1514 [TCP Previous segment not captured] [TCP segment of a reassembled PDU]
173   1.770202 172.31.29.138 -> 54.230.150.52 TCP 78 [TCP Dup ACK 171#1] 44166 > http [ACK] Seq=97 Ack=977401 Win=934144 Len=0 TSval=9642981 TSecr=435232751 SLE=978849 SRE=980297
174   1.770256 54.230.150.52 -> 172.31.29.138 TCP 1514 [TCP Out-Of-Order] [TCP segment of a reassembled PDU]
175   1.770261 172.31.29.138 -> 54.230.150.52 TCP 66 44166 > http [ACK] Seq=97 Ack=980297 Win=931328 Len=0 TSval=9642981 TSecr=435232751
176   1.770361 54.230.150.52 -> 172.31.29.138 TCP 26130 [TCP segment of a reassembled PDU]
177   1.770376 172.31.29.138 -> 54.230.150.52 TCP 66 44166 > http [ACK] Seq=97 Ack=1006361 Win=905344 Len=0 TSval=9642981 TSecr=435232751
178   1.770389 54.230.150.52 -> 172.31.29.138 TCP 10202 [TCP segment of a reassembled PDU]
179   1.770398 172.31.29.138 -> 54.230.150.52 TCP 66 44166 > http [ACK] Seq=97 Ack=1016497 Win=895232 Len=0 TSval=9642981 TSecr=435232751
180   1.771092 54.230.150.52 -> 172.31.29.138 TCP 10202 [TCP segment of a reassembled PDU]
181   1.771101 172.31.29.138 -> 54.230.150.52 TCP 66 44166 > http [ACK] Seq=97 Ack=1026633 Win=929408 Len=0 TSval=9642982 TSecr=435232751
182   1.771565 54.230.150.52 -> 172.31.29.138 TCP 1514 [TCP segment of a reassembled PDU]
183   1.771570 172.31.29.138 -> 54.230.150.52 TCP 66 44166 > http [ACK] Seq=97 Ack=1028081 Win=943104 Len=0 TSval=9642982 TSecr=435232751
184   1.771751 54.230.150.52 -> 172.31.29.138 HTTP 21019 HTTP/1.1 200 OK  (application/octet-stream)
185   1.771761 172.31.29.138 -> 54.230.150.52 TCP 66 44166 > http [ACK] Seq=97 Ack=1049034 Win=946432 Len=0 TSval=9642982 TSecr=435232751
186   1.771945 172.31.29.138 -> 54.230.150.52 TCP 66 44166 > http [FIN, ACK] Seq=97 Ack=1049034 Win=979328 Len=0 TSval=9642982 TSecr=435232751
187   1.773374 54.230.150.52 -> 172.31.29.138 TCP 66 http > 44166 [FIN, ACK] Seq=1049034 Ack=98 Win=14592 Len=0 TSval=435232752 TSecr=9642982
188   1.773384 172.31.29.138 -> 54.230.150.52 TCP 66 44166 > http [ACK] Seq=98 Ack=1049035 Win=979328 Len=0 TSval=9642982 TSecr=435232752
