[Measurement for 1mb at 13:38:18 20.38.2014] 
Tshark:

  1   0.000000 172.31.29.138 -> 172.31.0.2   DNS 89 Standard query 0x3d90  A d1n0gskdvzj94j.cloudfront.net
  2   0.000028 172.31.29.138 -> 172.31.0.2   DNS 89 Standard query 0x9802  AAAA d1n0gskdvzj94j.cloudfront.net
  3   0.000609   172.31.0.2 -> 172.31.29.138 DNS 217 Standard query response 0x3d90  A 54.230.150.115 A 54.230.150.122 A 54.230.150.155 A 54.230.149.97 A 54.230.149.156 A 54.230.150.29 A 54.230.150.106 A 54.230.150.109
  4   0.000632   172.31.0.2 -> 172.31.29.138 DNS 176 Standard query response 0x9802 
  5   0.003882 172.31.29.138 -> 54.230.150.115 TCP 74 44093 > http [SYN] Seq=0 Win=26883 Len=0 MSS=8961 SACK_PERM=1 TSval=18642876 TSecr=0 WS=128
  6   0.005332 54.230.150.115 -> 172.31.29.138 TCP 74 http > 44093 [SYN, ACK] Seq=0 Ack=1 Win=14480 Len=0 MSS=1460 SACK_PERM=1 TSval=447331729 TSecr=18642876 WS=128
  7   0.005356 172.31.29.138 -> 54.230.150.115 TCP 66 44093 > http [ACK] Seq=1 Ack=1 Win=27008 Len=0 TSval=18642877 TSecr=447331729
  8   0.005396 172.31.29.138 -> 54.230.150.115 HTTP 162 GET /1mb HTTP/1.1 
  9   0.006791 54.230.150.115 -> 172.31.29.138 TCP 66 http > 44093 [ACK] Seq=1 Ack=97 Win=14592 Len=0 TSval=447331729 TSecr=18642877
 10   0.009891 54.230.150.115 -> 172.31.29.138 TCP 523 [TCP segment of a reassembled PDU]
 11   0.009897 172.31.29.138 -> 54.230.150.115 TCP 66 44093 > http [ACK] Seq=97 Ack=458 Win=28032 Len=0 TSval=18642878 TSecr=447331729
 12   0.010009 54.230.150.115 -> 172.31.29.138 TCP 13098 [TCP segment of a reassembled PDU]
 13   0.010019 172.31.29.138 -> 54.230.150.115 TCP 66 44093 > http [ACK] Seq=97 Ack=13490 Win=54144 Len=0 TSval=18642878 TSecr=447331729
 14   0.011441 54.230.150.115 -> 172.31.29.138 TCP 5858 [TCP segment of a reassembled PDU]
 15   0.011448 172.31.29.138 -> 54.230.150.115 TCP 66 44093 > http [ACK] Seq=97 Ack=19282 Win=65664 Len=0 TSval=18642878 TSecr=447331729
 16   0.011502 54.230.150.115 -> 172.31.29.138 TCP 7306 [TCP segment of a reassembled PDU]
 17   0.011509 172.31.29.138 -> 54.230.150.115 TCP 66 44093 > http [ACK] Seq=97 Ack=26522 Win=80128 Len=0 TSval=18642878 TSecr=447331729
 18   0.012984 54.230.150.115 -> 172.31.29.138 TCP 10202 [TCP segment of a reassembled PDU]
 19   0.012992 172.31.29.138 -> 54.230.150.115 TCP 66 44093 > http [ACK] Seq=97 Ack=36658 Win=100480 Len=0 TSval=18642879 TSecr=447331729
 20   0.012999 54.230.150.115 -> 172.31.29.138 TCP 2962 [TCP segment of a reassembled PDU]
 21   0.013005 172.31.29.138 -> 54.230.150.115 TCP 66 44093 > http [ACK] Seq=97 Ack=39554 Win=97664 Len=0 TSval=18642879 TSecr=447331729
 22   0.013062 54.230.150.115 -> 172.31.29.138 TCP 7306 [TCP segment of a reassembled PDU]
 23   0.013069 172.31.29.138 -> 54.230.150.115 TCP 66 44093 > http [ACK] Seq=97 Ack=46794 Win=105984 Len=0 TSval=18642879 TSecr=447331729
 24   0.014486 54.230.150.115 -> 172.31.29.138 TCP 7306 [TCP segment of a reassembled PDU]
 25   0.014493 172.31.29.138 -> 54.230.150.115 TCP 66 44093 > http [ACK] Seq=97 Ack=54034 Win=105984 Len=0 TSval=18642879 TSecr=447331730
 26   0.014570 54.230.150.115 -> 172.31.29.138 TCP 11650 [TCP segment of a reassembled PDU]
 27   0.014578 172.31.29.138 -> 54.230.150.115 TCP 66 44093 > http [ACK] Seq=97 Ack=65618 Win=98944 Len=0 TSval=18642879 TSecr=447331730
 28   0.016014 54.230.150.115 -> 172.31.29.138 TCP 1514 [TCP segment of a reassembled PDU]
 29   0.016019 172.31.29.138 -> 54.230.150.115 TCP 66 44093 > http [ACK] Seq=97 Ack=67066 Win=109056 Len=0 TSval=18642879 TSecr=447331730
 30   0.016171 54.230.150.115 -> 172.31.29.138 TCP 24682 [TCP segment of a reassembled PDU]
 31   0.016182 172.31.29.138 -> 54.230.150.115 TCP 66 44093 > http [ACK] Seq=97 Ack=91682 Win=84480 Len=0 TSval=18642879 TSecr=447331730
 32   0.017820 54.230.150.115 -> 172.31.29.138 TCP 5858 [TCP segment of a reassembled PDU]
 33   0.017827 172.31.29.138 -> 54.230.150.115 TCP 66 44093 > http [ACK] Seq=97 Ack=97474 Win=108416 Len=0 TSval=18642880 TSecr=447331730
 34   0.017958 54.230.150.115 -> 172.31.29.138 TCP 20338 [TCP segment of a reassembled PDU]
 35   0.017968 172.31.29.138 -> 54.230.150.115 TCP 66 44093 > http [ACK] Seq=97 Ack=117746 Win=149632 Len=0 TSval=18642880 TSecr=447331730
 36   0.019126 54.230.150.115 -> 172.31.29.138 TCP 5858 [TCP segment of a reassembled PDU]
 37   0.019132 172.31.29.138 -> 54.230.150.115 TCP 66 44093 > http [ACK] Seq=97 Ack=123538 Win=161152 Len=0 TSval=18642880 TSecr=447331730
 38   0.019224 54.230.150.115 -> 172.31.29.138 TCP 5858 [TCP segment of a reassembled PDU]
 39   0.019231 172.31.29.138 -> 54.230.150.115 TCP 66 44093 > http [ACK] Seq=97 Ack=129330 Win=172800 Len=0 TSval=18642880 TSecr=447331730
 40   0.019423 54.230.150.115 -> 172.31.29.138 TCP 1514 [TCP segment of a reassembled PDU]
 41   0.019427 172.31.29.138 -> 54.230.150.115 TCP 66 44093 > http [ACK] Seq=97 Ack=130778 Win=175616 Len=0 TSval=18642880 TSecr=447331730
 42   0.019664 54.230.150.115 -> 172.31.29.138 TCP 13098 [TCP segment of a reassembled PDU]
 43   0.019674 172.31.29.138 -> 54.230.150.115 TCP 66 44093 > http [ACK] Seq=97 Ack=143810 Win=201728 Len=0 TSval=18642880 TSecr=447331730
 44   0.020632 54.230.150.115 -> 172.31.29.138 TCP 5858 [TCP segment of a reassembled PDU]
 45   0.020638 172.31.29.138 -> 54.230.150.115 TCP 66 44093 > http [ACK] Seq=97 Ack=149602 Win=213376 Len=0 TSval=18642880 TSecr=447331730
 46   0.020725 54.230.150.115 -> 172.31.29.138 TCP 8754 [TCP segment of a reassembled PDU]
 47   0.020744 172.31.29.138 -> 54.230.150.115 TCP 66 44093 > http [ACK] Seq=97 Ack=158290 Win=230656 Len=0 TSval=18642880 TSecr=447331730
 48   0.021146 54.230.150.115 -> 172.31.29.138 TCP 7306 [TCP segment of a reassembled PDU]
 49   0.021153 172.31.29.138 -> 54.230.150.115 TCP 66 44093 > http [ACK] Seq=97 Ack=165530 Win=245120 Len=0 TSval=18642881 TSecr=447331730
 50   0.021281 54.230.150.115 -> 172.31.29.138 TCP 17442 [TCP segment of a reassembled PDU]
 51   0.021291 172.31.29.138 -> 54.230.150.115 TCP 66 44093 > http [ACK] Seq=97 Ack=182906 Win=279936 Len=0 TSval=18642881 TSecr=447331730
 52   0.022213 54.230.150.115 -> 172.31.29.138 TCP 13098 [TCP segment of a reassembled PDU]
 53   0.022222 172.31.29.138 -> 54.230.150.115 TCP 66 44093 > http [ACK] Seq=97 Ack=195938 Win=306048 Len=0 TSval=18642881 TSecr=447331730
 54   0.022686 54.230.150.115 -> 172.31.29.138 TCP 1514 [TCP segment of a reassembled PDU]
 55   0.022691 172.31.29.138 -> 54.230.150.115 TCP 66 44093 > http [ACK] Seq=97 Ack=197386 Win=308864 Len=0 TSval=18642881 TSecr=447331730
 56   0.022864 54.230.150.115 -> 172.31.29.138 TCP 27578 [TCP segment of a reassembled PDU]
 57   0.022878 172.31.29.138 -> 54.230.150.115 TCP 66 44093 > http [ACK] Seq=97 Ack=224898 Win=363904 Len=0 TSval=18642881 TSecr=447331730
 58   0.022885 54.230.150.115 -> 172.31.29.138 TCP 2962 [TCP segment of a reassembled PDU]
 59   0.022888 172.31.29.138 -> 54.230.150.115 TCP 66 44093 > http [ACK] Seq=97 Ack=227794 Win=369664 Len=0 TSval=18642881 TSecr=447331730
 60   0.024008 54.230.150.115 -> 172.31.29.138 TCP 10202 [TCP segment of a reassembled PDU]
 61   0.024016 172.31.29.138 -> 54.230.150.115 TCP 66 44093 > http [ACK] Seq=97 Ack=237930 Win=390016 Len=0 TSval=18642881 TSecr=447331731
 62   0.024083 54.230.150.115 -> 172.31.29.138 TCP 7306 [TCP segment of a reassembled PDU]
 63   0.024089 172.31.29.138 -> 54.230.150.115 TCP 66 44093 > http [ACK] Seq=97 Ack=245170 Win=404480 Len=0 TSval=18642881 TSecr=447331731
 64   0.024401 54.230.150.115 -> 172.31.29.138 TCP 29026 [TCP segment of a reassembled PDU]
 65   0.024415 172.31.29.138 -> 54.230.150.115 TCP 66 44093 > http [ACK] Seq=97 Ack=274130 Win=462336 Len=0 TSval=18642881 TSecr=447331731
 66   0.025743 54.230.150.115 -> 172.31.29.138 TCP 4410 [TCP segment of a reassembled PDU]
 67   0.025750 172.31.29.138 -> 54.230.150.115 TCP 66 44093 > http [ACK] Seq=97 Ack=278474 Win=471040 Len=0 TSval=18642882 TSecr=447331731
 68   0.025914 54.230.150.115 -> 172.31.29.138 TCP 26130 [TCP segment of a reassembled PDU]
 69   0.025927 172.31.29.138 -> 54.230.150.115 TCP 66 44093 > http [ACK] Seq=97 Ack=304538 Win=523136 Len=0 TSval=18642882 TSecr=447331731
 70   0.025967 54.230.150.115 -> 172.31.29.138 TCP 24682 [TCP segment of a reassembled PDU]
 71   0.025980 172.31.29.138 -> 54.230.150.115 TCP 66 44093 > http [ACK] Seq=97 Ack=329154 Win=572416 Len=0 TSval=18642882 TSecr=447331731
 72   0.027376 54.230.150.115 -> 172.31.29.138 TCP 10202 [TCP segment of a reassembled PDU]
 73   0.027384 172.31.29.138 -> 54.230.150.115 TCP 66 44093 > http [ACK] Seq=97 Ack=339290 Win=592640 Len=0 TSval=18642882 TSecr=447331731
 74   0.027550 54.230.150.115 -> 172.31.29.138 TCP 26130 [TCP segment of a reassembled PDU]
 75   0.027564 172.31.29.138 -> 54.230.150.115 TCP 66 44093 > http [ACK] Seq=97 Ack=365354 Win=644864 Len=0 TSval=18642882 TSecr=447331731
 76   0.027644 54.230.150.115 -> 172.31.29.138 TCP 23234 [TCP segment of a reassembled PDU]
 77   0.027657 172.31.29.138 -> 54.230.150.115 TCP 66 44093 > http [ACK] Seq=97 Ack=388522 Win=691200 Len=0 TSval=18642882 TSecr=447331731
 78   0.029162 54.230.150.115 -> 172.31.29.138 TCP 14546 [TCP segment of a reassembled PDU]
 79   0.029172 172.31.29.138 -> 54.230.150.115 TCP 66 44093 > http [ACK] Seq=97 Ack=403002 Win=715008 Len=0 TSval=18642883 TSecr=447331731
 80   0.029213 54.230.150.115 -> 172.31.29.138 TCP 8754 [TCP segment of a reassembled PDU]
 81   0.029220 172.31.29.138 -> 54.230.150.115 TCP 66 44093 > http [ACK] Seq=97 Ack=411690 Win=724608 Len=0 TSval=18642883 TSecr=447331731
 82   0.029264 54.230.150.115 -> 172.31.29.138 TCP 1514 [TCP Previous segment not captured] [TCP segment of a reassembled PDU]
 83   0.029269 172.31.29.138 -> 54.230.150.115 TCP 78 [TCP Window Update] 44093 > http [ACK] Seq=97 Ack=411690 Win=736384 Len=0 TSval=18642883 TSecr=447331731 SLE=413138 SRE=414586
 84   0.029274 54.230.150.115 -> 172.31.29.138 TCP 1514 [TCP Out-Of-Order] [TCP segment of a reassembled PDU]
 85   0.029277 172.31.29.138 -> 54.230.150.115 TCP 66 44093 > http [ACK] Seq=97 Ack=414586 Win=733952 Len=0 TSval=18642883 TSecr=447331731
 86   0.029387 54.230.150.115 -> 172.31.29.138 TCP 36266 [TCP segment of a reassembled PDU]
 87   0.029408 172.31.29.138 -> 54.230.150.115 TCP 66 44093 > http [ACK] Seq=97 Ack=450786 Win=697856 Len=0 TSval=18642883 TSecr=447331731
 88   0.029435 54.230.150.115 -> 172.31.29.138 TCP 1514 [TCP segment of a reassembled PDU]
 89   0.029441 172.31.29.138 -> 54.230.150.115 TCP 66 44093 > http [ACK] Seq=97 Ack=452234 Win=696448 Len=0 TSval=18642883 TSecr=447331731
 90   0.030751 54.230.150.115 -> 172.31.29.138 TCP 26130 [TCP segment of a reassembled PDU]
 91   0.030765 172.31.29.138 -> 54.230.150.115 TCP 66 44093 > http [ACK] Seq=97 Ack=478298 Win=696064 Len=0 TSval=18642883 TSecr=447331731
 92   0.030807 54.230.150.115 -> 172.31.29.138 TCP 26130 [TCP segment of a reassembled PDU]
 93   0.030821 172.31.29.138 -> 54.230.150.115 TCP 66 44093 > http [ACK] Seq=97 Ack=504362 Win=670080 Len=0 TSval=18642883 TSecr=447331731
 94   0.030861 54.230.150.115 -> 172.31.29.138 TCP 15994 [TCP segment of a reassembled PDU]
 95   0.030870 172.31.29.138 -> 54.230.150.115 TCP 66 44093 > http [ACK] Seq=97 Ack=520290 Win=712576 Len=0 TSval=18642883 TSecr=447331731
 96   0.032200 54.230.150.115 -> 172.31.29.138 TCP 13098 [TCP segment of a reassembled PDU]
 97   0.032210 172.31.29.138 -> 54.230.150.115 TCP 66 44093 > http [ACK] Seq=97 Ack=533322 Win=717440 Len=0 TSval=18642883 TSecr=447331731
 98   0.032343 54.230.150.115 -> 172.31.29.138 TCP 26130 [TCP segment of a reassembled PDU]
 99   0.032357 172.31.29.138 -> 54.230.150.115 TCP 66 44093 > http [ACK] Seq=97 Ack=559386 Win=696064 Len=0 TSval=18642883 TSecr=447331731
100   0.032386 54.230.150.115 -> 172.31.29.138 TCP 14546 [TCP segment of a reassembled PDU]
101   0.032392 172.31.29.138 -> 54.230.150.115 TCP 66 44093 > http [ACK] Seq=97 Ack=573866 Win=681600 Len=0 TSval=18642883 TSecr=447331731
102   0.032399 54.230.150.115 -> 172.31.29.138 TCP 4410 [TCP segment of a reassembled PDU]
103   0.032403 172.31.29.138 -> 54.230.150.115 TCP 66 44093 > http [ACK] Seq=97 Ack=578210 Win=677376 Len=0 TSval=18642883 TSecr=447331731
104   0.033489 54.230.150.115 -> 172.31.29.138 TCP 8754 [TCP segment of a reassembled PDU]
105   0.033497 172.31.29.138 -> 54.230.150.115 TCP 66 44093 > http [ACK] Seq=97 Ack=586898 Win=724608 Len=0 TSval=18642884 TSecr=447331731
106   0.033649 54.230.150.115 -> 172.31.29.138 TCP 23234 [TCP segment of a reassembled PDU]
107   0.033663 172.31.29.138 -> 54.230.150.115 TCP 66 44093 > http [ACK] Seq=97 Ack=610066 Win=727808 Len=0 TSval=18642884 TSecr=447331731
108   0.033758 54.230.150.115 -> 172.31.29.138 TCP 2962 [TCP segment of a reassembled PDU]
109   0.033763 172.31.29.138 -> 54.230.150.115 TCP 66 44093 > http [ACK] Seq=97 Ack=612962 Win=743936 Len=0 TSval=18642884 TSecr=447331731
110   0.034040 54.230.150.115 -> 172.31.29.138 TCP 26130 [TCP segment of a reassembled PDU]
111   0.034054 172.31.29.138 -> 54.230.150.115 TCP 66 44093 > http [ACK] Seq=97 Ack=639026 Win=723072 Len=0 TSval=18642884 TSecr=447331731
112   0.034068 54.230.150.115 -> 172.31.29.138 TCP 14546 [TCP segment of a reassembled PDU]
113   0.034079 172.31.29.138 -> 54.230.150.115 TCP 66 44093 > http [ACK] Seq=97 Ack=653506 Win=708608 Len=0 TSval=18642884 TSecr=447331731
114   0.035031 54.230.150.115 -> 172.31.29.138 TCP 11650 [TCP segment of a reassembled PDU]
115   0.035040 172.31.29.138 -> 54.230.150.115 TCP 66 44093 > http [ACK] Seq=97 Ack=665090 Win=746880 Len=0 TSval=18642884 TSecr=447331732
116   0.035153 54.230.150.115 -> 172.31.29.138 TCP 13098 [TCP segment of a reassembled PDU]
117   0.035162 172.31.29.138 -> 54.230.150.115 TCP 66 44093 > http [ACK] Seq=97 Ack=678122 Win=744576 Len=0 TSval=18642884 TSecr=447331732
118   0.035486 54.230.150.115 -> 172.31.29.138 TCP 1514 [TCP segment of a reassembled PDU]
119   0.035490 172.31.29.138 -> 54.230.150.115 TCP 66 44093 > http [ACK] Seq=97 Ack=679570 Win=763520 Len=0 TSval=18642884 TSecr=447331732
120   0.035752 54.230.150.115 -> 172.31.29.138 TCP 5858 [TCP segment of a reassembled PDU]
121   0.035767 172.31.29.138 -> 54.230.150.115 TCP 66 44093 > http [ACK] Seq=97 Ack=685362 Win=765952 Len=0 TSval=18642884 TSecr=447331732
122   0.035891 54.230.150.115 -> 172.31.29.138 TCP 26130 [TCP segment of a reassembled PDU]
123   0.035913 54.230.150.115 -> 172.31.29.138 TCP 14546 [TCP segment of a reassembled PDU]
124   0.035931 172.31.29.138 -> 54.230.150.115 TCP 66 44093 > http [ACK] Seq=97 Ack=725906 Win=725504 Len=0 TSval=18642884 TSecr=447331732
125   0.036266 54.230.150.115 -> 172.31.29.138 TCP 7306 [TCP segment of a reassembled PDU]
126   0.036274 172.31.29.138 -> 54.230.150.115 TCP 66 44093 > http [ACK] Seq=97 Ack=733146 Win=754048 Len=0 TSval=18642884 TSecr=447331732
127   0.036368 54.230.150.115 -> 172.31.29.138 TCP 10202 [TCP segment of a reassembled PDU]
128   0.036387 172.31.29.138 -> 54.230.150.115 TCP 66 44093 > http [ACK] Seq=97 Ack=743282 Win=765952 Len=0 TSval=18642884 TSecr=447331732
129   0.037009 54.230.150.115 -> 172.31.29.138 TCP 1514 [TCP segment of a reassembled PDU]
130   0.037156 54.230.150.115 -> 172.31.29.138 TCP 14546 [TCP segment of a reassembled PDU]
131   0.037176 172.31.29.138 -> 54.230.150.115 TCP 66 44093 > http [ACK] Seq=97 Ack=759210 Win=765952 Len=0 TSval=18642885 TSecr=447331732
132   0.037441 54.230.150.115 -> 172.31.29.138 TCP 26130 [TCP segment of a reassembled PDU]
133   0.037478 54.230.150.115 -> 172.31.29.138 TCP 23234 [TCP segment of a reassembled PDU]
134   0.037494 172.31.29.138 -> 54.230.150.115 TCP 66 44093 > http [ACK] Seq=97 Ack=808442 Win=716800 Len=0 TSval=18642885 TSecr=447331732
135   0.037783 54.230.150.115 -> 172.31.29.138 TCP 7306 [TCP segment of a reassembled PDU]
136   0.037790 172.31.29.138 -> 54.230.150.115 TCP 66 44093 > http [ACK] Seq=97 Ack=815682 Win=754048 Len=0 TSval=18642885 TSecr=447331732
137   0.037939 54.230.150.115 -> 172.31.29.138 TCP 26130 [TCP segment of a reassembled PDU]
138   0.037964 172.31.29.138 -> 54.230.150.115 TCP 66 44093 > http [ACK] Seq=97 Ack=841746 Win=728064 Len=0 TSval=18642885 TSecr=447331732
139   0.038828 54.230.150.115 -> 172.31.29.138 TCP 1514 [TCP segment of a reassembled PDU]
140   0.039012 54.230.150.115 -> 172.31.29.138 TCP 27578 [TCP segment of a reassembled PDU]
141   0.039037 54.230.150.115 -> 172.31.29.138 TCP 2962 [TCP segment of a reassembled PDU]
142   0.039047 172.31.29.138 -> 54.230.150.115 TCP 66 44093 > http [ACK] Seq=97 Ack=873602 Win=715776 Len=0 TSval=18642885 TSecr=447331732
143   0.039127 54.230.150.115 -> 172.31.29.138 TCP 36266 [TCP segment of a reassembled PDU]
144   0.039156 172.31.29.138 -> 54.230.150.115 TCP 66 44093 > http [ACK] Seq=97 Ack=909802 Win=706432 Len=0 TSval=18642885 TSecr=447331732
145   0.039468 54.230.150.115 -> 172.31.29.138 TCP 23234 [TCP segment of a reassembled PDU]
146   0.039480 172.31.29.138 -> 54.230.150.115 TCP 66 44093 > http [ACK] Seq=97 Ack=932970 Win=727808 Len=0 TSval=18642885 TSecr=447331732
147   0.039503 54.230.150.115 -> 172.31.29.138 TCP 5858 [TCP segment of a reassembled PDU]
148   0.039511 172.31.29.138 -> 54.230.150.115 TCP 66 44093 > http [ACK] Seq=97 Ack=938762 Win=722048 Len=0 TSval=18642885 TSecr=447331732
149   0.040593 54.230.150.115 -> 172.31.29.138 TCP 4410 [TCP segment of a reassembled PDU]
150   0.040599 172.31.29.138 -> 54.230.150.115 TCP 66 44093 > http [ACK] Seq=97 Ack=943106 Win=758784 Len=0 TSval=18642885 TSecr=447331732
151   0.040758 54.230.150.115 -> 172.31.29.138 TCP 26130 [TCP segment of a reassembled PDU]
