[Measurement for 1mb at 09:38:19 20.38.2014] 
Tshark:

  1   0.000000 172.31.29.138 -> 172.31.0.2   DNS 89 Standard query 0xc515  A d1n0gskdvzj94j.cloudfront.net
  2   0.000026 172.31.29.138 -> 172.31.0.2   DNS 89 Standard query 0x1b19  AAAA d1n0gskdvzj94j.cloudfront.net
  3   0.000755   172.31.0.2 -> 172.31.29.138 DNS 217 Standard query response 0xc515  A 54.230.150.12 A 54.230.150.16 A 54.230.150.23 A 54.230.150.78 A 54.230.150.220 A 54.230.151.236 A 204.246.164.163 A 54.230.149.215
  4   0.000878   172.31.0.2 -> 172.31.29.138 DNS 176 Standard query response 0x1b19 
  5   0.003876 172.31.29.138 -> 54.230.150.12 TCP 74 36275 > http [SYN] Seq=0 Win=26883 Len=0 MSS=8961 SACK_PERM=1 TSval=15042940 TSecr=0 WS=128
  6   0.005078 54.230.150.12 -> 172.31.29.138 TCP 74 http > 36275 [SYN, ACK] Seq=0 Ack=1 Win=14480 Len=0 MSS=1460 SACK_PERM=1 TSval=1455340543 TSecr=15042940 WS=128
  7   0.005093 172.31.29.138 -> 54.230.150.12 TCP 66 36275 > http [ACK] Seq=1 Ack=1 Win=27008 Len=0 TSval=15042940 TSecr=1455340543
  8   0.005132 172.31.29.138 -> 54.230.150.12 HTTP 162 GET /1mb HTTP/1.1 
  9   0.006582 54.230.150.12 -> 172.31.29.138 TCP 66 http > 36275 [ACK] Seq=1 Ack=97 Win=14592 Len=0 TSval=1455340543 TSecr=15042940
 10   0.008650 54.230.150.12 -> 172.31.29.138 TCP 523 [TCP segment of a reassembled PDU]
 11   0.008658 172.31.29.138 -> 54.230.150.12 TCP 66 36275 > http [ACK] Seq=97 Ack=458 Win=28032 Len=0 TSval=15042941 TSecr=1455340543
 12   0.008716 54.230.150.12 -> 172.31.29.138 TCP 13098 [TCP segment of a reassembled PDU]
 13   0.008727 172.31.29.138 -> 54.230.150.12 TCP 66 36275 > http [ACK] Seq=97 Ack=13490 Win=54144 Len=0 TSval=15042941 TSecr=1455340543
 14   0.010070 54.230.150.12 -> 172.31.29.138 TCP 4410 [TCP segment of a reassembled PDU]
 15   0.010077 172.31.29.138 -> 54.230.150.12 TCP 66 36275 > http [ACK] Seq=97 Ack=17834 Win=62720 Len=0 TSval=15042942 TSecr=1455340543
 16   0.010123 54.230.150.12 -> 172.31.29.138 TCP 8754 [TCP segment of a reassembled PDU]
 17   0.010130 172.31.29.138 -> 54.230.150.12 TCP 66 36275 > http [ACK] Seq=97 Ack=26522 Win=80128 Len=0 TSval=15042942 TSecr=1455340543
 18   0.011397 54.230.150.12 -> 172.31.29.138 TCP 5858 [TCP segment of a reassembled PDU]
 19   0.011404 172.31.29.138 -> 54.230.150.12 TCP 66 36275 > http [ACK] Seq=97 Ack=32314 Win=91776 Len=0 TSval=15042942 TSecr=1455340543
 20   0.011497 54.230.150.12 -> 172.31.29.138 TCP 14546 [TCP segment of a reassembled PDU]
 21   0.011506 172.31.29.138 -> 54.230.150.12 TCP 66 36275 > http [ACK] Seq=97 Ack=46794 Win=94080 Len=0 TSval=15042942 TSecr=1455340543
 22   0.012881 54.230.150.12 -> 172.31.29.138 TCP 4410 [TCP segment of a reassembled PDU]
 23   0.012888 172.31.29.138 -> 54.230.150.12 TCP 66 36275 > http [ACK] Seq=97 Ack=51138 Win=109056 Len=0 TSval=15042942 TSecr=1455340543
 24   0.012913 54.230.150.12 -> 172.31.29.138 TCP 1514 [TCP segment of a reassembled PDU]
 25   0.012916 172.31.29.138 -> 54.230.150.12 TCP 66 36275 > http [ACK] Seq=97 Ack=52586 Win=108416 Len=0 TSval=15042942 TSecr=1455340543
 26   0.013028 54.230.150.12 -> 172.31.29.138 TCP 13098 [TCP segment of a reassembled PDU]
 27   0.013037 172.31.29.138 -> 54.230.150.12 TCP 66 36275 > http [ACK] Seq=97 Ack=65618 Win=96512 Len=0 TSval=15042942 TSecr=1455340543
 28   0.014451 54.230.150.12 -> 172.31.29.138 TCP 11650 [TCP segment of a reassembled PDU]
 29   0.014460 172.31.29.138 -> 54.230.150.12 TCP 66 36275 > http [ACK] Seq=97 Ack=77202 Win=98944 Len=0 TSval=15042943 TSecr=1455340543
 30   0.014521 54.230.150.12 -> 172.31.29.138 TCP 15994 [TCP segment of a reassembled PDU]
 31   0.014531 172.31.29.138 -> 54.230.150.12 TCP 66 36275 > http [ACK] Seq=97 Ack=93130 Win=140928 Len=0 TSval=15042943 TSecr=1455340543
 32   0.015965 54.230.150.12 -> 172.31.29.138 TCP 11650 [TCP segment of a reassembled PDU]
 33   0.015974 172.31.29.138 -> 54.230.150.12 TCP 66 36275 > http [ACK] Seq=97 Ack=104714 Win=164096 Len=0 TSval=15042943 TSecr=1455340544
 34   0.016075 54.230.150.12 -> 172.31.29.138 TCP 18890 [TCP segment of a reassembled PDU]
 35   0.016087 172.31.29.138 -> 54.230.150.12 TCP 66 36275 > http [ACK] Seq=97 Ack=123538 Win=201728 Len=0 TSval=15042943 TSecr=1455340544
 36   0.017495 54.230.150.12 -> 172.31.29.138 TCP 7306 [TCP segment of a reassembled PDU]
 37   0.017502 172.31.29.138 -> 54.230.150.12 TCP 66 36275 > http [ACK] Seq=97 Ack=130778 Win=216192 Len=0 TSval=15042944 TSecr=1455340544
 38   0.017614 54.230.150.12 -> 172.31.29.138 TCP 26130 [TCP segment of a reassembled PDU]
 39   0.017626 172.31.29.138 -> 54.230.150.12 TCP 66 36275 > http [ACK] Seq=97 Ack=156842 Win=268288 Len=0 TSval=15042944 TSecr=1455340544
 40   0.019075 54.230.150.12 -> 172.31.29.138 TCP 4410 [TCP segment of a reassembled PDU]
 41   0.019083 172.31.29.138 -> 54.230.150.12 TCP 66 36275 > http [ACK] Seq=97 Ack=161186 Win=276992 Len=0 TSval=15042944 TSecr=1455340544
 42   0.019227 54.230.150.12 -> 172.31.29.138 TCP 21786 [TCP segment of a reassembled PDU]
 43   0.019237 172.31.29.138 -> 54.230.150.12 TCP 66 36275 > http [ACK] Seq=97 Ack=182906 Win=320512 Len=0 TSval=15042944 TSecr=1455340544
 44   0.020416 54.230.150.12 -> 172.31.29.138 TCP 14546 [TCP segment of a reassembled PDU]
 45   0.020427 172.31.29.138 -> 54.230.150.12 TCP 66 36275 > http [ACK] Seq=97 Ack=197386 Win=349440 Len=0 TSval=15042944 TSecr=1455340544
 46   0.020432 54.230.150.12 -> 172.31.29.138 TCP 1514 [TCP segment of a reassembled PDU]
 47   0.020435 172.31.29.138 -> 54.230.150.12 TCP 66 36275 > http [ACK] Seq=97 Ack=198834 Win=352384 Len=0 TSval=15042944 TSecr=1455340544
 48   0.020613 54.230.150.12 -> 172.31.29.138 TCP 10202 [TCP segment of a reassembled PDU]
 49   0.020621 172.31.29.138 -> 54.230.150.12 TCP 66 36275 > http [ACK] Seq=97 Ack=208970 Win=372608 Len=0 TSval=15042944 TSecr=1455340544
 50   0.020755 54.230.150.12 -> 172.31.29.138 TCP 13098 [TCP segment of a reassembled PDU]
 51   0.020763 172.31.29.138 -> 54.230.150.12 TCP 66 36275 > http [ACK] Seq=97 Ack=222002 Win=398720 Len=0 TSval=15042944 TSecr=1455340544
 52   0.021934 54.230.150.12 -> 172.31.29.138 TCP 15994 [TCP segment of a reassembled PDU]
 53   0.021945 172.31.29.138 -> 54.230.150.12 TCP 66 36275 > http [ACK] Seq=97 Ack=237930 Win=430464 Len=0 TSval=15042945 TSecr=1455340544
 54   0.022267 54.230.150.12 -> 172.31.29.138 TCP 17442 [TCP segment of a reassembled PDU]
 55   0.022278 172.31.29.138 -> 54.230.150.12 TCP 66 36275 > http [ACK] Seq=97 Ack=255306 Win=465280 Len=0 TSval=15042945 TSecr=1455340544
 56   0.023423 54.230.150.12 -> 172.31.29.138 TCP 10202 [TCP segment of a reassembled PDU]
 57   0.023432 172.31.29.138 -> 54.230.150.12 TCP 66 36275 > http [ACK] Seq=97 Ack=265442 Win=485504 Len=0 TSval=15042945 TSecr=1455340544
 58   0.023572 54.230.150.12 -> 172.31.29.138 TCP 18890 [TCP segment of a reassembled PDU]
 59   0.023583 172.31.29.138 -> 54.230.150.12 TCP 66 36275 > http [ACK] Seq=97 Ack=284266 Win=523136 Len=0 TSval=15042945 TSecr=1455340544
 60   0.023785 54.230.150.12 -> 172.31.29.138 TCP 17442 [TCP segment of a reassembled PDU]
 61   0.023796 172.31.29.138 -> 54.230.150.12 TCP 66 36275 > http [ACK] Seq=97 Ack=301642 Win=557952 Len=0 TSval=15042945 TSecr=1455340544
 62   0.025005 54.230.150.12 -> 172.31.29.138 TCP 23234 [TCP segment of a reassembled PDU]
 63   0.025030 172.31.29.138 -> 54.230.150.12 TCP 66 36275 > http [ACK] Seq=97 Ack=324810 Win=604288 Len=0 TSval=15042945 TSecr=1455340545
 64   0.025069 54.230.150.12 -> 172.31.29.138 TCP 10202 [TCP segment of a reassembled PDU]
 65   0.025076 172.31.29.138 -> 54.230.150.12 TCP 66 36275 > http [ACK] Seq=97 Ack=334946 Win=624512 Len=0 TSval=15042945 TSecr=1455340545
 66   0.025444 54.230.150.12 -> 172.31.29.138 TCP 18890 [TCP segment of a reassembled PDU]
 67   0.025455 172.31.29.138 -> 54.230.150.12 TCP 66 36275 > http [ACK] Seq=97 Ack=353770 Win=662144 Len=0 TSval=15042946 TSecr=1455340545
 68   0.026477 54.230.150.12 -> 172.31.29.138 TCP 5858 [TCP segment of a reassembled PDU]
 69   0.026484 172.31.29.138 -> 54.230.150.12 TCP 66 36275 > http [ACK] Seq=97 Ack=359562 Win=673792 Len=0 TSval=15042946 TSecr=1455340545
 70   0.026658 54.230.150.12 -> 172.31.29.138 TCP 26130 [TCP segment of a reassembled PDU]
 71   0.026671 172.31.29.138 -> 54.230.150.12 TCP 66 36275 > http [ACK] Seq=97 Ack=385626 Win=669056 Len=0 TSval=15042946 TSecr=1455340545
 72   0.026679 54.230.150.12 -> 172.31.29.138 TCP 4410 [TCP segment of a reassembled PDU]
 73   0.026683 172.31.29.138 -> 54.230.150.12 TCP 66 36275 > http [ACK] Seq=97 Ack=389970 Win=664832 Len=0 TSval=15042946 TSecr=1455340545
 74   0.026877 54.230.150.12 -> 172.31.29.138 TCP 20338 [TCP segment of a reassembled PDU]
 75   0.026889 172.31.29.138 -> 54.230.150.12 TCP 66 36275 > http [ACK] Seq=97 Ack=410242 Win=678528 Len=0 TSval=15042946 TSecr=1455340545
 76   0.028008 54.230.150.12 -> 172.31.29.138 TCP 8754 [TCP segment of a reassembled PDU]
 77   0.028015 172.31.29.138 -> 54.230.150.12 TCP 66 36275 > http [ACK] Seq=97 Ack=418930 Win=697600 Len=0 TSval=15042946 TSecr=1455340545
 78   0.028138 54.230.150.12 -> 172.31.29.138 TCP 13098 [TCP segment of a reassembled PDU]
 79   0.028147 172.31.29.138 -> 54.230.150.12 TCP 66 36275 > http [ACK] Seq=97 Ack=431962 Win=690432 Len=0 TSval=15042946 TSecr=1455340545
 80   0.028404 54.230.150.12 -> 172.31.29.138 TCP 20338 [TCP segment of a reassembled PDU]
 81   0.028415 172.31.29.138 -> 54.230.150.12 TCP 66 36275 > http [ACK] Seq=97 Ack=452234 Win=678528 Len=0 TSval=15042946 TSecr=1455340545
 82   0.028423 54.230.150.12 -> 172.31.29.138 TCP 1514 [TCP Previous segment not captured] [TCP segment of a reassembled PDU]
 83   0.028426 172.31.29.138 -> 54.230.150.12 TCP 78 [TCP Dup ACK 81#1] 36275 > http [ACK] Seq=97 Ack=452234 Win=678528 Len=0 TSval=15042946 TSecr=1455340545 SLE=453682 SRE=455130
 84   0.028428 54.230.150.12 -> 172.31.29.138 TCP 1514 [TCP Out-Of-Order] [TCP segment of a reassembled PDU]
 85   0.028431 172.31.29.138 -> 54.230.150.12 TCP 66 36275 > http [ACK] Seq=97 Ack=455130 Win=675712 Len=0 TSval=15042946 TSecr=1455340545
 86   0.028558 54.230.150.12 -> 172.31.29.138 TCP 17442 [TCP segment of a reassembled PDU]
 87   0.028568 172.31.29.138 -> 54.230.150.12 TCP 66 36275 > http [ACK] Seq=97 Ack=472506 Win=683264 Len=0 TSval=15042946 TSecr=1455340545
 88   0.029648 54.230.150.12 -> 172.31.29.138 TCP 8754 [TCP segment of a reassembled PDU]
 89   0.029656 172.31.29.138 -> 54.230.150.12 TCP 66 36275 > http [ACK] Seq=97 Ack=481194 Win=697600 Len=0 TSval=15042947 TSecr=1455340545
 90   0.029790 54.230.150.12 -> 172.31.29.138 TCP 15994 [TCP segment of a reassembled PDU]
 91   0.029800 172.31.29.138 -> 54.230.150.12 TCP 66 36275 > http [ACK] Seq=97 Ack=497122 Win=685568 Len=0 TSval=15042947 TSecr=1455340545
 92   0.029881 54.230.150.12 -> 172.31.29.138 TCP 4410 [TCP segment of a reassembled PDU]
 93   0.029886 172.31.29.138 -> 54.230.150.12 TCP 66 36275 > http [ACK] Seq=97 Ack=501466 Win=704640 Len=0 TSval=15042947 TSecr=1455340545
 94   0.030078 54.230.150.12 -> 172.31.29.138 TCP 21786 [TCP segment of a reassembled PDU]
 95   0.030091 172.31.29.138 -> 54.230.150.12 TCP 66 36275 > http [ACK] Seq=97 Ack=523186 Win=683008 Len=0 TSval=15042947 TSecr=1455340545
 96   0.031182 54.230.150.12 -> 172.31.29.138 TCP 8754 [TCP segment of a reassembled PDU]
 97   0.031189 172.31.29.138 -> 54.230.150.12 TCP 66 36275 > http [ACK] Seq=97 Ack=531874 Win=697600 Len=0 TSval=15042947 TSecr=1455340545
 98   0.031313 54.230.150.12 -> 172.31.29.138 TCP 11650 [TCP segment of a reassembled PDU]
 99   0.031321 172.31.29.138 -> 54.230.150.12 TCP 66 36275 > http [ACK] Seq=97 Ack=543458 Win=692864 Len=0 TSval=15042947 TSecr=1455340545
100   0.031326 54.230.150.12 -> 172.31.29.138 TCP 1514 [TCP Previous segment not captured] [TCP segment of a reassembled PDU]
101   0.031329 172.31.29.138 -> 54.230.150.12 TCP 78 [TCP Dup ACK 99#1] 36275 > http [ACK] Seq=97 Ack=543458 Win=692864 Len=0 TSval=15042947 TSecr=1455340545 SLE=544906 SRE=546354
102   0.031342 54.230.150.12 -> 172.31.29.138 TCP 1514 [TCP Out-Of-Order] [TCP segment of a reassembled PDU]
103   0.031345 172.31.29.138 -> 54.230.150.12 TCP 66 36275 > http [ACK] Seq=97 Ack=546354 Win=690048 Len=0 TSval=15042947 TSecr=1455340545
104   0.031407 54.230.150.12 -> 172.31.29.138 TCP 4410 [TCP segment of a reassembled PDU]
105   0.031413 172.31.29.138 -> 54.230.150.12 TCP 66 36275 > http [ACK] Seq=97 Ack=550698 Win=704640 Len=0 TSval=15042947 TSecr=1455340545
106   0.031445 54.230.150.12 -> 172.31.29.138 TCP 7306 [TCP segment of a reassembled PDU]
107   0.031452 172.31.29.138 -> 54.230.150.12 TCP 66 36275 > http [ACK] Seq=97 Ack=557938 Win=699904 Len=0 TSval=15042947 TSecr=1455340545
108   0.031566 54.230.150.12 -> 172.31.29.138 TCP 4410 [TCP segment of a reassembled PDU]
109   0.031571 172.31.29.138 -> 54.230.150.12 TCP 66 36275 > http [ACK] Seq=97 Ack=562282 Win=704640 Len=0 TSval=15042947 TSecr=1455340545
110   0.032769 54.230.150.12 -> 172.31.29.138 TCP 7306 [TCP segment of a reassembled PDU]
111   0.032775 172.31.29.138 -> 54.230.150.12 TCP 66 36275 > http [ACK] Seq=97 Ack=569522 Win=699904 Len=0 TSval=15042947 TSecr=1455340545
112   0.032962 54.230.150.12 -> 172.31.29.138 TCP 24682 [TCP segment of a reassembled PDU]
113   0.032975 172.31.29.138 -> 54.230.150.12 TCP 66 36275 > http [ACK] Seq=97 Ack=594138 Win=675328 Len=0 TSval=15042947 TSecr=1455340545
114   0.032984 54.230.150.12 -> 172.31.29.138 TCP 1514 [TCP segment of a reassembled PDU]
115   0.032986 172.31.29.138 -> 54.230.150.12 TCP 66 36275 > http [ACK] Seq=97 Ack=595586 Win=673920 Len=0 TSval=15042947 TSecr=1455340545
116   0.033059 54.230.150.12 -> 172.31.29.138 TCP 21786 [TCP segment of a reassembled PDU]
117   0.033071 172.31.29.138 -> 54.230.150.12 TCP 66 36275 > http [ACK] Seq=97 Ack=617306 Win=676096 Len=0 TSval=15042947 TSecr=1455340545
118   0.034544 54.230.150.12 -> 172.31.29.138 TCP 5858 [TCP segment of a reassembled PDU]
119   0.034551 172.31.29.138 -> 54.230.150.12 TCP 66 36275 > http [ACK] Seq=97 Ack=623098 Win=702336 Len=0 TSval=15042948 TSecr=1455340545
120   0.034713 54.230.150.12 -> 172.31.29.138 TCP 26130 [TCP segment of a reassembled PDU]
121   0.034726 172.31.29.138 -> 54.230.150.12 TCP 66 36275 > http [ACK] Seq=97 Ack=649162 Win=676352 Len=0 TSval=15042948 TSecr=1455340545
122   0.034736 54.230.150.12 -> 172.31.29.138 TCP 7306 [TCP segment of a reassembled PDU]
123   0.034740 172.31.29.138 -> 54.230.150.12 TCP 66 36275 > http [ACK] Seq=97 Ack=656402 Win=669184 Len=0 TSval=15042948 TSecr=1455340545
124   0.034776 54.230.150.12 -> 172.31.29.138 TCP 18890 [TCP segment of a reassembled PDU]
125   0.034787 172.31.29.138 -> 54.230.150.12 TCP 66 36275 > http [ACK] Seq=97 Ack=675226 Win=668928 Len=0 TSval=15042948 TSecr=1455340545
126   0.034828 54.230.150.12 -> 172.31.29.138 TCP 2962 [TCP segment of a reassembled PDU]
127   0.034846 172.31.29.138 -> 54.230.150.12 TCP 66 36275 > http [ACK] Seq=97 Ack=678122 Win=707072 Len=0 TSval=15042948 TSecr=1455340545
128   0.036405 54.230.150.12 -> 172.31.29.138 TCP 7306 [TCP segment of a reassembled PDU]
129   0.036420 172.31.29.138 -> 54.230.150.12 TCP 66 36275 > http [ACK] Seq=97 Ack=685362 Win=699904 Len=0 TSval=15042948 TSecr=1455340546
130   0.036565 54.230.150.12 -> 172.31.29.138 TCP 26130 [TCP segment of a reassembled PDU]
131   0.036578 172.31.29.138 -> 54.230.150.12 TCP 66 36275 > http [ACK] Seq=97 Ack=711426 Win=673920 Len=0 TSval=15042948 TSecr=1455340546
132   0.036708 54.230.150.12 -> 172.31.29.138 TCP 34818 [TCP segment of a reassembled PDU]
133   0.036737 172.31.29.138 -> 54.230.150.12 TCP 66 36275 > http [ACK] Seq=97 Ack=746178 Win=654720 Len=0 TSval=15042948 TSecr=1455340546
134   0.038164 54.230.150.12 -> 172.31.29.138 TCP 1514 [TCP segment of a reassembled PDU]
135   0.038309 54.230.150.12 -> 172.31.29.138 TCP 10202 [TCP segment of a reassembled PDU]
136   0.038317 172.31.29.138 -> 54.230.150.12 TCP 66 36275 > http [ACK] Seq=97 Ack=757762 Win=695168 Len=0 TSval=15042949 TSecr=1455340546
137   0.038418 54.230.150.12 -> 172.31.29.138 TCP 24682 [TCP segment of a reassembled PDU]
138   0.038442 172.31.29.138 -> 54.230.150.12 TCP 66 36275 > http [ACK] Seq=97 Ack=782378 Win=671360 Len=0 TSval=15042949 TSecr=1455340546
139   0.038692 54.230.150.12 -> 172.31.29.138 TCP 5858 [TCP segment of a reassembled PDU]
140   0.038698 172.31.29.138 -> 54.230.150.12 TCP 66 36275 > http [ACK] Seq=97 Ack=788170 Win=702336 Len=0 TSval=15042949 TSecr=1455340546
141   0.038875 54.230.150.12 -> 172.31.29.138 TCP 26130 [TCP segment of a reassembled PDU]
142   0.038891 54.230.150.12 -> 172.31.29.138 TCP 4410 [TCP segment of a reassembled PDU]
143   0.038907 172.31.29.138 -> 54.230.150.12 TCP 66 36275 > http [ACK] Seq=97 Ack=818578 Win=672000 Len=0 TSval=15042949 TSecr=1455340546
144   0.039710 54.230.150.12 -> 172.31.29.138 TCP 4410 [TCP segment of a reassembled PDU]
145   0.039716 172.31.29.138 -> 54.230.150.12 TCP 66 36275 > http [ACK] Seq=97 Ack=822922 Win=704640 Len=0 TSval=15042949 TSecr=1455340546
146   0.039976 54.230.150.12 -> 172.31.29.138 TCP 5858 [TCP segment of a reassembled PDU]
147   0.039992 172.31.29.138 -> 54.230.150.12 TCP 66 36275 > http [ACK] Seq=97 Ack=828714 Win=711936 Len=0 TSval=15042949 TSecr=1455340546
148   0.040107 54.230.150.12 -> 172.31.29.138 TCP 29026 [TCP segment of a reassembled PDU]
149   0.040133 172.31.29.138 -> 54.230.150.12 TCP 66 36275 > http [ACK] Seq=97 Ack=857674 Win=683008 Len=0 TSval=15042949 TSecr=1455340546
150   0.040579 54.230.150.12 -> 172.31.29.138 TCP 18890 [TCP segment of a reassembled PDU]
151   0.040603 172.31.29.138 -> 54.230.150.12 TCP 66 36275 > http [ACK] Seq=97 Ack=876498 Win=680832 Len=0 TSval=15042949 TSecr=1455340546
152   0.040711 54.230.150.12 -> 172.31.29.138 TCP 11650 [TCP segment of a reassembled PDU]
153   0.040736 172.31.29.138 -> 54.230.150.12 TCP 66 36275 > http [ACK] Seq=97 Ack=888082 Win=692864 Len=0 TSval=15042949 TSecr=1455340546
154   0.041809 54.230.150.12 -> 172.31.29.138 TCP 4410 [TCP segment of a reassembled PDU]
155   0.041814 172.31.29.138 -> 54.230.150.12 TCP 66 36275 > http [ACK] Seq=97 Ack=892426 Win=704640 Len=0 TSval=15042950 TSecr=1455340546
156   0.041954 54.230.150.12 -> 172.31.29.138 TCP 26130 [TCP segment of a reassembled PDU]
157   0.041979 172.31.29.138 -> 54.230.150.12 TCP 66 36275 > http [ACK] Seq=97 Ack=918490 Win=678656 Len=0 TSval=15042950 TSecr=1455340546
158   0.042017 54.230.150.12 -> 172.31.29.138 TCP 20338 [TCP segment of a reassembled PDU]
159   0.042036 172.31.29.138 -> 54.230.150.12 TCP 66 36275 > http [ACK] Seq=97 Ack=938762 Win=678528 Len=0 TSval=15042950 TSecr=1455340546
160   0.042047 54.230.150.12 -> 172.31.29.138 TCP 1514 [TCP segment of a reassembled PDU]
161   0.042323 54.230.150.12 -> 172.31.29.138 TCP 13098 [TCP segment of a reassembled PDU]
162   0.042333 172.31.29.138 -> 54.230.150.12 TCP 66 36275 > http [ACK] Seq=97 Ack=953242 Win=690432 Len=0 TSval=15042950 TSecr=1455340546
163   0.043543 54.230.150.12 -> 172.31.29.138 TCP 8754 [TCP segment of a reassembled PDU]
164   0.043552 172.31.29.138 -> 54.230.150.12 TCP 66 36275 > http [ACK] Seq=97 Ack=961930 Win=697600 Len=0 TSval=15042950 TSecr=1455340546
165   0.043684 54.230.150.12 -> 172.31.29.138 TCP 17442 [TCP segment of a reassembled PDU]
166   0.043694 54.230.150.12 -> 172.31.29.138 TCP 1514 [TCP Previous segment not captured] [TCP segment of a reassembled PDU]
167   0.043698 172.31.29.138 -> 54.230.150.12 TCP 78 36275 > http [ACK] Seq=97 Ack=979306 Win=680704 Len=0 TSval=15042950 TSecr=1455340546 SLE=980754 SRE=982202
168   0.043703 54.230.150.12 -> 172.31.29.138 TCP 1514 [TCP Out-Of-Order] [TCP segment of a reassembled PDU]
169   0.043706 172.31.29.138 -> 54.230.150.12 TCP 66 36275 > http [ACK] Seq=97 Ack=982202 Win=678272 Len=0 TSval=15042950 TSecr=1455340546
170   0.043858 54.230.150.12 -> 172.31.29.138 TCP 18890 [TCP segment of a reassembled PDU]
171   0.043870 172.31.29.138 -> 54.230.150.12 TCP 66 36275 > http [ACK] Seq=97 Ack=1001026 Win=680832 Len=0 TSval=15042950 TSecr=1455340546
172   0.043895 54.230.150.12 -> 172.31.29.138 TCP 7306 [TCP segment of a reassembled PDU]
173   0.043902 172.31.29.138 -> 54.230.150.12 TCP 66 36275 > http [ACK] Seq=97 Ack=1008266 Win=673664 Len=0 TSval=15042950 TSecr=1455340546
174   0.043947 54.230.150.12 -> 172.31.29.138 TCP 10202 [TCP segment of a reassembled PDU]
175   0.043955 172.31.29.138 -> 54.230.150.12 TCP 66 36275 > http [ACK] Seq=97 Ack=1018402 Win=695168 Len=0 TSval=15042950 TSecr=1455340546
176   0.045100 54.230.150.12 -> 172.31.29.138 TCP 2962 [TCP segment of a reassembled PDU]
177   0.045105 172.31.29.138 -> 54.230.150.12 TCP 66 36275 > http [ACK] Seq=97 Ack=1021298 Win=707072 Len=0 TSval=15042950 TSecr=1455340547
178   0.045283 54.230.150.12 -> 172.31.29.138 TCP 24682 [TCP segment of a reassembled PDU]
179   0.045292 172.31.29.138 -> 54.230.150.12 TCP 66 36275 > http [ACK] Seq=97 Ack=1045914 Win=682496 Len=0 TSval=15042950 TSecr=1455340547
180   0.045298 54.230.150.12 -> 172.31.29.138 TCP 1738 [TCP Previous segment not captured] [TCP segment of a reassembled PDU]
181   0.045301 172.31.29.138 -> 54.230.150.12 TCP 78 [TCP Dup ACK 179#1] 36275 > http [ACK] Seq=97 Ack=1045914 Win=682496 Len=0 TSval=15042950 TSecr=1455340547 SLE=1047362 SRE=1049034
182   0.045307 54.230.150.12 -> 172.31.29.138 HTTP 1514 [TCP Out-Of-Order] HTTP/1.1 200 OK  (application/octet-stream)
183   0.045310 172.31.29.138 -> 54.230.150.12 TCP 66 36275 > http [ACK] Seq=97 Ack=1049034 Win=679424 Len=0 TSval=15042950 TSecr=1455340547
184   0.045464 172.31.29.138 -> 54.230.150.12 TCP 66 36275 > http [FIN, ACK] Seq=97 Ack=1049034 Win=711936 Len=0 TSval=15042950 TSecr=1455340547
185   0.047401 54.230.150.12 -> 172.31.29.138 TCP 66 http > 36275 [FIN, ACK] Seq=1049034 Ack=98 Win=14592 Len=0 TSval=1455340547 TSecr=15042950
186   0.047410 172.31.29.138 -> 54.230.150.12 TCP 66 36275 > http [ACK] Seq=98 Ack=1049035 Win=711936 Len=0 TSval=15042951 TSecr=1455340547
