[Measurement for 100kb at 22:33:23 19.33.2014] 
Tshark:

  1   0.000000 172.31.36.109 -> 172.31.0.2   DNS 89 Standard query 0x94b2  A d1n0gskdvzj94j.cloudfront.net
  2   0.000040 172.31.36.109 -> 172.31.0.2   DNS 89 Standard query 0x42e0  AAAA d1n0gskdvzj94j.cloudfront.net
  3   0.000508   172.31.0.2 -> 172.31.36.109 DNS 176 Standard query response 0x42e0 
  4   0.000518   172.31.0.2 -> 172.31.36.109 DNS 217 Standard query response 0x94b2  A 54.230.184.78 A 54.230.184.223 A 54.230.185.61 A 54.230.186.26 A 54.230.187.34 A 54.239.158.96 A 54.239.158.213 A 54.239.158.244
  5   0.003812 172.31.36.109 -> 54.230.184.78 TCP 74 41326 > http [SYN] Seq=0 Win=26883 Len=0 MSS=8961 SACK_PERM=1 TSval=25022428 TSecr=0 WS=128
  6   0.021717 54.230.184.78 -> 172.31.36.109 TCP 74 http > 41326 [SYN, ACK] Seq=0 Ack=1 Win=14480 Len=0 MSS=1460 SACK_PERM=1 TSval=1392513559 TSecr=25022428 WS=128
  7   0.021732 172.31.36.109 -> 54.230.184.78 TCP 66 41326 > http [ACK] Seq=1 Ack=1 Win=27008 Len=0 TSval=25022433 TSecr=1392513559
  8   0.021778 172.31.36.109 -> 54.230.184.78 HTTP 164 GET /100kb HTTP/1.1 
  9   0.039947 54.230.184.78 -> 172.31.36.109 TCP 66 http > 41326 [ACK] Seq=1 Ack=99 Win=14592 Len=0 TSval=1392513561 TSecr=25022433
 10   0.269156 54.230.184.78 -> 172.31.36.109 TCP 13098 [TCP segment of a reassembled PDU]
 11   0.269181 172.31.36.109 -> 54.230.184.78 TCP 66 41326 > http [ACK] Seq=99 Ack=13033 Win=52992 Len=0 TSval=25022495 TSecr=1392513584
 12   0.287506 54.230.184.78 -> 172.31.36.109 TCP 1957 [TCP segment of a reassembled PDU]
 13   0.287518 172.31.36.109 -> 54.230.184.78 TCP 66 41326 > http [ACK] Seq=99 Ack=14924 Win=56832 Len=0 TSval=25022499 TSecr=1392513586
 14   0.442465 54.230.184.78 -> 172.31.36.109 TCP 1514 [TCP segment of a reassembled PDU]
 15   0.442490 172.31.36.109 -> 54.230.184.78 TCP 66 41326 > http [ACK] Seq=99 Ack=16372 Win=59648 Len=0 TSval=25022538 TSecr=1392513601
 16   0.442708 54.230.184.78 -> 172.31.36.109 TCP 2962 [TCP segment of a reassembled PDU]
 17   0.442715 172.31.36.109 -> 54.230.184.78 TCP 66 41326 > http [ACK] Seq=99 Ack=19268 Win=65536 Len=0 TSval=25022538 TSecr=1392513601
 18   0.442724 54.230.184.78 -> 172.31.36.109 TCP 2998 [TCP segment of a reassembled PDU]
 19   0.442728 172.31.36.109 -> 54.230.184.78 TCP 66 41326 > http [ACK] Seq=99 Ack=22200 Win=71296 Len=0 TSval=25022538 TSecr=1392513601
 20   0.443229 54.230.184.78 -> 172.31.36.109 TCP 7306 [TCP segment of a reassembled PDU]
 21   0.443246 172.31.36.109 -> 54.230.184.78 TCP 66 41326 > http [ACK] Seq=99 Ack=29440 Win=85888 Len=0 TSval=25022538 TSecr=1392513601
 22   0.460923 54.230.184.78 -> 172.31.36.109 TCP 7306 [TCP segment of a reassembled PDU]
 23   0.460940 172.31.36.109 -> 54.230.184.78 TCP 66 41326 > http [ACK] Seq=99 Ack=36680 Win=100352 Len=0 TSval=25022543 TSecr=1392513603
 24   0.461402 54.230.184.78 -> 172.31.36.109 TCP 10430 [TCP segment of a reassembled PDU]
 25   0.461411 172.31.36.109 -> 54.230.184.78 TCP 66 41326 > http [ACK] Seq=99 Ack=47044 Win=98944 Len=0 TSval=25022543 TSecr=1392513603
 26   0.619144 54.230.184.78 -> 172.31.36.109 TCP 7306 [TCP segment of a reassembled PDU]
 27   0.619169 172.31.36.109 -> 54.230.184.78 TCP 66 41326 > http [ACK] Seq=99 Ack=54284 Win=105984 Len=0 TSval=25022582 TSecr=1392513619
 28   0.619364 54.230.184.78 -> 172.31.36.109 TCP 15994 [TCP segment of a reassembled PDU]
 29   0.619376 172.31.36.109 -> 54.230.184.78 TCP 66 41326 > http [ACK] Seq=99 Ack=70212 Win=91648 Len=0 TSval=25022582 TSecr=1392513619
 30   0.637312 54.230.184.78 -> 172.31.36.109 TCP 8754 [TCP segment of a reassembled PDU]
 31   0.637319 172.31.36.109 -> 54.230.184.78 TCP 66 41326 > http [ACK] Seq=99 Ack=78900 Win=103680 Len=0 TSval=25022587 TSecr=1392513621
 32   0.637479 54.230.184.78 -> 172.31.36.109 TCP 330 [TCP segment of a reassembled PDU]
 33   0.637484 172.31.36.109 -> 54.230.184.78 TCP 66 41326 > http [ACK] Seq=99 Ack=79164 Win=109056 Len=0 TSval=25022587 TSecr=1392513621
 34   0.793818 54.230.184.78 -> 172.31.36.109 TCP 1514 [TCP segment of a reassembled PDU]
