[Measurement for 100kb at 23:33:25 19.33.2014] 
Tshark:

  1   0.000000 172.31.36.109 -> 172.31.0.2   DNS 89 Standard query 0x9d6c  A d1n0gskdvzj94j.cloudfront.net
  2   0.000038 172.31.36.109 -> 172.31.0.2   DNS 89 Standard query 0xe3d3  AAAA d1n0gskdvzj94j.cloudfront.net
  3   0.000458   172.31.0.2 -> 172.31.36.109 DNS 176 Standard query response 0xe3d3 
  4   0.000475   172.31.0.2 -> 172.31.36.109 DNS 217 Standard query response 0x9d6c  A 54.239.158.150 A 54.239.158.207 A 54.239.158.232 A 54.239.158.238 A 54.230.185.176 A 54.230.186.217 A 54.230.187.34 A 54.230.187.123
  5   0.003879 172.31.36.109 -> 54.239.158.150 TCP 74 44946 > http [SYN] Seq=0 Win=26883 Len=0 MSS=8961 SACK_PERM=1 TSval=25923030 TSecr=0 WS=128
  6   0.022036 54.239.158.150 -> 172.31.36.109 TCP 74 http > 44946 [SYN, ACK] Seq=0 Ack=1 Win=14480 Len=0 MSS=1460 SACK_PERM=1 TSval=1258777984 TSecr=25923030 WS=128
  7   0.022050 172.31.36.109 -> 54.239.158.150 TCP 66 44946 > http [ACK] Seq=1 Ack=1 Win=27008 Len=0 TSval=25923035 TSecr=1258777984
  8   0.022092 172.31.36.109 -> 54.239.158.150 HTTP 164 GET /100kb HTTP/1.1 
  9   0.040251 54.239.158.150 -> 172.31.36.109 TCP 66 http > 44946 [ACK] Seq=1 Ack=99 Win=14592 Len=0 TSval=1258777985 TSecr=25923035
 10   0.051270 54.239.158.150 -> 172.31.36.109 TCP 13098 [TCP segment of a reassembled PDU]
 11   0.051283 172.31.36.109 -> 54.239.158.150 TCP 66 44946 > http [ACK] Seq=99 Ack=13033 Win=52992 Len=0 TSval=25923042 TSecr=1258777986
 12   0.051460 54.239.158.150 -> 172.31.36.109 TCP 1514 [TCP segment of a reassembled PDU]
 13   0.051466 172.31.36.109 -> 54.239.158.150 TCP 66 44946 > http [ACK] Seq=99 Ack=14481 Win=55936 Len=0 TSval=25923042 TSecr=1258777987
 14   0.069361 54.239.158.150 -> 172.31.36.109 TCP 13098 [TCP segment of a reassembled PDU]
 15   0.069373 172.31.36.109 -> 54.239.158.150 TCP 66 44946 > http [ACK] Seq=99 Ack=27513 Win=81920 Len=0 TSval=25923047 TSecr=1258777988
 16   0.087651 54.239.158.150 -> 172.31.36.109 TCP 13098 [TCP segment of a reassembled PDU]
 17   0.087661 172.31.36.109 -> 54.239.158.150 TCP 66 44946 > http [ACK] Seq=99 Ack=40545 Win=96512 Len=0 TSval=25923051 TSecr=1258777990
 18   0.105638 54.239.158.150 -> 172.31.36.109 TCP 10202 [TCP segment of a reassembled PDU]
 19   0.105657 172.31.36.109 -> 54.239.158.150 TCP 66 44946 > http [ACK] Seq=99 Ack=50681 Win=128256 Len=0 TSval=25923056 TSecr=1258777992
 20   0.105790 54.239.158.150 -> 172.31.36.109 TCP 4410 [TCP segment of a reassembled PDU]
 21   0.105796 172.31.36.109 -> 54.239.158.150 TCP 66 44946 > http [ACK] Seq=99 Ack=55025 Win=136960 Len=0 TSval=25923056 TSecr=1258777992
 22   0.105857 54.239.158.150 -> 172.31.36.109 TCP 5858 [TCP segment of a reassembled PDU]
 23   0.105863 172.31.36.109 -> 54.239.158.150 TCP 66 44946 > http [ACK] Seq=99 Ack=60817 Win=148608 Len=0 TSval=25923056 TSecr=1258777992
 24   0.123802 54.239.158.150 -> 172.31.36.109 TCP 1514 [TCP segment of a reassembled PDU]
 25   0.123813 172.31.36.109 -> 54.239.158.150 TCP 66 44946 > http [ACK] Seq=99 Ack=62265 Win=151424 Len=0 TSval=25923060 TSecr=1258777994
 26   0.123960 54.239.158.150 -> 172.31.36.109 TCP 2962 [TCP segment of a reassembled PDU]
 27   0.123966 172.31.36.109 -> 54.239.158.150 TCP 66 44946 > http [ACK] Seq=99 Ack=65161 Win=157312 Len=0 TSval=25923060 TSecr=1258777994
 28   0.124070 54.239.158.150 -> 172.31.36.109 TCP 14546 [TCP segment of a reassembled PDU]
 29   0.124080 172.31.36.109 -> 54.239.158.150 TCP 66 44946 > http [ACK] Seq=99 Ack=79641 Win=174336 Len=0 TSval=25923060 TSecr=1258777994
 30   0.142197 54.239.158.150 -> 172.31.36.109 TCP 8754 [TCP segment of a reassembled PDU]
 31   0.142214 172.31.36.109 -> 54.239.158.150 TCP 66 44946 > http [ACK] Seq=99 Ack=88329 Win=183936 Len=0 TSval=25923065 TSecr=1258777996
 32   0.142419 54.239.158.150 -> 172.31.36.109 TCP 5858 [TCP segment of a reassembled PDU]
 33   0.142425 172.31.36.109 -> 54.239.158.150 TCP 66 44946 > http [ACK] Seq=99 Ack=94121 Win=188672 Len=0 TSval=25923065 TSecr=1258777996
 34   0.142508 54.239.158.150 -> 172.31.36.109 TCP 8754 [TCP segment of a reassembled PDU]
 35   0.142516 172.31.36.109 -> 54.239.158.150 TCP 66 44946 > http [ACK] Seq=99 Ack=102809 Win=183936 Len=0 TSval=25923065 TSecr=1258777996
 36   0.142521 54.239.158.150 -> 172.31.36.109 HTTP 113 HTTP/1.1 200 OK  (application/octet-stream)
 37   0.142523 172.31.36.109 -> 54.239.158.150 TCP 66 44946 > http [ACK] Seq=99 Ack=102856 Win=183936 Len=0 TSval=25923065 TSecr=1258777996
 38   0.142670 172.31.36.109 -> 54.239.158.150 TCP 66 44946 > http [FIN, ACK] Seq=99 Ack=102856 Win=197760 Len=0 TSval=25923065 TSecr=1258777996
 39   0.160897 54.239.158.150 -> 172.31.36.109 TCP 66 http > 44946 [FIN, ACK] Seq=102856 Ack=100 Win=14592 Len=0 TSval=1258777997 TSecr=25923065
 40   0.160915 172.31.36.109 -> 54.239.158.150 TCP 66 44946 > http [ACK] Seq=100 Ack=102857 Win=197760 Len=0 TSval=25923070 TSecr=1258777997
