[Measurement for 100kb at 13:34:10 20.34.2014] 
Tshark:

  1   0.000000 172.31.36.109 -> 172.31.0.2   DNS 89 Standard query 0x1d7b  A d1n0gskdvzj94j.cloudfront.net
  2   0.000038 172.31.36.109 -> 172.31.0.2   DNS 89 Standard query 0x80cc  AAAA d1n0gskdvzj94j.cloudfront.net
  3   0.000471   172.31.0.2 -> 172.31.36.109 DNS 217 Standard query response 0x1d7b  A 216.137.41.10 A 54.230.20.101 A 54.230.21.222 A 54.230.22.127 A 54.230.22.245 A 54.230.23.48 A 54.230.23.144 A 54.230.23.210
  4   0.000482   172.31.0.2 -> 172.31.36.109 DNS 176 Standard query response 0x80cc 
  5   0.003873 172.31.36.109 -> 216.137.41.10 TCP 74 41119 > http [SYN] Seq=0 Win=26883 Len=0 MSS=8961 SACK_PERM=1 TSval=38534155 TSecr=0 WS=128
  6   0.090727 216.137.41.10 -> 172.31.36.109 TCP 74 http > 41119 [SYN, ACK] Seq=0 Ack=1 Win=14480 Len=0 MSS=1460 SACK_PERM=1 TSval=834801935 TSecr=38534155 WS=128
  7   0.090763 172.31.36.109 -> 216.137.41.10 TCP 66 41119 > http [ACK] Seq=1 Ack=1 Win=27008 Len=0 TSval=38534176 TSecr=834801935
  8   0.090880 172.31.36.109 -> 216.137.41.10 HTTP 164 GET /100kb HTTP/1.1 
  9   0.177540 216.137.41.10 -> 172.31.36.109 TCP 66 http > 41119 [ACK] Seq=1 Ack=99 Win=14592 Len=0 TSval=834801944 TSecr=38534176
 10   0.181642 216.137.41.10 -> 172.31.36.109 TCP 1144 [TCP segment of a reassembled PDU]
 11   0.181657 172.31.36.109 -> 216.137.41.10 TCP 66 41119 > http [ACK] Seq=99 Ack=1079 Win=29056 Len=0 TSval=38534199 TSecr=834801944
 12   0.181696 216.137.41.10 -> 172.31.36.109 TCP 7306 [TCP segment of a reassembled PDU]
 13   0.181704 172.31.36.109 -> 216.137.41.10 TCP 66 41119 > http [ACK] Seq=99 Ack=8319 Win=43520 Len=0 TSval=38534199 TSecr=834801944
 14   0.181993 216.137.41.10 -> 172.31.36.109 TCP 5858 [TCP segment of a reassembled PDU]
 15   0.182001 172.31.36.109 -> 216.137.41.10 TCP 66 41119 > http [ACK] Seq=99 Ack=14111 Win=55168 Len=0 TSval=38534199 TSecr=834801944
 16   0.268458 216.137.41.10 -> 172.31.36.109 TCP 5858 [TCP segment of a reassembled PDU]
 17   0.268486 172.31.36.109 -> 216.137.41.10 TCP 66 41119 > http [ACK] Seq=99 Ack=19903 Win=66688 Len=0 TSval=38534221 TSecr=834801953
 18   0.268640 216.137.41.10 -> 172.31.36.109 TCP 5858 [TCP segment of a reassembled PDU]
 19   0.268648 172.31.36.109 -> 216.137.41.10 TCP 66 41119 > http [ACK] Seq=99 Ack=25695 Win=78336 Len=0 TSval=38534221 TSecr=834801953
 20   0.268673 216.137.41.10 -> 172.31.36.109 TCP 1514 [TCP segment of a reassembled PDU]
 21   0.268678 172.31.36.109 -> 216.137.41.10 TCP 66 41119 > http [ACK] Seq=99 Ack=27143 Win=81280 Len=0 TSval=38534221 TSecr=834801953
 22   0.355328 216.137.41.10 -> 172.31.36.109 TCP 13098 [TCP segment of a reassembled PDU]
 23   0.355361 172.31.36.109 -> 216.137.41.10 TCP 66 41119 > http [ACK] Seq=99 Ack=40175 Win=96512 Len=0 TSval=38534242 TSecr=834801961
 24   0.355461 216.137.41.10 -> 172.31.36.109 TCP 4410 [TCP segment of a reassembled PDU]
 25   0.355468 172.31.36.109 -> 216.137.41.10 TCP 66 41119 > http [ACK] Seq=99 Ack=44519 Win=109056 Len=0 TSval=38534242 TSecr=834801961
 26   0.355491 216.137.41.10 -> 172.31.36.109 TCP 2962 [TCP segment of a reassembled PDU]
 27   0.355496 172.31.36.109 -> 216.137.41.10 TCP 66 41119 > http [ACK] Seq=99 Ack=47415 Win=106240 Len=0 TSval=38534242 TSecr=834801961
 28   0.442294 216.137.41.10 -> 172.31.36.109 TCP 7306 [TCP segment of a reassembled PDU]
 29   0.442320 172.31.36.109 -> 216.137.41.10 TCP 66 41119 > http [ACK] Seq=99 Ack=54655 Win=105984 Len=0 TSval=38534264 TSecr=834801970
 30   0.442385 216.137.41.10 -> 172.31.36.109 TCP 11650 [TCP segment of a reassembled PDU]
 31   0.442393 172.31.36.109 -> 216.137.41.10 TCP 66 41119 > http [ACK] Seq=99 Ack=66239 Win=132224 Len=0 TSval=38534264 TSecr=834801970
 32   0.529107 216.137.41.10 -> 172.31.36.109 TCP 2962 [TCP segment of a reassembled PDU]
 33   0.529132 172.31.36.109 -> 216.137.41.10 TCP 66 41119 > http [ACK] Seq=99 Ack=69135 Win=137984 Len=0 TSval=38534286 TSecr=834801979
 34   0.529174 216.137.41.10 -> 172.31.36.109 TCP 14546 [TCP segment of a reassembled PDU]
 35   0.529186 172.31.36.109 -> 216.137.41.10 TCP 66 41119 > http [ACK] Seq=99 Ack=83615 Win=167040 Len=0 TSval=38534286 TSecr=834801979
 36   0.529194 216.137.41.10 -> 172.31.36.109 TCP 4410 [TCP segment of a reassembled PDU]
 37   0.529200 172.31.36.109 -> 216.137.41.10 TCP 66 41119 > http [ACK] Seq=99 Ack=87959 Win=175616 Len=0 TSval=38534286 TSecr=834801979
 38   0.529223 216.137.41.10 -> 172.31.36.109 TCP 2962 [TCP segment of a reassembled PDU]
 39   0.529227 172.31.36.109 -> 216.137.41.10 TCP 66 41119 > http [ACK] Seq=99 Ack=90855 Win=181504 Len=0 TSval=38534286 TSecr=834801979
 40   0.529294 216.137.41.10 -> 172.31.36.109 TCP 5858 [TCP segment of a reassembled PDU]
 41   0.529302 172.31.36.109 -> 216.137.41.10 TCP 66 41119 > http [ACK] Seq=99 Ack=96647 Win=193024 Len=0 TSval=38534286 TSecr=834801979
 42   0.615931 216.137.41.10 -> 172.31.36.109 TCP 4410 [TCP segment of a reassembled PDU]
 43   0.615957 172.31.36.109 -> 216.137.41.10 TCP 66 41119 > http [ACK] Seq=99 Ack=100991 Win=201728 Len=0 TSval=38534308 TSecr=834801987
 44   0.615967 216.137.41.10 -> 172.31.36.109 HTTP 1932 HTTP/1.1 200 OK  (application/octet-stream)
 45   0.615980 172.31.36.109 -> 216.137.41.10 TCP 66 41119 > http [ACK] Seq=99 Ack=102857 Win=205440 Len=0 TSval=38534308 TSecr=834801987
 46   0.616206 172.31.36.109 -> 216.137.41.10 TCP 66 41119 > http [FIN, ACK] Seq=99 Ack=102857 Win=205440 Len=0 TSval=38534308 TSecr=834801987
 47   0.703160 216.137.41.10 -> 172.31.36.109 TCP 66 http > 41119 [FIN, ACK] Seq=102857 Ack=100 Win=14592 Len=0 TSval=834801996 TSecr=38534308
 48   0.703189 172.31.36.109 -> 216.137.41.10 TCP 66 41119 > http [ACK] Seq=100 Ack=102858 Win=205440 Len=0 TSval=38534329 TSecr=834801996
