[Measurement for 100kb at 19:33:36 19.33.2014] 
Tshark:

  1   0.000000 172.31.36.109 -> 172.31.0.2   DNS 89 Standard query 0xb8a2  A d1n0gskdvzj94j.cloudfront.net
  2   0.000081 172.31.36.109 -> 172.31.0.2   DNS 89 Standard query 0x634a  AAAA d1n0gskdvzj94j.cloudfront.net
  3   0.000601   172.31.0.2 -> 172.31.36.109 DNS 176 Standard query response 0x634a 
  4   0.000613   172.31.0.2 -> 172.31.36.109 DNS 217 Standard query response 0xb8a2  A 54.230.20.193 A 54.230.22.167 A 54.230.22.217 A 216.137.41.29 A 216.137.41.64 A 216.137.41.87 A 54.230.20.48 A 54.230.20.182
  5   0.003861 172.31.36.109 -> 54.230.20.193 TCP 74 35763 > http [SYN] Seq=0 Win=26883 Len=0 MSS=8961 SACK_PERM=1 TSval=22325840 TSecr=0 WS=128
  6   0.092385 54.230.20.193 -> 172.31.36.109 TCP 74 http > 35763 [SYN, ACK] Seq=0 Ack=1 Win=14480 Len=0 MSS=1460 SACK_PERM=1 TSval=979764080 TSecr=22325840 WS=128
  7   0.092401 172.31.36.109 -> 54.230.20.193 TCP 66 35763 > http [ACK] Seq=1 Ack=1 Win=27008 Len=0 TSval=22325863 TSecr=979764080
  8   0.092459 172.31.36.109 -> 54.230.20.193 HTTP 164 GET /100kb HTTP/1.1 
  9   0.193959 54.230.20.193 -> 172.31.36.109 TCP 66 http > 35763 [ACK] Seq=1 Ack=99 Win=14592 Len=0 TSval=979764090 TSecr=22325863
 10   0.199177 54.230.20.193 -> 172.31.36.109 TCP 2593 [TCP segment of a reassembled PDU]
 11   0.199189 172.31.36.109 -> 54.230.20.193 TCP 66 35763 > http [ACK] Seq=99 Ack=2528 Win=32000 Len=0 TSval=22325889 TSecr=979764090
 12   0.199205 54.230.20.193 -> 172.31.36.109 TCP 11650 [TCP segment of a reassembled PDU]
 13   0.199215 172.31.36.109 -> 54.230.20.193 TCP 66 35763 > http [ACK] Seq=99 Ack=14112 Win=55168 Len=0 TSval=22325889 TSecr=979764090
 14   0.287701 54.230.20.193 -> 172.31.36.109 TCP 7306 [TCP segment of a reassembled PDU]
 15   0.287711 172.31.36.109 -> 54.230.20.193 TCP 66 35763 > http [ACK] Seq=99 Ack=21352 Win=69632 Len=0 TSval=22325911 TSecr=979764099
 16   0.287722 54.230.20.193 -> 172.31.36.109 TCP 5858 [TCP segment of a reassembled PDU]
 17   0.287727 172.31.36.109 -> 54.230.20.193 TCP 66 35763 > http [ACK] Seq=99 Ack=27144 Win=81280 Len=0 TSval=22325911 TSecr=979764099
 18   0.376281 54.230.20.193 -> 172.31.36.109 TCP 20338 [TCP segment of a reassembled PDU]
 19   0.376301 172.31.36.109 -> 54.230.20.193 TCP 66 35763 > http [ACK] Seq=99 Ack=47416 Win=84608 Len=0 TSval=22325934 TSecr=979764108
 20   0.464602 54.230.20.193 -> 172.31.36.109 TCP 2962 [TCP segment of a reassembled PDU]
 21   0.464613 172.31.36.109 -> 54.230.20.193 TCP 66 35763 > http [ACK] Seq=99 Ack=50312 Win=114816 Len=0 TSval=22325956 TSecr=979764117
 22   0.464830 54.230.20.193 -> 172.31.36.109 TCP 1514 [TCP segment of a reassembled PDU]
 23   0.464835 172.31.36.109 -> 54.230.20.193 TCP 66 35763 > http [ACK] Seq=99 Ack=51760 Win=117760 Len=0 TSval=22325956 TSecr=979764117
 24   0.464954 54.230.20.193 -> 172.31.36.109 TCP 1514 [TCP segment of a reassembled PDU]
 25   0.464965 172.31.36.109 -> 54.230.20.193 TCP 66 35763 > http [ACK] Seq=99 Ack=53208 Win=120704 Len=0 TSval=22325956 TSecr=979764117
 26   0.465003 54.230.20.193 -> 172.31.36.109 TCP 13098 [TCP segment of a reassembled PDU]
 27   0.465010 172.31.36.109 -> 54.230.20.193 TCP 66 35763 > http [ACK] Seq=99 Ack=66240 Win=146688 Len=0 TSval=22325956 TSecr=979764117
 28   0.552913 54.230.20.193 -> 172.31.36.109 TCP 1514 [TCP segment of a reassembled PDU]
 29   0.552919 172.31.36.109 -> 54.230.20.193 TCP 66 35763 > http [ACK] Seq=99 Ack=67688 Win=149632 Len=0 TSval=22325978 TSecr=979764126
 30   0.553011 54.230.20.193 -> 172.31.36.109 TCP 4410 [TCP segment of a reassembled PDU]
 31   0.553017 172.31.36.109 -> 54.230.20.193 TCP 66 35763 > http [ACK] Seq=99 Ack=72032 Win=158336 Len=0 TSval=22325978 TSecr=979764126
 32   0.553055 54.230.20.193 -> 172.31.36.109 TCP 1514 [TCP segment of a reassembled PDU]
 33   0.553060 172.31.36.109 -> 54.230.20.193 TCP 66 35763 > http [ACK] Seq=99 Ack=73480 Win=161152 Len=0 TSval=22325978 TSecr=979764126
 34   0.553590 54.230.20.193 -> 172.31.36.109 TCP 5858 [TCP segment of a reassembled PDU]
 35   0.553596 172.31.36.109 -> 54.230.20.193 TCP 66 35763 > http [ACK] Seq=99 Ack=79272 Win=172800 Len=0 TSval=22325978 TSecr=979764126
 36   0.553619 54.230.20.193 -> 172.31.36.109 TCP 14546 [TCP segment of a reassembled PDU]
 37   0.553627 172.31.36.109 -> 54.230.20.193 TCP 66 35763 > http [ACK] Seq=99 Ack=93752 Win=201728 Len=0 TSval=22325978 TSecr=979764126
 38   0.641687 54.230.20.193 -> 172.31.36.109 HTTP 9170 HTTP/1.1 200 OK  (application/octet-stream)
 39   0.641697 172.31.36.109 -> 54.230.20.193 TCP 66 35763 > http [ACK] Seq=99 Ack=102856 Win=219904 Len=0 TSval=22326000 TSecr=979764135
 40   0.641959 172.31.36.109 -> 54.230.20.193 TCP 66 35763 > http [FIN, ACK] Seq=99 Ack=102856 Win=219904 Len=0 TSval=22326000 TSecr=979764135
 41   0.730555 54.230.20.193 -> 172.31.36.109 TCP 66 http > 35763 [FIN, ACK] Seq=102856 Ack=100 Win=14592 Len=0 TSval=979764144 TSecr=22326000
 42   0.730581 172.31.36.109 -> 54.230.20.193 TCP 66 35763 > http [ACK] Seq=100 Ack=102857 Win=219904 Len=0 TSval=22326022 TSecr=979764144
