[Measurement for 100kb at 08:33:30 20.33.2014] 
Tshark:

  1   0.000000 172.31.36.109 -> 172.31.0.2   DNS 89 Standard query 0xf1ca  A d1n0gskdvzj94j.cloudfront.net
  2   0.000029 172.31.36.109 -> 172.31.0.2   DNS 89 Standard query 0x6e76  AAAA d1n0gskdvzj94j.cloudfront.net
  3   0.000498   172.31.0.2 -> 172.31.36.109 DNS 176 Standard query response 0x6e76 
  4   0.000508   172.31.0.2 -> 172.31.36.109 DNS 217 Standard query response 0xf1ca  A 54.230.30.254 A 54.192.29.221 A 54.192.30.191 A 54.192.30.218 A 54.230.30.67 A 54.230.30.215 A 54.230.30.217 A 54.230.30.230
  5   0.003822 172.31.36.109 -> 54.230.30.254 TCP 74 52561 > http [SYN] Seq=0 Win=26883 Len=0 MSS=8961 SACK_PERM=1 TSval=34024305 TSecr=0 WS=128
  6   0.005092 54.230.30.254 -> 172.31.36.109 TCP 74 http > 52561 [SYN, ACK] Seq=0 Ack=1 Win=14480 Len=0 MSS=1460 SACK_PERM=1 TSval=735131338 TSecr=34024305 WS=128
  7   0.005126 172.31.36.109 -> 54.230.30.254 TCP 66 52561 > http [ACK] Seq=1 Ack=1 Win=27008 Len=0 TSval=34024305 TSecr=735131338
  8   0.005162 172.31.36.109 -> 54.230.30.254 HTTP 164 GET /100kb HTTP/1.1 
  9   0.006369 54.230.30.254 -> 172.31.36.109 TCP 66 http > 52561 [ACK] Seq=1 Ack=99 Win=14592 Len=0 TSval=735131338 TSecr=34024305
 10   0.075820 54.230.30.254 -> 172.31.36.109 TCP 1144 [TCP segment of a reassembled PDU]
 11   0.075831 172.31.36.109 -> 54.230.30.254 TCP 66 52561 > http [ACK] Seq=99 Ack=1079 Win=29056 Len=0 TSval=34024323 TSecr=735131345
 12   0.075847 54.230.30.254 -> 172.31.36.109 TCP 13098 [TCP segment of a reassembled PDU]
 13   0.075859 172.31.36.109 -> 54.230.30.254 TCP 66 52561 > http [ACK] Seq=99 Ack=14111 Win=55168 Len=0 TSval=34024323 TSecr=735131345
 14   0.077089 54.230.30.254 -> 172.31.36.109 TCP 7306 [TCP segment of a reassembled PDU]
 15   0.077097 172.31.36.109 -> 54.230.30.254 TCP 66 52561 > http [ACK] Seq=99 Ack=21351 Win=69632 Len=0 TSval=34024323 TSecr=735131345
 16   0.077379 54.230.30.254 -> 172.31.36.109 TCP 4410 [TCP segment of a reassembled PDU]
 17   0.077385 172.31.36.109 -> 54.230.30.254 TCP 66 52561 > http [ACK] Seq=99 Ack=25695 Win=78336 Len=0 TSval=34024323 TSecr=735131345
 18   0.077404 54.230.30.254 -> 172.31.36.109 TCP 1514 [TCP segment of a reassembled PDU]
 19   0.077412 172.31.36.109 -> 54.230.30.254 TCP 66 52561 > http [ACK] Seq=99 Ack=27143 Win=81280 Len=0 TSval=34024323 TSecr=735131345
 20   0.078374 54.230.30.254 -> 172.31.36.109 TCP 13098 [TCP segment of a reassembled PDU]
 21   0.078384 172.31.36.109 -> 54.230.30.254 TCP 66 52561 > http [ACK] Seq=99 Ack=40175 Win=96512 Len=0 TSval=34024323 TSecr=735131345
 22   0.078635 54.230.30.254 -> 172.31.36.109 TCP 8754 [TCP segment of a reassembled PDU]
 23   0.078642 172.31.36.109 -> 54.230.30.254 TCP 66 52561 > http [ACK] Seq=99 Ack=48863 Win=103680 Len=0 TSval=34024323 TSecr=735131345
 24   0.079764 54.230.30.254 -> 172.31.36.109 TCP 4410 [TCP segment of a reassembled PDU]
 25   0.079770 172.31.36.109 -> 54.230.30.254 TCP 66 52561 > http [ACK] Seq=99 Ack=53207 Win=109056 Len=0 TSval=34024324 TSecr=735131345
 26   0.079794 54.230.30.254 -> 172.31.36.109 TCP 10202 [TCP segment of a reassembled PDU]
 27   0.079801 172.31.36.109 -> 54.230.30.254 TCP 66 52561 > http [ACK] Seq=99 Ack=63343 Win=98944 Len=0 TSval=34024324 TSecr=735131345
 28   0.079883 54.230.30.254 -> 172.31.36.109 TCP 2962 [TCP segment of a reassembled PDU]
 29   0.079888 172.31.36.109 -> 54.230.30.254 TCP 66 52561 > http [ACK] Seq=99 Ack=66239 Win=114816 Len=0 TSval=34024324 TSecr=735131345
 30   0.080958 54.230.30.254 -> 172.31.36.109 TCP 7306 [TCP segment of a reassembled PDU]
 31   0.080965 172.31.36.109 -> 54.230.30.254 TCP 66 52561 > http [ACK] Seq=99 Ack=73479 Win=129280 Len=0 TSval=34024324 TSecr=735131345
 32   0.081041 54.230.30.254 -> 172.31.36.109 TCP 5858 [TCP segment of a reassembled PDU]
 33   0.081047 172.31.36.109 -> 54.230.30.254 TCP 66 52561 > http [ACK] Seq=99 Ack=79271 Win=140928 Len=0 TSval=34024324 TSecr=735131345
 34   0.081059 54.230.30.254 -> 172.31.36.109 TCP 10202 [TCP segment of a reassembled PDU]
 35   0.081065 172.31.36.109 -> 54.230.30.254 TCP 66 52561 > http [ACK] Seq=99 Ack=89407 Win=161152 Len=0 TSval=34024324 TSecr=735131345
 36   0.081105 54.230.30.254 -> 172.31.36.109 TCP 4410 [TCP segment of a reassembled PDU]
 37   0.081111 172.31.36.109 -> 54.230.30.254 TCP 66 52561 > http [ACK] Seq=99 Ack=93751 Win=169856 Len=0 TSval=34024324 TSecr=735131345
 38   0.082501 54.230.30.254 -> 172.31.36.109 TCP 7306 [TCP segment of a reassembled PDU]
 39   0.082507 172.31.36.109 -> 54.230.30.254 TCP 66 52561 > http [ACK] Seq=99 Ack=100991 Win=184320 Len=0 TSval=34024324 TSecr=735131345
 40   0.082578 54.230.30.254 -> 172.31.36.109 HTTP 1932 HTTP/1.1 200 OK  (application/octet-stream)
 41   0.082583 172.31.36.109 -> 54.230.30.254 TCP 66 52561 > http [ACK] Seq=99 Ack=102857 Win=188032 Len=0 TSval=34024324 TSecr=735131345
 42   0.082709 172.31.36.109 -> 54.230.30.254 TCP 66 52561 > http [FIN, ACK] Seq=99 Ack=102857 Win=188032 Len=0 TSval=34024324 TSecr=735131345
 43   0.083902 54.230.30.254 -> 172.31.36.109 TCP 66 http > 52561 [FIN, ACK] Seq=102857 Ack=100 Win=14592 Len=0 TSval=735131345 TSecr=34024324
 44   0.083910 172.31.36.109 -> 54.230.30.254 TCP 66 52561 > http [ACK] Seq=100 Ack=102858 Win=188032 Len=0 TSval=34024325 TSecr=735131345
