[Measurement for 100kb at 04:33:24 20.33.2014] 
Tshark:

  1   0.000000 172.31.36.109 -> 172.31.0.2   DNS 89 Standard query 0x1fde  A d1n0gskdvzj94j.cloudfront.net
  2   0.000023 172.31.36.109 -> 172.31.0.2   DNS 89 Standard query 0xb1a9  AAAA d1n0gskdvzj94j.cloudfront.net
  3   0.000476   172.31.0.2 -> 172.31.36.109 DNS 217 Standard query response 0x1fde  A 54.230.30.189 A 54.230.30.213 A 54.230.30.245 A 54.192.30.184 A 54.192.30.214 A 54.192.30.218 A 54.230.30.50 A 54.230.30.73
  4   0.000486   172.31.0.2 -> 172.31.36.109 DNS 176 Standard query response 0xb1a9 
  5   0.003893 172.31.36.109 -> 54.230.30.189 TCP 74 42140 > http [SYN] Seq=0 Win=26883 Len=0 MSS=8961 SACK_PERM=1 TSval=30422790 TSecr=0 WS=128
  6   0.005121 54.230.30.189 -> 172.31.36.109 TCP 74 http > 42140 [SYN, ACK] Seq=0 Ack=1 Win=14480 Len=0 MSS=1460 SACK_PERM=1 TSval=654463397 TSecr=30422790 WS=128
  7   0.005135 172.31.36.109 -> 54.230.30.189 TCP 66 42140 > http [ACK] Seq=1 Ack=1 Win=27008 Len=0 TSval=30422790 TSecr=654463397
  8   0.005174 172.31.36.109 -> 54.230.30.189 HTTP 164 GET /100kb HTTP/1.1 
  9   0.006355 54.230.30.189 -> 172.31.36.109 TCP 66 http > 42140 [ACK] Seq=1 Ack=99 Win=14592 Len=0 TSval=654463397 TSecr=30422790
 10   0.034375 54.230.30.189 -> 172.31.36.109 TCP 2962 [TCP segment of a reassembled PDU]
 11   0.034398 172.31.36.109 -> 54.230.30.189 TCP 66 42140 > http [ACK] Seq=99 Ack=2897 Win=32768 Len=0 TSval=30422798 TSecr=654463400
 12   0.034469 54.230.30.189 -> 172.31.36.109 TCP 1514 [TCP segment of a reassembled PDU]
 13   0.034475 172.31.36.109 -> 54.230.30.189 TCP 66 42140 > http [ACK] Seq=99 Ack=4345 Win=35584 Len=0 TSval=30422798 TSecr=654463400
 14   0.034531 54.230.30.189 -> 172.31.36.109 TCP 4410 [TCP segment of a reassembled PDU]
 15   0.034537 172.31.36.109 -> 54.230.30.189 TCP 66 42140 > http [ACK] Seq=99 Ack=8689 Win=44288 Len=0 TSval=30422798 TSecr=654463400
 16   0.034577 54.230.30.189 -> 172.31.36.109 TCP 4410 [TCP segment of a reassembled PDU]
 17   0.034582 172.31.36.109 -> 54.230.30.189 TCP 66 42140 > http [ACK] Seq=99 Ack=13033 Win=52992 Len=0 TSval=30422798 TSecr=654463400
 18   0.035743 54.230.30.189 -> 172.31.36.109 TCP 2962 [TCP segment of a reassembled PDU]
 19   0.035756 172.31.36.109 -> 54.230.30.189 TCP 66 42140 > http [ACK] Seq=99 Ack=15929 Win=58752 Len=0 TSval=30422798 TSecr=654463400
 20   0.035801 54.230.30.189 -> 172.31.36.109 TCP 4410 [TCP segment of a reassembled PDU]
 21   0.035806 172.31.36.109 -> 54.230.30.189 TCP 66 42140 > http [ACK] Seq=99 Ack=20273 Win=67456 Len=0 TSval=30422798 TSecr=654463400
 22   0.036000 54.230.30.189 -> 172.31.36.109 TCP 5858 [TCP segment of a reassembled PDU]
 23   0.036007 172.31.36.109 -> 54.230.30.189 TCP 66 42140 > http [ACK] Seq=99 Ack=26065 Win=79104 Len=0 TSval=30422798 TSecr=654463400
 24   0.036030 54.230.30.189 -> 172.31.36.109 TCP 7306 [TCP segment of a reassembled PDU]
 25   0.036036 172.31.36.109 -> 54.230.30.189 TCP 66 42140 > http [ACK] Seq=99 Ack=33305 Win=93568 Len=0 TSval=30422798 TSecr=654463400
 26   0.037088 54.230.30.189 -> 172.31.36.109 TCP 5858 [TCP segment of a reassembled PDU]
 27   0.037095 172.31.36.109 -> 54.230.30.189 TCP 66 42140 > http [ACK] Seq=99 Ack=39097 Win=105088 Len=0 TSval=30422798 TSecr=654463400
 28   0.037398 54.230.30.189 -> 172.31.36.109 TCP 7306 [TCP segment of a reassembled PDU]
 29   0.037414 172.31.36.109 -> 54.230.30.189 TCP 66 42140 > http [ACK] Seq=99 Ack=46337 Win=105984 Len=0 TSval=30422798 TSecr=654463400
 30   0.037450 54.230.30.189 -> 172.31.36.109 TCP 5858 [TCP segment of a reassembled PDU]
 31   0.037456 172.31.36.109 -> 54.230.30.189 TCP 66 42140 > http [ACK] Seq=99 Ack=52129 Win=108416 Len=0 TSval=30422798 TSecr=654463400
 32   0.038354 54.230.30.189 -> 172.31.36.109 TCP 1514 [TCP segment of a reassembled PDU]
 33   0.038358 172.31.36.109 -> 54.230.30.189 TCP 66 42140 > http [ACK] Seq=99 Ack=53577 Win=109056 Len=0 TSval=30422799 TSecr=654463400
 34   0.038427 54.230.30.189 -> 172.31.36.109 TCP 4410 [TCP segment of a reassembled PDU]
 35   0.038433 172.31.36.109 -> 54.230.30.189 TCP 66 42140 > http [ACK] Seq=99 Ack=57921 Win=117760 Len=0 TSval=30422799 TSecr=654463400
 36   0.038550 54.230.30.189 -> 172.31.36.109 TCP 7306 [TCP segment of a reassembled PDU]
 37   0.038557 172.31.36.109 -> 54.230.30.189 TCP 66 42140 > http [ACK] Seq=99 Ack=65161 Win=132224 Len=0 TSval=30422799 TSecr=654463400
 38   0.038971 54.230.30.189 -> 172.31.36.109 TCP 2962 [TCP segment of a reassembled PDU]
 39   0.038976 172.31.36.109 -> 54.230.30.189 TCP 66 42140 > http [ACK] Seq=99 Ack=68057 Win=137984 Len=0 TSval=30422799 TSecr=654463400
 40   0.039124 54.230.30.189 -> 172.31.36.109 TCP 10202 [TCP segment of a reassembled PDU]
 41   0.039131 172.31.36.109 -> 54.230.30.189 TCP 66 42140 > http [ACK] Seq=99 Ack=78193 Win=158336 Len=0 TSval=30422799 TSecr=654463400
 42   0.039804 54.230.30.189 -> 172.31.36.109 TCP 5858 [TCP segment of a reassembled PDU]
 43   0.039809 172.31.36.109 -> 54.230.30.189 TCP 66 42140 > http [ACK] Seq=99 Ack=83985 Win=169856 Len=0 TSval=30422799 TSecr=654463401
 44   0.039969 54.230.30.189 -> 172.31.36.109 TCP 15994 [TCP segment of a reassembled PDU]
 45   0.039988 172.31.36.109 -> 54.230.30.189 TCP 66 42140 > http [ACK] Seq=99 Ack=99913 Win=201728 Len=0 TSval=30422799 TSecr=654463401
 46   0.040581 54.230.30.189 -> 172.31.36.109 HTTP 3010 HTTP/1.1 200 OK  (application/octet-stream)
 47   0.040586 172.31.36.109 -> 54.230.30.189 TCP 66 42140 > http [ACK] Seq=99 Ack=102857 Win=207616 Len=0 TSval=30422799 TSecr=654463401
 48   0.040720 172.31.36.109 -> 54.230.30.189 TCP 66 42140 > http [FIN, ACK] Seq=99 Ack=102857 Win=207616 Len=0 TSval=30422799 TSecr=654463401
 49   0.041816 54.230.30.189 -> 172.31.36.109 TCP 66 http > 42140 [FIN, ACK] Seq=102857 Ack=100 Win=14592 Len=0 TSval=654463401 TSecr=30422799
 50   0.041824 172.31.36.109 -> 54.230.30.189 TCP 66 42140 > http [ACK] Seq=100 Ack=102858 Win=207616 Len=0 TSval=30422800 TSecr=654463401
