[Measurement for 100kb at 09:33:46 20.33.2014] 
Tshark:

  1   0.000000 172.31.36.109 -> 172.31.0.2   DNS 89 Standard query 0xe1ae  A d1n0gskdvzj94j.cloudfront.net
  2   0.000023 172.31.36.109 -> 172.31.0.2   DNS 89 Standard query 0xf439  AAAA d1n0gskdvzj94j.cloudfront.net
  3   0.000375   172.31.0.2 -> 172.31.36.109 DNS 217 Standard query response 0xe1ae  A 54.230.30.248 A 54.192.30.195 A 54.192.30.229 A 54.230.30.2 A 54.230.30.54 A 54.230.30.218 A 54.230.30.239 A 54.230.30.245
  4   0.000385   172.31.0.2 -> 172.31.36.109 DNS 176 Standard query response 0xf439 
  5   0.003935 172.31.36.109 -> 54.230.30.248 TCP 74 54868 > http [SYN] Seq=0 Win=26883 Len=0 MSS=8961 SACK_PERM=1 TSval=34928137 TSecr=0 WS=128
  6   0.005299 54.230.30.248 -> 172.31.36.109 TCP 74 http > 54868 [SYN, ACK] Seq=0 Ack=1 Win=14480 Len=0 MSS=1460 SACK_PERM=1 TSval=669270117 TSecr=34928137 WS=128
  7   0.005335 172.31.36.109 -> 54.230.30.248 TCP 66 54868 > http [ACK] Seq=1 Ack=1 Win=27008 Len=0 TSval=34928137 TSecr=669270117
  8   0.005371 172.31.36.109 -> 54.230.30.248 HTTP 164 GET /100kb HTTP/1.1 
  9   0.006465 54.230.30.248 -> 172.31.36.109 TCP 66 http > 54868 [ACK] Seq=1 Ack=99 Win=14592 Len=0 TSval=669270117 TSecr=34928137
 10   0.074351 54.230.30.248 -> 172.31.36.109 TCP 1144 [TCP segment of a reassembled PDU]
 11   0.074359 172.31.36.109 -> 54.230.30.248 TCP 66 54868 > http [ACK] Seq=99 Ack=1079 Win=29056 Len=0 TSval=34928155 TSecr=669270123
 12   0.074546 54.230.30.248 -> 172.31.36.109 TCP 2962 [TCP segment of a reassembled PDU]
 13   0.074552 172.31.36.109 -> 54.230.30.248 TCP 66 54868 > http [ACK] Seq=99 Ack=3975 Win=34944 Len=0 TSval=34928155 TSecr=669270124
 14   0.074608 54.230.30.248 -> 172.31.36.109 TCP 8754 [TCP segment of a reassembled PDU]
 15   0.074616 172.31.36.109 -> 54.230.30.248 TCP 66 54868 > http [ACK] Seq=99 Ack=12663 Win=52224 Len=0 TSval=34928155 TSecr=669270124
 16   0.074635 54.230.30.248 -> 172.31.36.109 TCP 1514 [TCP segment of a reassembled PDU]
 17   0.074638 172.31.36.109 -> 54.230.30.248 TCP 66 54868 > http [ACK] Seq=99 Ack=14111 Win=55168 Len=0 TSval=34928155 TSecr=669270124
 18   0.075866 54.230.30.248 -> 172.31.36.109 TCP 5858 [TCP segment of a reassembled PDU]
 19   0.075873 172.31.36.109 -> 54.230.30.248 TCP 66 54868 > http [ACK] Seq=99 Ack=19903 Win=66688 Len=0 TSval=34928155 TSecr=669270124
 20   0.075925 54.230.30.248 -> 172.31.36.109 TCP 14546 [TCP segment of a reassembled PDU]
 21   0.075936 172.31.36.109 -> 54.230.30.248 TCP 66 54868 > http [ACK] Seq=99 Ack=34383 Win=94080 Len=0 TSval=34928155 TSecr=669270124
 22   0.076906 54.230.30.248 -> 172.31.36.109 TCP 2962 [TCP segment of a reassembled PDU]
 23   0.076925 172.31.36.109 -> 54.230.30.248 TCP 66 54868 > http [ACK] Seq=99 Ack=37279 Win=101504 Len=0 TSval=34928155 TSecr=669270124
 24   0.077159 54.230.30.248 -> 172.31.36.109 TCP 2962 [TCP segment of a reassembled PDU]
 25   0.077171 172.31.36.109 -> 54.230.30.248 TCP 66 54868 > http [ACK] Seq=99 Ack=40175 Win=107264 Len=0 TSval=34928155 TSecr=669270124
 26   0.077206 54.230.30.248 -> 172.31.36.109 TCP 5858 [TCP segment of a reassembled PDU]
 27   0.077210 172.31.36.109 -> 54.230.30.248 TCP 66 54868 > http [ACK] Seq=99 Ack=45967 Win=103680 Len=0 TSval=34928155 TSecr=669270124
 28   0.077487 54.230.30.248 -> 172.31.36.109 TCP 11650 [TCP segment of a reassembled PDU]
 29   0.077496 172.31.36.109 -> 54.230.30.248 TCP 66 54868 > http [ACK] Seq=99 Ack=57551 Win=98944 Len=0 TSval=34928155 TSecr=669270124
 30   0.078135 54.230.30.248 -> 172.31.36.109 TCP 1514 [TCP segment of a reassembled PDU]
 31   0.078140 172.31.36.109 -> 54.230.30.248 TCP 66 54868 > http [ACK] Seq=99 Ack=58999 Win=109056 Len=0 TSval=34928156 TSecr=669270124
 32   0.078434 54.230.30.248 -> 172.31.36.109 TCP 5858 [TCP segment of a reassembled PDU]
 33   0.078459 172.31.36.109 -> 54.230.30.248 TCP 66 54868 > http [ACK] Seq=99 Ack=64791 Win=120704 Len=0 TSval=34928156 TSecr=669270124
 34   0.078476 54.230.30.248 -> 172.31.36.109 TCP 2962 [TCP segment of a reassembled PDU]
 35   0.078480 172.31.36.109 -> 54.230.30.248 TCP 66 54868 > http [ACK] Seq=99 Ack=67687 Win=126464 Len=0 TSval=34928156 TSecr=669270124
 36   0.078884 54.230.30.248 -> 172.31.36.109 TCP 14546 [TCP segment of a reassembled PDU]
 37   0.078916 172.31.36.109 -> 54.230.30.248 TCP 66 54868 > http [ACK] Seq=99 Ack=82167 Win=155392 Len=0 TSval=34928156 TSecr=669270124
 38   0.078928 54.230.30.248 -> 172.31.36.109 TCP 4410 [TCP segment of a reassembled PDU]
 39   0.078932 172.31.36.109 -> 54.230.30.248 TCP 66 54868 > http [ACK] Seq=99 Ack=86511 Win=164096 Len=0 TSval=34928156 TSecr=669270124
 40   0.079756 54.230.30.248 -> 172.31.36.109 TCP 1514 [TCP segment of a reassembled PDU]
 41   0.079780 172.31.36.109 -> 54.230.30.248 TCP 66 54868 > http [ACK] Seq=99 Ack=87959 Win=167040 Len=0 TSval=34928156 TSecr=669270124
 42   0.079873 54.230.30.248 -> 172.31.36.109 TCP 7306 [TCP segment of a reassembled PDU]
 43   0.079880 172.31.36.109 -> 54.230.30.248 TCP 66 54868 > http [ACK] Seq=99 Ack=95199 Win=181504 Len=0 TSval=34928156 TSecr=669270124
 44   0.080046 54.230.30.248 -> 172.31.36.109 TCP 4410 [TCP segment of a reassembled PDU]
 45   0.080052 172.31.36.109 -> 54.230.30.248 TCP 66 54868 > http [ACK] Seq=99 Ack=99543 Win=190208 Len=0 TSval=34928156 TSecr=669270124
 46   0.080178 54.230.30.248 -> 172.31.36.109 HTTP 3380 HTTP/1.1 200 OK  (application/octet-stream)
 47   0.080184 172.31.36.109 -> 54.230.30.248 TCP 66 54868 > http [ACK] Seq=99 Ack=102857 Win=196736 Len=0 TSval=34928156 TSecr=669270124
 48   0.080297 172.31.36.109 -> 54.230.30.248 TCP 66 54868 > http [FIN, ACK] Seq=99 Ack=102857 Win=196736 Len=0 TSval=34928156 TSecr=669270124
 49   0.081728 54.230.30.248 -> 172.31.36.109 TCP 66 http > 54868 [FIN, ACK] Seq=102857 Ack=100 Win=14592 Len=0 TSval=669270124 TSecr=34928156
 50   0.081761 172.31.36.109 -> 54.230.30.248 TCP 66 54868 > http [ACK] Seq=100 Ack=102858 Win=196736 Len=0 TSval=34928156 TSecr=669270124
