[Measurement for 100kb at 06:33:27 20.33.2014] 
Tshark:

  1   0.000000 172.31.36.109 -> 172.31.0.2   DNS 89 Standard query 0x05c4  A d1n0gskdvzj94j.cloudfront.net
  2   0.000029 172.31.36.109 -> 172.31.0.2   DNS 89 Standard query 0x916c  AAAA d1n0gskdvzj94j.cloudfront.net
  3   0.000650   172.31.0.2 -> 172.31.36.109 DNS 217 Standard query response 0x05c4  A 54.192.30.216 A 54.192.30.221 A 54.230.30.2 A 54.230.30.58 A 54.230.30.189 A 54.230.30.242 A 54.230.31.9 A 54.192.30.139
  4   0.000661   172.31.0.2 -> 172.31.36.109 DNS 176 Standard query response 0x916c 
  5   0.003824 172.31.36.109 -> 54.192.30.216 TCP 74 60760 > http [SYN] Seq=0 Win=26883 Len=0 MSS=8961 SACK_PERM=1 TSval=32223374 TSecr=0 WS=128
  6   0.005261 54.192.30.216 -> 172.31.36.109 TCP 74 http > 60760 [SYN, ACK] Seq=0 Ack=1 Win=14480 Len=0 MSS=1460 SACK_PERM=1 TSval=832790314 TSecr=32223374 WS=128
  7   0.005275 172.31.36.109 -> 54.192.30.216 TCP 66 60760 > http [ACK] Seq=1 Ack=1 Win=27008 Len=0 TSval=32223374 TSecr=832790314
  8   0.005330 172.31.36.109 -> 54.192.30.216 HTTP 164 GET /100kb HTTP/1.1 
  9   0.006508 54.192.30.216 -> 172.31.36.109 TCP 66 http > 60760 [ACK] Seq=1 Ack=99 Win=14592 Len=0 TSval=832790315 TSecr=32223374
 10   0.037793 54.192.30.216 -> 172.31.36.109 TCP 11650 [TCP segment of a reassembled PDU]
 11   0.037835 172.31.36.109 -> 54.192.30.216 TCP 66 60760 > http [ACK] Seq=99 Ack=11585 Win=50176 Len=0 TSval=32223382 TSecr=832790318
 12   0.037843 54.192.30.216 -> 172.31.36.109 TCP 1514 [TCP segment of a reassembled PDU]
 13   0.037847 172.31.36.109 -> 54.192.30.216 TCP 66 60760 > http [ACK] Seq=99 Ack=13033 Win=52992 Len=0 TSval=32223382 TSecr=832790318
 14   0.039132 54.192.30.216 -> 172.31.36.109 TCP 13098 [TCP segment of a reassembled PDU]
 15   0.039142 172.31.36.109 -> 54.192.30.216 TCP 66 60760 > http [ACK] Seq=99 Ack=26065 Win=79104 Len=0 TSval=32223382 TSecr=832790318
 16   0.040476 54.192.30.216 -> 172.31.36.109 TCP 13098 [TCP segment of a reassembled PDU]
 17   0.040486 172.31.36.109 -> 54.192.30.216 TCP 66 60760 > http [ACK] Seq=99 Ack=39097 Win=96512 Len=0 TSval=32223383 TSecr=832790318
 18   0.041908 54.192.30.216 -> 172.31.36.109 TCP 4410 [TCP segment of a reassembled PDU]
 19   0.041914 172.31.36.109 -> 54.192.30.216 TCP 66 60760 > http [ACK] Seq=99 Ack=43441 Win=109056 Len=0 TSval=32223383 TSecr=832790318
 20   0.041966 54.192.30.216 -> 172.31.36.109 TCP 8754 [TCP segment of a reassembled PDU]
 21   0.041973 172.31.36.109 -> 54.192.30.216 TCP 66 60760 > http [ACK] Seq=99 Ack=52129 Win=103680 Len=0 TSval=32223383 TSecr=832790318
 22   0.041981 54.192.30.216 -> 172.31.36.109 TCP 1514 [TCP segment of a reassembled PDU]
 23   0.041984 172.31.36.109 -> 54.192.30.216 TCP 66 60760 > http [ACK] Seq=99 Ack=53577 Win=102272 Len=0 TSval=32223383 TSecr=832790318
 24   0.042181 54.192.30.216 -> 172.31.36.109 TCP 5858 [TCP segment of a reassembled PDU]
 25   0.042187 172.31.36.109 -> 54.192.30.216 TCP 66 60760 > http [ACK] Seq=99 Ack=59369 Win=108416 Len=0 TSval=32223383 TSecr=832790318
 26   0.043290 54.192.30.216 -> 172.31.36.109 TCP 6001 [TCP segment of a reassembled PDU]
 27   0.043297 172.31.36.109 -> 54.192.30.216 TCP 66 60760 > http [ACK] Seq=99 Ack=65304 Win=105984 Len=0 TSval=32223383 TSecr=832790318
 28   0.047305 54.192.30.216 -> 172.31.36.109 TCP 1514 [TCP segment of a reassembled PDU]
 29   0.047310 172.31.36.109 -> 54.192.30.216 TCP 66 60760 > http [ACK] Seq=99 Ack=66752 Win=109056 Len=0 TSval=32223384 TSecr=832790319
 30   0.047327 54.192.30.216 -> 172.31.36.109 TCP 14546 [TCP segment of a reassembled PDU]
 31   0.047338 172.31.36.109 -> 54.192.30.216 TCP 66 60760 > http [ACK] Seq=99 Ack=81232 Win=94592 Len=0 TSval=32223384 TSecr=832790319
 32   0.047343 54.192.30.216 -> 172.31.36.109 TCP 1514 [TCP segment of a reassembled PDU]
 33   0.047345 172.31.36.109 -> 54.192.30.216 TCP 66 60760 > http [ACK] Seq=99 Ack=82680 Win=93184 Len=0 TSval=32223384 TSecr=832790319
 34   0.048625 54.192.30.216 -> 172.31.36.109 TCP 5858 [TCP segment of a reassembled PDU]
 35   0.048633 172.31.36.109 -> 54.192.30.216 TCP 66 60760 > http [ACK] Seq=99 Ack=88472 Win=120704 Len=0 TSval=32223385 TSecr=832790319
 36   0.048708 54.192.30.216 -> 172.31.36.109 TCP 13098 [TCP segment of a reassembled PDU]
 37   0.048717 172.31.36.109 -> 54.192.30.216 TCP 66 60760 > http [ACK] Seq=99 Ack=101504 Win=146688 Len=0 TSval=32223385 TSecr=832790319
 38   0.048826 54.192.30.216 -> 172.31.36.109 HTTP 1419 HTTP/1.1 200 OK  (application/octet-stream)
 39   0.048831 172.31.36.109 -> 54.192.30.216 TCP 66 60760 > http [ACK] Seq=99 Ack=102857 Win=149632 Len=0 TSval=32223385 TSecr=832790319
 40   0.048990 172.31.36.109 -> 54.192.30.216 TCP 66 60760 > http [FIN, ACK] Seq=99 Ack=102857 Win=149632 Len=0 TSval=32223385 TSecr=832790319
 41   0.050467 54.192.30.216 -> 172.31.36.109 TCP 66 http > 60760 [FIN, ACK] Seq=102857 Ack=100 Win=14592 Len=0 TSval=832790319 TSecr=32223385
 42   0.050478 172.31.36.109 -> 54.192.30.216 TCP 66 60760 > http [ACK] Seq=100 Ack=102858 Win=149632 Len=0 TSval=32223385 TSecr=832790319
