[Measurement for 100kb at 02:33:26 20.33.2014] 
Tshark:

  1   0.000000 172.31.36.109 -> 172.31.0.2   DNS 89 Standard query 0x23c7  A d1n0gskdvzj94j.cloudfront.net
  2   0.000022 172.31.36.109 -> 172.31.0.2   DNS 89 Standard query 0x817d  AAAA d1n0gskdvzj94j.cloudfront.net
  3   0.000465   172.31.0.2 -> 172.31.36.109 DNS 217 Standard query response 0x23c7  A 54.230.20.27 A 54.230.21.71 A 54.230.21.160 A 54.230.22.29 A 54.230.23.144 A 54.230.23.224 A 216.137.41.64 A 216.137.41.122
  4   0.000477   172.31.0.2 -> 172.31.36.109 DNS 176 Standard query response 0x817d 
  5   0.003889 172.31.36.109 -> 54.230.20.27 TCP 74 37550 > http [SYN] Seq=0 Win=26883 Len=0 MSS=8961 SACK_PERM=1 TSval=28623204 TSecr=0 WS=128
  6   0.090492 54.230.20.27 -> 172.31.36.109 TCP 74 http > 37550 [SYN, ACK] Seq=0 Ack=1 Win=14480 Len=0 MSS=1460 SACK_PERM=1 TSval=830813860 TSecr=28623204 WS=128
  7   0.090507 172.31.36.109 -> 54.230.20.27 TCP 66 37550 > http [ACK] Seq=1 Ack=1 Win=27008 Len=0 TSval=28623226 TSecr=830813860
  8   0.090554 172.31.36.109 -> 54.230.20.27 HTTP 164 GET /100kb HTTP/1.1 
  9   0.177647 54.230.20.27 -> 172.31.36.109 TCP 66 http > 37550 [ACK] Seq=1 Ack=99 Win=14592 Len=0 TSval=830813868 TSecr=28623226
 10   0.182582 54.230.20.27 -> 172.31.36.109 TCP 6936 [TCP segment of a reassembled PDU]
 11   0.182593 172.31.36.109 -> 54.230.20.27 TCP 66 37550 > http [ACK] Seq=99 Ack=6871 Win=40704 Len=0 TSval=28623249 TSecr=830813869
 12   0.182602 54.230.20.27 -> 172.31.36.109 TCP 7306 [TCP segment of a reassembled PDU]
 13   0.182608 172.31.36.109 -> 54.230.20.27 TCP 66 37550 > http [ACK] Seq=99 Ack=14111 Win=55168 Len=0 TSval=28623249 TSecr=830813869
 14   0.269450 54.230.20.27 -> 172.31.36.109 TCP 8754 [TCP segment of a reassembled PDU]
 15   0.269460 172.31.36.109 -> 54.230.20.27 TCP 66 37550 > http [ACK] Seq=99 Ack=22799 Win=72576 Len=0 TSval=28623271 TSecr=830813877
 16   0.269580 54.230.20.27 -> 172.31.36.109 TCP 4410 [TCP segment of a reassembled PDU]
 17   0.269586 172.31.36.109 -> 54.230.20.27 TCP 66 37550 > http [ACK] Seq=99 Ack=27143 Win=81280 Len=0 TSval=28623271 TSecr=830813877
 18   0.356320 54.230.20.27 -> 172.31.36.109 TCP 13098 [TCP segment of a reassembled PDU]
 19   0.356330 172.31.36.109 -> 54.230.20.27 TCP 66 37550 > http [ACK] Seq=99 Ack=40175 Win=96512 Len=0 TSval=28623293 TSecr=830813886
 20   0.356401 54.230.20.27 -> 172.31.36.109 TCP 7306 [TCP segment of a reassembled PDU]
 21   0.356408 172.31.36.109 -> 54.230.20.27 TCP 66 37550 > http [ACK] Seq=99 Ack=47415 Win=105984 Len=0 TSval=28623293 TSecr=830813886
 22   0.442877 54.230.20.27 -> 172.31.36.109 TCP 11650 [TCP segment of a reassembled PDU]
