[Measurement for 100kb at 13:33:34 20.33.2014] 
Tshark:

  1   0.000000 172.31.36.109 -> 172.31.0.2   DNS 88 Standard query 0xfe8d  A dm53kc3eax57k.cloudfront.net
  2   0.000074 172.31.36.109 -> 172.31.0.2   DNS 88 Standard query 0x20f1  AAAA dm53kc3eax57k.cloudfront.net
  3   0.000585   172.31.0.2 -> 172.31.36.109 DNS 216 Standard query response 0xfe8d  A 54.230.23.197 A 216.137.41.18 A 216.137.41.20 A 216.137.41.193 A 216.137.41.199 A 54.230.20.33 A 54.230.20.101 A 54.230.21.2
  4   0.000595   172.31.0.2 -> 172.31.36.109 DNS 175 Standard query response 0x20f1 
  5   0.003889 172.31.36.109 -> 54.230.23.197 TCP 74 59996 > http [SYN] Seq=0 Win=26883 Len=0 MSS=8961 SACK_PERM=1 TSval=38525350 TSecr=0 WS=128
  6   0.089508 54.230.23.197 -> 172.31.36.109 TCP 74 http > 59996 [SYN, ACK] Seq=0 Ack=1 Win=14480 Len=0 MSS=1460 SACK_PERM=1 TSval=944022317 TSecr=38525350 WS=128
  7   0.089552 172.31.36.109 -> 54.230.23.197 TCP 66 59996 > http [ACK] Seq=1 Ack=1 Win=27008 Len=0 TSval=38525372 TSecr=944022317
  8   0.089637 172.31.36.109 -> 54.230.23.197 HTTP 163 GET /100kb HTTP/1.1 
  9   0.175198 54.230.23.197 -> 172.31.36.109 TCP 66 http > 59996 [ACK] Seq=1 Ack=98 Win=14592 Len=0 TSval=944022326 TSecr=38525372
 10   0.181878 54.230.23.197 -> 172.31.36.109 TCP 6924 [TCP segment of a reassembled PDU]
 11   0.181894 172.31.36.109 -> 54.230.23.197 TCP 66 59996 > http [ACK] Seq=98 Ack=6859 Win=40704 Len=0 TSval=38525395 TSecr=944022327
 12   0.181924 54.230.23.197 -> 172.31.36.109 TCP 7306 [TCP segment of a reassembled PDU]
 13   0.181932 172.31.36.109 -> 54.230.23.197 TCP 66 59996 > http [ACK] Seq=98 Ack=14099 Win=55168 Len=0 TSval=38525395 TSecr=944022327
 14   0.267183 54.230.23.197 -> 172.31.36.109 TCP 4410 [TCP segment of a reassembled PDU]
 15   0.267203 172.31.36.109 -> 54.230.23.197 TCP 66 59996 > http [ACK] Seq=98 Ack=18443 Win=63872 Len=0 TSval=38525416 TSecr=944022335
 16   0.267328 54.230.23.197 -> 172.31.36.109 TCP 4410 [TCP segment of a reassembled PDU]
 17   0.267335 172.31.36.109 -> 54.230.23.197 TCP 66 59996 > http [ACK] Seq=98 Ack=22787 Win=72576 Len=0 TSval=38525416 TSecr=944022335
 18   0.267399 54.230.23.197 -> 172.31.36.109 TCP 1514 [TCP segment of a reassembled PDU]
 19   0.267404 172.31.36.109 -> 54.230.23.197 TCP 66 59996 > http [ACK] Seq=98 Ack=24235 Win=75392 Len=0 TSval=38525416 TSecr=944022335
 20   0.267575 54.230.23.197 -> 172.31.36.109 TCP 2962 [TCP segment of a reassembled PDU]
 21   0.267581 172.31.36.109 -> 54.230.23.197 TCP 66 59996 > http [ACK] Seq=98 Ack=27131 Win=81152 Len=0 TSval=38525416 TSecr=944022335
 22   0.352932 54.230.23.197 -> 172.31.36.109 TCP 8754 [TCP segment of a reassembled PDU]
 23   0.352966 172.31.36.109 -> 54.230.23.197 TCP 66 59996 > http [ACK] Seq=98 Ack=35819 Win=98560 Len=0 TSval=38525438 TSecr=944022344
 24   0.352980 54.230.23.197 -> 172.31.36.109 TCP 4410 [TCP segment of a reassembled PDU]
 25   0.352985 172.31.36.109 -> 54.230.23.197 TCP 66 59996 > http [ACK] Seq=98 Ack=40163 Win=96512 Len=0 TSval=38525438 TSecr=944022344
 26   0.353103 54.230.23.197 -> 172.31.36.109 TCP 10202 [TCP segment of a reassembled PDU]
 27   0.353111 172.31.36.109 -> 54.230.23.197 TCP 66 59996 > http [ACK] Seq=98 Ack=50299 Win=118912 Len=0 TSval=38525438 TSecr=944022344
 28   0.438609 54.230.23.197 -> 172.31.36.109 TCP 1514 [TCP segment of a reassembled PDU]
 29   0.438631 172.31.36.109 -> 54.230.23.197 TCP 66 59996 > http [ACK] Seq=98 Ack=51747 Win=121728 Len=0 TSval=38525459 TSecr=944022352
 30   0.438638 54.230.23.197 -> 172.31.36.109 TCP 1514 [TCP segment of a reassembled PDU]
 31   0.438643 172.31.36.109 -> 54.230.23.197 TCP 66 59996 > http [ACK] Seq=98 Ack=53195 Win=124672 Len=0 TSval=38525459 TSecr=944022352
 32   0.438675 54.230.23.197 -> 172.31.36.109 TCP 5858 [TCP segment of a reassembled PDU]
 33   0.438680 172.31.36.109 -> 54.230.23.197 TCP 66 59996 > http [ACK] Seq=98 Ack=58987 Win=136192 Len=0 TSval=38525459 TSecr=944022352
 34   0.438867 54.230.23.197 -> 172.31.36.109 TCP 4410 [TCP segment of a reassembled PDU]
 35   0.438874 172.31.36.109 -> 54.230.23.197 TCP 66 59996 > http [ACK] Seq=98 Ack=63331 Win=144896 Len=0 TSval=38525459 TSecr=944022352
 36   0.438970 54.230.23.197 -> 172.31.36.109 TCP 14546 [TCP segment of a reassembled PDU]
 37   0.438980 172.31.36.109 -> 54.230.23.197 TCP 66 59996 > http [ACK] Seq=98 Ack=77811 Win=173824 Len=0 TSval=38525459 TSecr=944022352
 38   0.524311 54.230.23.197 -> 172.31.36.109 TCP 1514 [TCP segment of a reassembled PDU]
 39   0.524332 172.31.36.109 -> 54.230.23.197 TCP 66 59996 > http [ACK] Seq=98 Ack=79259 Win=176768 Len=0 TSval=38525481 TSecr=944022361
 40   0.524393 54.230.23.197 -> 172.31.36.109 TCP 4410 [TCP segment of a reassembled PDU]
 41   0.524401 172.31.36.109 -> 54.230.23.197 TCP 66 59996 > http [ACK] Seq=98 Ack=83603 Win=185472 Len=0 TSval=38525481 TSecr=944022361
 42   0.524506 54.230.23.197 -> 172.31.36.109 TCP 17442 [TCP segment of a reassembled PDU]
 43   0.524530 172.31.36.109 -> 54.230.23.197 TCP 66 59996 > http [ACK] Seq=98 Ack=100979 Win=178688 Len=0 TSval=38525481 TSecr=944022361
 44   0.524630 54.230.23.197 -> 172.31.36.109 HTTP 1944 HTTP/1.1 200 OK  (application/octet-stream)
 45   0.524636 172.31.36.109 -> 54.230.23.197 TCP 66 59996 > http [ACK] Seq=98 Ack=102857 Win=189184 Len=0 TSval=38525481 TSecr=944022361
 46   0.524834 172.31.36.109 -> 54.230.23.197 TCP 66 59996 > http [FIN, ACK] Seq=98 Ack=102857 Win=189184 Len=0 TSval=38525481 TSecr=944022361
 47   0.610285 54.230.23.197 -> 172.31.36.109 TCP 66 http > 59996 [FIN, ACK] Seq=102857 Ack=99 Win=14592 Len=0 TSval=944022369 TSecr=38525481
 48   0.610313 172.31.36.109 -> 54.230.23.197 TCP 66 59996 > http [ACK] Seq=99 Ack=102858 Win=189184 Len=0 TSval=38525502 TSecr=944022369
