[Measurement for 100kb at 12:32:58 20.32.2014] 
Tshark:

  1   0.000000 172.31.36.109 -> 172.31.0.2   DNS 88 Standard query 0x02f9  A dm53kc3eax57k.cloudfront.net
  2   0.000025 172.31.36.109 -> 172.31.0.2   DNS 88 Standard query 0xccc9  AAAA dm53kc3eax57k.cloudfront.net
  3   0.000602   172.31.0.2 -> 172.31.36.109 DNS 216 Standard query response 0x02f9  A 54.230.30.239 A 54.192.29.220 A 54.192.30.194 A 54.192.30.227 A 54.230.29.242 A 54.230.30.52 A 54.230.30.58 A 54.230.30.193
  4   0.000613   172.31.0.2 -> 172.31.36.109 DNS 175 Standard query response 0xccc9 
  5   0.003804 172.31.36.109 -> 54.230.30.239 TCP 74 50339 > http [SYN] Seq=0 Win=26883 Len=0 MSS=8961 SACK_PERM=1 TSval=37616279 TSecr=0 WS=128
  6   0.004973 54.230.30.239 -> 172.31.36.109 TCP 74 http > 50339 [SYN, ACK] Seq=0 Ack=1 Win=14480 Len=0 MSS=1460 SACK_PERM=1 TSval=834947420 TSecr=37616279 WS=128
  7   0.004987 172.31.36.109 -> 54.230.30.239 TCP 66 50339 > http [ACK] Seq=1 Ack=1 Win=27008 Len=0 TSval=37616280 TSecr=834947420
  8   0.005034 172.31.36.109 -> 54.230.30.239 HTTP 163 GET /100kb HTTP/1.1 
  9   0.006213 54.230.30.239 -> 172.31.36.109 TCP 66 http > 50339 [ACK] Seq=1 Ack=98 Win=14592 Len=0 TSval=834947420 TSecr=37616280
 10   0.027631 54.230.30.239 -> 172.31.36.109 TCP 8754 [TCP segment of a reassembled PDU]
 11   0.027642 172.31.36.109 -> 54.230.30.239 TCP 66 50339 > http [ACK] Seq=98 Ack=8689 Win=44288 Len=0 TSval=37616285 TSecr=834947422
 12   0.027753 54.230.30.239 -> 172.31.36.109 TCP 4410 [TCP segment of a reassembled PDU]
 13   0.027760 172.31.36.109 -> 54.230.30.239 TCP 66 50339 > http [ACK] Seq=98 Ack=13033 Win=52992 Len=0 TSval=37616285 TSecr=834947422
 14   0.028877 54.230.30.239 -> 172.31.36.109 TCP 11650 [TCP segment of a reassembled PDU]
 15   0.028888 172.31.36.109 -> 54.230.30.239 TCP 66 50339 > http [ACK] Seq=98 Ack=24617 Win=76160 Len=0 TSval=37616286 TSecr=834947422
 16   0.029023 54.230.30.239 -> 172.31.36.109 TCP 1514 [TCP segment of a reassembled PDU]
 17   0.029028 172.31.36.109 -> 54.230.30.239 TCP 66 50339 > http [ACK] Seq=98 Ack=26065 Win=79104 Len=0 TSval=37616286 TSecr=834947422
 18   0.030187 54.230.30.239 -> 172.31.36.109 TCP 4410 [TCP segment of a reassembled PDU]
 19   0.030206 172.31.36.109 -> 54.230.30.239 TCP 66 50339 > http [ACK] Seq=98 Ack=30409 Win=87808 Len=0 TSval=37616286 TSecr=834947422
 20   0.030221 54.230.30.239 -> 172.31.36.109 TCP 13098 [TCP segment of a reassembled PDU]
 21   0.030231 172.31.36.109 -> 54.230.30.239 TCP 66 50339 > http [ACK] Seq=98 Ack=43441 Win=89344 Len=0 TSval=37616286 TSecr=834947422
 22   0.030237 54.230.30.239 -> 172.31.36.109 TCP 2962 [TCP segment of a reassembled PDU]
 23   0.030240 172.31.36.109 -> 54.230.30.239 TCP 66 50339 > http [ACK] Seq=98 Ack=46337 Win=86528 Len=0 TSval=37616286 TSecr=834947422
 24   0.031341 54.230.30.239 -> 172.31.36.109 TCP 2962 [TCP segment of a reassembled PDU]
 25   0.031354 172.31.36.109 -> 54.230.30.239 TCP 66 50339 > http [ACK] Seq=98 Ack=49233 Win=109056 Len=0 TSval=37616286 TSecr=834947422
 26   0.031473 54.230.30.239 -> 172.31.36.109 TCP 11650 [TCP segment of a reassembled PDU]
 27   0.031501 172.31.36.109 -> 54.230.30.239 TCP 66 50339 > http [ACK] Seq=98 Ack=60817 Win=98944 Len=0 TSval=37616286 TSecr=834947422
 28   0.031509 54.230.30.239 -> 172.31.36.109 TCP 4410 [TCP segment of a reassembled PDU]
 29   0.031512 172.31.36.109 -> 54.230.30.239 TCP 66 50339 > http [ACK] Seq=98 Ack=65161 Win=94720 Len=0 TSval=37616286 TSecr=834947422
 30   0.032642 54.230.30.239 -> 172.31.36.109 TCP 2962 [TCP segment of a reassembled PDU]
 31   0.032655 172.31.36.109 -> 54.230.30.239 TCP 66 50339 > http [ACK] Seq=98 Ack=68057 Win=109056 Len=0 TSval=37616287 TSecr=834947422
 32   0.032713 54.230.30.239 -> 172.31.36.109 TCP 2962 [TCP segment of a reassembled PDU]
 33   0.032718 172.31.36.109 -> 54.230.30.239 TCP 66 50339 > http [ACK] Seq=98 Ack=70953 Win=114816 Len=0 TSval=37616287 TSecr=834947422
 34   0.032866 54.230.30.239 -> 172.31.36.109 TCP 4410 [TCP segment of a reassembled PDU]
 35   0.032872 172.31.36.109 -> 54.230.30.239 TCP 66 50339 > http [ACK] Seq=98 Ack=75297 Win=123520 Len=0 TSval=37616287 TSecr=834947422
 36   0.032974 54.230.30.239 -> 172.31.36.109 TCP 13098 [TCP segment of a reassembled PDU]
 37   0.032983 172.31.36.109 -> 54.230.30.239 TCP 66 50339 > http [ACK] Seq=98 Ack=88329 Win=149632 Len=0 TSval=37616287 TSecr=834947422
 38   0.033884 54.230.30.239 -> 172.31.36.109 TCP 4410 [TCP segment of a reassembled PDU]
 39   0.033890 172.31.36.109 -> 54.230.30.239 TCP 66 50339 > http [ACK] Seq=98 Ack=92673 Win=158336 Len=0 TSval=37616287 TSecr=834947423
 40   0.033998 54.230.30.239 -> 172.31.36.109 TCP 5858 [TCP segment of a reassembled PDU]
 41   0.034012 172.31.36.109 -> 54.230.30.239 TCP 66 50339 > http [ACK] Seq=98 Ack=98465 Win=169856 Len=0 TSval=37616287 TSecr=834947423
 42   0.034292 54.230.30.239 -> 172.31.36.109 HTTP 4458 HTTP/1.1 200 OK  (application/octet-stream)
 43   0.034318 172.31.36.109 -> 54.230.30.239 TCP 66 50339 > http [ACK] Seq=98 Ack=102857 Win=178688 Len=0 TSval=37616287 TSecr=834947423
 44   0.034456 172.31.36.109 -> 54.230.30.239 TCP 66 50339 > http [FIN, ACK] Seq=98 Ack=102857 Win=178688 Len=0 TSval=37616287 TSecr=834947423
 45   0.035664 54.230.30.239 -> 172.31.36.109 TCP 66 http > 50339 [FIN, ACK] Seq=102857 Ack=99 Win=14592 Len=0 TSval=834947423 TSecr=37616287
 46   0.035672 172.31.36.109 -> 54.230.30.239 TCP 66 50339 > http [ACK] Seq=99 Ack=102858 Win=178688 Len=0 TSval=37616287 TSecr=834947423
