[Measurement for 100kb at 22:32:53 19.32.2014] 
Tshark:

  1   0.000000 172.31.36.109 -> 172.31.0.2   DNS 88 Standard query 0x1477  A dm53kc3eax57k.cloudfront.net
  2   0.000023 172.31.36.109 -> 172.31.0.2   DNS 88 Standard query 0x2de9  AAAA dm53kc3eax57k.cloudfront.net
  3   0.000542   172.31.0.2 -> 172.31.36.109 DNS 175 Standard query response 0x2de9 
  4   0.000553   172.31.0.2 -> 172.31.36.109 DNS 216 Standard query response 0x1477  A 54.230.30.219 A 54.230.30.225 A 54.192.29.222 A 54.192.30.136 A 54.192.30.192 A 54.230.30.49 A 54.230.30.71 A 54.230.30.209
  5   0.003865 172.31.36.109 -> 54.230.30.219 TCP 74 42827 > http [SYN] Seq=0 Win=26883 Len=0 MSS=8961 SACK_PERM=1 TSval=25014896 TSecr=0 WS=128
  6   0.005035 54.230.30.219 -> 172.31.36.109 TCP 74 http > 42827 [SYN, ACK] Seq=0 Ack=1 Win=14480 Len=0 MSS=1460 SACK_PERM=1 TSval=686744875 TSecr=25014896 WS=128
  7   0.005049 172.31.36.109 -> 54.230.30.219 TCP 66 42827 > http [ACK] Seq=1 Ack=1 Win=27008 Len=0 TSval=25014897 TSecr=686744875
  8   0.005088 172.31.36.109 -> 54.230.30.219 HTTP 163 GET /100kb HTTP/1.1 
  9   0.006030 54.230.30.219 -> 172.31.36.109 TCP 66 http > 42827 [ACK] Seq=1 Ack=98 Win=14592 Len=0 TSval=686744875 TSecr=25014897
 10   0.019254 54.230.30.219 -> 172.31.36.109 TCP 6924 [TCP segment of a reassembled PDU]
 11   0.019279 172.31.36.109 -> 54.230.30.219 TCP 66 42827 > http [ACK] Seq=98 Ack=6859 Win=40704 Len=0 TSval=25014900 TSecr=686744876
 12   0.019291 54.230.30.219 -> 172.31.36.109 TCP 7306 [TCP segment of a reassembled PDU]
 13   0.019296 172.31.36.109 -> 54.230.30.219 TCP 66 42827 > http [ACK] Seq=98 Ack=14099 Win=55168 Len=0 TSval=25014900 TSecr=686744876
 14   0.020467 54.230.30.219 -> 172.31.36.109 TCP 10202 [TCP segment of a reassembled PDU]
 15   0.020475 172.31.36.109 -> 54.230.30.219 TCP 66 42827 > http [ACK] Seq=98 Ack=24235 Win=75392 Len=0 TSval=25014901 TSecr=686744876
 16   0.020630 54.230.30.219 -> 172.31.36.109 TCP 2962 [TCP segment of a reassembled PDU]
 17   0.020635 172.31.36.109 -> 54.230.30.219 TCP 66 42827 > http [ACK] Seq=98 Ack=27131 Win=81152 Len=0 TSval=25014901 TSecr=686744876
 18   0.021730 54.230.30.219 -> 172.31.36.109 TCP 13098 [TCP segment of a reassembled PDU]
 19   0.021738 172.31.36.109 -> 54.230.30.219 TCP 66 42827 > http [ACK] Seq=98 Ack=40163 Win=96512 Len=0 TSval=25014901 TSecr=686744876
 20   0.021924 54.230.30.219 -> 172.31.36.109 TCP 4410 [TCP segment of a reassembled PDU]
 21   0.021938 172.31.36.109 -> 54.230.30.219 TCP 66 42827 > http [ACK] Seq=98 Ack=44507 Win=115968 Len=0 TSval=25014901 TSecr=686744876
 22   0.021962 54.230.30.219 -> 172.31.36.109 TCP 2962 [TCP segment of a reassembled PDU]
 23   0.021965 172.31.36.109 -> 54.230.30.219 TCP 66 42827 > http [ACK] Seq=98 Ack=47403 Win=121728 Len=0 TSval=25014901 TSecr=686744876
 24   0.023047 54.230.30.219 -> 172.31.36.109 TCP 5858 [TCP segment of a reassembled PDU]
 25   0.023082 172.31.36.109 -> 54.230.30.219 TCP 66 42827 > http [ACK] Seq=98 Ack=53195 Win=133376 Len=0 TSval=25014901 TSecr=686744876
 26   0.023097 54.230.30.219 -> 172.31.36.109 TCP 10202 [TCP segment of a reassembled PDU]
 27   0.023103 172.31.36.109 -> 54.230.30.219 TCP 66 42827 > http [ACK] Seq=98 Ack=63331 Win=153600 Len=0 TSval=25014901 TSecr=686744876
 28   0.023247 54.230.30.219 -> 172.31.36.109 TCP 2962 [TCP segment of a reassembled PDU]
 29   0.023252 172.31.36.109 -> 54.230.30.219 TCP 66 42827 > http [ACK] Seq=98 Ack=66227 Win=159360 Len=0 TSval=25014901 TSecr=686744876
 30   0.024261 54.230.30.219 -> 172.31.36.109 TCP 2962 [TCP segment of a reassembled PDU]
 31   0.024266 172.31.36.109 -> 54.230.30.219 TCP 66 42827 > http [ACK] Seq=98 Ack=69123 Win=165248 Len=0 TSval=25014902 TSecr=686744877
 32   0.024518 54.230.30.219 -> 172.31.36.109 TCP 4410 [TCP segment of a reassembled PDU]
 33   0.024544 172.31.36.109 -> 54.230.30.219 TCP 66 42827 > http [ACK] Seq=98 Ack=73467 Win=173824 Len=0 TSval=25014902 TSecr=686744877
 34   0.024585 54.230.30.219 -> 172.31.36.109 TCP 5858 [TCP segment of a reassembled PDU]
 35   0.024590 172.31.36.109 -> 54.230.30.219 TCP 66 42827 > http [ACK] Seq=98 Ack=79259 Win=185472 Len=0 TSval=25014902 TSecr=686744877
 36   0.024605 54.230.30.219 -> 172.31.36.109 TCP 11650 [TCP segment of a reassembled PDU]
 37   0.024615 172.31.36.109 -> 54.230.30.219 TCP 66 42827 > http [ACK] Seq=98 Ack=90843 Win=178688 Len=0 TSval=25014902 TSecr=686744877
 38   0.025836 54.230.30.219 -> 172.31.36.109 TCP 10202 [TCP segment of a reassembled PDU]
 39   0.025859 172.31.36.109 -> 54.230.30.219 TCP 66 42827 > http [ACK] Seq=98 Ack=100979 Win=190592 Len=0 TSval=25014902 TSecr=686744877
 40   0.025876 54.230.30.219 -> 172.31.36.109 HTTP 1944 HTTP/1.1 200 OK  (application/octet-stream)
 41   0.025879 172.31.36.109 -> 54.230.30.219 TCP 66 42827 > http [ACK] Seq=98 Ack=102857 Win=188800 Len=0 TSval=25014902 TSecr=686744877
 42   0.025987 172.31.36.109 -> 54.230.30.219 TCP 66 42827 > http [FIN, ACK] Seq=98 Ack=102857 Win=205696 Len=0 TSval=25014902 TSecr=686744877
 43   0.027060 54.230.30.219 -> 172.31.36.109 TCP 66 http > 42827 [FIN, ACK] Seq=102857 Ack=99 Win=14592 Len=0 TSval=686744877 TSecr=25014902
 44   0.027100 172.31.36.109 -> 54.230.30.219 TCP 66 42827 > http [ACK] Seq=99 Ack=102858 Win=205696 Len=0 TSval=25014902 TSecr=686744877
