[Measurement for 100kb at 02:32:56 20.32.2014] 
Tshark:

  1   0.000000 172.31.36.109 -> 172.31.0.2   DNS 88 Standard query 0x595d  A dm53kc3eax57k.cloudfront.net
  2   0.000022 172.31.36.109 -> 172.31.0.2   DNS 88 Standard query 0xccac  AAAA dm53kc3eax57k.cloudfront.net
  3   0.000466   172.31.0.2 -> 172.31.36.109 DNS 216 Standard query response 0x595d  A 54.192.30.188 A 54.192.30.218 A 54.230.30.37 A 54.230.30.50 A 54.230.30.53 A 54.230.30.57 A 54.230.30.249 A 54.192.30.184
  4   0.000495   172.31.0.2 -> 172.31.36.109 DNS 175 Standard query response 0xccac 
  5   0.003908 172.31.36.109 -> 54.192.30.188 TCP 74 42873 > http [SYN] Seq=0 Win=26883 Len=0 MSS=8961 SACK_PERM=1 TSval=28615724 TSecr=0 WS=128
  6   0.005307 54.192.30.188 -> 172.31.36.109 TCP 74 http > 42873 [SYN, ACK] Seq=0 Ack=1 Win=14480 Len=0 MSS=1460 SACK_PERM=1 TSval=688185168 TSecr=28615724 WS=128
  7   0.005352 172.31.36.109 -> 54.192.30.188 TCP 66 42873 > http [ACK] Seq=1 Ack=1 Win=27008 Len=0 TSval=28615724 TSecr=688185168
  8   0.005389 172.31.36.109 -> 54.192.30.188 HTTP 163 GET /100kb HTTP/1.1 
  9   0.006552 54.192.30.188 -> 172.31.36.109 TCP 66 http > 42873 [ACK] Seq=1 Ack=98 Win=14592 Len=0 TSval=688185168 TSecr=28615724
 10   0.039788 54.192.30.188 -> 172.31.36.109 TCP 13098 [TCP segment of a reassembled PDU]
 11   0.039800 172.31.36.109 -> 54.192.30.188 TCP 66 42873 > http [ACK] Seq=98 Ack=13033 Win=52992 Len=0 TSval=28615733 TSecr=688185171
 12   0.041083 54.192.30.188 -> 172.31.36.109 TCP 10202 [TCP segment of a reassembled PDU]
 13   0.041092 172.31.36.109 -> 54.192.30.188 TCP 66 42873 > http [ACK] Seq=98 Ack=23169 Win=73344 Len=0 TSval=28615733 TSecr=688185172
 14   0.041158 54.192.30.188 -> 172.31.36.109 TCP 2962 [TCP segment of a reassembled PDU]
 15   0.041163 172.31.36.109 -> 54.192.30.188 TCP 66 42873 > http [ACK] Seq=98 Ack=26065 Win=79104 Len=0 TSval=28615733 TSecr=688185172
 16   0.042500 54.192.30.188 -> 172.31.36.109 TCP 7306 [TCP segment of a reassembled PDU]
 17   0.042507 172.31.36.109 -> 54.192.30.188 TCP 66 42873 > http [ACK] Seq=98 Ack=33305 Win=93568 Len=0 TSval=28615734 TSecr=688185172
 18   0.042532 54.192.30.188 -> 172.31.36.109 TCP 5858 [TCP segment of a reassembled PDU]
 19   0.042538 172.31.36.109 -> 54.192.30.188 TCP 66 42873 > http [ACK] Seq=98 Ack=39097 Win=96512 Len=0 TSval=28615734 TSecr=688185172
 20   0.043559 54.192.30.188 -> 172.31.36.109 TCP 2962 [TCP segment of a reassembled PDU]
 21   0.043566 172.31.36.109 -> 54.192.30.188 TCP 66 42873 > http [ACK] Seq=98 Ack=41993 Win=109056 Len=0 TSval=28615734 TSecr=688185172
 22   0.043637 54.192.30.188 -> 172.31.36.109 TCP 8754 [TCP segment of a reassembled PDU]
 23   0.043645 172.31.36.109 -> 54.192.30.188 TCP 66 42873 > http [ACK] Seq=98 Ack=50681 Win=126464 Len=0 TSval=28615734 TSecr=688185172
 24   0.043827 54.192.30.188 -> 172.31.36.109 TCP 1514 [TCP segment of a reassembled PDU]
 25   0.043832 172.31.36.109 -> 54.192.30.188 TCP 66 42873 > http [ACK] Seq=98 Ack=52129 Win=129280 Len=0 TSval=28615734 TSecr=688185172
 26   0.043843 54.192.30.188 -> 172.31.36.109 TCP 8754 [TCP segment of a reassembled PDU]
 27   0.043852 172.31.36.109 -> 54.192.30.188 TCP 66 42873 > http [ACK] Seq=98 Ack=60817 Win=146688 Len=0 TSval=28615734 TSecr=688185172
 28   0.044775 54.192.30.188 -> 172.31.36.109 TCP 1514 [TCP segment of a reassembled PDU]
 29   0.044779 172.31.36.109 -> 54.192.30.188 TCP 66 42873 > http [ACK] Seq=98 Ack=62265 Win=149632 Len=0 TSval=28615734 TSecr=688185172
 30   0.044824 54.192.30.188 -> 172.31.36.109 TCP 2962 [TCP segment of a reassembled PDU]
 31   0.044829 172.31.36.109 -> 54.192.30.188 TCP 66 42873 > http [ACK] Seq=98 Ack=65161 Win=155392 Len=0 TSval=28615734 TSecr=688185172
 32   0.045146 54.192.30.188 -> 172.31.36.109 TCP 2962 [TCP segment of a reassembled PDU]
 33   0.045151 172.31.36.109 -> 54.192.30.188 TCP 66 42873 > http [ACK] Seq=98 Ack=68057 Win=161152 Len=0 TSval=28615734 TSecr=688185172
 34   0.045163 54.192.30.188 -> 172.31.36.109 TCP 8754 [TCP segment of a reassembled PDU]
 35   0.045172 172.31.36.109 -> 54.192.30.188 TCP 66 42873 > http [ACK] Seq=98 Ack=76745 Win=178560 Len=0 TSval=28615734 TSecr=688185172
 36   0.045262 54.192.30.188 -> 172.31.36.109 TCP 11650 [TCP segment of a reassembled PDU]
 37   0.045280 172.31.36.109 -> 54.192.30.188 TCP 66 42873 > http [ACK] Seq=98 Ack=88329 Win=179200 Len=0 TSval=28615734 TSecr=688185172
 38   0.046362 54.192.30.188 -> 172.31.36.109 TCP 5858 [TCP segment of a reassembled PDU]
 39   0.046369 172.31.36.109 -> 54.192.30.188 TCP 66 42873 > http [ACK] Seq=98 Ack=94121 Win=188672 Len=0 TSval=28615735 TSecr=688185172
 40   0.046463 54.192.30.188 -> 172.31.36.109 TCP 5858 [TCP segment of a reassembled PDU]
 41   0.046469 172.31.36.109 -> 54.192.30.188 TCP 66 42873 > http [ACK] Seq=98 Ack=99913 Win=212736 Len=0 TSval=28615735 TSecr=688185172
 42   0.046588 54.192.30.188 -> 172.31.36.109 HTTP 3010 HTTP/1.1 200 OK  (application/octet-stream)
 43   0.046593 172.31.36.109 -> 54.192.30.188 TCP 66 42873 > http [ACK] Seq=98 Ack=102857 Win=218624 Len=0 TSval=28615735 TSecr=688185172
 44   0.046727 172.31.36.109 -> 54.192.30.188 TCP 66 42873 > http [FIN, ACK] Seq=98 Ack=102857 Win=218624 Len=0 TSval=28615735 TSecr=688185172
 45   0.047925 54.192.30.188 -> 172.31.36.109 TCP 66 http > 42873 [FIN, ACK] Seq=102857 Ack=99 Win=14592 Len=0 TSval=688185172 TSecr=28615735
 46   0.047934 172.31.36.109 -> 54.192.30.188 TCP 66 42873 > http [ACK] Seq=99 Ack=102858 Win=218624 Len=0 TSval=28615735 TSecr=688185172
