[Measurement for 100kb at 17:36:02 19.36.2014] 
Tshark:

  1   0.000000 172.31.36.109 -> 172.31.0.2   DNS 88 Standard query 0xebf3  A dm53kc3eax57k.cloudfront.net
  2   0.000037 172.31.36.109 -> 172.31.0.2   DNS 88 Standard query 0xc0ef  AAAA dm53kc3eax57k.cloudfront.net
  3   0.000544   172.31.0.2 -> 172.31.36.109 DNS 216 Standard query response 0xebf3  A 54.230.30.205 A 54.230.31.3 A 54.192.30.223 A 54.230.29.241 A 54.230.30.5 A 54.230.30.37 A 54.230.30.51 A 54.230.30.56
  4   0.000556   172.31.0.2 -> 172.31.36.109 DNS 175 Standard query response 0xc0ef 
  5   0.003891 172.31.36.109 -> 54.230.30.205 TCP 74 37263 > http [SYN] Seq=0 Win=26883 Len=0 MSS=8961 SACK_PERM=1 TSval=20562352 TSecr=0 WS=128
  6   0.005282 54.230.30.205 -> 172.31.36.109 TCP 74 http > 37263 [SYN, ACK] Seq=0 Ack=1 Win=14480 Len=0 MSS=1460 SACK_PERM=1 TSval=631394956 TSecr=20562352 WS=128
  7   0.005297 172.31.36.109 -> 54.230.30.205 TCP 66 37263 > http [ACK] Seq=1 Ack=1 Win=27008 Len=0 TSval=20562352 TSecr=631394956
  8   0.005363 172.31.36.109 -> 54.230.30.205 HTTP 163 GET /100kb HTTP/1.1 
  9   0.006768 54.230.30.205 -> 172.31.36.109 TCP 66 http > 37263 [ACK] Seq=1 Ack=98 Win=14592 Len=0 TSval=631394956 TSecr=20562353
 10   0.265995 54.230.30.205 -> 172.31.36.109 TCP 4410 [TCP segment of a reassembled PDU]
 11   0.266016 172.31.36.109 -> 54.230.30.205 TCP 66 37263 > http [ACK] Seq=98 Ack=4345 Win=35584 Len=0 TSval=20562418 TSecr=631394982
 12   0.266030 54.230.30.205 -> 172.31.36.109 TCP 7306 [TCP segment of a reassembled PDU]
 13   0.266036 172.31.36.109 -> 54.230.30.205 TCP 66 37263 > http [ACK] Seq=98 Ack=11585 Win=50176 Len=0 TSval=20562418 TSecr=631394982
 14   0.266167 54.230.30.205 -> 172.31.36.109 TCP 1933 [TCP segment of a reassembled PDU]
 15   0.266186 172.31.36.109 -> 54.230.30.205 TCP 66 37263 > http [ACK] Seq=98 Ack=13452 Win=53888 Len=0 TSval=20562418 TSecr=631394982
 16   0.291023 54.230.30.205 -> 172.31.36.109 TCP 1526 [TCP segment of a reassembled PDU]
 17   0.291029 172.31.36.109 -> 54.230.30.205 TCP 66 37263 > http [ACK] Seq=98 Ack=14912 Win=56832 Len=0 TSval=20562424 TSecr=631394985
 18   0.292531 54.230.30.205 -> 172.31.36.109 TCP 1514 [TCP segment of a reassembled PDU]
 19   0.292536 172.31.36.109 -> 54.230.30.205 TCP 66 37263 > http [ACK] Seq=98 Ack=16360 Win=59648 Len=0 TSval=20562424 TSecr=631394985
 20   0.292760 54.230.30.205 -> 172.31.36.109 TCP 2962 [TCP segment of a reassembled PDU]
 21   0.292764 172.31.36.109 -> 54.230.30.205 TCP 66 37263 > http [ACK] Seq=98 Ack=19256 Win=65408 Len=0 TSval=20562424 TSecr=631394985
 22   0.292771 54.230.30.205 -> 172.31.36.109 TCP 4410 [TCP segment of a reassembled PDU]
 23   0.292774 172.31.36.109 -> 54.230.30.205 TCP 66 37263 > http [ACK] Seq=98 Ack=23600 Win=74112 Len=0 TSval=20562424 TSecr=631394985
 24   0.293021 54.230.30.205 -> 172.31.36.109 TCP 7306 [TCP segment of a reassembled PDU]
 25   0.293037 172.31.36.109 -> 54.230.30.205 TCP 66 37263 > http [ACK] Seq=98 Ack=30840 Win=88576 Len=0 TSval=20562424 TSecr=631394985
 26   0.294005 54.230.30.205 -> 172.31.36.109 TCP 2962 [TCP segment of a reassembled PDU]
 27   0.294010 172.31.36.109 -> 54.230.30.205 TCP 66 37263 > http [ACK] Seq=98 Ack=33736 Win=94464 Len=0 TSval=20562425 TSecr=631394985
 28   0.294091 54.230.30.205 -> 172.31.36.109 TCP 4410 [TCP segment of a reassembled PDU]
 29   0.294096 172.31.36.109 -> 54.230.30.205 TCP 66 37263 > http [ACK] Seq=98 Ack=38080 Win=103168 Len=0 TSval=20562425 TSecr=631394985
 30   0.294241 54.230.30.205 -> 172.31.36.109 TCP 1718 [TCP segment of a reassembled PDU]
 31   0.294246 172.31.36.109 -> 54.230.30.205 TCP 66 37263 > http [ACK] Seq=98 Ack=39732 Win=106368 Len=0 TSval=20562425 TSecr=631394985
 32   0.316286 54.230.30.205 -> 172.31.36.109 TCP 1514 [TCP segment of a reassembled PDU]
 33   0.316291 172.31.36.109 -> 54.230.30.205 TCP 66 37263 > http [ACK] Seq=98 Ack=41180 Win=109056 Len=0 TSval=20562430 TSecr=631394987
 34   0.316515 54.230.30.205 -> 172.31.36.109 TCP 1526 [TCP segment of a reassembled PDU]
 35   0.316520 172.31.36.109 -> 54.230.30.205 TCP 66 37263 > http [ACK] Seq=98 Ack=42640 Win=109056 Len=0 TSval=20562430 TSecr=631394987
 36   0.316528 54.230.30.205 -> 172.31.36.109 TCP 2962 [TCP segment of a reassembled PDU]
 37   0.316531 172.31.36.109 -> 54.230.30.205 TCP 66 37263 > http [ACK] Seq=98 Ack=45536 Win=108416 Len=0 TSval=20562430 TSecr=631394987
 38   0.316560 54.230.30.205 -> 172.31.36.109 TCP 2962 [TCP segment of a reassembled PDU]
 39   0.316565 172.31.36.109 -> 54.230.30.205 TCP 66 37263 > http [ACK] Seq=98 Ack=48432 Win=109056 Len=0 TSval=20562430 TSecr=631394987
 40   0.316647 54.230.30.205 -> 172.31.36.109 TCP 10202 [TCP segment of a reassembled PDU]
 41   0.316655 172.31.36.109 -> 54.230.30.205 TCP 66 37263 > http [ACK] Seq=98 Ack=58568 Win=101248 Len=0 TSval=20562430 TSecr=631394987
 42   0.316705 54.230.30.205 -> 172.31.36.109 TCP 1514 [TCP segment of a reassembled PDU]
 43   0.316709 172.31.36.109 -> 54.230.30.205 TCP 66 37263 > http [ACK] Seq=98 Ack=60016 Win=109056 Len=0 TSval=20562430 TSecr=631394987
 44   0.317801 54.230.30.205 -> 172.31.36.109 TCP 2962 [TCP segment of a reassembled PDU]
 45   0.317819 172.31.36.109 -> 54.230.30.205 TCP 66 37263 > http [ACK] Seq=98 Ack=62912 Win=109056 Len=0 TSval=20562431 TSecr=631394988
 46   0.317877 54.230.30.205 -> 172.31.36.109 TCP 6086 [TCP segment of a reassembled PDU]
 47   0.317883 172.31.36.109 -> 54.230.30.205 TCP 66 37263 > http [ACK] Seq=98 Ack=68932 Win=105984 Len=0 TSval=20562431 TSecr=631394988
 48   0.343736 54.230.30.205 -> 172.31.36.109 TCP 5858 [TCP segment of a reassembled PDU]
 49   0.343743 172.31.36.109 -> 54.230.30.205 TCP 66 37263 > http [ACK] Seq=98 Ack=74724 Win=108416 Len=0 TSval=20562437 TSecr=631394990
 50   0.343755 54.230.30.205 -> 172.31.36.109 TCP 5858 [TCP segment of a reassembled PDU]
 51   0.343777 172.31.36.109 -> 54.230.30.205 TCP 66 37263 > http [ACK] Seq=98 Ack=80516 Win=109056 Len=0 TSval=20562437 TSecr=631394990
 52   0.343850 54.230.30.205 -> 172.31.36.109 TCP 10202 [TCP segment of a reassembled PDU]
 53   0.343857 172.31.36.109 -> 54.230.30.205 TCP 66 37263 > http [ACK] Seq=98 Ack=90652 Win=129280 Len=0 TSval=20562437 TSecr=631394990
 54   0.343902 54.230.30.205 -> 172.31.36.109 TCP 3166 [TCP segment of a reassembled PDU]
 55   0.343908 172.31.36.109 -> 54.230.30.205 TCP 66 37263 > http [ACK] Seq=98 Ack=93752 Win=135552 Len=0 TSval=20562437 TSecr=631394990
 56   0.347320 54.230.30.205 -> 172.31.36.109 TCP 7306 [TCP segment of a reassembled PDU]
 57   0.347327 172.31.36.109 -> 54.230.30.205 TCP 66 37263 > http [ACK] Seq=98 Ack=100992 Win=150016 Len=0 TSval=20562438 TSecr=631394991
 58   0.347343 54.230.30.205 -> 172.31.36.109 HTTP 1920 HTTP/1.1 200 OK  (application/octet-stream)
 59   0.347346 172.31.36.109 -> 54.230.30.205 TCP 66 37263 > http [ACK] Seq=98 Ack=102846 Win=153728 Len=0 TSval=20562438 TSecr=631394991
 60   0.347484 172.31.36.109 -> 54.230.30.205 TCP 66 37263 > http [FIN, ACK] Seq=98 Ack=102846 Win=153728 Len=0 TSval=20562438 TSecr=631394991
 61   0.349087 54.230.30.205 -> 172.31.36.109 TCP 66 http > 37263 [FIN, ACK] Seq=102846 Ack=99 Win=14592 Len=0 TSval=631394991 TSecr=20562438
 62   0.349097 172.31.36.109 -> 54.230.30.205 TCP 66 37263 > http [ACK] Seq=99 Ack=102847 Win=153728 Len=0 TSval=20562438 TSecr=631394991
