[Measurement for 100kb at 09:33:16 20.33.2014] 
Tshark:

  1   0.000000 172.31.36.109 -> 172.31.0.2   DNS 88 Standard query 0x03d5  A dm53kc3eax57k.cloudfront.net
  2   0.000036 172.31.36.109 -> 172.31.0.2   DNS 88 Standard query 0x0e8a  AAAA dm53kc3eax57k.cloudfront.net
  3   0.000391   172.31.0.2 -> 172.31.36.109 DNS 175 Standard query response 0x0e8a 
  4   0.000403   172.31.0.2 -> 172.31.36.109 DNS 216 Standard query response 0x03d5  A 54.230.30.210 A 54.230.30.230 A 54.230.30.254 A 54.192.30.221 A 54.230.30.12 A 54.230.30.26 A 54.230.30.37 A 54.230.30.73
  5   0.003845 172.31.36.109 -> 54.230.30.210 TCP 74 52233 > http [SYN] Seq=0 Win=26883 Len=0 MSS=8961 SACK_PERM=1 TSval=34920752 TSecr=0 WS=128
  6   0.005191 54.230.30.210 -> 172.31.36.109 TCP 74 http > 52233 [SYN, ACK] Seq=0 Ack=1 Win=14480 Len=0 MSS=1460 SACK_PERM=1 TSval=734233103 TSecr=34920752 WS=128
  7   0.005205 172.31.36.109 -> 54.230.30.210 TCP 66 52233 > http [ACK] Seq=1 Ack=1 Win=27008 Len=0 TSval=34920752 TSecr=734233103
  8   0.005246 172.31.36.109 -> 54.230.30.210 HTTP 163 GET /100kb HTTP/1.1 
  9   0.006550 54.230.30.210 -> 172.31.36.109 TCP 66 http > 52233 [ACK] Seq=1 Ack=98 Win=14592 Len=0 TSval=734233103 TSecr=34920752
 10   0.029114 54.230.30.210 -> 172.31.36.109 TCP 5858 [TCP segment of a reassembled PDU]
 11   0.029133 172.31.36.109 -> 54.230.30.210 TCP 66 52233 > http [ACK] Seq=98 Ack=5793 Win=38528 Len=0 TSval=34920758 TSecr=734233105
 12   0.029138 54.230.30.210 -> 172.31.36.109 TCP 1132 [TCP segment of a reassembled PDU]
 13   0.029141 172.31.36.109 -> 54.230.30.210 TCP 66 52233 > http [ACK] Seq=98 Ack=6859 Win=41472 Len=0 TSval=34920758 TSecr=734233105
 14   0.029165 54.230.30.210 -> 172.31.36.109 TCP 7306 [TCP segment of a reassembled PDU]
 15   0.029171 172.31.36.109 -> 54.230.30.210 TCP 66 52233 > http [ACK] Seq=98 Ack=14099 Win=55936 Len=0 TSval=34920758 TSecr=734233105
 16   0.030302 54.230.30.210 -> 172.31.36.109 TCP 2962 [TCP segment of a reassembled PDU]
 17   0.030309 172.31.36.109 -> 54.230.30.210 TCP 66 52233 > http [ACK] Seq=98 Ack=16995 Win=61696 Len=0 TSval=34920758 TSecr=734233105
 18   0.030327 54.230.30.210 -> 172.31.36.109 TCP 5858 [TCP segment of a reassembled PDU]
 19   0.030331 172.31.36.109 -> 54.230.30.210 TCP 66 52233 > http [ACK] Seq=98 Ack=22787 Win=73344 Len=0 TSval=34920758 TSecr=734233105
 20   0.030364 54.230.30.210 -> 172.31.36.109 TCP 2962 [TCP segment of a reassembled PDU]
 21   0.030369 172.31.36.109 -> 54.230.30.210 TCP 66 52233 > http [ACK] Seq=98 Ack=25683 Win=79104 Len=0 TSval=34920758 TSecr=734233105
 22   0.030547 54.230.30.210 -> 172.31.36.109 TCP 1514 [TCP segment of a reassembled PDU]
 23   0.030552 172.31.36.109 -> 54.230.30.210 TCP 66 52233 > http [ACK] Seq=98 Ack=27131 Win=81920 Len=0 TSval=34920758 TSecr=734233105
 24   0.031895 54.230.30.210 -> 172.31.36.109 TCP 10202 [TCP segment of a reassembled PDU]
 25   0.031903 172.31.36.109 -> 54.230.30.210 TCP 66 52233 > http [ACK] Seq=98 Ack=37267 Win=101248 Len=0 TSval=34920759 TSecr=734233105
 26   0.031920 54.230.30.210 -> 172.31.36.109 TCP 2962 [TCP segment of a reassembled PDU]
 27   0.031923 172.31.36.109 -> 54.230.30.210 TCP 66 52233 > http [ACK] Seq=98 Ack=40163 Win=98432 Len=0 TSval=34920759 TSecr=734233105
 28   0.031964 54.230.30.210 -> 172.31.36.109 TCP 4410 [TCP segment of a reassembled PDU]
 29   0.031969 172.31.36.109 -> 54.230.30.210 TCP 66 52233 > http [ACK] Seq=98 Ack=44507 Win=110976 Len=0 TSval=34920759 TSecr=734233105
 30   0.032216 54.230.30.210 -> 172.31.36.109 TCP 4410 [TCP segment of a reassembled PDU]
 31   0.032221 172.31.36.109 -> 54.230.30.210 TCP 66 52233 > http [ACK] Seq=98 Ack=48851 Win=119680 Len=0 TSval=34920759 TSecr=734233105
 32   0.033140 54.230.30.210 -> 172.31.36.109 TCP 1514 [TCP segment of a reassembled PDU]
 33   0.033145 172.31.36.109 -> 54.230.30.210 TCP 66 52233 > http [ACK] Seq=98 Ack=50299 Win=122496 Len=0 TSval=34920759 TSecr=734233106
 34   0.033223 54.230.30.210 -> 172.31.36.109 TCP 14546 [TCP segment of a reassembled PDU]
 35   0.033232 172.31.36.109 -> 54.230.30.210 TCP 66 52233 > http [ACK] Seq=98 Ack=64779 Win=151424 Len=0 TSval=34920759 TSecr=734233106
 36   0.033270 54.230.30.210 -> 172.31.36.109 TCP 8754 [TCP segment of a reassembled PDU]
 37   0.033277 172.31.36.109 -> 54.230.30.210 TCP 66 52233 > http [ACK] Seq=98 Ack=73467 Win=168832 Len=0 TSval=34920759 TSecr=734233106
 38   0.033324 54.230.30.210 -> 172.31.36.109 TCP 1514 [TCP segment of a reassembled PDU]
 39   0.033328 172.31.36.109 -> 54.230.30.210 TCP 66 52233 > http [ACK] Seq=98 Ack=74915 Win=171776 Len=0 TSval=34920759 TSecr=734233106
 40   0.033441 54.230.30.210 -> 172.31.36.109 TCP 4410 [TCP segment of a reassembled PDU]
 41   0.033446 172.31.36.109 -> 54.230.30.210 TCP 66 52233 > http [ACK] Seq=98 Ack=79259 Win=180480 Len=0 TSval=34920759 TSecr=734233106
 42   0.034384 54.230.30.210 -> 172.31.36.109 TCP 4410 [TCP segment of a reassembled PDU]
 43   0.034400 172.31.36.109 -> 54.230.30.210 TCP 66 52233 > http [ACK] Seq=98 Ack=83603 Win=189184 Len=0 TSval=34920759 TSecr=734233106
 44   0.034513 54.230.30.210 -> 172.31.36.109 TCP 10202 [TCP segment of a reassembled PDU]
 45   0.034521 172.31.36.109 -> 54.230.30.210 TCP 66 52233 > http [ACK] Seq=98 Ack=93739 Win=190592 Len=0 TSval=34920759 TSecr=734233106
 46   0.034555 54.230.30.210 -> 172.31.36.109 TCP 5858 [TCP segment of a reassembled PDU]
 47   0.034560 172.31.36.109 -> 54.230.30.210 TCP 66 52233 > http [ACK] Seq=98 Ack=99531 Win=197760 Len=0 TSval=34920759 TSecr=734233106
 48   0.034636 54.230.30.210 -> 172.31.36.109 HTTP 3392 HTTP/1.1 200 OK  (application/octet-stream)
 49   0.034641 172.31.36.109 -> 54.230.30.210 TCP 66 52233 > http [ACK] Seq=98 Ack=102857 Win=200064 Len=0 TSval=34920759 TSecr=734233106
 50   0.034792 172.31.36.109 -> 54.230.30.210 TCP 66 52233 > http [FIN, ACK] Seq=98 Ack=102857 Win=207360 Len=0 TSval=34920759 TSecr=734233106
 51   0.035953 54.230.30.210 -> 172.31.36.109 TCP 66 http > 52233 [FIN, ACK] Seq=102857 Ack=99 Win=14592 Len=0 TSval=734233106 TSecr=34920759
 52   0.035962 172.31.36.109 -> 54.230.30.210 TCP 66 52233 > http [ACK] Seq=99 Ack=102858 Win=207360 Len=0 TSval=34920760 TSecr=734233106
