[Measurement for 10kb at 12:37:41 20.37.2014] 
Tshark:

  1   0.000000 172.31.29.138 -> 172.31.0.2   DNS 88 Standard query 0xd925  A dm53kc3eax57k.cloudfront.net
  2   0.000041 172.31.29.138 -> 172.31.0.2   DNS 88 Standard query 0xfa33  AAAA dm53kc3eax57k.cloudfront.net
  3   0.000652   172.31.0.2 -> 172.31.29.138 DNS 216 Standard query response 0xd925  A 54.230.158.217 A 54.230.158.230 A 54.230.158.244 A 54.230.159.137 A 54.192.157.139 A 54.192.157.142 A 54.192.159.107 A 54.230.158.191
  4   0.000663   172.31.0.2 -> 172.31.29.138 DNS 175 Standard query response 0xfa33 
  5   0.003855 172.31.29.138 -> 54.230.158.217 TCP 74 42370 > http [SYN] Seq=0 Win=26883 Len=0 MSS=8961 SACK_PERM=1 TSval=17733653 TSecr=0 WS=128
  6   0.004372 54.230.158.217 -> 172.31.29.138 TCP 74 http > 42370 [SYN, ACK] Seq=0 Ack=1 Win=14480 Len=0 MSS=1460 SACK_PERM=1 TSval=813301899 TSecr=17733653 WS=128
  7   0.004387 172.31.29.138 -> 54.230.158.217 TCP 66 42370 > http [ACK] Seq=1 Ack=1 Win=27008 Len=0 TSval=17733653 TSecr=813301899
  8   0.004436 172.31.29.138 -> 54.230.158.217 HTTP 162 GET /10kb HTTP/1.1 
  9   0.005138 54.230.158.217 -> 172.31.29.138 TCP 66 http > 42370 [ACK] Seq=1 Ack=97 Win=14592 Len=0 TSval=813301899 TSecr=17733653
 10   0.007794 54.230.158.217 -> 172.31.29.138 TCP 1132 [TCP segment of a reassembled PDU]
 11   0.007802 172.31.29.138 -> 54.230.158.217 TCP 66 42370 > http [ACK] Seq=97 Ack=1067 Win=29056 Len=0 TSval=17733654 TSecr=813301900
 12   0.007814 54.230.158.217 -> 172.31.29.138 HTTP 9695 HTTP/1.1 200 OK  (application/octet-stream)
 13   0.007824 172.31.29.138 -> 54.230.158.217 TCP 66 42370 > http [ACK] Seq=97 Ack=10696 Win=48384 Len=0 TSval=17733654 TSecr=813301900
 14   0.007974 172.31.29.138 -> 54.230.158.217 TCP 66 42370 > http [FIN, ACK] Seq=97 Ack=10696 Win=48384 Len=0 TSval=17733654 TSecr=813301900
 15   0.008447 54.230.158.217 -> 172.31.29.138 TCP 66 http > 42370 [FIN, ACK] Seq=10696 Ack=98 Win=14592 Len=0 TSval=813301900 TSecr=17733654
 16   0.008455 172.31.29.138 -> 54.230.158.217 TCP 66 42370 > http [ACK] Seq=98 Ack=10697 Win=48384 Len=0 TSval=17733654 TSecr=813301900
