[Measurement for 10kb at 20:38:38 19.38.2014] 
Tshark:

  1   0.000000 172.31.29.138 -> 172.31.0.2   DNS 88 Standard query 0xcedd  A dm53kc3eax57k.cloudfront.net
  2   0.000024 172.31.29.138 -> 172.31.0.2   DNS 88 Standard query 0x1cd1  AAAA dm53kc3eax57k.cloudfront.net
  3   0.000584   172.31.0.2 -> 172.31.29.138 DNS 216 Standard query response 0xcedd  A 54.230.157.230 A 54.230.158.152 A 54.230.158.223 A 54.230.158.246 A 54.230.159.132 A 54.230.159.150 A 54.192.156.109 A 54.230.156.193
  4   0.000603   172.31.0.2 -> 172.31.29.138 DNS 175 Standard query response 0x1cd1 
  5   0.003927 172.31.29.138 -> 54.230.157.230 TCP 74 60412 > http [SYN] Seq=0 Win=26883 Len=0 MSS=8961 SACK_PERM=1 TSval=3347852 TSecr=0 WS=128
  6   0.004793 54.230.157.230 -> 172.31.29.138 TCP 74 http > 60412 [SYN, ACK] Seq=0 Ack=1 Win=14480 Len=0 MSS=1460 SACK_PERM=1 TSval=832479739 TSecr=3347852 WS=128
  7   0.004807 172.31.29.138 -> 54.230.157.230 TCP 66 60412 > http [ACK] Seq=1 Ack=1 Win=27008 Len=0 TSval=3347852 TSecr=832479739
  8   0.004845 172.31.29.138 -> 54.230.157.230 HTTP 162 GET /10kb HTTP/1.1 
  9   0.005502 54.230.157.230 -> 172.31.29.138 TCP 66 http > 60412 [ACK] Seq=1 Ack=97 Win=14592 Len=0 TSval=832479739 TSecr=3347852
 10   0.008128 54.230.157.230 -> 172.31.29.138 HTTP 10761 HTTP/1.1 200 OK  (application/octet-stream)
 11   0.008139 172.31.29.138 -> 54.230.157.230 TCP 66 60412 > http [ACK] Seq=97 Ack=10696 Win=48384 Len=0 TSval=3347853 TSecr=832479740
 12   0.008297 172.31.29.138 -> 54.230.157.230 TCP 66 60412 > http [FIN, ACK] Seq=97 Ack=10696 Win=48384 Len=0 TSval=3347853 TSecr=832479740
 13   0.008737 54.230.157.230 -> 172.31.29.138 TCP 66 http > 60412 [FIN, ACK] Seq=10696 Ack=98 Win=14592 Len=0 TSval=832479740 TSecr=3347853
 14   0.008744 172.31.29.138 -> 54.230.157.230 TCP 66 60412 > http [ACK] Seq=98 Ack=10697 Win=48384 Len=0 TSval=3347853 TSecr=832479740
