[Measurement for 10kb at 10:37:41 20.37.2014] 
Tshark:

  1   0.000000 172.31.29.138 -> 172.31.0.2   DNS 88 Standard query 0x3649  A dm53kc3eax57k.cloudfront.net
  2   0.000038 172.31.29.138 -> 172.31.0.2   DNS 88 Standard query 0xf17f  AAAA dm53kc3eax57k.cloudfront.net
  3   0.000641   172.31.0.2 -> 172.31.29.138 DNS 216 Standard query response 0x3649  A 54.230.159.132 A 54.192.157.146 A 54.192.159.106 A 54.230.156.193 A 54.230.157.230 A 54.230.158.147 A 54.230.158.191 A 54.230.158.225
  4   0.000651   172.31.0.2 -> 172.31.29.138 DNS 175 Standard query response 0xf17f 
  5   0.003862 172.31.29.138 -> 54.230.159.132 TCP 74 51717 > http [SYN] Seq=0 Win=26883 Len=0 MSS=8961 SACK_PERM=1 TSval=15933581 TSecr=0 WS=128
  6   0.004499 54.230.159.132 -> 172.31.29.138 TCP 74 http > 51717 [SYN, ACK] Seq=0 Ack=1 Win=14480 Len=0 MSS=1460 SACK_PERM=1 TSval=843923962 TSecr=15933581 WS=128
  7   0.004514 172.31.29.138 -> 54.230.159.132 TCP 66 51717 > http [ACK] Seq=1 Ack=1 Win=27008 Len=0 TSval=15933581 TSecr=843923962
  8   0.004555 172.31.29.138 -> 54.230.159.132 HTTP 162 GET /10kb HTTP/1.1 
  9   0.005223 54.230.159.132 -> 172.31.29.138 TCP 66 http > 51717 [ACK] Seq=1 Ack=97 Win=14592 Len=0 TSval=843923962 TSecr=15933581
 10   0.008313 54.230.159.132 -> 172.31.29.138 TCP 2580 [TCP segment of a reassembled PDU]
 11   0.008321 172.31.29.138 -> 54.230.159.132 TCP 66 51717 > http [ACK] Seq=97 Ack=2515 Win=32000 Len=0 TSval=15933582 TSecr=843923962
 12   0.008357 54.230.159.132 -> 172.31.29.138 HTTP 8247 HTTP/1.1 200 OK  (application/octet-stream)
 13   0.008365 172.31.29.138 -> 54.230.159.132 TCP 66 51717 > http [ACK] Seq=97 Ack=10696 Win=48384 Len=0 TSval=15933582 TSecr=843923962
 14   0.008500 172.31.29.138 -> 54.230.159.132 TCP 66 51717 > http [FIN, ACK] Seq=97 Ack=10696 Win=48384 Len=0 TSval=15933582 TSecr=843923962
 15   0.009082 54.230.159.132 -> 172.31.29.138 TCP 66 http > 51717 [FIN, ACK] Seq=10696 Ack=98 Win=14592 Len=0 TSval=843923962 TSecr=15933582
 16   0.009090 172.31.29.138 -> 54.230.159.132 TCP 66 51717 > http [ACK] Seq=98 Ack=10697 Win=48384 Len=0 TSval=15933582 TSecr=843923962
