[Measurement for 10kb at 22:05:07 16.05.2014] 
Tshark:

  1   0.000000  192.168.1.2 -> 192.168.1.255 UDP 86 Source port: 57621  Destination port: 57621
  2   1.114602  192.168.1.2 -> 54.230.99.203 TCP 66 49257→80 [SYN] Seq=0 Win=8192 Len=0 MSS=1460 WS=256 SACK_PERM=1
  3   1.168394 54.230.99.203 -> 192.168.1.2  TCP 66 80→49257 [SYN, ACK] Seq=0 Ack=1 Win=14600 Len=0 MSS=1400 SACK_PERM=1 WS=128
  4   1.168540  192.168.1.2 -> 54.230.99.203 TCP 54 49257→80 [ACK] Seq=1 Ack=1 Win=65792 Len=0
  5   1.168960  192.168.1.2 -> 54.230.99.203 HTTP 150 GET /10kb HTTP/1.1 
  6   1.204839 54.230.99.203 -> 192.168.1.2  TCP 54 80→49257 [ACK] Seq=1 Ack=97 Win=14720 Len=0
  7   1.227273 54.230.99.203 -> 192.168.1.2  TCP 1454 [TCP segment of a reassembled PDU]
  8   1.228976 54.230.99.203 -> 192.168.1.2  TCP 1180 [TCP segment of a reassembled PDU]
  9   1.229126  192.168.1.2 -> 54.230.99.203 TCP 54 49257→80 [ACK] Seq=97 Ack=2527 Win=65792 Len=0
 10   1.254179 54.230.99.203 -> 192.168.1.2  TCP 1454 [TCP segment of a reassembled PDU]
 11   1.254181 54.230.99.203 -> 192.168.1.2  TCP 1454 [TCP segment of a reassembled PDU]
 12   1.254182 54.230.99.203 -> 192.168.1.2  TCP 1454 [TCP segment of a reassembled PDU]
 13   1.254185 54.230.99.203 -> 192.168.1.2  TCP 1454 [TCP segment of a reassembled PDU]
 14   1.254186 54.230.99.203 -> 192.168.1.2  TCP 1454 [TCP segment of a reassembled PDU]
 15   1.254187 54.230.99.203 -> 192.168.1.2  HTTP 1223 HTTP/1.1 200 OK  (application/octet-stream)
 16   1.254403  192.168.1.2 -> 54.230.99.203 TCP 54 49257→80 [ACK] Seq=97 Ack=10696 Win=65792 Len=0
 17   1.254511  192.168.1.2 -> 54.230.99.203 TCP 54 49257→80 [FIN, ACK] Seq=97 Ack=10696 Win=65792 Len=0
 18   1.295096 54.230.99.203 -> 192.168.1.2  TCP 54 80→49257 [FIN, ACK] Seq=10696 Ack=98 Win=14720 Len=0
 19   1.295296  192.168.1.2 -> 54.230.99.203 TCP 54 49257→80 [ACK] Seq=98 Ack=10697 Win=65792 Len=0
