[Measurement for 10kb at 07:05:24 17.05.2014] 
Tshark:

  1   0.000000  192.168.1.2 -> 54.230.99.196 TCP 66 50539→80 [SYN] Seq=0 Win=8192 Len=0 MSS=1460 WS=256 SACK_PERM=1
  2   0.026310 54.230.99.196 -> 192.168.1.2  TCP 66 80→50539 [SYN, ACK] Seq=0 Ack=1 Win=14600 Len=0 MSS=1400 SACK_PERM=1 WS=128
  3   0.026427  192.168.1.2 -> 54.230.99.196 TCP 54 50539→80 [ACK] Seq=1 Ack=1 Win=16384 Len=0
  4   0.036032  192.168.1.2 -> 54.230.99.196 HTTP 150 GET /10kb HTTP/1.1 
  5   0.063918 54.230.99.196 -> 192.168.1.2  TCP 54 80→50539 [ACK] Seq=1 Ack=97 Win=14720 Len=0
  6   0.068569 54.230.99.196 -> 192.168.1.2  TCP 1454 [TCP segment of a reassembled PDU]
  7   0.073730 54.230.99.196 -> 192.168.1.2  TCP 1454 [TCP segment of a reassembled PDU]
  8   0.073813  192.168.1.2 -> 54.230.99.196 TCP 54 50539→80 [ACK] Seq=97 Ack=2801 Win=16384 Len=0
  9   0.073918 54.230.99.196 -> 192.168.1.2  TCP 1454 [TCP segment of a reassembled PDU]
 10   0.077609 54.230.99.196 -> 192.168.1.2  TCP 1454 [TCP segment of a reassembled PDU]
 11   0.077669  192.168.1.2 -> 54.230.99.196 TCP 54 50539→80 [ACK] Seq=97 Ack=5601 Win=16384 Len=0
 12   0.077766 54.230.99.196 -> 192.168.1.2  TCP 1454 [TCP segment of a reassembled PDU]
 13   0.077804 54.230.99.196 -> 192.168.1.2  TCP 1454 [TCP segment of a reassembled PDU]
 14   0.077863  192.168.1.2 -> 54.230.99.196 TCP 54 50539→80 [ACK] Seq=97 Ack=8401 Win=16384 Len=0
 15   0.077957 54.230.99.196 -> 192.168.1.2  TCP 1454 [TCP segment of a reassembled PDU]
 16   0.078796 54.230.99.196 -> 192.168.1.2  HTTP 949 HTTP/1.1 200 OK  (application/octet-stream)
 17   0.078881  192.168.1.2 -> 54.230.99.196 TCP 54 50539→80 [ACK] Seq=97 Ack=10696 Win=16384 Len=0
 18   0.078975  192.168.1.2 -> 54.230.99.196 TCP 54 50539→80 [FIN, ACK] Seq=97 Ack=10696 Win=16384 Len=0
 19   0.112143 54.230.99.196 -> 192.168.1.2  TCP 54 80→50539 [FIN, ACK] Seq=10696 Ack=98 Win=14720 Len=0
 20   0.112296  192.168.1.2 -> 54.230.99.196 TCP 54 50539→80 [ACK] Seq=98 Ack=10697 Win=16384 Len=0
