[Measurement for 1kb at 18:44:32 19.44.2014] 
Tshark:

  1   0.000000 85.76.134.238 -> 172.31.8.238 TCP 54 29664 > ssh [ACK] Seq=1 Ack=1 Win=257 Len=0
  2   0.139875 85.76.134.238 -> 172.31.8.238 TCP 54 29664 > ssh [ACK] Seq=1 Ack=65 Win=256 Len=0
  3   0.779146 06:c7:b5:04:b8:d0 -> 06:b0:37:46:8f:13 ARP 42 Who has 172.31.0.2?  Tell 172.31.8.238
  4   0.779427 06:b0:37:46:8f:13 -> 06:c7:b5:04:b8:d0 ARP 60 172.31.0.2 is at 06:b0:37:46:8f:13
  5   1.675245 172.31.8.238 -> 172.31.0.2   DNS 89 Standard query 0xdacc  A d3m1c4hwkgedal.cloudfront.net
  6   1.675270 172.31.8.238 -> 172.31.0.2   DNS 89 Standard query 0xbeb1  AAAA d3m1c4hwkgedal.cloudfront.net
  7   1.675892   172.31.0.2 -> 172.31.8.238 DNS 217 Standard query response 0xdacc  A 54.239.132.41 A 54.239.132.86 A 54.239.132.250 A 54.230.117.50 A 54.230.117.154 A 54.230.117.238 A 54.230.119.66 A 54.230.119.110
  8   1.680833   172.31.0.2 -> 172.31.8.238 DNS 174 Standard query response 0xbeb1 
  9   1.687317 172.31.8.238 -> 54.239.132.41 TCP 74 54130 > http [SYN] Seq=0 Win=26883 Len=0 MSS=8961 SACK_PERM=1 TSval=1575031 TSecr=0 WS=128
 10   1.688030 54.239.132.41 -> 172.31.8.238 TCP 74 http > 54130 [SYN, ACK] Seq=0 Ack=1 Win=14480 Len=0 MSS=1460 SACK_PERM=1 TSval=1682154059 TSecr=1575031 WS=128
 11   1.688044 172.31.8.238 -> 54.239.132.41 TCP 66 54130 > http [ACK] Seq=1 Ack=1 Win=27008 Len=0 TSval=1575031 TSecr=1682154059
 12   1.688090 172.31.8.238 -> 54.239.132.41 HTTP 162 GET /1kb HTTP/1.1 
 13   1.688828 54.239.132.41 -> 172.31.8.238 TCP 66 http > 54130 [ACK] Seq=1 Ack=97 Win=14592 Len=0 TSval=1682154059 TSecr=1575031
 14   2.051163 54.239.132.41 -> 172.31.8.238 HTTP 1533 HTTP/1.1 200 OK  (application/octet-stream)
 15   2.051192 172.31.8.238 -> 54.239.132.41 TCP 66 54130 > http [ACK] Seq=97 Ack=1468 Win=29824 Len=0 TSval=1575122 TSecr=1682154095
 16   2.051421 172.31.8.238 -> 54.239.132.41 TCP 66 54130 > http [FIN, ACK] Seq=97 Ack=1468 Win=29824 Len=0 TSval=1575122 TSecr=1682154095
 17   2.051851 54.239.132.41 -> 172.31.8.238 TCP 66 http > 54130 [FIN, ACK] Seq=1468 Ack=98 Win=14592 Len=0 TSval=1682154095 TSecr=1575122
 18   2.051861 172.31.8.238 -> 54.239.132.41 TCP 66 54130 > http [ACK] Seq=98 Ack=1469 Win=29824 Len=0 TSval=1575122 TSecr=1682154095
