[Measurement for 1kb at 09:44:05 20.44.2014] 
Tshark:

  1   0.000000 172.31.8.238 -> 172.31.0.2   DNS 89 Standard query 0xd25c  A d3m1c4hwkgedal.cloudfront.net
  2   0.000028 172.31.8.238 -> 172.31.0.2   DNS 89 Standard query 0xe6a5  AAAA d3m1c4hwkgedal.cloudfront.net
  3   0.000765   172.31.0.2 -> 172.31.8.238 DNS 217 Standard query response 0xd25c  A 54.230.116.82 A 54.230.117.21 A 54.230.117.37 A 54.239.132.74 A 54.239.132.83 A 54.192.118.219 A 54.192.118.228 A 54.192.118.238
  4   0.004954   172.31.0.2 -> 172.31.8.238 DNS 174 Standard query response 0xe6a5 
  5   0.006386 172.31.8.238 -> 54.230.116.82 TCP 74 60401 > http [SYN] Seq=0 Win=26883 Len=0 MSS=8961 SACK_PERM=1 TSval=15068349 TSecr=0 WS=128
  6   0.007052 54.230.116.82 -> 172.31.8.238 TCP 74 http > 60401 [SYN, ACK] Seq=0 Ack=1 Win=14480 Len=0 MSS=1460 SACK_PERM=1 TSval=1686038949 TSecr=15068349 WS=128
  7   0.007066 172.31.8.238 -> 54.230.116.82 TCP 66 60401 > http [ACK] Seq=1 Ack=1 Win=27008 Len=0 TSval=15068349 TSecr=1686038949
  8   0.007108 172.31.8.238 -> 54.230.116.82 HTTP 162 GET /1kb HTTP/1.1 
  9   0.007799 54.230.116.82 -> 172.31.8.238 TCP 66 http > 60401 [ACK] Seq=1 Ack=97 Win=14592 Len=0 TSval=1686038949 TSecr=15068349
 10   0.010133 54.230.116.82 -> 172.31.8.238 HTTP 1544 HTTP/1.1 200 OK  (application/octet-stream)
 11   0.010141 172.31.8.238 -> 54.230.116.82 TCP 66 60401 > http [ACK] Seq=97 Ack=1479 Win=29952 Len=0 TSval=15068350 TSecr=1686038949
 12   0.010314 172.31.8.238 -> 54.230.116.82 TCP 66 60401 > http [FIN, ACK] Seq=97 Ack=1479 Win=29952 Len=0 TSval=15068350 TSecr=1686038949
 13   0.010990 54.230.116.82 -> 172.31.8.238 TCP 66 http > 60401 [FIN, ACK] Seq=1479 Ack=98 Win=14592 Len=0 TSval=1686038949 TSecr=15068350
 14   0.010999 172.31.8.238 -> 54.230.116.82 TCP 66 60401 > http [ACK] Seq=98 Ack=1480 Win=29952 Len=0 TSval=15068350 TSecr=1686038949
