[Measurement for 1kb at 06:43:35 20.43.2014] 
Tshark:

  1   0.000000 172.31.8.238 -> 172.31.0.2   DNS 89 Standard query 0x2c94  A d3m1c4hwkgedal.cloudfront.net
  2   0.000085 172.31.8.238 -> 172.31.0.2   DNS 89 Standard query 0x791f  AAAA d3m1c4hwkgedal.cloudfront.net
  3   0.000563   172.31.0.2 -> 172.31.8.238 DNS 217 Standard query response 0x2c94  A 54.230.117.10 A 54.230.119.71 A 54.230.119.86 A 54.230.119.189 A 54.239.132.98 A 54.239.132.233 A 54.239.132.250 A 54.192.118.219
  4   0.005109   172.31.0.2 -> 172.31.8.238 DNS 174 Standard query response 0x791f 
  5   0.012096 172.31.8.238 -> 54.230.117.10 TCP 74 54050 > http [SYN] Seq=0 Win=26883 Len=0 MSS=8961 SACK_PERM=1 TSval=12360837 TSecr=0 WS=128
  6   0.012678 54.230.117.10 -> 172.31.8.238 TCP 74 http > 54050 [SYN, ACK] Seq=0 Ack=1 Win=14480 Len=0 MSS=1460 SACK_PERM=1 TSval=1686925137 TSecr=12360837 WS=128
  7   0.012692 172.31.8.238 -> 54.230.117.10 TCP 66 54050 > http [ACK] Seq=1 Ack=1 Win=27008 Len=0 TSval=12360837 TSecr=1686925137
  8   0.012745 172.31.8.238 -> 54.230.117.10 HTTP 162 GET /1kb HTTP/1.1 
  9   0.013412 54.230.117.10 -> 172.31.8.238 TCP 66 http > 54050 [ACK] Seq=1 Ack=97 Win=14592 Len=0 TSval=1686925137 TSecr=12360837
 10   0.014955 54.230.117.10 -> 172.31.8.238 HTTP 1544 HTTP/1.1 200 OK  (application/octet-stream)
 11   0.014961 172.31.8.238 -> 54.230.117.10 TCP 66 54050 > http [ACK] Seq=97 Ack=1479 Win=29952 Len=0 TSval=12360837 TSecr=1686925137
 12   0.015116 172.31.8.238 -> 54.230.117.10 TCP 66 54050 > http [FIN, ACK] Seq=97 Ack=1479 Win=29952 Len=0 TSval=12360837 TSecr=1686925137
 13   0.015716 54.230.117.10 -> 172.31.8.238 TCP 66 http > 54050 [FIN, ACK] Seq=1479 Ack=98 Win=14592 Len=0 TSval=1686925137 TSecr=12360837
 14   0.015724 172.31.8.238 -> 54.230.117.10 TCP 66 54050 > http [ACK] Seq=98 Ack=1480 Win=29952 Len=0 TSval=12360837 TSecr=1686925137
