[Measurement for 1kb at 21:43:35 19.43.2014] 
Tshark:

  1   0.000000 172.31.8.238 -> 172.31.0.2   DNS 89 Standard query 0xeee2  A d3m1c4hwkgedal.cloudfront.net
  2   0.000029 172.31.8.238 -> 172.31.0.2   DNS 89 Standard query 0x91d3  AAAA d3m1c4hwkgedal.cloudfront.net
  3   0.000545   172.31.0.2 -> 172.31.8.238 DNS 217 Standard query response 0xeee2  A 54.230.117.5 A 54.230.117.157 A 54.230.118.136 A 54.230.118.143 A 54.192.118.221 A 54.192.118.222 A 54.192.118.239 A 54.230.116.136
  4   0.004585   172.31.0.2 -> 172.31.8.238 DNS 174 Standard query response 0x91d3 
  5   0.012049 172.31.8.238 -> 54.230.117.5 TCP 74 45860 > http [SYN] Seq=0 Win=26883 Len=0 MSS=8961 SACK_PERM=1 TSval=4260919 TSecr=0 WS=128
  6   0.012693 54.230.117.5 -> 172.31.8.238 TCP 74 http > 45860 [SYN, ACK] Seq=0 Ack=1 Win=14480 Len=0 MSS=1460 SACK_PERM=1 TSval=1683270922 TSecr=4260919 WS=128
  7   0.012707 172.31.8.238 -> 54.230.117.5 TCP 66 45860 > http [ACK] Seq=1 Ack=1 Win=27008 Len=0 TSval=4260919 TSecr=1683270922
  8   0.012769 172.31.8.238 -> 54.230.117.5 HTTP 162 GET /1kb HTTP/1.1 
  9   0.013230 54.230.117.5 -> 172.31.8.238 TCP 66 http > 45860 [ACK] Seq=1 Ack=97 Win=14592 Len=0 TSval=1683270922 TSecr=4260919
 10   0.015338 54.230.117.5 -> 172.31.8.238 HTTP 1544 HTTP/1.1 200 OK  (application/octet-stream)
 11   0.015348 172.31.8.238 -> 54.230.117.5 TCP 66 45860 > http [ACK] Seq=97 Ack=1479 Win=29952 Len=0 TSval=4260919 TSecr=1683270922
 12   0.015494 172.31.8.238 -> 54.230.117.5 TCP 66 45860 > http [FIN, ACK] Seq=97 Ack=1479 Win=29952 Len=0 TSval=4260919 TSecr=1683270922
 13   0.015999 54.230.117.5 -> 172.31.8.238 TCP 66 http > 45860 [FIN, ACK] Seq=1479 Ack=98 Win=14592 Len=0 TSval=1683270922 TSecr=4260919
 14   0.016007 172.31.8.238 -> 54.230.117.5 TCP 66 45860 > http [ACK] Seq=98 Ack=1480 Win=29952 Len=0 TSval=4260920 TSecr=1683270922
