[Measurement for 100kb at 03:44:13 20.44.2014] 
Tshark:

  1   0.000000 172.31.8.238 -> 172.31.0.2   DNS 89 Standard query 0x70ac  A d2pcb72msibvx3.cloudfront.net
  2   0.000028 172.31.8.238 -> 172.31.0.2   DNS 89 Standard query 0xe254  AAAA d2pcb72msibvx3.cloudfront.net
  3   0.000572   172.31.0.2 -> 172.31.8.238 DNS 217 Standard query response 0x70ac  A 54.192.118.239 A 54.192.118.240 A 54.192.118.246 A 54.230.116.72 A 54.230.116.167 A 54.239.132.41 A 54.239.132.233 A 54.192.118.235
  4   0.000598   172.31.0.2 -> 172.31.8.238 DNS 169 Standard query response 0xe254 
  5   0.003867 172.31.8.238 -> 54.192.118.239 TCP 74 47950 > http [SYN] Seq=0 Win=26883 Len=0 MSS=8961 SACK_PERM=1 TSval=9670214 TSecr=0 WS=128
  6   0.004596 54.192.118.239 -> 172.31.8.238 TCP 74 http > 47950 [SYN, ACK] Seq=0 Ack=1 Win=14480 Len=0 MSS=1460 SACK_PERM=1 TSval=1682615973 TSecr=9670214 WS=128
  7   0.004610 172.31.8.238 -> 54.192.118.239 TCP 66 47950 > http [ACK] Seq=1 Ack=1 Win=27008 Len=0 TSval=9670214 TSecr=1682615973
  8   0.004664 172.31.8.238 -> 54.192.118.239 HTTP 164 GET /100kb HTTP/1.1 
  9   0.005328 54.192.118.239 -> 172.31.8.238 TCP 66 http > 47950 [ACK] Seq=1 Ack=99 Win=14592 Len=0 TSval=1682615974 TSecr=9670214
 10   0.006898 54.192.118.239 -> 172.31.8.238 TCP 2592 [TCP segment of a reassembled PDU]
 11   0.006905 172.31.8.238 -> 54.192.118.239 TCP 66 47950 > http [ACK] Seq=99 Ack=2527 Win=32000 Len=0 TSval=9670214 TSecr=1682615974
 12   0.007044 54.192.118.239 -> 172.31.8.238 TCP 11650 [TCP segment of a reassembled PDU]
 13   0.007054 172.31.8.238 -> 54.192.118.239 TCP 66 47950 > http [ACK] Seq=99 Ack=14111 Win=55168 Len=0 TSval=9670214 TSecr=1682615974
 14   0.007672 54.192.118.239 -> 172.31.8.238 TCP 8754 [TCP segment of a reassembled PDU]
 15   0.007681 172.31.8.238 -> 54.192.118.239 TCP 66 47950 > http [ACK] Seq=99 Ack=22799 Win=72576 Len=0 TSval=9670215 TSecr=1682615974
 16   0.007716 54.192.118.239 -> 172.31.8.238 TCP 4410 [TCP segment of a reassembled PDU]
 17   0.007722 172.31.8.238 -> 54.192.118.239 TCP 66 47950 > http [ACK] Seq=99 Ack=27143 Win=81280 Len=0 TSval=9670215 TSecr=1682615974
 18   0.008164 54.192.118.239 -> 172.31.8.238 TCP 4410 [TCP segment of a reassembled PDU]
 19   0.008169 172.31.8.238 -> 54.192.118.239 TCP 66 47950 > http [ACK] Seq=99 Ack=31487 Win=89856 Len=0 TSval=9670215 TSecr=1682615974
 20   0.008267 54.192.118.239 -> 172.31.8.238 TCP 8754 [TCP segment of a reassembled PDU]
 21   0.008274 172.31.8.238 -> 54.192.118.239 TCP 66 47950 > http [ACK] Seq=99 Ack=40175 Win=103680 Len=0 TSval=9670215 TSecr=1682615974
 22   0.008445 54.192.118.239 -> 172.31.8.238 TCP 7306 [TCP segment of a reassembled PDU]
 23   0.008452 172.31.8.238 -> 54.192.118.239 TCP 66 47950 > http [ACK] Seq=99 Ack=47415 Win=105984 Len=0 TSval=9670215 TSecr=1682615974
 24   0.008937 54.192.118.239 -> 172.31.8.238 TCP 2962 [TCP segment of a reassembled PDU]
 25   0.008942 172.31.8.238 -> 54.192.118.239 TCP 66 47950 > http [ACK] Seq=99 Ack=50311 Win=109056 Len=0 TSval=9670215 TSecr=1682615974
 26   0.009053 54.192.118.239 -> 172.31.8.238 TCP 15994 [TCP segment of a reassembled PDU]
 27   0.009063 172.31.8.238 -> 54.192.118.239 TCP 66 47950 > http [ACK] Seq=99 Ack=66239 Win=93184 Len=0 TSval=9670215 TSecr=1682615974
 28   0.009714 54.192.118.239 -> 172.31.8.238 TCP 8754 [TCP segment of a reassembled PDU]
 29   0.009735 172.31.8.238 -> 54.192.118.239 TCP 66 47950 > http [ACK] Seq=99 Ack=74927 Win=103680 Len=0 TSval=9670215 TSecr=1682615974
 30   0.009861 54.192.118.239 -> 172.31.8.238 TCP 18890 [TCP segment of a reassembled PDU]
 31   0.009874 172.31.8.238 -> 54.192.118.239 TCP 66 47950 > http [ACK] Seq=99 Ack=93751 Win=86912 Len=0 TSval=9670215 TSecr=1682615974
 32   0.010506 54.192.118.239 -> 172.31.8.238 HTTP 9172 HTTP/1.1 200 OK  (application/octet-stream)
 33   0.010514 172.31.8.238 -> 54.192.118.239 TCP 66 47950 > http [ACK] Seq=99 Ack=102857 Win=101248 Len=0 TSval=9670215 TSecr=1682615974
 34   0.010636 172.31.8.238 -> 54.192.118.239 TCP 66 47950 > http [FIN, ACK] Seq=99 Ack=102857 Win=109056 Len=0 TSval=9670215 TSecr=1682615974
 35   0.011239 54.192.118.239 -> 172.31.8.238 TCP 66 http > 47950 [FIN, ACK] Seq=102857 Ack=100 Win=14592 Len=0 TSval=1682615974 TSecr=9670215
 36   0.011247 172.31.8.238 -> 54.192.118.239 TCP 66 47950 > http [ACK] Seq=100 Ack=102858 Win=109056 Len=0 TSval=9670216 TSecr=1682615974
