[Measurement for 100kb at 14:44:13 20.44.2014] 
Tshark:

  1   0.000000 172.31.8.238 -> 172.31.0.2   DNS 89 Standard query 0xc9b6  A d2pcb72msibvx3.cloudfront.net
  2   0.000026 172.31.8.238 -> 172.31.0.2   DNS 89 Standard query 0xbe4b  AAAA d2pcb72msibvx3.cloudfront.net
  3   0.000686   172.31.0.2 -> 172.31.8.238 DNS 217 Standard query response 0xc9b6  A 54.192.118.241 A 54.192.118.243 A 54.230.116.73 A 54.230.117.45 A 54.230.117.50 A 54.239.132.41 A 54.239.132.90 A 54.239.132.196
  4   0.000760   172.31.0.2 -> 172.31.8.238 DNS 169 Standard query response 0xbe4b 
  5   0.003831 172.31.8.238 -> 54.192.118.241 TCP 74 55906 > http [SYN] Seq=0 Win=26883 Len=0 MSS=8961 SACK_PERM=1 TSval=19570182 TSecr=0 WS=128
  6   0.004512 54.192.118.241 -> 172.31.8.238 TCP 74 http > 55906 [SYN, ACK] Seq=0 Ack=1 Win=14480 Len=0 MSS=1460 SACK_PERM=1 TSval=1690183910 TSecr=19570182 WS=128
  7   0.004527 172.31.8.238 -> 54.192.118.241 TCP 66 55906 > http [ACK] Seq=1 Ack=1 Win=27008 Len=0 TSval=19570183 TSecr=1690183910
  8   0.004567 172.31.8.238 -> 54.192.118.241 HTTP 164 GET /100kb HTTP/1.1 
  9   0.005225 54.192.118.241 -> 172.31.8.238 TCP 66 http > 55906 [ACK] Seq=1 Ack=99 Win=14592 Len=0 TSval=1690183910 TSecr=19570183
 10   0.007054 54.192.118.241 -> 172.31.8.238 TCP 7306 [TCP segment of a reassembled PDU]
 11   0.007062 172.31.8.238 -> 54.192.118.241 TCP 66 55906 > http [ACK] Seq=99 Ack=7241 Win=41472 Len=0 TSval=19570183 TSecr=1690183911
 12   0.007156 54.192.118.241 -> 172.31.8.238 TCP 5858 [TCP segment of a reassembled PDU]
 13   0.007163 172.31.8.238 -> 54.192.118.241 TCP 66 55906 > http [ACK] Seq=99 Ack=13033 Win=52992 Len=0 TSval=19570183 TSecr=1690183911
 14   0.007808 54.192.118.241 -> 172.31.8.238 TCP 5858 [TCP segment of a reassembled PDU]
 15   0.007814 172.31.8.238 -> 54.192.118.241 TCP 66 55906 > http [ACK] Seq=99 Ack=18825 Win=64640 Len=0 TSval=19570183 TSecr=1690183911
 16   0.007906 54.192.118.241 -> 172.31.8.238 TCP 7306 [TCP segment of a reassembled PDU]
 17   0.007913 172.31.8.238 -> 54.192.118.241 TCP 66 55906 > http [ACK] Seq=99 Ack=26065 Win=79104 Len=0 TSval=19570184 TSecr=1690183911
 18   0.008597 54.192.118.241 -> 172.31.8.238 TCP 2962 [TCP segment of a reassembled PDU]
 19   0.008615 172.31.8.238 -> 54.192.118.241 TCP 66 55906 > http [ACK] Seq=99 Ack=28961 Win=84864 Len=0 TSval=19570184 TSecr=1690183911
 20   0.008726 54.192.118.241 -> 172.31.8.238 TCP 8754 [TCP segment of a reassembled PDU]
 21   0.008733 172.31.8.238 -> 54.192.118.241 TCP 66 55906 > http [ACK] Seq=99 Ack=37649 Win=102272 Len=0 TSval=19570184 TSecr=1690183911
 22   0.008766 54.192.118.241 -> 172.31.8.238 TCP 8754 [TCP segment of a reassembled PDU]
 23   0.008773 172.31.8.238 -> 54.192.118.241 TCP 66 55906 > http [ACK] Seq=99 Ack=46337 Win=103680 Len=0 TSval=19570184 TSecr=1690183911
 24   0.009320 54.192.118.241 -> 172.31.8.238 TCP 1514 [TCP segment of a reassembled PDU]
 25   0.009324 172.31.8.238 -> 54.192.118.241 TCP 66 55906 > http [ACK] Seq=99 Ack=47785 Win=109056 Len=0 TSval=19570184 TSecr=1690183911
 26   0.009446 54.192.118.241 -> 172.31.8.238 TCP 17442 [TCP segment of a reassembled PDU]
 27   0.009456 172.31.8.238 -> 54.192.118.241 TCP 66 55906 > http [ACK] Seq=99 Ack=65161 Win=91776 Len=0 TSval=19570184 TSecr=1690183911
 28   0.010279 54.192.118.241 -> 172.31.8.238 TCP 27578 [TCP segment of a reassembled PDU]
 29   0.010294 172.31.8.238 -> 54.192.118.241 TCP 66 55906 > http [ACK] Seq=99 Ack=92673 Win=72576 Len=0 TSval=19570184 TSecr=1690183911
 30   0.011149 54.192.118.241 -> 172.31.8.238 TCP 7306 [TCP segment of a reassembled PDU]
 31   0.011156 172.31.8.238 -> 54.192.118.241 TCP 66 55906 > http [ACK] Seq=99 Ack=99913 Win=105984 Len=0 TSval=19570184 TSecr=1690183911
 32   0.011245 54.192.118.241 -> 172.31.8.238 HTTP 3010 HTTP/1.1 200 OK  (application/octet-stream)
 33   0.011250 172.31.8.238 -> 54.192.118.241 TCP 66 55906 > http [ACK] Seq=99 Ack=102857 Win=109056 Len=0 TSval=19570184 TSecr=1690183911
 34   0.011367 172.31.8.238 -> 54.192.118.241 TCP 66 55906 > http [FIN, ACK] Seq=99 Ack=102857 Win=109056 Len=0 TSval=19570184 TSecr=1690183911
 35   0.012130 54.192.118.241 -> 172.31.8.238 TCP 66 http > 55906 [FIN, ACK] Seq=102857 Ack=100 Win=14592 Len=0 TSval=1690183911 TSecr=19570184
 36   0.012138 172.31.8.238 -> 54.192.118.241 TCP 66 55906 > http [ACK] Seq=100 Ack=102858 Win=109056 Len=0 TSval=19570185 TSecr=1690183911
