[Measurement for 100kb at 22:44:13 19.44.2014] 
Tshark:

  1   0.000000 172.31.8.238 -> 172.31.0.2   DNS 89 Standard query 0xcb42  A d2pcb72msibvx3.cloudfront.net
  2   0.000027 172.31.8.238 -> 172.31.0.2   DNS 89 Standard query 0xe68f  AAAA d2pcb72msibvx3.cloudfront.net
  3   0.000562   172.31.0.2 -> 172.31.8.238 DNS 169 Standard query response 0xe68f 
  4   0.000575   172.31.0.2 -> 172.31.8.238 DNS 217 Standard query response 0xcb42  A 54.192.118.228 A 54.192.118.234 A 54.230.116.141 A 54.230.117.198 A 54.230.119.3 A 54.239.132.83 A 54.239.132.86 A 54.239.132.103
  5   0.003861 172.31.8.238 -> 54.192.118.228 TCP 74 54738 > http [SYN] Seq=0 Win=26883 Len=0 MSS=8961 SACK_PERM=1 TSval=5170197 TSecr=0 WS=128
  6   0.004599 54.192.118.228 -> 172.31.8.238 TCP 74 http > 54738 [SYN, ACK] Seq=0 Ack=1 Win=14480 Len=0 MSS=1460 SACK_PERM=1 TSval=1493987137 TSecr=5170197 WS=128
  7   0.004613 172.31.8.238 -> 54.192.118.228 TCP 66 54738 > http [ACK] Seq=1 Ack=1 Win=27008 Len=0 TSval=5170197 TSecr=1493987137
  8   0.004654 172.31.8.238 -> 54.192.118.228 HTTP 164 GET /100kb HTTP/1.1 
  9   0.005459 54.192.118.228 -> 172.31.8.238 TCP 66 http > 54738 [ACK] Seq=1 Ack=99 Win=14592 Len=0 TSval=1493987137 TSecr=5170197
 10   0.006719 54.192.118.228 -> 172.31.8.238 TCP 522 [TCP segment of a reassembled PDU]
 11   0.006725 172.31.8.238 -> 54.192.118.228 TCP 66 54738 > http [ACK] Seq=99 Ack=457 Win=28032 Len=0 TSval=5170197 TSecr=1493987137
 12   0.006838 54.192.118.228 -> 172.31.8.238 TCP 13098 [TCP segment of a reassembled PDU]
 13   0.006849 172.31.8.238 -> 54.192.118.228 TCP 66 54738 > http [ACK] Seq=99 Ack=13489 Win=54144 Len=0 TSval=5170197 TSecr=1493987137
 14   0.007450 54.192.118.228 -> 172.31.8.238 TCP 4410 [TCP segment of a reassembled PDU]
 15   0.007457 172.31.8.238 -> 54.192.118.228 TCP 66 54738 > http [ACK] Seq=99 Ack=17833 Win=62720 Len=0 TSval=5170198 TSecr=1493987137
 16   0.007552 54.192.118.228 -> 172.31.8.238 TCP 8754 [TCP segment of a reassembled PDU]
 17   0.007559 172.31.8.238 -> 54.192.118.228 TCP 66 54738 > http [ACK] Seq=99 Ack=26521 Win=80128 Len=0 TSval=5170198 TSecr=1493987137
 18   0.008235 54.192.118.228 -> 172.31.8.238 TCP 2962 [TCP segment of a reassembled PDU]
 19   0.008241 172.31.8.238 -> 54.192.118.228 TCP 66 54738 > http [ACK] Seq=99 Ack=29417 Win=85888 Len=0 TSval=5170198 TSecr=1493987137
 20   0.008363 54.192.118.228 -> 172.31.8.238 TCP 17442 [TCP segment of a reassembled PDU]
 21   0.008373 172.31.8.238 -> 54.192.118.228 TCP 66 54738 > http [ACK] Seq=99 Ack=46793 Win=89344 Len=0 TSval=5170198 TSecr=1493987137
 22   0.009253 54.192.118.228 -> 172.31.8.238 TCP 2962 [TCP segment of a reassembled PDU]
 23   0.009259 172.31.8.238 -> 54.192.118.228 TCP 66 54738 > http [ACK] Seq=99 Ack=49689 Win=109056 Len=0 TSval=5170198 TSecr=1493987137
 24   0.009364 54.192.118.228 -> 172.31.8.238 TCP 2962 [TCP segment of a reassembled PDU]
 25   0.009369 172.31.8.238 -> 54.192.118.228 TCP 66 54738 > http [ACK] Seq=99 Ack=52585 Win=109056 Len=0 TSval=5170198 TSecr=1493987137
 26   0.009476 54.192.118.228 -> 172.31.8.238 TCP 13098 [TCP segment of a reassembled PDU]
 27   0.009485 172.31.8.238 -> 54.192.118.228 TCP 66 54738 > http [ACK] Seq=99 Ack=65617 Win=96512 Len=0 TSval=5170198 TSecr=1493987137
 28   0.010072 54.192.118.228 -> 172.31.8.238 TCP 8754 [TCP segment of a reassembled PDU]
 29   0.010080 172.31.8.238 -> 54.192.118.228 TCP 66 54738 > http [ACK] Seq=99 Ack=74305 Win=103680 Len=0 TSval=5170198 TSecr=1493987137
 30   0.010202 54.192.118.228 -> 172.31.8.238 TCP 18890 [TCP segment of a reassembled PDU]
 31   0.010214 172.31.8.238 -> 54.192.118.228 TCP 66 54738 > http [ACK] Seq=99 Ack=93129 Win=86912 Len=0 TSval=5170198 TSecr=1493987137
 32   0.010828 54.192.118.228 -> 172.31.8.238 TCP 5858 [TCP segment of a reassembled PDU]
 33   0.010835 172.31.8.238 -> 54.192.118.228 TCP 66 54738 > http [ACK] Seq=99 Ack=98921 Win=108416 Len=0 TSval=5170198 TSecr=1493987137
 34   0.010919 54.192.118.228 -> 172.31.8.238 HTTP 4002 HTTP/1.1 200 OK  (application/octet-stream)
 35   0.010925 172.31.8.238 -> 54.192.118.228 TCP 66 54738 > http [ACK] Seq=99 Ack=102857 Win=109056 Len=0 TSval=5170198 TSecr=1493987137
 36   0.011057 172.31.8.238 -> 54.192.118.228 TCP 66 54738 > http [FIN, ACK] Seq=99 Ack=102857 Win=109056 Len=0 TSval=5170198 TSecr=1493987137
 37   0.011546 54.192.118.228 -> 172.31.8.238 TCP 66 http > 54738 [FIN, ACK] Seq=102857 Ack=100 Win=14592 Len=0 TSval=1493987137 TSecr=5170198
 38   0.011554 172.31.8.238 -> 54.192.118.228 TCP 66 54738 > http [ACK] Seq=100 Ack=102858 Win=109056 Len=0 TSval=5170199 TSecr=1493987137
