[Measurement for 1kb at 22:42:37 19.42.2014] 
Tshark:

  1   0.000000 172.31.8.238 -> 172.31.0.2   DNS 88 Standard query 0x1e50  A dm53kc3eax57k.cloudfront.net
  2   0.000035 172.31.8.238 -> 172.31.0.2   DNS 88 Standard query 0xadaa  AAAA dm53kc3eax57k.cloudfront.net
  3   0.000717   172.31.0.2 -> 172.31.8.238 DNS 216 Standard query response 0x1e50  A 54.192.118.228 A 54.192.118.236 A 54.192.118.246 A 54.230.116.82 A 54.230.118.138 A 54.230.118.143 A 54.230.119.86 A 54.192.118.221
  4   0.003362   172.31.0.2 -> 172.31.8.238 DNS 175 Standard query response 0xadaa 
  5   0.003892 172.31.8.238 -> 54.192.118.228 TCP 74 54721 > http [SYN] Seq=0 Win=26883 Len=0 MSS=8961 SACK_PERM=1 TSval=5146224 TSecr=0 WS=128
  6   0.004525 54.192.118.228 -> 172.31.8.238 TCP 74 http > 54721 [SYN, ACK] Seq=0 Ack=1 Win=14480 Len=0 MSS=1460 SACK_PERM=1 TSval=1680358257 TSecr=5146224 WS=128
  7   0.004540 172.31.8.238 -> 54.192.118.228 TCP 66 54721 > http [ACK] Seq=1 Ack=1 Win=27008 Len=0 TSval=5146224 TSecr=1680358257
  8   0.004578 172.31.8.238 -> 54.192.118.228 HTTP 161 GET /1kb HTTP/1.1 
  9   0.005266 54.192.118.228 -> 172.31.8.238 TCP 66 http > 54721 [ACK] Seq=1 Ack=96 Win=14592 Len=0 TSval=1680358257 TSecr=5146224
 10   0.006854 54.192.118.228 -> 172.31.8.238 HTTP 1544 HTTP/1.1 200 OK  (application/octet-stream)
 11   0.006861 172.31.8.238 -> 54.192.118.228 TCP 66 54721 > http [ACK] Seq=96 Ack=1479 Win=29952 Len=0 TSval=5146225 TSecr=1680358257
 12   0.007018 172.31.8.238 -> 54.192.118.228 TCP 66 54721 > http [FIN, ACK] Seq=96 Ack=1479 Win=29952 Len=0 TSval=5146225 TSecr=1680358257
 13   0.007562 54.192.118.228 -> 172.31.8.238 TCP 66 http > 54721 [FIN, ACK] Seq=1479 Ack=97 Win=14592 Len=0 TSval=1680358257 TSecr=5146225
 14   0.007570 172.31.8.238 -> 54.192.118.228 TCP 66 54721 > http [ACK] Seq=97 Ack=1480 Win=29952 Len=0 TSval=5146225 TSecr=1680358257
