[Measurement for 1kb at 00:42:36 20.42.2014] 
Tshark:

  1   0.000000 172.31.8.238 -> 172.31.0.2   DNS 88 Standard query 0x9165  A dm53kc3eax57k.cloudfront.net
  2   0.000029 172.31.8.238 -> 172.31.0.2   DNS 88 Standard query 0x26d3  AAAA dm53kc3eax57k.cloudfront.net
  3   0.000655   172.31.0.2 -> 172.31.8.238 DNS 216 Standard query response 0x9165  A 54.230.118.214 A 54.230.118.235 A 54.230.119.106 A 54.239.132.84 A 54.192.118.222 A 54.192.118.246 A 54.230.116.73 A 54.230.116.82
  4   0.005613   172.31.0.2 -> 172.31.8.238 DNS 175 Standard query response 0x26d3 
  5   0.012019 172.31.8.238 -> 54.230.118.214 TCP 74 45483 > http [SYN] Seq=0 Win=26883 Len=0 MSS=8961 SACK_PERM=1 TSval=6946171 TSecr=0 WS=128
  6   0.012675 54.230.118.214 -> 172.31.8.238 TCP 74 http > 45483 [SYN, ACK] Seq=0 Ack=1 Win=14480 Len=0 MSS=1460 SACK_PERM=1 TSval=1682554843 TSecr=6946171 WS=128
  7   0.012690 172.31.8.238 -> 54.230.118.214 TCP 66 45483 > http [ACK] Seq=1 Ack=1 Win=27008 Len=0 TSval=6946171 TSecr=1682554843
  8   0.012734 172.31.8.238 -> 54.230.118.214 HTTP 161 GET /1kb HTTP/1.1 
  9   0.013382 54.230.118.214 -> 172.31.8.238 TCP 66 http > 45483 [ACK] Seq=1 Ack=96 Win=14592 Len=0 TSval=1682554843 TSecr=6946171
 10   0.015024 54.230.118.214 -> 172.31.8.238 HTTP 1544 HTTP/1.1 200 OK  (application/octet-stream)
 11   0.015032 172.31.8.238 -> 54.230.118.214 TCP 66 45483 > http [ACK] Seq=96 Ack=1479 Win=29952 Len=0 TSval=6946172 TSecr=1682554843
 12   0.015190 172.31.8.238 -> 54.230.118.214 TCP 66 45483 > http [FIN, ACK] Seq=96 Ack=1479 Win=29952 Len=0 TSval=6946172 TSecr=1682554843
 13   0.015779 54.230.118.214 -> 172.31.8.238 TCP 66 http > 45483 [FIN, ACK] Seq=1479 Ack=97 Win=14592 Len=0 TSval=1682554843 TSecr=6946172
 14   0.015787 172.31.8.238 -> 54.230.118.214 TCP 66 45483 > http [ACK] Seq=97 Ack=1480 Win=29952 Len=0 TSval=6946172 TSecr=1682554843
