[Measurement for 1kb at 15:05:01 16.05.2014] 
Tshark:

  1   0.000000  192.168.1.2 -> 54.230.99.217 TCP 66 62592→80 [SYN] Seq=0 Win=8192 Len=0 MSS=1460 WS=256 SACK_PERM=1
  2   0.057734 54.230.99.217 -> 192.168.1.2  TCP 66 80→62592 [SYN, ACK] Seq=0 Ack=1 Win=14600 Len=0 MSS=1400 SACK_PERM=1 WS=128
  3   0.057925  192.168.1.2 -> 54.230.99.217 TCP 54 62592→80 [ACK] Seq=1 Ack=1 Win=65792 Len=0
  4   0.068090  192.168.1.2 -> 54.230.99.217 HTTP 149 GET /1kb HTTP/1.1 
  5   0.094990 54.230.99.217 -> 192.168.1.2  TCP 54 80→62592 [ACK] Seq=1 Ack=96 Win=14720 Len=0
  6   0.099763 54.230.99.217 -> 192.168.1.2  TCP 1454 [TCP segment of a reassembled PDU]
  7   0.100358 54.230.99.217 -> 192.168.1.2  HTTP 131 HTTP/1.1 200 OK  (application/octet-stream)
  8   0.100451  192.168.1.2 -> 54.230.99.217 TCP 54 62592→80 [ACK] Seq=96 Ack=1478 Win=65792 Len=0
  9   0.100552  192.168.1.2 -> 54.230.99.217 TCP 54 62592→80 [FIN, ACK] Seq=96 Ack=1478 Win=65792 Len=0
 10   0.128455 54.230.99.217 -> 192.168.1.2  TCP 54 80→62592 [FIN, ACK] Seq=1478 Ack=97 Win=14720 Len=0
 11   0.128589  192.168.1.2 -> 54.230.99.217 TCP 54 62592→80 [ACK] Seq=97 Ack=1479 Win=65792 Len=0
 12   0.610459  192.168.1.2 -> 54.243.222.44 SSL 55 Continuation Data
