[Measurement for 1kb at 22:05:02 16.05.2014] 
Tshark:

  1   0.000000  192.168.1.2 -> 74.125.232.200 TCP 1454 [TCP segment of a reassembled PDU]
  2   0.139663 74.125.232.200 -> 192.168.1.2  TCP 54 443→65381 [ACK] Seq=1 Ack=1401 Win=6103 Len=0
  3   0.139751  192.168.1.2 -> 74.125.232.200 TCP 1454 [TCP segment of a reassembled PDU]
  4   0.139767  192.168.1.2 -> 74.125.232.200 TLSv1.2 1454 Application Data
  5   0.142797 74.125.232.200 -> 192.168.1.2  TCP 54 443→65381 [ACK] Seq=1 Ack=2801 Win=6103 Len=0
  6   0.142798 74.125.232.200 -> 192.168.1.2  TCP 54 443→65381 [ACK] Seq=1 Ack=3259 Win=6103 Len=0
  7   0.142799 74.125.232.200 -> 192.168.1.2  TCP 54 443→65381 [ACK] Seq=1 Ack=3292 Win=6103 Len=0
  8   0.142799 74.125.232.200 -> 192.168.1.2  TCP 54 [TCP ACKed unseen segment] 443→65381 [ACK] Seq=1 Ack=4692 Win=6103 Len=0
  9   0.142800 74.125.232.200 -> 192.168.1.2  TLSv1.2 87 [TCP ACKed unseen segment] Application Data
 10   0.142800 74.125.232.200 -> 192.168.1.2  TCP 54 [TCP ACKed unseen segment] 443→65381 [ACK] Seq=34 Ack=6173 Win=6103 Len=0
 11   0.142801 74.125.232.200 -> 192.168.1.2  TLSv1.2 106 [TCP ACKed unseen segment] Application Data
 12   0.142801 74.125.232.200 -> 192.168.1.2  TLSv1.2 132 [TCP ACKed unseen segment] Application Data
 13   0.142802 74.125.232.200 -> 192.168.1.2  TLSv1.2 93 [TCP ACKed unseen segment] Application Data
 14   0.142802 74.125.232.200 -> 192.168.1.2  TLSv1.2 87 [TCP ACKed unseen segment] Application Data
 15   0.142917  192.168.1.2 -> 74.125.232.200 TCP 54 [TCP Previous segment not captured] 65381→443 [ACK] Seq=6740 Ack=236 Win=254 Len=0
 16   0.143509 74.125.232.200 -> 192.168.1.2  TLSv1.2 87 [TCP ACKed unseen segment] [TCP Retransmission] Application Data
 17   0.143552  192.168.1.2 -> 74.125.232.200 TCP 66 [TCP Dup ACK 15#1] 65381→443 [ACK] Seq=6740 Ack=236 Win=254 Len=0 SLE=203 SRE=236
 18   0.144713  192.168.1.2 -> 74.125.232.200 TLSv1.2 87 Application Data
 19   0.174713 74.125.232.200 -> 192.168.1.2  TCP 66 [TCP Dup ACK 16#1] 443→65381 [ACK] Seq=236 Ack=6740 Win=6103 Len=0 SLE=1 SRE=1401
 20   0.196429 74.125.232.200 -> 192.168.1.2  TCP 66 [TCP Dup ACK 16#2] 443→65381 [ACK] Seq=236 Ack=6740 Win=6103 Len=0 SLE=1401 SRE=2801
 21   0.196948 74.125.232.200 -> 192.168.1.2  TCP 66 [TCP Dup ACK 16#3] 443→65381 [ACK] Seq=236 Ack=6740 Win=6103 Len=0 SLE=2801 SRE=4201
 22   0.196949 74.125.232.200 -> 192.168.1.2  TCP 54 443→65381 [ACK] Seq=236 Ack=6773 Win=6103 Len=0
 23   0.197009  192.168.1.2 -> 74.125.232.200 TLSv1.2 87 [TCP Retransmission] Application Data
 24   0.223637 74.125.232.200 -> 192.168.1.2  TCP 66 [TCP Dup ACK 22#1] 443→65381 [ACK] Seq=236 Ack=6773 Win=6103 Len=0 SLE=6740 SRE=6773
 25   1.216388  192.168.1.2 -> 54.230.99.203 TCP 66 49256→80 [SYN] Seq=0 Win=8192 Len=0 MSS=1460 WS=256 SACK_PERM=1
 26   1.583854 54.230.99.203 -> 192.168.1.2  TCP 66 80→49256 [SYN, ACK] Seq=0 Ack=1 Win=14600 Len=0 MSS=1400 SACK_PERM=1 WS=128
 27   1.584035  192.168.1.2 -> 54.230.99.203 TCP 54 49256→80 [ACK] Seq=1 Ack=1 Win=65792 Len=0
 28   1.584218  192.168.1.2 -> 54.230.99.203 HTTP 149 GET /1kb HTTP/1.1 
 29   1.617555 54.230.99.203 -> 192.168.1.2  TCP 54 80→49256 [ACK] Seq=1 Ack=96 Win=14720 Len=0
 30   1.620363 54.230.99.203 -> 192.168.1.2  TCP 1454 [TCP segment of a reassembled PDU]
 31   1.620896 54.230.99.203 -> 192.168.1.2  HTTP 132 HTTP/1.1 200 OK  (application/octet-stream)
 32   1.620981  192.168.1.2 -> 54.230.99.203 TCP 54 49256→80 [ACK] Seq=96 Ack=1479 Win=65792 Len=0
 33   1.621072  192.168.1.2 -> 54.230.99.203 TCP 54 49256→80 [FIN, ACK] Seq=96 Ack=1479 Win=65792 Len=0
 34   1.652385 54.230.99.203 -> 192.168.1.2  TCP 54 80→49256 [FIN, ACK] Seq=1479 Ack=97 Win=14720 Len=0
 35   1.652542  192.168.1.2 -> 54.230.99.203 TCP 54 49256→80 [ACK] Seq=97 Ack=1480 Win=65792 Len=0
 36   2.281088  192.168.1.2 -> 54.243.222.44 SSL 55 Continuation Data
 37   2.367164  192.168.1.2 -> 54.243.222.44 SSL 55 Continuation Data
 38   2.474839 54.243.222.44 -> 192.168.1.2  TCP 66 443→49245 [ACK] Seq=1 Ack=2 Win=82 Len=0 SLE=1 SRE=2
 39   2.505292 54.243.222.44 -> 192.168.1.2  TCP 66 443→49243 [ACK] Seq=1 Ack=2 Win=69 Len=0 SLE=1 SRE=2
 40   2.612320  192.168.1.2 -> 54.243.222.44 SSL 55 Continuation Data
