[Measurement for 100kb at 10:41:16 20.41.2014] 
Tshark:

  1   0.000000 06:b0:37:46:8f:13 -> 06:c7:b5:04:b8:d0 ARP 60 Who has 172.31.8.238?  Tell 172.31.0.1
  2   0.000021 06:c7:b5:04:b8:d0 -> 06:b0:37:46:8f:13 ARP 42 172.31.8.238 is at 06:c7:b5:04:b8:d0
  3   0.246768 172.31.8.238 -> 172.31.0.2   DNS 89 Standard query 0x2df6  A d1xvcg6dfvgaki.cloudfront.net
  4   0.246819 172.31.8.238 -> 172.31.0.2   DNS 89 Standard query 0x75d6  AAAA d1xvcg6dfvgaki.cloudfront.net
  5   0.247424   172.31.0.2 -> 172.31.8.238 DNS 170 Standard query response 0x75d6 
  6   0.247436   172.31.0.2 -> 172.31.8.238 DNS 217 Standard query response 0x2df6  A 54.192.118.236 A 54.192.118.247 A 54.230.117.156 A 54.230.118.248 A 54.230.119.86 A 54.230.119.165 A 54.239.132.98 A 54.239.132.250
  7   0.250691 172.31.8.238 -> 54.192.118.236 TCP 74 51092 > http [SYN] Seq=0 Win=26883 Len=0 MSS=8961 SACK_PERM=1 TSval=15926160 TSecr=0 WS=128
  8   0.251490 54.192.118.236 -> 172.31.8.238 TCP 74 http > 51092 [SYN, ACK] Seq=0 Ack=1 Win=14480 Len=0 MSS=1460 SACK_PERM=1 TSval=1686116279 TSecr=15926160 WS=128
  9   0.251504 172.31.8.238 -> 54.192.118.236 TCP 66 51092 > http [ACK] Seq=1 Ack=1 Win=27008 Len=0 TSval=15926160 TSecr=1686116279
 10   0.251543 172.31.8.238 -> 54.192.118.236 HTTP 164 GET /100kb HTTP/1.1 
 11   0.252256 54.192.118.236 -> 172.31.8.238 TCP 66 http > 51092 [ACK] Seq=1 Ack=99 Win=14592 Len=0 TSval=1686116279 TSecr=15926160
 12   0.253521 54.192.118.236 -> 172.31.8.238 TCP 522 [TCP segment of a reassembled PDU]
 13   0.253527 172.31.8.238 -> 54.192.118.236 TCP 66 51092 > http [ACK] Seq=99 Ack=457 Win=28032 Len=0 TSval=15926160 TSecr=1686116279
 14   0.253803 54.192.118.236 -> 172.31.8.238 TCP 5858 [TCP segment of a reassembled PDU]
 15   0.253812 172.31.8.238 -> 54.192.118.236 TCP 66 51092 > http [ACK] Seq=99 Ack=6249 Win=39552 Len=0 TSval=15926161 TSecr=1686116279
 16   0.253925 54.192.118.236 -> 172.31.8.238 TCP 7306 [TCP segment of a reassembled PDU]
 17   0.253932 172.31.8.238 -> 54.192.118.236 TCP 66 51092 > http [ACK] Seq=99 Ack=13489 Win=54144 Len=0 TSval=15926161 TSecr=1686116279
 18   0.254364 54.192.118.236 -> 172.31.8.238 TCP 7306 [TCP segment of a reassembled PDU]
 19   0.254371 172.31.8.238 -> 54.192.118.236 TCP 66 51092 > http [ACK] Seq=99 Ack=20729 Win=68608 Len=0 TSval=15926161 TSecr=1686116279
 20   0.254462 54.192.118.236 -> 172.31.8.238 TCP 4410 [TCP segment of a reassembled PDU]
 21   0.254468 172.31.8.238 -> 54.192.118.236 TCP 66 51092 > http [ACK] Seq=99 Ack=25073 Win=77312 Len=0 TSval=15926161 TSecr=1686116279
 22   0.254555 54.192.118.236 -> 172.31.8.238 TCP 1514 [TCP segment of a reassembled PDU]
 23   0.254572 172.31.8.238 -> 54.192.118.236 TCP 66 51092 > http [ACK] Seq=99 Ack=26521 Win=80128 Len=0 TSval=15926161 TSecr=1686116279
 24   0.255074 54.192.118.236 -> 172.31.8.238 TCP 5858 [TCP segment of a reassembled PDU]
 25   0.255081 172.31.8.238 -> 54.192.118.236 TCP 66 51092 > http [ACK] Seq=99 Ack=32313 Win=91776 Len=0 TSval=15926161 TSecr=1686116279
 26   0.255177 54.192.118.236 -> 172.31.8.238 TCP 7306 [TCP segment of a reassembled PDU]
 27   0.255184 172.31.8.238 -> 54.192.118.236 TCP 66 51092 > http [ACK] Seq=99 Ack=39553 Win=105984 Len=0 TSval=15926161 TSecr=1686116279
 28   0.255336 54.192.118.236 -> 172.31.8.238 TCP 5858 [TCP segment of a reassembled PDU]
 29   0.255342 172.31.8.238 -> 54.192.118.236 TCP 66 51092 > http [ACK] Seq=99 Ack=45345 Win=108416 Len=0 TSval=15926161 TSecr=1686116280
 30   0.255420 54.192.118.236 -> 172.31.8.238 TCP 1514 [TCP segment of a reassembled PDU]
 31   0.255425 172.31.8.238 -> 54.192.118.236 TCP 66 51092 > http [ACK] Seq=99 Ack=46793 Win=109056 Len=0 TSval=15926161 TSecr=1686116280
 32   0.255857 54.192.118.236 -> 172.31.8.238 TCP 4410 [TCP segment of a reassembled PDU]
 33   0.255862 172.31.8.238 -> 54.192.118.236 TCP 66 51092 > http [ACK] Seq=99 Ack=51137 Win=109056 Len=0 TSval=15926161 TSecr=1686116280
 34   0.255949 54.192.118.236 -> 172.31.8.238 TCP 1514 [TCP segment of a reassembled PDU]
 35   0.255954 172.31.8.238 -> 54.192.118.236 TCP 66 51092 > http [ACK] Seq=99 Ack=52585 Win=109056 Len=0 TSval=15926161 TSecr=1686116280
 36   0.256002 54.192.118.236 -> 172.31.8.238 TCP 13098 [TCP segment of a reassembled PDU]
 37   0.256012 172.31.8.238 -> 54.192.118.236 TCP 66 51092 > http [ACK] Seq=99 Ack=65617 Win=96512 Len=0 TSval=15926161 TSecr=1686116280
 38   0.256164 54.192.118.236 -> 172.31.8.238 TCP 10202 [TCP segment of a reassembled PDU]
 39   0.256172 172.31.8.238 -> 54.192.118.236 TCP 66 51092 > http [ACK] Seq=99 Ack=75753 Win=101248 Len=0 TSval=15926161 TSecr=1686116280
 40   0.256618 54.192.118.236 -> 172.31.8.238 TCP 2962 [TCP segment of a reassembled PDU]
 41   0.256623 172.31.8.238 -> 54.192.118.236 TCP 66 51092 > http [ACK] Seq=99 Ack=78649 Win=109056 Len=0 TSval=15926161 TSecr=1686116280
 42   0.256898 54.192.118.236 -> 172.31.8.238 TCP 13098 [TCP segment of a reassembled PDU]
 43   0.256907 172.31.8.238 -> 54.192.118.236 TCP 66 51092 > http [ACK] Seq=99 Ack=91681 Win=96512 Len=0 TSval=15926161 TSecr=1686116280
 44   0.256999 54.192.118.236 -> 172.31.8.238 HTTP 11242 HTTP/1.1 200 OK  (application/octet-stream)
 45   0.257007 172.31.8.238 -> 54.192.118.236 TCP 66 51092 > http [ACK] Seq=99 Ack=102857 Win=98944 Len=0 TSval=15926161 TSecr=1686116280
 46   0.257128 172.31.8.238 -> 54.192.118.236 TCP 66 51092 > http [FIN, ACK] Seq=99 Ack=102857 Win=109056 Len=0 TSval=15926161 TSecr=1686116280
 47   0.257895 54.192.118.236 -> 172.31.8.238 TCP 66 http > 51092 [FIN, ACK] Seq=102857 Ack=100 Win=14592 Len=0 TSval=1686116280 TSecr=15926161
 48   0.257904 172.31.8.238 -> 54.192.118.236 TCP 66 51092 > http [ACK] Seq=100 Ack=102858 Win=109056 Len=0 TSval=15926162 TSecr=1686116280
