[Measurement for 100kb at 17:41:46 19.41.2014] 
Tshark:

  1   0.000000 172.31.8.238 -> 172.31.0.2   DNS 89 Standard query 0x29c8  A d1xvcg6dfvgaki.cloudfront.net
  2   0.000040 172.31.8.238 -> 172.31.0.2   DNS 89 Standard query 0xeba9  AAAA d1xvcg6dfvgaki.cloudfront.net
  3   0.000906   172.31.0.2 -> 172.31.8.238 DNS 217 Standard query response 0x29c8  A 54.192.141.198 A 54.230.140.231 A 54.230.141.96 A 54.230.142.4 A 54.230.143.62 A 54.230.143.233 A 205.251.215.126 A 205.251.215.191
  4   0.000916   172.31.0.2 -> 172.31.8.238 DNS 170 Standard query response 0xeba9 
  5   0.003831 172.31.8.238 -> 54.192.141.198 TCP 74 52741 > http [SYN] Seq=0 Win=26883 Len=0 MSS=8961 SACK_PERM=1 TSval=633431 TSecr=0 WS=128
  6   0.005905 54.192.141.198 -> 172.31.8.238 TCP 74 http > 52741 [SYN, ACK] Seq=0 Ack=1 Win=14480 Len=0 MSS=1460 SACK_PERM=1 TSval=712497213 TSecr=633431 WS=128
  7   0.005920 172.31.8.238 -> 54.192.141.198 TCP 66 52741 > http [ACK] Seq=1 Ack=1 Win=27008 Len=0 TSval=633431 TSecr=712497213
  8   0.005960 172.31.8.238 -> 54.192.141.198 HTTP 164 GET /100kb HTTP/1.1 
  9   0.008371 54.192.141.198 -> 172.31.8.238 TCP 66 http > 52741 [ACK] Seq=1 Ack=99 Win=14592 Len=0 TSval=712497214 TSecr=633431
 10   0.241144 54.192.141.198 -> 172.31.8.238 TCP 13517 [TCP segment of a reassembled PDU]
 11   0.241176 172.31.8.238 -> 54.192.141.198 TCP 66 52741 > http [ACK] Seq=99 Ack=13452 Win=53888 Len=0 TSval=633490 TSecr=712497237
 12   0.428637 54.192.141.198 -> 172.31.8.238 TCP 1514 [TCP segment of a reassembled PDU]
 13   0.428662 172.31.8.238 -> 54.192.141.198 TCP 66 52741 > http [ACK] Seq=99 Ack=14900 Win=56704 Len=0 TSval=633537 TSecr=712497256
 14   0.429062 54.192.141.198 -> 172.31.8.238 TCP 1526 [TCP segment of a reassembled PDU]
 15   0.429069 172.31.8.238 -> 54.192.141.198 TCP 66 52741 > http [ACK] Seq=99 Ack=16360 Win=59648 Len=0 TSval=633537 TSecr=712497256
 16   0.429174 54.192.141.198 -> 172.31.8.238 TCP 5858 [TCP segment of a reassembled PDU]
 17   0.429181 172.31.8.238 -> 54.192.141.198 TCP 66 52741 > http [ACK] Seq=99 Ack=22152 Win=71296 Len=0 TSval=633537 TSecr=712497256
 18   0.429190 54.192.141.198 -> 172.31.8.238 TCP 2962 [TCP segment of a reassembled PDU]
 19   0.429194 172.31.8.238 -> 54.192.141.198 TCP 66 52741 > http [ACK] Seq=99 Ack=25048 Win=77056 Len=0 TSval=633537 TSecr=712497256
 20   0.429196 54.192.141.198 -> 172.31.8.238 TCP 78 [TCP segment of a reassembled PDU]
 21   0.429198 172.31.8.238 -> 54.192.141.198 TCP 66 52741 > http [ACK] Seq=99 Ack=25060 Win=77056 Len=0 TSval=633537 TSecr=712497256
 22   0.430579 54.192.141.198 -> 172.31.8.238 TCP 1514 [TCP segment of a reassembled PDU]
 23   0.430585 172.31.8.238 -> 54.192.141.198 TCP 66 52741 > http [ACK] Seq=99 Ack=26508 Win=80000 Len=0 TSval=633538 TSecr=712497256
 24   0.431353 54.192.141.198 -> 172.31.8.238 TCP 2962 [TCP segment of a reassembled PDU]
 25   0.431360 172.31.8.238 -> 54.192.141.198 TCP 66 52741 > http [ACK] Seq=99 Ack=29404 Win=85760 Len=0 TSval=633538 TSecr=712497256
 26   0.431437 54.192.141.198 -> 172.31.8.238 TCP 1634 [TCP segment of a reassembled PDU]
 27   0.431441 172.31.8.238 -> 54.192.141.198 TCP 66 52741 > http [ACK] Seq=99 Ack=30972 Win=88832 Len=0 TSval=633538 TSecr=712497256
 28   0.431850 54.192.141.198 -> 172.31.8.238 TCP 2962 [TCP segment of a reassembled PDU]
 29   0.431856 172.31.8.238 -> 54.192.141.198 TCP 66 52741 > http [ACK] Seq=99 Ack=33868 Win=94720 Len=0 TSval=633538 TSecr=712497256
 30   0.431940 54.192.141.198 -> 172.31.8.238 TCP 90 [TCP segment of a reassembled PDU]
 31   0.431944 172.31.8.238 -> 54.192.141.198 TCP 66 52741 > http [ACK] Seq=99 Ack=33892 Win=94720 Len=0 TSval=633538 TSecr=712497256
 32   0.619601 54.192.141.198 -> 172.31.8.238 TCP 1514 [TCP segment of a reassembled PDU]
 33   0.619620 172.31.8.238 -> 54.192.141.198 TCP 66 52741 > http [ACK] Seq=99 Ack=35340 Win=97536 Len=0 TSval=633585 TSecr=712497275
 34   0.619830 54.192.141.198 -> 172.31.8.238 TCP 1538 [TCP segment of a reassembled PDU]
 35   0.619835 172.31.8.238 -> 54.192.141.198 TCP 66 52741 > http [ACK] Seq=99 Ack=36812 Win=100480 Len=0 TSval=633585 TSecr=712497275
 36   0.620729 54.192.141.198 -> 172.31.8.238 TCP 17442 [TCP segment of a reassembled PDU]
 37   0.620743 172.31.8.238 -> 54.192.141.198 TCP 66 52741 > http [ACK] Seq=99 Ack=54188 Win=89344 Len=0 TSval=633585 TSecr=712497275
 38   0.623225 54.192.141.198 -> 172.31.8.238 TCP 6050 [TCP segment of a reassembled PDU]
 39   0.623232 172.31.8.238 -> 54.192.141.198 TCP 66 52741 > http [ACK] Seq=99 Ack=60172 Win=105984 Len=0 TSval=633586 TSecr=712497275
 40   0.810383 54.192.141.198 -> 172.31.8.238 TCP 1514 [TCP segment of a reassembled PDU]
 41   0.810407 172.31.8.238 -> 54.192.141.198 TCP 66 52741 > http [ACK] Seq=99 Ack=61620 Win=109056 Len=0 TSval=633632 TSecr=712497294
 42   0.810427 54.192.141.198 -> 172.31.8.238 TCP 1538 [TCP segment of a reassembled PDU]
 43   0.810431 172.31.8.238 -> 54.192.141.198 TCP 66 52741 > http [ACK] Seq=99 Ack=63092 Win=109056 Len=0 TSval=633632 TSecr=712497294
 44   0.810570 54.192.141.198 -> 172.31.8.238 TCP 4410 [TCP segment of a reassembled PDU]
 45   0.810577 172.31.8.238 -> 54.192.141.198 TCP 66 52741 > http [ACK] Seq=99 Ack=67436 Win=117760 Len=0 TSval=633633 TSecr=712497294
 46   0.810662 54.192.141.198 -> 172.31.8.238 TCP 3022 [TCP segment of a reassembled PDU]
 47   0.810668 172.31.8.238 -> 54.192.141.198 TCP 66 52741 > http [ACK] Seq=99 Ack=70392 Win=123648 Len=0 TSval=633633 TSecr=712497294
 48   0.810999 54.192.141.198 -> 172.31.8.238 TCP 1514 [TCP segment of a reassembled PDU]
 49   0.811004 172.31.8.238 -> 54.192.141.198 TCP 66 52741 > http [ACK] Seq=99 Ack=71840 Win=126592 Len=0 TSval=633633 TSecr=712497294
 50   0.811283 54.192.141.198 -> 172.31.8.238 TCP 2962 [TCP segment of a reassembled PDU]
 51   0.811288 172.31.8.238 -> 54.192.141.198 TCP 66 52741 > http [ACK] Seq=99 Ack=74736 Win=132352 Len=0 TSval=633633 TSecr=712497294
 52   0.811366 54.192.141.198 -> 172.31.8.238 TCP 2962 [TCP segment of a reassembled PDU]
 53   0.811371 172.31.8.238 -> 54.192.141.198 TCP 66 52741 > http [ACK] Seq=99 Ack=77632 Win=138112 Len=0 TSval=633633 TSecr=712497294
 54   0.811389 54.192.141.198 -> 172.31.8.238 TCP 126 [TCP segment of a reassembled PDU]
 55   0.811401 172.31.8.238 -> 54.192.141.198 TCP 66 52741 > http [ACK] Seq=99 Ack=77692 Win=138112 Len=0 TSval=633633 TSecr=712497294
 56   0.812836 54.192.141.198 -> 172.31.8.238 TCP 2962 [TCP segment of a reassembled PDU]
 57   0.812841 172.31.8.238 -> 54.192.141.198 TCP 66 52741 > http [ACK] Seq=99 Ack=80588 Win=143872 Len=0 TSval=633633 TSecr=712497294
 58   0.812936 54.192.141.198 -> 172.31.8.238 TCP 8754 [TCP segment of a reassembled PDU]
 59   0.812944 172.31.8.238 -> 54.192.141.198 TCP 66 52741 > http [ACK] Seq=99 Ack=89276 Win=161280 Len=0 TSval=633633 TSecr=712497294
 60   0.813031 54.192.141.198 -> 172.31.8.238 TCP 4542 [TCP segment of a reassembled PDU]
 61   0.813036 172.31.8.238 -> 54.192.141.198 TCP 66 52741 > http [ACK] Seq=99 Ack=93752 Win=170240 Len=0 TSval=633633 TSecr=712497294
 62   1.001898 54.192.141.198 -> 172.31.8.238 TCP 1514 [TCP segment of a reassembled PDU]
 63   1.001923 172.31.8.238 -> 54.192.141.198 TCP 66 52741 > http [ACK] Seq=99 Ack=95200 Win=173184 Len=0 TSval=633680 TSecr=712497313
 64   1.002206 54.192.141.198 -> 172.31.8.238 TCP 78 [TCP segment of a reassembled PDU]
 65   1.002225 172.31.8.238 -> 54.192.141.198 TCP 66 52741 > http [ACK] Seq=99 Ack=95212 Win=173184 Len=0 TSval=633680 TSecr=712497313
 66   1.002592 54.192.141.198 -> 172.31.8.238 TCP 1514 [TCP segment of a reassembled PDU]
 67   1.002598 172.31.8.238 -> 54.192.141.198 TCP 66 52741 > http [ACK] Seq=99 Ack=96660 Win=176000 Len=0 TSval=633681 TSecr=712497313
 68   1.002616 54.192.141.198 -> 172.31.8.238 TCP 78 [TCP segment of a reassembled PDU]
 69   1.002628 172.31.8.238 -> 54.192.141.198 TCP 66 52741 > http [ACK] Seq=99 Ack=96672 Win=176000 Len=0 TSval=633681 TSecr=712497313
 70   1.002881 54.192.141.198 -> 172.31.8.238 TCP 1514 [TCP segment of a reassembled PDU]
 71   1.002885 172.31.8.238 -> 54.192.141.198 TCP 66 52741 > http [ACK] Seq=99 Ack=98120 Win=178944 Len=0 TSval=633681 TSecr=712497313
 72   1.003129 54.192.141.198 -> 172.31.8.238 TCP 2962 [TCP segment of a reassembled PDU]
 73   1.003135 172.31.8.238 -> 54.192.141.198 TCP 66 52741 > http [ACK] Seq=99 Ack=101016 Win=184704 Len=0 TSval=633681 TSecr=712497313
 74   1.003155 54.192.141.198 -> 172.31.8.238 TCP 102 [TCP segment of a reassembled PDU]
 75   1.003166 172.31.8.238 -> 54.192.141.198 TCP 66 52741 > http [ACK] Seq=99 Ack=101052 Win=184704 Len=0 TSval=633681 TSecr=712497313
 76   1.003928 54.192.141.198 -> 172.31.8.238 HTTP 1860 HTTP/1.1 200 OK  (application/octet-stream)
 77   1.003933 172.31.8.238 -> 54.192.141.198 TCP 66 52741 > http [ACK] Seq=99 Ack=102846 Win=188288 Len=0 TSval=633681 TSecr=712497313
 78   1.004094 172.31.8.238 -> 54.192.141.198 TCP 66 52741 > http [FIN, ACK] Seq=99 Ack=102846 Win=188288 Len=0 TSval=633681 TSecr=712497313
 79   1.006181 54.192.141.198 -> 172.31.8.238 TCP 66 http > 52741 [FIN, ACK] Seq=102846 Ack=100 Win=14592 Len=0 TSval=712497313 TSecr=633681
 80   1.006191 172.31.8.238 -> 54.192.141.198 TCP 66 52741 > http [ACK] Seq=100 Ack=102847 Win=188288 Len=0 TSval=633681 TSecr=712497313
