[Measurement for 100kb at 09:41:17 20.41.2014] 
Tshark:

  1   0.000000 172.31.8.238 -> 172.31.0.2   DNS 89 Standard query 0x0261  A d1xvcg6dfvgaki.cloudfront.net
  2   0.000031 172.31.8.238 -> 172.31.0.2   DNS 89 Standard query 0x16b4  AAAA d1xvcg6dfvgaki.cloudfront.net
  3   0.000591   172.31.0.2 -> 172.31.8.238 DNS 217 Standard query response 0x0261  A 54.192.118.242 A 54.230.117.10 A 54.230.117.15 A 54.230.117.45 A 54.230.117.87 A 54.230.118.143 A 54.230.119.91 A 54.230.119.125
  4   0.000603   172.31.0.2 -> 172.31.8.238 DNS 170 Standard query response 0x16b4 
  5   0.003850 172.31.8.238 -> 54.192.118.242 TCP 74 59123 > http [SYN] Seq=0 Win=26883 Len=0 MSS=8961 SACK_PERM=1 TSval=15026298 TSecr=0 WS=128
  6   0.004558 54.192.118.242 -> 172.31.8.238 TCP 74 http > 59123 [SYN, ACK] Seq=0 Ack=1 Win=14480 Len=0 MSS=1460 SACK_PERM=1 TSval=1685825931 TSecr=15026298 WS=128
  7   0.004573 172.31.8.238 -> 54.192.118.242 TCP 66 59123 > http [ACK] Seq=1 Ack=1 Win=27008 Len=0 TSval=15026298 TSecr=1685825931
  8   0.004615 172.31.8.238 -> 54.192.118.242 HTTP 164 GET /100kb HTTP/1.1 
  9   0.005314 54.192.118.242 -> 172.31.8.238 TCP 66 http > 59123 [ACK] Seq=1 Ack=99 Win=14592 Len=0 TSval=1685825931 TSecr=15026298
 10   0.007389 54.192.118.242 -> 172.31.8.238 TCP 4410 [TCP segment of a reassembled PDU]
 11   0.007398 172.31.8.238 -> 54.192.118.242 TCP 66 59123 > http [ACK] Seq=99 Ack=4345 Win=35584 Len=0 TSval=15026299 TSecr=1685825931
 12   0.007522 54.192.118.242 -> 172.31.8.238 TCP 6314 [TCP segment of a reassembled PDU]
 13   0.007531 172.31.8.238 -> 54.192.118.242 TCP 66 59123 > http [ACK] Seq=99 Ack=10593 Win=48128 Len=0 TSval=15026299 TSecr=1685825931
 14   0.007540 54.192.118.242 -> 172.31.8.238 TCP 2962 [TCP segment of a reassembled PDU]
 15   0.007544 172.31.8.238 -> 54.192.118.242 TCP 66 59123 > http [ACK] Seq=99 Ack=13489 Win=53888 Len=0 TSval=15026299 TSecr=1685825931
 16   0.008147 54.192.118.242 -> 172.31.8.238 TCP 4410 [TCP segment of a reassembled PDU]
 17   0.008153 172.31.8.238 -> 54.192.118.242 TCP 66 59123 > http [ACK] Seq=99 Ack=17833 Win=62592 Len=0 TSval=15026299 TSecr=1685825931
 18   0.008249 54.192.118.242 -> 172.31.8.238 TCP 8754 [TCP segment of a reassembled PDU]
 19   0.008257 172.31.8.238 -> 54.192.118.242 TCP 66 59123 > http [ACK] Seq=99 Ack=26521 Win=80000 Len=0 TSval=15026299 TSecr=1685825931
 20   0.008647 54.192.118.242 -> 172.31.8.238 TCP 2962 [TCP segment of a reassembled PDU]
 21   0.008653 172.31.8.238 -> 54.192.118.242 TCP 66 59123 > http [ACK] Seq=99 Ack=29417 Win=85760 Len=0 TSval=15026299 TSecr=1685825931
 22   0.008751 54.192.118.242 -> 172.31.8.238 TCP 8754 [TCP segment of a reassembled PDU]
 23   0.008758 172.31.8.238 -> 54.192.118.242 TCP 66 59123 > http [ACK] Seq=99 Ack=38105 Win=103168 Len=0 TSval=15026299 TSecr=1685825931
 24   0.008942 54.192.118.242 -> 172.31.8.238 TCP 7306 [TCP segment of a reassembled PDU]
 25   0.008949 172.31.8.238 -> 54.192.118.242 TCP 66 59123 > http [ACK] Seq=99 Ack=45345 Win=105984 Len=0 TSval=15026299 TSecr=1685825931
 26   0.009031 54.192.118.242 -> 172.31.8.238 TCP 2962 [TCP segment of a reassembled PDU]
 27   0.009037 172.31.8.238 -> 54.192.118.242 TCP 66 59123 > http [ACK] Seq=99 Ack=48241 Win=109056 Len=0 TSval=15026299 TSecr=1685825931
 28   0.009170 54.192.118.242 -> 172.31.8.238 TCP 4410 [TCP segment of a reassembled PDU]
 29   0.009176 172.31.8.238 -> 54.192.118.242 TCP 66 59123 > http [ACK] Seq=99 Ack=52585 Win=109056 Len=0 TSval=15026299 TSecr=1685825931
 30   0.009426 54.192.118.242 -> 172.31.8.238 TCP 5858 [TCP segment of a reassembled PDU]
 31   0.009432 172.31.8.238 -> 54.192.118.242 TCP 66 59123 > http [ACK] Seq=99 Ack=58377 Win=108416 Len=0 TSval=15026299 TSecr=1685825931
 32   0.009522 54.192.118.242 -> 172.31.8.238 TCP 7306 [TCP segment of a reassembled PDU]
 33   0.009529 172.31.8.238 -> 54.192.118.242 TCP 66 59123 > http [ACK] Seq=99 Ack=65617 Win=105984 Len=0 TSval=15026299 TSecr=1685825931
 34   0.009749 54.192.118.242 -> 172.31.8.238 TCP 13098 [TCP segment of a reassembled PDU]
 35   0.009757 172.31.8.238 -> 54.192.118.242 TCP 66 59123 > http [ACK] Seq=99 Ack=78649 Win=96512 Len=0 TSval=15026299 TSecr=1685825931
 36   0.009983 54.192.118.242 -> 172.31.8.238 TCP 10202 [TCP segment of a reassembled PDU]
 37   0.009990 172.31.8.238 -> 54.192.118.242 TCP 66 59123 > http [ACK] Seq=99 Ack=88785 Win=101248 Len=0 TSval=15026299 TSecr=1685825931
 38   0.010473 54.192.118.242 -> 172.31.8.238 TCP 5858 [TCP segment of a reassembled PDU]
 39   0.010480 172.31.8.238 -> 54.192.118.242 TCP 66 59123 > http [ACK] Seq=99 Ack=94577 Win=108416 Len=0 TSval=15026300 TSecr=1685825931
 40   0.010577 54.192.118.242 -> 172.31.8.238 HTTP 8346 HTTP/1.1 200 OK  (application/octet-stream)
 41   0.010584 172.31.8.238 -> 54.192.118.242 TCP 66 59123 > http [ACK] Seq=99 Ack=102857 Win=125568 Len=0 TSval=15026300 TSecr=1685825931
 42   0.010712 172.31.8.238 -> 54.192.118.242 TCP 66 59123 > http [FIN, ACK] Seq=99 Ack=102857 Win=125568 Len=0 TSval=15026300 TSecr=1685825931
 43   0.011187 54.192.118.242 -> 172.31.8.238 TCP 66 http > 59123 [FIN, ACK] Seq=102857 Ack=100 Win=14592 Len=0 TSval=1685825931 TSecr=15026300
 44   0.011195 172.31.8.238 -> 54.192.118.242 TCP 66 59123 > http [ACK] Seq=100 Ack=102858 Win=125568 Len=0 TSval=15026300 TSecr=1685825931
