[Measurement for 100kb at 07:41:16 20.41.2014] 
Tshark:

  1   0.000000 172.31.8.238 -> 172.31.0.2   DNS 89 Standard query 0x7dc8  A d1xvcg6dfvgaki.cloudfront.net
  2   0.000030 172.31.8.238 -> 172.31.0.2   DNS 89 Standard query 0x2286  AAAA d1xvcg6dfvgaki.cloudfront.net
  3   0.000572   172.31.0.2 -> 172.31.8.238 DNS 170 Standard query response 0x2286 
  4   0.000582   172.31.0.2 -> 172.31.8.238 DNS 217 Standard query response 0x7dc8  A 54.230.119.3 A 54.192.118.220 A 54.192.118.247 A 54.230.116.73 A 54.230.116.204 A 54.230.117.21 A 54.230.117.42 A 54.230.118.248
  5   0.003881 172.31.8.238 -> 54.230.119.3 TCP 74 41186 > http [SYN] Seq=0 Win=26883 Len=0 MSS=8961 SACK_PERM=1 TSval=13226158 TSecr=0 WS=128
  6   0.004595 54.230.119.3 -> 172.31.8.238 TCP 74 http > 41186 [SYN, ACK] Seq=0 Ack=1 Win=14480 Len=0 MSS=1460 SACK_PERM=1 TSval=1687234764 TSecr=13226158 WS=128
  7   0.004609 172.31.8.238 -> 54.230.119.3 TCP 66 41186 > http [ACK] Seq=1 Ack=1 Win=27008 Len=0 TSval=13226158 TSecr=1687234764
  8   0.004648 172.31.8.238 -> 54.230.119.3 HTTP 164 GET /100kb HTTP/1.1 
  9   0.005385 54.230.119.3 -> 172.31.8.238 TCP 66 http > 41186 [ACK] Seq=1 Ack=99 Win=14592 Len=0 TSval=1687234764 TSecr=13226158
 10   0.008281 54.230.119.3 -> 172.31.8.238 TCP 522 [TCP segment of a reassembled PDU]
 11   0.008290 172.31.8.238 -> 54.230.119.3 TCP 66 41186 > http [ACK] Seq=99 Ack=457 Win=28032 Len=0 TSval=13226159 TSecr=1687234765
 12   0.008304 54.230.119.3 -> 172.31.8.238 TCP 7306 [TCP segment of a reassembled PDU]
 13   0.008311 172.31.8.238 -> 54.230.119.3 TCP 66 41186 > http [ACK] Seq=99 Ack=7697 Win=42496 Len=0 TSval=13226159 TSecr=1687234765
 14   0.008317 54.230.119.3 -> 172.31.8.238 TCP 5858 [TCP segment of a reassembled PDU]
 15   0.008322 172.31.8.238 -> 54.230.119.3 TCP 66 41186 > http [ACK] Seq=99 Ack=13489 Win=54144 Len=0 TSval=13226159 TSecr=1687234765
 16   0.008980 54.230.119.3 -> 172.31.8.238 TCP 5858 [TCP segment of a reassembled PDU]
 17   0.008989 172.31.8.238 -> 54.230.119.3 TCP 66 41186 > http [ACK] Seq=99 Ack=19281 Win=65664 Len=0 TSval=13226159 TSecr=1687234765
 18   0.009053 54.230.119.3 -> 172.31.8.238 TCP 7306 [TCP segment of a reassembled PDU]
 19   0.009061 172.31.8.238 -> 54.230.119.3 TCP 66 41186 > http [ACK] Seq=99 Ack=26521 Win=80128 Len=0 TSval=13226159 TSecr=1687234765
 20   0.009718 54.230.119.3 -> 172.31.8.238 TCP 4410 [TCP segment of a reassembled PDU]
 21   0.009726 172.31.8.238 -> 54.230.119.3 TCP 66 41186 > http [ACK] Seq=99 Ack=30865 Win=88832 Len=0 TSval=13226159 TSecr=1687234765
 22   0.009829 54.230.119.3 -> 172.31.8.238 TCP 15994 [TCP segment of a reassembled PDU]
 23   0.009840 172.31.8.238 -> 54.230.119.3 TCP 66 41186 > http [ACK] Seq=99 Ack=46793 Win=91648 Len=0 TSval=13226159 TSecr=1687234765
 24   0.009877 54.230.119.3 -> 172.31.8.238 TCP 1514 [TCP segment of a reassembled PDU]
 25   0.009882 172.31.8.238 -> 54.230.119.3 TCP 66 41186 > http [ACK] Seq=99 Ack=48241 Win=109056 Len=0 TSval=13226159 TSecr=1687234765
 26   0.010486 54.230.119.3 -> 172.31.8.238 TCP 4410 [TCP segment of a reassembled PDU]
 27   0.010492 172.31.8.238 -> 54.230.119.3 TCP 66 41186 > http [ACK] Seq=99 Ack=52585 Win=109056 Len=0 TSval=13226159 TSecr=1687234765
 28   0.010616 54.230.119.3 -> 172.31.8.238 TCP 18890 [TCP segment of a reassembled PDU]
 29   0.010629 172.31.8.238 -> 54.230.119.3 TCP 66 41186 > http [ACK] Seq=99 Ack=71409 Win=90240 Len=0 TSval=13226159 TSecr=1687234765
 30   0.011275 54.230.119.3 -> 172.31.8.238 TCP 4410 [TCP segment of a reassembled PDU]
 31   0.011282 172.31.8.238 -> 54.230.119.3 TCP 66 41186 > http [ACK] Seq=99 Ack=75753 Win=109056 Len=0 TSval=13226159 TSecr=1687234765
 32   0.011409 54.230.119.3 -> 172.31.8.238 TCP 17442 [TCP segment of a reassembled PDU]
 33   0.011419 172.31.8.238 -> 54.230.119.3 TCP 66 41186 > http [ACK] Seq=99 Ack=93129 Win=91776 Len=0 TSval=13226160 TSecr=1687234765
 34   0.011443 54.230.119.3 -> 172.31.8.238 TCP 7306 [TCP segment of a reassembled PDU]
 35   0.011462 172.31.8.238 -> 54.230.119.3 TCP 66 41186 > http [ACK] Seq=99 Ack=100369 Win=84608 Len=0 TSval=13226160 TSecr=1687234765
 36   0.012043 54.230.119.3 -> 172.31.8.238 HTTP 2554 HTTP/1.1 200 OK  (application/octet-stream)
 37   0.012049 172.31.8.238 -> 54.230.119.3 TCP 66 41186 > http [ACK] Seq=99 Ack=102857 Win=114048 Len=0 TSval=13226160 TSecr=1687234765
 38   0.012174 172.31.8.238 -> 54.230.119.3 TCP 66 41186 > http [FIN, ACK] Seq=99 Ack=102857 Win=114048 Len=0 TSval=13226160 TSecr=1687234765
 39   0.012753 54.230.119.3 -> 172.31.8.238 TCP 66 http > 41186 [FIN, ACK] Seq=102857 Ack=100 Win=14592 Len=0 TSval=1687234765 TSecr=13226160
 40   0.012761 172.31.8.238 -> 54.230.119.3 TCP 66 41186 > http [ACK] Seq=100 Ack=102858 Win=114048 Len=0 TSval=13226160 TSecr=1687234765
