[Measurement for 100kb at 12:41:17 20.41.2014] 
Tshark:

  1   0.000000 172.31.8.238 -> 172.31.0.2   DNS 89 Standard query 0x43c2  A d1xvcg6dfvgaki.cloudfront.net
  2   0.000033 172.31.8.238 -> 172.31.0.2   DNS 89 Standard query 0xd266  AAAA d1xvcg6dfvgaki.cloudfront.net
  3   0.000772   172.31.0.2 -> 172.31.8.238 DNS 170 Standard query response 0xd266 
  4   0.000797   172.31.0.2 -> 172.31.8.238 DNS 217 Standard query response 0x43c2  A 54.230.116.82 A 54.230.116.141 A 54.230.116.204 A 54.230.117.156 A 54.230.119.66 A 54.230.119.125 A 54.239.132.173 A 54.192.118.228
  5   0.003852 172.31.8.238 -> 54.230.116.82 TCP 74 60513 > http [SYN] Seq=0 Win=26883 Len=0 MSS=8961 SACK_PERM=1 TSval=17726339 TSecr=0 WS=128
  6   0.004530 54.230.116.82 -> 172.31.8.238 TCP 74 http > 60513 [SYN, ACK] Seq=0 Ack=1 Win=14480 Len=0 MSS=1460 SACK_PERM=1 TSval=1687544365 TSecr=17726339 WS=128
  7   0.004544 172.31.8.238 -> 54.230.116.82 TCP 66 60513 > http [ACK] Seq=1 Ack=1 Win=27008 Len=0 TSval=17726339 TSecr=1687544365
  8   0.004589 172.31.8.238 -> 54.230.116.82 HTTP 164 GET /100kb HTTP/1.1 
  9   0.005281 54.230.116.82 -> 172.31.8.238 TCP 66 http > 60513 [ACK] Seq=1 Ack=99 Win=14592 Len=0 TSval=1687544365 TSecr=17726339
 10   0.007324 54.230.116.82 -> 172.31.8.238 TCP 522 [TCP segment of a reassembled PDU]
 11   0.007331 172.31.8.238 -> 54.230.116.82 TCP 66 60513 > http [ACK] Seq=99 Ack=457 Win=28032 Len=0 TSval=17726340 TSecr=1687544365
 12   0.007415 54.230.116.82 -> 172.31.8.238 TCP 13098 [TCP segment of a reassembled PDU]
 13   0.007426 172.31.8.238 -> 54.230.116.82 TCP 66 60513 > http [ACK] Seq=99 Ack=13489 Win=54144 Len=0 TSval=17726340 TSecr=1687544365
 14   0.008100 54.230.116.82 -> 172.31.8.238 TCP 4410 [TCP segment of a reassembled PDU]
 15   0.008108 172.31.8.238 -> 54.230.116.82 TCP 66 60513 > http [ACK] Seq=99 Ack=17833 Win=62720 Len=0 TSval=17726340 TSecr=1687544365
 16   0.008233 54.230.116.82 -> 172.31.8.238 TCP 8754 [TCP segment of a reassembled PDU]
 17   0.008242 172.31.8.238 -> 54.230.116.82 TCP 66 60513 > http [ACK] Seq=99 Ack=26521 Win=80128 Len=0 TSval=17726340 TSecr=1687544365
 18   0.008865 54.230.116.82 -> 172.31.8.238 TCP 4410 [TCP segment of a reassembled PDU]
 19   0.008872 172.31.8.238 -> 54.230.116.82 TCP 66 60513 > http [ACK] Seq=99 Ack=30865 Win=88832 Len=0 TSval=17726340 TSecr=1687544365
 20   0.008982 54.230.116.82 -> 172.31.8.238 TCP 8754 [TCP segment of a reassembled PDU]
 21   0.008990 172.31.8.238 -> 54.230.116.82 TCP 66 60513 > http [ACK] Seq=99 Ack=39553 Win=103680 Len=0 TSval=17726340 TSecr=1687544365
 22   0.009003 54.230.116.82 -> 172.31.8.238 TCP 5858 [TCP segment of a reassembled PDU]
 23   0.009008 172.31.8.238 -> 54.230.116.82 TCP 66 60513 > http [ACK] Seq=99 Ack=45345 Win=97920 Len=0 TSval=17726340 TSecr=1687544365
 24   0.009122 54.230.116.82 -> 172.31.8.238 TCP 1514 [TCP segment of a reassembled PDU]
 25   0.009127 172.31.8.238 -> 54.230.116.82 TCP 66 60513 > http [ACK] Seq=99 Ack=46793 Win=109056 Len=0 TSval=17726340 TSecr=1687544365
 26   0.009396 54.230.116.82 -> 172.31.8.238 TCP 1514 [TCP segment of a reassembled PDU]
 27   0.009401 172.31.8.238 -> 54.230.116.82 TCP 66 60513 > http [ACK] Seq=99 Ack=48241 Win=109056 Len=0 TSval=17726341 TSecr=1687544365
 28   0.009507 54.230.116.82 -> 172.31.8.238 TCP 4410 [TCP segment of a reassembled PDU]
 29   0.009515 172.31.8.238 -> 54.230.116.82 TCP 66 60513 > http [ACK] Seq=99 Ack=52585 Win=117760 Len=0 TSval=17726341 TSecr=1687544365
 30   0.009642 54.230.116.82 -> 172.31.8.238 TCP 5858 [TCP segment of a reassembled PDU]
 31   0.009649 172.31.8.238 -> 54.230.116.82 TCP 66 60513 > http [ACK] Seq=99 Ack=58377 Win=129280 Len=0 TSval=17726341 TSecr=1687544366
 32   0.009765 54.230.116.82 -> 172.31.8.238 TCP 7306 [TCP segment of a reassembled PDU]
 33   0.009773 172.31.8.238 -> 54.230.116.82 TCP 66 60513 > http [ACK] Seq=99 Ack=65617 Win=143872 Len=0 TSval=17726341 TSecr=1687544366
 34   0.010142 54.230.116.82 -> 172.31.8.238 TCP 4410 [TCP segment of a reassembled PDU]
 35   0.010148 172.31.8.238 -> 54.230.116.82 TCP 66 60513 > http [ACK] Seq=99 Ack=69961 Win=152448 Len=0 TSval=17726341 TSecr=1687544366
 36   0.010244 54.230.116.82 -> 172.31.8.238 TCP 8754 [TCP segment of a reassembled PDU]
 37   0.010251 172.31.8.238 -> 54.230.116.82 TCP 66 60513 > http [ACK] Seq=99 Ack=78649 Win=169856 Len=0 TSval=17726341 TSecr=1687544366
 38   0.010399 54.230.116.82 -> 172.31.8.238 TCP 1514 [TCP segment of a reassembled PDU]
 39   0.010404 172.31.8.238 -> 54.230.116.82 TCP 66 60513 > http [ACK] Seq=99 Ack=80097 Win=172800 Len=0 TSval=17726341 TSecr=1687544366
 40   0.010506 54.230.116.82 -> 172.31.8.238 TCP 11650 [TCP segment of a reassembled PDU]
 41   0.010514 172.31.8.238 -> 54.230.116.82 TCP 66 60513 > http [ACK] Seq=99 Ack=91681 Win=195968 Len=0 TSval=17726341 TSecr=1687544366
 42   0.010760 54.230.116.82 -> 172.31.8.238 TCP 10202 [TCP segment of a reassembled PDU]
 43   0.010767 172.31.8.238 -> 54.230.116.82 TCP 66 60513 > http [ACK] Seq=99 Ack=101817 Win=216192 Len=0 TSval=17726341 TSecr=1687544366
 44   0.010907 54.230.116.82 -> 172.31.8.238 HTTP 1106 HTTP/1.1 200 OK  (application/octet-stream)
 45   0.010912 172.31.8.238 -> 54.230.116.82 TCP 66 60513 > http [ACK] Seq=99 Ack=102857 Win=219136 Len=0 TSval=17726341 TSecr=1687544366
 46   0.011036 172.31.8.238 -> 54.230.116.82 TCP 66 60513 > http [FIN, ACK] Seq=99 Ack=102857 Win=219136 Len=0 TSval=17726341 TSecr=1687544366
 47   0.011662 54.230.116.82 -> 172.31.8.238 TCP 66 http > 60513 [FIN, ACK] Seq=102857 Ack=100 Win=14592 Len=0 TSval=1687544366 TSecr=17726341
 48   0.011671 172.31.8.238 -> 54.230.116.82 TCP 66 60513 > http [ACK] Seq=100 Ack=102858 Win=219136 Len=0 TSval=17726341 TSecr=1687544366
