[Measurement for 100kb at 00:41:17 20.41.2014] 
Tshark:

  1   0.000000 172.31.8.238 -> 172.31.0.2   DNS 89 Standard query 0x0bc9  A d1xvcg6dfvgaki.cloudfront.net
  2   0.000038 172.31.8.238 -> 172.31.0.2   DNS 89 Standard query 0x419a  AAAA d1xvcg6dfvgaki.cloudfront.net
  3   0.000758   172.31.0.2 -> 172.31.8.238 DNS 170 Standard query response 0x419a 
  4   0.000768   172.31.0.2 -> 172.31.8.238 DNS 217 Standard query response 0x0bc9  A 54.230.118.239 A 54.230.119.110 A 54.230.119.189 A 54.239.132.90 A 54.239.132.103 A 54.239.132.249 A 54.230.116.73 A 54.230.116.82
  5   0.003928 172.31.8.238 -> 54.230.118.239 TCP 74 36122 > http [SYN] Seq=0 Win=26883 Len=0 MSS=8961 SACK_PERM=1 TSval=6926229 TSecr=0 WS=128
  6   0.004508 54.230.118.239 -> 172.31.8.238 TCP 74 http > 36122 [SYN, ACK] Seq=0 Ack=1 Win=14480 Len=0 MSS=1460 SACK_PERM=1 TSval=1684714762 TSecr=6926229 WS=128
  7   0.004522 172.31.8.238 -> 54.230.118.239 TCP 66 36122 > http [ACK] Seq=1 Ack=1 Win=27008 Len=0 TSval=6926229 TSecr=1684714762
  8   0.004570 172.31.8.238 -> 54.230.118.239 HTTP 164 GET /100kb HTTP/1.1 
  9   0.005230 54.230.118.239 -> 172.31.8.238 TCP 66 http > 36122 [ACK] Seq=1 Ack=99 Win=14592 Len=0 TSval=1684714762 TSecr=6926229
 10   0.007287 54.230.118.239 -> 172.31.8.238 TCP 5858 [TCP segment of a reassembled PDU]
 11   0.007296 172.31.8.238 -> 54.230.118.239 TCP 66 36122 > http [ACK] Seq=99 Ack=5793 Win=38528 Len=0 TSval=6926230 TSecr=1684714762
 12   0.007398 54.230.118.239 -> 172.31.8.238 TCP 7306 [TCP segment of a reassembled PDU]
 13   0.007406 172.31.8.238 -> 54.230.118.239 TCP 66 36122 > http [ACK] Seq=99 Ack=13033 Win=52992 Len=0 TSval=6926230 TSecr=1684714762
 14   0.007780 54.230.118.239 -> 172.31.8.238 TCP 4410 [TCP segment of a reassembled PDU]
 15   0.007786 172.31.8.238 -> 54.230.118.239 TCP 66 36122 > http [ACK] Seq=99 Ack=17377 Win=61696 Len=0 TSval=6926230 TSecr=1684714762
 16   0.007890 54.230.118.239 -> 172.31.8.238 TCP 4410 [TCP segment of a reassembled PDU]
 17   0.007896 172.31.8.238 -> 54.230.118.239 TCP 66 36122 > http [ACK] Seq=99 Ack=21721 Win=70400 Len=0 TSval=6926230 TSecr=1684714762
 18   0.008053 54.230.118.239 -> 172.31.8.238 TCP 4410 [TCP segment of a reassembled PDU]
 19   0.008058 172.31.8.238 -> 54.230.118.239 TCP 66 36122 > http [ACK] Seq=99 Ack=26065 Win=79104 Len=0 TSval=6926230 TSecr=1684714762
 20   0.008350 54.230.118.239 -> 172.31.8.238 TCP 10202 [TCP segment of a reassembled PDU]
 21   0.008358 172.31.8.238 -> 54.230.118.239 TCP 66 36122 > http [ACK] Seq=99 Ack=36201 Win=99328 Len=0 TSval=6926230 TSecr=1684714762
 22   0.008559 54.230.118.239 -> 172.31.8.238 TCP 4410 [TCP segment of a reassembled PDU]
 23   0.008565 172.31.8.238 -> 54.230.118.239 TCP 66 36122 > http [ACK] Seq=99 Ack=40545 Win=108032 Len=0 TSval=6926230 TSecr=1684714763
 24   0.008661 54.230.118.239 -> 172.31.8.238 TCP 7306 [TCP segment of a reassembled PDU]
 25   0.008667 172.31.8.238 -> 54.230.118.239 TCP 66 36122 > http [ACK] Seq=99 Ack=47785 Win=105984 Len=0 TSval=6926230 TSecr=1684714763
 26   0.008794 54.230.118.239 -> 172.31.8.238 TCP 1514 [TCP segment of a reassembled PDU]
 27   0.008798 172.31.8.238 -> 54.230.118.239 TCP 66 36122 > http [ACK] Seq=99 Ack=49233 Win=109056 Len=0 TSval=6926230 TSecr=1684714763
 28   0.008877 54.230.118.239 -> 172.31.8.238 TCP 2962 [TCP segment of a reassembled PDU]
 29   0.008882 172.31.8.238 -> 54.230.118.239 TCP 66 36122 > http [ACK] Seq=99 Ack=52129 Win=109056 Len=0 TSval=6926230 TSecr=1684714763
 30   0.009109 54.230.118.239 -> 172.31.8.238 TCP 13098 [TCP segment of a reassembled PDU]
 31   0.009117 172.31.8.238 -> 54.230.118.239 TCP 66 36122 > http [ACK] Seq=99 Ack=65161 Win=96512 Len=0 TSval=6926230 TSecr=1684714763
 32   0.009342 54.230.118.239 -> 172.31.8.238 TCP 5858 [TCP segment of a reassembled PDU]
 33   0.009349 172.31.8.238 -> 54.230.118.239 TCP 66 36122 > http [ACK] Seq=99 Ack=70953 Win=108416 Len=0 TSval=6926231 TSecr=1684714763
 34   0.009443 54.230.118.239 -> 172.31.8.238 TCP 2962 [TCP segment of a reassembled PDU]
 35   0.009448 172.31.8.238 -> 54.230.118.239 TCP 66 36122 > http [ACK] Seq=99 Ack=73849 Win=114816 Len=0 TSval=6926231 TSecr=1684714763
 36   0.009608 54.230.118.239 -> 172.31.8.238 TCP 10202 [TCP segment of a reassembled PDU]
 37   0.009616 172.31.8.238 -> 54.230.118.239 TCP 66 36122 > http [ACK] Seq=99 Ack=83985 Win=135168 Len=0 TSval=6926231 TSecr=1684714763
 38   0.009736 54.230.118.239 -> 172.31.8.238 TCP 11650 [TCP segment of a reassembled PDU]
 39   0.009744 172.31.8.238 -> 54.230.118.239 TCP 66 36122 > http [ACK] Seq=99 Ack=95569 Win=158336 Len=0 TSval=6926231 TSecr=1684714763
 40   0.010112 54.230.118.239 -> 172.31.8.238 TCP 7306 [TCP segment of a reassembled PDU]
 41   0.010120 172.31.8.238 -> 54.230.118.239 TCP 66 36122 > http [ACK] Seq=99 Ack=102809 Win=172800 Len=0 TSval=6926231 TSecr=1684714763
 42   0.010140 54.230.118.239 -> 172.31.8.238 HTTP 114 HTTP/1.1 200 OK  (application/octet-stream)
 43   0.010146 172.31.8.238 -> 54.230.118.239 TCP 66 36122 > http [ACK] Seq=99 Ack=102857 Win=172800 Len=0 TSval=6926231 TSecr=1684714763
 44   0.010254 172.31.8.238 -> 54.230.118.239 TCP 66 36122 > http [FIN, ACK] Seq=99 Ack=102857 Win=172800 Len=0 TSval=6926231 TSecr=1684714763
 45   0.010823 54.230.118.239 -> 172.31.8.238 TCP 66 http > 36122 [FIN, ACK] Seq=102857 Ack=100 Win=14592 Len=0 TSval=1684714763 TSecr=6926231
 46   0.010831 172.31.8.238 -> 54.230.118.239 TCP 66 36122 > http [ACK] Seq=100 Ack=102858 Win=172800 Len=0 TSval=6926231 TSecr=1684714763
