[Measurement for 10mb at 11:37:53 20.37.2014] 
Tshark:

  1   0.000000 172.31.29.138 -> 172.31.0.2   DNS 88 Standard query 0x5e6e  A dm53kc3eax57k.cloudfront.net
  2   0.000023 172.31.29.138 -> 172.31.0.2   DNS 88 Standard query 0x80c4  AAAA dm53kc3eax57k.cloudfront.net
  3   0.000545   172.31.0.2 -> 172.31.29.138 DNS 216 Standard query response 0x5e6e  A 54.230.150.31 A 54.230.150.36 A 54.230.150.38 A 54.230.150.54 A 54.230.150.148 A 54.230.150.159 A 54.230.149.156 A 54.230.149.214
  4   0.000575   172.31.0.2 -> 172.31.29.138 DNS 175 Standard query response 0x80c4 
  5   0.003890 172.31.29.138 -> 54.230.150.31 TCP 74 33306 > http [SYN] Seq=0 Win=26883 Len=0 MSS=8961 SACK_PERM=1 TSval=16836559 TSecr=0 WS=128
  6   0.005396 54.230.150.31 -> 172.31.29.138 TCP 74 http > 33306 [SYN, ACK] Seq=0 Ack=1 Win=14480 Len=0 MSS=1460 SACK_PERM=1 TSval=446609197 TSecr=16836559 WS=128
  7   0.005411 172.31.29.138 -> 54.230.150.31 TCP 66 33306 > http [ACK] Seq=1 Ack=1 Win=27008 Len=0 TSval=16836560 TSecr=446609197
  8   0.005455 172.31.29.138 -> 54.230.150.31 HTTP 162 GET /10mb HTTP/1.1 
  9   0.006864 54.230.150.31 -> 172.31.29.138 TCP 66 http > 33306 [ACK] Seq=1 Ack=97 Win=14592 Len=0 TSval=446609198 TSecr=16836560
 10   0.011178 54.230.150.31 -> 172.31.29.138 TCP 524 [TCP segment of a reassembled PDU]
 11   0.011194 172.31.29.138 -> 54.230.150.31 TCP 66 33306 > http [ACK] Seq=97 Ack=459 Win=28032 Len=0 TSval=16836561 TSecr=446609198
 12   0.011228 54.230.150.31 -> 172.31.29.138 TCP 13098 [TCP segment of a reassembled PDU]
 13   0.011237 172.31.29.138 -> 54.230.150.31 TCP 66 33306 > http [ACK] Seq=97 Ack=13491 Win=54144 Len=0 TSval=16836561 TSecr=446609198
 14   0.012837 54.230.150.31 -> 172.31.29.138 TCP 13098 [TCP segment of a reassembled PDU]
 15   0.012847 172.31.29.138 -> 54.230.150.31 TCP 66 33306 > http [ACK] Seq=97 Ack=26523 Win=80128 Len=0 TSval=16836561 TSecr=446609198
 16   0.014234 54.230.150.31 -> 172.31.29.138 TCP 4410 [TCP segment of a reassembled PDU]
 17   0.014240 172.31.29.138 -> 54.230.150.31 TCP 66 33306 > http [ACK] Seq=97 Ack=30867 Win=88832 Len=0 TSval=16836562 TSecr=446609198
 18   0.014294 54.230.150.31 -> 172.31.29.138 TCP 8754 [TCP segment of a reassembled PDU]
 19   0.014301 172.31.29.138 -> 54.230.150.31 TCP 66 33306 > http [ACK] Seq=97 Ack=39555 Win=106240 Len=0 TSval=16836562 TSecr=446609198
 20   0.015781 54.230.150.31 -> 172.31.29.138 TCP 4410 [TCP segment of a reassembled PDU]
 21   0.015787 172.31.29.138 -> 54.230.150.31 TCP 66 33306 > http [ACK] Seq=97 Ack=43899 Win=114944 Len=0 TSval=16836562 TSecr=446609198
 22   0.015881 54.230.150.31 -> 172.31.29.138 TCP 17442 [TCP segment of a reassembled PDU]
 23   0.015891 172.31.29.138 -> 54.230.150.31 TCP 66 33306 > http [ACK] Seq=97 Ack=61275 Win=149632 Len=0 TSval=16836562 TSecr=446609198
 24   0.017309 54.230.150.31 -> 172.31.29.138 TCP 2962 [TCP segment of a reassembled PDU]
 25   0.017314 172.31.29.138 -> 54.230.150.31 TCP 66 33306 > http [ACK] Seq=97 Ack=64171 Win=155392 Len=0 TSval=16836563 TSecr=446609199
 26   0.017423 54.230.150.31 -> 172.31.29.138 TCP 14546 [TCP segment of a reassembled PDU]
 27   0.017432 172.31.29.138 -> 54.230.150.31 TCP 66 33306 > http [ACK] Seq=97 Ack=78651 Win=183424 Len=0 TSval=16836563 TSecr=446609199
 28   0.018580 54.230.150.31 -> 172.31.29.138 TCP 4410 [TCP segment of a reassembled PDU]
 29   0.018586 172.31.29.138 -> 54.230.150.31 TCP 66 33306 > http [ACK] Seq=97 Ack=82995 Win=193152 Len=0 TSval=16836563 TSecr=446609199
 30   0.018654 54.230.150.31 -> 172.31.29.138 TCP 7306 [TCP segment of a reassembled PDU]
 31   0.018661 172.31.29.138 -> 54.230.150.31 TCP 66 33306 > http [ACK] Seq=97 Ack=90235 Win=195328 Len=0 TSval=16836563 TSecr=446609199
 32   0.018964 54.230.150.31 -> 172.31.29.138 TCP 14546 [TCP segment of a reassembled PDU]
 33   0.018973 172.31.29.138 -> 54.230.150.31 TCP 66 33306 > http [ACK] Seq=97 Ack=104715 Win=183424 Len=0 TSval=16836563 TSecr=446609199
 34   0.020187 54.230.150.31 -> 172.31.29.138 TCP 10202 [TCP segment of a reassembled PDU]
 35   0.020195 172.31.29.138 -> 54.230.150.31 TCP 66 33306 > http [ACK] Seq=97 Ack=114851 Win=190592 Len=0 TSval=16836563 TSecr=446609199
 36   0.020219 54.230.150.31 -> 172.31.29.138 TCP 5858 [TCP segment of a reassembled PDU]
 37   0.020226 172.31.29.138 -> 54.230.150.31 TCP 66 33306 > http [ACK] Seq=97 Ack=120643 Win=197760 Len=0 TSval=16836563 TSecr=446609199
 38   0.020481 54.230.150.31 -> 172.31.29.138 TCP 15994 [TCP segment of a reassembled PDU]
 39   0.020491 172.31.29.138 -> 54.230.150.31 TCP 66 33306 > http [ACK] Seq=97 Ack=136571 Win=181888 Len=0 TSval=16836563 TSecr=446609199
 40   0.021673 54.230.150.31 -> 172.31.29.138 TCP 4410 [TCP segment of a reassembled PDU]
 41   0.021679 172.31.29.138 -> 54.230.150.31 TCP 66 33306 > http [ACK] Seq=97 Ack=140915 Win=200064 Len=0 TSval=16836564 TSecr=446609199
 42   0.021845 54.230.150.31 -> 172.31.29.138 TCP 14546 [TCP segment of a reassembled PDU]
 43   0.021872 172.31.29.138 -> 54.230.150.31 TCP 66 33306 > http [ACK] Seq=97 Ack=155395 Win=236544 Len=0 TSval=16836564 TSecr=446609199
 44   0.022115 54.230.150.31 -> 172.31.29.138 TCP 17442 [TCP segment of a reassembled PDU]
 45   0.022141 172.31.29.138 -> 54.230.150.31 TCP 66 33306 > http [ACK] Seq=97 Ack=172771 Win=271232 Len=0 TSval=16836564 TSecr=446609199
 46   0.023256 54.230.150.31 -> 172.31.29.138 TCP 10202 [TCP segment of a reassembled PDU]
 47   0.023263 172.31.29.138 -> 54.230.150.31 TCP 66 33306 > http [ACK] Seq=97 Ack=182907 Win=291584 Len=0 TSval=16836564 TSecr=446609199
 48   0.023635 54.230.150.31 -> 172.31.29.138 TCP 29026 [TCP segment of a reassembled PDU]
 49   0.023650 172.31.29.138 -> 54.230.150.31 TCP 66 33306 > http [ACK] Seq=97 Ack=211867 Win=349440 Len=0 TSval=16836564 TSecr=446609199
 50   0.023655 54.230.150.31 -> 172.31.29.138 TCP 1514 [TCP segment of a reassembled PDU]
 51   0.023658 172.31.29.138 -> 54.230.150.31 TCP 66 33306 > http [ACK] Seq=97 Ack=213315 Win=352384 Len=0 TSval=16836564 TSecr=446609199
 52   0.025033 54.230.150.31 -> 172.31.29.138 TCP 5858 [TCP segment of a reassembled PDU]
 53   0.025039 172.31.29.138 -> 54.230.150.31 TCP 66 33306 > http [ACK] Seq=97 Ack=219107 Win=363904 Len=0 TSval=16836565 TSecr=446609199
 54   0.025215 54.230.150.31 -> 172.31.29.138 TCP 26130 [TCP segment of a reassembled PDU]
 55   0.025229 172.31.29.138 -> 54.230.150.31 TCP 66 33306 > http [ACK] Seq=97 Ack=245171 Win=416128 Len=0 TSval=16836565 TSecr=446609199
 56   0.025309 54.230.150.31 -> 172.31.29.138 TCP 10202 [TCP segment of a reassembled PDU]
 57   0.025318 172.31.29.138 -> 54.230.150.31 TCP 66 33306 > http [ACK] Seq=97 Ack=255307 Win=436352 Len=0 TSval=16836565 TSecr=446609199
 58   0.026621 54.230.150.31 -> 172.31.29.138 TCP 8754 [TCP segment of a reassembled PDU]
 59   0.026630 172.31.29.138 -> 54.230.150.31 TCP 66 33306 > http [ACK] Seq=97 Ack=263995 Win=453760 Len=0 TSval=16836565 TSecr=446609200
 60   0.026749 54.230.150.31 -> 172.31.29.138 TCP 29026 [TCP segment of a reassembled PDU]
 61   0.026776 172.31.29.138 -> 54.230.150.31 TCP 66 33306 > http [ACK] Seq=97 Ack=292955 Win=511616 Len=0 TSval=16836565 TSecr=446609200
 62   0.026847 54.230.150.31 -> 172.31.29.138 TCP 7306 [TCP segment of a reassembled PDU]
 63   0.026854 172.31.29.138 -> 54.230.150.31 TCP 66 33306 > http [ACK] Seq=97 Ack=300195 Win=526080 Len=0 TSval=16836565 TSecr=446609200
 64   0.028139 54.230.150.31 -> 172.31.29.138 TCP 10202 [TCP segment of a reassembled PDU]
 65   0.028156 172.31.29.138 -> 54.230.150.31 TCP 66 33306 > http [ACK] Seq=97 Ack=310331 Win=546432 Len=0 TSval=16836565 TSecr=446609200
 66   0.028274 54.230.150.31 -> 172.31.29.138 TCP 26130 [TCP segment of a reassembled PDU]
 67   0.028288 172.31.29.138 -> 54.230.150.31 TCP 66 33306 > http [ACK] Seq=97 Ack=336395 Win=551936 Len=0 TSval=16836565 TSecr=446609200
 68   0.028298 54.230.150.31 -> 172.31.29.138 TCP 7306 [TCP segment of a reassembled PDU]
 69   0.028303 172.31.29.138 -> 54.230.150.31 TCP 66 33306 > http [ACK] Seq=97 Ack=343635 Win=544768 Len=0 TSval=16836565 TSecr=446609200
 70   0.028311 54.230.150.31 -> 172.31.29.138 TCP 1514 [TCP segment of a reassembled PDU]
 71   0.028314 172.31.29.138 -> 54.230.150.31 TCP 66 33306 > http [ACK] Seq=97 Ack=345083 Win=543360 Len=0 TSval=16836565 TSecr=446609200
 72   0.029654 54.230.150.31 -> 172.31.29.138 TCP 2962 [TCP segment of a reassembled PDU]
 73   0.029660 172.31.29.138 -> 54.230.150.31 TCP 66 33306 > http [ACK] Seq=97 Ack=347979 Win=589952 Len=0 TSval=16836566 TSecr=446609200
 74   0.029828 54.230.150.31 -> 172.31.29.138 TCP 26130 [TCP segment of a reassembled PDU]
 75   0.029855 172.31.29.138 -> 54.230.150.31 TCP 66 33306 > http [ACK] Seq=97 Ack=374043 Win=645504 Len=0 TSval=16836566 TSecr=446609200
 76   0.029869 54.230.150.31 -> 172.31.29.138 TCP 14546 [TCP segment of a reassembled PDU]
 77   0.029879 172.31.29.138 -> 54.230.150.31 TCP 66 33306 > http [ACK] Seq=97 Ack=388523 Win=674432 Len=0 TSval=16836566 TSecr=446609200
 78   0.029920 54.230.150.31 -> 172.31.29.138 TCP 4410 [TCP segment of a reassembled PDU]
 79   0.029925 172.31.29.138 -> 54.230.150.31 TCP 66 33306 > http [ACK] Seq=97 Ack=392867 Win=683136 Len=0 TSval=16836566 TSecr=446609200
 80   0.031173 54.230.150.31 -> 172.31.29.138 TCP 5858 [TCP segment of a reassembled PDU]
 81   0.031180 172.31.29.138 -> 54.230.150.31 TCP 66 33306 > http [ACK] Seq=97 Ack=398659 Win=694784 Len=0 TSval=16836566 TSecr=446609200
 82   0.031305 54.230.150.31 -> 172.31.29.138 TCP 26130 [TCP segment of a reassembled PDU]
 83   0.031318 172.31.29.138 -> 54.230.150.31 TCP 66 33306 > http [ACK] Seq=97 Ack=424723 Win=746880 Len=0 TSval=16836566 TSecr=446609200
 84   0.031359 54.230.150.31 -> 172.31.29.138 TCP 24682 [TCP segment of a reassembled PDU]
 85   0.031371 172.31.29.138 -> 54.230.150.31 TCP 66 33306 > http [ACK] Seq=97 Ack=449339 Win=722304 Len=0 TSval=16836566 TSecr=446609200
 86   0.031376 54.230.150.31 -> 172.31.29.138 TCP 1514 [TCP segment of a reassembled PDU]
 87   0.031378 172.31.29.138 -> 54.230.150.31 TCP 66 33306 > http [ACK] Seq=97 Ack=450787 Win=720896 Len=0 TSval=16836566 TSecr=446609200
 88   0.031496 54.230.150.31 -> 172.31.29.138 TCP 1514 [TCP segment of a reassembled PDU]
 89   0.031508 172.31.29.138 -> 54.230.150.31 TCP 66 33306 > http [ACK] Seq=97 Ack=452235 Win=749824 Len=0 TSval=16836566 TSecr=446609200
 90   0.032732 54.230.150.31 -> 172.31.29.138 TCP 7306 [TCP segment of a reassembled PDU]
 91   0.032738 172.31.29.138 -> 54.230.150.31 TCP 66 33306 > http [ACK] Seq=97 Ack=459475 Win=764288 Len=0 TSval=16836566 TSecr=446609200
 92   0.032841 54.230.150.31 -> 172.31.29.138 TCP 26130 [TCP segment of a reassembled PDU]
 93   0.032867 172.31.29.138 -> 54.230.150.31 TCP 66 33306 > http [ACK] Seq=97 Ack=485539 Win=759168 Len=0 TSval=16836566 TSecr=446609200
 94   0.032877 54.230.150.31 -> 172.31.29.138 TCP 10202 [TCP segment of a reassembled PDU]
 95   0.032883 172.31.29.138 -> 54.230.150.31 TCP 66 33306 > http [ACK] Seq=97 Ack=495675 Win=749056 Len=0 TSval=16836566 TSecr=446609200
 96   0.032920 54.230.150.31 -> 172.31.29.138 TCP 15994 [TCP segment of a reassembled PDU]
 97   0.032929 172.31.29.138 -> 54.230.150.31 TCP 66 33306 > http [ACK] Seq=97 Ack=511603 Win=733184 Len=0 TSval=16836567 TSecr=446609200
 98   0.032978 54.230.150.31 -> 172.31.29.138 TCP 7306 [TCP segment of a reassembled PDU]
 99   0.032984 172.31.29.138 -> 54.230.150.31 TCP 66 33306 > http [ACK] Seq=97 Ack=518843 Win=726016 Len=0 TSval=16836567 TSecr=446609200
100   0.034261 54.230.150.31 -> 172.31.29.138 TCP 8754 [TCP segment of a reassembled PDU]
101   0.034269 172.31.29.138 -> 54.230.150.31 TCP 66 33306 > http [ACK] Seq=97 Ack=527531 Win=781696 Len=0 TSval=16836567 TSecr=446609200
102   0.034372 54.230.150.31 -> 172.31.29.138 TCP 26130 [TCP segment of a reassembled PDU]
103   0.034388 54.230.150.31 -> 172.31.29.138 TCP 4410 [TCP segment of a reassembled PDU]
104   0.034393 54.230.150.31 -> 172.31.29.138 TCP 2962 [TCP segment of a reassembled PDU]
105   0.034406 172.31.29.138 -> 54.230.150.31 TCP 66 33306 > http [ACK] Seq=97 Ack=560835 Win=748416 Len=0 TSval=16836567 TSecr=446609200
106   0.034531 54.230.150.31 -> 172.31.29.138 TCP 23234 [TCP segment of a reassembled PDU]
107   0.034543 172.31.29.138 -> 54.230.150.31 TCP 66 33306 > http [ACK] Seq=97 Ack=584003 Win=763904 Len=0 TSval=16836567 TSecr=446609200
108   0.034550 54.230.150.31 -> 172.31.29.138 TCP 2962 [TCP segment of a reassembled PDU]
109   0.034565 172.31.29.138 -> 54.230.150.31 TCP 66 33306 > http [ACK] Seq=97 Ack=586899 Win=761088 Len=0 TSval=16836567 TSecr=446609200
110   0.034577 54.230.150.31 -> 172.31.29.138 TCP 2962 [TCP segment of a reassembled PDU]
111   0.034589 172.31.29.138 -> 54.230.150.31 TCP 66 33306 > http [ACK] Seq=97 Ack=589795 Win=781696 Len=0 TSval=16836567 TSecr=446609200
112   0.035861 54.230.150.31 -> 172.31.29.138 TCP 10202 [TCP segment of a reassembled PDU]
113   0.035890 172.31.29.138 -> 54.230.150.31 TCP 66 33306 > http [ACK] Seq=97 Ack=599931 Win=785280 Len=0 TSval=16836567 TSecr=446609200
114   0.036031 54.230.150.31 -> 172.31.29.138 TCP 20338 [TCP segment of a reassembled PDU]
115   0.036053 172.31.29.138 -> 54.230.150.31 TCP 66 33306 > http [ACK] Seq=97 Ack=620203 Win=768640 Len=0 TSval=16836567 TSecr=446609200
116   0.036181 54.230.150.31 -> 172.31.29.138 TCP 26130 [TCP segment of a reassembled PDU]
117   0.036204 54.230.150.31 -> 172.31.29.138 TCP 15994 [TCP segment of a reassembled PDU]
118   0.036211 54.230.150.31 -> 172.31.29.138 TCP 2962 [TCP segment of a reassembled PDU]
119   0.036225 172.31.29.138 -> 54.230.150.31 TCP 66 33306 > http [ACK] Seq=97 Ack=665091 Win=727936 Len=0 TSval=16836567 TSecr=446609200
120   0.036391 54.230.150.31 -> 172.31.29.138 TCP 2962 [TCP segment of a reassembled PDU]
121   0.036396 172.31.29.138 -> 54.230.150.31 TCP 66 33306 > http [ACK] Seq=97 Ack=667987 Win=797184 Len=0 TSval=16836567 TSecr=446609200
122   0.037334 54.230.150.31 -> 172.31.29.138 TCP 8754 [TCP segment of a reassembled PDU]
123   0.037353 172.31.29.138 -> 54.230.150.31 TCP 66 33306 > http [ACK] Seq=97 Ack=676675 Win=801920 Len=0 TSval=16836568 TSecr=446609201
124   0.037431 54.230.150.31 -> 172.31.29.138 TCP 14546 [TCP segment of a reassembled PDU]
125   0.037439 172.31.29.138 -> 54.230.150.31 TCP 66 33306 > http [ACK] Seq=97 Ack=691155 Win=830848 Len=0 TSval=16836568 TSecr=446609201
126   0.037680 54.230.150.31 -> 172.31.29.138 TCP 17442 [TCP segment of a reassembled PDU]
127   0.037703 172.31.29.138 -> 54.230.150.31 TCP 66 33306 > http [ACK] Seq=97 Ack=708531 Win=865664 Len=0 TSval=16836568 TSecr=446609201
128   0.037728 54.230.150.31 -> 172.31.29.138 TCP 8754 [TCP segment of a reassembled PDU]
129   0.037733 172.31.29.138 -> 54.230.150.31 TCP 66 33306 > http [ACK] Seq=97 Ack=717219 Win=882944 Len=0 TSval=16836568 TSecr=446609201
130   0.037818 54.230.150.31 -> 172.31.29.138 TCP 34818 [TCP segment of a reassembled PDU]
131   0.037834 172.31.29.138 -> 54.230.150.31 TCP 66 33306 > http [ACK] Seq=97 Ack=751971 Win=952448 Len=0 TSval=16836568 TSecr=446609201
132   0.037862 54.230.150.31 -> 172.31.29.138 TCP 4410 [TCP segment of a reassembled PDU]
133   0.037866 172.31.29.138 -> 54.230.150.31 TCP 66 33306 > http [ACK] Seq=97 Ack=756315 Win=961152 Len=0 TSval=16836568 TSecr=446609201
134   0.039145 54.230.150.31 -> 172.31.29.138 TCP 8754 [TCP segment of a reassembled PDU]
135   0.039163 172.31.29.138 -> 54.230.150.31 TCP 66 33306 > http [ACK] Seq=97 Ack=765003 Win=978560 Len=0 TSval=16836568 TSecr=446609201
136   0.039281 54.230.150.31 -> 172.31.29.138 TCP 26130 [TCP segment of a reassembled PDU]
137   0.039294 172.31.29.138 -> 54.230.150.31 TCP 66 33306 > http [ACK] Seq=97 Ack=791067 Win=1030656 Len=0 TSval=16836568 TSecr=446609201
138   0.039329 54.230.150.31 -> 172.31.29.138 TCP 23234 [TCP segment of a reassembled PDU]
139   0.039344 172.31.29.138 -> 54.230.150.31 TCP 66 33306 > http [ACK] Seq=97 Ack=814235 Win=1009280 Len=0 TSval=16836568 TSecr=446609201
140   0.039362 54.230.150.31 -> 172.31.29.138 TCP 8754 [TCP segment of a reassembled PDU]
141   0.039374 172.31.29.138 -> 54.230.150.31 TCP 66 33306 > http [ACK] Seq=97 Ack=822923 Win=1030656 Len=0 TSval=16836568 TSecr=446609201
142   0.039522 54.230.150.31 -> 172.31.29.138 TCP 26130 [TCP segment of a reassembled PDU]
143   0.039536 172.31.29.138 -> 54.230.150.31 TCP 66 33306 > http [ACK] Seq=97 Ack=848987 Win=1047424 Len=0 TSval=16836568 TSecr=446609201
144   0.039546 54.230.150.31 -> 172.31.29.138 TCP 8754 [TCP segment of a reassembled PDU]
145   0.039572 172.31.29.138 -> 54.230.150.31 TCP 66 33306 > http [ACK] Seq=97 Ack=857675 Win=1038848 Len=0 TSval=16836568 TSecr=446609201
146   0.040613 54.230.150.31 -> 172.31.29.138 TCP 4410 [TCP segment of a reassembled PDU]
147   0.040620 172.31.29.138 -> 54.230.150.31 TCP 66 33306 > http [ACK] Seq=97 Ack=862019 Win=1083136 Len=0 TSval=16836568 TSecr=446609201
148   0.040843 54.230.150.31 -> 172.31.29.138 TCP 26130 [TCP segment of a reassembled PDU]
149   0.040868 172.31.29.138 -> 54.230.150.31 TCP 66 33306 > http [ACK] Seq=97 Ack=888083 Win=1057152 Len=0 TSval=16836568 TSecr=446609201
150   0.040894 54.230.150.31 -> 172.31.29.138 TCP 26130 [TCP segment of a reassembled PDU]
151   0.040913 54.230.150.31 -> 172.31.29.138 TCP 10202 [TCP segment of a reassembled PDU]
152   0.040930 172.31.29.138 -> 54.230.150.31 TCP 66 33306 > http [ACK] Seq=97 Ack=924283 Win=1030784 Len=0 TSval=16836568 TSecr=446609201
153   0.040989 54.230.150.31 -> 172.31.29.138 TCP 27578 [TCP segment of a reassembled PDU]
154   0.041002 172.31.29.138 -> 54.230.150.31 TCP 66 33306 > http [ACK] Seq=97 Ack=951795 Win=1044992 Len=0 TSval=16836569 TSecr=446609201
155   0.042247 54.230.150.31 -> 172.31.29.138 TCP 2962 [TCP segment of a reassembled PDU]
156   0.042252 172.31.29.138 -> 54.230.150.31 TCP 66 33306 > http [ACK] Seq=97 Ack=954691 Win=1085440 Len=0 TSval=16836569 TSecr=446609201
157   0.042424 54.230.150.31 -> 172.31.29.138 TCP 21786 [TCP segment of a reassembled PDU]
158   0.042449 172.31.29.138 -> 54.230.150.31 TCP 66 33306 > http [ACK] Seq=97 Ack=976411 Win=1063808 Len=0 TSval=16836569 TSecr=446609201
159   0.042458 54.230.150.31 -> 172.31.29.138 TCP 4410 [TCP segment of a reassembled PDU]
160   0.042471 172.31.29.138 -> 54.230.150.31 TCP 66 33306 > http [ACK] Seq=97 Ack=980755 Win=1089664 Len=0 TSval=16836569 TSecr=446609201
161   0.042520 54.230.150.31 -> 172.31.29.138 TCP 26130 [TCP segment of a reassembled PDU]
162   0.042549 172.31.29.138 -> 54.230.150.31 TCP 66 33306 > http [ACK] Seq=97 Ack=1006819 Win=1063680 Len=0 TSval=16836569 TSecr=446609201
163   0.042632 54.230.150.31 -> 172.31.29.138 TCP 10202 [TCP segment of a reassembled PDU]
164   0.042649 172.31.29.138 -> 54.230.150.31 TCP 66 33306 > http [ACK] Seq=97 Ack=1016955 Win=1073664 Len=0 TSval=16836569 TSecr=446609201
165   0.042683 54.230.150.31 -> 172.31.29.138 TCP 20338 [TCP segment of a reassembled PDU]
166   0.042709 172.31.29.138 -> 54.230.150.31 TCP 66 33306 > http [ACK] Seq=97 Ack=1037227 Win=1056896 Len=0 TSval=16836569 TSecr=446609201
167   0.042778 54.230.150.31 -> 172.31.29.138 TCP 26130 [TCP segment of a reassembled PDU]
168   0.042794 54.230.150.31 -> 172.31.29.138 TCP 4410 [TCP segment of a reassembled PDU]
169   0.042809 172.31.29.138 -> 54.230.150.31 TCP 66 33306 > http [ACK] Seq=97 Ack=1067635 Win=1040256 Len=0 TSval=16836569 TSecr=446609201
170   0.044034 54.230.150.31 -> 172.31.29.138 TCP 8754 [TCP segment of a reassembled PDU]
171   0.044041 172.31.29.138 -> 54.230.150.31 TCP 66 33306 > http [ACK] Seq=97 Ack=1076323 Win=1075968 Len=0 TSval=16836569 TSecr=446609201
172   0.044212 54.230.150.31 -> 172.31.29.138 TCP 23234 [TCP segment of a reassembled PDU]
173   0.044236 54.230.150.31 -> 172.31.29.138 TCP 2962 [TCP segment of a reassembled PDU]
174   0.044243 172.31.29.138 -> 54.230.150.31 TCP 66 33306 > http [ACK] Seq=97 Ack=1102387 Win=1049984 Len=0 TSval=16836569 TSecr=446609201
175   0.044316 54.230.150.31 -> 172.31.29.138 TCP 26130 [TCP segment of a reassembled PDU]
176   0.044350 54.230.150.31 -> 172.31.29.138 TCP 10202 [TCP segment of a reassembled PDU]
177   0.044373 54.230.150.31 -> 172.31.29.138 TCP 14546 [TCP segment of a reassembled PDU]
178   0.044486 172.31.29.138 -> 54.230.150.31 TCP 66 33306 > http [ACK] Seq=97 Ack=1153067 Win=1006848 Len=0 TSval=16836569 TSecr=446609201
179   0.044544 54.230.150.31 -> 172.31.29.138 TCP 26130 [TCP segment of a reassembled PDU]
180   0.044558 172.31.29.138 -> 54.230.150.31 TCP 66 33306 > http [ACK] Seq=97 Ack=1179131 Win=1047424 Len=0 TSval=16836569 TSecr=446609201
181   0.044586 54.230.150.31 -> 172.31.29.138 TCP 14546 [TCP segment of a reassembled PDU]
182   0.044596 172.31.29.138 -> 54.230.150.31 TCP 66 33306 > http [ACK] Seq=97 Ack=1193611 Win=1032960 Len=0 TSval=16836569 TSecr=446609201
183   0.045820 54.230.150.31 -> 172.31.29.138 TCP 4410 [TCP segment of a reassembled PDU]
184   0.045825 172.31.29.138 -> 54.230.150.31 TCP 66 33306 > http [ACK] Seq=97 Ack=1197955 Win=1083136 Len=0 TSval=16836570 TSecr=446609201
185   0.045981 54.230.150.31 -> 172.31.29.138 TCP 17442 [TCP segment of a reassembled PDU]
186   0.046003 172.31.29.138 -> 54.230.150.31 TCP 66 33306 > http [ACK] Seq=97 Ack=1215331 Win=1065856 Len=0 TSval=16836570 TSecr=446609201
187   0.046019 54.230.150.31 -> 172.31.29.138 TCP 8754 [TCP segment of a reassembled PDU]
188   0.046034 172.31.29.138 -> 54.230.150.31 TCP 66 33306 > http [ACK] Seq=97 Ack=1224019 Win=1089664 Len=0 TSval=16836570 TSecr=446609201
189   0.046108 54.230.150.31 -> 172.31.29.138 TCP 26130 [TCP segment of a reassembled PDU]
190   0.046168 54.230.150.31 -> 172.31.29.138 TCP 27578 [TCP segment of a reassembled PDU]
191   0.046273 54.230.150.31 -> 172.31.29.138 TCP 26130 [TCP segment of a reassembled PDU]
192   0.046291 54.230.150.31 -> 172.31.29.138 TCP 10202 [TCP segment of a reassembled PDU]
193   0.046333 54.230.150.31 -> 172.31.29.138 TCP 13098 [TCP segment of a reassembled PDU]
194   0.046367 172.31.29.138 -> 54.230.150.31 TCP 66 33306 > http [ACK] Seq=97 Ack=1326827 Win=986880 Len=0 TSval=16836570 TSecr=446609201
195   0.047300 54.230.150.31 -> 172.31.29.138 TCP 2962 [TCP segment of a reassembled PDU]
196   0.047305 172.31.29.138 -> 54.230.150.31 TCP 66 33306 > http [ACK] Seq=97 Ack=1329723 Win=1085440 Len=0 TSval=16836570 TSecr=446609202
197   0.047448 54.230.150.31 -> 172.31.29.138 TCP 13098 [TCP segment of a reassembled PDU]
198   0.047498 172.31.29.138 -> 54.230.150.31 TCP 66 33306 > http [ACK] Seq=97 Ack=1342755 Win=1089664 Len=0 TSval=16836570 TSecr=446609202
199   0.047808 54.230.150.31 -> 172.31.29.138 TCP 2962 [TCP segment of a reassembled PDU]
200   0.047822 172.31.29.138 -> 54.230.150.31 TCP 66 33306 > http [ACK] Seq=97 Ack=1345651 Win=1089664 Len=0 TSval=16836570 TSecr=446609202
201   0.047996 54.230.150.31 -> 172.31.29.138 TCP 26130 [TCP segment of a reassembled PDU]
202   0.048034 54.230.150.31 -> 172.31.29.138 TCP 17442 [TCP segment of a reassembled PDU]
203   0.048044 172.31.29.138 -> 54.230.150.31 TCP 66 33306 > http [ACK] Seq=97 Ack=1371715 Win=1063680 Len=0 TSval=16836570 TSecr=446609202
204   0.048061 172.31.29.138 -> 54.230.150.31 TCP 66 33306 > http [ACK] Seq=97 Ack=1389091 Win=1061632 Len=0 TSval=16836570 TSecr=446609202
205   0.048073 54.230.150.31 -> 172.31.29.138 TCP 8754 [TCP segment of a reassembled PDU]
206   0.048084 172.31.29.138 -> 54.230.150.31 TCP 66 33306 > http [ACK] Seq=97 Ack=1397779 Win=1075968 Len=0 TSval=16836570 TSecr=446609202
207   0.048157 54.230.150.31 -> 172.31.29.138 TCP 33370 [TCP segment of a reassembled PDU]
208   0.048188 172.31.29.138 -> 54.230.150.31 TCP 66 33306 > http [ACK] Seq=97 Ack=1431083 Win=1042688 Len=0 TSval=16836570 TSecr=446609202
209   0.048254 54.230.150.31 -> 172.31.29.138 TCP 20338 [TCP segment of a reassembled PDU]
210   0.048265 172.31.29.138 -> 54.230.150.31 TCP 66 33306 > http [ACK] Seq=97 Ack=1451355 Win=1056896 Len=0 TSval=16836570 TSecr=446609202
211   0.048272 54.230.150.31 -> 172.31.29.138 TCP 2962 [TCP segment of a reassembled PDU]
212   0.048289 172.31.29.138 -> 54.230.150.31 TCP 66 33306 > http [ACK] Seq=97 Ack=1454251 Win=1054080 Len=0 TSval=16836570 TSecr=446609202
213   0.048361 54.230.150.31 -> 172.31.29.138 TCP 11650 [TCP segment of a reassembled PDU]
214   0.048368 172.31.29.138 -> 54.230.150.31 TCP 66 33306 > http [ACK] Seq=97 Ack=1465835 Win=1071232 Len=0 TSval=16836570 TSecr=446609202
215   0.048803 54.230.150.31 -> 172.31.29.138 TCP 1514 [TCP segment of a reassembled PDU]
216   0.048938 54.230.150.31 -> 172.31.29.138 TCP 5858 [TCP segment of a reassembled PDU]
217   0.048944 172.31.29.138 -> 54.230.150.31 TCP 66 33306 > http [ACK] Seq=97 Ack=1473075 Win=1080704 Len=0 TSval=16836571 TSecr=446609202
218   0.049577 54.230.150.31 -> 172.31.29.138 TCP 2962 [TCP segment of a reassembled PDU]
219   0.049582 172.31.29.138 -> 54.230.150.31 TCP 66 33306 > http [ACK] Seq=97 Ack=1475971 Win=1085440 Len=0 TSval=16836571 TSecr=446609202
220   0.049758 54.230.150.31 -> 172.31.29.138 TCP 26130 [TCP segment of a reassembled PDU]
221   0.049778 54.230.150.31 -> 172.31.29.138 TCP 11650 [TCP segment of a reassembled PDU]
222   0.049814 54.230.150.31 -> 172.31.29.138 TCP 14546 [TCP segment of a reassembled PDU]
223   0.049824 54.230.150.31 -> 172.31.29.138 TCP 5858 [TCP segment of a reassembled PDU]
224   0.049832 54.230.150.31 -> 172.31.29.138 TCP 10202 [TCP segment of a reassembled PDU]
225   0.049839 172.31.29.138 -> 54.230.150.31 TCP 66 33306 > http [ACK] Seq=97 Ack=1513619 Win=1047808 Len=0 TSval=16836571 TSecr=446609202
226   0.049854 172.31.29.138 -> 54.230.150.31 TCP 66 33306 > http [ACK] Seq=97 Ack=1544027 Win=1021056 Len=0 TSval=16836571 TSecr=446609202
227   0.049895 54.230.150.31 -> 172.31.29.138 TCP 15994 [TCP segment of a reassembled PDU]
228   0.049904 172.31.29.138 -> 54.230.150.31 TCP 66 33306 > http [ACK] Seq=97 Ack=1559955 Win=1047296 Len=0 TSval=16836571 TSecr=446609202
229   0.050033 54.230.150.31 -> 172.31.29.138 TCP 24682 [TCP segment of a reassembled PDU]
230   0.050046 172.31.29.138 -> 54.230.150.31 TCP 66 33306 > http [ACK] Seq=97 Ack=1584571 Win=1049856 Len=0 TSval=16836571 TSecr=446609202
231   0.050157 54.230.150.31 -> 172.31.29.138 TCP 18890 [TCP segment of a reassembled PDU]
232   0.050167 172.31.29.138 -> 54.230.150.31 TCP 66 33306 > http [ACK] Seq=97 Ack=1603395 Win=1059328 Len=0 TSval=16836571 TSecr=446609202
233   0.051143 54.230.150.31 -> 172.31.29.138 TCP 4410 [TCP segment of a reassembled PDU]
234   0.051149 172.31.29.138 -> 54.230.150.31 TCP 66 33306 > http [ACK] Seq=97 Ack=1607739 Win=1083136 Len=0 TSval=16836571 TSecr=446609202
235   0.051344 54.230.150.31 -> 172.31.29.138 TCP 26130 [TCP segment of a reassembled PDU]
236   0.051370 172.31.29.138 -> 54.230.150.31 TCP 66 33306 > http [ACK] Seq=97 Ack=1633803 Win=1057152 Len=0 TSval=16836571 TSecr=446609202
237   0.051399 54.230.150.31 -> 172.31.29.138 TCP 26130 [TCP segment of a reassembled PDU]
238   0.051421 172.31.29.138 -> 54.230.150.31 TCP 66 33306 > http [ACK] Seq=97 Ack=1659867 Win=1047424 Len=0 TSval=16836571 TSecr=446609202
239   0.051471 54.230.150.31 -> 172.31.29.138 TCP 23234 [TCP segment of a reassembled PDU]
240   0.051484 172.31.29.138 -> 54.230.150.31 TCP 66 33306 > http [ACK] Seq=97 Ack=1683035 Win=1052160 Len=0 TSval=16836571 TSecr=446609202
241   0.051494 54.230.150.31 -> 172.31.29.138 TCP 7306 [TCP segment of a reassembled PDU]
242   0.051514 172.31.29.138 -> 54.230.150.31 TCP 66 33306 > http [ACK] Seq=97 Ack=1690275 Win=1044992 Len=0 TSval=16836571 TSecr=446609202
243   0.051662 54.230.150.31 -> 172.31.29.138 TCP 26130 [TCP segment of a reassembled PDU]
244   0.051674 172.31.29.138 -> 54.230.150.31 TCP 66 33306 > http [ACK] Seq=97 Ack=1716339 Win=1047424 Len=0 TSval=16836571 TSecr=446609202
245   0.051684 54.230.150.31 -> 172.31.29.138 TCP 5858 [TCP segment of a reassembled PDU]
246   0.051726 54.230.150.31 -> 172.31.29.138 TCP 20338 [TCP segment of a reassembled PDU]
247   0.051752 54.230.150.31 -> 172.31.29.138 TCP 4410 [TCP segment of a reassembled PDU]
248   0.051789 172.31.29.138 -> 54.230.150.31 TCP 66 33306 > http [ACK] Seq=97 Ack=1746747 Win=1017088 Len=0 TSval=16836571 TSecr=446609202
249   0.052947 54.230.150.31 -> 172.31.29.138 TCP 2962 [TCP segment of a reassembled PDU]
250   0.052953 172.31.29.138 -> 54.230.150.31 TCP 66 33306 > http [ACK] Seq=97 Ack=1749643 Win=1085440 Len=0 TSval=16836572 TSecr=446609202
251   0.053135 54.230.150.31 -> 172.31.29.138 TCP 26130 [TCP segment of a reassembled PDU]
252   0.053150 54.230.150.31 -> 172.31.29.138 TCP 2962 [TCP segment of a reassembled PDU]
253   0.053164 172.31.29.138 -> 54.230.150.31 TCP 66 33306 > http [ACK] Seq=97 Ack=1778603 Win=1056512 Len=0 TSval=16836572 TSecr=446609202
254   0.053189 54.230.150.31 -> 172.31.29.138 TCP 21786 [TCP segment of a reassembled PDU]
255   0.053207 172.31.29.138 -> 54.230.150.31 TCP 66 33306 > http [ACK] Seq=97 Ack=1800323 Win=1054592 Len=0 TSval=16836572 TSecr=446609202
256   0.053257 54.230.150.31 -> 172.31.29.138 TCP 20338 [TCP segment of a reassembled PDU]
257   0.053268 172.31.29.138 -> 54.230.150.31 TCP 66 33306 > http [ACK] Seq=97 Ack=1820595 Win=1056896 Len=0 TSval=16836572 TSecr=446609202
258   0.053371 54.230.150.31 -> 172.31.29.138 TCP 17442 [TCP segment of a reassembled PDU]
259   0.053380 172.31.29.138 -> 54.230.150.31 TCP 66 33306 > http [ACK] Seq=97 Ack=1837971 Win=1061632 Len=0 TSval=16836572 TSecr=446609202
260   0.053405 54.230.150.31 -> 172.31.29.138 TCP 8754 [TCP segment of a reassembled PDU]
261   0.053462 54.230.150.31 -> 172.31.29.138 TCP 18890 [TCP segment of a reassembled PDU]
262   0.053478 54.230.150.31 -> 172.31.29.138 TCP 11650 [TCP segment of a reassembled PDU]
263   0.053530 172.31.29.138 -> 54.230.150.31 TCP 66 33306 > http [ACK] Seq=97 Ack=1877067 Win=1022592 Len=0 TSval=16836572 TSecr=446609202
264   0.054493 54.230.150.31 -> 172.31.29.138 TCP 5858 [TCP segment of a reassembled PDU]
265   0.054499 172.31.29.138 -> 54.230.150.31 TCP 66 33306 > http [ACK] Seq=97 Ack=1882859 Win=1080704 Len=0 TSval=16836572 TSecr=446609202
266   0.054658 54.230.150.31 -> 172.31.29.138 TCP 17442 [TCP segment of a reassembled PDU]
267   0.054678 172.31.29.138 -> 54.230.150.31 TCP 66 33306 > http [ACK] Seq=97 Ack=1900235 Win=1063424 Len=0 TSval=16836572 TSecr=446609202
268   0.054692 54.230.150.31 -> 172.31.29.138 TCP 8754 [TCP segment of a reassembled PDU]
269   0.054705 172.31.29.138 -> 54.230.150.31 TCP 66 33306 > http [ACK] Seq=97 Ack=1908923 Win=1089664 Len=0 TSval=16836572 TSecr=446609202
270   0.054800 54.230.150.31 -> 172.31.29.138 TCP 33370 [TCP segment of a reassembled PDU]
271   0.054820 172.31.29.138 -> 54.230.150.31 TCP 66 33306 > http [ACK] Seq=97 Ack=1942227 Win=1056384 Len=0 TSval=16836572 TSecr=446609202
272   0.055001 54.230.150.31 -> 172.31.29.138 TCP 20338 [TCP segment of a reassembled PDU]
273   0.055008 172.31.29.138 -> 54.230.150.31 TCP 66 33306 > http [ACK] Seq=97 Ack=1962499 Win=1056896 Len=0 TSval=16836572 TSecr=446609202
274   0.055056 54.230.150.31 -> 172.31.29.138 TCP 17442 [TCP segment of a reassembled PDU]
275   0.055061 172.31.29.138 -> 54.230.150.31 TCP 66 33306 > http [ACK] Seq=97 Ack=1979875 Win=1061632 Len=0 TSval=16836572 TSecr=446609202
276   0.055131 54.230.150.31 -> 172.31.29.138 TCP 27578 [TCP segment of a reassembled PDU]
277   0.055162 172.31.29.138 -> 54.230.150.31 TCP 66 33306 > http [ACK] Seq=97 Ack=2007387 Win=1044992 Len=0 TSval=16836572 TSecr=446609202
278   0.055991 54.230.150.31 -> 172.31.29.138 TCP 2962 [TCP segment of a reassembled PDU]
279   0.055996 172.31.29.138 -> 54.230.150.31 TCP 66 33306 > http [ACK] Seq=97 Ack=2010283 Win=1085440 Len=0 TSval=16836572 TSecr=446609202
280   0.056176 54.230.150.31 -> 172.31.29.138 TCP 26130 [TCP segment of a reassembled PDU]
281   0.056195 172.31.29.138 -> 54.230.150.31 TCP 66 33306 > http [ACK] Seq=97 Ack=2036347 Win=1059456 Len=0 TSval=16836572 TSecr=446609202
282   0.056226 54.230.150.31 -> 172.31.29.138 TCP 26130 [TCP segment of a reassembled PDU]
283   0.056237 54.230.150.31 -> 172.31.29.138 TCP 10202 [TCP segment of a reassembled PDU]
284   0.056247 172.31.29.138 -> 54.230.150.31 TCP 66 33306 > http [ACK] Seq=97 Ack=2072547 Win=1030784 Len=0 TSval=16836572 TSecr=446609202
285   0.056520 54.230.150.31 -> 172.31.29.138 TCP 8754 [TCP segment of a reassembled PDU]
286   0.056526 172.31.29.138 -> 54.230.150.31 TCP 66 33306 > http [ACK] Seq=97 Ack=2081235 Win=1075968 Len=0 TSval=16836572 TSecr=446609203
287   0.056692 54.230.150.31 -> 172.31.29.138 TCP 26130 [TCP segment of a reassembled PDU]
288   0.056724 54.230.150.31 -> 172.31.29.138 TCP 17442 [TCP segment of a reassembled PDU]
289   0.056731 172.31.29.138 -> 54.230.150.31 TCP 66 33306 > http [ACK] Seq=97 Ack=2107299 Win=1049984 Len=0 TSval=16836572 TSecr=446609203
290   0.056744 172.31.29.138 -> 54.230.150.31 TCP 66 33306 > http [ACK] Seq=97 Ack=2124675 Win=1061632 Len=0 TSval=16836572 TSecr=446609203
291   0.056757 54.230.150.31 -> 172.31.29.138 TCP 8754 [TCP segment of a reassembled PDU]
292   0.056765 172.31.29.138 -> 54.230.150.31 TCP 66 33306 > http [ACK] Seq=97 Ack=2133363 Win=1075968 Len=0 TSval=16836572 TSecr=446609203
293   0.056815 54.230.150.31 -> 172.31.29.138 TCP 4410 [TCP segment of a reassembled PDU]
294   0.056819 172.31.29.138 -> 54.230.150.31 TCP 66 33306 > http [ACK] Seq=97 Ack=2137707 Win=1083136 Len=0 TSval=16836572 TSecr=446609203
295   0.057256 54.230.150.31 -> 172.31.29.138 TCP 4410 [TCP segment of a reassembled PDU]
296   0.057260 172.31.29.138 -> 54.230.150.31 TCP 66 33306 > http [ACK] Seq=97 Ack=2142051 Win=1083136 Len=0 TSval=16836573 TSecr=446609203
297   0.057447 54.230.150.31 -> 172.31.29.138 TCP 26130 [TCP segment of a reassembled PDU]
298   0.057454 172.31.29.138 -> 54.230.150.31 TCP 66 33306 > http [ACK] Seq=97 Ack=2168115 Win=1141760 Len=0 TSval=16836573 TSecr=446609203
299   0.057469 54.230.150.31 -> 172.31.29.138 TCP 10202 [TCP segment of a reassembled PDU]
300   0.057475 172.31.29.138 -> 54.230.150.31 TCP 66 33306 > http [ACK] Seq=97 Ack=2178251 Win=1162112 Len=0 TSval=16836573 TSecr=446609203
301   0.057484 54.230.150.31 -> 172.31.29.138 TCP 8754 [TCP segment of a reassembled PDU]
302   0.057486 172.31.29.138 -> 54.230.150.31 TCP 66 33306 > http [ACK] Seq=97 Ack=2186939 Win=1179520 Len=0 TSval=16836573 TSecr=446609203
303   0.057538 54.230.150.31 -> 172.31.29.138 TCP 18890 [TCP segment of a reassembled PDU]
304   0.057543 172.31.29.138 -> 54.230.150.31 TCP 66 33306 > http [ACK] Seq=97 Ack=2205763 Win=1217152 Len=0 TSval=16836573 TSecr=446609203
305   0.057677 54.230.150.31 -> 172.31.29.138 TCP 22285 [TCP segment of a reassembled PDU]
306   0.057682 172.31.29.138 -> 54.230.150.31 TCP 66 33306 > http [ACK] Seq=97 Ack=2227982 Win=1261568 Len=0 TSval=16836573 TSecr=446609203
307   0.057700 54.230.150.31 -> 172.31.29.138 TCP 11650 [TCP segment of a reassembled PDU]
308   0.057705 172.31.29.138 -> 54.230.150.31 TCP 66 33306 > http [ACK] Seq=97 Ack=2239566 Win=1284736 Len=0 TSval=16836573 TSecr=446609203
309   0.057818 54.230.150.31 -> 172.31.29.138 TCP 26130 [TCP segment of a reassembled PDU]
310   0.057830 172.31.29.138 -> 54.230.150.31 TCP 66 33306 > http [ACK] Seq=97 Ack=2265630 Win=1336832 Len=0 TSval=16836573 TSecr=446609203
311   0.057890 54.230.150.31 -> 172.31.29.138 TCP 2962 [TCP segment of a reassembled PDU]
312   0.057896 172.31.29.138 -> 54.230.150.31 TCP 66 33306 > http [ACK] Seq=97 Ack=2268526 Win=1342592 Len=0 TSval=16836573 TSecr=446609203
313   0.058193 54.230.150.31 -> 172.31.29.138 TCP 21786 [TCP segment of a reassembled PDU]
314   0.058200 172.31.29.138 -> 54.230.150.31 TCP 66 33306 > http [ACK] Seq=97 Ack=2290246 Win=1360896 Len=0 TSval=16836573 TSecr=446609203
315   0.058224 54.230.150.31 -> 172.31.29.138 TCP 3338 [TCP segment of a reassembled PDU]
316   0.058234 172.31.29.138 -> 54.230.150.31 TCP 66 33306 > http [ACK] Seq=97 Ack=2293518 Win=1386112 Len=0 TSval=16836573 TSecr=446609203
317   0.058584 54.230.150.31 -> 172.31.29.138 TCP 2962 [TCP segment of a reassembled PDU]
318   0.058589 172.31.29.138 -> 54.230.150.31 TCP 66 33306 > http [ACK] Seq=97 Ack=2296414 Win=1391872 Len=0 TSval=16836573 TSecr=446609203
319   0.058754 54.230.150.31 -> 172.31.29.138 TCP 26130 [TCP segment of a reassembled PDU]
320   0.058772 54.230.150.31 -> 172.31.29.138 TCP 17442 [TCP segment of a reassembled PDU]
321   0.058788 172.31.29.138 -> 54.230.150.31 TCP 66 33306 > http [ACK] Seq=97 Ack=2339854 Win=1348480 Len=0 TSval=16836573 TSecr=446609203
322   0.058978 54.230.150.31 -> 172.31.29.138 TCP 19266 [TCP segment of a reassembled PDU]
323   0.058984 172.31.29.138 -> 54.230.150.31 TCP 66 33306 > http [ACK] Seq=97 Ack=2359054 Win=1363328 Len=0 TSval=16836573 TSecr=446609203
324   0.059069 54.230.150.31 -> 172.31.29.138 TCP 1514 [TCP segment of a reassembled PDU]
325   0.059073 172.31.29.138 -> 54.230.150.31 TCP 66 33306 > http [ACK] Seq=97 Ack=2360502 Win=1392000 Len=0 TSval=16836573 TSecr=446609203
326   0.059107 54.230.150.31 -> 172.31.29.138 TCP 7306 [TCP segment of a reassembled PDU]
327   0.059122 172.31.29.138 -> 54.230.150.31 TCP 66 33306 > http [ACK] Seq=97 Ack=2367742 Win=1392000 Len=0 TSval=16836573 TSecr=446609203
328   0.059253 54.230.150.31 -> 172.31.29.138 TCP 23234 [TCP segment of a reassembled PDU]
329   0.059273 172.31.29.138 -> 54.230.150.31 TCP 66 33306 > http [ACK] Seq=97 Ack=2390910 Win=1368832 Len=0 TSval=16836573 TSecr=446609203
330   0.059390 54.230.150.31 -> 172.31.29.138 TCP 26130 [TCP segment of a reassembled PDU]
331   0.059400 54.230.150.31 -> 172.31.29.138 TCP 7682 [TCP segment of a reassembled PDU]
332   0.059415 172.31.29.138 -> 54.230.150.31 TCP 66 33306 > http [ACK] Seq=97 Ack=2424590 Win=1339520 Len=0 TSval=16836573 TSecr=446609203
333   0.060638 54.230.150.31 -> 172.31.29.138 TCP 2962 [TCP segment of a reassembled PDU]
334   0.060643 172.31.29.138 -> 54.230.150.31 TCP 66 33306 > http [ACK] Seq=97 Ack=2427486 Win=1391872 Len=0 TSval=16836573 TSecr=446609203
335   0.060884 54.230.150.31 -> 172.31.29.138 TCP 4410 [TCP segment of a reassembled PDU]
336   0.060898 172.31.29.138 -> 54.230.150.31 TCP 66 33306 > http [ACK] Seq=97 Ack=2431830 Win=1392000 Len=0 TSval=16836574 TSecr=446609203
337   0.061060 54.230.150.31 -> 172.31.29.138 TCP 20338 [TCP segment of a reassembled PDU]
338   0.061077 172.31.29.138 -> 54.230.150.31 TCP 66 33306 > http [ACK] Seq=97 Ack=2452102 Win=1371776 Len=0 TSval=16836574 TSecr=446609203
339   0.061090 54.230.150.31 -> 172.31.29.138 TCP 5858 [TCP segment of a reassembled PDU]
340   0.061102 172.31.29.138 -> 54.230.150.31 TCP 66 33306 > http [ACK] Seq=97 Ack=2457894 Win=1392000 Len=0 TSval=16836574 TSecr=446609203
341   0.061162 54.230.150.31 -> 172.31.29.138 TCP 24682 [TCP segment of a reassembled PDU]
342   0.061184 54.230.150.31 -> 172.31.29.138 TCP 7682 [TCP segment of a reassembled PDU]
343   0.061192 172.31.29.138 -> 54.230.150.31 TCP 66 33306 > http [ACK] Seq=97 Ack=2482510 Win=1367424 Len=0 TSval=16836574 TSecr=446609203
344   0.061206 172.31.29.138 -> 54.230.150.31 TCP 66 33306 > http [ACK] Seq=97 Ack=2490126 Win=1392000 Len=0 TSval=16836574 TSecr=446609203
345   0.061503 54.230.150.31 -> 172.31.29.138 TCP 2962 [TCP segment of a reassembled PDU]
346   0.061518 172.31.29.138 -> 54.230.150.31 TCP 66 33306 > http [ACK] Seq=97 Ack=2493022 Win=1392000 Len=0 TSval=16836574 TSecr=446609203
347   0.061586 54.230.150.31 -> 172.31.29.138 TCP 20338 [TCP segment of a reassembled PDU]
348   0.061603 172.31.29.138 -> 54.230.150.31 TCP 66 33306 > http [ACK] Seq=97 Ack=2513294 Win=1371776 Len=0 TSval=16836574 TSecr=446609203
349   0.061615 54.230.150.31 -> 172.31.29.138 TCP 5858 [TCP segment of a reassembled PDU]
350   0.061627 172.31.29.138 -> 54.230.150.31 TCP 66 33306 > http [ACK] Seq=97 Ack=2519086 Win=1392000 Len=0 TSval=16836574 TSecr=446609203
351   0.061682 54.230.150.31 -> 172.31.29.138 TCP 26130 [TCP segment of a reassembled PDU]
352   0.061710 54.230.150.31 -> 172.31.29.138 TCP 10578 [TCP segment of a reassembled PDU]
