[Measurement for 100kb at 14:06:01 16.06.2014] 
Tshark:

  1   0.000000 54.231.32.216 -> 192.168.1.2  TLSv1.2 107 Encrypted Alert
  2   0.050014  192.168.1.2 -> 54.231.32.216 TCP 54 61961→443 [ACK] Seq=1 Ack=54 Win=255 Len=0
  3   0.539887  192.168.1.2 -> 54.230.99.105 TCP 66 61963→80 [SYN] Seq=0 Win=8192 Len=0 MSS=1460 WS=256 SACK_PERM=1
  4   0.586202 54.230.99.105 -> 192.168.1.2  TCP 66 80→61963 [SYN, ACK] Seq=0 Ack=1 Win=14600 Len=0 MSS=1400 SACK_PERM=1 WS=128
  5   0.586324  192.168.1.2 -> 54.230.99.105 TCP 54 61963→80 [ACK] Seq=1 Ack=1 Win=65792 Len=0
  6   0.586439  192.168.1.2 -> 54.230.99.105 HTTP 152 GET /100kb HTTP/1.1 
  7   0.616004 54.230.99.105 -> 192.168.1.2  TCP 54 80→61963 [ACK] Seq=1 Ack=99 Win=14720 Len=0
  8   0.621707 54.230.99.105 -> 192.168.1.2  TCP 1121 [TCP segment of a reassembled PDU]
  9   0.623705 54.230.99.105 -> 192.168.1.2  TCP 1454 [TCP segment of a reassembled PDU]
 10   0.623788  192.168.1.2 -> 54.230.99.105 TCP 54 61963→80 [ACK] Seq=99 Ack=2468 Win=65792 Len=0
 11   0.623935 54.230.99.105 -> 192.168.1.2  TCP 1454 [TCP segment of a reassembled PDU]
 12   0.623971 54.230.99.105 -> 192.168.1.2  TCP 1454 [TCP segment of a reassembled PDU]
 13   0.624021  192.168.1.2 -> 54.230.99.105 TCP 54 61963→80 [ACK] Seq=99 Ack=5268 Win=65792 Len=0
 14   0.624134 54.230.99.105 -> 192.168.1.2  TCP 1454 [TCP segment of a reassembled PDU]
 15   0.625329 54.230.99.105 -> 192.168.1.2  TCP 1454 [TCP segment of a reassembled PDU]
 16   0.625477  192.168.1.2 -> 54.230.99.105 TCP 54 61963→80 [ACK] Seq=99 Ack=8068 Win=65792 Len=0
 17   0.625643 54.230.99.105 -> 192.168.1.2  TCP 1454 [TCP segment of a reassembled PDU]
 18   0.625684 54.230.99.105 -> 192.168.1.2  TCP 1454 [TCP segment of a reassembled PDU]
 19   0.625724  192.168.1.2 -> 54.230.99.105 TCP 54 61963→80 [ACK] Seq=99 Ack=10868 Win=65792 Len=0
 20   0.625825 54.230.99.105 -> 192.168.1.2  TCP 1454 [TCP segment of a reassembled PDU]
 21   0.625862 54.230.99.105 -> 192.168.1.2  TCP 1454 [TCP segment of a reassembled PDU]
 22   0.625898  192.168.1.2 -> 54.230.99.105 TCP 54 61963→80 [ACK] Seq=99 Ack=13668 Win=65792 Len=0
 23   0.652717 54.230.99.105 -> 192.168.1.2  TCP 1454 [TCP segment of a reassembled PDU]
 24   0.653972 54.230.99.105 -> 192.168.1.2  TCP 1454 [TCP segment of a reassembled PDU]
 25   0.654041  192.168.1.2 -> 54.230.99.105 TCP 54 61963→80 [ACK] Seq=99 Ack=16468 Win=65792 Len=0
 26   0.654177 54.230.99.105 -> 192.168.1.2  TCP 1454 [TCP segment of a reassembled PDU]
 27   0.654212 54.230.99.105 -> 192.168.1.2  TCP 1454 [TCP segment of a reassembled PDU]
 28   0.654245  192.168.1.2 -> 54.230.99.105 TCP 54 61963→80 [ACK] Seq=99 Ack=19268 Win=65792 Len=0
 29   0.654328 54.230.99.105 -> 192.168.1.2  TCP 1454 [TCP segment of a reassembled PDU]
 30   0.654362 54.230.99.105 -> 192.168.1.2  TCP 1454 [TCP segment of a reassembled PDU]
 31   0.654392  192.168.1.2 -> 54.230.99.105 TCP 54 61963→80 [ACK] Seq=99 Ack=22068 Win=65792 Len=0
 32   0.658201 54.230.99.105 -> 192.168.1.2  TCP 1454 [TCP segment of a reassembled PDU]
 33   0.659046 54.230.99.105 -> 192.168.1.2  TCP 1454 [TCP segment of a reassembled PDU]
 34   0.659106  192.168.1.2 -> 54.230.99.105 TCP 54 61963→80 [ACK] Seq=99 Ack=24868 Win=65792 Len=0
 35   0.659991 54.230.99.105 -> 192.168.1.2  TCP 1454 [TCP segment of a reassembled PDU]
 36   0.660040 54.230.99.105 -> 192.168.1.2  TCP 1454 [TCP segment of a reassembled PDU]
 37   0.660081  192.168.1.2 -> 54.230.99.105 TCP 54 61963→80 [ACK] Seq=99 Ack=27668 Win=65792 Len=0
 38   0.661395 54.230.99.105 -> 192.168.1.2  TCP 1454 [TCP segment of a reassembled PDU]
 39   0.661445 54.230.99.105 -> 192.168.1.2  TCP 1454 [TCP segment of a reassembled PDU]
 40   0.661485  192.168.1.2 -> 54.230.99.105 TCP 54 61963→80 [ACK] Seq=99 Ack=30468 Win=65792 Len=0
 41   0.689092 54.230.99.105 -> 192.168.1.2  TCP 1454 [TCP segment of a reassembled PDU]
 42   0.690093 54.230.99.105 -> 192.168.1.2  TCP 1454 [TCP segment of a reassembled PDU]
 43   0.690157  192.168.1.2 -> 54.230.99.105 TCP 54 61963→80 [ACK] Seq=99 Ack=33268 Win=65792 Len=0
 44   0.691008 54.230.99.105 -> 192.168.1.2  TCP 1454 [TCP segment of a reassembled PDU]
 45   0.691057 54.230.99.105 -> 192.168.1.2  TCP 1454 [TCP segment of a reassembled PDU]
 46   0.691102  192.168.1.2 -> 54.230.99.105 TCP 54 61963→80 [ACK] Seq=99 Ack=36068 Win=65792 Len=0
 47   0.693190 54.230.99.105 -> 192.168.1.2  TCP 1454 [TCP segment of a reassembled PDU]
 48   0.693236 54.230.99.105 -> 192.168.1.2  TCP 1454 [TCP segment of a reassembled PDU]
 49   0.693304  192.168.1.2 -> 54.230.99.105 TCP 54 61963→80 [ACK] Seq=99 Ack=38868 Win=65792 Len=0
 50   0.693424 54.230.99.105 -> 192.168.1.2  TCP 1454 [TCP segment of a reassembled PDU]
 51   0.693477 54.230.99.105 -> 192.168.1.2  TCP 1454 [TCP segment of a reassembled PDU]
 52   0.693520  192.168.1.2 -> 54.230.99.105 TCP 54 61963→80 [ACK] Seq=99 Ack=41668 Win=65792 Len=0
 53   0.693606 54.230.99.105 -> 192.168.1.2  TCP 1454 [TCP segment of a reassembled PDU]
 54   0.693657 54.230.99.105 -> 192.168.1.2  TCP 1454 [TCP segment of a reassembled PDU]
 55   0.693689  192.168.1.2 -> 54.230.99.105 TCP 54 61963→80 [ACK] Seq=99 Ack=44468 Win=65792 Len=0
 56   0.693771 54.230.99.105 -> 192.168.1.2  TCP 1454 [TCP segment of a reassembled PDU]
 57   0.693804 54.230.99.105 -> 192.168.1.2  TCP 1454 [TCP segment of a reassembled PDU]
 58   0.693836  192.168.1.2 -> 54.230.99.105 TCP 54 61963→80 [ACK] Seq=99 Ack=47268 Win=65792 Len=0
 59   0.693917 54.230.99.105 -> 192.168.1.2  TCP 1454 [TCP segment of a reassembled PDU]
 60   0.693967 54.230.99.105 -> 192.168.1.2  TCP 1454 [TCP segment of a reassembled PDU]
 61   0.694000  192.168.1.2 -> 54.230.99.105 TCP 54 61963→80 [ACK] Seq=99 Ack=50068 Win=65792 Len=0
 62   0.697605 54.230.99.105 -> 192.168.1.2  TCP 1454 [TCP segment of a reassembled PDU]
 63   0.697657 54.230.99.105 -> 192.168.1.2  TCP 1454 [TCP segment of a reassembled PDU]
 64   0.697697  192.168.1.2 -> 54.230.99.105 TCP 54 61963→80 [ACK] Seq=99 Ack=52868 Win=65792 Len=0
 65   0.697791 54.230.99.105 -> 192.168.1.2  TCP 1454 [TCP segment of a reassembled PDU]
 66   0.697827 54.230.99.105 -> 192.168.1.2  TCP 1454 [TCP segment of a reassembled PDU]
 67   0.697860  192.168.1.2 -> 54.230.99.105 TCP 54 61963→80 [ACK] Seq=99 Ack=55668 Win=65792 Len=0
 68   0.717089 54.230.99.105 -> 192.168.1.2  TCP 1454 [TCP segment of a reassembled PDU]
 69   0.718136 54.230.99.105 -> 192.168.1.2  TCP 1454 [TCP segment of a reassembled PDU]
 70   0.718202  192.168.1.2 -> 54.230.99.105 TCP 54 61963→80 [ACK] Seq=99 Ack=58468 Win=65792 Len=0
 71   0.719321 54.230.99.105 -> 192.168.1.2  TCP 1454 [TCP segment of a reassembled PDU]
 72   0.719369 54.230.99.105 -> 192.168.1.2  TCP 1454 [TCP segment of a reassembled PDU]
 73   0.719427  192.168.1.2 -> 54.230.99.105 TCP 54 61963→80 [ACK] Seq=99 Ack=61268 Win=65792 Len=0
 74   0.719550 54.230.99.105 -> 192.168.1.2  TCP 1454 [TCP segment of a reassembled PDU]
 75   0.719599 54.230.99.105 -> 192.168.1.2  TCP 1454 [TCP segment of a reassembled PDU]
 76   0.719647  192.168.1.2 -> 54.230.99.105 TCP 54 61963→80 [ACK] Seq=99 Ack=64068 Win=65792 Len=0
 77   0.723568 54.230.99.105 -> 192.168.1.2  TCP 1454 [TCP segment of a reassembled PDU]
 78   0.724530 54.230.99.105 -> 192.168.1.2  TCP 1454 [TCP segment of a reassembled PDU]
 79   0.724592  192.168.1.2 -> 54.230.99.105 TCP 54 61963→80 [ACK] Seq=99 Ack=66868 Win=65792 Len=0
 80   0.726256 54.230.99.105 -> 192.168.1.2  TCP 1454 [TCP segment of a reassembled PDU]
 81   0.726319 54.230.99.105 -> 192.168.1.2  TCP 1454 [TCP segment of a reassembled PDU]
 82   0.726377  192.168.1.2 -> 54.230.99.105 TCP 54 61963→80 [ACK] Seq=99 Ack=69668 Win=65792 Len=0
 83   0.726509 54.230.99.105 -> 192.168.1.2  TCP 1454 [TCP segment of a reassembled PDU]
 84   0.726560 54.230.99.105 -> 192.168.1.2  TCP 1454 [TCP segment of a reassembled PDU]
 85   0.726614  192.168.1.2 -> 54.230.99.105 TCP 54 61963→80 [ACK] Seq=99 Ack=72468 Win=65792 Len=0
 86   0.726722 54.230.99.105 -> 192.168.1.2  TCP 1454 [TCP segment of a reassembled PDU]
 87   0.726760 54.230.99.105 -> 192.168.1.2  TCP 1454 [TCP segment of a reassembled PDU]
 88   0.726792  192.168.1.2 -> 54.230.99.105 TCP 54 61963→80 [ACK] Seq=99 Ack=75268 Win=65792 Len=0
 89   0.726874 54.230.99.105 -> 192.168.1.2  TCP 1454 [TCP segment of a reassembled PDU]
 90   0.726930 54.230.99.105 -> 192.168.1.2  TCP 1454 [TCP segment of a reassembled PDU]
 91   0.726962  192.168.1.2 -> 54.230.99.105 TCP 54 61963→80 [ACK] Seq=99 Ack=78068 Win=65792 Len=0
 92   0.730761 54.230.99.105 -> 192.168.1.2  TCP 1454 [TCP segment of a reassembled PDU]
 93   0.730814 54.230.99.105 -> 192.168.1.2  TCP 1454 [TCP segment of a reassembled PDU]
 94   0.730853  192.168.1.2 -> 54.230.99.105 TCP 54 61963→80 [ACK] Seq=99 Ack=80868 Win=65792 Len=0
 95   0.730948 54.230.99.105 -> 192.168.1.2  TCP 1454 [TCP segment of a reassembled PDU]
 96   0.731006 54.230.99.105 -> 192.168.1.2  TCP 1454 [TCP segment of a reassembled PDU]
 97   0.731059  192.168.1.2 -> 54.230.99.105 TCP 54 61963→80 [ACK] Seq=99 Ack=83668 Win=65792 Len=0
 98   0.731166 54.230.99.105 -> 192.168.1.2  TCP 1454 [TCP segment of a reassembled PDU]
 99   0.731204 54.230.99.105 -> 192.168.1.2  TCP 1454 [TCP segment of a reassembled PDU]
100   0.731274  192.168.1.2 -> 54.230.99.105 TCP 54 61963→80 [ACK] Seq=99 Ack=86468 Win=65792 Len=0
101   0.731385 54.230.99.105 -> 192.168.1.2  TCP 1454 [TCP segment of a reassembled PDU]
102   0.746555 54.230.99.105 -> 192.168.1.2  TCP 1454 [TCP segment of a reassembled PDU]
103   0.746639  192.168.1.2 -> 54.230.99.105 TCP 54 61963→80 [ACK] Seq=99 Ack=89268 Win=65792 Len=0
104   0.748487 54.230.99.105 -> 192.168.1.2  TCP 1454 [TCP segment of a reassembled PDU]
105   0.748541 54.230.99.105 -> 192.168.1.2  TCP 1454 [TCP segment of a reassembled PDU]
106   0.748588  192.168.1.2 -> 54.230.99.105 TCP 54 61963→80 [ACK] Seq=99 Ack=92068 Win=65792 Len=0
107   0.748698 54.230.99.105 -> 192.168.1.2  TCP 1454 [TCP segment of a reassembled PDU]
108   0.748741 54.230.99.105 -> 192.168.1.2  TCP 1454 [TCP segment of a reassembled PDU]
109   0.748780  192.168.1.2 -> 54.230.99.105 TCP 54 61963→80 [ACK] Seq=99 Ack=94868 Win=65792 Len=0
110   0.748880 54.230.99.105 -> 192.168.1.2  TCP 1454 [TCP segment of a reassembled PDU]
111   0.748920 54.230.99.105 -> 192.168.1.2  TCP 1454 [TCP segment of a reassembled PDU]
112   0.748959  192.168.1.2 -> 54.230.99.105 TCP 54 61963→80 [ACK] Seq=99 Ack=97668 Win=113152 Len=0
113   0.749056 54.230.99.105 -> 192.168.1.2  TCP 1454 [TCP segment of a reassembled PDU]
114   0.749096 54.230.99.105 -> 192.168.1.2  TCP 1454 [TCP segment of a reassembled PDU]
115   0.749133  192.168.1.2 -> 54.230.99.105 TCP 54 61963→80 [ACK] Seq=99 Ack=100468 Win=113152 Len=0
116   0.749229 54.230.99.105 -> 192.168.1.2  TCP 1454 [TCP segment of a reassembled PDU]
117   0.749551 54.230.99.105 -> 192.168.1.2  HTTP 1042 HTTP/1.1 200 OK  (application/octet-stream)
118   0.749611  192.168.1.2 -> 54.230.99.105 TCP 54 61963→80 [ACK] Seq=99 Ack=102856 Win=113152 Len=0
119   0.749785  192.168.1.2 -> 54.230.99.105 TCP 54 61963→80 [FIN, ACK] Seq=99 Ack=102856 Win=113152 Len=0
120   0.791106 54.230.99.105 -> 192.168.1.2  TCP 54 80→61963 [FIN, ACK] Seq=102856 Ack=100 Win=14720 Len=0
121   0.791263  192.168.1.2 -> 54.230.99.105 TCP 54 61963→80 [ACK] Seq=100 Ack=102857 Win=113152 Len=0
122   2.001505 54.231.32.216 -> 192.168.1.2  TCP 54 443→61961 [FIN, ACK] Seq=54 Ack=1 Win=144 Len=0
123   2.001587  192.168.1.2 -> 54.231.32.216 TCP 54 61961→443 [ACK] Seq=1 Ack=55 Win=255 Len=0
