[Measurement for 1kb at 07:38:36 20.38.2014] 
Tshark:

  1   0.000000 172.31.29.138 -> 172.31.0.2   DNS 89 Standard query 0xb802  A d3m1c4hwkgedal.cloudfront.net
  2   0.000034 172.31.29.138 -> 172.31.0.2   DNS 89 Standard query 0x6cf6  AAAA d3m1c4hwkgedal.cloudfront.net
  3   0.000578   172.31.0.2 -> 172.31.29.138 DNS 217 Standard query response 0xb802  A 54.230.150.123 A 54.230.148.75 A 54.230.149.215 A 54.230.150.33 A 54.230.150.42 A 54.230.150.74 A 54.230.150.106 A 54.230.150.122
  4   0.004379   172.31.0.2 -> 172.31.29.138 DNS 174 Standard query response 0x6cf6 
  5   0.012111 172.31.29.138 -> 54.230.150.123 TCP 74 40836 > http [SYN] Seq=0 Win=26883 Len=0 MSS=8961 SACK_PERM=1 TSval=13247283 TSecr=0 WS=128
  6   0.013737 54.230.150.123 -> 172.31.29.138 TCP 74 http > 40836 [SYN, ACK] Seq=0 Ack=1 Win=14480 Len=0 MSS=1460 SACK_PERM=1 TSval=1454986377 TSecr=13247283 WS=128
  7   0.013751 172.31.29.138 -> 54.230.150.123 TCP 66 40836 > http [ACK] Seq=1 Ack=1 Win=27008 Len=0 TSval=13247283 TSecr=1454986377
  8   0.013807 172.31.29.138 -> 54.230.150.123 HTTP 162 GET /1kb HTTP/1.1 
  9   0.015438 54.230.150.123 -> 172.31.29.138 TCP 66 http > 40836 [ACK] Seq=1 Ack=97 Win=14592 Len=0 TSval=1454986377 TSecr=13247283
 10   0.017506 54.230.150.123 -> 172.31.29.138 HTTP 1544 HTTP/1.1 200 OK  (application/octet-stream)
 11   0.017514 172.31.29.138 -> 54.230.150.123 TCP 66 40836 > http [ACK] Seq=97 Ack=1479 Win=29952 Len=0 TSval=13247284 TSecr=1454986377
 12   0.017686 172.31.29.138 -> 54.230.150.123 TCP 66 40836 > http [FIN, ACK] Seq=97 Ack=1479 Win=29952 Len=0 TSval=13247284 TSecr=1454986377
 13   0.019617 54.230.150.123 -> 172.31.29.138 TCP 66 http > 40836 [FIN, ACK] Seq=1479 Ack=98 Win=14592 Len=0 TSval=1454986377 TSecr=13247284
 14   0.019625 172.31.29.138 -> 54.230.150.123 TCP 66 40836 > http [ACK] Seq=98 Ack=1480 Win=29952 Len=0 TSval=13247285 TSecr=1454986377
