[Measurement for 1kb at 13:38:35 20.38.2014] 
Tshark:

  1   0.000000 172.31.29.138 -> 172.31.0.2   DNS 89 Standard query 0x93dd  A d3m1c4hwkgedal.cloudfront.net
  2   0.000026 172.31.29.138 -> 172.31.0.2   DNS 89 Standard query 0xd99d  AAAA d3m1c4hwkgedal.cloudfront.net
  3   0.000483   172.31.0.2 -> 172.31.29.138 DNS 217 Standard query response 0x93dd  A 54.192.159.169 A 54.192.159.180 A 54.230.158.142 A 54.230.158.176 A 54.230.158.182 A 54.192.157.139 A 54.192.159.107 A 54.192.159.161
  4   0.003439   172.31.0.2 -> 172.31.29.138 DNS 174 Standard query response 0xd99d 
  5   0.006330 172.31.29.138 -> 54.192.159.169 TCP 74 38198 > http [SYN] Seq=0 Win=26883 Len=0 MSS=8961 SACK_PERM=1 TSval=18647176 TSecr=0 WS=128
  6   0.007112 54.192.159.169 -> 172.31.29.138 TCP 74 http > 38198 [SYN, ACK] Seq=0 Ack=1 Win=14480 Len=0 MSS=1460 SACK_PERM=1 TSval=733708809 TSecr=18647176 WS=128
  7   0.007126 172.31.29.138 -> 54.192.159.169 TCP 66 38198 > http [ACK] Seq=1 Ack=1 Win=27008 Len=0 TSval=18647177 TSecr=733708809
  8   0.007167 172.31.29.138 -> 54.192.159.169 HTTP 162 GET /1kb HTTP/1.1 
  9   0.007864 54.192.159.169 -> 172.31.29.138 TCP 66 http > 38198 [ACK] Seq=1 Ack=97 Win=14592 Len=0 TSval=733708809 TSecr=18647177
 10   0.010194 54.192.159.169 -> 172.31.29.138 HTTP 1544 HTTP/1.1 200 OK  (application/octet-stream)
 11   0.010207 172.31.29.138 -> 54.192.159.169 TCP 66 38198 > http [ACK] Seq=97 Ack=1479 Win=29952 Len=0 TSval=18647177 TSecr=733708809
 12   0.010375 172.31.29.138 -> 54.192.159.169 TCP 66 38198 > http [FIN, ACK] Seq=97 Ack=1479 Win=29952 Len=0 TSval=18647177 TSecr=733708809
 13   0.010943 54.192.159.169 -> 172.31.29.138 TCP 66 http > 38198 [FIN, ACK] Seq=1479 Ack=98 Win=14592 Len=0 TSval=733708809 TSecr=18647177
 14   0.010951 172.31.29.138 -> 54.192.159.169 TCP 66 38198 > http [ACK] Seq=98 Ack=1480 Win=29952 Len=0 TSval=18647178 TSecr=733708809
