[Measurement for 1kb at 04:38:36 20.38.2014] 
Tshark:

  1   0.000000 172.31.29.138 -> 172.31.0.2   DNS 89 Standard query 0xaf3d  A d3m1c4hwkgedal.cloudfront.net
  2   0.000035 172.31.29.138 -> 172.31.0.2   DNS 89 Standard query 0x6476  AAAA d3m1c4hwkgedal.cloudfront.net
  3   0.000653   172.31.0.2 -> 172.31.29.138 DNS 217 Standard query response 0xaf3d  A 54.230.157.230 A 54.230.158.184 A 54.230.158.225 A 54.230.159.137 A 54.192.156.100 A 54.192.157.137 A 54.192.157.142 A 54.192.157.144
  4   0.003489   172.31.0.2 -> 172.31.29.138 DNS 174 Standard query response 0x6476 
  5   0.003874 172.31.29.138 -> 54.230.157.230 TCP 74 60781 > http [SYN] Seq=0 Win=26883 Len=0 MSS=8961 SACK_PERM=1 TSval=10547230 TSecr=0 WS=128
  6   0.004494 54.230.157.230 -> 172.31.29.138 TCP 74 http > 60781 [SYN, ACK] Seq=0 Ack=1 Win=14480 Len=0 MSS=1460 SACK_PERM=1 TSval=835359509 TSecr=10547230 WS=128
  7   0.004507 172.31.29.138 -> 54.230.157.230 TCP 66 60781 > http [ACK] Seq=1 Ack=1 Win=27008 Len=0 TSval=10547230 TSecr=835359509
  8   0.004544 172.31.29.138 -> 54.230.157.230 HTTP 162 GET /1kb HTTP/1.1 
  9   0.005240 54.230.157.230 -> 172.31.29.138 TCP 66 http > 60781 [ACK] Seq=1 Ack=97 Win=14592 Len=0 TSval=835359509 TSecr=10547230
 10   0.008605 54.230.157.230 -> 172.31.29.138 HTTP 1544 HTTP/1.1 200 OK  (application/octet-stream)
 11   0.008613 172.31.29.138 -> 54.230.157.230 TCP 66 60781 > http [ACK] Seq=97 Ack=1479 Win=29952 Len=0 TSval=10547231 TSecr=835359509
 12   0.008746 172.31.29.138 -> 54.230.157.230 TCP 66 60781 > http [FIN, ACK] Seq=97 Ack=1479 Win=29952 Len=0 TSval=10547231 TSecr=835359509
 13   0.009595 54.230.157.230 -> 172.31.29.138 TCP 66 http > 60781 [FIN, ACK] Seq=1479 Ack=98 Win=14592 Len=0 TSval=835359509 TSecr=10547231
 14   0.009604 172.31.29.138 -> 54.230.157.230 TCP 66 60781 > http [ACK] Seq=98 Ack=1480 Win=29952 Len=0 TSval=10547231 TSecr=835359509
