[Measurement for 100kb at 13:36:17 20.36.2014] 
Tshark:

  1   0.000000 172.31.29.138 -> 172.31.0.2   DNS 89 Standard query 0x9abe  A d1xvcg6dfvgaki.cloudfront.net
  2   0.000033 172.31.29.138 -> 172.31.0.2   DNS 89 Standard query 0xf55f  AAAA d1xvcg6dfvgaki.cloudfront.net
  3   0.000788   172.31.0.2 -> 172.31.29.138 DNS 217 Standard query response 0x9abe  A 54.230.158.101 A 54.230.158.244 A 54.230.159.137 A 54.192.157.143 A 54.192.159.169 A 54.192.159.173 A 54.230.156.193 A 54.230.158.71
  4   0.000799   172.31.0.2 -> 172.31.29.138 DNS 170 Standard query response 0xf55f 
  5   0.003890 172.31.29.138 -> 54.230.158.101 TCP 74 36796 > http [SYN] Seq=0 Win=26883 Len=0 MSS=8961 SACK_PERM=1 TSval=18612458 TSecr=0 WS=128
  6   0.004512 54.230.158.101 -> 172.31.29.138 TCP 74 http > 36796 [SYN, ACK] Seq=0 Ack=1 Win=14480 Len=0 MSS=1460 SACK_PERM=1 TSval=733696019 TSecr=18612458 WS=128
  7   0.004526 172.31.29.138 -> 54.230.158.101 TCP 66 36796 > http [ACK] Seq=1 Ack=1 Win=27008 Len=0 TSval=18612458 TSecr=733696019
  8   0.004564 172.31.29.138 -> 54.230.158.101 HTTP 164 GET /100kb HTTP/1.1 
  9   0.005246 54.230.158.101 -> 172.31.29.138 TCP 66 http > 36796 [ACK] Seq=1 Ack=99 Win=14592 Len=0 TSval=733696019 TSecr=18612458
 10   0.278556 54.230.158.101 -> 172.31.29.138 TCP 2962 [TCP segment of a reassembled PDU]
 11   0.278579 172.31.29.138 -> 54.230.158.101 TCP 66 36796 > http [ACK] Seq=99 Ack=2897 Win=32768 Len=0 TSval=18612526 TSecr=733696047
 12   0.278600 54.230.158.101 -> 172.31.29.138 TCP 10202 [TCP segment of a reassembled PDU]
 13   0.278607 172.31.29.138 -> 54.230.158.101 TCP 66 36796 > http [ACK] Seq=99 Ack=13033 Win=52992 Len=0 TSval=18612526 TSecr=733696047
 14   0.279209 54.230.158.101 -> 172.31.29.138 TCP 10202 [TCP segment of a reassembled PDU]
 15   0.279218 172.31.29.138 -> 54.230.158.101 TCP 66 36796 > http [ACK] Seq=99 Ack=23169 Win=73344 Len=0 TSval=18612527 TSecr=733696047
 16   0.279226 54.230.158.101 -> 172.31.29.138 TCP 2962 [TCP segment of a reassembled PDU]
 17   0.279230 172.31.29.138 -> 54.230.158.101 TCP 66 36796 > http [ACK] Seq=99 Ack=26065 Win=79104 Len=0 TSval=18612527 TSecr=733696047
 18   0.279974 54.230.158.101 -> 172.31.29.138 TCP 8754 [TCP segment of a reassembled PDU]
 19   0.279982 172.31.29.138 -> 54.230.158.101 TCP 66 36796 > http [ACK] Seq=99 Ack=34753 Win=96512 Len=0 TSval=18612527 TSecr=733696047
 20   0.280026 54.230.158.101 -> 172.31.29.138 TCP 11650 [TCP segment of a reassembled PDU]
 21   0.280033 172.31.29.138 -> 54.230.158.101 TCP 66 36796 > http [ACK] Seq=99 Ack=46337 Win=98944 Len=0 TSval=18612527 TSecr=733696047
 22   0.280565 54.230.158.101 -> 172.31.29.138 TCP 5858 [TCP segment of a reassembled PDU]
 23   0.280571 172.31.29.138 -> 54.230.158.101 TCP 66 36796 > http [ACK] Seq=99 Ack=52129 Win=108416 Len=0 TSval=18612527 TSecr=733696047
 24   0.280774 54.230.158.101 -> 172.31.29.138 TCP 13098 [TCP segment of a reassembled PDU]
 25   0.280783 172.31.29.138 -> 54.230.158.101 TCP 66 36796 > http [ACK] Seq=99 Ack=65161 Win=96512 Len=0 TSval=18612527 TSecr=733696047
 26   0.281126 54.230.158.101 -> 172.31.29.138 TCP 11650 [TCP segment of a reassembled PDU]
 27   0.281135 172.31.29.138 -> 54.230.158.101 TCP 66 36796 > http [ACK] Seq=99 Ack=76745 Win=98944 Len=0 TSval=18612527 TSecr=733696047
 28   0.281557 54.230.158.101 -> 172.31.29.138 TCP 2962 [TCP segment of a reassembled PDU]
 29   0.281562 172.31.29.138 -> 54.230.158.101 TCP 66 36796 > http [ACK] Seq=99 Ack=79641 Win=109056 Len=0 TSval=18612527 TSecr=733696047
 30   0.281673 54.230.158.101 -> 172.31.29.138 TCP 11650 [TCP segment of a reassembled PDU]
 31   0.281682 172.31.29.138 -> 54.230.158.101 TCP 66 36796 > http [ACK] Seq=99 Ack=91225 Win=98944 Len=0 TSval=18612527 TSecr=733696047
 32   0.287476 54.230.158.101 -> 172.31.29.138 TCP 5858 [TCP segment of a reassembled PDU]
 33   0.287483 172.31.29.138 -> 54.230.158.101 TCP 66 36796 > http [ACK] Seq=99 Ack=97017 Win=108416 Len=0 TSval=18612529 TSecr=733696048
 34   0.287562 54.230.158.101 -> 172.31.29.138 TCP 5858 [TCP segment of a reassembled PDU]
 35   0.287568 172.31.29.138 -> 54.230.158.101 TCP 66 36796 > http [ACK] Seq=99 Ack=102809 Win=120704 Len=0 TSval=18612529 TSecr=733696048
 36   0.287573 54.230.158.101 -> 172.31.29.138 HTTP 114 HTTP/1.1 200 OK  (application/octet-stream)
 37   0.287575 172.31.29.138 -> 54.230.158.101 TCP 66 36796 > http [ACK] Seq=99 Ack=102857 Win=120704 Len=0 TSval=18612529 TSecr=733696048
 38   0.287705 172.31.29.138 -> 54.230.158.101 TCP 66 36796 > http [FIN, ACK] Seq=99 Ack=102857 Win=120704 Len=0 TSval=18612529 TSecr=733696048
 39   0.288701 54.230.158.101 -> 172.31.29.138 TCP 66 http > 36796 [FIN, ACK] Seq=102857 Ack=100 Win=14592 Len=0 TSval=733696048 TSecr=18612529
 40   0.288711 172.31.29.138 -> 54.230.158.101 TCP 66 36796 > http [ACK] Seq=100 Ack=102858 Win=120704 Len=0 TSval=18612529 TSecr=733696048
