[Measurement for 100kb at 06:36:16 20.36.2014] 
Tshark:

  1   0.000000 172.31.29.138 -> 172.31.0.2   DNS 89 Standard query 0x9501  A d1xvcg6dfvgaki.cloudfront.net
  2   0.000029 172.31.29.138 -> 172.31.0.2   DNS 89 Standard query 0x46fb  AAAA d1xvcg6dfvgaki.cloudfront.net
  3   0.000496   172.31.0.2 -> 172.31.29.138 DNS 217 Standard query response 0x9501  A 54.230.150.43 A 54.230.150.45 A 54.230.150.65 A 54.230.150.114 A 54.230.151.226 A 54.230.149.71 A 54.230.150.30 A 54.230.150.34
  4   0.000507   172.31.0.2 -> 172.31.29.138 DNS 170 Standard query response 0x46fb 
  5   0.003892 172.31.29.138 -> 54.230.150.43 TCP 74 47787 > http [SYN] Seq=0 Win=26883 Len=0 MSS=8961 SACK_PERM=1 TSval=12312428 TSecr=0 WS=128
  6   0.005474 54.230.150.43 -> 172.31.29.138 TCP 74 http > 47787 [SYN, ACK] Seq=0 Ack=1 Win=14480 Len=0 MSS=1460 SACK_PERM=1 TSval=1446676838 TSecr=12312428 WS=128
  7   0.005488 172.31.29.138 -> 54.230.150.43 TCP 66 47787 > http [ACK] Seq=1 Ack=1 Win=27008 Len=0 TSval=12312429 TSecr=1446676838
  8   0.005536 172.31.29.138 -> 54.230.150.43 HTTP 164 GET /100kb HTTP/1.1 
  9   0.006955 54.230.150.43 -> 172.31.29.138 TCP 66 http > 47787 [ACK] Seq=1 Ack=99 Win=14592 Len=0 TSval=1446676839 TSecr=12312429
 10   0.009119 54.230.150.43 -> 172.31.29.138 TCP 7306 [TCP segment of a reassembled PDU]
 11   0.009128 172.31.29.138 -> 54.230.150.43 TCP 66 47787 > http [ACK] Seq=99 Ack=7241 Win=41472 Len=0 TSval=12312430 TSecr=1446676839
 12   0.009243 54.230.150.43 -> 172.31.29.138 TCP 4410 [TCP segment of a reassembled PDU]
 13   0.009250 172.31.29.138 -> 54.230.150.43 TCP 66 47787 > http [ACK] Seq=99 Ack=11585 Win=50176 Len=0 TSval=12312430 TSecr=1446676839
 14   0.009316 54.230.150.43 -> 172.31.29.138 TCP 1514 [TCP segment of a reassembled PDU]
 15   0.009321 172.31.29.138 -> 54.230.150.43 TCP 66 47787 > http [ACK] Seq=99 Ack=13033 Win=52992 Len=0 TSval=12312430 TSecr=1446676839
 16   0.010636 54.230.150.43 -> 172.31.29.138 TCP 5858 [TCP segment of a reassembled PDU]
 17   0.010643 172.31.29.138 -> 54.230.150.43 TCP 66 47787 > http [ACK] Seq=99 Ack=18825 Win=64640 Len=0 TSval=12312430 TSecr=1446676839
 18   0.010713 54.230.150.43 -> 172.31.29.138 TCP 4410 [TCP segment of a reassembled PDU]
 19   0.010719 172.31.29.138 -> 54.230.150.43 TCP 66 47787 > http [ACK] Seq=99 Ack=23169 Win=73344 Len=0 TSval=12312430 TSecr=1446676839
 20   0.010816 54.230.150.43 -> 172.31.29.138 TCP 2962 [TCP segment of a reassembled PDU]
 21   0.010822 172.31.29.138 -> 54.230.150.43 TCP 66 47787 > http [ACK] Seq=99 Ack=26065 Win=79104 Len=0 TSval=12312430 TSecr=1446676839
 22   0.011885 54.230.150.43 -> 172.31.29.138 TCP 2962 [TCP segment of a reassembled PDU]
 23   0.011892 172.31.29.138 -> 54.230.150.43 TCP 66 47787 > http [ACK] Seq=99 Ack=28961 Win=84864 Len=0 TSval=12312430 TSecr=1446676839
 24   0.011968 54.230.150.43 -> 172.31.29.138 TCP 10202 [TCP segment of a reassembled PDU]
 25   0.011977 172.31.29.138 -> 54.230.150.43 TCP 66 47787 > http [ACK] Seq=99 Ack=39097 Win=101248 Len=0 TSval=12312430 TSecr=1446676839
 26   0.012179 54.230.150.43 -> 172.31.29.138 TCP 10202 [TCP segment of a reassembled PDU]
 27   0.012187 172.31.29.138 -> 54.230.150.43 TCP 66 47787 > http [ACK] Seq=99 Ack=49233 Win=101248 Len=0 TSval=12312430 TSecr=1446676839
 28   0.013134 54.230.150.43 -> 172.31.29.138 TCP 2962 [TCP segment of a reassembled PDU]
 29   0.013139 172.31.29.138 -> 54.230.150.43 TCP 66 47787 > http [ACK] Seq=99 Ack=52129 Win=109056 Len=0 TSval=12312431 TSecr=1446676839
 30   0.013408 54.230.150.43 -> 172.31.29.138 TCP 1514 [TCP segment of a reassembled PDU]
 31   0.013412 172.31.29.138 -> 54.230.150.43 TCP 66 47787 > http [ACK] Seq=99 Ack=53577 Win=112000 Len=0 TSval=12312431 TSecr=1446676839
 32   0.013523 54.230.150.43 -> 172.31.29.138 TCP 11650 [TCP segment of a reassembled PDU]
 33   0.013531 172.31.29.138 -> 54.230.150.43 TCP 66 47787 > http [ACK] Seq=99 Ack=65161 Win=135168 Len=0 TSval=12312431 TSecr=1446676839
 34   0.013756 54.230.150.43 -> 172.31.29.138 TCP 11650 [TCP segment of a reassembled PDU]
 35   0.013764 172.31.29.138 -> 54.230.150.43 TCP 66 47787 > http [ACK] Seq=99 Ack=76745 Win=158336 Len=0 TSval=12312431 TSecr=1446676839
 36   0.014418 54.230.150.43 -> 172.31.29.138 TCP 1514 [TCP segment of a reassembled PDU]
 37   0.014422 172.31.29.138 -> 54.230.150.43 TCP 66 47787 > http [ACK] Seq=99 Ack=78193 Win=161152 Len=0 TSval=12312431 TSecr=1446676839
 38   0.014948 54.230.150.43 -> 172.31.29.138 TCP 5858 [TCP segment of a reassembled PDU]
 39   0.014954 172.31.29.138 -> 54.230.150.43 TCP 66 47787 > http [ACK] Seq=99 Ack=83985 Win=172800 Len=0 TSval=12312431 TSecr=1446676839
 40   0.015028 54.230.150.43 -> 172.31.29.138 TCP 11650 [TCP segment of a reassembled PDU]
 41   0.015035 172.31.29.138 -> 54.230.150.43 TCP 66 47787 > http [ACK] Seq=99 Ack=95569 Win=195968 Len=0 TSval=12312431 TSecr=1446676839
 42   0.015259 54.230.150.43 -> 172.31.29.138 TCP 7306 [TCP segment of a reassembled PDU]
 43   0.015265 172.31.29.138 -> 54.230.150.43 TCP 66 47787 > http [ACK] Seq=99 Ack=102809 Win=210432 Len=0 TSval=12312431 TSecr=1446676839
 44   0.015279 54.230.150.43 -> 172.31.29.138 HTTP 114 HTTP/1.1 200 OK  (application/octet-stream)
 45   0.015281 172.31.29.138 -> 54.230.150.43 TCP 66 47787 > http [ACK] Seq=99 Ack=102857 Win=210432 Len=0 TSval=12312431 TSecr=1446676839
 46   0.015394 172.31.29.138 -> 54.230.150.43 TCP 66 47787 > http [FIN, ACK] Seq=99 Ack=102857 Win=210432 Len=0 TSval=12312431 TSecr=1446676839
 47   0.016669 54.230.150.43 -> 172.31.29.138 TCP 66 http > 47787 [FIN, ACK] Seq=102857 Ack=100 Win=14592 Len=0 TSval=1446676839 TSecr=12312431
 48   0.016677 172.31.29.138 -> 54.230.150.43 TCP 66 47787 > http [ACK] Seq=100 Ack=102858 Win=210432 Len=0 TSval=12312432 TSecr=1446676839
