[Measurement for 100kb at 03:36:17 20.36.2014] 
Tshark:

  1   0.000000 172.31.29.138 -> 172.31.0.2   DNS 89 Standard query 0xad38  A d1xvcg6dfvgaki.cloudfront.net
  2   0.000041 172.31.29.138 -> 172.31.0.2   DNS 89 Standard query 0x9b71  AAAA d1xvcg6dfvgaki.cloudfront.net
  3   0.000731   172.31.0.2 -> 172.31.29.138 DNS 217 Standard query response 0xad38  A 54.230.158.139 A 54.230.158.182 A 54.230.158.217 A 54.230.158.223 A 54.230.159.150 A 54.192.159.77 A 54.192.159.174 A 54.192.159.180
  4   0.000741   172.31.0.2 -> 172.31.29.138 DNS 170 Standard query response 0x9b71 
  5   0.003930 172.31.29.138 -> 54.230.158.139 TCP 74 59006 > http [SYN] Seq=0 Win=26883 Len=0 MSS=8961 SACK_PERM=1 TSval=9612669 TSecr=0 WS=128
  6   0.004559 54.230.158.139 -> 172.31.29.138 TCP 74 http > 59006 [SYN, ACK] Seq=0 Ack=1 Win=14480 Len=0 MSS=1460 SACK_PERM=1 TSval=834996181 TSecr=9612669 WS=128
  7   0.004572 172.31.29.138 -> 54.230.158.139 TCP 66 59006 > http [ACK] Seq=1 Ack=1 Win=27008 Len=0 TSval=9612669 TSecr=834996181
  8   0.004615 172.31.29.138 -> 54.230.158.139 HTTP 164 GET /100kb HTTP/1.1 
  9   0.005330 54.230.158.139 -> 172.31.29.138 TCP 66 http > 59006 [ACK] Seq=1 Ack=99 Win=14592 Len=0 TSval=834996181 TSecr=9612669
 10   0.008573 54.230.158.139 -> 172.31.29.138 TCP 14546 [TCP segment of a reassembled PDU]
 11   0.008585 172.31.29.138 -> 54.230.158.139 TCP 66 59006 > http [ACK] Seq=99 Ack=14481 Win=55936 Len=0 TSval=9612670 TSecr=834996182
 12   0.009328 54.230.158.139 -> 172.31.29.138 TCP 13098 [TCP segment of a reassembled PDU]
 13   0.009338 172.31.29.138 -> 54.230.158.139 TCP 66 59006 > http [ACK] Seq=99 Ack=27513 Win=81920 Len=0 TSval=9612670 TSecr=834996182
 14   0.010028 54.230.158.139 -> 172.31.29.138 TCP 7306 [TCP segment of a reassembled PDU]
 15   0.010035 172.31.29.138 -> 54.230.158.139 TCP 66 59006 > http [ACK] Seq=99 Ack=34753 Win=96512 Len=0 TSval=9612670 TSecr=834996182
 16   0.010044 54.230.158.139 -> 172.31.29.138 TCP 5858 [TCP segment of a reassembled PDU]
 17   0.010049 172.31.29.138 -> 54.230.158.139 TCP 66 59006 > http [ACK] Seq=99 Ack=40545 Win=96512 Len=0 TSval=9612670 TSecr=834996182
 18   0.010791 54.230.158.139 -> 172.31.29.138 TCP 2962 [TCP segment of a reassembled PDU]
 19   0.010804 172.31.29.138 -> 54.230.158.139 TCP 66 59006 > http [ACK] Seq=99 Ack=43441 Win=109056 Len=0 TSval=9612671 TSecr=834996182
 20   0.010908 54.230.158.139 -> 172.31.29.138 TCP 17442 [TCP segment of a reassembled PDU]
 21   0.010919 172.31.29.138 -> 54.230.158.139 TCP 66 59006 > http [ACK] Seq=99 Ack=60817 Win=143872 Len=0 TSval=9612671 TSecr=834996182
 22   0.011577 54.230.158.139 -> 172.31.29.138 TCP 2962 [TCP segment of a reassembled PDU]
 23   0.011583 172.31.29.138 -> 54.230.158.139 TCP 66 59006 > http [ACK] Seq=99 Ack=63713 Win=149632 Len=0 TSval=9612671 TSecr=834996182
 24   0.011713 54.230.158.139 -> 172.31.29.138 TCP 15994 [TCP segment of a reassembled PDU]
 25   0.011723 172.31.29.138 -> 54.230.158.139 TCP 66 59006 > http [ACK] Seq=99 Ack=79641 Win=172032 Len=0 TSval=9612671 TSecr=834996182
 26   0.012019 54.230.158.139 -> 172.31.29.138 TCP 8754 [TCP segment of a reassembled PDU]
 27   0.012026 172.31.29.138 -> 54.230.158.139 TCP 66 59006 > http [ACK] Seq=99 Ack=88329 Win=183936 Len=0 TSval=9612671 TSecr=834996182
 28   0.012314 54.230.158.139 -> 172.31.29.138 HTTP 14594 HTTP/1.1 200 OK  (application/octet-stream)
 29   0.012323 172.31.29.138 -> 54.230.158.139 TCP 66 59006 > http [ACK] Seq=99 Ack=102857 Win=172032 Len=0 TSval=9612671 TSecr=834996182
 30   0.012443 172.31.29.138 -> 54.230.158.139 TCP 66 59006 > http [FIN, ACK] Seq=99 Ack=102857 Win=198272 Len=0 TSval=9612671 TSecr=834996182
 31   0.013092 54.230.158.139 -> 172.31.29.138 TCP 66 http > 59006 [FIN, ACK] Seq=102857 Ack=100 Win=14592 Len=0 TSval=834996182 TSecr=9612671
 32   0.013101 172.31.29.138 -> 54.230.158.139 TCP 66 59006 > http [ACK] Seq=100 Ack=102858 Win=198272 Len=0 TSval=9612671 TSecr=834996182
