[Measurement for 100kb at 17:37:35 19.37.2014] 
Tshark:

  1   0.000000 172.31.29.138 -> 172.31.0.2   DNS 89 Standard query 0xa01b  A d1xvcg6dfvgaki.cloudfront.net
  2   0.000023 172.31.29.138 -> 172.31.0.2   DNS 89 Standard query 0x0754  AAAA d1xvcg6dfvgaki.cloudfront.net
  3   0.000606   172.31.0.2 -> 172.31.29.138 DNS 170 Standard query response 0x0754 
  4   0.000616   172.31.0.2 -> 172.31.29.138 DNS 217 Standard query response 0xa01b  A 54.230.158.193 A 54.230.158.223 A 54.230.158.252 A 54.230.159.8 A 54.230.159.132 A 54.192.159.170 A 54.230.158.179 A 54.230.158.186
  5   0.003857 172.31.29.138 -> 54.230.158.193 TCP 74 45668 > http [SYN] Seq=0 Win=26883 Len=0 MSS=8961 SACK_PERM=1 TSval=632010 TSecr=0 WS=128
  6   0.004444 54.230.158.193 -> 172.31.29.138 TCP 74 http > 45668 [SYN, ACK] Seq=0 Ack=1 Win=14480 Len=0 MSS=1460 SACK_PERM=1 TSval=831681098 TSecr=632010 WS=128
  7   0.004458 172.31.29.138 -> 54.230.158.193 TCP 66 45668 > http [ACK] Seq=1 Ack=1 Win=27008 Len=0 TSval=632010 TSecr=831681098
  8   0.004510 172.31.29.138 -> 54.230.158.193 HTTP 164 GET /100kb HTTP/1.1 
  9   0.004919 54.230.158.193 -> 172.31.29.138 TCP 66 http > 45668 [ACK] Seq=1 Ack=99 Win=14592 Len=0 TSval=831681098 TSecr=632010
 10   0.042275 54.230.158.193 -> 172.31.29.138 TCP 13098 [TCP segment of a reassembled PDU]
 11   0.042290 172.31.29.138 -> 54.230.158.193 TCP 66 45668 > http [ACK] Seq=99 Ack=13033 Win=52992 Len=0 TSval=632020 TSecr=831681102
 12   0.042998 54.230.158.193 -> 172.31.29.138 TCP 1514 [TCP segment of a reassembled PDU]
 13   0.043005 172.31.29.138 -> 54.230.158.193 TCP 66 45668 > http [ACK] Seq=99 Ack=14481 Win=55936 Len=0 TSval=632020 TSecr=831681102
 14   0.043046 54.230.158.193 -> 172.31.29.138 TCP 11650 [TCP segment of a reassembled PDU]
 15   0.043054 172.31.29.138 -> 54.230.158.193 TCP 66 45668 > http [ACK] Seq=99 Ack=26065 Win=79104 Len=0 TSval=632020 TSecr=831681102
 16   0.043836 54.230.158.193 -> 172.31.29.138 TCP 13098 [TCP segment of a reassembled PDU]
 17   0.043846 172.31.29.138 -> 54.230.158.193 TCP 66 45668 > http [ACK] Seq=99 Ack=39097 Win=96512 Len=0 TSval=632020 TSecr=831681102
 18   0.044517 54.230.158.193 -> 172.31.29.138 TCP 8754 [TCP segment of a reassembled PDU]
 19   0.044524 172.31.29.138 -> 54.230.158.193 TCP 66 45668 > http [ACK] Seq=99 Ack=47785 Win=103680 Len=0 TSval=632020 TSecr=831681102
 20   0.044572 54.230.158.193 -> 172.31.29.138 TCP 11650 [TCP segment of a reassembled PDU]
 21   0.044581 172.31.29.138 -> 54.230.158.193 TCP 66 45668 > http [ACK] Seq=99 Ack=59369 Win=98944 Len=0 TSval=632020 TSecr=831681102
 22   0.045269 54.230.158.193 -> 172.31.29.138 TCP 5858 [TCP segment of a reassembled PDU]
 23   0.045276 172.31.29.138 -> 54.230.158.193 TCP 66 45668 > http [ACK] Seq=99 Ack=65161 Win=108416 Len=0 TSval=632020 TSecr=831681102
 24   0.045329 54.230.158.193 -> 172.31.29.138 TCP 14546 [TCP segment of a reassembled PDU]
 25   0.045338 172.31.29.138 -> 54.230.158.193 TCP 66 45668 > http [ACK] Seq=99 Ack=79641 Win=94080 Len=0 TSval=632020 TSecr=831681102
 26   0.045356 54.230.158.193 -> 172.31.29.138 TCP 2962 [TCP segment of a reassembled PDU]
 27   0.045361 172.31.29.138 -> 54.230.158.193 TCP 66 45668 > http [ACK] Seq=99 Ack=82537 Win=91264 Len=0 TSval=632020 TSecr=831681102
 28   0.046047 54.230.158.193 -> 172.31.29.138 TCP 7306 [TCP segment of a reassembled PDU]
 29   0.046054 172.31.29.138 -> 54.230.158.193 TCP 66 45668 > http [ACK] Seq=99 Ack=89777 Win=105984 Len=0 TSval=632021 TSecr=831681102
 30   0.046132 54.230.158.193 -> 172.31.29.138 HTTP 13135 HTTP/1.1 200 OK  (application/octet-stream)
 31   0.046141 172.31.29.138 -> 54.230.158.193 TCP 66 45668 > http [ACK] Seq=99 Ack=102846 Win=135168 Len=0 TSval=632021 TSecr=831681102
 32   0.046282 172.31.29.138 -> 54.230.158.193 TCP 66 45668 > http [FIN, ACK] Seq=99 Ack=102846 Win=135168 Len=0 TSval=632021 TSecr=831681102
 33   0.047026 54.230.158.193 -> 172.31.29.138 TCP 66 http > 45668 [FIN, ACK] Seq=102846 Ack=100 Win=14592 Len=0 TSval=831681102 TSecr=632021
 34   0.047034 172.31.29.138 -> 54.230.158.193 TCP 66 45668 > http [ACK] Seq=100 Ack=102847 Win=135168 Len=0 TSval=632021 TSecr=831681102
