[Measurement for 100kb at 08:36:17 20.36.2014] 
Tshark:

  1   0.000000 172.31.29.138 -> 172.31.0.2   DNS 89 Standard query 0x0a82  A d1xvcg6dfvgaki.cloudfront.net
  2   0.000037 172.31.29.138 -> 172.31.0.2   DNS 89 Standard query 0x51f5  AAAA d1xvcg6dfvgaki.cloudfront.net
  3   0.000689   172.31.0.2 -> 172.31.29.138 DNS 217 Standard query response 0x0a82  A 54.192.157.142 A 54.192.159.75 A 54.192.159.168 A 54.192.159.174 A 54.230.158.135 A 54.230.158.153 A 54.230.159.7 A 54.230.159.124
  4   0.000700   172.31.0.2 -> 172.31.29.138 DNS 170 Standard query response 0x51f5 
  5   0.003845 172.31.29.138 -> 54.192.157.142 TCP 74 48693 > http [SYN] Seq=0 Win=26883 Len=0 MSS=8961 SACK_PERM=1 TSval=14112459 TSecr=0 WS=128
  6   0.004539 54.192.157.142 -> 172.31.29.138 TCP 74 http > 48693 [SYN, ACK] Seq=0 Ack=1 Win=14480 Len=0 MSS=1460 SACK_PERM=1 TSval=731895200 TSecr=14112459 WS=128
  7   0.004554 172.31.29.138 -> 54.192.157.142 TCP 66 48693 > http [ACK] Seq=1 Ack=1 Win=27008 Len=0 TSval=14112459 TSecr=731895200
  8   0.004605 172.31.29.138 -> 54.192.157.142 HTTP 164 GET /100kb HTTP/1.1 
  9   0.005317 54.192.157.142 -> 172.31.29.138 TCP 66 http > 48693 [ACK] Seq=1 Ack=99 Win=14592 Len=0 TSval=731895201 TSecr=14112459
 10   0.009758 54.192.157.142 -> 172.31.29.138 TCP 13098 [TCP segment of a reassembled PDU]
 11   0.009770 172.31.29.138 -> 54.192.157.142 TCP 66 48693 > http [ACK] Seq=99 Ack=13033 Win=52992 Len=0 TSval=14112460 TSecr=731895201
 12   0.010537 54.192.157.142 -> 172.31.29.138 TCP 13098 [TCP segment of a reassembled PDU]
 13   0.010563 172.31.29.138 -> 54.192.157.142 TCP 66 48693 > http [ACK] Seq=99 Ack=26065 Win=79104 Len=0 TSval=14112460 TSecr=731895201
 14   0.011267 54.192.157.142 -> 172.31.29.138 TCP 13098 [TCP segment of a reassembled PDU]
 15   0.011276 172.31.29.138 -> 54.192.157.142 TCP 66 48693 > http [ACK] Seq=99 Ack=39097 Win=96512 Len=0 TSval=14112460 TSecr=731895201
 16   0.012062 54.192.157.142 -> 172.31.29.138 TCP 13098 [TCP segment of a reassembled PDU]
 17   0.012087 172.31.29.138 -> 54.192.157.142 TCP 66 48693 > http [ACK] Seq=99 Ack=52129 Win=96512 Len=0 TSval=14112461 TSecr=731895201
 18   0.012907 54.192.157.142 -> 172.31.29.138 TCP 20338 [TCP segment of a reassembled PDU]
 19   0.012919 172.31.29.138 -> 54.192.157.142 TCP 66 48693 > http [ACK] Seq=99 Ack=72401 Win=145664 Len=0 TSval=14112461 TSecr=731895201
 20   0.013657 54.192.157.142 -> 172.31.29.138 TCP 21786 [TCP segment of a reassembled PDU]
 21   0.013669 172.31.29.138 -> 54.192.157.142 TCP 66 48693 > http [ACK] Seq=99 Ack=94121 Win=189184 Len=0 TSval=14112461 TSecr=731895201
 22   0.014344 54.192.157.142 -> 172.31.29.138 HTTP 8802 HTTP/1.1 200 OK  (application/octet-stream)
 23   0.014351 172.31.29.138 -> 54.192.157.142 TCP 66 48693 > http [ACK] Seq=99 Ack=102857 Win=206592 Len=0 TSval=14112461 TSecr=731895201
 24   0.014467 172.31.29.138 -> 54.192.157.142 TCP 66 48693 > http [FIN, ACK] Seq=99 Ack=102857 Win=206592 Len=0 TSval=14112461 TSecr=731895201
 25   0.015035 54.192.157.142 -> 172.31.29.138 TCP 66 http > 48693 [FIN, ACK] Seq=102857 Ack=100 Win=14592 Len=0 TSval=731895202 TSecr=14112461
 26   0.015043 172.31.29.138 -> 54.192.157.142 TCP 66 48693 > http [ACK] Seq=100 Ack=102858 Win=206592 Len=0 TSval=14112461 TSecr=731895202
