[Measurement for 100kb at 05:36:18 20.36.2014] 
Tshark:

  1   0.000000 172.31.29.138 -> 172.31.0.2   DNS 89 Standard query 0x8b5c  A d1xvcg6dfvgaki.cloudfront.net
  2   0.000022 172.31.29.138 -> 172.31.0.2   DNS 89 Standard query 0x0bb4  AAAA d1xvcg6dfvgaki.cloudfront.net
  3   0.000528   172.31.0.2 -> 172.31.29.138 DNS 217 Standard query response 0x8b5c  A 54.230.150.54 A 54.230.150.122 A 54.230.150.151 A 54.230.150.220 A 54.230.151.252 A 54.230.149.229 A 54.230.150.30 A 54.230.150.47
  4   0.000538   172.31.0.2 -> 172.31.29.138 DNS 170 Standard query response 0x0bb4 
  5   0.003905 172.31.29.138 -> 54.230.150.54 TCP 74 60886 > http [SYN] Seq=0 Win=26883 Len=0 MSS=8961 SACK_PERM=1 TSval=11412689 TSecr=0 WS=128
  6   0.005357 54.230.150.54 -> 172.31.29.138 TCP 74 http > 60886 [SYN, ACK] Seq=0 Ack=1 Win=14480 Len=0 MSS=1460 SACK_PERM=1 TSval=1454643242 TSecr=11412689 WS=128
  7   0.005372 172.31.29.138 -> 54.230.150.54 TCP 66 60886 > http [ACK] Seq=1 Ack=1 Win=27008 Len=0 TSval=11412689 TSecr=1454643242
  8   0.005412 172.31.29.138 -> 54.230.150.54 HTTP 164 GET /100kb HTTP/1.1 
  9   0.006728 54.230.150.54 -> 172.31.29.138 TCP 66 http > 60886 [ACK] Seq=1 Ack=99 Win=14592 Len=0 TSval=1454643242 TSecr=11412689
 10   0.011590 54.230.150.54 -> 172.31.29.138 TCP 522 [TCP segment of a reassembled PDU]
 11   0.011599 172.31.29.138 -> 54.230.150.54 TCP 66 60886 > http [ACK] Seq=99 Ack=457 Win=28032 Len=0 TSval=11412691 TSecr=1454643242
 12   0.011864 54.230.150.54 -> 172.31.29.138 TCP 7306 [TCP segment of a reassembled PDU]
 13   0.011874 172.31.29.138 -> 54.230.150.54 TCP 66 60886 > http [ACK] Seq=99 Ack=7697 Win=42496 Len=0 TSval=11412691 TSecr=1454643242
 14   0.011897 54.230.150.54 -> 172.31.29.138 TCP 5858 [TCP segment of a reassembled PDU]
 15   0.011903 172.31.29.138 -> 54.230.150.54 TCP 66 60886 > http [ACK] Seq=99 Ack=13489 Win=54144 Len=0 TSval=11412691 TSecr=1454643242
 16   0.013195 54.230.150.54 -> 172.31.29.138 TCP 13098 [TCP segment of a reassembled PDU]
 17   0.013204 172.31.29.138 -> 54.230.150.54 TCP 66 60886 > http [ACK] Seq=99 Ack=26521 Win=80128 Len=0 TSval=11412691 TSecr=1454643242
 18   0.014497 54.230.150.54 -> 172.31.29.138 TCP 8754 [TCP segment of a reassembled PDU]
 19   0.014504 172.31.29.138 -> 54.230.150.54 TCP 66 60886 > http [ACK] Seq=99 Ack=35209 Win=97536 Len=0 TSval=11412691 TSecr=1454643242
 20   0.014552 54.230.150.54 -> 172.31.29.138 TCP 11650 [TCP segment of a reassembled PDU]
 21   0.014560 172.31.29.138 -> 54.230.150.54 TCP 66 60886 > http [ACK] Seq=99 Ack=46793 Win=98944 Len=0 TSval=11412691 TSecr=1454643242
 22   0.015970 54.230.150.54 -> 172.31.29.138 TCP 8754 [TCP segment of a reassembled PDU]
 23   0.015978 172.31.29.138 -> 54.230.150.54 TCP 66 60886 > http [ACK] Seq=99 Ack=55481 Win=103680 Len=0 TSval=11412692 TSecr=1454643243
 24   0.016024 54.230.150.54 -> 172.31.29.138 TCP 10202 [TCP segment of a reassembled PDU]
 25   0.016044 172.31.29.138 -> 54.230.150.54 TCP 66 60886 > http [ACK] Seq=99 Ack=65617 Win=129280 Len=0 TSval=11412692 TSecr=1454643243
 26   0.017234 54.230.150.54 -> 172.31.29.138 TCP 4410 [TCP segment of a reassembled PDU]
 27   0.017240 172.31.29.138 -> 54.230.150.54 TCP 66 60886 > http [ACK] Seq=99 Ack=69961 Win=137984 Len=0 TSval=11412692 TSecr=1454643243
 28   0.017351 54.230.150.54 -> 172.31.29.138 TCP 18890 [TCP segment of a reassembled PDU]
 29   0.017362 172.31.29.138 -> 54.230.150.54 TCP 66 60886 > http [ACK] Seq=99 Ack=88785 Win=175616 Len=0 TSval=11412692 TSecr=1454643243
 30   0.017369 54.230.150.54 -> 172.31.29.138 TCP 1514 [TCP segment of a reassembled PDU]
 31   0.017376 172.31.29.138 -> 54.230.150.54 TCP 66 60886 > http [ACK] Seq=99 Ack=90233 Win=178560 Len=0 TSval=11412692 TSecr=1454643243
 32   0.017381 54.230.150.54 -> 172.31.29.138 TCP 1514 [TCP segment of a reassembled PDU]
 33   0.017383 172.31.29.138 -> 54.230.150.54 TCP 66 60886 > http [ACK] Seq=99 Ack=91681 Win=181504 Len=0 TSval=11412692 TSecr=1454643243
 34   0.018786 54.230.150.54 -> 172.31.29.138 TCP 8754 [TCP segment of a reassembled PDU]
 35   0.018796 172.31.29.138 -> 54.230.150.54 TCP 66 60886 > http [ACK] Seq=99 Ack=100369 Win=198784 Len=0 TSval=11412692 TSecr=1454643243
 36   0.018855 54.230.150.54 -> 172.31.29.138 HTTP 2554 HTTP/1.1 200 OK  (application/octet-stream)
 37   0.018861 172.31.29.138 -> 54.230.150.54 TCP 66 60886 > http [ACK] Seq=99 Ack=102857 Win=203776 Len=0 TSval=11412692 TSecr=1454643243
 38   0.018995 172.31.29.138 -> 54.230.150.54 TCP 66 60886 > http [FIN, ACK] Seq=99 Ack=102857 Win=203776 Len=0 TSval=11412692 TSecr=1454643243
 39   0.020281 54.230.150.54 -> 172.31.29.138 TCP 66 http > 60886 [FIN, ACK] Seq=102857 Ack=100 Win=14592 Len=0 TSval=1454643243 TSecr=11412692
 40   0.020289 172.31.29.138 -> 54.230.150.54 TCP 66 60886 > http [ACK] Seq=100 Ack=102858 Win=203776 Len=0 TSval=11412693 TSecr=1454643243
