[Measurement for 100kb at 18:36:16 19.36.2014] 
Tshark:

  1   0.000000 172.31.29.138 -> 172.31.0.2   DNS 89 Standard query 0x5d38  A d1xvcg6dfvgaki.cloudfront.net
  2   0.000030 172.31.29.138 -> 172.31.0.2   DNS 89 Standard query 0x218e  AAAA d1xvcg6dfvgaki.cloudfront.net
  3   0.000715   172.31.0.2 -> 172.31.29.138 DNS 217 Standard query response 0x5d38  A 54.230.159.6 A 54.240.168.150 A 54.192.156.106 A 54.192.157.141 A 54.192.159.157 A 54.230.156.193 A 54.230.158.148 A 54.230.158.223
  4   0.000725   172.31.0.2 -> 172.31.29.138 DNS 170 Standard query response 0x218e 
  5   0.003852 172.31.29.138 -> 54.230.159.6 TCP 74 46680 > http [SYN] Seq=0 Win=26883 Len=0 MSS=8961 SACK_PERM=1 TSval=1512432 TSecr=0 WS=128
  6   0.004709 54.230.159.6 -> 172.31.29.138 TCP 74 http > 46680 [SYN, ACK] Seq=0 Ack=1 Win=14480 Len=0 MSS=1460 SACK_PERM=1 TSval=726855157 TSecr=1512432 WS=128
  7   0.004724 172.31.29.138 -> 54.230.159.6 TCP 66 46680 > http [ACK] Seq=1 Ack=1 Win=27008 Len=0 TSval=1512432 TSecr=726855157
  8   0.004767 172.31.29.138 -> 54.230.159.6 HTTP 164 GET /100kb HTTP/1.1 
  9   0.005480 54.230.159.6 -> 172.31.29.138 TCP 66 http > 46680 [ACK] Seq=1 Ack=99 Win=14592 Len=0 TSval=726855157 TSecr=1512432
 10   0.010404 54.230.159.6 -> 172.31.29.138 TCP 13098 [TCP segment of a reassembled PDU]
 11   0.010417 172.31.29.138 -> 54.230.159.6 TCP 66 46680 > http [ACK] Seq=99 Ack=13033 Win=52992 Len=0 TSval=1512433 TSecr=726855157
 12   0.010426 54.230.159.6 -> 172.31.29.138 TCP 1514 [TCP segment of a reassembled PDU]
 13   0.010438 172.31.29.138 -> 54.230.159.6 TCP 66 46680 > http [ACK] Seq=99 Ack=14481 Win=55936 Len=0 TSval=1512433 TSecr=726855158
 14   0.011125 54.230.159.6 -> 172.31.29.138 TCP 8754 [TCP segment of a reassembled PDU]
 15   0.011134 172.31.29.138 -> 54.230.159.6 TCP 66 46680 > http [ACK] Seq=99 Ack=23169 Win=73344 Len=0 TSval=1512433 TSecr=726855158
 16   0.011144 54.230.159.6 -> 172.31.29.138 TCP 4410 [TCP segment of a reassembled PDU]
 17   0.011149 172.31.29.138 -> 54.230.159.6 TCP 66 46680 > http [ACK] Seq=99 Ack=27513 Win=81920 Len=0 TSval=1512433 TSecr=726855158
 18   0.011892 54.230.159.6 -> 172.31.29.138 TCP 13098 [TCP segment of a reassembled PDU]
 19   0.011901 172.31.29.138 -> 54.230.159.6 TCP 66 46680 > http [ACK] Seq=99 Ack=40545 Win=96512 Len=0 TSval=1512434 TSecr=726855158
 20   0.011919 54.230.159.6 -> 172.31.29.138 TCP 7306 [TCP segment of a reassembled PDU]
 21   0.011934 172.31.29.138 -> 54.230.159.6 TCP 66 46680 > http [ACK] Seq=99 Ack=47785 Win=89344 Len=0 TSval=1512434 TSecr=726855158
 22   0.012666 54.230.159.6 -> 172.31.29.138 TCP 10202 [TCP segment of a reassembled PDU]
 23   0.012674 172.31.29.138 -> 54.230.159.6 TCP 66 46680 > http [ACK] Seq=99 Ack=57921 Win=128256 Len=0 TSval=1512434 TSecr=726855158
 24   0.012770 54.230.159.6 -> 172.31.29.138 TCP 13098 [TCP segment of a reassembled PDU]
 25   0.012779 172.31.29.138 -> 54.230.159.6 TCP 66 46680 > http [ACK] Seq=99 Ack=70953 Win=154368 Len=0 TSval=1512434 TSecr=726855158
 26   0.013445 54.230.159.6 -> 172.31.29.138 TCP 2962 [TCP segment of a reassembled PDU]
 27   0.013450 172.31.29.138 -> 54.230.159.6 TCP 66 46680 > http [ACK] Seq=99 Ack=73849 Win=160128 Len=0 TSval=1512434 TSecr=726855158
 28   0.013586 54.230.159.6 -> 172.31.29.138 TCP 23234 [TCP segment of a reassembled PDU]
 29   0.013599 172.31.29.138 -> 54.230.159.6 TCP 66 46680 > http [ACK] Seq=99 Ack=97017 Win=160128 Len=0 TSval=1512434 TSecr=726855158
 30   0.014220 54.230.159.6 -> 172.31.29.138 TCP 5858 [TCP segment of a reassembled PDU]
 31   0.014227 172.31.29.138 -> 54.230.159.6 TCP 66 46680 > http [ACK] Seq=99 Ack=102809 Win=171776 Len=0 TSval=1512434 TSecr=726855158
 32   0.014233 54.230.159.6 -> 172.31.29.138 HTTP 113 HTTP/1.1 200 OK  (application/octet-stream)
 33   0.014234 172.31.29.138 -> 54.230.159.6 TCP 66 46680 > http [ACK] Seq=99 Ack=102856 Win=171776 Len=0 TSval=1512434 TSecr=726855158
 34   0.014356 172.31.29.138 -> 54.230.159.6 TCP 66 46680 > http [FIN, ACK] Seq=99 Ack=102856 Win=171776 Len=0 TSval=1512434 TSecr=726855158
 35   0.014930 54.230.159.6 -> 172.31.29.138 TCP 66 http > 46680 [FIN, ACK] Seq=102856 Ack=100 Win=14592 Len=0 TSval=726855158 TSecr=1512434
 36   0.014939 172.31.29.138 -> 54.230.159.6 TCP 66 46680 > http [ACK] Seq=100 Ack=102857 Win=171776 Len=0 TSval=1512434 TSecr=726855158
