[Measurement for 100kb at 22:36:17 19.36.2014] 
Tshark:

  1   0.000000 06:38:16:87:8c:c2 -> 06:4e:73:56:a6:a6 ARP 60 Who has 172.31.29.138?  Tell 172.31.16.1
  2   0.000017 06:4e:73:56:a6:a6 -> 06:38:16:87:8c:c2 ARP 42 172.31.29.138 is at 06:4e:73:56:a6:a6
  3   0.542777 172.31.29.138 -> 172.31.0.2   DNS 89 Standard query 0x4d6a  A d1xvcg6dfvgaki.cloudfront.net
  4   0.542796 172.31.29.138 -> 172.31.0.2   DNS 89 Standard query 0xf7e3  AAAA d1xvcg6dfvgaki.cloudfront.net
  5   0.543445   172.31.0.2 -> 172.31.29.138 DNS 217 Standard query response 0x4d6a  A 54.230.156.193 A 54.230.158.139 A 54.230.158.182 A 54.230.158.223 A 54.230.159.4 A 54.230.159.7 A 54.230.159.153 A 54.192.157.144
  6   0.543456   172.31.0.2 -> 172.31.29.138 DNS 170 Standard query response 0xf7e3 
  7   0.546644 172.31.29.138 -> 54.230.156.193 TCP 74 38888 > http [SYN] Seq=0 Win=26883 Len=0 MSS=8961 SACK_PERM=1 TSval=5112553 TSecr=0 WS=128
  8   0.547405 54.230.156.193 -> 172.31.29.138 TCP 74 http > 38888 [SYN, ACK] Seq=0 Ack=1 Win=14480 Len=0 MSS=1460 SACK_PERM=1 TSval=839450723 TSecr=5112553 WS=128
  9   0.547419 172.31.29.138 -> 54.230.156.193 TCP 66 38888 > http [ACK] Seq=1 Ack=1 Win=27008 Len=0 TSval=5112553 TSecr=839450723
 10   0.547460 172.31.29.138 -> 54.230.156.193 HTTP 164 GET /100kb HTTP/1.1 
 11   0.548092 54.230.156.193 -> 172.31.29.138 TCP 66 http > 38888 [ACK] Seq=1 Ack=99 Win=14592 Len=0 TSval=839450724 TSecr=5112553
 12   0.550225 54.230.156.193 -> 172.31.29.138 TCP 522 [TCP segment of a reassembled PDU]
 13   0.550233 172.31.29.138 -> 54.230.156.193 TCP 66 38888 > http [ACK] Seq=99 Ack=457 Win=28032 Len=0 TSval=5112554 TSecr=839450724
 14   0.550280 54.230.156.193 -> 172.31.29.138 TCP 13098 [TCP segment of a reassembled PDU]
 15   0.550289 172.31.29.138 -> 54.230.156.193 TCP 66 38888 > http [ACK] Seq=99 Ack=13489 Win=54144 Len=0 TSval=5112554 TSecr=839450724
 16   0.551038 54.230.156.193 -> 172.31.29.138 TCP 13098 [TCP segment of a reassembled PDU]
 17   0.551048 172.31.29.138 -> 54.230.156.193 TCP 66 38888 > http [ACK] Seq=99 Ack=26521 Win=80128 Len=0 TSval=5112554 TSecr=839450724
 18   0.551719 54.230.156.193 -> 172.31.29.138 TCP 4410 [TCP segment of a reassembled PDU]
 19   0.551725 172.31.29.138 -> 54.230.156.193 TCP 66 38888 > http [ACK] Seq=99 Ack=30865 Win=88832 Len=0 TSval=5112554 TSecr=839450724
 20   0.551797 54.230.156.193 -> 172.31.29.138 TCP 8754 [TCP segment of a reassembled PDU]
 21   0.551805 172.31.29.138 -> 54.230.156.193 TCP 66 38888 > http [ACK] Seq=99 Ack=39553 Win=103680 Len=0 TSval=5112554 TSecr=839450724
 22   0.552491 54.230.156.193 -> 172.31.29.138 TCP 4410 [TCP segment of a reassembled PDU]
 23   0.552497 172.31.29.138 -> 54.230.156.193 TCP 66 38888 > http [ACK] Seq=99 Ack=43897 Win=109056 Len=0 TSval=5112554 TSecr=839450724
 24   0.552540 54.230.156.193 -> 172.31.29.138 TCP 8754 [TCP segment of a reassembled PDU]
 25   0.552561 172.31.29.138 -> 54.230.156.193 TCP 66 38888 > http [ACK] Seq=99 Ack=52585 Win=103680 Len=0 TSval=5112554 TSecr=839450724
 26   0.552597 54.230.156.193 -> 172.31.29.138 TCP 8754 [TCP segment of a reassembled PDU]
 27   0.552604 172.31.29.138 -> 54.230.156.193 TCP 66 38888 > http [ACK] Seq=99 Ack=61273 Win=103680 Len=0 TSval=5112554 TSecr=839450724
 28   0.553143 54.230.156.193 -> 172.31.29.138 TCP 4410 [TCP segment of a reassembled PDU]
 29   0.553149 172.31.29.138 -> 54.230.156.193 TCP 66 38888 > http [ACK] Seq=99 Ack=65617 Win=109056 Len=0 TSval=5112555 TSecr=839450724
 30   0.553225 54.230.156.193 -> 172.31.29.138 TCP 13098 [TCP segment of a reassembled PDU]
 31   0.553234 172.31.29.138 -> 54.230.156.193 TCP 66 38888 > http [ACK] Seq=99 Ack=78649 Win=135168 Len=0 TSval=5112555 TSecr=839450724
 32   0.553253 54.230.156.193 -> 172.31.29.138 TCP 8754 [TCP segment of a reassembled PDU]
 33   0.553259 172.31.29.138 -> 54.230.156.193 TCP 66 38888 > http [ACK] Seq=99 Ack=87337 Win=152448 Len=0 TSval=5112555 TSecr=839450724
 34   0.553936 54.230.156.193 -> 172.31.29.138 TCP 8754 [TCP segment of a reassembled PDU]
 35   0.553944 172.31.29.138 -> 54.230.156.193 TCP 66 38888 > http [ACK] Seq=99 Ack=96025 Win=169856 Len=0 TSval=5112555 TSecr=839450724
 36   0.554012 54.230.156.193 -> 172.31.29.138 HTTP 6898 HTTP/1.1 200 OK  (application/octet-stream)
 37   0.554019 172.31.29.138 -> 54.230.156.193 TCP 66 38888 > http [ACK] Seq=99 Ack=102857 Win=183552 Len=0 TSval=5112555 TSecr=839450724
 38   0.554135 172.31.29.138 -> 54.230.156.193 TCP 66 38888 > http [FIN, ACK] Seq=99 Ack=102857 Win=183552 Len=0 TSval=5112555 TSecr=839450724
 39   0.554659 54.230.156.193 -> 172.31.29.138 TCP 66 http > 38888 [FIN, ACK] Seq=102857 Ack=100 Win=14592 Len=0 TSval=839450724 TSecr=5112555
 40   0.554667 172.31.29.138 -> 54.230.156.193 TCP 66 38888 > http [ACK] Seq=100 Ack=102858 Win=183552 Len=0 TSval=5112555 TSecr=839450724
