[Measurement for 10kb at 04:03:59 17.03.2014] 
Tshark:

  1   0.000000  192.168.1.2 -> 54.230.99.53 TCP 66 50004→80 [SYN] Seq=0 Win=8192 Len=0 MSS=1460 WS=256 SACK_PERM=1
  2   0.049954 54.230.99.53 -> 192.168.1.2  TCP 66 80→50004 [SYN, ACK] Seq=0 Ack=1 Win=14600 Len=0 MSS=1400 SACK_PERM=1 WS=128
  3   0.050091  192.168.1.2 -> 54.230.99.53 TCP 54 50004→80 [ACK] Seq=1 Ack=1 Win=65792 Len=0
  4   0.060044  192.168.1.2 -> 54.230.99.53 HTTP 151 GET /10kb HTTP/1.1 
  5   0.104618 54.230.99.53 -> 192.168.1.2  TCP 54 80→50004 [ACK] Seq=1 Ack=98 Win=14720 Len=0
  6   0.140505 54.230.99.53 -> 192.168.1.2  TCP 1454 [TCP segment of a reassembled PDU]
  7   0.141454 54.230.99.53 -> 192.168.1.2  TCP 1454 [TCP segment of a reassembled PDU]
  8   0.141531  192.168.1.2 -> 54.230.99.53 TCP 54 50004→80 [ACK] Seq=98 Ack=2801 Win=65792 Len=0
  9   0.141660 54.230.99.53 -> 192.168.1.2  TCP 1454 [TCP segment of a reassembled PDU]
 10   0.141871 54.230.99.53 -> 192.168.1.2  TCP 1454 [TCP segment of a reassembled PDU]
 11   0.141933  192.168.1.2 -> 54.230.99.53 TCP 54 50004→80 [ACK] Seq=98 Ack=5601 Win=65792 Len=0
 12   0.142035 54.230.99.53 -> 192.168.1.2  TCP 1454 [TCP segment of a reassembled PDU]
 13   0.153230 54.230.99.53 -> 192.168.1.2  TCP 1454 [TCP segment of a reassembled PDU]
 14   0.153315  192.168.1.2 -> 54.230.99.53 TCP 54 50004→80 [ACK] Seq=98 Ack=8401 Win=65792 Len=0
 15   0.153421 54.230.99.53 -> 192.168.1.2  TCP 1454 [TCP segment of a reassembled PDU]
 16   0.153559 54.230.99.53 -> 192.168.1.2  HTTP 949 HTTP/1.1 200 OK  (application/octet-stream)
 17   0.153609  192.168.1.2 -> 54.230.99.53 TCP 54 50004→80 [ACK] Seq=98 Ack=10696 Win=65792 Len=0
 18   0.153772  192.168.1.2 -> 54.230.99.53 TCP 54 50004→80 [FIN, ACK] Seq=98 Ack=10696 Win=65792 Len=0
 19   0.189097 54.230.99.53 -> 192.168.1.2  TCP 54 80→50004 [FIN, ACK] Seq=10696 Ack=99 Win=14720 Len=0
 20   0.189241  192.168.1.2 -> 54.230.99.53 TCP 54 50004→80 [ACK] Seq=99 Ack=10697 Win=65792 Len=0
 21   1.154501  192.168.1.1 -> 239.255.255.250 SSDP 451 NOTIFY * HTTP/1.1 
