[Measurement for 10kb at 02:04:05 17.04.2014] 
Tshark:

  1   0.000000  192.168.1.2 -> 54.230.99.193 TCP 66 49807→80 [SYN] Seq=0 Win=8192 Len=0 MSS=1460 WS=256 SACK_PERM=1
  2   0.045326 54.230.99.193 -> 192.168.1.2  TCP 66 80→49807 [SYN, ACK] Seq=0 Ack=1 Win=14600 Len=0 MSS=1400 SACK_PERM=1 WS=128
  3   0.045453  192.168.1.2 -> 54.230.99.193 TCP 54 49807→80 [ACK] Seq=1 Ack=1 Win=65792 Len=0
  4   0.045808  192.168.1.2 -> 54.230.99.193 HTTP 151 GET /10kb HTTP/1.1 
  5   0.073244 54.230.99.193 -> 192.168.1.2  TCP 54 80→49807 [ACK] Seq=1 Ack=98 Win=14720 Len=0
  6   0.076304 54.230.99.193 -> 192.168.1.2  TCP 1454 [TCP segment of a reassembled PDU]
  7   0.079049 54.230.99.193 -> 192.168.1.2  TCP 1454 [TCP segment of a reassembled PDU]
  8   0.079177  192.168.1.2 -> 54.230.99.193 TCP 54 49807→80 [ACK] Seq=98 Ack=2801 Win=65792 Len=0
  9   0.083264 54.230.99.193 -> 192.168.1.2  TCP 1454 [TCP segment of a reassembled PDU]
 10   0.083323 54.230.99.193 -> 192.168.1.2  TCP 1454 [TCP segment of a reassembled PDU]
 11   0.083362  192.168.1.2 -> 54.230.99.193 TCP 54 49807→80 [ACK] Seq=98 Ack=5601 Win=65792 Len=0
 12   0.083439 54.230.99.193 -> 192.168.1.2  TCP 1454 [TCP segment of a reassembled PDU]
 13   0.083504 54.230.99.193 -> 192.168.1.2  TCP 1454 [TCP segment of a reassembled PDU]
 14   0.083539  192.168.1.2 -> 54.230.99.193 TCP 54 49807→80 [ACK] Seq=98 Ack=8401 Win=65792 Len=0
 15   0.083610 54.230.99.193 -> 192.168.1.2  TCP 1454 [TCP segment of a reassembled PDU]
 16   0.083638 54.230.99.193 -> 192.168.1.2  HTTP 949 HTTP/1.1 200 OK  (application/octet-stream)
 17   0.083663  192.168.1.2 -> 54.230.99.193 TCP 54 49807→80 [ACK] Seq=98 Ack=10696 Win=65792 Len=0
 18   0.083847  192.168.1.2 -> 54.230.99.193 TCP 54 49807→80 [FIN, ACK] Seq=98 Ack=10696 Win=65792 Len=0
 19   0.112594 54.230.99.193 -> 192.168.1.2  TCP 54 80→49807 [FIN, ACK] Seq=10696 Ack=99 Win=14720 Len=0
 20   0.112723  192.168.1.2 -> 54.230.99.193 TCP 54 49807→80 [ACK] Seq=99 Ack=10697 Win=65792 Len=0
