[Measurement for 10kb at 05:02:09 17.02.2014] 
Tshark:

  1   0.000000  192.168.1.2 -> 64.233.164.125 TCP 76 [TCP segment of a reassembled PDU]
  2   0.063256 64.233.164.125 -> 192.168.1.2  TCP 54 5222→49965 [ACK] Seq=1 Ack=23 Win=557 Len=0
  3   0.276350  192.168.1.2 -> 54.230.98.195 TCP 66 50085→80 [SYN] Seq=0 Win=8192 Len=0 MSS=1460 WS=256 SACK_PERM=1
  4   0.329003 54.230.98.195 -> 192.168.1.2  TCP 66 80→50085 [SYN, ACK] Seq=0 Ack=1 Win=14600 Len=0 MSS=1400 SACK_PERM=1 WS=128
  5   0.329123  192.168.1.2 -> 54.230.98.195 TCP 54 50085→80 [ACK] Seq=1 Ack=1 Win=65792 Len=0
  6   0.329416  192.168.1.2 -> 54.230.98.195 HTTP 151 GET /10kb HTTP/1.1 
  7   0.356780 54.230.98.195 -> 192.168.1.2  TCP 54 80→50085 [ACK] Seq=1 Ack=98 Win=14720 Len=0
  8   0.362114 54.230.98.195 -> 192.168.1.2  TCP 1454 [TCP segment of a reassembled PDU]
  9   0.363794 54.230.98.195 -> 192.168.1.2  TCP 1454 [TCP segment of a reassembled PDU]
 10   0.363875  192.168.1.2 -> 54.230.98.195 TCP 54 50085→80 [ACK] Seq=98 Ack=2801 Win=65792 Len=0
 11   0.364022 54.230.98.195 -> 192.168.1.2  TCP 1454 [TCP segment of a reassembled PDU]
 12   0.364064 54.230.98.195 -> 192.168.1.2  TCP 1454 [TCP segment of a reassembled PDU]
 13   0.364111  192.168.1.2 -> 54.230.98.195 TCP 54 50085→80 [ACK] Seq=98 Ack=5601 Win=65792 Len=0
 14   0.364197 54.230.98.195 -> 192.168.1.2  TCP 1454 [TCP segment of a reassembled PDU]
 15   0.364237 54.230.98.195 -> 192.168.1.2  TCP 1454 [TCP segment of a reassembled PDU]
 16   0.364283  192.168.1.2 -> 54.230.98.195 TCP 54 50085→80 [ACK] Seq=98 Ack=8401 Win=65792 Len=0
 17   0.364373 54.230.98.195 -> 192.168.1.2  TCP 1454 [TCP segment of a reassembled PDU]
 18   0.364406 54.230.98.195 -> 192.168.1.2  HTTP 949 HTTP/1.1 200 OK  (application/octet-stream)
 19   0.364436  192.168.1.2 -> 54.230.98.195 TCP 54 50085→80 [ACK] Seq=98 Ack=10696 Win=65792 Len=0
 20   0.364684  192.168.1.2 -> 54.230.98.195 TCP 54 50085→80 [FIN, ACK] Seq=98 Ack=10696 Win=65792 Len=0
 21   0.401876 54.230.98.195 -> 192.168.1.2  TCP 54 80→50085 [FIN, ACK] Seq=10696 Ack=99 Win=14720 Len=0
 22   0.402008  192.168.1.2 -> 54.230.98.195 TCP 54 50085→80 [ACK] Seq=99 Ack=10697 Win=65792 Len=0
