[Measurement for 1kb at 11:02:32 17.02.2014] 
Tshark:

  1   0.000000  192.168.1.2 -> 64.233.164.125 TCP 76 [TCP segment of a reassembled PDU]
  2   0.053419 64.233.164.125 -> 192.168.1.2  TCP 54 5222→50147 [ACK] Seq=1 Ack=23 Win=1180 Len=0
  3   1.231810  192.168.1.2 -> 54.230.98.197 TCP 66 52523→80 [SYN] Seq=0 Win=8192 Len=0 MSS=1460 WS=256 SACK_PERM=1
  4   1.288566 54.230.98.197 -> 192.168.1.2  TCP 66 80→52523 [SYN, ACK] Seq=0 Ack=1 Win=14600 Len=0 MSS=1400 SACK_PERM=1 WS=128
  5   1.288712  192.168.1.2 -> 54.230.98.197 TCP 54 52523→80 [ACK] Seq=1 Ack=1 Win=65792 Len=0
  6   1.288895  192.168.1.2 -> 54.230.98.197 HTTP 150 GET /1kb HTTP/1.1 
  7   1.316582 54.230.98.197 -> 192.168.1.2  TCP 54 80→52523 [ACK] Seq=1 Ack=97 Win=14720 Len=0
  8   1.322317 54.230.98.197 -> 192.168.1.2  TCP 1454 [TCP segment of a reassembled PDU]
  9   1.323229 54.230.98.197 -> 192.168.1.2  HTTP 132 HTTP/1.1 200 OK  (application/octet-stream)
 10   1.323300  192.168.1.2 -> 54.230.98.197 TCP 54 52523→80 [ACK] Seq=97 Ack=1479 Win=65792 Len=0
 11   1.323435  192.168.1.2 -> 54.230.98.197 TCP 54 52523→80 [FIN, ACK] Seq=97 Ack=1479 Win=65792 Len=0
 12   1.350797 54.230.98.197 -> 192.168.1.2  TCP 54 80→52523 [FIN, ACK] Seq=1479 Ack=98 Win=14720 Len=0
 13   1.350949  192.168.1.2 -> 54.230.98.197 TCP 54 52523→80 [ACK] Seq=98 Ack=1480 Win=65792 Len=0
 14   1.395929  54.231.2.32 -> 192.168.1.2  TCP 54 443→52522 [FIN, ACK] Seq=1 Ack=1 Win=280 Len=0
 15   1.396007  192.168.1.2 -> 54.231.2.32  TCP 54 52522→443 [ACK] Seq=1 Ack=2 Win=255 Len=0
 16   2.127691 fe80::446a:b521:8794:ef65 -> fe80::5ef9:6aff:fe25:83d4 DNS 99 Standard query 0xe071  A accounts.google.com
 17   2.178918 fe80::5ef9:6aff:fe25:83d4 -> fe80::446a:b521:8794:ef65 DNS 140 Standard query response 0xe071  CNAME accounts.l.google.com A 64.233.164.84
 18   2.180047  192.168.1.2 -> 64.233.164.84 TCP 66 52524→443 [SYN] Seq=0 Win=8192 Len=0 MSS=1460 WS=256 SACK_PERM=1
 19   2.213401 64.233.164.84 -> 192.168.1.2  TCP 66 443→52524 [SYN, ACK] Seq=0 Ack=1 Win=42900 Len=0 MSS=1400 SACK_PERM=1 WS=128
 20   2.213505  192.168.1.2 -> 64.233.164.84 TCP 54 52524→443 [ACK] Seq=1 Ack=1 Win=65792 Len=0
 21   2.213957  192.168.1.2 -> 64.233.164.84 SSL 571 Client Hello
 22   2.260599 64.233.164.84 -> 192.168.1.2  TCP 54 443→52524 [ACK] Seq=1 Ack=518 Win=44032 Len=0
 23   2.262197 64.233.164.84 -> 192.168.1.2  TLSv1.2 198 Server Hello, Change Cipher Spec, Encrypted Handshake Message
 24   2.262938  192.168.1.2 -> 64.233.164.84 TLSv1.2 97 Change Cipher Spec, Encrypted Handshake Message
 25   2.278272  192.168.1.2 -> 64.233.164.84 TLSv1.2 103 Application Data
 26   2.278498  192.168.1.2 -> 64.233.164.84 TLSv1.2 91 Application Data
 27   2.278650  192.168.1.2 -> 64.233.164.84 TLSv1.2 111 Application Data
 28   2.279369  192.168.1.2 -> 64.233.164.84 TLSv1.2 396 Application Data
 29   2.279555  192.168.1.2 -> 64.233.164.84 TLSv1.2 255 Application Data
 30   2.296791 64.233.164.84 -> 192.168.1.2  TLSv1.2 103 Application Data
 31   2.298288 64.233.164.84 -> 192.168.1.2  TLSv1.2 91 Application Data
 32   2.298331  192.168.1.2 -> 64.233.164.84 TCP 54 52524→443 [ACK] Seq=1247 Ack=231 Win=65536 Len=0
 33   2.313103 64.233.164.84 -> 192.168.1.2  TCP 54 443→52524 [ACK] Seq=231 Ack=647 Win=44032 Len=0
 34   2.325369 64.233.164.84 -> 192.168.1.2  TCP 54 443→52524 [ACK] Seq=231 Ack=1247 Win=46208 Len=0
 35   2.347897 64.233.164.84 -> 192.168.1.2  TLSv1.2 382 Application Data
 36   2.349546 64.233.164.84 -> 192.168.1.2  TLSv1.2 220 Application Data
 37   2.349548 64.233.164.84 -> 192.168.1.2  TLSv1.2 93 Application Data
 38   2.349548 64.233.164.84 -> 192.168.1.2  TLSv1.2 87 Application Data
 39   2.349615  192.168.1.2 -> 64.233.164.84 TCP 54 52524→443 [ACK] Seq=1247 Ack=797 Win=64768 Len=0
 40   2.349883  192.168.1.2 -> 64.233.164.84 TLSv1.2 87 Application Data
 41   2.362153 fe80::446a:b521:8794:ef65 -> fe80::5ef9:6aff:fe25:83d4 DNS 98 Standard query 0xcead  A www.googleapis.com
 42   2.389849 fe80::5ef9:6aff:fe25:83d4 -> fe80::446a:b521:8794:ef65 DNS 148 Standard query response 0xcead  CNAME googleapis.l.google.com A 64.233.164.95
 43   2.391491  192.168.1.2 -> 64.233.164.95 TLSv1.2 329 Application Data
 44   2.391706  192.168.1.2 -> 64.233.164.95 TLSv1.2 87 Application Data
 45   2.391870  192.168.1.2 -> 64.233.164.95 TLSv1.2 250 Application Data
 46   2.425086 64.233.164.84 -> 192.168.1.2  TCP 54 443→52524 [ACK] Seq=797 Ack=1280 Win=46208 Len=0
 47   2.431396 64.233.164.95 -> 192.168.1.2  TCP 54 443→52486 [ACK] Seq=1 Ack=276 Win=369 Len=0
