[Measurement for 10mb at 11:31:30 20.31.2014] 
Tshark:

  1   0.000000 172.31.36.109 -> 172.31.0.2   DNS 89 Standard query 0xf744  A d1xvcg6dfvgaki.cloudfront.net
  2   0.000033 172.31.36.109 -> 172.31.0.2   DNS 89 Standard query 0x2564  AAAA d1xvcg6dfvgaki.cloudfront.net
  3   0.000524   172.31.0.2 -> 172.31.36.109 DNS 170 Standard query response 0x2564 
  4   0.000537   172.31.0.2 -> 172.31.36.109 DNS 217 Standard query response 0xf744  A 216.137.41.10 A 216.137.41.101 A 216.137.41.193 A 216.137.41.237 A 54.230.21.2 A 54.230.21.79 A 54.230.23.43 A 54.230.23.144
  5   0.003898 172.31.36.109 -> 216.137.41.10 TCP 74 41011 > http [SYN] Seq=0 Win=26883 Len=0 MSS=8961 SACK_PERM=1 TSval=36694264 TSecr=0 WS=128
  6   0.091138 216.137.41.10 -> 172.31.36.109 TCP 74 http > 41011 [SYN, ACK] Seq=0 Ack=1 Win=14480 Len=0 MSS=1460 SACK_PERM=1 TSval=834065998 TSecr=36694264 WS=128
  7   0.091154 172.31.36.109 -> 216.137.41.10 TCP 66 41011 > http [ACK] Seq=1 Ack=1 Win=27008 Len=0 TSval=36694286 TSecr=834065998
  8   0.091199 172.31.36.109 -> 216.137.41.10 HTTP 163 GET /10mb HTTP/1.1 
  9   0.178404 216.137.41.10 -> 172.31.36.109 TCP 66 http > 41011 [ACK] Seq=1 Ack=98 Win=14592 Len=0 TSval=834066007 TSecr=36694286
 10   0.182977 216.137.41.10 -> 172.31.36.109 TCP 1514 [TCP segment of a reassembled PDU]
 11   0.182986 172.31.36.109 -> 216.137.41.10 TCP 66 41011 > http [ACK] Seq=98 Ack=1449 Win=29824 Len=0 TSval=36694309 TSecr=834066007
 12   0.183008 216.137.41.10 -> 172.31.36.109 TCP 5476 [TCP segment of a reassembled PDU]
 13   0.183014 172.31.36.109 -> 216.137.41.10 TCP 66 41011 > http [ACK] Seq=98 Ack=6859 Win=40704 Len=0 TSval=36694309 TSecr=834066007
 14   0.183021 216.137.41.10 -> 172.31.36.109 TCP 7306 [TCP segment of a reassembled PDU]
 15   0.183026 172.31.36.109 -> 216.137.41.10 TCP 66 41011 > http [ACK] Seq=98 Ack=14099 Win=55168 Len=0 TSval=36694309 TSecr=834066007
 16   0.270450 216.137.41.10 -> 172.31.36.109 TCP 13098 [TCP segment of a reassembled PDU]
 17   0.270462 172.31.36.109 -> 216.137.41.10 TCP 66 41011 > http [ACK] Seq=98 Ack=27131 Win=81152 Len=0 TSval=36694330 TSecr=834066016
 18   0.357715 216.137.41.10 -> 172.31.36.109 TCP 17442 [TCP segment of a reassembled PDU]
 19   0.357727 172.31.36.109 -> 216.137.41.10 TCP 66 41011 > http [ACK] Seq=98 Ack=44507 Win=89344 Len=0 TSval=36694352 TSecr=834066025
 20   0.357760 216.137.41.10 -> 172.31.36.109 TCP 2962 [TCP segment of a reassembled PDU]
 21   0.357766 172.31.36.109 -> 216.137.41.10 TCP 66 41011 > http [ACK] Seq=98 Ack=47403 Win=86528 Len=0 TSval=36694352 TSecr=834066025
 22   0.445211 216.137.41.10 -> 172.31.36.109 TCP 18890 [TCP segment of a reassembled PDU]
