[Measurement for 10mb at 20:31:34 19.31.2014] 
Tshark:

  1   0.000000 172.31.36.109 -> 172.31.0.2   DNS 89 Standard query 0x5dcd  A d1xvcg6dfvgaki.cloudfront.net
  2   0.000023 172.31.36.109 -> 172.31.0.2   DNS 89 Standard query 0x489d  AAAA d1xvcg6dfvgaki.cloudfront.net
  3   0.000481   172.31.0.2 -> 172.31.36.109 DNS 217 Standard query response 0x5dcd  A 54.230.195.137 A 54.239.152.230 A 54.230.192.159 A 54.230.193.45 A 54.230.193.113 A 54.230.194.18 A 54.230.194.150 A 54.230.194.212
  4   0.000491   172.31.0.2 -> 172.31.36.109 DNS 170 Standard query response 0x489d 
  5   0.003879 172.31.36.109 -> 54.230.195.137 TCP 74 45616 > http [SYN] Seq=0 Win=26883 Len=0 MSS=8961 SACK_PERM=1 TSval=23195239 TSecr=0 WS=128
  6   0.090778 54.230.195.137 -> 172.31.36.109 TCP 74 http > 45616 [SYN, ACK] Seq=0 Ack=1 Win=14480 Len=0 MSS=1460 SACK_PERM=1 TSval=3921004561 TSecr=23195239 WS=128
  7   0.090814 172.31.36.109 -> 54.230.195.137 TCP 66 45616 > http [ACK] Seq=1 Ack=1 Win=27008 Len=0 TSval=23195260 TSecr=3921004561
  8   0.090943 172.31.36.109 -> 54.230.195.137 HTTP 163 GET /10mb HTTP/1.1 
  9   0.177882 54.230.195.137 -> 172.31.36.109 TCP 66 http > 45616 [ACK] Seq=1 Ack=98 Win=14592 Len=0 TSval=3921004570 TSecr=23195260
 10   0.491966 54.230.195.137 -> 172.31.36.109 TCP 7437 [TCP segment of a reassembled PDU]
