[Measurement for 10mb at 22:31:29 19.31.2014] 
Tshark:

  1   0.000000 172.31.36.109 -> 172.31.0.2   DNS 89 Standard query 0x8a36  A d1xvcg6dfvgaki.cloudfront.net
  2   0.000028 172.31.36.109 -> 172.31.0.2   DNS 89 Standard query 0x686c  AAAA d1xvcg6dfvgaki.cloudfront.net
  3   0.000650   172.31.0.2 -> 172.31.36.109 DNS 217 Standard query response 0x8a36  A 54.230.30.232 A 54.230.30.240 A 54.230.31.6 A 54.230.30.4 A 54.230.30.41 A 54.230.30.59 A 54.230.30.73 A 54.230.30.206
  4   0.000661   172.31.0.2 -> 172.31.36.109 DNS 170 Standard query response 0x686c 
  5   0.003910 172.31.36.109 -> 54.230.30.232 TCP 74 49907 > http [SYN] Seq=0 Win=26883 Len=0 MSS=8961 SACK_PERM=1 TSval=24993901 TSecr=0 WS=128
  6   0.005180 54.230.30.232 -> 172.31.36.109 TCP 74 http > 49907 [SYN, ACK] Seq=0 Ack=1 Win=14480 Len=0 MSS=1460 SACK_PERM=1 TSval=665296529 TSecr=24993901 WS=128
  7   0.005194 172.31.36.109 -> 54.230.30.232 TCP 66 49907 > http [ACK] Seq=1 Ack=1 Win=27008 Len=0 TSval=24993902 TSecr=665296529
  8   0.005245 172.31.36.109 -> 54.230.30.232 HTTP 163 GET /10mb HTTP/1.1 
  9   0.006412 54.230.30.232 -> 172.31.36.109 TCP 66 http > 49907 [ACK] Seq=1 Ack=98 Win=14592 Len=0 TSval=665296529 TSecr=24993902
 10   0.030635 54.230.30.232 -> 172.31.36.109 TCP 524 [TCP segment of a reassembled PDU]
 11   0.030659 172.31.36.109 -> 54.230.30.232 TCP 66 49907 > http [ACK] Seq=98 Ack=459 Win=28032 Len=0 TSval=24993908 TSecr=665296531
 12   0.030676 54.230.30.232 -> 172.31.36.109 TCP 13098 [TCP segment of a reassembled PDU]
 13   0.030686 172.31.36.109 -> 54.230.30.232 TCP 66 49907 > http [ACK] Seq=98 Ack=13491 Win=54144 Len=0 TSval=24993908 TSecr=665296531
 14   0.032135 54.230.30.232 -> 172.31.36.109 TCP 13098 [TCP segment of a reassembled PDU]
 15   0.032144 172.31.36.109 -> 54.230.30.232 TCP 66 49907 > http [ACK] Seq=98 Ack=26523 Win=80128 Len=0 TSval=24993908 TSecr=665296532
 16   0.033361 54.230.30.232 -> 172.31.36.109 TCP 5858 [TCP segment of a reassembled PDU]
 17   0.033367 172.31.36.109 -> 54.230.30.232 TCP 66 49907 > http [ACK] Seq=98 Ack=32315 Win=91776 Len=0 TSval=24993909 TSecr=665296532
 18   0.033532 54.230.30.232 -> 172.31.36.109 TCP 1514 [TCP segment of a reassembled PDU]
 19   0.033537 172.31.36.109 -> 54.230.30.232 TCP 66 49907 > http [ACK] Seq=98 Ack=33763 Win=94592 Len=0 TSval=24993909 TSecr=665296532
 20   0.033587 54.230.30.232 -> 172.31.36.109 TCP 5858 [TCP segment of a reassembled PDU]
 21   0.033593 172.31.36.109 -> 54.230.30.232 TCP 66 49907 > http [ACK] Seq=98 Ack=39555 Win=106240 Len=0 TSval=24993909 TSecr=665296532
 22   0.034641 54.230.30.232 -> 172.31.36.109 TCP 11650 [TCP segment of a reassembled PDU]
 23   0.034649 172.31.36.109 -> 54.230.30.232 TCP 66 49907 > http [ACK] Seq=98 Ack=51139 Win=129408 Len=0 TSval=24993909 TSecr=665296532
 24   0.034665 54.230.30.232 -> 172.31.36.109 TCP 1514 [TCP segment of a reassembled PDU]
 25   0.034667 172.31.36.109 -> 54.230.30.232 TCP 66 49907 > http [ACK] Seq=98 Ack=52587 Win=132224 Len=0 TSval=24993909 TSecr=665296532
 26   0.034948 54.230.30.232 -> 172.31.36.109 TCP 10202 [TCP segment of a reassembled PDU]
 27   0.034956 172.31.36.109 -> 54.230.30.232 TCP 66 49907 > http [ACK] Seq=98 Ack=62723 Win=152576 Len=0 TSval=24993909 TSecr=665296532
 28   0.035893 54.230.30.232 -> 172.31.36.109 TCP 2636 [TCP segment of a reassembled PDU]
 29   0.035906 172.31.36.109 -> 54.230.30.232 TCP 66 49907 > http [ACK] Seq=98 Ack=65293 Win=157696 Len=0 TSval=24993909 TSecr=665296532
 30   0.043325 54.230.30.232 -> 172.31.36.109 TCP 5858 [TCP segment of a reassembled PDU]
 31   0.043332 172.31.36.109 -> 54.230.30.232 TCP 66 49907 > http [ACK] Seq=98 Ack=71085 Win=169216 Len=0 TSval=24993911 TSecr=665296533
 32   0.043520 54.230.30.232 -> 172.31.36.109 TCP 4410 [TCP segment of a reassembled PDU]
 33   0.043525 172.31.36.109 -> 54.230.30.232 TCP 66 49907 > http [ACK] Seq=98 Ack=75429 Win=177920 Len=0 TSval=24993911 TSecr=665296533
 34   0.043663 54.230.30.232 -> 172.31.36.109 TCP 14546 [TCP segment of a reassembled PDU]
 35   0.043685 172.31.36.109 -> 54.230.30.232 TCP 66 49907 > http [ACK] Seq=98 Ack=89909 Win=192384 Len=0 TSval=24993911 TSecr=665296533
 36   0.044874 54.230.30.232 -> 172.31.36.109 TCP 1514 [TCP segment of a reassembled PDU]
 37   0.044878 172.31.36.109 -> 54.230.30.232 TCP 66 49907 > http [ACK] Seq=98 Ack=91357 Win=209792 Len=0 TSval=24993912 TSecr=665296533
 38   0.044975 54.230.30.232 -> 172.31.36.109 TCP 1514 [TCP Previous segment not captured] [TCP segment of a reassembled PDU]
 39   0.044980 172.31.36.109 -> 54.230.30.232 TCP 78 [TCP Window Update] 49907 > http [ACK] Seq=98 Ack=91357 Win=212736 Len=0 TSval=24993912 TSecr=665296533 SLE=92805 SRE=94253
 40   0.044984 54.230.30.232 -> 172.31.36.109 TCP 1514 [TCP Out-Of-Order] [TCP segment of a reassembled PDU]
 41   0.044988 172.31.36.109 -> 54.230.30.232 TCP 66 49907 > http [ACK] Seq=98 Ack=94253 Win=211328 Len=0 TSval=24993912 TSecr=665296533
 42   0.045001 54.230.30.232 -> 172.31.36.109 TCP 14546 [TCP segment of a reassembled PDU]
 43   0.045008 172.31.36.109 -> 54.230.30.232 TCP 66 49907 > http [ACK] Seq=98 Ack=108733 Win=196864 Len=0 TSval=24993912 TSecr=665296533
 44   0.045227 54.230.30.232 -> 172.31.36.109 TCP 10202 [TCP segment of a reassembled PDU]
 45   0.045252 172.31.36.109 -> 54.230.30.232 TCP 66 49907 > http [ACK] Seq=98 Ack=118869 Win=199552 Len=0 TSval=24993912 TSecr=665296533
 46   0.046117 54.230.30.232 -> 172.31.36.109 TCP 2962 [TCP segment of a reassembled PDU]
 47   0.046122 172.31.36.109 -> 54.230.30.232 TCP 66 49907 > http [ACK] Seq=98 Ack=121765 Win=211456 Len=0 TSval=24993912 TSecr=665296533
 48   0.046175 54.230.30.232 -> 172.31.36.109 TCP 2962 [TCP segment of a reassembled PDU]
 49   0.046180 172.31.36.109 -> 54.230.30.232 TCP 66 49907 > http [ACK] Seq=98 Ack=124661 Win=211456 Len=0 TSval=24993912 TSecr=665296533
 50   0.046422 54.230.30.232 -> 172.31.36.109 TCP 6234 [TCP segment of a reassembled PDU]
 51   0.046429 172.31.36.109 -> 54.230.30.232 TCP 66 49907 > http [ACK] Seq=98 Ack=130829 Win=205312 Len=0 TSval=24993912 TSecr=665296533
 52   0.077423 54.230.30.232 -> 172.31.36.109 TCP 13098 [TCP segment of a reassembled PDU]
 53   0.077448 172.31.36.109 -> 54.230.30.232 TCP 66 49907 > http [ACK] Seq=98 Ack=143861 Win=194816 Len=0 TSval=24993920 TSecr=665296536
 54   0.077692 54.230.30.232 -> 172.31.36.109 TCP 21786 [TCP segment of a reassembled PDU]
 55   0.077703 172.31.36.109 -> 54.230.30.232 TCP 66 49907 > http [ACK] Seq=98 Ack=165581 Win=256128 Len=0 TSval=24993920 TSecr=665296536
 56   0.078607 54.230.30.232 -> 172.31.36.109 TCP 1514 [TCP segment of a reassembled PDU]
 57   0.078612 172.31.36.109 -> 54.230.30.232 TCP 66 49907 > http [ACK] Seq=98 Ack=167029 Win=259072 Len=0 TSval=24993920 TSecr=665296536
 58   0.078740 54.230.30.232 -> 172.31.36.109 TCP 13098 [TCP segment of a reassembled PDU]
 59   0.078748 172.31.36.109 -> 54.230.30.232 TCP 66 49907 > http [ACK] Seq=98 Ack=180061 Win=285056 Len=0 TSval=24993920 TSecr=665296536
 60   0.079023 54.230.30.232 -> 172.31.36.109 TCP 23234 [TCP segment of a reassembled PDU]
 61   0.079035 172.31.36.109 -> 54.230.30.232 TCP 66 49907 > http [ACK] Seq=98 Ack=203229 Win=331392 Len=0 TSval=24993920 TSecr=665296536
 62   0.079890 54.230.30.232 -> 172.31.36.109 TCP 2962 [TCP segment of a reassembled PDU]
 63   0.079903 172.31.36.109 -> 54.230.30.232 TCP 66 49907 > http [ACK] Seq=98 Ack=206125 Win=337280 Len=0 TSval=24993920 TSecr=665296536
 64   0.080029 54.230.30.232 -> 172.31.36.109 TCP 14546 [TCP segment of a reassembled PDU]
 65   0.080050 172.31.36.109 -> 54.230.30.232 TCP 66 49907 > http [ACK] Seq=98 Ack=220605 Win=345600 Len=0 TSval=24993920 TSecr=665296536
 66   0.080448 54.230.30.232 -> 172.31.36.109 TCP 10202 [TCP segment of a reassembled PDU]
 67   0.080455 172.31.36.109 -> 54.230.30.232 TCP 66 49907 > http [ACK] Seq=98 Ack=230741 Win=352768 Len=0 TSval=24993920 TSecr=665296536
 68   0.080584 54.230.30.232 -> 172.31.36.109 TCP 14546 [TCP segment of a reassembled PDU]
 69   0.080593 172.31.36.109 -> 54.230.30.232 TCP 66 49907 > http [ACK] Seq=98 Ack=245221 Win=345600 Len=0 TSval=24993921 TSecr=665296536
 70   0.081197 54.230.30.232 -> 172.31.36.109 TCP 4410 [TCP segment of a reassembled PDU]
 71   0.081216 172.31.36.109 -> 54.230.30.232 TCP 66 49907 > http [ACK] Seq=98 Ack=249565 Win=362240 Len=0 TSval=24993921 TSecr=665296537
 72   0.081355 54.230.30.232 -> 172.31.36.109 TCP 12402 [TCP segment of a reassembled PDU]
 73   0.081362 172.31.36.109 -> 54.230.30.232 TCP 66 49907 > http [ACK] Seq=98 Ack=261901 Win=349952 Len=0 TSval=24993921 TSecr=665296537
 74   0.081367 54.230.30.232 -> 172.31.36.109 TCP 1514 [TCP segment of a reassembled PDU]
 75   0.081369 172.31.36.109 -> 54.230.30.232 TCP 66 49907 > http [ACK] Seq=98 Ack=263349 Win=348544 Len=0 TSval=24993921 TSecr=665296537
 76   0.082000 54.230.30.232 -> 172.31.36.109 TCP 2962 [TCP segment of a reassembled PDU]
 77   0.082006 172.31.36.109 -> 54.230.30.232 TCP 66 49907 > http [ACK] Seq=98 Ack=266245 Win=371968 Len=0 TSval=24993921 TSecr=665296537
 78   0.082131 54.230.30.232 -> 172.31.36.109 TCP 20338 [TCP segment of a reassembled PDU]
 79   0.082142 172.31.36.109 -> 54.230.30.232 TCP 66 49907 > http [ACK] Seq=98 Ack=286517 Win=412544 Len=0 TSval=24993921 TSecr=665296537
 80   0.082179 54.230.30.232 -> 172.31.36.109 TCP 2962 [TCP segment of a reassembled PDU]
 81   0.082185 172.31.36.109 -> 54.230.30.232 TCP 66 49907 > http [ACK] Seq=98 Ack=289413 Win=418304 Len=0 TSval=24993921 TSecr=665296537
 82   0.082354 54.230.30.232 -> 172.31.36.109 TCP 2962 [TCP segment of a reassembled PDU]
 83   0.082366 172.31.36.109 -> 54.230.30.232 TCP 66 49907 > http [ACK] Seq=98 Ack=292309 Win=424064 Len=0 TSval=24993921 TSecr=665296537
 84   0.082531 54.230.30.232 -> 172.31.36.109 TCP 14546 [TCP segment of a reassembled PDU]
 85   0.082552 172.31.36.109 -> 54.230.30.232 TCP 66 49907 > http [ACK] Seq=98 Ack=306789 Win=453120 Len=0 TSval=24993921 TSecr=665296537
 86   0.082562 54.230.30.232 -> 172.31.36.109 TCP 5858 [TCP segment of a reassembled PDU]
 87   0.082565 172.31.36.109 -> 54.230.30.232 TCP 66 49907 > http [ACK] Seq=98 Ack=312581 Win=464640 Len=0 TSval=24993921 TSecr=665296537
 88   0.083509 54.230.30.232 -> 172.31.36.109 TCP 8754 [TCP segment of a reassembled PDU]
 89   0.083515 172.31.36.109 -> 54.230.30.232 TCP 66 49907 > http [ACK] Seq=98 Ack=321269 Win=482048 Len=0 TSval=24993921 TSecr=665296537
 90   0.083646 54.230.30.232 -> 172.31.36.109 TCP 6234 [TCP segment of a reassembled PDU]
 91   0.083678 172.31.36.109 -> 54.230.30.232 TCP 66 49907 > http [ACK] Seq=98 Ack=327437 Win=494336 Len=0 TSval=24993921 TSecr=665296537
 92   0.091454 54.230.30.232 -> 172.31.36.109 TCP 4410 [TCP segment of a reassembled PDU]
 93   0.091475 172.31.36.109 -> 54.230.30.232 TCP 66 49907 > http [ACK] Seq=98 Ack=331781 Win=503040 Len=0 TSval=24993923 TSecr=665296538
 94   0.091562 54.230.30.232 -> 172.31.36.109 TCP 2962 [TCP segment of a reassembled PDU]
 95   0.091574 172.31.36.109 -> 54.230.30.232 TCP 66 49907 > http [ACK] Seq=98 Ack=334677 Win=508800 Len=0 TSval=24993923 TSecr=665296538
 96   0.091736 54.230.30.232 -> 172.31.36.109 TCP 5858 [TCP segment of a reassembled PDU]
 97   0.091750 172.31.36.109 -> 54.230.30.232 TCP 66 49907 > http [ACK] Seq=98 Ack=340469 Win=520448 Len=0 TSval=24993923 TSecr=665296538
 98   0.091779 54.230.30.232 -> 172.31.36.109 TCP 13098 [TCP segment of a reassembled PDU]
 99   0.091785 172.31.36.109 -> 54.230.30.232 TCP 66 49907 > http [ACK] Seq=98 Ack=353501 Win=546560 Len=0 TSval=24993923 TSecr=665296538
100   0.091819 54.230.30.232 -> 172.31.36.109 TCP 7306 [TCP segment of a reassembled PDU]
101   0.091826 172.31.36.109 -> 54.230.30.232 TCP 66 49907 > http [ACK] Seq=98 Ack=360741 Win=561024 Len=0 TSval=24993923 TSecr=665296538
102   0.091937 54.230.30.232 -> 172.31.36.109 TCP 1514 [TCP segment of a reassembled PDU]
103   0.091956 172.31.36.109 -> 54.230.30.232 TCP 66 49907 > http [ACK] Seq=98 Ack=362189 Win=563840 Len=0 TSval=24993923 TSecr=665296538
104   0.092261 54.230.30.232 -> 172.31.36.109 TCP 11650 [TCP segment of a reassembled PDU]
105   0.092287 172.31.36.109 -> 54.230.30.232 TCP 66 49907 > http [ACK] Seq=98 Ack=373773 Win=587008 Len=0 TSval=24993923 TSecr=665296538
106   0.092311 54.230.30.232 -> 172.31.36.109 TCP 8754 [TCP segment of a reassembled PDU]
107   0.092317 172.31.36.109 -> 54.230.30.232 TCP 66 49907 > http [ACK] Seq=98 Ack=382461 Win=604416 Len=0 TSval=24993923 TSecr=665296538
108   0.092963 54.230.30.232 -> 172.31.36.109 TCP 1514 [TCP segment of a reassembled PDU]
109   0.092976 172.31.36.109 -> 54.230.30.232 TCP 66 49907 > http [ACK] Seq=98 Ack=383909 Win=607360 Len=0 TSval=24993924 TSecr=665296538
110   0.093095 54.230.30.232 -> 172.31.36.109 TCP 9130 [TCP segment of a reassembled PDU]
111   0.093121 172.31.36.109 -> 54.230.30.232 TCP 66 49907 > http [ACK] Seq=98 Ack=392973 Win=625408 Len=0 TSval=24993924 TSecr=665296538
112   0.093307 54.230.30.232 -> 172.31.36.109 TCP 1514 [TCP segment of a reassembled PDU]
113   0.093317 172.31.36.109 -> 54.230.30.232 TCP 66 49907 > http [ACK] Seq=98 Ack=394421 Win=628352 Len=0 TSval=24993924 TSecr=665296538
114   0.093754 54.230.30.232 -> 172.31.36.109 TCP 7306 [TCP segment of a reassembled PDU]
115   0.093782 172.31.36.109 -> 54.230.30.232 TCP 66 49907 > http [ACK] Seq=98 Ack=401661 Win=642816 Len=0 TSval=24993924 TSecr=665296538
116   0.093839 54.230.30.232 -> 172.31.36.109 TCP 20338 [TCP segment of a reassembled PDU]
117   0.093850 172.31.36.109 -> 54.230.30.232 TCP 66 49907 > http [ACK] Seq=98 Ack=421933 Win=678528 Len=0 TSval=24993924 TSecr=665296538
118   0.094059 54.230.30.232 -> 172.31.36.109 TCP 13098 [TCP segment of a reassembled PDU]
119   0.094089 172.31.36.109 -> 54.230.30.232 TCP 66 49907 > http [ACK] Seq=98 Ack=434965 Win=690432 Len=0 TSval=24993924 TSecr=665296538
120   0.094096 54.230.30.232 -> 172.31.36.109 TCP 2962 [TCP segment of a reassembled PDU]
121   0.094099 172.31.36.109 -> 54.230.30.232 TCP 66 49907 > http [ACK] Seq=98 Ack=437861 Win=687616 Len=0 TSval=24993924 TSecr=665296538
122   0.094545 54.230.30.232 -> 172.31.36.109 TCP 15994 [TCP segment of a reassembled PDU]
123   0.094568 172.31.36.109 -> 54.230.30.232 TCP 66 49907 > http [ACK] Seq=98 Ack=453789 Win=685568 Len=0 TSval=24993924 TSecr=665296538
124   0.094577 54.230.30.232 -> 172.31.36.109 TCP 5858 [TCP segment of a reassembled PDU]
125   0.094595 172.31.36.109 -> 54.230.30.232 TCP 66 49907 > http [ACK] Seq=98 Ack=459581 Win=702336 Len=0 TSval=24993924 TSecr=665296538
126   0.095047 54.230.30.232 -> 172.31.36.109 TCP 7306 [TCP segment of a reassembled PDU]
127   0.095089 172.31.36.109 -> 54.230.30.232 TCP 66 49907 > http [ACK] Seq=98 Ack=466821 Win=709248 Len=0 TSval=24993924 TSecr=665296538
128   0.095227 54.230.30.232 -> 172.31.36.109 TCP 17442 [TCP segment of a reassembled PDU]
129   0.095250 54.230.30.232 -> 172.31.36.109 TCP 2962 [TCP segment of a reassembled PDU]
130   0.095256 54.230.30.232 -> 172.31.36.109 TCP 4410 [TCP segment of a reassembled PDU]
131   0.095260 172.31.36.109 -> 54.230.30.232 TCP 66 49907 > http [ACK] Seq=98 Ack=484197 Win=691968 Len=0 TSval=24993924 TSecr=665296538
132   0.095273 172.31.36.109 -> 54.230.30.232 TCP 66 49907 > http [ACK] Seq=98 Ack=491437 Win=709248 Len=0 TSval=24993924 TSecr=665296538
133   0.095358 54.230.30.232 -> 172.31.36.109 TCP 1514 [TCP segment of a reassembled PDU]
134   0.095811 54.230.30.232 -> 172.31.36.109 TCP 7306 [TCP segment of a reassembled PDU]
135   0.095850 172.31.36.109 -> 54.230.30.232 TCP 66 49907 > http [ACK] Seq=98 Ack=500125 Win=709248 Len=0 TSval=24993924 TSecr=665296538
136   0.095878 54.230.30.232 -> 172.31.36.109 TCP 14546 [TCP segment of a reassembled PDU]
137   0.095898 172.31.36.109 -> 54.230.30.232 TCP 66 49907 > http [ACK] Seq=98 Ack=514605 Win=709248 Len=0 TSval=24993924 TSecr=665296538
138   0.095948 54.230.30.232 -> 172.31.36.109 TCP 7306 [TCP segment of a reassembled PDU]
139   0.095964 172.31.36.109 -> 54.230.30.232 TCP 66 49907 > http [ACK] Seq=98 Ack=521845 Win=709248 Len=0 TSval=24993924 TSecr=665296538
140   0.096030 54.230.30.232 -> 172.31.36.109 TCP 2266 [TCP segment of a reassembled PDU]
141   0.096045 172.31.36.109 -> 54.230.30.232 TCP 66 49907 > http [ACK] Seq=98 Ack=524045 Win=709248 Len=0 TSval=24993924 TSecr=665296538
142   0.114902 54.230.30.232 -> 172.31.36.109 TCP 18890 [TCP segment of a reassembled PDU]
143   0.114941 172.31.36.109 -> 54.230.30.232 TCP 66 49907 > http [ACK] Seq=98 Ack=542869 Win=690432 Len=0 TSval=24993929 TSecr=665296540
144   0.114989 54.230.30.232 -> 172.31.36.109 TCP 2962 [TCP segment of a reassembled PDU]
145   0.114994 172.31.36.109 -> 54.230.30.232 TCP 66 49907 > http [ACK] Seq=98 Ack=545765 Win=707072 Len=0 TSval=24993929 TSecr=665296540
146   0.115100 54.230.30.232 -> 172.31.36.109 TCP 4410 [TCP segment of a reassembled PDU]
147   0.115115 54.230.30.232 -> 172.31.36.109 TCP 15994 [TCP segment of a reassembled PDU]
148   0.115134 172.31.36.109 -> 54.230.30.232 TCP 66 49907 > http [ACK] Seq=98 Ack=566037 Win=686848 Len=0 TSval=24993929 TSecr=665296540
149   0.115169 54.230.30.232 -> 172.31.36.109 TCP 1514 [TCP segment of a reassembled PDU]
150   0.115425 54.230.30.232 -> 172.31.36.109 TCP 24682 [TCP segment of a reassembled PDU]
151   0.115450 172.31.36.109 -> 54.230.30.232 TCP 66 49907 > http [ACK] Seq=98 Ack=592101 Win=671360 Len=0 TSval=24993929 TSecr=665296540
152   0.115485 54.230.30.232 -> 172.31.36.109 TCP 4410 [TCP segment of a reassembled PDU]
153   0.115491 172.31.36.109 -> 54.230.30.232 TCP 66 49907 > http [ACK] Seq=98 Ack=596445 Win=704640 Len=0 TSval=24993929 TSecr=665296540
154   0.116277 54.230.30.232 -> 172.31.36.109 TCP 1514 [TCP segment of a reassembled PDU]
155   0.116516 54.230.30.232 -> 172.31.36.109 TCP 5858 [TCP segment of a reassembled PDU]
156   0.116532 172.31.36.109 -> 54.230.30.232 TCP 66 49907 > http [ACK] Seq=98 Ack=603685 Win=709248 Len=0 TSval=24993930 TSecr=665296540
157   0.116674 54.230.30.232 -> 172.31.36.109 TCP 20338 [TCP segment of a reassembled PDU]
158   0.116887 172.31.36.109 -> 54.230.30.232 TCP 66 49907 > http [ACK] Seq=98 Ack=623957 Win=689024 Len=0 TSval=24993930 TSecr=665296540
159   0.116914 54.230.30.232 -> 172.31.36.109 TCP 24682 [TCP segment of a reassembled PDU]
160   0.116935 172.31.36.109 -> 54.230.30.232 TCP 66 49907 > http [ACK] Seq=98 Ack=648573 Win=671360 Len=0 TSval=24993930 TSecr=665296540
161   0.117175 54.230.30.232 -> 172.31.36.109 TCP 13098 [TCP segment of a reassembled PDU]
162   0.117184 172.31.36.109 -> 54.230.30.232 TCP 66 49907 > http [ACK] Seq=98 Ack=661605 Win=690432 Len=0 TSval=24993930 TSecr=665296540
163   0.117808 54.230.30.232 -> 172.31.36.109 TCP 4410 [TCP segment of a reassembled PDU]
164   0.117841 172.31.36.109 -> 54.230.30.232 TCP 66 49907 > http [ACK] Seq=98 Ack=665949 Win=704640 Len=0 TSval=24993930 TSecr=665296540
165   0.117970 54.230.30.232 -> 172.31.36.109 TCP 14546 [TCP segment of a reassembled PDU]
166   0.118015 172.31.36.109 -> 54.230.30.232 TCP 66 49907 > http [ACK] Seq=98 Ack=680429 Win=709248 Len=0 TSval=24993930 TSecr=665296540
167   0.118209 54.230.30.232 -> 172.31.36.109 TCP 24682 [TCP segment of a reassembled PDU]
168   0.118233 172.31.36.109 -> 54.230.30.232 TCP 66 49907 > http [ACK] Seq=98 Ack=705045 Win=684672 Len=0 TSval=24993930 TSecr=665296540
169   0.118404 54.230.30.232 -> 172.31.36.109 TCP 15674 [TCP segment of a reassembled PDU]
170   0.118412 172.31.36.109 -> 54.230.30.232 TCP 66 49907 > http [ACK] Seq=98 Ack=720653 Win=685568 Len=0 TSval=24993930 TSecr=665296540
171   0.121653 54.230.30.232 -> 172.31.36.109 TCP 5858 [TCP segment of a reassembled PDU]
172   0.121660 172.31.36.109 -> 54.230.30.232 TCP 66 49907 > http [ACK] Seq=98 Ack=726445 Win=702336 Len=0 TSval=24993931 TSecr=665296541
173   0.121819 54.230.30.232 -> 172.31.36.109 TCP 24682 [TCP segment of a reassembled PDU]
174   0.121850 54.230.30.232 -> 172.31.36.109 TCP 4410 [TCP segment of a reassembled PDU]
175   0.122043 172.31.36.109 -> 54.230.30.232 TCP 66 49907 > http [ACK] Seq=98 Ack=755405 Win=673408 Len=0 TSval=24993931 TSecr=665296541
176   0.122096 54.230.30.232 -> 172.31.36.109 TCP 29026 [TCP segment of a reassembled PDU]
177   0.122130 172.31.36.109 -> 54.230.30.232 TCP 66 49907 > http [ACK] Seq=98 Ack=784365 Win=664192 Len=0 TSval=24993931 TSecr=665296541
178   0.122305 54.230.30.232 -> 172.31.36.109 TCP 1890 [TCP segment of a reassembled PDU]
179   0.122317 172.31.36.109 -> 54.230.30.232 TCP 66 49907 > http [ACK] Seq=98 Ack=786189 Win=707072 Len=0 TSval=24993931 TSecr=665296541
180   0.122362 54.230.30.232 -> 172.31.36.109 TCP 21786 [TCP segment of a reassembled PDU]
181   0.122395 172.31.36.109 -> 54.230.30.232 TCP 66 49907 > http [ACK] Seq=98 Ack=807909 Win=685440 Len=0 TSval=24993931 TSecr=665296541
182   0.122480 54.230.30.232 -> 172.31.36.109 TCP 4410 [TCP segment of a reassembled PDU]
183   0.122493 172.31.36.109 -> 54.230.30.232 TCP 66 49907 > http [ACK] Seq=98 Ack=812253 Win=704640 Len=0 TSval=24993931 TSecr=665296541
184   0.123192 54.230.30.232 -> 172.31.36.109 TCP 10202 [TCP segment of a reassembled PDU]
185   0.123213 172.31.36.109 -> 54.230.30.232 TCP 66 49907 > http [ACK] Seq=98 Ack=822389 Win=709248 Len=0 TSval=24993931 TSecr=665296541
186   0.123329 54.230.30.232 -> 172.31.36.109 TCP 13098 [TCP segment of a reassembled PDU]
187   0.123348 172.31.36.109 -> 54.230.30.232 TCP 66 49907 > http [ACK] Seq=98 Ack=835421 Win=709248 Len=0 TSval=24993931 TSecr=665296541
188   0.123639 54.230.30.232 -> 172.31.36.109 TCP 34818 [TCP segment of a reassembled PDU]
189   0.123658 54.230.30.232 -> 172.31.36.109 TCP 1514 [TCP segment of a reassembled PDU]
190   0.123669 54.230.30.232 -> 172.31.36.109 TCP 2962 [TCP segment of a reassembled PDU]
191   0.123679 172.31.36.109 -> 54.230.30.232 TCP 66 49907 > http [ACK] Seq=98 Ack=874517 Win=670208 Len=0 TSval=24993931 TSecr=665296541
192   0.123837 54.230.30.232 -> 172.31.36.109 TCP 18890 [TCP segment of a reassembled PDU]
193   0.123856 172.31.36.109 -> 54.230.30.232 TCP 66 49907 > http [ACK] Seq=98 Ack=893341 Win=680832 Len=0 TSval=24993931 TSecr=665296541
194   0.123979 54.230.30.232 -> 172.31.36.109 TCP 5858 [TCP segment of a reassembled PDU]
195   0.124005 172.31.36.109 -> 54.230.30.232 TCP 66 49907 > http [ACK] Seq=98 Ack=899133 Win=702336 Len=0 TSval=24993931 TSecr=665296541
196   0.124150 54.230.30.232 -> 172.31.36.109 TCP 14546 [TCP segment of a reassembled PDU]
197   0.124195 172.31.36.109 -> 54.230.30.232 TCP 66 49907 > http [ACK] Seq=98 Ack=913613 Win=709248 Len=0 TSval=24993931 TSecr=665296541
198   0.124981 54.230.30.232 -> 172.31.36.109 TCP 3714 [TCP segment of a reassembled PDU]
199   0.125024 172.31.36.109 -> 54.230.30.232 TCP 66 49907 > http [ACK] Seq=98 Ack=917261 Win=709248 Len=0 TSval=24993932 TSecr=665296541
200   0.133389 54.230.30.232 -> 172.31.36.109 TCP 2962 [TCP segment of a reassembled PDU]
201   0.133427 172.31.36.109 -> 54.230.30.232 TCP 66 49907 > http [ACK] Seq=98 Ack=920157 Win=709248 Len=0 TSval=24993934 TSecr=665296542
202   0.133508 54.230.30.232 -> 172.31.36.109 TCP 1514 [TCP segment of a reassembled PDU]
203   0.133514 54.230.30.232 -> 172.31.36.109 TCP 4410 [TCP segment of a reassembled PDU]
204   0.133527 172.31.36.109 -> 54.230.30.232 TCP 66 49907 > http [ACK] Seq=98 Ack=925949 Win=709248 Len=0 TSval=24993934 TSecr=665296542
205   0.133616 54.230.30.232 -> 172.31.36.109 TCP 1514 [TCP segment of a reassembled PDU]
206   0.133852 54.230.30.232 -> 172.31.36.109 TCP 23234 [TCP segment of a reassembled PDU]
207   0.133879 54.230.30.232 -> 172.31.36.109 TCP 10202 [TCP segment of a reassembled PDU]
208   0.133890 54.230.30.232 -> 172.31.36.109 TCP 2962 [TCP segment of a reassembled PDU]
209   0.133905 172.31.36.109 -> 54.230.30.232 TCP 66 49907 > http [ACK] Seq=98 Ack=963597 Win=671616 Len=0 TSval=24993934 TSecr=665296542
210   0.134016 54.230.30.232 -> 172.31.36.109 TCP 13098 [TCP segment of a reassembled PDU]
211   0.134024 172.31.36.109 -> 54.230.30.232 TCP 66 49907 > http [ACK] Seq=98 Ack=976629 Win=690432 Len=0 TSval=24993934 TSecr=665296542
212   0.134293 54.230.30.232 -> 172.31.36.109 TCP 18890 [TCP segment of a reassembled PDU]
213   0.134314 172.31.36.109 -> 54.230.30.232 TCP 66 49907 > http [ACK] Seq=98 Ack=995453 Win=680832 Len=0 TSval=24993934 TSecr=665296542
214   0.134425 54.230.30.232 -> 172.31.36.109 TCP 2962 [TCP segment of a reassembled PDU]
215   0.134441 172.31.36.109 -> 54.230.30.232 TCP 66 49907 > http [ACK] Seq=98 Ack=998349 Win=707072 Len=0 TSval=24993934 TSecr=665296542
216   0.134557 54.230.30.232 -> 172.31.36.109 TCP 4786 [TCP segment of a reassembled PDU]
217   0.134598 172.31.36.109 -> 54.230.30.232 TCP 66 49907 > http [ACK] Seq=98 Ack=1003069 Win=709248 Len=0 TSval=24993934 TSecr=665296542
218   0.134964 54.230.30.232 -> 172.31.36.109 TCP 8754 [TCP segment of a reassembled PDU]
219   0.134988 172.31.36.109 -> 54.230.30.232 TCP 66 49907 > http [ACK] Seq=98 Ack=1011757 Win=709248 Len=0 TSval=24993934 TSecr=665296542
220   0.135101 54.230.30.232 -> 172.31.36.109 TCP 14546 [TCP segment of a reassembled PDU]
221   0.135134 172.31.36.109 -> 54.230.30.232 TCP 66 49907 > http [ACK] Seq=98 Ack=1026237 Win=709248 Len=0 TSval=24993934 TSecr=665296542
222   0.135390 54.230.30.232 -> 172.31.36.109 TCP 34818 [TCP segment of a reassembled PDU]
223   0.135417 172.31.36.109 -> 54.230.30.232 TCP 66 49907 > http [ACK] Seq=98 Ack=1060989 Win=674560 Len=0 TSval=24993934 TSecr=665296542
224   0.135428 54.230.30.232 -> 172.31.36.109 TCP 4410 [TCP segment of a reassembled PDU]
225   0.135444 172.31.36.109 -> 54.230.30.232 TCP 66 49907 > http [ACK] Seq=98 Ack=1065333 Win=670336 Len=0 TSval=24993934 TSecr=665296542
226   0.135586 54.230.30.232 -> 172.31.36.109 TCP 23234 [TCP segment of a reassembled PDU]
227   0.135598 172.31.36.109 -> 54.230.30.232 TCP 66 49907 > http [ACK] Seq=98 Ack=1088501 Win=673792 Len=0 TSval=24993934 TSecr=665296542
228   0.135706 54.230.30.232 -> 172.31.36.109 TCP 4410 [TCP segment of a reassembled PDU]
229   0.135723 172.31.36.109 -> 54.230.30.232 TCP 66 49907 > http [ACK] Seq=98 Ack=1092845 Win=704640 Len=0 TSval=24993934 TSecr=665296542
230   0.135826 54.230.30.232 -> 172.31.36.109 TCP 5858 [TCP segment of a reassembled PDU]
231   0.135946 172.31.36.109 -> 54.230.30.232 TCP 66 49907 > http [ACK] Seq=98 Ack=1098637 Win=709248 Len=0 TSval=24993934 TSecr=665296542
232   0.136115 54.230.30.232 -> 172.31.36.109 TCP 20338 [TCP segment of a reassembled PDU]
233   0.136147 172.31.36.109 -> 54.230.30.232 TCP 66 49907 > http [ACK] Seq=98 Ack=1118909 Win=689024 Len=0 TSval=24993934 TSecr=665296542
234   0.136759 54.230.30.232 -> 172.31.36.109 TCP 4410 [TCP segment of a reassembled PDU]
235   0.136789 172.31.36.109 -> 54.230.30.232 TCP 66 49907 > http [ACK] Seq=98 Ack=1123253 Win=704640 Len=0 TSval=24993935 TSecr=665296542
236   0.136962 54.230.30.232 -> 172.31.36.109 TCP 23234 [TCP segment of a reassembled PDU]
237   0.136977 54.230.30.232 -> 172.31.36.109 TCP 5858 [TCP segment of a reassembled PDU]
238   0.137000 172.31.36.109 -> 54.230.30.232 TCP 66 49907 > http [ACK] Seq=98 Ack=1152213 Win=675712 Len=0 TSval=24993935 TSecr=665296542
239   0.137157 54.230.30.232 -> 172.31.36.109 TCP 23234 [TCP segment of a reassembled PDU]
240   0.137191 172.31.36.109 -> 54.230.30.232 TCP 66 49907 > http [ACK] Seq=98 Ack=1175381 Win=673792 Len=0 TSval=24993935 TSecr=665296542
241   0.137273 54.230.30.232 -> 172.31.36.109 TCP 5858 [TCP segment of a reassembled PDU]
242   0.137278 172.31.36.109 -> 54.230.30.232 TCP 66 49907 > http [ACK] Seq=98 Ack=1181173 Win=702336 Len=0 TSval=24993935 TSecr=665296542
243   0.137349 54.230.30.232 -> 172.31.36.109 TCP 2962 [TCP segment of a reassembled PDU]
244   0.137354 172.31.36.109 -> 54.230.30.232 TCP 66 49907 > http [ACK] Seq=98 Ack=1184069 Win=707072 Len=0 TSval=24993935 TSecr=665296542
245   0.137621 54.230.30.232 -> 172.31.36.109 TCP 4410 [TCP segment of a reassembled PDU]
246   0.137636 172.31.36.109 -> 54.230.30.232 TCP 66 49907 > http [ACK] Seq=98 Ack=1188413 Win=709248 Len=0 TSval=24993935 TSecr=665296542
247   0.137770 54.230.30.232 -> 172.31.36.109 TCP 7306 [TCP segment of a reassembled PDU]
248   0.137795 172.31.36.109 -> 54.230.30.232 TCP 66 49907 > http [ACK] Seq=98 Ack=1195653 Win=709248 Len=0 TSval=24993935 TSecr=665296542
249   0.137917 54.230.30.232 -> 172.31.36.109 TCP 17442 [TCP segment of a reassembled PDU]
250   0.137938 172.31.36.109 -> 54.230.30.232 TCP 66 49907 > http [ACK] Seq=98 Ack=1213029 Win=691968 Len=0 TSval=24993935 TSecr=665296542
251   0.138163 54.230.30.232 -> 172.31.36.109 TCP 24682 [TCP segment of a reassembled PDU]
252   0.138185 54.230.30.232 -> 172.31.36.109 TCP 1514 [TCP segment of a reassembled PDU]
253   0.138189 54.230.30.232 -> 172.31.36.109 TCP 2962 [TCP segment of a reassembled PDU]
254   0.138247 54.230.30.232 -> 172.31.36.109 TCP 4410 [TCP segment of a reassembled PDU]
255   0.138368 172.31.36.109 -> 54.230.30.232 TCP 66 49907 > http [ACK] Seq=98 Ack=1246333 Win=658688 Len=0 TSval=24993935 TSecr=665296542
256   0.140835 54.230.30.232 -> 172.31.36.109 TCP 2962 [TCP segment of a reassembled PDU]
257   0.140840 172.31.36.109 -> 54.230.30.232 TCP 66 49907 > http [ACK] Seq=98 Ack=1249229 Win=707072 Len=0 TSval=24993936 TSecr=665296542
258   0.141001 54.230.30.232 -> 172.31.36.109 TCP 29026 [TCP segment of a reassembled PDU]
259   0.141037 172.31.36.109 -> 54.230.30.232 TCP 66 49907 > http [ACK] Seq=98 Ack=1278189 Win=678144 Len=0 TSval=24993936 TSecr=665296542
260   0.141162 54.230.30.232 -> 172.31.36.109 TCP 11650 [TCP segment of a reassembled PDU]
261   0.141190 172.31.36.109 -> 54.230.30.232 TCP 66 49907 > http [ACK] Seq=98 Ack=1289773 Win=692864 Len=0 TSval=24993936 TSecr=665296542
262   0.141223 54.230.30.232 -> 172.31.36.109 TCP 15994 [TCP segment of a reassembled PDU]
263   0.141236 172.31.36.109 -> 54.230.30.232 TCP 66 49907 > http [ACK] Seq=98 Ack=1305701 Win=709248 Len=0 TSval=24993936 TSecr=665296542
264   0.141325 54.230.30.232 -> 172.31.36.109 TCP 4842 [TCP segment of a reassembled PDU]
265   0.141366 172.31.36.109 -> 54.230.30.232 TCP 66 49907 > http [ACK] Seq=98 Ack=1310477 Win=709248 Len=0 TSval=24993936 TSecr=665296542
266   0.152640 54.230.30.232 -> 172.31.36.109 TCP 1514 [TCP segment of a reassembled PDU]
267   0.152876 54.230.30.232 -> 172.31.36.109 TCP 2962 [TCP segment of a reassembled PDU]
268   0.152914 172.31.36.109 -> 54.230.30.232 TCP 66 49907 > http [ACK] Seq=98 Ack=1314821 Win=709248 Len=0 TSval=24993939 TSecr=665296544
269   0.153049 54.230.30.232 -> 172.31.36.109 TCP 23234 [TCP segment of a reassembled PDU]
270   0.153075 172.31.36.109 -> 54.230.30.232 TCP 66 49907 > http [ACK] Seq=98 Ack=1337989 Win=686080 Len=0 TSval=24993939 TSecr=665296544
271   0.153227 54.230.30.232 -> 172.31.36.109 TCP 10202 [TCP segment of a reassembled PDU]
272   0.153254 172.31.36.109 -> 54.230.30.232 TCP 66 49907 > http [ACK] Seq=98 Ack=1348125 Win=695168 Len=0 TSval=24993939 TSecr=665296544
273   0.153564 54.230.30.232 -> 172.31.36.109 TCP 15994 [TCP segment of a reassembled PDU]
274   0.153583 54.230.30.232 -> 172.31.36.109 TCP 25058 [TCP segment of a reassembled PDU]
275   0.153600 54.230.30.232 -> 172.31.36.109 TCP 4410 [TCP segment of a reassembled PDU]
276   0.153769 54.230.30.232 -> 172.31.36.109 TCP 14546 [TCP segment of a reassembled PDU]
277   0.154152 54.230.30.232 -> 172.31.36.109 TCP 5858 [TCP segment of a reassembled PDU]
278   0.154288 54.230.30.232 -> 172.31.36.109 TCP 13098 [TCP segment of a reassembled PDU]
279   0.154412 54.230.30.232 -> 172.31.36.109 TCP 5858 [TCP segment of a reassembled PDU]
280   0.154541 54.230.30.232 -> 172.31.36.109 TCP 9130 [TCP segment of a reassembled PDU]
281   0.155673 54.230.30.232 -> 172.31.36.109 TCP 1514 [TCP segment of a reassembled PDU]
282   0.156212 54.230.30.232 -> 172.31.36.109 TCP 2962 [TCP segment of a reassembled PDU]
283   0.156405 54.230.30.232 -> 172.31.36.109 TCP 1514 [TCP segment of a reassembled PDU]
284   0.156552 172.31.36.109 -> 54.230.30.232 TCP 66 49907 > http [ACK] Seq=98 Ack=1447341 Win=595968 Len=0 TSval=24993940 TSecr=665296544
285   0.156600 54.230.30.232 -> 172.31.36.109 TCP 33370 [TCP segment of a reassembled PDU]
286   0.156617 172.31.36.109 -> 54.230.30.232 TCP 66 49907 > http [ACK] Seq=98 Ack=1480645 Win=599680 Len=0 TSval=24993940 TSecr=665296544
287   0.156769 54.230.30.232 -> 172.31.36.109 TCP 1514 [TCP segment of a reassembled PDU]
288   0.157993 54.230.30.232 -> 172.31.36.109 TCP 7306 [TCP segment of a reassembled PDU]
289   0.158000 172.31.36.109 -> 54.230.30.232 TCP 66 49907 > http [ACK] Seq=98 Ack=1489333 Win=699904 Len=0 TSval=24993940 TSecr=665296544
290   0.158127 54.230.30.232 -> 172.31.36.109 TCP 33370 [TCP segment of a reassembled PDU]
291   0.158152 172.31.36.109 -> 54.230.30.232 TCP 66 49907 > http [ACK] Seq=98 Ack=1522637 Win=666624 Len=0 TSval=24993940 TSecr=665296544
292   0.158246 54.230.30.232 -> 172.31.36.109 TCP 11650 [TCP segment of a reassembled PDU]
293   0.158254 172.31.36.109 -> 54.230.30.232 TCP 66 49907 > http [ACK] Seq=98 Ack=1534221 Win=692864 Len=0 TSval=24993940 TSecr=665296544
294   0.158380 54.230.30.232 -> 172.31.36.109 TCP 11650 [TCP segment of a reassembled PDU]
295   0.158388 172.31.36.109 -> 54.230.30.232 TCP 66 49907 > http [ACK] Seq=98 Ack=1545805 Win=692864 Len=0 TSval=24993940 TSecr=665296544
296   0.158600 54.230.30.232 -> 172.31.36.109 TCP 18890 [TCP segment of a reassembled PDU]
297   0.158618 172.31.36.109 -> 54.230.30.232 TCP 66 49907 > http [ACK] Seq=98 Ack=1564629 Win=680832 Len=0 TSval=24993940 TSecr=665296544
298   0.158652 54.230.30.232 -> 172.31.36.109 TCP 8058 [TCP segment of a reassembled PDU]
299   0.158658 172.31.36.109 -> 54.230.30.232 TCP 66 49907 > http [ACK] Seq=98 Ack=1572621 Win=697600 Len=0 TSval=24993940 TSecr=665296544
300   0.251241 54.230.30.232 -> 172.31.36.109 TCP 4410 [TCP segment of a reassembled PDU]
301   0.251252 172.31.36.109 -> 54.230.30.232 TCP 66 49907 > http [ACK] Seq=98 Ack=1576965 Win=704640 Len=0 TSval=24993963 TSecr=665296554
302   0.251258 54.230.30.232 -> 172.31.36.109 TCP 2962 [TCP segment of a reassembled PDU]
303   0.251423 172.31.36.109 -> 54.230.30.232 TCP 66 49907 > http [ACK] Seq=98 Ack=1579861 Win=709248 Len=0 TSval=24993963 TSecr=665296554
304   0.251514 54.230.30.232 -> 172.31.36.109 TCP 20338 [TCP segment of a reassembled PDU]
305   0.251539 172.31.36.109 -> 54.230.30.232 TCP 66 49907 > http [ACK] Seq=98 Ack=1600133 Win=689024 Len=0 TSval=24993963 TSecr=665296554
306   0.251615 54.230.30.232 -> 172.31.36.109 TCP 5858 [TCP segment of a reassembled PDU]
307   0.251622 172.31.36.109 -> 54.230.30.232 TCP 66 49907 > http [ACK] Seq=98 Ack=1605925 Win=702336 Len=0 TSval=24993963 TSecr=665296554
308   0.251632 54.230.30.232 -> 172.31.36.109 TCP 5858 [TCP segment of a reassembled PDU]
309   0.251651 172.31.36.109 -> 54.230.30.232 TCP 66 49907 > http [ACK] Seq=98 Ack=1611717 Win=709248 Len=0 TSval=24993963 TSecr=665296554
310   0.251717 54.230.30.232 -> 172.31.36.109 TCP 13098 [TCP segment of a reassembled PDU]
311   0.251739 172.31.36.109 -> 54.230.30.232 TCP 66 49907 > http [ACK] Seq=98 Ack=1624749 Win=709248 Len=0 TSval=24993963 TSecr=665296554
312   0.251979 54.230.30.232 -> 172.31.36.109 TCP 8754 [TCP segment of a reassembled PDU]
313   0.252002 172.31.36.109 -> 54.230.30.232 TCP 66 49907 > http [ACK] Seq=98 Ack=1633437 Win=709248 Len=0 TSval=24993963 TSecr=665296554
314   0.252135 54.230.30.232 -> 172.31.36.109 TCP 14922 [TCP segment of a reassembled PDU]
315   0.252147 54.230.30.232 -> 172.31.36.109 TCP 1514 [TCP segment of a reassembled PDU]
316   0.252166 172.31.36.109 -> 54.230.30.232 TCP 66 49907 > http [ACK] Seq=98 Ack=1649741 Win=709248 Len=0 TSval=24993963 TSecr=665296554
317   0.252174 54.230.30.232 -> 172.31.36.109 TCP 2962 [TCP segment of a reassembled PDU]
318   0.252188 172.31.36.109 -> 54.230.30.232 TCP 66 49907 > http [ACK] Seq=98 Ack=1652637 Win=709248 Len=0 TSval=24993963 TSecr=665296554
319   0.252396 54.230.30.232 -> 172.31.36.109 TCP 18890 [TCP segment of a reassembled PDU]
320   0.252424 172.31.36.109 -> 54.230.30.232 TCP 66 49907 > http [ACK] Seq=98 Ack=1671461 Win=690432 Len=0 TSval=24993963 TSecr=665296554
321   0.252723 54.230.30.232 -> 172.31.36.109 TCP 8754 [TCP segment of a reassembled PDU]
322   0.252730 172.31.36.109 -> 54.230.30.232 TCP 66 49907 > http [ACK] Seq=98 Ack=1680149 Win=697600 Len=0 TSval=24993964 TSecr=665296554
323   0.252868 54.230.30.232 -> 172.31.36.109 TCP 13098 [TCP segment of a reassembled PDU]
324   0.252888 172.31.36.109 -> 54.230.30.232 TCP 66 49907 > http [ACK] Seq=98 Ack=1693181 Win=709248 Len=0 TSval=24993964 TSecr=665296554
325   0.253116 54.230.30.232 -> 172.31.36.109 TCP 18890 [TCP segment of a reassembled PDU]
326   0.253176 54.230.30.232 -> 172.31.36.109 TCP 4410 [TCP segment of a reassembled PDU]
327   0.253245 54.230.30.232 -> 172.31.36.109 TCP 11650 [TCP segment of a reassembled PDU]
328   0.253389 54.230.30.232 -> 172.31.36.109 TCP 13098 [TCP segment of a reassembled PDU]
329   0.253421 172.31.36.109 -> 54.230.30.232 TCP 66 49907 > http [ACK] Seq=98 Ack=1740965 Win=661504 Len=0 TSval=24993964 TSecr=665296554
330   0.253476 54.230.30.232 -> 172.31.36.109 TCP 5858 [TCP segment of a reassembled PDU]
331   0.253483 172.31.36.109 -> 54.230.30.232 TCP 66 49907 > http [ACK] Seq=98 Ack=1746757 Win=702336 Len=0 TSval=24993964 TSecr=665296554
332   0.253608 54.230.30.232 -> 172.31.36.109 TCP 10202 [TCP segment of a reassembled PDU]
333   0.253628 172.31.36.109 -> 54.230.30.232 TCP 66 49907 > http [ACK] Seq=98 Ack=1756893 Win=709248 Len=0 TSval=24993964 TSecr=665296554
334   0.253882 54.230.30.232 -> 172.31.36.109 TCP 8754 [TCP segment of a reassembled PDU]
335   0.253905 172.31.36.109 -> 54.230.30.232 TCP 66 49907 > http [ACK] Seq=98 Ack=1765581 Win=709248 Len=0 TSval=24993964 TSecr=665296554
336   0.254072 54.230.30.232 -> 172.31.36.109 TCP 29026 [TCP segment of a reassembled PDU]
337   0.254098 172.31.36.109 -> 54.230.30.232 TCP 66 49907 > http [ACK] Seq=98 Ack=1794541 Win=680320 Len=0 TSval=24993964 TSecr=665296554
338   0.254380 54.230.30.232 -> 172.31.36.109 TCP 10202 [TCP segment of a reassembled PDU]
339   0.254387 172.31.36.109 -> 54.230.30.232 TCP 66 49907 > http [ACK] Seq=98 Ack=1804677 Win=695168 Len=0 TSval=24993964 TSecr=665296554
340   0.254519 54.230.30.232 -> 172.31.36.109 TCP 5858 [TCP segment of a reassembled PDU]
341   0.254525 172.31.36.109 -> 54.230.30.232 TCP 66 49907 > http [ACK] Seq=98 Ack=1810469 Win=702336 Len=0 TSval=24993964 TSecr=665296554
342   0.254620 54.230.30.232 -> 172.31.36.109 TCP 14546 [TCP segment of a reassembled PDU]
343   0.254640 172.31.36.109 -> 54.230.30.232 TCP 66 49907 > http [ACK] Seq=98 Ack=1824949 Win=709248 Len=0 TSval=24993964 TSecr=665296554
344   0.254724 54.230.30.232 -> 172.31.36.109 TCP 2962 [TCP segment of a reassembled PDU]
345   0.254864 172.31.36.109 -> 54.230.30.232 TCP 66 49907 > http [ACK] Seq=98 Ack=1827845 Win=709248 Len=0 TSval=24993964 TSecr=665296554
346   0.254943 54.230.30.232 -> 172.31.36.109 TCP 21786 [TCP segment of a reassembled PDU]
347   0.254968 172.31.36.109 -> 54.230.30.232 TCP 66 49907 > http [ACK] Seq=98 Ack=1849565 Win=687616 Len=0 TSval=24993964 TSecr=665296554
348   0.255163 54.230.30.232 -> 172.31.36.109 TCP 10202 [TCP segment of a reassembled PDU]
349   0.255191 172.31.36.109 -> 54.230.30.232 TCP 66 49907 > http [ACK] Seq=98 Ack=1859701 Win=695168 Len=0 TSval=24993964 TSecr=665296554
350   0.255308 54.230.30.232 -> 172.31.36.109 TCP 8754 [TCP segment of a reassembled PDU]
351   0.255315 172.31.36.109 -> 54.230.30.232 TCP 66 49907 > http [ACK] Seq=98 Ack=1868389 Win=697600 Len=0 TSval=24993964 TSecr=665296554
352   0.255439 54.230.30.232 -> 172.31.36.109 TCP 18890 [TCP segment of a reassembled PDU]
353   0.255462 172.31.36.109 -> 54.230.30.232 TCP 66 49907 > http [ACK] Seq=98 Ack=1887213 Win=680832 Len=0 TSval=24993964 TSecr=665296554
354   0.255505 54.230.30.232 -> 172.31.36.109 TCP 7306 [TCP segment of a reassembled PDU]
