[Measurement for 10mb at 12:31:30 20.31.2014] 
Tshark:

  1   0.000000 172.31.36.109 -> 172.31.0.2   DNS 89 Standard query 0xee29  A d1xvcg6dfvgaki.cloudfront.net
  2   0.000025 172.31.36.109 -> 172.31.0.2   DNS 89 Standard query 0xd02c  AAAA d1xvcg6dfvgaki.cloudfront.net
  3   0.000543   172.31.0.2 -> 172.31.36.109 DNS 217 Standard query response 0xee29  A 54.192.30.194 A 54.192.30.222 A 54.230.29.254 A 54.230.30.6 A 54.230.30.28 A 54.230.30.68 A 54.230.30.189 A 54.192.30.187
  4   0.000556   172.31.0.2 -> 172.31.36.109 DNS 170 Standard query response 0xd02c 
  5   0.003819 172.31.36.109 -> 54.192.30.194 TCP 74 34778 > http [SYN] Seq=0 Win=26883 Len=0 MSS=8961 SACK_PERM=1 TSval=37594183 TSecr=0 WS=128
  6   0.005003 54.192.30.194 -> 172.31.36.109 TCP 74 http > 34778 [SYN, ACK] Seq=0 Ack=1 Win=14480 Len=0 MSS=1460 SACK_PERM=1 TSval=658763305 TSecr=37594183 WS=128
  7   0.005019 172.31.36.109 -> 54.192.30.194 TCP 66 34778 > http [ACK] Seq=1 Ack=1 Win=27008 Len=0 TSval=37594184 TSecr=658763305
  8   0.005061 172.31.36.109 -> 54.192.30.194 HTTP 163 GET /10mb HTTP/1.1 
  9   0.006275 54.192.30.194 -> 172.31.36.109 TCP 66 http > 34778 [ACK] Seq=1 Ack=98 Win=14592 Len=0 TSval=658763305 TSecr=37594184
 10   0.037959 54.192.30.194 -> 172.31.36.109 TCP 14164 [TCP segment of a reassembled PDU]
 11   0.037974 172.31.36.109 -> 54.192.30.194 TCP 66 34778 > http [ACK] Seq=98 Ack=14099 Win=55168 Len=0 TSval=37594192 TSecr=658763308
 12   0.039266 54.192.30.194 -> 172.31.36.109 TCP 1514 [TCP segment of a reassembled PDU]
 13   0.039273 172.31.36.109 -> 54.192.30.194 TCP 66 34778 > http [ACK] Seq=98 Ack=15547 Win=57984 Len=0 TSval=37594192 TSecr=658763308
 14   0.039287 54.192.30.194 -> 172.31.36.109 TCP 8754 [TCP segment of a reassembled PDU]
 15   0.039293 172.31.36.109 -> 54.192.30.194 TCP 66 34778 > http [ACK] Seq=98 Ack=24235 Win=75392 Len=0 TSval=37594192 TSecr=658763308
 16   0.039336 54.192.30.194 -> 172.31.36.109 TCP 2962 [TCP segment of a reassembled PDU]
 17   0.039341 172.31.36.109 -> 54.192.30.194 TCP 66 34778 > http [ACK] Seq=98 Ack=27131 Win=81152 Len=0 TSval=37594192 TSecr=658763308
 18   0.040634 54.192.30.194 -> 172.31.36.109 TCP 2962 [TCP segment of a reassembled PDU]
 19   0.040640 172.31.36.109 -> 54.192.30.194 TCP 66 34778 > http [ACK] Seq=98 Ack=30027 Win=87040 Len=0 TSval=37594193 TSecr=658763308
 20   0.040704 54.192.30.194 -> 172.31.36.109 TCP 7306 [TCP segment of a reassembled PDU]
 21   0.040710 172.31.36.109 -> 54.192.30.194 TCP 66 34778 > http [ACK] Seq=98 Ack=37267 Win=101504 Len=0 TSval=37594193 TSecr=658763308
 22   0.040765 54.192.30.194 -> 172.31.36.109 TCP 8754 [TCP segment of a reassembled PDU]
 23   0.040772 172.31.36.109 -> 54.192.30.194 TCP 66 34778 > http [ACK] Seq=98 Ack=45955 Win=103680 Len=0 TSval=37594193 TSecr=658763308
 24   0.040870 54.192.30.194 -> 172.31.36.109 TCP 1514 [TCP segment of a reassembled PDU]
 25   0.040875 172.31.36.109 -> 54.192.30.194 TCP 66 34778 > http [ACK] Seq=98 Ack=47403 Win=112000 Len=0 TSval=37594193 TSecr=658763308
 26   0.042025 54.192.30.194 -> 172.31.36.109 TCP 2962 [TCP segment of a reassembled PDU]
 27   0.042031 172.31.36.109 -> 54.192.30.194 TCP 66 34778 > http [ACK] Seq=98 Ack=50299 Win=117760 Len=0 TSval=37594193 TSecr=658763308
 28   0.042107 54.192.30.194 -> 172.31.36.109 TCP 10202 [TCP segment of a reassembled PDU]
 29   0.042115 172.31.36.109 -> 54.192.30.194 TCP 66 34778 > http [ACK] Seq=98 Ack=60435 Win=137984 Len=0 TSval=37594193 TSecr=658763308
 30   0.042161 54.192.30.194 -> 172.31.36.109 TCP 4924 [TCP segment of a reassembled PDU]
 31   0.042168 172.31.36.109 -> 54.192.30.194 TCP 66 34778 > http [ACK] Seq=98 Ack=65293 Win=147712 Len=0 TSval=37594193 TSecr=658763308
 32   0.048086 54.192.30.194 -> 172.31.36.109 TCP 2962 [TCP segment of a reassembled PDU]
 33   0.048094 172.31.36.109 -> 54.192.30.194 TCP 66 34778 > http [ACK] Seq=98 Ack=68189 Win=153472 Len=0 TSval=37594195 TSecr=658763309
 34   0.048243 54.192.30.194 -> 172.31.36.109 TCP 14546 [TCP segment of a reassembled PDU]
 35   0.048253 172.31.36.109 -> 54.192.30.194 TCP 66 34778 > http [ACK] Seq=98 Ack=82669 Win=182528 Len=0 TSval=37594195 TSecr=658763309
 36   0.048263 54.192.30.194 -> 172.31.36.109 TCP 2962 [TCP segment of a reassembled PDU]
 37   0.048270 172.31.36.109 -> 54.192.30.194 TCP 66 34778 > http [ACK] Seq=98 Ack=85565 Win=179712 Len=0 TSval=37594195 TSecr=658763309
 38   0.048281 54.192.30.194 -> 172.31.36.109 TCP 7306 [TCP segment of a reassembled PDU]
 39   0.048286 172.31.36.109 -> 54.192.30.194 TCP 66 34778 > http [ACK] Seq=98 Ack=92805 Win=172544 Len=0 TSval=37594195 TSecr=658763309
 40   0.049426 54.192.30.194 -> 172.31.36.109 TCP 1514 [TCP segment of a reassembled PDU]
 41   0.049431 172.31.36.109 -> 54.192.30.194 TCP 66 34778 > http [ACK] Seq=98 Ack=94253 Win=185344 Len=0 TSval=37594195 TSecr=658763309
 42   0.049532 54.192.30.194 -> 172.31.36.109 TCP 7306 [TCP segment of a reassembled PDU]
 43   0.049540 172.31.36.109 -> 54.192.30.194 TCP 66 34778 > http [ACK] Seq=98 Ack=101493 Win=195328 Len=0 TSval=37594195 TSecr=658763309
 44   0.049649 54.192.30.194 -> 172.31.36.109 TCP 11650 [TCP segment of a reassembled PDU]
 45   0.049658 172.31.36.109 -> 54.192.30.194 TCP 66 34778 > http [ACK] Seq=98 Ack=113077 Win=188288 Len=0 TSval=37594195 TSecr=658763309
 46   0.049733 54.192.30.194 -> 172.31.36.109 TCP 11650 [TCP segment of a reassembled PDU]
 47   0.049742 172.31.36.109 -> 54.192.30.194 TCP 66 34778 > http [ACK] Seq=98 Ack=124661 Win=188288 Len=0 TSval=37594195 TSecr=658763309
 48   0.049894 54.192.30.194 -> 172.31.36.109 TCP 1514 [TCP segment of a reassembled PDU]
 49   0.049899 172.31.36.109 -> 54.192.30.194 TCP 66 34778 > http [ACK] Seq=98 Ack=126109 Win=186880 Len=0 TSval=37594195 TSecr=658763309
 50   0.050925 54.192.30.194 -> 172.31.36.109 TCP 2962 [TCP segment of a reassembled PDU]
 51   0.050931 172.31.36.109 -> 54.192.30.194 TCP 66 34778 > http [ACK] Seq=98 Ack=129005 Win=202496 Len=0 TSval=37594195 TSecr=658763309
 52   0.051156 54.192.30.194 -> 172.31.36.109 TCP 1890 [TCP segment of a reassembled PDU]
 53   0.051162 172.31.36.109 -> 54.192.30.194 TCP 66 34778 > http [ACK] Seq=98 Ack=130829 Win=202496 Len=0 TSval=37594195 TSecr=658763309
 54   0.067593 54.192.30.194 -> 172.31.36.109 TCP 7306 [TCP segment of a reassembled PDU]
 55   0.067601 172.31.36.109 -> 54.192.30.194 TCP 66 34778 > http [ACK] Seq=98 Ack=138069 Win=195328 Len=0 TSval=37594199 TSecr=658763311
 56   0.067657 54.192.30.194 -> 172.31.36.109 TCP 4410 [TCP segment of a reassembled PDU]
 57   0.067663 172.31.36.109 -> 54.192.30.194 TCP 66 34778 > http [ACK] Seq=98 Ack=142413 Win=214400 Len=0 TSval=37594199 TSecr=658763311
 58   0.067895 54.192.30.194 -> 172.31.36.109 TCP 1514 [TCP segment of a reassembled PDU]
 59   0.067900 172.31.36.109 -> 54.192.30.194 TCP 66 34778 > http [ACK] Seq=98 Ack=143861 Win=217216 Len=0 TSval=37594199 TSecr=658763311
 60   0.067921 54.192.30.194 -> 172.31.36.109 TCP 17442 [TCP segment of a reassembled PDU]
 61   0.067929 172.31.36.109 -> 54.192.30.194 TCP 66 34778 > http [ACK] Seq=98 Ack=161237 Win=252032 Len=0 TSval=37594199 TSecr=658763311
 62   0.067951 54.192.30.194 -> 172.31.36.109 TCP 1514 [TCP segment of a reassembled PDU]
 63   0.067957 172.31.36.109 -> 54.192.30.194 TCP 66 34778 > http [ACK] Seq=98 Ack=162685 Win=254848 Len=0 TSval=37594200 TSecr=658763311
 64   0.068154 54.192.30.194 -> 172.31.36.109 TCP 5858 [TCP segment of a reassembled PDU]
 65   0.068165 172.31.36.109 -> 54.192.30.194 TCP 66 34778 > http [ACK] Seq=98 Ack=168477 Win=266496 Len=0 TSval=37594200 TSecr=658763311
 66   0.069090 54.192.30.194 -> 172.31.36.109 TCP 4410 [TCP segment of a reassembled PDU]
 67   0.069098 172.31.36.109 -> 54.192.30.194 TCP 66 34778 > http [ACK] Seq=98 Ack=172821 Win=275200 Len=0 TSval=37594200 TSecr=658763311
 68   0.069194 54.192.30.194 -> 172.31.36.109 TCP 7306 [TCP segment of a reassembled PDU]
 69   0.069201 172.31.36.109 -> 54.192.30.194 TCP 66 34778 > http [ACK] Seq=98 Ack=180061 Win=289664 Len=0 TSval=37594200 TSecr=658763311
 70   0.069372 54.192.30.194 -> 172.31.36.109 TCP 5858 [TCP segment of a reassembled PDU]
 71   0.069379 172.31.36.109 -> 54.192.30.194 TCP 66 34778 > http [ACK] Seq=98 Ack=185853 Win=301184 Len=0 TSval=37594200 TSecr=658763311
 72   0.069481 54.192.30.194 -> 172.31.36.109 TCP 10578 [TCP segment of a reassembled PDU]
 73   0.069489 172.31.36.109 -> 54.192.30.194 TCP 66 34778 > http [ACK] Seq=98 Ack=196365 Win=322304 Len=0 TSval=37594200 TSecr=658763311
 74   0.070645 54.192.30.194 -> 172.31.36.109 TCP 1514 [TCP segment of a reassembled PDU]
 75   0.070650 172.31.36.109 -> 54.192.30.194 TCP 66 34778 > http [ACK] Seq=98 Ack=197813 Win=325120 Len=0 TSval=37594200 TSecr=658763311
 76   0.070658 54.192.30.194 -> 172.31.36.109 TCP 5858 [TCP segment of a reassembled PDU]
 77   0.070663 172.31.36.109 -> 54.192.30.194 TCP 66 34778 > http [ACK] Seq=98 Ack=203605 Win=336768 Len=0 TSval=37594200 TSecr=658763311
 78   0.070949 54.192.30.194 -> 172.31.36.109 TCP 5858 [TCP segment of a reassembled PDU]
 79   0.070956 172.31.36.109 -> 54.192.30.194 TCP 66 34778 > http [ACK] Seq=98 Ack=209397 Win=348288 Len=0 TSval=37594200 TSecr=658763311
 80   0.071191 54.192.30.194 -> 172.31.36.109 TCP 11650 [TCP segment of a reassembled PDU]
 81   0.071200 172.31.36.109 -> 54.192.30.194 TCP 66 34778 > http [ACK] Seq=98 Ack=220981 Win=371456 Len=0 TSval=37594200 TSecr=658763311
 82   0.071329 54.192.30.194 -> 172.31.36.109 TCP 14546 [TCP segment of a reassembled PDU]
 83   0.071338 172.31.36.109 -> 54.192.30.194 TCP 66 34778 > http [ACK] Seq=98 Ack=235461 Win=400384 Len=0 TSval=37594200 TSecr=658763311
 84   0.071343 54.192.30.194 -> 172.31.36.109 TCP 1514 [TCP segment of a reassembled PDU]
 85   0.071345 172.31.36.109 -> 54.192.30.194 TCP 66 34778 > http [ACK] Seq=98 Ack=236909 Win=403328 Len=0 TSval=37594200 TSecr=658763311
 86   0.072449 54.192.30.194 -> 172.31.36.109 TCP 2962 [TCP segment of a reassembled PDU]
 87   0.072455 172.31.36.109 -> 54.192.30.194 TCP 66 34778 > http [ACK] Seq=98 Ack=239805 Win=409088 Len=0 TSval=37594201 TSecr=658763312
 88   0.072609 54.192.30.194 -> 172.31.36.109 TCP 22162 [TCP segment of a reassembled PDU]
 89   0.072621 172.31.36.109 -> 54.192.30.194 TCP 66 34778 > http [ACK] Seq=98 Ack=261901 Win=453376 Len=0 TSval=37594201 TSecr=658763312
 90   0.090660 54.192.30.194 -> 172.31.36.109 TCP 1514 [TCP segment of a reassembled PDU]
 91   0.090667 172.31.36.109 -> 54.192.30.194 TCP 66 34778 > http [ACK] Seq=98 Ack=263349 Win=456192 Len=0 TSval=37594205 TSecr=658763313
 92   0.090756 54.192.30.194 -> 172.31.36.109 TCP 1514 [TCP segment of a reassembled PDU]
 93   0.090762 172.31.36.109 -> 54.192.30.194 TCP 66 34778 > http [ACK] Seq=98 Ack=264797 Win=459136 Len=0 TSval=37594205 TSecr=658763313
 94   0.090883 54.192.30.194 -> 172.31.36.109 TCP 7306 [TCP segment of a reassembled PDU]
 95   0.090890 172.31.36.109 -> 54.192.30.194 TCP 66 34778 > http [ACK] Seq=98 Ack=272037 Win=473600 Len=0 TSval=37594205 TSecr=658763313
 96   0.091056 54.192.30.194 -> 172.31.36.109 TCP 17442 [TCP segment of a reassembled PDU]
 97   0.091066 172.31.36.109 -> 54.192.30.194 TCP 66 34778 > http [ACK] Seq=98 Ack=289413 Win=508288 Len=0 TSval=37594205 TSecr=658763313
 98   0.091076 54.192.30.194 -> 172.31.36.109 TCP 4410 [TCP segment of a reassembled PDU]
 99   0.091079 172.31.36.109 -> 54.192.30.194 TCP 66 34778 > http [ACK] Seq=98 Ack=293757 Win=516992 Len=0 TSval=37594205 TSecr=658763313
100   0.091223 54.192.30.194 -> 172.31.36.109 TCP 18890 [TCP segment of a reassembled PDU]
101   0.091234 172.31.36.109 -> 54.192.30.194 TCP 66 34778 > http [ACK] Seq=98 Ack=312581 Win=536704 Len=0 TSval=37594205 TSecr=658763313
102   0.091468 54.192.30.194 -> 172.31.36.109 TCP 2962 [TCP segment of a reassembled PDU]
103   0.091473 172.31.36.109 -> 54.192.30.194 TCP 66 34778 > http [ACK] Seq=98 Ack=315477 Win=560512 Len=0 TSval=37594205 TSecr=658763313
104   0.092417 54.192.30.194 -> 172.31.36.109 TCP 2962 [TCP segment of a reassembled PDU]
105   0.092425 172.31.36.109 -> 54.192.30.194 TCP 66 34778 > http [ACK] Seq=98 Ack=318373 Win=562816 Len=0 TSval=37594206 TSecr=658763314
106   0.092538 54.192.30.194 -> 172.31.36.109 TCP 9130 [TCP segment of a reassembled PDU]
107   0.092559 172.31.36.109 -> 54.192.30.194 TCP 66 34778 > http [ACK] Seq=98 Ack=327437 Win=565888 Len=0 TSval=37594206 TSecr=658763314
108   0.101195 54.192.30.194 -> 172.31.36.109 TCP 2962 [TCP segment of a reassembled PDU]
109   0.101217 172.31.36.109 -> 54.192.30.194 TCP 66 34778 > http [ACK] Seq=98 Ack=330333 Win=565888 Len=0 TSval=37594208 TSecr=658763314
110   0.101274 54.192.30.194 -> 172.31.36.109 TCP 2962 [TCP segment of a reassembled PDU]
111   0.101290 172.31.36.109 -> 54.192.30.194 TCP 66 34778 > http [ACK] Seq=98 Ack=333229 Win=565888 Len=0 TSval=37594208 TSecr=658763314
112   0.101624 54.192.30.194 -> 172.31.36.109 TCP 39162 [TCP segment of a reassembled PDU]
113   0.101657 172.31.36.109 -> 54.192.30.194 TCP 66 34778 > http [ACK] Seq=98 Ack=372325 Win=526848 Len=0 TSval=37594208 TSecr=658763314
114   0.101773 54.192.30.194 -> 172.31.36.109 TCP 14546 [TCP segment of a reassembled PDU]
115   0.101782 172.31.36.109 -> 54.192.30.194 TCP 66 34778 > http [ACK] Seq=98 Ack=386805 Win=543744 Len=0 TSval=37594208 TSecr=658763314
116   0.102977 54.192.30.194 -> 172.31.36.109 TCP 2962 [TCP segment of a reassembled PDU]
117   0.102983 172.31.36.109 -> 54.192.30.194 TCP 66 34778 > http [ACK] Seq=98 Ack=389701 Win=562816 Len=0 TSval=37594208 TSecr=658763315
118   0.103094 54.192.30.194 -> 172.31.36.109 TCP 3338 [TCP segment of a reassembled PDU]
119   0.103111 172.31.36.109 -> 54.192.30.194 TCP 66 34778 > http [ACK] Seq=98 Ack=392973 Win=565888 Len=0 TSval=37594208 TSecr=658763315
120   0.106269 54.192.30.194 -> 172.31.36.109 TCP 1514 [TCP segment of a reassembled PDU]
121   0.106400 54.192.30.194 -> 172.31.36.109 TCP 5858 [TCP segment of a reassembled PDU]
122   0.106429 172.31.36.109 -> 54.192.30.194 TCP 66 34778 > http [ACK] Seq=98 Ack=400213 Win=565888 Len=0 TSval=37594209 TSecr=658763315
123   0.106544 54.192.30.194 -> 172.31.36.109 TCP 13098 [TCP segment of a reassembled PDU]
124   0.106565 172.31.36.109 -> 54.192.30.194 TCP 66 34778 > http [ACK] Seq=98 Ack=413245 Win=565888 Len=0 TSval=37594209 TSecr=658763315
125   0.106662 54.192.30.194 -> 172.31.36.109 TCP 20338 [TCP segment of a reassembled PDU]
126   0.106685 172.31.36.109 -> 54.192.30.194 TCP 66 34778 > http [ACK] Seq=98 Ack=433517 Win=545664 Len=0 TSval=37594209 TSecr=658763315
127   0.106769 54.192.30.194 -> 172.31.36.109 TCP 14546 [TCP segment of a reassembled PDU]
128   0.106793 54.192.30.194 -> 172.31.36.109 TCP 1514 [TCP segment of a reassembled PDU]
129   0.106807 172.31.36.109 -> 54.192.30.194 TCP 66 34778 > http [ACK] Seq=98 Ack=449445 Win=565888 Len=0 TSval=37594209 TSecr=658763315
130   0.106836 54.192.30.194 -> 172.31.36.109 TCP 7306 [TCP segment of a reassembled PDU]
131   0.106865 172.31.36.109 -> 54.192.30.194 TCP 66 34778 > http [ACK] Seq=98 Ack=456685 Win=565888 Len=0 TSval=37594209 TSecr=658763315
132   0.108052 54.192.30.194 -> 172.31.36.109 TCP 2962 [TCP segment of a reassembled PDU]
133   0.108071 172.31.36.109 -> 54.192.30.194 TCP 66 34778 > http [ACK] Seq=98 Ack=459581 Win=565888 Len=0 TSval=37594210 TSecr=658763315
134   0.108262 54.192.30.194 -> 172.31.36.109 TCP 33370 [TCP segment of a reassembled PDU]
135   0.108435 54.192.30.194 -> 172.31.36.109 TCP 20338 [TCP segment of a reassembled PDU]
136   0.108500 172.31.36.109 -> 54.192.30.194 TCP 66 34778 > http [ACK] Seq=98 Ack=513157 Win=512384 Len=0 TSval=37594210 TSecr=658763315
137   0.108525 54.192.30.194 -> 172.31.36.109 TCP 5858 [TCP segment of a reassembled PDU]
138   0.108542 172.31.36.109 -> 54.192.30.194 TCP 66 34778 > http [ACK] Seq=98 Ack=518949 Win=524672 Len=0 TSval=37594210 TSecr=658763315
139   0.109873 54.192.30.194 -> 172.31.36.109 TCP 2962 [TCP segment of a reassembled PDU]
140   0.109878 172.31.36.109 -> 54.192.30.194 TCP 66 34778 > http [ACK] Seq=98 Ack=521845 Win=562816 Len=0 TSval=37594210 TSecr=658763315
141   0.111177 54.192.30.194 -> 172.31.36.109 TCP 2266 [TCP segment of a reassembled PDU]
142   0.111184 172.31.36.109 -> 54.192.30.194 TCP 66 34778 > http [ACK] Seq=98 Ack=524045 Win=562816 Len=0 TSval=37594210 TSecr=658763315
143   0.119070 54.192.30.194 -> 172.31.36.109 TCP 1514 [TCP segment of a reassembled PDU]
144   0.119077 54.192.30.194 -> 172.31.36.109 TCP 1514 [TCP segment of a reassembled PDU]
145   0.119081 172.31.36.109 -> 54.192.30.194 TCP 66 34778 > http [ACK] Seq=98 Ack=526941 Win=562816 Len=0 TSval=37594212 TSecr=658763316
146   0.119147 54.192.30.194 -> 172.31.36.109 TCP 1514 [TCP segment of a reassembled PDU]
147   0.119485 54.192.30.194 -> 172.31.36.109 TCP 2962 [TCP segment of a reassembled PDU]
148   0.119492 172.31.36.109 -> 54.192.30.194 TCP 66 34778 > http [ACK] Seq=98 Ack=531285 Win=562816 Len=0 TSval=37594212 TSecr=658763316
149   0.119500 54.192.30.194 -> 172.31.36.109 TCP 5858 [TCP segment of a reassembled PDU]
150   0.119513 54.192.30.194 -> 172.31.36.109 TCP 10202 [TCP segment of a reassembled PDU]
151   0.119535 172.31.36.109 -> 54.192.30.194 TCP 66 34778 > http [ACK] Seq=98 Ack=547213 Win=551040 Len=0 TSval=37594212 TSecr=658763316
152   0.119706 54.192.30.194 -> 172.31.36.109 TCP 15994 [TCP segment of a reassembled PDU]
153   0.119722 54.192.30.194 -> 172.31.36.109 TCP 7306 [TCP segment of a reassembled PDU]
154   0.119740 172.31.36.109 -> 54.192.30.194 TCP 66 34778 > http [ACK] Seq=98 Ack=570381 Win=555776 Len=0 TSval=37594212 TSecr=658763316
155   0.119859 54.192.30.194 -> 172.31.36.109 TCP 13098 [TCP segment of a reassembled PDU]
156   0.119888 172.31.36.109 -> 54.192.30.194 TCP 66 34778 > http [ACK] Seq=98 Ack=583413 Win=565888 Len=0 TSval=37594212 TSecr=658763316
157   0.120322 54.192.30.194 -> 172.31.36.109 TCP 2962 [TCP segment of a reassembled PDU]
158   0.120339 172.31.36.109 -> 54.192.30.194 TCP 66 34778 > http [ACK] Seq=98 Ack=586309 Win=565888 Len=0 TSval=37594213 TSecr=658763316
159   0.120437 54.192.30.194 -> 172.31.36.109 TCP 1514 [TCP segment of a reassembled PDU]
160   0.120625 54.192.30.194 -> 172.31.36.109 TCP 10202 [TCP segment of a reassembled PDU]
161   0.120669 172.31.36.109 -> 54.192.30.194 TCP 66 34778 > http [ACK] Seq=98 Ack=597893 Win=565888 Len=0 TSval=37594213 TSecr=658763316
162   0.120872 54.192.30.194 -> 172.31.36.109 TCP 2962 [TCP segment of a reassembled PDU]
163   0.120888 172.31.36.109 -> 54.192.30.194 TCP 66 34778 > http [ACK] Seq=98 Ack=600789 Win=565888 Len=0 TSval=37594213 TSecr=658763316
164   0.121022 54.192.30.194 -> 172.31.36.109 TCP 23234 [TCP segment of a reassembled PDU]
165   0.121035 54.192.30.194 -> 172.31.36.109 TCP 1514 [TCP segment of a reassembled PDU]
166   0.121050 172.31.36.109 -> 54.192.30.194 TCP 66 34778 > http [ACK] Seq=98 Ack=625405 Win=541312 Len=0 TSval=37594213 TSecr=658763316
167   0.121150 54.192.30.194 -> 172.31.36.109 TCP 4410 [TCP segment of a reassembled PDU]
168   0.121157 172.31.36.109 -> 54.192.30.194 TCP 66 34778 > http [ACK] Seq=98 Ack=629749 Win=560512 Len=0 TSval=37594213 TSecr=658763316
169   0.121232 54.192.30.194 -> 172.31.36.109 TCP 1514 [TCP segment of a reassembled PDU]
170   0.121415 54.192.30.194 -> 172.31.36.109 TCP 7306 [TCP segment of a reassembled PDU]
171   0.121432 172.31.36.109 -> 54.192.30.194 TCP 66 34778 > http [ACK] Seq=98 Ack=638437 Win=565888 Len=0 TSval=37594213 TSecr=658763316
172   0.121527 54.192.30.194 -> 172.31.36.109 TCP 20338 [TCP segment of a reassembled PDU]
173   0.121551 172.31.36.109 -> 54.192.30.194 TCP 66 34778 > http [ACK] Seq=98 Ack=658709 Win=545664 Len=0 TSval=37594213 TSecr=658763316
174   0.121640 54.192.30.194 -> 172.31.36.109 TCP 4410 [TCP segment of a reassembled PDU]
175   0.121646 172.31.36.109 -> 54.192.30.194 TCP 66 34778 > http [ACK] Seq=98 Ack=663053 Win=560512 Len=0 TSval=37594213 TSecr=658763316
176   0.121972 54.192.30.194 -> 172.31.36.109 TCP 2962 [TCP segment of a reassembled PDU]
177   0.121977 172.31.36.109 -> 54.192.30.194 TCP 66 34778 > http [ACK] Seq=98 Ack=665949 Win=562816 Len=0 TSval=37594213 TSecr=658763316
178   0.122030 54.192.30.194 -> 172.31.36.109 TCP 2962 [TCP segment of a reassembled PDU]
179   0.122035 172.31.36.109 -> 54.192.30.194 TCP 66 34778 > http [ACK] Seq=98 Ack=668845 Win=562816 Len=0 TSval=37594213 TSecr=658763316
180   0.122370 54.192.30.194 -> 172.31.36.109 TCP 2962 [TCP segment of a reassembled PDU]
181   0.122375 172.31.36.109 -> 54.192.30.194 TCP 66 34778 > http [ACK] Seq=98 Ack=671741 Win=562816 Len=0 TSval=37594213 TSecr=658763317
182   0.122542 54.192.30.194 -> 172.31.36.109 TCP 29026 [TCP segment of a reassembled PDU]
183   0.122570 172.31.36.109 -> 54.192.30.194 TCP 66 34778 > http [ACK] Seq=98 Ack=700701 Win=533888 Len=0 TSval=37594213 TSecr=658763317
184   0.122679 54.192.30.194 -> 172.31.36.109 TCP 7306 [TCP segment of a reassembled PDU]
185   0.122687 172.31.36.109 -> 54.192.30.194 TCP 66 34778 > http [ACK] Seq=98 Ack=707941 Win=555776 Len=0 TSval=37594213 TSecr=658763317
186   0.122808 54.192.30.194 -> 172.31.36.109 TCP 8754 [TCP segment of a reassembled PDU]
187   0.122910 54.192.30.194 -> 172.31.36.109 TCP 8754 [TCP segment of a reassembled PDU]
188   0.123019 54.192.30.194 -> 172.31.36.109 TCP 8754 [TCP segment of a reassembled PDU]
189   0.123049 172.31.36.109 -> 54.192.30.194 TCP 66 34778 > http [ACK] Seq=98 Ack=734005 Win=539008 Len=0 TSval=37594213 TSecr=658763317
190   0.123477 54.192.30.194 -> 172.31.36.109 TCP 4410 [TCP segment of a reassembled PDU]
191   0.123484 172.31.36.109 -> 54.192.30.194 TCP 66 34778 > http [ACK] Seq=98 Ack=738349 Win=560512 Len=0 TSval=37594213 TSecr=658763317
192   0.123600 54.192.30.194 -> 172.31.36.109 TCP 10202 [TCP segment of a reassembled PDU]
193   0.123619 172.31.36.109 -> 54.192.30.194 TCP 66 34778 > http [ACK] Seq=98 Ack=748485 Win=565888 Len=0 TSval=37594213 TSecr=658763317
194   0.123739 54.192.30.194 -> 172.31.36.109 TCP 17442 [TCP segment of a reassembled PDU]
195   0.123761 172.31.36.109 -> 54.192.30.194 TCP 66 34778 > http [ACK] Seq=98 Ack=765861 Win=548608 Len=0 TSval=37594213 TSecr=658763317
196   0.123947 54.192.30.194 -> 172.31.36.109 TCP 2962 [TCP segment of a reassembled PDU]
197   0.123952 172.31.36.109 -> 54.192.30.194 TCP 66 34778 > http [ACK] Seq=98 Ack=768757 Win=562816 Len=0 TSval=37594214 TSecr=658763317
198   0.124058 54.192.30.194 -> 172.31.36.109 TCP 7306 [TCP segment of a reassembled PDU]
199   0.124076 172.31.36.109 -> 54.192.30.194 TCP 66 34778 > http [ACK] Seq=98 Ack=775997 Win=565888 Len=0 TSval=37594214 TSecr=658763317
200   0.124347 54.192.30.194 -> 172.31.36.109 TCP 10258 [TCP segment of a reassembled PDU]
201   0.124367 172.31.36.109 -> 54.192.30.194 TCP 66 34778 > http [ACK] Seq=98 Ack=786189 Win=565888 Len=0 TSval=37594214 TSecr=658763317
202   0.125469 54.192.30.194 -> 172.31.36.109 TCP 1514 [TCP segment of a reassembled PDU]
203   0.125705 54.192.30.194 -> 172.31.36.109 TCP 4410 [TCP segment of a reassembled PDU]
204   0.125720 172.31.36.109 -> 54.192.30.194 TCP 66 34778 > http [ACK] Seq=98 Ack=791981 Win=565888 Len=0 TSval=37594214 TSecr=658763317
205   0.125829 54.192.30.194 -> 172.31.36.109 TCP 11650 [TCP segment of a reassembled PDU]
206   0.125849 172.31.36.109 -> 54.192.30.194 TCP 66 34778 > http [ACK] Seq=98 Ack=803565 Win=565888 Len=0 TSval=37594214 TSecr=658763317
207   0.126093 54.192.30.194 -> 172.31.36.109 TCP 10202 [TCP segment of a reassembled PDU]
208   0.126113 54.192.30.194 -> 172.31.36.109 TCP 13098 [TCP segment of a reassembled PDU]
209   0.126133 172.31.36.109 -> 54.192.30.194 TCP 66 34778 > http [ACK] Seq=98 Ack=826733 Win=546304 Len=0 TSval=37594214 TSecr=658763317
210   0.126148 54.192.30.194 -> 172.31.36.109 TCP 8754 [TCP segment of a reassembled PDU]
211   0.126164 172.31.36.109 -> 54.192.30.194 TCP 66 34778 > http [ACK] Seq=98 Ack=835421 Win=565888 Len=0 TSval=37594214 TSecr=658763317
212   0.126289 54.192.30.194 -> 172.31.36.109 TCP 4410 [TCP segment of a reassembled PDU]
213   0.126304 54.192.30.194 -> 172.31.36.109 TCP 14546 [TCP segment of a reassembled PDU]
214   0.126373 54.192.30.194 -> 172.31.36.109 TCP 9130 [TCP segment of a reassembled PDU]
215   0.126434 172.31.36.109 -> 54.192.30.194 TCP 66 34778 > http [ACK] Seq=98 Ack=863309 Win=538112 Len=0 TSval=37594214 TSecr=658763317
216   0.127107 54.192.30.194 -> 172.31.36.109 TCP 2962 [TCP segment of a reassembled PDU]
217   0.127113 172.31.36.109 -> 54.192.30.194 TCP 66 34778 > http [ACK] Seq=98 Ack=866205 Win=562816 Len=0 TSval=37594214 TSecr=658763317
218   0.127393 54.192.30.194 -> 172.31.36.109 TCP 21786 [TCP segment of a reassembled PDU]
219   0.127416 54.192.30.194 -> 172.31.36.109 TCP 2962 [TCP segment of a reassembled PDU]
220   0.127426 172.31.36.109 -> 54.192.30.194 TCP 66 34778 > http [ACK] Seq=98 Ack=890821 Win=538240 Len=0 TSval=37594214 TSecr=658763317
221   0.127488 54.192.30.194 -> 172.31.36.109 TCP 14546 [TCP segment of a reassembled PDU]
222   0.127498 172.31.36.109 -> 54.192.30.194 TCP 66 34778 > http [ACK] Seq=98 Ack=905301 Win=543744 Len=0 TSval=37594214 TSecr=658763317
223   0.127616 54.192.30.194 -> 172.31.36.109 TCP 18890 [TCP segment of a reassembled PDU]
224   0.127639 172.31.36.109 -> 54.192.30.194 TCP 66 34778 > http [ACK] Seq=98 Ack=924125 Win=536704 Len=0 TSval=37594214 TSecr=658763317
225   0.127821 54.192.30.194 -> 172.31.36.109 TCP 4410 [TCP segment of a reassembled PDU]
226   0.127827 172.31.36.109 -> 54.192.30.194 TCP 66 34778 > http [ACK] Seq=98 Ack=928469 Win=560512 Len=0 TSval=37594214 TSecr=658763317
227   0.128091 54.192.30.194 -> 172.31.36.109 TCP 15994 [TCP segment of a reassembled PDU]
228   0.128115 172.31.36.109 -> 54.192.30.194 TCP 66 34778 > http [ACK] Seq=98 Ack=944397 Win=565888 Len=0 TSval=37594215 TSecr=658763317
229   0.128251 54.192.30.194 -> 172.31.36.109 TCP 23234 [TCP segment of a reassembled PDU]
230   0.128264 172.31.36.109 -> 54.192.30.194 TCP 66 34778 > http [ACK] Seq=98 Ack=967565 Win=612224 Len=0 TSval=37594215 TSecr=658763317
231   0.128308 54.192.30.194 -> 172.31.36.109 TCP 4410 [TCP segment of a reassembled PDU]
232   0.128314 172.31.36.109 -> 54.192.30.194 TCP 66 34778 > http [ACK] Seq=98 Ack=971909 Win=620928 Len=0 TSval=37594215 TSecr=658763317
233   0.128822 54.192.30.194 -> 172.31.36.109 TCP 7306 [TCP segment of a reassembled PDU]
234   0.128830 172.31.36.109 -> 54.192.30.194 TCP 66 34778 > http [ACK] Seq=98 Ack=979149 Win=635392 Len=0 TSval=37594215 TSecr=658763317
235   0.128975 54.192.30.194 -> 172.31.36.109 TCP 24682 [TCP segment of a reassembled PDU]
236   0.128988 172.31.36.109 -> 54.192.30.194 TCP 66 34778 > http [ACK] Seq=98 Ack=1003765 Win=684672 Len=0 TSval=37594215 TSecr=658763317
237   0.129055 54.192.30.194 -> 172.31.36.109 TCP 2962 [TCP segment of a reassembled PDU]
238   0.129061 172.31.36.109 -> 54.192.30.194 TCP 66 34778 > http [ACK] Seq=98 Ack=1006661 Win=690432 Len=0 TSval=37594215 TSecr=658763317
239   0.129198 54.192.30.194 -> 172.31.36.109 TCP 13098 [TCP segment of a reassembled PDU]
240   0.129207 172.31.36.109 -> 54.192.30.194 TCP 66 34778 > http [ACK] Seq=98 Ack=1019693 Win=716544 Len=0 TSval=37594215 TSecr=658763317
241   0.129326 54.192.30.194 -> 172.31.36.109 TCP 17442 [TCP segment of a reassembled PDU]
242   0.129348 172.31.36.109 -> 54.192.30.194 TCP 66 34778 > http [ACK] Seq=98 Ack=1037069 Win=710272 Len=0 TSval=37594215 TSecr=658763317
243   0.129467 54.192.30.194 -> 172.31.36.109 TCP 1514 [TCP segment of a reassembled PDU]
244   0.129472 172.31.36.109 -> 54.192.30.194 TCP 66 34778 > http [ACK] Seq=98 Ack=1038517 Win=719488 Len=0 TSval=37594215 TSecr=658763317
245   0.129481 54.192.30.194 -> 172.31.36.109 TCP 7306 [TCP segment of a reassembled PDU]
246   0.129485 172.31.36.109 -> 54.192.30.194 TCP 66 34778 > http [ACK] Seq=98 Ack=1045757 Win=724608 Len=0 TSval=37594215 TSecr=658763317
247   0.129671 54.192.30.194 -> 172.31.36.109 TCP 2962 [TCP segment of a reassembled PDU]
248   0.129676 172.31.36.109 -> 54.192.30.194 TCP 66 34778 > http [ACK] Seq=98 Ack=1048653 Win=734080 Len=0 TSval=37594215 TSecr=658763317
249   0.129812 54.192.30.194 -> 172.31.36.109 TCP 10202 [TCP segment of a reassembled PDU]
250   0.129831 172.31.36.109 -> 54.192.30.194 TCP 66 34778 > http [ACK] Seq=98 Ack=1058789 Win=738944 Len=0 TSval=37594215 TSecr=658763317
251   0.130224 54.192.30.194 -> 172.31.36.109 TCP 13098 [TCP segment of a reassembled PDU]
252   0.130244 172.31.36.109 -> 54.192.30.194 TCP 66 34778 > http [ACK] Seq=98 Ack=1071821 Win=738944 Len=0 TSval=37594215 TSecr=658763317
253   0.130352 54.192.30.194 -> 172.31.36.109 TCP 13098 [TCP segment of a reassembled PDU]
254   0.130483 54.192.30.194 -> 172.31.36.109 TCP 20338 [TCP segment of a reassembled PDU]
255   0.130501 172.31.36.109 -> 54.192.30.194 TCP 66 34778 > http [ACK] Seq=98 Ack=1105125 Win=705664 Len=0 TSval=37594215 TSecr=658763317
256   0.130600 54.192.30.194 -> 172.31.36.109 TCP 7306 [TCP segment of a reassembled PDU]
257   0.130608 172.31.36.109 -> 54.192.30.194 TCP 66 34778 > http [ACK] Seq=98 Ack=1112365 Win=726912 Len=0 TSval=37594215 TSecr=658763317
258   0.130712 54.192.30.194 -> 172.31.36.109 TCP 11650 [TCP segment of a reassembled PDU]
259   0.130732 172.31.36.109 -> 54.192.30.194 TCP 66 34778 > http [ACK] Seq=98 Ack=1123949 Win=738944 Len=0 TSval=37594215 TSecr=658763317
260   0.130825 54.192.30.194 -> 172.31.36.109 TCP 5858 [TCP segment of a reassembled PDU]
261   0.130842 172.31.36.109 -> 54.192.30.194 TCP 66 34778 > http [ACK] Seq=98 Ack=1129741 Win=738944 Len=0 TSval=37594215 TSecr=658763317
262   0.130967 54.192.30.194 -> 172.31.36.109 TCP 14546 [TCP segment of a reassembled PDU]
263   0.130988 172.31.36.109 -> 54.192.30.194 TCP 66 34778 > http [ACK] Seq=98 Ack=1144221 Win=738944 Len=0 TSval=37594215 TSecr=658763317
264   0.131121 54.192.30.194 -> 172.31.36.109 TCP 23234 [TCP segment of a reassembled PDU]
265   0.131146 172.31.36.109 -> 54.192.30.194 TCP 66 34778 > http [ACK] Seq=98 Ack=1167389 Win=715776 Len=0 TSval=37594215 TSecr=658763317
266   0.131734 54.192.30.194 -> 172.31.36.109 TCP 2962 [TCP segment of a reassembled PDU]
267   0.131739 172.31.36.109 -> 54.192.30.194 TCP 66 34778 > http [ACK] Seq=98 Ack=1170285 Win=734080 Len=0 TSval=37594215 TSecr=658763317
268   0.131873 54.192.30.194 -> 172.31.36.109 TCP 9186 [TCP segment of a reassembled PDU]
269   0.131894 172.31.36.109 -> 54.192.30.194 TCP 66 34778 > http [ACK] Seq=98 Ack=1179405 Win=738944 Len=0 TSval=37594215 TSecr=658763317
270   0.142277 54.192.30.194 -> 172.31.36.109 TCP 1514 [TCP segment of a reassembled PDU]
271   0.142293 54.192.30.194 -> 172.31.36.109 TCP 8754 [TCP segment of a reassembled PDU]
272   0.142317 172.31.36.109 -> 54.192.30.194 TCP 66 34778 > http [ACK] Seq=98 Ack=1189541 Win=739712 Len=0 TSval=37594218 TSecr=658763318
273   0.142502 54.192.30.194 -> 172.31.36.109 TCP 2962 [TCP segment of a reassembled PDU]
274   0.142508 172.31.36.109 -> 54.192.30.194 TCP 66 34778 > http [ACK] Seq=98 Ack=1192437 Win=745472 Len=0 TSval=37594218 TSecr=658763319
275   0.142516 54.192.30.194 -> 172.31.36.109 TCP 5858 [TCP segment of a reassembled PDU]
276   0.142520 172.31.36.109 -> 54.192.30.194 TCP 66 34778 > http [ACK] Seq=98 Ack=1198229 Win=757120 Len=0 TSval=37594218 TSecr=658763319
277   0.142647 54.192.30.194 -> 172.31.36.109 TCP 15994 [TCP segment of a reassembled PDU]
278   0.142657 172.31.36.109 -> 54.192.30.194 TCP 66 34778 > http [ACK] Seq=98 Ack=1214157 Win=788992 Len=0 TSval=37594218 TSecr=658763319
279   0.142794 54.192.30.194 -> 172.31.36.109 TCP 10202 [TCP segment of a reassembled PDU]
280   0.142804 172.31.36.109 -> 54.192.30.194 TCP 66 34778 > http [ACK] Seq=98 Ack=1224293 Win=809216 Len=0 TSval=37594218 TSecr=658763319
281   0.142817 54.192.30.194 -> 172.31.36.109 TCP 8754 [TCP segment of a reassembled PDU]
282   0.142822 172.31.36.109 -> 54.192.30.194 TCP 66 34778 > http [ACK] Seq=98 Ack=1232981 Win=826624 Len=0 TSval=37594218 TSecr=658763319
283   0.142981 54.192.30.194 -> 172.31.36.109 TCP 4410 [TCP segment of a reassembled PDU]
284   0.143001 172.31.36.109 -> 54.192.30.194 TCP 66 34778 > http [ACK] Seq=98 Ack=1237325 Win=835328 Len=0 TSval=37594218 TSecr=658763319
285   0.143197 54.192.30.194 -> 172.31.36.109 TCP 7682 [TCP segment of a reassembled PDU]
286   0.143204 172.31.36.109 -> 54.192.30.194 TCP 66 34778 > http [ACK] Seq=98 Ack=1244941 Win=850560 Len=0 TSval=37594218 TSecr=658763319
287   0.143210 54.192.30.194 -> 172.31.36.109 TCP 2962 [TCP segment of a reassembled PDU]
288   0.143214 172.31.36.109 -> 54.192.30.194 TCP 66 34778 > http [ACK] Seq=98 Ack=1247837 Win=856320 Len=0 TSval=37594218 TSecr=658763319
289   0.143231 54.192.30.194 -> 172.31.36.109 TCP 20338 [TCP segment of a reassembled PDU]
290   0.143240 172.31.36.109 -> 54.192.30.194 TCP 66 34778 > http [ACK] Seq=98 Ack=1268109 Win=896896 Len=0 TSval=37594218 TSecr=658763319
291   0.143337 54.192.30.194 -> 172.31.36.109 TCP 1514 [TCP segment of a reassembled PDU]
292   0.143342 172.31.36.109 -> 54.192.30.194 TCP 66 34778 > http [ACK] Seq=98 Ack=1269557 Win=899712 Len=0 TSval=37594218 TSecr=658763319
293   0.143606 54.192.30.194 -> 172.31.36.109 TCP 13098 [TCP segment of a reassembled PDU]
294   0.143614 172.31.36.109 -> 54.192.30.194 TCP 66 34778 > http [ACK] Seq=98 Ack=1282589 Win=925824 Len=0 TSval=37594218 TSecr=658763319
295   0.143683 54.192.30.194 -> 172.31.36.109 TCP 7306 [TCP segment of a reassembled PDU]
296   0.143689 172.31.36.109 -> 54.192.30.194 TCP 66 34778 > http [ACK] Seq=98 Ack=1289829 Win=940288 Len=0 TSval=37594218 TSecr=658763319
297   0.143812 54.192.30.194 -> 172.31.36.109 TCP 20714 [TCP segment of a reassembled PDU]
298   0.143837 172.31.36.109 -> 54.192.30.194 TCP 66 34778 > http [ACK] Seq=98 Ack=1310477 Win=919680 Len=0 TSval=37594218 TSecr=658763319
299   0.189878 54.192.30.194 -> 172.31.36.109 TCP 4410 [TCP segment of a reassembled PDU]
300   0.189895 172.31.36.109 -> 54.192.30.194 TCP 66 34778 > http [ACK] Seq=98 Ack=1314821 Win=947968 Len=0 TSval=37594230 TSecr=658763323
301   0.189918 54.192.30.194 -> 172.31.36.109 TCP 2962 [TCP segment of a reassembled PDU]
302   0.189937 172.31.36.109 -> 54.192.30.194 TCP 66 34778 > http [ACK] Seq=98 Ack=1317717 Win=948992 Len=0 TSval=37594230 TSecr=658763323
303   0.190157 54.192.30.194 -> 172.31.36.109 TCP 5858 [TCP segment of a reassembled PDU]
304   0.190171 54.192.30.194 -> 172.31.36.109 TCP 8754 [TCP segment of a reassembled PDU]
305   0.190190 172.31.36.109 -> 54.192.30.194 TCP 66 34778 > http [ACK] Seq=98 Ack=1332197 Win=948992 Len=0 TSval=37594230 TSecr=658763323
306   0.190551 54.192.30.194 -> 172.31.36.109 TCP 17442 [TCP segment of a reassembled PDU]
307   0.190573 54.192.30.194 -> 172.31.36.109 TCP 20338 [TCP segment of a reassembled PDU]
308   0.190598 54.192.30.194 -> 172.31.36.109 TCP 7306 [TCP segment of a reassembled PDU]
309   0.190659 54.192.30.194 -> 172.31.36.109 TCP 8754 [TCP segment of a reassembled PDU]
310   0.190820 54.192.30.194 -> 172.31.36.109 TCP 9130 [TCP segment of a reassembled PDU]
311   0.190826 54.192.30.194 -> 172.31.36.109 TCP 1514 [TCP segment of a reassembled PDU]
312   0.190833 54.192.30.194 -> 172.31.36.109 TCP 2962 [TCP segment of a reassembled PDU]
313   0.190883 54.192.30.194 -> 172.31.36.109 TCP 13098 [TCP segment of a reassembled PDU]
314   0.190977 54.192.30.194 -> 172.31.36.109 TCP 4410 [TCP segment of a reassembled PDU]
315   0.191415 54.192.30.194 -> 172.31.36.109 TCP 2962 [TCP segment of a reassembled PDU]
316   0.191613 54.192.30.194 -> 172.31.36.109 TCP 18890 [TCP segment of a reassembled PDU]
317   0.191638 54.192.30.194 -> 172.31.36.109 TCP 3338 [TCP segment of a reassembled PDU]
318   0.195201 54.192.30.194 -> 172.31.36.109 TCP 1514 [TCP segment of a reassembled PDU]
319   0.195972 172.31.36.109 -> 54.192.30.194 TCP 66 34778 > http [ACK] Seq=98 Ack=1442997 Win=838272 Len=0 TSval=37594232 TSecr=658763323
320   0.196216 54.192.30.194 -> 172.31.36.109 TCP 2962 [TCP segment of a reassembled PDU]
321   0.196222 172.31.36.109 -> 54.192.30.194 TCP 66 34778 > http [ACK] Seq=98 Ack=1445893 Win=950272 Len=0 TSval=37594232 TSecr=658763324
322   0.196352 54.192.30.194 -> 172.31.36.109 TCP 21786 [TCP segment of a reassembled PDU]
323   0.196440 54.192.30.194 -> 172.31.36.109 TCP 10202 [TCP segment of a reassembled PDU]
324   0.196573 172.31.36.109 -> 54.192.30.194 TCP 66 34778 > http [ACK] Seq=98 Ack=1477749 Win=918528 Len=0 TSval=37594232 TSecr=658763324
325   0.197193 54.192.30.194 -> 172.31.36.109 TCP 2962 [TCP segment of a reassembled PDU]
326   0.197202 172.31.36.109 -> 54.192.30.194 TCP 66 34778 > http [ACK] Seq=98 Ack=1480645 Win=950272 Len=0 TSval=37594232 TSecr=658763324
327   0.197307 54.192.30.194 -> 172.31.36.109 TCP 10202 [TCP segment of a reassembled PDU]
328   0.197325 172.31.36.109 -> 54.192.30.194 TCP 66 34778 > http [ACK] Seq=98 Ack=1490781 Win=950272 Len=0 TSval=37594232 TSecr=658763324
329   0.197431 54.192.30.194 -> 172.31.36.109 TCP 15994 [TCP segment of a reassembled PDU]
330   0.197451 172.31.36.109 -> 54.192.30.194 TCP 66 34778 > http [ACK] Seq=98 Ack=1506709 Win=950272 Len=0 TSval=37594232 TSecr=658763324
331   0.197507 54.192.30.194 -> 172.31.36.109 TCP 4410 [TCP segment of a reassembled PDU]
332   0.197521 172.31.36.109 -> 54.192.30.194 TCP 66 34778 > http [ACK] Seq=98 Ack=1511053 Win=950272 Len=0 TSval=37594232 TSecr=658763324
333   0.197649 54.192.30.194 -> 172.31.36.109 TCP 21786 [TCP segment of a reassembled PDU]
334   0.197670 172.31.36.109 -> 54.192.30.194 TCP 66 34778 > http [ACK] Seq=98 Ack=1532773 Win=928640 Len=0 TSval=37594232 TSecr=658763324
335   0.197916 54.192.30.194 -> 172.31.36.109 TCP 20338 [TCP segment of a reassembled PDU]
336   0.197929 54.192.30.194 -> 172.31.36.109 TCP 1514 [TCP segment of a reassembled PDU]
337   0.197942 172.31.36.109 -> 54.192.30.194 TCP 66 34778 > http [ACK] Seq=98 Ack=1554493 Win=919296 Len=0 TSval=37594232 TSecr=658763324
338   0.198017 54.192.30.194 -> 172.31.36.109 TCP 15994 [TCP segment of a reassembled PDU]
339   0.198027 172.31.36.109 -> 54.192.30.194 TCP 66 34778 > http [ACK] Seq=98 Ack=1570421 Win=928896 Len=0 TSval=37594232 TSecr=658763324
340   0.198100 54.192.30.194 -> 172.31.36.109 TCP 2266 [TCP segment of a reassembled PDU]
341   0.198106 172.31.36.109 -> 54.192.30.194 TCP 66 34778 > http [ACK] Seq=98 Ack=1572621 Win=950272 Len=0 TSval=37594232 TSecr=658763324
342   0.203481 54.192.30.194 -> 172.31.36.109 TCP 1514 [TCP segment of a reassembled PDU]
343   0.203734 54.192.30.194 -> 172.31.36.109 TCP 4410 [TCP segment of a reassembled PDU]
344   0.203749 172.31.36.109 -> 54.192.30.194 TCP 66 34778 > http [ACK] Seq=98 Ack=1578413 Win=950272 Len=0 TSval=37594233 TSecr=658763325
345   0.203846 54.192.30.194 -> 172.31.36.109 TCP 20338 [TCP segment of a reassembled PDU]
346   0.203869 172.31.36.109 -> 54.192.30.194 TCP 66 34778 > http [ACK] Seq=98 Ack=1598685 Win=930048 Len=0 TSval=37594233 TSecr=658763325
347   0.203921 54.192.30.194 -> 172.31.36.109 TCP 2962 [TCP segment of a reassembled PDU]
348   0.203926 172.31.36.109 -> 54.192.30.194 TCP 66 34778 > http [ACK] Seq=98 Ack=1601581 Win=950272 Len=0 TSval=37594233 TSecr=658763325
349   0.203939 54.192.30.194 -> 172.31.36.109 TCP 10202 [TCP segment of a reassembled PDU]
350   0.203966 172.31.36.109 -> 54.192.30.194 TCP 66 34778 > http [ACK] Seq=98 Ack=1611717 Win=950272 Len=0 TSval=37594234 TSecr=658763325
351   0.203981 54.192.30.194 -> 172.31.36.109 TCP 7306 [TCP segment of a reassembled PDU]
352   0.203992 172.31.36.109 -> 54.192.30.194 TCP 66 34778 > http [ACK] Seq=98 Ack=1618957 Win=950272 Len=0 TSval=37594234 TSecr=658763325
353   0.204058 54.192.30.194 -> 172.31.36.109 TCP 5858 [TCP segment of a reassembled PDU]
354   0.204073 172.31.36.109 -> 54.192.30.194 TCP 66 34778 > http [ACK] Seq=98 Ack=1624749 Win=950272 Len=0 TSval=37594234 TSecr=658763325
355   0.205299 54.192.30.194 -> 172.31.36.109 TCP 7306 [TCP segment of a reassembled PDU]
