[Measurement for 10mb at 02:31:28 20.31.2014] 
Tshark:

  1   0.000000 172.31.36.109 -> 172.31.0.2   DNS 89 Standard query 0x50b3  A d1xvcg6dfvgaki.cloudfront.net
  2   0.000029 172.31.36.109 -> 172.31.0.2   DNS 89 Standard query 0xe058  AAAA d1xvcg6dfvgaki.cloudfront.net
  3   0.000456   172.31.0.2 -> 172.31.36.109 DNS 170 Standard query response 0xe058 
  4   0.000466   172.31.0.2 -> 172.31.36.109 DNS 217 Standard query response 0x50b3  A 54.230.30.222 A 54.230.30.245 A 54.230.30.249 A 54.192.30.214 A 54.192.30.222 A 54.230.30.3 A 54.230.30.72 A 54.230.30.73
  5   0.003924 172.31.36.109 -> 54.230.30.222 TCP 74 55889 > http [SYN] Seq=0 Win=26883 Len=0 MSS=8961 SACK_PERM=1 TSval=28593675 TSecr=0 WS=128
  6   0.005193 54.230.30.222 -> 172.31.36.109 TCP 74 http > 55889 [SYN, ACK] Seq=0 Ack=1 Win=14480 Len=0 MSS=1460 SACK_PERM=1 TSval=831405433 TSecr=28593675 WS=128
  7   0.005227 172.31.36.109 -> 54.230.30.222 TCP 66 55889 > http [ACK] Seq=1 Ack=1 Win=27008 Len=0 TSval=28593676 TSecr=831405433
  8   0.005266 172.31.36.109 -> 54.230.30.222 HTTP 163 GET /10mb HTTP/1.1 
  9   0.006446 54.230.30.222 -> 172.31.36.109 TCP 66 http > 55889 [ACK] Seq=1 Ack=98 Win=14592 Len=0 TSval=831405433 TSecr=28593676
 10   0.027646 54.230.30.222 -> 172.31.36.109 TCP 1132 [TCP segment of a reassembled PDU]
 11   0.027673 172.31.36.109 -> 54.230.30.222 TCP 66 55889 > http [ACK] Seq=98 Ack=1067 Win=29056 Len=0 TSval=28593681 TSecr=831405435
 12   0.027690 54.230.30.222 -> 172.31.36.109 TCP 13098 [TCP segment of a reassembled PDU]
 13   0.027701 172.31.36.109 -> 54.230.30.222 TCP 66 55889 > http [ACK] Seq=98 Ack=14099 Win=55168 Len=0 TSval=28593681 TSecr=831405435
 14   0.029148 54.230.30.222 -> 172.31.36.109 TCP 11650 [TCP segment of a reassembled PDU]
 15   0.029157 172.31.36.109 -> 54.230.30.222 TCP 66 55889 > http [ACK] Seq=98 Ack=25683 Win=78336 Len=0 TSval=28593682 TSecr=831405436
 16   0.029163 54.230.30.222 -> 172.31.36.109 TCP 1514 [TCP segment of a reassembled PDU]
 17   0.029166 172.31.36.109 -> 54.230.30.222 TCP 66 55889 > http [ACK] Seq=98 Ack=27131 Win=81152 Len=0 TSval=28593682 TSecr=831405436
 18   0.030105 54.230.30.222 -> 172.31.36.109 TCP 1514 [TCP segment of a reassembled PDU]
 19   0.030118 172.31.36.109 -> 54.230.30.222 TCP 66 55889 > http [ACK] Seq=98 Ack=28579 Win=84096 Len=0 TSval=28593682 TSecr=831405436
 20   0.030285 54.230.30.222 -> 172.31.36.109 TCP 2962 [TCP segment of a reassembled PDU]
 21   0.030290 172.31.36.109 -> 54.230.30.222 TCP 66 55889 > http [ACK] Seq=98 Ack=31475 Win=89856 Len=0 TSval=28593682 TSecr=831405436
 22   0.030397 54.230.30.222 -> 172.31.36.109 TCP 15994 [TCP segment of a reassembled PDU]
 23   0.030406 172.31.36.109 -> 54.230.30.222 TCP 66 55889 > http [ACK] Seq=98 Ack=47403 Win=121728 Len=0 TSval=28593682 TSecr=831405436
 24   0.031659 54.230.30.222 -> 172.31.36.109 TCP 11650 [TCP segment of a reassembled PDU]
 25   0.031667 172.31.36.109 -> 54.230.30.222 TCP 66 55889 > http [ACK] Seq=98 Ack=58987 Win=144896 Len=0 TSval=28593682 TSecr=831405436
 26   0.031676 54.230.30.222 -> 172.31.36.109 TCP 6372 [TCP segment of a reassembled PDU]
 27   0.031681 172.31.36.109 -> 54.230.30.222 TCP 66 55889 > http [ACK] Seq=98 Ack=65293 Win=157568 Len=0 TSval=28593682 TSecr=831405436
 28   0.061104 54.230.30.222 -> 172.31.36.109 TCP 1514 [TCP segment of a reassembled PDU]
 29   0.061111 172.31.36.109 -> 54.230.30.222 TCP 66 55889 > http [ACK] Seq=98 Ack=66741 Win=160384 Len=0 TSval=28593690 TSecr=831405439
 30   0.061323 54.230.30.222 -> 172.31.36.109 TCP 13098 [TCP segment of a reassembled PDU]
 31   0.061332 172.31.36.109 -> 54.230.30.222 TCP 66 55889 > http [ACK] Seq=98 Ack=79773 Win=186496 Len=0 TSval=28593690 TSecr=831405439
 32   0.061377 54.230.30.222 -> 172.31.36.109 TCP 5858 [TCP segment of a reassembled PDU]
 33   0.061383 172.31.36.109 -> 54.230.30.222 TCP 66 55889 > http [ACK] Seq=98 Ack=85565 Win=198016 Len=0 TSval=28593690 TSecr=831405439
 34   0.061599 54.230.30.222 -> 172.31.36.109 TCP 1514 [TCP segment of a reassembled PDU]
 35   0.061604 172.31.36.109 -> 54.230.30.222 TCP 66 55889 > http [ACK] Seq=98 Ack=87013 Win=200960 Len=0 TSval=28593690 TSecr=831405439
 36   0.062725 54.230.30.222 -> 172.31.36.109 TCP 20338 [TCP segment of a reassembled PDU]
 37   0.062737 172.31.36.109 -> 54.230.30.222 TCP 66 55889 > http [ACK] Seq=98 Ack=107285 Win=241536 Len=0 TSval=28593690 TSecr=831405439
 38   0.062751 54.230.30.222 -> 172.31.36.109 TCP 1514 [TCP segment of a reassembled PDU]
 39   0.062754 172.31.36.109 -> 54.230.30.222 TCP 66 55889 > http [ACK] Seq=98 Ack=108733 Win=244352 Len=0 TSval=28593690 TSecr=831405439
 40   0.062790 54.230.30.222 -> 172.31.36.109 TCP 1514 [TCP segment of a reassembled PDU]
 41   0.062794 172.31.36.109 -> 54.230.30.222 TCP 66 55889 > http [ACK] Seq=98 Ack=110181 Win=247296 Len=0 TSval=28593690 TSecr=831405439
 42   0.062879 54.230.30.222 -> 172.31.36.109 TCP 5858 [TCP segment of a reassembled PDU]
 43   0.062893 172.31.36.109 -> 54.230.30.222 TCP 66 55889 > http [ACK] Seq=98 Ack=115973 Win=258944 Len=0 TSval=28593690 TSecr=831405439
 44   0.063882 54.230.30.222 -> 172.31.36.109 TCP 2962 [TCP segment of a reassembled PDU]
 45   0.063887 172.31.36.109 -> 54.230.30.222 TCP 66 55889 > http [ACK] Seq=98 Ack=118869 Win=264704 Len=0 TSval=28593690 TSecr=831405439
 46   0.063964 54.230.30.222 -> 172.31.36.109 TCP 1514 [TCP segment of a reassembled PDU]
 47   0.063968 172.31.36.109 -> 54.230.30.222 TCP 66 55889 > http [ACK] Seq=98 Ack=120317 Win=267520 Len=0 TSval=28593690 TSecr=831405439
 48   0.064247 54.230.30.222 -> 172.31.36.109 TCP 30474 [TCP segment of a reassembled PDU]
 49   0.064263 172.31.36.109 -> 54.230.30.222 TCP 66 55889 > http [ACK] Seq=98 Ack=150725 Win=274304 Len=0 TSval=28593691 TSecr=831405439
 50   0.064432 54.230.30.222 -> 172.31.36.109 TCP 2962 [TCP segment of a reassembled PDU]
 51   0.064437 172.31.36.109 -> 54.230.30.222 TCP 66 55889 > http [ACK] Seq=98 Ack=153621 Win=271488 Len=0 TSval=28593691 TSecr=831405439
 52   0.065407 54.230.30.222 -> 172.31.36.109 TCP 5858 [TCP segment of a reassembled PDU]
 53   0.065430 172.31.36.109 -> 54.230.30.222 TCP 66 55889 > http [ACK] Seq=98 Ack=159413 Win=314880 Len=0 TSval=28593691 TSecr=831405439
 54   0.065557 54.230.30.222 -> 172.31.36.109 TCP 18890 [TCP segment of a reassembled PDU]
 55   0.065567 172.31.36.109 -> 54.230.30.222 TCP 66 55889 > http [ACK] Seq=98 Ack=178237 Win=296064 Len=0 TSval=28593691 TSecr=831405439
 56   0.065701 54.230.30.222 -> 172.31.36.109 TCP 4410 [TCP segment of a reassembled PDU]
 57   0.065707 172.31.36.109 -> 54.230.30.222 TCP 66 55889 > http [ACK] Seq=98 Ack=182581 Win=317184 Len=0 TSval=28593691 TSecr=831405439
 58   0.065790 54.230.30.222 -> 172.31.36.109 TCP 10202 [TCP segment of a reassembled PDU]
 59   0.065796 172.31.36.109 -> 54.230.30.222 TCP 66 55889 > http [ACK] Seq=98 Ack=192717 Win=307712 Len=0 TSval=28593691 TSecr=831405439
 60   0.066965 54.230.30.222 -> 172.31.36.109 TCP 2962 [TCP segment of a reassembled PDU]
 61   0.066989 172.31.36.109 -> 54.230.30.222 TCP 66 55889 > http [ACK] Seq=98 Ack=195613 Win=334208 Len=0 TSval=28593691 TSecr=831405439
 62   0.067167 54.230.30.222 -> 172.31.36.109 TCP 26130 [TCP segment of a reassembled PDU]
 63   0.067180 172.31.36.109 -> 54.230.30.222 TCP 66 55889 > http [ACK] Seq=98 Ack=221677 Win=386304 Len=0 TSval=28593691 TSecr=831405439
 64   0.067243 54.230.30.222 -> 172.31.36.109 TCP 11650 [TCP segment of a reassembled PDU]
 65   0.067264 172.31.36.109 -> 54.230.30.222 TCP 66 55889 > http [ACK] Seq=98 Ack=233261 Win=409472 Len=0 TSval=28593691 TSecr=831405439
 66   0.067291 54.230.30.222 -> 172.31.36.109 TCP 8754 [TCP segment of a reassembled PDU]
 67   0.067299 172.31.36.109 -> 54.230.30.222 TCP 66 55889 > http [ACK] Seq=98 Ack=241949 Win=426880 Len=0 TSval=28593691 TSecr=831405439
 68   0.068568 54.230.30.222 -> 172.31.36.109 TCP 2962 [TCP segment of a reassembled PDU]
 69   0.068581 172.31.36.109 -> 54.230.30.222 TCP 66 55889 > http [ACK] Seq=98 Ack=244845 Win=432640 Len=0 TSval=28593692 TSecr=831405440
 70   0.068828 54.230.30.222 -> 172.31.36.109 TCP 10202 [TCP segment of a reassembled PDU]
 71   0.068854 172.31.36.109 -> 54.230.30.222 TCP 66 55889 > http [ACK] Seq=98 Ack=254981 Win=452864 Len=0 TSval=28593692 TSecr=831405440
 72   0.068927 54.230.30.222 -> 172.31.36.109 TCP 6986 [TCP segment of a reassembled PDU]
 73   0.068934 172.31.36.109 -> 54.230.30.222 TCP 66 55889 > http [ACK] Seq=98 Ack=261901 Win=466816 Len=0 TSval=28593692 TSecr=831405440
 74   0.073125 54.230.30.222 -> 172.31.36.109 TCP 1514 [TCP segment of a reassembled PDU]
 75   0.073141 172.31.36.109 -> 54.230.30.222 TCP 66 55889 > http [ACK] Seq=98 Ack=263349 Win=469632 Len=0 TSval=28593693 TSecr=831405440
 76   0.073352 54.230.30.222 -> 172.31.36.109 TCP 2962 [TCP segment of a reassembled PDU]
 77   0.073357 172.31.36.109 -> 54.230.30.222 TCP 66 55889 > http [ACK] Seq=98 Ack=266245 Win=475392 Len=0 TSval=28593693 TSecr=831405440
 78   0.073548 54.230.30.222 -> 172.31.36.109 TCP 17442 [TCP segment of a reassembled PDU]
 79   0.073557 172.31.36.109 -> 54.230.30.222 TCP 66 55889 > http [ACK] Seq=98 Ack=283621 Win=510208 Len=0 TSval=28593693 TSecr=831405440
 80   0.073576 54.230.30.222 -> 172.31.36.109 TCP 4410 [TCP segment of a reassembled PDU]
 81   0.073580 172.31.36.109 -> 54.230.30.222 TCP 66 55889 > http [ACK] Seq=98 Ack=287965 Win=518912 Len=0 TSval=28593693 TSecr=831405440
 82   0.073705 54.230.30.222 -> 172.31.36.109 TCP 10202 [TCP segment of a reassembled PDU]
 83   0.073712 172.31.36.109 -> 54.230.30.222 TCP 66 55889 > http [ACK] Seq=98 Ack=298101 Win=539136 Len=0 TSval=28593693 TSecr=831405440
 84   0.073725 54.230.30.222 -> 172.31.36.109 TCP 13098 [TCP segment of a reassembled PDU]
 85   0.073732 172.31.36.109 -> 54.230.30.222 TCP 66 55889 > http [ACK] Seq=98 Ack=311133 Win=565248 Len=0 TSval=28593693 TSecr=831405440
 86   0.073741 54.230.30.222 -> 172.31.36.109 TCP 4410 [TCP segment of a reassembled PDU]
 87   0.073744 172.31.36.109 -> 54.230.30.222 TCP 66 55889 > http [ACK] Seq=98 Ack=315477 Win=573952 Len=0 TSval=28593693 TSecr=831405440
 88   0.074791 54.230.30.222 -> 172.31.36.109 TCP 4410 [TCP segment of a reassembled PDU]
 89   0.074824 172.31.36.109 -> 54.230.30.222 TCP 66 55889 > http [ACK] Seq=98 Ack=319821 Win=582656 Len=0 TSval=28593693 TSecr=831405440
 90   0.074911 54.230.30.222 -> 172.31.36.109 TCP 1514 [TCP segment of a reassembled PDU]
 91   0.074922 172.31.36.109 -> 54.230.30.222 TCP 66 55889 > http [ACK] Seq=98 Ack=321269 Win=585472 Len=0 TSval=28593693 TSecr=831405440
 92   0.075112 54.230.30.222 -> 172.31.36.109 TCP 6234 [TCP segment of a reassembled PDU]
 93   0.075118 172.31.36.109 -> 54.230.30.222 TCP 66 55889 > http [ACK] Seq=98 Ack=327437 Win=597888 Len=0 TSval=28593693 TSecr=831405440
 94   0.082061 54.230.30.222 -> 172.31.36.109 TCP 1514 [TCP segment of a reassembled PDU]
 95   0.082065 172.31.36.109 -> 54.230.30.222 TCP 66 55889 > http [ACK] Seq=98 Ack=328885 Win=600704 Len=0 TSval=28593695 TSecr=831405441
 96   0.082071 54.230.30.222 -> 172.31.36.109 TCP 1514 [TCP segment of a reassembled PDU]
 97   0.082074 172.31.36.109 -> 54.230.30.222 TCP 66 55889 > http [ACK] Seq=98 Ack=330333 Win=603648 Len=0 TSval=28593695 TSecr=831405441
 98   0.082162 54.230.30.222 -> 172.31.36.109 TCP 5858 [TCP segment of a reassembled PDU]
 99   0.082168 172.31.36.109 -> 54.230.30.222 TCP 66 55889 > http [ACK] Seq=98 Ack=336125 Win=615168 Len=0 TSval=28593695 TSecr=831405441
100   0.082414 54.230.30.222 -> 172.31.36.109 TCP 13098 [TCP segment of a reassembled PDU]
101   0.082438 172.31.36.109 -> 54.230.30.222 TCP 66 55889 > http [ACK] Seq=98 Ack=349157 Win=641280 Len=0 TSval=28593695 TSecr=831405441
102   0.082541 54.230.30.222 -> 172.31.36.109 TCP 5858 [TCP segment of a reassembled PDU]
103   0.082574 172.31.36.109 -> 54.230.30.222 TCP 66 55889 > http [ACK] Seq=98 Ack=354949 Win=652800 Len=0 TSval=28593695 TSecr=831405441
104   0.082597 54.230.30.222 -> 172.31.36.109 TCP 24682 [TCP segment of a reassembled PDU]
105   0.082608 172.31.36.109 -> 54.230.30.222 TCP 66 55889 > http [ACK] Seq=98 Ack=379565 Win=702080 Len=0 TSval=28593695 TSecr=831405441
106   0.082665 54.230.30.222 -> 172.31.36.109 TCP 2962 [TCP segment of a reassembled PDU]
107   0.082670 172.31.36.109 -> 54.230.30.222 TCP 66 55889 > http [ACK] Seq=98 Ack=382461 Win=707840 Len=0 TSval=28593695 TSecr=831405441
108   0.083664 54.230.30.222 -> 172.31.36.109 TCP 4410 [TCP segment of a reassembled PDU]
109   0.083673 172.31.36.109 -> 54.230.30.222 TCP 66 55889 > http [ACK] Seq=98 Ack=386805 Win=716544 Len=0 TSval=28593695 TSecr=831405441
110   0.083755 54.230.30.222 -> 172.31.36.109 TCP 6234 [TCP segment of a reassembled PDU]
111   0.083762 172.31.36.109 -> 54.230.30.222 TCP 66 55889 > http [ACK] Seq=98 Ack=392973 Win=728960 Len=0 TSval=28593695 TSecr=831405441
112   0.086448 54.230.30.222 -> 172.31.36.109 TCP 1514 [TCP segment of a reassembled PDU]
113   0.086481 172.31.36.109 -> 54.230.30.222 TCP 66 55889 > http [ACK] Seq=98 Ack=394421 Win=731776 Len=0 TSval=28593696 TSecr=831405441
114   0.086748 54.230.30.222 -> 172.31.36.109 TCP 8754 [TCP segment of a reassembled PDU]
115   0.086755 172.31.36.109 -> 54.230.30.222 TCP 66 55889 > http [ACK] Seq=98 Ack=403109 Win=749184 Len=0 TSval=28593696 TSecr=831405441
116   0.086810 54.230.30.222 -> 172.31.36.109 TCP 1514 [TCP segment of a reassembled PDU]
117   0.086815 172.31.36.109 -> 54.230.30.222 TCP 66 55889 > http [ACK] Seq=98 Ack=404557 Win=752128 Len=0 TSval=28593696 TSecr=831405441
118   0.086821 54.230.30.222 -> 172.31.36.109 TCP 4410 [TCP segment of a reassembled PDU]
119   0.086825 172.31.36.109 -> 54.230.30.222 TCP 66 55889 > http [ACK] Seq=98 Ack=408901 Win=760704 Len=0 TSval=28593696 TSecr=831405441
120   0.087177 54.230.30.222 -> 172.31.36.109 TCP 4410 [TCP segment of a reassembled PDU]
121   0.087182 172.31.36.109 -> 54.230.30.222 TCP 66 55889 > http [ACK] Seq=98 Ack=413245 Win=769408 Len=0 TSval=28593696 TSecr=831405441
122   0.087297 54.230.30.222 -> 172.31.36.109 TCP 18890 [TCP segment of a reassembled PDU]
123   0.087316 172.31.36.109 -> 54.230.30.222 TCP 66 55889 > http [ACK] Seq=98 Ack=432069 Win=761984 Len=0 TSval=28593696 TSecr=831405441
124   0.087480 54.230.30.222 -> 172.31.36.109 TCP 2962 [TCP segment of a reassembled PDU]
125   0.087485 172.31.36.109 -> 54.230.30.222 TCP 66 55889 > http [ACK] Seq=98 Ack=434965 Win=775296 Len=0 TSval=28593696 TSecr=831405441
126   0.087494 54.230.30.222 -> 172.31.36.109 TCP 8754 [TCP segment of a reassembled PDU]
127   0.087499 172.31.36.109 -> 54.230.30.222 TCP 66 55889 > http [ACK] Seq=98 Ack=443653 Win=773888 Len=0 TSval=28593696 TSecr=831405441
128   0.087500 54.230.30.222 -> 172.31.36.109 TCP 1514 [TCP Previous segment not captured] [TCP segment of a reassembled PDU]
129   0.087503 172.31.36.109 -> 54.230.30.222 TCP 78 [TCP Dup ACK 127#1] 55889 > http [ACK] Seq=98 Ack=443653 Win=773888 Len=0 TSval=28593696 TSecr=831405441 SLE=445101 SRE=446549
130   0.087508 54.230.30.222 -> 172.31.36.109 TCP 1514 [TCP Out-Of-Order] [TCP segment of a reassembled PDU]
131   0.087511 172.31.36.109 -> 54.230.30.222 TCP 66 55889 > http [ACK] Seq=98 Ack=446549 Win=771072 Len=0 TSval=28593696 TSecr=831405441
132   0.087515 54.230.30.222 -> 172.31.36.109 TCP 10202 [TCP segment of a reassembled PDU]
133   0.087520 172.31.36.109 -> 54.230.30.222 TCP 66 55889 > http [ACK] Seq=98 Ack=456685 Win=760960 Len=0 TSval=28593696 TSecr=831405441
134   0.087859 54.230.30.222 -> 172.31.36.109 TCP 4410 [TCP segment of a reassembled PDU]
135   0.087865 172.31.36.109 -> 54.230.30.222 TCP 66 55889 > http [ACK] Seq=98 Ack=461029 Win=783872 Len=0 TSval=28593696 TSecr=831405441
136   0.088537 54.230.30.222 -> 172.31.36.109 TCP 4410 [TCP segment of a reassembled PDU]
137   0.088569 172.31.36.109 -> 54.230.30.222 TCP 66 55889 > http [ACK] Seq=98 Ack=465373 Win=785792 Len=0 TSval=28593697 TSecr=831405442
138   0.088777 54.230.30.222 -> 172.31.36.109 TCP 20338 [TCP segment of a reassembled PDU]
139   0.088789 172.31.36.109 -> 54.230.30.222 TCP 66 55889 > http [ACK] Seq=98 Ack=485645 Win=765568 Len=0 TSval=28593697 TSecr=831405442
140   0.088801 54.230.30.222 -> 172.31.36.109 TCP 8754 [TCP segment of a reassembled PDU]
141   0.088806 172.31.36.109 -> 54.230.30.222 TCP 66 55889 > http [ACK] Seq=98 Ack=494333 Win=756992 Len=0 TSval=28593697 TSecr=831405442
142   0.088880 54.230.30.222 -> 172.31.36.109 TCP 10202 [TCP segment of a reassembled PDU]
143   0.088887 172.31.36.109 -> 54.230.30.222 TCP 66 55889 > http [ACK] Seq=98 Ack=504469 Win=776320 Len=0 TSval=28593697 TSecr=831405442
144   0.088966 54.230.30.222 -> 172.31.36.109 TCP 8754 [TCP segment of a reassembled PDU]
145   0.088972 172.31.36.109 -> 54.230.30.222 TCP 66 55889 > http [ACK] Seq=98 Ack=513157 Win=767744 Len=0 TSval=28593697 TSecr=831405442
146   0.089111 54.230.30.222 -> 172.31.36.109 TCP 10954 [TCP segment of a reassembled PDU]
147   0.089118 172.31.36.109 -> 54.230.30.222 TCP 66 55889 > http [ACK] Seq=98 Ack=524045 Win=756864 Len=0 TSval=28593697 TSecr=831405442
148   0.100855 54.230.30.222 -> 172.31.36.109 TCP 1514 [TCP segment of a reassembled PDU]
149   0.100861 172.31.36.109 -> 54.230.30.222 TCP 66 55889 > http [ACK] Seq=98 Ack=525493 Win=790272 Len=0 TSval=28593700 TSecr=831405443
150   0.100867 54.230.30.222 -> 172.31.36.109 TCP 1514 [TCP segment of a reassembled PDU]
151   0.100869 172.31.36.109 -> 54.230.30.222 TCP 66 55889 > http [ACK] Seq=98 Ack=526941 Win=788864 Len=0 TSval=28593700 TSecr=831405443
152   0.100978 54.230.30.222 -> 172.31.36.109 TCP 11650 [TCP segment of a reassembled PDU]
153   0.100986 172.31.36.109 -> 54.230.30.222 TCP 66 55889 > http [ACK] Seq=98 Ack=538525 Win=777344 Len=0 TSval=28593700 TSecr=831405443
154   0.101094 54.230.30.222 -> 172.31.36.109 TCP 8754 [TCP segment of a reassembled PDU]
155   0.101102 172.31.36.109 -> 54.230.30.222 TCP 66 55889 > http [ACK] Seq=98 Ack=547213 Win=778624 Len=0 TSval=28593700 TSecr=831405443
156   0.101243 54.230.30.222 -> 172.31.36.109 TCP 15994 [TCP segment of a reassembled PDU]
157   0.101251 172.31.36.109 -> 54.230.30.222 TCP 66 55889 > http [ACK] Seq=98 Ack=563141 Win=766720 Len=0 TSval=28593700 TSecr=831405443
158   0.101258 54.230.30.222 -> 172.31.36.109 TCP 1514 [TCP segment of a reassembled PDU]
159   0.101261 172.31.36.109 -> 54.230.30.222 TCP 66 55889 > http [ACK] Seq=98 Ack=564589 Win=765312 Len=0 TSval=28593700 TSecr=831405443
160   0.101339 54.230.30.222 -> 172.31.36.109 TCP 2962 [TCP segment of a reassembled PDU]
161   0.101344 172.31.36.109 -> 54.230.30.222 TCP 66 55889 > http [ACK] Seq=98 Ack=567485 Win=788096 Len=0 TSval=28593700 TSecr=831405443
162   0.101514 54.230.30.222 -> 172.31.36.109 TCP 8754 [TCP segment of a reassembled PDU]
163   0.101539 172.31.36.109 -> 54.230.30.222 TCP 66 55889 > http [ACK] Seq=98 Ack=576173 Win=790272 Len=0 TSval=28593700 TSecr=831405443
164   0.101641 54.230.30.222 -> 172.31.36.109 TCP 8754 [TCP segment of a reassembled PDU]
165   0.101661 172.31.36.109 -> 54.230.30.222 TCP 66 55889 > http [ACK] Seq=98 Ack=584861 Win=790272 Len=0 TSval=28593700 TSecr=831405443
166   0.102042 54.230.30.222 -> 172.31.36.109 TCP 1514 [TCP segment of a reassembled PDU]
167   0.102201 54.230.30.222 -> 172.31.36.109 TCP 15994 [TCP segment of a reassembled PDU]
168   0.102230 172.31.36.109 -> 54.230.30.222 TCP 66 55889 > http [ACK] Seq=98 Ack=602237 Win=790272 Len=0 TSval=28593700 TSecr=831405443
169   0.102565 54.230.30.222 -> 172.31.36.109 TCP 8754 [TCP segment of a reassembled PDU]
170   0.102586 54.230.30.222 -> 172.31.36.109 TCP 21786 [TCP segment of a reassembled PDU]
171   0.102616 172.31.36.109 -> 54.230.30.222 TCP 66 55889 > http [ACK] Seq=98 Ack=632645 Win=759936 Len=0 TSval=28593700 TSecr=831405443
172   0.102728 54.230.30.222 -> 172.31.36.109 TCP 15994 [TCP segment of a reassembled PDU]
173   0.102738 172.31.36.109 -> 54.230.30.222 TCP 66 55889 > http [ACK] Seq=98 Ack=648573 Win=766720 Len=0 TSval=28593700 TSecr=831405443
174   0.102969 54.230.30.222 -> 172.31.36.109 TCP 15994 [TCP segment of a reassembled PDU]
175   0.102986 172.31.36.109 -> 54.230.30.222 TCP 66 55889 > http [ACK] Seq=98 Ack=664501 Win=766720 Len=0 TSval=28593700 TSecr=831405443
176   0.103312 54.230.30.222 -> 172.31.36.109 TCP 5858 [TCP segment of a reassembled PDU]
177   0.103318 172.31.36.109 -> 54.230.30.222 TCP 66 55889 > http [ACK] Seq=98 Ack=670293 Win=783360 Len=0 TSval=28593700 TSecr=831405443
178   0.103412 54.230.30.222 -> 172.31.36.109 TCP 1514 [TCP segment of a reassembled PDU]
179   0.103558 54.230.30.222 -> 172.31.36.109 TCP 2962 [TCP segment of a reassembled PDU]
180   0.103592 172.31.36.109 -> 54.230.30.222 TCP 66 55889 > http [ACK] Seq=98 Ack=674637 Win=788096 Len=0 TSval=28593700 TSecr=831405443
181   0.103757 54.230.30.222 -> 172.31.36.109 TCP 20338 [TCP segment of a reassembled PDU]
182   0.103783 54.230.30.222 -> 172.31.36.109 TCP 1514 [TCP segment of a reassembled PDU]
183   0.103797 172.31.36.109 -> 54.230.30.222 TCP 66 55889 > http [ACK] Seq=98 Ack=696357 Win=766464 Len=0 TSval=28593700 TSecr=831405443
184   0.103810 54.230.30.222 -> 172.31.36.109 TCP 7306 [TCP segment of a reassembled PDU]
185   0.103828 172.31.36.109 -> 54.230.30.222 TCP 66 55889 > http [ACK] Seq=98 Ack=703597 Win=790272 Len=0 TSval=28593700 TSecr=831405443
186   0.103890 54.230.30.222 -> 172.31.36.109 TCP 13098 [TCP segment of a reassembled PDU]
187   0.103910 172.31.36.109 -> 54.230.30.222 TCP 66 55889 > http [ACK] Seq=98 Ack=716629 Win=790272 Len=0 TSval=28593700 TSecr=831405443
188   0.103976 54.230.30.222 -> 172.31.36.109 TCP 4410 [TCP segment of a reassembled PDU]
189   0.104117 172.31.36.109 -> 54.230.30.222 TCP 66 55889 > http [ACK] Seq=98 Ack=720973 Win=790272 Len=0 TSval=28593700 TSecr=831405443
190   0.104247 54.230.30.222 -> 172.31.36.109 TCP 30474 [TCP segment of a reassembled PDU]
191   0.104276 172.31.36.109 -> 54.230.30.222 TCP 66 55889 > http [ACK] Seq=98 Ack=751381 Win=790272 Len=0 TSval=28593701 TSecr=831405443
192   0.104370 54.230.30.222 -> 172.31.36.109 TCP 5858 [TCP segment of a reassembled PDU]
193   0.104396 172.31.36.109 -> 54.230.30.222 TCP 66 55889 > http [ACK] Seq=98 Ack=757173 Win=801920 Len=0 TSval=28593701 TSecr=831405443
194   0.104444 54.230.30.222 -> 172.31.36.109 TCP 8754 [TCP segment of a reassembled PDU]
195   0.104451 172.31.36.109 -> 54.230.30.222 TCP 66 55889 > http [ACK] Seq=98 Ack=765861 Win=819328 Len=0 TSval=28593701 TSecr=831405443
196   0.104545 54.230.30.222 -> 172.31.36.109 TCP 2962 [TCP segment of a reassembled PDU]
197   0.104557 172.31.36.109 -> 54.230.30.222 TCP 66 55889 > http [ACK] Seq=98 Ack=768757 Win=825088 Len=0 TSval=28593701 TSecr=831405443
198   0.105160 54.230.30.222 -> 172.31.36.109 TCP 1514 [TCP segment of a reassembled PDU]
199   0.105164 172.31.36.109 -> 54.230.30.222 TCP 66 55889 > http [ACK] Seq=98 Ack=770205 Win=828032 Len=0 TSval=28593701 TSecr=831405443
200   0.105324 54.230.30.222 -> 172.31.36.109 TCP 16050 [TCP segment of a reassembled PDU]
201   0.105332 172.31.36.109 -> 54.230.30.222 TCP 66 55889 > http [ACK] Seq=98 Ack=786189 Win=859904 Len=0 TSval=28593701 TSecr=831405443
202   0.107008 54.230.30.222 -> 172.31.36.109 TCP 1514 [TCP segment of a reassembled PDU]
203   0.107020 172.31.36.109 -> 54.230.30.222 TCP 66 55889 > http [ACK] Seq=98 Ack=787637 Win=862848 Len=0 TSval=28593701 TSecr=831405443
204   0.107318 54.230.30.222 -> 172.31.36.109 TCP 18890 [TCP segment of a reassembled PDU]
205   0.107330 172.31.36.109 -> 54.230.30.222 TCP 66 55889 > http [ACK] Seq=98 Ack=806461 Win=900480 Len=0 TSval=28593701 TSecr=831405443
206   0.107640 54.230.30.222 -> 172.31.36.109 TCP 1514 [TCP segment of a reassembled PDU]
207   0.107651 172.31.36.109 -> 54.230.30.222 TCP 66 55889 > http [ACK] Seq=98 Ack=807909 Win=903424 Len=0 TSval=28593701 TSecr=831405443
208   0.107922 54.230.30.222 -> 172.31.36.109 TCP 2962 [TCP segment of a reassembled PDU]
209   0.107948 172.31.36.109 -> 54.230.30.222 TCP 66 55889 > http [ACK] Seq=98 Ack=810805 Win=909184 Len=0 TSval=28593701 TSecr=831405443
210   0.107961 54.230.30.222 -> 172.31.36.109 TCP 21786 [TCP segment of a reassembled PDU]
211   0.107974 172.31.36.109 -> 54.230.30.222 TCP 66 55889 > http [ACK] Seq=98 Ack=832525 Win=952576 Len=0 TSval=28593701 TSecr=831405443
212   0.107986 54.230.30.222 -> 172.31.36.109 TCP 21786 [TCP segment of a reassembled PDU]
213   0.107997 172.31.36.109 -> 54.230.30.222 TCP 66 55889 > http [ACK] Seq=98 Ack=854245 Win=996096 Len=0 TSval=28593701 TSecr=831405443
214   0.108014 54.230.30.222 -> 172.31.36.109 TCP 8754 [TCP segment of a reassembled PDU]
215   0.108019 172.31.36.109 -> 54.230.30.222 TCP 66 55889 > http [ACK] Seq=98 Ack=862933 Win=1013376 Len=0 TSval=28593701 TSecr=831405443
216   0.108024 54.230.30.222 -> 172.31.36.109 TCP 5858 [TCP segment of a reassembled PDU]
217   0.108028 172.31.36.109 -> 54.230.30.222 TCP 66 55889 > http [ACK] Seq=98 Ack=868725 Win=1025024 Len=0 TSval=28593701 TSecr=831405443
218   0.108056 54.230.30.222 -> 172.31.36.109 TCP 10202 [TCP segment of a reassembled PDU]
219   0.108067 172.31.36.109 -> 54.230.30.222 TCP 66 55889 > http [ACK] Seq=98 Ack=878861 Win=1045248 Len=0 TSval=28593701 TSecr=831405443
220   0.108553 54.230.30.222 -> 172.31.36.109 TCP 1514 [TCP segment of a reassembled PDU]
221   0.108559 172.31.36.109 -> 54.230.30.222 TCP 66 55889 > http [ACK] Seq=98 Ack=880309 Win=1048192 Len=0 TSval=28593702 TSecr=831405444
222   0.108628 54.230.30.222 -> 172.31.36.109 TCP 4410 [TCP segment of a reassembled PDU]
223   0.108633 172.31.36.109 -> 54.230.30.222 TCP 66 55889 > http [ACK] Seq=98 Ack=884653 Win=1056896 Len=0 TSval=28593702 TSecr=831405444
224   0.108743 54.230.30.222 -> 172.31.36.109 TCP 2962 [TCP segment of a reassembled PDU]
225   0.108756 172.31.36.109 -> 54.230.30.222 TCP 66 55889 > http [ACK] Seq=98 Ack=887549 Win=1062656 Len=0 TSval=28593702 TSecr=831405444
226   0.108923 54.230.30.222 -> 172.31.36.109 TCP 17442 [TCP segment of a reassembled PDU]
227   0.108933 172.31.36.109 -> 54.230.30.222 TCP 66 55889 > http [ACK] Seq=98 Ack=904925 Win=1097472 Len=0 TSval=28593702 TSecr=831405444
228   0.108944 54.230.30.222 -> 172.31.36.109 TCP 12402 [TCP segment of a reassembled PDU]
229   0.108969 172.31.36.109 -> 54.230.30.222 TCP 66 55889 > http [ACK] Seq=98 Ack=917261 Win=1085312 Len=0 TSval=28593702 TSecr=831405444
230   0.120316 54.230.30.222 -> 172.31.36.109 TCP 1514 [TCP segment of a reassembled PDU]
231   0.120328 172.31.36.109 -> 54.230.30.222 TCP 66 55889 > http [ACK] Seq=98 Ack=918709 Win=1100288 Len=0 TSval=28593705 TSecr=831405445
232   0.120443 54.230.30.222 -> 172.31.36.109 TCP 4410 [TCP segment of a reassembled PDU]
233   0.120456 172.31.36.109 -> 54.230.30.222 TCP 66 55889 > http [ACK] Seq=98 Ack=923053 Win=1108992 Len=0 TSval=28593705 TSecr=831405445
234   0.120542 54.230.30.222 -> 172.31.36.109 TCP 14546 [TCP segment of a reassembled PDU]
235   0.120551 172.31.36.109 -> 54.230.30.222 TCP 66 55889 > http [ACK] Seq=98 Ack=937533 Win=1111424 Len=0 TSval=28593705 TSecr=831405445
236   0.120655 54.230.30.222 -> 172.31.36.109 TCP 5858 [TCP segment of a reassembled PDU]
237   0.120661 172.31.36.109 -> 54.230.30.222 TCP 66 55889 > http [ACK] Seq=98 Ack=943325 Win=1125760 Len=0 TSval=28593705 TSecr=831405445
238   0.120674 54.230.30.222 -> 172.31.36.109 TCP 14546 [TCP segment of a reassembled PDU]
239   0.120696 172.31.36.109 -> 54.230.30.222 TCP 66 55889 > http [ACK] Seq=98 Ack=957805 Win=1111424 Len=0 TSval=28593705 TSecr=831405445
240   0.120840 54.230.30.222 -> 172.31.36.109 TCP 7306 [TCP segment of a reassembled PDU]
241   0.120846 172.31.36.109 -> 54.230.30.222 TCP 66 55889 > http [ACK] Seq=98 Ack=965045 Win=1123456 Len=0 TSval=28593705 TSecr=831405445
242   0.120858 54.230.30.222 -> 172.31.36.109 TCP 5858 [TCP segment of a reassembled PDU]
243   0.120955 172.31.36.109 -> 54.230.30.222 TCP 66 55889 > http [ACK] Seq=98 Ack=970837 Win=1128064 Len=0 TSval=28593705 TSecr=831405445
244   0.121109 54.230.30.222 -> 172.31.36.109 TCP 14546 [TCP segment of a reassembled PDU]
245   0.121131 172.31.36.109 -> 54.230.30.222 TCP 66 55889 > http [ACK] Seq=98 Ack=985317 Win=1128064 Len=0 TSval=28593705 TSecr=831405445
246   0.121266 54.230.30.222 -> 172.31.36.109 TCP 4410 [TCP segment of a reassembled PDU]
247   0.121297 172.31.36.109 -> 54.230.30.222 TCP 66 55889 > http [ACK] Seq=98 Ack=989661 Win=1128064 Len=0 TSval=28593705 TSecr=831405445
248   0.121313 54.230.30.222 -> 172.31.36.109 TCP 20338 [TCP segment of a reassembled PDU]
249   0.121335 172.31.36.109 -> 54.230.30.222 TCP 66 55889 > http [ACK] Seq=98 Ack=1009933 Win=1107840 Len=0 TSval=28593705 TSecr=831405445
250   0.121724 54.230.30.222 -> 172.31.36.109 TCP 4410 [TCP segment of a reassembled PDU]
251   0.121759 172.31.36.109 -> 54.230.30.222 TCP 66 55889 > http [ACK] Seq=98 Ack=1014277 Win=1128064 Len=0 TSval=28593705 TSecr=831405445
252   0.121911 54.230.30.222 -> 172.31.36.109 TCP 11650 [TCP segment of a reassembled PDU]
253   0.121920 54.230.30.222 -> 172.31.36.109 TCP 1514 [TCP segment of a reassembled PDU]
254   0.121926 54.230.30.222 -> 172.31.36.109 TCP 5858 [TCP segment of a reassembled PDU]
255   0.121942 54.230.30.222 -> 172.31.36.109 TCP 8754 [TCP segment of a reassembled PDU]
256   0.121954 172.31.36.109 -> 54.230.30.222 TCP 66 55889 > http [ACK] Seq=98 Ack=1041789 Win=1111424 Len=0 TSval=28593705 TSecr=831405445
257   0.122315 54.230.30.222 -> 172.31.36.109 TCP 8754 [TCP segment of a reassembled PDU]
258   0.122345 172.31.36.109 -> 54.230.30.222 TCP 66 55889 > http [ACK] Seq=98 Ack=1050477 Win=1121024 Len=0 TSval=28593705 TSecr=831405445
259   0.122482 54.230.30.222 -> 172.31.36.109 TCP 20338 [TCP segment of a reassembled PDU]
260   0.122513 54.230.30.222 -> 172.31.36.109 TCP 7306 [TCP segment of a reassembled PDU]
261   0.122534 172.31.36.109 -> 54.230.30.222 TCP 66 55889 > http [ACK] Seq=98 Ack=1077989 Win=1093632 Len=0 TSval=28593705 TSecr=831405445
262   0.122653 54.230.30.222 -> 172.31.36.109 TCP 8754 [TCP segment of a reassembled PDU]
263   0.122659 172.31.36.109 -> 54.230.30.222 TCP 66 55889 > http [ACK] Seq=98 Ack=1086677 Win=1121024 Len=0 TSval=28593705 TSecr=831405445
264   0.123085 54.230.30.222 -> 172.31.36.109 TCP 20338 [TCP segment of a reassembled PDU]
265   0.123108 172.31.36.109 -> 54.230.30.222 TCP 66 55889 > http [ACK] Seq=98 Ack=1106949 Win=1101952 Len=0 TSval=28593705 TSecr=831405445
266   0.123259 54.230.30.222 -> 172.31.36.109 TCP 13098 [TCP segment of a reassembled PDU]
267   0.123267 172.31.36.109 -> 54.230.30.222 TCP 66 55889 > http [ACK] Seq=98 Ack=1119981 Win=1113984 Len=0 TSval=28593705 TSecr=831405445
268   0.123309 54.230.30.222 -> 172.31.36.109 TCP 20338 [TCP segment of a reassembled PDU]
269   0.123326 172.31.36.109 -> 54.230.30.222 TCP 66 55889 > http [ACK] Seq=98 Ack=1140253 Win=1101952 Len=0 TSval=28593705 TSecr=831405445
270   0.123469 54.230.30.222 -> 172.31.36.109 TCP 5858 [TCP segment of a reassembled PDU]
271   0.123475 172.31.36.109 -> 54.230.30.222 TCP 66 55889 > http [ACK] Seq=98 Ack=1146045 Win=1125760 Len=0 TSval=28593705 TSecr=831405445
272   0.124212 54.230.30.222 -> 172.31.36.109 TCP 2962 [TCP segment of a reassembled PDU]
273   0.124217 172.31.36.109 -> 54.230.30.222 TCP 66 55889 > http [ACK] Seq=98 Ack=1148941 Win=1128064 Len=0 TSval=28593706 TSecr=831405445
274   0.124346 54.230.30.222 -> 172.31.36.109 TCP 26130 [TCP segment of a reassembled PDU]
275   0.124394 172.31.36.109 -> 54.230.30.222 TCP 66 55889 > http [ACK] Seq=98 Ack=1175005 Win=1102080 Len=0 TSval=28593706 TSecr=831405445
276   0.124490 54.230.30.222 -> 172.31.36.109 TCP 15994 [TCP segment of a reassembled PDU]
277   0.124500 172.31.36.109 -> 54.230.30.222 TCP 66 55889 > http [ACK] Seq=98 Ack=1190933 Win=1109120 Len=0 TSval=28593706 TSecr=831405445
278   0.124831 54.230.30.222 -> 172.31.36.109 TCP 44954 [TCP segment of a reassembled PDU]
279   0.124867 172.31.36.109 -> 54.230.30.222 TCP 66 55889 > http [ACK] Seq=98 Ack=1235821 Win=1064320 Len=0 TSval=28593706 TSecr=831405445
280   0.124969 54.230.30.222 -> 172.31.36.109 TCP 7306 [TCP segment of a reassembled PDU]
281   0.124976 172.31.36.109 -> 54.230.30.222 TCP 66 55889 > http [ACK] Seq=98 Ack=1243061 Win=1123456 Len=0 TSval=28593706 TSecr=831405445
282   0.125071 54.230.30.222 -> 172.31.36.109 TCP 17442 [TCP segment of a reassembled PDU]
283   0.125101 172.31.36.109 -> 54.230.30.222 TCP 66 55889 > http [ACK] Seq=98 Ack=1260437 Win=1106688 Len=0 TSval=28593706 TSecr=831405445
284   0.125229 54.230.30.222 -> 172.31.36.109 TCP 15994 [TCP segment of a reassembled PDU]
285   0.125238 172.31.36.109 -> 54.230.30.222 TCP 66 55889 > http [ACK] Seq=98 Ack=1276365 Win=1109120 Len=0 TSval=28593706 TSecr=831405445
286   0.125739 54.230.30.222 -> 172.31.36.109 TCP 2962 [TCP segment of a reassembled PDU]
287   0.125744 172.31.36.109 -> 54.230.30.222 TCP 66 55889 > http [ACK] Seq=98 Ack=1279261 Win=1128064 Len=0 TSval=28593706 TSecr=831405445
288   0.125889 54.230.30.222 -> 172.31.36.109 TCP 14546 [TCP segment of a reassembled PDU]
289   0.125922 172.31.36.109 -> 54.230.30.222 TCP 66 55889 > http [ACK] Seq=98 Ack=1293741 Win=1128064 Len=0 TSval=28593706 TSecr=831405445
290   0.126032 54.230.30.222 -> 172.31.36.109 TCP 14546 [TCP segment of a reassembled PDU]
291   0.126053 172.31.36.109 -> 54.230.30.222 TCP 66 55889 > http [ACK] Seq=98 Ack=1308221 Win=1128064 Len=0 TSval=28593706 TSecr=831405445
292   0.126115 54.230.30.222 -> 172.31.36.109 TCP 2322 [TCP segment of a reassembled PDU]
293   0.126120 172.31.36.109 -> 54.230.30.222 TCP 66 55889 > http [ACK] Seq=98 Ack=1310477 Win=1128064 Len=0 TSval=28593706 TSecr=831405445
294   0.135632 54.230.30.222 -> 172.31.36.109 TCP 1514 [TCP segment of a reassembled PDU]
295   0.135830 54.230.30.222 -> 172.31.36.109 TCP 4410 [TCP segment of a reassembled PDU]
296   0.135848 172.31.36.109 -> 54.230.30.222 TCP 66 55889 > http [ACK] Seq=98 Ack=1316269 Win=1128064 Len=0 TSval=28593708 TSecr=831405446
297   0.135910 54.230.30.222 -> 172.31.36.109 TCP 1514 [TCP segment of a reassembled PDU]
298   0.136095 54.230.30.222 -> 172.31.36.109 TCP 5858 [TCP segment of a reassembled PDU]
299   0.136111 172.31.36.109 -> 54.230.30.222 TCP 66 55889 > http [ACK] Seq=98 Ack=1323509 Win=1128064 Len=0 TSval=28593708 TSecr=831405446
300   0.136351 54.230.30.222 -> 172.31.36.109 TCP 13098 [TCP segment of a reassembled PDU]
301   0.136380 54.230.30.222 -> 172.31.36.109 TCP 18890 [TCP segment of a reassembled PDU]
302   0.136404 54.230.30.222 -> 172.31.36.109 TCP 2962 [TCP segment of a reassembled PDU]
303   0.136410 54.230.30.222 -> 172.31.36.109 TCP 2962 [TCP segment of a reassembled PDU]
304   0.136420 172.31.36.109 -> 54.230.30.222 TCP 66 55889 > http [ACK] Seq=98 Ack=1361157 Win=1094784 Len=0 TSval=28593709 TSecr=831405446
305   0.136445 54.230.30.222 -> 172.31.36.109 TCP 14546 [TCP segment of a reassembled PDU]
306   0.136459 172.31.36.109 -> 54.230.30.222 TCP 66 55889 > http [ACK] Seq=98 Ack=1375637 Win=1101824 Len=0 TSval=28593709 TSecr=831405446
307   0.136597 54.230.30.222 -> 172.31.36.109 TCP 5858 [TCP segment of a reassembled PDU]
308   0.136603 172.31.36.109 -> 54.230.30.222 TCP 66 55889 > http [ACK] Seq=98 Ack=1381429 Win=1125760 Len=0 TSval=28593709 TSecr=831405446
309   0.136757 54.230.30.222 -> 172.31.36.109 TCP 1514 [TCP segment of a reassembled PDU]
310   0.136769 54.230.30.222 -> 172.31.36.109 TCP 18890 [TCP segment of a reassembled PDU]
311   0.136792 54.230.30.222 -> 172.31.36.109 TCP 15994 [TCP segment of a reassembled PDU]
312   0.136811 172.31.36.109 -> 54.230.30.222 TCP 66 55889 > http [ACK] Seq=98 Ack=1417629 Win=1089664 Len=0 TSval=28593709 TSecr=831405446
313   0.136898 54.230.30.222 -> 172.31.36.109 TCP 1514 [TCP segment of a reassembled PDU]
314   0.136997 54.230.30.222 -> 172.31.36.109 TCP 5858 [TCP segment of a reassembled PDU]
315   0.137004 172.31.36.109 -> 54.230.30.222 TCP 66 55889 > http [ACK] Seq=98 Ack=1424869 Win=1125760 Len=0 TSval=28593709 TSecr=831405446
316   0.137431 54.230.30.222 -> 172.31.36.109 TCP 7306 [TCP segment of a reassembled PDU]
317   0.137467 172.31.36.109 -> 54.230.30.222 TCP 66 55889 > http [ACK] Seq=98 Ack=1432109 Win=1128064 Len=0 TSval=28593709 TSecr=831405446
318   0.137479 54.230.30.222 -> 172.31.36.109 TCP 9506 [TCP segment of a reassembled PDU]
319   0.137498 172.31.36.109 -> 54.230.30.222 TCP 66 55889 > http [ACK] Seq=98 Ack=1441549 Win=1128064 Len=0 TSval=28593709 TSecr=831405446
320   0.161088 54.230.30.222 -> 172.31.36.109 TCP 1514 [TCP segment of a reassembled PDU]
321   0.161118 54.230.30.222 -> 172.31.36.109 TCP 11650 [TCP segment of a reassembled PDU]
322   0.161140 172.31.36.109 -> 54.230.30.222 TCP 66 55889 > http [ACK] Seq=98 Ack=1454581 Win=1128064 Len=0 TSval=28593715 TSecr=831405449
323   0.161365 54.230.30.222 -> 172.31.36.109 TCP 18890 [TCP segment of a reassembled PDU]
324   0.161387 172.31.36.109 -> 54.230.30.222 TCP 66 55889 > http [ACK] Seq=98 Ack=1473405 Win=1109248 Len=0 TSval=28593715 TSecr=831405449
325   0.161464 54.230.30.222 -> 172.31.36.109 TCP 7306 [TCP segment of a reassembled PDU]
326   0.161471 172.31.36.109 -> 54.230.30.222 TCP 66 55889 > http [ACK] Seq=98 Ack=1480645 Win=1123456 Len=0 TSval=28593715 TSecr=831405449
327   0.161483 54.230.30.222 -> 172.31.36.109 TCP 11650 [TCP segment of a reassembled PDU]
328   0.161500 172.31.36.109 -> 54.230.30.222 TCP 66 55889 > http [ACK] Seq=98 Ack=1492229 Win=1116288 Len=0 TSval=28593715 TSecr=831405449
329   0.161533 54.230.30.222 -> 172.31.36.109 TCP 8754 [TCP segment of a reassembled PDU]
330   0.161540 172.31.36.109 -> 54.230.30.222 TCP 66 55889 > http [ACK] Seq=98 Ack=1500917 Win=1121024 Len=0 TSval=28593715 TSecr=831405449
331   0.161816 54.230.30.222 -> 172.31.36.109 TCP 1514 [TCP segment of a reassembled PDU]
332   0.161951 54.230.30.222 -> 172.31.36.109 TCP 17442 [TCP segment of a reassembled PDU]
333   0.161971 172.31.36.109 -> 54.230.30.222 TCP 66 55889 > http [ACK] Seq=98 Ack=1519741 Win=1106688 Len=0 TSval=28593715 TSecr=831405449
334   0.162022 54.230.30.222 -> 172.31.36.109 TCP 4410 [TCP segment of a reassembled PDU]
335   0.162028 172.31.36.109 -> 54.230.30.222 TCP 66 55889 > http [ACK] Seq=98 Ack=1524085 Win=1128064 Len=0 TSval=28593715 TSecr=831405449
336   0.162135 54.230.30.222 -> 172.31.36.109 TCP 13098 [TCP segment of a reassembled PDU]
337   0.162165 172.31.36.109 -> 54.230.30.222 TCP 66 55889 > http [ACK] Seq=98 Ack=1537117 Win=1128064 Len=0 TSval=28593715 TSecr=831405449
338   0.162295 54.230.30.222 -> 172.31.36.109 TCP 7306 [TCP segment of a reassembled PDU]
339   0.162309 54.230.30.222 -> 172.31.36.109 TCP 14546 [TCP segment of a reassembled PDU]
340   0.162316 54.230.30.222 -> 172.31.36.109 TCP 1514 [TCP segment of a reassembled PDU]
341   0.162329 172.31.36.109 -> 54.230.30.222 TCP 66 55889 > http [ACK] Seq=98 Ack=1560285 Win=1108992 Len=0 TSval=28593715 TSecr=831405449
342   0.162607 54.230.30.222 -> 172.31.36.109 TCP 12402 [TCP segment of a reassembled PDU]
343   0.162615 172.31.36.109 -> 54.230.30.222 TCP 66 55889 > http [ACK] Seq=98 Ack=1572621 Win=1113984 Len=0 TSval=28593715 TSecr=831405449
344   0.166693 54.230.30.222 -> 172.31.36.109 TCP 1514 [TCP segment of a reassembled PDU]
345   0.166912 54.230.30.222 -> 172.31.36.109 TCP 5858 [TCP segment of a reassembled PDU]
346   0.167199 54.230.30.222 -> 172.31.36.109 TCP 4410 [TCP segment of a reassembled PDU]
347   0.167380 54.230.30.222 -> 172.31.36.109 TCP 14546 [TCP segment of a reassembled PDU]
348   0.167413 54.230.30.222 -> 172.31.36.109 TCP 18890 [TCP segment of a reassembled PDU]
349   0.167554 54.230.30.222 -> 172.31.36.109 TCP 7306 [TCP segment of a reassembled PDU]
350   0.167582 54.230.30.222 -> 172.31.36.109 TCP 10202 [TCP segment of a reassembled PDU]
351   0.167657 54.230.30.222 -> 172.31.36.109 TCP 10202 [TCP segment of a reassembled PDU]
352   0.167720 54.230.30.222 -> 172.31.36.109 TCP 4410 [TCP segment of a reassembled PDU]
353   0.167861 54.230.30.222 -> 172.31.36.109 TCP 10202 [TCP segment of a reassembled PDU]
