[Measurement for 100kb at 20:37:44 19.37.2014] 
Tshark:

  1   0.000000 172.31.29.138 -> 172.31.0.2   DNS 89 Standard query 0xc5d4  A d1dx94olpiqj0t.cloudfront.net
  2   0.000028 172.31.29.138 -> 172.31.0.2   DNS 89 Standard query 0xb6c2  AAAA d1dx94olpiqj0t.cloudfront.net
  3   0.000531   172.31.0.2 -> 172.31.29.138 DNS 176 Standard query response 0xb6c2 
  4   0.000543   172.31.0.2 -> 172.31.29.138 DNS 217 Standard query response 0xc5d4  A 54.230.159.7 A 54.192.156.109 A 54.192.157.146 A 54.192.159.173 A 54.192.159.174 A 54.230.158.80 A 54.230.158.223 A 54.230.158.246
  5   0.003880 172.31.29.138 -> 54.230.159.7 TCP 74 47869 > http [SYN] Seq=0 Win=26883 Len=0 MSS=8961 SACK_PERM=1 TSval=3334217 TSecr=0 WS=128
  6   0.004697 54.230.159.7 -> 172.31.29.138 TCP 74 http > 47869 [SYN, ACK] Seq=0 Ack=1 Win=14480 Len=0 MSS=1460 SACK_PERM=1 TSval=832909282 TSecr=3334217 WS=128
  7   0.004711 172.31.29.138 -> 54.230.159.7 TCP 66 47869 > http [ACK] Seq=1 Ack=1 Win=27008 Len=0 TSval=3334217 TSecr=832909282
  8   0.004752 172.31.29.138 -> 54.230.159.7 HTTP 164 GET /100kb HTTP/1.1 
  9   0.005398 54.230.159.7 -> 172.31.29.138 TCP 66 http > 47869 [ACK] Seq=1 Ack=99 Win=14592 Len=0 TSval=832909282 TSecr=3334217
 10   0.007515 54.230.159.7 -> 172.31.29.138 TCP 10202 [TCP segment of a reassembled PDU]
 11   0.007526 172.31.29.138 -> 54.230.159.7 TCP 66 47869 > http [ACK] Seq=99 Ack=10137 Win=47232 Len=0 TSval=3334218 TSecr=832909283
 12   0.007535 54.230.159.7 -> 172.31.29.138 TCP 2962 [TCP segment of a reassembled PDU]
 13   0.007543 172.31.29.138 -> 54.230.159.7 TCP 66 47869 > http [ACK] Seq=99 Ack=13033 Win=52992 Len=0 TSval=3334218 TSecr=832909283
 14   0.008207 54.230.159.7 -> 172.31.29.138 TCP 2962 [TCP segment of a reassembled PDU]
 15   0.008224 172.31.29.138 -> 54.230.159.7 TCP 66 47869 > http [ACK] Seq=99 Ack=15929 Win=58752 Len=0 TSval=3334218 TSecr=832909283
 16   0.008262 54.230.159.7 -> 172.31.29.138 TCP 10202 [TCP segment of a reassembled PDU]
 17   0.008269 172.31.29.138 -> 54.230.159.7 TCP 66 47869 > http [ACK] Seq=99 Ack=26065 Win=79104 Len=0 TSval=3334218 TSecr=832909283
 18   0.009002 54.230.159.7 -> 172.31.29.138 TCP 8754 [TCP segment of a reassembled PDU]
 19   0.009010 172.31.29.138 -> 54.230.159.7 TCP 66 47869 > http [ACK] Seq=99 Ack=34753 Win=96512 Len=0 TSval=3334218 TSecr=832909283
 20   0.009087 54.230.159.7 -> 172.31.29.138 TCP 11650 [TCP segment of a reassembled PDU]
 21   0.009096 172.31.29.138 -> 54.230.159.7 TCP 66 47869 > http [ACK] Seq=99 Ack=46337 Win=98944 Len=0 TSval=3334218 TSecr=832909283
 22   0.009751 54.230.159.7 -> 172.31.29.138 TCP 2962 [TCP segment of a reassembled PDU]
 23   0.009756 172.31.29.138 -> 54.230.159.7 TCP 66 47869 > http [ACK] Seq=99 Ack=49233 Win=109056 Len=0 TSval=3334218 TSecr=832909283
 24   0.009844 54.230.159.7 -> 172.31.29.138 TCP 15994 [TCP segment of a reassembled PDU]
 25   0.009864 172.31.29.138 -> 54.230.159.7 TCP 66 47869 > http [ACK] Seq=99 Ack=65161 Win=93184 Len=0 TSval=3334218 TSecr=832909283
 26   0.010521 54.230.159.7 -> 172.31.29.138 TCP 8754 [TCP segment of a reassembled PDU]
 27   0.010528 172.31.29.138 -> 54.230.159.7 TCP 66 47869 > http [ACK] Seq=99 Ack=73849 Win=103680 Len=0 TSval=3334219 TSecr=832909283
 28   0.010638 54.230.159.7 -> 172.31.29.138 TCP 17442 [TCP segment of a reassembled PDU]
 29   0.010649 172.31.29.138 -> 54.230.159.7 TCP 66 47869 > http [ACK] Seq=99 Ack=91225 Win=143872 Len=0 TSval=3334219 TSecr=832909283
 30   0.011299 54.230.159.7 -> 172.31.29.138 TCP 4410 [TCP segment of a reassembled PDU]
 31   0.011305 172.31.29.138 -> 54.230.159.7 TCP 66 47869 > http [ACK] Seq=99 Ack=95569 Win=152448 Len=0 TSval=3334219 TSecr=832909283
 32   0.011366 54.230.159.7 -> 172.31.29.138 HTTP 7354 HTTP/1.1 200 OK  (application/octet-stream)
 33   0.011372 172.31.29.138 -> 54.230.159.7 TCP 66 47869 > http [ACK] Seq=99 Ack=102857 Win=167040 Len=0 TSval=3334219 TSecr=832909283
 34   0.011500 172.31.29.138 -> 54.230.159.7 TCP 66 47869 > http [FIN, ACK] Seq=99 Ack=102857 Win=167040 Len=0 TSval=3334219 TSecr=832909283
 35   0.012035 54.230.159.7 -> 172.31.29.138 TCP 66 http > 47869 [FIN, ACK] Seq=102857 Ack=100 Win=14592 Len=0 TSval=832909283 TSecr=3334219
 36   0.012043 172.31.29.138 -> 54.230.159.7 TCP 66 47869 > http [ACK] Seq=100 Ack=102858 Win=167040 Len=0 TSval=3334219 TSecr=832909283
