[Measurement for 100kb at 08:36:46 20.36.2014] 
Tshark:

  1   0.000000 172.31.29.138 -> 172.31.0.2   DNS 89 Standard query 0x2861  A d1dx94olpiqj0t.cloudfront.net
  2   0.000031 172.31.29.138 -> 172.31.0.2   DNS 89 Standard query 0x7bb5  AAAA d1dx94olpiqj0t.cloudfront.net
  3   0.000575   172.31.0.2 -> 172.31.29.138 DNS 217 Standard query response 0x2861  A 54.230.148.165 A 54.230.150.15 A 54.230.150.29 A 54.230.150.35 A 54.230.150.47 A 54.230.150.156 A 54.230.150.159 A 54.230.150.221
  4   0.000613   172.31.0.2 -> 172.31.29.138 DNS 176 Standard query response 0x7bb5 
  5   0.003826 172.31.29.138 -> 54.230.148.165 TCP 74 41570 > http [SYN] Seq=0 Win=26883 Len=0 MSS=8961 SACK_PERM=1 TSval=14119804 TSecr=0 WS=128
  6   0.005314 54.230.148.165 -> 172.31.29.138 TCP 74 http > 41570 [SYN, ACK] Seq=0 Ack=1 Win=14480 Len=0 MSS=1460 SACK_PERM=1 TSval=1455140894 TSecr=14119804 WS=128
  7   0.005328 172.31.29.138 -> 54.230.148.165 TCP 66 41570 > http [ACK] Seq=1 Ack=1 Win=27008 Len=0 TSval=14119804 TSecr=1455140894
  8   0.005366 172.31.29.138 -> 54.230.148.165 HTTP 164 GET /100kb HTTP/1.1 
  9   0.006569 54.230.148.165 -> 172.31.29.138 TCP 66 http > 41570 [ACK] Seq=1 Ack=99 Win=14592 Len=0 TSval=1455140894 TSecr=14119804
 10   0.011024 54.230.148.165 -> 172.31.29.138 TCP 522 [TCP segment of a reassembled PDU]
 11   0.011032 172.31.29.138 -> 54.230.148.165 TCP 66 41570 > http [ACK] Seq=99 Ack=457 Win=28032 Len=0 TSval=14119805 TSecr=1455140894
 12   0.011056 54.230.148.165 -> 172.31.29.138 TCP 13098 [TCP segment of a reassembled PDU]
 13   0.011064 172.31.29.138 -> 54.230.148.165 TCP 66 41570 > http [ACK] Seq=99 Ack=13489 Win=54144 Len=0 TSval=14119805 TSecr=1455140894
 14   0.012545 54.230.148.165 -> 172.31.29.138 TCP 13098 [TCP segment of a reassembled PDU]
 15   0.012555 172.31.29.138 -> 54.230.148.165 TCP 66 41570 > http [ACK] Seq=99 Ack=26521 Win=80128 Len=0 TSval=14119806 TSecr=1455140894
 16   0.013846 54.230.148.165 -> 172.31.29.138 TCP 13098 [TCP segment of a reassembled PDU]
 17   0.013855 172.31.29.138 -> 54.230.148.165 TCP 66 41570 > http [ACK] Seq=99 Ack=39553 Win=96512 Len=0 TSval=14119806 TSecr=1455140895
 18   0.015118 54.230.148.165 -> 172.31.29.138 TCP 10202 [TCP segment of a reassembled PDU]
 19   0.015126 172.31.29.138 -> 54.230.148.165 TCP 66 41570 > http [ACK] Seq=99 Ack=49689 Win=101248 Len=0 TSval=14119806 TSecr=1455140895
 20   0.015133 54.230.148.165 -> 172.31.29.138 TCP 2962 [TCP segment of a reassembled PDU]
 21   0.015136 172.31.29.138 -> 54.230.148.165 TCP 66 41570 > http [ACK] Seq=99 Ack=52585 Win=98432 Len=0 TSval=14119806 TSecr=1455140895
 22   0.015145 54.230.148.165 -> 172.31.29.138 TCP 7306 [TCP segment of a reassembled PDU]
 23   0.015150 172.31.29.138 -> 54.230.148.165 TCP 66 41570 > http [ACK] Seq=99 Ack=59825 Win=91264 Len=0 TSval=14119806 TSecr=1455140895
 24   0.016352 54.230.148.165 -> 172.31.29.138 TCP 5858 [TCP segment of a reassembled PDU]
 25   0.016359 172.31.29.138 -> 54.230.148.165 TCP 66 41570 > http [ACK] Seq=99 Ack=65617 Win=108416 Len=0 TSval=14119807 TSecr=1455140895
 26   0.016385 54.230.148.165 -> 172.31.29.138 TCP 10202 [TCP segment of a reassembled PDU]
 27   0.016391 172.31.29.138 -> 54.230.148.165 TCP 66 41570 > http [ACK] Seq=99 Ack=75753 Win=98304 Len=0 TSval=14119807 TSecr=1455140895
 28   0.016574 54.230.148.165 -> 172.31.29.138 TCP 2962 [TCP segment of a reassembled PDU]
 29   0.016580 172.31.29.138 -> 54.230.148.165 TCP 66 41570 > http [ACK] Seq=99 Ack=78649 Win=114816 Len=0 TSval=14119807 TSecr=1455140895
 30   0.017614 54.230.148.165 -> 172.31.29.138 TCP 7306 [TCP segment of a reassembled PDU]
 31   0.017622 172.31.29.138 -> 54.230.148.165 TCP 66 41570 > http [ACK] Seq=99 Ack=85889 Win=129280 Len=0 TSval=14119807 TSecr=1455140895
 32   0.017711 54.230.148.165 -> 172.31.29.138 TCP 5858 [TCP segment of a reassembled PDU]
 33   0.017718 172.31.29.138 -> 54.230.148.165 TCP 66 41570 > http [ACK] Seq=99 Ack=91681 Win=140928 Len=0 TSval=14119807 TSecr=1455140895
 34   0.017729 54.230.148.165 -> 172.31.29.138 HTTP 11242 HTTP/1.1 200 OK  (application/octet-stream)
 35   0.017735 172.31.29.138 -> 54.230.148.165 TCP 66 41570 > http [ACK] Seq=99 Ack=102857 Win=163328 Len=0 TSval=14119807 TSecr=1455140895
 36   0.017885 172.31.29.138 -> 54.230.148.165 TCP 66 41570 > http [FIN, ACK] Seq=99 Ack=102857 Win=163328 Len=0 TSval=14119807 TSecr=1455140895
 37   0.019102 54.230.148.165 -> 172.31.29.138 TCP 66 http > 41570 [FIN, ACK] Seq=102857 Ack=100 Win=14592 Len=0 TSval=1455140895 TSecr=14119807
 38   0.019110 172.31.29.138 -> 54.230.148.165 TCP 66 41570 > http [ACK] Seq=100 Ack=102858 Win=163328 Len=0 TSval=14119807 TSecr=1455140895
