[Measurement for 10kb at 04:04:37 17.04.2014] 
Tshark:

  1   0.000000  192.168.1.2 -> 54.230.98.98 TCP 66 50011→80 [SYN] Seq=0 Win=8192 Len=0 MSS=1460 WS=256 SACK_PERM=1
  2   0.052825 54.230.98.98 -> 192.168.1.2  TCP 66 80→50011 [SYN, ACK] Seq=0 Ack=1 Win=14600 Len=0 MSS=1400 SACK_PERM=1 WS=128
  3   0.052980  192.168.1.2 -> 54.230.98.98 TCP 54 50011→80 [ACK] Seq=1 Ack=1 Win=65792 Len=0
  4   0.053123  192.168.1.2 -> 54.230.98.98 HTTP 151 GET /10kb HTTP/1.1 
  5   0.080039 54.230.98.98 -> 192.168.1.2  TCP 54 80→50011 [ACK] Seq=1 Ack=98 Win=14720 Len=0
  6   0.083104 54.230.98.98 -> 192.168.1.2  TCP 1454 [TCP segment of a reassembled PDU]
  7   0.085284 54.230.98.98 -> 192.168.1.2  TCP 1454 [TCP segment of a reassembled PDU]
  8   0.085401  192.168.1.2 -> 54.230.98.98 TCP 54 50011→80 [ACK] Seq=98 Ack=2801 Win=65792 Len=0
  9   0.085554 54.230.98.98 -> 192.168.1.2  TCP 1454 [TCP segment of a reassembled PDU]
 10   0.085608 54.230.98.98 -> 192.168.1.2  TCP 1454 [TCP segment of a reassembled PDU]
 11   0.085662  192.168.1.2 -> 54.230.98.98 TCP 54 50011→80 [ACK] Seq=98 Ack=5601 Win=65792 Len=0
 12   0.088731 54.230.98.98 -> 192.168.1.2  TCP 1454 [TCP segment of a reassembled PDU]
 13   0.088827 54.230.98.98 -> 192.168.1.2  TCP 1454 [TCP segment of a reassembled PDU]
 14   0.088887  192.168.1.2 -> 54.230.98.98 TCP 54 50011→80 [ACK] Seq=98 Ack=8401 Win=65792 Len=0
 15   0.089032 54.230.98.98 -> 192.168.1.2  TCP 1454 [TCP segment of a reassembled PDU]
 16   0.089086 54.230.98.98 -> 192.168.1.2  HTTP 949 HTTP/1.1 200 OK  (application/octet-stream)
 17   0.089134  192.168.1.2 -> 54.230.98.98 TCP 54 50011→80 [ACK] Seq=98 Ack=10696 Win=65792 Len=0
 18   0.089226  192.168.1.2 -> 54.230.98.98 TCP 54 50011→80 [FIN, ACK] Seq=98 Ack=10696 Win=65792 Len=0
 19   0.117149 54.230.98.98 -> 192.168.1.2  TCP 54 80→50011 [FIN, ACK] Seq=10696 Ack=99 Win=14720 Len=0
 20   0.117281  192.168.1.2 -> 54.230.98.98 TCP 54 50011→80 [ACK] Seq=99 Ack=10697 Win=65792 Len=0
