[Measurement for 10kb at 18:05:18 16.05.2014] 
Tshark:

  1   0.000000  192.168.1.2 -> 74.125.232.216 SSL 55 Continuation Data
  2   0.026748 74.125.232.216 -> 192.168.1.2  TCP 66 443→63738 [ACK] Seq=1 Ack=2 Win=361 Len=0 SLE=1 SRE=2
  3   0.995717  192.168.1.2 -> 74.125.205.188 SSL 55 Continuation Data
  4   1.016155  192.168.1.2 -> 54.230.98.130 TCP 66 63785→80 [SYN] Seq=0 Win=8192 Len=0 MSS=1460 WS=256 SACK_PERM=1
  5   1.040249 74.125.205.188 -> 192.168.1.2  TCP 66 443→63043 [ACK] Seq=1 Ack=2 Win=361 Len=0 SLE=1 SRE=2
  6   1.044891 54.230.98.130 -> 192.168.1.2  TCP 66 80→63785 [SYN, ACK] Seq=0 Ack=1 Win=14600 Len=0 MSS=1400 SACK_PERM=1 WS=128
  7   1.045071  192.168.1.2 -> 54.230.98.130 TCP 54 63785→80 [ACK] Seq=1 Ack=1 Win=65792 Len=0
  8   1.054948  192.168.1.2 -> 54.230.98.130 HTTP 151 GET /10kb HTTP/1.1 
  9   1.120823 54.230.98.130 -> 192.168.1.2  TCP 54 80→63785 [ACK] Seq=1 Ack=98 Win=14720 Len=0
 10   1.126959 54.230.98.130 -> 192.168.1.2  TCP 1454 [TCP segment of a reassembled PDU]
 11   1.128563 54.230.98.130 -> 192.168.1.2  TCP 1454 [TCP segment of a reassembled PDU]
 12   1.128736  192.168.1.2 -> 54.230.98.130 TCP 54 63785→80 [ACK] Seq=98 Ack=2801 Win=65792 Len=0
 13   1.128858 54.230.98.130 -> 192.168.1.2  TCP 1454 [TCP segment of a reassembled PDU]
 14   1.128889 54.230.98.130 -> 192.168.1.2  TCP 1454 [TCP segment of a reassembled PDU]
 15   1.128920  192.168.1.2 -> 54.230.98.130 TCP 54 63785→80 [ACK] Seq=98 Ack=5601 Win=65792 Len=0
 16   1.128985 54.230.98.130 -> 192.168.1.2  TCP 1454 [TCP segment of a reassembled PDU]
 17   1.129079 54.230.98.130 -> 192.168.1.2  TCP 1454 [TCP segment of a reassembled PDU]
 18   1.129119  192.168.1.2 -> 54.230.98.130 TCP 54 63785→80 [ACK] Seq=98 Ack=8401 Win=65792 Len=0
 19   1.129182 54.230.98.130 -> 192.168.1.2  TCP 1454 [TCP segment of a reassembled PDU]
 20   1.129211 54.230.98.130 -> 192.168.1.2  HTTP 949 HTTP/1.1 200 OK  (application/octet-stream)
 21   1.129239  192.168.1.2 -> 54.230.98.130 TCP 54 63785→80 [ACK] Seq=98 Ack=10696 Win=65792 Len=0
 22   1.129499  192.168.1.2 -> 54.230.98.130 TCP 54 63785→80 [FIN, ACK] Seq=98 Ack=10696 Win=65792 Len=0
 23   1.160207 54.230.98.130 -> 192.168.1.2  TCP 54 80→63785 [FIN, ACK] Seq=10696 Ack=99 Win=14720 Len=0
 24   1.160316  192.168.1.2 -> 54.230.98.130 TCP 54 63785→80 [ACK] Seq=99 Ack=10697 Win=65792 Len=0
