[Measurement for 10mb at 17:36:53 19.36.2014] 
Tshark:

  1   0.000000 172.31.36.109 -> 172.31.0.2   DNS 89 Standard query 0x13ea  A d1n0gskdvzj94j.cloudfront.net
  2   0.000041 172.31.36.109 -> 172.31.0.2   DNS 89 Standard query 0xafdf  AAAA d1n0gskdvzj94j.cloudfront.net
  3   0.000490   172.31.0.2 -> 172.31.36.109 DNS 217 Standard query response 0x13ea  A 54.230.23.104 A 54.230.20.43 A 54.230.20.115 A 54.230.20.154 A 54.230.21.79 A 54.230.21.146 A 54.230.21.237 A 54.230.23.102
  4   0.000504   172.31.0.2 -> 172.31.36.109 DNS 176 Standard query response 0xafdf 
  5   0.003848 172.31.36.109 -> 54.230.23.104 TCP 74 36434 > http [SYN] Seq=0 Win=26883 Len=0 MSS=8961 SACK_PERM=1 TSval=20574941 TSecr=0 WS=128
  6   0.100606 54.230.23.104 -> 172.31.36.109 TCP 74 http > 36434 [SYN, ACK] Seq=0 Ack=1 Win=14480 Len=0 MSS=1460 SACK_PERM=1 TSval=827600443 TSecr=20574941 WS=128
  7   0.100653 172.31.36.109 -> 54.230.23.104 TCP 66 36434 > http [ACK] Seq=1 Ack=1 Win=27008 Len=0 TSval=20574966 TSecr=827600443
  8   0.100756 172.31.36.109 -> 54.230.23.104 HTTP 163 GET /10mb HTTP/1.1 
  9   0.197712 54.230.23.104 -> 172.31.36.109 TCP 66 http > 36434 [ACK] Seq=1 Ack=98 Win=14592 Len=0 TSval=827600453 TSecr=20574966
 10   0.332368 54.230.23.104 -> 172.31.36.109 TCP 1169 [TCP segment of a reassembled PDU]
 11   0.332388 172.31.36.109 -> 54.230.23.104 TCP 66 36434 > http [ACK] Seq=98 Ack=1104 Win=29184 Len=0 TSval=20575024 TSecr=827600466
 12   0.332417 54.230.23.104 -> 172.31.36.109 TCP 11895 [TCP segment of a reassembled PDU]
 13   0.332423 172.31.36.109 -> 54.230.23.104 TCP 66 36434 > http [ACK] Seq=98 Ack=12933 Win=52864 Len=0 TSval=20575024 TSecr=827600466
 14   0.429390 54.230.23.104 -> 172.31.36.109 TCP 2962 [TCP segment of a reassembled PDU]
 15   0.429399 172.31.36.109 -> 54.230.23.104 TCP 66 36434 > http [ACK] Seq=98 Ack=15829 Win=58624 Len=0 TSval=20575048 TSecr=827600476
 16   0.429438 54.230.23.104 -> 172.31.36.109 TCP 5858 [TCP segment of a reassembled PDU]
 17   0.429444 172.31.36.109 -> 54.230.23.104 TCP 66 36434 > http [ACK] Seq=98 Ack=21621 Win=70144 Len=0 TSval=20575048 TSecr=827600476
 18   0.429452 54.230.23.104 -> 172.31.36.109 TCP 4410 [TCP segment of a reassembled PDU]
 19   0.429456 172.31.36.109 -> 54.230.23.104 TCP 66 36434 > http [ACK] Seq=98 Ack=25965 Win=78848 Len=0 TSval=20575048 TSecr=827600476
 20   0.473117 54.230.23.104 -> 172.31.36.109 TCP 4410 [TCP segment of a reassembled PDU]
 21   0.473127 172.31.36.109 -> 54.230.23.104 TCP 66 36434 > http [ACK] Seq=98 Ack=30309 Win=87552 Len=0 TSval=20575059 TSecr=827600480
 22   0.526318 54.230.23.104 -> 172.31.36.109 TCP 15994 [TCP segment of a reassembled PDU]
 23   0.526332 172.31.36.109 -> 54.230.23.104 TCP 66 36434 > http [ACK] Seq=98 Ack=46237 Win=119424 Len=0 TSval=20575072 TSecr=827600486
 24   0.526445 54.230.23.104 -> 172.31.36.109 TCP 1514 [TCP segment of a reassembled PDU]
 25   0.526451 172.31.36.109 -> 54.230.23.104 TCP 66 36434 > http [ACK] Seq=98 Ack=47685 Win=122368 Len=0 TSval=20575072 TSecr=827600486
 26   0.570037 54.230.23.104 -> 172.31.36.109 TCP 4410 [TCP segment of a reassembled PDU]
 27   0.570075 172.31.36.109 -> 54.230.23.104 TCP 66 36434 > http [ACK] Seq=98 Ack=52029 Win=130944 Len=0 TSval=20575083 TSecr=827600490
 28   0.623176 54.230.23.104 -> 172.31.36.109 TCP 4410 [TCP segment of a reassembled PDU]
 29   0.623200 172.31.36.109 -> 54.230.23.104 TCP 66 36434 > http [ACK] Seq=98 Ack=56373 Win=139648 Len=0 TSval=20575096 TSecr=827600495
 30   0.623249 54.230.23.104 -> 172.31.36.109 TCP 4410 [TCP segment of a reassembled PDU]
 31   0.623255 172.31.36.109 -> 54.230.23.104 TCP 66 36434 > http [ACK] Seq=98 Ack=60717 Win=148352 Len=0 TSval=20575096 TSecr=827600495
 32   0.623334 54.230.23.104 -> 172.31.36.109 TCP 13098 [TCP segment of a reassembled PDU]
 33   0.623343 172.31.36.109 -> 54.230.23.104 TCP 66 36434 > http [ACK] Seq=98 Ack=73749 Win=174464 Len=0 TSval=20575096 TSecr=827600495
 34   0.667185 54.230.23.104 -> 172.31.36.109 TCP 4410 [TCP segment of a reassembled PDU]
