[Measurement for 10mb at 20:33:58 19.33.2014] 
Tshark:

  1   0.000000 172.31.36.109 -> 172.31.0.2   DNS 89 Standard query 0x2176  A d1n0gskdvzj94j.cloudfront.net
  2   0.000027 172.31.36.109 -> 172.31.0.2   DNS 89 Standard query 0xb3ff  AAAA d1n0gskdvzj94j.cloudfront.net
  3   0.000482   172.31.0.2 -> 172.31.36.109 DNS 217 Standard query response 0x2176  A 54.192.30.136 A 54.230.29.244 A 54.230.29.253 A 54.230.30.51 A 54.230.30.216 A 54.230.30.229 A 54.230.30.253 A 54.192.29.221
  4   0.000494   172.31.0.2 -> 172.31.36.109 DNS 176 Standard query response 0xb3ff 
  5   0.003894 172.31.36.109 -> 54.192.30.136 TCP 74 56346 > http [SYN] Seq=0 Win=26883 Len=0 MSS=8961 SACK_PERM=1 TSval=23231164 TSecr=0 WS=128
  6   0.005014 54.192.30.136 -> 172.31.36.109 TCP 74 http > 56346 [SYN, ACK] Seq=0 Ack=1 Win=14480 Len=0 MSS=1460 SACK_PERM=1 TSval=723048860 TSecr=23231164 WS=128
  7   0.005028 172.31.36.109 -> 54.192.30.136 TCP 66 56346 > http [ACK] Seq=1 Ack=1 Win=27008 Len=0 TSval=23231165 TSecr=723048860
  8   0.005077 172.31.36.109 -> 54.192.30.136 HTTP 163 GET /10mb HTTP/1.1 
  9   0.006296 54.192.30.136 -> 172.31.36.109 TCP 66 http > 56346 [ACK] Seq=1 Ack=98 Win=14592 Len=0 TSval=723048860 TSecr=23231165
 10   0.030717 54.192.30.136 -> 172.31.36.109 TCP 7306 [TCP segment of a reassembled PDU]
 11   0.030728 172.31.36.109 -> 54.192.30.136 TCP 66 56346 > http [ACK] Seq=98 Ack=7241 Win=41472 Len=0 TSval=23231171 TSecr=723048862
 12   0.030817 54.192.30.136 -> 172.31.36.109 TCP 5858 [TCP segment of a reassembled PDU]
 13   0.030824 172.31.36.109 -> 54.192.30.136 TCP 66 56346 > http [ACK] Seq=98 Ack=13033 Win=52992 Len=0 TSval=23231171 TSecr=723048862
 14   0.031909 54.192.30.136 -> 172.31.36.109 TCP 10202 [TCP segment of a reassembled PDU]
 15   0.031918 172.31.36.109 -> 54.192.30.136 TCP 66 56346 > http [ACK] Seq=98 Ack=23169 Win=73344 Len=0 TSval=23231171 TSecr=723048862
 16   0.032064 54.192.30.136 -> 172.31.36.109 TCP 2962 [TCP segment of a reassembled PDU]
 17   0.032069 172.31.36.109 -> 54.192.30.136 TCP 66 56346 > http [ACK] Seq=98 Ack=26065 Win=79104 Len=0 TSval=23231171 TSecr=723048862
 18   0.033178 54.192.30.136 -> 172.31.36.109 TCP 7306 [TCP segment of a reassembled PDU]
 19   0.033184 172.31.36.109 -> 54.192.30.136 TCP 66 56346 > http [ACK] Seq=98 Ack=33305 Win=93568 Len=0 TSval=23231172 TSecr=723048862
 20   0.033354 54.192.30.136 -> 172.31.36.109 TCP 4410 [TCP segment of a reassembled PDU]
 21   0.033359 172.31.36.109 -> 54.192.30.136 TCP 66 56346 > http [ACK] Seq=98 Ack=37649 Win=102272 Len=0 TSval=23231172 TSecr=723048862
 22   0.033425 54.192.30.136 -> 172.31.36.109 TCP 8754 [TCP segment of a reassembled PDU]
 23   0.033432 172.31.36.109 -> 54.192.30.136 TCP 66 56346 > http [ACK] Seq=98 Ack=46337 Win=119680 Len=0 TSval=23231172 TSecr=723048862
 24   0.034448 54.192.30.136 -> 172.31.36.109 TCP 10202 [TCP segment of a reassembled PDU]
 25   0.034456 172.31.36.109 -> 54.192.30.136 TCP 66 56346 > http [ACK] Seq=98 Ack=56473 Win=139904 Len=0 TSval=23231172 TSecr=723048863
 26   0.034679 54.192.30.136 -> 172.31.36.109 TCP 8754 [TCP segment of a reassembled PDU]
 27   0.034686 172.31.36.109 -> 54.192.30.136 TCP 66 56346 > http [ACK] Seq=98 Ack=65161 Win=157312 Len=0 TSval=23231172 TSecr=723048863
 28   0.035463 54.192.30.136 -> 172.31.36.109 TCP 5858 [TCP segment of a reassembled PDU]
 29   0.035469 172.31.36.109 -> 54.192.30.136 TCP 66 56346 > http [ACK] Seq=98 Ack=70953 Win=168832 Len=0 TSval=23231172 TSecr=723048863
 30   0.035500 54.192.30.136 -> 172.31.36.109 TCP 2962 [TCP segment of a reassembled PDU]
 31   0.035505 172.31.36.109 -> 54.192.30.136 TCP 66 56346 > http [ACK] Seq=98 Ack=73849 Win=174592 Len=0 TSval=23231172 TSecr=723048863
 32   0.035688 54.192.30.136 -> 172.31.36.109 TCP 4410 [TCP segment of a reassembled PDU]
 33   0.035693 172.31.36.109 -> 54.192.30.136 TCP 66 56346 > http [ACK] Seq=98 Ack=78193 Win=183296 Len=0 TSval=23231172 TSecr=723048863
 34   0.036454 54.192.30.136 -> 172.31.36.109 TCP 2962 [TCP segment of a reassembled PDU]
 35   0.036459 172.31.36.109 -> 54.192.30.136 TCP 66 56346 > http [ACK] Seq=98 Ack=81089 Win=189184 Len=0 TSval=23231172 TSecr=723048863
 36   0.036551 54.192.30.136 -> 172.31.36.109 TCP 11650 [TCP segment of a reassembled PDU]
 37   0.036559 172.31.36.109 -> 54.192.30.136 TCP 66 56346 > http [ACK] Seq=98 Ack=92673 Win=179200 Len=0 TSval=23231172 TSecr=723048863
 38   0.036844 54.192.30.136 -> 172.31.36.109 TCP 11650 [TCP segment of a reassembled PDU]
 39   0.036866 172.31.36.109 -> 54.192.30.136 TCP 66 56346 > http [ACK] Seq=98 Ack=104257 Win=179200 Len=0 TSval=23231172 TSecr=723048863
 40   0.037725 54.192.30.136 -> 172.31.36.109 TCP 5858 [TCP segment of a reassembled PDU]
 41   0.037731 172.31.36.109 -> 54.192.30.136 TCP 66 56346 > http [ACK] Seq=98 Ack=110049 Win=188672 Len=0 TSval=23231173 TSecr=723048863
 42   0.037835 54.192.30.136 -> 172.31.36.109 TCP 2962 [TCP segment of a reassembled PDU]
 43   0.037849 172.31.36.109 -> 54.192.30.136 TCP 66 56346 > http [ACK] Seq=98 Ack=112945 Win=194944 Len=0 TSval=23231173 TSecr=723048863
 44   0.038049 54.192.30.136 -> 172.31.36.109 TCP 17442 [TCP segment of a reassembled PDU]
 45   0.038059 172.31.36.109 -> 54.192.30.136 TCP 66 56346 > http [ACK] Seq=98 Ack=130321 Win=229632 Len=0 TSval=23231173 TSecr=723048863
 46   0.038777 54.192.30.136 -> 172.31.36.109 TCP 2962 [TCP segment of a reassembled PDU]
 47   0.038784 172.31.36.109 -> 54.192.30.136 TCP 66 56346 > http [ACK] Seq=98 Ack=133217 Win=235520 Len=0 TSval=23231173 TSecr=723048863
 48   0.038881 54.192.30.136 -> 172.31.36.109 TCP 2962 [TCP segment of a reassembled PDU]
 49   0.038886 172.31.36.109 -> 54.192.30.136 TCP 66 56346 > http [ACK] Seq=98 Ack=136113 Win=241280 Len=0 TSval=23231173 TSecr=723048863
 50   0.039004 54.192.30.136 -> 172.31.36.109 TCP 8754 [TCP segment of a reassembled PDU]
 51   0.039011 172.31.36.109 -> 54.192.30.136 TCP 66 56346 > http [ACK] Seq=98 Ack=144801 Win=258688 Len=0 TSval=23231173 TSecr=723048863
 52   0.039100 54.192.30.136 -> 172.31.36.109 TCP 2962 [TCP segment of a reassembled PDU]
 53   0.039105 172.31.36.109 -> 54.192.30.136 TCP 66 56346 > http [ACK] Seq=98 Ack=147697 Win=264448 Len=0 TSval=23231173 TSecr=723048863
 54   0.039347 54.192.30.136 -> 172.31.36.109 TCP 13098 [TCP segment of a reassembled PDU]
 55   0.039355 172.31.36.109 -> 54.192.30.136 TCP 66 56346 > http [ACK] Seq=98 Ack=160729 Win=290432 Len=0 TSval=23231173 TSecr=723048863
 56   0.039570 54.192.30.136 -> 172.31.36.109 TCP 10202 [TCP segment of a reassembled PDU]
 57   0.039577 172.31.36.109 -> 54.192.30.136 TCP 66 56346 > http [ACK] Seq=98 Ack=170865 Win=310784 Len=0 TSval=23231173 TSecr=723048863
 58   0.040021 54.192.30.136 -> 172.31.36.109 TCP 2962 [TCP segment of a reassembled PDU]
 59   0.040026 172.31.36.109 -> 54.192.30.136 TCP 66 56346 > http [ACK] Seq=98 Ack=173761 Win=316544 Len=0 TSval=23231173 TSecr=723048863
 60   0.040145 54.192.30.136 -> 172.31.36.109 TCP 4410 [TCP segment of a reassembled PDU]
 61   0.040150 172.31.36.109 -> 54.192.30.136 TCP 66 56346 > http [ACK] Seq=98 Ack=178105 Win=325248 Len=0 TSval=23231173 TSecr=723048863
 62   0.040264 54.192.30.136 -> 172.31.36.109 TCP 4410 [TCP segment of a reassembled PDU]
 63   0.040270 172.31.36.109 -> 54.192.30.136 TCP 66 56346 > http [ACK] Seq=98 Ack=182449 Win=333952 Len=0 TSval=23231173 TSecr=723048863
 64   0.040394 54.192.30.136 -> 172.31.36.109 TCP 7306 [TCP segment of a reassembled PDU]
 65   0.040400 172.31.36.109 -> 54.192.30.136 TCP 66 56346 > http [ACK] Seq=98 Ack=189689 Win=348416 Len=0 TSval=23231173 TSecr=723048863
 66   0.040638 54.192.30.136 -> 172.31.36.109 TCP 10202 [TCP segment of a reassembled PDU]
 67   0.040646 172.31.36.109 -> 54.192.30.136 TCP 66 56346 > http [ACK] Seq=98 Ack=199825 Win=368640 Len=0 TSval=23231173 TSecr=723048863
 68   0.040904 54.192.30.136 -> 172.31.36.109 TCP 20338 [TCP segment of a reassembled PDU]
 69   0.040916 172.31.36.109 -> 54.192.30.136 TCP 66 56346 > http [ACK] Seq=98 Ack=220097 Win=409216 Len=0 TSval=23231173 TSecr=723048863
 70   0.041571 54.192.30.136 -> 172.31.36.109 TCP 8754 [TCP segment of a reassembled PDU]
 71   0.041578 172.31.36.109 -> 54.192.30.136 TCP 66 56346 > http [ACK] Seq=98 Ack=228785 Win=426624 Len=0 TSval=23231174 TSecr=723048863
 72   0.041683 54.192.30.136 -> 172.31.36.109 TCP 5858 [TCP segment of a reassembled PDU]
 73   0.041689 172.31.36.109 -> 54.192.30.136 TCP 66 56346 > http [ACK] Seq=98 Ack=234577 Win=438144 Len=0 TSval=23231174 TSecr=723048863
 74   0.041947 54.192.30.136 -> 172.31.36.109 TCP 10202 [TCP segment of a reassembled PDU]
 75   0.041955 172.31.36.109 -> 54.192.30.136 TCP 66 56346 > http [ACK] Seq=98 Ack=244713 Win=458496 Len=0 TSval=23231174 TSecr=723048863
 76   0.042203 54.192.30.136 -> 172.31.36.109 TCP 17265 [TCP segment of a reassembled PDU]
 77   0.042214 172.31.36.109 -> 54.192.30.136 TCP 66 56346 > http [ACK] Seq=98 Ack=261912 Win=492800 Len=0 TSval=23231174 TSecr=723048863
 78   0.042426 54.192.30.136 -> 172.31.36.109 TCP 1514 [TCP segment of a reassembled PDU]
 79   0.042431 172.31.36.109 -> 54.192.30.136 TCP 66 56346 > http [ACK] Seq=98 Ack=263360 Win=495744 Len=0 TSval=23231174 TSecr=723048863
 80   0.042678 54.192.30.136 -> 172.31.36.109 TCP 8754 [TCP segment of a reassembled PDU]
 81   0.042685 172.31.36.109 -> 54.192.30.136 TCP 66 56346 > http [ACK] Seq=98 Ack=272048 Win=513152 Len=0 TSval=23231174 TSecr=723048863
 82   0.042891 54.192.30.136 -> 172.31.36.109 TCP 15994 [TCP segment of a reassembled PDU]
 83   0.042900 172.31.36.109 -> 54.192.30.136 TCP 66 56346 > http [ACK] Seq=98 Ack=287976 Win=545024 Len=0 TSval=23231174 TSecr=723048863
 84   0.043363 54.192.30.136 -> 172.31.36.109 TCP 2962 [TCP segment of a reassembled PDU]
 85   0.043368 172.31.36.109 -> 54.192.30.136 TCP 66 56346 > http [ACK] Seq=98 Ack=290872 Win=550784 Len=0 TSval=23231174 TSecr=723048863
 86   0.043470 54.192.30.136 -> 172.31.36.109 TCP 5858 [TCP segment of a reassembled PDU]
 87   0.043476 172.31.36.109 -> 54.192.30.136 TCP 66 56346 > http [ACK] Seq=98 Ack=296664 Win=562304 Len=0 TSval=23231174 TSecr=723048863
 88   0.043762 54.192.30.136 -> 172.31.36.109 TCP 27578 [TCP segment of a reassembled PDU]
 89   0.043775 172.31.36.109 -> 54.192.30.136 TCP 66 56346 > http [ACK] Seq=98 Ack=324176 Win=617344 Len=0 TSval=23231174 TSecr=723048863
 90   0.043781 54.192.30.136 -> 172.31.36.109 TCP 1514 [TCP segment of a reassembled PDU]
 91   0.043796 172.31.36.109 -> 54.192.30.136 TCP 66 56346 > http [ACK] Seq=98 Ack=325624 Win=620288 Len=0 TSval=23231174 TSecr=723048863
 92   0.043872 54.192.30.136 -> 172.31.36.109 TCP 1890 [TCP segment of a reassembled PDU]
 93   0.043877 172.31.36.109 -> 54.192.30.136 TCP 66 56346 > http [ACK] Seq=98 Ack=327448 Win=623872 Len=0 TSval=23231174 TSecr=723048863
 94   0.092434 54.192.30.136 -> 172.31.36.109 TCP 8754 [TCP segment of a reassembled PDU]
 95   0.092444 172.31.36.109 -> 54.192.30.136 TCP 66 56346 > http [ACK] Seq=98 Ack=336136 Win=641280 Len=0 TSval=23231186 TSecr=723048868
 96   0.092702 54.192.30.136 -> 172.31.36.109 TCP 20338 [TCP segment of a reassembled PDU]
 97   0.092713 172.31.36.109 -> 54.192.30.136 TCP 66 56346 > http [ACK] Seq=98 Ack=356408 Win=681856 Len=0 TSval=23231186 TSecr=723048868
 98   0.092774 54.192.30.136 -> 172.31.36.109 TCP 11650 [TCP segment of a reassembled PDU]
 99   0.092782 172.31.36.109 -> 54.192.30.136 TCP 66 56346 > http [ACK] Seq=98 Ack=367992 Win=705024 Len=0 TSval=23231186 TSecr=723048868
100   0.093055 54.192.30.136 -> 172.31.36.109 TCP 17442 [TCP segment of a reassembled PDU]
101   0.093066 172.31.36.109 -> 54.192.30.136 TCP 66 56346 > http [ACK] Seq=98 Ack=385368 Win=737280 Len=0 TSval=23231187 TSecr=723048868
102   0.093101 54.192.30.136 -> 172.31.36.109 TCP 7682 [TCP segment of a reassembled PDU]
103   0.093107 172.31.36.109 -> 54.192.30.136 TCP 66 56346 > http [ACK] Seq=98 Ack=392984 Win=729728 Len=0 TSval=23231187 TSecr=723048868
104   0.093126 54.192.30.136 -> 172.31.36.109 TCP 1514 [TCP segment of a reassembled PDU]
105   0.093135 172.31.36.109 -> 54.192.30.136 TCP 66 56346 > http [ACK] Seq=98 Ack=394432 Win=742656 Len=0 TSval=23231187 TSecr=723048868
106   0.093933 54.192.30.136 -> 172.31.36.109 TCP 5858 [TCP segment of a reassembled PDU]
107   0.093939 172.31.36.109 -> 54.192.30.136 TCP 66 56346 > http [ACK] Seq=98 Ack=400224 Win=754304 Len=0 TSval=23231187 TSecr=723048868
108   0.094068 54.192.30.136 -> 172.31.36.109 TCP 11650 [TCP segment of a reassembled PDU]
109   0.094077 172.31.36.109 -> 54.192.30.136 TCP 66 56346 > http [ACK] Seq=98 Ack=411808 Win=746880 Len=0 TSval=23231187 TSecr=723048868
110   0.094288 54.192.30.136 -> 172.31.36.109 TCP 14546 [TCP segment of a reassembled PDU]
111   0.094298 172.31.36.109 -> 54.192.30.136 TCP 66 56346 > http [ACK] Seq=98 Ack=426288 Win=742016 Len=0 TSval=23231187 TSecr=723048868
112   0.094464 54.192.30.136 -> 172.31.36.109 TCP 13098 [TCP segment of a reassembled PDU]
113   0.094474 172.31.36.109 -> 54.192.30.136 TCP 66 56346 > http [ACK] Seq=98 Ack=439320 Win=744576 Len=0 TSval=23231187 TSecr=723048869
114   0.094578 54.192.30.136 -> 172.31.36.109 TCP 11650 [TCP segment of a reassembled PDU]
115   0.094586 172.31.36.109 -> 54.192.30.136 TCP 66 56346 > http [ACK] Seq=98 Ack=450904 Win=746880 Len=0 TSval=23231187 TSecr=723048869
116   0.094664 54.192.30.136 -> 172.31.36.109 TCP 4410 [TCP segment of a reassembled PDU]
117   0.094670 172.31.36.109 -> 54.192.30.136 TCP 66 56346 > http [ACK] Seq=98 Ack=455248 Win=758784 Len=0 TSval=23231187 TSecr=723048869
118   0.094766 54.192.30.136 -> 172.31.36.109 TCP 4410 [TCP segment of a reassembled PDU]
119   0.094771 172.31.36.109 -> 54.192.30.136 TCP 66 56346 > http [ACK] Seq=98 Ack=459592 Win=758784 Len=0 TSval=23231187 TSecr=723048869
120   0.095278 54.192.30.136 -> 172.31.36.109 TCP 4410 [TCP segment of a reassembled PDU]
121   0.095283 172.31.36.109 -> 54.192.30.136 TCP 66 56346 > http [ACK] Seq=98 Ack=463936 Win=758784 Len=0 TSval=23231187 TSecr=723048869
122   0.095433 54.192.30.136 -> 172.31.36.109 TCP 23234 [TCP segment of a reassembled PDU]
123   0.095456 172.31.36.109 -> 54.192.30.136 TCP 66 56346 > http [ACK] Seq=98 Ack=487104 Win=735616 Len=0 TSval=23231187 TSecr=723048869
124   0.095467 54.192.30.136 -> 172.31.36.109 TCP 4410 [TCP segment of a reassembled PDU]
125   0.095484 172.31.36.109 -> 54.192.30.136 TCP 66 56346 > http [ACK] Seq=98 Ack=491448 Win=761344 Len=0 TSval=23231187 TSecr=723048869
126   0.095795 54.192.30.136 -> 172.31.36.109 TCP 10202 [TCP segment of a reassembled PDU]
127   0.095824 172.31.36.109 -> 54.192.30.136 TCP 66 56346 > http [ACK] Seq=98 Ack=501584 Win=761344 Len=0 TSval=23231187 TSecr=723048869
128   0.095938 54.192.30.136 -> 172.31.36.109 TCP 17442 [TCP segment of a reassembled PDU]
129   0.095959 172.31.36.109 -> 54.192.30.136 TCP 66 56346 > http [ACK] Seq=98 Ack=518960 Win=744064 Len=0 TSval=23231187 TSecr=723048869
130   0.096000 54.192.30.136 -> 172.31.36.109 TCP 5858 [TCP segment of a reassembled PDU]
131   0.096006 172.31.36.109 -> 54.192.30.136 TCP 66 56346 > http [ACK] Seq=98 Ack=524752 Win=756352 Len=0 TSval=23231187 TSecr=723048869
132   0.096759 54.192.30.136 -> 172.31.36.109 TCP 8754 [TCP segment of a reassembled PDU]
133   0.096783 172.31.36.109 -> 54.192.30.136 TCP 66 56346 > http [ACK] Seq=98 Ack=533440 Win=761344 Len=0 TSval=23231187 TSecr=723048869
134   0.096895 54.192.30.136 -> 172.31.36.109 TCP 13098 [TCP segment of a reassembled PDU]
135   0.096915 172.31.36.109 -> 54.192.30.136 TCP 66 56346 > http [ACK] Seq=98 Ack=546472 Win=761344 Len=0 TSval=23231187 TSecr=723048869
136   0.097152 54.192.30.136 -> 172.31.36.109 TCP 21786 [TCP segment of a reassembled PDU]
137   0.097176 172.31.36.109 -> 54.192.30.136 TCP 66 56346 > http [ACK] Seq=98 Ack=568192 Win=761344 Len=0 TSval=23231188 TSecr=723048869
138   0.097258 54.192.30.136 -> 172.31.36.109 TCP 14546 [TCP segment of a reassembled PDU]
139   0.097267 172.31.36.109 -> 54.192.30.136 TCP 66 56346 > http [ACK] Seq=98 Ack=582672 Win=790272 Len=0 TSval=23231188 TSecr=723048869
140   0.097495 54.192.30.136 -> 172.31.36.109 TCP 7306 [TCP segment of a reassembled PDU]
141   0.097502 172.31.36.109 -> 54.192.30.136 TCP 66 56346 > http [ACK] Seq=98 Ack=589912 Win=804864 Len=0 TSval=23231188 TSecr=723048869
142   0.112418 54.192.30.136 -> 172.31.36.109 TCP 5858 [TCP segment of a reassembled PDU]
143   0.112434 172.31.36.109 -> 54.192.30.136 TCP 66 56346 > http [ACK] Seq=98 Ack=595704 Win=816384 Len=0 TSval=23231191 TSecr=723048870
144   0.112501 54.192.30.136 -> 172.31.36.109 TCP 11650 [TCP segment of a reassembled PDU]
145   0.112509 172.31.36.109 -> 54.192.30.136 TCP 66 56346 > http [ACK] Seq=98 Ack=607288 Win=839552 Len=0 TSval=23231191 TSecr=723048870
146   0.112605 54.192.30.136 -> 172.31.36.109 TCP 8754 [TCP segment of a reassembled PDU]
147   0.112611 172.31.36.109 -> 54.192.30.136 TCP 66 56346 > http [ACK] Seq=98 Ack=615976 Win=856960 Len=0 TSval=23231191 TSecr=723048870
148   0.112818 54.192.30.136 -> 172.31.36.109 TCP 21786 [TCP segment of a reassembled PDU]
149   0.112831 172.31.36.109 -> 54.192.30.136 TCP 66 56346 > http [ACK] Seq=98 Ack=637696 Win=900352 Len=0 TSval=23231191 TSecr=723048870
150   0.112841 54.192.30.136 -> 172.31.36.109 TCP 2962 [TCP segment of a reassembled PDU]
151   0.112844 172.31.36.109 -> 54.192.30.136 TCP 66 56346 > http [ACK] Seq=98 Ack=640592 Win=906112 Len=0 TSval=23231191 TSecr=723048870
152   0.112866 54.192.30.136 -> 172.31.36.109 TCP 7306 [TCP segment of a reassembled PDU]
153   0.112871 172.31.36.109 -> 54.192.30.136 TCP 66 56346 > http [ACK] Seq=98 Ack=647832 Win=920704 Len=0 TSval=23231191 TSecr=723048870
154   0.112978 54.192.30.136 -> 172.31.36.109 TCP 7306 [TCP segment of a reassembled PDU]
155   0.112984 172.31.36.109 -> 54.192.30.136 TCP 66 56346 > http [ACK] Seq=98 Ack=655072 Win=935168 Len=0 TSval=23231192 TSecr=723048870
156   0.113086 54.192.30.136 -> 172.31.36.109 TCP 122 [TCP segment of a reassembled PDU]
157   0.113099 172.31.36.109 -> 54.192.30.136 TCP 66 56346 > http [ACK] Seq=98 Ack=655128 Win=935168 Len=0 TSval=23231192 TSecr=723048870
158   0.125887 54.192.30.136 -> 172.31.36.109 TCP 1514 [TCP segment of a reassembled PDU]
159   0.125891 172.31.36.109 -> 54.192.30.136 TCP 66 56346 > http [ACK] Seq=98 Ack=656576 Win=937984 Len=0 TSval=23231195 TSecr=723048872
160   0.126140 54.192.30.136 -> 172.31.36.109 TCP 2962 [TCP segment of a reassembled PDU]
161   0.126145 172.31.36.109 -> 54.192.30.136 TCP 66 56346 > http [ACK] Seq=98 Ack=659472 Win=943872 Len=0 TSval=23231195 TSecr=723048872
162   0.126294 54.192.30.136 -> 172.31.36.109 TCP 15994 [TCP segment of a reassembled PDU]
163   0.126303 172.31.36.109 -> 54.192.30.136 TCP 66 56346 > http [ACK] Seq=98 Ack=675400 Win=975616 Len=0 TSval=23231195 TSecr=723048872
164   0.126317 54.192.30.136 -> 172.31.36.109 TCP 11650 [TCP segment of a reassembled PDU]
165   0.126323 172.31.36.109 -> 54.192.30.136 TCP 66 56346 > http [ACK] Seq=98 Ack=686984 Win=998784 Len=0 TSval=23231195 TSecr=723048872
166   0.126482 54.192.30.136 -> 172.31.36.109 TCP 7306 [TCP segment of a reassembled PDU]
167   0.126489 172.31.36.109 -> 54.192.30.136 TCP 66 56346 > http [ACK] Seq=98 Ack=694224 Win=1013376 Len=0 TSval=23231195 TSecr=723048872
168   0.126499 54.192.30.136 -> 172.31.36.109 TCP 8754 [TCP segment of a reassembled PDU]
169   0.126504 172.31.36.109 -> 54.192.30.136 TCP 66 56346 > http [ACK] Seq=98 Ack=702912 Win=1030656 Len=0 TSval=23231195 TSecr=723048872
170   0.126529 54.192.30.136 -> 172.31.36.109 TCP 13098 [TCP segment of a reassembled PDU]
171   0.126537 172.31.36.109 -> 54.192.30.136 TCP 66 56346 > http [ACK] Seq=98 Ack=715944 Win=1056768 Len=0 TSval=23231195 TSecr=723048872
172   0.126680 54.192.30.136 -> 172.31.36.109 TCP 1514 [TCP segment of a reassembled PDU]
173   0.126685 172.31.36.109 -> 54.192.30.136 TCP 66 56346 > http [ACK] Seq=98 Ack=717392 Win=1059712 Len=0 TSval=23231195 TSecr=723048872
174   0.126691 54.192.30.136 -> 172.31.36.109 TCP 3338 [TCP segment of a reassembled PDU]
175   0.126694 172.31.36.109 -> 54.192.30.136 TCP 66 56346 > http [ACK] Seq=98 Ack=720664 Win=1059712 Len=0 TSval=23231195 TSecr=723048872
176   0.128193 54.192.30.136 -> 172.31.36.109 TCP 1514 [TCP segment of a reassembled PDU]
177   0.128198 172.31.36.109 -> 54.192.30.136 TCP 66 56346 > http [ACK] Seq=98 Ack=722112 Win=1062528 Len=0 TSval=23231195 TSecr=723048872
178   0.128418 54.192.30.136 -> 172.31.36.109 TCP 1514 [TCP segment of a reassembled PDU]
179   0.128422 172.31.36.109 -> 54.192.30.136 TCP 66 56346 > http [ACK] Seq=98 Ack=723560 Win=1065472 Len=0 TSval=23231195 TSecr=723048872
180   0.128542 54.192.30.136 -> 172.31.36.109 TCP 10202 [TCP segment of a reassembled PDU]
181   0.128550 172.31.36.109 -> 54.192.30.136 TCP 66 56346 > http [ACK] Seq=98 Ack=733696 Win=1085696 Len=0 TSval=23231195 TSecr=723048872
182   0.128556 54.192.30.136 -> 172.31.36.109 TCP 4410 [TCP segment of a reassembled PDU]
183   0.128560 172.31.36.109 -> 54.192.30.136 TCP 66 56346 > http [ACK] Seq=98 Ack=738040 Win=1094400 Len=0 TSval=23231195 TSecr=723048872
184   0.128826 54.192.30.136 -> 172.31.36.109 TCP 11650 [TCP segment of a reassembled PDU]
185   0.128834 172.31.36.109 -> 54.192.30.136 TCP 66 56346 > http [ACK] Seq=98 Ack=749624 Win=1117568 Len=0 TSval=23231195 TSecr=723048872
186   0.129109 54.192.30.136 -> 172.31.36.109 TCP 14546 [TCP segment of a reassembled PDU]
187   0.129117 172.31.36.109 -> 54.192.30.136 TCP 66 56346 > http [ACK] Seq=98 Ack=764104 Win=1146496 Len=0 TSval=23231196 TSecr=723048872
188   0.129255 54.192.30.136 -> 172.31.36.109 TCP 1514 [TCP segment of a reassembled PDU]
189   0.129280 172.31.36.109 -> 54.192.30.136 TCP 66 56346 > http [ACK] Seq=98 Ack=765552 Win=1149440 Len=0 TSval=23231196 TSecr=723048872
190   0.129290 54.192.30.136 -> 172.31.36.109 TCP 8754 [TCP segment of a reassembled PDU]
191   0.129295 172.31.36.109 -> 54.192.30.136 TCP 66 56346 > http [ACK] Seq=98 Ack=774240 Win=1166848 Len=0 TSval=23231196 TSecr=723048872
192   0.129365 54.192.30.136 -> 172.31.36.109 TCP 5858 [TCP segment of a reassembled PDU]
193   0.129371 172.31.36.109 -> 54.192.30.136 TCP 66 56346 > http [ACK] Seq=98 Ack=780032 Win=1178368 Len=0 TSval=23231196 TSecr=723048872
194   0.129379 54.192.30.136 -> 172.31.36.109 TCP 6234 [TCP segment of a reassembled PDU]
195   0.129401 172.31.36.109 -> 54.192.30.136 TCP 66 56346 > http [ACK] Seq=98 Ack=786200 Win=1178368 Len=0 TSval=23231196 TSecr=723048872
196   0.129690 54.192.30.136 -> 172.31.36.109 TCP 1514 [TCP segment of a reassembled PDU]
197   0.129694 172.31.36.109 -> 54.192.30.136 TCP 66 56346 > http [ACK] Seq=98 Ack=787648 Win=1181312 Len=0 TSval=23231196 TSecr=723048872
198   0.129808 54.192.30.136 -> 172.31.36.109 TCP 1514 [TCP segment of a reassembled PDU]
199   0.129812 172.31.36.109 -> 54.192.30.136 TCP 66 56346 > http [ACK] Seq=98 Ack=789096 Win=1184128 Len=0 TSval=23231196 TSecr=723048872
200   0.129818 54.192.30.136 -> 172.31.36.109 TCP 1514 [TCP segment of a reassembled PDU]
201   0.129820 172.31.36.109 -> 54.192.30.136 TCP 66 56346 > http [ACK] Seq=98 Ack=790544 Win=1187072 Len=0 TSval=23231196 TSecr=723048872
202   0.129998 54.192.30.136 -> 172.31.36.109 TCP 7306 [TCP segment of a reassembled PDU]
203   0.130015 172.31.36.109 -> 54.192.30.136 TCP 66 56346 > http [ACK] Seq=98 Ack=797784 Win=1187072 Len=0 TSval=23231196 TSecr=723048872
204   0.130102 54.192.30.136 -> 172.31.36.109 TCP 11650 [TCP segment of a reassembled PDU]
205   0.130122 172.31.36.109 -> 54.192.30.136 TCP 66 56346 > http [ACK] Seq=98 Ack=809368 Win=1187072 Len=0 TSval=23231196 TSecr=723048872
206   0.130197 54.192.30.136 -> 172.31.36.109 TCP 5858 [TCP segment of a reassembled PDU]
207   0.130202 172.31.36.109 -> 54.192.30.136 TCP 66 56346 > http [ACK] Seq=98 Ack=815160 Win=1188864 Len=0 TSval=23231196 TSecr=723048872
208   0.130456 54.192.30.136 -> 172.31.36.109 TCP 1514 [TCP segment of a reassembled PDU]
209   0.130624 54.192.30.136 -> 172.31.36.109 TCP 13098 [TCP segment of a reassembled PDU]
210   0.130645 172.31.36.109 -> 54.192.30.136 TCP 66 56346 > http [ACK] Seq=98 Ack=829640 Win=1193344 Len=0 TSval=23231196 TSecr=723048872
211   0.130689 54.192.30.136 -> 172.31.36.109 TCP 11650 [TCP segment of a reassembled PDU]
212   0.130774 54.192.30.136 -> 172.31.36.109 TCP 8754 [TCP segment of a reassembled PDU]
213   0.130914 54.192.30.136 -> 172.31.36.109 TCP 21786 [TCP segment of a reassembled PDU]
214   0.130974 172.31.36.109 -> 54.192.30.136 TCP 66 56346 > http [ACK] Seq=98 Ack=871632 Win=1151360 Len=0 TSval=23231196 TSecr=723048872
215   0.130999 54.192.30.136 -> 172.31.36.109 TCP 2962 [TCP segment of a reassembled PDU]
216   0.131003 172.31.36.109 -> 54.192.30.136 TCP 66 56346 > http [ACK] Seq=98 Ack=874528 Win=1157760 Len=0 TSval=23231196 TSecr=723048872
217   0.131148 54.192.30.136 -> 172.31.36.109 TCP 23234 [TCP segment of a reassembled PDU]
218   0.131160 172.31.36.109 -> 54.192.30.136 TCP 66 56346 > http [ACK] Seq=98 Ack=897696 Win=1160320 Len=0 TSval=23231196 TSecr=723048872
219   0.131251 54.192.30.136 -> 172.31.36.109 TCP 5858 [TCP segment of a reassembled PDU]
220   0.131257 172.31.36.109 -> 54.192.30.136 TCP 66 56346 > http [ACK] Seq=98 Ack=903488 Win=1188864 Len=0 TSval=23231196 TSecr=723048872
221   0.131368 54.192.30.136 -> 172.31.36.109 TCP 8754 [TCP segment of a reassembled PDU]
222   0.131386 172.31.36.109 -> 54.192.30.136 TCP 66 56346 > http [ACK] Seq=98 Ack=912176 Win=1193344 Len=0 TSval=23231196 TSecr=723048872
223   0.131598 54.192.30.136 -> 172.31.36.109 TCP 14546 [TCP segment of a reassembled PDU]
224   0.131619 172.31.36.109 -> 54.192.30.136 TCP 66 56346 > http [ACK] Seq=98 Ack=926656 Win=1193344 Len=0 TSval=23231196 TSecr=723048872
225   0.131701 54.192.30.136 -> 172.31.36.109 TCP 5858 [TCP segment of a reassembled PDU]
226   0.131716 172.31.36.109 -> 54.192.30.136 TCP 66 56346 > http [ACK] Seq=98 Ack=932448 Win=1193344 Len=0 TSval=23231196 TSecr=723048872
227   0.132037 54.192.30.136 -> 172.31.36.109 TCP 2962 [TCP segment of a reassembled PDU]
228   0.132042 172.31.36.109 -> 54.192.30.136 TCP 66 56346 > http [ACK] Seq=98 Ack=935344 Win=1193344 Len=0 TSval=23231196 TSecr=723048872
229   0.132161 54.192.30.136 -> 172.31.36.109 TCP 8754 [TCP segment of a reassembled PDU]
230   0.132178 172.31.36.109 -> 54.192.30.136 TCP 66 56346 > http [ACK] Seq=98 Ack=944032 Win=1193344 Len=0 TSval=23231196 TSecr=723048872
231   0.132488 54.192.30.136 -> 172.31.36.109 TCP 34818 [TCP segment of a reassembled PDU]
232   0.132517 172.31.36.109 -> 54.192.30.136 TCP 66 56346 > http [ACK] Seq=98 Ack=978784 Win=1158656 Len=0 TSval=23231196 TSecr=723048872
233   0.132620 54.192.30.136 -> 172.31.36.109 TCP 13098 [TCP segment of a reassembled PDU]
234   0.132628 172.31.36.109 -> 54.192.30.136 TCP 66 56346 > http [ACK] Seq=98 Ack=991816 Win=1176960 Len=0 TSval=23231196 TSecr=723048872
235   0.133063 54.192.30.136 -> 172.31.36.109 TCP 2962 [TCP segment of a reassembled PDU]
236   0.133069 172.31.36.109 -> 54.192.30.136 TCP 66 56346 > http [ACK] Seq=98 Ack=994712 Win=1193344 Len=0 TSval=23231197 TSecr=723048872
237   0.133291 54.192.30.136 -> 172.31.36.109 TCP 2962 [TCP segment of a reassembled PDU]
238   0.133296 172.31.36.109 -> 54.192.30.136 TCP 66 56346 > http [ACK] Seq=98 Ack=997608 Win=1193344 Len=0 TSval=23231197 TSecr=723048872
239   0.133453 54.192.30.136 -> 172.31.36.109 TCP 23234 [TCP segment of a reassembled PDU]
240   0.133476 172.31.36.109 -> 54.192.30.136 TCP 66 56346 > http [ACK] Seq=98 Ack=1020776 Win=1170176 Len=0 TSval=23231197 TSecr=723048872
241   0.133554 54.192.30.136 -> 172.31.36.109 TCP 5858 [TCP segment of a reassembled PDU]
242   0.133560 172.31.36.109 -> 54.192.30.136 TCP 66 56346 > http [ACK] Seq=98 Ack=1026568 Win=1188864 Len=0 TSval=23231197 TSecr=723048872
243   0.133713 54.192.30.136 -> 172.31.36.109 TCP 21842 [TCP segment of a reassembled PDU]
244   0.133739 172.31.36.109 -> 54.192.30.136 TCP 66 56346 > http [ACK] Seq=98 Ack=1048344 Win=1167104 Len=0 TSval=23231197 TSecr=723048872
245   0.188884 54.192.30.136 -> 172.31.36.109 TCP 1514 [TCP segment of a reassembled PDU]
246   0.189096 54.192.30.136 -> 172.31.36.109 TCP 4410 [TCP segment of a reassembled PDU]
247   0.189103 172.31.36.109 -> 54.192.30.136 TCP 66 56346 > http [ACK] Seq=98 Ack=1054136 Win=1191168 Len=0 TSval=23231211 TSecr=723048878
248   0.189194 54.192.30.136 -> 172.31.36.109 TCP 1514 [TCP segment of a reassembled PDU]
249   0.189908 54.192.30.136 -> 172.31.36.109 TCP 5858 [TCP segment of a reassembled PDU]
250   0.189924 172.31.36.109 -> 54.192.30.136 TCP 66 56346 > http [ACK] Seq=98 Ack=1061376 Win=1193344 Len=0 TSval=23231211 TSecr=723048878
251   0.190177 54.192.30.136 -> 172.31.36.109 TCP 14546 [TCP segment of a reassembled PDU]
252   0.190197 172.31.36.109 -> 54.192.30.136 TCP 66 56346 > http [ACK] Seq=98 Ack=1075856 Win=1193344 Len=0 TSval=23231211 TSecr=723048878
253   0.190364 54.192.30.136 -> 172.31.36.109 TCP 2962 [TCP segment of a reassembled PDU]
254   0.190369 172.31.36.109 -> 54.192.30.136 TCP 66 56346 > http [ACK] Seq=98 Ack=1078752 Win=1193344 Len=0 TSval=23231211 TSecr=723048878
255   0.190553 54.192.30.136 -> 172.31.36.109 TCP 31922 [TCP segment of a reassembled PDU]
256   0.190568 54.192.30.136 -> 172.31.36.109 TCP 1514 [TCP segment of a reassembled PDU]
257   0.190716 54.192.30.136 -> 172.31.36.109 TCP 14921 [TCP segment of a reassembled PDU]
258   0.190892 54.192.30.136 -> 172.31.36.109 TCP 1514 [TCP segment of a reassembled PDU]
259   0.191006 54.192.30.136 -> 172.31.36.109 TCP 2962 [TCP segment of a reassembled PDU]
260   0.191135 54.192.30.136 -> 172.31.36.109 TCP 4410 [TCP segment of a reassembled PDU]
261   0.191267 54.192.30.136 -> 172.31.36.109 TCP 18890 [TCP segment of a reassembled PDU]
262   0.191367 54.192.30.136 -> 172.31.36.109 TCP 14546 [TCP segment of a reassembled PDU]
263   0.191483 54.192.30.136 -> 172.31.36.109 TCP 17442 [TCP segment of a reassembled PDU]
264   0.191566 54.192.30.136 -> 172.31.36.109 TCP 8754 [TCP segment of a reassembled PDU]
265   0.193030 172.31.36.109 -> 54.192.30.136 TCP 66 56346 > http [ACK] Seq=98 Ack=1194967 Win=1077248 Len=0 TSval=23231212 TSecr=723048878
266   0.194210 54.192.30.136 -> 172.31.36.109 TCP 4410 [TCP segment of a reassembled PDU]
267   0.194219 172.31.36.109 -> 54.192.30.136 TCP 66 56346 > http [ACK] Seq=98 Ack=1199311 Win=1191168 Len=0 TSval=23231212 TSecr=723048878
268   0.194368 54.192.30.136 -> 172.31.36.109 TCP 24682 [TCP segment of a reassembled PDU]
269   0.194390 172.31.36.109 -> 54.192.30.136 TCP 66 56346 > http [ACK] Seq=98 Ack=1223927 Win=1166592 Len=0 TSval=23231212 TSecr=723048878
270   0.194461 54.192.30.136 -> 172.31.36.109 TCP 13098 [TCP segment of a reassembled PDU]
271   0.194470 172.31.36.109 -> 54.192.30.136 TCP 66 56346 > http [ACK] Seq=98 Ack=1236959 Win=1176960 Len=0 TSval=23231212 TSecr=723048878
272   0.194582 54.192.30.136 -> 172.31.36.109 TCP 20338 [TCP segment of a reassembled PDU]
273   0.194611 172.31.36.109 -> 54.192.30.136 TCP 66 56346 > http [ACK] Seq=98 Ack=1257231 Win=1165056 Len=0 TSval=23231212 TSecr=723048878
274   0.194960 54.192.30.136 -> 172.31.36.109 TCP 29026 [TCP segment of a reassembled PDU]
275   0.194983 172.31.36.109 -> 54.192.30.136 TCP 66 56346 > http [ACK] Seq=98 Ack=1286191 Win=1150720 Len=0 TSval=23231212 TSecr=723048878
276   0.194997 54.192.30.136 -> 172.31.36.109 TCP 7306 [TCP segment of a reassembled PDU]
277   0.195013 172.31.36.109 -> 54.192.30.136 TCP 66 56346 > http [ACK] Seq=98 Ack=1293431 Win=1186432 Len=0 TSval=23231212 TSecr=723048878
278   0.195026 54.192.30.136 -> 172.31.36.109 TCP 4410 [TCP segment of a reassembled PDU]
279   0.195037 172.31.36.109 -> 54.192.30.136 TCP 66 56346 > http [ACK] Seq=98 Ack=1297775 Win=1193344 Len=0 TSval=23231212 TSecr=723048878
280   0.195142 54.192.30.136 -> 172.31.36.109 TCP 12779 [TCP segment of a reassembled PDU]
281   0.195159 54.192.30.136 -> 172.31.36.109 TCP 11650 [TCP segment of a reassembled PDU]
282   0.195257 54.192.30.136 -> 172.31.36.109 TCP 2962 [TCP segment of a reassembled PDU]
283   0.195392 54.192.30.136 -> 172.31.36.109 TCP 8754 [TCP segment of a reassembled PDU]
284   0.195406 172.31.36.109 -> 54.192.30.136 TCP 66 56346 > http [ACK] Seq=98 Ack=1333656 Win=1160320 Len=0 TSval=23231212 TSecr=723048878
285   0.196045 54.192.30.136 -> 172.31.36.109 TCP 8754 [TCP segment of a reassembled PDU]
286   0.196053 172.31.36.109 -> 54.192.30.136 TCP 66 56346 > http [ACK] Seq=98 Ack=1342344 Win=1184128 Len=0 TSval=23231212 TSecr=723048879
287   0.196216 54.192.30.136 -> 172.31.36.109 TCP 26130 [TCP segment of a reassembled PDU]
288   0.196239 54.192.30.136 -> 172.31.36.109 TCP 1514 [TCP segment of a reassembled PDU]
289   0.196243 172.31.36.109 -> 54.192.30.136 TCP 66 56346 > http [ACK] Seq=98 Ack=1368408 Win=1158144 Len=0 TSval=23231212 TSecr=723048879
290   0.196407 54.192.30.136 -> 172.31.36.109 TCP 6234 [TCP segment of a reassembled PDU]
291   0.196414 172.31.36.109 -> 54.192.30.136 TCP 66 56346 > http [ACK] Seq=98 Ack=1376024 Win=1186432 Len=0 TSval=23231212 TSecr=723048879
292   0.196630 54.192.30.136 -> 172.31.36.109 TCP 1514 [TCP segment of a reassembled PDU]
293   0.196839 54.192.30.136 -> 172.31.36.109 TCP 13098 [TCP segment of a reassembled PDU]
294   0.196869 172.31.36.109 -> 54.192.30.136 TCP 66 56346 > http [ACK] Seq=98 Ack=1390504 Win=1193344 Len=0 TSval=23231212 TSecr=723048879
295   0.196941 54.192.30.136 -> 172.31.36.109 TCP 18890 [TCP segment of a reassembled PDU]
296   0.196957 54.192.30.136 -> 172.31.36.109 TCP 7306 [TCP segment of a reassembled PDU]
297   0.196972 172.31.36.109 -> 54.192.30.136 TCP 66 56346 > http [ACK] Seq=98 Ack=1416568 Win=1167360 Len=0 TSval=23231212 TSecr=723048879
298   0.197141 54.192.30.136 -> 172.31.36.109 TCP 15994 [TCP segment of a reassembled PDU]
299   0.197151 172.31.36.109 -> 54.192.30.136 TCP 66 56346 > http [ACK] Seq=98 Ack=1432496 Win=1172096 Len=0 TSval=23231213 TSecr=723048879
300   0.197306 54.192.30.136 -> 172.31.36.109 TCP 2962 [TCP segment of a reassembled PDU]
301   0.197312 172.31.36.109 -> 54.192.30.136 TCP 66 56346 > http [ACK] Seq=98 Ack=1435392 Win=1193344 Len=0 TSval=23231213 TSecr=723048879
302   0.197405 54.192.30.136 -> 172.31.36.109 TCP 1514 [TCP segment of a reassembled PDU]
303   0.197560 54.192.30.136 -> 172.31.36.109 TCP 4786 [TCP segment of a reassembled PDU]
304   0.197743 172.31.36.109 -> 54.192.30.136 TCP 66 56346 > http [ACK] Seq=98 Ack=1441560 Win=1193344 Len=0 TSval=23231213 TSecr=723048879
305   0.220425 54.192.30.136 -> 172.31.36.109 TCP 1514 [TCP segment of a reassembled PDU]
306   0.220434 54.192.30.136 -> 172.31.36.109 TCP 1514 [TCP segment of a reassembled PDU]
307   0.220439 172.31.36.109 -> 54.192.30.136 TCP 66 56346 > http [ACK] Seq=98 Ack=1444456 Win=1193344 Len=0 TSval=23231218 TSecr=723048881
308   0.220651 54.192.30.136 -> 172.31.36.109 TCP 10202 [TCP segment of a reassembled PDU]
309   0.220665 54.192.30.136 -> 172.31.36.109 TCP 5858 [TCP segment of a reassembled PDU]
310   0.220682 172.31.36.109 -> 54.192.30.136 TCP 66 56346 > http [ACK] Seq=98 Ack=1460384 Win=1193344 Len=0 TSval=23231218 TSecr=723048881
311   0.220988 54.192.30.136 -> 172.31.36.109 TCP 18890 [TCP segment of a reassembled PDU]
312   0.221015 54.192.30.136 -> 172.31.36.109 TCP 17442 [TCP segment of a reassembled PDU]
313   0.221023 54.192.30.136 -> 172.31.36.109 TCP 1514 [TCP segment of a reassembled PDU]
314   0.221039 172.31.36.109 -> 54.192.30.136 TCP 66 56346 > http [ACK] Seq=98 Ack=1498032 Win=1155712 Len=0 TSval=23231219 TSecr=723048881
315   0.221167 54.192.30.136 -> 172.31.36.109 TCP 2962 [TCP segment of a reassembled PDU]
316   0.221172 172.31.36.109 -> 54.192.30.136 TCP 66 56346 > http [ACK] Seq=98 Ack=1500928 Win=1193344 Len=0 TSval=23231219 TSecr=723048881
317   0.221187 54.192.30.136 -> 172.31.36.109 TCP 17442 [TCP segment of a reassembled PDU]
318   0.221207 172.31.36.109 -> 54.192.30.136 TCP 66 56346 > http [ACK] Seq=98 Ack=1518304 Win=1176064 Len=0 TSval=23231219 TSecr=723048881
319   0.221223 54.192.30.136 -> 172.31.36.109 TCP 4410 [TCP segment of a reassembled PDU]
320   0.221227 172.31.36.109 -> 54.192.30.136 TCP 66 56346 > http [ACK] Seq=98 Ack=1522648 Win=1191168 Len=0 TSval=23231219 TSecr=723048881
321   0.221529 54.192.30.136 -> 172.31.36.109 TCP 3338 [TCP segment of a reassembled PDU]
322   0.221534 172.31.36.109 -> 54.192.30.136 TCP 66 56346 > http [ACK] Seq=98 Ack=1525920 Win=1191168 Len=0 TSval=23231219 TSecr=723048881
323   0.221548 54.192.30.136 -> 172.31.36.109 TCP 21930 [TCP segment of a reassembled PDU]
324   0.221579 172.31.36.109 -> 54.192.30.136 TCP 66 56346 > http [ACK] Seq=98 Ack=1547784 Win=1169408 Len=0 TSval=23231219 TSecr=723048881
325   0.221906 54.192.30.136 -> 172.31.36.109 TCP 2962 [TCP segment of a reassembled PDU]
326   0.221911 172.31.36.109 -> 54.192.30.136 TCP 66 56346 > http [ACK] Seq=98 Ack=1550680 Win=1193344 Len=0 TSval=23231219 TSecr=723048881
327   0.222045 54.192.30.136 -> 172.31.36.109 TCP 7306 [TCP segment of a reassembled PDU]
328   0.222067 172.31.36.109 -> 54.192.30.136 TCP 66 56346 > http [ACK] Seq=98 Ack=1557920 Win=1193344 Len=0 TSval=23231219 TSecr=723048881
329   0.222244 54.192.30.136 -> 172.31.36.109 TCP 23234 [TCP segment of a reassembled PDU]
330   0.222334 54.192.30.136 -> 172.31.36.109 TCP 11882 [TCP segment of a reassembled PDU]
331   0.222460 172.31.36.109 -> 54.192.30.136 TCP 66 56346 > http [ACK] Seq=98 Ack=1592904 Win=1158400 Len=0 TSval=23231219 TSecr=723048881
332   0.222697 54.192.30.136 -> 172.31.36.109 TCP 5858 [TCP segment of a reassembled PDU]
333   0.222704 172.31.36.109 -> 54.192.30.136 TCP 66 56346 > http [ACK] Seq=98 Ack=1598696 Win=1188864 Len=0 TSval=23231219 TSecr=723048881
334   0.222795 54.192.30.136 -> 172.31.36.109 TCP 8754 [TCP segment of a reassembled PDU]
335   0.222812 172.31.36.109 -> 54.192.30.136 TCP 66 56346 > http [ACK] Seq=98 Ack=1607384 Win=1193344 Len=0 TSval=23231219 TSecr=723048881
336   0.222915 54.192.30.136 -> 172.31.36.109 TCP 11650 [TCP segment of a reassembled PDU]
337   0.222933 172.31.36.109 -> 54.192.30.136 TCP 66 56346 > http [ACK] Seq=98 Ack=1618968 Win=1193344 Len=0 TSval=23231219 TSecr=723048881
338   0.223045 54.192.30.136 -> 172.31.36.109 TCP 17442 [TCP segment of a reassembled PDU]
339   0.223065 172.31.36.109 -> 54.192.30.136 TCP 66 56346 > http [ACK] Seq=98 Ack=1636344 Win=1176064 Len=0 TSval=23231219 TSecr=723048881
340   0.223154 54.192.30.136 -> 172.31.36.109 TCP 1890 [TCP segment of a reassembled PDU]
341   0.223165 172.31.36.109 -> 54.192.30.136 TCP 66 56346 > http [ACK] Seq=98 Ack=1638168 Win=1193344 Len=0 TSval=23231219 TSecr=723048881
342   0.225011 54.192.30.136 -> 172.31.36.109 TCP 1514 [TCP segment of a reassembled PDU]
343   0.225051 54.192.30.136 -> 172.31.36.109 TCP 14546 [TCP segment of a reassembled PDU]
344   0.225073 172.31.36.109 -> 54.192.30.136 TCP 66 56346 > http [ACK] Seq=98 Ack=1654096 Win=1193344 Len=0 TSval=23231220 TSecr=723048882
345   0.225344 54.192.30.136 -> 172.31.36.109 TCP 11650 [TCP segment of a reassembled PDU]
346   0.225391 172.31.36.109 -> 54.192.30.136 TCP 66 56346 > http [ACK] Seq=98 Ack=1665680 Win=1193344 Len=0 TSval=23231220 TSecr=723048882
347   0.225519 54.192.30.136 -> 172.31.36.109 TCP 11650 [TCP segment of a reassembled PDU]
348   0.225553 172.31.36.109 -> 54.192.30.136 TCP 66 56346 > http [ACK] Seq=98 Ack=1677264 Win=1193344 Len=0 TSval=23231220 TSecr=723048882
349   0.225583 54.192.30.136 -> 172.31.36.109 TCP 4410 [TCP segment of a reassembled PDU]
350   0.225596 54.192.30.136 -> 172.31.36.109 TCP 11650 [TCP segment of a reassembled PDU]
351   0.225798 54.192.30.136 -> 172.31.36.109 TCP 8754 [TCP segment of a reassembled PDU]
352   0.225805 54.192.30.136 -> 172.31.36.109 TCP 1890 [TCP segment of a reassembled PDU]
353   0.225826 172.31.36.109 -> 54.192.30.136 TCP 66 56346 > http [ACK] Seq=98 Ack=1703704 Win=1179392 Len=0 TSval=23231220 TSecr=723048882
354   0.256971 54.192.30.136 -> 172.31.36.109 TCP 1514 [TCP segment of a reassembled PDU]
