[Measurement for 10mb at 13:35:23 20.35.2014] 
Tshark:

  1   0.000000 172.31.36.109 -> 172.31.0.2   DNS 89 Standard query 0x5f08  A d2pcb72msibvx3.cloudfront.net
  2   0.000028 172.31.36.109 -> 172.31.0.2   DNS 89 Standard query 0xbde2  AAAA d2pcb72msibvx3.cloudfront.net
  3   0.000653   172.31.0.2 -> 172.31.36.109 DNS 169 Standard query response 0xbde2 
  4   0.000663   172.31.0.2 -> 172.31.36.109 DNS 217 Standard query response 0x5f08  A 54.192.30.229 A 54.230.29.254 A 54.230.30.17 A 54.230.30.202 A 54.230.30.213 A 54.230.30.221 A 54.230.31.9 A 54.192.30.189
  5   0.003871 172.31.36.109 -> 54.192.30.229 TCP 74 44983 > http [SYN] Seq=0 Win=26883 Len=0 MSS=8961 SACK_PERM=1 TSval=38552526 TSecr=0 WS=128
  6   0.005010 54.192.30.229 -> 172.31.36.109 TCP 74 http > 44983 [SYN, ACK] Seq=0 Ack=1 Win=14480 Len=0 MSS=1460 SACK_PERM=1 TSval=731036995 TSecr=38552526 WS=128
  7   0.005024 172.31.36.109 -> 54.192.30.229 TCP 66 44983 > http [ACK] Seq=1 Ack=1 Win=27008 Len=0 TSval=38552526 TSecr=731036995
  8   0.005078 172.31.36.109 -> 54.192.30.229 HTTP 163 GET /10mb HTTP/1.1 
  9   0.006278 54.192.30.229 -> 172.31.36.109 TCP 66 http > 44983 [ACK] Seq=1 Ack=98 Win=14592 Len=0 TSval=731036996 TSecr=38552526
 10   0.031164 54.192.30.229 -> 172.31.36.109 TCP 1144 [TCP segment of a reassembled PDU]
 11   0.031185 172.31.36.109 -> 54.192.30.229 TCP 66 44983 > http [ACK] Seq=98 Ack=1079 Win=29056 Len=0 TSval=38552533 TSecr=731036998
 12   0.031250 54.192.30.229 -> 172.31.36.109 TCP 8754 [TCP segment of a reassembled PDU]
 13   0.031271 172.31.36.109 -> 54.192.30.229 TCP 66 44983 > http [ACK] Seq=98 Ack=9767 Win=46464 Len=0 TSval=38552533 TSecr=731036998
 14   0.031301 54.192.30.229 -> 172.31.36.109 TCP 4410 [TCP segment of a reassembled PDU]
 15   0.031306 172.31.36.109 -> 54.192.30.229 TCP 66 44983 > http [ACK] Seq=98 Ack=14111 Win=55168 Len=0 TSval=38552533 TSecr=731036998
 16   0.032608 54.192.30.229 -> 172.31.36.109 TCP 4410 [TCP segment of a reassembled PDU]
 17   0.032615 172.31.36.109 -> 54.192.30.229 TCP 66 44983 > http [ACK] Seq=98 Ack=18455 Win=63872 Len=0 TSval=38552533 TSecr=731036998
 18   0.032650 54.192.30.229 -> 172.31.36.109 TCP 8754 [TCP segment of a reassembled PDU]
 19   0.032657 172.31.36.109 -> 54.192.30.229 TCP 66 44983 > http [ACK] Seq=98 Ack=27143 Win=81280 Len=0 TSval=38552533 TSecr=731036998
 20   0.034025 54.192.30.229 -> 172.31.36.109 TCP 2962 [TCP segment of a reassembled PDU]
 21   0.034031 172.31.36.109 -> 54.192.30.229 TCP 66 44983 > http [ACK] Seq=98 Ack=30039 Win=87040 Len=0 TSval=38552534 TSecr=731036998
 22   0.034147 54.192.30.229 -> 172.31.36.109 TCP 15994 [TCP segment of a reassembled PDU]
 23   0.034158 172.31.36.109 -> 54.192.30.229 TCP 66 44983 > http [ACK] Seq=98 Ack=45967 Win=91648 Len=0 TSval=38552534 TSecr=731036998
 24   0.034167 54.192.30.229 -> 172.31.36.109 TCP 2962 [TCP segment of a reassembled PDU]
 25   0.034171 172.31.36.109 -> 54.192.30.229 TCP 66 44983 > http [ACK] Seq=98 Ack=48863 Win=88832 Len=0 TSval=38552534 TSecr=731036998
 26   0.035572 54.192.30.229 -> 172.31.36.109 TCP 1514 [TCP segment of a reassembled PDU]
 27   0.035577 172.31.36.109 -> 54.192.30.229 TCP 66 44983 > http [ACK] Seq=98 Ack=50311 Win=109056 Len=0 TSval=38552534 TSecr=731036998
 28   0.035678 54.192.30.229 -> 172.31.36.109 TCP 8754 [TCP segment of a reassembled PDU]
 29   0.035686 172.31.36.109 -> 54.192.30.229 TCP 66 44983 > http [ACK] Seq=98 Ack=58999 Win=103680 Len=0 TSval=38552534 TSecr=731036998
 30   0.035732 54.192.30.229 -> 172.31.36.109 TCP 15994 [TCP segment of a reassembled PDU]
 31   0.035742 172.31.36.109 -> 54.192.30.229 TCP 66 44983 > http [ACK] Seq=98 Ack=74927 Win=91648 Len=0 TSval=38552534 TSecr=731036998
 32   0.037092 54.192.30.229 -> 172.31.36.109 TCP 1514 [TCP segment of a reassembled PDU]
 33   0.037097 172.31.36.109 -> 54.192.30.229 TCP 66 44983 > http [ACK] Seq=98 Ack=76375 Win=109056 Len=0 TSval=38552534 TSecr=731036999
 34   0.037235 54.192.30.229 -> 172.31.36.109 TCP 26130 [TCP segment of a reassembled PDU]
 35   0.037249 172.31.36.109 -> 54.192.30.229 TCP 66 44983 > http [ACK] Seq=98 Ack=102439 Win=83072 Len=0 TSval=38552534 TSecr=731036999
 36   0.038402 54.192.30.229 -> 172.31.36.109 TCP 2962 [TCP segment of a reassembled PDU]
 37   0.038407 172.31.36.109 -> 54.192.30.229 TCP 66 44983 > http [ACK] Seq=98 Ack=105335 Win=109056 Len=0 TSval=38552535 TSecr=731036999
 38   0.038539 54.192.30.229 -> 172.31.36.109 TCP 18890 [TCP segment of a reassembled PDU]
 39   0.038550 172.31.36.109 -> 54.192.30.229 TCP 66 44983 > http [ACK] Seq=98 Ack=124159 Win=146688 Len=0 TSval=38552535 TSecr=731036999
 40   0.038564 54.192.30.229 -> 172.31.36.109 TCP 1514 [TCP segment of a reassembled PDU]
 41   0.038568 172.31.36.109 -> 54.192.30.229 TCP 66 44983 > http [ACK] Seq=98 Ack=125607 Win=149632 Len=0 TSval=38552535 TSecr=731036999
 42   0.039676 54.192.30.229 -> 172.31.36.109 TCP 4410 [TCP segment of a reassembled PDU]
 43   0.039683 172.31.36.109 -> 54.192.30.229 TCP 66 44983 > http [ACK] Seq=98 Ack=129951 Win=158336 Len=0 TSval=38552535 TSecr=731036999
 44   0.039768 54.192.30.229 -> 172.31.36.109 TCP 8754 [TCP segment of a reassembled PDU]
 45   0.039776 172.31.36.109 -> 54.192.30.229 TCP 66 44983 > http [ACK] Seq=98 Ack=138639 Win=175616 Len=0 TSval=38552535 TSecr=731036999
 46   0.039913 54.192.30.229 -> 172.31.36.109 TCP 2962 [TCP segment of a reassembled PDU]
 47   0.039918 172.31.36.109 -> 54.192.30.229 TCP 66 44983 > http [ACK] Seq=98 Ack=141535 Win=181504 Len=0 TSval=38552535 TSecr=731036999
 48   0.040007 54.192.30.229 -> 172.31.36.109 TCP 11650 [TCP segment of a reassembled PDU]
 49   0.040015 172.31.36.109 -> 54.192.30.229 TCP 66 44983 > http [ACK] Seq=98 Ack=153119 Win=204672 Len=0 TSval=38552535 TSecr=731036999
 50   0.040949 54.192.30.229 -> 172.31.36.109 TCP 4410 [TCP segment of a reassembled PDU]
 51   0.040955 172.31.36.109 -> 54.192.30.229 TCP 66 44983 > http [ACK] Seq=98 Ack=157463 Win=213376 Len=0 TSval=38552535 TSecr=731036999
 52   0.041238 54.192.30.229 -> 172.31.36.109 TCP 8754 [TCP segment of a reassembled PDU]
 53   0.041245 172.31.36.109 -> 54.192.30.229 TCP 66 44983 > http [ACK] Seq=98 Ack=166151 Win=230656 Len=0 TSval=38552535 TSecr=731036999
 54   0.041386 54.192.30.229 -> 172.31.36.109 TCP 24682 [TCP segment of a reassembled PDU]
 55   0.041399 172.31.36.109 -> 54.192.30.229 TCP 66 44983 > http [ACK] Seq=98 Ack=190767 Win=279936 Len=0 TSval=38552535 TSecr=731036999
 56   0.041546 54.192.30.229 -> 172.31.36.109 TCP 5858 [TCP segment of a reassembled PDU]
 57   0.041552 172.31.36.109 -> 54.192.30.229 TCP 66 44983 > http [ACK] Seq=98 Ack=196559 Win=291456 Len=0 TSval=38552536 TSecr=731036999
 58   0.042501 54.192.30.229 -> 172.31.36.109 TCP 4410 [TCP segment of a reassembled PDU]
 59   0.042507 172.31.36.109 -> 54.192.30.229 TCP 66 44983 > http [ACK] Seq=98 Ack=200903 Win=300160 Len=0 TSval=38552536 TSecr=731036999
 60   0.042705 54.192.30.229 -> 172.31.36.109 TCP 1514 [TCP segment of a reassembled PDU]
 61   0.042710 172.31.36.109 -> 54.192.30.229 TCP 66 44983 > http [ACK] Seq=98 Ack=202351 Win=303104 Len=0 TSval=38552536 TSecr=731036999
 62   0.042881 54.192.30.229 -> 172.31.36.109 TCP 26130 [TCP segment of a reassembled PDU]
 63   0.042895 172.31.36.109 -> 54.192.30.229 TCP 66 44983 > http [ACK] Seq=98 Ack=228415 Win=355200 Len=0 TSval=38552536 TSecr=731036999
 64   0.042909 54.192.30.229 -> 172.31.36.109 TCP 8754 [TCP segment of a reassembled PDU]
 65   0.042914 172.31.36.109 -> 54.192.30.229 TCP 66 44983 > http [ACK] Seq=98 Ack=237103 Win=372608 Len=0 TSval=38552536 TSecr=731036999
 66   0.043031 54.192.30.229 -> 172.31.36.109 TCP 1514 [TCP segment of a reassembled PDU]
 67   0.043036 172.31.36.109 -> 54.192.30.229 TCP 66 44983 > http [ACK] Seq=98 Ack=238551 Win=375552 Len=0 TSval=38552536 TSecr=731036999
 68   0.044036 54.192.30.229 -> 172.31.36.109 TCP 5858 [TCP segment of a reassembled PDU]
 69   0.044042 172.31.36.109 -> 54.192.30.229 TCP 66 44983 > http [ACK] Seq=98 Ack=244343 Win=387072 Len=0 TSval=38552536 TSecr=731036999
 70   0.044146 54.192.30.229 -> 172.31.36.109 TCP 14546 [TCP segment of a reassembled PDU]
 71   0.044169 172.31.36.109 -> 54.192.30.229 TCP 66 44983 > http [ACK] Seq=98 Ack=258823 Win=416000 Len=0 TSval=38552536 TSecr=731036999
 72   0.044323 54.192.30.229 -> 172.31.36.109 TCP 17442 [TCP segment of a reassembled PDU]
 73   0.044333 172.31.36.109 -> 54.192.30.229 TCP 66 44983 > http [ACK] Seq=98 Ack=276199 Win=450816 Len=0 TSval=38552536 TSecr=731036999
 74   0.044374 54.192.30.229 -> 172.31.36.109 TCP 5858 [TCP segment of a reassembled PDU]
 75   0.044379 172.31.36.109 -> 54.192.30.229 TCP 66 44983 > http [ACK] Seq=98 Ack=281991 Win=462336 Len=0 TSval=38552536 TSecr=731036999
 76   0.045126 54.192.30.229 -> 172.31.36.109 TCP 2962 [TCP segment of a reassembled PDU]
 77   0.045132 172.31.36.109 -> 54.192.30.229 TCP 66 44983 > http [ACK] Seq=98 Ack=284887 Win=468224 Len=0 TSval=38552536 TSecr=731036999
 78   0.045310 54.192.30.229 -> 172.31.36.109 TCP 1514 [TCP segment of a reassembled PDU]
 79   0.045314 172.31.36.109 -> 54.192.30.229 TCP 66 44983 > http [ACK] Seq=98 Ack=286335 Win=471040 Len=0 TSval=38552536 TSecr=731036999
 80   0.045430 54.192.30.229 -> 172.31.36.109 TCP 11650 [TCP segment of a reassembled PDU]
 81   0.045439 172.31.36.109 -> 54.192.30.229 TCP 66 44983 > http [ACK] Seq=98 Ack=297919 Win=494208 Len=0 TSval=38552536 TSecr=731036999
 82   0.045614 54.192.30.229 -> 172.31.36.109 TCP 8754 [TCP segment of a reassembled PDU]
 83   0.045622 172.31.36.109 -> 54.192.30.229 TCP 66 44983 > http [ACK] Seq=98 Ack=306607 Win=511616 Len=0 TSval=38552537 TSecr=731036999
 84   0.045883 54.192.30.229 -> 172.31.36.109 TCP 11650 [TCP segment of a reassembled PDU]
 85   0.045891 172.31.36.109 -> 54.192.30.229 TCP 66 44983 > http [ACK] Seq=98 Ack=318191 Win=534784 Len=0 TSval=38552537 TSecr=731036999
 86   0.045929 54.192.30.229 -> 172.31.36.109 TCP 8754 [TCP segment of a reassembled PDU]
 87   0.045936 172.31.36.109 -> 54.192.30.229 TCP 66 44983 > http [ACK] Seq=98 Ack=326879 Win=552192 Len=0 TSval=38552537 TSecr=731037000
 88   0.046072 54.192.30.229 -> 172.31.36.109 TCP 2962 [TCP segment of a reassembled PDU]
 89   0.046078 172.31.36.109 -> 54.192.30.229 TCP 66 44983 > http [ACK] Seq=98 Ack=329775 Win=557952 Len=0 TSval=38552537 TSecr=731037000
 90   0.046241 54.192.30.229 -> 172.31.36.109 TCP 13098 [TCP segment of a reassembled PDU]
 91   0.046250 172.31.36.109 -> 54.192.30.229 TCP 66 44983 > http [ACK] Seq=98 Ack=342807 Win=564352 Len=0 TSval=38552537 TSecr=731037000
 92   0.047083 54.192.30.229 -> 172.31.36.109 TCP 2962 [TCP segment of a reassembled PDU]
 93   0.047088 172.31.36.109 -> 54.192.30.229 TCP 66 44983 > http [ACK] Seq=98 Ack=345703 Win=580864 Len=0 TSval=38552537 TSecr=731037000
 94   0.047258 54.192.30.229 -> 172.31.36.109 TCP 23234 [TCP segment of a reassembled PDU]
 95   0.047271 172.31.36.109 -> 54.192.30.229 TCP 66 44983 > http [ACK] Seq=98 Ack=368871 Win=557696 Len=0 TSval=38552537 TSecr=731037000
 96   0.047288 54.192.30.229 -> 172.31.36.109 TCP 2962 [TCP segment of a reassembled PDU]
 97   0.047294 172.31.36.109 -> 54.192.30.229 TCP 66 44983 > http [ACK] Seq=98 Ack=371767 Win=554880 Len=0 TSval=38552537 TSecr=731037000
 98   0.047363 54.192.30.229 -> 172.31.36.109 TCP 11650 [TCP segment of a reassembled PDU]
 99   0.047372 172.31.36.109 -> 54.192.30.229 TCP 66 44983 > http [ACK] Seq=98 Ack=383351 Win=566656 Len=0 TSval=38552537 TSecr=731037000
100   0.047426 54.192.30.229 -> 172.31.36.109 TCP 13098 [TCP segment of a reassembled PDU]
101   0.047559 172.31.36.109 -> 54.192.30.229 TCP 66 44983 > http [ACK] Seq=98 Ack=396383 Win=564352 Len=0 TSval=38552537 TSecr=731037000
102   0.048729 54.192.30.229 -> 172.31.36.109 TCP 2962 [TCP segment of a reassembled PDU]
103   0.048735 172.31.36.109 -> 54.192.30.229 TCP 66 44983 > http [ACK] Seq=98 Ack=399279 Win=580864 Len=0 TSval=38552537 TSecr=731037000
104   0.048870 54.192.30.229 -> 172.31.36.109 TCP 11650 [TCP segment of a reassembled PDU]
105   0.048890 172.31.36.109 -> 54.192.30.229 TCP 66 44983 > http [ACK] Seq=98 Ack=410863 Win=584064 Len=0 TSval=38552537 TSecr=731037000
106   0.049030 54.192.30.229 -> 172.31.36.109 TCP 20338 [TCP segment of a reassembled PDU]
107   0.049058 54.192.30.229 -> 172.31.36.109 TCP 5858 [TCP segment of a reassembled PDU]
108   0.049062 54.192.30.229 -> 172.31.36.109 TCP 1514 [TCP segment of a reassembled PDU]
109   0.049080 172.31.36.109 -> 54.192.30.229 TCP 66 44983 > http [ACK] Seq=98 Ack=431135 Win=563840 Len=0 TSval=38552537 TSecr=731037000
110   0.049096 172.31.36.109 -> 54.192.30.229 TCP 66 44983 > http [ACK] Seq=98 Ack=438375 Win=584064 Len=0 TSval=38552537 TSecr=731037000
111   0.049272 54.192.30.229 -> 172.31.36.109 TCP 26130 [TCP segment of a reassembled PDU]
112   0.049288 54.192.30.229 -> 172.31.36.109 TCP 4410 [TCP segment of a reassembled PDU]
113   0.049304 172.31.36.109 -> 54.192.30.229 TCP 66 44983 > http [ACK] Seq=98 Ack=468783 Win=553728 Len=0 TSval=38552537 TSecr=731037000
114   0.049469 54.192.30.229 -> 172.31.36.109 TCP 8754 [TCP segment of a reassembled PDU]
115   0.049476 172.31.36.109 -> 54.192.30.229 TCP 66 44983 > http [ACK] Seq=98 Ack=477471 Win=571392 Len=0 TSval=38552537 TSecr=731037000
116   0.050669 54.192.30.229 -> 172.31.36.109 TCP 5858 [TCP segment of a reassembled PDU]
117   0.050676 172.31.36.109 -> 54.192.30.229 TCP 66 44983 > http [ACK] Seq=98 Ack=483263 Win=576128 Len=0 TSval=38552538 TSecr=731037000
118   0.050836 54.192.30.229 -> 172.31.36.109 TCP 20338 [TCP segment of a reassembled PDU]
119   0.050847 172.31.36.109 -> 54.192.30.229 TCP 66 44983 > http [ACK] Seq=98 Ack=503535 Win=624512 Len=0 TSval=38552538 TSecr=731037000
120   0.050897 54.192.30.229 -> 172.31.36.109 TCP 15994 [TCP segment of a reassembled PDU]
121   0.050906 172.31.36.109 -> 54.192.30.229 TCP 66 44983 > http [ACK] Seq=98 Ack=519463 Win=656384 Len=0 TSval=38552538 TSecr=731037000
122   0.051099 54.192.30.229 -> 172.31.36.109 TCP 20338 [TCP segment of a reassembled PDU]
123   0.051111 172.31.36.109 -> 54.192.30.229 TCP 66 44983 > http [ACK] Seq=98 Ack=539735 Win=696960 Len=0 TSval=38552538 TSecr=731037000
124   0.051137 54.192.30.229 -> 172.31.36.109 TCP 4410 [TCP segment of a reassembled PDU]
125   0.051141 172.31.36.109 -> 54.192.30.229 TCP 66 44983 > http [ACK] Seq=98 Ack=544079 Win=705664 Len=0 TSval=38552538 TSecr=731037000
126   0.051322 54.192.30.229 -> 172.31.36.109 TCP 13098 [TCP segment of a reassembled PDU]
127   0.051331 172.31.36.109 -> 54.192.30.229 TCP 66 44983 > http [ACK] Seq=98 Ack=557111 Win=731648 Len=0 TSval=38552538 TSecr=731037000
128   0.052021 54.192.30.229 -> 172.31.36.109 TCP 5858 [TCP segment of a reassembled PDU]
129   0.052028 172.31.36.109 -> 54.192.30.229 TCP 66 44983 > http [ACK] Seq=98 Ack=562903 Win=743296 Len=0 TSval=38552538 TSecr=731037000
130   0.052151 54.192.30.229 -> 172.31.36.109 TCP 5858 [TCP segment of a reassembled PDU]
131   0.052157 172.31.36.109 -> 54.192.30.229 TCP 66 44983 > http [ACK] Seq=98 Ack=568695 Win=754816 Len=0 TSval=38552538 TSecr=731037000
132   0.052564 54.192.30.229 -> 172.31.36.109 TCP 23234 [TCP segment of a reassembled PDU]
133   0.052577 172.31.36.109 -> 54.192.30.229 TCP 66 44983 > http [ACK] Seq=98 Ack=591863 Win=801152 Len=0 TSval=38552538 TSecr=731037000
134   0.052669 54.192.30.229 -> 172.31.36.109 TCP 14546 [TCP segment of a reassembled PDU]
135   0.052679 172.31.36.109 -> 54.192.30.229 TCP 66 44983 > http [ACK] Seq=98 Ack=606343 Win=830208 Len=0 TSval=38552538 TSecr=731037000
136   0.052802 54.192.30.229 -> 172.31.36.109 TCP 20338 [TCP segment of a reassembled PDU]
137   0.052814 172.31.36.109 -> 54.192.30.229 TCP 66 44983 > http [ACK] Seq=98 Ack=626615 Win=870656 Len=0 TSval=38552538 TSecr=731037000
138   0.052899 54.192.30.229 -> 172.31.36.109 TCP 7306 [TCP segment of a reassembled PDU]
139   0.052906 172.31.36.109 -> 54.192.30.229 TCP 66 44983 > http [ACK] Seq=98 Ack=633855 Win=885248 Len=0 TSval=38552538 TSecr=731037000
140   0.053485 54.192.30.229 -> 172.31.36.109 TCP 4410 [TCP segment of a reassembled PDU]
141   0.053491 172.31.36.109 -> 54.192.30.229 TCP 66 44983 > http [ACK] Seq=98 Ack=638199 Win=893824 Len=0 TSval=38552538 TSecr=731037000
142   0.053637 54.192.30.229 -> 172.31.36.109 TCP 17442 [TCP segment of a reassembled PDU]
143   0.053647 172.31.36.109 -> 54.192.30.229 TCP 66 44983 > http [ACK] Seq=98 Ack=655575 Win=928640 Len=0 TSval=38552539 TSecr=731037000
144   0.053739 54.192.30.229 -> 172.31.36.109 TCP 2962 [TCP segment of a reassembled PDU]
145   0.053745 172.31.36.109 -> 54.192.30.229 TCP 66 44983 > http [ACK] Seq=98 Ack=658471 Win=934400 Len=0 TSval=38552539 TSecr=731037000
146   0.053873 54.192.30.229 -> 172.31.36.109 TCP 11650 [TCP segment of a reassembled PDU]
147   0.053881 172.31.36.109 -> 54.192.30.229 TCP 66 44983 > http [ACK] Seq=98 Ack=670055 Win=957568 Len=0 TSval=38552539 TSecr=731037000
148   0.054166 54.192.30.229 -> 172.31.36.109 TCP 27578 [TCP segment of a reassembled PDU]
149   0.054192 172.31.36.109 -> 54.192.30.229 TCP 66 44983 > http [ACK] Seq=98 Ack=697567 Win=945792 Len=0 TSval=38552539 TSecr=731037000
150   0.054262 54.192.30.229 -> 172.31.36.109 TCP 2962 [TCP segment of a reassembled PDU]
151   0.054268 172.31.36.109 -> 54.192.30.229 TCP 66 44983 > http [ACK] Seq=98 Ack=700463 Win=963328 Len=0 TSval=38552539 TSecr=731037000
152   0.054417 54.192.30.229 -> 172.31.36.109 TCP 23234 [TCP segment of a reassembled PDU]
153   0.054440 172.31.36.109 -> 54.192.30.229 TCP 66 44983 > http [ACK] Seq=98 Ack=723631 Win=953088 Len=0 TSval=38552539 TSecr=731037000
154   0.054506 54.192.30.229 -> 172.31.36.109 TCP 1514 [TCP segment of a reassembled PDU]
155   0.054511 172.31.36.109 -> 54.192.30.229 TCP 66 44983 > http [ACK] Seq=98 Ack=725079 Win=966272 Len=0 TSval=38552539 TSecr=731037000
156   0.054650 54.192.30.229 -> 172.31.36.109 TCP 15994 [TCP segment of a reassembled PDU]
157   0.054672 172.31.36.109 -> 54.192.30.229 TCP 66 44983 > http [ACK] Seq=98 Ack=741007 Win=966272 Len=0 TSval=38552539 TSecr=731037000
158   0.055070 54.192.30.229 -> 172.31.36.109 TCP 4410 [TCP segment of a reassembled PDU]
159   0.055077 172.31.36.109 -> 54.192.30.229 TCP 66 44983 > http [ACK] Seq=98 Ack=745351 Win=974976 Len=0 TSval=38552539 TSecr=731037000
160   0.055206 54.192.30.229 -> 172.31.36.109 TCP 13098 [TCP segment of a reassembled PDU]
161   0.055227 172.31.36.109 -> 54.192.30.229 TCP 66 44983 > http [ACK] Seq=98 Ack=758383 Win=974976 Len=0 TSval=38552539 TSecr=731037000
162   0.055315 54.192.30.229 -> 172.31.36.109 TCP 5858 [TCP segment of a reassembled PDU]
163   0.055321 172.31.36.109 -> 54.192.30.229 TCP 66 44983 > http [ACK] Seq=98 Ack=764175 Win=981632 Len=0 TSval=38552539 TSecr=731037000
164   0.055662 54.192.30.229 -> 172.31.36.109 TCP 15994 [TCP segment of a reassembled PDU]
165   0.055685 172.31.36.109 -> 54.192.30.229 TCP 66 44983 > http [ACK] Seq=98 Ack=780103 Win=986496 Len=0 TSval=38552539 TSecr=731037000
166   0.055793 54.192.30.229 -> 172.31.36.109 TCP 7306 [TCP segment of a reassembled PDU]
167   0.055811 172.31.36.109 -> 54.192.30.229 TCP 66 44983 > http [ACK] Seq=98 Ack=787343 Win=986496 Len=0 TSval=38552539 TSecr=731037000
168   0.055954 54.192.30.229 -> 172.31.36.109 TCP 20338 [TCP segment of a reassembled PDU]
169   0.055980 54.192.30.229 -> 172.31.36.109 TCP 4410 [TCP segment of a reassembled PDU]
170   0.055987 54.192.30.229 -> 172.31.36.109 TCP 5858 [TCP segment of a reassembled PDU]
171   0.055996 172.31.36.109 -> 54.192.30.229 TCP 66 44983 > http [ACK] Seq=98 Ack=817751 Win=956160 Len=0 TSval=38552539 TSecr=731037000
172   0.056152 54.192.30.229 -> 172.31.36.109 TCP 11650 [TCP segment of a reassembled PDU]
173   0.056161 172.31.36.109 -> 54.192.30.229 TCP 66 44983 > http [ACK] Seq=98 Ack=829335 Win=972160 Len=0 TSval=38552539 TSecr=731037001
174   0.056560 54.192.30.229 -> 172.31.36.109 TCP 2962 [TCP segment of a reassembled PDU]
175   0.056566 172.31.36.109 -> 54.192.30.229 TCP 66 44983 > http [ACK] Seq=98 Ack=832231 Win=986368 Len=0 TSval=38552539 TSecr=731037001
176   0.056717 54.192.30.229 -> 172.31.36.109 TCP 18890 [TCP segment of a reassembled PDU]
177   0.056741 172.31.36.109 -> 54.192.30.229 TCP 66 44983 > http [ACK] Seq=98 Ack=851055 Win=967552 Len=0 TSval=38552539 TSecr=731037001
178   0.056809 54.192.30.229 -> 172.31.36.109 TCP 1514 [TCP segment of a reassembled PDU]
179   0.056813 172.31.36.109 -> 54.192.30.229 TCP 66 44983 > http [ACK] Seq=98 Ack=852503 Win=988672 Len=0 TSval=38552539 TSecr=731037001
180   0.056969 54.192.30.229 -> 172.31.36.109 TCP 17442 [TCP segment of a reassembled PDU]
181   0.056990 54.192.30.229 -> 172.31.36.109 TCP 2962 [TCP segment of a reassembled PDU]
182   0.057081 172.31.36.109 -> 54.192.30.229 TCP 66 44983 > http [ACK] Seq=98 Ack=872775 Win=968448 Len=0 TSval=38552539 TSecr=731037001
183   0.057190 54.192.30.229 -> 172.31.36.109 TCP 21786 [TCP segment of a reassembled PDU]
184   0.057215 172.31.36.109 -> 54.192.30.229 TCP 66 44983 > http [ACK] Seq=98 Ack=894495 Win=955392 Len=0 TSval=38552539 TSecr=731037001
185   0.057392 54.192.30.229 -> 172.31.36.109 TCP 13098 [TCP segment of a reassembled PDU]
186   0.057401 172.31.36.109 -> 54.192.30.229 TCP 66 44983 > http [ACK] Seq=98 Ack=907527 Win=969728 Len=0 TSval=38552539 TSecr=731037001
187   0.057500 54.192.30.229 -> 172.31.36.109 TCP 13098 [TCP segment of a reassembled PDU]
188   0.057509 172.31.36.109 -> 54.192.30.229 TCP 66 44983 > http [ACK] Seq=98 Ack=920559 Win=969728 Len=0 TSval=38552539 TSecr=731037001
189   0.057578 54.192.30.229 -> 172.31.36.109 TCP 1514 [TCP segment of a reassembled PDU]
190   0.057739 54.192.30.229 -> 172.31.36.109 TCP 18890 [TCP segment of a reassembled PDU]
191   0.057750 172.31.36.109 -> 54.192.30.229 TCP 66 44983 > http [ACK] Seq=98 Ack=940831 Win=1027072 Len=0 TSval=38552540 TSecr=731037001
192   0.057822 54.192.30.229 -> 172.31.36.109 TCP 2962 [TCP segment of a reassembled PDU]
193   0.057827 172.31.36.109 -> 54.192.30.229 TCP 66 44983 > http [ACK] Seq=98 Ack=943727 Win=1032832 Len=0 TSval=38552540 TSecr=731037001
194   0.057965 54.192.30.229 -> 172.31.36.109 TCP 15994 [TCP segment of a reassembled PDU]
195   0.057976 172.31.36.109 -> 54.192.30.229 TCP 66 44983 > http [ACK] Seq=98 Ack=959655 Win=1064704 Len=0 TSval=38552540 TSecr=731037001
196   0.058343 54.192.30.229 -> 172.31.36.109 TCP 4410 [TCP segment of a reassembled PDU]
197   0.058349 172.31.36.109 -> 54.192.30.229 TCP 66 44983 > http [ACK] Seq=98 Ack=963999 Win=1073408 Len=0 TSval=38552540 TSecr=731037001
198   0.058454 54.192.30.229 -> 172.31.36.109 TCP 4410 [TCP segment of a reassembled PDU]
199   0.058460 172.31.36.109 -> 54.192.30.229 TCP 66 44983 > http [ACK] Seq=98 Ack=968343 Win=1082112 Len=0 TSval=38552540 TSecr=731037001
200   0.058731 54.192.30.229 -> 172.31.36.109 TCP 26130 [TCP segment of a reassembled PDU]
201   0.058745 172.31.36.109 -> 54.192.30.229 TCP 66 44983 > http [ACK] Seq=98 Ack=994407 Win=1134208 Len=0 TSval=38552540 TSecr=731037001
202   0.058760 54.192.30.229 -> 172.31.36.109 TCP 14546 [TCP segment of a reassembled PDU]
203   0.058771 172.31.36.109 -> 54.192.30.229 TCP 66 44983 > http [ACK] Seq=98 Ack=1008887 Win=1163264 Len=0 TSval=38552540 TSecr=731037001
204   0.058934 54.192.30.229 -> 172.31.36.109 TCP 15994 [TCP segment of a reassembled PDU]
205   0.058943 172.31.36.109 -> 54.192.30.229 TCP 66 44983 > http [ACK] Seq=98 Ack=1024815 Win=1195008 Len=0 TSval=38552540 TSecr=731037001
206   0.058950 54.192.30.229 -> 172.31.36.109 TCP 1514 [TCP segment of a reassembled PDU]
207   0.058953 172.31.36.109 -> 54.192.30.229 TCP 66 44983 > http [ACK] Seq=98 Ack=1026263 Win=1197952 Len=0 TSval=38552540 TSecr=731037001
208   0.059223 54.192.30.229 -> 172.31.36.109 TCP 22148 [TCP segment of a reassembled PDU]
209   0.059233 172.31.36.109 -> 54.192.30.229 TCP 66 44983 > http [ACK] Seq=98 Ack=1048345 Win=1242112 Len=0 TSval=38552540 TSecr=731037001
210   0.065015 54.192.30.229 -> 172.31.36.109 TCP 2962 [TCP segment of a reassembled PDU]
211   0.065026 172.31.36.109 -> 54.192.30.229 TCP 66 44983 > http [ACK] Seq=98 Ack=1051241 Win=1247872 Len=0 TSval=38552541 TSecr=731037001
212   0.065129 54.192.30.229 -> 172.31.36.109 TCP 1514 [TCP segment of a reassembled PDU]
213   0.065139 172.31.36.109 -> 54.192.30.229 TCP 66 44983 > http [ACK] Seq=98 Ack=1052689 Win=1250816 Len=0 TSval=38552541 TSecr=731037001
214   0.065237 54.192.30.229 -> 172.31.36.109 TCP 1514 [TCP segment of a reassembled PDU]
215   0.065243 172.31.36.109 -> 54.192.30.229 TCP 66 44983 > http [ACK] Seq=98 Ack=1054137 Win=1253760 Len=0 TSval=38552541 TSecr=731037001
216   0.065360 54.192.30.229 -> 172.31.36.109 TCP 8754 [TCP segment of a reassembled PDU]
217   0.065369 172.31.36.109 -> 54.192.30.229 TCP 66 44983 > http [ACK] Seq=98 Ack=1062825 Win=1271040 Len=0 TSval=38552541 TSecr=731037001
218   0.065411 54.192.30.229 -> 172.31.36.109 TCP 11650 [TCP segment of a reassembled PDU]
219   0.065419 172.31.36.109 -> 54.192.30.229 TCP 66 44983 > http [ACK] Seq=98 Ack=1074409 Win=1294208 Len=0 TSval=38552541 TSecr=731037001
220   0.065528 54.192.30.229 -> 172.31.36.109 TCP 1514 [TCP segment of a reassembled PDU]
221   0.065533 172.31.36.109 -> 54.192.30.229 TCP 66 44983 > http [ACK] Seq=98 Ack=1075857 Win=1297152 Len=0 TSval=38552541 TSecr=731037001
222   0.065659 54.192.30.229 -> 172.31.36.109 TCP 13098 [TCP segment of a reassembled PDU]
223   0.065669 172.31.36.109 -> 54.192.30.229 TCP 66 44983 > http [ACK] Seq=98 Ack=1088889 Win=1323264 Len=0 TSval=38552542 TSecr=731037001
224   0.065725 54.192.30.229 -> 172.31.36.109 TCP 15994 [TCP segment of a reassembled PDU]
225   0.065736 172.31.36.109 -> 54.192.30.229 TCP 66 44983 > http [ACK] Seq=98 Ack=1104817 Win=1334400 Len=0 TSval=38552542 TSecr=731037001
226   0.065840 54.192.30.229 -> 172.31.36.109 TCP 5858 [TCP segment of a reassembled PDU]
227   0.065847 172.31.36.109 -> 54.192.30.229 TCP 66 44983 > http [ACK] Seq=98 Ack=1110609 Win=1351040 Len=0 TSval=38552542 TSecr=731037001
228   0.065875 54.192.30.229 -> 172.31.36.109 TCP 3338 [TCP segment of a reassembled PDU]
229   0.066018 172.31.36.109 -> 54.192.30.229 TCP 66 44983 > http [ACK] Seq=98 Ack=1113881 Win=1355008 Len=0 TSval=38552542 TSecr=731037001
230   0.103008 54.192.30.229 -> 172.31.36.109 TCP 2962 [TCP segment of a reassembled PDU]
231   0.103034 172.31.36.109 -> 54.192.30.229 TCP 66 44983 > http [ACK] Seq=98 Ack=1116777 Win=1355776 Len=0 TSval=38552551 TSecr=731037005
232   0.103105 54.192.30.229 -> 172.31.36.109 TCP 15994 [TCP segment of a reassembled PDU]
233   0.103143 172.31.36.109 -> 54.192.30.229 TCP 66 44983 > http [ACK] Seq=98 Ack=1132705 Win=1356160 Len=0 TSval=38552551 TSecr=731037005
234   0.103280 54.192.30.229 -> 172.31.36.109 TCP 21786 [TCP segment of a reassembled PDU]
235   0.103297 54.192.30.229 -> 172.31.36.109 TCP 2962 [TCP segment of a reassembled PDU]
236   0.103321 172.31.36.109 -> 54.192.30.229 TCP 66 44983 > http [ACK] Seq=98 Ack=1157321 Win=1331584 Len=0 TSval=38552551 TSecr=731037005
237   0.104519 54.192.30.229 -> 172.31.36.109 TCP 1514 [TCP segment of a reassembled PDU]
238   0.104681 54.192.30.229 -> 172.31.36.109 TCP 26130 [TCP segment of a reassembled PDU]
239   0.104716 54.192.30.229 -> 172.31.36.109 TCP 10202 [TCP segment of a reassembled PDU]
240   0.104735 172.31.36.109 -> 54.192.30.229 TCP 66 44983 > http [ACK] Seq=98 Ack=1194969 Win=1301120 Len=0 TSval=38552551 TSecr=731037005
241   0.104881 54.192.30.229 -> 172.31.36.109 TCP 20338 [TCP segment of a reassembled PDU]
242   0.104893 172.31.36.109 -> 54.192.30.229 TCP 66 44983 > http [ACK] Seq=98 Ack=1215241 Win=1327232 Len=0 TSval=38552551 TSecr=731037005
243   0.105046 54.192.30.229 -> 172.31.36.109 TCP 7682 [TCP segment of a reassembled PDU]
244   0.105054 172.31.36.109 -> 54.192.30.229 TCP 66 44983 > http [ACK] Seq=98 Ack=1222857 Win=1346304 Len=0 TSval=38552551 TSecr=731037005
245   0.105117 54.192.30.229 -> 172.31.36.109 TCP 22162 [TCP segment of a reassembled PDU]
246   0.105349 172.31.36.109 -> 54.192.30.229 TCP 66 44983 > http [ACK] Seq=98 Ack=1244953 Win=1324288 Len=0 TSval=38552551 TSecr=731037005
247   0.140868 54.192.30.229 -> 172.31.36.109 TCP 1514 [TCP segment of a reassembled PDU]
248   0.140993 54.192.30.229 -> 172.31.36.109 TCP 18890 [TCP segment of a reassembled PDU]
249   0.141011 172.31.36.109 -> 54.192.30.229 TCP 66 44983 > http [ACK] Seq=98 Ack=1265225 Win=1329664 Len=0 TSval=38552560 TSecr=731037009
250   0.141175 54.192.30.229 -> 172.31.36.109 TCP 14546 [TCP segment of a reassembled PDU]
251   0.141186 172.31.36.109 -> 54.192.30.229 TCP 66 44983 > http [ACK] Seq=98 Ack=1279705 Win=1336704 Len=0 TSval=38552560 TSecr=731037009
252   0.141285 54.192.30.229 -> 172.31.36.109 TCP 18890 [TCP segment of a reassembled PDU]
253   0.141309 172.31.36.109 -> 54.192.30.229 TCP 66 44983 > http [ACK] Seq=98 Ack=1298529 Win=1329664 Len=0 TSval=38552560 TSecr=731037009
254   0.141384 54.192.30.229 -> 172.31.36.109 TCP 7306 [TCP segment of a reassembled PDU]
255   0.141391 172.31.36.109 -> 54.192.30.229 TCP 66 44983 > http [ACK] Seq=98 Ack=1305769 Win=1348736 Len=0 TSval=38552560 TSecr=731037009
256   0.141465 54.192.30.229 -> 172.31.36.109 TCP 4786 [TCP segment of a reassembled PDU]
257   0.141471 172.31.36.109 -> 54.192.30.229 TCP 66 44983 > http [ACK] Seq=98 Ack=1310489 Win=1351040 Len=0 TSval=38552560 TSecr=731037009
258   0.141515 54.192.30.229 -> 172.31.36.109 TCP 11650 [TCP segment of a reassembled PDU]
259   0.141550 172.31.36.109 -> 54.192.30.229 TCP 66 44983 > http [ACK] Seq=98 Ack=1322073 Win=1356160 Len=0 TSval=38552560 TSecr=731037009
260   0.141568 54.192.30.229 -> 172.31.36.109 TCP 4410 [TCP segment of a reassembled PDU]
261   0.141578 172.31.36.109 -> 54.192.30.229 TCP 66 44983 > http [ACK] Seq=98 Ack=1326417 Win=1356160 Len=0 TSval=38552560 TSecr=731037009
262   0.141668 54.192.30.229 -> 172.31.36.109 TCP 1514 [TCP segment of a reassembled PDU]
263   0.141752 54.192.30.229 -> 172.31.36.109 TCP 17442 [TCP segment of a reassembled PDU]
264   0.141782 54.192.30.229 -> 172.31.36.109 TCP 2962 [TCP segment of a reassembled PDU]
265   0.141821 54.192.30.229 -> 172.31.36.109 TCP 4410 [TCP segment of a reassembled PDU]
266   0.141931 54.192.30.229 -> 172.31.36.109 TCP 11650 [TCP segment of a reassembled PDU]
267   0.142036 172.31.36.109 -> 54.192.30.229 TCP 66 44983 > http [ACK] Seq=98 Ack=1364065 Win=1318528 Len=0 TSval=38552561 TSecr=731037009
268   0.142072 54.192.30.229 -> 172.31.36.109 TCP 24682 [TCP segment of a reassembled PDU]
269   0.142095 172.31.36.109 -> 54.192.30.229 TCP 66 44983 > http [ACK] Seq=98 Ack=1388681 Win=1301120 Len=0 TSval=38552561 TSecr=731037009
270   0.142128 54.192.30.229 -> 172.31.36.109 TCP 4410 [TCP segment of a reassembled PDU]
271   0.142133 172.31.36.109 -> 54.192.30.229 TCP 66 44983 > http [ACK] Seq=98 Ack=1393025 Win=1353472 Len=0 TSval=38552561 TSecr=731037009
272   0.142660 54.192.30.229 -> 172.31.36.109 TCP 4410 [TCP segment of a reassembled PDU]
273   0.142666 172.31.36.109 -> 54.192.30.229 TCP 66 44983 > http [ACK] Seq=98 Ack=1397369 Win=1353472 Len=0 TSval=38552561 TSecr=731037009
274   0.142790 54.192.30.229 -> 172.31.36.109 TCP 8754 [TCP segment of a reassembled PDU]
275   0.142808 172.31.36.109 -> 54.192.30.229 TCP 66 44983 > http [ACK] Seq=98 Ack=1406057 Win=1356160 Len=0 TSval=38552561 TSecr=731037009
276   0.142920 54.192.30.229 -> 172.31.36.109 TCP 14546 [TCP segment of a reassembled PDU]
277   0.142941 172.31.36.109 -> 54.192.30.229 TCP 66 44983 > http [ACK] Seq=98 Ack=1420537 Win=1356160 Len=0 TSval=38552561 TSecr=731037009
278   0.143046 54.192.30.229 -> 172.31.36.109 TCP 17442 [TCP segment of a reassembled PDU]
279   0.143068 172.31.36.109 -> 54.192.30.229 TCP 66 44983 > http [ACK] Seq=98 Ack=1437913 Win=1338880 Len=0 TSval=38552561 TSecr=731037009
280   0.143426 54.192.30.229 -> 172.31.36.109 TCP 17442 [TCP segment of a reassembled PDU]
281   0.143448 54.192.30.229 -> 172.31.36.109 TCP 2962 [TCP segment of a reassembled PDU]
282   0.143458 172.31.36.109 -> 54.192.30.229 TCP 66 44983 > http [ACK] Seq=98 Ack=1458185 Win=1327104 Len=0 TSval=38552561 TSecr=731037009
283   0.143496 54.192.30.229 -> 172.31.36.109 TCP 15994 [TCP segment of a reassembled PDU]
284   0.143505 172.31.36.109 -> 54.192.30.229 TCP 66 44983 > http [ACK] Seq=98 Ack=1474113 Win=1334400 Len=0 TSval=38552561 TSecr=731037009
285   0.143538 54.192.30.229 -> 172.31.36.109 TCP 10202 [TCP segment of a reassembled PDU]
286   0.143627 54.192.30.229 -> 172.31.36.109 TCP 7306 [TCP segment of a reassembled PDU]
287   0.143726 172.31.36.109 -> 54.192.30.229 TCP 66 44983 > http [ACK] Seq=98 Ack=1491489 Win=1331968 Len=0 TSval=38552561 TSecr=731037009
288   0.143737 54.192.30.229 -> 172.31.36.109 TCP 1514 [TCP segment of a reassembled PDU]
289   0.143891 54.192.30.229 -> 172.31.36.109 TCP 11650 [TCP segment of a reassembled PDU]
290   0.143900 172.31.36.109 -> 54.192.30.229 TCP 66 44983 > http [ACK] Seq=98 Ack=1504521 Win=1341568 Len=0 TSval=38552561 TSecr=731037009
291   0.144007 54.192.30.229 -> 172.31.36.109 TCP 18890 [TCP segment of a reassembled PDU]
292   0.144030 172.31.36.109 -> 54.192.30.229 TCP 66 44983 > http [ACK] Seq=98 Ack=1523345 Win=1329664 Len=0 TSval=38552561 TSecr=731037009
293   0.144360 54.192.30.229 -> 172.31.36.109 TCP 26130 [TCP segment of a reassembled PDU]
294   0.144385 172.31.36.109 -> 54.192.30.229 TCP 66 44983 > http [ACK] Seq=98 Ack=1549409 Win=1317760 Len=0 TSval=38552561 TSecr=731037009
295   0.144460 54.192.30.229 -> 172.31.36.109 TCP 11650 [TCP segment of a reassembled PDU]
296   0.144469 172.31.36.109 -> 54.192.30.229 TCP 66 44983 > http [ACK] Seq=98 Ack=1560993 Win=1341568 Len=0 TSval=38552561 TSecr=731037009
297   0.144574 54.192.30.229 -> 172.31.36.109 TCP 20338 [TCP segment of a reassembled PDU]
298   0.144597 172.31.36.109 -> 54.192.30.229 TCP 66 44983 > http [ACK] Seq=98 Ack=1581265 Win=1327232 Len=0 TSval=38552561 TSecr=731037009
299   0.144781 54.192.30.229 -> 172.31.36.109 TCP 10202 [TCP segment of a reassembled PDU]
300   0.144789 172.31.36.109 -> 54.192.30.229 TCP 66 44983 > http [ACK] Seq=98 Ack=1591401 Win=1344000 Len=0 TSval=38552561 TSecr=731037009
301   0.144875 54.192.30.229 -> 172.31.36.109 TCP 4410 [TCP segment of a reassembled PDU]
302   0.144880 172.31.36.109 -> 54.192.30.229 TCP 66 44983 > http [ACK] Seq=98 Ack=1595745 Win=1353472 Len=0 TSval=38552561 TSecr=731037009
303   0.145185 54.192.30.229 -> 172.31.36.109 TCP 26130 [TCP segment of a reassembled PDU]
304   0.145200 54.192.30.229 -> 172.31.36.109 TCP 1514 [TCP segment of a reassembled PDU]
305   0.145216 54.192.30.229 -> 172.31.36.109 TCP 10202 [TCP segment of a reassembled PDU]
306   0.145230 172.31.36.109 -> 54.192.30.229 TCP 66 44983 > http [ACK] Seq=98 Ack=1633393 Win=1315840 Len=0 TSval=38552561 TSecr=731037009
307   0.145258 54.192.30.229 -> 172.31.36.109 TCP 4410 [TCP segment of a reassembled PDU]
308   0.145263 172.31.36.109 -> 54.192.30.229 TCP 66 44983 > http [ACK] Seq=98 Ack=1637737 Win=1353472 Len=0 TSval=38552561 TSecr=731037009
309   0.145419 54.192.30.229 -> 172.31.36.109 TCP 15994 [TCP segment of a reassembled PDU]
310   0.145429 172.31.36.109 -> 54.192.30.229 TCP 66 44983 > http [ACK] Seq=98 Ack=1653665 Win=1370368 Len=0 TSval=38552561 TSecr=731037009
311   0.145534 54.192.30.229 -> 172.31.36.109 TCP 1514 [TCP segment of a reassembled PDU]
312   0.145539 172.31.36.109 -> 54.192.30.229 TCP 66 44983 > http [ACK] Seq=98 Ack=1655113 Win=1388800 Len=0 TSval=38552561 TSecr=731037009
313   0.145782 54.192.30.229 -> 172.31.36.109 TCP 7306 [TCP segment of a reassembled PDU]
314   0.145801 172.31.36.109 -> 54.192.30.229 TCP 66 44983 > http [ACK] Seq=98 Ack=1662353 Win=1388800 Len=0 TSval=38552562 TSecr=731037009
315   0.145931 54.192.30.229 -> 172.31.36.109 TCP 21786 [TCP segment of a reassembled PDU]
316   0.145955 172.31.36.109 -> 54.192.30.229 TCP 66 44983 > http [ACK] Seq=98 Ack=1684073 Win=1367168 Len=0 TSval=38552562 TSecr=731037009
317   0.146403 54.192.30.229 -> 172.31.36.109 TCP 4410 [TCP segment of a reassembled PDU]
318   0.146409 172.31.36.109 -> 54.192.30.229 TCP 66 44983 > http [ACK] Seq=98 Ack=1688417 Win=1388800 Len=0 TSval=38552562 TSecr=731037009
319   0.146461 54.192.30.229 -> 172.31.36.109 TCP 15354 [TCP segment of a reassembled PDU]
320   0.146486 172.31.36.109 -> 54.192.30.229 TCP 66 44983 > http [ACK] Seq=98 Ack=1703705 Win=1388800 Len=0 TSval=38552562 TSecr=731037009
321   0.154287 54.192.30.229 -> 172.31.36.109 TCP 1514 [TCP segment of a reassembled PDU]
322   0.154559 54.192.30.229 -> 172.31.36.109 TCP 4410 [TCP segment of a reassembled PDU]
323   0.154578 172.31.36.109 -> 54.192.30.229 TCP 66 44983 > http [ACK] Seq=98 Ack=1709497 Win=1388800 Len=0 TSval=38552564 TSecr=731037010
324   0.154644 54.192.30.229 -> 172.31.36.109 TCP 17442 [TCP segment of a reassembled PDU]
325   0.154811 54.192.30.229 -> 172.31.36.109 TCP 4410 [TCP segment of a reassembled PDU]
326   0.154874 54.192.30.229 -> 172.31.36.109 TCP 10202 [TCP segment of a reassembled PDU]
327   0.154927 172.31.36.109 -> 54.192.30.229 TCP 66 44983 > http [ACK] Seq=98 Ack=1741353 Win=1357056 Len=0 TSval=38552564 TSecr=731037010
328   0.155015 54.192.30.229 -> 172.31.36.109 TCP 5858 [TCP segment of a reassembled PDU]
329   0.155022 172.31.36.109 -> 54.192.30.229 TCP 66 44983 > http [ACK] Seq=98 Ack=1747145 Win=1387136 Len=0 TSval=38552564 TSecr=731037010
330   0.155121 54.192.30.229 -> 172.31.36.109 TCP 4410 [TCP segment of a reassembled PDU]
331   0.155128 172.31.36.109 -> 54.192.30.229 TCP 66 44983 > http [ACK] Seq=98 Ack=1751489 Win=1388800 Len=0 TSval=38552564 TSecr=731037010
332   0.155265 54.192.30.229 -> 172.31.36.109 TCP 25058 [TCP segment of a reassembled PDU]
333   0.155289 54.192.30.229 -> 172.31.36.109 TCP 8754 [TCP segment of a reassembled PDU]
334   0.155307 172.31.36.109 -> 54.192.30.229 TCP 66 44983 > http [ACK] Seq=98 Ack=1785169 Win=1355136 Len=0 TSval=38552564 TSecr=731037010
335   0.155335 54.192.30.229 -> 172.31.36.109 TCP 11650 [TCP segment of a reassembled PDU]
336   0.155343 172.31.36.109 -> 54.192.30.229 TCP 66 44983 > http [ACK] Seq=98 Ack=1796753 Win=1363328 Len=0 TSval=38552564 TSecr=731037010
337   0.155366 54.192.30.229 -> 172.31.36.109 TCP 1514 [TCP segment of a reassembled PDU]
338   0.155597 54.192.30.229 -> 172.31.36.109 TCP 23450 [TCP segment of a reassembled PDU]
339   0.155623 54.192.30.229 -> 172.31.36.109 TCP 8754 [TCP segment of a reassembled PDU]
340   0.155641 172.31.36.109 -> 54.192.30.229 TCP 66 44983 > http [ACK] Seq=98 Ack=1830273 Win=1341824 Len=0 TSval=38552564 TSecr=731037010
341   0.155657 54.192.30.229 -> 172.31.36.109 TCP 4410 [TCP segment of a reassembled PDU]
342   0.155670 172.31.36.109 -> 54.192.30.229 TCP 66 44983 > http [ACK] Seq=98 Ack=1834617 Win=1375232 Len=0 TSval=38552564 TSecr=731037010
343   0.155692 54.192.30.229 -> 172.31.36.109 TCP 226 [TCP segment of a reassembled PDU]
344   0.155872 172.31.36.109 -> 54.192.30.229 TCP 66 44983 > http [ACK] Seq=98 Ack=1834777 Win=1388800 Len=0 TSval=38552564 TSecr=731037010
345   0.156770 54.192.30.229 -> 172.31.36.109 TCP 1514 [TCP segment of a reassembled PDU]
346   0.157025 54.192.30.229 -> 172.31.36.109 TCP 4410 [TCP segment of a reassembled PDU]
347   0.157031 172.31.36.109 -> 54.192.30.229 TCP 66 44983 > http [ACK] Seq=98 Ack=1840569 Win=1388800 Len=0 TSval=38552564 TSecr=731037011
348   0.157167 54.192.30.229 -> 172.31.36.109 TCP 20338 [TCP segment of a reassembled PDU]
349   0.157192 172.31.36.109 -> 54.192.30.229 TCP 66 44983 > http [ACK] Seq=98 Ack=1860841 Win=1368576 Len=0 TSval=38552564 TSecr=731037011
350   0.157358 54.192.30.229 -> 172.31.36.109 TCP 11650 [TCP segment of a reassembled PDU]
351   0.157366 172.31.36.109 -> 54.192.30.229 TCP 66 44983 > http [ACK] Seq=98 Ack=1872425 Win=1377664 Len=0 TSval=38552564 TSecr=731037011
352   0.157461 54.192.30.229 -> 172.31.36.109 TCP 10202 [TCP segment of a reassembled PDU]
