[Measurement for 10mb at 19:35:04 19.35.2014] 
Tshark:

  1   0.000000 172.31.36.109 -> 172.31.0.2   DNS 89 Standard query 0xb1fd  A d2pcb72msibvx3.cloudfront.net
  2   0.000038 172.31.36.109 -> 172.31.0.2   DNS 89 Standard query 0x4702  AAAA d2pcb72msibvx3.cloudfront.net
  3   0.000630   172.31.0.2 -> 172.31.36.109 DNS 169 Standard query response 0x4702 
  4   0.000640   172.31.0.2 -> 172.31.36.109 DNS 217 Standard query response 0xb1fd  A 54.230.22.101 A 54.230.23.144 A 216.137.41.123 A 216.137.41.193 A 54.230.20.105 A 54.230.20.159 A 54.230.20.220 A 54.230.21.137
  5   0.003866 172.31.36.109 -> 54.230.22.101 TCP 74 58533 > http [SYN] Seq=0 Win=26883 Len=0 MSS=8961 SACK_PERM=1 TSval=22347730 TSecr=0 WS=128
  6   0.099950 54.230.22.101 -> 172.31.36.109 TCP 74 http > 58533 [SYN, ACK] Seq=0 Ack=1 Win=14480 Len=0 MSS=1460 SACK_PERM=1 TSval=945964939 TSecr=22347730 WS=128
  7   0.099975 172.31.36.109 -> 54.230.22.101 TCP 66 58533 > http [ACK] Seq=1 Ack=1 Win=27008 Len=0 TSval=22347754 TSecr=945964939
  8   0.100128 172.31.36.109 -> 54.230.22.101 HTTP 163 GET /10mb HTTP/1.1 
  9   0.195968 54.230.22.101 -> 172.31.36.109 TCP 66 http > 58533 [ACK] Seq=1 Ack=98 Win=14592 Len=0 TSval=945964948 TSecr=22347754
 10   0.687855 54.230.22.101 -> 172.31.36.109 TCP 1169 [TCP segment of a reassembled PDU]
