[Measurement for 10mb at 20:35:38 19.35.2014] 
Tshark:

  1   0.000000 172.31.36.109 -> 172.31.0.2   DNS 89 Standard query 0x5145  A d2pcb72msibvx3.cloudfront.net
  2   0.000024 172.31.36.109 -> 172.31.0.2   DNS 89 Standard query 0x278c  AAAA d2pcb72msibvx3.cloudfront.net
  3   0.000495   172.31.0.2 -> 172.31.36.109 DNS 169 Standard query response 0x278c 
  4   0.000506   172.31.0.2 -> 172.31.36.109 DNS 217 Standard query response 0x5145  A 54.230.219.130 A 54.230.219.202 A 54.230.216.97 A 54.230.216.224 A 54.230.217.203 A 54.230.217.217 A 54.230.218.116 A 54.230.219.118
  5   0.003870 172.31.36.109 -> 54.230.219.130 TCP 74 40221 > http [SYN] Seq=0 Win=26883 Len=0 MSS=8961 SACK_PERM=1 TSval=23256139 TSecr=0 WS=128
  6   0.090412 54.230.219.130 -> 172.31.36.109 TCP 74 http > 40221 [SYN, ACK] Seq=0 Ack=1 Win=14480 Len=0 MSS=1460 SACK_PERM=1 TSval=3118954268 TSecr=23256139 WS=128
  7   0.090432 172.31.36.109 -> 54.230.219.130 TCP 66 40221 > http [ACK] Seq=1 Ack=1 Win=27008 Len=0 TSval=23256160 TSecr=3118954268
  8   0.090502 172.31.36.109 -> 54.230.219.130 HTTP 163 GET /10mb HTTP/1.1 
  9   0.176830 54.230.219.130 -> 172.31.36.109 TCP 66 http > 40221 [ACK] Seq=1 Ack=98 Win=14592 Len=0 TSval=3118954276 TSecr=23256160
 10   0.600015 54.230.219.130 -> 172.31.36.109 TCP 13098 [TCP segment of a reassembled PDU]
 11   0.600043 172.31.36.109 -> 54.230.219.130 TCP 66 40221 > http [ACK] Seq=98 Ack=13033 Win=52992 Len=0 TSval=23256288 TSecr=3118954319
 12   0.685738 54.230.219.130 -> 172.31.36.109 TCP 1957 [TCP segment of a reassembled PDU]
 13   0.685751 172.31.36.109 -> 54.230.219.130 TCP 66 40221 > http [ACK] Seq=98 Ack=14924 Win=56832 Len=0 TSval=23256309 TSecr=3118954327
 14   0.960069 54.230.219.130 -> 172.31.36.109 TCP 1514 [TCP segment of a reassembled PDU]
