[Measurement for 10mb at 06:34:38 20.34.2014] 
Tshark:

  1   0.000000 172.31.36.109 -> 172.31.0.2   DNS 89 Standard query 0x93aa  A d2pcb72msibvx3.cloudfront.net
  2   0.000027 172.31.36.109 -> 172.31.0.2   DNS 89 Standard query 0xb33b  AAAA d2pcb72msibvx3.cloudfront.net
  3   0.000520   172.31.0.2 -> 172.31.36.109 DNS 169 Standard query response 0xb33b 
  4   0.000531   172.31.0.2 -> 172.31.36.109 DNS 217 Standard query response 0x93aa  A 216.137.41.227 A 54.230.20.3 A 54.230.20.109 A 54.230.20.181 A 54.230.20.193 A 54.230.21.79 A 54.230.22.128 A 54.230.22.176
  5   0.003863 172.31.36.109 -> 216.137.41.227 TCP 74 54567 > http [SYN] Seq=0 Win=26883 Len=0 MSS=8961 SACK_PERM=1 TSval=32241235 TSecr=0 WS=128
  6   0.093528 216.137.41.227 -> 172.31.36.109 TCP 74 http > 54567 [SYN, ACK] Seq=0 Ack=1 Win=14480 Len=0 MSS=1460 SACK_PERM=1 TSval=970626234 TSecr=32241235 WS=128
  7   0.093562 172.31.36.109 -> 216.137.41.227 TCP 66 54567 > http [ACK] Seq=1 Ack=1 Win=27008 Len=0 TSval=32241258 TSecr=970626234
  8   0.093681 172.31.36.109 -> 216.137.41.227 HTTP 163 GET /10mb HTTP/1.1 
  9   0.183129 216.137.41.227 -> 172.31.36.109 TCP 66 http > 54567 [ACK] Seq=1 Ack=98 Win=14592 Len=0 TSval=970626243 TSecr=32241258
 10   0.186716 216.137.41.227 -> 172.31.36.109 TCP 1144 [TCP segment of a reassembled PDU]
 11   0.186725 172.31.36.109 -> 216.137.41.227 TCP 66 54567 > http [ACK] Seq=98 Ack=1079 Win=29056 Len=0 TSval=32241281 TSecr=970626244
 12   0.186742 216.137.41.227 -> 172.31.36.109 TCP 13098 [TCP segment of a reassembled PDU]
 13   0.186752 172.31.36.109 -> 216.137.41.227 TCP 66 54567 > http [ACK] Seq=98 Ack=14111 Win=55168 Len=0 TSval=32241281 TSecr=970626244
 14   0.276450 216.137.41.227 -> 172.31.36.109 TCP 13098 [TCP segment of a reassembled PDU]
 15   0.276460 172.31.36.109 -> 216.137.41.227 TCP 66 54567 > http [ACK] Seq=98 Ack=27143 Win=81280 Len=0 TSval=32241303 TSecr=970626253
 16   0.366021 216.137.41.227 -> 172.31.36.109 TCP 13098 [TCP segment of a reassembled PDU]
 17   0.366032 172.31.36.109 -> 216.137.41.227 TCP 66 54567 > http [ACK] Seq=98 Ack=40175 Win=96512 Len=0 TSval=32241326 TSecr=970626261
 18   0.455804 216.137.41.227 -> 172.31.36.109 TCP 20338 [TCP segment of a reassembled PDU]
