[Measurement for 10mb at 08:34:42 20.34.2014] 
Tshark:

  1   0.000000 172.31.36.109 -> 172.31.0.2   DNS 89 Standard query 0x0bf2  A d2pcb72msibvx3.cloudfront.net
  2   0.000027 172.31.36.109 -> 172.31.0.2   DNS 89 Standard query 0x7ec7  AAAA d2pcb72msibvx3.cloudfront.net
  3   0.000490   172.31.0.2 -> 172.31.36.109 DNS 217 Standard query response 0x0bf2  A 54.230.20.252 A 54.230.20.254 A 54.230.21.160 A 54.230.21.222 A 216.137.41.10 A 216.137.41.34 A 216.137.41.199 A 54.230.20.3
  4   0.000501   172.31.0.2 -> 172.31.36.109 DNS 169 Standard query response 0x7ec7 
  5   0.003812 172.31.36.109 -> 54.230.20.252 TCP 74 49567 > http [SYN] Seq=0 Win=26883 Len=0 MSS=8961 SACK_PERM=1 TSval=34042230 TSecr=0 WS=128
  6   0.092333 54.230.20.252 -> 172.31.36.109 TCP 74 http > 49567 [SYN, ACK] Seq=0 Ack=1 Win=14480 Len=0 MSS=1460 SACK_PERM=1 TSval=949192815 TSecr=34042230 WS=128
  7   0.092359 172.31.36.109 -> 54.230.20.252 TCP 66 49567 > http [ACK] Seq=1 Ack=1 Win=27008 Len=0 TSval=34042252 TSecr=949192815
  8   0.092535 172.31.36.109 -> 54.230.20.252 HTTP 163 GET /10mb HTTP/1.1 
  9   0.181137 54.230.20.252 -> 172.31.36.109 TCP 66 http > 49567 [ACK] Seq=1 Ack=98 Win=14592 Len=0 TSval=949192824 TSecr=34042252
 10   0.185327 54.230.20.252 -> 172.31.36.109 TCP 14546 [TCP segment of a reassembled PDU]
 11   0.185344 172.31.36.109 -> 54.230.20.252 TCP 66 49567 > http [ACK] Seq=98 Ack=14481 Win=55936 Len=0 TSval=34042275 TSecr=949192824
 12   0.273925 54.230.20.252 -> 172.31.36.109 TCP 13098 [TCP segment of a reassembled PDU]
 13   0.273947 172.31.36.109 -> 54.230.20.252 TCP 66 49567 > http [ACK] Seq=98 Ack=27513 Win=81920 Len=0 TSval=34042297 TSecr=949192833
 14   0.362743 54.230.20.252 -> 172.31.36.109 TCP 10202 [TCP segment of a reassembled PDU]
 15   0.362765 172.31.36.109 -> 54.230.20.252 TCP 66 49567 > http [ACK] Seq=98 Ack=37649 Win=101248 Len=0 TSval=34042319 TSecr=949192842
 16   0.362898 54.230.20.252 -> 172.31.36.109 TCP 2962 [TCP segment of a reassembled PDU]
 17   0.362904 172.31.36.109 -> 54.230.20.252 TCP 66 49567 > http [ACK] Seq=98 Ack=40545 Win=108032 Len=0 TSval=34042319 TSecr=949192842
 18   0.451355 54.230.20.252 -> 172.31.36.109 TCP 13098 [TCP segment of a reassembled PDU]
