[Measurement for 1kb at 01:40:39 20.40.2014] 
Tshark:

  1   0.000000 172.31.8.238 -> 172.31.0.2   DNS 89 Standard query 0xdfef  A d3796nkzln59xv.cloudfront.net
  2   0.000029 172.31.8.238 -> 172.31.0.2   DNS 89 Standard query 0x01e5  AAAA d3796nkzln59xv.cloudfront.net
  3   0.000737   172.31.0.2 -> 172.31.8.238 DNS 217 Standard query response 0xdfef  A 54.192.118.237 A 54.192.118.241 A 54.230.118.187 A 54.230.119.86 A 54.239.132.84 A 54.239.132.196 A 54.192.118.218 A 54.192.118.235
  4   0.004937   172.31.0.2 -> 172.31.8.238 DNS 170 Standard query response 0x01e5 
  5   0.012070 172.31.8.238 -> 54.192.118.237 TCP 74 59460 > http [SYN] Seq=0 Win=26883 Len=0 MSS=8961 SACK_PERM=1 TSval=7816788 TSecr=0 WS=128
  6   0.012897 54.192.118.237 -> 172.31.8.238 TCP 74 http > 59460 [SYN, ACK] Seq=0 Ack=1 Win=14480 Len=0 MSS=1460 SACK_PERM=1 TSval=1684382590 TSecr=7816788 WS=128
  7   0.012912 172.31.8.238 -> 54.192.118.237 TCP 66 59460 > http [ACK] Seq=1 Ack=1 Win=27008 Len=0 TSval=7816788 TSecr=1684382590
  8   0.012971 172.31.8.238 -> 54.192.118.237 HTTP 162 GET /1kb HTTP/1.1 
  9   0.013683 54.192.118.237 -> 172.31.8.238 TCP 66 http > 59460 [ACK] Seq=1 Ack=97 Win=14592 Len=0 TSval=1684382590 TSecr=7816788
 10   0.015498 54.192.118.237 -> 172.31.8.238 HTTP 1544 HTTP/1.1 200 OK  (application/octet-stream)
 11   0.015507 172.31.8.238 -> 54.192.118.237 TCP 66 59460 > http [ACK] Seq=97 Ack=1479 Win=29952 Len=0 TSval=7816789 TSecr=1684382590
 12   0.015667 172.31.8.238 -> 54.192.118.237 TCP 66 59460 > http [FIN, ACK] Seq=97 Ack=1479 Win=29952 Len=0 TSval=7816789 TSecr=1684382590
 13   0.016191 54.192.118.237 -> 172.31.8.238 TCP 66 http > 59460 [FIN, ACK] Seq=1479 Ack=98 Win=14592 Len=0 TSval=1684382590 TSecr=7816789
 14   0.016199 172.31.8.238 -> 54.192.118.237 TCP 66 59460 > http [ACK] Seq=98 Ack=1480 Win=29952 Len=0 TSval=7816789 TSecr=1684382590
