[Measurement for 1kb at 12:40:40 20.40.2014] 
Tshark:

  1   0.000000 172.31.8.238 -> 172.31.0.2   DNS 89 Standard query 0xe0f1  A d3796nkzln59xv.cloudfront.net
  2   0.000050 172.31.8.238 -> 172.31.0.2   DNS 89 Standard query 0x34c9  AAAA d3796nkzln59xv.cloudfront.net
  3   0.000560   172.31.0.2 -> 172.31.8.238 DNS 217 Standard query response 0xe0f1  A 54.230.119.18 A 54.230.119.118 A 54.239.132.147 A 54.192.118.228 A 54.230.116.53 A 54.230.116.98 A 54.230.117.37 A 54.230.118.136
  4   0.004717   172.31.0.2 -> 172.31.8.238 DNS 170 Standard query response 0x34c9 
  5   0.012013 172.31.8.238 -> 54.230.119.18 TCP 74 43589 > http [SYN] Seq=0 Win=26883 Len=0 MSS=8961 SACK_PERM=1 TSval=17717008 TSecr=0 WS=128
  6   0.012682 54.230.119.18 -> 172.31.8.238 TCP 74 http > 43589 [SYN, ACK] Seq=0 Ack=1 Win=14480 Len=0 MSS=1460 SACK_PERM=1 TSval=1688752427 TSecr=17717008 WS=128
  7   0.012696 172.31.8.238 -> 54.230.119.18 TCP 66 43589 > http [ACK] Seq=1 Ack=1 Win=27008 Len=0 TSval=17717008 TSecr=1688752427
  8   0.012740 172.31.8.238 -> 54.230.119.18 HTTP 162 GET /1kb HTTP/1.1 
  9   0.013440 54.230.119.18 -> 172.31.8.238 TCP 66 http > 43589 [ACK] Seq=1 Ack=97 Win=14592 Len=0 TSval=1688752427 TSecr=17717008
 10   0.014473 54.230.119.18 -> 172.31.8.238 HTTP 1544 HTTP/1.1 200 OK  (application/octet-stream)
 11   0.014480 172.31.8.238 -> 54.230.119.18 TCP 66 43589 > http [ACK] Seq=97 Ack=1479 Win=29952 Len=0 TSval=17717008 TSecr=1688752427
 12   0.014630 172.31.8.238 -> 54.230.119.18 TCP 66 43589 > http [FIN, ACK] Seq=97 Ack=1479 Win=29952 Len=0 TSval=17717008 TSecr=1688752427
 13   0.015464 54.230.119.18 -> 172.31.8.238 TCP 66 http > 43589 [FIN, ACK] Seq=1479 Ack=98 Win=14592 Len=0 TSval=1688752427 TSecr=17717008
 14   0.015473 172.31.8.238 -> 54.230.119.18 TCP 66 43589 > http [ACK] Seq=98 Ack=1480 Win=29952 Len=0 TSval=17717009 TSecr=1688752427
