[Measurement for 1kb at 03:40:40 20.40.2014] 
Tshark:

  1   0.000000 172.31.8.238 -> 172.31.0.2   DNS 89 Standard query 0x08e5  A d3796nkzln59xv.cloudfront.net
  2   0.000029 172.31.8.238 -> 172.31.0.2   DNS 89 Standard query 0xbcc8  AAAA d3796nkzln59xv.cloudfront.net
  3   0.000684   172.31.0.2 -> 172.31.8.238 DNS 217 Standard query response 0x08e5  A 54.192.118.228 A 54.192.118.241 A 54.192.118.242 A 54.230.116.73 A 54.230.118.138 A 54.230.119.3 A 54.239.132.83 A 54.192.118.219
  4   0.002860   172.31.0.2 -> 172.31.8.238 DNS 170 Standard query response 0xbcc8 
  5   0.003876 172.31.8.238 -> 54.192.118.228 TCP 74 54926 > http [SYN] Seq=0 Win=26883 Len=0 MSS=8961 SACK_PERM=1 TSval=9616934 TSecr=0 WS=128
  6   0.004533 54.192.118.228 -> 172.31.8.238 TCP 74 http > 54926 [SYN, ACK] Seq=0 Ack=1 Win=14480 Len=0 MSS=1460 SACK_PERM=1 TSval=1581617360 TSecr=9616934 WS=128
  7   0.004546 172.31.8.238 -> 54.192.118.228 TCP 66 54926 > http [ACK] Seq=1 Ack=1 Win=27008 Len=0 TSval=9616934 TSecr=1581617360
  8   0.004589 172.31.8.238 -> 54.192.118.228 HTTP 162 GET /1kb HTTP/1.1 
  9   0.005275 54.192.118.228 -> 172.31.8.238 TCP 66 http > 54926 [ACK] Seq=1 Ack=97 Win=14592 Len=0 TSval=1581617360 TSecr=9616934
 10   0.006613 54.192.118.228 -> 172.31.8.238 HTTP 1544 HTTP/1.1 200 OK  (application/octet-stream)
 11   0.006621 172.31.8.238 -> 54.192.118.228 TCP 66 54926 > http [ACK] Seq=97 Ack=1479 Win=29952 Len=0 TSval=9616934 TSecr=1581617360
 12   0.006788 172.31.8.238 -> 54.192.118.228 TCP 66 54926 > http [FIN, ACK] Seq=97 Ack=1479 Win=29952 Len=0 TSval=9616934 TSecr=1581617360
 13   0.007323 54.192.118.228 -> 172.31.8.238 TCP 66 http > 54926 [FIN, ACK] Seq=1479 Ack=98 Win=14592 Len=0 TSval=1581617361 TSecr=9616934
 14   0.007331 172.31.8.238 -> 54.192.118.228 TCP 66 54926 > http [ACK] Seq=98 Ack=1480 Win=29952 Len=0 TSval=9616934 TSecr=1581617361
