[Measurement for 1kb at 23:40:39 19.40.2014] 
Tshark:

  1   0.000000 172.31.8.238 -> 172.31.0.2   DNS 89 Standard query 0x17ce  A d3796nkzln59xv.cloudfront.net
  2   0.000029 172.31.8.238 -> 172.31.0.2   DNS 89 Standard query 0x37a8  AAAA d3796nkzln59xv.cloudfront.net
  3   0.000543   172.31.0.2 -> 172.31.8.238 DNS 217 Standard query response 0x17ce  A 54.230.119.40 A 54.239.132.86 A 54.192.118.219 A 54.230.117.37 A 54.230.117.69 A 54.230.117.157 A 54.230.117.238 A 54.230.119.3
  4   0.006854   172.31.0.2 -> 172.31.8.238 DNS 170 Standard query response 0x37a8 
  5   0.012038 172.31.8.238 -> 54.230.119.40 TCP 74 42548 > http [SYN] Seq=0 Win=26883 Len=0 MSS=8961 SACK_PERM=1 TSval=6016862 TSecr=0 WS=128
  6   0.012885 54.230.119.40 -> 172.31.8.238 TCP 74 http > 42548 [SYN, ACK] Seq=0 Ack=1 Win=14480 Len=0 MSS=1460 SACK_PERM=1 TSval=1680602811 TSecr=6016862 WS=128
  7   0.012900 172.31.8.238 -> 54.230.119.40 TCP 66 42548 > http [ACK] Seq=1 Ack=1 Win=27008 Len=0 TSval=6016863 TSecr=1680602811
  8   0.012946 172.31.8.238 -> 54.230.119.40 HTTP 162 GET /1kb HTTP/1.1 
  9   0.013663 54.230.119.40 -> 172.31.8.238 TCP 66 http > 42548 [ACK] Seq=1 Ack=97 Win=14592 Len=0 TSval=1680602811 TSecr=6016863
 10   0.015726 54.230.119.40 -> 172.31.8.238 HTTP 1544 HTTP/1.1 200 OK  (application/octet-stream)
 11   0.015733 172.31.8.238 -> 54.230.119.40 TCP 66 42548 > http [ACK] Seq=97 Ack=1479 Win=29952 Len=0 TSval=6016863 TSecr=1680602811
 12   0.015936 172.31.8.238 -> 54.230.119.40 TCP 66 42548 > http [FIN, ACK] Seq=97 Ack=1479 Win=29952 Len=0 TSval=6016863 TSecr=1680602811
 13   0.016777 54.230.119.40 -> 172.31.8.238 TCP 66 http > 42548 [FIN, ACK] Seq=1479 Ack=98 Win=14592 Len=0 TSval=1680602811 TSecr=6016863
 14   0.016786 172.31.8.238 -> 54.230.119.40 TCP 66 42548 > http [ACK] Seq=98 Ack=1480 Win=29952 Len=0 TSval=6016864 TSecr=1680602811
