[Measurement for 1kb at 17:41:00 19.41.2014] 
Tshark:

  1   0.000000 172.31.8.238 -> 172.31.0.2   DNS 89 Standard query 0x8e7f  A d3796nkzln59xv.cloudfront.net
  2   0.000031 172.31.8.238 -> 172.31.0.2   DNS 89 Standard query 0x2a1d  AAAA d3796nkzln59xv.cloudfront.net
  3   0.001172   172.31.0.2 -> 172.31.8.238 DNS 217 Standard query response 0x8e7f  A 54.192.141.189 A 54.230.140.236 A 54.230.143.14 A 205.251.215.109 A 205.251.215.126 A 205.251.215.155 A 205.251.215.224 A 54.192.141.180
  4   0.016178   172.31.0.2 -> 172.31.8.238 DNS 170 Standard query response 0x2a1d 
  5   0.030468 172.31.8.238 -> 54.192.141.189 TCP 74 59851 > http [SYN] Seq=0 Win=26883 Len=0 MSS=8961 SACK_PERM=1 TSval=621973 TSecr=0 WS=128
  6   0.032736 54.192.141.189 -> 172.31.8.238 TCP 74 http > 59851 [SYN, ACK] Seq=0 Ack=1 Win=14480 Len=0 MSS=1460 SACK_PERM=1 TSval=803935232 TSecr=621973 WS=128
  7   0.032768 172.31.8.238 -> 54.192.141.189 TCP 66 59851 > http [ACK] Seq=1 Ack=1 Win=27008 Len=0 TSval=621974 TSecr=803935232
  8   0.032856 172.31.8.238 -> 54.192.141.189 HTTP 162 GET /1kb HTTP/1.1 
  9   0.035000 54.192.141.189 -> 172.31.8.238 TCP 66 http > 59851 [ACK] Seq=1 Ack=97 Win=14592 Len=0 TSval=803935232 TSecr=621974
 10   0.223320 54.192.141.189 -> 172.31.8.238 HTTP 1533 HTTP/1.1 200 OK  (application/octet-stream)
 11   0.223351 172.31.8.238 -> 54.192.141.189 TCP 66 59851 > http [ACK] Seq=97 Ack=1468 Win=29824 Len=0 TSval=622021 TSecr=803935251
 12   0.227904 172.31.8.238 -> 54.192.141.189 TCP 66 59851 > http [FIN, ACK] Seq=97 Ack=1468 Win=29824 Len=0 TSval=622023 TSecr=803935251
 13   0.230143 54.192.141.189 -> 172.31.8.238 TCP 66 http > 59851 [FIN, ACK] Seq=1468 Ack=98 Win=14592 Len=0 TSval=803935252 TSecr=622023
 14   0.230160 172.31.8.238 -> 54.192.141.189 TCP 66 59851 > http [ACK] Seq=98 Ack=1469 Win=29824 Len=0 TSval=622023 TSecr=803935252
