[Measurement for 1kb at 02:40:40 20.40.2014] 
Tshark:

  1   0.000000 172.31.8.238 -> 172.31.0.2   DNS 89 Standard query 0xe5f0  A d3796nkzln59xv.cloudfront.net
  2   0.000029 172.31.8.238 -> 172.31.0.2   DNS 89 Standard query 0x50e5  AAAA d3796nkzln59xv.cloudfront.net
  3   0.000654   172.31.0.2 -> 172.31.8.238 DNS 217 Standard query response 0xe5f0  A 54.192.118.241 A 54.230.116.44 A 54.230.116.72 A 54.230.116.73 A 54.230.117.42 A 54.239.132.90 A 54.239.132.103 A 54.192.118.230
  4   0.003125   172.31.0.2 -> 172.31.8.238 DNS 170 Standard query response 0x50e5 
  5   0.003872 172.31.8.238 -> 54.192.118.241 TCP 74 55327 > http [SYN] Seq=0 Win=26883 Len=0 MSS=8961 SACK_PERM=1 TSval=8716974 TSecr=0 WS=128
  6   0.004662 54.192.118.241 -> 172.31.8.238 TCP 74 http > 55327 [SYN, ACK] Seq=0 Ack=1 Win=14480 Len=0 MSS=1460 SACK_PERM=1 TSval=1685842574 TSecr=8716974 WS=128
  7   0.004677 172.31.8.238 -> 54.192.118.241 TCP 66 55327 > http [ACK] Seq=1 Ack=1 Win=27008 Len=0 TSval=8716974 TSecr=1685842574
  8   0.004719 172.31.8.238 -> 54.192.118.241 HTTP 162 GET /1kb HTTP/1.1 
  9   0.005445 54.192.118.241 -> 172.31.8.238 TCP 66 http > 55327 [ACK] Seq=1 Ack=97 Win=14592 Len=0 TSval=1685842574 TSecr=8716974
 10   0.011377 54.192.118.241 -> 172.31.8.238 HTTP 1544 HTTP/1.1 200 OK  (application/octet-stream)
 11   0.011386 172.31.8.238 -> 54.192.118.241 TCP 66 55327 > http [ACK] Seq=97 Ack=1479 Win=29952 Len=0 TSval=8716976 TSecr=1685842575
 12   0.011560 172.31.8.238 -> 54.192.118.241 TCP 66 55327 > http [FIN, ACK] Seq=97 Ack=1479 Win=29952 Len=0 TSval=8716976 TSecr=1685842575
 13   0.012307 54.192.118.241 -> 172.31.8.238 TCP 66 http > 55327 [FIN, ACK] Seq=1479 Ack=98 Win=14592 Len=0 TSval=1685842575 TSecr=8716976
 14   0.012316 172.31.8.238 -> 54.192.118.241 TCP 66 55327 > http [ACK] Seq=98 Ack=1480 Win=29952 Len=0 TSval=8716976 TSecr=1685842575
