[Measurement for 1mb at 11:30:22 20.30.2014] 
Tshark:

  1   0.000000 172.31.36.109 -> 172.31.0.2   DNS 89 Standard query 0x9fa7  A d39wppo36gwqpx.cloudfront.net
  2   0.000039 172.31.36.109 -> 172.31.0.2   DNS 89 Standard query 0x6e2c  AAAA d39wppo36gwqpx.cloudfront.net
  3   0.000476   172.31.0.2 -> 172.31.36.109 DNS 217 Standard query response 0x9fa7  A 54.230.30.56 A 54.230.30.217 A 54.192.29.219 A 54.192.30.216 A 54.230.29.245 A 54.230.30.2 A 54.230.30.17 A 54.230.30.40
  4   0.000493   172.31.0.2 -> 172.31.36.109 DNS 170 Standard query response 0x6e2c 
  5   0.003795 172.31.36.109 -> 54.230.30.56 TCP 74 58537 > http [SYN] Seq=0 Win=26883 Len=0 MSS=8961 SACK_PERM=1 TSval=36677179 TSecr=0 WS=128
  6   0.005014 54.230.30.56 -> 172.31.36.109 TCP 74 http > 58537 [SYN, ACK] Seq=0 Ack=1 Win=14480 Len=0 MSS=1460 SACK_PERM=1 TSval=724680264 TSecr=36677179 WS=128
  7   0.005029 172.31.36.109 -> 54.230.30.56 TCP 66 58537 > http [ACK] Seq=1 Ack=1 Win=27008 Len=0 TSval=36677180 TSecr=724680264
  8   0.005081 172.31.36.109 -> 54.230.30.56 HTTP 162 GET /1mb HTTP/1.1 
  9   0.006191 54.230.30.56 -> 172.31.36.109 TCP 66 http > 58537 [ACK] Seq=1 Ack=97 Win=14592 Len=0 TSval=724680264 TSecr=36677180
 10   0.022435 54.230.30.56 -> 172.31.36.109 TCP 4410 [TCP segment of a reassembled PDU]
 11   0.022447 172.31.36.109 -> 54.230.30.56 TCP 66 58537 > http [ACK] Seq=97 Ack=4345 Win=35584 Len=0 TSval=36677184 TSecr=724680266
 12   0.022462 54.230.30.56 -> 172.31.36.109 TCP 8754 [TCP segment of a reassembled PDU]
 13   0.022472 172.31.36.109 -> 54.230.30.56 TCP 66 58537 > http [ACK] Seq=97 Ack=13033 Win=52992 Len=0 TSval=36677184 TSecr=724680266
 14   0.022608 54.230.30.56 -> 172.31.36.109 TCP 1514 [TCP segment of a reassembled PDU]
 15   0.022617 172.31.36.109 -> 54.230.30.56 TCP 66 58537 > http [ACK] Seq=97 Ack=14481 Win=55936 Len=0 TSval=36677184 TSecr=724680266
 16   0.023495 54.230.30.56 -> 172.31.36.109 TCP 5858 [TCP segment of a reassembled PDU]
 17   0.023504 172.31.36.109 -> 54.230.30.56 TCP 66 58537 > http [ACK] Seq=97 Ack=20273 Win=67456 Len=0 TSval=36677184 TSecr=724680266
 18   0.023661 54.230.30.56 -> 172.31.36.109 TCP 2962 [TCP segment of a reassembled PDU]
 19   0.023667 172.31.36.109 -> 54.230.30.56 TCP 66 58537 > http [ACK] Seq=97 Ack=23169 Win=73344 Len=0 TSval=36677184 TSecr=724680266
 20   0.023688 54.230.30.56 -> 172.31.36.109 TCP 2962 [TCP segment of a reassembled PDU]
 21   0.023693 172.31.36.109 -> 54.230.30.56 TCP 66 58537 > http [ACK] Seq=97 Ack=26065 Win=79104 Len=0 TSval=36677184 TSecr=724680266
 22   0.023711 54.230.30.56 -> 172.31.36.109 TCP 1514 [TCP segment of a reassembled PDU]
 23   0.023714 172.31.36.109 -> 54.230.30.56 TCP 66 58537 > http [ACK] Seq=97 Ack=27513 Win=81920 Len=0 TSval=36677184 TSecr=724680266
 24   0.024657 54.230.30.56 -> 172.31.36.109 TCP 2962 [TCP segment of a reassembled PDU]
 25   0.024663 172.31.36.109 -> 54.230.30.56 TCP 66 58537 > http [ACK] Seq=97 Ack=30409 Win=87808 Len=0 TSval=36677185 TSecr=724680266
 26   0.024726 54.230.30.56 -> 172.31.36.109 TCP 10202 [TCP segment of a reassembled PDU]
 27   0.024734 172.31.36.109 -> 54.230.30.56 TCP 66 58537 > http [ACK] Seq=97 Ack=40545 Win=101248 Len=0 TSval=36677185 TSecr=724680266
 28   0.024900 54.230.30.56 -> 172.31.36.109 TCP 8754 [TCP segment of a reassembled PDU]
 29   0.024906 172.31.36.109 -> 54.230.30.56 TCP 66 58537 > http [ACK] Seq=97 Ack=49233 Win=125440 Len=0 TSval=36677185 TSecr=724680266
 30   0.025941 54.230.30.56 -> 172.31.36.109 TCP 7306 [TCP segment of a reassembled PDU]
 31   0.025947 172.31.36.109 -> 54.230.30.56 TCP 66 58537 > http [ACK] Seq=97 Ack=56473 Win=139904 Len=0 TSval=36677185 TSecr=724680266
 32   0.026022 54.230.30.56 -> 172.31.36.109 TCP 10202 [TCP segment of a reassembled PDU]
 33   0.026030 172.31.36.109 -> 54.230.30.56 TCP 66 58537 > http [ACK] Seq=97 Ack=66609 Win=160128 Len=0 TSval=36677185 TSecr=724680266
 34   0.026291 54.230.30.56 -> 172.31.36.109 TCP 11650 [TCP segment of a reassembled PDU]
 35   0.026299 172.31.36.109 -> 54.230.30.56 TCP 66 58537 > http [ACK] Seq=97 Ack=78193 Win=179200 Len=0 TSval=36677185 TSecr=724680266
 36   0.027016 54.230.30.56 -> 172.31.36.109 TCP 4410 [TCP segment of a reassembled PDU]
 37   0.027022 172.31.36.109 -> 54.230.30.56 TCP 66 58537 > http [ACK] Seq=97 Ack=82537 Win=191104 Len=0 TSval=36677185 TSecr=724680266
 38   0.027201 54.230.30.56 -> 172.31.36.109 TCP 2962 [TCP segment of a reassembled PDU]
 39   0.027207 172.31.36.109 -> 54.230.30.56 TCP 66 58537 > http [ACK] Seq=97 Ack=85433 Win=193408 Len=0 TSval=36677185 TSecr=724680266
 40   0.027415 54.230.30.56 -> 172.31.36.109 TCP 20338 [TCP segment of a reassembled PDU]
 41   0.027427 172.31.36.109 -> 54.230.30.56 TCP 66 58537 > http [ACK] Seq=97 Ack=105705 Win=173184 Len=0 TSval=36677185 TSecr=724680266
 42   0.028052 54.230.30.56 -> 172.31.36.109 TCP 5858 [TCP segment of a reassembled PDU]
 43   0.028058 172.31.36.109 -> 54.230.30.56 TCP 66 58537 > http [ACK] Seq=97 Ack=111497 Win=188672 Len=0 TSval=36677185 TSecr=724680266
 44   0.028135 54.230.30.56 -> 172.31.36.109 TCP 1514 [TCP segment of a reassembled PDU]
 45   0.028140 172.31.36.109 -> 54.230.30.56 TCP 66 58537 > http [ACK] Seq=97 Ack=112945 Win=195840 Len=0 TSval=36677185 TSecr=724680266
 46   0.028264 54.230.30.56 -> 172.31.36.109 TCP 4410 [TCP segment of a reassembled PDU]
 47   0.028270 172.31.36.109 -> 54.230.30.56 TCP 66 58537 > http [ACK] Seq=97 Ack=117289 Win=191616 Len=0 TSval=36677185 TSecr=724680266
 48   0.028555 54.230.30.56 -> 172.31.36.109 TCP 1514 [TCP segment of a reassembled PDU]
 49   0.028559 172.31.36.109 -> 54.230.30.56 TCP 66 58537 > http [ACK] Seq=97 Ack=118737 Win=195840 Len=0 TSval=36677185 TSecr=724680266
 50   0.028651 54.230.30.56 -> 172.31.36.109 TCP 5858 [TCP segment of a reassembled PDU]
 51   0.028658 172.31.36.109 -> 54.230.30.56 TCP 66 58537 > http [ACK] Seq=97 Ack=124529 Win=190080 Len=0 TSval=36677186 TSecr=724680266
 52   0.028761 54.230.30.56 -> 172.31.36.109 TCP 5858 [TCP segment of a reassembled PDU]
 53   0.028767 172.31.36.109 -> 54.230.30.56 TCP 66 58537 > http [ACK] Seq=97 Ack=130321 Win=184320 Len=0 TSval=36677186 TSecr=724680266
 54   0.028843 54.230.30.56 -> 172.31.36.109 TCP 1514 [TCP segment of a reassembled PDU]
 55   0.028847 172.31.36.109 -> 54.230.30.56 TCP 66 58537 > http [ACK] Seq=97 Ack=131769 Win=182912 Len=0 TSval=36677186 TSecr=724680266
 56   0.029286 54.230.30.56 -> 172.31.36.109 TCP 4410 [TCP segment of a reassembled PDU]
 57   0.029294 172.31.36.109 -> 54.230.30.56 TCP 66 58537 > http [ACK] Seq=97 Ack=136113 Win=206464 Len=0 TSval=36677186 TSecr=724680267
 58   0.029379 54.230.30.56 -> 172.31.36.109 TCP 13098 [TCP segment of a reassembled PDU]
 59   0.029388 172.31.36.109 -> 54.230.30.56 TCP 66 58537 > http [ACK] Seq=97 Ack=149145 Win=232576 Len=0 TSval=36677186 TSecr=724680267
 60   0.029422 54.230.30.56 -> 172.31.36.109 TCP 1514 [TCP segment of a reassembled PDU]
 61   0.029427 172.31.36.109 -> 54.230.30.56 TCP 66 58537 > http [ACK] Seq=97 Ack=150593 Win=235520 Len=0 TSval=36677186 TSecr=724680267
 62   0.029520 54.230.30.56 -> 172.31.36.109 TCP 5858 [TCP segment of a reassembled PDU]
 63   0.029526 172.31.36.109 -> 54.230.30.56 TCP 66 58537 > http [ACK] Seq=97 Ack=156385 Win=247040 Len=0 TSval=36677186 TSecr=724680267
 64   0.029609 54.230.30.56 -> 172.31.36.109 TCP 2962 [TCP segment of a reassembled PDU]
 65   0.029614 172.31.36.109 -> 54.230.30.56 TCP 66 58537 > http [ACK] Seq=97 Ack=159281 Win=252800 Len=0 TSval=36677186 TSecr=724680267
 66   0.029889 54.230.30.56 -> 172.31.36.109 TCP 8754 [TCP segment of a reassembled PDU]
 67   0.029896 172.31.36.109 -> 54.230.30.56 TCP 66 58537 > http [ACK] Seq=97 Ack=167969 Win=270208 Len=0 TSval=36677186 TSecr=724680267
 68   0.029992 54.230.30.56 -> 172.31.36.109 TCP 8754 [TCP segment of a reassembled PDU]
 69   0.029999 172.31.36.109 -> 54.230.30.56 TCP 66 58537 > http [ACK] Seq=97 Ack=176657 Win=287616 Len=0 TSval=36677186 TSecr=724680267
 70   0.030399 54.230.30.56 -> 172.31.36.109 TCP 4410 [TCP segment of a reassembled PDU]
 71   0.030405 172.31.36.109 -> 54.230.30.56 TCP 66 58537 > http [ACK] Seq=97 Ack=181001 Win=296320 Len=0 TSval=36677186 TSecr=724680267
 72   0.030493 54.230.30.56 -> 172.31.36.109 TCP 5858 [TCP segment of a reassembled PDU]
 73   0.030499 172.31.36.109 -> 54.230.30.56 TCP 66 58537 > http [ACK] Seq=97 Ack=186793 Win=307840 Len=0 TSval=36677186 TSecr=724680267
 74   0.030700 54.230.30.56 -> 172.31.36.109 TCP 1514 [TCP segment of a reassembled PDU]
 75   0.030704 172.31.36.109 -> 54.230.30.56 TCP 66 58537 > http [ACK] Seq=97 Ack=188241 Win=310784 Len=0 TSval=36677186 TSecr=724680267
 76   0.030850 54.230.30.56 -> 172.31.36.109 TCP 14546 [TCP segment of a reassembled PDU]
 77   0.030869 172.31.36.109 -> 54.230.30.56 TCP 66 58537 > http [ACK] Seq=97 Ack=202721 Win=339712 Len=0 TSval=36677186 TSecr=724680267
 78   0.030936 54.230.30.56 -> 172.31.36.109 TCP 7306 [TCP segment of a reassembled PDU]
 79   0.030943 172.31.36.109 -> 54.230.30.56 TCP 66 58537 > http [ACK] Seq=97 Ack=209961 Win=354176 Len=0 TSval=36677186 TSecr=724680267
 80   0.031109 54.230.30.56 -> 172.31.36.109 TCP 2962 [TCP segment of a reassembled PDU]
 81   0.031115 172.31.36.109 -> 54.230.30.56 TCP 66 58537 > http [ACK] Seq=97 Ack=212857 Win=359936 Len=0 TSval=36677186 TSecr=724680267
 82   0.031360 54.230.30.56 -> 172.31.36.109 TCP 14546 [TCP segment of a reassembled PDU]
 83   0.031369 172.31.36.109 -> 54.230.30.56 TCP 66 58537 > http [ACK] Seq=97 Ack=227337 Win=388992 Len=0 TSval=36677186 TSecr=724680267
 84   0.031793 54.230.30.56 -> 172.31.36.109 TCP 2962 [TCP segment of a reassembled PDU]
 85   0.031798 172.31.36.109 -> 54.230.30.56 TCP 66 58537 > http [ACK] Seq=97 Ack=230233 Win=394752 Len=0 TSval=36677186 TSecr=724680267
 86   0.031936 54.230.30.56 -> 172.31.36.109 TCP 17442 [TCP segment of a reassembled PDU]
 87   0.031947 172.31.36.109 -> 54.230.30.56 TCP 66 58537 > http [ACK] Seq=97 Ack=247609 Win=429440 Len=0 TSval=36677186 TSecr=724680267
 88   0.032324 54.230.30.56 -> 172.31.36.109 TCP 5858 [TCP segment of a reassembled PDU]
 89   0.032331 172.31.36.109 -> 54.230.30.56 TCP 66 58537 > http [ACK] Seq=97 Ack=253401 Win=441088 Len=0 TSval=36677186 TSecr=724680267
 90   0.032508 54.230.30.56 -> 172.31.36.109 TCP 27578 [TCP segment of a reassembled PDU]
 91   0.032522 172.31.36.109 -> 54.230.30.56 TCP 66 58537 > http [ACK] Seq=97 Ack=280913 Win=496128 Len=0 TSval=36677186 TSecr=724680267
 92   0.032676 54.230.30.56 -> 172.31.36.109 TCP 11650 [TCP segment of a reassembled PDU]
 93   0.032685 172.31.36.109 -> 54.230.30.56 TCP 66 58537 > http [ACK] Seq=97 Ack=292497 Win=519296 Len=0 TSval=36677187 TSecr=724680267
 94   0.033330 54.230.30.56 -> 172.31.36.109 TCP 4410 [TCP segment of a reassembled PDU]
 95   0.033336 172.31.36.109 -> 54.230.30.56 TCP 66 58537 > http [ACK] Seq=97 Ack=296841 Win=528000 Len=0 TSval=36677187 TSecr=724680267
 96   0.033483 54.230.30.56 -> 172.31.36.109 TCP 18890 [TCP segment of a reassembled PDU]
 97   0.033494 172.31.36.109 -> 54.230.30.56 TCP 66 58537 > http [ACK] Seq=97 Ack=315665 Win=565632 Len=0 TSval=36677187 TSecr=724680267
 98   0.033505 54.230.30.56 -> 172.31.36.109 TCP 2962 [TCP segment of a reassembled PDU]
 99   0.033508 172.31.36.109 -> 54.230.30.56 TCP 66 58537 > http [ACK] Seq=97 Ack=318561 Win=571392 Len=0 TSval=36677187 TSecr=724680267
100   0.033583 54.230.30.56 -> 172.31.36.109 TCP 5858 [TCP segment of a reassembled PDU]
101   0.033590 172.31.36.109 -> 54.230.30.56 TCP 66 58537 > http [ACK] Seq=97 Ack=324353 Win=583040 Len=0 TSval=36677187 TSecr=724680267
102   0.033733 54.230.30.56 -> 172.31.36.109 TCP 15994 [TCP segment of a reassembled PDU]
103   0.033742 172.31.36.109 -> 54.230.30.56 TCP 66 58537 > http [ACK] Seq=97 Ack=340281 Win=614784 Len=0 TSval=36677187 TSecr=724680267
104   0.033844 54.230.30.56 -> 172.31.36.109 TCP 10202 [TCP segment of a reassembled PDU]
105   0.033852 172.31.36.109 -> 54.230.30.56 TCP 66 58537 > http [ACK] Seq=97 Ack=350417 Win=635136 Len=0 TSval=36677187 TSecr=724680267
106   0.034006 54.230.30.56 -> 172.31.36.109 TCP 4410 [TCP segment of a reassembled PDU]
107   0.034017 172.31.36.109 -> 54.230.30.56 TCP 66 58537 > http [ACK] Seq=97 Ack=354761 Win=643840 Len=0 TSval=36677187 TSecr=724680267
108   0.034026 54.230.30.56 -> 172.31.36.109 TCP 2962 [TCP segment of a reassembled PDU]
109   0.034030 172.31.36.109 -> 54.230.30.56 TCP 66 58537 > http [ACK] Seq=97 Ack=357657 Win=649600 Len=0 TSval=36677187 TSecr=724680267
110   0.034681 54.230.30.56 -> 172.31.36.109 TCP 1514 [TCP segment of a reassembled PDU]
111   0.034687 172.31.36.109 -> 54.230.30.56 TCP 66 58537 > http [ACK] Seq=97 Ack=359105 Win=652544 Len=0 TSval=36677187 TSecr=724680267
112   0.034792 54.230.30.56 -> 172.31.36.109 TCP 10202 [TCP segment of a reassembled PDU]
113   0.034800 172.31.36.109 -> 54.230.30.56 TCP 66 58537 > http [ACK] Seq=97 Ack=369241 Win=672768 Len=0 TSval=36677187 TSecr=724680267
114   0.035009 54.230.30.56 -> 172.31.36.109 TCP 20338 [TCP segment of a reassembled PDU]
115   0.035020 172.31.36.109 -> 54.230.30.56 TCP 66 58537 > http [ACK] Seq=97 Ack=389513 Win=713344 Len=0 TSval=36677187 TSecr=724680267
116   0.035120 54.230.30.56 -> 172.31.36.109 TCP 20338 [TCP segment of a reassembled PDU]
117   0.035131 172.31.36.109 -> 54.230.30.56 TCP 66 58537 > http [ACK] Seq=97 Ack=409785 Win=753792 Len=0 TSval=36677187 TSecr=724680267
118   0.035222 54.230.30.56 -> 172.31.36.109 TCP 10202 [TCP segment of a reassembled PDU]
119   0.035230 172.31.36.109 -> 54.230.30.56 TCP 66 58537 > http [ACK] Seq=97 Ack=419921 Win=774144 Len=0 TSval=36677187 TSecr=724680267
120   0.035545 54.230.30.56 -> 172.31.36.109 TCP 2962 [TCP segment of a reassembled PDU]
121   0.035551 172.31.36.109 -> 54.230.30.56 TCP 66 58537 > http [ACK] Seq=97 Ack=422817 Win=779904 Len=0 TSval=36677187 TSecr=724680267
122   0.036159 54.230.30.56 -> 172.31.36.109 TCP 2962 [TCP segment of a reassembled PDU]
123   0.036164 172.31.36.109 -> 54.230.30.56 TCP 66 58537 > http [ACK] Seq=97 Ack=425713 Win=785664 Len=0 TSval=36677187 TSecr=724680267
124   0.036423 54.230.30.56 -> 172.31.36.109 TCP 37714 [TCP segment of a reassembled PDU]
125   0.036441 172.31.36.109 -> 54.230.30.56 TCP 66 58537 > http [ACK] Seq=97 Ack=463361 Win=861056 Len=0 TSval=36677187 TSecr=724680267
126   0.036457 54.230.30.56 -> 172.31.36.109 TCP 13098 [TCP segment of a reassembled PDU]
127   0.036481 172.31.36.109 -> 54.230.30.56 TCP 66 58537 > http [ACK] Seq=97 Ack=476393 Win=848128 Len=0 TSval=36677187 TSecr=724680267
128   0.036545 54.230.30.56 -> 172.31.36.109 TCP 11650 [TCP segment of a reassembled PDU]
129   0.036554 172.31.36.109 -> 54.230.30.56 TCP 66 58537 > http [ACK] Seq=97 Ack=487977 Win=884224 Len=0 TSval=36677187 TSecr=724680267
130   0.037241 54.230.30.56 -> 172.31.36.109 TCP 1514 [TCP segment of a reassembled PDU]
131   0.037247 172.31.36.109 -> 54.230.30.56 TCP 66 58537 > http [ACK] Seq=97 Ack=489425 Win=887040 Len=0 TSval=36677188 TSecr=724680267
132   0.037493 54.230.30.56 -> 172.31.36.109 TCP 5858 [TCP segment of a reassembled PDU]
133   0.037500 172.31.36.109 -> 54.230.30.56 TCP 66 58537 > http [ACK] Seq=97 Ack=495217 Win=898688 Len=0 TSval=36677188 TSecr=724680267
134   0.037687 54.230.30.56 -> 172.31.36.109 TCP 36266 [TCP segment of a reassembled PDU]
135   0.037716 172.31.36.109 -> 54.230.30.56 TCP 66 58537 > http [ACK] Seq=97 Ack=531417 Win=868608 Len=0 TSval=36677188 TSecr=724680267
136   0.037817 54.230.30.56 -> 172.31.36.109 TCP 20338 [TCP segment of a reassembled PDU]
137   0.037828 172.31.36.109 -> 54.230.30.56 TCP 66 58537 > http [ACK] Seq=97 Ack=551689 Win=894720 Len=0 TSval=36677188 TSecr=724680267
138   0.037896 54.230.30.56 -> 172.31.36.109 TCP 1514 [TCP segment of a reassembled PDU]
139   0.037900 172.31.36.109 -> 54.230.30.56 TCP 66 58537 > http [ACK] Seq=97 Ack=553137 Win=901504 Len=0 TSval=36677188 TSecr=724680267
140   0.037906 54.230.30.56 -> 172.31.36.109 TCP 1514 [TCP segment of a reassembled PDU]
141   0.037908 172.31.36.109 -> 54.230.30.56 TCP 66 58537 > http [ACK] Seq=97 Ack=554585 Win=904448 Len=0 TSval=36677188 TSecr=724680267
142   0.038202 54.230.30.56 -> 172.31.36.109 TCP 33370 [TCP segment of a reassembled PDU]
143   0.038231 172.31.36.109 -> 54.230.30.56 TCP 66 58537 > http [ACK] Seq=97 Ack=587889 Win=873344 Len=0 TSval=36677188 TSecr=724680267
144   0.038309 54.230.30.56 -> 172.31.36.109 TCP 1514 [TCP segment of a reassembled PDU]
145   0.038314 172.31.36.109 -> 54.230.30.56 TCP 66 58537 > http [ACK] Seq=97 Ack=589337 Win=907392 Len=0 TSval=36677188 TSecr=724680267
146   0.039042 54.230.30.56 -> 172.31.36.109 TCP 2962 [TCP segment of a reassembled PDU]
147   0.039049 172.31.36.109 -> 54.230.30.56 TCP 66 58537 > http [ACK] Seq=97 Ack=592233 Win=913152 Len=0 TSval=36677188 TSecr=724680267
148   0.039170 54.230.30.56 -> 172.31.36.109 TCP 18890 [TCP segment of a reassembled PDU]
149   0.039194 172.31.36.109 -> 54.230.30.56 TCP 66 58537 > http [ACK] Seq=97 Ack=611057 Win=897152 Len=0 TSval=36677188 TSecr=724680267
150   0.039346 54.230.30.56 -> 172.31.36.109 TCP 17442 [TCP segment of a reassembled PDU]
151   0.039357 172.31.36.109 -> 54.230.30.56 TCP 66 58537 > http [ACK] Seq=97 Ack=628433 Win=899456 Len=0 TSval=36677188 TSecr=724680267
152   0.039422 54.230.30.56 -> 172.31.36.109 TCP 5858 [TCP segment of a reassembled PDU]
153   0.039429 172.31.36.109 -> 54.230.30.56 TCP 66 58537 > http [ACK] Seq=97 Ack=634225 Win=918528 Len=0 TSval=36677188 TSecr=724680267
154   0.039516 54.230.30.56 -> 172.31.36.109 TCP 5858 [TCP segment of a reassembled PDU]
155   0.039523 172.31.36.109 -> 54.230.30.56 TCP 66 58537 > http [ACK] Seq=97 Ack=640017 Win=918528 Len=0 TSval=36677188 TSecr=724680267
156   0.039600 54.230.30.56 -> 172.31.36.109 TCP 1514 [TCP segment of a reassembled PDU]
157   0.039604 172.31.36.109 -> 54.230.30.56 TCP 66 58537 > http [ACK] Seq=97 Ack=641465 Win=925696 Len=0 TSval=36677188 TSecr=724680267
158   0.039819 54.230.30.56 -> 172.31.36.109 TCP 17442 [TCP segment of a reassembled PDU]
159   0.039833 54.230.30.56 -> 172.31.36.109 TCP 7306 [TCP segment of a reassembled PDU]
160   0.039848 54.230.30.56 -> 172.31.36.109 TCP 17442 [TCP segment of a reassembled PDU]
161   0.039866 172.31.36.109 -> 54.230.30.56 TCP 66 58537 > http [ACK] Seq=97 Ack=683457 Win=883712 Len=0 TSval=36677188 TSecr=724680267
162   0.040341 54.230.30.56 -> 172.31.36.109 TCP 4410 [TCP segment of a reassembled PDU]
163   0.040348 172.31.36.109 -> 54.230.30.56 TCP 66 58537 > http [ACK] Seq=97 Ack=687801 Win=920960 Len=0 TSval=36677188 TSecr=724680268
164   0.040453 54.230.30.56 -> 172.31.36.109 TCP 5858 [TCP segment of a reassembled PDU]
165   0.040470 172.31.36.109 -> 54.230.30.56 TCP 66 58537 > http [ACK] Seq=97 Ack=693593 Win=927616 Len=0 TSval=36677188 TSecr=724680268
166   0.040746 54.230.30.56 -> 172.31.36.109 TCP 33370 [TCP segment of a reassembled PDU]
167   0.040777 172.31.36.109 -> 54.230.30.56 TCP 66 58537 > http [ACK] Seq=97 Ack=726897 Win=894336 Len=0 TSval=36677189 TSecr=724680268
168   0.040895 54.230.30.56 -> 172.31.36.109 TCP 13098 [TCP segment of a reassembled PDU]
169   0.040904 172.31.36.109 -> 54.230.30.56 TCP 66 58537 > http [ACK] Seq=97 Ack=739929 Win=906752 Len=0 TSval=36677189 TSecr=724680268
170   0.040989 54.230.30.56 -> 172.31.36.109 TCP 5858 [TCP segment of a reassembled PDU]
171   0.041023 172.31.36.109 -> 54.230.30.56 TCP 66 58537 > http [ACK] Seq=97 Ack=745721 Win=918528 Len=0 TSval=36677189 TSecr=724680268
172   0.041100 54.230.30.56 -> 172.31.36.109 TCP 10202 [TCP segment of a reassembled PDU]
173   0.041119 172.31.36.109 -> 54.230.30.56 TCP 66 58537 > http [ACK] Seq=97 Ack=755857 Win=927616 Len=0 TSval=36677189 TSecr=724680268
174   0.041205 54.230.30.56 -> 172.31.36.109 TCP 4410 [TCP segment of a reassembled PDU]
175   0.041221 172.31.36.109 -> 54.230.30.56 TCP 66 58537 > http [ACK] Seq=97 Ack=760201 Win=927616 Len=0 TSval=36677189 TSecr=724680268
176   0.041527 54.230.30.56 -> 172.31.36.109 TCP 37714 [TCP segment of a reassembled PDU]
177   0.041558 172.31.36.109 -> 54.230.30.56 TCP 66 58537 > http [ACK] Seq=97 Ack=797849 Win=889984 Len=0 TSval=36677189 TSecr=724680268
178   0.041664 54.230.30.56 -> 172.31.36.109 TCP 7306 [TCP segment of a reassembled PDU]
179   0.041684 172.31.36.109 -> 54.230.30.56 TCP 66 58537 > http [ACK] Seq=97 Ack=805089 Win=916224 Len=0 TSval=36677189 TSecr=724680268
180   0.041778 54.230.30.56 -> 172.31.36.109 TCP 8754 [TCP segment of a reassembled PDU]
181   0.041796 172.31.36.109 -> 54.230.30.56 TCP 66 58537 > http [ACK] Seq=97 Ack=813777 Win=927616 Len=0 TSval=36677189 TSecr=724680268
182   0.042159 54.230.30.56 -> 172.31.36.109 TCP 1514 [TCP segment of a reassembled PDU]
183   0.042330 54.230.30.56 -> 172.31.36.109 TCP 20338 [TCP segment of a reassembled PDU]
184   0.042352 172.31.36.109 -> 54.230.30.56 TCP 66 58537 > http [ACK] Seq=97 Ack=835497 Win=905984 Len=0 TSval=36677189 TSecr=724680268
185   0.042405 54.230.30.56 -> 172.31.36.109 TCP 10202 [TCP segment of a reassembled PDU]
186   0.042413 172.31.36.109 -> 54.230.30.56 TCP 66 58537 > http [ACK] Seq=97 Ack=845633 Win=911488 Len=0 TSval=36677189 TSecr=724680268
187   0.042508 54.230.30.56 -> 172.31.36.109 TCP 11650 [TCP segment of a reassembled PDU]
188   0.042576 172.31.36.109 -> 54.230.30.56 TCP 66 58537 > http [ACK] Seq=97 Ack=857217 Win=909056 Len=0 TSval=36677189 TSecr=724680268
189   0.042817 54.230.30.56 -> 172.31.36.109 TCP 40610 [TCP segment of a reassembled PDU]
190   0.042849 172.31.36.109 -> 54.230.30.56 TCP 66 58537 > http [ACK] Seq=97 Ack=897761 Win=868608 Len=0 TSval=36677189 TSecr=724680268
191   0.042957 54.230.30.56 -> 172.31.36.109 TCP 14546 [TCP segment of a reassembled PDU]
192   0.042966 172.31.36.109 -> 54.230.30.56 TCP 66 58537 > http [ACK] Seq=97 Ack=912241 Win=904192 Len=0 TSval=36677189 TSecr=724680268
193   0.043071 54.230.30.56 -> 172.31.36.109 TCP 7306 [TCP segment of a reassembled PDU]
194   0.043077 172.31.36.109 -> 54.230.30.56 TCP 66 58537 > http [ACK] Seq=97 Ack=919481 Win=916224 Len=0 TSval=36677189 TSecr=724680268
195   0.043192 54.230.30.56 -> 172.31.36.109 TCP 18890 [TCP segment of a reassembled PDU]
196   0.043215 172.31.36.109 -> 54.230.30.56 TCP 66 58537 > http [ACK] Seq=97 Ack=938305 Win=897408 Len=0 TSval=36677189 TSecr=724680268
197   0.043308 54.230.30.56 -> 172.31.36.109 TCP 5858 [TCP segment of a reassembled PDU]
198   0.043315 172.31.36.109 -> 54.230.30.56 TCP 66 58537 > http [ACK] Seq=97 Ack=944097 Win=918528 Len=0 TSval=36677189 TSecr=724680268
199   0.043671 54.230.30.56 -> 172.31.36.109 TCP 5858 [TCP segment of a reassembled PDU]
200   0.043678 172.31.36.109 -> 54.230.30.56 TCP 66 58537 > http [ACK] Seq=97 Ack=949889 Win=918528 Len=0 TSval=36677189 TSecr=724680268
201   0.043793 54.230.30.56 -> 172.31.36.109 TCP 8754 [TCP segment of a reassembled PDU]
202   0.043811 172.31.36.109 -> 54.230.30.56 TCP 66 58537 > http [ACK] Seq=97 Ack=958577 Win=927616 Len=0 TSval=36677189 TSecr=724680268
203   0.043898 54.230.30.56 -> 172.31.36.109 TCP 4410 [TCP segment of a reassembled PDU]
204   0.043913 172.31.36.109 -> 54.230.30.56 TCP 66 58537 > http [ACK] Seq=97 Ack=962921 Win=927616 Len=0 TSval=36677189 TSecr=724680268
205   0.044113 54.230.30.56 -> 172.31.36.109 TCP 31922 [TCP segment of a reassembled PDU]
206   0.044142 172.31.36.109 -> 54.230.30.56 TCP 66 58537 > http [ACK] Seq=97 Ack=994777 Win=895872 Len=0 TSval=36677189 TSecr=724680268
207   0.044157 54.230.30.56 -> 172.31.36.109 TCP 8754 [TCP segment of a reassembled PDU]
208   0.044176 172.31.36.109 -> 54.230.30.56 TCP 66 58537 > http [ACK] Seq=97 Ack=1003465 Win=913792 Len=0 TSval=36677189 TSecr=724680268
209   0.044276 54.230.30.56 -> 172.31.36.109 TCP 8754 [TCP segment of a reassembled PDU]
210   0.044284 172.31.36.109 -> 54.230.30.56 TCP 66 58537 > http [ACK] Seq=97 Ack=1012153 Win=913792 Len=0 TSval=36677189 TSecr=724680268
211   0.044599 54.230.30.56 -> 172.31.36.109 HTTP 36947 HTTP/1.1 200 OK  (application/octet-stream)
212   0.044632 172.31.36.109 -> 54.230.30.56 TCP 66 58537 > http [ACK] Seq=97 Ack=1049034 Win=927616 Len=0 TSval=36677190 TSecr=724680268
213   0.044773 172.31.36.109 -> 54.230.30.56 TCP 66 58537 > http [FIN, ACK] Seq=97 Ack=1049034 Win=927616 Len=0 TSval=36677190 TSecr=724680268
214   0.045957 54.230.30.56 -> 172.31.36.109 TCP 66 http > 58537 [FIN, ACK] Seq=1049034 Ack=98 Win=14592 Len=0 TSval=724680268 TSecr=36677190
215   0.045967 172.31.36.109 -> 54.230.30.56 TCP 66 58537 > http [ACK] Seq=98 Ack=1049035 Win=927616 Len=0 TSval=36677190 TSecr=724680268
