[Measurement for 1mb at 08:30:23 20.30.2014] 
Tshark:

  1   0.000000 172.31.36.109 -> 172.31.0.2   DNS 89 Standard query 0x4186  A d39wppo36gwqpx.cloudfront.net
  2   0.000045 172.31.36.109 -> 172.31.0.2   DNS 89 Standard query 0x94ef  AAAA d39wppo36gwqpx.cloudfront.net
  3   0.000678   172.31.0.2 -> 172.31.36.109 DNS 170 Standard query response 0x94ef 
  4   0.000730   172.31.0.2 -> 172.31.36.109 DNS 217 Standard query response 0x4186  A 54.230.30.221 A 54.230.30.226 A 54.230.30.245 A 54.192.29.221 A 54.230.30.2 A 54.230.30.37 A 54.230.30.54 A 54.230.30.217
  5   0.003894 172.31.36.109 -> 54.230.30.221 TCP 74 58399 > http [SYN] Seq=0 Win=26883 Len=0 MSS=8961 SACK_PERM=1 TSval=33977400 TSecr=0 WS=128
  6   0.005210 54.230.30.221 -> 172.31.36.109 TCP 74 http > 58399 [SYN, ACK] Seq=0 Ack=1 Win=14480 Len=0 MSS=1460 SACK_PERM=1 TSval=648002450 TSecr=33977400 WS=128
  7   0.005224 172.31.36.109 -> 54.230.30.221 TCP 66 58399 > http [ACK] Seq=1 Ack=1 Win=27008 Len=0 TSval=33977400 TSecr=648002450
  8   0.005277 172.31.36.109 -> 54.230.30.221 HTTP 162 GET /1mb HTTP/1.1 
  9   0.006398 54.230.30.221 -> 172.31.36.109 TCP 66 http > 58399 [ACK] Seq=1 Ack=97 Win=14592 Len=0 TSval=648002450 TSecr=33977400
 10   0.021630 54.230.30.221 -> 172.31.36.109 TCP 14546 [TCP segment of a reassembled PDU]
 11   0.021644 172.31.36.109 -> 54.230.30.221 TCP 66 58399 > http [ACK] Seq=97 Ack=14481 Win=55936 Len=0 TSval=33977404 TSecr=648002452
 12   0.022923 54.230.30.221 -> 172.31.36.109 TCP 13098 [TCP segment of a reassembled PDU]
 13   0.022933 172.31.36.109 -> 54.230.30.221 TCP 66 58399 > http [ACK] Seq=97 Ack=27513 Win=81920 Len=0 TSval=33977405 TSecr=648002452
 14   0.024117 54.230.30.221 -> 172.31.36.109 TCP 2962 [TCP segment of a reassembled PDU]
 15   0.024124 172.31.36.109 -> 54.230.30.221 TCP 66 58399 > http [ACK] Seq=97 Ack=30409 Win=87808 Len=0 TSval=33977405 TSecr=648002452
 16   0.024166 54.230.30.221 -> 172.31.36.109 TCP 10202 [TCP segment of a reassembled PDU]
 17   0.024173 172.31.36.109 -> 54.230.30.221 TCP 66 58399 > http [ACK] Seq=97 Ack=40545 Win=101248 Len=0 TSval=33977405 TSecr=648002452
 18   0.025137 54.230.30.221 -> 172.31.36.109 TCP 7306 [TCP segment of a reassembled PDU]
 19   0.025143 172.31.36.109 -> 54.230.30.221 TCP 66 58399 > http [ACK] Seq=97 Ack=47785 Win=105984 Len=0 TSval=33977405 TSecr=648002452
 20   0.025376 54.230.30.221 -> 172.31.36.109 TCP 2962 [TCP segment of a reassembled PDU]
 21   0.025382 172.31.36.109 -> 54.230.30.221 TCP 66 58399 > http [ACK] Seq=97 Ack=50681 Win=113792 Len=0 TSval=33977405 TSecr=648002452
 22   0.025441 54.230.30.221 -> 172.31.36.109 TCP 5858 [TCP segment of a reassembled PDU]
 23   0.025447 172.31.36.109 -> 54.230.30.221 TCP 66 58399 > http [ACK] Seq=97 Ack=56473 Win=125440 Len=0 TSval=33977405 TSecr=648002452
 24   0.025499 54.230.30.221 -> 172.31.36.109 TCP 4410 [TCP segment of a reassembled PDU]
 25   0.025504 172.31.36.109 -> 54.230.30.221 TCP 66 58399 > http [ACK] Seq=97 Ack=60817 Win=134144 Len=0 TSval=33977405 TSecr=648002452
 26   0.026168 54.230.30.221 -> 172.31.36.109 TCP 5858 [TCP segment of a reassembled PDU]
 27   0.026175 172.31.36.109 -> 54.230.30.221 TCP 66 58399 > http [ACK] Seq=97 Ack=66609 Win=145664 Len=0 TSval=33977405 TSecr=648002452
 28   0.026724 54.230.30.221 -> 172.31.36.109 TCP 10202 [TCP segment of a reassembled PDU]
 29   0.026744 172.31.36.109 -> 54.230.30.221 TCP 66 58399 > http [ACK] Seq=97 Ack=76745 Win=166016 Len=0 TSval=33977405 TSecr=648002452
 30   0.026752 54.230.30.221 -> 172.31.36.109 TCP 2962 [TCP segment of a reassembled PDU]
 31   0.026756 172.31.36.109 -> 54.230.30.221 TCP 66 58399 > http [ACK] Seq=97 Ack=79641 Win=171776 Len=0 TSval=33977405 TSecr=648002452
 32   0.027520 54.230.30.221 -> 172.31.36.109 TCP 7306 [TCP segment of a reassembled PDU]
 33   0.027527 172.31.36.109 -> 54.230.30.221 TCP 66 58399 > http [ACK] Seq=97 Ack=86881 Win=186240 Len=0 TSval=33977406 TSecr=648002452
 34   0.027564 54.230.30.221 -> 172.31.36.109 TCP 7306 [TCP segment of a reassembled PDU]
 35   0.027571 172.31.36.109 -> 54.230.30.221 TCP 66 58399 > http [ACK] Seq=97 Ack=94121 Win=195328 Len=0 TSval=33977406 TSecr=648002452
 36   0.027971 54.230.30.221 -> 172.31.36.109 TCP 2962 [TCP segment of a reassembled PDU]
 37   0.027978 172.31.36.109 -> 54.230.30.221 TCP 66 58399 > http [ACK] Seq=97 Ack=97017 Win=202496 Len=0 TSval=33977406 TSecr=648002452
 38   0.028127 54.230.30.221 -> 172.31.36.109 TCP 10202 [TCP segment of a reassembled PDU]
 39   0.028145 172.31.36.109 -> 54.230.30.221 TCP 66 58399 > http [ACK] Seq=97 Ack=107153 Win=192384 Len=0 TSval=33977406 TSecr=648002452
 40   0.028743 54.230.30.221 -> 172.31.36.109 TCP 5858 [TCP segment of a reassembled PDU]
 41   0.028749 172.31.36.109 -> 54.230.30.221 TCP 66 58399 > http [ACK] Seq=97 Ack=112945 Win=197760 Len=0 TSval=33977406 TSecr=648002452
 42   0.028865 54.230.30.221 -> 172.31.36.109 TCP 5858 [TCP segment of a reassembled PDU]
 43   0.028871 172.31.36.109 -> 54.230.30.221 TCP 66 58399 > http [ACK] Seq=97 Ack=118737 Win=197760 Len=0 TSval=33977406 TSecr=648002452
 44   0.029242 54.230.30.221 -> 172.31.36.109 TCP 1514 [TCP segment of a reassembled PDU]
 45   0.029247 172.31.36.109 -> 54.230.30.221 TCP 66 58399 > http [ACK] Seq=97 Ack=120185 Win=204800 Len=0 TSval=33977406 TSecr=648002452
 46   0.029372 54.230.30.221 -> 172.31.36.109 TCP 14546 [TCP segment of a reassembled PDU]
 47   0.029382 172.31.36.109 -> 54.230.30.221 TCP 66 58399 > http [ACK] Seq=97 Ack=134665 Win=190336 Len=0 TSval=33977406 TSecr=648002452
 48   0.030007 54.230.30.221 -> 172.31.36.109 TCP 1514 [TCP segment of a reassembled PDU]
 49   0.030012 172.31.36.109 -> 54.230.30.221 TCP 66 58399 > http [ACK] Seq=97 Ack=136113 Win=204800 Len=0 TSval=33977406 TSecr=648002453
 50   0.030131 54.230.30.221 -> 172.31.36.109 TCP 13098 [TCP segment of a reassembled PDU]
 51   0.030151 172.31.36.109 -> 54.230.30.221 TCP 66 58399 > http [ACK] Seq=97 Ack=149145 Win=206464 Len=0 TSval=33977406 TSecr=648002453
 52   0.030229 54.230.30.221 -> 172.31.36.109 TCP 1514 [TCP segment of a reassembled PDU]
 53   0.030485 54.230.30.221 -> 172.31.36.109 TCP 1514 [TCP segment of a reassembled PDU]
 54   0.030499 172.31.36.109 -> 54.230.30.221 TCP 66 58399 > http [ACK] Seq=97 Ack=152041 Win=206464 Len=0 TSval=33977406 TSecr=648002453
 55   0.030600 54.230.30.221 -> 172.31.36.109 TCP 15994 [TCP segment of a reassembled PDU]
 56   0.030622 172.31.36.109 -> 54.230.30.221 TCP 66 58399 > http [ACK] Seq=97 Ack=167969 Win=206464 Len=0 TSval=33977406 TSecr=648002453
 57   0.030673 54.230.30.221 -> 172.31.36.109 TCP 8754 [TCP segment of a reassembled PDU]
 58   0.030692 172.31.36.109 -> 54.230.30.221 TCP 66 58399 > http [ACK] Seq=97 Ack=176657 Win=206464 Len=0 TSval=33977406 TSecr=648002453
 59   0.031266 54.230.30.221 -> 172.31.36.109 TCP 2962 [TCP segment of a reassembled PDU]
 60   0.031282 172.31.36.109 -> 54.230.30.221 TCP 66 58399 > http [ACK] Seq=97 Ack=179553 Win=206464 Len=0 TSval=33977407 TSecr=648002453
 61   0.031372 54.230.30.221 -> 172.31.36.109 TCP 10202 [TCP segment of a reassembled PDU]
 62   0.031379 172.31.36.109 -> 54.230.30.221 TCP 66 58399 > http [ACK] Seq=97 Ack=189689 Win=226816 Len=0 TSval=33977407 TSecr=648002453
 63   0.031821 54.230.30.221 -> 172.31.36.109 TCP 4410 [TCP segment of a reassembled PDU]
 64   0.031826 172.31.36.109 -> 54.230.30.221 TCP 66 58399 > http [ACK] Seq=97 Ack=194033 Win=235520 Len=0 TSval=33977407 TSecr=648002453
 65   0.031958 54.230.30.221 -> 172.31.36.109 TCP 18890 [TCP segment of a reassembled PDU]
 66   0.031969 172.31.36.109 -> 54.230.30.221 TCP 66 58399 > http [ACK] Seq=97 Ack=212857 Win=273152 Len=0 TSval=33977407 TSecr=648002453
 67   0.032040 54.230.30.221 -> 172.31.36.109 TCP 2962 [TCP segment of a reassembled PDU]
 68   0.032045 172.31.36.109 -> 54.230.30.221 TCP 66 58399 > http [ACK] Seq=97 Ack=215753 Win=278912 Len=0 TSval=33977407 TSecr=648002453
 69   0.032538 54.230.30.221 -> 172.31.36.109 TCP 4410 [TCP segment of a reassembled PDU]
 70   0.032543 172.31.36.109 -> 54.230.30.221 TCP 66 58399 > http [ACK] Seq=97 Ack=220097 Win=287616 Len=0 TSval=33977407 TSecr=648002453
 71   0.032654 54.230.30.221 -> 172.31.36.109 TCP 10202 [TCP segment of a reassembled PDU]
 72   0.032661 172.31.36.109 -> 54.230.30.221 TCP 66 58399 > http [ACK] Seq=97 Ack=230233 Win=307840 Len=0 TSval=33977407 TSecr=648002453
 73   0.033341 54.230.30.221 -> 172.31.36.109 TCP 5858 [TCP segment of a reassembled PDU]
 74   0.033347 172.31.36.109 -> 54.230.30.221 TCP 66 58399 > http [ACK] Seq=97 Ack=236025 Win=319488 Len=0 TSval=33977407 TSecr=648002453
 75   0.033525 54.230.30.221 -> 172.31.36.109 TCP 31922 [TCP segment of a reassembled PDU]
 76   0.033540 172.31.36.109 -> 54.230.30.221 TCP 66 58399 > http [ACK] Seq=97 Ack=267881 Win=383104 Len=0 TSval=33977407 TSecr=648002453
 77   0.033851 54.230.30.221 -> 172.31.36.109 TCP 2962 [TCP segment of a reassembled PDU]
 78   0.033857 172.31.36.109 -> 54.230.30.221 TCP 66 58399 > http [ACK] Seq=97 Ack=270777 Win=388992 Len=0 TSval=33977407 TSecr=648002453
 79   0.034003 54.230.30.221 -> 172.31.36.109 TCP 18890 [TCP segment of a reassembled PDU]
 80   0.034013 172.31.36.109 -> 54.230.30.221 TCP 66 58399 > http [ACK] Seq=97 Ack=289601 Win=426624 Len=0 TSval=33977407 TSecr=648002453
 81   0.034333 54.230.30.221 -> 172.31.36.109 TCP 1514 [TCP segment of a reassembled PDU]
 82   0.034338 172.31.36.109 -> 54.230.30.221 TCP 66 58399 > http [ACK] Seq=97 Ack=291049 Win=429440 Len=0 TSval=33977407 TSecr=648002453
 83   0.034465 54.230.30.221 -> 172.31.36.109 TCP 4410 [TCP segment of a reassembled PDU]
 84   0.034470 172.31.36.109 -> 54.230.30.221 TCP 66 58399 > http [ACK] Seq=97 Ack=295393 Win=438144 Len=0 TSval=33977407 TSecr=648002453
 85   0.034868 54.230.30.221 -> 172.31.36.109 TCP 1514 [TCP segment of a reassembled PDU]
 86   0.034872 172.31.36.109 -> 54.230.30.221 TCP 66 58399 > http [ACK] Seq=97 Ack=296841 Win=441088 Len=0 TSval=33977408 TSecr=648002453
 87   0.035039 54.230.30.221 -> 172.31.36.109 TCP 24682 [TCP segment of a reassembled PDU]
 88   0.035053 172.31.36.109 -> 54.230.30.221 TCP 66 58399 > http [ACK] Seq=97 Ack=321457 Win=490368 Len=0 TSval=33977408 TSecr=648002453
 89   0.035105 54.230.30.221 -> 172.31.36.109 TCP 10202 [TCP segment of a reassembled PDU]
 90   0.035113 172.31.36.109 -> 54.230.30.221 TCP 66 58399 > http [ACK] Seq=97 Ack=331593 Win=510592 Len=0 TSval=33977408 TSecr=648002453
 91   0.035227 54.230.30.221 -> 172.31.36.109 TCP 17442 [TCP segment of a reassembled PDU]
 92   0.035238 172.31.36.109 -> 54.230.30.221 TCP 66 58399 > http [ACK] Seq=97 Ack=348969 Win=545280 Len=0 TSval=33977408 TSecr=648002453
 93   0.035289 54.230.30.221 -> 172.31.36.109 TCP 4410 [TCP segment of a reassembled PDU]
 94   0.035294 172.31.36.109 -> 54.230.30.221 TCP 66 58399 > http [ACK] Seq=97 Ack=353313 Win=553984 Len=0 TSval=33977408 TSecr=648002453
 95   0.035478 54.230.30.221 -> 172.31.36.109 TCP 1514 [TCP segment of a reassembled PDU]
 96   0.035483 172.31.36.109 -> 54.230.30.221 TCP 66 58399 > http [ACK] Seq=97 Ack=354761 Win=556928 Len=0 TSval=33977408 TSecr=648002453
 97   0.035862 54.230.30.221 -> 172.31.36.109 TCP 2962 [TCP segment of a reassembled PDU]
 98   0.035867 172.31.36.109 -> 54.230.30.221 TCP 66 58399 > http [ACK] Seq=97 Ack=357657 Win=562688 Len=0 TSval=33977408 TSecr=648002453
 99   0.035952 54.230.30.221 -> 172.31.36.109 TCP 2962 [TCP segment of a reassembled PDU]
100   0.035957 172.31.36.109 -> 54.230.30.221 TCP 66 58399 > http [ACK] Seq=97 Ack=360553 Win=568448 Len=0 TSval=33977408 TSecr=648002453
101   0.036381 54.230.30.221 -> 172.31.36.109 TCP 1514 [TCP segment of a reassembled PDU]
102   0.036385 172.31.36.109 -> 54.230.30.221 TCP 66 58399 > http [ACK] Seq=97 Ack=362001 Win=571392 Len=0 TSval=33977408 TSecr=648002453
103   0.036568 54.230.30.221 -> 172.31.36.109 TCP 30474 [TCP segment of a reassembled PDU]
104   0.036583 172.31.36.109 -> 54.230.30.221 TCP 66 58399 > http [ACK] Seq=97 Ack=392409 Win=632192 Len=0 TSval=33977408 TSecr=648002453
105   0.036676 54.230.30.221 -> 172.31.36.109 TCP 4410 [TCP segment of a reassembled PDU]
106   0.036819 54.230.30.221 -> 172.31.36.109 TCP 26130 [TCP segment of a reassembled PDU]
107   0.036864 172.31.36.109 -> 54.230.30.221 TCP 66 58399 > http [ACK] Seq=97 Ack=422817 Win=601856 Len=0 TSval=33977408 TSecr=648002453
108   0.037058 54.230.30.221 -> 172.31.36.109 TCP 2962 [TCP segment of a reassembled PDU]
109   0.037063 172.31.36.109 -> 54.230.30.221 TCP 66 58399 > http [ACK] Seq=97 Ack=425713 Win=637952 Len=0 TSval=33977408 TSecr=648002453
110   0.037710 54.230.30.221 -> 172.31.36.109 TCP 4410 [TCP segment of a reassembled PDU]
111   0.037715 172.31.36.109 -> 54.230.30.221 TCP 66 58399 > http [ACK] Seq=97 Ack=430057 Win=646656 Len=0 TSval=33977408 TSecr=648002453
112   0.037805 54.230.30.221 -> 172.31.36.109 TCP 1514 [TCP segment of a reassembled PDU]
113   0.037809 172.31.36.109 -> 54.230.30.221 TCP 66 58399 > http [ACK] Seq=97 Ack=431505 Win=649600 Len=0 TSval=33977408 TSecr=648002453
114   0.037949 54.230.30.221 -> 172.31.36.109 TCP 15994 [TCP segment of a reassembled PDU]
115   0.037958 172.31.36.109 -> 54.230.30.221 TCP 66 58399 > http [ACK] Seq=97 Ack=447433 Win=658560 Len=0 TSval=33977408 TSecr=648002453
116   0.038061 54.230.30.221 -> 172.31.36.109 TCP 17442 [TCP segment of a reassembled PDU]
117   0.038082 172.31.36.109 -> 54.230.30.221 TCP 66 58399 > http [ACK] Seq=97 Ack=464809 Win=656128 Len=0 TSval=33977408 TSecr=648002453
118   0.038240 54.230.30.221 -> 172.31.36.109 TCP 14546 [TCP segment of a reassembled PDU]
119   0.038249 172.31.36.109 -> 54.230.30.221 TCP 66 58399 > http [ACK] Seq=97 Ack=479289 Win=660864 Len=0 TSval=33977408 TSecr=648002453
120   0.038339 54.230.30.221 -> 172.31.36.109 TCP 11650 [TCP segment of a reassembled PDU]
121   0.038347 172.31.36.109 -> 54.230.30.221 TCP 66 58399 > http [ACK] Seq=97 Ack=490873 Win=665728 Len=0 TSval=33977408 TSecr=648002453
122   0.039174 54.230.30.221 -> 172.31.36.109 TCP 2962 [TCP segment of a reassembled PDU]
123   0.039180 172.31.36.109 -> 54.230.30.221 TCP 66 58399 > http [ACK] Seq=97 Ack=493769 Win=679936 Len=0 TSval=33977409 TSecr=648002453
124   0.039439 54.230.30.221 -> 172.31.36.109 TCP 37714 [TCP segment of a reassembled PDU]
125   0.039456 172.31.36.109 -> 54.230.30.221 TCP 66 58399 > http [ACK] Seq=97 Ack=531417 Win=756736 Len=0 TSval=33977409 TSecr=648002453
126   0.039558 54.230.30.221 -> 172.31.36.109 TCP 20338 [TCP segment of a reassembled PDU]
127   0.039569 172.31.36.109 -> 54.230.30.221 TCP 66 58399 > http [ACK] Seq=97 Ack=551689 Win=797312 Len=0 TSval=33977409 TSecr=648002453
128   0.039738 54.230.30.221 -> 172.31.36.109 TCP 4410 [TCP segment of a reassembled PDU]
129   0.039744 172.31.36.109 -> 54.230.30.221 TCP 66 58399 > http [ACK] Seq=97 Ack=556033 Win=806016 Len=0 TSval=33977409 TSecr=648002453
130   0.040453 54.230.30.221 -> 172.31.36.109 TCP 2962 [TCP segment of a reassembled PDU]
131   0.040458 172.31.36.109 -> 54.230.30.221 TCP 66 58399 > http [ACK] Seq=97 Ack=558929 Win=811776 Len=0 TSval=33977409 TSecr=648002454
132   0.040653 54.230.30.221 -> 172.31.36.109 TCP 29026 [TCP segment of a reassembled PDU]
133   0.040668 172.31.36.109 -> 54.230.30.221 TCP 66 58399 > http [ACK] Seq=97 Ack=587889 Win=869632 Len=0 TSval=33977409 TSecr=648002454
134   0.040756 54.230.30.221 -> 172.31.36.109 TCP 1514 [TCP segment of a reassembled PDU]
135   0.040761 172.31.36.109 -> 54.230.30.221 TCP 66 58399 > http [ACK] Seq=97 Ack=589337 Win=872576 Len=0 TSval=33977409 TSecr=648002454
136   0.040904 54.230.30.221 -> 172.31.36.109 TCP 11650 [TCP segment of a reassembled PDU]
137   0.040912 172.31.36.109 -> 54.230.30.221 TCP 66 58399 > http [ACK] Seq=97 Ack=600921 Win=895744 Len=0 TSval=33977409 TSecr=648002454
138   0.041019 54.230.30.221 -> 172.31.36.109 TCP 5858 [TCP segment of a reassembled PDU]
139   0.041025 172.31.36.109 -> 54.230.30.221 TCP 66 58399 > http [ACK] Seq=97 Ack=606713 Win=907392 Len=0 TSval=33977409 TSecr=648002454
140   0.041187 54.230.30.221 -> 172.31.36.109 TCP 14546 [TCP segment of a reassembled PDU]
141   0.041195 172.31.36.109 -> 54.230.30.221 TCP 66 58399 > http [ACK] Seq=97 Ack=621193 Win=936320 Len=0 TSval=33977409 TSecr=648002454
142   0.041207 54.230.30.221 -> 172.31.36.109 TCP 10202 [TCP segment of a reassembled PDU]
143   0.041213 172.31.36.109 -> 54.230.30.221 TCP 66 58399 > http [ACK] Seq=97 Ack=631329 Win=956544 Len=0 TSval=33977409 TSecr=648002454
144   0.041356 54.230.30.221 -> 172.31.36.109 TCP 21786 [TCP segment of a reassembled PDU]
145   0.041368 172.31.36.109 -> 54.230.30.221 TCP 66 58399 > http [ACK] Seq=97 Ack=653049 Win=1000064 Len=0 TSval=33977409 TSecr=648002454
146   0.041412 54.230.30.221 -> 172.31.36.109 TCP 2962 [TCP segment of a reassembled PDU]
147   0.041417 172.31.36.109 -> 54.230.30.221 TCP 66 58399 > http [ACK] Seq=97 Ack=655945 Win=1005824 Len=0 TSval=33977409 TSecr=648002454
148   0.041728 54.230.30.221 -> 172.31.36.109 TCP 1514 [TCP segment of a reassembled PDU]
149   0.041734 172.31.36.109 -> 54.230.30.221 TCP 66 58399 > http [ACK] Seq=97 Ack=657393 Win=1008640 Len=0 TSval=33977409 TSecr=648002454
150   0.041918 54.230.30.221 -> 172.31.36.109 TCP 29026 [TCP segment of a reassembled PDU]
151   0.041932 172.31.36.109 -> 54.230.30.221 TCP 66 58399 > http [ACK] Seq=97 Ack=686353 Win=1033600 Len=0 TSval=33977409 TSecr=648002454
152   0.042264 54.230.30.221 -> 172.31.36.109 TCP 5858 [TCP segment of a reassembled PDU]
153   0.042270 172.31.36.109 -> 54.230.30.221 TCP 66 58399 > http [ACK] Seq=97 Ack=692145 Win=1071744 Len=0 TSval=33977409 TSecr=648002454
154   0.042387 54.230.30.221 -> 172.31.36.109 TCP 13098 [TCP segment of a reassembled PDU]
155   0.042407 172.31.36.109 -> 54.230.30.221 TCP 66 58399 > http [ACK] Seq=97 Ack=705177 Win=1074176 Len=0 TSval=33977409 TSecr=648002454
156   0.042628 54.230.30.221 -> 172.31.36.109 TCP 15994 [TCP segment of a reassembled PDU]
157   0.042650 172.31.36.109 -> 54.230.30.221 TCP 66 58399 > http [ACK] Seq=97 Ack=721105 Win=1074176 Len=0 TSval=33977409 TSecr=648002454
158   0.042733 54.230.30.221 -> 172.31.36.109 TCP 8754 [TCP segment of a reassembled PDU]
159   0.042751 172.31.36.109 -> 54.230.30.221 TCP 66 58399 > http [ACK] Seq=97 Ack=729793 Win=1074176 Len=0 TSval=33977410 TSecr=648002454
160   0.042851 54.230.30.221 -> 172.31.36.109 TCP 18890 [TCP segment of a reassembled PDU]
161   0.042874 172.31.36.109 -> 54.230.30.221 TCP 66 58399 > http [ACK] Seq=97 Ack=748617 Win=1055360 Len=0 TSval=33977410 TSecr=648002454
162   0.042926 54.230.30.221 -> 172.31.36.109 TCP 2962 [TCP segment of a reassembled PDU]
163   0.042930 172.31.36.109 -> 54.230.30.221 TCP 66 58399 > http [ACK] Seq=97 Ack=751513 Win=1074176 Len=0 TSval=33977410 TSecr=648002454
164   0.043158 54.230.30.221 -> 172.31.36.109 TCP 1514 [TCP segment of a reassembled PDU]
165   0.043335 54.230.30.221 -> 172.31.36.109 TCP 2962 [TCP segment of a reassembled PDU]
166   0.043340 172.31.36.109 -> 54.230.30.221 TCP 66 58399 > http [ACK] Seq=97 Ack=755857 Win=1074176 Len=0 TSval=33977410 TSecr=648002454
167   0.043578 54.230.30.221 -> 172.31.36.109 TCP 40610 [TCP segment of a reassembled PDU]
168   0.043604 54.230.30.221 -> 172.31.36.109 TCP 11650 [TCP segment of a reassembled PDU]
169   0.043623 172.31.36.109 -> 54.230.30.221 TCP 66 58399 > http [ACK] Seq=97 Ack=807985 Win=1022080 Len=0 TSval=33977410 TSecr=648002454
170   0.043656 54.230.30.221 -> 172.31.36.109 TCP 4410 [TCP segment of a reassembled PDU]
171   0.043660 172.31.36.109 -> 54.230.30.221 TCP 66 58399 > http [ACK] Seq=97 Ack=812329 Win=1074048 Len=0 TSval=33977410 TSecr=648002454
172   0.043867 54.230.30.221 -> 172.31.36.109 TCP 4410 [TCP segment of a reassembled PDU]
173   0.043873 172.31.36.109 -> 54.230.30.221 TCP 66 58399 > http [ACK] Seq=97 Ack=816673 Win=1074048 Len=0 TSval=33977410 TSecr=648002454
174   0.044092 54.230.30.221 -> 172.31.36.109 TCP 7306 [TCP segment of a reassembled PDU]
175   0.044108 172.31.36.109 -> 54.230.30.221 TCP 66 58399 > http [ACK] Seq=97 Ack=823913 Win=1074176 Len=0 TSval=33977410 TSecr=648002454
176   0.044250 54.230.30.221 -> 172.31.36.109 TCP 17442 [TCP segment of a reassembled PDU]
177   0.044271 172.31.36.109 -> 54.230.30.221 TCP 66 58399 > http [ACK] Seq=97 Ack=841289 Win=1056896 Len=0 TSval=33977410 TSecr=648002454
178   0.044343 54.230.30.221 -> 172.31.36.109 TCP 2962 [TCP segment of a reassembled PDU]
179   0.044348 172.31.36.109 -> 54.230.30.221 TCP 66 58399 > http [ACK] Seq=97 Ack=844185 Win=1074176 Len=0 TSval=33977410 TSecr=648002454
180   0.044507 54.230.30.221 -> 172.31.36.109 TCP 26130 [TCP segment of a reassembled PDU]
181   0.044532 172.31.36.109 -> 54.230.30.221 TCP 66 58399 > http [ACK] Seq=97 Ack=870249 Win=1048192 Len=0 TSval=33977410 TSecr=648002454
182   0.044555 54.230.30.221 -> 172.31.36.109 TCP 7306 [TCP segment of a reassembled PDU]
183   0.044560 172.31.36.109 -> 54.230.30.221 TCP 66 58399 > http [ACK] Seq=97 Ack=877489 Win=1069312 Len=0 TSval=33977410 TSecr=648002454
184   0.044673 54.230.30.221 -> 172.31.36.109 TCP 4410 [TCP segment of a reassembled PDU]
185   0.044680 172.31.36.109 -> 54.230.30.221 TCP 66 58399 > http [ACK] Seq=97 Ack=881833 Win=1074048 Len=0 TSval=33977410 TSecr=648002454
186   0.044948 54.230.30.221 -> 172.31.36.109 TCP 21786 [TCP segment of a reassembled PDU]
187   0.044979 172.31.36.109 -> 54.230.30.221 TCP 66 58399 > http [ACK] Seq=97 Ack=903553 Win=1052416 Len=0 TSval=33977410 TSecr=648002454
188   0.045063 54.230.30.221 -> 172.31.36.109 TCP 11650 [TCP segment of a reassembled PDU]
189   0.045071 172.31.36.109 -> 54.230.30.221 TCP 66 58399 > http [ACK] Seq=97 Ack=915137 Win=1062272 Len=0 TSval=33977410 TSecr=648002454
190   0.045189 54.230.30.221 -> 172.31.36.109 TCP 17442 [TCP segment of a reassembled PDU]
191   0.045211 54.230.30.221 -> 172.31.36.109 TCP 2962 [TCP segment of a reassembled PDU]
192   0.045219 172.31.36.109 -> 54.230.30.221 TCP 66 58399 > http [ACK] Seq=97 Ack=935409 Win=1047808 Len=0 TSval=33977410 TSecr=648002454
193   0.045415 54.230.30.221 -> 172.31.36.109 TCP 11650 [TCP segment of a reassembled PDU]
194   0.045423 172.31.36.109 -> 54.230.30.221 TCP 66 58399 > http [ACK] Seq=97 Ack=946993 Win=1062272 Len=0 TSval=33977410 TSecr=648002454
195   0.045858 54.230.30.221 -> 172.31.36.109 TCP 4410 [TCP segment of a reassembled PDU]
196   0.045864 172.31.36.109 -> 54.230.30.221 TCP 66 58399 > http [ACK] Seq=97 Ack=951337 Win=1074048 Len=0 TSval=33977410 TSecr=648002454
197   0.046055 54.230.30.221 -> 172.31.36.109 TCP 29026 [TCP segment of a reassembled PDU]
198   0.046082 172.31.36.109 -> 54.230.30.221 TCP 66 58399 > http [ACK] Seq=97 Ack=980297 Win=1045120 Len=0 TSval=33977410 TSecr=648002454
199   0.046126 54.230.30.221 -> 172.31.36.109 TCP 4410 [TCP segment of a reassembled PDU]
200   0.046131 172.31.36.109 -> 54.230.30.221 TCP 66 58399 > http [ACK] Seq=97 Ack=984641 Win=1074048 Len=0 TSval=33977410 TSecr=648002454
201   0.046304 54.230.30.221 -> 172.31.36.109 TCP 27578 [TCP segment of a reassembled PDU]
202   0.046343 172.31.36.109 -> 54.230.30.221 TCP 66 58399 > http [ACK] Seq=97 Ack=1012153 Win=1046656 Len=0 TSval=33977410 TSecr=648002454
203   0.046667 54.230.30.221 -> 172.31.36.109 TCP 4410 [TCP segment of a reassembled PDU]
204   0.046672 172.31.36.109 -> 54.230.30.221 TCP 66 58399 > http [ACK] Seq=97 Ack=1016497 Win=1074048 Len=0 TSval=33977410 TSecr=648002454
205   0.046862 54.230.30.221 -> 172.31.36.109 TCP 26130 [TCP segment of a reassembled PDU]
206   0.046888 172.31.36.109 -> 54.230.30.221 TCP 66 58399 > http [ACK] Seq=97 Ack=1042561 Win=1074176 Len=0 TSval=33977411 TSecr=648002454
207   0.046910 54.230.30.221 -> 172.31.36.109 HTTP 6539 HTTP/1.1 200 OK  (application/octet-stream)
208   0.046918 172.31.36.109 -> 54.230.30.221 TCP 66 58399 > http [ACK] Seq=97 Ack=1049034 Win=1087104 Len=0 TSval=33977411 TSecr=648002454
209   0.047058 172.31.36.109 -> 54.230.30.221 TCP 66 58399 > http [FIN, ACK] Seq=97 Ack=1049034 Win=1087104 Len=0 TSval=33977411 TSecr=648002454
210   0.048146 54.230.30.221 -> 172.31.36.109 TCP 66 http > 58399 [FIN, ACK] Seq=1049034 Ack=98 Win=14592 Len=0 TSval=648002454 TSecr=33977411
211   0.048155 172.31.36.109 -> 54.230.30.221 TCP 66 58399 > http [ACK] Seq=98 Ack=1049035 Win=1087104 Len=0 TSval=33977411 TSecr=648002454
