[Measurement for 1mb at 22:30:22 19.30.2014] 
Tshark:

  1   0.000000 172.31.36.109 -> 172.31.0.2   DNS 89 Standard query 0x91e4  A d39wppo36gwqpx.cloudfront.net
  2   0.000023 172.31.36.109 -> 172.31.0.2   DNS 89 Standard query 0x8bc7  AAAA d39wppo36gwqpx.cloudfront.net
  3   0.000464   172.31.0.2 -> 172.31.36.109 DNS 170 Standard query response 0x8bc7 
  4   0.000475   172.31.0.2 -> 172.31.36.109 DNS 217 Standard query response 0x91e4  A 54.230.30.231 A 54.230.30.233 A 54.230.30.237 A 54.192.30.186 A 54.192.30.227 A 54.230.30.53 A 54.230.30.59 A 54.230.30.229
  5   0.003918 172.31.36.109 -> 54.230.30.231 TCP 74 40243 > http [SYN] Seq=0 Win=26883 Len=0 MSS=8961 SACK_PERM=1 TSval=24977341 TSecr=0 WS=128
  6   0.011375 54.230.30.231 -> 172.31.36.109 TCP 74 http > 40243 [SYN, ACK] Seq=0 Ack=1 Win=14480 Len=0 MSS=1460 SACK_PERM=1 TSval=651126979 TSecr=24977341 WS=128
  7   0.011390 172.31.36.109 -> 54.230.30.231 TCP 66 40243 > http [ACK] Seq=1 Ack=1 Win=27008 Len=0 TSval=24977343 TSecr=651126979
  8   0.011435 172.31.36.109 -> 54.230.30.231 HTTP 162 GET /1mb HTTP/1.1 
  9   0.012569 54.230.30.231 -> 172.31.36.109 TCP 66 http > 40243 [ACK] Seq=1 Ack=97 Win=14592 Len=0 TSval=651126979 TSecr=24977343
 10   0.040147 54.230.30.231 -> 172.31.36.109 TCP 5488 [TCP segment of a reassembled PDU]
 11   0.040158 172.31.36.109 -> 54.230.30.231 TCP 66 40243 > http [ACK] Seq=97 Ack=5423 Win=37760 Len=0 TSval=24977350 TSecr=651126982
 12   0.040165 54.230.30.231 -> 172.31.36.109 TCP 1514 [TCP segment of a reassembled PDU]
 13   0.040169 172.31.36.109 -> 54.230.30.231 TCP 66 40243 > http [ACK] Seq=97 Ack=6871 Win=40704 Len=0 TSval=24977350 TSecr=651126982
 14   0.040231 54.230.30.231 -> 172.31.36.109 TCP 2962 [TCP segment of a reassembled PDU]
 15   0.040237 172.31.36.109 -> 54.230.30.231 TCP 66 40243 > http [ACK] Seq=97 Ack=9767 Win=46464 Len=0 TSval=24977350 TSecr=651126982
 16   0.040313 54.230.30.231 -> 172.31.36.109 TCP 2962 [TCP segment of a reassembled PDU]
 17   0.040318 172.31.36.109 -> 54.230.30.231 TCP 66 40243 > http [ACK] Seq=97 Ack=12663 Win=52224 Len=0 TSval=24977350 TSecr=651126982
 18   0.040330 54.230.30.231 -> 172.31.36.109 TCP 1514 [TCP segment of a reassembled PDU]
 19   0.040332 172.31.36.109 -> 54.230.30.231 TCP 66 40243 > http [ACK] Seq=97 Ack=14111 Win=55168 Len=0 TSval=24977350 TSecr=651126982
 20   0.041364 54.230.30.231 -> 172.31.36.109 TCP 7306 [TCP segment of a reassembled PDU]
 21   0.041371 172.31.36.109 -> 54.230.30.231 TCP 66 40243 > http [ACK] Seq=97 Ack=21351 Win=69632 Len=0 TSval=24977350 TSecr=651126982
 22   0.041627 54.230.30.231 -> 172.31.36.109 TCP 5858 [TCP segment of a reassembled PDU]
 23   0.041641 172.31.36.109 -> 54.230.30.231 TCP 66 40243 > http [ACK] Seq=97 Ack=27143 Win=81280 Len=0 TSval=24977350 TSecr=651126982
 24   0.041666 54.230.30.231 -> 172.31.36.109 TCP 7306 [TCP segment of a reassembled PDU]
 25   0.041671 172.31.36.109 -> 54.230.30.231 TCP 66 40243 > http [ACK] Seq=97 Ack=34383 Win=95744 Len=0 TSval=24977350 TSecr=651126982
 26   0.041673 54.230.30.231 -> 172.31.36.109 TCP 1514 [TCP segment of a reassembled PDU]
 27   0.041675 172.31.36.109 -> 54.230.30.231 TCP 66 40243 > http [ACK] Seq=97 Ack=35831 Win=94336 Len=0 TSval=24977350 TSecr=651126982
 28   0.042572 54.230.30.231 -> 172.31.36.109 TCP 4410 [TCP segment of a reassembled PDU]
 29   0.042586 172.31.36.109 -> 54.230.30.231 TCP 66 40243 > http [ACK] Seq=97 Ack=40175 Win=104448 Len=0 TSval=24977350 TSecr=651126982
 30   0.042774 54.230.30.231 -> 172.31.36.109 TCP 2962 [TCP segment of a reassembled PDU]
 31   0.042785 172.31.36.109 -> 54.230.30.231 TCP 66 40243 > http [ACK] Seq=97 Ack=43071 Win=109056 Len=0 TSval=24977350 TSecr=651126982
 32   0.042935 54.230.30.231 -> 172.31.36.109 TCP 17442 [TCP segment of a reassembled PDU]
 33   0.042946 172.31.36.109 -> 54.230.30.231 TCP 66 40243 > http [ACK] Seq=97 Ack=60447 Win=91776 Len=0 TSval=24977350 TSecr=651126982
 34   0.043548 54.230.30.231 -> 172.31.36.109 TCP 1514 [TCP segment of a reassembled PDU]
 35   0.043559 172.31.36.109 -> 54.230.30.231 TCP 66 40243 > http [ACK] Seq=97 Ack=61895 Win=109056 Len=0 TSval=24977351 TSecr=651126982
 36   0.043661 54.230.30.231 -> 172.31.36.109 TCP 5858 [TCP segment of a reassembled PDU]
 37   0.043675 172.31.36.109 -> 54.230.30.231 TCP 66 40243 > http [ACK] Seq=97 Ack=67687 Win=120704 Len=0 TSval=24977351 TSecr=651126982
 38   0.044067 54.230.30.231 -> 172.31.36.109 TCP 2962 [TCP segment of a reassembled PDU]
 39   0.044079 172.31.36.109 -> 54.230.30.231 TCP 66 40243 > http [ACK] Seq=97 Ack=70583 Win=126464 Len=0 TSval=24977351 TSecr=651126982
 40   0.044325 54.230.30.231 -> 172.31.36.109 TCP 4410 [TCP segment of a reassembled PDU]
 41   0.044338 172.31.36.109 -> 54.230.30.231 TCP 66 40243 > http [ACK] Seq=97 Ack=74927 Win=135168 Len=0 TSval=24977351 TSecr=651126982
 42   0.044493 54.230.30.231 -> 172.31.36.109 TCP 17442 [TCP segment of a reassembled PDU]
 43   0.044503 172.31.36.109 -> 54.230.30.231 TCP 66 40243 > http [ACK] Seq=97 Ack=92303 Win=169856 Len=0 TSval=24977351 TSecr=651126982
 44   0.044596 54.230.30.231 -> 172.31.36.109 TCP 2962 [TCP segment of a reassembled PDU]
 45   0.044608 172.31.36.109 -> 54.230.30.231 TCP 66 40243 > http [ACK] Seq=97 Ack=95199 Win=175616 Len=0 TSval=24977351 TSecr=651126983
 46   0.045645 54.230.30.231 -> 172.31.36.109 TCP 5858 [TCP segment of a reassembled PDU]
 47   0.045651 172.31.36.109 -> 54.230.30.231 TCP 66 40243 > http [ACK] Seq=97 Ack=100991 Win=187264 Len=0 TSval=24977351 TSecr=651126983
 48   0.045772 54.230.30.231 -> 172.31.36.109 TCP 5858 [TCP segment of a reassembled PDU]
 49   0.045786 172.31.36.109 -> 54.230.30.231 TCP 66 40243 > http [ACK] Seq=97 Ack=106783 Win=198784 Len=0 TSval=24977351 TSecr=651126983
 50   0.045852 54.230.30.231 -> 172.31.36.109 TCP 2962 [TCP segment of a reassembled PDU]
 51   0.045857 172.31.36.109 -> 54.230.30.231 TCP 66 40243 > http [ACK] Seq=97 Ack=109679 Win=204672 Len=0 TSval=24977351 TSecr=651126983
 52   0.045984 54.230.30.231 -> 172.31.36.109 TCP 21786 [TCP segment of a reassembled PDU]
 53   0.045996 172.31.36.109 -> 54.230.30.231 TCP 66 40243 > http [ACK] Seq=97 Ack=131399 Win=248064 Len=0 TSval=24977351 TSecr=651126983
 54   0.046874 54.230.30.231 -> 172.31.36.109 TCP 2962 [TCP segment of a reassembled PDU]
 55   0.046889 172.31.36.109 -> 54.230.30.231 TCP 66 40243 > http [ACK] Seq=97 Ack=134295 Win=253824 Len=0 TSval=24977351 TSecr=651126983
 56   0.047033 54.230.30.231 -> 172.31.36.109 TCP 13098 [TCP segment of a reassembled PDU]
 57   0.047041 172.31.36.109 -> 54.230.30.231 TCP 66 40243 > http [ACK] Seq=97 Ack=147327 Win=279936 Len=0 TSval=24977351 TSecr=651126983
 58   0.047216 54.230.30.231 -> 172.31.36.109 TCP 20338 [TCP segment of a reassembled PDU]
 59   0.047227 172.31.36.109 -> 54.230.30.231 TCP 66 40243 > http [ACK] Seq=97 Ack=167599 Win=320512 Len=0 TSval=24977352 TSecr=651126983
 60   0.047332 54.230.30.231 -> 172.31.36.109 TCP 10202 [TCP segment of a reassembled PDU]
 61   0.047340 172.31.36.109 -> 54.230.30.231 TCP 66 40243 > http [ACK] Seq=97 Ack=177735 Win=340736 Len=0 TSval=24977352 TSecr=651126983
 62   0.048463 54.230.30.231 -> 172.31.36.109 TCP 2962 [TCP segment of a reassembled PDU]
 63   0.048487 172.31.36.109 -> 54.230.30.231 TCP 66 40243 > http [ACK] Seq=97 Ack=180631 Win=346496 Len=0 TSval=24977352 TSecr=651126983
 64   0.048613 54.230.30.231 -> 172.31.36.109 TCP 4410 [TCP segment of a reassembled PDU]
 65   0.048618 172.31.36.109 -> 54.230.30.231 TCP 66 40243 > http [ACK] Seq=97 Ack=184975 Win=355200 Len=0 TSval=24977352 TSecr=651126983
 66   0.048718 54.230.30.231 -> 172.31.36.109 TCP 8754 [TCP segment of a reassembled PDU]
 67   0.048744 172.31.36.109 -> 54.230.30.231 TCP 66 40243 > http [ACK] Seq=97 Ack=193663 Win=372608 Len=0 TSval=24977352 TSecr=651126983
 68   0.048929 54.230.30.231 -> 172.31.36.109 TCP 2962 [TCP segment of a reassembled PDU]
 69   0.048953 172.31.36.109 -> 54.230.30.231 TCP 66 40243 > http [ACK] Seq=97 Ack=196559 Win=378368 Len=0 TSval=24977352 TSecr=651126983
 70   0.048962 54.230.30.231 -> 172.31.36.109 TCP 10202 [TCP segment of a reassembled PDU]
 71   0.048967 172.31.36.109 -> 54.230.30.231 TCP 66 40243 > http [ACK] Seq=97 Ack=206695 Win=398720 Len=0 TSval=24977352 TSecr=651126983
 72   0.048981 54.230.30.231 -> 172.31.36.109 TCP 15994 [TCP segment of a reassembled PDU]
 73   0.048989 172.31.36.109 -> 54.230.30.231 TCP 66 40243 > http [ACK] Seq=97 Ack=222623 Win=430464 Len=0 TSval=24977352 TSecr=651126983
 74   0.048996 54.230.30.231 -> 172.31.36.109 TCP 4410 [TCP segment of a reassembled PDU]
 75   0.049000 172.31.36.109 -> 54.230.30.231 TCP 66 40243 > http [ACK] Seq=97 Ack=226967 Win=439168 Len=0 TSval=24977352 TSecr=651126983
 76   0.049050 54.230.30.231 -> 172.31.36.109 TCP 2962 [TCP segment of a reassembled PDU]
 77   0.049055 172.31.36.109 -> 54.230.30.231 TCP 66 40243 > http [ACK] Seq=97 Ack=229863 Win=445056 Len=0 TSval=24977352 TSecr=651126983
 78   0.049979 54.230.30.231 -> 172.31.36.109 TCP 2962 [TCP segment of a reassembled PDU]
 79   0.050011 172.31.36.109 -> 54.230.30.231 TCP 66 40243 > http [ACK] Seq=97 Ack=232759 Win=450816 Len=0 TSval=24977352 TSecr=651126983
 80   0.050153 54.230.30.231 -> 172.31.36.109 TCP 15994 [TCP segment of a reassembled PDU]
 81   0.050176 172.31.36.109 -> 54.230.30.231 TCP 66 40243 > http [ACK] Seq=97 Ack=248687 Win=482688 Len=0 TSval=24977352 TSecr=651126983
 82   0.050224 54.230.30.231 -> 172.31.36.109 TCP 4410 [TCP segment of a reassembled PDU]
 83   0.050229 172.31.36.109 -> 54.230.30.231 TCP 66 40243 > http [ACK] Seq=97 Ack=253031 Win=491392 Len=0 TSval=24977352 TSecr=651126983
 84   0.050373 54.230.30.231 -> 172.31.36.109 TCP 18890 [TCP segment of a reassembled PDU]
 85   0.050395 172.31.36.109 -> 54.230.30.231 TCP 66 40243 > http [ACK] Seq=97 Ack=271855 Win=529024 Len=0 TSval=24977352 TSecr=651126983
 86   0.050619 54.230.30.231 -> 172.31.36.109 TCP 21786 [TCP segment of a reassembled PDU]
 87   0.050631 172.31.36.109 -> 54.230.30.231 TCP 66 40243 > http [ACK] Seq=97 Ack=293575 Win=572416 Len=0 TSval=24977352 TSecr=651126983
 88   0.051552 54.230.30.231 -> 172.31.36.109 TCP 2962 [TCP segment of a reassembled PDU]
 89   0.051557 172.31.36.109 -> 54.230.30.231 TCP 66 40243 > http [ACK] Seq=97 Ack=296471 Win=578176 Len=0 TSval=24977353 TSecr=651126983
 90   0.051731 54.230.30.231 -> 172.31.36.109 TCP 15994 [TCP segment of a reassembled PDU]
 91   0.051755 172.31.36.109 -> 54.230.30.231 TCP 66 40243 > http [ACK] Seq=97 Ack=312399 Win=610048 Len=0 TSval=24977353 TSecr=651126983
 92   0.051857 54.230.30.231 -> 172.31.36.109 TCP 21786 [TCP segment of a reassembled PDU]
 93   0.051869 172.31.36.109 -> 54.230.30.231 TCP 66 40243 > http [ACK] Seq=97 Ack=334119 Win=653568 Len=0 TSval=24977353 TSecr=651126983
 94   0.051940 54.230.30.231 -> 172.31.36.109 TCP 7306 [TCP segment of a reassembled PDU]
 95   0.051946 172.31.36.109 -> 54.230.30.231 TCP 66 40243 > http [ACK] Seq=97 Ack=341359 Win=668032 Len=0 TSval=24977353 TSecr=651126983
 96   0.052067 54.230.30.231 -> 172.31.36.109 TCP 13098 [TCP segment of a reassembled PDU]
 97   0.052075 172.31.36.109 -> 54.230.30.231 TCP 66 40243 > http [ACK] Seq=97 Ack=354391 Win=672384 Len=0 TSval=24977353 TSecr=651126983
 98   0.052331 54.230.30.231 -> 172.31.36.109 TCP 10202 [TCP segment of a reassembled PDU]
 99   0.052339 172.31.36.109 -> 54.230.30.231 TCP 66 40243 > http [ACK] Seq=97 Ack=364527 Win=677120 Len=0 TSval=24977353 TSecr=651126983
100   0.053033 54.230.30.231 -> 172.31.36.109 TCP 2962 [TCP segment of a reassembled PDU]
101   0.053059 172.31.36.109 -> 54.230.30.231 TCP 66 40243 > http [ACK] Seq=97 Ack=367423 Win=689024 Len=0 TSval=24977353 TSecr=651126983
102   0.053223 54.230.30.231 -> 172.31.36.109 TCP 18890 [TCP segment of a reassembled PDU]
103   0.053233 172.31.36.109 -> 54.230.30.231 TCP 66 40243 > http [ACK] Seq=97 Ack=386247 Win=670208 Len=0 TSval=24977353 TSecr=651126983
104   0.053266 54.230.30.231 -> 172.31.36.109 TCP 1514 [TCP segment of a reassembled PDU]
105   0.053270 172.31.36.109 -> 54.230.30.231 TCP 66 40243 > http [ACK] Seq=97 Ack=387695 Win=691328 Len=0 TSval=24977353 TSecr=651126983
106   0.053477 54.230.30.231 -> 172.31.36.109 TCP 36266 [TCP segment of a reassembled PDU]
107   0.053504 172.31.36.109 -> 54.230.30.231 TCP 66 40243 > http [ACK] Seq=97 Ack=423895 Win=655232 Len=0 TSval=24977353 TSecr=651126983
108   0.053518 54.230.30.231 -> 172.31.36.109 TCP 4410 [TCP segment of a reassembled PDU]
109   0.053531 172.31.36.109 -> 54.230.30.231 TCP 66 40243 > http [ACK] Seq=97 Ack=428239 Win=651008 Len=0 TSval=24977353 TSecr=651126983
110   0.053640 54.230.30.231 -> 172.31.36.109 TCP 4410 [TCP segment of a reassembled PDU]
111   0.053645 172.31.36.109 -> 54.230.30.231 TCP 66 40243 > http [ACK] Seq=97 Ack=432583 Win=686592 Len=0 TSval=24977353 TSecr=651126983
112   0.054301 54.230.30.231 -> 172.31.36.109 TCP 1514 [TCP segment of a reassembled PDU]
113   0.054510 54.230.30.231 -> 172.31.36.109 TCP 26130 [TCP segment of a reassembled PDU]
114   0.054533 172.31.36.109 -> 54.230.30.231 TCP 66 40243 > http [ACK] Seq=97 Ack=460095 Win=659200 Len=0 TSval=24977353 TSecr=651126983
115   0.054543 54.230.30.231 -> 172.31.36.109 TCP 1514 [TCP segment of a reassembled PDU]
116   0.054724 54.230.30.231 -> 172.31.36.109 TCP 5858 [TCP segment of a reassembled PDU]
117   0.054738 172.31.36.109 -> 54.230.30.231 TCP 66 40243 > http [ACK] Seq=97 Ack=467335 Win=684288 Len=0 TSval=24977353 TSecr=651126983
118   0.054768 54.230.30.231 -> 172.31.36.109 TCP 18890 [TCP segment of a reassembled PDU]
119   0.054793 172.31.36.109 -> 54.230.30.231 TCP 66 40243 > http [ACK] Seq=97 Ack=486159 Win=665472 Len=0 TSval=24977353 TSecr=651126984
120   0.054865 54.230.30.231 -> 172.31.36.109 TCP 13098 [TCP segment of a reassembled PDU]
121   0.054872 172.31.36.109 -> 54.230.30.231 TCP 66 40243 > http [ACK] Seq=97 Ack=499191 Win=672384 Len=0 TSval=24977353 TSecr=651126984
122   0.054944 54.230.30.231 -> 172.31.36.109 TCP 10202 [TCP segment of a reassembled PDU]
123   0.055032 172.31.36.109 -> 54.230.30.231 TCP 66 40243 > http [ACK] Seq=97 Ack=509327 Win=677120 Len=0 TSval=24977353 TSecr=651126984
124   0.055620 54.230.30.231 -> 172.31.36.109 TCP 2962 [TCP segment of a reassembled PDU]
125   0.055626 172.31.36.109 -> 54.230.30.231 TCP 66 40243 > http [ACK] Seq=97 Ack=512223 Win=689024 Len=0 TSval=24977354 TSecr=651126984
126   0.055728 54.230.30.231 -> 172.31.36.109 TCP 8754 [TCP segment of a reassembled PDU]
127   0.055736 172.31.36.109 -> 54.230.30.231 TCP 66 40243 > http [ACK] Seq=97 Ack=520911 Win=711040 Len=0 TSval=24977354 TSecr=651126984
128   0.055837 54.230.30.231 -> 172.31.36.109 TCP 4410 [TCP segment of a reassembled PDU]
129   0.055842 172.31.36.109 -> 54.230.30.231 TCP 66 40243 > http [ACK] Seq=97 Ack=525255 Win=719744 Len=0 TSval=24977354 TSecr=651126984
130   0.055959 54.230.30.231 -> 172.31.36.109 TCP 7306 [TCP segment of a reassembled PDU]
131   0.055965 172.31.36.109 -> 54.230.30.231 TCP 66 40243 > http [ACK] Seq=97 Ack=532495 Win=734208 Len=0 TSval=24977354 TSecr=651126984
132   0.056251 54.230.30.231 -> 172.31.36.109 TCP 18890 [TCP segment of a reassembled PDU]
133   0.056262 172.31.36.109 -> 54.230.30.231 TCP 66 40243 > http [ACK] Seq=97 Ack=551319 Win=771840 Len=0 TSval=24977354 TSecr=651126984
134   0.056326 54.230.30.231 -> 172.31.36.109 TCP 14546 [TCP segment of a reassembled PDU]
135   0.056335 172.31.36.109 -> 54.230.30.231 TCP 66 40243 > http [ACK] Seq=97 Ack=565799 Win=800896 Len=0 TSval=24977354 TSecr=651126984
136   0.056435 54.230.30.231 -> 172.31.36.109 TCP 13098 [TCP segment of a reassembled PDU]
137   0.056443 172.31.36.109 -> 54.230.30.231 TCP 66 40243 > http [ACK] Seq=97 Ack=578831 Win=826880 Len=0 TSval=24977354 TSecr=651126984
138   0.056579 54.230.30.231 -> 172.31.36.109 TCP 14546 [TCP segment of a reassembled PDU]
139   0.056588 172.31.36.109 -> 54.230.30.231 TCP 66 40243 > http [ACK] Seq=97 Ack=593311 Win=855808 Len=0 TSval=24977354 TSecr=651126984
140   0.056749 54.230.30.231 -> 172.31.36.109 TCP 4410 [TCP segment of a reassembled PDU]
141   0.056755 172.31.36.109 -> 54.230.30.231 TCP 66 40243 > http [ACK] Seq=97 Ack=597655 Win=864512 Len=0 TSval=24977354 TSecr=651126984
142   0.057098 54.230.30.231 -> 172.31.36.109 TCP 2962 [TCP segment of a reassembled PDU]
143   0.057103 172.31.36.109 -> 54.230.30.231 TCP 66 40243 > http [ACK] Seq=97 Ack=600551 Win=870400 Len=0 TSval=24977354 TSecr=651126984
144   0.057280 54.230.30.231 -> 172.31.36.109 TCP 27578 [TCP segment of a reassembled PDU]
145   0.057293 172.31.36.109 -> 54.230.30.231 TCP 66 40243 > http [ACK] Seq=97 Ack=628063 Win=925312 Len=0 TSval=24977354 TSecr=651126984
146   0.057391 54.230.30.231 -> 172.31.36.109 TCP 7306 [TCP segment of a reassembled PDU]
147   0.057398 172.31.36.109 -> 54.230.30.231 TCP 66 40243 > http [ACK] Seq=97 Ack=635303 Win=939904 Len=0 TSval=24977354 TSecr=651126984
148   0.057513 54.230.30.231 -> 172.31.36.109 TCP 18890 [TCP segment of a reassembled PDU]
149   0.057524 172.31.36.109 -> 54.230.30.231 TCP 66 40243 > http [ACK] Seq=97 Ack=654127 Win=977536 Len=0 TSval=24977354 TSecr=651126984
150   0.057600 54.230.30.231 -> 172.31.36.109 TCP 2962 [TCP segment of a reassembled PDU]
151   0.057605 172.31.36.109 -> 54.230.30.231 TCP 66 40243 > http [ACK] Seq=97 Ack=657023 Win=983296 Len=0 TSval=24977354 TSecr=651126984
152   0.057820 54.230.30.231 -> 172.31.36.109 TCP 33370 [TCP segment of a reassembled PDU]
153   0.057835 172.31.36.109 -> 54.230.30.231 TCP 66 40243 > http [ACK] Seq=97 Ack=690327 Win=1049856 Len=0 TSval=24977354 TSecr=651126984
154   0.057993 54.230.30.231 -> 172.31.36.109 TCP 10202 [TCP segment of a reassembled PDU]
155   0.058004 172.31.36.109 -> 54.230.30.231 TCP 66 40243 > http [ACK] Seq=97 Ack=700463 Win=1070208 Len=0 TSval=24977354 TSecr=651126984
156   0.058390 54.230.30.231 -> 172.31.36.109 TCP 4410 [TCP segment of a reassembled PDU]
157   0.058395 172.31.36.109 -> 54.230.30.231 TCP 66 40243 > http [ACK] Seq=97 Ack=704807 Win=1078912 Len=0 TSval=24977354 TSecr=651126984
158   0.058550 54.230.30.231 -> 172.31.36.109 TCP 23234 [TCP segment of a reassembled PDU]
159   0.058569 172.31.36.109 -> 54.230.30.231 TCP 66 40243 > http [ACK] Seq=97 Ack=727975 Win=1115264 Len=0 TSval=24977354 TSecr=651126984
160   0.058651 54.230.30.231 -> 172.31.36.109 TCP 4410 [TCP segment of a reassembled PDU]
161   0.058657 172.31.36.109 -> 54.230.30.231 TCP 66 40243 > http [ACK] Seq=97 Ack=732319 Win=1133824 Len=0 TSval=24977354 TSecr=651126984
162   0.058824 54.230.30.231 -> 172.31.36.109 TCP 20338 [TCP segment of a reassembled PDU]
163   0.058872 54.230.30.231 -> 172.31.36.109 TCP 2962 [TCP segment of a reassembled PDU]
164   0.058877 172.31.36.109 -> 54.230.30.231 TCP 66 40243 > http [ACK] Seq=97 Ack=752591 Win=1120000 Len=0 TSval=24977354 TSecr=651126984
165   0.058890 172.31.36.109 -> 54.230.30.231 TCP 66 40243 > http [ACK] Seq=97 Ack=755487 Win=1133824 Len=0 TSval=24977354 TSecr=651126984
166   0.058918 54.230.30.231 -> 172.31.36.109 TCP 2962 [TCP segment of a reassembled PDU]
167   0.058923 172.31.36.109 -> 54.230.30.231 TCP 66 40243 > http [ACK] Seq=97 Ack=758383 Win=1139712 Len=0 TSval=24977354 TSecr=651126984
168   0.059066 54.230.30.231 -> 172.31.36.109 TCP 26130 [TCP segment of a reassembled PDU]
169   0.059091 172.31.36.109 -> 54.230.30.231 TCP 66 40243 > http [ACK] Seq=97 Ack=784447 Win=1113728 Len=0 TSval=24977354 TSecr=651126984
170   0.059166 54.230.30.231 -> 172.31.36.109 TCP 8754 [TCP segment of a reassembled PDU]
171   0.059173 172.31.36.109 -> 54.230.30.231 TCP 66 40243 > http [ACK] Seq=97 Ack=793135 Win=1139072 Len=0 TSval=24977355 TSecr=651126984
172   0.059694 54.230.30.231 -> 172.31.36.109 TCP 1514 [TCP segment of a reassembled PDU]
173   0.059698 172.31.36.109 -> 54.230.30.231 TCP 66 40243 > http [ACK] Seq=97 Ack=794583 Win=1142528 Len=0 TSval=24977355 TSecr=651126984
174   0.059876 54.230.30.231 -> 172.31.36.109 TCP 20338 [TCP segment of a reassembled PDU]
175   0.059897 172.31.36.109 -> 54.230.30.231 TCP 66 40243 > http [ACK] Seq=97 Ack=814855 Win=1122304 Len=0 TSval=24977355 TSecr=651126984
176   0.059954 54.230.30.231 -> 172.31.36.109 TCP 13098 [TCP segment of a reassembled PDU]
177   0.059963 172.31.36.109 -> 54.230.30.231 TCP 66 40243 > http [ACK] Seq=97 Ack=827887 Win=1131904 Len=0 TSval=24977355 TSecr=651126984
178   0.060079 54.230.30.231 -> 172.31.36.109 TCP 23234 [TCP segment of a reassembled PDU]
179   0.060102 172.31.36.109 -> 54.230.30.231 TCP 66 40243 > http [ACK] Seq=97 Ack=851055 Win=1115264 Len=0 TSval=24977355 TSecr=651126984
180   0.060335 54.230.30.231 -> 172.31.36.109 TCP 7306 [TCP segment of a reassembled PDU]
181   0.060343 172.31.36.109 -> 54.230.30.231 TCP 66 40243 > http [ACK] Seq=97 Ack=858295 Win=1141376 Len=0 TSval=24977355 TSecr=651126984
182   0.060362 54.230.30.231 -> 172.31.36.109 TCP 18890 [TCP segment of a reassembled PDU]
183   0.060388 172.31.36.109 -> 54.230.30.231 TCP 66 40243 > http [ACK] Seq=97 Ack=877119 Win=1122560 Len=0 TSval=24977355 TSecr=651126984
184   0.060400 54.230.30.231 -> 172.31.36.109 TCP 1514 [TCP segment of a reassembled PDU]
185   0.060536 54.230.30.231 -> 172.31.36.109 TCP 23234 [TCP segment of a reassembled PDU]
186   0.060558 172.31.36.109 -> 54.230.30.231 TCP 66 40243 > http [ACK] Seq=97 Ack=901735 Win=1115264 Len=0 TSval=24977355 TSecr=651126984
187   0.060814 54.230.30.231 -> 172.31.36.109 TCP 11650 [TCP segment of a reassembled PDU]
188   0.060822 172.31.36.109 -> 54.230.30.231 TCP 66 40243 > http [ACK] Seq=97 Ack=913319 Win=1134336 Len=0 TSval=24977355 TSecr=651126984
189   0.060834 54.230.30.231 -> 172.31.36.109 TCP 10202 [TCP segment of a reassembled PDU]
190   0.060856 172.31.36.109 -> 54.230.30.231 TCP 66 40243 > http [ACK] Seq=97 Ack=923455 Win=1136640 Len=0 TSval=24977355 TSecr=651126984
191   0.061221 54.230.30.231 -> 172.31.36.109 TCP 2962 [TCP segment of a reassembled PDU]
192   0.061226 172.31.36.109 -> 54.230.30.231 TCP 66 40243 > http [ACK] Seq=97 Ack=926351 Win=1148416 Len=0 TSval=24977355 TSecr=651126984
193   0.061384 54.230.30.231 -> 172.31.36.109 TCP 26130 [TCP segment of a reassembled PDU]
194   0.061407 172.31.36.109 -> 54.230.30.231 TCP 66 40243 > http [ACK] Seq=97 Ack=952415 Win=1122432 Len=0 TSval=24977355 TSecr=651126984
195   0.061471 54.230.30.231 -> 172.31.36.109 TCP 7306 [TCP segment of a reassembled PDU]
196   0.061477 172.31.36.109 -> 54.230.30.231 TCP 66 40243 > http [ACK] Seq=97 Ack=959655 Win=1141376 Len=0 TSval=24977355 TSecr=651126984
197   0.061614 54.230.30.231 -> 172.31.36.109 TCP 15994 [TCP segment of a reassembled PDU]
198   0.061701 172.31.36.109 -> 54.230.30.231 TCP 66 40243 > http [ACK] Seq=97 Ack=975583 Win=1148416 Len=0 TSval=24977355 TSecr=651126984
199   0.061804 54.230.30.231 -> 172.31.36.109 TCP 10202 [TCP segment of a reassembled PDU]
200   0.061823 172.31.36.109 -> 54.230.30.231 TCP 66 40243 > http [ACK] Seq=97 Ack=985719 Win=1148416 Len=0 TSval=24977355 TSecr=651126984
201   0.061904 54.230.30.231 -> 172.31.36.109 TCP 2962 [TCP segment of a reassembled PDU]
202   0.061909 172.31.36.109 -> 54.230.30.231 TCP 66 40243 > http [ACK] Seq=97 Ack=988615 Win=1148544 Len=0 TSval=24977355 TSecr=651126984
203   0.062052 54.230.30.231 -> 172.31.36.109 TCP 15994 [TCP segment of a reassembled PDU]
204   0.062073 172.31.36.109 -> 54.230.30.231 TCP 66 40243 > http [ACK] Seq=97 Ack=1004543 Win=1149440 Len=0 TSval=24977355 TSecr=651126984
205   0.062205 54.230.30.231 -> 172.31.36.109 TCP 26130 [TCP segment of a reassembled PDU]
206   0.062228 172.31.36.109 -> 54.230.30.231 TCP 66 40243 > http [ACK] Seq=97 Ack=1030607 Win=1123456 Len=0 TSval=24977355 TSecr=651126984
207   0.062295 54.230.30.231 -> 172.31.36.109 TCP 11650 [TCP segment of a reassembled PDU]
208   0.062303 172.31.36.109 -> 54.230.30.231 TCP 66 40243 > http [ACK] Seq=97 Ack=1042191 Win=1134336 Len=0 TSval=24977355 TSecr=651126984
209   0.062529 54.230.30.231 -> 172.31.36.109 HTTP 6909 HTTP/1.1 200 OK  (application/octet-stream)
210   0.062536 172.31.36.109 -> 54.230.30.231 TCP 66 40243 > http [ACK] Seq=97 Ack=1049034 Win=1141376 Len=0 TSval=24977355 TSecr=651126984
211   0.062663 172.31.36.109 -> 54.230.30.231 TCP 66 40243 > http [FIN, ACK] Seq=97 Ack=1049034 Win=1149440 Len=0 TSval=24977355 TSecr=651126984
212   0.063797 54.230.30.231 -> 172.31.36.109 TCP 66 http > 40243 [FIN, ACK] Seq=1049034 Ack=98 Win=14592 Len=0 TSval=651126984 TSecr=24977355
213   0.063805 172.31.36.109 -> 54.230.30.231 TCP 66 40243 > http [ACK] Seq=98 Ack=1049035 Win=1149440 Len=0 TSval=24977356 TSecr=651126984
