[Measurement for 1mb at 13:30:23 20.30.2014] 
Tshark:

  1   0.000000 172.31.36.109 -> 172.31.0.2   DNS 89 Standard query 0x2b43  A d39wppo36gwqpx.cloudfront.net
  2   0.000028 172.31.36.109 -> 172.31.0.2   DNS 89 Standard query 0x7b5e  AAAA d39wppo36gwqpx.cloudfront.net
  3   0.000598   172.31.0.2 -> 172.31.36.109 DNS 217 Standard query response 0x2b43  A 54.230.21.150 A 54.230.21.175 A 54.230.22.243 A 54.230.23.160 A 54.230.23.210 A 216.137.41.101 A 216.137.41.199 A 54.230.20.115
  4   0.000647   172.31.0.2 -> 172.31.36.109 DNS 170 Standard query response 0x7b5e 
  5   0.003886 172.31.36.109 -> 54.230.21.150 TCP 74 54031 > http [SYN] Seq=0 Win=26883 Len=0 MSS=8961 SACK_PERM=1 TSval=38477501 TSecr=0 WS=128
  6   0.089274 54.230.21.150 -> 172.31.36.109 TCP 74 http > 54031 [SYN, ACK] Seq=0 Ack=1 Win=14480 Len=0 MSS=1460 SACK_PERM=1 TSval=944003178 TSecr=38477501 WS=128
  7   0.089310 172.31.36.109 -> 54.230.21.150 TCP 66 54031 > http [ACK] Seq=1 Ack=1 Win=27008 Len=0 TSval=38477522 TSecr=944003178
  8   0.089406 172.31.36.109 -> 54.230.21.150 HTTP 162 GET /1mb HTTP/1.1 
  9   0.174787 54.230.21.150 -> 172.31.36.109 TCP 66 http > 54031 [ACK] Seq=1 Ack=97 Win=14592 Len=0 TSval=944003187 TSecr=38477522
 10   0.179437 54.230.21.150 -> 172.31.36.109 TCP 6936 [TCP segment of a reassembled PDU]
 11   0.179454 172.31.36.109 -> 54.230.21.150 TCP 66 54031 > http [ACK] Seq=97 Ack=6871 Win=40704 Len=0 TSval=38477545 TSecr=944003187
 12   0.179465 54.230.21.150 -> 172.31.36.109 TCP 5858 [TCP segment of a reassembled PDU]
 13   0.179471 172.31.36.109 -> 54.230.21.150 TCP 66 54031 > http [ACK] Seq=97 Ack=12663 Win=52224 Len=0 TSval=38477545 TSecr=944003187
 14   0.179959 54.230.21.150 -> 172.31.36.109 TCP 1514 [TCP segment of a reassembled PDU]
 15   0.179969 172.31.36.109 -> 54.230.21.150 TCP 66 54031 > http [ACK] Seq=97 Ack=14111 Win=55168 Len=0 TSval=38477545 TSecr=944003187
 16   0.264925 54.230.21.150 -> 172.31.36.109 TCP 13098 [TCP segment of a reassembled PDU]
 17   0.264953 172.31.36.109 -> 54.230.21.150 TCP 66 54031 > http [ACK] Seq=97 Ack=27143 Win=81280 Len=0 TSval=38477566 TSecr=944003196
 18   0.350509 54.230.21.150 -> 172.31.36.109 TCP 11650 [TCP segment of a reassembled PDU]
 19   0.350538 172.31.36.109 -> 54.230.21.150 TCP 66 54031 > http [ACK] Seq=97 Ack=38727 Win=98944 Len=0 TSval=38477587 TSecr=944003204
 20   0.350623 54.230.21.150 -> 172.31.36.109 TCP 2962 [TCP segment of a reassembled PDU]
 21   0.350629 172.31.36.109 -> 54.230.21.150 TCP 66 54031 > http [ACK] Seq=97 Ack=41623 Win=109056 Len=0 TSval=38477587 TSecr=944003204
 22   0.350671 54.230.21.150 -> 172.31.36.109 TCP 2962 [TCP segment of a reassembled PDU]
 23   0.350676 172.31.36.109 -> 54.230.21.150 TCP 66 54031 > http [ACK] Seq=97 Ack=44519 Win=109056 Len=0 TSval=38477587 TSecr=944003204
 24   0.350725 54.230.21.150 -> 172.31.36.109 TCP 2962 [TCP segment of a reassembled PDU]
 25   0.350731 172.31.36.109 -> 54.230.21.150 TCP 66 54031 > http [ACK] Seq=97 Ack=47415 Win=109056 Len=0 TSval=38477587 TSecr=944003204
 26   0.435982 54.230.21.150 -> 172.31.36.109 TCP 4410 [TCP segment of a reassembled PDU]
