[Measurement for 1mb at 21:30:24 19.30.2014] 
Tshark:

  1   0.000000 172.31.36.109 -> 172.31.0.2   DNS 89 Standard query 0xbe4d  A d39wppo36gwqpx.cloudfront.net
  2   0.000021 172.31.36.109 -> 172.31.0.2   DNS 89 Standard query 0xa99a  AAAA d39wppo36gwqpx.cloudfront.net
  3   0.000641   172.31.0.2 -> 172.31.36.109 DNS 170 Standard query response 0xa99a 
  4   0.000652   172.31.0.2 -> 172.31.36.109 DNS 217 Standard query response 0xbe4d  A 216.137.41.192 A 54.230.20.3 A 54.230.20.7 A 54.230.20.159 A 54.230.22.189 A 54.230.23.13 A 216.137.41.18 A 216.137.41.45
  5   0.003879 172.31.36.109 -> 216.137.41.192 TCP 74 57700 > http [SYN] Seq=0 Win=26883 Len=0 MSS=8961 SACK_PERM=1 TSval=24077731 TSecr=0 WS=128
  6   0.101636 216.137.41.192 -> 172.31.36.109 TCP 74 http > 57700 [SYN, ACK] Seq=0 Ack=1 Win=14480 Len=0 MSS=1460 SACK_PERM=1 TSval=828995720 TSecr=24077731 WS=128
  7   0.101663 172.31.36.109 -> 216.137.41.192 TCP 66 57700 > http [ACK] Seq=1 Ack=1 Win=27008 Len=0 TSval=24077756 TSecr=828995720
  8   0.101844 172.31.36.109 -> 216.137.41.192 HTTP 162 GET /1mb HTTP/1.1 
  9   0.199487 216.137.41.192 -> 172.31.36.109 TCP 66 http > 57700 [ACK] Seq=1 Ack=97 Win=14592 Len=0 TSval=828995730 TSecr=24077756
 10   0.379953 216.137.41.192 -> 172.31.36.109 TCP 4065 [TCP segment of a reassembled PDU]
 11   0.379978 172.31.36.109 -> 216.137.41.192 TCP 66 57700 > http [ACK] Seq=97 Ack=4000 Win=34944 Len=0 TSval=24077825 TSecr=828995748
 12   0.380083 216.137.41.192 -> 172.31.36.109 TCP 1990 [TCP segment of a reassembled PDU]
 13   0.380090 172.31.36.109 -> 216.137.41.192 TCP 66 57700 > http [ACK] Seq=97 Ack=5924 Win=38784 Len=0 TSval=24077825 TSecr=828995748
 14   0.503912 216.137.41.192 -> 172.31.36.109 TCP 7366 [TCP segment of a reassembled PDU]
