[Measurement for 1mb at 03:30:23 20.30.2014] 
Tshark:

  1   0.000000 172.31.36.109 -> 172.31.0.2   DNS 89 Standard query 0xbd41  A d39wppo36gwqpx.cloudfront.net
  2   0.000028 172.31.36.109 -> 172.31.0.2   DNS 89 Standard query 0xad76  AAAA d39wppo36gwqpx.cloudfront.net
  3   0.000432   172.31.0.2 -> 172.31.36.109 DNS 170 Standard query response 0xad76 
  4   0.000443   172.31.0.2 -> 172.31.36.109 DNS 217 Standard query response 0xbd41  A 54.230.30.222 A 54.230.30.243 A 54.192.30.188 A 54.192.30.227 A 54.230.30.3 A 54.230.30.72 A 54.230.30.189 A 54.230.30.213
  5   0.003878 172.31.36.109 -> 54.230.30.222 TCP 74 55923 > http [SYN] Seq=0 Win=26883 Len=0 MSS=8961 SACK_PERM=1 TSval=29477384 TSecr=0 WS=128
  6   0.005177 54.230.30.222 -> 172.31.36.109 TCP 74 http > 55923 [SYN, ACK] Seq=0 Ack=1 Win=14480 Len=0 MSS=1460 SACK_PERM=1 TSval=652926949 TSecr=29477384 WS=128
  7   0.005192 172.31.36.109 -> 54.230.30.222 TCP 66 55923 > http [ACK] Seq=1 Ack=1 Win=27008 Len=0 TSval=29477384 TSecr=652926949
  8   0.005247 172.31.36.109 -> 54.230.30.222 HTTP 162 GET /1mb HTTP/1.1 
  9   0.006483 54.230.30.222 -> 172.31.36.109 TCP 66 http > 55923 [ACK] Seq=1 Ack=97 Win=14592 Len=0 TSval=652926949 TSecr=29477384
 10   0.020420 54.230.30.222 -> 172.31.36.109 TCP 14546 [TCP segment of a reassembled PDU]
 11   0.020442 172.31.36.109 -> 54.230.30.222 TCP 66 55923 > http [ACK] Seq=97 Ack=14481 Win=55936 Len=0 TSval=29477388 TSecr=652926950
 12   0.021633 54.230.30.222 -> 172.31.36.109 TCP 13098 [TCP segment of a reassembled PDU]
 13   0.021643 172.31.36.109 -> 54.230.30.222 TCP 66 55923 > http [ACK] Seq=97 Ack=27513 Win=81920 Len=0 TSval=29477388 TSecr=652926951
 14   0.022865 54.230.30.222 -> 172.31.36.109 TCP 2962 [TCP segment of a reassembled PDU]
 15   0.022871 172.31.36.109 -> 54.230.30.222 TCP 66 55923 > http [ACK] Seq=97 Ack=30409 Win=87808 Len=0 TSval=29477388 TSecr=652926951
 16   0.022899 54.230.30.222 -> 172.31.36.109 TCP 10202 [TCP segment of a reassembled PDU]
 17   0.022920 172.31.36.109 -> 54.230.30.222 TCP 66 55923 > http [ACK] Seq=97 Ack=40545 Win=96512 Len=0 TSval=29477388 TSecr=652926951
 18   0.024115 54.230.30.222 -> 172.31.36.109 TCP 4410 [TCP segment of a reassembled PDU]
 19   0.024121 172.31.36.109 -> 54.230.30.222 TCP 66 55923 > http [ACK] Seq=97 Ack=44889 Win=109056 Len=0 TSval=29477389 TSecr=652926951
 20   0.024202 54.230.30.222 -> 172.31.36.109 TCP 8754 [TCP segment of a reassembled PDU]
 21   0.024209 172.31.36.109 -> 54.230.30.222 TCP 66 55923 > http [ACK] Seq=97 Ack=53577 Win=126464 Len=0 TSval=29477389 TSecr=652926951
 22   0.024224 54.230.30.222 -> 172.31.36.109 TCP 7306 [TCP segment of a reassembled PDU]
 23   0.024228 172.31.36.109 -> 54.230.30.222 TCP 66 55923 > http [ACK] Seq=97 Ack=60817 Win=140928 Len=0 TSval=29477389 TSecr=652926951
 24   0.025484 54.230.30.222 -> 172.31.36.109 TCP 11650 [TCP segment of a reassembled PDU]
 25   0.025492 172.31.36.109 -> 54.230.30.222 TCP 66 55923 > http [ACK] Seq=97 Ack=72401 Win=164096 Len=0 TSval=29477389 TSecr=652926951
 26   0.025505 54.230.30.222 -> 172.31.36.109 TCP 7306 [TCP segment of a reassembled PDU]
 27   0.025514 172.31.36.109 -> 54.230.30.222 TCP 66 55923 > http [ACK] Seq=97 Ack=79641 Win=167296 Len=0 TSval=29477389 TSecr=652926951
 28   0.026771 54.230.30.222 -> 172.31.36.109 TCP 14546 [TCP segment of a reassembled PDU]
 29   0.026781 172.31.36.109 -> 54.230.30.222 TCP 66 55923 > http [ACK] Seq=97 Ack=94121 Win=174336 Len=0 TSval=29477389 TSecr=652926951
 30   0.026794 54.230.30.222 -> 172.31.36.109 TCP 10202 [TCP segment of a reassembled PDU]
 31   0.026803 172.31.36.109 -> 54.230.30.222 TCP 66 55923 > http [ACK] Seq=97 Ack=104257 Win=164224 Len=0 TSval=29477389 TSecr=652926951
 32   0.026990 54.230.30.222 -> 172.31.36.109 TCP 2962 [TCP segment of a reassembled PDU]
 33   0.026996 172.31.36.109 -> 54.230.30.222 TCP 66 55923 > http [ACK] Seq=97 Ack=107153 Win=184320 Len=0 TSval=29477389 TSecr=652926951
 34   0.028003 54.230.30.222 -> 172.31.36.109 TCP 4410 [TCP segment of a reassembled PDU]
 35   0.028009 172.31.36.109 -> 54.230.30.222 TCP 66 55923 > http [ACK] Seq=97 Ack=111497 Win=191104 Len=0 TSval=29477390 TSecr=652926951
 36   0.028087 54.230.30.222 -> 172.31.36.109 TCP 14546 [TCP segment of a reassembled PDU]
 37   0.028097 172.31.36.109 -> 54.230.30.222 TCP 66 55923 > http [ACK] Seq=97 Ack=125977 Win=221952 Len=0 TSval=29477390 TSecr=652926951
 38   0.028279 54.230.30.222 -> 172.31.36.109 TCP 8754 [TCP segment of a reassembled PDU]
 39   0.028286 172.31.36.109 -> 54.230.30.222 TCP 66 55923 > http [ACK] Seq=97 Ack=134665 Win=239360 Len=0 TSval=29477390 TSecr=652926951
 40   0.029294 54.230.30.222 -> 172.31.36.109 TCP 7306 [TCP segment of a reassembled PDU]
 41   0.029301 172.31.36.109 -> 54.230.30.222 TCP 66 55923 > http [ACK] Seq=97 Ack=141905 Win=253824 Len=0 TSval=29477390 TSecr=652926951
 42   0.029382 54.230.30.222 -> 172.31.36.109 TCP 18890 [TCP segment of a reassembled PDU]
 43   0.029394 172.31.36.109 -> 54.230.30.222 TCP 66 55923 > http [ACK] Seq=97 Ack=160729 Win=291456 Len=0 TSval=29477390 TSecr=652926951
 44   0.029576 54.230.30.222 -> 172.31.36.109 TCP 1514 [TCP segment of a reassembled PDU]
 45   0.029581 172.31.36.109 -> 54.230.30.222 TCP 66 55923 > http [ACK] Seq=97 Ack=162177 Win=294400 Len=0 TSval=29477390 TSecr=652926951
 46   0.030564 54.230.30.222 -> 172.31.36.109 TCP 5858 [TCP segment of a reassembled PDU]
 47   0.030570 172.31.36.109 -> 54.230.30.222 TCP 66 55923 > http [ACK] Seq=97 Ack=167969 Win=306048 Len=0 TSval=29477390 TSecr=652926951
 48   0.030720 54.230.30.222 -> 172.31.36.109 TCP 20338 [TCP segment of a reassembled PDU]
 49   0.030731 172.31.36.109 -> 54.230.30.222 TCP 66 55923 > http [ACK] Seq=97 Ack=188241 Win=346496 Len=0 TSval=29477390 TSecr=652926951
 50   0.030803 54.230.30.222 -> 172.31.36.109 TCP 1514 [TCP segment of a reassembled PDU]
 51   0.030807 172.31.36.109 -> 54.230.30.222 TCP 66 55923 > http [ACK] Seq=97 Ack=189689 Win=349440 Len=0 TSval=29477390 TSecr=652926951
 52   0.031835 54.230.30.222 -> 172.31.36.109 TCP 5858 [TCP segment of a reassembled PDU]
 53   0.031841 172.31.36.109 -> 54.230.30.222 TCP 66 55923 > http [ACK] Seq=97 Ack=195481 Win=360960 Len=0 TSval=29477391 TSecr=652926952
 54   0.031910 54.230.30.222 -> 172.31.36.109 TCP 15994 [TCP segment of a reassembled PDU]
 55   0.031919 172.31.36.109 -> 54.230.30.222 TCP 66 55923 > http [ACK] Seq=97 Ack=211409 Win=392832 Len=0 TSval=29477391 TSecr=652926952
 56   0.031993 54.230.30.222 -> 172.31.36.109 TCP 15994 [TCP segment of a reassembled PDU]
 57   0.032003 172.31.36.109 -> 54.230.30.222 TCP 66 55923 > http [ACK] Seq=97 Ack=227337 Win=424704 Len=0 TSval=29477391 TSecr=652926952
 58   0.032061 54.230.30.222 -> 172.31.36.109 TCP 4410 [TCP segment of a reassembled PDU]
 59   0.032067 172.31.36.109 -> 54.230.30.222 TCP 66 55923 > http [ACK] Seq=97 Ack=231681 Win=433408 Len=0 TSval=29477391 TSecr=652926952
 60   0.033168 54.230.30.222 -> 172.31.36.109 TCP 2962 [TCP segment of a reassembled PDU]
 61   0.033173 172.31.36.109 -> 54.230.30.222 TCP 66 55923 > http [ACK] Seq=97 Ack=234577 Win=439168 Len=0 TSval=29477391 TSecr=652926952
 62   0.033246 54.230.30.222 -> 172.31.36.109 TCP 5858 [TCP segment of a reassembled PDU]
 63   0.033253 172.31.36.109 -> 54.230.30.222 TCP 66 55923 > http [ACK] Seq=97 Ack=240369 Win=450816 Len=0 TSval=29477391 TSecr=652926952
 64   0.033346 54.230.30.222 -> 172.31.36.109 TCP 11650 [TCP segment of a reassembled PDU]
 65   0.033354 172.31.36.109 -> 54.230.30.222 TCP 66 55923 > http [ACK] Seq=97 Ack=251953 Win=473984 Len=0 TSval=29477391 TSecr=652926952
 66   0.033482 54.230.30.222 -> 172.31.36.109 TCP 13098 [TCP segment of a reassembled PDU]
 67   0.033491 172.31.36.109 -> 54.230.30.222 TCP 66 55923 > http [ACK] Seq=97 Ack=264985 Win=499584 Len=0 TSval=29477391 TSecr=652926952
 68   0.033575 54.230.30.222 -> 172.31.36.109 TCP 17442 [TCP segment of a reassembled PDU]
 69   0.033586 172.31.36.109 -> 54.230.30.222 TCP 66 55923 > http [ACK] Seq=97 Ack=282361 Win=521088 Len=0 TSval=29477391 TSecr=652926952
 70   0.034584 54.230.30.222 -> 172.31.36.109 TCP 7306 [TCP segment of a reassembled PDU]
 71   0.034591 172.31.36.109 -> 54.230.30.222 TCP 66 55923 > http [ACK] Seq=97 Ack=289601 Win=537728 Len=0 TSval=29477391 TSecr=652926952
 72   0.034685 54.230.30.222 -> 172.31.36.109 TCP 13098 [TCP segment of a reassembled PDU]
 73   0.034692 172.31.36.109 -> 54.230.30.222 TCP 66 55923 > http [ACK] Seq=97 Ack=302633 Win=528256 Len=0 TSval=29477391 TSecr=652926952
 74   0.034965 54.230.30.222 -> 172.31.36.109 TCP 23234 [TCP segment of a reassembled PDU]
 75   0.034977 172.31.36.109 -> 54.230.30.222 TCP 66 55923 > http [ACK] Seq=97 Ack=325801 Win=511616 Len=0 TSval=29477391 TSecr=652926952
 76   0.035019 54.230.30.222 -> 172.31.36.109 TCP 8754 [TCP segment of a reassembled PDU]
 77   0.035026 172.31.36.109 -> 54.230.30.222 TCP 66 55923 > http [ACK] Seq=97 Ack=334489 Win=535424 Len=0 TSval=29477391 TSecr=652926952
 78   0.035122 54.230.30.222 -> 172.31.36.109 TCP 5858 [TCP segment of a reassembled PDU]
 79   0.035128 172.31.36.109 -> 54.230.30.222 TCP 66 55923 > http [ACK] Seq=97 Ack=340281 Win=540160 Len=0 TSval=29477392 TSecr=652926952
 80   0.035674 54.230.30.222 -> 172.31.36.109 TCP 1514 [TCP segment of a reassembled PDU]
 81   0.035679 172.31.36.109 -> 54.230.30.222 TCP 66 55923 > http [ACK] Seq=97 Ack=341729 Win=552192 Len=0 TSval=29477392 TSecr=652926952
 82   0.035843 54.230.30.222 -> 172.31.36.109 TCP 5858 [TCP segment of a reassembled PDU]
 83   0.035849 172.31.36.109 -> 54.230.30.222 TCP 66 55923 > http [ACK] Seq=97 Ack=347521 Win=563712 Len=0 TSval=29477392 TSecr=652926952
 84   0.036126 54.230.30.222 -> 172.31.36.109 TCP 2962 [TCP segment of a reassembled PDU]
 85   0.036131 172.31.36.109 -> 54.230.30.222 TCP 66 55923 > http [ACK] Seq=97 Ack=350417 Win=569472 Len=0 TSval=29477392 TSecr=652926952
 86   0.036261 54.230.30.222 -> 172.31.36.109 TCP 23234 [TCP segment of a reassembled PDU]
 87   0.036275 172.31.36.109 -> 54.230.30.222 TCP 66 55923 > http [ACK] Seq=97 Ack=373585 Win=615808 Len=0 TSval=29477392 TSecr=652926952
 88   0.036446 54.230.30.222 -> 172.31.36.109 TCP 14546 [TCP segment of a reassembled PDU]
 89   0.036455 172.31.36.109 -> 54.230.30.222 TCP 66 55923 > http [ACK] Seq=97 Ack=388065 Win=644864 Len=0 TSval=29477392 TSecr=652926952
 90   0.036856 54.230.30.222 -> 172.31.36.109 TCP 2962 [TCP segment of a reassembled PDU]
 91   0.036862 172.31.36.109 -> 54.230.30.222 TCP 66 55923 > http [ACK] Seq=97 Ack=390961 Win=650624 Len=0 TSval=29477392 TSecr=652926952
 92   0.036988 54.230.30.222 -> 172.31.36.109 TCP 10202 [TCP segment of a reassembled PDU]
 93   0.036995 172.31.36.109 -> 54.230.30.222 TCP 66 55923 > http [ACK] Seq=97 Ack=401097 Win=670848 Len=0 TSval=29477392 TSecr=652926952
 94   0.037220 54.230.30.222 -> 172.31.36.109 TCP 11650 [TCP segment of a reassembled PDU]
 95   0.037228 172.31.36.109 -> 54.230.30.222 TCP 66 55923 > http [ACK] Seq=97 Ack=412681 Win=694016 Len=0 TSval=29477392 TSecr=652926952
 96   0.037467 54.230.30.222 -> 172.31.36.109 TCP 17442 [TCP segment of a reassembled PDU]
 97   0.037478 172.31.36.109 -> 54.230.30.222 TCP 66 55923 > http [ACK] Seq=97 Ack=430057 Win=728832 Len=0 TSval=29477392 TSecr=652926952
 98   0.037703 54.230.30.222 -> 172.31.36.109 TCP 14546 [TCP segment of a reassembled PDU]
 99   0.037713 172.31.36.109 -> 54.230.30.222 TCP 66 55923 > http [ACK] Seq=97 Ack=444537 Win=757760 Len=0 TSval=29477392 TSecr=652926952
100   0.038138 54.230.30.222 -> 172.31.36.109 TCP 4410 [TCP segment of a reassembled PDU]
101   0.038144 172.31.36.109 -> 54.230.30.222 TCP 66 55923 > http [ACK] Seq=97 Ack=448881 Win=766464 Len=0 TSval=29477392 TSecr=652926952
102   0.038305 54.230.30.222 -> 172.31.36.109 TCP 24682 [TCP segment of a reassembled PDU]
103   0.038318 172.31.36.109 -> 54.230.30.222 TCP 66 55923 > http [ACK] Seq=97 Ack=473497 Win=815744 Len=0 TSval=29477392 TSecr=652926952
104   0.038390 54.230.30.222 -> 172.31.36.109 TCP 4410 [TCP segment of a reassembled PDU]
105   0.038395 172.31.36.109 -> 54.230.30.222 TCP 66 55923 > http [ACK] Seq=97 Ack=477841 Win=824320 Len=0 TSval=29477392 TSecr=652926952
106   0.038645 54.230.30.222 -> 172.31.36.109 TCP 2962 [TCP segment of a reassembled PDU]
107   0.038650 172.31.36.109 -> 54.230.30.222 TCP 66 55923 > http [ACK] Seq=97 Ack=480737 Win=830208 Len=0 TSval=29477392 TSecr=652926952
108   0.038801 54.230.30.222 -> 172.31.36.109 TCP 17442 [TCP segment of a reassembled PDU]
109   0.038811 172.31.36.109 -> 54.230.30.222 TCP 66 55923 > http [ACK] Seq=97 Ack=498113 Win=836352 Len=0 TSval=29477392 TSecr=652926952
110   0.038897 54.230.30.222 -> 172.31.36.109 TCP 2962 [TCP segment of a reassembled PDU]
111   0.038903 172.31.36.109 -> 54.230.30.222 TCP 66 55923 > http [ACK] Seq=97 Ack=501009 Win=833536 Len=0 TSval=29477392 TSecr=652926952
112   0.039034 54.230.30.222 -> 172.31.36.109 TCP 7306 [TCP segment of a reassembled PDU]
113   0.039041 172.31.36.109 -> 54.230.30.222 TCP 66 55923 > http [ACK] Seq=97 Ack=508249 Win=853120 Len=0 TSval=29477392 TSecr=652926952
114   0.039432 54.230.30.222 -> 172.31.36.109 TCP 5858 [TCP segment of a reassembled PDU]
115   0.039438 172.31.36.109 -> 54.230.30.222 TCP 66 55923 > http [ACK] Seq=97 Ack=514041 Win=855424 Len=0 TSval=29477393 TSecr=652926952
116   0.039620 54.230.30.222 -> 172.31.36.109 TCP 29026 [TCP segment of a reassembled PDU]
117   0.039646 172.31.36.109 -> 54.230.30.222 TCP 66 55923 > http [ACK] Seq=97 Ack=543001 Win=826496 Len=0 TSval=29477393 TSecr=652926952
118   0.039925 54.230.30.222 -> 172.31.36.109 TCP 1514 [TCP segment of a reassembled PDU]
119   0.040078 54.230.30.222 -> 172.31.36.109 TCP 13098 [TCP segment of a reassembled PDU]
120   0.040086 172.31.36.109 -> 54.230.30.222 TCP 66 55923 > http [ACK] Seq=97 Ack=557481 Win=843648 Len=0 TSval=29477393 TSecr=652926952
121   0.040357 54.230.30.222 -> 172.31.36.109 TCP 27578 [TCP segment of a reassembled PDU]
122   0.040383 172.31.36.109 -> 54.230.30.222 TCP 66 55923 > http [ACK] Seq=97 Ack=584993 Win=819712 Len=0 TSval=29477393 TSecr=652926952
123   0.040706 54.230.30.222 -> 172.31.36.109 TCP 2962 [TCP segment of a reassembled PDU]
124   0.040712 172.31.36.109 -> 54.230.30.222 TCP 66 55923 > http [ACK] Seq=97 Ack=587889 Win=860160 Len=0 TSval=29477393 TSecr=652926952
125   0.040857 54.230.30.222 -> 172.31.36.109 TCP 17442 [TCP segment of a reassembled PDU]
126   0.040878 172.31.36.109 -> 54.230.30.222 TCP 66 55923 > http [ACK] Seq=97 Ack=605265 Win=842880 Len=0 TSval=29477393 TSecr=652926952
127   0.040945 54.230.30.222 -> 172.31.36.109 TCP 2962 [TCP segment of a reassembled PDU]
128   0.040950 172.31.36.109 -> 54.230.30.222 TCP 66 55923 > http [ACK] Seq=97 Ack=608161 Win=860160 Len=0 TSval=29477393 TSecr=652926952
129   0.041211 54.230.30.222 -> 172.31.36.109 TCP 2962 [TCP segment of a reassembled PDU]
130   0.041217 172.31.36.109 -> 54.230.30.222 TCP 66 55923 > http [ACK] Seq=97 Ack=611057 Win=860160 Len=0 TSval=29477393 TSecr=652926953
131   0.041373 54.230.30.222 -> 172.31.36.109 TCP 23234 [TCP segment of a reassembled PDU]
132   0.041397 172.31.36.109 -> 54.230.30.222 TCP 66 55923 > http [ACK] Seq=97 Ack=634225 Win=836992 Len=0 TSval=29477393 TSecr=652926953
133   0.041448 54.230.30.222 -> 172.31.36.109 TCP 2962 [TCP segment of a reassembled PDU]
134   0.041453 172.31.36.109 -> 54.230.30.222 TCP 66 55923 > http [ACK] Seq=97 Ack=637121 Win=860160 Len=0 TSval=29477393 TSecr=652926953
135   0.041604 54.230.30.222 -> 172.31.36.109 TCP 18890 [TCP segment of a reassembled PDU]
136   0.041625 172.31.36.109 -> 54.230.30.222 TCP 66 55923 > http [ACK] Seq=97 Ack=655945 Win=841344 Len=0 TSval=29477393 TSecr=652926953
137   0.041862 54.230.30.222 -> 172.31.36.109 TCP 17442 [TCP segment of a reassembled PDU]
138   0.041884 172.31.36.109 -> 54.230.30.222 TCP 66 55923 > http [ACK] Seq=97 Ack=673321 Win=836352 Len=0 TSval=29477393 TSecr=652926953
139   0.042135 54.230.30.222 -> 172.31.36.109 TCP 26130 [TCP segment of a reassembled PDU]
140   0.042160 172.31.36.109 -> 54.230.30.222 TCP 66 55923 > http [ACK] Seq=97 Ack=699385 Win=822144 Len=0 TSval=29477393 TSecr=652926953
141   0.042218 54.230.30.222 -> 172.31.36.109 TCP 5858 [TCP segment of a reassembled PDU]
142   0.042224 172.31.36.109 -> 54.230.30.222 TCP 66 55923 > http [ACK] Seq=97 Ack=705177 Win=855424 Len=0 TSval=29477393 TSecr=652926953
143   0.042329 54.230.30.222 -> 172.31.36.109 TCP 2962 [TCP segment of a reassembled PDU]
144   0.042334 172.31.36.109 -> 54.230.30.222 TCP 66 55923 > http [ACK] Seq=97 Ack=708073 Win=860160 Len=0 TSval=29477393 TSecr=652926953
145   0.042608 54.230.30.222 -> 172.31.36.109 TCP 18890 [TCP segment of a reassembled PDU]
146   0.042630 172.31.36.109 -> 54.230.30.222 TCP 66 55923 > http [ACK] Seq=97 Ack=726897 Win=841344 Len=0 TSval=29477393 TSecr=652926953
147   0.042850 54.230.30.222 -> 172.31.36.109 TCP 11650 [TCP segment of a reassembled PDU]
148   0.042858 172.31.36.109 -> 54.230.30.222 TCP 66 55923 > http [ACK] Seq=97 Ack=738481 Win=845952 Len=0 TSval=29477393 TSecr=652926953
149   0.043121 54.230.30.222 -> 172.31.36.109 TCP 18890 [TCP segment of a reassembled PDU]
150   0.043146 172.31.36.109 -> 54.230.30.222 TCP 66 55923 > http [ACK] Seq=97 Ack=757305 Win=864896 Len=0 TSval=29477394 TSecr=652926953
151   0.043442 54.230.30.222 -> 172.31.36.109 TCP 39162 [TCP segment of a reassembled PDU]
152   0.043461 172.31.36.109 -> 54.230.30.222 TCP 66 55923 > http [ACK] Seq=97 Ack=796401 Win=872832 Len=0 TSval=29477394 TSecr=652926953
153   0.043485 54.230.30.222 -> 172.31.36.109 TCP 5858 [TCP segment of a reassembled PDU]
154   0.043494 172.31.36.109 -> 54.230.30.222 TCP 66 55923 > http [ACK] Seq=97 Ack=802193 Win=867072 Len=0 TSval=29477394 TSecr=652926953
155   0.043597 54.230.30.222 -> 172.31.36.109 TCP 1514 [TCP segment of a reassembled PDU]
156   0.043773 54.230.30.222 -> 172.31.36.109 TCP 4410 [TCP segment of a reassembled PDU]
157   0.043779 172.31.36.109 -> 54.230.30.222 TCP 66 55923 > http [ACK] Seq=97 Ack=807985 Win=929920 Len=0 TSval=29477394 TSecr=652926953
158   0.043900 54.230.30.222 -> 172.31.36.109 TCP 13098 [TCP segment of a reassembled PDU]
159   0.043919 172.31.36.109 -> 54.230.30.222 TCP 66 55923 > http [ACK] Seq=97 Ack=821017 Win=937216 Len=0 TSval=29477394 TSecr=652926953
160   0.044150 54.230.30.222 -> 172.31.36.109 TCP 23234 [TCP segment of a reassembled PDU]
161   0.044173 172.31.36.109 -> 54.230.30.222 TCP 66 55923 > http [ACK] Seq=97 Ack=844185 Win=914048 Len=0 TSval=29477394 TSecr=652926953
162   0.044383 54.230.30.222 -> 172.31.36.109 TCP 8754 [TCP segment of a reassembled PDU]
163   0.044390 172.31.36.109 -> 54.230.30.222 TCP 66 55923 > http [ACK] Seq=97 Ack=852873 Win=922880 Len=0 TSval=29477394 TSecr=652926953
164   0.044409 54.230.30.222 -> 172.31.36.109 TCP 13098 [TCP segment of a reassembled PDU]
165   0.044441 172.31.36.109 -> 54.230.30.222 TCP 66 55923 > http [ACK] Seq=97 Ack=865905 Win=915712 Len=0 TSval=29477394 TSecr=652926953
166   0.044489 54.230.30.222 -> 172.31.36.109 TCP 2962 [TCP segment of a reassembled PDU]
167   0.044494 172.31.36.109 -> 54.230.30.222 TCP 66 55923 > http [ACK] Seq=97 Ack=868801 Win=932352 Len=0 TSval=29477394 TSecr=652926953
168   0.044595 54.230.30.222 -> 172.31.36.109 TCP 15994 [TCP segment of a reassembled PDU]
169   0.044690 54.230.30.222 -> 172.31.36.109 TCP 4410 [TCP segment of a reassembled PDU]
170   0.044716 172.31.36.109 -> 54.230.30.222 TCP 66 55923 > http [ACK] Seq=97 Ack=889073 Win=912128 Len=0 TSval=29477394 TSecr=652926953
171   0.044829 54.230.30.222 -> 172.31.36.109 TCP 8754 [TCP segment of a reassembled PDU]
172   0.044837 172.31.36.109 -> 54.230.30.222 TCP 66 55923 > http [ACK] Seq=97 Ack=897761 Win=922880 Len=0 TSval=29477394 TSecr=652926953
173   0.044949 54.230.30.222 -> 172.31.36.109 TCP 15994 [TCP segment of a reassembled PDU]
174   0.044985 172.31.36.109 -> 54.230.30.222 TCP 66 55923 > http [ACK] Seq=97 Ack=913689 Win=937216 Len=0 TSval=29477394 TSecr=652926953
175   0.045062 54.230.30.222 -> 172.31.36.109 TCP 2962 [TCP segment of a reassembled PDU]
176   0.045076 172.31.36.109 -> 54.230.30.222 TCP 66 55923 > http [ACK] Seq=97 Ack=916585 Win=937216 Len=0 TSval=29477394 TSecr=652926953
177   0.045203 54.230.30.222 -> 172.31.36.109 TCP 13098 [TCP segment of a reassembled PDU]
178   0.045221 172.31.36.109 -> 54.230.30.222 TCP 66 55923 > http [ACK] Seq=97 Ack=929617 Win=937216 Len=0 TSval=29477394 TSecr=652926953
179   0.045306 54.230.30.222 -> 172.31.36.109 TCP 4410 [TCP segment of a reassembled PDU]
180   0.045322 172.31.36.109 -> 54.230.30.222 TCP 66 55923 > http [ACK] Seq=97 Ack=933961 Win=937216 Len=0 TSval=29477394 TSecr=652926953
181   0.045570 54.230.30.222 -> 172.31.36.109 TCP 2962 [TCP segment of a reassembled PDU]
182   0.045584 172.31.36.109 -> 54.230.30.222 TCP 66 55923 > http [ACK] Seq=97 Ack=936857 Win=937216 Len=0 TSval=29477394 TSecr=652926953
183   0.045741 54.230.30.222 -> 172.31.36.109 TCP 26130 [TCP segment of a reassembled PDU]
184   0.045766 172.31.36.109 -> 54.230.30.222 TCP 66 55923 > http [ACK] Seq=97 Ack=962921 Win=911232 Len=0 TSval=29477394 TSecr=652926953
185   0.045830 54.230.30.222 -> 172.31.36.109 TCP 8754 [TCP segment of a reassembled PDU]
186   0.045837 172.31.36.109 -> 54.230.30.222 TCP 66 55923 > http [ACK] Seq=97 Ack=971609 Win=922880 Len=0 TSval=29477394 TSecr=652926953
187   0.045956 54.230.30.222 -> 172.31.36.109 TCP 11650 [TCP segment of a reassembled PDU]
188   0.045975 172.31.36.109 -> 54.230.30.222 TCP 66 55923 > http [ACK] Seq=97 Ack=983193 Win=937216 Len=0 TSval=29477394 TSecr=652926953
189   0.046287 54.230.30.222 -> 172.31.36.109 TCP 42058 [TCP segment of a reassembled PDU]
190   0.046327 54.230.30.222 -> 172.31.36.109 TCP 5858 [TCP segment of a reassembled PDU]
191   0.046332 172.31.36.109 -> 54.230.30.222 TCP 66 55923 > http [ACK] Seq=97 Ack=1025185 Win=895232 Len=0 TSval=29477394 TSecr=652926953
192   0.046345 172.31.36.109 -> 54.230.30.222 TCP 66 55923 > http [ACK] Seq=97 Ack=1030977 Win=889472 Len=0 TSval=29477394 TSecr=652926953
193   0.046451 54.230.30.222 -> 172.31.36.109 TCP 11650 [TCP segment of a reassembled PDU]
194   0.046459 172.31.36.109 -> 54.230.30.222 TCP 66 55923 > http [ACK] Seq=97 Ack=1042561 Win=918144 Len=0 TSval=29477394 TSecr=652926953
195   0.046677 54.230.30.222 -> 172.31.36.109 TCP 2962 [TCP segment of a reassembled PDU]
196   0.046682 172.31.36.109 -> 54.230.30.222 TCP 66 55923 > http [ACK] Seq=97 Ack=1045457 Win=932352 Len=0 TSval=29477394 TSecr=652926953
197   0.046928 54.230.30.222 -> 172.31.36.109 HTTP 3643 HTTP/1.1 200 OK  (application/octet-stream)
198   0.046944 172.31.36.109 -> 54.230.30.222 TCP 66 55923 > http [ACK] Seq=97 Ack=1049034 Win=937216 Len=0 TSval=29477394 TSecr=652926953
199   0.047068 172.31.36.109 -> 54.230.30.222 TCP 66 55923 > http [FIN, ACK] Seq=97 Ack=1049034 Win=937216 Len=0 TSval=29477394 TSecr=652926953
200   0.048044 54.230.30.222 -> 172.31.36.109 TCP 66 http > 55923 [FIN, ACK] Seq=1049034 Ack=98 Win=14592 Len=0 TSval=652926953 TSecr=29477394
201   0.048054 172.31.36.109 -> 54.230.30.222 TCP 66 55923 > http [ACK] Seq=98 Ack=1049035 Win=937216 Len=0 TSval=29477395 TSecr=652926953
