[Measurement for 1mb at 12:30:22 20.30.2014] 
Tshark:

  1   0.000000 172.31.36.109 -> 172.31.0.2   DNS 89 Standard query 0x1500  A d39wppo36gwqpx.cloudfront.net
  2   0.000028 172.31.36.109 -> 172.31.0.2   DNS 89 Standard query 0x55db  AAAA d39wppo36gwqpx.cloudfront.net
  3   0.000439   172.31.0.2 -> 172.31.36.109 DNS 170 Standard query response 0x55db 
  4   0.000449   172.31.0.2 -> 172.31.36.109 DNS 217 Standard query response 0x1500  A 54.230.31.9 A 54.192.30.187 A 54.230.29.239 A 54.230.29.242 A 54.230.30.192 A 54.230.30.207 A 54.230.30.247 A 54.230.30.249
  5   0.003890 172.31.36.109 -> 54.230.31.9  TCP 74 51684 > http [SYN] Seq=0 Win=26883 Len=0 MSS=8961 SACK_PERM=1 TSval=37577270 TSecr=0 WS=128
  6   0.005042  54.230.31.9 -> 172.31.36.109 TCP 74 http > 51684 [SYN, ACK] Seq=0 Ack=1 Win=14480 Len=0 MSS=1460 SACK_PERM=1 TSval=736552486 TSecr=37577270 WS=128
  7   0.005057 172.31.36.109 -> 54.230.31.9  TCP 66 51684 > http [ACK] Seq=1 Ack=1 Win=27008 Len=0 TSval=37577270 TSecr=736552486
  8   0.005098 172.31.36.109 -> 54.230.31.9  HTTP 162 GET /1mb HTTP/1.1 
  9   0.006298  54.230.31.9 -> 172.31.36.109 TCP 66 http > 51684 [ACK] Seq=1 Ack=97 Win=14592 Len=0 TSval=736552486 TSecr=37577270
 10   0.057454  54.230.31.9 -> 172.31.36.109 TCP 14176 [TCP segment of a reassembled PDU]
 11   0.057478 172.31.36.109 -> 54.230.31.9  TCP 66 51684 > http [ACK] Seq=97 Ack=14111 Win=55168 Len=0 TSval=37577283 TSecr=736552491
 12   0.058913  54.230.31.9 -> 172.31.36.109 TCP 13098 [TCP segment of a reassembled PDU]
 13   0.058923 172.31.36.109 -> 54.230.31.9  TCP 66 51684 > http [ACK] Seq=97 Ack=27143 Win=81280 Len=0 TSval=37577284 TSecr=736552492
 14   0.060216  54.230.31.9 -> 172.31.36.109 TCP 11650 [TCP segment of a reassembled PDU]
 15   0.060226 172.31.36.109 -> 54.230.31.9  TCP 66 51684 > http [ACK] Seq=97 Ack=38727 Win=98944 Len=0 TSval=37577284 TSecr=736552492
 16   0.060232  54.230.31.9 -> 172.31.36.109 TCP 1514 [TCP segment of a reassembled PDU]
 17   0.060235 172.31.36.109 -> 54.230.31.9  TCP 66 51684 > http [ACK] Seq=97 Ack=40175 Win=97536 Len=0 TSval=37577284 TSecr=736552492
 18   0.061736  54.230.31.9 -> 172.31.36.109 TCP 2962 [TCP segment of a reassembled PDU]
 19   0.061743 172.31.36.109 -> 54.230.31.9  TCP 66 51684 > http [ACK] Seq=97 Ack=43071 Win=109056 Len=0 TSval=37577284 TSecr=736552492
 20   0.061772  54.230.31.9 -> 172.31.36.109 TCP 17442 [TCP segment of a reassembled PDU]
 21   0.061781 172.31.36.109 -> 54.230.31.9  TCP 66 51684 > http [ACK] Seq=97 Ack=60447 Win=91776 Len=0 TSval=37577284 TSecr=736552492
 22   0.062975  54.230.31.9 -> 172.31.36.109 TCP 5858 [TCP segment of a reassembled PDU]
 23   0.062983 172.31.36.109 -> 54.230.31.9  TCP 66 51684 > http [ACK] Seq=97 Ack=66239 Win=120704 Len=0 TSval=37577285 TSecr=736552492
 24   0.062998  54.230.31.9 -> 172.31.36.109 TCP 10202 [TCP segment of a reassembled PDU]
 25   0.063007 172.31.36.109 -> 54.230.31.9  TCP 66 51684 > http [ACK] Seq=97 Ack=76375 Win=140928 Len=0 TSval=37577285 TSecr=736552492
 26   0.063146  54.230.31.9 -> 172.31.36.109 TCP 2962 [TCP segment of a reassembled PDU]
 27   0.063151 172.31.36.109 -> 54.230.31.9  TCP 66 51684 > http [ACK] Seq=97 Ack=79271 Win=146688 Len=0 TSval=37577285 TSecr=736552492
 28   0.064337  54.230.31.9 -> 172.31.36.109 TCP 7306 [TCP segment of a reassembled PDU]
 29   0.064349 172.31.36.109 -> 54.230.31.9  TCP 66 51684 > http [ACK] Seq=97 Ack=86511 Win=161152 Len=0 TSval=37577285 TSecr=736552492
 30   0.064363  54.230.31.9 -> 172.31.36.109 TCP 7306 [TCP segment of a reassembled PDU]
 31   0.064372 172.31.36.109 -> 54.230.31.9  TCP 66 51684 > http [ACK] Seq=97 Ack=93751 Win=174336 Len=0 TSval=37577285 TSecr=736552492
 32   0.064472  54.230.31.9 -> 172.31.36.109 TCP 11650 [TCP segment of a reassembled PDU]
 33   0.064481 172.31.36.109 -> 54.230.31.9  TCP 66 51684 > http [ACK] Seq=97 Ack=105335 Win=179200 Len=0 TSval=37577285 TSecr=736552492
 34   0.064521  54.230.31.9 -> 172.31.36.109 TCP 1514 [TCP segment of a reassembled PDU]
 35   0.064526 172.31.36.109 -> 54.230.31.9  TCP 66 51684 > http [ACK] Seq=97 Ack=106783 Win=195840 Len=0 TSval=37577285 TSecr=736552492
 36   0.065795  54.230.31.9 -> 172.31.36.109 TCP 5858 [TCP segment of a reassembled PDU]
 37   0.065802 172.31.36.109 -> 54.230.31.9  TCP 66 51684 > http [ACK] Seq=97 Ack=112575 Win=190080 Len=0 TSval=37577285 TSecr=736552492
 38   0.065898  54.230.31.9 -> 172.31.36.109 TCP 10202 [TCP segment of a reassembled PDU]
 39   0.065905 172.31.36.109 -> 54.230.31.9  TCP 66 51684 > http [ACK] Seq=97 Ack=122711 Win=181632 Len=0 TSval=37577285 TSecr=736552492
 40   0.066113  54.230.31.9 -> 172.31.36.109 TCP 11650 [TCP segment of a reassembled PDU]
 41   0.066122 172.31.36.109 -> 54.230.31.9  TCP 66 51684 > http [ACK] Seq=97 Ack=134295 Win=179200 Len=0 TSval=37577285 TSecr=736552492
 42   0.067066  54.230.31.9 -> 172.31.36.109 TCP 10202 [TCP segment of a reassembled PDU]
 43   0.067075 172.31.36.109 -> 54.230.31.9  TCP 66 51684 > http [ACK] Seq=97 Ack=144431 Win=219136 Len=0 TSval=37577286 TSecr=736552492
 44   0.067130  54.230.31.9 -> 172.31.36.109 TCP 2962 [TCP segment of a reassembled PDU]
 45   0.067135 172.31.36.109 -> 54.230.31.9  TCP 66 51684 > http [ACK] Seq=97 Ack=147327 Win=224896 Len=0 TSval=37577286 TSecr=736552492
 46   0.067339  54.230.31.9 -> 172.31.36.109 TCP 14546 [TCP segment of a reassembled PDU]
 47   0.067349 172.31.36.109 -> 54.230.31.9  TCP 66 51684 > http [ACK] Seq=97 Ack=161807 Win=253824 Len=0 TSval=37577286 TSecr=736552492
 48   0.068280  54.230.31.9 -> 172.31.36.109 TCP 2962 [TCP segment of a reassembled PDU]
 49   0.068286 172.31.36.109 -> 54.230.31.9  TCP 66 51684 > http [ACK] Seq=97 Ack=164703 Win=259712 Len=0 TSval=37577286 TSecr=736552492
 50   0.068419  54.230.31.9 -> 172.31.36.109 TCP 18890 [TCP segment of a reassembled PDU]
 51   0.068430 172.31.36.109 -> 54.230.31.9  TCP 66 51684 > http [ACK] Seq=97 Ack=183527 Win=297344 Len=0 TSval=37577286 TSecr=736552492
 52   0.068575  54.230.31.9 -> 172.31.36.109 TCP 15994 [TCP segment of a reassembled PDU]
 53   0.068585 172.31.36.109 -> 54.230.31.9  TCP 66 51684 > http [ACK] Seq=97 Ack=199455 Win=329216 Len=0 TSval=37577286 TSecr=736552493
 54   0.068848  54.230.31.9 -> 172.31.36.109 TCP 4410 [TCP segment of a reassembled PDU]
 55   0.068854 172.31.36.109 -> 54.230.31.9  TCP 66 51684 > http [ACK] Seq=97 Ack=203799 Win=337792 Len=0 TSval=37577286 TSecr=736552493
 56   0.069814  54.230.31.9 -> 172.31.36.109 TCP 5858 [TCP segment of a reassembled PDU]
 57   0.069824 172.31.36.109 -> 54.230.31.9  TCP 66 51684 > http [ACK] Seq=97 Ack=209591 Win=349440 Len=0 TSval=37577286 TSecr=736552493
 58   0.069950  54.230.31.9 -> 172.31.36.109 TCP 7306 [TCP segment of a reassembled PDU]
 59   0.069957 172.31.36.109 -> 54.230.31.9  TCP 66 51684 > http [ACK] Seq=97 Ack=216831 Win=363904 Len=0 TSval=37577286 TSecr=736552493
 60   0.069969  54.230.31.9 -> 172.31.36.109 TCP 10202 [TCP segment of a reassembled PDU]
 61   0.069978 172.31.36.109 -> 54.230.31.9  TCP 66 51684 > http [ACK] Seq=97 Ack=226967 Win=384128 Len=0 TSval=37577286 TSecr=736552493
 62   0.070161  54.230.31.9 -> 172.31.36.109 TCP 18890 [TCP segment of a reassembled PDU]
 63   0.070173 172.31.36.109 -> 54.230.31.9  TCP 66 51684 > http [ACK] Seq=97 Ack=245791 Win=421888 Len=0 TSval=37577287 TSecr=736552493
 64   0.071135  54.230.31.9 -> 172.31.36.109 TCP 4410 [TCP segment of a reassembled PDU]
 65   0.071142 172.31.36.109 -> 54.230.31.9  TCP 66 51684 > http [ACK] Seq=97 Ack=250135 Win=430464 Len=0 TSval=37577287 TSecr=736552493
 66   0.071276  54.230.31.9 -> 172.31.36.109 TCP 20338 [TCP segment of a reassembled PDU]
 67   0.071290 172.31.36.109 -> 54.230.31.9  TCP 66 51684 > http [ACK] Seq=97 Ack=270407 Win=471040 Len=0 TSval=37577287 TSecr=736552493
 68   0.071339  54.230.31.9 -> 172.31.36.109 TCP 1514 [TCP segment of a reassembled PDU]
 69   0.071344 172.31.36.109 -> 54.230.31.9  TCP 66 51684 > http [ACK] Seq=97 Ack=271855 Win=473984 Len=0 TSval=37577287 TSecr=736552493
 70   0.071507  54.230.31.9 -> 172.31.36.109 TCP 20338 [TCP segment of a reassembled PDU]
 71   0.071519 172.31.36.109 -> 54.230.31.9  TCP 66 51684 > http [ACK] Seq=97 Ack=292127 Win=514560 Len=0 TSval=37577287 TSecr=736552493
 72   0.071608  54.230.31.9 -> 172.31.36.109 TCP 7306 [TCP segment of a reassembled PDU]
 73   0.071615 172.31.36.109 -> 54.230.31.9  TCP 66 51684 > http [ACK] Seq=97 Ack=299367 Win=529024 Len=0 TSval=37577287 TSecr=736552493
 74   0.072630  54.230.31.9 -> 172.31.36.109 TCP 2962 [TCP segment of a reassembled PDU]
 75   0.072636 172.31.36.109 -> 54.230.31.9  TCP 66 51684 > http [ACK] Seq=97 Ack=302263 Win=534784 Len=0 TSval=37577287 TSecr=736552493
 76   0.072780  54.230.31.9 -> 172.31.36.109 TCP 21786 [TCP segment of a reassembled PDU]
 77   0.072792 172.31.36.109 -> 54.230.31.9  TCP 66 51684 > http [ACK] Seq=97 Ack=323983 Win=578176 Len=0 TSval=37577287 TSecr=736552493
 78   0.072998  54.230.31.9 -> 172.31.36.109 TCP 5858 [TCP segment of a reassembled PDU]
 79   0.073005 172.31.36.109 -> 54.230.31.9  TCP 66 51684 > http [ACK] Seq=97 Ack=329775 Win=589824 Len=0 TSval=37577287 TSecr=736552493
 80   0.073263  54.230.31.9 -> 172.31.36.109 TCP 21786 [TCP segment of a reassembled PDU]
 81   0.073287 172.31.36.109 -> 54.230.31.9  TCP 66 51684 > http [ACK] Seq=97 Ack=351495 Win=633216 Len=0 TSval=37577287 TSecr=736552493
 82   0.073954  54.230.31.9 -> 172.31.36.109 TCP 7306 [TCP segment of a reassembled PDU]
 83   0.073961 172.31.36.109 -> 54.230.31.9  TCP 66 51684 > http [ACK] Seq=97 Ack=358735 Win=647680 Len=0 TSval=37577287 TSecr=736552493
 84   0.074069  54.230.31.9 -> 172.31.36.109 TCP 7306 [TCP segment of a reassembled PDU]
 85   0.074076 172.31.36.109 -> 54.230.31.9  TCP 66 51684 > http [ACK] Seq=97 Ack=365975 Win=662144 Len=0 TSval=37577287 TSecr=736552493
 86   0.074158  54.230.31.9 -> 172.31.36.109 TCP 5858 [TCP segment of a reassembled PDU]
 87   0.074164 172.31.36.109 -> 54.230.31.9  TCP 66 51684 > http [ACK] Seq=97 Ack=371767 Win=673792 Len=0 TSval=37577288 TSecr=736552493
 88   0.074306  54.230.31.9 -> 172.31.36.109 TCP 17442 [TCP segment of a reassembled PDU]
 89   0.074316 172.31.36.109 -> 54.230.31.9  TCP 66 51684 > http [ACK] Seq=97 Ack=389143 Win=692224 Len=0 TSval=37577288 TSecr=736552493
 90   0.074563  54.230.31.9 -> 172.31.36.109 TCP 18890 [TCP segment of a reassembled PDU]
 91   0.074587 172.31.36.109 -> 54.230.31.9  TCP 66 51684 > http [ACK] Seq=97 Ack=407967 Win=689920 Len=0 TSval=37577288 TSecr=736552493
 92   0.074670  54.230.31.9 -> 172.31.36.109 TCP 5858 [TCP segment of a reassembled PDU]
 93   0.074677 172.31.36.109 -> 54.230.31.9  TCP 66 51684 > http [ACK] Seq=97 Ack=413759 Win=711296 Len=0 TSval=37577288 TSecr=736552493
 94   0.074788  54.230.31.9 -> 172.31.36.109 TCP 4410 [TCP segment of a reassembled PDU]
 95   0.074794 172.31.36.109 -> 54.230.31.9  TCP 66 51684 > http [ACK] Seq=97 Ack=418103 Win=713728 Len=0 TSval=37577288 TSecr=736552493
 96   0.075458  54.230.31.9 -> 172.31.36.109 TCP 1514 [TCP segment of a reassembled PDU]
 97   0.075629  54.230.31.9 -> 172.31.36.109 TCP 21786 [TCP segment of a reassembled PDU]
 98   0.075651 172.31.36.109 -> 54.230.31.9  TCP 66 51684 > http [ACK] Seq=97 Ack=441271 Win=690560 Len=0 TSval=37577288 TSecr=736552493
 99   0.075693  54.230.31.9 -> 172.31.36.109 TCP 1514 [TCP segment of a reassembled PDU]
100   0.075823  54.230.31.9 -> 172.31.36.109 TCP 11650 [TCP segment of a reassembled PDU]
101   0.075831 172.31.36.109 -> 54.230.31.9  TCP 66 51684 > http [ACK] Seq=97 Ack=454303 Win=701824 Len=0 TSval=37577288 TSecr=736552493
102   0.076060  54.230.31.9 -> 172.31.36.109 TCP 20338 [TCP segment of a reassembled PDU]
103   0.076083 172.31.36.109 -> 54.230.31.9  TCP 66 51684 > http [ACK] Seq=97 Ack=474575 Win=687488 Len=0 TSval=37577288 TSecr=736552493
104   0.076133  54.230.31.9 -> 172.31.36.109 TCP 4410 [TCP segment of a reassembled PDU]
105   0.076139 172.31.36.109 -> 54.230.31.9  TCP 66 51684 > http [ACK] Seq=97 Ack=478919 Win=713728 Len=0 TSval=37577288 TSecr=736552493
106   0.076241  54.230.31.9 -> 172.31.36.109 TCP 2962 [TCP segment of a reassembled PDU]
107   0.076246 172.31.36.109 -> 54.230.31.9  TCP 66 51684 > http [ACK] Seq=97 Ack=481815 Win=716032 Len=0 TSval=37577288 TSecr=736552493
108   0.076984  54.230.31.9 -> 172.31.36.109 TCP 4410 [TCP segment of a reassembled PDU]
109   0.077008 172.31.36.109 -> 54.230.31.9  TCP 66 51684 > http [ACK] Seq=97 Ack=486159 Win=720128 Len=0 TSval=37577288 TSecr=736552493
110   0.077117  54.230.31.9 -> 172.31.36.109 TCP 17442 [TCP segment of a reassembled PDU]
111   0.077305 172.31.36.109 -> 54.230.31.9  TCP 66 51684 > http [ACK] Seq=97 Ack=503535 Win=702848 Len=0 TSval=37577288 TSecr=736552493
112   0.077392  54.230.31.9 -> 172.31.36.109 TCP 33370 [TCP segment of a reassembled PDU]
113   0.077434 172.31.36.109 -> 54.230.31.9  TCP 66 51684 > http [ACK] Seq=97 Ack=536839 Win=669568 Len=0 TSval=37577288 TSecr=736552493
114   0.077546  54.230.31.9 -> 172.31.36.109 TCP 10202 [TCP segment of a reassembled PDU]
115   0.077554 172.31.36.109 -> 54.230.31.9  TCP 66 51684 > http [ACK] Seq=97 Ack=546975 Win=704256 Len=0 TSval=37577288 TSecr=736552493
116   0.077658  54.230.31.9 -> 172.31.36.109 TCP 8754 [TCP segment of a reassembled PDU]
117   0.077665 172.31.36.109 -> 54.230.31.9  TCP 66 51684 > http [ACK] Seq=97 Ack=555663 Win=706560 Len=0 TSval=37577288 TSecr=736552493
118   0.078563  54.230.31.9 -> 172.31.36.109 TCP 13098 [TCP segment of a reassembled PDU]
119   0.078588 172.31.36.109 -> 54.230.31.9  TCP 66 51684 > http [ACK] Seq=97 Ack=568695 Win=720128 Len=0 TSval=37577289 TSecr=736552494
120   0.078676  54.230.31.9 -> 172.31.36.109 TCP 5858 [TCP segment of a reassembled PDU]
121   0.078683 172.31.36.109 -> 54.230.31.9  TCP 66 51684 > http [ACK] Seq=97 Ack=574487 Win=731648 Len=0 TSval=37577289 TSecr=736552494
122   0.078767  54.230.31.9 -> 172.31.36.109 TCP 5858 [TCP segment of a reassembled PDU]
123   0.078773 172.31.36.109 -> 54.230.31.9  TCP 66 51684 > http [ACK] Seq=97 Ack=580279 Win=743296 Len=0 TSval=37577289 TSecr=736552494
124   0.078941  54.230.31.9 -> 172.31.36.109 TCP 4410 [TCP segment of a reassembled PDU]
125   0.078947 172.31.36.109 -> 54.230.31.9  TCP 66 51684 > http [ACK] Seq=97 Ack=584623 Win=752000 Len=0 TSval=37577289 TSecr=736552494
126   0.078970  54.230.31.9 -> 172.31.36.109 TCP 21786 [TCP segment of a reassembled PDU]
127   0.078980 172.31.36.109 -> 54.230.31.9  TCP 66 51684 > http [ACK] Seq=97 Ack=606343 Win=795392 Len=0 TSval=37577289 TSecr=736552494
128   0.079068  54.230.31.9 -> 172.31.36.109 TCP 11650 [TCP segment of a reassembled PDU]
129   0.079077 172.31.36.109 -> 54.230.31.9  TCP 66 51684 > http [ACK] Seq=97 Ack=617927 Win=818560 Len=0 TSval=37577289 TSecr=736552494
130   0.079162  54.230.31.9 -> 172.31.36.109 TCP 7306 [TCP segment of a reassembled PDU]
131   0.079169 172.31.36.109 -> 54.230.31.9  TCP 66 51684 > http [ACK] Seq=97 Ack=625167 Win=833024 Len=0 TSval=37577289 TSecr=736552494
132   0.079815  54.230.31.9 -> 172.31.36.109 TCP 2962 [TCP segment of a reassembled PDU]
133   0.079822 172.31.36.109 -> 54.230.31.9  TCP 66 51684 > http [ACK] Seq=97 Ack=628063 Win=838912 Len=0 TSval=37577289 TSecr=736552494
134   0.079974  54.230.31.9 -> 172.31.36.109 TCP 21786 [TCP segment of a reassembled PDU]
135   0.079987 172.31.36.109 -> 54.230.31.9  TCP 66 51684 > http [ACK] Seq=97 Ack=649783 Win=882304 Len=0 TSval=37577289 TSecr=736552494
136   0.080320  54.230.31.9 -> 172.31.36.109 TCP 1514 [TCP segment of a reassembled PDU]
137   0.080325 172.31.36.109 -> 54.230.31.9  TCP 66 51684 > http [ACK] Seq=97 Ack=651231 Win=885248 Len=0 TSval=37577289 TSecr=736552494
138   0.080483  54.230.31.9 -> 172.31.36.109 TCP 17442 [TCP segment of a reassembled PDU]
139   0.080494 172.31.36.109 -> 54.230.31.9  TCP 66 51684 > http [ACK] Seq=97 Ack=668607 Win=919936 Len=0 TSval=37577289 TSecr=736552494
140   0.080505  54.230.31.9 -> 172.31.36.109 TCP 2962 [TCP segment of a reassembled PDU]
141   0.080508 172.31.36.109 -> 54.230.31.9  TCP 66 51684 > http [ACK] Seq=97 Ack=671503 Win=925696 Len=0 TSval=37577289 TSecr=736552494
142   0.080568  54.230.31.9 -> 172.31.36.109 TCP 5858 [TCP segment of a reassembled PDU]
143   0.080574 172.31.36.109 -> 54.230.31.9  TCP 66 51684 > http [ACK] Seq=97 Ack=677295 Win=937344 Len=0 TSval=37577289 TSecr=736552494
144   0.080699  54.230.31.9 -> 172.31.36.109 TCP 15994 [TCP segment of a reassembled PDU]
145   0.080709 172.31.36.109 -> 54.230.31.9  TCP 66 51684 > http [ACK] Seq=97 Ack=693223 Win=969216 Len=0 TSval=37577289 TSecr=736552494
146   0.080951  54.230.31.9 -> 172.31.36.109 TCP 21786 [TCP segment of a reassembled PDU]
147   0.080964 172.31.36.109 -> 54.230.31.9  TCP 66 51684 > http [ACK] Seq=97 Ack=714943 Win=1012608 Len=0 TSval=37577289 TSecr=736552494
148   0.081332  54.230.31.9 -> 172.31.36.109 TCP 2962 [TCP segment of a reassembled PDU]
149   0.081338 172.31.36.109 -> 54.230.31.9  TCP 66 51684 > http [ACK] Seq=97 Ack=717839 Win=1018368 Len=0 TSval=37577289 TSecr=736552494
150   0.081466  54.230.31.9 -> 172.31.36.109 TCP 11650 [TCP segment of a reassembled PDU]
151   0.081474 172.31.36.109 -> 54.230.31.9  TCP 66 51684 > http [ACK] Seq=97 Ack=729423 Win=1041536 Len=0 TSval=37577289 TSecr=736552494
152   0.081725  54.230.31.9 -> 172.31.36.109 TCP 24682 [TCP segment of a reassembled PDU]
153   0.081849  54.230.31.9 -> 172.31.36.109 TCP 5858 [TCP segment of a reassembled PDU]
154   0.081937 172.31.36.109 -> 54.230.31.9  TCP 66 51684 > http [ACK] Seq=97 Ack=759831 Win=1031168 Len=0 TSval=37577289 TSecr=736552494
155   0.081994  54.230.31.9 -> 172.31.36.109 TCP 15994 [TCP segment of a reassembled PDU]
156   0.082005 172.31.36.109 -> 54.230.31.9  TCP 66 51684 > http [ACK] Seq=97 Ack=775759 Win=1054976 Len=0 TSval=37577289 TSecr=736552494
157   0.082204  54.230.31.9 -> 172.31.36.109 TCP 5858 [TCP segment of a reassembled PDU]
158   0.082211 172.31.36.109 -> 54.230.31.9  TCP 66 51684 > http [ACK] Seq=97 Ack=781551 Win=1071744 Len=0 TSval=37577290 TSecr=736552494
159   0.082368  54.230.31.9 -> 172.31.36.109 TCP 26130 [TCP segment of a reassembled PDU]
160   0.082394 172.31.36.109 -> 54.230.31.9  TCP 66 51684 > http [ACK] Seq=97 Ack=807615 Win=1045760 Len=0 TSval=37577290 TSecr=736552494
161   0.082482  54.230.31.9 -> 172.31.36.109 TCP 20338 [TCP segment of a reassembled PDU]
162   0.082494 172.31.36.109 -> 54.230.31.9  TCP 66 51684 > http [ACK] Seq=97 Ack=827887 Win=1047936 Len=0 TSval=37577290 TSecr=736552494
163   0.082710  54.230.31.9 -> 172.31.36.109 TCP 17442 [TCP segment of a reassembled PDU]
164   0.082721 172.31.36.109 -> 54.230.31.9  TCP 66 51684 > http [ACK] Seq=97 Ack=845263 Win=1052672 Len=0 TSval=37577290 TSecr=736552494
165   0.083132  54.230.31.9 -> 172.31.36.109 TCP 5858 [TCP segment of a reassembled PDU]
166   0.083138 172.31.36.109 -> 54.230.31.9  TCP 66 51684 > http [ACK] Seq=97 Ack=851055 Win=1071744 Len=0 TSval=37577290 TSecr=736552494
167   0.083265  54.230.31.9 -> 172.31.36.109 TCP 10202 [TCP segment of a reassembled PDU]
168   0.083285 172.31.36.109 -> 54.230.31.9  TCP 66 51684 > http [ACK] Seq=97 Ack=861191 Win=1073408 Len=0 TSval=37577290 TSecr=736552494
169   0.083368  54.230.31.9 -> 172.31.36.109 TCP 1514 [TCP segment of a reassembled PDU]
170   0.083372 172.31.36.109 -> 54.230.31.9  TCP 66 51684 > http [ACK] Seq=97 Ack=862639 Win=1074176 Len=0 TSval=37577290 TSecr=736552494
171   0.083579  54.230.31.9 -> 172.31.36.109 TCP 27578 [TCP segment of a reassembled PDU]
172   0.083606 172.31.36.109 -> 54.230.31.9  TCP 66 51684 > http [ACK] Seq=97 Ack=890151 Win=1046784 Len=0 TSval=37577290 TSecr=736552494
173   0.083631  54.230.31.9 -> 172.31.36.109 TCP 4410 [TCP segment of a reassembled PDU]
174   0.083636 172.31.36.109 -> 54.230.31.9  TCP 66 51684 > http [ACK] Seq=97 Ack=894495 Win=1074048 Len=0 TSval=37577290 TSecr=736552494
175   0.083768  54.230.31.9 -> 172.31.36.109 TCP 15994 [TCP segment of a reassembled PDU]
176   0.083790 172.31.36.109 -> 54.230.31.9  TCP 66 51684 > http [ACK] Seq=97 Ack=910423 Win=1074176 Len=0 TSval=37577290 TSecr=736552494
177   0.084019  54.230.31.9 -> 172.31.36.109 TCP 20338 [TCP segment of a reassembled PDU]
178   0.084042 172.31.36.109 -> 54.230.31.9  TCP 66 51684 > http [ACK] Seq=97 Ack=930695 Win=1053952 Len=0 TSval=37577290 TSecr=736552494
179   0.084128  54.230.31.9 -> 172.31.36.109 TCP 1514 [TCP segment of a reassembled PDU]
180   0.084302  54.230.31.9 -> 172.31.36.109 TCP 20338 [TCP segment of a reassembled PDU]
181   0.084327  54.230.31.9 -> 172.31.36.109 TCP 5858 [TCP segment of a reassembled PDU]
182   0.084332  54.230.31.9 -> 172.31.36.109 TCP 1514 [TCP segment of a reassembled PDU]
183   0.084338  54.230.31.9 -> 172.31.36.109 TCP 4410 [TCP segment of a reassembled PDU]
184   0.084348 172.31.36.109 -> 54.230.31.9  TCP 66 51684 > http [ACK] Seq=97 Ack=963999 Win=1028864 Len=0 TSval=37577290 TSecr=736552494
185   0.084396  54.230.31.9 -> 172.31.36.109 TCP 2962 [TCP segment of a reassembled PDU]
186   0.084402 172.31.36.109 -> 54.230.31.9  TCP 66 51684 > http [ACK] Seq=97 Ack=966895 Win=1074176 Len=0 TSval=37577290 TSecr=736552494
187   0.084502  54.230.31.9 -> 172.31.36.109 TCP 8754 [TCP segment of a reassembled PDU]
188   0.084522 172.31.36.109 -> 54.230.31.9  TCP 66 51684 > http [ACK] Seq=97 Ack=975583 Win=1074176 Len=0 TSval=37577290 TSecr=736552494
189   0.084944  54.230.31.9 -> 172.31.36.109 TCP 1514 [TCP segment of a reassembled PDU]
190   0.085085  54.230.31.9 -> 172.31.36.109 TCP 17442 [TCP segment of a reassembled PDU]
191   0.085150  54.230.31.9 -> 172.31.36.109 TCP 4410 [TCP segment of a reassembled PDU]
192   0.085275  54.230.31.9 -> 172.31.36.109 TCP 18890 [TCP segment of a reassembled PDU]
193   0.085336 172.31.36.109 -> 54.230.31.9  TCP 66 51684 > http [ACK] Seq=97 Ack=1017575 Win=1032192 Len=0 TSval=37577290 TSecr=736552494
194   0.085431  54.230.31.9 -> 172.31.36.109 TCP 4410 [TCP segment of a reassembled PDU]
195   0.085437 172.31.36.109 -> 54.230.31.9  TCP 66 51684 > http [ACK] Seq=97 Ack=1021919 Win=1074048 Len=0 TSval=37577290 TSecr=736552494
196   0.085561  54.230.31.9 -> 172.31.36.109 TCP 18890 [TCP segment of a reassembled PDU]
197   0.085584 172.31.36.109 -> 54.230.31.9  TCP 66 51684 > http [ACK] Seq=97 Ack=1040743 Win=1055232 Len=0 TSval=37577290 TSecr=736552494
198   0.085789  54.230.31.9 -> 172.31.36.109 HTTP 8357 HTTP/1.1 200 OK  (application/octet-stream)
199   0.085796 172.31.36.109 -> 54.230.31.9  TCP 66 51684 > http [ACK] Seq=97 Ack=1049034 Win=1067008 Len=0 TSval=37577290 TSecr=736552494
200   0.085939 172.31.36.109 -> 54.230.31.9  TCP 66 51684 > http [FIN, ACK] Seq=97 Ack=1049034 Win=1074176 Len=0 TSval=37577290 TSecr=736552494
201   0.087196  54.230.31.9 -> 172.31.36.109 TCP 66 http > 51684 [FIN, ACK] Seq=1049034 Ack=98 Win=14592 Len=0 TSval=736552494 TSecr=37577290
202   0.087205 172.31.36.109 -> 54.230.31.9  TCP 66 51684 > http [ACK] Seq=98 Ack=1049035 Win=1074176 Len=0 TSval=37577291 TSecr=736552494
