[Measurement for 10kb at 17:35:57 19.35.2014] 
Tshark:

  1   0.000000 172.31.36.109 -> 172.31.0.2   DNS 88 Standard query 0x1f38  A dm53kc3eax57k.cloudfront.net
  2   0.000044 172.31.36.109 -> 172.31.0.2   DNS 88 Standard query 0xaf7a  AAAA dm53kc3eax57k.cloudfront.net
  3   0.000520   172.31.0.2 -> 172.31.36.109 DNS 216 Standard query response 0x1f38  A 54.230.31.3 A 54.192.30.223 A 54.230.29.241 A 54.230.30.5 A 54.230.30.37 A 54.230.30.51 A 54.230.30.56 A 54.230.30.205
  4   0.000574   172.31.0.2 -> 172.31.36.109 DNS 175 Standard query response 0xaf7a 
  5   0.002237 172.31.36.109 -> 54.230.31.3  TCP 74 35608 > http [SYN] Seq=0 Win=26883 Len=0 MSS=8961 SACK_PERM=1 TSval=20561106 TSecr=0 WS=128
  6   0.003392  54.230.31.3 -> 172.31.36.109 TCP 74 http > 35608 [SYN, ACK] Seq=0 Ack=1 Win=14480 Len=0 MSS=1460 SACK_PERM=1 TSval=663523458 TSecr=20561106 WS=128
  7   0.003406 172.31.36.109 -> 54.230.31.3  TCP 66 35608 > http [ACK] Seq=1 Ack=1 Win=27008 Len=0 TSval=20561106 TSecr=663523458
  8   0.003446 172.31.36.109 -> 54.230.31.3  HTTP 162 GET /10kb HTTP/1.1 
  9   0.004680  54.230.31.3 -> 172.31.36.109 TCP 66 http > 35608 [ACK] Seq=1 Ack=97 Win=14592 Len=0 TSval=663523458 TSecr=20561106
 10   0.974612  54.230.31.3 -> 172.31.36.109 HTTP 10750 HTTP/1.1 200 OK  (application/octet-stream)
 11   0.974639 172.31.36.109 -> 54.230.31.3  TCP 66 35608 > http [ACK] Seq=97 Ack=10685 Win=48256 Len=0 TSval=20561349 TSecr=663523555
 12   0.974981 172.31.36.109 -> 54.230.31.3  TCP 66 35608 > http [FIN, ACK] Seq=97 Ack=10685 Win=48256 Len=0 TSval=20561349 TSecr=663523555
 13   0.980125  54.230.31.3 -> 172.31.36.109 TCP 66 http > 35608 [FIN, ACK] Seq=10685 Ack=98 Win=14592 Len=0 TSval=663523555 TSecr=20561349
 14   0.980156 172.31.36.109 -> 54.230.31.3  TCP 66 35608 > http [ACK] Seq=98 Ack=10686 Win=48256 Len=0 TSval=20561350 TSecr=663523555
