[Measurement for 10kb at 07:33:31 20.33.2014] 
Tshark:

  1   0.000000 172.31.36.109 -> 172.31.0.2   DNS 88 Standard query 0x7b1f  A dm53kc3eax57k.cloudfront.net
  2   0.000023 172.31.36.109 -> 172.31.0.2   DNS 88 Standard query 0xf221  AAAA dm53kc3eax57k.cloudfront.net
  3   0.000626   172.31.0.2 -> 172.31.36.109 DNS 216 Standard query response 0x7b1f  A 54.230.30.221 A 54.230.30.245 A 54.230.31.7 A 54.192.30.184 A 54.230.30.19 A 54.230.30.52 A 54.230.30.58 A 54.230.30.207
  4   0.000637   172.31.0.2 -> 172.31.36.109 DNS 175 Standard query response 0xf221 
  5   0.003903 172.31.36.109 -> 54.230.30.221 TCP 74 58377 > http [SYN] Seq=0 Win=26883 Len=0 MSS=8961 SACK_PERM=1 TSval=33124390 TSecr=0 WS=128
  6   0.005247 54.230.30.221 -> 172.31.36.109 TCP 74 http > 58377 [SYN, ACK] Seq=0 Ack=1 Win=14480 Len=0 MSS=1460 SACK_PERM=1 TSval=833151498 TSecr=33124390 WS=128
  7   0.005280 172.31.36.109 -> 54.230.30.221 TCP 66 58377 > http [ACK] Seq=1 Ack=1 Win=27008 Len=0 TSval=33124390 TSecr=833151498
  8   0.005317 172.31.36.109 -> 54.230.30.221 HTTP 162 GET /10kb HTTP/1.1 
  9   0.006434 54.230.30.221 -> 172.31.36.109 TCP 66 http > 58377 [ACK] Seq=1 Ack=97 Win=14592 Len=0 TSval=833151498 TSecr=33124390
 10   0.029096 54.230.30.221 -> 172.31.36.109 HTTP 10761 HTTP/1.1 200 OK  (application/octet-stream)
 11   0.029108 172.31.36.109 -> 54.230.30.221 TCP 66 58377 > http [ACK] Seq=97 Ack=10696 Win=48384 Len=0 TSval=33124396 TSecr=833151500
 12   0.029278 172.31.36.109 -> 54.230.30.221 TCP 66 58377 > http [FIN, ACK] Seq=97 Ack=10696 Win=48384 Len=0 TSval=33124396 TSecr=833151500
 13   0.030569 54.230.30.221 -> 172.31.36.109 TCP 66 http > 58377 [FIN, ACK] Seq=10696 Ack=98 Win=14592 Len=0 TSval=833151500 TSecr=33124396
 14   0.030600 172.31.36.109 -> 54.230.30.221 TCP 66 58377 > http [ACK] Seq=98 Ack=10697 Win=48384 Len=0 TSval=33124397 TSecr=833151500
