[Measurement for 10kb at 19:33:02 19.33.2014] 
Tshark:

  1   0.000000 172.31.36.109 -> 172.31.0.2   DNS 88 Standard query 0x67fb  A dm53kc3eax57k.cloudfront.net
  2   0.000026 172.31.36.109 -> 172.31.0.2   DNS 88 Standard query 0xdbfb  AAAA dm53kc3eax57k.cloudfront.net
  3   0.000493   172.31.0.2 -> 172.31.36.109 DNS 175 Standard query response 0xdbfb 
  4   0.000504   172.31.0.2 -> 172.31.36.109 DNS 216 Standard query response 0x67fb  A 54.230.30.48 A 54.230.30.70 A 54.230.30.189 A 54.192.29.218 A 54.192.30.220 A 54.192.30.226 A 54.230.29.240 A 54.230.30.40
  5   0.003827 172.31.36.109 -> 54.230.30.48 TCP 74 49972 > http [SYN] Seq=0 Win=26883 Len=0 MSS=8961 SACK_PERM=1 TSval=22317307 TSecr=0 WS=128
  6   0.005002 54.230.30.48 -> 172.31.36.109 TCP 74 http > 49972 [SYN, ACK] Seq=0 Ack=1 Win=14480 Len=0 MSS=1460 SACK_PERM=1 TSval=718936469 TSecr=22317307 WS=128
  7   0.005016 172.31.36.109 -> 54.230.30.48 TCP 66 49972 > http [ACK] Seq=1 Ack=1 Win=27008 Len=0 TSval=22317307 TSecr=718936469
  8   0.005057 172.31.36.109 -> 54.230.30.48 HTTP 162 GET /10kb HTTP/1.1 
  9   0.006247 54.230.30.48 -> 172.31.36.109 TCP 66 http > 49972 [ACK] Seq=1 Ack=97 Win=14592 Len=0 TSval=718936469 TSecr=22317307
 10   0.044749 54.230.30.48 -> 172.31.36.109 HTTP 10760 HTTP/1.1 200 OK  (application/octet-stream)
 11   0.044765 172.31.36.109 -> 54.230.30.48 TCP 66 49972 > http [ACK] Seq=97 Ack=10695 Win=48384 Len=0 TSval=22317317 TSecr=718936473
 12   0.044937 172.31.36.109 -> 54.230.30.48 TCP 66 49972 > http [FIN, ACK] Seq=97 Ack=10695 Win=48384 Len=0 TSval=22317317 TSecr=718936473
 13   0.046228 54.230.30.48 -> 172.31.36.109 TCP 66 http > 49972 [FIN, ACK] Seq=10695 Ack=98 Win=14592 Len=0 TSval=718936473 TSecr=22317317
 14   0.046237 172.31.36.109 -> 54.230.30.48 TCP 66 49972 > http [ACK] Seq=98 Ack=10696 Win=48384 Len=0 TSval=22317317 TSecr=718936473
