[Measurement for 10kb at 10:32:55 20.32.2014] 
Tshark:

  1   0.000000 172.31.36.109 -> 172.31.0.2   DNS 88 Standard query 0xa468  A dm53kc3eax57k.cloudfront.net
  2   0.000025 172.31.36.109 -> 172.31.0.2   DNS 88 Standard query 0xfbae  AAAA dm53kc3eax57k.cloudfront.net
  3   0.000372   172.31.0.2 -> 172.31.36.109 DNS 175 Standard query response 0xfbae 
  4   0.000385   172.31.0.2 -> 172.31.36.109 DNS 216 Standard query response 0xa468  A 216.137.41.254 A 54.230.22.29 A 54.230.22.45 A 54.230.22.189 A 216.137.41.69 A 216.137.41.78 A 216.137.41.104 A 216.137.41.193
  5   0.003819 172.31.36.109 -> 216.137.41.254 TCP 74 59248 > http [SYN] Seq=0 Win=26883 Len=0 MSS=8961 SACK_PERM=1 TSval=35815592 TSecr=0 WS=128
  6   0.093502 216.137.41.254 -> 172.31.36.109 TCP 74 http > 59248 [SYN, ACK] Seq=0 Ack=1 Win=14480 Len=0 MSS=1460 SACK_PERM=1 TSval=942938443 TSecr=35815592 WS=128
  7   0.093519 172.31.36.109 -> 216.137.41.254 TCP 66 59248 > http [ACK] Seq=1 Ack=1 Win=27008 Len=0 TSval=35815614 TSecr=942938443
  8   0.093571 172.31.36.109 -> 216.137.41.254 HTTP 162 GET /10kb HTTP/1.1 
  9   0.183141 216.137.41.254 -> 172.31.36.109 TCP 66 http > 59248 [ACK] Seq=1 Ack=97 Win=14592 Len=0 TSval=942938452 TSecr=35815614
 10   0.185469 216.137.41.254 -> 172.31.36.109 TCP 4410 [TCP segment of a reassembled PDU]
 11   0.185480 172.31.36.109 -> 216.137.41.254 TCP 66 59248 > http [ACK] Seq=97 Ack=4345 Win=35584 Len=0 TSval=35815637 TSecr=942938452
 12   0.185641 216.137.41.254 -> 172.31.36.109 TCP 2580 [TCP segment of a reassembled PDU]
 13   0.185648 172.31.36.109 -> 216.137.41.254 TCP 66 59248 > http [ACK] Seq=97 Ack=6859 Win=40704 Len=0 TSval=35815637 TSecr=942938452
 14   0.185680 216.137.41.254 -> 172.31.36.109 HTTP 3903 HTTP/1.1 200 OK  (application/octet-stream)
 15   0.185685 172.31.36.109 -> 216.137.41.254 TCP 66 59248 > http [ACK] Seq=97 Ack=10696 Win=48384 Len=0 TSval=35815637 TSecr=942938452
 16   0.185825 172.31.36.109 -> 216.137.41.254 TCP 66 59248 > http [FIN, ACK] Seq=97 Ack=10696 Win=48384 Len=0 TSval=35815637 TSecr=942938452
 17   0.275431 216.137.41.254 -> 172.31.36.109 TCP 66 http > 59248 [FIN, ACK] Seq=10696 Ack=98 Win=14592 Len=0 TSval=942938461 TSecr=35815637
 18   0.275444 172.31.36.109 -> 216.137.41.254 TCP 66 59248 > http [ACK] Seq=98 Ack=10697 Win=48384 Len=0 TSval=35815659 TSecr=942938461
