[Measurement for 1kb at 17:33:38 19.33.2014] 
Tshark:

  1   0.000000 172.31.36.109 -> 172.31.0.2   DNS 89 Standard query 0xc078  A d1xvcg6dfvgaki.cloudfront.net
  2   0.000034 172.31.36.109 -> 172.31.0.2   DNS 89 Standard query 0x71fb  AAAA d1xvcg6dfvgaki.cloudfront.net
  3   0.000615   172.31.0.2 -> 172.31.36.109 DNS 217 Standard query response 0xc078  A 216.137.41.237 A 54.230.20.33 A 54.230.20.109 A 54.230.20.111 A 54.230.21.160 A 54.230.22.112 A 54.230.23.117 A 54.230.23.127
  4   0.028057   172.31.0.2 -> 172.31.36.109 DNS 170 Standard query response 0x71fb 
  5   0.060296 172.31.36.109 -> 216.137.41.237 TCP 74 47849 > http [SYN] Seq=0 Win=26883 Len=0 MSS=8961 SACK_PERM=1 TSval=20526212 TSecr=0 WS=128
  6   0.146099 216.137.41.237 -> 172.31.36.109 TCP 74 http > 47849 [SYN, ACK] Seq=0 Ack=1 Win=14480 Len=0 MSS=1460 SACK_PERM=1 TSval=964489047 TSecr=20526212 WS=128
  7   0.146114 172.31.36.109 -> 216.137.41.237 TCP 66 47849 > http [ACK] Seq=1 Ack=1 Win=27008 Len=0 TSval=20526233 TSecr=964489047
  8   0.146174 172.31.36.109 -> 216.137.41.237 HTTP 162 GET /1kb HTTP/1.1 
  9   0.231182 216.137.41.237 -> 172.31.36.109 TCP 66 http > 47849 [ACK] Seq=1 Ack=97 Win=14592 Len=0 TSval=964489056 TSecr=20526233
