[Measurement for 1kb at 10:31:16 20.31.2014] 
Tshark:

  1   0.000000 172.31.36.109 -> 172.31.0.2   DNS 89 Standard query 0xb3f4  A d1xvcg6dfvgaki.cloudfront.net
  2   0.000021 172.31.36.109 -> 172.31.0.2   DNS 89 Standard query 0x48c6  AAAA d1xvcg6dfvgaki.cloudfront.net
  3   0.000436   172.31.0.2 -> 172.31.36.109 DNS 217 Standard query response 0xb3f4  A 54.230.29.238 A 54.230.29.242 A 54.230.30.8 A 54.230.30.69 A 54.230.30.189 A 54.230.30.213 A 54.230.30.223 A 54.192.29.221
  4   0.026506   172.31.0.2 -> 172.31.36.109 DNS 170 Standard query response 0x48c6 
  5   0.028130 172.31.36.109 -> 54.230.29.238 TCP 74 56805 > http [SYN] Seq=0 Win=26883 Len=0 MSS=8961 SACK_PERM=1 TSval=35790664 TSecr=0 WS=128
  6   0.029637 54.230.29.238 -> 172.31.36.109 TCP 74 http > 56805 [SYN, ACK] Seq=0 Ack=1 Win=14480 Len=0 MSS=1460 SACK_PERM=1 TSval=656610488 TSecr=35790664 WS=128
  7   0.029651 172.31.36.109 -> 54.230.29.238 TCP 66 56805 > http [ACK] Seq=1 Ack=1 Win=27008 Len=0 TSval=35790664 TSecr=656610488
  8   0.029702 172.31.36.109 -> 54.230.29.238 HTTP 162 GET /1kb HTTP/1.1 
  9   0.030959 54.230.29.238 -> 172.31.36.109 TCP 66 http > 56805 [ACK] Seq=1 Ack=97 Win=14592 Len=0 TSval=656610488 TSecr=35790664
 10   0.051466 54.230.29.238 -> 172.31.36.109 HTTP 1544 HTTP/1.1 200 OK  (application/octet-stream)
 11   0.051489 172.31.36.109 -> 54.230.29.238 TCP 66 56805 > http [ACK] Seq=97 Ack=1479 Win=29952 Len=0 TSval=35790669 TSecr=656610490
 12   0.051657 172.31.36.109 -> 54.230.29.238 TCP 66 56805 > http [FIN, ACK] Seq=97 Ack=1479 Win=29952 Len=0 TSval=35790669 TSecr=656610490
 13   0.052989 54.230.29.238 -> 172.31.36.109 TCP 66 http > 56805 [FIN, ACK] Seq=1479 Ack=98 Win=14592 Len=0 TSval=656610490 TSecr=35790669
 14   0.053020 172.31.36.109 -> 54.230.29.238 TCP 66 56805 > http [ACK] Seq=98 Ack=1480 Win=29952 Len=0 TSval=35790670 TSecr=656610490
