[Measurement for 1kb at 20:31:12 19.31.2014] 
Tshark:

  1   0.000000 172.31.36.109 -> 172.31.0.2   DNS 89 Standard query 0xdc62  A d1xvcg6dfvgaki.cloudfront.net
  2   0.000030 172.31.36.109 -> 172.31.0.2   DNS 89 Standard query 0xd5cc  AAAA d1xvcg6dfvgaki.cloudfront.net
  3   0.000646   172.31.0.2 -> 172.31.36.109 DNS 217 Standard query response 0xdc62  A 54.230.193.113 A 54.230.194.18 A 54.230.194.150 A 54.230.194.212 A 54.230.195.137 A 54.239.152.230 A 54.230.192.159 A 54.230.193.45
  4   0.035067   172.31.0.2 -> 172.31.36.109 DNS 170 Standard query response 0xd5cc 
  5   0.060296 172.31.36.109 -> 54.230.193.113 TCP 74 36543 > http [SYN] Seq=0 Win=26883 Len=0 MSS=8961 SACK_PERM=1 TSval=23189762 TSecr=0 WS=128
  6   0.151645 54.230.193.113 -> 172.31.36.109 TCP 74 http > 36543 [SYN, ACK] Seq=0 Ack=1 Win=14480 Len=0 MSS=1460 SACK_PERM=1 TSval=3576378588 TSecr=23189762 WS=128
  7   0.151681 172.31.36.109 -> 54.230.193.113 TCP 66 36543 > http [ACK] Seq=1 Ack=1 Win=27008 Len=0 TSval=23189785 TSecr=3576378588
  8   0.151757 172.31.36.109 -> 54.230.193.113 HTTP 162 GET /1kb HTTP/1.1 
  9   0.242925 54.230.193.113 -> 172.31.36.109 TCP 66 http > 36543 [ACK] Seq=1 Ack=97 Win=14592 Len=0 TSval=3576378597 TSecr=23189785
 10   0.677656 06:ab:f2:b7:83:1d -> 06:87:bf:67:ca:e7 ARP 60 Who has 172.31.36.109?  Tell 172.31.32.1
