[Measurement for 1kb at 09:31:30 20.31.2014] 
Tshark:

  1   0.000000 172.31.36.109 -> 172.31.0.2   DNS 89 Standard query 0xa3b3  A d1xvcg6dfvgaki.cloudfront.net
  2   0.000028 172.31.36.109 -> 172.31.0.2   DNS 89 Standard query 0x3348  AAAA d1xvcg6dfvgaki.cloudfront.net
  3   0.000482   172.31.0.2 -> 172.31.36.109 DNS 217 Standard query response 0xa3b3  A 54.192.30.191 A 54.192.30.222 A 54.230.29.254 A 54.230.30.50 A 54.230.30.52 A 54.192.29.221 A 54.192.30.187 A 54.192.30.188
  4   0.023553   172.31.0.2 -> 172.31.36.109 DNS 170 Standard query response 0x3348 
  5   0.028144 172.31.36.109 -> 54.192.30.191 TCP 74 40913 > http [SYN] Seq=0 Win=26883 Len=0 MSS=8961 SACK_PERM=1 TSval=34894355 TSecr=0 WS=128
  6   0.029270 54.192.30.191 -> 172.31.36.109 TCP 74 http > 40913 [SYN, ACK] Seq=0 Ack=1 Win=14480 Len=0 MSS=1460 SACK_PERM=1 TSval=674272204 TSecr=34894355 WS=128
  7   0.029284 172.31.36.109 -> 54.192.30.191 TCP 66 40913 > http [ACK] Seq=1 Ack=1 Win=27008 Len=0 TSval=34894355 TSecr=674272204
  8   0.029324 172.31.36.109 -> 54.192.30.191 HTTP 162 GET /1kb HTTP/1.1 
  9   0.030527 54.192.30.191 -> 172.31.36.109 TCP 66 http > 40913 [ACK] Seq=1 Ack=97 Win=14592 Len=0 TSval=674272204 TSecr=34894355
 10   0.057983 54.192.30.191 -> 172.31.36.109 HTTP 1544 HTTP/1.1 200 OK  (application/octet-stream)
 11   0.057992 172.31.36.109 -> 54.192.30.191 TCP 66 40913 > http [ACK] Seq=97 Ack=1479 Win=29952 Len=0 TSval=34894362 TSecr=674272207
 12   0.058146 172.31.36.109 -> 54.192.30.191 TCP 66 40913 > http [FIN, ACK] Seq=97 Ack=1479 Win=29952 Len=0 TSval=34894362 TSecr=674272207
 13   0.059339 54.192.30.191 -> 172.31.36.109 TCP 66 http > 40913 [FIN, ACK] Seq=1479 Ack=98 Win=14592 Len=0 TSval=674272207 TSecr=34894362
 14   0.059348 172.31.36.109 -> 54.192.30.191 TCP 66 40913 > http [ACK] Seq=98 Ack=1480 Win=29952 Len=0 TSval=34894363 TSecr=674272207
