[Measurement for 1kb at 03:31:12 20.31.2014] 
Tshark:

  1   0.000000 172.31.36.109 -> 172.31.0.2   DNS 89 Standard query 0xe525  A d1xvcg6dfvgaki.cloudfront.net
  2   0.000033 172.31.36.109 -> 172.31.0.2   DNS 89 Standard query 0x1f3b  AAAA d1xvcg6dfvgaki.cloudfront.net
  3   0.000503   172.31.0.2 -> 172.31.36.109 DNS 217 Standard query response 0xe525  A 54.230.22.217 A 54.230.23.43 A 54.230.23.46 A 54.230.20.109 A 54.230.20.115 A 54.230.20.220 A 54.230.21.17 A 54.230.21.120
  4   0.023739   172.31.0.2 -> 172.31.36.109 DNS 170 Standard query response 0x1f3b 
  5   0.028207 172.31.36.109 -> 54.230.22.217 TCP 74 50638 > http [SYN] Seq=0 Win=26883 Len=0 MSS=8961 SACK_PERM=1 TSval=29489695 TSecr=0 WS=128
  6   0.117812 54.230.22.217 -> 172.31.36.109 TCP 74 http > 50638 [SYN, ACK] Seq=0 Ack=1 Win=14480 Len=0 MSS=1460 SACK_PERM=1 TSval=966293151 TSecr=29489695 WS=128
  7   0.117848 172.31.36.109 -> 54.230.22.217 TCP 66 50638 > http [ACK] Seq=1 Ack=1 Win=27008 Len=0 TSval=29489718 TSecr=966293151
  8   0.117940 172.31.36.109 -> 54.230.22.217 HTTP 162 GET /1kb HTTP/1.1 
  9   0.207569 54.230.22.217 -> 172.31.36.109 TCP 66 http > 50638 [ACK] Seq=1 Ack=97 Win=14592 Len=0 TSval=966293160 TSecr=29489718
 10   0.209443 54.230.22.217 -> 172.31.36.109 HTTP 1544 HTTP/1.1 200 OK  (application/octet-stream)
 11   0.209454 172.31.36.109 -> 54.230.22.217 TCP 66 50638 > http [ACK] Seq=97 Ack=1479 Win=29952 Len=0 TSval=29489741 TSecr=966293160
 12   0.209657 172.31.36.109 -> 54.230.22.217 TCP 66 50638 > http [FIN, ACK] Seq=97 Ack=1479 Win=29952 Len=0 TSval=29489741 TSecr=966293160
 13   0.299360 54.230.22.217 -> 172.31.36.109 TCP 66 http > 50638 [FIN, ACK] Seq=1479 Ack=98 Win=14592 Len=0 TSval=966293169 TSecr=29489741
 14   0.299389 172.31.36.109 -> 54.230.22.217 TCP 66 50638 > http [ACK] Seq=98 Ack=1480 Win=29952 Len=0 TSval=29489763 TSecr=966293169
