[Measurement for 1kb at 07:31:17 20.31.2014] 
Tshark:

  1   0.000000 172.31.36.109 -> 172.31.0.2   DNS 89 Standard query 0xfa2f  A d1xvcg6dfvgaki.cloudfront.net
  2   0.000041 172.31.36.109 -> 172.31.0.2   DNS 89 Standard query 0x374a  AAAA d1xvcg6dfvgaki.cloudfront.net
  3   0.000436   172.31.0.2 -> 172.31.36.109 DNS 217 Standard query response 0xfa2f  A 54.192.30.218 A 54.230.30.2 A 54.230.30.50 A 54.230.30.52 A 54.230.30.53 A 54.230.30.202 A 54.192.30.190 A 54.192.30.216
  4   0.032895   172.31.0.2 -> 172.31.36.109 DNS 170 Standard query response 0x374a 
  5   0.060321 172.31.36.109 -> 54.192.30.218 TCP 74 45993 > http [SYN] Seq=0 Win=26883 Len=0 MSS=8961 SACK_PERM=1 TSval=33090967 TSecr=0 WS=128
  6   0.061603 54.192.30.218 -> 172.31.36.109 TCP 74 http > 45993 [SYN, ACK] Seq=0 Ack=1 Win=14480 Len=0 MSS=1460 SACK_PERM=1 TSval=731116290 TSecr=33090967 WS=128
  7   0.061618 172.31.36.109 -> 54.192.30.218 TCP 66 45993 > http [ACK] Seq=1 Ack=1 Win=27008 Len=0 TSval=33090967 TSecr=731116290
  8   0.061678 172.31.36.109 -> 54.192.30.218 HTTP 162 GET /1kb HTTP/1.1 
  9   0.062857 54.192.30.218 -> 172.31.36.109 TCP 66 http > 45993 [ACK] Seq=1 Ack=97 Win=14592 Len=0 TSval=731116290 TSecr=33090967
 10   0.131570 54.192.30.218 -> 172.31.36.109 HTTP 1544 HTTP/1.1 200 OK  (application/octet-stream)
 11   0.131597 172.31.36.109 -> 54.192.30.218 TCP 66 45993 > http [ACK] Seq=97 Ack=1479 Win=29952 Len=0 TSval=33090985 TSecr=731116297
 12   0.131867 172.31.36.109 -> 54.192.30.218 TCP 66 45993 > http [FIN, ACK] Seq=97 Ack=1479 Win=29952 Len=0 TSval=33090985 TSecr=731116297
 13   0.133309 54.192.30.218 -> 172.31.36.109 TCP 66 http > 45993 [FIN, ACK] Seq=1479 Ack=98 Win=14592 Len=0 TSval=731116297 TSecr=33090985
 14   0.133320 172.31.36.109 -> 54.192.30.218 TCP 66 45993 > http [ACK] Seq=98 Ack=1480 Win=29952 Len=0 TSval=33090985 TSecr=731116297
