[Measurement for 1kb at 12:31:11 20.31.2014] 
Tshark:

  1   0.000000 172.31.36.109 -> 172.31.0.2   DNS 89 Standard query 0x7d0a  A d1xvcg6dfvgaki.cloudfront.net
  2   0.000035 172.31.36.109 -> 172.31.0.2   DNS 89 Standard query 0xc4ee  AAAA d1xvcg6dfvgaki.cloudfront.net
  3   0.000711   172.31.0.2 -> 172.31.36.109 DNS 217 Standard query response 0x7d0a  A 54.230.30.28 A 54.230.30.68 A 54.230.30.189 A 54.192.30.187 A 54.192.30.194 A 54.192.30.222 A 54.230.29.254 A 54.230.30.6
  4   0.025633   172.31.0.2 -> 172.31.36.109 DNS 170 Standard query response 0xc4ee 
  5   0.028085 172.31.36.109 -> 54.230.30.28 TCP 74 35929 > http [SYN] Seq=0 Win=26883 Len=0 MSS=8961 SACK_PERM=1 TSval=37589609 TSecr=0 WS=128
  6   0.029621 54.230.30.28 -> 172.31.36.109 TCP 74 http > 35929 [SYN, ACK] Seq=0 Ack=1 Win=14480 Len=0 MSS=1460 SACK_PERM=1 TSval=628624308 TSecr=37589609 WS=128
  7   0.029634 172.31.36.109 -> 54.230.30.28 TCP 66 35929 > http [ACK] Seq=1 Ack=1 Win=27008 Len=0 TSval=37589609 TSecr=628624308
  8   0.029684 172.31.36.109 -> 54.230.30.28 HTTP 162 GET /1kb HTTP/1.1 
  9   0.031126 54.230.30.28 -> 172.31.36.109 TCP 66 http > 35929 [ACK] Seq=1 Ack=97 Win=14592 Len=0 TSval=628624308 TSecr=37589609
 10   0.041242 54.230.30.28 -> 172.31.36.109 HTTP 1544 HTTP/1.1 200 OK  (application/octet-stream)
 11   0.041250 172.31.36.109 -> 54.230.30.28 TCP 66 35929 > http [ACK] Seq=97 Ack=1479 Win=29952 Len=0 TSval=37589612 TSecr=628624309
 12   0.041411 172.31.36.109 -> 54.230.30.28 TCP 66 35929 > http [FIN, ACK] Seq=97 Ack=1479 Win=29952 Len=0 TSval=37589612 TSecr=628624309
 13   0.042718 54.230.30.28 -> 172.31.36.109 TCP 66 http > 35929 [FIN, ACK] Seq=1479 Ack=98 Win=14592 Len=0 TSval=628624309 TSecr=37589612
 14   0.042726 172.31.36.109 -> 54.230.30.28 TCP 66 35929 > http [ACK] Seq=98 Ack=1480 Win=29952 Len=0 TSval=37589612 TSecr=628624309
