[Measurement for 1kb at 18:02:03 16.02.2014] 
Tshark:

  1   0.000000  192.168.1.2 -> 54.230.99.207 TCP 66 63744→80 [SYN] Seq=0 Win=8192 Len=0 MSS=1460 WS=256 SACK_PERM=1
  2   0.050595 54.230.99.207 -> 192.168.1.2  TCP 66 80→63744 [SYN, ACK] Seq=0 Ack=1 Win=14600 Len=0 MSS=1400 SACK_PERM=1 WS=128
  3   0.050732  192.168.1.2 -> 54.230.99.207 TCP 54 63744→80 [ACK] Seq=1 Ack=1 Win=65792 Len=0
  4   0.051104  192.168.1.2 -> 54.230.99.207 HTTP 150 GET /1kb HTTP/1.1 
  5   0.090371 54.230.99.207 -> 192.168.1.2  TCP 54 80→63744 [ACK] Seq=1 Ack=97 Win=14720 Len=0
  6   0.126621 54.230.99.207 -> 192.168.1.2  TCP 1454 [TCP segment of a reassembled PDU]
  7   0.127145 54.230.99.207 -> 192.168.1.2  HTTP 132 HTTP/1.1 200 OK  (application/octet-stream)
  8   0.127221  192.168.1.2 -> 54.230.99.207 TCP 54 63744→80 [ACK] Seq=97 Ack=1479 Win=65792 Len=0
  9   0.127348  192.168.1.2 -> 54.230.99.207 TCP 54 63744→80 [FIN, ACK] Seq=97 Ack=1479 Win=65792 Len=0
 10   0.157521 54.230.99.207 -> 192.168.1.2  TCP 54 80→63744 [FIN, ACK] Seq=1479 Ack=98 Win=14720 Len=0
 11   0.157643  192.168.1.2 -> 54.230.99.207 TCP 54 63744→80 [ACK] Seq=98 Ack=1480 Win=65792 Len=0
