[Measurement for 1mb at 03:44:17 20.44.2014] 
Tshark:

  1   0.000000 06:b0:37:46:8f:13 -> 06:c7:b5:04:b8:d0 ARP 60 Who has 172.31.8.238?  Tell 172.31.0.1
  2   0.000018 06:c7:b5:04:b8:d0 -> 06:b0:37:46:8f:13 ARP 42 172.31.8.238 is at 06:c7:b5:04:b8:d0
  3   0.730781 172.31.8.238 -> 172.31.0.2   DNS 89 Standard query 0x8c8e  A d2pcb72msibvx3.cloudfront.net
  4   0.730810 172.31.8.238 -> 172.31.0.2   DNS 89 Standard query 0x1a1c  AAAA d2pcb72msibvx3.cloudfront.net
  5   0.731445   172.31.0.2 -> 172.31.8.238 DNS 169 Standard query response 0x1a1c 
  6   0.731467   172.31.0.2 -> 172.31.8.238 DNS 217 Standard query response 0x8c8e  A 54.192.118.235 A 54.192.118.239 A 54.192.118.240 A 54.192.118.246 A 54.230.116.72 A 54.230.116.167 A 54.239.132.41 A 54.239.132.233
  7   0.734648 172.31.8.238 -> 54.192.118.235 TCP 74 53381 > http [SYN] Seq=0 Win=26883 Len=0 MSS=8961 SACK_PERM=1 TSval=9671218 TSecr=0 WS=128
  8   0.735346 54.192.118.235 -> 172.31.8.238 TCP 74 http > 53381 [SYN, ACK] Seq=0 Ack=1 Win=14480 Len=0 MSS=1460 SACK_PERM=1 TSval=1683614273 TSecr=9671218 WS=128
  9   0.735360 172.31.8.238 -> 54.192.118.235 TCP 66 53381 > http [ACK] Seq=1 Ack=1 Win=27008 Len=0 TSval=9671219 TSecr=1683614273
 10   0.735401 172.31.8.238 -> 54.192.118.235 HTTP 162 GET /1mb HTTP/1.1 
 11   0.736277 54.192.118.235 -> 172.31.8.238 TCP 66 http > 53381 [ACK] Seq=1 Ack=97 Win=14592 Len=0 TSval=1683614273 TSecr=9671219
 12   0.738121 54.192.118.235 -> 172.31.8.238 TCP 523 [TCP segment of a reassembled PDU]
 13   0.738129 172.31.8.238 -> 54.192.118.235 TCP 66 53381 > http [ACK] Seq=97 Ack=458 Win=28032 Len=0 TSval=9671219 TSecr=1683614273
 14   0.738239 54.192.118.235 -> 172.31.8.238 TCP 13098 [TCP segment of a reassembled PDU]
 15   0.738250 172.31.8.238 -> 54.192.118.235 TCP 66 53381 > http [ACK] Seq=97 Ack=13490 Win=54144 Len=0 TSval=9671219 TSecr=1683614273
 16   0.738967 54.192.118.235 -> 172.31.8.238 TCP 2962 [TCP segment of a reassembled PDU]
 17   0.738973 172.31.8.238 -> 54.192.118.235 TCP 66 53381 > http [ACK] Seq=97 Ack=16386 Win=59904 Len=0 TSval=9671220 TSecr=1683614273
 18   0.739069 54.192.118.235 -> 172.31.8.238 TCP 10202 [TCP segment of a reassembled PDU]
 19   0.739076 172.31.8.238 -> 54.192.118.235 TCP 66 53381 > http [ACK] Seq=97 Ack=26522 Win=80128 Len=0 TSval=9671220 TSecr=1683614273
 20   0.739754 54.192.118.235 -> 172.31.8.238 TCP 4410 [TCP segment of a reassembled PDU]
 21   0.739760 172.31.8.238 -> 54.192.118.235 TCP 66 53381 > http [ACK] Seq=97 Ack=30866 Win=88832 Len=0 TSval=9671220 TSecr=1683614273
 22   0.739874 54.192.118.235 -> 172.31.8.238 TCP 15994 [TCP segment of a reassembled PDU]
 23   0.739884 172.31.8.238 -> 54.192.118.235 TCP 66 53381 > http [ACK] Seq=97 Ack=46794 Win=91648 Len=0 TSval=9671220 TSecr=1683614273
 24   0.740494 54.192.118.235 -> 172.31.8.238 TCP 1514 [TCP segment of a reassembled PDU]
 25   0.740499 172.31.8.238 -> 54.192.118.235 TCP 66 53381 > http [ACK] Seq=97 Ack=48242 Win=109056 Len=0 TSval=9671220 TSecr=1683614273
 26   0.740586 54.192.118.235 -> 172.31.8.238 TCP 4410 [TCP segment of a reassembled PDU]
 27   0.740592 172.31.8.238 -> 54.192.118.235 TCP 66 53381 > http [ACK] Seq=97 Ack=52586 Win=109056 Len=0 TSval=9671220 TSecr=1683614273
 28   0.740638 54.192.118.235 -> 172.31.8.238 TCP 13098 [TCP segment of a reassembled PDU]
 29   0.740646 172.31.8.238 -> 54.192.118.235 TCP 66 53381 > http [ACK] Seq=97 Ack=65618 Win=96512 Len=0 TSval=9671220 TSecr=1683614273
 30   0.741037 54.192.118.235 -> 172.31.8.238 TCP 4410 [TCP segment of a reassembled PDU]
 31   0.741043 172.31.8.238 -> 54.192.118.235 TCP 66 53381 > http [ACK] Seq=97 Ack=69962 Win=109056 Len=0 TSval=9671220 TSecr=1683614273
 32   0.741138 54.192.118.235 -> 172.31.8.238 TCP 8754 [TCP segment of a reassembled PDU]
 33   0.741146 172.31.8.238 -> 54.192.118.235 TCP 66 53381 > http [ACK] Seq=97 Ack=78650 Win=103680 Len=0 TSval=9671220 TSecr=1683614273
 34   0.741294 54.192.118.235 -> 172.31.8.238 TCP 8754 [TCP segment of a reassembled PDU]
 35   0.741302 172.31.8.238 -> 54.192.118.235 TCP 66 53381 > http [ACK] Seq=97 Ack=87338 Win=103680 Len=0 TSval=9671220 TSecr=1683614273
 36   0.741388 54.192.118.235 -> 172.31.8.238 TCP 4410 [TCP segment of a reassembled PDU]
 37   0.741393 172.31.8.238 -> 54.192.118.235 TCP 66 53381 > http [ACK] Seq=97 Ack=91682 Win=109056 Len=0 TSval=9671220 TSecr=1683614273
 38   0.741840 54.192.118.235 -> 172.31.8.238 TCP 13098 [TCP segment of a reassembled PDU]
 39   0.741849 172.31.8.238 -> 54.192.118.235 TCP 66 53381 > http [ACK] Seq=97 Ack=104714 Win=96512 Len=0 TSval=9671220 TSecr=1683614273
 40   0.742088 54.192.118.235 -> 172.31.8.238 TCP 13098 [TCP segment of a reassembled PDU]
 41   0.742097 172.31.8.238 -> 54.192.118.235 TCP 66 53381 > http [ACK] Seq=97 Ack=117746 Win=96512 Len=0 TSval=9671220 TSecr=1683614273
 42   0.742554 54.192.118.235 -> 172.31.8.238 TCP 2962 [TCP segment of a reassembled PDU]
 43   0.742559 172.31.8.238 -> 54.192.118.235 TCP 66 53381 > http [ACK] Seq=97 Ack=120642 Win=109056 Len=0 TSval=9671220 TSecr=1683614273
 44   0.742688 54.192.118.235 -> 172.31.8.238 TCP 10202 [TCP segment of a reassembled PDU]
 45   0.742697 172.31.8.238 -> 54.192.118.235 TCP 66 53381 > http [ACK] Seq=97 Ack=130778 Win=101248 Len=0 TSval=9671220 TSecr=1683614273
 46   0.742876 54.192.118.235 -> 172.31.8.238 TCP 11650 [TCP segment of a reassembled PDU]
 47   0.742886 172.31.8.238 -> 54.192.118.235 TCP 66 53381 > http [ACK] Seq=97 Ack=142362 Win=89728 Len=0 TSval=9671220 TSecr=1683614273
 48   0.742979 54.192.118.235 -> 172.31.8.238 TCP 1514 [TCP segment of a reassembled PDU]
 49   0.742984 172.31.8.238 -> 54.192.118.235 TCP 66 53381 > http [ACK] Seq=97 Ack=143810 Win=88320 Len=0 TSval=9671221 TSecr=1683614273
 50   0.743332 54.192.118.235 -> 172.31.8.238 TCP 2962 [TCP segment of a reassembled PDU]
 51   0.743338 172.31.8.238 -> 54.192.118.235 TCP 66 53381 > http [ACK] Seq=97 Ack=146706 Win=114816 Len=0 TSval=9671221 TSecr=1683614274
 52   0.743475 54.192.118.235 -> 172.31.8.238 TCP 20338 [TCP segment of a reassembled PDU]
 53   0.743487 172.31.8.238 -> 54.192.118.235 TCP 66 53381 > http [ACK] Seq=97 Ack=166978 Win=155392 Len=0 TSval=9671221 TSecr=1683614274
 54   0.743492 54.192.118.235 -> 172.31.8.238 TCP 2962 [TCP segment of a reassembled PDU]
 55   0.743496 172.31.8.238 -> 54.192.118.235 TCP 66 53381 > http [ACK] Seq=97 Ack=169874 Win=161152 Len=0 TSval=9671221 TSecr=1683614274
 56   0.743566 54.192.118.235 -> 172.31.8.238 TCP 13098 [TCP segment of a reassembled PDU]
 57   0.743575 172.31.8.238 -> 54.192.118.235 TCP 66 53381 > http [ACK] Seq=97 Ack=182906 Win=187264 Len=0 TSval=9671221 TSecr=1683614274
 58   0.744132 54.192.118.235 -> 172.31.8.238 TCP 5858 [TCP segment of a reassembled PDU]
 59   0.744138 172.31.8.238 -> 54.192.118.235 TCP 66 53381 > http [ACK] Seq=97 Ack=188698 Win=198784 Len=0 TSval=9671221 TSecr=1683614274
 60   0.744237 54.192.118.235 -> 172.31.8.238 TCP 7306 [TCP segment of a reassembled PDU]
 61   0.744244 172.31.8.238 -> 54.192.118.235 TCP 66 53381 > http [ACK] Seq=97 Ack=195938 Win=213376 Len=0 TSval=9671221 TSecr=1683614274
 62   0.744380 54.192.118.235 -> 172.31.8.238 TCP 26130 [TCP segment of a reassembled PDU]
 63   0.744394 172.31.8.238 -> 54.192.118.235 TCP 66 53381 > http [ACK] Seq=97 Ack=222002 Win=265472 Len=0 TSval=9671221 TSecr=1683614274
 64   0.744404 54.192.118.235 -> 172.31.8.238 TCP 8754 [TCP segment of a reassembled PDU]
 65   0.744413 172.31.8.238 -> 54.192.118.235 TCP 66 53381 > http [ACK] Seq=97 Ack=230690 Win=282880 Len=0 TSval=9671221 TSecr=1683614274
 66   0.744854 54.192.118.235 -> 172.31.8.238 TCP 2962 [TCP segment of a reassembled PDU]
 67   0.744860 172.31.8.238 -> 54.192.118.235 TCP 66 53381 > http [ACK] Seq=97 Ack=233586 Win=288640 Len=0 TSval=9671221 TSecr=1683614274
 68   0.744987 54.192.118.235 -> 172.31.8.238 TCP 7306 [TCP segment of a reassembled PDU]
 69   0.744994 172.31.8.238 -> 54.192.118.235 TCP 66 53381 > http [ACK] Seq=97 Ack=240826 Win=303104 Len=0 TSval=9671221 TSecr=1683614274
 70   0.745226 54.192.118.235 -> 172.31.8.238 TCP 26130 [TCP segment of a reassembled PDU]
 71   0.745240 172.31.8.238 -> 54.192.118.235 TCP 66 53381 > http [ACK] Seq=97 Ack=266890 Win=355200 Len=0 TSval=9671221 TSecr=1683614274
 72   0.745260 54.192.118.235 -> 172.31.8.238 TCP 7306 [TCP segment of a reassembled PDU]
 73   0.745265 172.31.8.238 -> 54.192.118.235 TCP 66 53381 > http [ACK] Seq=97 Ack=274130 Win=369664 Len=0 TSval=9671221 TSecr=1683614274
 74   0.745438 54.192.118.235 -> 172.31.8.238 TCP 11650 [TCP segment of a reassembled PDU]
 75   0.745446 172.31.8.238 -> 54.192.118.235 TCP 66 53381 > http [ACK] Seq=97 Ack=285714 Win=392832 Len=0 TSval=9671221 TSecr=1683614274
 76   0.745885 54.192.118.235 -> 172.31.8.238 TCP 1514 [TCP segment of a reassembled PDU]
 77   0.745890 172.31.8.238 -> 54.192.118.235 TCP 66 53381 > http [ACK] Seq=97 Ack=287162 Win=395776 Len=0 TSval=9671221 TSecr=1683614274
 78   0.746063 54.192.118.235 -> 172.31.8.238 TCP 26130 [TCP segment of a reassembled PDU]
 79   0.746076 172.31.8.238 -> 54.192.118.235 TCP 66 53381 > http [ACK] Seq=97 Ack=313226 Win=447872 Len=0 TSval=9671221 TSecr=1683614274
 80   0.746117 54.192.118.235 -> 172.31.8.238 TCP 17442 [TCP segment of a reassembled PDU]
 81   0.746127 172.31.8.238 -> 54.192.118.235 TCP 66 53381 > http [ACK] Seq=97 Ack=330602 Win=482688 Len=0 TSval=9671221 TSecr=1683614274
 82   0.746660 54.192.118.235 -> 172.31.8.238 TCP 2962 [TCP segment of a reassembled PDU]
 83   0.746666 172.31.8.238 -> 54.192.118.235 TCP 66 53381 > http [ACK] Seq=97 Ack=333498 Win=488448 Len=0 TSval=9671221 TSecr=1683614274
 84   0.746849 54.192.118.235 -> 172.31.8.238 TCP 26130 [TCP segment of a reassembled PDU]
 85   0.746863 172.31.8.238 -> 54.192.118.235 TCP 66 53381 > http [ACK] Seq=97 Ack=359562 Win=540544 Len=0 TSval=9671221 TSecr=1683614274
 86   0.746936 54.192.118.235 -> 172.31.8.238 TCP 24682 [TCP segment of a reassembled PDU]
 87   0.746949 172.31.8.238 -> 54.192.118.235 TCP 66 53381 > http [ACK] Seq=97 Ack=384178 Win=589824 Len=0 TSval=9671222 TSecr=1683614274
 88   0.747407 54.192.118.235 -> 172.31.8.238 TCP 4410 [TCP segment of a reassembled PDU]
 89   0.747414 172.31.8.238 -> 54.192.118.235 TCP 66 53381 > http [ACK] Seq=97 Ack=388522 Win=598528 Len=0 TSval=9671222 TSecr=1683614274
 90   0.747582 54.192.118.235 -> 172.31.8.238 TCP 26130 [TCP segment of a reassembled PDU]
 91   0.747595 172.31.8.238 -> 54.192.118.235 TCP 66 53381 > http [ACK] Seq=97 Ack=414586 Win=650624 Len=0 TSval=9671222 TSecr=1683614274
 92   0.747628 54.192.118.235 -> 172.31.8.238 TCP 13098 [TCP segment of a reassembled PDU]
 93   0.747636 172.31.8.238 -> 54.192.118.235 TCP 66 53381 > http [ACK] Seq=97 Ack=427618 Win=676736 Len=0 TSval=9671222 TSecr=1683614274
 94   0.747697 54.192.118.235 -> 172.31.8.238 TCP 2962 [TCP segment of a reassembled PDU]
 95   0.747703 172.31.8.238 -> 54.192.118.235 TCP 66 53381 > http [ACK] Seq=97 Ack=430514 Win=682496 Len=0 TSval=9671222 TSecr=1683614274
 96   0.747818 54.192.118.235 -> 172.31.8.238 TCP 7306 [TCP segment of a reassembled PDU]
 97   0.747825 172.31.8.238 -> 54.192.118.235 TCP 66 53381 > http [ACK] Seq=97 Ack=437754 Win=696960 Len=0 TSval=9671222 TSecr=1683614274
 98   0.748210 54.192.118.235 -> 172.31.8.238 TCP 2962 [TCP segment of a reassembled PDU]
 99   0.748215 172.31.8.238 -> 54.192.118.235 TCP 66 53381 > http [ACK] Seq=97 Ack=440650 Win=702720 Len=0 TSval=9671222 TSecr=1683614274
100   0.748388 54.192.118.235 -> 172.31.8.238 TCP 26130 [TCP segment of a reassembled PDU]
101   0.748401 172.31.8.238 -> 54.192.118.235 TCP 66 53381 > http [ACK] Seq=97 Ack=466714 Win=754816 Len=0 TSval=9671222 TSecr=1683614274
102   0.748461 54.192.118.235 -> 172.31.8.238 TCP 24682 [TCP segment of a reassembled PDU]
103   0.748474 172.31.8.238 -> 54.192.118.235 TCP 66 53381 > http [ACK] Seq=97 Ack=491330 Win=804096 Len=0 TSval=9671222 TSecr=1683614274
104   0.748988 54.192.118.235 -> 172.31.8.238 TCP 1514 [TCP segment of a reassembled PDU]
105   0.748993 172.31.8.238 -> 54.192.118.235 TCP 66 53381 > http [ACK] Seq=97 Ack=492778 Win=807040 Len=0 TSval=9671222 TSecr=1683614274
106   0.749173 54.192.118.235 -> 172.31.8.238 TCP 26130 [TCP segment of a reassembled PDU]
107   0.749199 172.31.8.238 -> 54.192.118.235 TCP 66 53381 > http [ACK] Seq=97 Ack=518842 Win=859136 Len=0 TSval=9671222 TSecr=1683614274
108   0.749264 54.192.118.235 -> 172.31.8.238 TCP 26130 [TCP segment of a reassembled PDU]
109   0.749278 172.31.8.238 -> 54.192.118.235 TCP 66 53381 > http [ACK] Seq=97 Ack=544906 Win=911232 Len=0 TSval=9671222 TSecr=1683614274
110   0.749323 54.192.118.235 -> 172.31.8.238 TCP 11650 [TCP segment of a reassembled PDU]
111   0.749331 172.31.8.238 -> 54.192.118.235 TCP 66 53381 > http [ACK] Seq=97 Ack=556490 Win=934400 Len=0 TSval=9671222 TSecr=1683614274
112   0.749980 54.192.118.235 -> 172.31.8.238 TCP 1514 [TCP segment of a reassembled PDU]
113   0.749984 172.31.8.238 -> 54.192.118.235 TCP 66 53381 > http [ACK] Seq=97 Ack=557938 Win=937344 Len=0 TSval=9671222 TSecr=1683614274
114   0.750155 54.192.118.235 -> 172.31.8.238 TCP 26130 [TCP segment of a reassembled PDU]
115   0.750168 172.31.8.238 -> 54.192.118.235 TCP 66 53381 > http [ACK] Seq=97 Ack=584002 Win=989440 Len=0 TSval=9671222 TSecr=1683614274
116   0.750228 54.192.118.235 -> 172.31.8.238 TCP 23234 [TCP segment of a reassembled PDU]
117   0.750241 172.31.8.238 -> 54.192.118.235 TCP 66 53381 > http [ACK] Seq=97 Ack=607170 Win=1035776 Len=0 TSval=9671222 TSecr=1683614274
118   0.750288 54.192.118.235 -> 172.31.8.238 TCP 14546 [TCP segment of a reassembled PDU]
119   0.750297 172.31.8.238 -> 54.192.118.235 TCP 66 53381 > http [ACK] Seq=97 Ack=621650 Win=1064704 Len=0 TSval=9671222 TSecr=1683614274
120   0.750732 54.192.118.235 -> 172.31.8.238 TCP 2962 [TCP segment of a reassembled PDU]
121   0.750739 172.31.8.238 -> 54.192.118.235 TCP 66 53381 > http [ACK] Seq=97 Ack=624546 Win=1070592 Len=0 TSval=9671222 TSecr=1683614274
122   0.750910 54.192.118.235 -> 172.31.8.238 TCP 26130 [TCP segment of a reassembled PDU]
123   0.750923 172.31.8.238 -> 54.192.118.235 TCP 66 53381 > http [ACK] Seq=97 Ack=650610 Win=1119488 Len=0 TSval=9671223 TSecr=1683614274
124   0.750978 54.192.118.235 -> 172.31.8.238 TCP 18890 [TCP segment of a reassembled PDU]
125   0.750989 172.31.8.238 -> 54.192.118.235 TCP 66 53381 > http [ACK] Seq=97 Ack=669434 Win=1131392 Len=0 TSval=9671223 TSecr=1683614274
126   0.751042 54.192.118.235 -> 172.31.8.238 TCP 17442 [TCP segment of a reassembled PDU]
127   0.751052 172.31.8.238 -> 54.192.118.235 TCP 66 53381 > http [ACK] Seq=97 Ack=686810 Win=1133696 Len=0 TSval=9671223 TSecr=1683614274
128   0.751281 54.192.118.235 -> 172.31.8.238 TCP 7306 [TCP segment of a reassembled PDU]
129   0.751288 172.31.8.238 -> 54.192.118.235 TCP 66 53381 > http [ACK] Seq=97 Ack=694050 Win=1150464 Len=0 TSval=9671223 TSecr=1683614274
130   0.751455 54.192.118.235 -> 172.31.8.238 TCP 24682 [TCP segment of a reassembled PDU]
131   0.751479 172.31.8.238 -> 54.192.118.235 TCP 66 53381 > http [ACK] Seq=97 Ack=718666 Win=1125888 Len=0 TSval=9671223 TSecr=1683614274
132   0.751527 54.192.118.235 -> 172.31.8.238 TCP 8754 [TCP segment of a reassembled PDU]
133   0.751533 172.31.8.238 -> 54.192.118.235 TCP 66 53381 > http [ACK] Seq=97 Ack=727354 Win=1148032 Len=0 TSval=9671223 TSecr=1683614274
134   0.751691 54.192.118.235 -> 172.31.8.238 TCP 24682 [TCP segment of a reassembled PDU]
135   0.751746 172.31.8.238 -> 54.192.118.235 TCP 66 53381 > http [ACK] Seq=97 Ack=751970 Win=1123456 Len=0 TSval=9671223 TSecr=1683614274
136   0.751906 54.192.118.235 -> 172.31.8.238 TCP 26130 [TCP segment of a reassembled PDU]
137   0.751935 54.192.118.235 -> 172.31.8.238 TCP 7306 [TCP segment of a reassembled PDU]
138   0.751945 172.31.8.238 -> 54.192.118.235 TCP 66 53381 > http [ACK] Seq=97 Ack=785274 Win=1107584 Len=0 TSval=9671223 TSecr=1683614274
139   0.752270 54.192.118.235 -> 172.31.8.238 TCP 5858 [TCP segment of a reassembled PDU]
140   0.752276 172.31.8.238 -> 54.192.118.235 TCP 66 53381 > http [ACK] Seq=97 Ack=791066 Win=1152768 Len=0 TSval=9671223 TSecr=1683614274
141   0.752446 54.192.118.235 -> 172.31.8.238 TCP 26130 [TCP segment of a reassembled PDU]
142   0.752473 172.31.8.238 -> 54.192.118.235 TCP 66 53381 > http [ACK] Seq=97 Ack=817130 Win=1126784 Len=0 TSval=9671223 TSecr=1683614274
143   0.752523 54.192.118.235 -> 172.31.8.238 TCP 23234 [TCP segment of a reassembled PDU]
144   0.752546 172.31.8.238 -> 54.192.118.235 TCP 66 53381 > http [ACK] Seq=97 Ack=840298 Win=1124224 Len=0 TSval=9671223 TSecr=1683614274
145   0.752666 54.192.118.235 -> 172.31.8.238 TCP 42058 [TCP segment of a reassembled PDU]
146   0.752764 172.31.8.238 -> 54.192.118.235 TCP 66 53381 > http [ACK] Seq=97 Ack=882290 Win=1093248 Len=0 TSval=9671223 TSecr=1683614274
147   0.753039 54.192.118.235 -> 172.31.8.238 TCP 2962 [TCP segment of a reassembled PDU]
148   0.753045 172.31.8.238 -> 54.192.118.235 TCP 66 53381 > http [ACK] Seq=97 Ack=885186 Win=1157504 Len=0 TSval=9671223 TSecr=1683614275
149   0.753206 54.192.118.235 -> 172.31.8.238 TCP 17442 [TCP segment of a reassembled PDU]
150   0.753228 172.31.8.238 -> 54.192.118.235 TCP 66 53381 > http [ACK] Seq=97 Ack=902562 Win=1140224 Len=0 TSval=9671223 TSecr=1683614275
151   0.753253 54.192.118.235 -> 172.31.8.238 TCP 8754 [TCP segment of a reassembled PDU]
152   0.753268 172.31.8.238 -> 54.192.118.235 TCP 66 53381 > http [ACK] Seq=97 Ack=911250 Win=1160320 Len=0 TSval=9671223 TSecr=1683614275
153   0.753299 54.192.118.235 -> 172.31.8.238 TCP 26130 [TCP segment of a reassembled PDU]
154   0.753324 172.31.8.238 -> 54.192.118.235 TCP 66 53381 > http [ACK] Seq=97 Ack=937314 Win=1134336 Len=0 TSval=9671223 TSecr=1683614275
155   0.753397 54.192.118.235 -> 172.31.8.238 TCP 1514 [TCP Previous segment not captured] [TCP segment of a reassembled PDU]
156   0.753402 172.31.8.238 -> 54.192.118.235 TCP 78 [TCP Window Update] 53381 > http [ACK] Seq=97 Ack=937314 Win=1159936 Len=0 TSval=9671223 TSecr=1683614275 SLE=938762 SRE=940210
157   0.753407 54.192.118.235 -> 172.31.8.238 TCP 1514 [TCP Out-Of-Order] [TCP segment of a reassembled PDU]
158   0.753410 172.31.8.238 -> 54.192.118.235 TCP 66 53381 > http [ACK] Seq=97 Ack=940210 Win=1157376 Len=0 TSval=9671223 TSecr=1683614275
159   0.753489 54.192.118.235 -> 172.31.8.238 TCP 24682 [TCP segment of a reassembled PDU]
160   0.753502 172.31.8.238 -> 54.192.118.235 TCP 66 53381 > http [ACK] Seq=97 Ack=964826 Win=1132800 Len=0 TSval=9671223 TSecr=1683614275
161   0.753608 54.192.118.235 -> 172.31.8.238 TCP 18890 [TCP segment of a reassembled PDU]
162   0.753616 172.31.8.238 -> 54.192.118.235 TCP 66 53381 > http [ACK] Seq=97 Ack=983650 Win=1131392 Len=0 TSval=9671223 TSecr=1683614275
163   0.753625 54.192.118.235 -> 172.31.8.238 TCP 1514 [TCP Previous segment not captured] [TCP segment of a reassembled PDU]
164   0.753627 172.31.8.238 -> 54.192.118.235 TCP 78 [TCP Dup ACK 162#1] 53381 > http [ACK] Seq=97 Ack=983650 Win=1131392 Len=0 TSval=9671223 TSecr=1683614275 SLE=985098 SRE=986546
165   0.753661 54.192.118.235 -> 172.31.8.238 TCP 1514 [TCP Out-Of-Order] [TCP segment of a reassembled PDU]
166   0.753666 172.31.8.238 -> 54.192.118.235 TCP 66 53381 > http [ACK] Seq=97 Ack=986546 Win=1128576 Len=0 TSval=9671223 TSecr=1683614275
167   0.753673 54.192.118.235 -> 172.31.8.238 TCP 7306 [TCP segment of a reassembled PDU]
168   0.753678 172.31.8.238 -> 54.192.118.235 TCP 66 53381 > http [ACK] Seq=97 Ack=993786 Win=1121408 Len=0 TSval=9671223 TSecr=1683614275
169   0.753999 54.192.118.235 -> 172.31.8.238 TCP 18890 [TCP segment of a reassembled PDU]
170   0.754010 172.31.8.238 -> 54.192.118.235 TCP 66 53381 > http [ACK] Seq=97 Ack=1012610 Win=1131392 Len=0 TSval=9671223 TSecr=1683614275
171   0.754127 54.192.118.235 -> 172.31.8.238 TCP 5858 [TCP segment of a reassembled PDU]
172   0.754133 172.31.8.238 -> 54.192.118.235 TCP 66 53381 > http [ACK] Seq=97 Ack=1018402 Win=1152768 Len=0 TSval=9671223 TSecr=1683614275
173   0.754303 54.192.118.235 -> 172.31.8.238 TCP 26130 [TCP segment of a reassembled PDU]
174   0.754316 172.31.8.238 -> 54.192.118.235 TCP 66 53381 > http [ACK] Seq=97 Ack=1044466 Win=1126784 Len=0 TSval=9671223 TSecr=1683614275
175   0.754332 54.192.118.235 -> 172.31.8.238 HTTP 4634 HTTP/1.1 200 OK  (application/octet-stream)
176   0.754335 172.31.8.238 -> 54.192.118.235 TCP 66 53381 > http [ACK] Seq=97 Ack=1049034 Win=1122304 Len=0 TSval=9671223 TSecr=1683614275
177   0.754459 172.31.8.238 -> 54.192.118.235 TCP 66 53381 > http [FIN, ACK] Seq=97 Ack=1049034 Win=1162368 Len=0 TSval=9671223 TSecr=1683614275
178   0.755087 54.192.118.235 -> 172.31.8.238 TCP 66 http > 53381 [FIN, ACK] Seq=1049034 Ack=98 Win=14592 Len=0 TSval=1683614275 TSecr=9671223
179   0.755094 172.31.8.238 -> 54.192.118.235 TCP 66 53381 > http [ACK] Seq=98 Ack=1049035 Win=1162368 Len=0 TSval=9671224 TSecr=1683614275
