[Measurement for 1mb at 10:44:16 20.44.2014] 
Tshark:

  1   0.000000 172.31.8.238 -> 172.31.0.2   DNS 89 Standard query 0xf403  A d2pcb72msibvx3.cloudfront.net
  2   0.000039 172.31.8.238 -> 172.31.0.2   DNS 89 Standard query 0x78ef  AAAA d2pcb72msibvx3.cloudfront.net
  3   0.000626   172.31.0.2 -> 172.31.8.238 DNS 169 Standard query response 0x78ef 
  4   0.000637   172.31.0.2 -> 172.31.8.238 DNS 217 Standard query response 0xf403  A 54.230.118.239 A 54.230.119.12 A 54.230.119.189 A 54.239.132.84 A 54.239.132.196 A 54.239.132.233 A 54.192.118.234 A 54.192.118.238
  5   0.003954 172.31.8.238 -> 54.230.118.239 TCP 74 36605 > http [SYN] Seq=0 Win=26883 Len=0 MSS=8961 SACK_PERM=1 TSval=15971155 TSecr=0 WS=128
  6   0.004629 54.230.118.239 -> 172.31.8.238 TCP 74 http > 36605 [SYN, ACK] Seq=0 Ack=1 Win=14480 Len=0 MSS=1460 SACK_PERM=1 TSval=1689147280 TSecr=15971155 WS=128
  7   0.004643 172.31.8.238 -> 54.230.118.239 TCP 66 36605 > http [ACK] Seq=1 Ack=1 Win=27008 Len=0 TSval=15971155 TSecr=1689147280
  8   0.004685 172.31.8.238 -> 54.230.118.239 HTTP 162 GET /1mb HTTP/1.1 
  9   0.005388 54.230.118.239 -> 172.31.8.238 TCP 66 http > 36605 [ACK] Seq=1 Ack=97 Win=14592 Len=0 TSval=1689147280 TSecr=15971155
 10   0.007465 54.230.118.239 -> 172.31.8.238 TCP 5858 [TCP segment of a reassembled PDU]
 11   0.007474 172.31.8.238 -> 54.230.118.239 TCP 66 36605 > http [ACK] Seq=97 Ack=5793 Win=38528 Len=0 TSval=15971156 TSecr=1689147280
 12   0.007513 54.230.118.239 -> 172.31.8.238 TCP 7306 [TCP segment of a reassembled PDU]
 13   0.007520 172.31.8.238 -> 54.230.118.239 TCP 66 36605 > http [ACK] Seq=97 Ack=13033 Win=52992 Len=0 TSval=15971156 TSecr=1689147280
 14   0.008176 54.230.118.239 -> 172.31.8.238 TCP 1514 [TCP segment of a reassembled PDU]
 15   0.008181 172.31.8.238 -> 54.230.118.239 TCP 66 36605 > http [ACK] Seq=97 Ack=14481 Win=55936 Len=0 TSval=15971156 TSecr=1689147280
 16   0.008289 54.230.118.239 -> 172.31.8.238 TCP 11650 [TCP segment of a reassembled PDU]
 17   0.008299 172.31.8.238 -> 54.230.118.239 TCP 66 36605 > http [ACK] Seq=97 Ack=26065 Win=79104 Len=0 TSval=15971156 TSecr=1689147280
 18   0.008955 54.230.118.239 -> 172.31.8.238 TCP 4410 [TCP segment of a reassembled PDU]
 19   0.008962 172.31.8.238 -> 54.230.118.239 TCP 66 36605 > http [ACK] Seq=97 Ack=30409 Win=87808 Len=0 TSval=15971157 TSecr=1689147280
 20   0.009100 54.230.118.239 -> 172.31.8.238 TCP 15994 [TCP segment of a reassembled PDU]
 21   0.009110 172.31.8.238 -> 54.230.118.239 TCP 66 36605 > http [ACK] Seq=97 Ack=46337 Win=91648 Len=0 TSval=15971157 TSecr=1689147280
 22   0.009748 54.230.118.239 -> 172.31.8.238 TCP 5858 [TCP segment of a reassembled PDU]
 23   0.009755 172.31.8.238 -> 54.230.118.239 TCP 66 36605 > http [ACK] Seq=97 Ack=52129 Win=108416 Len=0 TSval=15971157 TSecr=1689147280
 24   0.009865 54.230.118.239 -> 172.31.8.238 TCP 13098 [TCP segment of a reassembled PDU]
 25   0.009874 172.31.8.238 -> 54.230.118.239 TCP 66 36605 > http [ACK] Seq=97 Ack=65161 Win=96512 Len=0 TSval=15971157 TSecr=1689147280
 26   0.010493 54.230.118.239 -> 172.31.8.238 TCP 2962 [TCP segment of a reassembled PDU]
 27   0.010499 172.31.8.238 -> 54.230.118.239 TCP 66 36605 > http [ACK] Seq=97 Ack=68057 Win=109056 Len=0 TSval=15971157 TSecr=1689147280
 28   0.010614 54.230.118.239 -> 172.31.8.238 TCP 13098 [TCP segment of a reassembled PDU]
 29   0.010622 172.31.8.238 -> 54.230.118.239 TCP 66 36605 > http [ACK] Seq=97 Ack=81089 Win=96512 Len=0 TSval=15971157 TSecr=1689147280
 30   0.010662 54.230.118.239 -> 172.31.8.238 TCP 10202 [TCP segment of a reassembled PDU]
 31   0.010670 172.31.8.238 -> 54.230.118.239 TCP 66 36605 > http [ACK] Seq=97 Ack=91225 Win=101248 Len=0 TSval=15971157 TSecr=1689147280
 32   0.011248 54.230.118.239 -> 172.31.8.238 TCP 2962 [TCP segment of a reassembled PDU]
 33   0.011253 172.31.8.238 -> 54.230.118.239 TCP 66 36605 > http [ACK] Seq=97 Ack=94121 Win=109056 Len=0 TSval=15971157 TSecr=1689147281
 34   0.011404 54.230.118.239 -> 172.31.8.238 TCP 26130 [TCP segment of a reassembled PDU]
 35   0.011431 172.31.8.238 -> 54.230.118.239 TCP 66 36605 > http [ACK] Seq=97 Ack=120185 Win=83072 Len=0 TSval=15971157 TSecr=1689147281
 36   0.011438 54.230.118.239 -> 172.31.8.238 TCP 1514 [TCP segment of a reassembled PDU]
 37   0.011441 172.31.8.238 -> 54.230.118.239 TCP 66 36605 > http [ACK] Seq=97 Ack=121633 Win=81664 Len=0 TSval=15971157 TSecr=1689147281
 38   0.012022 54.230.118.239 -> 172.31.8.238 TCP 4410 [TCP segment of a reassembled PDU]
 39   0.012029 172.31.8.238 -> 54.230.118.239 TCP 66 36605 > http [ACK] Seq=97 Ack=125977 Win=109056 Len=0 TSval=15971157 TSecr=1689147281
 40   0.012126 54.230.118.239 -> 172.31.8.238 TCP 4410 [TCP segment of a reassembled PDU]
 41   0.012210 54.230.118.239 -> 172.31.8.238 TCP 26130 [TCP segment of a reassembled PDU]
 42   0.012343 172.31.8.238 -> 54.230.118.239 TCP 66 36605 > http [ACK] Seq=97 Ack=156385 Win=78720 Len=0 TSval=15971157 TSecr=1689147281
 43   0.013044 54.230.118.239 -> 172.31.8.238 TCP 4410 [TCP segment of a reassembled PDU]
 44   0.013050 172.31.8.238 -> 54.230.118.239 TCP 66 36605 > http [ACK] Seq=97 Ack=160729 Win=109056 Len=0 TSval=15971158 TSecr=1689147281
 45   0.013175 54.230.118.239 -> 172.31.8.238 TCP 21786 [TCP segment of a reassembled PDU]
 46   0.013186 172.31.8.238 -> 54.230.118.239 TCP 66 36605 > http [ACK] Seq=97 Ack=182449 Win=152448 Len=0 TSval=15971158 TSecr=1689147281
 47   0.013810 54.230.118.239 -> 172.31.8.238 TCP 2962 [TCP segment of a reassembled PDU]
 48   0.013815 172.31.8.238 -> 54.230.118.239 TCP 66 36605 > http [ACK] Seq=97 Ack=185345 Win=158336 Len=0 TSval=15971158 TSecr=1689147281
 49   0.013974 54.230.118.239 -> 172.31.8.238 TCP 26130 [TCP segment of a reassembled PDU]
 50   0.013988 172.31.8.238 -> 54.230.118.239 TCP 66 36605 > http [ACK] Seq=97 Ack=211409 Win=210432 Len=0 TSval=15971158 TSecr=1689147281
 51   0.014031 54.230.118.239 -> 172.31.8.238 TCP 11650 [TCP segment of a reassembled PDU]
 52   0.014038 172.31.8.238 -> 54.230.118.239 TCP 66 36605 > http [ACK] Seq=97 Ack=222993 Win=233600 Len=0 TSval=15971158 TSecr=1689147281
 53   0.014575 54.230.118.239 -> 172.31.8.238 TCP 4410 [TCP segment of a reassembled PDU]
 54   0.014581 172.31.8.238 -> 54.230.118.239 TCP 66 36605 > http [ACK] Seq=97 Ack=227337 Win=242304 Len=0 TSval=15971158 TSecr=1689147281
 55   0.014732 54.230.118.239 -> 172.31.8.238 TCP 17442 [TCP segment of a reassembled PDU]
 56   0.014742 172.31.8.238 -> 54.230.118.239 TCP 66 36605 > http [ACK] Seq=97 Ack=244713 Win=276992 Len=0 TSval=15971158 TSecr=1689147281
 57   0.014764 54.230.118.239 -> 172.31.8.238 TCP 8754 [TCP segment of a reassembled PDU]
 58   0.014771 172.31.8.238 -> 54.230.118.239 TCP 66 36605 > http [ACK] Seq=97 Ack=253401 Win=294400 Len=0 TSval=15971158 TSecr=1689147281
 59   0.015395 54.230.118.239 -> 172.31.8.238 TCP 11650 [TCP segment of a reassembled PDU]
 60   0.015405 172.31.8.238 -> 54.230.118.239 TCP 66 36605 > http [ACK] Seq=97 Ack=264985 Win=317568 Len=0 TSval=15971158 TSecr=1689147281
 61   0.015525 54.230.118.239 -> 172.31.8.238 TCP 26130 [TCP segment of a reassembled PDU]
 62   0.015538 172.31.8.238 -> 54.230.118.239 TCP 66 36605 > http [ACK] Seq=97 Ack=291049 Win=369664 Len=0 TSval=15971158 TSecr=1689147281
 63   0.015562 54.230.118.239 -> 172.31.8.238 TCP 7306 [TCP segment of a reassembled PDU]
 64   0.015570 172.31.8.238 -> 54.230.118.239 TCP 66 36605 > http [ACK] Seq=97 Ack=298289 Win=384128 Len=0 TSval=15971158 TSecr=1689147281
 65   0.016129 54.230.118.239 -> 172.31.8.238 TCP 2962 [TCP segment of a reassembled PDU]
 66   0.016134 172.31.8.238 -> 54.230.118.239 TCP 66 36605 > http [ACK] Seq=97 Ack=301185 Win=390016 Len=0 TSval=15971158 TSecr=1689147281
 67   0.016339 54.230.118.239 -> 172.31.8.238 TCP 26130 [TCP segment of a reassembled PDU]
 68   0.016358 172.31.8.238 -> 54.230.118.239 TCP 66 36605 > http [ACK] Seq=97 Ack=327249 Win=442112 Len=0 TSval=15971158 TSecr=1689147281
 69   0.016372 54.230.118.239 -> 172.31.8.238 TCP 15994 [TCP segment of a reassembled PDU]
 70   0.016381 172.31.8.238 -> 54.230.118.239 TCP 66 36605 > http [ACK] Seq=97 Ack=343177 Win=473984 Len=0 TSval=15971158 TSecr=1689147281
 71   0.016907 54.230.118.239 -> 172.31.8.238 TCP 2962 [TCP segment of a reassembled PDU]
 72   0.016914 172.31.8.238 -> 54.230.118.239 TCP 66 36605 > http [ACK] Seq=97 Ack=346073 Win=479744 Len=0 TSval=15971159 TSecr=1689147281
 73   0.017080 54.230.118.239 -> 172.31.8.238 TCP 26130 [TCP segment of a reassembled PDU]
 74   0.017094 172.31.8.238 -> 54.230.118.239 TCP 66 36605 > http [ACK] Seq=97 Ack=372137 Win=531840 Len=0 TSval=15971159 TSecr=1689147281
 75   0.017164 54.230.118.239 -> 172.31.8.238 TCP 21786 [TCP segment of a reassembled PDU]
 76   0.017177 172.31.8.238 -> 54.230.118.239 TCP 66 36605 > http [ACK] Seq=97 Ack=393857 Win=575360 Len=0 TSval=15971159 TSecr=1689147281
 77   0.017224 54.230.118.239 -> 172.31.8.238 TCP 2962 [TCP segment of a reassembled PDU]
 78   0.017229 172.31.8.238 -> 54.230.118.239 TCP 66 36605 > http [ACK] Seq=97 Ack=396753 Win=581120 Len=0 TSval=15971159 TSecr=1689147281
 79   0.017668 54.230.118.239 -> 172.31.8.238 TCP 2962 [TCP segment of a reassembled PDU]
 80   0.017675 172.31.8.238 -> 54.230.118.239 TCP 66 36605 > http [ACK] Seq=97 Ack=399649 Win=586880 Len=0 TSval=15971159 TSecr=1689147281
 81   0.017866 54.230.118.239 -> 172.31.8.238 TCP 26130 [TCP segment of a reassembled PDU]
 82   0.017880 172.31.8.238 -> 54.230.118.239 TCP 66 36605 > http [ACK] Seq=97 Ack=425713 Win=638976 Len=0 TSval=15971159 TSecr=1689147281
 83   0.017901 54.230.118.239 -> 172.31.8.238 TCP 7306 [TCP segment of a reassembled PDU]
 84   0.017906 172.31.8.238 -> 54.230.118.239 TCP 66 36605 > http [ACK] Seq=97 Ack=432953 Win=653568 Len=0 TSval=15971159 TSecr=1689147281
 85   0.018034 54.230.118.239 -> 172.31.8.238 TCP 17442 [TCP segment of a reassembled PDU]
 86   0.018045 172.31.8.238 -> 54.230.118.239 TCP 66 36605 > http [ACK] Seq=97 Ack=450329 Win=688256 Len=0 TSval=15971159 TSecr=1689147281
 87   0.018430 54.230.118.239 -> 172.31.8.238 TCP 4410 [TCP segment of a reassembled PDU]
 88   0.018436 172.31.8.238 -> 54.230.118.239 TCP 66 36605 > http [ACK] Seq=97 Ack=454673 Win=696960 Len=0 TSval=15971159 TSecr=1689147281
 89   0.018616 54.230.118.239 -> 172.31.8.238 TCP 26130 [TCP segment of a reassembled PDU]
 90   0.018644 172.31.8.238 -> 54.230.118.239 TCP 66 36605 > http [ACK] Seq=97 Ack=480737 Win=749056 Len=0 TSval=15971159 TSecr=1689147281
 91   0.018693 54.230.118.239 -> 172.31.8.238 TCP 20338 [TCP segment of a reassembled PDU]
 92   0.018705 172.31.8.238 -> 54.230.118.239 TCP 66 36605 > http [ACK] Seq=97 Ack=501009 Win=777600 Len=0 TSval=15971159 TSecr=1689147281
 93   0.018745 54.230.118.239 -> 172.31.8.238 TCP 2962 [TCP segment of a reassembled PDU]
 94   0.018750 172.31.8.238 -> 54.230.118.239 TCP 66 36605 > http [ACK] Seq=97 Ack=503905 Win=795392 Len=0 TSval=15971159 TSecr=1689147281
 95   0.019184 54.230.118.239 -> 172.31.8.238 TCP 2962 [TCP segment of a reassembled PDU]
 96   0.019191 172.31.8.238 -> 54.230.118.239 TCP 66 36605 > http [ACK] Seq=97 Ack=506801 Win=801152 Len=0 TSval=15971159 TSecr=1689147281
 97   0.019372 54.230.118.239 -> 172.31.8.238 TCP 26130 [TCP segment of a reassembled PDU]
 98   0.019398 172.31.8.238 -> 54.230.118.239 TCP 66 36605 > http [ACK] Seq=97 Ack=532865 Win=775168 Len=0 TSval=15971159 TSecr=1689147281
 99   0.019451 54.230.118.239 -> 172.31.8.238 TCP 26130 [TCP segment of a reassembled PDU]
100   0.019479 172.31.8.238 -> 54.230.118.239 TCP 66 36605 > http [ACK] Seq=97 Ack=558929 Win=768128 Len=0 TSval=15971159 TSecr=1689147281
101   0.019511 54.230.118.239 -> 172.31.8.238 TCP 10202 [TCP segment of a reassembled PDU]
102   0.019519 172.31.8.238 -> 54.230.118.239 TCP 66 36605 > http [ACK] Seq=97 Ack=569065 Win=794368 Len=0 TSval=15971159 TSecr=1689147281
103   0.019963 54.230.118.239 -> 172.31.8.238 TCP 4410 [TCP segment of a reassembled PDU]
104   0.019969 172.31.8.238 -> 54.230.118.239 TCP 66 36605 > http [ACK] Seq=97 Ack=573409 Win=803840 Len=0 TSval=15971159 TSecr=1689147281
105   0.020144 54.230.118.239 -> 172.31.8.238 TCP 26130 [TCP segment of a reassembled PDU]
106   0.020171 172.31.8.238 -> 54.230.118.239 TCP 66 36605 > http [ACK] Seq=97 Ack=599473 Win=777856 Len=0 TSval=15971159 TSecr=1689147281
107   0.020223 54.230.118.239 -> 172.31.8.238 TCP 21786 [TCP segment of a reassembled PDU]
108   0.020249 172.31.8.238 -> 54.230.118.239 TCP 66 36605 > http [ACK] Seq=97 Ack=621193 Win=775296 Len=0 TSval=15971159 TSecr=1689147281
109   0.020288 54.230.118.239 -> 172.31.8.238 TCP 13098 [TCP segment of a reassembled PDU]
110   0.020296 172.31.8.238 -> 54.230.118.239 TCP 66 36605 > http [ACK] Seq=97 Ack=634225 Win=789632 Len=0 TSval=15971159 TSecr=1689147281
111   0.020729 54.230.118.239 -> 172.31.8.238 TCP 2962 [TCP segment of a reassembled PDU]
112   0.020736 172.31.8.238 -> 54.230.118.239 TCP 66 36605 > http [ACK] Seq=97 Ack=637121 Win=806144 Len=0 TSval=15971160 TSecr=1689147282
113   0.020942 54.230.118.239 -> 172.31.8.238 TCP 26130 [TCP segment of a reassembled PDU]
114   0.020956 172.31.8.238 -> 54.230.118.239 TCP 66 36605 > http [ACK] Seq=97 Ack=663185 Win=859776 Len=0 TSval=15971160 TSecr=1689147282
115   0.021020 54.230.118.239 -> 172.31.8.238 TCP 20338 [TCP segment of a reassembled PDU]
116   0.021032 172.31.8.238 -> 54.230.118.239 TCP 66 36605 > http [ACK] Seq=97 Ack=683457 Win=900352 Len=0 TSval=15971160 TSecr=1689147282
117   0.021092 54.230.118.239 -> 172.31.8.238 TCP 15994 [TCP segment of a reassembled PDU]
118   0.021102 172.31.8.238 -> 54.230.118.239 TCP 66 36605 > http [ACK] Seq=97 Ack=699385 Win=932224 Len=0 TSval=15971160 TSecr=1689147282
119   0.021490 54.230.118.239 -> 172.31.8.238 TCP 1514 [TCP segment of a reassembled PDU]
120   0.021495 172.31.8.238 -> 54.230.118.239 TCP 66 36605 > http [ACK] Seq=97 Ack=700833 Win=935168 Len=0 TSval=15971160 TSecr=1689147282
121   0.021689 54.230.118.239 -> 172.31.8.238 TCP 26130 [TCP segment of a reassembled PDU]
122   0.021703 172.31.8.238 -> 54.230.118.239 TCP 66 36605 > http [ACK] Seq=97 Ack=726897 Win=987264 Len=0 TSval=15971160 TSecr=1689147282
123   0.021763 54.230.118.239 -> 172.31.8.238 TCP 18890 [TCP segment of a reassembled PDU]
124   0.021774 172.31.8.238 -> 54.230.118.239 TCP 66 36605 > http [ACK] Seq=97 Ack=745721 Win=1024896 Len=0 TSval=15971160 TSecr=1689147282
125   0.021837 54.230.118.239 -> 172.31.8.238 TCP 14546 [TCP segment of a reassembled PDU]
126   0.021847 172.31.8.238 -> 54.230.118.239 TCP 66 36605 > http [ACK] Seq=97 Ack=760201 Win=1053824 Len=0 TSval=15971160 TSecr=1689147282
127   0.021885 54.230.118.239 -> 172.31.8.238 TCP 4410 [TCP segment of a reassembled PDU]
128   0.021891 172.31.8.238 -> 54.230.118.239 TCP 66 36605 > http [ACK] Seq=97 Ack=764545 Win=1062528 Len=0 TSval=15971160 TSecr=1689147282
129   0.022262 54.230.118.239 -> 172.31.8.238 TCP 4410 [TCP segment of a reassembled PDU]
130   0.022269 172.31.8.238 -> 54.230.118.239 TCP 66 36605 > http [ACK] Seq=97 Ack=768889 Win=1071232 Len=0 TSval=15971160 TSecr=1689147282
131   0.022460 54.230.118.239 -> 172.31.8.238 TCP 26130 [TCP segment of a reassembled PDU]
132   0.022474 172.31.8.238 -> 54.230.118.239 TCP 66 36605 > http [ACK] Seq=97 Ack=794953 Win=1123328 Len=0 TSval=15971160 TSecr=1689147282
133   0.022539 54.230.118.239 -> 172.31.8.238 TCP 26130 [TCP segment of a reassembled PDU]
134   0.022553 172.31.8.238 -> 54.230.118.239 TCP 66 36605 > http [ACK] Seq=97 Ack=821017 Win=1175552 Len=0 TSval=15971160 TSecr=1689147282
135   0.022611 54.230.118.239 -> 172.31.8.238 TCP 8754 [TCP segment of a reassembled PDU]
136   0.022618 172.31.8.238 -> 54.230.118.239 TCP 66 36605 > http [ACK] Seq=97 Ack=829705 Win=1192832 Len=0 TSval=15971160 TSecr=1689147282
137   0.022705 54.230.118.239 -> 172.31.8.238 TCP 26130 [TCP segment of a reassembled PDU]
138   0.022718 172.31.8.238 -> 54.230.118.239 TCP 66 36605 > http [ACK] Seq=97 Ack=855769 Win=1245056 Len=0 TSval=15971160 TSecr=1689147282
139   0.022758 54.230.118.239 -> 172.31.8.238 TCP 8754 [TCP segment of a reassembled PDU]
140   0.022764 172.31.8.238 -> 54.230.118.239 TCP 66 36605 > http [ACK] Seq=97 Ack=864457 Win=1262336 Len=0 TSval=15971160 TSecr=1689147282
141   0.023121 54.230.118.239 -> 172.31.8.238 TCP 4410 [TCP segment of a reassembled PDU]
142   0.023128 172.31.8.238 -> 54.230.118.239 TCP 66 36605 > http [ACK] Seq=97 Ack=868801 Win=1271040 Len=0 TSval=15971160 TSecr=1689147282
143   0.023295 54.230.118.239 -> 172.31.8.238 TCP 26130 [TCP segment of a reassembled PDU]
144   0.023308 172.31.8.238 -> 54.230.118.239 TCP 66 36605 > http [ACK] Seq=97 Ack=894865 Win=1323136 Len=0 TSval=15971160 TSecr=1689147282
145   0.023387 54.230.118.239 -> 172.31.8.238 TCP 23234 [TCP segment of a reassembled PDU]
146   0.023401 172.31.8.238 -> 54.230.118.239 TCP 66 36605 > http [ACK] Seq=97 Ack=918033 Win=1369472 Len=0 TSval=15971160 TSecr=1689147282
147   0.023541 54.230.118.239 -> 172.31.8.238 TCP 42058 [TCP segment of a reassembled PDU]
148   0.023562 172.31.8.238 -> 54.230.118.239 TCP 66 36605 > http [ACK] Seq=97 Ack=960025 Win=1390592 Len=0 TSval=15971160 TSecr=1689147282
149   0.024013 54.230.118.239 -> 172.31.8.238 TCP 4410 [TCP segment of a reassembled PDU]
150   0.024020 172.31.8.238 -> 54.230.118.239 TCP 66 36605 > http [ACK] Seq=97 Ack=964369 Win=1450624 Len=0 TSval=15971160 TSecr=1689147282
151   0.024194 54.230.118.239 -> 172.31.8.238 TCP 26130 [TCP segment of a reassembled PDU]
152   0.024221 172.31.8.238 -> 54.230.118.239 TCP 66 36605 > http [ACK] Seq=97 Ack=990433 Win=1424640 Len=0 TSval=15971160 TSecr=1689147282
153   0.024274 54.230.118.239 -> 172.31.8.238 TCP 26130 [TCP segment of a reassembled PDU]
154   0.024301 172.31.8.238 -> 54.230.118.239 TCP 66 36605 > http [ACK] Seq=97 Ack=1016497 Win=1416832 Len=0 TSval=15971160 TSecr=1689147282
155   0.024361 54.230.118.239 -> 172.31.8.238 TCP 26130 [TCP segment of a reassembled PDU]
156   0.024375 172.31.8.238 -> 54.230.118.239 TCP 66 36605 > http [ACK] Seq=97 Ack=1042561 Win=1416832 Len=0 TSval=15971160 TSecr=1689147282
157   0.024408 54.230.118.239 -> 172.31.8.238 HTTP 6539 HTTP/1.1 200 OK  (application/octet-stream)
158   0.024413 172.31.8.238 -> 54.230.118.239 TCP 66 36605 > http [ACK] Seq=97 Ack=1049034 Win=1447808 Len=0 TSval=15971160 TSecr=1689147282
159   0.024550 172.31.8.238 -> 54.230.118.239 TCP 66 36605 > http [FIN, ACK] Seq=97 Ack=1049034 Win=1450624 Len=0 TSval=15971160 TSecr=1689147282
160   0.025069 54.230.118.239 -> 172.31.8.238 TCP 66 http > 36605 [FIN, ACK] Seq=1049034 Ack=98 Win=14592 Len=0 TSval=1689147282 TSecr=15971160
161   0.025079 172.31.8.238 -> 54.230.118.239 TCP 66 36605 > http [ACK] Seq=98 Ack=1049035 Win=1450624 Len=0 TSval=15971161 TSecr=1689147282
