[Measurement for 1mb at 12:44:17 20.44.2014] 
Tshark:

  1   0.000000 172.31.8.238 -> 172.31.0.2   DNS 89 Standard query 0xd354  A d2pcb72msibvx3.cloudfront.net
  2   0.000028 172.31.8.238 -> 172.31.0.2   DNS 89 Standard query 0x238e  AAAA d2pcb72msibvx3.cloudfront.net
  3   0.000750   172.31.0.2 -> 172.31.8.238 DNS 169 Standard query response 0x238e 
  4   0.000776   172.31.0.2 -> 172.31.8.238 DNS 217 Standard query response 0xd354  A 54.230.117.21 A 54.230.117.87 A 54.230.117.198 A 54.230.118.114 A 54.230.119.150 A 54.239.132.233 A 54.192.118.218 A 54.230.116.72
  5   0.003850 172.31.8.238 -> 54.230.117.21 TCP 74 34497 > http [SYN] Seq=0 Win=26883 Len=0 MSS=8961 SACK_PERM=1 TSval=17771295 TSecr=0 WS=128
  6   0.004711 54.230.117.21 -> 172.31.8.238 TCP 74 http > 34497 [SYN, ACK] Seq=0 Ack=1 Win=14480 Len=0 MSS=1460 SACK_PERM=1 TSval=1687600351 TSecr=17771295 WS=128
  7   0.004726 172.31.8.238 -> 54.230.117.21 TCP 66 34497 > http [ACK] Seq=1 Ack=1 Win=27008 Len=0 TSval=17771295 TSecr=1687600351
  8   0.004769 172.31.8.238 -> 54.230.117.21 HTTP 162 GET /1mb HTTP/1.1 
  9   0.005454 54.230.117.21 -> 172.31.8.238 TCP 66 http > 34497 [ACK] Seq=1 Ack=97 Win=14592 Len=0 TSval=1687600351 TSecr=17771295
 10   0.006791 54.230.117.21 -> 172.31.8.238 TCP 523 [TCP segment of a reassembled PDU]
 11   0.006798 172.31.8.238 -> 54.230.117.21 TCP 66 34497 > http [ACK] Seq=97 Ack=458 Win=28032 Len=0 TSval=17771296 TSecr=1687600351
 12   0.006942 54.230.117.21 -> 172.31.8.238 TCP 13098 [TCP segment of a reassembled PDU]
 13   0.006953 172.31.8.238 -> 54.230.117.21 TCP 66 34497 > http [ACK] Seq=97 Ack=13490 Win=54144 Len=0 TSval=17771296 TSecr=1687600351
 14   0.007534 54.230.117.21 -> 172.31.8.238 TCP 2962 [TCP segment of a reassembled PDU]
 15   0.007541 172.31.8.238 -> 54.230.117.21 TCP 66 34497 > http [ACK] Seq=97 Ack=16386 Win=59904 Len=0 TSval=17771296 TSecr=1687600352
 16   0.007647 54.230.117.21 -> 172.31.8.238 TCP 10202 [TCP segment of a reassembled PDU]
 17   0.007654 172.31.8.238 -> 54.230.117.21 TCP 66 34497 > http [ACK] Seq=97 Ack=26522 Win=80128 Len=0 TSval=17771296 TSecr=1687600352
 18   0.008292 54.230.117.21 -> 172.31.8.238 TCP 4410 [TCP segment of a reassembled PDU]
 19   0.008298 172.31.8.238 -> 54.230.117.21 TCP 66 34497 > http [ACK] Seq=97 Ack=30866 Win=88832 Len=0 TSval=17771296 TSecr=1687600352
 20   0.008416 54.230.117.21 -> 172.31.8.238 TCP 15994 [TCP segment of a reassembled PDU]
 21   0.008426 172.31.8.238 -> 54.230.117.21 TCP 66 34497 > http [ACK] Seq=97 Ack=46794 Win=91648 Len=0 TSval=17771296 TSecr=1687600352
 22   0.009074 54.230.117.21 -> 172.31.8.238 TCP 2962 [TCP segment of a reassembled PDU]
 23   0.009080 172.31.8.238 -> 54.230.117.21 TCP 66 34497 > http [ACK] Seq=97 Ack=49690 Win=109056 Len=0 TSval=17771297 TSecr=1687600352
 24   0.009173 54.230.117.21 -> 172.31.8.238 TCP 2962 [TCP segment of a reassembled PDU]
 25   0.009178 172.31.8.238 -> 54.230.117.21 TCP 66 34497 > http [ACK] Seq=97 Ack=52586 Win=114816 Len=0 TSval=17771297 TSecr=1687600352
 26   0.009223 54.230.117.21 -> 172.31.8.238 TCP 13098 [TCP segment of a reassembled PDU]
 27   0.009232 172.31.8.238 -> 54.230.117.21 TCP 66 34497 > http [ACK] Seq=97 Ack=65618 Win=140928 Len=0 TSval=17771297 TSecr=1687600352
 28   0.009904 54.230.117.21 -> 172.31.8.238 TCP 14546 [TCP segment of a reassembled PDU]
 29   0.009914 172.31.8.238 -> 54.230.117.21 TCP 66 34497 > http [ACK] Seq=97 Ack=80098 Win=169856 Len=0 TSval=17771297 TSecr=1687600352
 30   0.010055 54.230.117.21 -> 172.31.8.238 TCP 11650 [TCP segment of a reassembled PDU]
 31   0.010063 172.31.8.238 -> 54.230.117.21 TCP 66 34497 > http [ACK] Seq=97 Ack=91682 Win=193024 Len=0 TSval=17771297 TSecr=1687600352
 32   0.010727 54.230.117.21 -> 172.31.8.238 TCP 13098 [TCP segment of a reassembled PDU]
 33   0.010736 172.31.8.238 -> 54.230.117.21 TCP 66 34497 > http [ACK] Seq=97 Ack=104714 Win=219136 Len=0 TSval=17771297 TSecr=1687600352
 34   0.010894 54.230.117.21 -> 172.31.8.238 TCP 4410 [TCP segment of a reassembled PDU]
 35   0.010900 172.31.8.238 -> 54.230.117.21 TCP 66 34497 > http [ACK] Seq=97 Ack=109058 Win=227840 Len=0 TSval=17771297 TSecr=1687600352
 36   0.011042 54.230.117.21 -> 172.31.8.238 TCP 8754 [TCP segment of a reassembled PDU]
 37   0.011049 172.31.8.238 -> 54.230.117.21 TCP 66 34497 > http [ACK] Seq=97 Ack=117746 Win=245120 Len=0 TSval=17771297 TSecr=1687600352
 38   0.011362 54.230.117.21 -> 172.31.8.238 TCP 8754 [TCP segment of a reassembled PDU]
 39   0.011370 172.31.8.238 -> 54.230.117.21 TCP 66 34497 > http [ACK] Seq=97 Ack=126434 Win=262528 Len=0 TSval=17771297 TSecr=1687600352
 40   0.011468 54.230.117.21 -> 172.31.8.238 TCP 4410 [TCP segment of a reassembled PDU]
 41   0.011474 172.31.8.238 -> 54.230.117.21 TCP 66 34497 > http [ACK] Seq=97 Ack=130778 Win=271232 Len=0 TSval=17771297 TSecr=1687600352
 42   0.011634 54.230.117.21 -> 172.31.8.238 TCP 11650 [TCP segment of a reassembled PDU]
 43   0.011643 172.31.8.238 -> 54.230.117.21 TCP 66 34497 > http [ACK] Seq=97 Ack=142362 Win=283904 Len=0 TSval=17771297 TSecr=1687600352
 44   0.012134 54.230.117.21 -> 172.31.8.238 TCP 13098 [TCP segment of a reassembled PDU]
 45   0.012143 172.31.8.238 -> 54.230.117.21 TCP 66 34497 > http [ACK] Seq=97 Ack=155394 Win=302976 Len=0 TSval=17771297 TSecr=1687600352
 46   0.012228 54.230.117.21 -> 172.31.8.238 TCP 1514 [TCP segment of a reassembled PDU]
 47   0.012233 172.31.8.238 -> 54.230.117.21 TCP 66 34497 > http [ACK] Seq=97 Ack=156842 Win=321920 Len=0 TSval=17771297 TSecr=1687600352
 48   0.012440 54.230.117.21 -> 172.31.8.238 TCP 23234 [TCP segment of a reassembled PDU]
 49   0.012453 172.31.8.238 -> 54.230.117.21 TCP 66 34497 > http [ACK] Seq=97 Ack=180010 Win=298752 Len=0 TSval=17771297 TSecr=1687600352
 50   0.012459 54.230.117.21 -> 172.31.8.238 TCP 1514 [TCP segment of a reassembled PDU]
 51   0.012462 172.31.8.238 -> 54.230.117.21 TCP 66 34497 > http [ACK] Seq=97 Ack=181458 Win=297344 Len=0 TSval=17771297 TSecr=1687600352
 52   0.012880 54.230.117.21 -> 172.31.8.238 TCP 1514 [TCP segment of a reassembled PDU]
 53   0.012885 172.31.8.238 -> 54.230.117.21 TCP 66 34497 > http [ACK] Seq=97 Ack=182906 Win=321920 Len=0 TSval=17771297 TSecr=1687600352
 54   0.012989 54.230.117.21 -> 172.31.8.238 TCP 15994 [TCP segment of a reassembled PDU]
 55   0.012998 172.31.8.238 -> 54.230.117.21 TCP 66 34497 > http [ACK] Seq=97 Ack=198834 Win=306048 Len=0 TSval=17771298 TSecr=1687600352
 56   0.013256 54.230.117.21 -> 172.31.8.238 TCP 24682 [TCP segment of a reassembled PDU]
 57   0.013270 172.31.8.238 -> 54.230.117.21 TCP 66 34497 > http [ACK] Seq=97 Ack=223450 Win=372608 Len=0 TSval=17771298 TSecr=1687600352
 58   0.013658 54.230.117.21 -> 172.31.8.238 TCP 7306 [TCP segment of a reassembled PDU]
 59   0.013665 172.31.8.238 -> 54.230.117.21 TCP 66 34497 > http [ACK] Seq=97 Ack=230690 Win=387072 Len=0 TSval=17771298 TSecr=1687600352
 60   0.013788 54.230.117.21 -> 172.31.8.238 TCP 15994 [TCP segment of a reassembled PDU]
 61   0.013798 172.31.8.238 -> 54.230.117.21 TCP 66 34497 > http [ACK] Seq=97 Ack=246618 Win=418944 Len=0 TSval=17771298 TSecr=1687600352
 62   0.014021 54.230.117.21 -> 172.31.8.238 TCP 26130 [TCP segment of a reassembled PDU]
 63   0.014036 172.31.8.238 -> 54.230.117.21 TCP 66 34497 > http [ACK] Seq=97 Ack=272682 Win=471040 Len=0 TSval=17771298 TSecr=1687600352
 64   0.014432 54.230.117.21 -> 172.31.8.238 TCP 2962 [TCP segment of a reassembled PDU]
 65   0.014438 172.31.8.238 -> 54.230.117.21 TCP 66 34497 > http [ACK] Seq=97 Ack=275578 Win=476800 Len=0 TSval=17771298 TSecr=1687600352
 66   0.014595 54.230.117.21 -> 172.31.8.238 TCP 17442 [TCP segment of a reassembled PDU]
 67   0.014606 172.31.8.238 -> 54.230.117.21 TCP 66 34497 > http [ACK] Seq=97 Ack=292954 Win=511616 Len=0 TSval=17771298 TSecr=1687600352
 68   0.014623 54.230.117.21 -> 172.31.8.238 TCP 5858 [TCP segment of a reassembled PDU]
 69   0.014628 172.31.8.238 -> 54.230.117.21 TCP 66 34497 > http [ACK] Seq=97 Ack=298746 Win=523136 Len=0 TSval=17771298 TSecr=1687600352
 70   0.014864 54.230.117.21 -> 172.31.8.238 TCP 26130 [TCP segment of a reassembled PDU]
 71   0.014878 172.31.8.238 -> 54.230.117.21 TCP 66 34497 > http [ACK] Seq=97 Ack=324810 Win=575360 Len=0 TSval=17771298 TSecr=1687600352
 72   0.014884 54.230.117.21 -> 172.31.8.238 TCP 1514 [TCP segment of a reassembled PDU]
 73   0.014886 172.31.8.238 -> 54.230.117.21 TCP 66 34497 > http [ACK] Seq=97 Ack=326258 Win=578176 Len=0 TSval=17771298 TSecr=1687600352
 74   0.015337 54.230.117.21 -> 172.31.8.238 TCP 17442 [TCP segment of a reassembled PDU]
 75   0.015347 172.31.8.238 -> 54.230.117.21 TCP 66 34497 > http [ACK] Seq=97 Ack=343634 Win=612992 Len=0 TSval=17771298 TSecr=1687600352
 76   0.015493 54.230.117.21 -> 172.31.8.238 TCP 13098 [TCP segment of a reassembled PDU]
 77   0.015502 172.31.8.238 -> 54.230.117.21 TCP 66 34497 > http [ACK] Seq=97 Ack=356666 Win=638976 Len=0 TSval=17771298 TSecr=1687600352
 78   0.015664 54.230.117.21 -> 172.31.8.238 TCP 26130 [TCP segment of a reassembled PDU]
 79   0.015678 172.31.8.238 -> 54.230.117.21 TCP 66 34497 > http [ACK] Seq=97 Ack=382730 Win=691200 Len=0 TSval=17771298 TSecr=1687600352
 80   0.015692 54.230.117.21 -> 172.31.8.238 TCP 1514 [TCP segment of a reassembled PDU]
 81   0.015697 172.31.8.238 -> 54.230.117.21 TCP 66 34497 > http [ACK] Seq=97 Ack=384178 Win=694016 Len=0 TSval=17771298 TSecr=1687600352
 82   0.016038 54.230.117.21 -> 172.31.8.238 TCP 21786 [TCP segment of a reassembled PDU]
 83   0.016051 172.31.8.238 -> 54.230.117.21 TCP 66 34497 > http [ACK] Seq=97 Ack=405898 Win=737536 Len=0 TSval=17771298 TSecr=1687600352
 84   0.016368 54.230.117.21 -> 172.31.8.238 TCP 2962 [TCP segment of a reassembled PDU]
 85   0.016373 172.31.8.238 -> 54.230.117.21 TCP 66 34497 > http [ACK] Seq=97 Ack=408794 Win=743296 Len=0 TSval=17771298 TSecr=1687600352
 86   0.016589 54.230.117.21 -> 172.31.8.238 TCP 4410 [TCP segment of a reassembled PDU]
 87   0.016595 172.31.8.238 -> 54.230.117.21 TCP 66 34497 > http [ACK] Seq=97 Ack=413138 Win=752000 Len=0 TSval=17771298 TSecr=1687600352
 88   0.016787 54.230.117.21 -> 172.31.8.238 TCP 26130 [TCP segment of a reassembled PDU]
 89   0.016801 172.31.8.238 -> 54.230.117.21 TCP 66 34497 > http [ACK] Seq=97 Ack=439202 Win=804096 Len=0 TSval=17771298 TSecr=1687600352
 90   0.016832 54.230.117.21 -> 172.31.8.238 TCP 26130 [TCP segment of a reassembled PDU]
 91   0.016845 172.31.8.238 -> 54.230.117.21 TCP 66 34497 > http [ACK] Seq=97 Ack=465266 Win=797312 Len=0 TSval=17771298 TSecr=1687600352
 92   0.017790 54.230.117.21 -> 172.31.8.238 TCP 8754 [TCP segment of a reassembled PDU]
 93   0.017798 172.31.8.238 -> 54.230.117.21 TCP 66 34497 > http [ACK] Seq=97 Ack=473954 Win=821504 Len=0 TSval=17771299 TSecr=1687600352
 94   0.018020 54.230.117.21 -> 172.31.8.238 TCP 37714 [TCP segment of a reassembled PDU]
 95   0.018039 172.31.8.238 -> 54.230.117.21 TCP 66 34497 > http [ACK] Seq=97 Ack=511602 Win=896768 Len=0 TSval=17771299 TSecr=1687600353
 96   0.018557 54.230.117.21 -> 172.31.8.238 TCP 5858 [TCP segment of a reassembled PDU]
 97   0.018565 172.31.8.238 -> 54.230.117.21 TCP 66 34497 > http [ACK] Seq=97 Ack=517394 Win=908416 Len=0 TSval=17771299 TSecr=1687600353
 98   0.018738 54.230.117.21 -> 172.31.8.238 TCP 21786 [TCP segment of a reassembled PDU]
 99   0.018751 172.31.8.238 -> 54.230.117.21 TCP 66 34497 > http [ACK] Seq=97 Ack=539114 Win=951808 Len=0 TSval=17771299 TSecr=1687600353
100   0.019018 54.230.117.21 -> 172.31.8.238 TCP 26130 [TCP segment of a reassembled PDU]
101   0.019032 172.31.8.238 -> 54.230.117.21 TCP 66 34497 > http [ACK] Seq=97 Ack=565178 Win=1003904 Len=0 TSval=17771299 TSecr=1687600353
102   0.019042 54.230.117.21 -> 172.31.8.238 TCP 8754 [TCP segment of a reassembled PDU]
103   0.019047 172.31.8.238 -> 54.230.117.21 TCP 66 34497 > http [ACK] Seq=97 Ack=573866 Win=1021312 Len=0 TSval=17771299 TSecr=1687600353
104   0.019061 54.230.117.21 -> 172.31.8.238 TCP 14546 [TCP segment of a reassembled PDU]
105   0.019068 172.31.8.238 -> 54.230.117.21 TCP 66 34497 > http [ACK] Seq=97 Ack=588346 Win=1050240 Len=0 TSval=17771299 TSecr=1687600353
106   0.019407 54.230.117.21 -> 172.31.8.238 TCP 15994 [TCP segment of a reassembled PDU]
107   0.019417 172.31.8.238 -> 54.230.117.21 TCP 66 34497 > http [ACK] Seq=97 Ack=604274 Win=1082112 Len=0 TSval=17771299 TSecr=1687600353
108   0.019614 54.230.117.21 -> 172.31.8.238 TCP 5858 [TCP segment of a reassembled PDU]
109   0.019621 172.31.8.238 -> 54.230.117.21 TCP 66 34497 > http [ACK] Seq=97 Ack=610066 Win=1093760 Len=0 TSval=17771299 TSecr=1687600353
110   0.019786 54.230.117.21 -> 172.31.8.238 TCP 17442 [TCP segment of a reassembled PDU]
111   0.019798 172.31.8.238 -> 54.230.117.21 TCP 66 34497 > http [ACK] Seq=97 Ack=627442 Win=1128448 Len=0 TSval=17771299 TSecr=1687600353
112   0.019821 54.230.117.21 -> 172.31.8.238 TCP 8754 [TCP segment of a reassembled PDU]
113   0.019829 172.31.8.238 -> 54.230.117.21 TCP 66 34497 > http [ACK] Seq=97 Ack=636130 Win=1145856 Len=0 TSval=17771299 TSecr=1687600353
114   0.019897 54.230.117.21 -> 172.31.8.238 TCP 10202 [TCP segment of a reassembled PDU]
115   0.019905 172.31.8.238 -> 54.230.117.21 TCP 66 34497 > http [ACK] Seq=97 Ack=646266 Win=1166080 Len=0 TSval=17771299 TSecr=1687600353
116   0.019976 54.230.117.21 -> 172.31.8.238 TCP 23234 [TCP segment of a reassembled PDU]
117   0.019989 172.31.8.238 -> 54.230.117.21 TCP 66 34497 > http [ACK] Seq=97 Ack=669434 Win=1212416 Len=0 TSval=17771299 TSecr=1687600353
118   0.020401 54.230.117.21 -> 172.31.8.238 TCP 10202 [TCP segment of a reassembled PDU]
119   0.020410 172.31.8.238 -> 54.230.117.21 TCP 66 34497 > http [ACK] Seq=97 Ack=679570 Win=1232768 Len=0 TSval=17771299 TSecr=1687600353
120   0.020564 54.230.117.21 -> 172.31.8.238 TCP 26130 [TCP segment of a reassembled PDU]
121   0.020578 172.31.8.238 -> 54.230.117.21 TCP 66 34497 > http [ACK] Seq=97 Ack=705634 Win=1284864 Len=0 TSval=17771299 TSecr=1687600353
122   0.020984 54.230.117.21 -> 172.31.8.238 TCP 29026 [TCP segment of a reassembled PDU]
123   0.021000 172.31.8.238 -> 54.230.117.21 TCP 66 34497 > http [ACK] Seq=97 Ack=734594 Win=1339904 Len=0 TSval=17771300 TSecr=1687600353
124   0.021434 54.230.117.21 -> 172.31.8.238 TCP 39162 [TCP segment of a reassembled PDU]
125   0.021453 172.31.8.238 -> 54.230.117.21 TCP 66 34497 > http [ACK] Seq=97 Ack=773690 Win=1323392 Len=0 TSval=17771300 TSecr=1687600353
126   0.021653 54.230.117.21 -> 172.31.8.238 TCP 4410 [TCP segment of a reassembled PDU]
127   0.021660 172.31.8.238 -> 54.230.117.21 TCP 66 34497 > http [ACK] Seq=97 Ack=778034 Win=1351424 Len=0 TSval=17771300 TSecr=1687600353
128   0.021849 54.230.117.21 -> 172.31.8.238 TCP 18890 [TCP segment of a reassembled PDU]
129   0.021861 172.31.8.238 -> 54.230.117.21 TCP 66 34497 > http [ACK] Seq=97 Ack=796858 Win=1356672 Len=0 TSval=17771300 TSecr=1687600353
130   0.021994 54.230.117.21 -> 172.31.8.238 TCP 2962 [TCP segment of a reassembled PDU]
131   0.021999 172.31.8.238 -> 54.230.117.21 TCP 66 34497 > http [ACK] Seq=97 Ack=799754 Win=1382784 Len=0 TSval=17771300 TSecr=1687600353
132   0.022368 54.230.117.21 -> 172.31.8.238 TCP 26130 [TCP segment of a reassembled PDU]
133   0.022382 172.31.8.238 -> 54.230.117.21 TCP 66 34497 > http [ACK] Seq=97 Ack=825818 Win=1356800 Len=0 TSval=17771300 TSecr=1687600353
134   0.022400 54.230.117.21 -> 172.31.8.238 TCP 26130 [TCP segment of a reassembled PDU]
135   0.022416 172.31.8.238 -> 54.230.117.21 TCP 66 34497 > http [ACK] Seq=97 Ack=851882 Win=1330816 Len=0 TSval=17771300 TSecr=1687600353
136   0.022518 54.230.117.21 -> 172.31.8.238 TCP 13098 [TCP segment of a reassembled PDU]
137   0.022527 172.31.8.238 -> 54.230.117.21 TCP 66 34497 > http [ACK] Seq=97 Ack=864914 Win=1366272 Len=0 TSval=17771300 TSecr=1687600353
138   0.022709 54.230.117.21 -> 172.31.8.238 TCP 7306 [TCP segment of a reassembled PDU]
139   0.022717 172.31.8.238 -> 54.230.117.21 TCP 66 34497 > http [ACK] Seq=97 Ack=872154 Win=1375744 Len=0 TSval=17771300 TSecr=1687600353
140   0.022918 54.230.117.21 -> 172.31.8.238 TCP 30474 [TCP segment of a reassembled PDU]
141   0.022934 172.31.8.238 -> 54.230.117.21 TCP 66 34497 > http [ACK] Seq=97 Ack=902562 Win=1345408 Len=0 TSval=17771300 TSecr=1687600353
142   0.022945 54.230.117.21 -> 172.31.8.238 TCP 10202 [TCP segment of a reassembled PDU]
143   0.022966 172.31.8.238 -> 54.230.117.21 TCP 66 34497 > http [ACK] Seq=97 Ack=912698 Win=1335296 Len=0 TSval=17771300 TSecr=1687600353
144   0.023098 54.230.117.21 -> 172.31.8.238 TCP 17442 [TCP segment of a reassembled PDU]
145   0.023109 172.31.8.238 -> 54.230.117.21 TCP 66 34497 > http [ACK] Seq=97 Ack=930074 Win=1358976 Len=0 TSval=17771300 TSecr=1687600353
146   0.023211 54.230.117.21 -> 172.31.8.238 TCP 13098 [TCP segment of a reassembled PDU]
147   0.023220 172.31.8.238 -> 54.230.117.21 TCP 66 34497 > http [ACK] Seq=97 Ack=943106 Win=1366272 Len=0 TSval=17771300 TSecr=1687600353
148   0.023350 54.230.117.21 -> 172.31.8.238 TCP 21786 [TCP segment of a reassembled PDU]
149   0.023375 54.230.117.21 -> 172.31.8.238 TCP 4410 [TCP segment of a reassembled PDU]
150   0.023387 54.230.117.21 -> 172.31.8.238 TCP 2962 [TCP segment of a reassembled PDU]
151   0.023392 172.31.8.238 -> 54.230.117.21 TCP 66 34497 > http [ACK] Seq=97 Ack=969170 Win=1344640 Len=0 TSval=17771300 TSecr=1687600353
152   0.023407 172.31.8.238 -> 54.230.117.21 TCP 66 34497 > http [ACK] Seq=97 Ack=972066 Win=1386880 Len=0 TSval=17771300 TSecr=1687600353
153   0.023702 54.230.117.21 -> 172.31.8.238 TCP 8754 [TCP segment of a reassembled PDU]
154   0.023723 172.31.8.238 -> 54.230.117.21 TCP 66 34497 > http [ACK] Seq=97 Ack=980754 Win=1386880 Len=0 TSval=17771300 TSecr=1687600353
155   0.023863 54.230.117.21 -> 172.31.8.238 TCP 26130 [TCP segment of a reassembled PDU]
156   0.023890 172.31.8.238 -> 54.230.117.21 TCP 66 34497 > http [ACK] Seq=97 Ack=1006818 Win=1360896 Len=0 TSval=17771300 TSecr=1687600353
157   0.023948 54.230.117.21 -> 172.31.8.238 TCP 20338 [TCP segment of a reassembled PDU]
158   0.023972 172.31.8.238 -> 54.230.117.21 TCP 66 34497 > http [ACK] Seq=97 Ack=1027090 Win=1354240 Len=0 TSval=17771300 TSecr=1687600353
159   0.024022 54.230.117.21 -> 172.31.8.238 HTTP 22010 HTTP/1.1 200 OK  (application/octet-stream)
160   0.024047 172.31.8.238 -> 54.230.117.21 TCP 66 34497 > http [ACK] Seq=97 Ack=1049034 Win=1349504 Len=0 TSval=17771300 TSecr=1687600353
161   0.024186 172.31.8.238 -> 54.230.117.21 TCP 66 34497 > http [FIN, ACK] Seq=97 Ack=1049034 Win=1386880 Len=0 TSval=17771300 TSecr=1687600353
162   0.024874 54.230.117.21 -> 172.31.8.238 TCP 66 http > 34497 [FIN, ACK] Seq=1049034 Ack=98 Win=14592 Len=0 TSval=1687600353 TSecr=17771300
163   0.024883 172.31.8.238 -> 54.230.117.21 TCP 66 34497 > http [ACK] Seq=98 Ack=1049035 Win=1386880 Len=0 TSval=17771300 TSecr=1687600353
164   0.563479 06:b0:37:46:8f:13 -> 06:c7:b5:04:b8:d0 ARP 60 Who has 172.31.8.238?  Tell 172.31.0.1
