[Measurement for 1mb at 14:44:17 20.44.2014] 
Tshark:

  1   0.000000 06:b0:37:46:8f:13 -> 06:c7:b5:04:b8:d0 ARP 60 Who has 172.31.8.238?  Tell 172.31.0.1
  2   0.000021 06:c7:b5:04:b8:d0 -> 06:b0:37:46:8f:13 ARP 42 172.31.8.238 is at 06:c7:b5:04:b8:d0
  3   1.413492 172.31.8.238 -> 172.31.0.2   DNS 89 Standard query 0xaad4  A d2pcb72msibvx3.cloudfront.net
  4   1.413522 172.31.8.238 -> 172.31.0.2   DNS 89 Standard query 0x9d84  AAAA d2pcb72msibvx3.cloudfront.net
  5   1.414270   172.31.0.2 -> 172.31.8.238 DNS 169 Standard query response 0x9d84 
  6   1.414292   172.31.0.2 -> 172.31.8.238 DNS 217 Standard query response 0xaad4  A 54.239.132.196 A 54.192.118.241 A 54.192.118.243 A 54.230.116.73 A 54.230.117.45 A 54.230.117.50 A 54.239.132.41 A 54.239.132.90
  7   1.417399 172.31.8.238 -> 54.239.132.196 TCP 74 35464 > http [SYN] Seq=0 Win=26883 Len=0 MSS=8961 SACK_PERM=1 TSval=19571187 TSecr=0 WS=128
  8   1.417999 54.239.132.196 -> 172.31.8.238 TCP 74 http > 35464 [SYN, ACK] Seq=0 Ack=1 Win=14480 Len=0 MSS=1460 SACK_PERM=1 TSval=1688036605 TSecr=19571187 WS=128
  9   1.418013 172.31.8.238 -> 54.239.132.196 TCP 66 35464 > http [ACK] Seq=1 Ack=1 Win=27008 Len=0 TSval=19571188 TSecr=1688036605
 10   1.418057 172.31.8.238 -> 54.239.132.196 HTTP 162 GET /1mb HTTP/1.1 
 11   1.418743 54.239.132.196 -> 172.31.8.238 TCP 66 http > 35464 [ACK] Seq=1 Ack=97 Win=14592 Len=0 TSval=1688036605 TSecr=19571188
 12   1.420020 54.239.132.196 -> 172.31.8.238 TCP 7306 [TCP segment of a reassembled PDU]
 13   1.420028 172.31.8.238 -> 54.239.132.196 TCP 66 35464 > http [ACK] Seq=97 Ack=7241 Win=41472 Len=0 TSval=19571188 TSecr=1688036606
 14   1.420119 54.239.132.196 -> 172.31.8.238 TCP 5858 [TCP segment of a reassembled PDU]
 15   1.420127 172.31.8.238 -> 54.239.132.196 TCP 66 35464 > http [ACK] Seq=97 Ack=13033 Win=52992 Len=0 TSval=19571188 TSecr=1688036606
 16   1.420511 54.239.132.196 -> 172.31.8.238 TCP 4410 [TCP segment of a reassembled PDU]
 17   1.420517 172.31.8.238 -> 54.239.132.196 TCP 66 35464 > http [ACK] Seq=97 Ack=17377 Win=61696 Len=0 TSval=19571188 TSecr=1688036606
 18   1.420614 54.239.132.196 -> 172.31.8.238 TCP 8754 [TCP segment of a reassembled PDU]
 19   1.420621 172.31.8.238 -> 54.239.132.196 TCP 66 35464 > http [ACK] Seq=97 Ack=26065 Win=79104 Len=0 TSval=19571188 TSecr=1688036606
 20   1.421019 54.239.132.196 -> 172.31.8.238 TCP 4410 [TCP segment of a reassembled PDU]
 21   1.421025 172.31.8.238 -> 54.239.132.196 TCP 66 35464 > http [ACK] Seq=97 Ack=30409 Win=87808 Len=0 TSval=19571188 TSecr=1688036606
 22   1.421135 54.239.132.196 -> 172.31.8.238 TCP 15994 [TCP segment of a reassembled PDU]
 23   1.421146 172.31.8.238 -> 54.239.132.196 TCP 66 35464 > http [ACK] Seq=97 Ack=46337 Win=91648 Len=0 TSval=19571188 TSecr=1688036606
 24   1.421561 54.239.132.196 -> 172.31.8.238 TCP 2962 [TCP segment of a reassembled PDU]
 25   1.421567 172.31.8.238 -> 54.239.132.196 TCP 66 35464 > http [ACK] Seq=97 Ack=49233 Win=109056 Len=0 TSval=19571188 TSecr=1688036606
 26   1.421664 54.239.132.196 -> 172.31.8.238 TCP 2962 [TCP segment of a reassembled PDU]
 27   1.421669 172.31.8.238 -> 54.239.132.196 TCP 66 35464 > http [ACK] Seq=97 Ack=52129 Win=109056 Len=0 TSval=19571189 TSecr=1688036606
 28   1.421722 54.239.132.196 -> 172.31.8.238 TCP 13098 [TCP segment of a reassembled PDU]
 29   1.421731 172.31.8.238 -> 54.239.132.196 TCP 66 35464 > http [ACK] Seq=97 Ack=65161 Win=135168 Len=0 TSval=19571189 TSecr=1688036606
 30   1.422089 54.239.132.196 -> 172.31.8.238 TCP 7306 [TCP segment of a reassembled PDU]
 31   1.422096 172.31.8.238 -> 54.239.132.196 TCP 66 35464 > http [ACK] Seq=97 Ack=72401 Win=149632 Len=0 TSval=19571189 TSecr=1688036606
 32   1.422132 54.239.132.196 -> 172.31.8.238 TCP 1514 [TCP segment of a reassembled PDU]
 33   1.422136 172.31.8.238 -> 54.239.132.196 TCP 66 35464 > http [ACK] Seq=97 Ack=73849 Win=152448 Len=0 TSval=19571189 TSecr=1688036606
 34   1.422384 54.239.132.196 -> 172.31.8.238 TCP 15994 [TCP segment of a reassembled PDU]
 35   1.422394 172.31.8.238 -> 54.239.132.196 TCP 66 35464 > http [ACK] Seq=97 Ack=89777 Win=184320 Len=0 TSval=19571189 TSecr=1688036606
 36   1.422432 54.239.132.196 -> 172.31.8.238 TCP 2962 [TCP segment of a reassembled PDU]
 37   1.422438 172.31.8.238 -> 54.239.132.196 TCP 66 35464 > http [ACK] Seq=97 Ack=92673 Win=190208 Len=0 TSval=19571189 TSecr=1688036606
 38   1.422854 54.239.132.196 -> 172.31.8.238 TCP 5858 [TCP segment of a reassembled PDU]
 39   1.422860 172.31.8.238 -> 54.239.132.196 TCP 66 35464 > http [ACK] Seq=97 Ack=98465 Win=201728 Len=0 TSval=19571189 TSecr=1688036606
 40   1.422978 54.239.132.196 -> 172.31.8.238 TCP 23234 [TCP segment of a reassembled PDU]
 41   1.422991 172.31.8.238 -> 54.239.132.196 TCP 66 35464 > http [ACK] Seq=97 Ack=121633 Win=248064 Len=0 TSval=19571189 TSecr=1688036606
 42   1.423344 54.239.132.196 -> 172.31.8.238 TCP 7306 [TCP segment of a reassembled PDU]
 43   1.423352 172.31.8.238 -> 54.239.132.196 TCP 66 35464 > http [ACK] Seq=97 Ack=128873 Win=262528 Len=0 TSval=19571189 TSecr=1688036606
 44   1.423432 54.239.132.196 -> 172.31.8.238 TCP 1514 [TCP segment of a reassembled PDU]
 45   1.423437 172.31.8.238 -> 54.239.132.196 TCP 66 35464 > http [ACK] Seq=97 Ack=130321 Win=265472 Len=0 TSval=19571189 TSecr=1688036606
 46   1.423704 54.239.132.196 -> 172.31.8.238 TCP 14546 [TCP segment of a reassembled PDU]
 47   1.423715 172.31.8.238 -> 54.239.132.196 TCP 66 35464 > http [ACK] Seq=97 Ack=144801 Win=294400 Len=0 TSval=19571189 TSecr=1688036606
 48   1.423817 54.239.132.196 -> 172.31.8.238 TCP 11650 [TCP segment of a reassembled PDU]
 49   1.423826 172.31.8.238 -> 54.239.132.196 TCP 66 35464 > http [ACK] Seq=97 Ack=156385 Win=317568 Len=0 TSval=19571189 TSecr=1688036606
 50   1.423880 54.239.132.196 -> 172.31.8.238 TCP 10202 [TCP segment of a reassembled PDU]
 51   1.423887 172.31.8.238 -> 54.239.132.196 TCP 66 35464 > http [ACK] Seq=97 Ack=166521 Win=337792 Len=0 TSval=19571189 TSecr=1688036606
 52   1.423938 54.239.132.196 -> 172.31.8.238 TCP 2962 [TCP segment of a reassembled PDU]
 53   1.423943 172.31.8.238 -> 54.239.132.196 TCP 66 35464 > http [ACK] Seq=97 Ack=169417 Win=343680 Len=0 TSval=19571189 TSecr=1688036606
 54   1.424194 54.239.132.196 -> 172.31.8.238 TCP 10202 [TCP segment of a reassembled PDU]
 55   1.424202 172.31.8.238 -> 54.239.132.196 TCP 66 35464 > http [ACK] Seq=97 Ack=179553 Win=363904 Len=0 TSval=19571189 TSecr=1688036606
 56   1.424285 54.239.132.196 -> 172.31.8.238 TCP 2962 [TCP segment of a reassembled PDU]
 57   1.424290 172.31.8.238 -> 54.239.132.196 TCP 66 35464 > http [ACK] Seq=97 Ack=182449 Win=369664 Len=0 TSval=19571189 TSecr=1688036606
 58   1.424522 54.239.132.196 -> 172.31.8.238 TCP 24682 [TCP segment of a reassembled PDU]
 59   1.424536 172.31.8.238 -> 54.239.132.196 TCP 66 35464 > http [ACK] Seq=97 Ack=207065 Win=418944 Len=0 TSval=19571189 TSecr=1688036606
 60   1.424542 54.239.132.196 -> 172.31.8.238 TCP 1514 [TCP segment of a reassembled PDU]
 61   1.424545 172.31.8.238 -> 54.239.132.196 TCP 66 35464 > http [ACK] Seq=97 Ack=208513 Win=421888 Len=0 TSval=19571189 TSecr=1688036606
 62   1.424684 54.239.132.196 -> 172.31.8.238 TCP 2962 [TCP segment of a reassembled PDU]
 63   1.424690 172.31.8.238 -> 54.239.132.196 TCP 66 35464 > http [ACK] Seq=97 Ack=211409 Win=427648 Len=0 TSval=19571189 TSecr=1688036606
 64   1.424816 54.239.132.196 -> 172.31.8.238 TCP 14546 [TCP segment of a reassembled PDU]
 65   1.424825 172.31.8.238 -> 54.239.132.196 TCP 66 35464 > http [ACK] Seq=97 Ack=225889 Win=456576 Len=0 TSval=19571189 TSecr=1688036606
 66   1.425167 54.239.132.196 -> 172.31.8.238 TCP 5858 [TCP segment of a reassembled PDU]
 67   1.425173 172.31.8.238 -> 54.239.132.196 TCP 66 35464 > http [ACK] Seq=97 Ack=231681 Win=468224 Len=0 TSval=19571189 TSecr=1688036606
 68   1.425320 54.239.132.196 -> 172.31.8.238 TCP 21786 [TCP segment of a reassembled PDU]
 69   1.425332 172.31.8.238 -> 54.239.132.196 TCP 66 35464 > http [ACK] Seq=97 Ack=253401 Win=459904 Len=0 TSval=19571189 TSecr=1688036606
 70   1.425556 54.239.132.196 -> 172.31.8.238 TCP 26130 [TCP segment of a reassembled PDU]
 71   1.425571 172.31.8.238 -> 54.239.132.196 TCP 66 35464 > http [ACK] Seq=97 Ack=279465 Win=433920 Len=0 TSval=19571189 TSecr=1688036606
 72   1.425958 54.239.132.196 -> 172.31.8.238 TCP 1514 [TCP segment of a reassembled PDU]
 73   1.425963 172.31.8.238 -> 54.239.132.196 TCP 66 35464 > http [ACK] Seq=97 Ack=280913 Win=471040 Len=0 TSval=19571190 TSecr=1688036606
 74   1.426100 54.239.132.196 -> 172.31.8.238 TCP 17442 [TCP segment of a reassembled PDU]
 75   1.426110 172.31.8.238 -> 54.239.132.196 TCP 66 35464 > http [ACK] Seq=97 Ack=298289 Win=505856 Len=0 TSval=19571190 TSecr=1688036606
 76   1.426325 54.239.132.196 -> 172.31.8.238 TCP 17442 [TCP segment of a reassembled PDU]
 77   1.426336 172.31.8.238 -> 54.239.132.196 TCP 66 35464 > http [ACK] Seq=97 Ack=315665 Win=540544 Len=0 TSval=19571190 TSecr=1688036606
 78   1.426361 54.239.132.196 -> 172.31.8.238 TCP 8754 [TCP segment of a reassembled PDU]
 79   1.426367 172.31.8.238 -> 54.239.132.196 TCP 66 35464 > http [ACK] Seq=97 Ack=324353 Win=557952 Len=0 TSval=19571190 TSecr=1688036606
 80   1.426431 54.239.132.196 -> 172.31.8.238 TCP 13098 [TCP segment of a reassembled PDU]
 81   1.426440 172.31.8.238 -> 54.239.132.196 TCP 66 35464 > http [ACK] Seq=97 Ack=337385 Win=584064 Len=0 TSval=19571190 TSecr=1688036606
 82   1.426760 54.239.132.196 -> 172.31.8.238 TCP 5858 [TCP segment of a reassembled PDU]
 83   1.426767 172.31.8.238 -> 54.239.132.196 TCP 66 35464 > http [ACK] Seq=97 Ack=343177 Win=595584 Len=0 TSval=19571190 TSecr=1688036606
 84   1.426968 54.239.132.196 -> 172.31.8.238 TCP 1514 [TCP segment of a reassembled PDU]
 85   1.426973 172.31.8.238 -> 54.239.132.196 TCP 66 35464 > http [ACK] Seq=97 Ack=344625 Win=598528 Len=0 TSval=19571190 TSecr=1688036606
 86   1.427202 54.239.132.196 -> 172.31.8.238 TCP 26130 [TCP segment of a reassembled PDU]
 87   1.427218 172.31.8.238 -> 54.239.132.196 TCP 66 35464 > http [ACK] Seq=97 Ack=370689 Win=650624 Len=0 TSval=19571190 TSecr=1688036606
 88   1.427274 54.239.132.196 -> 172.31.8.238 TCP 26130 [TCP segment of a reassembled PDU]
 89   1.427301 172.31.8.238 -> 54.239.132.196 TCP 66 35464 > http [ACK] Seq=97 Ack=396753 Win=702720 Len=0 TSval=19571190 TSecr=1688036606
 90   1.427381 54.239.132.196 -> 172.31.8.238 TCP 11650 [TCP segment of a reassembled PDU]
 91   1.427389 172.31.8.238 -> 54.239.132.196 TCP 66 35464 > http [ACK] Seq=97 Ack=408337 Win=725888 Len=0 TSval=19571190 TSecr=1688036606
 92   1.427796 54.239.132.196 -> 172.31.8.238 TCP 4410 [TCP segment of a reassembled PDU]
 93   1.427802 172.31.8.238 -> 54.239.132.196 TCP 66 35464 > http [ACK] Seq=97 Ack=412681 Win=734592 Len=0 TSval=19571190 TSecr=1688036606
 94   1.427958 54.239.132.196 -> 172.31.8.238 TCP 20338 [TCP segment of a reassembled PDU]
 95   1.427970 172.31.8.238 -> 54.239.132.196 TCP 66 35464 > http [ACK] Seq=97 Ack=432953 Win=775168 Len=0 TSval=19571190 TSecr=1688036606
 96   1.427990 54.239.132.196 -> 172.31.8.238 TCP 5858 [TCP segment of a reassembled PDU]
 97   1.427995 172.31.8.238 -> 54.239.132.196 TCP 66 35464 > http [ACK] Seq=97 Ack=438745 Win=786688 Len=0 TSval=19571190 TSecr=1688036606
 98   1.428072 54.239.132.196 -> 172.31.8.238 TCP 21786 [TCP segment of a reassembled PDU]
 99   1.428085 172.31.8.238 -> 54.239.132.196 TCP 66 35464 > http [ACK] Seq=97 Ack=460465 Win=830208 Len=0 TSval=19571190 TSecr=1688036606
100   1.428180 54.239.132.196 -> 172.31.8.238 TCP 11650 [TCP segment of a reassembled PDU]
101   1.428189 172.31.8.238 -> 54.239.132.196 TCP 66 35464 > http [ACK] Seq=97 Ack=472049 Win=853376 Len=0 TSval=19571190 TSecr=1688036606
102   1.428270 54.239.132.196 -> 172.31.8.238 TCP 1514 [TCP segment of a reassembled PDU]
103   1.428275 172.31.8.238 -> 54.239.132.196 TCP 66 35464 > http [ACK] Seq=97 Ack=473497 Win=856192 Len=0 TSval=19571190 TSecr=1688036606
104   1.428471 54.239.132.196 -> 172.31.8.238 TCP 7306 [TCP segment of a reassembled PDU]
105   1.428478 172.31.8.238 -> 54.239.132.196 TCP 66 35464 > http [ACK] Seq=97 Ack=480737 Win=870656 Len=0 TSval=19571190 TSecr=1688036606
106   1.428757 54.239.132.196 -> 172.31.8.238 TCP 26130 [TCP segment of a reassembled PDU]
107   1.428770 172.31.8.238 -> 54.239.132.196 TCP 66 35464 > http [ACK] Seq=97 Ack=506801 Win=922880 Len=0 TSval=19571190 TSecr=1688036606
108   1.428776 54.239.132.196 -> 172.31.8.238 TCP 1514 [TCP segment of a reassembled PDU]
109   1.428778 172.31.8.238 -> 54.239.132.196 TCP 66 35464 > http [ACK] Seq=97 Ack=508249 Win=925696 Len=0 TSval=19571190 TSecr=1688036606
110   1.428979 54.239.132.196 -> 172.31.8.238 TCP 26130 [TCP segment of a reassembled PDU]
111   1.428993 172.31.8.238 -> 54.239.132.196 TCP 66 35464 > http [ACK] Seq=97 Ack=534313 Win=977920 Len=0 TSval=19571190 TSecr=1688036606
112   1.429001 54.239.132.196 -> 172.31.8.238 TCP 4410 [TCP segment of a reassembled PDU]
113   1.429004 172.31.8.238 -> 54.239.132.196 TCP 66 35464 > http [ACK] Seq=97 Ack=538657 Win=986496 Len=0 TSval=19571190 TSecr=1688036606
114   1.429275 54.239.132.196 -> 172.31.8.238 TCP 5858 [TCP segment of a reassembled PDU]
115   1.429282 172.31.8.238 -> 54.239.132.196 TCP 66 35464 > http [ACK] Seq=97 Ack=544449 Win=998144 Len=0 TSval=19571190 TSecr=1688036606
116   1.429437 54.239.132.196 -> 172.31.8.238 TCP 26130 [TCP segment of a reassembled PDU]
117   1.429450 172.31.8.238 -> 54.239.132.196 TCP 66 35464 > http [ACK] Seq=97 Ack=570513 Win=1050240 Len=0 TSval=19571190 TSecr=1688036606
118   1.429496 54.239.132.196 -> 172.31.8.238 TCP 20338 [TCP segment of a reassembled PDU]
119   1.429508 172.31.8.238 -> 54.239.132.196 TCP 66 35464 > http [ACK] Seq=97 Ack=590785 Win=1090816 Len=0 TSval=19571190 TSecr=1688036606
120   1.429660 54.239.132.196 -> 172.31.8.238 TCP 13098 [TCP segment of a reassembled PDU]
121   1.429669 172.31.8.238 -> 54.239.132.196 TCP 66 35464 > http [ACK] Seq=97 Ack=603817 Win=1116928 Len=0 TSval=19571191 TSecr=1688036606
122   1.429780 54.239.132.196 -> 172.31.8.238 TCP 7306 [TCP segment of a reassembled PDU]
123   1.429787 172.31.8.238 -> 54.239.132.196 TCP 66 35464 > http [ACK] Seq=97 Ack=611057 Win=1131392 Len=0 TSval=19571191 TSecr=1688036607
124   1.429926 54.239.132.196 -> 172.31.8.238 TCP 23234 [TCP segment of a reassembled PDU]
125   1.429940 172.31.8.238 -> 54.239.132.196 TCP 66 35464 > http [ACK] Seq=97 Ack=634225 Win=1169280 Len=0 TSval=19571191 TSecr=1688036607
126   1.430259 54.239.132.196 -> 172.31.8.238 TCP 18890 [TCP segment of a reassembled PDU]
127   1.430270 172.31.8.238 -> 54.239.132.196 TCP 66 35464 > http [ACK] Seq=97 Ack=653049 Win=1176448 Len=0 TSval=19571191 TSecr=1688036607
128   1.430289 54.239.132.196 -> 172.31.8.238 TCP 7306 [TCP segment of a reassembled PDU]
129   1.430294 172.31.8.238 -> 54.239.132.196 TCP 66 35464 > http [ACK] Seq=97 Ack=660289 Win=1169280 Len=0 TSval=19571191 TSecr=1688036607
130   1.430352 54.239.132.196 -> 172.31.8.238 TCP 8754 [TCP segment of a reassembled PDU]
131   1.430359 172.31.8.238 -> 54.239.132.196 TCP 66 35464 > http [ACK] Seq=97 Ack=668977 Win=1193088 Len=0 TSval=19571191 TSecr=1688036607
132   1.430567 54.239.132.196 -> 172.31.8.238 TCP 26130 [TCP segment of a reassembled PDU]
133   1.430581 172.31.8.238 -> 54.239.132.196 TCP 66 35464 > http [ACK] Seq=97 Ack=695041 Win=1167104 Len=0 TSval=19571191 TSecr=1688036607
134   1.430607 54.239.132.196 -> 172.31.8.238 TCP 10202 [TCP segment of a reassembled PDU]
135   1.430615 172.31.8.238 -> 54.239.132.196 TCP 66 35464 > http [ACK] Seq=97 Ack=705177 Win=1156992 Len=0 TSval=19571191 TSecr=1688036607
136   1.430663 54.239.132.196 -> 172.31.8.238 TCP 1514 [TCP segment of a reassembled PDU]
137   1.430668 172.31.8.238 -> 54.239.132.196 TCP 66 35464 > http [ACK] Seq=97 Ack=706625 Win=1197952 Len=0 TSval=19571191 TSecr=1688036607
138   1.430996 54.239.132.196 -> 172.31.8.238 TCP 4410 [TCP segment of a reassembled PDU]
139   1.431002 172.31.8.238 -> 54.239.132.196 TCP 66 35464 > http [ACK] Seq=97 Ack=710969 Win=1200256 Len=0 TSval=19571191 TSecr=1688036607
140   1.431100 54.239.132.196 -> 172.31.8.238 TCP 13098 [TCP segment of a reassembled PDU]
141   1.431121 172.31.8.238 -> 54.239.132.196 TCP 66 35464 > http [ACK] Seq=97 Ack=724001 Win=1201536 Len=0 TSval=19571191 TSecr=1688036607
142   1.431238 54.239.132.196 -> 172.31.8.238 TCP 24682 [TCP segment of a reassembled PDU]
143   1.431308 54.239.132.196 -> 172.31.8.238 TCP 18890 [TCP segment of a reassembled PDU]
144   1.431328 54.239.132.196 -> 172.31.8.238 TCP 2962 [TCP segment of a reassembled PDU]
145   1.431390 172.31.8.238 -> 54.239.132.196 TCP 66 35464 > http [ACK] Seq=97 Ack=770337 Win=1155200 Len=0 TSval=19571191 TSecr=1688036607
146   1.431493 54.239.132.196 -> 172.31.8.238 TCP 17442 [TCP segment of a reassembled PDU]
147   1.431504 172.31.8.238 -> 54.239.132.196 TCP 66 35464 > http [ACK] Seq=97 Ack=787713 Win=1178752 Len=0 TSval=19571191 TSecr=1688036607
148   1.431595 54.239.132.196 -> 172.31.8.238 TCP 11650 [TCP segment of a reassembled PDU]
149   1.431604 172.31.8.238 -> 54.239.132.196 TCP 66 35464 > http [ACK] Seq=97 Ack=799297 Win=1188352 Len=0 TSval=19571191 TSecr=1688036607
150   1.432141 54.239.132.196 -> 172.31.8.238 TCP 4410 [TCP segment of a reassembled PDU]
151   1.432147 172.31.8.238 -> 54.239.132.196 TCP 66 35464 > http [ACK] Seq=97 Ack=803641 Win=1200256 Len=0 TSval=19571191 TSecr=1688036607
152   1.432322 54.239.132.196 -> 172.31.8.238 TCP 26130 [TCP segment of a reassembled PDU]
153   1.432347 172.31.8.238 -> 54.239.132.196 TCP 66 35464 > http [ACK] Seq=97 Ack=829705 Win=1174272 Len=0 TSval=19571191 TSecr=1688036607
154   1.432473 54.239.132.196 -> 172.31.8.238 TCP 34818 [TCP segment of a reassembled PDU]
155   1.432493 54.239.132.196 -> 172.31.8.238 TCP 2962 [TCP segment of a reassembled PDU]
156   1.432506 54.239.132.196 -> 172.31.8.238 TCP 23234 [TCP segment of a reassembled PDU]
157   1.432528 172.31.8.238 -> 54.239.132.196 TCP 66 35464 > http [ACK] Seq=97 Ack=890521 Win=1113472 Len=0 TSval=19571191 TSecr=1688036607
158   1.432571 54.239.132.196 -> 172.31.8.238 TCP 21786 [TCP segment of a reassembled PDU]
159   1.432582 172.31.8.238 -> 54.239.132.196 TCP 66 35464 > http [ACK] Seq=97 Ack=912241 Win=1171712 Len=0 TSval=19571191 TSecr=1688036607
160   1.432932 54.239.132.196 -> 172.31.8.238 TCP 2962 [TCP segment of a reassembled PDU]
161   1.432938 172.31.8.238 -> 54.239.132.196 TCP 66 35464 > http [ACK] Seq=97 Ack=915137 Win=1201536 Len=0 TSval=19571191 TSecr=1688036607
162   1.433079 54.239.132.196 -> 172.31.8.238 TCP 14546 [TCP segment of a reassembled PDU]
163   1.433102 172.31.8.238 -> 54.239.132.196 TCP 66 35464 > http [ACK] Seq=97 Ack=929617 Win=1201536 Len=0 TSval=19571191 TSecr=1688036607
164   1.433433 54.239.132.196 -> 172.31.8.238 TCP 23234 [TCP segment of a reassembled PDU]
165   1.433458 54.239.132.196 -> 172.31.8.238 TCP 2962 [TCP segment of a reassembled PDU]
166   1.433465 172.31.8.238 -> 54.239.132.196 TCP 66 35464 > http [ACK] Seq=97 Ack=955681 Win=1175552 Len=0 TSval=19571191 TSecr=1688036607
167   1.433530 54.239.132.196 -> 172.31.8.238 TCP 23234 [TCP segment of a reassembled PDU]
168   1.433555 172.31.8.238 -> 54.239.132.196 TCP 66 35464 > http [ACK] Seq=97 Ack=978849 Win=1169280 Len=0 TSval=19571191 TSecr=1688036607
169   1.433592 54.239.132.196 -> 172.31.8.238 TCP 15994 [TCP segment of a reassembled PDU]
170   1.433600 172.31.8.238 -> 54.239.132.196 TCP 66 35464 > http [ACK] Seq=97 Ack=994777 Win=1181184 Len=0 TSval=19571191 TSecr=1688036607
171   1.433720 54.239.132.196 -> 172.31.8.238 TCP 20338 [TCP segment of a reassembled PDU]
172   1.433758 54.239.132.196 -> 172.31.8.238 TCP 4410 [TCP segment of a reassembled PDU]
173   1.433784 54.239.132.196 -> 172.31.8.238 TCP 15994 [TCP segment of a reassembled PDU]
174   1.433844 172.31.8.238 -> 54.239.132.196 TCP 66 35464 > http [ACK] Seq=97 Ack=1035321 Win=1140736 Len=0 TSval=19571192 TSecr=1688036607
175   1.434110 54.239.132.196 -> 172.31.8.238 TCP 7306 [TCP segment of a reassembled PDU]
176   1.434117 172.31.8.238 -> 54.239.132.196 TCP 66 35464 > http [ACK] Seq=97 Ack=1042561 Win=1195520 Len=0 TSval=19571192 TSecr=1688036607
177   1.434253 54.239.132.196 -> 172.31.8.238 HTTP 6539 HTTP/1.1 200 OK  (application/octet-stream)
178   1.434259 172.31.8.238 -> 54.239.132.196 TCP 66 35464 > http [ACK] Seq=97 Ack=1049034 Win=1195520 Len=0 TSval=19571192 TSecr=1688036607
179   1.434413 172.31.8.238 -> 54.239.132.196 TCP 66 35464 > http [FIN, ACK] Seq=97 Ack=1049034 Win=1201536 Len=0 TSval=19571192 TSecr=1688036607
180   1.434907 54.239.132.196 -> 172.31.8.238 TCP 66 http > 35464 [FIN, ACK] Seq=1049034 Ack=98 Win=14592 Len=0 TSval=1688036607 TSecr=19571192
181   1.434913 172.31.8.238 -> 54.239.132.196 TCP 66 35464 > http [ACK] Seq=98 Ack=1049035 Win=1201536 Len=0 TSval=19571192 TSecr=1688036607
