[Measurement for 10kb at 04:40:43 20.40.2014] 
Tshark:

  1   0.000000 172.31.8.238 -> 172.31.0.2   DNS 89 Standard query 0x90ae  A d3796nkzln59xv.cloudfront.net
  2   0.000088 172.31.8.238 -> 172.31.0.2   DNS 89 Standard query 0xd45b  AAAA d3796nkzln59xv.cloudfront.net
  3   0.000698   172.31.0.2 -> 172.31.8.238 DNS 170 Standard query response 0xd45b 
  4   0.000780   172.31.0.2 -> 172.31.8.238 DNS 217 Standard query response 0x90ae  A 54.230.119.86 A 54.230.119.94 A 54.230.119.189 A 54.239.132.41 A 54.192.118.228 A 54.230.116.73 A 54.230.118.239 A 54.230.119.66
  5   0.003880 172.31.8.238 -> 54.230.119.86 TCP 74 47997 > http [SYN] Seq=0 Win=26883 Len=0 MSS=8961 SACK_PERM=1 TSval=10517898 TSecr=0 WS=128
  6   0.004643 54.230.119.86 -> 172.31.8.238 TCP 74 http > 47997 [SYN, ACK] Seq=0 Ack=1 Win=14480 Len=0 MSS=1460 SACK_PERM=1 TSval=1289783834 TSecr=10517898 WS=128
  7   0.004657 172.31.8.238 -> 54.230.119.86 TCP 66 47997 > http [ACK] Seq=1 Ack=1 Win=27008 Len=0 TSval=10517899 TSecr=1289783834
  8   0.004697 172.31.8.238 -> 54.230.119.86 HTTP 163 GET /10kb HTTP/1.1 
  9   0.005362 54.230.119.86 -> 172.31.8.238 TCP 66 http > 47997 [ACK] Seq=1 Ack=98 Win=14592 Len=0 TSval=1289783834 TSecr=10517899
 10   0.006648 54.230.119.86 -> 172.31.8.238 TCP 2962 [TCP segment of a reassembled PDU]
 11   0.006655 172.31.8.238 -> 54.230.119.86 TCP 66 47997 > http [ACK] Seq=98 Ack=2897 Win=32768 Len=0 TSval=10517899 TSecr=1289783834
 12   0.006751 54.230.119.86 -> 172.31.8.238 HTTP 7865 HTTP/1.1 200 OK  (application/octet-stream)
 13   0.006760 172.31.8.238 -> 54.230.119.86 TCP 66 47997 > http [ACK] Seq=98 Ack=10696 Win=48384 Len=0 TSval=10517899 TSecr=1289783834
 14   0.006881 172.31.8.238 -> 54.230.119.86 TCP 66 47997 > http [FIN, ACK] Seq=98 Ack=10696 Win=48384 Len=0 TSval=10517899 TSecr=1289783834
 15   0.007486 54.230.119.86 -> 172.31.8.238 TCP 66 http > 47997 [FIN, ACK] Seq=10696 Ack=99 Win=14592 Len=0 TSval=1289783834 TSecr=10517899
 16   0.007495 172.31.8.238 -> 54.230.119.86 TCP 66 47997 > http [ACK] Seq=99 Ack=10697 Win=48384 Len=0 TSval=10517899 TSecr=1289783834
