[Measurement for 10kb at 13:40:43 20.40.2014] 
Tshark:

  1   0.000000 172.31.8.238 -> 172.31.0.2   DNS 89 Standard query 0x69d7  A d3796nkzln59xv.cloudfront.net
  2   0.000036 172.31.8.238 -> 172.31.0.2   DNS 89 Standard query 0xef90  AAAA d3796nkzln59xv.cloudfront.net
  3   0.000752   172.31.0.2 -> 172.31.8.238 DNS 217 Standard query response 0x69d7  A 54.230.116.128 A 54.230.116.154 A 54.230.119.58 A 54.230.119.94 A 54.230.119.110 A 54.239.132.249 A 54.192.118.221 A 54.192.118.236
  4   0.000763   172.31.0.2 -> 172.31.8.238 DNS 170 Standard query response 0xef90 
  5   0.003862 172.31.8.238 -> 54.230.116.128 TCP 74 47053 > http [SYN] Seq=0 Win=26883 Len=0 MSS=8961 SACK_PERM=1 TSval=18617924 TSecr=0 WS=128
  6   0.004880 54.230.116.128 -> 172.31.8.238 TCP 74 http > 47053 [SYN, ACK] Seq=0 Ack=1 Win=14480 Len=0 MSS=1460 SACK_PERM=1 TSval=1687475192 TSecr=18617924 WS=128
  7   0.004895 172.31.8.238 -> 54.230.116.128 TCP 66 47053 > http [ACK] Seq=1 Ack=1 Win=27008 Len=0 TSval=18617925 TSecr=1687475192
  8   0.004938 172.31.8.238 -> 54.230.116.128 HTTP 163 GET /10kb HTTP/1.1 
  9   0.005537 54.230.116.128 -> 172.31.8.238 TCP 66 http > 47053 [ACK] Seq=1 Ack=98 Win=14592 Len=0 TSval=1687475192 TSecr=18617925
 10   0.006315 54.230.116.128 -> 172.31.8.238 TCP 2962 [TCP segment of a reassembled PDU]
 11   0.006322 172.31.8.238 -> 54.230.116.128 TCP 66 47053 > http [ACK] Seq=98 Ack=2897 Win=32768 Len=0 TSval=18617925 TSecr=1687475192
 12   0.006418 54.230.116.128 -> 172.31.8.238 HTTP 7865 HTTP/1.1 200 OK  (application/octet-stream)
 13   0.006427 172.31.8.238 -> 54.230.116.128 TCP 66 47053 > http [ACK] Seq=98 Ack=10696 Win=48384 Len=0 TSval=18617925 TSecr=1687475192
 14   0.006545 172.31.8.238 -> 54.230.116.128 TCP 66 47053 > http [FIN, ACK] Seq=98 Ack=10696 Win=48384 Len=0 TSval=18617925 TSecr=1687475192
 15   0.007307 54.230.116.128 -> 172.31.8.238 TCP 66 http > 47053 [FIN, ACK] Seq=10696 Ack=99 Win=14592 Len=0 TSval=1687475192 TSecr=18617925
 16   0.007316 172.31.8.238 -> 54.230.116.128 TCP 66 47053 > http [ACK] Seq=99 Ack=10697 Win=48384 Len=0 TSval=18617925 TSecr=1687475192
