[Measurement for 10kb at 06:05:10 17.05.2014] 
Tshark:

  1   0.000000  192.168.1.2 -> 192.168.1.1  TCP 66 50291→59434 [SYN] Seq=0 Win=8192 Len=0 MSS=1460 WS=256 SACK_PERM=1
  2   0.159124  192.168.1.1 -> 192.168.1.2  TCP 66 59434→50291 [SYN, ACK] Seq=0 Ack=1 Win=5840 Len=0 MSS=1460 SACK_PERM=1 WS=8
  3   0.159223  192.168.1.2 -> 192.168.1.1  TCP 54 50291→59434 [ACK] Seq=1 Ack=1 Win=65536 Len=0
  4   0.159367  192.168.1.2 -> 192.168.1.1  TCP 367 [TCP segment of a reassembled PDU]
  5   0.159484  192.168.1.2 -> 192.168.1.1  HTTP/XML 363 POST /ctl/CmnIfCfg HTTP/1.1 
  6   0.161065  192.168.1.1 -> 192.168.1.2  TCP 54 59434→50291 [ACK] Seq=1 Ack=314 Win=6912 Len=0
  7   0.162193  192.168.1.1 -> 192.168.1.2  TCP 54 59434→50291 [ACK] Seq=1 Ack=623 Win=7984 Len=0
  8   0.171149  192.168.1.1 -> 192.168.1.2  HTTP/XML 587 HTTP/1.1 200 OK 
  9   0.171267  192.168.1.2 -> 192.168.1.1  TCP 54 50291→59434 [FIN, ACK] Seq=623 Ack=534 Win=65024 Len=0
 10   0.171672  192.168.1.1 -> 192.168.1.2  TCP 54 59434→50291 [FIN, ACK] Seq=534 Ack=623 Win=7984 Len=0
 11   0.171718  192.168.1.2 -> 192.168.1.1  TCP 54 50291→59434 [ACK] Seq=624 Ack=535 Win=65024 Len=0
 12   0.172777  192.168.1.2 -> 192.168.1.1  TCP 66 50292→59434 [SYN] Seq=0 Win=8192 Len=0 MSS=1460 WS=256 SACK_PERM=1
 13   0.173726  192.168.1.1 -> 192.168.1.2  TCP 54 59434→50291 [ACK] Seq=535 Ack=624 Win=7984 Len=0
 14   0.174510  192.168.1.1 -> 192.168.1.2  TCP 66 59434→50292 [SYN, ACK] Seq=0 Ack=1 Win=5840 Len=0 MSS=1460 SACK_PERM=1 WS=8
 15   0.174578  192.168.1.2 -> 192.168.1.1  TCP 54 50292→59434 [ACK] Seq=1 Ack=1 Win=65536 Len=0
 16   0.174710  192.168.1.2 -> 192.168.1.1  TCP 371 [TCP segment of a reassembled PDU]
 17   0.174826  192.168.1.2 -> 192.168.1.1  HTTP/XML 367 POST /ctl/CmnIfCfg HTTP/1.1 
 18   0.179324  192.168.1.1 -> 192.168.1.2  TCP 54 59434→50292 [ACK] Seq=1 Ack=318 Win=6912 Len=0
 19   0.180123  192.168.1.1 -> 192.168.1.2  TCP 54 59434→50292 [ACK] Seq=1 Ack=631 Win=7984 Len=0
 20   0.180867  192.168.1.1 -> 192.168.1.2  HTTP/XML 601 HTTP/1.1 200 OK 
 21   0.180900  192.168.1.1 -> 192.168.1.2  TCP 54 59434→50292 [FIN, ACK] Seq=548 Ack=631 Win=7984 Len=0
 22   0.180931  192.168.1.2 -> 192.168.1.1  TCP 54 50292→59434 [ACK] Seq=631 Ack=549 Win=65024 Len=0
 23   0.180976  192.168.1.2 -> 192.168.1.1  TCP 54 50292→59434 [FIN, ACK] Seq=631 Ack=549 Win=65024 Len=0
 24   0.182965  192.168.1.1 -> 192.168.1.2  TCP 54 59434→50292 [ACK] Seq=549 Ack=632 Win=7984 Len=0
 25   0.185559  192.168.1.2 -> 192.168.1.1  TCP 66 50293→59434 [SYN] Seq=0 Win=8192 Len=0 MSS=1460 WS=256 SACK_PERM=1
 26   0.186951  192.168.1.1 -> 192.168.1.2  TCP 66 59434→50293 [SYN, ACK] Seq=0 Ack=1 Win=5840 Len=0 MSS=1460 SACK_PERM=1 WS=8
 27   0.187055  192.168.1.2 -> 192.168.1.1  TCP 54 50293→59434 [ACK] Seq=1 Ack=1 Win=65536 Len=0
 28   0.187150  192.168.1.2 -> 192.168.1.1  TCP 367 [TCP segment of a reassembled PDU]
 29   0.187282  192.168.1.2 -> 192.168.1.1  HTTP/XML 363 POST /ctl/CmnIfCfg HTTP/1.1 
 30   0.193482  192.168.1.1 -> 192.168.1.2  TCP 54 59434→50293 [ACK] Seq=1 Ack=314 Win=6912 Len=0
 31   0.194260  192.168.1.1 -> 192.168.1.2  TCP 54 59434→50293 [ACK] Seq=1 Ack=623 Win=7984 Len=0
 32   0.194805  192.168.1.1 -> 192.168.1.2  HTTP/XML 587 HTTP/1.1 200 OK 
 33   0.194843  192.168.1.1 -> 192.168.1.2  TCP 54 59434→50293 [FIN, ACK] Seq=534 Ack=623 Win=7984 Len=0
 34   0.194878  192.168.1.2 -> 192.168.1.1  TCP 54 50293→59434 [ACK] Seq=623 Ack=535 Win=65024 Len=0
 35   0.194932  192.168.1.2 -> 192.168.1.1  TCP 54 50293→59434 [FIN, ACK] Seq=623 Ack=535 Win=65024 Len=0
 36   0.196399  192.168.1.2 -> 192.168.1.1  TCP 66 50294→59434 [SYN] Seq=0 Win=8192 Len=0 MSS=1460 WS=256 SACK_PERM=1
 37   0.197218  192.168.1.1 -> 192.168.1.2  TCP 54 59434→50293 [ACK] Seq=535 Ack=624 Win=7984 Len=0
 38   0.197867  192.168.1.1 -> 192.168.1.2  TCP 66 59434→50294 [SYN, ACK] Seq=0 Ack=1 Win=5840 Len=0 MSS=1460 SACK_PERM=1 WS=8
 39   0.197941  192.168.1.2 -> 192.168.1.1  TCP 54 50294→59434 [ACK] Seq=1 Ack=1 Win=65536 Len=0
 40   0.198063  192.168.1.2 -> 192.168.1.1  TCP 371 [TCP segment of a reassembled PDU]
 41   0.198190  192.168.1.2 -> 192.168.1.1  HTTP/XML 367 POST /ctl/CmnIfCfg HTTP/1.1 
 42   0.205439  192.168.1.1 -> 192.168.1.2  TCP 54 59434→50294 [ACK] Seq=1 Ack=318 Win=6912 Len=0
 43   0.206225  192.168.1.1 -> 192.168.1.2  TCP 54 59434→50294 [ACK] Seq=1 Ack=631 Win=7984 Len=0
 44   0.206252  192.168.1.1 -> 192.168.1.2  HTTP/XML 601 HTTP/1.1 200 OK 
 45   0.206278  192.168.1.1 -> 192.168.1.2  TCP 54 59434→50294 [FIN, ACK] Seq=548 Ack=631 Win=7984 Len=0
 46   0.206307  192.168.1.2 -> 192.168.1.1  TCP 54 50294→59434 [ACK] Seq=631 Ack=549 Win=65024 Len=0
 47   0.206358  192.168.1.2 -> 192.168.1.1  TCP 54 50294→59434 [FIN, ACK] Seq=631 Ack=549 Win=65024 Len=0
 48   0.209727  192.168.1.1 -> 192.168.1.2  TCP 54 59434→50294 [ACK] Seq=549 Ack=632 Win=7984 Len=0
 49   0.954655  192.168.1.2 -> 54.230.98.71 TCP 66 50295→80 [SYN] Seq=0 Win=8192 Len=0 MSS=1460 WS=256 SACK_PERM=1
 50   1.125499 54.230.98.71 -> 192.168.1.2  TCP 66 80→50295 [SYN, ACK] Seq=0 Ack=1 Win=14600 Len=0 MSS=1400 SACK_PERM=1 WS=128
 51   1.125638  192.168.1.2 -> 54.230.98.71 TCP 54 50295→80 [ACK] Seq=1 Ack=1 Win=65792 Len=0
 52   1.126052  192.168.1.2 -> 54.230.98.71 HTTP 150 GET /10kb HTTP/1.1 
 53   1.155454 54.230.98.71 -> 192.168.1.2  TCP 54 80→50295 [ACK] Seq=1 Ack=97 Win=14720 Len=0
 54   1.159687 54.230.98.71 -> 192.168.1.2  TCP 1454 [TCP segment of a reassembled PDU]
 55   1.163173 54.230.98.71 -> 192.168.1.2  TCP 1454 [TCP segment of a reassembled PDU]
 56   1.163254  192.168.1.2 -> 54.230.98.71 TCP 54 50295→80 [ACK] Seq=97 Ack=2801 Win=65792 Len=0
 57   1.163397 54.230.98.71 -> 192.168.1.2  TCP 1454 [TCP segment of a reassembled PDU]
 58   1.163436 54.230.98.71 -> 192.168.1.2  TCP 1454 [TCP segment of a reassembled PDU]
 59   1.163481  192.168.1.2 -> 54.230.98.71 TCP 54 50295→80 [ACK] Seq=97 Ack=5601 Win=65792 Len=0
 60   1.163565 54.230.98.71 -> 192.168.1.2  TCP 1454 [TCP segment of a reassembled PDU]
 61   1.163601 54.230.98.71 -> 192.168.1.2  TCP 1454 [TCP segment of a reassembled PDU]
 62   1.163646  192.168.1.2 -> 54.230.98.71 TCP 54 50295→80 [ACK] Seq=97 Ack=8401 Win=65792 Len=0
 63   1.163739 54.230.98.71 -> 192.168.1.2  TCP 1454 [TCP segment of a reassembled PDU]
 64   1.165200 54.230.98.71 -> 192.168.1.2  HTTP 949 HTTP/1.1 200 OK  (application/octet-stream)
 65   1.165260  192.168.1.2 -> 54.230.98.71 TCP 54 50295→80 [ACK] Seq=97 Ack=10696 Win=65792 Len=0
 66   1.165459  192.168.1.2 -> 54.230.98.71 TCP 54 50295→80 [FIN, ACK] Seq=97 Ack=10696 Win=65792 Len=0
 67   1.184660  192.168.1.2 -> 192.168.1.1  TCP 66 50296→59434 [SYN] Seq=0 Win=8192 Len=0 MSS=1460 WS=256 SACK_PERM=1
 68   1.371332 54.230.98.71 -> 192.168.1.2  TCP 54 80→50295 [FIN, ACK] Seq=10696 Ack=98 Win=14720 Len=0
 69   1.371449  192.168.1.2 -> 54.230.98.71 TCP 54 50295→80 [ACK] Seq=98 Ack=10697 Win=65792 Len=0
 70   1.374490  192.168.1.1 -> 192.168.1.2  TCP 66 59434→50296 [SYN, ACK] Seq=0 Ack=1 Win=5840 Len=0 MSS=1460 SACK_PERM=1 WS=8
 71   1.374575  192.168.1.2 -> 192.168.1.1  TCP 54 50296→59434 [ACK] Seq=1 Ack=1 Win=65536 Len=0
 72   1.374752  192.168.1.2 -> 192.168.1.1  TCP 367 [TCP segment of a reassembled PDU]
 73   1.374868  192.168.1.2 -> 192.168.1.1  HTTP/XML 363 POST /ctl/CmnIfCfg HTTP/1.1 
 74   1.376463  192.168.1.1 -> 192.168.1.2  TCP 54 59434→50296 [ACK] Seq=1 Ack=314 Win=6912 Len=0
 75   1.377079  192.168.1.1 -> 192.168.1.2  TCP 54 59434→50296 [ACK] Seq=1 Ack=623 Win=7984 Len=0
 76   1.381489  192.168.1.1 -> 192.168.1.2  HTTP/XML 587 HTTP/1.1 200 OK 
 77   1.381607  192.168.1.2 -> 192.168.1.1  TCP 54 50296→59434 [FIN, ACK] Seq=623 Ack=534 Win=65024 Len=0
 78   1.382002  192.168.1.1 -> 192.168.1.2  TCP 54 59434→50296 [FIN, ACK] Seq=534 Ack=623 Win=7984 Len=0
 79   1.382045  192.168.1.2 -> 192.168.1.1  TCP 54 50296→59434 [ACK] Seq=624 Ack=535 Win=65024 Len=0
 80   1.383269  192.168.1.2 -> 192.168.1.1  TCP 66 50297→59434 [SYN] Seq=0 Win=8192 Len=0 MSS=1460 WS=256 SACK_PERM=1
 81   1.388255  192.168.1.1 -> 192.168.1.2  TCP 54 59434→50296 [ACK] Seq=535 Ack=624 Win=7984 Len=0
 82   1.391203  192.168.1.1 -> 192.168.1.2  TCP 66 59434→50297 [SYN, ACK] Seq=0 Ack=1 Win=5840 Len=0 MSS=1460 SACK_PERM=1 WS=8
 83   1.391278  192.168.1.2 -> 192.168.1.1  TCP 54 50297→59434 [ACK] Seq=1 Ack=1 Win=65536 Len=0
 84   1.391405  192.168.1.2 -> 192.168.1.1  TCP 371 [TCP segment of a reassembled PDU]
 85   1.391522  192.168.1.2 -> 192.168.1.1  HTTP/XML 367 POST /ctl/CmnIfCfg HTTP/1.1 
 86   1.393052  192.168.1.1 -> 192.168.1.2  TCP 54 59434→50297 [ACK] Seq=1 Ack=318 Win=6912 Len=0
 87   1.396024  192.168.1.1 -> 192.168.1.2  TCP 54 59434→50297 [ACK] Seq=1 Ack=631 Win=7984 Len=0
 88   1.396721  192.168.1.1 -> 192.168.1.2  HTTP/XML 601 HTTP/1.1 200 OK 
 89   1.396755  192.168.1.1 -> 192.168.1.2  TCP 54 59434→50297 [FIN, ACK] Seq=548 Ack=631 Win=7984 Len=0
 90   1.396786  192.168.1.2 -> 192.168.1.1  TCP 54 50297→59434 [ACK] Seq=631 Ack=549 Win=65024 Len=0
 91   1.396836  192.168.1.2 -> 192.168.1.1  TCP 54 50297→59434 [FIN, ACK] Seq=631 Ack=549 Win=65024 Len=0
 92   1.399596  192.168.1.1 -> 192.168.1.2  TCP 54 59434→50297 [ACK] Seq=549 Ack=632 Win=7984 Len=0
 93   2.401533  192.168.1.2 -> 192.168.1.1  TCP 66 50298→59434 [SYN] Seq=0 Win=8192 Len=0 MSS=1460 WS=256 SACK_PERM=1
