[Measurement for 100kb at 18:35:47 19.35.2014] 
Tshark:

  1   0.000000 172.31.29.138 -> 172.31.0.2   DNS 89 Standard query 0x1cfa  A d3796nkzln59xv.cloudfront.net
  2   0.000039 172.31.29.138 -> 172.31.0.2   DNS 89 Standard query 0xa50e  AAAA d3796nkzln59xv.cloudfront.net
  3   0.000581   172.31.0.2 -> 172.31.29.138 DNS 170 Standard query response 0xa50e 
  4   0.000592   172.31.0.2 -> 172.31.29.138 DNS 217 Standard query response 0x1cfa  A 54.192.156.106 A 54.192.159.72 A 54.230.156.193 A 54.230.157.230 A 54.230.158.223 A 54.230.159.6 A 54.240.168.128 A 54.240.168.150
  5   0.003889 172.31.29.138 -> 54.192.156.106 TCP 74 57155 > http [SYN] Seq=0 Win=26883 Len=0 MSS=8961 SACK_PERM=1 TSval=1505105 TSecr=0 WS=128
  6   0.004574 54.192.156.106 -> 172.31.29.138 TCP 74 http > 57155 [SYN, ACK] Seq=0 Ack=1 Win=14480 Len=0 MSS=1460 SACK_PERM=1 TSval=726880537 TSecr=1505105 WS=128
  7   0.004589 172.31.29.138 -> 54.192.156.106 TCP 66 57155 > http [ACK] Seq=1 Ack=1 Win=27008 Len=0 TSval=1505106 TSecr=726880537
  8   0.004653 172.31.29.138 -> 54.192.156.106 HTTP 164 GET /100kb HTTP/1.1 
  9   0.005324 54.192.156.106 -> 172.31.29.138 TCP 66 http > 57155 [ACK] Seq=1 Ack=99 Win=14592 Len=0 TSval=726880537 TSecr=1505106
 10   0.009574 54.192.156.106 -> 172.31.29.138 TCP 13098 [TCP segment of a reassembled PDU]
 11   0.009586 172.31.29.138 -> 54.192.156.106 TCP 66 57155 > http [ACK] Seq=99 Ack=13033 Win=52992 Len=0 TSval=1505107 TSecr=726880537
 12   0.010248 54.192.156.106 -> 172.31.29.138 TCP 5858 [TCP segment of a reassembled PDU]
 13   0.010255 172.31.29.138 -> 54.192.156.106 TCP 66 57155 > http [ACK] Seq=99 Ack=18825 Win=64640 Len=0 TSval=1505107 TSecr=726880537
 14   0.010293 54.192.156.106 -> 172.31.29.138 TCP 7306 [TCP segment of a reassembled PDU]
 15   0.010300 172.31.29.138 -> 54.192.156.106 TCP 66 57155 > http [ACK] Seq=99 Ack=26065 Win=79104 Len=0 TSval=1505107 TSecr=726880537
 16   0.011046 54.192.156.106 -> 172.31.29.138 TCP 5858 [TCP segment of a reassembled PDU]
 17   0.011053 172.31.29.138 -> 54.192.156.106 TCP 66 57155 > http [ACK] Seq=99 Ack=31857 Win=90624 Len=0 TSval=1505107 TSecr=726880537
 18   0.011113 54.192.156.106 -> 172.31.29.138 TCP 7306 [TCP segment of a reassembled PDU]
 19   0.011120 172.31.29.138 -> 54.192.156.106 TCP 66 57155 > http [ACK] Seq=99 Ack=39097 Win=105088 Len=0 TSval=1505107 TSecr=726880537
 20   0.011818 54.192.156.106 -> 172.31.29.138 TCP 7306 [TCP segment of a reassembled PDU]
 21   0.011824 172.31.29.138 -> 54.192.156.106 TCP 66 57155 > http [ACK] Seq=99 Ack=46337 Win=105984 Len=0 TSval=1505107 TSecr=726880537
 22   0.011860 54.192.156.106 -> 172.31.29.138 TCP 5858 [TCP segment of a reassembled PDU]
 23   0.011866 172.31.29.138 -> 54.192.156.106 TCP 66 57155 > http [ACK] Seq=99 Ack=52129 Win=108416 Len=0 TSval=1505107 TSecr=726880537
 24   0.011915 54.192.156.106 -> 172.31.29.138 TCP 8754 [TCP segment of a reassembled PDU]
 25   0.011922 172.31.29.138 -> 54.192.156.106 TCP 66 57155 > http [ACK] Seq=99 Ack=60817 Win=103680 Len=0 TSval=1505107 TSecr=726880537
 26   0.012564 54.192.156.106 -> 172.31.29.138 TCP 4410 [TCP segment of a reassembled PDU]
 27   0.012570 172.31.29.138 -> 54.192.156.106 TCP 66 57155 > http [ACK] Seq=99 Ack=65161 Win=109056 Len=0 TSval=1505108 TSecr=726880538
 28   0.012695 54.192.156.106 -> 172.31.29.138 TCP 21786 [TCP segment of a reassembled PDU]
 29   0.012707 172.31.29.138 -> 54.192.156.106 TCP 66 57155 > http [ACK] Seq=99 Ack=86881 Win=152448 Len=0 TSval=1505108 TSecr=726880538
 30   0.013368 54.192.156.106 -> 172.31.29.138 TCP 11650 [TCP segment of a reassembled PDU]
 31   0.013376 172.31.29.138 -> 54.192.156.106 TCP 66 57155 > http [ACK] Seq=99 Ack=98465 Win=175616 Len=0 TSval=1505108 TSecr=726880538
 32   0.013405 54.192.156.106 -> 172.31.29.138 TCP 4410 [TCP segment of a reassembled PDU]
 33   0.013411 172.31.29.138 -> 54.192.156.106 TCP 66 57155 > http [ACK] Seq=99 Ack=102809 Win=184320 Len=0 TSval=1505108 TSecr=726880538
 34   0.013435 54.192.156.106 -> 172.31.29.138 HTTP 113 HTTP/1.1 200 OK  (application/octet-stream)
 35   0.013438 172.31.29.138 -> 54.192.156.106 TCP 66 57155 > http [ACK] Seq=99 Ack=102856 Win=184320 Len=0 TSval=1505108 TSecr=726880538
 36   0.013556 172.31.29.138 -> 54.192.156.106 TCP 66 57155 > http [FIN, ACK] Seq=99 Ack=102856 Win=184320 Len=0 TSval=1505108 TSecr=726880538
 37   0.014063 54.192.156.106 -> 172.31.29.138 TCP 66 http > 57155 [FIN, ACK] Seq=102856 Ack=100 Win=14592 Len=0 TSval=726880538 TSecr=1505108
 38   0.014070 172.31.29.138 -> 54.192.156.106 TCP 66 57155 > http [ACK] Seq=100 Ack=102857 Win=184320 Len=0 TSval=1505108 TSecr=726880538
