[Measurement for 100kb at 11:35:48 20.35.2014] 
Tshark:

  1   0.000000 172.31.29.138 -> 172.31.0.2   DNS 89 Standard query 0x823a  A d3796nkzln59xv.cloudfront.net
  2   0.000034 172.31.29.138 -> 172.31.0.2   DNS 89 Standard query 0x7d5b  AAAA d3796nkzln59xv.cloudfront.net
  3   0.000534   172.31.0.2 -> 172.31.29.138 DNS 217 Standard query response 0x823a  A 54.230.150.54 A 54.230.150.65 A 54.230.150.125 A 54.230.151.182 A 54.230.151.226 A 54.230.151.236 A 54.230.150.27 A 54.230.150.30
  4   0.000544   172.31.0.2 -> 172.31.29.138 DNS 170 Standard query response 0x7d5b 
  5   0.003891 172.31.29.138 -> 54.230.150.54 TCP 74 32920 > http [SYN] Seq=0 Win=26883 Len=0 MSS=8961 SACK_PERM=1 TSval=16805234 TSecr=0 WS=128
  6   0.005430 54.230.150.54 -> 172.31.29.138 TCP 74 http > 32920 [SYN, ACK] Seq=0 Ack=1 Win=14480 Len=0 MSS=1460 SACK_PERM=1 TSval=1448480766 TSecr=16805234 WS=128
  7   0.005443 172.31.29.138 -> 54.230.150.54 TCP 66 32920 > http [ACK] Seq=1 Ack=1 Win=27008 Len=0 TSval=16805234 TSecr=1448480766
  8   0.005494 172.31.29.138 -> 54.230.150.54 HTTP 164 GET /100kb HTTP/1.1 
  9   0.006931 54.230.150.54 -> 172.31.29.138 TCP 66 http > 32920 [ACK] Seq=1 Ack=99 Win=14592 Len=0 TSval=1448480766 TSecr=16805234
 10   0.011808 54.230.150.54 -> 172.31.29.138 TCP 2592 [TCP segment of a reassembled PDU]
 11   0.011825 172.31.29.138 -> 54.230.150.54 TCP 66 32920 > http [ACK] Seq=99 Ack=2527 Win=32000 Len=0 TSval=16805236 TSecr=1448480766
 12   0.011852 54.230.150.54 -> 172.31.29.138 TCP 11650 [TCP segment of a reassembled PDU]
 13   0.011860 172.31.29.138 -> 54.230.150.54 TCP 66 32920 > http [ACK] Seq=99 Ack=14111 Win=55168 Len=0 TSval=16805236 TSecr=1448480766
 14   0.013476 54.230.150.54 -> 172.31.29.138 TCP 13098 [TCP segment of a reassembled PDU]
 15   0.013486 172.31.29.138 -> 54.230.150.54 TCP 66 32920 > http [ACK] Seq=99 Ack=27143 Win=81280 Len=0 TSval=16805236 TSecr=1448480767
 16   0.014967 54.230.150.54 -> 172.31.29.138 TCP 13098 [TCP segment of a reassembled PDU]
 17   0.014977 172.31.29.138 -> 54.230.150.54 TCP 66 32920 > http [ACK] Seq=99 Ack=40175 Win=96512 Len=0 TSval=16805237 TSecr=1448480767
 18   0.016523 54.230.150.54 -> 172.31.29.138 TCP 4410 [TCP segment of a reassembled PDU]
 19   0.016531 172.31.29.138 -> 54.230.150.54 TCP 66 32920 > http [ACK] Seq=99 Ack=44519 Win=115968 Len=0 TSval=16805237 TSecr=1448480767
 20   0.016542 54.230.150.54 -> 172.31.29.138 TCP 8754 [TCP segment of a reassembled PDU]
 21   0.016550 172.31.29.138 -> 54.230.150.54 TCP 66 32920 > http [ACK] Seq=99 Ack=53207 Win=133376 Len=0 TSval=16805237 TSecr=1448480767
 22   0.016563 54.230.150.54 -> 172.31.29.138 TCP 7306 [TCP segment of a reassembled PDU]
 23   0.016568 172.31.29.138 -> 54.230.150.54 TCP 66 32920 > http [ACK] Seq=99 Ack=60447 Win=147840 Len=0 TSval=16805237 TSecr=1448480767
 24   0.018033 54.230.150.54 -> 172.31.29.138 TCP 17442 [TCP segment of a reassembled PDU]
 25   0.018044 172.31.29.138 -> 54.230.150.54 TCP 66 32920 > http [ACK] Seq=99 Ack=77823 Win=182528 Len=0 TSval=16805237 TSecr=1448480767
 26   0.018050 54.230.150.54 -> 172.31.29.138 TCP 1514 [TCP segment of a reassembled PDU]
 27   0.018052 172.31.29.138 -> 54.230.150.54 TCP 66 32920 > http [ACK] Seq=99 Ack=79271 Win=185472 Len=0 TSval=16805237 TSecr=1448480767
 28   0.019553 54.230.150.54 -> 172.31.29.138 TCP 4410 [TCP segment of a reassembled PDU]
 29   0.019560 172.31.29.138 -> 54.230.150.54 TCP 66 32920 > http [ACK] Seq=99 Ack=83615 Win=194176 Len=0 TSval=16805238 TSecr=1448480767
 30   0.019661 54.230.150.54 -> 172.31.29.138 TCP 18890 [TCP segment of a reassembled PDU]
 31   0.019672 172.31.29.138 -> 54.230.150.54 TCP 66 32920 > http [ACK] Seq=99 Ack=102439 Win=231808 Len=0 TSval=16805238 TSecr=1448480767
 32   0.019678 54.230.150.54 -> 172.31.29.138 HTTP 484 HTTP/1.1 200 OK  (application/octet-stream)
 33   0.019683 172.31.29.138 -> 54.230.150.54 TCP 66 32920 > http [ACK] Seq=99 Ack=102857 Win=234752 Len=0 TSval=16805238 TSecr=1448480767
 34   0.019819 172.31.29.138 -> 54.230.150.54 TCP 66 32920 > http [FIN, ACK] Seq=99 Ack=102857 Win=234752 Len=0 TSval=16805238 TSecr=1448480767
 35   0.021314 54.230.150.54 -> 172.31.29.138 TCP 66 http > 32920 [FIN, ACK] Seq=102857 Ack=100 Win=14592 Len=0 TSval=1448480767 TSecr=16805238
 36   0.021322 172.31.29.138 -> 54.230.150.54 TCP 66 32920 > http [ACK] Seq=100 Ack=102858 Win=234752 Len=0 TSval=16805238 TSecr=1448480767
