[Measurement for 100kb at 20:36:45 19.36.2014] 
Tshark:

  1   0.000000 172.31.29.138 -> 172.31.0.2   DNS 89 Standard query 0xbb28  A d3796nkzln59xv.cloudfront.net
  2   0.000023 172.31.29.138 -> 172.31.0.2   DNS 89 Standard query 0xe76a  AAAA d3796nkzln59xv.cloudfront.net
  3   0.000537   172.31.0.2 -> 172.31.29.138 DNS 170 Standard query response 0xe76a 
  4   0.000547   172.31.0.2 -> 172.31.29.138 DNS 217 Standard query response 0xbb28  A 54.230.159.4 A 54.230.159.150 A 54.230.159.153 A 54.192.157.146 A 54.192.159.173 A 54.192.159.174 A 54.230.156.193 A 54.230.158.80
  5   0.003853 172.31.29.138 -> 54.230.159.4 TCP 74 46595 > http [SYN] Seq=0 Win=26883 Len=0 MSS=8961 SACK_PERM=1 TSval=3319516 TSecr=0 WS=128
  6   0.004782 54.230.159.4 -> 172.31.29.138 TCP 74 http > 46595 [SYN, ACK] Seq=0 Ack=1 Win=14480 Len=0 MSS=1460 SACK_PERM=1 TSval=727578499 TSecr=3319516 WS=128
  7   0.004796 172.31.29.138 -> 54.230.159.4 TCP 66 46595 > http [ACK] Seq=1 Ack=1 Win=27008 Len=0 TSval=3319516 TSecr=727578499
  8   0.004834 172.31.29.138 -> 54.230.159.4 HTTP 164 GET /100kb HTTP/1.1 
  9   0.005698 54.230.159.4 -> 172.31.29.138 TCP 66 http > 46595 [ACK] Seq=1 Ack=99 Win=14592 Len=0 TSval=727578499 TSecr=3319516
 10   0.008355 54.230.159.4 -> 172.31.29.138 TCP 522 [TCP segment of a reassembled PDU]
 11   0.008363 172.31.29.138 -> 54.230.159.4 TCP 66 46595 > http [ACK] Seq=99 Ack=457 Win=28032 Len=0 TSval=3319517 TSecr=727578499
 12   0.008420 54.230.159.4 -> 172.31.29.138 TCP 13098 [TCP segment of a reassembled PDU]
 13   0.008429 172.31.29.138 -> 54.230.159.4 TCP 66 46595 > http [ACK] Seq=99 Ack=13489 Win=54144 Len=0 TSval=3319517 TSecr=727578499
 14   0.008818 54.230.159.4 -> 172.31.29.138 TCP 5858 [TCP segment of a reassembled PDU]
 15   0.008826 172.31.29.138 -> 54.230.159.4 TCP 66 46595 > http [ACK] Seq=99 Ack=19281 Win=65664 Len=0 TSval=3319517 TSecr=727578499
 16   0.008863 54.230.159.4 -> 172.31.29.138 TCP 7306 [TCP segment of a reassembled PDU]
 17   0.008869 172.31.29.138 -> 54.230.159.4 TCP 66 46595 > http [ACK] Seq=99 Ack=26521 Win=80128 Len=0 TSval=3319517 TSecr=727578499
 18   0.009600 54.230.159.4 -> 172.31.29.138 TCP 7306 [TCP segment of a reassembled PDU]
 19   0.009607 172.31.29.138 -> 54.230.159.4 TCP 66 46595 > http [ACK] Seq=99 Ack=33761 Win=94592 Len=0 TSval=3319517 TSecr=727578499
 20   0.009635 54.230.159.4 -> 172.31.29.138 TCP 13098 [TCP segment of a reassembled PDU]
 21   0.009643 172.31.29.138 -> 54.230.159.4 TCP 66 46595 > http [ACK] Seq=99 Ack=46793 Win=84608 Len=0 TSval=3319517 TSecr=727578499
 22   0.010239 54.230.159.4 -> 172.31.29.138 TCP 5858 [TCP segment of a reassembled PDU]
 23   0.010246 172.31.29.138 -> 54.230.159.4 TCP 66 46595 > http [ACK] Seq=99 Ack=52585 Win=106240 Len=0 TSval=3319517 TSecr=727578499
 24   0.010295 54.230.159.4 -> 172.31.29.138 TCP 13098 [TCP segment of a reassembled PDU]
 25   0.010304 172.31.29.138 -> 54.230.159.4 TCP 66 46595 > http [ACK] Seq=99 Ack=65617 Win=96512 Len=0 TSval=3319517 TSecr=727578499
 26   0.011141 54.230.159.4 -> 172.31.29.138 TCP 13098 [TCP segment of a reassembled PDU]
 27   0.011149 172.31.29.138 -> 54.230.159.4 TCP 66 46595 > http [ACK] Seq=99 Ack=78649 Win=96512 Len=0 TSval=3319517 TSecr=727578499
 28   0.011171 54.230.159.4 -> 172.31.29.138 TCP 13098 [TCP segment of a reassembled PDU]
 29   0.011178 172.31.29.138 -> 54.230.159.4 TCP 66 46595 > http [ACK] Seq=99 Ack=91681 Win=83584 Len=0 TSval=3319517 TSecr=727578499
 30   0.011828 54.230.159.4 -> 172.31.29.138 TCP 2962 [TCP segment of a reassembled PDU]
 31   0.011841 172.31.29.138 -> 54.230.159.4 TCP 66 46595 > http [ACK] Seq=99 Ack=94577 Win=109056 Len=0 TSval=3319518 TSecr=727578499
 32   0.011910 54.230.159.4 -> 172.31.29.138 HTTP 8346 HTTP/1.1 200 OK  (application/octet-stream)
 33   0.011918 172.31.29.138 -> 54.230.159.4 TCP 66 46595 > http [ACK] Seq=99 Ack=102857 Win=125568 Len=0 TSval=3319518 TSecr=727578499
 34   0.012051 172.31.29.138 -> 54.230.159.4 TCP 66 46595 > http [FIN, ACK] Seq=99 Ack=102857 Win=125568 Len=0 TSval=3319518 TSecr=727578499
 35   0.012853 54.230.159.4 -> 172.31.29.138 TCP 66 http > 46595 [FIN, ACK] Seq=102857 Ack=100 Win=14592 Len=0 TSval=727578499 TSecr=3319518
 36   0.012862 172.31.29.138 -> 54.230.159.4 TCP 66 46595 > http [ACK] Seq=100 Ack=102858 Win=125568 Len=0 TSval=3319518 TSecr=727578499
