[Measurement for 100kb at 07:35:48 20.35.2014] 
Tshark:

  1   0.000000 172.31.29.138 -> 172.31.0.2   DNS 89 Standard query 0xd0d3  A d3796nkzln59xv.cloudfront.net
  2   0.000039 172.31.29.138 -> 172.31.0.2   DNS 89 Standard query 0x4b9d  AAAA d3796nkzln59xv.cloudfront.net
  3   0.000646   172.31.0.2 -> 172.31.29.138 DNS 217 Standard query response 0xd0d3  A 54.230.150.54 A 54.230.150.74 A 54.230.151.62 A 54.230.151.214 A 54.230.151.234 A 54.230.149.221 A 54.230.150.16 A 54.230.150.31
  4   0.000657   172.31.0.2 -> 172.31.29.138 DNS 170 Standard query response 0x4b9d 
  5   0.003892 172.31.29.138 -> 54.230.150.54 TCP 74 60973 > http [SYN] Seq=0 Win=26883 Len=0 MSS=8961 SACK_PERM=1 TSval=13205314 TSecr=0 WS=128
  6   0.005251 54.230.150.54 -> 172.31.29.138 TCP 74 http > 60973 [SYN, ACK] Seq=0 Ack=1 Win=14480 Len=0 MSS=1460 SACK_PERM=1 TSval=445180992 TSecr=13205314 WS=128
  7   0.005264 172.31.29.138 -> 54.230.150.54 TCP 66 60973 > http [ACK] Seq=1 Ack=1 Win=27008 Len=0 TSval=13205314 TSecr=445180992
  8   0.005304 172.31.29.138 -> 54.230.150.54 HTTP 164 GET /100kb HTTP/1.1 
  9   0.006778 54.230.150.54 -> 172.31.29.138 TCP 66 http > 60973 [ACK] Seq=1 Ack=99 Win=14592 Len=0 TSval=445180992 TSecr=13205314
 10   0.011961 54.230.150.54 -> 172.31.29.138 TCP 11650 [TCP segment of a reassembled PDU]
 11   0.011973 172.31.29.138 -> 54.230.150.54 TCP 66 60973 > http [ACK] Seq=99 Ack=11585 Win=50176 Len=0 TSval=13205316 TSecr=445180993
 12   0.011981 54.230.150.54 -> 172.31.29.138 TCP 2962 [TCP segment of a reassembled PDU]
 13   0.011985 172.31.29.138 -> 54.230.150.54 TCP 66 60973 > http [ACK] Seq=99 Ack=14481 Win=55936 Len=0 TSval=13205316 TSecr=445180993
 14   0.013453 54.230.150.54 -> 172.31.29.138 TCP 4410 [TCP segment of a reassembled PDU]
 15   0.013460 172.31.29.138 -> 54.230.150.54 TCP 66 60973 > http [ACK] Seq=99 Ack=18825 Win=64640 Len=0 TSval=13205316 TSecr=445180993
 16   0.013514 54.230.150.54 -> 172.31.29.138 TCP 8754 [TCP segment of a reassembled PDU]
 17   0.013525 172.31.29.138 -> 54.230.150.54 TCP 66 60973 > http [ACK] Seq=99 Ack=27513 Win=81920 Len=0 TSval=13205316 TSecr=445180993
 18   0.014759 54.230.150.54 -> 172.31.29.138 TCP 4410 [TCP segment of a reassembled PDU]
 19   0.014765 172.31.29.138 -> 54.230.150.54 TCP 66 60973 > http [ACK] Seq=99 Ack=31857 Win=90624 Len=0 TSval=13205317 TSecr=445180993
 20   0.015040 54.230.150.54 -> 172.31.29.138 TCP 4410 [TCP segment of a reassembled PDU]
 21   0.015045 172.31.29.138 -> 54.230.150.54 TCP 66 60973 > http [ACK] Seq=99 Ack=36201 Win=99328 Len=0 TSval=13205317 TSecr=445180993
 22   0.015068 54.230.150.54 -> 172.31.29.138 TCP 4410 [TCP segment of a reassembled PDU]
 23   0.015073 172.31.29.138 -> 54.230.150.54 TCP 66 60973 > http [ACK] Seq=99 Ack=40545 Win=103680 Len=0 TSval=13205317 TSecr=445180993
 24   0.015142 54.230.150.54 -> 172.31.29.138 TCP 7306 [TCP segment of a reassembled PDU]
 25   0.015149 172.31.29.138 -> 54.230.150.54 TCP 66 60973 > http [ACK] Seq=99 Ack=47785 Win=105984 Len=0 TSval=13205317 TSecr=445180993
 26   0.016136 54.230.150.54 -> 172.31.29.138 TCP 5858 [TCP segment of a reassembled PDU]
 27   0.016142 172.31.29.138 -> 54.230.150.54 TCP 66 60973 > http [ACK] Seq=99 Ack=53577 Win=108416 Len=0 TSval=13205317 TSecr=445180993
 28   0.016486 54.230.150.54 -> 172.31.29.138 TCP 11650 [TCP segment of a reassembled PDU]
 29   0.016494 172.31.29.138 -> 54.230.150.54 TCP 66 60973 > http [ACK] Seq=99 Ack=65161 Win=98944 Len=0 TSval=13205317 TSecr=445180993
 30   0.016607 54.230.150.54 -> 172.31.29.138 TCP 1514 [TCP segment of a reassembled PDU]
 31   0.016611 172.31.29.138 -> 54.230.150.54 TCP 66 60973 > http [ACK] Seq=99 Ack=66609 Win=109056 Len=0 TSval=13205317 TSecr=445180993
 32   0.017600 54.230.150.54 -> 172.31.29.138 TCP 1514 [TCP segment of a reassembled PDU]
 33   0.017604 172.31.29.138 -> 54.230.150.54 TCP 66 60973 > http [ACK] Seq=99 Ack=68057 Win=109056 Len=0 TSval=13205317 TSecr=445180993
 34   0.017690 54.230.150.54 -> 172.31.29.138 TCP 11650 [TCP segment of a reassembled PDU]
 35   0.017698 172.31.29.138 -> 54.230.150.54 TCP 66 60973 > http [ACK] Seq=99 Ack=79641 Win=98944 Len=0 TSval=13205317 TSecr=445180993
 36   0.017861 54.230.150.54 -> 172.31.29.138 TCP 2962 [TCP segment of a reassembled PDU]
 37   0.017867 172.31.29.138 -> 54.230.150.54 TCP 66 60973 > http [ACK] Seq=99 Ack=82537 Win=109056 Len=0 TSval=13205317 TSecr=445180993
 38   0.017972 54.230.150.54 -> 172.31.29.138 TCP 11650 [TCP segment of a reassembled PDU]
 39   0.017981 172.31.29.138 -> 54.230.150.54 TCP 66 60973 > http [ACK] Seq=99 Ack=94121 Win=98944 Len=0 TSval=13205317 TSecr=445180993
 40   0.019225 54.230.150.54 -> 172.31.29.138 HTTP 8802 HTTP/1.1 200 OK  (application/octet-stream)
 41   0.019248 172.31.29.138 -> 54.230.150.54 TCP 66 60973 > http [ACK] Seq=99 Ack=102857 Win=101248 Len=0 TSval=13205318 TSecr=445180994
 42   0.019394 172.31.29.138 -> 54.230.150.54 TCP 66 60973 > http [FIN, ACK] Seq=99 Ack=102857 Win=109056 Len=0 TSval=13205318 TSecr=445180994
 43   0.020670 54.230.150.54 -> 172.31.29.138 TCP 66 http > 60973 [FIN, ACK] Seq=102857 Ack=100 Win=14592 Len=0 TSval=445180994 TSecr=13205318
 44   0.020702 172.31.29.138 -> 54.230.150.54 TCP 66 60973 > http [ACK] Seq=100 Ack=102858 Win=109056 Len=0 TSval=13205318 TSecr=445180994
