[Measurement for 100kb at 02:35:47 20.35.2014] 
Tshark:

  1   0.000000 172.31.29.138 -> 172.31.0.2   DNS 89 Standard query 0xe73e  A d3796nkzln59xv.cloudfront.net
  2   0.000042 172.31.29.138 -> 172.31.0.2   DNS 89 Standard query 0x8785  AAAA d3796nkzln59xv.cloudfront.net
  3   0.000674   172.31.0.2 -> 172.31.29.138 DNS 170 Standard query response 0x8785 
  4   0.000685   172.31.0.2 -> 172.31.29.138 DNS 217 Standard query response 0xe73e  A 54.230.159.153 A 54.192.156.102 A 54.192.159.180 A 54.230.158.152 A 54.230.158.214 A 54.230.159.4 A 54.230.159.132 A 54.230.159.150
  5   0.003847 172.31.29.138 -> 54.230.159.153 TCP 74 58714 > http [SYN] Seq=0 Win=26883 Len=0 MSS=8961 SACK_PERM=1 TSval=8705050 TSecr=0 WS=128
  6   0.004588 54.230.159.153 -> 172.31.29.138 TCP 74 http > 58714 [SYN, ACK] Seq=0 Ack=1 Win=14480 Len=0 MSS=1460 SACK_PERM=1 TSval=729732526 TSecr=8705050 WS=128
  7   0.004602 172.31.29.138 -> 54.230.159.153 TCP 66 58714 > http [ACK] Seq=1 Ack=1 Win=27008 Len=0 TSval=8705050 TSecr=729732526
  8   0.004643 172.31.29.138 -> 54.230.159.153 HTTP 164 GET /100kb HTTP/1.1 
  9   0.005321 54.230.159.153 -> 172.31.29.138 TCP 66 http > 58714 [ACK] Seq=1 Ack=99 Win=14592 Len=0 TSval=729732526 TSecr=8705050
 10   0.007646 54.230.159.153 -> 172.31.29.138 TCP 522 [TCP segment of a reassembled PDU]
 11   0.007654 172.31.29.138 -> 54.230.159.153 TCP 66 58714 > http [ACK] Seq=99 Ack=457 Win=28032 Len=0 TSval=8705051 TSecr=729732526
 12   0.007711 54.230.159.153 -> 172.31.29.138 TCP 13098 [TCP segment of a reassembled PDU]
 13   0.007721 172.31.29.138 -> 54.230.159.153 TCP 66 58714 > http [ACK] Seq=99 Ack=13489 Win=54144 Len=0 TSval=8705051 TSecr=729732526
 14   0.008411 54.230.159.153 -> 172.31.29.138 TCP 5858 [TCP segment of a reassembled PDU]
 15   0.008419 172.31.29.138 -> 54.230.159.153 TCP 66 58714 > http [ACK] Seq=99 Ack=19281 Win=65664 Len=0 TSval=8705051 TSecr=729732526
 16   0.008459 54.230.159.153 -> 172.31.29.138 TCP 7306 [TCP segment of a reassembled PDU]
 17   0.008467 172.31.29.138 -> 54.230.159.153 TCP 66 58714 > http [ACK] Seq=99 Ack=26521 Win=80128 Len=0 TSval=8705051 TSecr=729732526
 18   0.009197 54.230.159.153 -> 172.31.29.138 TCP 4410 [TCP segment of a reassembled PDU]
 19   0.009204 172.31.29.138 -> 54.230.159.153 TCP 66 58714 > http [ACK] Seq=99 Ack=30865 Win=88832 Len=0 TSval=8705051 TSecr=729732526
 20   0.009243 54.230.159.153 -> 172.31.29.138 TCP 8754 [TCP segment of a reassembled PDU]
 21   0.009251 172.31.29.138 -> 54.230.159.153 TCP 66 58714 > http [ACK] Seq=99 Ack=39553 Win=103680 Len=0 TSval=8705051 TSecr=729732526
 22   0.009285 54.230.159.153 -> 172.31.29.138 TCP 7306 [TCP segment of a reassembled PDU]
 23   0.009292 172.31.29.138 -> 54.230.159.153 TCP 66 58714 > http [ACK] Seq=99 Ack=46793 Win=105984 Len=0 TSval=8705051 TSecr=729732526
 24   0.009975 54.230.159.153 -> 172.31.29.138 TCP 2962 [TCP segment of a reassembled PDU]
 25   0.009981 172.31.29.138 -> 54.230.159.153 TCP 66 58714 > http [ACK] Seq=99 Ack=49689 Win=109056 Len=0 TSval=8705051 TSecr=729732526
 26   0.010063 54.230.159.153 -> 172.31.29.138 TCP 15994 [TCP segment of a reassembled PDU]
 27   0.010073 172.31.29.138 -> 54.230.159.153 TCP 66 58714 > http [ACK] Seq=99 Ack=65617 Win=93184 Len=0 TSval=8705051 TSecr=729732526
 28   0.010742 54.230.159.153 -> 172.31.29.138 TCP 7306 [TCP segment of a reassembled PDU]
 29   0.010749 172.31.29.138 -> 54.230.159.153 TCP 66 58714 > http [ACK] Seq=99 Ack=72857 Win=105984 Len=0 TSval=8705052 TSecr=729732526
 30   0.010824 54.230.159.153 -> 172.31.29.138 TCP 11650 [TCP segment of a reassembled PDU]
 31   0.010832 172.31.29.138 -> 54.230.159.153 TCP 66 58714 > http [ACK] Seq=99 Ack=84441 Win=132224 Len=0 TSval=8705052 TSecr=729732526
 32   0.010902 54.230.159.153 -> 172.31.29.138 TCP 8754 [TCP segment of a reassembled PDU]
 33   0.010910 172.31.29.138 -> 54.230.159.153 TCP 66 58714 > http [ACK] Seq=99 Ack=93129 Win=149632 Len=0 TSval=8705052 TSecr=729732526
 34   0.011511 54.230.159.153 -> 172.31.29.138 TCP 7306 [TCP segment of a reassembled PDU]
 35   0.011517 172.31.29.138 -> 54.230.159.153 TCP 66 58714 > http [ACK] Seq=99 Ack=100369 Win=164096 Len=0 TSval=8705052 TSecr=729732526
 36   0.011571 54.230.159.153 -> 172.31.29.138 HTTP 2554 HTTP/1.1 200 OK  (application/octet-stream)
 37   0.011576 172.31.29.138 -> 54.230.159.153 TCP 66 58714 > http [ACK] Seq=99 Ack=102857 Win=169088 Len=0 TSval=8705052 TSecr=729732526
 38   0.011695 172.31.29.138 -> 54.230.159.153 TCP 66 58714 > http [FIN, ACK] Seq=99 Ack=102857 Win=169088 Len=0 TSval=8705052 TSecr=729732526
 39   0.012257 54.230.159.153 -> 172.31.29.138 TCP 66 http > 58714 [FIN, ACK] Seq=102857 Ack=100 Win=14592 Len=0 TSval=729732527 TSecr=8705052
 40   0.012265 172.31.29.138 -> 54.230.159.153 TCP 66 58714 > http [ACK] Seq=100 Ack=102858 Win=169088 Len=0 TSval=8705052 TSecr=729732527
