[Measurement for 100kb at 05:35:48 20.35.2014] 
Tshark:

  1   0.000000 172.31.29.138 -> 172.31.0.2   DNS 89 Standard query 0x5c1e  A d3796nkzln59xv.cloudfront.net
  2   0.000026 172.31.29.138 -> 172.31.0.2   DNS 89 Standard query 0xb837  AAAA d3796nkzln59xv.cloudfront.net
  3   0.000518   172.31.0.2 -> 172.31.29.138 DNS 170 Standard query response 0xb837 
  4   0.000528   172.31.0.2 -> 172.31.29.138 DNS 217 Standard query response 0x5c1e  A 54.230.159.4 A 54.230.159.132 A 54.192.159.168 A 54.192.159.171 A 54.230.158.146 A 54.230.158.152 A 54.230.158.211 A 54.230.158.231
  5   0.003893 172.31.29.138 -> 54.230.159.4 TCP 74 mbus > http [SYN] Seq=0 Win=26883 Len=0 MSS=8961 SACK_PERM=1 TSval=11405350 TSecr=0 WS=128
  6   0.004564 54.230.159.4 -> 172.31.29.138 TCP 74 http > mbus [SYN, ACK] Seq=0 Ack=1 Win=14480 Len=0 MSS=1460 SACK_PERM=1 TSval=833732556 TSecr=11405350 WS=128
  7   0.004578 172.31.29.138 -> 54.230.159.4 TCP 66 mbus > http [ACK] Seq=1 Ack=1 Win=27008 Len=0 TSval=11405350 TSecr=833732556
  8   0.004617 172.31.29.138 -> 54.230.159.4 HTTP 164 GET /100kb HTTP/1.1 
  9   0.005052 54.230.159.4 -> 172.31.29.138 TCP 66 http > mbus [ACK] Seq=1 Ack=99 Win=14592 Len=0 TSval=833732556 TSecr=11405350
 10   0.009738 54.230.159.4 -> 172.31.29.138 TCP 2592 [TCP segment of a reassembled PDU]
 11   0.009746 172.31.29.138 -> 54.230.159.4 TCP 66 mbus > http [ACK] Seq=99 Ack=2527 Win=32000 Len=0 TSval=11405351 TSecr=833732556
 12   0.009826 54.230.159.4 -> 172.31.29.138 TCP 11650 [TCP segment of a reassembled PDU]
 13   0.009836 172.31.29.138 -> 54.230.159.4 TCP 66 mbus > http [ACK] Seq=99 Ack=14111 Win=55168 Len=0 TSval=11405351 TSecr=833732556
 14   0.010491 54.230.159.4 -> 172.31.29.138 TCP 10202 [TCP segment of a reassembled PDU]
 15   0.010498 172.31.29.138 -> 54.230.159.4 TCP 66 mbus > http [ACK] Seq=99 Ack=24247 Win=75392 Len=0 TSval=11405352 TSecr=833732556
 16   0.010505 54.230.159.4 -> 172.31.29.138 TCP 2962 [TCP segment of a reassembled PDU]
 17   0.010509 172.31.29.138 -> 54.230.159.4 TCP 66 mbus > http [ACK] Seq=99 Ack=27143 Win=81280 Len=0 TSval=11405352 TSecr=833732556
 18   0.010961 54.230.159.4 -> 172.31.29.138 TCP 4410 [TCP segment of a reassembled PDU]
 19   0.010967 172.31.29.138 -> 54.230.159.4 TCP 66 mbus > http [ACK] Seq=99 Ack=31487 Win=89856 Len=0 TSval=11405352 TSecr=833732556
 20   0.011015 54.230.159.4 -> 172.31.29.138 TCP 4410 [TCP segment of a reassembled PDU]
 21   0.011021 172.31.29.138 -> 54.230.159.4 TCP 66 mbus > http [ACK] Seq=99 Ack=35831 Win=98560 Len=0 TSval=11405352 TSecr=833732556
 22   0.011218 54.230.159.4 -> 172.31.29.138 TCP 4410 [TCP segment of a reassembled PDU]
 23   0.011224 172.31.29.138 -> 54.230.159.4 TCP 66 mbus > http [ACK] Seq=99 Ack=40175 Win=107264 Len=0 TSval=11405352 TSecr=833732556
 24   0.011299 54.230.159.4 -> 172.31.29.138 TCP 7306 [TCP segment of a reassembled PDU]
 25   0.011319 172.31.29.138 -> 54.230.159.4 TCP 66 mbus > http [ACK] Seq=99 Ack=47415 Win=105984 Len=0 TSval=11405352 TSecr=833732556
 26   0.011491 54.230.159.4 -> 172.31.29.138 TCP 5858 [TCP segment of a reassembled PDU]
 27   0.011497 172.31.29.138 -> 54.230.159.4 TCP 66 mbus > http [ACK] Seq=99 Ack=53207 Win=108416 Len=0 TSval=11405352 TSecr=833732556
 28   0.011730 54.230.159.4 -> 172.31.29.138 TCP 1514 [TCP segment of a reassembled PDU]
 29   0.011734 172.31.29.138 -> 54.230.159.4 TCP 66 mbus > http [ACK] Seq=99 Ack=54655 Win=109056 Len=0 TSval=11405352 TSecr=833732556
 30   0.011826 54.230.159.4 -> 172.31.29.138 TCP 11650 [TCP segment of a reassembled PDU]
 31   0.011847 172.31.29.138 -> 54.230.159.4 TCP 66 mbus > http [ACK] Seq=99 Ack=66239 Win=98944 Len=0 TSval=11405352 TSecr=833732556
 32   0.012063 54.230.159.4 -> 172.31.29.138 TCP 13098 [TCP segment of a reassembled PDU]
 33   0.012072 172.31.29.138 -> 54.230.159.4 TCP 66 mbus > http [ACK] Seq=99 Ack=79271 Win=96512 Len=0 TSval=11405352 TSecr=833732556
 34   0.012508 54.230.159.4 -> 172.31.29.138 TCP 5858 [TCP segment of a reassembled PDU]
 35   0.012514 172.31.29.138 -> 54.230.159.4 TCP 66 mbus > http [ACK] Seq=99 Ack=85063 Win=108416 Len=0 TSval=11405352 TSecr=833732556
 36   0.012626 54.230.159.4 -> 172.31.29.138 HTTP 17860 HTTP/1.1 200 OK  (application/octet-stream)
 37   0.012637 172.31.29.138 -> 54.230.159.4 TCP 66 mbus > http [ACK] Seq=99 Ack=102857 Win=90624 Len=0 TSval=11405352 TSecr=833732556
 38   0.012763 172.31.29.138 -> 54.230.159.4 TCP 66 mbus > http [FIN, ACK] Seq=99 Ack=102857 Win=109056 Len=0 TSval=11405352 TSecr=833732556
 39   0.013237 54.230.159.4 -> 172.31.29.138 TCP 66 http > mbus [FIN, ACK] Seq=102857 Ack=100 Win=14592 Len=0 TSval=833732556 TSecr=11405352
 40   0.013245 172.31.29.138 -> 54.230.159.4 TCP 66 mbus > http [ACK] Seq=100 Ack=102858 Win=109056 Len=0 TSval=11405352 TSecr=833732556
