[Measurement for 100kb at 12:39:13 20.39.2014] 
Tshark:

  1   0.000000 172.31.29.138 -> 172.31.0.2   DNS 89 Standard query 0xd799  A d2pcb72msibvx3.cloudfront.net
  2   0.000036 172.31.29.138 -> 172.31.0.2   DNS 89 Standard query 0xc319  AAAA d2pcb72msibvx3.cloudfront.net
  3   0.000625   172.31.0.2 -> 172.31.29.138 DNS 217 Standard query response 0xd799  A 54.230.158.152 A 54.230.158.242 A 54.192.156.109 A 54.192.157.139 A 54.192.157.156 A 54.192.159.104 A 54.192.159.164 A 54.192.159.180
  4   0.000636   172.31.0.2 -> 172.31.29.138 DNS 169 Standard query response 0xc319 
  5   0.003913 172.31.29.138 -> 54.230.158.152 TCP 74 37671 > http [SYN] Seq=0 Win=26883 Len=0 MSS=8961 SACK_PERM=1 TSval=17756680 TSecr=0 WS=128
  6   0.004498 54.230.158.152 -> 172.31.29.138 TCP 74 http > 37671 [SYN, ACK] Seq=0 Ack=1 Win=14480 Len=0 MSS=1460 SACK_PERM=1 TSval=836232205 TSecr=17756680 WS=128
  7   0.004513 172.31.29.138 -> 54.230.158.152 TCP 66 37671 > http [ACK] Seq=1 Ack=1 Win=27008 Len=0 TSval=17756680 TSecr=836232205
  8   0.004554 172.31.29.138 -> 54.230.158.152 HTTP 164 GET /100kb HTTP/1.1 
  9   0.005237 54.230.158.152 -> 172.31.29.138 TCP 66 http > 37671 [ACK] Seq=1 Ack=99 Win=14592 Len=0 TSval=836232205 TSecr=17756680
 10   0.010683 54.230.158.152 -> 172.31.29.138 TCP 7306 [TCP segment of a reassembled PDU]
 11   0.010695 172.31.29.138 -> 54.230.158.152 TCP 66 37671 > http [ACK] Seq=99 Ack=7241 Win=41472 Len=0 TSval=17756682 TSecr=836232205
 12   0.010721 54.230.158.152 -> 172.31.29.138 TCP 7306 [TCP segment of a reassembled PDU]
 13   0.010728 172.31.29.138 -> 54.230.158.152 TCP 66 37671 > http [ACK] Seq=99 Ack=14481 Win=55936 Len=0 TSval=17756682 TSecr=836232205
 14   0.011443 54.230.158.152 -> 172.31.29.138 TCP 7306 [TCP segment of a reassembled PDU]
 15   0.011452 172.31.29.138 -> 54.230.158.152 TCP 66 37671 > http [ACK] Seq=99 Ack=21721 Win=70400 Len=0 TSval=17756682 TSecr=836232205
 16   0.011478 54.230.158.152 -> 172.31.29.138 TCP 5858 [TCP segment of a reassembled PDU]
 17   0.011484 172.31.29.138 -> 54.230.158.152 TCP 66 37671 > http [ACK] Seq=99 Ack=27513 Win=81920 Len=0 TSval=17756682 TSecr=836232205
 18   0.012194 54.230.158.152 -> 172.31.29.138 TCP 7306 [TCP segment of a reassembled PDU]
 19   0.012202 172.31.29.138 -> 54.230.158.152 TCP 66 37671 > http [ACK] Seq=99 Ack=34753 Win=96512 Len=0 TSval=17756682 TSecr=836232205
 20   0.012244 54.230.158.152 -> 172.31.29.138 TCP 5858 [TCP segment of a reassembled PDU]
 21   0.012251 172.31.29.138 -> 54.230.158.152 TCP 66 37671 > http [ACK] Seq=99 Ack=40545 Win=108032 Len=0 TSval=17756682 TSecr=836232205
 22   0.012301 54.230.158.152 -> 172.31.29.138 TCP 7306 [TCP segment of a reassembled PDU]
 23   0.012308 172.31.29.138 -> 54.230.158.152 TCP 66 37671 > http [ACK] Seq=99 Ack=47785 Win=105984 Len=0 TSval=17756682 TSecr=836232205
 24   0.012960 54.230.158.152 -> 172.31.29.138 TCP 7306 [TCP segment of a reassembled PDU]
 25   0.012969 172.31.29.138 -> 54.230.158.152 TCP 66 37671 > http [ACK] Seq=99 Ack=55025 Win=105984 Len=0 TSval=17756682 TSecr=836232205
 26   0.013015 54.230.158.152 -> 172.31.29.138 TCP 8754 [TCP segment of a reassembled PDU]
 27   0.013025 172.31.29.138 -> 54.230.158.152 TCP 66 37671 > http [ACK] Seq=99 Ack=63713 Win=103680 Len=0 TSval=17756682 TSecr=836232205
 28   0.013211 54.230.158.152 -> 172.31.29.138 TCP 5858 [TCP segment of a reassembled PDU]
 29   0.013218 172.31.29.138 -> 54.230.158.152 TCP 66 37671 > http [ACK] Seq=99 Ack=69505 Win=108416 Len=0 TSval=17756682 TSecr=836232205
 30   0.013261 54.230.158.152 -> 172.31.29.138 TCP 2962 [TCP segment of a reassembled PDU]
 31   0.013266 172.31.29.138 -> 54.230.158.152 TCP 66 37671 > http [ACK] Seq=99 Ack=72401 Win=109056 Len=0 TSval=17756682 TSecr=836232205
 32   0.013709 54.230.158.152 -> 172.31.29.138 TCP 2962 [TCP segment of a reassembled PDU]
 33   0.013714 172.31.29.138 -> 54.230.158.152 TCP 66 37671 > http [ACK] Seq=99 Ack=75297 Win=109056 Len=0 TSval=17756682 TSecr=836232205
 34   0.013812 54.230.158.152 -> 172.31.29.138 TCP 15994 [TCP segment of a reassembled PDU]
 35   0.013822 172.31.29.138 -> 54.230.158.152 TCP 66 37671 > http [ACK] Seq=99 Ack=91225 Win=93184 Len=0 TSval=17756682 TSecr=836232205
 36   0.013981 54.230.158.152 -> 172.31.29.138 TCP 8754 [TCP segment of a reassembled PDU]
 37   0.013989 172.31.29.138 -> 54.230.158.152 TCP 66 37671 > http [ACK] Seq=99 Ack=99913 Win=126464 Len=0 TSval=17756683 TSecr=836232205
 38   0.014020 54.230.158.152 -> 172.31.29.138 TCP 2962 [TCP segment of a reassembled PDU]
 39   0.014025 172.31.29.138 -> 54.230.158.152 TCP 66 37671 > http [ACK] Seq=99 Ack=102809 Win=132224 Len=0 TSval=17756683 TSecr=836232205
 40   0.014439 54.230.158.152 -> 172.31.29.138 HTTP 114 HTTP/1.1 200 OK  (application/octet-stream)
 41   0.014455 172.31.29.138 -> 54.230.158.152 TCP 66 37671 > http [ACK] Seq=99 Ack=102857 Win=132224 Len=0 TSval=17756683 TSecr=836232206
 42   0.014579 172.31.29.138 -> 54.230.158.152 TCP 66 37671 > http [FIN, ACK] Seq=99 Ack=102857 Win=132224 Len=0 TSval=17756683 TSecr=836232206
 43   0.015213 54.230.158.152 -> 172.31.29.138 TCP 66 http > 37671 [FIN, ACK] Seq=102857 Ack=100 Win=14592 Len=0 TSval=836232206 TSecr=17756683
 44   0.015224 172.31.29.138 -> 54.230.158.152 TCP 66 37671 > http [ACK] Seq=100 Ack=102858 Win=132224 Len=0 TSval=17756683 TSecr=836232206
 45   1.189172 06:38:16:87:8c:c2 -> 06:4e:73:56:a6:a6 ARP 60 Who has 172.31.29.138?  Tell 172.31.16.1
