[Measurement for 100kb at 00:39:13 20.39.2014] 
Tshark:

  1   0.000000 172.31.29.138 -> 172.31.0.2   DNS 89 Standard query 0xc92a  A d2pcb72msibvx3.cloudfront.net
  2   0.000039 172.31.29.138 -> 172.31.0.2   DNS 89 Standard query 0x676e  AAAA d2pcb72msibvx3.cloudfront.net
  3   0.000625   172.31.0.2 -> 172.31.29.138 DNS 217 Standard query response 0xc92a  A 54.230.159.150 A 54.192.157.144 A 54.192.157.149 A 54.192.159.162 A 54.192.159.174 A 54.192.159.180 A 54.230.158.211 A 54.230.158.246
  4   0.000636   172.31.0.2 -> 172.31.29.138 DNS 169 Standard query response 0x676e 
  5   0.003802 172.31.29.138 -> 54.230.159.150 TCP 74 50132 > http [SYN] Seq=0 Win=26883 Len=0 MSS=8961 SACK_PERM=1 TSval=6956443 TSecr=0 WS=128
  6   0.004403 54.230.159.150 -> 172.31.29.138 TCP 74 http > 50132 [SYN, ACK] Seq=0 Ack=1 Win=14480 Len=0 MSS=1460 SACK_PERM=1 TSval=808963777 TSecr=6956443 WS=128
  7   0.004417 172.31.29.138 -> 54.230.159.150 TCP 66 50132 > http [ACK] Seq=1 Ack=1 Win=27008 Len=0 TSval=6956443 TSecr=808963777
  8   0.004469 172.31.29.138 -> 54.230.159.150 HTTP 164 GET /100kb HTTP/1.1 
  9   0.005157 54.230.159.150 -> 172.31.29.138 TCP 66 http > 50132 [ACK] Seq=1 Ack=99 Win=14592 Len=0 TSval=808963777 TSecr=6956443
 10   0.007515 54.230.159.150 -> 172.31.29.138 TCP 5858 [TCP segment of a reassembled PDU]
 11   0.007525 172.31.29.138 -> 54.230.159.150 TCP 66 50132 > http [ACK] Seq=99 Ack=5793 Win=38528 Len=0 TSval=6956444 TSecr=808963777
 12   0.007727 54.230.159.150 -> 172.31.29.138 TCP 4410 [TCP segment of a reassembled PDU]
 13   0.007734 172.31.29.138 -> 54.230.159.150 TCP 66 50132 > http [ACK] Seq=99 Ack=10137 Win=47232 Len=0 TSval=6956444 TSecr=808963777
 14   0.007791 54.230.159.150 -> 172.31.29.138 TCP 2962 [TCP segment of a reassembled PDU]
 15   0.007796 172.31.29.138 -> 54.230.159.150 TCP 66 50132 > http [ACK] Seq=99 Ack=13033 Win=52992 Len=0 TSval=6956444 TSecr=808963777
 16   0.008272 54.230.159.150 -> 172.31.29.138 TCP 4410 [TCP segment of a reassembled PDU]
 17   0.008278 172.31.29.138 -> 54.230.159.150 TCP 66 50132 > http [ACK] Seq=99 Ack=17377 Win=61696 Len=0 TSval=6956444 TSecr=808963777
 18   0.008305 54.230.159.150 -> 172.31.29.138 TCP 4410 [TCP segment of a reassembled PDU]
 19   0.008310 172.31.29.138 -> 54.230.159.150 TCP 66 50132 > http [ACK] Seq=99 Ack=21721 Win=70400 Len=0 TSval=6956444 TSecr=808963777
 20   0.008519 54.230.159.150 -> 172.31.29.138 TCP 4410 [TCP segment of a reassembled PDU]
 21   0.008525 172.31.29.138 -> 54.230.159.150 TCP 66 50132 > http [ACK] Seq=99 Ack=26065 Win=79104 Len=0 TSval=6956444 TSecr=808963778
 22   0.009014 54.230.159.150 -> 172.31.29.138 TCP 5858 [TCP segment of a reassembled PDU]
 23   0.009021 172.31.29.138 -> 54.230.159.150 TCP 66 50132 > http [ACK] Seq=99 Ack=31857 Win=90624 Len=0 TSval=6956444 TSecr=808963778
 24   0.009096 54.230.159.150 -> 172.31.29.138 TCP 7306 [TCP segment of a reassembled PDU]
 25   0.009103 172.31.29.138 -> 54.230.159.150 TCP 66 50132 > http [ACK] Seq=99 Ack=39097 Win=105088 Len=0 TSval=6956444 TSecr=808963778
 26   0.009299 54.230.159.150 -> 172.31.29.138 TCP 5858 [TCP segment of a reassembled PDU]
 27   0.009305 172.31.29.138 -> 54.230.159.150 TCP 66 50132 > http [ACK] Seq=99 Ack=44889 Win=108416 Len=0 TSval=6956444 TSecr=808963778
 28   0.009366 54.230.159.150 -> 172.31.29.138 TCP 4410 [TCP segment of a reassembled PDU]
 29   0.009371 172.31.29.138 -> 54.230.159.150 TCP 66 50132 > http [ACK] Seq=99 Ack=49233 Win=109056 Len=0 TSval=6956444 TSecr=808963778
 30   0.009784 54.230.159.150 -> 172.31.29.138 TCP 2962 [TCP segment of a reassembled PDU]
 31   0.009789 172.31.29.138 -> 54.230.159.150 TCP 66 50132 > http [ACK] Seq=99 Ack=52129 Win=109056 Len=0 TSval=6956444 TSecr=808963778
 32   0.009868 54.230.159.150 -> 172.31.29.138 TCP 13098 [TCP segment of a reassembled PDU]
 33   0.009878 172.31.29.138 -> 54.230.159.150 TCP 66 50132 > http [ACK] Seq=99 Ack=65161 Win=96512 Len=0 TSval=6956444 TSecr=808963778
 34   0.010060 54.230.159.150 -> 172.31.29.138 TCP 5858 [TCP segment of a reassembled PDU]
 35   0.010067 172.31.29.138 -> 54.230.159.150 TCP 66 50132 > http [ACK] Seq=99 Ack=70953 Win=108416 Len=0 TSval=6956445 TSecr=808963778
 36   0.010133 54.230.159.150 -> 172.31.29.138 TCP 7306 [TCP segment of a reassembled PDU]
 37   0.010140 172.31.29.138 -> 54.230.159.150 TCP 66 50132 > http [ACK] Seq=99 Ack=78193 Win=123520 Len=0 TSval=6956445 TSecr=808963778
 38   0.010551 54.230.159.150 -> 172.31.29.138 TCP 5858 [TCP segment of a reassembled PDU]
 39   0.010557 172.31.29.138 -> 54.230.159.150 TCP 66 50132 > http [ACK] Seq=99 Ack=83985 Win=135168 Len=0 TSval=6956445 TSecr=808963778
 40   0.010664 54.230.159.150 -> 172.31.29.138 TCP 13098 [TCP segment of a reassembled PDU]
 41   0.010673 172.31.29.138 -> 54.230.159.150 TCP 66 50132 > http [ACK] Seq=99 Ack=97017 Win=161152 Len=0 TSval=6956445 TSecr=808963778
 42   0.010920 54.230.159.150 -> 172.31.29.138 TCP 5858 [TCP segment of a reassembled PDU]
 43   0.010926 172.31.29.138 -> 54.230.159.150 TCP 66 50132 > http [ACK] Seq=99 Ack=102809 Win=172800 Len=0 TSval=6956445 TSecr=808963778
 44   0.010932 54.230.159.150 -> 172.31.29.138 HTTP 114 HTTP/1.1 200 OK  (application/octet-stream)
 45   0.010934 172.31.29.138 -> 54.230.159.150 TCP 66 50132 > http [ACK] Seq=99 Ack=102857 Win=172800 Len=0 TSval=6956445 TSecr=808963778
 46   0.011071 172.31.29.138 -> 54.230.159.150 TCP 66 50132 > http [FIN, ACK] Seq=99 Ack=102857 Win=172800 Len=0 TSval=6956445 TSecr=808963778
 47   0.011526 54.230.159.150 -> 172.31.29.138 TCP 66 http > 50132 [FIN, ACK] Seq=102857 Ack=100 Win=14592 Len=0 TSval=808963778 TSecr=6956445
 48   0.011534 172.31.29.138 -> 54.230.159.150 TCP 66 50132 > http [ACK] Seq=100 Ack=102858 Win=172800 Len=0 TSval=6956445 TSecr=808963778
