[Measurement for 100kb at 11:39:13 20.39.2014] 
Tshark:

  1   0.000000 06:38:16:87:8c:c2 -> 06:4e:73:56:a6:a6 ARP 60 Who has 172.31.29.138?  Tell 172.31.16.1
  2   0.000016 06:4e:73:56:a6:a6 -> 06:38:16:87:8c:c2 ARP 42 172.31.29.138 is at 06:4e:73:56:a6:a6
  3   1.575681 172.31.29.138 -> 172.31.0.2   DNS 89 Standard query 0x1e80  A d2pcb72msibvx3.cloudfront.net
  4   1.575715 172.31.29.138 -> 172.31.0.2   DNS 89 Standard query 0x20e8  AAAA d2pcb72msibvx3.cloudfront.net
  5   1.576443   172.31.0.2 -> 172.31.29.138 DNS 169 Standard query response 0x20e8 
  6   1.576453   172.31.0.2 -> 172.31.29.138 DNS 217 Standard query response 0x1e80  A 54.230.158.190 A 54.192.156.102 A 54.192.157.136 A 54.192.159.73 A 54.192.159.106 A 54.192.159.173 A 54.230.157.230 A 54.230.158.173
  7   1.579578 172.31.29.138 -> 54.230.158.190 TCP 74 46545 > http [SYN] Seq=0 Win=26883 Len=0 MSS=8961 SACK_PERM=1 TSval=16856540 TSecr=0 WS=128
  8   1.580240 54.230.158.190 -> 172.31.29.138 TCP 74 http > 46545 [SYN, ACK] Seq=0 Ack=1 Win=14480 Len=0 MSS=1460 SACK_PERM=1 TSval=812956151 TSecr=16856540 WS=128
  9   1.580254 172.31.29.138 -> 54.230.158.190 TCP 66 46545 > http [ACK] Seq=1 Ack=1 Win=27008 Len=0 TSval=16856540 TSecr=812956151
 10   1.580307 172.31.29.138 -> 54.230.158.190 HTTP 164 GET /100kb HTTP/1.1 
 11   1.580899 54.230.158.190 -> 172.31.29.138 TCP 66 http > 46545 [ACK] Seq=1 Ack=99 Win=14592 Len=0 TSval=812956151 TSecr=16856540
 12   1.584293 54.230.158.190 -> 172.31.29.138 TCP 4410 [TCP segment of a reassembled PDU]
 13   1.584302 172.31.29.138 -> 54.230.158.190 TCP 66 46545 > http [ACK] Seq=99 Ack=4345 Win=35584 Len=0 TSval=16856541 TSecr=812956152
 14   1.584361 54.230.158.190 -> 172.31.29.138 TCP 8754 [TCP segment of a reassembled PDU]
 15   1.584370 172.31.29.138 -> 54.230.158.190 TCP 66 46545 > http [ACK] Seq=99 Ack=13033 Win=52992 Len=0 TSval=16856541 TSecr=812956152
 16   1.585015 54.230.158.190 -> 172.31.29.138 TCP 1514 [TCP segment of a reassembled PDU]
 17   1.585020 172.31.29.138 -> 54.230.158.190 TCP 66 46545 > http [ACK] Seq=99 Ack=14481 Win=55936 Len=0 TSval=16856541 TSecr=812956152
 18   1.585116 54.230.158.190 -> 172.31.29.138 TCP 11650 [TCP segment of a reassembled PDU]
 19   1.585124 172.31.29.138 -> 54.230.158.190 TCP 66 46545 > http [ACK] Seq=99 Ack=26065 Win=79104 Len=0 TSval=16856541 TSecr=812956152
 20   1.585535 54.230.158.190 -> 172.31.29.138 TCP 2962 [TCP segment of a reassembled PDU]
 21   1.585541 172.31.29.138 -> 54.230.158.190 TCP 66 46545 > http [ACK] Seq=99 Ack=28961 Win=84864 Len=0 TSval=16856542 TSecr=812956152
 22   1.585578 54.230.158.190 -> 172.31.29.138 TCP 4410 [TCP segment of a reassembled PDU]
 23   1.585584 172.31.29.138 -> 54.230.158.190 TCP 66 46545 > http [ACK] Seq=99 Ack=33305 Win=93568 Len=0 TSval=16856542 TSecr=812956152
 24   1.585850 54.230.158.190 -> 172.31.29.138 TCP 11650 [TCP segment of a reassembled PDU]
 25   1.585858 172.31.29.138 -> 54.230.158.190 TCP 66 46545 > http [ACK] Seq=99 Ack=44889 Win=98944 Len=0 TSval=16856542 TSecr=812956152
 26   1.585874 54.230.158.190 -> 172.31.29.138 TCP 1514 [TCP segment of a reassembled PDU]
 27   1.585877 172.31.29.138 -> 54.230.158.190 TCP 66 46545 > http [ACK] Seq=99 Ack=46337 Win=97536 Len=0 TSval=16856542 TSecr=812956152
 28   1.586080 54.230.158.190 -> 172.31.29.138 TCP 5858 [TCP segment of a reassembled PDU]
 29   1.586086 172.31.29.138 -> 54.230.158.190 TCP 66 46545 > http [ACK] Seq=99 Ack=52129 Win=108416 Len=0 TSval=16856542 TSecr=812956152
 30   1.586676 54.230.158.190 -> 172.31.29.138 TCP 18890 [TCP segment of a reassembled PDU]
 31   1.586688 172.31.29.138 -> 54.230.158.190 TCP 66 46545 > http [ACK] Seq=99 Ack=70953 Win=89600 Len=0 TSval=16856542 TSecr=812956152
 32   1.586701 54.230.158.190 -> 172.31.29.138 TCP 7306 [TCP segment of a reassembled PDU]
 33   1.586706 172.31.29.138 -> 54.230.158.190 TCP 66 46545 > http [ACK] Seq=99 Ack=78193 Win=82432 Len=0 TSval=16856542 TSecr=812956152
 34   1.587402 54.230.158.190 -> 172.31.29.138 TCP 1514 [TCP segment of a reassembled PDU]
 35   1.587406 172.31.29.138 -> 54.230.158.190 TCP 66 46545 > http [ACK] Seq=99 Ack=79641 Win=109056 Len=0 TSval=16856542 TSecr=812956152
 36   1.587592 54.230.158.190 -> 172.31.29.138 TCP 20338 [TCP segment of a reassembled PDU]
 37   1.587603 172.31.29.138 -> 54.230.158.190 TCP 66 46545 > http [ACK] Seq=99 Ack=99913 Win=88832 Len=0 TSval=16856542 TSecr=812956152
 38   1.587942 54.230.158.190 -> 172.31.29.138 TCP 2962 [TCP segment of a reassembled PDU]
 39   1.587947 172.31.29.138 -> 54.230.158.190 TCP 66 46545 > http [ACK] Seq=99 Ack=102809 Win=109056 Len=0 TSval=16856542 TSecr=812956152
 40   1.587952 54.230.158.190 -> 172.31.29.138 HTTP 114 HTTP/1.1 200 OK  (application/octet-stream)
 41   1.587954 172.31.29.138 -> 54.230.158.190 TCP 66 46545 > http [ACK] Seq=99 Ack=102857 Win=109056 Len=0 TSval=16856542 TSecr=812956152
 42   1.588065 172.31.29.138 -> 54.230.158.190 TCP 66 46545 > http [FIN, ACK] Seq=99 Ack=102857 Win=109056 Len=0 TSval=16856542 TSecr=812956152
 43   1.588644 54.230.158.190 -> 172.31.29.138 TCP 66 http > 46545 [FIN, ACK] Seq=102857 Ack=100 Win=14592 Len=0 TSval=812956152 TSecr=16856542
 44   1.588653 172.31.29.138 -> 54.230.158.190 TCP 66 46545 > http [ACK] Seq=100 Ack=102858 Win=109056 Len=0 TSval=16856542 TSecr=812956152
