[Measurement for 100kb at 21:39:13 19.39.2014] 
Tshark:

  1   0.000000 06:38:16:87:8c:c2 -> 06:4e:73:56:a6:a6 ARP 60 Who has 172.31.29.138?  Tell 172.31.16.1
  2   0.000019 06:4e:73:56:a6:a6 -> 06:38:16:87:8c:c2 ARP 42 172.31.29.138 is at 06:4e:73:56:a6:a6
  3   0.952681 172.31.29.138 -> 172.31.0.2   DNS 89 Standard query 0xfe85  A d2pcb72msibvx3.cloudfront.net
  4   0.952711 172.31.29.138 -> 172.31.0.2   DNS 89 Standard query 0xbc1e  AAAA d2pcb72msibvx3.cloudfront.net
  5   0.953353   172.31.0.2 -> 172.31.29.138 DNS 169 Standard query response 0xbc1e 
  6   0.953363   172.31.0.2 -> 172.31.29.138 DNS 217 Standard query response 0xfe85  A 54.230.150.63 A 54.230.150.65 A 54.230.150.114 A 54.230.151.150 A 54.230.150.10 A 54.230.150.12 A 54.230.150.29 A 54.230.150.34
  7   0.956544 172.31.29.138 -> 54.230.150.63 TCP 74 48942 > http [SYN] Seq=0 Win=26883 Len=0 MSS=8961 SACK_PERM=1 TSval=4256542 TSecr=0 WS=128
  8   0.958166 54.230.150.63 -> 172.31.29.138 TCP 74 http > 48942 [SYN, ACK] Seq=0 Ack=1 Win=14480 Len=0 MSS=1460 SACK_PERM=1 TSval=1451533458 TSecr=4256542 WS=128
  9   0.958180 172.31.29.138 -> 54.230.150.63 TCP 66 48942 > http [ACK] Seq=1 Ack=1 Win=27008 Len=0 TSval=4256543 TSecr=1451533458
 10   0.958225 172.31.29.138 -> 54.230.150.63 HTTP 164 GET /100kb HTTP/1.1 
 11   0.959666 54.230.150.63 -> 172.31.29.138 TCP 66 http > 48942 [ACK] Seq=1 Ack=99 Win=14592 Len=0 TSval=1451533458 TSecr=4256543
 12   0.962033 54.230.150.63 -> 172.31.29.138 TCP 7306 [TCP segment of a reassembled PDU]
 13   0.962043 172.31.29.138 -> 54.230.150.63 TCP 66 48942 > http [ACK] Seq=99 Ack=7241 Win=41472 Len=0 TSval=4256544 TSecr=1451533458
 14   0.962053 54.230.150.63 -> 172.31.29.138 TCP 6936 [TCP segment of a reassembled PDU]
 15   0.962059 172.31.29.138 -> 54.230.150.63 TCP 66 48942 > http [ACK] Seq=99 Ack=14111 Win=55168 Len=0 TSval=4256544 TSecr=1451533458
 16   0.963519 54.230.150.63 -> 172.31.29.138 TCP 7306 [TCP segment of a reassembled PDU]
 17   0.963527 172.31.29.138 -> 54.230.150.63 TCP 66 48942 > http [ACK] Seq=99 Ack=21351 Win=69632 Len=0 TSval=4256544 TSecr=1451533458
 18   0.963580 54.230.150.63 -> 172.31.29.138 TCP 5858 [TCP segment of a reassembled PDU]
 19   0.963587 172.31.29.138 -> 54.230.150.63 TCP 66 48942 > http [ACK] Seq=99 Ack=27143 Win=81280 Len=0 TSval=4256544 TSecr=1451533458
 20   0.965053 54.230.150.63 -> 172.31.29.138 TCP 7306 [TCP segment of a reassembled PDU]
 21   0.965060 172.31.29.138 -> 54.230.150.63 TCP 66 48942 > http [ACK] Seq=99 Ack=34383 Win=95744 Len=0 TSval=4256545 TSecr=1451533458
 22   0.965112 54.230.150.63 -> 172.31.29.138 TCP 5858 [TCP segment of a reassembled PDU]
 23   0.965119 172.31.29.138 -> 54.230.150.63 TCP 66 48942 > http [ACK] Seq=99 Ack=40175 Win=107264 Len=0 TSval=4256545 TSecr=1451533458
 24   0.965161 54.230.150.63 -> 172.31.29.138 TCP 7306 [TCP segment of a reassembled PDU]
 25   0.965168 172.31.29.138 -> 54.230.150.63 TCP 66 48942 > http [ACK] Seq=99 Ack=47415 Win=121728 Len=0 TSval=4256545 TSecr=1451533458
 26   0.966576 54.230.150.63 -> 172.31.29.138 TCP 5858 [TCP segment of a reassembled PDU]
 27   0.966582 172.31.29.138 -> 54.230.150.63 TCP 66 48942 > http [ACK] Seq=99 Ack=53207 Win=133376 Len=0 TSval=4256545 TSecr=1451533459
 28   0.966658 54.230.150.63 -> 172.31.29.138 TCP 13098 [TCP segment of a reassembled PDU]
 29   0.966667 172.31.29.138 -> 54.230.150.63 TCP 66 48942 > http [ACK] Seq=99 Ack=66239 Win=159360 Len=0 TSval=4256545 TSecr=1451533459
 30   0.967859 54.230.150.63 -> 172.31.29.138 TCP 5858 [TCP segment of a reassembled PDU]
 31   0.967866 172.31.29.138 -> 54.230.150.63 TCP 66 48942 > http [ACK] Seq=99 Ack=72031 Win=171008 Len=0 TSval=4256545 TSecr=1451533459
 32   0.967907 54.230.150.63 -> 172.31.29.138 TCP 7306 [TCP segment of a reassembled PDU]
 33   0.967914 172.31.29.138 -> 54.230.150.63 TCP 66 48942 > http [ACK] Seq=99 Ack=79271 Win=185472 Len=0 TSval=4256545 TSecr=1451533459
 34   0.968127 54.230.150.63 -> 172.31.29.138 TCP 5858 [TCP segment of a reassembled PDU]
 35   0.968134 172.31.29.138 -> 54.230.150.63 TCP 66 48942 > http [ACK] Seq=99 Ack=85063 Win=188672 Len=0 TSval=4256545 TSecr=1451533459
 36   0.968207 54.230.150.63 -> 172.31.29.138 TCP 8754 [TCP segment of a reassembled PDU]
 37   0.968213 172.31.29.138 -> 54.230.150.63 TCP 66 48942 > http [ACK] Seq=99 Ack=93751 Win=183936 Len=0 TSval=4256545 TSecr=1451533459
 38   0.969425 54.230.150.63 -> 172.31.29.138 HTTP 9172 HTTP/1.1 200 OK  (application/octet-stream)
 39   0.969433 172.31.29.138 -> 54.230.150.63 TCP 66 48942 > http [ACK] Seq=99 Ack=102857 Win=181632 Len=0 TSval=4256546 TSecr=1451533459
 40   0.969591 172.31.29.138 -> 54.230.150.63 TCP 66 48942 > http [FIN, ACK] Seq=99 Ack=102857 Win=197120 Len=0 TSval=4256546 TSecr=1451533459
 41   0.970920 54.230.150.63 -> 172.31.29.138 TCP 66 http > 48942 [FIN, ACK] Seq=102857 Ack=100 Win=14592 Len=0 TSval=1451533459 TSecr=4256546
 42   0.970931 172.31.29.138 -> 54.230.150.63 TCP 66 48942 > http [ACK] Seq=100 Ack=102858 Win=197120 Len=0 TSval=4256546 TSecr=1451533459
