[Measurement for 10kb at 03:42:41 20.42.2014] 
Tshark:

  1   0.000000 172.31.8.238 -> 172.31.0.2   DNS 88 Standard query 0x1cd7  A dm53kc3eax57k.cloudfront.net
  2   0.000034 172.31.8.238 -> 172.31.0.2   DNS 88 Standard query 0x26ad  AAAA dm53kc3eax57k.cloudfront.net
  3   0.000820   172.31.0.2 -> 172.31.8.238 DNS 175 Standard query response 0x26ad 
  4   0.000831   172.31.0.2 -> 172.31.8.238 DNS 216 Standard query response 0x1cd7  A 54.239.132.74 A 54.192.118.220 A 54.192.118.230 A 54.230.116.72 A 54.230.116.204 A 54.230.117.15 A 54.230.117.154 A 54.230.118.187
  5   0.003917 172.31.8.238 -> 54.239.132.74 TCP 74 60255 > http [SYN] Seq=0 Win=26883 Len=0 MSS=8961 SACK_PERM=1 TSval=9647227 TSecr=0 WS=128
  6   0.004721 54.239.132.74 -> 172.31.8.238 TCP 74 http > 60255 [SYN, ACK] Seq=0 Ack=1 Win=14480 Len=0 MSS=1460 SACK_PERM=1 TSval=1682422275 TSecr=9647227 WS=128
  7   0.004735 172.31.8.238 -> 54.239.132.74 TCP 66 60255 > http [ACK] Seq=1 Ack=1 Win=27008 Len=0 TSval=9647227 TSecr=1682422275
  8   0.004786 172.31.8.238 -> 54.239.132.74 HTTP 162 GET /10kb HTTP/1.1 
  9   0.005526 54.239.132.74 -> 172.31.8.238 TCP 66 http > 60255 [ACK] Seq=1 Ack=97 Win=14592 Len=0 TSval=1682422275 TSecr=9647227
 10   0.007636 54.239.132.74 -> 172.31.8.238 HTTP 10761 HTTP/1.1 200 OK  (application/octet-stream)
 11   0.007648 172.31.8.238 -> 54.239.132.74 TCP 66 60255 > http [ACK] Seq=97 Ack=10696 Win=48384 Len=0 TSval=9647228 TSecr=1682422275
 12   0.007806 172.31.8.238 -> 54.239.132.74 TCP 66 60255 > http [FIN, ACK] Seq=97 Ack=10696 Win=48384 Len=0 TSval=9647228 TSecr=1682422275
 13   0.008247 54.239.132.74 -> 172.31.8.238 TCP 66 http > 60255 [FIN, ACK] Seq=10696 Ack=98 Win=14592 Len=0 TSval=1682422275 TSecr=9647228
 14   0.008255 172.31.8.238 -> 54.239.132.74 TCP 66 60255 > http [ACK] Seq=98 Ack=10697 Win=48384 Len=0 TSval=9647228 TSecr=1682422275
 15   0.999057 06:c7:b5:04:b8:d0 -> 06:b0:37:46:8f:13 ARP 42 Who has 172.31.0.2?  Tell 172.31.8.238
 16   0.999232 06:b0:37:46:8f:13 -> 06:c7:b5:04:b8:d0 ARP 60 172.31.0.2 is at 06:b0:37:46:8f:13
