[Measurement for 10kb at 19:42:42 19.42.2014] 
Tshark:

  1   0.000000 172.31.8.238 -> 172.31.0.2   DNS 88 Standard query 0x39e9  A dm53kc3eax57k.cloudfront.net
  2   0.000022 172.31.8.238 -> 172.31.0.2   DNS 88 Standard query 0x8de4  AAAA dm53kc3eax57k.cloudfront.net
  3   0.000718   172.31.0.2 -> 172.31.8.238 DNS 216 Standard query response 0x39e9  A 54.192.118.228 A 54.230.116.189 A 54.230.117.10 A 54.230.117.69 A 54.230.117.156 A 54.230.118.239 A 54.239.132.173 A 54.192.118.220
  4   0.000731   172.31.0.2 -> 172.31.8.238 DNS 175 Standard query response 0x8de4 
  5   0.003869 172.31.8.238 -> 54.192.118.228 TCP 74 54587 > http [SYN] Seq=0 Win=26883 Len=0 MSS=8961 SACK_PERM=1 TSval=2447482 TSecr=0 WS=128
  6   0.004630 54.192.118.228 -> 172.31.8.238 TCP 74 http > 54587 [SYN, ACK] Seq=0 Ack=1 Win=14480 Len=0 MSS=1460 SACK_PERM=1 TSval=1578749545 TSecr=2447482 WS=128
  7   0.004644 172.31.8.238 -> 54.192.118.228 TCP 66 54587 > http [ACK] Seq=1 Ack=1 Win=27008 Len=0 TSval=2447482 TSecr=1578749545
  8   0.004685 172.31.8.238 -> 54.192.118.228 HTTP 162 GET /10kb HTTP/1.1 
  9   0.005310 54.192.118.228 -> 172.31.8.238 TCP 66 http > 54587 [ACK] Seq=1 Ack=97 Win=14592 Len=0 TSval=1578749545 TSecr=2447482
 10   0.006634 54.192.118.228 -> 172.31.8.238 TCP 4410 [TCP segment of a reassembled PDU]
 11   0.006642 172.31.8.238 -> 54.192.118.228 TCP 66 54587 > http [ACK] Seq=97 Ack=4345 Win=35584 Len=0 TSval=2447482 TSecr=1578749545
 12   0.006708 54.192.118.228 -> 172.31.8.238 HTTP 6416 HTTP/1.1 200 OK  (application/octet-stream)
 13   0.006717 172.31.8.238 -> 54.192.118.228 TCP 66 54587 > http [ACK] Seq=97 Ack=10695 Win=48384 Len=0 TSval=2447482 TSecr=1578749545
 14   0.006835 172.31.8.238 -> 54.192.118.228 TCP 66 54587 > http [FIN, ACK] Seq=97 Ack=10695 Win=48384 Len=0 TSval=2447482 TSecr=1578749545
 15   0.007346 54.192.118.228 -> 172.31.8.238 TCP 66 http > 54587 [FIN, ACK] Seq=10695 Ack=98 Win=14592 Len=0 TSval=1578749545 TSecr=2447482
 16   0.007354 172.31.8.238 -> 54.192.118.228 TCP 66 54587 > http [ACK] Seq=98 Ack=10696 Win=48384 Len=0 TSval=2447482 TSecr=1578749545
