[Measurement for 10kb at 12:42:41 20.42.2014] 
Tshark:

  1   0.000000 172.31.8.238 -> 172.31.0.2   DNS 88 Standard query 0x6eb7  A dm53kc3eax57k.cloudfront.net
  2   0.000026 172.31.8.238 -> 172.31.0.2   DNS 88 Standard query 0xca53  AAAA dm53kc3eax57k.cloudfront.net
  3   0.000800   172.31.0.2 -> 172.31.8.238 DNS 175 Standard query response 0xca53 
  4   0.000810   172.31.0.2 -> 172.31.8.238 DNS 216 Standard query response 0x6eb7  A 54.230.116.154 A 54.230.117.21 A 54.230.117.50 A 54.230.118.187 A 54.230.119.86 A 54.239.132.166 A 54.192.118.228 A 54.192.118.234
  5   0.003928 172.31.8.238 -> 54.230.116.154 TCP 74 46018 > http [SYN] Seq=0 Win=26883 Len=0 MSS=8961 SACK_PERM=1 TSval=17747316 TSecr=0 WS=128
  6   0.004672 54.230.116.154 -> 172.31.8.238 TCP 74 http > 46018 [SYN, ACK] Seq=0 Ack=1 Win=14480 Len=0 MSS=1460 SACK_PERM=1 TSval=1689937359 TSecr=17747316 WS=128
  7   0.004686 172.31.8.238 -> 54.230.116.154 TCP 66 46018 > http [ACK] Seq=1 Ack=1 Win=27008 Len=0 TSval=17747316 TSecr=1689937359
  8   0.004721 172.31.8.238 -> 54.230.116.154 HTTP 162 GET /10kb HTTP/1.1 
  9   0.005349 54.230.116.154 -> 172.31.8.238 TCP 66 http > 46018 [ACK] Seq=1 Ack=97 Win=14592 Len=0 TSval=1689937359 TSecr=17747316
 10   0.007455 54.230.116.154 -> 172.31.8.238 TCP 7306 [TCP segment of a reassembled PDU]
 11   0.007465 172.31.8.238 -> 54.230.116.154 TCP 66 46018 > http [ACK] Seq=97 Ack=7241 Win=41472 Len=0 TSval=17747317 TSecr=1689937359
 12   0.007484 54.230.116.154 -> 172.31.8.238 HTTP 3521 HTTP/1.1 200 OK  (application/octet-stream)
 13   0.007490 172.31.8.238 -> 54.230.116.154 TCP 66 46018 > http [ACK] Seq=97 Ack=10696 Win=48384 Len=0 TSval=17747317 TSecr=1689937359
 14   0.007644 172.31.8.238 -> 54.230.116.154 TCP 66 46018 > http [FIN, ACK] Seq=97 Ack=10696 Win=48384 Len=0 TSval=17747317 TSecr=1689937359
 15   0.008148 54.230.116.154 -> 172.31.8.238 TCP 66 http > 46018 [FIN, ACK] Seq=10696 Ack=98 Win=14592 Len=0 TSval=1689937359 TSecr=17747317
 16   0.008157 172.31.8.238 -> 54.230.116.154 TCP 66 46018 > http [ACK] Seq=98 Ack=10697 Win=48384 Len=0 TSval=17747317 TSecr=1689937359
