[Measurement for 10kb at 17:44:05 19.44.2014] 
Tshark:

  1   0.000000 172.31.8.238 -> 172.31.0.2   DNS 88 Standard query 0x18bf  A dm53kc3eax57k.cloudfront.net
  2   0.000033 172.31.8.238 -> 172.31.0.2   DNS 88 Standard query 0x1e97  AAAA dm53kc3eax57k.cloudfront.net
  3   0.000850   172.31.0.2 -> 172.31.8.238 DNS 216 Standard query response 0x18bf  A 54.230.143.227 A 54.230.143.233 A 54.192.141.30 A 54.192.141.181 A 54.192.141.200 A 54.230.141.54 A 54.230.143.66 A 54.230.143.124
  4   0.000862   172.31.0.2 -> 172.31.8.238 DNS 175 Standard query response 0x1e97 
  5   0.003818 172.31.8.238 -> 54.230.143.227 TCP 74 40187 > http [SYN] Seq=0 Win=26883 Len=0 MSS=8961 SACK_PERM=1 TSval=668236 TSecr=0 WS=128
  6   0.006843 54.230.143.227 -> 172.31.8.238 TCP 74 http > 40187 [SYN, ACK] Seq=0 Ack=1 Win=14480 Len=0 MSS=1460 SACK_PERM=1 TSval=737551939 TSecr=668236 WS=128
  7   0.006857 172.31.8.238 -> 54.230.143.227 TCP 66 40187 > http [ACK] Seq=1 Ack=1 Win=27008 Len=0 TSval=668236 TSecr=737551939
  8   0.006897 172.31.8.238 -> 54.230.143.227 HTTP 162 GET /10kb HTTP/1.1 
  9   0.009731 54.230.143.227 -> 172.31.8.238 TCP 66 http > 40187 [ACK] Seq=1 Ack=97 Win=14592 Len=0 TSval=737551939 TSecr=668236
 10   0.366289 54.230.143.227 -> 172.31.8.238 TCP 6949 [TCP segment of a reassembled PDU]
 11   0.366331 172.31.8.238 -> 54.230.143.227 TCP 66 40187 > http [ACK] Seq=97 Ack=6884 Win=40704 Len=0 TSval=668326 TSecr=737551975
 12   0.366344 54.230.143.227 -> 172.31.8.238 HTTP 3867 HTTP/1.1 200 OK  (application/octet-stream)
 13   0.366354 172.31.8.238 -> 54.230.143.227 TCP 66 40187 > http [ACK] Seq=97 Ack=10685 Win=48256 Len=0 TSval=668326 TSecr=737551975
 14   0.366611 172.31.8.238 -> 54.230.143.227 TCP 66 40187 > http [FIN, ACK] Seq=97 Ack=10685 Win=48256 Len=0 TSval=668326 TSecr=737551975
 15   0.369470 54.230.143.227 -> 172.31.8.238 TCP 66 http > 40187 [FIN, ACK] Seq=10685 Ack=98 Win=14592 Len=0 TSval=737551975 TSecr=668326
 16   0.369479 172.31.8.238 -> 54.230.143.227 TCP 66 40187 > http [ACK] Seq=98 Ack=10686 Win=48256 Len=0 TSval=668327 TSecr=737551975
