[Measurement for 1kb at 21:44:05 19.44.2014] 
Tshark:

  1   0.000000 172.31.8.238 -> 172.31.0.2   DNS 89 Standard query 0xa0e1  A d2pcb72msibvx3.cloudfront.net
  2   0.000027 172.31.8.238 -> 172.31.0.2   DNS 89 Standard query 0xdecf  AAAA d2pcb72msibvx3.cloudfront.net
  3   0.000681   172.31.0.2 -> 172.31.8.238 DNS 217 Standard query response 0xa0e1  A 54.239.132.147 A 54.192.118.235 A 54.192.118.239 A 54.192.118.247 A 54.230.117.10 A 54.230.117.15 A 54.230.118.235 A 54.230.118.248
  4   0.006133   172.31.0.2 -> 172.31.8.238 DNS 169 Standard query response 0xdecf 
  5   0.012026 172.31.8.238 -> 54.239.132.147 TCP 74 59437 > http [SYN] Seq=0 Win=26883 Len=0 MSS=8961 SACK_PERM=1 TSval=4268243 TSecr=0 WS=128
  6   0.012678 54.239.132.147 -> 172.31.8.238 TCP 74 http > 59437 [SYN, ACK] Seq=0 Ack=1 Win=14480 Len=0 MSS=1460 SACK_PERM=1 TSval=1683304760 TSecr=4268243 WS=128
  7   0.012693 172.31.8.238 -> 54.239.132.147 TCP 66 59437 > http [ACK] Seq=1 Ack=1 Win=27008 Len=0 TSval=4268243 TSecr=1683304760
  8   0.012746 172.31.8.238 -> 54.239.132.147 HTTP 162 GET /1kb HTTP/1.1 
  9   0.013407 54.239.132.147 -> 172.31.8.238 TCP 66 http > 59437 [ACK] Seq=1 Ack=97 Win=14592 Len=0 TSval=1683304760 TSecr=4268243
 10   0.014716 54.239.132.147 -> 172.31.8.238 HTTP 1544 HTTP/1.1 200 OK  (application/octet-stream)
 11   0.014724 172.31.8.238 -> 54.239.132.147 TCP 66 59437 > http [ACK] Seq=97 Ack=1479 Win=29952 Len=0 TSval=4268244 TSecr=1683304760
 12   0.014883 172.31.8.238 -> 54.239.132.147 TCP 66 59437 > http [FIN, ACK] Seq=97 Ack=1479 Win=29952 Len=0 TSval=4268244 TSecr=1683304760
 13   0.015448 54.239.132.147 -> 172.31.8.238 TCP 66 http > 59437 [FIN, ACK] Seq=1479 Ack=98 Win=14592 Len=0 TSval=1683304760 TSecr=4268244
 14   0.015455 172.31.8.238 -> 54.239.132.147 TCP 66 59437 > http [ACK] Seq=98 Ack=1480 Win=29952 Len=0 TSval=4268244 TSecr=1683304760
