[Measurement for 1kb at 11:44:04 20.44.2014] 
Tshark:

  1   0.000000 172.31.8.238 -> 172.31.0.2   DNS 89 Standard query 0xc054  A d2pcb72msibvx3.cloudfront.net
  2   0.000027 172.31.8.238 -> 172.31.0.2   DNS 89 Standard query 0x438e  AAAA d2pcb72msibvx3.cloudfront.net
  3   0.000775   172.31.0.2 -> 172.31.8.238 DNS 217 Standard query response 0xc054  A 54.192.118.233 A 54.192.118.238 A 54.230.117.42 A 54.230.118.114 A 54.230.118.248 A 54.230.119.3 A 54.239.132.55 A 54.239.132.173
  4   0.003605   172.31.0.2 -> 172.31.8.238 DNS 169 Standard query response 0x438e 
  5   0.003810 172.31.8.238 -> 54.192.118.233 TCP 74 36316 > http [SYN] Seq=0 Win=26883 Len=0 MSS=8961 SACK_PERM=1 TSval=16868088 TSecr=0 WS=128
  6   0.004428 54.192.118.233 -> 172.31.8.238 TCP 74 http > 36316 [SYN, ACK] Seq=0 Ack=1 Win=14480 Len=0 MSS=1460 SACK_PERM=1 TSval=1584519656 TSecr=16868088 WS=128
  7   0.004444 172.31.8.238 -> 54.192.118.233 TCP 66 36316 > http [ACK] Seq=1 Ack=1 Win=27008 Len=0 TSval=16868089 TSecr=1584519656
  8   0.004485 172.31.8.238 -> 54.192.118.233 HTTP 162 GET /1kb HTTP/1.1 
  9   0.005184 54.192.118.233 -> 172.31.8.238 TCP 66 http > 36316 [ACK] Seq=1 Ack=97 Win=14592 Len=0 TSval=1584519656 TSecr=16868089
 10   0.007272 54.192.118.233 -> 172.31.8.238 HTTP 1544 HTTP/1.1 200 OK  (application/octet-stream)
 11   0.007278 172.31.8.238 -> 54.192.118.233 TCP 66 36316 > http [ACK] Seq=97 Ack=1479 Win=29952 Len=0 TSval=16868089 TSecr=1584519656
 12   0.007428 172.31.8.238 -> 54.192.118.233 TCP 66 36316 > http [FIN, ACK] Seq=97 Ack=1479 Win=29952 Len=0 TSval=16868089 TSecr=1584519656
 13   0.007785 54.192.118.233 -> 172.31.8.238 TCP 66 http > 36316 [FIN, ACK] Seq=1479 Ack=98 Win=14592 Len=0 TSval=1584519657 TSecr=16868089
 14   0.007791 172.31.8.238 -> 54.192.118.233 TCP 66 36316 > http [ACK] Seq=98 Ack=1480 Win=29952 Len=0 TSval=16868089 TSecr=1584519657
