[Measurement for 1kb at 14:44:04 20.44.2014] 
Tshark:

  1   0.000000 172.31.8.238 -> 172.31.0.2   DNS 89 Standard query 0xa95b  A d2pcb72msibvx3.cloudfront.net
  2   0.000028 172.31.8.238 -> 172.31.0.2   DNS 89 Standard query 0xb595  AAAA d2pcb72msibvx3.cloudfront.net
  3   0.000852   172.31.0.2 -> 172.31.8.238 DNS 217 Standard query response 0xa95b  A 54.230.116.73 A 54.230.117.45 A 54.230.117.50 A 54.239.132.41 A 54.239.132.90 A 54.239.132.196 A 54.192.118.241 A 54.192.118.243
  4   0.006108   172.31.0.2 -> 172.31.8.238 DNS 169 Standard query response 0xb595 
  5   0.006556 172.31.8.238 -> 54.230.116.73 TCP 74 34873 > http [SYN] Seq=0 Win=26883 Len=0 MSS=8961 SACK_PERM=1 TSval=19568175 TSecr=0 WS=128
  6   0.007192 54.230.116.73 -> 172.31.8.238 TCP 74 http > 34873 [SYN, ACK] Seq=0 Ack=1 Win=14480 Len=0 MSS=1460 SACK_PERM=1 TSval=1688571104 TSecr=19568175 WS=128
  7   0.007205 172.31.8.238 -> 54.230.116.73 TCP 66 34873 > http [ACK] Seq=1 Ack=1 Win=27008 Len=0 TSval=19568175 TSecr=1688571104
  8   0.007251 172.31.8.238 -> 54.230.116.73 HTTP 162 GET /1kb HTTP/1.1 
  9   0.007940 54.230.116.73 -> 172.31.8.238 TCP 66 http > 34873 [ACK] Seq=1 Ack=97 Win=14592 Len=0 TSval=1688571104 TSecr=19568175
 10   0.010008 54.230.116.73 -> 172.31.8.238 HTTP 1544 HTTP/1.1 200 OK  (application/octet-stream)
 11   0.010014 172.31.8.238 -> 54.230.116.73 TCP 66 34873 > http [ACK] Seq=97 Ack=1479 Win=29952 Len=0 TSval=19568175 TSecr=1688571104
 12   0.010168 172.31.8.238 -> 54.230.116.73 TCP 66 34873 > http [FIN, ACK] Seq=97 Ack=1479 Win=29952 Len=0 TSval=19568175 TSecr=1688571104
 13   0.010737 54.230.116.73 -> 172.31.8.238 TCP 66 http > 34873 [FIN, ACK] Seq=1479 Ack=98 Win=14592 Len=0 TSval=1688571104 TSecr=19568175
 14   0.010745 172.31.8.238 -> 54.230.116.73 TCP 66 34873 > http [ACK] Seq=98 Ack=1480 Win=29952 Len=0 TSval=19568176 TSecr=1688571104
