[Measurement for 1kb at 03:44:05 20.44.2014] 
Tshark:

  1   0.000000 172.31.8.238 -> 172.31.0.2   DNS 89 Standard query 0x0b98  A d2pcb72msibvx3.cloudfront.net
  2   0.000030 172.31.8.238 -> 172.31.0.2   DNS 89 Standard query 0xd02d  AAAA d2pcb72msibvx3.cloudfront.net
  3   0.000493   172.31.0.2 -> 172.31.8.238 DNS 217 Standard query response 0x0b98  A 54.192.118.246 A 54.230.116.72 A 54.230.116.167 A 54.239.132.41 A 54.239.132.233 A 54.192.118.235 A 54.192.118.239 A 54.192.118.240
  4   0.003965   172.31.0.2 -> 172.31.8.238 DNS 169 Standard query response 0xd02d 
  5   0.012006 172.31.8.238 -> 54.192.118.246 TCP 74 55042 > http [SYN] Seq=0 Win=26883 Len=0 MSS=8961 SACK_PERM=1 TSval=9668206 TSecr=0 WS=128
  6   0.012681 54.192.118.246 -> 172.31.8.238 TCP 74 http > 55042 [SYN, ACK] Seq=0 Ack=1 Win=14480 Len=0 MSS=1460 SACK_PERM=1 TSval=1685094166 TSecr=9668206 WS=128
  7   0.012694 172.31.8.238 -> 54.192.118.246 TCP 66 55042 > http [ACK] Seq=1 Ack=1 Win=27008 Len=0 TSval=9668206 TSecr=1685094166
  8   0.012738 172.31.8.238 -> 54.192.118.246 HTTP 162 GET /1kb HTTP/1.1 
  9   0.013403 54.192.118.246 -> 172.31.8.238 TCP 66 http > 55042 [ACK] Seq=1 Ack=97 Win=14592 Len=0 TSval=1685094166 TSecr=9668206
 10   0.015467 54.192.118.246 -> 172.31.8.238 HTTP 1544 HTTP/1.1 200 OK  (application/octet-stream)
 11   0.015474 172.31.8.238 -> 54.192.118.246 TCP 66 55042 > http [ACK] Seq=97 Ack=1479 Win=29952 Len=0 TSval=9668207 TSecr=1685094166
 12   0.015649 172.31.8.238 -> 54.192.118.246 TCP 66 55042 > http [FIN, ACK] Seq=97 Ack=1479 Win=29952 Len=0 TSval=9668207 TSecr=1685094166
 13   0.016310 54.192.118.246 -> 172.31.8.238 TCP 66 http > 55042 [FIN, ACK] Seq=1479 Ack=98 Win=14592 Len=0 TSval=1685094166 TSecr=9668207
 14   0.016318 172.31.8.238 -> 54.192.118.246 TCP 66 55042 > http [ACK] Seq=98 Ack=1480 Win=29952 Len=0 TSval=9668207 TSecr=1685094166
