[Measurement for 1kb at 04:44:04 20.44.2014] 
Tshark:

  1   0.000000 172.31.8.238 -> 172.31.0.2   DNS 89 Standard query 0x9a15  A d2pcb72msibvx3.cloudfront.net
  2   0.000038 172.31.8.238 -> 172.31.0.2   DNS 89 Standard query 0x7424  AAAA d2pcb72msibvx3.cloudfront.net
  3   0.000746   172.31.0.2 -> 172.31.8.238 DNS 217 Standard query response 0x9a15  A 54.230.117.154 A 54.230.117.157 A 54.230.119.40 A 54.230.119.150 A 54.239.132.41 A 54.239.132.74 A 54.239.132.249 A 54.192.118.228
  4   0.005147   172.31.0.2 -> 172.31.8.238 DNS 169 Standard query response 0x7424 
  5   0.012027 172.31.8.238 -> 54.230.117.154 TCP 74 42130 > http [SYN] Seq=0 Win=26883 Len=0 MSS=8961 SACK_PERM=1 TSval=10568149 TSecr=0 WS=128
  6   0.012637 54.230.117.154 -> 172.31.8.238 TCP 74 http > 42130 [SYN, ACK] Seq=0 Ack=1 Win=14480 Len=0 MSS=1460 SACK_PERM=1 TSval=1683973049 TSecr=10568149 WS=128
  7   0.012651 172.31.8.238 -> 54.230.117.154 TCP 66 42130 > http [ACK] Seq=1 Ack=1 Win=27008 Len=0 TSval=10568150 TSecr=1683973049
  8   0.012694 172.31.8.238 -> 54.230.117.154 HTTP 162 GET /1kb HTTP/1.1 
  9   0.013373 54.230.117.154 -> 172.31.8.238 TCP 66 http > 42130 [ACK] Seq=1 Ack=97 Win=14592 Len=0 TSval=1683973049 TSecr=10568150
 10   0.015436 54.230.117.154 -> 172.31.8.238 HTTP 1544 HTTP/1.1 200 OK  (application/octet-stream)
 11   0.015444 172.31.8.238 -> 54.230.117.154 TCP 66 42130 > http [ACK] Seq=97 Ack=1479 Win=29952 Len=0 TSval=10568150 TSecr=1683973050
 12   0.015613 172.31.8.238 -> 54.230.117.154 TCP 66 42130 > http [FIN, ACK] Seq=97 Ack=1479 Win=29952 Len=0 TSval=10568150 TSecr=1683973050
 13   0.016437 54.230.117.154 -> 172.31.8.238 TCP 66 http > 42130 [FIN, ACK] Seq=1479 Ack=98 Win=14592 Len=0 TSval=1683973050 TSecr=10568150
 14   0.016446 172.31.8.238 -> 54.230.117.154 TCP 66 42130 > http [ACK] Seq=98 Ack=1480 Win=29952 Len=0 TSval=10568151 TSecr=1683973050
