[Measurement for 10kb at 00:31:50 20.31.2014] 
Tshark:

  1   0.000000 172.31.36.109 -> 172.31.0.2   DNS 89 Standard query 0x62f3  A d1dx94olpiqj0t.cloudfront.net
  2   0.000022 172.31.36.109 -> 172.31.0.2   DNS 89 Standard query 0x66dc  AAAA d1dx94olpiqj0t.cloudfront.net
  3   0.000342   172.31.0.2 -> 172.31.36.109 DNS 217 Standard query response 0x62f3  A 54.192.30.135 A 54.192.30.219 A 54.230.29.243 A 54.230.30.53 A 54.230.30.73 A 54.230.30.205 A 54.230.30.209 A 54.192.29.218
  4   0.000351   172.31.0.2 -> 172.31.36.109 DNS 176 Standard query response 0x66dc 
  5   0.003920 172.31.36.109 -> 54.192.30.135 TCP 74 46921 > http [SYN] Seq=0 Win=26883 Len=0 MSS=8961 SACK_PERM=1 TSval=26799299 TSecr=0 WS=128
  6   0.005446 54.192.30.135 -> 172.31.36.109 TCP 74 http > 46921 [SYN, ACK] Seq=0 Ack=1 Win=14480 Len=0 MSS=1460 SACK_PERM=1 TSval=732241414 TSecr=26799299 WS=128
  7   0.005482 172.31.36.109 -> 54.192.30.135 TCP 66 46921 > http [ACK] Seq=1 Ack=1 Win=27008 Len=0 TSval=26799299 TSecr=732241414
  8   0.005519 172.31.36.109 -> 54.192.30.135 HTTP 163 GET /10kb HTTP/1.1 
  9   0.006705 54.192.30.135 -> 172.31.36.109 TCP 66 http > 46921 [ACK] Seq=1 Ack=98 Win=14592 Len=0 TSval=732241414 TSecr=26799299
 10   0.015733 54.192.30.135 -> 172.31.36.109 TCP 8754 [TCP segment of a reassembled PDU]
 11   0.015744 172.31.36.109 -> 54.192.30.135 TCP 66 46921 > http [ACK] Seq=98 Ack=8689 Win=44288 Len=0 TSval=26799302 TSecr=732241415
 12   0.015885 54.192.30.135 -> 172.31.36.109 HTTP 2073 HTTP/1.1 200 OK  (application/octet-stream)
 13   0.015891 172.31.36.109 -> 54.192.30.135 TCP 66 46921 > http [ACK] Seq=98 Ack=10696 Win=48384 Len=0 TSval=26799302 TSecr=732241415
 14   0.016023 172.31.36.109 -> 54.192.30.135 TCP 66 46921 > http [FIN, ACK] Seq=98 Ack=10696 Win=48384 Len=0 TSval=26799302 TSecr=732241415
 15   0.017493 54.192.30.135 -> 172.31.36.109 TCP 66 http > 46921 [FIN, ACK] Seq=10696 Ack=99 Win=14592 Len=0 TSval=732241415 TSecr=26799302
 16   0.017501 172.31.36.109 -> 54.192.30.135 TCP 66 46921 > http [ACK] Seq=99 Ack=10697 Win=48384 Len=0 TSval=26799302 TSecr=732241415
