[Measurement for 10kb at 17:34:38 19.34.2014] 
Tshark:

  1   0.000000 172.31.36.109 -> 172.31.0.2   DNS 89 Standard query 0xb688  A d1dx94olpiqj0t.cloudfront.net
  2   0.000036 172.31.36.109 -> 172.31.0.2   DNS 89 Standard query 0xa61c  AAAA d1dx94olpiqj0t.cloudfront.net
  3   0.000465   172.31.0.2 -> 172.31.36.109 DNS 217 Standard query response 0xb688  A 54.230.31.4 A 54.192.29.219 A 54.192.29.223 A 54.192.30.219 A 54.230.30.220 A 54.230.30.221 A 54.230.30.235 A 54.230.30.236
  4   0.000546   172.31.0.2 -> 172.31.36.109 DNS 176 Standard query response 0xa61c 
  5   0.003903 172.31.36.109 -> 54.230.31.4  TCP 74 41913 > http [SYN] Seq=0 Win=26883 Len=0 MSS=8961 SACK_PERM=1 TSval=20541346 TSecr=0 WS=128
  6   0.005247  54.230.31.4 -> 172.31.36.109 TCP 74 http > 41913 [SYN, ACK] Seq=0 Ack=1 Win=14480 Len=0 MSS=1460 SACK_PERM=1 TSval=631386554 TSecr=20541346 WS=128
  7   0.005261 172.31.36.109 -> 54.230.31.4  TCP 66 41913 > http [ACK] Seq=1 Ack=1 Win=27008 Len=0 TSval=20541347 TSecr=631386554
  8   0.005309 172.31.36.109 -> 54.230.31.4  HTTP 163 GET /10kb HTTP/1.1 
  9   0.006466  54.230.31.4 -> 172.31.36.109 TCP 66 http > 41913 [ACK] Seq=1 Ack=98 Win=14592 Len=0 TSval=631386554 TSecr=20541347
 10   0.199045  54.230.31.4 -> 172.31.36.109 TCP 1514 [TCP segment of a reassembled PDU]
 11   0.199069 172.31.36.109 -> 54.230.31.4  TCP 66 41913 > http [ACK] Seq=98 Ack=1449 Win=29824 Len=0 TSval=20541395 TSecr=631386574
 12   0.199278  54.230.31.4 -> 172.31.36.109 HTTP 9302 HTTP/1.1 200 OK  (application/octet-stream)
 13   0.199289 172.31.36.109 -> 54.230.31.4  TCP 66 41913 > http [ACK] Seq=98 Ack=10685 Win=48256 Len=0 TSval=20541395 TSecr=631386574
 14   0.199577 172.31.36.109 -> 54.230.31.4  TCP 66 41913 > http [FIN, ACK] Seq=98 Ack=10685 Win=48256 Len=0 TSval=20541395 TSecr=631386574
 15   0.200824  54.230.31.4 -> 172.31.36.109 TCP 66 http > 41913 [FIN, ACK] Seq=10685 Ack=99 Win=14592 Len=0 TSval=631386574 TSecr=20541395
 16   0.200847 172.31.36.109 -> 54.230.31.4  TCP 66 41913 > http [ACK] Seq=99 Ack=10686 Win=48256 Len=0 TSval=20541396 TSecr=631386574
