[Measurement for 10kb at 11:31:51 20.31.2014] 
Tshark:

  1   0.000000 172.31.36.109 -> 172.31.0.2   DNS 89 Standard query 0xbaef  A d1dx94olpiqj0t.cloudfront.net
  2   0.000030 172.31.36.109 -> 172.31.0.2   DNS 89 Standard query 0x79b8  AAAA d1dx94olpiqj0t.cloudfront.net
  3   0.000686   172.31.0.2 -> 172.31.36.109 DNS 217 Standard query response 0xbaef  A 54.192.30.137 A 54.192.30.214 A 54.230.30.2 A 54.230.30.6 A 54.230.30.27 A 54.230.30.28 A 54.230.30.226 A 54.230.30.247
  4   0.000695   172.31.0.2 -> 172.31.36.109 DNS 176 Standard query response 0x79b8 
  5   0.003853 172.31.36.109 -> 54.192.30.137 TCP 74 45365 > http [SYN] Seq=0 Win=26883 Len=0 MSS=8961 SACK_PERM=1 TSval=36699512 TSecr=0 WS=128
  6   0.005242 54.192.30.137 -> 172.31.36.109 TCP 74 http > 45365 [SYN, ACK] Seq=0 Ack=1 Win=14480 Len=0 MSS=1460 SACK_PERM=1 TSval=730295809 TSecr=36699512 WS=128
  7   0.005277 172.31.36.109 -> 54.192.30.137 TCP 66 45365 > http [ACK] Seq=1 Ack=1 Win=27008 Len=0 TSval=36699512 TSecr=730295809
  8   0.005347 172.31.36.109 -> 54.192.30.137 HTTP 163 GET /10kb HTTP/1.1 
  9   0.006748 54.192.30.137 -> 172.31.36.109 TCP 66 http > 45365 [ACK] Seq=1 Ack=98 Win=14592 Len=0 TSval=730295810 TSecr=36699512
 10   0.018445 54.192.30.137 -> 172.31.36.109 HTTP 10761 HTTP/1.1 200 OK  (application/octet-stream)
 11   0.018456 172.31.36.109 -> 54.192.30.137 TCP 66 45365 > http [ACK] Seq=98 Ack=10696 Win=48384 Len=0 TSval=36699516 TSecr=730295811
 12   0.018654 172.31.36.109 -> 54.192.30.137 TCP 66 45365 > http [FIN, ACK] Seq=98 Ack=10696 Win=48384 Len=0 TSval=36699516 TSecr=730295811
 13   0.019800 54.192.30.137 -> 172.31.36.109 TCP 66 http > 45365 [FIN, ACK] Seq=10696 Ack=99 Win=14592 Len=0 TSval=730295811 TSecr=36699516
 14   0.019808 172.31.36.109 -> 54.192.30.137 TCP 66 45365 > http [ACK] Seq=99 Ack=10697 Win=48384 Len=0 TSval=36699516 TSecr=730295811
