[Measurement for 1kb at 10:03:12 17.03.2014] 
Tshark:

  1   0.000000 54.235.136.252 -> 192.168.1.2  TCP 54 80→52015 [ACK] Seq=1 Ack=1 Win=13455 Len=0
  2   1.206913  192.168.1.2 -> 64.233.164.188 TCP 55 50651→5228 [ACK] Seq=1 Ack=1 Win=254 Len=1
  3   1.232262  192.168.1.2 -> 54.230.98.71 TCP 66 52033→80 [SYN] Seq=0 Win=8192 Len=0 MSS=1460 WS=256 SACK_PERM=1
  4   1.267504 54.230.98.71 -> 192.168.1.2  TCP 66 80→52033 [SYN, ACK] Seq=0 Ack=1 Win=14600 Len=0 MSS=1400 SACK_PERM=1 WS=128
  5   1.267658  192.168.1.2 -> 54.230.98.71 TCP 54 52033→80 [ACK] Seq=1 Ack=1 Win=65792 Len=0
  6   1.267823  192.168.1.2 -> 54.230.98.71 HTTP 150 GET /1kb HTTP/1.1 
  7   1.268178 64.233.164.188 -> 192.168.1.2  TCP 66 5228→50651 [ACK] Seq=1 Ack=2 Win=361 Len=0 SLE=1 SRE=2
  8   1.296971 54.230.98.71 -> 192.168.1.2  TCP 54 80→52033 [ACK] Seq=1 Ack=97 Win=14720 Len=0
  9   1.298118 54.230.98.71 -> 192.168.1.2  TCP 1454 [TCP segment of a reassembled PDU]
 10   1.299147 54.230.98.71 -> 192.168.1.2  HTTP 132 HTTP/1.1 200 OK  (application/octet-stream)
 11   1.299216  192.168.1.2 -> 54.230.98.71 TCP 54 52033→80 [ACK] Seq=97 Ack=1479 Win=65792 Len=0
 12   1.299348  192.168.1.2 -> 54.230.98.71 TCP 54 52033→80 [FIN, ACK] Seq=97 Ack=1479 Win=65792 Len=0
 13   1.331198 54.230.98.71 -> 192.168.1.2  TCP 54 80→52033 [FIN, ACK] Seq=1479 Ack=98 Win=14720 Len=0
 14   1.331326  192.168.1.2 -> 54.230.98.71 TCP 54 52033→80 [ACK] Seq=98 Ack=1480 Win=65792 Len=0
 15   1.650501  192.168.1.2 -> 72.21.195.190 TCP 1414 [TCP segment of a reassembled PDU]
 16   1.650523  192.168.1.2 -> 72.21.195.190 TCP 1414 [TCP segment of a reassembled PDU]
 17   1.650537  192.168.1.2 -> 72.21.195.190 TLSv1 1021 Application Data
 18   1.811244 72.21.195.190 -> 192.168.1.2  TCP 54 443→50824 [ACK] Seq=1 Ack=2721 Win=32725 Len=0
 19   1.811998 72.21.195.190 -> 192.168.1.2  TCP 54 443→50824 [ACK] Seq=1 Ack=3688 Win=32710 Len=0
 20   1.837112 72.21.195.190 -> 192.168.1.2  TLSv1 331 Application Data
 21   1.837805 72.21.195.190 -> 192.168.1.2  TLSv1 118 Application Data
 22   1.837862  192.168.1.2 -> 72.21.195.190 TCP 54 50824→443 [ACK] Seq=3688 Ack=342 Win=257 Len=0
