[Measurement for 10kb at 23:30:14 19.30.2014] 
Tshark:

  1   0.000000 06:ab:f2:b7:83:1d -> 06:87:bf:67:ca:e7 ARP 60 Who has 172.31.36.109?  Tell 172.31.32.1
  2   0.000018 06:87:bf:67:ca:e7 -> 06:ab:f2:b7:83:1d ARP 42 172.31.36.109 is at 06:87:bf:67:ca:e7
  3   1.586684 172.31.36.109 -> 172.31.0.2   DNS 89 Standard query 0x9e73  A d39wppo36gwqpx.cloudfront.net
  4   1.586713 172.31.36.109 -> 172.31.0.2   DNS 89 Standard query 0xb1e3  AAAA d39wppo36gwqpx.cloudfront.net
  5   1.587184   172.31.0.2 -> 172.31.36.109 DNS 217 Standard query response 0x9e73  A 54.192.30.189 A 54.192.30.222 A 54.230.30.49 A 54.230.30.57 A 54.230.30.73 A 54.230.30.213 A 54.230.30.243 A 54.192.30.138
  6   1.587195   172.31.0.2 -> 172.31.36.109 DNS 170 Standard query response 0xb1e3 
  7   1.590555 172.31.36.109 -> 54.192.30.189 TCP 74 58763 > http [SYN] Seq=0 Win=26883 Len=0 MSS=8961 SACK_PERM=1 TSval=25875334 TSecr=0 WS=128
  8   1.592039 54.192.30.189 -> 172.31.36.109 TCP 74 http > 58763 [SYN, ACK] Seq=0 Ack=1 Win=14480 Len=0 MSS=1460 SACK_PERM=1 TSval=714777367 TSecr=25875334 WS=128
  9   1.592053 172.31.36.109 -> 54.192.30.189 TCP 66 58763 > http [ACK] Seq=1 Ack=1 Win=27008 Len=0 TSval=25875335 TSecr=714777367
 10   1.592096 172.31.36.109 -> 54.192.30.189 HTTP 163 GET /10kb HTTP/1.1 
 11   1.593335 54.192.30.189 -> 172.31.36.109 TCP 66 http > 58763 [ACK] Seq=1 Ack=98 Win=14592 Len=0 TSval=714777367 TSecr=25875335
 12   1.622275 54.192.30.189 -> 172.31.36.109 HTTP 10761 HTTP/1.1 200 OK  (application/octet-stream)
 13   1.622299 172.31.36.109 -> 54.192.30.189 TCP 66 58763 > http [ACK] Seq=98 Ack=10696 Win=48384 Len=0 TSval=25875342 TSecr=714777370
 14   1.622533 172.31.36.109 -> 54.192.30.189 TCP 66 58763 > http [FIN, ACK] Seq=98 Ack=10696 Win=48384 Len=0 TSval=25875342 TSecr=714777370
 15   1.623937 54.192.30.189 -> 172.31.36.109 TCP 66 http > 58763 [FIN, ACK] Seq=10696 Ack=99 Win=14592 Len=0 TSval=714777370 TSecr=25875342
 16   1.623947 172.31.36.109 -> 54.192.30.189 TCP 66 58763 > http [ACK] Seq=99 Ack=10697 Win=48384 Len=0 TSval=25875343 TSecr=714777370
