[Measurement for 10kb at 11:30:14 20.30.2014] 
Tshark:

  1   0.000000 172.31.36.109 -> 172.31.0.2   DNS 89 Standard query 0xb07a  A d39wppo36gwqpx.cloudfront.net
  2   0.000029 172.31.36.109 -> 172.31.0.2   DNS 89 Standard query 0xf7d7  AAAA d39wppo36gwqpx.cloudfront.net
  3   0.000557   172.31.0.2 -> 172.31.36.109 DNS 170 Standard query response 0xf7d7 
  4   0.000569   172.31.0.2 -> 172.31.36.109 DNS 217 Standard query response 0xb07a  A 54.192.29.219 A 54.192.30.216 A 54.230.29.245 A 54.230.30.2 A 54.230.30.17 A 54.230.30.40 A 54.230.30.56 A 54.230.30.217
  5   0.003874 172.31.36.109 -> 54.192.29.219 TCP 74 56610 > http [SYN] Seq=0 Win=26883 Len=0 MSS=8961 SACK_PERM=1 TSval=36675158 TSecr=0 WS=128
  6   0.004984 54.192.29.219 -> 172.31.36.109 TCP 74 http > 56610 [SYN, ACK] Seq=0 Ack=1 Win=14480 Len=0 MSS=1460 SACK_PERM=1 TSval=625201147 TSecr=36675158 WS=128
  7   0.004997 172.31.36.109 -> 54.192.29.219 TCP 66 56610 > http [ACK] Seq=1 Ack=1 Win=27008 Len=0 TSval=36675158 TSecr=625201147
  8   0.005042 172.31.36.109 -> 54.192.29.219 HTTP 163 GET /10kb HTTP/1.1 
  9   0.006251 54.192.29.219 -> 172.31.36.109 TCP 66 http > 56610 [ACK] Seq=1 Ack=98 Win=14592 Len=0 TSval=625201147 TSecr=36675158
 10   0.016603 54.192.29.219 -> 172.31.36.109 HTTP 10761 HTTP/1.1 200 OK  (application/octet-stream)
 11   0.016617 172.31.36.109 -> 54.192.29.219 TCP 66 56610 > http [ACK] Seq=98 Ack=10696 Win=48384 Len=0 TSval=36675161 TSecr=625201148
 12   0.016786 172.31.36.109 -> 54.192.29.219 TCP 66 56610 > http [FIN, ACK] Seq=98 Ack=10696 Win=48384 Len=0 TSval=36675161 TSecr=625201148
 13   0.017774 54.192.29.219 -> 172.31.36.109 TCP 66 http > 56610 [FIN, ACK] Seq=10696 Ack=99 Win=14592 Len=0 TSval=625201148 TSecr=36675161
 14   0.017784 172.31.36.109 -> 54.192.29.219 TCP 66 56610 > http [ACK] Seq=99 Ack=10697 Win=48384 Len=0 TSval=36675161 TSecr=625201148
