[Measurement for 10kb at 09:30:14 20.30.2014] 
Tshark:

  1   0.000000 172.31.36.109 -> 172.31.0.2   DNS 89 Standard query 0x90bf  A d39wppo36gwqpx.cloudfront.net
  2   0.000027 172.31.36.109 -> 172.31.0.2   DNS 89 Standard query 0x6d61  AAAA d39wppo36gwqpx.cloudfront.net
  3   0.000432   172.31.0.2 -> 172.31.36.109 DNS 217 Standard query response 0x90bf  A 54.230.186.130 A 54.230.187.27 A 54.230.187.225 A 54.239.158.219 A 54.230.184.236 A 54.230.184.251 A 54.230.185.183 A 54.230.185.254
  4   0.000442   172.31.0.2 -> 172.31.36.109 DNS 170 Standard query response 0x6d61 
  5   0.003886 172.31.36.109 -> 54.230.186.130 TCP 74 44353 > http [SYN] Seq=0 Win=26883 Len=0 MSS=8961 SACK_PERM=1 TSval=34875351 TSecr=0 WS=128
  6   0.021728 54.230.186.130 -> 172.31.36.109 TCP 74 http > 44353 [SYN, ACK] Seq=0 Ack=1 Win=14480 Len=0 MSS=1460 SACK_PERM=1 TSval=1048155722 TSecr=34875351 WS=128
  7   0.021743 172.31.36.109 -> 54.230.186.130 TCP 66 44353 > http [ACK] Seq=1 Ack=1 Win=27008 Len=0 TSval=34875356 TSecr=1048155722
  8   0.021789 172.31.36.109 -> 54.230.186.130 HTTP 163 GET /10kb HTTP/1.1 
  9   0.039688 54.230.186.130 -> 172.31.36.109 TCP 66 http > 44353 [ACK] Seq=1 Ack=98 Win=14592 Len=0 TSval=1048155723 TSecr=34875356
 10   0.488967 54.230.186.130 -> 172.31.36.109 HTTP 10750 HTTP/1.1 200 OK  (application/octet-stream)
 11   0.488998 172.31.36.109 -> 54.230.186.130 TCP 66 44353 > http [ACK] Seq=98 Ack=10685 Win=48256 Len=0 TSval=34875473 TSecr=1048155768
 12   0.491466 172.31.36.109 -> 54.230.186.130 TCP 66 44353 > http [FIN, ACK] Seq=98 Ack=10685 Win=48256 Len=0 TSval=34875473 TSecr=1048155768
 13   0.509337 54.230.186.130 -> 172.31.36.109 TCP 66 http > 44353 [FIN, ACK] Seq=10685 Ack=99 Win=14592 Len=0 TSval=1048155770 TSecr=34875473
 14   0.509349 172.31.36.109 -> 54.230.186.130 TCP 66 44353 > http [ACK] Seq=99 Ack=10686 Win=48256 Len=0 TSval=34875478 TSecr=1048155770
