[Measurement for 1kb at 22:02:38 16.02.2014] 
Tshark:

  1   0.000000  192.168.1.2 -> 54.230.98.48 TCP 66 49222→80 [SYN] Seq=0 Win=8192 Len=0 MSS=1460 WS=256 SACK_PERM=1
  2   0.058126 54.230.98.48 -> 192.168.1.2  TCP 66 80→49222 [SYN, ACK] Seq=0 Ack=1 Win=14600 Len=0 MSS=1400 SACK_PERM=1 WS=128
  3   0.058290  192.168.1.2 -> 54.230.98.48 TCP 54 49222→80 [ACK] Seq=1 Ack=1 Win=65792 Len=0
  4   0.058460  192.168.1.2 -> 54.230.98.48 HTTP 150 GET /1kb HTTP/1.1 
  5   0.089300 54.230.98.48 -> 192.168.1.2  TCP 54 80→49222 [ACK] Seq=1 Ack=97 Win=14720 Len=0
  6   0.093632 54.230.98.48 -> 192.168.1.2  TCP 1454 [TCP segment of a reassembled PDU]
  7   0.094141 54.230.98.48 -> 192.168.1.2  HTTP 132 HTTP/1.1 200 OK  (application/octet-stream)
  8   0.094224  192.168.1.2 -> 54.230.98.48 TCP 54 49222→80 [ACK] Seq=97 Ack=1479 Win=65792 Len=0
  9   0.094316  192.168.1.2 -> 54.230.98.48 TCP 54 49222→80 [FIN, ACK] Seq=97 Ack=1479 Win=65792 Len=0
 10   0.125721 54.230.98.48 -> 192.168.1.2  TCP 54 80→49222 [FIN, ACK] Seq=1479 Ack=98 Win=14720 Len=0
 11   0.125879  192.168.1.2 -> 54.230.98.48 TCP 54 49222→80 [ACK] Seq=98 Ack=1480 Win=65792 Len=0
 12   0.356541 173.255.112.173 -> 192.168.1.2  TLSv1.2 100 Application Data
 13   0.407470  192.168.1.2 -> 173.255.112.173 TCP 54 63361→443 [ACK] Seq=1 Ack=47 Win=252 Len=0
 14   0.692949  192.168.1.2 -> 64.233.164.125 TCP 76 [TCP segment of a reassembled PDU]
