[Measurement for 1kb at 20:02:36 16.02.2014] 
Tshark:

  1   0.000000  192.168.1.1 -> 239.255.255.250 SSDP 451 NOTIFY * HTTP/1.1 
  2   0.005115  192.168.1.1 -> 239.255.255.250 SSDP 523 NOTIFY * HTTP/1.1 
  3   0.009909  192.168.1.1 -> 239.255.255.250 SSDP 519 NOTIFY * HTTP/1.1 
  4   0.015416  192.168.1.1 -> 239.255.255.250 SSDP 499 NOTIFY * HTTP/1.1 
  5   0.020763  192.168.1.1 -> 239.255.255.250 SSDP 531 NOTIFY * HTTP/1.1 
  6   0.025410  192.168.1.1 -> 239.255.255.250 SSDP 513 NOTIFY * HTTP/1.1 
  7   0.037523  192.168.1.1 -> 239.255.255.250 SSDP 515 NOTIFY * HTTP/1.1 
  8   0.041873  192.168.1.1 -> 239.255.255.250 SSDP 460 NOTIFY * HTTP/1.1 
  9   0.046246  192.168.1.1 -> 239.255.255.250 SSDP 460 NOTIFY * HTTP/1.1 
 10   0.052586  192.168.1.1 -> 239.255.255.250 SSDP 460 NOTIFY * HTTP/1.1 
 11   0.056855  192.168.1.1 -> 239.255.255.250 SSDP 460 NOTIFY * HTTP/1.1 
 12   1.130325  192.168.1.2 -> 54.230.98.25 TCP 66 64591→80 [SYN] Seq=0 Win=8192 Len=0 MSS=1460 WS=256 SACK_PERM=1
 13   1.185017 54.230.98.25 -> 192.168.1.2  TCP 66 80→64591 [SYN, ACK] Seq=0 Ack=1 Win=14600 Len=0 MSS=1400 SACK_PERM=1 WS=128
 14   1.185159  192.168.1.2 -> 54.230.98.25 TCP 54 64591→80 [ACK] Seq=1 Ack=1 Win=65792 Len=0
 15   1.185540  192.168.1.2 -> 54.230.98.25 HTTP 150 GET /1kb HTTP/1.1 
 16   1.214943 54.230.98.25 -> 192.168.1.2  TCP 54 80→64591 [ACK] Seq=1 Ack=97 Win=14720 Len=0
 17   1.221008 54.230.98.25 -> 192.168.1.2  TCP 1454 [TCP segment of a reassembled PDU]
 18   1.221517 54.230.98.25 -> 192.168.1.2  HTTP 132 HTTP/1.1 200 OK  (application/octet-stream)
 19   1.221583  192.168.1.2 -> 54.230.98.25 TCP 54 64591→80 [ACK] Seq=97 Ack=1479 Win=65792 Len=0
 20   1.221870  192.168.1.2 -> 54.230.98.25 TCP 54 64591→80 [FIN, ACK] Seq=97 Ack=1479 Win=65792 Len=0
 21   1.250994 54.230.98.25 -> 192.168.1.2  TCP 54 80→64591 [FIN, ACK] Seq=1479 Ack=98 Win=14720 Len=0
 22   1.251126  192.168.1.2 -> 54.230.98.25 TCP 54 64591→80 [ACK] Seq=98 Ack=1480 Win=65792 Len=0
