[Measurement for 10kb at 01:43:09 20.43.2014] 
Tshark:

  1   0.000000 172.31.8.238 -> 172.31.0.2   DNS 89 Standard query 0xba0d  A d1n0gskdvzj94j.cloudfront.net
  2   0.000029 172.31.8.238 -> 172.31.0.2   DNS 89 Standard query 0x9d1d  AAAA d1n0gskdvzj94j.cloudfront.net
  3   0.000787   172.31.0.2 -> 172.31.8.238 DNS 176 Standard query response 0x9d1d 
  4   0.000831   172.31.0.2 -> 172.31.8.238 DNS 217 Standard query response 0xba0d  A 54.230.116.141 A 54.230.116.189 A 54.230.117.37 A 54.230.119.150 A 54.239.132.173 A 54.239.132.233 A 54.230.116.72 A 54.230.116.98
  5   0.003856 172.31.8.238 -> 54.230.116.141 TCP 74 51222 > http [SYN] Seq=0 Win=26883 Len=0 MSS=8961 SACK_PERM=1 TSval=7854394 TSecr=0 WS=128
  6   0.004467 54.230.116.141 -> 172.31.8.238 TCP 74 http > 51222 [SYN, ACK] Seq=0 Ack=1 Win=14480 Len=0 MSS=1460 SACK_PERM=1 TSval=1681830930 TSecr=7854394 WS=128
  7   0.004482 172.31.8.238 -> 54.230.116.141 TCP 66 51222 > http [ACK] Seq=1 Ack=1 Win=27008 Len=0 TSval=7854394 TSecr=1681830930
  8   0.004518 172.31.8.238 -> 54.230.116.141 HTTP 163 GET /10kb HTTP/1.1 
  9   0.005222 54.230.116.141 -> 172.31.8.238 TCP 66 http > 51222 [ACK] Seq=1 Ack=98 Win=14592 Len=0 TSval=1681830930 TSecr=7854394
 10   0.007032 54.230.116.141 -> 172.31.8.238 TCP 1144 [TCP segment of a reassembled PDU]
 11   0.007038 172.31.8.238 -> 54.230.116.141 TCP 66 51222 > http [ACK] Seq=98 Ack=1079 Win=29056 Len=0 TSval=7854394 TSecr=1681830930
 12   0.007133 54.230.116.141 -> 172.31.8.238 HTTP 9683 HTTP/1.1 200 OK  (application/octet-stream)
 13   0.007142 172.31.8.238 -> 54.230.116.141 TCP 66 51222 > http [ACK] Seq=98 Ack=10696 Win=48384 Len=0 TSval=7854394 TSecr=1681830930
 14   0.007291 172.31.8.238 -> 54.230.116.141 TCP 66 51222 > http [FIN, ACK] Seq=98 Ack=10696 Win=48384 Len=0 TSval=7854394 TSecr=1681830930
 15   0.008032 54.230.116.141 -> 172.31.8.238 TCP 66 http > 51222 [FIN, ACK] Seq=10696 Ack=99 Win=14592 Len=0 TSval=1681830930 TSecr=7854394
 16   0.008041 172.31.8.238 -> 54.230.116.141 TCP 66 51222 > http [ACK] Seq=99 Ack=10697 Win=48384 Len=0 TSval=7854395 TSecr=1681830930
