[Measurement for 10kb at 22:43:10 19.43.2014] 
Tshark:

  1   0.000000 172.31.8.238 -> 172.31.0.2   DNS 89 Standard query 0x0395  A d1n0gskdvzj94j.cloudfront.net
  2   0.000028 172.31.8.238 -> 172.31.0.2   DNS 89 Standard query 0x6436  AAAA d1n0gskdvzj94j.cloudfront.net
  3   0.000794   172.31.0.2 -> 172.31.8.238 DNS 176 Standard query response 0x6436 
  4   0.000807   172.31.0.2 -> 172.31.8.238 DNS 217 Standard query response 0x0395  A 54.230.117.238 A 54.230.119.91 A 54.230.119.125 A 54.239.132.84 A 54.239.132.86 A 54.230.117.15 A 54.230.117.21 A 54.230.117.198
  5   0.003837 172.31.8.238 -> 54.230.117.238 TCP 74 36830 > http [SYN] Seq=0 Win=26883 Len=0 MSS=8961 SACK_PERM=1 TSval=5154548 TSecr=0 WS=128
  6   0.004405 54.230.117.238 -> 172.31.8.238 TCP 74 http > 36830 [SYN, ACK] Seq=0 Ack=1 Win=14480 Len=0 MSS=1460 SACK_PERM=1 TSval=1680361587 TSecr=5154548 WS=128
  7   0.004420 172.31.8.238 -> 54.230.117.238 TCP 66 36830 > http [ACK] Seq=1 Ack=1 Win=27008 Len=0 TSval=5154549 TSecr=1680361587
  8   0.004484 172.31.8.238 -> 54.230.117.238 HTTP 163 GET /10kb HTTP/1.1 
  9   0.005117 54.230.117.238 -> 172.31.8.238 TCP 66 http > 36830 [ACK] Seq=1 Ack=98 Win=14592 Len=0 TSval=1680361587 TSecr=5154549
 10   0.007448 54.230.117.238 -> 172.31.8.238 TCP 1514 [TCP segment of a reassembled PDU]
 11   0.007455 172.31.8.238 -> 54.230.117.238 TCP 66 36830 > http [ACK] Seq=98 Ack=1449 Win=29824 Len=0 TSval=5154549 TSecr=1680361587
 12   0.007566 54.230.117.238 -> 172.31.8.238 HTTP 9313 HTTP/1.1 200 OK  (application/octet-stream)
 13   0.007576 172.31.8.238 -> 54.230.117.238 TCP 66 36830 > http [ACK] Seq=98 Ack=10696 Win=48384 Len=0 TSval=5154549 TSecr=1680361587
 14   0.007712 172.31.8.238 -> 54.230.117.238 TCP 66 36830 > http [FIN, ACK] Seq=98 Ack=10696 Win=48384 Len=0 TSval=5154549 TSecr=1680361587
 15   0.008436 54.230.117.238 -> 172.31.8.238 TCP 66 http > 36830 [FIN, ACK] Seq=10696 Ack=99 Win=14592 Len=0 TSval=1680361587 TSecr=5154549
 16   0.008444 172.31.8.238 -> 54.230.117.238 TCP 66 36830 > http [ACK] Seq=99 Ack=10697 Win=48384 Len=0 TSval=5154550 TSecr=1680361587
