[Measurement for 10kb at 09:43:40 20.43.2014] 
Tshark:

  1   0.000000 172.31.8.238 -> 172.31.0.2   DNS 89 Standard query 0xad17  A d1n0gskdvzj94j.cloudfront.net
  2   0.000029 172.31.8.238 -> 172.31.0.2   DNS 89 Standard query 0x4b1e  AAAA d1n0gskdvzj94j.cloudfront.net
  3   0.000850   172.31.0.2 -> 172.31.8.238 DNS 217 Standard query response 0xad17  A 54.230.119.11 A 54.230.119.55 A 54.230.119.150 A 54.239.132.147 A 54.239.132.233 A 54.192.118.218 A 54.230.116.98 A 54.230.118.146
  4   0.000901   172.31.0.2 -> 172.31.8.238 DNS 176 Standard query response 0x4b1e 
  5   0.003897 172.31.8.238 -> 54.230.119.11 TCP 74 44499 > http [SYN] Seq=0 Win=26883 Len=0 MSS=8961 SACK_PERM=1 TSval=15062026 TSecr=0 WS=128
  6   0.004488 54.230.119.11 -> 172.31.8.238 TCP 74 http > 44499 [SYN, ACK] Seq=0 Ack=1 Win=14480 Len=0 MSS=1460 SACK_PERM=1 TSval=1685770621 TSecr=15062026 WS=128
  7   0.004500 172.31.8.238 -> 54.230.119.11 TCP 66 44499 > http [ACK] Seq=1 Ack=1 Win=27008 Len=0 TSval=15062026 TSecr=1685770621
  8   0.004539 172.31.8.238 -> 54.230.119.11 HTTP 163 GET /10kb HTTP/1.1 
  9   0.005231 54.230.119.11 -> 172.31.8.238 TCP 66 http > 44499 [ACK] Seq=1 Ack=98 Win=14592 Len=0 TSval=1685770621 TSecr=15062026
 10   0.007058 54.230.119.11 -> 172.31.8.238 TCP 4410 [TCP segment of a reassembled PDU]
 11   0.007066 172.31.8.238 -> 54.230.119.11 TCP 66 44499 > http [ACK] Seq=98 Ack=4345 Win=35584 Len=0 TSval=15062027 TSecr=1685770622
 12   0.007209 54.230.119.11 -> 172.31.8.238 HTTP 6417 HTTP/1.1 200 OK  (application/octet-stream)
 13   0.007218 172.31.8.238 -> 54.230.119.11 TCP 66 44499 > http [ACK] Seq=98 Ack=10696 Win=48384 Len=0 TSval=15062027 TSecr=1685770622
 14   0.007364 172.31.8.238 -> 54.230.119.11 TCP 66 44499 > http [FIN, ACK] Seq=98 Ack=10696 Win=48384 Len=0 TSval=15062027 TSecr=1685770622
 15   0.008075 54.230.119.11 -> 172.31.8.238 TCP 66 http > 44499 [FIN, ACK] Seq=10696 Ack=99 Win=14592 Len=0 TSval=1685770622 TSecr=15062027
 16   0.008084 172.31.8.238 -> 54.230.119.11 TCP 66 44499 > http [ACK] Seq=99 Ack=10697 Win=48384 Len=0 TSval=15062027 TSecr=1685770622
