[Measurement for 10kb at 04:43:10 20.43.2014] 
Tshark:

  1   0.000000 172.31.8.238 -> 172.31.0.2   DNS 89 Standard query 0x6bb2  A d1n0gskdvzj94j.cloudfront.net
  2   0.000025 172.31.8.238 -> 172.31.0.2   DNS 89 Standard query 0x315e  AAAA d1n0gskdvzj94j.cloudfront.net
  3   0.000766   172.31.0.2 -> 172.31.8.238 DNS 217 Standard query response 0x6bb2  A 54.230.116.141 A 54.230.117.152 A 54.230.118.114 A 54.239.132.196 A 54.239.132.249 A 54.192.118.224 A 54.192.118.233 A 54.192.118.239
  4   0.000913   172.31.0.2 -> 172.31.8.238 DNS 176 Standard query response 0x315e 
  5   0.003804 172.31.8.238 -> 54.230.116.141 TCP 74 51357 > http [SYN] Seq=0 Win=26883 Len=0 MSS=8961 SACK_PERM=1 TSval=10554502 TSecr=0 WS=128
  6   0.004633 54.230.116.141 -> 172.31.8.238 TCP 74 http > 51357 [SYN, ACK] Seq=0 Ack=1 Win=14480 Len=0 MSS=1460 SACK_PERM=1 TSval=1685745891 TSecr=10554502 WS=128
  7   0.004647 172.31.8.238 -> 54.230.116.141 TCP 66 51357 > http [ACK] Seq=1 Ack=1 Win=27008 Len=0 TSval=10554503 TSecr=1685745891
  8   0.004690 172.31.8.238 -> 54.230.116.141 HTTP 163 GET /10kb HTTP/1.1 
  9   0.005390 54.230.116.141 -> 172.31.8.238 TCP 66 http > 51357 [ACK] Seq=1 Ack=98 Win=14592 Len=0 TSval=1685745891 TSecr=10554503
 10   0.007494 54.230.116.141 -> 172.31.8.238 HTTP 10761 HTTP/1.1 200 OK  (application/octet-stream)
 11   0.007504 172.31.8.238 -> 54.230.116.141 TCP 66 51357 > http [ACK] Seq=98 Ack=10696 Win=48384 Len=0 TSval=10554503 TSecr=1685745892
 12   0.007658 172.31.8.238 -> 54.230.116.141 TCP 66 51357 > http [FIN, ACK] Seq=98 Ack=10696 Win=48384 Len=0 TSval=10554503 TSecr=1685745892
 13   0.008483 54.230.116.141 -> 172.31.8.238 TCP 66 http > 51357 [FIN, ACK] Seq=10696 Ack=99 Win=14592 Len=0 TSval=1685745892 TSecr=10554503
 14   0.008491 172.31.8.238 -> 54.230.116.141 TCP 66 51357 > http [ACK] Seq=99 Ack=10697 Win=48384 Len=0 TSval=10554504 TSecr=1685745892
