[Measurement for 10kb at 22:36:13 19.36.2014] 
Tshark:

  1   0.000000 172.31.29.138 -> 172.31.0.2   DNS 89 Standard query 0xcddf  A d1xvcg6dfvgaki.cloudfront.net
  2   0.000028 172.31.29.138 -> 172.31.0.2   DNS 89 Standard query 0x0ed1  AAAA d1xvcg6dfvgaki.cloudfront.net
  3   0.000594   172.31.0.2 -> 172.31.29.138 DNS 170 Standard query response 0x0ed1 
  4   0.000605   172.31.0.2 -> 172.31.29.138 DNS 217 Standard query response 0xcddf  A 54.230.158.139 A 54.230.158.182 A 54.230.158.223 A 54.230.159.4 A 54.230.159.7 A 54.230.159.153 A 54.192.157.144 A 54.230.156.193
  5   0.003849 172.31.29.138 -> 54.230.158.139 TCP 74 58780 > http [SYN] Seq=0 Win=26883 Len=0 MSS=8961 SACK_PERM=1 TSval=5111549 TSecr=0 WS=128
  6   0.004388 54.230.158.139 -> 172.31.29.138 TCP 74 http > 58780 [SYN, ACK] Seq=0 Ack=1 Win=14480 Len=0 MSS=1460 SACK_PERM=1 TSval=831492729 TSecr=5111549 WS=128
  7   0.004402 172.31.29.138 -> 54.230.158.139 TCP 66 58780 > http [ACK] Seq=1 Ack=1 Win=27008 Len=0 TSval=5111549 TSecr=831492729
  8   0.004443 172.31.29.138 -> 54.230.158.139 HTTP 163 GET /10kb HTTP/1.1 
  9   0.005130 54.230.158.139 -> 172.31.29.138 TCP 66 http > 58780 [ACK] Seq=1 Ack=98 Win=14592 Len=0 TSval=831492729 TSecr=5111549
 10   0.006927 54.230.158.139 -> 172.31.29.138 TCP 1514 [TCP segment of a reassembled PDU]
 11   0.006934 172.31.29.138 -> 54.230.158.139 TCP 66 58780 > http [ACK] Seq=98 Ack=1449 Win=29824 Len=0 TSval=5111550 TSecr=831492729
 12   0.007015 54.230.158.139 -> 172.31.29.138 HTTP 9313 HTTP/1.1 200 OK  (application/octet-stream)
 13   0.007025 172.31.29.138 -> 54.230.158.139 TCP 66 58780 > http [ACK] Seq=98 Ack=10696 Win=48384 Len=0 TSval=5111550 TSecr=831492729
 14   0.007170 172.31.29.138 -> 54.230.158.139 TCP 66 58780 > http [FIN, ACK] Seq=98 Ack=10696 Win=48384 Len=0 TSval=5111550 TSecr=831492729
 15   0.007677 54.230.158.139 -> 172.31.29.138 TCP 66 http > 58780 [FIN, ACK] Seq=10696 Ack=99 Win=14592 Len=0 TSval=831492729 TSecr=5111550
 16   0.007685 172.31.29.138 -> 54.230.158.139 TCP 66 58780 > http [ACK] Seq=99 Ack=10697 Win=48384 Len=0 TSval=5111550 TSecr=831492729
