[Measurement for 10kb at 01:36:12 20.36.2014] 
Tshark:

  1   0.000000 172.31.29.138 -> 172.31.0.2   DNS 89 Standard query 0x9a81  A d1xvcg6dfvgaki.cloudfront.net
  2   0.000034 172.31.29.138 -> 172.31.0.2   DNS 89 Standard query 0xe909  AAAA d1xvcg6dfvgaki.cloudfront.net
  3   0.000626   172.31.0.2 -> 172.31.29.138 DNS 170 Standard query response 0xe909 
  4   0.000637   172.31.0.2 -> 172.31.29.138 DNS 217 Standard query response 0x9a81  A 54.230.158.223 A 54.230.159.132 A 54.192.156.102 A 54.192.156.109 A 54.192.159.180 A 54.230.156.193 A 54.230.158.80 A 54.230.158.189
  5   0.003869 172.31.29.138 -> 54.230.158.223 TCP 74 44775 > http [SYN] Seq=0 Win=26883 Len=0 MSS=8961 SACK_PERM=1 TSval=7811417 TSecr=0 WS=128
  6   0.004581 54.230.158.223 -> 172.31.29.138 TCP 74 http > 44775 [SYN, ACK] Seq=0 Ack=1 Win=14480 Len=0 MSS=1460 SACK_PERM=1 TSval=807361971 TSecr=7811417 WS=128
  7   0.004595 172.31.29.138 -> 54.230.158.223 TCP 66 44775 > http [ACK] Seq=1 Ack=1 Win=27008 Len=0 TSval=7811417 TSecr=807361971
  8   0.004635 172.31.29.138 -> 54.230.158.223 HTTP 163 GET /10kb HTTP/1.1 
  9   0.005295 54.230.158.223 -> 172.31.29.138 TCP 66 http > 44775 [ACK] Seq=1 Ack=98 Win=14592 Len=0 TSval=807361971 TSecr=7811417
 10   0.029123 54.230.158.223 -> 172.31.29.138 HTTP 10761 HTTP/1.1 200 OK  (application/octet-stream)
 11   0.029135 172.31.29.138 -> 54.230.158.223 TCP 66 44775 > http [ACK] Seq=98 Ack=10696 Win=48384 Len=0 TSval=7811423 TSecr=807361974
 12   0.029309 172.31.29.138 -> 54.230.158.223 TCP 66 44775 > http [FIN, ACK] Seq=98 Ack=10696 Win=48384 Len=0 TSval=7811423 TSecr=807361974
 13   0.030050 54.230.158.223 -> 172.31.29.138 TCP 66 http > 44775 [FIN, ACK] Seq=10696 Ack=99 Win=14592 Len=0 TSval=807361974 TSecr=7811423
 14   0.030058 172.31.29.138 -> 54.230.158.223 TCP 66 44775 > http [ACK] Seq=99 Ack=10697 Win=48384 Len=0 TSval=7811424 TSecr=807361974
