[Measurement for 10kb at 20:37:10 19.37.2014] 
Tshark:

  1   0.000000 172.31.29.138 -> 172.31.0.2   DNS 89 Standard query 0x602b  A d1xvcg6dfvgaki.cloudfront.net
  2   0.000028 172.31.29.138 -> 172.31.0.2   DNS 89 Standard query 0xb76c  AAAA d1xvcg6dfvgaki.cloudfront.net
  3   0.000655   172.31.0.2 -> 172.31.29.138 DNS 217 Standard query response 0x602b  A 54.230.150.57 A 54.230.150.114 A 54.230.149.156 A 54.230.150.20 A 54.230.150.23 A 54.230.150.29 A 54.230.150.34 A 54.230.150.36
  4   0.000735   172.31.0.2 -> 172.31.29.138 DNS 170 Standard query response 0xb76c 
  5   0.003859 172.31.29.138 -> 54.230.150.57 TCP 74 58026 > http [SYN] Seq=0 Win=26883 Len=0 MSS=8961 SACK_PERM=1 TSval=3325858 TSecr=0 WS=128
  6   0.005290 54.230.150.57 -> 172.31.29.138 TCP 74 http > 58026 [SYN, ACK] Seq=0 Ack=1 Win=14480 Len=0 MSS=1460 SACK_PERM=1 TSval=1450816482 TSecr=3325858 WS=128
  7   0.005311 172.31.29.138 -> 54.230.150.57 TCP 66 58026 > http [ACK] Seq=1 Ack=1 Win=27008 Len=0 TSval=3325859 TSecr=1450816482
  8   0.005361 172.31.29.138 -> 54.230.150.57 HTTP 163 GET /10kb HTTP/1.1 
  9   0.006808 54.230.150.57 -> 172.31.29.138 TCP 66 http > 58026 [ACK] Seq=1 Ack=98 Win=14592 Len=0 TSval=1450816482 TSecr=3325859
 10   0.033039 54.230.150.57 -> 172.31.29.138 TCP 8897 [TCP segment of a reassembled PDU]
 11   0.033068 172.31.29.138 -> 54.230.150.57 TCP 66 58026 > http [ACK] Seq=98 Ack=8832 Win=44672 Len=0 TSval=3325865 TSecr=1450816484
 12   0.034515 54.230.150.57 -> 172.31.29.138 HTTP 1919 HTTP/1.1 200 OK  (application/octet-stream)
 13   0.034522 172.31.29.138 -> 54.230.150.57 TCP 66 58026 > http [ACK] Seq=98 Ack=10685 Win=48256 Len=0 TSval=3325866 TSecr=1450816485
 14   0.034676 172.31.29.138 -> 54.230.150.57 TCP 66 58026 > http [FIN, ACK] Seq=98 Ack=10685 Win=48256 Len=0 TSval=3325866 TSecr=1450816485
 15   0.035996 54.230.150.57 -> 172.31.29.138 TCP 66 http > 58026 [FIN, ACK] Seq=10685 Ack=99 Win=14592 Len=0 TSval=1450816485 TSecr=3325866
 16   0.036006 172.31.29.138 -> 54.230.150.57 TCP 66 58026 > http [ACK] Seq=99 Ack=10686 Win=48256 Len=0 TSval=3325866 TSecr=1450816485
