[Measurement for 10kb at 11:36:13 20.36.2014] 
Tshark:

  1   0.000000 172.31.29.138 -> 172.31.0.2   DNS 89 Standard query 0x8c21  A d1xvcg6dfvgaki.cloudfront.net
  2   0.000035 172.31.29.138 -> 172.31.0.2   DNS 89 Standard query 0xd529  AAAA d1xvcg6dfvgaki.cloudfront.net
  3   0.000630   172.31.0.2 -> 172.31.29.138 DNS 217 Standard query response 0x8c21  A 54.230.151.150 A 54.230.151.226 A 54.230.149.231 A 54.230.150.18 A 54.230.150.29 A 54.230.150.33 A 54.230.150.106 A 54.230.150.147
  4   0.000642   172.31.0.2 -> 172.31.29.138 DNS 170 Standard query response 0xd529 
  5   0.003922 172.31.29.138 -> 54.230.151.150 TCP 74 47498 > http [SYN] Seq=0 Win=26883 Len=0 MSS=8961 SACK_PERM=1 TSval=16811566 TSecr=0 WS=128
  6   0.005371 54.230.151.150 -> 172.31.29.138 TCP 74 http > 47498 [SYN, ACK] Seq=0 Ack=1 Win=14480 Len=0 MSS=1460 SACK_PERM=1 TSval=1456565705 TSecr=16811566 WS=128
  7   0.005385 172.31.29.138 -> 54.230.151.150 TCP 66 47498 > http [ACK] Seq=1 Ack=1 Win=27008 Len=0 TSval=16811567 TSecr=1456565705
  8   0.005431 172.31.29.138 -> 54.230.151.150 HTTP 163 GET /10kb HTTP/1.1 
  9   0.006759 54.230.151.150 -> 172.31.29.138 TCP 66 http > 47498 [ACK] Seq=1 Ack=98 Win=14592 Len=0 TSval=1456565705 TSecr=16811567
 10   0.009196 54.230.151.150 -> 172.31.29.138 HTTP 10761 HTTP/1.1 200 OK  (application/octet-stream)
 11   0.009208 172.31.29.138 -> 54.230.151.150 TCP 66 47498 > http [ACK] Seq=98 Ack=10696 Win=48384 Len=0 TSval=16811567 TSecr=1456565706
 12   0.009397 172.31.29.138 -> 54.230.151.150 TCP 66 47498 > http [FIN, ACK] Seq=98 Ack=10696 Win=48384 Len=0 TSval=16811568 TSecr=1456565706
 13   0.010911 54.230.151.150 -> 172.31.29.138 TCP 66 http > 47498 [FIN, ACK] Seq=10696 Ack=99 Win=14592 Len=0 TSval=1456565706 TSecr=16811568
 14   0.010920 172.31.29.138 -> 54.230.151.150 TCP 66 47498 > http [ACK] Seq=99 Ack=10697 Win=48384 Len=0 TSval=16811568 TSecr=1456565706
