[Measurement for 10kb at 21:36:13 19.36.2014] 
Tshark:

  1   0.000000 172.31.29.138 -> 172.31.0.2   DNS 89 Standard query 0x6c67  A d1xvcg6dfvgaki.cloudfront.net
  2   0.000029 172.31.29.138 -> 172.31.0.2   DNS 89 Standard query 0x8add  AAAA d1xvcg6dfvgaki.cloudfront.net
  3   0.000614   172.31.0.2 -> 172.31.29.138 DNS 217 Standard query response 0x6c67  A 54.192.156.109 A 54.230.156.193 A 54.230.157.230 A 54.230.158.152 A 54.230.158.182 A 54.230.158.217 A 54.230.158.223 A 54.230.158.252
  4   0.000624   172.31.0.2 -> 172.31.29.138 DNS 170 Standard query response 0x8add 
  5   0.003865 172.31.29.138 -> 54.192.156.109 TCP 74 55812 > http [SYN] Seq=0 Win=26883 Len=0 MSS=8961 SACK_PERM=1 TSval=4211548 TSecr=0 WS=128
  6   0.004387 54.192.156.109 -> 172.31.29.138 TCP 74 http > 55812 [SYN, ACK] Seq=0 Ack=1 Win=14480 Len=0 MSS=1460 SACK_PERM=1 TSval=833084517 TSecr=4211548 WS=128
  7   0.004400 172.31.29.138 -> 54.192.156.109 TCP 66 55812 > http [ACK] Seq=1 Ack=1 Win=27008 Len=0 TSval=4211548 TSecr=833084517
  8   0.004459 172.31.29.138 -> 54.192.156.109 HTTP 163 GET /10kb HTTP/1.1 
  9   0.005134 54.192.156.109 -> 172.31.29.138 TCP 66 http > 55812 [ACK] Seq=1 Ack=98 Win=14592 Len=0 TSval=833084517 TSecr=4211548
 10   0.007479 54.192.156.109 -> 172.31.29.138 TCP 2962 [TCP segment of a reassembled PDU]
 11   0.007489 172.31.29.138 -> 54.192.156.109 TCP 66 55812 > http [ACK] Seq=98 Ack=2897 Win=32768 Len=0 TSval=4211549 TSecr=833084517
 12   0.007562 54.192.156.109 -> 172.31.29.138 HTTP 7865 HTTP/1.1 200 OK  (application/octet-stream)
 13   0.007571 172.31.29.138 -> 54.192.156.109 TCP 66 55812 > http [ACK] Seq=98 Ack=10696 Win=48384 Len=0 TSval=4211549 TSecr=833084517
 14   0.007737 172.31.29.138 -> 54.192.156.109 TCP 66 55812 > http [FIN, ACK] Seq=98 Ack=10696 Win=48384 Len=0 TSval=4211549 TSecr=833084517
 15   0.008206 54.192.156.109 -> 172.31.29.138 TCP 66 http > 55812 [FIN, ACK] Seq=10696 Ack=99 Win=14592 Len=0 TSval=833084517 TSecr=4211549
 16   0.008214 172.31.29.138 -> 54.192.156.109 TCP 66 55812 > http [ACK] Seq=99 Ack=10697 Win=48384 Len=0 TSval=4211549 TSecr=833084517
