[Measurement for 10kb at 05:36:13 20.36.2014] 
Tshark:

  1   0.000000 172.31.29.138 -> 172.31.0.2   DNS 89 Standard query 0x804e  A d1xvcg6dfvgaki.cloudfront.net
  2   0.000028 172.31.29.138 -> 172.31.0.2   DNS 89 Standard query 0xd599  AAAA d1xvcg6dfvgaki.cloudfront.net
  3   0.000496   172.31.0.2 -> 172.31.29.138 DNS 217 Standard query response 0x804e  A 54.230.150.122 A 54.230.150.151 A 54.230.150.220 A 54.230.151.252 A 54.230.149.229 A 54.230.150.30 A 54.230.150.47 A 54.230.150.54
  4   0.000507   172.31.0.2 -> 172.31.29.138 DNS 170 Standard query response 0xd599 
  5   0.003873 172.31.29.138 -> 54.230.150.122 TCP 74 46248 > http [SYN] Seq=0 Win=26883 Len=0 MSS=8961 SACK_PERM=1 TSval=11411684 TSecr=0 WS=128
  6   0.005264 54.230.150.122 -> 172.31.29.138 TCP 74 http > 46248 [SYN, ACK] Seq=0 Ack=1 Win=14480 Len=0 MSS=1460 SACK_PERM=1 TSval=1454395925 TSecr=11411684 WS=128
  7   0.005279 172.31.29.138 -> 54.230.150.122 TCP 66 46248 > http [ACK] Seq=1 Ack=1 Win=27008 Len=0 TSval=11411685 TSecr=1454395925
  8   0.005327 172.31.29.138 -> 54.230.150.122 HTTP 163 GET /10kb HTTP/1.1 
  9   0.006700 54.230.150.122 -> 172.31.29.138 TCP 66 http > 46248 [ACK] Seq=1 Ack=98 Win=14592 Len=0 TSval=1454395925 TSecr=11411685
 10   0.009310 54.230.150.122 -> 172.31.29.138 TCP 4410 [TCP segment of a reassembled PDU]
 11   0.009318 172.31.29.138 -> 54.230.150.122 TCP 66 46248 > http [ACK] Seq=98 Ack=4345 Win=35584 Len=0 TSval=11411686 TSecr=1454395925
 12   0.009357 54.230.150.122 -> 172.31.29.138 HTTP 6417 HTTP/1.1 200 OK  (application/octet-stream)
 13   0.009364 172.31.29.138 -> 54.230.150.122 TCP 66 46248 > http [ACK] Seq=98 Ack=10696 Win=48384 Len=0 TSval=11411686 TSecr=1454395925
 14   0.009502 172.31.29.138 -> 54.230.150.122 TCP 66 46248 > http [FIN, ACK] Seq=98 Ack=10696 Win=48384 Len=0 TSval=11411686 TSecr=1454395925
 15   0.030642 54.230.150.122 -> 172.31.29.138 TCP 66 http > 46248 [FIN, ACK] Seq=10696 Ack=99 Win=14592 Len=0 TSval=1454395928 TSecr=11411686
 16   0.030651 172.31.29.138 -> 54.230.150.122 TCP 66 46248 > http [ACK] Seq=99 Ack=10697 Win=48384 Len=0 TSval=11411691 TSecr=1454395928
