[Measurement for 10kb at 12:36:13 20.36.2014] 
Tshark:

  1   0.000000 172.31.29.138 -> 172.31.0.2   DNS 89 Standard query 0xbb75  A d1xvcg6dfvgaki.cloudfront.net
  2   0.000028 172.31.29.138 -> 172.31.0.2   DNS 89 Standard query 0xb3d3  AAAA d1xvcg6dfvgaki.cloudfront.net
  3   0.000617   172.31.0.2 -> 172.31.29.138 DNS 217 Standard query response 0xbb75  A 54.192.159.164 A 54.192.159.168 A 54.192.159.180 A 54.230.158.141 A 54.230.158.149 A 54.230.158.223 A 54.230.158.225 A 54.230.159.132
  4   0.000627   172.31.0.2 -> 172.31.29.138 DNS 170 Standard query response 0xb3d3 
  5   0.003818 172.31.29.138 -> 54.192.159.164 TCP 74 35592 > http [SYN] Seq=0 Win=26883 Len=0 MSS=8961 SACK_PERM=1 TSval=17711612 TSecr=0 WS=128
  6   0.004493 54.192.159.164 -> 172.31.29.138 TCP 74 http > 35592 [SYN, ACK] Seq=0 Ack=1 Win=14480 Len=0 MSS=1460 SACK_PERM=1 TSval=733335581 TSecr=17711612 WS=128
  7   0.004510 172.31.29.138 -> 54.192.159.164 TCP 66 35592 > http [ACK] Seq=1 Ack=1 Win=27008 Len=0 TSval=17711612 TSecr=733335581
  8   0.004556 172.31.29.138 -> 54.192.159.164 HTTP 163 GET /10kb HTTP/1.1 
  9   0.005219 54.192.159.164 -> 172.31.29.138 TCP 66 http > 35592 [ACK] Seq=1 Ack=98 Win=14592 Len=0 TSval=733335581 TSecr=17711612
 10   0.008309 54.192.159.164 -> 172.31.29.138 TCP 1514 [TCP segment of a reassembled PDU]
 11   0.008316 172.31.29.138 -> 54.192.159.164 TCP 66 35592 > http [ACK] Seq=98 Ack=1449 Win=29824 Len=0 TSval=17711613 TSecr=733335581
 12   0.008572 54.192.159.164 -> 172.31.29.138 TCP 2962 [TCP segment of a reassembled PDU]
 13   0.008578 172.31.29.138 -> 54.192.159.164 TCP 66 35592 > http [ACK] Seq=98 Ack=4345 Win=35584 Len=0 TSval=17711613 TSecr=733335581
 14   0.008618 54.192.159.164 -> 172.31.29.138 HTTP 6417 HTTP/1.1 200 OK  (application/octet-stream)
 15   0.008626 172.31.29.138 -> 54.192.159.164 TCP 66 35592 > http [ACK] Seq=98 Ack=10696 Win=48384 Len=0 TSval=17711613 TSecr=733335581
 16   0.008756 172.31.29.138 -> 54.192.159.164 TCP 66 35592 > http [FIN, ACK] Seq=98 Ack=10696 Win=48384 Len=0 TSval=17711613 TSecr=733335581
 17   0.009338 54.192.159.164 -> 172.31.29.138 TCP 66 http > 35592 [FIN, ACK] Seq=10696 Ack=99 Win=14592 Len=0 TSval=733335581 TSecr=17711613
 18   0.009346 172.31.29.138 -> 54.192.159.164 TCP 66 35592 > http [ACK] Seq=99 Ack=10697 Win=48384 Len=0 TSval=17711614 TSecr=733335581
 19   0.549651 06:38:16:87:8c:c2 -> 06:4e:73:56:a6:a6 ARP 60 Who has 172.31.29.138?  Tell 172.31.16.1
