[Measurement for 10kb at 18:37:11 19.37.2014] 
Tshark:

  1   0.000000 172.31.29.138 -> 172.31.0.2   DNS 89 Standard query 0x8b65  A d1xzxs93r3iphc.cloudfront.net
  2   0.000033 172.31.29.138 -> 172.31.0.2   DNS 89 Standard query 0x9ee0  AAAA d1xzxs93r3iphc.cloudfront.net
  3   0.000774   172.31.0.2 -> 172.31.29.138 DNS 170 Standard query response 0x9ee0 
  4   0.000795   172.31.0.2 -> 172.31.29.138 DNS 217 Standard query response 0x8b65  A 54.230.158.152 A 54.230.158.182 A 54.230.159.6 A 54.192.159.74 A 54.192.159.157 A 54.230.157.230 A 54.230.158.80 A 54.230.158.150
  5   0.003924 172.31.29.138 -> 54.230.158.152 TCP 74 36838 > http [SYN] Seq=0 Win=26883 Len=0 MSS=8961 SACK_PERM=1 TSval=1526109 TSecr=0 WS=128
  6   0.004690 54.230.158.152 -> 172.31.29.138 TCP 74 http > 36838 [SYN, ACK] Seq=0 Ack=1 Win=14480 Len=0 MSS=1460 SACK_PERM=1 TSval=804812239 TSecr=1526109 WS=128
  7   0.004714 172.31.29.138 -> 54.230.158.152 TCP 66 36838 > http [ACK] Seq=1 Ack=1 Win=27008 Len=0 TSval=1526109 TSecr=804812239
  8   0.004770 172.31.29.138 -> 54.230.158.152 HTTP 163 GET /10kb HTTP/1.1 
  9   0.005392 54.230.158.152 -> 172.31.29.138 TCP 66 http > 36838 [ACK] Seq=1 Ack=98 Win=14592 Len=0 TSval=804812239 TSecr=1526109
 10   0.007622 54.230.158.152 -> 172.31.29.138 HTTP 10760 HTTP/1.1 200 OK  (application/octet-stream)
 11   0.007633 172.31.29.138 -> 54.230.158.152 TCP 66 36838 > http [ACK] Seq=98 Ack=10695 Win=48384 Len=0 TSval=1526110 TSecr=804812239
 12   0.007789 172.31.29.138 -> 54.230.158.152 TCP 66 36838 > http [FIN, ACK] Seq=98 Ack=10695 Win=48384 Len=0 TSval=1526110 TSecr=804812239
 13   0.009035 54.230.158.152 -> 172.31.29.138 TCP 66 http > 36838 [FIN, ACK] Seq=10695 Ack=99 Win=14592 Len=0 TSval=804812240 TSecr=1526110
 14   0.009043 172.31.29.138 -> 54.230.158.152 TCP 66 36838 > http [ACK] Seq=99 Ack=10696 Win=48384 Len=0 TSval=1526110 TSecr=804812240
