[Measurement for 10kb at 12:37:12 20.37.2014] 
Tshark:

  1   0.000000 172.31.29.138 -> 172.31.0.2   DNS 89 Standard query 0xfffe  A d1xzxs93r3iphc.cloudfront.net
  2   0.000034 172.31.29.138 -> 172.31.0.2   DNS 89 Standard query 0x47e3  AAAA d1xzxs93r3iphc.cloudfront.net
  3   0.000521   172.31.0.2 -> 172.31.29.138 DNS 217 Standard query response 0xfffe  A 54.192.156.109 A 54.192.157.155 A 54.192.157.156 A 54.192.159.168 A 54.230.158.173 A 54.230.158.243 A 54.230.159.4 A 54.230.159.141
  4   0.000531   172.31.0.2 -> 172.31.29.138 DNS 170 Standard query response 0x47e3 
  5   0.003875 172.31.29.138 -> 54.192.156.109 TCP 74 56499 > http [SYN] Seq=0 Win=26883 Len=0 MSS=8961 SACK_PERM=1 TSval=17726325 TSecr=0 WS=128
  6   0.004493 54.192.156.109 -> 172.31.29.138 TCP 74 http > 56499 [SYN, ACK] Seq=0 Ack=1 Win=14480 Len=0 MSS=1460 SACK_PERM=1 TSval=733341265 TSecr=17726325 WS=128
  7   0.004508 172.31.29.138 -> 54.192.156.109 TCP 66 56499 > http [ACK] Seq=1 Ack=1 Win=27008 Len=0 TSval=17726325 TSecr=733341265
  8   0.004561 172.31.29.138 -> 54.192.156.109 HTTP 163 GET /10kb HTTP/1.1 
  9   0.005223 54.192.156.109 -> 172.31.29.138 TCP 66 http > 56499 [ACK] Seq=1 Ack=98 Win=14592 Len=0 TSval=733341265 TSecr=17726325
 10   0.008585 54.192.156.109 -> 172.31.29.138 TCP 4410 [TCP segment of a reassembled PDU]
 11   0.008594 172.31.29.138 -> 54.192.156.109 TCP 66 56499 > http [ACK] Seq=98 Ack=4345 Win=35584 Len=0 TSval=17726326 TSecr=733341266
 12   0.008636 54.192.156.109 -> 172.31.29.138 HTTP 6417 HTTP/1.1 200 OK  (application/octet-stream)
 13   0.008644 172.31.29.138 -> 54.192.156.109 TCP 66 56499 > http [ACK] Seq=98 Ack=10696 Win=48384 Len=0 TSval=17726326 TSecr=733341266
 14   0.008772 172.31.29.138 -> 54.192.156.109 TCP 66 56499 > http [FIN, ACK] Seq=98 Ack=10696 Win=48384 Len=0 TSval=17726326 TSecr=733341266
 15   0.012443 54.192.156.109 -> 172.31.29.138 TCP 66 http > 56499 [FIN, ACK] Seq=10696 Ack=99 Win=14592 Len=0 TSval=733341266 TSecr=17726326
 16   0.012451 172.31.29.138 -> 54.192.156.109 TCP 66 56499 > http [ACK] Seq=99 Ack=10697 Win=48384 Len=0 TSval=17726327 TSecr=733341266
 17   0.738213 06:38:16:87:8c:c2 -> 06:4e:73:56:a6:a6 ARP 60 Who has 172.31.29.138?  Tell 172.31.16.1
