[Measurement for 10kb at 06:37:11 20.37.2014] 
Tshark:

  1   0.000000 172.31.29.138 -> 172.31.0.2   DNS 89 Standard query 0x92ff  A d1xzxs93r3iphc.cloudfront.net
  2   0.000026 172.31.29.138 -> 172.31.0.2   DNS 89 Standard query 0x87f9  AAAA d1xzxs93r3iphc.cloudfront.net
  3   0.000626   172.31.0.2 -> 172.31.29.138 DNS 170 Standard query response 0x87f9 
  4   0.000636   172.31.0.2 -> 172.31.29.138 DNS 217 Standard query response 0x92ff  A 54.230.158.238 A 54.230.159.7 A 54.230.159.132 A 54.192.157.146 A 54.192.159.180 A 54.230.156.193 A 54.230.158.188 A 54.230.158.191
  5   0.003824 172.31.29.138 -> 54.230.158.238 TCP 74 57138 > http [SYN] Seq=0 Win=26883 Len=0 MSS=8961 SACK_PERM=1 TSval=12326077 TSecr=0 WS=128
  6   0.004659 54.230.158.238 -> 172.31.29.138 TCP 74 http > 57138 [SYN, ACK] Seq=0 Ack=1 Win=14480 Len=0 MSS=1460 SACK_PERM=1 TSval=836358755 TSecr=12326077 WS=128
  7   0.004694 172.31.29.138 -> 54.230.158.238 TCP 66 57138 > http [ACK] Seq=1 Ack=1 Win=27008 Len=0 TSval=12326077 TSecr=836358755
  8   0.004734 172.31.29.138 -> 54.230.158.238 HTTP 163 GET /10kb HTTP/1.1 
  9   0.005323 54.230.158.238 -> 172.31.29.138 TCP 66 http > 57138 [ACK] Seq=1 Ack=98 Win=14592 Len=0 TSval=836358755 TSecr=12326077
 10   0.007649 54.230.158.238 -> 172.31.29.138 TCP 4410 [TCP segment of a reassembled PDU]
 11   0.007657 172.31.29.138 -> 54.230.158.238 TCP 66 57138 > http [ACK] Seq=98 Ack=4345 Win=35584 Len=0 TSval=12326078 TSecr=836358755
 12   0.007696 54.230.158.238 -> 172.31.29.138 HTTP 6417 HTTP/1.1 200 OK  (application/octet-stream)
 13   0.007702 172.31.29.138 -> 54.230.158.238 TCP 66 57138 > http [ACK] Seq=98 Ack=10696 Win=48384 Len=0 TSval=12326078 TSecr=836358755
 14   0.007844 172.31.29.138 -> 54.230.158.238 TCP 66 57138 > http [FIN, ACK] Seq=98 Ack=10696 Win=48384 Len=0 TSval=12326078 TSecr=836358755
 15   0.008374 54.230.158.238 -> 172.31.29.138 TCP 66 http > 57138 [FIN, ACK] Seq=10696 Ack=99 Win=14592 Len=0 TSval=836358755 TSecr=12326078
 16   0.008382 172.31.29.138 -> 54.230.158.238 TCP 66 57138 > http [ACK] Seq=99 Ack=10697 Win=48384 Len=0 TSval=12326078 TSecr=836358755
