[Measurement for 10kb at 08:37:11 20.37.2014] 
Tshark:

  1   0.000000 172.31.29.138 -> 172.31.0.2   DNS 89 Standard query 0x9557  A d1xzxs93r3iphc.cloudfront.net
  2   0.000027 172.31.29.138 -> 172.31.0.2   DNS 89 Standard query 0x34a1  AAAA d1xzxs93r3iphc.cloudfront.net
  3   0.000667   172.31.0.2 -> 172.31.29.138 DNS 217 Standard query response 0x9557  A 54.230.150.159 A 54.230.151.252 A 54.230.149.156 A 54.230.149.229 A 54.230.149.232 A 54.230.150.27 A 54.230.150.38 A 54.230.150.47
  4   0.000680   172.31.0.2 -> 172.31.29.138 DNS 170 Standard query response 0x34a1 
  5   0.003871 172.31.29.138 -> 54.230.150.159 TCP 74 53939 > http [SYN] Seq=0 Win=26883 Len=0 MSS=8961 SACK_PERM=1 TSval=14126119 TSecr=0 WS=128
  6   0.005224 54.230.150.159 -> 172.31.29.138 TCP 74 http > 53939 [SYN, ACK] Seq=0 Ack=1 Win=14480 Len=0 MSS=1460 SACK_PERM=1 TSval=447861822 TSecr=14126119 WS=128
  7   0.005239 172.31.29.138 -> 54.230.150.159 TCP 66 53939 > http [ACK] Seq=1 Ack=1 Win=27008 Len=0 TSval=14126119 TSecr=447861822
  8   0.005280 172.31.29.138 -> 54.230.150.159 HTTP 163 GET /10kb HTTP/1.1 
  9   0.006448 54.230.150.159 -> 172.31.29.138 TCP 66 http > 53939 [ACK] Seq=1 Ack=98 Win=14592 Len=0 TSval=447861822 TSecr=14126119
 10   0.008838 54.230.150.159 -> 172.31.29.138 TCP 1514 [TCP segment of a reassembled PDU]
 11   0.008847 172.31.29.138 -> 54.230.150.159 TCP 66 53939 > http [ACK] Seq=98 Ack=1449 Win=29824 Len=0 TSval=14126120 TSecr=447861823
 12   0.008861 54.230.150.159 -> 172.31.29.138 HTTP 9313 HTTP/1.1 200 OK  (application/octet-stream)
 13   0.008872 172.31.29.138 -> 54.230.150.159 TCP 66 53939 > http [ACK] Seq=98 Ack=10696 Win=48384 Len=0 TSval=14126120 TSecr=447861823
 14   0.009027 172.31.29.138 -> 54.230.150.159 TCP 66 53939 > http [FIN, ACK] Seq=98 Ack=10696 Win=48384 Len=0 TSval=14126120 TSecr=447861823
 15   0.010290 54.230.150.159 -> 172.31.29.138 TCP 66 http > 53939 [FIN, ACK] Seq=10696 Ack=99 Win=14592 Len=0 TSval=447861823 TSecr=14126120
 16   0.010299 172.31.29.138 -> 54.230.150.159 TCP 66 53939 > http [ACK] Seq=99 Ack=10697 Win=48384 Len=0 TSval=14126121 TSecr=447861823
