[Measurement for 10kb at 05:37:12 20.37.2014] 
Tshark:

  1   0.000000 172.31.29.138 -> 172.31.0.2   DNS 89 Standard query 0xbaea  A d1xzxs93r3iphc.cloudfront.net
  2   0.000027 172.31.29.138 -> 172.31.0.2   DNS 89 Standard query 0x738d  AAAA d1xzxs93r3iphc.cloudfront.net
  3   0.000569   172.31.0.2 -> 172.31.29.138 DNS 217 Standard query response 0xbaea  A 54.230.158.184 A 54.230.158.207 A 54.230.158.211 A 54.192.157.142 A 54.192.159.77 A 54.192.159.101 A 54.192.159.176 A 54.230.158.182
  4   0.000580   172.31.0.2 -> 172.31.29.138 DNS 170 Standard query response 0x738d 
  5   0.003795 172.31.29.138 -> 54.230.158.184 TCP 74 50126 > http [SYN] Seq=0 Win=26883 Len=0 MSS=8961 SACK_PERM=1 TSval=11426362 TSecr=0 WS=128
  6   0.004651 54.230.158.184 -> 172.31.29.138 TCP 74 http > 50126 [SYN, ACK] Seq=0 Ack=1 Win=14480 Len=0 MSS=1460 SACK_PERM=1 TSval=730820463 TSecr=11426362 WS=128
  7   0.004665 172.31.29.138 -> 54.230.158.184 TCP 66 50126 > http [ACK] Seq=1 Ack=1 Win=27008 Len=0 TSval=11426363 TSecr=730820463
  8   0.004706 172.31.29.138 -> 54.230.158.184 HTTP 163 GET /10kb HTTP/1.1 
  9   0.005371 54.230.158.184 -> 172.31.29.138 TCP 66 http > 50126 [ACK] Seq=1 Ack=98 Win=14592 Len=0 TSval=730820463 TSecr=11426363
 10   0.008296 54.230.158.184 -> 172.31.29.138 HTTP 10761 HTTP/1.1 200 OK  (application/octet-stream)
 11   0.008305 172.31.29.138 -> 54.230.158.184 TCP 66 50126 > http [ACK] Seq=98 Ack=10696 Win=48384 Len=0 TSval=11426364 TSecr=730820464
 12   0.008452 172.31.29.138 -> 54.230.158.184 TCP 66 50126 > http [FIN, ACK] Seq=98 Ack=10696 Win=48384 Len=0 TSval=11426364 TSecr=730820464
 13   0.009188 54.230.158.184 -> 172.31.29.138 TCP 66 http > 50126 [FIN, ACK] Seq=10696 Ack=99 Win=14592 Len=0 TSval=730820464 TSecr=11426364
 14   0.009197 172.31.29.138 -> 54.230.158.184 TCP 66 50126 > http [ACK] Seq=99 Ack=10697 Win=48384 Len=0 TSval=11426364 TSecr=730820464
