[Measurement for 100kb at 10:31:24 20.31.2014] 
Tshark:

  1   0.000000 172.31.36.109 -> 172.31.0.2   DNS 89 Standard query 0xd77c  A d1xvcg6dfvgaki.cloudfront.net
  2   0.000021 172.31.36.109 -> 172.31.0.2   DNS 89 Standard query 0xd0d7  AAAA d1xvcg6dfvgaki.cloudfront.net
  3   0.000561   172.31.0.2 -> 172.31.36.109 DNS 170 Standard query response 0xd0d7 
  4   0.000593   172.31.0.2 -> 172.31.36.109 DNS 217 Standard query response 0xd77c  A 54.230.30.223 A 54.192.29.221 A 54.230.29.238 A 54.230.29.242 A 54.230.30.8 A 54.230.30.69 A 54.230.30.189 A 54.230.30.213
  5   0.003870 172.31.36.109 -> 54.230.30.223 TCP 74 45258 > http [SYN] Seq=0 Win=26883 Len=0 MSS=8961 SACK_PERM=1 TSval=35792683 TSecr=0 WS=128
  6   0.005136 54.230.30.223 -> 172.31.36.109 TCP 74 http > 45258 [SYN, ACK] Seq=0 Ack=1 Win=14480 Len=0 MSS=1460 SACK_PERM=1 TSval=693693047 TSecr=35792683 WS=128
  7   0.005173 172.31.36.109 -> 54.230.30.223 TCP 66 45258 > http [ACK] Seq=1 Ack=1 Win=27008 Len=0 TSval=35792683 TSecr=693693047
  8   0.005210 172.31.36.109 -> 54.230.30.223 HTTP 164 GET /100kb HTTP/1.1 
  9   0.006495 54.230.30.223 -> 172.31.36.109 TCP 66 http > 45258 [ACK] Seq=1 Ack=99 Win=14592 Len=0 TSval=693693047 TSecr=35792683
 10   0.022423 54.230.30.223 -> 172.31.36.109 TCP 4410 [TCP segment of a reassembled PDU]
 11   0.022431 172.31.36.109 -> 54.230.30.223 TCP 66 45258 > http [ACK] Seq=99 Ack=4345 Win=35584 Len=0 TSval=35792688 TSecr=693693049
 12   0.022486 54.230.30.223 -> 172.31.36.109 TCP 10202 [TCP segment of a reassembled PDU]
 13   0.022502 172.31.36.109 -> 54.230.30.223 TCP 66 45258 > http [ACK] Seq=99 Ack=14481 Win=55936 Len=0 TSval=35792688 TSecr=693693049
 14   0.024038 54.230.30.223 -> 172.31.36.109 TCP 13098 [TCP segment of a reassembled PDU]
 15   0.024048 172.31.36.109 -> 54.230.30.223 TCP 66 45258 > http [ACK] Seq=99 Ack=27513 Win=81920 Len=0 TSval=35792688 TSecr=693693049
 16   0.025247 54.230.30.223 -> 172.31.36.109 TCP 1514 [TCP segment of a reassembled PDU]
 17   0.025253 172.31.36.109 -> 54.230.30.223 TCP 66 45258 > http [ACK] Seq=99 Ack=28961 Win=84864 Len=0 TSval=35792688 TSecr=693693049
 18   0.025258 54.230.30.223 -> 172.31.36.109 TCP 1514 [TCP segment of a reassembled PDU]
 19   0.025262 172.31.36.109 -> 54.230.30.223 TCP 66 45258 > http [ACK] Seq=99 Ack=30409 Win=87808 Len=0 TSval=35792688 TSecr=693693049
 20   0.025357 54.230.30.223 -> 172.31.36.109 TCP 10202 [TCP segment of a reassembled PDU]
 21   0.025364 172.31.36.109 -> 54.230.30.223 TCP 66 45258 > http [ACK] Seq=99 Ack=40545 Win=101248 Len=0 TSval=35792688 TSecr=693693049
 22   0.026634 54.230.30.223 -> 172.31.36.109 TCP 1514 [TCP segment of a reassembled PDU]
 23   0.026646 172.31.36.109 -> 54.230.30.223 TCP 66 45258 > http [ACK] Seq=99 Ack=41993 Win=109056 Len=0 TSval=35792689 TSecr=693693049
 24   0.026809 54.230.30.223 -> 172.31.36.109 TCP 21786 [TCP segment of a reassembled PDU]
 25   0.026821 172.31.36.109 -> 54.230.30.223 TCP 66 45258 > http [ACK] Seq=99 Ack=63713 Win=152448 Len=0 TSval=35792689 TSecr=693693049
 26   0.027847 54.230.30.223 -> 172.31.36.109 TCP 2962 [TCP segment of a reassembled PDU]
 27   0.027852 172.31.36.109 -> 54.230.30.223 TCP 66 45258 > http [ACK] Seq=99 Ack=66609 Win=158336 Len=0 TSval=35792689 TSecr=693693049
 28   0.028344 54.230.30.223 -> 172.31.36.109 TCP 2962 [TCP segment of a reassembled PDU]
 29   0.028349 172.31.36.109 -> 54.230.30.223 TCP 66 45258 > http [ACK] Seq=99 Ack=69505 Win=164096 Len=0 TSval=35792689 TSecr=693693049
 30   0.028446 54.230.30.223 -> 172.31.36.109 TCP 13098 [TCP segment of a reassembled PDU]
 31   0.028455 172.31.36.109 -> 54.230.30.223 TCP 66 45258 > http [ACK] Seq=99 Ack=82537 Win=190208 Len=0 TSval=35792689 TSecr=693693049
 32   0.028528 54.230.30.223 -> 172.31.36.109 TCP 7306 [TCP segment of a reassembled PDU]
 33   0.028535 172.31.36.109 -> 54.230.30.223 TCP 66 45258 > http [ACK] Seq=99 Ack=89777 Win=204672 Len=0 TSval=35792689 TSecr=693693049
 34   0.029659 54.230.30.223 -> 172.31.36.109 TCP 4410 [TCP segment of a reassembled PDU]
 35   0.029665 172.31.36.109 -> 54.230.30.223 TCP 66 45258 > http [ACK] Seq=99 Ack=94121 Win=213376 Len=0 TSval=35792689 TSecr=693693049
 36   0.029757 54.230.30.223 -> 172.31.36.109 TCP 8754 [TCP segment of a reassembled PDU]
 37   0.029764 172.31.36.109 -> 54.230.30.223 TCP 66 45258 > http [ACK] Seq=99 Ack=102809 Win=230656 Len=0 TSval=35792690 TSecr=693693049
 38   0.029768 54.230.30.223 -> 172.31.36.109 HTTP 114 HTTP/1.1 200 OK  (application/octet-stream)
 39   0.029770 172.31.36.109 -> 54.230.30.223 TCP 66 45258 > http [ACK] Seq=99 Ack=102857 Win=230656 Len=0 TSval=35792690 TSecr=693693049
 40   0.029878 172.31.36.109 -> 54.230.30.223 TCP 66 45258 > http [FIN, ACK] Seq=99 Ack=102857 Win=230656 Len=0 TSval=35792690 TSecr=693693049
 41   0.031109 54.230.30.223 -> 172.31.36.109 TCP 66 http > 45258 [FIN, ACK] Seq=102857 Ack=100 Win=14592 Len=0 TSval=693693049 TSecr=35792690
 42   0.031118 172.31.36.109 -> 54.230.30.223 TCP 66 45258 > http [ACK] Seq=100 Ack=102858 Win=230656 Len=0 TSval=35792690 TSecr=693693049
