[Measurement for 100kb at 08:31:25 20.31.2014] 
Tshark:

  1   0.000000 172.31.36.109 -> 172.31.0.2   DNS 89 Standard query 0x8dc9  A d1xvcg6dfvgaki.cloudfront.net
  2   0.000028 172.31.36.109 -> 172.31.0.2   DNS 89 Standard query 0xbb77  AAAA d1xvcg6dfvgaki.cloudfront.net
  3   0.000587   172.31.0.2 -> 172.31.36.109 DNS 217 Standard query response 0x8dc9  A 54.192.30.216 A 54.230.30.8 A 54.230.30.58 A 54.230.30.230 A 54.230.30.247 A 54.230.30.248 A 54.230.30.254 A 54.192.29.221
  4   0.000600   172.31.0.2 -> 172.31.36.109 DNS 170 Standard query response 0xbb77 
  5   0.003790 172.31.36.109 -> 54.192.30.216 TCP 74 60830 > http [SYN] Seq=0 Win=26883 Len=0 MSS=8961 SACK_PERM=1 TSval=33993014 TSecr=0 WS=128
  6   0.004944 54.192.30.216 -> 172.31.36.109 TCP 74 http > 60830 [SYN, ACK] Seq=0 Ack=1 Win=14480 Len=0 MSS=1460 SACK_PERM=1 TSval=833562947 TSecr=33993014 WS=128
  7   0.004958 172.31.36.109 -> 54.192.30.216 TCP 66 60830 > http [ACK] Seq=1 Ack=1 Win=27008 Len=0 TSval=33993014 TSecr=833562947
  8   0.005000 172.31.36.109 -> 54.192.30.216 HTTP 164 GET /100kb HTTP/1.1 
  9   0.006205 54.192.30.216 -> 172.31.36.109 TCP 66 http > 60830 [ACK] Seq=1 Ack=99 Win=14592 Len=0 TSval=833562947 TSecr=33993014
 10   0.028319 54.192.30.216 -> 172.31.36.109 TCP 4410 [TCP segment of a reassembled PDU]
 11   0.028334 172.31.36.109 -> 54.192.30.216 TCP 66 60830 > http [ACK] Seq=99 Ack=4345 Win=35584 Len=0 TSval=33993020 TSecr=833562949
 12   0.028402 54.192.30.216 -> 172.31.36.109 TCP 4410 [TCP segment of a reassembled PDU]
 13   0.028409 172.31.36.109 -> 54.192.30.216 TCP 66 60830 > http [ACK] Seq=99 Ack=8689 Win=44288 Len=0 TSval=33993020 TSecr=833562949
 14   0.028435 54.192.30.216 -> 172.31.36.109 TCP 5476 [TCP segment of a reassembled PDU]
 15   0.028442 172.31.36.109 -> 54.192.30.216 TCP 66 60830 > http [ACK] Seq=99 Ack=14099 Win=55168 Len=0 TSval=33993020 TSecr=833562949
 16   0.029641 54.192.30.216 -> 172.31.36.109 TCP 11650 [TCP segment of a reassembled PDU]
 17   0.029651 172.31.36.109 -> 54.192.30.216 TCP 66 60830 > http [ACK] Seq=99 Ack=25683 Win=78336 Len=0 TSval=33993020 TSecr=833562949
 18   0.029775 54.192.30.216 -> 172.31.36.109 TCP 1514 [TCP segment of a reassembled PDU]
 19   0.029780 172.31.36.109 -> 54.192.30.216 TCP 66 60830 > http [ACK] Seq=99 Ack=27131 Win=81152 Len=0 TSval=33993020 TSecr=833562949
 20   0.030795 54.192.30.216 -> 172.31.36.109 TCP 4410 [TCP segment of a reassembled PDU]
 21   0.030801 172.31.36.109 -> 54.192.30.216 TCP 66 60830 > http [ACK] Seq=99 Ack=31475 Win=89856 Len=0 TSval=33993021 TSecr=833562949
 22   0.030843 54.192.30.216 -> 172.31.36.109 TCP 8754 [TCP segment of a reassembled PDU]
 23   0.030850 172.31.36.109 -> 54.192.30.216 TCP 66 60830 > http [ACK] Seq=99 Ack=40163 Win=107264 Len=0 TSval=33993021 TSecr=833562949
 24   0.031054 54.192.30.216 -> 172.31.36.109 TCP 4410 [TCP segment of a reassembled PDU]
 25   0.031060 172.31.36.109 -> 54.192.30.216 TCP 66 60830 > http [ACK] Seq=99 Ack=44507 Win=115968 Len=0 TSval=33993021 TSecr=833562949
 26   0.031108 54.192.30.216 -> 172.31.36.109 TCP 4410 [TCP segment of a reassembled PDU]
 27   0.031113 172.31.36.109 -> 54.192.30.216 TCP 66 60830 > http [ACK] Seq=99 Ack=48851 Win=124672 Len=0 TSval=33993021 TSecr=833562949
 28   0.032104 54.192.30.216 -> 172.31.36.109 TCP 7306 [TCP segment of a reassembled PDU]
 29   0.032111 172.31.36.109 -> 54.192.30.216 TCP 66 60830 > http [ACK] Seq=99 Ack=56091 Win=139136 Len=0 TSval=33993021 TSecr=833562949
 30   0.032169 54.192.30.216 -> 172.31.36.109 TCP 8754 [TCP segment of a reassembled PDU]
 31   0.032176 172.31.36.109 -> 54.192.30.216 TCP 66 60830 > http [ACK] Seq=99 Ack=64779 Win=156544 Len=0 TSval=33993021 TSecr=833562949
 32   0.032376 54.192.30.216 -> 172.31.36.109 TCP 11650 [TCP segment of a reassembled PDU]
 33   0.032384 172.31.36.109 -> 54.192.30.216 TCP 66 60830 > http [ACK] Seq=99 Ack=76363 Win=179200 Len=0 TSval=33993021 TSecr=833562950
 34   0.033355 54.192.30.216 -> 172.31.36.109 TCP 4410 [TCP segment of a reassembled PDU]
 35   0.033360 172.31.36.109 -> 54.192.30.216 TCP 66 60830 > http [ACK] Seq=99 Ack=80707 Win=188416 Len=0 TSval=33993021 TSecr=833562950
 36   0.033439 54.192.30.216 -> 172.31.36.109 TCP 7306 [TCP segment of a reassembled PDU]
 37   0.033446 172.31.36.109 -> 54.192.30.216 TCP 66 60830 > http [ACK] Seq=99 Ack=87947 Win=186368 Len=0 TSval=33993021 TSecr=833562950
 38   0.033513 54.192.30.216 -> 172.31.36.109 TCP 4410 [TCP segment of a reassembled PDU]
 39   0.033519 172.31.36.109 -> 54.192.30.216 TCP 66 60830 > http [ACK] Seq=99 Ack=92291 Win=191104 Len=0 TSval=33993021 TSecr=833562950
 40   0.033592 54.192.30.216 -> 172.31.36.109 TCP 1514 [TCP segment of a reassembled PDU]
 41   0.033597 172.31.36.109 -> 54.192.30.216 TCP 66 60830 > http [ACK] Seq=99 Ack=93739 Win=195840 Len=0 TSval=33993021 TSecr=833562950
 42   0.033692 54.192.30.216 -> 172.31.36.109 TCP 5858 [TCP segment of a reassembled PDU]
 43   0.033698 172.31.36.109 -> 54.192.30.216 TCP 66 60830 > http [ACK] Seq=99 Ack=99531 Win=190080 Len=0 TSval=33993021 TSecr=833562950
 44   0.033860 54.192.30.216 -> 172.31.36.109 HTTP 3392 HTTP/1.1 200 OK  (application/octet-stream)
 45   0.033864 172.31.36.109 -> 54.192.30.216 TCP 66 60830 > http [ACK] Seq=99 Ack=102857 Win=191104 Len=0 TSval=33993021 TSecr=833562950
 46   0.033998 172.31.36.109 -> 54.192.30.216 TCP 66 60830 > http [FIN, ACK] Seq=99 Ack=102857 Win=196992 Len=0 TSval=33993021 TSecr=833562950
 47   0.034972 54.192.30.216 -> 172.31.36.109 TCP 66 http > 60830 [FIN, ACK] Seq=102857 Ack=100 Win=14592 Len=0 TSval=833562950 TSecr=33993021
 48   0.034981 172.31.36.109 -> 54.192.30.216 TCP 66 60830 > http [ACK] Seq=100 Ack=102858 Win=196992 Len=0 TSval=33993022 TSecr=833562950
