[Measurement for 100kb at 22:31:20 19.31.2014] 
Tshark:

  1   0.000000 172.31.36.109 -> 172.31.0.2   DNS 89 Standard query 0x48d1  A d1xvcg6dfvgaki.cloudfront.net
  2   0.000028 172.31.36.109 -> 172.31.0.2   DNS 89 Standard query 0xed9e  AAAA d1xvcg6dfvgaki.cloudfront.net
  3   0.000568   172.31.0.2 -> 172.31.36.109 DNS 217 Standard query response 0x48d1  A 54.230.31.6 A 54.230.30.4 A 54.230.30.41 A 54.230.30.59 A 54.230.30.73 A 54.230.30.206 A 54.230.30.232 A 54.230.30.240
  4   0.000579   172.31.0.2 -> 172.31.36.109 DNS 170 Standard query response 0xed9e 
  5   0.003889 172.31.36.109 -> 54.230.31.6  TCP 74 34897 > http [SYN] Seq=0 Win=26883 Len=0 MSS=8961 SACK_PERM=1 TSval=24991787 TSecr=0 WS=128
  6   0.005050  54.230.31.6 -> 172.31.36.109 TCP 74 http > 34897 [SYN, ACK] Seq=0 Ack=1 Win=14480 Len=0 MSS=1460 SACK_PERM=1 TSval=829880938 TSecr=24991787 WS=128
  7   0.005084 172.31.36.109 -> 54.230.31.6  TCP 66 34897 > http [ACK] Seq=1 Ack=1 Win=27008 Len=0 TSval=24991787 TSecr=829880938
  8   0.005121 172.31.36.109 -> 54.230.31.6  HTTP 164 GET /100kb HTTP/1.1 
  9   0.006275  54.230.31.6 -> 172.31.36.109 TCP 66 http > 34897 [ACK] Seq=1 Ack=99 Win=14592 Len=0 TSval=829880938 TSecr=24991787
 10   0.053207  54.230.31.6 -> 172.31.36.109 TCP 13098 [TCP segment of a reassembled PDU]
 11   0.053219 172.31.36.109 -> 54.230.31.6  TCP 66 34897 > http [ACK] Seq=99 Ack=13033 Win=52992 Len=0 TSval=24991799 TSecr=829880943
 12   0.054486  54.230.31.6 -> 172.31.36.109 TCP 13098 [TCP segment of a reassembled PDU]
 13   0.054508 172.31.36.109 -> 54.230.31.6  TCP 66 34897 > http [ACK] Seq=99 Ack=26065 Win=79104 Len=0 TSval=24991799 TSecr=829880943
 14   0.055782  54.230.31.6 -> 172.31.36.109 TCP 13098 [TCP segment of a reassembled PDU]
 15   0.055791 172.31.36.109 -> 54.230.31.6  TCP 66 34897 > http [ACK] Seq=99 Ack=39097 Win=96512 Len=0 TSval=24991800 TSecr=829880943
 16   0.057077  54.230.31.6 -> 172.31.36.109 TCP 13098 [TCP segment of a reassembled PDU]
 17   0.057086 172.31.36.109 -> 54.230.31.6  TCP 66 34897 > http [ACK] Seq=99 Ack=52129 Win=96512 Len=0 TSval=24991800 TSecr=829880943
 18   0.058320  54.230.31.6 -> 172.31.36.109 TCP 5858 [TCP segment of a reassembled PDU]
 19   0.058341 172.31.36.109 -> 54.230.31.6  TCP 66 34897 > http [ACK] Seq=99 Ack=57921 Win=116736 Len=0 TSval=24991800 TSecr=829880943
 20   0.058359  54.230.31.6 -> 172.31.36.109 TCP 14546 [TCP segment of a reassembled PDU]
 21   0.058370 172.31.36.109 -> 54.230.31.6  TCP 66 34897 > http [ACK] Seq=99 Ack=72401 Win=145664 Len=0 TSval=24991800 TSecr=829880943
 22   0.059569  54.230.31.6 -> 172.31.36.109 TCP 4410 [TCP segment of a reassembled PDU]
 23   0.059596 172.31.36.109 -> 54.230.31.6  TCP 66 34897 > http [ACK] Seq=99 Ack=76745 Win=154368 Len=0 TSval=24991801 TSecr=829880944
 24   0.059639  54.230.31.6 -> 172.31.36.109 TCP 13098 [TCP segment of a reassembled PDU]
 25   0.059648 172.31.36.109 -> 54.230.31.6  TCP 66 34897 > http [ACK] Seq=99 Ack=89777 Win=180480 Len=0 TSval=24991801 TSecr=829880944
 26   0.059824  54.230.31.6 -> 172.31.36.109 TCP 5858 [TCP segment of a reassembled PDU]
 27   0.059830 172.31.36.109 -> 54.230.31.6  TCP 66 34897 > http [ACK] Seq=99 Ack=95569 Win=192000 Len=0 TSval=24991801 TSecr=829880944
 28   0.060820  54.230.31.6 -> 172.31.36.109 TCP 4410 [TCP segment of a reassembled PDU]
 29   0.060833 172.31.36.109 -> 54.230.31.6  TCP 66 34897 > http [ACK] Seq=99 Ack=99913 Win=200704 Len=0 TSval=24991801 TSecr=829880944
 30   0.060889  54.230.31.6 -> 172.31.36.109 TCP 1132 [TCP segment of a reassembled PDU]
 31   0.060893 172.31.36.109 -> 54.230.31.6  TCP 66 34897 > http [ACK] Seq=99 Ack=100979 Win=203648 Len=0 TSval=24991801 TSecr=829880944
 32   0.261412  54.230.31.6 -> 172.31.36.109 HTTP 1944 HTTP/1.1 200 OK  (application/octet-stream)
 33   0.261423 172.31.36.109 -> 54.230.31.6  TCP 66 34897 > http [ACK] Seq=99 Ack=102857 Win=207360 Len=0 TSval=24991851 TSecr=829880964
 34   0.261543 172.31.36.109 -> 54.230.31.6  TCP 66 34897 > http [FIN, ACK] Seq=99 Ack=102857 Win=207360 Len=0 TSval=24991851 TSecr=829880964
 35   0.263014  54.230.31.6 -> 172.31.36.109 TCP 66 http > 34897 [FIN, ACK] Seq=102857 Ack=100 Win=14592 Len=0 TSval=829880964 TSecr=24991851
 36   0.263022 172.31.36.109 -> 54.230.31.6  TCP 66 34897 > http [ACK] Seq=100 Ack=102858 Win=207360 Len=0 TSval=24991851 TSecr=829880964
