[Measurement for 1kb at 19:01:59 16.01.2014] 
Tshark:

  1   0.000000  192.168.1.2 -> 54.230.98.242 TCP 66 64132→80 [SYN] Seq=0 Win=8192 Len=0 MSS=1460 WS=256 SACK_PERM=1
  2   0.063848 54.230.98.242 -> 192.168.1.2  TCP 66 80→64132 [SYN, ACK] Seq=0 Ack=1 Win=14600 Len=0 MSS=1400 SACK_PERM=1 WS=128
  3   0.064016  192.168.1.2 -> 54.230.98.242 TCP 54 64132→80 [ACK] Seq=1 Ack=1 Win=65792 Len=0
  4   0.064213  192.168.1.2 -> 54.230.98.242 HTTP 150 GET /1kb HTTP/1.1 
  5   0.091382 54.230.98.242 -> 192.168.1.2  TCP 54 80→64132 [ACK] Seq=1 Ack=97 Win=14720 Len=0
  6   0.102107 54.230.98.242 -> 192.168.1.2  TCP 1454 [TCP segment of a reassembled PDU]
  7   0.103160 54.230.98.242 -> 192.168.1.2  HTTP 132 HTTP/1.1 200 OK  (application/octet-stream)
  8   0.103236  192.168.1.2 -> 54.230.98.242 TCP 54 64132→80 [ACK] Seq=97 Ack=1479 Win=65792 Len=0
  9   0.103371  192.168.1.2 -> 54.230.98.242 TCP 54 64132→80 [FIN, ACK] Seq=97 Ack=1479 Win=65792 Len=0
 10   0.130213 54.230.98.242 -> 192.168.1.2  TCP 54 80→64132 [FIN, ACK] Seq=1479 Ack=98 Win=14720 Len=0
 11   0.130377  192.168.1.2 -> 54.230.98.242 TCP 54 64132→80 [ACK] Seq=98 Ack=1480 Win=65792 Len=0
