[Measurement for 1kb at 08:38:06 20.38.2014] 
Tshark:

  1   0.000000 172.31.29.138 -> 172.31.0.2   DNS 89 Standard query 0xd251  A d1n0gskdvzj94j.cloudfront.net
  2   0.000026 172.31.29.138 -> 172.31.0.2   DNS 89 Standard query 0xb794  AAAA d1n0gskdvzj94j.cloudfront.net
  3   0.000989   172.31.0.2 -> 172.31.29.138 DNS 217 Standard query response 0xd251  A 54.230.148.165 A 54.230.149.156 A 54.230.150.26 A 54.230.150.40 A 54.230.150.45 A 54.230.150.69 A 54.230.151.182 A 54.230.151.236
  4   0.003966   172.31.0.2 -> 172.31.29.138 DNS 176 Standard query response 0xb794 
  5   0.011997 172.31.29.138 -> 54.230.148.165 TCP 74 41583 > http [SYN] Seq=0 Win=26883 Len=0 MSS=8961 SACK_PERM=1 TSval=14139826 TSecr=0 WS=128
  6   0.013508 54.230.148.165 -> 172.31.29.138 TCP 74 http > 41583 [SYN, ACK] Seq=0 Ack=1 Win=14480 Len=0 MSS=1460 SACK_PERM=1 TSval=1455004899 TSecr=14139826 WS=128
  7   0.013522 172.31.29.138 -> 54.230.148.165 TCP 66 41583 > http [ACK] Seq=1 Ack=1 Win=27008 Len=0 TSval=14139826 TSecr=1455004899
  8   0.013566 172.31.29.138 -> 54.230.148.165 HTTP 162 GET /1kb HTTP/1.1 
  9   0.015014 54.230.148.165 -> 172.31.29.138 TCP 66 http > 41583 [ACK] Seq=1 Ack=97 Win=14592 Len=0 TSval=1455004899 TSecr=14139826
 10   0.017118 54.230.148.165 -> 172.31.29.138 HTTP 1544 HTTP/1.1 200 OK  (application/octet-stream)
 11   0.017125 172.31.29.138 -> 54.230.148.165 TCP 66 41583 > http [ACK] Seq=97 Ack=1479 Win=29952 Len=0 TSval=14139827 TSecr=1455004900
 12   0.017276 172.31.29.138 -> 54.230.148.165 TCP 66 41583 > http [FIN, ACK] Seq=97 Ack=1479 Win=29952 Len=0 TSval=14139827 TSecr=1455004900
 13   0.018938 54.230.148.165 -> 172.31.29.138 TCP 66 http > 41583 [FIN, ACK] Seq=1479 Ack=98 Win=14592 Len=0 TSval=1455004900 TSecr=14139827
 14   0.018945 172.31.29.138 -> 54.230.148.165 TCP 66 41583 > http [ACK] Seq=98 Ack=1480 Win=29952 Len=0 TSval=14139828 TSecr=1455004900
