[Measurement for 10kb at 09:00:19 17.00.2014] 
Tshark:

  1   0.000000  192.168.1.2 -> 54.230.99.53 TCP 66 51377→80 [SYN] Seq=0 Win=8192 Len=0 MSS=1460 WS=256 SACK_PERM=1
  2   0.059138 54.230.99.53 -> 192.168.1.2  TCP 66 80→51377 [SYN, ACK] Seq=0 Ack=1 Win=14600 Len=0 MSS=1400 SACK_PERM=1 WS=128
  3   0.059295  192.168.1.2 -> 54.230.99.53 TCP 54 51377→80 [ACK] Seq=1 Ack=1 Win=65792 Len=0
  4   0.059476  192.168.1.2 -> 54.230.99.53 HTTP 151 GET /10kb HTTP/1.1 
  5   0.090699 54.230.99.53 -> 192.168.1.2  TCP 54 80→51377 [ACK] Seq=1 Ack=98 Win=14720 Len=0
  6   0.098728 54.230.99.53 -> 192.168.1.2  TCP 1454 [TCP segment of a reassembled PDU]
  7   0.099746 54.230.99.53 -> 192.168.1.2  TCP 1454 [TCP segment of a reassembled PDU]
  8   0.099859  192.168.1.2 -> 54.230.99.53 TCP 54 51377→80 [ACK] Seq=98 Ack=2801 Win=65792 Len=0
  9   0.101024 54.230.99.53 -> 192.168.1.2  TCP 1454 [TCP segment of a reassembled PDU]
 10   0.101081 54.230.99.53 -> 192.168.1.2  TCP 1454 [TCP segment of a reassembled PDU]
 11   0.101130  192.168.1.2 -> 54.230.99.53 TCP 54 51377→80 [ACK] Seq=98 Ack=5601 Win=65792 Len=0
 12   0.101212 54.230.99.53 -> 192.168.1.2  TCP 1454 [TCP segment of a reassembled PDU]
 13   0.101247 54.230.99.53 -> 192.168.1.2  TCP 1454 [TCP segment of a reassembled PDU]
 14   0.101283  192.168.1.2 -> 54.230.99.53 TCP 54 51377→80 [ACK] Seq=98 Ack=8401 Win=65792 Len=0
 15   0.101361 54.230.99.53 -> 192.168.1.2  TCP 1454 [TCP segment of a reassembled PDU]
 16   0.102151 54.230.99.53 -> 192.168.1.2  HTTP 949 HTTP/1.1 200 OK  (application/octet-stream)
 17   0.102239  192.168.1.2 -> 54.230.99.53 TCP 54 51377→80 [ACK] Seq=98 Ack=10696 Win=65792 Len=0
 18   0.102341  192.168.1.2 -> 54.230.99.53 TCP 54 51377→80 [FIN, ACK] Seq=98 Ack=10696 Win=65792 Len=0
 19   0.132705 54.230.99.53 -> 192.168.1.2  TCP 54 80→51377 [FIN, ACK] Seq=10696 Ack=99 Win=14720 Len=0
 20   0.132827  192.168.1.2 -> 54.230.99.53 TCP 54 51377→80 [ACK] Seq=99 Ack=10697 Win=65792 Len=0
 21   0.802461 64.233.164.125 -> 192.168.1.2  TCP 76 [TCP segment of a reassembled PDU]
 22   0.822095  192.168.1.2 -> 64.233.164.125 TCP 54 50147→5222 [ACK] Seq=1 Ack=23 Win=251 Len=0
 23   0.979456 64.233.164.189 -> 192.168.1.2  TLSv1.2 105 Application Data
 24   1.010250  192.168.1.2 -> 64.233.164.189 TCP 54 50752→443 [ACK] Seq=1 Ack=52 Win=255 Len=0
