[Measurement for 10kb at 22:00:18 16.00.2014] 
Tshark:

  1   0.000000 23.21.88.158 -> 192.168.1.2  TLSv1.2 85 Encrypted Alert
  2   0.001244 23.21.88.158 -> 192.168.1.2  TCP 54 443→49185 [FIN, ACK] Seq=32 Ack=1 Win=92 Len=0
  3   0.001298  192.168.1.2 -> 23.21.88.158 TCP 54 49185→443 [ACK] Seq=1 Ack=33 Win=253 Len=0
  4   0.060114 23.21.88.158 -> 192.168.1.2  TLSv1.2 85 Encrypted Alert
  5   0.062936 23.21.88.158 -> 192.168.1.2  TCP 54 443→49183 [FIN, ACK] Seq=32 Ack=1 Win=70 Len=0
  6   0.063002  192.168.1.2 -> 23.21.88.158 TCP 54 49183→443 [ACK] Seq=1 Ack=33 Win=252 Len=0
  7   0.121513  192.168.1.2 -> 54.230.98.222 TCP 66 49194→80 [SYN] Seq=0 Win=8192 Len=0 MSS=1460 WS=256 SACK_PERM=1
  8   0.150352 54.230.98.222 -> 192.168.1.2  TCP 66 80→49194 [SYN, ACK] Seq=0 Ack=1 Win=14600 Len=0 MSS=1400 SACK_PERM=1 WS=128
  9   0.150533  192.168.1.2 -> 54.230.98.222 TCP 54 49194→80 [ACK] Seq=1 Ack=1 Win=65792 Len=0
 10   0.150720  192.168.1.2 -> 54.230.98.222 HTTP 151 GET /10kb HTTP/1.1 
 11   0.184205 54.230.98.222 -> 192.168.1.2  TCP 54 80→49194 [ACK] Seq=1 Ack=98 Win=14720 Len=0
 12   0.188485 54.230.98.222 -> 192.168.1.2  TCP 1454 [TCP segment of a reassembled PDU]
 13   0.189059 54.230.98.222 -> 192.168.1.2  TCP 1454 [TCP segment of a reassembled PDU]
 14   0.189155  192.168.1.2 -> 54.230.98.222 TCP 54 49194→80 [ACK] Seq=98 Ack=2801 Win=65792 Len=0
 15   0.190897 54.230.98.222 -> 192.168.1.2  TCP 1454 [TCP segment of a reassembled PDU]
 16   0.190899 54.230.98.222 -> 192.168.1.2  TCP 1454 [TCP segment of a reassembled PDU]
 17   0.190901 54.230.98.222 -> 192.168.1.2  TCP 1454 [TCP segment of a reassembled PDU]
 18   0.190903 54.230.98.222 -> 192.168.1.2  TCP 1454 [TCP segment of a reassembled PDU]
 19   0.190904 54.230.98.222 -> 192.168.1.2  TCP 1454 [TCP segment of a reassembled PDU]
 20   0.190905 54.230.98.222 -> 192.168.1.2  HTTP 949 HTTP/1.1 200 OK  (application/octet-stream)
 21   0.191108  192.168.1.2 -> 54.230.98.222 TCP 54 49194→80 [ACK] Seq=98 Ack=10696 Win=65792 Len=0
 22   0.191199  192.168.1.2 -> 54.230.98.222 TCP 54 49194→80 [FIN, ACK] Seq=98 Ack=10696 Win=65792 Len=0
 23   0.247059 54.230.98.222 -> 192.168.1.2  TCP 54 80→49194 [FIN, ACK] Seq=10696 Ack=99 Win=14720 Len=0
 24   0.247174  192.168.1.2 -> 54.230.98.222 TCP 54 49194→80 [ACK] Seq=99 Ack=10697 Win=65792 Len=0
 25   0.983506 23.21.88.158 -> 192.168.1.2  TLSv1.2 85 Encrypted Alert
 26   0.984034 23.21.88.158 -> 192.168.1.2  TCP 54 443→49184 [FIN, ACK] Seq=32 Ack=1 Win=79 Len=0
 27   0.984089  192.168.1.2 -> 23.21.88.158 TCP 54 49184→443 [ACK] Seq=1 Ack=33 Win=256 Len=0
 28   0.991619 23.21.88.158 -> 192.168.1.2  TLSv1.2 85 Encrypted Alert
 29   0.992217 23.21.88.158 -> 192.168.1.2  TCP 54 443→49182 [FIN, ACK] Seq=32 Ack=1 Win=104 Len=0
 30   0.992272  192.168.1.2 -> 23.21.88.158 TCP 54 49182→443 [ACK] Seq=1 Ack=33 Win=253 Len=0
 31   0.994113 23.21.88.158 -> 192.168.1.2  TLSv1.2 85 Encrypted Alert
 32   0.995526 23.21.88.158 -> 192.168.1.2  TCP 54 443→49180 [FIN, ACK] Seq=32 Ack=1 Win=107 Len=0
 33   0.995560  192.168.1.2 -> 23.21.88.158 TCP 54 49180→443 [ACK] Seq=1 Ack=33 Win=253 Len=0
 34   1.001130 23.21.88.158 -> 192.168.1.2  TLSv1.2 85 Encrypted Alert
 35   1.001849 23.21.88.158 -> 192.168.1.2  TCP 54 443→49181 [FIN, ACK] Seq=32 Ack=1 Win=79 Len=0
 36   1.001888  192.168.1.2 -> 23.21.88.158 TCP 54 49181→443 [ACK] Seq=1 Ack=33 Win=256 Len=0
