[Measurement for 1mb at 06:36:20 20.36.2014] 
Tshark:

  1   0.000000 172.31.29.138 -> 172.31.0.2   DNS 89 Standard query 0xb7f5  A d1xvcg6dfvgaki.cloudfront.net
  2   0.000029 172.31.29.138 -> 172.31.0.2   DNS 89 Standard query 0x03e3  AAAA d1xvcg6dfvgaki.cloudfront.net
  3   0.000594   172.31.0.2 -> 172.31.29.138 DNS 170 Standard query response 0x03e3 
  4   0.000622   172.31.0.2 -> 172.31.29.138 DNS 217 Standard query response 0xb7f5  A 54.230.150.34 A 54.230.150.43 A 54.230.150.45 A 54.230.150.65 A 54.230.150.114 A 54.230.151.226 A 54.230.149.71 A 54.230.150.30
  5   0.003836 172.31.29.138 -> 54.230.150.34 TCP 74 32814 > http [SYN] Seq=0 Win=26883 Len=0 MSS=8961 SACK_PERM=1 TSval=12313434 TSecr=0 WS=128
  6   0.005216 54.230.150.34 -> 172.31.29.138 TCP 74 http > 32814 [SYN, ACK] Seq=0 Ack=1 Win=14480 Len=0 MSS=1460 SACK_PERM=1 TSval=1454247432 TSecr=12313434 WS=128
  7   0.005231 172.31.29.138 -> 54.230.150.34 TCP 66 32814 > http [ACK] Seq=1 Ack=1 Win=27008 Len=0 TSval=12313435 TSecr=1454247432
  8   0.005270 172.31.29.138 -> 54.230.150.34 HTTP 162 GET /1mb HTTP/1.1 
  9   0.006671 54.230.150.34 -> 172.31.29.138 TCP 66 http > 32814 [ACK] Seq=1 Ack=97 Win=14592 Len=0 TSval=1454247432 TSecr=12313435
 10   0.008789 54.230.150.34 -> 172.31.29.138 TCP 523 [TCP segment of a reassembled PDU]
 11   0.008800 172.31.29.138 -> 54.230.150.34 TCP 66 32814 > http [ACK] Seq=97 Ack=458 Win=28032 Len=0 TSval=12313436 TSecr=1454247432
 12   0.008860 54.230.150.34 -> 172.31.29.138 TCP 13098 [TCP segment of a reassembled PDU]
 13   0.008870 172.31.29.138 -> 54.230.150.34 TCP 66 32814 > http [ACK] Seq=97 Ack=13490 Win=54144 Len=0 TSval=12313436 TSecr=1454247432
 14   0.010357 54.230.150.34 -> 172.31.29.138 TCP 13098 [TCP segment of a reassembled PDU]
 15   0.010369 172.31.29.138 -> 54.230.150.34 TCP 66 32814 > http [ACK] Seq=97 Ack=26522 Win=80128 Len=0 TSval=12313436 TSecr=1454247432
 16   0.011843 54.230.150.34 -> 172.31.29.138 TCP 4410 [TCP segment of a reassembled PDU]
 17   0.011849 172.31.29.138 -> 54.230.150.34 TCP 66 32814 > http [ACK] Seq=97 Ack=30866 Win=88832 Len=0 TSval=12313436 TSecr=1454247433
 18   0.011924 54.230.150.34 -> 172.31.29.138 TCP 8754 [TCP segment of a reassembled PDU]
 19   0.011931 172.31.29.138 -> 54.230.150.34 TCP 66 32814 > http [ACK] Seq=97 Ack=39554 Win=103680 Len=0 TSval=12313436 TSecr=1454247433
 20   0.013364 54.230.150.34 -> 172.31.29.138 TCP 4410 [TCP segment of a reassembled PDU]
 21   0.013370 172.31.29.138 -> 54.230.150.34 TCP 66 32814 > http [ACK] Seq=97 Ack=43898 Win=109056 Len=0 TSval=12313437 TSecr=1454247433
 22   0.013467 54.230.150.34 -> 172.31.29.138 TCP 17442 [TCP segment of a reassembled PDU]
 23   0.013477 172.31.29.138 -> 54.230.150.34 TCP 66 32814 > http [ACK] Seq=97 Ack=61274 Win=143872 Len=0 TSval=12313437 TSecr=1454247433
 24   0.014946 54.230.150.34 -> 172.31.29.138 TCP 1514 [TCP segment of a reassembled PDU]
 25   0.014954 172.31.29.138 -> 54.230.150.34 TCP 66 32814 > http [ACK] Seq=97 Ack=62722 Win=146688 Len=0 TSval=12313437 TSecr=1454247433
 26   0.015018 54.230.150.34 -> 172.31.29.138 TCP 15994 [TCP segment of a reassembled PDU]
 27   0.015029 172.31.29.138 -> 54.230.150.34 TCP 66 32814 > http [ACK] Seq=97 Ack=78650 Win=172032 Len=0 TSval=12313437 TSecr=1454247433
 28   0.016487 54.230.150.34 -> 172.31.29.138 TCP 5858 [TCP segment of a reassembled PDU]
 29   0.016495 172.31.29.138 -> 54.230.150.34 TCP 66 32814 > http [ACK] Seq=97 Ack=84442 Win=188672 Len=0 TSval=12313437 TSecr=1454247433
 30   0.016594 54.230.150.34 -> 172.31.29.138 TCP 20338 [TCP segment of a reassembled PDU]
 31   0.016607 172.31.29.138 -> 54.230.150.34 TCP 66 32814 > http [ACK] Seq=97 Ack=104714 Win=168448 Len=0 TSval=12313438 TSecr=1454247433
 32   0.018023 54.230.150.34 -> 172.31.29.138 TCP 4410 [TCP segment of a reassembled PDU]
 33   0.018029 172.31.29.138 -> 54.230.150.34 TCP 66 32814 > http [ACK] Seq=97 Ack=109058 Win=198784 Len=0 TSval=12313438 TSecr=1454247433
 34   0.018251 54.230.150.34 -> 172.31.29.138 TCP 7306 [TCP segment of a reassembled PDU]
 35   0.018258 172.31.29.138 -> 54.230.150.34 TCP 66 32814 > http [ACK] Seq=97 Ack=116298 Win=213376 Len=0 TSval=12313438 TSecr=1454247433
 36   0.018355 54.230.150.34 -> 172.31.29.138 TCP 14546 [TCP segment of a reassembled PDU]
 37   0.018364 172.31.29.138 -> 54.230.150.34 TCP 66 32814 > http [ACK] Seq=97 Ack=130778 Win=242304 Len=0 TSval=12313438 TSecr=1454247433
 38   0.019554 54.230.150.34 -> 172.31.29.138 TCP 5858 [TCP segment of a reassembled PDU]
 39   0.019562 172.31.29.138 -> 54.230.150.34 TCP 66 32814 > http [ACK] Seq=97 Ack=136570 Win=253824 Len=0 TSval=12313438 TSecr=1454247433
 40   0.019663 54.230.150.34 -> 172.31.29.138 TCP 13098 [TCP segment of a reassembled PDU]
 41   0.019671 172.31.29.138 -> 54.230.150.34 TCP 66 32814 > http [ACK] Seq=97 Ack=149602 Win=279936 Len=0 TSval=12313438 TSecr=1454247433
 42   0.019841 54.230.150.34 -> 172.31.29.138 TCP 7306 [TCP segment of a reassembled PDU]
 43   0.019848 172.31.29.138 -> 54.230.150.34 TCP 66 32814 > http [ACK] Seq=97 Ack=156842 Win=294400 Len=0 TSval=12313438 TSecr=1454247433
 44   0.020827 54.230.150.34 -> 172.31.29.138 TCP 7306 [TCP segment of a reassembled PDU]
 45   0.020834 172.31.29.138 -> 54.230.150.34 TCP 66 32814 > http [ACK] Seq=97 Ack=164082 Win=308864 Len=0 TSval=12313439 TSecr=1454247433
 46   0.020934 54.230.150.34 -> 172.31.29.138 TCP 8754 [TCP segment of a reassembled PDU]
 47   0.020941 172.31.29.138 -> 54.230.150.34 TCP 66 32814 > http [ACK] Seq=97 Ack=172770 Win=326272 Len=0 TSval=12313439 TSecr=1454247433
 48   0.021147 54.230.150.34 -> 172.31.29.138 TCP 10202 [TCP segment of a reassembled PDU]
 49   0.021155 172.31.29.138 -> 54.230.150.34 TCP 66 32814 > http [ACK] Seq=97 Ack=182906 Win=346496 Len=0 TSval=12313439 TSecr=1454247434
 50   0.021402 54.230.150.34 -> 172.31.29.138 TCP 13098 [TCP segment of a reassembled PDU]
 51   0.021411 172.31.29.138 -> 54.230.150.34 TCP 66 32814 > http [ACK] Seq=97 Ack=195938 Win=372608 Len=0 TSval=12313439 TSecr=1454247434
 52   0.022344 54.230.150.34 -> 172.31.29.138 TCP 7306 [TCP segment of a reassembled PDU]
 53   0.022352 172.31.29.138 -> 54.230.150.34 TCP 66 32814 > http [ACK] Seq=97 Ack=203178 Win=387072 Len=0 TSval=12313439 TSecr=1454247434
 54   0.022451 54.230.150.34 -> 172.31.29.138 TCP 5858 [TCP segment of a reassembled PDU]
 55   0.022457 172.31.29.138 -> 54.230.150.34 TCP 66 32814 > http [ACK] Seq=97 Ack=208970 Win=398720 Len=0 TSval=12313439 TSecr=1454247434
 56   0.022717 54.230.150.34 -> 172.31.29.138 TCP 17442 [TCP segment of a reassembled PDU]
 57   0.022727 172.31.29.138 -> 54.230.150.34 TCP 66 32814 > http [ACK] Seq=97 Ack=226346 Win=433408 Len=0 TSval=12313439 TSecr=1454247434
 58   0.023857 54.230.150.34 -> 172.31.29.138 TCP 2962 [TCP segment of a reassembled PDU]
 59   0.023862 172.31.29.138 -> 54.230.150.34 TCP 66 32814 > http [ACK] Seq=97 Ack=229242 Win=439168 Len=0 TSval=12313439 TSecr=1454247434
 60   0.024030 54.230.150.34 -> 172.31.29.138 TCP 20338 [TCP segment of a reassembled PDU]
 61   0.024042 172.31.29.138 -> 54.230.150.34 TCP 66 32814 > http [ACK] Seq=97 Ack=249514 Win=479744 Len=0 TSval=12313439 TSecr=1454247434
 62   0.024105 54.230.150.34 -> 172.31.29.138 TCP 1514 [TCP segment of a reassembled PDU]
 63   0.024110 172.31.29.138 -> 54.230.150.34 TCP 66 32814 > http [ACK] Seq=97 Ack=250962 Win=478336 Len=0 TSval=12313439 TSecr=1454247434
 64   0.024295 54.230.150.34 -> 172.31.29.138 TCP 23234 [TCP segment of a reassembled PDU]
 65   0.024311 172.31.29.138 -> 54.230.150.34 TCP 66 32814 > http [ACK] Seq=97 Ack=274130 Win=475520 Len=0 TSval=12313439 TSecr=1454247434
 66   0.025415 54.230.150.34 -> 172.31.29.138 TCP 2962 [TCP segment of a reassembled PDU]
 67   0.025420 172.31.29.138 -> 54.230.150.34 TCP 66 32814 > http [ACK] Seq=97 Ack=277026 Win=485504 Len=0 TSval=12313440 TSecr=1454247434
 68   0.025577 54.230.150.34 -> 172.31.29.138 TCP 24682 [TCP segment of a reassembled PDU]
 69   0.025590 172.31.29.138 -> 54.230.150.34 TCP 66 32814 > http [ACK] Seq=97 Ack=301642 Win=534784 Len=0 TSval=12313440 TSecr=1454247434
 70   0.025911 54.230.150.34 -> 172.31.29.138 TCP 2962 [TCP segment of a reassembled PDU]
 71   0.025916 172.31.29.138 -> 54.230.150.34 TCP 66 32814 > http [ACK] Seq=97 Ack=304538 Win=540544 Len=0 TSval=12313440 TSecr=1454247434
 72   0.026106 54.230.150.34 -> 172.31.29.138 TCP 24682 [TCP segment of a reassembled PDU]
 73   0.026119 172.31.29.138 -> 54.230.150.34 TCP 66 32814 > http [ACK] Seq=97 Ack=329154 Win=589824 Len=0 TSval=12313440 TSecr=1454247434
 74   0.027274 54.230.150.34 -> 172.31.29.138 TCP 11650 [TCP segment of a reassembled PDU]
 75   0.027282 172.31.29.138 -> 54.230.150.34 TCP 66 32814 > http [ACK] Seq=97 Ack=340738 Win=612992 Len=0 TSval=12313440 TSecr=1454247434
 76   0.027413 54.230.150.34 -> 172.31.29.138 TCP 18890 [TCP segment of a reassembled PDU]
 77   0.027424 172.31.29.138 -> 54.230.150.34 TCP 66 32814 > http [ACK] Seq=97 Ack=359562 Win=650624 Len=0 TSval=12313440 TSecr=1454247434
 78   0.027711 54.230.150.34 -> 172.31.29.138 TCP 4410 [TCP segment of a reassembled PDU]
 79   0.027717 172.31.29.138 -> 54.230.150.34 TCP 66 32814 > http [ACK] Seq=97 Ack=363906 Win=659328 Len=0 TSval=12313440 TSecr=1454247434
 80   0.027891 54.230.150.34 -> 172.31.29.138 TCP 26130 [TCP segment of a reassembled PDU]
 81   0.027904 172.31.29.138 -> 54.230.150.34 TCP 66 32814 > http [ACK] Seq=97 Ack=389970 Win=696064 Len=0 TSval=12313440 TSecr=1454247434
 82   0.028999 54.230.150.34 -> 172.31.29.138 TCP 7306 [TCP segment of a reassembled PDU]
 83   0.029006 172.31.29.138 -> 54.230.150.34 TCP 66 32814 > http [ACK] Seq=97 Ack=397210 Win=725888 Len=0 TSval=12313441 TSecr=1454247434
 84   0.029110 54.230.150.34 -> 172.31.29.138 TCP 7306 [TCP segment of a reassembled PDU]
 85   0.029117 172.31.29.138 -> 54.230.150.34 TCP 66 32814 > http [ACK] Seq=97 Ack=404450 Win=726912 Len=0 TSval=12313441 TSecr=1454247434
 86   0.029162 54.230.150.34 -> 172.31.29.138 TCP 13098 [TCP segment of a reassembled PDU]
 87   0.029170 172.31.29.138 -> 54.230.150.34 TCP 66 32814 > http [ACK] Seq=97 Ack=417482 Win=717440 Len=0 TSval=12313441 TSecr=1454247434
 88   0.029242 54.230.150.34 -> 172.31.29.138 TCP 11650 [TCP segment of a reassembled PDU]
 89   0.029250 172.31.29.138 -> 54.230.150.34 TCP 66 32814 > http [ACK] Seq=97 Ack=429066 Win=719872 Len=0 TSval=12313441 TSecr=1454247434
 90   0.029658 54.230.150.34 -> 172.31.29.138 TCP 27578 [TCP segment of a reassembled PDU]
 91   0.029671 172.31.29.138 -> 54.230.150.34 TCP 66 32814 > http [ACK] Seq=97 Ack=456578 Win=693504 Len=0 TSval=12313441 TSecr=1454247434
 92   0.030528 54.230.150.34 -> 172.31.29.138 TCP 4410 [TCP segment of a reassembled PDU]
 93   0.030534 172.31.29.138 -> 54.230.150.34 TCP 66 32814 > http [ACK] Seq=97 Ack=460922 Win=731648 Len=0 TSval=12313441 TSecr=1454247434
 94   0.030664 54.230.150.34 -> 172.31.29.138 TCP 8754 [TCP segment of a reassembled PDU]
 95   0.030671 172.31.29.138 -> 54.230.150.34 TCP 66 32814 > http [ACK] Seq=97 Ack=469610 Win=724608 Len=0 TSval=12313441 TSecr=1454247434
 96   0.030769 54.230.150.34 -> 172.31.29.138 TCP 2962 [TCP segment of a reassembled PDU]
 97   0.030774 172.31.29.138 -> 54.230.150.34 TCP 66 32814 > http [ACK] Seq=97 Ack=472506 Win=721792 Len=0 TSval=12313441 TSecr=1454247434
 98   0.030983 54.230.150.34 -> 172.31.29.138 TCP 26130 [TCP segment of a reassembled PDU]
 99   0.030997 172.31.29.138 -> 54.230.150.34 TCP 66 32814 > http [ACK] Seq=97 Ack=498570 Win=696064 Len=0 TSval=12313441 TSecr=1454247434
100   0.031037 54.230.150.34 -> 172.31.29.138 TCP 26130 [TCP segment of a reassembled PDU]
101   0.031050 172.31.29.138 -> 54.230.150.34 TCP 66 32814 > http [ACK] Seq=97 Ack=524634 Win=670080 Len=0 TSval=12313441 TSecr=1454247434
102   0.031059 54.230.150.34 -> 172.31.29.138 TCP 5858 [TCP segment of a reassembled PDU]
103   0.031064 172.31.29.138 -> 54.230.150.34 TCP 66 32814 > http [ACK] Seq=97 Ack=530426 Win=664320 Len=0 TSval=12313441 TSecr=1454247434
104   0.032050 54.230.150.34 -> 172.31.29.138 TCP 2962 [TCP segment of a reassembled PDU]
105   0.032056 172.31.29.138 -> 54.230.150.34 TCP 66 32814 > http [ACK] Seq=97 Ack=533322 Win=734080 Len=0 TSval=12313441 TSecr=1454247435
106   0.032166 54.230.150.34 -> 172.31.29.138 TCP 1514 [TCP segment of a reassembled PDU]
107   0.032170 172.31.29.138 -> 54.230.150.34 TCP 66 32814 > http [ACK] Seq=97 Ack=534770 Win=736384 Len=0 TSval=12313441 TSecr=1454247435
108   0.032553 54.230.150.34 -> 172.31.29.138 TCP 2962 [TCP segment of a reassembled PDU]
109   0.032558 172.31.29.138 -> 54.230.150.34 TCP 66 32814 > http [ACK] Seq=97 Ack=537666 Win=734080 Len=0 TSval=12313441 TSecr=1454247435
110   0.032716 54.230.150.34 -> 172.31.29.138 TCP 26130 [TCP segment of a reassembled PDU]
111   0.032742 172.31.29.138 -> 54.230.150.34 TCP 66 32814 > http [ACK] Seq=97 Ack=563730 Win=708096 Len=0 TSval=12313442 TSecr=1454247435
112   0.032770 54.230.150.34 -> 172.31.29.138 TCP 23234 [TCP segment of a reassembled PDU]
113   0.032794 172.31.29.138 -> 54.230.150.34 TCP 66 32814 > http [ACK] Seq=97 Ack=586898 Win=700800 Len=0 TSval=12313442 TSecr=1454247435
114   0.032799 54.230.150.34 -> 172.31.29.138 TCP 1514 [TCP segment of a reassembled PDU]
115   0.032801 54.230.150.34 -> 172.31.29.138 TCP 1514 [TCP Previous segment not captured] [TCP segment of a reassembled PDU]
116   0.032804 54.230.150.34 -> 172.31.29.138 TCP 1514 [TCP Out-Of-Order] [TCP segment of a reassembled PDU]
117   0.032808 172.31.29.138 -> 54.230.150.34 TCP 78 32814 > http [ACK] Seq=97 Ack=588346 Win=699392 Len=0 TSval=12313442 TSecr=1454247435 SLE=589794 SRE=591242
118   0.032810 172.31.29.138 -> 54.230.150.34 TCP 66 32814 > http [ACK] Seq=97 Ack=591242 Win=696576 Len=0 TSval=12313442 TSecr=1454247435
119   0.032824 54.230.150.34 -> 172.31.29.138 TCP 8754 [TCP segment of a reassembled PDU]
120   0.032833 172.31.29.138 -> 54.230.150.34 TCP 66 32814 > http [ACK] Seq=97 Ack=599930 Win=688000 Len=0 TSval=12313442 TSecr=1454247435
121   0.034166 54.230.150.34 -> 172.31.29.138 TCP 2962 [TCP segment of a reassembled PDU]
122   0.034172 172.31.29.138 -> 54.230.150.34 TCP 66 32814 > http [ACK] Seq=97 Ack=602826 Win=734080 Len=0 TSval=12313442 TSecr=1454247435
123   0.034323 54.230.150.34 -> 172.31.29.138 TCP 26130 [TCP segment of a reassembled PDU]
124   0.034337 172.31.29.138 -> 54.230.150.34 TCP 66 32814 > http [ACK] Seq=97 Ack=628890 Win=708096 Len=0 TSval=12313442 TSecr=1454247435
125   0.034371 54.230.150.34 -> 172.31.29.138 TCP 20338 [TCP segment of a reassembled PDU]
126   0.034381 172.31.29.138 -> 54.230.150.34 TCP 66 32814 > http [ACK] Seq=97 Ack=649162 Win=687872 Len=0 TSval=12313442 TSecr=1454247435
127   0.034398 54.230.150.34 -> 172.31.29.138 TCP 5858 [TCP segment of a reassembled PDU]
128   0.034402 172.31.29.138 -> 54.230.150.34 TCP 66 32814 > http [ACK] Seq=97 Ack=654954 Win=682112 Len=0 TSval=12313442 TSecr=1454247435
129   0.034456 54.230.150.34 -> 172.31.29.138 TCP 14546 [TCP segment of a reassembled PDU]
130   0.034464 172.31.29.138 -> 54.230.150.34 TCP 66 32814 > http [ACK] Seq=97 Ack=669434 Win=715008 Len=0 TSval=12313442 TSecr=1454247435
131   0.035946 54.230.150.34 -> 172.31.29.138 TCP 5858 [TCP segment of a reassembled PDU]
132   0.035953 172.31.29.138 -> 54.230.150.34 TCP 66 32814 > http [ACK] Seq=97 Ack=675226 Win=729344 Len=0 TSval=12313442 TSecr=1454247435
133   0.036119 54.230.150.34 -> 172.31.29.138 TCP 26130 [TCP segment of a reassembled PDU]
134   0.036132 172.31.29.138 -> 54.230.150.34 TCP 66 32814 > http [ACK] Seq=97 Ack=701290 Win=703360 Len=0 TSval=12313442 TSecr=1454247435
135   0.036144 54.230.150.34 -> 172.31.29.138 TCP 10202 [TCP segment of a reassembled PDU]
136   0.036149 172.31.29.138 -> 54.230.150.34 TCP 66 32814 > http [ACK] Seq=97 Ack=711426 Win=693248 Len=0 TSval=12313442 TSecr=1454247435
137   0.036176 54.230.150.34 -> 172.31.29.138 TCP 18890 [TCP segment of a reassembled PDU]
138   0.036187 172.31.29.138 -> 54.230.150.34 TCP 66 32814 > http [ACK] Seq=97 Ack=730250 Win=674432 Len=0 TSval=12313442 TSecr=1454247435
139   0.037549 54.230.150.34 -> 172.31.29.138 TCP 4410 [TCP segment of a reassembled PDU]
140   0.037555 172.31.29.138 -> 54.230.150.34 TCP 66 32814 > http [ACK] Seq=97 Ack=734594 Win=731648 Len=0 TSval=12313443 TSecr=1454247435
141   0.037726 54.230.150.34 -> 172.31.29.138 TCP 29026 [TCP segment of a reassembled PDU]
142   0.037741 172.31.29.138 -> 54.230.150.34 TCP 66 32814 > http [ACK] Seq=97 Ack=763554 Win=763264 Len=0 TSval=12313443 TSecr=1454247435
143   0.037748 54.230.150.34 -> 172.31.29.138 TCP 2962 [TCP segment of a reassembled PDU]
144   0.037751 172.31.29.138 -> 54.230.150.34 TCP 66 32814 > http [ACK] Seq=97 Ack=766450 Win=760448 Len=0 TSval=12313443 TSecr=1454247435
145   0.037827 54.230.150.34 -> 172.31.29.138 TCP 5858 [TCP segment of a reassembled PDU]
146   0.037833 172.31.29.138 -> 54.230.150.34 TCP 66 32814 > http [ACK] Seq=97 Ack=772242 Win=801408 Len=0 TSval=12313443 TSecr=1454247435
147   0.037949 54.230.150.34 -> 172.31.29.138 TCP 23234 [TCP segment of a reassembled PDU]
148   0.037974 172.31.29.138 -> 54.230.150.34 TCP 66 32814 > http [ACK] Seq=97 Ack=795410 Win=778240 Len=0 TSval=12313443 TSecr=1454247435
149   0.039016 54.230.150.34 -> 172.31.29.138 TCP 5858 [TCP segment of a reassembled PDU]
150   0.039023 172.31.29.138 -> 54.230.150.34 TCP 66 32814 > http [ACK] Seq=97 Ack=801202 Win=801408 Len=0 TSval=12313443 TSecr=1454247435
151   0.039220 54.230.150.34 -> 172.31.29.138 TCP 24682 [TCP segment of a reassembled PDU]
152   0.039234 54.230.150.34 -> 172.31.29.138 TCP 1514 [TCP segment of a reassembled PDU]
153   0.039250 172.31.29.138 -> 54.230.150.34 TCP 66 32814 > http [ACK] Seq=97 Ack=827266 Win=775424 Len=0 TSval=12313443 TSecr=1454247435
154   0.039304 54.230.150.34 -> 172.31.29.138 TCP 26130 [TCP segment of a reassembled PDU]
155   0.039330 54.230.150.34 -> 172.31.29.138 TCP 7306 [TCP segment of a reassembled PDU]
156   0.039485 172.31.29.138 -> 54.230.150.34 TCP 66 32814 > http [ACK] Seq=97 Ack=860570 Win=756224 Len=0 TSval=12313443 TSecr=1454247435
157   0.039549 54.230.150.34 -> 172.31.29.138 TCP 1514 [TCP segment of a reassembled PDU]
158   0.039735 54.230.150.34 -> 172.31.29.138 TCP 26130 [TCP segment of a reassembled PDU]
159   0.039748 172.31.29.138 -> 54.230.150.34 TCP 66 32814 > http [ACK] Seq=97 Ack=888082 Win=768128 Len=0 TSval=12313443 TSecr=1454247435
160   0.039779 54.230.150.34 -> 172.31.29.138 TCP 10202 [TCP segment of a reassembled PDU]
161   0.039793 172.31.29.138 -> 54.230.150.34 TCP 66 32814 > http [ACK] Seq=97 Ack=898218 Win=794368 Len=0 TSval=12313443 TSecr=1454247435
162   0.040830 54.230.150.34 -> 172.31.29.138 TCP 10202 [TCP segment of a reassembled PDU]
163   0.040837 172.31.29.138 -> 54.230.150.34 TCP 66 32814 > http [ACK] Seq=97 Ack=908354 Win=794368 Len=0 TSval=12313444 TSecr=1454247435
164   0.040998 54.230.150.34 -> 172.31.29.138 TCP 26130 [TCP segment of a reassembled PDU]
165   0.041016 54.230.150.34 -> 172.31.29.138 TCP 5858 [TCP segment of a reassembled PDU]
166   0.041026 54.230.150.34 -> 172.31.29.138 TCP 10202 [TCP segment of a reassembled PDU]
167   0.041035 54.230.150.34 -> 172.31.29.138 TCP 10202 [TCP segment of a reassembled PDU]
168   0.041045 54.230.150.34 -> 172.31.29.138 TCP 7306 [TCP segment of a reassembled PDU]
169   0.041212 172.31.29.138 -> 54.230.150.34 TCP 66 32814 > http [ACK] Seq=97 Ack=967722 Win=735104 Len=0 TSval=12313444 TSecr=1454247435
170   0.041321 54.230.150.34 -> 172.31.29.138 TCP 4410 [TCP segment of a reassembled PDU]
171   0.041327 172.31.29.138 -> 54.230.150.34 TCP 66 32814 > http [ACK] Seq=97 Ack=972066 Win=803840 Len=0 TSval=12313444 TSecr=1454247436
172   0.041464 54.230.150.34 -> 172.31.29.138 TCP 18890 [TCP segment of a reassembled PDU]
173   0.041486 172.31.29.138 -> 54.230.150.34 TCP 66 32814 > http [ACK] Seq=97 Ack=990890 Win=785024 Len=0 TSval=12313444 TSecr=1454247436
174   0.042604 54.230.150.34 -> 172.31.29.138 TCP 1514 [TCP segment of a reassembled PDU]
175   0.042788 54.230.150.34 -> 172.31.29.138 TCP 26130 [TCP segment of a reassembled PDU]
176   0.042814 172.31.29.138 -> 54.230.150.34 TCP 66 32814 > http [ACK] Seq=97 Ack=1018402 Win=768128 Len=0 TSval=12313444 TSecr=1454247436
177   0.042840 54.230.150.34 -> 172.31.29.138 TCP 26130 [TCP segment of a reassembled PDU]
178   0.042853 54.230.150.34 -> 172.31.29.138 HTTP 4634 HTTP/1.1 200 OK  (application/octet-stream)
179   0.042869 172.31.29.138 -> 54.230.150.34 TCP 66 32814 > http [ACK] Seq=97 Ack=1049034 Win=758528 Len=0 TSval=12313444 TSecr=1454247436
180   0.043012 172.31.29.138 -> 54.230.150.34 TCP 66 32814 > http [FIN, ACK] Seq=97 Ack=1049034 Win=805632 Len=0 TSval=12313444 TSecr=1454247436
181   0.044659 54.230.150.34 -> 172.31.29.138 TCP 66 http > 32814 [FIN, ACK] Seq=1049034 Ack=98 Win=14592 Len=0 TSval=1454247436 TSecr=12313444
182   0.044668 172.31.29.138 -> 54.230.150.34 TCP 66 32814 > http [ACK] Seq=98 Ack=1049035 Win=805632 Len=0 TSval=12313445 TSecr=1454247436
