[Measurement for 1mb at 02:36:20 20.36.2014] 
Tshark:

  1   0.000000 172.31.29.138 -> 172.31.0.2   DNS 89 Standard query 0x2559  A d1xvcg6dfvgaki.cloudfront.net
  2   0.000028 172.31.29.138 -> 172.31.0.2   DNS 89 Standard query 0xddb8  AAAA d1xvcg6dfvgaki.cloudfront.net
  3   0.000586   172.31.0.2 -> 172.31.29.138 DNS 217 Standard query response 0x2559  A 54.230.158.139 A 54.230.158.211 A 54.230.158.241 A 54.230.159.148 A 54.192.157.149 A 54.192.159.98 A 54.192.159.165 A 54.192.159.173
  4   0.000596   172.31.0.2 -> 172.31.29.138 DNS 170 Standard query response 0xddb8 
  5   0.003889 172.31.29.138 -> 54.230.158.139 TCP 74 58962 > http [SYN] Seq=0 Win=26883 Len=0 MSS=8961 SACK_PERM=1 TSval=8713392 TSecr=0 WS=128
  6   0.004639 54.230.158.139 -> 172.31.29.138 TCP 74 http > 58962 [SYN, ACK] Seq=0 Ack=1 Win=14480 Len=0 MSS=1460 SACK_PERM=1 TSval=834636469 TSecr=8713392 WS=128
  7   0.004654 172.31.29.138 -> 54.230.158.139 TCP 66 58962 > http [ACK] Seq=1 Ack=1 Win=27008 Len=0 TSval=8713392 TSecr=834636469
  8   0.004697 172.31.29.138 -> 54.230.158.139 HTTP 162 GET /1mb HTTP/1.1 
  9   0.005322 54.230.158.139 -> 172.31.29.138 TCP 66 http > 58962 [ACK] Seq=1 Ack=97 Win=14592 Len=0 TSval=834636469 TSecr=8713392
 10   0.007719 54.230.158.139 -> 172.31.29.138 TCP 7306 [TCP segment of a reassembled PDU]
 11   0.007730 172.31.29.138 -> 54.230.158.139 TCP 66 58962 > http [ACK] Seq=97 Ack=7241 Win=41472 Len=0 TSval=8713393 TSecr=834636469
 12   0.007740 54.230.158.139 -> 172.31.29.138 TCP 5858 [TCP segment of a reassembled PDU]
 13   0.007746 172.31.29.138 -> 54.230.158.139 TCP 66 58962 > http [ACK] Seq=97 Ack=13033 Win=52992 Len=0 TSval=8713393 TSecr=834636469
 14   0.007873 54.230.158.139 -> 172.31.29.138 TCP 1514 [TCP segment of a reassembled PDU]
 15   0.007892 172.31.29.138 -> 54.230.158.139 TCP 66 58962 > http [ACK] Seq=97 Ack=14481 Win=55936 Len=0 TSval=8713393 TSecr=834636469
 16   0.008446 54.230.158.139 -> 172.31.29.138 TCP 5858 [TCP segment of a reassembled PDU]
 17   0.008452 172.31.29.138 -> 54.230.158.139 TCP 66 58962 > http [ACK] Seq=97 Ack=20273 Win=67456 Len=0 TSval=8713393 TSecr=834636469
 18   0.008506 54.230.158.139 -> 172.31.29.138 TCP 7306 [TCP segment of a reassembled PDU]
 19   0.008516 172.31.29.138 -> 54.230.158.139 TCP 66 58962 > http [ACK] Seq=97 Ack=27513 Win=81920 Len=0 TSval=8713393 TSecr=834636469
 20   0.009202 54.230.158.139 -> 172.31.29.138 TCP 5858 [TCP segment of a reassembled PDU]
 21   0.009209 172.31.29.138 -> 54.230.158.139 TCP 66 58962 > http [ACK] Seq=97 Ack=33305 Win=93568 Len=0 TSval=8713393 TSecr=834636469
 22   0.009230 54.230.158.139 -> 172.31.29.138 TCP 7306 [TCP segment of a reassembled PDU]
 23   0.009234 172.31.29.138 -> 54.230.158.139 TCP 66 58962 > http [ACK] Seq=97 Ack=40545 Win=96512 Len=0 TSval=8713393 TSecr=834636469
 24   0.009280 54.230.158.139 -> 172.31.29.138 TCP 8754 [TCP segment of a reassembled PDU]
 25   0.009287 172.31.29.138 -> 54.230.158.139 TCP 66 58962 > http [ACK] Seq=97 Ack=49233 Win=103680 Len=0 TSval=8713393 TSecr=834636469
 26   0.009969 54.230.158.139 -> 172.31.29.138 TCP 5858 [TCP segment of a reassembled PDU]
 27   0.009988 172.31.29.138 -> 54.230.158.139 TCP 66 58962 > http [ACK] Seq=97 Ack=55025 Win=108416 Len=0 TSval=8713393 TSecr=834636469
 28   0.010025 54.230.158.139 -> 172.31.29.138 TCP 11650 [TCP segment of a reassembled PDU]
 29   0.010033 172.31.29.138 -> 54.230.158.139 TCP 66 58962 > http [ACK] Seq=97 Ack=66609 Win=98944 Len=0 TSval=8713393 TSecr=834636469
 30   0.010075 54.230.158.139 -> 172.31.29.138 TCP 8754 [TCP segment of a reassembled PDU]
 31   0.010086 172.31.29.138 -> 54.230.158.139 TCP 66 58962 > http [ACK] Seq=97 Ack=75297 Win=90368 Len=0 TSval=8713393 TSecr=834636469
 32   0.010705 54.230.158.139 -> 172.31.29.138 TCP 2962 [TCP segment of a reassembled PDU]
 33   0.010713 172.31.29.138 -> 54.230.158.139 TCP 66 58962 > http [ACK] Seq=97 Ack=78193 Win=109056 Len=0 TSval=8713394 TSecr=834636469
 34   0.010867 54.230.158.139 -> 172.31.29.138 TCP 27578 [TCP segment of a reassembled PDU]
 35   0.010888 172.31.29.138 -> 54.230.158.139 TCP 66 58962 > http [ACK] Seq=97 Ack=105705 Win=164096 Len=0 TSval=8713394 TSecr=834636469
 36   0.011291 54.230.158.139 -> 172.31.29.138 TCP 1514 [TCP segment of a reassembled PDU]
 37   0.011298 172.31.29.138 -> 54.230.158.139 TCP 66 58962 > http [ACK] Seq=97 Ack=107153 Win=167040 Len=0 TSval=8713394 TSecr=834636469
 38   0.011494 54.230.158.139 -> 172.31.29.138 TCP 10202 [TCP segment of a reassembled PDU]
 39   0.011502 172.31.29.138 -> 54.230.158.139 TCP 66 58962 > http [ACK] Seq=97 Ack=117289 Win=187264 Len=0 TSval=8713394 TSecr=834636469
 40   0.011589 54.230.158.139 -> 172.31.29.138 TCP 17442 [TCP segment of a reassembled PDU]
 41   0.011599 172.31.29.138 -> 54.230.158.139 TCP 66 58962 > http [ACK] Seq=97 Ack=134665 Win=221952 Len=0 TSval=8713394 TSecr=834636469
 42   0.012238 54.230.158.139 -> 172.31.29.138 TCP 4410 [TCP segment of a reassembled PDU]
 43   0.012246 172.31.29.138 -> 54.230.158.139 TCP 66 58962 > http [ACK] Seq=97 Ack=139009 Win=230656 Len=0 TSval=8713394 TSecr=834636469
 44   0.012379 54.230.158.139 -> 172.31.29.138 TCP 23234 [TCP segment of a reassembled PDU]
 45   0.012391 172.31.29.138 -> 54.230.158.139 TCP 66 58962 > http [ACK] Seq=97 Ack=162177 Win=276992 Len=0 TSval=8713394 TSecr=834636469
 46   0.013001 54.230.158.139 -> 172.31.29.138 TCP 4410 [TCP segment of a reassembled PDU]
 47   0.013007 172.31.29.138 -> 54.230.158.139 TCP 66 58962 > http [ACK] Seq=97 Ack=166521 Win=285696 Len=0 TSval=8713394 TSecr=834636469
 48   0.013148 54.230.158.139 -> 172.31.29.138 TCP 23234 [TCP segment of a reassembled PDU]
 49   0.013159 172.31.29.138 -> 54.230.158.139 TCP 66 58962 > http [ACK] Seq=97 Ack=189689 Win=332032 Len=0 TSval=8713394 TSecr=834636469
 50   0.013521 54.230.158.139 -> 172.31.29.138 TCP 4410 [TCP segment of a reassembled PDU]
 51   0.013527 172.31.29.138 -> 54.230.158.139 TCP 66 58962 > http [ACK] Seq=97 Ack=194033 Win=340736 Len=0 TSval=8713394 TSecr=834636469
 52   0.013670 54.230.158.139 -> 172.31.29.138 TCP 14546 [TCP segment of a reassembled PDU]
 53   0.013679 172.31.29.138 -> 54.230.158.139 TCP 66 58962 > http [ACK] Seq=97 Ack=208513 Win=369664 Len=0 TSval=8713394 TSecr=834636469
 54   0.013883 54.230.158.139 -> 172.31.29.138 TCP 18890 [TCP segment of a reassembled PDU]
 55   0.013895 172.31.29.138 -> 54.230.158.139 TCP 66 58962 > http [ACK] Seq=97 Ack=227337 Win=407296 Len=0 TSval=8713394 TSecr=834636470
 56   0.013972 54.230.158.139 -> 172.31.29.138 TCP 5858 [TCP segment of a reassembled PDU]
 57   0.013979 172.31.29.138 -> 54.230.158.139 TCP 66 58962 > http [ACK] Seq=97 Ack=233129 Win=418944 Len=0 TSval=8713394 TSecr=834636470
 58   0.014308 54.230.158.139 -> 172.31.29.138 TCP 2962 [TCP segment of a reassembled PDU]
 59   0.014315 172.31.29.138 -> 54.230.158.139 TCP 66 58962 > http [ACK] Seq=97 Ack=236025 Win=424704 Len=0 TSval=8713395 TSecr=834636470
 60   0.014470 54.230.158.139 -> 172.31.29.138 TCP 18890 [TCP segment of a reassembled PDU]
 61   0.014481 172.31.29.138 -> 54.230.158.139 TCP 66 58962 > http [ACK] Seq=97 Ack=254849 Win=462336 Len=0 TSval=8713395 TSecr=834636470
 62   0.014538 54.230.158.139 -> 172.31.29.138 TCP 4410 [TCP segment of a reassembled PDU]
 63   0.014544 172.31.29.138 -> 54.230.158.139 TCP 66 58962 > http [ACK] Seq=97 Ack=259193 Win=471040 Len=0 TSval=8713395 TSecr=834636470
 64   0.014687 54.230.158.139 -> 172.31.29.138 TCP 11650 [TCP segment of a reassembled PDU]
 65   0.014695 172.31.29.138 -> 54.230.158.139 TCP 66 58962 > http [ACK] Seq=97 Ack=270777 Win=494208 Len=0 TSval=8713395 TSecr=834636470
 66   0.015046 54.230.158.139 -> 172.31.29.138 TCP 4410 [TCP segment of a reassembled PDU]
 67   0.015053 172.31.29.138 -> 54.230.158.139 TCP 66 58962 > http [ACK] Seq=97 Ack=275121 Win=502912 Len=0 TSval=8713395 TSecr=834636470
 68   0.015233 54.230.158.139 -> 172.31.29.138 TCP 23234 [TCP segment of a reassembled PDU]
 69   0.015246 172.31.29.138 -> 54.230.158.139 TCP 66 58962 > http [ACK] Seq=97 Ack=298289 Win=549248 Len=0 TSval=8713395 TSecr=834636470
 70   0.015253 54.230.158.139 -> 172.31.29.138 TCP 2962 [TCP segment of a reassembled PDU]
 71   0.015256 172.31.29.138 -> 54.230.158.139 TCP 66 58962 > http [ACK] Seq=97 Ack=301185 Win=555008 Len=0 TSval=8713395 TSecr=834636470
 72   0.015314 54.230.158.139 -> 172.31.29.138 TCP 10202 [TCP segment of a reassembled PDU]
 73   0.015323 172.31.29.138 -> 54.230.158.139 TCP 66 58962 > http [ACK] Seq=97 Ack=311321 Win=575360 Len=0 TSval=8713395 TSecr=834636470
 74   0.015450 54.230.158.139 -> 172.31.29.138 TCP 13098 [TCP segment of a reassembled PDU]
 75   0.015459 172.31.29.138 -> 54.230.158.139 TCP 66 58962 > http [ACK] Seq=97 Ack=324353 Win=601344 Len=0 TSval=8713395 TSecr=834636470
 76   0.015832 54.230.158.139 -> 172.31.29.138 TCP 5858 [TCP segment of a reassembled PDU]
 77   0.015839 172.31.29.138 -> 54.230.158.139 TCP 66 58962 > http [ACK] Seq=97 Ack=330145 Win=612992 Len=0 TSval=8713395 TSecr=834636470
 78   0.016050 54.230.158.139 -> 172.31.29.138 TCP 26130 [TCP segment of a reassembled PDU]
 79   0.016064 172.31.29.138 -> 54.230.158.139 TCP 66 58962 > http [ACK] Seq=97 Ack=356209 Win=665088 Len=0 TSval=8713395 TSecr=834636470
 80   0.016276 54.230.158.139 -> 172.31.29.138 TCP 21786 [TCP segment of a reassembled PDU]
 81   0.016289 172.31.29.138 -> 54.230.158.139 TCP 66 58962 > http [ACK] Seq=97 Ack=377929 Win=708480 Len=0 TSval=8713395 TSecr=834636470
 82   0.016622 54.230.158.139 -> 172.31.29.138 TCP 4410 [TCP segment of a reassembled PDU]
 83   0.016628 172.31.29.138 -> 54.230.158.139 TCP 66 58962 > http [ACK] Seq=97 Ack=382273 Win=717184 Len=0 TSval=8713395 TSecr=834636470
 84   0.016813 54.230.158.139 -> 172.31.29.138 TCP 26130 [TCP segment of a reassembled PDU]
 85   0.016827 172.31.29.138 -> 54.230.158.139 TCP 66 58962 > http [ACK] Seq=97 Ack=408337 Win=769408 Len=0 TSval=8713395 TSecr=834636470
 86   0.016841 54.230.158.139 -> 172.31.29.138 TCP 13098 [TCP segment of a reassembled PDU]
 87   0.016851 172.31.29.138 -> 54.230.158.139 TCP 66 58962 > http [ACK] Seq=97 Ack=421369 Win=795392 Len=0 TSval=8713395 TSecr=834636470
 88   0.016889 54.230.158.139 -> 172.31.29.138 TCP 5858 [TCP segment of a reassembled PDU]
 89   0.016895 172.31.29.138 -> 54.230.158.139 TCP 66 58962 > http [ACK] Seq=97 Ack=427161 Win=807040 Len=0 TSval=8713395 TSecr=834636470
 90   0.017001 54.230.158.139 -> 172.31.29.138 TCP 4410 [TCP segment of a reassembled PDU]
 91   0.017007 172.31.29.138 -> 54.230.158.139 TCP 66 58962 > http [ACK] Seq=97 Ack=431505 Win=815744 Len=0 TSval=8713395 TSecr=834636470
 92   0.017387 54.230.158.139 -> 172.31.29.138 TCP 2962 [TCP segment of a reassembled PDU]
 93   0.017392 172.31.29.138 -> 54.230.158.139 TCP 66 58962 > http [ACK] Seq=97 Ack=434401 Win=821504 Len=0 TSval=8713395 TSecr=834636470
 94   0.017587 54.230.158.139 -> 172.31.29.138 TCP 26130 [TCP segment of a reassembled PDU]
 95   0.017601 172.31.29.138 -> 54.230.158.139 TCP 66 58962 > http [ACK] Seq=97 Ack=460465 Win=873600 Len=0 TSval=8713395 TSecr=834636470
 96   0.017621 54.230.158.139 -> 172.31.29.138 TCP 17442 [TCP segment of a reassembled PDU]
 97   0.017628 172.31.29.138 -> 54.230.158.139 TCP 66 58962 > http [ACK] Seq=97 Ack=477841 Win=856320 Len=0 TSval=8713395 TSecr=834636470
 98   0.017649 54.230.158.139 -> 172.31.29.138 TCP 4410 [TCP segment of a reassembled PDU]
 99   0.017653 172.31.29.138 -> 54.230.158.139 TCP 66 58962 > http [ACK] Seq=97 Ack=482185 Win=852096 Len=0 TSval=8713395 TSecr=834636470
100   0.017801 54.230.158.139 -> 172.31.29.138 TCP 14546 [TCP segment of a reassembled PDU]
101   0.017811 172.31.29.138 -> 54.230.158.139 TCP 66 58962 > http [ACK] Seq=97 Ack=496665 Win=895232 Len=0 TSval=8713395 TSecr=834636470
102   0.018165 54.230.158.139 -> 172.31.29.138 TCP 2962 [TCP segment of a reassembled PDU]
103   0.018171 172.31.29.138 -> 54.230.158.139 TCP 66 58962 > http [ACK] Seq=97 Ack=499561 Win=908416 Len=0 TSval=8713396 TSecr=834636470
104   0.018345 54.230.158.139 -> 172.31.29.138 TCP 23234 [TCP segment of a reassembled PDU]
105   0.018358 172.31.29.138 -> 54.230.158.139 TCP 66 58962 > http [ACK] Seq=97 Ack=522729 Win=954752 Len=0 TSval=8713396 TSecr=834636470
106   0.018365 54.230.158.139 -> 172.31.29.138 TCP 2962 [TCP segment of a reassembled PDU]
107   0.018368 172.31.29.138 -> 54.230.158.139 TCP 66 58962 > http [ACK] Seq=97 Ack=525625 Win=960512 Len=0 TSval=8713396 TSecr=834636470
108   0.018465 54.230.158.139 -> 172.31.29.138 TCP 36266 [TCP segment of a reassembled PDU]
109   0.018482 172.31.29.138 -> 54.230.158.139 TCP 66 58962 > http [ACK] Seq=97 Ack=561825 Win=1032832 Len=0 TSval=8713396 TSecr=834636470
110   0.018935 54.230.158.139 -> 172.31.29.138 TCP 5858 [TCP segment of a reassembled PDU]
111   0.018955 172.31.29.138 -> 54.230.158.139 TCP 66 58962 > http [ACK] Seq=97 Ack=567617 Win=1044480 Len=0 TSval=8713396 TSecr=834636470
112   0.019118 54.230.158.139 -> 172.31.29.138 TCP 17442 [TCP segment of a reassembled PDU]
113   0.019129 172.31.29.138 -> 54.230.158.139 TCP 66 58962 > http [ACK] Seq=97 Ack=584993 Win=1079168 Len=0 TSval=8713396 TSecr=834636470
114   0.019149 54.230.158.139 -> 172.31.29.138 TCP 8754 [TCP segment of a reassembled PDU]
115   0.019154 172.31.29.138 -> 54.230.158.139 TCP 66 58962 > http [ACK] Seq=97 Ack=593681 Win=1096576 Len=0 TSval=8713396 TSecr=834636470
116   0.019227 54.230.158.139 -> 172.31.29.138 TCP 33370 [TCP segment of a reassembled PDU]
117   0.019244 172.31.29.138 -> 54.230.158.139 TCP 66 58962 > http [ACK] Seq=97 Ack=626985 Win=1163264 Len=0 TSval=8713396 TSecr=834636470
118   0.019693 54.230.158.139 -> 172.31.29.138 TCP 4410 [TCP segment of a reassembled PDU]
119   0.019700 172.31.29.138 -> 54.230.158.139 TCP 66 58962 > http [ACK] Seq=97 Ack=631329 Win=1171840 Len=0 TSval=8713396 TSecr=834636470
120   0.019859 54.230.158.139 -> 172.31.29.138 TCP 26130 [TCP segment of a reassembled PDU]
121   0.019872 172.31.29.138 -> 54.230.158.139 TCP 66 58962 > http [ACK] Seq=97 Ack=657393 Win=1224064 Len=0 TSval=8713396 TSecr=834636470
122   0.019892 54.230.158.139 -> 172.31.29.138 TCP 17442 [TCP segment of a reassembled PDU]
123   0.019901 172.31.29.138 -> 54.230.158.139 TCP 66 58962 > http [ACK] Seq=97 Ack=674769 Win=1258752 Len=0 TSval=8713396 TSecr=834636470
124   0.020056 54.230.158.139 -> 172.31.29.138 TCP 17442 [TCP segment of a reassembled PDU]
125   0.020067 172.31.29.138 -> 54.230.158.139 TCP 66 58962 > http [ACK] Seq=97 Ack=692145 Win=1293568 Len=0 TSval=8713396 TSecr=834636470
126   0.020373 54.230.158.139 -> 172.31.29.138 TCP 26130 [TCP segment of a reassembled PDU]
127   0.020387 172.31.29.138 -> 54.230.158.139 TCP 66 58962 > http [ACK] Seq=97 Ack=718209 Win=1299712 Len=0 TSval=8713396 TSecr=834636470
128   0.020397 54.230.158.139 -> 172.31.29.138 TCP 7306 [TCP segment of a reassembled PDU]
129   0.020419 172.31.29.138 -> 54.230.158.139 TCP 66 58962 > http [ACK] Seq=97 Ack=725449 Win=1292544 Len=0 TSval=8713396 TSecr=834636470
130   0.020574 54.230.158.139 -> 172.31.29.138 TCP 26130 [TCP segment of a reassembled PDU]
131   0.020600 172.31.29.138 -> 54.230.158.139 TCP 66 58962 > http [ACK] Seq=97 Ack=751513 Win=1299712 Len=0 TSval=8713396 TSecr=834636470
132   0.020633 54.230.158.139 -> 172.31.29.138 TCP 5858 [TCP segment of a reassembled PDU]
133   0.020674 172.31.29.138 -> 54.230.158.139 TCP 66 58962 > http [ACK] Seq=97 Ack=757305 Win=1293952 Len=0 TSval=8713396 TSecr=834636470
134   0.020750 54.230.158.139 -> 172.31.29.138 TCP 11650 [TCP segment of a reassembled PDU]
135   0.020758 172.31.29.138 -> 54.230.158.139 TCP 66 58962 > http [ACK] Seq=97 Ack=768889 Win=1323520 Len=0 TSval=8713396 TSecr=834636470
136   0.020887 54.230.158.139 -> 172.31.29.138 TCP 21786 [TCP segment of a reassembled PDU]
137   0.020911 172.31.29.138 -> 54.230.158.139 TCP 66 58962 > http [ACK] Seq=97 Ack=790609 Win=1306880 Len=0 TSval=8713396 TSecr=834636470
138   0.021135 54.230.158.139 -> 172.31.29.138 TCP 23234 [TCP segment of a reassembled PDU]
139   0.021149 54.230.158.139 -> 172.31.29.138 TCP 2962 [TCP segment of a reassembled PDU]
140   0.021172 54.230.158.139 -> 172.31.29.138 TCP 5858 [TCP segment of a reassembled PDU]
141   0.021177 172.31.29.138 -> 54.230.158.139 TCP 66 58962 > http [ACK] Seq=97 Ack=816673 Win=1299584 Len=0 TSval=8713396 TSecr=834636470
142   0.021197 172.31.29.138 -> 54.230.158.139 TCP 66 58962 > http [ACK] Seq=97 Ack=822465 Win=1340544 Len=0 TSval=8713396 TSecr=834636470
143   0.021353 54.230.158.139 -> 172.31.29.138 TCP 26130 [TCP segment of a reassembled PDU]
144   0.021376 54.230.158.139 -> 172.31.29.138 TCP 13098 [TCP segment of a reassembled PDU]
145   0.021395 172.31.29.138 -> 54.230.158.139 TCP 66 58962 > http [ACK] Seq=97 Ack=861561 Win=1301504 Len=0 TSval=8713396 TSecr=834636470
146   0.021553 54.230.158.139 -> 172.31.29.138 TCP 17442 [TCP segment of a reassembled PDU]
147   0.021576 172.31.29.138 -> 54.230.158.139 TCP 66 58962 > http [ACK] Seq=97 Ack=878937 Win=1313920 Len=0 TSval=8713396 TSecr=834636470
148   0.021647 54.230.158.139 -> 172.31.29.138 TCP 8754 [TCP segment of a reassembled PDU]
149   0.021654 172.31.29.138 -> 54.230.158.139 TCP 66 58962 > http [ACK] Seq=97 Ack=887625 Win=1328256 Len=0 TSval=8713396 TSecr=834636470
150   0.021763 54.230.158.139 -> 172.31.29.138 TCP 7306 [TCP segment of a reassembled PDU]
151   0.021770 172.31.29.138 -> 54.230.158.139 TCP 66 58962 > http [ACK] Seq=97 Ack=894865 Win=1330688 Len=0 TSval=8713396 TSecr=834636470
152   0.021938 54.230.158.139 -> 172.31.29.138 TCP 29026 [TCP segment of a reassembled PDU]
153   0.021953 54.230.158.139 -> 172.31.29.138 TCP 1514 [TCP segment of a reassembled PDU]
154   0.021968 172.31.29.138 -> 54.230.158.139 TCP 66 58962 > http [ACK] Seq=97 Ack=925273 Win=1300352 Len=0 TSval=8713396 TSecr=834636470
155   0.021986 54.230.158.139 -> 172.31.29.138 TCP 2962 [TCP segment of a reassembled PDU]
156   0.021996 172.31.29.138 -> 54.230.158.139 TCP 66 58962 > http [ACK] Seq=97 Ack=928169 Win=1335424 Len=0 TSval=8713396 TSecr=834636470
