[Measurement for 10kb at 08:01:28 17.01.2014] 
Tshark:

  1   0.000000  192.168.1.2 -> 204.232.175.78 TCP 54 50592→80 [RST, ACK] Seq=1 Ack=1 Win=0 Len=0
  2   1.324121  192.168.1.2 -> 54.230.98.166 TCP 66 50607→80 [SYN] Seq=0 Win=8192 Len=0 MSS=1460 WS=256 SACK_PERM=1
  3   1.369942 54.230.98.166 -> 192.168.1.2  TCP 66 80→50607 [SYN, ACK] Seq=0 Ack=1 Win=14600 Len=0 MSS=1400 SACK_PERM=1 WS=128
  4   1.370059  192.168.1.2 -> 54.230.98.166 TCP 54 50607→80 [ACK] Seq=1 Ack=1 Win=65792 Len=0
  5   1.370308  192.168.1.2 -> 54.230.98.166 HTTP 151 GET /10kb HTTP/1.1 
  6   1.648532 54.230.98.166 -> 192.168.1.2  TCP 54 80→50607 [ACK] Seq=1 Ack=98 Win=14720 Len=0
  7   1.650459 54.230.98.166 -> 192.168.1.2  TCP 1454 [TCP segment of a reassembled PDU]
  8   1.650542 54.230.98.166 -> 192.168.1.2  TCP 1454 [TCP segment of a reassembled PDU]
  9   1.650603  192.168.1.2 -> 54.230.98.166 TCP 54 50607→80 [ACK] Seq=98 Ack=2801 Win=65792 Len=0
 10   1.650760 54.230.98.166 -> 192.168.1.2  TCP 1454 [TCP segment of a reassembled PDU]
 11   1.650807 54.230.98.166 -> 192.168.1.2  TCP 1454 [TCP segment of a reassembled PDU]
 12   1.650855  192.168.1.2 -> 54.230.98.166 TCP 54 50607→80 [ACK] Seq=98 Ack=5601 Win=65792 Len=0
 13   1.650942 54.230.98.166 -> 192.168.1.2  TCP 1454 [TCP segment of a reassembled PDU]
 14   1.650990 54.230.98.166 -> 192.168.1.2  TCP 1454 [TCP segment of a reassembled PDU]
 15   1.651043  192.168.1.2 -> 54.230.98.166 TCP 54 50607→80 [ACK] Seq=98 Ack=8401 Win=65792 Len=0
 16   1.651137 54.230.98.166 -> 192.168.1.2  TCP 1454 [TCP segment of a reassembled PDU]
 17   1.651171 54.230.98.166 -> 192.168.1.2  HTTP 949 HTTP/1.1 200 OK  (application/octet-stream)
 18   1.651201  192.168.1.2 -> 54.230.98.166 TCP 54 50607→80 [ACK] Seq=98 Ack=10696 Win=65792 Len=0
 19   1.651283 54.230.98.166 -> 192.168.1.2  TCP 1454 [TCP Out-Of-Order] 80→50607 [ACK] Seq=1 Ack=98 Win=14720 Len=1400
 20   1.651308  192.168.1.2 -> 54.230.98.166 TCP 66 [TCP Dup ACK 18#1] 50607→80 [ACK] Seq=98 Ack=10696 Win=65792 Len=0 SLE=1 SRE=1401
 21   1.651599  192.168.1.2 -> 54.230.98.166 TCP 54 50607→80 [FIN, ACK] Seq=98 Ack=10696 Win=65792 Len=0
 22   1.677926 54.230.98.166 -> 192.168.1.2  TCP 1454 [TCP Out-Of-Order] 80→50607 [ACK] Seq=2801 Ack=98 Win=14720 Len=1400[Reassembly error, protocol TCP: New fragment overlaps old data (retransmission?)]
 23   1.677998  192.168.1.2 -> 54.230.98.166 TCP 66 [TCP Dup ACK 21#1] 50607→80 [ACK] Seq=99 Ack=10696 Win=65792 Len=0 SLE=2801 SRE=4201
 24   1.678913 54.230.98.166 -> 192.168.1.2  TCP 1454 [TCP Out-Of-Order] 80→50607 [ACK] Seq=4201 Ack=98 Win=14720 Len=1400[Reassembly error, protocol TCP: New fragment overlaps old data (retransmission?)]
 25   1.678962  192.168.1.2 -> 54.230.98.166 TCP 66 [TCP Dup ACK 21#2] 50607→80 [ACK] Seq=99 Ack=10696 Win=65792 Len=0 SLE=4201 SRE=5601
 26   1.681230 54.230.98.166 -> 192.168.1.2  TCP 1454 [TCP Out-Of-Order] 80→50607 [ACK] Seq=5601 Ack=98 Win=14720 Len=1400[Reassembly error, protocol TCP: New fragment overlaps old data (retransmission?)]
 27   1.681260  192.168.1.2 -> 54.230.98.166 TCP 66 [TCP Dup ACK 21#3] 50607→80 [ACK] Seq=99 Ack=10696 Win=65792 Len=0 SLE=5601 SRE=7001
 28   1.681349 54.230.98.166 -> 192.168.1.2  TCP 1454 [TCP Out-Of-Order] 80→50607 [ACK] Seq=7001 Ack=98 Win=14720 Len=1400[Reassembly error, protocol TCP: New fragment overlaps old data (retransmission?)]
 29   1.681370  192.168.1.2 -> 54.230.98.166 TCP 66 [TCP Dup ACK 21#4] 50607→80 [ACK] Seq=99 Ack=10696 Win=65792 Len=0 SLE=7001 SRE=8401
 30   1.681438 54.230.98.166 -> 192.168.1.2  TCP 1454 [TCP Out-Of-Order] 80→50607 [ACK] Seq=8401 Ack=98 Win=14720 Len=1400[Reassembly error, protocol TCP: New fragment overlaps old data (retransmission?)]
 31   1.681463  192.168.1.2 -> 54.230.98.166 TCP 66 [TCP Dup ACK 21#5] 50607→80 [ACK] Seq=99 Ack=10696 Win=65792 Len=0 SLE=8401 SRE=9801
 32   1.681973 54.230.98.166 -> 192.168.1.2  TCP 54 80→50607 [FIN, ACK] Seq=10696 Ack=99 Win=14720 Len=0
 33   1.682056  192.168.1.2 -> 54.230.98.166 TCP 54 50607→80 [ACK] Seq=99 Ack=10697 Win=65792 Len=0
