[Measurement for 1kb at 19:43:07 19.43.2014] 
Tshark:

  1   0.000000 172.31.8.238 -> 172.31.0.2   DNS 89 Standard query 0xe06e  A d1n0gskdvzj94j.cloudfront.net
  2   0.000040 172.31.8.238 -> 172.31.0.2   DNS 89 Standard query 0x58ed  AAAA d1n0gskdvzj94j.cloudfront.net
  3   0.000625   172.31.0.2 -> 172.31.8.238 DNS 217 Standard query response 0xe06e  A 54.230.119.86 A 54.239.132.196 A 54.192.118.233 A 54.230.116.73 A 54.230.116.167 A 54.230.117.10 A 54.230.118.138 A 54.230.119.66
  4   0.005376   172.31.0.2 -> 172.31.8.238 DNS 176 Standard query response 0x58ed 
  5   0.011956 172.31.8.238 -> 54.230.119.86 TCP 74 47616 > http [SYN] Seq=0 Win=26883 Len=0 MSS=8961 SACK_PERM=1 TSval=2453820 TSecr=0 WS=128
  6   0.012622 54.230.119.86 -> 172.31.8.238 TCP 74 http > 47616 [SYN, ACK] Seq=0 Ack=1 Win=14480 Len=0 MSS=1460 SACK_PERM=1 TSval=1682157975 TSecr=2453820 WS=128
  7   0.012636 172.31.8.238 -> 54.230.119.86 TCP 66 47616 > http [ACK] Seq=1 Ack=1 Win=27008 Len=0 TSval=2453820 TSecr=1682157975
  8   0.012691 172.31.8.238 -> 54.230.119.86 HTTP 162 GET /1kb HTTP/1.1 
  9   0.013417 54.230.119.86 -> 172.31.8.238 TCP 66 http > 47616 [ACK] Seq=1 Ack=97 Win=14592 Len=0 TSval=1682157975 TSecr=2453820
 10   0.015265 54.230.119.86 -> 172.31.8.238 HTTP 1543 HTTP/1.1 200 OK  (application/octet-stream)
 11   0.015273 172.31.8.238 -> 54.230.119.86 TCP 66 47616 > http [ACK] Seq=97 Ack=1478 Win=29952 Len=0 TSval=2453821 TSecr=1682157976
 12   0.015450 172.31.8.238 -> 54.230.119.86 TCP 66 47616 > http [FIN, ACK] Seq=97 Ack=1478 Win=29952 Len=0 TSval=2453821 TSecr=1682157976
 13   0.015973 54.230.119.86 -> 172.31.8.238 TCP 66 http > 47616 [FIN, ACK] Seq=1478 Ack=98 Win=14592 Len=0 TSval=1682157976 TSecr=2453821
 14   0.015981 172.31.8.238 -> 54.230.119.86 TCP 66 47616 > http [ACK] Seq=98 Ack=1479 Win=29952 Len=0 TSval=2453821 TSecr=1682157976
