[Measurement for 1kb at 08:43:07 20.43.2014] 
Tshark:

  1   0.000000 172.31.8.238 -> 172.31.0.2   DNS 89 Standard query 0xc255  A d1n0gskdvzj94j.cloudfront.net
  2   0.000027 172.31.8.238 -> 172.31.0.2   DNS 89 Standard query 0x7b9b  AAAA d1n0gskdvzj94j.cloudfront.net
  3   0.000769   172.31.0.2 -> 172.31.8.238 DNS 217 Standard query response 0xc255  A 54.230.118.138 A 54.230.118.214 A 54.230.119.3 A 54.230.119.189 A 54.239.132.98 A 54.239.132.196 A 54.230.116.53 A 54.230.116.154
  4   0.006045   172.31.0.2 -> 172.31.8.238 DNS 176 Standard query response 0x7b9b 
  5   0.012026 172.31.8.238 -> 54.230.118.138 TCP 74 58899 > http [SYN] Seq=0 Win=26883 Len=0 MSS=8961 SACK_PERM=1 TSval=14153700 TSecr=0 WS=128
  6   0.012753 54.230.118.138 -> 172.31.8.238 TCP 74 http > 58899 [SYN, ACK] Seq=0 Ack=1 Win=14480 Len=0 MSS=1460 SACK_PERM=1 TSval=1684719886 TSecr=14153700 WS=128
  7   0.012766 172.31.8.238 -> 54.230.118.138 TCP 66 58899 > http [ACK] Seq=1 Ack=1 Win=27008 Len=0 TSval=14153700 TSecr=1684719886
  8   0.012806 172.31.8.238 -> 54.230.118.138 HTTP 162 GET /1kb HTTP/1.1 
  9   0.013539 54.230.118.138 -> 172.31.8.238 TCP 66 http > 58899 [ACK] Seq=1 Ack=97 Win=14592 Len=0 TSval=1684719886 TSecr=14153700
 10   0.014818 54.230.118.138 -> 172.31.8.238 HTTP 1544 HTTP/1.1 200 OK  (application/octet-stream)
 11   0.014825 172.31.8.238 -> 54.230.118.138 TCP 66 58899 > http [ACK] Seq=97 Ack=1479 Win=29952 Len=0 TSval=14153701 TSecr=1684719886
 12   0.014980 172.31.8.238 -> 54.230.118.138 TCP 66 58899 > http [FIN, ACK] Seq=97 Ack=1479 Win=29952 Len=0 TSval=14153701 TSecr=1684719886
 13   0.015520 54.230.118.138 -> 172.31.8.238 TCP 66 http > 58899 [FIN, ACK] Seq=1479 Ack=98 Win=14592 Len=0 TSval=1684719886 TSecr=14153701
 14   0.015528 172.31.8.238 -> 54.230.118.138 TCP 66 58899 > http [ACK] Seq=98 Ack=1480 Win=29952 Len=0 TSval=14153701 TSecr=1684719886
