[Measurement for 1kb at 17:44:43 19.44.2014] 
Tshark:

  1   0.000000 172.31.8.238 -> 172.31.0.2   DNS 89 Standard query 0x37c0  A d1n0gskdvzj94j.cloudfront.net
  2   0.000029 172.31.8.238 -> 172.31.0.2   DNS 89 Standard query 0x3e9a  AAAA d1n0gskdvzj94j.cloudfront.net
  3   0.000704   172.31.0.2 -> 172.31.8.238 DNS 217 Standard query response 0x37c0  A 54.192.141.180 A 54.192.141.184 A 54.230.140.141 A 54.230.141.154 A 54.230.143.62 A 54.230.143.233 A 205.251.215.155 A 205.251.215.193
  4   0.003597   172.31.0.2 -> 172.31.8.238 DNS 176 Standard query response 0x3e9a 
  5   0.003852 172.31.8.238 -> 54.192.141.180 TCP 74 54630 > http [SYN] Seq=0 Win=26883 Len=0 MSS=8961 SACK_PERM=1 TSval=677862 TSecr=0 WS=128
  6   0.005981 54.192.141.180 -> 172.31.8.238 TCP 74 http > 54630 [SYN, ACK] Seq=0 Ack=1 Win=14480 Len=0 MSS=1460 SACK_PERM=1 TSval=873843989 TSecr=677862 WS=128
  7   0.005995 172.31.8.238 -> 54.192.141.180 TCP 66 54630 > http [ACK] Seq=1 Ack=1 Win=27008 Len=0 TSval=677862 TSecr=873843989
  8   0.006034 172.31.8.238 -> 54.192.141.180 HTTP 162 GET /1kb HTTP/1.1 
  9   0.008259 54.192.141.180 -> 172.31.8.238 TCP 66 http > 54630 [ACK] Seq=1 Ack=97 Win=14592 Len=0 TSval=873843990 TSecr=677862
 10   0.117552 54.192.141.180 -> 172.31.8.238 TCP 1169 [TCP segment of a reassembled PDU]
 11   0.117565 172.31.8.238 -> 54.192.141.180 TCP 66 54630 > http [ACK] Seq=97 Ack=1104 Win=29184 Len=0 TSval=677890 TSecr=873844000
 12   0.117583 54.192.141.180 -> 172.31.8.238 HTTP 430 HTTP/1.1 200 OK  (application/octet-stream)
 13   0.117587 172.31.8.238 -> 54.192.141.180 TCP 66 54630 > http [ACK] Seq=97 Ack=1468 Win=31360 Len=0 TSval=677890 TSecr=873844000
 14   0.117734 172.31.8.238 -> 54.192.141.180 TCP 66 54630 > http [FIN, ACK] Seq=97 Ack=1468 Win=31360 Len=0 TSval=677890 TSecr=873844000
 15   0.120114 54.192.141.180 -> 172.31.8.238 TCP 66 http > 54630 [FIN, ACK] Seq=1468 Ack=98 Win=14592 Len=0 TSval=873844001 TSecr=677890
 16   0.120123 172.31.8.238 -> 54.192.141.180 TCP 66 54630 > http [ACK] Seq=98 Ack=1469 Win=31360 Len=0 TSval=677891 TSecr=873844001
