[Measurement for 1kb at 07:43:06 20.43.2014] 
Tshark:

  1   0.000000 172.31.8.238 -> 172.31.0.2   DNS 89 Standard query 0x7d9c  A d1n0gskdvzj94j.cloudfront.net
  2   0.000039 172.31.8.238 -> 172.31.0.2   DNS 89 Standard query 0x832b  AAAA d1n0gskdvzj94j.cloudfront.net
  3   0.001427   172.31.0.2 -> 172.31.8.238 DNS 217 Standard query response 0x7d9c  A 54.230.117.5 A 54.230.117.21 A 54.230.117.69 A 54.230.118.239 A 54.230.119.110 A 54.192.118.230 A 54.192.118.238 A 54.230.116.72
  4   0.003576   172.31.0.2 -> 172.31.8.238 DNS 176 Standard query response 0x832b 
  5   0.003836 172.31.8.238 -> 54.230.117.5 TCP 74 46307 > http [SYN] Seq=0 Win=26883 Len=0 MSS=8961 SACK_PERM=1 TSval=13253441 TSecr=0 WS=128
  6   0.004426 54.230.117.5 -> 172.31.8.238 TCP 74 http > 46307 [SYN, ACK] Seq=0 Ack=1 Win=14480 Len=0 MSS=1460 SACK_PERM=1 TSval=1687363475 TSecr=13253441 WS=128
  7   0.004441 172.31.8.238 -> 54.230.117.5 TCP 66 46307 > http [ACK] Seq=1 Ack=1 Win=27008 Len=0 TSval=13253441 TSecr=1687363475
  8   0.004485 172.31.8.238 -> 54.230.117.5 HTTP 162 GET /1kb HTTP/1.1 
  9   0.005132 54.230.117.5 -> 172.31.8.238 TCP 66 http > 46307 [ACK] Seq=1 Ack=97 Win=14592 Len=0 TSval=1687363475 TSecr=13253441
 10   0.007711 54.230.117.5 -> 172.31.8.238 HTTP 1544 HTTP/1.1 200 OK  (application/octet-stream)
 11   0.007718 172.31.8.238 -> 54.230.117.5 TCP 66 46307 > http [ACK] Seq=97 Ack=1479 Win=29952 Len=0 TSval=13253441 TSecr=1687363476
 12   0.007913 172.31.8.238 -> 54.230.117.5 TCP 66 46307 > http [FIN, ACK] Seq=97 Ack=1479 Win=29952 Len=0 TSval=13253442 TSecr=1687363476
 13   0.008475 54.230.117.5 -> 172.31.8.238 TCP 66 http > 46307 [FIN, ACK] Seq=1479 Ack=98 Win=14592 Len=0 TSval=1687363476 TSecr=13253442
 14   0.008483 172.31.8.238 -> 54.230.117.5 TCP 66 46307 > http [ACK] Seq=98 Ack=1480 Win=29952 Len=0 TSval=13253442 TSecr=1687363476
