[Measurement for 1kb at 09:43:36 20.43.2014] 
Tshark:

  1   0.000000 172.31.8.238 -> 172.31.0.2   DNS 89 Standard query 0x8fe9  A d1n0gskdvzj94j.cloudfront.net
  2   0.000038 172.31.8.238 -> 172.31.0.2   DNS 89 Standard query 0x67bf  AAAA d1n0gskdvzj94j.cloudfront.net
  3   0.000780   172.31.0.2 -> 172.31.8.238 DNS 217 Standard query response 0x8fe9  A 54.230.119.55 A 54.230.119.150 A 54.239.132.147 A 54.239.132.233 A 54.192.118.218 A 54.230.116.98 A 54.230.118.146 A 54.230.119.11
  4   0.005174   172.31.0.2 -> 172.31.8.238 DNS 176 Standard query response 0x67bf 
  5   0.011974 172.31.8.238 -> 54.230.119.55 TCP 74 43253 > http [SYN] Seq=0 Win=26883 Len=0 MSS=8961 SACK_PERM=1 TSval=15061022 TSecr=0 WS=128
  6   0.012677 54.230.119.55 -> 172.31.8.238 TCP 74 http > 43253 [SYN, ACK] Seq=0 Ack=1 Win=14480 Len=0 MSS=1460 SACK_PERM=1 TSval=1687621924 TSecr=15061022 WS=128
  7   0.012693 172.31.8.238 -> 54.230.119.55 TCP 66 43253 > http [ACK] Seq=1 Ack=1 Win=27008 Len=0 TSval=15061022 TSecr=1687621924
  8   0.012752 172.31.8.238 -> 54.230.119.55 HTTP 162 GET /1kb HTTP/1.1 
  9   0.013408 54.230.119.55 -> 172.31.8.238 TCP 66 http > 43253 [ACK] Seq=1 Ack=97 Win=14592 Len=0 TSval=1687621924 TSecr=15061022
 10   0.014949 54.230.119.55 -> 172.31.8.238 HTTP 1544 HTTP/1.1 200 OK  (application/octet-stream)
 11   0.014956 172.31.8.238 -> 54.230.119.55 TCP 66 43253 > http [ACK] Seq=97 Ack=1479 Win=29952 Len=0 TSval=15061023 TSecr=1687621924
 12   0.015134 172.31.8.238 -> 54.230.119.55 TCP 66 43253 > http [FIN, ACK] Seq=97 Ack=1479 Win=29952 Len=0 TSval=15061023 TSecr=1687621924
 13   0.015845 54.230.119.55 -> 172.31.8.238 TCP 66 http > 43253 [FIN, ACK] Seq=1479 Ack=98 Win=14592 Len=0 TSval=1687621924 TSecr=15061023
 14   0.015854 172.31.8.238 -> 54.230.119.55 TCP 66 43253 > http [ACK] Seq=98 Ack=1480 Win=29952 Len=0 TSval=15061023 TSecr=1687621924
