[Measurement for 1kb at 10:43:06 20.43.2014] 
Tshark:

  1   0.000000 172.31.8.238 -> 172.31.0.2   DNS 89 Standard query 0x581c  A d1n0gskdvzj94j.cloudfront.net
  2   0.000037 172.31.8.238 -> 172.31.0.2   DNS 89 Standard query 0x1523  AAAA d1n0gskdvzj94j.cloudfront.net
  3   0.000558   172.31.0.2 -> 172.31.8.238 DNS 217 Standard query response 0x581c  A 54.239.132.41 A 54.239.132.55 A 54.239.132.84 A 54.239.132.196 A 54.192.118.219 A 54.230.116.136 A 54.230.117.156 A 54.230.118.239
  4   0.005817   172.31.0.2 -> 172.31.8.238 DNS 176 Standard query response 0x1523 
  5   0.012044 172.31.8.238 -> 54.239.132.41 TCP 74 54847 > http [SYN] Seq=0 Win=26883 Len=0 MSS=8961 SACK_PERM=1 TSval=15953452 TSecr=0 WS=128
  6   0.012835 54.239.132.41 -> 172.31.8.238 TCP 74 http > 54847 [SYN, ACK] Seq=0 Ack=1 Win=14480 Len=0 MSS=1460 SACK_PERM=1 TSval=1686157799 TSecr=15953452 WS=128
  7   0.012850 172.31.8.238 -> 54.239.132.41 TCP 66 54847 > http [ACK] Seq=1 Ack=1 Win=27008 Len=0 TSval=15953452 TSecr=1686157799
  8   0.012907 172.31.8.238 -> 54.239.132.41 HTTP 162 GET /1kb HTTP/1.1 
  9   0.013555 54.239.132.41 -> 172.31.8.238 TCP 66 http > 54847 [ACK] Seq=1 Ack=97 Win=14592 Len=0 TSval=1686157799 TSecr=15953452
 10   0.014870 54.239.132.41 -> 172.31.8.238 HTTP 1544 HTTP/1.1 200 OK  (application/octet-stream)
 11   0.014879 172.31.8.238 -> 54.239.132.41 TCP 66 54847 > http [ACK] Seq=97 Ack=1479 Win=29952 Len=0 TSval=15953453 TSecr=1686157799
 12   0.015051 172.31.8.238 -> 54.239.132.41 TCP 66 54847 > http [FIN, ACK] Seq=97 Ack=1479 Win=29952 Len=0 TSval=15953453 TSecr=1686157799
 13   0.015591 54.239.132.41 -> 172.31.8.238 TCP 66 http > 54847 [FIN, ACK] Seq=1479 Ack=98 Win=14592 Len=0 TSval=1686157799 TSecr=15953453
 14   0.015599 172.31.8.238 -> 54.239.132.41 TCP 66 54847 > http [ACK] Seq=98 Ack=1480 Win=29952 Len=0 TSval=15953453 TSecr=1686157799
