[Measurement for 1mb at 08:32:00 20.32.2014] 
Tshark:

  1   0.000000 172.31.36.109 -> 172.31.0.2   DNS 89 Standard query 0xb8ec  A d1dx94olpiqj0t.cloudfront.net
  2   0.000022 172.31.36.109 -> 172.31.0.2   DNS 89 Standard query 0xf6bb  AAAA d1dx94olpiqj0t.cloudfront.net
  3   0.000569   172.31.0.2 -> 172.31.36.109 DNS 176 Standard query response 0xf6bb 
  4   0.000580   172.31.0.2 -> 172.31.36.109 DNS 217 Standard query response 0xb8ec  A 54.230.20.111 A 54.230.21.79 A 54.230.21.133 A 54.230.21.212 A 216.137.41.32 A 216.137.41.101 A 216.137.41.193 A 216.137.41.243
  5   0.003842 172.31.36.109 -> 54.230.20.111 TCP 74 54671 > http [SYN] Seq=0 Win=26883 Len=0 MSS=8961 SACK_PERM=1 TSval=34001689 TSecr=0 WS=128
  6   0.091501 54.230.20.111 -> 172.31.36.109 TCP 74 http > 54671 [SYN, ACK] Seq=0 Ack=1 Win=14480 Len=0 MSS=1460 SACK_PERM=1 TSval=832988996 TSecr=34001689 WS=128
  7   0.091516 172.31.36.109 -> 54.230.20.111 TCP 66 54671 > http [ACK] Seq=1 Ack=1 Win=27008 Len=0 TSval=34001711 TSecr=832988996
  8   0.091562 172.31.36.109 -> 54.230.20.111 HTTP 162 GET /1mb HTTP/1.1 
  9   0.178796 54.230.20.111 -> 172.31.36.109 TCP 66 http > 54671 [ACK] Seq=1 Ack=97 Win=14592 Len=0 TSval=832989005 TSecr=34001711
 10   0.185716 54.230.20.111 -> 172.31.36.109 TCP 2962 [TCP segment of a reassembled PDU]
 11   0.185726 172.31.36.109 -> 54.230.20.111 TCP 66 54671 > http [ACK] Seq=97 Ack=2897 Win=32768 Len=0 TSval=34001734 TSecr=832989006
 12   0.185888 54.230.20.111 -> 172.31.36.109 TCP 1514 [TCP segment of a reassembled PDU]
 13   0.185894 172.31.36.109 -> 54.230.20.111 TCP 66 54671 > http [ACK] Seq=97 Ack=4345 Win=35584 Len=0 TSval=34001734 TSecr=832989006
 14   0.185980 54.230.20.111 -> 172.31.36.109 TCP 2580 [TCP segment of a reassembled PDU]
 15   0.185986 172.31.36.109 -> 54.230.20.111 TCP 66 54671 > http [ACK] Seq=97 Ack=6859 Win=40704 Len=0 TSval=34001734 TSecr=832989006
 16   0.185997 54.230.20.111 -> 172.31.36.109 TCP 7306 [TCP segment of a reassembled PDU]
 17   0.186003 172.31.36.109 -> 54.230.20.111 TCP 66 54671 > http [ACK] Seq=97 Ack=14099 Win=55168 Len=0 TSval=34001734 TSecr=832989006
 18   0.273453 54.230.20.111 -> 172.31.36.109 TCP 20338 [TCP segment of a reassembled PDU]
 19   0.273468 172.31.36.109 -> 54.230.20.111 TCP 66 54671 > http [ACK] Seq=97 Ack=34371 Win=84608 Len=0 TSval=34001756 TSecr=832989015
 20   0.360882 54.230.20.111 -> 172.31.36.109 TCP 5858 [TCP segment of a reassembled PDU]
 21   0.360890 172.31.36.109 -> 54.230.20.111 TCP 66 54671 > http [ACK] Seq=97 Ack=40163 Win=107264 Len=0 TSval=34001778 TSecr=832989023
 22   0.360899 54.230.20.111 -> 172.31.36.109 TCP 2962 [TCP segment of a reassembled PDU]
 23   0.360902 172.31.36.109 -> 54.230.20.111 TCP 66 54671 > http [ACK] Seq=97 Ack=43059 Win=113024 Len=0 TSval=34001778 TSecr=832989023
 24   0.361054 54.230.20.111 -> 172.31.36.109 TCP 4410 [TCP segment of a reassembled PDU]
 25   0.361060 172.31.36.109 -> 54.230.20.111 TCP 66 54671 > http [ACK] Seq=97 Ack=47403 Win=121728 Len=0 TSval=34001778 TSecr=832989023
 26   0.361137 54.230.20.111 -> 172.31.36.109 TCP 5858 [TCP segment of a reassembled PDU]
 27   0.361143 172.31.36.109 -> 54.230.20.111 TCP 66 54671 > http [ACK] Seq=97 Ack=53195 Win=133376 Len=0 TSval=34001778 TSecr=832989023
 28   0.448248 54.230.20.111 -> 172.31.36.109 TCP 13098 [TCP segment of a reassembled PDU]
 29   0.448259 172.31.36.109 -> 54.230.20.111 TCP 66 54671 > http [ACK] Seq=97 Ack=66227 Win=159360 Len=0 TSval=34001800 TSecr=832989032
 30   0.448438 54.230.20.111 -> 172.31.36.109 TCP 1514 [TCP segment of a reassembled PDU]
 31   0.448443 172.31.36.109 -> 54.230.20.111 TCP 66 54671 > http [ACK] Seq=97 Ack=67675 Win=162304 Len=0 TSval=34001800 TSecr=832989032
 32   0.448665 54.230.20.111 -> 172.31.36.109 TCP 11650 [TCP segment of a reassembled PDU]
 33   0.448673 172.31.36.109 -> 54.230.20.111 TCP 66 54671 > http [ACK] Seq=97 Ack=79259 Win=179200 Len=0 TSval=34001800 TSecr=832989032
 34   0.535465 54.230.20.111 -> 172.31.36.109 TCP 5858 [TCP segment of a reassembled PDU]
 35   0.535474 172.31.36.109 -> 54.230.20.111 TCP 66 54671 > http [ACK] Seq=97 Ack=85051 Win=188672 Len=0 TSval=34001822 TSecr=832989041
 36   0.535660 54.230.20.111 -> 172.31.36.109 TCP 10202 [TCP segment of a reassembled PDU]
 37   0.535669 172.31.36.109 -> 54.230.20.111 TCP 66 54671 > http [ACK] Seq=97 Ack=95187 Win=181632 Len=0 TSval=34001822 TSecr=832989041
 38   0.535915 54.230.20.111 -> 172.31.36.109 TCP 1514 [TCP segment of a reassembled PDU]
 39   0.535927 172.31.36.109 -> 54.230.20.111 TCP 66 54671 > http [ACK] Seq=97 Ack=96635 Win=195840 Len=0 TSval=34001822 TSecr=832989041
 40   0.536038 54.230.20.111 -> 172.31.36.109 TCP 10202 [TCP segment of a reassembled PDU]
 41   0.536045 172.31.36.109 -> 54.230.20.111 TCP 66 54671 > http [ACK] Seq=97 Ack=106771 Win=185728 Len=0 TSval=34001822 TSecr=832989041
 42   0.622942 54.230.20.111 -> 172.31.36.109 TCP 7306 [TCP segment of a reassembled PDU]
 43   0.622949 172.31.36.109 -> 54.230.20.111 TCP 66 54671 > http [ACK] Seq=97 Ack=114011 Win=186368 Len=0 TSval=34001844 TSecr=832989050
 44   0.622957 54.230.20.111 -> 172.31.36.109 TCP 4410 [TCP segment of a reassembled PDU]
 45   0.622961 172.31.36.109 -> 54.230.20.111 TCP 66 54671 > http [ACK] Seq=97 Ack=118355 Win=182144 Len=0 TSval=34001844 TSecr=832989050
 46   0.623140 54.230.20.111 -> 172.31.36.109 TCP 4410 [TCP segment of a reassembled PDU]
 47   0.623146 172.31.36.109 -> 54.230.20.111 TCP 66 54671 > http [ACK] Seq=97 Ack=122699 Win=200064 Len=0 TSval=34001844 TSecr=832989050
 48   0.623246 54.230.20.111 -> 172.31.36.109 TCP 7306 [TCP segment of a reassembled PDU]
 49   0.623253 172.31.36.109 -> 54.230.20.111 TCP 66 54671 > http [ACK] Seq=97 Ack=129939 Win=195328 Len=0 TSval=34001844 TSecr=832989050
 50   0.623340 54.230.20.111 -> 172.31.36.109 TCP 1514 [TCP segment of a reassembled PDU]
 51   0.623345 172.31.36.109 -> 54.230.20.111 TCP 66 54671 > http [ACK] Seq=97 Ack=131387 Win=204800 Len=0 TSval=34001844 TSecr=832989050
 52   0.623448 54.230.20.111 -> 172.31.36.109 TCP 2962 [TCP segment of a reassembled PDU]
 53   0.623464 172.31.36.109 -> 54.230.20.111 TCP 66 54671 > http [ACK] Seq=97 Ack=134283 Win=205696 Len=0 TSval=34001844 TSecr=832989050
 54   0.710315 54.230.20.111 -> 172.31.36.109 TCP 4410 [TCP segment of a reassembled PDU]
 55   0.710340 172.31.36.109 -> 54.230.20.111 TCP 66 54671 > http [ACK] Seq=97 Ack=138627 Win=205696 Len=0 TSval=34001866 TSecr=832989058
 56   0.710584 54.230.20.111 -> 172.31.36.109 TCP 17442 [TCP segment of a reassembled PDU]
 57   0.710620 172.31.36.109 -> 54.230.20.111 TCP 66 54671 > http [ACK] Seq=97 Ack=156003 Win=188416 Len=0 TSval=34001866 TSecr=832989058
 58   0.710660 54.230.20.111 -> 172.31.36.109 TCP 5858 [TCP segment of a reassembled PDU]
 59   0.710666 172.31.36.109 -> 54.230.20.111 TCP 66 54671 > http [ACK] Seq=97 Ack=161795 Win=197760 Len=0 TSval=34001866 TSecr=832989058
 60   0.711045 54.230.20.111 -> 172.31.36.109 TCP 5858 [TCP segment of a reassembled PDU]
 61   0.711052 172.31.36.109 -> 54.230.20.111 TCP 66 54671 > http [ACK] Seq=97 Ack=167587 Win=197760 Len=0 TSval=34001866 TSecr=832989058
 62   0.711146 54.230.20.111 -> 172.31.36.109 TCP 13098 [TCP segment of a reassembled PDU]
 63   0.711175 172.31.36.109 -> 54.230.20.111 TCP 66 54671 > http [ACK] Seq=97 Ack=180619 Win=205696 Len=0 TSval=34001866 TSecr=832989058
 64   0.797983 54.230.20.111 -> 172.31.36.109 TCP 5858 [TCP segment of a reassembled PDU]
 65   0.798007 172.31.36.109 -> 54.230.20.111 TCP 66 54671 > http [ACK] Seq=97 Ack=186411 Win=205696 Len=0 TSval=34001887 TSecr=832989067
 66   0.798017 54.230.20.111 -> 172.31.36.109 TCP 2962 [TCP segment of a reassembled PDU]
 67   0.798021 172.31.36.109 -> 54.230.20.111 TCP 66 54671 > http [ACK] Seq=97 Ack=189307 Win=211584 Len=0 TSval=34001887 TSecr=832989067
 68   0.798025 54.230.20.111 -> 172.31.36.109 TCP 2962 [TCP segment of a reassembled PDU]
 69   0.798028 172.31.36.109 -> 54.230.20.111 TCP 66 54671 > http [ACK] Seq=97 Ack=192203 Win=217344 Len=0 TSval=34001887 TSecr=832989067
 70   0.798224 54.230.20.111 -> 172.31.36.109 TCP 8754 [TCP segment of a reassembled PDU]
 71   0.798231 172.31.36.109 -> 54.230.20.111 TCP 66 54671 > http [ACK] Seq=97 Ack=200891 Win=234752 Len=0 TSval=34001888 TSecr=832989067
 72   0.798340 54.230.20.111 -> 172.31.36.109 TCP 11650 [TCP segment of a reassembled PDU]
 73   0.798348 172.31.36.109 -> 54.230.20.111 TCP 66 54671 > http [ACK] Seq=97 Ack=212475 Win=257920 Len=0 TSval=34001888 TSecr=832989067
 74   0.798988 54.230.20.111 -> 172.31.36.109 TCP 5858 [TCP segment of a reassembled PDU]
 75   0.799007 172.31.36.109 -> 54.230.20.111 TCP 66 54671 > http [ACK] Seq=97 Ack=218267 Win=269440 Len=0 TSval=34001888 TSecr=832989067
 76   0.799106 54.230.20.111 -> 172.31.36.109 TCP 10202 [TCP segment of a reassembled PDU]
 77   0.799113 172.31.36.109 -> 54.230.20.111 TCP 66 54671 > http [ACK] Seq=97 Ack=228403 Win=289664 Len=0 TSval=34001888 TSecr=832989067
 78   0.799203 54.230.20.111 -> 172.31.36.109 TCP 2962 [TCP segment of a reassembled PDU]
 79   0.799208 172.31.36.109 -> 54.230.20.111 TCP 66 54671 > http [ACK] Seq=97 Ack=231299 Win=295552 Len=0 TSval=34001888 TSecr=832989067
 80   0.885566 54.230.20.111 -> 172.31.36.109 TCP 10202 [TCP segment of a reassembled PDU]
 81   0.885576 172.31.36.109 -> 54.230.20.111 TCP 66 54671 > http [ACK] Seq=97 Ack=241435 Win=315776 Len=0 TSval=34001909 TSecr=832989076
 82   0.885854 54.230.20.111 -> 172.31.36.109 TCP 1514 [TCP segment of a reassembled PDU]
 83   0.885859 172.31.36.109 -> 54.230.20.111 TCP 66 54671 > http [ACK] Seq=97 Ack=242883 Win=318720 Len=0 TSval=34001909 TSecr=832989076
 84   0.886017 54.230.20.111 -> 172.31.36.109 TCP 18890 [TCP segment of a reassembled PDU]
 85   0.886028 172.31.36.109 -> 54.230.20.111 TCP 66 54671 > http [ACK] Seq=97 Ack=261707 Win=329472 Len=0 TSval=34001909 TSecr=832989076
 86   0.886115 54.230.20.111 -> 172.31.36.109 TCP 11650 [TCP segment of a reassembled PDU]
 87   0.886251 172.31.36.109 -> 54.230.20.111 TCP 66 54671 > http [ACK] Seq=97 Ack=273291 Win=317952 Len=0 TSval=34001910 TSecr=832989076
 88   0.886640 54.230.20.111 -> 172.31.36.109 TCP 1514 [TCP segment of a reassembled PDU]
 89   0.886652 172.31.36.109 -> 54.230.20.111 TCP 66 54671 > http [ACK] Seq=97 Ack=274739 Win=358016 Len=0 TSval=34001910 TSecr=832989076
 90   0.886785 54.230.20.111 -> 172.31.36.109 TCP 10202 [TCP segment of a reassembled PDU]
 91   0.886823 172.31.36.109 -> 54.230.20.111 TCP 66 54671 > http [ACK] Seq=97 Ack=284875 Win=358144 Len=0 TSval=34001910 TSecr=832989076
 92   0.886875 54.230.20.111 -> 172.31.36.109 TCP 11650 [TCP segment of a reassembled PDU]
 93   0.886894 172.31.36.109 -> 54.230.20.111 TCP 66 54671 > http [ACK] Seq=97 Ack=296459 Win=358144 Len=0 TSval=34001910 TSecr=832989076
 94   0.973342 54.230.20.111 -> 172.31.36.109 TCP 10202 [TCP segment of a reassembled PDU]
 95   0.973355 54.230.20.111 -> 172.31.36.109 TCP 4410 [TCP segment of a reassembled PDU]
 96   0.973374 172.31.36.109 -> 54.230.20.111 TCP 66 54671 > http [ACK] Seq=97 Ack=310939 Win=358144 Len=0 TSval=34001931 TSecr=832989085
 97   0.973450 54.230.20.111 -> 172.31.36.109 TCP 2962 [TCP segment of a reassembled PDU]
 98   0.973467 172.31.36.109 -> 54.230.20.111 TCP 66 54671 > http [ACK] Seq=97 Ack=313835 Win=358144 Len=0 TSval=34001931 TSecr=832989085
 99   0.973605 54.230.20.111 -> 172.31.36.109 TCP 15994 [TCP segment of a reassembled PDU]
100   0.973629 172.31.36.109 -> 54.230.20.111 TCP 66 54671 > http [ACK] Seq=97 Ack=329763 Win=358144 Len=0 TSval=34001931 TSecr=832989085
101   0.973702 54.230.20.111 -> 172.31.36.109 TCP 1514 [TCP segment of a reassembled PDU]
102   0.973710 54.230.20.111 -> 172.31.36.109 TCP 7306 [TCP segment of a reassembled PDU]
103   0.973741 172.31.36.109 -> 54.230.20.111 TCP 66 54671 > http [ACK] Seq=97 Ack=338451 Win=358144 Len=0 TSval=34001931 TSecr=832989085
104   0.974246 54.230.20.111 -> 172.31.36.109 TCP 1514 [TCP segment of a reassembled PDU]
105   0.974399 54.230.20.111 -> 172.31.36.109 TCP 15994 [TCP segment of a reassembled PDU]
106   0.974421 172.31.36.109 -> 54.230.20.111 TCP 66 54671 > http [ACK] Seq=97 Ack=355827 Win=358144 Len=0 TSval=34001932 TSecr=832989085
107   0.974484 54.230.20.111 -> 172.31.36.109 TCP 7306 [TCP segment of a reassembled PDU]
108   0.974503 172.31.36.109 -> 54.230.20.111 TCP 66 54671 > http [ACK] Seq=97 Ack=363067 Win=358144 Len=0 TSval=34001932 TSecr=832989085
109   0.974588 54.230.20.111 -> 172.31.36.109 TCP 8754 [TCP segment of a reassembled PDU]
110   0.974777 172.31.36.109 -> 54.230.20.111 TCP 66 54671 > http [ACK] Seq=97 Ack=371755 Win=358144 Len=0 TSval=34001932 TSecr=832989085
111   1.060898 54.230.20.111 -> 172.31.36.109 TCP 13098 [TCP segment of a reassembled PDU]
112   1.060912 54.230.20.111 -> 172.31.36.109 TCP 2962 [TCP segment of a reassembled PDU]
113   1.060934 172.31.36.109 -> 54.230.20.111 TCP 66 54671 > http [ACK] Seq=97 Ack=387683 Win=358144 Len=0 TSval=34001953 TSecr=832989093
114   1.061008 54.230.20.111 -> 172.31.36.109 TCP 2962 [TCP segment of a reassembled PDU]
115   1.061024 172.31.36.109 -> 54.230.20.111 TCP 66 54671 > http [ACK] Seq=97 Ack=390579 Win=358144 Len=0 TSval=34001953 TSecr=832989093
116   1.061147 54.230.20.111 -> 172.31.36.109 TCP 13098 [TCP segment of a reassembled PDU]
117   1.061166 172.31.36.109 -> 54.230.20.111 TCP 66 54671 > http [ACK] Seq=97 Ack=403611 Win=358144 Len=0 TSval=34001953 TSecr=832989093
118   1.061634 54.230.20.111 -> 172.31.36.109 TCP 13098 [TCP segment of a reassembled PDU]
119   1.061654 172.31.36.109 -> 54.230.20.111 TCP 66 54671 > http [ACK] Seq=97 Ack=416643 Win=358144 Len=0 TSval=34001953 TSecr=832989093
120   1.061712 54.230.20.111 -> 172.31.36.109 TCP 11650 [TCP segment of a reassembled PDU]
121   1.061731 172.31.36.109 -> 54.230.20.111 TCP 66 54671 > http [ACK] Seq=97 Ack=428227 Win=358144 Len=0 TSval=34001953 TSecr=832989093
122   1.061986 54.230.20.111 -> 172.31.36.109 TCP 10202 [TCP segment of a reassembled PDU]
123   1.062025 172.31.36.109 -> 54.230.20.111 TCP 66 54671 > http [ACK] Seq=97 Ack=438363 Win=358144 Len=0 TSval=34001953 TSecr=832989093
124   1.148309 54.230.20.111 -> 172.31.36.109 TCP 8754 [TCP segment of a reassembled PDU]
125   1.148344 54.230.20.111 -> 172.31.36.109 TCP 4410 [TCP segment of a reassembled PDU]
126   1.148350 172.31.36.109 -> 54.230.20.111 TCP 66 54671 > http [ACK] Seq=97 Ack=447051 Win=358144 Len=0 TSval=34001975 TSecr=832989102
127   1.148365 172.31.36.109 -> 54.230.20.111 TCP 66 54671 > http [ACK] Seq=97 Ack=451395 Win=358144 Len=0 TSval=34001975 TSecr=832989102
128   1.148582 54.230.20.111 -> 172.31.36.109 TCP 17442 [TCP segment of a reassembled PDU]
129   1.148607 172.31.36.109 -> 54.230.20.111 TCP 66 54671 > http [ACK] Seq=97 Ack=468771 Win=340864 Len=0 TSval=34001975 TSecr=832989102
130   1.149014 54.230.20.111 -> 172.31.36.109 TCP 5858 [TCP segment of a reassembled PDU]
131   1.149031 172.31.36.109 -> 54.230.20.111 TCP 66 54671 > http [ACK] Seq=97 Ack=474563 Win=350848 Len=0 TSval=34001975 TSecr=832989102
132   1.149156 54.230.20.111 -> 172.31.36.109 TCP 26130 [TCP segment of a reassembled PDU]
