[Measurement for 1mb at 13:32:29 20.32.2014] 
Tshark:

  1   0.000000 172.31.36.109 -> 172.31.0.2   DNS 89 Standard query 0xed2d  A d1dx94olpiqj0t.cloudfront.net
  2   0.000041 172.31.36.109 -> 172.31.0.2   DNS 89 Standard query 0x9e31  AAAA d1dx94olpiqj0t.cloudfront.net
  3   0.000341   172.31.0.2 -> 172.31.36.109 DNS 217 Standard query response 0xed2d  A 54.230.21.159 A 54.230.22.29 A 54.230.22.107 A 54.230.22.243 A 54.230.23.48 A 54.230.23.197 A 216.137.41.95 A 54.230.20.109
  4   0.000544   172.31.0.2 -> 172.31.36.109 DNS 176 Standard query response 0x9e31 
  5   0.003848 172.31.36.109 -> 54.230.21.159 TCP 74 36601 > http [SYN] Seq=0 Win=26883 Len=0 MSS=8961 SACK_PERM=1 TSval=38508917 TSecr=0 WS=128
  6   0.093619 54.230.21.159 -> 172.31.36.109 TCP 74 http > 36601 [SYN, ACK] Seq=0 Ack=1 Win=14480 Len=0 MSS=1460 SACK_PERM=1 TSval=912943441 TSecr=38508917 WS=128
  7   0.093667 172.31.36.109 -> 54.230.21.159 TCP 66 36601 > http [ACK] Seq=1 Ack=1 Win=27008 Len=0 TSval=38508939 TSecr=912943441
  8   0.093777 172.31.36.109 -> 54.230.21.159 HTTP 162 GET /1mb HTTP/1.1 
  9   0.183126 54.230.21.159 -> 172.31.36.109 TCP 66 http > 36601 [ACK] Seq=1 Ack=97 Win=14592 Len=0 TSval=912943450 TSecr=38508939
 10   0.187596 54.230.21.159 -> 172.31.36.109 TCP 13098 [TCP segment of a reassembled PDU]
 11   0.187615 172.31.36.109 -> 54.230.21.159 TCP 66 36601 > http [ACK] Seq=97 Ack=13033 Win=52992 Len=0 TSval=38508963 TSecr=912943450
 12   0.277267 54.230.21.159 -> 172.31.36.109 TCP 10202 [TCP segment of a reassembled PDU]
 13   0.277307 172.31.36.109 -> 54.230.21.159 TCP 66 36601 > http [ACK] Seq=97 Ack=23169 Win=73344 Len=0 TSval=38508985 TSecr=912943459
 14   0.277318 54.230.21.159 -> 172.31.36.109 TCP 2962 [TCP segment of a reassembled PDU]
 15   0.277322 172.31.36.109 -> 54.230.21.159 TCP 66 36601 > http [ACK] Seq=97 Ack=26065 Win=79104 Len=0 TSval=38508985 TSecr=912943459
 16   0.367014 54.230.21.159 -> 172.31.36.109 TCP 13098 [TCP segment of a reassembled PDU]
 17   0.367044 172.31.36.109 -> 54.230.21.159 TCP 66 36601 > http [ACK] Seq=97 Ack=39097 Win=96512 Len=0 TSval=38509007 TSecr=912943468
 18   0.456717 54.230.21.159 -> 172.31.36.109 TCP 11650 [TCP segment of a reassembled PDU]
 19   0.456745 172.31.36.109 -> 54.230.21.159 TCP 66 36601 > http [ACK] Seq=97 Ack=50681 Win=98944 Len=0 TSval=38509030 TSecr=912943477
 20   0.456754 54.230.21.159 -> 172.31.36.109 TCP 1514 [TCP segment of a reassembled PDU]
 21   0.456759 172.31.36.109 -> 54.230.21.159 TCP 66 36601 > http [ACK] Seq=97 Ack=52129 Win=97536 Len=0 TSval=38509030 TSecr=912943477
 22   0.456767 54.230.21.159 -> 172.31.36.109 TCP 7306 [TCP segment of a reassembled PDU]
 23   0.456772 172.31.36.109 -> 54.230.21.159 TCP 66 36601 > http [ACK] Seq=97 Ack=59369 Win=90368 Len=0 TSval=38509030 TSecr=912943477
 24   0.546571 54.230.21.159 -> 172.31.36.109 TCP 18890 [TCP segment of a reassembled PDU]
 25   0.546600 172.31.36.109 -> 54.230.21.159 TCP 66 36601 > http [ACK] Seq=97 Ack=78193 Win=86912 Len=0 TSval=38509052 TSecr=912943486
 26   0.636035 54.230.21.159 -> 172.31.36.109 TCP 4410 [TCP segment of a reassembled PDU]
 27   0.636060 172.31.36.109 -> 54.230.21.159 TCP 66 36601 > http [ACK] Seq=97 Ack=82537 Win=113792 Len=0 TSval=38509075 TSecr=912943495
 28   0.636093 54.230.21.159 -> 172.31.36.109 TCP 8754 [TCP segment of a reassembled PDU]
 29   0.636100 172.31.36.109 -> 54.230.21.159 TCP 66 36601 > http [ACK] Seq=97 Ack=91225 Win=131200 Len=0 TSval=38509075 TSecr=912943495
 30   0.636294 54.230.21.159 -> 172.31.36.109 TCP 13098 [TCP segment of a reassembled PDU]
 31   0.636304 172.31.36.109 -> 54.230.21.159 TCP 66 36601 > http [ACK] Seq=97 Ack=104257 Win=157312 Len=0 TSval=38509075 TSecr=912943495
 32   0.725703 54.230.21.159 -> 172.31.36.109 TCP 4410 [TCP segment of a reassembled PDU]
 33   0.725739 172.31.36.109 -> 54.230.21.159 TCP 66 36601 > http [ACK] Seq=97 Ack=108601 Win=166016 Len=0 TSval=38509097 TSecr=912943504
 34   0.725852 54.230.21.159 -> 172.31.36.109 TCP 8754 [TCP segment of a reassembled PDU]
 35   0.725861 172.31.36.109 -> 54.230.21.159 TCP 66 36601 > http [ACK] Seq=97 Ack=117289 Win=183296 Len=0 TSval=38509097 TSecr=912943504
 36   0.725912 54.230.21.159 -> 172.31.36.109 TCP 11650 [TCP segment of a reassembled PDU]
 37   0.725934 172.31.36.109 -> 54.230.21.159 TCP 66 36601 > http [ACK] Seq=97 Ack=128873 Win=206464 Len=0 TSval=38509097 TSecr=912943504
 38   0.725939 54.230.21.159 -> 172.31.36.109 TCP 1514 [TCP segment of a reassembled PDU]
 39   0.725943 172.31.36.109 -> 54.230.21.159 TCP 66 36601 > http [ACK] Seq=97 Ack=130321 Win=209408 Len=0 TSval=38509097 TSecr=912943504
 40   0.815568 54.230.21.159 -> 172.31.36.109 TCP 14546 [TCP segment of a reassembled PDU]
 41   0.815598 172.31.36.109 -> 54.230.21.159 TCP 66 36601 > http [ACK] Seq=97 Ack=144801 Win=238336 Len=0 TSval=38509120 TSecr=912943513
 42   0.815689 54.230.21.159 -> 172.31.36.109 TCP 4410 [TCP segment of a reassembled PDU]
 43   0.815696 172.31.36.109 -> 54.230.21.159 TCP 66 36601 > http [ACK] Seq=97 Ack=149145 Win=247040 Len=0 TSval=38509120 TSecr=912943513
 44   0.815771 54.230.21.159 -> 172.31.36.109 TCP 7306 [TCP segment of a reassembled PDU]
 45   0.815779 172.31.36.109 -> 54.230.21.159 TCP 66 36601 > http [ACK] Seq=97 Ack=156385 Win=261504 Len=0 TSval=38509120 TSecr=912943513
 46   0.905129 54.230.21.159 -> 172.31.36.109 TCP 4410 [TCP segment of a reassembled PDU]
 47   0.905154 172.31.36.109 -> 54.230.21.159 TCP 66 36601 > http [ACK] Seq=97 Ack=160729 Win=270208 Len=0 TSval=38509142 TSecr=912943522
 48   0.905167 54.230.21.159 -> 172.31.36.109 TCP 4410 [TCP segment of a reassembled PDU]
 49   0.905173 172.31.36.109 -> 54.230.21.159 TCP 66 36601 > http [ACK] Seq=97 Ack=165073 Win=278912 Len=0 TSval=38509142 TSecr=912943522
 50   0.905292 54.230.21.159 -> 172.31.36.109 TCP 5858 [TCP segment of a reassembled PDU]
 51   0.905299 172.31.36.109 -> 54.230.21.159 TCP 66 36601 > http [ACK] Seq=97 Ack=170865 Win=290432 Len=0 TSval=38509142 TSecr=912943522
 52   0.905401 54.230.21.159 -> 172.31.36.109 TCP 11650 [TCP segment of a reassembled PDU]
 53   0.905408 172.31.36.109 -> 54.230.21.159 TCP 66 36601 > http [ACK] Seq=97 Ack=182449 Win=305408 Len=0 TSval=38509142 TSecr=912943522
 54   0.905448 54.230.21.159 -> 172.31.36.109 TCP 8754 [TCP segment of a reassembled PDU]
 55   0.905455 172.31.36.109 -> 54.230.21.159 TCP 66 36601 > http [ACK] Seq=97 Ack=191137 Win=310144 Len=0 TSval=38509142 TSecr=912943522
 56   0.905484 54.230.21.159 -> 172.31.36.109 TCP 5858 [TCP segment of a reassembled PDU]
 57   0.905489 172.31.36.109 -> 54.230.21.159 TCP 66 36601 > http [ACK] Seq=97 Ack=196929 Win=314880 Len=0 TSval=38509142 TSecr=912943522
 58   0.994955 54.230.21.159 -> 172.31.36.109 TCP 4410 [TCP segment of a reassembled PDU]
 59   0.994980 172.31.36.109 -> 54.230.21.159 TCP 66 36601 > http [ACK] Seq=97 Ack=201273 Win=317184 Len=0 TSval=38509164 TSecr=912943531
 60   0.995007 54.230.21.159 -> 172.31.36.109 TCP 10202 [TCP segment of a reassembled PDU]
 61   0.995014 172.31.36.109 -> 54.230.21.159 TCP 66 36601 > http [ACK] Seq=97 Ack=211409 Win=307072 Len=0 TSval=38509164 TSecr=912943531
 62   0.995094 54.230.21.159 -> 172.31.36.109 TCP 1514 [TCP segment of a reassembled PDU]
 63   0.995225 54.230.21.159 -> 172.31.36.109 TCP 13098 [TCP segment of a reassembled PDU]
 64   0.995247 172.31.36.109 -> 54.230.21.159 TCP 66 36601 > http [ACK] Seq=97 Ack=225889 Win=324480 Len=0 TSval=38509165 TSecr=912943531
 65   0.995342 54.230.21.159 -> 172.31.36.109 TCP 17442 [TCP segment of a reassembled PDU]
 66   0.995365 172.31.36.109 -> 54.230.21.159 TCP 66 36601 > http [ACK] Seq=97 Ack=243265 Win=307200 Len=0 TSval=38509165 TSecr=912943531
 67   0.995382 54.230.21.159 -> 172.31.36.109 TCP 2962 [TCP segment of a reassembled PDU]
 68   0.995391 172.31.36.109 -> 54.230.21.159 TCP 66 36601 > http [ACK] Seq=97 Ack=246161 Win=324480 Len=0 TSval=38509165 TSecr=912943531
 69   1.084841 54.230.21.159 -> 172.31.36.109 TCP 11650 [TCP segment of a reassembled PDU]
 70   1.084920 172.31.36.109 -> 54.230.21.159 TCP 66 36601 > http [ACK] Seq=97 Ack=257745 Win=324864 Len=0 TSval=38509187 TSecr=912943540
 71   1.084984 54.230.21.159 -> 172.31.36.109 TCP 4410 [TCP segment of a reassembled PDU]
 72   1.084991 172.31.36.109 -> 54.230.21.159 TCP 66 36601 > http [ACK] Seq=97 Ack=262089 Win=333440 Len=0 TSval=38509187 TSecr=912943540
 73   1.085117 54.230.21.159 -> 172.31.36.109 TCP 17442 [TCP segment of a reassembled PDU]
 74   1.085128 172.31.36.109 -> 54.230.21.159 TCP 66 36601 > http [ACK] Seq=97 Ack=279465 Win=349824 Len=0 TSval=38509187 TSecr=912943540
 75   1.085193 54.230.21.159 -> 172.31.36.109 TCP 2962 [TCP segment of a reassembled PDU]
 76   1.085198 172.31.36.109 -> 54.230.21.159 TCP 66 36601 > http [ACK] Seq=97 Ack=282361 Win=373632 Len=0 TSval=38509187 TSecr=912943540
 77   1.085331 54.230.21.159 -> 172.31.36.109 TCP 15994 [TCP segment of a reassembled PDU]
 78   1.085357 172.31.36.109 -> 54.230.21.159 TCP 66 36601 > http [ACK] Seq=97 Ack=298289 Win=374016 Len=0 TSval=38509187 TSecr=912943540
 79   1.174722 54.230.21.159 -> 172.31.36.109 TCP 7306 [TCP segment of a reassembled PDU]
 80   1.174769 54.230.21.159 -> 172.31.36.109 TCP 10202 [TCP segment of a reassembled PDU]
 81   1.174837 172.31.36.109 -> 54.230.21.159 TCP 66 36601 > http [ACK] Seq=97 Ack=315665 Win=361856 Len=0 TSval=38509209 TSecr=912943549
 82   1.174916 54.230.21.159 -> 172.31.36.109 TCP 26130 [TCP segment of a reassembled PDU]
