[Measurement for 1mb at 17:38:14 19.38.2014] 
Tshark:

  1   0.000000 172.31.36.109 -> 172.31.0.2   DNS 89 Standard query 0xefb7  A d2pcb72msibvx3.cloudfront.net
  2   0.000029 172.31.36.109 -> 172.31.0.2   DNS 89 Standard query 0x8e7a  AAAA d2pcb72msibvx3.cloudfront.net
  3   0.000729   172.31.0.2 -> 172.31.36.109 DNS 217 Standard query response 0xefb7  A 54.230.30.50 A 54.230.30.191 A 54.230.30.193 A 54.230.30.214 A 54.192.30.136 A 54.192.30.137 A 54.192.30.215 A 54.230.30.47
  4   0.000739   172.31.0.2 -> 172.31.36.109 DNS 169 Standard query response 0x8e7a 
  5   0.003882 172.31.36.109 -> 54.230.30.50 TCP 74 35153 > http [SYN] Seq=0 Win=26883 Len=0 MSS=8961 SACK_PERM=1 TSval=20595140 TSecr=0 WS=128
  6   0.005467 54.230.30.50 -> 172.31.36.109 TCP 74 http > 35153 [SYN, ACK] Seq=0 Ack=1 Win=14480 Len=0 MSS=1460 SACK_PERM=1 TSval=828222252 TSecr=20595140 WS=128
  7   0.005483 172.31.36.109 -> 54.230.30.50 TCP 66 35153 > http [ACK] Seq=1 Ack=1 Win=27008 Len=0 TSval=20595140 TSecr=828222252
  8   0.005537 172.31.36.109 -> 54.230.30.50 HTTP 162 GET /1mb HTTP/1.1 
  9   0.006908 54.230.30.50 -> 172.31.36.109 TCP 66 http > 35153 [ACK] Seq=1 Ack=97 Win=14592 Len=0 TSval=828222252 TSecr=20595140
 10   0.375365 54.230.30.50 -> 172.31.36.109 TCP 14201 [TCP segment of a reassembled PDU]
 11   0.375395 172.31.36.109 -> 54.230.30.50 TCP 66 35153 > http [ACK] Seq=97 Ack=14136 Win=55168 Len=0 TSval=20595232 TSecr=828222289
 12   0.376828 54.230.30.50 -> 172.31.36.109 TCP 854 [TCP segment of a reassembled PDU]
 13   0.376835 172.31.36.109 -> 54.230.30.50 TCP 66 35153 > http [ACK] Seq=97 Ack=14924 Win=58112 Len=0 TSval=20595233 TSecr=828222289
 14   0.700122 54.230.30.50 -> 172.31.36.109 TCP 1514 [TCP segment of a reassembled PDU]
