[Measurement for 1mb at 13:35:19 20.35.2014] 
Tshark:

  1   0.000000 172.31.36.109 -> 172.31.0.2   DNS 89 Standard query 0x9579  A d2pcb72msibvx3.cloudfront.net
  2   0.000027 172.31.36.109 -> 172.31.0.2   DNS 89 Standard query 0xd7c4  AAAA d2pcb72msibvx3.cloudfront.net
  3   0.000649   172.31.0.2 -> 172.31.36.109 DNS 217 Standard query response 0x9579  A 54.230.29.254 A 54.230.30.17 A 54.230.30.202 A 54.230.30.213 A 54.230.30.221 A 54.230.31.9 A 54.192.30.189 A 54.192.30.229
  4   0.000662   172.31.0.2 -> 172.31.36.109 DNS 169 Standard query response 0xd7c4 
  5   0.003868 172.31.36.109 -> 54.230.29.254 TCP 74 44408 > http [SYN] Seq=0 Win=26883 Len=0 MSS=8961 SACK_PERM=1 TSval=38551426 TSecr=0 WS=128
  6   0.005092 54.230.29.254 -> 172.31.36.109 TCP 74 http > 44408 [SYN, ACK] Seq=0 Ack=1 Win=14480 Len=0 MSS=1460 SACK_PERM=1 TSval=681511920 TSecr=38551426 WS=128
  7   0.005107 172.31.36.109 -> 54.230.29.254 TCP 66 44408 > http [ACK] Seq=1 Ack=1 Win=27008 Len=0 TSval=38551427 TSecr=681511920
  8   0.005145 172.31.36.109 -> 54.230.29.254 HTTP 162 GET /1mb HTTP/1.1 
  9   0.006307 54.230.29.254 -> 172.31.36.109 TCP 66 http > 44408 [ACK] Seq=1 Ack=97 Win=14592 Len=0 TSval=681511920 TSecr=38551427
 10   0.214827 54.230.29.254 -> 172.31.36.109 TCP 5858 [TCP segment of a reassembled PDU]
 11   0.214852 172.31.36.109 -> 54.230.29.254 TCP 66 44408 > http [ACK] Seq=97 Ack=5793 Win=38528 Len=0 TSval=38551479 TSecr=681511941
 12   0.214866 54.230.29.254 -> 172.31.36.109 TCP 7306 [TCP segment of a reassembled PDU]
 13   0.214873 172.31.36.109 -> 54.230.29.254 TCP 66 44408 > http [ACK] Seq=97 Ack=13033 Win=52992 Len=0 TSval=38551479 TSecr=681511941
 14   0.216159 54.230.29.254 -> 172.31.36.109 TCP 10202 [TCP segment of a reassembled PDU]
 15   0.216170 172.31.36.109 -> 54.230.29.254 TCP 66 44408 > http [ACK] Seq=97 Ack=23169 Win=73344 Len=0 TSval=38551479 TSecr=681511941
 16   0.216274 54.230.29.254 -> 172.31.36.109 TCP 2962 [TCP segment of a reassembled PDU]
 17   0.216281 172.31.36.109 -> 54.230.29.254 TCP 66 44408 > http [ACK] Seq=97 Ack=26065 Win=79104 Len=0 TSval=38551479 TSecr=681511941
 18   0.217554 54.230.29.254 -> 172.31.36.109 TCP 1514 [TCP segment of a reassembled PDU]
 19   0.217560 172.31.36.109 -> 54.230.29.254 TCP 66 44408 > http [ACK] Seq=97 Ack=27513 Win=81920 Len=0 TSval=38551480 TSecr=681511941
 20   0.217645 54.230.29.254 -> 172.31.36.109 TCP 8754 [TCP segment of a reassembled PDU]
 21   0.217653 172.31.36.109 -> 54.230.29.254 TCP 66 44408 > http [ACK] Seq=97 Ack=36201 Win=99328 Len=0 TSval=38551480 TSecr=681511941
 22   0.217659 54.230.29.254 -> 172.31.36.109 TCP 1514 [TCP segment of a reassembled PDU]
 23   0.217661 172.31.36.109 -> 54.230.29.254 TCP 66 44408 > http [ACK] Seq=97 Ack=37649 Win=101248 Len=0 TSval=38551480 TSecr=681511941
 24   0.217750 54.230.29.254 -> 172.31.36.109 TCP 1514 [TCP segment of a reassembled PDU]
 25   0.217754 172.31.36.109 -> 54.230.29.254 TCP 66 44408 > http [ACK] Seq=97 Ack=39097 Win=105088 Len=0 TSval=38551480 TSecr=681511941
 26   0.217835 54.230.29.254 -> 172.31.36.109 TCP 7306 [TCP segment of a reassembled PDU]
 27   0.217842 172.31.36.109 -> 54.230.29.254 TCP 66 44408 > http [ACK] Seq=97 Ack=46337 Win=105984 Len=0 TSval=38551480 TSecr=681511942
 28   0.218959 54.230.29.254 -> 172.31.36.109 TCP 5858 [TCP segment of a reassembled PDU]
 29   0.218971 172.31.36.109 -> 54.230.29.254 TCP 66 44408 > http [ACK] Seq=97 Ack=52129 Win=108416 Len=0 TSval=38551480 TSecr=681511942
 30   0.219002 54.230.29.254 -> 172.31.36.109 TCP 7306 [TCP segment of a reassembled PDU]
 31   0.219010 172.31.36.109 -> 54.230.29.254 TCP 66 44408 > http [ACK] Seq=97 Ack=59369 Win=101248 Len=0 TSval=38551480 TSecr=681511942
 32   0.219082 54.230.29.254 -> 172.31.36.109 TCP 2962 [TCP segment of a reassembled PDU]
 33   0.219088 172.31.36.109 -> 54.230.29.254 TCP 66 44408 > http [ACK] Seq=97 Ack=62265 Win=109056 Len=0 TSval=38551480 TSecr=681511942
 34   0.219151 54.230.29.254 -> 172.31.36.109 TCP 2962 [TCP segment of a reassembled PDU]
 35   0.219157 172.31.36.109 -> 54.230.29.254 TCP 66 44408 > http [ACK] Seq=97 Ack=65161 Win=109056 Len=0 TSval=38551480 TSecr=681511942
 36   0.220235 54.230.29.254 -> 172.31.36.109 TCP 4410 [TCP segment of a reassembled PDU]
 37   0.220242 172.31.36.109 -> 54.230.29.254 TCP 66 44408 > http [ACK] Seq=97 Ack=69505 Win=109056 Len=0 TSval=38551480 TSecr=681511942
 38   0.220318 54.230.29.254 -> 172.31.36.109 TCP 7306 [TCP segment of a reassembled PDU]
 39   0.220325 172.31.36.109 -> 54.230.29.254 TCP 66 44408 > http [ACK] Seq=97 Ack=76745 Win=105984 Len=0 TSval=38551480 TSecr=681511942
 40   0.220395 54.230.29.254 -> 172.31.36.109 TCP 4410 [TCP segment of a reassembled PDU]
 41   0.220401 172.31.36.109 -> 54.230.29.254 TCP 66 44408 > http [ACK] Seq=97 Ack=81089 Win=109056 Len=0 TSval=38551480 TSecr=681511942
 42   0.220468 54.230.29.254 -> 172.31.36.109 TCP 4410 [TCP segment of a reassembled PDU]
 43   0.220474 172.31.36.109 -> 54.230.29.254 TCP 66 44408 > http [ACK] Seq=97 Ack=85433 Win=109056 Len=0 TSval=38551480 TSecr=681511942
 44   0.220547 54.230.29.254 -> 172.31.36.109 TCP 4410 [TCP segment of a reassembled PDU]
 45   0.220554 172.31.36.109 -> 54.230.29.254 TCP 66 44408 > http [ACK] Seq=97 Ack=89777 Win=109056 Len=0 TSval=38551481 TSecr=681511942
 46   0.221482 54.230.29.254 -> 172.31.36.109 TCP 1514 [TCP segment of a reassembled PDU]
 47   0.221488 172.31.36.109 -> 54.230.29.254 TCP 66 44408 > http [ACK] Seq=97 Ack=91225 Win=112000 Len=0 TSval=38551481 TSecr=681511942
 48   0.221597 54.230.29.254 -> 172.31.36.109 TCP 10202 [TCP segment of a reassembled PDU]
 49   0.221605 172.31.36.109 -> 54.230.29.254 TCP 66 44408 > http [ACK] Seq=97 Ack=101361 Win=132224 Len=0 TSval=38551481 TSecr=681511942
 50   0.221668 54.230.29.254 -> 172.31.36.109 TCP 1514 [TCP segment of a reassembled PDU]
 51   0.221673 172.31.36.109 -> 54.230.29.254 TCP 66 44408 > http [ACK] Seq=97 Ack=102809 Win=135168 Len=0 TSval=38551481 TSecr=681511942
 52   0.221736 54.230.29.254 -> 172.31.36.109 TCP 1514 [TCP segment of a reassembled PDU]
 53   0.221741 172.31.36.109 -> 54.230.29.254 TCP 66 44408 > http [ACK] Seq=97 Ack=104257 Win=137984 Len=0 TSval=38551481 TSecr=681511942
 54   0.221898 54.230.29.254 -> 172.31.36.109 TCP 1514 [TCP segment of a reassembled PDU]
 55   0.221903 172.31.36.109 -> 54.230.29.254 TCP 66 44408 > http [ACK] Seq=97 Ack=105705 Win=140928 Len=0 TSval=38551481 TSecr=681511942
 56   0.221977 54.230.29.254 -> 172.31.36.109 TCP 5858 [TCP segment of a reassembled PDU]
 57   0.221984 172.31.36.109 -> 54.230.29.254 TCP 66 44408 > http [ACK] Seq=97 Ack=111497 Win=152448 Len=0 TSval=38551481 TSecr=681511942
 58   0.222056 54.230.29.254 -> 172.31.36.109 TCP 4410 [TCP segment of a reassembled PDU]
 59   0.222062 172.31.36.109 -> 54.230.29.254 TCP 66 44408 > http [ACK] Seq=97 Ack=115841 Win=161152 Len=0 TSval=38551481 TSecr=681511942
 60   0.222126 54.230.29.254 -> 172.31.36.109 TCP 2962 [TCP segment of a reassembled PDU]
 61   0.222132 172.31.36.109 -> 54.230.29.254 TCP 66 44408 > http [ACK] Seq=97 Ack=118737 Win=167040 Len=0 TSval=38551481 TSecr=681511942
 62   0.222218 54.230.29.254 -> 172.31.36.109 TCP 11650 [TCP segment of a reassembled PDU]
 63   0.222228 172.31.36.109 -> 54.230.29.254 TCP 66 44408 > http [ACK] Seq=97 Ack=130321 Win=190208 Len=0 TSval=38551481 TSecr=681511942
 64   0.222828 54.230.29.254 -> 172.31.36.109 TCP 5858 [TCP segment of a reassembled PDU]
 65   0.222836 172.31.36.109 -> 54.230.29.254 TCP 66 44408 > http [ACK] Seq=97 Ack=136113 Win=201728 Len=0 TSval=38551481 TSecr=681511942
 66   0.222918 54.230.29.254 -> 172.31.36.109 TCP 8754 [TCP segment of a reassembled PDU]
 67   0.222926 172.31.36.109 -> 54.230.29.254 TCP 66 44408 > http [ACK] Seq=97 Ack=144801 Win=219136 Len=0 TSval=38551481 TSecr=681511942
 68   0.223326 54.230.29.254 -> 172.31.36.109 TCP 2962 [TCP segment of a reassembled PDU]
 69   0.223332 172.31.36.109 -> 54.230.29.254 TCP 66 44408 > http [ACK] Seq=97 Ack=147697 Win=224896 Len=0 TSval=38551481 TSecr=681511942
 70   0.223454 54.230.29.254 -> 172.31.36.109 TCP 13098 [TCP segment of a reassembled PDU]
 71   0.223464 172.31.36.109 -> 54.230.29.254 TCP 66 44408 > http [ACK] Seq=97 Ack=160729 Win=251008 Len=0 TSval=38551481 TSecr=681511942
 72   0.223544 54.230.29.254 -> 172.31.36.109 TCP 8754 [TCP segment of a reassembled PDU]
 73   0.223552 172.31.36.109 -> 54.230.29.254 TCP 66 44408 > http [ACK] Seq=97 Ack=169417 Win=268288 Len=0 TSval=38551481 TSecr=681511942
 74   0.223779 54.230.29.254 -> 172.31.36.109 TCP 13098 [TCP segment of a reassembled PDU]
 75   0.223789 172.31.36.109 -> 54.230.29.254 TCP 66 44408 > http [ACK] Seq=97 Ack=182449 Win=294400 Len=0 TSval=38551481 TSecr=681511942
 76   0.224275 54.230.29.254 -> 172.31.36.109 TCP 10202 [TCP segment of a reassembled PDU]
 77   0.224284 172.31.36.109 -> 54.230.29.254 TCP 66 44408 > http [ACK] Seq=97 Ack=192585 Win=314624 Len=0 TSval=38551481 TSecr=681511942
 78   0.224364 54.230.29.254 -> 172.31.36.109 TCP 8754 [TCP segment of a reassembled PDU]
 79   0.224372 172.31.36.109 -> 54.230.29.254 TCP 66 44408 > http [ACK] Seq=97 Ack=201273 Win=332032 Len=0 TSval=38551481 TSecr=681511942
 80   0.224777 54.230.29.254 -> 172.31.36.109 TCP 1514 [TCP segment of a reassembled PDU]
 81   0.224782 172.31.36.109 -> 54.230.29.254 TCP 66 44408 > http [ACK] Seq=97 Ack=202721 Win=334976 Len=0 TSval=38551482 TSecr=681511942
 82   0.224920 54.230.29.254 -> 172.31.36.109 TCP 10202 [TCP segment of a reassembled PDU]
 83   0.224928 172.31.36.109 -> 54.230.29.254 TCP 66 44408 > http [ACK] Seq=97 Ack=212857 Win=355200 Len=0 TSval=38551482 TSecr=681511942
 84   0.224994 54.230.29.254 -> 172.31.36.109 TCP 1514 [TCP segment of a reassembled PDU]
 85   0.224999 172.31.36.109 -> 54.230.29.254 TCP 66 44408 > http [ACK] Seq=97 Ack=214305 Win=358144 Len=0 TSval=38551482 TSecr=681511942
 86   0.225157 54.230.29.254 -> 172.31.36.109 TCP 15994 [TCP segment of a reassembled PDU]
 87   0.225167 172.31.36.109 -> 54.230.29.254 TCP 66 44408 > http [ACK] Seq=97 Ack=230233 Win=390016 Len=0 TSval=38551482 TSecr=681511942
 88   0.225303 54.230.29.254 -> 172.31.36.109 TCP 4410 [TCP segment of a reassembled PDU]
 89   0.225309 172.31.36.109 -> 54.230.29.254 TCP 66 44408 > http [ACK] Seq=97 Ack=234577 Win=398720 Len=0 TSval=38551482 TSecr=681511942
 90   0.225573 54.230.29.254 -> 172.31.36.109 TCP 1514 [TCP segment of a reassembled PDU]
 91   0.225582 172.31.36.109 -> 54.230.29.254 TCP 66 44408 > http [ACK] Seq=97 Ack=236025 Win=401536 Len=0 TSval=38551482 TSecr=681511942
 92   0.225655 54.230.29.254 -> 172.31.36.109 TCP 1514 [TCP segment of a reassembled PDU]
 93   0.225661 172.31.36.109 -> 54.230.29.254 TCP 66 44408 > http [ACK] Seq=97 Ack=237473 Win=404480 Len=0 TSval=38551482 TSecr=681511942
 94   0.225744 54.230.29.254 -> 172.31.36.109 TCP 4410 [TCP segment of a reassembled PDU]
 95   0.225750 172.31.36.109 -> 54.230.29.254 TCP 66 44408 > http [ACK] Seq=97 Ack=241817 Win=413184 Len=0 TSval=38551482 TSecr=681511942
 96   0.225836 54.230.29.254 -> 172.31.36.109 TCP 8754 [TCP segment of a reassembled PDU]
 97   0.225844 172.31.36.109 -> 54.230.29.254 TCP 66 44408 > http [ACK] Seq=97 Ack=250505 Win=430464 Len=0 TSval=38551482 TSecr=681511942
 98   0.225917 54.230.29.254 -> 172.31.36.109 TCP 5858 [TCP segment of a reassembled PDU]
 99   0.225923 172.31.36.109 -> 54.230.29.254 TCP 66 44408 > http [ACK] Seq=97 Ack=256297 Win=442112 Len=0 TSval=38551482 TSecr=681511942
100   0.226002 54.230.29.254 -> 172.31.36.109 TCP 1514 [TCP segment of a reassembled PDU]
101   0.226006 172.31.36.109 -> 54.230.29.254 TCP 66 44408 > http [ACK] Seq=97 Ack=257745 Win=445056 Len=0 TSval=38551482 TSecr=681511942
102   0.226101 54.230.29.254 -> 172.31.36.109 TCP 2962 [TCP segment of a reassembled PDU]
103   0.226105 172.31.36.109 -> 54.230.29.254 TCP 66 44408 > http [ACK] Seq=97 Ack=260641 Win=450816 Len=0 TSval=38551482 TSecr=681511942
104   0.226271 54.230.29.254 -> 172.31.36.109 TCP 1339 [TCP segment of a reassembled PDU]
105   0.226277 172.31.36.109 -> 54.230.29.254 TCP 66 44408 > http [ACK] Seq=97 Ack=261914 Win=453632 Len=0 TSval=38551482 TSecr=681511942
106   0.241977 54.230.29.254 -> 172.31.36.109 TCP 1514 [TCP segment of a reassembled PDU]
107   0.241991 172.31.36.109 -> 54.230.29.254 TCP 66 44408 > http [ACK] Seq=97 Ack=263362 Win=456576 Len=0 TSval=38551486 TSecr=681511944
108   0.242644 54.230.29.254 -> 172.31.36.109 TCP 1514 [TCP segment of a reassembled PDU]
109   0.242650 172.31.36.109 -> 54.230.29.254 TCP 66 44408 > http [ACK] Seq=97 Ack=264810 Win=459520 Len=0 TSval=38551486 TSecr=681511944
110   0.242794 54.230.29.254 -> 172.31.36.109 TCP 18890 [TCP segment of a reassembled PDU]
111   0.242805 172.31.36.109 -> 54.230.29.254 TCP 66 44408 > http [ACK] Seq=97 Ack=283634 Win=497152 Len=0 TSval=38551486 TSecr=681511944
112   0.242858 54.230.29.254 -> 172.31.36.109 TCP 21786 [TCP segment of a reassembled PDU]
113   0.242874 172.31.36.109 -> 54.230.29.254 TCP 66 44408 > http [ACK] Seq=97 Ack=305354 Win=540544 Len=0 TSval=38551486 TSecr=681511944
114   0.242894 54.230.29.254 -> 172.31.36.109 TCP 4410 [TCP segment of a reassembled PDU]
115   0.242900 172.31.36.109 -> 54.230.29.254 TCP 66 44408 > http [ACK] Seq=97 Ack=309698 Win=549248 Len=0 TSval=38551486 TSecr=681511944
116   0.243000 54.230.29.254 -> 172.31.36.109 TCP 11650 [TCP segment of a reassembled PDU]
117   0.243009 172.31.36.109 -> 54.230.29.254 TCP 66 44408 > http [ACK] Seq=97 Ack=321282 Win=572416 Len=0 TSval=38551486 TSecr=681511944
118   0.243147 54.230.29.254 -> 172.31.36.109 TCP 4410 [TCP segment of a reassembled PDU]
119   0.243153 172.31.36.109 -> 54.230.29.254 TCP 66 44408 > http [ACK] Seq=97 Ack=325626 Win=581120 Len=0 TSval=38551486 TSecr=681511944
120   0.243224 54.230.29.254 -> 172.31.36.109 TCP 3338 [TCP segment of a reassembled PDU]
121   0.243230 172.31.36.109 -> 54.230.29.254 TCP 66 44408 > http [ACK] Seq=97 Ack=328898 Win=587648 Len=0 TSval=38551486 TSecr=681511944
122   0.243250 54.230.29.254 -> 172.31.36.109 TCP 1138 [TCP segment of a reassembled PDU]
123   0.243257 172.31.36.109 -> 54.230.29.254 TCP 66 44408 > http [ACK] Seq=97 Ack=329970 Win=590592 Len=0 TSval=38551486 TSecr=681511944
124   0.243297 54.230.29.254 -> 172.31.36.109 TCP 1514 [TCP segment of a reassembled PDU]
125   0.243301 172.31.36.109 -> 54.230.29.254 TCP 66 44408 > http [ACK] Seq=97 Ack=331418 Win=593408 Len=0 TSval=38551486 TSecr=681511944
126   0.243923 54.230.29.254 -> 172.31.36.109 TCP 1514 [TCP segment of a reassembled PDU]
127   0.243927 172.31.36.109 -> 54.230.29.254 TCP 66 44408 > http [ACK] Seq=97 Ack=332866 Win=596352 Len=0 TSval=38551486 TSecr=681511944
128   0.244026 54.230.29.254 -> 172.31.36.109 TCP 2962 [TCP segment of a reassembled PDU]
129   0.244031 172.31.36.109 -> 54.230.29.254 TCP 66 44408 > http [ACK] Seq=97 Ack=335762 Win=602112 Len=0 TSval=38551486 TSecr=681511944
130   0.244230 54.230.29.254 -> 172.31.36.109 TCP 10202 [TCP segment of a reassembled PDU]
131   0.244238 172.31.36.109 -> 54.230.29.254 TCP 66 44408 > http [ACK] Seq=97 Ack=345898 Win=622464 Len=0 TSval=38551486 TSecr=681511944
132   0.244390 54.230.29.254 -> 172.31.36.109 TCP 29026 [TCP segment of a reassembled PDU]
133   0.244406 172.31.36.109 -> 54.230.29.254 TCP 66 44408 > http [ACK] Seq=97 Ack=374858 Win=680320 Len=0 TSval=38551486 TSecr=681511944
134   0.244530 54.230.29.254 -> 172.31.36.109 TCP 5858 [TCP segment of a reassembled PDU]
135   0.244537 172.31.36.109 -> 54.230.29.254 TCP 66 44408 > http [ACK] Seq=97 Ack=380650 Win=681600 Len=0 TSval=38551486 TSecr=681511944
136   0.244663 54.230.29.254 -> 172.31.36.109 TCP 15994 [TCP segment of a reassembled PDU]
137   0.244724 172.31.36.109 -> 54.230.29.254 TCP 66 44408 > http [ACK] Seq=97 Ack=396578 Win=665728 Len=0 TSval=38551487 TSecr=681511944
138   0.245511 54.230.29.254 -> 172.31.36.109 TCP 1514 [TCP segment of a reassembled PDU]
139   0.245516 172.31.36.109 -> 54.230.29.254 TCP 66 44408 > http [ACK] Seq=97 Ack=398026 Win=694784 Len=0 TSval=38551487 TSecr=681511944
140   0.245643 54.230.29.254 -> 172.31.36.109 TCP 10202 [TCP segment of a reassembled PDU]
141   0.245650 172.31.36.109 -> 54.230.29.254 TCP 66 44408 > http [ACK] Seq=97 Ack=408162 Win=715136 Len=0 TSval=38551487 TSecr=681511944
142   0.245723 54.230.29.254 -> 172.31.36.109 TCP 5858 [TCP segment of a reassembled PDU]
143   0.245730 172.31.36.109 -> 54.230.29.254 TCP 66 44408 > http [ACK] Seq=97 Ack=413954 Win=726656 Len=0 TSval=38551487 TSecr=681511944
144   0.245871 54.230.29.254 -> 172.31.36.109 TCP 14546 [TCP segment of a reassembled PDU]
145   0.245892 172.31.36.109 -> 54.230.29.254 TCP 66 44408 > http [ACK] Seq=97 Ack=428434 Win=726656 Len=0 TSval=38551487 TSecr=681511944
146   0.245983 54.230.29.254 -> 172.31.36.109 TCP 17442 [TCP segment of a reassembled PDU]
147   0.246005 172.31.36.109 -> 54.230.29.254 TCP 66 44408 > http [ACK] Seq=97 Ack=445810 Win=710272 Len=0 TSval=38551487 TSecr=681511944
148   0.246026 54.230.29.254 -> 172.31.36.109 TCP 2962 [TCP segment of a reassembled PDU]
149   0.246030 172.31.36.109 -> 54.230.29.254 TCP 66 44408 > http [ACK] Seq=97 Ack=448706 Win=732416 Len=0 TSval=38551487 TSecr=681511944
150   0.246158 54.230.29.254 -> 172.31.36.109 TCP 13098 [TCP segment of a reassembled PDU]
151   0.246177 172.31.36.109 -> 54.230.29.254 TCP 66 44408 > http [ACK] Seq=97 Ack=461738 Win=732416 Len=0 TSval=38551487 TSecr=681511944
152   0.246984 54.230.29.254 -> 172.31.36.109 TCP 2962 [TCP segment of a reassembled PDU]
153   0.246990 172.31.36.109 -> 54.230.29.254 TCP 66 44408 > http [ACK] Seq=97 Ack=464634 Win=734080 Len=0 TSval=38551487 TSecr=681511944
154   0.247135 54.230.29.254 -> 172.31.36.109 TCP 17442 [TCP segment of a reassembled PDU]
155   0.247156 172.31.36.109 -> 54.230.29.254 TCP 66 44408 > http [ACK] Seq=97 Ack=482010 Win=716800 Len=0 TSval=38551487 TSecr=681511944
156   0.247229 54.230.29.254 -> 172.31.36.109 TCP 4410 [TCP segment of a reassembled PDU]
157   0.247235 172.31.36.109 -> 54.230.29.254 TCP 66 44408 > http [ACK] Seq=97 Ack=486354 Win=731648 Len=0 TSval=38551487 TSecr=681511944
158   0.247388 54.230.29.254 -> 172.31.36.109 TCP 23234 [TCP segment of a reassembled PDU]
159   0.247422 172.31.36.109 -> 54.230.29.254 TCP 66 44408 > http [ACK] Seq=97 Ack=509522 Win=708480 Len=0 TSval=38551487 TSecr=681511944
160   0.247584 54.230.29.254 -> 172.31.36.109 TCP 14546 [TCP segment of a reassembled PDU]
161   0.247593 172.31.36.109 -> 54.230.29.254 TCP 66 44408 > http [ACK] Seq=97 Ack=524002 Win=715008 Len=0 TSval=38551487 TSecr=681511944
162   0.247598 54.230.29.254 -> 172.31.36.109 TCP 122 [TCP segment of a reassembled PDU]
163   0.247616 172.31.36.109 -> 54.230.29.254 TCP 66 44408 > http [ACK] Seq=97 Ack=524058 Win=738176 Len=0 TSval=38551487 TSecr=681511944
164   0.369860 54.230.29.254 -> 172.31.36.109 TCP 1514 [TCP segment of a reassembled PDU]
165   0.370009 54.230.29.254 -> 172.31.36.109 TCP 7306 [TCP segment of a reassembled PDU]
166   0.370088 54.230.29.254 -> 172.31.36.109 TCP 4410 [TCP segment of a reassembled PDU]
167   0.370094 172.31.36.109 -> 54.230.29.254 TCP 66 44408 > http [ACK] Seq=97 Ack=532746 Win=738176 Len=0 TSval=38551518 TSecr=681511957
168   0.370109 172.31.36.109 -> 54.230.29.254 TCP 66 44408 > http [ACK] Seq=97 Ack=537090 Win=738176 Len=0 TSval=38551518 TSecr=681511957
169   0.370263 54.230.29.254 -> 172.31.36.109 TCP 7306 [TCP segment of a reassembled PDU]
170   0.370284 172.31.36.109 -> 54.230.29.254 TCP 66 44408 > http [ACK] Seq=97 Ack=544330 Win=738176 Len=0 TSval=38551518 TSecr=681511957
171   0.370366 54.230.29.254 -> 172.31.36.109 TCP 5858 [TCP segment of a reassembled PDU]
172   0.370386 172.31.36.109 -> 54.230.29.254 TCP 66 44408 > http [ACK] Seq=97 Ack=550122 Win=738176 Len=0 TSval=38551518 TSecr=681511957
173   0.370434 54.230.29.254 -> 172.31.36.109 TCP 11650 [TCP segment of a reassembled PDU]
174   0.370459 172.31.36.109 -> 54.230.29.254 TCP 66 44408 > http [ACK] Seq=97 Ack=561706 Win=738176 Len=0 TSval=38551518 TSecr=681511957
175   0.370595 54.230.29.254 -> 172.31.36.109 TCP 10202 [TCP segment of a reassembled PDU]
176   0.370618 172.31.36.109 -> 54.230.29.254 TCP 66 44408 > http [ACK] Seq=97 Ack=571842 Win=738176 Len=0 TSval=38551518 TSecr=681511957
177   0.370672 54.230.29.254 -> 172.31.36.109 TCP 18890 [TCP segment of a reassembled PDU]
178   0.370698 172.31.36.109 -> 54.230.29.254 TCP 66 44408 > http [ACK] Seq=97 Ack=590666 Win=719360 Len=0 TSval=38551518 TSecr=681511957
179   0.370809 54.230.29.254 -> 172.31.36.109 TCP 5858 [TCP segment of a reassembled PDU]
180   0.370816 172.31.36.109 -> 54.230.29.254 TCP 66 44408 > http [ACK] Seq=97 Ack=596458 Win=729344 Len=0 TSval=38551518 TSecr=681511957
181   0.371250 54.230.29.254 -> 172.31.36.109 TCP 5858 [TCP segment of a reassembled PDU]
182   0.371258 172.31.36.109 -> 54.230.29.254 TCP 66 44408 > http [ACK] Seq=97 Ack=602250 Win=729344 Len=0 TSval=38551518 TSecr=681511957
183   0.371373 54.230.29.254 -> 172.31.36.109 TCP 7306 [TCP segment of a reassembled PDU]
184   0.371390 172.31.36.109 -> 54.230.29.254 TCP 66 44408 > http [ACK] Seq=97 Ack=609490 Win=738176 Len=0 TSval=38551518 TSecr=681511957
185   0.371648 54.230.29.254 -> 172.31.36.109 TCP 18890 [TCP segment of a reassembled PDU]
186   0.371670 172.31.36.109 -> 54.230.29.254 TCP 66 44408 > http [ACK] Seq=97 Ack=628314 Win=719360 Len=0 TSval=38551518 TSecr=681511957
187   0.371768 54.230.29.254 -> 172.31.36.109 TCP 7306 [TCP segment of a reassembled PDU]
188   0.371775 172.31.36.109 -> 54.230.29.254 TCP 66 44408 > http [ACK] Seq=97 Ack=635554 Win=726912 Len=0 TSval=38551518 TSecr=681511957
189   0.371903 54.230.29.254 -> 172.31.36.109 TCP 11650 [TCP segment of a reassembled PDU]
190   0.371923 172.31.36.109 -> 54.230.29.254 TCP 66 44408 > http [ACK] Seq=97 Ack=647138 Win=738176 Len=0 TSval=38551518 TSecr=681511957
191   0.372198 54.230.29.254 -> 172.31.36.109 TCP 26130 [TCP segment of a reassembled PDU]
192   0.372218 54.230.29.254 -> 172.31.36.109 TCP 7306 [TCP segment of a reassembled PDU]
193   0.372237 172.31.36.109 -> 54.230.29.254 TCP 66 44408 > http [ACK] Seq=97 Ack=680442 Win=704896 Len=0 TSval=38551518 TSecr=681511957
194   0.372298 54.230.29.254 -> 172.31.36.109 TCP 8754 [TCP segment of a reassembled PDU]
195   0.372305 172.31.36.109 -> 54.230.29.254 TCP 66 44408 > http [ACK] Seq=97 Ack=689130 Win=724608 Len=0 TSval=38551518 TSecr=681511957
196   0.372411 54.230.29.254 -> 172.31.36.109 TCP 4410 [TCP segment of a reassembled PDU]
197   0.372417 172.31.36.109 -> 54.230.29.254 TCP 66 44408 > http [ACK] Seq=97 Ack=693474 Win=731648 Len=0 TSval=38551518 TSecr=681511957
198   0.373081 54.230.29.254 -> 172.31.36.109 TCP 10202 [TCP segment of a reassembled PDU]
199   0.373116 172.31.36.109 -> 54.230.29.254 TCP 66 44408 > http [ACK] Seq=97 Ack=703610 Win=738176 Len=0 TSval=38551519 TSecr=681511957
200   0.373203 54.230.29.254 -> 172.31.36.109 TCP 11650 [TCP segment of a reassembled PDU]
201   0.373223 172.31.36.109 -> 54.230.29.254 TCP 66 44408 > http [ACK] Seq=97 Ack=715194 Win=738176 Len=0 TSval=38551519 TSecr=681511957
202   0.373435 54.230.29.254 -> 172.31.36.109 TCP 5538 [TCP segment of a reassembled PDU]
203   0.373635 172.31.36.109 -> 54.230.29.254 TCP 66 44408 > http [ACK] Seq=97 Ack=720666 Win=738176 Len=0 TSval=38551519 TSecr=681511957
204   0.383276 54.230.29.254 -> 172.31.36.109 TCP 1514 [TCP segment of a reassembled PDU]
205   0.383344 54.230.29.254 -> 172.31.36.109 TCP 11650 [TCP segment of a reassembled PDU]
206   0.383382 172.31.36.109 -> 54.230.29.254 TCP 66 44408 > http [ACK] Seq=97 Ack=733698 Win=738176 Len=0 TSval=38551521 TSecr=681511958
207   0.383445 54.230.29.254 -> 172.31.36.109 TCP 21786 [TCP segment of a reassembled PDU]
208   0.383474 54.230.29.254 -> 172.31.36.109 TCP 4410 [TCP segment of a reassembled PDU]
209   0.383484 172.31.36.109 -> 54.230.29.254 TCP 66 44408 > http [ACK] Seq=97 Ack=759762 Win=712192 Len=0 TSval=38551521 TSecr=681511958
210   0.383525 54.230.29.254 -> 172.31.36.109 TCP 21786 [TCP segment of a reassembled PDU]
211   0.383550 172.31.36.109 -> 54.230.29.254 TCP 66 44408 > http [ACK] Seq=97 Ack=781482 Win=703104 Len=0 TSval=38551521 TSecr=681511958
212   0.383561 54.230.29.254 -> 172.31.36.109 TCP 4786 [TCP segment of a reassembled PDU]
213   0.383581 172.31.36.109 -> 54.230.29.254 TCP 66 44408 > http [ACK] Seq=97 Ack=786202 Win=738176 Len=0 TSval=38551521 TSecr=681511958
214   0.385836 54.230.29.254 -> 172.31.36.109 TCP 4410 [TCP segment of a reassembled PDU]
215   0.385855 172.31.36.109 -> 54.230.29.254 TCP 66 44408 > http [ACK] Seq=97 Ack=790546 Win=738176 Len=0 TSval=38551522 TSecr=681511958
216   0.385969 54.230.29.254 -> 172.31.36.109 TCP 8754 [TCP segment of a reassembled PDU]
217   0.385976 172.31.36.109 -> 54.230.29.254 TCP 66 44408 > http [ACK] Seq=97 Ack=799234 Win=755584 Len=0 TSval=38551522 TSecr=681511958
218   0.386026 54.230.29.254 -> 172.31.36.109 TCP 13098 [TCP segment of a reassembled PDU]
219   0.386036 172.31.36.109 -> 54.230.29.254 TCP 66 44408 > http [ACK] Seq=97 Ack=812266 Win=781696 Len=0 TSval=38551522 TSecr=681511958
220   0.386228 54.230.29.254 -> 172.31.36.109 TCP 13098 [TCP segment of a reassembled PDU]
221   0.386237 172.31.36.109 -> 54.230.29.254 TCP 66 44408 > http [ACK] Seq=97 Ack=825298 Win=807680 Len=0 TSval=38551522 TSecr=681511958
222   0.386249 54.230.29.254 -> 172.31.36.109 TCP 5858 [TCP segment of a reassembled PDU]
223   0.386254 172.31.36.109 -> 54.230.29.254 TCP 66 44408 > http [ACK] Seq=97 Ack=831090 Win=819328 Len=0 TSval=38551522 TSecr=681511958
224   0.386339 54.230.29.254 -> 172.31.36.109 TCP 2962 [TCP segment of a reassembled PDU]
225   0.386344 172.31.36.109 -> 54.230.29.254 TCP 66 44408 > http [ACK] Seq=97 Ack=833986 Win=825088 Len=0 TSval=38551522 TSecr=681511958
226   0.386481 54.230.29.254 -> 172.31.36.109 TCP 10202 [TCP segment of a reassembled PDU]
227   0.386489 172.31.36.109 -> 54.230.29.254 TCP 66 44408 > http [ACK] Seq=97 Ack=844122 Win=845312 Len=0 TSval=38551522 TSecr=681511958
228   0.386545 54.230.29.254 -> 172.31.36.109 TCP 18890 [TCP segment of a reassembled PDU]
229   0.386553 172.31.36.109 -> 54.230.29.254 TCP 66 44408 > http [ACK] Seq=97 Ack=862946 Win=882944 Len=0 TSval=38551522 TSecr=681511958
230   0.386585 54.230.29.254 -> 172.31.36.109 TCP 5858 [TCP segment of a reassembled PDU]
231   0.386591 172.31.36.109 -> 54.230.29.254 TCP 66 44408 > http [ACK] Seq=97 Ack=868738 Win=894592 Len=0 TSval=38551522 TSecr=681511958
232   0.386759 54.230.29.254 -> 172.31.36.109 TCP 17442 [TCP segment of a reassembled PDU]
233   0.386769 172.31.36.109 -> 54.230.29.254 TCP 66 44408 > http [ACK] Seq=97 Ack=886114 Win=929280 Len=0 TSval=38551522 TSecr=681511958
234   0.387137 54.230.29.254 -> 172.31.36.109 TCP 4410 [TCP segment of a reassembled PDU]
235   0.387143 172.31.36.109 -> 54.230.29.254 TCP 66 44408 > http [ACK] Seq=97 Ack=890458 Win=937984 Len=0 TSval=38551522 TSecr=681511958
236   0.387302 54.230.29.254 -> 172.31.36.109 TCP 18890 [TCP segment of a reassembled PDU]
237   0.387313 172.31.36.109 -> 54.230.29.254 TCP 66 44408 > http [ACK] Seq=97 Ack=909282 Win=975616 Len=0 TSval=38551522 TSecr=681511958
238   0.387323 54.230.29.254 -> 172.31.36.109 TCP 5858 [TCP segment of a reassembled PDU]
239   0.387327 172.31.36.109 -> 54.230.29.254 TCP 66 44408 > http [ACK] Seq=97 Ack=915074 Win=987264 Len=0 TSval=38551522 TSecr=681511958
240   0.387422 54.230.29.254 -> 172.31.36.109 TCP 7306 [TCP segment of a reassembled PDU]
241   0.387429 172.31.36.109 -> 54.230.29.254 TCP 66 44408 > http [ACK] Seq=97 Ack=922314 Win=1001728 Len=0 TSval=38551522 TSecr=681511958
242   0.387520 54.230.29.254 -> 172.31.36.109 TCP 5858 [TCP segment of a reassembled PDU]
243   0.387526 172.31.36.109 -> 54.230.29.254 TCP 66 44408 > http [ACK] Seq=97 Ack=928106 Win=1013376 Len=0 TSval=38551522 TSecr=681511958
244   0.387656 54.230.29.254 -> 172.31.36.109 TCP 11650 [TCP segment of a reassembled PDU]
245   0.387665 172.31.36.109 -> 54.230.29.254 TCP 66 44408 > http [ACK] Seq=97 Ack=939690 Win=1036544 Len=0 TSval=38551522 TSecr=681511958
246   0.387791 54.230.29.254 -> 172.31.36.109 TCP 14546 [TCP segment of a reassembled PDU]
247   0.387801 172.31.36.109 -> 54.230.29.254 TCP 66 44408 > http [ACK] Seq=97 Ack=954170 Win=1065472 Len=0 TSval=38551522 TSecr=681511959
248   0.387904 54.230.29.254 -> 172.31.36.109 TCP 8754 [TCP segment of a reassembled PDU]
249   0.387912 172.31.36.109 -> 54.230.29.254 TCP 66 44408 > http [ACK] Seq=97 Ack=962858 Win=1082880 Len=0 TSval=38551522 TSecr=681511959
250   0.388027 54.230.29.254 -> 172.31.36.109 TCP 10202 [TCP segment of a reassembled PDU]
251   0.388035 172.31.36.109 -> 54.230.29.254 TCP 66 44408 > http [ACK] Seq=97 Ack=972994 Win=1103104 Len=0 TSval=38551522 TSecr=681511959
252   0.388335 54.230.29.254 -> 172.31.36.109 TCP 26130 [TCP segment of a reassembled PDU]
253   0.388349 172.31.36.109 -> 54.230.29.254 TCP 66 44408 > http [ACK] Seq=97 Ack=999058 Win=1155200 Len=0 TSval=38551522 TSecr=681511959
254   0.388365 54.230.29.254 -> 172.31.36.109 TCP 13098 [TCP segment of a reassembled PDU]
255   0.388372 172.31.36.109 -> 54.230.29.254 TCP 66 44408 > http [ACK] Seq=97 Ack=1012090 Win=1181312 Len=0 TSval=38551522 TSecr=681511959
256   0.388539 54.230.29.254 -> 172.31.36.109 TCP 7306 [TCP segment of a reassembled PDU]
257   0.388546 172.31.36.109 -> 54.230.29.254 TCP 66 44408 > http [ACK] Seq=97 Ack=1019330 Win=1195776 Len=0 TSval=38551523 TSecr=681511959
258   0.388930 54.230.29.254 -> 172.31.36.109 TCP 5858 [TCP segment of a reassembled PDU]
259   0.388937 172.31.36.109 -> 54.230.29.254 TCP 66 44408 > http [ACK] Seq=97 Ack=1025122 Win=1207296 Len=0 TSval=38551523 TSecr=681511959
260   0.389065 54.230.29.254 -> 172.31.36.109 TCP 10202 [TCP segment of a reassembled PDU]
261   0.389072 172.31.36.109 -> 54.230.29.254 TCP 66 44408 > http [ACK] Seq=97 Ack=1035258 Win=1227648 Len=0 TSval=38551523 TSecr=681511959
262   0.389185 54.230.29.254 -> 172.31.36.109 TCP 2962 [TCP segment of a reassembled PDU]
263   0.389191 172.31.36.109 -> 54.230.29.254 TCP 66 44408 > http [ACK] Seq=97 Ack=1038154 Win=1233408 Len=0 TSval=38551523 TSecr=681511959
264   0.389327 54.230.29.254 -> 172.31.36.109 HTTP 10946 HTTP/1.1 200 OK  (application/octet-stream)
265   0.389335 172.31.36.109 -> 54.230.29.254 TCP 66 44408 > http [ACK] Seq=97 Ack=1049034 Win=1255168 Len=0 TSval=38551523 TSecr=681511959
266   0.389491 172.31.36.109 -> 54.230.29.254 TCP 66 44408 > http [FIN, ACK] Seq=97 Ack=1049034 Win=1255168 Len=0 TSval=38551523 TSecr=681511959
267   0.390758 54.230.29.254 -> 172.31.36.109 TCP 66 http > 44408 [FIN, ACK] Seq=1049034 Ack=98 Win=14592 Len=0 TSval=681511959 TSecr=38551523
268   0.390768 172.31.36.109 -> 54.230.29.254 TCP 66 44408 > http [ACK] Seq=98 Ack=1049035 Win=1255168 Len=0 TSval=38551523 TSecr=681511959
