[Measurement for 1mb at 23:34:30 19.34.2014] 
Tshark:

  1   0.000000 172.31.36.109 -> 172.31.0.2   DNS 89 Standard query 0x043a  A d2pcb72msibvx3.cloudfront.net
  2   0.000022 172.31.36.109 -> 172.31.0.2   DNS 89 Standard query 0x566e  AAAA d2pcb72msibvx3.cloudfront.net
  3   0.000527   172.31.0.2 -> 172.31.36.109 DNS 217 Standard query response 0x043a  A 54.230.30.39 A 54.230.30.48 A 54.230.30.51 A 216.137.57.150 A 54.192.30.228 A 54.230.29.243 A 54.230.30.9 A 54.230.30.38
  4   0.000538   172.31.0.2 -> 172.31.36.109 DNS 169 Standard query response 0x566e 
  5   0.003892 172.31.36.109 -> 54.230.30.39 TCP 74 50546 > http [SYN] Seq=0 Win=26883 Len=0 MSS=8961 SACK_PERM=1 TSval=25939291 TSecr=0 WS=128
  6   0.004979 54.230.30.39 -> 172.31.36.109 TCP 74 http > 50546 [SYN, ACK] Seq=0 Ack=1 Win=14480 Len=0 MSS=1460 SACK_PERM=1 TSval=623964305 TSecr=25939291 WS=128
  7   0.004992 172.31.36.109 -> 54.230.30.39 TCP 66 50546 > http [ACK] Seq=1 Ack=1 Win=27008 Len=0 TSval=25939291 TSecr=623964305
  8   0.005043 172.31.36.109 -> 54.230.30.39 HTTP 162 GET /1mb HTTP/1.1 
  9   0.006474 54.230.30.39 -> 172.31.36.109 TCP 66 http > 50546 [ACK] Seq=1 Ack=97 Win=14592 Len=0 TSval=623964305 TSecr=25939291
 10   0.035817 54.230.30.39 -> 172.31.36.109 TCP 12728 [TCP segment of a reassembled PDU]
 11   0.035829 172.31.36.109 -> 54.230.30.39 TCP 66 50546 > http [ACK] Seq=97 Ack=12663 Win=52224 Len=0 TSval=25939299 TSecr=623964308
 12   0.035864 54.230.30.39 -> 172.31.36.109 TCP 1514 [TCP segment of a reassembled PDU]
 13   0.035868 172.31.36.109 -> 54.230.30.39 TCP 66 50546 > http [ACK] Seq=97 Ack=14111 Win=55168 Len=0 TSval=25939299 TSecr=623964308
 14   0.036945 54.230.30.39 -> 172.31.36.109 TCP 5858 [TCP segment of a reassembled PDU]
 15   0.036952 172.31.36.109 -> 54.230.30.39 TCP 66 50546 > http [ACK] Seq=97 Ack=19903 Win=66688 Len=0 TSval=25939299 TSecr=623964308
 16   0.036971 54.230.30.39 -> 172.31.36.109 TCP 7306 [TCP segment of a reassembled PDU]
 17   0.036977 172.31.36.109 -> 54.230.30.39 TCP 66 50546 > http [ACK] Seq=97 Ack=27143 Win=81280 Len=0 TSval=25939299 TSecr=623964308
 18   0.038214 54.230.30.39 -> 172.31.36.109 TCP 1514 [TCP segment of a reassembled PDU]
 19   0.038219 172.31.36.109 -> 54.230.30.39 TCP 66 50546 > http [ACK] Seq=97 Ack=28591 Win=84096 Len=0 TSval=25939299 TSecr=623964309
 20   0.038305 54.230.30.39 -> 172.31.36.109 TCP 15994 [TCP segment of a reassembled PDU]
 21   0.038315 172.31.36.109 -> 54.230.30.39 TCP 66 50546 > http [ACK] Seq=97 Ack=44519 Win=91648 Len=0 TSval=25939299 TSecr=623964309
 22   0.038323 54.230.30.39 -> 172.31.36.109 TCP 2962 [TCP segment of a reassembled PDU]
 23   0.038329 172.31.36.109 -> 54.230.30.39 TCP 66 50546 > http [ACK] Seq=97 Ack=47415 Win=88832 Len=0 TSval=25939299 TSecr=623964309
 24   0.039492 54.230.30.39 -> 172.31.36.109 TCP 5858 [TCP segment of a reassembled PDU]
 25   0.039499 172.31.36.109 -> 54.230.30.39 TCP 66 50546 > http [ACK] Seq=97 Ack=53207 Win=108416 Len=0 TSval=25939299 TSecr=623964309
 26   0.039541 54.230.30.39 -> 172.31.36.109 TCP 12165 [TCP segment of a reassembled PDU]
 27   0.039549 172.31.36.109 -> 54.230.30.39 TCP 66 50546 > http [ACK] Seq=97 Ack=65306 Win=96512 Len=0 TSval=25939299 TSecr=623964309
 28   0.060414 54.230.30.39 -> 172.31.36.109 TCP 1514 [TCP segment of a reassembled PDU]
 29   0.060419 172.31.36.109 -> 54.230.30.39 TCP 66 50546 > http [ACK] Seq=97 Ack=66754 Win=109056 Len=0 TSval=25939305 TSecr=623964311
 30   0.060460 54.230.30.39 -> 172.31.36.109 TCP 14546 [TCP segment of a reassembled PDU]
 31   0.060469 172.31.36.109 -> 54.230.30.39 TCP 66 50546 > http [ACK] Seq=97 Ack=81234 Win=137984 Len=0 TSval=25939305 TSecr=623964311
 32   0.060648 54.230.30.39 -> 172.31.36.109 TCP 10202 [TCP segment of a reassembled PDU]
 33   0.060655 172.31.36.109 -> 54.230.30.39 TCP 66 50546 > http [ACK] Seq=97 Ack=91370 Win=158336 Len=0 TSval=25939305 TSecr=623964311
 34   0.061619 54.230.30.39 -> 172.31.36.109 TCP 4410 [TCP segment of a reassembled PDU]
 35   0.061625 172.31.36.109 -> 54.230.30.39 TCP 66 50546 > http [ACK] Seq=97 Ack=95714 Win=167040 Len=0 TSval=25939305 TSecr=623964311
 36   0.061764 54.230.30.39 -> 172.31.36.109 TCP 23234 [TCP segment of a reassembled PDU]
 37   0.061776 172.31.36.109 -> 54.230.30.39 TCP 66 50546 > http [ACK] Seq=97 Ack=118882 Win=213376 Len=0 TSval=25939305 TSecr=623964311
 38   0.061799 54.230.30.39 -> 172.31.36.109 TCP 1514 [TCP segment of a reassembled PDU]
 39   0.061803 172.31.36.109 -> 54.230.30.39 TCP 66 50546 > http [ACK] Seq=97 Ack=120330 Win=216192 Len=0 TSval=25939305 TSecr=623964311
 40   0.061901 54.230.30.39 -> 172.31.36.109 TCP 1514 [TCP segment of a reassembled PDU]
 41   0.061905 172.31.36.109 -> 54.230.30.39 TCP 66 50546 > http [ACK] Seq=97 Ack=121778 Win=219136 Len=0 TSval=25939305 TSecr=623964311
 42   0.063193 54.230.30.39 -> 172.31.36.109 TCP 5858 [TCP segment of a reassembled PDU]
 43   0.063199 172.31.36.109 -> 54.230.30.39 TCP 66 50546 > http [ACK] Seq=97 Ack=127570 Win=230656 Len=0 TSval=25939305 TSecr=623964311
 44   0.063227 54.230.30.39 -> 172.31.36.109 TCP 3338 [TCP segment of a reassembled PDU]
 45   0.063232 172.31.36.109 -> 54.230.30.39 TCP 66 50546 > http [ACK] Seq=97 Ack=130842 Win=237184 Len=0 TSval=25939305 TSecr=623964311
 46   0.063785 54.230.30.39 -> 172.31.36.109 TCP 2962 [TCP segment of a reassembled PDU]
 47   0.063791 172.31.36.109 -> 54.230.30.39 TCP 66 50546 > http [ACK] Seq=97 Ack=133738 Win=243072 Len=0 TSval=25939306 TSecr=623964311
 48   0.064016 54.230.30.39 -> 172.31.36.109 TCP 8754 [TCP segment of a reassembled PDU]
 49   0.064022 172.31.36.109 -> 54.230.30.39 TCP 66 50546 > http [ACK] Seq=97 Ack=142426 Win=260352 Len=0 TSval=25939306 TSecr=623964311
 50   0.064045 54.230.30.39 -> 172.31.36.109 TCP 5858 [TCP segment of a reassembled PDU]
 51   0.064052 172.31.36.109 -> 54.230.30.39 TCP 66 50546 > http [ACK] Seq=97 Ack=148218 Win=272000 Len=0 TSval=25939306 TSecr=623964311
 52   0.064246 54.230.30.39 -> 172.31.36.109 TCP 1514 [TCP segment of a reassembled PDU]
 53   0.064251 172.31.36.109 -> 54.230.30.39 TCP 66 50546 > http [ACK] Seq=97 Ack=149666 Win=274944 Len=0 TSval=25939306 TSecr=623964311
 54   0.064514 54.230.30.39 -> 172.31.36.109 TCP 10202 [TCP segment of a reassembled PDU]
 55   0.064521 172.31.36.109 -> 54.230.30.39 TCP 66 50546 > http [ACK] Seq=97 Ack=159802 Win=295168 Len=0 TSval=25939306 TSecr=623964311
 56   0.064541 54.230.30.39 -> 172.31.36.109 TCP 1514 [TCP segment of a reassembled PDU]
 57   0.064544 172.31.36.109 -> 54.230.30.39 TCP 66 50546 > http [ACK] Seq=97 Ack=161250 Win=298112 Len=0 TSval=25939306 TSecr=623964311
 58   0.064998 54.230.30.39 -> 172.31.36.109 TCP 5858 [TCP segment of a reassembled PDU]
 59   0.065004 172.31.36.109 -> 54.230.30.39 TCP 66 50546 > http [ACK] Seq=97 Ack=167042 Win=309632 Len=0 TSval=25939306 TSecr=623964311
 60   0.065036 54.230.30.39 -> 172.31.36.109 TCP 5858 [TCP segment of a reassembled PDU]
 61   0.065041 172.31.36.109 -> 54.230.30.39 TCP 66 50546 > http [ACK] Seq=97 Ack=172834 Win=321280 Len=0 TSval=25939306 TSecr=623964311
 62   0.065117 54.230.30.39 -> 172.31.36.109 TCP 5858 [TCP segment of a reassembled PDU]
 63   0.065132 172.31.36.109 -> 54.230.30.39 TCP 66 50546 > http [ACK] Seq=97 Ack=178626 Win=332800 Len=0 TSval=25939306 TSecr=623964311
 64   0.065223 54.230.30.39 -> 172.31.36.109 TCP 2962 [TCP segment of a reassembled PDU]
 65   0.065228 172.31.36.109 -> 54.230.30.39 TCP 66 50546 > http [ACK] Seq=97 Ack=181522 Win=338560 Len=0 TSval=25939306 TSecr=623964311
 66   0.065545 54.230.30.39 -> 172.31.36.109 TCP 5858 [TCP segment of a reassembled PDU]
 67   0.065551 172.31.36.109 -> 54.230.30.39 TCP 66 50546 > http [ACK] Seq=97 Ack=187314 Win=350208 Len=0 TSval=25939306 TSecr=623964311
 68   0.065663 54.230.30.39 -> 172.31.36.109 TCP 4410 [TCP segment of a reassembled PDU]
 69   0.065669 172.31.36.109 -> 54.230.30.39 TCP 66 50546 > http [ACK] Seq=97 Ack=191658 Win=358912 Len=0 TSval=25939306 TSecr=623964311
 70   0.065817 54.230.30.39 -> 172.31.36.109 TCP 11650 [TCP segment of a reassembled PDU]
 71   0.065824 172.31.36.109 -> 54.230.30.39 TCP 66 50546 > http [ACK] Seq=97 Ack=203242 Win=382080 Len=0 TSval=25939306 TSecr=623964311
 72   0.066103 54.230.30.39 -> 172.31.36.109 TCP 4410 [TCP segment of a reassembled PDU]
 73   0.066108 172.31.36.109 -> 54.230.30.39 TCP 66 50546 > http [ACK] Seq=97 Ack=207586 Win=390784 Len=0 TSval=25939306 TSecr=623964311
 74   0.066250 54.230.30.39 -> 172.31.36.109 TCP 5858 [TCP segment of a reassembled PDU]
 75   0.066256 172.31.36.109 -> 54.230.30.39 TCP 66 50546 > http [ACK] Seq=97 Ack=213378 Win=402304 Len=0 TSval=25939306 TSecr=623964311
 76   0.066367 54.230.30.39 -> 172.31.36.109 TCP 15994 [TCP segment of a reassembled PDU]
 77   0.066377 172.31.36.109 -> 54.230.30.39 TCP 66 50546 > http [ACK] Seq=97 Ack=229306 Win=434176 Len=0 TSval=25939306 TSecr=623964311
 78   0.066553 54.230.30.39 -> 172.31.36.109 TCP 2962 [TCP segment of a reassembled PDU]
 79   0.066558 172.31.36.109 -> 54.230.30.39 TCP 66 50546 > http [ACK] Seq=97 Ack=232202 Win=439936 Len=0 TSval=25939306 TSecr=623964311
 80   0.067042 54.230.30.39 -> 172.31.36.109 TCP 2962 [TCP segment of a reassembled PDU]
 81   0.067047 172.31.36.109 -> 54.230.30.39 TCP 66 50546 > http [ACK] Seq=97 Ack=235098 Win=445696 Len=0 TSval=25939306 TSecr=623964311
 82   0.067181 54.230.30.39 -> 172.31.36.109 TCP 13098 [TCP segment of a reassembled PDU]
 83   0.067189 172.31.36.109 -> 54.230.30.39 TCP 66 50546 > http [ACK] Seq=97 Ack=248130 Win=471808 Len=0 TSval=25939306 TSecr=623964311
 84   0.067402 54.230.30.39 -> 172.31.36.109 TCP 10202 [TCP segment of a reassembled PDU]
 85   0.067409 172.31.36.109 -> 54.230.30.39 TCP 66 50546 > http [ACK] Seq=97 Ack=258266 Win=466560 Len=0 TSval=25939306 TSecr=623964311
 86   0.067416 54.230.30.39 -> 172.31.36.109 TCP 2962 [TCP segment of a reassembled PDU]
 87   0.067419 172.31.36.109 -> 54.230.30.39 TCP 66 50546 > http [ACK] Seq=97 Ack=261162 Win=463744 Len=0 TSval=25939306 TSecr=623964312
 88   0.067500 54.230.30.39 -> 172.31.36.109 TCP 818 [TCP segment of a reassembled PDU]
 89   0.067505 172.31.36.109 -> 54.230.30.39 TCP 66 50546 > http [ACK] Seq=97 Ack=261914 Win=474752 Len=0 TSval=25939306 TSecr=623964312
 90   0.126190 54.230.30.39 -> 172.31.36.109 TCP 1514 [TCP segment of a reassembled PDU]
 91   0.126199 172.31.36.109 -> 54.230.30.39 TCP 66 50546 > http [ACK] Seq=97 Ack=263362 Win=477568 Len=0 TSval=25939321 TSecr=623964317
 92   0.126221 54.230.30.39 -> 172.31.36.109 TCP 1514 [TCP segment of a reassembled PDU]
 93   0.126224 172.31.36.109 -> 54.230.30.39 TCP 66 50546 > http [ACK] Seq=97 Ack=264810 Win=480512 Len=0 TSval=25939321 TSecr=623964317
 94   0.126462 54.230.30.39 -> 172.31.36.109 TCP 8754 [TCP segment of a reassembled PDU]
 95   0.126470 172.31.36.109 -> 54.230.30.39 TCP 66 50546 > http [ACK] Seq=97 Ack=273498 Win=497920 Len=0 TSval=25939321 TSecr=623964317
 96   0.127470 54.230.30.39 -> 172.31.36.109 TCP 5858 [TCP segment of a reassembled PDU]
 97   0.127477 172.31.36.109 -> 54.230.30.39 TCP 66 50546 > http [ACK] Seq=97 Ack=279290 Win=509440 Len=0 TSval=25939321 TSecr=623964318
 98   0.127542 54.230.30.39 -> 172.31.36.109 TCP 8754 [TCP segment of a reassembled PDU]
 99   0.127549 172.31.36.109 -> 54.230.30.39 TCP 66 50546 > http [ACK] Seq=97 Ack=287978 Win=526848 Len=0 TSval=25939321 TSecr=623964318
100   0.127832 54.230.30.39 -> 172.31.36.109 TCP 26130 [TCP segment of a reassembled PDU]
101   0.127846 172.31.36.109 -> 54.230.30.39 TCP 66 50546 > http [ACK] Seq=97 Ack=314042 Win=578944 Len=0 TSval=25939322 TSecr=623964318
102   0.127871 54.230.30.39 -> 172.31.36.109 TCP 10202 [TCP segment of a reassembled PDU]
103   0.127878 172.31.36.109 -> 54.230.30.39 TCP 66 50546 > http [ACK] Seq=97 Ack=324178 Win=599296 Len=0 TSval=25939322 TSecr=623964318
104   0.128753 54.230.30.39 -> 172.31.36.109 TCP 2962 [TCP segment of a reassembled PDU]
105   0.128759 172.31.36.109 -> 54.230.30.39 TCP 66 50546 > http [ACK] Seq=97 Ack=327074 Win=605056 Len=0 TSval=25939322 TSecr=623964318
106   0.128966 54.230.30.39 -> 172.31.36.109 TCP 24682 [TCP segment of a reassembled PDU]
107   0.128992 172.31.36.109 -> 54.230.30.39 TCP 66 50546 > http [ACK] Seq=97 Ack=351690 Win=654208 Len=0 TSval=25939322 TSecr=623964318
108   0.129232 54.230.30.39 -> 172.31.36.109 TCP 4410 [TCP segment of a reassembled PDU]
109   0.129238 172.31.36.109 -> 54.230.30.39 TCP 66 50546 > http [ACK] Seq=97 Ack=356034 Win=662912 Len=0 TSval=25939322 TSecr=623964318
110   0.129384 54.230.30.39 -> 172.31.36.109 TCP 15994 [TCP segment of a reassembled PDU]
111   0.129394 172.31.36.109 -> 54.230.30.39 TCP 66 50546 > http [ACK] Seq=97 Ack=371962 Win=694784 Len=0 TSval=25939322 TSecr=623964318
112   0.129532 54.230.30.39 -> 172.31.36.109 TCP 7306 [TCP segment of a reassembled PDU]
113   0.129549 172.31.36.109 -> 54.230.30.39 TCP 66 50546 > http [ACK] Seq=97 Ack=379202 Win=709248 Len=0 TSval=25939322 TSecr=623964318
114   0.130005 54.230.30.39 -> 172.31.36.109 TCP 2962 [TCP segment of a reassembled PDU]
115   0.130020 172.31.36.109 -> 54.230.30.39 TCP 66 50546 > http [ACK] Seq=97 Ack=382098 Win=715136 Len=0 TSval=25939322 TSecr=623964318
116   0.130131 54.230.30.39 -> 172.31.36.109 TCP 2962 [TCP segment of a reassembled PDU]
117   0.130136 172.31.36.109 -> 54.230.30.39 TCP 66 50546 > http [ACK] Seq=97 Ack=384994 Win=720896 Len=0 TSval=25939322 TSecr=623964318
118   0.130302 54.230.30.39 -> 172.31.36.109 TCP 17442 [TCP segment of a reassembled PDU]
119   0.130320 172.31.36.109 -> 54.230.30.39 TCP 66 50546 > http [ACK] Seq=97 Ack=402370 Win=755584 Len=0 TSval=25939322 TSecr=623964318
120   0.130457 54.230.30.39 -> 172.31.36.109 TCP 18890 [TCP segment of a reassembled PDU]
121   0.130477 172.31.36.109 -> 54.230.30.39 TCP 66 50546 > http [ACK] Seq=97 Ack=421194 Win=780032 Len=0 TSval=25939322 TSecr=623964318
122   0.130838 54.230.30.39 -> 172.31.36.109 TCP 7306 [TCP segment of a reassembled PDU]
123   0.130844 172.31.36.109 -> 54.230.30.39 TCP 66 50546 > http [ACK] Seq=97 Ack=428434 Win=799104 Len=0 TSval=25939322 TSecr=623964318
124   0.131011 54.230.30.39 -> 172.31.36.109 TCP 24682 [TCP segment of a reassembled PDU]
125   0.131035 172.31.36.109 -> 54.230.30.39 TCP 66 50546 > http [ACK] Seq=97 Ack=453050 Win=774528 Len=0 TSval=25939322 TSecr=623964318
126   0.131573 54.230.30.39 -> 172.31.36.109 TCP 2962 [TCP segment of a reassembled PDU]
127   0.131578 172.31.36.109 -> 54.230.30.39 TCP 66 50546 > http [ACK] Seq=97 Ack=455946 Win=806144 Len=0 TSval=25939322 TSecr=623964318
128   0.131732 54.230.30.39 -> 172.31.36.109 TCP 15994 [TCP segment of a reassembled PDU]
129   0.131762 172.31.36.109 -> 54.230.30.39 TCP 66 50546 > http [ACK] Seq=97 Ack=471874 Win=807808 Len=0 TSval=25939323 TSecr=623964318
130   0.131858 54.230.30.39 -> 172.31.36.109 TCP 8754 [TCP segment of a reassembled PDU]
131   0.131865 172.31.36.109 -> 54.230.30.39 TCP 66 50546 > http [ACK] Seq=97 Ack=480562 Win=825088 Len=0 TSval=25939323 TSecr=623964318
132   0.132315 54.230.30.39 -> 172.31.36.109 TCP 5858 [TCP segment of a reassembled PDU]
133   0.132321 172.31.36.109 -> 54.230.30.39 TCP 66 50546 > http [ACK] Seq=97 Ack=486354 Win=836736 Len=0 TSval=25939323 TSecr=623964318
134   0.132473 54.230.30.39 -> 172.31.36.109 TCP 18890 [TCP segment of a reassembled PDU]
135   0.132491 172.31.36.109 -> 54.230.30.39 TCP 66 50546 > http [ACK] Seq=97 Ack=505178 Win=874368 Len=0 TSval=25939323 TSecr=623964318
136   0.133387 54.230.30.39 -> 172.31.36.109 TCP 7306 [TCP segment of a reassembled PDU]
137   0.133416 172.31.36.109 -> 54.230.30.39 TCP 66 50546 > http [ACK] Seq=97 Ack=512418 Win=888832 Len=0 TSval=25939323 TSecr=623964318
138   0.133521 54.230.30.39 -> 172.31.36.109 TCP 11706 [TCP segment of a reassembled PDU]
139   0.133528 172.31.36.109 -> 54.230.30.39 TCP 66 50546 > http [ACK] Seq=97 Ack=524058 Win=912128 Len=0 TSval=25939323 TSecr=623964318
140   0.222198 54.230.30.39 -> 172.31.36.109 TCP 1514 [TCP segment of a reassembled PDU]
141   0.222228 172.31.36.109 -> 54.230.30.39 TCP 66 50546 > http [ACK] Seq=97 Ack=525506 Win=915072 Len=0 TSval=25939345 TSecr=623964327
142   0.222237 54.230.30.39 -> 172.31.36.109 TCP 5858 [TCP segment of a reassembled PDU]
143   0.222245 172.31.36.109 -> 54.230.30.39 TCP 66 50546 > http [ACK] Seq=97 Ack=531298 Win=926592 Len=0 TSval=25939345 TSecr=623964327
144   0.222258 54.230.30.39 -> 172.31.36.109 TCP 5858 [TCP segment of a reassembled PDU]
145   0.222262 172.31.36.109 -> 54.230.30.39 TCP 66 50546 > http [ACK] Seq=97 Ack=537090 Win=938240 Len=0 TSval=25939345 TSecr=623964327
146   0.222656 54.230.30.39 -> 172.31.36.109 TCP 2962 [TCP segment of a reassembled PDU]
147   0.222683 172.31.36.109 -> 54.230.30.39 TCP 66 50546 > http [ACK] Seq=97 Ack=539986 Win=944000 Len=0 TSval=25939345 TSecr=623964327
148   0.222803 54.230.30.39 -> 172.31.36.109 TCP 21786 [TCP segment of a reassembled PDU]
149   0.222813 172.31.36.109 -> 54.230.30.39 TCP 66 50546 > http [ACK] Seq=97 Ack=561706 Win=987392 Len=0 TSval=25939345 TSecr=623964327
150   0.222825 54.230.30.39 -> 172.31.36.109 TCP 7306 [TCP segment of a reassembled PDU]
151   0.222833 172.31.36.109 -> 54.230.30.39 TCP 66 50546 > http [ACK] Seq=97 Ack=568946 Win=1001856 Len=0 TSval=25939345 TSecr=623964327
152   0.223060 54.230.30.39 -> 172.31.36.109 TCP 13098 [TCP segment of a reassembled PDU]
153   0.223070 172.31.36.109 -> 54.230.30.39 TCP 66 50546 > http [ACK] Seq=97 Ack=581978 Win=1027968 Len=0 TSval=25939345 TSecr=623964327
154   0.223165 54.230.30.39 -> 172.31.36.109 TCP 5858 [TCP segment of a reassembled PDU]
155   0.223180 172.31.36.109 -> 54.230.30.39 TCP 66 50546 > http [ACK] Seq=97 Ack=587770 Win=1039488 Len=0 TSval=25939345 TSecr=623964327
156   0.223325 54.230.30.39 -> 172.31.36.109 TCP 15994 [TCP segment of a reassembled PDU]
157   0.223334 172.31.36.109 -> 54.230.30.39 TCP 66 50546 > http [ACK] Seq=97 Ack=603698 Win=1071360 Len=0 TSval=25939345 TSecr=623964327
158   0.224212 54.230.30.39 -> 172.31.36.109 TCP 8754 [TCP segment of a reassembled PDU]
159   0.224230 172.31.36.109 -> 54.230.30.39 TCP 66 50546 > http [ACK] Seq=97 Ack=612386 Win=1088768 Len=0 TSval=25939346 TSecr=623964327
160   0.224389 54.230.30.39 -> 172.31.36.109 TCP 26130 [TCP segment of a reassembled PDU]
161   0.224409 54.230.30.39 -> 172.31.36.109 TCP 5858 [TCP segment of a reassembled PDU]
162   0.224414 54.230.30.39 -> 172.31.36.109 TCP 2962 [TCP segment of a reassembled PDU]
163   0.224577 54.230.30.39 -> 172.31.36.109 TCP 5858 [TCP segment of a reassembled PDU]
164   0.224700 54.230.30.39 -> 172.31.36.109 TCP 2962 [TCP segment of a reassembled PDU]
165   0.224875 54.230.30.39 -> 172.31.36.109 TCP 26130 [TCP segment of a reassembled PDU]
166   0.227791 172.31.36.109 -> 54.230.30.39 TCP 66 50546 > http [ACK] Seq=97 Ack=681890 Win=1019264 Len=0 TSval=25939347 TSecr=623964327
167   0.229024 54.230.30.39 -> 172.31.36.109 TCP 2962 [TCP segment of a reassembled PDU]
168   0.229042 172.31.36.109 -> 54.230.30.39 TCP 66 50546 > http [ACK] Seq=97 Ack=684786 Win=1094528 Len=0 TSval=25939347 TSecr=623964328
169   0.229225 54.230.30.39 -> 172.31.36.109 TCP 26130 [TCP segment of a reassembled PDU]
170   0.229268 54.230.30.39 -> 172.31.36.109 TCP 9882 [TCP segment of a reassembled PDU]
171   0.229284 172.31.36.109 -> 54.230.30.39 TCP 66 50546 > http [ACK] Seq=97 Ack=720666 Win=1058688 Len=0 TSval=25939347 TSecr=623964328
172   0.266786 54.230.30.39 -> 172.31.36.109 TCP 1514 [TCP segment of a reassembled PDU]
173   0.266816 172.31.36.109 -> 54.230.30.39 TCP 66 50546 > http [ACK] Seq=97 Ack=722114 Win=1097472 Len=0 TSval=25939356 TSecr=623964331
174   0.267053 54.230.30.39 -> 172.31.36.109 TCP 17442 [TCP segment of a reassembled PDU]
175   0.267099 54.230.30.39 -> 172.31.36.109 TCP 1514 [TCP segment of a reassembled PDU]
176   0.267146 54.230.30.39 -> 172.31.36.109 TCP 11650 [TCP segment of a reassembled PDU]
177   0.267206 54.230.30.39 -> 172.31.36.109 TCP 4410 [TCP segment of a reassembled PDU]
178   0.267261 172.31.36.109 -> 54.230.30.39 TCP 66 50546 > http [ACK] Seq=97 Ack=756866 Win=1062784 Len=0 TSval=25939356 TSecr=623964331
179   0.267330 54.230.30.39 -> 172.31.36.109 TCP 10202 [TCP segment of a reassembled PDU]
180   0.267338 172.31.36.109 -> 54.230.30.39 TCP 66 50546 > http [ACK] Seq=97 Ack=767002 Win=1100672 Len=0 TSval=25939356 TSecr=623964331
181   0.267367 54.230.30.39 -> 172.31.36.109 TCP 10202 [TCP segment of a reassembled PDU]
182   0.267373 172.31.36.109 -> 54.230.30.39 TCP 66 50546 > http [ACK] Seq=97 Ack=777138 Win=1100672 Len=0 TSval=25939356 TSecr=623964332
183   0.267548 54.230.30.39 -> 172.31.36.109 TCP 9130 [TCP segment of a reassembled PDU]
184   0.267574 172.31.36.109 -> 54.230.30.39 TCP 66 50546 > http [ACK] Seq=97 Ack=786202 Win=1100672 Len=0 TSval=25939356 TSecr=623964332
185   0.270569 54.230.30.39 -> 172.31.36.109 TCP 1514 [TCP segment of a reassembled PDU]
186   0.270610 54.230.30.39 -> 172.31.36.109 TCP 10202 [TCP segment of a reassembled PDU]
187   0.270617 172.31.36.109 -> 54.230.30.39 TCP 66 50546 > http [ACK] Seq=97 Ack=797786 Win=1100672 Len=0 TSval=25939357 TSecr=623964332
188   0.270650 54.230.30.39 -> 172.31.36.109 TCP 5858 [TCP segment of a reassembled PDU]
189   0.270656 172.31.36.109 -> 54.230.30.39 TCP 66 50546 > http [ACK] Seq=97 Ack=803578 Win=1107712 Len=0 TSval=25939357 TSecr=623964332
190   0.270947 54.230.30.39 -> 172.31.36.109 TCP 10202 [TCP segment of a reassembled PDU]
191   0.270958 54.230.30.39 -> 172.31.36.109 TCP 2962 [TCP segment of a reassembled PDU]
192   0.270972 172.31.36.109 -> 54.230.30.39 TCP 66 50546 > http [ACK] Seq=97 Ack=816610 Win=1114624 Len=0 TSval=25939357 TSecr=623964332
193   0.271041 54.230.30.39 -> 172.31.36.109 TCP 1514 [TCP segment of a reassembled PDU]
194   0.271205 54.230.30.39 -> 172.31.36.109 TCP 20338 [TCP segment of a reassembled PDU]
195   0.271223 54.230.30.39 -> 172.31.36.109 TCP 1514 [TCP segment of a reassembled PDU]
196   0.271260 54.230.30.39 -> 172.31.36.109 TCP 8754 [TCP segment of a reassembled PDU]
197   0.271269 54.230.30.39 -> 172.31.36.109 TCP 10202 [TCP segment of a reassembled PDU]
198   0.271283 172.31.36.109 -> 54.230.30.39 TCP 66 50546 > http [ACK] Seq=97 Ack=858602 Win=1072640 Len=0 TSval=25939357 TSecr=623964332
199   0.271885 54.230.30.39 -> 172.31.36.109 TCP 5858 [TCP segment of a reassembled PDU]
200   0.271913 172.31.36.109 -> 54.230.30.39 TCP 66 50546 > http [ACK] Seq=97 Ack=864394 Win=1107712 Len=0 TSval=25939358 TSecr=623964332
201   0.272083 54.230.30.39 -> 172.31.36.109 TCP 18890 [TCP segment of a reassembled PDU]
202   0.272105 172.31.36.109 -> 54.230.30.39 TCP 66 50546 > http [ACK] Seq=97 Ack=883218 Win=1088896 Len=0 TSval=25939358 TSecr=623964332
203   0.272210 54.230.30.39 -> 172.31.36.109 TCP 2962 [TCP segment of a reassembled PDU]
204   0.272222 172.31.36.109 -> 54.230.30.39 TCP 66 50546 > http [ACK] Seq=97 Ack=886114 Win=1112448 Len=0 TSval=25939358 TSecr=623964332
205   0.272293 54.230.30.39 -> 172.31.36.109 TCP 26130 [TCP segment of a reassembled PDU]
206   0.272309 54.230.30.39 -> 172.31.36.109 TCP 5858 [TCP segment of a reassembled PDU]
207   0.272324 172.31.36.109 -> 54.230.30.39 TCP 66 50546 > http [ACK] Seq=97 Ack=917970 Win=1080704 Len=0 TSval=25939358 TSecr=623964332
208   0.272475 54.230.30.39 -> 172.31.36.109 TCP 2962 [TCP segment of a reassembled PDU]
209   0.272497 172.31.36.109 -> 54.230.30.39 TCP 66 50546 > http [ACK] Seq=97 Ack=920866 Win=1112448 Len=0 TSval=25939358 TSecr=623964332
210   0.272790 54.230.30.39 -> 172.31.36.109 TCP 18890 [TCP segment of a reassembled PDU]
211   0.272812 172.31.36.109 -> 54.230.30.39 TCP 66 50546 > http [ACK] Seq=97 Ack=939690 Win=1093632 Len=0 TSval=25939358 TSecr=623964332
212   0.272994 54.230.30.39 -> 172.31.36.109 TCP 21786 [TCP segment of a reassembled PDU]
213   0.273022 172.31.36.109 -> 54.230.30.39 TCP 66 50546 > http [ACK] Seq=97 Ack=961410 Win=1081600 Len=0 TSval=25939358 TSecr=623964332
214   0.273135 54.230.30.39 -> 172.31.36.109 TCP 2962 [TCP segment of a reassembled PDU]
215   0.273140 172.31.36.109 -> 54.230.30.39 TCP 66 50546 > http [ACK] Seq=97 Ack=964306 Win=1112448 Len=0 TSval=25939358 TSecr=623964332
216   0.273432 54.230.30.39 -> 172.31.36.109 TCP 8754 [TCP segment of a reassembled PDU]
217   0.273476 172.31.36.109 -> 54.230.30.39 TCP 66 50546 > http [ACK] Seq=97 Ack=972994 Win=1114624 Len=0 TSval=25939358 TSecr=623964332
218   0.273599 54.230.30.39 -> 172.31.36.109 TCP 13098 [TCP segment of a reassembled PDU]
219   0.273812 54.230.30.39 -> 172.31.36.109 TCP 27578 [TCP segment of a reassembled PDU]
220   0.273850 172.31.36.109 -> 54.230.30.39 TCP 66 50546 > http [ACK] Seq=97 Ack=1013538 Win=1074176 Len=0 TSval=25939358 TSecr=623964332
221   0.273968 54.230.30.39 -> 172.31.36.109 TCP 15994 [TCP segment of a reassembled PDU]
222   0.273978 172.31.36.109 -> 54.230.30.39 TCP 66 50546 > http [ACK] Seq=97 Ack=1029466 Win=1091072 Len=0 TSval=25939358 TSecr=623964332
223   0.274121 54.230.30.39 -> 172.31.36.109 TCP 4410 [TCP segment of a reassembled PDU]
224   0.274135 172.31.36.109 -> 54.230.30.39 TCP 66 50546 > http [ACK] Seq=97 Ack=1033810 Win=1110144 Len=0 TSval=25939358 TSecr=623964332
225   0.274274 54.230.30.39 -> 172.31.36.109 HTTP 15290 HTTP/1.1 200 OK  (application/octet-stream)
226   0.274309 172.31.36.109 -> 54.230.30.39 TCP 66 50546 > http [ACK] Seq=97 Ack=1049034 Win=1114624 Len=0 TSval=25939358 TSecr=623964332
227   0.274426 172.31.36.109 -> 54.230.30.39 TCP 66 50546 > http [FIN, ACK] Seq=97 Ack=1049034 Win=1114624 Len=0 TSval=25939358 TSecr=623964332
228   0.275508 54.230.30.39 -> 172.31.36.109 TCP 66 http > 50546 [FIN, ACK] Seq=1049034 Ack=98 Win=14592 Len=0 TSval=623964332 TSecr=25939358
229   0.275526 172.31.36.109 -> 54.230.30.39 TCP 66 50546 > http [ACK] Seq=98 Ack=1049035 Win=1114624 Len=0 TSval=25939358 TSecr=623964332
