[Measurement for 1mb at 07:35:19 20.35.2014] 
Tshark:

  1   0.000000 172.31.36.109 -> 172.31.0.2   DNS 89 Standard query 0x3cba  A d2pcb72msibvx3.cloudfront.net
  2   0.000030 172.31.36.109 -> 172.31.0.2   DNS 89 Standard query 0xf058  AAAA d2pcb72msibvx3.cloudfront.net
  3   0.000486   172.31.0.2 -> 172.31.36.109 DNS 217 Standard query response 0x3cba  A 54.192.29.221 A 54.192.30.194 A 54.192.30.214 A 54.230.30.6 A 54.230.30.53 A 54.230.30.69 A 54.230.30.207 A 54.230.30.218
  4   0.000530   172.31.0.2 -> 172.31.36.109 DNS 169 Standard query response 0xf058 
  5   0.003858 172.31.36.109 -> 54.192.29.221 TCP 74 58552 > http [SYN] Seq=0 Win=26883 Len=0 MSS=8961 SACK_PERM=1 TSval=33151615 TSecr=0 WS=128
  6   0.005188 54.192.29.221 -> 172.31.36.109 TCP 74 http > 58552 [SYN, ACK] Seq=0 Ack=1 Win=14480 Len=0 MSS=1460 SACK_PERM=1 TSval=717687802 TSecr=33151615 WS=128
  7   0.005202 172.31.36.109 -> 54.192.29.221 TCP 66 58552 > http [ACK] Seq=1 Ack=1 Win=27008 Len=0 TSval=33151616 TSecr=717687802
  8   0.005244 172.31.36.109 -> 54.192.29.221 HTTP 162 GET /1mb HTTP/1.1 
  9   0.006429 54.192.29.221 -> 172.31.36.109 TCP 66 http > 58552 [ACK] Seq=1 Ack=97 Win=14592 Len=0 TSval=717687802 TSecr=33151616
 10   0.048791 54.192.29.221 -> 172.31.36.109 TCP 13098 [TCP segment of a reassembled PDU]
 11   0.048803 172.31.36.109 -> 54.192.29.221 TCP 66 58552 > http [ACK] Seq=97 Ack=13033 Win=52992 Len=0 TSval=33151626 TSecr=717687806
 12   0.050096 54.192.29.221 -> 172.31.36.109 TCP 13098 [TCP segment of a reassembled PDU]
 13   0.050107 172.31.36.109 -> 54.192.29.221 TCP 66 58552 > http [ACK] Seq=97 Ack=26065 Win=79104 Len=0 TSval=33151627 TSecr=717687806
 14   0.051322 54.192.29.221 -> 172.31.36.109 TCP 8754 [TCP segment of a reassembled PDU]
 15   0.051343 172.31.36.109 -> 54.192.29.221 TCP 66 58552 > http [ACK] Seq=97 Ack=34753 Win=96512 Len=0 TSval=33151627 TSecr=717687806
 16   0.051353 54.192.29.221 -> 172.31.36.109 TCP 4410 [TCP segment of a reassembled PDU]
 17   0.051356 172.31.36.109 -> 54.192.29.221 TCP 66 58552 > http [ACK] Seq=97 Ack=39097 Win=96512 Len=0 TSval=33151627 TSecr=717687806
 18   0.052592 54.192.29.221 -> 172.31.36.109 TCP 13098 [TCP segment of a reassembled PDU]
 19   0.052602 172.31.36.109 -> 54.192.29.221 TCP 66 58552 > http [ACK] Seq=97 Ack=52129 Win=96512 Len=0 TSval=33151627 TSecr=717687807
 20   0.052614 54.192.29.221 -> 172.31.36.109 TCP 5858 [TCP segment of a reassembled PDU]
 21   0.052619 172.31.36.109 -> 54.192.29.221 TCP 66 58552 > http [ACK] Seq=97 Ack=57921 Win=90752 Len=0 TSval=33151627 TSecr=717687807
 22   0.052753 54.192.29.221 -> 172.31.36.109 TCP 1514 [TCP segment of a reassembled PDU]
 23   0.052758 172.31.36.109 -> 54.192.29.221 TCP 66 58552 > http [ACK] Seq=97 Ack=59369 Win=108032 Len=0 TSval=33151627 TSecr=717687807
 24   0.053796 54.192.29.221 -> 172.31.36.109 TCP 4410 [TCP segment of a reassembled PDU]
 25   0.053801 172.31.36.109 -> 54.192.29.221 TCP 66 58552 > http [ACK] Seq=97 Ack=63713 Win=116736 Len=0 TSval=33151628 TSecr=717687807
 26   0.053911 54.192.29.221 -> 172.31.36.109 TCP 14546 [TCP segment of a reassembled PDU]
 27   0.053920 172.31.36.109 -> 54.192.29.221 TCP 66 58552 > http [ACK] Seq=97 Ack=78193 Win=145664 Len=0 TSval=33151628 TSecr=717687807
 28   0.055165 54.192.29.221 -> 172.31.36.109 TCP 11650 [TCP segment of a reassembled PDU]
 29   0.055173 172.31.36.109 -> 54.192.29.221 TCP 66 58552 > http [ACK] Seq=97 Ack=89777 Win=168832 Len=0 TSval=33151628 TSecr=717687807
 30   0.055186 54.192.29.221 -> 172.31.36.109 TCP 10202 [TCP segment of a reassembled PDU]
 31   0.055196 172.31.36.109 -> 54.192.29.221 TCP 66 58552 > http [ACK] Seq=97 Ack=99913 Win=189184 Len=0 TSval=33151628 TSecr=717687807
 32   0.055380 54.192.29.221 -> 172.31.36.109 TCP 4410 [TCP segment of a reassembled PDU]
 33   0.055385 172.31.36.109 -> 54.192.29.221 TCP 66 58552 > http [ACK] Seq=97 Ack=104257 Win=197760 Len=0 TSval=33151628 TSecr=717687807
 34   0.056392 54.192.29.221 -> 172.31.36.109 TCP 11650 [TCP segment of a reassembled PDU]
 35   0.056412 172.31.36.109 -> 54.192.29.221 TCP 66 58552 > http [ACK] Seq=97 Ack=115841 Win=220928 Len=0 TSval=33151628 TSecr=717687807
 36   0.056483 54.192.29.221 -> 172.31.36.109 TCP 13098 [TCP segment of a reassembled PDU]
 37   0.056493 172.31.36.109 -> 54.192.29.221 TCP 66 58552 > http [ACK] Seq=97 Ack=128873 Win=247040 Len=0 TSval=33151628 TSecr=717687807
 38   0.056657 54.192.29.221 -> 172.31.36.109 TCP 2035 [TCP segment of a reassembled PDU]
 39   0.056662 172.31.36.109 -> 54.192.29.221 TCP 66 58552 > http [ACK] Seq=97 Ack=130842 Win=251008 Len=0 TSval=33151628 TSecr=717687807
 40   0.067929 54.192.29.221 -> 172.31.36.109 TCP 1514 [TCP segment of a reassembled PDU]
 41   0.067938 172.31.36.109 -> 54.192.29.221 TCP 66 58552 > http [ACK] Seq=97 Ack=132290 Win=253824 Len=0 TSval=33151631 TSecr=717687808
 42   0.068144 54.192.29.221 -> 172.31.36.109 TCP 7306 [TCP segment of a reassembled PDU]
 43   0.068150 172.31.36.109 -> 54.192.29.221 TCP 66 58552 > http [ACK] Seq=97 Ack=139530 Win=268416 Len=0 TSval=33151631 TSecr=717687808
 44   0.068247 54.192.29.221 -> 172.31.36.109 TCP 14546 [TCP segment of a reassembled PDU]
 45   0.068256 172.31.36.109 -> 54.192.29.221 TCP 66 58552 > http [ACK] Seq=97 Ack=154010 Win=297344 Len=0 TSval=33151631 TSecr=717687808
 46   0.068414 54.192.29.221 -> 172.31.36.109 TCP 2962 [TCP segment of a reassembled PDU]
 47   0.068419 172.31.36.109 -> 54.192.29.221 TCP 66 58552 > http [ACK] Seq=97 Ack=156906 Win=303104 Len=0 TSval=33151631 TSecr=717687808
 48   0.069465 54.192.29.221 -> 172.31.36.109 TCP 11650 [TCP segment of a reassembled PDU]
 49   0.069473 172.31.36.109 -> 54.192.29.221 TCP 66 58552 > http [ACK] Seq=97 Ack=168490 Win=326272 Len=0 TSval=33151632 TSecr=717687808
 50   0.069561 54.192.29.221 -> 172.31.36.109 TCP 17442 [TCP segment of a reassembled PDU]
 51   0.069571 172.31.36.109 -> 54.192.29.221 TCP 66 58552 > http [ACK] Seq=97 Ack=185866 Win=361088 Len=0 TSval=33151632 TSecr=717687808
 52   0.069748 54.192.29.221 -> 172.31.36.109 TCP 5858 [TCP segment of a reassembled PDU]
 53   0.069754 172.31.36.109 -> 54.192.29.221 TCP 66 58552 > http [ACK] Seq=97 Ack=191658 Win=372608 Len=0 TSval=33151632 TSecr=717687808
 54   0.070714 54.192.29.221 -> 172.31.36.109 TCP 4786 [TCP segment of a reassembled PDU]
 55   0.070720 172.31.36.109 -> 54.192.29.221 TCP 66 58552 > http [ACK] Seq=97 Ack=196378 Win=382080 Len=0 TSval=33151632 TSecr=717687808
 56   0.073810 54.192.29.221 -> 172.31.36.109 TCP 2962 [TCP segment of a reassembled PDU]
 57   0.073816 172.31.36.109 -> 54.192.29.221 TCP 66 58552 > http [ACK] Seq=97 Ack=199274 Win=387840 Len=0 TSval=33151633 TSecr=717687809
 58   0.073826 54.192.29.221 -> 172.31.36.109 TCP 7306 [TCP segment of a reassembled PDU]
 59   0.073831 172.31.36.109 -> 54.192.29.221 TCP 66 58552 > http [ACK] Seq=97 Ack=206514 Win=402304 Len=0 TSval=33151633 TSecr=717687809
 60   0.074189 54.192.29.221 -> 172.31.36.109 TCP 15994 [TCP segment of a reassembled PDU]
 61   0.074199 172.31.36.109 -> 54.192.29.221 TCP 66 58552 > http [ACK] Seq=97 Ack=222442 Win=434176 Len=0 TSval=33151633 TSecr=717687809
 62   0.074226 54.192.29.221 -> 172.31.36.109 TCP 7306 [TCP segment of a reassembled PDU]
 63   0.074231 172.31.36.109 -> 54.192.29.221 TCP 66 58552 > http [ACK] Seq=97 Ack=229682 Win=448640 Len=0 TSval=33151633 TSecr=717687809
 64   0.074286 54.192.29.221 -> 172.31.36.109 TCP 8754 [TCP segment of a reassembled PDU]
 65   0.074293 172.31.36.109 -> 54.192.29.221 TCP 66 58552 > http [ACK] Seq=97 Ack=238370 Win=466048 Len=0 TSval=33151633 TSecr=717687809
 66   0.075584 54.192.29.221 -> 172.31.36.109 TCP 8754 [TCP segment of a reassembled PDU]
 67   0.075592 172.31.36.109 -> 54.192.29.221 TCP 66 58552 > http [ACK] Seq=97 Ack=247058 Win=483456 Len=0 TSval=33151633 TSecr=717687809
 68   0.075724 54.192.29.221 -> 172.31.36.109 TCP 14922 [TCP segment of a reassembled PDU]
 69   0.075733 172.31.36.109 -> 54.192.29.221 TCP 66 58552 > http [ACK] Seq=97 Ack=261914 Win=513152 Len=0 TSval=33151633 TSecr=717687809
 70   0.096677 54.192.29.221 -> 172.31.36.109 TCP 1514 [TCP segment of a reassembled PDU]
 71   0.096685 172.31.36.109 -> 54.192.29.221 TCP 66 58552 > http [ACK] Seq=97 Ack=263362 Win=515968 Len=0 TSval=33151638 TSecr=717687811
 72   0.096698 54.192.29.221 -> 172.31.36.109 TCP 11650 [TCP segment of a reassembled PDU]
 73   0.096707 172.31.36.109 -> 54.192.29.221 TCP 66 58552 > http [ACK] Seq=97 Ack=274946 Win=537216 Len=0 TSval=33151638 TSecr=717687811
 74   0.096949 54.192.29.221 -> 172.31.36.109 TCP 15994 [TCP segment of a reassembled PDU]
 75   0.096959 172.31.36.109 -> 54.192.29.221 TCP 66 58552 > http [ACK] Seq=97 Ack=290874 Win=532352 Len=0 TSval=33151639 TSecr=717687811
 76   0.097176 54.192.29.221 -> 172.31.36.109 TCP 8754 [TCP segment of a reassembled PDU]
 77   0.097183 172.31.36.109 -> 54.192.29.221 TCP 66 58552 > http [ACK] Seq=97 Ack=299562 Win=544384 Len=0 TSval=33151639 TSecr=717687811
 78   0.097464 54.192.29.221 -> 172.31.36.109 TCP 11650 [TCP segment of a reassembled PDU]
 79   0.097472 172.31.36.109 -> 54.192.29.221 TCP 66 58552 > http [ACK] Seq=97 Ack=311146 Win=539648 Len=0 TSval=33151639 TSecr=717687811
 80   0.098361 54.192.29.221 -> 172.31.36.109 TCP 2962 [TCP segment of a reassembled PDU]
 81   0.098367 172.31.36.109 -> 54.192.29.221 TCP 66 58552 > http [ACK] Seq=97 Ack=314042 Win=553856 Len=0 TSval=33151639 TSecr=717687811
 82   0.098495 54.192.29.221 -> 172.31.36.109 TCP 21786 [TCP segment of a reassembled PDU]
 83   0.098518 172.31.36.109 -> 54.192.29.221 TCP 66 58552 > http [ACK] Seq=97 Ack=335762 Win=532224 Len=0 TSval=33151639 TSecr=717687811
 84   0.098619 54.192.29.221 -> 172.31.36.109 TCP 8754 [TCP segment of a reassembled PDU]
 85   0.098626 172.31.36.109 -> 54.192.29.221 TCP 66 58552 > http [ACK] Seq=97 Ack=344450 Win=544384 Len=0 TSval=33151639 TSecr=717687811
 86   0.098865 54.192.29.221 -> 172.31.36.109 TCP 1514 [TCP segment of a reassembled PDU]
 87   0.098997 54.192.29.221 -> 172.31.36.109 TCP 21786 [TCP segment of a reassembled PDU]
 88   0.099019 172.31.36.109 -> 54.192.29.221 TCP 66 58552 > http [ACK] Seq=97 Ack=367618 Win=522880 Len=0 TSval=33151639 TSecr=717687811
 89   0.099908 54.192.29.221 -> 172.31.36.109 TCP 10202 [TCP segment of a reassembled PDU]
 90   0.099917 172.31.36.109 -> 54.192.29.221 TCP 66 58552 > http [ACK] Seq=97 Ack=377754 Win=541952 Len=0 TSval=33151639 TSecr=717687811
 91   0.100053 54.192.29.221 -> 172.31.36.109 TCP 14546 [TCP segment of a reassembled PDU]
 92   0.100075 172.31.36.109 -> 54.192.29.221 TCP 66 58552 > http [ACK] Seq=97 Ack=392234 Win=556544 Len=0 TSval=33151639 TSecr=717687811
 93   0.100366 54.192.29.221 -> 172.31.36.109 TCP 33370 [TCP segment of a reassembled PDU]
 94   0.100398 172.31.36.109 -> 54.192.29.221 TCP 66 58552 > http [ACK] Seq=97 Ack=425538 Win=523264 Len=0 TSval=33151639 TSecr=717687811
 95   0.100490 54.192.29.221 -> 172.31.36.109 TCP 4410 [TCP segment of a reassembled PDU]
 96   0.100496 172.31.36.109 -> 54.192.29.221 TCP 66 58552 > http [ACK] Seq=97 Ack=429882 Win=551424 Len=0 TSval=33151639 TSecr=717687811
 97   0.101176 54.192.29.221 -> 172.31.36.109 TCP 1514 [TCP segment of a reassembled PDU]
 98   0.101322 54.192.29.221 -> 172.31.36.109 TCP 10202 [TCP segment of a reassembled PDU]
 99   0.101329 172.31.36.109 -> 54.192.29.221 TCP 66 58552 > http [ACK] Seq=97 Ack=441466 Win=576896 Len=0 TSval=33151640 TSecr=717687811
100   0.101700 54.192.29.221 -> 172.31.36.109 TCP 2962 [TCP segment of a reassembled PDU]
101   0.101706 172.31.36.109 -> 54.192.29.221 TCP 66 58552 > http [ACK] Seq=97 Ack=444362 Win=582656 Len=0 TSval=33151640 TSecr=717687811
102   0.101814 54.192.29.221 -> 172.31.36.109 TCP 21786 [TCP segment of a reassembled PDU]
103   0.101837 172.31.36.109 -> 54.192.29.221 TCP 66 58552 > http [ACK] Seq=97 Ack=466082 Win=626048 Len=0 TSval=33151640 TSecr=717687811
104   0.102100 54.192.29.221 -> 172.31.36.109 TCP 26130 [TCP segment of a reassembled PDU]
105   0.102123 172.31.36.109 -> 54.192.29.221 TCP 66 58552 > http [ACK] Seq=97 Ack=492146 Win=678144 Len=0 TSval=33151640 TSecr=717687811
106   0.102764 54.192.29.221 -> 172.31.36.109 TCP 14546 [TCP segment of a reassembled PDU]
107   0.102782 172.31.36.109 -> 54.192.29.221 TCP 66 58552 > http [ACK] Seq=97 Ack=506626 Win=707200 Len=0 TSval=33151640 TSecr=717687812
108   0.103305 54.192.29.221 -> 172.31.36.109 TCP 17498 [TCP segment of a reassembled PDU]
109   0.103314 172.31.36.109 -> 54.192.29.221 TCP 66 58552 > http [ACK] Seq=97 Ack=524058 Win=742016 Len=0 TSval=33151640 TSecr=717687812
110   0.168587 54.192.29.221 -> 172.31.36.109 TCP 8754 [TCP segment of a reassembled PDU]
111   0.168606 172.31.36.109 -> 54.192.29.221 TCP 66 58552 > http [ACK] Seq=97 Ack=532746 Win=759424 Len=0 TSval=33151656 TSecr=717687818
112   0.168836 54.192.29.221 -> 172.31.36.109 TCP 4410 [TCP segment of a reassembled PDU]
113   0.168842 172.31.36.109 -> 54.192.29.221 TCP 66 58552 > http [ACK] Seq=97 Ack=537090 Win=768128 Len=0 TSval=33151656 TSecr=717687818
114   0.168869 54.192.29.221 -> 172.31.36.109 TCP 15994 [TCP segment of a reassembled PDU]
115   0.168878 172.31.36.109 -> 54.192.29.221 TCP 66 58552 > http [ACK] Seq=97 Ack=553018 Win=800000 Len=0 TSval=33151656 TSecr=717687818
116   0.168892 54.192.29.221 -> 172.31.36.109 TCP 1514 [TCP segment of a reassembled PDU]
117   0.168898 172.31.36.109 -> 54.192.29.221 TCP 66 58552 > http [ACK] Seq=97 Ack=554466 Win=802816 Len=0 TSval=33151656 TSecr=717687818
118   0.169126 54.192.29.221 -> 172.31.36.109 TCP 7306 [TCP segment of a reassembled PDU]
119   0.169133 172.31.36.109 -> 54.192.29.221 TCP 66 58552 > http [ACK] Seq=97 Ack=561706 Win=817280 Len=0 TSval=33151657 TSecr=717687818
120   0.169165 54.192.29.221 -> 172.31.36.109 TCP 20338 [TCP segment of a reassembled PDU]
121   0.169175 172.31.36.109 -> 54.192.29.221 TCP 66 58552 > http [ACK] Seq=97 Ack=581978 Win=857856 Len=0 TSval=33151657 TSecr=717687818
122   0.169275 54.192.29.221 -> 172.31.36.109 TCP 4410 [TCP segment of a reassembled PDU]
123   0.169281 172.31.36.109 -> 54.192.29.221 TCP 66 58552 > http [ACK] Seq=97 Ack=586322 Win=866560 Len=0 TSval=33151657 TSecr=717687818
124   0.170070 54.192.29.221 -> 172.31.36.109 TCP 11650 [TCP segment of a reassembled PDU]
125   0.170086 172.31.36.109 -> 54.192.29.221 TCP 66 58552 > http [ACK] Seq=97 Ack=597906 Win=889728 Len=0 TSval=33151657 TSecr=717687818
126   0.170188 54.192.29.221 -> 172.31.36.109 TCP 5858 [TCP segment of a reassembled PDU]
127   0.170194 172.31.36.109 -> 54.192.29.221 TCP 66 58552 > http [ACK] Seq=97 Ack=603698 Win=900480 Len=0 TSval=33151657 TSecr=717687818
128   0.170455 54.192.29.221 -> 172.31.36.109 TCP 10202 [TCP segment of a reassembled PDU]
129   0.170495 54.192.29.221 -> 172.31.36.109 TCP 24682 [TCP segment of a reassembled PDU]
130   0.170572 54.192.29.221 -> 172.31.36.109 TCP 5858 [TCP segment of a reassembled PDU]
131   0.170694 54.192.29.221 -> 172.31.36.109 TCP 7306 [TCP segment of a reassembled PDU]
132   0.171343 54.192.29.221 -> 172.31.36.109 TCP 15994 [TCP segment of a reassembled PDU]
133   0.171452 54.192.29.221 -> 172.31.36.109 TCP 4410 [TCP segment of a reassembled PDU]
134   0.171601 54.192.29.221 -> 172.31.36.109 TCP 11650 [TCP segment of a reassembled PDU]
135   0.172947 172.31.36.109 -> 54.192.29.221 TCP 66 58552 > http [ACK] Seq=97 Ack=683338 Win=820864 Len=0 TSval=33151658 TSecr=717687818
136   0.174176 54.192.29.221 -> 172.31.36.109 TCP 14546 [TCP segment of a reassembled PDU]
137   0.174186 172.31.36.109 -> 54.192.29.221 TCP 66 58552 > http [ACK] Seq=97 Ack=697818 Win=886144 Len=0 TSval=33151658 TSecr=717687819
138   0.174289 54.192.29.221 -> 172.31.36.109 TCP 4410 [TCP segment of a reassembled PDU]
139   0.174295 172.31.36.109 -> 54.192.29.221 TCP 66 58552 > http [ACK] Seq=97 Ack=702162 Win=902912 Len=0 TSval=33151658 TSecr=717687819
140   0.174365 54.192.29.221 -> 172.31.36.109 TCP 4410 [TCP segment of a reassembled PDU]
141   0.174370 172.31.36.109 -> 54.192.29.221 TCP 66 58552 > http [ACK] Seq=97 Ack=706506 Win=902912 Len=0 TSval=33151658 TSecr=717687819
142   0.174592 54.192.29.221 -> 172.31.36.109 TCP 27578 [TCP segment of a reassembled PDU]
143   0.174610 54.192.29.221 -> 172.31.36.109 TCP 4410 [TCP segment of a reassembled PDU]
144   0.174798 172.31.36.109 -> 54.192.29.221 TCP 66 58552 > http [ACK] Seq=97 Ack=738362 Win=871168 Len=0 TSval=33151658 TSecr=717687819
145   0.174831 54.192.29.221 -> 172.31.36.109 TCP 21786 [TCP segment of a reassembled PDU]
146   0.174853 172.31.36.109 -> 54.192.29.221 TCP 66 58552 > http [ACK] Seq=97 Ack=760082 Win=874368 Len=0 TSval=33151658 TSecr=717687819
147   0.174882 54.192.29.221 -> 172.31.36.109 TCP 4410 [TCP segment of a reassembled PDU]
148   0.174888 172.31.36.109 -> 54.192.29.221 TCP 66 58552 > http [ACK] Seq=97 Ack=764426 Win=902912 Len=0 TSval=33151658 TSecr=717687819
149   0.174908 54.192.29.221 -> 172.31.36.109 TCP 4410 [TCP segment of a reassembled PDU]
150   0.174914 172.31.36.109 -> 54.192.29.221 TCP 66 58552 > http [ACK] Seq=97 Ack=768770 Win=902912 Len=0 TSval=33151658 TSecr=717687819
151   0.175063 54.192.29.221 -> 172.31.36.109 TCP 2962 [TCP segment of a reassembled PDU]
152   0.175069 172.31.36.109 -> 54.192.29.221 TCP 66 58552 > http [ACK] Seq=97 Ack=771666 Win=905216 Len=0 TSval=33151658 TSecr=717687819
153   0.175456 54.192.29.221 -> 172.31.36.109 TCP 10202 [TCP segment of a reassembled PDU]
154   0.175480 172.31.36.109 -> 54.192.29.221 TCP 66 58552 > http [ACK] Seq=97 Ack=781802 Win=909952 Len=0 TSval=33151658 TSecr=717687819
155   0.175920 54.192.29.221 -> 172.31.36.109 TCP 4466 [TCP segment of a reassembled PDU]
156   0.175936 172.31.36.109 -> 54.192.29.221 TCP 66 58552 > http [ACK] Seq=97 Ack=786202 Win=909952 Len=0 TSval=33151658 TSecr=717687819
157   0.176488 54.192.29.221 -> 172.31.36.109 TCP 1514 [TCP segment of a reassembled PDU]
158   0.176499 54.192.29.221 -> 172.31.36.109 TCP 8754 [TCP segment of a reassembled PDU]
159   0.176515 172.31.36.109 -> 54.192.29.221 TCP 66 58552 > http [ACK] Seq=97 Ack=796338 Win=909952 Len=0 TSval=33151658 TSecr=717687819
160   0.176790 54.192.29.221 -> 172.31.36.109 TCP 8754 [TCP segment of a reassembled PDU]
161   0.176822 54.192.29.221 -> 172.31.36.109 TCP 15994 [TCP segment of a reassembled PDU]
162   0.176841 172.31.36.109 -> 54.192.29.221 TCP 66 58552 > http [ACK] Seq=97 Ack=820954 Win=885376 Len=0 TSval=33151658 TSecr=717687819
163   0.176894 54.192.29.221 -> 172.31.36.109 TCP 8754 [TCP segment of a reassembled PDU]
164   0.176901 172.31.36.109 -> 54.192.29.221 TCP 66 58552 > http [ACK] Seq=97 Ack=829642 Win=895744 Len=0 TSval=33151658 TSecr=717687819
165   0.176968 54.192.29.221 -> 172.31.36.109 TCP 11650 [TCP segment of a reassembled PDU]
166   0.177105 54.192.29.221 -> 172.31.36.109 TCP 10202 [TCP segment of a reassembled PDU]
167   0.177219 172.31.36.109 -> 54.192.29.221 TCP 66 58552 > http [ACK] Seq=97 Ack=851362 Win=893440 Len=0 TSval=33151659 TSecr=717687819
168   0.177744 54.192.29.221 -> 172.31.36.109 TCP 2962 [TCP segment of a reassembled PDU]
169   0.177750 172.31.36.109 -> 54.192.29.221 TCP 66 58552 > http [ACK] Seq=97 Ack=854258 Win=905216 Len=0 TSval=33151659 TSecr=717687819
170   0.177880 54.192.29.221 -> 172.31.36.109 TCP 24682 [TCP segment of a reassembled PDU]
171   0.177913 172.31.36.109 -> 54.192.29.221 TCP 66 58552 > http [ACK] Seq=97 Ack=878874 Win=880640 Len=0 TSval=33151659 TSecr=717687819
172   0.178034 54.192.29.221 -> 172.31.36.109 TCP 18890 [TCP segment of a reassembled PDU]
173   0.178054 172.31.36.109 -> 54.192.29.221 TCP 66 58552 > http [ACK] Seq=97 Ack=897698 Win=879104 Len=0 TSval=33151659 TSecr=717687819
174   0.178101 54.192.29.221 -> 172.31.36.109 TCP 7306 [TCP segment of a reassembled PDU]
175   0.178108 172.31.36.109 -> 54.192.29.221 TCP 66 58552 > http [ACK] Seq=97 Ack=904938 Win=898176 Len=0 TSval=33151659 TSecr=717687819
176   0.178277 54.192.29.221 -> 172.31.36.109 TCP 11650 [TCP segment of a reassembled PDU]
177   0.178304 172.31.36.109 -> 54.192.29.221 TCP 66 58552 > http [ACK] Seq=97 Ack=916522 Win=909952 Len=0 TSval=33151659 TSecr=717687819
178   0.178543 54.192.29.221 -> 172.31.36.109 TCP 17442 [TCP segment of a reassembled PDU]
179   0.178564 172.31.36.109 -> 54.192.29.221 TCP 66 58552 > http [ACK] Seq=97 Ack=933898 Win=892672 Len=0 TSval=33151659 TSecr=717687819
180   0.178655 54.192.29.221 -> 172.31.36.109 TCP 4410 [TCP segment of a reassembled PDU]
181   0.178661 172.31.36.109 -> 54.192.29.221 TCP 66 58552 > http [ACK] Seq=97 Ack=938242 Win=902912 Len=0 TSval=33151659 TSecr=717687819
182   0.178711 54.192.29.221 -> 172.31.36.109 TCP 2962 [TCP segment of a reassembled PDU]
183   0.178716 172.31.36.109 -> 54.192.29.221 TCP 66 58552 > http [ACK] Seq=97 Ack=941138 Win=905216 Len=0 TSval=33151659 TSecr=717687819
184   0.178890 54.192.29.221 -> 172.31.36.109 TCP 11650 [TCP segment of a reassembled PDU]
185   0.178929 172.31.36.109 -> 54.192.29.221 TCP 66 58552 > http [ACK] Seq=97 Ack=952722 Win=909952 Len=0 TSval=33151659 TSecr=717687819
186   0.179276 54.192.29.221 -> 172.31.36.109 TCP 4410 [TCP segment of a reassembled PDU]
187   0.179298 172.31.36.109 -> 54.192.29.221 TCP 66 58552 > http [ACK] Seq=97 Ack=957066 Win=909952 Len=0 TSval=33151659 TSecr=717687819
188   0.179421 54.192.29.221 -> 172.31.36.109 TCP 17442 [TCP segment of a reassembled PDU]
189   0.179615 172.31.36.109 -> 54.192.29.221 TCP 66 58552 > http [ACK] Seq=97 Ack=974442 Win=892672 Len=0 TSval=33151659 TSecr=717687819
190   0.179710 54.192.29.221 -> 172.31.36.109 TCP 7306 [TCP segment of a reassembled PDU]
191   0.179718 172.31.36.109 -> 54.192.29.221 TCP 66 58552 > http [ACK] Seq=97 Ack=981682 Win=898176 Len=0 TSval=33151659 TSecr=717687819
192   0.179735 54.192.29.221 -> 172.31.36.109 TCP 14546 [TCP segment of a reassembled PDU]
193   0.179756 172.31.36.109 -> 54.192.29.221 TCP 66 58552 > http [ACK] Seq=97 Ack=996162 Win=886144 Len=0 TSval=33151659 TSecr=717687819
194   0.179800 54.192.29.221 -> 172.31.36.109 TCP 20338 [TCP segment of a reassembled PDU]
195   0.179820 172.31.36.109 -> 54.192.29.221 TCP 66 58552 > http [ACK] Seq=97 Ack=1016434 Win=876672 Len=0 TSval=33151659 TSecr=717687819
196   0.179883 54.192.29.221 -> 172.31.36.109 TCP 8754 [TCP segment of a reassembled PDU]
197   0.179890 172.31.36.109 -> 54.192.29.221 TCP 66 58552 > http [ACK] Seq=97 Ack=1025122 Win=895744 Len=0 TSval=33151659 TSecr=717687819
198   0.180179 54.192.29.221 -> 172.31.36.109 TCP 21786 [TCP segment of a reassembled PDU]
199   0.180221 172.31.36.109 -> 54.192.29.221 TCP 66 58552 > http [ACK] Seq=97 Ack=1046842 Win=874368 Len=0 TSval=33151659 TSecr=717687819
200   0.181021 54.192.29.221 -> 172.31.36.109 HTTP 2258 HTTP/1.1 200 OK  (application/octet-stream)
201   0.181027 172.31.36.109 -> 54.192.29.221 TCP 66 58552 > http [ACK] Seq=97 Ack=1049034 Win=905216 Len=0 TSval=33151660 TSecr=717687819
202   0.181187 172.31.36.109 -> 54.192.29.221 TCP 66 58552 > http [FIN, ACK] Seq=97 Ack=1049034 Win=909952 Len=0 TSval=33151660 TSecr=717687819
203   0.182304 54.192.29.221 -> 172.31.36.109 TCP 66 http > 58552 [FIN, ACK] Seq=1049034 Ack=98 Win=14592 Len=0 TSval=717687820 TSecr=33151660
204   0.182315 172.31.36.109 -> 54.192.29.221 TCP 66 58552 > http [ACK] Seq=98 Ack=1049035 Win=909952 Len=0 TSval=33151660 TSecr=717687820
