[Measurement for 1mb at 04:34:34 20.34.2014] 
Tshark:

  1   0.000000 172.31.36.109 -> 172.31.0.2   DNS 89 Standard query 0xf99a  A d2pcb72msibvx3.cloudfront.net
  2   0.000025 172.31.36.109 -> 172.31.0.2   DNS 89 Standard query 0x6623  AAAA d2pcb72msibvx3.cloudfront.net
  3   0.000520   172.31.0.2 -> 172.31.36.109 DNS 217 Standard query response 0xf99a  A 54.230.30.73 A 54.230.30.189 A 54.192.30.184 A 54.192.30.188 A 54.192.30.218 A 54.192.30.222 A 54.192.30.227 A 54.230.30.72
  4   0.000686   172.31.0.2 -> 172.31.36.109 DNS 169 Standard query response 0x6623 
  5   0.003846 172.31.36.109 -> 54.230.30.73 TCP 74 44833 > http [SYN] Seq=0 Win=26883 Len=0 MSS=8961 SACK_PERM=1 TSval=30440345 TSecr=0 WS=128
  6   0.005604 54.230.30.73 -> 172.31.36.109 TCP 74 http > 44833 [SYN, ACK] Seq=0 Ack=1 Win=14480 Len=0 MSS=1460 SACK_PERM=1 TSval=639477708 TSecr=30440345 WS=128
  7   0.005628 172.31.36.109 -> 54.230.30.73 TCP 66 44833 > http [ACK] Seq=1 Ack=1 Win=27008 Len=0 TSval=30440345 TSecr=639477708
  8   0.005665 172.31.36.109 -> 54.230.30.73 HTTP 162 GET /1mb HTTP/1.1 
  9   0.007227 54.230.30.73 -> 172.31.36.109 TCP 66 http > 44833 [ACK] Seq=1 Ack=97 Win=14592 Len=0 TSval=639477708 TSecr=30440345
 10   0.042275 54.230.30.73 -> 172.31.36.109 TCP 1144 [TCP segment of a reassembled PDU]
 11   0.042299 172.31.36.109 -> 54.230.30.73 TCP 66 44833 > http [ACK] Seq=97 Ack=1079 Win=29056 Len=0 TSval=30440355 TSecr=639477711
 12   0.042307 54.230.30.73 -> 172.31.36.109 TCP 2962 [TCP segment of a reassembled PDU]
 13   0.042311 172.31.36.109 -> 54.230.30.73 TCP 66 44833 > http [ACK] Seq=97 Ack=3975 Win=34944 Len=0 TSval=30440355 TSecr=639477711
 14   0.042366 54.230.30.73 -> 172.31.36.109 TCP 2962 [TCP segment of a reassembled PDU]
 15   0.042371 172.31.36.109 -> 54.230.30.73 TCP 66 44833 > http [ACK] Seq=97 Ack=6871 Win=40704 Len=0 TSval=30440355 TSecr=639477711
 16   0.042410 54.230.30.73 -> 172.31.36.109 TCP 2962 [TCP segment of a reassembled PDU]
 17   0.042415 172.31.36.109 -> 54.230.30.73 TCP 66 44833 > http [ACK] Seq=97 Ack=9767 Win=46464 Len=0 TSval=30440355 TSecr=639477711
 18   0.042478 54.230.30.73 -> 172.31.36.109 TCP 1514 [TCP segment of a reassembled PDU]
 19   0.042482 172.31.36.109 -> 54.230.30.73 TCP 66 44833 > http [ACK] Seq=97 Ack=11215 Win=49408 Len=0 TSval=30440355 TSecr=639477711
 20   0.042540 54.230.30.73 -> 172.31.36.109 TCP 2962 [TCP segment of a reassembled PDU]
 21   0.042548 172.31.36.109 -> 54.230.30.73 TCP 66 44833 > http [ACK] Seq=97 Ack=14111 Win=55168 Len=0 TSval=30440355 TSecr=639477711
 22   0.043793 54.230.30.73 -> 172.31.36.109 TCP 5858 [TCP segment of a reassembled PDU]
 23   0.043818 172.31.36.109 -> 54.230.30.73 TCP 66 44833 > http [ACK] Seq=97 Ack=19903 Win=66688 Len=0 TSval=30440355 TSecr=639477712
 24   0.043824 54.230.30.73 -> 172.31.36.109 TCP 1514 [TCP segment of a reassembled PDU]
 25   0.043826 172.31.36.109 -> 54.230.30.73 TCP 66 44833 > http [ACK] Seq=97 Ack=21351 Win=69632 Len=0 TSval=30440355 TSecr=639477712
 26   0.044037 54.230.30.73 -> 172.31.36.109 TCP 7306 [TCP segment of a reassembled PDU]
 27   0.044060 172.31.36.109 -> 54.230.30.73 TCP 66 44833 > http [ACK] Seq=97 Ack=28591 Win=84096 Len=0 TSval=30440355 TSecr=639477712
 28   0.044177 54.230.30.73 -> 172.31.36.109 TCP 8754 [TCP segment of a reassembled PDU]
 29   0.044203 172.31.36.109 -> 54.230.30.73 TCP 66 44833 > http [ACK] Seq=97 Ack=37279 Win=101504 Len=0 TSval=30440355 TSecr=639477712
 30   0.045334 54.230.30.73 -> 172.31.36.109 TCP 2962 [TCP segment of a reassembled PDU]
 31   0.045346 172.31.36.109 -> 54.230.30.73 TCP 66 44833 > http [ACK] Seq=97 Ack=40175 Win=107264 Len=0 TSval=30440355 TSecr=639477712
 32   0.045502 54.230.30.73 -> 172.31.36.109 TCP 1514 [TCP segment of a reassembled PDU]
 33   0.045535 172.31.36.109 -> 54.230.30.73 TCP 66 44833 > http [ACK] Seq=97 Ack=41623 Win=109056 Len=0 TSval=30440355 TSecr=639477712
 34   0.045660 54.230.30.73 -> 172.31.36.109 TCP 11650 [TCP segment of a reassembled PDU]
 35   0.045686 172.31.36.109 -> 54.230.30.73 TCP 66 44833 > http [ACK] Seq=97 Ack=53207 Win=98944 Len=0 TSval=30440355 TSecr=639477712
 36   0.045944 54.230.30.73 -> 172.31.36.109 TCP 7306 [TCP segment of a reassembled PDU]
 37   0.045971 172.31.36.109 -> 54.230.30.73 TCP 66 44833 > http [ACK] Seq=97 Ack=60447 Win=105984 Len=0 TSval=30440356 TSecr=639477712
 38   0.045980 54.230.30.73 -> 172.31.36.109 TCP 4410 [TCP segment of a reassembled PDU]
 39   0.045984 172.31.36.109 -> 54.230.30.73 TCP 66 44833 > http [ACK] Seq=97 Ack=64791 Win=101760 Len=0 TSval=30440356 TSecr=639477712
 40   0.046064 54.230.30.73 -> 172.31.36.109 TCP 1514 [TCP segment of a reassembled PDU]
 41   0.046075 172.31.36.109 -> 54.230.30.73 TCP 66 44833 > http [ACK] Seq=97 Ack=66239 Win=112000 Len=0 TSval=30440356 TSecr=639477712
 42   0.047158 54.230.30.73 -> 172.31.36.109 TCP 2962 [TCP segment of a reassembled PDU]
 43   0.047163 172.31.36.109 -> 54.230.30.73 TCP 66 44833 > http [ACK] Seq=97 Ack=69135 Win=117760 Len=0 TSval=30440356 TSecr=639477712
 44   0.047238 54.230.30.73 -> 172.31.36.109 TCP 5858 [TCP segment of a reassembled PDU]
 45   0.047244 172.31.36.109 -> 54.230.30.73 TCP 66 44833 > http [ACK] Seq=97 Ack=74927 Win=129280 Len=0 TSval=30440356 TSecr=639477712
 46   0.047347 54.230.30.73 -> 172.31.36.109 TCP 2962 [TCP segment of a reassembled PDU]
 47   0.047361 172.31.36.109 -> 54.230.30.73 TCP 66 44833 > http [ACK] Seq=97 Ack=77823 Win=135168 Len=0 TSval=30440356 TSecr=639477712
 48   0.047402 54.230.30.73 -> 172.31.36.109 TCP 1514 [TCP segment of a reassembled PDU]
 49   0.047406 172.31.36.109 -> 54.230.30.73 TCP 66 44833 > http [ACK] Seq=97 Ack=79271 Win=137984 Len=0 TSval=30440356 TSecr=639477712
 50   0.047736 54.230.30.73 -> 172.31.36.109 TCP 2962 [TCP segment of a reassembled PDU]
 51   0.047747 172.31.36.109 -> 54.230.30.73 TCP 66 44833 > http [ACK] Seq=97 Ack=82167 Win=143872 Len=0 TSval=30440356 TSecr=639477712
 52   0.047770 54.230.30.73 -> 172.31.36.109 TCP 2962 [TCP segment of a reassembled PDU]
 53   0.047772 172.31.36.109 -> 54.230.30.73 TCP 66 44833 > http [ACK] Seq=97 Ack=85063 Win=149632 Len=0 TSval=30440356 TSecr=639477712
 54   0.047860 54.230.30.73 -> 172.31.36.109 TCP 2962 [TCP segment of a reassembled PDU]
 55   0.047871 172.31.36.109 -> 54.230.30.73 TCP 66 44833 > http [ACK] Seq=97 Ack=87959 Win=155392 Len=0 TSval=30440356 TSecr=639477712
 56   0.047940 54.230.30.73 -> 172.31.36.109 TCP 8754 [TCP segment of a reassembled PDU]
 57   0.047946 172.31.36.109 -> 54.230.30.73 TCP 66 44833 > http [ACK] Seq=97 Ack=96647 Win=172800 Len=0 TSval=30440356 TSecr=639477712
 58   0.048856 54.230.30.73 -> 172.31.36.109 TCP 2962 [TCP segment of a reassembled PDU]
 59   0.048890 172.31.36.109 -> 54.230.30.73 TCP 66 44833 > http [ACK] Seq=97 Ack=99543 Win=178560 Len=0 TSval=30440356 TSecr=639477712
 60   0.048993 54.230.30.73 -> 172.31.36.109 TCP 5858 [TCP segment of a reassembled PDU]
 61   0.049020 172.31.36.109 -> 54.230.30.73 TCP 66 44833 > http [ACK] Seq=97 Ack=105335 Win=190208 Len=0 TSval=30440356 TSecr=639477712
 62   0.049025 54.230.30.73 -> 172.31.36.109 TCP 1514 [TCP segment of a reassembled PDU]
 63   0.049027 172.31.36.109 -> 54.230.30.73 TCP 66 44833 > http [ACK] Seq=97 Ack=106783 Win=193024 Len=0 TSval=30440356 TSecr=639477712
 64   0.049147 54.230.30.73 -> 172.31.36.109 TCP 7306 [TCP segment of a reassembled PDU]
 65   0.049180 172.31.36.109 -> 54.230.30.73 TCP 66 44833 > http [ACK] Seq=97 Ack=114023 Win=207488 Len=0 TSval=30440356 TSecr=639477712
 66   0.049511 54.230.30.73 -> 172.31.36.109 TCP 1514 [TCP segment of a reassembled PDU]
 67   0.049522 172.31.36.109 -> 54.230.30.73 TCP 66 44833 > http [ACK] Seq=97 Ack=115471 Win=210432 Len=0 TSval=30440356 TSecr=639477712
 68   0.049642 54.230.30.73 -> 172.31.36.109 TCP 10202 [TCP segment of a reassembled PDU]
 69   0.049659 172.31.36.109 -> 54.230.30.73 TCP 66 44833 > http [ACK] Seq=97 Ack=125607 Win=230656 Len=0 TSval=30440356 TSecr=639477712
 70   0.049725 54.230.30.73 -> 172.31.36.109 TCP 5301 [TCP segment of a reassembled PDU]
 71   0.049744 172.31.36.109 -> 54.230.30.73 TCP 66 44833 > http [ACK] Seq=97 Ack=130842 Win=241152 Len=0 TSval=30440356 TSecr=639477712
 72   0.083227 54.230.30.73 -> 172.31.36.109 TCP 1514 [TCP segment of a reassembled PDU]
 73   0.083234 172.31.36.109 -> 54.230.30.73 TCP 66 44833 > http [ACK] Seq=97 Ack=132290 Win=244096 Len=0 TSval=30440365 TSecr=639477716
 74   0.083432 54.230.30.73 -> 172.31.36.109 TCP 4410 [TCP segment of a reassembled PDU]
 75   0.083438 172.31.36.109 -> 54.230.30.73 TCP 66 44833 > http [ACK] Seq=97 Ack=136634 Win=252800 Len=0 TSval=30440365 TSecr=639477716
 76   0.083522 54.230.30.73 -> 172.31.36.109 TCP 10202 [TCP segment of a reassembled PDU]
 77   0.083529 172.31.36.109 -> 54.230.30.73 TCP 66 44833 > http [ACK] Seq=97 Ack=146770 Win=273024 Len=0 TSval=30440365 TSecr=639477716
 78   0.083872 54.230.30.73 -> 172.31.36.109 TCP 5858 [TCP segment of a reassembled PDU]
 79   0.083896 172.31.36.109 -> 54.230.30.73 TCP 66 44833 > http [ACK] Seq=97 Ack=152562 Win=284544 Len=0 TSval=30440365 TSecr=639477716
 80   0.083998 54.230.30.73 -> 172.31.36.109 TCP 4410 [TCP segment of a reassembled PDU]
 81   0.084011 172.31.36.109 -> 54.230.30.73 TCP 66 44833 > http [ACK] Seq=97 Ack=156906 Win=293248 Len=0 TSval=30440365 TSecr=639477716
 82   0.084046 54.230.30.73 -> 172.31.36.109 TCP 10202 [TCP segment of a reassembled PDU]
 83   0.084052 172.31.36.109 -> 54.230.30.73 TCP 66 44833 > http [ACK] Seq=97 Ack=167042 Win=313600 Len=0 TSval=30440365 TSecr=639477716
 84   0.084538 54.230.30.73 -> 172.31.36.109 TCP 7306 [TCP segment of a reassembled PDU]
 85   0.084544 172.31.36.109 -> 54.230.30.73 TCP 66 44833 > http [ACK] Seq=97 Ack=174282 Win=328064 Len=0 TSval=30440365 TSecr=639477716
 86   0.084680 54.230.30.73 -> 172.31.36.109 TCP 7306 [TCP segment of a reassembled PDU]
 87   0.084705 172.31.36.109 -> 54.230.30.73 TCP 66 44833 > http [ACK] Seq=97 Ack=181522 Win=342528 Len=0 TSval=30440365 TSecr=639477716
 88   0.084838 54.230.30.73 -> 172.31.36.109 TCP 2962 [TCP segment of a reassembled PDU]
 89   0.084856 172.31.36.109 -> 54.230.30.73 TCP 66 44833 > http [ACK] Seq=97 Ack=184418 Win=348288 Len=0 TSval=30440365 TSecr=639477716
 90   0.085350 54.230.30.73 -> 172.31.36.109 TCP 4410 [TCP segment of a reassembled PDU]
 91   0.085379 172.31.36.109 -> 54.230.30.73 TCP 66 44833 > http [ACK] Seq=97 Ack=188762 Win=356992 Len=0 TSval=30440365 TSecr=639477716
 92   0.085512 54.230.30.73 -> 172.31.36.109 TCP 14546 [TCP segment of a reassembled PDU]
 93   0.085535 172.31.36.109 -> 54.230.30.73 TCP 66 44833 > http [ACK] Seq=97 Ack=203242 Win=385920 Len=0 TSval=30440365 TSecr=639477716
 94   0.085544 54.230.30.73 -> 172.31.36.109 TCP 5858 [TCP segment of a reassembled PDU]
 95   0.085548 172.31.36.109 -> 54.230.30.73 TCP 66 44833 > http [ACK] Seq=97 Ack=209034 Win=397568 Len=0 TSval=30440365 TSecr=639477716
 96   0.085873 54.230.30.73 -> 172.31.36.109 TCP 18890 [TCP segment of a reassembled PDU]
 97   0.085884 172.31.36.109 -> 54.230.30.73 TCP 66 44833 > http [ACK] Seq=97 Ack=227858 Win=435200 Len=0 TSval=30440365 TSecr=639477716
 98   0.085936 54.230.30.73 -> 172.31.36.109 TCP 1514 [TCP segment of a reassembled PDU]
 99   0.085940 172.31.36.109 -> 54.230.30.73 TCP 66 44833 > http [ACK] Seq=97 Ack=229306 Win=438144 Len=0 TSval=30440366 TSecr=639477716
100   0.086043 54.230.30.73 -> 172.31.36.109 TCP 5858 [TCP segment of a reassembled PDU]
101   0.086064 172.31.36.109 -> 54.230.30.73 TCP 66 44833 > http [ACK] Seq=97 Ack=235098 Win=449664 Len=0 TSval=30440366 TSecr=639477716
102   0.086795 54.230.30.73 -> 172.31.36.109 TCP 8754 [TCP segment of a reassembled PDU]
103   0.086826 172.31.36.109 -> 54.230.30.73 TCP 66 44833 > http [ACK] Seq=97 Ack=243786 Win=467072 Len=0 TSval=30440366 TSecr=639477716
104   0.086924 54.230.30.73 -> 172.31.36.109 TCP 14546 [TCP segment of a reassembled PDU]
105   0.086933 172.31.36.109 -> 54.230.30.73 TCP 66 44833 > http [ACK] Seq=97 Ack=258266 Win=496000 Len=0 TSval=30440366 TSecr=639477716
106   0.086967 54.230.30.73 -> 172.31.36.109 TCP 4410 [TCP segment of a reassembled PDU]
107   0.086972 172.31.36.109 -> 54.230.30.73 TCP 66 44833 > http [ACK] Seq=97 Ack=262610 Win=500480 Len=0 TSval=30440366 TSecr=639477716
108   0.087152 54.230.30.73 -> 172.31.36.109 TCP 14546 [TCP segment of a reassembled PDU]
109   0.087162 172.31.36.109 -> 54.230.30.73 TCP 66 44833 > http [ACK] Seq=97 Ack=277090 Win=486016 Len=0 TSval=30440366 TSecr=639477716
110   0.087311 54.230.30.73 -> 172.31.36.109 TCP 10202 [TCP segment of a reassembled PDU]
111   0.087333 172.31.36.109 -> 54.230.30.73 TCP 66 44833 > http [ACK] Seq=97 Ack=287226 Win=514944 Len=0 TSval=30440366 TSecr=639477716
112   0.087430 54.230.30.73 -> 172.31.36.109 TCP 7306 [TCP segment of a reassembled PDU]
113   0.087437 172.31.36.109 -> 54.230.30.73 TCP 66 44833 > http [ACK] Seq=97 Ack=294466 Win=519680 Len=0 TSval=30440366 TSecr=639477716
114   0.087678 54.230.30.73 -> 172.31.36.109 TCP 13098 [TCP segment of a reassembled PDU]
115   0.087704 172.31.36.109 -> 54.230.30.73 TCP 66 44833 > http [ACK] Seq=97 Ack=307498 Win=510208 Len=0 TSval=30440366 TSecr=639477716
116   0.088122 54.230.30.73 -> 172.31.36.109 TCP 5858 [TCP segment of a reassembled PDU]
117   0.088128 172.31.36.109 -> 54.230.30.73 TCP 66 44833 > http [ACK] Seq=97 Ack=313290 Win=536576 Len=0 TSval=30440366 TSecr=639477716
118   0.088241 54.230.30.73 -> 172.31.36.109 TCP 1514 [TCP segment of a reassembled PDU]
119   0.088246 172.31.36.109 -> 54.230.30.73 TCP 66 44833 > http [ACK] Seq=97 Ack=314738 Win=539392 Len=0 TSval=30440366 TSecr=639477716
120   0.088331 54.230.30.73 -> 172.31.36.109 TCP 8754 [TCP segment of a reassembled PDU]
121   0.088338 172.31.36.109 -> 54.230.30.73 TCP 66 44833 > http [ACK] Seq=97 Ack=323426 Win=556800 Len=0 TSval=30440366 TSecr=639477716
122   0.088439 54.230.30.73 -> 172.31.36.109 TCP 4410 [TCP segment of a reassembled PDU]
123   0.088452 172.31.36.109 -> 54.230.30.73 TCP 66 44833 > http [ACK] Seq=97 Ack=327770 Win=565504 Len=0 TSval=30440366 TSecr=639477716
124   0.088565 54.230.30.73 -> 172.31.36.109 TCP 5858 [TCP segment of a reassembled PDU]
125   0.088579 172.31.36.109 -> 54.230.30.73 TCP 66 44833 > http [ACK] Seq=97 Ack=333562 Win=577152 Len=0 TSval=30440366 TSecr=639477716
126   0.088722 54.230.30.73 -> 172.31.36.109 TCP 21786 [TCP segment of a reassembled PDU]
127   0.088753 172.31.36.109 -> 54.230.30.73 TCP 66 44833 > http [ACK] Seq=97 Ack=355282 Win=620544 Len=0 TSval=30440366 TSecr=639477716
128   0.088997 54.230.30.73 -> 172.31.36.109 TCP 15994 [TCP segment of a reassembled PDU]
129   0.089006 172.31.36.109 -> 54.230.30.73 TCP 66 44833 > http [ACK] Seq=97 Ack=371210 Win=652416 Len=0 TSval=30440366 TSecr=639477716
130   0.089084 54.230.30.73 -> 172.31.36.109 TCP 8754 [TCP segment of a reassembled PDU]
131   0.089090 172.31.36.109 -> 54.230.30.73 TCP 66 44833 > http [ACK] Seq=97 Ack=379898 Win=669824 Len=0 TSval=30440366 TSecr=639477716
132   0.089551 54.230.30.73 -> 172.31.36.109 TCP 5858 [TCP segment of a reassembled PDU]
133   0.089557 172.31.36.109 -> 54.230.30.73 TCP 66 44833 > http [ACK] Seq=97 Ack=385690 Win=681344 Len=0 TSval=30440366 TSecr=639477716
134   0.089708 54.230.30.73 -> 172.31.36.109 TCP 7362 [TCP segment of a reassembled PDU]
135   0.089723 172.31.36.109 -> 54.230.30.73 TCP 66 44833 > http [ACK] Seq=97 Ack=392986 Win=695936 Len=0 TSval=30440366 TSecr=639477716
136   0.131229 54.230.30.73 -> 172.31.36.109 TCP 7306 [TCP segment of a reassembled PDU]
137   0.131238 172.31.36.109 -> 54.230.30.73 TCP 66 44833 > http [ACK] Seq=97 Ack=400226 Win=710400 Len=0 TSval=30440377 TSecr=639477720
138   0.131246 54.230.30.73 -> 172.31.36.109 TCP 4410 [TCP segment of a reassembled PDU]
139   0.131249 172.31.36.109 -> 54.230.30.73 TCP 66 44833 > http [ACK] Seq=97 Ack=404570 Win=719104 Len=0 TSval=30440377 TSecr=639477720
140   0.131349 54.230.30.73 -> 172.31.36.109 TCP 1514 [TCP segment of a reassembled PDU]
141   0.131353 172.31.36.109 -> 54.230.30.73 TCP 66 44833 > http [ACK] Seq=97 Ack=406018 Win=722048 Len=0 TSval=30440377 TSecr=639477720
142   0.131627 54.230.30.73 -> 172.31.36.109 TCP 11650 [TCP segment of a reassembled PDU]
143   0.131645 172.31.36.109 -> 54.230.30.73 TCP 66 44833 > http [ACK] Seq=97 Ack=417602 Win=745216 Len=0 TSval=30440377 TSecr=639477720
144   0.131737 54.230.30.73 -> 172.31.36.109 TCP 13098 [TCP segment of a reassembled PDU]
145   0.131746 172.31.36.109 -> 54.230.30.73 TCP 66 44833 > http [ACK] Seq=97 Ack=430634 Win=771200 Len=0 TSval=30440377 TSecr=639477720
146   0.131757 54.230.30.73 -> 172.31.36.109 TCP 5858 [TCP segment of a reassembled PDU]
147   0.131760 172.31.36.109 -> 54.230.30.73 TCP 66 44833 > http [ACK] Seq=97 Ack=436426 Win=782848 Len=0 TSval=30440377 TSecr=639477720
148   0.131904 54.230.30.73 -> 172.31.36.109 TCP 15994 [TCP segment of a reassembled PDU]
149   0.131914 172.31.36.109 -> 54.230.30.73 TCP 66 44833 > http [ACK] Seq=97 Ack=452354 Win=814720 Len=0 TSval=30440377 TSecr=639477720
150   0.132005 54.230.30.73 -> 172.31.36.109 TCP 1514 [TCP segment of a reassembled PDU]
151   0.132009 172.31.36.109 -> 54.230.30.73 TCP 66 44833 > http [ACK] Seq=97 Ack=453802 Win=817536 Len=0 TSval=30440377 TSecr=639477720
152   0.132017 54.230.30.73 -> 172.31.36.109 TCP 5858 [TCP segment of a reassembled PDU]
153   0.132021 172.31.36.109 -> 54.230.30.73 TCP 66 44833 > http [ACK] Seq=97 Ack=459594 Win=829184 Len=0 TSval=30440377 TSecr=639477720
154   0.132111 54.230.30.73 -> 172.31.36.109 TCP 13098 [TCP segment of a reassembled PDU]
155   0.132119 172.31.36.109 -> 54.230.30.73 TCP 66 44833 > http [ACK] Seq=97 Ack=472626 Win=855168 Len=0 TSval=30440377 TSecr=639477720
156   0.132440 54.230.30.73 -> 172.31.36.109 TCP 1514 [TCP segment of a reassembled PDU]
157   0.132451 172.31.36.109 -> 54.230.30.73 TCP 66 44833 > http [ACK] Seq=97 Ack=474074 Win=858112 Len=0 TSval=30440377 TSecr=639477720
158   0.132858 54.230.30.73 -> 172.31.36.109 TCP 1514 [TCP segment of a reassembled PDU]
159   0.132862 172.31.36.109 -> 54.230.30.73 TCP 66 44833 > http [ACK] Seq=97 Ack=475522 Win=861056 Len=0 TSval=30440377 TSecr=639477720
160   0.133190 54.230.30.73 -> 172.31.36.109 TCP 2962 [TCP segment of a reassembled PDU]
161   0.133201 172.31.36.109 -> 54.230.30.73 TCP 66 44833 > http [ACK] Seq=97 Ack=478418 Win=866816 Len=0 TSval=30440377 TSecr=639477720
162   0.133273 54.230.30.73 -> 172.31.36.109 TCP 18890 [TCP segment of a reassembled PDU]
163   0.133283 172.31.36.109 -> 54.230.30.73 TCP 66 44833 > http [ACK] Seq=97 Ack=497242 Win=904448 Len=0 TSval=30440377 TSecr=639477720
164   0.133327 54.230.30.73 -> 172.31.36.109 TCP 10202 [TCP segment of a reassembled PDU]
165   0.133333 172.31.36.109 -> 54.230.30.73 TCP 66 44833 > http [ACK] Seq=97 Ack=507378 Win=924672 Len=0 TSval=30440377 TSecr=639477720
166   0.133431 54.230.30.73 -> 172.31.36.109 TCP 7306 [TCP segment of a reassembled PDU]
167   0.133437 172.31.36.109 -> 54.230.30.73 TCP 66 44833 > http [ACK] Seq=97 Ack=514618 Win=939264 Len=0 TSval=30440377 TSecr=639477720
168   0.133459 54.230.30.73 -> 172.31.36.109 TCP 7306 [TCP segment of a reassembled PDU]
169   0.133463 172.31.36.109 -> 54.230.30.73 TCP 66 44833 > http [ACK] Seq=97 Ack=521858 Win=950528 Len=0 TSval=30440377 TSecr=639477721
170   0.133487 54.230.30.73 -> 172.31.36.109 TCP 2266 [TCP segment of a reassembled PDU]
171   0.133491 172.31.36.109 -> 54.230.30.73 TCP 66 44833 > http [ACK] Seq=97 Ack=524058 Win=948352 Len=0 TSval=30440377 TSecr=639477721
172   0.165887 54.230.30.73 -> 172.31.36.109 TCP 1514 [TCP segment of a reassembled PDU]
173   0.165893 172.31.36.109 -> 54.230.30.73 TCP 66 44833 > http [ACK] Seq=97 Ack=525506 Win=956544 Len=0 TSval=30440386 TSecr=639477724
174   0.165962 54.230.30.73 -> 172.31.36.109 TCP 2962 [TCP segment of a reassembled PDU]
175   0.165967 172.31.36.109 -> 54.230.30.73 TCP 66 44833 > http [ACK] Seq=97 Ack=528402 Win=962432 Len=0 TSval=30440386 TSecr=639477724
176   0.166053 54.230.30.73 -> 172.31.36.109 TCP 11650 [TCP segment of a reassembled PDU]
177   0.166061 172.31.36.109 -> 54.230.30.73 TCP 66 44833 > http [ACK] Seq=97 Ack=539986 Win=972160 Len=0 TSval=30440386 TSecr=639477724
178   0.166204 54.230.30.73 -> 172.31.36.109 TCP 10202 [TCP segment of a reassembled PDU]
179   0.166211 172.31.36.109 -> 54.230.30.73 TCP 66 44833 > http [ACK] Seq=97 Ack=550122 Win=974464 Len=0 TSval=30440386 TSecr=639477724
180   0.166222 54.230.30.73 -> 172.31.36.109 TCP 7306 [TCP segment of a reassembled PDU]
181   0.166226 172.31.36.109 -> 54.230.30.73 TCP 66 44833 > http [ACK] Seq=97 Ack=557362 Win=967296 Len=0 TSval=30440386 TSecr=639477724
182   0.166354 54.230.30.73 -> 172.31.36.109 TCP 11650 [TCP segment of a reassembled PDU]
183   0.166362 172.31.36.109 -> 54.230.30.73 TCP 66 44833 > http [ACK] Seq=97 Ack=568946 Win=972160 Len=0 TSval=30440386 TSecr=639477724
184   0.166369 54.230.30.73 -> 172.31.36.109 TCP 1514 [TCP segment of a reassembled PDU]
185   0.166530 54.230.30.73 -> 172.31.36.109 TCP 2962 [TCP segment of a reassembled PDU]
186   0.166535 172.31.36.109 -> 54.230.30.73 TCP 66 44833 > http [ACK] Seq=97 Ack=573290 Win=986368 Len=0 TSval=30440386 TSecr=639477724
187   0.166697 54.230.30.73 -> 172.31.36.109 TCP 20338 [TCP segment of a reassembled PDU]
188   0.166725 54.230.30.73 -> 172.31.36.109 TCP 14546 [TCP segment of a reassembled PDU]
189   0.166736 54.230.30.73 -> 172.31.36.109 TCP 5858 [TCP segment of a reassembled PDU]
190   0.166753 172.31.36.109 -> 54.230.30.73 TCP 66 44833 > http [ACK] Seq=97 Ack=613834 Win=945920 Len=0 TSval=30440386 TSecr=639477724
191   0.167129 54.230.30.73 -> 172.31.36.109 TCP 7306 [TCP segment of a reassembled PDU]
192   0.167136 172.31.36.109 -> 54.230.30.73 TCP 66 44833 > http [ACK] Seq=97 Ack=621074 Win=979200 Len=0 TSval=30440386 TSecr=639477724
193   0.167392 54.230.30.73 -> 172.31.36.109 TCP 7306 [TCP segment of a reassembled PDU]
194   0.167402 54.230.30.73 -> 172.31.36.109 TCP 7306 [TCP segment of a reassembled PDU]
195   0.167600 54.230.30.73 -> 172.31.36.109 TCP 21786 [TCP segment of a reassembled PDU]
196   0.167802 54.230.30.73 -> 172.31.36.109 TCP 15994 [TCP segment of a reassembled PDU]
197   0.167930 54.230.30.73 -> 172.31.36.109 TCP 8754 [TCP segment of a reassembled PDU]
198   0.168062 54.230.30.73 -> 172.31.36.109 TCP 14546 [TCP segment of a reassembled PDU]
199   0.168102 54.230.30.73 -> 172.31.36.109 TCP 4410 [TCP segment of a reassembled PDU]
200   0.169950 172.31.36.109 -> 54.230.30.73 TCP 66 44833 > http [ACK] Seq=97 Ack=700714 Win=899584 Len=0 TSval=30440387 TSecr=639477724
201   0.171115 54.230.30.73 -> 172.31.36.109 TCP 2962 [TCP segment of a reassembled PDU]
202   0.171121 172.31.36.109 -> 54.230.30.73 TCP 66 44833 > http [ACK] Seq=97 Ack=703610 Win=986368 Len=0 TSval=30440387 TSecr=639477724
203   0.171214 54.230.30.73 -> 172.31.36.109 TCP 17122 [TCP segment of a reassembled PDU]
204   0.171238 172.31.36.109 -> 54.230.30.73 TCP 66 44833 > http [ACK] Seq=97 Ack=720666 Win=969344 Len=0 TSval=30440387 TSecr=639477724
205   0.178708 54.230.30.73 -> 172.31.36.109 TCP 1514 [TCP segment of a reassembled PDU]
206   0.178945 54.230.30.73 -> 172.31.36.109 TCP 4410 [TCP segment of a reassembled PDU]
207   0.178953 172.31.36.109 -> 54.230.30.73 TCP 66 44833 > http [ACK] Seq=97 Ack=726458 Win=983936 Len=0 TSval=30440389 TSecr=639477725
208   0.179111 54.230.30.73 -> 172.31.36.109 TCP 20338 [TCP segment of a reassembled PDU]
209   0.179152 54.230.30.73 -> 172.31.36.109 TCP 10202 [TCP segment of a reassembled PDU]
210   0.179167 172.31.36.109 -> 54.230.30.73 TCP 66 44833 > http [ACK] Seq=97 Ack=756866 Win=953600 Len=0 TSval=30440389 TSecr=639477725
211   0.179192 54.230.30.73 -> 172.31.36.109 TCP 2962 [TCP segment of a reassembled PDU]
212   0.179197 172.31.36.109 -> 54.230.30.73 TCP 66 44833 > http [ACK] Seq=97 Ack=759762 Win=986368 Len=0 TSval=30440389 TSecr=639477725
213   0.179340 54.230.30.73 -> 172.31.36.109 TCP 8754 [TCP segment of a reassembled PDU]
214   0.179355 54.230.30.73 -> 172.31.36.109 TCP 17818 [TCP segment of a reassembled PDU]
215   0.179376 172.31.36.109 -> 54.230.30.73 TCP 66 44833 > http [ACK] Seq=97 Ack=786202 Win=960128 Len=0 TSval=30440389 TSecr=639477725
216   0.181564 54.230.30.73 -> 172.31.36.109 TCP 1514 [TCP segment of a reassembled PDU]
217   0.181830 54.230.30.73 -> 172.31.36.109 TCP 2962 [TCP segment of a reassembled PDU]
218   0.181840 172.31.36.109 -> 54.230.30.73 TCP 66 44833 > http [ACK] Seq=97 Ack=790546 Win=986368 Len=0 TSval=30440389 TSecr=639477725
219   0.181996 54.230.30.73 -> 172.31.36.109 TCP 18890 [TCP segment of a reassembled PDU]
220   0.182018 172.31.36.109 -> 54.230.30.73 TCP 66 44833 > http [ACK] Seq=97 Ack=809370 Win=967552 Len=0 TSval=30440390 TSecr=639477725
221   0.182038 54.230.30.73 -> 172.31.36.109 TCP 2962 [TCP segment of a reassembled PDU]
222   0.182044 172.31.36.109 -> 54.230.30.73 TCP 66 44833 > http [ACK] Seq=97 Ack=812266 Win=986368 Len=0 TSval=30440390 TSecr=639477725
223   0.182351 54.230.30.73 -> 172.31.36.109 TCP 20338 [TCP segment of a reassembled PDU]
224   0.182382 54.230.30.73 -> 172.31.36.109 TCP 15994 [TCP segment of a reassembled PDU]
225   0.182399 172.31.36.109 -> 54.230.30.73 TCP 66 44833 > http [ACK] Seq=97 Ack=848466 Win=950272 Len=0 TSval=30440390 TSecr=639477725
226   0.182569 54.230.30.73 -> 172.31.36.109 TCP 9130 [TCP segment of a reassembled PDU]
227   0.182578 172.31.36.109 -> 54.230.30.73 TCP 66 44833 > http [ACK] Seq=97 Ack=857530 Win=974464 Len=0 TSval=30440390 TSecr=639477725
228   0.182597 54.230.30.73 -> 172.31.36.109 TCP 13098 [TCP segment of a reassembled PDU]
229   0.182641 54.230.30.73 -> 172.31.36.109 TCP 7306 [TCP segment of a reassembled PDU]
230   0.182803 172.31.36.109 -> 54.230.30.73 TCP 66 44833 > http [ACK] Seq=97 Ack=877802 Win=957824 Len=0 TSval=30440390 TSecr=639477725
231   0.183086 54.230.30.73 -> 172.31.36.109 TCP 10202 [TCP segment of a reassembled PDU]
232   0.183095 172.31.36.109 -> 54.230.30.73 TCP 66 44833 > http [ACK] Seq=97 Ack=887938 Win=974464 Len=0 TSval=30440390 TSecr=639477725
233   0.183193 54.230.30.73 -> 172.31.36.109 TCP 1514 [TCP segment of a reassembled PDU]
234   0.183350 54.230.30.73 -> 172.31.36.109 TCP 14546 [TCP segment of a reassembled PDU]
235   0.183373 172.31.36.109 -> 54.230.30.73 TCP 66 44833 > http [ACK] Seq=97 Ack=903866 Win=987264 Len=0 TSval=30440390 TSecr=639477725
236   0.183916 54.230.30.73 -> 172.31.36.109 TCP 10202 [TCP segment of a reassembled PDU]
237   0.183940 172.31.36.109 -> 54.230.30.73 TCP 66 44833 > http [ACK] Seq=97 Ack=914002 Win=987264 Len=0 TSval=30440390 TSecr=639477726
238   0.184042 54.230.30.73 -> 172.31.36.109 TCP 8754 [TCP segment of a reassembled PDU]
239   0.184058 172.31.36.109 -> 54.230.30.73 TCP 66 44833 > http [ACK] Seq=97 Ack=922690 Win=987264 Len=0 TSval=30440390 TSecr=639477726
240   0.184255 54.230.30.73 -> 172.31.36.109 TCP 13098 [TCP segment of a reassembled PDU]
241   0.184280 172.31.36.109 -> 54.230.30.73 TCP 66 44833 > http [ACK] Seq=97 Ack=935722 Win=987264 Len=0 TSval=30440390 TSecr=639477726
242   0.184441 54.230.30.73 -> 172.31.36.109 TCP 33370 [TCP segment of a reassembled PDU]
243   0.184476 172.31.36.109 -> 54.230.30.73 TCP 66 44833 > http [ACK] Seq=97 Ack=969026 Win=953984 Len=0 TSval=30440390 TSecr=639477726
244   0.184586 54.230.30.73 -> 172.31.36.109 TCP 10202 [TCP segment of a reassembled PDU]
245   0.184594 172.31.36.109 -> 54.230.30.73 TCP 66 44833 > http [ACK] Seq=97 Ack=979162 Win=974464 Len=0 TSval=30440390 TSecr=639477726
246   0.184819 54.230.30.73 -> 172.31.36.109 TCP 4410 [TCP segment of a reassembled PDU]
247   0.184825 172.31.36.109 -> 54.230.30.73 TCP 66 44833 > http [ACK] Seq=97 Ack=983506 Win=983936 Len=0 TSval=30440390 TSecr=639477726
248   0.184971 54.230.30.73 -> 172.31.36.109 TCP 14546 [TCP segment of a reassembled PDU]
249   0.184996 172.31.36.109 -> 54.230.30.73 TCP 66 44833 > http [ACK] Seq=97 Ack=997986 Win=987264 Len=0 TSval=30440390 TSecr=639477726
250   0.185107 54.230.30.73 -> 172.31.36.109 TCP 13098 [TCP segment of a reassembled PDU]
251   0.185122 172.31.36.109 -> 54.230.30.73 TCP 66 44833 > http [ACK] Seq=97 Ack=1011018 Win=987264 Len=0 TSval=30440390 TSecr=639477726
252   0.185179 54.230.30.73 -> 172.31.36.109 TCP 7306 [TCP segment of a reassembled PDU]
253   0.185191 172.31.36.109 -> 54.230.30.73 TCP 66 44833 > http [ACK] Seq=97 Ack=1018258 Win=987264 Len=0 TSval=30440390 TSecr=639477726
254   0.185285 54.230.30.73 -> 172.31.36.109 TCP 4410 [TCP segment of a reassembled PDU]
255   0.185296 172.31.36.109 -> 54.230.30.73 TCP 66 44833 > http [ACK] Seq=97 Ack=1022602 Win=987264 Len=0 TSval=30440390 TSecr=639477726
256   0.185415 54.230.30.73 -> 172.31.36.109 TCP 13098 [TCP segment of a reassembled PDU]
257   0.185444 172.31.36.109 -> 54.230.30.73 TCP 66 44833 > http [ACK] Seq=97 Ack=1035634 Win=987264 Len=0 TSval=30440390 TSecr=639477726
258   0.185516 54.230.30.73 -> 172.31.36.109 TCP 4410 [TCP segment of a reassembled PDU]
259   0.185528 172.31.36.109 -> 54.230.30.73 TCP 66 44833 > http [ACK] Seq=97 Ack=1039978 Win=987264 Len=0 TSval=30440390 TSecr=639477726
260   0.185678 54.230.30.73 -> 172.31.36.109 HTTP 9122 HTTP/1.1 200 OK  (application/octet-stream)
261   0.185694 172.31.36.109 -> 54.230.30.73 TCP 66 44833 > http [ACK] Seq=97 Ack=1049034 Win=987264 Len=0 TSval=30440390 TSecr=639477726
262   0.185839 172.31.36.109 -> 54.230.30.73 TCP 66 44833 > http [FIN, ACK] Seq=97 Ack=1049034 Win=987264 Len=0 TSval=30440390 TSecr=639477726
263   0.187271 54.230.30.73 -> 172.31.36.109 TCP 66 http > 44833 [FIN, ACK] Seq=1049034 Ack=98 Win=14592 Len=0 TSval=639477726 TSecr=30440390
264   0.187280 172.31.36.109 -> 54.230.30.73 TCP 66 44833 > http [ACK] Seq=98 Ack=1049035 Win=987264 Len=0 TSval=30440391 TSecr=639477726
