[Measurement for 100kb at 06:37:44 20.37.2014] 
Tshark:

  1   0.000000 172.31.29.138 -> 172.31.0.2   DNS 88 Standard query 0x68aa  A dm53kc3eax57k.cloudfront.net
  2   0.000023 172.31.29.138 -> 172.31.0.2   DNS 88 Standard query 0x4c4f  AAAA dm53kc3eax57k.cloudfront.net
  3   0.000563   172.31.0.2 -> 172.31.29.138 DNS 216 Standard query response 0x68aa  A 54.192.159.104 A 54.192.159.107 A 54.230.158.80 A 54.230.158.135 A 54.230.158.189 A 54.230.158.190 A 54.230.159.130 A 54.192.157.146
  4   0.000573   172.31.0.2 -> 172.31.29.138 DNS 175 Standard query response 0x4c4f 
  5   0.003873 172.31.29.138 -> 54.192.159.104 TCP 74 45083 > http [SYN] Seq=0 Win=26883 Len=0 MSS=8961 SACK_PERM=1 TSval=12334401 TSecr=0 WS=128
  6   0.004478 54.192.159.104 -> 172.31.29.138 TCP 74 http > 45083 [SYN, ACK] Seq=0 Ack=1 Win=14480 Len=0 MSS=1460 SACK_PERM=1 TSval=811186483 TSecr=12334401 WS=128
  7   0.004492 172.31.29.138 -> 54.192.159.104 TCP 66 45083 > http [ACK] Seq=1 Ack=1 Win=27008 Len=0 TSval=12334401 TSecr=811186483
  8   0.004531 172.31.29.138 -> 54.192.159.104 HTTP 163 GET /100kb HTTP/1.1 
  9   0.005234 54.192.159.104 -> 172.31.29.138 TCP 66 http > 45083 [ACK] Seq=1 Ack=98 Win=14592 Len=0 TSval=811186483 TSecr=12334401
 10   0.011004 54.192.159.104 -> 172.31.29.138 TCP 13098 [TCP segment of a reassembled PDU]
 11   0.011017 172.31.29.138 -> 54.192.159.104 TCP 66 45083 > http [ACK] Seq=98 Ack=13033 Win=52992 Len=0 TSval=12334403 TSecr=811186483
 12   0.011690 54.192.159.104 -> 172.31.29.138 TCP 10202 [TCP segment of a reassembled PDU]
 13   0.011712 172.31.29.138 -> 54.192.159.104 TCP 66 45083 > http [ACK] Seq=98 Ack=23169 Win=73344 Len=0 TSval=12334403 TSecr=811186483
 14   0.011719 54.192.159.104 -> 172.31.29.138 TCP 2962 [TCP segment of a reassembled PDU]
 15   0.011723 172.31.29.138 -> 54.192.159.104 TCP 66 45083 > http [ACK] Seq=98 Ack=26065 Win=79104 Len=0 TSval=12334403 TSecr=811186483
 16   0.012534 54.192.159.104 -> 172.31.29.138 TCP 13098 [TCP segment of a reassembled PDU]
 17   0.012547 172.31.29.138 -> 54.192.159.104 TCP 66 45083 > http [ACK] Seq=98 Ack=39097 Win=96512 Len=0 TSval=12334403 TSecr=811186483
 18   0.013242 54.192.159.104 -> 172.31.29.138 TCP 11650 [TCP segment of a reassembled PDU]
 19   0.013253 172.31.29.138 -> 54.192.159.104 TCP 66 45083 > http [ACK] Seq=98 Ack=50681 Win=98944 Len=0 TSval=12334404 TSecr=811186483
 20   0.013259 54.192.159.104 -> 172.31.29.138 TCP 1514 [TCP segment of a reassembled PDU]
 21   0.013262 172.31.29.138 -> 54.192.159.104 TCP 66 45083 > http [ACK] Seq=98 Ack=52129 Win=97536 Len=0 TSval=12334404 TSecr=811186483
 22   0.013291 54.192.159.104 -> 172.31.29.138 TCP 7306 [TCP segment of a reassembled PDU]
 23   0.013298 172.31.29.138 -> 54.192.159.104 TCP 66 45083 > http [ACK] Seq=98 Ack=59369 Win=119680 Len=0 TSval=12334404 TSecr=811186483
 24   0.013948 54.192.159.104 -> 172.31.29.138 TCP 5858 [TCP segment of a reassembled PDU]
 25   0.013955 172.31.29.138 -> 54.192.159.104 TCP 66 45083 > http [ACK] Seq=98 Ack=65161 Win=131200 Len=0 TSval=12334404 TSecr=811186483
 26   0.014038 54.192.159.104 -> 172.31.29.138 TCP 13098 [TCP segment of a reassembled PDU]
 27   0.014047 172.31.29.138 -> 54.192.159.104 TCP 66 45083 > http [ACK] Seq=98 Ack=78193 Win=157312 Len=0 TSval=12334404 TSecr=811186483
 28   0.014463 54.192.159.104 -> 172.31.29.138 TCP 8754 [TCP segment of a reassembled PDU]
 29   0.014471 172.31.29.138 -> 54.192.159.104 TCP 66 45083 > http [ACK] Seq=98 Ack=86881 Win=174592 Len=0 TSval=12334404 TSecr=811186484
 30   0.014501 54.192.159.104 -> 172.31.29.138 TCP 4410 [TCP segment of a reassembled PDU]
 31   0.014507 172.31.29.138 -> 54.192.159.104 TCP 66 45083 > http [ACK] Seq=98 Ack=91225 Win=183296 Len=0 TSval=12334404 TSecr=811186484
 32   0.014748 54.192.159.104 -> 172.31.29.138 HTTP 11698 HTTP/1.1 200 OK  (application/octet-stream)
 33   0.014756 172.31.29.138 -> 54.192.159.104 TCP 66 45083 > http [ACK] Seq=98 Ack=102857 Win=206592 Len=0 TSval=12334404 TSecr=811186484
 34   0.014882 172.31.29.138 -> 54.192.159.104 TCP 66 45083 > http [FIN, ACK] Seq=98 Ack=102857 Win=206592 Len=0 TSval=12334404 TSecr=811186484
 35   0.015453 54.192.159.104 -> 172.31.29.138 TCP 66 http > 45083 [FIN, ACK] Seq=102857 Ack=99 Win=14592 Len=0 TSval=811186484 TSecr=12334404
 36   0.015462 172.31.29.138 -> 54.192.159.104 TCP 66 45083 > http [ACK] Seq=99 Ack=102858 Win=206592 Len=0 TSval=12334404 TSecr=811186484
