[Measurement for 100kb at 14:37:45 20.37.2014] 
Tshark:

  1   0.000000 86.50.146.105 -> 172.31.29.138 TCP 78 53852 > ssh [ACK] Seq=1 Ack=1 Win=5322 Len=0 TSval=17972611 TSecr=19534061 SLE=1369 SRE=1925
  2   0.002037 86.50.146.105 -> 172.31.29.138 TCP 66 53852 > ssh [ACK] Seq=1 Ack=1925 Win=5322 Len=0 TSval=17972612 TSecr=19534153
  3   0.004866 86.50.146.105 -> 172.31.29.138 SSH 102 Encrypted request packet len=36
  4   0.004974 86.50.146.105 -> 172.31.29.138 SSH 102 Encrypted request packet len=36
  5   0.004993 172.31.29.138 -> 86.50.146.105 TCP 66 ssh > 53852 [ACK] Seq=1925 Ack=73 Win=317 Len=0 TSval=19534245 TSecr=17972612
  6   0.005082 172.31.29.138 -> 86.50.146.105 SSH 134 Encrypted response packet len=68
  7   0.373280 86.50.146.105 -> 172.31.29.138 SSH 102 Encrypted request packet len=36
  8   0.373433 172.31.29.138 -> 86.50.146.105 SSH 1434 Encrypted response packet len=1368
  9   0.373441 172.31.29.138 -> 86.50.146.105 SSH 606 Encrypted response packet len=540
 10   0.741413 86.50.146.105 -> 172.31.29.138 TCP 78 [TCP Dup ACK 7#1] 53852 > ssh [ACK] Seq=109 Ack=1993 Win=5322 Len=0 TSval=17972796 TSecr=19534245 SLE=3361 SRE=3901
 11   0.741608 86.50.146.105 -> 172.31.29.138 TCP 66 53852 > ssh [ACK] Seq=109 Ack=3901 Win=5322 Len=0 TSval=17972797 TSecr=19534338
 12   0.741870 86.50.146.105 -> 172.31.29.138 SSH 102 Encrypted request packet len=36
 13   0.741969 172.31.29.138 -> 86.50.146.105 SSH 134 Encrypted response packet len=68
 14   1.111521 86.50.146.105 -> 172.31.29.138 SSH 102 Encrypted request packet len=36
 15   1.111713 172.31.29.138 -> 86.50.146.105 SSH 1434 Encrypted response packet len=1368
 16   1.111733 172.31.29.138 -> 86.50.146.105 SSH 606 Encrypted response packet len=540
 17   1.483957 86.50.146.105 -> 172.31.29.138 TCP 78 [TCP Dup ACK 14#1] 53852 > ssh [ACK] Seq=181 Ack=3969 Win=5322 Len=0 TSval=17972982 TSecr=19534430 SLE=5337 SRE=5877
 18   1.483977 86.50.146.105 -> 172.31.29.138 TCP 66 53852 > ssh [ACK] Seq=181 Ack=5877 Win=5322 Len=0 TSval=17972982 TSecr=19534522
 19   1.485336 86.50.146.105 -> 172.31.29.138 SSH 102 Encrypted request packet len=36
 20   1.485447 172.31.29.138 -> 86.50.146.105 SSH 134 Encrypted response packet len=68
 21   1.529124 172.31.29.138 -> 172.31.0.2   DNS 88 Standard query 0x3c44  A dm53kc3eax57k.cloudfront.net
 22   1.529139 172.31.29.138 -> 172.31.0.2   DNS 88 Standard query 0xf464  AAAA dm53kc3eax57k.cloudfront.net
 23   1.529623   172.31.0.2 -> 172.31.29.138 DNS 216 Standard query response 0x3c44  A 54.230.151.234 A 54.230.150.14 A 54.230.150.23 A 54.230.150.25 A 54.230.150.36 A 54.230.150.147 A 54.230.151.44 A 54.230.151.150
 24   1.529633   172.31.0.2 -> 172.31.29.138 DNS 175 Standard query response 0xf464 
 25   1.532997 172.31.29.138 -> 54.230.151.234 TCP 74 55310 > http [SYN] Seq=0 Win=26883 Len=0 MSS=8961 SACK_PERM=1 TSval=19534627 TSecr=0 WS=128
 26   1.534468 54.230.151.234 -> 172.31.29.138 TCP 74 http > 55310 [SYN, ACK] Seq=0 Ack=1 Win=14480 Len=0 MSS=1460 SACK_PERM=1 TSval=441761148 TSecr=19534627 WS=128
 27   1.534481 172.31.29.138 -> 54.230.151.234 TCP 66 55310 > http [ACK] Seq=1 Ack=1 Win=27008 Len=0 TSval=19534628 TSecr=441761148
 28   1.534533 172.31.29.138 -> 54.230.151.234 HTTP 163 GET /100kb HTTP/1.1 
 29   1.535932 54.230.151.234 -> 172.31.29.138 TCP 66 http > 55310 [ACK] Seq=1 Ack=98 Win=14592 Len=0 TSval=441761148 TSecr=19534628
 30   1.541161 54.230.151.234 -> 172.31.29.138 TCP 13098 [TCP segment of a reassembled PDU]
 31   1.541172 172.31.29.138 -> 54.230.151.234 TCP 66 55310 > http [ACK] Seq=98 Ack=13033 Win=52992 Len=0 TSval=19534629 TSecr=441761149
 32   1.542709 54.230.151.234 -> 172.31.29.138 TCP 13098 [TCP segment of a reassembled PDU]
 33   1.542720 172.31.29.138 -> 54.230.151.234 TCP 66 55310 > http [ACK] Seq=98 Ack=26065 Win=79104 Len=0 TSval=19534630 TSecr=441761149
 34   1.544235 54.230.151.234 -> 172.31.29.138 TCP 13098 [TCP segment of a reassembled PDU]
 35   1.544245 172.31.29.138 -> 54.230.151.234 TCP 66 55310 > http [ACK] Seq=98 Ack=39097 Win=96512 Len=0 TSval=19534630 TSecr=441761149
 36   1.545749 54.230.151.234 -> 172.31.29.138 TCP 13098 [TCP segment of a reassembled PDU]
 37   1.545758 172.31.29.138 -> 54.230.151.234 TCP 66 55310 > http [ACK] Seq=98 Ack=52129 Win=96512 Len=0 TSval=19534631 TSecr=441761149
 38   1.547256 54.230.151.234 -> 172.31.29.138 TCP 17442 [TCP segment of a reassembled PDU]
 39   1.547267 172.31.29.138 -> 54.230.151.234 TCP 66 55310 > http [ACK] Seq=98 Ack=69505 Win=139904 Len=0 TSval=19534631 TSecr=441761149
 40   1.547275 54.230.151.234 -> 172.31.29.138 TCP 2962 [TCP segment of a reassembled PDU]
 41   1.547278 172.31.29.138 -> 54.230.151.234 TCP 66 55310 > http [ACK] Seq=98 Ack=72401 Win=145664 Len=0 TSval=19534631 TSecr=441761149
 42   1.548792 54.230.151.234 -> 172.31.29.138 TCP 14546 [TCP segment of a reassembled PDU]
 43   1.548801 172.31.29.138 -> 54.230.151.234 TCP 66 55310 > http [ACK] Seq=98 Ack=86881 Win=174592 Len=0 TSval=19534631 TSecr=441761149
 44   1.548810 54.230.151.234 -> 172.31.29.138 TCP 4410 [TCP segment of a reassembled PDU]
 45   1.548816 172.31.29.138 -> 54.230.151.234 TCP 66 55310 > http [ACK] Seq=98 Ack=91225 Win=183296 Len=0 TSval=19534631 TSecr=441761149
 46   1.550285 54.230.151.234 -> 172.31.29.138 TCP 8754 [TCP segment of a reassembled PDU]
 47   1.550293 172.31.29.138 -> 54.230.151.234 TCP 66 55310 > http [ACK] Seq=98 Ack=99913 Win=200704 Len=0 TSval=19534632 TSecr=441761150
 48   1.550315 54.230.151.234 -> 172.31.29.138 TCP 2962 [TCP segment of a reassembled PDU]
 49   1.550322 172.31.29.138 -> 54.230.151.234 TCP 66 55310 > http [ACK] Seq=98 Ack=102809 Win=206464 Len=0 TSval=19534632 TSecr=441761150
 50   1.550364 54.230.151.234 -> 172.31.29.138 HTTP 114 HTTP/1.1 200 OK  (application/octet-stream)
 51   1.550367 172.31.29.138 -> 54.230.151.234 TCP 66 55310 > http [ACK] Seq=98 Ack=102857 Win=206464 Len=0 TSval=19534632 TSecr=441761150
 52   1.550503 172.31.29.138 -> 54.230.151.234 TCP 66 55310 > http [FIN, ACK] Seq=98 Ack=102857 Win=206464 Len=0 TSval=19534632 TSecr=441761150
 53   1.552052 54.230.151.234 -> 172.31.29.138 TCP 66 http > 55310 [FIN, ACK] Seq=102857 Ack=99 Win=14592 Len=0 TSval=441761150 TSecr=19534632
 54   1.552061 172.31.29.138 -> 54.230.151.234 TCP 66 55310 > http [ACK] Seq=99 Ack=102858 Win=206464 Len=0 TSval=19534632 TSecr=441761150
 55   1.853424 86.50.146.105 -> 172.31.29.138 SSH 102 Encrypted request packet len=36
 56   1.853599 172.31.29.138 -> 86.50.146.105 SSH 1434 Encrypted response packet len=1368
 57   1.853608 172.31.29.138 -> 86.50.146.105 SSH 638 Encrypted response packet len=572
 58   2.221578 86.50.146.105 -> 172.31.29.138 TCP 78 [TCP Dup ACK 55#1] 53852 > ssh [ACK] Seq=253 Ack=5945 Win=5322 Len=0 TSval=17973167 TSecr=19534616 SLE=7313 SRE=7885
