[Measurement for 100kb at 11:37:45 20.37.2014] 
Tshark:

  1   0.000000 172.31.29.138 -> 172.31.0.2   DNS 88 Standard query 0x928c  A dm53kc3eax57k.cloudfront.net
  2   0.000035 172.31.29.138 -> 172.31.0.2   DNS 88 Standard query 0x1eff  AAAA dm53kc3eax57k.cloudfront.net
  3   0.000390   172.31.0.2 -> 172.31.29.138 DNS 216 Standard query response 0x928c  A 54.230.150.38 A 54.230.150.54 A 54.230.150.148 A 54.230.150.159 A 54.230.149.156 A 54.230.149.214 A 54.230.150.31 A 54.230.150.36
  4   0.000428   172.31.0.2 -> 172.31.29.138 DNS 175 Standard query response 0x1eff 
  5   0.003895 172.31.29.138 -> 54.230.150.38 TCP 74 53417 > http [SYN] Seq=0 Win=26883 Len=0 MSS=8961 SACK_PERM=1 TSval=16834539 TSecr=0 WS=128
  6   0.005431 54.230.150.38 -> 172.31.29.138 TCP 74 http > 53417 [SYN, ACK] Seq=0 Ack=1 Win=14480 Len=0 MSS=1460 SACK_PERM=1 TSval=1456380387 TSecr=16834539 WS=128
  7   0.005445 172.31.29.138 -> 54.230.150.38 TCP 66 53417 > http [ACK] Seq=1 Ack=1 Win=27008 Len=0 TSval=16834539 TSecr=1456380387
  8   0.005484 172.31.29.138 -> 54.230.150.38 HTTP 163 GET /100kb HTTP/1.1 
  9   0.006973 54.230.150.38 -> 172.31.29.138 TCP 66 http > 53417 [ACK] Seq=1 Ack=98 Win=14592 Len=0 TSval=1456380387 TSecr=16834539
 10   0.010723 54.230.150.38 -> 172.31.29.138 TCP 13098 [TCP segment of a reassembled PDU]
 11   0.010737 172.31.29.138 -> 54.230.150.38 TCP 66 53417 > http [ACK] Seq=98 Ack=13033 Win=52992 Len=0 TSval=16834541 TSecr=1456380387
 12   0.012430 54.230.150.38 -> 172.31.29.138 TCP 13098 [TCP segment of a reassembled PDU]
 13   0.012451 172.31.29.138 -> 54.230.150.38 TCP 66 53417 > http [ACK] Seq=98 Ack=26065 Win=79104 Len=0 TSval=16834541 TSecr=1456380387
 14   0.013883 54.230.150.38 -> 172.31.29.138 TCP 4410 [TCP segment of a reassembled PDU]
 15   0.013891 172.31.29.138 -> 54.230.150.38 TCP 66 53417 > http [ACK] Seq=98 Ack=30409 Win=87808 Len=0 TSval=16834541 TSecr=1456380388
 16   0.013933 54.230.150.38 -> 172.31.29.138 TCP 8754 [TCP segment of a reassembled PDU]
 17   0.013953 172.31.29.138 -> 54.230.150.38 TCP 66 53417 > http [ACK] Seq=98 Ack=39097 Win=103680 Len=0 TSval=16834541 TSecr=1456380388
 18   0.015417 54.230.150.38 -> 172.31.29.138 TCP 1514 [TCP segment of a reassembled PDU]
 19   0.015423 172.31.29.138 -> 54.230.150.38 TCP 66 53417 > http [ACK] Seq=98 Ack=40545 Win=108032 Len=0 TSval=16834542 TSecr=1456380388
 20   0.015520 54.230.150.38 -> 172.31.29.138 TCP 13098 [TCP segment of a reassembled PDU]
 21   0.015529 172.31.29.138 -> 54.230.150.38 TCP 66 53417 > http [ACK] Seq=98 Ack=53577 Win=134144 Len=0 TSval=16834542 TSecr=1456380388
 22   0.015540 54.230.150.38 -> 172.31.29.138 TCP 5858 [TCP segment of a reassembled PDU]
 23   0.015544 172.31.29.138 -> 54.230.150.38 TCP 66 53417 > http [ACK] Seq=98 Ack=59369 Win=145664 Len=0 TSval=16834542 TSecr=1456380388
 24   0.016984 54.230.150.38 -> 172.31.29.138 TCP 4410 [TCP segment of a reassembled PDU]
 25   0.016992 172.31.29.138 -> 54.230.150.38 TCP 66 53417 > http [ACK] Seq=98 Ack=63713 Win=154368 Len=0 TSval=16834542 TSecr=1456380388
 26   0.016998 54.230.150.38 -> 172.31.29.138 TCP 1514 [TCP segment of a reassembled PDU]
 27   0.017001 172.31.29.138 -> 54.230.150.38 TCP 66 53417 > http [ACK] Seq=98 Ack=65161 Win=157312 Len=0 TSval=16834542 TSecr=1456380388
 28   0.017156 54.230.150.38 -> 172.31.29.138 TCP 13098 [TCP segment of a reassembled PDU]
 29   0.017164 172.31.29.138 -> 54.230.150.38 TCP 66 53417 > http [ACK] Seq=98 Ack=78193 Win=176896 Len=0 TSval=16834542 TSecr=1456380388
 30   0.018469 54.230.150.38 -> 172.31.29.138 TCP 4410 [TCP segment of a reassembled PDU]
 31   0.018475 172.31.29.138 -> 54.230.150.38 TCP 66 53417 > http [ACK] Seq=98 Ack=82537 Win=191104 Len=0 TSval=16834543 TSecr=1456380388
 32   0.018553 54.230.150.38 -> 172.31.29.138 TCP 7306 [TCP segment of a reassembled PDU]
 33   0.018560 172.31.29.138 -> 54.230.150.38 TCP 66 53417 > http [ACK] Seq=98 Ack=89777 Win=206464 Len=0 TSval=16834543 TSecr=1456380388
 34   0.018656 54.230.150.38 -> 172.31.29.138 HTTP 13146 HTTP/1.1 200 OK  (application/octet-stream)
 35   0.018663 172.31.29.138 -> 54.230.150.38 TCP 66 53417 > http [ACK] Seq=98 Ack=102857 Win=232704 Len=0 TSval=16834543 TSecr=1456380388
 36   0.018787 172.31.29.138 -> 54.230.150.38 TCP 66 53417 > http [FIN, ACK] Seq=98 Ack=102857 Win=232704 Len=0 TSval=16834543 TSecr=1456380388
 37   0.020249 54.230.150.38 -> 172.31.29.138 TCP 66 http > 53417 [FIN, ACK] Seq=102857 Ack=99 Win=14592 Len=0 TSval=1456380388 TSecr=16834543
 38   0.020258 172.31.29.138 -> 54.230.150.38 TCP 66 53417 > http [ACK] Seq=99 Ack=102858 Win=232704 Len=0 TSval=16834543 TSecr=1456380388
