[Measurement for 100kb at 00:37:45 20.37.2014] 
Tshark:

  1   0.000000 172.31.29.138 -> 172.31.0.2   DNS 88 Standard query 0x054c  A dm53kc3eax57k.cloudfront.net
  2   0.000024 172.31.29.138 -> 172.31.0.2   DNS 88 Standard query 0x9e9d  AAAA dm53kc3eax57k.cloudfront.net
  3   0.000449   172.31.0.2 -> 172.31.29.138 DNS 216 Standard query response 0x054c  A 54.230.158.246 A 54.230.159.4 A 54.230.159.132 A 54.192.157.157 A 54.192.159.173 A 54.192.159.180 A 54.230.156.40 A 54.230.158.241
  4   0.000459   172.31.0.2 -> 172.31.29.138 DNS 175 Standard query response 0x9e9d 
  5   0.003927 172.31.29.138 -> 54.230.158.246 TCP 74 45839 > http [SYN] Seq=0 Win=26883 Len=0 MSS=8961 SACK_PERM=1 TSval=6934442 TSecr=0 WS=128
  6   0.004604 54.230.158.246 -> 172.31.29.138 TCP 74 http > 45839 [SYN, ACK] Seq=0 Ack=1 Win=14480 Len=0 MSS=1460 SACK_PERM=1 TSval=729024482 TSecr=6934442 WS=128
  7   0.004619 172.31.29.138 -> 54.230.158.246 TCP 66 45839 > http [ACK] Seq=1 Ack=1 Win=27008 Len=0 TSval=6934442 TSecr=729024482
  8   0.004662 172.31.29.138 -> 54.230.158.246 HTTP 163 GET /100kb HTTP/1.1 
  9   0.005417 54.230.158.246 -> 172.31.29.138 TCP 66 http > 45839 [ACK] Seq=1 Ack=98 Win=14592 Len=0 TSval=729024482 TSecr=6934442
 10   0.008501 54.230.158.246 -> 172.31.29.138 TCP 13098 [TCP segment of a reassembled PDU]
 11   0.008513 172.31.29.138 -> 54.230.158.246 TCP 66 45839 > http [ACK] Seq=98 Ack=13033 Win=52992 Len=0 TSval=6934443 TSecr=729024483
 12   0.009192 54.230.158.246 -> 172.31.29.138 TCP 5858 [TCP segment of a reassembled PDU]
 13   0.009199 172.31.29.138 -> 54.230.158.246 TCP 66 45839 > http [ACK] Seq=98 Ack=18825 Win=64640 Len=0 TSval=6934443 TSecr=729024483
 14   0.009210 54.230.158.246 -> 172.31.29.138 TCP 5858 [TCP segment of a reassembled PDU]
 15   0.009215 172.31.29.138 -> 54.230.158.246 TCP 66 45839 > http [ACK] Seq=98 Ack=24617 Win=76160 Len=0 TSval=6934443 TSecr=729024483
 16   0.009217 54.230.158.246 -> 172.31.29.138 TCP 1514 [TCP segment of a reassembled PDU]
 17   0.009219 172.31.29.138 -> 54.230.158.246 TCP 66 45839 > http [ACK] Seq=98 Ack=26065 Win=79104 Len=0 TSval=6934443 TSecr=729024483
 18   0.009682 54.230.158.246 -> 172.31.29.138 TCP 2962 [TCP segment of a reassembled PDU]
 19   0.009696 172.31.29.138 -> 54.230.158.246 TCP 66 45839 > http [ACK] Seq=98 Ack=28961 Win=84864 Len=0 TSval=6934443 TSecr=729024483
 20   0.009757 54.230.158.246 -> 172.31.29.138 TCP 10202 [TCP segment of a reassembled PDU]
 21   0.009764 172.31.29.138 -> 54.230.158.246 TCP 66 45839 > http [ACK] Seq=98 Ack=39097 Win=101248 Len=0 TSval=6934443 TSecr=729024483
 22   0.009926 54.230.158.246 -> 172.31.29.138 TCP 7306 [TCP segment of a reassembled PDU]
 23   0.009932 172.31.29.138 -> 54.230.158.246 TCP 66 45839 > http [ACK] Seq=98 Ack=46337 Win=105984 Len=0 TSval=6934443 TSecr=729024483
 24   0.010449 54.230.158.246 -> 172.31.29.138 TCP 4410 [TCP segment of a reassembled PDU]
 25   0.010454 172.31.29.138 -> 54.230.158.246 TCP 66 45839 > http [ACK] Seq=98 Ack=50681 Win=109056 Len=0 TSval=6934443 TSecr=729024483
 26   0.010460 54.230.158.246 -> 172.31.29.138 TCP 1514 [TCP segment of a reassembled PDU]
 27   0.010462 172.31.29.138 -> 54.230.158.246 TCP 66 45839 > http [ACK] Seq=98 Ack=52129 Win=108416 Len=0 TSval=6934443 TSecr=729024483
 28   0.010542 54.230.158.246 -> 172.31.29.138 TCP 13098 [TCP segment of a reassembled PDU]
 29   0.010550 172.31.29.138 -> 54.230.158.246 TCP 66 45839 > http [ACK] Seq=98 Ack=65161 Win=96512 Len=0 TSval=6934443 TSecr=729024483
 30   0.011236 54.230.158.246 -> 172.31.29.138 TCP 7306 [TCP segment of a reassembled PDU]
 31   0.011243 172.31.29.138 -> 54.230.158.246 TCP 66 45839 > http [ACK] Seq=98 Ack=72401 Win=105984 Len=0 TSval=6934444 TSecr=729024483
 32   0.011336 54.230.158.246 -> 172.31.29.138 TCP 21786 [TCP segment of a reassembled PDU]
 33   0.011360 172.31.29.138 -> 54.230.158.246 TCP 66 45839 > http [ACK] Seq=98 Ack=94121 Win=152448 Len=0 TSval=6934444 TSecr=729024483
 34   0.011996 54.230.158.246 -> 172.31.29.138 TCP 7306 [TCP segment of a reassembled PDU]
 35   0.012003 172.31.29.138 -> 54.230.158.246 TCP 66 45839 > http [ACK] Seq=98 Ack=101361 Win=167040 Len=0 TSval=6934444 TSecr=729024483
 36   0.012026 54.230.158.246 -> 172.31.29.138 HTTP 1562 HTTP/1.1 200 OK  (application/octet-stream)
 37   0.012030 172.31.29.138 -> 54.230.158.246 TCP 66 45839 > http [ACK] Seq=98 Ack=102857 Win=169984 Len=0 TSval=6934444 TSecr=729024483
 38   0.012140 172.31.29.138 -> 54.230.158.246 TCP 66 45839 > http [FIN, ACK] Seq=98 Ack=102857 Win=169984 Len=0 TSval=6934444 TSecr=729024483
 39   0.012708 54.230.158.246 -> 172.31.29.138 TCP 66 http > 45839 [FIN, ACK] Seq=102857 Ack=99 Win=14592 Len=0 TSval=729024483 TSecr=6934444
 40   0.012727 172.31.29.138 -> 54.230.158.246 TCP 66 45839 > http [ACK] Seq=99 Ack=102858 Win=169984 Len=0 TSval=6934444 TSecr=729024483
