[Measurement for 1kb at 23:03:57 16.03.2014] 
Tshark:

  1   0.000000  192.168.1.2 -> 54.230.98.202 TCP 66 49495→80 [SYN] Seq=0 Win=8192 Len=0 MSS=1460 WS=256 SACK_PERM=1
  2   0.063559 54.230.98.202 -> 192.168.1.2  TCP 66 80→49495 [SYN, ACK] Seq=0 Ack=1 Win=14600 Len=0 MSS=1400 SACK_PERM=1 WS=128
  3   0.063696  192.168.1.2 -> 54.230.98.202 TCP 54 49495→80 [ACK] Seq=1 Ack=1 Win=65792 Len=0
  4   0.063856  192.168.1.2 -> 54.230.98.202 HTTP 150 GET /1kb HTTP/1.1 
  5   0.096572 54.230.98.202 -> 192.168.1.2  TCP 54 80→49495 [ACK] Seq=1 Ack=97 Win=14720 Len=0
  6   0.111519 54.230.98.202 -> 192.168.1.2  TCP 1454 [TCP segment of a reassembled PDU]
  7   0.112154 54.230.98.202 -> 192.168.1.2  HTTP 132 HTTP/1.1 200 OK  (application/octet-stream)
  8   0.112237  192.168.1.2 -> 54.230.98.202 TCP 54 49495→80 [ACK] Seq=97 Ack=1479 Win=65792 Len=0
  9   0.112329  192.168.1.2 -> 54.230.98.202 TCP 54 49495→80 [FIN, ACK] Seq=97 Ack=1479 Win=65792 Len=0
 10   0.140564 54.230.98.202 -> 192.168.1.2  TCP 54 80→49495 [FIN, ACK] Seq=1479 Ack=98 Win=14720 Len=0
 11   0.140682  192.168.1.2 -> 54.230.98.202 TCP 54 49495→80 [ACK] Seq=98 Ack=1480 Win=65792 Len=0
