[Measurement for 1kb at 17:03:57 16.03.2014] 
Tshark:

  1   0.000000  192.168.1.2 -> 54.230.98.58 TCP 66 63376→80 [SYN] Seq=0 Win=8192 Len=0 MSS=1460 WS=256 SACK_PERM=1
  2   0.043784 64.233.164.189 -> 192.168.1.2  TLSv1.2 105 Application Data
  3   0.054637 54.230.98.58 -> 192.168.1.2  TCP 66 80→63376 [SYN, ACK] Seq=0 Ack=1 Win=14600 Len=0 MSS=1400 SACK_PERM=1 WS=128
  4   0.054815  192.168.1.2 -> 54.230.98.58 TCP 54 63376→80 [ACK] Seq=1 Ack=1 Win=65792 Len=0
  5   0.055023  192.168.1.2 -> 54.230.98.58 HTTP 150 GET /1kb HTTP/1.1 
  6   0.081831 54.230.98.58 -> 192.168.1.2  TCP 54 80→63376 [ACK] Seq=1 Ack=97 Win=14720 Len=0
  7   0.084419  192.168.1.2 -> 64.233.164.189 TCP 54 63070→443 [ACK] Seq=1 Ack=52 Win=256 Len=0
  8   0.086864 54.230.98.58 -> 192.168.1.2  TCP 1454 [TCP segment of a reassembled PDU]
  9   0.087450 54.230.98.58 -> 192.168.1.2  HTTP 132 HTTP/1.1 200 OK  (application/octet-stream)
 10   0.087526  192.168.1.2 -> 54.230.98.58 TCP 54 63376→80 [ACK] Seq=97 Ack=1479 Win=65792 Len=0
 11   0.087689  192.168.1.2 -> 54.230.98.58 TCP 54 63376→80 [FIN, ACK] Seq=97 Ack=1479 Win=65792 Len=0
 12   0.115972 54.230.98.58 -> 192.168.1.2  TCP 54 80→63376 [FIN, ACK] Seq=1479 Ack=98 Win=14720 Len=0
 13   0.116105  192.168.1.2 -> 54.230.98.58 TCP 54 63376→80 [ACK] Seq=98 Ack=1480 Win=65792 Len=0
