[Measurement for 1kb at 10:03:49 17.03.2014] 
Tshark:

  1   0.000000 fe80::5ef9:6aff:fe25:83d4 -> fe80::446a:b521:8794:ef65 ICMPv6 86 Neighbor Solicitation for fe80::446a:b521:8794:ef65 from 5c:f9:6a:25:83:d4
  2   0.000262 fe80::446a:b521:8794:ef65 -> fe80::5ef9:6aff:fe25:83d4 ICMPv6 86 Neighbor Advertisement fe80::446a:b521:8794:ef65 (sol, ovr) is at 00:24:d7:3f:fc:98
  3   0.099576 HuaweiTe_25:83:d4 -> IntelCor_3f:fc:98 ARP 42 Who has 192.168.1.2?  Tell 192.168.1.1
  4   0.099601 IntelCor_3f:fc:98 -> HuaweiTe_25:83:d4 ARP 42 192.168.1.2 is at 00:24:d7:3f:fc:98
  5   0.369221  192.168.1.2 -> 54.230.99.246 TCP 66 52038→80 [SYN] Seq=0 Win=8192 Len=0 MSS=1460 WS=256 SACK_PERM=1
  6   0.418092 54.230.99.246 -> 192.168.1.2  TCP 66 80→52038 [SYN, ACK] Seq=0 Ack=1 Win=14600 Len=0 MSS=1400 SACK_PERM=1 WS=128
  7   0.418240  192.168.1.2 -> 54.230.99.246 TCP 54 52038→80 [ACK] Seq=1 Ack=1 Win=65792 Len=0
  8   0.418374  192.168.1.2 -> 54.230.99.246 HTTP 150 GET /1kb HTTP/1.1 
  9   0.450610 54.230.99.246 -> 192.168.1.2  TCP 54 80→52038 [ACK] Seq=1 Ack=97 Win=14720 Len=0
 10   0.458474 54.230.99.246 -> 192.168.1.2  TCP 1454 [TCP segment of a reassembled PDU]
 11   0.459018 54.230.99.246 -> 192.168.1.2  HTTP 132 HTTP/1.1 200 OK  (application/octet-stream)
 12   0.459100  192.168.1.2 -> 54.230.99.246 TCP 54 52038→80 [ACK] Seq=97 Ack=1479 Win=65792 Len=0
 13   0.459193  192.168.1.2 -> 54.230.99.246 TCP 54 52038→80 [FIN, ACK] Seq=97 Ack=1479 Win=65792 Len=0
 14   0.486192 54.230.99.246 -> 192.168.1.2  TCP 54 80→52038 [FIN, ACK] Seq=1479 Ack=98 Win=14720 Len=0
 15   0.486336  192.168.1.2 -> 54.230.99.246 TCP 54 52038→80 [ACK] Seq=98 Ack=1480 Win=65792 Len=0
 16   1.070520  192.168.1.2 -> 23.21.88.158 TCP 54 52026→443 [FIN, ACK] Seq=1 Ack=1 Win=256 Len=0
