[Measurement for 1kb at 20:00:49 16.00.2014] 
Tshark:

  1   0.000000  192.168.1.2 -> 74.125.232.196 TCP 1454 [TCP segment of a reassembled PDU]
  2   0.000032  192.168.1.2 -> 74.125.232.196 TCP 1454 [TCP segment of a reassembled PDU]
  3   0.000053  192.168.1.2 -> 74.125.232.196 TLSv1.2 517 Application Data
  4   0.000604  192.168.1.2 -> 74.125.232.196 TLSv1.2 87 Application Data
  5   0.001015  192.168.1.2 -> 74.125.232.196 TCP 1454 [TCP segment of a reassembled PDU]
  6   0.001042  192.168.1.2 -> 74.125.232.196 TLSv1.2 389 Application Data
  7   0.049783 74.125.232.196 -> 192.168.1.2  TCP 54 443→64294 [ACK] Seq=1 Ack=1401 Win=1373 Len=0
  8   0.054183 74.125.232.196 -> 192.168.1.2  TCP 54 443→64294 [ACK] Seq=1 Ack=2801 Win=1373 Len=0
  9   0.056476 74.125.232.196 -> 192.168.1.2  TCP 54 443→64294 [ACK] Seq=1 Ack=3264 Win=1373 Len=0
 10   0.057431 74.125.232.196 -> 192.168.1.2  TCP 54 443→64294 [ACK] Seq=1 Ack=3297 Win=1373 Len=0
 11   0.058707 74.125.232.196 -> 192.168.1.2  TLSv1.2 87 Application Data
 12   0.065827 74.125.232.196 -> 192.168.1.2  TCP 54 443→64294 [ACK] Seq=34 Ack=5032 Win=1373 Len=0
 13   0.088369 74.125.232.196 -> 192.168.1.2  TLSv1.2 104 Application Data
 14   0.088427  192.168.1.2 -> 74.125.232.196 TCP 54 64294→443 [ACK] Seq=5032 Ack=84 Win=253 Len=0
 15   0.090441 74.125.232.196 -> 192.168.1.2  TLSv1.2 132 Application Data
 16   0.091145 74.125.232.196 -> 192.168.1.2  TLSv1.2 93 Application Data
 17   0.091215  192.168.1.2 -> 74.125.232.196 TCP 54 64294→443 [ACK] Seq=5032 Ack=201 Win=253 Len=0
 18   0.091402 74.125.232.196 -> 192.168.1.2  TLSv1.2 87 Application Data
 19   0.092816  192.168.1.2 -> 74.125.232.196 TLSv1.2 87 Application Data
 20   0.160181 74.125.232.196 -> 192.168.1.2  TCP 54 443→64294 [ACK] Seq=234 Ack=5065 Win=1373 Len=0
 21   0.728964  192.168.1.2 -> 54.230.99.58 TCP 66 64567→80 [SYN] Seq=0 Win=8192 Len=0 MSS=1460 WS=256 SACK_PERM=1
 22   0.783535 54.230.99.58 -> 192.168.1.2  TCP 66 80→64567 [SYN, ACK] Seq=0 Ack=1 Win=14600 Len=0 MSS=1400 SACK_PERM=1 WS=128
 23   0.783722  192.168.1.2 -> 54.230.99.58 TCP 54 64567→80 [ACK] Seq=1 Ack=1 Win=65792 Len=0
 24   0.784093  192.168.1.2 -> 54.230.99.58 HTTP 150 GET /1kb HTTP/1.1 
 25   0.819328 54.230.99.58 -> 192.168.1.2  TCP 54 80→64567 [ACK] Seq=1 Ack=97 Win=14720 Len=0
 26   0.824489 54.230.99.58 -> 192.168.1.2  TCP 1454 [TCP segment of a reassembled PDU]
 27   0.825117 54.230.99.58 -> 192.168.1.2  HTTP 132 HTTP/1.1 200 OK  (application/octet-stream)
 28   0.825201  192.168.1.2 -> 54.230.99.58 TCP 54 64567→80 [ACK] Seq=97 Ack=1479 Win=65792 Len=0
 29   0.825491  192.168.1.2 -> 54.230.99.58 TCP 54 64567→80 [FIN, ACK] Seq=97 Ack=1479 Win=65792 Len=0
 30   0.863701 54.230.99.58 -> 192.168.1.2  TCP 54 80→64567 [FIN, ACK] Seq=1479 Ack=98 Win=14720 Len=0
 31   0.863858  192.168.1.2 -> 54.230.99.58 TCP 54 64567→80 [ACK] Seq=98 Ack=1480 Win=65792 Len=0
 32   1.487731 HuaweiTe_25:83:d4 -> IntelCor_3f:fc:98 ARP 42 Who has 192.168.1.2?  Tell 192.168.1.1
 33   1.487774 IntelCor_3f:fc:98 -> HuaweiTe_25:83:d4 ARP 42 192.168.1.2 is at 00:24:d7:3f:fc:98
