[Measurement for 10kb at 16:00:18 16.00.2014] 
Tshark:

  1   0.000000  192.168.1.2 -> 54.230.98.183 TCP 66 62908→80 [SYN] Seq=0 Win=8192 Len=0 MSS=1460 WS=256 SACK_PERM=1
  2   0.058456 54.230.98.183 -> 192.168.1.2  TCP 66 80→62908 [SYN, ACK] Seq=0 Ack=1 Win=14600 Len=0 MSS=1400 SACK_PERM=1 WS=128
  3   0.058622  192.168.1.2 -> 54.230.98.183 TCP 54 62908→80 [ACK] Seq=1 Ack=1 Win=65792 Len=0
  4   0.058819  192.168.1.2 -> 54.230.98.183 HTTP 151 GET /10kb HTTP/1.1 
  5   0.097040 54.230.98.183 -> 192.168.1.2  TCP 54 80→62908 [ACK] Seq=1 Ack=98 Win=14720 Len=0
  6   0.102253 54.230.98.183 -> 192.168.1.2  TCP 1454 [TCP segment of a reassembled PDU]
  7   0.103997 54.230.98.183 -> 192.168.1.2  TCP 1454 [TCP segment of a reassembled PDU]
  8   0.104131  192.168.1.2 -> 54.230.98.183 TCP 54 62908→80 [ACK] Seq=98 Ack=2801 Win=65792 Len=0
  9   0.104339 54.230.98.183 -> 192.168.1.2  TCP 1454 [TCP segment of a reassembled PDU]
 10   0.104449 54.230.98.183 -> 192.168.1.2  TCP 1454 [TCP segment of a reassembled PDU]
 11   0.104512  192.168.1.2 -> 54.230.98.183 TCP 54 62908→80 [ACK] Seq=98 Ack=5601 Win=65792 Len=0
 12   0.104651 54.230.98.183 -> 192.168.1.2  TCP 1454 [TCP segment of a reassembled PDU]
 13   0.104758 54.230.98.183 -> 192.168.1.2  TCP 1454 [TCP segment of a reassembled PDU]
 14   0.104822  192.168.1.2 -> 54.230.98.183 TCP 54 62908→80 [ACK] Seq=98 Ack=8401 Win=65792 Len=0
 15   0.104965 54.230.98.183 -> 192.168.1.2  TCP 1454 [TCP segment of a reassembled PDU]
 16   0.105033 54.230.98.183 -> 192.168.1.2  HTTP 948 HTTP/1.1 200 OK  (application/octet-stream)
 17   0.105072  192.168.1.2 -> 54.230.98.183 TCP 54 62908→80 [ACK] Seq=98 Ack=10695 Win=65792 Len=0
 18   0.105199  192.168.1.2 -> 54.230.98.183 TCP 54 62908→80 [FIN, ACK] Seq=98 Ack=10695 Win=65792 Len=0
 19   0.133261 54.230.98.183 -> 192.168.1.2  TCP 54 80→62908 [FIN, ACK] Seq=10695 Ack=99 Win=14720 Len=0
 20   0.133393  192.168.1.2 -> 54.230.98.183 TCP 54 62908→80 [ACK] Seq=99 Ack=10696 Win=65792 Len=0
 21   0.297048 23.21.88.158 -> 192.168.1.2  TLSv1.2 85 Encrypted Alert
 22   0.305978 23.21.88.158 -> 192.168.1.2  TCP 54 443→62898 [FIN, ACK] Seq=32 Ack=1 Win=92 Len=0
 23   0.306034  192.168.1.2 -> 23.21.88.158 TCP 54 62898→443 [ACK] Seq=1 Ack=33 Win=256 Len=0
 24   0.307208 23.21.88.158 -> 192.168.1.2  TLSv1.2 85 Encrypted Alert
 25   0.307239 23.21.88.158 -> 192.168.1.2  TCP 54 443→62895 [FIN, ACK] Seq=32 Ack=1 Win=81 Len=0
 26   0.307267  192.168.1.2 -> 23.21.88.158 TCP 54 62895→443 [ACK] Seq=1 Ack=33 Win=256 Len=0
 27   0.307358 23.21.88.158 -> 192.168.1.2  TLSv1.2 85 Encrypted Alert
 28   0.307380 23.21.88.158 -> 192.168.1.2  TCP 54 443→62900 [FIN, ACK] Seq=32 Ack=1 Win=92 Len=0
 29   0.307401  192.168.1.2 -> 23.21.88.158 TCP 54 62900→443 [ACK] Seq=1 Ack=33 Win=256 Len=0
 30   0.307481 23.21.88.158 -> 192.168.1.2  TLSv1.2 85 Encrypted Alert
 31   0.307502 23.21.88.158 -> 192.168.1.2  TCP 54 443→62897 [FIN, ACK] Seq=32 Ack=1 Win=86 Len=0
 32   0.307522  192.168.1.2 -> 23.21.88.158 TCP 54 62897→443 [ACK] Seq=1 Ack=33 Win=253 Len=0
 33   0.307602 23.21.88.158 -> 192.168.1.2  TLSv1.2 85 Encrypted Alert
 34   0.307623 23.21.88.158 -> 192.168.1.2  TCP 54 443→62896 [FIN, ACK] Seq=32 Ack=1 Win=79 Len=0
 35   0.307643  192.168.1.2 -> 23.21.88.158 TCP 54 62896→443 [ACK] Seq=1 Ack=33 Win=255 Len=0
 36   0.307721 23.21.88.158 -> 192.168.1.2  TLSv1.2 85 Encrypted Alert
 37   0.307743 23.21.88.158 -> 192.168.1.2  TCP 54 443→62899 [FIN, ACK] Seq=32 Ack=1 Win=107 Len=0
 38   0.307765  192.168.1.2 -> 23.21.88.158 TCP 54 62899→443 [ACK] Seq=1 Ack=33 Win=253 Len=0
 39   1.434702  192.168.1.1 -> 239.255.255.250 SSDP 451 NOTIFY * HTTP/1.1 
