[Measurement for 100kb at 10:37:16 20.37.2014] 
Tshark:

  1   0.000000 172.31.29.138 -> 172.31.0.2   DNS 89 Standard query 0xcbb6  A d1xzxs93r3iphc.cloudfront.net
  2   0.000026 172.31.29.138 -> 172.31.0.2   DNS 89 Standard query 0x9f58  AAAA d1xzxs93r3iphc.cloudfront.net
  3   0.000578   172.31.0.2 -> 172.31.29.138 DNS 170 Standard query response 0x9f58 
  4   0.000589   172.31.0.2 -> 172.31.29.138 DNS 217 Standard query response 0xcbb6  A 54.230.158.242 A 54.230.159.4 A 54.192.157.156 A 54.192.159.77 A 54.192.159.107 A 54.230.158.141 A 54.230.158.205 A 54.230.158.214
  5   0.003858 172.31.29.138 -> 54.230.158.242 TCP 74 52940 > http [SYN] Seq=0 Win=26883 Len=0 MSS=8961 SACK_PERM=1 TSval=15927259 TSecr=0 WS=128
  6   0.004555 54.230.158.242 -> 172.31.29.138 TCP 74 http > 52940 [SYN, ACK] Seq=0 Ack=1 Win=14480 Len=0 MSS=1460 SACK_PERM=1 TSval=835500431 TSecr=15927259 WS=128
  7   0.004570 172.31.29.138 -> 54.230.158.242 TCP 66 52940 > http [ACK] Seq=1 Ack=1 Win=27008 Len=0 TSval=15927259 TSecr=835500431
  8   0.004612 172.31.29.138 -> 54.230.158.242 HTTP 164 GET /100kb HTTP/1.1 
  9   0.005188 54.230.158.242 -> 172.31.29.138 TCP 66 http > 52940 [ACK] Seq=1 Ack=99 Win=14592 Len=0 TSval=835500431 TSecr=15927259
 10   0.009851 54.230.158.242 -> 172.31.29.138 TCP 2580 [TCP segment of a reassembled PDU]
 11   0.009862 172.31.29.138 -> 54.230.158.242 TCP 66 52940 > http [ACK] Seq=99 Ack=2515 Win=32000 Len=0 TSval=15927260 TSecr=835500432
 12   0.009902 54.230.158.242 -> 172.31.29.138 TCP 11650 [TCP segment of a reassembled PDU]
 13   0.009911 172.31.29.138 -> 54.230.158.242 TCP 66 52940 > http [ACK] Seq=99 Ack=14099 Win=55168 Len=0 TSval=15927260 TSecr=835500432
 14   0.010416 54.230.158.242 -> 172.31.29.138 TCP 8754 [TCP segment of a reassembled PDU]
 15   0.010424 172.31.29.138 -> 54.230.158.242 TCP 66 52940 > http [ACK] Seq=99 Ack=22787 Win=72576 Len=0 TSval=15927261 TSecr=835500432
 16   0.010442 54.230.158.242 -> 172.31.29.138 TCP 4410 [TCP segment of a reassembled PDU]
 17   0.010446 172.31.29.138 -> 54.230.158.242 TCP 66 52940 > http [ACK] Seq=99 Ack=27131 Win=81152 Len=0 TSval=15927261 TSecr=835500432
 18   0.011119 54.230.158.242 -> 172.31.29.138 TCP 5858 [TCP segment of a reassembled PDU]
 19   0.011144 172.31.29.138 -> 54.230.158.242 TCP 66 52940 > http [ACK] Seq=99 Ack=32923 Win=92800 Len=0 TSval=15927261 TSecr=835500432
 20   0.011206 54.230.158.242 -> 172.31.29.138 TCP 14546 [TCP segment of a reassembled PDU]
 21   0.011216 172.31.29.138 -> 54.230.158.242 TCP 66 52940 > http [ACK] Seq=99 Ack=47403 Win=94080 Len=0 TSval=15927261 TSecr=835500432
 22   0.011646 54.230.158.242 -> 172.31.29.138 TCP 5858 [TCP segment of a reassembled PDU]
 23   0.011653 172.31.29.138 -> 54.230.158.242 TCP 66 52940 > http [ACK] Seq=99 Ack=53195 Win=108416 Len=0 TSval=15927261 TSecr=835500432
 24   0.011908 54.230.158.242 -> 172.31.29.138 TCP 8754 [TCP segment of a reassembled PDU]
 25   0.011916 172.31.29.138 -> 54.230.158.242 TCP 66 52940 > http [ACK] Seq=99 Ack=61883 Win=103680 Len=0 TSval=15927261 TSecr=835500432
 26   0.011957 54.230.158.242 -> 172.31.29.138 TCP 8754 [TCP segment of a reassembled PDU]
 27   0.011965 172.31.29.138 -> 54.230.158.242 TCP 66 52940 > http [ACK] Seq=99 Ack=70571 Win=103680 Len=0 TSval=15927261 TSecr=835500432
 28   0.012447 54.230.158.242 -> 172.31.29.138 TCP 7306 [TCP segment of a reassembled PDU]
 29   0.012454 172.31.29.138 -> 54.230.158.242 TCP 66 52940 > http [ACK] Seq=99 Ack=77811 Win=105984 Len=0 TSval=15927261 TSecr=835500432
 30   0.012540 54.230.158.242 -> 172.31.29.138 TCP 11650 [TCP segment of a reassembled PDU]
 31   0.012547 172.31.29.138 -> 54.230.158.242 TCP 66 52940 > http [ACK] Seq=99 Ack=89395 Win=98944 Len=0 TSval=15927261 TSecr=835500432
 32   0.012553 54.230.158.242 -> 172.31.29.138 TCP 1514 [TCP Previous segment not captured] [TCP segment of a reassembled PDU]
 33   0.012556 172.31.29.138 -> 54.230.158.242 TCP 78 [TCP Dup ACK 31#1] 52940 > http [ACK] Seq=99 Ack=89395 Win=98944 Len=0 TSval=15927261 TSecr=835500432 SLE=90843 SRE=92291
 34   0.012570 54.230.158.242 -> 172.31.29.138 TCP 1514 [TCP Out-Of-Order] [TCP segment of a reassembled PDU]
 35   0.012574 172.31.29.138 -> 54.230.158.242 TCP 66 52940 > http [ACK] Seq=99 Ack=92291 Win=96128 Len=0 TSval=15927261 TSecr=835500432
 36   0.012629 54.230.158.242 -> 172.31.29.138 TCP 1514 [TCP segment of a reassembled PDU]
 37   0.012634 172.31.29.138 -> 54.230.158.242 TCP 66 52940 > http [ACK] Seq=99 Ack=93739 Win=109056 Len=0 TSval=15927261 TSecr=835500432
 38   0.012904 54.230.158.242 -> 172.31.29.138 TCP 4410 [TCP segment of a reassembled PDU]
 39   0.012910 172.31.29.138 -> 54.230.158.242 TCP 66 52940 > http [ACK] Seq=99 Ack=98083 Win=109056 Len=0 TSval=15927261 TSecr=835500432
 40   0.012988 54.230.158.242 -> 172.31.29.138 HTTP 4840 HTTP/1.1 200 OK  (application/octet-stream)
 41   0.012994 172.31.29.138 -> 54.230.158.242 TCP 66 52940 > http [ACK] Seq=99 Ack=102857 Win=108416 Len=0 TSval=15927261 TSecr=835500432
 42   0.013121 172.31.29.138 -> 54.230.158.242 TCP 66 52940 > http [FIN, ACK] Seq=99 Ack=102857 Win=109056 Len=0 TSval=15927261 TSecr=835500432
 43   0.013605 54.230.158.242 -> 172.31.29.138 TCP 66 http > 52940 [FIN, ACK] Seq=102857 Ack=100 Win=14592 Len=0 TSval=835500432 TSecr=15927261
 44   0.013612 172.31.29.138 -> 54.230.158.242 TCP 66 52940 > http [ACK] Seq=100 Ack=102858 Win=109056 Len=0 TSval=15927261 TSecr=835500432
