[Measurement for 100kb at 22:37:16 19.37.2014] 
Tshark:

  1   0.000000 172.31.29.138 -> 172.31.0.2   DNS 89 Standard query 0xd6be  A d1xzxs93r3iphc.cloudfront.net
  2   0.000024 172.31.29.138 -> 172.31.0.2   DNS 89 Standard query 0x698a  AAAA d1xzxs93r3iphc.cloudfront.net
  3   0.000604   172.31.0.2 -> 172.31.29.138 DNS 217 Standard query response 0xd6be  A 54.230.150.34 A 54.230.150.36 A 54.230.150.63 A 54.230.150.65 A 54.230.150.114 A 54.230.150.122 A 54.230.149.156 A 54.230.150.10
  4   0.000614   172.31.0.2 -> 172.31.29.138 DNS 170 Standard query response 0x698a 
  5   0.003901 172.31.29.138 -> 54.230.150.34 TCP 74 60696 > http [SYN] Seq=0 Win=26883 Len=0 MSS=8961 SACK_PERM=1 TSval=5127361 TSecr=0 WS=128
  6   0.005332 54.230.150.34 -> 172.31.29.138 TCP 74 http > 60696 [SYN, ACK] Seq=0 Ack=1 Win=14480 Len=0 MSS=1460 SACK_PERM=1 TSval=1451721187 TSecr=5127361 WS=128
  7   0.005346 172.31.29.138 -> 54.230.150.34 TCP 66 60696 > http [ACK] Seq=1 Ack=1 Win=27008 Len=0 TSval=5127361 TSecr=1451721187
  8   0.005400 172.31.29.138 -> 54.230.150.34 HTTP 164 GET /100kb HTTP/1.1 
  9   0.006858 54.230.150.34 -> 172.31.29.138 TCP 66 http > 60696 [ACK] Seq=1 Ack=99 Win=14592 Len=0 TSval=1451721187 TSecr=5127361
 10   0.454270 54.230.150.34 -> 172.31.29.138 TCP 13517 [TCP segment of a reassembled PDU]
 11   0.454300 172.31.29.138 -> 54.230.150.34 TCP 66 60696 > http [ACK] Seq=99 Ack=13452 Win=53888 Len=0 TSval=5127474 TSecr=1451721232
 12   0.644202 54.230.150.34 -> 172.31.29.138 TCP 2962 [TCP segment of a reassembled PDU]
 13   0.644226 172.31.29.138 -> 54.230.150.34 TCP 66 60696 > http [ACK] Seq=99 Ack=16348 Win=59648 Len=0 TSval=5127521 TSecr=1451721251
 14   0.644247 54.230.150.34 -> 172.31.29.138 TCP 11770 [TCP segment of a reassembled PDU]
 15   0.644259 172.31.29.138 -> 54.230.150.34 TCP 66 60696 > http [ACK] Seq=99 Ack=28052 Win=83072 Len=0 TSval=5127521 TSecr=1451721251
 16   0.646033 54.230.150.34 -> 172.31.29.138 TCP 15994 [TCP segment of a reassembled PDU]
 17   0.646045 172.31.29.138 -> 54.230.150.34 TCP 66 60696 > http [ACK] Seq=99 Ack=43980 Win=91648 Len=0 TSval=5127522 TSecr=1451721251
 18   0.646053 54.230.150.34 -> 172.31.29.138 TCP 1658 [TCP segment of a reassembled PDU]
 19   0.646056 172.31.29.138 -> 54.230.150.34 TCP 66 60696 > http [ACK] Seq=99 Ack=45572 Win=90112 Len=0 TSval=5127522 TSecr=1451721251
 20   0.834515 54.230.150.34 -> 172.31.29.138 TCP 2962 [TCP segment of a reassembled PDU]
