[Measurement for 100kb at 11:37:16 20.37.2014] 
Tshark:

  1   0.000000 172.31.29.138 -> 172.31.0.2   DNS 89 Standard query 0xe93a  A d1xzxs93r3iphc.cloudfront.net
  2   0.000037 172.31.29.138 -> 172.31.0.2   DNS 89 Standard query 0xa960  AAAA d1xzxs93r3iphc.cloudfront.net
  3   0.000915   172.31.0.2 -> 172.31.29.138 DNS 170 Standard query response 0xa960 
  4   0.000928   172.31.0.2 -> 172.31.29.138 DNS 217 Standard query response 0xe93a  A 54.230.158.182 A 54.230.158.226 A 54.230.158.230 A 54.230.158.246 A 54.230.159.137 A 54.192.159.107 A 54.192.159.162 A 54.230.156.40
  5   0.003820 172.31.29.138 -> 54.230.158.182 TCP 74 43555 > http [SYN] Seq=0 Win=26883 Len=0 MSS=8961 SACK_PERM=1 TSval=16827216 TSecr=0 WS=128
  6   0.004578 54.230.158.182 -> 172.31.29.138 TCP 74 http > 43555 [SYN, ACK] Seq=0 Ack=1 Win=14480 Len=0 MSS=1460 SACK_PERM=1 TSval=838023520 TSecr=16827216 WS=128
  7   0.004592 172.31.29.138 -> 54.230.158.182 TCP 66 43555 > http [ACK] Seq=1 Ack=1 Win=27008 Len=0 TSval=16827216 TSecr=838023520
  8   0.004629 172.31.29.138 -> 54.230.158.182 HTTP 164 GET /100kb HTTP/1.1 
  9   0.005258 54.230.158.182 -> 172.31.29.138 TCP 66 http > 43555 [ACK] Seq=1 Ack=99 Win=14592 Len=0 TSval=838023520 TSecr=16827216
 10   0.010178 54.230.158.182 -> 172.31.29.138 TCP 4410 [TCP segment of a reassembled PDU]
 11   0.010187 172.31.29.138 -> 54.230.158.182 TCP 66 43555 > http [ACK] Seq=99 Ack=4345 Win=35584 Len=0 TSval=16827218 TSecr=838023520
 12   0.010241 54.230.158.182 -> 172.31.29.138 TCP 10202 [TCP segment of a reassembled PDU]
 13   0.010250 172.31.29.138 -> 54.230.158.182 TCP 66 43555 > http [ACK] Seq=99 Ack=14481 Win=55936 Len=0 TSval=16827218 TSecr=838023520
 14   0.010661 54.230.158.182 -> 172.31.29.138 TCP 1514 [TCP segment of a reassembled PDU]
 15   0.010666 172.31.29.138 -> 54.230.158.182 TCP 66 43555 > http [ACK] Seq=99 Ack=15929 Win=58752 Len=0 TSval=16827218 TSecr=838023520
 16   0.010925 54.230.158.182 -> 172.31.29.138 TCP 4410 [TCP segment of a reassembled PDU]
 17   0.010931 172.31.29.138 -> 54.230.158.182 TCP 66 43555 > http [ACK] Seq=99 Ack=20273 Win=67456 Len=0 TSval=16827218 TSecr=838023520
 18   0.010978 54.230.158.182 -> 172.31.29.138 TCP 7306 [TCP segment of a reassembled PDU]
 19   0.010984 172.31.29.138 -> 54.230.158.182 TCP 66 43555 > http [ACK] Seq=99 Ack=27513 Win=81920 Len=0 TSval=16827218 TSecr=838023520
 20   0.011215 54.230.158.182 -> 172.31.29.138 TCP 2962 [TCP segment of a reassembled PDU]
 21   0.011220 172.31.29.138 -> 54.230.158.182 TCP 66 43555 > http [ACK] Seq=99 Ack=30409 Win=87808 Len=0 TSval=16827218 TSecr=838023520
 22   0.011260 54.230.158.182 -> 172.31.29.138 TCP 4410 [TCP segment of a reassembled PDU]
 23   0.011266 172.31.29.138 -> 54.230.158.182 TCP 66 43555 > http [ACK] Seq=99 Ack=34753 Win=96512 Len=0 TSval=16827218 TSecr=838023520
 24   0.011451 54.230.158.182 -> 172.31.29.138 TCP 2962 [TCP segment of a reassembled PDU]
 25   0.011458 172.31.29.138 -> 54.230.158.182 TCP 66 43555 > http [ACK] Seq=99 Ack=37649 Win=102272 Len=0 TSval=16827218 TSecr=838023520
 26   0.011705 54.230.158.182 -> 172.31.29.138 TCP 2962 [TCP segment of a reassembled PDU]
 27   0.011710 172.31.29.138 -> 54.230.158.182 TCP 66 43555 > http [ACK] Seq=99 Ack=40545 Win=108032 Len=0 TSval=16827218 TSecr=838023520
 28   0.011762 54.230.158.182 -> 172.31.29.138 TCP 11650 [TCP segment of a reassembled PDU]
 29   0.011769 172.31.29.138 -> 54.230.158.182 TCP 66 43555 > http [ACK] Seq=99 Ack=52129 Win=98944 Len=0 TSval=16827218 TSecr=838023520
 30   0.012010 54.230.158.182 -> 172.31.29.138 TCP 4410 [TCP segment of a reassembled PDU]
 31   0.012028 172.31.29.138 -> 54.230.158.182 TCP 66 43555 > http [ACK] Seq=99 Ack=56473 Win=109056 Len=0 TSval=16827218 TSecr=838023520
 32   0.012269 54.230.158.182 -> 172.31.29.138 TCP 15994 [TCP segment of a reassembled PDU]
 33   0.012278 172.31.29.138 -> 54.230.158.182 TCP 66 43555 > http [ACK] Seq=99 Ack=72401 Win=93184 Len=0 TSval=16827218 TSecr=838023520
 34   0.012600 54.230.158.182 -> 172.31.29.138 TCP 10202 [TCP segment of a reassembled PDU]
 35   0.012622 172.31.29.138 -> 54.230.158.182 TCP 66 43555 > http [ACK] Seq=99 Ack=82537 Win=101248 Len=0 TSval=16827218 TSecr=838023520
 36   0.012721 54.230.158.182 -> 172.31.29.138 TCP 4410 [TCP segment of a reassembled PDU]
 37   0.012727 172.31.29.138 -> 54.230.158.182 TCP 66 43555 > http [ACK] Seq=99 Ack=86881 Win=109056 Len=0 TSval=16827218 TSecr=838023521
 38   0.012889 54.230.158.182 -> 172.31.29.138 TCP 15994 [TCP segment of a reassembled PDU]
 39   0.012898 172.31.29.138 -> 54.230.158.182 TCP 66 43555 > http [ACK] Seq=99 Ack=102809 Win=93184 Len=0 TSval=16827218 TSecr=838023521
 40   0.012970 54.230.158.182 -> 172.31.29.138 HTTP 114 HTTP/1.1 200 OK  (application/octet-stream)
 41   0.012973 172.31.29.138 -> 54.230.158.182 TCP 66 43555 > http [ACK] Seq=99 Ack=102857 Win=109056 Len=0 TSval=16827218 TSecr=838023521
 42   0.013084 172.31.29.138 -> 54.230.158.182 TCP 66 43555 > http [FIN, ACK] Seq=99 Ack=102857 Win=109056 Len=0 TSval=16827218 TSecr=838023521
 43   0.013447 54.230.158.182 -> 172.31.29.138 TCP 66 http > 43555 [FIN, ACK] Seq=102857 Ack=100 Win=14592 Len=0 TSval=838023521 TSecr=16827218
 44   0.013454 172.31.29.138 -> 54.230.158.182 TCP 66 43555 > http [ACK] Seq=100 Ack=102858 Win=109056 Len=0 TSval=16827218 TSecr=838023521
