[Measurement for 100kb at 09:37:16 20.37.2014] 
Tshark:

  1   0.000000 172.31.29.138 -> 172.31.0.2   DNS 89 Standard query 0xa9f3  A d1xzxs93r3iphc.cloudfront.net
  2   0.000039 172.31.29.138 -> 172.31.0.2   DNS 89 Standard query 0xafd7  AAAA d1xzxs93r3iphc.cloudfront.net
  3   0.000644   172.31.0.2 -> 172.31.29.138 DNS 217 Standard query response 0xa9f3  A 54.230.158.246 A 54.230.159.141 A 54.192.156.109 A 54.192.157.142 A 54.192.159.104 A 54.192.159.108 A 54.230.156.40 A 54.230.158.191
  4   0.000654   172.31.0.2 -> 172.31.29.138 DNS 170 Standard query response 0xafd7 
  5   0.003889 172.31.29.138 -> 54.230.158.246 TCP 74 46241 > http [SYN] Seq=0 Win=26883 Len=0 MSS=8961 SACK_PERM=1 TSval=15027255 TSecr=0 WS=128
  6   0.004529 54.230.158.246 -> 172.31.29.138 TCP 74 http > 46241 [SYN, ACK] Seq=0 Ack=1 Win=14480 Len=0 MSS=1460 SACK_PERM=1 TSval=812224433 TSecr=15027255 WS=128
  7   0.004543 172.31.29.138 -> 54.230.158.246 TCP 66 46241 > http [ACK] Seq=1 Ack=1 Win=27008 Len=0 TSval=15027256 TSecr=812224433
  8   0.004582 172.31.29.138 -> 54.230.158.246 HTTP 164 GET /100kb HTTP/1.1 
  9   0.005226 54.230.158.246 -> 172.31.29.138 TCP 66 http > 46241 [ACK] Seq=1 Ack=99 Win=14592 Len=0 TSval=812224433 TSecr=15027256
 10   0.009969 54.230.158.246 -> 172.31.29.138 TCP 2580 [TCP segment of a reassembled PDU]
 11   0.009977 172.31.29.138 -> 54.230.158.246 TCP 66 46241 > http [ACK] Seq=99 Ack=2515 Win=32000 Len=0 TSval=15027257 TSecr=812224433
 12   0.009999 54.230.158.246 -> 172.31.29.138 TCP 11650 [TCP segment of a reassembled PDU]
 13   0.010006 172.31.29.138 -> 54.230.158.246 TCP 66 46241 > http [ACK] Seq=99 Ack=14099 Win=55168 Len=0 TSval=15027257 TSecr=812224433
 14   0.010600 54.230.158.246 -> 172.31.29.138 TCP 1514 [TCP segment of a reassembled PDU]
 15   0.010606 172.31.29.138 -> 54.230.158.246 TCP 66 46241 > http [ACK] Seq=99 Ack=15547 Win=57984 Len=0 TSval=15027257 TSecr=812224433
 16   0.010653 54.230.158.246 -> 172.31.29.138 TCP 8754 [TCP segment of a reassembled PDU]
 17   0.010660 172.31.29.138 -> 54.230.158.246 TCP 66 46241 > http [ACK] Seq=99 Ack=24235 Win=75392 Len=0 TSval=15027257 TSecr=812224433
 18   0.010682 54.230.158.246 -> 172.31.29.138 TCP 2962 [TCP segment of a reassembled PDU]
 19   0.010686 172.31.29.138 -> 54.230.158.246 TCP 66 46241 > http [ACK] Seq=99 Ack=27131 Win=81152 Len=0 TSval=15027257 TSecr=812224433
 20   0.011134 54.230.158.246 -> 172.31.29.138 TCP 4410 [TCP segment of a reassembled PDU]
 21   0.011141 172.31.29.138 -> 54.230.158.246 TCP 66 46241 > http [ACK] Seq=99 Ack=31475 Win=89856 Len=0 TSval=15027257 TSecr=812224433
 22   0.011174 54.230.158.246 -> 172.31.29.138 TCP 2962 [TCP segment of a reassembled PDU]
 23   0.011178 172.31.29.138 -> 54.230.158.246 TCP 66 46241 > http [ACK] Seq=99 Ack=34371 Win=95744 Len=0 TSval=15027257 TSecr=812224433
 24   0.011364 54.230.158.246 -> 172.31.29.138 TCP 2962 [TCP segment of a reassembled PDU]
 25   0.011369 172.31.29.138 -> 54.230.158.246 TCP 66 46241 > http [ACK] Seq=99 Ack=37267 Win=101504 Len=0 TSval=15027257 TSecr=812224433
 26   0.011464 54.230.158.246 -> 172.31.29.138 TCP 11650 [TCP segment of a reassembled PDU]
 27   0.011472 172.31.29.138 -> 54.230.158.246 TCP 66 46241 > http [ACK] Seq=99 Ack=48851 Win=98944 Len=0 TSval=15027257 TSecr=812224433
 28   0.011635 54.230.158.246 -> 172.31.29.138 TCP 4410 [TCP segment of a reassembled PDU]
 29   0.011640 172.31.29.138 -> 54.230.158.246 TCP 66 46241 > http [ACK] Seq=99 Ack=53195 Win=109056 Len=0 TSval=15027257 TSecr=812224433
 30   0.011851 54.230.158.246 -> 172.31.29.138 TCP 1514 [TCP segment of a reassembled PDU]
 31   0.011855 172.31.29.138 -> 54.230.158.246 TCP 66 46241 > http [ACK] Seq=99 Ack=54643 Win=109056 Len=0 TSval=15027257 TSecr=812224433
 32   0.011939 54.230.158.246 -> 172.31.29.138 TCP 8754 [TCP segment of a reassembled PDU]
 33   0.011946 172.31.29.138 -> 54.230.158.246 TCP 66 46241 > http [ACK] Seq=99 Ack=63331 Win=103680 Len=0 TSval=15027257 TSecr=812224433
 34   0.012142 54.230.158.246 -> 172.31.29.138 TCP 2962 [TCP segment of a reassembled PDU]
 35   0.012148 172.31.29.138 -> 54.230.158.246 TCP 66 46241 > http [ACK] Seq=99 Ack=66227 Win=109056 Len=0 TSval=15027257 TSecr=812224433
 36   0.012238 54.230.158.246 -> 172.31.29.138 TCP 10202 [TCP segment of a reassembled PDU]
 37   0.012245 172.31.29.138 -> 54.230.158.246 TCP 66 46241 > http [ACK] Seq=99 Ack=76363 Win=101248 Len=0 TSval=15027258 TSecr=812224433
 38   0.012645 54.230.158.246 -> 172.31.29.138 TCP 4410 [TCP segment of a reassembled PDU]
 39   0.012651 172.31.29.138 -> 54.230.158.246 TCP 66 46241 > http [ACK] Seq=99 Ack=80707 Win=117760 Len=0 TSval=15027258 TSecr=812224433
 40   0.012760 54.230.158.246 -> 172.31.29.138 TCP 13098 [TCP segment of a reassembled PDU]
 41   0.012769 172.31.29.138 -> 54.230.158.246 TCP 66 46241 > http [ACK] Seq=99 Ack=93739 Win=143872 Len=0 TSval=15027258 TSecr=812224433
 42   0.013006 54.230.158.246 -> 172.31.29.138 HTTP 9184 HTTP/1.1 200 OK  (application/octet-stream)
 43   0.013013 172.31.29.138 -> 54.230.158.246 TCP 66 46241 > http [ACK] Seq=99 Ack=102857 Win=162048 Len=0 TSval=15027258 TSecr=812224433
 44   0.013132 172.31.29.138 -> 54.230.158.246 TCP 66 46241 > http [FIN, ACK] Seq=99 Ack=102857 Win=162048 Len=0 TSval=15027258 TSecr=812224433
 45   0.013636 54.230.158.246 -> 172.31.29.138 TCP 66 http > 46241 [FIN, ACK] Seq=102857 Ack=100 Win=14592 Len=0 TSval=812224434 TSecr=15027258
 46   0.013644 172.31.29.138 -> 54.230.158.246 TCP 66 46241 > http [ACK] Seq=100 Ack=102858 Win=162048 Len=0 TSval=15027258 TSecr=812224434
