[Measurement for 100kb at 07:37:16 20.37.2014] 
Tshark:

  1   0.000000 172.31.29.138 -> 172.31.0.2   DNS 89 Standard query 0xbdfb  A d1xzxs93r3iphc.cloudfront.net
  2   0.000036 172.31.29.138 -> 172.31.0.2   DNS 89 Standard query 0x7cec  AAAA d1xzxs93r3iphc.cloudfront.net
  3   0.000617   172.31.0.2 -> 172.31.29.138 DNS 170 Standard query response 0x7cec 
  4   0.000627   172.31.0.2 -> 172.31.29.138 DNS 217 Standard query response 0xbdfb  A 54.192.157.136 A 54.192.159.106 A 54.192.159.171 A 54.230.156.193 A 54.230.158.190 A 54.230.158.207 A 54.230.158.225 A 54.230.159.141
  5   0.003806 172.31.29.138 -> 54.192.157.136 TCP 74 47328 > http [SYN] Seq=0 Win=26883 Len=0 MSS=8961 SACK_PERM=1 TSval=13227297 TSecr=0 WS=128
  6   0.004490 54.192.157.136 -> 172.31.29.138 TCP 74 http > 47328 [SYN, ACK] Seq=0 Ack=1 Win=14480 Len=0 MSS=1460 SACK_PERM=1 TSval=842652650 TSecr=13227297 WS=128
  7   0.004504 172.31.29.138 -> 54.192.157.136 TCP 66 47328 > http [ACK] Seq=1 Ack=1 Win=27008 Len=0 TSval=13227297 TSecr=842652650
  8   0.004545 172.31.29.138 -> 54.192.157.136 HTTP 164 GET /100kb HTTP/1.1 
  9   0.005191 54.192.157.136 -> 172.31.29.138 TCP 66 http > 47328 [ACK] Seq=1 Ack=99 Win=14592 Len=0 TSval=842652650 TSecr=13227297
 10   0.009879 54.192.157.136 -> 172.31.29.138 TCP 522 [TCP segment of a reassembled PDU]
 11   0.009887 172.31.29.138 -> 54.192.157.136 TCP 66 47328 > http [ACK] Seq=99 Ack=457 Win=28032 Len=0 TSval=13227298 TSecr=842652651
 12   0.009957 54.192.157.136 -> 172.31.29.138 TCP 13098 [TCP segment of a reassembled PDU]
 13   0.009967 172.31.29.138 -> 54.192.157.136 TCP 66 47328 > http [ACK] Seq=99 Ack=13489 Win=54144 Len=0 TSval=13227298 TSecr=842652651
 14   0.010680 54.192.157.136 -> 172.31.29.138 TCP 5858 [TCP segment of a reassembled PDU]
 15   0.010688 172.31.29.138 -> 54.192.157.136 TCP 66 47328 > http [ACK] Seq=99 Ack=19281 Win=65664 Len=0 TSval=13227298 TSecr=842652651
 16   0.010713 54.192.157.136 -> 172.31.29.138 TCP 7306 [TCP segment of a reassembled PDU]
 17   0.010720 172.31.29.138 -> 54.192.157.136 TCP 66 47328 > http [ACK] Seq=99 Ack=26521 Win=80128 Len=0 TSval=13227298 TSecr=842652651
 18   0.011452 54.192.157.136 -> 172.31.29.138 TCP 11650 [TCP segment of a reassembled PDU]
 19   0.011460 172.31.29.138 -> 54.192.157.136 TCP 66 47328 > http [ACK] Seq=99 Ack=38105 Win=98944 Len=0 TSval=13227299 TSecr=842652651
 20   0.011492 54.192.157.136 -> 172.31.29.138 TCP 8754 [TCP segment of a reassembled PDU]
 21   0.011502 172.31.29.138 -> 54.192.157.136 TCP 66 47328 > http [ACK] Seq=99 Ack=46793 Win=103680 Len=0 TSval=13227299 TSecr=842652651
 22   0.012162 54.192.157.136 -> 172.31.29.138 TCP 4410 [TCP segment of a reassembled PDU]
 23   0.012168 172.31.29.138 -> 54.192.157.136 TCP 66 47328 > http [ACK] Seq=99 Ack=51137 Win=109056 Len=0 TSval=13227299 TSecr=842652651
 24   0.012190 54.192.157.136 -> 172.31.29.138 TCP 1514 [TCP segment of a reassembled PDU]
 25   0.012194 172.31.29.138 -> 54.192.157.136 TCP 66 47328 > http [ACK] Seq=99 Ack=52585 Win=109056 Len=0 TSval=13227299 TSecr=842652651
 26   0.012290 54.192.157.136 -> 172.31.29.138 TCP 17442 [TCP segment of a reassembled PDU]
 27   0.012300 172.31.29.138 -> 54.192.157.136 TCP 66 47328 > http [ACK] Seq=99 Ack=69961 Win=91776 Len=0 TSval=13227299 TSecr=842652651
 28   0.012981 54.192.157.136 -> 172.31.29.138 TCP 14546 [TCP segment of a reassembled PDU]
 29   0.012991 172.31.29.138 -> 54.192.157.136 TCP 66 47328 > http [ACK] Seq=99 Ack=84441 Win=94080 Len=0 TSval=13227299 TSecr=842652651
 30   0.013027 54.192.157.136 -> 172.31.29.138 TCP 13098 [TCP segment of a reassembled PDU]
 31   0.013035 172.31.29.138 -> 54.192.157.136 TCP 66 47328 > http [ACK] Seq=99 Ack=97473 Win=96512 Len=0 TSval=13227299 TSecr=842652651
 32   0.013688 54.192.157.136 -> 172.31.29.138 TCP 4410 [TCP segment of a reassembled PDU]
 33   0.013693 172.31.29.138 -> 54.192.157.136 TCP 66 47328 > http [ACK] Seq=99 Ack=101817 Win=109056 Len=0 TSval=13227299 TSecr=842652651
 34   0.013750 54.192.157.136 -> 172.31.29.138 HTTP 1106 HTTP/1.1 200 OK  (application/octet-stream)
 35   0.013755 172.31.29.138 -> 54.192.157.136 TCP 66 47328 > http [ACK] Seq=99 Ack=102857 Win=109056 Len=0 TSval=13227299 TSecr=842652651
 36   0.013868 172.31.29.138 -> 54.192.157.136 TCP 66 47328 > http [FIN, ACK] Seq=99 Ack=102857 Win=109056 Len=0 TSval=13227299 TSecr=842652651
 37   0.014420 54.192.157.136 -> 172.31.29.138 TCP 66 http > 47328 [FIN, ACK] Seq=102857 Ack=100 Win=14592 Len=0 TSval=842652651 TSecr=13227299
 38   0.014428 172.31.29.138 -> 54.192.157.136 TCP 66 47328 > http [ACK] Seq=100 Ack=102858 Win=109056 Len=0 TSval=13227299 TSecr=842652651
 39   0.232628 06:38:16:87:8c:c2 -> 06:4e:73:56:a6:a6 ARP 60 Who has 172.31.29.138?  Tell 172.31.16.1
 40   0.232639 06:4e:73:56:a6:a6 -> 06:38:16:87:8c:c2 ARP 42 172.31.29.138 is at 06:4e:73:56:a6:a6
