[Measurement for 100kb at 05:37:16 20.37.2014] 
Tshark:

  1   0.000000 06:38:16:87:8c:c2 -> 06:4e:73:56:a6:a6 ARP 60 Who has 172.31.29.138?  Tell 172.31.16.1
  2   0.000018 06:4e:73:56:a6:a6 -> 06:38:16:87:8c:c2 ARP 42 172.31.29.138 is at 06:4e:73:56:a6:a6
  3   0.499715 172.31.29.138 -> 172.31.0.2   DNS 89 Standard query 0x986b  A d1xzxs93r3iphc.cloudfront.net
  4   0.499743 172.31.29.138 -> 172.31.0.2   DNS 89 Standard query 0xffd3  AAAA d1xzxs93r3iphc.cloudfront.net
  5   0.500207   172.31.0.2 -> 172.31.29.138 DNS 170 Standard query response 0xffd3 
  6   0.500235   172.31.0.2 -> 172.31.29.138 DNS 217 Standard query response 0x986b  A 54.230.158.182 A 54.230.158.184 A 54.230.158.207 A 54.230.158.211 A 54.192.157.142 A 54.192.159.77 A 54.192.159.101 A 54.192.159.176
  7   0.503549 172.31.29.138 -> 54.230.158.182 TCP 74 43283 > http [SYN] Seq=0 Win=26883 Len=0 MSS=8961 SACK_PERM=1 TSval=11427367 TSecr=0 WS=128
  8   0.504051 54.230.158.182 -> 172.31.29.138 TCP 74 http > 43283 [SYN, ACK] Seq=0 Ack=1 Win=14480 Len=0 MSS=1460 SACK_PERM=1 TSval=730821260 TSecr=11427367 WS=128
  9   0.504065 172.31.29.138 -> 54.230.158.182 TCP 66 43283 > http [ACK] Seq=1 Ack=1 Win=27008 Len=0 TSval=11427367 TSecr=730821260
 10   0.504105 172.31.29.138 -> 54.230.158.182 HTTP 164 GET /100kb HTTP/1.1 
 11   0.504497 54.230.158.182 -> 172.31.29.138 TCP 66 http > 43283 [ACK] Seq=1 Ack=99 Win=14592 Len=0 TSval=730821260 TSecr=11427367
 12   0.509647 54.230.158.182 -> 172.31.29.138 TCP 522 [TCP segment of a reassembled PDU]
 13   0.509655 172.31.29.138 -> 54.230.158.182 TCP 66 43283 > http [ACK] Seq=99 Ack=457 Win=28032 Len=0 TSval=11427368 TSecr=730821260
 14   0.509717 54.230.158.182 -> 172.31.29.138 TCP 13098 [TCP segment of a reassembled PDU]
 15   0.509735 172.31.29.138 -> 54.230.158.182 TCP 66 43283 > http [ACK] Seq=99 Ack=13489 Win=54144 Len=0 TSval=11427368 TSecr=730821260
 16   0.510175 54.230.158.182 -> 172.31.29.138 TCP 2962 [TCP segment of a reassembled PDU]
 17   0.510181 172.31.29.138 -> 54.230.158.182 TCP 66 43283 > http [ACK] Seq=99 Ack=16385 Win=59904 Len=0 TSval=11427368 TSecr=730821260
 18   0.510215 54.230.158.182 -> 172.31.29.138 TCP 10202 [TCP segment of a reassembled PDU]
 19   0.510221 172.31.29.138 -> 54.230.158.182 TCP 66 43283 > http [ACK] Seq=99 Ack=26521 Win=80128 Len=0 TSval=11427368 TSecr=730821260
 20   0.510667 54.230.158.182 -> 172.31.29.138 TCP 1514 [TCP segment of a reassembled PDU]
 21   0.510682 172.31.29.138 -> 54.230.158.182 TCP 66 43283 > http [ACK] Seq=99 Ack=27969 Win=83072 Len=0 TSval=11427369 TSecr=730821260
 22   0.510721 54.230.158.182 -> 172.31.29.138 TCP 8754 [TCP segment of a reassembled PDU]
 23   0.510729 172.31.29.138 -> 54.230.158.182 TCP 66 43283 > http [ACK] Seq=99 Ack=36657 Win=100480 Len=0 TSval=11427369 TSecr=730821260
 24   0.510781 54.230.158.182 -> 172.31.29.138 TCP 10202 [TCP segment of a reassembled PDU]
 25   0.510789 172.31.29.138 -> 54.230.158.182 TCP 66 43283 > http [ACK] Seq=99 Ack=46793 Win=101248 Len=0 TSval=11427369 TSecr=730821260
 26   0.511187 54.230.158.182 -> 172.31.29.138 TCP 1514 [TCP segment of a reassembled PDU]
 27   0.511192 172.31.29.138 -> 54.230.158.182 TCP 66 43283 > http [ACK] Seq=99 Ack=48241 Win=109056 Len=0 TSval=11427369 TSecr=730821260
 28   0.511237 54.230.158.182 -> 172.31.29.138 TCP 4410 [TCP segment of a reassembled PDU]
 29   0.511243 172.31.29.138 -> 54.230.158.182 TCP 66 43283 > http [ACK] Seq=99 Ack=52585 Win=109056 Len=0 TSval=11427369 TSecr=730821260
 30   0.511328 54.230.158.182 -> 172.31.29.138 TCP 18890 [TCP segment of a reassembled PDU]
 31   0.511350 172.31.29.138 -> 54.230.158.182 TCP 66 43283 > http [ACK] Seq=99 Ack=71409 Win=90240 Len=0 TSval=11427369 TSecr=730821260
 32   0.512004 54.230.158.182 -> 172.31.29.138 TCP 5858 [TCP segment of a reassembled PDU]
 33   0.512012 172.31.29.138 -> 54.230.158.182 TCP 66 43283 > http [ACK] Seq=99 Ack=77201 Win=108416 Len=0 TSval=11427369 TSecr=730821260
 34   0.512101 54.230.158.182 -> 172.31.29.138 TCP 14546 [TCP segment of a reassembled PDU]
 35   0.512121 172.31.29.138 -> 54.230.158.182 TCP 66 43283 > http [ACK] Seq=99 Ack=91681 Win=94080 Len=0 TSval=11427369 TSecr=730821260
 36   0.512497 54.230.158.182 -> 172.31.29.138 TCP 5858 [TCP segment of a reassembled PDU]
 37   0.512504 172.31.29.138 -> 54.230.158.182 TCP 66 43283 > http [ACK] Seq=99 Ack=97473 Win=108416 Len=0 TSval=11427369 TSecr=730821260
 38   0.512593 54.230.158.182 -> 172.31.29.138 HTTP 5450 HTTP/1.1 200 OK  (application/octet-stream)
 39   0.512599 172.31.29.138 -> 54.230.158.182 TCP 66 43283 > http [ACK] Seq=99 Ack=102857 Win=108416 Len=0 TSval=11427369 TSecr=730821260
 40   0.512726 172.31.29.138 -> 54.230.158.182 TCP 66 43283 > http [FIN, ACK] Seq=99 Ack=102857 Win=109056 Len=0 TSval=11427369 TSecr=730821260
 41   0.517808 54.230.158.182 -> 172.31.29.138 TCP 66 http > 43283 [FIN, ACK] Seq=102857 Ack=100 Win=14592 Len=0 TSval=730821261 TSecr=11427369
 42   0.517817 172.31.29.138 -> 54.230.158.182 TCP 66 43283 > http [ACK] Seq=100 Ack=102858 Win=109056 Len=0 TSval=11427370 TSecr=730821261
