[Measurement for 1kb at 11:00:10 17.00.2014] 
Tshark:

  1   0.000000  192.168.1.2 -> 72.21.195.190 TCP 1414 [TCP segment of a reassembled PDU]
  2   0.000022  192.168.1.2 -> 72.21.195.190 TCP 1414 [TCP segment of a reassembled PDU]
  3   0.000034  192.168.1.2 -> 72.21.195.190 TCP 1414 [TCP segment of a reassembled PDU]
  4   0.000047  192.168.1.2 -> 72.21.195.190 TLSv1 884 Application Data
  5   0.000468  192.168.1.2 -> 72.21.195.190 TLSv1 384 Application Data
  6   0.009677  192.168.1.2 -> 72.21.195.190 TCP 1414 [TCP segment of a reassembled PDU]
  7   0.009698  192.168.1.2 -> 72.21.195.190 TCP 1414 [TCP segment of a reassembled PDU]
  8   0.009709  192.168.1.2 -> 72.21.195.190 TCP 1414 [TCP segment of a reassembled PDU]
  9   0.009722  192.168.1.2 -> 72.21.195.190 TLSv1 884 Application Data
 10   0.010117  192.168.1.2 -> 72.21.195.190 TLSv1 393 Application Data
 11   0.151718 72.21.195.190 -> 192.168.1.2  TCP 54 443→50824 [ACK] Seq=1 Ack=2721 Win=32725 Len=0
 12   0.152602 72.21.195.190 -> 192.168.1.2  TCP 54 443→50824 [ACK] Seq=1 Ack=4911 Win=32691 Len=0
 13   0.153692 72.21.195.190 -> 192.168.1.2  TCP 54 443→50824 [ACK] Seq=1 Ack=5250 Win=32685 Len=0
 14   0.157550 72.21.195.190 -> 192.168.1.2  TCP 54 443→50825 [ACK] Seq=1 Ack=2721 Win=32725 Len=0
 15   0.158187 72.21.195.190 -> 192.168.1.2  TCP 54 443→50825 [ACK] Seq=1 Ack=4911 Win=32691 Len=0
 16   0.158766 72.21.195.190 -> 192.168.1.2  TCP 54 443→50825 [ACK] Seq=1 Ack=5241 Win=32686 Len=0
 17   0.222807 72.21.195.190 -> 192.168.1.2  TLSv1 360 Application Data
 18   0.225108 72.21.195.190 -> 192.168.1.2  TLSv1 123 Application Data
 19   0.225173  192.168.1.2 -> 72.21.195.190 TCP 54 50824→443 [ACK] Seq=5250 Ack=376 Win=258 Len=0
 20   0.235395  192.168.1.2 -> 72.21.195.190 TCP 1414 [TCP segment of a reassembled PDU]
 21   0.235411  192.168.1.2 -> 72.21.195.190 TCP 1414 [TCP segment of a reassembled PDU]
 22   0.235419  192.168.1.2 -> 72.21.195.190 TLSv1 1021 Application Data
 23   0.274738 72.21.195.190 -> 192.168.1.2  TLSv1 386 Application Data
 24   0.276317 72.21.195.190 -> 192.168.1.2  TLSv1 1255 Application Data
 25   0.276383  192.168.1.2 -> 72.21.195.190 TCP 54 50825→443 [ACK] Seq=5241 Ack=1534 Win=260 Len=0
 26   0.392153 72.21.195.190 -> 192.168.1.2  TCP 54 443→50824 [ACK] Seq=376 Ack=7970 Win=32725 Len=0
 27   0.411520 72.21.195.190 -> 192.168.1.2  TCP 54 443→50824 [ACK] Seq=376 Ack=8937 Win=32710 Len=0
 28   0.411521 72.21.195.190 -> 192.168.1.2  TLSv1 331 Application Data
 29   0.411522 72.21.195.190 -> 192.168.1.2  TLSv1 118 Application Data
 30   0.411599  192.168.1.2 -> 72.21.195.190 TCP 54 50824→443 [ACK] Seq=8937 Ack=717 Win=257 Len=0
 31   1.106460  192.168.1.2 -> 54.230.98.134 TCP 66 52492→80 [SYN] Seq=0 Win=8192 Len=0 MSS=1460 WS=256 SACK_PERM=1
 32   1.140752 54.230.98.134 -> 192.168.1.2  TCP 66 80→52492 [SYN, ACK] Seq=0 Ack=1 Win=14600 Len=0 MSS=1400 SACK_PERM=1 WS=128
 33   1.140903  192.168.1.2 -> 54.230.98.134 TCP 54 52492→80 [ACK] Seq=1 Ack=1 Win=65792 Len=0
 34   1.141072  192.168.1.2 -> 54.230.98.134 HTTP 150 GET /1kb HTTP/1.1 
 35   1.169596 54.230.98.134 -> 192.168.1.2  TCP 54 80→52492 [ACK] Seq=1 Ack=97 Win=14720 Len=0
 36   1.172667 54.230.98.134 -> 192.168.1.2  TCP 1454 [TCP segment of a reassembled PDU]
 37   1.173494 54.230.98.134 -> 192.168.1.2  HTTP 132 HTTP/1.1 200 OK  (application/octet-stream)
 38   1.173573  192.168.1.2 -> 54.230.98.134 TCP 54 52492→80 [ACK] Seq=97 Ack=1479 Win=65792 Len=0
 39   1.173700  192.168.1.2 -> 54.230.98.134 TCP 54 52492→80 [FIN, ACK] Seq=97 Ack=1479 Win=65792 Len=0
 40   1.210043 54.230.98.134 -> 192.168.1.2  TCP 54 80→52492 [FIN, ACK] Seq=1479 Ack=98 Win=14720 Len=0
 41   1.210192  192.168.1.2 -> 54.230.98.134 TCP 54 52492→80 [ACK] Seq=98 Ack=1480 Win=65792 Len=0
