[Measurement for 10kb at 19:03:53 16.03.2014] 
Tshark:

  1   0.000000  192.168.1.2 -> 54.230.96.199 SSL 55 Continuation Data
  2   0.000000  192.168.1.2 -> 54.230.96.199 SSL 55 Continuation Data
  3   0.041697 54.230.96.199 -> 192.168.1.2  TCP 66 443→64146 [ACK] Seq=1 Ack=2 Win=140 Len=0 SLE=1 SRE=2
  4   0.044531 54.230.96.199 -> 192.168.1.2  TCP 66 443→64145 [ACK] Seq=1 Ack=2 Win=140 Len=0 SLE=1 SRE=2
  5   0.261280  192.168.1.2 -> 54.230.96.199 TCP 55 64148→80 [ACK] Seq=1 Ack=1 Win=253 Len=1
  6   0.301327  192.168.1.2 -> 54.230.96.199 TCP 55 64147→80 [ACK] Seq=1 Ack=1 Win=836 Len=1
  7   0.301741 54.230.96.199 -> 192.168.1.2  TCP 66 80→64148 [ACK] Seq=1 Ack=2 Win=123 Len=0 SLE=1 SRE=2
  8   0.327598 54.230.96.199 -> 192.168.1.2  TCP 66 80→64147 [ACK] Seq=1 Ack=2 Win=123 Len=0 SLE=1 SRE=2
  9   0.568944  192.168.1.2 -> 54.221.227.112 TLSv1.2 90 Application Data
 10   0.727917 54.221.227.112 -> 192.168.1.2  TLSv1.2 86 Application Data
 11   0.778161  192.168.1.2 -> 54.221.227.112 TCP 54 63063→443 [ACK] Seq=37 Ack=33 Win=256 Len=0
 12   0.868849  192.168.1.2 -> 54.230.99.89 TCP 66 64189→80 [SYN] Seq=0 Win=8192 Len=0 MSS=1460 WS=256 SACK_PERM=1
 13   0.919872 54.230.99.89 -> 192.168.1.2  TCP 66 80→64189 [SYN, ACK] Seq=0 Ack=1 Win=14600 Len=0 MSS=1400 SACK_PERM=1 WS=128
 14   0.920062  192.168.1.2 -> 54.230.99.89 TCP 54 64189→80 [ACK] Seq=1 Ack=1 Win=65792 Len=0
 15   0.929412  192.168.1.2 -> 54.230.99.89 HTTP 151 GET /10kb HTTP/1.1 
 16   0.966877 54.230.99.89 -> 192.168.1.2  TCP 54 80→64189 [ACK] Seq=1 Ack=98 Win=14720 Len=0
 17   0.974990 54.230.99.89 -> 192.168.1.2  TCP 1454 [TCP segment of a reassembled PDU]
 18   0.976759 54.230.99.89 -> 192.168.1.2  TCP 1454 [TCP segment of a reassembled PDU]
 19   0.976875  192.168.1.2 -> 54.230.99.89 TCP 54 64189→80 [ACK] Seq=98 Ack=2801 Win=65792 Len=0
 20   0.977025 54.230.99.89 -> 192.168.1.2  TCP 1454 [TCP segment of a reassembled PDU]
 21   0.977070 54.230.99.89 -> 192.168.1.2  TCP 1454 [TCP segment of a reassembled PDU]
 22   0.977123  192.168.1.2 -> 54.230.99.89 TCP 54 64189→80 [ACK] Seq=98 Ack=5601 Win=65792 Len=0
 23   0.977222 54.230.99.89 -> 192.168.1.2  TCP 1454 [TCP segment of a reassembled PDU]
 24   0.977265 54.230.99.89 -> 192.168.1.2  TCP 1454 [TCP segment of a reassembled PDU]
 25   0.977313  192.168.1.2 -> 54.230.99.89 TCP 54 64189→80 [ACK] Seq=98 Ack=8401 Win=65792 Len=0
 26   0.977404 54.230.99.89 -> 192.168.1.2  TCP 1454 [TCP segment of a reassembled PDU]
 27   0.977443 54.230.99.89 -> 192.168.1.2  HTTP 949 HTTP/1.1 200 OK  (application/octet-stream)
 28   0.977488  192.168.1.2 -> 54.230.99.89 TCP 54 64189→80 [ACK] Seq=98 Ack=10696 Win=65792 Len=0
 29   0.977591  192.168.1.2 -> 54.230.99.89 TCP 54 64189→80 [FIN, ACK] Seq=98 Ack=10696 Win=65792 Len=0
 30   1.034520 54.230.99.89 -> 192.168.1.2  TCP 54 80→64189 [FIN, ACK] Seq=10696 Ack=99 Win=14720 Len=0
 31   1.034632  192.168.1.2 -> 54.230.99.89 TCP 54 64189→80 [ACK] Seq=99 Ack=10697 Win=65792 Len=0
 32   1.257721  192.168.1.2 -> 72.21.194.168 TCP 1414 [TCP segment of a reassembled PDU]
 33   1.257735  192.168.1.2 -> 72.21.194.168 TCP 1414 [TCP segment of a reassembled PDU]
 34   1.257741  192.168.1.2 -> 72.21.194.168 TCP 1414 [TCP segment of a reassembled PDU]
 35   1.257750  192.168.1.2 -> 72.21.194.168 TLSv1 939 Application Data
 36   1.416688 72.21.194.168 -> 192.168.1.2  TCP 54 443→64160 [ACK] Seq=1 Ack=2721 Win=32725 Len=0
 37   1.417758 72.21.194.168 -> 192.168.1.2  TCP 54 443→64160 [ACK] Seq=1 Ack=4966 Win=32690 Len=0
 38   1.658717 72.21.194.168 -> 192.168.1.2  TCP 1414 [TCP segment of a reassembled PDU]
 39   1.659659 72.21.194.168 -> 192.168.1.2  TCP 1414 [TCP segment of a reassembled PDU]
 40   1.659714  192.168.1.2 -> 72.21.194.168 TCP 54 64160→443 [ACK] Seq=4966 Ack=2721 Win=260 Len=0
 41   1.661968 72.21.194.168 -> 192.168.1.2  TCP 1414 [TCP segment of a reassembled PDU]
 42   1.661997 72.21.194.168 -> 192.168.1.2  TCP 1414 [TCP segment of a reassembled PDU]
 43   1.662029  192.168.1.2 -> 72.21.194.168 TCP 54 64160→443 [ACK] Seq=4966 Ack=5441 Win=260 Len=0
 44   1.662121 72.21.194.168 -> 192.168.1.2  TLSv1 790 Application Data
 45   1.662138 72.21.194.168 -> 192.168.1.2  TLSv1 599 Application Data
 46   1.662158  192.168.1.2 -> 72.21.194.168 TCP 54 64160→443 [ACK] Seq=4966 Ack=6722 Win=255 Len=0
 47   1.686027  192.168.1.2 -> 72.21.194.168 TCP 1414 [TCP segment of a reassembled PDU]
 48   1.686058  192.168.1.2 -> 72.21.194.168 TCP 1414 [TCP segment of a reassembled PDU]
 49   1.686079  192.168.1.2 -> 72.21.194.168 TLSv1 1140 Application Data
 50   1.827834 72.21.194.168 -> 192.168.1.2  TCP 54 443→64160 [ACK] Seq=6722 Ack=7686 Win=32725 Len=0
 51   1.828513 72.21.194.168 -> 192.168.1.2  TCP 54 443→64160 [ACK] Seq=6722 Ack=8772 Win=32708 Len=0
 52   1.850629 72.21.194.168 -> 192.168.1.2  TLSv1 374 Application Data
 53   1.900119  192.168.1.2 -> 72.21.194.168 TCP 54 64160→443 [ACK] Seq=8772 Ack=7042 Win=260 Len=0
