[Measurement for 100kb at 09:32:41 20.32.2014] 
Tshark:

  1   0.000000 172.31.36.109 -> 172.31.0.2   DNS 89 Standard query 0x5957  A d1xzxs93r3iphc.cloudfront.net
  2   0.000022 172.31.36.109 -> 172.31.0.2   DNS 89 Standard query 0xfd8c  AAAA d1xzxs93r3iphc.cloudfront.net
  3   0.000495   172.31.0.2 -> 172.31.36.109 DNS 217 Standard query response 0x5957  A 54.230.20.33 A 54.230.20.182 A 54.230.21.133 A 54.230.21.146 A 54.230.21.175 A 54.230.22.78 A 54.230.22.189 A 216.137.41.144
  4   0.000507   172.31.0.2 -> 172.31.36.109 DNS 170 Standard query response 0xfd8c 
  5   0.003915 172.31.36.109 -> 54.230.20.33 TCP 74 45635 > http [SYN] Seq=0 Win=26883 Len=0 MSS=8961 SACK_PERM=1 TSval=34911961 TSecr=0 WS=128
  6   0.093583 54.230.20.33 -> 172.31.36.109 TCP 74 http > 45635 [SYN, ACK] Seq=0 Ack=1 Win=14480 Len=0 MSS=1460 SACK_PERM=1 TSval=948089197 TSecr=34911961 WS=128
  7   0.093616 172.31.36.109 -> 54.230.20.33 TCP 66 45635 > http [ACK] Seq=1 Ack=1 Win=27008 Len=0 TSval=34911984 TSecr=948089197
  8   0.093659 172.31.36.109 -> 54.230.20.33 HTTP 164 GET /100kb HTTP/1.1 
  9   0.183217 54.230.20.33 -> 172.31.36.109 TCP 66 http > 45635 [ACK] Seq=1 Ack=99 Win=14592 Len=0 TSval=948089206 TSecr=34911984
 10   0.188513 54.230.20.33 -> 172.31.36.109 TCP 1144 [TCP segment of a reassembled PDU]
 11   0.188523 172.31.36.109 -> 54.230.20.33 TCP 66 45635 > http [ACK] Seq=99 Ack=1079 Win=29056 Len=0 TSval=34912008 TSecr=948089207
 12   0.188562 54.230.20.33 -> 172.31.36.109 TCP 5858 [TCP segment of a reassembled PDU]
 13   0.188570 172.31.36.109 -> 54.230.20.33 TCP 66 45635 > http [ACK] Seq=99 Ack=6871 Win=40704 Len=0 TSval=34912008 TSecr=948089207
 14   0.188688 54.230.20.33 -> 172.31.36.109 TCP 2962 [TCP segment of a reassembled PDU]
 15   0.188693 172.31.36.109 -> 54.230.20.33 TCP 66 45635 > http [ACK] Seq=99 Ack=9767 Win=46464 Len=0 TSval=34912008 TSecr=948089207
 16   0.188702 54.230.20.33 -> 172.31.36.109 TCP 4410 [TCP segment of a reassembled PDU]
 17   0.188706 172.31.36.109 -> 54.230.20.33 TCP 66 45635 > http [ACK] Seq=99 Ack=14111 Win=55168 Len=0 TSval=34912008 TSecr=948089207
 18   0.278755 54.230.20.33 -> 172.31.36.109 TCP 1514 [TCP segment of a reassembled PDU]
 19   0.278781 172.31.36.109 -> 54.230.20.33 TCP 66 45635 > http [ACK] Seq=99 Ack=15559 Win=58112 Len=0 TSval=34912030 TSecr=948089216
 20   0.278921 54.230.20.33 -> 172.31.36.109 TCP 18890 [TCP segment of a reassembled PDU]
 21   0.278935 172.31.36.109 -> 54.230.20.33 TCP 66 45635 > http [ACK] Seq=99 Ack=34383 Win=86912 Len=0 TSval=34912030 TSecr=948089216
 22   0.368595 54.230.20.33 -> 172.31.36.109 TCP 7306 [TCP segment of a reassembled PDU]
 23   0.368621 172.31.36.109 -> 54.230.20.33 TCP 66 45635 > http [ACK] Seq=99 Ack=41623 Win=110208 Len=0 TSval=34912053 TSecr=948089225
 24   0.368767 54.230.20.33 -> 172.31.36.109 TCP 11650 [TCP segment of a reassembled PDU]
 25   0.368776 172.31.36.109 -> 54.230.20.33 TCP 66 45635 > http [ACK] Seq=99 Ack=53207 Win=133376 Len=0 TSval=34912053 TSecr=948089225
 26   0.458268 54.230.20.33 -> 172.31.36.109 TCP 13098 [TCP segment of a reassembled PDU]
