[Measurement for 100kb at 18:34:36 19.34.2014] 
Tshark:

  1   0.000000 172.31.36.109 -> 172.31.0.2   DNS 89 Standard query 0x2d5c  A d1xzxs93r3iphc.cloudfront.net
  2   0.000029 172.31.36.109 -> 172.31.0.2   DNS 89 Standard query 0x91bf  AAAA d1xzxs93r3iphc.cloudfront.net
  3   0.000293   172.31.0.2 -> 172.31.36.109 DNS 217 Standard query response 0x2d5c  A 54.230.20.55 A 54.230.20.98 A 54.230.21.120 A 54.230.21.137 A 54.230.21.239 A 216.137.41.122 A 216.137.41.240 A 54.230.20.4
  4   0.000377   172.31.0.2 -> 172.31.36.109 DNS 170 Standard query response 0x91bf 
  5   0.003887 172.31.36.109 -> 54.230.20.55 TCP 74 40705 > http [SYN] Seq=0 Win=26883 Len=0 MSS=8961 SACK_PERM=1 TSval=21440658 TSecr=0 WS=128
  6   0.099057 54.230.20.55 -> 172.31.36.109 TCP 74 http > 40705 [SYN, ACK] Seq=0 Ack=1 Win=14480 Len=0 MSS=1460 SACK_PERM=1 TSval=924203622 TSecr=21440658 WS=128
  7   0.099084 172.31.36.109 -> 54.230.20.55 TCP 66 40705 > http [ACK] Seq=1 Ack=1 Win=27008 Len=0 TSval=21440682 TSecr=924203622
  8   0.099156 172.31.36.109 -> 54.230.20.55 HTTP 164 GET /100kb HTTP/1.1 
  9   0.194131 54.230.20.55 -> 172.31.36.109 TCP 66 http > 40705 [ACK] Seq=1 Ack=99 Win=14592 Len=0 TSval=924203632 TSecr=21440682
 10   0.336785 54.230.20.55 -> 172.31.36.109 TCP 2617 [TCP segment of a reassembled PDU]
 11   0.336801 172.31.36.109 -> 54.230.20.55 TCP 66 40705 > http [ACK] Seq=99 Ack=2552 Win=32000 Len=0 TSval=21440741 TSecr=924203646
 12   0.336808 54.230.20.55 -> 172.31.36.109 TCP 518 [TCP segment of a reassembled PDU]
 13   0.336811 172.31.36.109 -> 54.230.20.55 TCP 66 40705 > http [ACK] Seq=99 Ack=3004 Win=34944 Len=0 TSval=21440741 TSecr=924203646
 14   0.337711 54.230.20.55 -> 172.31.36.109 TCP 5906 [TCP segment of a reassembled PDU]
 15   0.337720 172.31.36.109 -> 54.230.20.55 TCP 66 40705 > http [ACK] Seq=99 Ack=8844 Win=46592 Len=0 TSval=21440742 TSecr=924203646
 16   0.337725 54.230.20.55 -> 172.31.36.109 TCP 1514 [TCP segment of a reassembled PDU]
 17   0.337728 172.31.36.109 -> 54.230.20.55 TCP 66 40705 > http [ACK] Seq=99 Ack=10292 Win=49536 Len=0 TSval=21440742 TSecr=924203646
 18   0.429819 54.230.20.55 -> 172.31.36.109 TCP 1514 [TCP segment of a reassembled PDU]
 19   0.429844 172.31.36.109 -> 54.230.20.55 TCP 66 40705 > http [ACK] Seq=99 Ack=11740 Win=52480 Len=0 TSval=21440765 TSecr=924203655
 20   0.431924 54.230.20.55 -> 172.31.36.109 TCP 7306 [TCP segment of a reassembled PDU]
 21   0.431933 172.31.36.109 -> 54.230.20.55 TCP 66 40705 > http [ACK] Seq=99 Ack=18980 Win=66944 Len=0 TSval=21440765 TSecr=924203655
 22   0.432604 54.230.20.55 -> 172.31.36.109 TCP 5858 [TCP segment of a reassembled PDU]
 23   0.432633 172.31.36.109 -> 54.230.20.55 TCP 66 40705 > http [ACK] Seq=99 Ack=24772 Win=78464 Len=0 TSval=21440765 TSecr=924203655
 24   0.523262 54.230.20.55 -> 172.31.36.109 TCP 2962 [TCP segment of a reassembled PDU]
 25   0.523270 172.31.36.109 -> 54.230.20.55 TCP 66 40705 > http [ACK] Seq=99 Ack=27668 Win=84224 Len=0 TSval=21440788 TSecr=924203664
 26   0.523279 54.230.20.55 -> 172.31.36.109 TCP 2962 [TCP segment of a reassembled PDU]
 27   0.523282 172.31.36.109 -> 54.230.20.55 TCP 66 40705 > http [ACK] Seq=99 Ack=30564 Win=90112 Len=0 TSval=21440788 TSecr=924203664
 28   0.526865 54.230.20.55 -> 172.31.36.109 TCP 4410 [TCP segment of a reassembled PDU]
 29   0.526891 172.31.36.109 -> 54.230.20.55 TCP 66 40705 > http [ACK] Seq=99 Ack=34908 Win=98816 Len=0 TSval=21440789 TSecr=924203665
 30   0.526912 54.230.20.55 -> 172.31.36.109 TCP 2962 [TCP segment of a reassembled PDU]
 31   0.526916 172.31.36.109 -> 54.230.20.55 TCP 66 40705 > http [ACK] Seq=99 Ack=37804 Win=104576 Len=0 TSval=21440789 TSecr=924203665
 32   0.527745 54.230.20.55 -> 172.31.36.109 TCP 4410 [TCP segment of a reassembled PDU]
 33   0.527752 172.31.36.109 -> 54.230.20.55 TCP 66 40705 > http [ACK] Seq=99 Ack=42148 Win=113280 Len=0 TSval=21440789 TSecr=924203665
 34   0.527764 54.230.20.55 -> 172.31.36.109 TCP 7306 [TCP segment of a reassembled PDU]
 35   0.527772 172.31.36.109 -> 54.230.20.55 TCP 66 40705 > http [ACK] Seq=99 Ack=49388 Win=127744 Len=0 TSval=21440789 TSecr=924203665
 36   0.621763 54.230.20.55 -> 172.31.36.109 TCP 2962 [TCP segment of a reassembled PDU]
 37   0.621774 172.31.36.109 -> 54.230.20.55 TCP 66 40705 > http [ACK] Seq=99 Ack=52284 Win=133504 Len=0 TSval=21440813 TSecr=924203674
 38   0.622053 54.230.20.55 -> 172.31.36.109 TCP 11650 [TCP segment of a reassembled PDU]
 39   0.622061 172.31.36.109 -> 54.230.20.55 TCP 66 40705 > http [ACK] Seq=99 Ack=63868 Win=156672 Len=0 TSval=21440813 TSecr=924203674
 40   0.622748 54.230.20.55 -> 172.31.36.109 TCP 1514 [TCP segment of a reassembled PDU]
 41   0.622762 172.31.36.109 -> 54.230.20.55 TCP 66 40705 > http [ACK] Seq=99 Ack=65316 Win=159616 Len=0 TSval=21440813 TSecr=924203674
 42   0.622870 54.230.20.55 -> 172.31.36.109 TCP 2962 [TCP segment of a reassembled PDU]
 43   0.622876 172.31.36.109 -> 54.230.20.55 TCP 66 40705 > http [ACK] Seq=99 Ack=68212 Win=165376 Len=0 TSval=21440813 TSecr=924203674
 44   0.622881 54.230.20.55 -> 172.31.36.109 TCP 1514 [TCP Previous segment not captured] [TCP segment of a reassembled PDU]
 45   0.622884 172.31.36.109 -> 54.230.20.55 TCP 78 [TCP Window Update] 40705 > http [ACK] Seq=99 Ack=68212 Win=168320 Len=0 TSval=21440813 TSecr=924203674 SLE=69660 SRE=71108
 46   0.622889 54.230.20.55 -> 172.31.36.109 TCP 1514 [TCP Out-Of-Order] [TCP segment of a reassembled PDU]
 47   0.622892 172.31.36.109 -> 54.230.20.55 TCP 66 40705 > http [ACK] Seq=99 Ack=71108 Win=171136 Len=0 TSval=21440813 TSecr=924203674
 48   0.623001 54.230.20.55 -> 172.31.36.109 TCP 8754 [TCP segment of a reassembled PDU]
 49   0.623023 172.31.36.109 -> 54.230.20.55 TCP 66 40705 > http [ACK] Seq=99 Ack=79796 Win=183936 Len=0 TSval=21440813 TSecr=924203674
 50   0.623031 54.230.20.55 -> 172.31.36.109 TCP 2962 [TCP segment of a reassembled PDU]
 51   0.623034 172.31.36.109 -> 54.230.20.55 TCP 66 40705 > http [ACK] Seq=99 Ack=82692 Win=181120 Len=0 TSval=21440813 TSecr=924203674
 52   0.717320 54.230.20.55 -> 172.31.36.109 TCP 4410 [TCP segment of a reassembled PDU]
