[Measurement for 1kb at 08:04:18 17.04.2014] 
Tshark:

  1   0.000000  192.168.1.2 -> 54.230.99.193 TCP 66 50631→80 [SYN] Seq=0 Win=8192 Len=0 MSS=1460 WS=256 SACK_PERM=1
  2   0.033178 54.230.99.193 -> 192.168.1.2  TCP 66 80→50631 [SYN, ACK] Seq=0 Ack=1 Win=14600 Len=0 MSS=1400 SACK_PERM=1 WS=128
  3   0.033286  192.168.1.2 -> 54.230.99.193 TCP 54 50631→80 [ACK] Seq=1 Ack=1 Win=65792 Len=0
  4   0.033521  192.168.1.2 -> 54.230.99.193 HTTP 150 GET /1kb HTTP/1.1 
  5   0.060790 54.230.99.193 -> 192.168.1.2  TCP 54 80→50631 [ACK] Seq=1 Ack=97 Win=14720 Len=0
  6   0.062124 54.230.99.193 -> 192.168.1.2  TCP 1454 [TCP segment of a reassembled PDU]
  7   0.066772 54.230.99.193 -> 192.168.1.2  HTTP 132 HTTP/1.1 200 OK  (application/octet-stream)
  8   0.066856  192.168.1.2 -> 54.230.99.193 TCP 54 50631→80 [ACK] Seq=97 Ack=1479 Win=65792 Len=0
  9   0.066948  192.168.1.2 -> 54.230.99.193 TCP 54 50631→80 [FIN, ACK] Seq=97 Ack=1479 Win=65792 Len=0
 10   0.100521 54.230.99.193 -> 192.168.1.2  TCP 54 80→50631 [FIN, ACK] Seq=1479 Ack=98 Win=14720 Len=0
 11   0.100636  192.168.1.2 -> 54.230.99.193 TCP 54 50631→80 [ACK] Seq=98 Ack=1480 Win=65792 Len=0
 12   0.167034  192.168.1.1 -> 239.255.255.250 SSDP 451 NOTIFY * HTTP/1.1 
 13   0.176786  192.168.1.1 -> 239.255.255.250 SSDP 519 NOTIFY * HTTP/1.1 
 14   0.181402  192.168.1.1 -> 239.255.255.250 SSDP 499 NOTIFY * HTTP/1.1 
 15   0.190533  192.168.1.1 -> 239.255.255.250 SSDP 531 NOTIFY * HTTP/1.1 
 16   0.195314  192.168.1.1 -> 239.255.255.250 SSDP 513 NOTIFY * HTTP/1.1 
 17   0.207482  192.168.1.1 -> 239.255.255.250 SSDP 515 NOTIFY * HTTP/1.1 
 18   0.211818  192.168.1.1 -> 239.255.255.250 SSDP 460 NOTIFY * HTTP/1.1 
 19   0.216479  192.168.1.1 -> 239.255.255.250 SSDP 460 NOTIFY * HTTP/1.1 
 20   0.221484  192.168.1.1 -> 239.255.255.250 SSDP 460 NOTIFY * HTTP/1.1 
 21   0.227892  192.168.1.1 -> 239.255.255.250 SSDP 460 NOTIFY * HTTP/1.1 
