[Measurement for 1kb at 01:04:32 17.04.2014] 
Tshark:

  1   0.000000  192.168.1.2 -> 54.230.97.235 TCP 66 49700→80 [SYN] Seq=0 Win=8192 Len=0 MSS=1460 WS=256 SACK_PERM=1
  2   0.043990 54.230.97.235 -> 192.168.1.2  TCP 66 80→49700 [SYN, ACK] Seq=0 Ack=1 Win=14600 Len=0 MSS=1400 SACK_PERM=1 WS=128
  3   0.044106  192.168.1.2 -> 54.230.97.235 TCP 54 49700→80 [ACK] Seq=1 Ack=1 Win=16384 Len=0
  4   0.053940  192.168.1.2 -> 54.230.97.235 HTTP 150 GET /1kb HTTP/1.1 
  5   0.081752 54.230.97.235 -> 192.168.1.2  TCP 54 80→49700 [ACK] Seq=1 Ack=97 Win=14720 Len=0
  6   0.084061 54.230.97.235 -> 192.168.1.2  TCP 1454 [TCP segment of a reassembled PDU]
  7   0.084771 54.230.97.235 -> 192.168.1.2  HTTP 132 HTTP/1.1 200 OK  (application/octet-stream)
  8   0.084846  192.168.1.2 -> 54.230.97.235 TCP 54 49700→80 [ACK] Seq=97 Ack=1479 Win=16384 Len=0
  9   0.084970  192.168.1.2 -> 54.230.97.235 TCP 54 49700→80 [FIN, ACK] Seq=97 Ack=1479 Win=16384 Len=0
 10   0.111874 54.230.97.235 -> 192.168.1.2  TCP 54 80→49700 [FIN, ACK] Seq=1479 Ack=98 Win=14720 Len=0
 11   0.112034  192.168.1.2 -> 54.230.97.235 TCP 54 49700→80 [ACK] Seq=98 Ack=1480 Win=16384 Len=0
