[Measurement for 100kb at 17:41:08 19.41.2014] 
Tshark:

  1   0.000000 172.31.8.238 -> 172.31.0.2   DNS 89 Standard query 0x1ff5  A d3796nkzln59xv.cloudfront.net
  2   0.000027 172.31.8.238 -> 172.31.0.2   DNS 89 Standard query 0x7c03  AAAA d3796nkzln59xv.cloudfront.net
  3   0.000681   172.31.0.2 -> 172.31.8.238 DNS 170 Standard query response 0x7c03 
  4   0.000692   172.31.0.2 -> 172.31.8.238 DNS 217 Standard query response 0x1ff5  A 205.251.215.224 A 54.192.141.180 A 54.192.141.189 A 54.230.140.236 A 54.230.143.14 A 205.251.215.109 A 205.251.215.126 A 205.251.215.155
  5   0.003848 172.31.8.238 -> 205.251.215.224 TCP 74 45504 > http [SYN] Seq=0 Win=26883 Len=0 MSS=8961 SACK_PERM=1 TSval=624096 TSecr=0 WS=128
  6   0.006445 205.251.215.224 -> 172.31.8.238 TCP 74 http > 45504 [SYN, ACK] Seq=0 Ack=1 Win=14480 Len=0 MSS=1460 SACK_PERM=1 TSval=760535881 TSecr=624096 WS=128
  7   0.006460 172.31.8.238 -> 205.251.215.224 TCP 66 45504 > http [ACK] Seq=1 Ack=1 Win=27008 Len=0 TSval=624096 TSecr=760535881
  8   0.006506 172.31.8.238 -> 205.251.215.224 HTTP 164 GET /100kb HTTP/1.1 
  9   0.008972 205.251.215.224 -> 172.31.8.238 TCP 66 http > 45504 [ACK] Seq=1 Ack=99 Win=14592 Len=0 TSval=760535882 TSecr=624096
 10   0.235846 205.251.215.224 -> 172.31.8.238 TCP 1169 [TCP segment of a reassembled PDU]
 11   0.235870 172.31.8.238 -> 205.251.215.224 TCP 66 45504 > http [ACK] Seq=99 Ack=1104 Win=29184 Len=0 TSval=624154 TSecr=760535904
 12   0.235892 205.251.215.224 -> 172.31.8.238 TCP 506 [TCP segment of a reassembled PDU]
 13   0.235896 172.31.8.238 -> 205.251.215.224 TCP 66 45504 > http [ACK] Seq=99 Ack=1544 Win=31360 Len=0 TSval=624154 TSecr=760535904
 14   0.236040 205.251.215.224 -> 172.31.8.238 TCP 2962 [TCP segment of a reassembled PDU]
 15   0.236048 172.31.8.238 -> 205.251.215.224 TCP 66 45504 > http [ACK] Seq=99 Ack=4440 Win=37120 Len=0 TSval=624154 TSecr=760535904
 16   0.236054 205.251.215.224 -> 172.31.8.238 TCP 1514 [TCP segment of a reassembled PDU]
 17   0.236056 172.31.8.238 -> 205.251.215.224 TCP 66 45504 > http [ACK] Seq=99 Ack=5888 Win=40064 Len=0 TSval=624154 TSecr=760535904
 18   0.236188 205.251.215.224 -> 172.31.8.238 TCP 5858 [TCP segment of a reassembled PDU]
 19   0.236196 172.31.8.238 -> 205.251.215.224 TCP 66 45504 > http [ACK] Seq=99 Ack=11680 Win=51584 Len=0 TSval=624154 TSecr=760535904
 20   0.236323 205.251.215.224 -> 172.31.8.238 TCP 1514 [TCP segment of a reassembled PDU]
 21   0.236329 172.31.8.238 -> 205.251.215.224 TCP 66 45504 > http [ACK] Seq=99 Ack=13128 Win=54528 Len=0 TSval=624154 TSecr=760535904
 22   0.238425 205.251.215.224 -> 172.31.8.238 TCP 5858 [TCP segment of a reassembled PDU]
 23   0.238432 172.31.8.238 -> 205.251.215.224 TCP 66 45504 > http [ACK] Seq=99 Ack=18920 Win=66048 Len=0 TSval=624154 TSecr=760535905
 24   0.238697 205.251.215.224 -> 172.31.8.238 TCP 14546 [TCP segment of a reassembled PDU]
 25   0.238706 172.31.8.238 -> 205.251.215.224 TCP 66 45504 > http [ACK] Seq=99 Ack=33400 Win=82048 Len=0 TSval=624154 TSecr=760535905
 26   0.240706 205.251.215.224 -> 172.31.8.238 TCP 5858 [TCP segment of a reassembled PDU]
 27   0.240714 172.31.8.238 -> 205.251.215.224 TCP 66 45504 > http [ACK] Seq=99 Ack=39192 Win=106624 Len=0 TSval=624155 TSecr=760535905
 28   0.241197 205.251.215.224 -> 172.31.8.238 TCP 2798 [TCP segment of a reassembled PDU]
 29   0.241203 172.31.8.238 -> 205.251.215.224 TCP 66 45504 > http [ACK] Seq=99 Ack=41924 Win=109056 Len=0 TSval=624155 TSecr=760535905
 30   0.318551 205.251.215.224 -> 172.31.8.238 TCP 4410 [TCP segment of a reassembled PDU]
 31   0.318573 172.31.8.238 -> 205.251.215.224 TCP 66 45504 > http [ACK] Seq=99 Ack=46268 Win=109056 Len=0 TSval=624174 TSecr=760535913
 32   0.318608 205.251.215.224 -> 172.31.8.238 TCP 4410 [TCP segment of a reassembled PDU]
 33   0.318614 172.31.8.238 -> 205.251.215.224 TCP 66 45504 > http [ACK] Seq=99 Ack=50612 Win=104832 Len=0 TSval=624174 TSecr=760535913
 34   0.318673 205.251.215.224 -> 172.31.8.238 TCP 114 [TCP segment of a reassembled PDU]
 35   0.318680 172.31.8.238 -> 205.251.215.224 TCP 66 45504 > http [ACK] Seq=99 Ack=50660 Win=109056 Len=0 TSval=624174 TSecr=760535913
 36   0.318765 205.251.215.224 -> 172.31.8.238 TCP 8754 [TCP segment of a reassembled PDU]
 37   0.318772 172.31.8.238 -> 205.251.215.224 TCP 66 45504 > http [ACK] Seq=99 Ack=59348 Win=126464 Len=0 TSval=624174 TSecr=760535913
 38   0.318978 205.251.215.224 -> 172.31.8.238 TCP 1514 [TCP segment of a reassembled PDU]
 39   0.318983 172.31.8.238 -> 205.251.215.224 TCP 66 45504 > http [ACK] Seq=99 Ack=60796 Win=129280 Len=0 TSval=624174 TSecr=760535913
 40   0.320911 205.251.215.224 -> 172.31.8.238 TCP 10202 [TCP segment of a reassembled PDU]
 41   0.320919 172.31.8.238 -> 205.251.215.224 TCP 66 45504 > http [ACK] Seq=99 Ack=70932 Win=149632 Len=0 TSval=624175 TSecr=760535913
 42   0.321596 205.251.215.224 -> 172.31.8.238 TCP 2962 [TCP segment of a reassembled PDU]
 43   0.321601 172.31.8.238 -> 205.251.215.224 TCP 66 45504 > http [ACK] Seq=99 Ack=73828 Win=155392 Len=0 TSval=624175 TSecr=760535913
 44   0.321879 205.251.215.224 -> 172.31.8.238 TCP 282 [TCP segment of a reassembled PDU]
 45   0.321882 172.31.8.238 -> 205.251.215.224 TCP 66 45504 > http [ACK] Seq=99 Ack=74044 Win=158336 Len=0 TSval=624175 TSecr=760535913
 46   0.400257 205.251.215.224 -> 172.31.8.238 TCP 1514 [TCP segment of a reassembled PDU]
 47   0.400281 172.31.8.238 -> 205.251.215.224 TCP 66 45504 > http [ACK] Seq=99 Ack=75492 Win=161152 Len=0 TSval=624195 TSecr=760535921
 48   0.400508 205.251.215.224 -> 172.31.8.238 TCP 5858 [TCP segment of a reassembled PDU]
 49   0.400516 172.31.8.238 -> 205.251.215.224 TCP 66 45504 > http [ACK] Seq=99 Ack=81284 Win=172800 Len=0 TSval=624195 TSecr=760535921
 50   0.400662 205.251.215.224 -> 172.31.8.238 TCP 78 [TCP segment of a reassembled PDU]
 51   0.400667 172.31.8.238 -> 205.251.215.224 TCP 66 45504 > http [ACK] Seq=99 Ack=81296 Win=172800 Len=0 TSval=624195 TSecr=760535921
 52   0.400671 205.251.215.224 -> 172.31.8.238 TCP 114 [TCP segment of a reassembled PDU]
 53   0.400674 172.31.8.238 -> 205.251.215.224 TCP 66 45504 > http [ACK] Seq=99 Ack=81344 Win=172800 Len=0 TSval=624195 TSecr=760535921
 54   0.400731 205.251.215.224 -> 172.31.8.238 TCP 1514 [TCP segment of a reassembled PDU]
 55   0.400736 172.31.8.238 -> 205.251.215.224 TCP 66 45504 > http [ACK] Seq=99 Ack=82792 Win=175616 Len=0 TSval=624195 TSecr=760535921
 56   0.400888 205.251.215.224 -> 172.31.8.238 TCP 5858 [TCP segment of a reassembled PDU]
 57   0.400894 172.31.8.238 -> 205.251.215.224 TCP 66 45504 > http [ACK] Seq=99 Ack=88584 Win=187264 Len=0 TSval=624195 TSecr=760535921
 58   0.401244 205.251.215.224 -> 172.31.8.238 TCP 5858 [TCP segment of a reassembled PDU]
 59   0.401250 172.31.8.238 -> 205.251.215.224 TCP 66 45504 > http [ACK] Seq=99 Ack=94376 Win=197760 Len=0 TSval=624195 TSecr=760535921
 60   0.402531 205.251.215.224 -> 172.31.8.238 TCP 4410 [TCP segment of a reassembled PDU]
 61   0.402537 172.31.8.238 -> 205.251.215.224 TCP 66 45504 > http [ACK] Seq=99 Ack=98720 Win=200064 Len=0 TSval=624195 TSecr=760535921
 62   0.402622 205.251.215.224 -> 172.31.8.238 HTTP 4192 HTTP/1.1 200 OK  (application/octet-stream)
 63   0.402627 172.31.8.238 -> 205.251.215.224 TCP 66 45504 > http [ACK] Seq=99 Ack=102846 Win=200064 Len=0 TSval=624195 TSecr=760535921
 64   0.402792 172.31.8.238 -> 205.251.215.224 TCP 66 45504 > http [FIN, ACK] Seq=99 Ack=102846 Win=206592 Len=0 TSval=624195 TSecr=760535921
 65   0.405037 205.251.215.224 -> 172.31.8.238 TCP 66 http > 45504 [FIN, ACK] Seq=102846 Ack=100 Win=14592 Len=0 TSval=760535921 TSecr=624195
 66   0.405048 172.31.8.238 -> 205.251.215.224 TCP 66 45504 > http [ACK] Seq=100 Ack=102847 Win=206592 Len=0 TSval=624196 TSecr=760535921
