[Measurement for 1mb at 14:41:50 20.41.2014] 
Tshark:

  1   0.000000 172.31.8.238 -> 172.31.0.2   DNS 89 Standard query 0x7430  A d1dx94olpiqj0t.cloudfront.net
  2   0.000028 172.31.8.238 -> 172.31.0.2   DNS 89 Standard query 0xc341  AAAA d1dx94olpiqj0t.cloudfront.net
  3   0.000638   172.31.0.2 -> 172.31.8.238 DNS 176 Standard query response 0xc341 
  4   0.000648   172.31.0.2 -> 172.31.8.238 DNS 217 Standard query response 0x7430  A 54.230.118.187 A 54.230.119.91 A 54.239.132.103 A 54.239.132.173 A 54.192.118.228 A 54.230.116.72 A 54.230.116.239 A 54.230.117.156
  5   0.003895 172.31.8.238 -> 54.230.118.187 TCP 74 51247 > http [SYN] Seq=0 Win=26883 Len=0 MSS=8961 SACK_PERM=1 TSval=19534557 TSecr=0 WS=128
  6   0.004743 54.230.118.187 -> 172.31.8.238 TCP 74 http > 51247 [SYN, ACK] Seq=0 Ack=1 Win=14480 Len=0 MSS=1460 SACK_PERM=1 TSval=1685824960 TSecr=19534557 WS=128
  7   0.004757 172.31.8.238 -> 54.230.118.187 TCP 66 51247 > http [ACK] Seq=1 Ack=1 Win=27008 Len=0 TSval=19534557 TSecr=1685824960
  8   0.004792 172.31.8.238 -> 54.230.118.187 HTTP 162 GET /1mb HTTP/1.1 
  9   0.005471 54.230.118.187 -> 172.31.8.238 TCP 66 http > 51247 [ACK] Seq=1 Ack=97 Win=14592 Len=0 TSval=1685824960 TSecr=19534557
 10   0.006821 54.230.118.187 -> 172.31.8.238 TCP 5858 [TCP segment of a reassembled PDU]
 11   0.006832 172.31.8.238 -> 54.230.118.187 TCP 66 51247 > http [ACK] Seq=97 Ack=5793 Win=38528 Len=0 TSval=19534558 TSecr=1685824960
 12   0.006882 54.230.118.187 -> 172.31.8.238 TCP 7306 [TCP segment of a reassembled PDU]
 13   0.006889 172.31.8.238 -> 54.230.118.187 TCP 66 51247 > http [ACK] Seq=97 Ack=13033 Win=52992 Len=0 TSval=19534558 TSecr=1685824960
 14   0.007578 54.230.118.187 -> 172.31.8.238 TCP 1514 [TCP segment of a reassembled PDU]
 15   0.007584 172.31.8.238 -> 54.230.118.187 TCP 66 51247 > http [ACK] Seq=97 Ack=14481 Win=55936 Len=0 TSval=19534558 TSecr=1685824960
 16   0.007675 54.230.118.187 -> 172.31.8.238 TCP 11650 [TCP segment of a reassembled PDU]
 17   0.007684 172.31.8.238 -> 54.230.118.187 TCP 66 51247 > http [ACK] Seq=97 Ack=26065 Win=79104 Len=0 TSval=19534558 TSecr=1685824960
 18   0.008409 54.230.118.187 -> 172.31.8.238 TCP 14546 [TCP segment of a reassembled PDU]
 19   0.008419 172.31.8.238 -> 54.230.118.187 TCP 66 51247 > http [ACK] Seq=97 Ack=40545 Win=94080 Len=0 TSval=19534558 TSecr=1685824961
 20   0.008452 54.230.118.187 -> 172.31.8.238 TCP 5858 [TCP segment of a reassembled PDU]
 21   0.008458 172.31.8.238 -> 54.230.118.187 TCP 66 51247 > http [ACK] Seq=97 Ack=46337 Win=108416 Len=0 TSval=19534558 TSecr=1685824961
 22   0.009153 54.230.118.187 -> 172.31.8.238 TCP 5858 [TCP segment of a reassembled PDU]
 23   0.009159 172.31.8.238 -> 54.230.118.187 TCP 66 51247 > http [ACK] Seq=97 Ack=52129 Win=108416 Len=0 TSval=19534558 TSecr=1685824961
 24   0.009268 54.230.118.187 -> 172.31.8.238 TCP 13098 [TCP segment of a reassembled PDU]
 25   0.009278 172.31.8.238 -> 54.230.118.187 TCP 66 51247 > http [ACK] Seq=97 Ack=65161 Win=96512 Len=0 TSval=19534559 TSecr=1685824961
 26   0.009921 54.230.118.187 -> 172.31.8.238 TCP 11650 [TCP segment of a reassembled PDU]
 27   0.009931 172.31.8.238 -> 54.230.118.187 TCP 66 51247 > http [ACK] Seq=97 Ack=76745 Win=132224 Len=0 TSval=19534559 TSecr=1685824961
 28   0.009989 54.230.118.187 -> 172.31.8.238 TCP 14546 [TCP segment of a reassembled PDU]
 29   0.009999 172.31.8.238 -> 54.230.118.187 TCP 66 51247 > http [ACK] Seq=97 Ack=91225 Win=161152 Len=0 TSval=19534559 TSecr=1685824961
 30   0.010714 54.230.118.187 -> 172.31.8.238 TCP 20338 [TCP segment of a reassembled PDU]
 31   0.010727 172.31.8.238 -> 54.230.118.187 TCP 66 51247 > http [ACK] Seq=97 Ack=111497 Win=201728 Len=0 TSval=19534559 TSecr=1685824961
 32   0.010760 54.230.118.187 -> 172.31.8.238 TCP 8754 [TCP segment of a reassembled PDU]
 33   0.010768 172.31.8.238 -> 54.230.118.187 TCP 66 51247 > http [ACK] Seq=97 Ack=120185 Win=219136 Len=0 TSval=19534559 TSecr=1685824961
 34   0.011455 54.230.118.187 -> 172.31.8.238 TCP 10202 [TCP segment of a reassembled PDU]
 35   0.011464 172.31.8.238 -> 54.230.118.187 TCP 66 51247 > http [ACK] Seq=97 Ack=130321 Win=239360 Len=0 TSval=19534559 TSecr=1685824961
 36   0.011513 54.230.118.187 -> 172.31.8.238 TCP 11650 [TCP segment of a reassembled PDU]
 37   0.011521 172.31.8.238 -> 54.230.118.187 TCP 66 51247 > http [ACK] Seq=97 Ack=141905 Win=262528 Len=0 TSval=19534559 TSecr=1685824961
 38   0.011976 54.230.118.187 -> 172.31.8.238 TCP 14546 [TCP segment of a reassembled PDU]
 39   0.011987 172.31.8.238 -> 54.230.118.187 TCP 66 51247 > http [ACK] Seq=97 Ack=156385 Win=291456 Len=0 TSval=19534559 TSecr=1685824961
 40   0.012289 54.230.118.187 -> 172.31.8.238 TCP 17442 [TCP segment of a reassembled PDU]
 41   0.012300 172.31.8.238 -> 54.230.118.187 TCP 66 51247 > http [ACK] Seq=97 Ack=173761 Win=326272 Len=0 TSval=19534559 TSecr=1685824961
 42   0.012311 54.230.118.187 -> 172.31.8.238 TCP 1514 [TCP segment of a reassembled PDU]
 43   0.012316 172.31.8.238 -> 54.230.118.187 TCP 66 51247 > http [ACK] Seq=97 Ack=175209 Win=329216 Len=0 TSval=19534559 TSecr=1685824961
 44   0.012365 54.230.118.187 -> 172.31.8.238 TCP 1514 [TCP segment of a reassembled PDU]
 45   0.012369 172.31.8.238 -> 54.230.118.187 TCP 66 51247 > http [ACK] Seq=97 Ack=176657 Win=332032 Len=0 TSval=19534559 TSecr=1685824961
 46   0.012493 54.230.118.187 -> 172.31.8.238 TCP 5858 [TCP segment of a reassembled PDU]
 47   0.012499 172.31.8.238 -> 54.230.118.187 TCP 66 51247 > http [ACK] Seq=97 Ack=182449 Win=343680 Len=0 TSval=19534559 TSecr=1685824961
 48   0.012989 54.230.118.187 -> 172.31.8.238 TCP 11650 [TCP segment of a reassembled PDU]
 49   0.012998 172.31.8.238 -> 54.230.118.187 TCP 66 51247 > http [ACK] Seq=97 Ack=194033 Win=366848 Len=0 TSval=19534559 TSecr=1685824961
 50   0.013136 54.230.118.187 -> 172.31.8.238 TCP 26130 [TCP segment of a reassembled PDU]
 51   0.013151 172.31.8.238 -> 54.230.118.187 TCP 66 51247 > http [ACK] Seq=97 Ack=220097 Win=418944 Len=0 TSval=19534559 TSecr=1685824961
 52   0.013159 54.230.118.187 -> 172.31.8.238 TCP 4410 [TCP segment of a reassembled PDU]
 53   0.013162 172.31.8.238 -> 54.230.118.187 TCP 66 51247 > http [ACK] Seq=97 Ack=224441 Win=427648 Len=0 TSval=19534559 TSecr=1685824961
 54   0.013754 54.230.118.187 -> 172.31.8.238 TCP 8754 [TCP segment of a reassembled PDU]
 55   0.013763 172.31.8.238 -> 54.230.118.187 TCP 66 51247 > http [ACK] Seq=97 Ack=233129 Win=445056 Len=0 TSval=19534560 TSecr=1685824961
 56   0.013920 54.230.118.187 -> 172.31.8.238 TCP 26130 [TCP segment of a reassembled PDU]
 57   0.013936 172.31.8.238 -> 54.230.118.187 TCP 66 51247 > http [ACK] Seq=97 Ack=259193 Win=497152 Len=0 TSval=19534560 TSecr=1685824961
 58   0.013944 54.230.118.187 -> 172.31.8.238 TCP 2962 [TCP segment of a reassembled PDU]
 59   0.013948 172.31.8.238 -> 54.230.118.187 TCP 66 51247 > http [ACK] Seq=97 Ack=262089 Win=502912 Len=0 TSval=19534560 TSecr=1685824961
 60   0.014262 54.230.118.187 -> 172.31.8.238 TCP 18890 [TCP segment of a reassembled PDU]
 61   0.014274 172.31.8.238 -> 54.230.118.187 TCP 66 51247 > http [ACK] Seq=97 Ack=280913 Win=540544 Len=0 TSval=19534560 TSecr=1685824961
 62   0.014468 54.230.118.187 -> 172.31.8.238 TCP 2962 [TCP segment of a reassembled PDU]
 63   0.014474 172.31.8.238 -> 54.230.118.187 TCP 66 51247 > http [ACK] Seq=97 Ack=283809 Win=546304 Len=0 TSval=19534560 TSecr=1685824961
 64   0.014650 54.230.118.187 -> 172.31.8.238 TCP 24682 [TCP segment of a reassembled PDU]
 65   0.014664 172.31.8.238 -> 54.230.118.187 TCP 66 51247 > http [ACK] Seq=97 Ack=308425 Win=595584 Len=0 TSval=19534560 TSecr=1685824961
 66   0.014888 54.230.118.187 -> 172.31.8.238 TCP 24682 [TCP segment of a reassembled PDU]
 67   0.014902 172.31.8.238 -> 54.230.118.187 TCP 66 51247 > http [ACK] Seq=97 Ack=333041 Win=644864 Len=0 TSval=19534560 TSecr=1685824961
 68   0.015274 54.230.118.187 -> 172.31.8.238 TCP 7306 [TCP segment of a reassembled PDU]
 69   0.015281 172.31.8.238 -> 54.230.118.187 TCP 66 51247 > http [ACK] Seq=97 Ack=340281 Win=659328 Len=0 TSval=19534560 TSecr=1685824961
 70   0.015436 54.230.118.187 -> 172.31.8.238 TCP 23234 [TCP segment of a reassembled PDU]
 71   0.015449 172.31.8.238 -> 54.230.118.187 TCP 66 51247 > http [ACK] Seq=97 Ack=363449 Win=705664 Len=0 TSval=19534560 TSecr=1685824961
 72   0.015662 54.230.118.187 -> 172.31.8.238 TCP 17442 [TCP segment of a reassembled PDU]
 73   0.015674 172.31.8.238 -> 54.230.118.187 TCP 66 51247 > http [ACK] Seq=97 Ack=380825 Win=740352 Len=0 TSval=19534560 TSecr=1685824961
 74   0.016077 54.230.118.187 -> 172.31.8.238 TCP 1514 [TCP segment of a reassembled PDU]
 75   0.016095 172.31.8.238 -> 54.230.118.187 TCP 66 51247 > http [ACK] Seq=97 Ack=382273 Win=743296 Len=0 TSval=19534560 TSecr=1685824961
 76   0.016234 54.230.118.187 -> 172.31.8.238 TCP 26130 [TCP segment of a reassembled PDU]
 77   0.016248 172.31.8.238 -> 54.230.118.187 TCP 66 51247 > http [ACK] Seq=97 Ack=408337 Win=795392 Len=0 TSval=19534560 TSecr=1685824961
 78   0.016302 54.230.118.187 -> 172.31.8.238 TCP 14546 [TCP segment of a reassembled PDU]
 79   0.016312 172.31.8.238 -> 54.230.118.187 TCP 66 51247 > http [ACK] Seq=97 Ack=422817 Win=824320 Len=0 TSval=19534560 TSecr=1685824961
 80   0.016803 54.230.118.187 -> 172.31.8.238 TCP 2962 [TCP segment of a reassembled PDU]
 81   0.016808 172.31.8.238 -> 54.230.118.187 TCP 66 51247 > http [ACK] Seq=97 Ack=425713 Win=830208 Len=0 TSval=19534560 TSecr=1685824961
 82   0.016971 54.230.118.187 -> 172.31.8.238 TCP 17442 [TCP segment of a reassembled PDU]
 83   0.016981 172.31.8.238 -> 54.230.118.187 TCP 66 51247 > http [ACK] Seq=97 Ack=443089 Win=864896 Len=0 TSval=19534560 TSecr=1685824961
 84   0.017005 54.230.118.187 -> 172.31.8.238 TCP 8754 [TCP segment of a reassembled PDU]
 85   0.017011 172.31.8.238 -> 54.230.118.187 TCP 66 51247 > http [ACK] Seq=97 Ack=451777 Win=882304 Len=0 TSval=19534560 TSecr=1685824961
 86   0.017078 54.230.118.187 -> 172.31.8.238 TCP 20338 [TCP segment of a reassembled PDU]
 87   0.017089 172.31.8.238 -> 54.230.118.187 TCP 66 51247 > http [ACK] Seq=97 Ack=472049 Win=922880 Len=0 TSval=19534560 TSecr=1685824961
 88   0.017591 54.230.118.187 -> 172.31.8.238 TCP 2962 [TCP segment of a reassembled PDU]
 89   0.017609 172.31.8.238 -> 54.230.118.187 TCP 66 51247 > http [ACK] Seq=97 Ack=474945 Win=928640 Len=0 TSval=19534561 TSecr=1685824961
 90   0.017776 54.230.118.187 -> 172.31.8.238 TCP 26130 [TCP segment of a reassembled PDU]
 91   0.017805 172.31.8.238 -> 54.230.118.187 TCP 66 51247 > http [ACK] Seq=97 Ack=501009 Win=921344 Len=0 TSval=19534561 TSecr=1685824961
 92   0.017866 54.230.118.187 -> 172.31.8.238 TCP 26130 [TCP segment of a reassembled PDU]
 93   0.017879 172.31.8.238 -> 54.230.118.187 TCP 66 51247 > http [ACK] Seq=97 Ack=527073 Win=921344 Len=0 TSval=19534561 TSecr=1685824961
 94   0.017947 54.230.118.187 -> 172.31.8.238 TCP 15994 [TCP segment of a reassembled PDU]
 95   0.017959 172.31.8.238 -> 54.230.118.187 TCP 66 51247 > http [ACK] Seq=97 Ack=543001 Win=937856 Len=0 TSval=19534561 TSecr=1685824961
 96   0.018401 54.230.118.187 -> 172.31.8.238 TCP 5858 [TCP segment of a reassembled PDU]
 97   0.018408 172.31.8.238 -> 54.230.118.187 TCP 66 51247 > http [ACK] Seq=97 Ack=548793 Win=954624 Len=0 TSval=19534561 TSecr=1685824962
 98   0.018551 54.230.118.187 -> 172.31.8.238 TCP 26130 [TCP segment of a reassembled PDU]
 99   0.018564 172.31.8.238 -> 54.230.118.187 TCP 66 51247 > http [ACK] Seq=97 Ack=574857 Win=928640 Len=0 TSval=19534561 TSecr=1685824962
100   0.018738 54.230.118.187 -> 172.31.8.238 TCP 1514 [TCP segment of a reassembled PDU]
101   0.018743 172.31.8.238 -> 54.230.118.187 TCP 66 51247 > http [ACK] Seq=97 Ack=576305 Win=958336 Len=0 TSval=19534561 TSecr=1685824962
102   0.018852 54.230.118.187 -> 172.31.8.238 TCP 26130 [TCP segment of a reassembled PDU]
103   0.018865 172.31.8.238 -> 54.230.118.187 TCP 66 51247 > http [ACK] Seq=97 Ack=602369 Win=932352 Len=0 TSval=19534561 TSecr=1685824962
104   0.019140 54.230.118.187 -> 172.31.8.238 TCP 5858 [TCP segment of a reassembled PDU]
105   0.019147 172.31.8.238 -> 54.230.118.187 TCP 66 51247 > http [ACK] Seq=97 Ack=608161 Win=954624 Len=0 TSval=19534561 TSecr=1685824962
106   0.019312 54.230.118.187 -> 172.31.8.238 TCP 26130 [TCP segment of a reassembled PDU]
107   0.019337 172.31.8.238 -> 54.230.118.187 TCP 66 51247 > http [ACK] Seq=97 Ack=634225 Win=928640 Len=0 TSval=19534561 TSecr=1685824962
108   0.019346 54.230.118.187 -> 172.31.8.238 TCP 7306 [TCP segment of a reassembled PDU]
109   0.019364 172.31.8.238 -> 54.230.118.187 TCP 66 51247 > http [ACK] Seq=97 Ack=641465 Win=952192 Len=0 TSval=19534561 TSecr=1685824962
110   0.019428 54.230.118.187 -> 172.31.8.238 TCP 10202 [TCP segment of a reassembled PDU]
111   0.019446 172.31.8.238 -> 54.230.118.187 TCP 66 51247 > http [ACK] Seq=97 Ack=651601 Win=958336 Len=0 TSval=19534561 TSecr=1685824962
112   0.019578 54.230.118.187 -> 172.31.8.238 TCP 26130 [TCP segment of a reassembled PDU]
113   0.019607 54.230.118.187 -> 172.31.8.238 TCP 7306 [TCP segment of a reassembled PDU]
114   0.019613 172.31.8.238 -> 54.230.118.187 TCP 66 51247 > http [ACK] Seq=97 Ack=677665 Win=932352 Len=0 TSval=19534561 TSecr=1685824962
115   0.019627 172.31.8.238 -> 54.230.118.187 TCP 66 51247 > http [ACK] Seq=97 Ack=684905 Win=952192 Len=0 TSval=19534561 TSecr=1685824962
116   0.019914 54.230.118.187 -> 172.31.8.238 TCP 8754 [TCP segment of a reassembled PDU]
117   0.019931 172.31.8.238 -> 54.230.118.187 TCP 66 51247 > http [ACK] Seq=97 Ack=693593 Win=958336 Len=0 TSval=19534561 TSecr=1685824962
118   0.020056 54.230.118.187 -> 172.31.8.238 TCP 13098 [TCP segment of a reassembled PDU]
119   0.020075 172.31.8.238 -> 54.230.118.187 TCP 66 51247 > http [ACK] Seq=97 Ack=706625 Win=958336 Len=0 TSval=19534561 TSecr=1685824962
120   0.020183 54.230.118.187 -> 172.31.8.238 TCP 11650 [TCP segment of a reassembled PDU]
121   0.020251 172.31.8.238 -> 54.230.118.187 TCP 66 51247 > http [ACK] Seq=97 Ack=718209 Win=958336 Len=0 TSval=19534561 TSecr=1685824962
122   0.020370 54.230.118.187 -> 172.31.8.238 TCP 26130 [TCP segment of a reassembled PDU]
123   0.020411 54.230.118.187 -> 172.31.8.238 TCP 24682 [TCP segment of a reassembled PDU]
124   0.020423 172.31.8.238 -> 54.230.118.187 TCP 66 51247 > http [ACK] Seq=97 Ack=744273 Win=932352 Len=0 TSval=19534561 TSecr=1685824962
125   0.020432 54.230.118.187 -> 172.31.8.238 TCP 1514 [TCP segment of a reassembled PDU]
126   0.020446 172.31.8.238 -> 54.230.118.187 TCP 66 51247 > http [ACK] Seq=97 Ack=770337 Win=921216 Len=0 TSval=19534561 TSecr=1685824962
127   0.020481 54.230.118.187 -> 172.31.8.238 TCP 1514 [TCP segment of a reassembled PDU]
128   0.020948 54.230.118.187 -> 172.31.8.238 TCP 4410 [TCP segment of a reassembled PDU]
129   0.020954 172.31.8.238 -> 54.230.118.187 TCP 66 51247 > http [ACK] Seq=97 Ack=776129 Win=956928 Len=0 TSval=19534561 TSecr=1685824962
130   0.021118 54.230.118.187 -> 172.31.8.238 TCP 26130 [TCP segment of a reassembled PDU]
131   0.021143 172.31.8.238 -> 54.230.118.187 TCP 66 51247 > http [ACK] Seq=97 Ack=802193 Win=930944 Len=0 TSval=19534561 TSecr=1685824962
132   0.021186 54.230.118.187 -> 172.31.8.238 TCP 26130 [TCP segment of a reassembled PDU]
133   0.021211 172.31.8.238 -> 54.230.118.187 TCP 66 51247 > http [ACK] Seq=97 Ack=828257 Win=958336 Len=0 TSval=19534562 TSecr=1685824962
134   0.021238 54.230.118.187 -> 172.31.8.238 TCP 8754 [TCP segment of a reassembled PDU]
135   0.021244 172.31.8.238 -> 54.230.118.187 TCP 66 51247 > http [ACK] Seq=97 Ack=836945 Win=975616 Len=0 TSval=19534562 TSecr=1685824962
136   0.021520 54.230.118.187 -> 172.31.8.238 TCP 7306 [TCP segment of a reassembled PDU]
137   0.021527 172.31.8.238 -> 54.230.118.187 TCP 66 51247 > http [ACK] Seq=97 Ack=844185 Win=990208 Len=0 TSval=19534562 TSecr=1685824962
138   0.021705 54.230.118.187 -> 172.31.8.238 TCP 26130 [TCP segment of a reassembled PDU]
139   0.021718 172.31.8.238 -> 54.230.118.187 TCP 66 51247 > http [ACK] Seq=97 Ack=870249 Win=1042304 Len=0 TSval=19534562 TSecr=1685824962
140   0.021727 54.230.118.187 -> 172.31.8.238 TCP 5858 [TCP segment of a reassembled PDU]
141   0.021731 172.31.8.238 -> 54.230.118.187 TCP 66 51247 > http [ACK] Seq=97 Ack=876041 Win=1053824 Len=0 TSval=19534562 TSecr=1685824962
142   0.021870 54.230.118.187 -> 172.31.8.238 TCP 18890 [TCP segment of a reassembled PDU]
143   0.021881 172.31.8.238 -> 54.230.118.187 TCP 66 51247 > http [ACK] Seq=97 Ack=894865 Win=1091456 Len=0 TSval=19534562 TSecr=1685824962
144   0.021919 54.230.118.187 -> 172.31.8.238 TCP 7306 [TCP segment of a reassembled PDU]
145   0.021926 172.31.8.238 -> 54.230.118.187 TCP 66 51247 > http [ACK] Seq=97 Ack=902105 Win=1106048 Len=0 TSval=19534562 TSecr=1685824962
146   0.022048 54.230.118.187 -> 172.31.8.238 TCP 7306 [TCP segment of a reassembled PDU]
147   0.022055 172.31.8.238 -> 54.230.118.187 TCP 66 51247 > http [ACK] Seq=97 Ack=909345 Win=1120512 Len=0 TSval=19534562 TSecr=1685824962
148   0.022221 54.230.118.187 -> 172.31.8.238 TCP 26130 [TCP segment of a reassembled PDU]
149   0.022235 172.31.8.238 -> 54.230.118.187 TCP 66 51247 > http [ACK] Seq=97 Ack=935409 Win=1172608 Len=0 TSval=19534562 TSecr=1685824962
150   0.022287 54.230.118.187 -> 172.31.8.238 TCP 26130 [TCP segment of a reassembled PDU]
151   0.022299 172.31.8.238 -> 54.230.118.187 TCP 66 51247 > http [ACK] Seq=97 Ack=961473 Win=1209600 Len=0 TSval=19534562 TSecr=1685824962
152   0.022338 54.230.118.187 -> 172.31.8.238 TCP 5858 [TCP segment of a reassembled PDU]
153   0.022462 172.31.8.238 -> 54.230.118.187 TCP 66 51247 > http [ACK] Seq=97 Ack=967265 Win=1203840 Len=0 TSval=19534562 TSecr=1685824962
154   0.022656 54.230.118.187 -> 172.31.8.238 TCP 26130 [TCP segment of a reassembled PDU]
155   0.022670 172.31.8.238 -> 54.230.118.187 TCP 66 51247 > http [ACK] Seq=97 Ack=993329 Win=1209600 Len=0 TSval=19534562 TSecr=1685824962
156   0.022696 54.230.118.187 -> 172.31.8.238 TCP 11650 [TCP segment of a reassembled PDU]
157   0.022728 172.31.8.238 -> 54.230.118.187 TCP 66 51247 > http [ACK] Seq=97 Ack=1004913 Win=1224704 Len=0 TSval=19534562 TSecr=1685824962
158   0.022996 54.230.118.187 -> 172.31.8.238 TCP 26130 [TCP segment of a reassembled PDU]
159   0.023034 172.31.8.238 -> 54.230.118.187 TCP 66 51247 > http [ACK] Seq=97 Ack=1030977 Win=1209600 Len=0 TSval=19534562 TSecr=1685824962
160   0.023059 54.230.118.187 -> 172.31.8.238 HTTP 18123 HTTP/1.1 200 OK  (application/octet-stream)
161   0.023066 172.31.8.238 -> 54.230.118.187 TCP 66 51247 > http [ACK] Seq=97 Ack=1049034 Win=1221504 Len=0 TSval=19534562 TSecr=1685824962
162   0.023196 172.31.8.238 -> 54.230.118.187 TCP 66 51247 > http [FIN, ACK] Seq=97 Ack=1049034 Win=1224704 Len=0 TSval=19534562 TSecr=1685824962
163   0.023617 54.230.118.187 -> 172.31.8.238 TCP 66 http > 51247 [FIN, ACK] Seq=1049034 Ack=98 Win=14592 Len=0 TSval=1685824962 TSecr=19534562
164   0.023625 172.31.8.238 -> 54.230.118.187 TCP 66 51247 > http [ACK] Seq=98 Ack=1049035 Win=1224704 Len=0 TSval=19534562 TSecr=1685824962
