[Measurement for 1mb at 04:41:50 20.41.2014] 
Tshark:

  1   0.000000 172.31.8.238 -> 172.31.0.2   DNS 89 Standard query 0xdebf  A d1dx94olpiqj0t.cloudfront.net
  2   0.000029 172.31.8.238 -> 172.31.0.2   DNS 89 Standard query 0xfc7d  AAAA d1dx94olpiqj0t.cloudfront.net
  3   0.000620   172.31.0.2 -> 172.31.8.238 DNS 176 Standard query response 0xfc7d 
  4   0.000632   172.31.0.2 -> 172.31.8.238 DNS 217 Standard query response 0xdebf  A 54.192.118.219 A 54.230.116.82 A 54.230.117.10 A 54.230.117.198 A 54.230.119.11 A 54.230.119.55 A 54.230.119.165 A 54.239.132.196
  5   0.003946 172.31.8.238 -> 54.192.118.219 TCP 74 44233 > http [SYN] Seq=0 Win=26883 Len=0 MSS=8961 SACK_PERM=1 TSval=10534563 TSecr=0 WS=128
  6   0.004626 54.192.118.219 -> 172.31.8.238 TCP 74 http > 44233 [SYN, ACK] Seq=0 Ack=1 Win=14480 Len=0 MSS=1460 SACK_PERM=1 TSval=1683249915 TSecr=10534563 WS=128
  7   0.004641 172.31.8.238 -> 54.192.118.219 TCP 66 44233 > http [ACK] Seq=1 Ack=1 Win=27008 Len=0 TSval=10534564 TSecr=1683249915
  8   0.004678 172.31.8.238 -> 54.192.118.219 HTTP 162 GET /1mb HTTP/1.1 
  9   0.005357 54.192.118.219 -> 172.31.8.238 TCP 66 http > 44233 [ACK] Seq=1 Ack=97 Win=14592 Len=0 TSval=1683249915 TSecr=10534564
 10   0.007933 54.192.118.219 -> 172.31.8.238 TCP 7306 [TCP segment of a reassembled PDU]
 11   0.007942 172.31.8.238 -> 54.192.118.219 TCP 66 44233 > http [ACK] Seq=97 Ack=7241 Win=41472 Len=0 TSval=10534564 TSecr=1683249915
 12   0.007987 54.192.118.219 -> 172.31.8.238 TCP 5858 [TCP segment of a reassembled PDU]
 13   0.007995 172.31.8.238 -> 54.192.118.219 TCP 66 44233 > http [ACK] Seq=97 Ack=13033 Win=52992 Len=0 TSval=10534564 TSecr=1683249915
 14   0.008533 54.192.118.219 -> 172.31.8.238 TCP 10202 [TCP segment of a reassembled PDU]
 15   0.008543 172.31.8.238 -> 54.192.118.219 TCP 66 44233 > http [ACK] Seq=97 Ack=23169 Win=73344 Len=0 TSval=10534565 TSecr=1683249915
 16   0.008704 54.192.118.219 -> 172.31.8.238 TCP 2962 [TCP segment of a reassembled PDU]
 17   0.008709 172.31.8.238 -> 54.192.118.219 TCP 66 44233 > http [ACK] Seq=97 Ack=26065 Win=79104 Len=0 TSval=10534565 TSecr=1683249915
 18   0.009201 54.192.118.219 -> 172.31.8.238 TCP 5858 [TCP segment of a reassembled PDU]
 19   0.009208 172.31.8.238 -> 54.192.118.219 TCP 66 44233 > http [ACK] Seq=97 Ack=31857 Win=90624 Len=0 TSval=10534565 TSecr=1683249915
 20   0.009331 54.192.118.219 -> 172.31.8.238 TCP 14546 [TCP segment of a reassembled PDU]
 21   0.009341 172.31.8.238 -> 54.192.118.219 TCP 66 44233 > http [ACK] Seq=97 Ack=46337 Win=94080 Len=0 TSval=10534565 TSecr=1683249915
 22   0.009694 54.192.118.219 -> 172.31.8.238 TCP 5858 [TCP segment of a reassembled PDU]
 23   0.009701 172.31.8.238 -> 54.192.118.219 TCP 66 44233 > http [ACK] Seq=97 Ack=52129 Win=108416 Len=0 TSval=10534565 TSecr=1683249915
 24   0.009944 54.192.118.219 -> 172.31.8.238 TCP 2962 [TCP segment of a reassembled PDU]
 25   0.009949 172.31.8.238 -> 54.192.118.219 TCP 66 44233 > http [ACK] Seq=97 Ack=55025 Win=109056 Len=0 TSval=10534565 TSecr=1683249915
 26   0.010058 54.192.118.219 -> 172.31.8.238 TCP 10202 [TCP segment of a reassembled PDU]
 27   0.010065 172.31.8.238 -> 54.192.118.219 TCP 66 44233 > http [ACK] Seq=97 Ack=65161 Win=101248 Len=0 TSval=10534565 TSecr=1683249915
 28   0.010203 54.192.118.219 -> 172.31.8.238 TCP 4410 [TCP segment of a reassembled PDU]
 29   0.010208 172.31.8.238 -> 54.192.118.219 TCP 66 44233 > http [ACK] Seq=97 Ack=69505 Win=109056 Len=0 TSval=10534565 TSecr=1683249915
 30   0.010299 54.192.118.219 -> 172.31.8.238 TCP 7306 [TCP segment of a reassembled PDU]
 31   0.010306 172.31.8.238 -> 54.192.118.219 TCP 66 44233 > http [ACK] Seq=97 Ack=76745 Win=105984 Len=0 TSval=10534565 TSecr=1683249915
 32   0.010445 54.192.118.219 -> 172.31.8.238 TCP 1514 [TCP segment of a reassembled PDU]
 33   0.010449 172.31.8.238 -> 54.192.118.219 TCP 66 44233 > http [ACK] Seq=97 Ack=78193 Win=109056 Len=0 TSval=10534565 TSecr=1683249915
 34   0.010701 54.192.118.219 -> 172.31.8.238 TCP 4410 [TCP segment of a reassembled PDU]
 35   0.010707 172.31.8.238 -> 54.192.118.219 TCP 66 44233 > http [ACK] Seq=97 Ack=82537 Win=109056 Len=0 TSval=10534565 TSecr=1683249915
 36   0.010803 54.192.118.219 -> 172.31.8.238 TCP 10202 [TCP segment of a reassembled PDU]
 37   0.010810 172.31.8.238 -> 54.192.118.219 TCP 66 44233 > http [ACK] Seq=97 Ack=92673 Win=101248 Len=0 TSval=10534565 TSecr=1683249915
 38   0.011040 54.192.118.219 -> 172.31.8.238 TCP 11650 [TCP segment of a reassembled PDU]
 39   0.011061 172.31.8.238 -> 54.192.118.219 TCP 66 44233 > http [ACK] Seq=97 Ack=104257 Win=109056 Len=0 TSval=10534565 TSecr=1683249915
 40   0.011298 54.192.118.219 -> 172.31.8.238 TCP 11650 [TCP segment of a reassembled PDU]
 41   0.011318 172.31.8.238 -> 54.192.118.219 TCP 66 44233 > http [ACK] Seq=97 Ack=115841 Win=109056 Len=0 TSval=10534565 TSecr=1683249915
 42   0.011573 54.192.118.219 -> 172.31.8.238 TCP 11650 [TCP segment of a reassembled PDU]
 43   0.011748 54.192.118.219 -> 172.31.8.238 TCP 2962 [TCP segment of a reassembled PDU]
 44   0.011827 172.31.8.238 -> 54.192.118.219 TCP 66 44233 > http [ACK] Seq=97 Ack=130321 Win=109056 Len=0 TSval=10534565 TSecr=1683249915
 45   0.012105 54.192.118.219 -> 172.31.8.238 TCP 23234 [TCP segment of a reassembled PDU]
 46   0.012134 172.31.8.238 -> 54.192.118.219 TCP 66 44233 > http [ACK] Seq=97 Ack=153489 Win=109056 Len=0 TSval=10534566 TSecr=1683249915
 47   0.012489 54.192.118.219 -> 172.31.8.238 TCP 2962 [TCP segment of a reassembled PDU]
 48   0.012494 172.31.8.238 -> 54.192.118.219 TCP 66 44233 > http [ACK] Seq=97 Ack=156385 Win=114816 Len=0 TSval=10534566 TSecr=1683249916
 49   0.012590 54.192.118.219 -> 172.31.8.238 TCP 13098 [TCP segment of a reassembled PDU]
 50   0.012599 172.31.8.238 -> 54.192.118.219 TCP 66 44233 > http [ACK] Seq=97 Ack=169417 Win=140928 Len=0 TSval=10534566 TSecr=1683249916
 51   0.012841 54.192.118.219 -> 172.31.8.238 TCP 13098 [TCP segment of a reassembled PDU]
 52   0.012850 172.31.8.238 -> 54.192.118.219 TCP 66 44233 > http [ACK] Seq=97 Ack=182449 Win=167040 Len=0 TSval=10534566 TSecr=1683249916
 53   0.013135 54.192.118.219 -> 172.31.8.238 TCP 15994 [TCP segment of a reassembled PDU]
 54   0.013146 172.31.8.238 -> 54.192.118.219 TCP 66 44233 > http [ACK] Seq=97 Ack=198377 Win=198784 Len=0 TSval=10534566 TSecr=1683249916
 55   0.013286 54.192.118.219 -> 172.31.8.238 TCP 10202 [TCP segment of a reassembled PDU]
 56   0.013294 172.31.8.238 -> 54.192.118.219 TCP 66 44233 > http [ACK] Seq=97 Ack=208513 Win=219136 Len=0 TSval=10534566 TSecr=1683249916
 57   0.013654 54.192.118.219 -> 172.31.8.238 TCP 18890 [TCP segment of a reassembled PDU]
 58   0.013664 172.31.8.238 -> 54.192.118.219 TCP 66 44233 > http [ACK] Seq=97 Ack=227337 Win=256768 Len=0 TSval=10534566 TSecr=1683249916
 59   0.013790 54.192.118.219 -> 172.31.8.238 TCP 5858 [TCP segment of a reassembled PDU]
 60   0.013797 172.31.8.238 -> 54.192.118.219 TCP 66 44233 > http [ACK] Seq=97 Ack=233129 Win=268288 Len=0 TSval=10534566 TSecr=1683249916
 61   0.013945 54.192.118.219 -> 172.31.8.238 TCP 21786 [TCP segment of a reassembled PDU]
 62   0.013957 172.31.8.238 -> 54.192.118.219 TCP 66 44233 > http [ACK] Seq=97 Ack=254849 Win=311808 Len=0 TSval=10534566 TSecr=1683249916
 63   0.014332 54.192.118.219 -> 172.31.8.238 TCP 8754 [TCP segment of a reassembled PDU]
 64   0.014340 172.31.8.238 -> 54.192.118.219 TCP 66 44233 > http [ACK] Seq=97 Ack=263537 Win=329216 Len=0 TSval=10534566 TSecr=1683249916
 65   0.014471 54.192.118.219 -> 172.31.8.238 TCP 13098 [TCP segment of a reassembled PDU]
 66   0.014480 172.31.8.238 -> 54.192.118.219 TCP 66 44233 > http [ACK] Seq=97 Ack=276569 Win=355200 Len=0 TSval=10534566 TSecr=1683249916
 67   0.014576 54.192.118.219 -> 172.31.8.238 TCP 2962 [TCP segment of a reassembled PDU]
 68   0.014581 172.31.8.238 -> 54.192.118.219 TCP 66 44233 > http [ACK] Seq=97 Ack=279465 Win=360960 Len=0 TSval=10534566 TSecr=1683249916
 69   0.014732 54.192.118.219 -> 172.31.8.238 TCP 21786 [TCP segment of a reassembled PDU]
 70   0.014744 172.31.8.238 -> 54.192.118.219 TCP 66 44233 > http [ACK] Seq=97 Ack=301185 Win=404480 Len=0 TSval=10534566 TSecr=1683249916
 71   0.015091 54.192.118.219 -> 172.31.8.238 TCP 7306 [TCP segment of a reassembled PDU]
 72   0.015098 172.31.8.238 -> 54.192.118.219 TCP 66 44233 > http [ACK] Seq=97 Ack=308425 Win=418944 Len=0 TSval=10534566 TSecr=1683249916
 73   0.015251 54.192.118.219 -> 172.31.8.238 TCP 23234 [TCP segment of a reassembled PDU]
 74   0.015263 172.31.8.238 -> 54.192.118.219 TCP 66 44233 > http [ACK] Seq=97 Ack=331593 Win=465280 Len=0 TSval=10534566 TSecr=1683249916
 75   0.015491 54.192.118.219 -> 172.31.8.238 TCP 23234 [TCP segment of a reassembled PDU]
 76   0.015503 172.31.8.238 -> 54.192.118.219 TCP 66 44233 > http [ACK] Seq=97 Ack=354761 Win=511616 Len=0 TSval=10534566 TSecr=1683249916
 77   0.015841 54.192.118.219 -> 172.31.8.238 TCP 7306 [TCP segment of a reassembled PDU]
 78   0.015848 172.31.8.238 -> 54.192.118.219 TCP 66 44233 > http [ACK] Seq=97 Ack=362001 Win=526080 Len=0 TSval=10534566 TSecr=1683249916
 79   0.016029 54.192.118.219 -> 172.31.8.238 TCP 26130 [TCP segment of a reassembled PDU]
 80   0.016043 172.31.8.238 -> 54.192.118.219 TCP 66 44233 > http [ACK] Seq=97 Ack=388065 Win=578176 Len=0 TSval=10534566 TSecr=1683249916
 81   0.016059 54.192.118.219 -> 172.31.8.238 TCP 4410 [TCP segment of a reassembled PDU]
 82   0.016063 172.31.8.238 -> 54.192.118.219 TCP 66 44233 > http [ACK] Seq=97 Ack=392409 Win=586880 Len=0 TSval=10534566 TSecr=1683249916
 83   0.016134 54.192.118.219 -> 172.31.8.238 TCP 8754 [TCP segment of a reassembled PDU]
 84   0.016142 172.31.8.238 -> 54.192.118.219 TCP 66 44233 > http [ACK] Seq=97 Ack=401097 Win=604288 Len=0 TSval=10534567 TSecr=1683249916
 85   0.016260 54.192.118.219 -> 172.31.8.238 TCP 7306 [TCP segment of a reassembled PDU]
 86   0.016267 172.31.8.238 -> 54.192.118.219 TCP 66 44233 > http [ACK] Seq=97 Ack=408337 Win=618752 Len=0 TSval=10534567 TSecr=1683249916
 87   0.016623 54.192.118.219 -> 172.31.8.238 TCP 10202 [TCP segment of a reassembled PDU]
 88   0.016630 172.31.8.238 -> 54.192.118.219 TCP 66 44233 > http [ACK] Seq=97 Ack=418473 Win=638976 Len=0 TSval=10534567 TSecr=1683249916
 89   0.016808 54.192.118.219 -> 172.31.8.238 TCP 26130 [TCP segment of a reassembled PDU]
 90   0.016821 172.31.8.238 -> 54.192.118.219 TCP 66 44233 > http [ACK] Seq=97 Ack=444537 Win=691200 Len=0 TSval=10534567 TSecr=1683249916
 91   0.016856 54.192.118.219 -> 172.31.8.238 TCP 8754 [TCP segment of a reassembled PDU]
 92   0.016862 172.31.8.238 -> 54.192.118.219 TCP 66 44233 > http [ACK] Seq=97 Ack=453225 Win=708480 Len=0 TSval=10534567 TSecr=1683249916
 93   0.016917 54.192.118.219 -> 172.31.8.238 TCP 8754 [TCP segment of a reassembled PDU]
 94   0.016925 172.31.8.238 -> 54.192.118.219 TCP 66 44233 > http [ACK] Seq=97 Ack=461913 Win=725888 Len=0 TSval=10534567 TSecr=1683249916
 95   0.017246 54.192.118.219 -> 172.31.8.238 TCP 15994 [TCP segment of a reassembled PDU]
 96   0.017255 172.31.8.238 -> 54.192.118.219 TCP 66 44233 > http [ACK] Seq=97 Ack=477841 Win=757760 Len=0 TSval=10534567 TSecr=1683249916
 97   0.017417 54.192.118.219 -> 172.31.8.238 TCP 26130 [TCP segment of a reassembled PDU]
 98   0.017431 172.31.8.238 -> 54.192.118.219 TCP 66 44233 > http [ACK] Seq=97 Ack=503905 Win=809856 Len=0 TSval=10534567 TSecr=1683249916
 99   0.017480 54.192.118.219 -> 172.31.8.238 TCP 23234 [TCP segment of a reassembled PDU]
100   0.017493 172.31.8.238 -> 54.192.118.219 TCP 66 44233 > http [ACK] Seq=97 Ack=527073 Win=856192 Len=0 TSval=10534567 TSecr=1683249916
101   0.017912 54.192.118.219 -> 172.31.8.238 TCP 8754 [TCP segment of a reassembled PDU]
102   0.017920 172.31.8.238 -> 54.192.118.219 TCP 66 44233 > http [ACK] Seq=97 Ack=535761 Win=873600 Len=0 TSval=10534567 TSecr=1683249916
103   0.018075 54.192.118.219 -> 172.31.8.238 TCP 18890 [TCP segment of a reassembled PDU]
104   0.018086 172.31.8.238 -> 54.192.118.219 TCP 66 44233 > http [ACK] Seq=97 Ack=554585 Win=911232 Len=0 TSval=10534567 TSecr=1683249916
105   0.018173 54.192.118.219 -> 172.31.8.238 TCP 5858 [TCP segment of a reassembled PDU]
106   0.018179 172.31.8.238 -> 54.192.118.219 TCP 66 44233 > http [ACK] Seq=97 Ack=560377 Win=922880 Len=0 TSval=10534567 TSecr=1683249916
107   0.018338 54.192.118.219 -> 172.31.8.238 TCP 26130 [TCP segment of a reassembled PDU]
108   0.018351 172.31.8.238 -> 54.192.118.219 TCP 66 44233 > http [ACK] Seq=97 Ack=586441 Win=974976 Len=0 TSval=10534567 TSecr=1683249916
109   0.018382 54.192.118.219 -> 172.31.8.238 TCP 5858 [TCP segment of a reassembled PDU]
110   0.018386 172.31.8.238 -> 54.192.118.219 TCP 66 44233 > http [ACK] Seq=97 Ack=592233 Win=986496 Len=0 TSval=10534567 TSecr=1683249916
111   0.018705 54.192.118.219 -> 172.31.8.238 TCP 15994 [TCP segment of a reassembled PDU]
112   0.018716 172.31.8.238 -> 54.192.118.219 TCP 66 44233 > http [ACK] Seq=97 Ack=608161 Win=1018368 Len=0 TSval=10534567 TSecr=1683249916
113   0.018907 54.192.118.219 -> 172.31.8.238 TCP 26130 [TCP segment of a reassembled PDU]
114   0.018920 172.31.8.238 -> 54.192.118.219 TCP 66 44233 > http [ACK] Seq=97 Ack=634225 Win=1070592 Len=0 TSval=10534567 TSecr=1683249916
115   0.018947 54.192.118.219 -> 172.31.8.238 TCP 10202 [TCP segment of a reassembled PDU]
116   0.018954 172.31.8.238 -> 54.192.118.219 TCP 66 44233 > http [ACK] Seq=97 Ack=644361 Win=1090816 Len=0 TSval=10534567 TSecr=1683249916
117   0.019067 54.192.118.219 -> 172.31.8.238 TCP 13098 [TCP segment of a reassembled PDU]
118   0.019077 172.31.8.238 -> 54.192.118.219 TCP 66 44233 > http [ACK] Seq=97 Ack=657393 Win=1116928 Len=0 TSval=10534567 TSecr=1683249916
119   0.019431 54.192.118.219 -> 172.31.8.238 TCP 5858 [TCP segment of a reassembled PDU]
120   0.019438 172.31.8.238 -> 54.192.118.219 TCP 66 44233 > http [ACK] Seq=97 Ack=663185 Win=1128448 Len=0 TSval=10534567 TSecr=1683249916
121   0.019613 54.192.118.219 -> 172.31.8.238 TCP 26130 [TCP segment of a reassembled PDU]
122   0.019627 172.31.8.238 -> 54.192.118.219 TCP 66 44233 > http [ACK] Seq=97 Ack=689249 Win=1180544 Len=0 TSval=10534567 TSecr=1683249916
123   0.019690 54.192.118.219 -> 172.31.8.238 TCP 26130 [TCP segment of a reassembled PDU]
124   0.019706 172.31.8.238 -> 54.192.118.219 TCP 66 44233 > http [ACK] Seq=97 Ack=715313 Win=1232768 Len=0 TSval=10534567 TSecr=1683249916
125   0.019746 54.192.118.219 -> 172.31.8.238 TCP 7306 [TCP segment of a reassembled PDU]
126   0.019753 172.31.8.238 -> 54.192.118.219 TCP 66 44233 > http [ACK] Seq=97 Ack=722553 Win=1247232 Len=0 TSval=10534567 TSecr=1683249916
127   0.020061 54.192.118.219 -> 172.31.8.238 TCP 26130 [TCP segment of a reassembled PDU]
128   0.020075 172.31.8.238 -> 54.192.118.219 TCP 66 44233 > http [ACK] Seq=97 Ack=748617 Win=1263744 Len=0 TSval=10534567 TSecr=1683249916
129   0.020166 54.192.118.219 -> 172.31.8.238 TCP 8754 [TCP segment of a reassembled PDU]
130   0.020174 172.31.8.238 -> 54.192.118.219 TCP 66 44233 > http [ACK] Seq=97 Ack=757305 Win=1292288 Len=0 TSval=10534568 TSecr=1683249916
131   0.020326 54.192.118.219 -> 172.31.8.238 TCP 20338 [TCP segment of a reassembled PDU]
132   0.020349 172.31.8.238 -> 54.192.118.219 TCP 66 44233 > http [ACK] Seq=97 Ack=777577 Win=1273216 Len=0 TSval=10534568 TSecr=1683249916
133   0.020384 54.192.118.219 -> 172.31.8.238 TCP 5858 [TCP segment of a reassembled PDU]
134   0.020390 172.31.8.238 -> 54.192.118.219 TCP 66 44233 > http [ACK] Seq=97 Ack=783369 Win=1297024 Len=0 TSval=10534568 TSecr=1683249916
135   0.020468 54.192.118.219 -> 172.31.8.238 TCP 4410 [TCP segment of a reassembled PDU]
136   0.020473 172.31.8.238 -> 54.192.118.219 TCP 66 44233 > http [ACK] Seq=97 Ack=787713 Win=1299328 Len=0 TSval=10534568 TSecr=1683249916
137   0.020488 54.192.118.219 -> 172.31.8.238 TCP 26130 [TCP segment of a reassembled PDU]
138   0.020518 172.31.8.238 -> 54.192.118.219 TCP 66 44233 > http [ACK] Seq=97 Ack=813777 Win=1273344 Len=0 TSval=10534568 TSecr=1683249916
139   0.020527 54.192.118.219 -> 172.31.8.238 TCP 7306 [TCP segment of a reassembled PDU]
140   0.020543 172.31.8.238 -> 54.192.118.219 TCP 66 44233 > http [ACK] Seq=97 Ack=821017 Win=1294592 Len=0 TSval=10534568 TSecr=1683249916
141   0.020841 54.192.118.219 -> 172.31.8.238 TCP 18890 [TCP segment of a reassembled PDU]
142   0.020884 54.192.118.219 -> 172.31.8.238 TCP 7306 [TCP segment of a reassembled PDU]
143   0.020890 172.31.8.238 -> 54.192.118.219 TCP 66 44233 > http [ACK] Seq=97 Ack=839841 Win=1275776 Len=0 TSval=10534568 TSecr=1683249916
144   0.020900 54.192.118.219 -> 172.31.8.238 TCP 5858 [TCP segment of a reassembled PDU]
145   0.020919 172.31.8.238 -> 54.192.118.219 TCP 66 44233 > http [ACK] Seq=97 Ack=852873 Win=1303936 Len=0 TSval=10534568 TSecr=1683249916
146   0.021103 54.192.118.219 -> 172.31.8.238 TCP 26130 [TCP segment of a reassembled PDU]
147   0.021143 54.192.118.219 -> 172.31.8.238 TCP 8754 [TCP segment of a reassembled PDU]
148   0.021175 172.31.8.238 -> 54.192.118.219 TCP 66 44233 > http [ACK] Seq=97 Ack=887625 Win=1269248 Len=0 TSval=10534568 TSecr=1683249916
149   0.021362 54.192.118.219 -> 172.31.8.238 TCP 26130 [TCP segment of a reassembled PDU]
150   0.021385 54.192.118.219 -> 172.31.8.238 TCP 4410 [TCP segment of a reassembled PDU]
151   0.021396 172.31.8.238 -> 54.192.118.219 TCP 66 44233 > http [ACK] Seq=97 Ack=918033 Win=1256448 Len=0 TSval=10534568 TSecr=1683249916
152   0.021630 54.192.118.219 -> 172.31.8.238 TCP 26130 [TCP segment of a reassembled PDU]
153   0.021644 172.31.8.238 -> 54.192.118.219 TCP 66 44233 > http [ACK] Seq=97 Ack=944097 Win=1263744 Len=0 TSval=10534568 TSecr=1683249916
154   0.021692 54.192.118.219 -> 172.31.8.238 TCP 20338 [TCP segment of a reassembled PDU]
155   0.021704 172.31.8.238 -> 54.192.118.219 TCP 66 44233 > http [ACK] Seq=97 Ack=964369 Win=1273216 Len=0 TSval=10534568 TSecr=1683249916
156   0.021764 54.192.118.219 -> 172.31.8.238 TCP 10202 [TCP segment of a reassembled PDU]
157   0.021772 172.31.8.238 -> 54.192.118.219 TCP 66 44233 > http [ACK] Seq=97 Ack=974505 Win=1289856 Len=0 TSval=10534568 TSecr=1683249916
158   0.021889 54.192.118.219 -> 172.31.8.238 TCP 8754 [TCP segment of a reassembled PDU]
159   0.021896 172.31.8.238 -> 54.192.118.219 TCP 66 44233 > http [ACK] Seq=97 Ack=983193 Win=1292288 Len=0 TSval=10534568 TSecr=1683249916
160   0.021982 54.192.118.219 -> 172.31.8.238 TCP 5858 [TCP segment of a reassembled PDU]
161   0.022003 172.31.8.238 -> 54.192.118.219 TCP 66 44233 > http [ACK] Seq=97 Ack=988985 Win=1303936 Len=0 TSval=10534568 TSecr=1683249916
162   0.022162 54.192.118.219 -> 172.31.8.238 TCP 17442 [TCP segment of a reassembled PDU]
163   0.022185 172.31.8.238 -> 54.192.118.219 TCP 66 44233 > http [ACK] Seq=97 Ack=1006361 Win=1286656 Len=0 TSval=10534568 TSecr=1683249916
164   0.022199 54.192.118.219 -> 172.31.8.238 TCP 8754 [TCP segment of a reassembled PDU]
165   0.022214 172.31.8.238 -> 54.192.118.219 TCP 66 44233 > http [ACK] Seq=97 Ack=1015049 Win=1303936 Len=0 TSval=10534568 TSecr=1683249916
166   0.022296 54.192.118.219 -> 172.31.8.238 TCP 30474 [TCP segment of a reassembled PDU]
167   0.022323 172.31.8.238 -> 54.192.118.219 TCP 66 44233 > http [ACK] Seq=97 Ack=1045457 Win=1273600 Len=0 TSval=10534568 TSecr=1683249916
168   0.022417 54.192.118.219 -> 172.31.8.238 HTTP 3643 HTTP/1.1 200 OK  (application/octet-stream)
169   0.022436 172.31.8.238 -> 54.192.118.219 TCP 66 44233 > http [ACK] Seq=97 Ack=1049034 Win=1299328 Len=0 TSval=10534568 TSecr=1683249916
170   0.022561 172.31.8.238 -> 54.192.118.219 TCP 66 44233 > http [FIN, ACK] Seq=97 Ack=1049034 Win=1303936 Len=0 TSval=10534568 TSecr=1683249916
171   0.022981 54.192.118.219 -> 172.31.8.238 TCP 66 http > 44233 [FIN, ACK] Seq=1049034 Ack=98 Win=14592 Len=0 TSval=1683249917 TSecr=10534568
172   0.022988 172.31.8.238 -> 54.192.118.219 TCP 66 44233 > http [ACK] Seq=98 Ack=1049035 Win=1303936 Len=0 TSval=10534568 TSecr=1683249917
