[Measurement for 1mb at 18:42:24 19.42.2014] 
Tshark:

  1   0.000000 172.31.8.238 -> 172.31.0.2   DNS 89 Standard query 0xa471  A d1dx94olpiqj0t.cloudfront.net
  2   0.000036 172.31.8.238 -> 172.31.0.2   DNS 89 Standard query 0x71f9  AAAA d1dx94olpiqj0t.cloudfront.net
  3   0.000671   172.31.0.2 -> 172.31.8.238 DNS 217 Standard query response 0xa471  A 54.230.142.81 A 54.230.142.82 A 205.251.215.193 A 205.251.215.224 A 54.192.141.30 A 54.192.141.180 A 54.230.140.152 A 54.230.140.235
  4   0.000710   172.31.0.2 -> 172.31.8.238 DNS 176 Standard query response 0x71f9 
  5   0.003869 172.31.8.238 -> 54.230.142.81 TCP 74 50662 > http [SYN] Seq=0 Win=26883 Len=0 MSS=8961 SACK_PERM=1 TSval=1543146 TSecr=0 WS=128
  6   0.006551 54.230.142.81 -> 172.31.8.238 TCP 74 http > 50662 [SYN, ACK] Seq=0 Ack=1 Win=14480 Len=0 MSS=1460 SACK_PERM=1 TSval=712861104 TSecr=1543146 WS=128
  7   0.006565 172.31.8.238 -> 54.230.142.81 TCP 66 50662 > http [ACK] Seq=1 Ack=1 Win=27008 Len=0 TSval=1543147 TSecr=712861104
  8   0.006611 172.31.8.238 -> 54.230.142.81 HTTP 162 GET /1mb HTTP/1.1 
  9   0.009344 54.230.142.81 -> 172.31.8.238 TCP 66 http > 50662 [ACK] Seq=1 Ack=97 Win=14592 Len=0 TSval=712861104 TSecr=1543147
 10   0.013929 54.230.142.81 -> 172.31.8.238 TCP 4410 [TCP segment of a reassembled PDU]
 11   0.013939 172.31.8.238 -> 54.230.142.81 TCP 66 50662 > http [ACK] Seq=97 Ack=4345 Win=35584 Len=0 TSval=1543149 TSecr=712861105
 12   0.014153 54.230.142.81 -> 172.31.8.238 TCP 4410 [TCP segment of a reassembled PDU]
 13   0.014160 172.31.8.238 -> 54.230.142.81 TCP 66 50662 > http [ACK] Seq=97 Ack=8689 Win=44288 Len=0 TSval=1543149 TSecr=712861105
 14   0.014242 54.230.142.81 -> 172.31.8.238 TCP 4410 [TCP segment of a reassembled PDU]
 15   0.014248 172.31.8.238 -> 54.230.142.81 TCP 66 50662 > http [ACK] Seq=97 Ack=13033 Win=52992 Len=0 TSval=1543149 TSecr=712861105
 16   0.014737 54.230.142.81 -> 172.31.8.238 TCP 1514 [TCP segment of a reassembled PDU]
 17   0.014742 172.31.8.238 -> 54.230.142.81 TCP 66 50662 > http [ACK] Seq=97 Ack=14481 Win=55936 Len=0 TSval=1543149 TSecr=712861105
 18   0.016740 54.230.142.81 -> 172.31.8.238 TCP 1514 [TCP segment of a reassembled PDU]
 19   0.016745 172.31.8.238 -> 54.230.142.81 TCP 66 50662 > http [ACK] Seq=97 Ack=15929 Win=58752 Len=0 TSval=1543149 TSecr=712861105
 20   0.017002 54.230.142.81 -> 172.31.8.238 TCP 2962 [TCP segment of a reassembled PDU]
 21   0.017007 172.31.8.238 -> 54.230.142.81 TCP 66 50662 > http [ACK] Seq=97 Ack=18825 Win=64640 Len=0 TSval=1543149 TSecr=712861105
 22   0.017093 54.230.142.81 -> 172.31.8.238 TCP 1514 [TCP segment of a reassembled PDU]
 23   0.017098 172.31.8.238 -> 54.230.142.81 TCP 66 50662 > http [ACK] Seq=97 Ack=20273 Win=67456 Len=0 TSval=1543149 TSecr=712861105
 24   0.017311 54.230.142.81 -> 172.31.8.238 TCP 7306 [TCP segment of a reassembled PDU]
 25   0.017319 172.31.8.238 -> 54.230.142.81 TCP 66 50662 > http [ACK] Seq=97 Ack=27513 Win=81920 Len=0 TSval=1543149 TSecr=712861105
 26   0.017636 54.230.142.81 -> 172.31.8.238 TCP 2962 [TCP segment of a reassembled PDU]
 27   0.017642 172.31.8.238 -> 54.230.142.81 TCP 66 50662 > http [ACK] Seq=97 Ack=30409 Win=87808 Len=0 TSval=1543150 TSecr=712861105
 28   0.017902 54.230.142.81 -> 172.31.8.238 TCP 4410 [TCP segment of a reassembled PDU]
 29   0.017908 172.31.8.238 -> 54.230.142.81 TCP 66 50662 > http [ACK] Seq=97 Ack=34753 Win=96512 Len=0 TSval=1543150 TSecr=712861105
 30   0.019886 54.230.142.81 -> 172.31.8.238 TCP 2962 [TCP segment of a reassembled PDU]
 31   0.019892 172.31.8.238 -> 54.230.142.81 TCP 66 50662 > http [ACK] Seq=97 Ack=37649 Win=102272 Len=0 TSval=1543150 TSecr=712861105
 32   0.019970 54.230.142.81 -> 172.31.8.238 TCP 1514 [TCP segment of a reassembled PDU]
 33   0.019975 172.31.8.238 -> 54.230.142.81 TCP 66 50662 > http [ACK] Seq=97 Ack=39097 Win=105088 Len=0 TSval=1543150 TSecr=712861105
 34   0.020137 54.230.142.81 -> 172.31.8.238 TCP 1514 [TCP segment of a reassembled PDU]
 35   0.020141 172.31.8.238 -> 54.230.142.81 TCP 66 50662 > http [ACK] Seq=97 Ack=40545 Win=108032 Len=0 TSval=1543150 TSecr=712861105
 36   0.020391 54.230.142.81 -> 172.31.8.238 TCP 2962 [TCP segment of a reassembled PDU]
 37   0.020396 172.31.8.238 -> 54.230.142.81 TCP 66 50662 > http [ACK] Seq=97 Ack=43441 Win=109056 Len=0 TSval=1543150 TSecr=712861105
 38   0.020494 54.230.142.81 -> 172.31.8.238 TCP 10202 [TCP segment of a reassembled PDU]
 39   0.020502 172.31.8.238 -> 54.230.142.81 TCP 66 50662 > http [ACK] Seq=97 Ack=53577 Win=101248 Len=0 TSval=1543150 TSecr=712861105
 40   0.020645 54.230.142.81 -> 172.31.8.238 TCP 4410 [TCP segment of a reassembled PDU]
 41   0.020663 172.31.8.238 -> 54.230.142.81 TCP 66 50662 > http [ACK] Seq=97 Ack=57921 Win=109056 Len=0 TSval=1543150 TSecr=712861105
 42   0.020896 54.230.142.81 -> 172.31.8.238 TCP 4410 [TCP segment of a reassembled PDU]
 43   0.020902 172.31.8.238 -> 54.230.142.81 TCP 66 50662 > http [ACK] Seq=97 Ack=62265 Win=109056 Len=0 TSval=1543150 TSecr=712861105
 44   0.020996 54.230.142.81 -> 172.31.8.238 TCP 1514 [TCP segment of a reassembled PDU]
 45   0.021000 172.31.8.238 -> 54.230.142.81 TCP 66 50662 > http [ACK] Seq=97 Ack=63713 Win=109056 Len=0 TSval=1543150 TSecr=712861105
 46   0.022850 54.230.142.81 -> 172.31.8.238 TCP 2962 [TCP segment of a reassembled PDU]
 47   0.022855 172.31.8.238 -> 54.230.142.81 TCP 66 50662 > http [ACK] Seq=97 Ack=66609 Win=109056 Len=0 TSval=1543151 TSecr=712861106
 48   0.023447 54.230.142.81 -> 172.31.8.238 TCP 5858 [TCP segment of a reassembled PDU]
 49   0.023453 172.31.8.238 -> 54.230.142.81 TCP 66 50662 > http [ACK] Seq=97 Ack=72401 Win=120704 Len=0 TSval=1543151 TSecr=712861106
 50   0.023616 54.230.142.81 -> 172.31.8.238 TCP 11650 [TCP segment of a reassembled PDU]
 51   0.023624 172.31.8.238 -> 54.230.142.81 TCP 66 50662 > http [ACK] Seq=97 Ack=83985 Win=143872 Len=0 TSval=1543151 TSecr=712861106
 52   0.023813 54.230.142.81 -> 172.31.8.238 TCP 2962 [TCP segment of a reassembled PDU]
 53   0.023819 172.31.8.238 -> 54.230.142.81 TCP 66 50662 > http [ACK] Seq=97 Ack=86881 Win=149632 Len=0 TSval=1543151 TSecr=712861106
 54   0.024111 54.230.142.81 -> 172.31.8.238 TCP 7306 [TCP segment of a reassembled PDU]
 55   0.024118 172.31.8.238 -> 54.230.142.81 TCP 66 50662 > http [ACK] Seq=97 Ack=94121 Win=164096 Len=0 TSval=1543151 TSecr=712861106
 56   0.024209 54.230.142.81 -> 172.31.8.238 TCP 7306 [TCP segment of a reassembled PDU]
 57   0.024216 172.31.8.238 -> 54.230.142.81 TCP 66 50662 > http [ACK] Seq=97 Ack=101361 Win=178560 Len=0 TSval=1543151 TSecr=712861106
 58   0.026252 54.230.142.81 -> 172.31.8.238 TCP 2962 [TCP segment of a reassembled PDU]
 59   0.026258 172.31.8.238 -> 54.230.142.81 TCP 66 50662 > http [ACK] Seq=97 Ack=104257 Win=184320 Len=0 TSval=1543152 TSecr=712861106
 60   0.026369 54.230.142.81 -> 172.31.8.238 TCP 1514 [TCP segment of a reassembled PDU]
 61   0.026374 172.31.8.238 -> 54.230.142.81 TCP 66 50662 > http [ACK] Seq=97 Ack=105705 Win=187264 Len=0 TSval=1543152 TSecr=712861106
 62   0.026584 54.230.142.81 -> 172.31.8.238 TCP 4410 [TCP segment of a reassembled PDU]
 63   0.026589 172.31.8.238 -> 54.230.142.81 TCP 66 50662 > http [ACK] Seq=97 Ack=110049 Win=195968 Len=0 TSval=1543152 TSecr=712861106
 64   0.026859 54.230.142.81 -> 172.31.8.238 TCP 18890 [TCP segment of a reassembled PDU]
 65   0.026871 172.31.8.238 -> 54.230.142.81 TCP 66 50662 > http [ACK] Seq=97 Ack=128873 Win=233600 Len=0 TSval=1543152 TSecr=712861106
 66   0.027106 54.230.142.81 -> 172.31.8.238 TCP 4410 [TCP segment of a reassembled PDU]
 67   0.027112 172.31.8.238 -> 54.230.142.81 TCP 66 50662 > http [ACK] Seq=97 Ack=133217 Win=242304 Len=0 TSval=1543152 TSecr=712861106
 68   0.027353 54.230.142.81 -> 172.31.8.238 TCP 4410 [TCP segment of a reassembled PDU]
 69   0.027360 172.31.8.238 -> 54.230.142.81 TCP 66 50662 > http [ACK] Seq=97 Ack=137561 Win=251008 Len=0 TSval=1543152 TSecr=712861106
 70   0.029281 54.230.142.81 -> 172.31.8.238 TCP 2962 [TCP segment of a reassembled PDU]
 71   0.029287 172.31.8.238 -> 54.230.142.81 TCP 66 50662 > http [ACK] Seq=97 Ack=140457 Win=256768 Len=0 TSval=1543152 TSecr=712861106
 72   0.029423 54.230.142.81 -> 172.31.8.238 TCP 14546 [TCP segment of a reassembled PDU]
 73   0.029433 172.31.8.238 -> 54.230.142.81 TCP 66 50662 > http [ACK] Seq=97 Ack=154937 Win=285696 Len=0 TSval=1543153 TSecr=712861106
 74   0.029608 54.230.142.81 -> 172.31.8.238 TCP 1514 [TCP segment of a reassembled PDU]
 75   0.029612 172.31.8.238 -> 54.230.142.81 TCP 66 50662 > http [ACK] Seq=97 Ack=156385 Win=288640 Len=0 TSval=1543153 TSecr=712861106
 76   0.029724 54.230.142.81 -> 172.31.8.238 TCP 1514 [TCP segment of a reassembled PDU]
 77   0.029728 172.31.8.238 -> 54.230.142.81 TCP 66 50662 > http [ACK] Seq=97 Ack=157833 Win=291456 Len=0 TSval=1543153 TSecr=712861106
 78   0.029968 54.230.142.81 -> 172.31.8.238 TCP 26130 [TCP segment of a reassembled PDU]
 79   0.029982 172.31.8.238 -> 54.230.142.81 TCP 66 50662 > http [ACK] Seq=97 Ack=183897 Win=317568 Len=0 TSval=1543153 TSecr=712861106
 80   0.030117 54.230.142.81 -> 172.31.8.238 TCP 1514 [TCP segment of a reassembled PDU]
 81   0.030122 172.31.8.238 -> 54.230.142.81 TCP 66 50662 > http [ACK] Seq=97 Ack=185345 Win=346496 Len=0 TSval=1543153 TSecr=712861106
 82   0.030389 54.230.142.81 -> 172.31.8.238 TCP 4410 [TCP segment of a reassembled PDU]
 83   0.030395 172.31.8.238 -> 54.230.142.81 TCP 66 50662 > http [ACK] Seq=97 Ack=189689 Win=353280 Len=0 TSval=1543153 TSecr=712861106
 84   0.030475 54.230.142.81 -> 172.31.8.238 TCP 2962 [TCP segment of a reassembled PDU]
 85   0.030480 172.31.8.238 -> 54.230.142.81 TCP 66 50662 > http [ACK] Seq=97 Ack=192585 Win=355584 Len=0 TSval=1543153 TSecr=712861106
 86   0.032173 54.230.142.81 -> 172.31.8.238 TCP 2962 [TCP segment of a reassembled PDU]
 87   0.032178 172.31.8.238 -> 54.230.142.81 TCP 66 50662 > http [ACK] Seq=97 Ack=195481 Win=355584 Len=0 TSval=1543153 TSecr=712861107
 88   0.032255 54.230.142.81 -> 172.31.8.238 TCP 1514 [TCP segment of a reassembled PDU]
 89   0.032260 172.31.8.238 -> 54.230.142.81 TCP 66 50662 > http [ACK] Seq=97 Ack=196929 Win=358016 Len=0 TSval=1543153 TSecr=712861107
 90   0.032429 54.230.142.81 -> 172.31.8.238 TCP 2962 [TCP segment of a reassembled PDU]
 91   0.032445 172.31.8.238 -> 54.230.142.81 TCP 66 50662 > http [ACK] Seq=97 Ack=199825 Win=360448 Len=0 TSval=1543153 TSecr=712861107
 92   0.032544 54.230.142.81 -> 172.31.8.238 TCP 15994 [TCP segment of a reassembled PDU]
 93   0.032568 172.31.8.238 -> 54.230.142.81 TCP 66 50662 > http [ACK] Seq=97 Ack=215753 Win=360448 Len=0 TSval=1543153 TSecr=712861107
 94   0.032718 54.230.142.81 -> 172.31.8.238 TCP 4410 [TCP segment of a reassembled PDU]
 95   0.032735 172.31.8.238 -> 54.230.142.81 TCP 66 50662 > http [ACK] Seq=97 Ack=220097 Win=360448 Len=0 TSval=1543153 TSecr=712861107
 96   0.033020 54.230.142.81 -> 172.31.8.238 TCP 21786 [TCP segment of a reassembled PDU]
 97   0.033066 54.230.142.81 -> 172.31.8.238 TCP 7306 [TCP segment of a reassembled PDU]
 98   0.033241 172.31.8.238 -> 54.230.142.81 TCP 66 50662 > http [ACK] Seq=97 Ack=249057 Win=331520 Len=0 TSval=1543153 TSecr=712861107
 99   0.034940 54.230.142.81 -> 172.31.8.238 TCP 2962 [TCP segment of a reassembled PDU]
100   0.034946 172.31.8.238 -> 54.230.142.81 TCP 66 50662 > http [ACK] Seq=97 Ack=251953 Win=355584 Len=0 TSval=1543154 TSecr=712861107
101   0.035258 54.230.142.81 -> 172.31.8.238 TCP 11650 [TCP segment of a reassembled PDU]
102   0.035267 172.31.8.238 -> 54.230.142.81 TCP 66 50662 > http [ACK] Seq=97 Ack=263537 Win=384128 Len=0 TSval=1543154 TSecr=712861107
103   0.035605 54.230.142.81 -> 172.31.8.238 TCP 1514 [TCP segment of a reassembled PDU]
104   0.035610 172.31.8.238 -> 54.230.142.81 TCP 66 50662 > http [ACK] Seq=97 Ack=264985 Win=387072 Len=0 TSval=1543154 TSecr=712861107
105   0.035871 54.230.142.81 -> 172.31.8.238 TCP 2962 [TCP segment of a reassembled PDU]
106   0.035876 172.31.8.238 -> 54.230.142.81 TCP 66 50662 > http [ACK] Seq=97 Ack=267881 Win=392832 Len=0 TSval=1543154 TSecr=712861107
107   0.036007 54.230.142.81 -> 172.31.8.238 TCP 23234 [TCP segment of a reassembled PDU]
108   0.036019 172.31.8.238 -> 54.230.142.81 TCP 66 50662 > http [ACK] Seq=97 Ack=291049 Win=439168 Len=0 TSval=1543154 TSecr=712861107
109   0.036144 54.230.142.81 -> 172.31.8.238 TCP 5858 [TCP segment of a reassembled PDU]
110   0.036151 172.31.8.238 -> 54.230.142.81 TCP 66 50662 > http [ACK] Seq=97 Ack=296841 Win=450816 Len=0 TSval=1543154 TSecr=712861107
111   0.036269 54.230.142.81 -> 172.31.8.238 TCP 15994 [TCP segment of a reassembled PDU]
112   0.036279 172.31.8.238 -> 54.230.142.81 TCP 66 50662 > http [ACK] Seq=97 Ack=312769 Win=482688 Len=0 TSval=1543154 TSecr=712861107
113   0.036443 54.230.142.81 -> 172.31.8.238 TCP 2962 [TCP segment of a reassembled PDU]
114   0.036449 172.31.8.238 -> 54.230.142.81 TCP 66 50662 > http [ACK] Seq=97 Ack=315665 Win=488448 Len=0 TSval=1543154 TSecr=712861107
115   0.038253 54.230.142.81 -> 172.31.8.238 TCP 1514 [TCP segment of a reassembled PDU]
116   0.038258 172.31.8.238 -> 54.230.142.81 TCP 66 50662 > http [ACK] Seq=97 Ack=317113 Win=491392 Len=0 TSval=1543155 TSecr=712861107
117   0.038497 54.230.142.81 -> 172.31.8.238 TCP 5858 [TCP segment of a reassembled PDU]
118   0.038504 172.31.8.238 -> 54.230.142.81 TCP 66 50662 > http [ACK] Seq=97 Ack=322905 Win=502912 Len=0 TSval=1543155 TSecr=712861107
119   0.038606 54.230.142.81 -> 172.31.8.238 TCP 21786 [TCP segment of a reassembled PDU]
120   0.038618 172.31.8.238 -> 54.230.142.81 TCP 66 50662 > http [ACK] Seq=97 Ack=344625 Win=546304 Len=0 TSval=1543155 TSecr=712861107
121   0.038888 54.230.142.81 -> 172.31.8.238 TCP 2962 [TCP segment of a reassembled PDU]
122   0.038893 172.31.8.238 -> 54.230.142.81 TCP 66 50662 > http [ACK] Seq=97 Ack=347521 Win=552192 Len=0 TSval=1543155 TSecr=712861107
123   0.039159 54.230.142.81 -> 172.31.8.238 TCP 20338 [TCP segment of a reassembled PDU]
124   0.039172 172.31.8.238 -> 54.230.142.81 TCP 66 50662 > http [ACK] Seq=97 Ack=367793 Win=592640 Len=0 TSval=1543155 TSecr=712861107
125   0.039340 54.230.142.81 -> 172.31.8.238 TCP 7306 [TCP segment of a reassembled PDU]
126   0.039347 172.31.8.238 -> 54.230.142.81 TCP 66 50662 > http [ACK] Seq=97 Ack=375033 Win=607232 Len=0 TSval=1543155 TSecr=712861107
127   0.039479 54.230.142.81 -> 172.31.8.238 TCP 18890 [TCP segment of a reassembled PDU]
128   0.039490 172.31.8.238 -> 54.230.142.81 TCP 66 50662 > http [ACK] Seq=97 Ack=393857 Win=644864 Len=0 TSval=1543155 TSecr=712861107
129   0.039666 54.230.142.81 -> 172.31.8.238 TCP 7306 [TCP segment of a reassembled PDU]
130   0.039673 172.31.8.238 -> 54.230.142.81 TCP 66 50662 > http [ACK] Seq=97 Ack=401097 Win=659328 Len=0 TSval=1543155 TSecr=712861107
131   0.041532 54.230.142.81 -> 172.31.8.238 TCP 1514 [TCP segment of a reassembled PDU]
132   0.041538 172.31.8.238 -> 54.230.142.81 TCP 66 50662 > http [ACK] Seq=97 Ack=402545 Win=662144 Len=0 TSval=1543156 TSecr=712861107
133   0.041833 54.230.142.81 -> 172.31.8.238 TCP 7306 [TCP segment of a reassembled PDU]
134   0.041841 172.31.8.238 -> 54.230.142.81 TCP 66 50662 > http [ACK] Seq=97 Ack=409785 Win=663936 Len=0 TSval=1543156 TSecr=712861107
135   0.041948 54.230.142.81 -> 172.31.8.238 TCP 11650 [TCP segment of a reassembled PDU]
136   0.041968 172.31.8.238 -> 54.230.142.81 TCP 66 50662 > http [ACK] Seq=97 Ack=421369 Win=674432 Len=0 TSval=1543156 TSecr=712861107
137   0.042090 54.230.142.81 -> 172.31.8.238 TCP 2962 [TCP segment of a reassembled PDU]
138   0.042105 172.31.8.238 -> 54.230.142.81 TCP 66 50662 > http [ACK] Seq=97 Ack=424265 Win=674432 Len=0 TSval=1543156 TSecr=712861108
139   0.042459 54.230.142.81 -> 172.31.8.238 TCP 26130 [TCP segment of a reassembled PDU]
140   0.042486 172.31.8.238 -> 54.230.142.81 TCP 66 50662 > http [ACK] Seq=97 Ack=450329 Win=648448 Len=0 TSval=1543156 TSecr=712861108
141   0.042521 54.230.142.81 -> 172.31.8.238 TCP 18890 [TCP segment of a reassembled PDU]
142   0.042545 172.31.8.238 -> 54.230.142.81 TCP 66 50662 > http [ACK] Seq=97 Ack=469153 Win=644864 Len=0 TSval=1543156 TSecr=712861108
143   0.042573 54.230.142.81 -> 172.31.8.238 TCP 1514 [TCP segment of a reassembled PDU]
144   0.042665 54.230.142.81 -> 172.31.8.238 TCP 4410 [TCP segment of a reassembled PDU]
145   0.042671 172.31.8.238 -> 54.230.142.81 TCP 66 50662 > http [ACK] Seq=97 Ack=474945 Win=668672 Len=0 TSval=1543156 TSecr=712861108
146   0.044690 54.230.142.81 -> 172.31.8.238 TCP 1514 [TCP segment of a reassembled PDU]
147   0.044944 54.230.142.81 -> 172.31.8.238 TCP 2962 [TCP segment of a reassembled PDU]
148   0.044949 172.31.8.238 -> 54.230.142.81 TCP 66 50662 > http [ACK] Seq=97 Ack=479289 Win=670976 Len=0 TSval=1543156 TSecr=712861108
149   0.045109 54.230.142.81 -> 172.31.8.238 TCP 26130 [TCP segment of a reassembled PDU]
150   0.045141 54.230.142.81 -> 172.31.8.238 TCP 8754 [TCP segment of a reassembled PDU]
151   0.045148 172.31.8.238 -> 54.230.142.81 TCP 66 50662 > http [ACK] Seq=97 Ack=505353 Win=644992 Len=0 TSval=1543156 TSecr=712861108
152   0.045167 172.31.8.238 -> 54.230.142.81 TCP 66 50662 > http [ACK] Seq=97 Ack=514041 Win=661504 Len=0 TSval=1543156 TSecr=712861108
153   0.045505 54.230.142.81 -> 172.31.8.238 TCP 10202 [TCP segment of a reassembled PDU]
154   0.045525 172.31.8.238 -> 54.230.142.81 TCP 66 50662 > http [ACK] Seq=97 Ack=524177 Win=674432 Len=0 TSval=1543157 TSecr=712861108
155   0.045608 54.230.142.81 -> 172.31.8.238 TCP 5858 [TCP segment of a reassembled PDU]
156   0.045625 172.31.8.238 -> 54.230.142.81 TCP 66 50662 > http [ACK] Seq=97 Ack=529969 Win=674432 Len=0 TSval=1543157 TSecr=712861108
157   0.045857 54.230.142.81 -> 172.31.8.238 TCP 26130 [TCP segment of a reassembled PDU]
158   0.045885 172.31.8.238 -> 54.230.142.81 TCP 66 50662 > http [ACK] Seq=97 Ack=556033 Win=648448 Len=0 TSval=1543157 TSecr=712861108
159   0.045894 54.230.142.81 -> 172.31.8.238 TCP 8754 [TCP segment of a reassembled PDU]
160   0.045913 172.31.8.238 -> 54.230.142.81 TCP 66 50662 > http [ACK] Seq=97 Ack=564721 Win=661504 Len=0 TSval=1543157 TSecr=712861108
161   0.046071 54.230.142.81 -> 172.31.8.238 TCP 14546 [TCP segment of a reassembled PDU]
162   0.046095 172.31.8.238 -> 54.230.142.81 TCP 66 50662 > http [ACK] Seq=97 Ack=579201 Win=674432 Len=0 TSval=1543157 TSecr=712861108
163   0.048184 54.230.142.81 -> 172.31.8.238 TCP 1514 [TCP segment of a reassembled PDU]
164   0.048442 54.230.142.81 -> 172.31.8.238 TCP 2962 [TCP segment of a reassembled PDU]
165   0.048458 172.31.8.238 -> 54.230.142.81 TCP 66 50662 > http [ACK] Seq=97 Ack=583545 Win=674432 Len=0 TSval=1543157 TSecr=712861108
166   0.048599 54.230.142.81 -> 172.31.8.238 TCP 21786 [TCP segment of a reassembled PDU]
167   0.048641 54.230.142.81 -> 172.31.8.238 TCP 7306 [TCP segment of a reassembled PDU]
168   0.048705 54.230.142.81 -> 172.31.8.238 TCP 1514 [TCP segment of a reassembled PDU]
169   0.048843 54.230.142.81 -> 172.31.8.238 TCP 26130 [TCP segment of a reassembled PDU]
170   0.048860 172.31.8.238 -> 54.230.142.81 TCP 66 50662 > http [ACK] Seq=97 Ack=613953 Win=644096 Len=0 TSval=1543157 TSecr=712861108
171   0.048882 172.31.8.238 -> 54.230.142.81 TCP 66 50662 > http [ACK] Seq=97 Ack=640017 Win=632960 Len=0 TSval=1543157 TSecr=712861108
172   0.049045 54.230.142.81 -> 172.31.8.238 TCP 13098 [TCP segment of a reassembled PDU]
173   0.049054 172.31.8.238 -> 54.230.142.81 TCP 66 50662 > http [ACK] Seq=97 Ack=653049 Win=654464 Len=0 TSval=1543157 TSecr=712861108
174   0.049095 54.230.142.81 -> 172.31.8.238 TCP 13098 [TCP segment of a reassembled PDU]
175   0.049105 172.31.8.238 -> 54.230.142.81 TCP 66 50662 > http [ACK] Seq=97 Ack=666081 Win=654464 Len=0 TSval=1543157 TSecr=712861108
176   0.049262 54.230.142.81 -> 172.31.8.238 TCP 4410 [TCP segment of a reassembled PDU]
177   0.049268 172.31.8.238 -> 54.230.142.81 TCP 66 50662 > http [ACK] Seq=97 Ack=670425 Win=668672 Len=0 TSval=1543157 TSecr=712861108
178   0.051676 54.230.142.81 -> 172.31.8.238 TCP 1514 [TCP segment of a reassembled PDU]
179   0.052109 54.230.142.81 -> 172.31.8.238 TCP 26130 [TCP segment of a reassembled PDU]
180   0.052135 172.31.8.238 -> 54.230.142.81 TCP 66 50662 > http [ACK] Seq=97 Ack=697937 Win=641280 Len=0 TSval=1543158 TSecr=712861108
181   0.052170 54.230.142.81 -> 172.31.8.238 TCP 15994 [TCP segment of a reassembled PDU]
182   0.052180 172.31.8.238 -> 54.230.142.81 TCP 66 50662 > http [ACK] Seq=97 Ack=713865 Win=649600 Len=0 TSval=1543158 TSecr=712861108
183   0.052314 54.230.142.81 -> 172.31.8.238 TCP 21786 [TCP segment of a reassembled PDU]
184   0.052344 54.230.142.81 -> 172.31.8.238 TCP 5858 [TCP segment of a reassembled PDU]
185   0.052387 172.31.8.238 -> 54.230.142.81 TCP 66 50662 > http [ACK] Seq=97 Ack=741377 Win=630528 Len=0 TSval=1543158 TSecr=712861108
186   0.052481 54.230.142.81 -> 172.31.8.238 TCP 7306 [TCP segment of a reassembled PDU]
187   0.052489 172.31.8.238 -> 54.230.142.81 TCP 66 50662 > http [ACK] Seq=97 Ack=748617 Win=663936 Len=0 TSval=1543158 TSecr=712861109
188   0.052616 54.230.142.81 -> 172.31.8.238 TCP 23234 [TCP segment of a reassembled PDU]
189   0.052641 172.31.8.238 -> 54.230.142.81 TCP 66 50662 > http [ACK] Seq=97 Ack=771785 Win=640768 Len=0 TSval=1543158 TSecr=712861109
190   0.052807 54.230.142.81 -> 172.31.8.238 TCP 10202 [TCP segment of a reassembled PDU]
191   0.052815 172.31.8.238 -> 54.230.142.81 TCP 66 50662 > http [ACK] Seq=97 Ack=781921 Win=659200 Len=0 TSval=1543158 TSecr=712861109
192   0.053032 54.230.142.81 -> 172.31.8.238 TCP 1514 [TCP segment of a reassembled PDU]
193   0.053248 54.230.142.81 -> 172.31.8.238 TCP 5858 [TCP segment of a reassembled PDU]
194   0.053254 172.31.8.238 -> 54.230.142.81 TCP 66 50662 > http [ACK] Seq=97 Ack=789161 Win=666240 Len=0 TSval=1543158 TSecr=712861109
195   0.053363 54.230.142.81 -> 172.31.8.238 TCP 11650 [TCP segment of a reassembled PDU]
196   0.053384 172.31.8.238 -> 54.230.142.81 TCP 66 50662 > http [ACK] Seq=97 Ack=800745 Win=674432 Len=0 TSval=1543159 TSecr=712861109
197   0.055000 54.230.142.81 -> 172.31.8.238 TCP 2962 [TCP segment of a reassembled PDU]
198   0.055015 172.31.8.238 -> 54.230.142.81 TCP 66 50662 > http [ACK] Seq=97 Ack=803641 Win=674432 Len=0 TSval=1543159 TSecr=712861109
199   0.055263 54.230.142.81 -> 172.31.8.238 TCP 5858 [TCP segment of a reassembled PDU]
200   0.055279 172.31.8.238 -> 54.230.142.81 TCP 66 50662 > http [ACK] Seq=97 Ack=809433 Win=674432 Len=0 TSval=1543159 TSecr=712861109
201   0.055436 54.230.142.81 -> 172.31.8.238 TCP 26130 [TCP segment of a reassembled PDU]
202   0.055462 172.31.8.238 -> 54.230.142.81 TCP 66 50662 > http [ACK] Seq=97 Ack=835497 Win=648448 Len=0 TSval=1543159 TSecr=712861109
203   0.055474 54.230.142.81 -> 172.31.8.238 TCP 10202 [TCP segment of a reassembled PDU]
204   0.055493 172.31.8.238 -> 54.230.142.81 TCP 66 50662 > http [ACK] Seq=97 Ack=845633 Win=659200 Len=0 TSval=1543159 TSecr=712861109
205   0.055549 54.230.142.81 -> 172.31.8.238 TCP 2962 [TCP segment of a reassembled PDU]
206   0.055553 172.31.8.238 -> 54.230.142.81 TCP 66 50662 > http [ACK] Seq=97 Ack=848529 Win=670976 Len=0 TSval=1543159 TSecr=712861109
207   0.055780 54.230.142.81 -> 172.31.8.238 TCP 5858 [TCP segment of a reassembled PDU]
208   0.055797 172.31.8.238 -> 54.230.142.81 TCP 66 50662 > http [ACK] Seq=97 Ack=854321 Win=674432 Len=0 TSval=1543159 TSecr=712861109
209   0.056000 54.230.142.81 -> 172.31.8.238 TCP 11650 [TCP segment of a reassembled PDU]
210   0.056018 54.230.142.81 -> 172.31.8.238 TCP 2962 [TCP segment of a reassembled PDU]
211   0.056029 172.31.8.238 -> 54.230.142.81 TCP 66 50662 > http [ACK] Seq=97 Ack=868801 Win=674432 Len=0 TSval=1543159 TSecr=712861109
212   0.056195 54.230.142.81 -> 172.31.8.238 TCP 13098 [TCP segment of a reassembled PDU]
213   0.056215 172.31.8.238 -> 54.230.142.81 TCP 66 50662 > http [ACK] Seq=97 Ack=881833 Win=674432 Len=0 TSval=1543159 TSecr=712861109
214   0.056371 54.230.142.81 -> 172.31.8.238 TCP 4410 [TCP segment of a reassembled PDU]
215   0.056387 172.31.8.238 -> 54.230.142.81 TCP 66 50662 > http [ACK] Seq=97 Ack=886177 Win=674432 Len=0 TSval=1543159 TSecr=712861109
216   0.056465 54.230.142.81 -> 172.31.8.238 TCP 24682 [TCP segment of a reassembled PDU]
217   0.056489 172.31.8.238 -> 54.230.142.81 TCP 66 50662 > http [ACK] Seq=97 Ack=910793 Win=649856 Len=0 TSval=1543159 TSecr=712861109
218   0.056604 54.230.142.81 -> 172.31.8.238 TCP 1514 [TCP segment of a reassembled PDU]
219   0.056761 54.230.142.81 -> 172.31.8.238 TCP 18890 [TCP segment of a reassembled PDU]
220   0.056783 172.31.8.238 -> 54.230.142.81 TCP 66 50662 > http [ACK] Seq=97 Ack=931065 Win=644864 Len=0 TSval=1543159 TSecr=712861109
221   0.058377 54.230.142.81 -> 172.31.8.238 TCP 4410 [TCP segment of a reassembled PDU]
222   0.058383 172.31.8.238 -> 54.230.142.81 TCP 66 50662 > http [ACK] Seq=97 Ack=935409 Win=668672 Len=0 TSval=1543160 TSecr=712861109
223   0.058592 54.230.142.81 -> 172.31.8.238 TCP 8754 [TCP segment of a reassembled PDU]
224   0.058749 54.230.142.81 -> 172.31.8.238 TCP 26130 [TCP segment of a reassembled PDU]
225   0.058780 54.230.142.81 -> 172.31.8.238 TCP 5858 [TCP segment of a reassembled PDU]
226   0.058852 172.31.8.238 -> 54.230.142.81 TCP 66 50662 > http [ACK] Seq=97 Ack=975953 Win=628224 Len=0 TSval=1543160 TSecr=712861109
227   0.058873 54.230.142.81 -> 172.31.8.238 TCP 17442 [TCP segment of a reassembled PDU]
228   0.058891 172.31.8.238 -> 54.230.142.81 TCP 66 50662 > http [ACK] Seq=97 Ack=993329 Win=610944 Len=0 TSval=1543160 TSecr=712861109
229   0.059003 54.230.142.81 -> 172.31.8.238 TCP 2962 [TCP segment of a reassembled PDU]
230   0.059009 172.31.8.238 -> 54.230.142.81 TCP 66 50662 > http [ACK] Seq=97 Ack=996225 Win=670976 Len=0 TSval=1543160 TSecr=712861109
231   0.059351 54.230.142.81 -> 172.31.8.238 TCP 1514 [TCP segment of a reassembled PDU]
232   0.059615 54.230.142.81 -> 172.31.8.238 TCP 4410 [TCP segment of a reassembled PDU]
233   0.059630 172.31.8.238 -> 54.230.142.81 TCP 66 50662 > http [ACK] Seq=97 Ack=1002017 Win=674432 Len=0 TSval=1543160 TSecr=712861109
234   0.059778 54.230.142.81 -> 172.31.8.238 TCP 26130 [TCP segment of a reassembled PDU]
235   0.059804 172.31.8.238 -> 54.230.142.81 TCP 66 50662 > http [ACK] Seq=97 Ack=1028081 Win=648448 Len=0 TSval=1543160 TSecr=712861109
236   0.059817 54.230.142.81 -> 172.31.8.238 TCP 10202 [TCP segment of a reassembled PDU]
237   0.059836 172.31.8.238 -> 54.230.142.81 TCP 66 50662 > http [ACK] Seq=97 Ack=1038217 Win=659200 Len=0 TSval=1543160 TSecr=712861109
238   0.059879 54.230.142.81 -> 172.31.8.238 TCP 2962 [TCP segment of a reassembled PDU]
239   0.059884 172.31.8.238 -> 54.230.142.81 TCP 66 50662 > http [ACK] Seq=97 Ack=1041113 Win=670976 Len=0 TSval=1543160 TSecr=712861109
240   0.059994 54.230.142.81 -> 172.31.8.238 HTTP 7986 HTTP/1.1 200 OK  (application/octet-stream)
241   0.060014 172.31.8.238 -> 54.230.142.81 TCP 66 50662 > http [ACK] Seq=97 Ack=1049033 Win=674432 Len=0 TSval=1543160 TSecr=712861109
242   0.060151 172.31.8.238 -> 54.230.142.81 TCP 66 50662 > http [FIN, ACK] Seq=97 Ack=1049033 Win=674432 Len=0 TSval=1543160 TSecr=712861109
243   0.062897 54.230.142.81 -> 172.31.8.238 TCP 66 http > 50662 [FIN, ACK] Seq=1049033 Ack=98 Win=14592 Len=0 TSval=712861110 TSecr=1543160
244   0.062906 172.31.8.238 -> 54.230.142.81 TCP 66 50662 > http [ACK] Seq=98 Ack=1049034 Win=674432 Len=0 TSval=1543161 TSecr=712861110
