[Measurement for 1mb at 13:41:50 20.41.2014] 
Tshark:

  1   0.000000 172.31.8.238 -> 172.31.0.2   DNS 89 Standard query 0xe5af  A d1dx94olpiqj0t.cloudfront.net
  2   0.000031 172.31.8.238 -> 172.31.0.2   DNS 89 Standard query 0x4346  AAAA d1dx94olpiqj0t.cloudfront.net
  3   0.000686   172.31.0.2 -> 172.31.8.238 DNS 217 Standard query response 0xe5af  A 54.230.119.71 A 54.192.118.221 A 54.230.116.72 A 54.230.116.98 A 54.230.117.50 A 54.230.117.152 A 54.230.118.235 A 54.230.119.12
  4   0.000696   172.31.0.2 -> 172.31.8.238 DNS 176 Standard query response 0x4346 
  5   0.003862 172.31.8.238 -> 54.230.119.71 TCP 74 36965 > http [SYN] Seq=0 Win=26883 Len=0 MSS=8961 SACK_PERM=1 TSval=18634594 TSecr=0 WS=128
  6   0.004605 54.230.119.71 -> 172.31.8.238 TCP 74 http > 36965 [SYN, ACK] Seq=0 Ack=1 Win=14480 Len=0 MSS=1460 SACK_PERM=1 TSval=1687661963 TSecr=18634594 WS=128
  7   0.004620 172.31.8.238 -> 54.230.119.71 TCP 66 36965 > http [ACK] Seq=1 Ack=1 Win=27008 Len=0 TSval=18634594 TSecr=1687661963
  8   0.004661 172.31.8.238 -> 54.230.119.71 HTTP 162 GET /1mb HTTP/1.1 
  9   0.005367 54.230.119.71 -> 172.31.8.238 TCP 66 http > 36965 [ACK] Seq=1 Ack=97 Win=14592 Len=0 TSval=1687661963 TSecr=18634594
 10   0.006644 54.230.119.71 -> 172.31.8.238 TCP 523 [TCP segment of a reassembled PDU]
 11   0.006652 172.31.8.238 -> 54.230.119.71 TCP 66 36965 > http [ACK] Seq=97 Ack=458 Win=28032 Len=0 TSval=18634595 TSecr=1687661964
 12   0.006783 54.230.119.71 -> 172.31.8.238 TCP 13098 [TCP segment of a reassembled PDU]
 13   0.006793 172.31.8.238 -> 54.230.119.71 TCP 66 36965 > http [ACK] Seq=97 Ack=13490 Win=54144 Len=0 TSval=18634595 TSecr=1687661964
 14   0.007377 54.230.119.71 -> 172.31.8.238 TCP 2962 [TCP segment of a reassembled PDU]
 15   0.007383 172.31.8.238 -> 54.230.119.71 TCP 66 36965 > http [ACK] Seq=97 Ack=16386 Win=59904 Len=0 TSval=18634595 TSecr=1687661964
 16   0.007482 54.230.119.71 -> 172.31.8.238 TCP 10202 [TCP segment of a reassembled PDU]
 17   0.007490 172.31.8.238 -> 54.230.119.71 TCP 66 36965 > http [ACK] Seq=97 Ack=26522 Win=80128 Len=0 TSval=18634595 TSecr=1687661964
 18   0.008150 54.230.119.71 -> 172.31.8.238 TCP 4410 [TCP segment of a reassembled PDU]
 19   0.008156 172.31.8.238 -> 54.230.119.71 TCP 66 36965 > http [ACK] Seq=97 Ack=30866 Win=88832 Len=0 TSval=18634595 TSecr=1687661964
 20   0.008269 54.230.119.71 -> 172.31.8.238 TCP 15994 [TCP segment of a reassembled PDU]
 21   0.008279 172.31.8.238 -> 54.230.119.71 TCP 66 36965 > http [ACK] Seq=97 Ack=46794 Win=91648 Len=0 TSval=18634595 TSecr=1687661964
 22   0.008922 54.230.119.71 -> 172.31.8.238 TCP 7306 [TCP segment of a reassembled PDU]
 23   0.008929 172.31.8.238 -> 54.230.119.71 TCP 66 36965 > http [ACK] Seq=97 Ack=54034 Win=105984 Len=0 TSval=18634595 TSecr=1687661964
 24   0.009028 54.230.119.71 -> 172.31.8.238 TCP 11650 [TCP segment of a reassembled PDU]
 25   0.009036 172.31.8.238 -> 54.230.119.71 TCP 66 36965 > http [ACK] Seq=97 Ack=65618 Win=98944 Len=0 TSval=18634595 TSecr=1687661964
 26   0.009682 54.230.119.71 -> 172.31.8.238 TCP 4410 [TCP segment of a reassembled PDU]
 27   0.009688 172.31.8.238 -> 54.230.119.71 TCP 66 36965 > http [ACK] Seq=97 Ack=69962 Win=109056 Len=0 TSval=18634595 TSecr=1687661964
 28   0.009804 54.230.119.71 -> 172.31.8.238 TCP 21786 [TCP segment of a reassembled PDU]
 29   0.009817 172.31.8.238 -> 54.230.119.71 TCP 66 36965 > http [ACK] Seq=97 Ack=91682 Win=87424 Len=0 TSval=18634595 TSecr=1687661964
 30   0.010475 54.230.119.71 -> 172.31.8.238 TCP 5858 [TCP segment of a reassembled PDU]
 31   0.010482 172.31.8.238 -> 54.230.119.71 TCP 66 36965 > http [ACK] Seq=97 Ack=97474 Win=108416 Len=0 TSval=18634595 TSecr=1687661964
 32   0.010605 54.230.119.71 -> 172.31.8.238 TCP 23234 [TCP segment of a reassembled PDU]
 33   0.010617 172.31.8.238 -> 54.230.119.71 TCP 66 36965 > http [ACK] Seq=97 Ack=120642 Win=155392 Len=0 TSval=18634596 TSecr=1687661964
 34   0.011331 54.230.119.71 -> 172.31.8.238 TCP 2962 [TCP segment of a reassembled PDU]
 35   0.011336 172.31.8.238 -> 54.230.119.71 TCP 66 36965 > http [ACK] Seq=97 Ack=123538 Win=161152 Len=0 TSval=18634596 TSecr=1687661964
 36   0.011345 54.230.119.71 -> 172.31.8.238 TCP 7306 [TCP segment of a reassembled PDU]
 37   0.011351 172.31.8.238 -> 54.230.119.71 TCP 66 36965 > http [ACK] Seq=97 Ack=130778 Win=175616 Len=0 TSval=18634596 TSecr=1687661964
 38   0.011496 54.230.119.71 -> 172.31.8.238 TCP 21786 [TCP segment of a reassembled PDU]
 39   0.011508 172.31.8.238 -> 54.230.119.71 TCP 66 36965 > http [ACK] Seq=97 Ack=152498 Win=219136 Len=0 TSval=18634596 TSecr=1687661964
 40   0.012005 54.230.119.71 -> 172.31.8.238 TCP 4410 [TCP segment of a reassembled PDU]
 41   0.012012 172.31.8.238 -> 54.230.119.71 TCP 66 36965 > http [ACK] Seq=97 Ack=156842 Win=227840 Len=0 TSval=18634596 TSecr=1687661964
 42   0.012277 54.230.119.71 -> 172.31.8.238 TCP 5858 [TCP segment of a reassembled PDU]
 43   0.012285 172.31.8.238 -> 54.230.119.71 TCP 66 36965 > http [ACK] Seq=97 Ack=162634 Win=239360 Len=0 TSval=18634596 TSecr=1687661964
 44   0.012433 54.230.119.71 -> 172.31.8.238 TCP 20338 [TCP segment of a reassembled PDU]
 45   0.012445 172.31.8.238 -> 54.230.119.71 TCP 66 36965 > http [ACK] Seq=97 Ack=182906 Win=279936 Len=0 TSval=18634596 TSecr=1687661964
 46   0.013062 54.230.119.71 -> 172.31.8.238 TCP 4410 [TCP segment of a reassembled PDU]
 47   0.013069 172.31.8.238 -> 54.230.119.71 TCP 66 36965 > http [ACK] Seq=97 Ack=187250 Win=288640 Len=0 TSval=18634596 TSecr=1687661964
 48   0.013241 54.230.119.71 -> 172.31.8.238 TCP 26130 [TCP segment of a reassembled PDU]
 49   0.013254 172.31.8.238 -> 54.230.119.71 TCP 66 36965 > http [ACK] Seq=97 Ack=213314 Win=340736 Len=0 TSval=18634596 TSecr=1687661964
 50   0.013289 54.230.119.71 -> 172.31.8.238 TCP 10202 [TCP segment of a reassembled PDU]
 51   0.013296 172.31.8.238 -> 54.230.119.71 TCP 66 36965 > http [ACK] Seq=97 Ack=223450 Win=360960 Len=0 TSval=18634596 TSecr=1687661964
 52   0.013804 54.230.119.71 -> 172.31.8.238 TCP 5858 [TCP segment of a reassembled PDU]
 53   0.013811 172.31.8.238 -> 54.230.119.71 TCP 66 36965 > http [ACK] Seq=97 Ack=229242 Win=372608 Len=0 TSval=18634596 TSecr=1687661964
 54   0.013986 54.230.119.71 -> 172.31.8.238 TCP 24682 [TCP segment of a reassembled PDU]
 55   0.014000 172.31.8.238 -> 54.230.119.71 TCP 66 36965 > http [ACK] Seq=97 Ack=253858 Win=421888 Len=0 TSval=18634596 TSecr=1687661964
 56   0.014565 54.230.119.71 -> 172.31.8.238 TCP 8754 [TCP segment of a reassembled PDU]
 57   0.014573 172.31.8.238 -> 54.230.119.71 TCP 66 36965 > http [ACK] Seq=97 Ack=262546 Win=439168 Len=0 TSval=18634597 TSecr=1687661964
 58   0.014743 54.230.119.71 -> 172.31.8.238 TCP 26130 [TCP segment of a reassembled PDU]
 59   0.014758 172.31.8.238 -> 54.230.119.71 TCP 66 36965 > http [ACK] Seq=97 Ack=288610 Win=491392 Len=0 TSval=18634597 TSecr=1687661964
 60   0.014880 54.230.119.71 -> 172.31.8.238 TCP 10202 [TCP segment of a reassembled PDU]
 61   0.014888 172.31.8.238 -> 54.230.119.71 TCP 66 36965 > http [ACK] Seq=97 Ack=298746 Win=511616 Len=0 TSval=18634597 TSecr=1687661964
 62   0.015609 54.230.119.71 -> 172.31.8.238 TCP 7306 [TCP segment of a reassembled PDU]
 63   0.015617 172.31.8.238 -> 54.230.119.71 TCP 66 36965 > http [ACK] Seq=97 Ack=305986 Win=526080 Len=0 TSval=18634597 TSecr=1687661964
 64   0.015772 54.230.119.71 -> 172.31.8.238 TCP 18890 [TCP segment of a reassembled PDU]
 65   0.015784 172.31.8.238 -> 54.230.119.71 TCP 66 36965 > http [ACK] Seq=97 Ack=324810 Win=563712 Len=0 TSval=18634597 TSecr=1687661964
 66   0.015814 54.230.119.71 -> 172.31.8.238 TCP 7306 [TCP segment of a reassembled PDU]
 67   0.015822 172.31.8.238 -> 54.230.119.71 TCP 66 36965 > http [ACK] Seq=97 Ack=332050 Win=578176 Len=0 TSval=18634597 TSecr=1687661964
 68   0.015896 54.230.119.71 -> 172.31.8.238 TCP 11650 [TCP segment of a reassembled PDU]
 69   0.015904 172.31.8.238 -> 54.230.119.71 TCP 66 36965 > http [ACK] Seq=97 Ack=343634 Win=601344 Len=0 TSval=18634597 TSecr=1687661964
 70   0.016460 54.230.119.71 -> 172.31.8.238 TCP 5858 [TCP segment of a reassembled PDU]
 71   0.016467 172.31.8.238 -> 54.230.119.71 TCP 66 36965 > http [ACK] Seq=97 Ack=349426 Win=612992 Len=0 TSval=18634597 TSecr=1687661965
 72   0.016656 54.230.119.71 -> 172.31.8.238 TCP 26130 [TCP segment of a reassembled PDU]
 73   0.016671 172.31.8.238 -> 54.230.119.71 TCP 66 36965 > http [ACK] Seq=97 Ack=375490 Win=665088 Len=0 TSval=18634597 TSecr=1687661965
 74   0.016736 54.230.119.71 -> 172.31.8.238 TCP 26130 [TCP segment of a reassembled PDU]
 75   0.016749 172.31.8.238 -> 54.230.119.71 TCP 66 36965 > http [ACK] Seq=97 Ack=401554 Win=717184 Len=0 TSval=18634597 TSecr=1687661965
 76   0.017104 54.230.119.71 -> 172.31.8.238 TCP 5858 [TCP segment of a reassembled PDU]
 77   0.017112 172.31.8.238 -> 54.230.119.71 TCP 66 36965 > http [ACK] Seq=97 Ack=407346 Win=728832 Len=0 TSval=18634597 TSecr=1687661965
 78   0.017238 54.230.119.71 -> 172.31.8.238 TCP 1514 [TCP segment of a reassembled PDU]
 79   0.017242 172.31.8.238 -> 54.230.119.71 TCP 66 36965 > http [ACK] Seq=97 Ack=408794 Win=731648 Len=0 TSval=18634597 TSecr=1687661965
 80   0.017371 54.230.119.71 -> 172.31.8.238 TCP 4410 [TCP segment of a reassembled PDU]
 81   0.017377 172.31.8.238 -> 54.230.119.71 TCP 66 36965 > http [ACK] Seq=97 Ack=413138 Win=740352 Len=0 TSval=18634597 TSecr=1687661965
 82   0.017526 54.230.119.71 -> 172.31.8.238 TCP 24682 [TCP segment of a reassembled PDU]
 83   0.017540 172.31.8.238 -> 54.230.119.71 TCP 66 36965 > http [ACK] Seq=97 Ack=437754 Win=789632 Len=0 TSval=18634597 TSecr=1687661965
 84   0.017546 54.230.119.71 -> 172.31.8.238 TCP 1514 [TCP segment of a reassembled PDU]
 85   0.017548 172.31.8.238 -> 54.230.119.71 TCP 66 36965 > http [ACK] Seq=97 Ack=439202 Win=792576 Len=0 TSval=18634597 TSecr=1687661965
 86   0.017650 54.230.119.71 -> 172.31.8.238 TCP 24682 [TCP segment of a reassembled PDU]
 87   0.017663 172.31.8.238 -> 54.230.119.71 TCP 66 36965 > http [ACK] Seq=97 Ack=463818 Win=841728 Len=0 TSval=18634597 TSecr=1687661965
 88   0.017873 54.230.119.71 -> 172.31.8.238 TCP 5858 [TCP segment of a reassembled PDU]
 89   0.017880 172.31.8.238 -> 54.230.119.71 TCP 66 36965 > http [ACK] Seq=97 Ack=469610 Win=853376 Len=0 TSval=18634597 TSecr=1687661965
 90   0.017991 54.230.119.71 -> 172.31.8.238 TCP 4410 [TCP segment of a reassembled PDU]
 91   0.018009 172.31.8.238 -> 54.230.119.71 TCP 66 36965 > http [ACK] Seq=97 Ack=473954 Win=862080 Len=0 TSval=18634597 TSecr=1687661965
 92   0.018264 54.230.119.71 -> 172.31.8.238 TCP 26130 [TCP segment of a reassembled PDU]
 93   0.018278 172.31.8.238 -> 54.230.119.71 TCP 66 36965 > http [ACK] Seq=97 Ack=500018 Win=903296 Len=0 TSval=18634597 TSecr=1687661965
 94   0.018308 54.230.119.71 -> 172.31.8.238 TCP 5858 [TCP segment of a reassembled PDU]
 95   0.018315 172.31.8.238 -> 54.230.119.71 TCP 66 36965 > http [ACK] Seq=97 Ack=505810 Win=925696 Len=0 TSval=18634597 TSecr=1687661965
 96   0.018425 54.230.119.71 -> 172.31.8.238 TCP 10202 [TCP segment of a reassembled PDU]
 97   0.018431 172.31.8.238 -> 54.230.119.71 TCP 66 36965 > http [ACK] Seq=97 Ack=515946 Win=929408 Len=0 TSval=18634597 TSecr=1687661965
 98   0.018547 54.230.119.71 -> 172.31.8.238 TCP 23234 [TCP segment of a reassembled PDU]
 99   0.018560 172.31.8.238 -> 54.230.119.71 TCP 66 36965 > http [ACK] Seq=97 Ack=539114 Win=906240 Len=0 TSval=18634598 TSecr=1687661965
100   0.018910 54.230.119.71 -> 172.31.8.238 TCP 4410 [TCP segment of a reassembled PDU]
101   0.018916 172.31.8.238 -> 54.230.119.71 TCP 66 36965 > http [ACK] Seq=97 Ack=543458 Win=954752 Len=0 TSval=18634598 TSecr=1687661965
102   0.019082 54.230.119.71 -> 172.31.8.238 TCP 18890 [TCP segment of a reassembled PDU]
103   0.019093 172.31.8.238 -> 54.230.119.71 TCP 66 36965 > http [ACK] Seq=97 Ack=562282 Win=992384 Len=0 TSval=18634598 TSecr=1687661965
104   0.019119 54.230.119.71 -> 172.31.8.238 TCP 7306 [TCP segment of a reassembled PDU]
105   0.019124 172.31.8.238 -> 54.230.119.71 TCP 66 36965 > http [ACK] Seq=97 Ack=569522 Win=1006848 Len=0 TSval=18634598 TSecr=1687661965
106   0.019189 54.230.119.71 -> 172.31.8.238 TCP 5858 [TCP segment of a reassembled PDU]
107   0.019194 172.31.8.238 -> 54.230.119.71 TCP 66 36965 > http [ACK] Seq=97 Ack=575314 Win=1018368 Len=0 TSval=18634598 TSecr=1687661965
108   0.019204 54.230.119.71 -> 172.31.8.238 TCP 11650 [TCP segment of a reassembled PDU]
109   0.019210 172.31.8.238 -> 54.230.119.71 TCP 66 36965 > http [ACK] Seq=97 Ack=586898 Win=1041536 Len=0 TSval=18634598 TSecr=1687661965
110   0.019354 54.230.119.71 -> 172.31.8.238 TCP 17442 [TCP segment of a reassembled PDU]
111   0.019364 172.31.8.238 -> 54.230.119.71 TCP 66 36965 > http [ACK] Seq=97 Ack=604274 Win=1076352 Len=0 TSval=18634598 TSecr=1687661965
112   0.019675 54.230.119.71 -> 172.31.8.238 TCP 7306 [TCP segment of a reassembled PDU]
113   0.019682 172.31.8.238 -> 54.230.119.71 TCP 66 36965 > http [ACK] Seq=97 Ack=611514 Win=1090816 Len=0 TSval=18634598 TSecr=1687661965
114   0.019843 54.230.119.71 -> 172.31.8.238 TCP 26130 [TCP segment of a reassembled PDU]
115   0.019856 172.31.8.238 -> 54.230.119.71 TCP 66 36965 > http [ACK] Seq=97 Ack=637578 Win=1142912 Len=0 TSval=18634598 TSecr=1687661965
116   0.019876 54.230.119.71 -> 172.31.8.238 TCP 7306 [TCP segment of a reassembled PDU]
117   0.019881 172.31.8.238 -> 54.230.119.71 TCP 66 36965 > http [ACK] Seq=97 Ack=644818 Win=1157376 Len=0 TSval=18634598 TSecr=1687661965
118   0.020065 54.230.119.71 -> 172.31.8.238 TCP 11650 [TCP segment of a reassembled PDU]
119   0.020073 172.31.8.238 -> 54.230.119.71 TCP 66 36965 > http [ACK] Seq=97 Ack=656402 Win=1180544 Len=0 TSval=18634598 TSecr=1687661965
120   0.020223 54.230.119.71 -> 172.31.8.238 TCP 17442 [TCP segment of a reassembled PDU]
121   0.020233 172.31.8.238 -> 54.230.119.71 TCP 66 36965 > http [ACK] Seq=97 Ack=673778 Win=1215360 Len=0 TSval=18634598 TSecr=1687661965
122   0.020256 54.230.119.71 -> 172.31.8.238 TCP 8754 [TCP segment of a reassembled PDU]
123   0.020262 172.31.8.238 -> 54.230.119.71 TCP 66 36965 > http [ACK] Seq=97 Ack=682466 Win=1232768 Len=0 TSval=18634598 TSecr=1687661965
124   0.020326 54.230.119.71 -> 172.31.8.238 TCP 18890 [TCP segment of a reassembled PDU]
125   0.020337 172.31.8.238 -> 54.230.119.71 TCP 66 36965 > http [ACK] Seq=97 Ack=701290 Win=1270400 Len=0 TSval=18634598 TSecr=1687661965
126   0.020497 54.230.119.71 -> 172.31.8.238 TCP 24682 [TCP segment of a reassembled PDU]
127   0.020510 172.31.8.238 -> 54.230.119.71 TCP 66 36965 > http [ACK] Seq=97 Ack=725906 Win=1266048 Len=0 TSval=18634598 TSecr=1687661965
128   0.020596 54.230.119.71 -> 172.31.8.238 TCP 8754 [TCP segment of a reassembled PDU]
129   0.020603 172.31.8.238 -> 54.230.119.71 TCP 66 36965 > http [ACK] Seq=97 Ack=734594 Win=1287680 Len=0 TSval=18634598 TSecr=1687661965
130   0.021062 54.230.119.71 -> 172.31.8.238 TCP 4410 [TCP segment of a reassembled PDU]
131   0.021069 172.31.8.238 -> 54.230.119.71 TCP 66 36965 > http [ACK] Seq=97 Ack=738938 Win=1296384 Len=0 TSval=18634598 TSecr=1687661965
132   0.021237 54.230.119.71 -> 172.31.8.238 TCP 26130 [TCP segment of a reassembled PDU]
133   0.021251 172.31.8.238 -> 54.230.119.71 TCP 66 36965 > http [ACK] Seq=97 Ack=765002 Win=1270400 Len=0 TSval=18634598 TSecr=1687661965
134   0.021306 54.230.119.71 -> 172.31.8.238 TCP 23234 [TCP segment of a reassembled PDU]
135   0.021319 172.31.8.238 -> 54.230.119.71 TCP 66 36965 > http [ACK] Seq=97 Ack=788170 Win=1268480 Len=0 TSval=18634598 TSecr=1687661965
136   0.021385 54.230.119.71 -> 172.31.8.238 TCP 29026 [TCP segment of a reassembled PDU]
137   0.021399 172.31.8.238 -> 54.230.119.71 TCP 66 36965 > http [ACK] Seq=97 Ack=817130 Win=1258880 Len=0 TSval=18634598 TSecr=1687661965
138   0.021450 54.230.119.71 -> 172.31.8.238 TCP 18890 [TCP segment of a reassembled PDU]
139   0.021460 172.31.8.238 -> 54.230.119.71 TCP 66 36965 > http [ACK] Seq=97 Ack=835954 Win=1275520 Len=0 TSval=18634598 TSecr=1687661965
140   0.021835 54.230.119.71 -> 172.31.8.238 TCP 1514 [TCP segment of a reassembled PDU]
141   0.021840 172.31.8.238 -> 54.230.119.71 TCP 66 36965 > http [ACK] Seq=97 Ack=837402 Win=1299328 Len=0 TSval=18634598 TSecr=1687661965
142   0.022023 54.230.119.71 -> 172.31.8.238 TCP 26130 [TCP segment of a reassembled PDU]
143   0.022037 172.31.8.238 -> 54.230.119.71 TCP 66 36965 > http [ACK] Seq=97 Ack=863466 Win=1273344 Len=0 TSval=18634598 TSecr=1687661965
144   0.022042 54.230.119.71 -> 172.31.8.238 TCP 1514 [TCP segment of a reassembled PDU]
145   0.022057 172.31.8.238 -> 54.230.119.71 TCP 66 36965 > http [ACK] Seq=97 Ack=864914 Win=1271936 Len=0 TSval=18634598 TSecr=1687661965
146   0.022250 54.230.119.71 -> 172.31.8.238 TCP 33370 [TCP segment of a reassembled PDU]
147   0.022279 172.31.8.238 -> 54.230.119.71 TCP 66 36965 > http [ACK] Seq=97 Ack=898218 Win=1251712 Len=0 TSval=18634598 TSecr=1687661965
148   0.022298 54.230.119.71 -> 172.31.8.238 TCP 18890 [TCP segment of a reassembled PDU]
149   0.022317 172.31.8.238 -> 54.230.119.71 TCP 66 36965 > http [ACK] Seq=97 Ack=917042 Win=1232896 Len=0 TSval=18634598 TSecr=1687661965
150   0.022375 54.230.119.71 -> 172.31.8.238 TCP 13098 [TCP segment of a reassembled PDU]
151   0.022384 172.31.8.238 -> 54.230.119.71 TCP 66 36965 > http [ACK] Seq=97 Ack=930074 Win=1285120 Len=0 TSval=18634598 TSecr=1687661965
152   0.022694 54.230.119.71 -> 172.31.8.238 TCP 26130 [TCP segment of a reassembled PDU]
153   0.022733 172.31.8.238 -> 54.230.119.71 TCP 66 36965 > http [ACK] Seq=97 Ack=956138 Win=1299328 Len=0 TSval=18634599 TSecr=1687661965
154   0.022759 54.230.119.71 -> 172.31.8.238 TCP 18890 [TCP segment of a reassembled PDU]
155   0.022772 172.31.8.238 -> 54.230.119.71 TCP 66 36965 > http [ACK] Seq=97 Ack=974962 Win=1336960 Len=0 TSval=18634599 TSecr=1687661965
156   0.022975 54.230.119.71 -> 172.31.8.238 TCP 26130 [TCP segment of a reassembled PDU]
157   0.022989 172.31.8.238 -> 54.230.119.71 TCP 66 36965 > http [ACK] Seq=97 Ack=1001026 Win=1389056 Len=0 TSval=18634599 TSecr=1687661965
158   0.023059 54.230.119.71 -> 172.31.8.238 TCP 17442 [TCP segment of a reassembled PDU]
159   0.023070 172.31.8.238 -> 54.230.119.71 TCP 66 36965 > http [ACK] Seq=97 Ack=1018402 Win=1423872 Len=0 TSval=18634599 TSecr=1687661965
160   0.023141 54.230.119.71 -> 172.31.8.238 TCP 8754 [TCP segment of a reassembled PDU]
161   0.023148 172.31.8.238 -> 54.230.119.71 TCP 66 36965 > http [ACK] Seq=97 Ack=1027090 Win=1441280 Len=0 TSval=18634599 TSecr=1687661965
162   0.023228 54.230.119.71 -> 172.31.8.238 TCP 20338 [TCP segment of a reassembled PDU]
163   0.023252 172.31.8.238 -> 54.230.119.71 TCP 66 36965 > http [ACK] Seq=97 Ack=1047362 Win=1481728 Len=0 TSval=18634599 TSecr=1687661965
164   0.023379 54.230.119.71 -> 172.31.8.238 HTTP 1738 HTTP/1.1 200 OK  (application/octet-stream)
165   0.023384 172.31.8.238 -> 54.230.119.71 TCP 66 36965 > http [ACK] Seq=97 Ack=1049034 Win=1481728 Len=0 TSval=18634599 TSecr=1687661965
166   0.023516 172.31.8.238 -> 54.230.119.71 TCP 66 36965 > http [FIN, ACK] Seq=97 Ack=1049034 Win=1481728 Len=0 TSval=18634599 TSecr=1687661965
167   0.023861 54.230.119.71 -> 172.31.8.238 TCP 66 http > 36965 [FIN, ACK] Seq=1049034 Ack=98 Win=14592 Len=0 TSval=1687661965 TSecr=18634599
168   0.023870 172.31.8.238 -> 54.230.119.71 TCP 66 36965 > http [ACK] Seq=98 Ack=1049035 Win=1481728 Len=0 TSval=18634599 TSecr=1687661965
