[Measurement for 1mb at 23:41:50 19.41.2014] 
Tshark:

  1   0.000000 172.31.8.238 -> 172.31.0.2   DNS 89 Standard query 0x85f7  A d1dx94olpiqj0t.cloudfront.net
  2   0.000026 172.31.8.238 -> 172.31.0.2   DNS 89 Standard query 0x6cf9  AAAA d1dx94olpiqj0t.cloudfront.net
  3   0.000766   172.31.0.2 -> 172.31.8.238 DNS 217 Standard query response 0x85f7  A 54.230.116.44 A 54.230.117.15 A 54.230.118.146 A 54.239.132.233 A 54.239.132.249 A 54.192.118.218 A 54.192.118.234 A 54.192.118.242
  4   0.000777   172.31.0.2 -> 172.31.8.238 DNS 176 Standard query response 0x6cf9 
  5   0.003905 172.31.8.238 -> 54.230.116.44 TCP 74 53120 > http [SYN] Seq=0 Win=26883 Len=0 MSS=8961 SACK_PERM=1 TSval=6034526 TSecr=0 WS=128
  6   0.004633 54.230.116.44 -> 172.31.8.238 TCP 74 http > 53120 [SYN, ACK] Seq=0 Ack=1 Win=14480 Len=0 MSS=1460 SACK_PERM=1 TSval=1682966081 TSecr=6034526 WS=128
  7   0.004647 172.31.8.238 -> 54.230.116.44 TCP 66 53120 > http [ACK] Seq=1 Ack=1 Win=27008 Len=0 TSval=6034526 TSecr=1682966081
  8   0.004685 172.31.8.238 -> 54.230.116.44 HTTP 162 GET /1mb HTTP/1.1 
  9   0.005358 54.230.116.44 -> 172.31.8.238 TCP 66 http > 53120 [ACK] Seq=1 Ack=97 Win=14592 Len=0 TSval=1682966082 TSecr=6034526
 10   0.007388 54.230.116.44 -> 172.31.8.238 TCP 523 [TCP segment of a reassembled PDU]
 11   0.007396 172.31.8.238 -> 54.230.116.44 TCP 66 53120 > http [ACK] Seq=97 Ack=458 Win=28032 Len=0 TSval=6034527 TSecr=1682966082
 12   0.007506 54.230.116.44 -> 172.31.8.238 TCP 13098 [TCP segment of a reassembled PDU]
 13   0.007517 172.31.8.238 -> 54.230.116.44 TCP 66 53120 > http [ACK] Seq=97 Ack=13490 Win=54144 Len=0 TSval=6034527 TSecr=1682966082
 14   0.008252 54.230.116.44 -> 172.31.8.238 TCP 2962 [TCP segment of a reassembled PDU]
 15   0.008258 172.31.8.238 -> 54.230.116.44 TCP 66 53120 > http [ACK] Seq=97 Ack=16386 Win=59904 Len=0 TSval=6034527 TSecr=1682966082
 16   0.008352 54.230.116.44 -> 172.31.8.238 TCP 10202 [TCP segment of a reassembled PDU]
 17   0.008360 172.31.8.238 -> 54.230.116.44 TCP 66 53120 > http [ACK] Seq=97 Ack=26522 Win=80128 Len=0 TSval=6034527 TSecr=1682966082
 18   0.009097 54.230.116.44 -> 172.31.8.238 TCP 7306 [TCP segment of a reassembled PDU]
 19   0.009105 172.31.8.238 -> 54.230.116.44 TCP 66 53120 > http [ACK] Seq=97 Ack=33762 Win=94592 Len=0 TSval=6034527 TSecr=1682966082
 20   0.009240 54.230.116.44 -> 172.31.8.238 TCP 13098 [TCP segment of a reassembled PDU]
 21   0.009249 172.31.8.238 -> 54.230.116.44 TCP 66 53120 > http [ACK] Seq=97 Ack=46794 Win=96512 Len=0 TSval=6034527 TSecr=1682966082
 22   0.009838 54.230.116.44 -> 172.31.8.238 TCP 5858 [TCP segment of a reassembled PDU]
 23   0.009857 172.31.8.238 -> 54.230.116.44 TCP 66 53120 > http [ACK] Seq=97 Ack=52586 Win=108416 Len=0 TSval=6034528 TSecr=1682966082
 24   0.009959 54.230.116.44 -> 172.31.8.238 TCP 13098 [TCP segment of a reassembled PDU]
 25   0.009968 172.31.8.238 -> 54.230.116.44 TCP 66 53120 > http [ACK] Seq=97 Ack=65618 Win=135168 Len=0 TSval=6034528 TSecr=1682966082
 26   0.010558 54.230.116.44 -> 172.31.8.238 TCP 2962 [TCP segment of a reassembled PDU]
 27   0.010564 172.31.8.238 -> 54.230.116.44 TCP 66 53120 > http [ACK] Seq=97 Ack=68514 Win=140928 Len=0 TSval=6034528 TSecr=1682966082
 28   0.010682 54.230.116.44 -> 172.31.8.238 TCP 23234 [TCP segment of a reassembled PDU]
 29   0.010709 172.31.8.238 -> 54.230.116.44 TCP 66 53120 > http [ACK] Seq=97 Ack=91682 Win=187264 Len=0 TSval=6034528 TSecr=1682966082
 30   0.011330 54.230.116.44 -> 172.31.8.238 TCP 4410 [TCP segment of a reassembled PDU]
 31   0.011337 172.31.8.238 -> 54.230.116.44 TCP 66 53120 > http [ACK] Seq=97 Ack=96026 Win=195968 Len=0 TSval=6034528 TSecr=1682966082
 32   0.011459 54.230.116.44 -> 172.31.8.238 TCP 21786 [TCP segment of a reassembled PDU]
 33   0.011471 172.31.8.238 -> 54.230.116.44 TCP 66 53120 > http [ACK] Seq=97 Ack=117746 Win=239360 Len=0 TSval=6034528 TSecr=1682966082
 34   0.012105 54.230.116.44 -> 172.31.8.238 TCP 2962 [TCP segment of a reassembled PDU]
 35   0.012110 172.31.8.238 -> 54.230.116.44 TCP 66 53120 > http [ACK] Seq=97 Ack=120642 Win=245120 Len=0 TSval=6034528 TSecr=1682966082
 36   0.012247 54.230.116.44 -> 172.31.8.238 TCP 23234 [TCP segment of a reassembled PDU]
 37   0.012261 172.31.8.238 -> 54.230.116.44 TCP 66 53120 > http [ACK] Seq=97 Ack=143810 Win=291456 Len=0 TSval=6034528 TSecr=1682966082
 38   0.012883 54.230.116.44 -> 172.31.8.238 TCP 2962 [TCP segment of a reassembled PDU]
 39   0.012889 172.31.8.238 -> 54.230.116.44 TCP 66 53120 > http [ACK] Seq=97 Ack=146706 Win=297344 Len=0 TSval=6034528 TSecr=1682966082
 40   0.013024 54.230.116.44 -> 172.31.8.238 TCP 23234 [TCP segment of a reassembled PDU]
 41   0.013037 172.31.8.238 -> 54.230.116.44 TCP 66 53120 > http [ACK] Seq=97 Ack=169874 Win=295296 Len=0 TSval=6034528 TSecr=1682966082
 42   0.013633 54.230.116.44 -> 172.31.8.238 TCP 4410 [TCP segment of a reassembled PDU]
 43   0.013640 172.31.8.238 -> 54.230.116.44 TCP 66 53120 > http [ACK] Seq=97 Ack=174218 Win=306048 Len=0 TSval=6034528 TSecr=1682966082
 44   0.013775 54.230.116.44 -> 172.31.8.238 TCP 21786 [TCP segment of a reassembled PDU]
 45   0.013784 172.31.8.238 -> 54.230.116.44 TCP 66 53120 > http [ACK] Seq=97 Ack=195938 Win=297728 Len=0 TSval=6034528 TSecr=1682966082
 46   0.014480 54.230.116.44 -> 172.31.8.238 TCP 26130 [TCP segment of a reassembled PDU]
 47   0.014494 172.31.8.238 -> 54.230.116.44 TCP 66 53120 > http [ACK] Seq=97 Ack=222002 Win=358144 Len=0 TSval=6034529 TSecr=1682966082
 48   0.014523 54.230.116.44 -> 172.31.8.238 TCP 14546 [TCP segment of a reassembled PDU]
 49   0.014535 172.31.8.238 -> 54.230.116.44 TCP 66 53120 > http [ACK] Seq=97 Ack=236482 Win=387072 Len=0 TSval=6034529 TSecr=1682966082
 50   0.015219 54.230.116.44 -> 172.31.8.238 TCP 4410 [TCP segment of a reassembled PDU]
 51   0.015226 172.31.8.238 -> 54.230.116.44 TCP 66 53120 > http [ACK] Seq=97 Ack=240826 Win=395776 Len=0 TSval=6034529 TSecr=1682966082
 52   0.015340 54.230.116.44 -> 172.31.8.238 TCP 17442 [TCP segment of a reassembled PDU]
 53   0.015351 172.31.8.238 -> 54.230.116.44 TCP 66 53120 > http [ACK] Seq=97 Ack=258202 Win=430464 Len=0 TSval=6034529 TSecr=1682966082
 54   0.015373 54.230.116.44 -> 172.31.8.238 TCP 8754 [TCP segment of a reassembled PDU]
 55   0.015379 172.31.8.238 -> 54.230.116.44 TCP 66 53120 > http [ACK] Seq=97 Ack=266890 Win=447872 Len=0 TSval=6034529 TSecr=1682966082
 56   0.015439 54.230.116.44 -> 172.31.8.238 TCP 13098 [TCP segment of a reassembled PDU]
 57   0.015447 172.31.8.238 -> 54.230.116.44 TCP 66 53120 > http [ACK] Seq=97 Ack=279922 Win=473984 Len=0 TSval=6034529 TSecr=1682966082
 58   0.015968 54.230.116.44 -> 172.31.8.238 TCP 11650 [TCP segment of a reassembled PDU]
 59   0.015977 172.31.8.238 -> 54.230.116.44 TCP 66 53120 > http [ACK] Seq=97 Ack=291506 Win=497152 Len=0 TSval=6034529 TSecr=1682966083
 60   0.016339 54.230.116.44 -> 172.31.8.238 TCP 23234 [TCP segment of a reassembled PDU]
 61   0.016352 172.31.8.238 -> 54.230.116.44 TCP 66 53120 > http [ACK] Seq=97 Ack=314674 Win=543488 Len=0 TSval=6034529 TSecr=1682966083
 62   0.016699 54.230.116.44 -> 172.31.8.238 TCP 2962 [TCP segment of a reassembled PDU]
 63   0.016704 172.31.8.238 -> 54.230.116.44 TCP 66 53120 > http [ACK] Seq=97 Ack=317570 Win=549248 Len=0 TSval=6034529 TSecr=1682966083
 64   0.016861 54.230.116.44 -> 172.31.8.238 TCP 21786 [TCP segment of a reassembled PDU]
 65   0.016872 172.31.8.238 -> 54.230.116.44 TCP 66 53120 > http [ACK] Seq=97 Ack=339290 Win=592640 Len=0 TSval=6034529 TSecr=1682966083
 66   0.016985 54.230.116.44 -> 172.31.8.238 TCP 27578 [TCP segment of a reassembled PDU]
 67   0.016999 172.31.8.238 -> 54.230.116.44 TCP 66 53120 > http [ACK] Seq=97 Ack=366802 Win=647680 Len=0 TSval=6034529 TSecr=1682966083
 68   0.017473 54.230.116.44 -> 172.31.8.238 TCP 5858 [TCP segment of a reassembled PDU]
 69   0.017479 172.31.8.238 -> 54.230.116.44 TCP 66 53120 > http [ACK] Seq=97 Ack=372594 Win=659328 Len=0 TSval=6034529 TSecr=1682966083
 70   0.017617 54.230.116.44 -> 172.31.8.238 TCP 21786 [TCP segment of a reassembled PDU]
 71   0.017628 172.31.8.238 -> 54.230.116.44 TCP 66 53120 > http [ACK] Seq=97 Ack=394314 Win=702720 Len=0 TSval=6034529 TSecr=1682966083
 72   0.017873 54.230.116.44 -> 172.31.8.238 TCP 26130 [TCP segment of a reassembled PDU]
 73   0.017886 172.31.8.238 -> 54.230.116.44 TCP 66 53120 > http [ACK] Seq=97 Ack=420378 Win=754816 Len=0 TSval=6034530 TSecr=1682966083
 74   0.017893 54.230.116.44 -> 172.31.8.238 TCP 2962 [TCP segment of a reassembled PDU]
 75   0.017897 172.31.8.238 -> 54.230.116.44 TCP 66 53120 > http [ACK] Seq=97 Ack=423274 Win=760704 Len=0 TSval=6034530 TSecr=1682966083
 76   0.018323 54.230.116.44 -> 172.31.8.238 TCP 26130 [TCP segment of a reassembled PDU]
 77   0.018336 172.31.8.238 -> 54.230.116.44 TCP 66 53120 > http [ACK] Seq=97 Ack=449338 Win=812800 Len=0 TSval=6034530 TSecr=1682966083
 78   0.018361 54.230.116.44 -> 172.31.8.238 TCP 4410 [TCP segment of a reassembled PDU]
 79   0.018365 172.31.8.238 -> 54.230.116.44 TCP 66 53120 > http [ACK] Seq=97 Ack=453682 Win=821504 Len=0 TSval=6034530 TSecr=1682966083
 80   0.018589 54.230.116.44 -> 172.31.8.238 TCP 15994 [TCP segment of a reassembled PDU]
 81   0.018599 172.31.8.238 -> 54.230.116.44 TCP 66 53120 > http [ACK] Seq=97 Ack=469610 Win=853376 Len=0 TSval=6034530 TSecr=1682966083
 82   0.019007 54.230.116.44 -> 172.31.8.238 TCP 4410 [TCP segment of a reassembled PDU]
 83   0.019013 172.31.8.238 -> 54.230.116.44 TCP 66 53120 > http [ACK] Seq=97 Ack=473954 Win=862080 Len=0 TSval=6034530 TSecr=1682966083
 84   0.019198 54.230.116.44 -> 172.31.8.238 TCP 26130 [TCP segment of a reassembled PDU]
 85   0.019211 172.31.8.238 -> 54.230.116.44 TCP 66 53120 > http [ACK] Seq=97 Ack=500018 Win=914176 Len=0 TSval=6034530 TSecr=1682966083
 86   0.019344 54.230.116.44 -> 172.31.8.238 TCP 26130 [TCP segment of a reassembled PDU]
 87   0.019356 172.31.8.238 -> 54.230.116.44 TCP 66 53120 > http [ACK] Seq=97 Ack=526082 Win=966272 Len=0 TSval=6034530 TSecr=1682966083
 88   0.019366 54.230.116.44 -> 172.31.8.238 TCP 8754 [TCP segment of a reassembled PDU]
 89   0.019374 172.31.8.238 -> 54.230.116.44 TCP 66 53120 > http [ACK] Seq=97 Ack=534770 Win=983680 Len=0 TSval=6034530 TSecr=1682966083
 90   0.019787 54.230.116.44 -> 172.31.8.238 TCP 5858 [TCP segment of a reassembled PDU]
 91   0.019794 172.31.8.238 -> 54.230.116.44 TCP 66 53120 > http [ACK] Seq=97 Ack=540562 Win=995200 Len=0 TSval=6034530 TSecr=1682966083
 92   0.019954 54.230.116.44 -> 172.31.8.238 TCP 26130 [TCP segment of a reassembled PDU]
 93   0.019967 172.31.8.238 -> 54.230.116.44 TCP 66 53120 > http [ACK] Seq=97 Ack=566626 Win=1047424 Len=0 TSval=6034530 TSecr=1682966083
 94   0.019999 54.230.116.44 -> 172.31.8.238 TCP 13098 [TCP segment of a reassembled PDU]
 95   0.020009 172.31.8.238 -> 54.230.116.44 TCP 66 53120 > http [ACK] Seq=97 Ack=579658 Win=1073408 Len=0 TSval=6034530 TSecr=1682966083
 96   0.020061 54.230.116.44 -> 172.31.8.238 TCP 1514 [TCP Previous segment not captured] [TCP segment of a reassembled PDU]
 97   0.020066 172.31.8.238 -> 54.230.116.44 TCP 78 [TCP Window Update] 53120 > http [ACK] Seq=97 Ack=579658 Win=1076352 Len=0 TSval=6034530 TSecr=1682966083 SLE=581106 SRE=582554
 98   0.020122 54.230.116.44 -> 172.31.8.238 TCP 1514 [TCP Out-Of-Order] [TCP segment of a reassembled PDU]
 99   0.020127 172.31.8.238 -> 54.230.116.44 TCP 66 53120 > http [ACK] Seq=97 Ack=582554 Win=1079168 Len=0 TSval=6034530 TSecr=1682966083
100   0.020192 54.230.116.44 -> 172.31.8.238 TCP 17442 [TCP segment of a reassembled PDU]
101   0.020200 172.31.8.238 -> 54.230.116.44 TCP 66 53120 > http [ACK] Seq=97 Ack=599930 Win=1113984 Len=0 TSval=6034530 TSecr=1682966083
102   0.020574 54.230.116.44 -> 172.31.8.238 TCP 2962 [TCP segment of a reassembled PDU]
103   0.020579 172.31.8.238 -> 54.230.116.44 TCP 66 53120 > http [ACK] Seq=97 Ack=602826 Win=1119744 Len=0 TSval=6034530 TSecr=1682966083
104   0.020788 54.230.116.44 -> 172.31.8.238 TCP 26130 [TCP segment of a reassembled PDU]
105   0.020801 172.31.8.238 -> 54.230.116.44 TCP 66 53120 > http [ACK] Seq=97 Ack=628890 Win=1128576 Len=0 TSval=6034530 TSecr=1682966083
106   0.020922 54.230.116.44 -> 172.31.8.238 TCP 26130 [TCP segment of a reassembled PDU]
107   0.020935 172.31.8.238 -> 54.230.116.44 TCP 66 53120 > http [ACK] Seq=97 Ack=654954 Win=1128576 Len=0 TSval=6034530 TSecr=1682966083
108   0.020945 54.230.116.44 -> 172.31.8.238 TCP 10202 [TCP segment of a reassembled PDU]
109   0.020954 172.31.8.238 -> 54.230.116.44 TCP 66 53120 > http [ACK] Seq=97 Ack=665090 Win=1118464 Len=0 TSval=6034530 TSecr=1682966083
110   0.021576 54.230.116.44 -> 172.31.8.238 TCP 2962 [TCP segment of a reassembled PDU]
111   0.021582 172.31.8.238 -> 54.230.116.44 TCP 66 53120 > http [ACK] Seq=97 Ack=667986 Win=1166592 Len=0 TSval=6034530 TSecr=1682966083
112   0.021748 54.230.116.44 -> 172.31.8.238 TCP 23234 [TCP segment of a reassembled PDU]
113   0.021760 172.31.8.238 -> 54.230.116.44 TCP 66 53120 > http [ACK] Seq=97 Ack=691154 Win=1143424 Len=0 TSval=6034530 TSecr=1682966083
114   0.021766 54.230.116.44 -> 172.31.8.238 TCP 2962 [TCP segment of a reassembled PDU]
115   0.021769 172.31.8.238 -> 54.230.116.44 TCP 66 53120 > http [ACK] Seq=97 Ack=694050 Win=1140608 Len=0 TSval=6034530 TSecr=1682966083
116   0.021871 54.230.116.44 -> 172.31.8.238 TCP 26130 [TCP segment of a reassembled PDU]
117   0.021885 172.31.8.238 -> 54.230.116.44 TCP 66 53120 > http [ACK] Seq=97 Ack=720114 Win=1128576 Len=0 TSval=6034531 TSecr=1682966083
118   0.021935 54.230.116.44 -> 172.31.8.238 TCP 10202 [TCP segment of a reassembled PDU]
119   0.021942 172.31.8.238 -> 54.230.116.44 TCP 66 53120 > http [ACK] Seq=97 Ack=730250 Win=1154688 Len=0 TSval=6034531 TSecr=1682966083
120   0.022341 54.230.116.44 -> 172.31.8.238 TCP 4410 [TCP segment of a reassembled PDU]
121   0.022347 172.31.8.238 -> 54.230.116.44 TCP 66 53120 > http [ACK] Seq=97 Ack=734594 Win=1164160 Len=0 TSval=6034531 TSecr=1682966083
122   0.022504 54.230.116.44 -> 172.31.8.238 TCP 18890 [TCP segment of a reassembled PDU]
123   0.022515 172.31.8.238 -> 54.230.116.44 TCP 66 53120 > http [ACK] Seq=97 Ack=753418 Win=1145344 Len=0 TSval=6034531 TSecr=1682966083
124   0.022604 54.230.116.44 -> 172.31.8.238 TCP 14546 [TCP segment of a reassembled PDU]
125   0.022613 172.31.8.238 -> 54.230.116.44 TCP 66 53120 > http [ACK] Seq=97 Ack=767898 Win=1147520 Len=0 TSval=6034531 TSecr=1682966083
126   0.022632 54.230.116.44 -> 172.31.8.238 TCP 26130 [TCP segment of a reassembled PDU]
127   0.022643 172.31.8.238 -> 54.230.116.44 TCP 66 53120 > http [ACK] Seq=97 Ack=793962 Win=1121536 Len=0 TSval=6034531 TSecr=1682966083
128   0.022687 54.230.116.44 -> 172.31.8.238 TCP 1514 [TCP segment of a reassembled PDU]
129   0.022696 172.31.8.238 -> 54.230.116.44 TCP 66 53120 > http [ACK] Seq=97 Ack=795410 Win=1166848 Len=0 TSval=6034531 TSecr=1682966083
130   0.023195 54.230.116.44 -> 172.31.8.238 TCP 17442 [TCP segment of a reassembled PDU]
131   0.023206 172.31.8.238 -> 54.230.116.44 TCP 66 53120 > http [ACK] Seq=97 Ack=812786 Win=1149568 Len=0 TSval=6034531 TSecr=1682966083
132   0.023320 54.230.116.44 -> 172.31.8.238 TCP 24682 [TCP segment of a reassembled PDU]
133   0.023332 172.31.8.238 -> 54.230.116.44 TCP 66 53120 > http [ACK] Seq=97 Ack=837402 Win=1130880 Len=0 TSval=6034531 TSecr=1682966083
134   0.023515 54.230.116.44 -> 172.31.8.238 TCP 23234 [TCP segment of a reassembled PDU]
135   0.023525 172.31.8.238 -> 54.230.116.44 TCP 66 53120 > http [ACK] Seq=97 Ack=860570 Win=1133312 Len=0 TSval=6034531 TSecr=1682966083
136   0.023898 54.230.116.44 -> 172.31.8.238 TCP 2962 [TCP segment of a reassembled PDU]
137   0.023904 172.31.8.238 -> 54.230.116.44 TCP 66 53120 > http [ACK] Seq=97 Ack=863466 Win=1166592 Len=0 TSval=6034531 TSecr=1682966083
138   0.024081 54.230.116.44 -> 172.31.8.238 TCP 26130 [TCP segment of a reassembled PDU]
139   0.024106 172.31.8.238 -> 54.230.116.44 TCP 66 53120 > http [ACK] Seq=97 Ack=889530 Win=1140608 Len=0 TSval=6034531 TSecr=1682966083
140   0.024163 54.230.116.44 -> 172.31.8.238 TCP 26130 [TCP segment of a reassembled PDU]
141   0.024191 172.31.8.238 -> 54.230.116.44 TCP 66 53120 > http [ACK] Seq=97 Ack=915594 Win=1128576 Len=0 TSval=6034531 TSecr=1682966083
142   0.024261 54.230.116.44 -> 172.31.8.238 TCP 10202 [TCP segment of a reassembled PDU]
143   0.024271 172.31.8.238 -> 54.230.116.44 TCP 66 53120 > http [ACK] Seq=97 Ack=925730 Win=1154688 Len=0 TSval=6034531 TSecr=1682966083
144   0.024673 54.230.116.44 -> 172.31.8.238 TCP 7306 [TCP segment of a reassembled PDU]
145   0.024680 172.31.8.238 -> 54.230.116.44 TCP 66 53120 > http [ACK] Seq=97 Ack=932970 Win=1159424 Len=0 TSval=6034531 TSecr=1682966083
146   0.024812 54.230.116.44 -> 172.31.8.238 TCP 26130 [TCP segment of a reassembled PDU]
147   0.024837 172.31.8.238 -> 54.230.116.44 TCP 66 53120 > http [ACK] Seq=97 Ack=959034 Win=1133440 Len=0 TSval=6034531 TSecr=1682966083
148   0.024898 54.230.116.44 -> 172.31.8.238 TCP 18890 [TCP segment of a reassembled PDU]
149   0.024909 172.31.8.238 -> 54.230.116.44 TCP 66 53120 > http [ACK] Seq=97 Ack=977858 Win=1140352 Len=0 TSval=6034531 TSecr=1682966083
150   0.024990 54.230.116.44 -> 172.31.8.238 TCP 33370 [TCP segment of a reassembled PDU]
151   0.025059 54.230.116.44 -> 172.31.8.238 TCP 13098 [TCP segment of a reassembled PDU]
152   0.025148 172.31.8.238 -> 54.230.116.44 TCP 66 53120 > http [ACK] Seq=97 Ack=1024194 Win=1095168 Len=0 TSval=6034531 TSecr=1682966083
153   0.025426 54.230.116.44 -> 172.31.8.238 TCP 4410 [TCP segment of a reassembled PDU]
154   0.025432 172.31.8.238 -> 54.230.116.44 TCP 66 53120 > http [ACK] Seq=97 Ack=1028538 Win=1164160 Len=0 TSval=6034531 TSecr=1682966084
155   0.025530 54.230.116.44 -> 172.31.8.238 HTTP 20562 HTTP/1.1 200 OK  (application/octet-stream)
156   0.025563 172.31.8.238 -> 54.230.116.44 TCP 66 53120 > http [ACK] Seq=97 Ack=1049034 Win=1143680 Len=0 TSval=6034531 TSecr=1682966084
157   0.025674 172.31.8.238 -> 54.230.116.44 TCP 66 53120 > http [FIN, ACK] Seq=97 Ack=1049034 Win=1166848 Len=0 TSval=6034531 TSecr=1682966084
158   0.026438 54.230.116.44 -> 172.31.8.238 TCP 66 http > 53120 [FIN, ACK] Seq=1049034 Ack=98 Win=14592 Len=0 TSval=1682966084 TSecr=6034531
159   0.026447 172.31.8.238 -> 54.230.116.44 TCP 66 53120 > http [ACK] Seq=98 Ack=1049035 Win=1166848 Len=0 TSval=6034532 TSecr=1682966084
