[Measurement for 1mb at 22:41:50 19.41.2014] 
Tshark:

  1   0.000000 172.31.8.238 -> 172.31.0.2   DNS 89 Standard query 0x069c  A d1dx94olpiqj0t.cloudfront.net
  2   0.000041 172.31.8.238 -> 172.31.0.2   DNS 89 Standard query 0x7944  AAAA d1dx94olpiqj0t.cloudfront.net
  3   0.000678   172.31.0.2 -> 172.31.8.238 DNS 176 Standard query response 0x7944 
  4   0.000689   172.31.0.2 -> 172.31.8.238 DNS 217 Standard query response 0x069c  A 54.230.117.15 A 54.230.117.154 A 54.239.132.249 A 54.192.118.218 A 54.192.118.220 A 54.192.118.247 A 54.230.116.73 A 54.230.116.204
  5   0.003855 172.31.8.238 -> 54.230.117.15 TCP 74 48875 > http [SYN] Seq=0 Win=26883 Len=0 MSS=8961 SACK_PERM=1 TSval=5134573 TSecr=0 WS=128
  6   0.004703 54.230.117.15 -> 172.31.8.238 TCP 74 http > 48875 [SYN, ACK] Seq=0 Ack=1 Win=14480 Len=0 MSS=1460 SACK_PERM=1 TSval=1680810171 TSecr=5134573 WS=128
  7   0.004718 172.31.8.238 -> 54.230.117.15 TCP 66 48875 > http [ACK] Seq=1 Ack=1 Win=27008 Len=0 TSval=5134573 TSecr=1680810171
  8   0.004759 172.31.8.238 -> 54.230.117.15 HTTP 162 GET /1mb HTTP/1.1 
  9   0.005364 54.230.117.15 -> 172.31.8.238 TCP 66 http > 48875 [ACK] Seq=1 Ack=97 Win=14592 Len=0 TSval=1680810171 TSecr=5134573
 10   0.007220 54.230.117.15 -> 172.31.8.238 TCP 13098 [TCP segment of a reassembled PDU]
 11   0.007232 172.31.8.238 -> 54.230.117.15 TCP 66 48875 > http [ACK] Seq=97 Ack=13033 Win=52992 Len=0 TSval=5134574 TSecr=1680810172
 12   0.007686 54.230.117.15 -> 172.31.8.238 TCP 5858 [TCP segment of a reassembled PDU]
 13   0.007693 172.31.8.238 -> 54.230.117.15 TCP 66 48875 > http [ACK] Seq=97 Ack=18825 Win=64640 Len=0 TSval=5134574 TSecr=1680810172
 14   0.007776 54.230.117.15 -> 172.31.8.238 TCP 7306 [TCP segment of a reassembled PDU]
 15   0.007783 172.31.8.238 -> 54.230.117.15 TCP 66 48875 > http [ACK] Seq=97 Ack=26065 Win=79104 Len=0 TSval=5134574 TSecr=1680810172
 16   0.008212 54.230.117.15 -> 172.31.8.238 TCP 5858 [TCP segment of a reassembled PDU]
 17   0.008233 172.31.8.238 -> 54.230.117.15 TCP 66 48875 > http [ACK] Seq=97 Ack=31857 Win=90624 Len=0 TSval=5134574 TSecr=1680810172
 18   0.008322 54.230.117.15 -> 172.31.8.238 TCP 7306 [TCP segment of a reassembled PDU]
 19   0.008329 172.31.8.238 -> 54.230.117.15 TCP 66 48875 > http [ACK] Seq=97 Ack=39097 Win=105088 Len=0 TSval=5134574 TSecr=1680810172
 20   0.008783 54.230.117.15 -> 172.31.8.238 TCP 4410 [TCP segment of a reassembled PDU]
 21   0.008789 172.31.8.238 -> 54.230.117.15 TCP 66 48875 > http [ACK] Seq=97 Ack=43441 Win=109056 Len=0 TSval=5134574 TSecr=1680810172
 22   0.008898 54.230.117.15 -> 172.31.8.238 TCP 14546 [TCP segment of a reassembled PDU]
 23   0.008909 172.31.8.238 -> 54.230.117.15 TCP 66 48875 > http [ACK] Seq=97 Ack=57921 Win=94592 Len=0 TSval=5134574 TSecr=1680810172
 24   0.009000 54.230.117.15 -> 172.31.8.238 TCP 2962 [TCP segment of a reassembled PDU]
 25   0.009006 172.31.8.238 -> 54.230.117.15 TCP 66 48875 > http [ACK] Seq=97 Ack=60817 Win=109056 Len=0 TSval=5134574 TSecr=1680810172
 26   0.009196 54.230.117.15 -> 172.31.8.238 TCP 1514 [TCP segment of a reassembled PDU]
 27   0.009201 172.31.8.238 -> 54.230.117.15 TCP 66 48875 > http [ACK] Seq=97 Ack=62265 Win=109056 Len=0 TSval=5134574 TSecr=1680810172
 28   0.009277 54.230.117.15 -> 172.31.8.238 TCP 2962 [TCP segment of a reassembled PDU]
 29   0.009282 172.31.8.238 -> 54.230.117.15 TCP 66 48875 > http [ACK] Seq=97 Ack=65161 Win=109056 Len=0 TSval=5134574 TSecr=1680810172
 30   0.009550 54.230.117.15 -> 172.31.8.238 TCP 5858 [TCP segment of a reassembled PDU]
 31   0.009556 172.31.8.238 -> 54.230.117.15 TCP 66 48875 > http [ACK] Seq=97 Ack=70953 Win=108416 Len=0 TSval=5134574 TSecr=1680810172
 32   0.009647 54.230.117.15 -> 172.31.8.238 TCP 11650 [TCP segment of a reassembled PDU]
 33   0.009656 172.31.8.238 -> 54.230.117.15 TCP 66 48875 > http [ACK] Seq=97 Ack=82537 Win=98944 Len=0 TSval=5134574 TSecr=1680810172
 34   0.009765 54.230.117.15 -> 172.31.8.238 TCP 4410 [TCP segment of a reassembled PDU]
 35   0.009771 172.31.8.238 -> 54.230.117.15 TCP 66 48875 > http [ACK] Seq=97 Ack=86881 Win=109056 Len=0 TSval=5134574 TSecr=1680810172
 36   0.009974 54.230.117.15 -> 172.31.8.238 TCP 5858 [TCP segment of a reassembled PDU]
 37   0.009981 172.31.8.238 -> 54.230.117.15 TCP 66 48875 > http [ACK] Seq=97 Ack=92673 Win=108416 Len=0 TSval=5134574 TSecr=1680810172
 38   0.010227 54.230.117.15 -> 172.31.8.238 TCP 5858 [TCP segment of a reassembled PDU]
 39   0.010233 172.31.8.238 -> 54.230.117.15 TCP 66 48875 > http [ACK] Seq=97 Ack=98465 Win=108416 Len=0 TSval=5134574 TSecr=1680810172
 40   0.010378 54.230.117.15 -> 172.31.8.238 TCP 18890 [TCP segment of a reassembled PDU]
 41   0.010403 172.31.8.238 -> 54.230.117.15 TCP 66 48875 > http [ACK] Seq=97 Ack=117289 Win=89600 Len=0 TSval=5134574 TSecr=1680810172
 42   0.010502 54.230.117.15 -> 172.31.8.238 TCP 2962 [TCP segment of a reassembled PDU]
 43   0.010507 172.31.8.238 -> 54.230.117.15 TCP 66 48875 > http [ACK] Seq=97 Ack=120185 Win=109056 Len=0 TSval=5134575 TSecr=1680810172
 44   0.010790 54.230.117.15 -> 172.31.8.238 TCP 10202 [TCP segment of a reassembled PDU]
 45   0.010799 172.31.8.238 -> 54.230.117.15 TCP 66 48875 > http [ACK] Seq=97 Ack=130321 Win=129280 Len=0 TSval=5134575 TSecr=1680810172
 46   0.011075 54.230.117.15 -> 172.31.8.238 TCP 13098 [TCP segment of a reassembled PDU]
 47   0.011085 172.31.8.238 -> 54.230.117.15 TCP 66 48875 > http [ACK] Seq=97 Ack=143353 Win=155392 Len=0 TSval=5134575 TSecr=1680810172
 48   0.011176 54.230.117.15 -> 172.31.8.238 TCP 8754 [TCP segment of a reassembled PDU]
 49   0.011184 172.31.8.238 -> 54.230.117.15 TCP 66 48875 > http [ACK] Seq=97 Ack=152041 Win=172800 Len=0 TSval=5134575 TSecr=1680810172
 50   0.011304 54.230.117.15 -> 172.31.8.238 TCP 2962 [TCP segment of a reassembled PDU]
 51   0.011309 172.31.8.238 -> 54.230.117.15 TCP 66 48875 > http [ACK] Seq=97 Ack=154937 Win=178560 Len=0 TSval=5134575 TSecr=1680810172
 52   0.011406 54.230.117.15 -> 172.31.8.238 TCP 15994 [TCP segment of a reassembled PDU]
 53   0.011416 172.31.8.238 -> 54.230.117.15 TCP 66 48875 > http [ACK] Seq=97 Ack=170865 Win=210432 Len=0 TSval=5134575 TSecr=1680810172
 54   0.011558 54.230.117.15 -> 172.31.8.238 TCP 11650 [TCP segment of a reassembled PDU]
 55   0.011566 172.31.8.238 -> 54.230.117.15 TCP 66 48875 > http [ACK] Seq=97 Ack=182449 Win=233600 Len=0 TSval=5134575 TSecr=1680810172
 56   0.011894 54.230.117.15 -> 172.31.8.238 TCP 8754 [TCP segment of a reassembled PDU]
 57   0.011910 172.31.8.238 -> 54.230.117.15 TCP 66 48875 > http [ACK] Seq=97 Ack=191137 Win=251008 Len=0 TSval=5134575 TSecr=1680810172
 58   0.012038 54.230.117.15 -> 172.31.8.238 TCP 10202 [TCP segment of a reassembled PDU]
 59   0.012045 172.31.8.238 -> 54.230.117.15 TCP 66 48875 > http [ACK] Seq=97 Ack=201273 Win=271232 Len=0 TSval=5134575 TSecr=1680810172
 60   0.012203 54.230.117.15 -> 172.31.8.238 TCP 26130 [TCP segment of a reassembled PDU]
 61   0.012217 172.31.8.238 -> 54.230.117.15 TCP 66 48875 > http [ACK] Seq=97 Ack=227337 Win=323328 Len=0 TSval=5134575 TSecr=1680810172
 62   0.012225 54.230.117.15 -> 172.31.8.238 TCP 2962 [TCP segment of a reassembled PDU]
 63   0.012228 172.31.8.238 -> 54.230.117.15 TCP 66 48875 > http [ACK] Seq=97 Ack=230233 Win=329216 Len=0 TSval=5134575 TSecr=1680810172
 64   0.012568 54.230.117.15 -> 172.31.8.238 TCP 10202 [TCP segment of a reassembled PDU]
 65   0.012576 172.31.8.238 -> 54.230.117.15 TCP 66 48875 > http [ACK] Seq=97 Ack=240369 Win=349440 Len=0 TSval=5134575 TSecr=1680810172
 66   0.012689 54.230.117.15 -> 172.31.8.238 TCP 7306 [TCP segment of a reassembled PDU]
 67   0.012695 172.31.8.238 -> 54.230.117.15 TCP 66 48875 > http [ACK] Seq=97 Ack=247609 Win=363904 Len=0 TSval=5134575 TSecr=1680810172
 68   0.012895 54.230.117.15 -> 172.31.8.238 TCP 5858 [TCP segment of a reassembled PDU]
 69   0.012901 172.31.8.238 -> 54.230.117.15 TCP 66 48875 > http [ACK] Seq=97 Ack=253401 Win=375552 Len=0 TSval=5134575 TSecr=1680810172
 70   0.013057 54.230.117.15 -> 172.31.8.238 TCP 4410 [TCP segment of a reassembled PDU]
 71   0.013064 172.31.8.238 -> 54.230.117.15 TCP 66 48875 > http [ACK] Seq=97 Ack=257745 Win=384128 Len=0 TSval=5134575 TSecr=1680810172
 72   0.013209 54.230.117.15 -> 172.31.8.238 TCP 21786 [TCP segment of a reassembled PDU]
 73   0.013220 172.31.8.238 -> 54.230.117.15 TCP 66 48875 > http [ACK] Seq=97 Ack=279465 Win=427648 Len=0 TSval=5134575 TSecr=1680810172
 74   0.013435 54.230.117.15 -> 172.31.8.238 TCP 17442 [TCP segment of a reassembled PDU]
 75   0.013445 172.31.8.238 -> 54.230.117.15 TCP 66 48875 > http [ACK] Seq=97 Ack=296841 Win=462336 Len=0 TSval=5134575 TSecr=1680810172
 76   0.013566 54.230.117.15 -> 172.31.8.238 TCP 7306 [TCP segment of a reassembled PDU]
 77   0.013573 172.31.8.238 -> 54.230.117.15 TCP 66 48875 > http [ACK] Seq=97 Ack=304081 Win=476800 Len=0 TSval=5134575 TSecr=1680810172
 78   0.013977 54.230.117.15 -> 172.31.8.238 TCP 26130 [TCP segment of a reassembled PDU]
 79   0.013990 172.31.8.238 -> 54.230.117.15 TCP 66 48875 > http [ACK] Seq=97 Ack=330145 Win=529024 Len=0 TSval=5134575 TSecr=1680810172
 80   0.013998 54.230.117.15 -> 172.31.8.238 TCP 4410 [TCP segment of a reassembled PDU]
 81   0.014002 172.31.8.238 -> 54.230.117.15 TCP 66 48875 > http [ACK] Seq=97 Ack=334489 Win=537728 Len=0 TSval=5134575 TSecr=1680810172
 82   0.014076 54.230.117.15 -> 172.31.8.238 TCP 5858 [TCP segment of a reassembled PDU]
 83   0.014082 172.31.8.238 -> 54.230.117.15 TCP 66 48875 > http [ACK] Seq=97 Ack=340281 Win=549248 Len=0 TSval=5134575 TSecr=1680810172
 84   0.014303 54.230.117.15 -> 172.31.8.238 TCP 1514 [TCP segment of a reassembled PDU]
 85   0.014307 172.31.8.238 -> 54.230.117.15 TCP 66 48875 > http [ACK] Seq=97 Ack=341729 Win=552192 Len=0 TSval=5134575 TSecr=1680810172
 86   0.014498 54.230.117.15 -> 172.31.8.238 TCP 26130 [TCP segment of a reassembled PDU]
 87   0.014520 172.31.8.238 -> 54.230.117.15 TCP 66 48875 > http [ACK] Seq=97 Ack=367793 Win=604288 Len=0 TSval=5134576 TSecr=1680810172
 88   0.014597 54.230.117.15 -> 172.31.8.238 TCP 1514 [TCP segment of a reassembled PDU]
 89   0.014602 172.31.8.238 -> 54.230.117.15 TCP 66 48875 > http [ACK] Seq=97 Ack=369241 Win=607232 Len=0 TSval=5134576 TSecr=1680810172
 90   0.014725 54.230.117.15 -> 172.31.8.238 TCP 23234 [TCP segment of a reassembled PDU]
 91   0.014737 172.31.8.238 -> 54.230.117.15 TCP 66 48875 > http [ACK] Seq=97 Ack=392409 Win=653568 Len=0 TSval=5134576 TSecr=1680810172
 92   0.014744 54.230.117.15 -> 172.31.8.238 TCP 2962 [TCP segment of a reassembled PDU]
 93   0.014747 172.31.8.238 -> 54.230.117.15 TCP 66 48875 > http [ACK] Seq=97 Ack=395305 Win=659328 Len=0 TSval=5134576 TSecr=1680810172
 94   0.015115 54.230.117.15 -> 172.31.8.238 TCP 8754 [TCP segment of a reassembled PDU]
 95   0.015124 172.31.8.238 -> 54.230.117.15 TCP 66 48875 > http [ACK] Seq=97 Ack=403993 Win=676736 Len=0 TSval=5134576 TSecr=1680810172
 96   0.015254 54.230.117.15 -> 172.31.8.238 TCP 18890 [TCP segment of a reassembled PDU]
 97   0.015263 172.31.8.238 -> 54.230.117.15 TCP 66 48875 > http [ACK] Seq=97 Ack=422817 Win=714368 Len=0 TSval=5134576 TSecr=1680810172
 98   0.015386 54.230.117.15 -> 172.31.8.238 TCP 26130 [TCP segment of a reassembled PDU]
 99   0.015400 172.31.8.238 -> 54.230.117.15 TCP 66 48875 > http [ACK] Seq=97 Ack=448881 Win=766464 Len=0 TSval=5134576 TSecr=1680810172
100   0.015416 54.230.117.15 -> 172.31.8.238 TCP 17442 [TCP segment of a reassembled PDU]
101   0.015426 172.31.8.238 -> 54.230.117.15 TCP 66 48875 > http [ACK] Seq=97 Ack=466257 Win=801152 Len=0 TSval=5134576 TSecr=1680810172
102   0.015694 54.230.117.15 -> 172.31.8.238 TCP 10202 [TCP segment of a reassembled PDU]
103   0.015703 172.31.8.238 -> 54.230.117.15 TCP 66 48875 > http [ACK] Seq=97 Ack=476393 Win=821504 Len=0 TSval=5134576 TSecr=1680810172
104   0.015964 54.230.117.15 -> 172.31.8.238 TCP 4410 [TCP segment of a reassembled PDU]
105   0.015970 172.31.8.238 -> 54.230.117.15 TCP 66 48875 > http [ACK] Seq=97 Ack=480737 Win=830208 Len=0 TSval=5134576 TSecr=1680810173
106   0.016269 54.230.117.15 -> 172.31.8.238 TCP 26130 [TCP segment of a reassembled PDU]
107   0.016282 172.31.8.238 -> 54.230.117.15 TCP 66 48875 > http [ACK] Seq=97 Ack=506801 Win=882304 Len=0 TSval=5134576 TSecr=1680810173
108   0.016340 54.230.117.15 -> 172.31.8.238 TCP 26130 [TCP segment of a reassembled PDU]
109   0.016353 172.31.8.238 -> 54.230.117.15 TCP 66 48875 > http [ACK] Seq=97 Ack=532865 Win=934400 Len=0 TSval=5134576 TSecr=1680810173
110   0.016425 54.230.117.15 -> 172.31.8.238 TCP 26130 [TCP segment of a reassembled PDU]
111   0.016439 172.31.8.238 -> 54.230.117.15 TCP 66 48875 > http [ACK] Seq=97 Ack=558929 Win=986496 Len=0 TSval=5134576 TSecr=1680810173
112   0.016968 54.230.117.15 -> 172.31.8.238 TCP 7306 [TCP segment of a reassembled PDU]
113   0.016976 172.31.8.238 -> 54.230.117.15 TCP 66 48875 > http [ACK] Seq=97 Ack=566169 Win=1001088 Len=0 TSval=5134576 TSecr=1680810173
114   0.017163 54.230.117.15 -> 172.31.8.238 TCP 26130 [TCP segment of a reassembled PDU]
115   0.017176 172.31.8.238 -> 54.230.117.15 TCP 66 48875 > http [ACK] Seq=97 Ack=592233 Win=1053184 Len=0 TSval=5134576 TSecr=1680810173
116   0.017235 54.230.117.15 -> 172.31.8.238 TCP 26130 [TCP segment of a reassembled PDU]
117   0.017248 172.31.8.238 -> 54.230.117.15 TCP 66 48875 > http [ACK] Seq=97 Ack=618297 Win=1105280 Len=0 TSval=5134576 TSecr=1680810173
118   0.017280 54.230.117.15 -> 172.31.8.238 TCP 1514 [TCP segment of a reassembled PDU]
119   0.017284 172.31.8.238 -> 54.230.117.15 TCP 66 48875 > http [ACK] Seq=97 Ack=619745 Win=1108224 Len=0 TSval=5134576 TSecr=1680810173
120   0.017593 54.230.117.15 -> 172.31.8.238 TCP 23234 [TCP segment of a reassembled PDU]
121   0.017606 172.31.8.238 -> 54.230.117.15 TCP 66 48875 > http [ACK] Seq=97 Ack=642913 Win=1154560 Len=0 TSval=5134576 TSecr=1680810173
122   0.017769 54.230.117.15 -> 172.31.8.238 TCP 26130 [TCP segment of a reassembled PDU]
123   0.017783 172.31.8.238 -> 54.230.117.15 TCP 66 48875 > http [ACK] Seq=97 Ack=668977 Win=1200640 Len=0 TSval=5134576 TSecr=1680810173
124   0.017841 54.230.117.15 -> 172.31.8.238 TCP 26130 [TCP segment of a reassembled PDU]
125   0.017854 172.31.8.238 -> 54.230.117.15 TCP 66 48875 > http [ACK] Seq=97 Ack=695041 Win=1200640 Len=0 TSval=5134576 TSecr=1680810173
126   0.017956 54.230.117.15 -> 172.31.8.238 TCP 18890 [TCP segment of a reassembled PDU]
127   0.017967 172.31.8.238 -> 54.230.117.15 TCP 66 48875 > http [ACK] Seq=97 Ack=713865 Win=1212416 Len=0 TSval=5134576 TSecr=1680810173
128   0.018425 54.230.117.15 -> 172.31.8.238 TCP 5858 [TCP segment of a reassembled PDU]
129   0.018431 172.31.8.238 -> 54.230.117.15 TCP 66 48875 > http [ACK] Seq=97 Ack=719657 Win=1233920 Len=0 TSval=5134576 TSecr=1680810173
130   0.018592 54.230.117.15 -> 172.31.8.238 TCP 26130 [TCP segment of a reassembled PDU]
131   0.018608 172.31.8.238 -> 54.230.117.15 TCP 66 48875 > http [ACK] Seq=97 Ack=745721 Win=1290240 Len=0 TSval=5134577 TSecr=1680810173
132   0.018664 54.230.117.15 -> 172.31.8.238 TCP 26130 [TCP segment of a reassembled PDU]
133   0.018678 172.31.8.238 -> 54.230.117.15 TCP 66 48875 > http [ACK] Seq=97 Ack=771785 Win=1342336 Len=0 TSval=5134577 TSecr=1680810173
134   0.018746 54.230.117.15 -> 172.31.8.238 TCP 26130 [TCP segment of a reassembled PDU]
135   0.018760 172.31.8.238 -> 54.230.117.15 TCP 66 48875 > http [ACK] Seq=97 Ack=797849 Win=1394560 Len=0 TSval=5134577 TSecr=1680810173
136   0.018808 54.230.117.15 -> 172.31.8.238 TCP 15994 [TCP segment of a reassembled PDU]
137   0.018818 172.31.8.238 -> 54.230.117.15 TCP 66 48875 > http [ACK] Seq=97 Ack=813777 Win=1426432 Len=0 TSval=5134577 TSecr=1680810173
138   0.019201 54.230.117.15 -> 172.31.8.238 TCP 7306 [TCP segment of a reassembled PDU]
139   0.019209 172.31.8.238 -> 54.230.117.15 TCP 66 48875 > http [ACK] Seq=97 Ack=821017 Win=1440896 Len=0 TSval=5134577 TSecr=1680810173
140   0.019390 54.230.117.15 -> 172.31.8.238 TCP 26130 [TCP segment of a reassembled PDU]
141   0.019404 172.31.8.238 -> 54.230.117.15 TCP 66 48875 > http [ACK] Seq=97 Ack=847081 Win=1492992 Len=0 TSval=5134577 TSecr=1680810173
142   0.019464 54.230.117.15 -> 172.31.8.238 TCP 26130 [TCP segment of a reassembled PDU]
143   0.019478 172.31.8.238 -> 54.230.117.15 TCP 66 48875 > http [ACK] Seq=97 Ack=873145 Win=1545088 Len=0 TSval=5134577 TSecr=1680810173
144   0.019603 54.230.117.15 -> 172.31.8.238 TCP 36266 [TCP segment of a reassembled PDU]
145   0.019615 172.31.8.238 -> 54.230.117.15 TCP 66 48875 > http [ACK] Seq=97 Ack=909345 Win=1617536 Len=0 TSval=5134577 TSecr=1680810173
146   0.020039 54.230.117.15 -> 172.31.8.238 TCP 2962 [TCP segment of a reassembled PDU]
147   0.020045 172.31.8.238 -> 54.230.117.15 TCP 66 48875 > http [ACK] Seq=97 Ack=912241 Win=1617536 Len=0 TSval=5134577 TSecr=1680810173
148   0.020349 54.230.117.15 -> 172.31.8.238 TCP 23234 [TCP segment of a reassembled PDU]
149   0.020361 172.31.8.238 -> 54.230.117.15 TCP 66 48875 > http [ACK] Seq=97 Ack=935409 Win=1617536 Len=0 TSval=5134577 TSecr=1680810173
150   0.020468 54.230.117.15 -> 172.31.8.238 TCP 29026 [TCP segment of a reassembled PDU]
151   0.020482 172.31.8.238 -> 54.230.117.15 TCP 66 48875 > http [ACK] Seq=97 Ack=964369 Win=1617536 Len=0 TSval=5134577 TSecr=1680810173
152   0.020515 54.230.117.15 -> 172.31.8.238 TCP 26130 [TCP segment of a reassembled PDU]
153   0.020527 172.31.8.238 -> 54.230.117.15 TCP 66 48875 > http [ACK] Seq=97 Ack=990433 Win=1617536 Len=0 TSval=5134577 TSecr=1680810173
154   0.020613 54.230.117.15 -> 172.31.8.238 TCP 26130 [TCP segment of a reassembled PDU]
155   0.020625 172.31.8.238 -> 54.230.117.15 TCP 66 48875 > http [ACK] Seq=97 Ack=1016497 Win=1617536 Len=0 TSval=5134577 TSecr=1680810173
156   0.020666 54.230.117.15 -> 172.31.8.238 TCP 5858 [TCP segment of a reassembled PDU]
157   0.020671 172.31.8.238 -> 54.230.117.15 TCP 66 48875 > http [ACK] Seq=97 Ack=1022289 Win=1617536 Len=0 TSval=5134577 TSecr=1680810173
158   0.021093 54.230.117.15 -> 172.31.8.238 TCP 26130 [TCP segment of a reassembled PDU]
159   0.021108 172.31.8.238 -> 54.230.117.15 TCP 66 48875 > http [ACK] Seq=97 Ack=1048353 Win=1617536 Len=0 TSval=5134577 TSecr=1680810173
160   0.021300 54.230.117.15 -> 172.31.8.238 HTTP 747 HTTP/1.1 200 OK  (application/octet-stream)
161   0.021315 172.31.8.238 -> 54.230.117.15 TCP 66 48875 > http [ACK] Seq=97 Ack=1049034 Win=1617536 Len=0 TSval=5134577 TSecr=1680810173
162   0.021427 172.31.8.238 -> 54.230.117.15 TCP 66 48875 > http [FIN, ACK] Seq=97 Ack=1049034 Win=1617536 Len=0 TSval=5134577 TSecr=1680810173
163   0.022225 54.230.117.15 -> 172.31.8.238 TCP 66 http > 48875 [FIN, ACK] Seq=1049034 Ack=98 Win=14592 Len=0 TSval=1680810173 TSecr=5134577
164   0.022234 172.31.8.238 -> 54.230.117.15 TCP 66 48875 > http [ACK] Seq=98 Ack=1049035 Win=1617536 Len=0 TSval=5134577 TSecr=1680810173
