[Measurement for 1mb at 03:41:50 20.41.2014] 
Tshark:

  1   0.000000 172.31.8.238 -> 172.31.0.2   DNS 89 Standard query 0xa3bc  A d1dx94olpiqj0t.cloudfront.net
  2   0.000025 172.31.8.238 -> 172.31.0.2   DNS 89 Standard query 0x4f77  AAAA d1dx94olpiqj0t.cloudfront.net
  3   0.000707   172.31.0.2 -> 172.31.8.238 DNS 176 Standard query response 0x4f77 
  4   0.000717   172.31.0.2 -> 172.31.8.238 DNS 217 Standard query response 0xa3bc  A 54.230.118.146 A 54.230.118.187 A 54.230.118.248 A 54.239.132.84 A 54.239.132.196 A 54.230.116.239 A 54.230.117.15 A 54.230.117.21
  5   0.003854 172.31.8.238 -> 54.230.118.146 TCP 74 54113 > http [SYN] Seq=0 Win=26883 Len=0 MSS=8961 SACK_PERM=1 TSval=9634592 TSecr=0 WS=128
  6   0.004632 54.230.118.146 -> 172.31.8.238 TCP 74 http > 54113 [SYN, ACK] Seq=0 Ack=1 Win=14480 Len=0 MSS=1460 SACK_PERM=1 TSval=1684191025 TSecr=9634592 WS=128
  7   0.004646 172.31.8.238 -> 54.230.118.146 TCP 66 54113 > http [ACK] Seq=1 Ack=1 Win=27008 Len=0 TSval=9634592 TSecr=1684191025
  8   0.004695 172.31.8.238 -> 54.230.118.146 HTTP 162 GET /1mb HTTP/1.1 
  9   0.005291 54.230.118.146 -> 172.31.8.238 TCP 66 http > 54113 [ACK] Seq=1 Ack=97 Win=14592 Len=0 TSval=1684191025 TSecr=9634592
 10   0.007751 54.230.118.146 -> 172.31.8.238 TCP 13098 [TCP segment of a reassembled PDU]
 11   0.007764 172.31.8.238 -> 54.230.118.146 TCP 66 54113 > http [ACK] Seq=97 Ack=13033 Win=52992 Len=0 TSval=9634593 TSecr=1684191025
 12   0.008403 54.230.118.146 -> 172.31.8.238 TCP 5858 [TCP segment of a reassembled PDU]
 13   0.008410 172.31.8.238 -> 54.230.118.146 TCP 66 54113 > http [ACK] Seq=97 Ack=18825 Win=64640 Len=0 TSval=9634593 TSecr=1684191025
 14   0.008496 54.230.118.146 -> 172.31.8.238 TCP 7306 [TCP segment of a reassembled PDU]
 15   0.008502 172.31.8.238 -> 54.230.118.146 TCP 66 54113 > http [ACK] Seq=97 Ack=26065 Win=79104 Len=0 TSval=9634593 TSecr=1684191025
 16   0.008892 54.230.118.146 -> 172.31.8.238 TCP 7306 [TCP segment of a reassembled PDU]
 17   0.008899 172.31.8.238 -> 54.230.118.146 TCP 66 54113 > http [ACK] Seq=97 Ack=33305 Win=93568 Len=0 TSval=9634593 TSecr=1684191025
 18   0.008976 54.230.118.146 -> 172.31.8.238 TCP 2962 [TCP segment of a reassembled PDU]
 19   0.008981 172.31.8.238 -> 54.230.118.146 TCP 66 54113 > http [ACK] Seq=97 Ack=36201 Win=99328 Len=0 TSval=9634593 TSecr=1684191025
 20   0.009139 54.230.118.146 -> 172.31.8.238 TCP 2962 [TCP segment of a reassembled PDU]
 21   0.009144 172.31.8.238 -> 54.230.118.146 TCP 66 54113 > http [ACK] Seq=97 Ack=39097 Win=105088 Len=0 TSval=9634593 TSecr=1684191025
 22   0.009382 54.230.118.146 -> 172.31.8.238 TCP 2962 [TCP segment of a reassembled PDU]
 23   0.009388 172.31.8.238 -> 54.230.118.146 TCP 66 54113 > http [ACK] Seq=97 Ack=41993 Win=109056 Len=0 TSval=9634593 TSecr=1684191025
 24   0.009486 54.230.118.146 -> 172.31.8.238 TCP 10202 [TCP segment of a reassembled PDU]
 25   0.009494 172.31.8.238 -> 54.230.118.146 TCP 66 54113 > http [ACK] Seq=97 Ack=52129 Win=101248 Len=0 TSval=9634593 TSecr=1684191025
 26   0.009687 54.230.118.146 -> 172.31.8.238 TCP 10202 [TCP segment of a reassembled PDU]
 27   0.009695 172.31.8.238 -> 54.230.118.146 TCP 66 54113 > http [ACK] Seq=97 Ack=62265 Win=101248 Len=0 TSval=9634593 TSecr=1684191025
 28   0.009911 54.230.118.146 -> 172.31.8.238 TCP 2962 [TCP segment of a reassembled PDU]
 29   0.009917 172.31.8.238 -> 54.230.118.146 TCP 66 54113 > http [ACK] Seq=97 Ack=65161 Win=109056 Len=0 TSval=9634594 TSecr=1684191025
 30   0.010164 54.230.118.146 -> 172.31.8.238 TCP 4410 [TCP segment of a reassembled PDU]
 31   0.010170 172.31.8.238 -> 54.230.118.146 TCP 66 54113 > http [ACK] Seq=97 Ack=69505 Win=117760 Len=0 TSval=9634594 TSecr=1684191025
 32   0.010303 54.230.118.146 -> 172.31.8.238 TCP 20338 [TCP segment of a reassembled PDU]
 33   0.010316 172.31.8.238 -> 54.230.118.146 TCP 66 54113 > http [ACK] Seq=97 Ack=89777 Win=158336 Len=0 TSval=9634594 TSecr=1684191025
 34   0.010666 54.230.118.146 -> 172.31.8.238 TCP 2962 [TCP segment of a reassembled PDU]
 35   0.010672 172.31.8.238 -> 54.230.118.146 TCP 66 54113 > http [ACK] Seq=97 Ack=92673 Win=164096 Len=0 TSval=9634594 TSecr=1684191025
 36   0.010764 54.230.118.146 -> 172.31.8.238 TCP 7306 [TCP segment of a reassembled PDU]
 37   0.010771 172.31.8.238 -> 54.230.118.146 TCP 66 54113 > http [ACK] Seq=97 Ack=99913 Win=178560 Len=0 TSval=9634594 TSecr=1684191025
 38   0.011183 54.230.118.146 -> 172.31.8.238 TCP 7306 [TCP segment of a reassembled PDU]
 39   0.011191 172.31.8.238 -> 54.230.118.146 TCP 66 54113 > http [ACK] Seq=97 Ack=107153 Win=193024 Len=0 TSval=9634594 TSecr=1684191025
 40   0.011290 54.230.118.146 -> 172.31.8.238 TCP 14546 [TCP segment of a reassembled PDU]
 41   0.011300 172.31.8.238 -> 54.230.118.146 TCP 66 54113 > http [ACK] Seq=97 Ack=121633 Win=221952 Len=0 TSval=9634594 TSecr=1684191025
 42   0.011442 54.230.118.146 -> 172.31.8.238 TCP 4410 [TCP segment of a reassembled PDU]
 43   0.011449 172.31.8.238 -> 54.230.118.146 TCP 66 54113 > http [ACK] Seq=97 Ack=125977 Win=230656 Len=0 TSval=9634594 TSecr=1684191025
 44   0.011540 54.230.118.146 -> 172.31.8.238 TCP 4410 [TCP segment of a reassembled PDU]
 45   0.011546 172.31.8.238 -> 54.230.118.146 TCP 66 54113 > http [ACK] Seq=97 Ack=130321 Win=239360 Len=0 TSval=9634594 TSecr=1684191025
 46   0.011739 54.230.118.146 -> 172.31.8.238 TCP 7306 [TCP segment of a reassembled PDU]
 47   0.011747 172.31.8.238 -> 54.230.118.146 TCP 66 54113 > http [ACK] Seq=97 Ack=137561 Win=253824 Len=0 TSval=9634594 TSecr=1684191025
 48   0.011842 54.230.118.146 -> 172.31.8.238 TCP 5858 [TCP segment of a reassembled PDU]
 49   0.011848 172.31.8.238 -> 54.230.118.146 TCP 66 54113 > http [ACK] Seq=97 Ack=143353 Win=265472 Len=0 TSval=9634594 TSecr=1684191025
 50   0.012062 54.230.118.146 -> 172.31.8.238 TCP 13098 [TCP segment of a reassembled PDU]
 51   0.012072 172.31.8.238 -> 54.230.118.146 TCP 66 54113 > http [ACK] Seq=97 Ack=156385 Win=291456 Len=0 TSval=9634594 TSecr=1684191025
 52   0.012214 54.230.118.146 -> 172.31.8.238 TCP 4410 [TCP segment of a reassembled PDU]
 53   0.012220 172.31.8.238 -> 54.230.118.146 TCP 66 54113 > http [ACK] Seq=97 Ack=160729 Win=300160 Len=0 TSval=9634594 TSecr=1684191025
 54   0.012378 54.230.118.146 -> 172.31.8.238 TCP 21786 [TCP segment of a reassembled PDU]
 55   0.012387 172.31.8.238 -> 54.230.118.146 TCP 66 54113 > http [ACK] Seq=97 Ack=182449 Win=343680 Len=0 TSval=9634594 TSecr=1684191025
 56   0.012736 54.230.118.146 -> 172.31.8.238 TCP 2962 [TCP segment of a reassembled PDU]
 57   0.012742 172.31.8.238 -> 54.230.118.146 TCP 66 54113 > http [ACK] Seq=97 Ack=185345 Win=349440 Len=0 TSval=9634594 TSecr=1684191025
 58   0.012879 54.230.118.146 -> 172.31.8.238 TCP 15994 [TCP segment of a reassembled PDU]
 59   0.012890 172.31.8.238 -> 54.230.118.146 TCP 66 54113 > http [ACK] Seq=97 Ack=201273 Win=381312 Len=0 TSval=9634594 TSecr=1684191025
 60   0.013129 54.230.118.146 -> 172.31.8.238 TCP 17442 [TCP segment of a reassembled PDU]
 61   0.013140 172.31.8.238 -> 54.230.118.146 TCP 66 54113 > http [ACK] Seq=97 Ack=218649 Win=416000 Len=0 TSval=9634594 TSecr=1684191025
 62   0.013157 54.230.118.146 -> 172.31.8.238 TCP 8754 [TCP segment of a reassembled PDU]
 63   0.013162 172.31.8.238 -> 54.230.118.146 TCP 66 54113 > http [ACK] Seq=97 Ack=227337 Win=433408 Len=0 TSval=9634594 TSecr=1684191025
 64   0.013207 54.230.118.146 -> 172.31.8.238 TCP 2962 [TCP segment of a reassembled PDU]
 65   0.013213 172.31.8.238 -> 54.230.118.146 TCP 66 54113 > http [ACK] Seq=97 Ack=230233 Win=439168 Len=0 TSval=9634594 TSecr=1684191025
 66   0.013592 54.230.118.146 -> 172.31.8.238 TCP 21786 [TCP segment of a reassembled PDU]
 67   0.013605 172.31.8.238 -> 54.230.118.146 TCP 66 54113 > http [ACK] Seq=97 Ack=251953 Win=459904 Len=0 TSval=9634594 TSecr=1684191025
 68   0.013751 54.230.118.146 -> 172.31.8.238 TCP 5858 [TCP segment of a reassembled PDU]
 69   0.013758 172.31.8.238 -> 54.230.118.146 TCP 66 54113 > http [ACK] Seq=97 Ack=257745 Win=454144 Len=0 TSval=9634594 TSecr=1684191026
 70   0.013915 54.230.118.146 -> 172.31.8.238 TCP 23234 [TCP segment of a reassembled PDU]
 71   0.013929 172.31.8.238 -> 54.230.118.146 TCP 66 54113 > http [ACK] Seq=97 Ack=280913 Win=529024 Len=0 TSval=9634595 TSecr=1684191026
 72   0.014254 54.230.118.146 -> 172.31.8.238 TCP 2962 [TCP segment of a reassembled PDU]
 73   0.014260 172.31.8.238 -> 54.230.118.146 TCP 66 54113 > http [ACK] Seq=97 Ack=283809 Win=534784 Len=0 TSval=9634595 TSecr=1684191026
 74   0.014460 54.230.118.146 -> 172.31.8.238 TCP 26130 [TCP segment of a reassembled PDU]
 75   0.014477 172.31.8.238 -> 54.230.118.146 TCP 66 54113 > http [ACK] Seq=97 Ack=309873 Win=586880 Len=0 TSval=9634595 TSecr=1684191026
 76   0.014486 54.230.118.146 -> 172.31.8.238 TCP 5858 [TCP segment of a reassembled PDU]
 77   0.014490 172.31.8.238 -> 54.230.118.146 TCP 66 54113 > http [ACK] Seq=97 Ack=315665 Win=598528 Len=0 TSval=9634595 TSecr=1684191026
 78   0.014855 54.230.118.146 -> 172.31.8.238 TCP 24682 [TCP segment of a reassembled PDU]
 79   0.014870 172.31.8.238 -> 54.230.118.146 TCP 66 54113 > http [ACK] Seq=97 Ack=340281 Win=647680 Len=0 TSval=9634595 TSecr=1684191026
 80   0.015045 54.230.118.146 -> 172.31.8.238 TCP 1514 [TCP segment of a reassembled PDU]
 81   0.015050 172.31.8.238 -> 54.230.118.146 TCP 66 54113 > http [ACK] Seq=97 Ack=341729 Win=650624 Len=0 TSval=9634595 TSecr=1684191026
 82   0.015224 54.230.118.146 -> 172.31.8.238 TCP 26130 [TCP segment of a reassembled PDU]
 83   0.015240 172.31.8.238 -> 54.230.118.146 TCP 66 54113 > http [ACK] Seq=97 Ack=367793 Win=702720 Len=0 TSval=9634595 TSecr=1684191026
 84   0.015247 54.230.118.146 -> 172.31.8.238 TCP 4410 [TCP segment of a reassembled PDU]
 85   0.015251 172.31.8.238 -> 54.230.118.146 TCP 66 54113 > http [ACK] Seq=97 Ack=372137 Win=711424 Len=0 TSval=9634595 TSecr=1684191026
 86   0.015685 54.230.118.146 -> 172.31.8.238 TCP 24682 [TCP segment of a reassembled PDU]
 87   0.015700 172.31.8.238 -> 54.230.118.146 TCP 66 54113 > http [ACK] Seq=97 Ack=396753 Win=760704 Len=0 TSval=9634595 TSecr=1684191026
 88   0.015803 54.230.118.146 -> 172.31.8.238 TCP 8754 [TCP segment of a reassembled PDU]
 89   0.015811 172.31.8.238 -> 54.230.118.146 TCP 66 54113 > http [ACK] Seq=97 Ack=405441 Win=777984 Len=0 TSval=9634595 TSecr=1684191026
 90   0.015951 54.230.118.146 -> 172.31.8.238 TCP 26130 [TCP segment of a reassembled PDU]
 91   0.015966 172.31.8.238 -> 54.230.118.146 TCP 66 54113 > http [ACK] Seq=97 Ack=431505 Win=830208 Len=0 TSval=9634595 TSecr=1684191026
 92   0.015983 54.230.118.146 -> 172.31.8.238 TCP 4410 [TCP segment of a reassembled PDU]
 93   0.015988 172.31.8.238 -> 54.230.118.146 TCP 66 54113 > http [ACK] Seq=97 Ack=435849 Win=838912 Len=0 TSval=9634595 TSecr=1684191026
 94   0.016460 54.230.118.146 -> 172.31.8.238 TCP 23234 [TCP segment of a reassembled PDU]
 95   0.016472 172.31.8.238 -> 54.230.118.146 TCP 66 54113 > http [ACK] Seq=97 Ack=459017 Win=885248 Len=0 TSval=9634595 TSecr=1684191026
 96   0.016481 54.230.118.146 -> 172.31.8.238 TCP 2962 [TCP segment of a reassembled PDU]
 97   0.016485 172.31.8.238 -> 54.230.118.146 TCP 66 54113 > http [ACK] Seq=97 Ack=461913 Win=891008 Len=0 TSval=9634595 TSecr=1684191026
 98   0.016550 54.230.118.146 -> 172.31.8.238 TCP 15994 [TCP segment of a reassembled PDU]
 99   0.016559 172.31.8.238 -> 54.230.118.146 TCP 66 54113 > http [ACK] Seq=97 Ack=477841 Win=922880 Len=0 TSval=9634595 TSecr=1684191026
100   0.016724 54.230.118.146 -> 172.31.8.238 TCP 26130 [TCP segment of a reassembled PDU]
101   0.016739 172.31.8.238 -> 54.230.118.146 TCP 66 54113 > http [ACK] Seq=97 Ack=503905 Win=974976 Len=0 TSval=9634595 TSecr=1684191026
102   0.016759 54.230.118.146 -> 172.31.8.238 TCP 7306 [TCP segment of a reassembled PDU]
103   0.016765 172.31.8.238 -> 54.230.118.146 TCP 66 54113 > http [ACK] Seq=97 Ack=511145 Win=967808 Len=0 TSval=9634595 TSecr=1684191026
104   0.017069 54.230.118.146 -> 172.31.8.238 TCP 2962 [TCP segment of a reassembled PDU]
105   0.017075 172.31.8.238 -> 54.230.118.146 TCP 66 54113 > http [ACK] Seq=97 Ack=514041 Win=980736 Len=0 TSval=9634595 TSecr=1684191026
106   0.017241 54.230.118.146 -> 172.31.8.238 TCP 26130 [TCP segment of a reassembled PDU]
107   0.017266 172.31.8.238 -> 54.230.118.146 TCP 66 54113 > http [ACK] Seq=97 Ack=540105 Win=975360 Len=0 TSval=9634595 TSecr=1684191026
108   0.017358 54.230.118.146 -> 172.31.8.238 TCP 5858 [TCP segment of a reassembled PDU]
109   0.017364 172.31.8.238 -> 54.230.118.146 TCP 66 54113 > http [ACK] Seq=97 Ack=545897 Win=992384 Len=0 TSval=9634595 TSecr=1684191026
110   0.017513 54.230.118.146 -> 172.31.8.238 TCP 26130 [TCP segment of a reassembled PDU]
111   0.017528 54.230.118.146 -> 172.31.8.238 TCP 4410 [TCP segment of a reassembled PDU]
112   0.017545 172.31.8.238 -> 54.230.118.146 TCP 66 54113 > http [ACK] Seq=97 Ack=576305 Win=968192 Len=0 TSval=9634595 TSecr=1684191026
113   0.017869 54.230.118.146 -> 172.31.8.238 TCP 7306 [TCP segment of a reassembled PDU]
114   0.017877 172.31.8.238 -> 54.230.118.146 TCP 66 54113 > http [ACK] Seq=97 Ack=583545 Win=1006336 Len=0 TSval=9634596 TSecr=1684191026
115   0.018047 54.230.118.146 -> 172.31.8.238 TCP 26130 [TCP segment of a reassembled PDU]
116   0.018062 172.31.8.238 -> 54.230.118.146 TCP 66 54113 > http [ACK] Seq=97 Ack=609609 Win=1058944 Len=0 TSval=9634596 TSecr=1684191026
117   0.018100 54.230.118.146 -> 172.31.8.238 TCP 15994 [TCP segment of a reassembled PDU]
118   0.018111 172.31.8.238 -> 54.230.118.146 TCP 66 54113 > http [ACK] Seq=97 Ack=625537 Win=1090816 Len=0 TSval=9634596 TSecr=1684191026
119   0.018183 54.230.118.146 -> 172.31.8.238 TCP 15994 [TCP segment of a reassembled PDU]
120   0.018192 172.31.8.238 -> 54.230.118.146 TCP 66 54113 > http [ACK] Seq=97 Ack=641465 Win=1122688 Len=0 TSval=9634596 TSecr=1684191026
121   0.018575 54.230.118.146 -> 172.31.8.238 TCP 26130 [TCP segment of a reassembled PDU]
122   0.018591 172.31.8.238 -> 54.230.118.146 TCP 66 54113 > http [ACK] Seq=97 Ack=667529 Win=1174784 Len=0 TSval=9634596 TSecr=1684191026
123   0.018600 54.230.118.146 -> 172.31.8.238 TCP 5858 [TCP segment of a reassembled PDU]
124   0.018604 172.31.8.238 -> 54.230.118.146 TCP 66 54113 > http [ACK] Seq=97 Ack=673321 Win=1186432 Len=0 TSval=9634596 TSecr=1684191026
125   0.018757 54.230.118.146 -> 172.31.8.238 TCP 26130 [TCP segment of a reassembled PDU]
126   0.018773 172.31.8.238 -> 54.230.118.146 TCP 66 54113 > http [ACK] Seq=97 Ack=699385 Win=1238528 Len=0 TSval=9634596 TSecr=1684191026
127   0.018781 54.230.118.146 -> 172.31.8.238 TCP 7306 [TCP segment of a reassembled PDU]
128   0.018786 172.31.8.238 -> 54.230.118.146 TCP 66 54113 > http [ACK] Seq=97 Ack=706625 Win=1252992 Len=0 TSval=9634596 TSecr=1684191026
129   0.019137 54.230.118.146 -> 172.31.8.238 TCP 2962 [TCP segment of a reassembled PDU]
130   0.019142 172.31.8.238 -> 54.230.118.146 TCP 66 54113 > http [ACK] Seq=97 Ack=709521 Win=1258752 Len=0 TSval=9634596 TSecr=1684191026
131   0.019322 54.230.118.146 -> 172.31.8.238 TCP 26130 [TCP segment of a reassembled PDU]
132   0.019336 172.31.8.238 -> 54.230.118.146 TCP 66 54113 > http [ACK] Seq=97 Ack=735585 Win=1310848 Len=0 TSval=9634596 TSecr=1684191026
133   0.019451 54.230.118.146 -> 172.31.8.238 TCP 27578 [TCP segment of a reassembled PDU]
134   0.019465 172.31.8.238 -> 54.230.118.146 TCP 66 54113 > http [ACK] Seq=97 Ack=763097 Win=1365888 Len=0 TSval=9634596 TSecr=1684191026
135   0.019521 54.230.118.146 -> 172.31.8.238 TCP 26130 [TCP segment of a reassembled PDU]
136   0.019535 172.31.8.238 -> 54.230.118.146 TCP 66 54113 > http [ACK] Seq=97 Ack=789161 Win=1418112 Len=0 TSval=9634596 TSecr=1684191026
137   0.019588 54.230.118.146 -> 172.31.8.238 TCP 17442 [TCP segment of a reassembled PDU]
138   0.019599 172.31.8.238 -> 54.230.118.146 TCP 66 54113 > http [ACK] Seq=97 Ack=806537 Win=1452800 Len=0 TSval=9634596 TSecr=1684191026
139   0.019965 54.230.118.146 -> 172.31.8.238 TCP 2962 [TCP segment of a reassembled PDU]
140   0.019972 172.31.8.238 -> 54.230.118.146 TCP 66 54113 > http [ACK] Seq=97 Ack=809433 Win=1458560 Len=0 TSval=9634596 TSecr=1684191026
141   0.020142 54.230.118.146 -> 172.31.8.238 TCP 26130 [TCP segment of a reassembled PDU]
142   0.020157 172.31.8.238 -> 54.230.118.146 TCP 66 54113 > http [ACK] Seq=97 Ack=835497 Win=1510784 Len=0 TSval=9634596 TSecr=1684191026
143   0.020162 54.230.118.146 -> 172.31.8.238 TCP 1514 [TCP segment of a reassembled PDU]
144   0.020165 172.31.8.238 -> 54.230.118.146 TCP 66 54113 > http [ACK] Seq=97 Ack=836945 Win=1513600 Len=0 TSval=9634596 TSecr=1684191026
145   0.020347 54.230.118.146 -> 172.31.8.238 TCP 36266 [TCP segment of a reassembled PDU]
146   0.020365 172.31.8.238 -> 54.230.118.146 TCP 66 54113 > http [ACK] Seq=97 Ack=873145 Win=1580416 Len=0 TSval=9634596 TSecr=1684191026
147   0.020416 54.230.118.146 -> 172.31.8.238 TCP 24682 [TCP segment of a reassembled PDU]
148   0.020428 172.31.8.238 -> 54.230.118.146 TCP 66 54113 > http [ACK] Seq=97 Ack=897761 Win=1586048 Len=0 TSval=9634596 TSecr=1684191026
149   0.020462 54.230.118.146 -> 172.31.8.238 TCP 4410 [TCP segment of a reassembled PDU]
150   0.020466 172.31.8.238 -> 54.230.118.146 TCP 66 54113 > http [ACK] Seq=97 Ack=902105 Win=1586048 Len=0 TSval=9634596 TSecr=1684191026
151   0.020736 54.230.118.146 -> 172.31.8.238 TCP 8754 [TCP segment of a reassembled PDU]
152   0.020744 172.31.8.238 -> 54.230.118.146 TCP 66 54113 > http [ACK] Seq=97 Ack=910793 Win=1586048 Len=0 TSval=9634596 TSecr=1684191026
153   0.020902 54.230.118.146 -> 172.31.8.238 TCP 26130 [TCP segment of a reassembled PDU]
154   0.020917 172.31.8.238 -> 54.230.118.146 TCP 66 54113 > http [ACK] Seq=97 Ack=936857 Win=1586048 Len=0 TSval=9634596 TSecr=1684191026
155   0.020923 54.230.118.146 -> 172.31.8.238 TCP 1514 [TCP segment of a reassembled PDU]
156   0.020934 54.230.118.146 -> 172.31.8.238 TCP 7306 [TCP segment of a reassembled PDU]
157   0.020952 172.31.8.238 -> 54.230.118.146 TCP 66 54113 > http [ACK] Seq=97 Ack=945545 Win=1582720 Len=0 TSval=9634596 TSecr=1684191026
158   0.021069 54.230.118.146 -> 172.31.8.238 TCP 24682 [TCP segment of a reassembled PDU]
159   0.021083 172.31.8.238 -> 54.230.118.146 TCP 66 54113 > http [ACK] Seq=97 Ack=970161 Win=1586048 Len=0 TSval=9634596 TSecr=1684191026
160   0.021216 54.230.118.146 -> 172.31.8.238 TCP 26130 [TCP segment of a reassembled PDU]
161   0.021230 172.31.8.238 -> 54.230.118.146 TCP 66 54113 > http [ACK] Seq=97 Ack=996225 Win=1586048 Len=0 TSval=9634596 TSecr=1684191026
162   0.021243 54.230.118.146 -> 172.31.8.238 TCP 15994 [TCP segment of a reassembled PDU]
163   0.021324 172.31.8.238 -> 54.230.118.146 TCP 66 54113 > http [ACK] Seq=97 Ack=1012153 Win=1570816 Len=0 TSval=9634596 TSecr=1684191026
164   0.021688 54.230.118.146 -> 172.31.8.238 TCP 1514 [TCP segment of a reassembled PDU]
165   0.021860 54.230.118.146 -> 172.31.8.238 TCP 26130 [TCP segment of a reassembled PDU]
166   0.021874 172.31.8.238 -> 54.230.118.146 TCP 66 54113 > http [ACK] Seq=97 Ack=1039665 Win=1586048 Len=0 TSval=9634597 TSecr=1684191026
167   0.021892 54.230.118.146 -> 172.31.8.238 HTTP 9435 HTTP/1.1 200 OK  (application/octet-stream)
168   0.021910 172.31.8.238 -> 54.230.118.146 TCP 66 54113 > http [ACK] Seq=97 Ack=1049034 Win=1580416 Len=0 TSval=9634597 TSecr=1684191026
169   0.022027 172.31.8.238 -> 54.230.118.146 TCP 66 54113 > http [FIN, ACK] Seq=97 Ack=1049034 Win=1586048 Len=0 TSval=9634597 TSecr=1684191026
170   0.022702 54.230.118.146 -> 172.31.8.238 TCP 66 http > 54113 [FIN, ACK] Seq=1049034 Ack=98 Win=14592 Len=0 TSval=1684191026 TSecr=9634597
171   0.022711 172.31.8.238 -> 54.230.118.146 TCP 66 54113 > http [ACK] Seq=98 Ack=1049035 Win=1586048 Len=0 TSval=9634597 TSecr=1684191026
