[Measurement for 10kb at 17:02:50 16.02.2014] 
Tshark:

  1   0.000000  192.168.1.2 -> 54.230.99.193 TCP 66 63365→80 [SYN] Seq=0 Win=8192 Len=0 MSS=1460 WS=256 SACK_PERM=1
  2   0.051530 54.230.99.193 -> 192.168.1.2  TCP 66 80→63365 [SYN, ACK] Seq=0 Ack=1 Win=14600 Len=0 MSS=1400 SACK_PERM=1 WS=128
  3   0.051658  192.168.1.2 -> 54.230.99.193 TCP 54 63365→80 [ACK] Seq=1 Ack=1 Win=65792 Len=0
  4   0.052015  192.168.1.2 -> 54.230.99.193 HTTP 151 GET /10kb HTTP/1.1 
  5   0.088485 54.230.99.193 -> 192.168.1.2  TCP 54 80→63365 [ACK] Seq=1 Ack=98 Win=14720 Len=0
  6   0.096364 54.230.99.193 -> 192.168.1.2  TCP 1454 [TCP segment of a reassembled PDU]
  7   0.099763 54.230.99.193 -> 192.168.1.2  TCP 1454 [TCP segment of a reassembled PDU]
  8   0.099887  192.168.1.2 -> 54.230.99.193 TCP 54 63365→80 [ACK] Seq=98 Ack=2801 Win=65792 Len=0
  9   0.100042 54.230.99.193 -> 192.168.1.2  TCP 1454 [TCP segment of a reassembled PDU]
 10   0.100110 54.230.99.193 -> 192.168.1.2  TCP 1454 [TCP segment of a reassembled PDU]
 11   0.100163  192.168.1.2 -> 54.230.99.193 TCP 54 63365→80 [ACK] Seq=98 Ack=5601 Win=65792 Len=0
 12   0.100283 54.230.99.193 -> 192.168.1.2  TCP 1454 [TCP segment of a reassembled PDU]
 13   0.100366 54.230.99.193 -> 192.168.1.2  TCP 1454 [TCP segment of a reassembled PDU]
 14   0.100415  192.168.1.2 -> 54.230.99.193 TCP 54 63365→80 [ACK] Seq=98 Ack=8401 Win=65792 Len=0
 15   0.100539 54.230.99.193 -> 192.168.1.2  TCP 1454 [TCP segment of a reassembled PDU]
 16   0.100817 54.230.99.193 -> 192.168.1.2  HTTP 949 HTTP/1.1 200 OK  (application/octet-stream)
 17   0.100869  192.168.1.2 -> 54.230.99.193 TCP 54 63365→80 [ACK] Seq=98 Ack=10696 Win=65792 Len=0
 18   0.101026  192.168.1.2 -> 54.230.99.193 TCP 54 63365→80 [FIN, ACK] Seq=98 Ack=10696 Win=65792 Len=0
 19   0.139841 54.230.99.193 -> 192.168.1.2  TCP 54 80→63365 [FIN, ACK] Seq=10696 Ack=99 Win=14720 Len=0
 20   0.139969  192.168.1.2 -> 54.230.99.193 TCP 54 63365→80 [ACK] Seq=99 Ack=10697 Win=65792 Len=0
 21   0.319834  192.168.1.2 -> 192.241.187.124 SSL 55 Continuation Data
 22   0.442435 192.241.187.124 -> 192.168.1.2  TCP 66 443→58317 [ACK] Seq=1 Ack=2 Win=16 Len=0 SLE=1 SRE=2
