[Measurement for 1mb at 23:35:51 19.35.2014] 
Tshark:

  1   0.000000 172.31.29.138 -> 172.31.0.2   DNS 89 Standard query 0x6302  A d3796nkzln59xv.cloudfront.net
  2   0.000024 172.31.29.138 -> 172.31.0.2   DNS 89 Standard query 0xee1e  AAAA d3796nkzln59xv.cloudfront.net
  3   0.000475   172.31.0.2 -> 172.31.29.138 DNS 170 Standard query response 0xee1e 
  4   0.000489   172.31.0.2 -> 172.31.29.138 DNS 217 Standard query response 0x6302  A 54.230.157.230 A 54.230.158.182 A 54.230.158.214 A 54.230.159.132 A 54.230.159.150 A 54.192.157.149 A 54.192.159.173 A 54.230.156.193
  5   0.003831 172.31.29.138 -> 54.230.157.230 TCP 74 60529 > http [SYN] Seq=0 Win=26883 Len=0 MSS=8961 SACK_PERM=1 TSval=6006134 TSecr=0 WS=128
  6   0.004311 54.230.157.230 -> 172.31.29.138 TCP 74 http > 60529 [SYN, ACK] Seq=0 Ack=1 Win=14480 Len=0 MSS=1460 SACK_PERM=1 TSval=728653662 TSecr=6006134 WS=128
  7   0.004338 172.31.29.138 -> 54.230.157.230 TCP 66 60529 > http [ACK] Seq=1 Ack=1 Win=27008 Len=0 TSval=6006134 TSecr=728653662
  8   0.004379 172.31.29.138 -> 54.230.157.230 HTTP 162 GET /1mb HTTP/1.1 
  9   0.004798 54.230.157.230 -> 172.31.29.138 TCP 66 http > 60529 [ACK] Seq=1 Ack=97 Win=14592 Len=0 TSval=728653662 TSecr=6006134
 10   0.006997 54.230.157.230 -> 172.31.29.138 TCP 523 [TCP segment of a reassembled PDU]
 11   0.007005 172.31.29.138 -> 54.230.157.230 TCP 66 60529 > http [ACK] Seq=97 Ack=458 Win=28032 Len=0 TSval=6006135 TSecr=728653662
 12   0.007295 54.230.157.230 -> 172.31.29.138 TCP 7306 [TCP segment of a reassembled PDU]
 13   0.007304 172.31.29.138 -> 54.230.157.230 TCP 66 60529 > http [ACK] Seq=97 Ack=7698 Win=42496 Len=0 TSval=6006135 TSecr=728653662
 14   0.007310 54.230.157.230 -> 172.31.29.138 TCP 1514 [TCP segment of a reassembled PDU]
 15   0.007314 172.31.29.138 -> 54.230.157.230 TCP 66 60529 > http [ACK] Seq=97 Ack=9146 Win=45440 Len=0 TSval=6006135 TSecr=728653662
 16   0.007319 54.230.157.230 -> 172.31.29.138 TCP 4410 [TCP segment of a reassembled PDU]
 17   0.007323 172.31.29.138 -> 54.230.157.230 TCP 66 60529 > http [ACK] Seq=97 Ack=13490 Win=54144 Len=0 TSval=6006135 TSecr=728653662
 18   0.008100 54.230.157.230 -> 172.31.29.138 TCP 10202 [TCP segment of a reassembled PDU]
 19   0.008109 172.31.29.138 -> 54.230.157.230 TCP 66 60529 > http [ACK] Seq=97 Ack=23626 Win=74368 Len=0 TSval=6006135 TSecr=728653662
 20   0.008124 54.230.157.230 -> 172.31.29.138 TCP 10202 [TCP segment of a reassembled PDU]
 21   0.008130 172.31.29.138 -> 54.230.157.230 TCP 66 60529 > http [ACK] Seq=97 Ack=33762 Win=84608 Len=0 TSval=6006135 TSecr=728653662
 22   0.008845 54.230.157.230 -> 172.31.29.138 TCP 5858 [TCP segment of a reassembled PDU]
 23   0.008851 172.31.29.138 -> 54.230.157.230 TCP 66 60529 > http [ACK] Seq=97 Ack=39554 Win=106240 Len=0 TSval=6006135 TSecr=728653663
 24   0.008883 54.230.157.230 -> 172.31.29.138 TCP 13098 [TCP segment of a reassembled PDU]
 25   0.008900 172.31.29.138 -> 54.230.157.230 TCP 66 60529 > http [ACK] Seq=97 Ack=52586 Win=93312 Len=0 TSval=6006135 TSecr=728653663
 26   0.009615 54.230.157.230 -> 172.31.29.138 TCP 13098 [TCP segment of a reassembled PDU]
 27   0.009624 172.31.29.138 -> 54.230.157.230 TCP 66 60529 > http [ACK] Seq=97 Ack=65618 Win=96512 Len=0 TSval=6006136 TSecr=728653663
 28   0.009649 54.230.157.230 -> 172.31.29.138 TCP 13098 [TCP segment of a reassembled PDU]
 29   0.009656 172.31.29.138 -> 54.230.157.230 TCP 66 60529 > http [ACK] Seq=97 Ack=78650 Win=83584 Len=0 TSval=6006136 TSecr=728653663
 30   0.010457 54.230.157.230 -> 172.31.29.138 TCP 13098 [TCP segment of a reassembled PDU]
 31   0.010466 172.31.29.138 -> 54.230.157.230 TCP 66 60529 > http [ACK] Seq=97 Ack=91682 Win=132224 Len=0 TSval=6006136 TSecr=728653663
 32   0.010485 54.230.157.230 -> 172.31.29.138 TCP 10202 [TCP segment of a reassembled PDU]
 33   0.010494 172.31.29.138 -> 54.230.157.230 TCP 66 60529 > http [ACK] Seq=97 Ack=101818 Win=152576 Len=0 TSval=6006136 TSecr=728653663
 34   0.010532 54.230.157.230 -> 172.31.29.138 TCP 2962 [TCP segment of a reassembled PDU]
 35   0.010537 172.31.29.138 -> 54.230.157.230 TCP 66 60529 > http [ACK] Seq=97 Ack=104714 Win=158336 Len=0 TSval=6006136 TSecr=728653663
 36   0.011134 54.230.157.230 -> 172.31.29.138 TCP 10202 [TCP segment of a reassembled PDU]
 37   0.011142 172.31.29.138 -> 54.230.157.230 TCP 66 60529 > http [ACK] Seq=97 Ack=114850 Win=178560 Len=0 TSval=6006136 TSecr=728653663
 38   0.011197 54.230.157.230 -> 172.31.29.138 TCP 2962 [TCP segment of a reassembled PDU]
 39   0.011202 172.31.29.138 -> 54.230.157.230 TCP 66 60529 > http [ACK] Seq=97 Ack=117746 Win=184448 Len=0 TSval=6006136 TSecr=728653663
 40   0.011231 54.230.157.230 -> 172.31.29.138 TCP 13098 [TCP segment of a reassembled PDU]
 41   0.011239 172.31.29.138 -> 54.230.157.230 TCP 66 60529 > http [ACK] Seq=97 Ack=130778 Win=210432 Len=0 TSval=6006136 TSecr=728653663
 42   0.011907 54.230.157.230 -> 172.31.29.138 TCP 8754 [TCP segment of a reassembled PDU]
 43   0.011916 172.31.29.138 -> 54.230.157.230 TCP 66 60529 > http [ACK] Seq=97 Ack=139466 Win=227840 Len=0 TSval=6006136 TSecr=728653663
 44   0.011974 54.230.157.230 -> 172.31.29.138 TCP 4410 [TCP segment of a reassembled PDU]
 45   0.011980 172.31.29.138 -> 54.230.157.230 TCP 66 60529 > http [ACK] Seq=97 Ack=143810 Win=236544 Len=0 TSval=6006136 TSecr=728653663
 46   0.012021 54.230.157.230 -> 172.31.29.138 TCP 13098 [TCP segment of a reassembled PDU]
 47   0.012030 172.31.29.138 -> 54.230.157.230 TCP 66 60529 > http [ACK] Seq=97 Ack=156842 Win=262656 Len=0 TSval=6006136 TSecr=728653663
 48   0.012675 54.230.157.230 -> 172.31.29.138 TCP 5858 [TCP segment of a reassembled PDU]
 49   0.012682 172.31.29.138 -> 54.230.157.230 TCP 66 60529 > http [ACK] Seq=97 Ack=162634 Win=274176 Len=0 TSval=6006136 TSecr=728653663
 50   0.012774 54.230.157.230 -> 172.31.29.138 TCP 7306 [TCP segment of a reassembled PDU]
 51   0.012780 172.31.29.138 -> 54.230.157.230 TCP 66 60529 > http [ACK] Seq=97 Ack=169874 Win=288640 Len=0 TSval=6006136 TSecr=728653663
 52   0.012883 54.230.157.230 -> 172.31.29.138 TCP 26130 [TCP segment of a reassembled PDU]
 53   0.012896 172.31.29.138 -> 54.230.157.230 TCP 66 60529 > http [ACK] Seq=97 Ack=195938 Win=340736 Len=0 TSval=6006136 TSecr=728653663
 54   0.013476 54.230.157.230 -> 172.31.29.138 TCP 10202 [TCP segment of a reassembled PDU]
 55   0.013484 172.31.29.138 -> 54.230.157.230 TCP 66 60529 > http [ACK] Seq=97 Ack=206074 Win=361088 Len=0 TSval=6006137 TSecr=728653663
 56   0.013574 54.230.157.230 -> 172.31.29.138 TCP 8754 [TCP segment of a reassembled PDU]
 57   0.013581 172.31.29.138 -> 54.230.157.230 TCP 66 60529 > http [ACK] Seq=97 Ack=214762 Win=378496 Len=0 TSval=6006137 TSecr=728653663
 58   0.013824 54.230.157.230 -> 172.31.29.138 TCP 23234 [TCP segment of a reassembled PDU]
 59   0.013837 172.31.29.138 -> 54.230.157.230 TCP 66 60529 > http [ACK] Seq=97 Ack=237930 Win=424832 Len=0 TSval=6006137 TSecr=728653663
 60   0.014227 54.230.157.230 -> 172.31.29.138 TCP 10202 [TCP segment of a reassembled PDU]
 61   0.014236 172.31.29.138 -> 54.230.157.230 TCP 66 60529 > http [ACK] Seq=97 Ack=248066 Win=445056 Len=0 TSval=6006137 TSecr=728653663
 62   0.014328 54.230.157.230 -> 172.31.29.138 TCP 5858 [TCP segment of a reassembled PDU]
 63   0.014334 172.31.29.138 -> 54.230.157.230 TCP 66 60529 > http [ACK] Seq=97 Ack=253858 Win=456576 Len=0 TSval=6006137 TSecr=728653663
 64   0.014610 54.230.157.230 -> 172.31.29.138 TCP 26130 [TCP segment of a reassembled PDU]
 65   0.014625 172.31.29.138 -> 54.230.157.230 TCP 66 60529 > http [ACK] Seq=97 Ack=279922 Win=508800 Len=0 TSval=6006137 TSecr=728653663
 66   0.014992 54.230.157.230 -> 172.31.29.138 TCP 8754 [TCP segment of a reassembled PDU]
 67   0.014999 172.31.29.138 -> 54.230.157.230 TCP 66 60529 > http [ACK] Seq=97 Ack=288610 Win=526080 Len=0 TSval=6006137 TSecr=728653663
 68   0.015117 54.230.157.230 -> 172.31.29.138 TCP 11650 [TCP segment of a reassembled PDU]
 69   0.015126 172.31.29.138 -> 54.230.157.230 TCP 66 60529 > http [ACK] Seq=97 Ack=300194 Win=549248 Len=0 TSval=6006137 TSecr=728653663
 70   0.015381 54.230.157.230 -> 172.31.29.138 TCP 21786 [TCP segment of a reassembled PDU]
 71   0.015392 172.31.29.138 -> 54.230.157.230 TCP 66 60529 > http [ACK] Seq=97 Ack=321914 Win=592768 Len=0 TSval=6006137 TSecr=728653663
 72   0.015761 54.230.157.230 -> 172.31.29.138 TCP 8754 [TCP segment of a reassembled PDU]
 73   0.015768 172.31.29.138 -> 54.230.157.230 TCP 66 60529 > http [ACK] Seq=97 Ack=330602 Win=610176 Len=0 TSval=6006137 TSecr=728653663
 74   0.015906 54.230.157.230 -> 172.31.29.138 TCP 14546 [TCP segment of a reassembled PDU]
 75   0.015916 172.31.29.138 -> 54.230.157.230 TCP 66 60529 > http [ACK] Seq=97 Ack=345082 Win=639104 Len=0 TSval=6006137 TSecr=728653663
 76   0.016162 54.230.157.230 -> 172.31.29.138 TCP 17442 [TCP segment of a reassembled PDU]
 77   0.016173 172.31.29.138 -> 54.230.157.230 TCP 66 60529 > http [ACK] Seq=97 Ack=362458 Win=673792 Len=0 TSval=6006137 TSecr=728653663
 78   0.016191 54.230.157.230 -> 172.31.29.138 TCP 8754 [TCP segment of a reassembled PDU]
 79   0.016197 172.31.29.138 -> 54.230.157.230 TCP 66 60529 > http [ACK] Seq=97 Ack=371146 Win=691200 Len=0 TSval=6006137 TSecr=728653663
 80   0.016236 54.230.157.230 -> 172.31.29.138 TCP 10202 [TCP segment of a reassembled PDU]
 81   0.016242 172.31.29.138 -> 54.230.157.230 TCP 66 60529 > http [ACK] Seq=97 Ack=381282 Win=711424 Len=0 TSval=6006137 TSecr=728653663
 82   0.016534 54.230.157.230 -> 172.31.29.138 TCP 5858 [TCP segment of a reassembled PDU]
 83   0.016541 172.31.29.138 -> 54.230.157.230 TCP 66 60529 > http [ACK] Seq=97 Ack=387074 Win=723072 Len=0 TSval=6006137 TSecr=728653663
 84   0.016808 54.230.157.230 -> 172.31.29.138 TCP 11650 [TCP segment of a reassembled PDU]
 85   0.016816 172.31.29.138 -> 54.230.157.230 TCP 66 60529 > http [ACK] Seq=97 Ack=398658 Win=746240 Len=0 TSval=6006137 TSecr=728653663
 86   0.017009 54.230.157.230 -> 172.31.29.138 TCP 26130 [TCP segment of a reassembled PDU]
 87   0.017039 172.31.29.138 -> 54.230.157.230 TCP 66 60529 > http [ACK] Seq=97 Ack=424722 Win=798336 Len=0 TSval=6006137 TSecr=728653663
 88   0.017047 54.230.157.230 -> 172.31.29.138 TCP 1514 [TCP segment of a reassembled PDU]
 89   0.017050 172.31.29.138 -> 54.230.157.230 TCP 66 60529 > http [ACK] Seq=97 Ack=426170 Win=801280 Len=0 TSval=6006137 TSecr=728653663
 90   0.017500 54.230.157.230 -> 172.31.29.138 TCP 26130 [TCP segment of a reassembled PDU]
 91   0.017514 172.31.29.138 -> 54.230.157.230 TCP 66 60529 > http [ACK] Seq=97 Ack=452234 Win=804224 Len=0 TSval=6006138 TSecr=728653663
 92   0.017798 54.230.157.230 -> 172.31.29.138 TCP 5858 [TCP segment of a reassembled PDU]
 93   0.017806 172.31.29.138 -> 54.230.157.230 TCP 66 60529 > http [ACK] Seq=97 Ack=458026 Win=859776 Len=0 TSval=6006138 TSecr=728653663
 94   0.017995 54.230.157.230 -> 172.31.29.138 TCP 29026 [TCP segment of a reassembled PDU]
 95   0.018010 172.31.29.138 -> 54.230.157.230 TCP 66 60529 > http [ACK] Seq=97 Ack=486986 Win=917760 Len=0 TSval=6006138 TSecr=728653663
 96   0.018025 54.230.157.230 -> 172.31.29.138 TCP 8754 [TCP segment of a reassembled PDU]
 97   0.018031 172.31.29.138 -> 54.230.157.230 TCP 66 60529 > http [ACK] Seq=97 Ack=495674 Win=935168 Len=0 TSval=6006138 TSecr=728653663
 98   0.018409 54.230.157.230 -> 172.31.29.138 TCP 21786 [TCP segment of a reassembled PDU]
 99   0.018422 172.31.29.138 -> 54.230.157.230 TCP 66 60529 > http [ACK] Seq=97 Ack=517394 Win=978560 Len=0 TSval=6006138 TSecr=728653663
100   0.018658 54.230.157.230 -> 172.31.29.138 TCP 20338 [TCP segment of a reassembled PDU]
101   0.018670 172.31.29.138 -> 54.230.157.230 TCP 66 60529 > http [ACK] Seq=97 Ack=537666 Win=1019136 Len=0 TSval=6006138 TSecr=728653663
102   0.018800 54.230.157.230 -> 172.31.29.138 TCP 26130 [TCP segment of a reassembled PDU]
103   0.018813 172.31.29.138 -> 54.230.157.230 TCP 66 60529 > http [ACK] Seq=97 Ack=563730 Win=1071232 Len=0 TSval=6006138 TSecr=728653663
104   0.019117 54.230.157.230 -> 172.31.29.138 TCP 7306 [TCP segment of a reassembled PDU]
105   0.019125 172.31.29.138 -> 54.230.157.230 TCP 66 60529 > http [ACK] Seq=97 Ack=570970 Win=1085696 Len=0 TSval=6006138 TSecr=728653664
106   0.019310 54.230.157.230 -> 172.31.29.138 TCP 11650 [TCP segment of a reassembled PDU]
107   0.019319 172.31.29.138 -> 54.230.157.230 TCP 66 60529 > http [ACK] Seq=97 Ack=582554 Win=1108864 Len=0 TSval=6006138 TSecr=728653664
108   0.019377 54.230.157.230 -> 172.31.29.138 TCP 17442 [TCP segment of a reassembled PDU]
109   0.019387 172.31.29.138 -> 54.230.157.230 TCP 66 60529 > http [ACK] Seq=97 Ack=599930 Win=1143680 Len=0 TSval=6006138 TSecr=728653664
110   0.019395 54.230.157.230 -> 172.31.29.138 TCP 2962 [TCP segment of a reassembled PDU]
111   0.019401 172.31.29.138 -> 54.230.157.230 TCP 66 60529 > http [ACK] Seq=97 Ack=602826 Win=1149440 Len=0 TSval=6006138 TSecr=728653664
112   0.019409 54.230.157.230 -> 172.31.29.138 TCP 5858 [TCP segment of a reassembled PDU]
113   0.019416 172.31.29.138 -> 54.230.157.230 TCP 66 60529 > http [ACK] Seq=97 Ack=608618 Win=1160960 Len=0 TSval=6006138 TSecr=728653664
114   0.019444 54.230.157.230 -> 172.31.29.138 TCP 10202 [TCP segment of a reassembled PDU]
115   0.019451 172.31.29.138 -> 54.230.157.230 TCP 66 60529 > http [ACK] Seq=97 Ack=618754 Win=1174784 Len=0 TSval=6006138 TSecr=728653664
116   0.019743 54.230.157.230 -> 172.31.29.138 TCP 27578 [TCP segment of a reassembled PDU]
117   0.019759 172.31.29.138 -> 54.230.157.230 TCP 66 60529 > http [ACK] Seq=97 Ack=646266 Win=1189120 Len=0 TSval=6006138 TSecr=728653664
118   0.019978 54.230.157.230 -> 172.31.29.138 TCP 1514 [TCP segment of a reassembled PDU]
119   0.019983 172.31.29.138 -> 54.230.157.230 TCP 66 60529 > http [ACK] Seq=97 Ack=647714 Win=1232000 Len=0 TSval=6006138 TSecr=728653664
120   0.020287 54.230.157.230 -> 172.31.29.138 TCP 26130 [TCP segment of a reassembled PDU]
121   0.020300 172.31.29.138 -> 54.230.157.230 TCP 66 60529 > http [ACK] Seq=97 Ack=673778 Win=1206016 Len=0 TSval=6006138 TSecr=728653664
122   0.020352 54.230.157.230 -> 172.31.29.138 TCP 26130 [TCP segment of a reassembled PDU]
123   0.020365 172.31.29.138 -> 54.230.157.230 TCP 66 60529 > http [ACK] Seq=97 Ack=699842 Win=1191680 Len=0 TSval=6006138 TSecr=728653664
124   0.020404 54.230.157.230 -> 172.31.29.138 TCP 8754 [TCP segment of a reassembled PDU]
125   0.020411 172.31.29.138 -> 54.230.157.230 TCP 66 60529 > http [ACK] Seq=97 Ack=708530 Win=1220224 Len=0 TSval=6006138 TSecr=728653664
126   0.020439 54.230.157.230 -> 172.31.29.138 TCP 4410 [TCP segment of a reassembled PDU]
127   0.020443 172.31.29.138 -> 54.230.157.230 TCP 66 60529 > http [ACK] Seq=97 Ack=712874 Win=1227264 Len=0 TSval=6006138 TSecr=728653664
128   0.021179 54.230.157.230 -> 172.31.29.138 TCP 11650 [TCP segment of a reassembled PDU]
129   0.021188 172.31.29.138 -> 54.230.157.230 TCP 66 60529 > http [ACK] Seq=97 Ack=724458 Win=1215744 Len=0 TSval=6006138 TSecr=728653664
130   0.021325 54.230.157.230 -> 172.31.29.138 TCP 26130 [TCP segment of a reassembled PDU]
131   0.021339 172.31.29.138 -> 54.230.157.230 TCP 66 60529 > http [ACK] Seq=97 Ack=750522 Win=1191680 Len=0 TSval=6006138 TSecr=728653664
132   0.021352 54.230.157.230 -> 172.31.29.138 TCP 11650 [TCP segment of a reassembled PDU]
133   0.021359 172.31.29.138 -> 54.230.157.230 TCP 66 60529 > http [ACK] Seq=97 Ack=762106 Win=1180160 Len=0 TSval=6006138 TSecr=728653664
134   0.021371 54.230.157.230 -> 172.31.29.138 TCP 13098 [TCP segment of a reassembled PDU]
135   0.021378 172.31.29.138 -> 54.230.157.230 TCP 66 60529 > http [ACK] Seq=97 Ack=775138 Win=1167232 Len=0 TSval=6006138 TSecr=728653664
136   0.021384 54.230.157.230 -> 172.31.29.138 TCP 1514 [TCP segment of a reassembled PDU]
137   0.021386 172.31.29.138 -> 54.230.157.230 TCP 66 60529 > http [ACK] Seq=97 Ack=776586 Win=1165824 Len=0 TSval=6006138 TSecr=728653664
138   0.021496 54.230.157.230 -> 172.31.29.138 TCP 36266 [TCP segment of a reassembled PDU]
139   0.021512 172.31.29.138 -> 54.230.157.230 TCP 66 60529 > http [ACK] Seq=97 Ack=812786 Win=1174912 Len=0 TSval=6006138 TSecr=728653664
140   0.022014 54.230.157.230 -> 172.31.29.138 TCP 24682 [TCP segment of a reassembled PDU]
141   0.022028 172.31.29.138 -> 54.230.157.230 TCP 66 60529 > http [ACK] Seq=97 Ack=837402 Win=1230080 Len=0 TSval=6006139 TSecr=728653664
142   0.022055 54.230.157.230 -> 172.31.29.138 TCP 5858 [TCP segment of a reassembled PDU]
143   0.022069 172.31.29.138 -> 54.230.157.230 TCP 66 60529 > http [ACK] Seq=97 Ack=843194 Win=1232384 Len=0 TSval=6006139 TSecr=728653664
144   0.022099 54.230.157.230 -> 172.31.29.138 TCP 5858 [TCP segment of a reassembled PDU]
145   0.022105 172.31.29.138 -> 54.230.157.230 TCP 66 60529 > http [ACK] Seq=97 Ack=848986 Win=1243904 Len=0 TSval=6006139 TSecr=728653664
146   0.022164 54.230.157.230 -> 172.31.29.138 TCP 20338 [TCP segment of a reassembled PDU]
147   0.022180 54.230.157.230 -> 172.31.29.138 TCP 5858 [TCP segment of a reassembled PDU]
148   0.022212 54.230.157.230 -> 172.31.29.138 TCP 20338 [TCP segment of a reassembled PDU]
149   0.022229 54.230.157.230 -> 172.31.29.138 TCP 13098 [TCP segment of a reassembled PDU]
150   0.022237 172.31.29.138 -> 54.230.157.230 TCP 66 60529 > http [ACK] Seq=97 Ack=875050 Win=1227520 Len=0 TSval=6006139 TSecr=728653664
151   0.022258 172.31.29.138 -> 54.230.157.230 TCP 66 60529 > http [ACK] Seq=97 Ack=908354 Win=1215744 Len=0 TSval=6006139 TSecr=728653664
152   0.022712 54.230.157.230 -> 172.31.29.138 TCP 5858 [TCP segment of a reassembled PDU]
153   0.022720 172.31.29.138 -> 54.230.157.230 TCP 66 60529 > http [ACK] Seq=97 Ack=914146 Win=1255552 Len=0 TSval=6006139 TSecr=728653664
154   0.022871 54.230.157.230 -> 172.31.29.138 TCP 17442 [TCP segment of a reassembled PDU]
155   0.022894 172.31.29.138 -> 54.230.157.230 TCP 66 60529 > http [ACK] Seq=97 Ack=931522 Win=1241856 Len=0 TSval=6006139 TSecr=728653664
156   0.022916 54.230.157.230 -> 172.31.29.138 TCP 8754 [TCP segment of a reassembled PDU]
157   0.022927 172.31.29.138 -> 54.230.157.230 TCP 66 60529 > http [ACK] Seq=97 Ack=940210 Win=1255552 Len=0 TSval=6006139 TSecr=728653664
158   0.022991 54.230.157.230 -> 172.31.29.138 TCP 26130 [TCP segment of a reassembled PDU]
159   0.023005 54.230.157.230 -> 172.31.29.138 TCP 1514 [TCP segment of a reassembled PDU]
160   0.023007 54.230.157.230 -> 172.31.29.138 TCP 1514 [TCP Previous segment not captured] [TCP segment of a reassembled PDU]
161   0.023011 172.31.29.138 -> 54.230.157.230 TCP 78 60529 > http [ACK] Seq=97 Ack=967722 Win=1228160 Len=0 TSval=6006139 TSecr=728653664 SLE=969170 SRE=970618
162   0.023028 54.230.157.230 -> 172.31.29.138 TCP 1514 [TCP Out-Of-Order] [TCP segment of a reassembled PDU]
163   0.023032 172.31.29.138 -> 54.230.157.230 TCP 66 60529 > http [ACK] Seq=97 Ack=970618 Win=1225344 Len=0 TSval=6006139 TSecr=728653664
164   0.023108 54.230.157.230 -> 172.31.29.138 TCP 23234 [TCP segment of a reassembled PDU]
