[Measurement for 1mb at 09:35:51 20.35.2014] 
Tshark:

  1   0.000000 172.31.29.138 -> 172.31.0.2   DNS 89 Standard query 0xcbe0  A d3796nkzln59xv.cloudfront.net
  2   0.000040 172.31.29.138 -> 172.31.0.2   DNS 89 Standard query 0x87ae  AAAA d3796nkzln59xv.cloudfront.net
  3   0.000557   172.31.0.2 -> 172.31.29.138 DNS 217 Standard query response 0xcbe0  A 54.230.150.42 A 54.230.150.74 A 54.230.150.122 A 54.230.150.152 A 54.230.150.220 A 54.230.149.38 A 54.230.149.227 A 54.230.149.232
  4   0.000567   172.31.0.2 -> 172.31.29.138 DNS 170 Standard query response 0x87ae 
  5   0.003887 172.31.29.138 -> 54.230.150.42 TCP 74 39599 > http [SYN] Seq=0 Win=26883 Len=0 MSS=8961 SACK_PERM=1 TSval=15006179 TSecr=0 WS=128
  6   0.005348 54.230.150.42 -> 172.31.29.138 TCP 74 http > 39599 [SYN, ACK] Seq=0 Ack=1 Win=14480 Len=0 MSS=1460 SACK_PERM=1 TSval=1455834143 TSecr=15006179 WS=128
  7   0.005361 172.31.29.138 -> 54.230.150.42 TCP 66 39599 > http [ACK] Seq=1 Ack=1 Win=27008 Len=0 TSval=15006179 TSecr=1455834143
  8   0.005401 172.31.29.138 -> 54.230.150.42 HTTP 162 GET /1mb HTTP/1.1 
  9   0.006686 54.230.150.42 -> 172.31.29.138 TCP 66 http > 39599 [ACK] Seq=1 Ack=97 Win=14592 Len=0 TSval=1455834143 TSecr=15006179
 10   0.010817 54.230.150.42 -> 172.31.29.138 TCP 2592 [TCP segment of a reassembled PDU]
 11   0.010825 172.31.29.138 -> 54.230.150.42 TCP 66 39599 > http [ACK] Seq=97 Ack=2527 Win=32000 Len=0 TSval=15006181 TSecr=1455834144
 12   0.010874 54.230.150.42 -> 172.31.29.138 TCP 11650 [TCP segment of a reassembled PDU]
 13   0.010884 172.31.29.138 -> 54.230.150.42 TCP 66 39599 > http [ACK] Seq=97 Ack=14111 Win=55168 Len=0 TSval=15006181 TSecr=1455834144
 14   0.012421 54.230.150.42 -> 172.31.29.138 TCP 5858 [TCP segment of a reassembled PDU]
 15   0.012429 172.31.29.138 -> 54.230.150.42 TCP 66 39599 > http [ACK] Seq=97 Ack=19903 Win=66688 Len=0 TSval=15006181 TSecr=1455834144
 16   0.012461 54.230.150.42 -> 172.31.29.138 TCP 7306 [TCP segment of a reassembled PDU]
 17   0.012467 172.31.29.138 -> 54.230.150.42 TCP 66 39599 > http [ACK] Seq=97 Ack=27143 Win=81280 Len=0 TSval=15006181 TSecr=1455834144
 18   0.013946 54.230.150.42 -> 172.31.29.138 TCP 11650 [TCP segment of a reassembled PDU]
 19   0.013955 172.31.29.138 -> 54.230.150.42 TCP 66 39599 > http [ACK] Seq=97 Ack=38727 Win=98944 Len=0 TSval=15006182 TSecr=1455834144
 20   0.013991 54.230.150.42 -> 172.31.29.138 TCP 8754 [TCP segment of a reassembled PDU]
 21   0.013998 172.31.29.138 -> 54.230.150.42 TCP 66 39599 > http [ACK] Seq=97 Ack=47415 Win=121728 Len=0 TSval=15006182 TSecr=1455834144
 22   0.015486 54.230.150.42 -> 172.31.29.138 TCP 5858 [TCP segment of a reassembled PDU]
 23   0.015492 172.31.29.138 -> 54.230.150.42 TCP 66 39599 > http [ACK] Seq=97 Ack=53207 Win=133376 Len=0 TSval=15006182 TSecr=1455834144
 24   0.015536 54.230.150.42 -> 172.31.29.138 TCP 17442 [TCP segment of a reassembled PDU]
 25   0.015546 172.31.29.138 -> 54.230.150.42 TCP 66 39599 > http [ACK] Seq=97 Ack=70583 Win=168064 Len=0 TSval=15006182 TSecr=1455834144
 26   0.016982 54.230.150.42 -> 172.31.29.138 TCP 4410 [TCP segment of a reassembled PDU]
 27   0.016988 172.31.29.138 -> 54.230.150.42 TCP 66 39599 > http [ACK] Seq=97 Ack=74927 Win=176768 Len=0 TSval=15006182 TSecr=1455834144
 28   0.017107 54.230.150.42 -> 172.31.29.138 TCP 21786 [TCP segment of a reassembled PDU]
 29   0.017120 172.31.29.138 -> 54.230.150.42 TCP 66 39599 > http [ACK] Seq=97 Ack=96647 Win=220288 Len=0 TSval=15006182 TSecr=1455834144
 30   0.018572 54.230.150.42 -> 172.31.29.138 TCP 14546 [TCP segment of a reassembled PDU]
 31   0.018583 172.31.29.138 -> 54.230.150.42 TCP 66 39599 > http [ACK] Seq=97 Ack=111127 Win=249216 Len=0 TSval=15006183 TSecr=1455834144
 32   0.018633 54.230.150.42 -> 172.31.29.138 TCP 14546 [TCP segment of a reassembled PDU]
 33   0.018644 172.31.29.138 -> 54.230.150.42 TCP 66 39599 > http [ACK] Seq=97 Ack=125607 Win=278144 Len=0 TSval=15006183 TSecr=1455834144
 34   0.020059 54.230.150.42 -> 172.31.29.138 TCP 2962 [TCP segment of a reassembled PDU]
 35   0.020065 172.31.29.138 -> 54.230.150.42 TCP 66 39599 > http [ACK] Seq=97 Ack=128503 Win=283904 Len=0 TSval=15006183 TSecr=1455834145
 36   0.020218 54.230.150.42 -> 172.31.29.138 TCP 29026 [TCP segment of a reassembled PDU]
 37   0.020233 172.31.29.138 -> 54.230.150.42 TCP 66 39599 > http [ACK] Seq=97 Ack=157463 Win=341888 Len=0 TSval=15006183 TSecr=1455834145
 38   0.021405 54.230.150.42 -> 172.31.29.138 TCP 4410 [TCP segment of a reassembled PDU]
 39   0.021412 172.31.29.138 -> 54.230.150.42 TCP 66 39599 > http [ACK] Seq=97 Ack=161807 Win=350592 Len=0 TSval=15006183 TSecr=1455834145
 40   0.021787 54.230.150.42 -> 172.31.29.138 TCP 26130 [TCP segment of a reassembled PDU]
 41   0.021802 172.31.29.138 -> 54.230.150.42 TCP 66 39599 > http [ACK] Seq=97 Ack=187871 Win=402688 Len=0 TSval=15006184 TSecr=1455834145
 42   0.021810 54.230.150.42 -> 172.31.29.138 TCP 4410 [TCP segment of a reassembled PDU]
 43   0.021814 172.31.29.138 -> 54.230.150.42 TCP 66 39599 > http [ACK] Seq=97 Ack=192215 Win=411392 Len=0 TSval=15006184 TSecr=1455834145
 44   0.022990 54.230.150.42 -> 172.31.29.138 TCP 11650 [TCP segment of a reassembled PDU]
 45   0.023012 172.31.29.138 -> 54.230.150.42 TCP 66 39599 > http [ACK] Seq=97 Ack=203799 Win=434560 Len=0 TSval=15006184 TSecr=1455834145
 46   0.023141 54.230.150.42 -> 172.31.29.138 TCP 21786 [TCP segment of a reassembled PDU]
 47   0.023153 172.31.29.138 -> 54.230.150.42 TCP 66 39599 > http [ACK] Seq=97 Ack=225519 Win=477952 Len=0 TSval=15006184 TSecr=1455834145
 48   0.023246 54.230.150.42 -> 172.31.29.138 TCP 1514 [TCP segment of a reassembled PDU]
 49   0.023251 172.31.29.138 -> 54.230.150.42 TCP 66 39599 > http [ACK] Seq=97 Ack=226967 Win=480896 Len=0 TSval=15006184 TSecr=1455834145
 50   0.024512 54.230.150.42 -> 172.31.29.138 TCP 8754 [TCP segment of a reassembled PDU]
 51   0.024519 172.31.29.138 -> 54.230.150.42 TCP 66 39599 > http [ACK] Seq=97 Ack=235655 Win=498304 Len=0 TSval=15006184 TSecr=1455834145
 52   0.024650 54.230.150.42 -> 172.31.29.138 TCP 29026 [TCP segment of a reassembled PDU]
 53   0.024665 172.31.29.138 -> 54.230.150.42 TCP 66 39599 > http [ACK] Seq=97 Ack=264615 Win=529024 Len=0 TSval=15006184 TSecr=1455834145
 54   0.024673 54.230.150.42 -> 172.31.29.138 TCP 2962 [TCP segment of a reassembled PDU]
 55   0.024676 172.31.29.138 -> 54.230.150.42 TCP 66 39599 > http [ACK] Seq=97 Ack=267511 Win=526208 Len=0 TSval=15006184 TSecr=1455834145
 56   0.026233 54.230.150.42 -> 172.31.29.138 TCP 10202 [TCP segment of a reassembled PDU]
 57   0.026243 172.31.29.138 -> 54.230.150.42 TCP 66 39599 > http [ACK] Seq=97 Ack=277647 Win=560000 Len=0 TSval=15006185 TSecr=1455834145
 58   0.026380 54.230.150.42 -> 172.31.29.138 TCP 26130 [TCP segment of a reassembled PDU]
 59   0.026394 172.31.29.138 -> 54.230.150.42 TCP 66 39599 > http [ACK] Seq=97 Ack=303711 Win=534016 Len=0 TSval=15006185 TSecr=1455834145
 60   0.026406 54.230.150.42 -> 172.31.29.138 TCP 7306 [TCP segment of a reassembled PDU]
 61   0.026410 172.31.29.138 -> 54.230.150.42 TCP 66 39599 > http [ACK] Seq=97 Ack=310951 Win=526848 Len=0 TSval=15006185 TSecr=1455834145
 62   0.027779 54.230.150.42 -> 172.31.29.138 TCP 11650 [TCP segment of a reassembled PDU]
 63   0.027788 172.31.29.138 -> 54.230.150.42 TCP 66 39599 > http [ACK] Seq=97 Ack=322535 Win=557696 Len=0 TSval=15006185 TSecr=1455834145
 64   0.027930 54.230.150.42 -> 172.31.29.138 TCP 26130 [TCP segment of a reassembled PDU]
 65   0.027944 172.31.29.138 -> 54.230.150.42 TCP 66 39599 > http [ACK] Seq=97 Ack=348599 Win=533888 Len=0 TSval=15006185 TSecr=1455834145
 66   0.027956 54.230.150.42 -> 172.31.29.138 TCP 8754 [TCP segment of a reassembled PDU]
 67   0.027961 172.31.29.138 -> 54.230.150.42 TCP 66 39599 > http [ACK] Seq=97 Ack=357287 Win=525312 Len=0 TSval=15006185 TSecr=1455834145
 68   0.029331 54.230.150.42 -> 172.31.29.138 TCP 13098 [TCP segment of a reassembled PDU]
 69   0.029340 172.31.29.138 -> 54.230.150.42 TCP 66 39599 > http [ACK] Seq=97 Ack=370319 Win=555264 Len=0 TSval=15006185 TSecr=1455834146
 70   0.029476 54.230.150.42 -> 172.31.29.138 TCP 26130 [TCP segment of a reassembled PDU]
 71   0.029495 54.230.150.42 -> 172.31.29.138 TCP 7306 [TCP segment of a reassembled PDU]
 72   0.029584 172.31.29.138 -> 54.230.150.42 TCP 66 39599 > http [ACK] Seq=97 Ack=403623 Win=521984 Len=0 TSval=15006186 TSecr=1455834146
 73   0.030844 54.230.150.42 -> 172.31.29.138 TCP 7306 [TCP segment of a reassembled PDU]
 74   0.030852 172.31.29.138 -> 54.230.150.42 TCP 66 39599 > http [ACK] Seq=97 Ack=410863 Win=564736 Len=0 TSval=15006186 TSecr=1455834146
 75   0.030979 54.230.150.42 -> 172.31.29.138 TCP 11650 [TCP segment of a reassembled PDU]
 76   0.031001 172.31.29.138 -> 54.230.150.42 TCP 66 39599 > http [ACK] Seq=97 Ack=422447 Win=576000 Len=0 TSval=15006186 TSecr=1455834146
 77   0.031305 54.230.150.42 -> 172.31.29.138 TCP 40610 [TCP segment of a reassembled PDU]
 78   0.031363 172.31.29.138 -> 54.230.150.42 TCP 66 39599 > http [ACK] Seq=97 Ack=462991 Win=535552 Len=0 TSval=15006186 TSecr=1455834146
 79   0.032409 54.230.150.42 -> 172.31.29.138 TCP 8754 [TCP segment of a reassembled PDU]
 80   0.032418 172.31.29.138 -> 54.230.150.42 TCP 66 39599 > http [ACK] Seq=97 Ack=471679 Win=562432 Len=0 TSval=15006186 TSecr=1455834146
 81   0.032517 54.230.150.42 -> 172.31.29.138 TCP 13098 [TCP segment of a reassembled PDU]
 82   0.032540 172.31.29.138 -> 54.230.150.42 TCP 66 39599 > http [ACK] Seq=97 Ack=484711 Win=576000 Len=0 TSval=15006186 TSecr=1455834146
 83   0.032937 54.230.150.42 -> 172.31.29.138 TCP 11650 [TCP segment of a reassembled PDU]
 84   0.033073 54.230.150.42 -> 172.31.29.138 TCP 27578 [TCP segment of a reassembled PDU]
 85   0.033087 54.230.150.42 -> 172.31.29.138 TCP 1514 [TCP segment of a reassembled PDU]
 86   0.033090 54.230.150.42 -> 172.31.29.138 TCP 1514 [TCP segment of a reassembled PDU]
 87   0.033186 172.31.29.138 -> 54.230.150.42 TCP 66 39599 > http [ACK] Seq=97 Ack=526703 Win=534016 Len=0 TSval=15006186 TSecr=1455834146
 88   0.033931 54.230.150.42 -> 172.31.29.138 TCP 8754 [TCP segment of a reassembled PDU]
 89   0.033940 172.31.29.138 -> 54.230.150.42 TCP 66 39599 > http [ACK] Seq=97 Ack=535391 Win=562432 Len=0 TSval=15006187 TSecr=1455834146
 90   0.034068 54.230.150.42 -> 172.31.29.138 TCP 15994 [TCP segment of a reassembled PDU]
 91   0.034078 172.31.29.138 -> 54.230.150.42 TCP 66 39599 > http [ACK] Seq=97 Ack=551319 Win=607872 Len=0 TSval=15006187 TSecr=1455834146
 92   0.034677 54.230.150.42 -> 172.31.29.138 TCP 7306 [TCP segment of a reassembled PDU]
 93   0.034684 172.31.29.138 -> 54.230.150.42 TCP 66 39599 > http [ACK] Seq=97 Ack=558559 Win=622336 Len=0 TSval=15006187 TSecr=1455834146
 94   0.034859 54.230.150.42 -> 172.31.29.138 TCP 27578 [TCP segment of a reassembled PDU]
 95   0.034873 172.31.29.138 -> 54.230.150.42 TCP 66 39599 > http [ACK] Seq=97 Ack=586071 Win=677376 Len=0 TSval=15006187 TSecr=1455834146
 96   0.034895 54.230.150.42 -> 172.31.29.138 TCP 8754 [TCP segment of a reassembled PDU]
 97   0.034901 172.31.29.138 -> 54.230.150.42 TCP 66 39599 > http [ACK] Seq=97 Ack=594759 Win=694784 Len=0 TSval=15006187 TSecr=1455834146
 98   0.035436 54.230.150.42 -> 172.31.29.138 TCP 2962 [TCP segment of a reassembled PDU]
 99   0.035442 172.31.29.138 -> 54.230.150.42 TCP 66 39599 > http [ACK] Seq=97 Ack=597655 Win=700544 Len=0 TSval=15006187 TSecr=1455834146
100   0.035612 54.230.150.42 -> 172.31.29.138 TCP 20338 [TCP segment of a reassembled PDU]
101   0.035624 172.31.29.138 -> 54.230.150.42 TCP 66 39599 > http [ACK] Seq=97 Ack=617927 Win=741120 Len=0 TSval=15006187 TSecr=1455834146
102   0.036229 54.230.150.42 -> 172.31.29.138 TCP 7306 [TCP segment of a reassembled PDU]
103   0.036237 172.31.29.138 -> 54.230.150.42 TCP 66 39599 > http [ACK] Seq=97 Ack=625167 Win=755584 Len=0 TSval=15006187 TSecr=1455834146
104   0.036406 54.230.150.42 -> 172.31.29.138 TCP 23234 [TCP segment of a reassembled PDU]
105   0.036419 172.31.29.138 -> 54.230.150.42 TCP 66 39599 > http [ACK] Seq=97 Ack=648335 Win=801920 Len=0 TSval=15006187 TSecr=1455834146
106   0.036430 54.230.150.42 -> 172.31.29.138 TCP 2962 [TCP segment of a reassembled PDU]
107   0.036433 172.31.29.138 -> 54.230.150.42 TCP 66 39599 > http [ACK] Seq=97 Ack=651231 Win=807680 Len=0 TSval=15006187 TSecr=1455834146
108   0.036479 54.230.150.42 -> 172.31.29.138 TCP 8754 [TCP segment of a reassembled PDU]
109   0.036486 172.31.29.138 -> 54.230.150.42 TCP 66 39599 > http [ACK] Seq=97 Ack=659919 Win=825088 Len=0 TSval=15006187 TSecr=1455834146
110   0.036892 54.230.150.42 -> 172.31.29.138 TCP 23234 [TCP segment of a reassembled PDU]
111   0.036903 172.31.29.138 -> 54.230.150.42 TCP 66 39599 > http [ACK] Seq=97 Ack=683087 Win=871424 Len=0 TSval=15006187 TSecr=1455834146
112   0.037800 54.230.150.42 -> 172.31.29.138 TCP 7306 [TCP segment of a reassembled PDU]
113   0.037807 172.31.29.138 -> 54.230.150.42 TCP 66 39599 > http [ACK] Seq=97 Ack=690327 Win=885888 Len=0 TSval=15006188 TSecr=1455834146
114   0.037969 54.230.150.42 -> 172.31.29.138 TCP 20338 [TCP segment of a reassembled PDU]
115   0.037981 172.31.29.138 -> 54.230.150.42 TCP 66 39599 > http [ACK] Seq=97 Ack=710599 Win=912768 Len=0 TSval=15006188 TSecr=1455834146
116   0.038000 54.230.150.42 -> 172.31.29.138 TCP 5858 [TCP segment of a reassembled PDU]
117   0.038011 172.31.29.138 -> 54.230.150.42 TCP 66 39599 > http [ACK] Seq=97 Ack=716391 Win=907008 Len=0 TSval=15006188 TSecr=1455834146
118   0.038055 54.230.150.42 -> 172.31.29.138 TCP 13098 [TCP segment of a reassembled PDU]
119   0.038065 172.31.29.138 -> 54.230.150.42 TCP 66 39599 > http [ACK] Seq=97 Ack=729423 Win=924672 Len=0 TSval=15006188 TSecr=1455834146
120   0.038082 54.230.150.42 -> 172.31.29.138 TCP 5858 [TCP segment of a reassembled PDU]
121   0.038094 172.31.29.138 -> 54.230.150.42 TCP 66 39599 > http [ACK] Seq=97 Ack=735215 Win=926464 Len=0 TSval=15006188 TSecr=1455834146
122   0.038210 54.230.150.42 -> 172.31.29.138 TCP 13098 [TCP segment of a reassembled PDU]
123   0.038315 172.31.29.138 -> 54.230.150.42 TCP 66 39599 > http [ACK] Seq=97 Ack=748247 Win=926464 Len=0 TSval=15006188 TSecr=1455834146
124   0.039103 54.230.150.42 -> 172.31.29.138 TCP 7306 [TCP segment of a reassembled PDU]
125   0.039110 172.31.29.138 -> 54.230.150.42 TCP 66 39599 > http [ACK] Seq=97 Ack=755487 Win=934144 Len=0 TSval=15006188 TSecr=1455834147
126   0.039271 54.230.150.42 -> 172.31.29.138 TCP 17442 [TCP segment of a reassembled PDU]
127   0.039297 54.230.150.42 -> 172.31.29.138 TCP 4410 [TCP segment of a reassembled PDU]
128   0.039305 172.31.29.138 -> 54.230.150.42 TCP 66 39599 > http [ACK] Seq=97 Ack=777207 Win=912512 Len=0 TSval=15006188 TSecr=1455834147
129   0.039333 54.230.150.42 -> 172.31.29.138 TCP 1514 [TCP segment of a reassembled PDU]
130   0.039338 172.31.29.138 -> 54.230.150.42 TCP 66 39599 > http [ACK] Seq=97 Ack=778655 Win=943616 Len=0 TSval=15006188 TSecr=1455834147
131   0.039490 54.230.150.42 -> 172.31.29.138 TCP 11650 [TCP segment of a reassembled PDU]
132   0.039499 54.230.150.42 -> 172.31.29.138 TCP 1514 [TCP Previous segment not captured] [TCP segment of a reassembled PDU]
133   0.039502 172.31.29.138 -> 54.230.150.42 TCP 78 39599 > http [ACK] Seq=97 Ack=790239 Win=932096 Len=0 TSval=15006188 TSecr=1455834147 SLE=791687 SRE=793135
134   0.039522 54.230.150.42 -> 172.31.29.138 TCP 1514 [TCP Out-Of-Order] [TCP segment of a reassembled PDU]
135   0.039529 172.31.29.138 -> 54.230.150.42 TCP 66 39599 > http [ACK] Seq=97 Ack=793135 Win=941184 Len=0 TSval=15006188 TSecr=1455834147
136   0.039615 54.230.150.42 -> 172.31.29.138 TCP 20338 [TCP segment of a reassembled PDU]
137   0.039627 172.31.29.138 -> 54.230.150.42 TCP 66 39599 > http [ACK] Seq=97 Ack=813407 Win=920960 Len=0 TSval=15006188 TSecr=1455834147
138   0.040402 54.230.150.42 -> 172.31.29.138 TCP 8754 [TCP segment of a reassembled PDU]
139   0.040410 172.31.29.138 -> 54.230.150.42 TCP 66 39599 > http [ACK] Seq=97 Ack=822095 Win=931840 Len=0 TSval=15006188 TSecr=1455834147
140   0.040552 54.230.150.42 -> 172.31.29.138 TCP 29026 [TCP segment of a reassembled PDU]
141   0.040567 172.31.29.138 -> 54.230.150.42 TCP 66 39599 > http [ACK] Seq=97 Ack=851055 Win=902912 Len=0 TSval=15006188 TSecr=1455834147
142   0.041148 54.230.150.42 -> 172.31.29.138 TCP 7306 [TCP segment of a reassembled PDU]
143   0.041162 172.31.29.138 -> 54.230.150.42 TCP 66 39599 > http [ACK] Seq=97 Ack=858295 Win=934144 Len=0 TSval=15006188 TSecr=1455834147
144   0.041303 54.230.150.42 -> 172.31.29.138 TCP 20338 [TCP segment of a reassembled PDU]
145   0.041314 172.31.29.138 -> 54.230.150.42 TCP 66 39599 > http [ACK] Seq=97 Ack=878567 Win=913920 Len=0 TSval=15006188 TSecr=1455834147
146   0.041943 54.230.150.42 -> 172.31.29.138 TCP 7306 [TCP segment of a reassembled PDU]
147   0.041954 172.31.29.138 -> 54.230.150.42 TCP 66 39599 > http [ACK] Seq=97 Ack=885807 Win=934144 Len=0 TSval=15006189 TSecr=1455834147
148   0.042062 54.230.150.42 -> 172.31.29.138 TCP 15994 [TCP segment of a reassembled PDU]
149   0.042074 172.31.29.138 -> 54.230.150.42 TCP 66 39599 > http [ACK] Seq=97 Ack=901735 Win=919808 Len=0 TSval=15006189 TSecr=1455834147
150   0.042082 54.230.150.42 -> 172.31.29.138 TCP 1514 [TCP Previous segment not captured] [TCP segment of a reassembled PDU]
151   0.042086 172.31.29.138 -> 54.230.150.42 TCP 78 [TCP Dup ACK 149#1] 39599 > http [ACK] Seq=97 Ack=901735 Win=919808 Len=0 TSval=15006189 TSecr=1455834147 SLE=903183 SRE=904631
152   0.042088 54.230.150.42 -> 172.31.29.138 TCP 1514 [TCP Out-Of-Order] [TCP segment of a reassembled PDU]
153   0.042091 172.31.29.138 -> 54.230.150.42 TCP 66 39599 > http [ACK] Seq=97 Ack=904631 Win=916992 Len=0 TSval=15006189 TSecr=1455834147
154   0.042202 54.230.150.42 -> 172.31.29.138 TCP 15994 [TCP segment of a reassembled PDU]
155   0.042213 172.31.29.138 -> 54.230.150.42 TCP 66 39599 > http [ACK] Seq=97 Ack=920559 Win=919808 Len=0 TSval=15006189 TSecr=1455834147
156   0.042705 54.230.150.42 -> 172.31.29.138 TCP 8754 [TCP segment of a reassembled PDU]
157   0.042712 172.31.29.138 -> 54.230.150.42 TCP 66 39599 > http [ACK] Seq=97 Ack=929247 Win=931840 Len=0 TSval=15006189 TSecr=1455834147
158   0.042845 54.230.150.42 -> 172.31.29.138 TCP 14546 [TCP segment of a reassembled PDU]
159   0.042854 172.31.29.138 -> 54.230.150.42 TCP 66 39599 > http [ACK] Seq=97 Ack=943727 Win=922240 Len=0 TSval=15006189 TSecr=1455834147
160   0.043453 54.230.150.42 -> 172.31.29.138 TCP 5858 [TCP segment of a reassembled PDU]
161   0.043460 172.31.29.138 -> 54.230.150.42 TCP 66 39599 > http [ACK] Seq=97 Ack=949519 Win=936576 Len=0 TSval=15006189 TSecr=1455834147
162   0.043635 54.230.150.42 -> 172.31.29.138 TCP 29026 [TCP segment of a reassembled PDU]
163   0.043650 172.31.29.138 -> 54.230.150.42 TCP 66 39599 > http [ACK] Seq=97 Ack=978479 Win=907648 Len=0 TSval=15006189 TSecr=1455834147
164   0.044231 54.230.150.42 -> 172.31.29.138 TCP 8754 [TCP segment of a reassembled PDU]
165   0.044239 172.31.29.138 -> 54.230.150.42 TCP 66 39599 > http [ACK] Seq=97 Ack=987167 Win=931840 Len=0 TSval=15006189 TSecr=1455834147
166   0.044385 54.230.150.42 -> 172.31.29.138 TCP 21786 [TCP segment of a reassembled PDU]
167   0.044397 172.31.29.138 -> 54.230.150.42 TCP 66 39599 > http [ACK] Seq=97 Ack=1008887 Win=910336 Len=0 TSval=15006189 TSecr=1455834147
168   0.045000 54.230.150.42 -> 172.31.29.138 TCP 4410 [TCP segment of a reassembled PDU]
169   0.045006 172.31.29.138 -> 54.230.150.42 TCP 66 39599 > http [ACK] Seq=97 Ack=1013231 Win=938880 Len=0 TSval=15006189 TSecr=1455834147
170   0.045191 54.230.150.42 -> 172.31.29.138 TCP 27578 [TCP segment of a reassembled PDU]
171   0.045205 172.31.29.138 -> 54.230.150.42 TCP 66 39599 > http [ACK] Seq=97 Ack=1040743 Win=911488 Len=0 TSval=15006189 TSecr=1455834147
172   0.045224 54.230.150.42 -> 172.31.29.138 HTTP 8357 HTTP/1.1 200 OK  (application/octet-stream)
173   0.045230 172.31.29.138 -> 54.230.150.42 TCP 66 39599 > http [ACK] Seq=97 Ack=1049034 Win=903296 Len=0 TSval=15006189 TSecr=1455834147
174   0.045366 172.31.29.138 -> 54.230.150.42 TCP 66 39599 > http [FIN, ACK] Seq=97 Ack=1049034 Win=943872 Len=0 TSval=15006189 TSecr=1455834147
175   0.047263 54.230.150.42 -> 172.31.29.138 TCP 66 http > 39599 [FIN, ACK] Seq=1049034 Ack=98 Win=14592 Len=0 TSval=1455834147 TSecr=15006189
176   0.047272 172.31.29.138 -> 54.230.150.42 TCP 66 39599 > http [ACK] Seq=98 Ack=1049035 Win=943872 Len=0 TSval=15006190 TSecr=1455834147
