[Measurement for 1mb at 03:35:52 20.35.2014] 
Tshark:

  1   0.000000 172.31.29.138 -> 172.31.0.2   DNS 89 Standard query 0x5af8  A d3796nkzln59xv.cloudfront.net
  2   0.000038 172.31.29.138 -> 172.31.0.2   DNS 89 Standard query 0x0cf3  AAAA d3796nkzln59xv.cloudfront.net
  3   0.000540   172.31.0.2 -> 172.31.29.138 DNS 217 Standard query response 0x5af8  A 54.192.157.144 A 54.192.157.146 A 54.192.157.157 A 54.192.159.165 A 54.230.158.197 A 54.230.158.205 A 54.230.159.122 A 54.192.156.109
  4   0.000550   172.31.0.2 -> 172.31.29.138 DNS 170 Standard query response 0x0cf3 
  5   0.003877 172.31.29.138 -> 54.192.157.144 TCP 74 46529 > http [SYN] Seq=0 Win=26883 Len=0 MSS=8961 SACK_PERM=1 TSval=9606348 TSecr=0 WS=128
  6   0.004545 54.192.157.144 -> 172.31.29.138 TCP 74 http > 46529 [SYN, ACK] Seq=0 Ack=1 Win=14480 Len=0 MSS=1460 SACK_PERM=1 TSval=832956752 TSecr=9606348 WS=128
  7   0.004559 172.31.29.138 -> 54.192.157.144 TCP 66 46529 > http [ACK] Seq=1 Ack=1 Win=27008 Len=0 TSval=9606349 TSecr=832956752
  8   0.004599 172.31.29.138 -> 54.192.157.144 HTTP 162 GET /1mb HTTP/1.1 
  9   0.005267 54.192.157.144 -> 172.31.29.138 TCP 66 http > 46529 [ACK] Seq=1 Ack=97 Win=14592 Len=0 TSval=832956752 TSecr=9606349
 10   0.008034 54.192.157.144 -> 172.31.29.138 TCP 523 [TCP segment of a reassembled PDU]
 11   0.008040 172.31.29.138 -> 54.192.157.144 TCP 66 46529 > http [ACK] Seq=97 Ack=458 Win=28032 Len=0 TSval=9606349 TSecr=832956752
 12   0.008107 54.192.157.144 -> 172.31.29.138 TCP 13098 [TCP segment of a reassembled PDU]
 13   0.008117 172.31.29.138 -> 54.192.157.144 TCP 66 46529 > http [ACK] Seq=97 Ack=13490 Win=54144 Len=0 TSval=9606350 TSecr=832956752
 14   0.008806 54.192.157.144 -> 172.31.29.138 TCP 1514 [TCP segment of a reassembled PDU]
 15   0.008812 172.31.29.138 -> 54.192.157.144 TCP 66 46529 > http [ACK] Seq=97 Ack=14938 Win=56960 Len=0 TSval=9606350 TSecr=832956752
 16   0.008859 54.192.157.144 -> 172.31.29.138 TCP 11650 [TCP segment of a reassembled PDU]
 17   0.008867 172.31.29.138 -> 54.192.157.144 TCP 66 46529 > http [ACK] Seq=97 Ack=26522 Win=80128 Len=0 TSval=9606350 TSecr=832956752
 18   0.009566 54.192.157.144 -> 172.31.29.138 TCP 4410 [TCP segment of a reassembled PDU]
 19   0.009572 172.31.29.138 -> 54.192.157.144 TCP 66 46529 > http [ACK] Seq=97 Ack=30866 Win=88832 Len=0 TSval=9606350 TSecr=832956752
 20   0.009644 54.192.157.144 -> 172.31.29.138 TCP 8754 [TCP segment of a reassembled PDU]
 21   0.009652 172.31.29.138 -> 54.192.157.144 TCP 66 46529 > http [ACK] Seq=97 Ack=39554 Win=103680 Len=0 TSval=9606350 TSecr=832956752
 22   0.009662 54.192.157.144 -> 172.31.29.138 TCP 7306 [TCP segment of a reassembled PDU]
 23   0.009667 172.31.29.138 -> 54.192.157.144 TCP 66 46529 > http [ACK] Seq=97 Ack=46794 Win=96512 Len=0 TSval=9606350 TSecr=832956752
 24   0.010088 54.192.157.144 -> 172.31.29.138 TCP 5858 [TCP segment of a reassembled PDU]
 25   0.010095 172.31.29.138 -> 54.192.157.144 TCP 66 46529 > http [ACK] Seq=97 Ack=52586 Win=108416 Len=0 TSval=9606350 TSecr=832956752
 26   0.010116 54.192.157.144 -> 172.31.29.138 TCP 1514 [TCP segment of a reassembled PDU]
 27   0.010119 172.31.29.138 -> 54.192.157.144 TCP 66 46529 > http [ACK] Seq=97 Ack=54034 Win=107008 Len=0 TSval=9606350 TSecr=832956752
 28   0.010332 54.192.157.144 -> 172.31.29.138 TCP 8754 [TCP segment of a reassembled PDU]
 29   0.010339 172.31.29.138 -> 54.192.157.144 TCP 66 46529 > http [ACK] Seq=97 Ack=62722 Win=103680 Len=0 TSval=9606350 TSecr=832956752
 30   0.010360 54.192.157.144 -> 172.31.29.138 TCP 2962 [TCP segment of a reassembled PDU]
 31   0.010364 172.31.29.138 -> 54.192.157.144 TCP 66 46529 > http [ACK] Seq=97 Ack=65618 Win=100864 Len=0 TSval=9606350 TSecr=832956752
 32   0.010656 54.192.157.144 -> 172.31.29.138 TCP 8754 [TCP segment of a reassembled PDU]
 33   0.010663 172.31.29.138 -> 54.192.157.144 TCP 66 46529 > http [ACK] Seq=97 Ack=74306 Win=103680 Len=0 TSval=9606350 TSecr=832956752
 34   0.010723 54.192.157.144 -> 172.31.29.138 TCP 4410 [TCP segment of a reassembled PDU]
 35   0.010729 172.31.29.138 -> 54.192.157.144 TCP 66 46529 > http [ACK] Seq=97 Ack=78650 Win=109056 Len=0 TSval=9606350 TSecr=832956752
 36   0.010859 54.192.157.144 -> 172.31.29.138 TCP 8754 [TCP segment of a reassembled PDU]
 37   0.010866 172.31.29.138 -> 54.192.157.144 TCP 66 46529 > http [ACK] Seq=97 Ack=87338 Win=103680 Len=0 TSval=9606350 TSecr=832956752
 38   0.010926 54.192.157.144 -> 172.31.29.138 TCP 4410 [TCP segment of a reassembled PDU]
 39   0.010932 172.31.29.138 -> 54.192.157.144 TCP 66 46529 > http [ACK] Seq=97 Ack=91682 Win=109056 Len=0 TSval=9606350 TSecr=832956752
 40   0.011210 54.192.157.144 -> 172.31.29.138 TCP 13098 [TCP segment of a reassembled PDU]
 41   0.011219 172.31.29.138 -> 54.192.157.144 TCP 66 46529 > http [ACK] Seq=97 Ack=104714 Win=96512 Len=0 TSval=9606350 TSecr=832956752
 42   0.011362 54.192.157.144 -> 172.31.29.138 TCP 2962 [TCP segment of a reassembled PDU]
 43   0.011367 172.31.29.138 -> 54.192.157.144 TCP 66 46529 > http [ACK] Seq=97 Ack=107610 Win=109056 Len=0 TSval=9606350 TSecr=832956752
 44   0.011469 54.192.157.144 -> 172.31.29.138 TCP 14546 [TCP segment of a reassembled PDU]
 45   0.011478 172.31.29.138 -> 54.192.157.144 TCP 66 46529 > http [ACK] Seq=97 Ack=122090 Win=94592 Len=0 TSval=9606350 TSecr=832956752
 46   0.011902 54.192.157.144 -> 172.31.29.138 TCP 8754 [TCP segment of a reassembled PDU]
 47   0.011911 172.31.29.138 -> 54.192.157.144 TCP 66 46529 > http [ACK] Seq=97 Ack=130778 Win=103680 Len=0 TSval=9606350 TSecr=832956752
 48   0.011957 54.192.157.144 -> 172.31.29.138 TCP 15994 [TCP segment of a reassembled PDU]
 49   0.011966 172.31.29.138 -> 54.192.157.144 TCP 66 46529 > http [ACK] Seq=97 Ack=146706 Win=87808 Len=0 TSval=9606350 TSecr=832956752
 50   0.012198 54.192.157.144 -> 172.31.29.138 TCP 10202 [TCP segment of a reassembled PDU]
 51   0.012205 172.31.29.138 -> 54.192.157.144 TCP 66 46529 > http [ACK] Seq=97 Ack=156842 Win=77696 Len=0 TSval=9606351 TSecr=832956752
 52   0.012615 54.192.157.144 -> 172.31.29.138 TCP 2962 [TCP segment of a reassembled PDU]
 53   0.012621 172.31.29.138 -> 54.192.157.144 TCP 66 46529 > http [ACK] Seq=97 Ack=159738 Win=114816 Len=0 TSval=9606351 TSecr=832956752
 54   0.012783 54.192.157.144 -> 172.31.29.138 TCP 23234 [TCP segment of a reassembled PDU]
 55   0.012807 172.31.29.138 -> 54.192.157.144 TCP 66 46529 > http [ACK] Seq=97 Ack=182906 Win=161152 Len=0 TSval=9606351 TSecr=832956752
 56   0.012821 54.192.157.144 -> 172.31.29.138 TCP 1514 [TCP segment of a reassembled PDU]
 57   0.012824 172.31.29.138 -> 54.192.157.144 TCP 66 46529 > http [ACK] Seq=97 Ack=184354 Win=164096 Len=0 TSval=9606351 TSecr=832956752
 58   0.012896 54.192.157.144 -> 172.31.29.138 TCP 17442 [TCP segment of a reassembled PDU]
 59   0.012906 172.31.29.138 -> 54.192.157.144 TCP 66 46529 > http [ACK] Seq=97 Ack=201730 Win=198784 Len=0 TSval=9606351 TSecr=832956752
 60   0.013410 54.192.157.144 -> 172.31.29.138 TCP 10202 [TCP segment of a reassembled PDU]
 61   0.013418 172.31.29.138 -> 54.192.157.144 TCP 66 46529 > http [ACK] Seq=97 Ack=211866 Win=219136 Len=0 TSval=9606351 TSecr=832956752
 62   0.013533 54.192.157.144 -> 172.31.29.138 TCP 15994 [TCP segment of a reassembled PDU]
 63   0.013543 172.31.29.138 -> 54.192.157.144 TCP 66 46529 > http [ACK] Seq=97 Ack=227794 Win=251008 Len=0 TSval=9606351 TSecr=832956752
 64   0.013780 54.192.157.144 -> 172.31.29.138 TCP 17442 [TCP segment of a reassembled PDU]
 65   0.013791 172.31.29.138 -> 54.192.157.144 TCP 66 46529 > http [ACK] Seq=97 Ack=245170 Win=285696 Len=0 TSval=9606351 TSecr=832956752
 66   0.013812 54.192.157.144 -> 172.31.29.138 TCP 7306 [TCP segment of a reassembled PDU]
 67   0.013817 172.31.29.138 -> 54.192.157.144 TCP 66 46529 > http [ACK] Seq=97 Ack=252410 Win=300160 Len=0 TSval=9606351 TSecr=832956752
 68   0.014164 54.192.157.144 -> 172.31.29.138 TCP 2962 [TCP segment of a reassembled PDU]
 69   0.014170 172.31.29.138 -> 54.192.157.144 TCP 66 46529 > http [ACK] Seq=97 Ack=255306 Win=306048 Len=0 TSval=9606351 TSecr=832956753
 70   0.014351 54.192.157.144 -> 172.31.29.138 TCP 26130 [TCP segment of a reassembled PDU]
 71   0.014374 172.31.29.138 -> 54.192.157.144 TCP 66 46529 > http [ACK] Seq=97 Ack=281370 Win=358144 Len=0 TSval=9606351 TSecr=832956753
 72   0.014398 54.192.157.144 -> 172.31.29.138 TCP 18890 [TCP segment of a reassembled PDU]
 73   0.014408 172.31.29.138 -> 54.192.157.144 TCP 66 46529 > http [ACK] Seq=97 Ack=300194 Win=395776 Len=0 TSval=9606351 TSecr=832956753
 74   0.014678 54.192.157.144 -> 172.31.29.138 TCP 8754 [TCP segment of a reassembled PDU]
 75   0.014686 172.31.29.138 -> 54.192.157.144 TCP 66 46529 > http [ACK] Seq=97 Ack=308882 Win=413184 Len=0 TSval=9606351 TSecr=832956753
 76   0.014775 54.192.157.144 -> 172.31.29.138 TCP 1514 [TCP segment of a reassembled PDU]
 77   0.014779 172.31.29.138 -> 54.192.157.144 TCP 66 46529 > http [ACK] Seq=97 Ack=310330 Win=416000 Len=0 TSval=9606351 TSecr=832956753
 78   0.015220 54.192.157.144 -> 172.31.29.138 TCP 8754 [TCP segment of a reassembled PDU]
 79   0.015226 172.31.29.138 -> 54.192.157.144 TCP 66 46529 > http [ACK] Seq=97 Ack=319018 Win=433408 Len=0 TSval=9606351 TSecr=832956753
 80   0.015340 54.192.157.144 -> 172.31.29.138 TCP 26130 [TCP segment of a reassembled PDU]
 81   0.015353 172.31.29.138 -> 54.192.157.144 TCP 66 46529 > http [ACK] Seq=97 Ack=345082 Win=485504 Len=0 TSval=9606351 TSecr=832956753
 82   0.015369 54.192.157.144 -> 172.31.29.138 TCP 15994 [TCP segment of a reassembled PDU]
 83   0.015380 172.31.29.138 -> 54.192.157.144 TCP 66 46529 > http [ACK] Seq=97 Ack=361010 Win=517376 Len=0 TSval=9606351 TSecr=832956753
 84   0.015701 54.192.157.144 -> 172.31.29.138 TCP 2962 [TCP segment of a reassembled PDU]
 85   0.015707 172.31.29.138 -> 54.192.157.144 TCP 66 46529 > http [ACK] Seq=97 Ack=363906 Win=523136 Len=0 TSval=9606351 TSecr=832956753
 86   0.015878 54.192.157.144 -> 172.31.29.138 TCP 20338 [TCP segment of a reassembled PDU]
 87   0.015889 172.31.29.138 -> 54.192.157.144 TCP 66 46529 > http [ACK] Seq=97 Ack=384178 Win=563712 Len=0 TSval=9606351 TSecr=832956753
 88   0.016037 54.192.157.144 -> 172.31.29.138 TCP 14546 [TCP segment of a reassembled PDU]
 89   0.016045 172.31.29.138 -> 54.192.157.144 TCP 66 46529 > http [ACK] Seq=97 Ack=398658 Win=592640 Len=0 TSval=9606351 TSecr=832956753
 90   0.016151 54.192.157.144 -> 172.31.29.138 TCP 15994 [TCP segment of a reassembled PDU]
 91   0.016161 172.31.29.138 -> 54.192.157.144 TCP 66 46529 > http [ACK] Seq=97 Ack=414586 Win=624512 Len=0 TSval=9606352 TSecr=832956753
 92   0.016721 54.192.157.144 -> 172.31.29.138 TCP 2962 [TCP segment of a reassembled PDU]
 93   0.016726 172.31.29.138 -> 54.192.157.144 TCP 66 46529 > http [ACK] Seq=97 Ack=417482 Win=630400 Len=0 TSval=9606352 TSecr=832956753
 94   0.016900 54.192.157.144 -> 172.31.29.138 TCP 26130 [TCP segment of a reassembled PDU]
 95   0.016914 172.31.29.138 -> 54.192.157.144 TCP 66 46529 > http [ACK] Seq=97 Ack=443546 Win=682496 Len=0 TSval=9606352 TSecr=832956753
 96   0.016944 54.192.157.144 -> 172.31.29.138 TCP 24682 [TCP segment of a reassembled PDU]
 97   0.016959 172.31.29.138 -> 54.192.157.144 TCP 66 46529 > http [ACK] Seq=97 Ack=468162 Win=731648 Len=0 TSval=9606352 TSecr=832956753
 98   0.017538 54.192.157.144 -> 172.31.29.138 TCP 4410 [TCP segment of a reassembled PDU]
 99   0.017544 172.31.29.138 -> 54.192.157.144 TCP 66 46529 > http [ACK] Seq=97 Ack=472506 Win=740352 Len=0 TSval=9606352 TSecr=832956753
100   0.017721 54.192.157.144 -> 172.31.29.138 TCP 26130 [TCP segment of a reassembled PDU]
101   0.017735 172.31.29.138 -> 54.192.157.144 TCP 66 46529 > http [ACK] Seq=97 Ack=498570 Win=792576 Len=0 TSval=9606352 TSecr=832956753
102   0.017774 54.192.157.144 -> 172.31.29.138 TCP 23234 [TCP segment of a reassembled PDU]
103   0.017798 172.31.29.138 -> 54.192.157.144 TCP 66 46529 > http [ACK] Seq=97 Ack=521738 Win=838912 Len=0 TSval=9606352 TSecr=832956753
104   0.018029 54.192.157.144 -> 172.31.29.138 TCP 2962 [TCP segment of a reassembled PDU]
105   0.018035 172.31.29.138 -> 54.192.157.144 TCP 66 46529 > http [ACK] Seq=97 Ack=524634 Win=844672 Len=0 TSval=9606352 TSecr=832956753
106   0.018213 54.192.157.144 -> 172.31.29.138 TCP 27578 [TCP segment of a reassembled PDU]
107   0.018240 172.31.29.138 -> 54.192.157.144 TCP 66 46529 > http [ACK] Seq=97 Ack=552146 Win=899712 Len=0 TSval=9606352 TSecr=832956753
108   0.018464 54.192.157.144 -> 172.31.29.138 TCP 26130 [TCP segment of a reassembled PDU]
109   0.018477 172.31.29.138 -> 54.192.157.144 TCP 66 46529 > http [ACK] Seq=97 Ack=578210 Win=951808 Len=0 TSval=9606352 TSecr=832956753
110   0.018486 54.192.157.144 -> 172.31.29.138 TCP 5858 [TCP segment of a reassembled PDU]
111   0.018490 172.31.29.138 -> 54.192.157.144 TCP 66 46529 > http [ACK] Seq=97 Ack=584002 Win=963328 Len=0 TSval=9606352 TSecr=832956753
112   0.018513 54.192.157.144 -> 172.31.29.138 TCP 20338 [TCP segment of a reassembled PDU]
113   0.018523 172.31.29.138 -> 54.192.157.144 TCP 66 46529 > http [ACK] Seq=97 Ack=604274 Win=1003904 Len=0 TSval=9606352 TSecr=832956753
114   0.018922 54.192.157.144 -> 172.31.29.138 TCP 26130 [TCP segment of a reassembled PDU]
115   0.018936 172.31.29.138 -> 54.192.157.144 TCP 66 46529 > http [ACK] Seq=97 Ack=630338 Win=1056000 Len=0 TSval=9606352 TSecr=832956753
116   0.018945 54.192.157.144 -> 172.31.29.138 TCP 7306 [TCP segment of a reassembled PDU]
117   0.018950 172.31.29.138 -> 54.192.157.144 TCP 66 46529 > http [ACK] Seq=97 Ack=637578 Win=1070592 Len=0 TSval=9606352 TSecr=832956753
118   0.019114 54.192.157.144 -> 172.31.29.138 TCP 11650 [TCP segment of a reassembled PDU]
119   0.019122 172.31.29.138 -> 54.192.157.144 TCP 66 46529 > http [ACK] Seq=97 Ack=649162 Win=1093760 Len=0 TSval=9606352 TSecr=832956753
120   0.019273 54.192.157.144 -> 172.31.29.138 TCP 23234 [TCP segment of a reassembled PDU]
121   0.019285 172.31.29.138 -> 54.192.157.144 TCP 66 46529 > http [ACK] Seq=97 Ack=672330 Win=1140096 Len=0 TSval=9606352 TSecr=832956753
122   0.019637 54.192.157.144 -> 172.31.29.138 TCP 20338 [TCP segment of a reassembled PDU]
123   0.019648 172.31.29.138 -> 54.192.157.144 TCP 66 46529 > http [ACK] Seq=97 Ack=692602 Win=1180544 Len=0 TSval=9606352 TSecr=832956753
124   0.019770 54.192.157.144 -> 172.31.29.138 TCP 26130 [TCP segment of a reassembled PDU]
125   0.019783 172.31.29.138 -> 54.192.157.144 TCP 66 46529 > http [ACK] Seq=97 Ack=718666 Win=1232768 Len=0 TSval=9606352 TSecr=832956753
126   0.019791 54.192.157.144 -> 172.31.29.138 TCP 2962 [TCP segment of a reassembled PDU]
127   0.019794 172.31.29.138 -> 54.192.157.144 TCP 66 46529 > http [ACK] Seq=97 Ack=721562 Win=1238528 Len=0 TSval=9606352 TSecr=832956753
128   0.019808 54.192.157.144 -> 172.31.29.138 TCP 21786 [TCP segment of a reassembled PDU]
129   0.019817 172.31.29.138 -> 54.192.157.144 TCP 66 46529 > http [ACK] Seq=97 Ack=743282 Win=1277184 Len=0 TSval=9606352 TSecr=832956753
130   0.020085 54.192.157.144 -> 172.31.29.138 TCP 2962 [TCP segment of a reassembled PDU]
131   0.020091 172.31.29.138 -> 54.192.157.144 TCP 66 46529 > http [ACK] Seq=97 Ack=746178 Win=1287680 Len=0 TSval=9606353 TSecr=832956753
132   0.020265 54.192.157.144 -> 172.31.29.138 TCP 24682 [TCP segment of a reassembled PDU]
133   0.020277 172.31.29.138 -> 54.192.157.144 TCP 66 46529 > http [ACK] Seq=97 Ack=770794 Win=1320192 Len=0 TSval=9606353 TSecr=832956753
134   0.020352 54.192.157.144 -> 172.31.29.138 TCP 11650 [TCP segment of a reassembled PDU]
135   0.020360 172.31.29.138 -> 54.192.157.144 TCP 66 46529 > http [ACK] Seq=97 Ack=782378 Win=1341568 Len=0 TSval=9606353 TSecr=832956753
136   0.020519 54.192.157.144 -> 172.31.29.138 TCP 23234 [TCP segment of a reassembled PDU]
137   0.020541 54.192.157.144 -> 172.31.29.138 TCP 2962 [TCP segment of a reassembled PDU]
138   0.020549 172.31.29.138 -> 54.192.157.144 TCP 66 46529 > http [ACK] Seq=97 Ack=808442 Win=1317632 Len=0 TSval=9606353 TSecr=832956753
139   0.020624 54.192.157.144 -> 172.31.29.138 TCP 27578 [TCP segment of a reassembled PDU]
140   0.020650 172.31.29.138 -> 54.192.157.144 TCP 66 46529 > http [ACK] Seq=97 Ack=835954 Win=1315328 Len=0 TSval=9606353 TSecr=832956753
141   0.021035 54.192.157.144 -> 172.31.29.138 TCP 26130 [TCP segment of a reassembled PDU]
142   0.021049 172.31.29.138 -> 54.192.157.144 TCP 66 46529 > http [ACK] Seq=97 Ack=862018 Win=1317760 Len=0 TSval=9606353 TSecr=832956753
143   0.021063 54.192.157.144 -> 172.31.29.138 TCP 7306 [TCP segment of a reassembled PDU]
144   0.021071 54.192.157.144 -> 172.31.29.138 TCP 5858 [TCP segment of a reassembled PDU]
145   0.021089 172.31.29.138 -> 54.192.157.144 TCP 66 46529 > http [ACK] Seq=97 Ack=875050 Win=1304832 Len=0 TSval=9606353 TSecr=832956753
146   0.021452 54.192.157.144 -> 172.31.29.138 TCP 26130 [TCP segment of a reassembled PDU]
147   0.021463 172.31.29.138 -> 54.192.157.144 TCP 66 46529 > http [ACK] Seq=97 Ack=901114 Win=1317760 Len=0 TSval=9606353 TSecr=832956753
148   0.021500 54.192.157.144 -> 172.31.29.138 TCP 23234 [TCP segment of a reassembled PDU]
149   0.021518 172.31.29.138 -> 54.192.157.144 TCP 66 46529 > http [ACK] Seq=97 Ack=924282 Win=1294592 Len=0 TSval=9606353 TSecr=832956753
150   0.021524 54.192.157.144 -> 172.31.29.138 TCP 2962 [TCP segment of a reassembled PDU]
151   0.021537 172.31.29.138 -> 54.192.157.144 TCP 66 46529 > http [ACK] Seq=97 Ack=927178 Win=1317632 Len=0 TSval=9606353 TSecr=832956753
152   0.021580 54.192.157.144 -> 172.31.29.138 TCP 17442 [TCP segment of a reassembled PDU]
153   0.021590 172.31.29.138 -> 54.192.157.144 TCP 66 46529 > http [ACK] Seq=97 Ack=944554 Win=1331968 Len=0 TSval=9606353 TSecr=832956753
154   0.021724 54.192.157.144 -> 172.31.29.138 TCP 21786 [TCP segment of a reassembled PDU]
155   0.021789 172.31.29.138 -> 54.192.157.144 TCP 66 46529 > http [ACK] Seq=97 Ack=966274 Win=1324928 Len=0 TSval=9606353 TSecr=832956753
156   0.021981 54.192.157.144 -> 172.31.29.138 TCP 20338 [TCP segment of a reassembled PDU]
157   0.021993 172.31.29.138 -> 54.192.157.144 TCP 66 46529 > http [ACK] Seq=97 Ack=986546 Win=1327232 Len=0 TSval=9606353 TSecr=832956753
158   0.022107 54.192.157.144 -> 172.31.29.138 TCP 27578 [TCP segment of a reassembled PDU]
159   0.022133 172.31.29.138 -> 54.192.157.144 TCP 66 46529 > http [ACK] Seq=97 Ack=1014058 Win=1315328 Len=0 TSval=9606353 TSecr=832956753
160   0.022448 54.192.157.144 -> 172.31.29.138 TCP 15994 [TCP segment of a reassembled PDU]
161   0.022458 172.31.29.138 -> 54.192.157.144 TCP 66 46529 > http [ACK] Seq=97 Ack=1029986 Win=1334400 Len=0 TSval=9606353 TSecr=832956753
162   0.022600 54.192.157.144 -> 172.31.29.138 TCP 18890 [TCP segment of a reassembled PDU]
163   0.022619 54.192.157.144 -> 172.31.29.138 HTTP 290 HTTP/1.1 200 OK  (application/octet-stream)
164   0.022629 172.31.29.138 -> 54.192.157.144 TCP 66 46529 > http [ACK] Seq=97 Ack=1049034 Win=1327104 Len=0 TSval=9606353 TSecr=832956753
165   0.022753 172.31.29.138 -> 54.192.157.144 TCP 66 46529 > http [FIN, ACK] Seq=97 Ack=1049034 Win=1357952 Len=0 TSval=9606353 TSecr=832956753
166   0.023384 54.192.157.144 -> 172.31.29.138 TCP 66 http > 46529 [FIN, ACK] Seq=1049034 Ack=98 Win=14592 Len=0 TSval=832956753 TSecr=9606353
167   0.023393 172.31.29.138 -> 54.192.157.144 TCP 66 46529 > http [ACK] Seq=98 Ack=1049035 Win=1357952 Len=0 TSval=9606353 TSecr=832956753
