[Measurement for 1mb at 00:35:51 20.35.2014] 
Tshark:

  1   0.000000 172.31.29.138 -> 172.31.0.2   DNS 89 Standard query 0x0f1b  A d3796nkzln59xv.cloudfront.net
  2   0.000066 172.31.29.138 -> 172.31.0.2   DNS 89 Standard query 0x263e  AAAA d3796nkzln59xv.cloudfront.net
  3   0.000629   172.31.0.2 -> 172.31.29.138 DNS 217 Standard query response 0x0f1b  A 54.230.156.193 A 54.230.158.139 A 54.230.158.223 A 54.230.159.150 A 54.230.159.153 A 54.192.157.144 A 54.192.157.146 A 54.192.159.173
  4   0.000639   172.31.0.2 -> 172.31.29.138 DNS 170 Standard query response 0x263e 
  5   0.003878 172.31.29.138 -> 54.230.156.193 TCP 74 38974 > http [SYN] Seq=0 Win=26883 Len=0 MSS=8961 SACK_PERM=1 TSval=6906153 TSecr=0 WS=128
  6   0.004461 54.230.156.193 -> 172.31.29.138 TCP 74 http > 38974 [SYN, ACK] Seq=0 Ack=1 Win=14480 Len=0 MSS=1460 SACK_PERM=1 TSval=729013167 TSecr=6906153 WS=128
  7   0.004476 172.31.29.138 -> 54.230.156.193 TCP 66 38974 > http [ACK] Seq=1 Ack=1 Win=27008 Len=0 TSval=6906154 TSecr=729013167
  8   0.004516 172.31.29.138 -> 54.230.156.193 HTTP 162 GET /1mb HTTP/1.1 
  9   0.004949 54.230.156.193 -> 172.31.29.138 TCP 66 http > 38974 [ACK] Seq=1 Ack=97 Win=14592 Len=0 TSval=729013167 TSecr=6906154
 10   0.007589 54.230.156.193 -> 172.31.29.138 TCP 13098 [TCP segment of a reassembled PDU]
 11   0.007601 172.31.29.138 -> 54.230.156.193 TCP 66 38974 > http [ACK] Seq=97 Ack=13033 Win=52992 Len=0 TSval=6906154 TSecr=729013168
 12   0.008340 54.230.156.193 -> 172.31.29.138 TCP 7306 [TCP segment of a reassembled PDU]
 13   0.008348 172.31.29.138 -> 54.230.156.193 TCP 66 38974 > http [ACK] Seq=97 Ack=20273 Win=67456 Len=0 TSval=6906155 TSecr=729013168
 14   0.008372 54.230.156.193 -> 172.31.29.138 TCP 5858 [TCP segment of a reassembled PDU]
 15   0.008378 172.31.29.138 -> 54.230.156.193 TCP 66 38974 > http [ACK] Seq=97 Ack=26065 Win=79104 Len=0 TSval=6906155 TSecr=729013168
 16   0.008797 54.230.156.193 -> 172.31.29.138 TCP 1514 [TCP segment of a reassembled PDU]
 17   0.008806 172.31.29.138 -> 54.230.156.193 TCP 66 38974 > http [ACK] Seq=97 Ack=27513 Win=81920 Len=0 TSval=6906155 TSecr=729013168
 18   0.008848 54.230.156.193 -> 172.31.29.138 TCP 10202 [TCP segment of a reassembled PDU]
 19   0.008857 172.31.29.138 -> 54.230.156.193 TCP 66 38974 > http [ACK] Seq=97 Ack=37649 Win=101248 Len=0 TSval=6906155 TSecr=729013168
 20   0.009006 54.230.156.193 -> 172.31.29.138 TCP 1514 [TCP segment of a reassembled PDU]
 21   0.009012 172.31.29.138 -> 54.230.156.193 TCP 66 38974 > http [ACK] Seq=97 Ack=39097 Win=105088 Len=0 TSval=6906155 TSecr=729013168
 22   0.009288 54.230.156.193 -> 172.31.29.138 TCP 2962 [TCP segment of a reassembled PDU]
 23   0.009294 172.31.29.138 -> 54.230.156.193 TCP 66 38974 > http [ACK] Seq=97 Ack=41993 Win=109056 Len=0 TSval=6906155 TSecr=729013168
 24   0.009378 54.230.156.193 -> 172.31.29.138 TCP 8754 [TCP segment of a reassembled PDU]
 25   0.009386 172.31.29.138 -> 54.230.156.193 TCP 66 38974 > http [ACK] Seq=97 Ack=50681 Win=103680 Len=0 TSval=6906155 TSecr=729013168
 26   0.009395 54.230.156.193 -> 172.31.29.138 TCP 4410 [TCP segment of a reassembled PDU]
 27   0.009399 172.31.29.138 -> 54.230.156.193 TCP 66 38974 > http [ACK] Seq=97 Ack=55025 Win=99456 Len=0 TSval=6906155 TSecr=729013168
 28   0.009405 54.230.156.193 -> 172.31.29.138 TCP 4410 [TCP segment of a reassembled PDU]
 29   0.009409 172.31.29.138 -> 54.230.156.193 TCP 66 38974 > http [ACK] Seq=97 Ack=59369 Win=95232 Len=0 TSval=6906155 TSecr=729013168
 30   0.009823 54.230.156.193 -> 172.31.29.138 TCP 5858 [TCP segment of a reassembled PDU]
 31   0.009842 172.31.29.138 -> 54.230.156.193 TCP 66 38974 > http [ACK] Seq=97 Ack=65161 Win=108416 Len=0 TSval=6906155 TSecr=729013168
 32   0.009896 54.230.156.193 -> 172.31.29.138 TCP 11650 [TCP segment of a reassembled PDU]
 33   0.009904 172.31.29.138 -> 54.230.156.193 TCP 66 38974 > http [ACK] Seq=97 Ack=76745 Win=98944 Len=0 TSval=6906155 TSecr=729013168
 34   0.010040 54.230.156.193 -> 172.31.29.138 TCP 1514 [TCP segment of a reassembled PDU]
 35   0.010045 172.31.29.138 -> 54.230.156.193 TCP 66 38974 > http [ACK] Seq=97 Ack=78193 Win=109056 Len=0 TSval=6906155 TSecr=729013168
 36   0.010119 54.230.156.193 -> 172.31.29.138 TCP 10202 [TCP segment of a reassembled PDU]
 37   0.010139 172.31.29.138 -> 54.230.156.193 TCP 66 38974 > http [ACK] Seq=97 Ack=88329 Win=101248 Len=0 TSval=6906155 TSecr=729013168
 38   0.010333 54.230.156.193 -> 172.31.29.138 TCP 1514 [TCP segment of a reassembled PDU]
 39   0.010337 172.31.29.138 -> 54.230.156.193 TCP 66 38974 > http [ACK] Seq=97 Ack=89777 Win=109056 Len=0 TSval=6906155 TSecr=729013168
 40   0.010476 54.230.156.193 -> 172.31.29.138 TCP 14546 [TCP segment of a reassembled PDU]
 41   0.010510 172.31.29.138 -> 54.230.156.193 TCP 66 38974 > http [ACK] Seq=97 Ack=104257 Win=109056 Len=0 TSval=6906155 TSecr=729013168
 42   0.010583 54.230.156.193 -> 172.31.29.138 TCP 2962 [TCP segment of a reassembled PDU]
 43   0.010589 172.31.29.138 -> 54.230.156.193 TCP 66 38974 > http [ACK] Seq=97 Ack=107153 Win=109056 Len=0 TSval=6906155 TSecr=729013168
 44   0.010723 54.230.156.193 -> 172.31.29.138 TCP 15994 [TCP segment of a reassembled PDU]
 45   0.010747 172.31.29.138 -> 54.230.156.193 TCP 66 38974 > http [ACK] Seq=97 Ack=123081 Win=109056 Len=0 TSval=6906155 TSecr=729013168
 46   0.011159 54.230.156.193 -> 172.31.29.138 TCP 2962 [TCP segment of a reassembled PDU]
 47   0.011168 172.31.29.138 -> 54.230.156.193 TCP 66 38974 > http [ACK] Seq=97 Ack=125977 Win=109056 Len=0 TSval=6906155 TSecr=729013168
 48   0.011189 54.230.156.193 -> 172.31.29.138 TCP 4410 [TCP segment of a reassembled PDU]
 49   0.011247 54.230.156.193 -> 172.31.29.138 TCP 15994 [TCP segment of a reassembled PDU]
 50   0.011388 54.230.156.193 -> 172.31.29.138 TCP 10202 [TCP segment of a reassembled PDU]
 51   0.011509 172.31.29.138 -> 54.230.156.193 TCP 66 38974 > http [ACK] Seq=97 Ack=156385 Win=78720 Len=0 TSval=6906155 TSecr=729013168
 52   0.012112 54.230.156.193 -> 172.31.29.138 TCP 1514 [TCP segment of a reassembled PDU]
 53   0.012283 54.230.156.193 -> 172.31.29.138 TCP 24682 [TCP segment of a reassembled PDU]
 54   0.012296 172.31.29.138 -> 54.230.156.193 TCP 66 38974 > http [ACK] Seq=97 Ack=182449 Win=158336 Len=0 TSval=6906156 TSecr=729013168
 55   0.012313 54.230.156.193 -> 172.31.29.138 TCP 2962 [TCP segment of a reassembled PDU]
 56   0.012319 172.31.29.138 -> 54.230.156.193 TCP 66 38974 > http [ACK] Seq=97 Ack=185345 Win=164096 Len=0 TSval=6906156 TSecr=729013168
 57   0.012379 54.230.156.193 -> 172.31.29.138 TCP 14546 [TCP segment of a reassembled PDU]
 58   0.012390 172.31.29.138 -> 54.230.156.193 TCP 66 38974 > http [ACK] Seq=97 Ack=199825 Win=193024 Len=0 TSval=6906156 TSecr=729013168
 59   0.012850 54.230.156.193 -> 172.31.29.138 TCP 5858 [TCP segment of a reassembled PDU]
 60   0.012857 172.31.29.138 -> 54.230.156.193 TCP 66 38974 > http [ACK] Seq=97 Ack=205617 Win=204672 Len=0 TSval=6906156 TSecr=729013168
 61   0.013019 54.230.156.193 -> 172.31.29.138 TCP 26130 [TCP segment of a reassembled PDU]
 62   0.013032 172.31.29.138 -> 54.230.156.193 TCP 66 38974 > http [ACK] Seq=97 Ack=231681 Win=256768 Len=0 TSval=6906156 TSecr=729013168
 63   0.013050 54.230.156.193 -> 172.31.29.138 TCP 15994 [TCP segment of a reassembled PDU]
 64   0.013062 172.31.29.138 -> 54.230.156.193 TCP 66 38974 > http [ACK] Seq=97 Ack=247609 Win=288640 Len=0 TSval=6906156 TSecr=729013168
 65   0.013688 54.230.156.193 -> 172.31.29.138 TCP 11650 [TCP segment of a reassembled PDU]
 66   0.013697 172.31.29.138 -> 54.230.156.193 TCP 66 38974 > http [ACK] Seq=97 Ack=259193 Win=311808 Len=0 TSval=6906156 TSecr=729013168
 67   0.013845 54.230.156.193 -> 172.31.29.138 TCP 26130 [TCP segment of a reassembled PDU]
 68   0.013858 172.31.29.138 -> 54.230.156.193 TCP 66 38974 > http [ACK] Seq=97 Ack=285257 Win=363904 Len=0 TSval=6906156 TSecr=729013168
 69   0.013877 54.230.156.193 -> 172.31.29.138 TCP 14546 [TCP segment of a reassembled PDU]
 70   0.013884 172.31.29.138 -> 54.230.156.193 TCP 66 38974 > http [ACK] Seq=97 Ack=299737 Win=392832 Len=0 TSval=6906156 TSecr=729013168
 71   0.014415 54.230.156.193 -> 172.31.29.138 TCP 2962 [TCP segment of a reassembled PDU]
 72   0.014422 172.31.29.138 -> 54.230.156.193 TCP 66 38974 > http [ACK] Seq=97 Ack=302633 Win=398720 Len=0 TSval=6906156 TSecr=729013168
 73   0.014589 54.230.156.193 -> 172.31.29.138 TCP 26130 [TCP segment of a reassembled PDU]
 74   0.014603 172.31.29.138 -> 54.230.156.193 TCP 66 38974 > http [ACK] Seq=97 Ack=328697 Win=450816 Len=0 TSval=6906156 TSecr=729013168
 75   0.014618 54.230.156.193 -> 172.31.29.138 TCP 11650 [TCP segment of a reassembled PDU]
 76   0.014628 172.31.29.138 -> 54.230.156.193 TCP 66 38974 > http [ACK] Seq=97 Ack=340281 Win=473984 Len=0 TSval=6906156 TSecr=729013168
 77   0.014950 54.230.156.193 -> 172.31.29.138 TCP 5858 [TCP segment of a reassembled PDU]
 78   0.014956 172.31.29.138 -> 54.230.156.193 TCP 66 38974 > http [ACK] Seq=97 Ack=346073 Win=485504 Len=0 TSval=6906156 TSecr=729013168
 79   0.015092 54.230.156.193 -> 172.31.29.138 TCP 14546 [TCP segment of a reassembled PDU]
 80   0.015102 172.31.29.138 -> 54.230.156.193 TCP 66 38974 > http [ACK] Seq=97 Ack=360553 Win=514560 Len=0 TSval=6906156 TSecr=729013168
 81   0.015192 54.230.156.193 -> 172.31.29.138 TCP 8754 [TCP segment of a reassembled PDU]
 82   0.015199 172.31.29.138 -> 54.230.156.193 TCP 66 38974 > http [ACK] Seq=97 Ack=369241 Win=531840 Len=0 TSval=6906156 TSecr=729013168
 83   0.015232 54.230.156.193 -> 172.31.29.138 TCP 11650 [TCP segment of a reassembled PDU]
 84   0.015240 172.31.29.138 -> 54.230.156.193 TCP 66 38974 > http [ACK] Seq=97 Ack=380825 Win=555008 Len=0 TSval=6906156 TSecr=729013168
 85   0.015361 54.230.156.193 -> 172.31.29.138 TCP 20338 [TCP segment of a reassembled PDU]
 86   0.015372 172.31.29.138 -> 54.230.156.193 TCP 66 38974 > http [ACK] Seq=97 Ack=401097 Win=595584 Len=0 TSval=6906156 TSecr=729013168
 87   0.015685 54.230.156.193 -> 172.31.29.138 TCP 7306 [TCP segment of a reassembled PDU]
 88   0.015693 172.31.29.138 -> 54.230.156.193 TCP 66 38974 > http [ACK] Seq=97 Ack=408337 Win=610048 Len=0 TSval=6906156 TSecr=729013168
 89   0.015863 54.230.156.193 -> 172.31.29.138 TCP 26130 [TCP segment of a reassembled PDU]
 90   0.015877 172.31.29.138 -> 54.230.156.193 TCP 66 38974 > http [ACK] Seq=97 Ack=434401 Win=662144 Len=0 TSval=6906156 TSecr=729013168
 91   0.015892 54.230.156.193 -> 172.31.29.138 TCP 13098 [TCP segment of a reassembled PDU]
 92   0.015902 172.31.29.138 -> 54.230.156.193 TCP 66 38974 > http [ACK] Seq=97 Ack=447433 Win=688256 Len=0 TSval=6906156 TSecr=729013168
 93   0.016172 54.230.156.193 -> 172.31.29.138 TCP 1514 [TCP segment of a reassembled PDU]
 94   0.016177 172.31.29.138 -> 54.230.156.193 TCP 66 38974 > http [ACK] Seq=97 Ack=448881 Win=691200 Len=0 TSval=6906157 TSecr=729013168
 95   0.016377 54.230.156.193 -> 172.31.29.138 TCP 27578 [TCP segment of a reassembled PDU]
 96   0.016389 172.31.29.138 -> 54.230.156.193 TCP 66 38974 > http [ACK] Seq=97 Ack=476393 Win=746240 Len=0 TSval=6906157 TSecr=729013168
 97   0.016469 54.230.156.193 -> 172.31.29.138 TCP 14546 [TCP segment of a reassembled PDU]
 98   0.016478 172.31.29.138 -> 54.230.156.193 TCP 66 38974 > http [ACK] Seq=97 Ack=490873 Win=775168 Len=0 TSval=6906157 TSecr=729013169
 99   0.016578 54.230.156.193 -> 172.31.29.138 TCP 14546 [TCP segment of a reassembled PDU]
100   0.016588 172.31.29.138 -> 54.230.156.193 TCP 66 38974 > http [ACK] Seq=97 Ack=505353 Win=804096 Len=0 TSval=6906157 TSecr=729013169
101   0.017032 54.230.156.193 -> 172.31.29.138 TCP 7306 [TCP segment of a reassembled PDU]
102   0.017040 172.31.29.138 -> 54.230.156.193 TCP 66 38974 > http [ACK] Seq=97 Ack=512593 Win=818560 Len=0 TSval=6906157 TSecr=729013169
103   0.017209 54.230.156.193 -> 172.31.29.138 TCP 26130 [TCP segment of a reassembled PDU]
104   0.017223 172.31.29.138 -> 54.230.156.193 TCP 66 38974 > http [ACK] Seq=97 Ack=538657 Win=870656 Len=0 TSval=6906157 TSecr=729013169
105   0.017272 54.230.156.193 -> 172.31.29.138 TCP 26130 [TCP segment of a reassembled PDU]
106   0.017285 172.31.29.138 -> 54.230.156.193 TCP 66 38974 > http [ACK] Seq=97 Ack=564721 Win=922880 Len=0 TSval=6906157 TSecr=729013169
107   0.017292 54.230.156.193 -> 172.31.29.138 TCP 2962 [TCP segment of a reassembled PDU]
108   0.017296 172.31.29.138 -> 54.230.156.193 TCP 66 38974 > http [ACK] Seq=97 Ack=567617 Win=928640 Len=0 TSval=6906157 TSecr=729013169
109   0.017808 54.230.156.193 -> 172.31.29.138 TCP 8754 [TCP segment of a reassembled PDU]
110   0.017816 172.31.29.138 -> 54.230.156.193 TCP 66 38974 > http [ACK] Seq=97 Ack=576305 Win=946048 Len=0 TSval=6906157 TSecr=729013169
111   0.017963 54.230.156.193 -> 172.31.29.138 TCP 26130 [TCP segment of a reassembled PDU]
112   0.017977 172.31.29.138 -> 54.230.156.193 TCP 66 38974 > http [ACK] Seq=97 Ack=602369 Win=998144 Len=0 TSval=6906157 TSecr=729013169
113   0.018021 54.230.156.193 -> 172.31.29.138 TCP 24682 [TCP segment of a reassembled PDU]
114   0.018037 172.31.29.138 -> 54.230.156.193 TCP 66 38974 > http [ACK] Seq=97 Ack=626985 Win=1047424 Len=0 TSval=6906157 TSecr=729013169
115   0.018042 54.230.156.193 -> 172.31.29.138 TCP 1514 [TCP segment of a reassembled PDU]
116   0.018044 172.31.29.138 -> 54.230.156.193 TCP 66 38974 > http [ACK] Seq=97 Ack=628433 Win=1050240 Len=0 TSval=6906157 TSecr=729013169
117   0.018168 54.230.156.193 -> 172.31.29.138 TCP 18890 [TCP segment of a reassembled PDU]
118   0.018178 172.31.29.138 -> 54.230.156.193 TCP 66 38974 > http [ACK] Seq=97 Ack=647257 Win=1087872 Len=0 TSval=6906157 TSecr=729013169
119   0.018588 54.230.156.193 -> 172.31.29.138 TCP 15994 [TCP segment of a reassembled PDU]
120   0.018599 172.31.29.138 -> 54.230.156.193 TCP 66 38974 > http [ACK] Seq=97 Ack=663185 Win=1119744 Len=0 TSval=6906157 TSecr=729013169
121   0.018729 54.230.156.193 -> 172.31.29.138 TCP 26130 [TCP segment of a reassembled PDU]
122   0.018743 172.31.29.138 -> 54.230.156.193 TCP 66 38974 > http [ACK] Seq=97 Ack=689249 Win=1171840 Len=0 TSval=6906157 TSecr=729013169
123   0.018833 54.230.156.193 -> 172.31.29.138 TCP 26130 [TCP segment of a reassembled PDU]
124   0.018847 172.31.29.138 -> 54.230.156.193 TCP 66 38974 > http [ACK] Seq=97 Ack=715313 Win=1224064 Len=0 TSval=6906157 TSecr=729013169
125   0.019070 54.230.156.193 -> 172.31.29.138 TCP 21786 [TCP segment of a reassembled PDU]
126   0.019082 172.31.29.138 -> 54.230.156.193 TCP 66 38974 > http [ACK] Seq=97 Ack=737033 Win=1267456 Len=0 TSval=6906157 TSecr=729013169
127   0.019447 54.230.156.193 -> 172.31.29.138 TCP 26130 [TCP segment of a reassembled PDU]
128   0.019475 172.31.29.138 -> 54.230.156.193 TCP 66 38974 > http [ACK] Seq=97 Ack=763097 Win=1319552 Len=0 TSval=6906157 TSecr=729013169
129   0.019488 54.230.156.193 -> 172.31.29.138 TCP 11650 [TCP segment of a reassembled PDU]
130   0.019497 172.31.29.138 -> 54.230.156.193 TCP 66 38974 > http [ACK] Seq=97 Ack=774681 Win=1342720 Len=0 TSval=6906157 TSecr=729013169
131   0.019513 54.230.156.193 -> 172.31.29.138 TCP 14546 [TCP segment of a reassembled PDU]
132   0.019520 172.31.29.138 -> 54.230.156.193 TCP 66 38974 > http [ACK] Seq=97 Ack=789161 Win=1371776 Len=0 TSval=6906157 TSecr=729013169
133   0.019553 54.230.156.193 -> 172.31.29.138 TCP 13098 [TCP segment of a reassembled PDU]
134   0.019568 172.31.29.138 -> 54.230.156.193 TCP 66 38974 > http [ACK] Seq=97 Ack=802193 Win=1358848 Len=0 TSval=6906157 TSecr=729013169
135   0.020029 54.230.156.193 -> 172.31.29.138 TCP 2962 [TCP segment of a reassembled PDU]
136   0.020034 172.31.29.138 -> 54.230.156.193 TCP 66 38974 > http [ACK] Seq=97 Ack=805089 Win=1377536 Len=0 TSval=6906158 TSecr=729013169
137   0.020205 54.230.156.193 -> 172.31.29.138 TCP 26130 [TCP segment of a reassembled PDU]
138   0.020218 172.31.29.138 -> 54.230.156.193 TCP 66 38974 > http [ACK] Seq=97 Ack=831153 Win=1416832 Len=0 TSval=6906158 TSecr=729013169
139   0.020242 54.230.156.193 -> 172.31.29.138 TCP 20338 [TCP segment of a reassembled PDU]
140   0.020264 172.31.29.138 -> 54.230.156.193 TCP 66 38974 > http [ACK] Seq=97 Ack=851425 Win=1396608 Len=0 TSval=6906158 TSecr=729013169
141   0.020280 54.230.156.193 -> 172.31.29.138 TCP 5858 [TCP segment of a reassembled PDU]
142   0.020292 172.31.29.138 -> 54.230.156.193 TCP 66 38974 > http [ACK] Seq=97 Ack=857217 Win=1416704 Len=0 TSval=6906158 TSecr=729013169
143   0.020342 54.230.156.193 -> 172.31.29.138 TCP 26130 [TCP segment of a reassembled PDU]
144   0.020354 172.31.29.138 -> 54.230.156.193 TCP 66 38974 > http [ACK] Seq=97 Ack=883281 Win=1416832 Len=0 TSval=6906158 TSecr=729013169
145   0.020390 54.230.156.193 -> 172.31.29.138 TCP 21786 [TCP segment of a reassembled PDU]
146   0.020518 172.31.29.138 -> 54.230.156.193 TCP 66 38974 > http [ACK] Seq=97 Ack=905001 Win=1395200 Len=0 TSval=6906158 TSecr=729013169
147   0.020890 54.230.156.193 -> 172.31.29.138 TCP 4410 [TCP segment of a reassembled PDU]
148   0.020897 172.31.29.138 -> 54.230.156.193 TCP 66 38974 > http [ACK] Seq=97 Ack=909345 Win=1438336 Len=0 TSval=6906158 TSecr=729013169
149   0.021110 54.230.156.193 -> 172.31.29.138 TCP 26130 [TCP segment of a reassembled PDU]
150   0.021137 172.31.29.138 -> 54.230.156.193 TCP 66 38974 > http [ACK] Seq=97 Ack=935409 Win=1416832 Len=0 TSval=6906158 TSecr=729013169
151   0.021164 54.230.156.193 -> 172.31.29.138 TCP 26130 [TCP segment of a reassembled PDU]
152   0.021182 54.230.156.193 -> 172.31.29.138 TCP 5858 [TCP segment of a reassembled PDU]
153   0.021198 172.31.29.138 -> 54.230.156.193 TCP 66 38974 > http [ACK] Seq=97 Ack=967265 Win=1407232 Len=0 TSval=6906158 TSecr=729013169
154   0.021268 54.230.156.193 -> 172.31.29.138 TCP 30474 [TCP segment of a reassembled PDU]
155   0.021282 172.31.29.138 -> 54.230.156.193 TCP 66 38974 > http [ACK] Seq=97 Ack=997673 Win=1409664 Len=0 TSval=6906158 TSecr=729013169
156   0.021681 54.230.156.193 -> 172.31.29.138 TCP 26130 [TCP segment of a reassembled PDU]
157   0.021694 172.31.29.138 -> 54.230.156.193 TCP 66 38974 > http [ACK] Seq=97 Ack=1023737 Win=1416832 Len=0 TSval=6906158 TSecr=729013169
158   0.021776 54.230.156.193 -> 172.31.29.138 HTTP 25363 HTTP/1.1 200 OK  (application/octet-stream)
159   0.021786 172.31.29.138 -> 54.230.156.193 TCP 66 38974 > http [ACK] Seq=97 Ack=1049034 Win=1416832 Len=0 TSval=6906158 TSecr=729013169
160   0.021914 172.31.29.138 -> 54.230.156.193 TCP 66 38974 > http [FIN, ACK] Seq=97 Ack=1049034 Win=1438336 Len=0 TSval=6906158 TSecr=729013169
161   0.022326 54.230.156.193 -> 172.31.29.138 TCP 66 http > 38974 [FIN, ACK] Seq=1049034 Ack=98 Win=14592 Len=0 TSval=729013169 TSecr=6906158
162   0.022333 172.31.29.138 -> 54.230.156.193 TCP 66 38974 > http [ACK] Seq=98 Ack=1049035 Win=1438336 Len=0 TSval=6906158 TSecr=729013169
