[Measurement for 1mb at 18:35:51 19.35.2014] 
Tshark:

  1   0.000000 172.31.29.138 -> 172.31.0.2   DNS 89 Standard query 0x91d2  A d3796nkzln59xv.cloudfront.net
  2   0.000029 172.31.29.138 -> 172.31.0.2   DNS 89 Standard query 0xd9c1  AAAA d3796nkzln59xv.cloudfront.net
  3   0.000701   172.31.0.2 -> 172.31.29.138 DNS 217 Standard query response 0x91d2  A 54.240.168.150 A 54.192.156.106 A 54.192.159.72 A 54.230.156.193 A 54.230.157.230 A 54.230.158.223 A 54.230.159.6 A 54.240.168.128
  4   0.000752   172.31.0.2 -> 172.31.29.138 DNS 170 Standard query response 0xd9c1 
  5   0.003855 172.31.29.138 -> 54.240.168.150 TCP 74 56456 > http [SYN] Seq=0 Win=26883 Len=0 MSS=8961 SACK_PERM=1 TSval=1506111 TSecr=0 WS=128
  6   0.004434 54.240.168.150 -> 172.31.29.138 TCP 74 http > 56456 [SYN, ACK] Seq=0 Ack=1 Win=14480 Len=0 MSS=1460 SACK_PERM=1 TSval=838187345 TSecr=1506111 WS=128
  7   0.004449 172.31.29.138 -> 54.240.168.150 TCP 66 56456 > http [ACK] Seq=1 Ack=1 Win=27008 Len=0 TSval=1506112 TSecr=838187345
  8   0.004492 172.31.29.138 -> 54.240.168.150 HTTP 162 GET /1mb HTTP/1.1 
  9   0.005093 54.240.168.150 -> 172.31.29.138 TCP 66 http > 56456 [ACK] Seq=1 Ack=97 Win=14592 Len=0 TSval=838187345 TSecr=1506112
 10   0.010236 54.240.168.150 -> 172.31.29.138 TCP 522 [TCP segment of a reassembled PDU]
 11   0.010245 172.31.29.138 -> 54.240.168.150 TCP 66 56456 > http [ACK] Seq=97 Ack=457 Win=28032 Len=0 TSval=1506113 TSecr=838187346
 12   0.010480 54.240.168.150 -> 172.31.29.138 TCP 2962 [TCP segment of a reassembled PDU]
 13   0.010487 172.31.29.138 -> 54.240.168.150 TCP 66 56456 > http [ACK] Seq=97 Ack=3353 Win=33792 Len=0 TSval=1506113 TSecr=838187346
 14   0.010528 54.240.168.150 -> 172.31.29.138 TCP 8754 [TCP segment of a reassembled PDU]
 15   0.010537 172.31.29.138 -> 54.240.168.150 TCP 66 56456 > http [ACK] Seq=97 Ack=12041 Win=51200 Len=0 TSval=1506113 TSecr=838187346
 16   0.010553 54.240.168.150 -> 172.31.29.138 TCP 1514 [TCP segment of a reassembled PDU]
 17   0.010556 172.31.29.138 -> 54.240.168.150 TCP 66 56456 > http [ACK] Seq=97 Ack=13489 Win=54144 Len=0 TSval=1506113 TSecr=838187346
 18   0.010998 54.240.168.150 -> 172.31.29.138 TCP 1514 [TCP segment of a reassembled PDU]
 19   0.011003 172.31.29.138 -> 54.240.168.150 TCP 66 56456 > http [ACK] Seq=97 Ack=14937 Win=56960 Len=0 TSval=1506113 TSecr=838187346
 20   0.011077 54.240.168.150 -> 172.31.29.138 TCP 11650 [TCP segment of a reassembled PDU]
 21   0.011085 172.31.29.138 -> 54.240.168.150 TCP 66 56456 > http [ACK] Seq=97 Ack=26521 Win=80128 Len=0 TSval=1506113 TSecr=838187346
 22   0.011112 54.240.168.150 -> 172.31.29.138 TCP 7306 [TCP segment of a reassembled PDU]
 23   0.011118 172.31.29.138 -> 54.240.168.150 TCP 66 56456 > http [ACK] Seq=97 Ack=33761 Win=86912 Len=0 TSval=1506113 TSecr=838187346
 24   0.011517 54.240.168.150 -> 172.31.29.138 TCP 2962 [TCP segment of a reassembled PDU]
 25   0.011523 172.31.29.138 -> 54.240.168.150 TCP 66 56456 > http [ACK] Seq=97 Ack=36657 Win=100480 Len=0 TSval=1506113 TSecr=838187346
 26   0.011604 54.240.168.150 -> 172.31.29.138 TCP 15994 [TCP segment of a reassembled PDU]
 27   0.011614 172.31.29.138 -> 54.240.168.150 TCP 66 56456 > http [ACK] Seq=97 Ack=52585 Win=91648 Len=0 TSval=1506113 TSecr=838187346
 28   0.012033 54.240.168.150 -> 172.31.29.138 TCP 4410 [TCP segment of a reassembled PDU]
 29   0.012039 172.31.29.138 -> 54.240.168.150 TCP 66 56456 > http [ACK] Seq=97 Ack=56929 Win=109056 Len=0 TSval=1506113 TSecr=838187346
 30   0.012158 54.240.168.150 -> 172.31.29.138 TCP 23234 [TCP segment of a reassembled PDU]
 31   0.012172 172.31.29.138 -> 54.240.168.150 TCP 66 56456 > http [ACK] Seq=97 Ack=80097 Win=155392 Len=0 TSval=1506114 TSecr=838187346
 32   0.012798 54.240.168.150 -> 172.31.29.138 TCP 7306 [TCP segment of a reassembled PDU]
 33   0.012805 172.31.29.138 -> 54.240.168.150 TCP 66 56456 > http [ACK] Seq=97 Ack=87337 Win=169856 Len=0 TSval=1506114 TSecr=838187346
 34   0.012894 54.240.168.150 -> 172.31.29.138 TCP 14546 [TCP segment of a reassembled PDU]
 35   0.012903 172.31.29.138 -> 54.240.168.150 TCP 66 56456 > http [ACK] Seq=97 Ack=101817 Win=198784 Len=0 TSval=1506114 TSecr=838187346
 36   0.013303 54.240.168.150 -> 172.31.29.138 TCP 7306 [TCP segment of a reassembled PDU]
 37   0.013310 172.31.29.138 -> 54.240.168.150 TCP 66 56456 > http [ACK] Seq=97 Ack=109057 Win=213376 Len=0 TSval=1506114 TSecr=838187346
 38   0.013432 54.240.168.150 -> 172.31.29.138 TCP 21850 [TCP segment of a reassembled PDU]
 39   0.013442 172.31.29.138 -> 54.240.168.150 TCP 66 56456 > http [ACK] Seq=97 Ack=130841 Win=256896 Len=0 TSval=1506114 TSecr=838187346
 40   0.014317 54.240.168.150 -> 172.31.29.138 TCP 2962 [TCP segment of a reassembled PDU]
 41   0.014323 172.31.29.138 -> 54.240.168.150 TCP 66 56456 > http [ACK] Seq=97 Ack=133737 Win=262656 Len=0 TSval=1506114 TSecr=838187346
 42   0.014414 54.240.168.150 -> 172.31.29.138 TCP 21786 [TCP segment of a reassembled PDU]
 43   0.014425 172.31.29.138 -> 54.240.168.150 TCP 66 56456 > http [ACK] Seq=97 Ack=155457 Win=306176 Len=0 TSval=1506114 TSecr=838187346
 44   0.014433 54.240.168.150 -> 172.31.29.138 TCP 1514 [TCP Previous segment not captured] [TCP segment of a reassembled PDU]
 45   0.014436 172.31.29.138 -> 54.240.168.150 TCP 78 [TCP Window Update] 56456 > http [ACK] Seq=97 Ack=155457 Win=308992 Len=0 TSval=1506114 TSecr=838187346 SLE=156905 SRE=158353
 46   0.014438 54.240.168.150 -> 172.31.29.138 TCP 1514 [TCP Out-Of-Order] [TCP segment of a reassembled PDU]
 47   0.014441 172.31.29.138 -> 54.240.168.150 TCP 66 56456 > http [ACK] Seq=97 Ack=158353 Win=311936 Len=0 TSval=1506114 TSecr=838187346
 48   0.014511 54.240.168.150 -> 172.31.29.138 TCP 7306 [TCP segment of a reassembled PDU]
 49   0.014518 172.31.29.138 -> 54.240.168.150 TCP 66 56456 > http [ACK] Seq=97 Ack=165593 Win=326400 Len=0 TSval=1506114 TSecr=838187346
 50   0.015111 54.240.168.150 -> 172.31.29.138 TCP 8754 [TCP segment of a reassembled PDU]
 51   0.015119 172.31.29.138 -> 54.240.168.150 TCP 66 56456 > http [ACK] Seq=97 Ack=174281 Win=343808 Len=0 TSval=1506114 TSecr=838187346
 52   0.015243 54.240.168.150 -> 172.31.29.138 TCP 18890 [TCP segment of a reassembled PDU]
 53   0.015254 172.31.29.138 -> 54.240.168.150 TCP 66 56456 > http [ACK] Seq=97 Ack=193105 Win=381440 Len=0 TSval=1506114 TSecr=838187346
 54   0.015260 54.240.168.150 -> 172.31.29.138 TCP 1514 [TCP segment of a reassembled PDU]
 55   0.015266 172.31.29.138 -> 54.240.168.150 TCP 66 56456 > http [ACK] Seq=97 Ack=194553 Win=384256 Len=0 TSval=1506114 TSecr=838187346
 56   0.015601 54.240.168.150 -> 172.31.29.138 TCP 1890 [TCP segment of a reassembled PDU]
 57   0.015606 172.31.29.138 -> 54.240.168.150 TCP 66 56456 > http [ACK] Seq=97 Ack=196377 Win=387968 Len=0 TSval=1506114 TSecr=838187346
 58   0.017388 54.240.168.150 -> 172.31.29.138 TCP 2962 [TCP segment of a reassembled PDU]
 59   0.017393 172.31.29.138 -> 54.240.168.150 TCP 66 56456 > http [ACK] Seq=97 Ack=199273 Win=393728 Len=0 TSval=1506115 TSecr=838187347
 60   0.017410 54.240.168.150 -> 172.31.29.138 TCP 2962 [TCP segment of a reassembled PDU]
 61   0.017414 172.31.29.138 -> 54.240.168.150 TCP 66 56456 > http [ACK] Seq=97 Ack=202169 Win=399488 Len=0 TSval=1506115 TSecr=838187347
 62   0.017550 54.240.168.150 -> 172.31.29.138 TCP 26130 [TCP segment of a reassembled PDU]
 63   0.017564 172.31.29.138 -> 54.240.168.150 TCP 66 56456 > http [ACK] Seq=97 Ack=228233 Win=451712 Len=0 TSval=1506115 TSecr=838187347
 64   0.017577 54.240.168.150 -> 172.31.29.138 TCP 10202 [TCP segment of a reassembled PDU]
 65   0.017586 172.31.29.138 -> 54.240.168.150 TCP 66 56456 > http [ACK] Seq=97 Ack=238369 Win=471936 Len=0 TSval=1506115 TSecr=838187347
 66   0.018171 54.240.168.150 -> 172.31.29.138 TCP 1514 [TCP segment of a reassembled PDU]
 67   0.018176 172.31.29.138 -> 54.240.168.150 TCP 66 56456 > http [ACK] Seq=97 Ack=239817 Win=474880 Len=0 TSval=1506115 TSecr=838187347
 68   0.018347 54.240.168.150 -> 172.31.29.138 TCP 22162 [TCP segment of a reassembled PDU]
 69   0.018359 172.31.29.138 -> 54.240.168.150 TCP 66 56456 > http [ACK] Seq=97 Ack=261913 Win=519040 Len=0 TSval=1506115 TSecr=838187347
 70   0.019455 54.240.168.150 -> 172.31.29.138 TCP 2962 [TCP segment of a reassembled PDU]
 71   0.019460 172.31.29.138 -> 54.240.168.150 TCP 66 56456 > http [ACK] Seq=97 Ack=264809 Win=524800 Len=0 TSval=1506115 TSecr=838187347
 72   0.019496 54.240.168.150 -> 172.31.29.138 TCP 8754 [TCP segment of a reassembled PDU]
 73   0.019504 172.31.29.138 -> 54.240.168.150 TCP 66 56456 > http [ACK] Seq=97 Ack=273497 Win=542208 Len=0 TSval=1506115 TSecr=838187347
 74   0.019561 54.240.168.150 -> 172.31.29.138 TCP 7378 [TCP segment of a reassembled PDU]
 75   0.019568 172.31.29.138 -> 54.240.168.150 TCP 66 56456 > http [ACK] Seq=97 Ack=280809 Win=556800 Len=0 TSval=1506115 TSecr=838187347
 76   0.019671 54.240.168.150 -> 172.31.29.138 TCP 17442 [TCP segment of a reassembled PDU]
 77   0.019682 172.31.29.138 -> 54.240.168.150 TCP 66 56456 > http [ACK] Seq=97 Ack=298185 Win=591616 Len=0 TSval=1506115 TSecr=838187347
 78   0.019702 54.240.168.150 -> 172.31.29.138 TCP 8754 [TCP segment of a reassembled PDU]
 79   0.019707 172.31.29.138 -> 54.240.168.150 TCP 66 56456 > http [ACK] Seq=97 Ack=306873 Win=608896 Len=0 TSval=1506115 TSecr=838187347
 80   0.019730 54.240.168.150 -> 172.31.29.138 TCP 1514 [TCP segment of a reassembled PDU]
 81   0.019733 172.31.29.138 -> 54.240.168.150 TCP 66 56456 > http [ACK] Seq=97 Ack=308321 Win=611840 Len=0 TSval=1506115 TSecr=838187347
 82   0.020011 54.240.168.150 -> 172.31.29.138 TCP 5858 [TCP segment of a reassembled PDU]
 83   0.020018 172.31.29.138 -> 54.240.168.150 TCP 66 56456 > http [ACK] Seq=97 Ack=314113 Win=623488 Len=0 TSval=1506115 TSecr=838187347
 84   0.020128 54.240.168.150 -> 172.31.29.138 TCP 13402 [TCP segment of a reassembled PDU]
 85   0.020137 172.31.29.138 -> 54.240.168.150 TCP 66 56456 > http [ACK] Seq=97 Ack=327449 Win=650112 Len=0 TSval=1506116 TSecr=838187347
 86   0.022011 54.240.168.150 -> 172.31.29.138 TCP 2962 [TCP segment of a reassembled PDU]
 87   0.022016 172.31.29.138 -> 54.240.168.150 TCP 66 56456 > http [ACK] Seq=97 Ack=330345 Win=655872 Len=0 TSval=1506116 TSecr=838187347
 88   0.022064 54.240.168.150 -> 172.31.29.138 TCP 13098 [TCP segment of a reassembled PDU]
 89   0.022073 172.31.29.138 -> 54.240.168.150 TCP 66 56456 > http [ACK] Seq=97 Ack=343377 Win=681984 Len=0 TSval=1506116 TSecr=838187347
 90   0.022183 54.240.168.150 -> 172.31.29.138 TCP 26130 [TCP segment of a reassembled PDU]
 91   0.022196 172.31.29.138 -> 54.240.168.150 TCP 66 56456 > http [ACK] Seq=97 Ack=369441 Win=734080 Len=0 TSval=1506116 TSecr=838187347
 92   0.022206 54.240.168.150 -> 172.31.29.138 TCP 8970 [TCP segment of a reassembled PDU]
 93   0.022212 172.31.29.138 -> 54.240.168.150 TCP 66 56456 > http [ACK] Seq=97 Ack=378345 Win=751872 Len=0 TSval=1506116 TSecr=838187347
 94   0.022788 54.240.168.150 -> 172.31.29.138 TCP 8754 [TCP segment of a reassembled PDU]
 95   0.022796 172.31.29.138 -> 54.240.168.150 TCP 66 56456 > http [ACK] Seq=97 Ack=387033 Win=769280 Len=0 TSval=1506116 TSecr=838187347
 96   0.022885 54.240.168.150 -> 172.31.29.138 TCP 5858 [TCP segment of a reassembled PDU]
 97   0.022891 172.31.29.138 -> 54.240.168.150 TCP 66 56456 > http [ACK] Seq=97 Ack=392825 Win=780800 Len=0 TSval=1506116 TSecr=838187347
 98   0.022896 54.240.168.150 -> 172.31.29.138 TCP 226 [TCP segment of a reassembled PDU]
 99   0.022898 172.31.29.138 -> 54.240.168.150 TCP 66 56456 > http [ACK] Seq=97 Ack=392985 Win=780800 Len=0 TSval=1506116 TSecr=838187347
100   0.024065 54.240.168.150 -> 172.31.29.138 TCP 2962 [TCP segment of a reassembled PDU]
101   0.024071 172.31.29.138 -> 54.240.168.150 TCP 66 56456 > http [ACK] Seq=97 Ack=395881 Win=786688 Len=0 TSval=1506117 TSecr=838187347
102   0.024310 54.240.168.150 -> 172.31.29.138 TCP 4410 [TCP segment of a reassembled PDU]
103   0.024316 172.31.29.138 -> 54.240.168.150 TCP 66 56456 > http [ACK] Seq=97 Ack=400225 Win=795392 Len=0 TSval=1506117 TSecr=838187347
104   0.024515 54.240.168.150 -> 172.31.29.138 TCP 26130 [TCP segment of a reassembled PDU]
105   0.024529 172.31.29.138 -> 54.240.168.150 TCP 66 56456 > http [ACK] Seq=97 Ack=426289 Win=822144 Len=0 TSval=1506117 TSecr=838187347
106   0.024540 54.240.168.150 -> 172.31.29.138 TCP 7306 [TCP segment of a reassembled PDU]
107   0.024548 172.31.29.138 -> 54.240.168.150 TCP 66 56456 > http [ACK] Seq=97 Ack=433529 Win=814976 Len=0 TSval=1506117 TSecr=838187347
108   0.024564 54.240.168.150 -> 172.31.29.138 TCP 17442 [TCP segment of a reassembled PDU]
109   0.024573 172.31.29.138 -> 54.240.168.150 TCP 66 56456 > http [ACK] Seq=97 Ack=450905 Win=797696 Len=0 TSval=1506117 TSecr=838187347
110   0.024937 54.240.168.150 -> 172.31.29.138 TCP 10202 [TCP segment of a reassembled PDU]
111   0.024945 172.31.29.138 -> 54.240.168.150 TCP 66 56456 > http [ACK] Seq=97 Ack=461041 Win=848384 Len=0 TSval=1506117 TSecr=838187347
112   0.025229 54.240.168.150 -> 172.31.29.138 TCP 26130 [TCP segment of a reassembled PDU]
113   0.025243 172.31.29.138 -> 54.240.168.150 TCP 66 56456 > http [ACK] Seq=97 Ack=487105 Win=822400 Len=0 TSval=1506117 TSecr=838187347
114   0.025281 54.240.168.150 -> 172.31.29.138 TCP 26130 [TCP segment of a reassembled PDU]
115   0.025295 172.31.29.138 -> 54.240.168.150 TCP 66 56456 > http [ACK] Seq=97 Ack=513169 Win=796416 Len=0 TSval=1506117 TSecr=838187347
116   0.025316 54.240.168.150 -> 172.31.29.138 TCP 2962 [TCP segment of a reassembled PDU]
117   0.025320 172.31.29.138 -> 54.240.168.150 TCP 66 56456 > http [ACK] Seq=97 Ack=516065 Win=817280 Len=0 TSval=1506117 TSecr=838187347
118   0.025691 54.240.168.150 -> 172.31.29.138 TCP 11650 [TCP segment of a reassembled PDU]
119   0.025700 172.31.29.138 -> 54.240.168.150 TCP 66 56456 > http [ACK] Seq=97 Ack=527649 Win=845952 Len=0 TSval=1506117 TSecr=838187347
120   0.025989 54.240.168.150 -> 172.31.29.138 TCP 26130 [TCP segment of a reassembled PDU]
121   0.026002 172.31.29.138 -> 54.240.168.150 TCP 66 56456 > http [ACK] Seq=97 Ack=553713 Win=822144 Len=0 TSval=1506117 TSecr=838187347
122   0.026008 54.240.168.150 -> 172.31.29.138 TCP 1514 [TCP segment of a reassembled PDU]
123   0.026010 172.31.29.138 -> 54.240.168.150 TCP 66 56456 > http [ACK] Seq=97 Ack=555161 Win=820736 Len=0 TSval=1506117 TSecr=838187347
124   0.026027 54.240.168.150 -> 172.31.29.138 TCP 20338 [TCP segment of a reassembled PDU]
125   0.026036 172.31.29.138 -> 54.240.168.150 TCP 66 56456 > http [ACK] Seq=97 Ack=575433 Win=800512 Len=0 TSval=1506117 TSecr=838187347
126   0.026082 54.240.168.150 -> 172.31.29.138 TCP 7306 [TCP segment of a reassembled PDU]
127   0.026088 172.31.29.138 -> 54.240.168.150 TCP 66 56456 > http [ACK] Seq=97 Ack=582673 Win=853120 Len=0 TSval=1506117 TSecr=838187347
128   0.026186 54.240.168.150 -> 172.31.29.138 TCP 4410 [TCP segment of a reassembled PDU]
129   0.026191 172.31.29.138 -> 54.240.168.150 TCP 66 56456 > http [ACK] Seq=97 Ack=587017 Win=857856 Len=0 TSval=1506117 TSecr=838187347
130   0.026607 54.240.168.150 -> 172.31.29.138 TCP 2962 [TCP segment of a reassembled PDU]
131   0.026612 172.31.29.138 -> 54.240.168.150 TCP 66 56456 > http [ACK] Seq=97 Ack=589913 Win=860160 Len=0 TSval=1506117 TSecr=838187347
132   0.026806 54.240.168.150 -> 172.31.29.138 TCP 26130 [TCP segment of a reassembled PDU]
133   0.026819 172.31.29.138 -> 54.240.168.150 TCP 66 56456 > http [ACK] Seq=97 Ack=615977 Win=834176 Len=0 TSval=1506117 TSecr=838187347
134   0.026860 54.240.168.150 -> 172.31.29.138 TCP 21786 [TCP segment of a reassembled PDU]
135   0.026877 172.31.29.138 -> 54.240.168.150 TCP 66 56456 > http [ACK] Seq=97 Ack=637697 Win=812544 Len=0 TSval=1506117 TSecr=838187347
136   0.026884 54.240.168.150 -> 172.31.29.138 TCP 4410 [TCP segment of a reassembled PDU]
137   0.026898 172.31.29.138 -> 54.240.168.150 TCP 66 56456 > http [ACK] Seq=97 Ack=642041 Win=822016 Len=0 TSval=1506117 TSecr=838187347
138   0.026908 54.240.168.150 -> 172.31.29.138 TCP 10202 [TCP segment of a reassembled PDU]
139   0.026923 172.31.29.138 -> 54.240.168.150 TCP 66 56456 > http [ACK] Seq=97 Ack=652177 Win=841088 Len=0 TSval=1506117 TSecr=838187347
140   0.027631 54.240.168.150 -> 172.31.29.138 TCP 2962 [TCP segment of a reassembled PDU]
141   0.027636 172.31.29.138 -> 54.240.168.150 TCP 66 56456 > http [ACK] Seq=97 Ack=655073 Win=860160 Len=0 TSval=1506117 TSecr=838187348
142   0.027641 54.240.168.150 -> 172.31.29.138 TCP 122 [TCP segment of a reassembled PDU]
143   0.027671 172.31.29.138 -> 54.240.168.150 TCP 66 56456 > http [ACK] Seq=97 Ack=655129 Win=865024 Len=0 TSval=1506117 TSecr=838187348
144   0.027696 54.240.168.150 -> 172.31.29.138 TCP 2962 [TCP segment of a reassembled PDU]
145   0.027713 172.31.29.138 -> 54.240.168.150 TCP 66 56456 > http [ACK] Seq=97 Ack=658025 Win=865024 Len=0 TSval=1506117 TSecr=838187348
146   0.027739 54.240.168.150 -> 172.31.29.138 TCP 10202 [TCP segment of a reassembled PDU]
147   0.027760 172.31.29.138 -> 54.240.168.150 TCP 66 56456 > http [ACK] Seq=97 Ack=668161 Win=865024 Len=0 TSval=1506117 TSecr=838187348
148   0.027765 54.240.168.150 -> 172.31.29.138 TCP 1514 [TCP Previous segment not captured] [TCP segment of a reassembled PDU]
149   0.027767 54.240.168.150 -> 172.31.29.138 TCP 1514 [TCP Out-Of-Order] [TCP segment of a reassembled PDU]
150   0.027770 172.31.29.138 -> 54.240.168.150 TCP 78 [TCP Dup ACK 147#1] 56456 > http [ACK] Seq=97 Ack=668161 Win=865024 Len=0 TSval=1506117 TSecr=838187348 SLE=669609 SRE=671057
151   0.027772 172.31.29.138 -> 54.240.168.150 TCP 66 56456 > http [ACK] Seq=97 Ack=671057 Win=862208 Len=0 TSval=1506117 TSecr=838187348
152   0.027904 54.240.168.150 -> 172.31.29.138 TCP 27578 [TCP segment of a reassembled PDU]
153   0.027918 172.31.29.138 -> 54.240.168.150 TCP 66 56456 > http [ACK] Seq=97 Ack=698569 Win=834816 Len=0 TSval=1506117 TSecr=838187348
154   0.027938 54.240.168.150 -> 172.31.29.138 TCP 11650 [TCP segment of a reassembled PDU]
155   0.027944 172.31.29.138 -> 54.240.168.150 TCP 66 56456 > http [ACK] Seq=97 Ack=710153 Win=823296 Len=0 TSval=1506117 TSecr=838187348
156   0.028277 54.240.168.150 -> 172.31.29.138 TCP 10578 [TCP segment of a reassembled PDU]
157   0.028286 172.31.29.138 -> 54.240.168.150 TCP 66 56456 > http [ACK] Seq=97 Ack=720665 Win=845952 Len=0 TSval=1506118 TSecr=838187348
158   0.029160 54.240.168.150 -> 172.31.29.138 TCP 2962 [TCP segment of a reassembled PDU]
159   0.029166 172.31.29.138 -> 54.240.168.150 TCP 66 56456 > http [ACK] Seq=97 Ack=723561 Win=873216 Len=0 TSval=1506118 TSecr=838187348
160   0.029194 54.240.168.150 -> 172.31.29.138 TCP 7306 [TCP segment of a reassembled PDU]
161   0.029199 172.31.29.138 -> 54.240.168.150 TCP 66 56456 > http [ACK] Seq=97 Ack=730801 Win=887680 Len=0 TSval=1506118 TSecr=838187348
162   0.029364 54.240.168.150 -> 172.31.29.138 TCP 29026 [TCP segment of a reassembled PDU]
163   0.029379 172.31.29.138 -> 54.240.168.150 TCP 66 56456 > http [ACK] Seq=97 Ack=759761 Win=945536 Len=0 TSval=1506118 TSecr=838187348
164   0.029410 54.240.168.150 -> 172.31.29.138 TCP 17442 [TCP segment of a reassembled PDU]
165   0.029418 172.31.29.138 -> 54.240.168.150 TCP 66 56456 > http [ACK] Seq=97 Ack=777137 Win=980352 Len=0 TSval=1506118 TSecr=838187348
166   0.029943 54.240.168.150 -> 172.31.29.138 TCP 5858 [TCP segment of a reassembled PDU]
167   0.029949 172.31.29.138 -> 54.240.168.150 TCP 66 56456 > http [ACK] Seq=97 Ack=782929 Win=991872 Len=0 TSval=1506118 TSecr=838187348
168   0.030128 54.240.168.150 -> 172.31.29.138 TCP 26130 [TCP segment of a reassembled PDU]
169   0.030141 172.31.29.138 -> 54.240.168.150 TCP 66 56456 > http [ACK] Seq=97 Ack=808993 Win=1044096 Len=0 TSval=1506118 TSecr=838187348
170   0.030154 54.240.168.150 -> 172.31.29.138 TCP 11650 [TCP segment of a reassembled PDU]
171   0.030163 172.31.29.138 -> 54.240.168.150 TCP 66 56456 > http [ACK] Seq=97 Ack=820577 Win=1067264 Len=0 TSval=1506118 TSecr=838187348
172   0.030516 54.240.168.150 -> 172.31.29.138 TCP 10202 [TCP segment of a reassembled PDU]
173   0.030524 172.31.29.138 -> 54.240.168.150 TCP 66 56456 > http [ACK] Seq=97 Ack=830713 Win=1087488 Len=0 TSval=1506118 TSecr=838187348
174   0.030650 54.240.168.150 -> 172.31.29.138 TCP 15994 [TCP segment of a reassembled PDU]
175   0.030660 172.31.29.138 -> 54.240.168.150 TCP 66 56456 > http [ACK] Seq=97 Ack=846641 Win=1119360 Len=0 TSval=1506118 TSecr=838187348
176   0.030744 54.240.168.150 -> 172.31.29.138 TCP 5162 [TCP segment of a reassembled PDU]
177   0.030750 172.31.29.138 -> 54.240.168.150 TCP 66 56456 > http [ACK] Seq=97 Ack=851737 Win=1129472 Len=0 TSval=1506118 TSecr=838187348
178   0.031221 54.240.168.150 -> 172.31.29.138 TCP 2962 [TCP segment of a reassembled PDU]
179   0.031228 172.31.29.138 -> 54.240.168.150 TCP 66 56456 > http [ACK] Seq=97 Ack=854633 Win=1135360 Len=0 TSval=1506118 TSecr=838187348
180   0.031329 54.240.168.150 -> 172.31.29.138 TCP 20338 [TCP segment of a reassembled PDU]
181   0.031341 172.31.29.138 -> 54.240.168.150 TCP 66 56456 > http [ACK] Seq=97 Ack=874905 Win=1175808 Len=0 TSval=1506118 TSecr=838187348
182   0.031415 54.240.168.150 -> 172.31.29.138 TCP 26130 [TCP segment of a reassembled PDU]
183   0.031429 172.31.29.138 -> 54.240.168.150 TCP 66 56456 > http [ACK] Seq=97 Ack=900969 Win=1228032 Len=0 TSval=1506118 TSecr=838187348
184   0.031455 54.240.168.150 -> 172.31.29.138 TCP 16370 [TCP segment of a reassembled PDU]
185   0.031463 172.31.29.138 -> 54.240.168.150 TCP 66 56456 > http [ACK] Seq=97 Ack=917273 Win=1260544 Len=0 TSval=1506118 TSecr=838187348
186   0.032311 54.240.168.150 -> 172.31.29.138 TCP 2962 [TCP segment of a reassembled PDU]
187   0.032317 172.31.29.138 -> 54.240.168.150 TCP 66 56456 > http [ACK] Seq=97 Ack=920169 Win=1266432 Len=0 TSval=1506119 TSecr=838187348
188   0.032558 54.240.168.150 -> 172.31.29.138 TCP 4410 [TCP segment of a reassembled PDU]
189   0.032563 172.31.29.138 -> 54.240.168.150 TCP 66 56456 > http [ACK] Seq=97 Ack=924513 Win=1275136 Len=0 TSval=1506119 TSecr=838187348
190   0.032743 54.240.168.150 -> 172.31.29.138 TCP 26130 [TCP segment of a reassembled PDU]
191   0.032757 172.31.29.138 -> 54.240.168.150 TCP 66 56456 > http [ACK] Seq=97 Ack=950577 Win=1327232 Len=0 TSval=1506119 TSecr=838187348
192   0.032769 54.240.168.150 -> 172.31.29.138 TCP 11650 [TCP segment of a reassembled PDU]
193   0.032779 172.31.29.138 -> 54.240.168.150 TCP 66 56456 > http [ACK] Seq=97 Ack=962161 Win=1350400 Len=0 TSval=1506119 TSecr=838187348
194   0.032791 54.240.168.150 -> 172.31.29.138 TCP 14546 [TCP segment of a reassembled PDU]
195   0.032796 172.31.29.138 -> 54.240.168.150 TCP 66 56456 > http [ACK] Seq=97 Ack=976641 Win=1379328 Len=0 TSval=1506119 TSecr=838187348
196   0.032818 54.240.168.150 -> 172.31.29.138 TCP 6234 [TCP segment of a reassembled PDU]
197   0.032823 172.31.29.138 -> 54.240.168.150 TCP 66 56456 > http [ACK] Seq=97 Ack=982809 Win=1391616 Len=0 TSval=1506119 TSecr=838187348
198   0.034577 54.240.168.150 -> 172.31.29.138 TCP 11650 [TCP segment of a reassembled PDU]
199   0.034586 172.31.29.138 -> 54.240.168.150 TCP 66 56456 > http [ACK] Seq=97 Ack=994393 Win=1414784 Len=0 TSval=1506119 TSecr=838187348
200   0.034722 54.240.168.150 -> 172.31.29.138 TCP 17442 [TCP segment of a reassembled PDU]
201   0.034734 172.31.29.138 -> 54.240.168.150 TCP 66 56456 > http [ACK] Seq=97 Ack=1011769 Win=1449600 Len=0 TSval=1506119 TSecr=838187348
202   0.034754 54.240.168.150 -> 172.31.29.138 TCP 8754 [TCP segment of a reassembled PDU]
203   0.034760 172.31.29.138 -> 54.240.168.150 TCP 66 56456 > http [ACK] Seq=97 Ack=1020457 Win=1467008 Len=0 TSval=1506119 TSecr=838187348
204   0.034821 54.240.168.150 -> 172.31.29.138 TCP 27953 [TCP segment of a reassembled PDU]
205   0.034832 172.31.29.138 -> 54.240.168.150 TCP 66 56456 > http [ACK] Seq=97 Ack=1048344 Win=1522688 Len=0 TSval=1506119 TSecr=838187348
206   0.035287 54.240.168.150 -> 172.31.29.138 HTTP 755 HTTP/1.1 200 OK  (application/octet-stream)
207   0.035292 172.31.29.138 -> 54.240.168.150 TCP 66 56456 > http [ACK] Seq=97 Ack=1049033 Win=1522688 Len=0 TSval=1506119 TSecr=838187348
208   0.035418 172.31.29.138 -> 54.240.168.150 TCP 66 56456 > http [FIN, ACK] Seq=97 Ack=1049033 Win=1522688 Len=0 TSval=1506119 TSecr=838187348
209   0.036056 54.240.168.150 -> 172.31.29.138 TCP 66 http > 56456 [FIN, ACK] Seq=1049033 Ack=98 Win=14592 Len=0 TSval=838187348 TSecr=1506119
210   0.036064 172.31.29.138 -> 54.240.168.150 TCP 66 56456 > http [ACK] Seq=98 Ack=1049034 Win=1522688 Len=0 TSval=1506119 TSecr=838187348
