[Measurement for 1mb at 20:36:49 19.36.2014] 
Tshark:

  1   0.000000 172.31.29.138 -> 172.31.0.2   DNS 89 Standard query 0x69e6  A d3796nkzln59xv.cloudfront.net
  2   0.000026 172.31.29.138 -> 172.31.0.2   DNS 89 Standard query 0x4bdf  AAAA d3796nkzln59xv.cloudfront.net
  3   0.000711   172.31.0.2 -> 172.31.29.138 DNS 217 Standard query response 0x69e6  A 54.230.158.80 A 54.230.159.4 A 54.230.159.150 A 54.230.159.153 A 54.192.157.146 A 54.192.159.173 A 54.192.159.174 A 54.230.156.193
  4   0.000724   172.31.0.2 -> 172.31.29.138 DNS 170 Standard query response 0x4bdf 
  5   0.003880 172.31.29.138 -> 54.230.158.80 TCP 74 48596 > http [SYN] Seq=0 Win=26883 Len=0 MSS=8961 SACK_PERM=1 TSval=3320521 TSecr=0 WS=128
  6   0.004594 54.230.158.80 -> 172.31.29.138 TCP 74 http > 48596 [SYN, ACK] Seq=0 Ack=1 Win=14480 Len=0 MSS=1460 SACK_PERM=1 TSval=727578410 TSecr=3320521 WS=128
  7   0.004610 172.31.29.138 -> 54.230.158.80 TCP 66 48596 > http [ACK] Seq=1 Ack=1 Win=27008 Len=0 TSval=3320521 TSecr=727578410
  8   0.004668 172.31.29.138 -> 54.230.158.80 HTTP 162 GET /1mb HTTP/1.1 
  9   0.005345 54.230.158.80 -> 172.31.29.138 TCP 66 http > 48596 [ACK] Seq=1 Ack=97 Win=14592 Len=0 TSval=727578410 TSecr=3320521
 10   0.010198 54.230.158.80 -> 172.31.29.138 TCP 1514 [TCP segment of a reassembled PDU]
 11   0.010207 172.31.29.138 -> 54.230.158.80 TCP 66 48596 > http [ACK] Seq=97 Ack=1449 Win=29824 Len=0 TSval=3320522 TSecr=727578411
 12   0.010450 54.230.158.80 -> 172.31.29.138 TCP 2962 [TCP segment of a reassembled PDU]
 13   0.010457 172.31.29.138 -> 54.230.158.80 TCP 66 48596 > http [ACK] Seq=97 Ack=4345 Win=35584 Len=0 TSval=3320522 TSecr=727578411
 14   0.010528 54.230.158.80 -> 172.31.29.138 TCP 9832 [TCP segment of a reassembled PDU]
 15   0.010537 172.31.29.138 -> 54.230.158.80 TCP 66 48596 > http [ACK] Seq=97 Ack=14111 Win=55168 Len=0 TSval=3320522 TSecr=727578411
 16   0.011218 54.230.158.80 -> 172.31.29.138 TCP 4410 [TCP segment of a reassembled PDU]
 17   0.011224 172.31.29.138 -> 54.230.158.80 TCP 66 48596 > http [ACK] Seq=97 Ack=18455 Win=63872 Len=0 TSval=3320523 TSecr=727578411
 18   0.011295 54.230.158.80 -> 172.31.29.138 TCP 8754 [TCP segment of a reassembled PDU]
 19   0.011301 172.31.29.138 -> 54.230.158.80 TCP 66 48596 > http [ACK] Seq=97 Ack=27143 Win=81280 Len=0 TSval=3320523 TSecr=727578411
 20   0.012072 54.230.158.80 -> 172.31.29.138 TCP 8754 [TCP segment of a reassembled PDU]
 21   0.012080 172.31.29.138 -> 54.230.158.80 TCP 66 48596 > http [ACK] Seq=97 Ack=35831 Win=98560 Len=0 TSval=3320523 TSecr=727578411
 22   0.012099 54.230.158.80 -> 172.31.29.138 TCP 4410 [TCP segment of a reassembled PDU]
 23   0.012105 172.31.29.138 -> 54.230.158.80 TCP 66 48596 > http [ACK] Seq=97 Ack=40175 Win=96512 Len=0 TSval=3320523 TSecr=727578411
 24   0.012162 54.230.158.80 -> 172.31.29.138 TCP 8754 [TCP segment of a reassembled PDU]
 25   0.012169 172.31.29.138 -> 54.230.158.80 TCP 66 48596 > http [ACK] Seq=97 Ack=48863 Win=103680 Len=0 TSval=3320523 TSecr=727578411
 26   0.012774 54.230.158.80 -> 172.31.29.138 TCP 4410 [TCP segment of a reassembled PDU]
 27   0.012780 172.31.29.138 -> 54.230.158.80 TCP 66 48596 > http [ACK] Seq=97 Ack=53207 Win=109056 Len=0 TSval=3320523 TSecr=727578411
 28   0.012948 54.230.158.80 -> 172.31.29.138 TCP 21786 [TCP segment of a reassembled PDU]
 29   0.012961 172.31.29.138 -> 54.230.158.80 TCP 66 48596 > http [ACK] Seq=97 Ack=74927 Win=87424 Len=0 TSval=3320523 TSecr=727578411
 30   0.013564 54.230.158.80 -> 172.31.29.138 TCP 8754 [TCP segment of a reassembled PDU]
 31   0.013571 172.31.29.138 -> 54.230.158.80 TCP 66 48596 > http [ACK] Seq=97 Ack=83615 Win=103680 Len=0 TSval=3320523 TSecr=727578411
 32   0.013662 54.230.158.80 -> 172.31.29.138 TCP 20338 [TCP segment of a reassembled PDU]
 33   0.013674 172.31.29.138 -> 54.230.158.80 TCP 66 48596 > http [ACK] Seq=97 Ack=103887 Win=84608 Len=0 TSval=3320523 TSecr=727578411
 34   0.014315 54.230.158.80 -> 172.31.29.138 TCP 4410 [TCP segment of a reassembled PDU]
 35   0.014321 172.31.29.138 -> 54.230.158.80 TCP 66 48596 > http [ACK] Seq=97 Ack=108231 Win=109056 Len=0 TSval=3320523 TSecr=727578411
 36   0.014496 54.230.158.80 -> 172.31.29.138 TCP 21786 [TCP segment of a reassembled PDU]
 37   0.014509 172.31.29.138 -> 54.230.158.80 TCP 66 48596 > http [ACK] Seq=97 Ack=129951 Win=87424 Len=0 TSval=3320523 TSecr=727578411
 38   0.014568 54.230.158.80 -> 172.31.29.138 TCP 4410 [TCP segment of a reassembled PDU]
 39   0.014643 54.230.158.80 -> 172.31.29.138 TCP 1514 [TCP segment of a reassembled PDU]
 40   0.014756 172.31.29.138 -> 54.230.158.80 TCP 66 48596 > http [ACK] Seq=97 Ack=135743 Win=81664 Len=0 TSval=3320523 TSecr=727578411
 41   0.015119 54.230.158.80 -> 172.31.29.138 TCP 7306 [TCP segment of a reassembled PDU]
 42   0.015127 172.31.29.138 -> 54.230.158.80 TCP 66 48596 > http [ACK] Seq=97 Ack=142983 Win=105984 Len=0 TSval=3320524 TSecr=727578411
 43   0.015221 54.230.158.80 -> 172.31.29.138 TCP 21786 [TCP segment of a reassembled PDU]
 44   0.015233 172.31.29.138 -> 54.230.158.80 TCP 66 48596 > http [ACK] Seq=97 Ack=164703 Win=152448 Len=0 TSval=3320524 TSecr=727578411
 45   0.015929 54.230.158.80 -> 172.31.29.138 TCP 8754 [TCP segment of a reassembled PDU]
 46   0.015938 172.31.29.138 -> 54.230.158.80 TCP 66 48596 > http [ACK] Seq=97 Ack=173391 Win=169856 Len=0 TSval=3320524 TSecr=727578411
 47   0.016029 54.230.158.80 -> 172.31.29.138 TCP 23053 [TCP segment of a reassembled PDU]
 48   0.016039 172.31.29.138 -> 54.230.158.80 TCP 66 48596 > http [ACK] Seq=97 Ack=196378 Win=215808 Len=0 TSval=3320524 TSecr=727578411
 49   0.016913 54.230.158.80 -> 172.31.29.138 TCP 1514 [TCP segment of a reassembled PDU]
 50   0.016930 172.31.29.138 -> 54.230.158.80 TCP 66 48596 > http [ACK] Seq=97 Ack=197826 Win=218752 Len=0 TSval=3320524 TSecr=727578411
 51   0.017024 54.230.158.80 -> 172.31.29.138 TCP 21786 [TCP segment of a reassembled PDU]
 52   0.017037 172.31.29.138 -> 54.230.158.80 TCP 66 48596 > http [ACK] Seq=97 Ack=219546 Win=262144 Len=0 TSval=3320524 TSecr=727578411
 53   0.017047 54.230.158.80 -> 172.31.29.138 TCP 7306 [TCP segment of a reassembled PDU]
 54   0.017052 172.31.29.138 -> 54.230.158.80 TCP 66 48596 > http [ACK] Seq=97 Ack=226786 Win=276608 Len=0 TSval=3320524 TSecr=727578411
 55   0.017067 54.230.158.80 -> 172.31.29.138 TCP 10202 [TCP segment of a reassembled PDU]
 56   0.017074 172.31.29.138 -> 54.230.158.80 TCP 66 48596 > http [ACK] Seq=97 Ack=236922 Win=296960 Len=0 TSval=3320524 TSecr=727578411
 57   0.017687 54.230.158.80 -> 172.31.29.138 TCP 4410 [TCP segment of a reassembled PDU]
 58   0.017694 172.31.29.138 -> 54.230.158.80 TCP 66 48596 > http [ACK] Seq=97 Ack=241266 Win=305664 Len=0 TSval=3320524 TSecr=727578412
 59   0.017889 54.230.158.80 -> 172.31.29.138 TCP 20714 [TCP segment of a reassembled PDU]
 60   0.017898 172.31.29.138 -> 54.230.158.80 TCP 66 48596 > http [ACK] Seq=97 Ack=261914 Win=346880 Len=0 TSval=3320524 TSecr=727578412
 61   0.019782 54.230.158.80 -> 172.31.29.138 TCP 2962 [TCP segment of a reassembled PDU]
 62   0.019788 172.31.29.138 -> 54.230.158.80 TCP 66 48596 > http [ACK] Seq=97 Ack=264810 Win=352768 Len=0 TSval=3320525 TSecr=727578412
 63   0.019874 54.230.158.80 -> 172.31.29.138 TCP 26130 [TCP segment of a reassembled PDU]
 64   0.019888 172.31.29.138 -> 54.230.158.80 TCP 66 48596 > http [ACK] Seq=97 Ack=290874 Win=404864 Len=0 TSval=3320525 TSecr=727578412
 65   0.019933 54.230.158.80 -> 172.31.29.138 TCP 8754 [TCP segment of a reassembled PDU]
 66   0.019940 172.31.29.138 -> 54.230.158.80 TCP 66 48596 > http [ACK] Seq=97 Ack=299562 Win=422272 Len=0 TSval=3320525 TSecr=727578412
 67   0.020125 54.230.158.80 -> 172.31.29.138 TCP 4410 [TCP segment of a reassembled PDU]
 68   0.020131 172.31.29.138 -> 54.230.158.80 TCP 66 48596 > http [ACK] Seq=97 Ack=303906 Win=430848 Len=0 TSval=3320525 TSecr=727578412
 69   0.020535 54.230.158.80 -> 172.31.29.138 TCP 5858 [TCP segment of a reassembled PDU]
 70   0.020542 172.31.29.138 -> 54.230.158.80 TCP 66 48596 > http [ACK] Seq=97 Ack=309698 Win=442496 Len=0 TSval=3320525 TSecr=727578412
 71   0.020667 54.230.158.80 -> 172.31.29.138 TCP 11650 [TCP segment of a reassembled PDU]
 72   0.020675 172.31.29.138 -> 54.230.158.80 TCP 66 48596 > http [ACK] Seq=97 Ack=321282 Win=465664 Len=0 TSval=3320525 TSecr=727578412
 73   0.020889 54.230.158.80 -> 172.31.29.138 TCP 6234 [TCP segment of a reassembled PDU]
 74   0.020896 172.31.29.138 -> 54.230.158.80 TCP 66 48596 > http [ACK] Seq=97 Ack=327450 Win=477952 Len=0 TSval=3320525 TSecr=727578412
 75   0.022328 54.230.158.80 -> 172.31.29.138 TCP 2962 [TCP segment of a reassembled PDU]
 76   0.022333 172.31.29.138 -> 54.230.158.80 TCP 66 48596 > http [ACK] Seq=97 Ack=330346 Win=483840 Len=0 TSval=3320525 TSecr=727578412
 77   0.022456 54.230.158.80 -> 172.31.29.138 TCP 20338 [TCP segment of a reassembled PDU]
 78   0.022467 172.31.29.138 -> 54.230.158.80 TCP 66 48596 > http [ACK] Seq=97 Ack=350618 Win=524288 Len=0 TSval=3320525 TSecr=727578412
 79   0.022521 54.230.158.80 -> 172.31.29.138 TCP 23234 [TCP segment of a reassembled PDU]
 80   0.022534 172.31.29.138 -> 54.230.158.80 TCP 66 48596 > http [ACK] Seq=97 Ack=373786 Win=570624 Len=0 TSval=3320525 TSecr=727578412
 81   0.022699 54.230.158.80 -> 172.31.29.138 TCP 4410 [TCP segment of a reassembled PDU]
 82   0.022704 172.31.29.138 -> 54.230.158.80 TCP 66 48596 > http [ACK] Seq=97 Ack=378130 Win=579328 Len=0 TSval=3320525 TSecr=727578412
 83   0.023359 54.230.158.80 -> 172.31.29.138 TCP 5858 [TCP segment of a reassembled PDU]
 84   0.023366 172.31.29.138 -> 54.230.158.80 TCP 66 48596 > http [ACK] Seq=97 Ack=383922 Win=590976 Len=0 TSval=3320526 TSecr=727578412
 85   0.023479 54.230.158.80 -> 172.31.29.138 TCP 9130 [TCP segment of a reassembled PDU]
 86   0.023487 172.31.29.138 -> 54.230.158.80 TCP 66 48596 > http [ACK] Seq=97 Ack=392986 Win=609024 Len=0 TSval=3320526 TSecr=727578412
 87   0.024360 54.230.158.80 -> 172.31.29.138 TCP 1514 [TCP segment of a reassembled PDU]
 88   0.024365 172.31.29.138 -> 54.230.158.80 TCP 66 48596 > http [ACK] Seq=97 Ack=394434 Win=611968 Len=0 TSval=3320526 TSecr=727578412
 89   0.024627 54.230.158.80 -> 172.31.29.138 TCP 5858 [TCP segment of a reassembled PDU]
 90   0.024633 172.31.29.138 -> 54.230.158.80 TCP 66 48596 > http [ACK] Seq=97 Ack=400226 Win=623488 Len=0 TSval=3320526 TSecr=727578412
 91   0.024797 54.230.158.80 -> 172.31.29.138 TCP 26130 [TCP segment of a reassembled PDU]
 92   0.024811 172.31.29.138 -> 54.230.158.80 TCP 66 48596 > http [ACK] Seq=97 Ack=426290 Win=675712 Len=0 TSval=3320526 TSecr=727578412
 93   0.024822 54.230.158.80 -> 172.31.29.138 TCP 8754 [TCP segment of a reassembled PDU]
 94   0.024827 172.31.29.138 -> 54.230.158.80 TCP 66 48596 > http [ACK] Seq=97 Ack=434978 Win=692992 Len=0 TSval=3320526 TSecr=727578412
 95   0.024843 54.230.158.80 -> 172.31.29.138 TCP 13098 [TCP segment of a reassembled PDU]
 96   0.024850 172.31.29.138 -> 54.230.158.80 TCP 66 48596 > http [ACK] Seq=97 Ack=448010 Win=705280 Len=0 TSval=3320526 TSecr=727578412
 97   0.025157 54.230.158.80 -> 172.31.29.138 TCP 1514 [TCP segment of a reassembled PDU]
 98   0.025162 172.31.29.138 -> 54.230.158.80 TCP 66 48596 > http [ACK] Seq=97 Ack=449458 Win=722048 Len=0 TSval=3320526 TSecr=727578412
 99   0.025377 54.230.158.80 -> 172.31.29.138 TCP 2962 [TCP segment of a reassembled PDU]
100   0.025383 172.31.29.138 -> 54.230.158.80 TCP 66 48596 > http [ACK] Seq=97 Ack=452354 Win=727808 Len=0 TSval=3320526 TSecr=727578412
101   0.025540 54.230.158.80 -> 172.31.29.138 TCP 26130 [TCP segment of a reassembled PDU]
102   0.025555 172.31.29.138 -> 54.230.158.80 TCP 66 48596 > http [ACK] Seq=97 Ack=478418 Win=741120 Len=0 TSval=3320526 TSecr=727578412
103   0.025566 54.230.158.80 -> 172.31.29.138 TCP 10202 [TCP segment of a reassembled PDU]
104   0.025592 54.230.158.80 -> 172.31.29.138 TCP 15994 [TCP segment of a reassembled PDU]
105   0.025606 172.31.29.138 -> 54.230.158.80 TCP 66 48596 > http [ACK] Seq=97 Ack=504482 Win=715136 Len=0 TSval=3320526 TSecr=727578412
106   0.025627 54.230.158.80 -> 172.31.29.138 TCP 4410 [TCP segment of a reassembled PDU]
107   0.025636 172.31.29.138 -> 54.230.158.80 TCP 66 48596 > http [ACK] Seq=97 Ack=508826 Win=733696 Len=0 TSval=3320526 TSecr=727578412
108   0.025725 54.230.158.80 -> 172.31.29.138 TCP 1514 [TCP segment of a reassembled PDU]
109   0.025729 172.31.29.138 -> 54.230.158.80 TCP 66 48596 > http [ACK] Seq=97 Ack=510274 Win=781440 Len=0 TSval=3320526 TSecr=727578412
110   0.025914 54.230.158.80 -> 172.31.29.138 TCP 5858 [TCP segment of a reassembled PDU]
111   0.025944 172.31.29.138 -> 54.230.158.80 TCP 66 48596 > http [ACK] Seq=97 Ack=516066 Win=782848 Len=0 TSval=3320526 TSecr=727578412
112   0.026152 54.230.158.80 -> 172.31.29.138 TCP 4410 [TCP segment of a reassembled PDU]
113   0.026168 172.31.29.138 -> 54.230.158.80 TCP 66 48596 > http [ACK] Seq=97 Ack=520410 Win=782848 Len=0 TSval=3320526 TSecr=727578412
114   0.026325 54.230.158.80 -> 172.31.29.138 TCP 20338 [TCP segment of a reassembled PDU]
115   0.026348 172.31.29.138 -> 54.230.158.80 TCP 66 48596 > http [ACK] Seq=97 Ack=540682 Win=762624 Len=0 TSval=3320526 TSecr=727578412
116   0.026431 54.230.158.80 -> 172.31.29.138 TCP 37714 [TCP segment of a reassembled PDU]
117   0.026451 54.230.158.80 -> 172.31.29.138 TCP 2962 [TCP segment of a reassembled PDU]
118   0.026467 172.31.29.138 -> 54.230.158.80 TCP 66 48596 > http [ACK] Seq=97 Ack=581226 Win=722176 Len=0 TSval=3320526 TSecr=727578412
119   0.026921 54.230.158.80 -> 172.31.29.138 TCP 4410 [TCP segment of a reassembled PDU]
120   0.026928 172.31.29.138 -> 54.230.158.80 TCP 66 48596 > http [ACK] Seq=97 Ack=585570 Win=776704 Len=0 TSval=3320526 TSecr=727578412
121   0.027073 54.230.158.80 -> 172.31.29.138 TCP 17442 [TCP segment of a reassembled PDU]
122   0.027097 172.31.29.138 -> 54.230.158.80 TCP 66 48596 > http [ACK] Seq=97 Ack=602946 Win=759424 Len=0 TSval=3320526 TSecr=727578412
123   0.027176 54.230.158.80 -> 172.31.29.138 TCP 37714 [TCP segment of a reassembled PDU]
124   0.027208 172.31.29.138 -> 54.230.158.80 TCP 66 48596 > http [ACK] Seq=97 Ack=640594 Win=782848 Len=0 TSval=3320527 TSecr=727578412
125   0.027283 54.230.158.80 -> 172.31.29.138 TCP 5858 [TCP segment of a reassembled PDU]
126   0.027290 172.31.29.138 -> 54.230.158.80 TCP 66 48596 > http [ACK] Seq=97 Ack=646386 Win=794368 Len=0 TSval=3320527 TSecr=727578412
127   0.027732 54.230.158.80 -> 172.31.29.138 TCP 4410 [TCP segment of a reassembled PDU]
128   0.027739 172.31.29.138 -> 54.230.158.80 TCP 66 48596 > http [ACK] Seq=97 Ack=650730 Win=803072 Len=0 TSval=3320527 TSecr=727578413
129   0.028041 54.230.158.80 -> 172.31.29.138 TCP 4410 [TCP segment of a reassembled PDU]
130   0.028046 172.31.29.138 -> 54.230.158.80 TCP 66 48596 > http [ACK] Seq=97 Ack=655074 Win=811776 Len=0 TSval=3320527 TSecr=727578413
131   0.028052 54.230.158.80 -> 172.31.29.138 TCP 122 [TCP segment of a reassembled PDU]
132   0.028068 172.31.29.138 -> 54.230.158.80 TCP 66 48596 > http [ACK] Seq=97 Ack=655130 Win=811776 Len=0 TSval=3320527 TSecr=727578413
133   0.028105 54.230.158.80 -> 172.31.29.138 TCP 2962 [TCP segment of a reassembled PDU]
134   0.028110 172.31.29.138 -> 54.230.158.80 TCP 66 48596 > http [ACK] Seq=97 Ack=658026 Win=817536 Len=0 TSval=3320527 TSecr=727578413
135   0.028178 54.230.158.80 -> 172.31.29.138 TCP 26130 [TCP segment of a reassembled PDU]
136   0.028191 172.31.29.138 -> 54.230.158.80 TCP 66 48596 > http [ACK] Seq=97 Ack=684090 Win=869760 Len=0 TSval=3320527 TSecr=727578413
137   0.028245 54.230.158.80 -> 172.31.29.138 TCP 26130 [TCP segment of a reassembled PDU]
138   0.028259 172.31.29.138 -> 54.230.158.80 TCP 66 48596 > http [ACK] Seq=97 Ack=710154 Win=921856 Len=0 TSval=3320527 TSecr=727578413
139   0.028277 54.230.158.80 -> 172.31.29.138 TCP 10578 [TCP segment of a reassembled PDU]
140   0.028283 172.31.29.138 -> 54.230.158.80 TCP 66 48596 > http [ACK] Seq=97 Ack=720666 Win=942848 Len=0 TSval=3320527 TSecr=727578413
141   0.029480 54.230.158.80 -> 172.31.29.138 TCP 2962 [TCP segment of a reassembled PDU]
142   0.029486 172.31.29.138 -> 54.230.158.80 TCP 66 48596 > http [ACK] Seq=97 Ack=723562 Win=948608 Len=0 TSval=3320527 TSecr=727578413
143   0.029544 54.230.158.80 -> 172.31.29.138 TCP 15994 [TCP segment of a reassembled PDU]
144   0.029554 172.31.29.138 -> 54.230.158.80 TCP 66 48596 > http [ACK] Seq=97 Ack=739490 Win=980480 Len=0 TSval=3320527 TSecr=727578413
145   0.029685 54.230.158.80 -> 172.31.29.138 TCP 24682 [TCP segment of a reassembled PDU]
146   0.029698 172.31.29.138 -> 54.230.158.80 TCP 66 48596 > http [ACK] Seq=97 Ack=764106 Win=1029760 Len=0 TSval=3320527 TSecr=727578413
147   0.029812 54.230.158.80 -> 172.31.29.138 TCP 22162 [TCP segment of a reassembled PDU]
148   0.029822 172.31.29.138 -> 54.230.158.80 TCP 66 48596 > http [ACK] Seq=97 Ack=786202 Win=1073920 Len=0 TSval=3320527 TSecr=727578413
149   0.030245 54.230.158.80 -> 172.31.29.138 TCP 2962 [TCP segment of a reassembled PDU]
150   0.030250 172.31.29.138 -> 54.230.158.80 TCP 66 48596 > http [ACK] Seq=97 Ack=789098 Win=1079680 Len=0 TSval=3320527 TSecr=727578413
151   0.030304 54.230.158.80 -> 172.31.29.138 TCP 14546 [TCP segment of a reassembled PDU]
152   0.030313 172.31.29.138 -> 54.230.158.80 TCP 66 48596 > http [ACK] Seq=97 Ack=803578 Win=1108736 Len=0 TSval=3320527 TSecr=727578413
153   0.030421 54.230.158.80 -> 172.31.29.138 TCP 21786 [TCP segment of a reassembled PDU]
154   0.030434 172.31.29.138 -> 54.230.158.80 TCP 66 48596 > http [ACK] Seq=97 Ack=825298 Win=1152128 Len=0 TSval=3320527 TSecr=727578413
155   0.030508 54.230.158.80 -> 172.31.29.138 TCP 20338 [TCP segment of a reassembled PDU]
156   0.030520 172.31.29.138 -> 54.230.158.80 TCP 66 48596 > http [ACK] Seq=97 Ack=845570 Win=1165312 Len=0 TSval=3320527 TSecr=727578413
157   0.030527 54.230.158.80 -> 172.31.29.138 TCP 2962 [TCP segment of a reassembled PDU]
158   0.030610 54.230.158.80 -> 172.31.29.138 TCP 3338 [TCP segment of a reassembled PDU]
159   0.030675 172.31.29.138 -> 54.230.158.80 TCP 66 48596 > http [ACK] Seq=97 Ack=851738 Win=1159168 Len=0 TSval=3320527 TSecr=727578413
160   0.031521 54.230.158.80 -> 172.31.29.138 TCP 2962 [TCP segment of a reassembled PDU]
161   0.031541 172.31.29.138 -> 54.230.158.80 TCP 66 48596 > http [ACK] Seq=97 Ack=854634 Win=1198464 Len=0 TSval=3320528 TSecr=727578413
162   0.031760 54.230.158.80 -> 172.31.29.138 TCP 1514 [TCP segment of a reassembled PDU]
163   0.031765 172.31.29.138 -> 54.230.158.80 TCP 66 48596 > http [ACK] Seq=97 Ack=856082 Win=1201408 Len=0 TSval=3320528 TSecr=727578413
164   0.031965 54.230.158.80 -> 172.31.29.138 TCP 26130 [TCP segment of a reassembled PDU]
165   0.031981 54.230.158.80 -> 172.31.29.138 TCP 4410 [TCP segment of a reassembled PDU]
166   0.031997 172.31.29.138 -> 54.230.158.80 TCP 66 48596 > http [ACK] Seq=97 Ack=886490 Win=1184384 Len=0 TSval=3320528 TSecr=727578413
167   0.032060 54.230.158.80 -> 172.31.29.138 TCP 30850 [TCP segment of a reassembled PDU]
168   0.032089 172.31.29.138 -> 54.230.158.80 TCP 66 48596 > http [ACK] Seq=97 Ack=917274 Win=1182080 Len=0 TSval=3320528 TSecr=727578413
169   0.032118 54.230.158.80 -> 172.31.29.138 TCP 2962 [TCP segment of a reassembled PDU]
170   0.032124 172.31.29.138 -> 54.230.158.80 TCP 66 48596 > http [ACK] Seq=97 Ack=920170 Win=1207168 Len=0 TSval=3320528 TSecr=727578413
171   0.032574 54.230.158.80 -> 172.31.29.138 TCP 4410 [TCP segment of a reassembled PDU]
172   0.032579 172.31.29.138 -> 54.230.158.80 TCP 66 48596 > http [ACK] Seq=97 Ack=924514 Win=1215872 Len=0 TSval=3320528 TSecr=727578413
173   0.032737 54.230.158.80 -> 172.31.29.138 TCP 18890 [TCP segment of a reassembled PDU]
174   0.032761 172.31.29.138 -> 54.230.158.80 TCP 66 48596 > http [ACK] Seq=97 Ack=943338 Win=1203456 Len=0 TSval=3320528 TSecr=727578413
175   0.032871 54.230.158.80 -> 172.31.29.138 TCP 39538 [TCP segment of a reassembled PDU]
176   0.033006 172.31.29.138 -> 54.230.158.80 TCP 66 48596 > http [ACK] Seq=97 Ack=982810 Win=1167744 Len=0 TSval=3320528 TSecr=727578413
177   0.033574 54.230.158.80 -> 172.31.29.138 TCP 4410 [TCP segment of a reassembled PDU]
178   0.033580 172.31.29.138 -> 54.230.158.80 TCP 66 48596 > http [ACK] Seq=97 Ack=987154 Win=1224576 Len=0 TSval=3320528 TSecr=727578413
179   0.033744 54.230.158.80 -> 172.31.29.138 TCP 17442 [TCP segment of a reassembled PDU]
180   0.033767 172.31.29.138 -> 54.230.158.80 TCP 66 48596 > http [ACK] Seq=97 Ack=1004530 Win=1207296 Len=0 TSval=3320528 TSecr=727578413
181   0.033869 54.230.158.80 -> 172.31.29.138 TCP 39162 [TCP segment of a reassembled PDU]
182   0.033899 172.31.29.138 -> 54.230.158.80 TCP 66 48596 > http [ACK] Seq=97 Ack=1043626 Win=1170176 Len=0 TSval=3320528 TSecr=727578413
183   0.033934 54.230.158.80 -> 172.31.29.138 HTTP 5474 HTTP/1.1 200 OK  (application/octet-stream)
184   0.033940 172.31.29.138 -> 54.230.158.80 TCP 66 48596 > http [ACK] Seq=97 Ack=1049034 Win=1224960 Len=0 TSval=3320528 TSecr=727578413
185   0.034098 172.31.29.138 -> 54.230.158.80 TCP 66 48596 > http [FIN, ACK] Seq=97 Ack=1049034 Win=1228032 Len=0 TSval=3320528 TSecr=727578413
186   0.034570 54.230.158.80 -> 172.31.29.138 TCP 66 http > 48596 [FIN, ACK] Seq=1049034 Ack=98 Win=14592 Len=0 TSval=727578413 TSecr=3320528
187   0.034578 172.31.29.138 -> 54.230.158.80 TCP 66 48596 > http [ACK] Seq=98 Ack=1049035 Win=1228032 Len=0 TSval=3320528 TSecr=727578413
