[Measurement for 10mb at 12:40:27 20.40.2014] 
Tshark:

  1   0.000000 172.31.8.238 -> 172.31.0.2   DNS 89 Standard query 0xa375  A d39wppo36gwqpx.cloudfront.net
  2   0.000037 172.31.8.238 -> 172.31.0.2   DNS 89 Standard query 0x2ccf  AAAA d39wppo36gwqpx.cloudfront.net
  3   0.000530   172.31.0.2 -> 172.31.8.238 DNS 217 Standard query response 0xa375  A 54.230.118.114 A 54.230.119.94 A 54.239.132.103 A 54.192.118.219 A 54.230.116.136 A 54.230.116.167 A 54.230.117.69 A 54.230.117.152
  4   0.000542   172.31.0.2 -> 172.31.8.238 DNS 170 Standard query response 0x2ccf 
  5   0.003807 172.31.8.238 -> 54.230.118.114 TCP 74 45977 > http [SYN] Seq=0 Win=26883 Len=0 MSS=8961 SACK_PERM=1 TSval=17713691 TSecr=0 WS=128
  6   0.004549 54.230.118.114 -> 172.31.8.238 TCP 74 http > 45977 [SYN, ACK] Seq=0 Ack=1 Win=14480 Len=0 MSS=1460 SACK_PERM=1 TSval=1689833104 TSecr=17713691 WS=128
  7   0.004563 172.31.8.238 -> 54.230.118.114 TCP 66 45977 > http [ACK] Seq=1 Ack=1 Win=27008 Len=0 TSval=17713692 TSecr=1689833104
  8   0.004600 172.31.8.238 -> 54.230.118.114 HTTP 163 GET /10mb HTTP/1.1 
  9   0.005284 54.230.118.114 -> 172.31.8.238 TCP 66 http > 45977 [ACK] Seq=1 Ack=98 Win=14592 Len=0 TSval=1689833104 TSecr=17713692
 10   0.007097 54.230.118.114 -> 172.31.8.238 TCP 524 [TCP segment of a reassembled PDU]
 11   0.007103 172.31.8.238 -> 54.230.118.114 TCP 66 45977 > http [ACK] Seq=98 Ack=459 Win=28032 Len=0 TSval=17713692 TSecr=1689833104
 12   0.007243 54.230.118.114 -> 172.31.8.238 TCP 11650 [TCP segment of a reassembled PDU]
 13   0.007253 172.31.8.238 -> 54.230.118.114 TCP 66 45977 > http [ACK] Seq=98 Ack=12043 Win=51200 Len=0 TSval=17713692 TSecr=1689833104
 14   0.007258 54.230.118.114 -> 172.31.8.238 TCP 1514 [TCP segment of a reassembled PDU]
 15   0.007262 172.31.8.238 -> 54.230.118.114 TCP 66 45977 > http [ACK] Seq=98 Ack=13491 Win=54144 Len=0 TSval=17713692 TSecr=1689833104
 16   0.008182 54.230.118.114 -> 172.31.8.238 TCP 11650 [TCP segment of a reassembled PDU]
 17   0.008192 172.31.8.238 -> 54.230.118.114 TCP 66 45977 > http [ACK] Seq=98 Ack=25075 Win=77312 Len=0 TSval=17713693 TSecr=1689833104
 18   0.008216 54.230.118.114 -> 172.31.8.238 TCP 1514 [TCP segment of a reassembled PDU]
 19   0.008224 172.31.8.238 -> 54.230.118.114 TCP 66 45977 > http [ACK] Seq=98 Ack=26523 Win=80128 Len=0 TSval=17713693 TSecr=1689833104
 20   0.008889 54.230.118.114 -> 172.31.8.238 TCP 1514 [TCP segment of a reassembled PDU]
 21   0.008894 172.31.8.238 -> 54.230.118.114 TCP 66 45977 > http [ACK] Seq=98 Ack=27971 Win=83072 Len=0 TSval=17713693 TSecr=1689833104
 22   0.009023 54.230.118.114 -> 172.31.8.238 TCP 20338 [TCP segment of a reassembled PDU]
 23   0.009037 172.31.8.238 -> 54.230.118.114 TCP 66 45977 > http [ACK] Seq=98 Ack=48243 Win=84608 Len=0 TSval=17713693 TSecr=1689833104
 24   0.009674 54.230.118.114 -> 172.31.8.238 TCP 4410 [TCP segment of a reassembled PDU]
 25   0.009680 172.31.8.238 -> 54.230.118.114 TCP 66 45977 > http [ACK] Seq=98 Ack=52587 Win=109056 Len=0 TSval=17713693 TSecr=1689833104
 26   0.009811 54.230.118.114 -> 172.31.8.238 TCP 13098 [TCP segment of a reassembled PDU]
 27   0.009820 172.31.8.238 -> 54.230.118.114 TCP 66 45977 > http [ACK] Seq=98 Ack=65619 Win=96512 Len=0 TSval=17713693 TSecr=1689833104
 28   0.011653 54.230.118.114 -> 172.31.8.238 TCP 26130 [TCP segment of a reassembled PDU]
 29   0.011666 172.31.8.238 -> 54.230.118.114 TCP 66 45977 > http [ACK] Seq=98 Ack=91683 Win=75136 Len=0 TSval=17713693 TSecr=1689833105
 30   0.012475 54.230.118.114 -> 172.31.8.238 TCP 1514 [TCP segment of a reassembled PDU]
 31   0.012480 172.31.8.238 -> 54.230.118.114 TCP 66 45977 > http [ACK] Seq=98 Ack=93131 Win=109056 Len=0 TSval=17713694 TSecr=1689833105
 32   0.012602 54.230.118.114 -> 172.31.8.238 TCP 17442 [TCP segment of a reassembled PDU]
 33   0.012612 172.31.8.238 -> 54.230.118.114 TCP 66 45977 > http [ACK] Seq=98 Ack=110507 Win=143872 Len=0 TSval=17713694 TSecr=1689833105
 34   0.012638 54.230.118.114 -> 172.31.8.238 TCP 7306 [TCP segment of a reassembled PDU]
 35   0.012648 172.31.8.238 -> 54.230.118.114 TCP 66 45977 > http [ACK] Seq=98 Ack=117747 Win=158336 Len=0 TSval=17713694 TSecr=1689833105
 36   0.013259 54.230.118.114 -> 172.31.8.238 TCP 8754 [TCP segment of a reassembled PDU]
 37   0.013267 172.31.8.238 -> 54.230.118.114 TCP 66 45977 > http [ACK] Seq=98 Ack=126435 Win=175616 Len=0 TSval=17713694 TSecr=1689833105
 38   0.013418 54.230.118.114 -> 172.31.8.238 TCP 17442 [TCP segment of a reassembled PDU]
 39   0.013428 172.31.8.238 -> 54.230.118.114 TCP 66 45977 > http [ACK] Seq=98 Ack=143811 Win=210432 Len=0 TSval=17713694 TSecr=1689833105
 40   0.014053 54.230.118.114 -> 172.31.8.238 TCP 11650 [TCP segment of a reassembled PDU]
 41   0.014063 172.31.8.238 -> 54.230.118.114 TCP 66 45977 > http [ACK] Seq=98 Ack=155395 Win=233600 Len=0 TSval=17713694 TSecr=1689833105
 42   0.014167 54.230.118.114 -> 172.31.8.238 TCP 14546 [TCP segment of a reassembled PDU]
 43   0.014176 172.31.8.238 -> 54.230.118.114 TCP 66 45977 > http [ACK] Seq=98 Ack=169875 Win=262528 Len=0 TSval=17713694 TSecr=1689833105
 44   0.014584 54.230.118.114 -> 172.31.8.238 TCP 10202 [TCP segment of a reassembled PDU]
 45   0.014592 172.31.8.238 -> 54.230.118.114 TCP 66 45977 > http [ACK] Seq=98 Ack=180011 Win=282880 Len=0 TSval=17713694 TSecr=1689833105
 46   0.014698 54.230.118.114 -> 172.31.8.238 TCP 2962 [TCP segment of a reassembled PDU]
 47   0.014703 172.31.8.238 -> 54.230.118.114 TCP 66 45977 > http [ACK] Seq=98 Ack=182907 Win=288640 Len=0 TSval=17713694 TSecr=1689833105
 48   0.015032 54.230.118.114 -> 172.31.8.238 TCP 2962 [TCP segment of a reassembled PDU]
 49   0.015037 172.31.8.238 -> 54.230.118.114 TCP 66 45977 > http [ACK] Seq=98 Ack=185803 Win=294400 Len=0 TSval=17713694 TSecr=1689833105
 50   0.015177 54.230.118.114 -> 172.31.8.238 TCP 23234 [TCP segment of a reassembled PDU]
 51   0.015202 172.31.8.238 -> 54.230.118.114 TCP 66 45977 > http [ACK] Seq=98 Ack=208971 Win=340736 Len=0 TSval=17713694 TSecr=1689833105
 52   0.015334 54.230.118.114 -> 172.31.8.238 TCP 11650 [TCP segment of a reassembled PDU]
 53   0.015341 172.31.8.238 -> 54.230.118.114 TCP 66 45977 > http [ACK] Seq=98 Ack=220555 Win=363904 Len=0 TSval=17713694 TSecr=1689833105
 54   0.015427 54.230.118.114 -> 172.31.8.238 TCP 4410 [TCP segment of a reassembled PDU]
 55   0.015433 172.31.8.238 -> 54.230.118.114 TCP 66 45977 > http [ACK] Seq=98 Ack=224899 Win=372608 Len=0 TSval=17713694 TSecr=1689833105
 56   0.016084 54.230.118.114 -> 172.31.8.238 TCP 5858 [TCP segment of a reassembled PDU]
 57   0.016091 172.31.8.238 -> 54.230.118.114 TCP 66 45977 > http [ACK] Seq=98 Ack=230691 Win=384128 Len=0 TSval=17713695 TSecr=1689833105
 58   0.016242 54.230.118.114 -> 172.31.8.238 TCP 26130 [TCP segment of a reassembled PDU]
 59   0.016255 172.31.8.238 -> 54.230.118.114 TCP 66 45977 > http [ACK] Seq=98 Ack=256755 Win=436352 Len=0 TSval=17713695 TSecr=1689833105
 60   0.016281 54.230.118.114 -> 172.31.8.238 TCP 10202 [TCP segment of a reassembled PDU]
 61   0.016287 172.31.8.238 -> 54.230.118.114 TCP 66 45977 > http [ACK] Seq=98 Ack=266891 Win=456576 Len=0 TSval=17713695 TSecr=1689833105
 62   0.017092 54.230.118.114 -> 172.31.8.238 TCP 8754 [TCP segment of a reassembled PDU]
 63   0.017107 172.31.8.238 -> 54.230.118.114 TCP 66 45977 > http [ACK] Seq=98 Ack=275579 Win=473984 Len=0 TSval=17713695 TSecr=1689833105
 64   0.017277 54.230.118.114 -> 172.31.8.238 TCP 26130 [TCP segment of a reassembled PDU]
 65   0.017291 172.31.8.238 -> 54.230.118.114 TCP 66 45977 > http [ACK] Seq=98 Ack=301643 Win=526080 Len=0 TSval=17713695 TSecr=1689833105
 66   0.017346 54.230.118.114 -> 172.31.8.238 TCP 17442 [TCP segment of a reassembled PDU]
 67   0.017371 172.31.8.238 -> 54.230.118.114 TCP 66 45977 > http [ACK] Seq=98 Ack=319019 Win=560896 Len=0 TSval=17713695 TSecr=1689833105
 68   0.018127 54.230.118.114 -> 172.31.8.238 TCP 10202 [TCP segment of a reassembled PDU]
 69   0.018135 172.31.8.238 -> 54.230.118.114 TCP 66 45977 > http [ACK] Seq=98 Ack=329155 Win=581120 Len=0 TSval=17713695 TSecr=1689833105
 70   0.018228 54.230.118.114 -> 172.31.8.238 TCP 5858 [TCP segment of a reassembled PDU]
 71   0.018234 172.31.8.238 -> 54.230.118.114 TCP 66 45977 > http [ACK] Seq=98 Ack=334947 Win=592640 Len=0 TSval=17713695 TSecr=1689833105
 72   0.018367 54.230.118.114 -> 172.31.8.238 TCP 26130 [TCP segment of a reassembled PDU]
 73   0.018385 172.31.8.238 -> 54.230.118.114 TCP 66 45977 > http [ACK] Seq=98 Ack=361011 Win=644864 Len=0 TSval=17713695 TSecr=1689833105
 74   0.018414 54.230.118.114 -> 172.31.8.238 TCP 14546 [TCP segment of a reassembled PDU]
 75   0.018426 172.31.8.238 -> 54.230.118.114 TCP 66 45977 > http [ACK] Seq=98 Ack=375491 Win=673792 Len=0 TSval=17713695 TSecr=1689833105
 76   0.019301 54.230.118.114 -> 172.31.8.238 TCP 4410 [TCP segment of a reassembled PDU]
 77   0.019309 172.31.8.238 -> 54.230.118.114 TCP 66 45977 > http [ACK] Seq=98 Ack=379835 Win=682496 Len=0 TSval=17713695 TSecr=1689833105
 78   0.019346 54.230.118.114 -> 172.31.8.238 TCP 26130 [TCP segment of a reassembled PDU]
 79   0.019359 172.31.8.238 -> 54.230.118.114 TCP 66 45977 > http [ACK] Seq=98 Ack=405899 Win=734592 Len=0 TSval=17713695 TSecr=1689833105
 80   0.019421 54.230.118.114 -> 172.31.8.238 TCP 15994 [TCP segment of a reassembled PDU]
 81   0.019431 172.31.8.238 -> 54.230.118.114 TCP 66 45977 > http [ACK] Seq=98 Ack=421827 Win=766464 Len=0 TSval=17713695 TSecr=1689833105
 82   0.019920 54.230.118.114 -> 172.31.8.238 TCP 8754 [TCP segment of a reassembled PDU]
 83   0.019929 172.31.8.238 -> 54.230.118.114 TCP 66 45977 > http [ACK] Seq=98 Ack=430515 Win=783872 Len=0 TSval=17713696 TSecr=1689833106
 84   0.020090 54.230.118.114 -> 172.31.8.238 TCP 26130 [TCP segment of a reassembled PDU]
 85   0.020103 172.31.8.238 -> 54.230.118.114 TCP 66 45977 > http [ACK] Seq=98 Ack=456579 Win=795136 Len=0 TSval=17713696 TSecr=1689833106
 86   0.020172 54.230.118.114 -> 172.31.8.238 TCP 26130 [TCP segment of a reassembled PDU]
 87   0.020186 172.31.8.238 -> 54.230.118.114 TCP 66 45977 > http [ACK] Seq=98 Ack=482643 Win=795136 Len=0 TSval=17713696 TSecr=1689833106
 88   0.020225 54.230.118.114 -> 172.31.8.238 TCP 5858 [TCP segment of a reassembled PDU]
 89   0.020230 172.31.8.238 -> 54.230.118.114 TCP 66 45977 > http [ACK] Seq=98 Ack=488435 Win=828416 Len=0 TSval=17713696 TSecr=1689833106
 90   0.020955 54.230.118.114 -> 172.31.8.238 TCP 14546 [TCP segment of a reassembled PDU]
 91   0.020964 172.31.8.238 -> 54.230.118.114 TCP 66 45977 > http [ACK] Seq=98 Ack=502915 Win=814080 Len=0 TSval=17713696 TSecr=1689833106
 92   0.021103 54.230.118.114 -> 172.31.8.238 TCP 26130 [TCP segment of a reassembled PDU]
 93   0.021117 172.31.8.238 -> 54.230.118.114 TCP 66 45977 > http [ACK] Seq=98 Ack=528979 Win=795136 Len=0 TSval=17713696 TSecr=1689833106
 94   0.021181 54.230.118.114 -> 172.31.8.238 TCP 26130 [TCP segment of a reassembled PDU]
 95   0.021194 172.31.8.238 -> 54.230.118.114 TCP 66 45977 > http [ACK] Seq=98 Ack=555043 Win=795136 Len=0 TSval=17713696 TSecr=1689833106
 96   0.021236 54.230.118.114 -> 172.31.8.238 TCP 5858 [TCP segment of a reassembled PDU]
 97   0.021242 172.31.8.238 -> 54.230.118.114 TCP 66 45977 > http [ACK] Seq=98 Ack=560835 Win=828416 Len=0 TSval=17713696 TSecr=1689833106
 98   0.021961 54.230.118.114 -> 172.31.8.238 TCP 5858 [TCP segment of a reassembled PDU]
 99   0.021967 172.31.8.238 -> 54.230.118.114 TCP 66 45977 > http [ACK] Seq=98 Ack=566627 Win=828416 Len=0 TSval=17713696 TSecr=1689833106
100   0.022130 54.230.118.114 -> 172.31.8.238 TCP 24682 [TCP segment of a reassembled PDU]
101   0.022143 172.31.8.238 -> 54.230.118.114 TCP 66 45977 > http [ACK] Seq=98 Ack=591243 Win=803840 Len=0 TSval=17713696 TSecr=1689833106
102   0.022211 54.230.118.114 -> 172.31.8.238 TCP 4410 [TCP segment of a reassembled PDU]
103   0.022223 172.31.8.238 -> 54.230.118.114 TCP 66 45977 > http [ACK] Seq=98 Ack=595587 Win=830848 Len=0 TSval=17713696 TSecr=1689833106
104   0.022263 54.230.118.114 -> 172.31.8.238 TCP 26130 [TCP segment of a reassembled PDU]
105   0.022276 172.31.8.238 -> 54.230.118.114 TCP 66 45977 > http [ACK] Seq=98 Ack=621651 Win=804864 Len=0 TSval=17713696 TSecr=1689833106
106   0.022327 54.230.118.114 -> 172.31.8.238 TCP 10202 [TCP segment of a reassembled PDU]
107   0.022334 172.31.8.238 -> 54.230.118.114 TCP 66 45977 > http [ACK] Seq=98 Ack=631787 Win=794752 Len=0 TSval=17713696 TSecr=1689833106
108   0.022745 54.230.118.114 -> 172.31.8.238 TCP 4410 [TCP segment of a reassembled PDU]
109   0.022751 172.31.8.238 -> 54.230.118.114 TCP 66 45977 > http [ACK] Seq=98 Ack=636131 Win=830848 Len=0 TSval=17713696 TSecr=1689833106
110   0.022935 54.230.118.114 -> 172.31.8.238 TCP 17442 [TCP segment of a reassembled PDU]
111   0.022961 172.31.8.238 -> 54.230.118.114 TCP 66 45977 > http [ACK] Seq=98 Ack=653507 Win=813568 Len=0 TSval=17713696 TSecr=1689833106
112   0.022976 54.230.118.114 -> 172.31.8.238 TCP 7306 [TCP segment of a reassembled PDU]
113   0.022991 172.31.8.238 -> 54.230.118.114 TCP 66 45977 > http [ACK] Seq=98 Ack=660747 Win=835968 Len=0 TSval=17713696 TSecr=1689833106
114   0.023040 54.230.118.114 -> 172.31.8.238 TCP 2962 [TCP segment of a reassembled PDU]
115   0.023058 172.31.8.238 -> 54.230.118.114 TCP 66 45977 > http [ACK] Seq=98 Ack=663643 Win=835968 Len=0 TSval=17713696 TSecr=1689833106
116   0.023213 54.230.118.114 -> 172.31.8.238 TCP 26130 [TCP segment of a reassembled PDU]
117   0.023238 172.31.8.238 -> 54.230.118.114 TCP 66 45977 > http [ACK] Seq=98 Ack=689707 Win=809984 Len=0 TSval=17713696 TSecr=1689833106
118   0.023254 54.230.118.114 -> 172.31.8.238 TCP 15994 [TCP segment of a reassembled PDU]
119   0.023274 172.31.8.238 -> 54.230.118.114 TCP 66 45977 > http [ACK] Seq=98 Ack=705635 Win=811776 Len=0 TSval=17713696 TSecr=1689833106
120   0.023768 54.230.118.114 -> 172.31.8.238 TCP 11650 [TCP segment of a reassembled PDU]
121   0.023778 172.31.8.238 -> 54.230.118.114 TCP 66 45977 > http [ACK] Seq=98 Ack=717219 Win=818944 Len=0 TSval=17713696 TSecr=1689833106
122   0.023913 54.230.118.114 -> 172.31.8.238 TCP 8754 [TCP segment of a reassembled PDU]
123   0.023922 172.31.8.238 -> 54.230.118.114 TCP 66 45977 > http [ACK] Seq=98 Ack=725907 Win=823680 Len=0 TSval=17713697 TSecr=1689833106
124   0.024166 54.230.118.114 -> 172.31.8.238 TCP 26130 [TCP segment of a reassembled PDU]
125   0.024180 172.31.8.238 -> 54.230.118.114 TCP 66 45977 > http [ACK] Seq=98 Ack=751971 Win=888064 Len=0 TSval=17713697 TSecr=1689833106
126   0.024239 54.230.118.114 -> 172.31.8.238 TCP 26130 [TCP segment of a reassembled PDU]
127   0.024253 172.31.8.238 -> 54.230.118.114 TCP 66 45977 > http [ACK] Seq=98 Ack=778035 Win=940160 Len=0 TSval=17713697 TSecr=1689833106
128   0.024312 54.230.118.114 -> 172.31.8.238 TCP 13098 [TCP segment of a reassembled PDU]
129   0.024321 172.31.8.238 -> 54.230.118.114 TCP 66 45977 > http [ACK] Seq=98 Ack=791067 Win=966272 Len=0 TSval=17713697 TSecr=1689833106
130   0.025036 54.230.118.114 -> 172.31.8.238 TCP 7306 [TCP segment of a reassembled PDU]
131   0.025044 172.31.8.238 -> 54.230.118.114 TCP 66 45977 > http [ACK] Seq=98 Ack=798307 Win=980736 Len=0 TSval=17713697 TSecr=1689833106
132   0.025203 54.230.118.114 -> 172.31.8.238 TCP 26130 [TCP segment of a reassembled PDU]
133   0.025217 172.31.8.238 -> 54.230.118.114 TCP 66 45977 > http [ACK] Seq=98 Ack=824371 Win=1032832 Len=0 TSval=17713697 TSecr=1689833106
134   0.025277 54.230.118.114 -> 172.31.8.238 TCP 26130 [TCP segment of a reassembled PDU]
135   0.025289 172.31.8.238 -> 54.230.118.114 TCP 66 45977 > http [ACK] Seq=98 Ack=850435 Win=1065472 Len=0 TSval=17713697 TSecr=1689833106
136   0.025334 54.230.118.114 -> 172.31.8.238 TCP 5858 [TCP segment of a reassembled PDU]
137   0.025441 54.230.118.114 -> 172.31.8.238 TCP 26130 [TCP segment of a reassembled PDU]
138   0.025459 54.230.118.114 -> 172.31.8.238 TCP 10202 [TCP segment of a reassembled PDU]
139   0.025516 172.31.8.238 -> 54.230.118.114 TCP 66 45977 > http [ACK] Seq=98 Ack=892427 Win=1023488 Len=0 TSval=17713697 TSecr=1689833106
140   0.025901 54.230.118.114 -> 172.31.8.238 TCP 5858 [TCP segment of a reassembled PDU]
141   0.025908 172.31.8.238 -> 54.230.118.114 TCP 66 45977 > http [ACK] Seq=98 Ack=898219 Win=1096576 Len=0 TSval=17713697 TSecr=1689833106
142   0.026089 54.230.118.114 -> 172.31.8.238 TCP 23234 [TCP segment of a reassembled PDU]
143   0.026114 172.31.8.238 -> 54.230.118.114 TCP 66 45977 > http [ACK] Seq=98 Ack=921387 Win=1073408 Len=0 TSval=17713697 TSecr=1689833106
144   0.026421 54.230.118.114 -> 172.31.8.238 TCP 8754 [TCP segment of a reassembled PDU]
145   0.026429 172.31.8.238 -> 54.230.118.114 TCP 66 45977 > http [ACK] Seq=98 Ack=930075 Win=1094016 Len=0 TSval=17713697 TSecr=1689833106
146   0.026595 54.230.118.114 -> 172.31.8.238 TCP 26130 [TCP segment of a reassembled PDU]
147   0.026639 172.31.8.238 -> 54.230.118.114 TCP 66 45977 > http [ACK] Seq=98 Ack=956139 Win=1068032 Len=0 TSval=17713697 TSecr=1689833106
148   0.026688 54.230.118.114 -> 172.31.8.238 TCP 26130 [TCP segment of a reassembled PDU]
149   0.026713 172.31.8.238 -> 54.230.118.114 TCP 66 45977 > http [ACK] Seq=98 Ack=982203 Win=1065472 Len=0 TSval=17713697 TSecr=1689833106
150   0.026802 54.230.118.114 -> 172.31.8.238 TCP 26130 [TCP segment of a reassembled PDU]
151   0.026816 172.31.8.238 -> 54.230.118.114 TCP 66 45977 > http [ACK] Seq=98 Ack=1008267 Win=1065472 Len=0 TSval=17713697 TSecr=1689833106
152   0.026884 54.230.118.114 -> 172.31.8.238 TCP 23234 [TCP segment of a reassembled PDU]
153   0.026896 172.31.8.238 -> 54.230.118.114 TCP 66 45977 > http [ACK] Seq=98 Ack=1031435 Win=1070208 Len=0 TSval=17713697 TSecr=1689833106
154   0.027376 54.230.118.114 -> 172.31.8.238 TCP 20338 [TCP segment of a reassembled PDU]
155   0.027388 172.31.8.238 -> 54.230.118.114 TCP 66 45977 > http [ACK] Seq=98 Ack=1051707 Win=1074944 Len=0 TSval=17713697 TSecr=1689833106
156   0.027524 54.230.118.114 -> 172.31.8.238 TCP 8754 [TCP segment of a reassembled PDU]
157   0.027531 172.31.8.238 -> 54.230.118.114 TCP 66 45977 > http [ACK] Seq=98 Ack=1060395 Win=1094016 Len=0 TSval=17713697 TSecr=1689833106
158   0.027684 54.230.118.114 -> 172.31.8.238 TCP 26130 [TCP segment of a reassembled PDU]
159   0.027710 172.31.8.238 -> 54.230.118.114 TCP 66 45977 > http [ACK] Seq=98 Ack=1086459 Win=1068032 Len=0 TSval=17713697 TSecr=1689833106
160   0.027762 54.230.118.114 -> 172.31.8.238 TCP 26130 [TCP segment of a reassembled PDU]
161   0.027791 172.31.8.238 -> 54.230.118.114 TCP 66 45977 > http [ACK] Seq=98 Ack=1112523 Win=1065472 Len=0 TSval=17713697 TSecr=1689833106
162   0.027817 54.230.118.114 -> 172.31.8.238 TCP 4410 [TCP segment of a reassembled PDU]
163   0.027823 172.31.8.238 -> 54.230.118.114 TCP 66 45977 > http [ACK] Seq=98 Ack=1116867 Win=1101056 Len=0 TSval=17713697 TSecr=1689833106
164   0.028019 54.230.118.114 -> 172.31.8.238 TCP 26130 [TCP segment of a reassembled PDU]
165   0.028046 172.31.8.238 -> 54.230.118.114 TCP 66 45977 > http [ACK] Seq=98 Ack=1142931 Win=1101056 Len=0 TSval=17713698 TSecr=1689833106
166   0.028110 54.230.118.114 -> 172.31.8.238 TCP 26130 [TCP segment of a reassembled PDU]
167   0.028124 172.31.8.238 -> 54.230.118.114 TCP 66 45977 > http [ACK] Seq=98 Ack=1168995 Win=1153152 Len=0 TSval=17713698 TSecr=1689833106
168   0.028157 54.230.118.114 -> 172.31.8.238 TCP 1514 [TCP segment of a reassembled PDU]
169   0.028161 172.31.8.238 -> 54.230.118.114 TCP 66 45977 > http [ACK] Seq=98 Ack=1170443 Win=1156096 Len=0 TSval=17713698 TSecr=1689833106
170   0.028446 54.230.118.114 -> 172.31.8.238 TCP 7306 [TCP segment of a reassembled PDU]
171   0.028454 172.31.8.238 -> 54.230.118.114 TCP 66 45977 > http [ACK] Seq=98 Ack=1177683 Win=1170560 Len=0 TSval=17713698 TSecr=1689833106
172   0.028570 54.230.118.114 -> 172.31.8.238 TCP 4410 [TCP segment of a reassembled PDU]
173   0.028576 172.31.8.238 -> 54.230.118.114 TCP 66 45977 > http [ACK] Seq=98 Ack=1182027 Win=1179264 Len=0 TSval=17713698 TSecr=1689833106
174   0.028708 54.230.118.114 -> 172.31.8.238 TCP 26130 [TCP segment of a reassembled PDU]
175   0.028722 172.31.8.238 -> 54.230.118.114 TCP 66 45977 > http [ACK] Seq=98 Ack=1208091 Win=1231360 Len=0 TSval=17713698 TSecr=1689833106
176   0.028766 54.230.118.114 -> 172.31.8.238 TCP 23234 [TCP segment of a reassembled PDU]
177   0.028780 172.31.8.238 -> 54.230.118.114 TCP 66 45977 > http [ACK] Seq=98 Ack=1231259 Win=1277696 Len=0 TSval=17713698 TSecr=1689833106
178   0.028903 54.230.118.114 -> 172.31.8.238 TCP 4410 [TCP segment of a reassembled PDU]
179   0.028909 172.31.8.238 -> 54.230.118.114 TCP 66 45977 > http [ACK] Seq=98 Ack=1235603 Win=1286400 Len=0 TSval=17713698 TSecr=1689833106
180   0.028926 54.230.118.114 -> 172.31.8.238 TCP 26130 [TCP segment of a reassembled PDU]
181   0.028950 172.31.8.238 -> 54.230.118.114 TCP 66 45977 > http [ACK] Seq=98 Ack=1261667 Win=1338496 Len=0 TSval=17713698 TSecr=1689833106
182   0.028982 54.230.118.114 -> 172.31.8.238 TCP 26130 [TCP segment of a reassembled PDU]
183   0.028995 172.31.8.238 -> 54.230.118.114 TCP 66 45977 > http [ACK] Seq=98 Ack=1287731 Win=1356032 Len=0 TSval=17713698 TSecr=1689833106
184   0.029114 54.230.118.114 -> 172.31.8.238 TCP 8754 [TCP segment of a reassembled PDU]
185   0.029121 172.31.8.238 -> 54.230.118.114 TCP 66 45977 > http [ACK] Seq=98 Ack=1296419 Win=1408000 Len=0 TSval=17713698 TSecr=1689833106
186   0.029246 54.230.118.114 -> 172.31.8.238 TCP 4410 [TCP segment of a reassembled PDU]
187   0.029253 172.31.8.238 -> 54.230.118.114 TCP 66 45977 > http [ACK] Seq=98 Ack=1300763 Win=1416704 Len=0 TSval=17713698 TSecr=1689833106
188   0.029370 54.230.118.114 -> 172.31.8.238 TCP 11650 [TCP segment of a reassembled PDU]
189   0.029379 172.31.8.238 -> 54.230.118.114 TCP 66 45977 > http [ACK] Seq=98 Ack=1312347 Win=1422720 Len=0 TSval=17713698 TSecr=1689833106
190   0.029624 54.230.118.114 -> 172.31.8.238 TCP 26130 [TCP segment of a reassembled PDU]
191   0.029649 172.31.8.238 -> 54.230.118.114 TCP 66 45977 > http [ACK] Seq=98 Ack=1338411 Win=1398912 Len=0 TSval=17713698 TSecr=1689833106
192   0.029696 54.230.118.114 -> 172.31.8.238 TCP 26130 [TCP segment of a reassembled PDU]
193   0.029710 172.31.8.238 -> 54.230.118.114 TCP 66 45977 > http [ACK] Seq=98 Ack=1364475 Win=1398912 Len=0 TSval=17713698 TSecr=1689833106
194   0.029781 54.230.118.114 -> 172.31.8.238 TCP 26130 [TCP segment of a reassembled PDU]
195   0.029794 172.31.8.238 -> 54.230.118.114 TCP 66 45977 > http [ACK] Seq=98 Ack=1390539 Win=1398912 Len=0 TSval=17713698 TSecr=1689833106
196   0.029867 54.230.118.114 -> 172.31.8.238 TCP 26130 [TCP segment of a reassembled PDU]
197   0.029880 172.31.8.238 -> 54.230.118.114 TCP 66 45977 > http [ACK] Seq=98 Ack=1416603 Win=1398912 Len=0 TSval=17713698 TSecr=1689833106
198   0.029927 54.230.118.114 -> 172.31.8.238 TCP 10202 [TCP segment of a reassembled PDU]
199   0.029935 172.31.8.238 -> 54.230.118.114 TCP 66 45977 > http [ACK] Seq=98 Ack=1426739 Win=1425024 Len=0 TSval=17713698 TSecr=1689833106
200   0.030000 54.230.118.114 -> 172.31.8.238 TCP 15994 [TCP segment of a reassembled PDU]
201   0.030126 172.31.8.238 -> 54.230.118.114 TCP 66 45977 > http [ACK] Seq=98 Ack=1442667 Win=1415424 Len=0 TSval=17713698 TSecr=1689833107
202   0.030489 54.230.118.114 -> 172.31.8.238 TCP 26130 [TCP segment of a reassembled PDU]
203   0.030515 172.31.8.238 -> 54.230.118.114 TCP 66 45977 > http [ACK] Seq=98 Ack=1468731 Win=1398912 Len=0 TSval=17713698 TSecr=1689833107
204   0.030561 54.230.118.114 -> 172.31.8.238 TCP 26130 [TCP segment of a reassembled PDU]
205   0.030574 172.31.8.238 -> 54.230.118.114 TCP 66 45977 > http [ACK] Seq=98 Ack=1494795 Win=1398912 Len=0 TSval=17713698 TSecr=1689833107
206   0.030629 54.230.118.114 -> 172.31.8.238 TCP 13098 [TCP segment of a reassembled PDU]
207   0.030638 172.31.8.238 -> 54.230.118.114 TCP 66 45977 > http [ACK] Seq=98 Ack=1507827 Win=1420288 Len=0 TSval=17713698 TSecr=1689833107
208   0.030717 54.230.118.114 -> 172.31.8.238 TCP 26130 [TCP segment of a reassembled PDU]
209   0.030742 172.31.8.238 -> 54.230.118.114 TCP 66 45977 > http [ACK] Seq=98 Ack=1533891 Win=1398912 Len=0 TSval=17713698 TSecr=1689833107
210   0.030800 54.230.118.114 -> 172.31.8.238 TCP 23234 [TCP segment of a reassembled PDU]
211   0.030812 172.31.8.238 -> 54.230.118.114 TCP 66 45977 > http [ACK] Seq=98 Ack=1557059 Win=1403648 Len=0 TSval=17713698 TSecr=1689833107
212   0.030852 54.230.118.114 -> 172.31.8.238 TCP 2962 [TCP segment of a reassembled PDU]
213   0.030857 54.230.118.114 -> 172.31.8.238 TCP 1514 [TCP Previous segment not captured] [TCP segment of a reassembled PDU]
214   0.030860 172.31.8.238 -> 54.230.118.114 TCP 78 45977 > http [ACK] Seq=98 Ack=1559955 Win=1400832 Len=0 TSval=17713698 TSecr=1689833107 SLE=1565747 SRE=1567195
215   0.030922 54.230.118.114 -> 172.31.8.238 TCP 1514 [TCP Out-Of-Order] [TCP segment of a reassembled PDU]
216   0.030927 172.31.8.238 -> 54.230.118.114 TCP 78 45977 > http [ACK] Seq=98 Ack=1561403 Win=1399424 Len=0 TSval=17713698 TSecr=1689833107 SLE=1565747 SRE=1567195
217   0.030932 54.230.118.114 -> 172.31.8.238 TCP 1514 [TCP segment of a reassembled PDU]
218   0.030934 172.31.8.238 -> 54.230.118.114 TCP 78 [TCP Dup ACK 216#1] 45977 > http [ACK] Seq=98 Ack=1561403 Win=1399424 Len=0 TSval=17713698 TSecr=1689833107 SLE=1565747 SRE=1568643
219   0.030976 54.230.118.114 -> 172.31.8.238 TCP 1514 [TCP Out-Of-Order] [TCP segment of a reassembled PDU]
220   0.030980 172.31.8.238 -> 54.230.118.114 TCP 78 45977 > http [ACK] Seq=98 Ack=1562851 Win=1398016 Len=0 TSval=17713698 TSecr=1689833107 SLE=1565747 SRE=1568643
221   0.031091 54.230.118.114 -> 172.31.8.238 TCP 1514 [TCP segment of a reassembled PDU]
222   0.031097 172.31.8.238 -> 54.230.118.114 TCP 78 [TCP Window Update] 45977 > http [ACK] Seq=98 Ack=1562851 Win=1434496 Len=0 TSval=17713698 TSecr=1689833107 SLE=1565747 SRE=1570091
223   0.031102 54.230.118.114 -> 172.31.8.238 TCP 1514 [TCP Out-Of-Order] [TCP segment of a reassembled PDU]
224   0.031105 172.31.8.238 -> 54.230.118.114 TCP 78 45977 > http [ACK] Seq=98 Ack=1564299 Win=1433088 Len=0 TSval=17713698 TSecr=1689833107 SLE=1565747 SRE=1570091
225   0.031163 54.230.118.114 -> 172.31.8.238 TCP 1514 [TCP segment of a reassembled PDU]
226   0.031167 172.31.8.238 -> 54.230.118.114 TCP 78 [TCP Dup ACK 224#1] 45977 > http [ACK] Seq=98 Ack=1564299 Win=1433088 Len=0 TSval=17713698 TSecr=1689833107 SLE=1565747 SRE=1571539
227   0.031172 54.230.118.114 -> 172.31.8.238 TCP 1514 [TCP Out-Of-Order] [TCP segment of a reassembled PDU]
228   0.031176 172.31.8.238 -> 54.230.118.114 TCP 66 45977 > http [ACK] Seq=98 Ack=1571539 Win=1429632 Len=0 TSval=17713698 TSecr=1689833107
229   0.031267 54.230.118.114 -> 172.31.8.238 TCP 1514 [TCP segment of a reassembled PDU]
230   0.031271 172.31.8.238 -> 54.230.118.114 TCP 66 45977 > http [ACK] Seq=98 Ack=1572987 Win=1436928 Len=0 TSval=17713698 TSecr=1689833107
231   0.031453 54.230.118.114 -> 172.31.8.238 TCP 26130 [TCP segment of a reassembled PDU]
232   0.031466 172.31.8.238 -> 54.230.118.114 TCP 66 45977 > http [ACK] Seq=98 Ack=1599051 Win=1410944 Len=0 TSval=17713698 TSecr=1689833107
233   0.031523 54.230.118.114 -> 172.31.8.238 TCP 20338 [TCP segment of a reassembled PDU]
234   0.031534 172.31.8.238 -> 54.230.118.114 TCP 66 45977 > http [ACK] Seq=98 Ack=1619323 Win=1408384 Len=0 TSval=17713698 TSecr=1689833107
235   0.031607 54.230.118.114 -> 172.31.8.238 TCP 31922 [TCP segment of a reassembled PDU]
236   0.031622 172.31.8.238 -> 54.230.118.114 TCP 66 45977 > http [ACK] Seq=98 Ack=1651179 Win=1389312 Len=0 TSval=17713698 TSecr=1689833107
237   0.031679 54.230.118.114 -> 172.31.8.238 TCP 24682 [TCP segment of a reassembled PDU]
238   0.031691 172.31.8.238 -> 54.230.118.114 TCP 66 45977 > http [ACK] Seq=98 Ack=1675795 Win=1401216 Len=0 TSval=17713698 TSecr=1689833107
239   0.031816 54.230.118.114 -> 172.31.8.238 TCP 27578 [TCP segment of a reassembled PDU]
240   0.031829 172.31.8.238 -> 54.230.118.114 TCP 66 45977 > http [ACK] Seq=98 Ack=1703307 Win=1373824 Len=0 TSval=17713698 TSecr=1689833107
241   0.031838 54.230.118.114 -> 172.31.8.238 TCP 5858 [TCP Out-Of-Order] [TCP segment of a reassembled PDU]
242   0.031842 172.31.8.238 -> 54.230.118.114 TCP 78 [TCP Dup ACK 240#1] 45977 > http [ACK] Seq=98 Ack=1703307 Win=1373824 Len=0 TSval=17713698 TSecr=1689833107 SLE=1559955 SRE=1565747
243   0.031966 54.230.118.114 -> 172.31.8.238 TCP 2962 [TCP segment of a reassembled PDU]
244   0.031972 172.31.8.238 -> 54.230.118.114 TCP 66 45977 > http [ACK] Seq=98 Ack=1706203 Win=1442688 Len=0 TSval=17713699 TSecr=1689833107
245   0.032119 54.230.118.114 -> 172.31.8.238 TCP 23234 [TCP segment of a reassembled PDU]
246   0.032131 172.31.8.238 -> 54.230.118.114 TCP 66 45977 > http [ACK] Seq=98 Ack=1729371 Win=1489024 Len=0 TSval=17713699 TSecr=1689833107
247   0.032359 54.230.118.114 -> 172.31.8.238 TCP 26130 [TCP segment of a reassembled PDU]
248   0.032372 172.31.8.238 -> 54.230.118.114 TCP 66 45977 > http [ACK] Seq=98 Ack=1755435 Win=1541120 Len=0 TSval=17713699 TSecr=1689833107
249   0.033026 54.230.118.114 -> 172.31.8.238 TCP 4410 [TCP segment of a reassembled PDU]
250   0.033032 172.31.8.238 -> 54.230.118.114 TCP 66 45977 > http [ACK] Seq=98 Ack=1759779 Win=1549824 Len=0 TSval=17713699 TSecr=1689833107
251   0.034330 54.230.118.114 -> 172.31.8.238 TCP 4410 [TCP segment of a reassembled PDU]
252   0.034336 172.31.8.238 -> 54.230.118.114 TCP 66 45977 > http [ACK] Seq=98 Ack=1764123 Win=1558528 Len=0 TSval=17713699 TSecr=1689833107
253   0.034814 54.230.118.114 -> 172.31.8.238 TCP 4410 [TCP segment of a reassembled PDU]
254   0.034820 172.31.8.238 -> 54.230.118.114 TCP 66 45977 > http [ACK] Seq=98 Ack=1768467 Win=1567232 Len=0 TSval=17713699 TSecr=1689833107
255   0.035331 54.230.118.114 -> 172.31.8.238 TCP 5858 [TCP segment of a reassembled PDU]
256   0.035336 172.31.8.238 -> 54.230.118.114 TCP 66 45977 > http [ACK] Seq=98 Ack=1774259 Win=1578752 Len=0 TSval=17713699 TSecr=1689833107
257   0.035839 54.230.118.114 -> 172.31.8.238 TCP 2962 [TCP segment of a reassembled PDU]
258   0.035844 172.31.8.238 -> 54.230.118.114 TCP 66 45977 > http [ACK] Seq=98 Ack=1777155 Win=1578752 Len=0 TSval=17713699 TSecr=1689833107
259   0.035967 54.230.118.114 -> 172.31.8.238 TCP 2962 [TCP segment of a reassembled PDU]
260   0.035972 172.31.8.238 -> 54.230.118.114 TCP 66 45977 > http [ACK] Seq=98 Ack=1780051 Win=1578752 Len=0 TSval=17713700 TSecr=1689833107
261   0.036338 54.230.118.114 -> 172.31.8.238 TCP 2962 [TCP segment of a reassembled PDU]
262   0.036343 172.31.8.238 -> 54.230.118.114 TCP 66 45977 > http [ACK] Seq=98 Ack=1782947 Win=1578752 Len=0 TSval=17713700 TSecr=1689833107
263   0.036664 54.230.118.114 -> 172.31.8.238 TCP 2962 [TCP segment of a reassembled PDU]
264   0.036669 172.31.8.238 -> 54.230.118.114 TCP 66 45977 > http [ACK] Seq=98 Ack=1785843 Win=1578752 Len=0 TSval=17713700 TSecr=1689833107
265   0.036911 54.230.118.114 -> 172.31.8.238 TCP 4410 [TCP segment of a reassembled PDU]
266   0.036916 172.31.8.238 -> 54.230.118.114 TCP 66 45977 > http [ACK] Seq=98 Ack=1790187 Win=1578752 Len=0 TSval=17713700 TSecr=1689833107
267   0.037175 54.230.118.114 -> 172.31.8.238 TCP 2962 [TCP segment of a reassembled PDU]
268   0.037181 172.31.8.238 -> 54.230.118.114 TCP 66 45977 > http [ACK] Seq=98 Ack=1793083 Win=1578752 Len=0 TSval=17713700 TSecr=1689833107
269   0.037465 54.230.118.114 -> 172.31.8.238 TCP 4410 [TCP segment of a reassembled PDU]
270   0.037470 172.31.8.238 -> 54.230.118.114 TCP 66 45977 > http [ACK] Seq=98 Ack=1797427 Win=1578752 Len=0 TSval=17713700 TSecr=1689833107
271   0.037623 54.230.118.114 -> 172.31.8.238 TCP 2962 [TCP segment of a reassembled PDU]
272   0.037628 172.31.8.238 -> 54.230.118.114 TCP 66 45977 > http [ACK] Seq=98 Ack=1800323 Win=1578752 Len=0 TSval=17713700 TSecr=1689833107
273   0.037980 54.230.118.114 -> 172.31.8.238 TCP 4410 [TCP segment of a reassembled PDU]
274   0.037986 172.31.8.238 -> 54.230.118.114 TCP 66 45977 > http [ACK] Seq=98 Ack=1804667 Win=1578752 Len=0 TSval=17713700 TSecr=1689833107
275   0.038140 54.230.118.114 -> 172.31.8.238 TCP 2962 [TCP segment of a reassembled PDU]
276   0.038145 172.31.8.238 -> 54.230.118.114 TCP 66 45977 > http [ACK] Seq=98 Ack=1807563 Win=1578752 Len=0 TSval=17713700 TSecr=1689833107
277   0.038640 54.230.118.114 -> 172.31.8.238 TCP 5858 [TCP segment of a reassembled PDU]
278   0.038646 172.31.8.238 -> 54.230.118.114 TCP 66 45977 > http [ACK] Seq=98 Ack=1813355 Win=1578752 Len=0 TSval=17713700 TSecr=1689833107
279   0.038766 54.230.118.114 -> 172.31.8.238 TCP 2962 [TCP segment of a reassembled PDU]
280   0.038771 172.31.8.238 -> 54.230.118.114 TCP 66 45977 > http [ACK] Seq=98 Ack=1816251 Win=1578752 Len=0 TSval=17713700 TSecr=1689833107
281   0.039211 54.230.118.114 -> 172.31.8.238 TCP 5858 [TCP segment of a reassembled PDU]
282   0.039217 172.31.8.238 -> 54.230.118.114 TCP 66 45977 > http [ACK] Seq=98 Ack=1822043 Win=1578752 Len=0 TSval=17713700 TSecr=1689833107
283   0.039444 54.230.118.114 -> 172.31.8.238 TCP 2962 [TCP segment of a reassembled PDU]
284   0.039449 172.31.8.238 -> 54.230.118.114 TCP 66 45977 > http [ACK] Seq=98 Ack=1824939 Win=1578752 Len=0 TSval=17713700 TSecr=1689833107
285   0.039719 54.230.118.114 -> 172.31.8.238 TCP 5858 [TCP segment of a reassembled PDU]
286   0.039725 172.31.8.238 -> 54.230.118.114 TCP 66 45977 > http [ACK] Seq=98 Ack=1830731 Win=1578752 Len=0 TSval=17713700 TSecr=1689833108
287   0.040209 54.230.118.114 -> 172.31.8.238 TCP 2962 [TCP segment of a reassembled PDU]
288   0.040214 172.31.8.238 -> 54.230.118.114 TCP 66 45977 > http [ACK] Seq=98 Ack=1833627 Win=1578752 Len=0 TSval=17713701 TSecr=1689833108
289   0.040348 54.230.118.114 -> 172.31.8.238 TCP 5858 [TCP segment of a reassembled PDU]
290   0.040354 172.31.8.238 -> 54.230.118.114 TCP 66 45977 > http [ACK] Seq=98 Ack=1839419 Win=1578752 Len=0 TSval=17713701 TSecr=1689833108
291   0.040714 54.230.118.114 -> 172.31.8.238 TCP 4410 [TCP segment of a reassembled PDU]
292   0.040719 172.31.8.238 -> 54.230.118.114 TCP 66 45977 > http [ACK] Seq=98 Ack=1843763 Win=1578752 Len=0 TSval=17713701 TSecr=1689833108
293   0.040979 54.230.118.114 -> 172.31.8.238 TCP 5858 [TCP segment of a reassembled PDU]
294   0.040985 172.31.8.238 -> 54.230.118.114 TCP 66 45977 > http [ACK] Seq=98 Ack=1849555 Win=1578752 Len=0 TSval=17713701 TSecr=1689833108
295   0.041251 54.230.118.114 -> 172.31.8.238 TCP 4410 [TCP segment of a reassembled PDU]
296   0.041257 172.31.8.238 -> 54.230.118.114 TCP 66 45977 > http [ACK] Seq=98 Ack=1853899 Win=1578752 Len=0 TSval=17713701 TSecr=1689833108
297   0.041513 54.230.118.114 -> 172.31.8.238 TCP 5858 [TCP segment of a reassembled PDU]
298   0.041518 172.31.8.238 -> 54.230.118.114 TCP 66 45977 > http [ACK] Seq=98 Ack=1859691 Win=1578752 Len=0 TSval=17713701 TSecr=1689833108
299   0.041773 54.230.118.114 -> 172.31.8.238 TCP 4410 [TCP segment of a reassembled PDU]
300   0.041779 172.31.8.238 -> 54.230.118.114 TCP 66 45977 > http [ACK] Seq=98 Ack=1864035 Win=1578752 Len=0 TSval=17713701 TSecr=1689833108
301   0.042036 54.230.118.114 -> 172.31.8.238 TCP 5858 [TCP segment of a reassembled PDU]
302   0.042041 172.31.8.238 -> 54.230.118.114 TCP 66 45977 > http [ACK] Seq=98 Ack=1869827 Win=1578752 Len=0 TSval=17713701 TSecr=1689833108
303   0.042299 54.230.118.114 -> 172.31.8.238 TCP 4410 [TCP segment of a reassembled PDU]
304   0.042304 172.31.8.238 -> 54.230.118.114 TCP 66 45977 > http [ACK] Seq=98 Ack=1874171 Win=1578752 Len=0 TSval=17713701 TSecr=1689833108
305   0.042565 54.230.118.114 -> 172.31.8.238 TCP 5858 [TCP segment of a reassembled PDU]
306   0.042570 172.31.8.238 -> 54.230.118.114 TCP 66 45977 > http [ACK] Seq=98 Ack=1879963 Win=1578752 Len=0 TSval=17713701 TSecr=1689833108
307   0.042838 54.230.118.114 -> 172.31.8.238 TCP 5858 [TCP segment of a reassembled PDU]
308   0.042843 172.31.8.238 -> 54.230.118.114 TCP 66 45977 > http [ACK] Seq=98 Ack=1885755 Win=1578752 Len=0 TSval=17713701 TSecr=1689833108
309   0.043121 54.230.118.114 -> 172.31.8.238 TCP 5858 [TCP segment of a reassembled PDU]
310   0.043126 172.31.8.238 -> 54.230.118.114 TCP 66 45977 > http [ACK] Seq=98 Ack=1891547 Win=1578752 Len=0 TSval=17713701 TSecr=1689833108
311   0.043271 54.230.118.114 -> 172.31.8.238 TCP 4410 [TCP segment of a reassembled PDU]
312   0.043275 172.31.8.238 -> 54.230.118.114 TCP 66 45977 > http [ACK] Seq=98 Ack=1895891 Win=1578752 Len=0 TSval=17713701 TSecr=1689833108
313   0.043381 54.230.118.114 -> 172.31.8.238 TCP 1514 [TCP segment of a reassembled PDU]
314   0.043895 54.230.118.114 -> 172.31.8.238 TCP 7306 [TCP segment of a reassembled PDU]
315   0.043900 172.31.8.238 -> 54.230.118.114 TCP 66 45977 > http [ACK] Seq=98 Ack=1904579 Win=1578752 Len=0 TSval=17713702 TSecr=1689833108
316   0.043998 54.230.118.114 -> 172.31.8.238 TCP 2962 [TCP segment of a reassembled PDU]
317   0.044015 172.31.8.238 -> 54.230.118.114 TCP 66 45977 > http [ACK] Seq=98 Ack=1907475 Win=1578752 Len=0 TSval=17713702 TSecr=1689833108
318   0.044518 54.230.118.114 -> 172.31.8.238 TCP 5858 [TCP segment of a reassembled PDU]
319   0.044523 172.31.8.238 -> 54.230.118.114 TCP 66 45977 > http [ACK] Seq=98 Ack=1913267 Win=1578752 Len=0 TSval=17713702 TSecr=1689833108
320   0.044628 54.230.118.114 -> 172.31.8.238 TCP 2962 [TCP segment of a reassembled PDU]
321   0.044632 172.31.8.238 -> 54.230.118.114 TCP 66 45977 > http [ACK] Seq=98 Ack=1916163 Win=1578752 Len=0 TSval=17713702 TSecr=1689833108
322   0.045068 54.230.118.114 -> 172.31.8.238 TCP 5858 [TCP segment of a reassembled PDU]
323   0.045073 172.31.8.238 -> 54.230.118.114 TCP 66 45977 > http [ACK] Seq=98 Ack=1921955 Win=1578752 Len=0 TSval=17713702 TSecr=1689833108
324   0.045194 54.230.118.114 -> 172.31.8.238 TCP 2962 [TCP segment of a reassembled PDU]
325   0.045198 172.31.8.238 -> 54.230.118.114 TCP 66 45977 > http [ACK] Seq=98 Ack=1924851 Win=1578752 Len=0 TSval=17713702 TSecr=1689833108
326   0.045543 54.230.118.114 -> 172.31.8.238 TCP 7306 [TCP segment of a reassembled PDU]
327   0.045548 172.31.8.238 -> 54.230.118.114 TCP 66 45977 > http [ACK] Seq=98 Ack=1932091 Win=1578752 Len=0 TSval=17713702 TSecr=1689833108
328   0.045661 54.230.118.114 -> 172.31.8.238 TCP 2962 [TCP segment of a reassembled PDU]
329   0.045665 172.31.8.238 -> 54.230.118.114 TCP 66 45977 > http [ACK] Seq=98 Ack=1934987 Win=1578752 Len=0 TSval=17713702 TSecr=1689833108
330   0.046058 54.230.118.114 -> 172.31.8.238 TCP 5858 [TCP segment of a reassembled PDU]
331   0.046063 172.31.8.238 -> 54.230.118.114 TCP 66 45977 > http [ACK] Seq=98 Ack=1940779 Win=1578752 Len=0 TSval=17713702 TSecr=1689833108
332   0.046194 54.230.118.114 -> 172.31.8.238 TCP 4410 [TCP segment of a reassembled PDU]
333   0.046198 172.31.8.238 -> 54.230.118.114 TCP 66 45977 > http [ACK] Seq=98 Ack=1945123 Win=1578752 Len=0 TSval=17713702 TSecr=1689833108
334   0.046605 54.230.118.114 -> 172.31.8.238 TCP 2962 [TCP segment of a reassembled PDU]
335   0.046610 172.31.8.238 -> 54.230.118.114 TCP 66 45977 > http [ACK] Seq=98 Ack=1948019 Win=1578752 Len=0 TSval=17713702 TSecr=1689833108
336   0.046745 54.230.118.114 -> 172.31.8.238 TCP 10202 [TCP segment of a reassembled PDU]
337   0.046750 172.31.8.238 -> 54.230.118.114 TCP 66 45977 > http [ACK] Seq=98 Ack=1958155 Win=1578752 Len=0 TSval=17713702 TSecr=1689833108
338   0.047417 54.230.118.114 -> 172.31.8.238 TCP 5858 [TCP segment of a reassembled PDU]
339   0.047422 172.31.8.238 -> 54.230.118.114 TCP 66 45977 > http [ACK] Seq=98 Ack=1963947 Win=1578752 Len=0 TSval=17713702 TSecr=1689833108
340   0.047549 54.230.118.114 -> 172.31.8.238 TCP 7306 [TCP segment of a reassembled PDU]
341   0.047555 172.31.8.238 -> 54.230.118.114 TCP 66 45977 > http [ACK] Seq=98 Ack=1971187 Win=1578752 Len=0 TSval=17713702 TSecr=1689833108
342   0.047905 54.230.118.114 -> 172.31.8.238 TCP 5858 [TCP segment of a reassembled PDU]
