[Measurement for 1kb at 08:00:14 17.00.2014] 
Tshark:

  1   0.000000  192.168.1.2 -> 54.230.99.196 TCP 66 50596→80 [SYN] Seq=0 Win=8192 Len=0 MSS=1460 WS=256 SACK_PERM=1
  2   0.047432 54.230.99.196 -> 192.168.1.2  TCP 66 80→50596 [SYN, ACK] Seq=0 Ack=1 Win=14600 Len=0 MSS=1400 SACK_PERM=1 WS=128
  3   0.047568  192.168.1.2 -> 54.230.99.196 TCP 54 50596→80 [ACK] Seq=1 Ack=1 Win=65792 Len=0
  4   0.047713  192.168.1.2 -> 54.230.99.196 HTTP 150 GET /1kb HTTP/1.1 
  5   0.077170 54.230.99.196 -> 192.168.1.2  TCP 54 80→50596 [ACK] Seq=1 Ack=97 Win=14720 Len=0
  6   0.078317 54.230.99.196 -> 192.168.1.2  TCP 1454 [TCP segment of a reassembled PDU]
  7   0.079177 54.230.99.196 -> 192.168.1.2  HTTP 132 HTTP/1.1 200 OK  (application/octet-stream)
  8   0.079260  192.168.1.2 -> 54.230.99.196 TCP 54 50596→80 [ACK] Seq=97 Ack=1479 Win=65792 Len=0
  9   0.079352  192.168.1.2 -> 54.230.99.196 TCP 54 50596→80 [FIN, ACK] Seq=97 Ack=1479 Win=65792 Len=0
 10   0.106340 54.230.99.196 -> 192.168.1.2  TCP 54 80→50596 [FIN, ACK] Seq=1479 Ack=98 Win=14720 Len=0
 11   0.106474  192.168.1.2 -> 54.230.99.196 TCP 54 50596→80 [ACK] Seq=98 Ack=1480 Win=65792 Len=0
