[Measurement for 1kb at 23:00:14 16.00.2014] 
Tshark:

  1   0.000000 HuaweiTe_25:83:d4 -> IntelCor_3f:fc:98 ARP 42 Who has 192.168.1.2?  Tell 192.168.1.1
  2   0.000039 IntelCor_3f:fc:98 -> HuaweiTe_25:83:d4 ARP 42 192.168.1.2 is at 00:24:d7:3f:fc:98
  3   1.180654  192.168.1.2 -> 54.230.99.37 TCP 66 49465→80 [SYN] Seq=0 Win=8192 Len=0 MSS=1460 WS=256 SACK_PERM=1
  4   1.231861 54.230.99.37 -> 192.168.1.2  TCP 66 80→49465 [SYN, ACK] Seq=0 Ack=1 Win=14600 Len=0 MSS=1400 SACK_PERM=1 WS=128
  5   1.231997  192.168.1.2 -> 54.230.99.37 TCP 54 49465→80 [ACK] Seq=1 Ack=1 Win=65792 Len=0
  6   1.232146  192.168.1.2 -> 54.230.99.37 HTTP 150 GET /1kb HTTP/1.1 
  7   1.273038 54.230.99.37 -> 192.168.1.2  TCP 54 80→49465 [ACK] Seq=1 Ack=97 Win=14720 Len=0
  8   1.277227 54.230.99.37 -> 192.168.1.2  TCP 1454 [TCP segment of a reassembled PDU]
  9   1.277900 54.230.99.37 -> 192.168.1.2  HTTP 132 HTTP/1.1 200 OK  (application/octet-stream)
 10   1.277983  192.168.1.2 -> 54.230.99.37 TCP 54 49465→80 [ACK] Seq=97 Ack=1479 Win=65792 Len=0
 11   1.278118  192.168.1.2 -> 54.230.99.37 TCP 54 49465→80 [FIN, ACK] Seq=97 Ack=1479 Win=65792 Len=0
 12   1.313267 54.230.99.37 -> 192.168.1.2  TCP 54 80→49465 [FIN, ACK] Seq=1479 Ack=98 Win=14720 Len=0
 13   1.313416  192.168.1.2 -> 54.230.99.37 TCP 54 49465→80 [ACK] Seq=98 Ack=1480 Win=65792 Len=0
