[Measurement for 1kb at 21:00:15 16.00.2014] 
Tshark:

  1   0.000000 64.233.164.95 -> 192.168.1.2  TLSv1.2 111 Application Data
  2   0.000583 64.233.164.95 -> 192.168.1.2  TLSv1.2 91 Application Data
  3   0.000642  192.168.1.2 -> 64.233.164.95 TCP 54 65019→443 [ACK] Seq=1 Ack=95 Win=255 Len=0
  4   0.000754 64.233.164.95 -> 192.168.1.2  TCP 54 443→65019 [FIN, ACK] Seq=95 Ack=1 Win=361 Len=0
  5   0.000772  192.168.1.2 -> 64.233.164.95 TCP 54 65019→443 [ACK] Seq=1 Ack=96 Win=255 Len=0
  6   0.000941  192.168.1.2 -> 64.233.164.95 TCP 54 65019→443 [FIN, ACK] Seq=1 Ack=96 Win=255 Len=0
  7   0.060387 64.233.164.95 -> 192.168.1.2  TCP 54 443→65019 [ACK] Seq=96 Ack=2 Win=361 Len=0
  8   0.158487 64.233.164.141 -> 192.168.1.2  TCP 54 80→65023 [FIN, ACK] Seq=1 Ack=1 Win=344 Len=0
  9   0.158567  192.168.1.2 -> 64.233.164.141 TCP 54 65023→80 [ACK] Seq=1 Ack=2 Win=257 Len=0
 10   0.234838 74.125.230.114 -> 192.168.1.2  TLSv1.2 111 Application Data
 11   0.235366 74.125.230.114 -> 192.168.1.2  TLSv1.2 91 Application Data
 12   0.235460  192.168.1.2 -> 74.125.230.114 TCP 54 64996→443 [ACK] Seq=1 Ack=96 Win=409 Len=0
 13   0.235763  192.168.1.2 -> 74.125.230.114 TCP 54 64996→443 [FIN, ACK] Seq=1 Ack=96 Win=409 Len=0
 14   0.261662 64.233.164.141 -> 192.168.1.2  TCP 54 80→64998 [FIN, ACK] Seq=1 Ack=1 Win=352 Len=0
 15   0.261714  192.168.1.2 -> 64.233.164.141 TCP 54 64998→80 [ACK] Seq=1 Ack=2 Win=252 Len=0
 16   0.277551 54.235.136.252 -> 192.168.1.2  TCP 54 80→65049 [FIN, ACK] Seq=1 Ack=1 Win=62 Len=0
 17   0.277640  192.168.1.2 -> 54.235.136.252 TCP 54 65049→80 [ACK] Seq=1 Ack=2 Win=255 Len=0
 18   0.307078 74.125.230.114 -> 192.168.1.2  TCP 54 443→64996 [ACK] Seq=96 Ack=2 Win=615 Len=0
 19   0.308452  192.168.1.2 -> 193.184.164.137 SSL 55 Continuation Data
 20   0.327482 193.184.164.137 -> 192.168.1.2  TCP 66 443→64949 [ACK] Seq=1 Ack=2 Win=780 Len=0 SLE=1 SRE=2
 21   0.431481  192.168.1.2 -> 193.184.164.137 SSL 55 Continuation Data
 22   0.452523 193.184.164.137 -> 192.168.1.2  TCP 66 443→64948 [ACK] Seq=1 Ack=2 Win=916 Len=0 SLE=1 SRE=2
 23   0.624711 64.233.164.141 -> 192.168.1.2  TCP 54 80→65025 [FIN, ACK] Seq=1 Ack=1 Win=345 Len=0
 24   0.624789  192.168.1.2 -> 64.233.164.141 TCP 54 65025→80 [ACK] Seq=1 Ack=2 Win=255 Len=0
 25   0.897932  192.168.1.2 -> 64.233.164.121 TCP 54 64989→80 [FIN, ACK] Seq=1 Ack=1 Win=255 Len=0
 26   0.898159  192.168.1.2 -> 64.233.164.121 TCP 54 65012→80 [FIN, ACK] Seq=1 Ack=1 Win=257 Len=0
 27   0.898308  192.168.1.2 -> 64.233.164.141 TCP 54 65023→80 [FIN, ACK] Seq=1 Ack=2 Win=257 Len=0
 28   0.898452  192.168.1.2 -> 64.233.164.141 TCP 54 65025→80 [FIN, ACK] Seq=1 Ack=2 Win=255 Len=0
 29   0.898597  192.168.1.2 -> 64.233.164.141 TCP 54 64997→80 [FIN, ACK] Seq=1 Ack=1 Win=257 Len=0
 30   0.898735  192.168.1.2 -> 64.233.164.141 TCP 54 64998→80 [FIN, ACK] Seq=1 Ack=2 Win=252 Len=0
 31   0.898876  192.168.1.2 -> 64.233.164.141 TCP 54 64984→80 [FIN, ACK] Seq=1 Ack=1 Win=253 Len=0
 32   0.899146  192.168.1.2 -> 54.235.136.252 TCP 54 65049→80 [FIN, ACK] Seq=1 Ack=2 Win=255 Len=0
 33   0.949267 64.233.164.121 -> 192.168.1.2  TCP 54 80→64989 [ACK] Seq=1 Ack=2 Win=446 Len=0
 34   0.950105 64.233.164.141 -> 192.168.1.2  TCP 54 80→65023 [ACK] Seq=2 Ack=2 Win=344 Len=0
 35   0.954059 64.233.164.121 -> 192.168.1.2  TCP 54 80→65012 [ACK] Seq=1 Ack=2 Win=373 Len=0
 36   0.954664 64.233.164.141 -> 192.168.1.2  TCP 54 80→65025 [ACK] Seq=2 Ack=2 Win=345 Len=0
 37   0.963569 64.233.164.141 -> 192.168.1.2  TCP 54 80→64984 [ACK] Seq=1 Ack=2 Win=352 Len=0
 38   0.964598 64.233.164.141 -> 192.168.1.2  TCP 54 80→64997 [ACK] Seq=1 Ack=2 Win=344 Len=0
 39   0.965625 64.233.164.141 -> 192.168.1.2  TCP 54 80→64998 [ACK] Seq=2 Ack=2 Win=352 Len=0
 40   1.068350 54.235.136.252 -> 192.168.1.2  TCP 54 80→65049 [ACK] Seq=2 Ack=2 Win=62 Len=0
 41   1.149124  192.168.1.2 -> 193.184.164.136 TCP 54 64961→443 [FIN, ACK] Seq=1 Ack=1 Win=252 Len=0
 42   1.149517  192.168.1.2 -> 82.96.58.62  TCP 54 64953→443 [FIN, ACK] Seq=1 Ack=1 Win=256 Len=0
 43   1.175978 193.184.164.136 -> 192.168.1.2  TLSv1.2 81 Encrypted Alert
 44   1.176055  192.168.1.2 -> 193.184.164.136 TCP 54 64961→443 [RST, ACK] Seq=2 Ack=28 Win=0 Len=0
 45   1.176757 193.184.164.136 -> 192.168.1.2  TCP 54 443→64961 [FIN, ACK] Seq=28 Ack=2 Win=557 Len=0
 46   1.189376  192.168.1.2 -> 54.230.99.53 TCP 66 65107→80 [SYN] Seq=0 Win=8192 Len=0 MSS=1460 WS=256 SACK_PERM=1
 47   1.190960  82.96.58.62 -> 192.168.1.2  TCP 54 443→64953 [ACK] Seq=1 Ack=2 Win=633 Len=0
 48   1.216829 54.230.99.53 -> 192.168.1.2  TCP 66 80→65107 [SYN, ACK] Seq=0 Ack=1 Win=14600 Len=0 MSS=1400 SACK_PERM=1 WS=128
 49   1.216956  192.168.1.2 -> 54.230.99.53 TCP 54 65107→80 [ACK] Seq=1 Ack=1 Win=65792 Len=0
 50   1.217237  192.168.1.2 -> 54.230.99.53 HTTP 150 GET /1kb HTTP/1.1 
 51   1.243984 54.230.99.53 -> 192.168.1.2  TCP 54 80→65107 [ACK] Seq=1 Ack=97 Win=14720 Len=0
 52   1.248446 54.230.99.53 -> 192.168.1.2  TCP 1454 [TCP segment of a reassembled PDU]
 53   1.249068 54.230.99.53 -> 192.168.1.2  HTTP 132 HTTP/1.1 200 OK  (application/octet-stream)
 54   1.249139  192.168.1.2 -> 54.230.99.53 TCP 54 65107→80 [ACK] Seq=97 Ack=1479 Win=65792 Len=0
 55   1.249248  192.168.1.2 -> 54.230.99.53 TCP 54 65107→80 [FIN, ACK] Seq=97 Ack=1479 Win=65792 Len=0
 56   1.285497 54.230.99.53 -> 192.168.1.2  TCP 54 80→65107 [FIN, ACK] Seq=1479 Ack=98 Win=14720 Len=0
 57   1.285610  192.168.1.2 -> 54.230.99.53 TCP 54 65107→80 [ACK] Seq=98 Ack=1480 Win=65792 Len=0
 58   1.309179  192.168.1.2 -> 108.162.204.152 TCP 55 65061→80 [ACK] Seq=1 Ack=1 Win=254 Len=1
 59   1.362003 108.162.204.152 -> 192.168.1.2  TCP 66 80→65061 [ACK] Seq=1 Ack=2 Win=29 Len=0 SLE=1 SRE=2
 60   1.490695 64.233.164.121 -> 192.168.1.2  TCP 54 80→65013 [FIN, ACK] Seq=1 Ack=1 Win=454 Len=0
 61   1.490774  192.168.1.2 -> 64.233.164.121 TCP 54 65013→80 [ACK] Seq=1 Ack=2 Win=254 Len=0
 62   1.779534  192.168.1.2 -> 74.125.205.188 SSL 55 Continuation Data
 63   1.830523 74.125.205.188 -> 192.168.1.2  TCP 66 443→63043 [ACK] Seq=1 Ack=2 Win=361 Len=0 SLE=1 SRE=2
 64   2.314869 108.162.204.152 -> 192.168.1.2  TCP 54 80→65061 [FIN, ACK] Seq=1 Ack=2 Win=29 Len=0
 65   2.314946  192.168.1.2 -> 108.162.204.152 TCP 54 65061→80 [ACK] Seq=2 Ack=2 Win=254 Len=0
 66   2.380082  192.168.1.2 -> 108.162.204.152 TCP 55 65099→80 [ACK] Seq=1 Ack=1 Win=255 Len=1
 67   2.435481 108.162.204.152 -> 192.168.1.2  TCP 66 80→65099 [ACK] Seq=1 Ack=2 Win=16 Len=0 SLE=1 SRE=2
 68   2.535160  192.168.1.2 -> 108.162.204.152 TCP 55 65091→80 [ACK] Seq=1 Ack=1 Win=255 Len=1
 69   2.590562 108.162.204.152 -> 192.168.1.2  TCP 66 80→65091 [ACK] Seq=1 Ack=2 Win=16 Len=0 SLE=1 SRE=2
