[Measurement for 10mb at 23:35:26 19.35.2014] 
Tshark:

  1   0.000000 172.31.29.138 -> 172.31.0.2   DNS 89 Standard query 0x3512  A d39wppo36gwqpx.cloudfront.net
  2   0.000042 172.31.29.138 -> 172.31.0.2   DNS 89 Standard query 0xaf34  AAAA d39wppo36gwqpx.cloudfront.net
  3   0.000812   172.31.0.2 -> 172.31.29.138 DNS 170 Standard query response 0xaf34 
  4   0.000822   172.31.0.2 -> 172.31.29.138 DNS 217 Standard query response 0x3512  A 54.230.159.132 A 54.230.159.153 A 54.192.157.144 A 54.192.159.174 A 54.230.157.230 A 54.230.158.139 A 54.230.158.241 A 54.230.159.7
  5   0.003894 172.31.29.138 -> 54.230.159.132 TCP 74 51198 > http [SYN] Seq=0 Win=26883 Len=0 MSS=8961 SACK_PERM=1 TSval=5999818 TSecr=0 WS=128
  6   0.004614 54.230.159.132 -> 172.31.29.138 TCP 74 http > 51198 [SYN, ACK] Seq=0 Ack=1 Win=14480 Len=0 MSS=1460 SACK_PERM=1 TSval=830906432 TSecr=5999818 WS=128
  7   0.004628 172.31.29.138 -> 54.230.159.132 TCP 66 51198 > http [ACK] Seq=1 Ack=1 Win=27008 Len=0 TSval=5999819 TSecr=830906432
  8   0.004674 172.31.29.138 -> 54.230.159.132 HTTP 163 GET /10mb HTTP/1.1 
  9   0.005278 54.230.159.132 -> 172.31.29.138 TCP 66 http > 51198 [ACK] Seq=1 Ack=98 Win=14592 Len=0 TSval=830906433 TSecr=5999819
 10   0.007160 54.230.159.132 -> 172.31.29.138 TCP 524 [TCP segment of a reassembled PDU]
 11   0.007166 172.31.29.138 -> 54.230.159.132 TCP 66 51198 > http [ACK] Seq=98 Ack=459 Win=28032 Len=0 TSval=5999819 TSecr=830906433
 12   0.007238 54.230.159.132 -> 172.31.29.138 TCP 8754 [TCP segment of a reassembled PDU]
 13   0.007246 172.31.29.138 -> 54.230.159.132 TCP 66 51198 > http [ACK] Seq=98 Ack=9147 Win=45440 Len=0 TSval=5999819 TSecr=830906433
 14   0.007443 54.230.159.132 -> 172.31.29.138 TCP 4410 [TCP segment of a reassembled PDU]
 15   0.007449 172.31.29.138 -> 54.230.159.132 TCP 66 51198 > http [ACK] Seq=98 Ack=13491 Win=54144 Len=0 TSval=5999819 TSecr=830906433
 16   0.007996 54.230.159.132 -> 172.31.29.138 TCP 4410 [TCP segment of a reassembled PDU]
 17   0.008002 172.31.29.138 -> 54.230.159.132 TCP 66 51198 > http [ACK] Seq=98 Ack=17835 Win=62720 Len=0 TSval=5999819 TSecr=830906433
 18   0.008055 54.230.159.132 -> 172.31.29.138 TCP 8754 [TCP segment of a reassembled PDU]
 19   0.008062 172.31.29.138 -> 54.230.159.132 TCP 66 51198 > http [ACK] Seq=98 Ack=26523 Win=80128 Len=0 TSval=5999819 TSecr=830906433
 20   0.008774 54.230.159.132 -> 172.31.29.138 TCP 8754 [TCP segment of a reassembled PDU]
 21   0.008782 172.31.29.138 -> 54.230.159.132 TCP 66 51198 > http [ACK] Seq=98 Ack=35211 Win=97536 Len=0 TSval=5999820 TSecr=830906433
 22   0.008827 54.230.159.132 -> 172.31.29.138 TCP 13098 [TCP segment of a reassembled PDU]
 23   0.008836 172.31.29.138 -> 54.230.159.132 TCP 66 51198 > http [ACK] Seq=98 Ack=48243 Win=123648 Len=0 TSval=5999820 TSecr=830906433
 24   0.009493 54.230.159.132 -> 172.31.29.138 TCP 4410 [TCP segment of a reassembled PDU]
 25   0.009499 172.31.29.138 -> 54.230.159.132 TCP 66 51198 > http [ACK] Seq=98 Ack=52587 Win=132224 Len=0 TSval=5999820 TSecr=830906433
 26   0.009548 54.230.159.132 -> 172.31.29.138 TCP 13098 [TCP segment of a reassembled PDU]
 27   0.009556 172.31.29.138 -> 54.230.159.132 TCP 66 51198 > http [ACK] Seq=98 Ack=65619 Win=158336 Len=0 TSval=5999820 TSecr=830906433
 28   0.010057 54.230.159.132 -> 172.31.29.138 TCP 1514 [TCP segment of a reassembled PDU]
 29   0.010062 172.31.29.138 -> 54.230.159.132 TCP 66 51198 > http [ACK] Seq=98 Ack=67067 Win=161280 Len=0 TSval=5999820 TSecr=830906433
 30   0.010310 54.230.159.132 -> 172.31.29.138 TCP 4410 [TCP segment of a reassembled PDU]
 31   0.010315 172.31.29.138 -> 54.230.159.132 TCP 66 51198 > http [ACK] Seq=98 Ack=71411 Win=169984 Len=0 TSval=5999820 TSecr=830906433
 32   0.010387 54.230.159.132 -> 172.31.29.138 TCP 7306 [TCP segment of a reassembled PDU]
 33   0.010393 172.31.29.138 -> 54.230.159.132 TCP 66 51198 > http [ACK] Seq=98 Ack=78651 Win=184448 Len=0 TSval=5999820 TSecr=830906433
 34   0.010446 54.230.159.132 -> 172.31.29.138 TCP 14546 [TCP segment of a reassembled PDU]
 35   0.010455 172.31.29.138 -> 54.230.159.132 TCP 66 51198 > http [ACK] Seq=98 Ack=93131 Win=213376 Len=0 TSval=5999820 TSecr=830906433
 36   0.010813 54.230.159.132 -> 172.31.29.138 TCP 1514 [TCP segment of a reassembled PDU]
 37   0.010817 172.31.29.138 -> 54.230.159.132 TCP 66 51198 > http [ACK] Seq=98 Ack=94579 Win=216320 Len=0 TSval=5999820 TSecr=830906433
 38   0.011086 54.230.159.132 -> 172.31.29.138 TCP 5858 [TCP segment of a reassembled PDU]
 39   0.011092 172.31.29.138 -> 54.230.159.132 TCP 66 51198 > http [ACK] Seq=98 Ack=100371 Win=227840 Len=0 TSval=5999820 TSecr=830906433
 40   0.011213 54.230.159.132 -> 172.31.29.138 TCP 21786 [TCP segment of a reassembled PDU]
 41   0.011222 172.31.29.138 -> 54.230.159.132 TCP 66 51198 > http [ACK] Seq=98 Ack=122091 Win=271232 Len=0 TSval=5999820 TSecr=830906433
 42   0.011888 54.230.159.132 -> 172.31.29.138 TCP 10202 [TCP segment of a reassembled PDU]
 43   0.011897 172.31.29.138 -> 54.230.159.132 TCP 66 51198 > http [ACK] Seq=98 Ack=132227 Win=291584 Len=0 TSval=5999820 TSecr=830906433
 44   0.012019 54.230.159.132 -> 172.31.29.138 TCP 23234 [TCP segment of a reassembled PDU]
 45   0.012033 172.31.29.138 -> 54.230.159.132 TCP 66 51198 > http [ACK] Seq=98 Ack=155395 Win=268416 Len=0 TSval=5999820 TSecr=830906433
 46   0.012040 54.230.159.132 -> 172.31.29.138 TCP 2962 [TCP segment of a reassembled PDU]
 47   0.012044 172.31.29.138 -> 54.230.159.132 TCP 66 51198 > http [ACK] Seq=98 Ack=158291 Win=265600 Len=0 TSval=5999820 TSecr=830906433
 48   0.012046 54.230.159.132 -> 172.31.29.138 TCP 1514 [TCP segment of a reassembled PDU]
 49   0.012048 172.31.29.138 -> 54.230.159.132 TCP 66 51198 > http [ACK] Seq=98 Ack=159739 Win=264192 Len=0 TSval=5999820 TSecr=830906433
 50   0.012622 54.230.159.132 -> 172.31.29.138 TCP 5858 [TCP segment of a reassembled PDU]
 51   0.012629 172.31.29.138 -> 54.230.159.132 TCP 66 51198 > http [ACK] Seq=98 Ack=165531 Win=303104 Len=0 TSval=5999821 TSecr=830906433
 52   0.012768 54.230.159.132 -> 172.31.29.138 TCP 21786 [TCP segment of a reassembled PDU]
 53   0.012779 172.31.29.138 -> 54.230.159.132 TCP 66 51198 > http [ACK] Seq=98 Ack=187251 Win=346624 Len=0 TSval=5999821 TSecr=830906433
 54   0.012800 54.230.159.132 -> 172.31.29.138 TCP 14546 [TCP segment of a reassembled PDU]
 55   0.012807 172.31.29.138 -> 54.230.159.132 TCP 66 51198 > http [ACK] Seq=98 Ack=201731 Win=375552 Len=0 TSval=5999821 TSecr=830906433
 56   0.012813 54.230.159.132 -> 172.31.29.138 TCP 1514 [TCP segment of a reassembled PDU]
 57   0.012815 172.31.29.138 -> 54.230.159.132 TCP 66 51198 > http [ACK] Seq=98 Ack=203179 Win=378496 Len=0 TSval=5999821 TSecr=830906433
 58   0.013137 54.230.159.132 -> 172.31.29.138 TCP 2962 [TCP segment of a reassembled PDU]
 59   0.013142 172.31.29.138 -> 54.230.159.132 TCP 66 51198 > http [ACK] Seq=98 Ack=206075 Win=384256 Len=0 TSval=5999821 TSecr=830906433
 60   0.013530 54.230.159.132 -> 172.31.29.138 TCP 26130 [TCP segment of a reassembled PDU]
 61   0.013544 172.31.29.138 -> 54.230.159.132 TCP 66 51198 > http [ACK] Seq=98 Ack=232139 Win=436352 Len=0 TSval=5999821 TSecr=830906433
 62   0.013557 54.230.159.132 -> 172.31.29.138 TCP 11650 [TCP segment of a reassembled PDU]
 63   0.013565 172.31.29.138 -> 54.230.159.132 TCP 66 51198 > http [ACK] Seq=98 Ack=243723 Win=459520 Len=0 TSval=5999821 TSecr=830906433
 64   0.013707 54.230.159.132 -> 172.31.29.138 TCP 5858 [TCP segment of a reassembled PDU]
 65   0.013713 172.31.29.138 -> 54.230.159.132 TCP 66 51198 > http [ACK] Seq=98 Ack=249515 Win=471168 Len=0 TSval=5999821 TSecr=830906433
 66   0.014153 54.230.159.132 -> 172.31.29.138 TCP 4410 [TCP segment of a reassembled PDU]
 67   0.014159 172.31.29.138 -> 54.230.159.132 TCP 66 51198 > http [ACK] Seq=98 Ack=253859 Win=479744 Len=0 TSval=5999821 TSecr=830906433
 68   0.014339 54.230.159.132 -> 172.31.29.138 TCP 26130 [TCP segment of a reassembled PDU]
 69   0.014352 172.31.29.138 -> 54.230.159.132 TCP 66 51198 > http [ACK] Seq=98 Ack=279923 Win=531968 Len=0 TSval=5999821 TSecr=830906433
 70   0.014365 54.230.159.132 -> 172.31.29.138 TCP 13098 [TCP segment of a reassembled PDU]
 71   0.014374 172.31.29.138 -> 54.230.159.132 TCP 66 51198 > http [ACK] Seq=98 Ack=292955 Win=557952 Len=0 TSval=5999821 TSecr=830906433
 72   0.014523 54.230.159.132 -> 172.31.29.138 TCP 4410 [TCP segment of a reassembled PDU]
 73   0.014529 172.31.29.138 -> 54.230.159.132 TCP 66 51198 > http [ACK] Seq=98 Ack=297299 Win=566656 Len=0 TSval=5999821 TSecr=830906433
 74   0.015179 54.230.159.132 -> 172.31.29.138 TCP 5858 [TCP segment of a reassembled PDU]
 75   0.015185 172.31.29.138 -> 54.230.159.132 TCP 66 51198 > http [ACK] Seq=98 Ack=303091 Win=578304 Len=0 TSval=5999821 TSecr=830906433
 76   0.015373 54.230.159.132 -> 172.31.29.138 TCP 26130 [TCP segment of a reassembled PDU]
 77   0.015387 172.31.29.138 -> 54.230.159.132 TCP 66 51198 > http [ACK] Seq=98 Ack=329155 Win=630400 Len=0 TSval=5999821 TSecr=830906433
 78   0.015412 54.230.159.132 -> 172.31.29.138 TCP 23234 [TCP segment of a reassembled PDU]
 79   0.015423 172.31.29.138 -> 54.230.159.132 TCP 66 51198 > http [ACK] Seq=98 Ack=352323 Win=607232 Len=0 TSval=5999821 TSecr=830906433
 80   0.016200 54.230.159.132 -> 172.31.29.138 TCP 4410 [TCP segment of a reassembled PDU]
 81   0.016206 172.31.29.138 -> 54.230.159.132 TCP 66 51198 > http [ACK] Seq=98 Ack=356667 Win=639104 Len=0 TSval=5999822 TSecr=830906434
 82   0.016382 54.230.159.132 -> 172.31.29.138 TCP 26130 [TCP segment of a reassembled PDU]
 83   0.016396 172.31.29.138 -> 54.230.159.132 TCP 66 51198 > http [ACK] Seq=98 Ack=382731 Win=691200 Len=0 TSval=5999822 TSecr=830906434
 84   0.016437 54.230.159.132 -> 172.31.29.138 TCP 26130 [TCP segment of a reassembled PDU]
 85   0.016451 172.31.29.138 -> 54.230.159.132 TCP 66 51198 > http [ACK] Seq=98 Ack=408795 Win=743296 Len=0 TSval=5999822 TSecr=830906434
 86   0.016464 54.230.159.132 -> 172.31.29.138 TCP 8754 [TCP segment of a reassembled PDU]
 87   0.016469 172.31.29.138 -> 54.230.159.132 TCP 66 51198 > http [ACK] Seq=98 Ack=417483 Win=760704 Len=0 TSval=5999822 TSecr=830906434
 88   0.016959 54.230.159.132 -> 172.31.29.138 TCP 1514 [TCP segment of a reassembled PDU]
 89   0.016964 172.31.29.138 -> 54.230.159.132 TCP 66 51198 > http [ACK] Seq=98 Ack=418931 Win=763648 Len=0 TSval=5999822 TSecr=830906434
 90   0.017223 54.230.159.132 -> 172.31.29.138 TCP 4410 [TCP segment of a reassembled PDU]
 91   0.017229 172.31.29.138 -> 54.230.159.132 TCP 66 51198 > http [ACK] Seq=98 Ack=423275 Win=772352 Len=0 TSval=5999822 TSecr=830906434
 92   0.017384 54.230.159.132 -> 172.31.29.138 TCP 26130 [TCP segment of a reassembled PDU]
 93   0.017397 172.31.29.138 -> 54.230.159.132 TCP 66 51198 > http [ACK] Seq=98 Ack=449339 Win=824448 Len=0 TSval=5999822 TSecr=830906434
 94   0.017404 54.230.159.132 -> 172.31.29.138 TCP 1514 [TCP segment of a reassembled PDU]
 95   0.017406 172.31.29.138 -> 54.230.159.132 TCP 66 51198 > http [ACK] Seq=98 Ack=450787 Win=827264 Len=0 TSval=5999822 TSecr=830906434
 96   0.017424 54.230.159.132 -> 172.31.29.138 TCP 20338 [TCP segment of a reassembled PDU]
 97   0.017433 172.31.29.138 -> 54.230.159.132 TCP 66 51198 > http [ACK] Seq=98 Ack=471059 Win=867840 Len=0 TSval=5999822 TSecr=830906434
 98   0.017495 54.230.159.132 -> 172.31.29.138 TCP 17442 [TCP segment of a reassembled PDU]
 99   0.017505 172.31.29.138 -> 54.230.159.132 TCP 66 51198 > http [ACK] Seq=98 Ack=488435 Win=902656 Len=0 TSval=5999822 TSecr=830906434
100   0.018025 54.230.159.132 -> 172.31.29.138 TCP 4410 [TCP segment of a reassembled PDU]
101   0.018031 172.31.29.138 -> 54.230.159.132 TCP 66 51198 > http [ACK] Seq=98 Ack=492779 Win=911360 Len=0 TSval=5999822 TSecr=830906434
102   0.018192 54.230.159.132 -> 172.31.29.138 TCP 26130 [TCP segment of a reassembled PDU]
103   0.018206 172.31.29.138 -> 54.230.159.132 TCP 66 51198 > http [ACK] Seq=98 Ack=518843 Win=963456 Len=0 TSval=5999822 TSecr=830906434
104   0.018223 54.230.159.132 -> 172.31.29.138 TCP 14546 [TCP segment of a reassembled PDU]
105   0.018230 172.31.29.138 -> 54.230.159.132 TCP 66 51198 > http [ACK] Seq=98 Ack=533323 Win=992384 Len=0 TSval=5999822 TSecr=830906434
106   0.018300 54.230.159.132 -> 172.31.29.138 TCP 27578 [TCP segment of a reassembled PDU]
107   0.018314 172.31.29.138 -> 54.230.159.132 TCP 66 51198 > http [ACK] Seq=98 Ack=560835 Win=1047424 Len=0 TSval=5999822 TSecr=830906434
108   0.018326 54.230.159.132 -> 172.31.29.138 TCP 7306 [TCP segment of a reassembled PDU]
109   0.018330 172.31.29.138 -> 54.230.159.132 TCP 66 51198 > http [ACK] Seq=98 Ack=568075 Win=1061888 Len=0 TSval=5999822 TSecr=830906434
110   0.019035 54.230.159.132 -> 172.31.29.138 TCP 4410 [TCP segment of a reassembled PDU]
111   0.019041 172.31.29.138 -> 54.230.159.132 TCP 66 51198 > http [ACK] Seq=98 Ack=572419 Win=1070592 Len=0 TSval=5999822 TSecr=830906434
112   0.019201 54.230.159.132 -> 172.31.29.138 TCP 18890 [TCP segment of a reassembled PDU]
113   0.019212 172.31.29.138 -> 54.230.159.132 TCP 66 51198 > http [ACK] Seq=98 Ack=591243 Win=1108224 Len=0 TSval=5999822 TSecr=830906434
114   0.019281 54.230.159.132 -> 172.31.29.138 TCP 26130 [TCP segment of a reassembled PDU]
115   0.019295 172.31.29.138 -> 54.230.159.132 TCP 66 51198 > http [ACK] Seq=98 Ack=617307 Win=1146624 Len=0 TSval=5999822 TSecr=830906434
116   0.019345 54.230.159.132 -> 172.31.29.138 TCP 26130 [TCP segment of a reassembled PDU]
117   0.019357 172.31.29.138 -> 54.230.159.132 TCP 66 51198 > http [ACK] Seq=98 Ack=643371 Win=1146624 Len=0 TSval=5999822 TSecr=830906434
118   0.019366 54.230.159.132 -> 172.31.29.138 TCP 2962 [TCP segment of a reassembled PDU]
119   0.019369 172.31.29.138 -> 54.230.159.132 TCP 66 51198 > http [ACK] Seq=98 Ack=646267 Win=1143808 Len=0 TSval=5999822 TSecr=830906434
120   0.019814 54.230.159.132 -> 172.31.29.138 TCP 4410 [TCP segment of a reassembled PDU]
121   0.019820 172.31.29.138 -> 54.230.159.132 TCP 66 51198 > http [ACK] Seq=98 Ack=650611 Win=1169024 Len=0 TSval=5999822 TSecr=830906434
122   0.019994 54.230.159.132 -> 172.31.29.138 TCP 26130 [TCP segment of a reassembled PDU]
123   0.020007 172.31.29.138 -> 54.230.159.132 TCP 66 51198 > http [ACK] Seq=98 Ack=676675 Win=1146624 Len=0 TSval=5999822 TSecr=830906434
124   0.020015 54.230.159.132 -> 172.31.29.138 TCP 2962 [TCP segment of a reassembled PDU]
125   0.020018 172.31.29.138 -> 54.230.159.132 TCP 66 51198 > http [ACK] Seq=98 Ack=679571 Win=1143808 Len=0 TSval=5999822 TSecr=830906434
126   0.020069 54.230.159.132 -> 172.31.29.138 TCP 23234 [TCP segment of a reassembled PDU]
127   0.020085 172.31.29.138 -> 54.230.159.132 TCP 66 51198 > http [ACK] Seq=98 Ack=702739 Win=1151360 Len=0 TSval=5999822 TSecr=830906434
128   0.020154 54.230.159.132 -> 172.31.29.138 TCP 18890 [TCP segment of a reassembled PDU]
129   0.020165 172.31.29.138 -> 54.230.159.132 TCP 66 51198 > http [ACK] Seq=98 Ack=721563 Win=1158400 Len=0 TSval=5999822 TSecr=830906434
130   0.020848 54.230.159.132 -> 172.31.29.138 TCP 4410 [TCP segment of a reassembled PDU]
131   0.020854 172.31.29.138 -> 54.230.159.132 TCP 66 51198 > http [ACK] Seq=98 Ack=725907 Win=1177728 Len=0 TSval=5999823 TSecr=830906434
132   0.021024 54.230.159.132 -> 172.31.29.138 TCP 26130 [TCP segment of a reassembled PDU]
133   0.021038 172.31.29.138 -> 54.230.159.132 TCP 66 51198 > http [ACK] Seq=98 Ack=751971 Win=1229824 Len=0 TSval=5999823 TSecr=830906434
134   0.021064 54.230.159.132 -> 172.31.29.138 TCP 26130 [TCP segment of a reassembled PDU]
135   0.021076 172.31.29.138 -> 54.230.159.132 TCP 66 51198 > http [ACK] Seq=98 Ack=778035 Win=1282048 Len=0 TSval=5999823 TSecr=830906434
136   0.021137 54.230.159.132 -> 172.31.29.138 TCP 26130 [TCP segment of a reassembled PDU]
137   0.021164 172.31.29.138 -> 54.230.159.132 TCP 66 51198 > http [ACK] Seq=98 Ack=804099 Win=1334144 Len=0 TSval=5999823 TSecr=830906434
138   0.021194 54.230.159.132 -> 172.31.29.138 TCP 18890 [TCP segment of a reassembled PDU]
139   0.021204 172.31.29.138 -> 54.230.159.132 TCP 66 51198 > http [ACK] Seq=98 Ack=822923 Win=1371776 Len=0 TSval=5999823 TSecr=830906434
140   0.021648 54.230.159.132 -> 172.31.29.138 TCP 2962 [TCP segment of a reassembled PDU]
141   0.021654 172.31.29.138 -> 54.230.159.132 TCP 66 51198 > http [ACK] Seq=98 Ack=825819 Win=1377536 Len=0 TSval=5999823 TSecr=830906434
142   0.021905 54.230.159.132 -> 172.31.29.138 TCP 4410 [TCP segment of a reassembled PDU]
143   0.021911 172.31.29.138 -> 54.230.159.132 TCP 66 51198 > http [ACK] Seq=98 Ack=830163 Win=1386240 Len=0 TSval=5999823 TSecr=830906434
144   0.022071 54.230.159.132 -> 172.31.29.138 TCP 21786 [TCP segment of a reassembled PDU]
145   0.022080 172.31.29.138 -> 54.230.159.132 TCP 66 51198 > http [ACK] Seq=98 Ack=851883 Win=1429632 Len=0 TSval=5999823 TSecr=830906434
146   0.022132 54.230.159.132 -> 172.31.29.138 TCP 26130 [TCP segment of a reassembled PDU]
147   0.022144 172.31.29.138 -> 54.230.159.132 TCP 66 51198 > http [ACK] Seq=98 Ack=877947 Win=1481856 Len=0 TSval=5999823 TSecr=830906434
148   0.022192 54.230.159.132 -> 172.31.29.138 TCP 26130 [TCP segment of a reassembled PDU]
149   0.022204 172.31.29.138 -> 54.230.159.132 TCP 66 51198 > http [ACK] Seq=98 Ack=904011 Win=1533952 Len=0 TSval=5999823 TSecr=830906434
150   0.022229 54.230.159.132 -> 172.31.29.138 TCP 13098 [TCP segment of a reassembled PDU]
151   0.022236 172.31.29.138 -> 54.230.159.132 TCP 66 51198 > http [ACK] Seq=98 Ack=917043 Win=1560064 Len=0 TSval=5999823 TSecr=830906434
152   0.022698 54.230.159.132 -> 172.31.29.138 TCP 2962 [TCP segment of a reassembled PDU]
153   0.022703 172.31.29.138 -> 54.230.159.132 TCP 66 51198 > http [ACK] Seq=98 Ack=919939 Win=1565824 Len=0 TSval=5999823 TSecr=830906434
154   0.022864 54.230.159.132 -> 172.31.29.138 TCP 20338 [TCP segment of a reassembled PDU]
155   0.022876 172.31.29.138 -> 54.230.159.132 TCP 66 51198 > http [ACK] Seq=98 Ack=940211 Win=1606400 Len=0 TSval=5999823 TSecr=830906434
156   0.022887 54.230.159.132 -> 172.31.29.138 TCP 5858 [TCP segment of a reassembled PDU]
157   0.022891 172.31.29.138 -> 54.230.159.132 TCP 66 51198 > http [ACK] Seq=98 Ack=946003 Win=1606400 Len=0 TSval=5999823 TSecr=830906434
158   0.022958 54.230.159.132 -> 172.31.29.138 TCP 26130 [TCP segment of a reassembled PDU]
159   0.022972 172.31.29.138 -> 54.230.159.132 TCP 66 51198 > http [ACK] Seq=98 Ack=972067 Win=1606400 Len=0 TSval=5999823 TSecr=830906434
160   0.023020 54.230.159.132 -> 172.31.29.138 TCP 30474 [TCP segment of a reassembled PDU]
161   0.023051 172.31.29.138 -> 54.230.159.132 TCP 66 51198 > http [ACK] Seq=98 Ack=1002475 Win=1606400 Len=0 TSval=5999823 TSecr=830906434
162   0.023061 54.230.159.132 -> 172.31.29.138 TCP 7306 [TCP segment of a reassembled PDU]
163   0.023065 172.31.29.138 -> 54.230.159.132 TCP 66 51198 > http [ACK] Seq=98 Ack=1009715 Win=1606400 Len=0 TSval=5999823 TSecr=830906434
164   0.023156 54.230.159.132 -> 172.31.29.138 TCP 24682 [TCP segment of a reassembled PDU]
165   0.023168 172.31.29.138 -> 54.230.159.132 TCP 66 51198 > http [ACK] Seq=98 Ack=1034331 Win=1606400 Len=0 TSval=5999823 TSecr=830906434
166   0.023553 54.230.159.132 -> 172.31.29.138 TCP 2962 [TCP segment of a reassembled PDU]
167   0.023560 172.31.29.138 -> 54.230.159.132 TCP 66 51198 > http [ACK] Seq=98 Ack=1037227 Win=1606400 Len=0 TSval=5999823 TSecr=830906434
168   0.023751 54.230.159.132 -> 172.31.29.138 TCP 26130 [TCP segment of a reassembled PDU]
169   0.023765 172.31.29.138 -> 54.230.159.132 TCP 66 51198 > http [ACK] Seq=98 Ack=1063291 Win=1606400 Len=0 TSval=5999823 TSecr=830906434
170   0.023771 54.230.159.132 -> 172.31.29.138 TCP 1514 [TCP segment of a reassembled PDU]
171   0.023813 54.230.159.132 -> 172.31.29.138 TCP 24682 [TCP segment of a reassembled PDU]
172   0.023824 172.31.29.138 -> 54.230.159.132 TCP 66 51198 > http [ACK] Seq=98 Ack=1089355 Win=1606400 Len=0 TSval=5999823 TSecr=830906434
173   0.023881 54.230.159.132 -> 172.31.29.138 TCP 26130 [TCP segment of a reassembled PDU]
174   0.023894 172.31.29.138 -> 54.230.159.132 TCP 66 51198 > http [ACK] Seq=98 Ack=1115419 Win=1606400 Len=0 TSval=5999823 TSecr=830906434
175   0.023909 54.230.159.132 -> 172.31.29.138 TCP 10202 [TCP segment of a reassembled PDU]
176   0.023913 172.31.29.138 -> 54.230.159.132 TCP 66 51198 > http [ACK] Seq=98 Ack=1125555 Win=1606400 Len=0 TSval=5999823 TSecr=830906434
177   0.024034 54.230.159.132 -> 172.31.29.138 TCP 26130 [TCP segment of a reassembled PDU]
178   0.024046 172.31.29.138 -> 54.230.159.132 TCP 66 51198 > http [ACK] Seq=98 Ack=1151619 Win=1606400 Len=0 TSval=5999823 TSecr=830906434
179   0.024060 54.230.159.132 -> 172.31.29.138 TCP 10202 [TCP segment of a reassembled PDU]
180   0.024069 172.31.29.138 -> 54.230.159.132 TCP 66 51198 > http [ACK] Seq=98 Ack=1161755 Win=1606400 Len=0 TSval=5999823 TSecr=830906434
181   0.024489 54.230.159.132 -> 172.31.29.138 TCP 2962 [TCP segment of a reassembled PDU]
182   0.024495 172.31.29.138 -> 54.230.159.132 TCP 66 51198 > http [ACK] Seq=98 Ack=1164651 Win=1606400 Len=0 TSval=5999824 TSecr=830906434
183   0.024644 54.230.159.132 -> 172.31.29.138 TCP 13098 [TCP segment of a reassembled PDU]
184   0.024652 172.31.29.138 -> 54.230.159.132 TCP 66 51198 > http [ACK] Seq=98 Ack=1177683 Win=1606400 Len=0 TSval=5999824 TSecr=830906434
185   0.024719 54.230.159.132 -> 172.31.29.138 TCP 26130 [TCP segment of a reassembled PDU]
186   0.024732 172.31.29.138 -> 54.230.159.132 TCP 66 51198 > http [ACK] Seq=98 Ack=1203747 Win=1606400 Len=0 TSval=5999824 TSecr=830906434
187   0.024775 54.230.159.132 -> 172.31.29.138 TCP 20338 [TCP segment of a reassembled PDU]
188   0.024786 172.31.29.138 -> 54.230.159.132 TCP 66 51198 > http [ACK] Seq=98 Ack=1224019 Win=1606400 Len=0 TSval=5999824 TSecr=830906434
189   0.024802 54.230.159.132 -> 172.31.29.138 TCP 5858 [TCP segment of a reassembled PDU]
190   0.024809 172.31.29.138 -> 54.230.159.132 TCP 66 51198 > http [ACK] Seq=98 Ack=1229811 Win=1606400 Len=0 TSval=5999824 TSecr=830906434
191   0.024880 54.230.159.132 -> 172.31.29.138 TCP 34818 [TCP segment of a reassembled PDU]
192   0.024896 172.31.29.138 -> 54.230.159.132 TCP 66 51198 > http [ACK] Seq=98 Ack=1264563 Win=1606400 Len=0 TSval=5999824 TSecr=830906434
193   0.024910 54.230.159.132 -> 172.31.29.138 TCP 10202 [TCP segment of a reassembled PDU]
194   0.024919 172.31.29.138 -> 54.230.159.132 TCP 66 51198 > http [ACK] Seq=98 Ack=1274699 Win=1606400 Len=0 TSval=5999824 TSecr=830906434
195   0.024989 54.230.159.132 -> 172.31.29.138 TCP 24682 [TCP segment of a reassembled PDU]
196   0.025001 172.31.29.138 -> 54.230.159.132 TCP 66 51198 > http [ACK] Seq=98 Ack=1299315 Win=1606400 Len=0 TSval=5999824 TSecr=830906434
197   0.025404 54.230.159.132 -> 172.31.29.138 TCP 4410 [TCP segment of a reassembled PDU]
198   0.025410 172.31.29.138 -> 54.230.159.132 TCP 66 51198 > http [ACK] Seq=98 Ack=1303659 Win=1606400 Len=0 TSval=5999824 TSecr=830906435
199   0.025589 54.230.159.132 -> 172.31.29.138 TCP 26130 [TCP segment of a reassembled PDU]
200   0.025603 172.31.29.138 -> 54.230.159.132 TCP 66 51198 > http [ACK] Seq=98 Ack=1329723 Win=1606400 Len=0 TSval=5999824 TSecr=830906435
201   0.025613 54.230.159.132 -> 172.31.29.138 TCP 7306 [TCP segment of a reassembled PDU]
202   0.025618 172.31.29.138 -> 54.230.159.132 TCP 66 51198 > http [ACK] Seq=98 Ack=1336963 Win=1606400 Len=0 TSval=5999824 TSecr=830906435
203   0.025622 54.230.159.132 -> 172.31.29.138 TCP 4410 [TCP segment of a reassembled PDU]
204   0.025625 172.31.29.138 -> 54.230.159.132 TCP 66 51198 > http [ACK] Seq=98 Ack=1341307 Win=1606400 Len=0 TSval=5999824 TSecr=830906435
205   0.025635 54.230.159.132 -> 172.31.29.138 TCP 14546 [TCP segment of a reassembled PDU]
206   0.025641 172.31.29.138 -> 54.230.159.132 TCP 66 51198 > http [ACK] Seq=98 Ack=1355787 Win=1606400 Len=0 TSval=5999824 TSecr=830906435
207   0.025772 54.230.159.132 -> 172.31.29.138 TCP 36266 [TCP segment of a reassembled PDU]
208   0.025787 172.31.29.138 -> 54.230.159.132 TCP 66 51198 > http [ACK] Seq=98 Ack=1391987 Win=1606400 Len=0 TSval=5999824 TSecr=830906435
209   0.025813 54.230.159.132 -> 172.31.29.138 TCP 8754 [TCP segment of a reassembled PDU]
210   0.025820 172.31.29.138 -> 54.230.159.132 TCP 66 51198 > http [ACK] Seq=98 Ack=1400675 Win=1606400 Len=0 TSval=5999824 TSecr=830906435
211   0.025905 54.230.159.132 -> 172.31.29.138 TCP 26130 [TCP segment of a reassembled PDU]
212   0.025917 172.31.29.138 -> 54.230.159.132 TCP 66 51198 > http [ACK] Seq=98 Ack=1426739 Win=1606400 Len=0 TSval=5999824 TSecr=830906435
213   0.025930 54.230.159.132 -> 172.31.29.138 TCP 11650 [TCP segment of a reassembled PDU]
214   0.025941 172.31.29.138 -> 54.230.159.132 TCP 66 51198 > http [ACK] Seq=98 Ack=1438323 Win=1606400 Len=0 TSval=5999824 TSecr=830906435
215   0.026353 54.230.159.132 -> 172.31.29.138 TCP 4410 [TCP segment of a reassembled PDU]
216   0.026359 172.31.29.138 -> 54.230.159.132 TCP 66 51198 > http [ACK] Seq=98 Ack=1442667 Win=1606400 Len=0 TSval=5999824 TSecr=830906435
217   0.026548 54.230.159.132 -> 172.31.29.138 TCP 26130 [TCP segment of a reassembled PDU]
218   0.026562 172.31.29.138 -> 54.230.159.132 TCP 66 51198 > http [ACK] Seq=98 Ack=1468731 Win=1606400 Len=0 TSval=5999824 TSecr=830906435
219   0.026601 54.230.159.132 -> 172.31.29.138 TCP 26130 [TCP segment of a reassembled PDU]
220   0.026613 172.31.29.138 -> 54.230.159.132 TCP 66 51198 > http [ACK] Seq=98 Ack=1494795 Win=1606400 Len=0 TSval=5999824 TSecr=830906435
221   0.026657 54.230.159.132 -> 172.31.29.138 TCP 26130 [TCP segment of a reassembled PDU]
222   0.026671 172.31.29.138 -> 54.230.159.132 TCP 66 51198 > http [ACK] Seq=98 Ack=1520859 Win=1606400 Len=0 TSval=5999824 TSecr=830906435
223   0.026695 54.230.159.132 -> 172.31.29.138 TCP 14546 [TCP segment of a reassembled PDU]
224   0.026702 172.31.29.138 -> 54.230.159.132 TCP 66 51198 > http [ACK] Seq=98 Ack=1535339 Win=1606400 Len=0 TSval=5999824 TSecr=830906435
225   0.026860 54.230.159.132 -> 172.31.29.138 TCP 21786 [TCP segment of a reassembled PDU]
226   0.026872 172.31.29.138 -> 54.230.159.132 TCP 66 51198 > http [ACK] Seq=98 Ack=1557059 Win=1606400 Len=0 TSval=5999824 TSecr=830906435
227   0.026883 54.230.159.132 -> 172.31.29.138 TCP 4410 [TCP segment of a reassembled PDU]
228   0.026886 172.31.29.138 -> 54.230.159.132 TCP 66 51198 > http [ACK] Seq=98 Ack=1561403 Win=1606400 Len=0 TSval=5999824 TSecr=830906435
229   0.026919 54.230.159.132 -> 172.31.29.138 TCP 7306 [TCP segment of a reassembled PDU]
230   0.026924 172.31.29.138 -> 54.230.159.132 TCP 66 51198 > http [ACK] Seq=98 Ack=1568643 Win=1606400 Len=0 TSval=5999824 TSecr=830906435
231   0.027042 54.230.159.132 -> 172.31.29.138 TCP 4410 [TCP segment of a reassembled PDU]
232   0.027047 172.31.29.138 -> 54.230.159.132 TCP 66 51198 > http [ACK] Seq=98 Ack=1572987 Win=1606400 Len=0 TSval=5999824 TSecr=830906435
233   0.027227 54.230.159.132 -> 172.31.29.138 TCP 26130 [TCP segment of a reassembled PDU]
234   0.027240 172.31.29.138 -> 54.230.159.132 TCP 66 51198 > http [ACK] Seq=98 Ack=1599051 Win=1606400 Len=0 TSval=5999824 TSecr=830906435
235   0.027264 54.230.159.132 -> 172.31.29.138 TCP 20338 [TCP segment of a reassembled PDU]
236   0.027273 172.31.29.138 -> 54.230.159.132 TCP 66 51198 > http [ACK] Seq=98 Ack=1619323 Win=1606400 Len=0 TSval=5999824 TSecr=830906435
237   0.027299 54.230.159.132 -> 172.31.29.138 TCP 5858 [TCP segment of a reassembled PDU]
238   0.027304 172.31.29.138 -> 54.230.159.132 TCP 66 51198 > http [ACK] Seq=98 Ack=1625115 Win=1606400 Len=0 TSval=5999824 TSecr=830906435
239   0.027348 54.230.159.132 -> 172.31.29.138 TCP 14546 [TCP segment of a reassembled PDU]
240   0.027357 172.31.29.138 -> 54.230.159.132 TCP 66 51198 > http [ACK] Seq=98 Ack=1639595 Win=1606400 Len=0 TSval=5999824 TSecr=830906435
241   0.027487 54.230.159.132 -> 172.31.29.138 TCP 26130 [TCP segment of a reassembled PDU]
242   0.027500 172.31.29.138 -> 54.230.159.132 TCP 66 51198 > http [ACK] Seq=98 Ack=1665659 Win=1606400 Len=0 TSval=5999824 TSecr=830906435
243   0.027518 54.230.159.132 -> 172.31.29.138 TCP 17442 [TCP segment of a reassembled PDU]
244   0.027527 172.31.29.138 -> 54.230.159.132 TCP 66 51198 > http [ACK] Seq=98 Ack=1683035 Win=1606400 Len=0 TSval=5999824 TSecr=830906435
245   0.027535 54.230.159.132 -> 172.31.29.138 TCP 8754 [TCP segment of a reassembled PDU]
246   0.027540 172.31.29.138 -> 54.230.159.132 TCP 66 51198 > http [ACK] Seq=98 Ack=1691723 Win=1606400 Len=0 TSval=5999824 TSecr=830906435
247   0.027555 54.230.159.132 -> 172.31.29.138 TCP 7306 [TCP segment of a reassembled PDU]
248   0.027559 172.31.29.138 -> 54.230.159.132 TCP 66 51198 > http [ACK] Seq=98 Ack=1698963 Win=1606400 Len=0 TSval=5999824 TSecr=830906435
249   0.027971 54.230.159.132 -> 172.31.29.138 TCP 26130 [TCP segment of a reassembled PDU]
250   0.027985 172.31.29.138 -> 54.230.159.132 TCP 66 51198 > http [ACK] Seq=98 Ack=1725027 Win=1606400 Len=0 TSval=5999824 TSecr=830906435
251   0.027992 54.230.159.132 -> 172.31.29.138 TCP 2962 [TCP segment of a reassembled PDU]
252   0.027995 172.31.29.138 -> 54.230.159.132 TCP 66 51198 > http [ACK] Seq=98 Ack=1727923 Win=1606400 Len=0 TSval=5999824 TSecr=830906435
253   0.028027 54.230.159.132 -> 172.31.29.138 TCP 23234 [TCP segment of a reassembled PDU]
254   0.028038 172.31.29.138 -> 54.230.159.132 TCP 66 51198 > http [ACK] Seq=98 Ack=1751091 Win=1606400 Len=0 TSval=5999824 TSecr=830906435
255   0.028083 54.230.159.132 -> 172.31.29.138 TCP 5858 [TCP segment of a reassembled PDU]
256   0.028089 172.31.29.138 -> 54.230.159.132 TCP 66 51198 > http [ACK] Seq=98 Ack=1756883 Win=1606400 Len=0 TSval=5999824 TSecr=830906435
257   0.028224 54.230.159.132 -> 172.31.29.138 TCP 26130 [TCP segment of a reassembled PDU]
258   0.028238 172.31.29.138 -> 54.230.159.132 TCP 66 51198 > http [ACK] Seq=98 Ack=1782947 Win=1606400 Len=0 TSval=5999825 TSecr=830906435
259   0.028245 54.230.159.132 -> 172.31.29.138 TCP 4410 [TCP segment of a reassembled PDU]
260   0.028249 172.31.29.138 -> 54.230.159.132 TCP 66 51198 > http [ACK] Seq=98 Ack=1787291 Win=1606400 Len=0 TSval=5999825 TSecr=830906435
261   0.028294 54.230.159.132 -> 172.31.29.138 TCP 21786 [TCP segment of a reassembled PDU]
262   0.028304 172.31.29.138 -> 54.230.159.132 TCP 66 51198 > http [ACK] Seq=98 Ack=1809011 Win=1606400 Len=0 TSval=5999825 TSecr=830906435
263   0.028373 54.230.159.132 -> 172.31.29.138 TCP 20338 [TCP segment of a reassembled PDU]
264   0.028384 172.31.29.138 -> 54.230.159.132 TCP 66 51198 > http [ACK] Seq=98 Ack=1829283 Win=1606400 Len=0 TSval=5999825 TSecr=830906435
265   0.028712 54.230.159.132 -> 172.31.29.138 TCP 26130 [TCP segment of a reassembled PDU]
266   0.028726 172.31.29.138 -> 54.230.159.132 TCP 66 51198 > http [ACK] Seq=98 Ack=1855347 Win=1606400 Len=0 TSval=5999825 TSecr=830906435
267   0.028766 54.230.159.132 -> 172.31.29.138 TCP 26130 [TCP segment of a reassembled PDU]
268   0.028778 172.31.29.138 -> 54.230.159.132 TCP 66 51198 > http [ACK] Seq=98 Ack=1881411 Win=1606400 Len=0 TSval=5999825 TSecr=830906435
269   0.028803 54.230.159.132 -> 172.31.29.138 TCP 13098 [TCP segment of a reassembled PDU]
270   0.028810 172.31.29.138 -> 54.230.159.132 TCP 66 51198 > http [ACK] Seq=98 Ack=1894443 Win=1606400 Len=0 TSval=5999825 TSecr=830906435
271   0.028979 54.230.159.132 -> 172.31.29.138 TCP 26130 [TCP segment of a reassembled PDU]
272   0.028986 172.31.29.138 -> 54.230.159.132 TCP 66 51198 > http [ACK] Seq=98 Ack=1920507 Win=1606400 Len=0 TSval=5999825 TSecr=830906435
273   0.029037 54.230.159.132 -> 172.31.29.138 TCP 23234 [TCP segment of a reassembled PDU]
274   0.029046 172.31.29.138 -> 54.230.159.132 TCP 66 51198 > http [ACK] Seq=98 Ack=1943675 Win=1606400 Len=0 TSval=5999825 TSecr=830906435
275   0.029060 54.230.159.132 -> 172.31.29.138 TCP 2962 [TCP segment of a reassembled PDU]
276   0.029063 172.31.29.138 -> 54.230.159.132 TCP 66 51198 > http [ACK] Seq=98 Ack=1946571 Win=1606400 Len=0 TSval=5999825 TSecr=830906435
277   0.029147 54.230.159.132 -> 172.31.29.138 TCP 31922 [TCP segment of a reassembled PDU]
278   0.029155 172.31.29.138 -> 54.230.159.132 TCP 66 51198 > http [ACK] Seq=98 Ack=1978427 Win=1606400 Len=0 TSval=5999825 TSecr=830906435
279   0.029231 54.230.159.132 -> 172.31.29.138 TCP 26130 [TCP segment of a reassembled PDU]
280   0.029239 172.31.29.138 -> 54.230.159.132 TCP 66 51198 > http [ACK] Seq=98 Ack=2004491 Win=1606400 Len=0 TSval=5999825 TSecr=830906435
281   0.029244 54.230.159.132 -> 172.31.29.138 TCP 1514 [TCP segment of a reassembled PDU]
282   0.029275 54.230.159.132 -> 172.31.29.138 TCP 18890 [TCP segment of a reassembled PDU]
283   0.029280 172.31.29.138 -> 54.230.159.132 TCP 66 51198 > http [ACK] Seq=98 Ack=2024763 Win=1606400 Len=0 TSval=5999825 TSecr=830906435
284   0.029504 54.230.159.132 -> 172.31.29.138 TCP 4410 [TCP segment of a reassembled PDU]
285   0.029509 172.31.29.138 -> 54.230.159.132 TCP 66 51198 > http [ACK] Seq=98 Ack=2029107 Win=1606400 Len=0 TSval=5999825 TSecr=830906435
286   0.029678 54.230.159.132 -> 172.31.29.138 TCP 26130 [TCP segment of a reassembled PDU]
287   0.029698 172.31.29.138 -> 54.230.159.132 TCP 66 51198 > http [ACK] Seq=98 Ack=2055171 Win=1606400 Len=0 TSval=5999825 TSecr=830906435
288   0.029710 54.230.159.132 -> 172.31.29.138 TCP 11650 [TCP segment of a reassembled PDU]
289   0.029712 172.31.29.138 -> 54.230.159.132 TCP 66 51198 > http [ACK] Seq=98 Ack=2066755 Win=1606400 Len=0 TSval=5999825 TSecr=830906435
290   0.029722 54.230.159.132 -> 172.31.29.138 TCP 14546 [TCP segment of a reassembled PDU]
291   0.029725 172.31.29.138 -> 54.230.159.132 TCP 66 51198 > http [ACK] Seq=98 Ack=2081235 Win=1606400 Len=0 TSval=5999825 TSecr=830906435
292   0.029786 54.230.159.132 -> 172.31.29.138 TCP 8754 [TCP segment of a reassembled PDU]
293   0.029791 172.31.29.138 -> 54.230.159.132 TCP 66 51198 > http [ACK] Seq=98 Ack=2089923 Win=1606400 Len=0 TSval=5999825 TSecr=830906435
294   0.030017 54.230.159.132 -> 172.31.29.138 TCP 4410 [TCP segment of a reassembled PDU]
295   0.030021 172.31.29.138 -> 54.230.159.132 TCP 66 51198 > http [ACK] Seq=98 Ack=2094267 Win=1606400 Len=0 TSval=5999825 TSecr=830906435
296   0.030196 54.230.159.132 -> 172.31.29.138 TCP 23234 [TCP segment of a reassembled PDU]
297   0.030202 172.31.29.138 -> 54.230.159.132 TCP 66 51198 > http [ACK] Seq=98 Ack=2117435 Win=1606400 Len=0 TSval=5999825 TSecr=830906435
298   0.030218 54.230.159.132 -> 172.31.29.138 TCP 2962 [TCP segment of a reassembled PDU]
299   0.030220 172.31.29.138 -> 54.230.159.132 TCP 66 51198 > http [ACK] Seq=98 Ack=2120331 Win=1606400 Len=0 TSval=5999825 TSecr=830906435
300   0.030287 54.230.159.132 -> 172.31.29.138 TCP 26130 [TCP segment of a reassembled PDU]
301   0.030295 172.31.29.138 -> 54.230.159.132 TCP 66 51198 > http [ACK] Seq=98 Ack=2146395 Win=1606400 Len=0 TSval=5999825 TSecr=830906435
302   0.030323 54.230.159.132 -> 172.31.29.138 TCP 15994 [TCP segment of a reassembled PDU]
303   0.030327 172.31.29.138 -> 54.230.159.132 TCP 66 51198 > http [ACK] Seq=98 Ack=2162323 Win=1606400 Len=0 TSval=5999825 TSecr=830906435
304   0.030427 54.230.159.132 -> 172.31.29.138 TCP 17442 [TCP segment of a reassembled PDU]
305   0.030433 172.31.29.138 -> 54.230.159.132 TCP 66 51198 > http [ACK] Seq=98 Ack=2179699 Win=1606400 Len=0 TSval=5999825 TSecr=830906435
306   0.030458 54.230.159.132 -> 172.31.29.138 TCP 8754 [TCP segment of a reassembled PDU]
307   0.030461 172.31.29.138 -> 54.230.159.132 TCP 66 51198 > http [ACK] Seq=98 Ack=2188387 Win=1606400 Len=0 TSval=5999825 TSecr=830906435
308   0.030578 54.230.159.132 -> 172.31.29.138 TCP 53642 [TCP segment of a reassembled PDU]
309   0.030589 172.31.29.138 -> 54.230.159.132 TCP 66 51198 > http [ACK] Seq=98 Ack=2241963 Win=1606400 Len=0 TSval=5999825 TSecr=830906435
310   0.030681 54.230.159.132 -> 172.31.29.138 TCP 26130 [TCP segment of a reassembled PDU]
311   0.030689 172.31.29.138 -> 54.230.159.132 TCP 66 51198 > http [ACK] Seq=98 Ack=2268027 Win=1606400 Len=0 TSval=5999825 TSecr=830906435
312   0.030712 54.230.159.132 -> 172.31.29.138 TCP 17442 [TCP segment of a reassembled PDU]
313   0.030716 172.31.29.138 -> 54.230.159.132 TCP 66 51198 > http [ACK] Seq=98 Ack=2285403 Win=1606400 Len=0 TSval=5999825 TSecr=830906435
314   0.031038 54.230.159.132 -> 172.31.29.138 TCP 18890 [TCP segment of a reassembled PDU]
315   0.031045 172.31.29.138 -> 54.230.159.132 TCP 66 51198 > http [ACK] Seq=98 Ack=2304227 Win=1606400 Len=0 TSval=5999825 TSecr=830906435
316   0.031066 54.230.159.132 -> 172.31.29.138 TCP 7306 [TCP segment of a reassembled PDU]
317   0.031069 172.31.29.138 -> 54.230.159.132 TCP 66 51198 > http [ACK] Seq=98 Ack=2311467 Win=1606400 Len=0 TSval=5999825 TSecr=830906435
318   0.031165 54.230.159.132 -> 172.31.29.138 TCP 26130 [TCP segment of a reassembled PDU]
319   0.031173 172.31.29.138 -> 54.230.159.132 TCP 66 51198 > http [ACK] Seq=98 Ack=2337531 Win=1606400 Len=0 TSval=5999825 TSecr=830906435
320   0.031180 54.230.159.132 -> 172.31.29.138 TCP 1514 [TCP segment of a reassembled PDU]
321   0.031197 54.230.159.132 -> 172.31.29.138 TCP 13098 [TCP segment of a reassembled PDU]
322   0.031201 172.31.29.138 -> 54.230.159.132 TCP 66 51198 > http [ACK] Seq=98 Ack=2352011 Win=1606400 Len=0 TSval=5999825 TSecr=830906435
323   0.031212 54.230.159.132 -> 172.31.29.138 TCP 11650 [TCP segment of a reassembled PDU]
324   0.031216 172.31.29.138 -> 54.230.159.132 TCP 66 51198 > http [ACK] Seq=98 Ack=2363595 Win=1606400 Len=0 TSval=5999825 TSecr=830906435
325   0.031255 54.230.159.132 -> 172.31.29.138 TCP 21786 [TCP segment of a reassembled PDU]
326   0.031268 172.31.29.138 -> 54.230.159.132 TCP 66 51198 > http [ACK] Seq=98 Ack=2385315 Win=1606400 Len=0 TSval=5999825 TSecr=830906435
327   0.031328 54.230.159.132 -> 172.31.29.138 TCP 20338 [TCP segment of a reassembled PDU]
328   0.031333 172.31.29.138 -> 54.230.159.132 TCP 66 51198 > http [ACK] Seq=98 Ack=2405587 Win=1606400 Len=0 TSval=5999825 TSecr=830906435
329   0.031447 54.230.159.132 -> 172.31.29.138 TCP 26130 [TCP segment of a reassembled PDU]
330   0.031453 172.31.29.138 -> 54.230.159.132 TCP 66 51198 > http [ACK] Seq=98 Ack=2431651 Win=1606400 Len=0 TSval=5999825 TSecr=830906435
331   0.031500 54.230.159.132 -> 172.31.29.138 TCP 26130 [TCP segment of a reassembled PDU]
332   0.031506 172.31.29.138 -> 54.230.159.132 TCP 66 51198 > http [ACK] Seq=98 Ack=2457715 Win=1606400 Len=0 TSval=5999825 TSecr=830906435
333   0.031551 54.230.159.132 -> 172.31.29.138 TCP 23234 [TCP segment of a reassembled PDU]
334   0.031557 172.31.29.138 -> 54.230.159.132 TCP 66 51198 > http [ACK] Seq=98 Ack=2480883 Win=1606400 Len=0 TSval=5999825 TSecr=830906435
335   0.031823 54.230.159.132 -> 172.31.29.138 TCP 11650 [TCP segment of a reassembled PDU]
336   0.031831 172.31.29.138 -> 54.230.159.132 TCP 66 51198 > http [ACK] Seq=98 Ack=2492467 Win=1606400 Len=0 TSval=5999825 TSecr=830906435
337   0.031975 54.230.159.132 -> 172.31.29.138 TCP 26130 [TCP segment of a reassembled PDU]
338   0.031983 172.31.29.138 -> 54.230.159.132 TCP 66 51198 > http [ACK] Seq=98 Ack=2518531 Win=1606400 Len=0 TSval=5999825 TSecr=830906435
339   0.031989 54.230.159.132 -> 172.31.29.138 TCP 1514 [TCP segment of a reassembled PDU]
340   0.032036 54.230.159.132 -> 172.31.29.138 TCP 24682 [TCP segment of a reassembled PDU]
341   0.032042 172.31.29.138 -> 54.230.159.132 TCP 66 51198 > http [ACK] Seq=98 Ack=2544595 Win=1606400 Len=0 TSval=5999825 TSecr=830906435
342   0.032129 54.230.159.132 -> 172.31.29.138 TCP 36266 [TCP segment of a reassembled PDU]
343   0.032136 172.31.29.138 -> 54.230.159.132 TCP 66 51198 > http [ACK] Seq=98 Ack=2580795 Win=1606400 Len=0 TSval=5999825 TSecr=830906435
344   0.032185 54.230.159.132 -> 172.31.29.138 TCP 8754 [TCP segment of a reassembled PDU]
345   0.032189 172.31.29.138 -> 54.230.159.132 TCP 66 51198 > http [ACK] Seq=98 Ack=2589483 Win=1606400 Len=0 TSval=5999825 TSecr=830906435
346   0.032283 54.230.159.132 -> 172.31.29.138 TCP 26130 [TCP segment of a reassembled PDU]
