[Measurement for 10mb at 22:35:26 19.35.2014] 
Tshark:

  1   0.000000 172.31.29.138 -> 172.31.0.2   DNS 89 Standard query 0x3885  A d39wppo36gwqpx.cloudfront.net
  2   0.000036 172.31.29.138 -> 172.31.0.2   DNS 89 Standard query 0x821c  AAAA d39wppo36gwqpx.cloudfront.net
  3   0.000532   172.31.0.2 -> 172.31.29.138 DNS 217 Standard query response 0x3885  A 54.192.156.109 A 54.192.157.149 A 54.192.159.174 A 54.230.157.230 A 54.230.158.139 A 54.230.158.152 A 54.230.158.223 A 54.230.159.132
  4   0.000542   172.31.0.2 -> 172.31.29.138 DNS 170 Standard query response 0x821c 
  5   0.003865 172.31.29.138 -> 54.192.156.109 TCP 74 55850 > http [SYN] Seq=0 Win=26883 Len=0 MSS=8961 SACK_PERM=1 TSval=5099884 TSecr=0 WS=128
  6   0.004541 54.192.156.109 -> 172.31.29.138 TCP 74 http > 55850 [SYN, ACK] Seq=0 Ack=1 Win=14480 Len=0 MSS=1460 SACK_PERM=1 TSval=831398653 TSecr=5099884 WS=128
  7   0.004565 172.31.29.138 -> 54.192.156.109 TCP 66 55850 > http [ACK] Seq=1 Ack=1 Win=27008 Len=0 TSval=5099884 TSecr=831398653
  8   0.004601 172.31.29.138 -> 54.192.156.109 HTTP 163 GET /10mb HTTP/1.1 
  9   0.005516 54.192.156.109 -> 172.31.29.138 TCP 66 http > 55850 [ACK] Seq=1 Ack=98 Win=14592 Len=0 TSval=831398653 TSecr=5099884
 10   0.007808 54.192.156.109 -> 172.31.29.138 TCP 524 [TCP segment of a reassembled PDU]
 11   0.007818 172.31.29.138 -> 54.192.156.109 TCP 66 55850 > http [ACK] Seq=98 Ack=459 Win=28032 Len=0 TSval=5099885 TSecr=831398654
 12   0.007884 54.192.156.109 -> 172.31.29.138 TCP 13098 [TCP segment of a reassembled PDU]
 13   0.007895 172.31.29.138 -> 54.192.156.109 TCP 66 55850 > http [ACK] Seq=98 Ack=13491 Win=54144 Len=0 TSval=5099885 TSecr=831398654
 14   0.008558 54.192.156.109 -> 172.31.29.138 TCP 2962 [TCP segment of a reassembled PDU]
 15   0.008564 172.31.29.138 -> 54.192.156.109 TCP 66 55850 > http [ACK] Seq=98 Ack=16387 Win=59904 Len=0 TSval=5099885 TSecr=831398654
 16   0.008635 54.192.156.109 -> 172.31.29.138 TCP 10202 [TCP segment of a reassembled PDU]
 17   0.008642 172.31.29.138 -> 54.192.156.109 TCP 66 55850 > http [ACK] Seq=98 Ack=26523 Win=80128 Len=0 TSval=5099885 TSecr=831398654
 18   0.009317 54.192.156.109 -> 172.31.29.138 TCP 2962 [TCP segment of a reassembled PDU]
 19   0.009323 172.31.29.138 -> 54.192.156.109 TCP 66 55850 > http [ACK] Seq=98 Ack=29419 Win=85888 Len=0 TSval=5099885 TSecr=831398654
 20   0.009388 54.192.156.109 -> 172.31.29.138 TCP 7306 [TCP segment of a reassembled PDU]
 21   0.009395 172.31.29.138 -> 54.192.156.109 TCP 66 55850 > http [ACK] Seq=98 Ack=36659 Win=100480 Len=0 TSval=5099885 TSecr=831398654
 22   0.009421 54.192.156.109 -> 172.31.29.138 TCP 10202 [TCP segment of a reassembled PDU]
 23   0.009427 172.31.29.138 -> 54.192.156.109 TCP 66 55850 > http [ACK] Seq=98 Ack=46795 Win=90368 Len=0 TSval=5099885 TSecr=831398654
 24   0.010122 54.192.156.109 -> 172.31.29.138 TCP 2962 [TCP segment of a reassembled PDU]
 25   0.010128 172.31.29.138 -> 54.192.156.109 TCP 66 55850 > http [ACK] Seq=98 Ack=49691 Win=106240 Len=0 TSval=5099886 TSecr=831398654
 26   0.010154 54.192.156.109 -> 172.31.29.138 TCP 2962 [TCP segment of a reassembled PDU]
 27   0.010159 172.31.29.138 -> 54.192.156.109 TCP 66 55850 > http [ACK] Seq=98 Ack=52587 Win=112000 Len=0 TSval=5099886 TSecr=831398654
 28   0.010228 54.192.156.109 -> 172.31.29.138 TCP 13098 [TCP segment of a reassembled PDU]
 29   0.010237 172.31.29.138 -> 54.192.156.109 TCP 66 55850 > http [ACK] Seq=98 Ack=65619 Win=138112 Len=0 TSval=5099886 TSecr=831398654
 30   0.010858 54.192.156.109 -> 172.31.29.138 TCP 1514 [TCP segment of a reassembled PDU]
 31   0.010863 172.31.29.138 -> 54.192.156.109 TCP 66 55850 > http [ACK] Seq=98 Ack=67067 Win=140928 Len=0 TSval=5099886 TSecr=831398654
 32   0.010977 54.192.156.109 -> 172.31.29.138 TCP 21786 [TCP segment of a reassembled PDU]
 33   0.010990 172.31.29.138 -> 54.192.156.109 TCP 66 55850 > http [ACK] Seq=98 Ack=88787 Win=184448 Len=0 TSval=5099886 TSecr=831398654
 34   0.010997 54.192.156.109 -> 172.31.29.138 TCP 2962 [TCP segment of a reassembled PDU]
 35   0.011001 172.31.29.138 -> 54.192.156.109 TCP 66 55850 > http [ACK] Seq=98 Ack=91683 Win=190208 Len=0 TSval=5099886 TSecr=831398654
 36   0.011626 54.192.156.109 -> 172.31.29.138 TCP 2962 [TCP segment of a reassembled PDU]
 37   0.011632 172.31.29.138 -> 54.192.156.109 TCP 66 55850 > http [ACK] Seq=98 Ack=94579 Win=195968 Len=0 TSval=5099886 TSecr=831398654
 38   0.011763 54.192.156.109 -> 172.31.29.138 TCP 23234 [TCP segment of a reassembled PDU]
 39   0.011773 172.31.29.138 -> 54.192.156.109 TCP 66 55850 > http [ACK] Seq=98 Ack=117747 Win=242304 Len=0 TSval=5099886 TSecr=831398654
 40   0.012407 54.192.156.109 -> 172.31.29.138 TCP 2962 [TCP segment of a reassembled PDU]
 41   0.012413 172.31.29.138 -> 54.192.156.109 TCP 66 55850 > http [ACK] Seq=98 Ack=120643 Win=248064 Len=0 TSval=5099886 TSecr=831398654
 42   0.012548 54.192.156.109 -> 172.31.29.138 TCP 23234 [TCP segment of a reassembled PDU]
 43   0.012561 172.31.29.138 -> 54.192.156.109 TCP 66 55850 > http [ACK] Seq=98 Ack=143811 Win=286336 Len=0 TSval=5099886 TSecr=831398654
 44   0.012918 54.192.156.109 -> 172.31.29.138 TCP 2962 [TCP segment of a reassembled PDU]
 45   0.012924 172.31.29.138 -> 54.192.156.109 TCP 66 55850 > http [ACK] Seq=98 Ack=146707 Win=300288 Len=0 TSval=5099886 TSecr=831398654
 46   0.013039 54.192.156.109 -> 172.31.29.138 TCP 11650 [TCP segment of a reassembled PDU]
 47   0.013048 172.31.29.138 -> 54.192.156.109 TCP 66 55850 > http [ACK] Seq=98 Ack=158291 Win=305408 Len=0 TSval=5099886 TSecr=831398654
 48   0.013268 54.192.156.109 -> 172.31.29.138 TCP 20338 [TCP segment of a reassembled PDU]
 49   0.013280 172.31.29.138 -> 54.192.156.109 TCP 66 55850 > http [ACK] Seq=98 Ack=178563 Win=291072 Len=0 TSval=5099886 TSecr=831398654
 50   0.013341 54.192.156.109 -> 172.31.29.138 TCP 4410 [TCP segment of a reassembled PDU]
 51   0.013347 172.31.29.138 -> 54.192.156.109 TCP 66 55850 > http [ACK] Seq=98 Ack=182907 Win=317184 Len=0 TSval=5099886 TSecr=831398654
 52   0.013685 54.192.156.109 -> 172.31.29.138 TCP 2962 [TCP segment of a reassembled PDU]
 53   0.013690 172.31.29.138 -> 54.192.156.109 TCP 66 55850 > http [ACK] Seq=98 Ack=185803 Win=319616 Len=0 TSval=5099886 TSecr=831398654
 54   0.013817 54.192.156.109 -> 172.31.29.138 TCP 10202 [TCP segment of a reassembled PDU]
 55   0.013825 172.31.29.138 -> 54.192.156.109 TCP 66 55850 > http [ACK] Seq=98 Ack=195939 Win=309504 Len=0 TSval=5099886 TSecr=831398654
 56   0.013922 54.192.156.109 -> 172.31.29.138 TCP 1514 [TCP segment of a reassembled PDU]
 57   0.013927 172.31.29.138 -> 54.192.156.109 TCP 66 55850 > http [ACK] Seq=98 Ack=197387 Win=321920 Len=0 TSval=5099886 TSecr=831398654
 58   0.014107 54.192.156.109 -> 172.31.29.138 TCP 24682 [TCP segment of a reassembled PDU]
 59   0.014120 172.31.29.138 -> 54.192.156.109 TCP 66 55850 > http [ACK] Seq=98 Ack=222003 Win=297344 Len=0 TSval=5099886 TSecr=831398654
 60   0.014478 54.192.156.109 -> 172.31.29.138 TCP 7306 [TCP segment of a reassembled PDU]
 61   0.014485 172.31.29.138 -> 54.192.156.109 TCP 66 55850 > http [ACK] Seq=98 Ack=229243 Win=337920 Len=0 TSval=5099887 TSecr=831398654
 62   0.014607 54.192.156.109 -> 172.31.29.138 TCP 15994 [TCP segment of a reassembled PDU]
 63   0.014617 172.31.29.138 -> 54.192.156.109 TCP 66 55850 > http [ACK] Seq=98 Ack=245171 Win=369792 Len=0 TSval=5099887 TSecr=831398654
 64   0.014853 54.192.156.109 -> 172.31.29.138 TCP 27578 [TCP segment of a reassembled PDU]
 65   0.014867 172.31.29.138 -> 54.192.156.109 TCP 66 55850 > http [ACK] Seq=98 Ack=272683 Win=424832 Len=0 TSval=5099887 TSecr=831398654
 66   0.015211 54.192.156.109 -> 172.31.29.138 TCP 4410 [TCP segment of a reassembled PDU]
 67   0.015218 172.31.29.138 -> 54.192.156.109 TCP 66 55850 > http [ACK] Seq=98 Ack=277027 Win=433408 Len=0 TSval=5099887 TSecr=831398654
 68   0.015359 54.192.156.109 -> 172.31.29.138 TCP 17442 [TCP segment of a reassembled PDU]
 69   0.015369 172.31.29.138 -> 54.192.156.109 TCP 66 55850 > http [ACK] Seq=98 Ack=294403 Win=468224 Len=0 TSval=5099887 TSecr=831398654
 70   0.015598 54.192.156.109 -> 172.31.29.138 TCP 23234 [TCP segment of a reassembled PDU]
 71   0.015610 172.31.29.138 -> 54.192.156.109 TCP 66 55850 > http [ACK] Seq=98 Ack=317571 Win=514560 Len=0 TSval=5099887 TSecr=831398654
 72   0.015690 54.192.156.109 -> 172.31.29.138 TCP 10202 [TCP segment of a reassembled PDU]
 73   0.015698 172.31.29.138 -> 54.192.156.109 TCP 66 55850 > http [ACK] Seq=98 Ack=327707 Win=534784 Len=0 TSval=5099887 TSecr=831398654
 74   0.016025 54.192.156.109 -> 172.31.29.138 TCP 8754 [TCP segment of a reassembled PDU]
 75   0.016033 172.31.29.138 -> 54.192.156.109 TCP 66 55850 > http [ACK] Seq=98 Ack=336395 Win=552192 Len=0 TSval=5099887 TSecr=831398655
 76   0.016150 54.192.156.109 -> 172.31.29.138 TCP 7306 [TCP segment of a reassembled PDU]
 77   0.016157 172.31.29.138 -> 54.192.156.109 TCP 66 55850 > http [ACK] Seq=98 Ack=343635 Win=566656 Len=0 TSval=5099887 TSecr=831398655
 78   0.016247 54.192.156.109 -> 172.31.29.138 TCP 4410 [TCP segment of a reassembled PDU]
 79   0.016253 172.31.29.138 -> 54.192.156.109 TCP 66 55850 > http [ACK] Seq=98 Ack=347979 Win=575360 Len=0 TSval=5099887 TSecr=831398655
 80   0.016433 54.192.156.109 -> 172.31.29.138 TCP 29026 [TCP segment of a reassembled PDU]
 81   0.016447 172.31.29.138 -> 54.192.156.109 TCP 66 55850 > http [ACK] Seq=98 Ack=376939 Win=633344 Len=0 TSval=5099887 TSecr=831398655
 82   0.016771 54.192.156.109 -> 172.31.29.138 TCP 1514 [TCP segment of a reassembled PDU]
 83   0.016776 172.31.29.138 -> 54.192.156.109 TCP 66 55850 > http [ACK] Seq=98 Ack=378387 Win=636160 Len=0 TSval=5099887 TSecr=831398655
 84   0.016979 54.192.156.109 -> 172.31.29.138 TCP 27578 [TCP segment of a reassembled PDU]
 85   0.016993 172.31.29.138 -> 54.192.156.109 TCP 66 55850 > http [ACK] Seq=98 Ack=405899 Win=691200 Len=0 TSval=5099887 TSecr=831398655
 86   0.017001 54.192.156.109 -> 172.31.29.138 TCP 2962 [TCP segment of a reassembled PDU]
 87   0.017004 172.31.29.138 -> 54.192.156.109 TCP 66 55850 > http [ACK] Seq=98 Ack=408795 Win=696960 Len=0 TSval=5099887 TSecr=831398655
 88   0.017008 54.192.156.109 -> 172.31.29.138 TCP 2962 [TCP segment of a reassembled PDU]
 89   0.017011 172.31.29.138 -> 54.192.156.109 TCP 66 55850 > http [ACK] Seq=98 Ack=411691 Win=702848 Len=0 TSval=5099887 TSecr=831398655
 90   0.017201 54.192.156.109 -> 172.31.29.138 TCP 27578 [TCP segment of a reassembled PDU]
 91   0.017237 172.31.29.138 -> 54.192.156.109 TCP 66 55850 > http [ACK] Seq=98 Ack=439203 Win=757760 Len=0 TSval=5099887 TSecr=831398655
 92   0.017263 54.192.156.109 -> 172.31.29.138 TCP 4410 [TCP segment of a reassembled PDU]
 93   0.017268 172.31.29.138 -> 54.192.156.109 TCP 66 55850 > http [ACK] Seq=98 Ack=443547 Win=766464 Len=0 TSval=5099887 TSecr=831398655
 94   0.017609 54.192.156.109 -> 172.31.29.138 TCP 14546 [TCP segment of a reassembled PDU]
 95   0.017619 172.31.29.138 -> 54.192.156.109 TCP 66 55850 > http [ACK] Seq=98 Ack=458027 Win=795520 Len=0 TSval=5099887 TSecr=831398655
 96   0.017728 54.192.156.109 -> 172.31.29.138 TCP 15994 [TCP segment of a reassembled PDU]
 97   0.017738 172.31.29.138 -> 54.192.156.109 TCP 66 55850 > http [ACK] Seq=98 Ack=473955 Win=827264 Len=0 TSval=5099887 TSecr=831398655
 98   0.017843 54.192.156.109 -> 172.31.29.138 TCP 14546 [TCP segment of a reassembled PDU]
 99   0.017852 172.31.29.138 -> 54.192.156.109 TCP 66 55850 > http [ACK] Seq=98 Ack=488435 Win=856320 Len=0 TSval=5099887 TSecr=831398655
100   0.017986 54.192.156.109 -> 172.31.29.138 TCP 24682 [TCP segment of a reassembled PDU]
101   0.017999 172.31.29.138 -> 54.192.156.109 TCP 66 55850 > http [ACK] Seq=98 Ack=513051 Win=881664 Len=0 TSval=5099887 TSecr=831398655
102   0.018297 54.192.156.109 -> 172.31.29.138 TCP 8754 [TCP segment of a reassembled PDU]
103   0.018305 172.31.29.138 -> 54.192.156.109 TCP 66 55850 > http [ACK] Seq=98 Ack=521739 Win=922880 Len=0 TSval=5099888 TSecr=831398655
104   0.018457 54.192.156.109 -> 172.31.29.138 TCP 17442 [TCP segment of a reassembled PDU]
105   0.018467 172.31.29.138 -> 54.192.156.109 TCP 66 55850 > http [ACK] Seq=98 Ack=539115 Win=957696 Len=0 TSval=5099888 TSecr=831398655
106   0.018532 54.192.156.109 -> 172.31.29.138 TCP 7306 [TCP segment of a reassembled PDU]
107   0.018539 172.31.29.138 -> 54.192.156.109 TCP 66 55850 > http [ACK] Seq=98 Ack=546355 Win=972160 Len=0 TSval=5099888 TSecr=831398655
108   0.018702 54.192.156.109 -> 172.31.29.138 TCP 18890 [TCP segment of a reassembled PDU]
109   0.018713 172.31.29.138 -> 54.192.156.109 TCP 66 55850 > http [ACK] Seq=98 Ack=565179 Win=1009792 Len=0 TSval=5099888 TSecr=831398655
110   0.018809 54.192.156.109 -> 172.31.29.138 TCP 2962 [TCP segment of a reassembled PDU]
111   0.018815 172.31.29.138 -> 54.192.156.109 TCP 66 55850 > http [ACK] Seq=98 Ack=568075 Win=1015552 Len=0 TSval=5099888 TSecr=831398655
112   0.019236 54.192.156.109 -> 172.31.29.138 TCP 26130 [TCP segment of a reassembled PDU]
113   0.019250 172.31.29.138 -> 54.192.156.109 TCP 66 55850 > http [ACK] Seq=98 Ack=594139 Win=1067648 Len=0 TSval=5099888 TSecr=831398655
114   0.019260 54.192.156.109 -> 172.31.29.138 TCP 10202 [TCP segment of a reassembled PDU]
115   0.019269 172.31.29.138 -> 54.192.156.109 TCP 66 55850 > http [ACK] Seq=98 Ack=604275 Win=1088000 Len=0 TSval=5099888 TSecr=831398655
116   0.019306 54.192.156.109 -> 172.31.29.138 TCP 2962 [TCP segment of a reassembled PDU]
117   0.019310 172.31.29.138 -> 54.192.156.109 TCP 66 55850 > http [ACK] Seq=98 Ack=607171 Win=1093760 Len=0 TSval=5099888 TSecr=831398655
118   0.019474 54.192.156.109 -> 172.31.29.138 TCP 26130 [TCP segment of a reassembled PDU]
119   0.019487 172.31.29.138 -> 54.192.156.109 TCP 66 55850 > http [ACK] Seq=98 Ack=633235 Win=1145856 Len=0 TSval=5099888 TSecr=831398655
120   0.019510 54.192.156.109 -> 172.31.29.138 TCP 18890 [TCP segment of a reassembled PDU]
121   0.019519 172.31.29.138 -> 54.192.156.109 TCP 66 55850 > http [ACK] Seq=98 Ack=652059 Win=1183488 Len=0 TSval=5099888 TSecr=831398655
122   0.019790 54.192.156.109 -> 172.31.29.138 TCP 2962 [TCP segment of a reassembled PDU]
123   0.019796 172.31.29.138 -> 54.192.156.109 TCP 66 55850 > http [ACK] Seq=98 Ack=654955 Win=1189376 Len=0 TSval=5099888 TSecr=831398655
124   0.019947 54.192.156.109 -> 172.31.29.138 TCP 14546 [TCP segment of a reassembled PDU]
125   0.019956 172.31.29.138 -> 54.192.156.109 TCP 66 55850 > http [ACK] Seq=98 Ack=669435 Win=1218304 Len=0 TSval=5099888 TSecr=831398655
126   0.020252 54.192.156.109 -> 172.31.29.138 TCP 26130 [TCP segment of a reassembled PDU]
127   0.020265 172.31.29.138 -> 54.192.156.109 TCP 66 55850 > http [ACK] Seq=98 Ack=695499 Win=1270400 Len=0 TSval=5099888 TSecr=831398655
128   0.020302 54.192.156.109 -> 172.31.29.138 TCP 18890 [TCP segment of a reassembled PDU]
129   0.020310 172.31.29.138 -> 54.192.156.109 TCP 66 55850 > http [ACK] Seq=98 Ack=714323 Win=1308032 Len=0 TSval=5099888 TSecr=831398655
130   0.020339 54.192.156.109 -> 172.31.29.138 TCP 7306 [TCP segment of a reassembled PDU]
131   0.020345 172.31.29.138 -> 54.192.156.109 TCP 66 55850 > http [ACK] Seq=98 Ack=721563 Win=1322496 Len=0 TSval=5099888 TSecr=831398655
132   0.020372 54.192.156.109 -> 172.31.29.138 TCP 5858 [TCP segment of a reassembled PDU]
133   0.020379 172.31.29.138 -> 54.192.156.109 TCP 66 55850 > http [ACK] Seq=98 Ack=727355 Win=1334144 Len=0 TSval=5099888 TSecr=831398655
134   0.020444 54.192.156.109 -> 172.31.29.138 TCP 7306 [TCP segment of a reassembled PDU]
135   0.020451 172.31.29.138 -> 54.192.156.109 TCP 66 55850 > http [ACK] Seq=98 Ack=734595 Win=1348608 Len=0 TSval=5099888 TSecr=831398655
136   0.020742 54.192.156.109 -> 172.31.29.138 TCP 26130 [TCP segment of a reassembled PDU]
137   0.020756 172.31.29.138 -> 54.192.156.109 TCP 66 55850 > http [ACK] Seq=98 Ack=760659 Win=1400704 Len=0 TSval=5099888 TSecr=831398655
138   0.020767 54.192.156.109 -> 172.31.29.138 TCP 7306 [TCP segment of a reassembled PDU]
139   0.020771 172.31.29.138 -> 54.192.156.109 TCP 66 55850 > http [ACK] Seq=98 Ack=767899 Win=1415168 Len=0 TSval=5099888 TSecr=831398655
140   0.020809 54.192.156.109 -> 172.31.29.138 TCP 1514 [TCP segment of a reassembled PDU]
141   0.020813 172.31.29.138 -> 54.192.156.109 TCP 66 55850 > http [ACK] Seq=98 Ack=769347 Win=1418112 Len=0 TSval=5099888 TSecr=831398655
142   0.020997 54.192.156.109 -> 172.31.29.138 TCP 23234 [TCP segment of a reassembled PDU]
143   0.021009 172.31.29.138 -> 54.192.156.109 TCP 66 55850 > http [ACK] Seq=98 Ack=792515 Win=1464448 Len=0 TSval=5099888 TSecr=831398655
144   0.021069 54.192.156.109 -> 172.31.29.138 TCP 4410 [TCP segment of a reassembled PDU]
145   0.021074 172.31.29.138 -> 54.192.156.109 TCP 66 55850 > http [ACK] Seq=98 Ack=796859 Win=1473152 Len=0 TSval=5099888 TSecr=831398655
146   0.021260 54.192.156.109 -> 172.31.29.138 TCP 26130 [TCP segment of a reassembled PDU]
147   0.021274 172.31.29.138 -> 54.192.156.109 TCP 66 55850 > http [ACK] Seq=98 Ack=822923 Win=1479936 Len=0 TSval=5099888 TSecr=831398655
148   0.021300 54.192.156.109 -> 172.31.29.138 TCP 7306 [TCP segment of a reassembled PDU]
149   0.021305 172.31.29.138 -> 54.192.156.109 TCP 66 55850 > http [ACK] Seq=98 Ack=830163 Win=1472768 Len=0 TSval=5099888 TSecr=831398655
150   0.021465 54.192.156.109 -> 172.31.29.138 TCP 26130 [TCP segment of a reassembled PDU]
151   0.021478 172.31.29.138 -> 54.192.156.109 TCP 66 55850 > http [ACK] Seq=98 Ack=856227 Win=1479936 Len=0 TSval=5099888 TSecr=831398655
152   0.021489 54.192.156.109 -> 172.31.29.138 TCP 8754 [TCP segment of a reassembled PDU]
153   0.021498 172.31.29.138 -> 54.192.156.109 TCP 66 55850 > http [ACK] Seq=98 Ack=864915 Win=1471360 Len=0 TSval=5099888 TSecr=831398655
154   0.021648 54.192.156.109 -> 172.31.29.138 TCP 8754 [TCP segment of a reassembled PDU]
155   0.021655 172.31.29.138 -> 54.192.156.109 TCP 66 55850 > http [ACK] Seq=98 Ack=873603 Win=1508480 Len=0 TSval=5099888 TSecr=831398655
156   0.021662 54.192.156.109 -> 172.31.29.138 TCP 1514 [TCP Previous segment not captured] [TCP segment of a reassembled PDU]
157   0.021664 172.31.29.138 -> 54.192.156.109 TCP 78 [TCP Dup ACK 155#1] 55850 > http [ACK] Seq=98 Ack=873603 Win=1508480 Len=0 TSval=5099888 TSecr=831398655 SLE=875051 SRE=876499
158   0.021675 54.192.156.109 -> 172.31.29.138 TCP 1514 [TCP Out-Of-Order] [TCP segment of a reassembled PDU]
159   0.021678 172.31.29.138 -> 54.192.156.109 TCP 66 55850 > http [ACK] Seq=98 Ack=876499 Win=1505664 Len=0 TSval=5099888 TSecr=831398655
160   0.021778 54.192.156.109 -> 172.31.29.138 TCP 26130 [TCP segment of a reassembled PDU]
161   0.021791 172.31.29.138 -> 54.192.156.109 TCP 66 55850 > http [ACK] Seq=98 Ack=902563 Win=1479936 Len=0 TSval=5099888 TSecr=831398655
162   0.021798 54.192.156.109 -> 172.31.29.138 TCP 1514 [TCP segment of a reassembled PDU]
163   0.021800 172.31.29.138 -> 54.192.156.109 TCP 66 55850 > http [ACK] Seq=98 Ack=904011 Win=1478528 Len=0 TSval=5099888 TSecr=831398655
164   0.021967 54.192.156.109 -> 172.31.29.138 TCP 26130 [TCP segment of a reassembled PDU]
165   0.021977 172.31.29.138 -> 54.192.156.109 TCP 66 55850 > http [ACK] Seq=98 Ack=930075 Win=1479936 Len=0 TSval=5099888 TSecr=831398655
166   0.022153 54.192.156.109 -> 172.31.29.138 TCP 5858 [TCP segment of a reassembled PDU]
167   0.022160 172.31.29.138 -> 54.192.156.109 TCP 66 55850 > http [ACK] Seq=98 Ack=935867 Win=1513216 Len=0 TSval=5099889 TSecr=831398655
168   0.022326 54.192.156.109 -> 172.31.29.138 TCP 26130 [TCP segment of a reassembled PDU]
169   0.022340 172.31.29.138 -> 54.192.156.109 TCP 66 55850 > http [ACK] Seq=98 Ack=961931 Win=1487232 Len=0 TSval=5099889 TSecr=831398655
170   0.022352 54.192.156.109 -> 172.31.29.138 TCP 11650 [TCP segment of a reassembled PDU]
171   0.022362 172.31.29.138 -> 54.192.156.109 TCP 66 55850 > http [ACK] Seq=98 Ack=973515 Win=1475712 Len=0 TSval=5099889 TSecr=831398655
172   0.022397 54.192.156.109 -> 172.31.29.138 TCP 2962 [TCP segment of a reassembled PDU]
173   0.022403 172.31.29.138 -> 54.192.156.109 TCP 66 55850 > http [ACK] Seq=98 Ack=976411 Win=1517952 Len=0 TSval=5099889 TSecr=831398655
174   0.022576 54.192.156.109 -> 172.31.29.138 TCP 18890 [TCP segment of a reassembled PDU]
175   0.022590 172.31.29.138 -> 54.192.156.109 TCP 66 55850 > http [ACK] Seq=98 Ack=995235 Win=1499136 Len=0 TSval=5099889 TSecr=831398655
176   0.022665 54.192.156.109 -> 172.31.29.138 TCP 11650 [TCP segment of a reassembled PDU]
177   0.022674 172.31.29.138 -> 54.192.156.109 TCP 66 55850 > http [ACK] Seq=98 Ack=1006819 Win=1503744 Len=0 TSval=5099889 TSecr=831398655
178   0.022807 54.192.156.109 -> 172.31.29.138 TCP 21786 [TCP segment of a reassembled PDU]
179   0.022819 172.31.29.138 -> 54.192.156.109 TCP 66 55850 > http [ACK] Seq=98 Ack=1028539 Win=1487104 Len=0 TSval=5099889 TSecr=831398655
180   0.022891 54.192.156.109 -> 172.31.29.138 TCP 5858 [TCP segment of a reassembled PDU]
181   0.022897 172.31.29.138 -> 54.192.156.109 TCP 66 55850 > http [ACK] Seq=98 Ack=1034331 Win=1513216 Len=0 TSval=5099889 TSecr=831398655
182   0.023000 54.192.156.109 -> 172.31.29.138 TCP 4410 [TCP segment of a reassembled PDU]
183   0.023005 172.31.29.138 -> 54.192.156.109 TCP 66 55850 > http [ACK] Seq=98 Ack=1038675 Win=1515648 Len=0 TSval=5099889 TSecr=831398655
184   0.023071 54.192.156.109 -> 172.31.29.138 TCP 21786 [TCP segment of a reassembled PDU]
185   0.023083 172.31.29.138 -> 54.192.156.109 TCP 66 55850 > http [ACK] Seq=98 Ack=1060395 Win=1494016 Len=0 TSval=5099889 TSecr=831398655
186   0.023311 54.192.156.109 -> 172.31.29.138 TCP 26130 [TCP segment of a reassembled PDU]
187   0.023325 172.31.29.138 -> 54.192.156.109 TCP 66 55850 > http [ACK] Seq=98 Ack=1086459 Win=1479936 Len=0 TSval=5099889 TSecr=831398655
188   0.023334 54.192.156.109 -> 172.31.29.138 TCP 4410 [TCP segment of a reassembled PDU]
189   0.023359 54.192.156.109 -> 172.31.29.138 TCP 20338 [TCP segment of a reassembled PDU]
190   0.023375 172.31.29.138 -> 54.192.156.109 TCP 66 55850 > http [ACK] Seq=98 Ack=1111075 Win=1455360 Len=0 TSval=5099889 TSecr=831398655
191   0.023519 54.192.156.109 -> 172.31.29.138 TCP 14546 [TCP segment of a reassembled PDU]
192   0.023528 172.31.29.138 -> 54.192.156.109 TCP 66 55850 > http [ACK] Seq=98 Ack=1125555 Win=1498880 Len=0 TSval=5099889 TSecr=831398655
193   0.023787 54.192.156.109 -> 172.31.29.138 TCP 21786 [TCP segment of a reassembled PDU]
194   0.023812 172.31.29.138 -> 54.192.156.109 TCP 66 55850 > http [ACK] Seq=98 Ack=1147275 Win=1487104 Len=0 TSval=5099889 TSecr=831398655
195   0.023923 54.192.156.109 -> 172.31.29.138 TCP 26130 [TCP segment of a reassembled PDU]
196   0.023974 54.192.156.109 -> 172.31.29.138 TCP 26130 [TCP segment of a reassembled PDU]
197   0.024008 54.192.156.109 -> 172.31.29.138 TCP 14546 [TCP segment of a reassembled PDU]
198   0.024015 172.31.29.138 -> 54.192.156.109 TCP 66 55850 > http [ACK] Seq=98 Ack=1173339 Win=1479936 Len=0 TSval=5099889 TSecr=831398655
199   0.024033 172.31.29.138 -> 54.192.156.109 TCP 66 55850 > http [ACK] Seq=98 Ack=1213883 Win=1456000 Len=0 TSval=5099889 TSecr=831398655
200   0.024067 54.192.156.109 -> 172.31.29.138 TCP 17442 [TCP segment of a reassembled PDU]
201   0.024074 172.31.29.138 -> 54.192.156.109 TCP 66 55850 > http [ACK] Seq=98 Ack=1231259 Win=1494144 Len=0 TSval=5099889 TSecr=831398655
202   0.024145 54.192.156.109 -> 172.31.29.138 TCP 5858 [TCP segment of a reassembled PDU]
203   0.024151 172.31.29.138 -> 54.192.156.109 TCP 66 55850 > http [ACK] Seq=98 Ack=1237051 Win=1513216 Len=0 TSval=5099889 TSecr=831398655
204   0.024383 54.192.156.109 -> 172.31.29.138 TCP 1514 [TCP segment of a reassembled PDU]
205   0.024572 54.192.156.109 -> 172.31.29.138 TCP 4410 [TCP segment of a reassembled PDU]
206   0.024578 172.31.29.138 -> 54.192.156.109 TCP 66 55850 > http [ACK] Seq=98 Ack=1242843 Win=1515648 Len=0 TSval=5099889 TSecr=831398655
207   0.024707 54.192.156.109 -> 172.31.29.138 TCP 13098 [TCP segment of a reassembled PDU]
208   0.024750 54.192.156.109 -> 172.31.29.138 TCP 5858 [TCP segment of a reassembled PDU]
209   0.024760 172.31.29.138 -> 54.192.156.109 TCP 66 55850 > http [ACK] Seq=98 Ack=1261667 Win=1513216 Len=0 TSval=5099889 TSecr=831398655
210   0.024811 54.192.156.109 -> 172.31.29.138 TCP 20338 [TCP segment of a reassembled PDU]
211   0.024834 172.31.29.138 -> 54.192.156.109 TCP 66 55850 > http [ACK] Seq=98 Ack=1281939 Win=1492992 Len=0 TSval=5099889 TSecr=831398655
212   0.024872 54.192.156.109 -> 172.31.29.138 TCP 21786 [TCP segment of a reassembled PDU]
213   0.024887 172.31.29.138 -> 54.192.156.109 TCP 66 55850 > http [ACK] Seq=98 Ack=1303659 Win=1487104 Len=0 TSval=5099889 TSecr=831398655
214   0.024920 54.192.156.109 -> 172.31.29.138 TCP 21786 [TCP segment of a reassembled PDU]
215   0.024931 172.31.29.138 -> 54.192.156.109 TCP 66 55850 > http [ACK] Seq=98 Ack=1325379 Win=1487104 Len=0 TSval=5099889 TSecr=831398655
216   0.025030 54.192.156.109 -> 172.31.29.138 TCP 26130 [TCP segment of a reassembled PDU]
217   0.025051 54.192.156.109 -> 172.31.29.138 TCP 14546 [TCP segment of a reassembled PDU]
218   0.025062 54.192.156.109 -> 172.31.29.138 TCP 5858 [TCP segment of a reassembled PDU]
219   0.025152 172.31.29.138 -> 54.192.156.109 TCP 66 55850 > http [ACK] Seq=98 Ack=1371715 Win=1440768 Len=0 TSval=5099889 TSecr=831398655
220   0.025541 54.192.156.109 -> 172.31.29.138 TCP 4410 [TCP segment of a reassembled PDU]
221   0.025548 172.31.29.138 -> 54.192.156.109 TCP 66 55850 > http [ACK] Seq=98 Ack=1376059 Win=1515648 Len=0 TSval=5099889 TSecr=831398655
222   0.025737 54.192.156.109 -> 172.31.29.138 TCP 26130 [TCP segment of a reassembled PDU]
223   0.025758 54.192.156.109 -> 172.31.29.138 TCP 11650 [TCP segment of a reassembled PDU]
224   0.025777 172.31.29.138 -> 54.192.156.109 TCP 66 55850 > http [ACK] Seq=98 Ack=1413707 Win=1478016 Len=0 TSval=5099889 TSecr=831398655
225   0.025795 54.192.156.109 -> 172.31.29.138 TCP 14546 [TCP segment of a reassembled PDU]
226   0.025814 172.31.29.138 -> 54.192.156.109 TCP 66 55850 > http [ACK] Seq=98 Ack=1428187 Win=1479808 Len=0 TSval=5099889 TSecr=831398655
227   0.025844 54.192.156.109 -> 172.31.29.138 TCP 26130 [TCP segment of a reassembled PDU]
228   0.025871 172.31.29.138 -> 54.192.156.109 TCP 66 55850 > http [ACK] Seq=98 Ack=1454251 Win=1456000 Len=0 TSval=5099889 TSecr=831398655
229   0.025886 54.192.156.109 -> 172.31.29.138 TCP 14546 [TCP segment of a reassembled PDU]
230   0.025901 172.31.29.138 -> 54.192.156.109 TCP 66 55850 > http [ACK] Seq=98 Ack=1468731 Win=1456000 Len=0 TSval=5099889 TSecr=831398655
231   0.025928 54.192.156.109 -> 172.31.29.138 TCP 15994 [TCP segment of a reassembled PDU]
232   0.025938 172.31.29.138 -> 54.192.156.109 TCP 66 55850 > http [ACK] Seq=98 Ack=1484659 Win=1496576 Len=0 TSval=5099889 TSecr=831398655
233   0.026078 54.192.156.109 -> 172.31.29.138 TCP 26130 [TCP segment of a reassembled PDU]
234   0.026094 54.192.156.109 -> 172.31.29.138 TCP 4410 [TCP segment of a reassembled PDU]
235   0.026157 172.31.29.138 -> 54.192.156.109 TCP 66 55850 > http [ACK] Seq=98 Ack=1515067 Win=1472768 Len=0 TSval=5099889 TSecr=831398655
236   0.026270 54.192.156.109 -> 172.31.29.138 TCP 1514 [TCP segment of a reassembled PDU]
237   0.026275 172.31.29.138 -> 54.192.156.109 TCP 66 55850 > http [ACK] Seq=98 Ack=1516515 Win=1521152 Len=0 TSval=5099890 TSecr=831398656
238   0.026557 54.192.156.109 -> 172.31.29.138 TCP 4410 [TCP segment of a reassembled PDU]
239   0.026563 172.31.29.138 -> 54.192.156.109 TCP 66 55850 > http [ACK] Seq=98 Ack=1520859 Win=1529856 Len=0 TSval=5099890 TSecr=831398656
240   0.026711 54.192.156.109 -> 172.31.29.138 TCP 26130 [TCP segment of a reassembled PDU]
241   0.026725 172.31.29.138 -> 54.192.156.109 TCP 66 55850 > http [ACK] Seq=98 Ack=1546923 Win=1581952 Len=0 TSval=5099890 TSecr=831398656
242   0.026750 54.192.156.109 -> 172.31.29.138 TCP 20338 [TCP segment of a reassembled PDU]
243   0.026760 172.31.29.138 -> 54.192.156.109 TCP 66 55850 > http [ACK] Seq=98 Ack=1567195 Win=1581952 Len=0 TSval=5099890 TSecr=831398656
244   0.026813 54.192.156.109 -> 172.31.29.138 TCP 15994 [TCP segment of a reassembled PDU]
245   0.026823 172.31.29.138 -> 54.192.156.109 TCP 66 55850 > http [ACK] Seq=98 Ack=1583123 Win=1581952 Len=0 TSval=5099890 TSecr=831398656
246   0.026928 54.192.156.109 -> 172.31.29.138 TCP 26130 [TCP segment of a reassembled PDU]
247   0.026942 172.31.29.138 -> 54.192.156.109 TCP 66 55850 > http [ACK] Seq=98 Ack=1609187 Win=1581952 Len=0 TSval=5099890 TSecr=831398656
248   0.026969 54.192.156.109 -> 172.31.29.138 TCP 20338 [TCP segment of a reassembled PDU]
249   0.026979 172.31.29.138 -> 54.192.156.109 TCP 66 55850 > http [ACK] Seq=98 Ack=1629459 Win=1581952 Len=0 TSval=5099890 TSecr=831398656
250   0.027040 54.192.156.109 -> 172.31.29.138 TCP 13098 [TCP segment of a reassembled PDU]
251   0.027049 172.31.29.138 -> 54.192.156.109 TCP 66 55850 > http [ACK] Seq=98 Ack=1642491 Win=1581952 Len=0 TSval=5099890 TSecr=831398656
252   0.027066 54.192.156.109 -> 172.31.29.138 TCP 4410 [TCP segment of a reassembled PDU]
253   0.027083 172.31.29.138 -> 54.192.156.109 TCP 66 55850 > http [ACK] Seq=98 Ack=1646835 Win=1581952 Len=0 TSval=5099890 TSecr=831398656
254   0.027320 54.192.156.109 -> 172.31.29.138 TCP 14546 [TCP segment of a reassembled PDU]
255   0.027330 172.31.29.138 -> 54.192.156.109 TCP 66 55850 > http [ACK] Seq=98 Ack=1661315 Win=1581952 Len=0 TSval=5099890 TSecr=831398656
256   0.027455 54.192.156.109 -> 172.31.29.138 TCP 26130 [TCP segment of a reassembled PDU]
257   0.027468 172.31.29.138 -> 54.192.156.109 TCP 66 55850 > http [ACK] Seq=98 Ack=1687379 Win=1581952 Len=0 TSval=5099890 TSecr=831398656
258   0.027477 54.192.156.109 -> 172.31.29.138 TCP 4410 [TCP segment of a reassembled PDU]
259   0.027480 172.31.29.138 -> 54.192.156.109 TCP 66 55850 > http [ACK] Seq=98 Ack=1691723 Win=1581952 Len=0 TSval=5099890 TSecr=831398656
260   0.027506 54.192.156.109 -> 172.31.29.138 TCP 20338 [TCP segment of a reassembled PDU]
261   0.027515 172.31.29.138 -> 54.192.156.109 TCP 66 55850 > http [ACK] Seq=98 Ack=1711995 Win=1581952 Len=0 TSval=5099890 TSecr=831398656
262   0.027596 54.192.156.109 -> 172.31.29.138 TCP 21786 [TCP segment of a reassembled PDU]
263   0.027607 172.31.29.138 -> 54.192.156.109 TCP 66 55850 > http [ACK] Seq=98 Ack=1733715 Win=1581952 Len=0 TSval=5099890 TSecr=831398656
264   0.027734 54.192.156.109 -> 172.31.29.138 TCP 26130 [TCP segment of a reassembled PDU]
265   0.027749 172.31.29.138 -> 54.192.156.109 TCP 66 55850 > http [ACK] Seq=98 Ack=1759779 Win=1581952 Len=0 TSval=5099890 TSecr=831398656
266   0.027770 54.192.156.109 -> 172.31.29.138 TCP 17442 [TCP segment of a reassembled PDU]
267   0.027778 172.31.29.138 -> 54.192.156.109 TCP 66 55850 > http [ACK] Seq=98 Ack=1777155 Win=1581952 Len=0 TSval=5099890 TSecr=831398656
268   0.028041 54.192.156.109 -> 172.31.29.138 TCP 10202 [TCP segment of a reassembled PDU]
269   0.028050 172.31.29.138 -> 54.192.156.109 TCP 66 55850 > http [ACK] Seq=98 Ack=1787291 Win=1581952 Len=0 TSval=5099890 TSecr=831398656
270   0.028183 54.192.156.109 -> 172.31.29.138 TCP 26130 [TCP segment of a reassembled PDU]
271   0.028196 172.31.29.138 -> 54.192.156.109 TCP 66 55850 > http [ACK] Seq=98 Ack=1813355 Win=1581952 Len=0 TSval=5099890 TSecr=831398656
272   0.028236 54.192.156.109 -> 172.31.29.138 TCP 26130 [TCP segment of a reassembled PDU]
273   0.028249 172.31.29.138 -> 54.192.156.109 TCP 66 55850 > http [ACK] Seq=98 Ack=1839419 Win=1581952 Len=0 TSval=5099890 TSecr=831398656
274   0.028288 54.192.156.109 -> 172.31.29.138 TCP 21786 [TCP segment of a reassembled PDU]
275   0.028299 172.31.29.138 -> 54.192.156.109 TCP 66 55850 > http [ACK] Seq=98 Ack=1861139 Win=1581952 Len=0 TSval=5099890 TSecr=831398656
276   0.028309 54.192.156.109 -> 172.31.29.138 TCP 5858 [TCP segment of a reassembled PDU]
277   0.028313 172.31.29.138 -> 54.192.156.109 TCP 66 55850 > http [ACK] Seq=98 Ack=1866931 Win=1581952 Len=0 TSval=5099890 TSecr=831398656
278   0.028466 54.192.156.109 -> 172.31.29.138 TCP 26130 [TCP segment of a reassembled PDU]
279   0.028474 172.31.29.138 -> 54.192.156.109 TCP 66 55850 > http [ACK] Seq=98 Ack=1892995 Win=1581952 Len=0 TSval=5099890 TSecr=831398656
280   0.028488 54.192.156.109 -> 172.31.29.138 TCP 8754 [TCP segment of a reassembled PDU]
281   0.028491 172.31.29.138 -> 54.192.156.109 TCP 66 55850 > http [ACK] Seq=98 Ack=1901683 Win=1581952 Len=0 TSval=5099890 TSecr=831398656
282   0.028498 54.192.156.109 -> 172.31.29.138 TCP 5858 [TCP segment of a reassembled PDU]
283   0.028501 172.31.29.138 -> 54.192.156.109 TCP 66 55850 > http [ACK] Seq=98 Ack=1907475 Win=1581952 Len=0 TSval=5099890 TSecr=831398656
284   0.028823 54.192.156.109 -> 172.31.29.138 TCP 26130 [TCP segment of a reassembled PDU]
285   0.028832 172.31.29.138 -> 54.192.156.109 TCP 66 55850 > http [ACK] Seq=98 Ack=1933539 Win=1581952 Len=0 TSval=5099890 TSecr=831398656
286   0.028868 54.192.156.109 -> 172.31.29.138 TCP 21786 [TCP segment of a reassembled PDU]
287   0.028874 172.31.29.138 -> 54.192.156.109 TCP 66 55850 > http [ACK] Seq=98 Ack=1955259 Win=1581952 Len=0 TSval=5099890 TSecr=831398656
288   0.028890 54.192.156.109 -> 172.31.29.138 TCP 4410 [TCP segment of a reassembled PDU]
289   0.028896 172.31.29.138 -> 54.192.156.109 TCP 66 55850 > http [ACK] Seq=98 Ack=1959603 Win=1581952 Len=0 TSval=5099890 TSecr=831398656
290   0.028928 54.192.156.109 -> 172.31.29.138 TCP 8754 [TCP segment of a reassembled PDU]
291   0.028932 172.31.29.138 -> 54.192.156.109 TCP 66 55850 > http [ACK] Seq=98 Ack=1968291 Win=1581952 Len=0 TSval=5099890 TSecr=831398656
292   0.029069 54.192.156.109 -> 172.31.29.138 TCP 26130 [TCP segment of a reassembled PDU]
293   0.029077 172.31.29.138 -> 54.192.156.109 TCP 66 55850 > http [ACK] Seq=98 Ack=1994355 Win=1581952 Len=0 TSval=5099890 TSecr=831398656
294   0.029174 54.192.156.109 -> 172.31.29.138 TCP 23234 [TCP segment of a reassembled PDU]
295   0.029182 172.31.29.138 -> 54.192.156.109 TCP 66 55850 > http [ACK] Seq=98 Ack=2017523 Win=1581952 Len=0 TSval=5099890 TSecr=831398656
296   0.029197 54.192.156.109 -> 172.31.29.138 TCP 2962 [TCP segment of a reassembled PDU]
297   0.029200 172.31.29.138 -> 54.192.156.109 TCP 66 55850 > http [ACK] Seq=98 Ack=2020419 Win=1581952 Len=0 TSval=5099890 TSecr=831398656
298   0.029237 54.192.156.109 -> 172.31.29.138 TCP 7306 [TCP segment of a reassembled PDU]
299   0.029241 172.31.29.138 -> 54.192.156.109 TCP 66 55850 > http [ACK] Seq=98 Ack=2027659 Win=1581952 Len=0 TSval=5099890 TSecr=831398656
300   0.029280 54.192.156.109 -> 172.31.29.138 TCP 10202 [TCP segment of a reassembled PDU]
301   0.029284 172.31.29.138 -> 54.192.156.109 TCP 66 55850 > http [ACK] Seq=98 Ack=2037795 Win=1581952 Len=0 TSval=5099890 TSecr=831398656
302   0.029536 54.192.156.109 -> 172.31.29.138 TCP 23234 [TCP segment of a reassembled PDU]
303   0.029544 172.31.29.138 -> 54.192.156.109 TCP 66 55850 > http [ACK] Seq=98 Ack=2060963 Win=1581952 Len=0 TSval=5099890 TSecr=831398656
304   0.029659 54.192.156.109 -> 172.31.29.138 TCP 18890 [TCP segment of a reassembled PDU]
305   0.029666 172.31.29.138 -> 54.192.156.109 TCP 66 55850 > http [ACK] Seq=98 Ack=2079787 Win=1581952 Len=0 TSval=5099890 TSecr=831398656
306   0.029687 54.192.156.109 -> 172.31.29.138 TCP 7306 [TCP segment of a reassembled PDU]
307   0.029690 172.31.29.138 -> 54.192.156.109 TCP 66 55850 > http [ACK] Seq=98 Ack=2087027 Win=1581952 Len=0 TSval=5099890 TSecr=831398656
308   0.029731 54.192.156.109 -> 172.31.29.138 TCP 8754 [TCP segment of a reassembled PDU]
309   0.029736 172.31.29.138 -> 54.192.156.109 TCP 66 55850 > http [ACK] Seq=98 Ack=2095715 Win=1581952 Len=0 TSval=5099890 TSecr=831398656
310   0.029784 54.192.156.109 -> 172.31.29.138 TCP 15994 [TCP segment of a reassembled PDU]
311   0.029790 172.31.29.138 -> 54.192.156.109 TCP 66 55850 > http [ACK] Seq=98 Ack=2111643 Win=1581952 Len=0 TSval=5099890 TSecr=831398656
312   0.029918 54.192.156.109 -> 172.31.29.138 TCP 26130 [TCP segment of a reassembled PDU]
313   0.029926 172.31.29.138 -> 54.192.156.109 TCP 66 55850 > http [ACK] Seq=98 Ack=2137707 Win=1581952 Len=0 TSval=5099890 TSecr=831398656
314   0.029933 54.192.156.109 -> 172.31.29.138 TCP 4410 [TCP segment of a reassembled PDU]
315   0.029936 172.31.29.138 -> 54.192.156.109 TCP 66 55850 > http [ACK] Seq=98 Ack=2142051 Win=1581952 Len=0 TSval=5099890 TSecr=831398656
316   0.029973 54.192.156.109 -> 172.31.29.138 TCP 21786 [TCP segment of a reassembled PDU]
317   0.029979 172.31.29.138 -> 54.192.156.109 TCP 66 55850 > http [ACK] Seq=98 Ack=2163771 Win=1581952 Len=0 TSval=5099890 TSecr=831398656
318   0.030063 54.192.156.109 -> 172.31.29.138 TCP 26130 [TCP segment of a reassembled PDU]
319   0.030070 172.31.29.138 -> 54.192.156.109 TCP 66 55850 > http [ACK] Seq=98 Ack=2189835 Win=1581952 Len=0 TSval=5099890 TSecr=831398656
320   0.030192 54.192.156.109 -> 172.31.29.138 TCP 26130 [TCP segment of a reassembled PDU]
321   0.030198 172.31.29.138 -> 54.192.156.109 TCP 66 55850 > http [ACK] Seq=98 Ack=2215899 Win=1581952 Len=0 TSval=5099891 TSecr=831398656
322   0.030214 54.192.156.109 -> 172.31.29.138 TCP 17442 [TCP segment of a reassembled PDU]
323   0.030225 172.31.29.138 -> 54.192.156.109 TCP 66 55850 > http [ACK] Seq=98 Ack=2233275 Win=1581952 Len=0 TSval=5099891 TSecr=831398656
324   0.030558 54.192.156.109 -> 172.31.29.138 TCP 18890 [TCP segment of a reassembled PDU]
325   0.030566 172.31.29.138 -> 54.192.156.109 TCP 66 55850 > http [ACK] Seq=98 Ack=2252099 Win=1581952 Len=0 TSval=5099891 TSecr=831398656
326   0.030585 54.192.156.109 -> 172.31.29.138 TCP 7306 [TCP segment of a reassembled PDU]
327   0.030588 172.31.29.138 -> 54.192.156.109 TCP 66 55850 > http [ACK] Seq=98 Ack=2259339 Win=1581952 Len=0 TSval=5099891 TSecr=831398656
328   0.030634 54.192.156.109 -> 172.31.29.138 TCP 13098 [TCP segment of a reassembled PDU]
329   0.030639 172.31.29.138 -> 54.192.156.109 TCP 66 55850 > http [ACK] Seq=98 Ack=2272371 Win=1581952 Len=0 TSval=5099891 TSecr=831398656
330   0.030698 54.192.156.109 -> 172.31.29.138 TCP 26130 [TCP segment of a reassembled PDU]
331   0.030704 172.31.29.138 -> 54.192.156.109 TCP 66 55850 > http [ACK] Seq=98 Ack=2298435 Win=1581952 Len=0 TSval=5099891 TSecr=831398656
332   0.030742 54.192.156.109 -> 172.31.29.138 TCP 15994 [TCP segment of a reassembled PDU]
333   0.030747 172.31.29.138 -> 54.192.156.109 TCP 66 55850 > http [ACK] Seq=98 Ack=2314363 Win=1581952 Len=0 TSval=5099891 TSecr=831398656
334   0.030790 54.192.156.109 -> 172.31.29.138 TCP 11650 [TCP segment of a reassembled PDU]
335   0.030794 172.31.29.138 -> 54.192.156.109 TCP 66 55850 > http [ACK] Seq=98 Ack=2325947 Win=1581952 Len=0 TSval=5099891 TSecr=831398656
336   0.030955 54.192.156.109 -> 172.31.29.138 TCP 26130 [TCP segment of a reassembled PDU]
337   0.030963 172.31.29.138 -> 54.192.156.109 TCP 66 55850 > http [ACK] Seq=98 Ack=2352011 Win=1581952 Len=0 TSval=5099891 TSecr=831398656
338   0.030974 54.192.156.109 -> 172.31.29.138 TCP 8754 [TCP segment of a reassembled PDU]
339   0.030978 172.31.29.138 -> 54.192.156.109 TCP 66 55850 > http [ACK] Seq=98 Ack=2360699 Win=1581952 Len=0 TSval=5099891 TSecr=831398656
340   0.030991 54.192.156.109 -> 172.31.29.138 TCP 2962 [TCP segment of a reassembled PDU]
341   0.030993 172.31.29.138 -> 54.192.156.109 TCP 66 55850 > http [ACK] Seq=98 Ack=2363595 Win=1581952 Len=0 TSval=5099891 TSecr=831398656
342   0.031129 54.192.156.109 -> 172.31.29.138 TCP 42058 [TCP segment of a reassembled PDU]
343   0.031138 172.31.29.138 -> 54.192.156.109 TCP 66 55850 > http [ACK] Seq=98 Ack=2405587 Win=1581952 Len=0 TSval=5099891 TSecr=831398656
344   0.031150 54.192.156.109 -> 172.31.29.138 TCP 8754 [TCP segment of a reassembled PDU]
345   0.031153 172.31.29.138 -> 54.192.156.109 TCP 66 55850 > http [ACK] Seq=98 Ack=2414275 Win=1581952 Len=0 TSval=5099891 TSecr=831398656
346   0.031267 54.192.156.109 -> 172.31.29.138 TCP 14546 [TCP segment of a reassembled PDU]
