[Measurement for 100kb at 04:42:45 20.42.2014] 
Tshark:

  1   0.000000 172.31.8.238 -> 172.31.0.2   DNS 88 Standard query 0xc562  A dm53kc3eax57k.cloudfront.net
  2   0.000025 172.31.8.238 -> 172.31.0.2   DNS 88 Standard query 0xd5c2  AAAA dm53kc3eax57k.cloudfront.net
  3   0.000739   172.31.0.2 -> 172.31.8.238 DNS 216 Standard query response 0xc562  A 54.230.117.238 A 54.230.119.71 A 54.239.132.86 A 54.192.118.228 A 54.192.118.233 A 54.192.118.238 A 54.230.117.5 A 54.230.117.156
  4   0.000749   172.31.0.2 -> 172.31.8.238 DNS 175 Standard query response 0xd5c2 
  5   0.003749 172.31.8.238 -> 54.230.117.238 TCP 74 37096 > http [SYN] Seq=0 Win=26883 Len=0 MSS=8961 SACK_PERM=1 TSval=10548208 TSecr=0 WS=128
  6   0.004345 54.230.117.238 -> 172.31.8.238 TCP 74 http > 37096 [SYN, ACK] Seq=0 Ack=1 Win=14480 Len=0 MSS=1460 SACK_PERM=1 TSval=1683277671 TSecr=10548208 WS=128
  7   0.004359 172.31.8.238 -> 54.230.117.238 TCP 66 37096 > http [ACK] Seq=1 Ack=1 Win=27008 Len=0 TSval=10548208 TSecr=1683277671
  8   0.004397 172.31.8.238 -> 54.230.117.238 HTTP 163 GET /100kb HTTP/1.1 
  9   0.005415 54.230.117.238 -> 172.31.8.238 TCP 66 http > 37096 [ACK] Seq=1 Ack=98 Win=14592 Len=0 TSval=1683277671 TSecr=10548208
 10   0.007662 54.230.117.238 -> 172.31.8.238 TCP 522 [TCP segment of a reassembled PDU]
 11   0.007669 172.31.8.238 -> 54.230.117.238 TCP 66 37096 > http [ACK] Seq=98 Ack=457 Win=28032 Len=0 TSval=10548209 TSecr=1683277672
 12   0.007782 54.230.117.238 -> 172.31.8.238 TCP 13098 [TCP segment of a reassembled PDU]
 13   0.007792 172.31.8.238 -> 54.230.117.238 TCP 66 37096 > http [ACK] Seq=98 Ack=13489 Win=54144 Len=0 TSval=10548209 TSecr=1683277672
 14   0.008458 54.230.117.238 -> 172.31.8.238 TCP 5858 [TCP segment of a reassembled PDU]
 15   0.008465 172.31.8.238 -> 54.230.117.238 TCP 66 37096 > http [ACK] Seq=98 Ack=19281 Win=65664 Len=0 TSval=10548209 TSecr=1683277672
 16   0.008556 54.230.117.238 -> 172.31.8.238 TCP 7306 [TCP segment of a reassembled PDU]
 17   0.008563 172.31.8.238 -> 54.230.117.238 TCP 66 37096 > http [ACK] Seq=98 Ack=26521 Win=80128 Len=0 TSval=10548209 TSecr=1683277672
 18   0.008957 54.230.117.238 -> 172.31.8.238 TCP 4410 [TCP segment of a reassembled PDU]
 19   0.008962 172.31.8.238 -> 54.230.117.238 TCP 66 37096 > http [ACK] Seq=98 Ack=30865 Win=88832 Len=0 TSval=10548209 TSecr=1683277672
 20   0.009019 54.230.117.238 -> 172.31.8.238 TCP 7306 [TCP segment of a reassembled PDU]
 21   0.009025 172.31.8.238 -> 54.230.117.238 TCP 66 37096 > http [ACK] Seq=98 Ack=38105 Win=103296 Len=0 TSval=10548209 TSecr=1683277672
 22   0.009254 54.230.117.238 -> 172.31.8.238 TCP 4410 [TCP segment of a reassembled PDU]
 23   0.009259 172.31.8.238 -> 54.230.117.238 TCP 66 37096 > http [ACK] Seq=98 Ack=42449 Win=109056 Len=0 TSval=10548209 TSecr=1683277672
 24   0.009343 54.230.117.238 -> 172.31.8.238 TCP 4410 [TCP segment of a reassembled PDU]
 25   0.009348 172.31.8.238 -> 54.230.117.238 TCP 66 37096 > http [ACK] Seq=98 Ack=46793 Win=109056 Len=0 TSval=10548209 TSecr=1683277672
 26   0.009733 54.230.117.238 -> 172.31.8.238 TCP 4410 [TCP segment of a reassembled PDU]
 27   0.009738 172.31.8.238 -> 54.230.117.238 TCP 66 37096 > http [ACK] Seq=98 Ack=51137 Win=109056 Len=0 TSval=10548209 TSecr=1683277672
 28   0.009772 54.230.117.238 -> 172.31.8.238 TCP 1514 [TCP segment of a reassembled PDU]
 29   0.009776 172.31.8.238 -> 54.230.117.238 TCP 66 37096 > http [ACK] Seq=98 Ack=52585 Win=109056 Len=0 TSval=10548209 TSecr=1683277672
 30   0.009889 54.230.117.238 -> 172.31.8.238 TCP 13098 [TCP segment of a reassembled PDU]
 31   0.009897 172.31.8.238 -> 54.230.117.238 TCP 66 37096 > http [ACK] Seq=98 Ack=65617 Win=96512 Len=0 TSval=10548209 TSecr=1683277672
 32   0.010526 54.230.117.238 -> 172.31.8.238 TCP 4410 [TCP segment of a reassembled PDU]
 33   0.010532 172.31.8.238 -> 54.230.117.238 TCP 66 37096 > http [ACK] Seq=98 Ack=69961 Win=117760 Len=0 TSval=10548210 TSecr=1683277672
 34   0.010642 54.230.117.238 -> 172.31.8.238 TCP 21786 [TCP segment of a reassembled PDU]
 35   0.010651 172.31.8.238 -> 54.230.117.238 TCP 66 37096 > http [ACK] Seq=98 Ack=91681 Win=161152 Len=0 TSval=10548210 TSecr=1683277672
 36   0.011317 54.230.117.238 -> 172.31.8.238 TCP 8754 [TCP segment of a reassembled PDU]
 37   0.011325 172.31.8.238 -> 54.230.117.238 TCP 66 37096 > http [ACK] Seq=98 Ack=100369 Win=178560 Len=0 TSval=10548210 TSecr=1683277672
 38   0.011358 54.230.117.238 -> 172.31.8.238 HTTP 2554 HTTP/1.1 200 OK  (application/octet-stream)
 39   0.011363 172.31.8.238 -> 54.230.117.238 TCP 66 37096 > http [ACK] Seq=98 Ack=102857 Win=183552 Len=0 TSval=10548210 TSecr=1683277672
 40   0.011474 172.31.8.238 -> 54.230.117.238 TCP 66 37096 > http [FIN, ACK] Seq=98 Ack=102857 Win=183552 Len=0 TSval=10548210 TSecr=1683277672
 41   0.011988 54.230.117.238 -> 172.31.8.238 TCP 66 http > 37096 [FIN, ACK] Seq=102857 Ack=99 Win=14592 Len=0 TSval=1683277672 TSecr=10548210
 42   0.011996 172.31.8.238 -> 54.230.117.238 TCP 66 37096 > http [ACK] Seq=99 Ack=102858 Win=183552 Len=0 TSval=10548210 TSecr=1683277672
