[Measurement for 100kb at 06:42:45 20.42.2014] 
Tshark:

  1   0.000000 172.31.8.238 -> 172.31.0.2   DNS 88 Standard query 0x553f  A dm53kc3eax57k.cloudfront.net
  2   0.000030 172.31.8.238 -> 172.31.0.2   DNS 88 Standard query 0x0377  AAAA dm53kc3eax57k.cloudfront.net
  3   0.000882   172.31.0.2 -> 172.31.8.238 DNS 216 Standard query response 0x553f  A 54.239.132.90 A 54.239.132.173 A 54.230.117.5 A 54.230.117.21 A 54.230.118.136 A 54.230.119.11 A 54.230.119.94 A 54.239.132.55
  4   0.000944   172.31.0.2 -> 172.31.8.238 DNS 175 Standard query response 0x0377 
  5   0.003778 172.31.8.238 -> 54.239.132.90 TCP 74 55608 > http [SYN] Seq=0 Win=26883 Len=0 MSS=8961 SACK_PERM=1 TSval=12348183 TSecr=0 WS=128
  6   0.004556 54.239.132.90 -> 172.31.8.238 TCP 74 http > 55608 [SYN, ACK] Seq=0 Ack=1 Win=14480 Len=0 MSS=1460 SACK_PERM=1 TSval=1686604870 TSecr=12348183 WS=128
  7   0.004570 172.31.8.238 -> 54.239.132.90 TCP 66 55608 > http [ACK] Seq=1 Ack=1 Win=27008 Len=0 TSval=12348183 TSecr=1686604870
  8   0.004608 172.31.8.238 -> 54.239.132.90 HTTP 163 GET /100kb HTTP/1.1 
  9   0.005079 54.239.132.90 -> 172.31.8.238 TCP 66 http > 55608 [ACK] Seq=1 Ack=98 Win=14592 Len=0 TSval=1686604870 TSecr=12348183
 10   0.006621 54.239.132.90 -> 172.31.8.238 TCP 2580 [TCP segment of a reassembled PDU]
 11   0.006628 172.31.8.238 -> 54.239.132.90 TCP 66 55608 > http [ACK] Seq=98 Ack=2515 Win=32000 Len=0 TSval=12348183 TSecr=1686604870
 12   0.006754 54.239.132.90 -> 172.31.8.238 TCP 11650 [TCP segment of a reassembled PDU]
 13   0.006764 172.31.8.238 -> 54.239.132.90 TCP 66 55608 > http [ACK] Seq=98 Ack=14099 Win=55168 Len=0 TSval=12348183 TSecr=1686604870
 14   0.007407 54.239.132.90 -> 172.31.8.238 TCP 10202 [TCP segment of a reassembled PDU]
 15   0.007416 172.31.8.238 -> 54.239.132.90 TCP 66 55608 > http [ACK] Seq=98 Ack=24235 Win=75392 Len=0 TSval=12348183 TSecr=1686604871
 16   0.007451 54.239.132.90 -> 172.31.8.238 TCP 2962 [TCP segment of a reassembled PDU]
 17   0.007457 172.31.8.238 -> 54.239.132.90 TCP 66 55608 > http [ACK] Seq=98 Ack=27131 Win=81152 Len=0 TSval=12348183 TSecr=1686604871
 18   0.007905 54.239.132.90 -> 172.31.8.238 TCP 5858 [TCP segment of a reassembled PDU]
 19   0.007912 172.31.8.238 -> 54.239.132.90 TCP 66 55608 > http [ACK] Seq=98 Ack=32923 Win=92800 Len=0 TSval=12348184 TSecr=1686604871
 20   0.008018 54.239.132.90 -> 172.31.8.238 TCP 14546 [TCP segment of a reassembled PDU]
 21   0.008028 172.31.8.238 -> 54.239.132.90 TCP 66 55608 > http [ACK] Seq=98 Ack=47403 Win=121728 Len=0 TSval=12348184 TSecr=1686604871
 22   0.008407 54.239.132.90 -> 172.31.8.238 TCP 5858 [TCP segment of a reassembled PDU]
 23   0.008414 172.31.8.238 -> 54.239.132.90 TCP 66 55608 > http [ACK] Seq=98 Ack=53195 Win=133376 Len=0 TSval=12348184 TSecr=1686604871
 24   0.008524 54.239.132.90 -> 172.31.8.238 TCP 13098 [TCP segment of a reassembled PDU]
 25   0.008532 172.31.8.238 -> 54.239.132.90 TCP 66 55608 > http [ACK] Seq=98 Ack=66227 Win=159360 Len=0 TSval=12348184 TSecr=1686604871
 26   0.008908 54.239.132.90 -> 172.31.8.238 TCP 4410 [TCP segment of a reassembled PDU]
 27   0.008913 172.31.8.238 -> 54.239.132.90 TCP 66 55608 > http [ACK] Seq=98 Ack=70571 Win=168064 Len=0 TSval=12348184 TSecr=1686604871
 28   0.009094 54.239.132.90 -> 172.31.8.238 TCP 21786 [TCP segment of a reassembled PDU]
 29   0.009107 172.31.8.238 -> 54.239.132.90 TCP 66 55608 > http [ACK] Seq=98 Ack=92291 Win=171520 Len=0 TSval=12348184 TSecr=1686604871
 30   0.009443 54.239.132.90 -> 172.31.8.238 TCP 2962 [TCP segment of a reassembled PDU]
 31   0.009449 172.31.8.238 -> 54.239.132.90 TCP 66 55608 > http [ACK] Seq=98 Ack=95187 Win=202496 Len=0 TSval=12348184 TSecr=1686604871
 32   0.009699 54.239.132.90 -> 172.31.8.238 HTTP 7736 HTTP/1.1 200 OK  (application/octet-stream)
 33   0.009706 172.31.8.238 -> 54.239.132.90 TCP 66 55608 > http [ACK] Seq=98 Ack=102857 Win=194944 Len=0 TSval=12348184 TSecr=1686604871
 34   0.009857 172.31.8.238 -> 54.239.132.90 TCP 66 55608 > http [FIN, ACK] Seq=98 Ack=102857 Win=207360 Len=0 TSval=12348184 TSecr=1686604871
 35   0.010439 54.239.132.90 -> 172.31.8.238 TCP 66 http > 55608 [FIN, ACK] Seq=102857 Ack=99 Win=14592 Len=0 TSval=1686604871 TSecr=12348184
 36   0.010448 172.31.8.238 -> 54.239.132.90 TCP 66 55608 > http [ACK] Seq=99 Ack=102858 Win=207360 Len=0 TSval=12348184 TSecr=1686604871
