[Measurement for 100kb at 14:42:45 20.42.2014] 
Tshark:

  1   0.000000 172.31.8.238 -> 172.31.0.2   DNS 88 Standard query 0x38f8  A dm53kc3eax57k.cloudfront.net
  2   0.000024 172.31.8.238 -> 172.31.0.2   DNS 88 Standard query 0xc4d1  AAAA dm53kc3eax57k.cloudfront.net
  3   0.000500   172.31.0.2 -> 172.31.8.238 DNS 216 Standard query response 0x38f8  A 54.192.118.221 A 54.192.118.224 A 54.230.117.15 A 54.230.118.114 A 54.230.118.143 A 54.230.119.58 A 54.230.119.106 A 54.239.132.84
  4   0.000512   172.31.0.2 -> 172.31.8.238 DNS 175 Standard query response 0xc4d1 
  5   0.003888 172.31.8.238 -> 54.192.118.221 TCP 74 42050 > http [SYN] Seq=0 Win=26883 Len=0 MSS=8961 SACK_PERM=1 TSval=19548187 TSecr=0 WS=128
  6   0.004551 54.192.118.221 -> 172.31.8.238 TCP 74 http > 42050 [SYN, ACK] Seq=0 Ack=1 Win=14480 Len=0 MSS=1460 SACK_PERM=1 TSval=1690232712 TSecr=19548187 WS=128
  7   0.004565 172.31.8.238 -> 54.192.118.221 TCP 66 42050 > http [ACK] Seq=1 Ack=1 Win=27008 Len=0 TSval=19548187 TSecr=1690232712
  8   0.004604 172.31.8.238 -> 54.192.118.221 HTTP 163 GET /100kb HTTP/1.1 
  9   0.005136 54.192.118.221 -> 172.31.8.238 TCP 66 http > 42050 [ACK] Seq=1 Ack=98 Win=14592 Len=0 TSval=1690232712 TSecr=19548187
 10   0.006564 54.192.118.221 -> 172.31.8.238 TCP 522 [TCP segment of a reassembled PDU]
 11   0.006571 172.31.8.238 -> 54.192.118.221 TCP 66 42050 > http [ACK] Seq=98 Ack=457 Win=28032 Len=0 TSval=19548188 TSecr=1690232712
 12   0.006834 54.192.118.221 -> 172.31.8.238 TCP 2962 [TCP segment of a reassembled PDU]
 13   0.006840 172.31.8.238 -> 54.192.118.221 TCP 66 42050 > http [ACK] Seq=98 Ack=3353 Win=33792 Len=0 TSval=19548188 TSecr=1690232712
 14   0.006958 54.192.118.221 -> 172.31.8.238 TCP 10202 [TCP segment of a reassembled PDU]
 15   0.006968 172.31.8.238 -> 54.192.118.221 TCP 66 42050 > http [ACK] Seq=98 Ack=13489 Win=54144 Len=0 TSval=19548188 TSecr=1690232712
 16   0.007357 54.192.118.221 -> 172.31.8.238 TCP 4410 [TCP segment of a reassembled PDU]
 17   0.007365 172.31.8.238 -> 54.192.118.221 TCP 66 42050 > http [ACK] Seq=98 Ack=17833 Win=62720 Len=0 TSval=19548188 TSecr=1690232712
 18   0.007457 54.192.118.221 -> 172.31.8.238 TCP 2962 [TCP segment of a reassembled PDU]
 19   0.007462 172.31.8.238 -> 54.192.118.221 TCP 66 42050 > http [ACK] Seq=98 Ack=20729 Win=68608 Len=0 TSval=19548188 TSecr=1690232712
 20   0.007662 54.192.118.221 -> 172.31.8.238 TCP 5858 [TCP segment of a reassembled PDU]
 21   0.007673 172.31.8.238 -> 54.192.118.221 TCP 66 42050 > http [ACK] Seq=98 Ack=26521 Win=80128 Len=0 TSval=19548188 TSecr=1690232712
 22   0.007875 54.192.118.221 -> 172.31.8.238 TCP 5858 [TCP segment of a reassembled PDU]
 23   0.007882 172.31.8.238 -> 54.192.118.221 TCP 66 42050 > http [ACK] Seq=98 Ack=32313 Win=91776 Len=0 TSval=19548188 TSecr=1690232712
 24   0.007930 54.192.118.221 -> 172.31.8.238 TCP 5858 [TCP segment of a reassembled PDU]
 25   0.007936 172.31.8.238 -> 54.192.118.221 TCP 66 42050 > http [ACK] Seq=98 Ack=38105 Win=103296 Len=0 TSval=19548188 TSecr=1690232712
 26   0.008141 54.192.118.221 -> 172.31.8.238 TCP 1514 [TCP segment of a reassembled PDU]
 27   0.008145 172.31.8.238 -> 54.192.118.221 TCP 66 42050 > http [ACK] Seq=98 Ack=39553 Win=106240 Len=0 TSval=19548188 TSecr=1690232712
 28   0.008375 54.192.118.221 -> 172.31.8.238 TCP 4410 [TCP segment of a reassembled PDU]
 29   0.008381 172.31.8.238 -> 54.192.118.221 TCP 66 42050 > http [ACK] Seq=98 Ack=43897 Win=109056 Len=0 TSval=19548188 TSecr=1690232712
 30   0.008503 54.192.118.221 -> 172.31.8.238 TCP 18890 [TCP segment of a reassembled PDU]
 31   0.008516 172.31.8.238 -> 54.192.118.221 TCP 66 42050 > http [ACK] Seq=98 Ack=62721 Win=90240 Len=0 TSval=19548188 TSecr=1690232712
 32   0.008658 54.192.118.221 -> 172.31.8.238 TCP 2962 [TCP segment of a reassembled PDU]
 33   0.008664 172.31.8.238 -> 54.192.118.221 TCP 66 42050 > http [ACK] Seq=98 Ack=65617 Win=109056 Len=0 TSval=19548188 TSecr=1690232712
 34   0.009154 54.192.118.221 -> 172.31.8.238 TCP 2962 [TCP segment of a reassembled PDU]
 35   0.009160 172.31.8.238 -> 54.192.118.221 TCP 66 42050 > http [ACK] Seq=98 Ack=68513 Win=109056 Len=0 TSval=19548188 TSecr=1690232713
 36   0.009293 54.192.118.221 -> 172.31.8.238 TCP 23234 [TCP segment of a reassembled PDU]
 37   0.009303 172.31.8.238 -> 54.192.118.221 TCP 66 42050 > http [ACK] Seq=98 Ack=91681 Win=85888 Len=0 TSval=19548188 TSecr=1690232713
 38   0.009932 54.192.118.221 -> 172.31.8.238 TCP 4410 [TCP segment of a reassembled PDU]
 39   0.009938 172.31.8.238 -> 54.192.118.221 TCP 66 42050 > http [ACK] Seq=98 Ack=96025 Win=109056 Len=0 TSval=19548189 TSecr=1690232713
 40   0.010038 54.192.118.221 -> 172.31.8.238 HTTP 6898 HTTP/1.1 200 OK  (application/octet-stream)
 41   0.010045 172.31.8.238 -> 54.192.118.221 TCP 66 42050 > http [ACK] Seq=98 Ack=102857 Win=122752 Len=0 TSval=19548189 TSecr=1690232713
 42   0.010173 172.31.8.238 -> 54.192.118.221 TCP 66 42050 > http [FIN, ACK] Seq=98 Ack=102857 Win=122752 Len=0 TSval=19548189 TSecr=1690232713
 43   0.010669 54.192.118.221 -> 172.31.8.238 TCP 66 http > 42050 [FIN, ACK] Seq=102857 Ack=99 Win=14592 Len=0 TSval=1690232713 TSecr=19548189
 44   0.010676 172.31.8.238 -> 54.192.118.221 TCP 66 42050 > http [ACK] Seq=99 Ack=102858 Win=122752 Len=0 TSval=19548189 TSecr=1690232713
