[Measurement for 10kb at 19:35:14 19.35.2014] 
Tshark:

  1   0.000000 172.31.29.138 -> 172.31.0.2   DNS 89 Standard query 0xc65e  A d39wppo36gwqpx.cloudfront.net
  2   0.000028 172.31.29.138 -> 172.31.0.2   DNS 89 Standard query 0x2cd6  AAAA d39wppo36gwqpx.cloudfront.net
  3   0.000623   172.31.0.2 -> 172.31.29.138 DNS 217 Standard query response 0xc65e  A 54.240.168.128 A 54.192.156.104 A 54.192.159.74 A 54.192.159.177 A 54.230.156.193 A 54.230.158.182 A 54.230.158.198 A 54.230.159.4
  4   0.000634   172.31.0.2 -> 172.31.29.138 DNS 170 Standard query response 0x2cd6 
  5   0.003856 172.31.29.138 -> 54.240.168.128 TCP 74 40127 > http [SYN] Seq=0 Win=26883 Len=0 MSS=8961 SACK_PERM=1 TSval=2396842 TSecr=0 WS=128
  6   0.004538 54.240.168.128 -> 172.31.29.138 TCP 74 http > 40127 [SYN, ACK] Seq=0 Ack=1 Win=14480 Len=0 MSS=1460 SACK_PERM=1 TSval=831913331 TSecr=2396842 WS=128
  7   0.004553 172.31.29.138 -> 54.240.168.128 TCP 66 40127 > http [ACK] Seq=1 Ack=1 Win=27008 Len=0 TSval=2396843 TSecr=831913331
  8   0.004597 172.31.29.138 -> 54.240.168.128 HTTP 163 GET /10kb HTTP/1.1 
  9   0.005249 54.240.168.128 -> 172.31.29.138 TCP 66 http > 40127 [ACK] Seq=1 Ack=98 Win=14592 Len=0 TSval=831913331 TSecr=2396843
 10   0.007146 54.240.168.128 -> 172.31.29.138 TCP 8754 [TCP segment of a reassembled PDU]
 11   0.007155 172.31.29.138 -> 54.240.168.128 TCP 66 40127 > http [ACK] Seq=98 Ack=8689 Win=44288 Len=0 TSval=2396843 TSecr=831913332
 12   0.007162 54.240.168.128 -> 172.31.29.138 HTTP 2072 HTTP/1.1 200 OK  (application/octet-stream)
 13   0.007166 172.31.29.138 -> 54.240.168.128 TCP 66 40127 > http [ACK] Seq=98 Ack=10695 Win=48384 Len=0 TSval=2396843 TSecr=831913332
 14   0.007306 172.31.29.138 -> 54.240.168.128 TCP 66 40127 > http [FIN, ACK] Seq=98 Ack=10695 Win=48384 Len=0 TSval=2396843 TSecr=831913332
 15   0.011178 54.240.168.128 -> 172.31.29.138 TCP 66 http > 40127 [FIN, ACK] Seq=10695 Ack=99 Win=14592 Len=0 TSval=831913332 TSecr=2396843
 16   0.011186 172.31.29.138 -> 54.240.168.128 TCP 66 40127 > http [ACK] Seq=99 Ack=10696 Win=48384 Len=0 TSval=2396844 TSecr=831913332
