[Measurement for 10kb at 01:35:14 20.35.2014] 
Tshark:

  1   0.000000 172.31.29.138 -> 172.31.0.2   DNS 89 Standard query 0x6258  A d39wppo36gwqpx.cloudfront.net
  2   0.000040 172.31.29.138 -> 172.31.0.2   DNS 89 Standard query 0x7ab6  AAAA d39wppo36gwqpx.cloudfront.net
  3   0.000726   172.31.0.2 -> 172.31.29.138 DNS 217 Standard query response 0x6258  A 54.192.159.98 A 54.192.159.180 A 54.230.156.193 A 54.230.158.182 A 54.230.158.189 A 54.230.158.231 A 54.230.159.142 A 54.192.156.102
  4   0.000738   172.31.0.2 -> 172.31.29.138 DNS 170 Standard query response 0x7ab6 
  5   0.003781 172.31.29.138 -> 54.192.159.98 TCP 74 54618 > http [SYN] Seq=0 Win=26883 Len=0 MSS=8961 SACK_PERM=1 TSval=7796770 TSecr=0 WS=128
  6   0.004431 54.192.159.98 -> 172.31.29.138 TCP 74 http > 54618 [SYN, ACK] Seq=0 Ack=1 Win=14480 Len=0 MSS=1460 SACK_PERM=1 TSval=834073316 TSecr=7796770 WS=128
  7   0.004445 172.31.29.138 -> 54.192.159.98 TCP 66 54618 > http [ACK] Seq=1 Ack=1 Win=27008 Len=0 TSval=7796770 TSecr=834073316
  8   0.004493 172.31.29.138 -> 54.192.159.98 HTTP 163 GET /10kb HTTP/1.1 
  9   0.004913 54.192.159.98 -> 172.31.29.138 TCP 66 http > 54618 [ACK] Seq=1 Ack=98 Win=14592 Len=0 TSval=834073317 TSecr=7796770
 10   0.006040 54.192.159.98 -> 172.31.29.138 HTTP 10761 HTTP/1.1 200 OK  (application/octet-stream)
 11   0.006050 172.31.29.138 -> 54.192.159.98 TCP 66 54618 > http [ACK] Seq=98 Ack=10696 Win=48384 Len=0 TSval=7796770 TSecr=834073317
 12   0.006190 172.31.29.138 -> 54.192.159.98 TCP 66 54618 > http [FIN, ACK] Seq=98 Ack=10696 Win=48384 Len=0 TSval=7796770 TSecr=834073317
 13   0.006748 54.192.159.98 -> 172.31.29.138 TCP 66 http > 54618 [FIN, ACK] Seq=10696 Ack=99 Win=14592 Len=0 TSval=834073317 TSecr=7796770
 14   0.006756 172.31.29.138 -> 54.192.159.98 TCP 66 54618 > http [ACK] Seq=99 Ack=10697 Win=48384 Len=0 TSval=7796770 TSecr=834073317
