[Measurement for 100kb at 13:35:15 20.35.2014] 
Tshark:

  1   0.000000 172.31.36.109 -> 172.31.0.2   DNS 89 Standard query 0xb2d3  A d2pcb72msibvx3.cloudfront.net
  2   0.000050 172.31.36.109 -> 172.31.0.2   DNS 89 Standard query 0xfd7b  AAAA d2pcb72msibvx3.cloudfront.net
  3   0.000614   172.31.0.2 -> 172.31.36.109 DNS 217 Standard query response 0xb2d3  A 54.230.30.17 A 54.230.30.202 A 54.230.30.213 A 54.230.30.221 A 54.230.31.9 A 54.192.30.189 A 54.192.30.229 A 54.230.29.254
  4   0.000625   172.31.0.2 -> 172.31.36.109 DNS 169 Standard query response 0xfd7b 
  5   0.003836 172.31.36.109 -> 54.230.30.17 TCP 74 51413 > http [SYN] Seq=0 Win=26883 Len=0 MSS=8961 SACK_PERM=1 TSval=38550416 TSecr=0 WS=128
  6   0.005143 54.230.30.17 -> 172.31.36.109 TCP 74 http > 51413 [SYN, ACK] Seq=0 Ack=1 Win=14480 Len=0 MSS=1460 SACK_PERM=1 TSval=721848981 TSecr=38550416 WS=128
  7   0.005159 172.31.36.109 -> 54.230.30.17 TCP 66 51413 > http [ACK] Seq=1 Ack=1 Win=27008 Len=0 TSval=38550416 TSecr=721848981
  8   0.005220 172.31.36.109 -> 54.230.30.17 HTTP 164 GET /100kb HTTP/1.1 
  9   0.006401 54.230.30.17 -> 172.31.36.109 TCP 66 http > 51413 [ACK] Seq=1 Ack=99 Win=14592 Len=0 TSval=721848981 TSecr=38550417
 10   0.025460 54.230.30.17 -> 172.31.36.109 TCP 12728 [TCP segment of a reassembled PDU]
 11   0.025474 172.31.36.109 -> 54.230.30.17 TCP 66 51413 > http [ACK] Seq=99 Ack=12663 Win=52224 Len=0 TSval=38550422 TSecr=721848983
 12   0.025483 54.230.30.17 -> 172.31.36.109 TCP 1514 [TCP segment of a reassembled PDU]
 13   0.025487 172.31.36.109 -> 54.230.30.17 TCP 66 51413 > http [ACK] Seq=99 Ack=14111 Win=55168 Len=0 TSval=38550422 TSecr=721848983
 14   0.026736 54.230.30.17 -> 172.31.36.109 TCP 11650 [TCP segment of a reassembled PDU]
 15   0.026745 172.31.36.109 -> 54.230.30.17 TCP 66 51413 > http [ACK] Seq=99 Ack=25695 Win=78336 Len=0 TSval=38550422 TSecr=721848983
 16   0.026882 54.230.30.17 -> 172.31.36.109 TCP 1514 [TCP segment of a reassembled PDU]
 17   0.026887 172.31.36.109 -> 54.230.30.17 TCP 66 51413 > http [ACK] Seq=99 Ack=27143 Win=81280 Len=0 TSval=38550422 TSecr=721848983
 18   0.027961 54.230.30.17 -> 172.31.36.109 TCP 1514 [TCP segment of a reassembled PDU]
 19   0.027967 172.31.36.109 -> 54.230.30.17 TCP 66 51413 > http [ACK] Seq=99 Ack=28591 Win=84096 Len=0 TSval=38550422 TSecr=721848983
 20   0.028021 54.230.30.17 -> 172.31.36.109 TCP 10202 [TCP segment of a reassembled PDU]
 21   0.028028 172.31.36.109 -> 54.230.30.17 TCP 66 51413 > http [ACK] Seq=99 Ack=38727 Win=101248 Len=0 TSval=38550422 TSecr=721848983
 22   0.028197 54.230.30.17 -> 172.31.36.109 TCP 2962 [TCP segment of a reassembled PDU]
 23   0.028201 172.31.36.109 -> 54.230.30.17 TCP 66 51413 > http [ACK] Seq=99 Ack=41623 Win=109056 Len=0 TSval=38550422 TSecr=721848983
 24   0.028279 54.230.30.17 -> 172.31.36.109 TCP 5858 [TCP segment of a reassembled PDU]
 25   0.028284 172.31.36.109 -> 54.230.30.17 TCP 66 51413 > http [ACK] Seq=99 Ack=47415 Win=108416 Len=0 TSval=38550422 TSecr=721848983
 26   0.029217 54.230.30.17 -> 172.31.36.109 TCP 2962 [TCP segment of a reassembled PDU]
 27   0.029223 172.31.36.109 -> 54.230.30.17 TCP 66 51413 > http [ACK] Seq=99 Ack=50311 Win=109056 Len=0 TSval=38550423 TSecr=721848983
 28   0.029301 54.230.30.17 -> 172.31.36.109 TCP 8754 [TCP segment of a reassembled PDU]
 29   0.029308 172.31.36.109 -> 54.230.30.17 TCP 66 51413 > http [ACK] Seq=99 Ack=58999 Win=126464 Len=0 TSval=38550423 TSecr=721848983
 30   0.029476 54.230.30.17 -> 172.31.36.109 TCP 5858 [TCP segment of a reassembled PDU]
 31   0.029482 172.31.36.109 -> 54.230.30.17 TCP 66 51413 > http [ACK] Seq=99 Ack=64791 Win=137984 Len=0 TSval=38550423 TSecr=721848983
 32   0.029547 54.230.30.17 -> 172.31.36.109 TCP 1514 [TCP segment of a reassembled PDU]
 33   0.029551 172.31.36.109 -> 54.230.30.17 TCP 66 51413 > http [ACK] Seq=99 Ack=66239 Win=140928 Len=0 TSval=38550423 TSecr=721848983
 34   0.030505 54.230.30.17 -> 172.31.36.109 TCP 2962 [TCP segment of a reassembled PDU]
 35   0.030510 172.31.36.109 -> 54.230.30.17 TCP 66 51413 > http [ACK] Seq=99 Ack=69135 Win=146688 Len=0 TSval=38550423 TSecr=721848984
 36   0.030583 54.230.30.17 -> 172.31.36.109 TCP 4410 [TCP segment of a reassembled PDU]
 37   0.030588 172.31.36.109 -> 54.230.30.17 TCP 66 51413 > http [ACK] Seq=99 Ack=73479 Win=155392 Len=0 TSval=38550423 TSecr=721848984
 38   0.030746 54.230.30.17 -> 172.31.36.109 TCP 5858 [TCP segment of a reassembled PDU]
 39   0.030752 172.31.36.109 -> 54.230.30.17 TCP 66 51413 > http [ACK] Seq=99 Ack=79271 Win=167040 Len=0 TSval=38550423 TSecr=721848984
 40   0.030849 54.230.30.17 -> 172.31.36.109 TCP 10202 [TCP segment of a reassembled PDU]
 41   0.030857 172.31.36.109 -> 54.230.30.17 TCP 66 51413 > http [ACK] Seq=99 Ack=89407 Win=187264 Len=0 TSval=38550423 TSecr=721848984
 42   0.031095 54.230.30.17 -> 172.31.36.109 TCP 5858 [TCP segment of a reassembled PDU]
 43   0.031102 172.31.36.109 -> 54.230.30.17 TCP 66 51413 > http [ACK] Seq=99 Ack=95199 Win=198784 Len=0 TSval=38550423 TSecr=721848984
 44   0.031773 54.230.30.17 -> 172.31.36.109 TCP 2962 [TCP segment of a reassembled PDU]
 45   0.031778 172.31.36.109 -> 54.230.30.17 TCP 66 51413 > http [ACK] Seq=99 Ack=98095 Win=204672 Len=0 TSval=38550423 TSecr=721848984
 46   0.031877 54.230.30.17 -> 172.31.36.109 HTTP 4828 HTTP/1.1 200 OK  (application/octet-stream)
 47   0.031883 172.31.36.109 -> 54.230.30.17 TCP 66 51413 > http [ACK] Seq=99 Ack=102857 Win=214144 Len=0 TSval=38550423 TSecr=721848984
 48   0.032018 172.31.36.109 -> 54.230.30.17 TCP 66 51413 > http [FIN, ACK] Seq=99 Ack=102857 Win=214144 Len=0 TSval=38550423 TSecr=721848984
 49   0.033292 54.230.30.17 -> 172.31.36.109 TCP 66 http > 51413 [FIN, ACK] Seq=102857 Ack=100 Win=14592 Len=0 TSval=721848984 TSecr=38550423
 50   0.033300 172.31.36.109 -> 54.230.30.17 TCP 66 51413 > http [ACK] Seq=100 Ack=102858 Win=214144 Len=0 TSval=38550424 TSecr=721848984
