[Measurement for 100kb at 07:35:15 20.35.2014] 
Tshark:

  1   0.000000 172.31.36.109 -> 172.31.0.2   DNS 89 Standard query 0xc529  A d2pcb72msibvx3.cloudfront.net
  2   0.000029 172.31.36.109 -> 172.31.0.2   DNS 89 Standard query 0xfd34  AAAA d2pcb72msibvx3.cloudfront.net
  3   0.000581   172.31.0.2 -> 172.31.36.109 DNS 217 Standard query response 0xc529  A 54.192.30.194 A 54.192.30.214 A 54.230.30.6 A 54.230.30.53 A 54.230.30.69 A 54.230.30.207 A 54.230.30.218 A 54.192.29.221
  4   0.000591   172.31.0.2 -> 172.31.36.109 DNS 169 Standard query response 0xfd34 
  5   0.003908 172.31.36.109 -> 54.192.30.194 TCP 74 34581 > http [SYN] Seq=0 Win=26883 Len=0 MSS=8961 SACK_PERM=1 TSval=33150603 TSecr=0 WS=128
  6   0.005037 54.192.30.194 -> 172.31.36.109 TCP 74 http > 34581 [SYN, ACK] Seq=0 Ack=1 Win=14480 Len=0 MSS=1460 SACK_PERM=1 TSval=701179557 TSecr=33150603 WS=128
  7   0.005051 172.31.36.109 -> 54.192.30.194 TCP 66 34581 > http [ACK] Seq=1 Ack=1 Win=27008 Len=0 TSval=33150603 TSecr=701179557
  8   0.005088 172.31.36.109 -> 54.192.30.194 HTTP 164 GET /100kb HTTP/1.1 
  9   0.006279 54.192.30.194 -> 172.31.36.109 TCP 66 http > 34581 [ACK] Seq=1 Ack=99 Win=14592 Len=0 TSval=701179557 TSecr=33150603
 10   0.033609 54.192.30.194 -> 172.31.36.109 TCP 13098 [TCP segment of a reassembled PDU]
 11   0.033622 172.31.36.109 -> 54.192.30.194 TCP 66 34581 > http [ACK] Seq=99 Ack=13033 Win=52992 Len=0 TSval=33150610 TSecr=701179560
 12   0.035056 54.192.30.194 -> 172.31.36.109 TCP 13098 [TCP segment of a reassembled PDU]
 13   0.035066 172.31.36.109 -> 54.192.30.194 TCP 66 34581 > http [ACK] Seq=99 Ack=26065 Win=79104 Len=0 TSval=33150611 TSecr=701179560
 14   0.036315 54.192.30.194 -> 172.31.36.109 TCP 13098 [TCP segment of a reassembled PDU]
 15   0.036324 172.31.36.109 -> 54.192.30.194 TCP 66 34581 > http [ACK] Seq=99 Ack=39097 Win=96512 Len=0 TSval=33150611 TSecr=701179560
 16   0.037510 54.192.30.194 -> 172.31.36.109 TCP 4410 [TCP segment of a reassembled PDU]
 17   0.037535 172.31.36.109 -> 54.192.30.194 TCP 66 34581 > http [ACK] Seq=99 Ack=43441 Win=109056 Len=0 TSval=33150611 TSecr=701179560
 18   0.037546 54.192.30.194 -> 172.31.36.109 TCP 8754 [TCP segment of a reassembled PDU]
 19   0.037551 172.31.36.109 -> 54.192.30.194 TCP 66 34581 > http [ACK] Seq=99 Ack=52129 Win=100480 Len=0 TSval=33150611 TSecr=701179560
 20   0.038776 54.192.30.194 -> 172.31.36.109 TCP 5858 [TCP segment of a reassembled PDU]
 21   0.038800 172.31.36.109 -> 54.192.30.194 TCP 66 34581 > http [ACK] Seq=99 Ack=57921 Win=120704 Len=0 TSval=33150611 TSecr=701179560
 22   0.038861 54.192.30.194 -> 172.31.36.109 TCP 5858 [TCP segment of a reassembled PDU]
 23   0.038867 172.31.36.109 -> 54.192.30.194 TCP 66 34581 > http [ACK] Seq=99 Ack=63713 Win=132224 Len=0 TSval=33150611 TSecr=701179560
 24   0.038881 54.192.30.194 -> 172.31.36.109 TCP 10202 [TCP segment of a reassembled PDU]
 25   0.038887 172.31.36.109 -> 54.192.30.194 TCP 66 34581 > http [ACK] Seq=99 Ack=73849 Win=152448 Len=0 TSval=33150611 TSecr=701179561
 26   0.040066 54.192.30.194 -> 172.31.36.109 TCP 7306 [TCP segment of a reassembled PDU]
 27   0.040092 172.31.36.109 -> 54.192.30.194 TCP 66 34581 > http [ACK] Seq=99 Ack=81089 Win=167040 Len=0 TSval=33150612 TSecr=701179561
 28   0.040147 54.192.30.194 -> 172.31.36.109 TCP 18890 [TCP segment of a reassembled PDU]
 29   0.040158 172.31.36.109 -> 54.192.30.194 TCP 66 34581 > http [ACK] Seq=99 Ack=99913 Win=204672 Len=0 TSval=33150612 TSecr=701179561
 30   0.041337 54.192.30.194 -> 172.31.36.109 HTTP 3010 HTTP/1.1 200 OK  (application/octet-stream)
 31   0.041350 172.31.36.109 -> 54.192.30.194 TCP 66 34581 > http [ACK] Seq=99 Ack=102857 Win=210560 Len=0 TSval=33150612 TSecr=701179561
 32   0.041489 172.31.36.109 -> 54.192.30.194 TCP 66 34581 > http [FIN, ACK] Seq=99 Ack=102857 Win=210560 Len=0 TSval=33150612 TSecr=701179561
 33   0.042842 54.192.30.194 -> 172.31.36.109 TCP 66 http > 34581 [FIN, ACK] Seq=102857 Ack=100 Win=14592 Len=0 TSval=701179561 TSecr=33150612
 34   0.042872 172.31.36.109 -> 54.192.30.194 TCP 66 34581 > http [ACK] Seq=100 Ack=102858 Win=210560 Len=0 TSval=33150612 TSecr=701179561
