[Measurement for 100kb at 21:35:32 19.35.2014] 
Tshark:

  1   0.000000 172.31.36.109 -> 222.34.19.245 TCP 66 ssh > 36639 [ACK] Seq=1 Ack=1 Win=219 Len=0 TSval=24154383 TSecr=365494359
  2   0.320576 222.34.19.245 -> 172.31.36.109 SSH 210 Encrypted request packet len=144
  3   0.320606 172.31.36.109 -> 222.34.19.245 TCP 66 ssh > 36639 [ACK] Seq=1 Ack=145 Win=227 Len=0 TSval=24154463 TSecr=365494395
  4   0.322275 172.31.36.109 -> 222.34.19.245 SSH 786 Encrypted response packet len=720
  5   0.643465 222.34.19.245 -> 172.31.36.109 SSH 82 Encrypted request packet len=16
  6   0.679967 172.31.36.109 -> 222.34.19.245 TCP 66 ssh > 36639 [ACK] Seq=721 Ack=161 Win=227 Len=0 TSval=24154553 TSecr=365494427
  7   0.999652 222.34.19.245 -> 172.31.36.109 SSH 118 Encrypted request packet len=52
  8   0.999675 172.31.36.109 -> 222.34.19.245 TCP 66 ssh > 36639 [ACK] Seq=721 Ack=213 Win=227 Len=0 TSval=24154632 TSecr=365494463
  9   0.999744 172.31.36.109 -> 222.34.19.245 SSH 118 Encrypted response packet len=52
 10   1.320003 222.34.19.245 -> 172.31.36.109 SSH 150 Encrypted request packet len=84
 11   1.320448 172.31.36.109 -> 172.31.0.2   DNS 86 Standard query 0x0997  PTR 245.19.34.222.in-addr.arpa
 12   1.321736   172.31.0.2 -> 172.31.36.109 DNS 145 Standard query response 0x0997 No such name
 13   1.323399 172.31.36.109 -> 222.34.19.245 SSH 118 Encrypted response packet len=52
 14   1.643140 222.34.19.245 -> 172.31.36.109 SSH 118 Encrypted request packet len=52
 15   1.643165 222.34.19.245 -> 172.31.36.109 TCP 66 36639 > ssh [FIN, ACK] Seq=349 Ack=825 Win=319 Len=0 TSval=365494527 TSecr=24154713
 16   1.643523 222.34.19.245 -> 172.31.36.109 TCP 74 36777 > ssh [SYN] Seq=0 Win=14600 Len=0 MSS=1460 SACK_PERM=1 TSval=365494527 TSecr=0 WS=64
 17   1.643541 172.31.36.109 -> 222.34.19.245 TCP 74 ssh > 36777 [SYN, ACK] Seq=0 Ack=1 Win=26847 Len=0 MSS=8961 SACK_PERM=1 TSval=24154793 TSecr=365494527 WS=128
 18   1.644223 172.31.36.109 -> 222.34.19.245 TCP 66 ssh > 36639 [FIN, ACK] Seq=825 Ack=350 Win=227 Len=0 TSval=24154794 TSecr=365494527
 19   1.827571 172.31.36.109 -> 172.31.0.2   DNS 89 Standard query 0x46b3  A d2pcb72msibvx3.cloudfront.net
 20   1.827591 172.31.36.109 -> 172.31.0.2   DNS 89 Standard query 0x2364  AAAA d2pcb72msibvx3.cloudfront.net
 21   1.828071   172.31.0.2 -> 172.31.36.109 DNS 217 Standard query response 0x46b3  A 54.230.217.253 A 54.230.218.155 A 54.230.219.114 A 54.230.219.118 A 54.230.219.239 A 54.230.219.249 A 54.192.216.173 A 54.230.216.16
 22   1.828092   172.31.0.2 -> 172.31.36.109 DNS 169 Standard query response 0x2364 
 23   1.831471 172.31.36.109 -> 54.230.217.253 TCP 74 37677 > http [SYN] Seq=0 Win=26883 Len=0 MSS=8961 SACK_PERM=1 TSval=24154840 TSecr=0 WS=128
 24   1.917775 54.230.217.253 -> 172.31.36.109 TCP 74 http > 37677 [SYN, ACK] Seq=0 Ack=1 Win=14480 Len=0 MSS=1460 SACK_PERM=1 TSval=3125080037 TSecr=24154840 WS=128
 25   1.917808 172.31.36.109 -> 54.230.217.253 TCP 66 37677 > http [ACK] Seq=1 Ack=1 Win=27008 Len=0 TSval=24154862 TSecr=3125080037
 26   1.917922 172.31.36.109 -> 54.230.217.253 HTTP 164 GET /100kb HTTP/1.1 
 27   1.963063 222.34.19.245 -> 172.31.36.109 TCP 66 36639 > ssh [ACK] Seq=350 Ack=826 Win=319 Len=0 TSval=365494559 TSecr=24154794
 28   1.968034 222.34.19.245 -> 172.31.36.109 TCP 66 36777 > ssh [ACK] Seq=1 Ack=1 Win=14656 Len=0 TSval=365494560 TSecr=24154793
 29   1.972514 172.31.36.109 -> 222.34.19.245 SSH 107 Server Protocol: SSH-2.0-OpenSSH_6.6.1p1 Ubuntu-2ubuntu2\r
 30   2.003340 54.230.217.253 -> 172.31.36.109 TCP 66 http > 37677 [ACK] Seq=1 Ack=99 Win=14592 Len=0 TSval=3125080045 TSecr=24154862
 31   2.010956 54.230.217.253 -> 172.31.36.109 TCP 13098 [TCP segment of a reassembled PDU]
 32   2.010974 172.31.36.109 -> 54.230.217.253 TCP 66 37677 > http [ACK] Seq=99 Ack=13033 Win=52992 Len=0 TSval=24154885 TSecr=3125080046
 33   2.094982 54.230.217.253 -> 172.31.36.109 TCP 13098 [TCP segment of a reassembled PDU]
 34   2.094993 172.31.36.109 -> 54.230.217.253 TCP 66 37677 > http [ACK] Seq=99 Ack=26065 Win=79104 Len=0 TSval=24154906 TSecr=3125080055
 35   2.176752 54.230.217.253 -> 172.31.36.109 TCP 13098 [TCP segment of a reassembled PDU]
 36   2.176762 172.31.36.109 -> 54.230.217.253 TCP 66 37677 > http [ACK] Seq=99 Ack=39097 Win=96512 Len=0 TSval=24154927 TSecr=3125080063
 37   2.255040 54.230.217.253 -> 172.31.36.109 TCP 4410 [TCP segment of a reassembled PDU]
 38   2.255049 172.31.36.109 -> 54.230.217.253 TCP 66 37677 > http [ACK] Seq=99 Ack=43441 Win=109056 Len=0 TSval=24154946 TSecr=3125080071
 39   2.255059 54.230.217.253 -> 172.31.36.109 TCP 8754 [TCP segment of a reassembled PDU]
 40   2.255065 172.31.36.109 -> 54.230.217.253 TCP 66 37677 > http [ACK] Seq=99 Ack=52129 Win=100480 Len=0 TSval=24154946 TSecr=3125080071
 41   2.295958 222.34.19.245 -> 172.31.36.109 SSH 86 Client Protocol: SSH-2.0-libssh-0.1\r
 42   2.295964 222.34.19.245 -> 172.31.36.109 TCP 66 36777 > ssh [ACK] Seq=1 Ack=42 Win=14656 Len=0 TSval=365494593 TSecr=24154876
 43   2.295979 172.31.36.109 -> 222.34.19.245 TCP 66 ssh > 36777 [ACK] Seq=42 Ack=21 Win=26880 Len=0 TSval=24154957 TSecr=365494593
 44   2.295984 172.31.36.109 -> 222.34.19.245 TCP 66 [TCP Dup ACK 43#1] ssh > 36777 [ACK] Seq=42 Ack=21 Win=26880 Len=0 TSval=24154957 TSecr=365494593
 45   2.296489 172.31.36.109 -> 222.34.19.245 TCP 1514 [TCP segment of a reassembled PDU]
 46   2.296498 172.31.36.109 -> 222.34.19.245 SSHv2 250 Server: Key Exchange Init
 47   2.332981 54.230.217.253 -> 172.31.36.109 TCP 21786 [TCP segment of a reassembled PDU]
 48   2.332994 172.31.36.109 -> 54.230.217.253 TCP 66 37677 > http [ACK] Seq=99 Ack=73849 Win=82176 Len=0 TSval=24154966 TSecr=3125080078
 49   2.412114 54.230.217.253 -> 172.31.36.109 TCP 1514 [TCP segment of a reassembled PDU]
 50   2.412121 172.31.36.109 -> 54.230.217.253 TCP 66 37677 > http [ACK] Seq=99 Ack=75297 Win=112000 Len=0 TSval=24154986 TSecr=3125080086
 51   2.412127 54.230.217.253 -> 172.31.36.109 TCP 1514 [TCP segment of a reassembled PDU]
 52   2.412130 172.31.36.109 -> 54.230.217.253 TCP 66 37677 > http [ACK] Seq=99 Ack=76745 Win=114816 Len=0 TSval=24154986 TSecr=3125080086
 53   2.412206 54.230.217.253 -> 172.31.36.109 TCP 7306 [TCP segment of a reassembled PDU]
 54   2.412213 172.31.36.109 -> 54.230.217.253 TCP 66 37677 > http [ACK] Seq=99 Ack=83985 Win=129280 Len=0 TSval=24154986 TSecr=3125080086
 55   2.412308 54.230.217.253 -> 172.31.36.109 TCP 13098 [TCP segment of a reassembled PDU]
 56   2.412317 172.31.36.109 -> 54.230.217.253 TCP 66 37677 > http [ACK] Seq=99 Ack=97017 Win=155392 Len=0 TSval=24154986 TSecr=3125080086
 57   2.491978 54.230.217.253 -> 172.31.36.109 HTTP 5905 HTTP/1.1 200 OK  (application/octet-stream)
 58   2.491998 172.31.36.109 -> 54.230.217.253 TCP 66 37677 > http [ACK] Seq=99 Ack=102856 Win=167040 Len=0 TSval=24155006 TSecr=3125080094
 59   2.492341 172.31.36.109 -> 54.230.217.253 TCP 66 37677 > http [FIN, ACK] Seq=99 Ack=102856 Win=167040 Len=0 TSval=24155006 TSecr=3125080094
 60   2.575613 54.230.217.253 -> 172.31.36.109 TCP 66 http > 37677 [FIN, ACK] Seq=102856 Ack=100 Win=14592 Len=0 TSval=3125080103 TSecr=24155006
 61   2.575622 172.31.36.109 -> 54.230.217.253 TCP 66 37677 > http [ACK] Seq=100 Ack=102857 Win=167040 Len=0 TSval=24155026 TSecr=3125080103
 62   2.622333 222.34.19.245 -> 172.31.36.109 TCP 66 36777 > ssh [ACK] Seq=21 Ack=1674 Win=20416 Len=0 TSval=365494625 TSecr=24154957
 63   2.622493 222.34.19.245 -> 172.31.36.109 SSHv2 218 Client: Key Exchange Init
 64   2.659961 172.31.36.109 -> 222.34.19.245 TCP 66 ssh > 36777 [ACK] Seq=1674 Ack=173 Win=28032 Len=0 TSval=24155048 TSecr=365494625
 65   2.984594 222.34.19.245 -> 172.31.36.109 SSHv2 210 Client: Diffie-Hellman Key Exchange Init
