[Measurement for 100kb at 00:34:27 20.34.2014] 
Tshark:

  1   0.000000 172.31.36.109 -> 172.31.0.2   DNS 89 Standard query 0xcc9e  A d2pcb72msibvx3.cloudfront.net
  2   0.000028 172.31.36.109 -> 172.31.0.2   DNS 89 Standard query 0x5935  AAAA d2pcb72msibvx3.cloudfront.net
  3   0.000566   172.31.0.2 -> 172.31.36.109 DNS 217 Standard query response 0xcc9e  A 54.230.21.79 A 54.230.23.46 A 216.137.41.42 A 216.137.41.104 A 216.137.41.237 A 216.137.41.252 A 54.230.20.98 A 54.230.20.115
  4   0.000576   172.31.0.2 -> 172.31.36.109 DNS 169 Standard query response 0x5935 
  5   0.003914 172.31.36.109 -> 54.230.21.79 TCP 74 43543 > http [SYN] Seq=0 Win=26883 Len=0 MSS=8961 SACK_PERM=1 TSval=26838426 TSecr=0 WS=128
  6   0.092414 54.230.21.79 -> 172.31.36.109 TCP 74 http > 43543 [SYN, ACK] Seq=0 Ack=1 Win=14480 Len=0 MSS=1460 SACK_PERM=1 TSval=898244465 TSecr=26838426 WS=128
  7   0.092448 172.31.36.109 -> 54.230.21.79 TCP 66 43543 > http [ACK] Seq=1 Ack=1 Win=27008 Len=0 TSval=26838449 TSecr=898244465
  8   0.092492 172.31.36.109 -> 54.230.21.79 HTTP 164 GET /100kb HTTP/1.1 
  9   0.180933 54.230.21.79 -> 172.31.36.109 TCP 66 http > 43543 [ACK] Seq=1 Ack=99 Win=14592 Len=0 TSval=898244474 TSecr=26838449
 10   0.184951 54.230.21.79 -> 172.31.36.109 TCP 1144 [TCP segment of a reassembled PDU]
 11   0.184960 172.31.36.109 -> 54.230.21.79 TCP 66 43543 > http [ACK] Seq=99 Ack=1079 Win=29056 Len=0 TSval=26838472 TSecr=898244474
 12   0.185791 54.230.21.79 -> 172.31.36.109 TCP 13098 [TCP segment of a reassembled PDU]
 13   0.185804 172.31.36.109 -> 54.230.21.79 TCP 66 43543 > http [ACK] Seq=99 Ack=14111 Win=55168 Len=0 TSval=26838472 TSecr=898244474
 14   0.274147 54.230.21.79 -> 172.31.36.109 TCP 4410 [TCP segment of a reassembled PDU]
 15   0.274156 172.31.36.109 -> 54.230.21.79 TCP 66 43543 > http [ACK] Seq=99 Ack=18455 Win=63872 Len=0 TSval=26838494 TSecr=898244483
 16   0.274301 54.230.21.79 -> 172.31.36.109 TCP 4410 [TCP segment of a reassembled PDU]
 17   0.274308 172.31.36.109 -> 54.230.21.79 TCP 66 43543 > http [ACK] Seq=99 Ack=22799 Win=72576 Len=0 TSval=26838494 TSecr=898244483
 18   0.274345 54.230.21.79 -> 172.31.36.109 TCP 4410 [TCP segment of a reassembled PDU]
 19   0.274351 172.31.36.109 -> 54.230.21.79 TCP 66 43543 > http [ACK] Seq=99 Ack=27143 Win=81280 Len=0 TSval=26838494 TSecr=898244483
 20   0.362502 54.230.21.79 -> 172.31.36.109 TCP 13098 [TCP segment of a reassembled PDU]
 21   0.362517 172.31.36.109 -> 54.230.21.79 TCP 66 43543 > http [ACK] Seq=99 Ack=40175 Win=96512 Len=0 TSval=26838516 TSecr=898244492
 22   0.362679 54.230.21.79 -> 172.31.36.109 TCP 4410 [TCP segment of a reassembled PDU]
 23   0.362686 172.31.36.109 -> 54.230.21.79 TCP 66 43543 > http [ACK] Seq=99 Ack=44519 Win=109056 Len=0 TSval=26838516 TSecr=898244492
 24   0.362891 54.230.21.79 -> 172.31.36.109 TCP 4410 [TCP segment of a reassembled PDU]
 25   0.362898 172.31.36.109 -> 54.230.21.79 TCP 66 43543 > http [ACK] Seq=99 Ack=48863 Win=109056 Len=0 TSval=26838516 TSecr=898244492
 26   0.451178 54.230.21.79 -> 172.31.36.109 TCP 4410 [TCP segment of a reassembled PDU]
 27   0.451202 172.31.36.109 -> 54.230.21.79 TCP 66 43543 > http [ACK] Seq=99 Ack=53207 Win=109056 Len=0 TSval=26838538 TSecr=898244501
 28   0.451220 54.230.21.79 -> 172.31.36.109 TCP 10202 [TCP segment of a reassembled PDU]
 29   0.451230 172.31.36.109 -> 54.230.21.79 TCP 66 43543 > http [ACK] Seq=99 Ack=63343 Win=98944 Len=0 TSval=26838538 TSecr=898244501
 30   0.451395 54.230.21.79 -> 172.31.36.109 TCP 11650 [TCP segment of a reassembled PDU]
 31   0.451404 172.31.36.109 -> 54.230.21.79 TCP 66 43543 > http [ACK] Seq=99 Ack=74927 Win=98944 Len=0 TSval=26838538 TSecr=898244501
 32   0.539759 54.230.21.79 -> 172.31.36.109 TCP 4410 [TCP segment of a reassembled PDU]
 33   0.539767 172.31.36.109 -> 54.230.21.79 TCP 66 43543 > http [ACK] Seq=99 Ack=79271 Win=109056 Len=0 TSval=26838560 TSecr=898244510
 34   0.539776 54.230.21.79 -> 172.31.36.109 TCP 2962 [TCP segment of a reassembled PDU]
 35   0.539780 172.31.36.109 -> 54.230.21.79 TCP 66 43543 > http [ACK] Seq=99 Ack=82167 Win=106240 Len=0 TSval=26838560 TSecr=898244510
 36   0.540003 54.230.21.79 -> 172.31.36.109 HTTP 20756 HTTP/1.1 200 OK  (application/octet-stream)
 37   0.540013 172.31.36.109 -> 54.230.21.79 TCP 66 43543 > http [ACK] Seq=99 Ack=102857 Win=150400 Len=0 TSval=26838560 TSecr=898244510
 38   0.540154 172.31.36.109 -> 54.230.21.79 TCP 66 43543 > http [FIN, ACK] Seq=99 Ack=102857 Win=150400 Len=0 TSval=26838560 TSecr=898244510
 39   0.628412 54.230.21.79 -> 172.31.36.109 TCP 66 http > 43543 [FIN, ACK] Seq=102857 Ack=100 Win=14592 Len=0 TSval=898244518 TSecr=26838560
 40   0.628423 172.31.36.109 -> 54.230.21.79 TCP 66 43543 > http [ACK] Seq=100 Ack=102858 Win=150400 Len=0 TSval=26838583 TSecr=898244518
