[Measurement for 10kb at 08:44:09 20.44.2014] 
Tshark:

  1   0.000000 172.31.8.238 -> 172.31.0.2   DNS 89 Standard query 0xad0c  A d2pcb72msibvx3.cloudfront.net
  2   0.000050 172.31.8.238 -> 172.31.0.2   DNS 89 Standard query 0x3c06  AAAA d2pcb72msibvx3.cloudfront.net
  3   0.000686   172.31.0.2 -> 172.31.8.238 DNS 169 Standard query response 0x3c06 
  4   0.000698   172.31.0.2 -> 172.31.8.238 DNS 217 Standard query response 0xad0c  A 54.239.132.41 A 54.239.132.196 A 54.239.132.249 A 54.192.118.234 A 54.230.116.72 A 54.230.116.154 A 54.230.117.198 A 54.230.119.66
  5   0.003845 172.31.8.238 -> 54.239.132.41 TCP 74 54768 > http [SYN] Seq=0 Win=26883 Len=0 MSS=8961 SACK_PERM=1 TSval=14169304 TSecr=0 WS=128
  6   0.004490 54.239.132.41 -> 172.31.8.238 TCP 74 http > 54768 [SYN, ACK] Seq=0 Ack=1 Win=14480 Len=0 MSS=1460 SACK_PERM=1 TSval=1685444131 TSecr=14169304 WS=128
  7   0.004505 172.31.8.238 -> 54.239.132.41 TCP 66 54768 > http [ACK] Seq=1 Ack=1 Win=27008 Len=0 TSval=14169304 TSecr=1685444131
  8   0.004557 172.31.8.238 -> 54.239.132.41 HTTP 163 GET /10kb HTTP/1.1 
  9   0.005238 54.239.132.41 -> 172.31.8.238 TCP 66 http > 54768 [ACK] Seq=1 Ack=98 Win=14592 Len=0 TSval=1685444131 TSecr=14169304
 10   0.007678 54.239.132.41 -> 172.31.8.238 HTTP 10761 HTTP/1.1 200 OK  (application/octet-stream)
 11   0.007690 172.31.8.238 -> 54.239.132.41 TCP 66 54768 > http [ACK] Seq=98 Ack=10696 Win=48384 Len=0 TSval=14169304 TSecr=1685444131
 12   0.007866 172.31.8.238 -> 54.239.132.41 TCP 66 54768 > http [FIN, ACK] Seq=98 Ack=10696 Win=48384 Len=0 TSval=14169305 TSecr=1685444131
 13   0.008592 54.239.132.41 -> 172.31.8.238 TCP 66 http > 54768 [FIN, ACK] Seq=10696 Ack=99 Win=14592 Len=0 TSval=1685444131 TSecr=14169305
 14   0.008600 172.31.8.238 -> 54.239.132.41 TCP 66 54768 > http [ACK] Seq=99 Ack=10697 Win=48384 Len=0 TSval=14169305 TSecr=1685444131
