[Measurement for 10kb at 01:44:08 20.44.2014] 
Tshark:

  1   0.000000 172.31.8.238 -> 172.31.0.2   DNS 89 Standard query 0xfb41  A d2pcb72msibvx3.cloudfront.net
  2   0.000028 172.31.8.238 -> 172.31.0.2   DNS 89 Standard query 0xdb88  AAAA d2pcb72msibvx3.cloudfront.net
  3   0.000724   172.31.0.2 -> 172.31.8.238 DNS 217 Standard query response 0xfb41  A 54.230.119.18 A 54.230.119.110 A 54.192.118.233 A 54.192.118.238 A 54.230.116.98 A 54.230.116.136 A 54.230.116.154 A 54.230.117.238
  4   0.000834   172.31.0.2 -> 172.31.8.238 DNS 169 Standard query response 0xdb88 
  5   0.003862 172.31.8.238 -> 54.230.119.18 TCP 74 43128 > http [SYN] Seq=0 Win=26883 Len=0 MSS=8961 SACK_PERM=1 TSval=7869041 TSecr=0 WS=128
  6   0.004457 54.230.119.18 -> 172.31.8.238 TCP 74 http > 43128 [SYN, ACK] Seq=0 Ack=1 Win=14480 Len=0 MSS=1460 SACK_PERM=1 TSval=1682476792 TSecr=7869041 WS=128
  7   0.004470 172.31.8.238 -> 54.230.119.18 TCP 66 43128 > http [ACK] Seq=1 Ack=1 Win=27008 Len=0 TSval=7869041 TSecr=1682476792
  8   0.004522 172.31.8.238 -> 54.230.119.18 HTTP 163 GET /10kb HTTP/1.1 
  9   0.004950 54.230.119.18 -> 172.31.8.238 TCP 66 http > 43128 [ACK] Seq=1 Ack=98 Win=14592 Len=0 TSval=1682476792 TSecr=7869041
 10   0.007025 54.230.119.18 -> 172.31.8.238 TCP 4410 [TCP segment of a reassembled PDU]
 11   0.007034 172.31.8.238 -> 54.230.119.18 TCP 66 43128 > http [ACK] Seq=98 Ack=4345 Win=35584 Len=0 TSval=7869042 TSecr=1682476793
 12   0.007123 54.230.119.18 -> 172.31.8.238 HTTP 6417 HTTP/1.1 200 OK  (application/octet-stream)
 13   0.007132 172.31.8.238 -> 54.230.119.18 TCP 66 43128 > http [ACK] Seq=98 Ack=10696 Win=48384 Len=0 TSval=7869042 TSecr=1682476793
 14   0.007247 172.31.8.238 -> 54.230.119.18 TCP 66 43128 > http [FIN, ACK] Seq=98 Ack=10696 Win=48384 Len=0 TSval=7869042 TSecr=1682476793
 15   0.007764 54.230.119.18 -> 172.31.8.238 TCP 66 http > 43128 [FIN, ACK] Seq=10696 Ack=99 Win=14592 Len=0 TSval=1682476793 TSecr=7869042
 16   0.007772 172.31.8.238 -> 54.230.119.18 TCP 66 43128 > http [ACK] Seq=99 Ack=10697 Win=48384 Len=0 TSval=7869042 TSecr=1682476793
