[Measurement for 10kb at 12:44:09 20.44.2014] 
Tshark:

  1   0.000000 172.31.8.238 -> 172.31.0.2   DNS 89 Standard query 0x7210  A d2pcb72msibvx3.cloudfront.net
  2   0.000029 172.31.8.238 -> 172.31.0.2   DNS 89 Standard query 0xa104  AAAA d2pcb72msibvx3.cloudfront.net
  3   0.000708   172.31.0.2 -> 172.31.8.238 DNS 217 Standard query response 0x7210  A 54.230.117.198 A 54.230.118.114 A 54.230.119.150 A 54.239.132.233 A 54.192.118.218 A 54.230.116.72 A 54.230.117.21 A 54.230.117.87
  4   0.000747   172.31.0.2 -> 172.31.8.238 DNS 169 Standard query response 0xa104 
  5   0.003873 172.31.8.238 -> 54.230.117.198 TCP 74 46854 > http [SYN] Seq=0 Win=26883 Len=0 MSS=8961 SACK_PERM=1 TSval=17769286 TSecr=0 WS=128
  6   0.004599 54.230.117.198 -> 172.31.8.238 TCP 74 http > 46854 [SYN, ACK] Seq=0 Ack=1 Win=14480 Len=0 MSS=1460 SACK_PERM=1 TSval=1689067244 TSecr=17769286 WS=128
  7   0.004613 172.31.8.238 -> 54.230.117.198 TCP 66 46854 > http [ACK] Seq=1 Ack=1 Win=27008 Len=0 TSval=17769287 TSecr=1689067244
  8   0.004659 172.31.8.238 -> 54.230.117.198 HTTP 163 GET /10kb HTTP/1.1 
  9   0.005340 54.230.117.198 -> 172.31.8.238 TCP 66 http > 46854 [ACK] Seq=1 Ack=98 Win=14592 Len=0 TSval=1689067244 TSecr=17769287
 10   0.007174 54.230.117.198 -> 172.31.8.238 TCP 4410 [TCP segment of a reassembled PDU]
 11   0.007184 172.31.8.238 -> 54.230.117.198 TCP 66 46854 > http [ACK] Seq=98 Ack=4345 Win=35584 Len=0 TSval=17769287 TSecr=1689067244
 12   0.007279 54.230.117.198 -> 172.31.8.238 HTTP 6417 HTTP/1.1 200 OK  (application/octet-stream)
 13   0.007288 172.31.8.238 -> 54.230.117.198 TCP 66 46854 > http [ACK] Seq=98 Ack=10696 Win=48384 Len=0 TSval=17769287 TSecr=1689067244
 14   0.007412 172.31.8.238 -> 54.230.117.198 TCP 66 46854 > http [FIN, ACK] Seq=98 Ack=10696 Win=48384 Len=0 TSval=17769287 TSecr=1689067244
 15   0.007931 54.230.117.198 -> 172.31.8.238 TCP 66 http > 46854 [FIN, ACK] Seq=10696 Ack=99 Win=14592 Len=0 TSval=1689067244 TSecr=17769287
 16   0.007938 172.31.8.238 -> 54.230.117.198 TCP 66 46854 > http [ACK] Seq=99 Ack=10697 Win=48384 Len=0 TSval=17769287 TSecr=1689067244
