[Measurement for 10kb at 14:44:09 20.44.2014] 
Tshark:

  1   0.000000 172.31.8.238 -> 172.31.0.2   DNS 89 Standard query 0xdcef  A d2pcb72msibvx3.cloudfront.net
  2   0.000027 172.31.8.238 -> 172.31.0.2   DNS 89 Standard query 0x0abc  AAAA d2pcb72msibvx3.cloudfront.net
  3   0.000648   172.31.0.2 -> 172.31.8.238 DNS 169 Standard query response 0x0abc 
  4   0.000660   172.31.0.2 -> 172.31.8.238 DNS 217 Standard query response 0xdcef  A 54.192.118.243 A 54.230.116.73 A 54.230.117.45 A 54.230.117.50 A 54.239.132.41 A 54.239.132.90 A 54.239.132.196 A 54.192.118.241
  5   0.003886 172.31.8.238 -> 54.192.118.243 TCP 74 36180 > http [SYN] Seq=0 Win=26883 Len=0 MSS=8961 SACK_PERM=1 TSval=19569178 TSecr=0 WS=128
  6   0.005715 54.192.118.243 -> 172.31.8.238 TCP 74 http > 36180 [SYN, ACK] Seq=0 Ack=1 Win=14480 Len=0 MSS=1460 SACK_PERM=1 TSval=1690666112 TSecr=19569178 WS=128
  7   0.005729 172.31.8.238 -> 54.192.118.243 TCP 66 36180 > http [ACK] Seq=1 Ack=1 Win=27008 Len=0 TSval=19569179 TSecr=1690666112
  8   0.005769 172.31.8.238 -> 54.192.118.243 HTTP 163 GET /10kb HTTP/1.1 
  9   0.006603 54.192.118.243 -> 172.31.8.238 TCP 66 http > 36180 [ACK] Seq=1 Ack=98 Win=14592 Len=0 TSval=1690666113 TSecr=19569179
 10   0.007875 54.192.118.243 -> 172.31.8.238 TCP 8754 [TCP segment of a reassembled PDU]
 11   0.007884 172.31.8.238 -> 54.192.118.243 TCP 66 36180 > http [ACK] Seq=98 Ack=8689 Win=44288 Len=0 TSval=19569179 TSecr=1690666113
 12   0.007916 54.192.118.243 -> 172.31.8.238 HTTP 2073 HTTP/1.1 200 OK  (application/octet-stream)
 13   0.007922 172.31.8.238 -> 54.192.118.243 TCP 66 36180 > http [ACK] Seq=98 Ack=10696 Win=48384 Len=0 TSval=19569179 TSecr=1690666113
 14   0.008053 172.31.8.238 -> 54.192.118.243 TCP 66 36180 > http [FIN, ACK] Seq=98 Ack=10696 Win=48384 Len=0 TSval=19569179 TSecr=1690666113
 15   0.008588 54.192.118.243 -> 172.31.8.238 TCP 66 http > 36180 [FIN, ACK] Seq=10696 Ack=99 Win=14592 Len=0 TSval=1690666113 TSecr=19569179
 16   0.008596 172.31.8.238 -> 54.192.118.243 TCP 66 36180 > http [ACK] Seq=99 Ack=10697 Win=48384 Len=0 TSval=19569180 TSecr=1690666113
