[Measurement for 10kb at 13:44:09 20.44.2014] 
Tshark:

  1   0.000000 172.31.8.238 -> 172.31.0.2   DNS 89 Standard query 0x4cae  A d2pcb72msibvx3.cloudfront.net
  2   0.000027 172.31.8.238 -> 172.31.0.2   DNS 89 Standard query 0xab3c  AAAA d2pcb72msibvx3.cloudfront.net
  3   0.005526   172.31.0.2 -> 172.31.8.238 DNS 217 Standard query response 0x4cae  A 54.230.119.66 A 54.239.132.26 A 54.239.132.74 A 54.192.118.228 A 54.192.118.230 A 54.230.116.239 A 54.230.117.86 A 54.230.119.40
  4   0.005538   172.31.0.2 -> 172.31.8.238 DNS 169 Standard query response 0xab3c 
  5   0.012013 172.31.8.238 -> 54.230.119.66 TCP 74 37486 > http [SYN] Seq=0 Win=26883 Len=0 MSS=8961 SACK_PERM=1 TSval=18669235 TSecr=0 WS=128
  6   0.012863 54.230.119.66 -> 172.31.8.238 TCP 74 http > 37486 [SYN, ACK] Seq=0 Ack=1 Win=14480 Len=0 MSS=1460 SACK_PERM=1 TSval=1690243724 TSecr=18669235 WS=128
  7   0.012878 172.31.8.238 -> 54.230.119.66 TCP 66 37486 > http [ACK] Seq=1 Ack=1 Win=27008 Len=0 TSval=18669235 TSecr=1690243724
  8   0.012920 172.31.8.238 -> 54.230.119.66 HTTP 163 GET /10kb HTTP/1.1 
  9   0.013617 54.230.119.66 -> 172.31.8.238 TCP 66 http > 37486 [ACK] Seq=1 Ack=98 Win=14592 Len=0 TSval=1690243724 TSecr=18669235
 10   0.014917 54.230.119.66 -> 172.31.8.238 TCP 2592 [TCP segment of a reassembled PDU]
 11   0.014924 172.31.8.238 -> 54.230.119.66 TCP 66 37486 > http [ACK] Seq=98 Ack=2527 Win=32000 Len=0 TSval=18669236 TSecr=1690243724
 12   0.015035 54.230.119.66 -> 172.31.8.238 HTTP 8235 HTTP/1.1 200 OK  (application/octet-stream)
 13   0.015044 172.31.8.238 -> 54.230.119.66 TCP 66 37486 > http [ACK] Seq=98 Ack=10696 Win=48384 Len=0 TSval=18669236 TSecr=1690243724
 14   0.015184 172.31.8.238 -> 54.230.119.66 TCP 66 37486 > http [FIN, ACK] Seq=98 Ack=10696 Win=48384 Len=0 TSval=18669236 TSecr=1690243724
 15   0.015908 54.230.119.66 -> 172.31.8.238 TCP 66 http > 37486 [FIN, ACK] Seq=10696 Ack=99 Win=14592 Len=0 TSval=1690243724 TSecr=18669236
 16   0.015916 172.31.8.238 -> 54.230.119.66 TCP 66 37486 > http [ACK] Seq=99 Ack=10697 Win=48384 Len=0 TSval=18669236 TSecr=1690243724
