[Measurement for 10kb at 04:44:08 20.44.2014] 
Tshark:

  1   0.000000 172.31.8.238 -> 172.31.0.2   DNS 89 Standard query 0xcf73  A d2pcb72msibvx3.cloudfront.net
  2   0.000029 172.31.8.238 -> 172.31.0.2   DNS 89 Standard query 0x5fe4  AAAA d2pcb72msibvx3.cloudfront.net
  3   0.000690   172.31.0.2 -> 172.31.8.238 DNS 217 Standard query response 0xcf73  A 54.192.118.228 A 54.230.117.154 A 54.230.117.157 A 54.230.119.40 A 54.230.119.150 A 54.239.132.41 A 54.239.132.74 A 54.239.132.249
  4   0.000717   172.31.0.2 -> 172.31.8.238 DNS 169 Standard query response 0x5fe4 
  5   0.003885 172.31.8.238 -> 54.192.118.228 TCP 74 55007 > http [SYN] Seq=0 Win=26883 Len=0 MSS=8961 SACK_PERM=1 TSval=10569153 TSecr=0 WS=128
  6   0.004483 54.192.118.228 -> 172.31.8.238 TCP 74 http > 55007 [SYN, ACK] Seq=0 Ack=1 Win=14480 Len=0 MSS=1460 SACK_PERM=1 TSval=1496146746 TSecr=10569153 WS=128
  7   0.004498 172.31.8.238 -> 54.192.118.228 TCP 66 55007 > http [ACK] Seq=1 Ack=1 Win=27008 Len=0 TSval=10569154 TSecr=1496146746
  8   0.004541 172.31.8.238 -> 54.192.118.228 HTTP 163 GET /10kb HTTP/1.1 
  9   0.005241 54.192.118.228 -> 172.31.8.238 TCP 66 http > 55007 [ACK] Seq=1 Ack=98 Win=14592 Len=0 TSval=1496146746 TSecr=10569154
 10   0.007370 54.192.118.228 -> 172.31.8.238 TCP 2592 [TCP segment of a reassembled PDU]
 11   0.007381 172.31.8.238 -> 54.192.118.228 TCP 66 55007 > http [ACK] Seq=98 Ack=2527 Win=32000 Len=0 TSval=10569154 TSecr=1496146746
 12   0.007428 54.192.118.228 -> 172.31.8.238 HTTP 8235 HTTP/1.1 200 OK  (application/octet-stream)
 13   0.007436 172.31.8.238 -> 54.192.118.228 TCP 66 55007 > http [ACK] Seq=98 Ack=10696 Win=48384 Len=0 TSval=10569154 TSecr=1496146746
 14   0.007606 172.31.8.238 -> 54.192.118.228 TCP 66 55007 > http [FIN, ACK] Seq=98 Ack=10696 Win=48384 Len=0 TSval=10569154 TSecr=1496146746
 15   0.008195 54.192.118.228 -> 172.31.8.238 TCP 66 http > 55007 [FIN, ACK] Seq=10696 Ack=99 Win=14592 Len=0 TSval=1496146746 TSecr=10569154
 16   0.008203 172.31.8.238 -> 54.192.118.228 TCP 66 55007 > http [ACK] Seq=99 Ack=10697 Win=48384 Len=0 TSval=10569154 TSecr=1496146746
 17   0.988277 06:c7:b5:04:b8:d0 -> 06:b0:37:46:8f:13 ARP 42 Who has 172.31.0.2?  Tell 172.31.8.238
 18   0.988424 06:b0:37:46:8f:13 -> 06:c7:b5:04:b8:d0 ARP 60 172.31.0.2 is at 06:b0:37:46:8f:13
