[Measurement for 10kb at 03:44:09 20.44.2014] 
Tshark:

  1   0.000000 172.31.8.238 -> 172.31.0.2   DNS 89 Standard query 0x8051  A d2pcb72msibvx3.cloudfront.net
  2   0.000028 172.31.8.238 -> 172.31.0.2   DNS 89 Standard query 0x68a1  AAAA d2pcb72msibvx3.cloudfront.net
  3   0.000720   172.31.0.2 -> 172.31.8.238 DNS 169 Standard query response 0x68a1 
  4   0.000733   172.31.0.2 -> 172.31.8.238 DNS 217 Standard query response 0x8051  A 54.192.118.240 A 54.192.118.246 A 54.230.116.72 A 54.230.116.167 A 54.239.132.41 A 54.239.132.233 A 54.192.118.235 A 54.192.118.239
  5   0.003897 172.31.8.238 -> 54.192.118.240 TCP 74 38637 > http [SYN] Seq=0 Win=26883 Len=0 MSS=8961 SACK_PERM=1 TSval=9669210 TSecr=0 WS=128
  6   0.004610 54.192.118.240 -> 172.31.8.238 TCP 74 http > 38637 [SYN, ACK] Seq=0 Ack=1 Win=14480 Len=0 MSS=1460 SACK_PERM=1 TSval=1686596871 TSecr=9669210 WS=128
  7   0.004624 172.31.8.238 -> 54.192.118.240 TCP 66 38637 > http [ACK] Seq=1 Ack=1 Win=27008 Len=0 TSval=9669210 TSecr=1686596871
  8   0.004664 172.31.8.238 -> 54.192.118.240 HTTP 163 GET /10kb HTTP/1.1 
  9   0.005083 54.192.118.240 -> 172.31.8.238 TCP 66 http > 38637 [ACK] Seq=1 Ack=98 Win=14592 Len=0 TSval=1686596871 TSecr=9669210
 10   0.006652 54.192.118.240 -> 172.31.8.238 TCP 1514 [TCP segment of a reassembled PDU]
 11   0.006658 172.31.8.238 -> 54.192.118.240 TCP 66 38637 > http [ACK] Seq=98 Ack=1449 Win=29824 Len=0 TSval=9669210 TSecr=1686596871
 12   0.006763 54.192.118.240 -> 172.31.8.238 HTTP 9313 HTTP/1.1 200 OK  (application/octet-stream)
 13   0.006785 172.31.8.238 -> 54.192.118.240 TCP 66 38637 > http [ACK] Seq=98 Ack=10696 Win=48384 Len=0 TSval=9669210 TSecr=1686596871
 14   0.006928 172.31.8.238 -> 54.192.118.240 TCP 66 38637 > http [FIN, ACK] Seq=98 Ack=10696 Win=48384 Len=0 TSval=9669211 TSecr=1686596871
 15   0.007708 54.192.118.240 -> 172.31.8.238 TCP 66 http > 38637 [FIN, ACK] Seq=10696 Ack=99 Win=14592 Len=0 TSval=1686596871 TSecr=9669211
 16   0.007716 172.31.8.238 -> 54.192.118.240 TCP 66 38637 > http [ACK] Seq=99 Ack=10697 Win=48384 Len=0 TSval=9669211 TSecr=1686596871
