[Measurement for 10kb at 10:02:05 17.02.2014] 
Tshark:

  1   0.000000  192.168.1.2 -> 54.230.99.162 TCP 66 52012→80 [SYN] Seq=0 Win=8192 Len=0 MSS=1460 WS=256 SACK_PERM=1
  2   0.062122 54.230.99.162 -> 192.168.1.2  TCP 66 80→52012 [SYN, ACK] Seq=0 Ack=1 Win=14600 Len=0 MSS=1400 SACK_PERM=1 WS=128
  3   0.062276  192.168.1.2 -> 54.230.99.162 TCP 54 52012→80 [ACK] Seq=1 Ack=1 Win=65792 Len=0
  4   0.071787  192.168.1.2 -> 54.230.99.162 HTTP 151 GET /10kb HTTP/1.1 
  5   0.100563 54.230.99.162 -> 192.168.1.2  TCP 54 80→52012 [ACK] Seq=1 Ack=98 Win=14720 Len=0
  6   0.102653 54.230.99.162 -> 192.168.1.2  TCP 1454 [TCP segment of a reassembled PDU]
  7   0.104611 54.230.99.162 -> 192.168.1.2  TCP 1454 [TCP segment of a reassembled PDU]
  8   0.104613 54.230.99.162 -> 192.168.1.2  TCP 1454 [TCP segment of a reassembled PDU]
  9   0.104615 54.230.99.162 -> 192.168.1.2  TCP 1454 [TCP segment of a reassembled PDU]
 10   0.104619 54.230.99.162 -> 192.168.1.2  TCP 1454 [TCP segment of a reassembled PDU]
 11   0.104620 54.230.99.162 -> 192.168.1.2  TCP 1454 [TCP segment of a reassembled PDU]
 12   0.104621 54.230.99.162 -> 192.168.1.2  TCP 1454 [TCP segment of a reassembled PDU]
 13   0.104788  192.168.1.2 -> 54.230.99.162 TCP 54 52012→80 [ACK] Seq=98 Ack=9801 Win=65792 Len=0
 14   0.107187 54.230.99.162 -> 192.168.1.2  HTTP 949 HTTP/1.1 200 OK  (application/octet-stream)
 15   0.107266  192.168.1.2 -> 54.230.99.162 TCP 54 52012→80 [ACK] Seq=98 Ack=10696 Win=64768 Len=0
 16   0.107412  192.168.1.2 -> 54.230.99.162 TCP 54 52012→80 [FIN, ACK] Seq=98 Ack=10696 Win=64768 Len=0
 17   0.137200 54.230.99.162 -> 192.168.1.2  TCP 54 80→52012 [FIN, ACK] Seq=10696 Ack=99 Win=14720 Len=0
 18   0.137346  192.168.1.2 -> 54.230.99.162 TCP 54 52012→80 [ACK] Seq=99 Ack=10697 Win=64768 Len=0
 19   0.766699 HuaweiTe_25:83:d4 -> IntelCor_3f:fc:98 ARP 42 Who has 192.168.1.2?  Tell 192.168.1.1
 20   0.766739 IntelCor_3f:fc:98 -> HuaweiTe_25:83:d4 ARP 42 192.168.1.2 is at 00:24:d7:3f:fc:98
