[Measurement for 1kb at 12:32:50 20.32.2014] 
Tshark:

  1   0.000000 172.31.36.109 -> 172.31.0.2   DNS 88 Standard query 0x9fda  A dm53kc3eax57k.cloudfront.net
  2   0.000025 172.31.36.109 -> 172.31.0.2   DNS 88 Standard query 0xd48b  AAAA dm53kc3eax57k.cloudfront.net
  3   0.000429   172.31.0.2 -> 172.31.36.109 DNS 216 Standard query response 0x9fda  A 54.192.30.194 A 54.192.30.227 A 54.230.29.242 A 54.230.30.52 A 54.230.30.58 A 54.230.30.193 A 54.230.30.239 A 54.192.29.220
  4   0.024434   172.31.0.2 -> 172.31.36.109 DNS 175 Standard query response 0xd48b 
  5   0.028199 172.31.36.109 -> 54.192.30.194 TCP 74 34789 > http [SYN] Seq=0 Win=26883 Len=0 MSS=8961 SACK_PERM=1 TSval=37614261 TSecr=0 WS=128
  6   0.029208 54.192.30.194 -> 172.31.36.109 TCP 74 http > 34789 [SYN, ACK] Seq=0 Ack=1 Win=14480 Len=0 MSS=1460 SACK_PERM=1 TSval=658771336 TSecr=37614261 WS=128
  7   0.029244 172.31.36.109 -> 54.192.30.194 TCP 66 34789 > http [ACK] Seq=1 Ack=1 Win=27008 Len=0 TSval=37614261 TSecr=658771336
  8   0.029282 172.31.36.109 -> 54.192.30.194 HTTP 161 GET /1kb HTTP/1.1 
  9   0.030445 54.192.30.194 -> 172.31.36.109 TCP 66 http > 34789 [ACK] Seq=1 Ack=96 Win=14592 Len=0 TSval=658771336 TSecr=37614261
 10   0.059208 54.192.30.194 -> 172.31.36.109 HTTP 1544 HTTP/1.1 200 OK  (application/octet-stream)
 11   0.059217 172.31.36.109 -> 54.192.30.194 TCP 66 34789 > http [ACK] Seq=96 Ack=1479 Win=29952 Len=0 TSval=37614269 TSecr=658771339
 12   0.059393 172.31.36.109 -> 54.192.30.194 TCP 66 34789 > http [FIN, ACK] Seq=96 Ack=1479 Win=29952 Len=0 TSval=37614269 TSecr=658771339
 13   0.060505 54.192.30.194 -> 172.31.36.109 TCP 66 http > 34789 [FIN, ACK] Seq=1479 Ack=97 Win=14592 Len=0 TSval=658771339 TSecr=37614269
 14   0.060536 172.31.36.109 -> 54.192.30.194 TCP 66 34789 > http [ACK] Seq=97 Ack=1480 Win=29952 Len=0 TSval=37614269 TSecr=658771339
