[Measurement for 1kb at 06:32:49 20.32.2014] 
Tshark:

  1   0.000000 172.31.36.109 -> 172.31.0.2   DNS 88 Standard query 0xd91e  A dm53kc3eax57k.cloudfront.net
  2   0.000022 172.31.36.109 -> 172.31.0.2   DNS 88 Standard query 0x7023  AAAA dm53kc3eax57k.cloudfront.net
  3   0.000537   172.31.0.2 -> 172.31.36.109 DNS 216 Standard query response 0xd91e  A 54.192.30.184 A 54.192.30.216 A 54.192.30.218 A 54.192.30.221 A 54.230.30.7 A 54.230.30.189 A 54.230.30.245 A 54.192.30.139
  4   0.033225   172.31.0.2 -> 172.31.36.109 DNS 175 Standard query response 0x7023 
  5   0.060456 172.31.36.109 -> 54.192.30.184 TCP 74 34495 > http [SYN] Seq=0 Win=26883 Len=0 MSS=8961 SACK_PERM=1 TSval=32214014 TSecr=0 WS=128
  6   0.061787 54.192.30.184 -> 172.31.36.109 TCP 74 http > 34495 [SYN, ACK] Seq=0 Ack=1 Win=14480 Len=0 MSS=1460 SACK_PERM=1 TSval=668184497 TSecr=32214014 WS=128
  7   0.061800 172.31.36.109 -> 54.192.30.184 TCP 66 34495 > http [ACK] Seq=1 Ack=1 Win=27008 Len=0 TSval=32214015 TSecr=668184497
  8   0.061841 172.31.36.109 -> 54.192.30.184 HTTP 161 GET /1kb HTTP/1.1 
  9   0.062848 54.192.30.184 -> 172.31.36.109 TCP 66 http > 34495 [ACK] Seq=1 Ack=96 Win=14592 Len=0 TSval=668184497 TSecr=32214015
 10   0.097928 54.192.30.184 -> 172.31.36.109 HTTP 1544 HTTP/1.1 200 OK  (application/octet-stream)
 11   0.097953 172.31.36.109 -> 54.192.30.184 TCP 66 34495 > http [ACK] Seq=96 Ack=1479 Win=29952 Len=0 TSval=32214024 TSecr=668184500
 12   0.098092 172.31.36.109 -> 54.192.30.184 TCP 66 34495 > http [FIN, ACK] Seq=96 Ack=1479 Win=29952 Len=0 TSval=32214024 TSecr=668184500
 13   0.099455 54.192.30.184 -> 172.31.36.109 TCP 66 http > 34495 [FIN, ACK] Seq=1479 Ack=97 Win=14592 Len=0 TSval=668184500 TSecr=32214024
 14   0.099464 172.31.36.109 -> 54.192.30.184 TCP 66 34495 > http [ACK] Seq=97 Ack=1480 Win=29952 Len=0 TSval=32214024 TSecr=668184500
