[Measurement for 1kb at 03:32:51 20.32.2014] 
Tshark:

  1   0.000000 172.31.36.109 -> 172.31.0.2   DNS 88 Standard query 0x5ab7  A dm53kc3eax57k.cloudfront.net
  2   0.000043 172.31.36.109 -> 172.31.0.2   DNS 88 Standard query 0x565d  AAAA dm53kc3eax57k.cloudfront.net
  3   0.000634   172.31.0.2 -> 172.31.36.109 DNS 216 Standard query response 0x5ab7  A 54.230.30.222 A 54.192.30.216 A 54.192.30.222 A 54.192.30.227 A 54.230.30.73 A 54.230.30.202 A 54.230.30.213 A 54.230.30.221
  4   0.150423   172.31.0.2 -> 172.31.36.109 DNS 175 Standard query response 0x565d 
  5   0.252640 172.31.36.109 -> 54.230.30.222 TCP 74 55945 > http [SYN] Seq=0 Win=26883 Len=0 MSS=8961 SACK_PERM=1 TSval=29514579 TSecr=0 WS=128
  6   0.253823 54.230.30.222 -> 172.31.36.109 TCP 74 http > 55945 [SYN, ACK] Seq=0 Ack=1 Win=14480 Len=0 MSS=1460 SACK_PERM=1 TSval=628873811 TSecr=29514579 WS=128
  7   0.253840 172.31.36.109 -> 54.230.30.222 TCP 66 55945 > http [ACK] Seq=1 Ack=1 Win=27008 Len=0 TSval=29514579 TSecr=628873811
  8   0.253898 172.31.36.109 -> 54.230.30.222 HTTP 161 GET /1kb HTTP/1.1 
  9   0.254886 54.230.30.222 -> 172.31.36.109 TCP 66 http > 55945 [ACK] Seq=1 Ack=96 Win=14592 Len=0 TSval=628873812 TSecr=29514579
 10   0.261587 54.230.30.222 -> 172.31.36.109 HTTP 1544 HTTP/1.1 200 OK  (application/octet-stream)
 11   0.261597 172.31.36.109 -> 54.230.30.222 TCP 66 55945 > http [ACK] Seq=96 Ack=1479 Win=29952 Len=0 TSval=29514581 TSecr=628873812
 12   0.261750 172.31.36.109 -> 54.230.30.222 TCP 66 55945 > http [FIN, ACK] Seq=96 Ack=1479 Win=29952 Len=0 TSval=29514581 TSecr=628873812
 13   0.262875 54.230.30.222 -> 172.31.36.109 TCP 66 http > 55945 [FIN, ACK] Seq=1479 Ack=97 Win=14592 Len=0 TSval=628873812 TSecr=29514581
 14   0.262884 172.31.36.109 -> 54.230.30.222 TCP 66 55945 > http [ACK] Seq=97 Ack=1480 Win=29952 Len=0 TSval=29514581 TSecr=628873812
