[Measurement for 1kb at 05:32:59 20.32.2014] 
Tshark:

  1   0.000000 172.31.36.109 -> 172.31.0.2   DNS 88 Standard query 0x439f  A dm53kc3eax57k.cloudfront.net
  2   0.000022 172.31.36.109 -> 172.31.0.2   DNS 88 Standard query 0x3024  AAAA dm53kc3eax57k.cloudfront.net
  3   0.000574   172.31.0.2 -> 172.31.36.109 DNS 216 Standard query response 0x439f  A 54.230.21.237 A 54.230.23.138 A 216.137.41.122 A 216.137.41.199 A 54.230.20.118 A 54.230.20.174 A 54.230.20.182 A 54.230.21.159
  4   0.030933   172.31.0.2 -> 172.31.36.109 DNS 175 Standard query response 0x3024 
  5   0.060371 172.31.36.109 -> 54.230.21.237 TCP 74 45834 > http [SYN] Seq=0 Win=26883 Len=0 MSS=8961 SACK_PERM=1 TSval=31316438 TSecr=0 WS=128
  6   0.146326 54.230.21.237 -> 172.31.36.109 TCP 74 http > 45834 [SYN, ACK] Seq=0 Ack=1 Win=14480 Len=0 MSS=1460 SACK_PERM=1 TSval=948102528 TSecr=31316438 WS=128
  7   0.146359 172.31.36.109 -> 54.230.21.237 TCP 66 45834 > http [ACK] Seq=1 Ack=1 Win=27008 Len=0 TSval=31316460 TSecr=948102528
  8   0.146404 172.31.36.109 -> 54.230.21.237 HTTP 161 GET /1kb HTTP/1.1 
  9   0.232069 54.230.21.237 -> 172.31.36.109 TCP 66 http > 45834 [ACK] Seq=1 Ack=96 Win=14592 Len=0 TSval=948102536 TSecr=31316460
 10   0.234547 54.230.21.237 -> 172.31.36.109 HTTP 1544 HTTP/1.1 200 OK  (application/octet-stream)
 11   0.234556 172.31.36.109 -> 54.230.21.237 TCP 66 45834 > http [ACK] Seq=96 Ack=1479 Win=29952 Len=0 TSval=31316482 TSecr=948102536
 12   0.234705 172.31.36.109 -> 54.230.21.237 TCP 66 45834 > http [FIN, ACK] Seq=96 Ack=1479 Win=29952 Len=0 TSval=31316482 TSecr=948102536
 13   0.320362 54.230.21.237 -> 172.31.36.109 TCP 66 http > 45834 [FIN, ACK] Seq=1479 Ack=97 Win=14592 Len=0 TSval=948102545 TSecr=31316482
 14   0.320389 172.31.36.109 -> 54.230.21.237 TCP 66 45834 > http [ACK] Seq=97 Ack=1480 Win=29952 Len=0 TSval=31316503 TSecr=948102545
