[Measurement for 10mb at 04:39:21 20.39.2014] 
Tshark:

  1   0.000000 172.31.29.138 -> 172.31.0.2   DNS 89 Standard query 0x7c24  A d2pcb72msibvx3.cloudfront.net
  2   0.000027 172.31.29.138 -> 172.31.0.2   DNS 89 Standard query 0x9c43  AAAA d2pcb72msibvx3.cloudfront.net
  3   0.000555   172.31.0.2 -> 172.31.29.138 DNS 217 Standard query response 0x7c24  A 54.192.159.168 A 54.192.159.171 A 54.230.158.146 A 54.230.158.180 A 54.230.158.184 A 54.192.157.142 A 54.192.157.144 A 54.192.159.97
  4   0.000567   172.31.0.2 -> 172.31.29.138 DNS 169 Standard query response 0x9c43 
  5   0.003855 172.31.29.138 -> 54.192.159.168 TCP 74 51763 > http [SYN] Seq=0 Win=26883 Len=0 MSS=8961 SACK_PERM=1 TSval=10558583 TSecr=0 WS=128
  6   0.004522 54.192.159.168 -> 172.31.29.138 TCP 74 http > 51763 [SYN, ACK] Seq=0 Ack=1 Win=14480 Len=0 MSS=1460 SACK_PERM=1 TSval=730473541 TSecr=10558583 WS=128
  7   0.004537 172.31.29.138 -> 54.192.159.168 TCP 66 51763 > http [ACK] Seq=1 Ack=1 Win=27008 Len=0 TSval=10558583 TSecr=730473541
  8   0.004577 172.31.29.138 -> 54.192.159.168 HTTP 163 GET /10mb HTTP/1.1 
  9   0.004972 54.192.159.168 -> 172.31.29.138 TCP 66 http > 51763 [ACK] Seq=1 Ack=98 Win=14592 Len=0 TSval=730473541 TSecr=10558583
 10   0.009430 54.192.159.168 -> 172.31.29.138 TCP 2592 [TCP segment of a reassembled PDU]
 11   0.009439 172.31.29.138 -> 54.192.159.168 TCP 66 51763 > http [ACK] Seq=98 Ack=2527 Win=32000 Len=0 TSval=10558585 TSecr=730473541
 12   0.009455 54.192.159.168 -> 172.31.29.138 TCP 11650 [TCP segment of a reassembled PDU]
 13   0.009465 172.31.29.138 -> 54.192.159.168 TCP 66 51763 > http [ACK] Seq=98 Ack=14111 Win=55168 Len=0 TSval=10558585 TSecr=730473541
 14   0.010148 54.192.159.168 -> 172.31.29.138 TCP 10202 [TCP segment of a reassembled PDU]
 15   0.010157 172.31.29.138 -> 54.192.159.168 TCP 66 51763 > http [ACK] Seq=98 Ack=24247 Win=75392 Len=0 TSval=10558585 TSecr=730473542
 16   0.010165 54.192.159.168 -> 172.31.29.138 TCP 2962 [TCP segment of a reassembled PDU]
 17   0.010168 172.31.29.138 -> 54.192.159.168 TCP 66 51763 > http [ACK] Seq=98 Ack=27143 Win=81280 Len=0 TSval=10558585 TSecr=730473542
 18   0.010626 54.192.159.168 -> 172.31.29.138 TCP 2962 [TCP segment of a reassembled PDU]
 19   0.010632 172.31.29.138 -> 54.192.159.168 TCP 66 51763 > http [ACK] Seq=98 Ack=30039 Win=87040 Len=0 TSval=10558585 TSecr=730473542
 20   0.010708 54.192.159.168 -> 172.31.29.138 TCP 10202 [TCP segment of a reassembled PDU]
 21   0.010715 172.31.29.138 -> 54.192.159.168 TCP 66 51763 > http [ACK] Seq=98 Ack=40175 Win=101248 Len=0 TSval=10558585 TSecr=730473542
 22   0.010890 54.192.159.168 -> 172.31.29.138 TCP 7306 [TCP segment of a reassembled PDU]
 23   0.010896 172.31.29.138 -> 54.192.159.168 TCP 66 51763 > http [ACK] Seq=98 Ack=47415 Win=105984 Len=0 TSval=10558585 TSecr=730473542
 24   0.011385 54.192.159.168 -> 172.31.29.138 TCP 5858 [TCP segment of a reassembled PDU]
 25   0.011392 172.31.29.138 -> 54.192.159.168 TCP 66 51763 > http [ACK] Seq=98 Ack=53207 Win=108416 Len=0 TSval=10558585 TSecr=730473542
 26   0.011485 54.192.159.168 -> 172.31.29.138 TCP 18890 [TCP segment of a reassembled PDU]
 27   0.011497 172.31.29.138 -> 54.192.159.168 TCP 66 51763 > http [ACK] Seq=98 Ack=72031 Win=89600 Len=0 TSval=10558585 TSecr=730473542
 28   0.012161 54.192.159.168 -> 172.31.29.138 TCP 10202 [TCP segment of a reassembled PDU]
 29   0.012168 172.31.29.138 -> 54.192.159.168 TCP 66 51763 > http [ACK] Seq=98 Ack=82167 Win=101248 Len=0 TSval=10558585 TSecr=730473542
 30   0.012244 54.192.159.168 -> 172.31.29.138 TCP 11650 [TCP segment of a reassembled PDU]
 31   0.012253 172.31.29.138 -> 54.192.159.168 TCP 66 51763 > http [ACK] Seq=98 Ack=93751 Win=98944 Len=0 TSval=10558585 TSecr=730473542
 32   0.012683 54.192.159.168 -> 172.31.29.138 TCP 10202 [TCP segment of a reassembled PDU]
 33   0.012691 172.31.29.138 -> 54.192.159.168 TCP 66 51763 > http [ACK] Seq=98 Ack=103887 Win=101248 Len=0 TSval=10558585 TSecr=730473542
 34   0.012759 54.192.159.168 -> 172.31.29.138 TCP 7306 [TCP segment of a reassembled PDU]
 35   0.012766 172.31.29.138 -> 54.192.159.168 TCP 66 51763 > http [ACK] Seq=98 Ack=111127 Win=105984 Len=0 TSval=10558585 TSecr=730473542
 36   0.013029 54.192.159.168 -> 172.31.29.138 TCP 13098 [TCP segment of a reassembled PDU]
 37   0.013038 172.31.29.138 -> 54.192.159.168 TCP 66 51763 > http [ACK] Seq=98 Ack=124159 Win=96512 Len=0 TSval=10558585 TSecr=730473542
 38   0.013299 54.192.159.168 -> 172.31.29.138 TCP 11650 [TCP segment of a reassembled PDU]
 39   0.013309 172.31.29.138 -> 54.192.159.168 TCP 66 51763 > http [ACK] Seq=98 Ack=135743 Win=98944 Len=0 TSval=10558586 TSecr=730473542
 40   0.013715 54.192.159.168 -> 172.31.29.138 TCP 10202 [TCP segment of a reassembled PDU]
 41   0.013724 172.31.29.138 -> 54.192.159.168 TCP 66 51763 > http [ACK] Seq=98 Ack=145879 Win=129280 Len=0 TSval=10558586 TSecr=730473542
 42   0.013815 54.192.159.168 -> 172.31.29.138 TCP 13098 [TCP segment of a reassembled PDU]
 43   0.013824 172.31.29.138 -> 54.192.159.168 TCP 66 51763 > http [ACK] Seq=98 Ack=158911 Win=155392 Len=0 TSval=10558586 TSecr=730473542
 44   0.013987 54.192.159.168 -> 172.31.29.138 TCP 13098 [TCP segment of a reassembled PDU]
 45   0.013995 172.31.29.138 -> 54.192.159.168 TCP 66 51763 > http [ACK] Seq=98 Ack=171943 Win=181504 Len=0 TSval=10558586 TSecr=730473542
 46   0.014224 54.192.159.168 -> 172.31.29.138 TCP 5858 [TCP segment of a reassembled PDU]
 47   0.014230 172.31.29.138 -> 54.192.159.168 TCP 66 51763 > http [ACK] Seq=98 Ack=177735 Win=193024 Len=0 TSval=10558586 TSecr=730473542
 48   0.014502 54.192.159.168 -> 172.31.29.138 TCP 18708 [TCP segment of a reassembled PDU]
 49   0.014511 172.31.29.138 -> 54.192.159.168 TCP 66 51763 > http [ACK] Seq=98 Ack=196377 Win=230272 Len=0 TSval=10558586 TSecr=730473542
 50   0.014518 54.192.159.168 -> 172.31.29.138 TCP 1514 [TCP segment of a reassembled PDU]
 51   0.014521 172.31.29.138 -> 54.192.159.168 TCP 66 51763 > http [ACK] Seq=98 Ack=197825 Win=233216 Len=0 TSval=10558586 TSecr=730473542
 52   0.014827 54.192.159.168 -> 172.31.29.138 TCP 14546 [TCP segment of a reassembled PDU]
 53   0.014836 172.31.29.138 -> 54.192.159.168 TCP 66 51763 > http [ACK] Seq=98 Ack=212305 Win=262144 Len=0 TSval=10558586 TSecr=730473542
 54   0.014992 54.192.159.168 -> 172.31.29.138 TCP 14546 [TCP segment of a reassembled PDU]
 55   0.015001 172.31.29.138 -> 54.192.159.168 TCP 66 51763 > http [ACK] Seq=98 Ack=226785 Win=291200 Len=0 TSval=10558586 TSecr=730473542
 56   0.015101 54.192.159.168 -> 172.31.29.138 TCP 13098 [TCP segment of a reassembled PDU]
 57   0.015110 172.31.29.138 -> 54.192.159.168 TCP 66 51763 > http [ACK] Seq=98 Ack=239817 Win=317184 Len=0 TSval=10558586 TSecr=730473542
 58   0.015482 54.192.159.168 -> 172.31.29.138 TCP 8754 [TCP segment of a reassembled PDU]
 59   0.015488 172.31.29.138 -> 54.192.159.168 TCP 66 51763 > http [ACK] Seq=98 Ack=248505 Win=334592 Len=0 TSval=10558586 TSecr=730473542
 60   0.015621 54.192.159.168 -> 172.31.29.138 TCP 13474 [TCP segment of a reassembled PDU]
 61   0.015629 172.31.29.138 -> 54.192.159.168 TCP 66 51763 > http [ACK] Seq=98 Ack=261913 Win=361344 Len=0 TSval=10558586 TSecr=730473542
 62   0.016276 54.192.159.168 -> 172.31.29.138 TCP 4410 [TCP segment of a reassembled PDU]
 63   0.016282 172.31.29.138 -> 54.192.159.168 TCP 66 51763 > http [ACK] Seq=98 Ack=266257 Win=370048 Len=0 TSval=10558586 TSecr=730473542
 64   0.016465 54.192.159.168 -> 172.31.29.138 TCP 21786 [TCP segment of a reassembled PDU]
 65   0.016478 172.31.29.138 -> 54.192.159.168 TCP 66 51763 > http [ACK] Seq=98 Ack=287977 Win=413568 Len=0 TSval=10558586 TSecr=730473542
 66   0.016490 54.192.159.168 -> 172.31.29.138 TCP 4410 [TCP segment of a reassembled PDU]
 67   0.016494 172.31.29.138 -> 54.192.159.168 TCP 66 51763 > http [ACK] Seq=98 Ack=292321 Win=422272 Len=0 TSval=10558586 TSecr=730473542
 68   0.016558 54.192.159.168 -> 172.31.29.138 TCP 18890 [TCP segment of a reassembled PDU]
 69   0.016568 172.31.29.138 -> 54.192.159.168 TCP 66 51763 > http [ACK] Seq=98 Ack=311145 Win=459904 Len=0 TSval=10558586 TSecr=730473542
 70   0.017033 54.192.159.168 -> 172.31.29.138 TCP 10202 [TCP segment of a reassembled PDU]
 71   0.017041 172.31.29.138 -> 54.192.159.168 TCP 66 51763 > http [ACK] Seq=98 Ack=321281 Win=480128 Len=0 TSval=10558586 TSecr=730473542
 72   0.017138 54.192.159.168 -> 172.31.29.138 TCP 6234 [TCP segment of a reassembled PDU]
 73   0.017144 172.31.29.138 -> 54.192.159.168 TCP 66 51763 > http [ACK] Seq=98 Ack=327449 Win=492416 Len=0 TSval=10558586 TSecr=730473542
 74   0.017510 54.192.159.168 -> 172.31.29.138 TCP 2962 [TCP segment of a reassembled PDU]
 75   0.017515 172.31.29.138 -> 54.192.159.168 TCP 66 51763 > http [ACK] Seq=98 Ack=330345 Win=498304 Len=0 TSval=10558587 TSecr=730473542
 76   0.017594 54.192.159.168 -> 172.31.29.138 TCP 15994 [TCP segment of a reassembled PDU]
 77   0.017602 172.31.29.138 -> 54.192.159.168 TCP 66 51763 > http [ACK] Seq=98 Ack=346273 Win=530176 Len=0 TSval=10558587 TSecr=730473542
 78   0.017675 54.192.159.168 -> 172.31.29.138 TCP 11650 [TCP segment of a reassembled PDU]
 79   0.017696 172.31.29.138 -> 54.192.159.168 TCP 66 51763 > http [ACK] Seq=98 Ack=357857 Win=553344 Len=0 TSval=10558587 TSecr=730473542
 80   0.017877 54.192.159.168 -> 172.31.29.138 TCP 18890 [TCP segment of a reassembled PDU]
 81   0.017887 172.31.29.138 -> 54.192.159.168 TCP 66 51763 > http [ACK] Seq=98 Ack=376681 Win=590976 Len=0 TSval=10558587 TSecr=730473542
 82   0.018305 54.192.159.168 -> 172.31.29.138 TCP 11650 [TCP segment of a reassembled PDU]
 83   0.018327 172.31.29.138 -> 54.192.159.168 TCP 66 51763 > http [ACK] Seq=98 Ack=388265 Win=614144 Len=0 TSval=10558587 TSecr=730473542
 84   0.018453 54.192.159.168 -> 172.31.29.138 TCP 17442 [TCP segment of a reassembled PDU]
 85   0.018464 172.31.29.138 -> 54.192.159.168 TCP 66 51763 > http [ACK] Seq=98 Ack=405641 Win=648832 Len=0 TSval=10558587 TSecr=730473542
 86   0.018539 54.192.159.168 -> 172.31.29.138 TCP 4410 [TCP segment of a reassembled PDU]
 87   0.018545 172.31.29.138 -> 54.192.159.168 TCP 66 51763 > http [ACK] Seq=98 Ack=409985 Win=657536 Len=0 TSval=10558587 TSecr=730473542
 88   0.018749 54.192.159.168 -> 172.31.29.138 TCP 20714 [TCP segment of a reassembled PDU]
 89   0.018759 172.31.29.138 -> 54.192.159.168 TCP 66 51763 > http [ACK] Seq=98 Ack=430633 Win=698880 Len=0 TSval=10558587 TSecr=730473542
 90   0.019071 54.192.159.168 -> 172.31.29.138 TCP 4410 [TCP segment of a reassembled PDU]
 91   0.019077 172.31.29.138 -> 54.192.159.168 TCP 66 51763 > http [ACK] Seq=98 Ack=434977 Win=707584 Len=0 TSval=10558587 TSecr=730473542
 92   0.019242 54.192.159.168 -> 172.31.29.138 TCP 23610 [TCP segment of a reassembled PDU]
 93   0.019252 172.31.29.138 -> 54.192.159.168 TCP 66 51763 > http [ACK] Seq=98 Ack=458521 Win=754560 Len=0 TSval=10558587 TSecr=730473542
 94   0.020635 54.192.159.168 -> 172.31.29.138 TCP 17442 [TCP segment of a reassembled PDU]
 95   0.020645 172.31.29.138 -> 54.192.159.168 TCP 66 51763 > http [ACK] Seq=98 Ack=475897 Win=789376 Len=0 TSval=10558587 TSecr=730473543
 96   0.020708 54.192.159.168 -> 172.31.29.138 TCP 2962 [TCP segment of a reassembled PDU]
 97   0.020714 172.31.29.138 -> 54.192.159.168 TCP 66 51763 > http [ACK] Seq=98 Ack=478793 Win=795136 Len=0 TSval=10558587 TSecr=730473543
 98   0.020770 54.192.159.168 -> 172.31.29.138 TCP 2962 [TCP segment of a reassembled PDU]
 99   0.020775 172.31.29.138 -> 54.192.159.168 TCP 66 51763 > http [ACK] Seq=98 Ack=481689 Win=800896 Len=0 TSval=10558587 TSecr=730473543
100   0.020874 54.192.159.168 -> 172.31.29.138 TCP 26130 [TCP segment of a reassembled PDU]
101   0.020918 54.192.159.168 -> 172.31.29.138 TCP 16370 [TCP segment of a reassembled PDU]
102   0.021095 172.31.29.138 -> 54.192.159.168 TCP 66 51763 > http [ACK] Seq=98 Ack=524057 Win=758528 Len=0 TSval=10558587 TSecr=730473543
103   0.021882 54.192.159.168 -> 172.31.29.138 TCP 2962 [TCP segment of a reassembled PDU]
104   0.021888 172.31.29.138 -> 54.192.159.168 TCP 66 51763 > http [ACK] Seq=98 Ack=526953 Win=806784 Len=0 TSval=10558588 TSecr=730473543
105   0.021979 54.192.159.168 -> 172.31.29.138 TCP 13098 [TCP segment of a reassembled PDU]
106   0.021999 172.31.29.138 -> 54.192.159.168 TCP 66 51763 > http [ACK] Seq=98 Ack=539985 Win=806784 Len=0 TSval=10558588 TSecr=730473543
107   0.022021 54.192.159.168 -> 172.31.29.138 TCP 4410 [TCP segment of a reassembled PDU]
108   0.022027 172.31.29.138 -> 54.192.159.168 TCP 66 51763 > http [ACK] Seq=98 Ack=544329 Win=812800 Len=0 TSval=10558588 TSecr=730473543
109   0.022122 54.192.159.168 -> 172.31.29.138 TCP 20338 [TCP segment of a reassembled PDU]
110   0.022146 172.31.29.138 -> 54.192.159.168 TCP 66 51763 > http [ACK] Seq=98 Ack=564601 Win=792576 Len=0 TSval=10558588 TSecr=730473543
111   0.022191 54.192.159.168 -> 172.31.29.138 TCP 15994 [TCP segment of a reassembled PDU]
112   0.022200 172.31.29.138 -> 54.192.159.168 TCP 66 51763 > http [ACK] Seq=98 Ack=580529 Win=793728 Len=0 TSval=10558588 TSecr=730473543
113   0.022660 54.192.159.168 -> 172.31.29.138 TCP 4410 [TCP segment of a reassembled PDU]
114   0.022666 172.31.29.138 -> 54.192.159.168 TCP 66 51763 > http [ACK] Seq=98 Ack=584873 Win=812800 Len=0 TSval=10558588 TSecr=730473543
115   0.022784 54.192.159.168 -> 172.31.29.138 TCP 4786 [TCP segment of a reassembled PDU]
116   0.022801 172.31.29.138 -> 54.192.159.168 TCP 66 51763 > http [ACK] Seq=98 Ack=589593 Win=815488 Len=0 TSval=10558588 TSecr=730473543
117   0.022827 54.192.159.168 -> 172.31.29.138 TCP 2962 [TCP segment of a reassembled PDU]
118   0.022846 172.31.29.138 -> 54.192.159.168 TCP 66 51763 > http [ACK] Seq=98 Ack=592489 Win=815488 Len=0 TSval=10558588 TSecr=730473543
119   0.022944 54.192.159.168 -> 172.31.29.138 TCP 18890 [TCP segment of a reassembled PDU]
120   0.022968 172.31.29.138 -> 54.192.159.168 TCP 66 51763 > http [ACK] Seq=98 Ack=611313 Win=796672 Len=0 TSval=10558588 TSecr=730473543
121   0.023022 54.192.159.168 -> 172.31.29.138 TCP 21786 [TCP segment of a reassembled PDU]
122   0.023178 172.31.29.138 -> 54.192.159.168 TCP 66 51763 > http [ACK] Seq=98 Ack=633033 Win=784256 Len=0 TSval=10558588 TSecr=730473543
123   0.023526 54.192.159.168 -> 172.31.29.138 TCP 14546 [TCP segment of a reassembled PDU]
124   0.023548 172.31.29.138 -> 54.192.159.168 TCP 66 51763 > http [ACK] Seq=98 Ack=647513 Win=796032 Len=0 TSval=10558588 TSecr=730473543
125   0.023632 54.192.159.168 -> 172.31.29.138 TCP 7682 [TCP segment of a reassembled PDU]
126   0.023639 172.31.29.138 -> 54.192.159.168 TCP 66 51763 > http [ACK] Seq=98 Ack=655129 Win=805632 Len=0 TSval=10558588 TSecr=730473543
127   0.024001 54.192.159.168 -> 172.31.29.138 TCP 13098 [TCP segment of a reassembled PDU]
128   0.024021 172.31.29.138 -> 54.192.159.168 TCP 66 51763 > http [ACK] Seq=98 Ack=668161 Win=815488 Len=0 TSval=10558588 TSecr=730473543
129   0.024131 54.192.159.168 -> 172.31.29.138 TCP 14546 [TCP segment of a reassembled PDU]
130   0.024154 172.31.29.138 -> 54.192.159.168 TCP 66 51763 > http [ACK] Seq=98 Ack=682641 Win=815488 Len=0 TSval=10558588 TSecr=730473543
131   0.024195 54.192.159.168 -> 172.31.29.138 TCP 15994 [TCP segment of a reassembled PDU]
132   0.024218 172.31.29.138 -> 54.192.159.168 TCP 66 51763 > http [ACK] Seq=98 Ack=698569 Win=815488 Len=0 TSval=10558588 TSecr=730473543
133   0.024319 54.192.159.168 -> 172.31.29.138 TCP 22162 [TCP segment of a reassembled PDU]
134   0.024345 172.31.29.138 -> 54.192.159.168 TCP 66 51763 > http [ACK] Seq=98 Ack=720665 Win=793472 Len=0 TSval=10558588 TSecr=730473543
135   0.025475 54.192.159.168 -> 172.31.29.138 TCP 8754 [TCP segment of a reassembled PDU]
136   0.025483 172.31.29.138 -> 54.192.159.168 TCP 66 51763 > http [ACK] Seq=98 Ack=729353 Win=805632 Len=0 TSval=10558589 TSecr=730473543
137   0.025591 54.192.159.168 -> 172.31.29.138 TCP 13098 [TCP segment of a reassembled PDU]
138   0.025673 54.192.159.168 -> 172.31.29.138 TCP 21786 [TCP segment of a reassembled PDU]
139   0.025685 54.192.159.168 -> 172.31.29.138 TCP 1514 [TCP segment of a reassembled PDU]
140   0.025734 172.31.29.138 -> 54.192.159.168 TCP 66 51763 > http [ACK] Seq=98 Ack=765553 Win=781696 Len=0 TSval=10558589 TSecr=730473543
141   0.025835 54.192.159.168 -> 172.31.29.138 TCP 17442 [TCP segment of a reassembled PDU]
142   0.025846 172.31.29.138 -> 54.192.159.168 TCP 66 51763 > http [ACK] Seq=98 Ack=782929 Win=791296 Len=0 TSval=10558589 TSecr=730473543
143   0.025860 54.192.159.168 -> 172.31.29.138 TCP 2962 [TCP segment of a reassembled PDU]
144   0.025872 172.31.29.138 -> 54.192.159.168 TCP 66 51763 > http [ACK] Seq=98 Ack=785825 Win=788480 Len=0 TSval=10558589 TSecr=730473543
145   0.025896 54.192.159.168 -> 172.31.29.138 TCP 442 [TCP segment of a reassembled PDU]
146   0.025910 172.31.29.138 -> 54.192.159.168 TCP 66 51763 > http [ACK] Seq=98 Ack=786201 Win=815488 Len=0 TSval=10558589 TSecr=730473543
147   0.027237 54.192.159.168 -> 172.31.29.138 TCP 2962 [TCP segment of a reassembled PDU]
148   0.027253 172.31.29.138 -> 54.192.159.168 TCP 66 51763 > http [ACK] Seq=98 Ack=789097 Win=815488 Len=0 TSval=10558589 TSecr=730473543
149   0.027345 54.192.159.168 -> 172.31.29.138 TCP 20338 [TCP segment of a reassembled PDU]
150   0.027370 172.31.29.138 -> 54.192.159.168 TCP 66 51763 > http [ACK] Seq=98 Ack=809369 Win=795264 Len=0 TSval=10558589 TSecr=730473543
151   0.027413 54.192.159.168 -> 172.31.29.138 TCP 20338 [TCP segment of a reassembled PDU]
152   0.027438 172.31.29.138 -> 54.192.159.168 TCP 66 51763 > http [ACK] Seq=98 Ack=829641 Win=786560 Len=0 TSval=10558589 TSecr=730473543
153   0.027566 54.192.159.168 -> 172.31.29.138 TCP 2962 [TCP segment of a reassembled PDU]
154   0.027571 172.31.29.138 -> 54.192.159.168 TCP 66 51763 > http [ACK] Seq=98 Ack=832537 Win=815104 Len=0 TSval=10558589 TSecr=730473543
155   0.027667 54.192.159.168 -> 172.31.29.138 TCP 19266 [TCP segment of a reassembled PDU]
156   0.027692 172.31.29.138 -> 54.192.159.168 TCP 66 51763 > http [ACK] Seq=98 Ack=851737 Win=795904 Len=0 TSval=10558589 TSecr=730473543
157   0.029037 54.192.159.168 -> 172.31.29.138 TCP 2962 [TCP segment of a reassembled PDU]
158   0.029043 172.31.29.138 -> 54.192.159.168 TCP 66 51763 > http [ACK] Seq=98 Ack=854633 Win=815104 Len=0 TSval=10558589 TSecr=730473543
159   0.029157 54.192.159.168 -> 172.31.29.138 TCP 20338 [TCP segment of a reassembled PDU]
160   0.029182 172.31.29.138 -> 54.192.159.168 TCP 66 51763 > http [ACK] Seq=98 Ack=874905 Win=794880 Len=0 TSval=10558590 TSecr=730473543
161   0.029219 54.192.159.168 -> 172.31.29.138 TCP 10202 [TCP segment of a reassembled PDU]
162   0.029226 172.31.29.138 -> 54.192.159.168 TCP 66 51763 > http [ACK] Seq=98 Ack=885041 Win=803328 Len=0 TSval=10558590 TSecr=730473543
163   0.029264 54.192.159.168 -> 172.31.29.138 TCP 2962 [TCP Previous segment not captured] [TCP segment of a reassembled PDU]
164   0.029269 172.31.29.138 -> 54.192.159.168 TCP 78 [TCP Window Update] 51763 > http [ACK] Seq=98 Ack=885041 Win=815104 Len=0 TSval=10558590 TSecr=730473543 SLE=886489 SRE=889385
165   0.029294 54.192.159.168 -> 172.31.29.138 TCP 1514 [TCP Out-Of-Order] [TCP segment of a reassembled PDU]
166   0.029299 172.31.29.138 -> 54.192.159.168 TCP 66 51763 > http [ACK] Seq=98 Ack=889385 Win=812672 Len=0 TSval=10558590 TSecr=730473543
167   0.029360 54.192.159.168 -> 172.31.29.138 TCP 8754 [TCP segment of a reassembled PDU]
168   0.029367 172.31.29.138 -> 54.192.159.168 TCP 66 51763 > http [ACK] Seq=98 Ack=898073 Win=805632 Len=0 TSval=10558590 TSecr=730473543
169   0.029614 54.192.159.168 -> 172.31.29.138 TCP 14546 [TCP segment of a reassembled PDU]
170   0.029623 172.31.29.138 -> 54.192.159.168 TCP 66 51763 > http [ACK] Seq=98 Ack=912553 Win=796032 Len=0 TSval=10558590 TSecr=730473543
171   0.029704 54.192.159.168 -> 172.31.29.138 TCP 4786 [TCP segment of a reassembled PDU]
172   0.029710 172.31.29.138 -> 54.192.159.168 TCP 66 51763 > http [ACK] Seq=98 Ack=917273 Win=810368 Len=0 TSval=10558590 TSecr=730473543
173   0.032706 54.192.159.168 -> 172.31.29.138 TCP 2962 [TCP segment of a reassembled PDU]
174   0.032711 172.31.29.138 -> 54.192.159.168 TCP 66 51763 > http [ACK] Seq=98 Ack=920169 Win=815104 Len=0 TSval=10558590 TSecr=730473544
175   0.032826 54.192.159.168 -> 172.31.29.138 TCP 21786 [TCP segment of a reassembled PDU]
176   0.032839 172.31.29.138 -> 54.192.159.168 TCP 66 51763 > http [ACK] Seq=98 Ack=941889 Win=793472 Len=0 TSval=10558590 TSecr=730473544
177   0.032844 54.192.159.168 -> 172.31.29.138 TCP 138 [TCP segment of a reassembled PDU]
178   0.032846 172.31.29.138 -> 54.192.159.168 TCP 66 51763 > http [ACK] Seq=98 Ack=941961 Win=793472 Len=0 TSval=10558590 TSecr=730473544
179   0.033490 54.192.159.168 -> 172.31.29.138 TCP 15994 [TCP segment of a reassembled PDU]
180   0.033500 172.31.29.138 -> 54.192.159.168 TCP 66 51763 > http [ACK] Seq=98 Ack=957889 Win=793728 Len=0 TSval=10558591 TSecr=730473544
181   0.033628 54.192.159.168 -> 172.31.29.138 TCP 20338 [TCP segment of a reassembled PDU]
182   0.033639 172.31.29.138 -> 54.192.159.168 TCP 66 51763 > http [ACK] Seq=98 Ack=978161 Win=786560 Len=0 TSval=10558591 TSecr=730473544
183   0.034181 54.192.159.168 -> 172.31.29.138 TCP 2962 [TCP segment of a reassembled PDU]
184   0.034187 172.31.29.138 -> 54.192.159.168 TCP 66 51763 > http [ACK] Seq=98 Ack=981057 Win=815104 Len=0 TSval=10558591 TSecr=730473544
185   0.034324 54.192.159.168 -> 172.31.29.138 TCP 26130 [TCP segment of a reassembled PDU]
186   0.034338 172.31.29.138 -> 54.192.159.168 TCP 66 51763 > http [ACK] Seq=98 Ack=1007121 Win=789120 Len=0 TSval=10558591 TSecr=730473544
187   0.034376 54.192.159.168 -> 172.31.29.138 TCP 13098 [TCP segment of a reassembled PDU]
188   0.034383 172.31.29.138 -> 54.192.159.168 TCP 66 51763 > http [ACK] Seq=98 Ack=1020153 Win=776192 Len=0 TSval=10558591 TSecr=730473544
189   0.034975 54.192.159.168 -> 172.31.29.138 TCP 8754 [TCP segment of a reassembled PDU]
190   0.034982 172.31.29.138 -> 54.192.159.168 TCP 66 51763 > http [ACK] Seq=98 Ack=1028841 Win=805632 Len=0 TSval=10558591 TSecr=730473544
191   0.035139 54.192.159.168 -> 172.31.29.138 TCP 21018 [TCP segment of a reassembled PDU]
192   0.035149 172.31.29.138 -> 54.192.159.168 TCP 66 51763 > http [ACK] Seq=98 Ack=1049793 Win=784768 Len=0 TSval=10558591 TSecr=730473544
193   0.035208 54.192.159.168 -> 172.31.29.138 TCP 15994 [TCP segment of a reassembled PDU]
194   0.035216 172.31.29.138 -> 54.192.159.168 TCP 66 51763 > http [ACK] Seq=98 Ack=1065721 Win=793728 Len=0 TSval=10558591 TSecr=730473544
195   0.035728 54.192.159.168 -> 172.31.29.138 TCP 11650 [TCP segment of a reassembled PDU]
196   0.035736 172.31.29.138 -> 54.192.159.168 TCP 66 51763 > http [ACK] Seq=98 Ack=1077305 Win=800896 Len=0 TSval=10558591 TSecr=730473544
197   0.035917 54.192.159.168 -> 172.31.29.138 TCP 26130 [TCP segment of a reassembled PDU]
198   0.035937 54.192.159.168 -> 172.31.29.138 TCP 10578 [TCP segment of a reassembled PDU]
199   0.035956 172.31.29.138 -> 54.192.159.168 TCP 66 51763 > http [ACK] Seq=98 Ack=1113881 Win=764416 Len=0 TSval=10558591 TSecr=730473544
200   0.037008 54.192.159.168 -> 172.31.29.138 TCP 11650 [TCP segment of a reassembled PDU]
201   0.037017 172.31.29.138 -> 54.192.159.168 TCP 66 51763 > http [ACK] Seq=98 Ack=1125465 Win=800896 Len=0 TSval=10558591 TSecr=730473544
202   0.037130 54.192.159.168 -> 172.31.29.138 TCP 13098 [TCP segment of a reassembled PDU]
203   0.037152 172.31.29.138 -> 54.192.159.168 TCP 66 51763 > http [ACK] Seq=98 Ack=1138497 Win=819328 Len=0 TSval=10558591 TSecr=730473544
204   0.037282 54.192.159.168 -> 172.31.29.138 TCP 18890 [TCP segment of a reassembled PDU]
205   0.037304 172.31.29.138 -> 54.192.159.168 TCP 66 51763 > http [ACK] Seq=98 Ack=1157321 Win=800512 Len=0 TSval=10558592 TSecr=730473544
206   0.037388 54.192.159.168 -> 172.31.29.138 TCP 5858 [TCP segment of a reassembled PDU]
207   0.037395 172.31.29.138 -> 54.192.159.168 TCP 66 51763 > http [ACK] Seq=98 Ack=1163113 Win=810368 Len=0 TSval=10558592 TSecr=730473544
208   0.037778 54.192.159.168 -> 172.31.29.138 TCP 13098 [TCP segment of a reassembled PDU]
209   0.037798 172.31.29.138 -> 54.192.159.168 TCP 66 51763 > http [ACK] Seq=98 Ack=1176145 Win=819328 Len=0 TSval=10558592 TSecr=730473544
210   0.037877 54.192.159.168 -> 172.31.29.138 TCP 3338 [TCP segment of a reassembled PDU]
211   0.037893 172.31.29.138 -> 54.192.159.168 TCP 66 51763 > http [ACK] Seq=98 Ack=1179417 Win=819328 Len=0 TSval=10558592 TSecr=730473544
212   0.038511 54.192.159.168 -> 172.31.29.138 TCP 1514 [TCP segment of a reassembled PDU]
213   0.038803 54.192.159.168 -> 172.31.29.138 TCP 7306 [TCP segment of a reassembled PDU]
214   0.038821 172.31.29.138 -> 54.192.159.168 TCP 66 51763 > http [ACK] Seq=98 Ack=1188105 Win=819328 Len=0 TSval=10558592 TSecr=730473544
215   0.038933 54.192.159.168 -> 172.31.29.138 TCP 17442 [TCP segment of a reassembled PDU]
216   0.038956 172.31.29.138 -> 54.192.159.168 TCP 66 51763 > http [ACK] Seq=98 Ack=1205481 Win=802048 Len=0 TSval=10558592 TSecr=730473544
217   0.039033 54.192.159.168 -> 172.31.29.138 TCP 26130 [TCP segment of a reassembled PDU]
218   0.039181 172.31.29.138 -> 54.192.159.168 TCP 66 51763 > http [ACK] Seq=98 Ack=1231545 Win=777088 Len=0 TSval=10558592 TSecr=730473544
219   0.039557 54.192.159.168 -> 172.31.29.138 TCP 5858 [TCP segment of a reassembled PDU]
220   0.039564 172.31.29.138 -> 54.192.159.168 TCP 66 51763 > http [ACK] Seq=98 Ack=1237337 Win=810368 Len=0 TSval=10558592 TSecr=730473544
221   0.039686 54.192.159.168 -> 172.31.29.138 TCP 7682 [TCP segment of a reassembled PDU]
222   0.039705 172.31.29.138 -> 54.192.159.168 TCP 66 51763 > http [ACK] Seq=98 Ack=1244953 Win=819328 Len=0 TSval=10558592 TSecr=730473544
223   0.040316 54.192.159.168 -> 172.31.29.138 TCP 2962 [TCP segment of a reassembled PDU]
224   0.040331 172.31.29.138 -> 54.192.159.168 TCP 66 51763 > http [ACK] Seq=98 Ack=1247849 Win=819328 Len=0 TSval=10558592 TSecr=730473545
225   0.040446 54.192.159.168 -> 172.31.29.138 TCP 23234 [TCP segment of a reassembled PDU]
226   0.040460 54.192.159.168 -> 172.31.29.138 TCP 2962 [TCP segment of a reassembled PDU]
227   0.040475 172.31.29.138 -> 54.192.159.168 TCP 66 51763 > http [ACK] Seq=98 Ack=1273913 Win=793344 Len=0 TSval=10558592 TSecr=730473545
228   0.040672 54.192.159.168 -> 172.31.29.138 TCP 18890 [TCP segment of a reassembled PDU]
229   0.040699 54.192.159.168 -> 172.31.29.138 TCP 4410 [TCP segment of a reassembled PDU]
230   0.040703 172.31.29.138 -> 54.192.159.168 TCP 66 51763 > http [ACK] Seq=98 Ack=1292737 Win=788992 Len=0 TSval=10558592 TSecr=730473545
231   0.040716 172.31.29.138 -> 54.192.159.168 TCP 66 51763 > http [ACK] Seq=98 Ack=1297081 Win=819328 Len=0 TSval=10558592 TSecr=730473545
232   0.041180 54.192.159.168 -> 172.31.29.138 TCP 2962 [TCP segment of a reassembled PDU]
233   0.041210 172.31.29.138 -> 54.192.159.168 TCP 66 51763 > http [ACK] Seq=98 Ack=1299977 Win=819328 Len=0 TSval=10558593 TSecr=730473545
234   0.041256 54.192.159.168 -> 172.31.29.138 TCP 10578 [TCP segment of a reassembled PDU]
235   0.041280 172.31.29.138 -> 54.192.159.168 TCP 66 51763 > http [ACK] Seq=98 Ack=1310489 Win=819328 Len=0 TSval=10558593 TSecr=730473545
236   0.042364 54.192.159.168 -> 172.31.29.138 TCP 1514 [TCP segment of a reassembled PDU]
237   0.042630 54.192.159.168 -> 172.31.29.138 TCP 5858 [TCP segment of a reassembled PDU]
238   0.042769 54.192.159.168 -> 172.31.29.138 TCP 18890 [TCP segment of a reassembled PDU]
239   0.042851 54.192.159.168 -> 172.31.29.138 TCP 17442 [TCP segment of a reassembled PDU]
240   0.042891 54.192.159.168 -> 172.31.29.138 TCP 8754 [TCP segment of a reassembled PDU]
241   0.042923 172.31.29.138 -> 54.192.159.168 TCP 66 51763 > http [ACK] Seq=98 Ack=1362617 Win=767232 Len=0 TSval=10558593 TSecr=730473545
242   0.043433 54.192.159.168 -> 172.31.29.138 TCP 4410 [TCP segment of a reassembled PDU]
243   0.043440 172.31.29.138 -> 54.192.159.168 TCP 66 51763 > http [ACK] Seq=98 Ack=1366961 Win=812800 Len=0 TSval=10558593 TSecr=730473545
244   0.043557 54.192.159.168 -> 172.31.29.138 TCP 12026 [TCP segment of a reassembled PDU]
245   0.043588 172.31.29.138 -> 54.192.159.168 TCP 66 51763 > http [ACK] Seq=98 Ack=1378921 Win=819328 Len=0 TSval=10558593 TSecr=730473545
246   0.043662 54.192.159.168 -> 172.31.29.138 TCP 23234 [TCP segment of a reassembled PDU]
247   0.043692 172.31.29.138 -> 54.192.159.168 TCP 66 51763 > http [ACK] Seq=98 Ack=1402089 Win=796160 Len=0 TSval=10558593 TSecr=730473545
248   0.044701 54.192.159.168 -> 172.31.29.138 TCP 13098 [TCP segment of a reassembled PDU]
249   0.044711 172.31.29.138 -> 54.192.159.168 TCP 66 51763 > http [ACK] Seq=98 Ack=1415121 Win=798592 Len=0 TSval=10558593 TSecr=730473545
250   0.044863 54.192.159.168 -> 172.31.29.138 TCP 26130 [TCP segment of a reassembled PDU]
251   0.044889 172.31.29.138 -> 54.192.159.168 TCP 66 51763 > http [ACK] Seq=98 Ack=1441185 Win=777088 Len=0 TSval=10558593 TSecr=730473545
252   0.044944 54.192.159.168 -> 172.31.29.138 TCP 23234 [TCP segment of a reassembled PDU]
253   0.044956 172.31.29.138 -> 54.192.159.168 TCP 66 51763 > http [ACK] Seq=98 Ack=1464353 Win=781824 Len=0 TSval=10558593 TSecr=730473545
254   0.044977 54.192.159.168 -> 172.31.29.138 TCP 2962 [TCP segment of a reassembled PDU]
255   0.045103 172.31.29.138 -> 54.192.159.168 TCP 66 51763 > http [ACK] Seq=98 Ack=1467249 Win=779008 Len=0 TSval=10558593 TSecr=730473545
256   0.045451 54.192.159.168 -> 172.31.29.138 TCP 4410 [TCP segment of a reassembled PDU]
257   0.045457 172.31.29.138 -> 54.192.159.168 TCP 66 51763 > http [ACK] Seq=98 Ack=1471593 Win=812800 Len=0 TSval=10558594 TSecr=730473545
258   0.045718 54.192.159.168 -> 172.31.29.138 TCP 13098 [TCP segment of a reassembled PDU]
259   0.045740 172.31.29.138 -> 54.192.159.168 TCP 66 51763 > http [ACK] Seq=98 Ack=1484625 Win=819328 Len=0 TSval=10558594 TSecr=730473545
260   0.045871 54.192.159.168 -> 172.31.29.138 TCP 22538 [TCP segment of a reassembled PDU]
261   0.045898 172.31.29.138 -> 54.192.159.168 TCP 66 51763 > http [ACK] Seq=98 Ack=1507097 Win=796928 Len=0 TSval=10558594 TSecr=730473545
262   0.046216 54.192.159.168 -> 172.31.29.138 TCP 5858 [TCP segment of a reassembled PDU]
263   0.046222 172.31.29.138 -> 54.192.159.168 TCP 66 51763 > http [ACK] Seq=98 Ack=1512889 Win=810368 Len=0 TSval=10558594 TSecr=730473545
264   0.046400 54.192.159.168 -> 172.31.29.138 TCP 27578 [TCP segment of a reassembled PDU]
265   0.046426 172.31.29.138 -> 54.192.159.168 TCP 66 51763 > http [ACK] Seq=98 Ack=1540401 Win=782976 Len=0 TSval=10558594 TSecr=730473545
266   0.046660 54.192.159.168 -> 172.31.29.138 TCP 26130 [TCP segment of a reassembled PDU]
267   0.046680 54.192.159.168 -> 172.31.29.138 TCP 8754 [TCP segment of a reassembled PDU]
268   0.046687 54.192.159.168 -> 172.31.29.138 TCP 4410 [TCP segment of a reassembled PDU]
269   0.046703 172.31.29.138 -> 54.192.159.168 TCP 66 51763 > http [ACK] Seq=98 Ack=1579497 Win=755712 Len=0 TSval=10558594 TSecr=730473545
270   0.047253 54.192.159.168 -> 172.31.29.138 TCP 4410 [TCP segment of a reassembled PDU]
271   0.047259 172.31.29.138 -> 54.192.159.168 TCP 66 51763 > http [ACK] Seq=98 Ack=1583841 Win=812800 Len=0 TSval=10558594 TSecr=730473545
272   0.047448 54.192.159.168 -> 172.31.29.138 TCP 26130 [TCP segment of a reassembled PDU]
273   0.047475 172.31.29.138 -> 54.192.159.168 TCP 66 51763 > http [ACK] Seq=98 Ack=1609905 Win=786816 Len=0 TSval=10558594 TSecr=730473545
274   0.047520 54.192.159.168 -> 172.31.29.138 TCP 18890 [TCP segment of a reassembled PDU]
275   0.047531 172.31.29.138 -> 54.192.159.168 TCP 66 51763 > http [ACK] Seq=98 Ack=1628729 Win=788992 Len=0 TSval=10558594 TSecr=730473545
276   0.047567 54.192.159.168 -> 172.31.29.138 TCP 7306 [TCP segment of a reassembled PDU]
277   0.047573 172.31.29.138 -> 54.192.159.168 TCP 66 51763 > http [ACK] Seq=98 Ack=1635969 Win=808064 Len=0 TSval=10558594 TSecr=730473545
278   0.047657 54.192.159.168 -> 172.31.29.138 TCP 20338 [TCP segment of a reassembled PDU]
279   0.047680 172.31.29.138 -> 54.192.159.168 TCP 66 51763 > http [ACK] Seq=98 Ack=1656241 Win=787840 Len=0 TSval=10558594 TSecr=730473545
280   0.048026 54.192.159.168 -> 172.31.29.138 TCP 2962 [TCP segment of a reassembled PDU]
281   0.048031 172.31.29.138 -> 54.192.159.168 TCP 66 51763 > http [ACK] Seq=98 Ack=1659137 Win=815104 Len=0 TSval=10558594 TSecr=730473545
282   0.048246 54.192.159.168 -> 172.31.29.138 TCP 29026 [TCP segment of a reassembled PDU]
283   0.048262 54.192.159.168 -> 172.31.29.138 TCP 1514 [TCP segment of a reassembled PDU]
284   0.048277 172.31.29.138 -> 54.192.159.168 TCP 66 51763 > http [ACK] Seq=98 Ack=1689545 Win=784768 Len=0 TSval=10558594 TSecr=730473545
285   0.048335 54.192.159.168 -> 172.31.29.138 TCP 14226 [TCP segment of a reassembled PDU]
286   0.048344 172.31.29.138 -> 54.192.159.168 TCP 66 51763 > http [ACK] Seq=98 Ack=1703705 Win=796032 Len=0 TSval=10558594 TSecr=730473545
287   0.048775 54.192.159.168 -> 172.31.29.138 TCP 10202 [TCP segment of a reassembled PDU]
288   0.048784 172.31.29.138 -> 54.192.159.168 TCP 66 51763 > http [ACK] Seq=98 Ack=1713841 Win=803328 Len=0 TSval=10558594 TSecr=730473545
289   0.048920 54.192.159.168 -> 172.31.29.138 TCP 18890 [TCP segment of a reassembled PDU]
290   0.048945 172.31.29.138 -> 54.192.159.168 TCP 66 51763 > http [ACK] Seq=98 Ack=1732665 Win=788992 Len=0 TSval=10558594 TSecr=730473545
291   0.049026 54.192.159.168 -> 172.31.29.138 TCP 2962 [TCP segment of a reassembled PDU]
292   0.049032 172.31.29.138 -> 54.192.159.168 TCP 66 51763 > http [ACK] Seq=98 Ack=1735561 Win=815104 Len=0 TSval=10558594 TSecr=730473545
293   0.049200 54.192.159.168 -> 172.31.29.138 TCP 26130 [TCP segment of a reassembled PDU]
294   0.049231 54.192.159.168 -> 172.31.29.138 TCP 7682 [TCP segment of a reassembled PDU]
295   0.049251 172.31.29.138 -> 54.192.159.168 TCP 66 51763 > http [ACK] Seq=98 Ack=1769241 Win=819328 Len=0 TSval=10558595 TSecr=730473545
296   0.051064 54.192.159.168 -> 172.31.29.138 TCP 2962 [TCP segment of a reassembled PDU]
297   0.051069 172.31.29.138 -> 54.192.159.168 TCP 66 51763 > http [ACK] Seq=98 Ack=1772137 Win=825088 Len=0 TSval=10558595 TSecr=730473546
298   0.051171 54.192.159.168 -> 172.31.29.138 TCP 10202 [TCP segment of a reassembled PDU]
299   0.051179 172.31.29.138 -> 54.192.159.168 TCP 66 51763 > http [ACK] Seq=98 Ack=1782273 Win=845312 Len=0 TSval=10558595 TSecr=730473546
300   0.051228 54.192.159.168 -> 172.31.29.138 TCP 15994 [TCP segment of a reassembled PDU]
301   0.051237 172.31.29.138 -> 54.192.159.168 TCP 66 51763 > http [ACK] Seq=98 Ack=1798201 Win=877184 Len=0 TSval=10558595 TSecr=730473546
302   0.051302 54.192.159.168 -> 172.31.29.138 TCP 2962 [TCP segment of a reassembled PDU]
303   0.051307 172.31.29.138 -> 54.192.159.168 TCP 66 51763 > http [ACK] Seq=98 Ack=1801097 Win=882944 Len=0 TSval=10558595 TSecr=730473546
304   0.051523 54.192.159.168 -> 172.31.29.138 TCP 26130 [TCP segment of a reassembled PDU]
305   0.051537 172.31.29.138 -> 54.192.159.168 TCP 66 51763 > http [ACK] Seq=98 Ack=1827161 Win=935168 Len=0 TSval=10558595 TSecr=730473546
306   0.051546 54.192.159.168 -> 172.31.29.138 TCP 7682 [TCP segment of a reassembled PDU]
307   0.051551 172.31.29.138 -> 54.192.159.168 TCP 66 51763 > http [ACK] Seq=98 Ack=1834777 Win=950400 Len=0 TSval=10558595 TSecr=730473546
308   0.053522 54.192.159.168 -> 172.31.29.138 TCP 24682 [TCP segment of a reassembled PDU]
309   0.053536 172.31.29.138 -> 54.192.159.168 TCP 66 51763 > http [ACK] Seq=98 Ack=1859393 Win=999552 Len=0 TSval=10558596 TSecr=730473546
310   0.053561 54.192.159.168 -> 172.31.29.138 TCP 4410 [TCP segment of a reassembled PDU]
311   0.053567 172.31.29.138 -> 54.192.159.168 TCP 66 51763 > http [ACK] Seq=98 Ack=1863737 Win=1006592 Len=0 TSval=10558596 TSecr=730473546
312   0.053696 54.192.159.168 -> 172.31.29.138 TCP 17442 [TCP segment of a reassembled PDU]
313   0.053705 172.31.29.138 -> 54.192.159.168 TCP 66 51763 > http [ACK] Seq=98 Ack=1881113 Win=1025664 Len=0 TSval=10558596 TSecr=730473546
314   0.053725 54.192.159.168 -> 172.31.29.138 TCP 14546 [TCP segment of a reassembled PDU]
315   0.053735 54.192.159.168 -> 172.31.29.138 TCP 1514 [TCP segment of a reassembled PDU]
316   0.053751 172.31.29.138 -> 54.192.159.168 TCP 66 51763 > http [ACK] Seq=98 Ack=1897041 Win=1009792 Len=0 TSval=10558596 TSecr=730473546
317   0.053783 54.192.159.168 -> 172.31.29.138 TCP 3338 [TCP segment of a reassembled PDU]
318   0.053789 172.31.29.138 -> 54.192.159.168 TCP 66 51763 > http [ACK] Seq=98 Ack=1900313 Win=1043072 Len=0 TSval=10558596 TSecr=730473546
319   0.055668 54.192.159.168 -> 172.31.29.138 TCP 2962 [TCP segment of a reassembled PDU]
320   0.055673 172.31.29.138 -> 54.192.159.168 TCP 66 51763 > http [ACK] Seq=98 Ack=1903209 Win=1048832 Len=0 TSval=10558596 TSecr=730473546
321   0.055806 54.192.159.168 -> 172.31.29.138 TCP 27578 [TCP segment of a reassembled PDU]
322   0.055833 54.192.159.168 -> 172.31.29.138 TCP 2962 [TCP segment of a reassembled PDU]
323   0.055845 172.31.29.138 -> 54.192.159.168 TCP 66 51763 > http [ACK] Seq=98 Ack=1933617 Win=1018496 Len=0 TSval=10558596 TSecr=730473546
324   0.055973 54.192.159.168 -> 172.31.29.138 TCP 26130 [TCP segment of a reassembled PDU]
325   0.055987 54.192.159.168 -> 172.31.29.138 TCP 1514 [TCP segment of a reassembled PDU]
326   0.055991 54.192.159.168 -> 172.31.29.138 TCP 4786 [TCP segment of a reassembled PDU]
327   0.056082 172.31.29.138 -> 54.192.159.168 TCP 66 51763 > http [ACK] Seq=98 Ack=1965849 Win=999424 Len=0 TSval=10558596 TSecr=730473546
328   0.058039 54.192.159.168 -> 172.31.29.138 TCP 11650 [TCP segment of a reassembled PDU]
329   0.058049 172.31.29.138 -> 54.192.159.168 TCP 66 51763 > http [ACK] Seq=98 Ack=1977433 Win=1035264 Len=0 TSval=10558597 TSecr=730473546
330   0.058178 54.192.159.168 -> 172.31.29.138 TCP 26130 [TCP segment of a reassembled PDU]
331   0.058230 54.192.159.168 -> 172.31.29.138 TCP 18890 [TCP segment of a reassembled PDU]
332   0.058245 54.192.159.168 -> 172.31.29.138 TCP 5858 [TCP segment of a reassembled PDU]
333   0.058256 172.31.29.138 -> 54.192.159.168 TCP 66 51763 > http [ACK] Seq=98 Ack=2028113 Win=984704 Len=0 TSval=10558597 TSecr=730473546
334   0.058288 54.192.159.168 -> 172.31.29.138 TCP 3338 [TCP segment of a reassembled PDU]
335   0.058293 172.31.29.138 -> 54.192.159.168 TCP 66 51763 > http [ACK] Seq=98 Ack=2031385 Win=1047040 Len=0 TSval=10558597 TSecr=730473546
336   0.058606 54.192.159.168 -> 172.31.29.138 TCP 2962 [TCP segment of a reassembled PDU]
337   0.058611 172.31.29.138 -> 54.192.159.168 TCP 66 51763 > http [ACK] Seq=98 Ack=2034281 Win=1049472 Len=0 TSval=10558597 TSecr=730473546
338   0.058732 54.192.159.168 -> 172.31.29.138 TCP 27578 [TCP segment of a reassembled PDU]
339   0.058836 172.31.29.138 -> 54.192.159.168 TCP 66 51763 > http [ACK] Seq=98 Ack=2061793 Win=1022080 Len=0 TSval=10558597 TSecr=730473546
340   0.058992 54.192.159.168 -> 172.31.29.138 TCP 27578 [TCP segment of a reassembled PDU]
341   0.059023 172.31.29.138 -> 54.192.159.168 TCP 66 51763 > http [ACK] Seq=98 Ack=2089305 Win=1008896 Len=0 TSval=10558597 TSecr=730473546
342   0.059035 54.192.159.168 -> 172.31.29.138 TCP 2962 [TCP segment of a reassembled PDU]
343   0.059050 172.31.29.138 -> 54.192.159.168 TCP 66 51763 > http [ACK] Seq=98 Ack=2092201 Win=1054336 Len=0 TSval=10558597 TSecr=730473546
344   0.059093 54.192.159.168 -> 172.31.29.138 TCP 4786 [TCP segment of a reassembled PDU]
345   0.059111 172.31.29.138 -> 54.192.159.168 TCP 66 51763 > http [ACK] Seq=98 Ack=2096921 Win=1054336 Len=0 TSval=10558597 TSecr=730473546
346   0.059518 54.192.159.168 -> 172.31.29.138 TCP 1514 [TCP segment of a reassembled PDU]
347   0.059600 54.192.159.168 -> 172.31.29.138 TCP 15994 [TCP segment of a reassembled PDU]
348   0.059622 172.31.29.138 -> 54.192.159.168 TCP 66 51763 > http [ACK] Seq=98 Ack=2114297 Win=1054336 Len=0 TSval=10558597 TSecr=730473546
