[Measurement for 10mb at 08:39:21 20.39.2014] 
Tshark:

  1   0.000000 172.31.29.138 -> 172.31.0.2   DNS 89 Standard query 0xabeb  A d2pcb72msibvx3.cloudfront.net
  2   0.000028 172.31.29.138 -> 172.31.0.2   DNS 89 Standard query 0x5ac7  AAAA d2pcb72msibvx3.cloudfront.net
  3   0.000630   172.31.0.2 -> 172.31.29.138 DNS 217 Standard query response 0xabeb  A 54.230.149.215 A 54.230.149.229 A 54.230.150.12 A 54.230.150.40 A 54.230.150.54 A 54.230.150.69 A 54.230.150.109 A 54.230.151.251
  4   0.000640   172.31.0.2 -> 172.31.29.138 DNS 169 Standard query response 0x5ac7 
  5   0.003826 172.31.29.138 -> 54.230.149.215 TCP 74 34575 > http [SYN] Seq=0 Win=26883 Len=0 MSS=8961 SACK_PERM=1 TSval=14158500 TSecr=0 WS=128
  6   0.005287 54.230.149.215 -> 172.31.29.138 TCP 74 http > 34575 [SYN, ACK] Seq=0 Ack=1 Win=14480 Len=0 MSS=1460 SACK_PERM=1 TSval=1455160269 TSecr=14158500 WS=128
  7   0.005301 172.31.29.138 -> 54.230.149.215 TCP 66 34575 > http [ACK] Seq=1 Ack=1 Win=27008 Len=0 TSval=14158501 TSecr=1455160269
  8   0.005350 172.31.29.138 -> 54.230.149.215 HTTP 163 GET /10mb HTTP/1.1 
  9   0.006731 54.230.149.215 -> 172.31.29.138 TCP 66 http > 34575 [ACK] Seq=1 Ack=98 Win=14592 Len=0 TSval=1455160269 TSecr=14158501
 10   0.009077 54.230.149.215 -> 172.31.29.138 TCP 2592 [TCP segment of a reassembled PDU]
 11   0.009086 172.31.29.138 -> 54.230.149.215 TCP 66 34575 > http [ACK] Seq=98 Ack=2527 Win=32000 Len=0 TSval=14158502 TSecr=1455160270
 12   0.009313 54.230.149.215 -> 172.31.29.138 TCP 11650 [TCP segment of a reassembled PDU]
 13   0.009324 172.31.29.138 -> 54.230.149.215 TCP 66 34575 > http [ACK] Seq=98 Ack=14111 Win=55168 Len=0 TSval=14158502 TSecr=1455160270
 14   0.010634 54.230.149.215 -> 172.31.29.138 TCP 13098 [TCP segment of a reassembled PDU]
 15   0.010643 172.31.29.138 -> 54.230.149.215 TCP 66 34575 > http [ACK] Seq=98 Ack=27143 Win=81280 Len=0 TSval=14158502 TSecr=1455160270
 16   0.012111 54.230.149.215 -> 172.31.29.138 TCP 2962 [TCP segment of a reassembled PDU]
 17   0.012117 172.31.29.138 -> 54.230.149.215 TCP 66 34575 > http [ACK] Seq=98 Ack=30039 Win=87040 Len=0 TSval=14158503 TSecr=1455160270
 18   0.012197 54.230.149.215 -> 172.31.29.138 TCP 10202 [TCP segment of a reassembled PDU]
 19   0.012205 172.31.29.138 -> 54.230.149.215 TCP 66 34575 > http [ACK] Seq=98 Ack=40175 Win=107264 Len=0 TSval=14158503 TSecr=1455160270
 20   0.013492 54.230.149.215 -> 172.31.29.138 TCP 1514 [TCP segment of a reassembled PDU]
 21   0.013496 172.31.29.138 -> 54.230.149.215 TCP 66 34575 > http [ACK] Seq=98 Ack=41623 Win=110208 Len=0 TSval=14158503 TSecr=1455160270
 22   0.013568 54.230.149.215 -> 172.31.29.138 TCP 8754 [TCP segment of a reassembled PDU]
 23   0.013575 172.31.29.138 -> 54.230.149.215 TCP 66 34575 > http [ACK] Seq=98 Ack=50311 Win=127616 Len=0 TSval=14158503 TSecr=1455160270
 24   0.013774 54.230.149.215 -> 172.31.29.138 TCP 2962 [TCP segment of a reassembled PDU]
 25   0.013779 172.31.29.138 -> 54.230.149.215 TCP 66 34575 > http [ACK] Seq=98 Ack=53207 Win=133376 Len=0 TSval=14158503 TSecr=1455160270
 26   0.013847 54.230.149.215 -> 172.31.29.138 TCP 8754 [TCP segment of a reassembled PDU]
 27   0.013854 172.31.29.138 -> 54.230.149.215 TCP 66 34575 > http [ACK] Seq=98 Ack=61895 Win=150784 Len=0 TSval=14158503 TSecr=1455160270
 28   0.015048 54.230.149.215 -> 172.31.29.138 TCP 4410 [TCP segment of a reassembled PDU]
 29   0.015054 172.31.29.138 -> 54.230.149.215 TCP 66 34575 > http [ACK] Seq=98 Ack=66239 Win=159360 Len=0 TSval=14158503 TSecr=1455160270
 30   0.015144 54.230.149.215 -> 172.31.29.138 TCP 13098 [TCP segment of a reassembled PDU]
 31   0.015153 172.31.29.138 -> 54.230.149.215 TCP 66 34575 > http [ACK] Seq=98 Ack=79271 Win=176896 Len=0 TSval=14158503 TSecr=1455160270
 32   0.015274 54.230.149.215 -> 172.31.29.138 TCP 2962 [TCP segment of a reassembled PDU]
 33   0.015279 172.31.29.138 -> 54.230.149.215 TCP 66 34575 > http [ACK] Seq=98 Ack=82167 Win=191232 Len=0 TSval=14158503 TSecr=1455160270
 34   0.015379 54.230.149.215 -> 172.31.29.138 TCP 7306 [TCP segment of a reassembled PDU]
 35   0.015385 172.31.29.138 -> 54.230.149.215 TCP 66 34575 > http [ACK] Seq=98 Ack=89407 Win=186368 Len=0 TSval=14158503 TSecr=1455160270
 36   0.016405 54.230.149.215 -> 172.31.29.138 TCP 5858 [TCP segment of a reassembled PDU]
 37   0.016414 172.31.29.138 -> 54.230.149.215 TCP 66 34575 > http [ACK] Seq=98 Ack=95199 Win=188672 Len=0 TSval=14158504 TSecr=1455160270
 38   0.016716 54.230.149.215 -> 172.31.29.138 TCP 15994 [TCP segment of a reassembled PDU]
 39   0.016726 172.31.29.138 -> 54.230.149.215 TCP 66 34575 > http [ACK] Seq=98 Ack=111127 Win=223104 Len=0 TSval=14158504 TSecr=1455160270
 40   0.016978 54.230.149.215 -> 172.31.29.138 TCP 11650 [TCP segment of a reassembled PDU]
 41   0.016986 172.31.29.138 -> 54.230.149.215 TCP 66 34575 > http [ACK] Seq=98 Ack=122711 Win=246272 Len=0 TSval=14158504 TSecr=1455160270
 42   0.017925 54.230.149.215 -> 172.31.29.138 TCP 4410 [TCP segment of a reassembled PDU]
 43   0.017933 172.31.29.138 -> 54.230.149.215 TCP 66 34575 > http [ACK] Seq=98 Ack=127055 Win=254976 Len=0 TSval=14158504 TSecr=1455160270
 44   0.018409 54.230.149.215 -> 172.31.29.138 TCP 4410 [TCP segment of a reassembled PDU]
 45   0.018416 172.31.29.138 -> 54.230.149.215 TCP 66 34575 > http [ACK] Seq=98 Ack=131399 Win=263680 Len=0 TSval=14158504 TSecr=1455160270
 46   0.018551 54.230.149.215 -> 172.31.29.138 TCP 11650 [TCP segment of a reassembled PDU]
 47   0.018560 172.31.29.138 -> 54.230.149.215 TCP 66 34575 > http [ACK] Seq=98 Ack=142983 Win=286848 Len=0 TSval=14158504 TSecr=1455160270
 48   0.018640 54.230.149.215 -> 172.31.29.138 TCP 15994 [TCP segment of a reassembled PDU]
 49   0.018649 172.31.29.138 -> 54.230.149.215 TCP 66 34575 > http [ACK] Seq=98 Ack=158911 Win=318720 Len=0 TSval=14158504 TSecr=1455160271
 50   0.020258 54.230.149.215 -> 172.31.29.138 TCP 7306 [TCP segment of a reassembled PDU]
 51   0.020270 172.31.29.138 -> 54.230.149.215 TCP 66 34575 > http [ACK] Seq=98 Ack=166151 Win=333184 Len=0 TSval=14158505 TSecr=1455160271
 52   0.020343 54.230.149.215 -> 172.31.29.138 TCP 8754 [TCP segment of a reassembled PDU]
 53   0.020352 172.31.29.138 -> 54.230.149.215 TCP 66 34575 > http [ACK] Seq=98 Ack=174839 Win=350592 Len=0 TSval=14158505 TSecr=1455160271
 54   0.020366 54.230.149.215 -> 172.31.29.138 TCP 1514 [TCP segment of a reassembled PDU]
 55   0.020369 172.31.29.138 -> 54.230.149.215 TCP 66 34575 > http [ACK] Seq=98 Ack=176287 Win=353408 Len=0 TSval=14158505 TSecr=1455160271
 56   0.020388 54.230.149.215 -> 172.31.29.138 TCP 13098 [TCP segment of a reassembled PDU]
 57   0.020395 172.31.29.138 -> 54.230.149.215 TCP 66 34575 > http [ACK] Seq=98 Ack=189319 Win=379520 Len=0 TSval=14158505 TSecr=1455160271
 58   0.020424 54.230.149.215 -> 172.31.29.138 TCP 1514 [TCP segment of a reassembled PDU]
 59   0.020427 172.31.29.138 -> 54.230.149.215 TCP 66 34575 > http [ACK] Seq=98 Ack=190767 Win=382464 Len=0 TSval=14158505 TSecr=1455160271
 60   0.021474 54.230.149.215 -> 172.31.29.138 TCP 2962 [TCP segment of a reassembled PDU]
 61   0.021482 172.31.29.138 -> 54.230.149.215 TCP 66 34575 > http [ACK] Seq=98 Ack=193663 Win=388224 Len=0 TSval=14158505 TSecr=1455160271
 62   0.021617 54.230.149.215 -> 172.31.29.138 TCP 5858 [TCP segment of a reassembled PDU]
 63   0.021624 172.31.29.138 -> 54.230.149.215 TCP 66 34575 > http [ACK] Seq=98 Ack=199455 Win=399744 Len=0 TSval=14158505 TSecr=1455160271
 64   0.021938 54.230.149.215 -> 172.31.29.138 TCP 26130 [TCP segment of a reassembled PDU]
 65   0.021952 172.31.29.138 -> 54.230.149.215 TCP 66 34575 > http [ACK] Seq=98 Ack=225519 Win=451968 Len=0 TSval=14158505 TSecr=1455160271
 66   0.021969 54.230.149.215 -> 172.31.29.138 TCP 13098 [TCP segment of a reassembled PDU]
 67   0.021977 172.31.29.138 -> 54.230.149.215 TCP 66 34575 > http [ACK] Seq=98 Ack=238551 Win=477952 Len=0 TSval=14158505 TSecr=1455160271
 68   0.023016 54.230.149.215 -> 172.31.29.138 TCP 7306 [TCP segment of a reassembled PDU]
 69   0.023025 172.31.29.138 -> 54.230.149.215 TCP 66 34575 > http [ACK] Seq=98 Ack=245791 Win=492416 Len=0 TSval=14158505 TSecr=1455160271
 70   0.023539 54.230.149.215 -> 172.31.29.138 TCP 10202 [TCP segment of a reassembled PDU]
 71   0.023549 172.31.29.138 -> 54.230.149.215 TCP 66 34575 > http [ACK] Seq=98 Ack=255927 Win=512768 Len=0 TSval=14158505 TSecr=1455160271
 72   0.023704 54.230.149.215 -> 172.31.29.138 TCP 24682 [TCP segment of a reassembled PDU]
 73   0.023716 172.31.29.138 -> 54.230.149.215 TCP 66 34575 > http [ACK] Seq=98 Ack=280543 Win=492544 Len=0 TSval=14158505 TSecr=1455160271
 74   0.024560 54.230.149.215 -> 172.31.29.138 TCP 7306 [TCP segment of a reassembled PDU]
 75   0.024569 172.31.29.138 -> 54.230.149.215 TCP 66 34575 > http [ACK] Seq=98 Ack=287783 Win=527232 Len=0 TSval=14158506 TSecr=1455160271
 76   0.024698 54.230.149.215 -> 172.31.29.138 TCP 13098 [TCP segment of a reassembled PDU]
 77   0.024708 172.31.29.138 -> 54.230.149.215 TCP 66 34575 > http [ACK] Seq=98 Ack=300815 Win=553216 Len=0 TSval=14158506 TSecr=1455160271
 78   0.025295 54.230.149.215 -> 172.31.29.138 TCP 1514 [TCP segment of a reassembled PDU]
 79   0.025300 172.31.29.138 -> 54.230.149.215 TCP 66 34575 > http [ACK] Seq=98 Ack=302263 Win=556160 Len=0 TSval=14158506 TSecr=1455160271
 80   0.025493 54.230.149.215 -> 172.31.29.138 TCP 26130 [TCP segment of a reassembled PDU]
 81   0.025520 172.31.29.138 -> 54.230.149.215 TCP 66 34575 > http [ACK] Seq=98 Ack=328327 Win=608256 Len=0 TSval=14158506 TSecr=1455160271
 82   0.025538 54.230.149.215 -> 172.31.29.138 TCP 13098 [TCP segment of a reassembled PDU]
 83   0.025545 172.31.29.138 -> 54.230.149.215 TCP 66 34575 > http [ACK] Seq=98 Ack=341359 Win=634368 Len=0 TSval=14158506 TSecr=1455160271
 84   0.026079 54.230.149.215 -> 172.31.29.138 TCP 4410 [TCP segment of a reassembled PDU]
 85   0.026085 172.31.29.138 -> 54.230.149.215 TCP 66 34575 > http [ACK] Seq=98 Ack=345703 Win=643072 Len=0 TSval=14158506 TSecr=1455160271
 86   0.026244 54.230.149.215 -> 172.31.29.138 TCP 18890 [TCP segment of a reassembled PDU]
 87   0.026255 172.31.29.138 -> 54.230.149.215 TCP 66 34575 > http [ACK] Seq=98 Ack=364527 Win=680704 Len=0 TSval=14158506 TSecr=1455160271
 88   0.026833 54.230.149.215 -> 172.31.29.138 TCP 1514 [TCP segment of a reassembled PDU]
 89   0.026838 172.31.29.138 -> 54.230.149.215 TCP 66 34575 > http [ACK] Seq=98 Ack=365975 Win=683648 Len=0 TSval=14158506 TSecr=1455160271
 90   0.027094 54.230.149.215 -> 172.31.29.138 TCP 4410 [TCP segment of a reassembled PDU]
 91   0.027099 172.31.29.138 -> 54.230.149.215 TCP 66 34575 > http [ACK] Seq=98 Ack=370319 Win=692224 Len=0 TSval=14158506 TSecr=1455160271
 92   0.027242 54.230.149.215 -> 172.31.29.138 TCP 20338 [TCP segment of a reassembled PDU]
 93   0.027254 172.31.29.138 -> 54.230.149.215 TCP 66 34575 > http [ACK] Seq=98 Ack=390591 Win=732800 Len=0 TSval=14158506 TSecr=1455160271
 94   0.027265 54.230.149.215 -> 172.31.29.138 TCP 4410 [TCP segment of a reassembled PDU]
 95   0.027269 172.31.29.138 -> 54.230.149.215 TCP 66 34575 > http [ACK] Seq=98 Ack=394935 Win=734336 Len=0 TSval=14158506 TSecr=1455160271
 96   0.027879 54.230.149.215 -> 172.31.29.138 TCP 7306 [TCP segment of a reassembled PDU]
 97   0.027888 172.31.29.138 -> 54.230.149.215 TCP 66 34575 > http [ACK] Seq=98 Ack=402175 Win=755968 Len=0 TSval=14158507 TSecr=1455160271
 98   0.028035 54.230.149.215 -> 172.31.29.138 TCP 29026 [TCP segment of a reassembled PDU]
 99   0.028049 172.31.29.138 -> 54.230.149.215 TCP 66 34575 > http [ACK] Seq=98 Ack=431135 Win=727168 Len=0 TSval=14158507 TSecr=1455160271
100   0.028654 54.230.149.215 -> 172.31.29.138 TCP 10202 [TCP segment of a reassembled PDU]
101   0.028663 172.31.29.138 -> 54.230.149.215 TCP 66 34575 > http [ACK] Seq=98 Ack=441271 Win=758272 Len=0 TSval=14158507 TSecr=1455160272
102   0.028802 54.230.149.215 -> 172.31.29.138 TCP 24682 [TCP segment of a reassembled PDU]
103   0.028815 172.31.29.138 -> 54.230.149.215 TCP 66 34575 > http [ACK] Seq=98 Ack=465887 Win=734464 Len=0 TSval=14158507 TSecr=1455160272
104   0.029700 54.230.149.215 -> 172.31.29.138 TCP 10202 [TCP segment of a reassembled PDU]
105   0.029710 172.31.29.138 -> 54.230.149.215 TCP 66 34575 > http [ACK] Seq=98 Ack=476023 Win=758272 Len=0 TSval=14158507 TSecr=1455160272
106   0.029854 54.230.149.215 -> 172.31.29.138 TCP 20338 [TCP segment of a reassembled PDU]
107   0.029879 172.31.29.138 -> 54.230.149.215 TCP 66 34575 > http [ACK] Seq=98 Ack=496295 Win=741504 Len=0 TSval=14158507 TSecr=1455160272
108   0.030435 54.230.149.215 -> 172.31.29.138 TCP 7306 [TCP segment of a reassembled PDU]
109   0.030443 172.31.29.138 -> 54.230.149.215 TCP 66 34575 > http [ACK] Seq=98 Ack=503535 Win=763008 Len=0 TSval=14158507 TSecr=1455160272
110   0.030614 54.230.149.215 -> 172.31.29.138 TCP 26130 [TCP segment of a reassembled PDU]
111   0.030655 54.230.149.215 -> 172.31.29.138 TCP 18890 [TCP segment of a reassembled PDU]
112   0.030693 172.31.29.138 -> 54.230.149.215 TCP 66 34575 > http [ACK] Seq=98 Ack=548423 Win=718208 Len=0 TSval=14158507 TSecr=1455160272
113   0.031472 54.230.149.215 -> 172.31.29.138 TCP 8754 [TCP segment of a reassembled PDU]
114   0.031481 172.31.29.138 -> 54.230.149.215 TCP 66 34575 > http [ACK] Seq=98 Ack=557111 Win=760576 Len=0 TSval=14158507 TSecr=1455160272
115   0.031572 54.230.149.215 -> 172.31.29.138 TCP 4410 [TCP segment of a reassembled PDU]
116   0.031579 172.31.29.138 -> 54.230.149.215 TCP 66 34575 > http [ACK] Seq=98 Ack=561455 Win=767744 Len=0 TSval=14158507 TSecr=1455160272
117   0.031969 54.230.149.215 -> 172.31.29.138 TCP 7306 [TCP segment of a reassembled PDU]
118   0.031988 172.31.29.138 -> 54.230.149.215 TCP 66 34575 > http [ACK] Seq=98 Ack=568695 Win=772992 Len=0 TSval=14158508 TSecr=1455160272
119   0.032132 54.230.149.215 -> 172.31.29.138 TCP 21786 [TCP segment of a reassembled PDU]
120   0.032156 172.31.29.138 -> 54.230.149.215 TCP 66 34575 > http [ACK] Seq=98 Ack=590415 Win=751360 Len=0 TSval=14158508 TSecr=1455160272
121   0.032388 54.230.149.215 -> 172.31.29.138 TCP 20338 [TCP segment of a reassembled PDU]
122   0.032413 54.230.149.215 -> 172.31.29.138 TCP 5858 [TCP segment of a reassembled PDU]
123   0.032425 172.31.29.138 -> 54.230.149.215 TCP 66 34575 > http [ACK] Seq=98 Ack=616479 Win=731904 Len=0 TSval=14158508 TSecr=1455160272
124   0.032440 54.230.149.215 -> 172.31.29.138 TCP 10202 [TCP segment of a reassembled PDU]
125   0.032461 172.31.29.138 -> 54.230.149.215 TCP 66 34575 > http [ACK] Seq=98 Ack=626615 Win=758272 Len=0 TSval=14158508 TSecr=1455160272
126   0.033504 54.230.149.215 -> 172.31.29.138 TCP 5858 [TCP segment of a reassembled PDU]
127   0.033512 172.31.29.138 -> 54.230.149.215 TCP 66 34575 > http [ACK] Seq=98 Ack=632407 Win=765312 Len=0 TSval=14158508 TSecr=1455160272
128   0.033684 54.230.149.215 -> 172.31.29.138 TCP 29026 [TCP segment of a reassembled PDU]
129   0.033711 172.31.29.138 -> 54.230.149.215 TCP 66 34575 > http [ACK] Seq=98 Ack=661367 Win=736384 Len=0 TSval=14158508 TSecr=1455160272
130   0.034023 54.230.149.215 -> 172.31.29.138 TCP 8754 [TCP segment of a reassembled PDU]
131   0.034030 172.31.29.138 -> 54.230.149.215 TCP 66 34575 > http [ACK] Seq=98 Ack=670055 Win=760576 Len=0 TSval=14158508 TSecr=1455160272
132   0.034183 54.230.149.215 -> 172.31.29.138 TCP 21786 [TCP segment of a reassembled PDU]
133   0.034208 172.31.29.138 -> 54.230.149.215 TCP 66 34575 > http [ACK] Seq=98 Ack=691775 Win=739200 Len=0 TSval=14158508 TSecr=1455160272
134   0.035030 54.230.149.215 -> 172.31.29.138 TCP 2962 [TCP segment of a reassembled PDU]
135   0.035035 172.31.29.138 -> 54.230.149.215 TCP 66 34575 > http [ACK] Seq=98 Ack=694671 Win=770048 Len=0 TSval=14158508 TSecr=1455160272
136   0.035234 54.230.149.215 -> 172.31.29.138 TCP 26130 [TCP segment of a reassembled PDU]
137   0.035250 54.230.149.215 -> 172.31.29.138 TCP 2962 [TCP segment of a reassembled PDU]
138   0.035265 172.31.29.138 -> 54.230.149.215 TCP 66 34575 > http [ACK] Seq=98 Ack=723631 Win=741120 Len=0 TSval=14158508 TSecr=1455160272
139   0.035298 54.230.149.215 -> 172.31.29.138 TCP 23234 [TCP segment of a reassembled PDU]
140   0.035315 172.31.29.138 -> 54.230.149.215 TCP 66 34575 > http [ACK] Seq=98 Ack=746799 Win=736768 Len=0 TSval=14158508 TSecr=1455160272
141   0.035338 54.230.149.215 -> 172.31.29.138 TCP 10202 [TCP segment of a reassembled PDU]
142   0.035345 172.31.29.138 -> 54.230.149.215 TCP 66 34575 > http [ACK] Seq=98 Ack=756935 Win=758272 Len=0 TSval=14158508 TSecr=1455160272
143   0.035822 54.230.149.215 -> 172.31.29.138 TCP 7306 [TCP segment of a reassembled PDU]
144   0.035829 172.31.29.138 -> 54.230.149.215 TCP 66 34575 > http [ACK] Seq=98 Ack=764175 Win=763008 Len=0 TSval=14158509 TSecr=1455160272
145   0.035984 54.230.149.215 -> 172.31.29.138 TCP 18890 [TCP segment of a reassembled PDU]
146   0.036009 54.230.149.215 -> 172.31.29.138 TCP 7306 [TCP segment of a reassembled PDU]
147   0.036016 54.230.149.215 -> 172.31.29.138 TCP 4410 [TCP segment of a reassembled PDU]
148   0.036026 172.31.29.138 -> 54.230.149.215 TCP 66 34575 > http [ACK] Seq=98 Ack=794583 Win=732672 Len=0 TSval=14158509 TSecr=1455160272
149   0.036839 54.230.149.215 -> 172.31.29.138 TCP 5858 [TCP segment of a reassembled PDU]
150   0.036845 172.31.29.138 -> 54.230.149.215 TCP 66 34575 > http [ACK] Seq=98 Ack=800375 Win=765312 Len=0 TSval=14158509 TSecr=1455160272
151   0.037001 54.230.149.215 -> 172.31.29.138 TCP 21786 [TCP segment of a reassembled PDU]
152   0.037026 172.31.29.138 -> 54.230.149.215 TCP 66 34575 > http [ACK] Seq=98 Ack=822095 Win=743680 Len=0 TSval=14158509 TSecr=1455160272
153   0.037062 54.230.149.215 -> 172.31.29.138 TCP 23234 [TCP segment of a reassembled PDU]
154   0.037095 54.230.149.215 -> 172.31.29.138 TCP 2962 [TCP segment of a reassembled PDU]
155   0.037102 172.31.29.138 -> 54.230.149.215 TCP 66 34575 > http [ACK] Seq=98 Ack=848159 Win=731904 Len=0 TSval=14158509 TSecr=1455160272
156   0.037141 54.230.149.215 -> 172.31.29.138 TCP 17442 [TCP segment of a reassembled PDU]
157   0.037152 172.31.29.138 -> 54.230.149.215 TCP 66 34575 > http [ACK] Seq=98 Ack=865535 Win=746240 Len=0 TSval=14158509 TSecr=1455160272
158   0.037361 54.230.149.215 -> 172.31.29.138 TCP 7306 [TCP segment of a reassembled PDU]
159   0.037369 172.31.29.138 -> 54.230.149.215 TCP 66 34575 > http [ACK] Seq=98 Ack=872775 Win=763008 Len=0 TSval=14158509 TSecr=1455160272
160   0.037503 54.230.149.215 -> 172.31.29.138 TCP 14546 [TCP segment of a reassembled PDU]
161   0.037525 172.31.29.138 -> 54.230.149.215 TCP 66 34575 > http [ACK] Seq=98 Ack=887255 Win=772992 Len=0 TSval=14158509 TSecr=1455160272
162   0.038402 54.230.149.215 -> 172.31.29.138 TCP 5858 [TCP segment of a reassembled PDU]
163   0.038420 172.31.29.138 -> 54.230.149.215 TCP 66 34575 > http [ACK] Seq=98 Ack=893047 Win=772992 Len=0 TSval=14158509 TSecr=1455160272
164   0.038580 54.230.149.215 -> 172.31.29.138 TCP 26130 [TCP segment of a reassembled PDU]
165   0.038607 172.31.29.138 -> 54.230.149.215 TCP 66 34575 > http [ACK] Seq=98 Ack=919111 Win=747008 Len=0 TSval=14158509 TSecr=1455160272
166   0.038635 54.230.149.215 -> 172.31.29.138 TCP 26130 [TCP segment of a reassembled PDU]
167   0.038650 54.230.149.215 -> 172.31.29.138 TCP 7306 [TCP segment of a reassembled PDU]
168   0.038666 172.31.29.138 -> 54.230.149.215 TCP 66 34575 > http [ACK] Seq=98 Ack=952415 Win=720128 Len=0 TSval=14158509 TSecr=1455160272
169   0.038992 54.230.149.215 -> 172.31.29.138 TCP 26130 [TCP segment of a reassembled PDU]
170   0.039007 172.31.29.138 -> 54.230.149.215 TCP 66 34575 > http [ACK] Seq=98 Ack=978479 Win=732032 Len=0 TSval=14158509 TSecr=1455160273
171   0.039030 54.230.149.215 -> 172.31.29.138 TCP 14546 [TCP segment of a reassembled PDU]
172   0.039045 54.230.149.215 -> 172.31.29.138 TCP 11650 [TCP segment of a reassembled PDU]
173   0.039062 54.230.149.215 -> 172.31.29.138 TCP 2962 [TCP segment of a reassembled PDU]
174   0.039210 172.31.29.138 -> 54.230.149.215 TCP 66 34575 > http [ACK] Seq=98 Ack=1007439 Win=703104 Len=0 TSval=14158509 TSecr=1455160273
175   0.039916 54.230.149.215 -> 172.31.29.138 TCP 7306 [TCP segment of a reassembled PDU]
176   0.039925 172.31.29.138 -> 54.230.149.215 TCP 66 34575 > http [ACK] Seq=98 Ack=1014679 Win=763008 Len=0 TSval=14158510 TSecr=1455160273
177   0.040022 54.230.149.215 -> 172.31.29.138 TCP 2962 [TCP segment of a reassembled PDU]
178   0.040028 172.31.29.138 -> 54.230.149.215 TCP 66 34575 > http [ACK] Seq=98 Ack=1017575 Win=778752 Len=0 TSval=14158510 TSecr=1455160273
179   0.040339 54.230.149.215 -> 172.31.29.138 TCP 26130 [TCP segment of a reassembled PDU]
180   0.040353 172.31.29.138 -> 54.230.149.215 TCP 66 34575 > http [ACK] Seq=98 Ack=1043639 Win=830848 Len=0 TSval=14158510 TSecr=1455160273
181   0.040366 54.230.149.215 -> 172.31.29.138 TCP 11650 [TCP segment of a reassembled PDU]
182   0.040375 172.31.29.138 -> 54.230.149.215 TCP 66 34575 > http [ACK] Seq=98 Ack=1055223 Win=854016 Len=0 TSval=14158510 TSecr=1455160273
183   0.040388 54.230.149.215 -> 172.31.29.138 TCP 14546 [TCP segment of a reassembled PDU]
184   0.040394 172.31.29.138 -> 54.230.149.215 TCP 66 34575 > http [ACK] Seq=98 Ack=1069703 Win=878336 Len=0 TSval=14158510 TSecr=1455160273
185   0.040417 54.230.149.215 -> 172.31.29.138 TCP 7306 [TCP segment of a reassembled PDU]
186   0.040426 172.31.29.138 -> 54.230.149.215 TCP 66 34575 > http [ACK] Seq=98 Ack=1076943 Win=871168 Len=0 TSval=14158510 TSecr=1455160273
187   0.040687 54.230.149.215 -> 172.31.29.138 TCP 5858 [TCP segment of a reassembled PDU]
188   0.040694 172.31.29.138 -> 54.230.149.215 TCP 66 34575 > http [ACK] Seq=98 Ack=1082735 Win=894592 Len=0 TSval=14158510 TSecr=1455160273
189   0.040975 54.230.149.215 -> 172.31.29.138 TCP 17442 [TCP segment of a reassembled PDU]
190   0.040987 172.31.29.138 -> 54.230.149.215 TCP 66 34575 > http [ACK] Seq=98 Ack=1100111 Win=929280 Len=0 TSval=14158510 TSecr=1455160273
191   0.041119 54.230.149.215 -> 172.31.29.138 TCP 26130 [TCP segment of a reassembled PDU]
192   0.041138 54.230.149.215 -> 172.31.29.138 TCP 8754 [TCP segment of a reassembled PDU]
193   0.041156 172.31.29.138 -> 54.230.149.215 TCP 66 34575 > http [ACK] Seq=98 Ack=1134863 Win=907008 Len=0 TSval=14158510 TSecr=1455160273
194   0.041483 54.230.149.215 -> 172.31.29.138 TCP 7306 [TCP segment of a reassembled PDU]
195   0.041492 172.31.29.138 -> 54.230.149.215 TCP 66 34575 > http [ACK] Seq=98 Ack=1142103 Win=943872 Len=0 TSval=14158510 TSecr=1455160273
196   0.041651 54.230.149.215 -> 172.31.29.138 TCP 5858 [TCP segment of a reassembled PDU]
197   0.041662 172.31.29.138 -> 54.230.149.215 TCP 66 34575 > http [ACK] Seq=98 Ack=1147895 Win=954624 Len=0 TSval=14158510 TSecr=1455160273
198   0.041724 54.230.149.215 -> 172.31.29.138 TCP 4410 [TCP segment of a reassembled PDU]
199   0.041731 172.31.29.138 -> 54.230.149.215 TCP 66 34575 > http [ACK] Seq=98 Ack=1152239 Win=956928 Len=0 TSval=14158510 TSecr=1455160273
200   0.041895 54.230.149.215 -> 172.31.29.138 TCP 26130 [TCP segment of a reassembled PDU]
201   0.041927 172.31.29.138 -> 54.230.149.215 TCP 66 34575 > http [ACK] Seq=98 Ack=1178303 Win=930944 Len=0 TSval=14158510 TSecr=1455160273
202   0.041961 54.230.149.215 -> 172.31.29.138 TCP 31922 [TCP segment of a reassembled PDU]
203   0.041984 54.230.149.215 -> 172.31.29.138 TCP 2962 [TCP segment of a reassembled PDU]
204   0.041998 172.31.29.138 -> 54.230.149.215 TCP 66 34575 > http [ACK] Seq=98 Ack=1213055 Win=906880 Len=0 TSval=14158510 TSecr=1455160273
205   0.042518 54.230.149.215 -> 172.31.29.138 TCP 11650 [TCP segment of a reassembled PDU]
206   0.042542 172.31.29.138 -> 54.230.149.215 TCP 66 34575 > http [ACK] Seq=98 Ack=1224639 Win=945152 Len=0 TSval=14158510 TSecr=1455160273
207   0.042710 54.230.149.215 -> 172.31.29.138 TCP 26130 [TCP segment of a reassembled PDU]
208   0.042726 54.230.149.215 -> 172.31.29.138 TCP 1514 [TCP segment of a reassembled PDU]
209   0.042742 54.230.149.215 -> 172.31.29.138 TCP 14546 [TCP segment of a reassembled PDU]
210   0.042753 54.230.149.215 -> 172.31.29.138 TCP 5858 [TCP segment of a reassembled PDU]
211   0.042768 54.230.149.215 -> 172.31.29.138 TCP 2962 [TCP segment of a reassembled PDU]
212   0.042782 172.31.29.138 -> 54.230.149.215 TCP 66 34575 > http [ACK] Seq=98 Ack=1275319 Win=894592 Len=0 TSval=14158510 TSecr=1455160273
213   0.043027 54.230.149.215 -> 172.31.29.138 TCP 2962 [TCP segment of a reassembled PDU]
214   0.043033 172.31.29.138 -> 54.230.149.215 TCP 66 34575 > http [ACK] Seq=98 Ack=1278215 Win=959360 Len=0 TSval=14158510 TSecr=1455160273
215   0.043480 54.230.149.215 -> 172.31.29.138 TCP 5858 [TCP segment of a reassembled PDU]
216   0.043498 172.31.29.138 -> 54.230.149.215 TCP 66 34575 > http [ACK] Seq=98 Ack=1284007 Win=964096 Len=0 TSval=14158510 TSecr=1455160273
217   0.043660 54.230.149.215 -> 172.31.29.138 TCP 26130 [TCP segment of a reassembled PDU]
218   0.043699 54.230.149.215 -> 172.31.29.138 TCP 18890 [TCP segment of a reassembled PDU]
219   0.043725 54.230.149.215 -> 172.31.29.138 TCP 7306 [TCP segment of a reassembled PDU]
220   0.043741 54.230.149.215 -> 172.31.29.138 TCP 7306 [TCP segment of a reassembled PDU]
221   0.043894 172.31.29.138 -> 54.230.149.215 TCP 66 34575 > http [ACK] Seq=98 Ack=1343375 Win=904832 Len=0 TSval=14158511 TSecr=1455160273
222   0.044262 54.230.149.215 -> 172.31.29.138 TCP 5858 [TCP segment of a reassembled PDU]
223   0.044270 172.31.29.138 -> 54.230.149.215 TCP 66 34575 > http [ACK] Seq=98 Ack=1349167 Win=954624 Len=0 TSval=14158511 TSecr=1455160273
224   0.044444 54.230.149.215 -> 172.31.29.138 TCP 26130 [TCP segment of a reassembled PDU]
225   0.044468 54.230.149.215 -> 172.31.29.138 TCP 15994 [TCP segment of a reassembled PDU]
226   0.044481 54.230.149.215 -> 172.31.29.138 TCP 10202 [TCP segment of a reassembled PDU]
227   0.044490 54.230.149.215 -> 172.31.29.138 TCP 7306 [TCP segment of a reassembled PDU]
228   0.044507 172.31.29.138 -> 54.230.149.215 TCP 66 34575 > http [ACK] Seq=98 Ack=1408535 Win=895360 Len=0 TSval=14158511 TSecr=1455160273
229   0.045295 54.230.149.215 -> 172.31.29.138 TCP 8754 [TCP segment of a reassembled PDU]
230   0.045303 172.31.29.138 -> 54.230.149.215 TCP 66 34575 > http [ACK] Seq=98 Ack=1417223 Win=949888 Len=0 TSval=14158511 TSecr=1455160273
231   0.045453 54.230.149.215 -> 172.31.29.138 TCP 20338 [TCP segment of a reassembled PDU]
232   0.045479 54.230.149.215 -> 172.31.29.138 TCP 5858 [TCP segment of a reassembled PDU]
233   0.045526 54.230.149.215 -> 172.31.29.138 TCP 17442 [TCP segment of a reassembled PDU]
234   0.045534 54.230.149.215 -> 172.31.29.138 TCP 1514 [TCP Previous segment not captured] [TCP segment of a reassembled PDU]
235   0.045538 172.31.29.138 -> 54.230.149.215 TCP 78 34575 > http [ACK] Seq=98 Ack=1460663 Win=906496 Len=0 TSval=14158511 TSecr=1455160273 SLE=1462111 SRE=1463559
236   0.045546 54.230.149.215 -> 172.31.29.138 TCP 1514 [TCP Out-Of-Order] [TCP segment of a reassembled PDU]
237   0.045549 172.31.29.138 -> 54.230.149.215 TCP 66 34575 > http [ACK] Seq=98 Ack=1463559 Win=903680 Len=0 TSval=14158511 TSecr=1455160273
238   0.045562 54.230.149.215 -> 172.31.29.138 TCP 10202 [TCP segment of a reassembled PDU]
239   0.045568 172.31.29.138 -> 54.230.149.215 TCP 66 34575 > http [ACK] Seq=98 Ack=1473695 Win=893568 Len=0 TSval=14158511 TSecr=1455160273
240   0.045873 54.230.149.215 -> 172.31.29.138 TCP 11650 [TCP segment of a reassembled PDU]
241   0.045883 172.31.29.138 -> 54.230.149.215 TCP 66 34575 > http [ACK] Seq=98 Ack=1485279 Win=945152 Len=0 TSval=14158511 TSecr=1455160273
242   0.046033 54.230.149.215 -> 172.31.29.138 TCP 26130 [TCP segment of a reassembled PDU]
243   0.046047 172.31.29.138 -> 54.230.149.215 TCP 66 34575 > http [ACK] Seq=98 Ack=1511343 Win=921344 Len=0 TSval=14158511 TSecr=1455160273
244   0.046086 54.230.149.215 -> 172.31.29.138 TCP 26130 [TCP segment of a reassembled PDU]
245   0.046098 54.230.149.215 -> 172.31.29.138 TCP 1514 [TCP segment of a reassembled PDU]
246   0.046104 172.31.29.138 -> 54.230.149.215 TCP 66 34575 > http [ACK] Seq=98 Ack=1537407 Win=895360 Len=0 TSval=14158511 TSecr=1455160273
247   0.046109 172.31.29.138 -> 54.230.149.215 TCP 66 34575 > http [ACK] Seq=98 Ack=1538855 Win=893952 Len=0 TSval=14158511 TSecr=1455160273
248   0.046816 54.230.149.215 -> 172.31.29.138 TCP 4410 [TCP segment of a reassembled PDU]
249   0.046823 172.31.29.138 -> 54.230.149.215 TCP 66 34575 > http [ACK] Seq=98 Ack=1543199 Win=956928 Len=0 TSval=14158511 TSecr=1455160273
250   0.047351 54.230.149.215 -> 172.31.29.138 TCP 8754 [TCP segment of a reassembled PDU]
251   0.047358 172.31.29.138 -> 54.230.149.215 TCP 66 34575 > http [ACK] Seq=98 Ack=1551887 Win=949888 Len=0 TSval=14158511 TSecr=1455160273
252   0.047522 54.230.149.215 -> 172.31.29.138 TCP 26130 [TCP segment of a reassembled PDU]
253   0.047536 172.31.29.138 -> 54.230.149.215 TCP 66 34575 > http [ACK] Seq=98 Ack=1577951 Win=923904 Len=0 TSval=14158511 TSecr=1455160273
254   0.047560 54.230.149.215 -> 172.31.29.138 TCP 20338 [TCP segment of a reassembled PDU]
255   0.047569 172.31.29.138 -> 54.230.149.215 TCP 66 34575 > http [ACK] Seq=98 Ack=1598223 Win=903680 Len=0 TSval=14158511 TSecr=1455160273
256   0.047599 54.230.149.215 -> 172.31.29.138 TCP 5858 [TCP segment of a reassembled PDU]
257   0.047604 172.31.29.138 -> 54.230.149.215 TCP 66 34575 > http [ACK] Seq=98 Ack=1604015 Win=897920 Len=0 TSval=14158511 TSecr=1455160273
258   0.048136 54.230.149.215 -> 172.31.29.138 TCP 7306 [TCP segment of a reassembled PDU]
259   0.048145 172.31.29.138 -> 54.230.149.215 TCP 66 34575 > http [ACK] Seq=98 Ack=1611255 Win=952192 Len=0 TSval=14158512 TSecr=1455160273
260   0.048299 54.230.149.215 -> 172.31.29.138 TCP 23234 [TCP segment of a reassembled PDU]
261   0.048312 172.31.29.138 -> 54.230.149.215 TCP 66 34575 > http [ACK] Seq=98 Ack=1634423 Win=929024 Len=0 TSval=14158512 TSecr=1455160273
262   0.048880 54.230.149.215 -> 172.31.29.138 TCP 7306 [TCP segment of a reassembled PDU]
263   0.048889 172.31.29.138 -> 54.230.149.215 TCP 66 34575 > http [ACK] Seq=98 Ack=1641663 Win=952192 Len=0 TSval=14158512 TSecr=1455160274
264   0.049040 54.230.149.215 -> 172.31.29.138 TCP 18890 [TCP segment of a reassembled PDU]
265   0.049051 172.31.29.138 -> 54.230.149.215 TCP 66 34575 > http [ACK] Seq=98 Ack=1660487 Win=933376 Len=0 TSval=14158512 TSecr=1455160274
266   0.049067 54.230.149.215 -> 172.31.29.138 TCP 7306 [TCP segment of a reassembled PDU]
267   0.049095 54.230.149.215 -> 172.31.29.138 TCP 1514 [TCP segment of a reassembled PDU]
268   0.049148 172.31.29.138 -> 54.230.149.215 TCP 66 34575 > http [ACK] Seq=98 Ack=1669175 Win=924800 Len=0 TSval=14158512 TSecr=1455160274
269   0.049658 54.230.149.215 -> 172.31.29.138 TCP 8754 [TCP segment of a reassembled PDU]
270   0.049666 172.31.29.138 -> 54.230.149.215 TCP 66 34575 > http [ACK] Seq=98 Ack=1677863 Win=949888 Len=0 TSval=14158512 TSecr=1455160274
271   0.049833 54.230.149.215 -> 172.31.29.138 TCP 26130 [TCP segment of a reassembled PDU]
272   0.049855 54.230.149.215 -> 172.31.29.138 TCP 5858 [TCP segment of a reassembled PDU]
273   0.049868 54.230.149.215 -> 172.31.29.138 TCP 13098 [TCP segment of a reassembled PDU]
274   0.049878 54.230.149.215 -> 172.31.29.138 TCP 7306 [TCP segment of a reassembled PDU]
275   0.049894 54.230.149.215 -> 172.31.29.138 TCP 4410 [TCP segment of a reassembled PDU]
276   0.049906 172.31.29.138 -> 54.230.149.215 TCP 66 34575 > http [ACK] Seq=98 Ack=1734335 Win=893440 Len=0 TSval=14158512 TSecr=1455160274
277   0.050406 54.230.149.215 -> 172.31.29.138 TCP 7306 [TCP segment of a reassembled PDU]
278   0.050413 172.31.29.138 -> 54.230.149.215 TCP 66 34575 > http [ACK] Seq=98 Ack=1741575 Win=952192 Len=0 TSval=14158512 TSecr=1455160274
279   0.050585 54.230.149.215 -> 172.31.29.138 TCP 26130 [TCP segment of a reassembled PDU]
280   0.050603 54.230.149.215 -> 172.31.29.138 TCP 5858 [TCP segment of a reassembled PDU]
281   0.050620 172.31.29.138 -> 54.230.149.215 TCP 66 34575 > http [ACK] Seq=98 Ack=1773431 Win=920448 Len=0 TSval=14158512 TSecr=1455160274
282   0.051176 54.230.149.215 -> 172.31.29.138 TCP 7306 [TCP segment of a reassembled PDU]
283   0.051184 172.31.29.138 -> 54.230.149.215 TCP 66 34575 > http [ACK] Seq=98 Ack=1780671 Win=952192 Len=0 TSval=14158512 TSecr=1455160274
284   0.051404 54.230.149.215 -> 172.31.29.138 TCP 26130 [TCP segment of a reassembled PDU]
285   0.051449 54.230.149.215 -> 172.31.29.138 TCP 23234 [TCP segment of a reassembled PDU]
286   0.051467 54.230.149.215 -> 172.31.29.138 TCP 2962 [TCP segment of a reassembled PDU]
287   0.051475 172.31.29.138 -> 54.230.149.215 TCP 66 34575 > http [ACK] Seq=98 Ack=1832799 Win=900096 Len=0 TSval=14158512 TSecr=1455160274
288   0.051493 54.230.149.215 -> 172.31.29.138 TCP 8754 [TCP segment of a reassembled PDU]
289   0.051510 172.31.29.138 -> 54.230.149.215 TCP 66 34575 > http [ACK] Seq=98 Ack=1841487 Win=907008 Len=0 TSval=14158512 TSecr=1455160274
290   0.052189 54.230.149.215 -> 172.31.29.138 TCP 5858 [TCP segment of a reassembled PDU]
291   0.052197 172.31.29.138 -> 54.230.149.215 TCP 66 34575 > http [ACK] Seq=98 Ack=1847279 Win=954624 Len=0 TSval=14158513 TSecr=1455160274
292   0.052340 54.230.149.215 -> 172.31.29.138 TCP 17442 [TCP segment of a reassembled PDU]
293   0.052364 172.31.29.138 -> 54.230.149.215 TCP 66 34575 > http [ACK] Seq=98 Ack=1864655 Win=937344 Len=0 TSval=14158513 TSecr=1455160274
294   0.052716 54.230.149.215 -> 172.31.29.138 TCP 5858 [TCP segment of a reassembled PDU]
295   0.052721 172.31.29.138 -> 54.230.149.215 TCP 66 34575 > http [ACK] Seq=98 Ack=1870447 Win=954624 Len=0 TSval=14158513 TSecr=1455160274
296   0.052890 54.230.149.215 -> 172.31.29.138 TCP 21786 [TCP segment of a reassembled PDU]
297   0.052910 54.230.149.215 -> 172.31.29.138 TCP 4410 [TCP segment of a reassembled PDU]
298   0.052955 172.31.29.138 -> 54.230.149.215 TCP 66 34575 > http [ACK] Seq=98 Ack=1896511 Win=928640 Len=0 TSval=14158513 TSecr=1455160274
299   0.052984 54.230.149.215 -> 172.31.29.138 TCP 33370 [TCP segment of a reassembled PDU]
300   0.053006 172.31.29.138 -> 54.230.149.215 TCP 66 34575 > http [ACK] Seq=98 Ack=1929815 Win=909312 Len=0 TSval=14158513 TSecr=1455160274
301   0.053745 54.230.149.215 -> 172.31.29.138 TCP 5858 [TCP segment of a reassembled PDU]
302   0.053751 172.31.29.138 -> 54.230.149.215 TCP 66 34575 > http [ACK] Seq=98 Ack=1935607 Win=954624 Len=0 TSval=14158513 TSecr=1455160274
303   0.053896 54.230.149.215 -> 172.31.29.138 TCP 18890 [TCP segment of a reassembled PDU]
304   0.053921 54.230.149.215 -> 172.31.29.138 TCP 7306 [TCP segment of a reassembled PDU]
305   0.053930 172.31.29.138 -> 54.230.149.215 TCP 66 34575 > http [ACK] Seq=98 Ack=1961671 Win=928640 Len=0 TSval=14158513 TSecr=1455160274
306   0.053970 54.230.149.215 -> 172.31.29.138 TCP 20338 [TCP segment of a reassembled PDU]
307   0.053980 172.31.29.138 -> 54.230.149.215 TCP 66 34575 > http [ACK] Seq=98 Ack=1981943 Win=930816 Len=0 TSval=14158513 TSecr=1455160274
308   0.054235 54.230.149.215 -> 172.31.29.138 TCP 5858 [TCP segment of a reassembled PDU]
309   0.054240 172.31.29.138 -> 54.230.149.215 TCP 66 34575 > http [ACK] Seq=98 Ack=1987735 Win=954624 Len=0 TSval=14158513 TSecr=1455160274
310   0.054421 54.230.149.215 -> 172.31.29.138 TCP 26130 [TCP segment of a reassembled PDU]
311   0.054433 54.230.149.215 -> 172.31.29.138 TCP 2962 [TCP segment of a reassembled PDU]
312   0.054448 172.31.29.138 -> 54.230.149.215 TCP 66 34575 > http [ACK] Seq=98 Ack=2016695 Win=925696 Len=0 TSval=14158513 TSecr=1455160274
313   0.054480 54.230.149.215 -> 172.31.29.138 TCP 23234 [TCP segment of a reassembled PDU]
314   0.054488 172.31.29.138 -> 54.230.149.215 TCP 66 34575 > http [ACK] Seq=98 Ack=2039863 Win=926080 Len=0 TSval=14158513 TSecr=1455160274
315   0.054521 54.230.149.215 -> 172.31.29.138 TCP 11650 [TCP segment of a reassembled PDU]
316   0.054526 172.31.29.138 -> 54.230.149.215 TCP 66 34575 > http [ACK] Seq=98 Ack=2051447 Win=945152 Len=0 TSval=14158513 TSecr=1455160274
317   0.055295 54.230.149.215 -> 172.31.29.138 TCP 5858 [TCP segment of a reassembled PDU]
318   0.055302 172.31.29.138 -> 54.230.149.215 TCP 66 34575 > http [ACK] Seq=98 Ack=2057239 Win=954624 Len=0 TSval=14158513 TSecr=1455160274
319   0.055449 54.230.149.215 -> 172.31.29.138 TCP 18890 [TCP segment of a reassembled PDU]
320   0.055474 54.230.149.215 -> 172.31.29.138 TCP 7306 [TCP segment of a reassembled PDU]
321   0.055481 172.31.29.138 -> 54.230.149.215 TCP 66 34575 > http [ACK] Seq=98 Ack=2083303 Win=928640 Len=0 TSval=14158513 TSecr=1455160274
322   0.055524 54.230.149.215 -> 172.31.29.138 TCP 24682 [TCP segment of a reassembled PDU]
323   0.055545 172.31.29.138 -> 54.230.149.215 TCP 66 34575 > http [ACK] Seq=98 Ack=2107919 Win=923648 Len=0 TSval=14158513 TSecr=1455160274
324   0.055811 54.230.149.215 -> 172.31.29.138 TCP 7306 [TCP segment of a reassembled PDU]
325   0.055816 172.31.29.138 -> 54.230.149.215 TCP 66 34575 > http [ACK] Seq=98 Ack=2115159 Win=952192 Len=0 TSval=14158514 TSecr=1455160274
326   0.055959 54.230.149.215 -> 172.31.29.138 TCP 23234 [TCP segment of a reassembled PDU]
327   0.055979 54.230.149.215 -> 172.31.29.138 TCP 2962 [TCP segment of a reassembled PDU]
328   0.055989 172.31.29.138 -> 54.230.149.215 TCP 66 34575 > http [ACK] Seq=98 Ack=2141223 Win=926208 Len=0 TSval=14158514 TSecr=1455160274
329   0.056041 54.230.149.215 -> 172.31.29.138 TCP 26130 [TCP segment of a reassembled PDU]
330   0.056062 54.230.149.215 -> 172.31.29.138 TCP 2962 [TCP segment of a reassembled PDU]
331   0.056223 172.31.29.138 -> 54.230.149.215 TCP 66 34575 > http [ACK] Seq=98 Ack=2170183 Win=916480 Len=0 TSval=14158514 TSecr=1455160274
332   0.056578 54.230.149.215 -> 172.31.29.138 TCP 8754 [TCP segment of a reassembled PDU]
333   0.056584 172.31.29.138 -> 54.230.149.215 TCP 66 34575 > http [ACK] Seq=98 Ack=2178871 Win=949888 Len=0 TSval=14158514 TSecr=1455160274
334   0.056680 54.230.149.215 -> 172.31.29.138 TCP 11650 [TCP segment of a reassembled PDU]
335   0.056700 172.31.29.138 -> 54.230.149.215 TCP 66 34575 > http [ACK] Seq=98 Ack=2190455 Win=964096 Len=0 TSval=14158514 TSecr=1455160274
336   0.056826 54.230.149.215 -> 172.31.29.138 TCP 13098 [TCP segment of a reassembled PDU]
337   0.056850 172.31.29.138 -> 54.230.149.215 TCP 66 34575 > http [ACK] Seq=98 Ack=2203487 Win=964096 Len=0 TSval=14158514 TSecr=1455160274
338   0.056975 54.230.149.215 -> 172.31.29.138 TCP 26130 [TCP segment of a reassembled PDU]
339   0.056994 54.230.149.215 -> 172.31.29.138 TCP 14546 [TCP segment of a reassembled PDU]
340   0.057024 172.31.29.138 -> 54.230.149.215 TCP 66 34575 > http [ACK] Seq=98 Ack=2244031 Win=923648 Len=0 TSval=14158514 TSecr=1455160274
341   0.057312 54.230.149.215 -> 172.31.29.138 TCP 7306 [TCP segment of a reassembled PDU]
342   0.057318 172.31.29.138 -> 54.230.149.215 TCP 66 34575 > http [ACK] Seq=98 Ack=2251271 Win=952192 Len=0 TSval=14158514 TSecr=1455160274
343   0.057429 54.230.149.215 -> 172.31.29.138 TCP 4410 [TCP segment of a reassembled PDU]
344   0.057433 172.31.29.138 -> 54.230.149.215 TCP 66 34575 > http [ACK] Seq=98 Ack=2255615 Win=956928 Len=0 TSval=14158514 TSecr=1455160274
345   0.057550 54.230.149.215 -> 172.31.29.138 TCP 2962 [TCP segment of a reassembled PDU]
346   0.057554 172.31.29.138 -> 54.230.149.215 TCP 66 34575 > http [ACK] Seq=98 Ack=2258511 Win=959360 Len=0 TSval=14158514 TSecr=1455160274
347   0.057741 54.230.149.215 -> 172.31.29.138 TCP 26130 [TCP segment of a reassembled PDU]
348   0.057763 172.31.29.138 -> 54.230.149.215 TCP 66 34575 > http [ACK] Seq=98 Ack=2284575 Win=933376 Len=0 TSval=14158514 TSecr=1455160274
349   0.057791 54.230.149.215 -> 172.31.29.138 TCP 21786 [TCP segment of a reassembled PDU]
350   0.057808 172.31.29.138 -> 54.230.149.215 TCP 66 34575 > http [ACK] Seq=98 Ack=2306295 Win=928384 Len=0 TSval=14158514 TSecr=1455160274
351   0.057824 54.230.149.215 -> 172.31.29.138 TCP 4410 [TCP segment of a reassembled PDU]
