[Measurement for 10kb at 11:36:42 20.36.2014] 
Tshark:

  1   0.000000 172.31.29.138 -> 172.31.0.2   DNS 89 Standard query 0x8a68  A d1dx94olpiqj0t.cloudfront.net
  2   0.000034 172.31.29.138 -> 172.31.0.2   DNS 89 Standard query 0x7db8  AAAA d1dx94olpiqj0t.cloudfront.net
  3   0.000544   172.31.0.2 -> 172.31.29.138 DNS 217 Standard query response 0x8a68  A 54.192.157.146 A 54.192.159.162 A 54.192.159.171 A 54.192.159.175 A 54.230.158.223 A 54.230.158.225 A 54.230.159.2 A 54.230.159.4
  4   0.000554   172.31.0.2 -> 172.31.29.138 DNS 176 Standard query response 0x7db8 
  5   0.003956 172.31.29.138 -> 54.192.157.146 TCP 74 60463 > http [SYN] Seq=0 Win=26883 Len=0 MSS=8961 SACK_PERM=1 TSval=16818874 TSecr=0 WS=128
  6   0.004718 54.192.157.146 -> 172.31.29.138 TCP 74 http > 60463 [SYN, ACK] Seq=0 Ack=1 Win=14480 Len=0 MSS=1460 SACK_PERM=1 TSval=732977674 TSecr=16818874 WS=128
  7   0.004731 172.31.29.138 -> 54.192.157.146 TCP 66 60463 > http [ACK] Seq=1 Ack=1 Win=27008 Len=0 TSval=16818875 TSecr=732977674
  8   0.004778 172.31.29.138 -> 54.192.157.146 HTTP 163 GET /10kb HTTP/1.1 
  9   0.005365 54.192.157.146 -> 172.31.29.138 TCP 66 http > 60463 [ACK] Seq=1 Ack=98 Win=14592 Len=0 TSval=732977674 TSecr=16818875
 10   0.028136 54.192.157.146 -> 172.31.29.138 TCP 1132 [TCP segment of a reassembled PDU]
 11   0.028145 172.31.29.138 -> 54.192.157.146 TCP 66 60463 > http [ACK] Seq=98 Ack=1067 Win=29056 Len=0 TSval=16818880 TSecr=732977677
 12   0.028157 54.192.157.146 -> 172.31.29.138 HTTP 9695 HTTP/1.1 200 OK  (application/octet-stream)
 13   0.028163 172.31.29.138 -> 54.192.157.146 TCP 66 60463 > http [ACK] Seq=98 Ack=10696 Win=48384 Len=0 TSval=16818880 TSecr=732977677
 14   0.028313 172.31.29.138 -> 54.192.157.146 TCP 66 60463 > http [FIN, ACK] Seq=98 Ack=10696 Win=48384 Len=0 TSval=16818880 TSecr=732977677
 15   0.028951 54.192.157.146 -> 172.31.29.138 TCP 66 http > 60463 [FIN, ACK] Seq=10696 Ack=99 Win=14592 Len=0 TSval=732977677 TSecr=16818880
 16   0.028959 172.31.29.138 -> 54.192.157.146 TCP 66 60463 > http [ACK] Seq=99 Ack=10697 Win=48384 Len=0 TSval=16818881 TSecr=732977677
