[Measurement for 10kb at 03:36:43 20.36.2014] 
Tshark:

  1   0.000000 172.31.29.138 -> 172.31.0.2   DNS 89 Standard query 0xf645  A d1dx94olpiqj0t.cloudfront.net
  2   0.000038 172.31.29.138 -> 172.31.0.2   DNS 89 Standard query 0x738b  AAAA d1dx94olpiqj0t.cloudfront.net
  3   0.000730   172.31.0.2 -> 172.31.29.138 DNS 176 Standard query response 0x738b 
  4   0.000740   172.31.0.2 -> 172.31.29.138 DNS 217 Standard query response 0xf645  A 54.192.159.98 A 54.192.159.165 A 54.192.159.180 A 54.230.158.139 A 54.230.158.189 A 54.230.159.137 A 54.192.157.149 A 54.192.157.157
  5   0.003860 172.31.29.138 -> 54.192.159.98 TCP 74 54723 > http [SYN] Seq=0 Win=26883 Len=0 MSS=8961 SACK_PERM=1 TSval=9618987 TSecr=0 WS=128
  6   0.004646 54.192.159.98 -> 172.31.29.138 TCP 74 http > 54723 [SYN, ACK] Seq=0 Ack=1 Win=14480 Len=0 MSS=1460 SACK_PERM=1 TSval=730101706 TSecr=9618987 WS=128
  7   0.004660 172.31.29.138 -> 54.192.159.98 TCP 66 54723 > http [ACK] Seq=1 Ack=1 Win=27008 Len=0 TSval=9618987 TSecr=730101706
  8   0.004699 172.31.29.138 -> 54.192.159.98 HTTP 163 GET /10kb HTTP/1.1 
  9   0.005294 54.192.159.98 -> 172.31.29.138 TCP 66 http > 54723 [ACK] Seq=1 Ack=98 Win=14592 Len=0 TSval=730101706 TSecr=9618987
 10   0.007316 54.192.159.98 -> 172.31.29.138 HTTP 10761 HTTP/1.1 200 OK  (application/octet-stream)
 11   0.007325 172.31.29.138 -> 54.192.159.98 TCP 66 54723 > http [ACK] Seq=98 Ack=10696 Win=48384 Len=0 TSval=9618987 TSecr=730101706
 12   0.007482 172.31.29.138 -> 54.192.159.98 TCP 66 54723 > http [FIN, ACK] Seq=98 Ack=10696 Win=48384 Len=0 TSval=9618987 TSecr=730101706
 13   0.008045 54.192.159.98 -> 172.31.29.138 TCP 66 http > 54723 [FIN, ACK] Seq=10696 Ack=99 Win=14592 Len=0 TSval=730101706 TSecr=9618987
 14   0.008053 172.31.29.138 -> 54.192.159.98 TCP 66 54723 > http [ACK] Seq=99 Ack=10697 Win=48384 Len=0 TSval=9618988 TSecr=730101706
