[Measurement for 10mb at 20:39:20 19.39.2014] 
Tshark:

  1   0.000000 172.31.29.138 -> 172.31.0.2   DNS 89 Standard query 0x52cd  A d1n0gskdvzj94j.cloudfront.net
  2   0.000026 172.31.29.138 -> 172.31.0.2   DNS 89 Standard query 0xdcac  AAAA d1n0gskdvzj94j.cloudfront.net
  3   0.000560   172.31.0.2 -> 172.31.29.138 DNS 217 Standard query response 0x52cd  A 54.230.158.80 A 54.230.158.182 A 54.230.158.246 A 54.230.158.252 A 54.230.159.4 A 54.192.157.146 A 54.230.156.193 A 54.230.157.230
  4   0.000571   172.31.0.2 -> 172.31.29.138 DNS 176 Standard query response 0xdcac 
  5   0.003843 172.31.29.138 -> 54.230.158.80 TCP 74 48622 > http [SYN] Seq=0 Win=26883 Len=0 MSS=8961 SACK_PERM=1 TSval=3358191 TSecr=0 WS=128
  6   0.004366 54.230.158.80 -> 172.31.29.138 TCP 74 http > 48622 [SYN, ACK] Seq=0 Ack=1 Win=14480 Len=0 MSS=1460 SACK_PERM=1 TSval=727597371 TSecr=3358191 WS=128
  7   0.004380 172.31.29.138 -> 54.230.158.80 TCP 66 48622 > http [ACK] Seq=1 Ack=1 Win=27008 Len=0 TSval=3358191 TSecr=727597371
  8   0.004421 172.31.29.138 -> 54.230.158.80 HTTP 163 GET /10mb HTTP/1.1 
  9   0.004887 54.230.158.80 -> 172.31.29.138 TCP 66 http > 48622 [ACK] Seq=1 Ack=98 Win=14592 Len=0 TSval=727597371 TSecr=3358191
 10   0.007189 54.230.158.80 -> 172.31.29.138 TCP 2592 [TCP segment of a reassembled PDU]
 11   0.007196 172.31.29.138 -> 54.230.158.80 TCP 66 48622 > http [ACK] Seq=98 Ack=2527 Win=32000 Len=0 TSval=3358191 TSecr=727597371
 12   0.007252 54.230.158.80 -> 172.31.29.138 TCP 11650 [TCP segment of a reassembled PDU]
 13   0.007262 172.31.29.138 -> 54.230.158.80 TCP 66 48622 > http [ACK] Seq=98 Ack=14111 Win=55168 Len=0 TSval=3358191 TSecr=727597371
 14   0.007983 54.230.158.80 -> 172.31.29.138 TCP 13098 [TCP segment of a reassembled PDU]
 15   0.007992 172.31.29.138 -> 54.230.158.80 TCP 66 48622 > http [ACK] Seq=98 Ack=27143 Win=81280 Len=0 TSval=3358192 TSecr=727597371
 16   0.008450 54.230.158.80 -> 172.31.29.138 TCP 4410 [TCP segment of a reassembled PDU]
 17   0.008456 172.31.29.138 -> 54.230.158.80 TCP 66 48622 > http [ACK] Seq=98 Ack=31487 Win=89856 Len=0 TSval=3358192 TSecr=727597371
 18   0.008505 54.230.158.80 -> 172.31.29.138 TCP 8754 [TCP segment of a reassembled PDU]
 19   0.008512 172.31.29.138 -> 54.230.158.80 TCP 66 48622 > http [ACK] Seq=98 Ack=40175 Win=107264 Len=0 TSval=3358192 TSecr=727597371
 20   0.008959 54.230.158.80 -> 172.31.29.138 TCP 7306 [TCP segment of a reassembled PDU]
 21   0.008966 172.31.29.138 -> 54.230.158.80 TCP 66 48622 > http [ACK] Seq=98 Ack=47415 Win=121728 Len=0 TSval=3358192 TSecr=727597371
 22   0.008994 54.230.158.80 -> 172.31.29.138 TCP 5858 [TCP segment of a reassembled PDU]
 23   0.009000 172.31.29.138 -> 54.230.158.80 TCP 66 48622 > http [ACK] Seq=98 Ack=53207 Win=133376 Len=0 TSval=3358192 TSecr=727597371
 24   0.009068 54.230.158.80 -> 172.31.29.138 TCP 8754 [TCP segment of a reassembled PDU]
 25   0.009075 172.31.29.138 -> 54.230.158.80 TCP 66 48622 > http [ACK] Seq=98 Ack=61895 Win=150784 Len=0 TSval=3358192 TSecr=727597371
 26   0.009446 54.230.158.80 -> 172.31.29.138 TCP 1514 [TCP segment of a reassembled PDU]
 27   0.009451 172.31.29.138 -> 54.230.158.80 TCP 66 48622 > http [ACK] Seq=98 Ack=63343 Win=153600 Len=0 TSval=3358192 TSecr=727597372
 28   0.009523 54.230.158.80 -> 172.31.29.138 TCP 2962 [TCP segment of a reassembled PDU]
 29   0.009527 172.31.29.138 -> 54.230.158.80 TCP 66 48622 > http [ACK] Seq=98 Ack=66239 Win=159360 Len=0 TSval=3358192 TSecr=727597372
 30   0.009736 54.230.158.80 -> 172.31.29.138 TCP 11650 [TCP segment of a reassembled PDU]
 31   0.009744 172.31.29.138 -> 54.230.158.80 TCP 66 48622 > http [ACK] Seq=98 Ack=77823 Win=179200 Len=0 TSval=3358192 TSecr=727597372
 32   0.009794 54.230.158.80 -> 172.31.29.138 TCP 10202 [TCP segment of a reassembled PDU]
 33   0.009801 172.31.29.138 -> 54.230.158.80 TCP 66 48622 > http [ACK] Seq=98 Ack=87959 Win=181632 Len=0 TSval=3358192 TSecr=727597372
 34   0.009960 54.230.158.80 -> 172.31.29.138 TCP 2962 [TCP segment of a reassembled PDU]
 35   0.009965 172.31.29.138 -> 54.230.158.80 TCP 66 48622 > http [ACK] Seq=98 Ack=90855 Win=188416 Len=0 TSval=3358192 TSecr=727597372
 36   0.010041 54.230.158.80 -> 172.31.29.138 TCP 4410 [TCP segment of a reassembled PDU]
 37   0.010046 172.31.29.138 -> 54.230.158.80 TCP 66 48622 > http [ACK] Seq=98 Ack=95199 Win=191104 Len=0 TSval=3358192 TSecr=727597372
 38   0.010338 54.230.158.80 -> 172.31.29.138 TCP 15994 [TCP segment of a reassembled PDU]
 39   0.010347 172.31.29.138 -> 54.230.158.80 TCP 66 48622 > http [ACK] Seq=98 Ack=111127 Win=175232 Len=0 TSval=3358192 TSecr=727597372
 40   0.010494 54.230.158.80 -> 172.31.29.138 TCP 10202 [TCP segment of a reassembled PDU]
 41   0.010501 172.31.29.138 -> 54.230.158.80 TCP 66 48622 > http [ACK] Seq=98 Ack=121263 Win=181632 Len=0 TSval=3358192 TSecr=727597372
 42   0.010585 54.230.158.80 -> 172.31.29.138 TCP 2962 [TCP segment of a reassembled PDU]
 43   0.010590 172.31.29.138 -> 54.230.158.80 TCP 66 48622 > http [ACK] Seq=98 Ack=124159 Win=193408 Len=0 TSval=3358192 TSecr=727597372
 44   0.010744 54.230.158.80 -> 172.31.29.138 TCP 2962 [TCP segment of a reassembled PDU]
 45   0.010750 172.31.29.138 -> 54.230.158.80 TCP 66 48622 > http [ACK] Seq=98 Ack=127055 Win=190592 Len=0 TSval=3358192 TSecr=727597372
 46   0.010985 54.230.158.80 -> 172.31.29.138 TCP 4410 [TCP segment of a reassembled PDU]
 47   0.010992 172.31.29.138 -> 54.230.158.80 TCP 66 48622 > http [ACK] Seq=98 Ack=131399 Win=191104 Len=0 TSval=3358192 TSecr=727597372
 48   0.011153 54.230.158.80 -> 172.31.29.138 TCP 27578 [TCP segment of a reassembled PDU]
 49   0.011165 172.31.29.138 -> 54.230.158.80 TCP 66 48622 > http [ACK] Seq=98 Ack=158911 Win=163712 Len=0 TSval=3358192 TSecr=727597372
 50   0.011554 54.230.158.80 -> 172.31.29.138 TCP 14546 [TCP segment of a reassembled PDU]
 51   0.011564 172.31.29.138 -> 54.230.158.80 TCP 66 48622 > http [ACK] Seq=98 Ack=173391 Win=174336 Len=0 TSval=3358192 TSecr=727597372
 52   0.011882 54.230.158.80 -> 172.31.29.138 TCP 17442 [TCP segment of a reassembled PDU]
 53   0.011906 172.31.29.138 -> 54.230.158.80 TCP 66 48622 > http [ACK] Seq=98 Ack=190767 Win=197120 Len=0 TSval=3358193 TSecr=727597372
 54   0.012030 54.230.158.80 -> 172.31.29.138 TCP 8754 [TCP segment of a reassembled PDU]
 55   0.012037 172.31.29.138 -> 54.230.158.80 TCP 66 48622 > http [ACK] Seq=98 Ack=199455 Win=214400 Len=0 TSval=3358193 TSecr=727597372
 56   0.012177 54.230.158.80 -> 172.31.29.138 TCP 18890 [TCP segment of a reassembled PDU]
 57   0.012188 172.31.29.138 -> 54.230.158.80 TCP 66 48622 > http [ACK] Seq=98 Ack=218279 Win=252032 Len=0 TSval=3358193 TSecr=727597372
 58   0.012572 54.230.158.80 -> 172.31.29.138 TCP 7306 [TCP segment of a reassembled PDU]
 59   0.012579 172.31.29.138 -> 54.230.158.80 TCP 66 48622 > http [ACK] Seq=98 Ack=225519 Win=266624 Len=0 TSval=3358193 TSecr=727597372
 60   0.012678 54.230.158.80 -> 172.31.29.138 TCP 11650 [TCP segment of a reassembled PDU]
 61   0.012686 172.31.29.138 -> 54.230.158.80 TCP 66 48622 > http [ACK] Seq=98 Ack=237103 Win=289792 Len=0 TSval=3358193 TSecr=727597372
 62   0.012916 54.230.158.80 -> 172.31.29.138 TCP 14546 [TCP segment of a reassembled PDU]
 63   0.012925 172.31.29.138 -> 54.230.158.80 TCP 66 48622 > http [ACK] Seq=98 Ack=251583 Win=318720 Len=0 TSval=3358193 TSecr=727597372
 64   0.013063 54.230.158.80 -> 172.31.29.138 TCP 8754 [TCP segment of a reassembled PDU]
 65   0.013071 172.31.29.138 -> 54.230.158.80 TCP 66 48622 > http [ACK] Seq=98 Ack=260271 Win=336128 Len=0 TSval=3358193 TSecr=727597372
 66   0.013211 54.230.158.80 -> 172.31.29.138 TCP 15994 [TCP segment of a reassembled PDU]
 67   0.013220 172.31.29.138 -> 54.230.158.80 TCP 66 48622 > http [ACK] Seq=98 Ack=276199 Win=367872 Len=0 TSval=3358193 TSecr=727597372
 68   0.013555 54.230.158.80 -> 172.31.29.138 TCP 5858 [TCP segment of a reassembled PDU]
 69   0.013562 172.31.29.138 -> 54.230.158.80 TCP 66 48622 > http [ACK] Seq=98 Ack=281991 Win=379520 Len=0 TSval=3358193 TSecr=727597372
 70   0.013751 54.230.158.80 -> 172.31.29.138 TCP 26130 [TCP segment of a reassembled PDU]
 71   0.013764 172.31.29.138 -> 54.230.158.80 TCP 66 48622 > http [ACK] Seq=98 Ack=308055 Win=431616 Len=0 TSval=3358193 TSecr=727597372
 72   0.013773 54.230.158.80 -> 172.31.29.138 TCP 4410 [TCP segment of a reassembled PDU]
 73   0.013777 172.31.29.138 -> 54.230.158.80 TCP 66 48622 > http [ACK] Seq=98 Ack=312399 Win=440320 Len=0 TSval=3358193 TSecr=727597372
 74   0.013970 54.230.158.80 -> 172.31.29.138 TCP 20338 [TCP segment of a reassembled PDU]
 75   0.013982 172.31.29.138 -> 54.230.158.80 TCP 66 48622 > http [ACK] Seq=98 Ack=332671 Win=480896 Len=0 TSval=3358193 TSecr=727597372
 76   0.014351 54.230.158.80 -> 172.31.29.138 TCP 11650 [TCP segment of a reassembled PDU]
 77   0.014359 172.31.29.138 -> 54.230.158.80 TCP 66 48622 > http [ACK] Seq=98 Ack=344255 Win=504064 Len=0 TSval=3358193 TSecr=727597372
 78   0.014524 54.230.158.80 -> 172.31.29.138 TCP 23234 [TCP segment of a reassembled PDU]
 79   0.014536 172.31.29.138 -> 54.230.158.80 TCP 66 48622 > http [ACK] Seq=98 Ack=367423 Win=550400 Len=0 TSval=3358193 TSecr=727597372
 80   0.014734 54.230.158.80 -> 172.31.29.138 TCP 10202 [TCP segment of a reassembled PDU]
 81   0.014742 172.31.29.138 -> 54.230.158.80 TCP 66 48622 > http [ACK] Seq=98 Ack=377559 Win=570624 Len=0 TSval=3358193 TSecr=727597372
 82   0.014866 54.230.158.80 -> 172.31.29.138 TCP 4410 [TCP segment of a reassembled PDU]
 83   0.014872 172.31.29.138 -> 54.230.158.80 TCP 66 48622 > http [ACK] Seq=98 Ack=381903 Win=579328 Len=0 TSval=3358193 TSecr=727597372
 84   0.015056 54.230.158.80 -> 172.31.29.138 TCP 26130 [TCP segment of a reassembled PDU]
 85   0.015068 172.31.29.138 -> 54.230.158.80 TCP 66 48622 > http [ACK] Seq=98 Ack=407967 Win=631424 Len=0 TSval=3358193 TSecr=727597372
 86   0.015202 54.230.158.80 -> 172.31.29.138 TCP 24682 [TCP segment of a reassembled PDU]
 87   0.015215 172.31.29.138 -> 54.230.158.80 TCP 66 48622 > http [ACK] Seq=98 Ack=432583 Win=680704 Len=0 TSval=3358193 TSecr=727597372
 88   0.015385 54.230.158.80 -> 172.31.29.138 TCP 10202 [TCP segment of a reassembled PDU]
 89   0.015393 172.31.29.138 -> 54.230.158.80 TCP 66 48622 > http [ACK] Seq=98 Ack=442719 Win=700928 Len=0 TSval=3358193 TSecr=727597372
 90   0.015710 54.230.158.80 -> 172.31.29.138 TCP 24682 [TCP segment of a reassembled PDU]
 91   0.015723 172.31.29.138 -> 54.230.158.80 TCP 66 48622 > http [ACK] Seq=98 Ack=467335 Win=750208 Len=0 TSval=3358194 TSecr=727597372
 92   0.015817 54.230.158.80 -> 172.31.29.138 TCP 10202 [TCP segment of a reassembled PDU]
 93   0.015825 172.31.29.138 -> 54.230.158.80 TCP 66 48622 > http [ACK] Seq=98 Ack=477471 Win=770432 Len=0 TSval=3358194 TSecr=727597372
 94   0.015944 54.230.158.80 -> 172.31.29.138 TCP 17442 [TCP segment of a reassembled PDU]
 95   0.015955 172.31.29.138 -> 54.230.158.80 TCP 66 48622 > http [ACK] Seq=98 Ack=494847 Win=805248 Len=0 TSval=3358194 TSecr=727597372
 96   0.016010 54.230.158.80 -> 172.31.29.138 TCP 13098 [TCP segment of a reassembled PDU]
 97   0.016019 172.31.29.138 -> 54.230.158.80 TCP 66 48622 > http [ACK] Seq=98 Ack=507879 Win=831232 Len=0 TSval=3358194 TSecr=727597372
 98   0.016369 54.230.158.80 -> 172.31.29.138 TCP 4410 [TCP segment of a reassembled PDU]
 99   0.016376 172.31.29.138 -> 54.230.158.80 TCP 66 48622 > http [ACK] Seq=98 Ack=512223 Win=839936 Len=0 TSval=3358194 TSecr=727597372
100   0.016588 54.230.158.80 -> 172.31.29.138 TCP 29026 [TCP segment of a reassembled PDU]
101   0.016603 172.31.29.138 -> 54.230.158.80 TCP 66 48622 > http [ACK] Seq=98 Ack=541183 Win=897920 Len=0 TSval=3358194 TSecr=727597372
102   0.016625 54.230.158.80 -> 172.31.29.138 TCP 2962 [TCP segment of a reassembled PDU]
103   0.016631 172.31.29.138 -> 54.230.158.80 TCP 66 48622 > http [ACK] Seq=98 Ack=544079 Win=903680 Len=0 TSval=3358194 TSecr=727597372
104   0.016815 54.230.158.80 -> 172.31.29.138 TCP 26130 [TCP segment of a reassembled PDU]
105   0.016828 172.31.29.138 -> 54.230.158.80 TCP 66 48622 > http [ACK] Seq=98 Ack=570143 Win=955776 Len=0 TSval=3358194 TSecr=727597372
106   0.016835 54.230.158.80 -> 172.31.29.138 TCP 2962 [TCP segment of a reassembled PDU]
107   0.016851 172.31.29.138 -> 54.230.158.80 TCP 66 48622 > http [ACK] Seq=98 Ack=573039 Win=961664 Len=0 TSval=3358194 TSecr=727597372
108   0.017142 54.230.158.80 -> 172.31.29.138 TCP 7306 [TCP segment of a reassembled PDU]
109   0.017150 172.31.29.138 -> 54.230.158.80 TCP 66 48622 > http [ACK] Seq=98 Ack=580279 Win=976128 Len=0 TSval=3358194 TSecr=727597372
110   0.017329 54.230.158.80 -> 172.31.29.138 TCP 23234 [TCP segment of a reassembled PDU]
111   0.017341 172.31.29.138 -> 54.230.158.80 TCP 66 48622 > http [ACK] Seq=98 Ack=603447 Win=1022464 Len=0 TSval=3358194 TSecr=727597372
112   0.017437 54.230.158.80 -> 172.31.29.138 TCP 26130 [TCP segment of a reassembled PDU]
113   0.017451 172.31.29.138 -> 54.230.158.80 TCP 66 48622 > http [ACK] Seq=98 Ack=629511 Win=1074560 Len=0 TSval=3358194 TSecr=727597372
114   0.017523 54.230.158.80 -> 172.31.29.138 TCP 8754 [TCP segment of a reassembled PDU]
115   0.017531 172.31.29.138 -> 54.230.158.80 TCP 66 48622 > http [ACK] Seq=98 Ack=638199 Win=1091968 Len=0 TSval=3358194 TSecr=727597372
116   0.017838 54.230.158.80 -> 172.31.29.138 TCP 27578 [TCP segment of a reassembled PDU]
117   0.017853 172.31.29.138 -> 54.230.158.80 TCP 66 48622 > http [ACK] Seq=98 Ack=665711 Win=1147008 Len=0 TSval=3358194 TSecr=727597372
118   0.017860 54.230.158.80 -> 172.31.29.138 TCP 1514 [TCP segment of a reassembled PDU]
119   0.017863 172.31.29.138 -> 54.230.158.80 TCP 66 48622 > http [ACK] Seq=98 Ack=667159 Win=1149824 Len=0 TSval=3358194 TSecr=727597372
120   0.017933 54.230.158.80 -> 172.31.29.138 TCP 7306 [TCP segment of a reassembled PDU]
121   0.017940 172.31.29.138 -> 54.230.158.80 TCP 66 48622 > http [ACK] Seq=98 Ack=674399 Win=1164288 Len=0 TSval=3358194 TSecr=727597372
122   0.018116 54.230.158.80 -> 172.31.29.138 TCP 27578 [TCP segment of a reassembled PDU]
123   0.018130 172.31.29.138 -> 54.230.158.80 TCP 66 48622 > http [ACK] Seq=98 Ack=701911 Win=1219328 Len=0 TSval=3358194 TSecr=727597372
124   0.018137 54.230.158.80 -> 172.31.29.138 TCP 1514 [TCP segment of a reassembled PDU]
125   0.018139 172.31.29.138 -> 54.230.158.80 TCP 66 48622 > http [ACK] Seq=98 Ack=703359 Win=1222272 Len=0 TSval=3358194 TSecr=727597372
126   0.018601 54.230.158.80 -> 172.31.29.138 TCP 24682 [TCP segment of a reassembled PDU]
127   0.018614 172.31.29.138 -> 54.230.158.80 TCP 66 48622 > http [ACK] Seq=98 Ack=727975 Win=1271424 Len=0 TSval=3358194 TSecr=727597372
128   0.018740 54.230.158.80 -> 172.31.29.138 TCP 40610 [TCP segment of a reassembled PDU]
129   0.018758 172.31.29.138 -> 54.230.158.80 TCP 66 48622 > http [ACK] Seq=98 Ack=768519 Win=1302784 Len=0 TSval=3358194 TSecr=727597372
130   0.018831 54.230.158.80 -> 172.31.29.138 TCP 21786 [TCP segment of a reassembled PDU]
131   0.018842 172.31.29.138 -> 54.230.158.80 TCP 66 48622 > http [ACK] Seq=98 Ack=790239 Win=1333888 Len=0 TSval=3358194 TSecr=727597372
132   0.018899 54.230.158.80 -> 172.31.29.138 TCP 11650 [TCP segment of a reassembled PDU]
133   0.019007 172.31.29.138 -> 54.230.158.80 TCP 66 48622 > http [ACK] Seq=98 Ack=801823 Win=1322368 Len=0 TSval=3358194 TSecr=727597372
134   0.019570 54.230.158.80 -> 172.31.29.138 TCP 4410 [TCP segment of a reassembled PDU]
135   0.019577 172.31.29.138 -> 54.230.158.80 TCP 66 48622 > http [ACK] Seq=98 Ack=806167 Win=1361280 Len=0 TSval=3358194 TSecr=727597373
136   0.019754 54.230.158.80 -> 172.31.29.138 TCP 26130 [TCP segment of a reassembled PDU]
137   0.019784 54.230.158.80 -> 172.31.29.138 TCP 20338 [TCP segment of a reassembled PDU]
138   0.019807 172.31.29.138 -> 54.230.158.80 TCP 66 48622 > http [ACK] Seq=98 Ack=852503 Win=1314944 Len=0 TSval=3358195 TSecr=727597373
139   0.019939 54.230.158.80 -> 172.31.29.138 TCP 46402 [TCP segment of a reassembled PDU]
140   0.019976 172.31.29.138 -> 54.230.158.80 TCP 66 48622 > http [ACK] Seq=98 Ack=898839 Win=1293312 Len=0 TSval=3358195 TSecr=727597373
141   0.020587 54.230.158.80 -> 172.31.29.138 TCP 2962 [TCP segment of a reassembled PDU]
142   0.020593 172.31.29.138 -> 54.230.158.80 TCP 66 48622 > http [ACK] Seq=98 Ack=901735 Win=1363712 Len=0 TSval=3358195 TSecr=727597373
143   0.020797 54.230.158.80 -> 172.31.29.138 TCP 26130 [TCP segment of a reassembled PDU]
144   0.020818 54.230.158.80 -> 172.31.29.138 TCP 11650 [TCP segment of a reassembled PDU]
145   0.020834 54.230.158.80 -> 172.31.29.138 TCP 14546 [TCP segment of a reassembled PDU]
146   0.020854 54.230.158.80 -> 172.31.29.138 TCP 7306 [TCP segment of a reassembled PDU]
147   0.020866 172.31.29.138 -> 54.230.158.80 TCP 66 48622 > http [ACK] Seq=98 Ack=961103 Win=1304448 Len=0 TSval=3358195 TSecr=727597373
148   0.020906 54.230.158.80 -> 172.31.29.138 TCP 18890 [TCP segment of a reassembled PDU]
149   0.020916 172.31.29.138 -> 54.230.158.80 TCP 66 48622 > http [ACK] Seq=98 Ack=979927 Win=1338624 Len=0 TSval=3358195 TSecr=727597373
150   0.021007 54.230.158.80 -> 172.31.29.138 TCP 27578 [TCP segment of a reassembled PDU]
151   0.021033 172.31.29.138 -> 54.230.158.80 TCP 66 48622 > http [ACK] Seq=98 Ack=1007439 Win=1324288 Len=0 TSval=3358195 TSecr=727597373
152   0.021644 54.230.158.80 -> 172.31.29.138 TCP 7306 [TCP segment of a reassembled PDU]
153   0.021652 172.31.29.138 -> 54.230.158.80 TCP 66 48622 > http [ACK] Seq=98 Ack=1014679 Win=1357696 Len=0 TSval=3358195 TSecr=727597373
154   0.021834 54.230.158.80 -> 172.31.29.138 TCP 26130 [TCP segment of a reassembled PDU]
155   0.021879 54.230.158.80 -> 172.31.29.138 TCP 26130 [TCP segment of a reassembled PDU]
156   0.021892 54.230.158.80 -> 172.31.29.138 TCP 2962 [TCP segment of a reassembled PDU]
157   0.021899 172.31.29.138 -> 54.230.158.80 TCP 66 48622 > http [ACK] Seq=98 Ack=1069703 Win=1302784 Len=0 TSval=3358195 TSecr=727597373
158   0.021965 54.230.158.80 -> 172.31.29.138 TCP 24682 [TCP segment of a reassembled PDU]
159   0.021978 172.31.29.138 -> 54.230.158.80 TCP 66 48622 > http [ACK] Seq=98 Ack=1094319 Win=1329152 Len=0 TSval=3358195 TSecr=727597373
160   0.022655 54.230.158.80 -> 172.31.29.138 TCP 4410 [TCP segment of a reassembled PDU]
161   0.022661 172.31.29.138 -> 54.230.158.80 TCP 66 48622 > http [ACK] Seq=98 Ack=1098663 Win=1362432 Len=0 TSval=3358195 TSecr=727597373
162   0.022847 54.230.158.80 -> 172.31.29.138 TCP 26130 [TCP segment of a reassembled PDU]
163   0.022862 54.230.158.80 -> 172.31.29.138 TCP 4410 [TCP segment of a reassembled PDU]
164   0.022877 172.31.29.138 -> 54.230.158.80 TCP 66 48622 > http [ACK] Seq=98 Ack=1129071 Win=1332096 Len=0 TSval=3358195 TSecr=727597373
165   0.022933 54.230.158.80 -> 172.31.29.138 TCP 21786 [TCP segment of a reassembled PDU]
166   0.022944 172.31.29.138 -> 54.230.158.80 TCP 66 48622 > http [ACK] Seq=98 Ack=1150791 Win=1333888 Len=0 TSval=3358195 TSecr=727597373
167   0.023051 54.230.158.80 -> 172.31.29.138 TCP 36266 [TCP segment of a reassembled PDU]
168   0.023140 54.230.158.80 -> 172.31.29.138 TCP 26130 [TCP segment of a reassembled PDU]
169   0.023160 172.31.29.138 -> 54.230.158.80 TCP 66 48622 > http [ACK] Seq=98 Ack=1213055 Win=1271680 Len=0 TSval=3358195 TSecr=727597373
170   0.023682 54.230.158.80 -> 172.31.29.138 TCP 2962 [TCP segment of a reassembled PDU]
171   0.023688 172.31.29.138 -> 54.230.158.80 TCP 66 48622 > http [ACK] Seq=98 Ack=1215951 Win=1363712 Len=0 TSval=3358195 TSecr=727597373
172   0.023830 54.230.158.80 -> 172.31.29.138 TCP 8754 [TCP segment of a reassembled PDU]
173   0.023849 172.31.29.138 -> 54.230.158.80 TCP 66 48622 > http [ACK] Seq=98 Ack=1224639 Win=1363712 Len=0 TSval=3358196 TSecr=727597373
174   0.023919 54.230.158.80 -> 172.31.29.138 TCP 24682 [TCP segment of a reassembled PDU]
175   0.023944 172.31.29.138 -> 54.230.158.80 TCP 66 48622 > http [ACK] Seq=98 Ack=1249255 Win=1339136 Len=0 TSval=3358196 TSecr=727597373
176   0.024135 54.230.158.80 -> 172.31.29.138 TCP 62330 [TCP segment of a reassembled PDU]
177   0.024170 172.31.29.138 -> 54.230.158.80 TCP 66 48622 > http [ACK] Seq=98 Ack=1311519 Win=1276928 Len=0 TSval=3358196 TSecr=727597373
178   0.024234 54.230.158.80 -> 172.31.29.138 TCP 26130 [TCP segment of a reassembled PDU]
179   0.024247 172.31.29.138 -> 54.230.158.80 TCP 66 48622 > http [ACK] Seq=98 Ack=1337583 Win=1326720 Len=0 TSval=3358196 TSecr=727597373
180   0.024647 54.230.158.80 -> 172.31.29.138 TCP 17442 [TCP segment of a reassembled PDU]
181   0.024658 172.31.29.138 -> 54.230.158.80 TCP 66 48622 > http [ACK] Seq=98 Ack=1354959 Win=1340928 Len=0 TSval=3358196 TSecr=727597373
182   0.024813 54.230.158.80 -> 172.31.29.138 TCP 4410 [TCP segment of a reassembled PDU]
183   0.024819 172.31.29.138 -> 54.230.158.80 TCP 66 48622 > http [ACK] Seq=98 Ack=1359303 Win=1362432 Len=0 TSval=3358196 TSecr=727597373
184   0.024986 54.230.158.80 -> 172.31.29.138 TCP 26130 [TCP segment of a reassembled PDU]
185   0.025003 54.230.158.80 -> 172.31.29.138 TCP 5858 [TCP segment of a reassembled PDU]
186   0.025022 54.230.158.80 -> 172.31.29.138 TCP 20338 [TCP segment of a reassembled PDU]
187   0.025037 54.230.158.80 -> 172.31.29.138 TCP 10202 [TCP segment of a reassembled PDU]
188   0.025054 172.31.29.138 -> 54.230.158.80 TCP 66 48622 > http [ACK] Seq=98 Ack=1421567 Win=1300224 Len=0 TSval=3358196 TSecr=727597373
189   0.025104 54.230.158.80 -> 172.31.29.138 TCP 15994 [TCP segment of a reassembled PDU]
190   0.025115 172.31.29.138 -> 54.230.158.80 TCP 66 48622 > http [ACK] Seq=98 Ack=1437495 Win=1343360 Len=0 TSval=3358196 TSecr=727597373
191   0.025208 54.230.158.80 -> 172.31.29.138 TCP 31922 [TCP segment of a reassembled PDU]
192   0.025236 172.31.29.138 -> 54.230.158.80 TCP 66 48622 > http [ACK] Seq=98 Ack=1469351 Win=1317120 Len=0 TSval=3358196 TSecr=727597373
193   0.025313 54.230.158.80 -> 172.31.29.138 TCP 1514 [TCP segment of a reassembled PDU]
194   0.025467 54.230.158.80 -> 172.31.29.138 TCP 14546 [TCP segment of a reassembled PDU]
195   0.025477 172.31.29.138 -> 54.230.158.80 TCP 66 48622 > http [ACK] Seq=98 Ack=1485279 Win=1345664 Len=0 TSval=3358196 TSecr=727597373
196   0.025586 54.230.158.80 -> 172.31.29.138 TCP 5858 [TCP segment of a reassembled PDU]
197   0.025592 172.31.29.138 -> 54.230.158.80 TCP 66 48622 > http [ACK] Seq=98 Ack=1491071 Win=1360000 Len=0 TSval=3358196 TSecr=727597373
198   0.025762 54.230.158.80 -> 172.31.29.138 TCP 26130 [TCP segment of a reassembled PDU]
199   0.025784 54.230.158.80 -> 172.31.29.138 TCP 14546 [TCP segment of a reassembled PDU]
200   0.025802 172.31.29.138 -> 54.230.158.80 TCP 66 48622 > http [ACK] Seq=98 Ack=1531615 Win=1319552 Len=0 TSval=3358196 TSecr=727597373
201   0.025835 54.230.158.80 -> 172.31.29.138 TCP 18890 [TCP segment of a reassembled PDU]
202   0.025850 172.31.29.138 -> 54.230.158.80 TCP 66 48622 > http [ACK] Seq=98 Ack=1550439 Win=1338624 Len=0 TSval=3358196 TSecr=727597373
203   0.026023 54.230.158.80 -> 172.31.29.138 TCP 29026 [TCP segment of a reassembled PDU]
204   0.026048 172.31.29.138 -> 54.230.158.80 TCP 66 48622 > http [ACK] Seq=98 Ack=1579399 Win=1321856 Len=0 TSval=3358196 TSecr=727597373
205   0.026117 54.230.158.80 -> 172.31.29.138 TCP 29026 [TCP segment of a reassembled PDU]
206   0.026130 172.31.29.138 -> 54.230.158.80 TCP 66 48622 > http [ACK] Seq=98 Ack=1608359 Win=1321856 Len=0 TSval=3358196 TSecr=727597373
207   0.026197 54.230.158.80 -> 172.31.29.138 TCP 7306 [TCP segment of a reassembled PDU]
208   0.026256 172.31.29.138 -> 54.230.158.80 TCP 66 48622 > http [ACK] Seq=98 Ack=1615599 Win=1314688 Len=0 TSval=3358196 TSecr=727597373
209   0.026487 54.230.158.80 -> 172.31.29.138 TCP 26130 [TCP segment of a reassembled PDU]
210   0.026500 172.31.29.138 -> 54.230.158.80 TCP 66 48622 > http [ACK] Seq=98 Ack=1641663 Win=1326720 Len=0 TSval=3358196 TSecr=727597373
211   0.026630 54.230.158.80 -> 172.31.29.138 TCP 39162 [TCP segment of a reassembled PDU]
212   0.026661 172.31.29.138 -> 54.230.158.80 TCP 66 48622 > http [ACK] Seq=98 Ack=1680759 Win=1305344 Len=0 TSval=3358196 TSecr=727597373
213   0.026721 54.230.158.80 -> 172.31.29.138 TCP 23234 [TCP segment of a reassembled PDU]
214   0.026732 172.31.29.138 -> 54.230.158.80 TCP 66 48622 > http [ACK] Seq=98 Ack=1703927 Win=1331456 Len=0 TSval=3358196 TSecr=727597373
215   0.026875 54.230.158.80 -> 172.31.29.138 TCP 42058 [TCP segment of a reassembled PDU]
216   0.026900 172.31.29.138 -> 54.230.158.80 TCP 66 48622 > http [ACK] Seq=98 Ack=1745919 Win=1300480 Len=0 TSval=3358196 TSecr=727597373
217   0.027177 54.230.158.80 -> 172.31.29.138 TCP 17442 [TCP segment of a reassembled PDU]
218   0.027187 172.31.29.138 -> 54.230.158.80 TCP 66 48622 > http [ACK] Seq=98 Ack=1763295 Win=1340928 Len=0 TSval=3358196 TSecr=727597373
219   0.027309 54.230.158.80 -> 172.31.29.138 TCP 26130 [TCP segment of a reassembled PDU]
220   0.027333 172.31.29.138 -> 54.230.158.80 TCP 66 48622 > http [ACK] Seq=98 Ack=1789359 Win=1326720 Len=0 TSval=3358196 TSecr=727597373
221   0.027356 54.230.158.80 -> 172.31.29.138 TCP 21786 [TCP segment of a reassembled PDU]
222   0.027376 172.31.29.138 -> 54.230.158.80 TCP 66 48622 > http [ACK] Seq=98 Ack=1811079 Win=1333888 Len=0 TSval=3358196 TSecr=727597373
223   0.027449 54.230.158.80 -> 172.31.29.138 TCP 26130 [TCP segment of a reassembled PDU]
224   0.027549 54.230.158.80 -> 172.31.29.138 TCP 36266 [TCP segment of a reassembled PDU]
225   0.027574 54.230.158.80 -> 172.31.29.138 TCP 2962 [TCP segment of a reassembled PDU]
226   0.027597 172.31.29.138 -> 54.230.158.80 TCP 66 48622 > http [ACK] Seq=98 Ack=1876239 Win=1268736 Len=0 TSval=3358196 TSecr=727597373
227   0.027894 54.230.158.80 -> 172.31.29.138 TCP 4410 [TCP segment of a reassembled PDU]
228   0.027900 172.31.29.138 -> 54.230.158.80 TCP 66 48622 > http [ACK] Seq=98 Ack=1880583 Win=1362432 Len=0 TSval=3358197 TSecr=727597373
229   0.028084 54.230.158.80 -> 172.31.29.138 TCP 24682 [TCP segment of a reassembled PDU]
230   0.028092 172.31.29.138 -> 54.230.158.80 TCP 66 48622 > http [ACK] Seq=98 Ack=1905199 Win=1412992 Len=0 TSval=3358197 TSecr=727597373
231   0.028097 54.230.158.80 -> 172.31.29.138 TCP 1514 [TCP Previous segment not captured] [TCP segment of a reassembled PDU]
232   0.028100 172.31.29.138 -> 54.230.158.80 TCP 78 [TCP Window Update] 48622 > http [ACK] Seq=98 Ack=1905199 Win=1415808 Len=0 TSval=3358197 TSecr=727597373 SLE=1906647 SRE=1908095
233   0.028101 54.230.158.80 -> 172.31.29.138 TCP 1514 [TCP Out-Of-Order] [TCP segment of a reassembled PDU]
234   0.028104 172.31.29.138 -> 54.230.158.80 TCP 66 48622 > http [ACK] Seq=98 Ack=1908095 Win=1418752 Len=0 TSval=3358197 TSecr=727597373
235   0.028172 54.230.158.80 -> 172.31.29.138 TCP 26130 [TCP segment of a reassembled PDU]
236   0.028178 172.31.29.138 -> 54.230.158.80 TCP 66 48622 > http [ACK] Seq=98 Ack=1934159 Win=1470848 Len=0 TSval=3358197 TSecr=727597373
237   0.028385 54.230.158.80 -> 172.31.29.138 TCP 49298 [TCP segment of a reassembled PDU]
238   0.028395 172.31.29.138 -> 54.230.158.80 TCP 66 48622 > http [ACK] Seq=98 Ack=1983391 Win=1569408 Len=0 TSval=3358197 TSecr=727597373
239   0.028467 54.230.158.80 -> 172.31.29.138 TCP 23234 [TCP segment of a reassembled PDU]
240   0.028474 172.31.29.138 -> 54.230.158.80 TCP 66 48622 > http [ACK] Seq=98 Ack=2006559 Win=1615744 Len=0 TSval=3358197 TSecr=727597373
241   0.028925 54.230.158.80 -> 172.31.29.138 TCP 7306 [TCP segment of a reassembled PDU]
242   0.028930 172.31.29.138 -> 54.230.158.80 TCP 66 48622 > http [ACK] Seq=98 Ack=2013799 Win=1615744 Len=0 TSval=3358197 TSecr=727597373
243   0.029102 54.230.158.80 -> 172.31.29.138 TCP 26130 [TCP segment of a reassembled PDU]
244   0.029109 172.31.29.138 -> 54.230.158.80 TCP 66 48622 > http [ACK] Seq=98 Ack=2039863 Win=1615744 Len=0 TSval=3358197 TSecr=727597373
245   0.029117 54.230.158.80 -> 172.31.29.138 TCP 5858 [TCP segment of a reassembled PDU]
246   0.029119 172.31.29.138 -> 54.230.158.80 TCP 66 48622 > http [ACK] Seq=98 Ack=2045655 Win=1615744 Len=0 TSval=3358197 TSecr=727597373
247   0.029194 54.230.158.80 -> 172.31.29.138 TCP 20338 [TCP segment of a reassembled PDU]
248   0.029200 172.31.29.138 -> 54.230.158.80 TCP 66 48622 > http [ACK] Seq=98 Ack=2065927 Win=1615744 Len=0 TSval=3358197 TSecr=727597373
249   0.029329 54.230.158.80 -> 172.31.29.138 TCP 5858 [TCP segment of a reassembled PDU]
250   0.029333 172.31.29.138 -> 54.230.158.80 TCP 66 48622 > http [ACK] Seq=98 Ack=2071719 Win=1615744 Len=0 TSval=3358197 TSecr=727597373
251   0.029357 54.230.158.80 -> 172.31.29.138 TCP 30474 [TCP segment of a reassembled PDU]
252   0.029363 172.31.29.138 -> 54.230.158.80 TCP 66 48622 > http [ACK] Seq=98 Ack=2102127 Win=1615744 Len=0 TSval=3358197 TSecr=727597374
253   0.029458 54.230.158.80 -> 172.31.29.138 TCP 34818 [TCP segment of a reassembled PDU]
254   0.029466 172.31.29.138 -> 54.230.158.80 TCP 66 48622 > http [ACK] Seq=98 Ack=2136879 Win=1615744 Len=0 TSval=3358197 TSecr=727597374
255   0.029916 54.230.158.80 -> 172.31.29.138 TCP 27578 [TCP segment of a reassembled PDU]
256   0.029924 172.31.29.138 -> 54.230.158.80 TCP 66 48622 > http [ACK] Seq=98 Ack=2164391 Win=1615744 Len=0 TSval=3358197 TSecr=727597374
257   0.030098 54.230.158.80 -> 172.31.29.138 TCP 37714 [TCP segment of a reassembled PDU]
258   0.030119 172.31.29.138 -> 54.230.158.80 TCP 66 48622 > http [ACK] Seq=98 Ack=2202039 Win=1615744 Len=0 TSval=3358197 TSecr=727597374
259   0.030145 54.230.158.80 -> 172.31.29.138 TCP 20338 [TCP segment of a reassembled PDU]
260   0.030150 172.31.29.138 -> 54.230.158.80 TCP 66 48622 > http [ACK] Seq=98 Ack=2222311 Win=1615744 Len=0 TSval=3358197 TSecr=727597374
261   0.030156 54.230.158.80 -> 172.31.29.138 TCP 4410 [TCP segment of a reassembled PDU]
262   0.030158 172.31.29.138 -> 54.230.158.80 TCP 66 48622 > http [ACK] Seq=98 Ack=2226655 Win=1615744 Len=0 TSval=3358197 TSecr=727597374
263   0.030277 54.230.158.80 -> 172.31.29.138 TCP 40610 [TCP segment of a reassembled PDU]
264   0.030286 172.31.29.138 -> 54.230.158.80 TCP 66 48622 > http [ACK] Seq=98 Ack=2267199 Win=1615744 Len=0 TSval=3358197 TSecr=727597374
265   0.030733 54.230.158.80 -> 172.31.29.138 TCP 5858 [TCP segment of a reassembled PDU]
266   0.030738 172.31.29.138 -> 54.230.158.80 TCP 66 48622 > http [ACK] Seq=98 Ack=2272991 Win=1615744 Len=0 TSval=3358197 TSecr=727597374
267   0.030932 54.230.158.80 -> 172.31.29.138 TCP 26130 [TCP segment of a reassembled PDU]
268   0.030938 172.31.29.138 -> 54.230.158.80 TCP 66 48622 > http [ACK] Seq=98 Ack=2299055 Win=1615744 Len=0 TSval=3358197 TSecr=727597374
269   0.030947 54.230.158.80 -> 172.31.29.138 TCP 4410 [TCP segment of a reassembled PDU]
270   0.030949 172.31.29.138 -> 54.230.158.80 TCP 66 48622 > http [ACK] Seq=98 Ack=2303399 Win=1615744 Len=0 TSval=3358197 TSecr=727597374
271   0.030958 54.230.158.80 -> 172.31.29.138 TCP 14546 [TCP segment of a reassembled PDU]
272   0.030961 172.31.29.138 -> 54.230.158.80 TCP 66 48622 > http [ACK] Seq=98 Ack=2317879 Win=1615744 Len=0 TSval=3358197 TSecr=727597374
273   0.030972 54.230.158.80 -> 172.31.29.138 TCP 7306 [TCP segment of a reassembled PDU]
274   0.030974 172.31.29.138 -> 54.230.158.80 TCP 66 48622 > http [ACK] Seq=98 Ack=2325119 Win=1615744 Len=0 TSval=3358197 TSecr=727597374
275   0.031165 54.230.158.80 -> 172.31.29.138 TCP 62330 [TCP segment of a reassembled PDU]
276   0.031180 172.31.29.138 -> 54.230.158.80 TCP 66 48622 > http [ACK] Seq=98 Ack=2387383 Win=1615744 Len=0 TSval=3358197 TSecr=727597374
277   0.031236 54.230.158.80 -> 172.31.29.138 TCP 10202 [TCP segment of a reassembled PDU]
278   0.031240 172.31.29.138 -> 54.230.158.80 TCP 66 48622 > http [ACK] Seq=98 Ack=2397519 Win=1615744 Len=0 TSval=3358197 TSecr=727597374
279   0.031427 54.230.158.80 -> 172.31.29.138 TCP 26130 [TCP segment of a reassembled PDU]
280   0.031435 172.31.29.138 -> 54.230.158.80 TCP 66 48622 > http [ACK] Seq=98 Ack=2423583 Win=1615744 Len=0 TSval=3358197 TSecr=727597374
281   0.031441 54.230.158.80 -> 172.31.29.138 TCP 1514 [TCP segment of a reassembled PDU]
282   0.031446 54.230.158.80 -> 172.31.29.138 TCP 4410 [TCP segment of a reassembled PDU]
283   0.031448 172.31.29.138 -> 54.230.158.80 TCP 66 48622 > http [ACK] Seq=98 Ack=2429375 Win=1615744 Len=0 TSval=3358197 TSecr=727597374
284   0.031464 54.230.158.80 -> 172.31.29.138 TCP 20338 [TCP segment of a reassembled PDU]
285   0.031471 172.31.29.138 -> 54.230.158.80 TCP 66 48622 > http [ACK] Seq=98 Ack=2449647 Win=1615744 Len=0 TSval=3358197 TSecr=727597374
286   0.031573 54.230.158.80 -> 172.31.29.138 TCP 11650 [TCP segment of a reassembled PDU]
287   0.031579 172.31.29.138 -> 54.230.158.80 TCP 66 48622 > http [ACK] Seq=98 Ack=2461231 Win=1615744 Len=0 TSval=3358197 TSecr=727597374
288   0.031610 54.230.158.80 -> 172.31.29.138 TCP 1514 [TCP segment of a reassembled PDU]
289   0.031916 54.230.158.80 -> 172.31.29.138 TCP 26130 [TCP segment of a reassembled PDU]
290   0.031923 172.31.29.138 -> 54.230.158.80 TCP 66 48622 > http [ACK] Seq=98 Ack=2488743 Win=1615744 Len=0 TSval=3358198 TSecr=727597374
291   0.032001 54.230.158.80 -> 172.31.29.138 TCP 23234 [TCP segment of a reassembled PDU]
292   0.032008 172.31.29.138 -> 54.230.158.80 TCP 66 48622 > http [ACK] Seq=98 Ack=2511911 Win=1615744 Len=0 TSval=3358198 TSecr=727597374
293   0.032219 54.230.158.80 -> 172.31.29.138 TCP 62330 [TCP segment of a reassembled PDU]
294   0.032230 172.31.29.138 -> 54.230.158.80 TCP 66 48622 > http [ACK] Seq=98 Ack=2574175 Win=1615744 Len=0 TSval=3358198 TSecr=727597374
295   0.032289 54.230.158.80 -> 172.31.29.138 TCP 18890 [TCP segment of a reassembled PDU]
296   0.032295 172.31.29.138 -> 54.230.158.80 TCP 66 48622 > http [ACK] Seq=98 Ack=2592999 Win=1615744 Len=0 TSval=3358198 TSecr=727597374
297   0.032439 54.230.158.80 -> 172.31.29.138 TCP 26130 [TCP segment of a reassembled PDU]
298   0.032445 172.31.29.138 -> 54.230.158.80 TCP 66 48622 > http [ACK] Seq=98 Ack=2619063 Win=1615744 Len=0 TSval=3358198 TSecr=727597374
299   0.032468 54.230.158.80 -> 172.31.29.138 TCP 17442 [TCP segment of a reassembled PDU]
300   0.032471 172.31.29.138 -> 54.230.158.80 TCP 66 48622 > http [ACK] Seq=98 Ack=2636439 Win=1615744 Len=0 TSval=3358198 TSecr=727597374
301   0.032569 54.230.158.80 -> 172.31.29.138 TCP 21786 [TCP segment of a reassembled PDU]
302   0.032576 172.31.29.138 -> 54.230.158.80 TCP 66 48622 > http [ACK] Seq=98 Ack=2658159 Win=1615744 Len=0 TSval=3358198 TSecr=727597374
303   0.032880 54.230.158.80 -> 172.31.29.138 TCP 5858 [TCP segment of a reassembled PDU]
304   0.032885 172.31.29.138 -> 54.230.158.80 TCP 66 48622 > http [ACK] Seq=98 Ack=2663951 Win=1615744 Len=0 TSval=3358198 TSecr=727597374
305   0.033057 54.230.158.80 -> 172.31.29.138 TCP 26130 [TCP segment of a reassembled PDU]
306   0.033077 172.31.29.138 -> 54.230.158.80 TCP 66 48622 > http [ACK] Seq=98 Ack=2690015 Win=1615744 Len=0 TSval=3358198 TSecr=727597374
307   0.033088 54.230.158.80 -> 172.31.29.138 TCP 8754 [TCP segment of a reassembled PDU]
308   0.033091 172.31.29.138 -> 54.230.158.80 TCP 66 48622 > http [ACK] Seq=98 Ack=2698703 Win=1615744 Len=0 TSval=3358198 TSecr=727597374
309   0.033138 54.230.158.80 -> 172.31.29.138 TCP 17442 [TCP segment of a reassembled PDU]
310   0.033144 172.31.29.138 -> 54.230.158.80 TCP 66 48622 > http [ACK] Seq=98 Ack=2716079 Win=1615744 Len=0 TSval=3358198 TSecr=727597374
311   0.033299 54.230.158.80 -> 172.31.29.138 TCP 36266 [TCP segment of a reassembled PDU]
312   0.033307 172.31.29.138 -> 54.230.158.80 TCP 66 48622 > http [ACK] Seq=98 Ack=2752279 Win=1615744 Len=0 TSval=3358198 TSecr=727597374
313   0.033497 54.230.158.80 -> 172.31.29.138 TCP 62330 [TCP segment of a reassembled PDU]
314   0.033509 172.31.29.138 -> 54.230.158.80 TCP 66 48622 > http [ACK] Seq=98 Ack=2814543 Win=1615744 Len=0 TSval=3358198 TSecr=727597374
315   0.033621 54.230.158.80 -> 172.31.29.138 TCP 39162 [TCP segment of a reassembled PDU]
316   0.033629 172.31.29.138 -> 54.230.158.80 TCP 66 48622 > http [ACK] Seq=98 Ack=2853639 Win=1615744 Len=0 TSval=3358198 TSecr=727597374
317   0.033865 54.230.158.80 -> 172.31.29.138 TCP 17442 [TCP segment of a reassembled PDU]
318   0.033871 172.31.29.138 -> 54.230.158.80 TCP 66 48622 > http [ACK] Seq=98 Ack=2871015 Win=1615744 Len=0 TSval=3358198 TSecr=727597374
319   0.033992 54.230.158.80 -> 172.31.29.138 TCP 26130 [TCP segment of a reassembled PDU]
320   0.033999 172.31.29.138 -> 54.230.158.80 TCP 66 48622 > http [ACK] Seq=98 Ack=2897079 Win=1615744 Len=0 TSval=3358198 TSecr=727597374
321   0.034045 54.230.158.80 -> 172.31.29.138 TCP 21786 [TCP segment of a reassembled PDU]
322   0.034051 172.31.29.138 -> 54.230.158.80 TCP 66 48622 > http [ACK] Seq=98 Ack=2918799 Win=1615744 Len=0 TSval=3358198 TSecr=727597374
323   0.034088 54.230.158.80 -> 172.31.29.138 TCP 5858 [TCP segment of a reassembled PDU]
324   0.034092 172.31.29.138 -> 54.230.158.80 TCP 66 48622 > http [ACK] Seq=98 Ack=2924591 Win=1615744 Len=0 TSval=3358198 TSecr=727597374
325   0.034255 54.230.158.80 -> 172.31.29.138 TCP 26130 [TCP segment of a reassembled PDU]
326   0.034262 172.31.29.138 -> 54.230.158.80 TCP 66 48622 > http [ACK] Seq=98 Ack=2950655 Win=1615744 Len=0 TSval=3358198 TSecr=727597374
327   0.034306 54.230.158.80 -> 172.31.29.138 TCP 24682 [TCP segment of a reassembled PDU]
328   0.034311 172.31.29.138 -> 54.230.158.80 TCP 66 48622 > http [ACK] Seq=98 Ack=2975271 Win=1615744 Len=0 TSval=3358198 TSecr=727597374
329   0.034361 54.230.158.80 -> 172.31.29.138 TCP 1514 [TCP Previous segment not captured] [TCP segment of a reassembled PDU]
330   0.034365 172.31.29.138 -> 54.230.158.80 TCP 78 [TCP Dup ACK 328#1] 48622 > http [ACK] Seq=98 Ack=2975271 Win=1615744 Len=0 TSval=3358198 TSecr=727597374 SLE=2976719 SRE=2978167
331   0.034370 54.230.158.80 -> 172.31.29.138 TCP 1514 [TCP Out-Of-Order] [TCP segment of a reassembled PDU]
332   0.034373 172.31.29.138 -> 54.230.158.80 TCP 66 48622 > http [ACK] Seq=98 Ack=2978167 Win=1615744 Len=0 TSval=3358198 TSecr=727597374
333   0.034379 54.230.158.80 -> 172.31.29.138 TCP 8754 [TCP segment of a reassembled PDU]
334   0.034381 172.31.29.138 -> 54.230.158.80 TCP 66 48622 > http [ACK] Seq=98 Ack=2986855 Win=1615744 Len=0 TSval=3358198 TSecr=727597374
335   0.034446 54.230.158.80 -> 172.31.29.138 TCP 21786 [TCP segment of a reassembled PDU]
336   0.034460 172.31.29.138 -> 54.230.158.80 TCP 66 48622 > http [ACK] Seq=98 Ack=3008575 Win=1615744 Len=0 TSval=3358198 TSecr=727597374
337   0.034626 54.230.158.80 -> 172.31.29.138 TCP 29026 [TCP segment of a reassembled PDU]
338   0.034633 172.31.29.138 -> 54.230.158.80 TCP 66 48622 > http [ACK] Seq=98 Ack=3037535 Win=1615744 Len=0 TSval=3358198 TSecr=727597374
339   0.034760 54.230.158.80 -> 172.31.29.138 TCP 24682 [TCP segment of a reassembled PDU]
340   0.034767 172.31.29.138 -> 54.230.158.80 TCP 66 48622 > http [ACK] Seq=98 Ack=3062151 Win=1615744 Len=0 TSval=3358198 TSecr=727597374
341   0.034908 54.230.158.80 -> 172.31.29.138 TCP 37714 [TCP segment of a reassembled PDU]
342   0.034916 172.31.29.138 -> 54.230.158.80 TCP 66 48622 > http [ACK] Seq=98 Ack=3099799 Win=1615744 Len=0 TSval=3358198 TSecr=727597374
343   0.035118 54.230.158.80 -> 172.31.29.138 TCP 62330 [TCP segment of a reassembled PDU]
344   0.035144 172.31.29.138 -> 54.230.158.80 TCP 66 48622 > http [ACK] Seq=98 Ack=3162063 Win=1615744 Len=0 TSval=3358198 TSecr=727597374
345   0.035211 54.230.158.80 -> 172.31.29.138 TCP 21786 [TCP segment of a reassembled PDU]
346   0.035217 172.31.29.138 -> 54.230.158.80 TCP 66 48622 > http [ACK] Seq=98 Ack=3183783 Win=1615744 Len=0 TSval=3358198 TSecr=727597374
347   0.035544 54.230.158.80 -> 172.31.29.138 TCP 26130 [TCP segment of a reassembled PDU]
348   0.035552 172.31.29.138 -> 54.230.158.80 TCP 66 48622 > http [ACK] Seq=98 Ack=3209847 Win=1615744 Len=0 TSval=3358198 TSecr=727597374
349   0.035566 54.230.158.80 -> 172.31.29.138 TCP 14546 [TCP segment of a reassembled PDU]
