[Measurement for 10mb at 18:38:22 19.38.2014] 
Tshark:

  1   0.000000 172.31.29.138 -> 172.31.0.2   DNS 89 Standard query 0x57d3  A d1n0gskdvzj94j.cloudfront.net
  2   0.000032 172.31.29.138 -> 172.31.0.2   DNS 89 Standard query 0x24be  AAAA d1n0gskdvzj94j.cloudfront.net
  3   0.000550   172.31.0.2 -> 172.31.29.138 DNS 176 Standard query response 0x24be 
  4   0.000561   172.31.0.2 -> 172.31.29.138 DNS 217 Standard query response 0x57d3  A 54.230.158.80 A 54.230.159.147 A 54.192.156.106 A 54.192.156.109 A 54.192.157.138 A 54.192.157.141 A 54.192.157.146 A 54.192.157.151
  5   0.003823 172.31.29.138 -> 54.230.158.80 TCP 74 48532 > http [SYN] Seq=0 Win=26883 Len=0 MSS=8961 SACK_PERM=1 TSval=1543815 TSecr=0 WS=128
  6   0.004567 54.230.158.80 -> 172.31.29.138 TCP 74 http > 48532 [SYN, ACK] Seq=0 Ack=1 Win=14480 Len=0 MSS=1460 SACK_PERM=1 TSval=830065626 TSecr=1543815 WS=128
  7   0.004582 172.31.29.138 -> 54.230.158.80 TCP 66 48532 > http [ACK] Seq=1 Ack=1 Win=27008 Len=0 TSval=1543815 TSecr=830065626
  8   0.004623 172.31.29.138 -> 54.230.158.80 HTTP 163 GET /10mb HTTP/1.1 
  9   0.005289 54.230.158.80 -> 172.31.29.138 TCP 66 http > 48532 [ACK] Seq=1 Ack=98 Win=14592 Len=0 TSval=830065626 TSecr=1543815
 10   0.007758 54.230.158.80 -> 172.31.29.138 TCP 4410 [TCP segment of a reassembled PDU]
 11   0.007768 172.31.29.138 -> 54.230.158.80 TCP 66 48532 > http [ACK] Seq=98 Ack=4345 Win=35584 Len=0 TSval=1543816 TSecr=830065626
 12   0.007779 54.230.158.80 -> 172.31.29.138 TCP 9211 [TCP segment of a reassembled PDU]
 13   0.007802 172.31.29.138 -> 54.230.158.80 TCP 66 48532 > http [ACK] Seq=98 Ack=13490 Win=53888 Len=0 TSval=1543816 TSecr=830065626
 14   0.008298 54.230.158.80 -> 172.31.29.138 TCP 13098 [TCP segment of a reassembled PDU]
 15   0.008309 172.31.29.138 -> 54.230.158.80 TCP 66 48532 > http [ACK] Seq=98 Ack=26522 Win=80000 Len=0 TSval=1543816 TSecr=830065626
 16   0.008984 54.230.158.80 -> 172.31.29.138 TCP 5858 [TCP segment of a reassembled PDU]
 17   0.008992 172.31.29.138 -> 54.230.158.80 TCP 66 48532 > http [ACK] Seq=98 Ack=32314 Win=91520 Len=0 TSval=1543816 TSecr=830065626
 18   0.009031 54.230.158.80 -> 172.31.29.138 TCP 7306 [TCP segment of a reassembled PDU]
 19   0.009038 172.31.29.138 -> 54.230.158.80 TCP 66 48532 > http [ACK] Seq=98 Ack=39554 Win=96512 Len=0 TSval=1543816 TSecr=830065626
 20   0.009498 54.230.158.80 -> 172.31.29.138 TCP 8754 [TCP segment of a reassembled PDU]
 21   0.009506 172.31.29.138 -> 54.230.158.80 TCP 66 48532 > http [ACK] Seq=98 Ack=48242 Win=103680 Len=0 TSval=1543816 TSecr=830065626
 22   0.009529 54.230.158.80 -> 172.31.29.138 TCP 4410 [TCP segment of a reassembled PDU]
 23   0.009534 172.31.29.138 -> 54.230.158.80 TCP 66 48532 > http [ACK] Seq=98 Ack=52586 Win=99456 Len=0 TSval=1543816 TSecr=830065626
 24   0.009794 54.230.158.80 -> 172.31.29.138 TCP 8754 [TCP segment of a reassembled PDU]
 25   0.009814 172.31.29.138 -> 54.230.158.80 TCP 66 48532 > http [ACK] Seq=98 Ack=61274 Win=103680 Len=0 TSval=1543816 TSecr=830065626
 26   0.010002 54.230.158.80 -> 172.31.29.138 TCP 2962 [TCP segment of a reassembled PDU]
 27   0.010008 172.31.29.138 -> 54.230.158.80 TCP 66 48532 > http [ACK] Seq=98 Ack=64170 Win=109056 Len=0 TSval=1543816 TSecr=830065627
 28   0.010059 54.230.158.80 -> 172.31.29.138 TCP 1514 [TCP segment of a reassembled PDU]
 29   0.010064 172.31.29.138 -> 54.230.158.80 TCP 66 48532 > http [ACK] Seq=98 Ack=65618 Win=109056 Len=0 TSval=1543816 TSecr=830065627
 30   0.010116 54.230.158.80 -> 172.31.29.138 TCP 11650 [TCP segment of a reassembled PDU]
 31   0.010125 172.31.29.138 -> 54.230.158.80 TCP 66 48532 > http [ACK] Seq=98 Ack=77202 Win=98944 Len=0 TSval=1543816 TSecr=830065627
 32   0.010500 54.230.158.80 -> 172.31.29.138 TCP 2962 [TCP segment of a reassembled PDU]
 33   0.010506 172.31.29.138 -> 54.230.158.80 TCP 66 48532 > http [ACK] Seq=98 Ack=80098 Win=109056 Len=0 TSval=1543817 TSecr=830065627
 34   0.010589 54.230.158.80 -> 172.31.29.138 TCP 7306 [TCP segment of a reassembled PDU]
 35   0.010596 172.31.29.138 -> 54.230.158.80 TCP 66 48532 > http [ACK] Seq=98 Ack=87338 Win=123520 Len=0 TSval=1543817 TSecr=830065627
 36   0.010826 54.230.158.80 -> 172.31.29.138 TCP 13098 [TCP segment of a reassembled PDU]
 37   0.010835 172.31.29.138 -> 54.230.158.80 TCP 66 48532 > http [ACK] Seq=98 Ack=100370 Win=149632 Len=0 TSval=1543817 TSecr=830065627
 38   0.010894 54.230.158.80 -> 172.31.29.138 TCP 4410 [TCP segment of a reassembled PDU]
 39   0.010899 172.31.29.138 -> 54.230.158.80 TCP 66 48532 > http [ACK] Seq=98 Ack=104714 Win=158336 Len=0 TSval=1543817 TSecr=830065627
 40   0.011272 54.230.158.80 -> 172.31.29.138 TCP 1514 [TCP segment of a reassembled PDU]
 41   0.011277 172.31.29.138 -> 54.230.158.80 TCP 66 48532 > http [ACK] Seq=98 Ack=106162 Win=161152 Len=0 TSval=1543817 TSecr=830065627
 42   0.011428 54.230.158.80 -> 172.31.29.138 TCP 24682 [TCP segment of a reassembled PDU]
 43   0.011442 172.31.29.138 -> 54.230.158.80 TCP 66 48532 > http [ACK] Seq=98 Ack=130778 Win=210432 Len=0 TSval=1543817 TSecr=830065627
 44   0.011839 54.230.158.80 -> 172.31.29.138 TCP 4410 [TCP segment of a reassembled PDU]
 45   0.011846 172.31.29.138 -> 54.230.158.80 TCP 66 48532 > http [ACK] Seq=98 Ack=135122 Win=219136 Len=0 TSval=1543817 TSecr=830065627
 46   0.011930 54.230.158.80 -> 172.31.29.138 TCP 8754 [TCP segment of a reassembled PDU]
 47   0.011938 172.31.29.138 -> 54.230.158.80 TCP 66 48532 > http [ACK] Seq=98 Ack=143810 Win=236544 Len=0 TSval=1543817 TSecr=830065627
 48   0.012042 54.230.158.80 -> 172.31.29.138 TCP 7306 [TCP segment of a reassembled PDU]
 49   0.012049 172.31.29.138 -> 54.230.158.80 TCP 66 48532 > http [ACK] Seq=98 Ack=151050 Win=251008 Len=0 TSval=1543817 TSecr=830065627
 50   0.012179 54.230.158.80 -> 172.31.29.138 TCP 18890 [TCP segment of a reassembled PDU]
 51   0.012190 172.31.29.138 -> 54.230.158.80 TCP 66 48532 > http [ACK] Seq=98 Ack=169874 Win=288640 Len=0 TSval=1543817 TSecr=830065627
 52   0.012545 54.230.158.80 -> 172.31.29.138 TCP 4410 [TCP segment of a reassembled PDU]
 53   0.012551 172.31.29.138 -> 54.230.158.80 TCP 66 48532 > http [ACK] Seq=98 Ack=174218 Win=297344 Len=0 TSval=1543817 TSecr=830065627
 54   0.012672 54.230.158.80 -> 172.31.29.138 TCP 8754 [TCP segment of a reassembled PDU]
 55   0.012678 172.31.29.138 -> 54.230.158.80 TCP 66 48532 > http [ACK] Seq=98 Ack=182906 Win=314624 Len=0 TSval=1543817 TSecr=830065627
 56   0.012975 54.230.158.80 -> 172.31.29.138 TCP 26130 [TCP segment of a reassembled PDU]
 57   0.012989 172.31.29.138 -> 54.230.158.80 TCP 66 48532 > http [ACK] Seq=98 Ack=208970 Win=366848 Len=0 TSval=1543817 TSecr=830065627
 58   0.013337 54.230.158.80 -> 172.31.29.138 TCP 4410 [TCP segment of a reassembled PDU]
 59   0.013343 172.31.29.138 -> 54.230.158.80 TCP 66 48532 > http [ACK] Seq=98 Ack=213314 Win=375552 Len=0 TSval=1543817 TSecr=830065627
 60   0.013464 54.230.158.80 -> 172.31.29.138 TCP 17442 [TCP segment of a reassembled PDU]
 61   0.013475 172.31.29.138 -> 54.230.158.80 TCP 66 48532 > http [ACK] Seq=98 Ack=230690 Win=410240 Len=0 TSval=1543817 TSecr=830065627
 62   0.013774 54.230.158.80 -> 172.31.29.138 TCP 27578 [TCP segment of a reassembled PDU]
 63   0.013789 172.31.29.138 -> 54.230.158.80 TCP 66 48532 > http [ACK] Seq=98 Ack=258202 Win=465280 Len=0 TSval=1543817 TSecr=830065627
 64   0.013912 54.230.158.80 -> 172.31.29.138 TCP 1514 [TCP segment of a reassembled PDU]
 65   0.013917 172.31.29.138 -> 54.230.158.80 TCP 66 48532 > http [ACK] Seq=98 Ack=259650 Win=468224 Len=0 TSval=1543817 TSecr=830065627
 66   0.014196 54.230.158.80 -> 172.31.29.138 TCP 23234 [TCP segment of a reassembled PDU]
 67   0.014209 172.31.29.138 -> 54.230.158.80 TCP 66 48532 > http [ACK] Seq=98 Ack=282818 Win=514560 Len=0 TSval=1543817 TSecr=830065627
 68   0.014496 54.230.158.80 -> 172.31.29.138 TCP 29026 [TCP segment of a reassembled PDU]
 69   0.014512 172.31.29.138 -> 54.230.158.80 TCP 66 48532 > http [ACK] Seq=98 Ack=311778 Win=537984 Len=0 TSval=1543818 TSecr=830065627
 70   0.014600 54.230.158.80 -> 172.31.29.138 TCP 1514 [TCP segment of a reassembled PDU]
 71   0.014605 172.31.29.138 -> 54.230.158.80 TCP 66 48532 > http [ACK] Seq=98 Ack=313226 Win=575360 Len=0 TSval=1543818 TSecr=830065627
 72   0.014860 54.230.158.80 -> 172.31.29.138 TCP 4410 [TCP segment of a reassembled PDU]
 73   0.014867 172.31.29.138 -> 54.230.158.80 TCP 66 48532 > http [ACK] Seq=98 Ack=317570 Win=584064 Len=0 TSval=1543818 TSecr=830065627
 74   0.014996 54.230.158.80 -> 172.31.29.138 TCP 21786 [TCP segment of a reassembled PDU]
 75   0.015021 172.31.29.138 -> 54.230.158.80 TCP 66 48532 > http [ACK] Seq=98 Ack=339290 Win=627456 Len=0 TSval=1543818 TSecr=830065627
 76   0.015145 54.230.158.80 -> 172.31.29.138 TCP 11650 [TCP segment of a reassembled PDU]
 77   0.015153 172.31.29.138 -> 54.230.158.80 TCP 66 48532 > http [ACK] Seq=98 Ack=350874 Win=650624 Len=0 TSval=1543818 TSecr=830065627
 78   0.015261 54.230.158.80 -> 172.31.29.138 TCP 18890 [TCP segment of a reassembled PDU]
 79   0.015273 172.31.29.138 -> 54.230.158.80 TCP 66 48532 > http [ACK] Seq=98 Ack=369698 Win=688256 Len=0 TSval=1543818 TSecr=830065627
 80   0.015438 54.230.158.80 -> 172.31.29.138 TCP 8754 [TCP segment of a reassembled PDU]
 81   0.015445 172.31.29.138 -> 54.230.158.80 TCP 66 48532 > http [ACK] Seq=98 Ack=378386 Win=705664 Len=0 TSval=1543818 TSecr=830065627
 82   0.015698 54.230.158.80 -> 172.31.29.138 TCP 17442 [TCP segment of a reassembled PDU]
 83   0.015710 172.31.29.138 -> 54.230.158.80 TCP 66 48532 > http [ACK] Seq=98 Ack=395762 Win=740352 Len=0 TSval=1543818 TSecr=830065627
 84   0.015772 54.230.158.80 -> 172.31.29.138 TCP 5858 [TCP segment of a reassembled PDU]
 85   0.015779 172.31.29.138 -> 54.230.158.80 TCP 66 48532 > http [ACK] Seq=98 Ack=401554 Win=752000 Len=0 TSval=1543818 TSecr=830065627
 86   0.016036 54.230.158.80 -> 172.31.29.138 TCP 26130 [TCP segment of a reassembled PDU]
 87   0.016050 172.31.29.138 -> 54.230.158.80 TCP 66 48532 > http [ACK] Seq=98 Ack=427618 Win=804096 Len=0 TSval=1543818 TSecr=830065627
 88   0.016061 54.230.158.80 -> 172.31.29.138 TCP 7306 [TCP segment of a reassembled PDU]
 89   0.016069 172.31.29.138 -> 54.230.158.80 TCP 66 48532 > http [ACK] Seq=98 Ack=434858 Win=818560 Len=0 TSval=1543818 TSecr=830065627
 90   0.016134 54.230.158.80 -> 172.31.29.138 TCP 4410 [TCP segment of a reassembled PDU]
 91   0.016139 172.31.29.138 -> 54.230.158.80 TCP 66 48532 > http [ACK] Seq=98 Ack=439202 Win=827264 Len=0 TSval=1543818 TSecr=830065627
 92   0.016270 54.230.158.80 -> 172.31.29.138 TCP 4410 [TCP segment of a reassembled PDU]
 93   0.016281 172.31.29.138 -> 54.230.158.80 TCP 66 48532 > http [ACK] Seq=98 Ack=443546 Win=835968 Len=0 TSval=1543818 TSecr=830065627
 94   0.016402 54.230.158.80 -> 172.31.29.138 TCP 10202 [TCP segment of a reassembled PDU]
 95   0.016412 172.31.29.138 -> 54.230.158.80 TCP 66 48532 > http [ACK] Seq=98 Ack=453682 Win=856192 Len=0 TSval=1543818 TSecr=830065627
 96   0.016528 54.230.158.80 -> 172.31.29.138 TCP 17442 [TCP segment of a reassembled PDU]
 97   0.016539 172.31.29.138 -> 54.230.158.80 TCP 66 48532 > http [ACK] Seq=98 Ack=471058 Win=891008 Len=0 TSval=1543818 TSecr=830065627
 98   0.016789 54.230.158.80 -> 172.31.29.138 TCP 26130 [TCP segment of a reassembled PDU]
 99   0.016804 172.31.29.138 -> 54.230.158.80 TCP 66 48532 > http [ACK] Seq=98 Ack=497122 Win=943104 Len=0 TSval=1543818 TSecr=830065627
100   0.016822 54.230.158.80 -> 172.31.29.138 TCP 11650 [TCP segment of a reassembled PDU]
101   0.016829 172.31.29.138 -> 54.230.158.80 TCP 66 48532 > http [ACK] Seq=98 Ack=508706 Win=966272 Len=0 TSval=1543818 TSecr=830065627
102   0.017153 54.230.158.80 -> 172.31.29.138 TCP 5858 [TCP segment of a reassembled PDU]
103   0.017161 172.31.29.138 -> 54.230.158.80 TCP 66 48532 > http [ACK] Seq=98 Ack=514498 Win=977920 Len=0 TSval=1543818 TSecr=830065627
104   0.017346 54.230.158.80 -> 172.31.29.138 TCP 26130 [TCP segment of a reassembled PDU]
105   0.017360 172.31.29.138 -> 54.230.158.80 TCP 66 48532 > http [ACK] Seq=98 Ack=540562 Win=1030016 Len=0 TSval=1543818 TSecr=830065627
106   0.017372 54.230.158.80 -> 172.31.29.138 TCP 8754 [TCP segment of a reassembled PDU]
107   0.017381 172.31.29.138 -> 54.230.158.80 TCP 66 48532 > http [ACK] Seq=98 Ack=549250 Win=1047424 Len=0 TSval=1543818 TSecr=830065627
108   0.017425 54.230.158.80 -> 172.31.29.138 TCP 4410 [TCP segment of a reassembled PDU]
109   0.017431 172.31.29.138 -> 54.230.158.80 TCP 66 48532 > http [ACK] Seq=98 Ack=553594 Win=1056000 Len=0 TSval=1543818 TSecr=830065627
110   0.017587 54.230.158.80 -> 172.31.29.138 TCP 20338 [TCP segment of a reassembled PDU]
111   0.017611 172.31.29.138 -> 54.230.158.80 TCP 66 48532 > http [ACK] Seq=98 Ack=573866 Win=1096576 Len=0 TSval=1543818 TSecr=830065627
112   0.017941 54.230.158.80 -> 172.31.29.138 TCP 7306 [TCP segment of a reassembled PDU]
113   0.017949 172.31.29.138 -> 54.230.158.80 TCP 66 48532 > http [ACK] Seq=98 Ack=581106 Win=1111040 Len=0 TSval=1543818 TSecr=830065627
114   0.018107 54.230.158.80 -> 172.31.29.138 TCP 26130 [TCP segment of a reassembled PDU]
115   0.018121 172.31.29.138 -> 54.230.158.80 TCP 66 48532 > http [ACK] Seq=98 Ack=607170 Win=1119488 Len=0 TSval=1543818 TSecr=830065627
116   0.018129 54.230.158.80 -> 172.31.29.138 TCP 4410 [TCP segment of a reassembled PDU]
117   0.018158 54.230.158.80 -> 172.31.29.138 TCP 14546 [TCP segment of a reassembled PDU]
118   0.018166 54.230.158.80 -> 172.31.29.138 TCP 2962 [TCP segment of a reassembled PDU]
119   0.018191 54.230.158.80 -> 172.31.29.138 TCP 10202 [TCP segment of a reassembled PDU]
120   0.018196 172.31.29.138 -> 54.230.158.80 TCP 66 48532 > http [ACK] Seq=98 Ack=628890 Win=1097856 Len=0 TSval=1543818 TSecr=830065627
121   0.018216 172.31.29.138 -> 54.230.158.80 TCP 66 48532 > http [ACK] Seq=98 Ack=639026 Win=1117056 Len=0 TSval=1543818 TSecr=830065627
122   0.018408 54.230.158.80 -> 172.31.29.138 TCP 1514 [TCP segment of a reassembled PDU]
123   0.018606 54.230.158.80 -> 172.31.29.138 TCP 29026 [TCP segment of a reassembled PDU]
124   0.018621 54.230.158.80 -> 172.31.29.138 TCP 1514 [TCP segment of a reassembled PDU]
125   0.018636 172.31.29.138 -> 54.230.158.80 TCP 66 48532 > http [ACK] Seq=98 Ack=670882 Win=1162880 Len=0 TSval=1543819 TSecr=830065627
126   0.018694 54.230.158.80 -> 172.31.29.138 TCP 4410 [TCP segment of a reassembled PDU]
127   0.018700 172.31.29.138 -> 54.230.158.80 TCP 66 48532 > http [ACK] Seq=98 Ack=675226 Win=1171584 Len=0 TSval=1543819 TSecr=830065627
128   0.018899 54.230.158.80 -> 172.31.29.138 TCP 29026 [TCP segment of a reassembled PDU]
129   0.018914 172.31.29.138 -> 54.230.158.80 TCP 66 48532 > http [ACK] Seq=98 Ack=704186 Win=1229440 Len=0 TSval=1543819 TSecr=830065627
130   0.019234 54.230.158.80 -> 172.31.29.138 TCP 4410 [TCP segment of a reassembled PDU]
131   0.019241 172.31.29.138 -> 54.230.158.80 TCP 66 48532 > http [ACK] Seq=98 Ack=708530 Win=1238144 Len=0 TSval=1543819 TSecr=830065627
132   0.019390 54.230.158.80 -> 172.31.29.138 TCP 23234 [TCP segment of a reassembled PDU]
133   0.019405 172.31.29.138 -> 54.230.158.80 TCP 66 48532 > http [ACK] Seq=98 Ack=731698 Win=1284480 Len=0 TSval=1543819 TSecr=830065627
134   0.019412 54.230.158.80 -> 172.31.29.138 TCP 2962 [TCP segment of a reassembled PDU]
135   0.019416 172.31.29.138 -> 54.230.158.80 TCP 66 48532 > http [ACK] Seq=98 Ack=734594 Win=1290240 Len=0 TSval=1543819 TSecr=830065627
136   0.019516 54.230.158.80 -> 172.31.29.138 TCP 34818 [TCP segment of a reassembled PDU]
137   0.019532 172.31.29.138 -> 54.230.158.80 TCP 66 48532 > http [ACK] Seq=98 Ack=769346 Win=1359744 Len=0 TSval=1543819 TSecr=830065627
138   0.019604 54.230.158.80 -> 172.31.29.138 TCP 24682 [TCP segment of a reassembled PDU]
139   0.019616 172.31.29.138 -> 54.230.158.80 TCP 66 48532 > http [ACK] Seq=98 Ack=793962 Win=1409024 Len=0 TSval=1543819 TSecr=830065627
140   0.019622 54.230.158.80 -> 172.31.29.138 TCP 1514 [TCP segment of a reassembled PDU]
141   0.019625 172.31.29.138 -> 54.230.158.80 TCP 66 48532 > http [ACK] Seq=98 Ack=795410 Win=1411840 Len=0 TSval=1543819 TSecr=830065627
142   0.019693 54.230.158.80 -> 172.31.29.138 TCP 7306 [TCP segment of a reassembled PDU]
143   0.019699 172.31.29.138 -> 54.230.158.80 TCP 66 48532 > http [ACK] Seq=98 Ack=802650 Win=1426432 Len=0 TSval=1543819 TSecr=830065627
144   0.020092 54.230.158.80 -> 172.31.29.138 TCP 26130 [TCP segment of a reassembled PDU]
145   0.020107 172.31.29.138 -> 54.230.158.80 TCP 66 48532 > http [ACK] Seq=98 Ack=828714 Win=1478528 Len=0 TSval=1543819 TSecr=830065628
146   0.020115 54.230.158.80 -> 172.31.29.138 TCP 5858 [TCP segment of a reassembled PDU]
147   0.020119 172.31.29.138 -> 54.230.158.80 TCP 66 48532 > http [ACK] Seq=98 Ack=834506 Win=1490048 Len=0 TSval=1543819 TSecr=830065628
148   0.020398 54.230.158.80 -> 172.31.29.138 TCP 21786 [TCP segment of a reassembled PDU]
149   0.020410 172.31.29.138 -> 54.230.158.80 TCP 66 48532 > http [ACK] Seq=98 Ack=856226 Win=1533568 Len=0 TSval=1543819 TSecr=830065628
150   0.020421 54.230.158.80 -> 172.31.29.138 TCP 4410 [TCP segment of a reassembled PDU]
151   0.020425 172.31.29.138 -> 54.230.158.80 TCP 66 48532 > http [ACK] Seq=98 Ack=860570 Win=1542272 Len=0 TSval=1543819 TSecr=830065628
152   0.020489 54.230.158.80 -> 172.31.29.138 TCP 26130 [TCP segment of a reassembled PDU]
153   0.020501 172.31.29.138 -> 54.230.158.80 TCP 66 48532 > http [ACK] Seq=98 Ack=886634 Win=1594368 Len=0 TSval=1543819 TSecr=830065628
154   0.020517 54.230.158.80 -> 172.31.29.138 TCP 13098 [TCP segment of a reassembled PDU]
155   0.020526 172.31.29.138 -> 54.230.158.80 TCP 66 48532 > http [ACK] Seq=98 Ack=899666 Win=1594368 Len=0 TSval=1543819 TSecr=830065628
156   0.020862 54.230.158.80 -> 172.31.29.138 TCP 18890 [TCP segment of a reassembled PDU]
157   0.020873 172.31.29.138 -> 54.230.158.80 TCP 66 48532 > http [ACK] Seq=98 Ack=918490 Win=1594368 Len=0 TSval=1543819 TSecr=830065628
158   0.020881 54.230.158.80 -> 172.31.29.138 TCP 2962 [TCP segment of a reassembled PDU]
159   0.020887 172.31.29.138 -> 54.230.158.80 TCP 66 48532 > http [ACK] Seq=98 Ack=921386 Win=1594368 Len=0 TSval=1543819 TSecr=830065628
160   0.020894 54.230.158.80 -> 172.31.29.138 TCP 4410 [TCP segment of a reassembled PDU]
161   0.020898 172.31.29.138 -> 54.230.158.80 TCP 66 48532 > http [ACK] Seq=98 Ack=925730 Win=1594368 Len=0 TSval=1543819 TSecr=830065628
162   0.020934 54.230.158.80 -> 172.31.29.138 TCP 13098 [TCP segment of a reassembled PDU]
163   0.020941 172.31.29.138 -> 54.230.158.80 TCP 66 48532 > http [ACK] Seq=98 Ack=938762 Win=1594368 Len=0 TSval=1543819 TSecr=830065628
164   0.021127 54.230.158.80 -> 172.31.29.138 TCP 23234 [TCP segment of a reassembled PDU]
165   0.021140 172.31.29.138 -> 54.230.158.80 TCP 66 48532 > http [ACK] Seq=98 Ack=961930 Win=1594368 Len=0 TSval=1543819 TSecr=830065628
166   0.021230 54.230.158.80 -> 172.31.29.138 TCP 18890 [TCP segment of a reassembled PDU]
167   0.021241 172.31.29.138 -> 54.230.158.80 TCP 66 48532 > http [ACK] Seq=98 Ack=980754 Win=1594368 Len=0 TSval=1543819 TSecr=830065628
168   0.021248 54.230.158.80 -> 172.31.29.138 TCP 1514 [TCP segment of a reassembled PDU]
169   0.021259 54.230.158.80 -> 172.31.29.138 TCP 5858 [TCP segment of a reassembled PDU]
170   0.021263 172.31.29.138 -> 54.230.158.80 TCP 66 48532 > http [ACK] Seq=98 Ack=987994 Win=1594368 Len=0 TSval=1543819 TSecr=830065628
171   0.021337 54.230.158.80 -> 172.31.29.138 TCP 29026 [TCP segment of a reassembled PDU]
172   0.021351 172.31.29.138 -> 54.230.158.80 TCP 66 48532 > http [ACK] Seq=98 Ack=1016954 Win=1594368 Len=0 TSval=1543819 TSecr=830065628
173   0.021586 54.230.158.80 -> 172.31.29.138 TCP 11650 [TCP segment of a reassembled PDU]
174   0.021596 172.31.29.138 -> 54.230.158.80 TCP 66 48532 > http [ACK] Seq=98 Ack=1028538 Win=1594368 Len=0 TSval=1543819 TSecr=830065628
175   0.021665 54.230.158.80 -> 172.31.29.138 TCP 1514 [TCP segment of a reassembled PDU]
176   0.021796 54.230.158.80 -> 172.31.29.138 TCP 4410 [TCP segment of a reassembled PDU]
177   0.021802 172.31.29.138 -> 54.230.158.80 TCP 66 48532 > http [ACK] Seq=98 Ack=1034330 Win=1594368 Len=0 TSval=1543819 TSecr=830065628
178   0.021976 54.230.158.80 -> 172.31.29.138 TCP 26130 [TCP segment of a reassembled PDU]
179   0.021989 172.31.29.138 -> 54.230.158.80 TCP 66 48532 > http [ACK] Seq=98 Ack=1060394 Win=1594368 Len=0 TSval=1543819 TSecr=830065628
180   0.022026 54.230.158.80 -> 172.31.29.138 TCP 26130 [TCP segment of a reassembled PDU]
181   0.022038 172.31.29.138 -> 54.230.158.80 TCP 66 48532 > http [ACK] Seq=98 Ack=1086458 Win=1594368 Len=0 TSval=1543819 TSecr=830065628
182   0.022048 54.230.158.80 -> 172.31.29.138 TCP 5858 [TCP segment of a reassembled PDU]
183   0.022053 172.31.29.138 -> 54.230.158.80 TCP 66 48532 > http [ACK] Seq=98 Ack=1092250 Win=1594368 Len=0 TSval=1543819 TSecr=830065628
184   0.022058 54.230.158.80 -> 172.31.29.138 TCP 2962 [TCP segment of a reassembled PDU]
185   0.022061 172.31.29.138 -> 54.230.158.80 TCP 66 48532 > http [ACK] Seq=98 Ack=1095146 Win=1594368 Len=0 TSval=1543819 TSecr=830065628
186   0.022089 54.230.158.80 -> 172.31.29.138 TCP 10202 [TCP segment of a reassembled PDU]
187   0.022097 172.31.29.138 -> 54.230.158.80 TCP 66 48532 > http [ACK] Seq=98 Ack=1105282 Win=1594368 Len=0 TSval=1543819 TSecr=830065628
188   0.022225 54.230.158.80 -> 172.31.29.138 TCP 26130 [TCP segment of a reassembled PDU]
189   0.022238 172.31.29.138 -> 54.230.158.80 TCP 66 48532 > http [ACK] Seq=98 Ack=1131346 Win=1594368 Len=0 TSval=1543819 TSecr=830065628
190   0.022258 54.230.158.80 -> 172.31.29.138 TCP 14546 [TCP segment of a reassembled PDU]
191   0.022266 172.31.29.138 -> 54.230.158.80 TCP 66 48532 > http [ACK] Seq=98 Ack=1145826 Win=1594368 Len=0 TSval=1543819 TSecr=830065628
192   0.022310 54.230.158.80 -> 172.31.29.138 TCP 11650 [TCP segment of a reassembled PDU]
193   0.022317 172.31.29.138 -> 54.230.158.80 TCP 66 48532 > http [ACK] Seq=98 Ack=1157410 Win=1594368 Len=0 TSval=1543819 TSecr=830065628
194   0.022384 54.230.158.80 -> 172.31.29.138 TCP 2962 [TCP segment of a reassembled PDU]
195   0.022393 172.31.29.138 -> 54.230.158.80 TCP 66 48532 > http [ACK] Seq=98 Ack=1160306 Win=1594368 Len=0 TSval=1543819 TSecr=830065628
196   0.022676 54.230.158.80 -> 172.31.29.138 TCP 26130 [TCP segment of a reassembled PDU]
197   0.022702 172.31.29.138 -> 54.230.158.80 TCP 66 48532 > http [ACK] Seq=98 Ack=1186370 Win=1594368 Len=0 TSval=1543820 TSecr=830065628
198   0.022728 54.230.158.80 -> 172.31.29.138 TCP 21786 [TCP segment of a reassembled PDU]
199   0.022738 172.31.29.138 -> 54.230.158.80 TCP 66 48532 > http [ACK] Seq=98 Ack=1208090 Win=1594368 Len=0 TSval=1543820 TSecr=830065628
200   0.022759 54.230.158.80 -> 172.31.29.138 TCP 4410 [TCP segment of a reassembled PDU]
201   0.022763 172.31.29.138 -> 54.230.158.80 TCP 66 48532 > http [ACK] Seq=98 Ack=1212434 Win=1594368 Len=0 TSval=1543820 TSecr=830065628
202   0.022815 54.230.158.80 -> 172.31.29.138 TCP 13098 [TCP segment of a reassembled PDU]
203   0.022823 172.31.29.138 -> 54.230.158.80 TCP 66 48532 > http [ACK] Seq=98 Ack=1225466 Win=1594368 Len=0 TSval=1543820 TSecr=830065628
204   0.022932 54.230.158.80 -> 172.31.29.138 TCP 26130 [TCP segment of a reassembled PDU]
205   0.022946 172.31.29.138 -> 54.230.158.80 TCP 66 48532 > http [ACK] Seq=98 Ack=1251530 Win=1594368 Len=0 TSval=1543820 TSecr=830065628
206   0.022972 54.230.158.80 -> 172.31.29.138 TCP 18890 [TCP segment of a reassembled PDU]
207   0.022981 172.31.29.138 -> 54.230.158.80 TCP 66 48532 > http [ACK] Seq=98 Ack=1270354 Win=1594368 Len=0 TSval=1543820 TSecr=830065628
208   0.023008 54.230.158.80 -> 172.31.29.138 TCP 7306 [TCP segment of a reassembled PDU]
209   0.023013 172.31.29.138 -> 54.230.158.80 TCP 66 48532 > http [ACK] Seq=98 Ack=1277594 Win=1594368 Len=0 TSval=1543820 TSecr=830065628
210   0.023060 54.230.158.80 -> 172.31.29.138 TCP 13098 [TCP segment of a reassembled PDU]
211   0.023068 172.31.29.138 -> 54.230.158.80 TCP 66 48532 > http [ACK] Seq=98 Ack=1290626 Win=1594368 Len=0 TSval=1543820 TSecr=830065628
212   0.023417 54.230.158.80 -> 172.31.29.138 TCP 20338 [TCP segment of a reassembled PDU]
213   0.023430 172.31.29.138 -> 54.230.158.80 TCP 66 48532 > http [ACK] Seq=98 Ack=1310898 Win=1594368 Len=0 TSval=1543820 TSecr=830065628
214   0.023438 54.230.158.80 -> 172.31.29.138 TCP 1514 [TCP Previous segment not captured] [TCP segment of a reassembled PDU]
215   0.023441 172.31.29.138 -> 54.230.158.80 TCP 78 [TCP Dup ACK 213#1] 48532 > http [ACK] Seq=98 Ack=1310898 Win=1594368 Len=0 TSval=1543820 TSecr=830065628 SLE=1312346 SRE=1313794
216   0.023443 54.230.158.80 -> 172.31.29.138 TCP 1514 [TCP Out-Of-Order] [TCP segment of a reassembled PDU]
217   0.023445 172.31.29.138 -> 54.230.158.80 TCP 66 48532 > http [ACK] Seq=98 Ack=1313794 Win=1594368 Len=0 TSval=1543820 TSecr=830065628
218   0.023539 54.230.158.80 -> 172.31.29.138 TCP 18890 [TCP segment of a reassembled PDU]
219   0.023550 172.31.29.138 -> 54.230.158.80 TCP 66 48532 > http [ACK] Seq=98 Ack=1332618 Win=1594368 Len=0 TSval=1543820 TSecr=830065628
220   0.023563 54.230.158.80 -> 172.31.29.138 TCP 7306 [TCP segment of a reassembled PDU]
221   0.023568 172.31.29.138 -> 54.230.158.80 TCP 66 48532 > http [ACK] Seq=98 Ack=1339858 Win=1594368 Len=0 TSval=1543820 TSecr=830065628
222   0.023641 54.230.158.80 -> 172.31.29.138 TCP 20338 [TCP segment of a reassembled PDU]
223   0.023652 172.31.29.138 -> 54.230.158.80 TCP 66 48532 > http [ACK] Seq=98 Ack=1360130 Win=1594368 Len=0 TSval=1543820 TSecr=830065628
224   0.023756 54.230.158.80 -> 172.31.29.138 TCP 26130 [TCP segment of a reassembled PDU]
225   0.023770 172.31.29.138 -> 54.230.158.80 TCP 66 48532 > http [ACK] Seq=98 Ack=1386194 Win=1594368 Len=0 TSval=1543820 TSecr=830065628
226   0.023783 54.230.158.80 -> 172.31.29.138 TCP 8754 [TCP segment of a reassembled PDU]
227   0.023792 172.31.29.138 -> 54.230.158.80 TCP 66 48532 > http [ACK] Seq=98 Ack=1394882 Win=1594368 Len=0 TSval=1543820 TSecr=830065628
228   0.023807 54.230.158.80 -> 172.31.29.138 TCP 17442 [TCP segment of a reassembled PDU]
229   0.023813 172.31.29.138 -> 54.230.158.80 TCP 66 48532 > http [ACK] Seq=98 Ack=1412258 Win=1594368 Len=0 TSval=1543820 TSecr=830065628
230   0.023835 54.230.158.80 -> 172.31.29.138 TCP 8754 [TCP segment of a reassembled PDU]
231   0.023840 172.31.29.138 -> 54.230.158.80 TCP 66 48532 > http [ACK] Seq=98 Ack=1420946 Win=1594368 Len=0 TSval=1543820 TSecr=830065628
232   0.024174 54.230.158.80 -> 172.31.29.138 TCP 4410 [TCP segment of a reassembled PDU]
233   0.024181 172.31.29.138 -> 54.230.158.80 TCP 66 48532 > http [ACK] Seq=98 Ack=1425290 Win=1594368 Len=0 TSval=1543820 TSecr=830065628
234   0.024475 54.230.158.80 -> 172.31.29.138 TCP 23234 [TCP segment of a reassembled PDU]
235   0.024488 172.31.29.138 -> 54.230.158.80 TCP 66 48532 > http [ACK] Seq=98 Ack=1448458 Win=1594368 Len=0 TSval=1543820 TSecr=830065628
236   0.024509 54.230.158.80 -> 172.31.29.138 TCP 2962 [TCP segment of a reassembled PDU]
237   0.024512 172.31.29.138 -> 54.230.158.80 TCP 66 48532 > http [ACK] Seq=98 Ack=1451354 Win=1594368 Len=0 TSval=1543820 TSecr=830065628
238   0.024638 54.230.158.80 -> 172.31.29.138 TCP 52194 [TCP segment of a reassembled PDU]
239   0.024675 172.31.29.138 -> 54.230.158.80 TCP 66 48532 > http [ACK] Seq=98 Ack=1503482 Win=1594368 Len=0 TSval=1543820 TSecr=830065628
240   0.024702 54.230.158.80 -> 172.31.29.138 TCP 26130 [TCP segment of a reassembled PDU]
241   0.024714 172.31.29.138 -> 54.230.158.80 TCP 66 48532 > http [ACK] Seq=98 Ack=1529546 Win=1594368 Len=0 TSval=1543820 TSecr=830065628
242   0.024758 54.230.158.80 -> 172.31.29.138 TCP 21786 [TCP segment of a reassembled PDU]
243   0.024770 172.31.29.138 -> 54.230.158.80 TCP 66 48532 > http [ACK] Seq=98 Ack=1551266 Win=1594368 Len=0 TSval=1543820 TSecr=830065628
244   0.025460 54.230.158.80 -> 172.31.29.138 TCP 10202 [TCP segment of a reassembled PDU]
245   0.025468 172.31.29.138 -> 54.230.158.80 TCP 66 48532 > http [ACK] Seq=98 Ack=1561402 Win=1594368 Len=0 TSval=1543820 TSecr=830065628
246   0.025626 54.230.158.80 -> 172.31.29.138 TCP 26130 [TCP segment of a reassembled PDU]
247   0.025640 172.31.29.138 -> 54.230.158.80 TCP 66 48532 > http [ACK] Seq=98 Ack=1587466 Win=1594368 Len=0 TSval=1543820 TSecr=830065628
248   0.025650 54.230.158.80 -> 172.31.29.138 TCP 7306 [TCP segment of a reassembled PDU]
249   0.025657 172.31.29.138 -> 54.230.158.80 TCP 66 48532 > http [ACK] Seq=98 Ack=1594706 Win=1594368 Len=0 TSval=1543820 TSecr=830065628
250   0.025675 54.230.158.80 -> 172.31.29.138 TCP 18890 [TCP segment of a reassembled PDU]
251   0.025687 172.31.29.138 -> 54.230.158.80 TCP 66 48532 > http [ACK] Seq=98 Ack=1613530 Win=1594368 Len=0 TSval=1543820 TSecr=830065628
252   0.025717 54.230.158.80 -> 172.31.29.138 TCP 2962 [TCP segment of a reassembled PDU]
253   0.025725 172.31.29.138 -> 54.230.158.80 TCP 66 48532 > http [ACK] Seq=98 Ack=1616426 Win=1594368 Len=0 TSval=1543820 TSecr=830065628
254   0.025798 54.230.158.80 -> 172.31.29.138 TCP 26130 [TCP segment of a reassembled PDU]
255   0.025811 172.31.29.138 -> 54.230.158.80 TCP 66 48532 > http [ACK] Seq=98 Ack=1642490 Win=1594368 Len=0 TSval=1543820 TSecr=830065628
256   0.025872 54.230.158.80 -> 172.31.29.138 TCP 33370 [TCP segment of a reassembled PDU]
257   0.025888 172.31.29.138 -> 54.230.158.80 TCP 66 48532 > http [ACK] Seq=98 Ack=1675794 Win=1594368 Len=0 TSval=1543820 TSecr=830065628
258   0.025898 54.230.158.80 -> 172.31.29.138 TCP 5858 [TCP segment of a reassembled PDU]
259   0.025906 172.31.29.138 -> 54.230.158.80 TCP 66 48532 > http [ACK] Seq=98 Ack=1681586 Win=1594368 Len=0 TSval=1543820 TSecr=830065628
260   0.026225 54.230.158.80 -> 172.31.29.138 TCP 2962 [TCP segment of a reassembled PDU]
261   0.026231 172.31.29.138 -> 54.230.158.80 TCP 66 48532 > http [ACK] Seq=98 Ack=1684482 Win=1594368 Len=0 TSval=1543820 TSecr=830065628
262   0.026438 54.230.158.80 -> 172.31.29.138 TCP 26130 [TCP segment of a reassembled PDU]
263   0.026452 172.31.29.138 -> 54.230.158.80 TCP 66 48532 > http [ACK] Seq=98 Ack=1710546 Win=1594368 Len=0 TSval=1543820 TSecr=830065628
264   0.026461 54.230.158.80 -> 172.31.29.138 TCP 5858 [TCP segment of a reassembled PDU]
265   0.026468 172.31.29.138 -> 54.230.158.80 TCP 66 48532 > http [ACK] Seq=98 Ack=1716338 Win=1594368 Len=0 TSval=1543820 TSecr=830065628
266   0.026487 54.230.158.80 -> 172.31.29.138 TCP 20338 [TCP segment of a reassembled PDU]
267   0.026497 172.31.29.138 -> 54.230.158.80 TCP 66 48532 > http [ACK] Seq=98 Ack=1736610 Win=1594368 Len=0 TSval=1543820 TSecr=830065628
268   0.026516 54.230.158.80 -> 172.31.29.138 TCP 10202 [TCP segment of a reassembled PDU]
269   0.026521 172.31.29.138 -> 54.230.158.80 TCP 66 48532 > http [ACK] Seq=98 Ack=1746746 Win=1594368 Len=0 TSval=1543821 TSecr=830065628
270   0.026805 54.230.158.80 -> 172.31.29.138 TCP 13098 [TCP segment of a reassembled PDU]
271   0.026816 172.31.29.138 -> 54.230.158.80 TCP 66 48532 > http [ACK] Seq=98 Ack=1759778 Win=1594368 Len=0 TSval=1543821 TSecr=830065628
272   0.026966 54.230.158.80 -> 172.31.29.138 TCP 26130 [TCP segment of a reassembled PDU]
273   0.026980 172.31.29.138 -> 54.230.158.80 TCP 66 48532 > http [ACK] Seq=98 Ack=1785842 Win=1594368 Len=0 TSval=1543821 TSecr=830065628
274   0.026996 54.230.158.80 -> 172.31.29.138 TCP 13098 [TCP segment of a reassembled PDU]
275   0.027004 172.31.29.138 -> 54.230.158.80 TCP 66 48532 > http [ACK] Seq=98 Ack=1798874 Win=1594368 Len=0 TSval=1543821 TSecr=830065628
276   0.027016 54.230.158.80 -> 172.31.29.138 TCP 13098 [TCP segment of a reassembled PDU]
277   0.027021 172.31.29.138 -> 54.230.158.80 TCP 66 48532 > http [ACK] Seq=98 Ack=1811906 Win=1594368 Len=0 TSval=1543821 TSecr=830065628
278   0.027065 54.230.158.80 -> 172.31.29.138 TCP 15994 [TCP segment of a reassembled PDU]
279   0.027074 172.31.29.138 -> 54.230.158.80 TCP 66 48532 > http [ACK] Seq=98 Ack=1827834 Win=1594368 Len=0 TSval=1543821 TSecr=830065628
280   0.027210 54.230.158.80 -> 172.31.29.138 TCP 20338 [TCP segment of a reassembled PDU]
281   0.027221 172.31.29.138 -> 54.230.158.80 TCP 66 48532 > http [ACK] Seq=98 Ack=1848106 Win=1594368 Len=0 TSval=1543821 TSecr=830065628
282   0.027235 54.230.158.80 -> 172.31.29.138 TCP 5858 [TCP segment of a reassembled PDU]
283   0.027239 172.31.29.138 -> 54.230.158.80 TCP 66 48532 > http [ACK] Seq=98 Ack=1853898 Win=1594368 Len=0 TSval=1543821 TSecr=830065628
284   0.027297 54.230.158.80 -> 172.31.29.138 TCP 23234 [TCP segment of a reassembled PDU]
285   0.027309 172.31.29.138 -> 54.230.158.80 TCP 66 48532 > http [ACK] Seq=98 Ack=1877066 Win=1594368 Len=0 TSval=1543821 TSecr=830065628
286   0.027594 54.230.158.80 -> 172.31.29.138 TCP 26130 [TCP segment of a reassembled PDU]
287   0.027609 172.31.29.138 -> 54.230.158.80 TCP 66 48532 > http [ACK] Seq=98 Ack=1903130 Win=1594368 Len=0 TSval=1543821 TSecr=830065628
288   0.027619 54.230.158.80 -> 172.31.29.138 TCP 7306 [TCP segment of a reassembled PDU]
289   0.027624 172.31.29.138 -> 54.230.158.80 TCP 66 48532 > http [ACK] Seq=98 Ack=1910370 Win=1594368 Len=0 TSval=1543821 TSecr=830065628
290   0.027641 54.230.158.80 -> 172.31.29.138 TCP 17442 [TCP segment of a reassembled PDU]
291   0.027661 172.31.29.138 -> 54.230.158.80 TCP 66 48532 > http [ACK] Seq=98 Ack=1927746 Win=1594368 Len=0 TSval=1543821 TSecr=830065628
292   0.027688 54.230.158.80 -> 172.31.29.138 TCP 14546 [TCP segment of a reassembled PDU]
293   0.027695 172.31.29.138 -> 54.230.158.80 TCP 66 48532 > http [ACK] Seq=98 Ack=1942226 Win=1594368 Len=0 TSval=1543821 TSecr=830065628
294   0.027825 54.230.158.80 -> 172.31.29.138 TCP 20338 [TCP segment of a reassembled PDU]
295   0.027832 172.31.29.138 -> 54.230.158.80 TCP 66 48532 > http [ACK] Seq=98 Ack=1962498 Win=1594368 Len=0 TSval=1543821 TSecr=830065628
296   0.027969 54.230.158.80 -> 172.31.29.138 TCP 26130 [TCP segment of a reassembled PDU]
297   0.027978 172.31.29.138 -> 54.230.158.80 TCP 66 48532 > http [ACK] Seq=98 Ack=1988562 Win=1594368 Len=0 TSval=1543821 TSecr=830065628
298   0.027998 54.230.158.80 -> 172.31.29.138 TCP 18890 [TCP segment of a reassembled PDU]
299   0.028003 172.31.29.138 -> 54.230.158.80 TCP 66 48532 > http [ACK] Seq=98 Ack=2007386 Win=1594368 Len=0 TSval=1543821 TSecr=830065628
300   0.028327 54.230.158.80 -> 172.31.29.138 TCP 17442 [TCP segment of a reassembled PDU]
301   0.028335 172.31.29.138 -> 54.230.158.80 TCP 66 48532 > http [ACK] Seq=98 Ack=2024762 Win=1594368 Len=0 TSval=1543821 TSecr=830065628
302   0.028353 54.230.158.80 -> 172.31.29.138 TCP 5858 [TCP segment of a reassembled PDU]
303   0.028356 172.31.29.138 -> 54.230.158.80 TCP 66 48532 > http [ACK] Seq=98 Ack=2030554 Win=1594368 Len=0 TSval=1543821 TSecr=830065628
304   0.028478 54.230.158.80 -> 172.31.29.138 TCP 26130 [TCP segment of a reassembled PDU]
305   0.028489 172.31.29.138 -> 54.230.158.80 TCP 66 48532 > http [ACK] Seq=98 Ack=2056618 Win=1594368 Len=0 TSval=1543821 TSecr=830065628
306   0.028534 54.230.158.80 -> 172.31.29.138 TCP 26130 [TCP segment of a reassembled PDU]
307   0.028541 172.31.29.138 -> 54.230.158.80 TCP 66 48532 > http [ACK] Seq=98 Ack=2082682 Win=1594368 Len=0 TSval=1543821 TSecr=830065628
308   0.028551 54.230.158.80 -> 172.31.29.138 TCP 4410 [TCP segment of a reassembled PDU]
309   0.028553 172.31.29.138 -> 54.230.158.80 TCP 66 48532 > http [ACK] Seq=98 Ack=2087026 Win=1594368 Len=0 TSval=1543821 TSecr=830065628
310   0.028672 54.230.158.80 -> 172.31.29.138 TCP 47850 [TCP segment of a reassembled PDU]
311   0.028683 172.31.29.138 -> 54.230.158.80 TCP 66 48532 > http [ACK] Seq=98 Ack=2134810 Win=1594368 Len=0 TSval=1543821 TSecr=830065628
312   0.028692 54.230.158.80 -> 172.31.29.138 TCP 2962 [TCP segment of a reassembled PDU]
313   0.028695 172.31.29.138 -> 54.230.158.80 TCP 66 48532 > http [ACK] Seq=98 Ack=2137706 Win=1594368 Len=0 TSval=1543821 TSecr=830065628
314   0.028971 54.230.158.80 -> 172.31.29.138 TCP 26130 [TCP segment of a reassembled PDU]
315   0.028980 172.31.29.138 -> 54.230.158.80 TCP 66 48532 > http [ACK] Seq=98 Ack=2163770 Win=1594368 Len=0 TSval=1543821 TSecr=830065628
316   0.029024 54.230.158.80 -> 172.31.29.138 TCP 26130 [TCP segment of a reassembled PDU]
317   0.029031 172.31.29.138 -> 54.230.158.80 TCP 66 48532 > http [ACK] Seq=98 Ack=2189834 Win=1594368 Len=0 TSval=1543821 TSecr=830065628
318   0.029057 54.230.158.80 -> 172.31.29.138 TCP 10202 [TCP segment of a reassembled PDU]
319   0.029061 172.31.29.138 -> 54.230.158.80 TCP 66 48532 > http [ACK] Seq=98 Ack=2199970 Win=1594368 Len=0 TSval=1543821 TSecr=830065628
320   0.029089 54.230.158.80 -> 172.31.29.138 TCP 2962 [TCP segment of a reassembled PDU]
321   0.029093 172.31.29.138 -> 54.230.158.80 TCP 66 48532 > http [ACK] Seq=98 Ack=2202866 Win=1594368 Len=0 TSval=1543821 TSecr=830065628
322   0.029320 54.230.158.80 -> 172.31.29.138 TCP 7306 [TCP segment of a reassembled PDU]
323   0.029326 172.31.29.138 -> 54.230.158.80 TCP 66 48532 > http [ACK] Seq=98 Ack=2210106 Win=1594368 Len=0 TSval=1543821 TSecr=830065628
324   0.029505 54.230.158.80 -> 172.31.29.138 TCP 26130 [TCP segment of a reassembled PDU]
325   0.029513 172.31.29.138 -> 54.230.158.80 TCP 66 48532 > http [ACK] Seq=98 Ack=2236170 Win=1594368 Len=0 TSval=1543821 TSecr=830065628
326   0.029529 54.230.158.80 -> 172.31.29.138 TCP 11650 [TCP segment of a reassembled PDU]
327   0.029532 172.31.29.138 -> 54.230.158.80 TCP 66 48532 > http [ACK] Seq=98 Ack=2247754 Win=1594368 Len=0 TSval=1543821 TSecr=830065628
328   0.029538 54.230.158.80 -> 172.31.29.138 TCP 4410 [TCP segment of a reassembled PDU]
329   0.029541 172.31.29.138 -> 54.230.158.80 TCP 66 48532 > http [ACK] Seq=98 Ack=2252098 Win=1594368 Len=0 TSval=1543821 TSecr=830065628
330   0.029635 54.230.158.80 -> 172.31.29.138 TCP 36266 [TCP segment of a reassembled PDU]
331   0.029646 172.31.29.138 -> 54.230.158.80 TCP 66 48532 > http [ACK] Seq=98 Ack=2288298 Win=1594368 Len=0 TSval=1543821 TSecr=830065628
332   0.029708 54.230.158.80 -> 172.31.29.138 TCP 26130 [TCP segment of a reassembled PDU]
333   0.029717 172.31.29.138 -> 54.230.158.80 TCP 66 48532 > http [ACK] Seq=98 Ack=2314362 Win=1594368 Len=0 TSval=1543821 TSecr=830065628
334   0.029747 54.230.158.80 -> 172.31.29.138 TCP 18890 [TCP segment of a reassembled PDU]
335   0.029753 172.31.29.138 -> 54.230.158.80 TCP 66 48532 > http [ACK] Seq=98 Ack=2333186 Win=1594368 Len=0 TSval=1543821 TSecr=830065628
336   0.029992 54.230.158.80 -> 172.31.29.138 TCP 17442 [TCP segment of a reassembled PDU]
337   0.030000 172.31.29.138 -> 54.230.158.80 TCP 66 48532 > http [ACK] Seq=98 Ack=2350562 Win=1594368 Len=0 TSval=1543821 TSecr=830065629
338   0.030023 54.230.158.80 -> 172.31.29.138 TCP 8754 [TCP segment of a reassembled PDU]
339   0.030027 172.31.29.138 -> 54.230.158.80 TCP 66 48532 > http [ACK] Seq=98 Ack=2359250 Win=1594368 Len=0 TSval=1543821 TSecr=830065629
340   0.030118 54.230.158.80 -> 172.31.29.138 TCP 39162 [TCP segment of a reassembled PDU]
341   0.030128 172.31.29.138 -> 54.230.158.80 TCP 66 48532 > http [ACK] Seq=98 Ack=2398346 Win=1594368 Len=0 TSval=1543821 TSecr=830065629
342   0.030485 54.230.158.80 -> 172.31.29.138 TCP 26130 [TCP segment of a reassembled PDU]
343   0.030505 172.31.29.138 -> 54.230.158.80 TCP 66 48532 > http [ACK] Seq=98 Ack=2424410 Win=1594368 Len=0 TSval=1543822 TSecr=830065629
344   0.030634 54.230.158.80 -> 172.31.29.138 TCP 26130 [TCP segment of a reassembled PDU]
345   0.030641 172.31.29.138 -> 54.230.158.80 TCP 66 48532 > http [ACK] Seq=98 Ack=2450474 Win=1594368 Len=0 TSval=1543822 TSecr=830065629
346   0.030653 54.230.158.80 -> 172.31.29.138 TCP 10202 [TCP segment of a reassembled PDU]
347   0.030656 172.31.29.138 -> 54.230.158.80 TCP 66 48532 > http [ACK] Seq=98 Ack=2460610 Win=1594368 Len=0 TSval=1543822 TSecr=830065629
348   0.030692 54.230.158.80 -> 172.31.29.138 TCP 15994 [TCP segment of a reassembled PDU]
