[Measurement for 10mb at 19:38:57 19.38.2014] 
Tshark:

  1   0.000000 172.31.29.138 -> 172.31.0.2   DNS 89 Standard query 0x6635  A d1n0gskdvzj94j.cloudfront.net
  2   0.000023 172.31.29.138 -> 172.31.0.2   DNS 89 Standard query 0xdf80  AAAA d1n0gskdvzj94j.cloudfront.net
  3   0.000563   172.31.0.2 -> 172.31.29.138 DNS 176 Standard query response 0xdf80 
  4   0.000573   172.31.0.2 -> 172.31.29.138 DNS 217 Standard query response 0x6635  A 54.230.158.252 A 54.230.159.4 A 54.192.156.109 A 54.192.157.146 A 54.192.159.157 A 54.230.158.139 A 54.230.158.152 A 54.230.158.246
  5   0.003904 172.31.29.138 -> 54.230.158.252 TCP 74 51161 > http [SYN] Seq=0 Win=26883 Len=0 MSS=8961 SACK_PERM=1 TSval=2452523 TSecr=0 WS=128
  6   0.004803 54.230.158.252 -> 172.31.29.138 TCP 74 http > 51161 [SYN, ACK] Seq=0 Ack=1 Win=14480 Len=0 MSS=1460 SACK_PERM=1 TSval=728970300 TSecr=2452523 WS=128
  7   0.004817 172.31.29.138 -> 54.230.158.252 TCP 66 51161 > http [ACK] Seq=1 Ack=1 Win=27008 Len=0 TSval=2452523 TSecr=728970300
  8   0.004861 172.31.29.138 -> 54.230.158.252 HTTP 163 GET /10mb HTTP/1.1 
  9   0.005467 54.230.158.252 -> 172.31.29.138 TCP 66 http > 51161 [ACK] Seq=1 Ack=98 Win=14592 Len=0 TSval=728970300 TSecr=2452523
 10   0.007521 54.230.158.252 -> 172.31.29.138 TCP 523 [TCP segment of a reassembled PDU]
 11   0.007530 172.31.29.138 -> 54.230.158.252 TCP 66 51161 > http [ACK] Seq=98 Ack=458 Win=28032 Len=0 TSval=2452524 TSecr=728970300
 12   0.007786 54.230.158.252 -> 172.31.29.138 TCP 4410 [TCP segment of a reassembled PDU]
 13   0.007793 172.31.29.138 -> 54.230.158.252 TCP 66 51161 > http [ACK] Seq=98 Ack=4802 Win=36736 Len=0 TSval=2452524 TSecr=728970300
 14   0.007836 54.230.158.252 -> 172.31.29.138 TCP 8754 [TCP segment of a reassembled PDU]
 15   0.007844 172.31.29.138 -> 54.230.158.252 TCP 66 51161 > http [ACK] Seq=98 Ack=13490 Win=54144 Len=0 TSval=2452524 TSecr=728970300
 16   0.008578 54.230.158.252 -> 172.31.29.138 TCP 4410 [TCP segment of a reassembled PDU]
 17   0.008584 172.31.29.138 -> 54.230.158.252 TCP 66 51161 > http [ACK] Seq=98 Ack=17834 Win=62720 Len=0 TSval=2452524 TSecr=728970300
 18   0.008610 54.230.158.252 -> 172.31.29.138 TCP 8754 [TCP segment of a reassembled PDU]
 19   0.008621 172.31.29.138 -> 54.230.158.252 TCP 66 51161 > http [ACK] Seq=98 Ack=26522 Win=80128 Len=0 TSval=2452524 TSecr=728970300
 20   0.009357 54.230.158.252 -> 172.31.29.138 TCP 4410 [TCP segment of a reassembled PDU]
 21   0.009363 172.31.29.138 -> 54.230.158.252 TCP 66 51161 > http [ACK] Seq=98 Ack=30866 Win=88832 Len=0 TSval=2452524 TSecr=728970300
 22   0.009421 54.230.158.252 -> 172.31.29.138 TCP 17442 [TCP segment of a reassembled PDU]
 23   0.009433 172.31.29.138 -> 54.230.158.252 TCP 66 51161 > http [ACK] Seq=98 Ack=48242 Win=89344 Len=0 TSval=2452524 TSecr=728970300
 24   0.010089 54.230.158.252 -> 172.31.29.138 TCP 2962 [TCP segment of a reassembled PDU]
 25   0.010094 172.31.29.138 -> 54.230.158.252 TCP 66 51161 > http [ACK] Seq=98 Ack=51138 Win=109056 Len=0 TSval=2452524 TSecr=728970301
 26   0.010117 54.230.158.252 -> 172.31.29.138 TCP 1514 [TCP segment of a reassembled PDU]
 27   0.010121 172.31.29.138 -> 54.230.158.252 TCP 66 51161 > http [ACK] Seq=98 Ack=52586 Win=109056 Len=0 TSval=2452524 TSecr=728970301
 28   0.010182 54.230.158.252 -> 172.31.29.138 TCP 13098 [TCP segment of a reassembled PDU]
 29   0.010190 172.31.29.138 -> 54.230.158.252 TCP 66 51161 > http [ACK] Seq=98 Ack=65618 Win=96512 Len=0 TSval=2452524 TSecr=728970301
 30   0.010849 54.230.158.252 -> 172.31.29.138 TCP 2962 [TCP segment of a reassembled PDU]
 31   0.010854 172.31.29.138 -> 54.230.158.252 TCP 66 51161 > http [ACK] Seq=98 Ack=68514 Win=109056 Len=0 TSval=2452525 TSecr=728970301
 32   0.010933 54.230.158.252 -> 172.31.29.138 TCP 10202 [TCP segment of a reassembled PDU]
 33   0.010941 172.31.29.138 -> 54.230.158.252 TCP 66 51161 > http [ACK] Seq=98 Ack=78650 Win=129280 Len=0 TSval=2452525 TSecr=728970301
 34   0.010972 54.230.158.252 -> 172.31.29.138 TCP 13098 [TCP segment of a reassembled PDU]
 35   0.010985 172.31.29.138 -> 54.230.158.252 TCP 66 51161 > http [ACK] Seq=98 Ack=91682 Win=155392 Len=0 TSval=2452525 TSecr=728970301
 36   0.011650 54.230.158.252 -> 172.31.29.138 TCP 8754 [TCP segment of a reassembled PDU]
 37   0.011656 172.31.29.138 -> 54.230.158.252 TCP 66 51161 > http [ACK] Seq=98 Ack=100370 Win=172800 Len=0 TSval=2452525 TSecr=728970301
 38   0.011750 54.230.158.252 -> 172.31.29.138 TCP 17442 [TCP segment of a reassembled PDU]
 39   0.011760 172.31.29.138 -> 54.230.158.252 TCP 66 51161 > http [ACK] Seq=98 Ack=117746 Win=207488 Len=0 TSval=2452525 TSecr=728970301
 40   0.012390 54.230.158.252 -> 172.31.29.138 TCP 4410 [TCP segment of a reassembled PDU]
 41   0.012396 172.31.29.138 -> 54.230.158.252 TCP 66 51161 > http [ACK] Seq=98 Ack=122090 Win=216192 Len=0 TSval=2452525 TSecr=728970301
 42   0.012532 54.230.158.252 -> 172.31.29.138 TCP 21786 [TCP segment of a reassembled PDU]
 43   0.012543 172.31.29.138 -> 54.230.158.252 TCP 66 51161 > http [ACK] Seq=98 Ack=143810 Win=259712 Len=0 TSval=2452525 TSecr=728970301
 44   0.013181 54.230.158.252 -> 172.31.29.138 TCP 5858 [TCP segment of a reassembled PDU]
 45   0.013188 172.31.29.138 -> 54.230.158.252 TCP 66 51161 > http [ACK] Seq=98 Ack=149602 Win=271232 Len=0 TSval=2452525 TSecr=728970301
 46   0.013309 54.230.158.252 -> 172.31.29.138 TCP 20338 [TCP segment of a reassembled PDU]
 47   0.013319 172.31.29.138 -> 54.230.158.252 TCP 66 51161 > http [ACK] Seq=98 Ack=169874 Win=311808 Len=0 TSval=2452525 TSecr=728970301
 48   0.013341 54.230.158.252 -> 172.31.29.138 TCP 13098 [TCP segment of a reassembled PDU]
 49   0.013362 172.31.29.138 -> 54.230.158.252 TCP 66 51161 > http [ACK] Seq=98 Ack=182906 Win=337792 Len=0 TSval=2452525 TSecr=728970301
 50   0.013921 54.230.158.252 -> 172.31.29.138 TCP 2962 [TCP segment of a reassembled PDU]
 51   0.013927 172.31.29.138 -> 54.230.158.252 TCP 66 51161 > http [ACK] Seq=98 Ack=185802 Win=343680 Len=0 TSval=2452525 TSecr=728970301
 52   0.014048 54.230.158.252 -> 172.31.29.138 TCP 10202 [TCP segment of a reassembled PDU]
 53   0.014055 172.31.29.138 -> 54.230.158.252 TCP 66 51161 > http [ACK] Seq=98 Ack=195938 Win=363904 Len=0 TSval=2452525 TSecr=728970301
 54   0.014127 54.230.158.252 -> 172.31.29.138 TCP 26130 [TCP segment of a reassembled PDU]
 55   0.014140 172.31.29.138 -> 54.230.158.252 TCP 66 51161 > http [ACK] Seq=98 Ack=222002 Win=416000 Len=0 TSval=2452525 TSecr=728970301
 56   0.014148 54.230.158.252 -> 172.31.29.138 TCP 4410 [TCP segment of a reassembled PDU]
 57   0.014165 172.31.29.138 -> 54.230.158.252 TCP 66 51161 > http [ACK] Seq=98 Ack=226346 Win=424704 Len=0 TSval=2452525 TSecr=728970301
 58   0.014700 54.230.158.252 -> 172.31.29.138 TCP 4410 [TCP segment of a reassembled PDU]
 59   0.014705 172.31.29.138 -> 54.230.158.252 TCP 66 51161 > http [ACK] Seq=98 Ack=230690 Win=433408 Len=0 TSval=2452526 TSecr=728970301
 60   0.014881 54.230.158.252 -> 172.31.29.138 TCP 27578 [TCP segment of a reassembled PDU]
 61   0.014895 172.31.29.138 -> 54.230.158.252 TCP 66 51161 > http [ACK] Seq=98 Ack=258202 Win=488448 Len=0 TSval=2452526 TSecr=728970301
 62   0.014917 54.230.158.252 -> 172.31.29.138 TCP 11650 [TCP segment of a reassembled PDU]
 63   0.014924 172.31.29.138 -> 54.230.158.252 TCP 66 51161 > http [ACK] Seq=98 Ack=269786 Win=511616 Len=0 TSval=2452526 TSecr=728970301
 64   0.015483 54.230.158.252 -> 172.31.29.138 TCP 4410 [TCP segment of a reassembled PDU]
 65   0.015489 172.31.29.138 -> 54.230.158.252 TCP 66 51161 > http [ACK] Seq=98 Ack=274130 Win=520320 Len=0 TSval=2452526 TSecr=728970301
 66   0.015658 54.230.158.252 -> 172.31.29.138 TCP 26130 [TCP segment of a reassembled PDU]
 67   0.015672 172.31.29.138 -> 54.230.158.252 TCP 66 51161 > http [ACK] Seq=98 Ack=300194 Win=572416 Len=0 TSval=2452526 TSecr=728970301
 68   0.015686 54.230.158.252 -> 172.31.29.138 TCP 10202 [TCP segment of a reassembled PDU]
 69   0.015695 172.31.29.138 -> 54.230.158.252 TCP 66 51161 > http [ACK] Seq=98 Ack=310330 Win=592640 Len=0 TSval=2452526 TSecr=728970301
 70   0.016232 54.230.158.252 -> 172.31.29.138 TCP 4410 [TCP segment of a reassembled PDU]
 71   0.016237 172.31.29.138 -> 54.230.158.252 TCP 66 51161 > http [ACK] Seq=98 Ack=314674 Win=601344 Len=0 TSval=2452526 TSecr=728970301
 72   0.016374 54.230.158.252 -> 172.31.29.138 TCP 11650 [TCP segment of a reassembled PDU]
 73   0.016382 172.31.29.138 -> 54.230.158.252 TCP 66 51161 > http [ACK] Seq=98 Ack=326258 Win=624512 Len=0 TSval=2452526 TSecr=728970301
 74   0.016452 54.230.158.252 -> 172.31.29.138 TCP 26130 [TCP segment of a reassembled PDU]
 75   0.016465 172.31.29.138 -> 54.230.158.252 TCP 66 51161 > http [ACK] Seq=98 Ack=352322 Win=676736 Len=0 TSval=2452526 TSecr=728970301
 76   0.016474 54.230.158.252 -> 172.31.29.138 TCP 4410 [TCP segment of a reassembled PDU]
 77   0.016477 172.31.29.138 -> 54.230.158.252 TCP 66 51161 > http [ACK] Seq=98 Ack=356666 Win=685312 Len=0 TSval=2452526 TSecr=728970301
 78   0.017020 54.230.158.252 -> 172.31.29.138 TCP 1514 [TCP segment of a reassembled PDU]
 79   0.017024 172.31.29.138 -> 54.230.158.252 TCP 66 51161 > http [ACK] Seq=98 Ack=358114 Win=688256 Len=0 TSval=2452526 TSecr=728970301
 80   0.017218 54.230.158.252 -> 172.31.29.138 TCP 26130 [TCP segment of a reassembled PDU]
 81   0.017232 172.31.29.138 -> 54.230.158.252 TCP 66 51161 > http [ACK] Seq=98 Ack=384178 Win=740352 Len=0 TSval=2452526 TSecr=728970301
 82   0.017242 54.230.158.252 -> 172.31.29.138 TCP 7306 [TCP segment of a reassembled PDU]
 83   0.017250 172.31.29.138 -> 54.230.158.252 TCP 66 51161 > http [ACK] Seq=98 Ack=391418 Win=754816 Len=0 TSval=2452526 TSecr=728970301
 84   0.017265 54.230.158.252 -> 172.31.29.138 TCP 15994 [TCP segment of a reassembled PDU]
 85   0.017273 172.31.29.138 -> 54.230.158.252 TCP 66 51161 > http [ACK] Seq=98 Ack=407346 Win=786688 Len=0 TSval=2452526 TSecr=728970301
 86   0.017291 54.230.158.252 -> 172.31.29.138 TCP 7306 [TCP segment of a reassembled PDU]
 87   0.017297 172.31.29.138 -> 54.230.158.252 TCP 66 51161 > http [ACK] Seq=98 Ack=414586 Win=801152 Len=0 TSval=2452526 TSecr=728970301
 88   0.017768 54.230.158.252 -> 172.31.29.138 TCP 4410 [TCP segment of a reassembled PDU]
 89   0.017775 172.31.29.138 -> 54.230.158.252 TCP 66 51161 > http [ACK] Seq=98 Ack=418930 Win=809856 Len=0 TSval=2452526 TSecr=728970301
 90   0.017945 54.230.158.252 -> 172.31.29.138 TCP 26130 [TCP segment of a reassembled PDU]
 91   0.017971 172.31.29.138 -> 54.230.158.252 TCP 66 51161 > http [ACK] Seq=98 Ack=444994 Win=862080 Len=0 TSval=2452526 TSecr=728970301
 92   0.017994 54.230.158.252 -> 172.31.29.138 TCP 15994 [TCP segment of a reassembled PDU]
 93   0.018002 172.31.29.138 -> 54.230.158.252 TCP 66 51161 > http [ACK] Seq=98 Ack=460922 Win=867968 Len=0 TSval=2452526 TSecr=728970301
 94   0.018011 54.230.158.252 -> 172.31.29.138 TCP 8754 [TCP segment of a reassembled PDU]
 95   0.018019 172.31.29.138 -> 54.230.158.252 TCP 66 51161 > http [ACK] Seq=98 Ack=469610 Win=859392 Len=0 TSval=2452526 TSecr=728970301
 96   0.018024 54.230.158.252 -> 172.31.29.138 TCP 1514 [TCP segment of a reassembled PDU]
 97   0.018026 172.31.29.138 -> 54.230.158.252 TCP 66 51161 > http [ACK] Seq=98 Ack=471058 Win=857984 Len=0 TSval=2452526 TSecr=728970301
 98   0.018067 54.230.158.252 -> 172.31.29.138 TCP 14546 [TCP segment of a reassembled PDU]
 99   0.018077 172.31.29.138 -> 54.230.158.252 TCP 66 51161 > http [ACK] Seq=98 Ack=485538 Win=896512 Len=0 TSval=2452526 TSecr=728970301
100   0.018539 54.230.158.252 -> 172.31.29.138 TCP 2962 [TCP segment of a reassembled PDU]
101   0.018545 172.31.29.138 -> 54.230.158.252 TCP 66 51161 > http [ACK] Seq=98 Ack=488434 Win=928640 Len=0 TSval=2452527 TSecr=728970301
102   0.018726 54.230.158.252 -> 172.31.29.138 TCP 26130 [TCP segment of a reassembled PDU]
103   0.018739 172.31.29.138 -> 54.230.158.252 TCP 66 51161 > http [ACK] Seq=98 Ack=514498 Win=980736 Len=0 TSval=2452527 TSecr=728970301
104   0.018750 54.230.158.252 -> 172.31.29.138 TCP 7306 [TCP segment of a reassembled PDU]
105   0.018758 172.31.29.138 -> 54.230.158.252 TCP 66 51161 > http [ACK] Seq=98 Ack=521738 Win=995200 Len=0 TSval=2452527 TSecr=728970301
106   0.018798 54.230.158.252 -> 172.31.29.138 TCP 4410 [TCP segment of a reassembled PDU]
107   0.018808 172.31.29.138 -> 54.230.158.252 TCP 66 51161 > http [ACK] Seq=98 Ack=526082 Win=1003904 Len=0 TSval=2452527 TSecr=728970301
108   0.018971 54.230.158.252 -> 172.31.29.138 TCP 23234 [TCP segment of a reassembled PDU]
109   0.018984 172.31.29.138 -> 54.230.158.252 TCP 66 51161 > http [ACK] Seq=98 Ack=549250 Win=1050240 Len=0 TSval=2452527 TSecr=728970301
110   0.019304 54.230.158.252 -> 172.31.29.138 TCP 4410 [TCP segment of a reassembled PDU]
111   0.019310 172.31.29.138 -> 54.230.158.252 TCP 66 51161 > http [ACK] Seq=98 Ack=553594 Win=1058944 Len=0 TSval=2452527 TSecr=728970301
112   0.019499 54.230.158.252 -> 172.31.29.138 TCP 23234 [TCP segment of a reassembled PDU]
113   0.019511 172.31.29.138 -> 54.230.158.252 TCP 66 51161 > http [ACK] Seq=98 Ack=576762 Win=1105280 Len=0 TSval=2452527 TSecr=728970301
114   0.019537 54.230.158.252 -> 172.31.29.138 TCP 2962 [TCP segment of a reassembled PDU]
115   0.019541 172.31.29.138 -> 54.230.158.252 TCP 66 51161 > http [ACK] Seq=98 Ack=579658 Win=1111040 Len=0 TSval=2452527 TSecr=728970301
116   0.019611 54.230.158.252 -> 172.31.29.138 TCP 7306 [TCP segment of a reassembled PDU]
117   0.019618 172.31.29.138 -> 54.230.158.252 TCP 66 51161 > http [ACK] Seq=98 Ack=586898 Win=1125504 Len=0 TSval=2452527 TSecr=728970301
118   0.019638 54.230.158.252 -> 172.31.29.138 TCP 26130 [TCP segment of a reassembled PDU]
119   0.019649 172.31.29.138 -> 54.230.158.252 TCP 66 51161 > http [ACK] Seq=98 Ack=612962 Win=1177728 Len=0 TSval=2452527 TSecr=728970301
120   0.019654 54.230.158.252 -> 172.31.29.138 TCP 4410 [TCP segment of a reassembled PDU]
121   0.019657 172.31.29.138 -> 54.230.158.252 TCP 66 51161 > http [ACK] Seq=98 Ack=617306 Win=1186432 Len=0 TSval=2452527 TSecr=728970301
122   0.019675 54.230.158.252 -> 172.31.29.138 TCP 18890 [TCP segment of a reassembled PDU]
123   0.019683 172.31.29.138 -> 54.230.158.252 TCP 66 51161 > http [ACK] Seq=98 Ack=636130 Win=1224064 Len=0 TSval=2452527 TSecr=728970301
124   0.020068 54.230.158.252 -> 172.31.29.138 TCP 2962 [TCP segment of a reassembled PDU]
125   0.020074 172.31.29.138 -> 54.230.158.252 TCP 66 51161 > http [ACK] Seq=98 Ack=639026 Win=1229824 Len=0 TSval=2452527 TSecr=728970302
126   0.020217 54.230.158.252 -> 172.31.29.138 TCP 13098 [TCP segment of a reassembled PDU]
127   0.020226 172.31.29.138 -> 54.230.158.252 TCP 66 51161 > http [ACK] Seq=98 Ack=652058 Win=1255936 Len=0 TSval=2452527 TSecr=728970302
128   0.020329 54.230.158.252 -> 172.31.29.138 TCP 2962 [TCP segment of a reassembled PDU]
129   0.020334 172.31.29.138 -> 54.230.158.252 TCP 66 51161 > http [ACK] Seq=98 Ack=654954 Win=1261696 Len=0 TSval=2452527 TSecr=728970302
130   0.020512 54.230.158.252 -> 172.31.29.138 TCP 26130 [TCP segment of a reassembled PDU]
131   0.020525 172.31.29.138 -> 54.230.158.252 TCP 66 51161 > http [ACK] Seq=98 Ack=681018 Win=1281664 Len=0 TSval=2452527 TSecr=728970302
132   0.020565 54.230.158.252 -> 172.31.29.138 TCP 17442 [TCP segment of a reassembled PDU]
133   0.020574 172.31.29.138 -> 54.230.158.252 TCP 66 51161 > http [ACK] Seq=98 Ack=698394 Win=1264384 Len=0 TSval=2452527 TSecr=728970302
134   0.020603 54.230.158.252 -> 172.31.29.138 TCP 8754 [TCP segment of a reassembled PDU]
135   0.020609 172.31.29.138 -> 54.230.158.252 TCP 66 51161 > http [ACK] Seq=98 Ack=707082 Win=1255808 Len=0 TSval=2452527 TSecr=728970302
136   0.020641 54.230.158.252 -> 172.31.29.138 TCP 10202 [TCP segment of a reassembled PDU]
137   0.020648 172.31.29.138 -> 54.230.158.252 TCP 66 51161 > http [ACK] Seq=98 Ack=717218 Win=1293568 Len=0 TSval=2452527 TSecr=728970302
138   0.020827 54.230.158.252 -> 172.31.29.138 TCP 1514 [TCP segment of a reassembled PDU]
139   0.020832 172.31.29.138 -> 54.230.158.252 TCP 66 51161 > http [ACK] Seq=98 Ack=718666 Win=1316736 Len=0 TSval=2452527 TSecr=728970302
140   0.021023 54.230.158.252 -> 172.31.29.138 TCP 26130 [TCP segment of a reassembled PDU]
141   0.021036 172.31.29.138 -> 54.230.158.252 TCP 66 51161 > http [ACK] Seq=98 Ack=744730 Win=1290752 Len=0 TSval=2452527 TSecr=728970302
142   0.021051 54.230.158.252 -> 172.31.29.138 TCP 15994 [TCP segment of a reassembled PDU]
143   0.021062 172.31.29.138 -> 54.230.158.252 TCP 66 51161 > http [ACK] Seq=98 Ack=760658 Win=1274880 Len=0 TSval=2452527 TSecr=728970302
144   0.021072 54.230.158.252 -> 172.31.29.138 TCP 10202 [TCP segment of a reassembled PDU]
145   0.021076 172.31.29.138 -> 54.230.158.252 TCP 66 51161 > http [ACK] Seq=98 Ack=770794 Win=1264768 Len=0 TSval=2452527 TSecr=728970302
146   0.021106 54.230.158.252 -> 172.31.29.138 TCP 11650 [TCP segment of a reassembled PDU]
147   0.021113 172.31.29.138 -> 54.230.158.252 TCP 66 51161 > http [ACK] Seq=98 Ack=782378 Win=1253248 Len=0 TSval=2452527 TSecr=728970302
148   0.021483 54.230.158.252 -> 172.31.29.138 TCP 24682 [TCP segment of a reassembled PDU]
149   0.021497 172.31.29.138 -> 54.230.158.252 TCP 66 51161 > http [ACK] Seq=98 Ack=806994 Win=1284096 Len=0 TSval=2452527 TSecr=728970302
150   0.021503 54.230.158.252 -> 172.31.29.138 TCP 1514 [TCP segment of a reassembled PDU]
151   0.021505 172.31.29.138 -> 54.230.158.252 TCP 66 51161 > http [ACK] Seq=98 Ack=808442 Win=1282688 Len=0 TSval=2452527 TSecr=728970302
152   0.021537 54.230.158.252 -> 172.31.29.138 TCP 15994 [TCP segment of a reassembled PDU]
153   0.021568 172.31.29.138 -> 54.230.158.252 TCP 66 51161 > http [ACK] Seq=98 Ack=824370 Win=1298304 Len=0 TSval=2452527 TSecr=728970302
154   0.021693 54.230.158.252 -> 172.31.29.138 TCP 20338 [TCP segment of a reassembled PDU]
155   0.021716 172.31.29.138 -> 54.230.158.252 TCP 66 51161 > http [ACK] Seq=98 Ack=844642 Win=1291136 Len=0 TSval=2452527 TSecr=728970302
156   0.021771 54.230.158.252 -> 172.31.29.138 TCP 2962 [TCP segment of a reassembled PDU]
157   0.021776 172.31.29.138 -> 54.230.158.252 TCP 66 51161 > http [ACK] Seq=98 Ack=847538 Win=1317376 Len=0 TSval=2452527 TSecr=728970302
158   0.021908 54.230.158.252 -> 172.31.29.138 TCP 13098 [TCP segment of a reassembled PDU]
159   0.021975 172.31.29.138 -> 54.230.158.252 TCP 66 51161 > http [ACK] Seq=98 Ack=860570 Win=1317376 Len=0 TSval=2452527 TSecr=728970302
160   0.022073 54.230.158.252 -> 172.31.29.138 TCP 26130 [TCP segment of a reassembled PDU]
161   0.022098 54.230.158.252 -> 172.31.29.138 TCP 20338 [TCP segment of a reassembled PDU]
162   0.022119 54.230.158.252 -> 172.31.29.138 TCP 4410 [TCP segment of a reassembled PDU]
163   0.022131 172.31.29.138 -> 54.230.158.252 TCP 66 51161 > http [ACK] Seq=98 Ack=911250 Win=1266816 Len=0 TSval=2452527 TSecr=728970302
164   0.022231 54.230.158.252 -> 172.31.29.138 TCP 1514 [TCP segment of a reassembled PDU]
165   0.022546 54.230.158.252 -> 172.31.29.138 TCP 26130 [TCP segment of a reassembled PDU]
166   0.022560 172.31.29.138 -> 54.230.158.252 TCP 66 51161 > http [ACK] Seq=98 Ack=938762 Win=1281664 Len=0 TSval=2452528 TSecr=728970302
167   0.022606 54.230.158.252 -> 172.31.29.138 TCP 26130 [TCP segment of a reassembled PDU]
168   0.022619 172.31.29.138 -> 54.230.158.252 TCP 66 51161 > http [ACK] Seq=98 Ack=964826 Win=1369472 Len=0 TSval=2452528 TSecr=728970302
169   0.022625 54.230.158.252 -> 172.31.29.138 TCP 1514 [TCP segment of a reassembled PDU]
170   0.022630 172.31.29.138 -> 54.230.158.252 TCP 66 51161 > http [ACK] Seq=98 Ack=966274 Win=1372416 Len=0 TSval=2452528 TSecr=728970302
171   0.022642 54.230.158.252 -> 172.31.29.138 TCP 10202 [TCP segment of a reassembled PDU]
172   0.022647 172.31.29.138 -> 54.230.158.252 TCP 66 51161 > http [ACK] Seq=98 Ack=976410 Win=1392640 Len=0 TSval=2452528 TSecr=728970302
173   0.022661 54.230.158.252 -> 172.31.29.138 TCP 1514 [TCP segment of a reassembled PDU]
174   0.022663 172.31.29.138 -> 54.230.158.252 TCP 66 51161 > http [ACK] Seq=98 Ack=977858 Win=1395584 Len=0 TSval=2452528 TSecr=728970302
175   0.022929 54.230.158.252 -> 172.31.29.138 TCP 10202 [TCP segment of a reassembled PDU]
176   0.022937 172.31.29.138 -> 54.230.158.252 TCP 66 51161 > http [ACK] Seq=98 Ack=987994 Win=1415808 Len=0 TSval=2452528 TSecr=728970302
177   0.023041 54.230.158.252 -> 172.31.29.138 TCP 26130 [TCP segment of a reassembled PDU]
178   0.023055 172.31.29.138 -> 54.230.158.252 TCP 66 51161 > http [ACK] Seq=98 Ack=1014058 Win=1468032 Len=0 TSval=2452528 TSecr=728970302
179   0.023090 54.230.158.252 -> 172.31.29.138 TCP 21786 [TCP segment of a reassembled PDU]
180   0.023100 172.31.29.138 -> 54.230.158.252 TCP 66 51161 > http [ACK] Seq=98 Ack=1035778 Win=1511424 Len=0 TSval=2452528 TSecr=728970302
181   0.023156 54.230.158.252 -> 172.31.29.138 TCP 15994 [TCP segment of a reassembled PDU]
182   0.023164 172.31.29.138 -> 54.230.158.252 TCP 66 51161 > http [ACK] Seq=98 Ack=1051706 Win=1543296 Len=0 TSval=2452528 TSecr=728970302
183   0.023227 54.230.158.252 -> 172.31.29.138 TCP 18890 [TCP segment of a reassembled PDU]
184   0.023238 172.31.29.138 -> 54.230.158.252 TCP 66 51161 > http [ACK] Seq=98 Ack=1070530 Win=1580928 Len=0 TSval=2452528 TSecr=728970302
185   0.023312 54.230.158.252 -> 172.31.29.138 TCP 26130 [TCP segment of a reassembled PDU]
186   0.023326 172.31.29.138 -> 54.230.158.252 TCP 66 51161 > http [ACK] Seq=98 Ack=1096594 Win=1580928 Len=0 TSval=2452528 TSecr=728970302
187   0.023366 54.230.158.252 -> 172.31.29.138 TCP 11650 [TCP segment of a reassembled PDU]
188   0.023374 172.31.29.138 -> 54.230.158.252 TCP 66 51161 > http [ACK] Seq=98 Ack=1108178 Win=1580928 Len=0 TSval=2452528 TSecr=728970302
189   0.023698 54.230.158.252 -> 172.31.29.138 TCP 24682 [TCP segment of a reassembled PDU]
190   0.023712 172.31.29.138 -> 54.230.158.252 TCP 66 51161 > http [ACK] Seq=98 Ack=1132794 Win=1580928 Len=0 TSval=2452528 TSecr=728970302
191   0.023718 54.230.158.252 -> 172.31.29.138 TCP 1514 [TCP segment of a reassembled PDU]
192   0.023820 54.230.158.252 -> 172.31.29.138 TCP 34818 [TCP segment of a reassembled PDU]
193   0.023837 172.31.29.138 -> 54.230.158.252 TCP 66 51161 > http [ACK] Seq=98 Ack=1168994 Win=1580928 Len=0 TSval=2452528 TSecr=728970302
194   0.023845 54.230.158.252 -> 172.31.29.138 TCP 4410 [TCP segment of a reassembled PDU]
195   0.023848 172.31.29.138 -> 54.230.158.252 TCP 66 51161 > http [ACK] Seq=98 Ack=1173338 Win=1580928 Len=0 TSval=2452528 TSecr=728970302
196   0.023898 54.230.158.252 -> 172.31.29.138 TCP 18890 [TCP segment of a reassembled PDU]
197   0.023908 172.31.29.138 -> 54.230.158.252 TCP 66 51161 > http [ACK] Seq=98 Ack=1192162 Win=1580928 Len=0 TSval=2452528 TSecr=728970302
198   0.024011 54.230.158.252 -> 172.31.29.138 TCP 26130 [TCP segment of a reassembled PDU]
199   0.024025 172.31.29.138 -> 54.230.158.252 TCP 66 51161 > http [ACK] Seq=98 Ack=1218226 Win=1580928 Len=0 TSval=2452528 TSecr=728970302
200   0.024039 54.230.158.252 -> 172.31.29.138 TCP 13098 [TCP segment of a reassembled PDU]
201   0.024048 172.31.29.138 -> 54.230.158.252 TCP 66 51161 > http [ACK] Seq=98 Ack=1231258 Win=1580928 Len=0 TSval=2452528 TSecr=728970302
202   0.024146 54.230.158.252 -> 172.31.29.138 TCP 7306 [TCP segment of a reassembled PDU]
203   0.024153 172.31.29.138 -> 54.230.158.252 TCP 66 51161 > http [ACK] Seq=98 Ack=1238498 Win=1580928 Len=0 TSval=2452528 TSecr=728970302
204   0.024402 54.230.158.252 -> 172.31.29.138 TCP 17442 [TCP segment of a reassembled PDU]
205   0.024413 172.31.29.138 -> 54.230.158.252 TCP 66 51161 > http [ACK] Seq=98 Ack=1255874 Win=1580928 Len=0 TSval=2452528 TSecr=728970302
206   0.024529 54.230.158.252 -> 172.31.29.138 TCP 26130 [TCP segment of a reassembled PDU]
207   0.024542 172.31.29.138 -> 54.230.158.252 TCP 66 51161 > http [ACK] Seq=98 Ack=1281938 Win=1580928 Len=0 TSval=2452528 TSecr=728970302
208   0.024557 54.230.158.252 -> 172.31.29.138 TCP 13098 [TCP segment of a reassembled PDU]
209   0.024567 172.31.29.138 -> 54.230.158.252 TCP 66 51161 > http [ACK] Seq=98 Ack=1294970 Win=1580928 Len=0 TSval=2452528 TSecr=728970302
210   0.024608 54.230.158.252 -> 172.31.29.138 TCP 7306 [TCP segment of a reassembled PDU]
211   0.024614 172.31.29.138 -> 54.230.158.252 TCP 66 51161 > http [ACK] Seq=98 Ack=1302210 Win=1580928 Len=0 TSval=2452528 TSecr=728970302
212   0.024756 54.230.158.252 -> 172.31.29.138 TCP 26130 [TCP segment of a reassembled PDU]
213   0.024769 172.31.29.138 -> 54.230.158.252 TCP 66 51161 > http [ACK] Seq=98 Ack=1328274 Win=1580928 Len=0 TSval=2452528 TSecr=728970302
214   0.024805 54.230.158.252 -> 172.31.29.138 TCP 26130 [TCP segment of a reassembled PDU]
215   0.024817 172.31.29.138 -> 54.230.158.252 TCP 66 51161 > http [ACK] Seq=98 Ack=1354338 Win=1580928 Len=0 TSval=2452528 TSecr=728970302
216   0.024855 54.230.158.252 -> 172.31.29.138 TCP 14546 [TCP segment of a reassembled PDU]
217   0.024865 172.31.29.138 -> 54.230.158.252 TCP 66 51161 > http [ACK] Seq=98 Ack=1368818 Win=1580928 Len=0 TSval=2452528 TSecr=728970302
218   0.025257 54.230.158.252 -> 172.31.29.138 TCP 26130 [TCP segment of a reassembled PDU]
219   0.025271 172.31.29.138 -> 54.230.158.252 TCP 66 51161 > http [ACK] Seq=98 Ack=1394882 Win=1580928 Len=0 TSval=2452528 TSecr=728970302
220   0.025294 54.230.158.252 -> 172.31.29.138 TCP 17442 [TCP segment of a reassembled PDU]
221   0.025302 172.31.29.138 -> 54.230.158.252 TCP 66 51161 > http [ACK] Seq=98 Ack=1412258 Win=1580928 Len=0 TSval=2452528 TSecr=728970302
222   0.025309 54.230.158.252 -> 172.31.29.138 TCP 4410 [TCP segment of a reassembled PDU]
223   0.025312 172.31.29.138 -> 54.230.158.252 TCP 66 51161 > http [ACK] Seq=98 Ack=1416602 Win=1580928 Len=0 TSval=2452528 TSecr=728970302
224   0.025332 54.230.158.252 -> 172.31.29.138 TCP 8754 [TCP segment of a reassembled PDU]
225   0.025338 172.31.29.138 -> 54.230.158.252 TCP 66 51161 > http [ACK] Seq=98 Ack=1425290 Win=1580928 Len=0 TSval=2452528 TSecr=728970302
226   0.025525 54.230.158.252 -> 172.31.29.138 TCP 26130 [TCP segment of a reassembled PDU]
227   0.025538 172.31.29.138 -> 54.230.158.252 TCP 66 51161 > http [ACK] Seq=98 Ack=1451354 Win=1580928 Len=0 TSval=2452528 TSecr=728970302
228   0.025560 54.230.158.252 -> 172.31.29.138 TCP 15994 [TCP segment of a reassembled PDU]
229   0.025568 172.31.29.138 -> 54.230.158.252 TCP 66 51161 > http [ACK] Seq=98 Ack=1467282 Win=1580928 Len=0 TSval=2452528 TSecr=728970302
230   0.025576 54.230.158.252 -> 172.31.29.138 TCP 7306 [TCP segment of a reassembled PDU]
231   0.025581 172.31.29.138 -> 54.230.158.252 TCP 66 51161 > http [ACK] Seq=98 Ack=1474522 Win=1580928 Len=0 TSval=2452528 TSecr=728970302
232   0.025589 54.230.158.252 -> 172.31.29.138 TCP 2962 [TCP segment of a reassembled PDU]
233   0.025592 172.31.29.138 -> 54.230.158.252 TCP 66 51161 > http [ACK] Seq=98 Ack=1477418 Win=1580928 Len=0 TSval=2452528 TSecr=728970302
234   0.025636 54.230.158.252 -> 172.31.29.138 TCP 15994 [TCP segment of a reassembled PDU]
235   0.025646 172.31.29.138 -> 54.230.158.252 TCP 66 51161 > http [ACK] Seq=98 Ack=1493346 Win=1580928 Len=0 TSval=2452528 TSecr=728970302
236   0.025723 54.230.158.252 -> 172.31.29.138 TCP 5858 [TCP segment of a reassembled PDU]
237   0.025728 172.31.29.138 -> 54.230.158.252 TCP 66 51161 > http [ACK] Seq=98 Ack=1499138 Win=1580928 Len=0 TSval=2452528 TSecr=728970302
238   0.025999 54.230.158.252 -> 172.31.29.138 TCP 26130 [TCP segment of a reassembled PDU]
239   0.026013 172.31.29.138 -> 54.230.158.252 TCP 66 51161 > http [ACK] Seq=98 Ack=1525202 Win=1580928 Len=0 TSval=2452528 TSecr=728970302
240   0.026021 54.230.158.252 -> 172.31.29.138 TCP 4410 [TCP segment of a reassembled PDU]
241   0.026024 172.31.29.138 -> 54.230.158.252 TCP 66 51161 > http [ACK] Seq=98 Ack=1529546 Win=1580928 Len=0 TSval=2452528 TSecr=728970302
242   0.026047 54.230.158.252 -> 172.31.29.138 TCP 21786 [TCP segment of a reassembled PDU]
243   0.026055 172.31.29.138 -> 54.230.158.252 TCP 66 51161 > http [ACK] Seq=98 Ack=1551266 Win=1580928 Len=0 TSval=2452528 TSecr=728970302
244   0.026110 54.230.158.252 -> 172.31.29.138 TCP 13098 [TCP segment of a reassembled PDU]
245   0.026118 172.31.29.138 -> 54.230.158.252 TCP 66 51161 > http [ACK] Seq=98 Ack=1564298 Win=1580928 Len=0 TSval=2452528 TSecr=728970302
246   0.026256 54.230.158.252 -> 172.31.29.138 TCP 23234 [TCP segment of a reassembled PDU]
247   0.026268 172.31.29.138 -> 54.230.158.252 TCP 66 51161 > http [ACK] Seq=98 Ack=1587466 Win=1580928 Len=0 TSval=2452528 TSecr=728970302
248   0.026280 54.230.158.252 -> 172.31.29.138 TCP 2962 [TCP segment of a reassembled PDU]
249   0.026283 172.31.29.138 -> 54.230.158.252 TCP 66 51161 > http [ACK] Seq=98 Ack=1590362 Win=1580928 Len=0 TSval=2452528 TSecr=728970302
250   0.026363 54.230.158.252 -> 172.31.29.138 TCP 29026 [TCP segment of a reassembled PDU]
251   0.026377 172.31.29.138 -> 54.230.158.252 TCP 66 51161 > http [ACK] Seq=98 Ack=1619322 Win=1580928 Len=0 TSval=2452529 TSecr=728970302
252   0.026418 54.230.158.252 -> 172.31.29.138 TCP 10202 [TCP segment of a reassembled PDU]
253   0.026426 172.31.29.138 -> 54.230.158.252 TCP 66 51161 > http [ACK] Seq=98 Ack=1629458 Win=1580928 Len=0 TSval=2452529 TSecr=728970302
254   0.026650 54.230.158.252 -> 172.31.29.138 TCP 8754 [TCP segment of a reassembled PDU]
255   0.026658 172.31.29.138 -> 54.230.158.252 TCP 66 51161 > http [ACK] Seq=98 Ack=1638146 Win=1580928 Len=0 TSval=2452529 TSecr=728970302
256   0.026803 54.230.158.252 -> 172.31.29.138 TCP 26130 [TCP segment of a reassembled PDU]
257   0.026816 172.31.29.138 -> 54.230.158.252 TCP 66 51161 > http [ACK] Seq=98 Ack=1664210 Win=1580928 Len=0 TSval=2452529 TSecr=728970302
258   0.026839 54.230.158.252 -> 172.31.29.138 TCP 21786 [TCP segment of a reassembled PDU]
259   0.026849 172.31.29.138 -> 54.230.158.252 TCP 66 51161 > http [ACK] Seq=98 Ack=1685930 Win=1580928 Len=0 TSval=2452529 TSecr=728970302
260   0.027037 54.230.158.252 -> 172.31.29.138 TCP 26130 [TCP segment of a reassembled PDU]
261   0.027050 172.31.29.138 -> 54.230.158.252 TCP 66 51161 > http [ACK] Seq=98 Ack=1711994 Win=1580928 Len=0 TSval=2452529 TSecr=728970302
262   0.027100 54.230.158.252 -> 172.31.29.138 TCP 26130 [TCP segment of a reassembled PDU]
263   0.027112 172.31.29.138 -> 54.230.158.252 TCP 66 51161 > http [ACK] Seq=98 Ack=1738058 Win=1580928 Len=0 TSval=2452529 TSecr=728970302
264   0.027120 54.230.158.252 -> 172.31.29.138 TCP 4410 [TCP segment of a reassembled PDU]
265   0.027127 172.31.29.138 -> 54.230.158.252 TCP 66 51161 > http [ACK] Seq=98 Ack=1742402 Win=1580928 Len=0 TSval=2452529 TSecr=728970302
266   0.027134 54.230.158.252 -> 172.31.29.138 TCP 5858 [TCP segment of a reassembled PDU]
267   0.027139 172.31.29.138 -> 54.230.158.252 TCP 66 51161 > http [ACK] Seq=98 Ack=1748194 Win=1580928 Len=0 TSval=2452529 TSecr=728970302
268   0.027195 54.230.158.252 -> 172.31.29.138 TCP 11650 [TCP segment of a reassembled PDU]
269   0.027204 172.31.29.138 -> 54.230.158.252 TCP 66 51161 > http [ACK] Seq=98 Ack=1759778 Win=1580928 Len=0 TSval=2452529 TSecr=728970302
270   0.027222 54.230.158.252 -> 172.31.29.138 TCP 18890 [TCP segment of a reassembled PDU]
271   0.027231 172.31.29.138 -> 54.230.158.252 TCP 66 51161 > http [ACK] Seq=98 Ack=1778602 Win=1580928 Len=0 TSval=2452529 TSecr=728970302
272   0.027254 54.230.158.252 -> 172.31.29.138 TCP 10202 [TCP segment of a reassembled PDU]
273   0.027261 172.31.29.138 -> 54.230.158.252 TCP 66 51161 > http [ACK] Seq=98 Ack=1788738 Win=1580928 Len=0 TSval=2452529 TSecr=728970302
274   0.027370 54.230.158.252 -> 172.31.29.138 TCP 26130 [TCP segment of a reassembled PDU]
275   0.027384 172.31.29.138 -> 54.230.158.252 TCP 66 51161 > http [ACK] Seq=98 Ack=1814802 Win=1580928 Len=0 TSval=2452529 TSecr=728970302
276   0.027397 54.230.158.252 -> 172.31.29.138 TCP 10202 [TCP segment of a reassembled PDU]
277   0.027405 172.31.29.138 -> 54.230.158.252 TCP 66 51161 > http [ACK] Seq=98 Ack=1824938 Win=1580928 Len=0 TSval=2452529 TSecr=728970302
278   0.027809 54.230.158.252 -> 172.31.29.138 TCP 4410 [TCP segment of a reassembled PDU]
279   0.027815 172.31.29.138 -> 54.230.158.252 TCP 66 51161 > http [ACK] Seq=98 Ack=1829282 Win=1580928 Len=0 TSval=2452529 TSecr=728970302
280   0.027984 54.230.158.252 -> 172.31.29.138 TCP 21786 [TCP segment of a reassembled PDU]
281   0.027996 172.31.29.138 -> 54.230.158.252 TCP 66 51161 > http [ACK] Seq=98 Ack=1851002 Win=1580928 Len=0 TSval=2452529 TSecr=728970302
282   0.028007 54.230.158.252 -> 172.31.29.138 TCP 4410 [TCP segment of a reassembled PDU]
283   0.028010 172.31.29.138 -> 54.230.158.252 TCP 66 51161 > http [ACK] Seq=98 Ack=1855346 Win=1580928 Len=0 TSval=2452529 TSecr=728970302
284   0.028083 54.230.158.252 -> 172.31.29.138 TCP 26130 [TCP segment of a reassembled PDU]
285   0.028096 172.31.29.138 -> 54.230.158.252 TCP 66 51161 > http [ACK] Seq=98 Ack=1881410 Win=1580928 Len=0 TSval=2452529 TSecr=728970302
286   0.028148 54.230.158.252 -> 172.31.29.138 TCP 31922 [TCP segment of a reassembled PDU]
287   0.028162 172.31.29.138 -> 54.230.158.252 TCP 66 51161 > http [ACK] Seq=98 Ack=1913266 Win=1580928 Len=0 TSval=2452529 TSecr=728970302
288   0.028168 54.230.158.252 -> 172.31.29.138 TCP 1514 [TCP segment of a reassembled PDU]
289   0.028264 54.230.158.252 -> 172.31.29.138 TCP 36266 [TCP segment of a reassembled PDU]
290   0.028273 172.31.29.138 -> 54.230.158.252 TCP 66 51161 > http [ACK] Seq=98 Ack=1950914 Win=1580928 Len=0 TSval=2452529 TSecr=728970302
291   0.028382 54.230.158.252 -> 172.31.29.138 TCP 24682 [TCP segment of a reassembled PDU]
292   0.028388 172.31.29.138 -> 54.230.158.252 TCP 66 51161 > http [ACK] Seq=98 Ack=1975530 Win=1580928 Len=0 TSval=2452529 TSecr=728970302
293   0.028395 54.230.158.252 -> 172.31.29.138 TCP 1514 [TCP segment of a reassembled PDU]
294   0.028488 54.230.158.252 -> 172.31.29.138 TCP 39162 [TCP segment of a reassembled PDU]
295   0.028496 172.31.29.138 -> 54.230.158.252 TCP 66 51161 > http [ACK] Seq=98 Ack=2016074 Win=1580928 Len=0 TSval=2452529 TSecr=728970302
296   0.028554 54.230.158.252 -> 172.31.29.138 TCP 4410 [TCP segment of a reassembled PDU]
297   0.028558 172.31.29.138 -> 54.230.158.252 TCP 66 51161 > http [ACK] Seq=98 Ack=2020418 Win=1580928 Len=0 TSval=2452529 TSecr=728970302
298   0.028833 54.230.158.252 -> 172.31.29.138 TCP 17442 [TCP segment of a reassembled PDU]
299   0.028840 172.31.29.138 -> 54.230.158.252 TCP 66 51161 > http [ACK] Seq=98 Ack=2037794 Win=1580928 Len=0 TSval=2452529 TSecr=728970302
300   0.028863 54.230.158.252 -> 172.31.29.138 TCP 8754 [TCP segment of a reassembled PDU]
301   0.028866 172.31.29.138 -> 54.230.158.252 TCP 66 51161 > http [ACK] Seq=98 Ack=2046482 Win=1580928 Len=0 TSval=2452529 TSecr=728970302
302   0.028928 54.230.158.252 -> 172.31.29.138 TCP 24682 [TCP segment of a reassembled PDU]
303   0.028934 172.31.29.138 -> 54.230.158.252 TCP 66 51161 > http [ACK] Seq=98 Ack=2071098 Win=1580928 Len=0 TSval=2452529 TSecr=728970302
304   0.028987 54.230.158.252 -> 172.31.29.138 TCP 14546 [TCP segment of a reassembled PDU]
305   0.028992 172.31.29.138 -> 54.230.158.252 TCP 66 51161 > http [ACK] Seq=98 Ack=2085578 Win=1580928 Len=0 TSval=2452529 TSecr=728970302
306   0.029012 54.230.158.252 -> 172.31.29.138 TCP 14546 [TCP segment of a reassembled PDU]
307   0.029016 172.31.29.138 -> 54.230.158.252 TCP 66 51161 > http [ACK] Seq=98 Ack=2100058 Win=1580928 Len=0 TSval=2452529 TSecr=728970302
308   0.029040 54.230.158.252 -> 172.31.29.138 TCP 5858 [TCP segment of a reassembled PDU]
309   0.029044 172.31.29.138 -> 54.230.158.252 TCP 66 51161 > http [ACK] Seq=98 Ack=2105850 Win=1580928 Len=0 TSval=2452529 TSecr=728970302
310   0.029102 54.230.158.252 -> 172.31.29.138 TCP 24682 [TCP segment of a reassembled PDU]
311   0.029109 172.31.29.138 -> 54.230.158.252 TCP 66 51161 > http [ACK] Seq=98 Ack=2130466 Win=1580928 Len=0 TSval=2452529 TSecr=728970302
312   0.029224 54.230.158.252 -> 172.31.29.138 TCP 26130 [TCP segment of a reassembled PDU]
313   0.029233 172.31.29.138 -> 54.230.158.252 TCP 66 51161 > http [ACK] Seq=98 Ack=2156530 Win=1580928 Len=0 TSval=2452529 TSecr=728970302
314   0.029242 54.230.158.252 -> 172.31.29.138 TCP 5858 [TCP segment of a reassembled PDU]
315   0.029246 172.31.29.138 -> 54.230.158.252 TCP 66 51161 > http [ACK] Seq=98 Ack=2162322 Win=1580928 Len=0 TSval=2452529 TSecr=728970302
316   0.029282 54.230.158.252 -> 172.31.29.138 TCP 20338 [TCP segment of a reassembled PDU]
317   0.029288 172.31.29.138 -> 54.230.158.252 TCP 66 51161 > http [ACK] Seq=98 Ack=2182594 Win=1580928 Len=0 TSval=2452529 TSecr=728970302
318   0.029387 54.230.158.252 -> 172.31.29.138 TCP 33370 [TCP segment of a reassembled PDU]
319   0.029394 172.31.29.138 -> 54.230.158.252 TCP 66 51161 > http [ACK] Seq=98 Ack=2215898 Win=1580928 Len=0 TSval=2452529 TSecr=728970302
320   0.029755 54.230.158.252 -> 172.31.29.138 TCP 26130 [TCP segment of a reassembled PDU]
321   0.029762 172.31.29.138 -> 54.230.158.252 TCP 66 51161 > http [ACK] Seq=98 Ack=2241962 Win=1580928 Len=0 TSval=2452529 TSecr=728970302
322   0.029805 54.230.158.252 -> 172.31.29.138 TCP 26130 [TCP segment of a reassembled PDU]
323   0.029811 172.31.29.138 -> 54.230.158.252 TCP 66 51161 > http [ACK] Seq=98 Ack=2268026 Win=1580928 Len=0 TSval=2452529 TSecr=728970302
324   0.029844 54.230.158.252 -> 172.31.29.138 TCP 13098 [TCP segment of a reassembled PDU]
325   0.029851 172.31.29.138 -> 54.230.158.252 TCP 66 51161 > http [ACK] Seq=98 Ack=2281058 Win=1580928 Len=0 TSval=2452529 TSecr=728970302
326   0.029921 54.230.158.252 -> 172.31.29.138 TCP 24682 [TCP segment of a reassembled PDU]
327   0.029927 172.31.29.138 -> 54.230.158.252 TCP 66 51161 > http [ACK] Seq=98 Ack=2305674 Win=1580928 Len=0 TSval=2452529 TSecr=728970303
328   0.029990 54.230.158.252 -> 172.31.29.138 TCP 17442 [TCP segment of a reassembled PDU]
329   0.029995 172.31.29.138 -> 54.230.158.252 TCP 66 51161 > http [ACK] Seq=98 Ack=2323050 Win=1580928 Len=0 TSval=2452529 TSecr=728970303
330   0.030130 54.230.158.252 -> 172.31.29.138 TCP 26130 [TCP segment of a reassembled PDU]
331   0.030137 172.31.29.138 -> 54.230.158.252 TCP 66 51161 > http [ACK] Seq=98 Ack=2349114 Win=1580928 Len=0 TSval=2452529 TSecr=728970303
332   0.030182 54.230.158.252 -> 172.31.29.138 TCP 26130 [TCP segment of a reassembled PDU]
333   0.030189 172.31.29.138 -> 54.230.158.252 TCP 66 51161 > http [ACK] Seq=98 Ack=2375178 Win=1580928 Len=0 TSval=2452529 TSecr=728970303
334   0.030234 54.230.158.252 -> 172.31.29.138 TCP 23234 [TCP segment of a reassembled PDU]
335   0.030239 172.31.29.138 -> 54.230.158.252 TCP 66 51161 > http [ACK] Seq=98 Ack=2398346 Win=1580928 Len=0 TSval=2452529 TSecr=728970303
336   0.030246 54.230.158.252 -> 172.31.29.138 TCP 1514 [TCP segment of a reassembled PDU]
337   0.030412 54.230.158.252 -> 172.31.29.138 TCP 26130 [TCP segment of a reassembled PDU]
338   0.030420 172.31.29.138 -> 54.230.158.252 TCP 66 51161 > http [ACK] Seq=98 Ack=2425858 Win=1580928 Len=0 TSval=2452530 TSecr=728970303
339   0.030444 54.230.158.252 -> 172.31.29.138 TCP 11650 [TCP segment of a reassembled PDU]
340   0.030447 172.31.29.138 -> 54.230.158.252 TCP 66 51161 > http [ACK] Seq=98 Ack=2437442 Win=1580928 Len=0 TSval=2452530 TSecr=728970303
341   0.030467 54.230.158.252 -> 172.31.29.138 TCP 14546 [TCP segment of a reassembled PDU]
342   0.030470 172.31.29.138 -> 54.230.158.252 TCP 66 51161 > http [ACK] Seq=98 Ack=2451922 Win=1580928 Len=0 TSval=2452530 TSecr=728970303
343   0.030564 54.230.158.252 -> 172.31.29.138 TCP 26130 [TCP segment of a reassembled PDU]
344   0.030571 172.31.29.138 -> 54.230.158.252 TCP 66 51161 > http [ACK] Seq=98 Ack=2477986 Win=1580928 Len=0 TSval=2452530 TSecr=728970303
345   0.030581 54.230.158.252 -> 172.31.29.138 TCP 5858 [TCP segment of a reassembled PDU]
346   0.030586 172.31.29.138 -> 54.230.158.252 TCP 66 51161 > http [ACK] Seq=98 Ack=2483778 Win=1580928 Len=0 TSval=2452530 TSecr=728970303
