[Measurement for 10mb at 22:38:33 19.38.2014] 
Tshark:

  1   0.000000 172.31.29.138 -> 172.31.0.2   DNS 89 Standard query 0xb1f2  A d1n0gskdvzj94j.cloudfront.net
  2   0.000034 172.31.29.138 -> 172.31.0.2   DNS 89 Standard query 0xe2f1  AAAA d1n0gskdvzj94j.cloudfront.net
  3   0.000629   172.31.0.2 -> 172.31.29.138 DNS 176 Standard query response 0xe2f1 
  4   0.000640   172.31.0.2 -> 172.31.29.138 DNS 217 Standard query response 0xb1f2  A 54.192.156.109 A 54.192.159.174 A 54.230.157.230 A 54.230.158.152 A 54.230.159.4 A 54.230.159.7 A 54.230.159.132 A 54.230.159.153
  5   0.003886 172.31.29.138 -> 54.192.156.109 TCP 74 55880 > http [SYN] Seq=0 Win=26883 Len=0 MSS=8961 SACK_PERM=1 TSval=5146570 TSecr=0 WS=128
  6   0.004661 54.192.156.109 -> 172.31.29.138 TCP 74 http > 55880 [SYN, ACK] Seq=0 Ack=1 Win=14480 Len=0 MSS=1460 SACK_PERM=1 TSval=728309834 TSecr=5146570 WS=128
  7   0.004675 172.31.29.138 -> 54.192.156.109 TCP 66 55880 > http [ACK] Seq=1 Ack=1 Win=27008 Len=0 TSval=5146570 TSecr=728309834
  8   0.004730 172.31.29.138 -> 54.192.156.109 HTTP 163 GET /10mb HTTP/1.1 
  9   0.005408 54.192.156.109 -> 172.31.29.138 TCP 66 http > 55880 [ACK] Seq=1 Ack=98 Win=14592 Len=0 TSval=728309834 TSecr=5146570
 10   0.007766 54.192.156.109 -> 172.31.29.138 TCP 524 [TCP segment of a reassembled PDU]
 11   0.007773 172.31.29.138 -> 54.192.156.109 TCP 66 55880 > http [ACK] Seq=98 Ack=459 Win=28032 Len=0 TSval=5146571 TSecr=728309835
 12   0.007857 54.192.156.109 -> 172.31.29.138 TCP 13098 [TCP segment of a reassembled PDU]
 13   0.007868 172.31.29.138 -> 54.192.156.109 TCP 66 55880 > http [ACK] Seq=98 Ack=13491 Win=54144 Len=0 TSval=5146571 TSecr=728309835
 14   0.008532 54.192.156.109 -> 172.31.29.138 TCP 7306 [TCP segment of a reassembled PDU]
 15   0.008541 172.31.29.138 -> 54.192.156.109 TCP 66 55880 > http [ACK] Seq=98 Ack=20731 Win=68608 Len=0 TSval=5146571 TSecr=728309835
 16   0.008569 54.192.156.109 -> 172.31.29.138 TCP 5858 [TCP segment of a reassembled PDU]
 17   0.008576 172.31.29.138 -> 54.192.156.109 TCP 66 55880 > http [ACK] Seq=98 Ack=26523 Win=80128 Len=0 TSval=5146571 TSecr=728309835
 18   0.009294 54.192.156.109 -> 172.31.29.138 TCP 5858 [TCP segment of a reassembled PDU]
 19   0.009313 172.31.29.138 -> 54.192.156.109 TCP 66 55880 > http [ACK] Seq=98 Ack=32315 Win=91776 Len=0 TSval=5146571 TSecr=728309835
 20   0.009350 54.192.156.109 -> 172.31.29.138 TCP 7306 [TCP segment of a reassembled PDU]
 21   0.009356 172.31.29.138 -> 54.192.156.109 TCP 66 55880 > http [ACK] Seq=98 Ack=39555 Win=105984 Len=0 TSval=5146571 TSecr=728309835
 22   0.009405 54.192.156.109 -> 172.31.29.138 TCP 7306 [TCP segment of a reassembled PDU]
 23   0.009411 172.31.29.138 -> 54.192.156.109 TCP 66 55880 > http [ACK] Seq=98 Ack=46795 Win=105984 Len=0 TSval=5146571 TSecr=728309835
 24   0.010060 54.192.156.109 -> 172.31.29.138 TCP 5858 [TCP segment of a reassembled PDU]
 25   0.010067 172.31.29.138 -> 54.192.156.109 TCP 66 55880 > http [ACK] Seq=98 Ack=52587 Win=108416 Len=0 TSval=5146572 TSecr=728309835
 26   0.010170 54.192.156.109 -> 172.31.29.138 TCP 13098 [TCP segment of a reassembled PDU]
 27   0.010198 172.31.29.138 -> 54.192.156.109 TCP 66 55880 > http [ACK] Seq=98 Ack=65619 Win=135168 Len=0 TSval=5146572 TSecr=728309835
 28   0.010795 54.192.156.109 -> 172.31.29.138 TCP 4410 [TCP segment of a reassembled PDU]
 29   0.010801 172.31.29.138 -> 54.192.156.109 TCP 66 55880 > http [ACK] Seq=98 Ack=69963 Win=143872 Len=0 TSval=5146572 TSecr=728309835
 30   0.010882 54.192.156.109 -> 172.31.29.138 TCP 14546 [TCP segment of a reassembled PDU]
 31   0.010891 172.31.29.138 -> 54.192.156.109 TCP 66 55880 > http [ACK] Seq=98 Ack=84443 Win=172800 Len=0 TSval=5146572 TSecr=728309835
 32   0.010899 54.192.156.109 -> 172.31.29.138 TCP 2962 [TCP segment of a reassembled PDU]
 33   0.010906 172.31.29.138 -> 54.192.156.109 TCP 66 55880 > http [ACK] Seq=98 Ack=87339 Win=178560 Len=0 TSval=5146572 TSecr=728309835
 34   0.010914 54.192.156.109 -> 172.31.29.138 TCP 5858 [TCP segment of a reassembled PDU]
 35   0.010919 172.31.29.138 -> 54.192.156.109 TCP 66 55880 > http [ACK] Seq=98 Ack=93131 Win=190208 Len=0 TSval=5146572 TSecr=728309835
 36   0.011556 54.192.156.109 -> 172.31.29.138 TCP 4410 [TCP segment of a reassembled PDU]
 37   0.011562 172.31.29.138 -> 54.192.156.109 TCP 66 55880 > http [ACK] Seq=98 Ack=97475 Win=198784 Len=0 TSval=5146572 TSecr=728309835
 38   0.011700 54.192.156.109 -> 172.31.29.138 TCP 26130 [TCP segment of a reassembled PDU]
 39   0.011723 172.31.29.138 -> 54.192.156.109 TCP 66 55880 > http [ACK] Seq=98 Ack=123539 Win=251008 Len=0 TSval=5146572 TSecr=728309835
 40   0.011730 54.192.156.109 -> 172.31.29.138 TCP 2962 [TCP segment of a reassembled PDU]
 41   0.011734 172.31.29.138 -> 54.192.156.109 TCP 66 55880 > http [ACK] Seq=98 Ack=126435 Win=256768 Len=0 TSval=5146572 TSecr=728309835
 42   0.012337 54.192.156.109 -> 172.31.29.138 TCP 4410 [TCP segment of a reassembled PDU]
 43   0.012344 172.31.29.138 -> 54.192.156.109 TCP 66 55880 > http [ACK] Seq=98 Ack=130779 Win=265472 Len=0 TSval=5146572 TSecr=728309835
 44   0.012391 54.192.156.109 -> 172.31.29.138 TCP 13098 [TCP segment of a reassembled PDU]
 45   0.012401 172.31.29.138 -> 54.192.156.109 TCP 66 55880 > http [ACK] Seq=98 Ack=143811 Win=291456 Len=0 TSval=5146572 TSecr=728309835
 46   0.012439 54.192.156.109 -> 172.31.29.138 TCP 13098 [TCP segment of a reassembled PDU]
 47   0.012448 172.31.29.138 -> 54.192.156.109 TCP 66 55880 > http [ACK] Seq=98 Ack=156843 Win=312064 Len=0 TSval=5146572 TSecr=728309835
 48   0.013092 54.192.156.109 -> 172.31.29.138 TCP 2962 [TCP segment of a reassembled PDU]
 49   0.013097 172.31.29.138 -> 54.192.156.109 TCP 66 55880 > http [ACK] Seq=98 Ack=159739 Win=323328 Len=0 TSval=5146572 TSecr=728309835
 50   0.013266 54.192.156.109 -> 172.31.29.138 TCP 26130 [TCP segment of a reassembled PDU]
 51   0.013279 172.31.29.138 -> 54.192.156.109 TCP 66 55880 > http [ACK] Seq=98 Ack=185803 Win=297344 Len=0 TSval=5146572 TSecr=728309835
 52   0.013369 54.192.156.109 -> 172.31.29.138 TCP 13098 [TCP segment of a reassembled PDU]
 53   0.013379 172.31.29.138 -> 54.192.156.109 TCP 66 55880 > http [ACK] Seq=98 Ack=198835 Win=312064 Len=0 TSval=5146572 TSecr=728309835
 54   0.013865 54.192.156.109 -> 172.31.29.138 TCP 2962 [TCP segment of a reassembled PDU]
 55   0.013870 172.31.29.138 -> 54.192.156.109 TCP 66 55880 > http [ACK] Seq=98 Ack=201731 Win=328576 Len=0 TSval=5146572 TSecr=728309835
 56   0.013984 54.192.156.109 -> 172.31.29.138 TCP 7306 [TCP segment of a reassembled PDU]
 57   0.013991 172.31.29.138 -> 54.192.156.109 TCP 66 55880 > http [ACK] Seq=98 Ack=208971 Win=321536 Len=0 TSval=5146573 TSecr=728309835
 58   0.014057 54.192.156.109 -> 172.31.29.138 TCP 21786 [TCP segment of a reassembled PDU]
 59   0.014069 172.31.29.138 -> 54.192.156.109 TCP 66 55880 > http [ACK] Seq=98 Ack=230691 Win=372608 Len=0 TSval=5146573 TSecr=728309835
 60   0.014789 54.192.156.109 -> 172.31.29.138 TCP 17442 [TCP segment of a reassembled PDU]
 61   0.014801 172.31.29.138 -> 54.192.156.109 TCP 66 55880 > http [ACK] Seq=98 Ack=248067 Win=407296 Len=0 TSval=5146573 TSecr=728309835
 62   0.014820 54.192.156.109 -> 172.31.29.138 TCP 1514 [TCP segment of a reassembled PDU]
 63   0.014823 172.31.29.138 -> 54.192.156.109 TCP 66 55880 > http [ACK] Seq=98 Ack=249515 Win=410240 Len=0 TSval=5146573 TSecr=728309835
 64   0.014954 54.192.156.109 -> 172.31.29.138 TCP 31922 [TCP segment of a reassembled PDU]
 65   0.014971 172.31.29.138 -> 54.192.156.109 TCP 66 55880 > http [ACK] Seq=98 Ack=281371 Win=473984 Len=0 TSval=5146573 TSecr=728309835
 66   0.015403 54.192.156.109 -> 172.31.29.138 TCP 4410 [TCP segment of a reassembled PDU]
 67   0.015411 172.31.29.138 -> 54.192.156.109 TCP 66 55880 > http [ACK] Seq=98 Ack=285715 Win=482688 Len=0 TSval=5146573 TSecr=728309835
 68   0.015549 54.192.156.109 -> 172.31.29.138 TCP 14546 [TCP segment of a reassembled PDU]
 69   0.015558 172.31.29.138 -> 54.192.156.109 TCP 66 55880 > http [ACK] Seq=98 Ack=300195 Win=511616 Len=0 TSval=5146573 TSecr=728309835
 70   0.015823 54.192.156.109 -> 172.31.29.138 TCP 26130 [TCP segment of a reassembled PDU]
 71   0.015836 172.31.29.138 -> 54.192.156.109 TCP 66 55880 > http [ACK] Seq=98 Ack=326259 Win=563712 Len=0 TSval=5146573 TSecr=728309835
 72   0.015849 54.192.156.109 -> 172.31.29.138 TCP 10202 [TCP segment of a reassembled PDU]
 73   0.015854 172.31.29.138 -> 54.192.156.109 TCP 66 55880 > http [ACK] Seq=98 Ack=336395 Win=584064 Len=0 TSval=5146573 TSecr=728309835
 74   0.016184 54.192.156.109 -> 172.31.29.138 TCP 4410 [TCP segment of a reassembled PDU]
 75   0.016191 172.31.29.138 -> 54.192.156.109 TCP 66 55880 > http [ACK] Seq=98 Ack=340739 Win=592640 Len=0 TSval=5146573 TSecr=728309835
 76   0.016347 54.192.156.109 -> 172.31.29.138 TCP 17442 [TCP segment of a reassembled PDU]
 77   0.016357 172.31.29.138 -> 54.192.156.109 TCP 66 55880 > http [ACK] Seq=98 Ack=358115 Win=627456 Len=0 TSval=5146573 TSecr=728309835
 78   0.016415 54.192.156.109 -> 172.31.29.138 TCP 1514 [TCP segment of a reassembled PDU]
 79   0.016420 172.31.29.138 -> 54.192.156.109 TCP 66 55880 > http [ACK] Seq=98 Ack=359563 Win=630400 Len=0 TSval=5146573 TSecr=728309835
 80   0.016583 54.192.156.109 -> 172.31.29.138 TCP 18890 [TCP segment of a reassembled PDU]
 81   0.016595 172.31.29.138 -> 54.192.156.109 TCP 66 55880 > http [ACK] Seq=98 Ack=378387 Win=668032 Len=0 TSval=5146573 TSecr=728309835
 82   0.016938 54.192.156.109 -> 172.31.29.138 TCP 2962 [TCP segment of a reassembled PDU]
 83   0.016945 172.31.29.138 -> 54.192.156.109 TCP 66 55880 > http [ACK] Seq=98 Ack=381283 Win=673792 Len=0 TSval=5146573 TSecr=728309835
 84   0.017136 54.192.156.109 -> 172.31.29.138 TCP 26130 [TCP segment of a reassembled PDU]
 85   0.017150 172.31.29.138 -> 54.192.156.109 TCP 66 55880 > http [ACK] Seq=98 Ack=407347 Win=725888 Len=0 TSval=5146573 TSecr=728309835
 86   0.017167 54.192.156.109 -> 172.31.29.138 TCP 13098 [TCP segment of a reassembled PDU]
 87   0.017172 172.31.29.138 -> 54.192.156.109 TCP 66 55880 > http [ACK] Seq=98 Ack=420379 Win=752000 Len=0 TSval=5146573 TSecr=728309835
 88   0.017238 54.192.156.109 -> 172.31.29.138 TCP 23234 [TCP segment of a reassembled PDU]
 89   0.017251 172.31.29.138 -> 54.192.156.109 TCP 66 55880 > http [ACK] Seq=98 Ack=443547 Win=798336 Len=0 TSval=5146573 TSecr=728309835
 90   0.017706 54.192.156.109 -> 172.31.29.138 TCP 4410 [TCP segment of a reassembled PDU]
 91   0.017712 172.31.29.138 -> 54.192.156.109 TCP 66 55880 > http [ACK] Seq=98 Ack=447891 Win=807040 Len=0 TSval=5146573 TSecr=728309836
 92   0.017882 54.192.156.109 -> 172.31.29.138 TCP 21786 [TCP segment of a reassembled PDU]
 93   0.017895 172.31.29.138 -> 54.192.156.109 TCP 66 55880 > http [ACK] Seq=98 Ack=469611 Win=850432 Len=0 TSval=5146573 TSecr=728309836
 94   0.017903 54.192.156.109 -> 172.31.29.138 TCP 4410 [TCP segment of a reassembled PDU]
 95   0.017909 172.31.29.138 -> 54.192.156.109 TCP 66 55880 > http [ACK] Seq=98 Ack=473955 Win=859136 Len=0 TSval=5146573 TSecr=728309836
 96   0.018002 54.192.156.109 -> 172.31.29.138 TCP 34818 [TCP segment of a reassembled PDU]
 97   0.018019 172.31.29.138 -> 54.192.156.109 TCP 66 55880 > http [ACK] Seq=98 Ack=508707 Win=852864 Len=0 TSval=5146574 TSecr=728309836
 98   0.018510 54.192.156.109 -> 172.31.29.138 TCP 5858 [TCP segment of a reassembled PDU]
 99   0.018528 172.31.29.138 -> 54.192.156.109 TCP 66 55880 > http [ACK] Seq=98 Ack=514499 Win=870656 Len=0 TSval=5146574 TSecr=728309836
100   0.018675 54.192.156.109 -> 172.31.29.138 TCP 17442 [TCP segment of a reassembled PDU]
101   0.018685 172.31.29.138 -> 54.192.156.109 TCP 66 55880 > http [ACK] Seq=98 Ack=531875 Win=905472 Len=0 TSval=5146574 TSecr=728309836
102   0.018709 54.192.156.109 -> 172.31.29.138 TCP 8754 [TCP segment of a reassembled PDU]
103   0.018717 172.31.29.138 -> 54.192.156.109 TCP 66 55880 > http [ACK] Seq=98 Ack=540563 Win=922880 Len=0 TSval=5146574 TSecr=728309836
104   0.018780 54.192.156.109 -> 172.31.29.138 TCP 4410 [TCP segment of a reassembled PDU]
105   0.018786 172.31.29.138 -> 54.192.156.109 TCP 66 55880 > http [ACK] Seq=98 Ack=544907 Win=931584 Len=0 TSval=5146574 TSecr=728309836
106   0.018809 54.192.156.109 -> 172.31.29.138 TCP 27578 [TCP segment of a reassembled PDU]
107   0.018821 172.31.29.138 -> 54.192.156.109 TCP 66 55880 > http [ACK] Seq=98 Ack=572419 Win=986496 Len=0 TSval=5146574 TSecr=728309836
108   0.018876 54.192.156.109 -> 172.31.29.138 TCP 1514 [TCP segment of a reassembled PDU]
109   0.018881 172.31.29.138 -> 54.192.156.109 TCP 66 55880 > http [ACK] Seq=98 Ack=573867 Win=989440 Len=0 TSval=5146574 TSecr=728309836
110   0.019238 54.192.156.109 -> 172.31.29.138 TCP 4410 [TCP segment of a reassembled PDU]
111   0.019244 172.31.29.138 -> 54.192.156.109 TCP 66 55880 > http [ACK] Seq=98 Ack=578211 Win=998144 Len=0 TSval=5146574 TSecr=728309836
112   0.019389 54.192.156.109 -> 172.31.29.138 TCP 26130 [TCP segment of a reassembled PDU]
113   0.019403 172.31.29.138 -> 54.192.156.109 TCP 66 55880 > http [ACK] Seq=98 Ack=604275 Win=1050240 Len=0 TSval=5146574 TSecr=728309836
114   0.019420 54.192.156.109 -> 172.31.29.138 TCP 18890 [TCP segment of a reassembled PDU]
115   0.019429 172.31.29.138 -> 54.192.156.109 TCP 66 55880 > http [ACK] Seq=98 Ack=623099 Win=1087872 Len=0 TSval=5146574 TSecr=728309836
116   0.019436 54.192.156.109 -> 172.31.29.138 TCP 7306 [TCP segment of a reassembled PDU]
117   0.019441 172.31.29.138 -> 54.192.156.109 TCP 66 55880 > http [ACK] Seq=98 Ack=630339 Win=1102336 Len=0 TSval=5146574 TSecr=728309836
118   0.019541 54.192.156.109 -> 172.31.29.138 TCP 8754 [TCP segment of a reassembled PDU]
119   0.019548 172.31.29.138 -> 54.192.156.109 TCP 66 55880 > http [ACK] Seq=98 Ack=639027 Win=1119744 Len=0 TSval=5146574 TSecr=728309836
120   0.020035 54.192.156.109 -> 172.31.29.138 TCP 4410 [TCP segment of a reassembled PDU]
121   0.020041 172.31.29.138 -> 54.192.156.109 TCP 66 55880 > http [ACK] Seq=98 Ack=643371 Win=1128448 Len=0 TSval=5146574 TSecr=728309836
122   0.020197 54.192.156.109 -> 172.31.29.138 TCP 26130 [TCP segment of a reassembled PDU]
123   0.020211 172.31.29.138 -> 54.192.156.109 TCP 66 55880 > http [ACK] Seq=98 Ack=669435 Win=1180544 Len=0 TSval=5146574 TSecr=728309836
124   0.020250 54.192.156.109 -> 172.31.29.138 TCP 23234 [TCP segment of a reassembled PDU]
125   0.020262 172.31.29.138 -> 54.192.156.109 TCP 66 55880 > http [ACK] Seq=98 Ack=692603 Win=1226880 Len=0 TSval=5146574 TSecr=728309836
126   0.020268 54.192.156.109 -> 172.31.29.138 TCP 2962 [TCP segment of a reassembled PDU]
127   0.020271 172.31.29.138 -> 54.192.156.109 TCP 66 55880 > http [ACK] Seq=98 Ack=695499 Win=1232768 Len=0 TSval=5146574 TSecr=728309836
128   0.020296 54.192.156.109 -> 172.31.29.138 TCP 8754 [TCP segment of a reassembled PDU]
129   0.020302 172.31.29.138 -> 54.192.156.109 TCP 66 55880 > http [ACK] Seq=98 Ack=704187 Win=1250048 Len=0 TSval=5146574 TSecr=728309836
130   0.020775 54.192.156.109 -> 172.31.29.138 TCP 1514 [TCP segment of a reassembled PDU]
131   0.020780 172.31.29.138 -> 54.192.156.109 TCP 66 55880 > http [ACK] Seq=98 Ack=705635 Win=1252992 Len=0 TSval=5146574 TSecr=728309836
132   0.020956 54.192.156.109 -> 172.31.29.138 TCP 26130 [TCP segment of a reassembled PDU]
133   0.020970 172.31.29.138 -> 54.192.156.109 TCP 66 55880 > http [ACK] Seq=98 Ack=731699 Win=1305088 Len=0 TSval=5146574 TSecr=728309836
134   0.020990 54.192.156.109 -> 172.31.29.138 TCP 13098 [TCP segment of a reassembled PDU]
135   0.020997 172.31.29.138 -> 54.192.156.109 TCP 66 55880 > http [ACK] Seq=98 Ack=744731 Win=1331200 Len=0 TSval=5146574 TSecr=728309836
136   0.021007 54.192.156.109 -> 172.31.29.138 TCP 10202 [TCP segment of a reassembled PDU]
137   0.021012 172.31.29.138 -> 54.192.156.109 TCP 66 55880 > http [ACK] Seq=98 Ack=754867 Win=1333632 Len=0 TSval=5146574 TSecr=728309836
138   0.021023 54.192.156.109 -> 172.31.29.138 TCP 2962 [TCP segment of a reassembled PDU]
139   0.021026 172.31.29.138 -> 54.192.156.109 TCP 66 55880 > http [ACK] Seq=98 Ack=757763 Win=1330816 Len=0 TSval=5146574 TSecr=728309836
140   0.021128 54.192.156.109 -> 172.31.29.138 TCP 31922 [TCP segment of a reassembled PDU]
141   0.021143 172.31.29.138 -> 54.192.156.109 TCP 66 55880 > http [ACK] Seq=98 Ack=789619 Win=1362176 Len=0 TSval=5146574 TSecr=728309836
142   0.021163 54.192.156.109 -> 172.31.29.138 TCP 14546 [TCP segment of a reassembled PDU]
143   0.021170 172.31.29.138 -> 54.192.156.109 TCP 66 55880 > http [ACK] Seq=98 Ack=804099 Win=1347712 Len=0 TSval=5146574 TSecr=728309836
144   0.021175 54.192.156.109 -> 172.31.29.138 TCP 1514 [TCP segment of a reassembled PDU]
145   0.021178 172.31.29.138 -> 54.192.156.109 TCP 66 55880 > http [ACK] Seq=98 Ack=805547 Win=1346304 Len=0 TSval=5146574 TSecr=728309836
146   0.021505 54.192.156.109 -> 172.31.29.138 TCP 20338 [TCP segment of a reassembled PDU]
147   0.021518 172.31.29.138 -> 54.192.156.109 TCP 66 55880 > http [ACK] Seq=98 Ack=825819 Win=1381248 Len=0 TSval=5146574 TSecr=728309836
148   0.021632 54.192.156.109 -> 172.31.29.138 TCP 4410 [TCP segment of a reassembled PDU]
149   0.021638 172.31.29.138 -> 54.192.156.109 TCP 66 55880 > http [ACK] Seq=98 Ack=830163 Win=1407488 Len=0 TSval=5146574 TSecr=728309836
150   0.021748 54.192.156.109 -> 172.31.29.138 TCP 4410 [TCP segment of a reassembled PDU]
151   0.021754 172.31.29.138 -> 54.192.156.109 TCP 66 55880 > http [ACK] Seq=98 Ack=834507 Win=1407488 Len=0 TSval=5146574 TSecr=728309836
152   0.021870 54.192.156.109 -> 172.31.29.138 TCP 26130 [TCP segment of a reassembled PDU]
153   0.021883 172.31.29.138 -> 54.192.156.109 TCP 66 55880 > http [ACK] Seq=98 Ack=860571 Win=1381504 Len=0 TSval=5146574 TSecr=728309836
154   0.021892 54.192.156.109 -> 172.31.29.138 TCP 5858 [TCP segment of a reassembled PDU]
155   0.021943 54.192.156.109 -> 172.31.29.138 TCP 20338 [TCP segment of a reassembled PDU]
156   0.021986 54.192.156.109 -> 172.31.29.138 TCP 13098 [TCP segment of a reassembled PDU]
157   0.022085 172.31.29.138 -> 54.192.156.109 TCP 66 55880 > http [ACK] Seq=98 Ack=899667 Win=1342464 Len=0 TSval=5146575 TSecr=728309836
158   0.022233 54.192.156.109 -> 172.31.29.138 TCP 21786 [TCP segment of a reassembled PDU]
159   0.022246 172.31.29.138 -> 54.192.156.109 TCP 66 55880 > http [ACK] Seq=98 Ack=921387 Win=1378944 Len=0 TSval=5146575 TSecr=728309836
160   0.022329 54.192.156.109 -> 172.31.29.138 TCP 17442 [TCP segment of a reassembled PDU]
161   0.022340 172.31.29.138 -> 54.192.156.109 TCP 66 55880 > http [ACK] Seq=98 Ack=938763 Win=1385984 Len=0 TSval=5146575 TSecr=728309836
162   0.022428 54.192.156.109 -> 172.31.29.138 TCP 10202 [TCP segment of a reassembled PDU]
163   0.022436 172.31.29.138 -> 54.192.156.109 TCP 66 55880 > http [ACK] Seq=98 Ack=948899 Win=1398016 Len=0 TSval=5146575 TSecr=728309836
164   0.022535 54.192.156.109 -> 172.31.29.138 TCP 7306 [TCP segment of a reassembled PDU]
165   0.022542 172.31.29.138 -> 54.192.156.109 TCP 66 55880 > http [ACK] Seq=98 Ack=956139 Win=1402752 Len=0 TSval=5146575 TSecr=728309836
166   0.022645 54.192.156.109 -> 172.31.29.138 TCP 4410 [TCP segment of a reassembled PDU]
167   0.022651 172.31.29.138 -> 54.192.156.109 TCP 66 55880 > http [ACK] Seq=98 Ack=960483 Win=1407488 Len=0 TSval=5146575 TSecr=728309836
168   0.022774 54.192.156.109 -> 172.31.29.138 TCP 4410 [TCP segment of a reassembled PDU]
169   0.022779 172.31.29.138 -> 54.192.156.109 TCP 66 55880 > http [ACK] Seq=98 Ack=964827 Win=1407488 Len=0 TSval=5146575 TSecr=728309836
170   0.022868 54.192.156.109 -> 172.31.29.138 TCP 18890 [TCP segment of a reassembled PDU]
171   0.022899 54.192.156.109 -> 172.31.29.138 TCP 7306 [TCP segment of a reassembled PDU]
172   0.022933 172.31.29.138 -> 54.192.156.109 TCP 66 55880 > http [ACK] Seq=98 Ack=990891 Win=1381504 Len=0 TSval=5146575 TSecr=728309836
173   0.022972 54.192.156.109 -> 172.31.29.138 TCP 30474 [TCP segment of a reassembled PDU]
174   0.023001 54.192.156.109 -> 172.31.29.138 TCP 8754 [TCP segment of a reassembled PDU]
175   0.023011 172.31.29.138 -> 54.192.156.109 TCP 66 55880 > http [ACK] Seq=98 Ack=1029987 Win=1350272 Len=0 TSval=5146575 TSecr=728309836
176   0.023093 54.192.156.109 -> 172.31.29.138 TCP 26130 [TCP segment of a reassembled PDU]
177   0.023106 172.31.29.138 -> 54.192.156.109 TCP 66 55880 > http [ACK] Seq=98 Ack=1056051 Win=1371776 Len=0 TSval=5146575 TSecr=728309836
178   0.023138 54.192.156.109 -> 172.31.29.138 TCP 15994 [TCP segment of a reassembled PDU]
179   0.023157 172.31.29.138 -> 54.192.156.109 TCP 66 55880 > http [ACK] Seq=98 Ack=1071979 Win=1388416 Len=0 TSval=5146575 TSecr=728309836
180   0.023260 54.192.156.109 -> 172.31.29.138 TCP 1514 [TCP segment of a reassembled PDU]
181   0.023678 54.192.156.109 -> 172.31.29.138 TCP 4410 [TCP segment of a reassembled PDU]
182   0.023684 172.31.29.138 -> 54.192.156.109 TCP 66 55880 > http [ACK] Seq=98 Ack=1077771 Win=1407488 Len=0 TSval=5146575 TSecr=728309836
183   0.023834 54.192.156.109 -> 172.31.29.138 TCP 26130 [TCP segment of a reassembled PDU]
184   0.023861 172.31.29.138 -> 54.192.156.109 TCP 66 55880 > http [ACK] Seq=98 Ack=1103835 Win=1381504 Len=0 TSval=5146575 TSecr=728309836
185   0.023891 54.192.156.109 -> 172.31.29.138 TCP 26130 [TCP segment of a reassembled PDU]
186   0.023914 172.31.29.138 -> 54.192.156.109 TCP 66 55880 > http [ACK] Seq=98 Ack=1129899 Win=1371776 Len=0 TSval=5146575 TSecr=728309836
187   0.023959 54.192.156.109 -> 172.31.29.138 TCP 18890 [TCP segment of a reassembled PDU]
188   0.023971 172.31.29.138 -> 54.192.156.109 TCP 66 55880 > http [ACK] Seq=98 Ack=1148723 Win=1383680 Len=0 TSval=5146575 TSecr=728309836
189   0.024014 54.192.156.109 -> 172.31.29.138 TCP 11650 [TCP segment of a reassembled PDU]
190   0.024022 172.31.29.138 -> 54.192.156.109 TCP 66 55880 > http [ACK] Seq=98 Ack=1160307 Win=1395584 Len=0 TSval=5146575 TSecr=728309836
191   0.024091 54.192.156.109 -> 172.31.29.138 TCP 26130 [TCP segment of a reassembled PDU]
192   0.024107 54.192.156.109 -> 172.31.29.138 TCP 5858 [TCP segment of a reassembled PDU]
193   0.024125 54.192.156.109 -> 172.31.29.138 TCP 11650 [TCP segment of a reassembled PDU]
194   0.024132 54.192.156.109 -> 172.31.29.138 TCP 2962 [TCP segment of a reassembled PDU]
195   0.024266 172.31.29.138 -> 54.192.156.109 TCP 66 55880 > http [ACK] Seq=98 Ack=1206643 Win=1349248 Len=0 TSval=5146575 TSecr=728309836
196   0.024658 54.192.156.109 -> 172.31.29.138 TCP 2962 [TCP segment of a reassembled PDU]
197   0.024664 172.31.29.138 -> 54.192.156.109 TCP 66 55880 > http [ACK] Seq=98 Ack=1209539 Win=1409792 Len=0 TSval=5146575 TSecr=728309836
198   0.024838 54.192.156.109 -> 172.31.29.138 TCP 26130 [TCP segment of a reassembled PDU]
199   0.024859 54.192.156.109 -> 172.31.29.138 TCP 13098 [TCP segment of a reassembled PDU]
200   0.024891 54.192.156.109 -> 172.31.29.138 TCP 13098 [TCP segment of a reassembled PDU]
201   0.024926 54.192.156.109 -> 172.31.29.138 TCP 23234 [TCP segment of a reassembled PDU]
202   0.024947 54.192.156.109 -> 172.31.29.138 TCP 7306 [TCP segment of a reassembled PDU]
203   0.024966 172.31.29.138 -> 54.192.156.109 TCP 66 55880 > http [ACK] Seq=98 Ack=1292075 Win=1327360 Len=0 TSval=5146575 TSecr=728309836
204   0.025134 54.192.156.109 -> 172.31.29.138 TCP 26130 [TCP segment of a reassembled PDU]
205   0.025148 172.31.29.138 -> 54.192.156.109 TCP 66 55880 > http [ACK] Seq=98 Ack=1318139 Win=1371776 Len=0 TSval=5146575 TSecr=728309836
206   0.025190 54.192.156.109 -> 172.31.29.138 TCP 26130 [TCP segment of a reassembled PDU]
207   0.025212 54.192.156.109 -> 172.31.29.138 TCP 5858 [TCP segment of a reassembled PDU]
208   0.025226 172.31.29.138 -> 54.192.156.109 TCP 66 55880 > http [ACK] Seq=98 Ack=1349995 Win=1362176 Len=0 TSval=5146575 TSecr=728309836
209   0.025651 54.192.156.109 -> 172.31.29.138 TCP 2962 [TCP segment of a reassembled PDU]
210   0.025658 172.31.29.138 -> 54.192.156.109 TCP 66 55880 > http [ACK] Seq=98 Ack=1352891 Win=1409792 Len=0 TSval=5146575 TSecr=728309836
211   0.025773 54.192.156.109 -> 172.31.29.138 TCP 1514 [TCP Previous segment not captured] [TCP segment of a reassembled PDU]
212   0.025778 172.31.29.138 -> 54.192.156.109 TCP 78 [TCP Window Update] 55880 > http [ACK] Seq=98 Ack=1352891 Win=1411840 Len=0 TSval=5146575 TSecr=728309836 SLE=1354339 SRE=1355787
213   0.025797 54.192.156.109 -> 172.31.29.138 TCP 1514 [TCP Out-Of-Order] [TCP segment of a reassembled PDU]
214   0.025801 172.31.29.138 -> 54.192.156.109 TCP 66 55880 > http [ACK] Seq=98 Ack=1355787 Win=1409664 Len=0 TSval=5146575 TSecr=728309836
215   0.025916 54.192.156.109 -> 172.31.29.138 TCP 26130 [TCP segment of a reassembled PDU]
216   0.025930 172.31.29.138 -> 54.192.156.109 TCP 66 55880 > http [ACK] Seq=98 Ack=1381851 Win=1383680 Len=0 TSval=5146575 TSecr=728309836
217   0.025957 54.192.156.109 -> 172.31.29.138 TCP 24682 [TCP segment of a reassembled PDU]
218   0.025968 172.31.29.138 -> 54.192.156.109 TCP 66 55880 > http [ACK] Seq=98 Ack=1406467 Win=1359104 Len=0 TSval=5146575 TSecr=728309836
219   0.025986 54.192.156.109 -> 172.31.29.138 TCP 1514 [TCP segment of a reassembled PDU]
220   0.025989 172.31.29.138 -> 54.192.156.109 TCP 66 55880 > http [ACK] Seq=98 Ack=1407915 Win=1357696 Len=0 TSval=5146576 TSecr=728309836
221   0.026062 54.192.156.109 -> 172.31.29.138 TCP 26130 [TCP segment of a reassembled PDU]
222   0.026076 172.31.29.138 -> 54.192.156.109 TCP 66 55880 > http [ACK] Seq=98 Ack=1433979 Win=1464064 Len=0 TSval=5146576 TSecr=728309836
223   0.026139 54.192.156.109 -> 172.31.29.138 TCP 33370 [TCP segment of a reassembled PDU]
224   0.026156 172.31.29.138 -> 54.192.156.109 TCP 66 55880 > http [ACK] Seq=98 Ack=1467283 Win=1530624 Len=0 TSval=5146576 TSecr=728309836
225   0.026163 54.192.156.109 -> 172.31.29.138 TCP 1514 [TCP segment of a reassembled PDU]
226   0.026165 172.31.29.138 -> 54.192.156.109 TCP 66 55880 > http [ACK] Seq=98 Ack=1468731 Win=1533568 Len=0 TSval=5146576 TSecr=728309836
227   0.026188 54.192.156.109 -> 172.31.29.138 TCP 17442 [TCP segment of a reassembled PDU]
228   0.026197 172.31.29.138 -> 54.192.156.109 TCP 66 55880 > http [ACK] Seq=98 Ack=1486107 Win=1568256 Len=0 TSval=5146576 TSecr=728309836
229   0.026372 54.192.156.109 -> 172.31.29.138 TCP 4410 [TCP segment of a reassembled PDU]
230   0.026377 172.31.29.138 -> 54.192.156.109 TCP 66 55880 > http [ACK] Seq=98 Ack=1490451 Win=1576960 Len=0 TSval=5146576 TSecr=728309836
231   0.026781 54.192.156.109 -> 172.31.29.138 TCP 26130 [TCP segment of a reassembled PDU]
232   0.026795 172.31.29.138 -> 54.192.156.109 TCP 66 55880 > http [ACK] Seq=98 Ack=1516515 Win=1576960 Len=0 TSval=5146576 TSecr=728309836
233   0.026809 54.192.156.109 -> 172.31.29.138 TCP 13098 [TCP segment of a reassembled PDU]
234   0.026818 172.31.29.138 -> 54.192.156.109 TCP 66 55880 > http [ACK] Seq=98 Ack=1529547 Win=1576960 Len=0 TSval=5146576 TSecr=728309836
235   0.026830 54.192.156.109 -> 172.31.29.138 TCP 13098 [TCP segment of a reassembled PDU]
236   0.026837 172.31.29.138 -> 54.192.156.109 TCP 66 55880 > http [ACK] Seq=98 Ack=1542579 Win=1576960 Len=0 TSval=5146576 TSecr=728309836
237   0.026861 54.192.156.109 -> 172.31.29.138 TCP 4410 [TCP segment of a reassembled PDU]
238   0.026866 172.31.29.138 -> 54.192.156.109 TCP 66 55880 > http [ACK] Seq=98 Ack=1546923 Win=1576960 Len=0 TSval=5146576 TSecr=728309836
239   0.026872 54.192.156.109 -> 172.31.29.138 TCP 4410 [TCP segment of a reassembled PDU]
240   0.026875 172.31.29.138 -> 54.192.156.109 TCP 66 55880 > http [ACK] Seq=98 Ack=1551267 Win=1576960 Len=0 TSval=5146576 TSecr=728309836
241   0.026966 54.192.156.109 -> 172.31.29.138 TCP 27578 [TCP segment of a reassembled PDU]
242   0.026980 172.31.29.138 -> 54.192.156.109 TCP 66 55880 > http [ACK] Seq=98 Ack=1578779 Win=1576960 Len=0 TSval=5146576 TSecr=728309836
243   0.027042 54.192.156.109 -> 172.31.29.138 TCP 20338 [TCP segment of a reassembled PDU]
244   0.027053 172.31.29.138 -> 54.192.156.109 TCP 66 55880 > http [ACK] Seq=98 Ack=1599051 Win=1576960 Len=0 TSval=5146576 TSecr=728309836
245   0.027135 54.192.156.109 -> 172.31.29.138 TCP 17442 [TCP segment of a reassembled PDU]
246   0.027144 172.31.29.138 -> 54.192.156.109 TCP 66 55880 > http [ACK] Seq=98 Ack=1616427 Win=1576960 Len=0 TSval=5146576 TSecr=728309836
247   0.027366 54.192.156.109 -> 172.31.29.138 TCP 10202 [TCP segment of a reassembled PDU]
248   0.027375 172.31.29.138 -> 54.192.156.109 TCP 66 55880 > http [ACK] Seq=98 Ack=1626563 Win=1576960 Len=0 TSval=5146576 TSecr=728309837
249   0.027521 54.192.156.109 -> 172.31.29.138 TCP 26130 [TCP segment of a reassembled PDU]
250   0.027534 172.31.29.138 -> 54.192.156.109 TCP 66 55880 > http [ACK] Seq=98 Ack=1652627 Win=1576960 Len=0 TSval=5146576 TSecr=728309837
251   0.027570 54.192.156.109 -> 172.31.29.138 TCP 26130 [TCP segment of a reassembled PDU]
252   0.027582 172.31.29.138 -> 54.192.156.109 TCP 66 55880 > http [ACK] Seq=98 Ack=1678691 Win=1576960 Len=0 TSval=5146576 TSecr=728309837
253   0.027599 54.192.156.109 -> 172.31.29.138 TCP 7306 [TCP segment of a reassembled PDU]
254   0.027606 172.31.29.138 -> 54.192.156.109 TCP 66 55880 > http [ACK] Seq=98 Ack=1685931 Win=1576960 Len=0 TSval=5146576 TSecr=728309837
255   0.027770 54.192.156.109 -> 172.31.29.138 TCP 26130 [TCP segment of a reassembled PDU]
256   0.027783 172.31.29.138 -> 54.192.156.109 TCP 66 55880 > http [ACK] Seq=98 Ack=1711995 Win=1576960 Len=0 TSval=5146576 TSecr=728309837
257   0.027827 54.192.156.109 -> 172.31.29.138 TCP 26130 [TCP segment of a reassembled PDU]
258   0.027840 172.31.29.138 -> 54.192.156.109 TCP 66 55880 > http [ACK] Seq=98 Ack=1738059 Win=1576960 Len=0 TSval=5146576 TSecr=728309837
259   0.027853 54.192.156.109 -> 172.31.29.138 TCP 8754 [TCP segment of a reassembled PDU]
260   0.027858 172.31.29.138 -> 54.192.156.109 TCP 66 55880 > http [ACK] Seq=98 Ack=1746747 Win=1576960 Len=0 TSval=5146576 TSecr=728309837
261   0.028094 54.192.156.109 -> 172.31.29.138 TCP 4410 [TCP segment of a reassembled PDU]
262   0.028101 172.31.29.138 -> 54.192.156.109 TCP 66 55880 > http [ACK] Seq=98 Ack=1751091 Win=1576960 Len=0 TSval=5146576 TSecr=728309837
263   0.028278 54.192.156.109 -> 172.31.29.138 TCP 26130 [TCP segment of a reassembled PDU]
264   0.028292 172.31.29.138 -> 54.192.156.109 TCP 66 55880 > http [ACK] Seq=98 Ack=1777155 Win=1576960 Len=0 TSval=5146576 TSecr=728309837
265   0.028300 54.192.156.109 -> 172.31.29.138 TCP 4410 [TCP segment of a reassembled PDU]
266   0.028304 172.31.29.138 -> 54.192.156.109 TCP 66 55880 > http [ACK] Seq=98 Ack=1781499 Win=1576960 Len=0 TSval=5146576 TSecr=728309837
267   0.028326 54.192.156.109 -> 172.31.29.138 TCP 18890 [TCP segment of a reassembled PDU]
268   0.028334 172.31.29.138 -> 54.192.156.109 TCP 66 55880 > http [ACK] Seq=98 Ack=1800323 Win=1576960 Len=0 TSval=5146576 TSecr=728309837
269   0.028348 54.192.156.109 -> 172.31.29.138 TCP 2962 [TCP segment of a reassembled PDU]
270   0.028351 172.31.29.138 -> 54.192.156.109 TCP 66 55880 > http [ACK] Seq=98 Ack=1803219 Win=1576960 Len=0 TSval=5146576 TSecr=728309837
271   0.028407 54.192.156.109 -> 172.31.29.138 TCP 7306 [TCP segment of a reassembled PDU]
272   0.028414 172.31.29.138 -> 54.192.156.109 TCP 66 55880 > http [ACK] Seq=98 Ack=1810459 Win=1576960 Len=0 TSval=5146576 TSecr=728309837
273   0.028539 54.192.156.109 -> 172.31.29.138 TCP 26130 [TCP segment of a reassembled PDU]
274   0.028552 172.31.29.138 -> 54.192.156.109 TCP 66 55880 > http [ACK] Seq=98 Ack=1836523 Win=1576960 Len=0 TSval=5146576 TSecr=728309837
275   0.028603 54.192.156.109 -> 172.31.29.138 TCP 26130 [TCP segment of a reassembled PDU]
276   0.028616 172.31.29.138 -> 54.192.156.109 TCP 66 55880 > http [ACK] Seq=98 Ack=1862587 Win=1576960 Len=0 TSval=5146576 TSecr=728309837
277   0.028664 54.192.156.109 -> 172.31.29.138 TCP 14546 [TCP segment of a reassembled PDU]
278   0.028673 172.31.29.138 -> 54.192.156.109 TCP 66 55880 > http [ACK] Seq=98 Ack=1877067 Win=1576960 Len=0 TSval=5146576 TSecr=728309837
279   0.028884 54.192.156.109 -> 172.31.29.138 TCP 10202 [TCP segment of a reassembled PDU]
280   0.028893 172.31.29.138 -> 54.192.156.109 TCP 66 55880 > http [ACK] Seq=98 Ack=1887203 Win=1576960 Len=0 TSval=5146576 TSecr=728309837
281   0.029058 54.192.156.109 -> 172.31.29.138 TCP 26130 [TCP segment of a reassembled PDU]
282   0.029073 172.31.29.138 -> 54.192.156.109 TCP 66 55880 > http [ACK] Seq=98 Ack=1913267 Win=1576960 Len=0 TSval=5146576 TSecr=728309837
283   0.029088 54.192.156.109 -> 172.31.29.138 TCP 11650 [TCP segment of a reassembled PDU]
284   0.029095 172.31.29.138 -> 54.192.156.109 TCP 66 55880 > http [ACK] Seq=98 Ack=1924851 Win=1576960 Len=0 TSval=5146576 TSecr=728309837
285   0.029105 54.192.156.109 -> 172.31.29.138 TCP 11650 [TCP segment of a reassembled PDU]
286   0.029109 172.31.29.138 -> 54.192.156.109 TCP 66 55880 > http [ACK] Seq=98 Ack=1936435 Win=1576960 Len=0 TSval=5146576 TSecr=728309837
287   0.029133 54.192.156.109 -> 172.31.29.138 TCP 8754 [TCP segment of a reassembled PDU]
288   0.029138 172.31.29.138 -> 54.192.156.109 TCP 66 55880 > http [ACK] Seq=98 Ack=1945123 Win=1576960 Len=0 TSval=5146576 TSecr=728309837
289   0.029306 54.192.156.109 -> 172.31.29.138 TCP 26130 [TCP segment of a reassembled PDU]
290   0.029313 172.31.29.138 -> 54.192.156.109 TCP 66 55880 > http [ACK] Seq=98 Ack=1971187 Win=1576960 Len=0 TSval=5146576 TSecr=728309837
291   0.029325 54.192.156.109 -> 172.31.29.138 TCP 4410 [TCP segment of a reassembled PDU]
292   0.029327 172.31.29.138 -> 54.192.156.109 TCP 66 55880 > http [ACK] Seq=98 Ack=1975531 Win=1576960 Len=0 TSval=5146576 TSecr=728309837
293   0.029442 54.192.156.109 -> 172.31.29.138 TCP 47850 [TCP segment of a reassembled PDU]
294   0.029453 172.31.29.138 -> 54.192.156.109 TCP 66 55880 > http [ACK] Seq=98 Ack=2023315 Win=1576960 Len=0 TSval=5146576 TSecr=728309837
295   0.029463 54.192.156.109 -> 172.31.29.138 TCP 5858 [TCP segment of a reassembled PDU]
296   0.029466 172.31.29.138 -> 54.192.156.109 TCP 66 55880 > http [ACK] Seq=98 Ack=2029107 Win=1576960 Len=0 TSval=5146576 TSecr=728309837
297   0.029593 54.192.156.109 -> 172.31.29.138 TCP 26130 [TCP segment of a reassembled PDU]
298   0.029600 172.31.29.138 -> 54.192.156.109 TCP 66 55880 > http [ACK] Seq=98 Ack=2055171 Win=1576960 Len=0 TSval=5146576 TSecr=728309837
299   0.029614 54.192.156.109 -> 172.31.29.138 TCP 17442 [TCP segment of a reassembled PDU]
300   0.029621 172.31.29.138 -> 54.192.156.109 TCP 66 55880 > http [ACK] Seq=98 Ack=2072547 Win=1576960 Len=0 TSval=5146576 TSecr=728309837
301   0.029967 54.192.156.109 -> 172.31.29.138 TCP 26130 [TCP segment of a reassembled PDU]
302   0.029975 172.31.29.138 -> 54.192.156.109 TCP 66 55880 > http [ACK] Seq=98 Ack=2098611 Win=1576960 Len=0 TSval=5146576 TSecr=728309837
303   0.030023 54.192.156.109 -> 172.31.29.138 TCP 26130 [TCP segment of a reassembled PDU]
304   0.030029 172.31.29.138 -> 54.192.156.109 TCP 66 55880 > http [ACK] Seq=98 Ack=2124675 Win=1576960 Len=0 TSval=5146577 TSecr=728309837
305   0.030063 54.192.156.109 -> 172.31.29.138 TCP 14546 [TCP segment of a reassembled PDU]
306   0.030068 172.31.29.138 -> 54.192.156.109 TCP 66 55880 > http [ACK] Seq=98 Ack=2139155 Win=1576960 Len=0 TSval=5146577 TSecr=728309837
307   0.030119 54.192.156.109 -> 172.31.29.138 TCP 18890 [TCP segment of a reassembled PDU]
308   0.030125 172.31.29.138 -> 54.192.156.109 TCP 66 55880 > http [ACK] Seq=98 Ack=2157979 Win=1576960 Len=0 TSval=5146577 TSecr=728309837
309   0.030248 54.192.156.109 -> 172.31.29.138 TCP 26130 [TCP segment of a reassembled PDU]
310   0.030256 172.31.29.138 -> 54.192.156.109 TCP 66 55880 > http [ACK] Seq=98 Ack=2184043 Win=1576960 Len=0 TSval=5146577 TSecr=728309837
311   0.030263 54.192.156.109 -> 172.31.29.138 TCP 2962 [TCP segment of a reassembled PDU]
312   0.030265 172.31.29.138 -> 54.192.156.109 TCP 66 55880 > http [ACK] Seq=98 Ack=2186939 Win=1576960 Len=0 TSval=5146577 TSecr=728309837
313   0.030298 54.192.156.109 -> 172.31.29.138 TCP 18890 [TCP segment of a reassembled PDU]
314   0.030307 172.31.29.138 -> 54.192.156.109 TCP 66 55880 > http [ACK] Seq=98 Ack=2205763 Win=1576960 Len=0 TSval=5146577 TSecr=728309837
315   0.030377 54.192.156.109 -> 172.31.29.138 TCP 20338 [TCP segment of a reassembled PDU]
316   0.030383 172.31.29.138 -> 54.192.156.109 TCP 66 55880 > http [ACK] Seq=98 Ack=2226035 Win=1576960 Len=0 TSval=5146577 TSecr=728309837
317   0.030485 54.192.156.109 -> 172.31.29.138 TCP 20338 [TCP segment of a reassembled PDU]
318   0.030491 172.31.29.138 -> 54.192.156.109 TCP 66 55880 > http [ACK] Seq=98 Ack=2246307 Win=1576960 Len=0 TSval=5146577 TSecr=728309837
319   0.030513 54.192.156.109 -> 172.31.29.138 TCP 5858 [TCP segment of a reassembled PDU]
320   0.030517 172.31.29.138 -> 54.192.156.109 TCP 66 55880 > http [ACK] Seq=98 Ack=2252099 Win=1576960 Len=0 TSval=5146577 TSecr=728309837
321   0.030567 54.192.156.109 -> 172.31.29.138 TCP 15994 [TCP segment of a reassembled PDU]
322   0.030572 172.31.29.138 -> 54.192.156.109 TCP 66 55880 > http [ACK] Seq=98 Ack=2268027 Win=1576960 Len=0 TSval=5146577 TSecr=728309837
323   0.030870 54.192.156.109 -> 172.31.29.138 TCP 26130 [TCP segment of a reassembled PDU]
324   0.030878 172.31.29.138 -> 54.192.156.109 TCP 66 55880 > http [ACK] Seq=98 Ack=2294091 Win=1576960 Len=0 TSval=5146577 TSecr=728309837
325   0.030893 54.192.156.109 -> 172.31.29.138 TCP 14546 [TCP segment of a reassembled PDU]
326   0.030900 172.31.29.138 -> 54.192.156.109 TCP 66 55880 > http [ACK] Seq=98 Ack=2308571 Win=1576960 Len=0 TSval=5146577 TSecr=728309837
327   0.030909 54.192.156.109 -> 172.31.29.138 TCP 8754 [TCP segment of a reassembled PDU]
328   0.030912 172.31.29.138 -> 54.192.156.109 TCP 66 55880 > http [ACK] Seq=98 Ack=2317259 Win=1576960 Len=0 TSval=5146577 TSecr=728309837
329   0.031010 54.192.156.109 -> 172.31.29.138 TCP 21786 [TCP segment of a reassembled PDU]
330   0.031016 172.31.29.138 -> 54.192.156.109 TCP 66 55880 > http [ACK] Seq=98 Ack=2338979 Win=1576960 Len=0 TSval=5146577 TSecr=728309837
331   0.031101 54.192.156.109 -> 172.31.29.138 TCP 17442 [TCP segment of a reassembled PDU]
332   0.031107 172.31.29.138 -> 54.192.156.109 TCP 66 55880 > http [ACK] Seq=98 Ack=2356355 Win=1576960 Len=0 TSval=5146577 TSecr=728309837
333   0.031149 54.192.156.109 -> 172.31.29.138 TCP 8754 [TCP segment of a reassembled PDU]
334   0.031152 172.31.29.138 -> 54.192.156.109 TCP 66 55880 > http [ACK] Seq=98 Ack=2365043 Win=1576960 Len=0 TSval=5146577 TSecr=728309837
335   0.031219 54.192.156.109 -> 172.31.29.138 TCP 20338 [TCP segment of a reassembled PDU]
336   0.031225 172.31.29.138 -> 54.192.156.109 TCP 66 55880 > http [ACK] Seq=98 Ack=2385315 Win=1576960 Len=0 TSval=5146577 TSecr=728309837
337   0.031285 54.192.156.109 -> 172.31.29.138 TCP 26130 [TCP segment of a reassembled PDU]
338   0.031292 172.31.29.138 -> 54.192.156.109 TCP 66 55880 > http [ACK] Seq=98 Ack=2411379 Win=1576960 Len=0 TSval=5146577 TSecr=728309837
339   0.031305 54.192.156.109 -> 172.31.29.138 TCP 7306 [TCP segment of a reassembled PDU]
340   0.031308 172.31.29.138 -> 54.192.156.109 TCP 66 55880 > http [ACK] Seq=98 Ack=2418619 Win=1576960 Len=0 TSval=5146577 TSecr=728309837
341   0.031373 54.192.156.109 -> 172.31.29.138 TCP 26130 [TCP segment of a reassembled PDU]
342   0.031379 172.31.29.138 -> 54.192.156.109 TCP 66 55880 > http [ACK] Seq=98 Ack=2444683 Win=1576960 Len=0 TSval=5146577 TSecr=728309837
343   0.031526 54.192.156.109 -> 172.31.29.138 TCP 26130 [TCP segment of a reassembled PDU]
344   0.031533 172.31.29.138 -> 54.192.156.109 TCP 66 55880 > http [ACK] Seq=98 Ack=2470747 Win=1576960 Len=0 TSval=5146577 TSecr=728309837
345   0.031541 54.192.156.109 -> 172.31.29.138 TCP 2962 [TCP segment of a reassembled PDU]
346   0.031543 172.31.29.138 -> 54.192.156.109 TCP 66 55880 > http [ACK] Seq=98 Ack=2473643 Win=1576960 Len=0 TSval=5146577 TSecr=728309837
347   0.031603 54.192.156.109 -> 172.31.29.138 TCP 23234 [TCP segment of a reassembled PDU]
