[Measurement for 1mb at 09:37:49 20.37.2014] 
Tshark:

  1   0.000000 172.31.29.138 -> 172.31.0.2   DNS 88 Standard query 0xcd00  A dm53kc3eax57k.cloudfront.net
  2   0.000027 172.31.29.138 -> 172.31.0.2   DNS 88 Standard query 0xfcef  AAAA dm53kc3eax57k.cloudfront.net
  3   0.000541   172.31.0.2 -> 172.31.29.138 DNS 216 Standard query response 0xcd00  A 54.230.158.217 A 54.230.158.243 A 54.230.158.246 A 54.230.159.132 A 54.192.157.136 A 54.192.159.174 A 54.230.158.152 A 54.230.158.190
  4   0.000552   172.31.0.2 -> 172.31.29.138 DNS 175 Standard query response 0xfcef 
  5   0.003958 172.31.29.138 -> 54.230.158.217 TCP 74 42237 > http [SYN] Seq=0 Win=26883 Len=0 MSS=8961 SACK_PERM=1 TSval=15035585 TSecr=0 WS=128
  6   0.004655 54.230.158.217 -> 172.31.29.138 TCP 74 http > 42237 [SYN, ACK] Seq=0 Ack=1 Win=14480 Len=0 MSS=1460 SACK_PERM=1 TSval=732292764 TSecr=15035585 WS=128
  7   0.004670 172.31.29.138 -> 54.230.158.217 TCP 66 42237 > http [ACK] Seq=1 Ack=1 Win=27008 Len=0 TSval=15035585 TSecr=732292764
  8   0.004713 172.31.29.138 -> 54.230.158.217 HTTP 161 GET /1mb HTTP/1.1 
  9   0.005435 54.230.158.217 -> 172.31.29.138 TCP 66 http > 42237 [ACK] Seq=1 Ack=96 Win=14592 Len=0 TSval=732292764 TSecr=15035585
 10   0.019066 54.230.158.217 -> 172.31.29.138 TCP 8754 [TCP segment of a reassembled PDU]
 11   0.019077 172.31.29.138 -> 54.230.158.217 TCP 66 42237 > http [ACK] Seq=96 Ack=8689 Win=44288 Len=0 TSval=15035589 TSecr=732292765
 12   0.019121 54.230.158.217 -> 172.31.29.138 TCP 4410 [TCP segment of a reassembled PDU]
 13   0.019128 172.31.29.138 -> 54.230.158.217 TCP 66 42237 > http [ACK] Seq=96 Ack=13033 Win=52992 Len=0 TSval=15035589 TSecr=732292765
 14   0.019847 54.230.158.217 -> 172.31.29.138 TCP 13098 [TCP segment of a reassembled PDU]
 15   0.019859 172.31.29.138 -> 54.230.158.217 TCP 66 42237 > http [ACK] Seq=96 Ack=26065 Win=79104 Len=0 TSval=15035589 TSecr=732292765
 16   0.020646 54.230.158.217 -> 172.31.29.138 TCP 13098 [TCP segment of a reassembled PDU]
 17   0.020655 172.31.29.138 -> 54.230.158.217 TCP 66 42237 > http [ACK] Seq=96 Ack=39097 Win=96512 Len=0 TSval=15035589 TSecr=732292765
 18   0.021304 54.230.158.217 -> 172.31.29.138 TCP 5858 [TCP segment of a reassembled PDU]
 19   0.021311 172.31.29.138 -> 54.230.158.217 TCP 66 42237 > http [ACK] Seq=96 Ack=44889 Win=108416 Len=0 TSval=15035589 TSecr=732292765
 20   0.021443 54.230.158.217 -> 172.31.29.138 TCP 7306 [TCP segment of a reassembled PDU]
 21   0.021450 172.31.29.138 -> 54.230.158.217 TCP 66 42237 > http [ACK] Seq=96 Ack=52129 Win=105984 Len=0 TSval=15035589 TSecr=732292765
 22   0.021473 54.230.158.217 -> 172.31.29.138 TCP 7306 [TCP segment of a reassembled PDU]
 23   0.021478 172.31.29.138 -> 54.230.158.217 TCP 66 42237 > http [ACK] Seq=96 Ack=59369 Win=98816 Len=0 TSval=15035589 TSecr=732292765
 24   0.022106 54.230.158.217 -> 172.31.29.138 TCP 7306 [TCP segment of a reassembled PDU]
 25   0.022113 172.31.29.138 -> 54.230.158.217 TCP 66 42237 > http [ACK] Seq=96 Ack=66609 Win=105984 Len=0 TSval=15035589 TSecr=732292765
 26   0.022217 54.230.158.217 -> 172.31.29.138 TCP 17442 [TCP segment of a reassembled PDU]
 27   0.022228 172.31.29.138 -> 54.230.158.217 TCP 66 42237 > http [ACK] Seq=96 Ack=83985 Win=89344 Len=0 TSval=15035589 TSecr=732292765
 28   0.022978 54.230.158.217 -> 172.31.29.138 TCP 17442 [TCP segment of a reassembled PDU]
 29   0.022989 172.31.29.138 -> 54.230.158.217 TCP 66 42237 > http [ACK] Seq=96 Ack=101361 Win=143872 Len=0 TSval=15035590 TSecr=732292766
 30   0.023017 54.230.158.217 -> 172.31.29.138 TCP 8754 [TCP segment of a reassembled PDU]
 31   0.023024 172.31.29.138 -> 54.230.158.217 TCP 66 42237 > http [ACK] Seq=96 Ack=110049 Win=161152 Len=0 TSval=15035590 TSecr=732292766
 32   0.023051 54.230.158.217 -> 172.31.29.138 TCP 1514 [TCP segment of a reassembled PDU]
 33   0.023055 172.31.29.138 -> 54.230.158.217 TCP 66 42237 > http [ACK] Seq=96 Ack=111497 Win=164096 Len=0 TSval=15035590 TSecr=732292766
 34   0.023668 54.230.158.217 -> 172.31.29.138 TCP 15994 [TCP segment of a reassembled PDU]
 35   0.023678 172.31.29.138 -> 54.230.158.217 TCP 66 42237 > http [ACK] Seq=96 Ack=127425 Win=195968 Len=0 TSval=15035590 TSecr=732292766
 36   0.023685 54.230.158.217 -> 172.31.29.138 TCP 3472 [TCP segment of a reassembled PDU]
 37   0.023698 172.31.29.138 -> 54.230.158.217 TCP 66 42237 > http [ACK] Seq=96 Ack=130831 Win=202752 Len=0 TSval=15035590 TSecr=732292766
 38   0.027458 54.230.158.217 -> 172.31.29.138 TCP 2962 [TCP segment of a reassembled PDU]
 39   0.027465 172.31.29.138 -> 54.230.158.217 TCP 66 42237 > http [ACK] Seq=96 Ack=133727 Win=208512 Len=0 TSval=15035591 TSecr=732292766
 40   0.027612 54.230.158.217 -> 172.31.29.138 TCP 23234 [TCP segment of a reassembled PDU]
 41   0.027625 172.31.29.138 -> 54.230.158.217 TCP 66 42237 > http [ACK] Seq=96 Ack=156895 Win=254848 Len=0 TSval=15035591 TSecr=732292766
 42   0.027731 54.230.158.217 -> 172.31.29.138 TCP 5858 [TCP segment of a reassembled PDU]
 43   0.027738 172.31.29.138 -> 54.230.158.217 TCP 66 42237 > http [ACK] Seq=96 Ack=162687 Win=266496 Len=0 TSval=15035591 TSecr=732292766
 44   0.028227 54.230.158.217 -> 172.31.29.138 TCP 14546 [TCP segment of a reassembled PDU]
 45   0.028237 172.31.29.138 -> 54.230.158.217 TCP 66 42237 > http [ACK] Seq=96 Ack=177167 Win=295424 Len=0 TSval=15035591 TSecr=732292766
 46   0.028332 54.230.158.217 -> 172.31.29.138 TCP 14546 [TCP segment of a reassembled PDU]
 47   0.028342 172.31.29.138 -> 54.230.158.217 TCP 66 42237 > http [ACK] Seq=96 Ack=191647 Win=324352 Len=0 TSval=15035591 TSecr=732292766
 48   0.028974 54.230.158.217 -> 172.31.29.138 TCP 4786 [TCP segment of a reassembled PDU]
 49   0.028981 172.31.29.138 -> 54.230.158.217 TCP 66 42237 > http [ACK] Seq=96 Ack=196367 Win=333824 Len=0 TSval=15035591 TSecr=732292766
 50   0.029270 54.230.158.217 -> 172.31.29.138 TCP 2962 [TCP segment of a reassembled PDU]
 51   0.029275 172.31.29.138 -> 54.230.158.217 TCP 66 42237 > http [ACK] Seq=96 Ack=199263 Win=339584 Len=0 TSval=15035591 TSecr=732292766
 52   0.029381 54.230.158.217 -> 172.31.29.138 TCP 18890 [TCP segment of a reassembled PDU]
 53   0.029392 172.31.29.138 -> 54.230.158.217 TCP 66 42237 > http [ACK] Seq=96 Ack=218087 Win=377216 Len=0 TSval=15035591 TSecr=732292766
 54   0.029398 54.230.158.217 -> 172.31.29.138 TCP 1514 [TCP segment of a reassembled PDU]
 55   0.029401 172.31.29.138 -> 54.230.158.217 TCP 66 42237 > http [ACK] Seq=96 Ack=219535 Win=380160 Len=0 TSval=15035591 TSecr=732292766
 56   0.029408 54.230.158.217 -> 172.31.29.138 TCP 1514 [TCP segment of a reassembled PDU]
 57   0.029411 172.31.29.138 -> 54.230.158.217 TCP 66 42237 > http [ACK] Seq=96 Ack=220983 Win=383104 Len=0 TSval=15035591 TSecr=732292766
 58   0.029531 54.230.158.217 -> 172.31.29.138 TCP 7306 [TCP segment of a reassembled PDU]
 59   0.029538 172.31.29.138 -> 54.230.158.217 TCP 66 42237 > http [ACK] Seq=96 Ack=228223 Win=397568 Len=0 TSval=15035591 TSecr=732292766
 60   0.030010 54.230.158.217 -> 172.31.29.138 TCP 8754 [TCP segment of a reassembled PDU]
 61   0.030017 172.31.29.138 -> 54.230.158.217 TCP 66 42237 > http [ACK] Seq=96 Ack=236911 Win=414976 Len=0 TSval=15035591 TSecr=732292766
 62   0.030169 54.230.158.217 -> 172.31.29.138 TCP 23234 [TCP segment of a reassembled PDU]
 63   0.030182 172.31.29.138 -> 54.230.158.217 TCP 66 42237 > http [ACK] Seq=96 Ack=260079 Win=461312 Len=0 TSval=15035591 TSecr=732292766
 64   0.030743 54.230.158.217 -> 172.31.29.138 TCP 1890 [TCP segment of a reassembled PDU]
 65   0.030750 172.31.29.138 -> 54.230.158.217 TCP 66 42237 > http [ACK] Seq=96 Ack=261903 Win=464896 Len=0 TSval=15035592 TSecr=732292766
 66   0.039540 54.230.158.217 -> 172.31.29.138 TCP 17442 [TCP segment of a reassembled PDU]
 67   0.039550 172.31.29.138 -> 54.230.158.217 TCP 66 42237 > http [ACK] Seq=96 Ack=279279 Win=499712 Len=0 TSval=15035594 TSecr=732292767
 68   0.039567 54.230.158.217 -> 172.31.29.138 TCP 2962 [TCP segment of a reassembled PDU]
 69   0.039570 172.31.29.138 -> 54.230.158.217 TCP 66 42237 > http [ACK] Seq=96 Ack=282175 Win=505472 Len=0 TSval=15035594 TSecr=732292767
 70   0.039654 54.230.158.217 -> 172.31.29.138 TCP 26130 [TCP segment of a reassembled PDU]
 71   0.039668 172.31.29.138 -> 54.230.158.217 TCP 66 42237 > http [ACK] Seq=96 Ack=308239 Win=557568 Len=0 TSval=15035594 TSecr=732292767
 72   0.039768 54.230.158.217 -> 172.31.29.138 TCP 1514 [TCP segment of a reassembled PDU]
 73   0.039773 172.31.29.138 -> 54.230.158.217 TCP 66 42237 > http [ACK] Seq=96 Ack=309687 Win=560512 Len=0 TSval=15035594 TSecr=732292767
 74   0.040247 54.230.158.217 -> 172.31.29.138 TCP 5858 [TCP segment of a reassembled PDU]
 75   0.040253 172.31.29.138 -> 54.230.158.217 TCP 66 42237 > http [ACK] Seq=96 Ack=315479 Win=572032 Len=0 TSval=15035594 TSecr=732292767
 76   0.040350 54.230.158.217 -> 172.31.29.138 TCP 12026 [TCP segment of a reassembled PDU]
 77   0.040359 172.31.29.138 -> 54.230.158.217 TCP 66 42237 > http [ACK] Seq=96 Ack=327439 Win=595968 Len=0 TSval=15035594 TSecr=732292767
 78   0.047201 54.230.158.217 -> 172.31.29.138 TCP 17442 [TCP segment of a reassembled PDU]
 79   0.047211 172.31.29.138 -> 54.230.158.217 TCP 66 42237 > http [ACK] Seq=96 Ack=344815 Win=630784 Len=0 TSval=15035596 TSecr=732292768
 80   0.047325 54.230.158.217 -> 172.31.29.138 TCP 26130 [TCP segment of a reassembled PDU]
 81   0.047339 172.31.29.138 -> 54.230.158.217 TCP 66 42237 > http [ACK] Seq=96 Ack=370879 Win=682880 Len=0 TSval=15035596 TSecr=732292768
 82   0.047352 54.230.158.217 -> 172.31.29.138 TCP 8754 [TCP segment of a reassembled PDU]
 83   0.047361 172.31.29.138 -> 54.230.158.217 TCP 66 42237 > http [ACK] Seq=96 Ack=379567 Win=700288 Len=0 TSval=15035596 TSecr=732292768
 84   0.047917 54.230.158.217 -> 172.31.29.138 TCP 4410 [TCP segment of a reassembled PDU]
 85   0.047924 172.31.29.138 -> 54.230.158.217 TCP 66 42237 > http [ACK] Seq=96 Ack=383911 Win=708864 Len=0 TSval=15035596 TSecr=732292768
 86   0.048005 54.230.158.217 -> 172.31.29.138 TCP 9130 [TCP segment of a reassembled PDU]
 87   0.048012 172.31.29.138 -> 54.230.158.217 TCP 66 42237 > http [ACK] Seq=96 Ack=392975 Win=727040 Len=0 TSval=15035596 TSecr=732292768
 88   0.050458 54.230.158.217 -> 172.31.29.138 TCP 1514 [TCP segment of a reassembled PDU]
 89   0.050463 172.31.29.138 -> 54.230.158.217 TCP 66 42237 > http [ACK] Seq=96 Ack=394423 Win=729984 Len=0 TSval=15035597 TSecr=732292768
 90   0.050554 54.230.158.217 -> 172.31.29.138 TCP 16066 [TCP segment of a reassembled PDU]
 91   0.050562 172.31.29.138 -> 54.230.158.217 TCP 66 42237 > http [ACK] Seq=96 Ack=410423 Win=737280 Len=0 TSval=15035597 TSecr=732292768
 92   0.050755 54.230.158.217 -> 172.31.29.138 TCP 26130 [TCP segment of a reassembled PDU]
 93   0.050769 172.31.29.138 -> 54.230.158.217 TCP 66 42237 > http [ACK] Seq=96 Ack=436487 Win=723072 Len=0 TSval=15035597 TSecr=732292768
 94   0.050776 54.230.158.217 -> 172.31.29.138 TCP 1514 [TCP segment of a reassembled PDU]
 95   0.050778 172.31.29.138 -> 54.230.158.217 TCP 66 42237 > http [ACK] Seq=96 Ack=437935 Win=721664 Len=0 TSval=15035597 TSecr=732292768
 96   0.050796 54.230.158.217 -> 172.31.29.138 TCP 8754 [TCP segment of a reassembled PDU]
 97   0.050803 172.31.29.138 -> 54.230.158.217 TCP 66 42237 > http [ACK] Seq=96 Ack=446623 Win=713088 Len=0 TSval=15035597 TSecr=732292768
 98   0.051517 54.230.158.217 -> 172.31.29.138 TCP 11954 [TCP segment of a reassembled PDU]
 99   0.051526 172.31.29.138 -> 54.230.158.217 TCP 66 42237 > http [ACK] Seq=96 Ack=458511 Win=744576 Len=0 TSval=15035597 TSecr=732292768
100   0.058205 54.230.158.217 -> 172.31.29.138 TCP 13098 [TCP segment of a reassembled PDU]
101   0.058215 172.31.29.138 -> 54.230.158.217 TCP 66 42237 > http [ACK] Seq=96 Ack=471543 Win=744576 Len=0 TSval=15035598 TSecr=732292769
102   0.058351 54.230.158.217 -> 172.31.29.138 TCP 26130 [TCP segment of a reassembled PDU]
103   0.058428 54.230.158.217 -> 172.31.29.138 TCP 11650 [TCP segment of a reassembled PDU]
104   0.058441 54.230.158.217 -> 172.31.29.138 TCP 8754 [TCP segment of a reassembled PDU]
105   0.058607 172.31.29.138 -> 54.230.158.217 TCP 66 42237 > http [ACK] Seq=96 Ack=517879 Win=698240 Len=0 TSval=15035599 TSecr=732292769
106   0.059195 54.230.158.217 -> 172.31.29.138 TCP 6234 [TCP segment of a reassembled PDU]
107   0.059203 172.31.29.138 -> 54.230.158.217 TCP 66 42237 > http [ACK] Seq=96 Ack=524047 Win=754048 Len=0 TSval=15035599 TSecr=732292769
108   0.065591 54.230.158.217 -> 172.31.29.138 TCP 2962 [TCP segment of a reassembled PDU]
109   0.065600 172.31.29.138 -> 54.230.158.217 TCP 66 42237 > http [ACK] Seq=96 Ack=526943 Win=761088 Len=0 TSval=15035600 TSecr=732292770
110   0.065944 54.230.158.217 -> 172.31.29.138 TCP 26130 [TCP segment of a reassembled PDU]
111   0.065973 172.31.29.138 -> 54.230.158.217 TCP 66 42237 > http [ACK] Seq=96 Ack=553007 Win=735104 Len=0 TSval=15035600 TSecr=732292770
112   0.066018 54.230.158.217 -> 172.31.29.138 TCP 26130 [TCP segment of a reassembled PDU]
113   0.066047 54.230.158.217 -> 172.31.29.138 TCP 7306 [TCP segment of a reassembled PDU]
114   0.066054 172.31.29.138 -> 54.230.158.217 TCP 66 42237 > http [ACK] Seq=96 Ack=579071 Win=723072 Len=0 TSval=15035600 TSecr=732292770
115   0.066070 172.31.29.138 -> 54.230.158.217 TCP 66 42237 > http [ACK] Seq=96 Ack=586311 Win=754048 Len=0 TSval=15035600 TSecr=732292770
116   0.066606 54.230.158.217 -> 172.31.29.138 TCP 3338 [TCP segment of a reassembled PDU]
117   0.066612 172.31.29.138 -> 54.230.158.217 TCP 66 42237 > http [ACK] Seq=96 Ack=589583 Win=758784 Len=0 TSval=15035601 TSecr=732292770
118   0.068398 54.230.158.217 -> 172.31.29.138 TCP 2962 [TCP segment of a reassembled PDU]
119   0.068405 172.31.29.138 -> 54.230.158.217 TCP 66 42237 > http [ACK] Seq=96 Ack=592479 Win=761088 Len=0 TSval=15035601 TSecr=732292770
120   0.068955 54.230.158.217 -> 172.31.29.138 TCP 10202 [TCP segment of a reassembled PDU]
121   0.068977 172.31.29.138 -> 54.230.158.217 TCP 66 42237 > http [ACK] Seq=96 Ack=602615 Win=761984 Len=0 TSval=15035601 TSecr=732292770
122   0.069134 54.230.158.217 -> 172.31.29.138 TCP 26130 [TCP segment of a reassembled PDU]
123   0.069219 54.230.158.217 -> 172.31.29.138 TCP 26506 [TCP segment of a reassembled PDU]
124   0.069269 172.31.29.138 -> 54.230.158.217 TCP 66 42237 > http [ACK] Seq=96 Ack=655119 Win=709504 Len=0 TSval=15035601 TSecr=732292770
125   0.074793 54.230.158.217 -> 172.31.29.138 TCP 2962 [TCP segment of a reassembled PDU]
126   0.074800 172.31.29.138 -> 54.230.158.217 TCP 66 42237 > http [ACK] Seq=96 Ack=658015 Win=761088 Len=0 TSval=15035603 TSecr=732292771
127   0.075025 54.230.158.217 -> 172.31.29.138 TCP 2962 [TCP segment of a reassembled PDU]
128   0.075030 172.31.29.138 -> 54.230.158.217 TCP 66 42237 > http [ACK] Seq=96 Ack=660911 Win=761088 Len=0 TSval=15035603 TSecr=732292771
129   0.075225 54.230.158.217 -> 172.31.29.138 TCP 26130 [TCP segment of a reassembled PDU]
130   0.075251 172.31.29.138 -> 54.230.158.217 TCP 66 42237 > http [ACK] Seq=96 Ack=686975 Win=735104 Len=0 TSval=15035603 TSecr=732292771
131   0.075323 54.230.158.217 -> 172.31.29.138 TCP 26130 [TCP segment of a reassembled PDU]
132   0.075349 172.31.29.138 -> 54.230.158.217 TCP 66 42237 > http [ACK] Seq=96 Ack=713039 Win=723072 Len=0 TSval=15035603 TSecr=732292771
133   0.075387 54.230.158.217 -> 172.31.29.138 TCP 7682 [TCP segment of a reassembled PDU]
134   0.075393 172.31.29.138 -> 54.230.158.217 TCP 66 42237 > http [ACK] Seq=96 Ack=720655 Win=751616 Len=0 TSval=15035603 TSecr=732292771
135   0.080941 54.230.158.217 -> 172.31.29.138 TCP 2962 [TCP segment of a reassembled PDU]
136   0.080947 172.31.29.138 -> 54.230.158.217 TCP 66 42237 > http [ACK] Seq=96 Ack=723551 Win=761088 Len=0 TSval=15035604 TSecr=732292771
137   0.081083 54.230.158.217 -> 172.31.29.138 TCP 26130 [TCP segment of a reassembled PDU]
138   0.081108 54.230.158.217 -> 172.31.29.138 TCP 18890 [TCP segment of a reassembled PDU]
139   0.081176 54.230.158.217 -> 172.31.29.138 TCP 17818 [TCP segment of a reassembled PDU]
140   0.081235 172.31.29.138 -> 54.230.158.217 TCP 66 42237 > http [ACK] Seq=96 Ack=786191 Win=698496 Len=0 TSval=15035604 TSecr=732292771
141   0.088611 54.230.158.217 -> 172.31.29.138 TCP 5858 [TCP segment of a reassembled PDU]
142   0.088619 172.31.29.138 -> 54.230.158.217 TCP 66 42237 > http [ACK] Seq=96 Ack=791983 Win=756352 Len=0 TSval=15035606 TSecr=732292772
143   0.088786 54.230.158.217 -> 172.31.29.138 TCP 26130 [TCP segment of a reassembled PDU]
144   0.088814 172.31.29.138 -> 54.230.158.217 TCP 66 42237 > http [ACK] Seq=96 Ack=818047 Win=730368 Len=0 TSval=15035606 TSecr=732292772
145   0.088879 54.230.158.217 -> 172.31.29.138 TCP 26130 [TCP segment of a reassembled PDU]
146   0.088908 54.230.158.217 -> 172.31.29.138 TCP 7682 [TCP segment of a reassembled PDU]
147   0.088920 172.31.29.138 -> 54.230.158.217 TCP 66 42237 > http [ACK] Seq=96 Ack=851727 Win=708736 Len=0 TSval=15035606 TSecr=732292772
148   0.096887 54.230.158.217 -> 172.31.29.138 TCP 10202 [TCP segment of a reassembled PDU]
149   0.096896 172.31.29.138 -> 54.230.158.217 TCP 66 42237 > http [ACK] Seq=96 Ack=861863 Win=749312 Len=0 TSval=15035608 TSecr=732292773
150   0.097054 54.230.158.217 -> 172.31.29.138 TCP 17442 [TCP segment of a reassembled PDU]
151   0.097087 172.31.29.138 -> 54.230.158.217 TCP 66 42237 > http [ACK] Seq=96 Ack=879239 Win=737280 Len=0 TSval=15035608 TSecr=732292773
152   0.097107 54.230.158.217 -> 172.31.29.138 TCP 4410 [TCP segment of a reassembled PDU]
153   0.097115 172.31.29.138 -> 54.230.158.217 TCP 66 42237 > http [ACK] Seq=96 Ack=883583 Win=758784 Len=0 TSval=15035608 TSecr=732292773
154   0.097231 54.230.158.217 -> 172.31.29.138 TCP 33746 [TCP segment of a reassembled PDU]
155   0.097263 172.31.29.138 -> 54.230.158.217 TCP 66 42237 > http [ACK] Seq=96 Ack=917263 Win=725120 Len=0 TSval=15035608 TSecr=732292773
156   0.104778 54.230.158.217 -> 172.31.29.138 TCP 8754 [TCP segment of a reassembled PDU]
157   0.104787 172.31.29.138 -> 54.230.158.217 TCP 66 42237 > http [ACK] Seq=96 Ack=925951 Win=751616 Len=0 TSval=15035610 TSecr=732292774
158   0.104965 54.230.158.217 -> 172.31.29.138 TCP 26130 [TCP segment of a reassembled PDU]
159   0.104991 172.31.29.138 -> 54.230.158.217 TCP 66 42237 > http [ACK] Seq=96 Ack=952015 Win=725632 Len=0 TSval=15035610 TSecr=732292774
160   0.105064 54.230.158.217 -> 172.31.29.138 TCP 26130 [TCP segment of a reassembled PDU]
161   0.105092 54.230.158.217 -> 172.31.29.138 TCP 4785 [TCP segment of a reassembled PDU]
162   0.105096 54.230.158.217 -> 172.31.29.138 TCP 67 [TCP segment of a reassembled PDU]
163   0.105104 172.31.29.138 -> 54.230.158.217 TCP 66 42237 > http [ACK] Seq=96 Ack=982799 Win=711168 Len=0 TSval=15035610 TSecr=732292774
164   0.113751 54.230.158.217 -> 172.31.29.138 TCP 7306 [TCP segment of a reassembled PDU]
165   0.113761 172.31.29.138 -> 54.230.158.217 TCP 66 42237 > http [ACK] Seq=96 Ack=990039 Win=754048 Len=0 TSval=15035612 TSecr=732292775
166   0.113926 54.230.158.217 -> 172.31.29.138 TCP 26130 [TCP segment of a reassembled PDU]
167   0.113941 54.230.158.217 -> 172.31.29.138 TCP 2962 [TCP segment of a reassembled PDU]
168   0.113945 54.230.158.217 -> 172.31.29.138 TCP 2962 [TCP segment of a reassembled PDU]
169   0.113962 172.31.29.138 -> 54.230.158.217 TCP 66 42237 > http [ACK] Seq=96 Ack=1021895 Win=722304 Len=0 TSval=15035612 TSecr=732292775
170   0.114507 54.230.158.217 -> 172.31.29.138 TCP 1514 [TCP segment of a reassembled PDU]
171   0.114512 172.31.29.138 -> 54.230.158.217 TCP 66 42237 > http [ACK] Seq=96 Ack=1023343 Win=763520 Len=0 TSval=15035613 TSecr=732292775
172   0.114858 54.230.158.217 -> 172.31.29.138 HTTP 25757 HTTP/1.1 200 OK  (application/octet-stream)
173   0.114885 172.31.29.138 -> 54.230.158.217 TCP 66 42237 > http [ACK] Seq=96 Ack=1049034 Win=737920 Len=0 TSval=15035613 TSecr=732292775
174   0.115028 172.31.29.138 -> 54.230.158.217 TCP 66 42237 > http [FIN, ACK] Seq=96 Ack=1049034 Win=764672 Len=0 TSval=15035613 TSecr=732292775
175   0.115714 54.230.158.217 -> 172.31.29.138 TCP 66 http > 42237 [FIN, ACK] Seq=1049034 Ack=97 Win=14592 Len=0 TSval=732292775 TSecr=15035613
176   0.115723 172.31.29.138 -> 54.230.158.217 TCP 66 42237 > http [ACK] Seq=97 Ack=1049035 Win=764672 Len=0 TSval=15035613 TSecr=732292775
