[Measurement for 1mb at 04:37:49 20.37.2014] 
Tshark:

  1   0.000000 172.31.29.138 -> 172.31.0.2   DNS 88 Standard query 0x99d4  A dm53kc3eax57k.cloudfront.net
  2   0.000027 172.31.29.138 -> 172.31.0.2   DNS 88 Standard query 0x5da9  AAAA dm53kc3eax57k.cloudfront.net
  3   0.000594   172.31.0.2 -> 172.31.29.138 DNS 216 Standard query response 0x99d4  A 54.230.150.36 A 54.230.150.155 A 54.230.150.156 A 54.230.150.159 A 54.230.151.214 A 54.230.149.217 A 54.230.149.231 A 54.230.150.31
  4   0.000660   172.31.0.2 -> 172.31.29.138 DNS 175 Standard query response 0x5da9 
  5   0.003858 172.31.29.138 -> 54.230.150.36 TCP 74 33476 > http [SYN] Seq=0 Win=26883 Len=0 MSS=8961 SACK_PERM=1 TSval=10535617 TSecr=0 WS=128
  6   0.005387 54.230.150.36 -> 172.31.29.138 TCP 74 http > 33476 [SYN, ACK] Seq=0 Ack=1 Win=14480 Len=0 MSS=1460 SACK_PERM=1 TSval=445556710 TSecr=10535617 WS=128
  7   0.005402 172.31.29.138 -> 54.230.150.36 TCP 66 33476 > http [ACK] Seq=1 Ack=1 Win=27008 Len=0 TSval=10535617 TSecr=445556710
  8   0.005448 172.31.29.138 -> 54.230.150.36 HTTP 161 GET /1mb HTTP/1.1 
  9   0.006932 54.230.150.36 -> 172.31.29.138 TCP 66 http > 33476 [ACK] Seq=1 Ack=96 Win=14592 Len=0 TSval=445556711 TSecr=10535617
 10   0.009309 54.230.150.36 -> 172.31.29.138 TCP 523 [TCP segment of a reassembled PDU]
 11   0.009318 172.31.29.138 -> 54.230.150.36 TCP 66 33476 > http [ACK] Seq=96 Ack=458 Win=28032 Len=0 TSval=10535618 TSecr=445556711
 12   0.009355 54.230.150.36 -> 172.31.29.138 TCP 13098 [TCP segment of a reassembled PDU]
 13   0.009363 172.31.29.138 -> 54.230.150.36 TCP 66 33476 > http [ACK] Seq=96 Ack=13490 Win=54144 Len=0 TSval=10535618 TSecr=445556711
 14   0.010855 54.230.150.36 -> 172.31.29.138 TCP 13098 [TCP segment of a reassembled PDU]
 15   0.010865 172.31.29.138 -> 54.230.150.36 TCP 66 33476 > http [ACK] Seq=96 Ack=26522 Win=80128 Len=0 TSval=10535619 TSecr=445556711
 16   0.012419 54.230.150.36 -> 172.31.29.138 TCP 13098 [TCP segment of a reassembled PDU]
 17   0.012430 172.31.29.138 -> 54.230.150.36 TCP 66 33476 > http [ACK] Seq=96 Ack=39554 Win=96512 Len=0 TSval=10535619 TSecr=445556711
 18   0.013874 54.230.150.36 -> 172.31.29.138 TCP 10202 [TCP segment of a reassembled PDU]
 19   0.013882 172.31.29.138 -> 54.230.150.36 TCP 66 33476 > http [ACK] Seq=96 Ack=49690 Win=101248 Len=0 TSval=10535619 TSecr=445556711
 20   0.013918 54.230.150.36 -> 172.31.29.138 TCP 10202 [TCP segment of a reassembled PDU]
 21   0.013926 172.31.29.138 -> 54.230.150.36 TCP 66 33476 > http [ACK] Seq=96 Ack=59826 Win=101248 Len=0 TSval=10535619 TSecr=445556711
 22   0.015397 54.230.150.36 -> 172.31.29.138 TCP 5858 [TCP segment of a reassembled PDU]
 23   0.015406 172.31.29.138 -> 54.230.150.36 TCP 66 33476 > http [ACK] Seq=96 Ack=65618 Win=108416 Len=0 TSval=10535620 TSecr=445556711
 24   0.015460 54.230.150.36 -> 172.31.29.138 TCP 13098 [TCP segment of a reassembled PDU]
 25   0.015470 172.31.29.138 -> 54.230.150.36 TCP 66 33476 > http [ACK] Seq=96 Ack=78650 Win=135168 Len=0 TSval=10535620 TSecr=445556711
 26   0.016925 54.230.150.36 -> 172.31.29.138 TCP 4410 [TCP segment of a reassembled PDU]
 27   0.016932 172.31.29.138 -> 54.230.150.36 TCP 66 33476 > http [ACK] Seq=96 Ack=82994 Win=143872 Len=0 TSval=10535620 TSecr=445556712
 28   0.017011 54.230.150.36 -> 172.31.29.138 TCP 11650 [TCP segment of a reassembled PDU]
 29   0.017020 172.31.29.138 -> 54.230.150.36 TCP 66 33476 > http [ACK] Seq=96 Ack=94578 Win=167040 Len=0 TSval=10535620 TSecr=445556712
 30   0.017050 54.230.150.36 -> 172.31.29.138 TCP 10202 [TCP segment of a reassembled PDU]
 31   0.017060 172.31.29.138 -> 54.230.150.36 TCP 66 33476 > http [ACK] Seq=96 Ack=104714 Win=187264 Len=0 TSval=10535620 TSecr=445556712
 32   0.018496 54.230.150.36 -> 172.31.29.138 TCP 4410 [TCP segment of a reassembled PDU]
 33   0.018502 172.31.29.138 -> 54.230.150.36 TCP 66 33476 > http [ACK] Seq=96 Ack=109058 Win=195968 Len=0 TSval=10535621 TSecr=445556712
 34   0.018636 54.230.150.36 -> 172.31.29.138 TCP 21786 [TCP segment of a reassembled PDU]
 35   0.018661 172.31.29.138 -> 54.230.150.36 TCP 66 33476 > http [ACK] Seq=96 Ack=130778 Win=239360 Len=0 TSval=10535621 TSecr=445556712
 36   0.020307 54.230.150.36 -> 172.31.29.138 TCP 11650 [TCP segment of a reassembled PDU]
 37   0.020330 172.31.29.138 -> 54.230.150.36 TCP 66 33476 > http [ACK] Seq=96 Ack=142362 Win=262528 Len=0 TSval=10535621 TSecr=445556712
 38   0.020435 54.230.150.36 -> 172.31.29.138 TCP 14546 [TCP segment of a reassembled PDU]
 39   0.020445 172.31.29.138 -> 54.230.150.36 TCP 66 33476 > http [ACK] Seq=96 Ack=156842 Win=291456 Len=0 TSval=10535621 TSecr=445556712
 40   0.021836 54.230.150.36 -> 172.31.29.138 TCP 7306 [TCP segment of a reassembled PDU]
 41   0.021844 172.31.29.138 -> 54.230.150.36 TCP 66 33476 > http [ACK] Seq=96 Ack=164082 Win=306048 Len=0 TSval=10535621 TSecr=445556712
 42   0.021956 54.230.150.36 -> 172.31.29.138 TCP 18890 [TCP segment of a reassembled PDU]
 43   0.021967 172.31.29.138 -> 54.230.150.36 TCP 66 33476 > http [ACK] Seq=96 Ack=182906 Win=302464 Len=0 TSval=10535621 TSecr=445556712
 44   0.023397 54.230.150.36 -> 172.31.29.138 TCP 17442 [TCP segment of a reassembled PDU]
 45   0.023408 172.31.29.138 -> 54.230.150.36 TCP 66 33476 > http [ACK] Seq=96 Ack=200282 Win=304768 Len=0 TSval=10535622 TSecr=445556712
 46   0.023661 54.230.150.36 -> 172.31.29.138 TCP 8754 [TCP segment of a reassembled PDU]
 47   0.023668 172.31.29.138 -> 54.230.150.36 TCP 66 33476 > http [ACK] Seq=96 Ack=208970 Win=323328 Len=0 TSval=10535622 TSecr=445556712
 48   0.024867 54.230.150.36 -> 172.31.29.138 TCP 5858 [TCP segment of a reassembled PDU]
 49   0.024874 172.31.29.138 -> 54.230.150.36 TCP 66 33476 > http [ACK] Seq=96 Ack=214762 Win=334976 Len=0 TSval=10535622 TSecr=445556712
 50   0.025033 54.230.150.36 -> 172.31.29.138 TCP 24682 [TCP segment of a reassembled PDU]
 51   0.025047 172.31.29.138 -> 54.230.150.36 TCP 66 33476 > http [ACK] Seq=96 Ack=239378 Win=384128 Len=0 TSval=10535622 TSecr=445556712
 52   0.026501 54.230.150.36 -> 172.31.29.138 TCP 17442 [TCP segment of a reassembled PDU]
 53   0.026512 172.31.29.138 -> 54.230.150.36 TCP 66 33476 > http [ACK] Seq=96 Ack=256754 Win=418944 Len=0 TSval=10535623 TSecr=445556712
 54   0.026674 54.230.150.36 -> 172.31.29.138 TCP 26130 [TCP segment of a reassembled PDU]
 55   0.026697 172.31.29.138 -> 54.230.150.36 TCP 66 33476 > http [ACK] Seq=96 Ack=282818 Win=471040 Len=0 TSval=10535623 TSecr=445556712
 56   0.027980 54.230.150.36 -> 172.31.29.138 TCP 5858 [TCP segment of a reassembled PDU]
 57   0.027987 172.31.29.138 -> 54.230.150.36 TCP 66 33476 > http [ACK] Seq=96 Ack=288610 Win=482688 Len=0 TSval=10535623 TSecr=445556713
 58   0.028178 54.230.150.36 -> 172.31.29.138 TCP 26130 [TCP segment of a reassembled PDU]
 59   0.028192 172.31.29.138 -> 54.230.150.36 TCP 66 33476 > http [ACK] Seq=96 Ack=314674 Win=534784 Len=0 TSval=10535623 TSecr=445556713
 60   0.028218 54.230.150.36 -> 172.31.29.138 TCP 14546 [TCP segment of a reassembled PDU]
 61   0.028227 172.31.29.138 -> 54.230.150.36 TCP 66 33476 > http [ACK] Seq=96 Ack=329154 Win=563712 Len=0 TSval=10535623 TSecr=445556713
 62   0.029792 54.230.150.36 -> 172.31.29.138 TCP 11650 [TCP segment of a reassembled PDU]
 63   0.029801 172.31.29.138 -> 54.230.150.36 TCP 66 33476 > http [ACK] Seq=96 Ack=340738 Win=586880 Len=0 TSval=10535623 TSecr=445556713
 64   0.029966 54.230.150.36 -> 172.31.29.138 TCP 26130 [TCP segment of a reassembled PDU]
 65   0.029980 172.31.29.138 -> 54.230.150.36 TCP 66 33476 > http [ACK] Seq=96 Ack=366802 Win=605952 Len=0 TSval=10535623 TSecr=445556713
 66   0.030006 54.230.150.36 -> 172.31.29.138 TCP 13098 [TCP segment of a reassembled PDU]
 67   0.030013 172.31.29.138 -> 54.230.150.36 TCP 66 33476 > http [ACK] Seq=96 Ack=379834 Win=593024 Len=0 TSval=10535623 TSecr=445556713
 68   0.031619 54.230.150.36 -> 172.31.29.138 TCP 11650 [TCP segment of a reassembled PDU]
 69   0.031628 172.31.29.138 -> 54.230.150.36 TCP 66 33476 > http [ACK] Seq=96 Ack=391418 Win=629760 Len=0 TSval=10535624 TSecr=445556713
 70   0.031786 54.230.150.36 -> 172.31.29.138 TCP 26130 [TCP segment of a reassembled PDU]
 71   0.031810 172.31.29.138 -> 54.230.150.36 TCP 66 33476 > http [ACK] Seq=96 Ack=417482 Win=691200 Len=0 TSval=10535624 TSecr=445556713
 72   0.031819 54.230.150.36 -> 172.31.29.138 TCP 4410 [TCP segment of a reassembled PDU]
 73   0.031823 172.31.29.138 -> 54.230.150.36 TCP 66 33476 > http [ACK] Seq=96 Ack=421826 Win=699904 Len=0 TSval=10535624 TSecr=445556713
 74   0.033095 54.230.150.36 -> 172.31.29.138 TCP 7306 [TCP segment of a reassembled PDU]
 75   0.033102 172.31.29.138 -> 54.230.150.36 TCP 66 33476 > http [ACK] Seq=96 Ack=429066 Win=714368 Len=0 TSval=10535624 TSecr=445556713
 76   0.033269 54.230.150.36 -> 172.31.29.138 TCP 18890 [TCP segment of a reassembled PDU]
 77   0.033280 172.31.29.138 -> 54.230.150.36 TCP 66 33476 > http [ACK] Seq=96 Ack=447890 Win=752000 Len=0 TSval=10535624 TSecr=445556713
 78   0.033317 54.230.150.36 -> 172.31.29.138 TCP 4410 [TCP segment of a reassembled PDU]
 79   0.033322 172.31.29.138 -> 54.230.150.36 TCP 66 33476 > http [ACK] Seq=96 Ack=452234 Win=760704 Len=0 TSval=10535624 TSecr=445556713
 80   0.033494 54.230.150.36 -> 172.31.29.138 TCP 23234 [TCP segment of a reassembled PDU]
 81   0.033506 172.31.29.138 -> 54.230.150.36 TCP 66 33476 > http [ACK] Seq=96 Ack=475402 Win=790912 Len=0 TSval=10535624 TSecr=445556713
 82   0.034614 54.230.150.36 -> 172.31.29.138 TCP 4410 [TCP segment of a reassembled PDU]
 83   0.034620 172.31.29.138 -> 54.230.150.36 TCP 66 33476 > http [ACK] Seq=96 Ack=479746 Win=815744 Len=0 TSval=10535625 TSecr=445556713
 84   0.034754 54.230.150.36 -> 172.31.29.138 TCP 17442 [TCP segment of a reassembled PDU]
 85   0.034764 172.31.29.138 -> 54.230.150.36 TCP 66 33476 > http [ACK] Seq=96 Ack=497122 Win=800384 Len=0 TSval=10535625 TSecr=445556713
 86   0.034772 54.230.150.36 -> 172.31.29.138 TCP 1514 [TCP Previous segment not captured] [TCP segment of a reassembled PDU]
 87   0.034775 172.31.29.138 -> 54.230.150.36 TCP 78 [TCP Dup ACK 85#1] 33476 > http [ACK] Seq=96 Ack=497122 Win=800384 Len=0 TSval=10535625 TSecr=445556713 SLE=498570 SRE=500018
 88   0.034777 54.230.150.36 -> 172.31.29.138 TCP 1514 [TCP Out-Of-Order] [TCP segment of a reassembled PDU]
 89   0.034779 172.31.29.138 -> 54.230.150.36 TCP 66 33476 > http [ACK] Seq=96 Ack=500018 Win=797568 Len=0 TSval=10535625 TSecr=445556713
 90   0.034861 54.230.150.36 -> 172.31.29.138 TCP 10202 [TCP segment of a reassembled PDU]
 91   0.034881 172.31.29.138 -> 54.230.150.36 TCP 66 33476 > http [ACK] Seq=96 Ack=510154 Win=812288 Len=0 TSval=10535625 TSecr=445556713
 92   0.034946 54.230.150.36 -> 172.31.29.138 TCP 24682 [TCP segment of a reassembled PDU]
 93   0.034959 172.31.29.138 -> 54.230.150.36 TCP 66 33476 > http [ACK] Seq=96 Ack=534770 Win=788480 Len=0 TSval=10535625 TSecr=445556713
 94   0.035023 54.230.150.36 -> 172.31.29.138 TCP 5858 [TCP segment of a reassembled PDU]
 95   0.035029 172.31.29.138 -> 54.230.150.36 TCP 66 33476 > http [ACK] Seq=96 Ack=540562 Win=819456 Len=0 TSval=10535625 TSecr=445556713
 96   0.036383 54.230.150.36 -> 172.31.29.138 TCP 2962 [TCP segment of a reassembled PDU]
 97   0.036389 172.31.29.138 -> 54.230.150.36 TCP 66 33476 > http [ACK] Seq=96 Ack=543458 Win=824192 Len=0 TSval=10535625 TSecr=445556713
 98   0.036518 54.230.150.36 -> 172.31.29.138 TCP 8754 [TCP segment of a reassembled PDU]
 99   0.036524 172.31.29.138 -> 54.230.150.36 TCP 66 33476 > http [ACK] Seq=96 Ack=552146 Win=815616 Len=0 TSval=10535625 TSecr=445556713
100   0.036634 54.230.150.36 -> 172.31.29.138 TCP 26130 [TCP segment of a reassembled PDU]
101   0.036647 172.31.29.138 -> 54.230.150.36 TCP 66 33476 > http [ACK] Seq=96 Ack=578210 Win=789632 Len=0 TSval=10535625 TSecr=445556713
102   0.036663 54.230.150.36 -> 172.31.29.138 TCP 18890 [TCP segment of a reassembled PDU]
103   0.036675 172.31.29.138 -> 54.230.150.36 TCP 66 33476 > http [ACK] Seq=96 Ack=597034 Win=770816 Len=0 TSval=10535625 TSecr=445556713
104   0.038021 54.230.150.36 -> 172.31.29.138 TCP 14546 [TCP segment of a reassembled PDU]
105   0.038031 172.31.29.138 -> 54.230.150.36 TCP 66 33476 > http [ACK] Seq=96 Ack=611514 Win=805120 Len=0 TSval=10535625 TSecr=445556714
106   0.038193 54.230.150.36 -> 172.31.29.138 TCP 26130 [TCP segment of a reassembled PDU]
107   0.038207 172.31.29.138 -> 54.230.150.36 TCP 66 33476 > http [ACK] Seq=96 Ack=637578 Win=786176 Len=0 TSval=10535625 TSecr=445556714
108   0.038217 54.230.150.36 -> 172.31.29.138 TCP 8754 [TCP segment of a reassembled PDU]
109   0.038222 172.31.29.138 -> 54.230.150.36 TCP 66 33476 > http [ACK] Seq=96 Ack=646266 Win=777600 Len=0 TSval=10535625 TSecr=445556714
110   0.039476 54.230.150.36 -> 172.31.29.138 TCP 4410 [TCP segment of a reassembled PDU]
111   0.039481 172.31.29.138 -> 54.230.150.36 TCP 66 33476 > http [ACK] Seq=96 Ack=650610 Win=821760 Len=0 TSval=10535626 TSecr=445556714
112   0.039682 54.230.150.36 -> 172.31.29.138 TCP 23234 [TCP segment of a reassembled PDU]
113   0.039694 172.31.29.138 -> 54.230.150.36 TCP 66 33476 > http [ACK] Seq=96 Ack=673778 Win=798592 Len=0 TSval=10535626 TSecr=445556714
114   0.039701 54.230.150.36 -> 172.31.29.138 TCP 2962 [TCP segment of a reassembled PDU]
115   0.039707 172.31.29.138 -> 54.230.150.36 TCP 66 33476 > http [ACK] Seq=96 Ack=676674 Win=795776 Len=0 TSval=10535626 TSecr=445556714
116   0.039758 54.230.150.36 -> 172.31.29.138 TCP 5858 [TCP segment of a reassembled PDU]
117   0.039765 172.31.29.138 -> 54.230.150.36 TCP 66 33476 > http [ACK] Seq=96 Ack=682466 Win=819456 Len=0 TSval=10535626 TSecr=445556714
118   0.040070 54.230.150.36 -> 172.31.29.138 TCP 27578 [TCP segment of a reassembled PDU]
119   0.040084 172.31.29.138 -> 54.230.150.36 TCP 66 33476 > http [ACK] Seq=96 Ack=709978 Win=792064 Len=0 TSval=10535626 TSecr=445556714
120   0.040980 54.230.150.36 -> 172.31.29.138 TCP 4410 [TCP segment of a reassembled PDU]
121   0.040987 172.31.29.138 -> 54.230.150.36 TCP 66 33476 > http [ACK] Seq=96 Ack=714322 Win=821760 Len=0 TSval=10535626 TSecr=445556714
122   0.041161 54.230.150.36 -> 172.31.29.138 TCP 21786 [TCP segment of a reassembled PDU]
123   0.041185 54.230.150.36 -> 172.31.29.138 TCP 4410 [TCP segment of a reassembled PDU]
124   0.041190 54.230.150.36 -> 172.31.29.138 TCP 1514 [TCP segment of a reassembled PDU]
125   0.041197 54.230.150.36 -> 172.31.29.138 TCP 5858 [TCP segment of a reassembled PDU]
126   0.041206 172.31.29.138 -> 54.230.150.36 TCP 66 33476 > http [ACK] Seq=96 Ack=747626 Win=788480 Len=0 TSval=10535626 TSecr=445556714
127   0.041498 54.230.150.36 -> 172.31.29.138 TCP 2962 [TCP segment of a reassembled PDU]
128   0.041504 172.31.29.138 -> 54.230.150.36 TCP 66 33476 > http [ACK] Seq=96 Ack=750522 Win=824192 Len=0 TSval=10535626 TSecr=445556714
129   0.041705 54.230.150.36 -> 172.31.29.138 TCP 26130 [TCP segment of a reassembled PDU]
130   0.041727 54.230.150.36 -> 172.31.29.138 TCP 14546 [TCP segment of a reassembled PDU]
131   0.041746 172.31.29.138 -> 54.230.150.36 TCP 66 33476 > http [ACK] Seq=96 Ack=791066 Win=783744 Len=0 TSval=10535626 TSecr=445556714
132   0.042574 54.230.150.36 -> 172.31.29.138 TCP 11650 [TCP segment of a reassembled PDU]
133   0.042582 172.31.29.138 -> 54.230.150.36 TCP 66 33476 > http [ACK] Seq=96 Ack=802650 Win=809984 Len=0 TSval=10535627 TSecr=445556714
134   0.042691 54.230.150.36 -> 172.31.29.138 TCP 10202 [TCP segment of a reassembled PDU]
135   0.042699 172.31.29.138 -> 54.230.150.36 TCP 66 33476 > http [ACK] Seq=96 Ack=812786 Win=812288 Len=0 TSval=10535627 TSecr=445556714
136   0.043033 54.230.150.36 -> 172.31.29.138 TCP 7306 [TCP segment of a reassembled PDU]
137   0.043041 172.31.29.138 -> 54.230.150.36 TCP 66 33476 > http [ACK] Seq=96 Ack=820026 Win=817024 Len=0 TSval=10535627 TSecr=445556714
138   0.043206 54.230.150.36 -> 172.31.29.138 TCP 26130 [TCP segment of a reassembled PDU]
139   0.043224 54.230.150.36 -> 172.31.29.138 TCP 7306 [TCP segment of a reassembled PDU]
140   0.043241 172.31.29.138 -> 54.230.150.36 TCP 66 33476 > http [ACK] Seq=96 Ack=853330 Win=783744 Len=0 TSval=10535627 TSecr=445556714
141   0.043267 54.230.150.36 -> 172.31.29.138 TCP 18890 [TCP segment of a reassembled PDU]
142   0.043283 172.31.29.138 -> 54.230.150.36 TCP 66 33476 > http [ACK] Seq=96 Ack=872154 Win=786048 Len=0 TSval=10535627 TSecr=445556714
143   0.043302 54.230.150.36 -> 172.31.29.138 TCP 5858 [TCP segment of a reassembled PDU]
144   0.043323 172.31.29.138 -> 54.230.150.36 TCP 66 33476 > http [ACK] Seq=96 Ack=877946 Win=788352 Len=0 TSval=10535627 TSecr=445556714
145   0.044311 54.230.150.36 -> 172.31.29.138 TCP 4410 [TCP segment of a reassembled PDU]
146   0.044317 172.31.29.138 -> 54.230.150.36 TCP 66 33476 > http [ACK] Seq=96 Ack=882290 Win=821760 Len=0 TSval=10535627 TSecr=445556714
147   0.044521 54.230.150.36 -> 172.31.29.138 TCP 26130 [TCP segment of a reassembled PDU]
148   0.044547 172.31.29.138 -> 54.230.150.36 TCP 66 33476 > http [ACK] Seq=96 Ack=908354 Win=795776 Len=0 TSval=10535627 TSecr=445556714
149   0.044573 54.230.150.36 -> 172.31.29.138 TCP 2962 [TCP segment of a reassembled PDU]
150   0.044578 172.31.29.138 -> 54.230.150.36 TCP 66 33476 > http [ACK] Seq=96 Ack=911250 Win=824192 Len=0 TSval=10535627 TSecr=445556714
151   0.044636 54.230.150.36 -> 172.31.29.138 TCP 14546 [TCP segment of a reassembled PDU]
152   0.044658 172.31.29.138 -> 54.230.150.36 TCP 66 33476 > http [ACK] Seq=96 Ack=925730 Win=827264 Len=0 TSval=10535627 TSecr=445556714
153   0.044754 54.230.150.36 -> 172.31.29.138 TCP 17442 [TCP segment of a reassembled PDU]
