[Measurement for 1mb at 08:37:49 20.37.2014] 
Tshark:

  1   0.000000 172.31.29.138 -> 172.31.0.2   DNS 88 Standard query 0xf79b  A dm53kc3eax57k.cloudfront.net
  2   0.000028 172.31.29.138 -> 172.31.0.2   DNS 88 Standard query 0xc929  AAAA dm53kc3eax57k.cloudfront.net
  3   0.000578   172.31.0.2 -> 172.31.29.138 DNS 175 Standard query response 0xc929 
  4   0.000590   172.31.0.2 -> 172.31.29.138 DNS 216 Standard query response 0xf79b  A 54.230.159.141 A 54.230.159.143 A 54.192.157.146 A 54.192.159.75 A 54.192.159.107 A 54.192.159.164 A 54.230.158.188 A 54.230.158.223
  5   0.003866 172.31.29.138 -> 54.230.159.141 TCP 74 59936 > http [SYN] Seq=0 Win=26883 Len=0 MSS=8961 SACK_PERM=1 TSval=14135504 TSecr=0 WS=128
  6   0.004555 54.230.159.141 -> 172.31.29.138 TCP 74 http > 59936 [SYN, ACK] Seq=0 Ack=1 Win=14480 Len=0 MSS=1460 SACK_PERM=1 TSval=837229825 TSecr=14135504 WS=128
  7   0.004569 172.31.29.138 -> 54.230.159.141 TCP 66 59936 > http [ACK] Seq=1 Ack=1 Win=27008 Len=0 TSval=14135504 TSecr=837229825
  8   0.004625 172.31.29.138 -> 54.230.159.141 HTTP 161 GET /1mb HTTP/1.1 
  9   0.005273 54.230.159.141 -> 172.31.29.138 TCP 66 http > 59936 [ACK] Seq=1 Ack=96 Win=14592 Len=0 TSval=837229825 TSecr=14135504
 10   0.010766 54.230.159.141 -> 172.31.29.138 TCP 5476 [TCP segment of a reassembled PDU]
 11   0.010777 172.31.29.138 -> 54.230.159.141 TCP 66 59936 > http [ACK] Seq=96 Ack=5411 Win=37760 Len=0 TSval=14135506 TSecr=837229825
 12   0.010791 54.230.159.141 -> 172.31.29.138 TCP 8754 [TCP segment of a reassembled PDU]
 13   0.010796 172.31.29.138 -> 54.230.159.141 TCP 66 59936 > http [ACK] Seq=96 Ack=14099 Win=55168 Len=0 TSval=14135506 TSecr=837229825
 14   0.011285 54.230.159.141 -> 172.31.29.138 TCP 13098 [TCP segment of a reassembled PDU]
 15   0.011295 172.31.29.138 -> 54.230.159.141 TCP 66 59936 > http [ACK] Seq=96 Ack=27131 Win=81152 Len=0 TSval=14135506 TSecr=837229825
 16   0.011809 54.230.159.141 -> 172.31.29.138 TCP 13098 [TCP segment of a reassembled PDU]
 17   0.011839 172.31.29.138 -> 54.230.159.141 TCP 66 59936 > http [ACK] Seq=96 Ack=40163 Win=96512 Len=0 TSval=14135506 TSecr=837229825
 18   0.012356 54.230.159.141 -> 172.31.29.138 TCP 5858 [TCP segment of a reassembled PDU]
 19   0.012383 172.31.29.138 -> 54.230.159.141 TCP 66 59936 > http [ACK] Seq=96 Ack=45955 Win=108416 Len=0 TSval=14135506 TSecr=837229825
 20   0.012394 54.230.159.141 -> 172.31.29.138 TCP 7306 [TCP segment of a reassembled PDU]
 21   0.012398 172.31.29.138 -> 54.230.159.141 TCP 66 59936 > http [ACK] Seq=96 Ack=53195 Win=101248 Len=0 TSval=14135506 TSecr=837229825
 22   0.012407 54.230.159.141 -> 172.31.29.138 TCP 7306 [TCP segment of a reassembled PDU]
 23   0.012412 172.31.29.138 -> 54.230.159.141 TCP 66 59936 > http [ACK] Seq=96 Ack=60435 Win=94080 Len=0 TSval=14135506 TSecr=837229825
 24   0.013051 54.230.159.141 -> 172.31.29.138 TCP 4926 [TCP segment of a reassembled PDU]
 25   0.013065 172.31.29.138 -> 54.230.159.141 TCP 66 59936 > http [ACK] Seq=96 Ack=65295 Win=108416 Len=0 TSval=14135506 TSecr=837229825
 26   0.013427 54.230.159.141 -> 172.31.29.138 TCP 4410 [TCP segment of a reassembled PDU]
 27   0.013440 172.31.29.138 -> 54.230.159.141 TCP 66 59936 > http [ACK] Seq=96 Ack=69639 Win=109056 Len=0 TSval=14135506 TSecr=837229825
 28   0.013463 54.230.159.141 -> 172.31.29.138 TCP 4410 [TCP segment of a reassembled PDU]
 29   0.013467 172.31.29.138 -> 54.230.159.141 TCP 66 59936 > http [ACK] Seq=96 Ack=73983 Win=104832 Len=0 TSval=14135506 TSecr=837229825
 30   0.013468 54.230.159.141 -> 172.31.29.138 TCP 1514 [TCP Previous segment not captured] [TCP segment of a reassembled PDU]
 31   0.013471 172.31.29.138 -> 54.230.159.141 TCP 78 [TCP Dup ACK 29#1] 59936 > http [ACK] Seq=96 Ack=73983 Win=104832 Len=0 TSval=14135506 TSecr=837229825 SLE=75431 SRE=76879
 32   0.013472 54.230.159.141 -> 172.31.29.138 TCP 1514 [TCP Out-Of-Order] [TCP segment of a reassembled PDU]
 33   0.013474 172.31.29.138 -> 54.230.159.141 TCP 66 59936 > http [ACK] Seq=96 Ack=76879 Win=102016 Len=0 TSval=14135506 TSecr=837229825
 34   0.013482 54.230.159.141 -> 172.31.29.138 TCP 5858 [TCP segment of a reassembled PDU]
 35   0.013486 172.31.29.138 -> 54.230.159.141 TCP 66 59936 > http [ACK] Seq=96 Ack=82671 Win=96256 Len=0 TSval=14135506 TSecr=837229825
 36   0.014049 54.230.159.141 -> 172.31.29.138 TCP 4410 [TCP segment of a reassembled PDU]
 37   0.014075 172.31.29.138 -> 54.230.159.141 TCP 66 59936 > http [ACK] Seq=96 Ack=87015 Win=109056 Len=0 TSval=14135507 TSecr=837229825
 38   0.014130 54.230.159.141 -> 172.31.29.138 TCP 13098 [TCP segment of a reassembled PDU]
 39   0.014139 172.31.29.138 -> 54.230.159.141 TCP 66 59936 > http [ACK] Seq=96 Ack=100047 Win=135168 Len=0 TSval=14135507 TSecr=837229825
 40   0.014285 54.230.159.141 -> 172.31.29.138 TCP 1514 [TCP segment of a reassembled PDU]
 41   0.014296 172.31.29.138 -> 54.230.159.141 TCP 66 59936 > http [ACK] Seq=96 Ack=101495 Win=137984 Len=0 TSval=14135507 TSecr=837229825
 42   0.014397 54.230.159.141 -> 172.31.29.138 TCP 8754 [TCP segment of a reassembled PDU]
 43   0.014405 172.31.29.138 -> 54.230.159.141 TCP 66 59936 > http [ACK] Seq=96 Ack=110183 Win=155392 Len=0 TSval=14135507 TSecr=837229825
 44   0.014813 54.230.159.141 -> 172.31.29.138 TCP 4410 [TCP segment of a reassembled PDU]
 45   0.014839 172.31.29.138 -> 54.230.159.141 TCP 66 59936 > http [ACK] Seq=96 Ack=114527 Win=164096 Len=0 TSval=14135507 TSecr=837229826
 46   0.014966 54.230.159.141 -> 172.31.29.138 TCP 16370 [TCP segment of a reassembled PDU]
 47   0.014976 172.31.29.138 -> 54.230.159.141 TCP 66 59936 > http [ACK] Seq=96 Ack=130831 Win=196736 Len=0 TSval=14135507 TSecr=837229826
 48   0.015684 54.230.159.141 -> 172.31.29.138 TCP 1514 [TCP segment of a reassembled PDU]
 49   0.015690 172.31.29.138 -> 54.230.159.141 TCP 66 59936 > http [ACK] Seq=96 Ack=132279 Win=199552 Len=0 TSval=14135507 TSecr=837229826
 50   0.015711 54.230.159.141 -> 172.31.29.138 TCP 31922 [TCP segment of a reassembled PDU]
 51   0.015728 172.31.29.138 -> 54.230.159.141 TCP 66 59936 > http [ACK] Seq=96 Ack=164135 Win=263296 Len=0 TSval=14135507 TSecr=837229826
 52   0.016588 54.230.159.141 -> 172.31.29.138 TCP 1514 [TCP segment of a reassembled PDU]
 53   0.016593 172.31.29.138 -> 54.230.159.141 TCP 66 59936 > http [ACK] Seq=96 Ack=165583 Win=266240 Len=0 TSval=14135507 TSecr=837229826
 54   0.016847 54.230.159.141 -> 172.31.29.138 TCP 27578 [TCP segment of a reassembled PDU]
 55   0.016861 172.31.29.138 -> 54.230.159.141 TCP 66 59936 > http [ACK] Seq=96 Ack=193095 Win=321280 Len=0 TSval=14135507 TSecr=837229826
 56   0.016878 54.230.159.141 -> 172.31.29.138 TCP 3338 [TCP segment of a reassembled PDU]
 57   0.016882 172.31.29.138 -> 54.230.159.141 TCP 66 59936 > http [ACK] Seq=96 Ack=196367 Win=327808 Len=0 TSval=14135507 TSecr=837229826
 58   0.017182 54.230.159.141 -> 172.31.29.138 TCP 4410 [TCP segment of a reassembled PDU]
 59   0.017188 172.31.29.138 -> 54.230.159.141 TCP 66 59936 > http [ACK] Seq=96 Ack=200711 Win=336512 Len=0 TSval=14135507 TSecr=837229826
 60   0.017621 54.230.159.141 -> 172.31.29.138 TCP 4410 [TCP segment of a reassembled PDU]
 61   0.017628 172.31.29.138 -> 54.230.159.141 TCP 66 59936 > http [ACK] Seq=96 Ack=205055 Win=345088 Len=0 TSval=14135508 TSecr=837229826
 62   0.017823 54.230.159.141 -> 172.31.29.138 TCP 27578 [TCP segment of a reassembled PDU]
 63   0.017838 172.31.29.138 -> 54.230.159.141 TCP 66 59936 > http [ACK] Seq=96 Ack=232567 Win=400128 Len=0 TSval=14135508 TSecr=837229826
 64   0.018392 54.230.159.141 -> 172.31.29.138 TCP 4410 [TCP segment of a reassembled PDU]
 65   0.018399 172.31.29.138 -> 54.230.159.141 TCP 66 59936 > http [ACK] Seq=96 Ack=236911 Win=408832 Len=0 TSval=14135508 TSecr=837229826
 66   0.018588 54.230.159.141 -> 172.31.29.138 TCP 17442 [TCP segment of a reassembled PDU]
 67   0.018598 172.31.29.138 -> 54.230.159.141 TCP 66 59936 > http [ACK] Seq=96 Ack=254287 Win=443648 Len=0 TSval=14135508 TSecr=837229826
 68   0.018619 54.230.159.141 -> 172.31.29.138 TCP 7682 [TCP segment of a reassembled PDU]
 69   0.018625 172.31.29.138 -> 54.230.159.141 TCP 66 59936 > http [ACK] Seq=96 Ack=261903 Win=458880 Len=0 TSval=14135508 TSecr=837229826
 70   0.019840 54.230.159.141 -> 172.31.29.138 TCP 4410 [TCP segment of a reassembled PDU]
 71   0.019846 172.31.29.138 -> 54.230.159.141 TCP 66 59936 > http [ACK] Seq=96 Ack=266247 Win=467584 Len=0 TSval=14135508 TSecr=837229826
 72   0.020075 54.230.159.141 -> 172.31.29.138 TCP 8754 [TCP segment of a reassembled PDU]
 73   0.020082 172.31.29.138 -> 54.230.159.141 TCP 66 59936 > http [ACK] Seq=96 Ack=274935 Win=484864 Len=0 TSval=14135508 TSecr=837229826
 74   0.020111 54.230.159.141 -> 172.31.29.138 TCP 33370 [TCP segment of a reassembled PDU]
 75   0.020124 172.31.29.138 -> 54.230.159.141 TCP 66 59936 > http [ACK] Seq=96 Ack=308239 Win=543616 Len=0 TSval=14135508 TSecr=837229826
 76   0.020858 54.230.159.141 -> 172.31.29.138 TCP 7306 [TCP segment of a reassembled PDU]
 77   0.020866 172.31.29.138 -> 54.230.159.141 TCP 66 59936 > http [ACK] Seq=96 Ack=315479 Win=566016 Len=0 TSval=14135508 TSecr=837229826
 78   0.020984 54.230.159.141 -> 172.31.29.138 TCP 12026 [TCP segment of a reassembled PDU]
 79   0.020992 172.31.29.138 -> 54.230.159.141 TCP 66 59936 > http [ACK] Seq=96 Ack=327439 Win=589952 Len=0 TSval=14135508 TSecr=837229826
 80   0.022033 54.230.159.141 -> 172.31.29.138 TCP 1514 [TCP segment of a reassembled PDU]
 81   0.022039 172.31.29.138 -> 54.230.159.141 TCP 66 59936 > http [ACK] Seq=96 Ack=328887 Win=592768 Len=0 TSval=14135509 TSecr=837229826
 82   0.022058 54.230.159.141 -> 172.31.29.138 TCP 23234 [TCP segment of a reassembled PDU]
 83   0.022068 172.31.29.138 -> 54.230.159.141 TCP 66 59936 > http [ACK] Seq=96 Ack=352055 Win=572160 Len=0 TSval=14135509 TSecr=837229826
 84   0.022089 54.230.159.141 -> 172.31.29.138 TCP 17442 [TCP segment of a reassembled PDU]
 85   0.022098 172.31.29.138 -> 54.230.159.141 TCP 66 59936 > http [ACK] Seq=96 Ack=369431 Win=554880 Len=0 TSval=14135509 TSecr=837229826
 86   0.022241 54.230.159.141 -> 172.31.29.138 TCP 8754 [TCP segment of a reassembled PDU]
 87   0.022248 172.31.29.138 -> 54.230.159.141 TCP 66 59936 > http [ACK] Seq=96 Ack=378119 Win=598400 Len=0 TSval=14135509 TSecr=837229826
 88   0.022767 54.230.159.141 -> 172.31.29.138 TCP 2962 [TCP segment of a reassembled PDU]
 89   0.022773 172.31.29.138 -> 54.230.159.141 TCP 66 59936 > http [ACK] Seq=96 Ack=381015 Win=607872 Len=0 TSval=14135509 TSecr=837229826
 90   0.022913 54.230.159.141 -> 172.31.29.138 TCP 12026 [TCP segment of a reassembled PDU]
 91   0.022922 172.31.29.138 -> 54.230.159.141 TCP 66 59936 > http [ACK] Seq=96 Ack=392975 Win=595968 Len=0 TSval=14135509 TSecr=837229826
 92   0.023532 54.230.159.141 -> 172.31.29.138 TCP 2962 [TCP segment of a reassembled PDU]
 93   0.023537 172.31.29.138 -> 54.230.159.141 TCP 66 59936 > http [ACK] Seq=96 Ack=395871 Win=607872 Len=0 TSval=14135509 TSecr=837229826
 94   0.024034 54.230.159.141 -> 172.31.29.138 TCP 2962 [TCP segment of a reassembled PDU]
 95   0.024039 172.31.29.138 -> 54.230.159.141 TCP 66 59936 > http [ACK] Seq=96 Ack=398767 Win=607872 Len=0 TSval=14135509 TSecr=837229826
 96   0.024284 54.230.159.141 -> 172.31.29.138 TCP 31922 [TCP segment of a reassembled PDU]
 97   0.024299 172.31.29.138 -> 54.230.159.141 TCP 66 59936 > http [ACK] Seq=96 Ack=430623 Win=576128 Len=0 TSval=14135509 TSecr=837229826
 98   0.024336 54.230.159.141 -> 172.31.29.138 TCP 17442 [TCP segment of a reassembled PDU]
 99   0.024345 172.31.29.138 -> 54.230.159.141 TCP 66 59936 > http [ACK] Seq=96 Ack=447999 Win=558848 Len=0 TSval=14135509 TSecr=837229826
100   0.025071 54.230.159.141 -> 172.31.29.138 TCP 4410 [TCP segment of a reassembled PDU]
101   0.025077 172.31.29.138 -> 54.230.159.141 TCP 66 59936 > http [ACK] Seq=96 Ack=452343 Win=605568 Len=0 TSval=14135509 TSecr=837229827
102   0.025197 54.230.159.141 -> 172.31.29.138 TCP 6234 [TCP segment of a reassembled PDU]
103   0.025209 172.31.29.138 -> 54.230.159.141 TCP 66 59936 > http [ACK] Seq=96 Ack=458511 Win=600832 Len=0 TSval=14135509 TSecr=837229827
104   0.026126 54.230.159.141 -> 172.31.29.138 TCP 2962 [TCP segment of a reassembled PDU]
105   0.026135 172.31.29.138 -> 54.230.159.141 TCP 66 59936 > http [ACK] Seq=96 Ack=461407 Win=607872 Len=0 TSval=14135510 TSecr=837229827
106   0.026392 54.230.159.141 -> 172.31.29.138 TCP 4410 [TCP segment of a reassembled PDU]
107   0.026400 172.31.29.138 -> 54.230.159.141 TCP 66 59936 > http [ACK] Seq=96 Ack=465751 Win=605568 Len=0 TSval=14135510 TSecr=837229827
108   0.026596 54.230.159.141 -> 172.31.29.138 TCP 26130 [TCP segment of a reassembled PDU]
109   0.026622 172.31.29.138 -> 54.230.159.141 TCP 66 59936 > http [ACK] Seq=96 Ack=491815 Win=579584 Len=0 TSval=14135510 TSecr=837229827
110   0.026670 54.230.159.141 -> 172.31.29.138 TCP 7306 [TCP segment of a reassembled PDU]
111   0.026677 172.31.29.138 -> 54.230.159.141 TCP 66 59936 > http [ACK] Seq=96 Ack=499055 Win=600832 Len=0 TSval=14135510 TSecr=837229827
112   0.026691 54.230.159.141 -> 172.31.29.138 TCP 10202 [TCP segment of a reassembled PDU]
113   0.026811 54.230.159.141 -> 172.31.29.138 TCP 13098 [TCP segment of a reassembled PDU]
114   0.026904 172.31.29.138 -> 54.230.159.141 TCP 66 59936 > http [ACK] Seq=96 Ack=522223 Win=577664 Len=0 TSval=14135510 TSecr=837229827
115   0.027168 54.230.159.141 -> 172.31.29.138 TCP 1890 [TCP segment of a reassembled PDU]
116   0.027175 172.31.29.138 -> 54.230.159.141 TCP 66 59936 > http [ACK] Seq=96 Ack=524047 Win=607872 Len=0 TSval=14135510 TSecr=837229827
117   0.029207 54.230.159.141 -> 172.31.29.138 TCP 2962 [TCP segment of a reassembled PDU]
118   0.029212 172.31.29.138 -> 54.230.159.141 TCP 66 59936 > http [ACK] Seq=96 Ack=526943 Win=607872 Len=0 TSval=14135510 TSecr=837229827
119   0.029597 54.230.159.141 -> 172.31.29.138 TCP 26130 [TCP segment of a reassembled PDU]
120   0.029624 172.31.29.138 -> 54.230.159.141 TCP 66 59936 > http [ACK] Seq=96 Ack=553007 Win=581888 Len=0 TSval=14135511 TSecr=837229827
121   0.029731 54.230.159.141 -> 172.31.29.138 TCP 26130 [TCP segment of a reassembled PDU]
122   0.029759 172.31.29.138 -> 54.230.159.141 TCP 66 59936 > http [ACK] Seq=96 Ack=579071 Win=569856 Len=0 TSval=14135511 TSecr=837229827
123   0.030514 54.230.159.141 -> 172.31.29.138 TCP 4410 [TCP segment of a reassembled PDU]
124   0.030520 172.31.29.138 -> 54.230.159.141 TCP 66 59936 > http [ACK] Seq=96 Ack=583415 Win=605568 Len=0 TSval=14135511 TSecr=837229827
125   0.030626 54.230.159.141 -> 172.31.29.138 TCP 6234 [TCP segment of a reassembled PDU]
126   0.030644 172.31.29.138 -> 54.230.159.141 TCP 66 59936 > http [ACK] Seq=96 Ack=589583 Win=610176 Len=0 TSval=14135511 TSecr=837229827
127   0.031285 54.230.159.141 -> 172.31.29.138 TCP 10202 [TCP segment of a reassembled PDU]
128   0.031309 172.31.29.138 -> 54.230.159.141 TCP 66 59936 > http [ACK] Seq=96 Ack=599719 Win=610176 Len=0 TSval=14135511 TSecr=837229827
129   0.031505 54.230.159.141 -> 172.31.29.138 TCP 49298 [TCP segment of a reassembled PDU]
130   0.031556 172.31.29.138 -> 54.230.159.141 TCP 66 59936 > http [ACK] Seq=96 Ack=648951 Win=561024 Len=0 TSval=14135511 TSecr=837229827
131   0.031809 54.230.159.141 -> 172.31.29.138 TCP 8754 [TCP segment of a reassembled PDU]
132   0.031817 172.31.29.138 -> 54.230.159.141 TCP 66 59936 > http [ACK] Seq=96 Ack=657639 Win=598400 Len=0 TSval=14135511 TSecr=837229827
133   0.032345 54.230.159.141 -> 172.31.29.138 TCP 53642 [TCP segment of a reassembled PDU]
134   0.032383 54.230.159.141 -> 172.31.29.138 TCP 9506 [TCP segment of a reassembled PDU]
135   0.032400 172.31.29.138 -> 54.230.159.141 TCP 66 59936 > http [ACK] Seq=96 Ack=720655 Win=535424 Len=0 TSval=14135511 TSecr=837229827
136   0.034600 54.230.159.141 -> 172.31.29.138 TCP 1514 [TCP segment of a reassembled PDU]
137   0.034606 172.31.29.138 -> 54.230.159.141 TCP 66 59936 > http [ACK] Seq=96 Ack=722103 Win=610304 Len=0 TSval=14135512 TSecr=837229828
138   0.034960 54.230.159.141 -> 172.31.29.138 TCP 7306 [TCP segment of a reassembled PDU]
139   0.034969 172.31.29.138 -> 54.230.159.141 TCP 66 59936 > http [ACK] Seq=96 Ack=729343 Win=627328 Len=0 TSval=14135512 TSecr=837229828
140   0.034980 54.230.159.141 -> 172.31.29.138 TCP 13098 [TCP segment of a reassembled PDU]
141   0.034987 172.31.29.138 -> 54.230.159.141 TCP 66 59936 > http [ACK] Seq=96 Ack=742375 Win=653440 Len=0 TSval=14135512 TSecr=837229828
142   0.035017 54.230.159.141 -> 172.31.29.138 TCP 30474 [TCP segment of a reassembled PDU]
143   0.035032 172.31.29.138 -> 54.230.159.141 TCP 66 59936 > http [ACK] Seq=96 Ack=772783 Win=664448 Len=0 TSval=14135512 TSecr=837229828
144   0.035062 54.230.159.141 -> 172.31.29.138 TCP 13474 [TCP segment of a reassembled PDU]
145   0.035083 172.31.29.138 -> 54.230.159.141 TCP 66 59936 > http [ACK] Seq=96 Ack=786191 Win=673920 Len=0 TSval=14135512 TSecr=837229828
146   0.037863 54.230.159.141 -> 172.31.29.138 TCP 1514 [TCP segment of a reassembled PDU]
147   0.037868 172.31.29.138 -> 54.230.159.141 TCP 66 59936 > http [ACK] Seq=96 Ack=787639 Win=717056 Len=0 TSval=14135513 TSecr=837229828
148   0.037907 54.230.159.141 -> 172.31.29.138 TCP 46402 [TCP segment of a reassembled PDU]
149   0.037948 54.230.159.141 -> 172.31.29.138 TCP 5858 [TCP segment of a reassembled PDU]
150   0.037956 54.230.159.141 -> 172.31.29.138 TCP 8754 [TCP segment of a reassembled PDU]
151   0.037966 172.31.29.138 -> 54.230.159.141 TCP 66 59936 > http [ACK] Seq=96 Ack=833975 Win=671616 Len=0 TSval=14135513 TSecr=837229828
152   0.037981 172.31.29.138 -> 54.230.159.141 TCP 66 59936 > http [ACK] Seq=96 Ack=848455 Win=657152 Len=0 TSval=14135513 TSecr=837229828
153   0.038443 54.230.159.141 -> 172.31.29.138 TCP 3338 [TCP segment of a reassembled PDU]
154   0.038450 172.31.29.138 -> 54.230.159.141 TCP 66 59936 > http [ACK] Seq=96 Ack=851727 Win=723584 Len=0 TSval=14135513 TSecr=837229828
155   0.040447 54.230.159.141 -> 172.31.29.138 TCP 1514 [TCP segment of a reassembled PDU]
156   0.040453 172.31.29.138 -> 54.230.159.141 TCP 66 59936 > http [ACK] Seq=96 Ack=853175 Win=726528 Len=0 TSval=14135513 TSecr=837229828
157   0.040477 54.230.159.141 -> 172.31.29.138 TCP 32066 [TCP segment of a reassembled PDU]
158   0.040504 54.230.159.141 -> 172.31.29.138 TCP 8754 [TCP segment of a reassembled PDU]
159   0.040528 172.31.29.138 -> 54.230.159.141 TCP 66 59936 > http [ACK] Seq=96 Ack=893863 Win=685952 Len=0 TSval=14135513 TSecr=837229828
160   0.040564 54.230.159.141 -> 172.31.29.138 TCP 17442 [TCP segment of a reassembled PDU]
161   0.040576 172.31.29.138 -> 54.230.159.141 TCP 66 59936 > http [ACK] Seq=96 Ack=911239 Win=719232 Len=0 TSval=14135513 TSecr=837229828
162   0.040603 54.230.159.141 -> 172.31.29.138 TCP 2818 [TCP segment of a reassembled PDU]
163   0.040608 172.31.29.138 -> 54.230.159.141 TCP 66 59936 > http [ACK] Seq=96 Ack=913991 Win=732032 Len=0 TSval=14135513 TSecr=837229828
164   0.041169 54.230.159.141 -> 172.31.29.138 TCP 3338 [TCP segment of a reassembled PDU]
165   0.041174 172.31.29.138 -> 54.230.159.141 TCP 66 59936 > http [ACK] Seq=96 Ack=917263 Win=738560 Len=0 TSval=14135513 TSecr=837229828
166   0.041612 54.230.159.141 -> 172.31.29.138 TCP 2962 [TCP segment of a reassembled PDU]
167   0.041617 172.31.29.138 -> 54.230.159.141 TCP 66 59936 > http [ACK] Seq=96 Ack=920159 Win=743040 Len=0 TSval=14135514 TSecr=837229828
168   0.042172 54.230.159.141 -> 172.31.29.138 TCP 34818 [TCP segment of a reassembled PDU]
169   0.042201 172.31.29.138 -> 54.230.159.141 TCP 66 59936 > http [ACK] Seq=96 Ack=954911 Win=708352 Len=0 TSval=14135514 TSecr=837229828
170   0.042223 54.230.159.141 -> 172.31.29.138 TCP 17442 [TCP segment of a reassembled PDU]
171   0.042241 172.31.29.138 -> 54.230.159.141 TCP 66 59936 > http [ACK] Seq=96 Ack=972287 Win=691072 Len=0 TSval=14135514 TSecr=837229828
172   0.042269 54.230.159.141 -> 172.31.29.138 TCP 7306 [TCP segment of a reassembled PDU]
173   0.042274 172.31.29.138 -> 54.230.159.141 TCP 66 59936 > http [ACK] Seq=96 Ack=979527 Win=736000 Len=0 TSval=14135514 TSecr=837229828
174   0.042912 54.230.159.141 -> 172.31.29.138 TCP 3338 [TCP segment of a reassembled PDU]
175   0.042919 172.31.29.138 -> 54.230.159.141 TCP 66 59936 > http [ACK] Seq=96 Ack=982799 Win=740736 Len=0 TSval=14135514 TSecr=837229828
176   0.043416 54.230.159.141 -> 172.31.29.138 TCP 5858 [TCP segment of a reassembled PDU]
177   0.043433 172.31.29.138 -> 54.230.159.141 TCP 66 59936 > http [ACK] Seq=96 Ack=988591 Win=744320 Len=0 TSval=14135514 TSecr=837229828
178   0.043718 54.230.159.141 -> 172.31.29.138 TCP 1514 [TCP segment of a reassembled PDU]
179   0.043722 172.31.29.138 -> 54.230.159.141 TCP 66 59936 > http [ACK] Seq=96 Ack=990039 Win=745472 Len=0 TSval=14135514 TSecr=837229828
180   0.043749 54.230.159.141 -> 172.31.29.138 TCP 26130 [TCP segment of a reassembled PDU]
181   0.043775 172.31.29.138 -> 54.230.159.141 TCP 66 59936 > http [ACK] Seq=96 Ack=1016103 Win=719488 Len=0 TSval=14135514 TSecr=837229828
182   0.043841 54.230.159.141 -> 172.31.29.138 TCP 26130 [TCP segment of a reassembled PDU]
183   0.043869 172.31.29.138 -> 54.230.159.141 TCP 66 59936 > http [ACK] Seq=96 Ack=1042167 Win=705024 Len=0 TSval=14135514 TSecr=837229828
184   0.043875 54.230.159.141 -> 172.31.29.138 TCP 2962 [TCP segment of a reassembled PDU]
185   0.043893 172.31.29.138 -> 54.230.159.141 TCP 66 59936 > http [ACK] Seq=96 Ack=1045063 Win=747264 Len=0 TSval=14135514 TSecr=837229828
186   0.044243 54.230.159.141 -> 172.31.29.138 HTTP 4037 HTTP/1.1 200 OK  (application/octet-stream)
187   0.044260 172.31.29.138 -> 54.230.159.141 TCP 66 59936 > http [ACK] Seq=96 Ack=1049034 Win=747264 Len=0 TSval=14135514 TSecr=837229828
188   0.044376 172.31.29.138 -> 54.230.159.141 TCP 66 59936 > http [FIN, ACK] Seq=96 Ack=1049034 Win=747264 Len=0 TSval=14135514 TSecr=837229828
189   0.045168 54.230.159.141 -> 172.31.29.138 TCP 66 http > 59936 [FIN, ACK] Seq=1049034 Ack=97 Win=14592 Len=0 TSval=837229829 TSecr=14135514
190   0.045177 172.31.29.138 -> 54.230.159.141 TCP 66 59936 > http [ACK] Seq=97 Ack=1049035 Win=747264 Len=0 TSval=14135514 TSecr=837229829
