[Measurement for 1mb at 12:37:49 20.37.2014] 
Tshark:

  1   0.000000 172.31.29.138 -> 172.31.0.2   DNS 88 Standard query 0x4b39  A dm53kc3eax57k.cloudfront.net
  2   0.000027 172.31.29.138 -> 172.31.0.2   DNS 88 Standard query 0x0058  AAAA dm53kc3eax57k.cloudfront.net
  3   0.000442   172.31.0.2 -> 172.31.29.138 DNS 216 Standard query response 0x4b39  A 54.192.159.107 A 54.230.158.191 A 54.230.158.217 A 54.230.158.230 A 54.230.158.244 A 54.230.159.137 A 54.192.157.139 A 54.192.157.142
  4   0.000452   172.31.0.2 -> 172.31.29.138 DNS 175 Standard query response 0x0058 
  5   0.003907 172.31.29.138 -> 54.192.159.107 TCP 74 55564 > http [SYN] Seq=0 Win=26883 Len=0 MSS=8961 SACK_PERM=1 TSval=17735662 TSecr=0 WS=128
  6   0.004680 54.192.159.107 -> 172.31.29.138 TCP 74 http > 55564 [SYN, ACK] Seq=0 Ack=1 Win=14480 Len=0 MSS=1460 SACK_PERM=1 TSval=733345504 TSecr=17735662 WS=128
  7   0.004695 172.31.29.138 -> 54.192.159.107 TCP 66 55564 > http [ACK] Seq=1 Ack=1 Win=27008 Len=0 TSval=17735662 TSecr=733345504
  8   0.004734 172.31.29.138 -> 54.192.159.107 HTTP 161 GET /1mb HTTP/1.1 
  9   0.005426 54.192.159.107 -> 172.31.29.138 TCP 66 http > 55564 [ACK] Seq=1 Ack=96 Win=14592 Len=0 TSval=733345504 TSecr=17735662
 10   0.010289 54.192.159.107 -> 172.31.29.138 TCP 523 [TCP segment of a reassembled PDU]
 11   0.010298 172.31.29.138 -> 54.192.159.107 TCP 66 55564 > http [ACK] Seq=96 Ack=458 Win=28032 Len=0 TSval=17735664 TSecr=733345505
 12   0.010349 54.192.159.107 -> 172.31.29.138 TCP 13098 [TCP segment of a reassembled PDU]
 13   0.010359 172.31.29.138 -> 54.192.159.107 TCP 66 55564 > http [ACK] Seq=96 Ack=13490 Win=54144 Len=0 TSval=17735664 TSecr=733345505
 14   0.011080 54.192.159.107 -> 172.31.29.138 TCP 5858 [TCP segment of a reassembled PDU]
 15   0.011087 172.31.29.138 -> 54.192.159.107 TCP 66 55564 > http [ACK] Seq=96 Ack=19282 Win=65664 Len=0 TSval=17735664 TSecr=733345505
 16   0.011139 54.192.159.107 -> 172.31.29.138 TCP 7306 [TCP segment of a reassembled PDU]
 17   0.011145 172.31.29.138 -> 54.192.159.107 TCP 66 55564 > http [ACK] Seq=96 Ack=26522 Win=80128 Len=0 TSval=17735664 TSecr=733345505
 18   0.011820 54.192.159.107 -> 172.31.29.138 TCP 1514 [TCP segment of a reassembled PDU]
 19   0.011825 172.31.29.138 -> 54.192.159.107 TCP 66 55564 > http [ACK] Seq=96 Ack=27970 Win=83072 Len=0 TSval=17735664 TSecr=733345505
 20   0.011900 54.192.159.107 -> 172.31.29.138 TCP 10202 [TCP segment of a reassembled PDU]
 21   0.011908 172.31.29.138 -> 54.192.159.107 TCP 66 55564 > http [ACK] Seq=96 Ack=38106 Win=101248 Len=0 TSval=17735664 TSecr=733345505
 22   0.011913 54.192.159.107 -> 172.31.29.138 TCP 1514 [TCP segment of a reassembled PDU]
 23   0.011917 172.31.29.138 -> 54.192.159.107 TCP 66 55564 > http [ACK] Seq=96 Ack=39554 Win=99840 Len=0 TSval=17735664 TSecr=733345505
 24   0.012006 54.192.159.107 -> 172.31.29.138 TCP 7306 [TCP segment of a reassembled PDU]
 25   0.012013 172.31.29.138 -> 54.192.159.107 TCP 66 55564 > http [ACK] Seq=96 Ack=46794 Win=105984 Len=0 TSval=17735664 TSecr=733345505
 26   0.012586 54.192.159.107 -> 172.31.29.138 TCP 5858 [TCP segment of a reassembled PDU]
 27   0.012592 172.31.29.138 -> 54.192.159.107 TCP 66 55564 > http [ACK] Seq=96 Ack=52586 Win=108416 Len=0 TSval=17735664 TSecr=733345505
 28   0.012646 54.192.159.107 -> 172.31.29.138 TCP 12775 [TCP segment of a reassembled PDU]
 29   0.012654 172.31.29.138 -> 54.192.159.107 TCP 66 55564 > http [ACK] Seq=96 Ack=65295 Win=96512 Len=0 TSval=17735664 TSecr=733345505
 30   0.012684 54.192.159.107 -> 172.31.29.138 TCP 7306 [TCP segment of a reassembled PDU]
 31   0.012694 172.31.29.138 -> 54.192.159.107 TCP 66 55564 > http [ACK] Seq=96 Ack=72535 Win=105984 Len=0 TSval=17735664 TSecr=733345505
 32   0.013353 54.192.159.107 -> 172.31.29.138 TCP 1514 [TCP segment of a reassembled PDU]
 33   0.013358 172.31.29.138 -> 54.192.159.107 TCP 66 55564 > http [ACK] Seq=96 Ack=73983 Win=109056 Len=0 TSval=17735664 TSecr=733345505
 34   0.013491 54.192.159.107 -> 172.31.29.138 TCP 20338 [TCP segment of a reassembled PDU]
 35   0.013516 172.31.29.138 -> 54.192.159.107 TCP 66 55564 > http [ACK] Seq=96 Ack=94255 Win=88832 Len=0 TSval=17735664 TSecr=733345505
 36   0.014194 54.192.159.107 -> 172.31.29.138 TCP 14546 [TCP segment of a reassembled PDU]
 37   0.014204 172.31.29.138 -> 54.192.159.107 TCP 66 55564 > http [ACK] Seq=96 Ack=108735 Win=94080 Len=0 TSval=17735665 TSecr=733345505
 38   0.014244 54.192.159.107 -> 172.31.29.138 TCP 15994 [TCP segment of a reassembled PDU]
 39   0.014253 172.31.29.138 -> 54.192.159.107 TCP 66 55564 > http [ACK] Seq=96 Ack=124663 Win=140928 Len=0 TSval=17735665 TSecr=733345505
 40   0.014930 54.192.159.107 -> 172.31.29.138 TCP 6234 [TCP segment of a reassembled PDU]
 41   0.014938 172.31.29.138 -> 54.192.159.107 TCP 66 55564 > http [ACK] Seq=96 Ack=130831 Win=153216 Len=0 TSval=17735665 TSecr=733345505
 42   0.015243 54.192.159.107 -> 172.31.29.138 TCP 23234 [TCP segment of a reassembled PDU]
 43   0.015255 172.31.29.138 -> 54.192.159.107 TCP 66 55564 > http [ACK] Seq=96 Ack=153999 Win=199552 Len=0 TSval=17735665 TSecr=733345505
 44   0.015267 54.192.159.107 -> 172.31.29.138 TCP 4410 [TCP segment of a reassembled PDU]
 45   0.015271 172.31.29.138 -> 54.192.159.107 TCP 66 55564 > http [ACK] Seq=96 Ack=158343 Win=208256 Len=0 TSval=17735665 TSecr=733345505
 46   0.015993 54.192.159.107 -> 172.31.29.138 TCP 18890 [TCP segment of a reassembled PDU]
 47   0.016004 172.31.29.138 -> 54.192.159.107 TCP 66 55564 > http [ACK] Seq=96 Ack=177167 Win=245888 Len=0 TSval=17735665 TSecr=733345505
 48   0.016043 54.192.159.107 -> 172.31.29.138 TCP 14546 [TCP segment of a reassembled PDU]
 49   0.016052 172.31.29.138 -> 54.192.159.107 TCP 66 55564 > http [ACK] Seq=96 Ack=191647 Win=274944 Len=0 TSval=17735665 TSecr=733345505
 50   0.016474 54.192.159.107 -> 172.31.29.138 TCP 5858 [TCP segment of a reassembled PDU]
 51   0.016480 172.31.29.138 -> 54.192.159.107 TCP 66 55564 > http [ACK] Seq=96 Ack=197439 Win=286464 Len=0 TSval=17735665 TSecr=733345505
 52   0.016844 54.192.159.107 -> 172.31.29.138 TCP 18890 [TCP segment of a reassembled PDU]
 53   0.016855 172.31.29.138 -> 54.192.159.107 TCP 66 55564 > http [ACK] Seq=96 Ack=216263 Win=324096 Len=0 TSval=17735665 TSecr=733345505
 54   0.016878 54.192.159.107 -> 172.31.29.138 TCP 7306 [TCP segment of a reassembled PDU]
 55   0.016884 172.31.29.138 -> 54.192.159.107 TCP 66 55564 > http [ACK] Seq=96 Ack=223503 Win=338560 Len=0 TSval=17735665 TSecr=733345505
 56   0.016928 54.192.159.107 -> 172.31.29.138 TCP 10202 [TCP segment of a reassembled PDU]
 57   0.016935 172.31.29.138 -> 54.192.159.107 TCP 66 55564 > http [ACK] Seq=96 Ack=233639 Win=358912 Len=0 TSval=17735665 TSecr=733345505
 58   0.017450 54.192.159.107 -> 172.31.29.138 TCP 2962 [TCP segment of a reassembled PDU]
 59   0.017457 172.31.29.138 -> 54.192.159.107 TCP 66 55564 > http [ACK] Seq=96 Ack=236535 Win=364672 Len=0 TSval=17735665 TSecr=733345505
 60   0.017628 54.192.159.107 -> 172.31.29.138 TCP 25434 [TCP segment of a reassembled PDU]
 61   0.017642 172.31.29.138 -> 54.192.159.107 TCP 66 55564 > http [ACK] Seq=96 Ack=261903 Win=415360 Len=0 TSval=17735665 TSecr=733345505
 62   0.022598 54.192.159.107 -> 172.31.29.138 TCP 8754 [TCP segment of a reassembled PDU]
 63   0.022607 172.31.29.138 -> 54.192.159.107 TCP 66 55564 > http [ACK] Seq=96 Ack=270591 Win=432768 Len=0 TSval=17735667 TSecr=733345506
 64   0.022764 54.192.159.107 -> 172.31.29.138 TCP 26130 [TCP segment of a reassembled PDU]
 65   0.022778 172.31.29.138 -> 54.192.159.107 TCP 66 55564 > http [ACK] Seq=96 Ack=296655 Win=484864 Len=0 TSval=17735667 TSecr=733345506
 66   0.022792 54.192.159.107 -> 172.31.29.138 TCP 13098 [TCP segment of a reassembled PDU]
 67   0.022803 172.31.29.138 -> 54.192.159.107 TCP 66 55564 > http [ACK] Seq=96 Ack=309687 Win=510976 Len=0 TSval=17735667 TSecr=733345506
 68   0.023359 54.192.159.107 -> 172.31.29.138 TCP 8754 [TCP segment of a reassembled PDU]
 69   0.023367 172.31.29.138 -> 54.192.159.107 TCP 66 55564 > http [ACK] Seq=96 Ack=318375 Win=528384 Len=0 TSval=17735667 TSecr=733345506
 70   0.023538 54.192.159.107 -> 172.31.29.138 TCP 29026 [TCP segment of a reassembled PDU]
 71   0.023553 172.31.29.138 -> 54.192.159.107 TCP 66 55564 > http [ACK] Seq=96 Ack=347335 Win=586240 Len=0 TSval=17735667 TSecr=733345506
 72   0.024205 54.192.159.107 -> 172.31.29.138 TCP 15994 [TCP segment of a reassembled PDU]
 73   0.024231 172.31.29.138 -> 54.192.159.107 TCP 66 55564 > http [ACK] Seq=96 Ack=363263 Win=618112 Len=0 TSval=17735667 TSecr=733345506
 74   0.024333 54.192.159.107 -> 172.31.29.138 TCP 27578 [TCP segment of a reassembled PDU]
 75   0.024348 172.31.29.138 -> 54.192.159.107 TCP 66 55564 > http [ACK] Seq=96 Ack=390775 Win=673152 Len=0 TSval=17735667 TSecr=733345506
 76   0.024354 54.192.159.107 -> 172.31.29.138 TCP 2266 [TCP segment of a reassembled PDU]
 77   0.024357 172.31.29.138 -> 54.192.159.107 TCP 66 55564 > http [ACK] Seq=96 Ack=392975 Win=677504 Len=0 TSval=17735667 TSecr=733345506
 78   0.025145 54.192.159.107 -> 172.31.29.138 TCP 8754 [TCP segment of a reassembled PDU]
 79   0.025153 172.31.29.138 -> 54.192.159.107 TCP 66 55564 > http [ACK] Seq=96 Ack=401663 Win=694912 Len=0 TSval=17735667 TSecr=733345506
 80   0.025319 54.192.159.107 -> 172.31.29.138 TCP 23234 [TCP segment of a reassembled PDU]
 81   0.025332 172.31.29.138 -> 54.192.159.107 TCP 66 55564 > http [ACK] Seq=96 Ack=424831 Win=741248 Len=0 TSval=17735667 TSecr=733345506
 82   0.025356 54.192.159.107 -> 172.31.29.138 TCP 2962 [TCP segment of a reassembled PDU]
 83   0.025359 172.31.29.138 -> 54.192.159.107 TCP 66 55564 > http [ACK] Seq=96 Ack=427727 Win=747008 Len=0 TSval=17735667 TSecr=733345506
 84   0.025436 54.192.159.107 -> 172.31.29.138 TCP 21786 [TCP segment of a reassembled PDU]
 85   0.025448 172.31.29.138 -> 54.192.159.107 TCP 66 55564 > http [ACK] Seq=96 Ack=449447 Win=790528 Len=0 TSval=17735667 TSecr=733345506
 86   0.025952 54.192.159.107 -> 172.31.29.138 TCP 9130 [TCP segment of a reassembled PDU]
 87   0.025960 172.31.29.138 -> 54.192.159.107 TCP 66 55564 > http [ACK] Seq=96 Ack=458511 Win=808576 Len=0 TSval=17735668 TSecr=733345506
 88   0.026671 54.192.159.107 -> 172.31.29.138 TCP 7306 [TCP segment of a reassembled PDU]
 89   0.026678 172.31.29.138 -> 54.192.159.107 TCP 66 55564 > http [ACK] Seq=96 Ack=465751 Win=823040 Len=0 TSval=17735668 TSecr=733345506
 90   0.026868 54.192.159.107 -> 172.31.29.138 TCP 20338 [TCP segment of a reassembled PDU]
 91   0.026879 172.31.29.138 -> 54.192.159.107 TCP 66 55564 > http [ACK] Seq=96 Ack=486023 Win=863616 Len=0 TSval=17735668 TSecr=733345506
 92   0.026898 54.192.159.107 -> 172.31.29.138 TCP 5858 [TCP segment of a reassembled PDU]
 93   0.026902 172.31.29.138 -> 54.192.159.107 TCP 66 55564 > http [ACK] Seq=96 Ack=491815 Win=875264 Len=0 TSval=17735668 TSecr=733345506
 94   0.026953 54.192.159.107 -> 172.31.29.138 TCP 15994 [TCP segment of a reassembled PDU]
 95   0.026963 172.31.29.138 -> 54.192.159.107 TCP 66 55564 > http [ACK] Seq=96 Ack=507743 Win=907136 Len=0 TSval=17735668 TSecr=733345506
 96   0.027447 54.192.159.107 -> 172.31.29.138 TCP 2962 [TCP segment of a reassembled PDU]
 97   0.027454 172.31.29.138 -> 54.192.159.107 TCP 66 55564 > http [ACK] Seq=96 Ack=510639 Win=912896 Len=0 TSval=17735668 TSecr=733345506
 98   0.027679 54.192.159.107 -> 172.31.29.138 TCP 13474 [TCP segment of a reassembled PDU]
 99   0.027698 172.31.29.138 -> 54.192.159.107 TCP 66 55564 > http [ACK] Seq=96 Ack=524047 Win=913280 Len=0 TSval=17735668 TSecr=733345506
100   0.028065 54.192.159.107 -> 172.31.29.138 TCP 2962 [TCP segment of a reassembled PDU]
101   0.028071 172.31.29.138 -> 54.192.159.107 TCP 66 55564 > http [ACK] Seq=96 Ack=526943 Win=932352 Len=0 TSval=17735668 TSecr=733345506
102   0.028119 54.192.159.107 -> 172.31.29.138 TCP 7306 [TCP segment of a reassembled PDU]
103   0.028125 172.31.29.138 -> 54.192.159.107 TCP 66 55564 > http [ACK] Seq=96 Ack=534183 Win=925184 Len=0 TSval=17735668 TSecr=733345506
104   0.028225 54.192.159.107 -> 172.31.29.138 TCP 24682 [TCP segment of a reassembled PDU]
105   0.028238 172.31.29.138 -> 54.192.159.107 TCP 66 55564 > http [ACK] Seq=96 Ack=558799 Win=900608 Len=0 TSval=17735668 TSecr=733345506
106   0.028313 54.192.159.107 -> 172.31.29.138 TCP 11650 [TCP segment of a reassembled PDU]
107   0.028322 172.31.29.138 -> 54.192.159.107 TCP 66 55564 > http [ACK] Seq=96 Ack=570383 Win=918144 Len=0 TSval=17735668 TSecr=733345506
108   0.028719 54.192.159.107 -> 172.31.29.138 TCP 2962 [TCP segment of a reassembled PDU]
109   0.028724 172.31.29.138 -> 54.192.159.107 TCP 66 55564 > http [ACK] Seq=96 Ack=573279 Win=932352 Len=0 TSval=17735668 TSecr=733345506
110   0.028910 54.192.159.107 -> 172.31.29.138 TCP 16370 [TCP segment of a reassembled PDU]
111   0.028919 172.31.29.138 -> 54.192.159.107 TCP 66 55564 > http [ACK] Seq=96 Ack=589583 Win=916096 Len=0 TSval=17735668 TSecr=733345506
112   0.028976 54.192.159.107 -> 172.31.29.138 TCP 2962 [TCP segment of a reassembled PDU]
113   0.028981 172.31.29.138 -> 54.192.159.107 TCP 66 55564 > http [ACK] Seq=96 Ack=592479 Win=932352 Len=0 TSval=17735668 TSecr=733345506
114   0.029070 54.192.159.107 -> 172.31.29.138 TCP 20338 [TCP segment of a reassembled PDU]
115   0.029081 172.31.29.138 -> 54.192.159.107 TCP 66 55564 > http [ACK] Seq=96 Ack=612751 Win=912128 Len=0 TSval=17735668 TSecr=733345506
116   0.029182 54.192.159.107 -> 172.31.29.138 TCP 27578 [TCP segment of a reassembled PDU]
117   0.029381 172.31.29.138 -> 54.192.159.107 TCP 66 55564 > http [ACK] Seq=96 Ack=640263 Win=891776 Len=0 TSval=17735668 TSecr=733345506
118   0.029749 54.192.159.107 -> 172.31.29.138 TCP 2962 [TCP segment of a reassembled PDU]
119   0.029755 172.31.29.138 -> 54.192.159.107 TCP 66 55564 > http [ACK] Seq=96 Ack=643159 Win=932352 Len=0 TSval=17735668 TSecr=733345507
120   0.029902 54.192.159.107 -> 172.31.29.138 TCP 12026 [TCP segment of a reassembled PDU]
121   0.029938 172.31.29.138 -> 54.192.159.107 TCP 66 55564 > http [ACK] Seq=96 Ack=655119 Win=933888 Len=0 TSval=17735669 TSecr=733345507
122   0.030548 54.192.159.107 -> 172.31.29.138 TCP 4410 [TCP segment of a reassembled PDU]
123   0.030564 172.31.29.138 -> 54.192.159.107 TCP 66 55564 > http [ACK] Seq=96 Ack=659463 Win=933888 Len=0 TSval=17735669 TSecr=733345507
124   0.030748 54.192.159.107 -> 172.31.29.138 TCP 26130 [TCP segment of a reassembled PDU]
125   0.030790 54.192.159.107 -> 172.31.29.138 TCP 15994 [TCP segment of a reassembled PDU]
126   0.030805 54.192.159.107 -> 172.31.29.138 TCP 11650 [TCP segment of a reassembled PDU]
127   0.030811 54.192.159.107 -> 172.31.29.138 TCP 2962 [TCP segment of a reassembled PDU]
128   0.030814 172.31.29.138 -> 54.192.159.107 TCP 66 55564 > http [ACK] Seq=96 Ack=685527 Win=907904 Len=0 TSval=17735669 TSecr=733345507
129   0.030831 172.31.29.138 -> 54.192.159.107 TCP 66 55564 > http [ACK] Seq=96 Ack=715935 Win=886912 Len=0 TSval=17735669 TSecr=733345507
130   0.031550 54.192.159.107 -> 172.31.29.138 TCP 2962 [TCP segment of a reassembled PDU]
131   0.031556 172.31.29.138 -> 54.192.159.107 TCP 66 55564 > http [ACK] Seq=96 Ack=718831 Win=932352 Len=0 TSval=17735669 TSecr=733345507
132   0.031678 54.192.159.107 -> 172.31.29.138 TCP 1890 [TCP segment of a reassembled PDU]
133   0.031683 172.31.29.138 -> 54.192.159.107 TCP 66 55564 > http [ACK] Seq=96 Ack=720655 Win=932352 Len=0 TSval=17735669 TSecr=733345507
134   0.032835 54.192.159.107 -> 172.31.29.138 TCP 4410 [TCP segment of a reassembled PDU]
135   0.032852 172.31.29.138 -> 54.192.159.107 TCP 66 55564 > http [ACK] Seq=96 Ack=724999 Win=933888 Len=0 TSval=17735669 TSecr=733345507
136   0.032985 54.192.159.107 -> 172.31.29.138 TCP 21786 [TCP segment of a reassembled PDU]
137   0.033024 54.192.159.107 -> 172.31.29.138 TCP 4410 [TCP segment of a reassembled PDU]
138   0.033088 54.192.159.107 -> 172.31.29.138 TCP 21786 [TCP segment of a reassembled PDU]
139   0.033105 54.192.159.107 -> 172.31.29.138 TCP 13474 [TCP segment of a reassembled PDU]
140   0.033280 172.31.29.138 -> 54.192.159.107 TCP 66 55564 > http [ACK] Seq=96 Ack=786191 Win=872704 Len=0 TSval=17735669 TSecr=733345507
141   0.034913 54.192.159.107 -> 172.31.29.138 TCP 5858 [TCP segment of a reassembled PDU]
142   0.034920 172.31.29.138 -> 54.192.159.107 TCP 66 55564 > http [ACK] Seq=96 Ack=791983 Win=927616 Len=0 TSval=17735670 TSecr=733345507
143   0.035024 54.192.159.107 -> 172.31.29.138 TCP 26130 [TCP segment of a reassembled PDU]
144   0.035051 172.31.29.138 -> 54.192.159.107 TCP 66 55564 > http [ACK] Seq=96 Ack=818047 Win=901632 Len=0 TSval=17735670 TSecr=733345507
145   0.035078 54.192.159.107 -> 172.31.29.138 TCP 26130 [TCP segment of a reassembled PDU]
146   0.035094 54.192.159.107 -> 172.31.29.138 TCP 7682 [TCP segment of a reassembled PDU]
147   0.035110 172.31.29.138 -> 54.192.159.107 TCP 66 55564 > http [ACK] Seq=96 Ack=851727 Win=880000 Len=0 TSval=17735670 TSecr=733345507
148   0.037275 54.192.159.107 -> 172.31.29.138 TCP 15994 [TCP segment of a reassembled PDU]
149   0.037305 172.31.29.138 -> 54.192.159.107 TCP 66 55564 > http [ACK] Seq=96 Ack=867655 Win=910848 Len=0 TSval=17735670 TSecr=733345507
150   0.037419 54.192.159.107 -> 172.31.29.138 TCP 26130 [TCP segment of a reassembled PDU]
151   0.037439 54.192.159.107 -> 172.31.29.138 TCP 11650 [TCP segment of a reassembled PDU]
152   0.037458 54.192.159.107 -> 172.31.29.138 TCP 12026 [TCP segment of a reassembled PDU]
153   0.037555 172.31.29.138 -> 54.192.159.107 TCP 66 55564 > http [ACK] Seq=96 Ack=917263 Win=861312 Len=0 TSval=17735670 TSecr=733345507
154   0.038956 54.192.159.107 -> 172.31.29.138 TCP 2962 [TCP segment of a reassembled PDU]
155   0.038962 172.31.29.138 -> 54.192.159.107 TCP 66 55564 > http [ACK] Seq=96 Ack=920159 Win=932352 Len=0 TSval=17735671 TSecr=733345507
156   0.039143 54.192.159.107 -> 172.31.29.138 TCP 26130 [TCP segment of a reassembled PDU]
157   0.039162 54.192.159.107 -> 172.31.29.138 TCP 8754 [TCP segment of a reassembled PDU]
158   0.039169 54.192.159.107 -> 172.31.29.138 TCP 2962 [TCP segment of a reassembled PDU]
159   0.039185 172.31.29.138 -> 54.192.159.107 TCP 66 55564 > http [ACK] Seq=96 Ack=957807 Win=894720 Len=0 TSval=17735671 TSecr=733345507
160   0.039238 54.192.159.107 -> 172.31.29.138 TCP 25058 [TCP segment of a reassembled PDU]
161   0.039268 172.31.29.138 -> 54.192.159.107 TCP 66 55564 > http [ACK] Seq=96 Ack=982799 Win=894336 Len=0 TSval=17735671 TSecr=733345507
162   0.040593 54.192.159.107 -> 172.31.29.138 TCP 18890 [TCP segment of a reassembled PDU]
163   0.040605 172.31.29.138 -> 54.192.159.107 TCP 66 55564 > http [ACK] Seq=96 Ack=1001623 Win=906112 Len=0 TSval=17735671 TSecr=733345508
164   0.040671 54.192.159.107 -> 172.31.29.138 TCP 21786 [TCP segment of a reassembled PDU]
165   0.040697 172.31.29.138 -> 54.192.159.107 TCP 66 55564 > http [ACK] Seq=96 Ack=1023343 Win=901376 Len=0 TSval=17735671 TSecr=733345508
166   0.040707 54.192.159.107 -> 172.31.29.138 TCP 2962 [TCP segment of a reassembled PDU]
167   0.040710 54.192.159.107 -> 172.31.29.138 TCP 1514 [TCP Previous segment not captured] [TCP segment of a reassembled PDU]
168   0.040713 54.192.159.107 -> 172.31.29.138 TCP 1514 [TCP Out-Of-Order] [TCP segment of a reassembled PDU]
169   0.040717 172.31.29.138 -> 54.192.159.107 TCP 78 55564 > http [ACK] Seq=96 Ack=1026239 Win=898560 Len=0 TSval=17735671 TSecr=733345508 SLE=1027687 SRE=1029135
170   0.040725 172.31.29.138 -> 54.192.159.107 TCP 66 55564 > http [ACK] Seq=96 Ack=1029135 Win=895744 Len=0 TSval=17735671 TSecr=733345508
171   0.040859 54.192.159.107 -> 172.31.29.138 HTTP 19965 HTTP/1.1 200 OK  (application/octet-stream)
172   0.040867 172.31.29.138 -> 54.192.159.107 TCP 66 55564 > http [ACK] Seq=96 Ack=1049034 Win=903808 Len=0 TSval=17735671 TSecr=733345508
173   0.041007 172.31.29.138 -> 54.192.159.107 TCP 66 55564 > http [FIN, ACK] Seq=96 Ack=1049034 Win=933888 Len=0 TSval=17735671 TSecr=733345508
174   0.041502 54.192.159.107 -> 172.31.29.138 TCP 66 http > 55564 [FIN, ACK] Seq=1049034 Ack=97 Win=14592 Len=0 TSval=733345508 TSecr=17735671
175   0.041509 172.31.29.138 -> 54.192.159.107 TCP 66 55564 > http [ACK] Seq=97 Ack=1049035 Win=933888 Len=0 TSval=17735671 TSecr=733345508
