[Measurement for 1mb at 06:37:48 20.37.2014] 
Tshark:

  1   0.000000 172.31.29.138 -> 172.31.0.2   DNS 88 Standard query 0xf420  A dm53kc3eax57k.cloudfront.net
  2   0.000027 172.31.29.138 -> 172.31.0.2   DNS 88 Standard query 0x3836  AAAA dm53kc3eax57k.cloudfront.net
  3   0.000541   172.31.0.2 -> 172.31.29.138 DNS 175 Standard query response 0x3836 
  4   0.000551   172.31.0.2 -> 172.31.29.138 DNS 216 Standard query response 0xf420  A 54.192.157.146 A 54.192.159.104 A 54.192.159.107 A 54.230.158.80 A 54.230.158.135 A 54.230.158.189 A 54.230.158.190 A 54.230.159.130
  5   0.003882 172.31.29.138 -> 54.192.157.146 TCP 74 60248 > http [SYN] Seq=0 Win=26883 Len=0 MSS=8961 SACK_PERM=1 TSval=12335407 TSecr=0 WS=128
  6   0.004404 54.192.157.146 -> 172.31.29.138 TCP 74 http > 60248 [SYN, ACK] Seq=0 Ack=1 Win=14480 Len=0 MSS=1460 SACK_PERM=1 TSval=834038480 TSecr=12335407 WS=128
  7   0.004419 172.31.29.138 -> 54.192.157.146 TCP 66 60248 > http [ACK] Seq=1 Ack=1 Win=27008 Len=0 TSval=12335407 TSecr=834038480
  8   0.004473 172.31.29.138 -> 54.192.157.146 HTTP 161 GET /1mb HTTP/1.1 
  9   0.004898 54.192.157.146 -> 172.31.29.138 TCP 66 http > 60248 [ACK] Seq=1 Ack=96 Win=14592 Len=0 TSval=834038481 TSecr=12335407
 10   0.010432 54.192.157.146 -> 172.31.29.138 TCP 8754 [TCP segment of a reassembled PDU]
 11   0.010443 172.31.29.138 -> 54.192.157.146 TCP 66 60248 > http [ACK] Seq=96 Ack=8689 Win=44288 Len=0 TSval=12335409 TSecr=834038481
 12   0.010473 54.192.157.146 -> 172.31.29.138 TCP 4410 [TCP segment of a reassembled PDU]
 13   0.010479 172.31.29.138 -> 54.192.157.146 TCP 66 60248 > http [ACK] Seq=96 Ack=13033 Win=52992 Len=0 TSval=12335409 TSecr=834038481
 14   0.011123 54.192.157.146 -> 172.31.29.138 TCP 13098 [TCP segment of a reassembled PDU]
 15   0.011133 172.31.29.138 -> 54.192.157.146 TCP 66 60248 > http [ACK] Seq=96 Ack=26065 Win=79104 Len=0 TSval=12335409 TSecr=834038481
 16   0.011599 54.192.157.146 -> 172.31.29.138 TCP 11650 [TCP segment of a reassembled PDU]
 17   0.011608 172.31.29.138 -> 54.192.157.146 TCP 66 60248 > http [ACK] Seq=96 Ack=37649 Win=98944 Len=0 TSval=12335409 TSecr=834038481
 18   0.011621 54.192.157.146 -> 172.31.29.138 TCP 1514 [TCP segment of a reassembled PDU]
 19   0.011624 172.31.29.138 -> 54.192.157.146 TCP 66 60248 > http [ACK] Seq=96 Ack=39097 Win=97536 Len=0 TSval=12335409 TSecr=834038481
 20   0.012078 54.192.157.146 -> 172.31.29.138 TCP 5858 [TCP segment of a reassembled PDU]
 21   0.012084 172.31.29.138 -> 54.192.157.146 TCP 66 60248 > http [ACK] Seq=96 Ack=44889 Win=108416 Len=0 TSval=12335409 TSecr=834038481
 22   0.012171 54.192.157.146 -> 172.31.29.138 TCP 15994 [TCP segment of a reassembled PDU]
 23   0.012181 172.31.29.138 -> 54.192.157.146 TCP 66 60248 > http [ACK] Seq=96 Ack=60817 Win=92544 Len=0 TSval=12335409 TSecr=834038481
 24   0.012574 54.192.157.146 -> 172.31.29.138 TCP 4410 [TCP segment of a reassembled PDU]
 25   0.012580 172.31.29.138 -> 54.192.157.146 TCP 66 60248 > http [ACK] Seq=96 Ack=65161 Win=109056 Len=0 TSval=12335409 TSecr=834038481
 26   0.012672 54.192.157.146 -> 172.31.29.138 TCP 20338 [TCP segment of a reassembled PDU]
 27   0.012683 172.31.29.138 -> 54.192.157.146 TCP 66 60248 > http [ACK] Seq=96 Ack=85433 Win=88832 Len=0 TSval=12335409 TSecr=834038481
 28   0.013359 54.192.157.146 -> 172.31.29.138 TCP 8754 [TCP segment of a reassembled PDU]
 29   0.013366 172.31.29.138 -> 54.192.157.146 TCP 66 60248 > http [ACK] Seq=96 Ack=94121 Win=103680 Len=0 TSval=12335409 TSecr=834038481
 30   0.013449 54.192.157.146 -> 172.31.29.138 TCP 10202 [TCP segment of a reassembled PDU]
 31   0.013457 172.31.29.138 -> 54.192.157.146 TCP 66 60248 > http [ACK] Seq=96 Ack=104257 Win=101248 Len=0 TSval=12335409 TSecr=834038481
 32   0.013890 54.192.157.146 -> 172.31.29.138 TCP 8754 [TCP segment of a reassembled PDU]
 33   0.013897 172.31.29.138 -> 54.192.157.146 TCP 66 60248 > http [ACK] Seq=96 Ack=112945 Win=103680 Len=0 TSval=12335410 TSecr=834038481
 34   0.013985 54.192.157.146 -> 172.31.29.138 TCP 17952 [TCP segment of a reassembled PDU]
 35   0.013997 172.31.29.138 -> 54.192.157.146 TCP 66 60248 > http [ACK] Seq=96 Ack=130831 Win=144896 Len=0 TSval=12335410 TSecr=834038481
 36   0.014383 54.192.157.146 -> 172.31.29.138 TCP 2962 [TCP segment of a reassembled PDU]
 37   0.014389 172.31.29.138 -> 54.192.157.146 TCP 66 60248 > http [ACK] Seq=96 Ack=133727 Win=150656 Len=0 TSval=12335410 TSecr=834038481
 38   0.014726 54.192.157.146 -> 172.31.29.138 TCP 20338 [TCP segment of a reassembled PDU]
 39   0.014738 172.31.29.138 -> 54.192.157.146 TCP 66 60248 > http [ACK] Seq=96 Ack=153999 Win=191232 Len=0 TSval=12335410 TSecr=834038482
 40   0.014789 54.192.157.146 -> 172.31.29.138 TCP 10202 [TCP segment of a reassembled PDU]
 41   0.014809 172.31.29.138 -> 54.192.157.146 TCP 66 60248 > http [ACK] Seq=96 Ack=164135 Win=211456 Len=0 TSval=12335410 TSecr=834038482
 42   0.015441 54.192.157.146 -> 172.31.29.138 TCP 11650 [TCP segment of a reassembled PDU]
 43   0.015449 172.31.29.138 -> 54.192.157.146 TCP 66 60248 > http [ACK] Seq=96 Ack=175719 Win=234624 Len=0 TSval=12335410 TSecr=834038482
 44   0.015538 54.192.157.146 -> 172.31.29.138 TCP 14546 [TCP segment of a reassembled PDU]
 45   0.015547 172.31.29.138 -> 54.192.157.146 TCP 66 60248 > http [ACK] Seq=96 Ack=190199 Win=263552 Len=0 TSval=12335410 TSecr=834038482
 46   0.016171 54.192.157.146 -> 172.31.29.138 TCP 7306 [TCP segment of a reassembled PDU]
 47   0.016178 172.31.29.138 -> 54.192.157.146 TCP 66 60248 > http [ACK] Seq=96 Ack=197439 Win=278016 Len=0 TSval=12335410 TSecr=834038482
 48   0.016351 54.192.157.146 -> 172.31.29.138 TCP 29026 [TCP segment of a reassembled PDU]
 49   0.016368 172.31.29.138 -> 54.192.157.146 TCP 66 60248 > http [ACK] Seq=96 Ack=226399 Win=336000 Len=0 TSval=12335410 TSecr=834038482
 50   0.016390 54.192.157.146 -> 172.31.29.138 TCP 4410 [TCP segment of a reassembled PDU]
 51   0.016394 172.31.29.138 -> 54.192.157.146 TCP 66 60248 > http [ACK] Seq=96 Ack=230743 Win=344704 Len=0 TSval=12335410 TSecr=834038482
 52   0.016936 54.192.157.146 -> 172.31.29.138 TCP 7306 [TCP segment of a reassembled PDU]
 53   0.016943 172.31.29.138 -> 54.192.157.146 TCP 66 60248 > http [ACK] Seq=96 Ack=237983 Win=359168 Len=0 TSval=12335410 TSecr=834038482
 54   0.017083 54.192.157.146 -> 172.31.29.138 TCP 23986 [TCP segment of a reassembled PDU]
 55   0.017096 172.31.29.138 -> 54.192.157.146 TCP 66 60248 > http [ACK] Seq=96 Ack=261903 Win=407040 Len=0 TSval=12335410 TSecr=834038482
 56   0.018489 54.192.157.146 -> 172.31.29.138 TCP 2962 [TCP segment of a reassembled PDU]
 57   0.018496 172.31.29.138 -> 54.192.157.146 TCP 66 60248 > http [ACK] Seq=96 Ack=264799 Win=412800 Len=0 TSval=12335411 TSecr=834038482
 58   0.018796 54.192.157.146 -> 172.31.29.138 TCP 13098 [TCP segment of a reassembled PDU]
 59   0.018804 172.31.29.138 -> 54.192.157.146 TCP 66 60248 > http [ACK] Seq=96 Ack=277831 Win=438784 Len=0 TSval=12335411 TSecr=834038482
 60   0.018967 54.192.157.146 -> 172.31.29.138 TCP 29026 [TCP segment of a reassembled PDU]
 61   0.018978 172.31.29.138 -> 54.192.157.146 TCP 66 60248 > http [ACK] Seq=96 Ack=306791 Win=496768 Len=0 TSval=12335411 TSecr=834038482
 62   0.019525 54.192.157.146 -> 172.31.29.138 TCP 5858 [TCP segment of a reassembled PDU]
 63   0.019531 172.31.29.138 -> 54.192.157.146 TCP 66 60248 > http [ACK] Seq=96 Ack=312583 Win=508288 Len=0 TSval=12335411 TSecr=834038482
 64   0.019690 54.192.157.146 -> 172.31.29.138 TCP 14922 [TCP segment of a reassembled PDU]
 65   0.019700 172.31.29.138 -> 54.192.157.146 TCP 66 60248 > http [ACK] Seq=96 Ack=327439 Win=538112 Len=0 TSval=12335411 TSecr=834038482
 66   0.020516 54.192.157.146 -> 172.31.29.138 TCP 1514 [TCP segment of a reassembled PDU]
 67   0.020521 172.31.29.138 -> 54.192.157.146 TCP 66 60248 > http [ACK] Seq=96 Ack=328887 Win=540928 Len=0 TSval=12335411 TSecr=834038482
 68   0.020586 54.192.157.146 -> 172.31.29.138 TCP 15994 [TCP segment of a reassembled PDU]
 69   0.020596 172.31.29.138 -> 54.192.157.146 TCP 66 60248 > http [ACK] Seq=96 Ack=344815 Win=572800 Len=0 TSval=12335411 TSecr=834038482
 70   0.020609 54.192.157.146 -> 172.31.29.138 TCP 138 [TCP segment of a reassembled PDU]
 71   0.020622 172.31.29.138 -> 54.192.157.146 TCP 66 60248 > http [ACK] Seq=96 Ack=344887 Win=572800 Len=0 TSval=12335411 TSecr=834038482
 72   0.020674 54.192.157.146 -> 172.31.29.138 TCP 21714 [TCP segment of a reassembled PDU]
 73   0.020684 172.31.29.138 -> 54.192.157.146 TCP 66 60248 > http [ACK] Seq=96 Ack=366535 Win=616064 Len=0 TSval=12335411 TSecr=834038482
 74   0.021056 54.192.157.146 -> 172.31.29.138 TCP 4410 [TCP segment of a reassembled PDU]
 75   0.021063 172.31.29.138 -> 54.192.157.146 TCP 66 60248 > http [ACK] Seq=96 Ack=370879 Win=624768 Len=0 TSval=12335411 TSecr=834038482
 76   0.021239 54.192.157.146 -> 172.31.29.138 TCP 17442 [TCP segment of a reassembled PDU]
 77   0.021250 172.31.29.138 -> 54.192.157.146 TCP 66 60248 > http [ACK] Seq=96 Ack=388255 Win=659584 Len=0 TSval=12335411 TSecr=834038482
 78   0.021258 54.192.157.146 -> 172.31.29.138 TCP 4410 [TCP segment of a reassembled PDU]
 79   0.021275 172.31.29.138 -> 54.192.157.146 TCP 66 60248 > http [ACK] Seq=96 Ack=392599 Win=668288 Len=0 TSval=12335411 TSecr=834038482
 80   0.021280 54.192.157.146 -> 172.31.29.138 TCP 442 [TCP segment of a reassembled PDU]
 81   0.021303 172.31.29.138 -> 54.192.157.146 TCP 66 60248 > http [ACK] Seq=96 Ack=392975 Win=668288 Len=0 TSval=12335411 TSecr=834038482
 82   0.022312 54.192.157.146 -> 172.31.29.138 TCP 1514 [TCP segment of a reassembled PDU]
 83   0.022326 172.31.29.138 -> 54.192.157.146 TCP 66 60248 > http [ACK] Seq=96 Ack=394423 Win=671104 Len=0 TSval=12335412 TSecr=834038482
 84   0.022549 54.192.157.146 -> 172.31.29.138 TCP 26130 [TCP segment of a reassembled PDU]
 85   0.022563 172.31.29.138 -> 54.192.157.146 TCP 66 60248 > http [ACK] Seq=96 Ack=420487 Win=723200 Len=0 TSval=12335412 TSecr=834038482
 86   0.022576 54.192.157.146 -> 172.31.29.138 TCP 15994 [TCP segment of a reassembled PDU]
 87   0.022588 172.31.29.138 -> 54.192.157.146 TCP 66 60248 > http [ACK] Seq=96 Ack=436415 Win=755072 Len=0 TSval=12335412 TSecr=834038482
 88   0.023137 54.192.157.146 -> 172.31.29.138 TCP 7306 [TCP segment of a reassembled PDU]
 89   0.023144 172.31.29.138 -> 54.192.157.146 TCP 66 60248 > http [ACK] Seq=96 Ack=443655 Win=769536 Len=0 TSval=12335412 TSecr=834038482
 90   0.023231 54.192.157.146 -> 172.31.29.138 TCP 14922 [TCP segment of a reassembled PDU]
 91   0.023239 172.31.29.138 -> 54.192.157.146 TCP 66 60248 > http [ACK] Seq=96 Ack=458511 Win=799360 Len=0 TSval=12335412 TSecr=834038482
 92   0.024851 54.192.157.146 -> 172.31.29.138 TCP 1514 [TCP segment of a reassembled PDU]
 93   0.024856 172.31.29.138 -> 54.192.157.146 TCP 66 60248 > http [ACK] Seq=96 Ack=459959 Win=802176 Len=0 TSval=12335412 TSecr=834038483
 94   0.024961 54.192.157.146 -> 172.31.29.138 TCP 26130 [TCP segment of a reassembled PDU]
 95   0.024975 172.31.29.138 -> 54.192.157.146 TCP 66 60248 > http [ACK] Seq=96 Ack=486023 Win=849280 Len=0 TSval=12335412 TSecr=834038483
 96   0.024988 54.192.157.146 -> 172.31.29.138 TCP 11650 [TCP segment of a reassembled PDU]
 97   0.024995 54.192.157.146 -> 172.31.29.138 TCP 1514 [TCP segment of a reassembled PDU]
 98   0.025008 54.192.157.146 -> 172.31.29.138 TCP 11650 [TCP segment of a reassembled PDU]
 99   0.025015 54.192.157.146 -> 172.31.29.138 TCP 1514 [TCP segment of a reassembled PDU]
100   0.025032 172.31.29.138 -> 54.192.157.146 TCP 66 60248 > http [ACK] Seq=96 Ack=512087 Win=823296 Len=0 TSval=12335412 TSecr=834038483
101   0.025039 54.192.157.146 -> 172.31.29.138 TCP 1514 [TCP segment of a reassembled PDU]
102   0.025637 54.192.157.146 -> 172.31.29.138 TCP 7306 [TCP segment of a reassembled PDU]
103   0.025645 172.31.29.138 -> 54.192.157.146 TCP 66 60248 > http [ACK] Seq=96 Ack=520775 Win=868864 Len=0 TSval=12335412 TSecr=834038483
104   0.025754 54.192.157.146 -> 172.31.29.138 TCP 3338 [TCP segment of a reassembled PDU]
105   0.025759 172.31.29.138 -> 54.192.157.146 TCP 66 60248 > http [ACK] Seq=96 Ack=524047 Win=868864 Len=0 TSval=12335413 TSecr=834038483
106   0.028198 54.192.157.146 -> 172.31.29.138 TCP 2962 [TCP segment of a reassembled PDU]
107   0.028203 172.31.29.138 -> 54.192.157.146 TCP 66 60248 > http [ACK] Seq=96 Ack=526943 Win=874624 Len=0 TSval=12335413 TSecr=834038483
108   0.028301 54.192.157.146 -> 172.31.29.138 TCP 20338 [TCP segment of a reassembled PDU]
109   0.028327 172.31.29.138 -> 54.192.157.146 TCP 66 60248 > http [ACK] Seq=96 Ack=547215 Win=858752 Len=0 TSval=12335413 TSecr=834038483
110   0.028336 54.192.157.146 -> 172.31.29.138 TCP 5858 [TCP segment of a reassembled PDU]
111   0.028353 172.31.29.138 -> 54.192.157.146 TCP 66 60248 > http [ACK] Seq=96 Ack=553007 Win=874624 Len=0 TSval=12335413 TSecr=834038483
112   0.028455 54.192.157.146 -> 172.31.29.138 TCP 33370 [TCP segment of a reassembled PDU]
113   0.028483 172.31.29.138 -> 54.192.157.146 TCP 66 60248 > http [ACK] Seq=96 Ack=586311 Win=841344 Len=0 TSval=12335413 TSecr=834038483
114   0.029245 54.192.157.146 -> 172.31.29.138 TCP 8754 [TCP segment of a reassembled PDU]
115   0.029253 172.31.29.138 -> 54.192.157.146 TCP 66 60248 > http [ACK] Seq=96 Ack=594999 Win=877824 Len=0 TSval=12335413 TSecr=834038483
116   0.029417 54.192.157.146 -> 172.31.29.138 TCP 26130 [TCP segment of a reassembled PDU]
117   0.029485 172.31.29.138 -> 54.192.157.146 TCP 66 60248 > http [ACK] Seq=96 Ack=621063 Win=851840 Len=0 TSval=12335413 TSecr=834038483
118   0.029528 54.192.157.146 -> 172.31.29.138 TCP 26130 [TCP segment of a reassembled PDU]
119   0.029566 172.31.29.138 -> 54.192.157.146 TCP 66 60248 > http [ACK] Seq=96 Ack=647127 Win=849280 Len=0 TSval=12335413 TSecr=834038483
120   0.029605 54.192.157.146 -> 172.31.29.138 TCP 7306 [TCP segment of a reassembled PDU]
121   0.029611 172.31.29.138 -> 54.192.157.146 TCP 66 60248 > http [ACK] Seq=96 Ack=654367 Win=880128 Len=0 TSval=12335413 TSecr=834038483
122   0.030006 54.192.157.146 -> 172.31.29.138 TCP 818 [TCP segment of a reassembled PDU]
123   0.030021 172.31.29.138 -> 54.192.157.146 TCP 66 60248 > http [ACK] Seq=96 Ack=655119 Win=892032 Len=0 TSval=12335414 TSecr=834038483
124   0.030499 54.192.157.146 -> 172.31.29.138 TCP 5858 [TCP segment of a reassembled PDU]
125   0.030515 172.31.29.138 -> 54.192.157.146 TCP 66 60248 > http [ACK] Seq=96 Ack=660911 Win=892032 Len=0 TSval=12335414 TSecr=834038483
126   0.030602 54.192.157.146 -> 172.31.29.138 TCP 8754 [TCP segment of a reassembled PDU]
127   0.030621 172.31.29.138 -> 54.192.157.146 TCP 66 60248 > http [ACK] Seq=96 Ack=669599 Win=892032 Len=0 TSval=12335414 TSecr=834038483
128   0.030691 54.192.157.146 -> 172.31.29.138 TCP 26130 [TCP segment of a reassembled PDU]
129   0.030717 172.31.29.138 -> 54.192.157.146 TCP 66 60248 > http [ACK] Seq=96 Ack=695663 Win=866048 Len=0 TSval=12335414 TSecr=834038483
130   0.030746 54.192.157.146 -> 172.31.29.138 TCP 25058 [TCP segment of a reassembled PDU]
131   0.030766 172.31.29.138 -> 54.192.157.146 TCP 66 60248 > http [ACK] Seq=96 Ack=720655 Win=849280 Len=0 TSval=12335414 TSecr=834038483
132   0.033349 54.192.157.146 -> 172.31.29.138 TCP 2962 [TCP segment of a reassembled PDU]
133   0.033355 172.31.29.138 -> 54.192.157.146 TCP 66 60248 > http [ACK] Seq=96 Ack=723551 Win=887296 Len=0 TSval=12335414 TSecr=834038483
134   0.033497 54.192.157.146 -> 172.31.29.138 TCP 33370 [TCP segment of a reassembled PDU]
135   0.033524 172.31.29.138 -> 54.192.157.146 TCP 66 60248 > http [ACK] Seq=96 Ack=756855 Win=854016 Len=0 TSval=12335414 TSecr=834038483
136   0.033581 54.192.157.146 -> 172.31.29.138 TCP 4410 [TCP segment of a reassembled PDU]
137   0.033587 172.31.29.138 -> 54.192.157.146 TCP 66 60248 > http [ACK] Seq=96 Ack=761199 Win=884864 Len=0 TSval=12335414 TSecr=834038483
138   0.033696 54.192.157.146 -> 172.31.29.138 TCP 25058 [TCP segment of a reassembled PDU]
139   0.033723 172.31.29.138 -> 54.192.157.146 TCP 66 60248 > http [ACK] Seq=96 Ack=786191 Win=859904 Len=0 TSval=12335415 TSecr=834038483
140   0.036394 54.192.157.146 -> 172.31.29.138 TCP 2962 [TCP segment of a reassembled PDU]
141   0.036399 172.31.29.138 -> 54.192.157.146 TCP 66 60248 > http [ACK] Seq=96 Ack=789087 Win=887296 Len=0 TSval=12335415 TSecr=834038484
142   0.036517 54.192.157.146 -> 172.31.29.138 TCP 29026 [TCP segment of a reassembled PDU]
143   0.036544 54.192.157.146 -> 172.31.29.138 TCP 7306 [TCP segment of a reassembled PDU]
144   0.036558 172.31.29.138 -> 54.192.157.146 TCP 66 60248 > http [ACK] Seq=96 Ack=825287 Win=851200 Len=0 TSval=12335415 TSecr=834038484
145   0.036644 54.192.157.146 -> 172.31.29.138 TCP 26506 [TCP segment of a reassembled PDU]
146   0.036792 172.31.29.138 -> 54.192.157.146 TCP 66 60248 > http [ACK] Seq=96 Ack=851727 Win=846720 Len=0 TSval=12335415 TSecr=834038484
147   0.038967 54.192.157.146 -> 172.31.29.138 TCP 8754 [TCP segment of a reassembled PDU]
148   0.038975 172.31.29.138 -> 54.192.157.146 TCP 66 60248 > http [ACK] Seq=96 Ack=860415 Win=877824 Len=0 TSval=12335416 TSecr=834038484
149   0.039109 54.192.157.146 -> 172.31.29.138 TCP 18890 [TCP segment of a reassembled PDU]
150   0.039132 54.192.157.146 -> 172.31.29.138 TCP 5858 [TCP segment of a reassembled PDU]
151   0.039144 172.31.29.138 -> 54.192.157.146 TCP 66 60248 > http [ACK] Seq=96 Ack=885031 Win=853248 Len=0 TSval=12335416 TSecr=834038484
152   0.039203 54.192.157.146 -> 172.31.29.138 TCP 26130 [TCP segment of a reassembled PDU]
153   0.039229 54.192.157.146 -> 172.31.29.138 TCP 6234 [TCP segment of a reassembled PDU]
154   0.039241 172.31.29.138 -> 54.192.157.146 TCP 66 60248 > http [ACK] Seq=96 Ack=917263 Win=837248 Len=0 TSval=12335416 TSecr=834038484
155   0.040467 54.192.157.146 -> 172.31.29.138 TCP 1514 [TCP segment of a reassembled PDU]
156   0.040558 54.192.157.146 -> 172.31.29.138 TCP 21786 [TCP segment of a reassembled PDU]
157   0.040570 172.31.29.138 -> 54.192.157.146 TCP 66 60248 > http [ACK] Seq=96 Ack=940431 Win=856320 Len=0 TSval=12335416 TSecr=834038484
158   0.040581 54.192.157.146 -> 172.31.29.138 TCP 4410 [TCP segment of a reassembled PDU]
159   0.040599 172.31.29.138 -> 54.192.157.146 TCP 66 60248 > http [ACK] Seq=96 Ack=944775 Win=852096 Len=0 TSval=12335416 TSecr=834038484
160   0.040622 54.192.157.146 -> 172.31.29.138 TCP 4410 [TCP segment of a reassembled PDU]
161   0.040627 172.31.29.138 -> 54.192.157.146 TCP 66 60248 > http [ACK] Seq=96 Ack=949119 Win=884864 Len=0 TSval=12335416 TSecr=834038484
162   0.040706 54.192.157.146 -> 172.31.29.138 TCP 33746 [TCP segment of a reassembled PDU]
163   0.040855 172.31.29.138 -> 54.192.157.146 TCP 66 60248 > http [ACK] Seq=96 Ack=982799 Win=851200 Len=0 TSval=12335416 TSecr=834038484
164   0.042258 54.192.157.146 -> 172.31.29.138 TCP 2962 [TCP segment of a reassembled PDU]
165   0.042263 172.31.29.138 -> 54.192.157.146 TCP 66 60248 > http [ACK] Seq=96 Ack=985695 Win=887296 Len=0 TSval=12335417 TSecr=834038484
166   0.042533 54.192.157.146 -> 172.31.29.138 TCP 7306 [TCP segment of a reassembled PDU]
167   0.042550 172.31.29.138 -> 54.192.157.146 TCP 66 60248 > http [ACK] Seq=96 Ack=992935 Win=892032 Len=0 TSval=12335417 TSecr=834038484
168   0.042707 54.192.157.146 -> 172.31.29.138 TCP 26130 [TCP segment of a reassembled PDU]
169   0.042732 172.31.29.138 -> 54.192.157.146 TCP 66 60248 > http [ACK] Seq=96 Ack=1018999 Win=866048 Len=0 TSval=12335417 TSecr=834038484
170   0.042754 54.192.157.146 -> 172.31.29.138 TCP 27578 [TCP segment of a reassembled PDU]
171   0.042781 172.31.29.138 -> 54.192.157.146 TCP 66 60248 > http [ACK] Seq=96 Ack=1046511 Win=846720 Len=0 TSval=12335417 TSecr=834038484
172   0.043030 54.192.157.146 -> 172.31.29.138 HTTP 2589 HTTP/1.1 200 OK  (application/octet-stream)
173   0.043035 172.31.29.138 -> 54.192.157.146 TCP 66 60248 > http [ACK] Seq=96 Ack=1049034 Win=887296 Len=0 TSval=12335417 TSecr=834038484
174   0.043159 172.31.29.138 -> 54.192.157.146 TCP 66 60248 > http [FIN, ACK] Seq=96 Ack=1049034 Win=892032 Len=0 TSval=12335417 TSecr=834038484
175   0.043766 54.192.157.146 -> 172.31.29.138 TCP 66 http > 60248 [FIN, ACK] Seq=1049034 Ack=97 Win=14592 Len=0 TSval=834038484 TSecr=12335417
176   0.043773 172.31.29.138 -> 54.192.157.146 TCP 66 60248 > http [ACK] Seq=97 Ack=1049035 Win=892032 Len=0 TSval=12335417 TSecr=834038484
