[Measurement for 10mb at 19:32:41 19.32.2014] 
Tshark:

  1   0.000000 172.31.36.109 -> 172.31.0.2   DNS 89 Standard query 0xaecf  A d1xzxs93r3iphc.cloudfront.net
  2   0.000026 172.31.36.109 -> 172.31.0.2   DNS 89 Standard query 0xc5a9  AAAA d1xzxs93r3iphc.cloudfront.net
  3   0.000648   172.31.0.2 -> 172.31.36.109 DNS 217 Standard query response 0xaecf  A 54.230.20.43 A 54.230.20.174 A 54.230.20.192 A 54.230.21.133 A 54.230.21.159 A 54.230.22.78 A 54.230.22.217 A 54.230.23.102
  4   0.000670   172.31.0.2 -> 172.31.36.109 DNS 170 Standard query response 0xc5a9 
  5   0.003865 172.31.36.109 -> 54.230.20.43 TCP 74 51391 > http [SYN] Seq=0 Win=26883 Len=0 MSS=8961 SACK_PERM=1 TSval=22312065 TSecr=0 WS=128
  6   0.098567 54.230.20.43 -> 172.31.36.109 TCP 74 http > 51391 [SYN, ACK] Seq=0 Ack=1 Win=14480 Len=0 MSS=1460 SACK_PERM=1 TSval=948678871 TSecr=22312065 WS=128
  7   0.098586 172.31.36.109 -> 54.230.20.43 TCP 66 51391 > http [ACK] Seq=1 Ack=1 Win=27008 Len=0 TSval=22312089 TSecr=948678871
  8   0.098658 172.31.36.109 -> 54.230.20.43 HTTP 163 GET /10mb HTTP/1.1 
  9   0.193565 54.230.20.43 -> 172.31.36.109 TCP 66 http > 51391 [ACK] Seq=1 Ack=98 Win=14592 Len=0 TSval=948678881 TSecr=22312089
 10   0.199790 54.230.20.43 -> 172.31.36.109 TCP 8754 [TCP segment of a reassembled PDU]
 11   0.199804 172.31.36.109 -> 54.230.20.43 TCP 66 51391 > http [ACK] Seq=98 Ack=8689 Win=44288 Len=0 TSval=22312114 TSecr=948678881
 12   0.199968 54.230.20.43 -> 172.31.36.109 TCP 4410 [TCP segment of a reassembled PDU]
 13   0.199975 172.31.36.109 -> 54.230.20.43 TCP 66 51391 > http [ACK] Seq=98 Ack=13033 Win=52992 Len=0 TSval=22312114 TSecr=948678881
 14   0.200739 54.230.20.43 -> 172.31.36.109 TCP 1514 [TCP segment of a reassembled PDU]
 15   0.200744 172.31.36.109 -> 54.230.20.43 TCP 66 51391 > http [ACK] Seq=98 Ack=14481 Win=55936 Len=0 TSval=22312114 TSecr=948678881
 16   0.294540 54.230.20.43 -> 172.31.36.109 TCP 10202 [TCP segment of a reassembled PDU]
 17   0.294555 172.31.36.109 -> 54.230.20.43 TCP 66 51391 > http [ACK] Seq=98 Ack=24617 Win=76160 Len=0 TSval=22312138 TSecr=948678891
 18   0.294953 54.230.20.43 -> 172.31.36.109 TCP 2962 [TCP segment of a reassembled PDU]
 19   0.294960 172.31.36.109 -> 54.230.20.43 TCP 66 51391 > http [ACK] Seq=98 Ack=27513 Win=81920 Len=0 TSval=22312138 TSecr=948678891
 20   0.389562 54.230.20.43 -> 172.31.36.109 TCP 13098 [TCP segment of a reassembled PDU]
 21   0.389579 172.31.36.109 -> 54.230.20.43 TCP 66 51391 > http [ACK] Seq=98 Ack=40545 Win=96512 Len=0 TSval=22312162 TSecr=948678900
 22   0.389590 54.230.20.43 -> 172.31.36.109 TCP 4410 [TCP segment of a reassembled PDU]
 23   0.389594 172.31.36.109 -> 54.230.20.43 TCP 66 51391 > http [ACK] Seq=98 Ack=44889 Win=92288 Len=0 TSval=22312162 TSecr=948678900
 24   0.389677 54.230.20.43 -> 172.31.36.109 TCP 4410 [TCP segment of a reassembled PDU]
 25   0.389683 172.31.36.109 -> 54.230.20.43 TCP 66 51391 > http [ACK] Seq=98 Ack=49233 Win=109056 Len=0 TSval=22312162 TSecr=948678900
 26   0.484567 54.230.20.43 -> 172.31.36.109 TCP 4410 [TCP segment of a reassembled PDU]
 27   0.484576 172.31.36.109 -> 54.230.20.43 TCP 66 51391 > http [ACK] Seq=98 Ack=53577 Win=109056 Len=0 TSval=22312185 TSecr=948678910
 28   0.484600 54.230.20.43 -> 172.31.36.109 TCP 21786 [TCP segment of a reassembled PDU]
 29   0.484611 172.31.36.109 -> 54.230.20.43 TCP 66 51391 > http [ACK] Seq=98 Ack=75297 Win=87424 Len=0 TSval=22312185 TSecr=948678910
 30   0.579498 54.230.20.43 -> 172.31.36.109 TCP 7306 [TCP segment of a reassembled PDU]
 31   0.579507 172.31.36.109 -> 54.230.20.43 TCP 66 51391 > http [ACK] Seq=98 Ack=82537 Win=105984 Len=0 TSval=22312209 TSecr=948678919
 32   0.579738 54.230.20.43 -> 172.31.36.109 TCP 20338 [TCP segment of a reassembled PDU]
 33   0.579750 172.31.36.109 -> 54.230.20.43 TCP 66 51391 > http [ACK] Seq=98 Ack=102809 Win=149632 Len=0 TSval=22312209 TSecr=948678919
 34   0.579759 54.230.20.43 -> 172.31.36.109 TCP 1514 [TCP segment of a reassembled PDU]
 35   0.579761 172.31.36.109 -> 54.230.20.43 TCP 66 51391 > http [ACK] Seq=98 Ack=104257 Win=152448 Len=0 TSval=22312209 TSecr=948678919
 36   0.674168 54.230.20.43 -> 172.31.36.109 TCP 1514 [TCP segment of a reassembled PDU]
