[Measurement for 10mb at 02:32:31 20.32.2014] 
Tshark:

  1   0.000000 172.31.36.109 -> 172.31.0.2   DNS 89 Standard query 0xd7da  A d1xzxs93r3iphc.cloudfront.net
  2   0.000026 172.31.36.109 -> 172.31.0.2   DNS 89 Standard query 0xa3a9  AAAA d1xzxs93r3iphc.cloudfront.net
  3   0.000462   172.31.0.2 -> 172.31.36.109 DNS 170 Standard query response 0xa3a9 
  4   0.000474   172.31.0.2 -> 172.31.36.109 DNS 217 Standard query response 0xd7da  A 216.137.41.227 A 54.230.20.174 A 54.230.21.108 A 54.230.22.176 A 54.230.23.30 A 54.230.23.241 A 216.137.41.24 A 216.137.41.134
  5   0.003887 172.31.36.109 -> 216.137.41.227 TCP 74 54365 > http [SYN] Seq=0 Win=26883 Len=0 MSS=8961 SACK_PERM=1 TSval=28609554 TSecr=0 WS=128
  6   0.092481 216.137.41.227 -> 172.31.36.109 TCP 74 http > 54365 [SYN, ACK] Seq=0 Ack=1 Win=14480 Len=0 MSS=1460 SACK_PERM=1 TSval=940056105 TSecr=28609554 WS=128
  7   0.092504 172.31.36.109 -> 216.137.41.227 TCP 66 54365 > http [ACK] Seq=1 Ack=1 Win=27008 Len=0 TSval=28609576 TSecr=940056105
  8   0.092572 172.31.36.109 -> 216.137.41.227 HTTP 163 GET /10mb HTTP/1.1 
  9   0.180900 216.137.41.227 -> 172.31.36.109 TCP 66 http > 54365 [ACK] Seq=1 Ack=98 Win=14592 Len=0 TSval=940056114 TSecr=28609576
 10   0.188123 216.137.41.227 -> 172.31.36.109 TCP 5858 [TCP segment of a reassembled PDU]
 11   0.188138 172.31.36.109 -> 216.137.41.227 TCP 66 54365 > http [ACK] Seq=98 Ack=5793 Win=38528 Len=0 TSval=28609600 TSecr=940056115
 12   0.188151 216.137.41.227 -> 172.31.36.109 TCP 7306 [TCP segment of a reassembled PDU]
 13   0.188158 172.31.36.109 -> 216.137.41.227 TCP 66 54365 > http [ACK] Seq=98 Ack=13033 Win=52992 Len=0 TSval=28609600 TSecr=940056115
 14   0.188291 216.137.41.227 -> 172.31.36.109 TCP 1514 [TCP segment of a reassembled PDU]
 15   0.188297 172.31.36.109 -> 216.137.41.227 TCP 66 54365 > http [ACK] Seq=98 Ack=14481 Win=55936 Len=0 TSval=28609600 TSecr=940056115
 16   0.276519 216.137.41.227 -> 172.31.36.109 TCP 11650 [TCP segment of a reassembled PDU]
 17   0.276531 172.31.36.109 -> 216.137.41.227 TCP 66 54365 > http [ACK] Seq=98 Ack=26065 Win=79104 Len=0 TSval=28609622 TSecr=940056124
 18   0.276614 216.137.41.227 -> 172.31.36.109 TCP 1514 [TCP segment of a reassembled PDU]
 19   0.276619 172.31.36.109 -> 216.137.41.227 TCP 66 54365 > http [ACK] Seq=98 Ack=27513 Win=81920 Len=0 TSval=28609622 TSecr=940056124
 20   0.365065 216.137.41.227 -> 172.31.36.109 TCP 5858 [TCP segment of a reassembled PDU]
 21   0.365073 172.31.36.109 -> 216.137.41.227 TCP 66 54365 > http [ACK] Seq=98 Ack=33305 Win=93568 Len=0 TSval=28609644 TSecr=940056133
 22   0.365097 216.137.41.227 -> 172.31.36.109 TCP 15994 [TCP segment of a reassembled PDU]
 23   0.365106 172.31.36.109 -> 216.137.41.227 TCP 66 54365 > http [ACK] Seq=98 Ack=49233 Win=82048 Len=0 TSval=28609644 TSecr=940056133
 24   0.453379 216.137.41.227 -> 172.31.36.109 TCP 4410 [TCP segment of a reassembled PDU]
