[Measurement for 10mb at 05:32:45 20.32.2014] 
Tshark:

  1   0.000000 172.31.36.109 -> 172.31.0.2   DNS 89 Standard query 0xd3c4  A d1xzxs93r3iphc.cloudfront.net
  2   0.000029 172.31.36.109 -> 172.31.0.2   DNS 89 Standard query 0x4171  AAAA d1xzxs93r3iphc.cloudfront.net
  3   0.000610   172.31.0.2 -> 172.31.36.109 DNS 217 Standard query response 0xd3c4  A 54.192.30.214 A 54.230.30.189 A 54.230.30.210 A 54.230.30.222 A 54.230.30.245 A 54.230.30.249 A 54.192.29.221 A 54.192.30.188
  4   0.000620   172.31.0.2 -> 172.31.36.109 DNS 170 Standard query response 0x4171 
  5   0.003919 172.31.36.109 -> 54.192.30.214 TCP 74 50425 > http [SYN] Seq=0 Win=26883 Len=0 MSS=8961 SACK_PERM=1 TSval=31312877 TSecr=0 WS=128
  6   0.004957 54.192.30.214 -> 172.31.36.109 TCP 74 http > 50425 [SYN, ACK] Seq=0 Ack=1 Win=14480 Len=0 MSS=1460 SACK_PERM=1 TSval=715383993 TSecr=31312877 WS=128
  7   0.004970 172.31.36.109 -> 54.192.30.214 TCP 66 50425 > http [ACK] Seq=1 Ack=1 Win=27008 Len=0 TSval=31312878 TSecr=715383993
  8   0.005010 172.31.36.109 -> 54.192.30.214 HTTP 163 GET /10mb HTTP/1.1 
  9   0.006257 54.192.30.214 -> 172.31.36.109 TCP 66 http > 50425 [ACK] Seq=1 Ack=98 Win=14592 Len=0 TSval=715383993 TSecr=31312878
 10   0.026886 54.192.30.214 -> 172.31.36.109 TCP 12716 [TCP segment of a reassembled PDU]
 11   0.026898 172.31.36.109 -> 54.192.30.214 TCP 66 50425 > http [ACK] Seq=98 Ack=12651 Win=52224 Len=0 TSval=31312883 TSecr=715383995
 12   0.026906 54.192.30.214 -> 172.31.36.109 TCP 1514 [TCP segment of a reassembled PDU]
 13   0.026909 172.31.36.109 -> 54.192.30.214 TCP 66 50425 > http [ACK] Seq=98 Ack=14099 Win=55168 Len=0 TSval=31312883 TSecr=715383995
 14   0.028178 54.192.30.214 -> 172.31.36.109 TCP 13098 [TCP segment of a reassembled PDU]
 15   0.028188 172.31.36.109 -> 54.192.30.214 TCP 66 50425 > http [ACK] Seq=98 Ack=27131 Win=81152 Len=0 TSval=31312883 TSecr=715383995
 16   0.029338 54.192.30.214 -> 172.31.36.109 TCP 2962 [TCP segment of a reassembled PDU]
 17   0.029344 172.31.36.109 -> 54.192.30.214 TCP 66 50425 > http [ACK] Seq=98 Ack=30027 Win=87040 Len=0 TSval=31312884 TSecr=715383995
 18   0.029381 54.192.30.214 -> 172.31.36.109 TCP 10202 [TCP segment of a reassembled PDU]
 19   0.029389 172.31.36.109 -> 54.192.30.214 TCP 66 50425 > http [ACK] Seq=98 Ack=40163 Win=101248 Len=0 TSval=31312884 TSecr=715383995
 20   0.030602 54.192.30.214 -> 172.31.36.109 TCP 4410 [TCP segment of a reassembled PDU]
 21   0.030608 172.31.36.109 -> 54.192.30.214 TCP 66 50425 > http [ACK] Seq=98 Ack=44507 Win=115968 Len=0 TSval=31312884 TSecr=715383995
 22   0.030678 54.192.30.214 -> 172.31.36.109 TCP 5858 [TCP segment of a reassembled PDU]
 23   0.030684 172.31.36.109 -> 54.192.30.214 TCP 66 50425 > http [ACK] Seq=98 Ack=50299 Win=127488 Len=0 TSval=31312884 TSecr=715383995
 24   0.030697 54.192.30.214 -> 172.31.36.109 TCP 11650 [TCP segment of a reassembled PDU]
 25   0.030704 172.31.36.109 -> 54.192.30.214 TCP 66 50425 > http [ACK] Seq=98 Ack=61883 Win=150656 Len=0 TSval=31312884 TSecr=715383996
 26   0.038559 54.192.30.214 -> 172.31.36.109 TCP 5858 [TCP segment of a reassembled PDU]
 27   0.038566 172.31.36.109 -> 54.192.30.214 TCP 66 50425 > http [ACK] Seq=98 Ack=67675 Win=162304 Len=0 TSval=31312886 TSecr=715383996
 28   0.038770 54.192.30.214 -> 172.31.36.109 TCP 4410 [TCP segment of a reassembled PDU]
 29   0.038775 172.31.36.109 -> 54.192.30.214 TCP 66 50425 > http [ACK] Seq=98 Ack=72019 Win=171008 Len=0 TSval=31312886 TSecr=715383996
 30   0.038849 54.192.30.214 -> 172.31.36.109 TCP 15994 [TCP segment of a reassembled PDU]
 31   0.038859 172.31.36.109 -> 54.192.30.214 TCP 66 50425 > http [ACK] Seq=98 Ack=87947 Win=172032 Len=0 TSval=31312886 TSecr=715383996
 32   0.039868 54.192.30.214 -> 172.31.36.109 TCP 13098 [TCP segment of a reassembled PDU]
 33   0.039877 172.31.36.109 -> 54.192.30.214 TCP 66 50425 > http [ACK] Seq=98 Ack=100979 Win=176896 Len=0 TSval=31312886 TSecr=715383996
 34   0.040081 54.192.30.214 -> 172.31.36.109 TCP 5858 [TCP segment of a reassembled PDU]
 35   0.040087 172.31.36.109 -> 54.192.30.214 TCP 66 50425 > http [ACK] Seq=98 Ack=106771 Win=188672 Len=0 TSval=31312886 TSecr=715383996
 36   0.040161 54.192.30.214 -> 172.31.36.109 TCP 5858 [TCP segment of a reassembled PDU]
 37   0.040167 172.31.36.109 -> 54.192.30.214 TCP 66 50425 > http [ACK] Seq=98 Ack=112563 Win=188672 Len=0 TSval=31312886 TSecr=715383996
 38   0.040220 54.192.30.214 -> 172.31.36.109 TCP 5858 [TCP segment of a reassembled PDU]
 39   0.040226 172.31.36.109 -> 54.192.30.214 TCP 66 50425 > http [ACK] Seq=98 Ack=118355 Win=188672 Len=0 TSval=31312886 TSecr=715383996
 40   0.041129 54.192.30.214 -> 172.31.36.109 TCP 10202 [TCP segment of a reassembled PDU]
 41   0.041137 172.31.36.109 -> 54.192.30.214 TCP 66 50425 > http [ACK] Seq=98 Ack=128491 Win=181632 Len=0 TSval=31312887 TSecr=715383997
 42   0.041361 54.192.30.214 -> 172.31.36.109 TCP 4410 [TCP segment of a reassembled PDU]
 43   0.041367 172.31.36.109 -> 54.192.30.214 TCP 66 50425 > http [ACK] Seq=98 Ack=132835 Win=177408 Len=0 TSval=31312887 TSecr=715383997
 44   0.041429 54.192.30.214 -> 172.31.36.109 TCP 7306 [TCP segment of a reassembled PDU]
 45   0.041436 172.31.36.109 -> 54.192.30.214 TCP 66 50425 > http [ACK] Seq=98 Ack=140075 Win=212736 Len=0 TSval=31312887 TSecr=715383997
 46   0.041644 54.192.30.214 -> 172.31.36.109 TCP 7306 [TCP segment of a reassembled PDU]
 47   0.041651 172.31.36.109 -> 54.192.30.214 TCP 66 50425 > http [ACK] Seq=98 Ack=147315 Win=227200 Len=0 TSval=31312887 TSecr=715383997
 48   0.042108 54.192.30.214 -> 172.31.36.109 TCP 1514 [TCP segment of a reassembled PDU]
 49   0.042112 172.31.36.109 -> 54.192.30.214 TCP 66 50425 > http [ACK] Seq=98 Ack=148763 Win=230144 Len=0 TSval=31312887 TSecr=715383997
 50   0.042231 54.192.30.214 -> 172.31.36.109 TCP 13098 [TCP segment of a reassembled PDU]
 51   0.042239 172.31.36.109 -> 54.192.30.214 TCP 66 50425 > http [ACK] Seq=98 Ack=161795 Win=256128 Len=0 TSval=31312887 TSecr=715383997
 52   0.042394 54.192.30.214 -> 172.31.36.109 TCP 10202 [TCP segment of a reassembled PDU]
 53   0.042402 172.31.36.109 -> 54.192.30.214 TCP 66 50425 > http [ACK] Seq=98 Ack=171931 Win=276480 Len=0 TSval=31312887 TSecr=715383997
 54   0.042673 54.192.30.214 -> 172.31.36.109 TCP 8754 [TCP segment of a reassembled PDU]
 55   0.042680 172.31.36.109 -> 54.192.30.214 TCP 66 50425 > http [ACK] Seq=98 Ack=180619 Win=293888 Len=0 TSval=31312887 TSecr=715383997
 56   0.043129 54.192.30.214 -> 172.31.36.109 TCP 2962 [TCP segment of a reassembled PDU]
 57   0.043134 172.31.36.109 -> 54.192.30.214 TCP 66 50425 > http [ACK] Seq=98 Ack=183515 Win=299648 Len=0 TSval=31312887 TSecr=715383997
 58   0.043395 54.192.30.214 -> 172.31.36.109 TCP 5858 [TCP segment of a reassembled PDU]
 59   0.043401 172.31.36.109 -> 54.192.30.214 TCP 66 50425 > http [ACK] Seq=98 Ack=189307 Win=311168 Len=0 TSval=31312887 TSecr=715383997
 60   0.043496 54.192.30.214 -> 172.31.36.109 TCP 7124 [TCP segment of a reassembled PDU]
 61   0.043503 172.31.36.109 -> 54.192.30.214 TCP 66 50425 > http [ACK] Seq=98 Ack=196365 Win=325376 Len=0 TSval=31312887 TSecr=715383997
 62   0.049303 54.192.30.214 -> 172.31.36.109 TCP 1514 [TCP segment of a reassembled PDU]
 63   0.049307 172.31.36.109 -> 54.192.30.214 TCP 66 50425 > http [ACK] Seq=98 Ack=197813 Win=328192 Len=0 TSval=31312889 TSecr=715383997
 64   0.049558 54.192.30.214 -> 172.31.36.109 TCP 4410 [TCP segment of a reassembled PDU]
 65   0.049564 172.31.36.109 -> 54.192.30.214 TCP 66 50425 > http [ACK] Seq=98 Ack=202157 Win=336896 Len=0 TSval=31312889 TSecr=715383997
 66   0.049626 54.192.30.214 -> 172.31.36.109 TCP 14546 [TCP segment of a reassembled PDU]
 67   0.049634 172.31.36.109 -> 54.192.30.214 TCP 66 50425 > http [ACK] Seq=98 Ack=216637 Win=365824 Len=0 TSval=31312889 TSecr=715383997
 68   0.049708 54.192.30.214 -> 172.31.36.109 TCP 5858 [TCP segment of a reassembled PDU]
 69   0.049713 172.31.36.109 -> 54.192.30.214 TCP 66 50425 > http [ACK] Seq=98 Ack=222429 Win=377472 Len=0 TSval=31312889 TSecr=715383997
 70   0.049723 54.192.30.214 -> 172.31.36.109 TCP 7306 [TCP segment of a reassembled PDU]
 71   0.049728 172.31.36.109 -> 54.192.30.214 TCP 66 50425 > http [ACK] Seq=98 Ack=229669 Win=391936 Len=0 TSval=31312889 TSecr=715383997
 72   0.049808 54.192.30.214 -> 172.31.36.109 TCP 7306 [TCP segment of a reassembled PDU]
 73   0.049814 172.31.36.109 -> 54.192.30.214 TCP 66 50425 > http [ACK] Seq=98 Ack=236909 Win=406400 Len=0 TSval=31312889 TSecr=715383997
 74   0.049858 54.192.30.214 -> 172.31.36.109 TCP 5858 [TCP segment of a reassembled PDU]
 75   0.049863 172.31.36.109 -> 54.192.30.214 TCP 66 50425 > http [ACK] Seq=98 Ack=242701 Win=418048 Len=0 TSval=31312889 TSecr=715383997
 76   0.050557 54.192.30.214 -> 172.31.36.109 TCP 2962 [TCP segment of a reassembled PDU]
 77   0.050562 172.31.36.109 -> 54.192.30.214 TCP 66 50425 > http [ACK] Seq=98 Ack=245597 Win=423808 Len=0 TSval=31312889 TSecr=715383997
 78   0.050844 54.192.30.214 -> 172.31.36.109 TCP 4410 [TCP segment of a reassembled PDU]
 79   0.050850 172.31.36.109 -> 54.192.30.214 TCP 66 50425 > http [ACK] Seq=98 Ack=249941 Win=432512 Len=0 TSval=31312889 TSecr=715383998
 80   0.050877 54.192.30.214 -> 172.31.36.109 TCP 8754 [TCP segment of a reassembled PDU]
 81   0.050883 172.31.36.109 -> 54.192.30.214 TCP 66 50425 > http [ACK] Seq=98 Ack=258629 Win=449920 Len=0 TSval=31312889 TSecr=715383998
 82   0.050938 54.192.30.214 -> 172.31.36.109 TCP 7306 [TCP segment of a reassembled PDU]
 83   0.050944 172.31.36.109 -> 54.192.30.214 TCP 66 50425 > http [ACK] Seq=98 Ack=265869 Win=464384 Len=0 TSval=31312889 TSecr=715383998
 84   0.051053 54.192.30.214 -> 172.31.36.109 TCP 1514 [TCP segment of a reassembled PDU]
 85   0.051058 172.31.36.109 -> 54.192.30.214 TCP 66 50425 > http [ACK] Seq=98 Ack=267317 Win=467200 Len=0 TSval=31312889 TSecr=715383998
 86   0.051171 54.192.30.214 -> 172.31.36.109 TCP 15994 [TCP segment of a reassembled PDU]
 87   0.051180 172.31.36.109 -> 54.192.30.214 TCP 66 50425 > http [ACK] Seq=98 Ack=283245 Win=499072 Len=0 TSval=31312889 TSecr=715383998
 88   0.051187 54.192.30.214 -> 172.31.36.109 TCP 2962 [TCP segment of a reassembled PDU]
 89   0.051190 172.31.36.109 -> 54.192.30.214 TCP 66 50425 > http [ACK] Seq=98 Ack=286141 Win=500480 Len=0 TSval=31312889 TSecr=715383998
 90   0.051356 54.192.30.214 -> 172.31.36.109 TCP 5858 [TCP segment of a reassembled PDU]
 91   0.051362 172.31.36.109 -> 54.192.30.214 TCP 66 50425 > http [ACK] Seq=98 Ack=291933 Win=516480 Len=0 TSval=31312889 TSecr=715383998
 92   0.052199 54.192.30.214 -> 172.31.36.109 TCP 18890 [TCP segment of a reassembled PDU]
 93   0.052210 172.31.36.109 -> 54.192.30.214 TCP 66 50425 > http [ACK] Seq=98 Ack=310757 Win=500608 Len=0 TSval=31312889 TSecr=715383998
 94   0.052347 54.192.30.214 -> 172.31.36.109 TCP 4410 [TCP segment of a reassembled PDU]
 95   0.052353 172.31.36.109 -> 54.192.30.214 TCP 66 50425 > http [ACK] Seq=98 Ack=315101 Win=524416 Len=0 TSval=31312889 TSecr=715383998
 96   0.052494 54.192.30.214 -> 172.31.36.109 TCP 14546 [TCP segment of a reassembled PDU]
 97   0.052531 172.31.36.109 -> 54.192.30.214 TCP 66 50425 > http [ACK] Seq=98 Ack=329581 Win=525184 Len=0 TSval=31312889 TSecr=715383998
 98   0.052661 54.192.30.214 -> 172.31.36.109 TCP 13098 [TCP segment of a reassembled PDU]
 99   0.052680 172.31.36.109 -> 54.192.30.214 TCP 66 50425 > http [ACK] Seq=98 Ack=342613 Win=525184 Len=0 TSval=31312890 TSecr=715383998
100   0.052706 54.192.30.214 -> 172.31.36.109 TCP 5858 [TCP segment of a reassembled PDU]
101   0.052712 172.31.36.109 -> 54.192.30.214 TCP 66 50425 > http [ACK] Seq=98 Ack=348405 Win=536704 Len=0 TSval=31312890 TSecr=715383998
102   0.053366 54.192.30.214 -> 172.31.36.109 TCP 1514 [TCP segment of a reassembled PDU]
103   0.053382 172.31.36.109 -> 54.192.30.214 TCP 66 50425 > http [ACK] Seq=98 Ack=349853 Win=539648 Len=0 TSval=31312890 TSecr=715383998
104   0.053586 54.192.30.214 -> 172.31.36.109 TCP 26130 [TCP segment of a reassembled PDU]
105   0.053601 172.31.36.109 -> 54.192.30.214 TCP 66 50425 > http [ACK] Seq=98 Ack=375917 Win=591744 Len=0 TSval=31312890 TSecr=715383998
106   0.053674 54.192.30.214 -> 172.31.36.109 TCP 2962 [TCP segment of a reassembled PDU]
107   0.053679 172.31.36.109 -> 54.192.30.214 TCP 66 50425 > http [ACK] Seq=98 Ack=378813 Win=597504 Len=0 TSval=31312890 TSecr=715383998
108   0.053902 54.192.30.214 -> 172.31.36.109 TCP 4410 [TCP segment of a reassembled PDU]
109   0.053930 172.31.36.109 -> 54.192.30.214 TCP 66 50425 > http [ACK] Seq=98 Ack=383157 Win=606208 Len=0 TSval=31312890 TSecr=715383998
110   0.054062 54.192.30.214 -> 172.31.36.109 TCP 17442 [TCP segment of a reassembled PDU]
111   0.054071 172.31.36.109 -> 54.192.30.214 TCP 66 50425 > http [ACK] Seq=98 Ack=400533 Win=641024 Len=0 TSval=31312890 TSecr=715383998
112   0.054174 54.192.30.214 -> 172.31.36.109 TCP 1514 [TCP segment of a reassembled PDU]
113   0.054185 172.31.36.109 -> 54.192.30.214 TCP 66 50425 > http [ACK] Seq=98 Ack=401981 Win=643840 Len=0 TSval=31312890 TSecr=715383998
114   0.054921 54.192.30.214 -> 172.31.36.109 TCP 2962 [TCP segment of a reassembled PDU]
115   0.054926 172.31.36.109 -> 54.192.30.214 TCP 66 50425 > http [ACK] Seq=98 Ack=404877 Win=649728 Len=0 TSval=31312890 TSecr=715383998
116   0.055140 54.192.30.214 -> 172.31.36.109 TCP 27578 [TCP segment of a reassembled PDU]
117   0.055154 172.31.36.109 -> 54.192.30.214 TCP 66 50425 > http [ACK] Seq=98 Ack=432389 Win=704768 Len=0 TSval=31312890 TSecr=715383998
118   0.055219 54.192.30.214 -> 172.31.36.109 TCP 11650 [TCP segment of a reassembled PDU]
119   0.055226 172.31.36.109 -> 54.192.30.214 TCP 66 50425 > http [ACK] Seq=98 Ack=443973 Win=727936 Len=0 TSval=31312890 TSecr=715383998
120   0.055307 54.192.30.214 -> 172.31.36.109 TCP 17442 [TCP segment of a reassembled PDU]
121   0.055317 172.31.36.109 -> 54.192.30.214 TCP 66 50425 > http [ACK] Seq=98 Ack=461349 Win=762624 Len=0 TSval=31312890 TSecr=715383998
122   0.055515 54.192.30.214 -> 172.31.36.109 TCP 21786 [TCP segment of a reassembled PDU]
123   0.055526 172.31.36.109 -> 54.192.30.214 TCP 66 50425 > http [ACK] Seq=98 Ack=483069 Win=806016 Len=0 TSval=31312890 TSecr=715383998
124   0.056389 54.192.30.214 -> 172.31.36.109 TCP 4410 [TCP segment of a reassembled PDU]
125   0.056421 172.31.36.109 -> 54.192.30.214 TCP 66 50425 > http [ACK] Seq=98 Ack=487413 Win=814720 Len=0 TSval=31312890 TSecr=715383998
126   0.056584 54.192.30.214 -> 172.31.36.109 TCP 18890 [TCP segment of a reassembled PDU]
127   0.056611 172.31.36.109 -> 54.192.30.214 TCP 66 50425 > http [ACK] Seq=98 Ack=506237 Win=834048 Len=0 TSval=31312890 TSecr=715383998
128   0.056621 54.192.30.214 -> 172.31.36.109 TCP 2962 [TCP segment of a reassembled PDU]
129   0.056635 172.31.36.109 -> 54.192.30.214 TCP 66 50425 > http [ACK] Seq=98 Ack=509133 Win=831232 Len=0 TSval=31312891 TSecr=715383998
130   0.056942 54.192.30.214 -> 172.31.36.109 TCP 36266 [TCP segment of a reassembled PDU]
131   0.056982 172.31.36.109 -> 54.192.30.214 TCP 66 50425 > http [ACK] Seq=98 Ack=545333 Win=805504 Len=0 TSval=31312891 TSecr=715383998
132   0.057099 54.192.30.214 -> 172.31.36.109 TCP 23234 [TCP segment of a reassembled PDU]
133   0.057112 172.31.36.109 -> 54.192.30.214 TCP 66 50425 > http [ACK] Seq=98 Ack=568501 Win=826880 Len=0 TSval=31312891 TSecr=715383998
134   0.057245 54.192.30.214 -> 172.31.36.109 TCP 2962 [TCP segment of a reassembled PDU]
135   0.057250 172.31.36.109 -> 54.192.30.214 TCP 66 50425 > http [ACK] Seq=98 Ack=571397 Win=858240 Len=0 TSval=31312891 TSecr=715383998
136   0.057870 54.192.30.214 -> 172.31.36.109 TCP 2962 [TCP segment of a reassembled PDU]
137   0.057875 172.31.36.109 -> 54.192.30.214 TCP 66 50425 > http [ACK] Seq=98 Ack=574293 Win=860160 Len=0 TSval=31312891 TSecr=715383998
138   0.058006 54.192.30.214 -> 172.31.36.109 TCP 11650 [TCP segment of a reassembled PDU]
139   0.058025 172.31.36.109 -> 54.192.30.214 TCP 66 50425 > http [ACK] Seq=98 Ack=585877 Win=864000 Len=0 TSval=31312891 TSecr=715383998
140   0.058133 54.192.30.214 -> 172.31.36.109 TCP 15994 [TCP segment of a reassembled PDU]
141   0.058155 172.31.36.109 -> 54.192.30.214 TCP 66 50425 > http [ACK] Seq=98 Ack=601805 Win=864000 Len=0 TSval=31312891 TSecr=715383998
142   0.058444 54.192.30.214 -> 172.31.36.109 TCP 21786 [TCP segment of a reassembled PDU]
143   0.058467 172.31.36.109 -> 54.192.30.214 TCP 66 50425 > http [ACK] Seq=98 Ack=623525 Win=842368 Len=0 TSval=31312891 TSecr=715383998
144   0.058568 54.192.30.214 -> 172.31.36.109 TCP 24682 [TCP segment of a reassembled PDU]
145   0.058609 172.31.36.109 -> 54.192.30.214 TCP 66 50425 > http [ACK] Seq=98 Ack=648141 Win=824576 Len=0 TSval=31312891 TSecr=715383998
146   0.058624 54.192.30.214 -> 172.31.36.109 TCP 13098 [TCP segment of a reassembled PDU]
147   0.058643 172.31.36.109 -> 54.192.30.214 TCP 66 50425 > http [ACK] Seq=98 Ack=661173 Win=843648 Len=0 TSval=31312891 TSecr=715383998
148   0.058866 54.192.30.214 -> 172.31.36.109 TCP 10202 [TCP segment of a reassembled PDU]
149   0.058873 172.31.36.109 -> 54.192.30.214 TCP 66 50425 > http [ACK] Seq=98 Ack=671309 Win=848384 Len=0 TSval=31312891 TSecr=715383998
150   0.059094 54.192.30.214 -> 172.31.36.109 TCP 2962 [TCP segment of a reassembled PDU]
151   0.059099 172.31.36.109 -> 54.192.30.214 TCP 66 50425 > http [ACK] Seq=98 Ack=674205 Win=860160 Len=0 TSval=31312891 TSecr=715383998
152   0.059515 54.192.30.214 -> 172.31.36.109 TCP 2962 [TCP segment of a reassembled PDU]
153   0.059520 172.31.36.109 -> 54.192.30.214 TCP 66 50425 > http [ACK] Seq=98 Ack=677101 Win=860160 Len=0 TSval=31312891 TSecr=715383998
154   0.059692 54.192.30.214 -> 172.31.36.109 TCP 24682 [TCP segment of a reassembled PDU]
155   0.059714 172.31.36.109 -> 54.192.30.214 TCP 66 50425 > http [ACK] Seq=98 Ack=701717 Win=835584 Len=0 TSval=31312891 TSecr=715383998
156   0.059749 54.192.30.214 -> 172.31.36.109 TCP 5858 [TCP segment of a reassembled PDU]
157   0.059755 172.31.36.109 -> 54.192.30.214 TCP 66 50425 > http [ACK] Seq=98 Ack=707509 Win=855424 Len=0 TSval=31312891 TSecr=715383998
158   0.059840 54.192.30.214 -> 172.31.36.109 TCP 10202 [TCP segment of a reassembled PDU]
159   0.059857 172.31.36.109 -> 54.192.30.214 TCP 66 50425 > http [ACK] Seq=98 Ack=717645 Win=864000 Len=0 TSval=31312891 TSecr=715383998
160   0.059967 54.192.30.214 -> 172.31.36.109 TCP 18890 [TCP segment of a reassembled PDU]
161   0.060075 172.31.36.109 -> 54.192.30.214 TCP 66 50425 > http [ACK] Seq=98 Ack=736469 Win=845184 Len=0 TSval=31312891 TSecr=715383998
162   0.060159 54.192.30.214 -> 172.31.36.109 TCP 5858 [TCP segment of a reassembled PDU]
163   0.060166 172.31.36.109 -> 54.192.30.214 TCP 66 50425 > http [ACK] Seq=98 Ack=742261 Win=855424 Len=0 TSval=31312891 TSecr=715383998
164   0.060303 54.192.30.214 -> 172.31.36.109 TCP 21786 [TCP segment of a reassembled PDU]
165   0.060326 54.192.30.214 -> 172.31.36.109 TCP 2962 [TCP segment of a reassembled PDU]
166   0.060334 172.31.36.109 -> 54.192.30.214 TCP 66 50425 > http [ACK] Seq=98 Ack=766877 Win=830848 Len=0 TSval=31312891 TSecr=715383998
167   0.060955 54.192.30.214 -> 172.31.36.109 TCP 1514 [TCP segment of a reassembled PDU]
168   0.061096 54.192.30.214 -> 172.31.36.109 TCP 17442 [TCP segment of a reassembled PDU]
169   0.061105 172.31.36.109 -> 54.192.30.214 TCP 66 50425 > http [ACK] Seq=98 Ack=785701 Win=898688 Len=0 TSval=31312892 TSecr=715383999
170   0.069916 54.192.30.214 -> 172.31.36.109 TCP 7306 [TCP segment of a reassembled PDU]
171   0.069924 172.31.36.109 -> 54.192.30.214 TCP 66 50425 > http [ACK] Seq=98 Ack=792941 Win=913280 Len=0 TSval=31312894 TSecr=715383999
172   0.070110 54.192.30.214 -> 172.31.36.109 TCP 2962 [TCP segment of a reassembled PDU]
173   0.070115 172.31.36.109 -> 54.192.30.214 TCP 66 50425 > http [ACK] Seq=98 Ack=795837 Win=919040 Len=0 TSval=31312894 TSecr=715383999
174   0.070202 54.192.30.214 -> 172.31.36.109 TCP 15994 [TCP segment of a reassembled PDU]
175   0.070212 172.31.36.109 -> 54.192.30.214 TCP 66 50425 > http [ACK] Seq=98 Ack=811765 Win=950912 Len=0 TSval=31312894 TSecr=715383999
176   0.070252 54.192.30.214 -> 172.31.36.109 TCP 7306 [TCP segment of a reassembled PDU]
177   0.070258 172.31.36.109 -> 54.192.30.214 TCP 66 50425 > http [ACK] Seq=98 Ack=819005 Win=965376 Len=0 TSval=31312894 TSecr=715383999
178   0.070308 54.192.30.214 -> 172.31.36.109 TCP 8754 [TCP segment of a reassembled PDU]
179   0.070314 172.31.36.109 -> 54.192.30.214 TCP 66 50425 > http [ACK] Seq=98 Ack=827693 Win=982784 Len=0 TSval=31312894 TSecr=715383999
180   0.070490 54.192.30.214 -> 172.31.36.109 TCP 2962 [TCP segment of a reassembled PDU]
181   0.070495 172.31.36.109 -> 54.192.30.214 TCP 66 50425 > http [ACK] Seq=98 Ack=830589 Win=988544 Len=0 TSval=31312894 TSecr=715383999
182   0.070660 54.192.30.214 -> 172.31.36.109 TCP 20338 [TCP segment of a reassembled PDU]
183   0.070670 172.31.36.109 -> 54.192.30.214 TCP 66 50425 > http [ACK] Seq=98 Ack=850861 Win=1029120 Len=0 TSval=31312894 TSecr=715383999
184   0.070691 54.192.30.214 -> 172.31.36.109 TCP 14546 [TCP segment of a reassembled PDU]
185   0.070698 172.31.36.109 -> 54.192.30.214 TCP 66 50425 > http [ACK] Seq=98 Ack=865341 Win=1058048 Len=0 TSval=31312894 TSecr=715383999
186   0.070708 54.192.30.214 -> 172.31.36.109 TCP 8754 [TCP segment of a reassembled PDU]
187   0.070713 172.31.36.109 -> 54.192.30.214 TCP 66 50425 > http [ACK] Seq=98 Ack=874029 Win=1075456 Len=0 TSval=31312894 TSecr=715383999
188   0.070746 54.192.30.214 -> 172.31.36.109 TCP 4410 [TCP segment of a reassembled PDU]
189   0.070751 172.31.36.109 -> 54.192.30.214 TCP 66 50425 > http [ACK] Seq=98 Ack=878373 Win=1084032 Len=0 TSval=31312894 TSecr=715383999
190   0.070889 54.192.30.214 -> 172.31.36.109 TCP 554 [TCP segment of a reassembled PDU]
191   0.070951 172.31.36.109 -> 54.192.30.214 TCP 66 50425 > http [ACK] Seq=98 Ack=878861 Win=1084032 Len=0 TSval=31312894 TSecr=715383999
192   0.071269 54.192.30.214 -> 172.31.36.109 TCP 2962 [TCP segment of a reassembled PDU]
193   0.071275 172.31.36.109 -> 54.192.30.214 TCP 66 50425 > http [ACK] Seq=98 Ack=881757 Win=1089920 Len=0 TSval=31312894 TSecr=715384000
194   0.071381 54.192.30.214 -> 172.31.36.109 TCP 18890 [TCP segment of a reassembled PDU]
195   0.071391 172.31.36.109 -> 54.192.30.214 TCP 66 50425 > http [ACK] Seq=98 Ack=900581 Win=1127552 Len=0 TSval=31312894 TSecr=715384000
196   0.071458 54.192.30.214 -> 172.31.36.109 TCP 10202 [TCP segment of a reassembled PDU]
197   0.071465 172.31.36.109 -> 54.192.30.214 TCP 66 50425 > http [ACK] Seq=98 Ack=910717 Win=1147776 Len=0 TSval=31312894 TSecr=715384000
198   0.071522 54.192.30.214 -> 172.31.36.109 TCP 5858 [TCP segment of a reassembled PDU]
199   0.071528 172.31.36.109 -> 54.192.30.214 TCP 66 50425 > http [ACK] Seq=98 Ack=916509 Win=1159424 Len=0 TSval=31312894 TSecr=715384000
200   0.071695 54.192.30.214 -> 172.31.36.109 TCP 5858 [TCP segment of a reassembled PDU]
201   0.071713 172.31.36.109 -> 54.192.30.214 TCP 66 50425 > http [ACK] Seq=98 Ack=922301 Win=1170944 Len=0 TSval=31312894 TSecr=715384000
202   0.071839 54.192.30.214 -> 172.31.36.109 TCP 17442 [TCP segment of a reassembled PDU]
203   0.071862 172.31.36.109 -> 54.192.30.214 TCP 66 50425 > http [ACK] Seq=98 Ack=939677 Win=1205760 Len=0 TSval=31312894 TSecr=715384000
204   0.071910 54.192.30.214 -> 172.31.36.109 TCP 11650 [TCP segment of a reassembled PDU]
205   0.071918 172.31.36.109 -> 54.192.30.214 TCP 66 50425 > http [ACK] Seq=98 Ack=951261 Win=1228928 Len=0 TSval=31312894 TSecr=715384000
206   0.072052 54.192.30.214 -> 172.31.36.109 TCP 11650 [TCP segment of a reassembled PDU]
207   0.072060 172.31.36.109 -> 54.192.30.214 TCP 66 50425 > http [ACK] Seq=98 Ack=962845 Win=1252096 Len=0 TSval=31312894 TSecr=715384000
208   0.072181 54.192.30.214 -> 172.31.36.109 TCP 1514 [TCP segment of a reassembled PDU]
209   0.072185 172.31.36.109 -> 54.192.30.214 TCP 66 50425 > http [ACK] Seq=98 Ack=964293 Win=1254912 Len=0 TSval=31312894 TSecr=715384000
210   0.072354 54.192.30.214 -> 172.31.36.109 TCP 17442 [TCP segment of a reassembled PDU]
211   0.072364 172.31.36.109 -> 54.192.30.214 TCP 66 50425 > http [ACK] Seq=98 Ack=981669 Win=1289728 Len=0 TSval=31312894 TSecr=715384000
212   0.072734 54.192.30.214 -> 172.31.36.109 TCP 2962 [TCP segment of a reassembled PDU]
213   0.072740 172.31.36.109 -> 54.192.30.214 TCP 66 50425 > http [ACK] Seq=98 Ack=984565 Win=1295488 Len=0 TSval=31312895 TSecr=715384000
214   0.072865 54.192.30.214 -> 172.31.36.109 TCP 15994 [TCP segment of a reassembled PDU]
215   0.072874 172.31.36.109 -> 54.192.30.214 TCP 66 50425 > http [ACK] Seq=98 Ack=1000493 Win=1325312 Len=0 TSval=31312895 TSecr=715384000
216   0.072992 54.192.30.214 -> 172.31.36.109 TCP 21786 [TCP segment of a reassembled PDU]
217   0.073014 172.31.36.109 -> 54.192.30.214 TCP 66 50425 > http [ACK] Seq=98 Ack=1022213 Win=1315840 Len=0 TSval=31312895 TSecr=715384000
218   0.073074 54.192.30.214 -> 172.31.36.109 TCP 10202 [TCP segment of a reassembled PDU]
219   0.073081 172.31.36.109 -> 54.192.30.214 TCP 66 50425 > http [ACK] Seq=98 Ack=1032349 Win=1334912 Len=0 TSval=31312895 TSecr=715384000
220   0.073180 54.192.30.214 -> 172.31.36.109 TCP 15994 [TCP segment of a reassembled PDU]
221   0.073200 172.31.36.109 -> 54.192.30.214 TCP 66 50425 > http [ACK] Seq=98 Ack=1048277 Win=1344512 Len=0 TSval=31312895 TSecr=715384000
222   0.073528 54.192.30.214 -> 172.31.36.109 TCP 4410 [TCP segment of a reassembled PDU]
223   0.073543 172.31.36.109 -> 54.192.30.214 TCP 66 50425 > http [ACK] Seq=98 Ack=1052621 Win=1344512 Len=0 TSval=31312895 TSecr=715384000
224   0.073674 54.192.30.214 -> 172.31.36.109 TCP 20338 [TCP segment of a reassembled PDU]
225   0.073695 172.31.36.109 -> 54.192.30.214 TCP 66 50425 > http [ACK] Seq=98 Ack=1072893 Win=1324288 Len=0 TSval=31312895 TSecr=715384000
226   0.073791 54.192.30.214 -> 172.31.36.109 TCP 26130 [TCP segment of a reassembled PDU]
227   0.073815 172.31.36.109 -> 54.192.30.214 TCP 66 50425 > http [ACK] Seq=98 Ack=1098957 Win=1308800 Len=0 TSval=31312895 TSecr=715384000
228   0.073863 54.192.30.214 -> 172.31.36.109 TCP 5858 [TCP segment of a reassembled PDU]
229   0.073868 172.31.36.109 -> 54.192.30.214 TCP 66 50425 > http [ACK] Seq=98 Ack=1104749 Win=1342080 Len=0 TSval=31312895 TSecr=715384000
230   0.073986 54.192.30.214 -> 172.31.36.109 TCP 7306 [TCP segment of a reassembled PDU]
231   0.074036 172.31.36.109 -> 54.192.30.214 TCP 66 50425 > http [ACK] Seq=98 Ack=1111989 Win=1344512 Len=0 TSval=31312895 TSecr=715384000
232   0.074282 54.192.30.214 -> 172.31.36.109 TCP 21786 [TCP segment of a reassembled PDU]
233   0.074318 172.31.36.109 -> 54.192.30.214 TCP 66 50425 > http [ACK] Seq=98 Ack=1133709 Win=1322880 Len=0 TSval=31312895 TSecr=715384000
234   0.074532 54.192.30.214 -> 172.31.36.109 TCP 10202 [TCP segment of a reassembled PDU]
235   0.074539 172.31.36.109 -> 54.192.30.214 TCP 66 50425 > http [ACK] Seq=98 Ack=1143845 Win=1334912 Len=0 TSval=31312895 TSecr=715384000
236   0.074681 54.192.30.214 -> 172.31.36.109 TCP 23234 [TCP segment of a reassembled PDU]
237   0.074704 172.31.36.109 -> 54.192.30.214 TCP 66 50425 > http [ACK] Seq=98 Ack=1167013 Win=1313536 Len=0 TSval=31312895 TSecr=715384000
238   0.074779 54.192.30.214 -> 172.31.36.109 TCP 5858 [TCP segment of a reassembled PDU]
239   0.074785 172.31.36.109 -> 54.192.30.214 TCP 66 50425 > http [ACK] Seq=98 Ack=1172805 Win=1342080 Len=0 TSval=31312895 TSecr=715384000
240   0.075003 54.192.30.214 -> 172.31.36.109 TCP 6666 [TCP segment of a reassembled PDU]
241   0.075022 172.31.36.109 -> 54.192.30.214 TCP 66 50425 > http [ACK] Seq=98 Ack=1179405 Win=1344512 Len=0 TSval=31312895 TSecr=715384000
242   0.134797 54.192.30.214 -> 172.31.36.109 TCP 13098 [TCP segment of a reassembled PDU]
243   0.134822 172.31.36.109 -> 54.192.30.214 TCP 66 50425 > http [ACK] Seq=98 Ack=1192437 Win=1344512 Len=0 TSval=31312910 TSecr=715384006
244   0.135069 54.192.30.214 -> 172.31.36.109 TCP 15994 [TCP segment of a reassembled PDU]
245   0.135091 172.31.36.109 -> 54.192.30.214 TCP 66 50425 > http [ACK] Seq=98 Ack=1208365 Win=1344512 Len=0 TSval=31312910 TSecr=715384006
246   0.135328 54.192.30.214 -> 172.31.36.109 TCP 21786 [TCP segment of a reassembled PDU]
247   0.135352 172.31.36.109 -> 54.192.30.214 TCP 66 50425 > http [ACK] Seq=98 Ack=1230085 Win=1322880 Len=0 TSval=31312910 TSecr=715384006
248   0.135576 54.192.30.214 -> 172.31.36.109 TCP 11650 [TCP segment of a reassembled PDU]
249   0.135584 172.31.36.109 -> 54.192.30.214 TCP 66 50425 > http [ACK] Seq=98 Ack=1241669 Win=1332608 Len=0 TSval=31312910 TSecr=715384006
250   0.135598 54.192.30.214 -> 172.31.36.109 TCP 13098 [TCP segment of a reassembled PDU]
251   0.135617 172.31.36.109 -> 54.192.30.214 TCP 66 50425 > http [ACK] Seq=98 Ack=1254701 Win=1330176 Len=0 TSval=31312910 TSecr=715384006
252   0.135665 54.192.30.214 -> 172.31.36.109 TCP 10202 [TCP segment of a reassembled PDU]
253   0.135688 172.31.36.109 -> 54.192.30.214 TCP 66 50425 > http [ACK] Seq=98 Ack=1264837 Win=1334912 Len=0 TSval=31312910 TSecr=715384006
254   0.135828 54.192.30.214 -> 172.31.36.109 TCP 1514 [TCP segment of a reassembled PDU]
255   0.135859 54.192.30.214 -> 172.31.36.109 TCP 13098 [TCP segment of a reassembled PDU]
256   0.135892 172.31.36.109 -> 54.192.30.214 TCP 66 50425 > http [ACK] Seq=98 Ack=1279317 Win=1344512 Len=0 TSval=31312910 TSecr=715384006
257   0.135962 54.192.30.214 -> 172.31.36.109 TCP 8754 [TCP segment of a reassembled PDU]
258   0.135986 54.192.30.214 -> 172.31.36.109 TCP 4410 [TCP segment of a reassembled PDU]
259   0.136007 54.192.30.214 -> 172.31.36.109 TCP 4410 [TCP segment of a reassembled PDU]
260   0.136022 172.31.36.109 -> 54.192.30.214 TCP 66 50425 > http [ACK] Seq=98 Ack=1296693 Win=1344384 Len=0 TSval=31312910 TSecr=715384006
261   0.136151 54.192.30.214 -> 172.31.36.109 TCP 13098 [TCP segment of a reassembled PDU]
262   0.136164 54.192.30.214 -> 172.31.36.109 TCP 4410 [TCP segment of a reassembled PDU]
263   0.136179 172.31.36.109 -> 54.192.30.214 TCP 66 50425 > http [ACK] Seq=98 Ack=1314069 Win=1344384 Len=0 TSval=31312910 TSecr=715384006
264   0.136229 54.192.30.214 -> 172.31.36.109 TCP 2962 [TCP segment of a reassembled PDU]
265   0.136234 172.31.36.109 -> 54.192.30.214 TCP 66 50425 > http [ACK] Seq=98 Ack=1316965 Win=1344512 Len=0 TSval=31312910 TSecr=715384006
266   0.136425 54.192.30.214 -> 172.31.36.109 TCP 24682 [TCP segment of a reassembled PDU]
267   0.136438 54.192.30.214 -> 172.31.36.109 TCP 1514 [TCP segment of a reassembled PDU]
268   0.136452 172.31.36.109 -> 54.192.30.214 TCP 66 50425 > http [ACK] Seq=98 Ack=1343029 Win=1318528 Len=0 TSval=31312910 TSecr=715384006
269   0.136480 54.192.30.214 -> 172.31.36.109 TCP 8754 [TCP segment of a reassembled PDU]
270   0.136487 172.31.36.109 -> 54.192.30.214 TCP 66 50425 > http [ACK] Seq=98 Ack=1351717 Win=1337344 Len=0 TSval=31312910 TSecr=715384006
271   0.136598 54.192.30.214 -> 172.31.36.109 TCP 5858 [TCP segment of a reassembled PDU]
272   0.136737 172.31.36.109 -> 54.192.30.214 TCP 66 50425 > http [ACK] Seq=98 Ack=1357509 Win=1344512 Len=0 TSval=31312911 TSecr=715384006
273   0.137020 54.192.30.214 -> 172.31.36.109 TCP 1514 [TCP segment of a reassembled PDU]
274   0.137204 54.192.30.214 -> 172.31.36.109 TCP 33370 [TCP segment of a reassembled PDU]
275   0.137232 172.31.36.109 -> 54.192.30.214 TCP 66 50425 > http [ACK] Seq=98 Ack=1392261 Win=1309824 Len=0 TSval=31312911 TSecr=715384006
276   0.137244 54.192.30.214 -> 172.31.36.109 TCP 2962 [TCP segment of a reassembled PDU]
277   0.137270 172.31.36.109 -> 54.192.30.214 TCP 66 50425 > http [ACK] Seq=98 Ack=1395157 Win=1307008 Len=0 TSval=31312911 TSecr=715384006
278   0.137448 54.192.30.214 -> 172.31.36.109 TCP 27578 [TCP segment of a reassembled PDU]
279   0.137466 54.192.30.214 -> 172.31.36.109 TCP 7306 [TCP segment of a reassembled PDU]
280   0.137482 172.31.36.109 -> 54.192.30.214 TCP 66 50425 > http [ACK] Seq=98 Ack=1429909 Win=1294336 Len=0 TSval=31312911 TSecr=715384006
281   0.137610 54.192.30.214 -> 172.31.36.109 TCP 11706 [TCP segment of a reassembled PDU]
282   0.137618 172.31.36.109 -> 54.192.30.214 TCP 66 50425 > http [ACK] Seq=98 Ack=1441549 Win=1330176 Len=0 TSval=31312911 TSecr=715384006
283   0.153499 54.192.30.214 -> 172.31.36.109 TCP 13098 [TCP segment of a reassembled PDU]
284   0.153508 172.31.36.109 -> 54.192.30.214 TCP 66 50425 > http [ACK] Seq=98 Ack=1454581 Win=1330176 Len=0 TSval=31312915 TSecr=715384008
285   0.153521 54.192.30.214 -> 172.31.36.109 TCP 13098 [TCP segment of a reassembled PDU]
286   0.153544 172.31.36.109 -> 54.192.30.214 TCP 66 50425 > http [ACK] Seq=98 Ack=1467613 Win=1330176 Len=0 TSval=31312915 TSecr=715384008
287   0.153630 54.192.30.214 -> 172.31.36.109 TCP 11650 [TCP segment of a reassembled PDU]
288   0.153638 172.31.36.109 -> 54.192.30.214 TCP 66 50425 > http [ACK] Seq=98 Ack=1479197 Win=1332608 Len=0 TSval=31312915 TSecr=715384008
289   0.153719 54.192.30.214 -> 172.31.36.109 TCP 1514 [TCP segment of a reassembled PDU]
290   0.153930 54.192.30.214 -> 172.31.36.109 TCP 5858 [TCP segment of a reassembled PDU]
291   0.154051 54.192.30.214 -> 172.31.36.109 TCP 7306 [TCP segment of a reassembled PDU]
292   0.154175 54.192.30.214 -> 172.31.36.109 TCP 4410 [TCP segment of a reassembled PDU]
293   0.154374 54.192.30.214 -> 172.31.36.109 TCP 7306 [TCP segment of a reassembled PDU]
294   0.154385 54.192.30.214 -> 172.31.36.109 TCP 18890 [TCP segment of a reassembled PDU]
295   0.154403 54.192.30.214 -> 172.31.36.109 TCP 10202 [TCP segment of a reassembled PDU]
296   0.154544 54.192.30.214 -> 172.31.36.109 TCP 13098 [TCP segment of a reassembled PDU]
297   0.154562 54.192.30.214 -> 172.31.36.109 TCP 8754 [TCP segment of a reassembled PDU]
298   0.154696 54.192.30.214 -> 172.31.36.109 TCP 11650 [TCP segment of a reassembled PDU]
299   0.154704 54.192.30.214 -> 172.31.36.109 TCP 5162 [TCP segment of a reassembled PDU]
300   0.156665 172.31.36.109 -> 54.192.30.214 TCP 66 50425 > http [ACK] Seq=98 Ack=1572621 Win=1239296 Len=0 TSval=31312916 TSecr=715384008
301   0.169771 54.192.30.214 -> 172.31.36.109 TCP 1514 [TCP segment of a reassembled PDU]
302   0.169779 54.192.30.214 -> 172.31.36.109 TCP 1514 [TCP segment of a reassembled PDU]
303   0.169782 172.31.36.109 -> 54.192.30.214 TCP 66 50425 > http [ACK] Seq=98 Ack=1575517 Win=1344512 Len=0 TSval=31312919 TSecr=715384009
304   0.170014 54.192.30.214 -> 172.31.36.109 TCP 2962 [TCP segment of a reassembled PDU]
305   0.170021 172.31.36.109 -> 54.192.30.214 TCP 66 50425 > http [ACK] Seq=98 Ack=1578413 Win=1344512 Len=0 TSval=31312919 TSecr=715384009
306   0.170088 54.192.30.214 -> 172.31.36.109 TCP 11650 [TCP segment of a reassembled PDU]
307   0.170107 172.31.36.109 -> 54.192.30.214 TCP 66 50425 > http [ACK] Seq=98 Ack=1589997 Win=1344512 Len=0 TSval=31312919 TSecr=715384009
308   0.170215 54.192.30.214 -> 172.31.36.109 TCP 8754 [TCP segment of a reassembled PDU]
309   0.170234 54.192.30.214 -> 172.31.36.109 TCP 11650 [TCP segment of a reassembled PDU]
310   0.170255 54.192.30.214 -> 172.31.36.109 TCP 7306 [TCP segment of a reassembled PDU]
311   0.170264 172.31.36.109 -> 54.192.30.214 TCP 66 50425 > http [ACK] Seq=98 Ack=1610269 Win=1332608 Len=0 TSval=31312919 TSecr=715384009
312   0.170274 54.192.30.214 -> 172.31.36.109 TCP 5858 [TCP segment of a reassembled PDU]
313   0.170291 172.31.36.109 -> 54.192.30.214 TCP 66 50425 > http [ACK] Seq=98 Ack=1623301 Win=1330176 Len=0 TSval=31312919 TSecr=715384009
314   0.170354 54.192.30.214 -> 172.31.36.109 TCP 11650 [TCP segment of a reassembled PDU]
315   0.170363 172.31.36.109 -> 54.192.30.214 TCP 66 50425 > http [ACK] Seq=98 Ack=1634885 Win=1332608 Len=0 TSval=31312919 TSecr=715384009
316   0.170668 54.192.30.214 -> 172.31.36.109 TCP 7306 [TCP segment of a reassembled PDU]
317   0.170676 172.31.36.109 -> 54.192.30.214 TCP 66 50425 > http [ACK] Seq=98 Ack=1642125 Win=1339648 Len=0 TSval=31312919 TSecr=715384009
318   0.170698 54.192.30.214 -> 172.31.36.109 TCP 14546 [TCP segment of a reassembled PDU]
319   0.170709 54.192.30.214 -> 172.31.36.109 TCP 7306 [TCP segment of a reassembled PDU]
320   0.170720 54.192.30.214 -> 172.31.36.109 TCP 8754 [TCP segment of a reassembled PDU]
321   0.170751 172.31.36.109 -> 54.192.30.214 TCP 66 50425 > http [ACK] Seq=98 Ack=1672533 Win=1309312 Len=0 TSval=31312919 TSecr=715384009
322   0.170862 54.192.30.214 -> 172.31.36.109 TCP 13098 [TCP segment of a reassembled PDU]
323   0.170871 172.31.36.109 -> 54.192.30.214 TCP 66 50425 > http [ACK] Seq=98 Ack=1685565 Win=1330176 Len=0 TSval=31312919 TSecr=715384010
324   0.171321 54.192.30.214 -> 172.31.36.109 TCP 2962 [TCP segment of a reassembled PDU]
325   0.171327 172.31.36.109 -> 54.192.30.214 TCP 66 50425 > http [ACK] Seq=98 Ack=1688461 Win=1344512 Len=0 TSval=31312919 TSecr=715384010
326   0.171507 54.192.30.214 -> 172.31.36.109 TCP 17442 [TCP segment of a reassembled PDU]
327   0.171545 54.192.30.214 -> 172.31.36.109 TCP 2962 [TCP segment of a reassembled PDU]
328   0.171727 172.31.36.109 -> 54.192.30.214 TCP 66 50425 > http [ACK] Seq=98 Ack=1708733 Win=1324288 Len=0 TSval=31312919 TSecr=715384010
329   0.171755 54.192.30.214 -> 172.31.36.109 TCP 27578 [TCP segment of a reassembled PDU]
330   0.171778 172.31.36.109 -> 54.192.30.214 TCP 66 50425 > http [ACK] Seq=98 Ack=1736245 Win=1306240 Len=0 TSval=31312919 TSecr=715384010
331   0.171898 54.192.30.214 -> 172.31.36.109 TCP 14922 [TCP segment of a reassembled PDU]
332   0.171909 172.31.36.109 -> 54.192.30.214 TCP 66 50425 > http [ACK] Seq=98 Ack=1751101 Win=1325312 Len=0 TSval=31312919 TSecr=715384010
333   0.171920 54.192.30.214 -> 172.31.36.109 TCP 5858 [TCP segment of a reassembled PDU]
334   0.171934 172.31.36.109 -> 54.192.30.214 TCP 66 50425 > http [ACK] Seq=98 Ack=1756893 Win=1342080 Len=0 TSval=31312919 TSecr=715384010
335   0.172001 54.192.30.214 -> 172.31.36.109 TCP 8754 [TCP segment of a reassembled PDU]
336   0.172017 172.31.36.109 -> 54.192.30.214 TCP 66 50425 > http [ACK] Seq=98 Ack=1765581 Win=1344512 Len=0 TSval=31312919 TSecr=715384010
337   0.172081 54.192.30.214 -> 172.31.36.109 TCP 2962 [TCP segment of a reassembled PDU]
338   0.172087 172.31.36.109 -> 54.192.30.214 TCP 66 50425 > http [ACK] Seq=98 Ack=1768477 Win=1344512 Len=0 TSval=31312919 TSecr=715384010
339   0.172217 54.192.30.214 -> 172.31.36.109 TCP 2586 [TCP segment of a reassembled PDU]
340   0.172223 172.31.36.109 -> 54.192.30.214 TCP 66 50425 > http [ACK] Seq=98 Ack=1770997 Win=1344512 Len=0 TSval=31312919 TSecr=715384010
341   0.172238 54.192.30.214 -> 172.31.36.109 TCP 18890 [TCP segment of a reassembled PDU]
342   0.172261 172.31.36.109 -> 54.192.30.214 TCP 66 50425 > http [ACK] Seq=98 Ack=1789821 Win=1325696 Len=0 TSval=31312919 TSecr=715384010
343   0.172306 54.192.30.214 -> 172.31.36.109 TCP 1514 [TCP segment of a reassembled PDU]
344   0.172542 54.192.30.214 -> 172.31.36.109 TCP 27578 [TCP segment of a reassembled PDU]
345   0.172578 54.192.30.214 -> 172.31.36.109 TCP 11650 [TCP segment of a reassembled PDU]
346   0.172650 54.192.30.214 -> 172.31.36.109 TCP 4466 [TCP segment of a reassembled PDU]
347   0.172669 172.31.36.109 -> 54.192.30.214 TCP 66 50425 > http [ACK] Seq=98 Ack=1834765 Win=1280768 Len=0 TSval=31312920 TSecr=715384010
348   0.228165 54.192.30.214 -> 172.31.36.109 TCP 1514 [TCP segment of a reassembled PDU]
349   0.228195 54.192.30.214 -> 172.31.36.109 TCP 4410 [TCP segment of a reassembled PDU]
350   0.228200 172.31.36.109 -> 54.192.30.214 TCP 66 50425 > http [ACK] Seq=98 Ack=1840557 Win=1342080 Len=0 TSval=31312933 TSecr=715384015
351   0.228268 54.192.30.214 -> 172.31.36.109 TCP 2962 [TCP segment of a reassembled PDU]
352   0.228273 172.31.36.109 -> 54.192.30.214 TCP 66 50425 > http [ACK] Seq=98 Ack=1843453 Win=1344512 Len=0 TSval=31312933 TSecr=715384015
353   0.228378 54.192.30.214 -> 172.31.36.109 TCP 8754 [TCP segment of a reassembled PDU]
