[Measurement for 100kb at 23:30:51 19.30.2014] 
Tshark:

  1   0.000000 172.31.36.109 -> 172.31.0.2   DNS 89 Standard query 0x7be4  A d3796nkzln59xv.cloudfront.net
  2   0.000028 172.31.36.109 -> 172.31.0.2   DNS 89 Standard query 0x1bc4  AAAA d3796nkzln59xv.cloudfront.net
  3   0.000312   172.31.0.2 -> 172.31.36.109 DNS 170 Standard query response 0x1bc4 
  4   0.000324   172.31.0.2 -> 172.31.36.109 DNS 217 Standard query response 0x7be4  A 54.230.30.219 A 54.230.30.236 A 54.230.30.237 A 54.230.30.246 A 54.192.29.218 A 54.230.30.37 A 54.230.30.47 A 54.230.30.53
  5   0.003865 172.31.36.109 -> 54.230.30.219 TCP 74 42852 > http [SYN] Seq=0 Win=26883 Len=0 MSS=8961 SACK_PERM=1 TSval=25884435 TSecr=0 WS=128
  6   0.004858 54.230.30.219 -> 172.31.36.109 TCP 74 http > 42852 [SYN, ACK] Seq=0 Ack=1 Win=14480 Len=0 MSS=1460 SACK_PERM=1 TSval=698273168 TSecr=25884435 WS=128
  7   0.004873 172.31.36.109 -> 54.230.30.219 TCP 66 42852 > http [ACK] Seq=1 Ack=1 Win=27008 Len=0 TSval=25884435 TSecr=698273168
  8   0.004924 172.31.36.109 -> 54.230.30.219 HTTP 164 GET /100kb HTTP/1.1 
  9   0.005814 54.230.30.219 -> 172.31.36.109 TCP 66 http > 42852 [ACK] Seq=1 Ack=99 Win=14592 Len=0 TSval=698273168 TSecr=25884435
 10   0.022224 54.230.30.219 -> 172.31.36.109 TCP 7306 [TCP segment of a reassembled PDU]
 11   0.022233 172.31.36.109 -> 54.230.30.219 TCP 66 42852 > http [ACK] Seq=99 Ack=7241 Win=41472 Len=0 TSval=25884439 TSecr=698273170
 12   0.022260 54.230.30.219 -> 172.31.36.109 TCP 6314 [TCP segment of a reassembled PDU]
 13   0.022266 172.31.36.109 -> 54.230.30.219 TCP 66 42852 > http [ACK] Seq=99 Ack=13489 Win=53888 Len=0 TSval=25884439 TSecr=698273170
 14   0.023233 54.230.30.219 -> 172.31.36.109 TCP 4410 [TCP segment of a reassembled PDU]
 15   0.023240 172.31.36.109 -> 54.230.30.219 TCP 66 42852 > http [ACK] Seq=99 Ack=17833 Win=62592 Len=0 TSval=25884439 TSecr=698273170
 16   0.023448 54.230.30.219 -> 172.31.36.109 TCP 2962 [TCP segment of a reassembled PDU]
 17   0.023453 172.31.36.109 -> 54.230.30.219 TCP 66 42852 > http [ACK] Seq=99 Ack=20729 Win=68352 Len=0 TSval=25884439 TSecr=698273170
 18   0.023486 54.230.30.219 -> 172.31.36.109 TCP 5858 [TCP segment of a reassembled PDU]
 19   0.023492 172.31.36.109 -> 54.230.30.219 TCP 66 42852 > http [ACK] Seq=99 Ack=26521 Win=80000 Len=0 TSval=25884439 TSecr=698273170
 20   0.024693 54.230.30.219 -> 172.31.36.109 TCP 11650 [TCP segment of a reassembled PDU]
 21   0.024701 172.31.36.109 -> 54.230.30.219 TCP 66 42852 > http [ACK] Seq=99 Ack=38105 Win=98944 Len=0 TSval=25884440 TSecr=698273170
 22   0.024777 54.230.30.219 -> 172.31.36.109 TCP 10202 [TCP segment of a reassembled PDU]
 23   0.024785 172.31.36.109 -> 54.230.30.219 TCP 66 42852 > http [ACK] Seq=99 Ack=48241 Win=123392 Len=0 TSval=25884440 TSecr=698273170
 24   0.025845 54.230.30.219 -> 172.31.36.109 TCP 4410 [TCP segment of a reassembled PDU]
 25   0.025851 172.31.36.109 -> 54.230.30.219 TCP 66 42852 > http [ACK] Seq=99 Ack=52585 Win=132096 Len=0 TSval=25884440 TSecr=698273170
 26   0.025884 54.230.30.219 -> 172.31.36.109 TCP 1514 [TCP segment of a reassembled PDU]
 27   0.025888 172.31.36.109 -> 54.230.30.219 TCP 66 42852 > http [ACK] Seq=99 Ack=54033 Win=135040 Len=0 TSval=25884440 TSecr=698273170
 28   0.026057 54.230.30.219 -> 172.31.36.109 TCP 11325 [TCP segment of a reassembled PDU]
 29   0.026065 172.31.36.109 -> 54.230.30.219 TCP 66 42852 > http [ACK] Seq=99 Ack=65292 Win=157568 Len=0 TSval=25884440 TSecr=698273170
 30   0.029956 54.230.30.219 -> 172.31.36.109 TCP 1514 [TCP segment of a reassembled PDU]
 31   0.029961 172.31.36.109 -> 54.230.30.219 TCP 66 42852 > http [ACK] Seq=99 Ack=66740 Win=160384 Len=0 TSval=25884441 TSecr=698273170
 32   0.030287 54.230.30.219 -> 172.31.36.109 TCP 1514 [TCP segment of a reassembled PDU]
 33   0.030291 172.31.36.109 -> 54.230.30.219 TCP 66 42852 > http [ACK] Seq=99 Ack=68188 Win=163328 Len=0 TSval=25884441 TSecr=698273170
 34   0.030421 54.230.30.219 -> 172.31.36.109 TCP 18890 [TCP segment of a reassembled PDU]
 35   0.030431 172.31.36.109 -> 54.230.30.219 TCP 66 42852 > http [ACK] Seq=99 Ack=87012 Win=167296 Len=0 TSval=25884441 TSecr=698273170
 36   0.030443 54.230.30.219 -> 172.31.36.109 TCP 1514 [TCP segment of a reassembled PDU]
 37   0.030446 172.31.36.109 -> 54.230.30.219 TCP 66 42852 > http [ACK] Seq=99 Ack=88460 Win=165888 Len=0 TSval=25884441 TSecr=698273170
 38   0.031572 54.230.30.219 -> 172.31.36.109 TCP 1514 [TCP segment of a reassembled PDU]
 39   0.031579 172.31.36.109 -> 54.230.30.219 TCP 66 42852 > http [ACK] Seq=99 Ack=89908 Win=195840 Len=0 TSval=25884441 TSecr=698273170
 40   0.031706 54.230.30.219 -> 172.31.36.109 HTTP 13015 HTTP/1.1 200 OK  (application/octet-stream)
 41   0.031715 172.31.36.109 -> 54.230.30.219 TCP 66 42852 > http [ACK] Seq=99 Ack=102857 Win=182912 Len=0 TSval=25884441 TSecr=698273170
 42   0.031855 172.31.36.109 -> 54.230.30.219 TCP 66 42852 > http [FIN, ACK] Seq=99 Ack=102857 Win=200960 Len=0 TSval=25884442 TSecr=698273170
 43   0.033156 54.230.30.219 -> 172.31.36.109 TCP 66 http > 42852 [FIN, ACK] Seq=102857 Ack=100 Win=14592 Len=0 TSval=698273171 TSecr=25884442
 44   0.033164 172.31.36.109 -> 54.230.30.219 TCP 66 42852 > http [ACK] Seq=100 Ack=102858 Win=200960 Len=0 TSval=25884442 TSecr=698273171
