[Measurement for 100kb at 11:30:49 20.30.2014] 
Tshark:

  1   0.000000 172.31.36.109 -> 172.31.0.2   DNS 89 Standard query 0xdf05  A d3796nkzln59xv.cloudfront.net
  2   0.000022 172.31.36.109 -> 172.31.0.2   DNS 89 Standard query 0xace7  AAAA d3796nkzln59xv.cloudfront.net
  3   0.000508   172.31.0.2 -> 172.31.36.109 DNS 170 Standard query response 0xace7 
  4   0.000520   172.31.0.2 -> 172.31.36.109 DNS 217 Standard query response 0xdf05  A 54.230.30.226 A 54.230.30.239 A 54.230.30.17 A 54.230.30.26 A 54.230.30.39 A 54.230.30.69 A 54.230.30.72 A 54.230.30.217
  5   0.003922 172.31.36.109 -> 54.230.30.226 TCP 74 40142 > http [SYN] Seq=0 Win=26883 Len=0 MSS=8961 SACK_PERM=1 TSval=36683922 TSecr=0 WS=128
  6   0.005074 54.230.30.226 -> 172.31.36.109 TCP 74 http > 40142 [SYN, ACK] Seq=0 Ack=1 Win=14480 Len=0 MSS=1460 SACK_PERM=1 TSval=667344378 TSecr=36683922 WS=128
  7   0.005088 172.31.36.109 -> 54.230.30.226 TCP 66 40142 > http [ACK] Seq=1 Ack=1 Win=27008 Len=0 TSval=36683922 TSecr=667344378
  8   0.005139 172.31.36.109 -> 54.230.30.226 HTTP 164 GET /100kb HTTP/1.1 
  9   0.006339 54.230.30.226 -> 172.31.36.109 TCP 66 http > 40142 [ACK] Seq=1 Ack=99 Win=14592 Len=0 TSval=667344378 TSecr=36683922
 10   0.022837 54.230.30.226 -> 172.31.36.109 TCP 1132 [TCP segment of a reassembled PDU]
 11   0.022846 172.31.36.109 -> 54.230.30.226 TCP 66 40142 > http [ACK] Seq=99 Ack=1067 Win=29056 Len=0 TSval=36683927 TSecr=667344380
 12   0.022875 54.230.30.226 -> 172.31.36.109 TCP 13098 [TCP segment of a reassembled PDU]
 13   0.022883 172.31.36.109 -> 54.230.30.226 TCP 66 40142 > http [ACK] Seq=99 Ack=14099 Win=55168 Len=0 TSval=36683927 TSecr=667344380
 14   0.024030 54.230.30.226 -> 172.31.36.109 TCP 4410 [TCP segment of a reassembled PDU]
 15   0.024054 172.31.36.109 -> 54.230.30.226 TCP 66 40142 > http [ACK] Seq=99 Ack=18443 Win=63872 Len=0 TSval=36683927 TSecr=667344380
 16   0.024258 54.230.30.226 -> 172.31.36.109 TCP 7306 [TCP segment of a reassembled PDU]
 17   0.024284 172.31.36.109 -> 54.230.30.226 TCP 66 40142 > http [ACK] Seq=99 Ack=25683 Win=78336 Len=0 TSval=36683927 TSecr=667344380
 18   0.024290 54.230.30.226 -> 172.31.36.109 TCP 1514 [TCP segment of a reassembled PDU]
 19   0.024292 172.31.36.109 -> 54.230.30.226 TCP 66 40142 > http [ACK] Seq=99 Ack=27131 Win=81152 Len=0 TSval=36683927 TSecr=667344380
 20   0.025854 54.230.30.226 -> 172.31.36.109 TCP 10202 [TCP segment of a reassembled PDU]
 21   0.025862 172.31.36.109 -> 54.230.30.226 TCP 66 40142 > http [ACK] Seq=99 Ack=37267 Win=101248 Len=0 TSval=36683927 TSecr=667344380
 22   0.026369 54.230.30.226 -> 172.31.36.109 TCP 2962 [TCP segment of a reassembled PDU]
 23   0.026375 172.31.36.109 -> 54.230.30.226 TCP 66 40142 > http [ACK] Seq=99 Ack=40163 Win=107264 Len=0 TSval=36683927 TSecr=667344380
 24   0.026395 54.230.30.226 -> 172.31.36.109 TCP 7306 [TCP segment of a reassembled PDU]
 25   0.026400 172.31.36.109 -> 54.230.30.226 TCP 66 40142 > http [ACK] Seq=99 Ack=47403 Win=101248 Len=0 TSval=36683927 TSecr=667344380
 26   0.026569 54.230.30.226 -> 172.31.36.109 TCP 1514 [TCP segment of a reassembled PDU]
 27   0.026581 172.31.36.109 -> 54.230.30.226 TCP 66 40142 > http [ACK] Seq=99 Ack=48851 Win=109056 Len=0 TSval=36683927 TSecr=667344380
 28   0.027617 54.230.30.226 -> 172.31.36.109 TCP 4410 [TCP segment of a reassembled PDU]
 29   0.027647 172.31.36.109 -> 54.230.30.226 TCP 66 40142 > http [ACK] Seq=99 Ack=53195 Win=109056 Len=0 TSval=36683928 TSecr=667344380
 30   0.028176 54.230.30.226 -> 172.31.36.109 TCP 10202 [TCP segment of a reassembled PDU]
 31   0.028184 172.31.36.109 -> 54.230.30.226 TCP 66 40142 > http [ACK] Seq=99 Ack=63331 Win=129280 Len=0 TSval=36683928 TSecr=667344380
 32   0.028366 54.230.30.226 -> 172.31.36.109 TCP 2027 [TCP segment of a reassembled PDU]
 33   0.028371 172.31.36.109 -> 54.230.30.226 TCP 66 40142 > http [ACK] Seq=99 Ack=65292 Win=133248 Len=0 TSval=36683928 TSecr=667344380
 34   0.031170 54.230.30.226 -> 172.31.36.109 TCP 5858 [TCP segment of a reassembled PDU]
 35   0.031194 172.31.36.109 -> 54.230.30.226 TCP 66 40142 > http [ACK] Seq=99 Ack=71084 Win=144896 Len=0 TSval=36683929 TSecr=667344381
 36   0.031440 54.230.30.226 -> 172.31.36.109 TCP 5858 [TCP segment of a reassembled PDU]
 37   0.031446 172.31.36.109 -> 54.230.30.226 TCP 66 40142 > http [ACK] Seq=99 Ack=76876 Win=156416 Len=0 TSval=36683929 TSecr=667344381
 38   0.031925 54.230.30.226 -> 172.31.36.109 TCP 2962 [TCP segment of a reassembled PDU]
 39   0.031930 172.31.36.109 -> 54.230.30.226 TCP 66 40142 > http [ACK] Seq=99 Ack=79772 Win=162176 Len=0 TSval=36683929 TSecr=667344381
 40   0.032042 54.230.30.226 -> 172.31.36.109 TCP 5858 [TCP segment of a reassembled PDU]
 41   0.032047 172.31.36.109 -> 54.230.30.226 TCP 66 40142 > http [ACK] Seq=99 Ack=85564 Win=173824 Len=0 TSval=36683929 TSecr=667344381
 42   0.032266 54.230.30.226 -> 172.31.36.109 TCP 7306 [TCP segment of a reassembled PDU]
 43   0.032273 172.31.36.109 -> 54.230.30.226 TCP 66 40142 > http [ACK] Seq=99 Ack=92804 Win=188288 Len=0 TSval=36683929 TSecr=667344381
 44   0.032481 54.230.30.226 -> 172.31.36.109 TCP 5858 [TCP segment of a reassembled PDU]
 45   0.032487 172.31.36.109 -> 54.230.30.226 TCP 66 40142 > http [ACK] Seq=99 Ack=98596 Win=199808 Len=0 TSval=36683929 TSecr=667344381
 46   0.032716 54.230.30.226 -> 172.31.36.109 HTTP 4327 HTTP/1.1 200 OK  (application/octet-stream)
 47   0.032729 172.31.36.109 -> 54.230.30.226 TCP 66 40142 > http [ACK] Seq=99 Ack=102857 Win=208384 Len=0 TSval=36683929 TSecr=667344381
 48   0.032854 172.31.36.109 -> 54.230.30.226 TCP 66 40142 > http [FIN, ACK] Seq=99 Ack=102857 Win=208384 Len=0 TSval=36683929 TSecr=667344381
 49   0.033951 54.230.30.226 -> 172.31.36.109 TCP 66 http > 40142 [FIN, ACK] Seq=102857 Ack=100 Win=14592 Len=0 TSval=667344381 TSecr=36683929
 50   0.033959 172.31.36.109 -> 54.230.30.226 TCP 66 40142 > http [ACK] Seq=100 Ack=102858 Win=208384 Len=0 TSval=36683929 TSecr=667344381
