[Measurement for 100kb at 21:38:43 19.38.2014] 
Tshark:

  1   0.000000 172.31.29.138 -> 172.31.0.2   DNS 89 Standard query 0x110b  A d3m1c4hwkgedal.cloudfront.net
  2   0.000033 172.31.29.138 -> 172.31.0.2   DNS 89 Standard query 0x2c29  AAAA d3m1c4hwkgedal.cloudfront.net
  3   0.000661   172.31.0.2 -> 172.31.29.138 DNS 174 Standard query response 0x2c29 
  4   0.000672   172.31.0.2 -> 172.31.29.138 DNS 217 Standard query response 0x110b  A 54.230.158.139 A 54.230.158.246 A 54.230.159.4 A 54.230.159.153 A 54.192.157.146 A 54.192.157.149 A 54.192.159.173 A 54.230.157.230
  5   0.003733 172.31.29.138 -> 54.230.158.139 TCP 74 58761 > http [SYN] Seq=0 Win=26883 Len=0 MSS=8961 SACK_PERM=1 TSval=4249161 TSecr=0 WS=128
  6   0.004263 54.230.158.139 -> 172.31.29.138 TCP 74 http > 58761 [SYN, ACK] Seq=0 Ack=1 Win=14480 Len=0 MSS=1460 SACK_PERM=1 TSval=727950265 TSecr=4249161 WS=128
  7   0.004276 172.31.29.138 -> 54.230.158.139 TCP 66 58761 > http [ACK] Seq=1 Ack=1 Win=27008 Len=0 TSval=4249161 TSecr=727950265
  8   0.004351 172.31.29.138 -> 54.230.158.139 HTTP 164 GET /100kb HTTP/1.1 
  9   0.004778 54.230.158.139 -> 172.31.29.138 TCP 66 http > 58761 [ACK] Seq=1 Ack=99 Win=14592 Len=0 TSval=727950265 TSecr=4249162
 10   0.007200 54.230.158.139 -> 172.31.29.138 TCP 13098 [TCP segment of a reassembled PDU]
 11   0.007213 172.31.29.138 -> 54.230.158.139 TCP 66 58761 > http [ACK] Seq=99 Ack=13033 Win=52992 Len=0 TSval=4249162 TSecr=727950265
 12   0.007700 54.230.158.139 -> 172.31.29.138 TCP 4410 [TCP segment of a reassembled PDU]
 13   0.007707 172.31.29.138 -> 54.230.158.139 TCP 66 58761 > http [ACK] Seq=99 Ack=17377 Win=61696 Len=0 TSval=4249162 TSecr=727950265
 14   0.007778 54.230.158.139 -> 172.31.29.138 TCP 8754 [TCP segment of a reassembled PDU]
 15   0.007785 172.31.29.138 -> 54.230.158.139 TCP 66 58761 > http [ACK] Seq=99 Ack=26065 Win=79104 Len=0 TSval=4249162 TSecr=727950265
 16   0.008540 54.230.158.139 -> 172.31.29.138 TCP 11650 [TCP segment of a reassembled PDU]
 17   0.008549 172.31.29.138 -> 54.230.158.139 TCP 66 58761 > http [ACK] Seq=99 Ack=37649 Win=98944 Len=0 TSval=4249163 TSecr=727950265
 18   0.008555 54.230.158.139 -> 172.31.29.138 TCP 1514 [TCP segment of a reassembled PDU]
 19   0.008558 172.31.29.138 -> 54.230.158.139 TCP 66 58761 > http [ACK] Seq=99 Ack=39097 Win=97536 Len=0 TSval=4249163 TSecr=727950265
 20   0.009217 54.230.158.139 -> 172.31.29.138 TCP 5858 [TCP segment of a reassembled PDU]
 21   0.009223 172.31.29.138 -> 54.230.158.139 TCP 66 58761 > http [ACK] Seq=99 Ack=44889 Win=108416 Len=0 TSval=4249163 TSecr=727950265
 22   0.009318 54.230.158.139 -> 172.31.29.138 TCP 15994 [TCP segment of a reassembled PDU]
 23   0.009329 172.31.29.138 -> 54.230.158.139 TCP 66 58761 > http [ACK] Seq=99 Ack=60817 Win=92544 Len=0 TSval=4249163 TSecr=727950265
 24   0.009748 54.230.158.139 -> 172.31.29.138 TCP 4410 [TCP segment of a reassembled PDU]
 25   0.009754 172.31.29.138 -> 54.230.158.139 TCP 66 58761 > http [ACK] Seq=99 Ack=65161 Win=109056 Len=0 TSval=4249163 TSecr=727950265
 26   0.009809 54.230.158.139 -> 172.31.29.138 TCP 13098 [TCP segment of a reassembled PDU]
 27   0.009818 172.31.29.138 -> 54.230.158.139 TCP 66 58761 > http [ACK] Seq=99 Ack=78193 Win=96512 Len=0 TSval=4249163 TSecr=727950265
 28   0.010481 54.230.158.139 -> 172.31.29.138 TCP 2962 [TCP segment of a reassembled PDU]
 29   0.010486 172.31.29.138 -> 54.230.158.139 TCP 66 58761 > http [ACK] Seq=99 Ack=81089 Win=109056 Len=0 TSval=4249163 TSecr=727950265
 30   0.010604 54.230.158.139 -> 172.31.29.138 HTTP 21834 HTTP/1.1 200 OK  (application/octet-stream)
 31   0.010613 172.31.29.138 -> 54.230.158.139 TCP 66 58761 > http [ACK] Seq=99 Ack=102857 Win=87296 Len=0 TSval=4249163 TSecr=727950265
 32   0.010753 172.31.29.138 -> 54.230.158.139 TCP 66 58761 > http [FIN, ACK] Seq=99 Ack=102857 Win=109056 Len=0 TSval=4249163 TSecr=727950265
 33   0.011317 54.230.158.139 -> 172.31.29.138 TCP 66 http > 58761 [FIN, ACK] Seq=102857 Ack=100 Win=14592 Len=0 TSval=727950265 TSecr=4249163
 34   0.011326 172.31.29.138 -> 54.230.158.139 TCP 66 58761 > http [ACK] Seq=100 Ack=102858 Win=109056 Len=0 TSval=4249163 TSecr=727950265
