[Measurement for 100kb at 17:41:07 19.41.2014] 
Tshark:

  1   0.000000 172.31.29.138 -> 172.31.0.2   DNS 89 Standard query 0x2823  A d3m1c4hwkgedal.cloudfront.net
  2   0.000043 172.31.29.138 -> 172.31.0.2   DNS 89 Standard query 0x0f64  AAAA d3m1c4hwkgedal.cloudfront.net
  3   0.000684   172.31.0.2 -> 172.31.29.138 DNS 174 Standard query response 0x0f64 
  4   0.000695   172.31.0.2 -> 172.31.29.138 DNS 217 Standard query response 0x2823  A 54.192.159.78 A 54.192.159.178 A 54.230.156.193 A 54.230.158.246 A 54.230.159.138 A 54.192.156.109 A 54.192.157.146 A 54.192.159.76
  5   0.003875 172.31.29.138 -> 54.192.159.78 TCP 74 33016 > http [SYN] Seq=0 Win=26883 Len=0 MSS=8961 SACK_PERM=1 TSval=685021 TSecr=0 WS=128
  6   0.004508 54.192.159.78 -> 172.31.29.138 TCP 74 http > 33016 [SYN, ACK] Seq=0 Ack=1 Win=14480 Len=0 MSS=1460 SACK_PERM=1 TSval=837642797 TSecr=685021 WS=128
  7   0.004522 172.31.29.138 -> 54.192.159.78 TCP 66 33016 > http [ACK] Seq=1 Ack=1 Win=27008 Len=0 TSval=685021 TSecr=837642797
  8   0.004567 172.31.29.138 -> 54.192.159.78 HTTP 164 GET /100kb HTTP/1.1 
  9   0.005226 54.192.159.78 -> 172.31.29.138 TCP 66 http > 33016 [ACK] Seq=1 Ack=99 Win=14592 Len=0 TSval=837642797 TSecr=685021
 10   0.246443 54.192.159.78 -> 172.31.29.138 TCP 13517 [TCP segment of a reassembled PDU]
 11   0.246487 172.31.29.138 -> 54.192.159.78 TCP 66 33016 > http [ACK] Seq=99 Ack=13452 Win=53888 Len=0 TSval=685082 TSecr=837642821
 12   0.332850 54.192.159.78 -> 172.31.29.138 TCP 1514 [TCP segment of a reassembled PDU]
 13   0.332891 172.31.29.138 -> 54.192.159.78 TCP 66 33016 > http [ACK] Seq=99 Ack=14900 Win=56704 Len=0 TSval=685103 TSecr=837642830
 14   0.332910 54.192.159.78 -> 172.31.29.138 TCP 1538 [TCP segment of a reassembled PDU]
 15   0.332918 172.31.29.138 -> 54.192.159.78 TCP 66 33016 > http [ACK] Seq=99 Ack=16372 Win=59648 Len=0 TSval=685103 TSecr=837642830
 16   0.333081 54.192.159.78 -> 172.31.29.138 TCP 2962 [TCP segment of a reassembled PDU]
 17   0.333087 172.31.29.138 -> 54.192.159.78 TCP 66 33016 > http [ACK] Seq=99 Ack=19268 Win=65536 Len=0 TSval=685103 TSecr=837642830
 18   0.333127 54.192.159.78 -> 172.31.29.138 TCP 8754 [TCP segment of a reassembled PDU]
 19   0.333135 172.31.29.138 -> 54.192.159.78 TCP 66 33016 > http [ACK] Seq=99 Ack=27956 Win=82816 Len=0 TSval=685103 TSecr=837642830
 20   0.333386 54.192.159.78 -> 172.31.29.138 TCP 7306 [TCP segment of a reassembled PDU]
 21   0.333392 172.31.29.138 -> 54.192.159.78 TCP 66 33016 > http [ACK] Seq=99 Ack=35196 Win=97280 Len=0 TSval=685103 TSecr=837642830
 22   0.333839 54.192.159.78 -> 172.31.29.138 TCP 1514 [TCP segment of a reassembled PDU]
 23   0.333844 172.31.29.138 -> 54.192.159.78 TCP 66 33016 > http [ACK] Seq=99 Ack=36644 Win=100224 Len=0 TSval=685103 TSecr=837642830
 24   0.333961 54.192.159.78 -> 172.31.29.138 TCP 14834 [TCP segment of a reassembled PDU]
 25   0.333972 172.31.29.138 -> 54.192.159.78 TCP 66 33016 > http [ACK] Seq=99 Ack=51412 Win=91648 Len=0 TSval=685104 TSecr=837642830
 26   0.420417 54.192.159.78 -> 172.31.29.138 TCP 2962 [TCP segment of a reassembled PDU]
 27   0.420451 172.31.29.138 -> 54.192.159.78 TCP 66 33016 > http [ACK] Seq=99 Ack=54308 Win=105984 Len=0 TSval=685125 TSecr=837642839
 28   0.420461 54.192.159.78 -> 172.31.29.138 TCP 3010 [TCP segment of a reassembled PDU]
 29   0.420465 172.31.29.138 -> 54.192.159.78 TCP 66 33016 > http [ACK] Seq=99 Ack=57252 Win=105984 Len=0 TSval=685125 TSecr=837642839
 30   0.420476 54.192.159.78 -> 172.31.29.138 TCP 5858 [TCP segment of a reassembled PDU]
 31   0.420480 172.31.29.138 -> 54.192.159.78 TCP 66 33016 > http [ACK] Seq=99 Ack=63044 Win=100224 Len=0 TSval=685125 TSecr=837642839
 32   0.420484 54.192.159.78 -> 172.31.29.138 TCP 114 [TCP segment of a reassembled PDU]
 33   0.420486 172.31.29.138 -> 54.192.159.78 TCP 66 33016 > http [ACK] Seq=99 Ack=63092 Win=100224 Len=0 TSval=685125 TSecr=837642839
 34   0.420579 54.192.159.78 -> 172.31.29.138 TCP 2962 [TCP segment of a reassembled PDU]
 35   0.420583 172.31.29.138 -> 54.192.159.78 TCP 66 33016 > http [ACK] Seq=99 Ack=65988 Win=97408 Len=0 TSval=685125 TSecr=837642839
 36   0.421119 54.192.159.78 -> 172.31.29.138 TCP 1514 [TCP segment of a reassembled PDU]
 37   0.421125 172.31.29.138 -> 54.192.159.78 TCP 66 33016 > http [ACK] Seq=99 Ack=67436 Win=112000 Len=0 TSval=685125 TSecr=837642839
 38   0.421251 54.192.159.78 -> 172.31.29.138 TCP 22002 [TCP segment of a reassembled PDU]
 39   0.421263 172.31.29.138 -> 54.192.159.78 TCP 66 33016 > http [ACK] Seq=99 Ack=89372 Win=155776 Len=0 TSval=685125 TSecr=837642839
 40   0.507479 54.192.159.78 -> 172.31.29.138 TCP 1514 [TCP segment of a reassembled PDU]
 41   0.507494 172.31.29.138 -> 54.192.159.78 TCP 66 33016 > http [ACK] Seq=99 Ack=90820 Win=158720 Len=0 TSval=685147 TSecr=837642847
 42   0.507503 54.192.159.78 -> 172.31.29.138 TCP 2962 [TCP segment of a reassembled PDU]
 43   0.507506 172.31.29.138 -> 54.192.159.78 TCP 66 33016 > http [ACK] Seq=99 Ack=93716 Win=164480 Len=0 TSval=685147 TSecr=837642847
 44   0.507624 54.192.159.78 -> 172.31.29.138 TCP 1514 [TCP segment of a reassembled PDU]
 45   0.507629 172.31.29.138 -> 54.192.159.78 TCP 66 33016 > http [ACK] Seq=99 Ack=95164 Win=167424 Len=0 TSval=685147 TSecr=837642847
 46   0.507753 54.192.159.78 -> 172.31.29.138 HTTP 7748 HTTP/1.1 200 OK  (application/octet-stream)
 47   0.507760 172.31.29.138 -> 54.192.159.78 TCP 66 33016 > http [ACK] Seq=99 Ack=102846 Win=182784 Len=0 TSval=685147 TSecr=837642847
 48   0.507910 172.31.29.138 -> 54.192.159.78 TCP 66 33016 > http [FIN, ACK] Seq=99 Ack=102846 Win=182784 Len=0 TSval=685147 TSecr=837642847
 49   0.508394 54.192.159.78 -> 172.31.29.138 TCP 66 http > 33016 [FIN, ACK] Seq=102846 Ack=100 Win=14592 Len=0 TSval=837642848 TSecr=685147
 50   0.508405 172.31.29.138 -> 54.192.159.78 TCP 66 33016 > http [ACK] Seq=100 Ack=102847 Win=182784 Len=0 TSval=685147 TSecr=837642848
