[Measurement for 10mb at 07:40:55 20.40.2014] 
Tshark:

  1   0.000000 172.31.8.238 -> 172.31.0.2   DNS 89 Standard query 0xdc21  A d3796nkzln59xv.cloudfront.net
  2   0.000028 172.31.8.238 -> 172.31.0.2   DNS 89 Standard query 0x7d36  AAAA d3796nkzln59xv.cloudfront.net
  3   0.000613   172.31.0.2 -> 172.31.8.238 DNS 217 Standard query response 0xdc21  A 54.239.132.83 A 54.192.118.219 A 54.192.118.224 A 54.230.119.3 A 54.230.119.55 A 54.230.119.71 A 54.230.119.94 A 54.239.132.55
  4   0.000623   172.31.0.2 -> 172.31.8.238 DNS 170 Standard query response 0x7d36 
  5   0.003866 172.31.8.238 -> 54.239.132.83 TCP 74 56123 > http [SYN] Seq=0 Win=26883 Len=0 MSS=8961 SACK_PERM=1 TSval=13220849 TSecr=0 WS=128
  6   0.004561 54.239.132.83 -> 172.31.8.238 TCP 74 http > 56123 [SYN, ACK] Seq=0 Ack=1 Win=14480 Len=0 MSS=1460 SACK_PERM=1 TSval=1685603451 TSecr=13220849 WS=128
  7   0.004575 172.31.8.238 -> 54.239.132.83 TCP 66 56123 > http [ACK] Seq=1 Ack=1 Win=27008 Len=0 TSval=13220849 TSecr=1685603451
  8   0.004614 172.31.8.238 -> 54.239.132.83 HTTP 163 GET /10mb HTTP/1.1 
  9   0.005273 54.239.132.83 -> 172.31.8.238 TCP 66 http > 56123 [ACK] Seq=1 Ack=98 Win=14592 Len=0 TSval=1685603451 TSecr=13220849
 10   0.006594 54.239.132.83 -> 172.31.8.238 TCP 8754 [TCP segment of a reassembled PDU]
 11   0.006604 172.31.8.238 -> 54.239.132.83 TCP 66 56123 > http [ACK] Seq=98 Ack=8689 Win=44288 Len=0 TSval=13220850 TSecr=1685603451
 12   0.006659 54.239.132.83 -> 172.31.8.238 TCP 5858 [TCP segment of a reassembled PDU]
 13   0.006666 172.31.8.238 -> 54.239.132.83 TCP 66 56123 > http [ACK] Seq=98 Ack=14481 Win=55936 Len=0 TSval=13220850 TSecr=1685603451
 14   0.007338 54.239.132.83 -> 172.31.8.238 TCP 7306 [TCP segment of a reassembled PDU]
 15   0.007346 172.31.8.238 -> 54.239.132.83 TCP 66 56123 > http [ACK] Seq=98 Ack=21721 Win=70400 Len=0 TSval=13220850 TSecr=1685603451
 16   0.007435 54.239.132.83 -> 172.31.8.238 TCP 5858 [TCP segment of a reassembled PDU]
 17   0.007442 172.31.8.238 -> 54.239.132.83 TCP 66 56123 > http [ACK] Seq=98 Ack=27513 Win=81920 Len=0 TSval=13220850 TSecr=1685603451
 18   0.008144 54.239.132.83 -> 172.31.8.238 TCP 13098 [TCP segment of a reassembled PDU]
 19   0.008154 172.31.8.238 -> 54.239.132.83 TCP 66 56123 > http [ACK] Seq=98 Ack=40545 Win=96512 Len=0 TSval=13220850 TSecr=1685603451
 20   0.008199 54.239.132.83 -> 172.31.8.238 TCP 7306 [TCP segment of a reassembled PDU]
 21   0.008206 172.31.8.238 -> 54.239.132.83 TCP 66 56123 > http [ACK] Seq=98 Ack=47785 Win=105984 Len=0 TSval=13220850 TSecr=1685603451
 22   0.008869 54.239.132.83 -> 172.31.8.238 TCP 5858 [TCP segment of a reassembled PDU]
 23   0.008875 172.31.8.238 -> 54.239.132.83 TCP 66 56123 > http [ACK] Seq=98 Ack=53577 Win=108416 Len=0 TSval=13220850 TSecr=1685603451
 24   0.009082 54.239.132.83 -> 172.31.8.238 TCP 13098 [TCP segment of a reassembled PDU]
 25   0.009091 172.31.8.238 -> 54.239.132.83 TCP 66 56123 > http [ACK] Seq=98 Ack=66609 Win=96512 Len=0 TSval=13220850 TSecr=1685603451
 26   0.009654 54.239.132.83 -> 172.31.8.238 TCP 8754 [TCP segment of a reassembled PDU]
 27   0.009661 172.31.8.238 -> 54.239.132.83 TCP 66 56123 > http [ACK] Seq=98 Ack=75297 Win=103680 Len=0 TSval=13220851 TSecr=1685603451
 28   0.009708 54.239.132.83 -> 172.31.8.238 TCP 2962 [TCP segment of a reassembled PDU]
 29   0.009712 172.31.8.238 -> 54.239.132.83 TCP 66 56123 > http [ACK] Seq=98 Ack=78193 Win=114816 Len=0 TSval=13220851 TSecr=1685603451
 30   0.009876 54.239.132.83 -> 172.31.8.238 TCP 4410 [TCP segment of a reassembled PDU]
 31   0.009881 172.31.8.238 -> 54.239.132.83 TCP 66 56123 > http [ACK] Seq=98 Ack=82537 Win=123520 Len=0 TSval=13220851 TSecr=1685603451
 32   0.009975 54.239.132.83 -> 172.31.8.238 TCP 10202 [TCP segment of a reassembled PDU]
 33   0.009983 172.31.8.238 -> 54.239.132.83 TCP 66 56123 > http [ACK] Seq=98 Ack=92673 Win=143872 Len=0 TSval=13220851 TSecr=1685603451
 34   0.010406 54.239.132.83 -> 172.31.8.238 TCP 2962 [TCP segment of a reassembled PDU]
 35   0.010412 172.31.8.238 -> 54.239.132.83 TCP 66 56123 > http [ACK] Seq=98 Ack=95569 Win=149632 Len=0 TSval=13220851 TSecr=1685603451
 36   0.010523 54.239.132.83 -> 172.31.8.238 TCP 11650 [TCP segment of a reassembled PDU]
 37   0.010530 172.31.8.238 -> 54.239.132.83 TCP 66 56123 > http [ACK] Seq=98 Ack=107153 Win=172800 Len=0 TSval=13220851 TSecr=1685603451
 38   0.010672 54.239.132.83 -> 172.31.8.238 TCP 11650 [TCP segment of a reassembled PDU]
 39   0.010680 172.31.8.238 -> 54.239.132.83 TCP 66 56123 > http [ACK] Seq=98 Ack=118737 Win=195968 Len=0 TSval=13220851 TSecr=1685603451
 40   0.010780 54.239.132.83 -> 172.31.8.238 TCP 5858 [TCP segment of a reassembled PDU]
 41   0.010787 172.31.8.238 -> 54.239.132.83 TCP 66 56123 > http [ACK] Seq=98 Ack=124529 Win=207488 Len=0 TSval=13220851 TSecr=1685603451
 42   0.011165 54.239.132.83 -> 172.31.8.238 TCP 5858 [TCP segment of a reassembled PDU]
 43   0.011172 172.31.8.238 -> 54.239.132.83 TCP 66 56123 > http [ACK] Seq=98 Ack=130321 Win=219136 Len=0 TSval=13220851 TSecr=1685603451
 44   0.011273 54.239.132.83 -> 172.31.8.238 TCP 4410 [TCP segment of a reassembled PDU]
 45   0.011279 172.31.8.238 -> 54.239.132.83 TCP 66 56123 > http [ACK] Seq=98 Ack=134665 Win=227840 Len=0 TSval=13220851 TSecr=1685603451
 46   0.011495 54.239.132.83 -> 172.31.8.238 TCP 20338 [TCP segment of a reassembled PDU]
 47   0.011519 172.31.8.238 -> 54.239.132.83 TCP 66 56123 > http [ACK] Seq=98 Ack=154937 Win=268288 Len=0 TSval=13220851 TSecr=1685603451
 48   0.011557 54.239.132.83 -> 172.31.8.238 TCP 7306 [TCP segment of a reassembled PDU]
 49   0.011564 172.31.8.238 -> 54.239.132.83 TCP 66 56123 > http [ACK] Seq=98 Ack=162177 Win=282880 Len=0 TSval=13220851 TSecr=1685603451
 50   0.012196 54.239.132.83 -> 172.31.8.238 TCP 7306 [TCP segment of a reassembled PDU]
 51   0.012203 172.31.8.238 -> 54.239.132.83 TCP 66 56123 > http [ACK] Seq=98 Ack=169417 Win=297344 Len=0 TSval=13220851 TSecr=1685603451
 52   0.012377 54.239.132.83 -> 172.31.8.238 TCP 26130 [TCP segment of a reassembled PDU]
 53   0.012404 172.31.8.238 -> 54.239.132.83 TCP 66 56123 > http [ACK] Seq=98 Ack=195481 Win=349440 Len=0 TSval=13220851 TSecr=1685603451
 54   0.012433 54.239.132.83 -> 172.31.8.238 TCP 10202 [TCP segment of a reassembled PDU]
 55   0.012439 172.31.8.238 -> 54.239.132.83 TCP 66 56123 > http [ACK] Seq=98 Ack=205617 Win=369664 Len=0 TSval=13220851 TSecr=1685603451
 56   0.012957 54.239.132.83 -> 172.31.8.238 TCP 7306 [TCP segment of a reassembled PDU]
 57   0.012964 172.31.8.238 -> 54.239.132.83 TCP 66 56123 > http [ACK] Seq=98 Ack=212857 Win=384128 Len=0 TSval=13220851 TSecr=1685603451
 58   0.013127 54.239.132.83 -> 172.31.8.238 TCP 26130 [TCP segment of a reassembled PDU]
 59   0.013153 172.31.8.238 -> 54.239.132.83 TCP 66 56123 > http [ACK] Seq=98 Ack=238921 Win=436352 Len=0 TSval=13220851 TSecr=1685603451
 60   0.013161 54.239.132.83 -> 172.31.8.238 TCP 2962 [TCP segment of a reassembled PDU]
 61   0.013164 172.31.8.238 -> 54.239.132.83 TCP 66 56123 > http [ACK] Seq=98 Ack=241817 Win=442112 Len=0 TSval=13220851 TSecr=1685603451
 62   0.013742 54.239.132.83 -> 172.31.8.238 TCP 4410 [TCP segment of a reassembled PDU]
 63   0.013748 172.31.8.238 -> 54.239.132.83 TCP 66 56123 > http [ACK] Seq=98 Ack=246161 Win=450816 Len=0 TSval=13220852 TSecr=1685603451
 64   0.013918 54.239.132.83 -> 172.31.8.238 TCP 21786 [TCP segment of a reassembled PDU]
 65   0.013930 172.31.8.238 -> 54.239.132.83 TCP 66 56123 > http [ACK] Seq=98 Ack=267881 Win=494208 Len=0 TSval=13220852 TSecr=1685603451
 66   0.013948 54.239.132.83 -> 172.31.8.238 TCP 4410 [TCP segment of a reassembled PDU]
 67   0.013953 172.31.8.238 -> 54.239.132.83 TCP 66 56123 > http [ACK] Seq=98 Ack=272225 Win=499456 Len=0 TSval=13220852 TSecr=1685603451
 68   0.014028 54.239.132.83 -> 172.31.8.238 TCP 17442 [TCP segment of a reassembled PDU]
 69   0.014039 172.31.8.238 -> 54.239.132.83 TCP 66 56123 > http [ACK] Seq=98 Ack=289601 Win=537728 Len=0 TSval=13220852 TSecr=1685603451
 70   0.014484 54.239.132.83 -> 172.31.8.238 TCP 2962 [TCP segment of a reassembled PDU]
 71   0.014490 172.31.8.238 -> 54.239.132.83 TCP 66 56123 > http [ACK] Seq=98 Ack=292497 Win=543488 Len=0 TSval=13220852 TSecr=1685603452
 72   0.014683 54.239.132.83 -> 172.31.8.238 TCP 26130 [TCP segment of a reassembled PDU]
 73   0.014697 172.31.8.238 -> 54.239.132.83 TCP 66 56123 > http [ACK] Seq=98 Ack=318561 Win=595584 Len=0 TSval=13220852 TSecr=1685603452
 74   0.014763 54.239.132.83 -> 172.31.8.238 TCP 26130 [TCP segment of a reassembled PDU]
 75   0.014777 172.31.8.238 -> 54.239.132.83 TCP 66 56123 > http [ACK] Seq=98 Ack=344625 Win=647680 Len=0 TSval=13220852 TSecr=1685603452
 76   0.014810 54.239.132.83 -> 172.31.8.238 TCP 2962 [TCP segment of a reassembled PDU]
 77   0.014814 172.31.8.238 -> 54.239.132.83 TCP 66 56123 > http [ACK] Seq=98 Ack=347521 Win=653568 Len=0 TSval=13220852 TSecr=1685603452
 78   0.015555 54.239.132.83 -> 172.31.8.238 TCP 11650 [TCP segment of a reassembled PDU]
 79   0.015563 172.31.8.238 -> 54.239.132.83 TCP 66 56123 > http [ACK] Seq=98 Ack=359105 Win=676736 Len=0 TSval=13220852 TSecr=1685603452
 80   0.015699 54.239.132.83 -> 172.31.8.238 TCP 21786 [TCP segment of a reassembled PDU]
 81   0.015711 172.31.8.238 -> 54.239.132.83 TCP 66 56123 > http [ACK] Seq=98 Ack=380825 Win=720128 Len=0 TSval=13220852 TSecr=1685603452
 82   0.015730 54.239.132.83 -> 172.31.8.238 TCP 4410 [TCP segment of a reassembled PDU]
 83   0.015735 172.31.8.238 -> 54.239.132.83 TCP 66 56123 > http [ACK] Seq=98 Ack=385169 Win=728832 Len=0 TSval=13220852 TSecr=1685603452
 84   0.015832 54.239.132.83 -> 172.31.8.238 TCP 26130 [TCP segment of a reassembled PDU]
 85   0.015845 172.31.8.238 -> 54.239.132.83 TCP 66 56123 > http [ACK] Seq=98 Ack=411233 Win=780928 Len=0 TSval=13220852 TSecr=1685603452
 86   0.016283 54.239.132.83 -> 172.31.8.238 TCP 4410 [TCP segment of a reassembled PDU]
 87   0.016290 172.31.8.238 -> 54.239.132.83 TCP 66 56123 > http [ACK] Seq=98 Ack=415577 Win=789632 Len=0 TSval=13220852 TSecr=1685603452
 88   0.016479 54.239.132.83 -> 172.31.8.238 TCP 26130 [TCP segment of a reassembled PDU]
 89   0.016493 172.31.8.238 -> 54.239.132.83 TCP 66 56123 > http [ACK] Seq=98 Ack=441641 Win=841728 Len=0 TSval=13220852 TSecr=1685603452
 90   0.016560 54.239.132.83 -> 172.31.8.238 TCP 26130 [TCP segment of a reassembled PDU]
 91   0.016573 172.31.8.238 -> 54.239.132.83 TCP 66 56123 > http [ACK] Seq=98 Ack=467705 Win=893824 Len=0 TSval=13220852 TSecr=1685603452
 92   0.016627 54.239.132.83 -> 172.31.8.238 TCP 13098 [TCP segment of a reassembled PDU]
 93   0.016637 172.31.8.238 -> 54.239.132.83 TCP 66 56123 > http [ACK] Seq=98 Ack=480737 Win=919936 Len=0 TSval=13220852 TSecr=1685603452
 94   0.017317 54.239.132.83 -> 172.31.8.238 TCP 8754 [TCP segment of a reassembled PDU]
 95   0.017324 172.31.8.238 -> 54.239.132.83 TCP 66 56123 > http [ACK] Seq=98 Ack=489425 Win=937344 Len=0 TSval=13220852 TSecr=1685603452
 96   0.017503 54.239.132.83 -> 172.31.8.238 TCP 26130 [TCP segment of a reassembled PDU]
 97   0.017515 172.31.8.238 -> 54.239.132.83 TCP 66 56123 > http [ACK] Seq=98 Ack=515489 Win=930304 Len=0 TSval=13220852 TSecr=1685603452
 98   0.017599 54.239.132.83 -> 172.31.8.238 TCP 26130 [TCP segment of a reassembled PDU]
 99   0.017613 172.31.8.238 -> 54.239.132.83 TCP 66 56123 > http [ACK] Seq=98 Ack=541553 Win=930304 Len=0 TSval=13220853 TSecr=1685603452
100   0.017659 54.239.132.83 -> 172.31.8.238 TCP 14546 [TCP segment of a reassembled PDU]
101   0.017669 172.31.8.238 -> 54.239.132.83 TCP 66 56123 > http [ACK] Seq=98 Ack=556033 Win=966272 Len=0 TSval=13220853 TSecr=1685603452
102   0.018269 54.239.132.83 -> 172.31.8.238 TCP 7306 [TCP segment of a reassembled PDU]
103   0.018276 172.31.8.238 -> 54.239.132.83 TCP 66 56123 > http [ACK] Seq=98 Ack=563273 Win=980736 Len=0 TSval=13220853 TSecr=1685603452
104   0.018442 54.239.132.83 -> 172.31.8.238 TCP 21786 [TCP segment of a reassembled PDU]
105   0.018452 172.31.8.238 -> 54.239.132.83 TCP 66 56123 > http [ACK] Seq=98 Ack=584993 Win=1024256 Len=0 TSval=13220853 TSecr=1685603452
106   0.018582 54.239.132.83 -> 172.31.8.238 TCP 18890 [TCP segment of a reassembled PDU]
107   0.018594 172.31.8.238 -> 54.239.132.83 TCP 66 56123 > http [ACK] Seq=98 Ack=603817 Win=1061888 Len=0 TSval=13220853 TSecr=1685603452
108   0.018613 54.239.132.83 -> 172.31.8.238 TCP 7306 [TCP segment of a reassembled PDU]
109   0.018618 172.31.8.238 -> 54.239.132.83 TCP 66 56123 > http [ACK] Seq=98 Ack=611057 Win=1076352 Len=0 TSval=13220853 TSecr=1685603452
110   0.018673 54.239.132.83 -> 172.31.8.238 TCP 10202 [TCP segment of a reassembled PDU]
111   0.018681 172.31.8.238 -> 54.239.132.83 TCP 66 56123 > http [ACK] Seq=98 Ack=621193 Win=1096576 Len=0 TSval=13220853 TSecr=1685603452
112   0.019034 54.239.132.83 -> 172.31.8.238 TCP 26130 [TCP segment of a reassembled PDU]
113   0.019047 172.31.8.238 -> 54.239.132.83 TCP 66 56123 > http [ACK] Seq=98 Ack=647257 Win=1148672 Len=0 TSval=13220853 TSecr=1685603452
114   0.019056 54.239.132.83 -> 172.31.8.238 TCP 2962 [TCP segment of a reassembled PDU]
115   0.019059 172.31.8.238 -> 54.239.132.83 TCP 66 56123 > http [ACK] Seq=98 Ack=650153 Win=1154560 Len=0 TSval=13220853 TSecr=1685603452
116   0.019463 54.239.132.83 -> 172.31.8.238 TCP 13098 [TCP segment of a reassembled PDU]
117   0.019472 172.31.8.238 -> 54.239.132.83 TCP 66 56123 > http [ACK] Seq=98 Ack=663185 Win=1180544 Len=0 TSval=13220853 TSecr=1685603452
118   0.019631 54.239.132.83 -> 172.31.8.238 TCP 26130 [TCP segment of a reassembled PDU]
119   0.019644 172.31.8.238 -> 54.239.132.83 TCP 66 56123 > http [ACK] Seq=98 Ack=689249 Win=1232768 Len=0 TSval=13220853 TSecr=1685603452
120   0.019704 54.239.132.83 -> 172.31.8.238 TCP 23234 [TCP segment of a reassembled PDU]
121   0.019716 172.31.8.238 -> 54.239.132.83 TCP 66 56123 > http [ACK] Seq=98 Ack=712417 Win=1279104 Len=0 TSval=13220853 TSecr=1685603452
122   0.019741 54.239.132.83 -> 172.31.8.238 TCP 2962 [TCP segment of a reassembled PDU]
123   0.019745 172.31.8.238 -> 54.239.132.83 TCP 66 56123 > http [ACK] Seq=98 Ack=715313 Win=1284864 Len=0 TSval=13220853 TSecr=1685603452
124   0.020045 54.239.132.83 -> 172.31.8.238 TCP 26130 [TCP segment of a reassembled PDU]
125   0.020059 172.31.8.238 -> 54.239.132.83 TCP 66 56123 > http [ACK] Seq=98 Ack=741377 Win=1336960 Len=0 TSval=13220853 TSecr=1685603452
126   0.020095 54.239.132.83 -> 172.31.8.238 TCP 14546 [TCP segment of a reassembled PDU]
127   0.020103 172.31.8.238 -> 54.239.132.83 TCP 66 56123 > http [ACK] Seq=98 Ack=755857 Win=1365888 Len=0 TSval=13220853 TSecr=1685603452
128   0.020315 54.239.132.83 -> 172.31.8.238 TCP 18890 [TCP segment of a reassembled PDU]
129   0.020326 172.31.8.238 -> 54.239.132.83 TCP 66 56123 > http [ACK] Seq=98 Ack=774681 Win=1401728 Len=0 TSval=13220853 TSecr=1685603452
130   0.020346 54.239.132.83 -> 172.31.8.238 TCP 5858 [TCP segment of a reassembled PDU]
131   0.020350 172.31.8.238 -> 54.239.132.83 TCP 66 56123 > http [ACK] Seq=98 Ack=780473 Win=1395968 Len=0 TSval=13220853 TSecr=1685603452
132   0.020465 54.239.132.83 -> 172.31.8.238 TCP 4410 [TCP segment of a reassembled PDU]
133   0.020471 172.31.8.238 -> 54.239.132.83 TCP 66 56123 > http [ACK] Seq=98 Ack=784817 Win=1412224 Len=0 TSval=13220853 TSecr=1685603452
134   0.020611 54.239.132.83 -> 172.31.8.238 TCP 26130 [TCP segment of a reassembled PDU]
135   0.020635 172.31.8.238 -> 54.239.132.83 TCP 66 56123 > http [ACK] Seq=98 Ack=810881 Win=1389824 Len=0 TSval=13220853 TSecr=1685603452
136   0.020694 54.239.132.83 -> 172.31.8.238 TCP 26130 [TCP segment of a reassembled PDU]
137   0.020707 172.31.8.238 -> 54.239.132.83 TCP 66 56123 > http [ACK] Seq=98 Ack=836945 Win=1389824 Len=0 TSval=13220853 TSecr=1685603452
138   0.020750 54.239.132.83 -> 172.31.8.238 TCP 8754 [TCP segment of a reassembled PDU]
139   0.020757 172.31.8.238 -> 54.239.132.83 TCP 66 56123 > http [ACK] Seq=98 Ack=845633 Win=1418368 Len=0 TSval=13220853 TSecr=1685603452
140   0.021198 54.239.132.83 -> 172.31.8.238 TCP 8754 [TCP segment of a reassembled PDU]
141   0.021206 172.31.8.238 -> 54.239.132.83 TCP 66 56123 > http [ACK] Seq=98 Ack=854321 Win=1418368 Len=0 TSval=13220853 TSecr=1685603452
142   0.021390 54.239.132.83 -> 172.31.8.238 TCP 26130 [TCP segment of a reassembled PDU]
143   0.021416 172.31.8.238 -> 54.239.132.83 TCP 66 56123 > http [ACK] Seq=98 Ack=880385 Win=1392384 Len=0 TSval=13220853 TSecr=1685603452
144   0.021467 54.239.132.83 -> 172.31.8.238 TCP 18890 [TCP segment of a reassembled PDU]
145   0.021479 172.31.8.238 -> 54.239.132.83 TCP 66 56123 > http [ACK] Seq=98 Ack=899209 Win=1401728 Len=0 TSval=13220853 TSecr=1685603452
146   0.021565 54.239.132.83 -> 172.31.8.238 TCP 33370 [TCP segment of a reassembled PDU]
147   0.021595 172.31.8.238 -> 54.239.132.83 TCP 66 56123 > http [ACK] Seq=98 Ack=932513 Win=1377920 Len=0 TSval=13220854 TSecr=1685603452
148   0.021645 54.239.132.83 -> 172.31.8.238 TCP 21786 [TCP segment of a reassembled PDU]
149   0.021658 172.31.8.238 -> 54.239.132.83 TCP 66 56123 > http [ACK] Seq=98 Ack=954233 Win=1396992 Len=0 TSval=13220854 TSecr=1685603452
150   0.022220 54.239.132.83 -> 172.31.8.238 TCP 7306 [TCP segment of a reassembled PDU]
151   0.022227 172.31.8.238 -> 54.239.132.83 TCP 66 56123 > http [ACK] Seq=98 Ack=961473 Win=1420800 Len=0 TSval=13220854 TSecr=1685603452
152   0.022379 54.239.132.83 -> 172.31.8.238 TCP 14546 [TCP segment of a reassembled PDU]
153   0.022401 172.31.8.238 -> 54.239.132.83 TCP 66 56123 > http [ACK] Seq=98 Ack=975953 Win=1429248 Len=0 TSval=13220854 TSecr=1685603452
154   0.022471 54.239.132.83 -> 172.31.8.238 TCP 26130 [TCP segment of a reassembled PDU]
155   0.022560 54.239.132.83 -> 172.31.8.238 TCP 26130 [TCP segment of a reassembled PDU]
156   0.022611 54.239.132.83 -> 172.31.8.238 TCP 13098 [TCP segment of a reassembled PDU]
157   0.022677 172.31.8.238 -> 54.239.132.83 TCP 66 56123 > http [ACK] Seq=98 Ack=1041113 Win=1364096 Len=0 TSval=13220854 TSecr=1685603452
158   0.023259 54.239.132.83 -> 172.31.8.238 TCP 2962 [TCP segment of a reassembled PDU]
159   0.023265 172.31.8.238 -> 54.239.132.83 TCP 66 56123 > http [ACK] Seq=98 Ack=1044009 Win=1427840 Len=0 TSval=13220854 TSecr=1685603452
160   0.023427 54.239.132.83 -> 172.31.8.238 TCP 20338 [TCP segment of a reassembled PDU]
161   0.023451 172.31.8.238 -> 54.239.132.83 TCP 66 56123 > http [ACK] Seq=98 Ack=1064281 Win=1407616 Len=0 TSval=13220854 TSecr=1685603452
162   0.023633 54.239.132.83 -> 172.31.8.238 TCP 57986 [TCP segment of a reassembled PDU]
163   0.023660 54.239.132.83 -> 172.31.8.238 TCP 4410 [TCP segment of a reassembled PDU]
164   0.023676 172.31.8.238 -> 54.239.132.83 TCP 66 56123 > http [ACK] Seq=98 Ack=1126545 Win=1345408 Len=0 TSval=13220854 TSecr=1685603452
165   0.023712 54.239.132.83 -> 172.31.8.238 TCP 21786 [TCP segment of a reassembled PDU]
166   0.023729 172.31.8.238 -> 54.239.132.83 TCP 66 56123 > http [ACK] Seq=98 Ack=1148265 Win=1396992 Len=0 TSval=13220854 TSecr=1685603452
167   0.023765 54.239.132.83 -> 172.31.8.238 TCP 13098 [TCP segment of a reassembled PDU]
168   0.023772 172.31.8.238 -> 54.239.132.83 TCP 66 56123 > http [ACK] Seq=98 Ack=1161297 Win=1411328 Len=0 TSval=13220854 TSecr=1685603452
169   0.024147 54.239.132.83 -> 172.31.8.238 TCP 10202 [TCP segment of a reassembled PDU]
170   0.024156 172.31.8.238 -> 54.239.132.83 TCP 66 56123 > http [ACK] Seq=98 Ack=1171433 Win=1416064 Len=0 TSval=13220854 TSecr=1685603453
171   0.024288 54.239.132.83 -> 172.31.8.238 TCP 4410 [TCP segment of a reassembled PDU]
172   0.024294 172.31.8.238 -> 54.239.132.83 TCP 66 56123 > http [ACK] Seq=98 Ack=1175777 Win=1425536 Len=0 TSval=13220854 TSecr=1685603453
173   0.024461 54.239.132.83 -> 172.31.8.238 TCP 26130 [TCP segment of a reassembled PDU]
174   0.024498 172.31.8.238 -> 54.239.132.83 TCP 66 56123 > http [ACK] Seq=98 Ack=1201841 Win=1399552 Len=0 TSval=13220854 TSecr=1685603453
175   0.024548 54.239.132.83 -> 172.31.8.238 TCP 26130 [TCP segment of a reassembled PDU]
176   0.024605 54.239.132.83 -> 172.31.8.238 TCP 8754 [TCP segment of a reassembled PDU]
177   0.024673 54.239.132.83 -> 172.31.8.238 TCP 26130 [TCP segment of a reassembled PDU]
178   0.024743 54.239.132.83 -> 172.31.8.238 TCP 26130 [TCP segment of a reassembled PDU]
179   0.024764 172.31.8.238 -> 54.239.132.83 TCP 66 56123 > http [ACK] Seq=98 Ack=1288721 Win=1312768 Len=0 TSval=13220854 TSecr=1685603453
180   0.025060 54.239.132.83 -> 172.31.8.238 TCP 2962 [TCP segment of a reassembled PDU]
181   0.025066 172.31.8.238 -> 54.239.132.83 TCP 66 56123 > http [ACK] Seq=98 Ack=1291617 Win=1427840 Len=0 TSval=13220854 TSecr=1685603453
182   0.025202 54.239.132.83 -> 172.31.8.238 TCP 10202 [TCP segment of a reassembled PDU]
183   0.025221 172.31.8.238 -> 54.239.132.83 TCP 66 56123 > http [ACK] Seq=98 Ack=1301753 Win=1429248 Len=0 TSval=13220854 TSecr=1685603453
184   0.025357 54.239.132.83 -> 172.31.8.238 TCP 14546 [TCP segment of a reassembled PDU]
185   0.025378 172.31.8.238 -> 54.239.132.83 TCP 66 56123 > http [ACK] Seq=98 Ack=1316233 Win=1429248 Len=0 TSval=13220854 TSecr=1685603453
186   0.025510 54.239.132.83 -> 172.31.8.238 TCP 26130 [TCP segment of a reassembled PDU]
187   0.025577 54.239.132.83 -> 172.31.8.238 TCP 26130 [TCP segment of a reassembled PDU]
188   0.025611 172.31.8.238 -> 54.239.132.83 TCP 66 56123 > http [ACK] Seq=98 Ack=1368361 Win=1377152 Len=0 TSval=13220855 TSecr=1685603453
189   0.025652 54.239.132.83 -> 172.31.8.238 TCP 26130 [TCP segment of a reassembled PDU]
190   0.025665 172.31.8.238 -> 54.239.132.83 TCP 66 56123 > http [ACK] Seq=98 Ack=1394425 Win=1389824 Len=0 TSval=13220855 TSecr=1685603453
191   0.025749 54.239.132.83 -> 172.31.8.238 TCP 26130 [TCP segment of a reassembled PDU]
192   0.025762 172.31.8.238 -> 54.239.132.83 TCP 66 56123 > http [ACK] Seq=98 Ack=1420489 Win=1389824 Len=0 TSval=13220855 TSecr=1685603453
193   0.025793 54.239.132.83 -> 172.31.8.238 TCP 1514 [TCP segment of a reassembled PDU]
194   0.025941 54.239.132.83 -> 172.31.8.238 TCP 10202 [TCP segment of a reassembled PDU]
195   0.025949 172.31.8.238 -> 54.239.132.83 TCP 66 56123 > http [ACK] Seq=98 Ack=1432073 Win=1416064 Len=0 TSval=13220855 TSecr=1685603453
196   0.026082 54.239.132.83 -> 172.31.8.238 TCP 1514 [TCP segment of a reassembled PDU]
197   0.026255 54.239.132.83 -> 172.31.8.238 TCP 23234 [TCP segment of a reassembled PDU]
198   0.026278 172.31.8.238 -> 54.239.132.83 TCP 66 56123 > http [ACK] Seq=98 Ack=1456689 Win=1394560 Len=0 TSval=13220855 TSecr=1685603453
199   0.026308 54.239.132.83 -> 172.31.8.238 TCP 2962 [TCP segment of a reassembled PDU]
200   0.026315 172.31.8.238 -> 54.239.132.83 TCP 66 56123 > http [ACK] Seq=98 Ack=1459585 Win=1427840 Len=0 TSval=13220855 TSecr=1685603453
201   0.026417 54.239.132.83 -> 172.31.8.238 TCP 37714 [TCP segment of a reassembled PDU]
202   0.026446 172.31.8.238 -> 54.239.132.83 TCP 66 56123 > http [ACK] Seq=98 Ack=1497233 Win=1390208 Len=0 TSval=13220855 TSecr=1685603453
203   0.026492 54.239.132.83 -> 172.31.8.238 TCP 21786 [TCP segment of a reassembled PDU]
204   0.026517 172.31.8.238 -> 54.239.132.83 TCP 66 56123 > http [ACK] Seq=98 Ack=1518953 Win=1396992 Len=0 TSval=13220855 TSecr=1685603453
205   0.026562 54.239.132.83 -> 172.31.8.238 TCP 4410 [TCP segment of a reassembled PDU]
206   0.026567 172.31.8.238 -> 54.239.132.83 TCP 66 56123 > http [ACK] Seq=98 Ack=1523297 Win=1425536 Len=0 TSval=13220855 TSecr=1685603453
207   0.026656 54.239.132.83 -> 172.31.8.238 TCP 39162 [TCP segment of a reassembled PDU]
208   0.026687 172.31.8.238 -> 54.239.132.83 TCP 66 56123 > http [ACK] Seq=98 Ack=1562393 Win=1386496 Len=0 TSval=13220855 TSecr=1685603453
209   0.027127 54.239.132.83 -> 172.31.8.238 TCP 4410 [TCP segment of a reassembled PDU]
210   0.027134 172.31.8.238 -> 54.239.132.83 TCP 66 56123 > http [ACK] Seq=98 Ack=1566737 Win=1425536 Len=0 TSval=13220855 TSecr=1685603453
211   0.027302 54.239.132.83 -> 172.31.8.238 TCP 26130 [TCP segment of a reassembled PDU]
212   0.027327 172.31.8.238 -> 54.239.132.83 TCP 66 56123 > http [ACK] Seq=98 Ack=1592801 Win=1399552 Len=0 TSval=13220855 TSecr=1685603453
213   0.027389 54.239.132.83 -> 172.31.8.238 TCP 26130 [TCP segment of a reassembled PDU]
214   0.027415 172.31.8.238 -> 54.239.132.83 TCP 66 56123 > http [ACK] Seq=98 Ack=1618865 Win=1389824 Len=0 TSval=13220855 TSecr=1685603453
215   0.027477 54.239.132.83 -> 172.31.8.238 TCP 26130 [TCP segment of a reassembled PDU]
216   0.027491 172.31.8.238 -> 54.239.132.83 TCP 66 56123 > http [ACK] Seq=98 Ack=1644929 Win=1389824 Len=0 TSval=13220855 TSecr=1685603453
217   0.027570 54.239.132.83 -> 172.31.8.238 TCP 26130 [TCP segment of a reassembled PDU]
218   0.027584 172.31.8.238 -> 54.239.132.83 TCP 66 56123 > http [ACK] Seq=98 Ack=1670993 Win=1389824 Len=0 TSval=13220855 TSecr=1685603453
219   0.027643 54.239.132.83 -> 172.31.8.238 TCP 21786 [TCP segment of a reassembled PDU]
220   0.027657 172.31.8.238 -> 54.239.132.83 TCP 66 56123 > http [ACK] Seq=98 Ack=1692713 Win=1396992 Len=0 TSval=13220855 TSecr=1685603453
221   0.028096 54.239.132.83 -> 172.31.8.238 TCP 26130 [TCP segment of a reassembled PDU]
222   0.028122 172.31.8.238 -> 54.239.132.83 TCP 66 56123 > http [ACK] Seq=98 Ack=1718777 Win=1389824 Len=0 TSval=13220855 TSecr=1685603453
223   0.028184 54.239.132.83 -> 172.31.8.238 TCP 26130 [TCP segment of a reassembled PDU]
224   0.028198 172.31.8.238 -> 54.239.132.83 TCP 66 56123 > http [ACK] Seq=98 Ack=1744841 Win=1389824 Len=0 TSval=13220855 TSecr=1685603453
225   0.028287 54.239.132.83 -> 172.31.8.238 TCP 26130 [TCP segment of a reassembled PDU]
226   0.028301 172.31.8.238 -> 54.239.132.83 TCP 66 56123 > http [ACK] Seq=98 Ack=1770905 Win=1389824 Len=0 TSval=13220855 TSecr=1685603453
227   0.028395 54.239.132.83 -> 172.31.8.238 TCP 26130 [TCP segment of a reassembled PDU]
228   0.028409 172.31.8.238 -> 54.239.132.83 TCP 66 56123 > http [ACK] Seq=98 Ack=1796969 Win=1389824 Len=0 TSval=13220855 TSecr=1685603453
229   0.028481 54.239.132.83 -> 172.31.8.238 TCP 26130 [TCP segment of a reassembled PDU]
230   0.028494 172.31.8.238 -> 54.239.132.83 TCP 66 56123 > http [ACK] Seq=98 Ack=1823033 Win=1389824 Len=0 TSval=13220855 TSecr=1685603453
231   0.028760 54.239.132.83 -> 172.31.8.238 TCP 14546 [TCP segment of a reassembled PDU]
232   0.028770 172.31.8.238 -> 54.239.132.83 TCP 66 56123 > http [ACK] Seq=98 Ack=1837513 Win=1408768 Len=0 TSval=13220855 TSecr=1685603453
233   0.028909 54.239.132.83 -> 172.31.8.238 TCP 26130 [TCP segment of a reassembled PDU]
234   0.028935 172.31.8.238 -> 54.239.132.83 TCP 66 56123 > http [ACK] Seq=98 Ack=1863577 Win=1389824 Len=0 TSval=13220855 TSecr=1685603453
235   0.028987 54.239.132.83 -> 172.31.8.238 TCP 21786 [TCP segment of a reassembled PDU]
236   0.028999 172.31.8.238 -> 54.239.132.83 TCP 66 56123 > http [ACK] Seq=98 Ack=1885297 Win=1396992 Len=0 TSval=13220855 TSecr=1685603453
237   0.029049 54.239.132.83 -> 172.31.8.238 TCP 2962 [TCP segment of a reassembled PDU]
238   0.029054 172.31.8.238 -> 54.239.132.83 TCP 66 56123 > http [ACK] Seq=98 Ack=1888193 Win=1427840 Len=0 TSval=13220855 TSecr=1685603453
239   0.029139 54.239.132.83 -> 172.31.8.238 TCP 26130 [TCP segment of a reassembled PDU]
240   0.029159 172.31.8.238 -> 54.239.132.83 TCP 66 56123 > http [ACK] Seq=98 Ack=1914257 Win=1401856 Len=0 TSval=13220855 TSecr=1685603453
241   0.029242 54.239.132.83 -> 172.31.8.238 TCP 33370 [TCP segment of a reassembled PDU]
242   0.029277 54.239.132.83 -> 172.31.8.238 TCP 5858 [TCP segment of a reassembled PDU]
243   0.029374 172.31.8.238 -> 54.239.132.83 TCP 66 56123 > http [ACK] Seq=98 Ack=1953353 Win=1368320 Len=0 TSval=13220855 TSecr=1685603453
244   0.029559 54.239.132.83 -> 172.31.8.238 TCP 26130 [TCP segment of a reassembled PDU]
245   0.029567 172.31.8.238 -> 54.239.132.83 TCP 66 56123 > http [ACK] Seq=98 Ack=1979417 Win=1389824 Len=0 TSval=13220856 TSecr=1685603453
246   0.029631 54.239.132.83 -> 172.31.8.238 TCP 26130 [TCP segment of a reassembled PDU]
247   0.029639 172.31.8.238 -> 54.239.132.83 TCP 66 56123 > http [ACK] Seq=98 Ack=2005481 Win=1481344 Len=0 TSval=13220856 TSecr=1685603453
248   0.029713 54.239.132.83 -> 172.31.8.238 TCP 13098 [TCP segment of a reassembled PDU]
249   0.029720 172.31.8.238 -> 54.239.132.83 TCP 66 56123 > http [ACK] Seq=98 Ack=2018513 Win=1507456 Len=0 TSval=13220856 TSecr=1685603453
250   0.029801 54.239.132.83 -> 172.31.8.238 TCP 18890 [TCP segment of a reassembled PDU]
251   0.029807 172.31.8.238 -> 54.239.132.83 TCP 66 56123 > http [ACK] Seq=98 Ack=2037337 Win=1545088 Len=0 TSval=13220856 TSecr=1685603453
252   0.029954 54.239.132.83 -> 172.31.8.238 TCP 30474 [TCP segment of a reassembled PDU]
253   0.029977 172.31.8.238 -> 54.239.132.83 TCP 66 56123 > http [ACK] Seq=98 Ack=2067745 Win=1605888 Len=0 TSval=13220856 TSecr=1685603453
254   0.030010 54.239.132.83 -> 172.31.8.238 TCP 15994 [TCP segment of a reassembled PDU]
255   0.030015 172.31.8.238 -> 54.239.132.83 TCP 66 56123 > http [ACK] Seq=98 Ack=2083673 Win=1605888 Len=0 TSval=13220856 TSecr=1685603453
256   0.030414 54.239.132.83 -> 172.31.8.238 TCP 26130 [TCP segment of a reassembled PDU]
257   0.030422 172.31.8.238 -> 54.239.132.83 TCP 66 56123 > http [ACK] Seq=98 Ack=2109737 Win=1605888 Len=0 TSval=13220856 TSecr=1685603453
258   0.030495 54.239.132.83 -> 172.31.8.238 TCP 20338 [TCP segment of a reassembled PDU]
259   0.030502 172.31.8.238 -> 54.239.132.83 TCP 66 56123 > http [ACK] Seq=98 Ack=2130009 Win=1605888 Len=0 TSval=13220856 TSecr=1685603453
260   0.030586 54.239.132.83 -> 172.31.8.238 TCP 31922 [TCP segment of a reassembled PDU]
261   0.030594 172.31.8.238 -> 54.239.132.83 TCP 66 56123 > http [ACK] Seq=98 Ack=2161865 Win=1605888 Len=0 TSval=13220856 TSecr=1685603453
262   0.030663 54.239.132.83 -> 172.31.8.238 TCP 26130 [TCP segment of a reassembled PDU]
263   0.030669 172.31.8.238 -> 54.239.132.83 TCP 66 56123 > http [ACK] Seq=98 Ack=2187929 Win=1605888 Len=0 TSval=13220856 TSecr=1685603453
264   0.030726 54.239.132.83 -> 172.31.8.238 TCP 13098 [TCP segment of a reassembled PDU]
265   0.030731 172.31.8.238 -> 54.239.132.83 TCP 66 56123 > http [ACK] Seq=98 Ack=2200961 Win=1605888 Len=0 TSval=13220856 TSecr=1685603453
266   0.030782 54.239.132.83 -> 172.31.8.238 TCP 1514 [TCP Previous segment not captured] [TCP segment of a reassembled PDU]
267   0.030786 172.31.8.238 -> 54.239.132.83 TCP 78 [TCP Dup ACK 265#1] 56123 > http [ACK] Seq=98 Ack=2200961 Win=1605888 Len=0 TSval=13220856 TSecr=1685603453 SLE=2202409 SRE=2203857
268   0.030842 54.239.132.83 -> 172.31.8.238 TCP 1514 [TCP Out-Of-Order] [TCP segment of a reassembled PDU]
269   0.030846 172.31.8.238 -> 54.239.132.83 TCP 66 56123 > http [ACK] Seq=98 Ack=2203857 Win=1605888 Len=0 TSval=13220856 TSecr=1685603453
270   0.030909 54.239.132.83 -> 172.31.8.238 TCP 10202 [TCP segment of a reassembled PDU]
271   0.030915 172.31.8.238 -> 54.239.132.83 TCP 66 56123 > http [ACK] Seq=98 Ack=2213993 Win=1605888 Len=0 TSval=13220856 TSecr=1685603453
272   0.031104 54.239.132.83 -> 172.31.8.238 TCP 26130 [TCP segment of a reassembled PDU]
273   0.031112 172.31.8.238 -> 54.239.132.83 TCP 66 56123 > http [ACK] Seq=98 Ack=2240057 Win=1605888 Len=0 TSval=13220856 TSecr=1685603453
274   0.031177 54.239.132.83 -> 172.31.8.238 TCP 26130 [TCP segment of a reassembled PDU]
275   0.031185 172.31.8.238 -> 54.239.132.83 TCP 66 56123 > http [ACK] Seq=98 Ack=2266121 Win=1605888 Len=0 TSval=13220856 TSecr=1685603453
276   0.031245 54.239.132.83 -> 172.31.8.238 TCP 13098 [TCP segment of a reassembled PDU]
277   0.031251 172.31.8.238 -> 54.239.132.83 TCP 66 56123 > http [ACK] Seq=98 Ack=2279153 Win=1605888 Len=0 TSval=13220856 TSecr=1685603453
278   0.031337 54.239.132.83 -> 172.31.8.238 TCP 17442 [TCP segment of a reassembled PDU]
279   0.031343 172.31.8.238 -> 54.239.132.83 TCP 66 56123 > http [ACK] Seq=98 Ack=2296529 Win=1605888 Len=0 TSval=13220856 TSecr=1685603453
280   0.031422 54.239.132.83 -> 172.31.8.238 TCP 26130 [TCP segment of a reassembled PDU]
281   0.031429 172.31.8.238 -> 54.239.132.83 TCP 66 56123 > http [ACK] Seq=98 Ack=2322593 Win=1605888 Len=0 TSval=13220856 TSecr=1685603453
282   0.031497 54.239.132.83 -> 172.31.8.238 TCP 26130 [TCP segment of a reassembled PDU]
283   0.031504 172.31.8.238 -> 54.239.132.83 TCP 66 56123 > http [ACK] Seq=98 Ack=2348657 Win=1605888 Len=0 TSval=13220856 TSecr=1685603453
284   0.031773 54.239.132.83 -> 172.31.8.238 TCP 7306 [TCP segment of a reassembled PDU]
285   0.031779 172.31.8.238 -> 54.239.132.83 TCP 66 56123 > http [ACK] Seq=98 Ack=2355897 Win=1605888 Len=0 TSval=13220856 TSecr=1685603453
286   0.031945 54.239.132.83 -> 172.31.8.238 TCP 26130 [TCP segment of a reassembled PDU]
287   0.031953 172.31.8.238 -> 54.239.132.83 TCP 66 56123 > http [ACK] Seq=98 Ack=2381961 Win=1605888 Len=0 TSval=13220856 TSecr=1685603453
288   0.032017 54.239.132.83 -> 172.31.8.238 TCP 26130 [TCP segment of a reassembled PDU]
289   0.032024 172.31.8.238 -> 54.239.132.83 TCP 66 56123 > http [ACK] Seq=98 Ack=2408025 Win=1605888 Len=0 TSval=13220856 TSecr=1685603453
290   0.032096 54.239.132.83 -> 172.31.8.238 TCP 26130 [TCP segment of a reassembled PDU]
291   0.032104 172.31.8.238 -> 54.239.132.83 TCP 66 56123 > http [ACK] Seq=98 Ack=2434089 Win=1605888 Len=0 TSval=13220856 TSecr=1685603453
292   0.032236 54.239.132.83 -> 172.31.8.238 TCP 26130 [TCP segment of a reassembled PDU]
293   0.032243 172.31.8.238 -> 54.239.132.83 TCP 66 56123 > http [ACK] Seq=98 Ack=2460153 Win=1605888 Len=0 TSval=13220856 TSecr=1685603453
294   0.032259 54.239.132.83 -> 172.31.8.238 TCP 10202 [TCP segment of a reassembled PDU]
295   0.032262 172.31.8.238 -> 54.239.132.83 TCP 66 56123 > http [ACK] Seq=98 Ack=2470289 Win=1605888 Len=0 TSval=13220856 TSecr=1685603453
296   0.032268 54.239.132.83 -> 172.31.8.238 TCP 4410 [TCP segment of a reassembled PDU]
297   0.032270 172.31.8.238 -> 54.239.132.83 TCP 66 56123 > http [ACK] Seq=98 Ack=2474633 Win=1605888 Len=0 TSval=13220856 TSecr=1685603453
298   0.032705 54.239.132.83 -> 172.31.8.238 TCP 26130 [TCP segment of a reassembled PDU]
299   0.032714 172.31.8.238 -> 54.239.132.83 TCP 66 56123 > http [ACK] Seq=98 Ack=2500697 Win=1605888 Len=0 TSval=13220856 TSecr=1685603453
300   0.032776 54.239.132.83 -> 172.31.8.238 TCP 21786 [TCP segment of a reassembled PDU]
301   0.032782 172.31.8.238 -> 54.239.132.83 TCP 66 56123 > http [ACK] Seq=98 Ack=2522417 Win=1605888 Len=0 TSval=13220856 TSecr=1685603453
302   0.032914 54.239.132.83 -> 172.31.8.238 TCP 30474 [TCP segment of a reassembled PDU]
303   0.032922 172.31.8.238 -> 54.239.132.83 TCP 66 56123 > http [ACK] Seq=98 Ack=2552825 Win=1605888 Len=0 TSval=13220856 TSecr=1685603453
304   0.032941 54.239.132.83 -> 172.31.8.238 TCP 26130 [TCP segment of a reassembled PDU]
305   0.032951 172.31.8.238 -> 54.239.132.83 TCP 66 56123 > http [ACK] Seq=98 Ack=2578889 Win=1605888 Len=0 TSval=13220856 TSecr=1685603453
306   0.033033 54.239.132.83 -> 172.31.8.238 TCP 26130 [TCP segment of a reassembled PDU]
307   0.033040 172.31.8.238 -> 54.239.132.83 TCP 66 56123 > http [ACK] Seq=98 Ack=2604953 Win=1605888 Len=0 TSval=13220856 TSecr=1685603453
308   0.033570 54.239.132.83 -> 172.31.8.238 TCP 2962 [TCP segment of a reassembled PDU]
309   0.033576 172.31.8.238 -> 54.239.132.83 TCP 66 56123 > http [ACK] Seq=98 Ack=2607849 Win=1605888 Len=0 TSval=13220857 TSecr=1685603453
310   0.033764 54.239.132.83 -> 172.31.8.238 TCP 26130 [TCP segment of a reassembled PDU]
311   0.033773 172.31.8.238 -> 54.239.132.83 TCP 66 56123 > http [ACK] Seq=98 Ack=2633913 Win=1605888 Len=0 TSval=13220857 TSecr=1685603453
312   0.033838 54.239.132.83 -> 172.31.8.238 TCP 26130 [TCP segment of a reassembled PDU]
313   0.033847 172.31.8.238 -> 54.239.132.83 TCP 66 56123 > http [ACK] Seq=98 Ack=2659977 Win=1605888 Len=0 TSval=13220857 TSecr=1685603453
314   0.033926 54.239.132.83 -> 172.31.8.238 TCP 26130 [TCP segment of a reassembled PDU]
315   0.033934 172.31.8.238 -> 54.239.132.83 TCP 66 56123 > http [ACK] Seq=98 Ack=2686041 Win=1605888 Len=0 TSval=13220857 TSecr=1685603453
316   0.034014 54.239.132.83 -> 172.31.8.238 TCP 26130 [TCP segment of a reassembled PDU]
317   0.034023 172.31.8.238 -> 54.239.132.83 TCP 66 56123 > http [ACK] Seq=98 Ack=2712105 Win=1605888 Len=0 TSval=13220857 TSecr=1685603453
318   0.034087 54.239.132.83 -> 172.31.8.238 TCP 23234 [TCP segment of a reassembled PDU]
319   0.034094 172.31.8.238 -> 54.239.132.83 TCP 66 56123 > http [ACK] Seq=98 Ack=2735273 Win=1605888 Len=0 TSval=13220857 TSecr=1685603453
320   0.034520 54.239.132.83 -> 172.31.8.238 TCP 26130 [TCP segment of a reassembled PDU]
321   0.034529 172.31.8.238 -> 54.239.132.83 TCP 66 56123 > http [ACK] Seq=98 Ack=2761337 Win=1605888 Len=0 TSval=13220857 TSecr=1685603454
322   0.034592 54.239.132.83 -> 172.31.8.238 TCP 26130 [TCP segment of a reassembled PDU]
323   0.034600 172.31.8.238 -> 54.239.132.83 TCP 66 56123 > http [ACK] Seq=98 Ack=2787401 Win=1605888 Len=0 TSval=13220857 TSecr=1685603454
324   0.034672 54.239.132.83 -> 172.31.8.238 TCP 21786 [TCP segment of a reassembled PDU]
325   0.034680 172.31.8.238 -> 54.239.132.83 TCP 66 56123 > http [ACK] Seq=98 Ack=2809121 Win=1605888 Len=0 TSval=13220857 TSecr=1685603454
326   0.034754 54.239.132.83 -> 172.31.8.238 TCP 26130 [TCP segment of a reassembled PDU]
327   0.034763 172.31.8.238 -> 54.239.132.83 TCP 66 56123 > http [ACK] Seq=98 Ack=2835185 Win=1605888 Len=0 TSval=13220857 TSecr=1685603454
328   0.034833 54.239.132.83 -> 172.31.8.238 TCP 26130 [TCP segment of a reassembled PDU]
329   0.034841 172.31.8.238 -> 54.239.132.83 TCP 66 56123 > http [ACK] Seq=98 Ack=2861249 Win=1605888 Len=0 TSval=13220857 TSecr=1685603454
330   0.034889 54.239.132.83 -> 172.31.8.238 TCP 4410 [TCP segment of a reassembled PDU]
331   0.034893 172.31.8.238 -> 54.239.132.83 TCP 66 56123 > http [ACK] Seq=98 Ack=2865593 Win=1605888 Len=0 TSval=13220857 TSecr=1685603454
332   0.035214 54.239.132.83 -> 172.31.8.238 TCP 26130 [TCP segment of a reassembled PDU]
333   0.035223 172.31.8.238 -> 54.239.132.83 TCP 66 56123 > http [ACK] Seq=98 Ack=2891657 Win=1605888 Len=0 TSval=13220857 TSecr=1685603454
334   0.035285 54.239.132.83 -> 172.31.8.238 TCP 26130 [TCP segment of a reassembled PDU]
335   0.035294 172.31.8.238 -> 54.239.132.83 TCP 66 56123 > http [ACK] Seq=98 Ack=2917721 Win=1605888 Len=0 TSval=13220857 TSecr=1685603454
336   0.035350 54.239.132.83 -> 172.31.8.238 TCP 13098 [TCP segment of a reassembled PDU]
337   0.035359 172.31.8.238 -> 54.239.132.83 TCP 66 56123 > http [ACK] Seq=98 Ack=2930753 Win=1605888 Len=0 TSval=13220857 TSecr=1685603454
338   0.035621 54.239.132.83 -> 172.31.8.238 TCP 23234 [TCP segment of a reassembled PDU]
339   0.035628 172.31.8.238 -> 54.239.132.83 TCP 66 56123 > http [ACK] Seq=98 Ack=2953921 Win=1605888 Len=0 TSval=13220857 TSecr=1685603454
340   0.035784 54.239.132.83 -> 172.31.8.238 TCP 2962 [TCP segment of a reassembled PDU]
341   0.035788 172.31.8.238 -> 54.239.132.83 TCP 66 56123 > http [ACK] Seq=98 Ack=2956817 Win=1605888 Len=0 TSval=13220857 TSecr=1685603454
342   0.035895 54.239.132.83 -> 172.31.8.238 TCP 39162 [TCP segment of a reassembled PDU]
343   0.035905 172.31.8.238 -> 54.239.132.83 TCP 66 56123 > http [ACK] Seq=98 Ack=2995913 Win=1605888 Len=0 TSval=13220857 TSecr=1685603454
344   0.036043 54.239.132.83 -> 172.31.8.238 TCP 20338 [TCP segment of a reassembled PDU]
345   0.036051 172.31.8.238 -> 54.239.132.83 TCP 66 56123 > http [ACK] Seq=98 Ack=3016185 Win=1605888 Len=0 TSval=13220857 TSecr=1685603454
346   0.036198 54.239.132.83 -> 172.31.8.238 TCP 31922 [TCP segment of a reassembled PDU]
347   0.036208 172.31.8.238 -> 54.239.132.83 TCP 66 56123 > http [ACK] Seq=98 Ack=3048041 Win=1605888 Len=0 TSval=13220857 TSecr=1685603454
348   0.036226 54.239.132.83 -> 172.31.8.238 TCP 26130 [TCP segment of a reassembled PDU]
349   0.036232 172.31.8.238 -> 54.239.132.83 TCP 66 56123 > http [ACK] Seq=98 Ack=3074105 Win=1605888 Len=0 TSval=13220857 TSecr=1685603454
