[Measurement for 10mb at 03:40:56 20.40.2014] 
Tshark:

  1   0.000000 172.31.8.238 -> 172.31.0.2   DNS 89 Standard query 0x8972  A d3796nkzln59xv.cloudfront.net
  2   0.000035 172.31.8.238 -> 172.31.0.2   DNS 89 Standard query 0xcae2  AAAA d3796nkzln59xv.cloudfront.net
  3   0.000542   172.31.0.2 -> 172.31.8.238 DNS 217 Standard query response 0x8972  A 54.230.118.138 A 54.230.119.3 A 54.239.132.83 A 54.192.118.219 A 54.192.118.228 A 54.192.118.241 A 54.192.118.242 A 54.230.116.73
  4   0.000562   172.31.0.2 -> 172.31.8.238 DNS 170 Standard query response 0xcae2 
  5   0.003864 172.31.8.238 -> 54.230.118.138 TCP 74 58651 > http [SYN] Seq=0 Win=26883 Len=0 MSS=8961 SACK_PERM=1 TSval=9620954 TSecr=0 WS=128
  6   0.004548 54.230.118.138 -> 172.31.8.238 TCP 74 http > 58651 [SYN, ACK] Seq=0 Ack=1 Win=14480 Len=0 MSS=1460 SACK_PERM=1 TSval=1685792665 TSecr=9620954 WS=128
  7   0.004562 172.31.8.238 -> 54.230.118.138 TCP 66 58651 > http [ACK] Seq=1 Ack=1 Win=27008 Len=0 TSval=9620954 TSecr=1685792665
  8   0.004610 172.31.8.238 -> 54.230.118.138 HTTP 163 GET /10mb HTTP/1.1 
  9   0.005429 54.230.118.138 -> 172.31.8.238 TCP 66 http > 58651 [ACK] Seq=1 Ack=98 Win=14592 Len=0 TSval=1685792665 TSecr=9620954
 10   0.007235 54.230.118.138 -> 172.31.8.238 TCP 2962 [TCP segment of a reassembled PDU]
 11   0.007244 172.31.8.238 -> 54.230.118.138 TCP 66 58651 > http [ACK] Seq=98 Ack=2897 Win=32768 Len=0 TSval=9620955 TSecr=1685792666
 12   0.007321 54.230.118.138 -> 172.31.8.238 TCP 10202 [TCP segment of a reassembled PDU]
 13   0.007330 172.31.8.238 -> 54.230.118.138 TCP 66 58651 > http [ACK] Seq=98 Ack=13033 Win=52992 Len=0 TSval=9620955 TSecr=1685792666
 14   0.007835 54.230.118.138 -> 172.31.8.238 TCP 5858 [TCP segment of a reassembled PDU]
 15   0.007842 172.31.8.238 -> 54.230.118.138 TCP 66 58651 > http [ACK] Seq=98 Ack=18825 Win=64640 Len=0 TSval=9620955 TSecr=1685792666
 16   0.007948 54.230.118.138 -> 172.31.8.238 TCP 7306 [TCP segment of a reassembled PDU]
 17   0.007955 172.31.8.238 -> 54.230.118.138 TCP 66 58651 > http [ACK] Seq=98 Ack=26065 Win=79104 Len=0 TSval=9620955 TSecr=1685792666
 18   0.008409 54.230.118.138 -> 172.31.8.238 TCP 11650 [TCP segment of a reassembled PDU]
 19   0.008418 172.31.8.238 -> 54.230.118.138 TCP 66 58651 > http [ACK] Seq=98 Ack=37649 Win=98944 Len=0 TSval=9620955 TSecr=1685792666
 20   0.008795 54.230.118.138 -> 172.31.8.238 TCP 5858 [TCP segment of a reassembled PDU]
 21   0.008801 172.31.8.238 -> 54.230.118.138 TCP 66 58651 > http [ACK] Seq=98 Ack=43441 Win=108416 Len=0 TSval=9620956 TSecr=1685792666
 22   0.008879 54.230.118.138 -> 172.31.8.238 TCP 2962 [TCP segment of a reassembled PDU]
 23   0.008884 172.31.8.238 -> 54.230.118.138 TCP 66 58651 > http [ACK] Seq=98 Ack=46337 Win=114816 Len=0 TSval=9620956 TSecr=1685792666
 24   0.009020 54.230.118.138 -> 172.31.8.238 TCP 4410 [TCP segment of a reassembled PDU]
 25   0.009027 172.31.8.238 -> 54.230.118.138 TCP 66 58651 > http [ACK] Seq=98 Ack=50681 Win=123520 Len=0 TSval=9620956 TSecr=1685792666
 26   0.009141 54.230.118.138 -> 172.31.8.238 TCP 8754 [TCP segment of a reassembled PDU]
 27   0.009149 172.31.8.238 -> 54.230.118.138 TCP 66 58651 > http [ACK] Seq=98 Ack=59369 Win=140928 Len=0 TSval=9620956 TSecr=1685792666
 28   0.009503 54.230.118.138 -> 172.31.8.238 TCP 2962 [TCP segment of a reassembled PDU]
 29   0.009508 172.31.8.238 -> 54.230.118.138 TCP 66 58651 > http [ACK] Seq=98 Ack=62265 Win=146688 Len=0 TSval=9620956 TSecr=1685792666
 30   0.009603 54.230.118.138 -> 172.31.8.238 TCP 2962 [TCP segment of a reassembled PDU]
 31   0.009608 172.31.8.238 -> 54.230.118.138 TCP 66 58651 > http [ACK] Seq=98 Ack=65161 Win=152448 Len=0 TSval=9620956 TSecr=1685792666
 32   0.009709 54.230.118.138 -> 172.31.8.238 TCP 13098 [TCP segment of a reassembled PDU]
 33   0.009717 172.31.8.238 -> 54.230.118.138 TCP 66 58651 > http [ACK] Seq=98 Ack=78193 Win=178560 Len=0 TSval=9620956 TSecr=1685792666
 34   0.010102 54.230.118.138 -> 172.31.8.238 TCP 8754 [TCP segment of a reassembled PDU]
 35   0.010110 172.31.8.238 -> 54.230.118.138 TCP 66 58651 > http [ACK] Seq=98 Ack=86881 Win=195968 Len=0 TSval=9620956 TSecr=1685792666
 36   0.010222 54.230.118.138 -> 172.31.8.238 TCP 17442 [TCP segment of a reassembled PDU]
 37   0.010234 172.31.8.238 -> 54.230.118.138 TCP 66 58651 > http [ACK] Seq=98 Ack=104257 Win=230656 Len=0 TSval=9620956 TSecr=1685792666
 38   0.010799 54.230.118.138 -> 172.31.8.238 TCP 4410 [TCP segment of a reassembled PDU]
 39   0.010805 172.31.8.238 -> 54.230.118.138 TCP 66 58651 > http [ACK] Seq=98 Ack=108601 Win=239360 Len=0 TSval=9620956 TSecr=1685792666
 40   0.010948 54.230.118.138 -> 172.31.8.238 TCP 21786 [TCP segment of a reassembled PDU]
 41   0.010962 172.31.8.238 -> 54.230.118.138 TCP 66 58651 > http [ACK] Seq=98 Ack=130321 Win=282880 Len=0 TSval=9620956 TSecr=1685792666
 42   0.011382 54.230.118.138 -> 172.31.8.238 TCP 7306 [TCP segment of a reassembled PDU]
 43   0.011390 172.31.8.238 -> 54.230.118.138 TCP 66 58651 > http [ACK] Seq=98 Ack=137561 Win=297344 Len=0 TSval=9620956 TSecr=1685792666
 44   0.011532 54.230.118.138 -> 172.31.8.238 TCP 18890 [TCP segment of a reassembled PDU]
 45   0.011543 172.31.8.238 -> 54.230.118.138 TCP 66 58651 > http [ACK] Seq=98 Ack=156385 Win=334976 Len=0 TSval=9620956 TSecr=1685792666
 46   0.011946 54.230.118.138 -> 172.31.8.238 TCP 5858 [TCP segment of a reassembled PDU]
 47   0.011953 172.31.8.238 -> 54.230.118.138 TCP 66 58651 > http [ACK] Seq=98 Ack=162177 Win=346496 Len=0 TSval=9620956 TSecr=1685792666
 48   0.012096 54.230.118.138 -> 172.31.8.238 TCP 14546 [TCP segment of a reassembled PDU]
 49   0.012107 172.31.8.238 -> 54.230.118.138 TCP 66 58651 > http [ACK] Seq=98 Ack=176657 Win=375552 Len=0 TSval=9620956 TSecr=1685792666
 50   0.012284 54.230.118.138 -> 172.31.8.238 TCP 11650 [TCP segment of a reassembled PDU]
 51   0.012293 172.31.8.238 -> 54.230.118.138 TCP 66 58651 > http [ACK] Seq=98 Ack=188241 Win=398720 Len=0 TSval=9620956 TSecr=1685792666
 52   0.012432 54.230.118.138 -> 172.31.8.238 TCP 10202 [TCP segment of a reassembled PDU]
 53   0.012440 172.31.8.238 -> 54.230.118.138 TCP 66 58651 > http [ACK] Seq=98 Ack=198377 Win=418944 Len=0 TSval=9620956 TSecr=1685792666
 54   0.012520 54.230.118.138 -> 172.31.8.238 TCP 5858 [TCP segment of a reassembled PDU]
 55   0.012527 172.31.8.238 -> 54.230.118.138 TCP 66 58651 > http [ACK] Seq=98 Ack=204169 Win=430464 Len=0 TSval=9620956 TSecr=1685792666
 56   0.012755 54.230.118.138 -> 172.31.8.238 TCP 15994 [TCP segment of a reassembled PDU]
 57   0.012766 172.31.8.238 -> 54.230.118.138 TCP 66 58651 > http [ACK] Seq=98 Ack=220097 Win=424320 Len=0 TSval=9620957 TSecr=1685792666
 58   0.012930 54.230.118.138 -> 172.31.8.238 TCP 5858 [TCP segment of a reassembled PDU]
 59   0.012937 172.31.8.238 -> 54.230.118.138 TCP 66 58651 > http [ACK] Seq=98 Ack=225889 Win=442112 Len=0 TSval=9620957 TSecr=1685792666
 60   0.013056 54.230.118.138 -> 172.31.8.238 TCP 11650 [TCP segment of a reassembled PDU]
 61   0.013064 172.31.8.238 -> 54.230.118.138 TCP 66 58651 > http [ACK] Seq=98 Ack=237473 Win=465280 Len=0 TSval=9620957 TSecr=1685792666
 62   0.013313 54.230.118.138 -> 172.31.8.238 TCP 26130 [TCP segment of a reassembled PDU]
 63   0.013329 172.31.8.238 -> 54.230.118.138 TCP 66 58651 > http [ACK] Seq=98 Ack=263537 Win=517376 Len=0 TSval=9620957 TSecr=1685792666
 64   0.013338 54.230.118.138 -> 172.31.8.238 TCP 5858 [TCP segment of a reassembled PDU]
 65   0.013343 172.31.8.238 -> 54.230.118.138 TCP 66 58651 > http [ACK] Seq=98 Ack=269329 Win=529024 Len=0 TSval=9620957 TSecr=1685792666
 66   0.013716 54.230.118.138 -> 172.31.8.238 TCP 4410 [TCP segment of a reassembled PDU]
 67   0.013722 172.31.8.238 -> 54.230.118.138 TCP 66 58651 > http [ACK] Seq=98 Ack=273673 Win=537728 Len=0 TSval=9620957 TSecr=1685792666
 68   0.013876 54.230.118.138 -> 172.31.8.238 TCP 15994 [TCP segment of a reassembled PDU]
 69   0.013887 172.31.8.238 -> 54.230.118.138 TCP 66 58651 > http [ACK] Seq=98 Ack=289601 Win=569472 Len=0 TSval=9620957 TSecr=1685792666
 70   0.014020 54.230.118.138 -> 172.31.8.238 TCP 21786 [TCP segment of a reassembled PDU]
 71   0.014034 172.31.8.238 -> 54.230.118.138 TCP 66 58651 > http [ACK] Seq=98 Ack=311321 Win=612992 Len=0 TSval=9620957 TSecr=1685792666
 72   0.014145 54.230.118.138 -> 172.31.8.238 TCP 13098 [TCP segment of a reassembled PDU]
 73   0.014155 172.31.8.238 -> 54.230.118.138 TCP 66 58651 > http [ACK] Seq=98 Ack=324353 Win=638976 Len=0 TSval=9620957 TSecr=1685792666
 74   0.014494 54.230.118.138 -> 172.31.8.238 TCP 7306 [TCP segment of a reassembled PDU]
 75   0.014502 172.31.8.238 -> 54.230.118.138 TCP 66 58651 > http [ACK] Seq=98 Ack=331593 Win=653568 Len=0 TSval=9620957 TSecr=1685792666
 76   0.014687 54.230.118.138 -> 172.31.8.238 TCP 20338 [TCP segment of a reassembled PDU]
 77   0.014700 172.31.8.238 -> 54.230.118.138 TCP 66 58651 > http [ACK] Seq=98 Ack=351865 Win=694016 Len=0 TSval=9620957 TSecr=1685792666
 78   0.014719 54.230.118.138 -> 172.31.8.238 TCP 5858 [TCP segment of a reassembled PDU]
 79   0.014724 172.31.8.238 -> 54.230.118.138 TCP 66 58651 > http [ACK] Seq=98 Ack=357657 Win=705664 Len=0 TSval=9620957 TSecr=1685792666
 80   0.014782 54.230.118.138 -> 172.31.8.238 TCP 10202 [TCP segment of a reassembled PDU]
 81   0.014791 172.31.8.238 -> 54.230.118.138 TCP 66 58651 > http [ACK] Seq=98 Ack=367793 Win=725888 Len=0 TSval=9620957 TSecr=1685792666
 82   0.015137 54.230.118.138 -> 172.31.8.238 TCP 2962 [TCP segment of a reassembled PDU]
 83   0.015143 172.31.8.238 -> 54.230.118.138 TCP 66 58651 > http [ACK] Seq=98 Ack=370689 Win=731648 Len=0 TSval=9620957 TSecr=1685792666
 84   0.015304 54.230.118.138 -> 172.31.8.238 TCP 23234 [TCP segment of a reassembled PDU]
 85   0.015318 172.31.8.238 -> 54.230.118.138 TCP 66 58651 > http [ACK] Seq=98 Ack=393857 Win=777984 Len=0 TSval=9620957 TSecr=1685792666
 86   0.015564 54.230.118.138 -> 172.31.8.238 TCP 20338 [TCP segment of a reassembled PDU]
 87   0.015577 172.31.8.238 -> 54.230.118.138 TCP 66 58651 > http [ACK] Seq=98 Ack=414129 Win=818560 Len=0 TSval=9620957 TSecr=1685792666
 88   0.015588 54.230.118.138 -> 172.31.8.238 TCP 5858 [TCP segment of a reassembled PDU]
 89   0.015592 172.31.8.238 -> 54.230.118.138 TCP 66 58651 > http [ACK] Seq=98 Ack=419921 Win=830208 Len=0 TSval=9620957 TSecr=1685792666
 90   0.015666 54.230.118.138 -> 172.31.8.238 TCP 13098 [TCP segment of a reassembled PDU]
 91   0.015675 172.31.8.238 -> 54.230.118.138 TCP 66 58651 > http [ACK] Seq=98 Ack=432953 Win=856192 Len=0 TSval=9620957 TSecr=1685792666
 92   0.015824 54.230.118.138 -> 172.31.8.238 TCP 1514 [TCP segment of a reassembled PDU]
 93   0.015828 172.31.8.238 -> 54.230.118.138 TCP 66 58651 > http [ACK] Seq=98 Ack=434401 Win=859136 Len=0 TSval=9620957 TSecr=1685792666
 94   0.015985 54.230.118.138 -> 172.31.8.238 TCP 8754 [TCP segment of a reassembled PDU]
 95   0.015992 172.31.8.238 -> 54.230.118.138 TCP 66 58651 > http [ACK] Seq=98 Ack=443089 Win=876544 Len=0 TSval=9620957 TSecr=1685792666
 96   0.016116 54.230.118.138 -> 172.31.8.238 TCP 20338 [TCP segment of a reassembled PDU]
 97   0.016129 172.31.8.238 -> 54.230.118.138 TCP 66 58651 > http [ACK] Seq=98 Ack=463361 Win=916992 Len=0 TSval=9620957 TSecr=1685792666
 98   0.016330 54.230.118.138 -> 172.31.8.238 TCP 24682 [TCP segment of a reassembled PDU]
 99   0.016345 172.31.8.238 -> 54.230.118.138 TCP 66 58651 > http [ACK] Seq=98 Ack=487977 Win=950656 Len=0 TSval=9620957 TSecr=1685792666
100   0.016430 54.230.118.138 -> 172.31.8.238 TCP 10202 [TCP segment of a reassembled PDU]
101   0.016438 172.31.8.238 -> 54.230.118.138 TCP 66 58651 > http [ACK] Seq=98 Ack=498113 Win=974464 Len=0 TSval=9620957 TSecr=1685792666
102   0.016879 54.230.118.138 -> 172.31.8.238 TCP 4410 [TCP segment of a reassembled PDU]
103   0.016886 172.31.8.238 -> 54.230.118.138 TCP 66 58651 > http [ACK] Seq=98 Ack=502457 Win=983936 Len=0 TSval=9620958 TSecr=1685792666
104   0.017049 54.230.118.138 -> 172.31.8.238 TCP 23234 [TCP segment of a reassembled PDU]
105   0.017063 172.31.8.238 -> 54.230.118.138 TCP 66 58651 > http [ACK] Seq=98 Ack=525625 Win=1032832 Len=0 TSval=9620958 TSecr=1685792666
106   0.017072 54.230.118.138 -> 172.31.8.238 TCP 2962 [TCP segment of a reassembled PDU]
107   0.017076 172.31.8.238 -> 54.230.118.138 TCP 66 58651 > http [ACK] Seq=98 Ack=528521 Win=1038720 Len=0 TSval=9620958 TSecr=1685792666
108   0.017166 54.230.118.138 -> 172.31.8.238 TCP 26130 [TCP segment of a reassembled PDU]
109   0.017181 172.31.8.238 -> 54.230.118.138 TCP 66 58651 > http [ACK] Seq=98 Ack=554585 Win=1090816 Len=0 TSval=9620958 TSecr=1685792666
110   0.017213 54.230.118.138 -> 172.31.8.238 TCP 8754 [TCP segment of a reassembled PDU]
111   0.017220 172.31.8.238 -> 54.230.118.138 TCP 66 58651 > http [ACK] Seq=98 Ack=563273 Win=1108224 Len=0 TSval=9620958 TSecr=1685792666
112   0.017635 54.230.118.138 -> 172.31.8.238 TCP 2962 [TCP segment of a reassembled PDU]
113   0.017640 172.31.8.238 -> 54.230.118.138 TCP 66 58651 > http [ACK] Seq=98 Ack=566169 Win=1113984 Len=0 TSval=9620958 TSecr=1685792667
114   0.017822 54.230.118.138 -> 172.31.8.238 TCP 21786 [TCP segment of a reassembled PDU]
115   0.017835 172.31.8.238 -> 54.230.118.138 TCP 66 58651 > http [ACK] Seq=98 Ack=587889 Win=1157376 Len=0 TSval=9620958 TSecr=1685792667
116   0.017843 54.230.118.138 -> 172.31.8.238 TCP 4410 [TCP segment of a reassembled PDU]
117   0.017851 172.31.8.238 -> 54.230.118.138 TCP 66 58651 > http [ACK] Seq=98 Ack=592233 Win=1166080 Len=0 TSval=9620958 TSecr=1685792667
118   0.017943 54.230.118.138 -> 172.31.8.238 TCP 26130 [TCP segment of a reassembled PDU]
119   0.017958 172.31.8.238 -> 54.230.118.138 TCP 66 58651 > http [ACK] Seq=98 Ack=618297 Win=1218176 Len=0 TSval=9620958 TSecr=1685792667
120   0.018010 54.230.118.138 -> 172.31.8.238 TCP 10202 [TCP segment of a reassembled PDU]
121   0.018018 172.31.8.238 -> 54.230.118.138 TCP 66 58651 > http [ACK] Seq=98 Ack=628433 Win=1238528 Len=0 TSval=9620958 TSecr=1685792667
122   0.018490 54.230.118.138 -> 172.31.8.238 TCP 5858 [TCP segment of a reassembled PDU]
123   0.018497 172.31.8.238 -> 54.230.118.138 TCP 66 58651 > http [ACK] Seq=98 Ack=634225 Win=1250048 Len=0 TSval=9620958 TSecr=1685792667
124   0.018687 54.230.118.138 -> 172.31.8.238 TCP 26130 [TCP segment of a reassembled PDU]
125   0.018703 172.31.8.238 -> 54.230.118.138 TCP 66 58651 > http [ACK] Seq=98 Ack=660289 Win=1302272 Len=0 TSval=9620958 TSecr=1685792667
126   0.018767 54.230.118.138 -> 172.31.8.238 TCP 26130 [TCP segment of a reassembled PDU]
127   0.018782 172.31.8.238 -> 54.230.118.138 TCP 66 58651 > http [ACK] Seq=98 Ack=686353 Win=1354368 Len=0 TSval=9620958 TSecr=1685792667
128   0.018827 54.230.118.138 -> 172.31.8.238 TCP 7306 [TCP segment of a reassembled PDU]
129   0.018835 172.31.8.238 -> 54.230.118.138 TCP 66 58651 > http [ACK] Seq=98 Ack=693593 Win=1368832 Len=0 TSval=9620958 TSecr=1685792667
130   0.019157 54.230.118.138 -> 172.31.8.238 TCP 5858 [TCP segment of a reassembled PDU]
131   0.019163 172.31.8.238 -> 54.230.118.138 TCP 66 58651 > http [ACK] Seq=98 Ack=699385 Win=1380352 Len=0 TSval=9620958 TSecr=1685792667
132   0.019333 54.230.118.138 -> 172.31.8.238 TCP 26130 [TCP segment of a reassembled PDU]
133   0.019348 172.31.8.238 -> 54.230.118.138 TCP 66 58651 > http [ACK] Seq=98 Ack=725449 Win=1380864 Len=0 TSval=9620958 TSecr=1685792667
134   0.019356 54.230.118.138 -> 172.31.8.238 TCP 5858 [TCP segment of a reassembled PDU]
135   0.019361 172.31.8.238 -> 54.230.118.138 TCP 66 58651 > http [ACK] Seq=98 Ack=731241 Win=1375104 Len=0 TSval=9620958 TSecr=1685792667
136   0.019571 54.230.118.138 -> 172.31.8.238 TCP 7306 [TCP segment of a reassembled PDU]
137   0.019591 172.31.8.238 -> 54.230.118.138 TCP 66 58651 > http [ACK] Seq=98 Ack=738481 Win=1411712 Len=0 TSval=9620958 TSecr=1685792667
138   0.019735 54.230.118.138 -> 172.31.8.238 TCP 26130 [TCP segment of a reassembled PDU]
139   0.019748 172.31.8.238 -> 54.230.118.138 TCP 66 58651 > http [ACK] Seq=98 Ack=764545 Win=1385728 Len=0 TSval=9620958 TSecr=1685792667
140   0.019810 54.230.118.138 -> 172.31.8.238 TCP 26130 [TCP segment of a reassembled PDU]
141   0.019824 172.31.8.238 -> 54.230.118.138 TCP 66 58651 > http [ACK] Seq=98 Ack=790609 Win=1380864 Len=0 TSval=9620958 TSecr=1685792667
142   0.019892 54.230.118.138 -> 172.31.8.238 TCP 13098 [TCP segment of a reassembled PDU]
143   0.019901 172.31.8.238 -> 54.230.118.138 TCP 66 58651 > http [ACK] Seq=98 Ack=803641 Win=1402240 Len=0 TSval=9620958 TSecr=1685792667
144   0.019968 54.230.118.138 -> 172.31.8.238 TCP 20338 [TCP segment of a reassembled PDU]
145   0.019991 172.31.8.238 -> 54.230.118.138 TCP 66 58651 > http [ACK] Seq=98 Ack=823913 Win=1390336 Len=0 TSval=9620958 TSecr=1685792667
146   0.020515 54.230.118.138 -> 172.31.8.238 TCP 5858 [TCP segment of a reassembled PDU]
147   0.020521 172.31.8.238 -> 54.230.118.138 TCP 66 58651 > http [ACK] Seq=98 Ack=829705 Win=1414144 Len=0 TSval=9620958 TSecr=1685792667
148   0.020687 54.230.118.138 -> 172.31.8.238 TCP 23234 [TCP segment of a reassembled PDU]
149   0.020713 172.31.8.238 -> 54.230.118.138 TCP 66 58651 > http [ACK] Seq=98 Ack=852873 Win=1390976 Len=0 TSval=9620958 TSecr=1685792667
150   0.020884 54.230.118.138 -> 172.31.8.238 TCP 55090 [TCP segment of a reassembled PDU]
151   0.020911 54.230.118.138 -> 172.31.8.238 TCP 7306 [TCP segment of a reassembled PDU]
152   0.020929 172.31.8.238 -> 54.230.118.138 TCP 66 58651 > http [ACK] Seq=98 Ack=915137 Win=1328768 Len=0 TSval=9620959 TSecr=1685792667
153   0.020957 54.230.118.138 -> 172.31.8.238 TCP 18890 [TCP segment of a reassembled PDU]
154   0.020972 172.31.8.238 -> 54.230.118.138 TCP 66 58651 > http [ACK] Seq=98 Ack=933961 Win=1309952 Len=0 TSval=9620959 TSecr=1685792667
155   0.020999 54.230.118.138 -> 172.31.8.238 TCP 2962 [TCP segment of a reassembled PDU]
156   0.021003 172.31.8.238 -> 54.230.118.138 TCP 66 58651 > http [ACK] Seq=98 Ack=936857 Win=1387776 Len=0 TSval=9620959 TSecr=1685792667
157   0.021273 54.230.118.138 -> 172.31.8.238 TCP 17442 [TCP segment of a reassembled PDU]
158   0.021284 172.31.8.238 -> 54.230.118.138 TCP 66 58651 > http [ACK] Seq=98 Ack=954233 Win=1395072 Len=0 TSval=9620959 TSecr=1685792667
159   0.021411 54.230.118.138 -> 172.31.8.238 TCP 10202 [TCP segment of a reassembled PDU]
160   0.021419 172.31.8.238 -> 54.230.118.138 TCP 66 58651 > http [ACK] Seq=98 Ack=964369 Win=1406976 Len=0 TSval=9620959 TSecr=1685792667
161   0.021579 54.230.118.138 -> 172.31.8.238 TCP 26130 [TCP segment of a reassembled PDU]
162   0.021603 172.31.8.238 -> 54.230.118.138 TCP 66 58651 > http [ACK] Seq=98 Ack=990433 Win=1380992 Len=0 TSval=9620959 TSecr=1685792667
163   0.021656 54.230.118.138 -> 172.31.8.238 TCP 26130 [TCP segment of a reassembled PDU]
164   0.021681 172.31.8.238 -> 54.230.118.138 TCP 66 58651 > http [ACK] Seq=98 Ack=1016497 Win=1380864 Len=0 TSval=9620959 TSecr=1685792667
165   0.021695 54.230.118.138 -> 172.31.8.238 TCP 2962 [TCP segment of a reassembled PDU]
166   0.021705 172.31.8.238 -> 54.230.118.138 TCP 66 58651 > http [ACK] Seq=98 Ack=1019393 Win=1415808 Len=0 TSval=9620959 TSecr=1685792667
167   0.021961 54.230.118.138 -> 172.31.8.238 TCP 4410 [TCP segment of a reassembled PDU]
168   0.021967 172.31.8.238 -> 54.230.118.138 TCP 66 58651 > http [ACK] Seq=98 Ack=1023737 Win=1415808 Len=0 TSval=9620959 TSecr=1685792667
169   0.022135 54.230.118.138 -> 172.31.8.238 TCP 26130 [TCP segment of a reassembled PDU]
170   0.022160 172.31.8.238 -> 54.230.118.138 TCP 66 58651 > http [ACK] Seq=98 Ack=1049801 Win=1389824 Len=0 TSval=9620959 TSecr=1685792667
171   0.022206 54.230.118.138 -> 172.31.8.238 TCP 26130 [TCP segment of a reassembled PDU]
172   0.022231 172.31.8.238 -> 54.230.118.138 TCP 66 58651 > http [ACK] Seq=98 Ack=1075865 Win=1380864 Len=0 TSval=9620959 TSecr=1685792667
173   0.022286 54.230.118.138 -> 172.31.8.238 TCP 26130 [TCP segment of a reassembled PDU]
174   0.022299 172.31.8.238 -> 54.230.118.138 TCP 66 58651 > http [ACK] Seq=98 Ack=1101929 Win=1380864 Len=0 TSval=9620959 TSecr=1685792667
175   0.022362 54.230.118.138 -> 172.31.8.238 TCP 26130 [TCP segment of a reassembled PDU]
176   0.022421 54.230.118.138 -> 172.31.8.238 TCP 14546 [TCP segment of a reassembled PDU]
177   0.022482 172.31.8.238 -> 54.230.118.138 TCP 66 58651 > http [ACK] Seq=98 Ack=1142473 Win=1340416 Len=0 TSval=9620959 TSecr=1685792667
178   0.022590 54.230.118.138 -> 172.31.8.238 TCP 7306 [TCP segment of a reassembled PDU]
179   0.022598 172.31.8.238 -> 54.230.118.138 TCP 66 58651 > http [ACK] Seq=98 Ack=1149713 Win=1411712 Len=0 TSval=9620959 TSecr=1685792667
180   0.022721 54.230.118.138 -> 172.31.8.238 TCP 4410 [TCP segment of a reassembled PDU]
181   0.022727 172.31.8.238 -> 54.230.118.138 TCP 66 58651 > http [ACK] Seq=98 Ack=1154057 Win=1415808 Len=0 TSval=9620959 TSecr=1685792667
182   0.022884 54.230.118.138 -> 172.31.8.238 TCP 26130 [TCP segment of a reassembled PDU]
183   0.022909 172.31.8.238 -> 54.230.118.138 TCP 66 58651 > http [ACK] Seq=98 Ack=1180121 Win=1389824 Len=0 TSval=9620959 TSecr=1685792667
184   0.022966 54.230.118.138 -> 172.31.8.238 TCP 26130 [TCP segment of a reassembled PDU]
185   0.023021 54.230.118.138 -> 172.31.8.238 TCP 8754 [TCP segment of a reassembled PDU]
186   0.023111 172.31.8.238 -> 54.230.118.138 TCP 66 58651 > http [ACK] Seq=98 Ack=1214873 Win=1366528 Len=0 TSval=9620959 TSecr=1685792667
187   0.023343 54.230.118.138 -> 172.31.8.238 TCP 26130 [TCP segment of a reassembled PDU]
188   0.023356 172.31.8.238 -> 54.230.118.138 TCP 66 58651 > http [ACK] Seq=98 Ack=1240937 Win=1380864 Len=0 TSval=9620959 TSecr=1685792667
189   0.023411 54.230.118.138 -> 172.31.8.238 TCP 26130 [TCP segment of a reassembled PDU]
190   0.023425 172.31.8.238 -> 54.230.118.138 TCP 66 58651 > http [ACK] Seq=98 Ack=1267001 Win=1380864 Len=0 TSval=9620959 TSecr=1685792667
191   0.023482 54.230.118.138 -> 172.31.8.238 TCP 13098 [TCP segment of a reassembled PDU]
192   0.023504 172.31.8.238 -> 54.230.118.138 TCP 66 58651 > http [ACK] Seq=98 Ack=1280033 Win=1402240 Len=0 TSval=9620959 TSecr=1685792667
193   0.023938 54.230.118.138 -> 172.31.8.238 TCP 23234 [TCP segment of a reassembled PDU]
194   0.023975 172.31.8.238 -> 54.230.118.138 TCP 66 58651 > http [ACK] Seq=98 Ack=1303201 Win=1385600 Len=0 TSval=9620959 TSecr=1685792667
195   0.024059 54.230.118.138 -> 172.31.8.238 TCP 2962 [TCP segment of a reassembled PDU]
196   0.024064 172.31.8.238 -> 54.230.118.138 TCP 66 58651 > http [ACK] Seq=98 Ack=1306097 Win=1415808 Len=0 TSval=9620959 TSecr=1685792667
197   0.024180 54.230.118.138 -> 172.31.8.238 TCP 26130 [TCP segment of a reassembled PDU]
198   0.024224 54.230.118.138 -> 172.31.8.238 TCP 26130 [TCP segment of a reassembled PDU]
199   0.024240 54.230.118.138 -> 172.31.8.238 TCP 7306 [TCP segment of a reassembled PDU]
200   0.024273 54.230.118.138 -> 172.31.8.238 TCP 18890 [TCP segment of a reassembled PDU]
201   0.024285 172.31.8.238 -> 54.230.118.138 TCP 66 58651 > http [ACK] Seq=98 Ack=1365465 Win=1356544 Len=0 TSval=9620959 TSecr=1685792667
202   0.024304 54.230.118.138 -> 172.31.8.238 TCP 26130 [TCP segment of a reassembled PDU]
203   0.024333 172.31.8.238 -> 54.230.118.138 TCP 66 58651 > http [ACK] Seq=98 Ack=1410353 Win=1311744 Len=0 TSval=9620959 TSecr=1685792667
204   0.024854 54.230.118.138 -> 172.31.8.238 TCP 4410 [TCP segment of a reassembled PDU]
205   0.024860 172.31.8.238 -> 54.230.118.138 TCP 66 58651 > http [ACK] Seq=98 Ack=1414697 Win=1415808 Len=0 TSval=9620960 TSecr=1685792667
206   0.025033 54.230.118.138 -> 172.31.8.238 TCP 26130 [TCP segment of a reassembled PDU]
207   0.025046 172.31.8.238 -> 54.230.118.138 TCP 66 58651 > http [ACK] Seq=98 Ack=1440761 Win=1468032 Len=0 TSval=9620960 TSecr=1685792667
208   0.025114 54.230.118.138 -> 172.31.8.238 TCP 26130 [TCP segment of a reassembled PDU]
209   0.025129 172.31.8.238 -> 54.230.118.138 TCP 66 58651 > http [ACK] Seq=98 Ack=1466825 Win=1520128 Len=0 TSval=9620960 TSecr=1685792667
210   0.025183 54.230.118.138 -> 172.31.8.238 TCP 8754 [TCP segment of a reassembled PDU]
211   0.025191 172.31.8.238 -> 54.230.118.138 TCP 66 58651 > http [ACK] Seq=98 Ack=1475513 Win=1537536 Len=0 TSval=9620960 TSecr=1685792667
212   0.025278 54.230.118.138 -> 172.31.8.238 TCP 26130 [TCP segment of a reassembled PDU]
213   0.025293 172.31.8.238 -> 54.230.118.138 TCP 66 58651 > http [ACK] Seq=98 Ack=1501577 Win=1589632 Len=0 TSval=9620960 TSecr=1685792667
214   0.025366 54.230.118.138 -> 172.31.8.238 TCP 26130 [TCP segment of a reassembled PDU]
215   0.025382 172.31.8.238 -> 54.230.118.138 TCP 66 58651 > http [ACK] Seq=98 Ack=1527641 Win=1589632 Len=0 TSval=9620960 TSecr=1685792667
216   0.025431 54.230.118.138 -> 172.31.8.238 TCP 13098 [TCP segment of a reassembled PDU]
217   0.025440 172.31.8.238 -> 54.230.118.138 TCP 66 58651 > http [ACK] Seq=98 Ack=1540673 Win=1589632 Len=0 TSval=9620960 TSecr=1685792667
218   0.025828 54.230.118.138 -> 172.31.8.238 TCP 4410 [TCP segment of a reassembled PDU]
219   0.025835 172.31.8.238 -> 54.230.118.138 TCP 66 58651 > http [ACK] Seq=98 Ack=1545017 Win=1589632 Len=0 TSval=9620960 TSecr=1685792667
220   0.025985 54.230.118.138 -> 172.31.8.238 TCP 26130 [TCP segment of a reassembled PDU]
221   0.026000 172.31.8.238 -> 54.230.118.138 TCP 66 58651 > http [ACK] Seq=98 Ack=1571081 Win=1589632 Len=0 TSval=9620960 TSecr=1685792667
222   0.026053 54.230.118.138 -> 172.31.8.238 TCP 18890 [TCP segment of a reassembled PDU]
223   0.026065 172.31.8.238 -> 54.230.118.138 TCP 66 58651 > http [ACK] Seq=98 Ack=1589905 Win=1589632 Len=0 TSval=9620960 TSecr=1685792667
224   0.026141 54.230.118.138 -> 172.31.8.238 TCP 33370 [TCP segment of a reassembled PDU]
225   0.026159 172.31.8.238 -> 54.230.118.138 TCP 66 58651 > http [ACK] Seq=98 Ack=1623209 Win=1589632 Len=0 TSval=9620960 TSecr=1685792667
226   0.026217 54.230.118.138 -> 172.31.8.238 TCP 26130 [TCP segment of a reassembled PDU]
227   0.026232 172.31.8.238 -> 54.230.118.138 TCP 66 58651 > http [ACK] Seq=98 Ack=1649273 Win=1589632 Len=0 TSval=9620960 TSecr=1685792667
228   0.026290 54.230.118.138 -> 172.31.8.238 TCP 21786 [TCP segment of a reassembled PDU]
229   0.026301 172.31.8.238 -> 54.230.118.138 TCP 66 58651 > http [ACK] Seq=98 Ack=1670993 Win=1589632 Len=0 TSval=9620960 TSecr=1685792667
230   0.026583 54.230.118.138 -> 172.31.8.238 TCP 10202 [TCP segment of a reassembled PDU]
231   0.026591 172.31.8.238 -> 54.230.118.138 TCP 66 58651 > http [ACK] Seq=98 Ack=1681129 Win=1589632 Len=0 TSval=9620960 TSecr=1685792667
232   0.026752 54.230.118.138 -> 172.31.8.238 TCP 26130 [TCP segment of a reassembled PDU]
233   0.026768 172.31.8.238 -> 54.230.118.138 TCP 66 58651 > http [ACK] Seq=98 Ack=1707193 Win=1589632 Len=0 TSval=9620960 TSecr=1685792667
234   0.026819 54.230.118.138 -> 172.31.8.238 TCP 26130 [TCP segment of a reassembled PDU]
235   0.026834 172.31.8.238 -> 54.230.118.138 TCP 66 58651 > http [ACK] Seq=98 Ack=1733257 Win=1589632 Len=0 TSval=9620960 TSecr=1685792667
236   0.026905 54.230.118.138 -> 172.31.8.238 TCP 23234 [TCP segment of a reassembled PDU]
237   0.026919 172.31.8.238 -> 54.230.118.138 TCP 66 58651 > http [ACK] Seq=98 Ack=1756425 Win=1589632 Len=0 TSval=9620960 TSecr=1685792667
238   0.026998 54.230.118.138 -> 172.31.8.238 TCP 26130 [TCP segment of a reassembled PDU]
239   0.027012 172.31.8.238 -> 54.230.118.138 TCP 66 58651 > http [ACK] Seq=98 Ack=1782489 Win=1589632 Len=0 TSval=9620960 TSecr=1685792667
240   0.027066 54.230.118.138 -> 172.31.8.238 TCP 18890 [TCP segment of a reassembled PDU]
241   0.027077 172.31.8.238 -> 54.230.118.138 TCP 66 58651 > http [ACK] Seq=98 Ack=1801313 Win=1589632 Len=0 TSval=9620960 TSecr=1685792667
242   0.027461 54.230.118.138 -> 172.31.8.238 TCP 4410 [TCP segment of a reassembled PDU]
243   0.027467 172.31.8.238 -> 54.230.118.138 TCP 66 58651 > http [ACK] Seq=98 Ack=1805657 Win=1589632 Len=0 TSval=9620960 TSecr=1685792668
244   0.027632 54.230.118.138 -> 172.31.8.238 TCP 26130 [TCP segment of a reassembled PDU]
245   0.027646 172.31.8.238 -> 54.230.118.138 TCP 66 58651 > http [ACK] Seq=98 Ack=1831721 Win=1589632 Len=0 TSval=9620960 TSecr=1685792668
246   0.027706 54.230.118.138 -> 172.31.8.238 TCP 26130 [TCP segment of a reassembled PDU]
247   0.027721 172.31.8.238 -> 54.230.118.138 TCP 66 58651 > http [ACK] Seq=98 Ack=1857785 Win=1589632 Len=0 TSval=9620960 TSecr=1685792668
248   0.027787 54.230.118.138 -> 172.31.8.238 TCP 26130 [TCP segment of a reassembled PDU]
249   0.027794 172.31.8.238 -> 54.230.118.138 TCP 66 58651 > http [ACK] Seq=98 Ack=1883849 Win=1589632 Len=0 TSval=9620960 TSecr=1685792668
250   0.027890 54.230.118.138 -> 172.31.8.238 TCP 26130 [TCP segment of a reassembled PDU]
251   0.027897 172.31.8.238 -> 54.230.118.138 TCP 66 58651 > http [ACK] Seq=98 Ack=1909913 Win=1589632 Len=0 TSval=9620960 TSecr=1685792668
252   0.027947 54.230.118.138 -> 172.31.8.238 TCP 21786 [TCP segment of a reassembled PDU]
253   0.027953 172.31.8.238 -> 54.230.118.138 TCP 66 58651 > http [ACK] Seq=98 Ack=1931633 Win=1589632 Len=0 TSval=9620960 TSecr=1685792668
254   0.028369 54.230.118.138 -> 172.31.8.238 TCP 20338 [TCP segment of a reassembled PDU]
255   0.028376 172.31.8.238 -> 54.230.118.138 TCP 66 58651 > http [ACK] Seq=98 Ack=1951905 Win=1589632 Len=0 TSval=9620960 TSecr=1685792668
256   0.028512 54.230.118.138 -> 172.31.8.238 TCP 20338 [TCP segment of a reassembled PDU]
257   0.028519 172.31.8.238 -> 54.230.118.138 TCP 66 58651 > http [ACK] Seq=98 Ack=1972177 Win=1589632 Len=0 TSval=9620960 TSecr=1685792668
258   0.028599 54.230.118.138 -> 172.31.8.238 TCP 5858 [TCP segment of a reassembled PDU]
259   0.028606 172.31.8.238 -> 54.230.118.138 TCP 66 58651 > http [ACK] Seq=98 Ack=1977969 Win=1589632 Len=0 TSval=9620960 TSecr=1685792668
260   0.028721 54.230.118.138 -> 172.31.8.238 TCP 26130 [TCP segment of a reassembled PDU]
261   0.028728 172.31.8.238 -> 54.230.118.138 TCP 66 58651 > http [ACK] Seq=98 Ack=2004033 Win=1589632 Len=0 TSval=9620961 TSecr=1685792668
262   0.028766 54.230.118.138 -> 172.31.8.238 TCP 26130 [TCP segment of a reassembled PDU]
263   0.028772 172.31.8.238 -> 54.230.118.138 TCP 66 58651 > http [ACK] Seq=98 Ack=2030097 Win=1589632 Len=0 TSval=9620961 TSecr=1685792668
264   0.028913 54.230.118.138 -> 172.31.8.238 TCP 31922 [TCP segment of a reassembled PDU]
265   0.028920 172.31.8.238 -> 54.230.118.138 TCP 66 58651 > http [ACK] Seq=98 Ack=2061953 Win=1589632 Len=0 TSval=9620961 TSecr=1685792668
266   0.029023 54.230.118.138 -> 172.31.8.238 TCP 30474 [TCP segment of a reassembled PDU]
267   0.029032 172.31.8.238 -> 54.230.118.138 TCP 66 58651 > http [ACK] Seq=98 Ack=2092361 Win=1589632 Len=0 TSval=9620961 TSecr=1685792668
268   0.029093 54.230.118.138 -> 172.31.8.238 TCP 34818 [TCP segment of a reassembled PDU]
269   0.029102 172.31.8.238 -> 54.230.118.138 TCP 66 58651 > http [ACK] Seq=98 Ack=2127113 Win=1589632 Len=0 TSval=9620961 TSecr=1685792668
270   0.029464 54.230.118.138 -> 172.31.8.238 TCP 26130 [TCP segment of a reassembled PDU]
271   0.029472 172.31.8.238 -> 54.230.118.138 TCP 66 58651 > http [ACK] Seq=98 Ack=2153177 Win=1589632 Len=0 TSval=9620961 TSecr=1685792668
272   0.029540 54.230.118.138 -> 172.31.8.238 TCP 26130 [TCP segment of a reassembled PDU]
273   0.029547 172.31.8.238 -> 54.230.118.138 TCP 66 58651 > http [ACK] Seq=98 Ack=2179241 Win=1589632 Len=0 TSval=9620961 TSecr=1685792668
274   0.029606 54.230.118.138 -> 172.31.8.238 TCP 13098 [TCP segment of a reassembled PDU]
275   0.029612 172.31.8.238 -> 54.230.118.138 TCP 66 58651 > http [ACK] Seq=98 Ack=2192273 Win=1589632 Len=0 TSval=9620961 TSecr=1685792668
276   0.029780 54.230.118.138 -> 172.31.8.238 TCP 5858 [TCP segment of a reassembled PDU]
277   0.029785 172.31.8.238 -> 54.230.118.138 TCP 66 58651 > http [ACK] Seq=98 Ack=2198065 Win=1589632 Len=0 TSval=9620961 TSecr=1685792668
278   0.029944 54.230.118.138 -> 172.31.8.238 TCP 17442 [TCP segment of a reassembled PDU]
279   0.029950 172.31.8.238 -> 54.230.118.138 TCP 66 58651 > http [ACK] Seq=98 Ack=2215441 Win=1589632 Len=0 TSval=9620961 TSecr=1685792668
280   0.029975 54.230.118.138 -> 172.31.8.238 TCP 8754 [TCP segment of a reassembled PDU]
281   0.029979 172.31.8.238 -> 54.230.118.138 TCP 66 58651 > http [ACK] Seq=98 Ack=2224129 Win=1589632 Len=0 TSval=9620961 TSecr=1685792668
282   0.030116 54.230.118.138 -> 172.31.8.238 TCP 26130 [TCP segment of a reassembled PDU]
283   0.030123 172.31.8.238 -> 54.230.118.138 TCP 66 58651 > http [ACK] Seq=98 Ack=2250193 Win=1589632 Len=0 TSval=9620961 TSecr=1685792668
284   0.030145 54.230.118.138 -> 172.31.8.238 TCP 26130 [TCP segment of a reassembled PDU]
285   0.030150 172.31.8.238 -> 54.230.118.138 TCP 66 58651 > http [ACK] Seq=98 Ack=2276257 Win=1589632 Len=0 TSval=9620961 TSecr=1685792668
286   0.030238 54.230.118.138 -> 172.31.8.238 TCP 26130 [TCP segment of a reassembled PDU]
287   0.030245 172.31.8.238 -> 54.230.118.138 TCP 66 58651 > http [ACK] Seq=98 Ack=2302321 Win=1589632 Len=0 TSval=9620961 TSecr=1685792668
288   0.030321 54.230.118.138 -> 172.31.8.238 TCP 26130 [TCP segment of a reassembled PDU]
289   0.030328 172.31.8.238 -> 54.230.118.138 TCP 66 58651 > http [ACK] Seq=98 Ack=2328385 Win=1589632 Len=0 TSval=9620961 TSecr=1685792668
290   0.030400 54.230.118.138 -> 172.31.8.238 TCP 26130 [TCP segment of a reassembled PDU]
291   0.030407 172.31.8.238 -> 54.230.118.138 TCP 66 58651 > http [ACK] Seq=98 Ack=2354449 Win=1589632 Len=0 TSval=9620961 TSecr=1685792668
292   0.030483 54.230.118.138 -> 172.31.8.238 TCP 33370 [TCP segment of a reassembled PDU]
293   0.030490 172.31.8.238 -> 54.230.118.138 TCP 66 58651 > http [ACK] Seq=98 Ack=2387753 Win=1589632 Len=0 TSval=9620961 TSecr=1685792668
294   0.030779 54.230.118.138 -> 172.31.8.238 TCP 26130 [TCP segment of a reassembled PDU]
295   0.030787 172.31.8.238 -> 54.230.118.138 TCP 66 58651 > http [ACK] Seq=98 Ack=2413817 Win=1589632 Len=0 TSval=9620961 TSecr=1685792668
296   0.030832 54.230.118.138 -> 172.31.8.238 TCP 17442 [TCP segment of a reassembled PDU]
297   0.030838 172.31.8.238 -> 54.230.118.138 TCP 66 58651 > http [ACK] Seq=98 Ack=2431193 Win=1589632 Len=0 TSval=9620961 TSecr=1685792668
298   0.030881 54.230.118.138 -> 172.31.8.238 TCP 1514 [TCP Previous segment not captured] [TCP segment of a reassembled PDU]
299   0.030885 172.31.8.238 -> 54.230.118.138 TCP 78 [TCP Dup ACK 297#1] 58651 > http [ACK] Seq=98 Ack=2431193 Win=1589632 Len=0 TSval=9620961 TSecr=1685792668 SLE=2432641 SRE=2434089
300   0.030935 54.230.118.138 -> 172.31.8.238 TCP 1514 [TCP Out-Of-Order] [TCP segment of a reassembled PDU]
301   0.030939 172.31.8.238 -> 54.230.118.138 TCP 66 58651 > http [ACK] Seq=98 Ack=2434089 Win=1589632 Len=0 TSval=9620961 TSecr=1685792668
302   0.031022 54.230.118.138 -> 172.31.8.238 TCP 18890 [TCP segment of a reassembled PDU]
303   0.031029 172.31.8.238 -> 54.230.118.138 TCP 66 58651 > http [ACK] Seq=98 Ack=2452913 Win=1589632 Len=0 TSval=9620961 TSecr=1685792668
304   0.031214 54.230.118.138 -> 172.31.8.238 TCP 26130 [TCP segment of a reassembled PDU]
305   0.031222 172.31.8.238 -> 54.230.118.138 TCP 66 58651 > http [ACK] Seq=98 Ack=2478977 Win=1589632 Len=0 TSval=9620961 TSecr=1685792668
306   0.031276 54.230.118.138 -> 172.31.8.238 TCP 17442 [TCP segment of a reassembled PDU]
307   0.031294 172.31.8.238 -> 54.230.118.138 TCP 66 58651 > http [ACK] Seq=98 Ack=2496353 Win=1589632 Len=0 TSval=9620961 TSecr=1685792668
308   0.031368 54.230.118.138 -> 172.31.8.238 TCP 27578 [TCP segment of a reassembled PDU]
309   0.031375 172.31.8.238 -> 54.230.118.138 TCP 66 58651 > http [ACK] Seq=98 Ack=2523865 Win=1589632 Len=0 TSval=9620961 TSecr=1685792668
310   0.031522 54.230.118.138 -> 172.31.8.238 TCP 26130 [TCP segment of a reassembled PDU]
311   0.031529 172.31.8.238 -> 54.230.118.138 TCP 66 58651 > http [ACK] Seq=98 Ack=2549929 Win=1589632 Len=0 TSval=9620961 TSecr=1685792668
312   0.031538 54.230.118.138 -> 172.31.8.238 TCP 8754 [TCP segment of a reassembled PDU]
313   0.031541 172.31.8.238 -> 54.230.118.138 TCP 66 58651 > http [ACK] Seq=98 Ack=2558617 Win=1589632 Len=0 TSval=9620961 TSecr=1685792668
314   0.031557 54.230.118.138 -> 172.31.8.238 TCP 14546 [TCP segment of a reassembled PDU]
315   0.031564 172.31.8.238 -> 54.230.118.138 TCP 66 58651 > http [ACK] Seq=98 Ack=2573097 Win=1589632 Len=0 TSval=9620961 TSecr=1685792668
316   0.031692 54.230.118.138 -> 172.31.8.238 TCP 10202 [TCP segment of a reassembled PDU]
317   0.031698 172.31.8.238 -> 54.230.118.138 TCP 66 58651 > http [ACK] Seq=98 Ack=2583233 Win=1589632 Len=0 TSval=9620961 TSecr=1685792668
318   0.031711 54.230.118.138 -> 172.31.8.238 TCP 15994 [TCP segment of a reassembled PDU]
319   0.031714 172.31.8.238 -> 54.230.118.138 TCP 66 58651 > http [ACK] Seq=98 Ack=2599161 Win=1589632 Len=0 TSval=9620961 TSecr=1685792668
320   0.031791 54.230.118.138 -> 172.31.8.238 TCP 26130 [TCP segment of a reassembled PDU]
321   0.031797 172.31.8.238 -> 54.230.118.138 TCP 66 58651 > http [ACK] Seq=98 Ack=2625225 Win=1589632 Len=0 TSval=9620961 TSecr=1685792668
322   0.031905 54.230.118.138 -> 172.31.8.238 TCP 26130 [TCP segment of a reassembled PDU]
323   0.031911 172.31.8.238 -> 54.230.118.138 TCP 66 58651 > http [ACK] Seq=98 Ack=2651289 Win=1589632 Len=0 TSval=9620961 TSecr=1685792668
324   0.032194 54.230.118.138 -> 172.31.8.238 TCP 26130 [TCP segment of a reassembled PDU]
325   0.032202 172.31.8.238 -> 54.230.118.138 TCP 66 58651 > http [ACK] Seq=98 Ack=2677353 Win=1589632 Len=0 TSval=9620961 TSecr=1685792668
326   0.032263 54.230.118.138 -> 172.31.8.238 TCP 26130 [TCP segment of a reassembled PDU]
327   0.032270 172.31.8.238 -> 54.230.118.138 TCP 66 58651 > http [ACK] Seq=98 Ack=2703417 Win=1589632 Len=0 TSval=9620961 TSecr=1685792668
328   0.032344 54.230.118.138 -> 172.31.8.238 TCP 26130 [TCP segment of a reassembled PDU]
329   0.032350 172.31.8.238 -> 54.230.118.138 TCP 66 58651 > http [ACK] Seq=98 Ack=2729481 Win=1589632 Len=0 TSval=9620961 TSecr=1685792668
330   0.032425 54.230.118.138 -> 172.31.8.238 TCP 26130 [TCP segment of a reassembled PDU]
331   0.032432 172.31.8.238 -> 54.230.118.138 TCP 66 58651 > http [ACK] Seq=98 Ack=2755545 Win=1589632 Len=0 TSval=9620961 TSecr=1685792668
332   0.032497 54.230.118.138 -> 172.31.8.238 TCP 23234 [TCP segment of a reassembled PDU]
333   0.032503 172.31.8.238 -> 54.230.118.138 TCP 66 58651 > http [ACK] Seq=98 Ack=2778713 Win=1589632 Len=0 TSval=9620961 TSecr=1685792668
334   0.032662 54.230.118.138 -> 172.31.8.238 TCP 11650 [TCP segment of a reassembled PDU]
335   0.032669 172.31.8.238 -> 54.230.118.138 TCP 66 58651 > http [ACK] Seq=98 Ack=2790297 Win=1589632 Len=0 TSval=9620961 TSecr=1685792668
336   0.032841 54.230.118.138 -> 172.31.8.238 TCP 26130 [TCP segment of a reassembled PDU]
337   0.032849 172.31.8.238 -> 54.230.118.138 TCP 66 58651 > http [ACK] Seq=98 Ack=2816361 Win=1589632 Len=0 TSval=9620962 TSecr=1685792668
338   0.032910 54.230.118.138 -> 172.31.8.238 TCP 26130 [TCP segment of a reassembled PDU]
339   0.032917 172.31.8.238 -> 54.230.118.138 TCP 66 58651 > http [ACK] Seq=98 Ack=2842425 Win=1589632 Len=0 TSval=9620962 TSecr=1685792668
340   0.032997 54.230.118.138 -> 172.31.8.238 TCP 26130 [TCP segment of a reassembled PDU]
341   0.033004 172.31.8.238 -> 54.230.118.138 TCP 66 58651 > http [ACK] Seq=98 Ack=2868489 Win=1589632 Len=0 TSval=9620962 TSecr=1685792668
342   0.033077 54.230.118.138 -> 172.31.8.238 TCP 26130 [TCP segment of a reassembled PDU]
343   0.033084 172.31.8.238 -> 54.230.118.138 TCP 66 58651 > http [ACK] Seq=98 Ack=2894553 Win=1589632 Len=0 TSval=9620962 TSecr=1685792668
344   0.033140 54.230.118.138 -> 172.31.8.238 TCP 14546 [TCP segment of a reassembled PDU]
345   0.033147 172.31.8.238 -> 54.230.118.138 TCP 66 58651 > http [ACK] Seq=98 Ack=2909033 Win=1589632 Len=0 TSval=9620962 TSecr=1685792668
346   0.033451 54.230.118.138 -> 172.31.8.238 TCP 11650 [TCP segment of a reassembled PDU]
