[Measurement for 1mb at 10:30:57 20.30.2014] 
Tshark:

  1   0.000000 172.31.36.109 -> 172.31.0.2   DNS 89 Standard query 0xa911  A d3796nkzln59xv.cloudfront.net
  2   0.000021 172.31.36.109 -> 172.31.0.2   DNS 89 Standard query 0x29fd  AAAA d3796nkzln59xv.cloudfront.net
  3   0.000424   172.31.0.2 -> 172.31.36.109 DNS 170 Standard query response 0x29fd 
  4   0.000433   172.31.0.2 -> 172.31.36.109 DNS 217 Standard query response 0xa911  A 54.230.30.213 A 54.230.30.233 A 54.230.30.245 A 54.230.30.247 A 54.192.30.139 A 54.192.30.191 A 54.230.29.238 A 54.230.30.68
  5   0.003894 172.31.36.109 -> 54.230.30.213 TCP 74 54962 > http [SYN] Seq=0 Win=26883 Len=0 MSS=8961 SACK_PERM=1 TSval=35786071 TSecr=0 WS=128
  6   0.005493 54.230.30.213 -> 172.31.36.109 TCP 74 http > 54962 [SYN, ACK] Seq=0 Ack=1 Win=14480 Len=0 MSS=1460 SACK_PERM=1 TSval=728070687 TSecr=35786071 WS=128
  7   0.005529 172.31.36.109 -> 54.230.30.213 TCP 66 54962 > http [ACK] Seq=1 Ack=1 Win=27008 Len=0 TSval=35786071 TSecr=728070687
  8   0.005566 172.31.36.109 -> 54.230.30.213 HTTP 162 GET /1mb HTTP/1.1 
  9   0.006976 54.230.30.213 -> 172.31.36.109 TCP 66 http > 54962 [ACK] Seq=1 Ack=97 Win=14592 Len=0 TSval=728070687 TSecr=35786071
 10   0.022712 54.230.30.213 -> 172.31.36.109 TCP 13098 [TCP segment of a reassembled PDU]
 11   0.022723 172.31.36.109 -> 54.230.30.213 TCP 66 54962 > http [ACK] Seq=97 Ack=13033 Win=52992 Len=0 TSval=35786075 TSecr=728070689
 12   0.022851 54.230.30.213 -> 172.31.36.109 TCP 1514 [TCP segment of a reassembled PDU]
 13   0.022857 172.31.36.109 -> 54.230.30.213 TCP 66 54962 > http [ACK] Seq=97 Ack=14481 Win=55936 Len=0 TSval=35786075 TSecr=728070689
 14   0.024012 54.230.30.213 -> 172.31.36.109 TCP 2962 [TCP segment of a reassembled PDU]
 15   0.024018 172.31.36.109 -> 54.230.30.213 TCP 66 54962 > http [ACK] Seq=97 Ack=17377 Win=61696 Len=0 TSval=35786076 TSecr=728070689
 16   0.024026 54.230.30.213 -> 172.31.36.109 TCP 2962 [TCP segment of a reassembled PDU]
 17   0.024029 172.31.36.109 -> 54.230.30.213 TCP 66 54962 > http [ACK] Seq=97 Ack=20273 Win=67456 Len=0 TSval=35786076 TSecr=728070689
 18   0.024137 54.230.30.213 -> 172.31.36.109 TCP 7306 [TCP segment of a reassembled PDU]
 19   0.024144 172.31.36.109 -> 54.230.30.213 TCP 66 54962 > http [ACK] Seq=97 Ack=27513 Win=81920 Len=0 TSval=35786076 TSecr=728070689
 20   0.025546 54.230.30.213 -> 172.31.36.109 TCP 11650 [TCP segment of a reassembled PDU]
 21   0.025555 172.31.36.109 -> 54.230.30.213 TCP 66 54962 > http [ACK] Seq=97 Ack=39097 Win=98944 Len=0 TSval=35786076 TSecr=728070689
 22   0.025570 54.230.30.213 -> 172.31.36.109 TCP 10202 [TCP segment of a reassembled PDU]
 23   0.025579 172.31.36.109 -> 54.230.30.213 TCP 66 54962 > http [ACK] Seq=97 Ack=49233 Win=88832 Len=0 TSval=35786076 TSecr=728070689
 24   0.027009 54.230.30.213 -> 172.31.36.109 TCP 11650 [TCP segment of a reassembled PDU]
 25   0.027018 172.31.36.109 -> 54.230.30.213 TCP 66 54962 > http [ACK] Seq=97 Ack=60817 Win=98944 Len=0 TSval=35786077 TSecr=728070689
 26   0.027060 54.230.30.213 -> 172.31.36.109 TCP 13098 [TCP segment of a reassembled PDU]
 27   0.027068 172.31.36.109 -> 54.230.30.213 TCP 66 54962 > http [ACK] Seq=97 Ack=73849 Win=96512 Len=0 TSval=35786077 TSecr=728070689
 28   0.028537 54.230.30.213 -> 172.31.36.109 TCP 2962 [TCP segment of a reassembled PDU]
 29   0.028550 172.31.36.109 -> 54.230.30.213 TCP 66 54962 > http [ACK] Seq=97 Ack=76745 Win=109056 Len=0 TSval=35786077 TSecr=728070689
 30   0.028702 54.230.30.213 -> 172.31.36.109 TCP 15994 [TCP segment of a reassembled PDU]
 31   0.028712 172.31.36.109 -> 54.230.30.213 TCP 66 54962 > http [ACK] Seq=97 Ack=92673 Win=93184 Len=0 TSval=35786077 TSecr=728070689
 32   0.028717 54.230.30.213 -> 172.31.36.109 TCP 1514 [TCP segment of a reassembled PDU]
 33   0.028720 172.31.36.109 -> 54.230.30.213 TCP 66 54962 > http [ACK] Seq=97 Ack=94121 Win=91776 Len=0 TSval=35786077 TSecr=728070689
 34   0.030054 54.230.30.213 -> 172.31.36.109 TCP 5858 [TCP segment of a reassembled PDU]
 35   0.030070 172.31.36.109 -> 54.230.30.213 TCP 66 54962 > http [ACK] Seq=97 Ack=99913 Win=108416 Len=0 TSval=35786077 TSecr=728070690
 36   0.030143 54.230.30.213 -> 172.31.36.109 TCP 23234 [TCP segment of a reassembled PDU]
 37   0.030155 172.31.36.109 -> 54.230.30.213 TCP 66 54962 > http [ACK] Seq=97 Ack=123081 Win=85248 Len=0 TSval=35786077 TSecr=728070690
 38   0.031604 54.230.30.213 -> 172.31.36.109 TCP 7827 [TCP segment of a reassembled PDU]
 39   0.031637 172.31.36.109 -> 54.230.30.213 TCP 66 54962 > http [ACK] Seq=97 Ack=130842 Win=103680 Len=0 TSval=35786078 TSecr=728070690
 40   0.053930 54.230.30.213 -> 172.31.36.109 TCP 1514 [TCP segment of a reassembled PDU]
 41   0.053952 172.31.36.109 -> 54.230.30.213 TCP 66 54962 > http [ACK] Seq=97 Ack=132290 Win=112000 Len=0 TSval=35786083 TSecr=728070692
 42   0.054144 54.230.30.213 -> 172.31.36.109 TCP 5858 [TCP segment of a reassembled PDU]
 43   0.054150 172.31.36.109 -> 54.230.30.213 TCP 66 54962 > http [ACK] Seq=97 Ack=138082 Win=123520 Len=0 TSval=35786083 TSecr=728070692
 44   0.054245 54.230.30.213 -> 172.31.36.109 TCP 11650 [TCP segment of a reassembled PDU]
 45   0.054253 172.31.36.109 -> 54.230.30.213 TCP 66 54962 > http [ACK] Seq=97 Ack=149666 Win=146688 Len=0 TSval=35786083 TSecr=728070692
 46   0.054260 54.230.30.213 -> 172.31.36.109 TCP 1514 [TCP segment of a reassembled PDU]
 47   0.054263 172.31.36.109 -> 54.230.30.213 TCP 66 54962 > http [ACK] Seq=97 Ack=151114 Win=149632 Len=0 TSval=35786083 TSecr=728070692
 48   0.054573 54.230.30.213 -> 172.31.36.109 TCP 14546 [TCP segment of a reassembled PDU]
 49   0.054583 172.31.36.109 -> 54.230.30.213 TCP 66 54962 > http [ACK] Seq=97 Ack=165594 Win=178560 Len=0 TSval=35786083 TSecr=728070692
 50   0.055683 54.230.30.213 -> 172.31.36.109 TCP 4410 [TCP segment of a reassembled PDU]
 51   0.055689 172.31.36.109 -> 54.230.30.213 TCP 66 54962 > http [ACK] Seq=97 Ack=169938 Win=187264 Len=0 TSval=35786084 TSecr=728070692
 52   0.055785 54.230.30.213 -> 172.31.36.109 TCP 17442 [TCP segment of a reassembled PDU]
 53   0.055795 172.31.36.109 -> 54.230.30.213 TCP 66 54962 > http [ACK] Seq=97 Ack=187314 Win=221952 Len=0 TSval=35786084 TSecr=728070692
 54   0.055820 54.230.30.213 -> 172.31.36.109 TCP 1514 [TCP segment of a reassembled PDU]
 55   0.055825 172.31.36.109 -> 54.230.30.213 TCP 66 54962 > http [ACK] Seq=97 Ack=188762 Win=224896 Len=0 TSval=35786084 TSecr=728070692
 56   0.056178 54.230.30.213 -> 172.31.36.109 TCP 5858 [TCP segment of a reassembled PDU]
 57   0.056191 172.31.36.109 -> 54.230.30.213 TCP 66 54962 > http [ACK] Seq=97 Ack=194554 Win=236544 Len=0 TSval=35786084 TSecr=728070692
 58   0.056239 54.230.30.213 -> 172.31.36.109 TCP 13098 [TCP segment of a reassembled PDU]
 59   0.056246 172.31.36.109 -> 54.230.30.213 TCP 66 54962 > http [ACK] Seq=97 Ack=207586 Win=262528 Len=0 TSval=35786084 TSecr=728070692
 60   0.057226 54.230.30.213 -> 172.31.36.109 TCP 2962 [TCP segment of a reassembled PDU]
 61   0.057239 172.31.36.109 -> 54.230.30.213 TCP 66 54962 > http [ACK] Seq=97 Ack=210482 Win=268288 Len=0 TSval=35786084 TSecr=728070692
 62   0.057442 54.230.30.213 -> 172.31.36.109 TCP 13098 [TCP segment of a reassembled PDU]
 63   0.057451 172.31.36.109 -> 54.230.30.213 TCP 66 54962 > http [ACK] Seq=97 Ack=223514 Win=294400 Len=0 TSval=35786084 TSecr=728070692
 64   0.057725 54.230.30.213 -> 172.31.36.109 TCP 7306 [TCP segment of a reassembled PDU]
 65   0.057752 172.31.36.109 -> 54.230.30.213 TCP 66 54962 > http [ACK] Seq=97 Ack=230754 Win=308864 Len=0 TSval=35786084 TSecr=728070692
 66   0.057901 54.230.30.213 -> 172.31.36.109 TCP 11650 [TCP segment of a reassembled PDU]
 67   0.057924 172.31.36.109 -> 54.230.30.213 TCP 66 54962 > http [ACK] Seq=97 Ack=242338 Win=332032 Len=0 TSval=35786084 TSecr=728070692
 68   0.058818 54.230.30.213 -> 172.31.36.109 TCP 1514 [TCP segment of a reassembled PDU]
 69   0.058835 172.31.36.109 -> 54.230.30.213 TCP 66 54962 > http [ACK] Seq=97 Ack=243786 Win=334976 Len=0 TSval=35786084 TSecr=728070692
 70   0.058989 54.230.30.213 -> 172.31.36.109 TCP 11650 [TCP segment of a reassembled PDU]
 71   0.059007 172.31.36.109 -> 54.230.30.213 TCP 66 54962 > http [ACK] Seq=97 Ack=255370 Win=358144 Len=0 TSval=35786085 TSecr=728070692
 72   0.059030 54.230.30.213 -> 172.31.36.109 TCP 5858 [TCP segment of a reassembled PDU]
 73   0.059035 172.31.36.109 -> 54.230.30.213 TCP 66 54962 > http [ACK] Seq=97 Ack=261162 Win=369664 Len=0 TSval=35786085 TSecr=728070692
 74   0.059344 54.230.30.213 -> 172.31.36.109 TCP 23234 [TCP segment of a reassembled PDU]
 75   0.059367 172.31.36.109 -> 54.230.30.213 TCP 66 54962 > http [ACK] Seq=97 Ack=284330 Win=416000 Len=0 TSval=35786085 TSecr=728070693
 76   0.059500 54.230.30.213 -> 172.31.36.109 TCP 4410 [TCP segment of a reassembled PDU]
 77   0.059520 172.31.36.109 -> 54.230.30.213 TCP 66 54962 > http [ACK] Seq=97 Ack=288674 Win=424704 Len=0 TSval=35786085 TSecr=728070693
 78   0.060574 54.230.30.213 -> 172.31.36.109 TCP 5858 [TCP segment of a reassembled PDU]
 79   0.060604 172.31.36.109 -> 54.230.30.213 TCP 66 54962 > http [ACK] Seq=97 Ack=294466 Win=436352 Len=0 TSval=35786085 TSecr=728070693
 80   0.060769 54.230.30.213 -> 172.31.36.109 TCP 18890 [TCP segment of a reassembled PDU]
 81   0.060780 172.31.36.109 -> 54.230.30.213 TCP 66 54962 > http [ACK] Seq=97 Ack=313290 Win=473984 Len=0 TSval=35786085 TSecr=728070693
 82   0.061082 54.230.30.213 -> 172.31.36.109 TCP 8754 [TCP segment of a reassembled PDU]
 83   0.061097 172.31.36.109 -> 54.230.30.213 TCP 66 54962 > http [ACK] Seq=97 Ack=321978 Win=491392 Len=0 TSval=35786085 TSecr=728070693
 84   0.061297 54.230.30.213 -> 172.31.36.109 TCP 17442 [TCP segment of a reassembled PDU]
 85   0.061308 172.31.36.109 -> 54.230.30.213 TCP 66 54962 > http [ACK] Seq=97 Ack=339354 Win=526080 Len=0 TSval=35786085 TSecr=728070693
 86   0.061318 54.230.30.213 -> 172.31.36.109 TCP 5858 [TCP segment of a reassembled PDU]
 87   0.061322 172.31.36.109 -> 54.230.30.213 TCP 66 54962 > http [ACK] Seq=97 Ack=345146 Win=537728 Len=0 TSval=35786085 TSecr=728070693
 88   0.062099 54.230.30.213 -> 172.31.36.109 TCP 7306 [TCP segment of a reassembled PDU]
 89   0.062130 172.31.36.109 -> 54.230.30.213 TCP 66 54962 > http [ACK] Seq=97 Ack=352386 Win=552192 Len=0 TSval=35786085 TSecr=728070693
 90   0.062223 54.230.30.213 -> 172.31.36.109 TCP 1514 [TCP segment of a reassembled PDU]
 91   0.062252 172.31.36.109 -> 54.230.30.213 TCP 66 54962 > http [ACK] Seq=97 Ack=353834 Win=555008 Len=0 TSval=35786085 TSecr=728070693
 92   0.062369 54.230.30.213 -> 172.31.36.109 TCP 8754 [TCP segment of a reassembled PDU]
 93   0.062398 172.31.36.109 -> 54.230.30.213 TCP 66 54962 > http [ACK] Seq=97 Ack=362522 Win=572416 Len=0 TSval=35786085 TSecr=728070693
 94   0.062429 54.230.30.213 -> 172.31.36.109 TCP 15994 [TCP segment of a reassembled PDU]
 95   0.062437 172.31.36.109 -> 54.230.30.213 TCP 66 54962 > http [ACK] Seq=97 Ack=378450 Win=604288 Len=0 TSval=35786085 TSecr=728070693
 96   0.062816 54.230.30.213 -> 172.31.36.109 TCP 1514 [TCP segment of a reassembled PDU]
 97   0.062829 172.31.36.109 -> 54.230.30.213 TCP 66 54962 > http [ACK] Seq=97 Ack=379898 Win=607232 Len=0 TSval=35786085 TSecr=728070693
 98   0.063028 54.230.30.213 -> 172.31.36.109 TCP 21786 [TCP segment of a reassembled PDU]
 99   0.063041 172.31.36.109 -> 54.230.30.213 TCP 66 54962 > http [ACK] Seq=97 Ack=401618 Win=650624 Len=0 TSval=35786086 TSecr=728070693
100   0.063088 54.230.30.213 -> 172.31.36.109 TCP 4410 [TCP segment of a reassembled PDU]
101   0.063094 172.31.36.109 -> 54.230.30.213 TCP 66 54962 > http [ACK] Seq=97 Ack=405962 Win=659328 Len=0 TSval=35786086 TSecr=728070693
102   0.063124 54.230.30.213 -> 172.31.36.109 TCP 1514 [TCP segment of a reassembled PDU]
103   0.063128 172.31.36.109 -> 54.230.30.213 TCP 66 54962 > http [ACK] Seq=97 Ack=407410 Win=662144 Len=0 TSval=35786086 TSecr=728070693
104   0.063583 54.230.30.213 -> 172.31.36.109 TCP 1514 [TCP segment of a reassembled PDU]
105   0.063587 172.31.36.109 -> 54.230.30.213 TCP 66 54962 > http [ACK] Seq=97 Ack=408858 Win=665088 Len=0 TSval=35786086 TSecr=728070693
106   0.063730 54.230.30.213 -> 172.31.36.109 TCP 10202 [TCP segment of a reassembled PDU]
107   0.063737 172.31.36.109 -> 54.230.30.213 TCP 66 54962 > http [ACK] Seq=97 Ack=418994 Win=685312 Len=0 TSval=35786086 TSecr=728070693
108   0.064070 54.230.30.213 -> 172.31.36.109 TCP 2962 [TCP segment of a reassembled PDU]
109   0.064074 172.31.36.109 -> 54.230.30.213 TCP 66 54962 > http [ACK] Seq=97 Ack=421890 Win=691200 Len=0 TSval=35786086 TSecr=728070693
110   0.064353 54.230.30.213 -> 172.31.36.109 TCP 2962 [TCP segment of a reassembled PDU]
111   0.064357 172.31.36.109 -> 54.230.30.213 TCP 66 54962 > http [ACK] Seq=97 Ack=424786 Win=696960 Len=0 TSval=35786086 TSecr=728070693
112   0.064480 54.230.30.213 -> 172.31.36.109 TCP 15994 [TCP segment of a reassembled PDU]
113   0.064489 172.31.36.109 -> 54.230.30.213 TCP 66 54962 > http [ACK] Seq=97 Ack=440714 Win=703616 Len=0 TSval=35786086 TSecr=728070693
114   0.064670 54.230.30.213 -> 172.31.36.109 TCP 11650 [TCP segment of a reassembled PDU]
115   0.064678 172.31.36.109 -> 54.230.30.213 TCP 66 54962 > http [ACK] Seq=97 Ack=452298 Win=710784 Len=0 TSval=35786086 TSecr=728070693
116   0.064752 54.230.30.213 -> 172.31.36.109 TCP 1514 [TCP segment of a reassembled PDU]
117   0.065120 54.230.30.213 -> 172.31.36.109 TCP 1514 [TCP segment of a reassembled PDU]
118   0.065124 172.31.36.109 -> 54.230.30.213 TCP 66 54962 > http [ACK] Seq=97 Ack=455194 Win=726656 Len=0 TSval=35786086 TSecr=728070693
119   0.065234 54.230.30.213 -> 172.31.36.109 TCP 11650 [TCP segment of a reassembled PDU]
120   0.065252 172.31.36.109 -> 54.230.30.213 TCP 66 54962 > http [ACK] Seq=97 Ack=466778 Win=726656 Len=0 TSval=35786086 TSecr=728070693
121   0.065378 54.230.30.213 -> 172.31.36.109 TCP 2962 [TCP segment of a reassembled PDU]
122   0.065391 172.31.36.109 -> 54.230.30.213 TCP 66 54962 > http [ACK] Seq=97 Ack=469674 Win=726656 Len=0 TSval=35786086 TSecr=728070693
123   0.065491 54.230.30.213 -> 172.31.36.109 TCP 13098 [TCP segment of a reassembled PDU]
124   0.065510 172.31.36.109 -> 54.230.30.213 TCP 66 54962 > http [ACK] Seq=97 Ack=482706 Win=726656 Len=0 TSval=35786086 TSecr=728070693
125   0.065652 54.230.30.213 -> 172.31.36.109 TCP 1514 [TCP segment of a reassembled PDU]
126   0.066112 54.230.30.213 -> 172.31.36.109 TCP 1514 [TCP segment of a reassembled PDU]
127   0.066116 172.31.36.109 -> 54.230.30.213 TCP 66 54962 > http [ACK] Seq=97 Ack=485602 Win=726656 Len=0 TSval=35786086 TSecr=728070693
128   0.066214 54.230.30.213 -> 172.31.36.109 TCP 2962 [TCP segment of a reassembled PDU]
129   0.066382 54.230.30.213 -> 172.31.36.109 TCP 1514 [TCP segment of a reassembled PDU]
130   0.066428 172.31.36.109 -> 54.230.30.213 TCP 66 54962 > http [ACK] Seq=97 Ack=489946 Win=726656 Len=0 TSval=35786086 TSecr=728070693
131   0.066494 54.230.30.213 -> 172.31.36.109 TCP 7306 [TCP segment of a reassembled PDU]
132   0.066524 172.31.36.109 -> 54.230.30.213 TCP 66 54962 > http [ACK] Seq=97 Ack=497186 Win=726656 Len=0 TSval=35786086 TSecr=728070693
133   0.066604 54.230.30.213 -> 172.31.36.109 TCP 13098 [TCP segment of a reassembled PDU]
134   0.066623 172.31.36.109 -> 54.230.30.213 TCP 66 54962 > http [ACK] Seq=97 Ack=510218 Win=726656 Len=0 TSval=35786086 TSecr=728070693
135   0.066647 54.230.30.213 -> 172.31.36.109 TCP 7306 [TCP segment of a reassembled PDU]
136   0.066663 172.31.36.109 -> 54.230.30.213 TCP 66 54962 > http [ACK] Seq=97 Ack=517458 Win=726656 Len=0 TSval=35786086 TSecr=728070693
137   0.066895 54.230.30.213 -> 172.31.36.109 TCP 6666 [TCP segment of a reassembled PDU]
138   0.066912 172.31.36.109 -> 54.230.30.213 TCP 66 54962 > http [ACK] Seq=97 Ack=524058 Win=726656 Len=0 TSval=35786086 TSecr=728070693
139   0.069199 54.230.30.213 -> 172.31.36.109 TCP 4410 [TCP segment of a reassembled PDU]
140   0.069222 172.31.36.109 -> 54.230.30.213 TCP 66 54962 > http [ACK] Seq=97 Ack=528402 Win=726656 Len=0 TSval=35786087 TSecr=728070694
141   0.069325 54.230.30.213 -> 172.31.36.109 TCP 5858 [TCP segment of a reassembled PDU]
142   0.069350 172.31.36.109 -> 54.230.30.213 TCP 66 54962 > http [ACK] Seq=97 Ack=534194 Win=726656 Len=0 TSval=35786087 TSecr=728070694
143   0.069503 54.230.30.213 -> 172.31.36.109 TCP 2962 [TCP segment of a reassembled PDU]
144   0.069551 54.230.30.213 -> 172.31.36.109 TCP 11650 [TCP segment of a reassembled PDU]
145   0.069562 172.31.36.109 -> 54.230.30.213 TCP 66 54962 > http [ACK] Seq=97 Ack=548674 Win=726656 Len=0 TSval=35786087 TSecr=728070694
146   0.069709 54.230.30.213 -> 172.31.36.109 TCP 2962 [TCP segment of a reassembled PDU]
147   0.069724 172.31.36.109 -> 54.230.30.213 TCP 66 54962 > http [ACK] Seq=97 Ack=551570 Win=726656 Len=0 TSval=35786087 TSecr=728070694
148   0.069807 54.230.30.213 -> 172.31.36.109 TCP 1514 [TCP segment of a reassembled PDU]
149   0.069851 54.230.30.213 -> 172.31.36.109 TCP 8754 [TCP segment of a reassembled PDU]
150   0.069872 172.31.36.109 -> 54.230.30.213 TCP 66 54962 > http [ACK] Seq=97 Ack=561706 Win=726656 Len=0 TSval=35786087 TSecr=728070694
151   0.070988 54.230.30.213 -> 172.31.36.109 TCP 2962 [TCP segment of a reassembled PDU]
152   0.071008 172.31.36.109 -> 54.230.30.213 TCP 66 54962 > http [ACK] Seq=97 Ack=564602 Win=726656 Len=0 TSval=35786088 TSecr=728070694
153   0.071135 54.230.30.213 -> 172.31.36.109 TCP 1514 [TCP segment of a reassembled PDU]
154   0.071412 54.230.30.213 -> 172.31.36.109 TCP 23610 [TCP segment of a reassembled PDU]
155   0.071449 172.31.36.109 -> 54.230.30.213 TCP 66 54962 > http [ACK] Seq=97 Ack=589594 Win=701696 Len=0 TSval=35786088 TSecr=728070694
156   0.072320 54.230.30.213 -> 172.31.36.109 TCP 4410 [TCP segment of a reassembled PDU]
157   0.072345 172.31.36.109 -> 54.230.30.213 TCP 66 54962 > http [ACK] Seq=97 Ack=593938 Win=722688 Len=0 TSval=35786088 TSecr=728070694
158   0.072678 54.230.30.213 -> 172.31.36.109 TCP 18890 [TCP segment of a reassembled PDU]
159   0.072870 172.31.36.109 -> 54.230.30.213 TCP 66 54962 > http [ACK] Seq=97 Ack=612762 Win=703872 Len=0 TSval=35786088 TSecr=728070694
160   0.073957 54.230.30.213 -> 172.31.36.109 TCP 4410 [TCP segment of a reassembled PDU]
161   0.073963 172.31.36.109 -> 54.230.30.213 TCP 66 54962 > http [ACK] Seq=97 Ack=617106 Win=722688 Len=0 TSval=35786088 TSecr=728070694
162   0.074270 54.230.30.213 -> 172.31.36.109 TCP 21786 [TCP segment of a reassembled PDU]
163   0.074314 54.230.30.213 -> 172.31.36.109 TCP 11650 [TCP segment of a reassembled PDU]
164   0.074332 172.31.36.109 -> 54.230.30.213 TCP 66 54962 > http [ACK] Seq=97 Ack=650410 Win=689408 Len=0 TSval=35786088 TSecr=728070694
165   0.074424 54.230.30.213 -> 172.31.36.109 TCP 10202 [TCP segment of a reassembled PDU]
166   0.074432 172.31.36.109 -> 54.230.30.213 TCP 66 54962 > http [ACK] Seq=97 Ack=660546 Win=713216 Len=0 TSval=35786088 TSecr=728070694
167   0.074478 54.230.30.213 -> 172.31.36.109 TCP 14546 [TCP segment of a reassembled PDU]
168   0.074500 172.31.36.109 -> 54.230.30.213 TCP 66 54962 > http [ACK] Seq=97 Ack=675026 Win=726656 Len=0 TSval=35786088 TSecr=728070694
169   0.074683 54.230.30.213 -> 172.31.36.109 TCP 10202 [TCP segment of a reassembled PDU]
170   0.074715 172.31.36.109 -> 54.230.30.213 TCP 66 54962 > http [ACK] Seq=97 Ack=685162 Win=726656 Len=0 TSval=35786088 TSecr=728070694
171   0.075332 54.230.30.213 -> 172.31.36.109 TCP 2962 [TCP segment of a reassembled PDU]
172   0.075357 172.31.36.109 -> 54.230.30.213 TCP 66 54962 > http [ACK] Seq=97 Ack=688058 Win=726656 Len=0 TSval=35786089 TSecr=728070694
173   0.075504 54.230.30.213 -> 172.31.36.109 TCP 18890 [TCP segment of a reassembled PDU]
174   0.075537 172.31.36.109 -> 54.230.30.213 TCP 66 54962 > http [ACK] Seq=97 Ack=706882 Win=707840 Len=0 TSval=35786089 TSecr=728070694
175   0.075706 54.230.30.213 -> 172.31.36.109 TCP 5858 [TCP segment of a reassembled PDU]
176   0.075712 172.31.36.109 -> 54.230.30.213 TCP 66 54962 > http [ACK] Seq=97 Ack=712674 Win=720256 Len=0 TSval=35786089 TSecr=728070694
177   0.076004 54.230.30.213 -> 172.31.36.109 TCP 13098 [TCP segment of a reassembled PDU]
178   0.076104 54.230.30.213 -> 172.31.36.109 TCP 26130 [TCP segment of a reassembled PDU]
179   0.076123 54.230.30.213 -> 172.31.36.109 TCP 10202 [TCP segment of a reassembled PDU]
180   0.076183 54.230.30.213 -> 172.31.36.109 TCP 8754 [TCP segment of a reassembled PDU]
181   0.076238 172.31.36.109 -> 54.230.30.213 TCP 66 54962 > http [ACK] Seq=97 Ack=770594 Win=662400 Len=0 TSval=35786089 TSecr=728070694
182   0.076351 54.230.30.213 -> 172.31.36.109 TCP 2962 [TCP segment of a reassembled PDU]
183   0.076365 172.31.36.109 -> 54.230.30.213 TCP 66 54962 > http [ACK] Seq=97 Ack=773490 Win=724992 Len=0 TSval=35786089 TSecr=728070694
184   0.076485 54.230.30.213 -> 172.31.36.109 TCP 4410 [TCP segment of a reassembled PDU]
185   0.076523 172.31.36.109 -> 54.230.30.213 TCP 66 54962 > http [ACK] Seq=97 Ack=777834 Win=726656 Len=0 TSval=35786089 TSecr=728070694
186   0.076864 54.230.30.213 -> 172.31.36.109 TCP 1514 [TCP segment of a reassembled PDU]
187   0.077017 54.230.30.213 -> 172.31.36.109 TCP 7306 [TCP segment of a reassembled PDU]
188   0.077053 172.31.36.109 -> 54.230.30.213 TCP 66 54962 > http [ACK] Seq=97 Ack=786522 Win=726656 Len=0 TSval=35786089 TSecr=728070694
189   0.077421 54.230.30.213 -> 172.31.36.109 TCP 4410 [TCP segment of a reassembled PDU]
190   0.077436 172.31.36.109 -> 54.230.30.213 TCP 66 54962 > http [ACK] Seq=97 Ack=790866 Win=726656 Len=0 TSval=35786089 TSecr=728070694
191   0.077676 54.230.30.213 -> 172.31.36.109 TCP 15994 [TCP segment of a reassembled PDU]
192   0.077697 172.31.36.109 -> 54.230.30.213 TCP 66 54962 > http [ACK] Seq=97 Ack=806794 Win=726656 Len=0 TSval=35786089 TSecr=728070694
193   0.077811 54.230.30.213 -> 172.31.36.109 TCP 17442 [TCP segment of a reassembled PDU]
194   0.077834 172.31.36.109 -> 54.230.30.213 TCP 66 54962 > http [ACK] Seq=97 Ack=824170 Win=709376 Len=0 TSval=35786089 TSecr=728070694
195   0.077843 54.230.30.213 -> 172.31.36.109 TCP 7306 [TCP segment of a reassembled PDU]
196   0.077860 172.31.36.109 -> 54.230.30.213 TCP 66 54962 > http [ACK] Seq=97 Ack=831410 Win=726656 Len=0 TSval=35786089 TSecr=728070694
197   0.078028 54.230.30.213 -> 172.31.36.109 TCP 23234 [TCP segment of a reassembled PDU]
198   0.078134 54.230.30.213 -> 172.31.36.109 TCP 2962 [TCP segment of a reassembled PDU]
199   0.078222 172.31.36.109 -> 54.230.30.213 TCP 66 54962 > http [ACK] Seq=97 Ack=857474 Win=700672 Len=0 TSval=35786089 TSecr=728070694
200   0.078316 54.230.30.213 -> 172.31.36.109 TCP 24682 [TCP segment of a reassembled PDU]
201   0.078339 172.31.36.109 -> 54.230.30.213 TCP 66 54962 > http [ACK] Seq=97 Ack=882090 Win=689408 Len=0 TSval=35786089 TSecr=728070694
202   0.078392 54.230.30.213 -> 172.31.36.109 TCP 1514 [TCP segment of a reassembled PDU]
203   0.078642 54.230.30.213 -> 172.31.36.109 TCP 2962 [TCP segment of a reassembled PDU]
204   0.078647 172.31.36.109 -> 54.230.30.213 TCP 66 54962 > http [ACK] Seq=97 Ack=886434 Win=724992 Len=0 TSval=35786089 TSecr=728070694
205   0.078769 54.230.30.213 -> 172.31.36.109 TCP 11650 [TCP segment of a reassembled PDU]
206   0.078787 172.31.36.109 -> 54.230.30.213 TCP 66 54962 > http [ACK] Seq=97 Ack=898018 Win=726656 Len=0 TSval=35786089 TSecr=728070694
207   0.079181 54.230.30.213 -> 172.31.36.109 TCP 2962 [TCP segment of a reassembled PDU]
208   0.079195 172.31.36.109 -> 54.230.30.213 TCP 66 54962 > http [ACK] Seq=97 Ack=900914 Win=726656 Len=0 TSval=35786090 TSecr=728070695
209   0.079315 54.230.30.213 -> 172.31.36.109 TCP 23234 [TCP segment of a reassembled PDU]
210   0.079327 172.31.36.109 -> 54.230.30.213 TCP 66 54962 > http [ACK] Seq=97 Ack=924082 Win=772992 Len=0 TSval=35786090 TSecr=728070695
211   0.079494 54.230.30.213 -> 172.31.36.109 TCP 10202 [TCP segment of a reassembled PDU]
212   0.079502 172.31.36.109 -> 54.230.30.213 TCP 66 54962 > http [ACK] Seq=97 Ack=934218 Win=793216 Len=0 TSval=35786090 TSecr=728070695
213   0.079592 54.230.30.213 -> 172.31.36.109 TCP 5858 [TCP segment of a reassembled PDU]
214   0.079598 172.31.36.109 -> 54.230.30.213 TCP 66 54962 > http [ACK] Seq=97 Ack=940010 Win=804864 Len=0 TSval=35786090 TSecr=728070695
215   0.079721 54.230.30.213 -> 172.31.36.109 TCP 13098 [TCP segment of a reassembled PDU]
216   0.079729 172.31.36.109 -> 54.230.30.213 TCP 66 54962 > http [ACK] Seq=97 Ack=953042 Win=830848 Len=0 TSval=35786090 TSecr=728070695
