[Measurement for 1mb at 19:30:54 19.30.2014] 
Tshark:

  1   0.000000 172.31.36.109 -> 172.31.0.2   DNS 89 Standard query 0x64cf  A d3796nkzln59xv.cloudfront.net
  2   0.000023 172.31.36.109 -> 172.31.0.2   DNS 89 Standard query 0xb5a3  AAAA d3796nkzln59xv.cloudfront.net
  3   0.000536   172.31.0.2 -> 172.31.36.109 DNS 217 Standard query response 0x64cf  A 54.192.29.221 A 54.192.29.227 A 54.192.30.223 A 54.230.29.244 A 54.230.30.37 A 54.230.30.40 A 54.230.30.222 A 54.230.30.244
  4   0.000567   172.31.0.2 -> 172.31.36.109 DNS 170 Standard query response 0xb5a3 
  5   0.003861 172.31.36.109 -> 54.192.29.221 TCP 74 57975 > http [SYN] Seq=0 Win=26883 Len=0 MSS=8961 SACK_PERM=1 TSval=22285343 TSecr=0 WS=128
  6   0.005081 54.192.29.221 -> 172.31.36.109 TCP 74 http > 57975 [SYN, ACK] Seq=0 Ack=1 Win=14480 Len=0 MSS=1460 SACK_PERM=1 TSval=718923684 TSecr=22285343 WS=128
  7   0.005107 172.31.36.109 -> 54.192.29.221 TCP 66 57975 > http [ACK] Seq=1 Ack=1 Win=27008 Len=0 TSval=22285343 TSecr=718923684
  8   0.005147 172.31.36.109 -> 54.192.29.221 HTTP 162 GET /1mb HTTP/1.1 
  9   0.006326 54.192.29.221 -> 172.31.36.109 TCP 66 http > 57975 [ACK] Seq=1 Ack=97 Win=14592 Len=0 TSval=718923684 TSecr=22285343
 10   0.088527 54.192.29.221 -> 172.31.36.109 TCP 13098 [TCP segment of a reassembled PDU]
 11   0.088541 172.31.36.109 -> 54.192.29.221 TCP 66 57975 > http [ACK] Seq=97 Ack=13033 Win=52992 Len=0 TSval=22285364 TSecr=718923692
 12   0.090064 54.192.29.221 -> 172.31.36.109 TCP 13098 [TCP segment of a reassembled PDU]
 13   0.090074 172.31.36.109 -> 54.192.29.221 TCP 66 57975 > http [ACK] Seq=97 Ack=26065 Win=79104 Len=0 TSval=22285364 TSecr=718923692
 14   0.091539 54.192.29.221 -> 172.31.36.109 TCP 13098 [TCP segment of a reassembled PDU]
 15   0.091548 172.31.36.109 -> 54.192.29.221 TCP 66 57975 > http [ACK] Seq=97 Ack=39097 Win=96512 Len=0 TSval=22285365 TSecr=718923693
 16   0.092860 54.192.29.221 -> 172.31.36.109 TCP 13098 [TCP segment of a reassembled PDU]
 17   0.092884 172.31.36.109 -> 54.192.29.221 TCP 66 57975 > http [ACK] Seq=97 Ack=52129 Win=96512 Len=0 TSval=22285365 TSecr=718923693
 18   0.094380 54.192.29.221 -> 172.31.36.109 TCP 20338 [TCP segment of a reassembled PDU]
 19   0.094393 172.31.36.109 -> 54.192.29.221 TCP 66 57975 > http [ACK] Seq=97 Ack=72401 Win=145664 Len=0 TSval=22285365 TSecr=718923693
 20   0.095580 54.192.29.221 -> 172.31.36.109 TCP 5858 [TCP segment of a reassembled PDU]
 21   0.095587 172.31.36.109 -> 54.192.29.221 TCP 66 57975 > http [ACK] Seq=97 Ack=78193 Win=157312 Len=0 TSval=22285366 TSecr=718923693
 22   0.095601 54.192.29.221 -> 172.31.36.109 TCP 10202 [TCP segment of a reassembled PDU]
 23   0.095606 172.31.36.109 -> 54.192.29.221 TCP 66 57975 > http [ACK] Seq=97 Ack=88329 Win=177536 Len=0 TSval=22285366 TSecr=718923693
 24   0.095641 54.192.29.221 -> 172.31.36.109 TCP 5858 [TCP segment of a reassembled PDU]
 25   0.095647 172.31.36.109 -> 54.192.29.221 TCP 66 57975 > http [ACK] Seq=97 Ack=94121 Win=189184 Len=0 TSval=22285366 TSecr=718923693
 26   0.096861 54.192.29.221 -> 172.31.36.109 TCP 8754 [TCP segment of a reassembled PDU]
 27   0.096887 172.31.36.109 -> 54.192.29.221 TCP 66 57975 > http [ACK] Seq=97 Ack=102809 Win=206464 Len=0 TSval=22285366 TSecr=718923693
 28   0.096926 54.192.29.221 -> 172.31.36.109 TCP 14546 [TCP segment of a reassembled PDU]
 29   0.096935 172.31.36.109 -> 54.192.29.221 TCP 66 57975 > http [ACK] Seq=97 Ack=117289 Win=235520 Len=0 TSval=22285366 TSecr=718923693
 30   0.098124 54.192.29.221 -> 172.31.36.109 TCP 5858 [TCP segment of a reassembled PDU]
 31   0.098130 172.31.36.109 -> 54.192.29.221 TCP 66 57975 > http [ACK] Seq=97 Ack=123081 Win=247040 Len=0 TSval=22285366 TSecr=718923693
 32   0.098224 54.192.29.221 -> 172.31.36.109 TCP 5858 [TCP segment of a reassembled PDU]
 33   0.098231 172.31.36.109 -> 54.192.29.221 TCP 66 57975 > http [ACK] Seq=97 Ack=128873 Win=258688 Len=0 TSval=22285366 TSecr=718923693
 34   0.098235 54.192.29.221 -> 172.31.36.109 TCP 586 [TCP Previous segment not captured] [TCP segment of a reassembled PDU]
 35   0.098238 172.31.36.109 -> 54.192.29.221 TCP 78 [TCP Window Update] 57975 > http [ACK] Seq=97 Ack=128873 Win=261504 Len=0 TSval=22285366 TSecr=718923693 SLE=130321 SRE=130841
 36   0.098241 54.192.29.221 -> 172.31.36.109 TCP 1514 [TCP Out-Of-Order] [TCP segment of a reassembled PDU]
 37   0.098244 172.31.36.109 -> 54.192.29.221 TCP 66 57975 > http [ACK] Seq=97 Ack=130841 Win=264448 Len=0 TSval=22285366 TSecr=718923693
 38   0.116137 54.192.29.221 -> 172.31.36.109 TCP 1514 [TCP segment of a reassembled PDU]
 39   0.116161 172.31.36.109 -> 54.192.29.221 TCP 66 57975 > http [ACK] Seq=97 Ack=132289 Win=267264 Len=0 TSval=22285371 TSecr=718923695
 40   0.116362 54.192.29.221 -> 172.31.36.109 TCP 2962 [TCP segment of a reassembled PDU]
 41   0.116367 172.31.36.109 -> 54.192.29.221 TCP 66 57975 > http [ACK] Seq=97 Ack=135185 Win=273152 Len=0 TSval=22285371 TSecr=718923695
 42   0.117580 54.192.29.221 -> 172.31.36.109 TCP 5858 [TCP segment of a reassembled PDU]
 43   0.117586 172.31.36.109 -> 54.192.29.221 TCP 66 57975 > http [ACK] Seq=97 Ack=140977 Win=284672 Len=0 TSval=22285371 TSecr=718923695
 44   0.117649 54.192.29.221 -> 172.31.36.109 TCP 1514 [TCP segment of a reassembled PDU]
 45   0.117666 172.31.36.109 -> 54.192.29.221 TCP 66 57975 > http [ACK] Seq=97 Ack=142425 Win=287616 Len=0 TSval=22285371 TSecr=718923695
 46   0.118899 54.192.29.221 -> 172.31.36.109 TCP 5858 [TCP segment of a reassembled PDU]
 47   0.118914 172.31.36.109 -> 54.192.29.221 TCP 66 57975 > http [ACK] Seq=97 Ack=148217 Win=299136 Len=0 TSval=22285372 TSecr=718923695
 48   0.118941 54.192.29.221 -> 172.31.36.109 TCP 1514 [TCP segment of a reassembled PDU]
 49   0.118948 172.31.36.109 -> 54.192.29.221 TCP 66 57975 > http [ACK] Seq=97 Ack=149665 Win=302080 Len=0 TSval=22285372 TSecr=718923695
 50   0.120166 54.192.29.221 -> 172.31.36.109 TCP 4410 [TCP segment of a reassembled PDU]
 51   0.120174 172.31.36.109 -> 54.192.29.221 TCP 66 57975 > http [ACK] Seq=97 Ack=154009 Win=310784 Len=0 TSval=22285372 TSecr=718923695
 52   0.120222 54.192.29.221 -> 172.31.36.109 TCP 5858 [TCP segment of a reassembled PDU]
 53   0.120229 172.31.36.109 -> 54.192.29.221 TCP 66 57975 > http [ACK] Seq=97 Ack=159801 Win=322304 Len=0 TSval=22285372 TSecr=718923695
 54   0.121416 54.192.29.221 -> 172.31.36.109 TCP 4410 [TCP segment of a reassembled PDU]
 55   0.121430 172.31.36.109 -> 54.192.29.221 TCP 66 57975 > http [ACK] Seq=97 Ack=164145 Win=331008 Len=0 TSval=22285372 TSecr=718923696
 56   0.121556 54.192.29.221 -> 172.31.36.109 TCP 11650 [TCP segment of a reassembled PDU]
 57   0.121580 172.31.36.109 -> 54.192.29.221 TCP 66 57975 > http [ACK] Seq=97 Ack=175729 Win=354176 Len=0 TSval=22285372 TSecr=718923696
 58   0.122701 54.192.29.221 -> 172.31.36.109 TCP 5858 [TCP segment of a reassembled PDU]
 59   0.122707 172.31.36.109 -> 54.192.29.221 TCP 66 57975 > http [ACK] Seq=97 Ack=181521 Win=365824 Len=0 TSval=22285372 TSecr=718923696
 60   0.123015 54.192.29.221 -> 172.31.36.109 TCP 13098 [TCP segment of a reassembled PDU]
 61   0.123039 172.31.36.109 -> 54.192.29.221 TCP 66 57975 > http [ACK] Seq=97 Ack=194553 Win=357120 Len=0 TSval=22285373 TSecr=718923696
 62   0.123974 54.192.29.221 -> 172.31.36.109 TCP 4410 [TCP segment of a reassembled PDU]
 63   0.123979 172.31.36.109 -> 54.192.29.221 TCP 66 57975 > http [ACK] Seq=97 Ack=198897 Win=371328 Len=0 TSval=22285373 TSecr=718923696
 64   0.124091 54.192.29.221 -> 172.31.36.109 TCP 1514 [TCP segment of a reassembled PDU]
 65   0.124102 172.31.36.109 -> 54.192.29.221 TCP 66 57975 > http [ACK] Seq=97 Ack=200345 Win=376064 Len=0 TSval=22285373 TSecr=718923696
 66   0.124225 54.192.29.221 -> 172.31.36.109 TCP 1514 [TCP segment of a reassembled PDU]
 67   0.124235 172.31.36.109 -> 54.192.29.221 TCP 66 57975 > http [ACK] Seq=97 Ack=201793 Win=376064 Len=0 TSval=22285373 TSecr=718923696
 68   0.124380 54.192.29.221 -> 172.31.36.109 TCP 14546 [TCP segment of a reassembled PDU]
 69   0.124405 172.31.36.109 -> 54.192.29.221 TCP 66 57975 > http [ACK] Seq=97 Ack=216273 Win=361600 Len=0 TSval=22285373 TSecr=718923696
 70   0.125503 54.192.29.221 -> 172.31.36.109 TCP 5858 [TCP segment of a reassembled PDU]
 71   0.125510 172.31.36.109 -> 54.192.29.221 TCP 66 57975 > http [ACK] Seq=97 Ack=222065 Win=368896 Len=0 TSval=22285373 TSecr=718923696
 72   0.125592 54.192.29.221 -> 172.31.36.109 TCP 2962 [TCP segment of a reassembled PDU]
 73   0.125597 172.31.36.109 -> 54.192.29.221 TCP 66 57975 > http [ACK] Seq=97 Ack=224961 Win=373632 Len=0 TSval=22285373 TSecr=718923696
 74   0.125957 54.192.29.221 -> 172.31.36.109 TCP 18890 [TCP segment of a reassembled PDU]
 75   0.125967 172.31.36.109 -> 54.192.29.221 TCP 66 57975 > http [ACK] Seq=97 Ack=243785 Win=354816 Len=0 TSval=22285373 TSecr=718923696
 76   0.126780 54.192.29.221 -> 172.31.36.109 TCP 1514 [TCP segment of a reassembled PDU]
 77   0.126784 172.31.36.109 -> 54.192.29.221 TCP 66 57975 > http [ACK] Seq=97 Ack=245233 Win=376064 Len=0 TSval=22285374 TSecr=718923696
 78   0.126906 54.192.29.221 -> 172.31.36.109 TCP 10202 [TCP segment of a reassembled PDU]
 79   0.126926 172.31.36.109 -> 54.192.29.221 TCP 66 57975 > http [ACK] Seq=97 Ack=255369 Win=365952 Len=0 TSval=22285374 TSecr=718923696
 80   0.127299 54.192.29.221 -> 172.31.36.109 TCP 2962 [TCP segment of a reassembled PDU]
 81   0.127327 172.31.36.109 -> 54.192.29.221 TCP 66 57975 > http [ACK] Seq=97 Ack=258265 Win=373632 Len=0 TSval=22285374 TSecr=718923696
 82   0.127422 54.192.29.221 -> 172.31.36.109 TCP 7306 [TCP segment of a reassembled PDU]
 83   0.127436 172.31.36.109 -> 54.192.29.221 TCP 66 57975 > http [ACK] Seq=97 Ack=265505 Win=366592 Len=0 TSval=22285374 TSecr=718923696
 84   0.128065 54.192.29.221 -> 172.31.36.109 TCP 2962 [TCP segment of a reassembled PDU]
 85   0.128071 172.31.36.109 -> 54.192.29.221 TCP 66 57975 > http [ACK] Seq=97 Ack=268401 Win=373632 Len=0 TSval=22285374 TSecr=718923696
 86   0.128203 54.192.29.221 -> 172.31.36.109 TCP 10202 [TCP segment of a reassembled PDU]
 87   0.128220 172.31.36.109 -> 54.192.29.221 TCP 66 57975 > http [ACK] Seq=97 Ack=278537 Win=363520 Len=0 TSval=22285374 TSecr=718923696
 88   0.128313 54.192.29.221 -> 172.31.36.109 TCP 2962 [TCP segment of a reassembled PDU]
 89   0.128319 172.31.36.109 -> 54.192.29.221 TCP 66 57975 > http [ACK] Seq=97 Ack=281433 Win=373632 Len=0 TSval=22285374 TSecr=718923696
 90   0.128444 54.192.29.221 -> 172.31.36.109 TCP 8754 [TCP segment of a reassembled PDU]
 91   0.128452 172.31.36.109 -> 54.192.29.221 TCP 66 57975 > http [ACK] Seq=97 Ack=290121 Win=365056 Len=0 TSval=22285374 TSecr=718923696
 92   0.128837 54.192.29.221 -> 172.31.36.109 TCP 1514 [TCP segment of a reassembled PDU]
 93   0.128847 172.31.36.109 -> 54.192.29.221 TCP 66 57975 > http [ACK] Seq=97 Ack=291569 Win=376064 Len=0 TSval=22285374 TSecr=718923696
 94   0.128966 54.192.29.221 -> 172.31.36.109 TCP 11650 [TCP segment of a reassembled PDU]
 95   0.128983 172.31.36.109 -> 54.192.29.221 TCP 66 57975 > http [ACK] Seq=97 Ack=303153 Win=377088 Len=0 TSval=22285374 TSecr=718923696
 96   0.129391 54.192.29.221 -> 172.31.36.109 TCP 7306 [TCP segment of a reassembled PDU]
 97   0.129428 172.31.36.109 -> 54.192.29.221 TCP 66 57975 > http [ACK] Seq=97 Ack=310393 Win=377088 Len=0 TSval=22285374 TSecr=718923696
 98   0.129584 54.192.29.221 -> 172.31.36.109 TCP 1514 [TCP segment of a reassembled PDU]
 99   0.129700 54.192.29.221 -> 172.31.36.109 TCP 7306 [TCP segment of a reassembled PDU]
100   0.129717 172.31.36.109 -> 54.192.29.221 TCP 66 57975 > http [ACK] Seq=97 Ack=319081 Win=377088 Len=0 TSval=22285374 TSecr=718923696
101   0.129956 54.192.29.221 -> 172.31.36.109 TCP 11650 [TCP segment of a reassembled PDU]
102   0.129975 172.31.36.109 -> 54.192.29.221 TCP 66 57975 > http [ACK] Seq=97 Ack=330665 Win=377088 Len=0 TSval=22285374 TSecr=718923696
103   0.130453 54.192.29.221 -> 172.31.36.109 TCP 1514 [TCP segment of a reassembled PDU]
104   0.130626 54.192.29.221 -> 172.31.36.109 TCP 4410 [TCP segment of a reassembled PDU]
105   0.130661 172.31.36.109 -> 54.192.29.221 TCP 66 57975 > http [ACK] Seq=97 Ack=336457 Win=377088 Len=0 TSval=22285374 TSecr=718923696
106   0.130739 54.192.29.221 -> 172.31.36.109 TCP 13098 [TCP segment of a reassembled PDU]
107   0.130760 172.31.36.109 -> 54.192.29.221 TCP 66 57975 > http [ACK] Seq=97 Ack=349489 Win=377088 Len=0 TSval=22285375 TSecr=718923696
108   0.130938 54.192.29.221 -> 172.31.36.109 TCP 17442 [TCP segment of a reassembled PDU]
109   0.130948 172.31.36.109 -> 54.192.29.221 TCP 66 57975 > http [ACK] Seq=97 Ack=366865 Win=411904 Len=0 TSval=22285375 TSecr=718923696
110   0.130998 54.192.29.221 -> 172.31.36.109 TCP 1514 [TCP segment of a reassembled PDU]
111   0.131003 172.31.36.109 -> 54.192.29.221 TCP 66 57975 > http [ACK] Seq=97 Ack=368313 Win=414720 Len=0 TSval=22285375 TSecr=718923696
112   0.131916 54.192.29.221 -> 172.31.36.109 TCP 2962 [TCP segment of a reassembled PDU]
113   0.131921 172.31.36.109 -> 54.192.29.221 TCP 66 57975 > http [ACK] Seq=97 Ack=371209 Win=420608 Len=0 TSval=22285375 TSecr=718923697
114   0.132099 54.192.29.221 -> 172.31.36.109 TCP 17442 [TCP segment of a reassembled PDU]
115   0.132107 172.31.36.109 -> 54.192.29.221 TCP 66 57975 > http [ACK] Seq=97 Ack=388585 Win=455296 Len=0 TSval=22285375 TSecr=718923697
116   0.132118 54.192.29.221 -> 172.31.36.109 TCP 5858 [TCP segment of a reassembled PDU]
117   0.132122 172.31.36.109 -> 54.192.29.221 TCP 66 57975 > http [ACK] Seq=97 Ack=394377 Win=466944 Len=0 TSval=22285375 TSecr=718923697
118   0.132235 54.192.29.221 -> 172.31.36.109 TCP 1514 [TCP segment of a reassembled PDU]
119   0.132241 172.31.36.109 -> 54.192.29.221 TCP 66 57975 > http [ACK] Seq=97 Ack=395825 Win=469760 Len=0 TSval=22285375 TSecr=718923697
120   0.132255 54.192.29.221 -> 172.31.36.109 TCP 13098 [TCP segment of a reassembled PDU]
121   0.132262 172.31.36.109 -> 54.192.29.221 TCP 66 57975 > http [ACK] Seq=97 Ack=408857 Win=495872 Len=0 TSval=22285375 TSecr=718923697
122   0.132318 54.192.29.221 -> 172.31.36.109 TCP 13098 [TCP segment of a reassembled PDU]
123   0.132330 172.31.36.109 -> 54.192.29.221 TCP 66 57975 > http [ACK] Seq=97 Ack=421889 Win=521984 Len=0 TSval=22285375 TSecr=718923697
124   0.133463 54.192.29.221 -> 172.31.36.109 TCP 4410 [TCP segment of a reassembled PDU]
125   0.133469 172.31.36.109 -> 54.192.29.221 TCP 66 57975 > http [ACK] Seq=97 Ack=426233 Win=530560 Len=0 TSval=22285375 TSecr=718923697
126   0.133613 54.192.29.221 -> 172.31.36.109 TCP 1514 [TCP segment of a reassembled PDU]
127   0.133617 172.31.36.109 -> 54.192.29.221 TCP 66 57975 > http [ACK] Seq=97 Ack=427681 Win=533504 Len=0 TSval=22285375 TSecr=718923697
128   0.133621 54.192.29.221 -> 172.31.36.109 TCP 1514 [TCP Previous segment not captured] [TCP segment of a reassembled PDU]
129   0.133624 172.31.36.109 -> 54.192.29.221 TCP 78 [TCP Window Update] 57975 > http [ACK] Seq=97 Ack=427681 Win=536448 Len=0 TSval=22285375 TSecr=718923697 SLE=429129 SRE=430577
130   0.133625 54.192.29.221 -> 172.31.36.109 TCP 1514 [TCP Out-Of-Order] [TCP segment of a reassembled PDU]
131   0.133628 172.31.36.109 -> 54.192.29.221 TCP 66 57975 > http [ACK] Seq=97 Ack=430577 Win=539264 Len=0 TSval=22285375 TSecr=718923697
132   0.133639 54.192.29.221 -> 172.31.36.109 TCP 17442 [TCP segment of a reassembled PDU]
133   0.133647 172.31.36.109 -> 54.192.29.221 TCP 66 57975 > http [ACK] Seq=97 Ack=447953 Win=574080 Len=0 TSval=22285375 TSecr=718923697
134   0.133887 54.192.29.221 -> 172.31.36.109 TCP 31922 [TCP segment of a reassembled PDU]
135   0.133902 172.31.36.109 -> 54.192.29.221 TCP 66 57975 > http [ACK] Seq=97 Ack=479809 Win=637824 Len=0 TSval=22285375 TSecr=718923697
136   0.134012 54.192.29.221 -> 172.31.36.109 TCP 7306 [TCP segment of a reassembled PDU]
137   0.134038 172.31.36.109 -> 54.192.29.221 TCP 66 57975 > http [ACK] Seq=97 Ack=487049 Win=652288 Len=0 TSval=22285375 TSecr=718923697
138   0.134973 54.192.29.221 -> 172.31.36.109 TCP 4410 [TCP segment of a reassembled PDU]
139   0.134978 172.31.36.109 -> 54.192.29.221 TCP 66 57975 > http [ACK] Seq=97 Ack=491393 Win=660992 Len=0 TSval=22285376 TSecr=718923697
140   0.135171 54.192.29.221 -> 172.31.36.109 TCP 18890 [TCP segment of a reassembled PDU]
141   0.135181 172.31.36.109 -> 54.192.29.221 TCP 66 57975 > http [ACK] Seq=97 Ack=510217 Win=671872 Len=0 TSval=22285376 TSecr=718923697
142   0.135233 54.192.29.221 -> 172.31.36.109 TCP 7306 [TCP segment of a reassembled PDU]
143   0.135239 172.31.36.109 -> 54.192.29.221 TCP 66 57975 > http [ACK] Seq=97 Ack=517457 Win=690944 Len=0 TSval=22285376 TSecr=718923697
144   0.135387 54.192.29.221 -> 172.31.36.109 TCP 26130 [TCP segment of a reassembled PDU]
145   0.135399 172.31.36.109 -> 54.192.29.221 TCP 66 57975 > http [ACK] Seq=97 Ack=543521 Win=664960 Len=0 TSval=22285376 TSecr=718923697
146   0.135524 54.192.29.221 -> 172.31.36.109 TCP 11650 [TCP segment of a reassembled PDU]
147   0.135544 172.31.36.109 -> 54.192.29.221 TCP 66 57975 > http [ACK] Seq=97 Ack=555105 Win=683776 Len=0 TSval=22285376 TSecr=718923697
148   0.136544 54.192.29.221 -> 172.31.36.109 TCP 5858 [TCP segment of a reassembled PDU]
149   0.136569 172.31.36.109 -> 54.192.29.221 TCP 66 57975 > http [ACK] Seq=97 Ack=560897 Win=693248 Len=0 TSval=22285376 TSecr=718923697
150   0.136749 54.192.29.221 -> 172.31.36.109 TCP 20338 [TCP segment of a reassembled PDU]
151   0.136759 172.31.36.109 -> 54.192.29.221 TCP 66 57975 > http [ACK] Seq=97 Ack=581169 Win=673024 Len=0 TSval=22285376 TSecr=718923697
152   0.136767 54.192.29.221 -> 172.31.36.109 TCP 2962 [TCP segment of a reassembled PDU]
153   0.136769 172.31.36.109 -> 54.192.29.221 TCP 66 57975 > http [ACK] Seq=97 Ack=584065 Win=670208 Len=0 TSval=22285376 TSecr=718923697
154   0.136950 54.192.29.221 -> 172.31.36.109 TCP 7306 [TCP segment of a reassembled PDU]
155   0.136976 172.31.36.109 -> 54.192.29.221 TCP 66 57975 > http [ACK] Seq=97 Ack=591305 Win=690944 Len=0 TSval=22285376 TSecr=718923697
156   0.136992 54.192.29.221 -> 172.31.36.109 TCP 18890 [TCP segment of a reassembled PDU]
157   0.137004 172.31.36.109 -> 54.192.29.221 TCP 66 57975 > http [ACK] Seq=97 Ack=610129 Win=672128 Len=0 TSval=22285376 TSecr=718923697
158   0.137162 54.192.29.221 -> 172.31.36.109 TCP 7306 [TCP segment of a reassembled PDU]
159   0.137188 172.31.36.109 -> 54.192.29.221 TCP 66 57975 > http [ACK] Seq=97 Ack=617369 Win=690944 Len=0 TSval=22285376 TSecr=718923697
160   0.138054 54.192.29.221 -> 172.31.36.109 TCP 5858 [TCP segment of a reassembled PDU]
161   0.138060 172.31.36.109 -> 54.192.29.221 TCP 66 57975 > http [ACK] Seq=97 Ack=623161 Win=693248 Len=0 TSval=22285376 TSecr=718923697
162   0.138212 54.192.29.221 -> 172.31.36.109 TCP 23234 [TCP segment of a reassembled PDU]
163   0.138224 172.31.36.109 -> 54.192.29.221 TCP 66 57975 > http [ACK] Seq=97 Ack=646329 Win=670080 Len=0 TSval=22285376 TSecr=718923697
164   0.138331 54.192.29.221 -> 172.31.36.109 TCP 13098 [TCP segment of a reassembled PDU]
165   0.138342 172.31.36.109 -> 54.192.29.221 TCP 66 57975 > http [ACK] Seq=97 Ack=659361 Win=681472 Len=0 TSval=22285376 TSecr=718923697
166   0.138475 54.192.29.221 -> 172.31.36.109 TCP 11650 [TCP segment of a reassembled PDU]
167   0.138483 172.31.36.109 -> 54.192.29.221 TCP 66 57975 > http [ACK] Seq=97 Ack=670945 Win=683776 Len=0 TSval=22285376 TSecr=718923697
168   0.138704 54.192.29.221 -> 172.31.36.109 TCP 21786 [TCP segment of a reassembled PDU]
169   0.138715 172.31.36.109 -> 54.192.29.221 TCP 66 57975 > http [ACK] Seq=97 Ack=692665 Win=667136 Len=0 TSval=22285376 TSecr=718923697
170   0.139582 54.192.29.221 -> 172.31.36.109 TCP 4410 [TCP segment of a reassembled PDU]
171   0.139587 172.31.36.109 -> 54.192.29.221 TCP 66 57975 > http [ACK] Seq=97 Ack=697009 Win=707328 Len=0 TSval=22285377 TSecr=718923697
172   0.139788 54.192.29.221 -> 172.31.36.109 TCP 21786 [TCP segment of a reassembled PDU]
173   0.139799 172.31.36.109 -> 54.192.29.221 TCP 66 57975 > http [ACK] Seq=97 Ack=718729 Win=750720 Len=0 TSval=22285377 TSecr=718923697
174   0.139860 54.192.29.221 -> 172.31.36.109 TCP 5858 [TCP segment of a reassembled PDU]
175   0.139866 172.31.36.109 -> 54.192.29.221 TCP 66 57975 > http [ACK] Seq=97 Ack=724521 Win=762240 Len=0 TSval=22285377 TSecr=718923697
176   0.140038 54.192.29.221 -> 172.31.36.109 TCP 27578 [TCP segment of a reassembled PDU]
177   0.140052 172.31.36.109 -> 54.192.29.221 TCP 66 57975 > http [ACK] Seq=97 Ack=752033 Win=756608 Len=0 TSval=22285377 TSecr=718923697
178   0.140100 54.192.29.221 -> 172.31.36.109 TCP 7306 [TCP segment of a reassembled PDU]
179   0.140106 172.31.36.109 -> 54.192.29.221 TCP 66 57975 > http [ACK] Seq=97 Ack=759273 Win=776832 Len=0 TSval=22285377 TSecr=718923697
180   0.140204 54.192.29.221 -> 172.31.36.109 TCP 1514 [TCP segment of a reassembled PDU]
181   0.140208 172.31.36.109 -> 54.192.29.221 TCP 66 57975 > http [ACK] Seq=97 Ack=760721 Win=779648 Len=0 TSval=22285377 TSecr=718923697
182   0.140955 54.192.29.221 -> 172.31.36.109 TCP 2962 [TCP segment of a reassembled PDU]
183   0.140961 172.31.36.109 -> 54.192.29.221 TCP 66 57975 > http [ACK] Seq=97 Ack=763617 Win=785408 Len=0 TSval=22285377 TSecr=718923697
184   0.141089 54.192.29.221 -> 172.31.36.109 TCP 17442 [TCP segment of a reassembled PDU]
185   0.141110 172.31.36.109 -> 54.192.29.221 TCP 66 57975 > http [ACK] Seq=97 Ack=780993 Win=773376 Len=0 TSval=22285377 TSecr=718923697
186   0.141174 54.192.29.221 -> 172.31.36.109 TCP 8754 [TCP segment of a reassembled PDU]
187   0.141180 172.31.36.109 -> 54.192.29.221 TCP 66 57975 > http [ACK] Seq=97 Ack=789681 Win=787712 Len=0 TSval=22285377 TSecr=718923697
188   0.141218 54.192.29.221 -> 172.31.36.109 TCP 17442 [TCP segment of a reassembled PDU]
189   0.141237 172.31.36.109 -> 54.192.29.221 TCP 66 57975 > http [ACK] Seq=97 Ack=807057 Win=773376 Len=0 TSval=22285377 TSecr=718923697
190   0.141461 54.192.29.221 -> 172.31.36.109 TCP 2962 [TCP segment of a reassembled PDU]
191   0.141466 172.31.36.109 -> 54.192.29.221 TCP 66 57975 > http [ACK] Seq=97 Ack=809953 Win=797184 Len=0 TSval=22285377 TSecr=718923697
192   0.141617 54.192.29.221 -> 172.31.36.109 TCP 10202 [TCP segment of a reassembled PDU]
193   0.141632 54.192.29.221 -> 172.31.36.109 TCP 13098 [TCP segment of a reassembled PDU]
194   0.141649 172.31.36.109 -> 54.192.29.221 TCP 66 57975 > http [ACK] Seq=97 Ack=833121 Win=780544 Len=0 TSval=22285377 TSecr=718923697
195   0.141714 54.192.29.221 -> 172.31.36.109 TCP 18890 [TCP segment of a reassembled PDU]
196   0.141735 172.31.36.109 -> 54.192.29.221 TCP 66 57975 > http [ACK] Seq=97 Ack=851945 Win=770944 Len=0 TSval=22285377 TSecr=718923698
197   0.142468 54.192.29.221 -> 172.31.36.109 TCP 4410 [TCP segment of a reassembled PDU]
198   0.142473 172.31.36.109 -> 54.192.29.221 TCP 66 57975 > http [ACK] Seq=97 Ack=856289 Win=794752 Len=0 TSval=22285377 TSecr=718923698
199   0.142640 54.192.29.221 -> 172.31.36.109 TCP 27578 [TCP segment of a reassembled PDU]
200   0.142693 54.192.29.221 -> 172.31.36.109 TCP 4410 [TCP segment of a reassembled PDU]
201   0.142700 172.31.36.109 -> 54.192.29.221 TCP 66 57975 > http [ACK] Seq=97 Ack=883801 Win=767360 Len=0 TSval=22285377 TSecr=718923698
202   0.142715 172.31.36.109 -> 54.192.29.221 TCP 66 57975 > http [ACK] Seq=97 Ack=888145 Win=802048 Len=0 TSval=22285377 TSecr=718923698
203   0.142850 54.192.29.221 -> 172.31.36.109 TCP 24682 [TCP segment of a reassembled PDU]
204   0.142874 172.31.36.109 -> 54.192.29.221 TCP 66 57975 > http [ACK] Seq=97 Ack=912761 Win=777472 Len=0 TSval=22285378 TSecr=718923698
205   0.142959 54.192.29.221 -> 172.31.36.109 TCP 7306 [TCP segment of a reassembled PDU]
206   0.142965 172.31.36.109 -> 54.192.29.221 TCP 66 57975 > http [ACK] Seq=97 Ack=920001 Win=790016 Len=0 TSval=22285378 TSecr=718923698
207   0.143108 54.192.29.221 -> 172.31.36.109 TCP 18890 [TCP segment of a reassembled PDU]
208   0.143129 172.31.36.109 -> 54.192.29.221 TCP 66 57975 > http [ACK] Seq=97 Ack=938825 Win=771200 Len=0 TSval=22285378 TSecr=718923698
209   0.143215 54.192.29.221 -> 172.31.36.109 TCP 7306 [TCP segment of a reassembled PDU]
210   0.143222 172.31.36.109 -> 54.192.29.221 TCP 66 57975 > http [ACK] Seq=97 Ack=946065 Win=790016 Len=0 TSval=22285378 TSecr=718923698
211   0.143350 54.192.29.221 -> 172.31.36.109 TCP 15994 [TCP segment of a reassembled PDU]
212   0.143370 172.31.36.109 -> 54.192.29.221 TCP 66 57975 > http [ACK] Seq=97 Ack=961993 Win=802048 Len=0 TSval=22285378 TSecr=718923698
213   0.144003 54.192.29.221 -> 172.31.36.109 TCP 4410 [TCP segment of a reassembled PDU]
214   0.144021 172.31.36.109 -> 54.192.29.221 TCP 66 57975 > http [ACK] Seq=97 Ack=966337 Win=802048 Len=0 TSval=22285378 TSecr=718923698
215   0.144165 54.192.29.221 -> 172.31.36.109 TCP 15994 [TCP segment of a reassembled PDU]
216   0.144180 54.192.29.221 -> 172.31.36.109 TCP 5858 [TCP segment of a reassembled PDU]
217   0.144196 172.31.36.109 -> 54.192.29.221 TCP 66 57975 > http [ACK] Seq=97 Ack=988057 Win=792448 Len=0 TSval=22285378 TSecr=718923698
218   0.144249 54.192.29.221 -> 172.31.36.109 TCP 2962 [TCP segment of a reassembled PDU]
219   0.144253 172.31.36.109 -> 54.192.29.221 TCP 66 57975 > http [ACK] Seq=97 Ack=990953 Win=797184 Len=0 TSval=22285378 TSecr=718923698
220   0.144429 54.192.29.221 -> 172.31.36.109 TCP 26130 [TCP segment of a reassembled PDU]
221   0.144452 172.31.36.109 -> 54.192.29.221 TCP 66 57975 > http [ACK] Seq=97 Ack=1017017 Win=771200 Len=0 TSval=22285378 TSecr=718923698
222   0.144740 54.192.29.221 -> 172.31.36.109 TCP 30474 [TCP segment of a reassembled PDU]
223   0.144764 172.31.36.109 -> 54.192.29.221 TCP 66 57975 > http [ACK] Seq=97 Ack=1047425 Win=751872 Len=0 TSval=22285378 TSecr=718923698
224   0.145247 54.192.29.221 -> 172.31.36.109 HTTP 1674 HTTP/1.1 200 OK  (application/octet-stream)
225   0.145251 172.31.36.109 -> 54.192.29.221 TCP 66 57975 > http [ACK] Seq=97 Ack=1049033 Win=797184 Len=0 TSval=22285378 TSecr=718923698
226   0.145376 172.31.36.109 -> 54.192.29.221 TCP 66 57975 > http [FIN, ACK] Seq=97 Ack=1049033 Win=802048 Len=0 TSval=22285378 TSecr=718923698
227   0.146757 54.192.29.221 -> 172.31.36.109 TCP 66 http > 57975 [FIN, ACK] Seq=1049033 Ack=98 Win=14592 Len=0 TSval=718923698 TSecr=22285378
228   0.146773 172.31.36.109 -> 54.192.29.221 TCP 66 57975 > http [ACK] Seq=98 Ack=1049034 Win=802048 Len=0 TSval=22285379 TSecr=718923698
