[Measurement for 1mb at 04:30:53 20.30.2014] 
Tshark:

  1   0.000000 172.31.36.109 -> 172.31.0.2   DNS 89 Standard query 0x2cc4  A d3796nkzln59xv.cloudfront.net
  2   0.000024 172.31.36.109 -> 172.31.0.2   DNS 89 Standard query 0x5f79  AAAA d3796nkzln59xv.cloudfront.net
  3   0.000553   172.31.0.2 -> 172.31.36.109 DNS 170 Standard query response 0x5f79 
  4   0.000563   172.31.0.2 -> 172.31.36.109 DNS 217 Standard query response 0x2cc4  A 54.230.30.202 A 54.230.30.218 A 54.192.29.221 A 54.192.30.214 A 54.230.30.3 A 54.230.30.50 A 54.230.30.72 A 54.230.30.73
  5   0.003858 172.31.36.109 -> 54.230.30.202 TCP 74 53964 > http [SYN] Seq=0 Win=26883 Len=0 MSS=8961 SACK_PERM=1 TSval=30385061 TSecr=0 WS=128
  6   0.005169 54.230.30.202 -> 172.31.36.109 TCP 74 http > 53964 [SYN, ACK] Seq=0 Ack=1 Win=14480 Len=0 MSS=1460 SACK_PERM=1 TSval=624048419 TSecr=30385061 WS=128
  7   0.005183 172.31.36.109 -> 54.230.30.202 TCP 66 53964 > http [ACK] Seq=1 Ack=1 Win=27008 Len=0 TSval=30385061 TSecr=624048419
  8   0.005221 172.31.36.109 -> 54.230.30.202 HTTP 162 GET /1mb HTTP/1.1 
  9   0.006710 54.230.30.202 -> 172.31.36.109 TCP 66 http > 53964 [ACK] Seq=1 Ack=97 Win=14592 Len=0 TSval=624048419 TSecr=30385061
 10   0.015757 54.230.30.202 -> 172.31.36.109 TCP 13098 [TCP segment of a reassembled PDU]
 11   0.015769 172.31.36.109 -> 54.230.30.202 TCP 66 53964 > http [ACK] Seq=97 Ack=13033 Win=52992 Len=0 TSval=30385064 TSecr=624048420
 12   0.017272 54.230.30.202 -> 172.31.36.109 TCP 13098 [TCP segment of a reassembled PDU]
 13   0.017282 172.31.36.109 -> 54.230.30.202 TCP 66 53964 > http [ACK] Seq=97 Ack=26065 Win=79104 Len=0 TSval=30385064 TSecr=624048420
 14   0.018944 54.230.30.202 -> 172.31.36.109 TCP 13098 [TCP segment of a reassembled PDU]
 15   0.018954 172.31.36.109 -> 54.230.30.202 TCP 66 53964 > http [ACK] Seq=97 Ack=39097 Win=96512 Len=0 TSval=30385065 TSecr=624048421
 16   0.020355 54.230.30.202 -> 172.31.36.109 TCP 13098 [TCP segment of a reassembled PDU]
 17   0.020363 172.31.36.109 -> 54.230.30.202 TCP 66 53964 > http [ACK] Seq=97 Ack=52129 Win=96512 Len=0 TSval=30385065 TSecr=624048421
 18   0.021857 54.230.30.202 -> 172.31.36.109 TCP 5858 [TCP segment of a reassembled PDU]
 19   0.021863 172.31.36.109 -> 54.230.30.202 TCP 66 53964 > http [ACK] Seq=97 Ack=57921 Win=116736 Len=0 TSval=30385066 TSecr=624048421
 20   0.021919 54.230.30.202 -> 172.31.36.109 TCP 11650 [TCP segment of a reassembled PDU]
 21   0.021927 172.31.36.109 -> 54.230.30.202 TCP 66 53964 > http [ACK] Seq=97 Ack=69505 Win=139904 Len=0 TSval=30385066 TSecr=624048421
 22   0.022079 54.230.30.202 -> 172.31.36.109 TCP 2962 [TCP segment of a reassembled PDU]
 23   0.022084 172.31.36.109 -> 54.230.30.202 TCP 66 53964 > http [ACK] Seq=97 Ack=72401 Win=145664 Len=0 TSval=30385066 TSecr=624048421
 24   0.023367 54.230.30.202 -> 172.31.36.109 TCP 4410 [TCP segment of a reassembled PDU]
 25   0.023373 172.31.36.109 -> 54.230.30.202 TCP 66 53964 > http [ACK] Seq=97 Ack=76745 Win=154368 Len=0 TSval=30385066 TSecr=624048421
 26   0.023471 54.230.30.202 -> 172.31.36.109 TCP 15994 [TCP segment of a reassembled PDU]
 27   0.023482 172.31.36.109 -> 54.230.30.202 TCP 66 53964 > http [ACK] Seq=97 Ack=92673 Win=186240 Len=0 TSval=30385066 TSecr=624048421
 28   0.024934 54.230.30.202 -> 172.31.36.109 TCP 7306 [TCP segment of a reassembled PDU]
 29   0.024940 172.31.36.109 -> 54.230.30.202 TCP 66 53964 > http [ACK] Seq=97 Ack=99913 Win=200704 Len=0 TSval=30385066 TSecr=624048421
 30   0.025030 54.230.30.202 -> 172.31.36.109 TCP 11650 [TCP segment of a reassembled PDU]
 31   0.025038 172.31.36.109 -> 54.230.30.202 TCP 66 53964 > http [ACK] Seq=97 Ack=111497 Win=223872 Len=0 TSval=30385066 TSecr=624048421
 32   0.025111 54.230.30.202 -> 172.31.36.109 TCP 5858 [TCP segment of a reassembled PDU]
 33   0.025117 172.31.36.109 -> 54.230.30.202 TCP 66 53964 > http [ACK] Seq=97 Ack=117289 Win=235520 Len=0 TSval=30385066 TSecr=624048421
 34   0.025210 54.230.30.202 -> 172.31.36.109 TCP 2962 [TCP segment of a reassembled PDU]
 35   0.025215 172.31.36.109 -> 54.230.30.202 TCP 66 53964 > http [ACK] Seq=97 Ack=120185 Win=241280 Len=0 TSval=30385066 TSecr=624048421
 36   0.026448 54.230.30.202 -> 172.31.36.109 TCP 8754 [TCP segment of a reassembled PDU]
 37   0.026455 172.31.36.109 -> 54.230.30.202 TCP 66 53964 > http [ACK] Seq=97 Ack=128873 Win=258688 Len=0 TSval=30385067 TSecr=624048421
 38   0.026524 54.230.30.202 -> 172.31.36.109 TCP 2035 [TCP segment of a reassembled PDU]
 39   0.026529 172.31.36.109 -> 54.230.30.202 TCP 66 53964 > http [ACK] Seq=97 Ack=130842 Win=262528 Len=0 TSval=30385067 TSecr=624048421
 40   0.051099 54.230.30.202 -> 172.31.36.109 TCP 1514 [TCP segment of a reassembled PDU]
 41   0.051106 172.31.36.109 -> 54.230.30.202 TCP 66 53964 > http [ACK] Seq=97 Ack=132290 Win=265472 Len=0 TSval=30385073 TSecr=624048424
 42   0.051118 54.230.30.202 -> 172.31.36.109 TCP 7306 [TCP segment of a reassembled PDU]
 43   0.051123 172.31.36.109 -> 54.230.30.202 TCP 66 53964 > http [ACK] Seq=97 Ack=139530 Win=279936 Len=0 TSval=30385073 TSecr=624048424
 44   0.051397 54.230.30.202 -> 172.31.36.109 TCP 1514 [TCP segment of a reassembled PDU]
 45   0.051402 172.31.36.109 -> 54.230.30.202 TCP 66 53964 > http [ACK] Seq=97 Ack=140978 Win=282880 Len=0 TSval=30385073 TSecr=624048424
 46   0.051411 54.230.30.202 -> 172.31.36.109 TCP 8754 [TCP segment of a reassembled PDU]
 47   0.051416 172.31.36.109 -> 54.230.30.202 TCP 66 53964 > http [ACK] Seq=97 Ack=149666 Win=300160 Len=0 TSval=30385073 TSecr=624048424
 48   0.051422 54.230.30.202 -> 172.31.36.109 TCP 1514 [TCP segment of a reassembled PDU]
 49   0.051424 172.31.36.109 -> 54.230.30.202 TCP 66 53964 > http [ACK] Seq=97 Ack=151114 Win=303104 Len=0 TSval=30385073 TSecr=624048424
 50   0.051618 54.230.30.202 -> 172.31.36.109 TCP 10202 [TCP segment of a reassembled PDU]
 51   0.051625 172.31.36.109 -> 54.230.30.202 TCP 66 53964 > http [ACK] Seq=97 Ack=161250 Win=323328 Len=0 TSval=30385073 TSecr=624048424
 52   0.052562 54.230.30.202 -> 172.31.36.109 TCP 10202 [TCP segment of a reassembled PDU]
 53   0.052570 172.31.36.109 -> 54.230.30.202 TCP 66 53964 > http [ACK] Seq=97 Ack=171386 Win=343680 Len=0 TSval=30385073 TSecr=624048424
 54   0.052640 54.230.30.202 -> 172.31.36.109 TCP 1514 [TCP segment of a reassembled PDU]
 55   0.052644 172.31.36.109 -> 54.230.30.202 TCP 66 53964 > http [ACK] Seq=97 Ack=172834 Win=346496 Len=0 TSval=30385073 TSecr=624048424
 56   0.052888 54.230.30.202 -> 172.31.36.109 TCP 13098 [TCP segment of a reassembled PDU]
 57   0.052896 172.31.36.109 -> 54.230.30.202 TCP 66 53964 > http [ACK] Seq=97 Ack=185866 Win=372608 Len=0 TSval=30385073 TSecr=624048424
 58   0.053109 54.230.30.202 -> 172.31.36.109 TCP 14546 [TCP segment of a reassembled PDU]
 59   0.053118 172.31.36.109 -> 54.230.30.202 TCP 66 53964 > http [ACK] Seq=97 Ack=200346 Win=401536 Len=0 TSval=30385073 TSecr=624048424
 60   0.054080 54.230.30.202 -> 172.31.36.109 TCP 5858 [TCP segment of a reassembled PDU]
 61   0.054086 172.31.36.109 -> 54.230.30.202 TCP 66 53964 > http [ACK] Seq=97 Ack=206138 Win=413184 Len=0 TSval=30385074 TSecr=624048424
 62   0.054192 54.230.30.202 -> 172.31.36.109 TCP 8754 [TCP segment of a reassembled PDU]
 63   0.054199 172.31.36.109 -> 54.230.30.202 TCP 66 53964 > http [ACK] Seq=97 Ack=214826 Win=430592 Len=0 TSval=30385074 TSecr=624048424
 64   0.054410 54.230.30.202 -> 172.31.36.109 TCP 14546 [TCP segment of a reassembled PDU]
 65   0.054419 172.31.36.109 -> 54.230.30.202 TCP 66 53964 > http [ACK] Seq=97 Ack=229306 Win=459520 Len=0 TSval=30385074 TSecr=624048424
 66   0.054625 54.230.30.202 -> 172.31.36.109 TCP 8754 [TCP segment of a reassembled PDU]
 67   0.054632 172.31.36.109 -> 54.230.30.202 TCP 66 53964 > http [ACK] Seq=97 Ack=237994 Win=476928 Len=0 TSval=30385074 TSecr=624048424
 68   0.055615 54.230.30.202 -> 172.31.36.109 TCP 5858 [TCP segment of a reassembled PDU]
 69   0.055621 172.31.36.109 -> 54.230.30.202 TCP 66 53964 > http [ACK] Seq=97 Ack=243786 Win=488448 Len=0 TSval=30385074 TSecr=624048424
 70   0.055739 54.230.30.202 -> 172.31.36.109 TCP 10202 [TCP segment of a reassembled PDU]
 71   0.055747 172.31.36.109 -> 54.230.30.202 TCP 66 53964 > http [ACK] Seq=97 Ack=253922 Win=508672 Len=0 TSval=30385074 TSecr=624048424
 72   0.055961 54.230.30.202 -> 172.31.36.109 TCP 8754 [TCP segment of a reassembled PDU]
 73   0.055967 172.31.36.109 -> 54.230.30.202 TCP 66 53964 > http [ACK] Seq=97 Ack=262610 Win=526080 Len=0 TSval=30385074 TSecr=624048424
 74   0.056214 54.230.30.202 -> 172.31.36.109 TCP 15994 [TCP segment of a reassembled PDU]
 75   0.056225 172.31.36.109 -> 54.230.30.202 TCP 66 53964 > http [ACK] Seq=97 Ack=278538 Win=550400 Len=0 TSval=30385074 TSecr=624048424
 76   0.056441 54.230.30.202 -> 172.31.36.109 TCP 10202 [TCP segment of a reassembled PDU]
 77   0.056448 172.31.36.109 -> 54.230.30.202 TCP 66 53964 > http [ACK] Seq=97 Ack=288674 Win=578176 Len=0 TSval=30385074 TSecr=624048424
 78   0.057149 54.230.30.202 -> 172.31.36.109 TCP 5858 [TCP segment of a reassembled PDU]
 79   0.057155 172.31.36.109 -> 54.230.30.202 TCP 66 53964 > http [ACK] Seq=97 Ack=294466 Win=589824 Len=0 TSval=30385074 TSecr=624048424
 80   0.057279 54.230.30.202 -> 172.31.36.109 TCP 8754 [TCP segment of a reassembled PDU]
 81   0.057285 172.31.36.109 -> 54.230.30.202 TCP 66 53964 > http [ACK] Seq=97 Ack=303154 Win=607232 Len=0 TSval=30385074 TSecr=624048424
 82   0.057499 54.230.30.202 -> 172.31.36.109 TCP 1514 [TCP segment of a reassembled PDU]
 83   0.057503 172.31.36.109 -> 54.230.30.202 TCP 66 53964 > http [ACK] Seq=97 Ack=304602 Win=610048 Len=0 TSval=30385074 TSecr=624048424
 84   0.057810 54.230.30.202 -> 172.31.36.109 TCP 29026 [TCP segment of a reassembled PDU]
 85   0.057824 172.31.36.109 -> 54.230.30.202 TCP 66 53964 > http [ACK] Seq=97 Ack=333562 Win=668032 Len=0 TSval=30385075 TSecr=624048424
 86   0.057924 54.230.30.202 -> 172.31.36.109 TCP 1514 [TCP segment of a reassembled PDU]
 87   0.057928 172.31.36.109 -> 54.230.30.202 TCP 66 53964 > http [ACK] Seq=97 Ack=335010 Win=670848 Len=0 TSval=30385075 TSecr=624048424
 88   0.058684 54.230.30.202 -> 172.31.36.109 TCP 4410 [TCP segment of a reassembled PDU]
 89   0.058689 172.31.36.109 -> 54.230.30.202 TCP 66 53964 > http [ACK] Seq=97 Ack=339354 Win=679552 Len=0 TSval=30385075 TSecr=624048425
 90   0.058786 54.230.30.202 -> 172.31.36.109 TCP 11650 [TCP segment of a reassembled PDU]
 91   0.058793 172.31.36.109 -> 54.230.30.202 TCP 66 53964 > http [ACK] Seq=97 Ack=350938 Win=702720 Len=0 TSval=30385075 TSecr=624048425
 92   0.058965 54.230.30.202 -> 172.31.36.109 TCP 13098 [TCP segment of a reassembled PDU]
 93   0.058973 172.31.36.109 -> 54.230.30.202 TCP 66 53964 > http [ACK] Seq=97 Ack=363970 Win=728832 Len=0 TSval=30385075 TSecr=624048425
 94   0.059267 54.230.30.202 -> 172.31.36.109 TCP 15994 [TCP segment of a reassembled PDU]
 95   0.059277 172.31.36.109 -> 54.230.30.202 TCP 66 53964 > http [ACK] Seq=97 Ack=379898 Win=760704 Len=0 TSval=30385075 TSecr=624048425
 96   0.059565 54.230.30.202 -> 172.31.36.109 TCP 17442 [TCP segment of a reassembled PDU]
 97   0.059575 172.31.36.109 -> 54.230.30.202 TCP 66 53964 > http [ACK] Seq=97 Ack=397274 Win=795392 Len=0 TSval=30385075 TSecr=624048425
 98   0.060348 54.230.30.202 -> 172.31.36.109 TCP 5858 [TCP segment of a reassembled PDU]
 99   0.060355 172.31.36.109 -> 54.230.30.202 TCP 66 53964 > http [ACK] Seq=97 Ack=403066 Win=807040 Len=0 TSval=30385075 TSecr=624048425
100   0.060527 54.230.30.202 -> 172.31.36.109 TCP 30474 [TCP segment of a reassembled PDU]
101   0.060542 172.31.36.109 -> 54.230.30.202 TCP 66 53964 > http [ACK] Seq=97 Ack=433474 Win=796928 Len=0 TSval=30385075 TSecr=624048425
102   0.060995 54.230.30.202 -> 172.31.36.109 TCP 2962 [TCP segment of a reassembled PDU]
103   0.061000 172.31.36.109 -> 54.230.30.202 TCP 66 53964 > http [ACK] Seq=97 Ack=436370 Win=812800 Len=0 TSval=30385075 TSecr=624048425
104   0.061120 54.230.30.202 -> 172.31.36.109 TCP 11650 [TCP segment of a reassembled PDU]
105   0.061128 172.31.36.109 -> 54.230.30.202 TCP 66 53964 > http [ACK] Seq=97 Ack=447954 Win=828032 Len=0 TSval=30385075 TSecr=624048425
106   0.061367 54.230.30.202 -> 172.31.36.109 TCP 21786 [TCP segment of a reassembled PDU]
107   0.061378 172.31.36.109 -> 54.230.30.202 TCP 66 53964 > http [ACK] Seq=97 Ack=469674 Win=811264 Len=0 TSval=30385075 TSecr=624048425
108   0.062048 54.230.30.202 -> 172.31.36.109 TCP 5858 [TCP segment of a reassembled PDU]
109   0.062054 172.31.36.109 -> 54.230.30.202 TCP 66 53964 > http [ACK] Seq=97 Ack=475466 Win=837504 Len=0 TSval=30385076 TSecr=624048425
110   0.062179 54.230.30.202 -> 172.31.36.109 TCP 11650 [TCP segment of a reassembled PDU]
111   0.062187 172.31.36.109 -> 54.230.30.202 TCP 66 53964 > http [ACK] Seq=97 Ack=487050 Win=828032 Len=0 TSval=30385076 TSecr=624048425
112   0.062298 54.230.30.202 -> 172.31.36.109 TCP 11650 [TCP segment of a reassembled PDU]
113   0.062306 172.31.36.109 -> 54.230.30.202 TCP 66 53964 > http [ACK] Seq=97 Ack=498634 Win=828032 Len=0 TSval=30385076 TSecr=624048425
114   0.062547 54.230.30.202 -> 172.31.36.109 TCP 5858 [TCP segment of a reassembled PDU]
115   0.062555 172.31.36.109 -> 54.230.30.202 TCP 66 53964 > http [ACK] Seq=97 Ack=504426 Win=837504 Len=0 TSval=30385076 TSecr=624048425
116   0.062696 54.230.30.202 -> 172.31.36.109 TCP 17442 [TCP segment of a reassembled PDU]
117   0.062717 172.31.36.109 -> 54.230.30.202 TCP 66 53964 > http [ACK] Seq=97 Ack=521802 Win=820224 Len=0 TSval=30385076 TSecr=624048425
118   0.062791 54.230.30.202 -> 172.31.36.109 TCP 4410 [TCP segment of a reassembled PDU]
119   0.062797 172.31.36.109 -> 54.230.30.202 TCP 66 53964 > http [ACK] Seq=97 Ack=526146 Win=839808 Len=0 TSval=30385076 TSecr=624048425
120   0.063625 54.230.30.202 -> 172.31.36.109 TCP 1514 [TCP segment of a reassembled PDU]
121   0.063804 54.230.30.202 -> 172.31.36.109 TCP 24682 [TCP segment of a reassembled PDU]
122   0.063828 172.31.36.109 -> 54.230.30.202 TCP 66 53964 > http [ACK] Seq=97 Ack=552210 Win=813824 Len=0 TSval=30385076 TSecr=624048425
123   0.063886 54.230.30.202 -> 172.31.36.109 TCP 11650 [TCP segment of a reassembled PDU]
124   0.063894 172.31.36.109 -> 54.230.30.202 TCP 66 53964 > http [ACK] Seq=97 Ack=563794 Win=828032 Len=0 TSval=30385076 TSecr=624048425
125   0.064114 54.230.30.202 -> 172.31.36.109 TCP 18890 [TCP segment of a reassembled PDU]
126   0.064136 172.31.36.109 -> 54.230.30.202 TCP 66 53964 > http [ACK] Seq=97 Ack=582618 Win=816000 Len=0 TSval=30385076 TSecr=624048425
127   0.064198 54.230.30.202 -> 172.31.36.109 TCP 1514 [TCP segment of a reassembled PDU]
128   0.064297 54.230.30.202 -> 172.31.36.109 TCP 1514 [TCP segment of a reassembled PDU]
129   0.064301 172.31.36.109 -> 54.230.30.202 TCP 66 53964 > http [ACK] Seq=97 Ack=585514 Win=842496 Len=0 TSval=30385076 TSecr=624048425
130   0.064452 54.230.30.202 -> 172.31.36.109 TCP 23234 [TCP segment of a reassembled PDU]
131   0.064475 172.31.36.109 -> 54.230.30.202 TCP 66 53964 > http [ACK] Seq=97 Ack=608682 Win=819328 Len=0 TSval=30385076 TSecr=624048425
132   0.065337 54.230.30.202 -> 172.31.36.109 TCP 4410 [TCP segment of a reassembled PDU]
133   0.065342 172.31.36.109 -> 54.230.30.202 TCP 66 53964 > http [ACK] Seq=97 Ack=613026 Win=839808 Len=0 TSval=30385076 TSecr=624048425
134   0.065454 54.230.30.202 -> 172.31.36.109 TCP 13098 [TCP segment of a reassembled PDU]
135   0.065474 172.31.36.109 -> 54.230.30.202 TCP 66 53964 > http [ACK] Seq=97 Ack=626058 Win=842496 Len=0 TSval=30385076 TSecr=624048425
136   0.065686 54.230.30.202 -> 172.31.36.109 TCP 17442 [TCP segment of a reassembled PDU]
137   0.065721 172.31.36.109 -> 54.230.30.202 TCP 66 53964 > http [ACK] Seq=97 Ack=643434 Win=825216 Len=0 TSval=30385076 TSecr=624048425
138   0.065803 54.230.30.202 -> 172.31.36.109 TCP 14546 [TCP segment of a reassembled PDU]
139   0.065825 172.31.36.109 -> 54.230.30.202 TCP 66 53964 > http [ACK] Seq=97 Ack=657914 Win=842496 Len=0 TSval=30385077 TSecr=624048425
140   0.065901 54.230.30.202 -> 172.31.36.109 TCP 17442 [TCP segment of a reassembled PDU]
141   0.065923 172.31.36.109 -> 54.230.30.202 TCP 66 53964 > http [ACK] Seq=97 Ack=675290 Win=825216 Len=0 TSval=30385077 TSecr=624048425
142   0.066218 54.230.30.202 -> 172.31.36.109 TCP 18890 [TCP segment of a reassembled PDU]
143   0.066239 172.31.36.109 -> 54.230.30.202 TCP 66 53964 > http [ACK] Seq=97 Ack=694114 Win=816000 Len=0 TSval=30385077 TSecr=624048425
144   0.067140 54.230.30.202 -> 172.31.36.109 TCP 5858 [TCP segment of a reassembled PDU]
145   0.067146 172.31.36.109 -> 54.230.30.202 TCP 66 53964 > http [ACK] Seq=97 Ack=699906 Win=837504 Len=0 TSval=30385077 TSecr=624048425
146   0.067265 54.230.30.202 -> 172.31.36.109 TCP 10202 [TCP segment of a reassembled PDU]
147   0.067283 172.31.36.109 -> 54.230.30.202 TCP 66 53964 > http [ACK] Seq=97 Ack=710042 Win=842496 Len=0 TSval=30385077 TSecr=624048425
148   0.067382 54.230.30.202 -> 172.31.36.109 TCP 5858 [TCP segment of a reassembled PDU]
149   0.067398 172.31.36.109 -> 54.230.30.202 TCP 66 53964 > http [ACK] Seq=97 Ack=715834 Win=842496 Len=0 TSval=30385077 TSecr=624048425
150   0.067495 54.230.30.202 -> 172.31.36.109 TCP 4898 [TCP segment of a reassembled PDU]
151   0.067511 172.31.36.109 -> 54.230.30.202 TCP 66 53964 > http [ACK] Seq=97 Ack=720666 Win=842496 Len=0 TSval=30385077 TSecr=624048425
152   0.079776 54.230.30.202 -> 172.31.36.109 TCP 7306 [TCP segment of a reassembled PDU]
153   0.079792 172.31.36.109 -> 54.230.30.202 TCP 66 53964 > http [ACK] Seq=97 Ack=727906 Win=842496 Len=0 TSval=30385080 TSecr=624048427
154   0.079942 54.230.30.202 -> 172.31.36.109 TCP 30474 [TCP segment of a reassembled PDU]
155   0.079969 172.31.36.109 -> 54.230.30.202 TCP 66 53964 > http [ACK] Seq=97 Ack=758314 Win=812160 Len=0 TSval=30385080 TSecr=624048427
156   0.080173 54.230.30.202 -> 172.31.36.109 TCP 26130 [TCP segment of a reassembled PDU]
157   0.080212 172.31.36.109 -> 54.230.30.202 TCP 66 53964 > http [ACK] Seq=97 Ack=784378 Win=804224 Len=0 TSval=30385080 TSecr=624048427
158   0.080254 54.230.30.202 -> 172.31.36.109 TCP 1890 [TCP segment of a reassembled PDU]
159   0.080260 172.31.36.109 -> 54.230.30.202 TCP 66 53964 > http [ACK] Seq=97 Ack=786202 Win=842240 Len=0 TSval=30385080 TSecr=624048427
160   0.080264 54.230.30.202 -> 172.31.36.109 TCP 1514 [TCP segment of a reassembled PDU]
161   0.080361 54.230.30.202 -> 172.31.36.109 TCP 5858 [TCP segment of a reassembled PDU]
162   0.080377 172.31.36.109 -> 54.230.30.202 TCP 66 53964 > http [ACK] Seq=97 Ack=793442 Win=842496 Len=0 TSval=30385080 TSecr=624048427
163   0.080519 54.230.30.202 -> 172.31.36.109 TCP 17442 [TCP segment of a reassembled PDU]
164   0.080540 172.31.36.109 -> 54.230.30.202 TCP 66 53964 > http [ACK] Seq=97 Ack=810818 Win=825216 Len=0 TSval=30385080 TSecr=624048427
165   0.080609 54.230.30.202 -> 172.31.36.109 TCP 2962 [TCP segment of a reassembled PDU]
166   0.080614 172.31.36.109 -> 54.230.30.202 TCP 66 53964 > http [ACK] Seq=97 Ack=813714 Win=842240 Len=0 TSval=30385080 TSecr=624048427
167   0.080729 54.230.30.202 -> 172.31.36.109 TCP 7306 [TCP segment of a reassembled PDU]
168   0.080746 172.31.36.109 -> 54.230.30.202 TCP 66 53964 > http [ACK] Seq=97 Ack=820954 Win=842496 Len=0 TSval=30385080 TSecr=624048427
169   0.081220 54.230.30.202 -> 172.31.36.109 TCP 4410 [TCP segment of a reassembled PDU]
170   0.081235 172.31.36.109 -> 54.230.30.202 TCP 66 53964 > http [ACK] Seq=97 Ack=825298 Win=842496 Len=0 TSval=30385080 TSecr=624048427
171   0.081368 54.230.30.202 -> 172.31.36.109 TCP 10202 [TCP segment of a reassembled PDU]
172   0.081386 172.31.36.109 -> 54.230.30.202 TCP 66 53964 > http [ACK] Seq=97 Ack=835434 Win=842496 Len=0 TSval=30385080 TSecr=624048427
173   0.081472 54.230.30.202 -> 172.31.36.109 TCP 5858 [TCP segment of a reassembled PDU]
174   0.081489 172.31.36.109 -> 54.230.30.202 TCP 66 53964 > http [ACK] Seq=97 Ack=841226 Win=842496 Len=0 TSval=30385080 TSecr=624048427
175   0.081631 54.230.30.202 -> 172.31.36.109 TCP 20338 [TCP segment of a reassembled PDU]
176   0.081756 54.230.30.202 -> 172.31.36.109 TCP 4410 [TCP segment of a reassembled PDU]
177   0.081822 172.31.36.109 -> 54.230.30.202 TCP 66 53964 > http [ACK] Seq=97 Ack=865842 Win=817920 Len=0 TSval=30385081 TSecr=624048427
178   0.081899 54.230.30.202 -> 172.31.36.109 TCP 14546 [TCP segment of a reassembled PDU]
179   0.081921 172.31.36.109 -> 54.230.30.202 TCP 66 53964 > http [ACK] Seq=97 Ack=880322 Win=823168 Len=0 TSval=30385081 TSecr=624048427
180   0.082010 54.230.30.202 -> 172.31.36.109 TCP 8754 [TCP segment of a reassembled PDU]
181   0.082017 172.31.36.109 -> 54.230.30.202 TCP 66 53964 > http [ACK] Seq=97 Ack=889010 Win=832768 Len=0 TSval=30385081 TSecr=624048427
182   0.082164 54.230.30.202 -> 172.31.36.109 TCP 21786 [TCP segment of a reassembled PDU]
183   0.082187 172.31.36.109 -> 54.230.30.202 TCP 66 53964 > http [ACK] Seq=97 Ack=910730 Win=811264 Len=0 TSval=30385081 TSecr=624048427
184   0.082281 54.230.30.202 -> 172.31.36.109 TCP 14546 [TCP segment of a reassembled PDU]
185   0.082290 172.31.36.109 -> 54.230.30.202 TCP 66 53964 > http [ACK] Seq=97 Ack=925210 Win=823168 Len=0 TSval=30385081 TSecr=624048427
186   0.082778 54.230.30.202 -> 172.31.36.109 TCP 4410 [TCP segment of a reassembled PDU]
187   0.082784 172.31.36.109 -> 54.230.30.202 TCP 66 53964 > http [ACK] Seq=97 Ack=929554 Win=839808 Len=0 TSval=30385081 TSecr=624048427
188   0.082920 54.230.30.202 -> 172.31.36.109 TCP 14546 [TCP segment of a reassembled PDU]
189   0.082940 172.31.36.109 -> 54.230.30.202 TCP 66 53964 > http [ACK] Seq=97 Ack=944034 Win=842496 Len=0 TSval=30385081 TSecr=624048427
190   0.083029 54.230.30.202 -> 172.31.36.109 TCP 7306 [TCP segment of a reassembled PDU]
191   0.083045 172.31.36.109 -> 54.230.30.202 TCP 66 53964 > http [ACK] Seq=97 Ack=951274 Win=842496 Len=0 TSval=30385081 TSecr=624048427
192   0.083281 54.230.30.202 -> 172.31.36.109 TCP 8754 [TCP segment of a reassembled PDU]
193   0.083299 172.31.36.109 -> 54.230.30.202 TCP 66 53964 > http [ACK] Seq=97 Ack=959962 Win=842496 Len=0 TSval=30385081 TSecr=624048427
194   0.083403 54.230.30.202 -> 172.31.36.109 TCP 7306 [TCP segment of a reassembled PDU]
195   0.083421 172.31.36.109 -> 54.230.30.202 TCP 66 53964 > http [ACK] Seq=97 Ack=967202 Win=842496 Len=0 TSval=30385081 TSecr=624048427
196   0.083539 54.230.30.202 -> 172.31.36.109 TCP 5858 [TCP segment of a reassembled PDU]
