[Measurement for 1mb at 07:30:54 20.30.2014] 
Tshark:

  1   0.000000 172.31.36.109 -> 172.31.0.2   DNS 89 Standard query 0xd36d  A d3796nkzln59xv.cloudfront.net
  2   0.000021 172.31.36.109 -> 172.31.0.2   DNS 89 Standard query 0xdbc0  AAAA d3796nkzln59xv.cloudfront.net
  3   0.000471   172.31.0.2 -> 172.31.36.109 DNS 170 Standard query response 0xdbc0 
  4   0.000482   172.31.0.2 -> 172.31.36.109 DNS 217 Standard query response 0xd36d  A 54.230.22.128 A 54.230.22.220 A 54.230.20.3 A 54.230.20.115 A 54.230.21.51 A 54.230.21.159 A 54.230.21.160 A 54.230.21.222
  5   0.003896 172.31.36.109 -> 54.230.22.128 TCP 74 47467 > http [SYN] Seq=0 Win=26883 Len=0 MSS=8961 SACK_PERM=1 TSval=33085359 TSecr=0 WS=128
  6   0.093482 54.230.22.128 -> 172.31.36.109 TCP 74 http > 47467 [SYN, ACK] Seq=0 Ack=1 Win=14480 Len=0 MSS=1460 SACK_PERM=1 TSval=951893578 TSecr=33085359 WS=128
  7   0.093497 172.31.36.109 -> 54.230.22.128 TCP 66 47467 > http [ACK] Seq=1 Ack=1 Win=27008 Len=0 TSval=33085381 TSecr=951893578
  8   0.093556 172.31.36.109 -> 54.230.22.128 HTTP 162 GET /1mb HTTP/1.1 
  9   0.183106 54.230.22.128 -> 172.31.36.109 TCP 66 http > 47467 [ACK] Seq=1 Ack=97 Win=14592 Len=0 TSval=951893587 TSecr=33085381
 10   0.185388 54.230.22.128 -> 172.31.36.109 TCP 10659 [TCP segment of a reassembled PDU]
 11   0.185400 172.31.36.109 -> 54.230.22.128 TCP 66 47467 > http [ACK] Seq=97 Ack=10594 Win=48128 Len=0 TSval=33085404 TSecr=951893587
 12   0.185584 54.230.22.128 -> 172.31.36.109 TCP 2962 [TCP segment of a reassembled PDU]
 13   0.185590 172.31.36.109 -> 54.230.22.128 TCP 66 47467 > http [ACK] Seq=97 Ack=13490 Win=53888 Len=0 TSval=33085404 TSecr=951893587
 14   0.274890 54.230.22.128 -> 172.31.36.109 TCP 1514 [TCP segment of a reassembled PDU]
 15   0.274900 172.31.36.109 -> 54.230.22.128 TCP 66 47467 > http [ACK] Seq=97 Ack=14938 Win=56832 Len=0 TSval=33085426 TSecr=951893596
 16   0.275101 54.230.22.128 -> 172.31.36.109 TCP 5858 [TCP segment of a reassembled PDU]
 17   0.275108 172.31.36.109 -> 54.230.22.128 TCP 66 47467 > http [ACK] Seq=97 Ack=20730 Win=68352 Len=0 TSval=33085427 TSecr=951893596
 18   0.275118 54.230.22.128 -> 172.31.36.109 TCP 5858 [TCP segment of a reassembled PDU]
 19   0.275123 172.31.36.109 -> 54.230.22.128 TCP 66 47467 > http [ACK] Seq=97 Ack=26522 Win=80000 Len=0 TSval=33085427 TSecr=951893596
 20   0.364535 54.230.22.128 -> 172.31.36.109 TCP 7306 [TCP segment of a reassembled PDU]
 21   0.364544 172.31.36.109 -> 54.230.22.128 TCP 66 47467 > http [ACK] Seq=97 Ack=33762 Win=94464 Len=0 TSval=33085449 TSecr=951893605
 22   0.364671 54.230.22.128 -> 172.31.36.109 TCP 4410 [TCP segment of a reassembled PDU]
 23   0.364677 172.31.36.109 -> 54.230.22.128 TCP 66 47467 > http [ACK] Seq=97 Ack=38106 Win=103168 Len=0 TSval=33085449 TSecr=951893605
 24   0.364767 54.230.22.128 -> 172.31.36.109 TCP 1514 [TCP segment of a reassembled PDU]
 25   0.364772 172.31.36.109 -> 54.230.22.128 TCP 66 47467 > http [ACK] Seq=97 Ack=39554 Win=106112 Len=0 TSval=33085449 TSecr=951893605
 26   0.364784 54.230.22.128 -> 172.31.36.109 TCP 8754 [TCP segment of a reassembled PDU]
 27   0.364792 172.31.36.109 -> 54.230.22.128 TCP 66 47467 > http [ACK] Seq=97 Ack=48242 Win=101248 Len=0 TSval=33085449 TSecr=951893605
 28   0.454175 54.230.22.128 -> 172.31.36.109 TCP 4410 [TCP segment of a reassembled PDU]
 29   0.454184 172.31.36.109 -> 54.230.22.128 TCP 66 47467 > http [ACK] Seq=97 Ack=52586 Win=109056 Len=0 TSval=33085471 TSecr=951893614
 30   0.454337 54.230.22.128 -> 172.31.36.109 TCP 2962 [TCP segment of a reassembled PDU]
 31   0.454342 172.31.36.109 -> 54.230.22.128 TCP 66 47467 > http [ACK] Seq=97 Ack=55482 Win=109056 Len=0 TSval=33085471 TSecr=951893614
 32   0.454415 54.230.22.128 -> 172.31.36.109 TCP 4410 [TCP segment of a reassembled PDU]
 33   0.454420 172.31.36.109 -> 54.230.22.128 TCP 66 47467 > http [ACK] Seq=97 Ack=59826 Win=109056 Len=0 TSval=33085471 TSecr=951893614
 34   0.454569 54.230.22.128 -> 172.31.36.109 TCP 4410 [TCP segment of a reassembled PDU]
 35   0.454591 172.31.36.109 -> 54.230.22.128 TCP 66 47467 > http [ACK] Seq=97 Ack=64170 Win=109056 Len=0 TSval=33085471 TSecr=951893614
 36   0.454660 54.230.22.128 -> 172.31.36.109 TCP 1514 [TCP segment of a reassembled PDU]
 37   0.454664 172.31.36.109 -> 54.230.22.128 TCP 66 47467 > http [ACK] Seq=97 Ack=65618 Win=109056 Len=0 TSval=33085471 TSecr=951893614
 38   0.454676 54.230.22.128 -> 172.31.36.109 TCP 10202 [TCP segment of a reassembled PDU]
 39   0.454685 172.31.36.109 -> 54.230.22.128 TCP 66 47467 > http [ACK] Seq=97 Ack=75754 Win=98944 Len=0 TSval=33085471 TSecr=951893614
 40   0.543599 54.230.22.128 -> 172.31.36.109 TCP 1514 [TCP segment of a reassembled PDU]
 41   0.543605 172.31.36.109 -> 54.230.22.128 TCP 66 47467 > http [ACK] Seq=97 Ack=77202 Win=109056 Len=0 TSval=33085494 TSecr=951893623
 42   0.543781 54.230.22.128 -> 172.31.36.109 TCP 2962 [TCP segment of a reassembled PDU]
 43   0.543787 172.31.36.109 -> 54.230.22.128 TCP 66 47467 > http [ACK] Seq=97 Ack=80098 Win=109056 Len=0 TSval=33085494 TSecr=951893623
 44   0.543855 54.230.22.128 -> 172.31.36.109 TCP 2962 [TCP segment of a reassembled PDU]
 45   0.543860 172.31.36.109 -> 54.230.22.128 TCP 66 47467 > http [ACK] Seq=97 Ack=82994 Win=109056 Len=0 TSval=33085494 TSecr=951893623
 46   0.544104 54.230.22.128 -> 172.31.36.109 TCP 8754 [TCP segment of a reassembled PDU]
 47   0.544123 172.31.36.109 -> 54.230.22.128 TCP 66 47467 > http [ACK] Seq=97 Ack=91682 Win=109056 Len=0 TSval=33085494 TSecr=951893623
 48   0.544352 54.230.22.128 -> 172.31.36.109 TCP 13098 [TCP segment of a reassembled PDU]
 49   0.544380 172.31.36.109 -> 54.230.22.128 TCP 66 47467 > http [ACK] Seq=97 Ack=104714 Win=109056 Len=0 TSval=33085494 TSecr=951893623
 50   0.632966 54.230.22.128 -> 172.31.36.109 TCP 4410 [TCP segment of a reassembled PDU]
 51   0.632974 172.31.36.109 -> 54.230.22.128 TCP 66 47467 > http [ACK] Seq=97 Ack=109058 Win=109056 Len=0 TSval=33085516 TSecr=951893632
 52   0.633208 54.230.22.128 -> 172.31.36.109 TCP 5858 [TCP segment of a reassembled PDU]
 53   0.633215 172.31.36.109 -> 54.230.22.128 TCP 66 47467 > http [ACK] Seq=97 Ack=114850 Win=120704 Len=0 TSval=33085516 TSecr=951893632
 54   0.633798 54.230.22.128 -> 172.31.36.109 TCP 11650 [TCP segment of a reassembled PDU]
 55   0.633807 172.31.36.109 -> 54.230.22.128 TCP 66 47467 > http [ACK] Seq=97 Ack=126434 Win=143872 Len=0 TSval=33085516 TSecr=951893632
 56   0.633815 54.230.22.128 -> 172.31.36.109 TCP 4410 [TCP segment of a reassembled PDU]
 57   0.633818 172.31.36.109 -> 54.230.22.128 TCP 66 47467 > http [ACK] Seq=97 Ack=130778 Win=152448 Len=0 TSval=33085516 TSecr=951893632
 58   0.634034 54.230.22.128 -> 172.31.36.109 TCP 8754 [TCP segment of a reassembled PDU]
 59   0.634041 172.31.36.109 -> 54.230.22.128 TCP 66 47467 > http [ACK] Seq=97 Ack=139466 Win=169856 Len=0 TSval=33085516 TSecr=951893632
 60   0.634323 54.230.22.128 -> 172.31.36.109 TCP 8754 [TCP segment of a reassembled PDU]
 61   0.634344 172.31.36.109 -> 54.230.22.128 TCP 66 47467 > http [ACK] Seq=97 Ack=148154 Win=187264 Len=0 TSval=33085516 TSecr=951893632
 62   0.723009 54.230.22.128 -> 172.31.36.109 TCP 4410 [TCP segment of a reassembled PDU]
 63   0.723017 172.31.36.109 -> 54.230.22.128 TCP 66 47467 > http [ACK] Seq=97 Ack=152498 Win=195968 Len=0 TSval=33085538 TSecr=951893641
 64   0.723139 54.230.22.128 -> 172.31.36.109 TCP 2962 [TCP segment of a reassembled PDU]
 65   0.723144 172.31.36.109 -> 54.230.22.128 TCP 66 47467 > http [ACK] Seq=97 Ack=155394 Win=201728 Len=0 TSval=33085539 TSecr=951893641
 66   0.723261 54.230.22.128 -> 172.31.36.109 TCP 1514 [TCP segment of a reassembled PDU]
 67   0.723271 172.31.36.109 -> 54.230.22.128 TCP 66 47467 > http [ACK] Seq=97 Ack=156842 Win=204672 Len=0 TSval=33085539 TSecr=951893641
 68   0.723512 54.230.22.128 -> 172.31.36.109 TCP 17442 [TCP segment of a reassembled PDU]
 69   0.723522 172.31.36.109 -> 54.230.22.128 TCP 66 47467 > http [ACK] Seq=97 Ack=174218 Win=239360 Len=0 TSval=33085539 TSecr=951893641
 70   0.723726 54.230.22.128 -> 172.31.36.109 TCP 8754 [TCP segment of a reassembled PDU]
 71   0.723753 172.31.36.109 -> 54.230.22.128 TCP 66 47467 > http [ACK] Seq=97 Ack=182906 Win=256768 Len=0 TSval=33085539 TSecr=951893641
 72   0.723963 54.230.22.128 -> 172.31.36.109 TCP 8754 [TCP segment of a reassembled PDU]
 73   0.723989 172.31.36.109 -> 54.230.22.128 TCP 66 47467 > http [ACK] Seq=97 Ack=191594 Win=274176 Len=0 TSval=33085539 TSecr=951893641
 74   0.724094 54.230.22.128 -> 172.31.36.109 TCP 8754 [TCP segment of a reassembled PDU]
 75   0.724117 172.31.36.109 -> 54.230.22.128 TCP 66 47467 > http [ACK] Seq=97 Ack=200282 Win=291456 Len=0 TSval=33085539 TSecr=951893641
 76   0.813349 54.230.22.128 -> 172.31.36.109 TCP 17442 [TCP segment of a reassembled PDU]
 77   0.813361 172.31.36.109 -> 54.230.22.128 TCP 66 47467 > http [ACK] Seq=97 Ack=217658 Win=313728 Len=0 TSval=33085561 TSecr=951893650
 78   0.813384 54.230.22.128 -> 172.31.36.109 TCP 5858 [TCP segment of a reassembled PDU]
 79   0.813398 172.31.36.109 -> 54.230.22.128 TCP 66 47467 > http [ACK] Seq=97 Ack=223450 Win=326272 Len=0 TSval=33085561 TSecr=951893650
 80   0.813424 54.230.22.128 -> 172.31.36.109 TCP 8754 [TCP segment of a reassembled PDU]
 81   0.813431 172.31.36.109 -> 54.230.22.128 TCP 66 47467 > http [ACK] Seq=97 Ack=232138 Win=343680 Len=0 TSval=33085561 TSecr=951893650
 82   0.813999 54.230.22.128 -> 172.31.36.109 TCP 2962 [TCP segment of a reassembled PDU]
 83   0.814013 172.31.36.109 -> 54.230.22.128 TCP 66 47467 > http [ACK] Seq=97 Ack=235034 Win=349440 Len=0 TSval=33085561 TSecr=951893650
 84   0.814084 54.230.22.128 -> 172.31.36.109 TCP 5858 [TCP segment of a reassembled PDU]
 85   0.814090 172.31.36.109 -> 54.230.22.128 TCP 66 47467 > http [ACK] Seq=97 Ack=240826 Win=360960 Len=0 TSval=33085561 TSecr=951893650
 86   0.814276 54.230.22.128 -> 172.31.36.109 TCP 15994 [TCP segment of a reassembled PDU]
 87   0.814285 172.31.36.109 -> 54.230.22.128 TCP 66 47467 > http [ACK] Seq=97 Ack=256754 Win=379264 Len=0 TSval=33085561 TSecr=951893650
 88   0.814394 54.230.22.128 -> 172.31.36.109 TCP 4410 [TCP segment of a reassembled PDU]
 89   0.814400 172.31.36.109 -> 54.230.22.128 TCP 66 47467 > http [ACK] Seq=97 Ack=261098 Win=398336 Len=0 TSval=33085561 TSecr=951893650
 90   0.902808 54.230.22.128 -> 172.31.36.109 TCP 2962 [TCP segment of a reassembled PDU]
 91   0.902831 172.31.36.109 -> 54.230.22.128 TCP 66 47467 > http [ACK] Seq=97 Ack=263994 Win=400640 Len=0 TSval=33085583 TSecr=951893659
 92   0.902990 54.230.22.128 -> 172.31.36.109 TCP 17442 [TCP segment of a reassembled PDU]
 93   0.903216 172.31.36.109 -> 54.230.22.128 TCP 66 47467 > http [ACK] Seq=97 Ack=281370 Win=383360 Len=0 TSval=33085584 TSecr=951893659
 94   0.903750 54.230.22.128 -> 172.31.36.109 TCP 10202 [TCP segment of a reassembled PDU]
 95   0.903759 172.31.36.109 -> 54.230.22.128 TCP 66 47467 > http [ACK] Seq=97 Ack=291506 Win=388864 Len=0 TSval=33085584 TSecr=951893659
 96   0.903858 54.230.22.128 -> 172.31.36.109 TCP 15994 [TCP segment of a reassembled PDU]
 97   0.903879 172.31.36.109 -> 54.230.22.128 TCP 66 47467 > http [ACK] Seq=97 Ack=307434 Win=401536 Len=0 TSval=33085584 TSecr=951893659
 98   0.904088 54.230.22.128 -> 172.31.36.109 TCP 5858 [TCP segment of a reassembled PDU]
 99   0.904125 172.31.36.109 -> 54.230.22.128 TCP 66 47467 > http [ACK] Seq=97 Ack=313226 Win=401536 Len=0 TSval=33085584 TSecr=951893659
100   0.992722 54.230.22.128 -> 172.31.36.109 TCP 24682 [TCP segment of a reassembled PDU]
101   0.992752 172.31.36.109 -> 54.230.22.128 TCP 66 47467 > http [ACK] Seq=97 Ack=337842 Win=376960 Len=0 TSval=33085606 TSecr=951893668
102   0.993513 54.230.22.128 -> 172.31.36.109 TCP 11650 [TCP segment of a reassembled PDU]
103   0.993522 172.31.36.109 -> 54.230.22.128 TCP 66 47467 > http [ACK] Seq=97 Ack=349426 Win=386432 Len=0 TSval=33085606 TSecr=951893668
104   0.993538 54.230.22.128 -> 172.31.36.109 TCP 17442 [TCP segment of a reassembled PDU]
105   0.993565 172.31.36.109 -> 54.230.22.128 TCP 66 47467 > http [ACK] Seq=97 Ack=366802 Win=376832 Len=0 TSval=33085606 TSecr=951893668
106   1.082388 54.230.22.128 -> 172.31.36.109 TCP 30474 [TCP segment of a reassembled PDU]
107   1.082479 54.230.22.128 -> 172.31.36.109 TCP 14546 [TCP segment of a reassembled PDU]
108   1.082577 172.31.36.109 -> 54.230.22.128 TCP 66 47467 > http [ACK] Seq=97 Ack=411690 Win=332032 Len=0 TSval=33085628 TSecr=951893677
109   1.082604 54.230.22.128 -> 172.31.36.109 TCP 7306 [TCP segment of a reassembled PDU]
110   1.082624 172.31.36.109 -> 54.230.22.128 TCP 66 47467 > http [ACK] Seq=97 Ack=418930 Win=369664 Len=0 TSval=33085628 TSecr=951893677
111   1.083276 54.230.22.128 -> 172.31.36.109 TCP 4410 [TCP segment of a reassembled PDU]
112   1.083297 172.31.36.109 -> 54.230.22.128 TCP 66 47467 > http [ACK] Seq=97 Ack=423274 Win=398336 Len=0 TSval=33085629 TSecr=951893677
113   1.083375 54.230.22.128 -> 172.31.36.109 TCP 15994 [TCP segment of a reassembled PDU]
114   1.083398 172.31.36.109 -> 54.230.22.128 TCP 66 47467 > http [ACK] Seq=97 Ack=439202 Win=401536 Len=0 TSval=33085629 TSecr=951893677
115   1.083449 54.230.22.128 -> 172.31.36.109 TCP 4410 [TCP segment of a reassembled PDU]
116   1.083464 172.31.36.109 -> 54.230.22.128 TCP 66 47467 > http [ACK] Seq=97 Ack=443546 Win=401536 Len=0 TSval=33085629 TSecr=951893677
117   1.083587 54.230.22.128 -> 172.31.36.109 TCP 7306 [TCP segment of a reassembled PDU]
118   1.083603 172.31.36.109 -> 54.230.22.128 TCP 66 47467 > http [ACK] Seq=97 Ack=450786 Win=401536 Len=0 TSval=33085629 TSecr=951893677
119   1.172811 54.230.22.128 -> 172.31.36.109 TCP 23234 [TCP segment of a reassembled PDU]
120   1.172835 54.230.22.128 -> 172.31.36.109 TCP 7306 [TCP segment of a reassembled PDU]
121   1.172854 172.31.36.109 -> 54.230.22.128 TCP 66 47467 > http [ACK] Seq=97 Ack=481194 Win=401536 Len=0 TSval=33085651 TSecr=951893686
122   1.172869 54.230.22.128 -> 172.31.36.109 TCP 8754 [TCP segment of a reassembled PDU]
123   1.172875 172.31.36.109 -> 54.230.22.128 TCP 66 47467 > http [ACK] Seq=97 Ack=489882 Win=404224 Len=0 TSval=33085651 TSecr=951893686
124   1.172932 54.230.22.128 -> 172.31.36.109 TCP 8754 [TCP segment of a reassembled PDU]
