[Measurement for 1mb at 08:30:54 20.30.2014] 
Tshark:

  1   0.000000 172.31.36.109 -> 172.31.0.2   DNS 89 Standard query 0xf3af  A d3796nkzln59xv.cloudfront.net
  2   0.000041 172.31.36.109 -> 172.31.0.2   DNS 89 Standard query 0x4c42  AAAA d3796nkzln59xv.cloudfront.net
  3   0.000794   172.31.0.2 -> 172.31.36.109 DNS 217 Standard query response 0xf3af  A 54.230.21.51 A 54.230.21.115 A 54.230.22.51 A 54.230.23.102 A 216.137.41.101 A 216.137.41.254 A 54.230.20.3 A 54.230.20.109
  4   0.000805   172.31.0.2 -> 172.31.36.109 DNS 170 Standard query response 0x4c42 
  5   0.003843 172.31.36.109 -> 54.230.21.51 TCP 74 38393 > http [SYN] Seq=0 Win=26883 Len=0 MSS=8961 SACK_PERM=1 TSval=33985363 TSecr=0 WS=128
  6   0.091017 54.230.21.51 -> 172.31.36.109 TCP 74 http > 38393 [SYN, ACK] Seq=0 Ack=1 Win=14480 Len=0 MSS=1460 SACK_PERM=1 TSval=940966966 TSecr=33985363 WS=128
  7   0.091035 172.31.36.109 -> 54.230.21.51 TCP 66 38393 > http [ACK] Seq=1 Ack=1 Win=27008 Len=0 TSval=33985385 TSecr=940966966
  8   0.091097 172.31.36.109 -> 54.230.21.51 HTTP 162 GET /1mb HTTP/1.1 
  9   0.178357 54.230.21.51 -> 172.31.36.109 TCP 66 http > 38393 [ACK] Seq=1 Ack=97 Win=14592 Len=0 TSval=940966974 TSecr=33985385
 10   0.178388 54.230.21.51 -> 172.31.36.109 TCP 66 [TCP Dup ACK 9#1] http > 38393 [ACK] Seq=1 Ack=97 Win=14592 Len=0 TSval=940966974 TSecr=33985385
 11   0.180410 54.230.21.51 -> 172.31.36.109 TCP 2962 [TCP segment of a reassembled PDU]
 12   0.180422 172.31.36.109 -> 54.230.21.51 TCP 66 38393 > http [ACK] Seq=97 Ack=2897 Win=32768 Len=0 TSval=33985408 TSecr=940966975
 13   0.180438 54.230.21.51 -> 172.31.36.109 TCP 10202 [TCP segment of a reassembled PDU]
 14   0.180449 172.31.36.109 -> 54.230.21.51 TCP 66 38393 > http [ACK] Seq=97 Ack=13033 Win=52992 Len=0 TSval=33985408 TSecr=940966975
 15   0.180594 54.230.21.51 -> 172.31.36.109 TCP 1514 [TCP segment of a reassembled PDU]
 16   0.180599 172.31.36.109 -> 54.230.21.51 TCP 66 38393 > http [ACK] Seq=97 Ack=14481 Win=55936 Len=0 TSval=33985408 TSecr=940966975
 17   0.267910 54.230.21.51 -> 172.31.36.109 TCP 13098 [TCP segment of a reassembled PDU]
 18   0.267922 172.31.36.109 -> 54.230.21.51 TCP 66 38393 > http [ACK] Seq=97 Ack=27513 Win=81920 Len=0 TSval=33985430 TSecr=940966983
 19   0.355093 54.230.21.51 -> 172.31.36.109 TCP 10202 [TCP segment of a reassembled PDU]
 20   0.355104 172.31.36.109 -> 54.230.21.51 TCP 66 38393 > http [ACK] Seq=97 Ack=37649 Win=101248 Len=0 TSval=33985451 TSecr=940966992
 21   0.355195 54.230.21.51 -> 172.31.36.109 TCP 2962 [TCP segment of a reassembled PDU]
 22   0.355201 172.31.36.109 -> 54.230.21.51 TCP 66 38393 > http [ACK] Seq=97 Ack=40545 Win=108032 Len=0 TSval=33985451 TSecr=940966992
 23   0.355250 54.230.21.51 -> 172.31.36.109 TCP 7306 [TCP segment of a reassembled PDU]
 24   0.355257 172.31.36.109 -> 54.230.21.51 TCP 66 38393 > http [ACK] Seq=97 Ack=47785 Win=105984 Len=0 TSval=33985451 TSecr=940966992
 25   0.442331 54.230.21.51 -> 172.31.36.109 TCP 10202 [TCP segment of a reassembled PDU]
 26   0.442342 172.31.36.109 -> 54.230.21.51 TCP 66 38393 > http [ACK] Seq=97 Ack=57921 Win=101248 Len=0 TSval=33985473 TSecr=940967001
 27   0.442352 54.230.21.51 -> 172.31.36.109 TCP 5858 [TCP segment of a reassembled PDU]
 28   0.442357 172.31.36.109 -> 54.230.21.51 TCP 66 38393 > http [ACK] Seq=97 Ack=63713 Win=95488 Len=0 TSval=33985473 TSecr=940967001
 29   0.442609 54.230.21.51 -> 172.31.36.109 TCP 1514 [TCP segment of a reassembled PDU]
 30   0.442614 172.31.36.109 -> 54.230.21.51 TCP 66 38393 > http [ACK] Seq=97 Ack=65161 Win=110976 Len=0 TSval=33985473 TSecr=940967001
 31   0.442688 54.230.21.51 -> 172.31.36.109 TCP 1514 [TCP segment of a reassembled PDU]
 32   0.442692 172.31.36.109 -> 54.230.21.51 TCP 66 38393 > http [ACK] Seq=97 Ack=66609 Win=113792 Len=0 TSval=33985473 TSecr=940967001
 33   0.529545 54.230.21.51 -> 172.31.36.109 TCP 8754 [TCP segment of a reassembled PDU]
 34   0.529554 172.31.36.109 -> 54.230.21.51 TCP 66 38393 > http [ACK] Seq=97 Ack=75297 Win=131200 Len=0 TSval=33985495 TSecr=940967009
 35   0.529564 54.230.21.51 -> 172.31.36.109 TCP 4410 [TCP segment of a reassembled PDU]
 36   0.529568 172.31.36.109 -> 54.230.21.51 TCP 66 38393 > http [ACK] Seq=97 Ack=79641 Win=139904 Len=0 TSval=33985495 TSecr=940967009
 37   0.529812 54.230.21.51 -> 172.31.36.109 TCP 11650 [TCP segment of a reassembled PDU]
 38   0.529820 172.31.36.109 -> 54.230.21.51 TCP 66 38393 > http [ACK] Seq=97 Ack=91225 Win=163072 Len=0 TSval=33985495 TSecr=940967009
 39   0.616729 54.230.21.51 -> 172.31.36.109 TCP 5858 [TCP segment of a reassembled PDU]
 40   0.616736 172.31.36.109 -> 54.230.21.51 TCP 66 38393 > http [ACK] Seq=97 Ack=97017 Win=174592 Len=0 TSval=33985517 TSecr=940967018
 41   0.616932 54.230.21.51 -> 172.31.36.109 TCP 10202 [TCP segment of a reassembled PDU]
 42   0.616940 172.31.36.109 -> 54.230.21.51 TCP 66 38393 > http [ACK] Seq=97 Ack=107153 Win=181632 Len=0 TSval=33985517 TSecr=940967018
 43   0.617125 54.230.21.51 -> 172.31.36.109 TCP 5858 [TCP segment of a reassembled PDU]
 44   0.617131 172.31.36.109 -> 54.230.21.51 TCP 66 38393 > http [ACK] Seq=97 Ack=112945 Win=188672 Len=0 TSval=33985517 TSecr=940967018
 45   0.617275 54.230.21.51 -> 172.31.36.109 TCP 13098 [TCP segment of a reassembled PDU]
 46   0.617298 172.31.36.109 -> 54.230.21.51 TCP 66 38393 > http [ACK] Seq=97 Ack=125977 Win=176896 Len=0 TSval=33985517 TSecr=940967018
 47   0.704366 54.230.21.51 -> 172.31.36.109 TCP 8754 [TCP segment of a reassembled PDU]
 48   0.704375 172.31.36.109 -> 54.230.21.51 TCP 66 38393 > http [ACK] Seq=97 Ack=134665 Win=183936 Len=0 TSval=33985539 TSecr=940967027
 49   0.704396 54.230.21.51 -> 172.31.36.109 TCP 17442 [TCP segment of a reassembled PDU]
 50   0.704405 172.31.36.109 -> 54.230.21.51 TCP 66 38393 > http [ACK] Seq=97 Ack=152041 Win=166656 Len=0 TSval=33985539 TSecr=940967027
 51   0.704426 54.230.21.51 -> 172.31.36.109 TCP 4410 [TCP segment of a reassembled PDU]
 52   0.704437 172.31.36.109 -> 54.230.21.51 TCP 66 38393 > http [ACK] Seq=97 Ack=156385 Win=180352 Len=0 TSval=33985539 TSecr=940967027
 53   0.704536 54.230.21.51 -> 172.31.36.109 TCP 4410 [TCP segment of a reassembled PDU]
 54   0.704542 172.31.36.109 -> 54.230.21.51 TCP 66 38393 > http [ACK] Seq=97 Ack=160729 Win=203648 Len=0 TSval=33985539 TSecr=940967027
 55   0.704743 54.230.21.51 -> 172.31.36.109 TCP 1514 [TCP segment of a reassembled PDU]
 56   0.704747 172.31.36.109 -> 54.230.21.51 TCP 66 38393 > http [ACK] Seq=97 Ack=162177 Win=206464 Len=0 TSval=33985539 TSecr=940967027
 57   0.791791 54.230.21.51 -> 172.31.36.109 TCP 27578 [TCP segment of a reassembled PDU]
 58   0.791823 172.31.36.109 -> 54.230.21.51 TCP 66 38393 > http [ACK] Seq=97 Ack=189689 Win=179072 Len=0 TSval=33985560 TSecr=940967036
 59   0.792208 54.230.21.51 -> 172.31.36.109 TCP 10202 [TCP segment of a reassembled PDU]
 60   0.792216 172.31.36.109 -> 54.230.21.51 TCP 66 38393 > http [ACK] Seq=97 Ack=199825 Win=199552 Len=0 TSval=33985561 TSecr=940967036
 61   0.792240 54.230.21.51 -> 172.31.36.109 TCP 7306 [TCP segment of a reassembled PDU]
 62   0.792252 172.31.36.109 -> 54.230.21.51 TCP 66 38393 > http [ACK] Seq=97 Ack=207065 Win=206464 Len=0 TSval=33985561 TSecr=940967036
 63   0.879166 54.230.21.51 -> 172.31.36.109 TCP 15994 [TCP segment of a reassembled PDU]
 64   0.879177 172.31.36.109 -> 54.230.21.51 TCP 66 38393 > http [ACK] Seq=97 Ack=222993 Win=238336 Len=0 TSval=33985582 TSecr=940967044
 65   0.879251 54.230.21.51 -> 172.31.36.109 TCP 4410 [TCP segment of a reassembled PDU]
 66   0.879257 172.31.36.109 -> 54.230.21.51 TCP 66 38393 > http [ACK] Seq=97 Ack=227337 Win=247040 Len=0 TSval=33985582 TSecr=940967044
 67   0.879303 54.230.21.51 -> 172.31.36.109 TCP 7306 [TCP segment of a reassembled PDU]
 68   0.879309 172.31.36.109 -> 54.230.21.51 TCP 66 38393 > http [ACK] Seq=97 Ack=234577 Win=261504 Len=0 TSval=33985582 TSecr=940967044
 69   0.879355 54.230.21.51 -> 172.31.36.109 TCP 4410 [TCP segment of a reassembled PDU]
 70   0.879360 172.31.36.109 -> 54.230.21.51 TCP 66 38393 > http [ACK] Seq=97 Ack=238921 Win=270208 Len=0 TSval=33985582 TSecr=940967044
 71   0.879534 54.230.21.51 -> 172.31.36.109 TCP 2962 [TCP segment of a reassembled PDU]
 72   0.879538 172.31.36.109 -> 54.230.21.51 TCP 66 38393 > http [ACK] Seq=97 Ack=241817 Win=275968 Len=0 TSval=33985582 TSecr=940967044
 73   0.879665 54.230.21.51 -> 172.31.36.109 TCP 11650 [TCP segment of a reassembled PDU]
 74   0.879687 172.31.36.109 -> 54.230.21.51 TCP 66 38393 > http [ACK] Seq=97 Ack=253401 Win=299136 Len=0 TSval=33985582 TSecr=940967044
 75   0.879695 54.230.21.51 -> 172.31.36.109 TCP 5858 [TCP segment of a reassembled PDU]
 76   0.879700 172.31.36.109 -> 54.230.21.51 TCP 66 38393 > http [ACK] Seq=97 Ack=259193 Win=310784 Len=0 TSval=33985582 TSecr=940967044
 77   0.966707 54.230.21.51 -> 172.31.36.109 TCP 17442 [TCP segment of a reassembled PDU]
 78   0.966719 172.31.36.109 -> 54.230.21.51 TCP 66 38393 > http [ACK] Seq=97 Ack=276569 Win=345472 Len=0 TSval=33985604 TSecr=940967053
 79   0.966791 54.230.21.51 -> 172.31.36.109 TCP 8754 [TCP segment of a reassembled PDU]
 80   0.966798 172.31.36.109 -> 54.230.21.51 TCP 66 38393 > http [ACK] Seq=97 Ack=285257 Win=362880 Len=0 TSval=33985604 TSecr=940967053
 81   0.966873 54.230.21.51 -> 172.31.36.109 TCP 5858 [TCP segment of a reassembled PDU]
 82   0.966879 172.31.36.109 -> 54.230.21.51 TCP 66 38393 > http [ACK] Seq=97 Ack=291049 Win=374528 Len=0 TSval=33985604 TSecr=940967053
 83   0.967162 54.230.21.51 -> 172.31.36.109 TCP 18890 [TCP segment of a reassembled PDU]
 84   0.967173 172.31.36.109 -> 54.230.21.51 TCP 66 38393 > http [ACK] Seq=97 Ack=309873 Win=412160 Len=0 TSval=33985604 TSecr=940967053
 85   0.967392 54.230.21.51 -> 172.31.36.109 TCP 4410 [TCP segment of a reassembled PDU]
 86   0.967397 172.31.36.109 -> 54.230.21.51 TCP 66 38393 > http [ACK] Seq=97 Ack=314217 Win=420864 Len=0 TSval=33985604 TSecr=940967053
 87   1.053926 54.230.21.51 -> 172.31.36.109 TCP 5858 [TCP segment of a reassembled PDU]
 88   1.053937 172.31.36.109 -> 54.230.21.51 TCP 66 38393 > http [ACK] Seq=97 Ack=320009 Win=432384 Len=0 TSval=33985626 TSecr=940967062
 89   1.054042 54.230.21.51 -> 172.31.36.109 TCP 14546 [TCP segment of a reassembled PDU]
 90   1.054053 172.31.36.109 -> 54.230.21.51 TCP 66 38393 > http [ACK] Seq=97 Ack=334489 Win=461312 Len=0 TSval=33985626 TSecr=940967062
 91   1.054255 54.230.21.51 -> 172.31.36.109 TCP 2962 [TCP segment of a reassembled PDU]
 92   1.054261 172.31.36.109 -> 54.230.21.51 TCP 66 38393 > http [ACK] Seq=97 Ack=337385 Win=467200 Len=0 TSval=33985626 TSecr=940967062
 93   1.054338 54.230.21.51 -> 172.31.36.109 TCP 8754 [TCP segment of a reassembled PDU]
 94   1.054345 172.31.36.109 -> 54.230.21.51 TCP 66 38393 > http [ACK] Seq=97 Ack=346073 Win=484480 Len=0 TSval=33985626 TSecr=940967062
 95   1.054393 54.230.21.51 -> 172.31.36.109 TCP 4410 [TCP segment of a reassembled PDU]
 96   1.054398 172.31.36.109 -> 54.230.21.51 TCP 66 38393 > http [ACK] Seq=97 Ack=350417 Win=493184 Len=0 TSval=33985626 TSecr=940967062
 97   1.054434 54.230.21.51 -> 172.31.36.109 TCP 5858 [TCP segment of a reassembled PDU]
 98   1.054440 172.31.36.109 -> 54.230.21.51 TCP 66 38393 > http [ACK] Seq=97 Ack=356209 Win=504832 Len=0 TSval=33985626 TSecr=940967062
 99   1.054506 54.230.21.51 -> 172.31.36.109 TCP 13098 [TCP segment of a reassembled PDU]
