[Measurement for 1mb at 11:30:53 20.30.2014] 
Tshark:

  1   0.000000 172.31.36.109 -> 172.31.0.2   DNS 89 Standard query 0x1828  A d3796nkzln59xv.cloudfront.net
  2   0.000040 172.31.36.109 -> 172.31.0.2   DNS 89 Standard query 0xfd2b  AAAA d3796nkzln59xv.cloudfront.net
  3   0.000509   172.31.0.2 -> 172.31.36.109 DNS 170 Standard query response 0xfd2b 
  4   0.000519   172.31.0.2 -> 172.31.36.109 DNS 217 Standard query response 0x1828  A 54.230.30.217 A 54.230.30.226 A 54.230.30.239 A 54.230.30.17 A 54.230.30.26 A 54.230.30.39 A 54.230.30.69 A 54.230.30.72
  5   0.003868 172.31.36.109 -> 54.230.30.217 TCP 74 56733 > http [SYN] Seq=0 Win=26883 Len=0 MSS=8961 SACK_PERM=1 TSval=36684932 TSecr=0 WS=128
  6   0.005179 54.230.30.217 -> 172.31.36.109 TCP 74 http > 56733 [SYN, ACK] Seq=0 Ack=1 Win=14480 Len=0 MSS=1460 SACK_PERM=1 TSval=691412764 TSecr=36684932 WS=128
  7   0.005194 172.31.36.109 -> 54.230.30.217 TCP 66 56733 > http [ACK] Seq=1 Ack=1 Win=27008 Len=0 TSval=36684932 TSecr=691412764
  8   0.005249 172.31.36.109 -> 54.230.30.217 HTTP 162 GET /1mb HTTP/1.1 
  9   0.006478 54.230.30.217 -> 172.31.36.109 TCP 66 http > 56733 [ACK] Seq=1 Ack=97 Win=14592 Len=0 TSval=691412765 TSecr=36684932
 10   0.025380 54.230.30.217 -> 172.31.36.109 TCP 4410 [TCP segment of a reassembled PDU]
 11   0.025403 172.31.36.109 -> 54.230.30.217 TCP 66 56733 > http [ACK] Seq=97 Ack=4345 Win=35584 Len=0 TSval=36684937 TSecr=691412766
 12   0.025481 54.230.30.217 -> 172.31.36.109 TCP 2592 [TCP segment of a reassembled PDU]
 13   0.025487 172.31.36.109 -> 54.230.30.217 TCP 66 56733 > http [ACK] Seq=97 Ack=6871 Win=40704 Len=0 TSval=36684937 TSecr=691412766
 14   0.025499 54.230.30.217 -> 172.31.36.109 TCP 7306 [TCP segment of a reassembled PDU]
 15   0.025509 172.31.36.109 -> 54.230.30.217 TCP 66 56733 > http [ACK] Seq=97 Ack=14111 Win=55168 Len=0 TSval=36684937 TSecr=691412766
 16   0.026708 54.230.30.217 -> 172.31.36.109 TCP 4410 [TCP segment of a reassembled PDU]
 17   0.026715 172.31.36.109 -> 54.230.30.217 TCP 66 56733 > http [ACK] Seq=97 Ack=18455 Win=63872 Len=0 TSval=36684938 TSecr=691412767
 18   0.026754 54.230.30.217 -> 172.31.36.109 TCP 4410 [TCP segment of a reassembled PDU]
 19   0.026760 172.31.36.109 -> 54.230.30.217 TCP 66 56733 > http [ACK] Seq=97 Ack=22799 Win=72576 Len=0 TSval=36684938 TSecr=691412767
 20   0.026914 54.230.30.217 -> 172.31.36.109 TCP 4410 [TCP segment of a reassembled PDU]
 21   0.026920 172.31.36.109 -> 54.230.30.217 TCP 66 56733 > http [ACK] Seq=97 Ack=27143 Win=81280 Len=0 TSval=36684938 TSecr=691412767
 22   0.027970 54.230.30.217 -> 172.31.36.109 TCP 5858 [TCP segment of a reassembled PDU]
 23   0.027977 172.31.36.109 -> 54.230.30.217 TCP 66 56733 > http [ACK] Seq=97 Ack=32935 Win=92800 Len=0 TSval=36684938 TSecr=691412767
 24   0.028026 54.230.30.217 -> 172.31.36.109 TCP 2962 [TCP segment of a reassembled PDU]
 25   0.028031 172.31.36.109 -> 54.230.30.217 TCP 66 56733 > http [ACK] Seq=97 Ack=35831 Win=98560 Len=0 TSval=36684938 TSecr=691412767
 26   0.028262 54.230.30.217 -> 172.31.36.109 TCP 14546 [TCP segment of a reassembled PDU]
 27   0.028273 172.31.36.109 -> 54.230.30.217 TCP 66 56733 > http [ACK] Seq=97 Ack=50311 Win=127616 Len=0 TSval=36684938 TSecr=691412767
 28   0.029021 54.230.30.217 -> 172.31.36.109 TCP 1514 [TCP segment of a reassembled PDU]
 29   0.029026 172.31.36.109 -> 54.230.30.217 TCP 66 56733 > http [ACK] Seq=97 Ack=51759 Win=130432 Len=0 TSval=36684938 TSecr=691412767
 30   0.029105 54.230.30.217 -> 172.31.36.109 TCP 1514 [TCP segment of a reassembled PDU]
 31   0.029110 172.31.36.109 -> 54.230.30.217 TCP 66 56733 > http [ACK] Seq=97 Ack=53207 Win=133376 Len=0 TSval=36684938 TSecr=691412767
 32   0.029382 54.230.30.217 -> 172.31.36.109 TCP 8754 [TCP segment of a reassembled PDU]
 33   0.029389 172.31.36.109 -> 54.230.30.217 TCP 66 56733 > http [ACK] Seq=97 Ack=61895 Win=150784 Len=0 TSval=36684938 TSecr=691412767
 34   0.029439 54.230.30.217 -> 172.31.36.109 TCP 1514 [TCP segment of a reassembled PDU]
 35   0.029443 172.31.36.109 -> 54.230.30.217 TCP 66 56733 > http [ACK] Seq=97 Ack=63343 Win=153600 Len=0 TSval=36684938 TSecr=691412767
 36   0.029698 54.230.30.217 -> 172.31.36.109 TCP 2029 [TCP segment of a reassembled PDU]
 37   0.029703 172.31.36.109 -> 54.230.30.217 TCP 66 56733 > http [ACK] Seq=97 Ack=65306 Win=157568 Len=0 TSval=36684938 TSecr=691412767
 38   0.047997 54.230.30.217 -> 172.31.36.109 TCP 1514 [TCP segment of a reassembled PDU]
 39   0.048002 172.31.36.109 -> 54.230.30.217 TCP 66 56733 > http [ACK] Seq=97 Ack=66754 Win=160512 Len=0 TSval=36684943 TSecr=691412769
 40   0.048425 54.230.30.217 -> 172.31.36.109 TCP 5858 [TCP segment of a reassembled PDU]
 41   0.048432 172.31.36.109 -> 54.230.30.217 TCP 66 56733 > http [ACK] Seq=97 Ack=72546 Win=172032 Len=0 TSval=36684943 TSecr=691412769
 42   0.048489 54.230.30.217 -> 172.31.36.109 TCP 10202 [TCP segment of a reassembled PDU]
 43   0.048496 172.31.36.109 -> 54.230.30.217 TCP 66 56733 > http [ACK] Seq=97 Ack=82682 Win=190592 Len=0 TSval=36684943 TSecr=691412769
 44   0.048558 54.230.30.217 -> 172.31.36.109 TCP 7306 [TCP segment of a reassembled PDU]
 45   0.048564 172.31.36.109 -> 54.230.30.217 TCP 66 56733 > http [ACK] Seq=97 Ack=89922 Win=195328 Len=0 TSval=36684943 TSecr=691412769
 46   0.049266 54.230.30.217 -> 172.31.36.109 TCP 2962 [TCP segment of a reassembled PDU]
 47   0.049271 172.31.36.109 -> 54.230.30.217 TCP 66 56733 > http [ACK] Seq=97 Ack=92818 Win=202496 Len=0 TSval=36684943 TSecr=691412769
 48   0.049364 54.230.30.217 -> 172.31.36.109 TCP 2962 [TCP segment of a reassembled PDU]
 49   0.049369 172.31.36.109 -> 54.230.30.217 TCP 66 56733 > http [ACK] Seq=97 Ack=95714 Win=202496 Len=0 TSval=36684943 TSecr=691412769
 50   0.049701 54.230.30.217 -> 172.31.36.109 TCP 2962 [TCP segment of a reassembled PDU]
 51   0.049706 172.31.36.109 -> 54.230.30.217 TCP 66 56733 > http [ACK] Seq=97 Ack=98610 Win=202496 Len=0 TSval=36684943 TSecr=691412769
 52   0.049849 54.230.30.217 -> 172.31.36.109 TCP 14546 [TCP segment of a reassembled PDU]
 53   0.049858 172.31.36.109 -> 54.230.30.217 TCP 66 56733 > http [ACK] Seq=97 Ack=113090 Win=188032 Len=0 TSval=36684944 TSecr=691412769
 54   0.050002 54.230.30.217 -> 172.31.36.109 TCP 1514 [TCP segment of a reassembled PDU]
 55   0.050007 172.31.36.109 -> 54.230.30.217 TCP 66 56733 > http [ACK] Seq=97 Ack=114538 Win=204800 Len=0 TSval=36684944 TSecr=691412769
 56   0.050469 54.230.30.217 -> 172.31.36.109 TCP 2962 [TCP segment of a reassembled PDU]
 57   0.050474 172.31.36.109 -> 54.230.30.217 TCP 66 56733 > http [ACK] Seq=97 Ack=117434 Win=202496 Len=0 TSval=36684944 TSecr=691412769
 58   0.050565 54.230.30.217 -> 172.31.36.109 TCP 10202 [TCP segment of a reassembled PDU]
 59   0.050574 172.31.36.109 -> 54.230.30.217 TCP 66 56733 > http [ACK] Seq=97 Ack=127570 Win=192384 Len=0 TSval=36684944 TSecr=691412769
 60   0.051010 54.230.30.217 -> 172.31.36.109 TCP 1514 [TCP segment of a reassembled PDU]
 61   0.051016 172.31.36.109 -> 54.230.30.217 TCP 66 56733 > http [ACK] Seq=97 Ack=129018 Win=209664 Len=0 TSval=36684944 TSecr=691412769
 62   0.051152 54.230.30.217 -> 172.31.36.109 TCP 17442 [TCP segment of a reassembled PDU]
 63   0.051163 172.31.36.109 -> 54.230.30.217 TCP 66 56733 > http [ACK] Seq=97 Ack=146394 Win=244480 Len=0 TSval=36684944 TSecr=691412769
 64   0.051223 54.230.30.217 -> 172.31.36.109 TCP 5858 [TCP segment of a reassembled PDU]
 65   0.051230 172.31.36.109 -> 54.230.30.217 TCP 66 56733 > http [ACK] Seq=97 Ack=152186 Win=256000 Len=0 TSval=36684944 TSecr=691412769
 66   0.051745 54.230.30.217 -> 172.31.36.109 TCP 2962 [TCP segment of a reassembled PDU]
 67   0.051749 172.31.36.109 -> 54.230.30.217 TCP 66 56733 > http [ACK] Seq=97 Ack=155082 Win=261760 Len=0 TSval=36684944 TSecr=691412769
 68   0.051846 54.230.30.217 -> 172.31.36.109 TCP 5858 [TCP segment of a reassembled PDU]
 69   0.051852 172.31.36.109 -> 54.230.30.217 TCP 66 56733 > http [ACK] Seq=97 Ack=160874 Win=273408 Len=0 TSval=36684944 TSecr=691412769
 70   0.052540 54.230.30.217 -> 172.31.36.109 TCP 2962 [TCP segment of a reassembled PDU]
 71   0.052544 172.31.36.109 -> 54.230.30.217 TCP 66 56733 > http [ACK] Seq=97 Ack=163770 Win=279168 Len=0 TSval=36684944 TSecr=691412769
 72   0.052698 54.230.30.217 -> 172.31.36.109 TCP 20338 [TCP segment of a reassembled PDU]
 73   0.052710 172.31.36.109 -> 54.230.30.217 TCP 66 56733 > http [ACK] Seq=97 Ack=184042 Win=319744 Len=0 TSval=36684944 TSecr=691412769
 74   0.052780 54.230.30.217 -> 172.31.36.109 TCP 8754 [TCP segment of a reassembled PDU]
 75   0.052788 172.31.36.109 -> 54.230.30.217 TCP 66 56733 > http [ACK] Seq=97 Ack=192730 Win=337152 Len=0 TSval=36684944 TSecr=691412769
 76   0.053080 54.230.30.217 -> 172.31.36.109 TCP 1514 [TCP segment of a reassembled PDU]
 77   0.053084 172.31.36.109 -> 54.230.30.217 TCP 66 56733 > http [ACK] Seq=97 Ack=194178 Win=339968 Len=0 TSval=36684944 TSecr=691412769
 78   0.053213 54.230.30.217 -> 172.31.36.109 TCP 8754 [TCP segment of a reassembled PDU]
 79   0.053221 172.31.36.109 -> 54.230.30.217 TCP 66 56733 > http [ACK] Seq=97 Ack=202866 Win=357376 Len=0 TSval=36684944 TSecr=691412769
 80   0.053295 54.230.30.217 -> 172.31.36.109 TCP 2962 [TCP segment of a reassembled PDU]
 81   0.053300 172.31.36.109 -> 54.230.30.217 TCP 66 56733 > http [ACK] Seq=97 Ack=205762 Win=363136 Len=0 TSval=36684944 TSecr=691412769
 82   0.053422 54.230.30.217 -> 172.31.36.109 TCP 5858 [TCP segment of a reassembled PDU]
 83   0.053428 172.31.36.109 -> 54.230.30.217 TCP 66 56733 > http [ACK] Seq=97 Ack=211554 Win=374784 Len=0 TSval=36684944 TSecr=691412769
 84   0.054062 54.230.30.217 -> 172.31.36.109 TCP 4410 [TCP segment of a reassembled PDU]
 85   0.054068 172.31.36.109 -> 54.230.30.217 TCP 66 56733 > http [ACK] Seq=97 Ack=215898 Win=383488 Len=0 TSval=36684945 TSecr=691412769
 86   0.054226 54.230.30.217 -> 172.31.36.109 TCP 10202 [TCP segment of a reassembled PDU]
 87   0.054233 172.31.36.109 -> 54.230.30.217 TCP 66 56733 > http [ACK] Seq=97 Ack=226034 Win=403712 Len=0 TSval=36684945 TSecr=691412769
 88   0.054253 54.230.30.217 -> 172.31.36.109 TCP 15994 [TCP segment of a reassembled PDU]
 89   0.054261 172.31.36.109 -> 54.230.30.217 TCP 66 56733 > http [ACK] Seq=97 Ack=241962 Win=435584 Len=0 TSval=36684945 TSecr=691412769
 90   0.054312 54.230.30.217 -> 172.31.36.109 TCP 4410 [TCP segment of a reassembled PDU]
 91   0.054319 172.31.36.109 -> 54.230.30.217 TCP 66 56733 > http [ACK] Seq=97 Ack=246306 Win=444288 Len=0 TSval=36684945 TSecr=691412769
 92   0.054405 54.230.30.217 -> 172.31.36.109 TCP 1514 [TCP segment of a reassembled PDU]
 93   0.054409 172.31.36.109 -> 54.230.30.217 TCP 66 56733 > http [ACK] Seq=97 Ack=247754 Win=447104 Len=0 TSval=36684945 TSecr=691412769
 94   0.054626 54.230.30.217 -> 172.31.36.109 TCP 5858 [TCP segment of a reassembled PDU]
 95   0.054633 172.31.36.109 -> 54.230.30.217 TCP 66 56733 > http [ACK] Seq=97 Ack=253546 Win=458752 Len=0 TSval=36684945 TSecr=691412769
 96   0.054826 54.230.30.217 -> 172.31.36.109 TCP 4410 [TCP segment of a reassembled PDU]
 97   0.054831 172.31.36.109 -> 54.230.30.217 TCP 66 56733 > http [ACK] Seq=97 Ack=257890 Win=467456 Len=0 TSval=36684945 TSecr=691412769
 98   0.054906 54.230.30.217 -> 172.31.36.109 TCP 4090 [TCP segment of a reassembled PDU]
 99   0.054911 172.31.36.109 -> 54.230.30.217 TCP 66 56733 > http [ACK] Seq=97 Ack=261914 Win=475520 Len=0 TSval=36684945 TSecr=691412769
100   0.061584 54.230.30.217 -> 172.31.36.109 TCP 11650 [TCP segment of a reassembled PDU]
101   0.061592 172.31.36.109 -> 54.230.30.217 TCP 66 56733 > http [ACK] Seq=97 Ack=273498 Win=498688 Len=0 TSval=36684946 TSecr=691412770
102   0.061603 54.230.30.217 -> 172.31.36.109 TCP 11650 [TCP segment of a reassembled PDU]
103   0.061623 172.31.36.109 -> 54.230.30.217 TCP 66 56733 > http [ACK] Seq=97 Ack=285082 Win=498688 Len=0 TSval=36684946 TSecr=691412770
104   0.061777 54.230.30.217 -> 172.31.36.109 TCP 4410 [TCP segment of a reassembled PDU]
105   0.061782 172.31.36.109 -> 54.230.30.217 TCP 66 56733 > http [ACK] Seq=97 Ack=289426 Win=507392 Len=0 TSval=36684946 TSecr=691412770
106   0.061789 54.230.30.217 -> 172.31.36.109 TCP 5858 [TCP segment of a reassembled PDU]
107   0.061793 172.31.36.109 -> 54.230.30.217 TCP 66 56733 > http [ACK] Seq=97 Ack=295218 Win=514944 Len=0 TSval=36684946 TSecr=691412770
108   0.061803 54.230.30.217 -> 172.31.36.109 TCP 7306 [TCP segment of a reassembled PDU]
109   0.061808 54.230.30.217 -> 172.31.36.109 TCP 1514 [TCP segment of a reassembled PDU]
110   0.061826 172.31.36.109 -> 54.230.30.217 TCP 66 56733 > http [ACK] Seq=97 Ack=303906 Win=517376 Len=0 TSval=36684947 TSecr=691412770
111   0.061993 54.230.30.217 -> 172.31.36.109 TCP 5858 [TCP segment of a reassembled PDU]
112   0.061999 172.31.36.109 -> 54.230.30.217 TCP 66 56733 > http [ACK] Seq=97 Ack=309698 Win=522112 Len=0 TSval=36684947 TSecr=691412770
113   0.062790 54.230.30.217 -> 172.31.36.109 TCP 4410 [TCP segment of a reassembled PDU]
114   0.062795 172.31.36.109 -> 54.230.30.217 TCP 66 56733 > http [ACK] Seq=97 Ack=314042 Win=524416 Len=0 TSval=36684947 TSecr=691412770
115   0.062895 54.230.30.217 -> 172.31.36.109 TCP 2962 [TCP segment of a reassembled PDU]
116   0.062900 172.31.36.109 -> 54.230.30.217 TCP 66 56733 > http [ACK] Seq=97 Ack=316938 Win=526848 Len=0 TSval=36684947 TSecr=691412770
117   0.063126 54.230.30.217 -> 172.31.36.109 TCP 21786 [TCP segment of a reassembled PDU]
118   0.063150 172.31.36.109 -> 54.230.30.217 TCP 66 56733 > http [ACK] Seq=97 Ack=338658 Win=505216 Len=0 TSval=36684947 TSecr=691412770
119   0.063189 54.230.30.217 -> 172.31.36.109 TCP 4410 [TCP segment of a reassembled PDU]
120   0.063194 172.31.36.109 -> 54.230.30.217 TCP 66 56733 > http [ACK] Seq=97 Ack=343002 Win=524416 Len=0 TSval=36684947 TSecr=691412770
121   0.063302 54.230.30.217 -> 172.31.36.109 TCP 4410 [TCP segment of a reassembled PDU]
122   0.063307 172.31.36.109 -> 54.230.30.217 TCP 66 56733 > http [ACK] Seq=97 Ack=347346 Win=524416 Len=0 TSval=36684947 TSecr=691412770
123   0.063470 54.230.30.217 -> 172.31.36.109 TCP 17442 [TCP segment of a reassembled PDU]
124   0.063492 172.31.36.109 -> 54.230.30.217 TCP 66 56733 > http [ACK] Seq=97 Ack=364722 Win=507136 Len=0 TSval=36684947 TSecr=691412770
125   0.064107 54.230.30.217 -> 172.31.36.109 TCP 1514 [TCP segment of a reassembled PDU]
126   0.064318 54.230.30.217 -> 172.31.36.109 TCP 17442 [TCP segment of a reassembled PDU]
127   0.064333 54.230.30.217 -> 172.31.36.109 TCP 8754 [TCP segment of a reassembled PDU]
128   0.064415 54.230.30.217 -> 172.31.36.109 TCP 818 [TCP segment of a reassembled PDU]
129   0.064580 172.31.36.109 -> 54.230.30.217 TCP 66 56733 > http [ACK] Seq=97 Ack=392986 Win=486272 Len=0 TSval=36684947 TSecr=691412770
130   0.065065 54.230.30.217 -> 172.31.36.109 TCP 1514 [TCP segment of a reassembled PDU]
131   0.065415 54.230.30.217 -> 172.31.36.109 TCP 8754 [TCP segment of a reassembled PDU]
132   0.065421 172.31.36.109 -> 54.230.30.217 TCP 66 56733 > http [ACK] Seq=97 Ack=403122 Win=517376 Len=0 TSval=36684947 TSecr=691412770
133   0.065434 54.230.30.217 -> 172.31.36.109 TCP 17442 [TCP segment of a reassembled PDU]
134   0.065463 172.31.36.109 -> 54.230.30.217 TCP 66 56733 > http [ACK] Seq=97 Ack=420498 Win=503040 Len=0 TSval=36684947 TSecr=691412770
135   0.065841 54.230.30.217 -> 172.31.36.109 TCP 4410 [TCP segment of a reassembled PDU]
136   0.065847 172.31.36.109 -> 54.230.30.217 TCP 66 56733 > http [ACK] Seq=97 Ack=424842 Win=524416 Len=0 TSval=36684948 TSecr=691412770
137   0.065984 54.230.30.217 -> 172.31.36.109 TCP 8754 [TCP segment of a reassembled PDU]
138   0.065991 172.31.36.109 -> 54.230.30.217 TCP 66 56733 > http [ACK] Seq=97 Ack=433530 Win=547072 Len=0 TSval=36684948 TSecr=691412770
139   0.066153 54.230.30.217 -> 172.31.36.109 TCP 14546 [TCP segment of a reassembled PDU]
140   0.066162 172.31.36.109 -> 54.230.30.217 TCP 66 56733 > http [ACK] Seq=97 Ack=448010 Win=576000 Len=0 TSval=36684948 TSecr=691412770
141   0.066257 54.230.30.217 -> 172.31.36.109 TCP 10578 [TCP segment of a reassembled PDU]
142   0.066265 172.31.36.109 -> 54.230.30.217 TCP 66 56733 > http [ACK] Seq=97 Ack=458522 Win=584704 Len=0 TSval=36684948 TSecr=691412770
143   0.069971 54.230.30.217 -> 172.31.36.109 TCP 1514 [TCP segment of a reassembled PDU]
144   0.069976 172.31.36.109 -> 54.230.30.217 TCP 66 56733 > http [ACK] Seq=97 Ack=459970 Win=599936 Len=0 TSval=36684949 TSecr=691412771
145   0.070441 54.230.30.217 -> 172.31.36.109 TCP 2962 [TCP segment of a reassembled PDU]
146   0.070469 172.31.36.109 -> 54.230.30.217 TCP 66 56733 > http [ACK] Seq=97 Ack=462866 Win=599936 Len=0 TSval=36684949 TSecr=691412771
147   0.070562 54.230.30.217 -> 172.31.36.109 TCP 14546 [TCP segment of a reassembled PDU]
148   0.070583 172.31.36.109 -> 54.230.30.217 TCP 66 56733 > http [ACK] Seq=97 Ack=477346 Win=599936 Len=0 TSval=36684949 TSecr=691412771
149   0.070632 54.230.30.217 -> 172.31.36.109 TCP 5858 [TCP segment of a reassembled PDU]
150   0.070650 172.31.36.109 -> 54.230.30.217 TCP 66 56733 > http [ACK] Seq=97 Ack=483138 Win=599936 Len=0 TSval=36684949 TSecr=691412771
151   0.070753 54.230.30.217 -> 172.31.36.109 TCP 4410 [TCP segment of a reassembled PDU]
152   0.070777 54.230.30.217 -> 172.31.36.109 TCP 7306 [TCP segment of a reassembled PDU]
153   0.070877 54.230.30.217 -> 172.31.36.109 TCP 4410 [TCP segment of a reassembled PDU]
154   0.070889 54.230.30.217 -> 172.31.36.109 TCP 11650 [TCP segment of a reassembled PDU]
155   0.070992 172.31.36.109 -> 54.230.30.217 TCP 66 56733 > http [ACK] Seq=97 Ack=510650 Win=584704 Len=0 TSval=36684949 TSecr=691412771
156   0.071028 54.230.30.217 -> 172.31.36.109 TCP 10202 [TCP segment of a reassembled PDU]
157   0.071036 172.31.36.109 -> 54.230.30.217 TCP 66 56733 > http [ACK] Seq=97 Ack=520786 Win=587008 Len=0 TSval=36684949 TSecr=691412771
158   0.071488 54.230.30.217 -> 172.31.36.109 TCP 2962 [TCP segment of a reassembled PDU]
159   0.071493 172.31.36.109 -> 54.230.30.217 TCP 66 56733 > http [ACK] Seq=97 Ack=523682 Win=598912 Len=0 TSval=36684949 TSecr=691412771
160   0.071691 54.230.30.217 -> 172.31.36.109 TCP 20338 [TCP segment of a reassembled PDU]
161   0.071713 172.31.36.109 -> 54.230.30.217 TCP 66 56733 > http [ACK] Seq=97 Ack=543954 Win=578688 Len=0 TSval=36684949 TSecr=691412771
162   0.072546 54.230.30.217 -> 172.31.36.109 TCP 1514 [TCP segment of a reassembled PDU]
163   0.072558 172.31.36.109 -> 54.230.30.217 TCP 66 56733 > http [ACK] Seq=97 Ack=545402 Win=601216 Len=0 TSval=36684949 TSecr=691412771
164   0.072793 54.230.30.217 -> 172.31.36.109 TCP 15994 [TCP segment of a reassembled PDU]
165   0.072829 54.230.30.217 -> 172.31.36.109 TCP 18890 [TCP segment of a reassembled PDU]
166   0.072851 172.31.36.109 -> 54.230.30.217 TCP 66 56733 > http [ACK] Seq=97 Ack=580154 Win=572672 Len=0 TSval=36684949 TSecr=691412771
167   0.072881 54.230.30.217 -> 172.31.36.109 TCP 8754 [TCP segment of a reassembled PDU]
168   0.072887 172.31.36.109 -> 54.230.30.217 TCP 66 56733 > http [ACK] Seq=97 Ack=588842 Win=589440 Len=0 TSval=36684949 TSecr=691412771
169   0.073135 54.230.30.217 -> 172.31.36.109 TCP 2266 [TCP segment of a reassembled PDU]
170   0.073147 172.31.36.109 -> 54.230.30.217 TCP 66 56733 > http [ACK] Seq=97 Ack=591042 Win=598912 Len=0 TSval=36684949 TSecr=691412771
171   0.073199 54.230.30.217 -> 172.31.36.109 TCP 30474 [TCP segment of a reassembled PDU]
172   0.073219 54.230.30.217 -> 172.31.36.109 TCP 7306 [TCP segment of a reassembled PDU]
173   0.073240 172.31.36.109 -> 54.230.30.217 TCP 66 56733 > http [ACK] Seq=97 Ack=628690 Win=561280 Len=0 TSval=36684949 TSecr=691412771
174   0.074198 54.230.30.217 -> 172.31.36.109 TCP 4410 [TCP segment of a reassembled PDU]
175   0.074224 172.31.36.109 -> 54.230.30.217 TCP 66 56733 > http [ACK] Seq=97 Ack=633034 Win=596480 Len=0 TSval=36684950 TSecr=691412771
176   0.074394 54.230.30.217 -> 172.31.36.109 TCP 22162 [TCP segment of a reassembled PDU]
177   0.074404 172.31.36.109 -> 54.230.30.217 TCP 66 56733 > http [ACK] Seq=97 Ack=655130 Win=647040 Len=0 TSval=36684950 TSecr=691412771
178   0.075278 54.230.30.217 -> 172.31.36.109 TCP 1514 [TCP segment of a reassembled PDU]
179   0.075283 172.31.36.109 -> 54.230.30.217 TCP 66 56733 > http [ACK] Seq=97 Ack=656578 Win=649984 Len=0 TSval=36684950 TSecr=691412771
180   0.075292 54.230.30.217 -> 172.31.36.109 TCP 10202 [TCP segment of a reassembled PDU]
181   0.075297 172.31.36.109 -> 54.230.30.217 TCP 66 56733 > http [ACK] Seq=97 Ack=666714 Win=670208 Len=0 TSval=36684950 TSecr=691412771
182   0.075306 54.230.30.217 -> 172.31.36.109 TCP 4410 [TCP segment of a reassembled PDU]
183   0.075310 172.31.36.109 -> 54.230.30.217 TCP 66 56733 > http [ACK] Seq=97 Ack=671058 Win=678912 Len=0 TSval=36684950 TSecr=691412771
184   0.075699 54.230.30.217 -> 172.31.36.109 TCP 4410 [TCP segment of a reassembled PDU]
185   0.075705 172.31.36.109 -> 54.230.30.217 TCP 66 56733 > http [ACK] Seq=97 Ack=675402 Win=687616 Len=0 TSval=36684950 TSecr=691412771
186   0.075875 54.230.30.217 -> 172.31.36.109 TCP 24682 [TCP segment of a reassembled PDU]
187   0.075887 172.31.36.109 -> 54.230.30.217 TCP 66 56733 > http [ACK] Seq=97 Ack=700018 Win=698368 Len=0 TSval=36684950 TSecr=691412771
188   0.076030 54.230.30.217 -> 172.31.36.109 TCP 5858 [TCP segment of a reassembled PDU]
189   0.076036 172.31.36.109 -> 54.230.30.217 TCP 66 56733 > http [ACK] Seq=97 Ack=705810 Win=729344 Len=0 TSval=36684950 TSecr=691412771
190   0.076051 54.230.30.217 -> 172.31.36.109 TCP 24682 [TCP segment of a reassembled PDU]
191   0.076082 172.31.36.109 -> 54.230.30.217 TCP 66 56733 > http [ACK] Seq=97 Ack=730426 Win=704768 Len=0 TSval=36684950 TSecr=691412771
192   0.076547 54.230.30.217 -> 172.31.36.109 TCP 2962 [TCP segment of a reassembled PDU]
193   0.076553 172.31.36.109 -> 54.230.30.217 TCP 66 56733 > http [ACK] Seq=97 Ack=733322 Win=734080 Len=0 TSval=36684950 TSecr=691412772
194   0.076795 54.230.30.217 -> 172.31.36.109 TCP 29026 [TCP segment of a reassembled PDU]
195   0.076820 172.31.36.109 -> 54.230.30.217 TCP 66 56733 > http [ACK] Seq=97 Ack=762282 Win=705152 Len=0 TSval=36684950 TSecr=691412772
196   0.076943 54.230.30.217 -> 172.31.36.109 TCP 7306 [TCP segment of a reassembled PDU]
197   0.076949 172.31.36.109 -> 54.230.30.217 TCP 66 56733 > http [ACK] Seq=97 Ack=769522 Win=726912 Len=0 TSval=36684950 TSecr=691412772
198   0.077315 54.230.30.217 -> 172.31.36.109 TCP 4410 [TCP segment of a reassembled PDU]
199   0.077320 172.31.36.109 -> 54.230.30.217 TCP 66 56733 > http [ACK] Seq=97 Ack=773866 Win=731648 Len=0 TSval=36684950 TSecr=691412772
200   0.077453 54.230.30.217 -> 172.31.36.109 TCP 12402 [TCP segment of a reassembled PDU]
201   0.077476 172.31.36.109 -> 54.230.30.217 TCP 66 56733 > http [ACK] Seq=97 Ack=786202 Win=734080 Len=0 TSval=36684950 TSecr=691412772
202   0.077678 54.230.30.217 -> 172.31.36.109 TCP 1514 [TCP segment of a reassembled PDU]
203   0.078101 54.230.30.217 -> 172.31.36.109 TCP 4410 [TCP segment of a reassembled PDU]
204   0.078117 172.31.36.109 -> 54.230.30.217 TCP 66 56733 > http [ACK] Seq=97 Ack=791994 Win=734080 Len=0 TSval=36684951 TSecr=691412772
205   0.078213 54.230.30.217 -> 172.31.36.109 TCP 11650 [TCP segment of a reassembled PDU]
206   0.078233 172.31.36.109 -> 54.230.30.217 TCP 66 56733 > http [ACK] Seq=97 Ack=803578 Win=734080 Len=0 TSval=36684951 TSecr=691412772
207   0.078475 54.230.30.217 -> 172.31.36.109 TCP 11650 [TCP segment of a reassembled PDU]
208   0.078491 54.230.30.217 -> 172.31.36.109 TCP 10202 [TCP segment of a reassembled PDU]
209   0.078509 172.31.36.109 -> 54.230.30.217 TCP 66 56733 > http [ACK] Seq=97 Ack=825298 Win=722176 Len=0 TSval=36684951 TSecr=691412772
210   0.078572 54.230.30.217 -> 172.31.36.109 TCP 8754 [TCP segment of a reassembled PDU]
211   0.078579 172.31.36.109 -> 54.230.30.217 TCP 66 56733 > http [ACK] Seq=97 Ack=833986 Win=724608 Len=0 TSval=36684951 TSecr=691412772
212   0.078592 54.230.30.217 -> 172.31.36.109 TCP 10202 [TCP segment of a reassembled PDU]
213   0.078645 54.230.30.217 -> 172.31.36.109 TCP 10202 [TCP segment of a reassembled PDU]
214   0.078788 172.31.36.109 -> 54.230.30.217 TCP 66 56733 > http [ACK] Seq=97 Ack=854258 Win=705536 Len=0 TSval=36684951 TSecr=691412772
215   0.079026 54.230.30.217 -> 172.31.36.109 TCP 8754 [TCP segment of a reassembled PDU]
216   0.079034 172.31.36.109 -> 54.230.30.217 TCP 66 56733 > http [ACK] Seq=97 Ack=862946 Win=724608 Len=0 TSval=36684951 TSecr=691412772
217   0.079186 54.230.30.217 -> 172.31.36.109 TCP 23234 [TCP segment of a reassembled PDU]
218   0.079209 172.31.36.109 -> 54.230.30.217 TCP 66 56733 > http [ACK] Seq=97 Ack=886114 Win=701440 Len=0 TSval=36684951 TSecr=691412772
219   0.079284 54.230.30.217 -> 172.31.36.109 TCP 15994 [TCP segment of a reassembled PDU]
220   0.079294 172.31.36.109 -> 54.230.30.217 TCP 66 56733 > http [ACK] Seq=97 Ack=902042 Win=712576 Len=0 TSval=36684951 TSecr=691412772
221   0.079413 54.230.30.217 -> 172.31.36.109 TCP 1514 [TCP segment of a reassembled PDU]
222   0.079794 54.230.30.217 -> 172.31.36.109 TCP 2962 [TCP segment of a reassembled PDU]
223   0.079799 172.31.36.109 -> 54.230.30.217 TCP 66 56733 > http [ACK] Seq=97 Ack=906386 Win=734080 Len=0 TSval=36684951 TSecr=691412772
224   0.079921 54.230.30.217 -> 172.31.36.109 TCP 21786 [TCP segment of a reassembled PDU]
225   0.079944 172.31.36.109 -> 54.230.30.217 TCP 66 56733 > http [ACK] Seq=97 Ack=928106 Win=712448 Len=0 TSval=36684951 TSecr=691412772
226   0.080095 54.230.30.217 -> 172.31.36.109 TCP 10202 [TCP segment of a reassembled PDU]
227   0.080103 172.31.36.109 -> 54.230.30.217 TCP 66 56733 > http [ACK] Seq=97 Ack=938242 Win=722176 Len=0 TSval=36684951 TSecr=691412772
228   0.080222 54.230.30.217 -> 172.31.36.109 TCP 18890 [TCP segment of a reassembled PDU]
229   0.080257 172.31.36.109 -> 54.230.30.217 TCP 66 56733 > http [ACK] Seq=97 Ack=957066 Win=707840 Len=0 TSval=36684951 TSecr=691412772
230   0.080307 54.230.30.217 -> 172.31.36.109 TCP 8754 [TCP segment of a reassembled PDU]
231   0.080314 172.31.36.109 -> 54.230.30.217 TCP 66 56733 > http [ACK] Seq=97 Ack=965754 Win=724608 Len=0 TSval=36684951 TSecr=691412772
232   0.080383 54.230.30.217 -> 172.31.36.109 TCP 2962 [TCP segment of a reassembled PDU]
233   0.080480 172.31.36.109 -> 54.230.30.217 TCP 66 56733 > http [ACK] Seq=97 Ack=968650 Win=734080 Len=0 TSval=36684951 TSecr=691412772
234   0.080630 54.230.30.217 -> 172.31.36.109 TCP 15994 [TCP segment of a reassembled PDU]
235   0.080653 172.31.36.109 -> 54.230.30.217 TCP 66 56733 > http [ACK] Seq=97 Ack=984578 Win=734080 Len=0 TSval=36684951 TSecr=691412772
236   0.080742 54.230.30.217 -> 172.31.36.109 TCP 8754 [TCP segment of a reassembled PDU]
237   0.080760 172.31.36.109 -> 54.230.30.217 TCP 66 56733 > http [ACK] Seq=97 Ack=993266 Win=734080 Len=0 TSval=36684951 TSecr=691412772
238   0.080830 54.230.30.217 -> 172.31.36.109 TCP 1514 [TCP segment of a reassembled PDU]
239   0.080972 54.230.30.217 -> 172.31.36.109 TCP 18890 [TCP segment of a reassembled PDU]
240   0.080994 172.31.36.109 -> 54.230.30.217 TCP 66 56733 > http [ACK] Seq=97 Ack=1013538 Win=713856 Len=0 TSval=36684951 TSecr=691412772
241   0.081154 54.230.30.217 -> 172.31.36.109 TCP 4410 [TCP segment of a reassembled PDU]
242   0.081159 172.31.36.109 -> 54.230.30.217 TCP 66 56733 > http [ACK] Seq=97 Ack=1017882 Win=731648 Len=0 TSval=36684951 TSecr=691412772
243   0.081289 54.230.30.217 -> 172.31.36.109 TCP 18890 [TCP segment of a reassembled PDU]
244   0.081311 172.31.36.109 -> 54.230.30.217 TCP 66 56733 > http [ACK] Seq=97 Ack=1036706 Win=712832 Len=0 TSval=36684951 TSecr=691412772
245   0.081384 54.230.30.217 -> 172.31.36.109 TCP 7306 [TCP segment of a reassembled PDU]
246   0.081391 172.31.36.109 -> 54.230.30.217 TCP 66 56733 > http [ACK] Seq=97 Ack=1043946 Win=726912 Len=0 TSval=36684951 TSecr=691412772
247   0.081466 54.230.30.217 -> 172.31.36.109 TCP 1514 [TCP segment of a reassembled PDU]
248   0.081573 54.230.30.217 -> 172.31.36.109 HTTP 3706 HTTP/1.1 200 OK  (application/octet-stream)
249   0.081579 172.31.36.109 -> 54.230.30.217 TCP 66 56733 > http [ACK] Seq=97 Ack=1049034 Win=731648 Len=0 TSval=36684951 TSecr=691412772
250   0.081710 172.31.36.109 -> 54.230.30.217 TCP 66 56733 > http [FIN, ACK] Seq=97 Ack=1049034 Win=734080 Len=0 TSval=36684951 TSecr=691412772
251   0.083339 54.230.30.217 -> 172.31.36.109 TCP 66 http > 56733 [FIN, ACK] Seq=1049034 Ack=98 Win=14592 Len=0 TSval=691412772 TSecr=36684951
252   0.083348 172.31.36.109 -> 54.230.30.217 TCP 66 56733 > http [ACK] Seq=98 Ack=1049035 Win=734080 Len=0 TSval=36684952 TSecr=691412772
