[Measurement for 1mb at 18:32:49 19.32.2014] 
Tshark:

  1   0.000000 172.31.36.109 -> 172.31.0.2   DNS 89 Standard query 0x8a6f  A d3796nkzln59xv.cloudfront.net
  2   0.000036 172.31.36.109 -> 172.31.0.2   DNS 89 Standard query 0xf8e7  AAAA d3796nkzln59xv.cloudfront.net
  3   0.000503   172.31.0.2 -> 172.31.36.109 DNS 170 Standard query response 0xf8e7 
  4   0.000513   172.31.0.2 -> 172.31.36.109 DNS 217 Standard query response 0x8a6f  A 54.192.30.192 A 54.192.30.224 A 54.192.30.228 A 54.230.30.53 A 54.230.30.203 A 54.230.30.204 A 54.230.30.219 A 54.192.30.138
  5   0.003892 172.31.36.109 -> 54.192.30.192 TCP 74 45949 > http [SYN] Seq=0 Win=26883 Len=0 MSS=8961 SACK_PERM=1 TSval=21413885 TSecr=0 WS=128
  6   0.005153 54.192.30.192 -> 172.31.36.109 TCP 74 http > 45949 [SYN, ACK] Seq=0 Ack=1 Win=14480 Len=0 MSS=1460 SACK_PERM=1 TSval=693686830 TSecr=21413885 WS=128
  7   0.005167 172.31.36.109 -> 54.192.30.192 TCP 66 45949 > http [ACK] Seq=1 Ack=1 Win=27008 Len=0 TSval=21413885 TSecr=693686830
  8   0.005206 172.31.36.109 -> 54.192.30.192 HTTP 162 GET /1mb HTTP/1.1 
  9   0.006245 54.192.30.192 -> 172.31.36.109 TCP 66 http > 45949 [ACK] Seq=1 Ack=97 Win=14592 Len=0 TSval=693686831 TSecr=21413885
 10   0.040982 54.192.30.192 -> 172.31.36.109 TCP 14177 [TCP segment of a reassembled PDU]
 11   0.040995 172.31.36.109 -> 54.192.30.192 TCP 66 45949 > http [ACK] Seq=97 Ack=14112 Win=55168 Len=0 TSval=21413894 TSecr=693686834
 12   0.042204 54.192.30.192 -> 172.31.36.109 TCP 4410 [TCP segment of a reassembled PDU]
 13   0.042211 172.31.36.109 -> 54.192.30.192 TCP 66 45949 > http [ACK] Seq=97 Ack=18456 Win=63872 Len=0 TSval=21413895 TSecr=693686834
 14   0.042236 54.192.30.192 -> 172.31.36.109 TCP 8754 [TCP segment of a reassembled PDU]
 15   0.042254 172.31.36.109 -> 54.192.30.192 TCP 66 45949 > http [ACK] Seq=97 Ack=27144 Win=81280 Len=0 TSval=21413895 TSecr=693686834
 16   0.043580 54.192.30.192 -> 172.31.36.109 TCP 7306 [TCP segment of a reassembled PDU]
 17   0.043588 172.31.36.109 -> 54.192.30.192 TCP 66 45949 > http [ACK] Seq=97 Ack=34384 Win=95744 Len=0 TSval=21413895 TSecr=693686834
 18   0.043596 54.192.30.192 -> 172.31.36.109 TCP 4410 [TCP segment of a reassembled PDU]
 19   0.043599 172.31.36.109 -> 54.192.30.192 TCP 66 45949 > http [ACK] Seq=97 Ack=38728 Win=98944 Len=0 TSval=21413895 TSecr=693686834
 20   0.043700 54.192.30.192 -> 172.31.36.109 TCP 1514 [TCP segment of a reassembled PDU]
 21   0.043705 172.31.36.109 -> 54.192.30.192 TCP 66 45949 > http [ACK] Seq=97 Ack=40176 Win=107264 Len=0 TSval=21413895 TSecr=693686834
 22   0.044743 54.192.30.192 -> 172.31.36.109 TCP 1514 [TCP segment of a reassembled PDU]
 23   0.044747 172.31.36.109 -> 54.192.30.192 TCP 66 45949 > http [ACK] Seq=97 Ack=41624 Win=109056 Len=0 TSval=21413895 TSecr=693686834
 24   0.044821 54.192.30.192 -> 172.31.36.109 TCP 8754 [TCP segment of a reassembled PDU]
 25   0.044828 172.31.36.109 -> 54.192.30.192 TCP 66 45949 > http [ACK] Seq=97 Ack=50312 Win=126464 Len=0 TSval=21413895 TSecr=693686834
 26   0.044857 54.192.30.192 -> 172.31.36.109 TCP 2962 [TCP segment of a reassembled PDU]
 27   0.044862 172.31.36.109 -> 54.192.30.192 TCP 66 45949 > http [ACK] Seq=97 Ack=53208 Win=132224 Len=0 TSval=21413895 TSecr=693686834
 28   0.044907 54.192.30.192 -> 172.31.36.109 TCP 7306 [TCP segment of a reassembled PDU]
 29   0.044913 172.31.36.109 -> 54.192.30.192 TCP 66 45949 > http [ACK] Seq=97 Ack=60448 Win=146688 Len=0 TSval=21413895 TSecr=693686834
 30   0.046022 54.192.30.192 -> 172.31.36.109 TCP 4923 [TCP segment of a reassembled PDU]
 31   0.046028 172.31.36.109 -> 54.192.30.192 TCP 66 45949 > http [ACK] Seq=97 Ack=65305 Win=156416 Len=0 TSval=21413896 TSecr=693686835
 32   0.063887 54.192.30.192 -> 172.31.36.109 TCP 1514 [TCP segment of a reassembled PDU]
 33   0.063893 172.31.36.109 -> 54.192.30.192 TCP 66 45949 > http [ACK] Seq=97 Ack=66753 Win=159360 Len=0 TSval=21413900 TSecr=693686836
 34   0.063971 54.192.30.192 -> 172.31.36.109 TCP 2962 [TCP segment of a reassembled PDU]
 35   0.063976 172.31.36.109 -> 54.192.30.192 TCP 66 45949 > http [ACK] Seq=97 Ack=69649 Win=165120 Len=0 TSval=21413900 TSecr=693686836
 36   0.064229 54.192.30.192 -> 172.31.36.109 TCP 14546 [TCP segment of a reassembled PDU]
 37   0.064238 172.31.36.109 -> 54.192.30.192 TCP 66 45949 > http [ACK] Seq=97 Ack=84129 Win=174336 Len=0 TSval=21413900 TSecr=693686836
 38   0.065167 54.192.30.192 -> 172.31.36.109 TCP 1514 [TCP segment of a reassembled PDU]
 39   0.065171 172.31.36.109 -> 54.192.30.192 TCP 66 45949 > http [ACK] Seq=97 Ack=85577 Win=195840 Len=0 TSval=21413900 TSecr=693686836
 40   0.065320 54.192.30.192 -> 172.31.36.109 TCP 13098 [TCP segment of a reassembled PDU]
 41   0.065329 172.31.36.109 -> 54.192.30.192 TCP 66 45949 > http [ACK] Seq=97 Ack=98609 Win=182912 Len=0 TSval=21413900 TSecr=693686836
 42   0.065457 54.192.30.192 -> 172.31.36.109 TCP 2962 [TCP segment of a reassembled PDU]
 43   0.065462 172.31.36.109 -> 54.192.30.192 TCP 66 45949 > http [ACK] Seq=97 Ack=101505 Win=193408 Len=0 TSval=21413901 TSecr=693686836
 44   0.065589 54.192.30.192 -> 172.31.36.109 TCP 13098 [TCP segment of a reassembled PDU]
 45   0.065616 172.31.36.109 -> 54.192.30.192 TCP 66 45949 > http [ACK] Seq=97 Ack=114537 Win=222976 Len=0 TSval=21413901 TSecr=693686836
 46   0.066639 54.192.30.192 -> 172.31.36.109 TCP 5858 [TCP segment of a reassembled PDU]
 47   0.066645 172.31.36.109 -> 54.192.30.192 TCP 66 45949 > http [ACK] Seq=97 Ack=120329 Win=234624 Len=0 TSval=21413901 TSecr=693686837
 48   0.066741 54.192.30.192 -> 172.31.36.109 TCP 10202 [TCP segment of a reassembled PDU]
 49   0.066750 172.31.36.109 -> 54.192.30.192 TCP 66 45949 > http [ACK] Seq=97 Ack=130465 Win=254848 Len=0 TSval=21413901 TSecr=693686837
 50   0.066766 54.192.30.192 -> 172.31.36.109 TCP 1514 [TCP segment of a reassembled PDU]
 51   0.066771 172.31.36.109 -> 54.192.30.192 TCP 66 45949 > http [ACK] Seq=97 Ack=131913 Win=257792 Len=0 TSval=21413901 TSecr=693686837
 52   0.066860 54.192.30.192 -> 172.31.36.109 TCP 17442 [TCP segment of a reassembled PDU]
 53   0.066880 172.31.36.109 -> 54.192.30.192 TCP 66 45949 > http [ACK] Seq=97 Ack=149289 Win=267648 Len=0 TSval=21413901 TSecr=693686837
 54   0.066986 54.192.30.192 -> 172.31.36.109 TCP 1514 [TCP segment of a reassembled PDU]
 55   0.066990 172.31.36.109 -> 54.192.30.192 TCP 66 45949 > http [ACK] Seq=97 Ack=150737 Win=266240 Len=0 TSval=21413901 TSecr=693686837
 56   0.067849 54.192.30.192 -> 172.31.36.109 TCP 2962 [TCP segment of a reassembled PDU]
 57   0.067881 172.31.36.109 -> 54.192.30.192 TCP 66 45949 > http [ACK] Seq=97 Ack=153633 Win=298368 Len=0 TSval=21413901 TSecr=693686837
 58   0.068007 54.192.30.192 -> 172.31.36.109 TCP 8754 [TCP segment of a reassembled PDU]
 59   0.068035 172.31.36.109 -> 54.192.30.192 TCP 66 45949 > http [ACK] Seq=97 Ack=162321 Win=301056 Len=0 TSval=21413901 TSecr=693686837
 60   0.068046 54.192.30.192 -> 172.31.36.109 TCP 7306 [TCP segment of a reassembled PDU]
 61   0.068050 172.31.36.109 -> 54.192.30.192 TCP 66 45949 > http [ACK] Seq=97 Ack=169561 Win=293888 Len=0 TSval=21413901 TSecr=693686837
 62   0.068285 54.192.30.192 -> 172.31.36.109 TCP 10202 [TCP segment of a reassembled PDU]
 63   0.068293 172.31.36.109 -> 54.192.30.192 TCP 66 45949 > http [ACK] Seq=97 Ack=179697 Win=298752 Len=0 TSval=21413901 TSecr=693686837
 64   0.068304 54.192.30.192 -> 172.31.36.109 TCP 2962 [TCP segment of a reassembled PDU]
 65   0.068307 172.31.36.109 -> 54.192.30.192 TCP 66 45949 > http [ACK] Seq=97 Ack=182593 Win=295936 Len=0 TSval=21413901 TSecr=693686837
 66   0.068554 54.192.30.192 -> 172.31.36.109 TCP 11650 [TCP segment of a reassembled PDU]
 67   0.068562 172.31.36.109 -> 54.192.30.192 TCP 66 45949 > http [ACK] Seq=97 Ack=194177 Win=296320 Len=0 TSval=21413901 TSecr=693686837
 68   0.069280 54.192.30.192 -> 172.31.36.109 TCP 7306 [TCP segment of a reassembled PDU]
 69   0.069287 172.31.36.109 -> 54.192.30.192 TCP 66 45949 > http [ACK] Seq=97 Ack=201417 Win=303488 Len=0 TSval=21413901 TSecr=693686837
 70   0.069415 54.192.30.192 -> 172.31.36.109 TCP 15994 [TCP segment of a reassembled PDU]
 71   0.069443 172.31.36.109 -> 54.192.30.192 TCP 66 45949 > http [ACK] Seq=97 Ack=217345 Win=315648 Len=0 TSval=21413902 TSecr=693686837
 72   0.069823 54.192.30.192 -> 172.31.36.109 TCP 4410 [TCP segment of a reassembled PDU]
 73   0.069828 172.31.36.109 -> 54.192.30.192 TCP 66 45949 > http [ACK] Seq=97 Ack=221689 Win=324352 Len=0 TSval=21413902 TSecr=693686837
 74   0.070002 54.192.30.192 -> 172.31.36.109 TCP 20338 [TCP segment of a reassembled PDU]
 75   0.070033 172.31.36.109 -> 54.192.30.192 TCP 66 45949 > http [ACK] Seq=97 Ack=241961 Win=364928 Len=0 TSval=21413902 TSecr=693686837
 76   0.070040 54.192.30.192 -> 172.31.36.109 TCP 2962 [TCP segment of a reassembled PDU]
 77   0.070043 172.31.36.109 -> 54.192.30.192 TCP 66 45949 > http [ACK] Seq=97 Ack=244857 Win=370688 Len=0 TSval=21413902 TSecr=693686837
 78   0.070782 54.192.30.192 -> 172.31.36.109 TCP 4410 [TCP segment of a reassembled PDU]
 79   0.070796 172.31.36.109 -> 54.192.30.192 TCP 66 45949 > http [ACK] Seq=97 Ack=249201 Win=379392 Len=0 TSval=21413902 TSecr=693686837
 80   0.070950 54.192.30.192 -> 172.31.36.109 TCP 12778 [TCP segment of a reassembled PDU]
 81   0.070958 172.31.36.109 -> 54.192.30.192 TCP 66 45949 > http [ACK] Seq=97 Ack=261913 Win=404864 Len=0 TSval=21413902 TSecr=693686837
 82   0.097673 54.192.30.192 -> 172.31.36.109 TCP 4410 [TCP segment of a reassembled PDU]
 83   0.097700 172.31.36.109 -> 54.192.30.192 TCP 66 45949 > http [ACK] Seq=97 Ack=266257 Win=413568 Len=0 TSval=21413909 TSecr=693686840
 84   0.097737 54.192.30.192 -> 172.31.36.109 TCP 8754 [TCP segment of a reassembled PDU]
 85   0.097745 172.31.36.109 -> 54.192.30.192 TCP 66 45949 > http [ACK] Seq=97 Ack=274945 Win=430848 Len=0 TSval=21413909 TSecr=693686840
 86   0.097786 54.192.30.192 -> 172.31.36.109 TCP 7306 [TCP segment of a reassembled PDU]
 87   0.097792 172.31.36.109 -> 54.192.30.192 TCP 66 45949 > http [ACK] Seq=97 Ack=282185 Win=445440 Len=0 TSval=21413909 TSecr=693686840
 88   0.098003 54.192.30.192 -> 172.31.36.109 TCP 17442 [TCP segment of a reassembled PDU]
 89   0.098013 172.31.36.109 -> 54.192.30.192 TCP 66 45949 > http [ACK] Seq=97 Ack=299561 Win=480128 Len=0 TSval=21413909 TSecr=693686840
 90   0.098026 54.192.30.192 -> 172.31.36.109 TCP 4410 [TCP segment of a reassembled PDU]
 91   0.098030 172.31.36.109 -> 54.192.30.192 TCP 66 45949 > http [ACK] Seq=97 Ack=303905 Win=488832 Len=0 TSval=21413909 TSecr=693686840
 92   0.098273 54.192.30.192 -> 172.31.36.109 TCP 10202 [TCP segment of a reassembled PDU]
 93   0.098306 172.31.36.109 -> 54.192.30.192 TCP 66 45949 > http [ACK] Seq=97 Ack=314041 Win=509056 Len=0 TSval=21413909 TSecr=693686840
 94   0.098701 54.192.30.192 -> 172.31.36.109 TCP 5858 [TCP segment of a reassembled PDU]
 95   0.098716 172.31.36.109 -> 54.192.30.192 TCP 66 45949 > http [ACK] Seq=97 Ack=319833 Win=520704 Len=0 TSval=21413909 TSecr=693686840
 96   0.098956 54.192.30.192 -> 172.31.36.109 TCP 5858 [TCP segment of a reassembled PDU]
 97   0.098972 172.31.36.109 -> 54.192.30.192 TCP 66 45949 > http [ACK] Seq=97 Ack=325625 Win=532224 Len=0 TSval=21413909 TSecr=693686840
 98   0.099135 54.192.30.192 -> 172.31.36.109 TCP 18890 [TCP segment of a reassembled PDU]
 99   0.099146 172.31.36.109 -> 54.192.30.192 TCP 66 45949 > http [ACK] Seq=97 Ack=344449 Win=569856 Len=0 TSval=21413909 TSecr=693686840
100   0.099281 54.192.30.192 -> 172.31.36.109 TCP 4410 [TCP segment of a reassembled PDU]
101   0.099296 172.31.36.109 -> 54.192.30.192 TCP 66 45949 > http [ACK] Seq=97 Ack=348793 Win=578560 Len=0 TSval=21413909 TSecr=693686840
102   0.099455 54.192.30.192 -> 172.31.36.109 TCP 7306 [TCP segment of a reassembled PDU]
103   0.099475 172.31.36.109 -> 54.192.30.192 TCP 66 45949 > http [ACK] Seq=97 Ack=356033 Win=593024 Len=0 TSval=21413909 TSecr=693686840
104   0.099623 54.192.30.192 -> 172.31.36.109 TCP 13098 [TCP segment of a reassembled PDU]
105   0.099651 172.31.36.109 -> 54.192.30.192 TCP 66 45949 > http [ACK] Seq=97 Ack=369065 Win=619136 Len=0 TSval=21413909 TSecr=693686840
106   0.100000 54.192.30.192 -> 172.31.36.109 TCP 4410 [TCP segment of a reassembled PDU]
107   0.100006 172.31.36.109 -> 54.192.30.192 TCP 66 45949 > http [ACK] Seq=97 Ack=373409 Win=627840 Len=0 TSval=21413909 TSecr=693686840
108   0.100106 54.192.30.192 -> 172.31.36.109 TCP 11650 [TCP segment of a reassembled PDU]
109   0.100114 172.31.36.109 -> 54.192.30.192 TCP 66 45949 > http [ACK] Seq=97 Ack=384993 Win=651008 Len=0 TSval=21413909 TSecr=693686840
110   0.100515 54.192.30.192 -> 172.31.36.109 TCP 4410 [TCP segment of a reassembled PDU]
111   0.100531 172.31.36.109 -> 54.192.30.192 TCP 66 45949 > http [ACK] Seq=97 Ack=389337 Win=659712 Len=0 TSval=21413909 TSecr=693686840
112   0.100741 54.192.30.192 -> 172.31.36.109 TCP 21786 [TCP segment of a reassembled PDU]
113   0.100752 172.31.36.109 -> 54.192.30.192 TCP 66 45949 > http [ACK] Seq=97 Ack=411057 Win=703104 Len=0 TSval=21413909 TSecr=693686840
114   0.100885 54.192.30.192 -> 172.31.36.109 TCP 15994 [TCP segment of a reassembled PDU]
115   0.100894 172.31.36.109 -> 54.192.30.192 TCP 66 45949 > http [ACK] Seq=97 Ack=426985 Win=721664 Len=0 TSval=21413909 TSecr=693686840
116   0.101006 54.192.30.192 -> 172.31.36.109 TCP 10202 [TCP segment of a reassembled PDU]
117   0.101013 172.31.36.109 -> 54.192.30.192 TCP 66 45949 > http [ACK] Seq=97 Ack=437121 Win=731264 Len=0 TSval=21413909 TSecr=693686840
118   0.101109 54.192.30.192 -> 172.31.36.109 TCP 7306 [TCP segment of a reassembled PDU]
119   0.101124 172.31.36.109 -> 54.192.30.192 TCP 66 45949 > http [ACK] Seq=97 Ack=444361 Win=736000 Len=0 TSval=21413909 TSecr=693686840
120   0.101813 54.192.30.192 -> 172.31.36.109 TCP 4410 [TCP segment of a reassembled PDU]
121   0.101819 172.31.36.109 -> 54.192.30.192 TCP 66 45949 > http [ACK] Seq=97 Ack=448705 Win=740736 Len=0 TSval=21413910 TSecr=693686840
122   0.102094 54.192.30.192 -> 172.31.36.109 TCP 9882 [TCP segment of a reassembled PDU]
123   0.102134 172.31.36.109 -> 54.192.30.192 TCP 66 45949 > http [ACK] Seq=97 Ack=458521 Win=747904 Len=0 TSval=21413910 TSecr=693686840
124   0.117934 54.192.30.192 -> 172.31.36.109 TCP 4410 [TCP segment of a reassembled PDU]
125   0.117970 172.31.36.109 -> 54.192.30.192 TCP 66 45949 > http [ACK] Seq=97 Ack=462865 Win=749440 Len=0 TSval=21413914 TSecr=693686842
126   0.118034 54.192.30.192 -> 172.31.36.109 TCP 2962 [TCP segment of a reassembled PDU]
127   0.118039 172.31.36.109 -> 54.192.30.192 TCP 66 45949 > http [ACK] Seq=97 Ack=465761 Win=755200 Len=0 TSval=21413914 TSecr=693686842
128   0.118046 54.192.30.192 -> 172.31.36.109 TCP 2962 [TCP segment of a reassembled PDU]
129   0.118049 172.31.36.109 -> 54.192.30.192 TCP 66 45949 > http [ACK] Seq=97 Ack=468657 Win=761088 Len=0 TSval=21413914 TSecr=693686842
130   0.118121 54.192.30.192 -> 172.31.36.109 TCP 2962 [TCP segment of a reassembled PDU]
131   0.118126 172.31.36.109 -> 54.192.30.192 TCP 66 45949 > http [ACK] Seq=97 Ack=471553 Win=766848 Len=0 TSval=21413914 TSecr=693686842
132   0.118148 54.192.30.192 -> 172.31.36.109 TCP 1514 [TCP segment of a reassembled PDU]
133   0.118152 172.31.36.109 -> 54.192.30.192 TCP 66 45949 > http [ACK] Seq=97 Ack=473001 Win=769792 Len=0 TSval=21413914 TSecr=693686842
134   0.118280 54.192.30.192 -> 172.31.36.109 TCP 15994 [TCP segment of a reassembled PDU]
135   0.118306 172.31.36.109 -> 54.192.30.192 TCP 66 45949 > http [ACK] Seq=97 Ack=488929 Win=801536 Len=0 TSval=21413914 TSecr=693686842
136   0.118556 54.192.30.192 -> 172.31.36.109 TCP 7306 [TCP segment of a reassembled PDU]
137   0.118572 172.31.36.109 -> 54.192.30.192 TCP 66 45949 > http [ACK] Seq=97 Ack=496169 Win=816128 Len=0 TSval=21413914 TSecr=693686842
138   0.118618 54.192.30.192 -> 172.31.36.109 TCP 20338 [TCP segment of a reassembled PDU]
139   0.118632 172.31.36.109 -> 54.192.30.192 TCP 66 45949 > http [ACK] Seq=97 Ack=516441 Win=856576 Len=0 TSval=21413914 TSecr=693686842
140   0.119206 54.192.30.192 -> 172.31.36.109 TCP 1514 [TCP segment of a reassembled PDU]
141   0.119212 172.31.36.109 -> 54.192.30.192 TCP 66 45949 > http [ACK] Seq=97 Ack=517889 Win=859520 Len=0 TSval=21413914 TSecr=693686842
142   0.119337 54.192.30.192 -> 172.31.36.109 TCP 6234 [TCP segment of a reassembled PDU]
143   0.119344 172.31.36.109 -> 54.192.30.192 TCP 66 45949 > http [ACK] Seq=97 Ack=524057 Win=871808 Len=0 TSval=21413914 TSecr=693686842
144   0.119433 54.192.30.192 -> 172.31.36.109 TCP 1514 [TCP segment of a reassembled PDU]
145   0.119437 172.31.36.109 -> 54.192.30.192 TCP 66 45949 > http [ACK] Seq=97 Ack=525505 Win=874752 Len=0 TSval=21413914 TSecr=693686842
146   0.119786 54.192.30.192 -> 172.31.36.109 TCP 5858 [TCP segment of a reassembled PDU]
147   0.119792 172.31.36.109 -> 54.192.30.192 TCP 66 45949 > http [ACK] Seq=97 Ack=531297 Win=886272 Len=0 TSval=21413914 TSecr=693686842
148   0.119987 54.192.30.192 -> 172.31.36.109 TCP 18890 [TCP segment of a reassembled PDU]
149   0.119998 172.31.36.109 -> 54.192.30.192 TCP 66 45949 > http [ACK] Seq=97 Ack=550121 Win=924032 Len=0 TSval=21413914 TSecr=693686842
150   0.120013 54.192.30.192 -> 172.31.36.109 TCP 11650 [TCP segment of a reassembled PDU]
151   0.120019 172.31.36.109 -> 54.192.30.192 TCP 66 45949 > http [ACK] Seq=97 Ack=561705 Win=947200 Len=0 TSval=21413914 TSecr=693686842
152   0.120237 54.192.30.192 -> 172.31.36.109 TCP 5858 [TCP segment of a reassembled PDU]
153   0.120244 172.31.36.109 -> 54.192.30.192 TCP 66 45949 > http [ACK] Seq=97 Ack=567497 Win=958720 Len=0 TSval=21413914 TSecr=693686842
154   0.120378 54.192.30.192 -> 172.31.36.109 TCP 20338 [TCP segment of a reassembled PDU]
155   0.120388 172.31.36.109 -> 54.192.30.192 TCP 66 45949 > http [ACK] Seq=97 Ack=587769 Win=999296 Len=0 TSval=21413914 TSecr=693686842
156   0.121183 54.192.30.192 -> 172.31.36.109 TCP 1890 [TCP segment of a reassembled PDU]
157   0.121188 172.31.36.109 -> 54.192.30.192 TCP 66 45949 > http [ACK] Seq=97 Ack=589593 Win=999296 Len=0 TSval=21413914 TSecr=693686842
158   0.144266 54.192.30.192 -> 172.31.36.109 TCP 1514 [TCP segment of a reassembled PDU]
159   0.144273 172.31.36.109 -> 54.192.30.192 TCP 66 45949 > http [ACK] Seq=97 Ack=591041 Win=1002112 Len=0 TSval=21413920 TSecr=693686844
160   0.144329 54.192.30.192 -> 172.31.36.109 TCP 1514 [TCP segment of a reassembled PDU]
161   0.144334 172.31.36.109 -> 54.192.30.192 TCP 66 45949 > http [ACK] Seq=97 Ack=592489 Win=1005056 Len=0 TSval=21413920 TSecr=693686844
162   0.144357 54.192.30.192 -> 172.31.36.109 TCP 1514 [TCP segment of a reassembled PDU]
163   0.144361 172.31.36.109 -> 54.192.30.192 TCP 66 45949 > http [ACK] Seq=97 Ack=593937 Win=1008000 Len=0 TSval=21413920 TSecr=693686844
164   0.144430 54.192.30.192 -> 172.31.36.109 TCP 5858 [TCP segment of a reassembled PDU]
165   0.144436 172.31.36.109 -> 54.192.30.192 TCP 66 45949 > http [ACK] Seq=97 Ack=599729 Win=1019520 Len=0 TSval=21413920 TSecr=693686844
166   0.144492 54.192.30.192 -> 172.31.36.109 TCP 2962 [TCP segment of a reassembled PDU]
167   0.144497 172.31.36.109 -> 54.192.30.192 TCP 66 45949 > http [ACK] Seq=97 Ack=602625 Win=1025280 Len=0 TSval=21413920 TSecr=693686844
168   0.144629 54.192.30.192 -> 172.31.36.109 TCP 13098 [TCP segment of a reassembled PDU]
169   0.144638 172.31.36.109 -> 54.192.30.192 TCP 66 45949 > http [ACK] Seq=97 Ack=615657 Win=1050880 Len=0 TSval=21413920 TSecr=693686844
170   0.144651 54.192.30.192 -> 172.31.36.109 TCP 2962 [TCP segment of a reassembled PDU]
171   0.144656 54.192.30.192 -> 172.31.36.109 TCP 4410 [TCP segment of a reassembled PDU]
172   0.144677 172.31.36.109 -> 54.192.30.192 TCP 66 45949 > http [ACK] Seq=97 Ack=622897 Win=1051392 Len=0 TSval=21413920 TSecr=693686844
173   0.144904 54.192.30.192 -> 172.31.36.109 TCP 2962 [TCP segment of a reassembled PDU]
174   0.144917 172.31.36.109 -> 54.192.30.192 TCP 66 45949 > http [ACK] Seq=97 Ack=625793 Win=1057152 Len=0 TSval=21413920 TSecr=693686844
175   0.145013 54.192.30.192 -> 172.31.36.109 TCP 1514 [TCP segment of a reassembled PDU]
176   0.145018 172.31.36.109 -> 54.192.30.192 TCP 66 45949 > http [ACK] Seq=97 Ack=627241 Win=1060096 Len=0 TSval=21413920 TSecr=693686844
177   0.145083 54.192.30.192 -> 172.31.36.109 TCP 4410 [TCP segment of a reassembled PDU]
178   0.145089 172.31.36.109 -> 54.192.30.192 TCP 66 45949 > http [ACK] Seq=97 Ack=631585 Win=1065088 Len=0 TSval=21413920 TSecr=693686844
179   0.145097 54.192.30.192 -> 172.31.36.109 TCP 7306 [TCP segment of a reassembled PDU]
180   0.145119 172.31.36.109 -> 54.192.30.192 TCP 66 45949 > http [ACK] Seq=97 Ack=638825 Win=1068800 Len=0 TSval=21413920 TSecr=693686844
181   0.145156 54.192.30.192 -> 172.31.36.109 TCP 7306 [TCP segment of a reassembled PDU]
182   0.145173 172.31.36.109 -> 54.192.30.192 TCP 66 45949 > http [ACK] Seq=97 Ack=646065 Win=1068800 Len=0 TSval=21413920 TSecr=693686844
183   0.145206 54.192.30.192 -> 172.31.36.109 TCP 13098 [TCP segment of a reassembled PDU]
184   0.145228 172.31.36.109 -> 54.192.30.192 TCP 66 45949 > http [ACK] Seq=97 Ack=659097 Win=1068800 Len=0 TSval=21413920 TSecr=693686844
185   0.145771 54.192.30.192 -> 172.31.36.109 TCP 1514 [TCP segment of a reassembled PDU]
186   0.145777 172.31.36.109 -> 54.192.30.192 TCP 66 45949 > http [ACK] Seq=97 Ack=660545 Win=1069824 Len=0 TSval=21413921 TSecr=693686845
187   0.145909 54.192.30.192 -> 172.31.36.109 TCP 17442 [TCP segment of a reassembled PDU]
188   0.145922 54.192.30.192 -> 172.31.36.109 TCP 2962 [TCP segment of a reassembled PDU]
189   0.145936 172.31.36.109 -> 54.192.30.192 TCP 66 45949 > http [ACK] Seq=97 Ack=680817 Win=1049600 Len=0 TSval=21413921 TSecr=693686845
190   0.146074 54.192.30.192 -> 172.31.36.109 TCP 17442 [TCP segment of a reassembled PDU]
191   0.146098 172.31.36.109 -> 54.192.30.192 TCP 66 45949 > http [ACK] Seq=97 Ack=698193 Win=1043584 Len=0 TSval=21413921 TSecr=693686845
192   0.146251 54.192.30.192 -> 172.31.36.109 TCP 7306 [TCP segment of a reassembled PDU]
193   0.146258 172.31.36.109 -> 54.192.30.192 TCP 66 45949 > http [ACK] Seq=97 Ack=705433 Win=1060352 Len=0 TSval=21413921 TSecr=693686845
194   0.146358 54.192.30.192 -> 172.31.36.109 TCP 13098 [TCP segment of a reassembled PDU]
195   0.146377 172.31.36.109 -> 54.192.30.192 TCP 66 45949 > http [ACK] Seq=97 Ack=718465 Win=1071616 Len=0 TSval=21413921 TSecr=693686845
196   0.146434 54.192.30.192 -> 172.31.36.109 TCP 2962 [TCP segment of a reassembled PDU]
197   0.146450 172.31.36.109 -> 54.192.30.192 TCP 66 45949 > http [ACK] Seq=97 Ack=721361 Win=1071616 Len=0 TSval=21413921 TSecr=693686845
198   0.146636 54.192.30.192 -> 172.31.36.109 TCP 4410 [TCP segment of a reassembled PDU]
199   0.146653 172.31.36.109 -> 54.192.30.192 TCP 66 45949 > http [ACK] Seq=97 Ack=725705 Win=1071616 Len=0 TSval=21413921 TSecr=693686845
200   0.146738 54.192.30.192 -> 172.31.36.109 TCP 1514 [TCP segment of a reassembled PDU]
201   0.146775 54.192.30.192 -> 172.31.36.109 TCP 7306 [TCP segment of a reassembled PDU]
202   0.146816 54.192.30.192 -> 172.31.36.109 TCP 11650 [TCP segment of a reassembled PDU]
203   0.146843 54.192.30.192 -> 172.31.36.109 TCP 2962 [TCP segment of a reassembled PDU]
204   0.146966 54.192.30.192 -> 172.31.36.109 TCP 2962 [TCP segment of a reassembled PDU]
205   0.147053 172.31.36.109 -> 54.192.30.192 TCP 66 45949 > http [ACK] Seq=97 Ack=751769 Win=1045632 Len=0 TSval=21413921 TSecr=693686845
206   0.147079 54.192.30.192 -> 172.31.36.109 TCP 2962 [TCP segment of a reassembled PDU]
207   0.147083 172.31.36.109 -> 54.192.30.192 TCP 66 45949 > http [ACK] Seq=97 Ack=754665 Win=1067392 Len=0 TSval=21413921 TSecr=693686845
208   0.147218 54.192.30.192 -> 172.31.36.109 TCP 14546 [TCP segment of a reassembled PDU]
209   0.147260 172.31.36.109 -> 54.192.30.192 TCP 66 45949 > http [ACK] Seq=97 Ack=769145 Win=1071616 Len=0 TSval=21413921 TSecr=693686845
210   0.147346 54.192.30.192 -> 172.31.36.109 TCP 2962 [TCP segment of a reassembled PDU]
211   0.147361 172.31.36.109 -> 54.192.30.192 TCP 66 45949 > http [ACK] Seq=97 Ack=772041 Win=1071616 Len=0 TSval=21413921 TSecr=693686845
212   0.147492 54.192.30.192 -> 172.31.36.109 TCP 18890 [TCP segment of a reassembled PDU]
213   0.147507 54.192.30.192 -> 172.31.36.109 TCP 4410 [TCP segment of a reassembled PDU]
214   0.147521 172.31.36.109 -> 54.192.30.192 TCP 66 45949 > http [ACK] Seq=97 Ack=795209 Win=1048448 Len=0 TSval=21413921 TSecr=693686845
215   0.147573 54.192.30.192 -> 172.31.36.109 TCP 1514 [TCP segment of a reassembled PDU]
216   0.147727 54.192.30.192 -> 172.31.36.109 TCP 21786 [TCP segment of a reassembled PDU]
217   0.147749 172.31.36.109 -> 54.192.30.192 TCP 66 45949 > http [ACK] Seq=97 Ack=818377 Win=1036544 Len=0 TSval=21413921 TSecr=693686845
218   0.147983 54.192.30.192 -> 172.31.36.109 TCP 20338 [TCP segment of a reassembled PDU]
219   0.147995 172.31.36.109 -> 54.192.30.192 TCP 66 45949 > http [ACK] Seq=97 Ack=838649 Win=1038848 Len=0 TSval=21413921 TSecr=693686845
220   0.148229 54.192.30.192 -> 172.31.36.109 TCP 7306 [TCP segment of a reassembled PDU]
221   0.148236 172.31.36.109 -> 54.192.30.192 TCP 66 45949 > http [ACK] Seq=97 Ack=845889 Win=1060352 Len=0 TSval=21413921 TSecr=693686845
222   0.148455 54.192.30.192 -> 172.31.36.109 TCP 8754 [TCP segment of a reassembled PDU]
223   0.148473 172.31.36.109 -> 54.192.30.192 TCP 66 45949 > http [ACK] Seq=97 Ack=854577 Win=1071616 Len=0 TSval=21413921 TSecr=693686845
224   0.148600 54.192.30.192 -> 172.31.36.109 TCP 21786 [TCP segment of a reassembled PDU]
225   0.148638 172.31.36.109 -> 54.192.30.192 TCP 66 45949 > http [ACK] Seq=97 Ack=876297 Win=1049984 Len=0 TSval=21413921 TSecr=693686845
226   0.148721 54.192.30.192 -> 172.31.36.109 TCP 20338 [TCP segment of a reassembled PDU]
227   0.148869 172.31.36.109 -> 54.192.30.192 TCP 66 45949 > http [ACK] Seq=97 Ack=896569 Win=1038848 Len=0 TSval=21413921 TSecr=693686845
228   0.148960 54.192.30.192 -> 172.31.36.109 TCP 4410 [TCP segment of a reassembled PDU]
229   0.148966 172.31.36.109 -> 54.192.30.192 TCP 66 45949 > http [ACK] Seq=97 Ack=900913 Win=1065088 Len=0 TSval=21413921 TSecr=693686845
230   0.149087 54.192.30.192 -> 172.31.36.109 TCP 13098 [TCP segment of a reassembled PDU]
231   0.149107 172.31.36.109 -> 54.192.30.192 TCP 66 45949 > http [ACK] Seq=97 Ack=913945 Win=1071616 Len=0 TSval=21413921 TSecr=693686845
232   0.149358 54.192.30.192 -> 172.31.36.109 TCP 24682 [TCP segment of a reassembled PDU]
233   0.149385 54.192.30.192 -> 172.31.36.109 TCP 1514 [TCP segment of a reassembled PDU]
234   0.149400 172.31.36.109 -> 54.192.30.192 TCP 66 45949 > http [ACK] Seq=97 Ack=940009 Win=1045632 Len=0 TSval=21413922 TSecr=693686845
235   0.149463 54.192.30.192 -> 172.31.36.109 TCP 7306 [TCP segment of a reassembled PDU]
236   0.149468 172.31.36.109 -> 54.192.30.192 TCP 66 45949 > http [ACK] Seq=97 Ack=947249 Win=1060352 Len=0 TSval=21413922 TSecr=693686845
237   0.149576 54.192.30.192 -> 172.31.36.109 TCP 17442 [TCP segment of a reassembled PDU]
238   0.149608 172.31.36.109 -> 54.192.30.192 TCP 66 45949 > http [ACK] Seq=97 Ack=964625 Win=1043584 Len=0 TSval=21413922 TSecr=693686845
239   0.149672 54.192.30.192 -> 172.31.36.109 TCP 7306 [TCP segment of a reassembled PDU]
240   0.149679 172.31.36.109 -> 54.192.30.192 TCP 66 45949 > http [ACK] Seq=97 Ack=971865 Win=1060352 Len=0 TSval=21413922 TSecr=693686845
241   0.150054 54.192.30.192 -> 172.31.36.109 TCP 5858 [TCP segment of a reassembled PDU]
242   0.150061 172.31.36.109 -> 54.192.30.192 TCP 66 45949 > http [ACK] Seq=97 Ack=977657 Win=1062656 Len=0 TSval=21413922 TSecr=693686845
243   0.150193 54.192.30.192 -> 172.31.36.109 TCP 15994 [TCP segment of a reassembled PDU]
244   0.150216 172.31.36.109 -> 54.192.30.192 TCP 66 45949 > http [ACK] Seq=97 Ack=993585 Win=1071616 Len=0 TSval=21413922 TSecr=693686845
245   0.150309 54.192.30.192 -> 172.31.36.109 TCP 2962 [TCP segment of a reassembled PDU]
246   0.150444 54.192.30.192 -> 172.31.36.109 TCP 17442 [TCP segment of a reassembled PDU]
247   0.150459 54.192.30.192 -> 172.31.36.109 TCP 8754 [TCP segment of a reassembled PDU]
248   0.150491 172.31.36.109 -> 54.192.30.192 TCP 66 45949 > http [ACK] Seq=97 Ack=1022545 Win=1042688 Len=0 TSval=21413922 TSecr=693686845
249   0.150569 54.192.30.192 -> 172.31.36.109 TCP 13098 [TCP segment of a reassembled PDU]
250   0.150578 172.31.36.109 -> 54.192.30.192 TCP 66 45949 > http [ACK] Seq=97 Ack=1035577 Win=1050880 Len=0 TSval=21413922 TSecr=693686845
251   0.150691 54.192.30.192 -> 172.31.36.109 HTTP 13522 HTTP/1.1 200 OK  (application/octet-stream)
252   0.150728 172.31.36.109 -> 54.192.30.192 TCP 66 45949 > http [ACK] Seq=97 Ack=1049033 Win=1071616 Len=0 TSval=21413922 TSecr=693686845
253   0.150850 172.31.36.109 -> 54.192.30.192 TCP 66 45949 > http [FIN, ACK] Seq=97 Ack=1049033 Win=1071616 Len=0 TSval=21413922 TSecr=693686845
254   0.151939 54.192.30.192 -> 172.31.36.109 TCP 66 http > 45949 [FIN, ACK] Seq=1049033 Ack=98 Win=14592 Len=0 TSval=693686845 TSecr=21413922
255   0.151948 172.31.36.109 -> 54.192.30.192 TCP 66 45949 > http [ACK] Seq=98 Ack=1049034 Win=1071616 Len=0 TSval=21413922 TSecr=693686845
