[Measurement for 1kb at 23:30:10 19.30.2014] 
Tshark:

  1   0.000000 172.31.36.109 -> 172.31.0.2   DNS 89 Standard query 0xdf32  A d39wppo36gwqpx.cloudfront.net
  2   0.000029 172.31.36.109 -> 172.31.0.2   DNS 89 Standard query 0x3862  AAAA d39wppo36gwqpx.cloudfront.net
  3   0.000599   172.31.0.2 -> 172.31.36.109 DNS 217 Standard query response 0xdf32  A 54.192.30.222 A 54.230.30.49 A 54.230.30.57 A 54.230.30.73 A 54.230.30.213 A 54.230.30.243 A 54.192.30.138 A 54.192.30.189
  4   0.023332   172.31.0.2 -> 172.31.36.109 DNS 170 Standard query response 0x3862 
  5   0.028152 172.31.36.109 -> 54.192.30.222 TCP 74 36976 > http [SYN] Seq=0 Win=26883 Len=0 MSS=8961 SACK_PERM=1 TSval=25874305 TSecr=0 WS=128
  6   0.029181 54.192.30.222 -> 172.31.36.109 TCP 74 http > 36976 [SYN, ACK] Seq=0 Ack=1 Win=14480 Len=0 MSS=1460 SACK_PERM=1 TSval=674802127 TSecr=25874305 WS=128
  7   0.029196 172.31.36.109 -> 54.192.30.222 TCP 66 36976 > http [ACK] Seq=1 Ack=1 Win=27008 Len=0 TSval=25874305 TSecr=674802127
  8   0.029238 172.31.36.109 -> 54.192.30.222 HTTP 162 GET /1kb HTTP/1.1 
  9   0.030176 54.192.30.222 -> 172.31.36.109 TCP 66 http > 36976 [ACK] Seq=1 Ack=97 Win=14592 Len=0 TSval=674802127 TSecr=25874305
 10   0.133379 54.192.30.222 -> 172.31.36.109 HTTP 1544 HTTP/1.1 200 OK  (application/octet-stream)
 11   0.133408 172.31.36.109 -> 54.192.30.222 TCP 66 36976 > http [ACK] Seq=97 Ack=1479 Win=29952 Len=0 TSval=25874331 TSecr=674802137
 12   0.133646 172.31.36.109 -> 54.192.30.222 TCP 66 36976 > http [FIN, ACK] Seq=97 Ack=1479 Win=29952 Len=0 TSval=25874331 TSecr=674802137
 13   0.134856 54.192.30.222 -> 172.31.36.109 TCP 66 http > 36976 [FIN, ACK] Seq=1479 Ack=98 Win=14592 Len=0 TSval=674802137 TSecr=25874331
 14   0.134866 172.31.36.109 -> 54.192.30.222 TCP 66 36976 > http [ACK] Seq=98 Ack=1480 Win=29952 Len=0 TSval=25874331 TSecr=674802137
