[Measurement for 1kb at 12:30:10 20.30.2014] 
Tshark:

  1   0.000000 172.31.36.109 -> 172.31.0.2   DNS 89 Standard query 0xf9ec  A d39wppo36gwqpx.cloudfront.net
  2   0.000036 172.31.36.109 -> 172.31.0.2   DNS 89 Standard query 0x21b1  AAAA d39wppo36gwqpx.cloudfront.net
  3   0.000582   172.31.0.2 -> 172.31.36.109 DNS 217 Standard query response 0xf9ec  A 54.230.29.242 A 54.230.30.192 A 54.230.30.207 A 54.230.30.247 A 54.230.30.249 A 54.230.31.9 A 54.192.30.187 A 54.230.29.239
  4   0.024165   172.31.0.2 -> 172.31.36.109 DNS 170 Standard query response 0x21b1 
  5   0.028149 172.31.36.109 -> 54.230.29.242 TCP 74 51689 > http [SYN] Seq=0 Win=26883 Len=0 MSS=8961 SACK_PERM=1 TSval=37574232 TSecr=0 WS=128
  6   0.029575 54.230.29.242 -> 172.31.36.109 TCP 74 http > 51689 [SYN, ACK] Seq=0 Ack=1 Win=14480 Len=0 MSS=1460 SACK_PERM=1 TSval=667700493 TSecr=37574232 WS=128
  7   0.029589 172.31.36.109 -> 54.230.29.242 TCP 66 51689 > http [ACK] Seq=1 Ack=1 Win=27008 Len=0 TSval=37574232 TSecr=667700493
  8   0.029630 172.31.36.109 -> 54.230.29.242 HTTP 162 GET /1kb HTTP/1.1 
  9   0.031238 54.230.29.242 -> 172.31.36.109 TCP 66 http > 51689 [ACK] Seq=1 Ack=97 Win=14592 Len=0 TSval=667700493 TSecr=37574232
 10   0.055581 54.230.29.242 -> 172.31.36.109 HTTP 1544 HTTP/1.1 200 OK  (application/octet-stream)
 11   0.055598 172.31.36.109 -> 54.230.29.242 TCP 66 51689 > http [ACK] Seq=97 Ack=1479 Win=29952 Len=0 TSval=37574239 TSecr=667700495
 12   0.055799 172.31.36.109 -> 54.230.29.242 TCP 66 51689 > http [FIN, ACK] Seq=97 Ack=1479 Win=29952 Len=0 TSval=37574239 TSecr=667700495
 13   0.057480 54.230.29.242 -> 172.31.36.109 TCP 66 http > 51689 [FIN, ACK] Seq=1479 Ack=98 Win=14592 Len=0 TSval=667700495 TSecr=37574239
 14   0.057502 172.31.36.109 -> 54.230.29.242 TCP 66 51689 > http [ACK] Seq=98 Ack=1480 Win=29952 Len=0 TSval=37574239 TSecr=667700495
