[Measurement for 1kb at 13:30:10 20.30.2014] 
Tshark:

  1   0.000000 172.31.36.109 -> 172.31.0.2   DNS 89 Standard query 0xe04c  A d39wppo36gwqpx.cloudfront.net
  2   0.000028 172.31.36.109 -> 172.31.0.2   DNS 89 Standard query 0x806e  AAAA d39wppo36gwqpx.cloudfront.net
  3   0.000586   172.31.0.2 -> 172.31.36.109 DNS 217 Standard query response 0xe04c  A 54.230.23.160 A 54.230.23.210 A 216.137.41.101 A 216.137.41.199 A 54.230.20.115 A 54.230.21.150 A 54.230.21.175 A 54.230.22.243
  4   0.023633   172.31.0.2 -> 172.31.36.109 DNS 170 Standard query response 0x806e 
  5   0.028176 172.31.36.109 -> 54.230.23.160 TCP 74 43113 > http [SYN] Seq=0 Win=26883 Len=0 MSS=8961 SACK_PERM=1 TSval=38474261 TSecr=0 WS=128
  6   0.126324 54.230.23.160 -> 172.31.36.109 TCP 74 http > 43113 [SYN, ACK] Seq=0 Ack=1 Win=14480 Len=0 MSS=1460 SACK_PERM=1 TSval=928295948 TSecr=38474261 WS=128
  7   0.126359 172.31.36.109 -> 54.230.23.160 TCP 66 43113 > http [ACK] Seq=1 Ack=1 Win=27008 Len=0 TSval=38474285 TSecr=928295948
  8   0.126454 172.31.36.109 -> 54.230.23.160 HTTP 162 GET /1kb HTTP/1.1 
  9   0.215287 54.230.23.160 -> 172.31.36.109 TCP 66 http > 43113 [ACK] Seq=1 Ack=97 Win=14592 Len=0 TSval=928295958 TSecr=38474285
 10   0.217093 54.230.23.160 -> 172.31.36.109 HTTP 1544 HTTP/1.1 200 OK  (application/octet-stream)
 11   0.217108 172.31.36.109 -> 54.230.23.160 TCP 66 43113 > http [ACK] Seq=97 Ack=1479 Win=29952 Len=0 TSval=38474308 TSecr=928295958
 12   0.217295 172.31.36.109 -> 54.230.23.160 TCP 66 43113 > http [FIN, ACK] Seq=97 Ack=1479 Win=29952 Len=0 TSval=38474308 TSecr=928295958
 13   0.306570 54.230.23.160 -> 172.31.36.109 TCP 66 http > 43113 [FIN, ACK] Seq=1479 Ack=98 Win=14592 Len=0 TSval=928295967 TSecr=38474308
 14   0.306600 172.31.36.109 -> 54.230.23.160 TCP 66 43113 > http [ACK] Seq=98 Ack=1480 Win=29952 Len=0 TSval=38474330 TSecr=928295967
