[Measurement for 1kb at 22:30:10 19.30.2014] 
Tshark:

  1   0.000000 06:ab:f2:b7:83:1d -> 06:87:bf:67:ca:e7 ARP 60 Who has 172.31.36.109?  Tell 172.31.32.1
  2   0.000015 06:87:bf:67:ca:e7 -> 06:ab:f2:b7:83:1d ARP 42 172.31.36.109 is at 06:87:bf:67:ca:e7
  3   1.771958 172.31.36.109 -> 172.31.0.2   DNS 89 Standard query 0x6be7  A d39wppo36gwqpx.cloudfront.net
  4   1.771977 172.31.36.109 -> 172.31.0.2   DNS 89 Standard query 0x72cb  AAAA d39wppo36gwqpx.cloudfront.net
  5   1.772487   172.31.0.2 -> 172.31.36.109 DNS 217 Standard query response 0x6be7  A 54.192.30.186 A 54.192.30.227 A 54.230.30.53 A 54.230.30.59 A 54.230.30.229 A 54.230.30.231 A 54.230.30.233 A 54.230.30.237
  6   1.921830   172.31.0.2 -> 172.31.36.109 DNS 170 Standard query response 0x72cb 
  7   2.024780 172.31.36.109 -> 54.192.30.186 TCP 74 42429 > http [SYN] Seq=0 Win=26883 Len=0 MSS=8961 SACK_PERM=1 TSval=24974294 TSecr=0 WS=128
  8   2.026259 54.192.30.186 -> 172.31.36.109 TCP 74 http > 42429 [SYN, ACK] Seq=0 Ack=1 Win=14480 Len=0 MSS=1460 SACK_PERM=1 TSval=711062927 TSecr=24974294 WS=128
  9   2.026273 172.31.36.109 -> 54.192.30.186 TCP 66 42429 > http [ACK] Seq=1 Ack=1 Win=27008 Len=0 TSval=24974295 TSecr=711062927
 10   2.026316 172.31.36.109 -> 54.192.30.186 HTTP 162 GET /1kb HTTP/1.1 
 11   2.027560 54.192.30.186 -> 172.31.36.109 TCP 66 http > 42429 [ACK] Seq=1 Ack=97 Win=14592 Len=0 TSval=711062928 TSecr=24974295
 12   2.043208 54.192.30.186 -> 172.31.36.109 HTTP 1544 HTTP/1.1 200 OK  (application/octet-stream)
 13   2.043217 172.31.36.109 -> 54.192.30.186 TCP 66 42429 > http [ACK] Seq=97 Ack=1479 Win=29952 Len=0 TSval=24974299 TSecr=711062929
 14   2.043360 172.31.36.109 -> 54.192.30.186 TCP 66 42429 > http [FIN, ACK] Seq=97 Ack=1479 Win=29952 Len=0 TSval=24974299 TSecr=711062929
 15   2.044970 54.192.30.186 -> 172.31.36.109 TCP 66 http > 42429 [FIN, ACK] Seq=1479 Ack=98 Win=14592 Len=0 TSval=711062929 TSecr=24974299
 16   2.044992 172.31.36.109 -> 54.192.30.186 TCP 66 42429 > http [ACK] Seq=98 Ack=1480 Win=29952 Len=0 TSval=24974299 TSecr=711062929
