[Measurement for 10kb at 17:03:25 16.03.2014] 
Tshark:

  1   0.000000  192.168.1.2 -> 64.233.164.125 TCP 55 [TCP segment of a reassembled PDU]
  2   0.051959 64.233.164.125 -> 192.168.1.2  TCP 66 5222→63047 [ACK] Seq=1 Ack=2 Win=508 Len=0 SLE=1 SRE=2
  3   0.565482  192.168.1.2 -> 72.14.247.65 SSL 55 Continuation Data
  4   0.605180 72.14.247.65 -> 192.168.1.2  TCP 66 443→63362 [ACK] Seq=1 Ack=2 Win=372 Len=0 SLE=1 SRE=2
  5   1.197376  192.168.1.2 -> 54.230.99.41 TCP 66 63370→80 [SYN] Seq=0 Win=8192 Len=0 MSS=1460 WS=256 SACK_PERM=1
  6   1.240290 54.230.99.41 -> 192.168.1.2  TCP 66 80→63370 [SYN, ACK] Seq=0 Ack=1 Win=14600 Len=0 MSS=1400 SACK_PERM=1 WS=128
  7   1.240434  192.168.1.2 -> 54.230.99.41 TCP 54 63370→80 [ACK] Seq=1 Ack=1 Win=65792 Len=0
  8   1.251252  192.168.1.2 -> 54.230.99.41 HTTP 151 GET /10kb HTTP/1.1 
  9   1.280023 54.230.99.41 -> 192.168.1.2  TCP 54 80→63370 [ACK] Seq=1 Ack=98 Win=14720 Len=0
 10   1.456202 54.230.99.41 -> 192.168.1.2  TCP 1454 [TCP segment of a reassembled PDU]
 11   1.457048 54.230.99.41 -> 192.168.1.2  TCP 1454 [TCP segment of a reassembled PDU]
 12   1.457159  192.168.1.2 -> 54.230.99.41 TCP 54 63370→80 [ACK] Seq=98 Ack=2801 Win=65792 Len=0
 13   1.458260 54.230.99.41 -> 192.168.1.2  TCP 1454 [TCP segment of a reassembled PDU]
 14   1.459626 54.230.99.41 -> 192.168.1.2  TCP 1454 [TCP segment of a reassembled PDU]
 15   1.459688  192.168.1.2 -> 54.230.99.41 TCP 54 63370→80 [ACK] Seq=98 Ack=5601 Win=65792 Len=0
 16   1.459784 54.230.99.41 -> 192.168.1.2  TCP 1454 [TCP segment of a reassembled PDU]
 17   1.459858 54.230.99.41 -> 192.168.1.2  TCP 1454 [TCP segment of a reassembled PDU]
 18   1.459899  192.168.1.2 -> 54.230.99.41 TCP 54 63370→80 [ACK] Seq=98 Ack=8401 Win=65792 Len=0
 19   1.459990 54.230.99.41 -> 192.168.1.2  TCP 1454 [TCP segment of a reassembled PDU]
 20   1.460024 54.230.99.41 -> 192.168.1.2  HTTP 949 HTTP/1.1 200 OK  (application/octet-stream)
 21   1.460055  192.168.1.2 -> 54.230.99.41 TCP 54 63370→80 [ACK] Seq=98 Ack=10696 Win=65792 Len=0
 22   1.460199  192.168.1.2 -> 54.230.99.41 TCP 54 63370→80 [FIN, ACK] Seq=98 Ack=10696 Win=65792 Len=0
 23   1.491131 54.230.99.41 -> 192.168.1.2  TCP 54 80→63370 [FIN, ACK] Seq=10696 Ack=99 Win=14720 Len=0
 24   1.491263  192.168.1.2 -> 54.230.99.41 TCP 54 63370→80 [ACK] Seq=99 Ack=10697 Win=65792 Len=0
 25   1.495133 54.230.99.41 -> 192.168.1.2  TCP 54 [TCP Dup ACK 23#1] 80→63370 [ACK] Seq=10697 Ack=99 Win=14720 Len=0
