[Measurement for 10kb at 17:01:38 16.01.2014] 
Tshark:

  1   0.000000  192.168.1.2 -> 54.221.227.112 TLSv1.2 90 Application Data
  2   0.154113 54.221.227.112 -> 192.168.1.2  TLSv1.2 86 Application Data
  3   0.203727  192.168.1.2 -> 54.221.227.112 TCP 54 63063→443 [ACK] Seq=37 Ack=33 Win=252 Len=0
  4   0.667593 173.255.112.173 -> 192.168.1.2  TLSv1.2 105 Application Data
  5   0.718154  192.168.1.2 -> 173.255.112.173 TCP 54 63066→443 [ACK] Seq=1 Ack=52 Win=256 Len=0
  6   0.860190  192.168.1.2 -> 54.230.99.37 TCP 66 63349→80 [SYN] Seq=0 Win=8192 Len=0 MSS=1460 WS=256 SACK_PERM=1
  7   0.908249 54.230.99.37 -> 192.168.1.2  TCP 66 80→63349 [SYN, ACK] Seq=0 Ack=1 Win=14600 Len=0 MSS=1400 SACK_PERM=1 WS=128
  8   0.908394  192.168.1.2 -> 54.230.99.37 TCP 54 63349→80 [ACK] Seq=1 Ack=1 Win=65792 Len=0
  9   0.908565  192.168.1.2 -> 54.230.99.37 HTTP 151 GET /10kb HTTP/1.1 
 10   0.943049 54.230.99.37 -> 192.168.1.2  TCP 54 80→63349 [ACK] Seq=1 Ack=98 Win=14720 Len=0
 11   0.947058 54.230.99.37 -> 192.168.1.2  TCP 1454 [TCP segment of a reassembled PDU]
 12   0.948812 54.230.99.37 -> 192.168.1.2  TCP 1454 [TCP segment of a reassembled PDU]
 13   0.948891  192.168.1.2 -> 54.230.99.37 TCP 54 63349→80 [ACK] Seq=98 Ack=2801 Win=65792 Len=0
 14   0.949037 54.230.99.37 -> 192.168.1.2  TCP 1454 [TCP segment of a reassembled PDU]
 15   0.949075 54.230.99.37 -> 192.168.1.2  TCP 1454 [TCP segment of a reassembled PDU]
 16   0.949123  192.168.1.2 -> 54.230.99.37 TCP 54 63349→80 [ACK] Seq=98 Ack=5601 Win=65792 Len=0
 17   0.949236 54.230.99.37 -> 192.168.1.2  TCP 1454 [TCP segment of a reassembled PDU]
 18   0.949329 54.230.99.37 -> 192.168.1.2  TCP 1454 [TCP segment of a reassembled PDU]
 19   0.949378  192.168.1.2 -> 54.230.99.37 TCP 54 63349→80 [ACK] Seq=98 Ack=8401 Win=65792 Len=0
 20   0.949496 54.230.99.37 -> 192.168.1.2  TCP 1454 [TCP segment of a reassembled PDU]
 21   0.949542 54.230.99.37 -> 192.168.1.2  HTTP 949 HTTP/1.1 200 OK  (application/octet-stream)
 22   0.949588  192.168.1.2 -> 54.230.99.37 TCP 54 63349→80 [ACK] Seq=98 Ack=10696 Win=65792 Len=0
 23   0.949875  192.168.1.2 -> 54.230.99.37 TCP 54 63349→80 [FIN, ACK] Seq=98 Ack=10696 Win=65792 Len=0
 24   0.990479 54.230.99.37 -> 192.168.1.2  TCP 54 80→63349 [FIN, ACK] Seq=10696 Ack=99 Win=14720 Len=0
 25   0.990623  192.168.1.2 -> 54.230.99.37 TCP 54 63349→80 [ACK] Seq=99 Ack=10697 Win=65792 Len=0
 26   1.011255  192.168.1.2 -> 74.125.232.192 TCP 1454 [TCP segment of a reassembled PDU]
 27   1.011272  192.168.1.2 -> 74.125.232.192 TCP 1454 [TCP segment of a reassembled PDU]
 28   1.011280  192.168.1.2 -> 74.125.232.192 TLSv1.2 517 Application Data
 29   1.011598  192.168.1.2 -> 74.125.232.192 TLSv1.2 87 Application Data
 30   1.011762  192.168.1.2 -> 74.125.232.192 TCP 1454 [TCP segment of a reassembled PDU]
 31   1.011773  192.168.1.2 -> 74.125.232.192 TCP 1454 [TCP segment of a reassembled PDU]
 32   1.011781  192.168.1.2 -> 74.125.232.192 TLSv1.2 135 Application Data
 33   1.011992  192.168.1.2 -> 74.125.232.192 TLSv1.2 621 Application Data
 34   1.045147 74.125.232.192 -> 192.168.1.2  TCP 54 443→63044 [ACK] Seq=1 Ack=3264 Win=1351 Len=0
 35   1.046117 74.125.232.192 -> 192.168.1.2  TLSv1.2 87 Application Data
 36   1.065365 74.125.232.192 -> 192.168.1.2  TCP 54 443→63044 [ACK] Seq=34 Ack=6178 Win=1357 Len=0
 37   1.075559  192.168.1.2 -> 74.125.232.192 TCP 54 63044→443 [ACK] Seq=6745 Ack=34 Win=257 Len=0
 38   1.093175 74.125.232.192 -> 192.168.1.2  TLSv1.2 104 Application Data
 39   1.094351 74.125.232.192 -> 192.168.1.2  TLSv1.2 132 Application Data
 40   1.094439  192.168.1.2 -> 74.125.232.192 TCP 54 63044→443 [ACK] Seq=6745 Ack=162 Win=256 Len=0
 41   1.095668 74.125.232.192 -> 192.168.1.2  TLSv1.2 93 Application Data
 42   1.096315 74.125.232.192 -> 192.168.1.2  TLSv1.2 87 Application Data
 43   1.096416  192.168.1.2 -> 74.125.232.192 TCP 54 63044→443 [ACK] Seq=6745 Ack=234 Win=256 Len=0
 44   1.096606  192.168.1.2 -> 74.125.232.192 TLSv1.2 87 Application Data
 45   1.164679 74.125.232.192 -> 192.168.1.2  TCP 54 443→63044 [ACK] Seq=234 Ack=6778 Win=1373 Len=0
