[Measurement for 10kb at 02:01:31 17.01.2014] 
Tshark:

  1   0.000000  192.168.1.2 -> 54.230.99.243 TCP 66 49774→80 [SYN] Seq=0 Win=8192 Len=0 MSS=1460 WS=256 SACK_PERM=1
  2   0.054472 54.230.99.243 -> 192.168.1.2  TCP 66 80→49774 [SYN, ACK] Seq=0 Ack=1 Win=14600 Len=0 MSS=1400 SACK_PERM=1 WS=128
  3   0.054590  192.168.1.2 -> 54.230.99.243 TCP 54 49774→80 [ACK] Seq=1 Ack=1 Win=65792 Len=0
  4   0.054889  192.168.1.2 -> 54.230.99.243 HTTP 151 GET /10kb HTTP/1.1 
  5   0.091498 54.230.99.243 -> 192.168.1.2  TCP 54 80→49774 [ACK] Seq=1 Ack=98 Win=14720 Len=0
  6   0.094315 54.230.99.243 -> 192.168.1.2  TCP 1454 [TCP segment of a reassembled PDU]
  7   0.099350 54.230.99.243 -> 192.168.1.2  TCP 1168 [TCP segment of a reassembled PDU]
  8   0.099467  192.168.1.2 -> 54.230.99.243 TCP 54 49774→80 [ACK] Seq=98 Ack=2515 Win=65792 Len=0
  9   0.099609 54.230.99.243 -> 192.168.1.2  TCP 1454 [TCP segment of a reassembled PDU]
 10   0.099658 54.230.99.243 -> 192.168.1.2  TCP 1454 [TCP segment of a reassembled PDU]
 11   0.099712  192.168.1.2 -> 54.230.99.243 TCP 54 49774→80 [ACK] Seq=98 Ack=5315 Win=65792 Len=0
 12   0.099801 54.230.99.243 -> 192.168.1.2  TCP 1454 [TCP segment of a reassembled PDU]
 13   0.099847 54.230.99.243 -> 192.168.1.2  TCP 1454 [TCP segment of a reassembled PDU]
 14   0.099900  192.168.1.2 -> 54.230.99.243 TCP 54 49774→80 [ACK] Seq=98 Ack=8115 Win=65792 Len=0
 15   0.099993 54.230.99.243 -> 192.168.1.2  TCP 1454 [TCP segment of a reassembled PDU]
 16   0.100033 54.230.99.243 -> 192.168.1.2  HTTP 1235 HTTP/1.1 200 OK  (application/octet-stream)
 17   0.100082  192.168.1.2 -> 54.230.99.243 TCP 54 49774→80 [ACK] Seq=98 Ack=10696 Win=65792 Len=0
 18   0.100199  192.168.1.2 -> 54.230.99.243 TCP 54 49774→80 [FIN, ACK] Seq=98 Ack=10696 Win=65792 Len=0
 19   0.129692 54.230.99.243 -> 192.168.1.2  TCP 54 80→49774 [FIN, ACK] Seq=10696 Ack=99 Win=14720 Len=0
 20   0.129851  192.168.1.2 -> 54.230.99.243 TCP 54 49774→80 [ACK] Seq=99 Ack=10697 Win=65792 Len=0
