[Measurement for 10kb at 17:33:04 19.33.2014] 
Tshark:

  1   0.000000 85.76.134.238 -> 172.31.36.109 SSH 102 Encrypted request packet len=48
  2   0.000186 172.31.36.109 -> 85.76.134.238 SSH 102 Encrypted response packet len=48
  3   0.132913 85.76.134.238 -> 172.31.36.109 TCP 54 9799 > ssh [ACK] Seq=49 Ack=49 Win=255 Len=0
  4   0.272850 85.76.134.238 -> 172.31.36.109 SSH 102 Encrypted request packet len=48
  5   0.278860 172.31.36.109 -> 85.76.134.238 SSH 102 Encrypted response packet len=48
  6   0.278916 172.31.36.109 -> 85.76.134.238 SSH 102 Encrypted response packet len=48
  7   0.372696 85.76.134.238 -> 172.31.36.109 TCP 54 9799 > ssh [ACK] Seq=97 Ack=145 Win=255 Len=0
  8   1.470722 172.31.36.109 -> 172.31.0.2   DNS 89 Standard query 0xac8d  A d3796nkzln59xv.cloudfront.net
  9   1.470753 172.31.36.109 -> 172.31.0.2   DNS 89 Standard query 0x0626  AAAA d3796nkzln59xv.cloudfront.net
 10   1.471210   172.31.0.2 -> 172.31.36.109 DNS 170 Standard query response 0x0626 
 11   1.471220   172.31.0.2 -> 172.31.36.109 DNS 217 Standard query response 0xac8d  A 54.230.30.206 A 54.230.30.220 A 54.230.30.246 A 54.230.31.4 A 54.192.29.219 A 54.192.29.221 A 54.230.30.5 A 54.230.30.57
 12   1.474598 172.31.36.109 -> 54.230.30.206 TCP 74 33125 > http [SYN] Seq=0 Win=26883 Len=0 MSS=8961 SACK_PERM=1 TSval=20517787 TSecr=0 WS=128
 13   1.475780 54.230.30.206 -> 172.31.36.109 TCP 74 http > 33125 [SYN, ACK] Seq=0 Ack=1 Win=14480 Len=0 MSS=1460 SACK_PERM=1 TSval=660878097 TSecr=20517787 WS=128
 14   1.475795 172.31.36.109 -> 54.230.30.206 TCP 66 33125 > http [ACK] Seq=1 Ack=1 Win=27008 Len=0 TSval=20517787 TSecr=660878097
 15   1.475837 172.31.36.109 -> 54.230.30.206 HTTP 163 GET /10kb HTTP/1.1 
 16   1.477002 54.230.30.206 -> 172.31.36.109 TCP 66 http > 33125 [ACK] Seq=1 Ack=98 Win=14592 Len=0 TSval=660878097 TSecr=20517787
 17   1.769082 54.230.30.206 -> 172.31.36.109 HTTP 10750 HTTP/1.1 200 OK  (application/octet-stream)
 18   1.769112 172.31.36.109 -> 54.230.30.206 TCP 66 33125 > http [ACK] Seq=98 Ack=10685 Win=48256 Len=0 TSval=20517861 TSecr=660878127
 19   1.769337 172.31.36.109 -> 54.230.30.206 TCP 66 33125 > http [FIN, ACK] Seq=98 Ack=10685 Win=48256 Len=0 TSval=20517861 TSecr=660878127
 20   1.770855 54.230.30.206 -> 172.31.36.109 TCP 66 http > 33125 [FIN, ACK] Seq=10685 Ack=99 Win=14592 Len=0 TSval=660878127 TSecr=20517861
 21   1.770865 172.31.36.109 -> 54.230.30.206 TCP 66 33125 > http [ACK] Seq=99 Ack=10686 Win=48256 Len=0 TSval=20517861 TSecr=660878127
