[Measurement for 10kb at 03:30:45 20.30.2014] 
Tshark:

  1   0.000000 172.31.36.109 -> 172.31.0.2   DNS 89 Standard query 0x1145  A d3796nkzln59xv.cloudfront.net
  2   0.000027 172.31.36.109 -> 172.31.0.2   DNS 89 Standard query 0xba7c  AAAA d3796nkzln59xv.cloudfront.net
  3   0.000377   172.31.0.2 -> 172.31.36.109 DNS 170 Standard query response 0xba7c 
  4   0.000389   172.31.0.2 -> 172.31.36.109 DNS 217 Standard query response 0x1145  A 54.230.30.210 A 54.230.30.221 A 54.192.30.184 A 54.192.30.216 A 54.192.30.218 A 54.230.30.50 A 54.230.30.72 A 54.230.30.189
  5   0.003890 172.31.36.109 -> 54.230.30.210 TCP 74 51940 > http [SYN] Seq=0 Win=26883 Len=0 MSS=8961 SACK_PERM=1 TSval=29483091 TSecr=0 WS=128
  6   0.005261 54.230.30.210 -> 172.31.36.109 TCP 74 http > 51940 [SYN, ACK] Seq=0 Ack=1 Win=14480 Len=0 MSS=1460 SACK_PERM=1 TSval=698410504 TSecr=29483091 WS=128
  7   0.005294 172.31.36.109 -> 54.230.30.210 TCP 66 51940 > http [ACK] Seq=1 Ack=1 Win=27008 Len=0 TSval=29483091 TSecr=698410504
  8   0.005333 172.31.36.109 -> 54.230.30.210 HTTP 163 GET /10kb HTTP/1.1 
  9   0.006781 54.230.30.210 -> 172.31.36.109 TCP 66 http > 51940 [ACK] Seq=1 Ack=98 Win=14592 Len=0 TSval=698410504 TSecr=29483091
 10   0.017456 54.230.30.210 -> 172.31.36.109 TCP 8754 [TCP segment of a reassembled PDU]
 11   0.017467 172.31.36.109 -> 54.230.30.210 TCP 66 51940 > http [ACK] Seq=98 Ack=8689 Win=44288 Len=0 TSval=29483094 TSecr=698410505
 12   0.017503 54.230.30.210 -> 172.31.36.109 HTTP 2073 HTTP/1.1 200 OK  (application/octet-stream)
 13   0.017509 172.31.36.109 -> 54.230.30.210 TCP 66 51940 > http [ACK] Seq=98 Ack=10696 Win=48384 Len=0 TSval=29483094 TSecr=698410505
 14   0.017644 172.31.36.109 -> 54.230.30.210 TCP 66 51940 > http [FIN, ACK] Seq=98 Ack=10696 Win=48384 Len=0 TSval=29483095 TSecr=698410505
 15   0.019028 54.230.30.210 -> 172.31.36.109 TCP 66 http > 51940 [FIN, ACK] Seq=10696 Ack=99 Win=14592 Len=0 TSval=698410505 TSecr=29483095
 16   0.019036 172.31.36.109 -> 54.230.30.210 TCP 66 51940 > http [ACK] Seq=99 Ack=10697 Win=48384 Len=0 TSval=29483095 TSecr=698410505
