[Measurement for 10kb at 04:30:45 20.30.2014] 
Tshark:

  1   0.000000 172.31.36.109 -> 172.31.0.2   DNS 89 Standard query 0xb95e  A d3796nkzln59xv.cloudfront.net
  2   0.000024 172.31.36.109 -> 172.31.0.2   DNS 89 Standard query 0x81ae  AAAA d3796nkzln59xv.cloudfront.net
  3   0.000467   172.31.0.2 -> 172.31.36.109 DNS 217 Standard query response 0xb95e  A 54.192.29.221 A 54.192.30.214 A 54.230.30.3 A 54.230.30.50 A 54.230.30.72 A 54.230.30.73 A 54.230.30.202 A 54.230.30.218
  4   0.000477   172.31.0.2 -> 172.31.36.109 DNS 170 Standard query response 0x81ae 
  5   0.003867 172.31.36.109 -> 54.192.29.221 TCP 74 58378 > http [SYN] Seq=0 Win=26883 Len=0 MSS=8961 SACK_PERM=1 TSval=30383045 TSecr=0 WS=128
  6   0.005091 54.192.29.221 -> 172.31.36.109 TCP 74 http > 58378 [SYN, ACK] Seq=0 Ack=1 Win=14480 Len=0 MSS=1460 SACK_PERM=1 TSval=695868703 TSecr=30383045 WS=128
  7   0.005104 172.31.36.109 -> 54.192.29.221 TCP 66 58378 > http [ACK] Seq=1 Ack=1 Win=27008 Len=0 TSval=30383045 TSecr=695868703
  8   0.005143 172.31.36.109 -> 54.192.29.221 HTTP 163 GET /10kb HTTP/1.1 
  9   0.006352 54.192.29.221 -> 172.31.36.109 TCP 66 http > 58378 [ACK] Seq=1 Ack=98 Win=14592 Len=0 TSval=695868703 TSecr=30383045
 10   0.017485 54.192.29.221 -> 172.31.36.109 HTTP 10761 HTTP/1.1 200 OK  (application/octet-stream)
 11   0.017498 172.31.36.109 -> 54.192.29.221 TCP 66 58378 > http [ACK] Seq=98 Ack=10696 Win=48384 Len=0 TSval=30383048 TSecr=695868704
 12   0.017656 172.31.36.109 -> 54.192.29.221 TCP 66 58378 > http [FIN, ACK] Seq=98 Ack=10696 Win=48384 Len=0 TSval=30383048 TSecr=695868704
 13   0.018750 54.192.29.221 -> 172.31.36.109 TCP 66 http > 58378 [FIN, ACK] Seq=10696 Ack=99 Win=14592 Len=0 TSval=695868705 TSecr=30383048
 14   0.018758 172.31.36.109 -> 54.192.29.221 TCP 66 58378 > http [ACK] Seq=99 Ack=10697 Win=48384 Len=0 TSval=30383048 TSecr=695868705
