[Measurement for 10kb at 10:30:49 20.30.2014] 
Tshark:

  1   0.000000 172.31.36.109 -> 172.31.0.2   DNS 89 Standard query 0xc34e  A d3796nkzln59xv.cloudfront.net
  2   0.000028 172.31.36.109 -> 172.31.0.2   DNS 89 Standard query 0xa27c  AAAA d3796nkzln59xv.cloudfront.net
  3   0.000520   172.31.0.2 -> 172.31.36.109 DNS 170 Standard query response 0xa27c 
  4   0.000531   172.31.0.2 -> 172.31.36.109 DNS 217 Standard query response 0xc34e  A 54.230.30.245 A 54.230.30.247 A 54.192.30.139 A 54.192.30.191 A 54.230.29.238 A 54.230.30.68 A 54.230.30.213 A 54.230.30.233
  5   0.003872 172.31.36.109 -> 54.230.30.245 TCP 74 45141 > http [SYN] Seq=0 Win=26883 Len=0 MSS=8961 SACK_PERM=1 TSval=35784043 TSecr=0 WS=128
  6   0.004947 54.230.30.245 -> 172.31.36.109 TCP 74 http > 45141 [SYN, ACK] Seq=0 Ack=1 Win=14480 Len=0 MSS=1460 SACK_PERM=1 TSval=641615129 TSecr=35784043 WS=128
  7   0.004961 172.31.36.109 -> 54.230.30.245 TCP 66 45141 > http [ACK] Seq=1 Ack=1 Win=27008 Len=0 TSval=35784044 TSecr=641615129
  8   0.004997 172.31.36.109 -> 54.230.30.245 HTTP 163 GET /10kb HTTP/1.1 
  9   0.006445 54.230.30.245 -> 172.31.36.109 TCP 66 http > 45141 [ACK] Seq=1 Ack=98 Win=14592 Len=0 TSval=641615129 TSecr=35784044
 10   0.036974 54.230.30.245 -> 172.31.36.109 TCP 7306 [TCP segment of a reassembled PDU]
 11   0.036985 172.31.36.109 -> 54.230.30.245 TCP 66 45141 > http [ACK] Seq=98 Ack=7241 Win=41472 Len=0 TSval=35784052 TSecr=641615132
 12   0.036993 54.230.30.245 -> 172.31.36.109 HTTP 3521 HTTP/1.1 200 OK  (application/octet-stream)
 13   0.036998 172.31.36.109 -> 54.230.30.245 TCP 66 45141 > http [ACK] Seq=98 Ack=10696 Win=48384 Len=0 TSval=35784052 TSecr=641615132
 14   0.037166 172.31.36.109 -> 54.230.30.245 TCP 66 45141 > http [FIN, ACK] Seq=98 Ack=10696 Win=48384 Len=0 TSval=35784052 TSecr=641615132
 15   0.038450 54.230.30.245 -> 172.31.36.109 TCP 66 http > 45141 [FIN, ACK] Seq=10696 Ack=99 Win=14592 Len=0 TSval=641615132 TSecr=35784052
 16   0.038459 172.31.36.109 -> 54.230.30.245 TCP 66 45141 > http [ACK] Seq=99 Ack=10697 Win=48384 Len=0 TSval=35784052 TSecr=641615132
