[Measurement for 10kb at 12:30:45 20.30.2014] 
Tshark:

  1   0.000000 172.31.36.109 -> 172.31.0.2   DNS 89 Standard query 0xb024  A d3796nkzln59xv.cloudfront.net
  2   0.000029 172.31.36.109 -> 172.31.0.2   DNS 89 Standard query 0xd522  AAAA d3796nkzln59xv.cloudfront.net
  3   0.000611   172.31.0.2 -> 172.31.36.109 DNS 170 Standard query response 0xd522 
  4   0.000622   172.31.0.2 -> 172.31.36.109 DNS 217 Standard query response 0xb024  A 54.230.30.192 A 54.230.30.210 A 54.230.30.221 A 54.230.30.242 A 54.230.30.248 A 54.192.30.224 A 54.230.30.26 A 54.230.30.28
  5   0.003838 172.31.36.109 -> 54.230.30.192 TCP 74 51445 > http [SYN] Seq=0 Win=26883 Len=0 MSS=8961 SACK_PERM=1 TSval=37583094 TSecr=0 WS=128
  6   0.004993 54.230.30.192 -> 172.31.36.109 TCP 74 http > 51445 [SYN, ACK] Seq=0 Ack=1 Win=14480 Len=0 MSS=1460 SACK_PERM=1 TSval=725042620 TSecr=37583094 WS=128
  7   0.005007 172.31.36.109 -> 54.230.30.192 TCP 66 51445 > http [ACK] Seq=1 Ack=1 Win=27008 Len=0 TSval=37583094 TSecr=725042620
  8   0.005056 172.31.36.109 -> 54.230.30.192 HTTP 163 GET /10kb HTTP/1.1 
  9   0.006273 54.230.30.192 -> 172.31.36.109 TCP 66 http > 51445 [ACK] Seq=1 Ack=98 Win=14592 Len=0 TSval=725042621 TSecr=37583094
 10   0.062757 54.230.30.192 -> 172.31.36.109 HTTP 10761 HTTP/1.1 200 OK  (application/octet-stream)
 11   0.062770 172.31.36.109 -> 54.230.30.192 TCP 66 51445 > http [ACK] Seq=98 Ack=10696 Win=48384 Len=0 TSval=37583109 TSecr=725042626
 12   0.062947 172.31.36.109 -> 54.230.30.192 TCP 66 51445 > http [FIN, ACK] Seq=98 Ack=10696 Win=48384 Len=0 TSval=37583109 TSecr=725042626
 13   0.064299 54.230.30.192 -> 172.31.36.109 TCP 66 http > 51445 [FIN, ACK] Seq=10696 Ack=99 Win=14592 Len=0 TSval=725042626 TSecr=37583109
 14   0.064307 172.31.36.109 -> 54.230.30.192 TCP 66 51445 > http [ACK] Seq=99 Ack=10697 Win=48384 Len=0 TSval=37583109 TSecr=725042626
