[Measurement for 10kb at 11:30:45 20.30.2014] 
Tshark:

  1   0.000000 172.31.36.109 -> 172.31.0.2   DNS 89 Standard query 0x6824  A d3796nkzln59xv.cloudfront.net
  2   0.000025 172.31.36.109 -> 172.31.0.2   DNS 89 Standard query 0x7524  AAAA d3796nkzln59xv.cloudfront.net
  3   0.000470   172.31.0.2 -> 172.31.36.109 DNS 217 Standard query response 0x6824  A 54.230.30.239 A 54.230.30.17 A 54.230.30.26 A 54.230.30.39 A 54.230.30.69 A 54.230.30.72 A 54.230.30.217 A 54.230.30.226
  4   0.000483   172.31.0.2 -> 172.31.36.109 DNS 170 Standard query response 0x7524 
  5   0.003860 172.31.36.109 -> 54.230.30.239 TCP 74 50273 > http [SYN] Seq=0 Win=26883 Len=0 MSS=8961 SACK_PERM=1 TSval=36682908 TSecr=0 WS=128
  6   0.006486 54.230.30.239 -> 172.31.36.109 TCP 74 http > 50273 [SYN, ACK] Seq=0 Ack=1 Win=14480 Len=0 MSS=1460 SACK_PERM=1 TSval=728429412 TSecr=36682908 WS=128
  7   0.006517 172.31.36.109 -> 54.230.30.239 TCP 66 50273 > http [ACK] Seq=1 Ack=1 Win=27008 Len=0 TSval=36682908 TSecr=728429412
  8   0.006566 172.31.36.109 -> 54.230.30.239 HTTP 163 GET /10kb HTTP/1.1 
  9   0.007964 54.230.30.239 -> 172.31.36.109 TCP 66 http > 50273 [ACK] Seq=1 Ack=98 Win=14592 Len=0 TSval=728429413 TSecr=36682908
 10   0.048542 54.230.30.239 -> 172.31.36.109 TCP 1144 [TCP segment of a reassembled PDU]
 11   0.048551 172.31.36.109 -> 54.230.30.239 TCP 66 50273 > http [ACK] Seq=98 Ack=1079 Win=29056 Len=0 TSval=36682919 TSecr=728429417
 12   0.048572 54.230.30.239 -> 172.31.36.109 HTTP 9683 HTTP/1.1 200 OK  (application/octet-stream)
 13   0.048579 172.31.36.109 -> 54.230.30.239 TCP 66 50273 > http [ACK] Seq=98 Ack=10696 Win=48384 Len=0 TSval=36682919 TSecr=728429417
 14   0.048748 172.31.36.109 -> 54.230.30.239 TCP 66 50273 > http [FIN, ACK] Seq=98 Ack=10696 Win=48384 Len=0 TSval=36682919 TSecr=728429417
 15   0.050023 54.230.30.239 -> 172.31.36.109 TCP 66 http > 50273 [FIN, ACK] Seq=10696 Ack=99 Win=14592 Len=0 TSval=728429417 TSecr=36682919
 16   0.050031 172.31.36.109 -> 54.230.30.239 TCP 66 50273 > http [ACK] Seq=99 Ack=10697 Win=48384 Len=0 TSval=36682919 TSecr=728429417
