[Measurement for 10kb at 13:30:50 20.30.2014] 
Tshark:

  1   0.000000 172.31.36.109 -> 172.31.0.2   DNS 89 Standard query 0x92f9  A d3796nkzln59xv.cloudfront.net
  2   0.000079 172.31.36.109 -> 172.31.0.2   DNS 89 Standard query 0xf7c8  AAAA d3796nkzln59xv.cloudfront.net
  3   0.000574   172.31.0.2 -> 172.31.36.109 DNS 170 Standard query response 0xf7c8 
  4   0.000588   172.31.0.2 -> 172.31.36.109 DNS 217 Standard query response 0x92f9  A 54.239.158.238 A 54.230.185.176 A 54.230.185.254 A 54.230.186.86 A 54.230.186.130 A 54.230.186.236 A 54.230.187.81 A 54.230.187.101
  5   0.003877 172.31.36.109 -> 54.239.158.238 TCP 74 47659 > http [SYN] Seq=0 Win=26883 Len=0 MSS=8961 SACK_PERM=1 TSval=38484243 TSecr=0 WS=128
  6   0.021972 54.239.158.238 -> 172.31.36.109 TCP 74 http > 47659 [SYN, ACK] Seq=0 Ack=1 Win=14480 Len=0 MSS=1460 SACK_PERM=1 TSval=1397898141 TSecr=38484243 WS=128
  7   0.021989 172.31.36.109 -> 54.239.158.238 TCP 66 47659 > http [ACK] Seq=1 Ack=1 Win=27008 Len=0 TSval=38484248 TSecr=1397898141
  8   0.022052 172.31.36.109 -> 54.239.158.238 HTTP 163 GET /10kb HTTP/1.1 
  9   0.039936 54.239.158.238 -> 172.31.36.109 TCP 66 http > 47659 [ACK] Seq=1 Ack=98 Win=14592 Len=0 TSval=1397898143 TSecr=38484248
 10   0.174953 54.239.158.238 -> 172.31.36.109 TCP 1514 [TCP segment of a reassembled PDU]
 11   0.174994 172.31.36.109 -> 54.239.158.238 TCP 66 47659 > http [ACK] Seq=98 Ack=1449 Win=29824 Len=0 TSval=38484286 TSecr=1397898156
 12   0.175144 54.239.158.238 -> 172.31.36.109 TCP 4505 [TCP segment of a reassembled PDU]
 13   0.175152 172.31.36.109 -> 54.239.158.238 TCP 66 47659 > http [ACK] Seq=98 Ack=5888 Win=38784 Len=0 TSval=38484286 TSecr=1397898156
 14   0.175160 54.239.158.238 -> 172.31.36.109 HTTP 4863 HTTP/1.1 200 OK  (application/octet-stream)
 15   0.175165 172.31.36.109 -> 54.239.158.238 TCP 66 47659 > http [ACK] Seq=98 Ack=10685 Win=48256 Len=0 TSval=38484286 TSecr=1397898156
 16   0.175602 172.31.36.109 -> 54.239.158.238 TCP 66 47659 > http [FIN, ACK] Seq=98 Ack=10685 Win=48256 Len=0 TSval=38484286 TSecr=1397898156
 17   0.193845 54.239.158.238 -> 172.31.36.109 TCP 66 http > 47659 [FIN, ACK] Seq=10685 Ack=99 Win=14592 Len=0 TSval=1397898158 TSecr=38484286
 18   0.193856 172.31.36.109 -> 54.239.158.238 TCP 66 47659 > http [ACK] Seq=99 Ack=10686 Win=48256 Len=0 TSval=38484291 TSecr=1397898158
