[Measurement for 10kb at 02:30:45 20.30.2014] 
Tshark:

  1   0.000000 172.31.36.109 -> 172.31.0.2   DNS 89 Standard query 0x7c95  A d3796nkzln59xv.cloudfront.net
  2   0.000026 172.31.36.109 -> 172.31.0.2   DNS 89 Standard query 0x491f  AAAA d3796nkzln59xv.cloudfront.net
  3   0.000622   172.31.0.2 -> 172.31.36.109 DNS 217 Standard query response 0x7c95  A 54.192.30.214 A 54.192.30.216 A 54.230.30.53 A 54.230.30.71 A 54.230.30.210 A 54.230.30.212 A 54.230.30.218 A 54.230.30.245
  4   0.000633   172.31.0.2 -> 172.31.36.109 DNS 170 Standard query response 0x491f 
  5   0.003870 172.31.36.109 -> 54.192.30.214 TCP 74 50272 > http [SYN] Seq=0 Win=26883 Len=0 MSS=8961 SACK_PERM=1 TSval=28582980 TSecr=0 WS=128
  6   0.005100 54.192.30.214 -> 172.31.36.109 TCP 74 http > 50272 [SYN, ACK] Seq=0 Ack=1 Win=14480 Len=0 MSS=1460 SACK_PERM=1 TSval=683314076 TSecr=28582980 WS=128
  7   0.005115 172.31.36.109 -> 54.192.30.214 TCP 66 50272 > http [ACK] Seq=1 Ack=1 Win=27008 Len=0 TSval=28582981 TSecr=683314076
  8   0.005163 172.31.36.109 -> 54.192.30.214 HTTP 163 GET /10kb HTTP/1.1 
  9   0.006225 54.192.30.214 -> 172.31.36.109 TCP 66 http > 50272 [ACK] Seq=1 Ack=98 Win=14592 Len=0 TSval=683314076 TSecr=28582981
 10   0.035036 54.192.30.214 -> 172.31.36.109 TCP 1144 [TCP segment of a reassembled PDU]
 11   0.035047 172.31.36.109 -> 54.192.30.214 TCP 66 50272 > http [ACK] Seq=98 Ack=1079 Win=29056 Len=0 TSval=28582988 TSecr=683314079
 12   0.035101 54.192.30.214 -> 172.31.36.109 TCP 4410 [TCP segment of a reassembled PDU]
 13   0.035109 172.31.36.109 -> 54.192.30.214 TCP 66 50272 > http [ACK] Seq=98 Ack=5423 Win=37760 Len=0 TSval=28582988 TSecr=683314079
 14   0.035132 54.192.30.214 -> 172.31.36.109 HTTP 5339 HTTP/1.1 200 OK  (application/octet-stream)
 15   0.035138 172.31.36.109 -> 54.192.30.214 TCP 66 50272 > http [ACK] Seq=98 Ack=10696 Win=48384 Len=0 TSval=28582988 TSecr=683314079
 16   0.035282 172.31.36.109 -> 54.192.30.214 TCP 66 50272 > http [FIN, ACK] Seq=98 Ack=10696 Win=48384 Len=0 TSval=28582988 TSecr=683314079
 17   0.039813 54.192.30.214 -> 172.31.36.109 TCP 66 http > 50272 [FIN, ACK] Seq=10696 Ack=99 Win=14592 Len=0 TSval=683314079 TSecr=28582988
 18   0.039822 172.31.36.109 -> 54.192.30.214 TCP 66 50272 > http [ACK] Seq=99 Ack=10697 Win=48384 Len=0 TSval=28582989 TSecr=683314079
