[Measurement for 100kb at 09:43:44 20.43.2014] 
Tshark:

  1   0.000000 172.31.8.238 -> 172.31.0.2   DNS 89 Standard query 0x6749  A d1n0gskdvzj94j.cloudfront.net
  2   0.000038 172.31.8.238 -> 172.31.0.2   DNS 89 Standard query 0x5c85  AAAA d1n0gskdvzj94j.cloudfront.net
  3   0.000476   172.31.0.2 -> 172.31.8.238 DNS 176 Standard query response 0x5c85 
  4   0.000510   172.31.0.2 -> 172.31.8.238 DNS 217 Standard query response 0x6749  A 54.230.118.146 A 54.230.119.11 A 54.230.119.55 A 54.230.119.150 A 54.239.132.147 A 54.239.132.233 A 54.192.118.218 A 54.230.116.98
  5   0.003830 172.31.8.238 -> 54.230.118.146 TCP 74 54399 > http [SYN] Seq=0 Win=26883 Len=0 MSS=8961 SACK_PERM=1 TSval=15063030 TSecr=0 WS=128
  6   0.004698 54.230.118.146 -> 172.31.8.238 TCP 74 http > 54399 [SYN, ACK] Seq=0 Ack=1 Win=14480 Len=0 MSS=1460 SACK_PERM=1 TSval=1687347927 TSecr=15063030 WS=128
  7   0.004713 172.31.8.238 -> 54.230.118.146 TCP 66 54399 > http [ACK] Seq=1 Ack=1 Win=27008 Len=0 TSval=15063030 TSecr=1687347927
  8   0.004755 172.31.8.238 -> 54.230.118.146 HTTP 164 GET /100kb HTTP/1.1 
  9   0.005535 54.230.118.146 -> 172.31.8.238 TCP 66 http > 54399 [ACK] Seq=1 Ack=99 Win=14592 Len=0 TSval=1687347927 TSecr=15063030
 10   0.006986 54.230.118.146 -> 172.31.8.238 TCP 522 [TCP segment of a reassembled PDU]
 11   0.006993 172.31.8.238 -> 54.230.118.146 TCP 66 54399 > http [ACK] Seq=99 Ack=457 Win=28032 Len=0 TSval=15063031 TSecr=1687347927
 12   0.007054 54.230.118.146 -> 172.31.8.238 TCP 5858 [TCP segment of a reassembled PDU]
 13   0.007062 172.31.8.238 -> 54.230.118.146 TCP 66 54399 > http [ACK] Seq=99 Ack=6249 Win=39552 Len=0 TSval=15063031 TSecr=1687347927
 14   0.007144 54.230.118.146 -> 172.31.8.238 TCP 7306 [TCP segment of a reassembled PDU]
 15   0.007152 172.31.8.238 -> 54.230.118.146 TCP 66 54399 > http [ACK] Seq=99 Ack=13489 Win=54144 Len=0 TSval=15063031 TSecr=1687347927
 16   0.007791 54.230.118.146 -> 172.31.8.238 TCP 8754 [TCP segment of a reassembled PDU]
 17   0.007799 172.31.8.238 -> 54.230.118.146 TCP 66 54399 > http [ACK] Seq=99 Ack=22177 Win=71424 Len=0 TSval=15063031 TSecr=1687347927
 18   0.007840 54.230.118.146 -> 172.31.8.238 TCP 4410 [TCP segment of a reassembled PDU]
 19   0.007846 172.31.8.238 -> 54.230.118.146 TCP 66 54399 > http [ACK] Seq=99 Ack=26521 Win=80128 Len=0 TSval=15063031 TSecr=1687347927
 20   0.008559 54.230.118.146 -> 172.31.8.238 TCP 5858 [TCP segment of a reassembled PDU]
 21   0.008566 172.31.8.238 -> 54.230.118.146 TCP 66 54399 > http [ACK] Seq=99 Ack=32313 Win=91776 Len=0 TSval=15063031 TSecr=1687347927
 22   0.008702 54.230.118.146 -> 172.31.8.238 TCP 15994 [TCP segment of a reassembled PDU]
 23   0.008714 172.31.8.238 -> 54.230.118.146 TCP 66 54399 > http [ACK] Seq=99 Ack=48241 Win=91648 Len=0 TSval=15063031 TSecr=1687347927
 24   0.009329 54.230.118.146 -> 172.31.8.238 TCP 4410 [TCP segment of a reassembled PDU]
 25   0.009348 172.31.8.238 -> 54.230.118.146 TCP 66 54399 > http [ACK] Seq=99 Ack=52585 Win=100480 Len=0 TSval=15063031 TSecr=1687347927
 26   0.009485 54.230.118.146 -> 172.31.8.238 TCP 13098 [TCP segment of a reassembled PDU]
 27   0.009494 172.31.8.238 -> 54.230.118.146 TCP 66 54399 > http [ACK] Seq=99 Ack=65617 Win=96512 Len=0 TSval=15063031 TSecr=1687347927
 28   0.010119 54.230.118.146 -> 172.31.8.238 TCP 15994 [TCP segment of a reassembled PDU]
 29   0.010129 172.31.8.238 -> 54.230.118.146 TCP 66 54399 > http [ACK] Seq=99 Ack=81545 Win=91648 Len=0 TSval=15063031 TSecr=1687347927
 30   0.010179 54.230.118.146 -> 172.31.8.238 TCP 11650 [TCP segment of a reassembled PDU]
 31   0.010187 172.31.8.238 -> 54.230.118.146 TCP 66 54399 > http [ACK] Seq=99 Ack=93129 Win=98944 Len=0 TSval=15063031 TSecr=1687347927
 32   0.010864 54.230.118.146 -> 172.31.8.238 TCP 2962 [TCP segment of a reassembled PDU]
 33   0.010869 172.31.8.238 -> 54.230.118.146 TCP 66 54399 > http [ACK] Seq=99 Ack=96025 Win=106240 Len=0 TSval=15063032 TSecr=1687347928
 34   0.010963 54.230.118.146 -> 172.31.8.238 HTTP 6898 HTTP/1.1 200 OK  (application/octet-stream)
 35   0.010969 172.31.8.238 -> 54.230.118.146 TCP 66 54399 > http [ACK] Seq=99 Ack=102857 Win=119936 Len=0 TSval=15063032 TSecr=1687347928
 36   0.011094 172.31.8.238 -> 54.230.118.146 TCP 66 54399 > http [FIN, ACK] Seq=99 Ack=102857 Win=119936 Len=0 TSval=15063032 TSecr=1687347928
 37   0.011608 54.230.118.146 -> 172.31.8.238 TCP 66 http > 54399 [FIN, ACK] Seq=102857 Ack=100 Win=14592 Len=0 TSval=1687347928 TSecr=15063032
 38   0.011616 172.31.8.238 -> 54.230.118.146 TCP 66 54399 > http [ACK] Seq=100 Ack=102858 Win=119936 Len=0 TSval=15063032 TSecr=1687347928
