[Measurement for 100kb at 20:43:14 19.43.2014] 
Tshark:

  1   0.000000 172.31.8.238 -> 172.31.0.2   DNS 89 Standard query 0x6ecc  A d1n0gskdvzj94j.cloudfront.net
  2   0.000037 172.31.8.238 -> 172.31.0.2   DNS 89 Standard query 0x80a8  AAAA d1n0gskdvzj94j.cloudfront.net
  3   0.000501   172.31.0.2 -> 172.31.8.238 DNS 176 Standard query response 0x80a8 
  4   0.000513   172.31.0.2 -> 172.31.8.238 DNS 217 Standard query response 0x6ecc  A 54.230.117.21 A 54.230.118.114 A 54.230.119.58 A 54.230.119.66 A 54.230.119.165 A 54.239.132.55 A 54.192.118.236 A 54.230.116.167
  5   0.003894 172.31.8.238 -> 54.230.117.21 TCP 74 33764 > http [SYN] Seq=0 Win=26883 Len=0 MSS=8961 SACK_PERM=1 TSval=3355459 TSecr=0 WS=128
  6   0.004685 54.230.117.21 -> 172.31.8.238 TCP 74 http > 33764 [SYN, ACK] Seq=0 Ack=1 Win=14480 Len=0 MSS=1460 SACK_PERM=1 TSval=1682632337 TSecr=3355459 WS=128
  7   0.004699 172.31.8.238 -> 54.230.117.21 TCP 66 33764 > http [ACK] Seq=1 Ack=1 Win=27008 Len=0 TSval=3355459 TSecr=1682632337
  8   0.004738 172.31.8.238 -> 54.230.117.21 HTTP 164 GET /100kb HTTP/1.1 
  9   0.005425 54.230.117.21 -> 172.31.8.238 TCP 66 http > 33764 [ACK] Seq=1 Ack=99 Win=14592 Len=0 TSval=1682632337 TSecr=3355459
 10   0.007269 54.230.117.21 -> 172.31.8.238 TCP 2593 [TCP segment of a reassembled PDU]
 11   0.007278 172.31.8.238 -> 54.230.117.21 TCP 66 33764 > http [ACK] Seq=99 Ack=2528 Win=32000 Len=0 TSval=3355460 TSecr=1682632338
 12   0.007387 54.230.117.21 -> 172.31.8.238 TCP 11650 [TCP segment of a reassembled PDU]
 13   0.007397 172.31.8.238 -> 54.230.117.21 TCP 66 33764 > http [ACK] Seq=99 Ack=14112 Win=55168 Len=0 TSval=3355460 TSecr=1682632338
 14   0.008060 54.230.117.21 -> 172.31.8.238 TCP 7306 [TCP segment of a reassembled PDU]
 15   0.008068 172.31.8.238 -> 54.230.117.21 TCP 66 33764 > http [ACK] Seq=99 Ack=21352 Win=69632 Len=0 TSval=3355460 TSecr=1682632338
 16   0.008157 54.230.117.21 -> 172.31.8.238 TCP 5858 [TCP segment of a reassembled PDU]
 17   0.008163 172.31.8.238 -> 54.230.117.21 TCP 66 33764 > http [ACK] Seq=99 Ack=27144 Win=81280 Len=0 TSval=3355460 TSecr=1682632338
 18   0.008783 54.230.117.21 -> 172.31.8.238 TCP 4410 [TCP segment of a reassembled PDU]
 19   0.008789 172.31.8.238 -> 54.230.117.21 TCP 66 33764 > http [ACK] Seq=99 Ack=31488 Win=89984 Len=0 TSval=3355460 TSecr=1682632338
 20   0.008897 54.230.117.21 -> 172.31.8.238 TCP 15994 [TCP segment of a reassembled PDU]
 21   0.008907 172.31.8.238 -> 54.230.117.21 TCP 66 33764 > http [ACK] Seq=99 Ack=47416 Win=91648 Len=0 TSval=3355460 TSecr=1682632338
 22   0.009391 54.230.117.21 -> 172.31.8.238 TCP 2962 [TCP segment of a reassembled PDU]
 23   0.009397 172.31.8.238 -> 54.230.117.21 TCP 66 33764 > http [ACK] Seq=99 Ack=50312 Win=109056 Len=0 TSval=3355460 TSecr=1682632338
 24   0.009507 54.230.117.21 -> 172.31.8.238 TCP 14546 [TCP segment of a reassembled PDU]
 25   0.009516 172.31.8.238 -> 54.230.117.21 TCP 66 33764 > http [ACK] Seq=99 Ack=64792 Win=94592 Len=0 TSval=3355460 TSecr=1682632338
 26   0.009521 54.230.117.21 -> 172.31.8.238 TCP 1514 [TCP segment of a reassembled PDU]
 27   0.009524 172.31.8.238 -> 54.230.117.21 TCP 66 33764 > http [ACK] Seq=99 Ack=66240 Win=93184 Len=0 TSval=3355460 TSecr=1682632338
 28   0.010142 54.230.117.21 -> 172.31.8.238 TCP 2962 [TCP segment of a reassembled PDU]
 29   0.010148 172.31.8.238 -> 54.230.117.21 TCP 66 33764 > http [ACK] Seq=99 Ack=69136 Win=109056 Len=0 TSval=3355460 TSecr=1682632338
 30   0.010264 54.230.117.21 -> 172.31.8.238 TCP 17442 [TCP segment of a reassembled PDU]
 31   0.010275 172.31.8.238 -> 54.230.117.21 TCP 66 33764 > http [ACK] Seq=99 Ack=86512 Win=91776 Len=0 TSval=3355460 TSecr=1682632338
 32   0.010298 54.230.117.21 -> 172.31.8.238 TCP 4410 [TCP segment of a reassembled PDU]
 33   0.010304 172.31.8.238 -> 54.230.117.21 TCP 66 33764 > http [ACK] Seq=99 Ack=90856 Win=87552 Len=0 TSval=3355460 TSecr=1682632338
 34   0.011005 54.230.117.21 -> 172.31.8.238 TCP 2962 [TCP segment of a reassembled PDU]
 35   0.011010 172.31.8.238 -> 54.230.117.21 TCP 66 33764 > http [ACK] Seq=99 Ack=93752 Win=109056 Len=0 TSval=3355461 TSecr=1682632338
 36   0.011103 54.230.117.21 -> 172.31.8.238 HTTP 9170 HTTP/1.1 200 OK  (application/octet-stream)
 37   0.011110 172.31.8.238 -> 54.230.117.21 TCP 66 33764 > http [ACK] Seq=99 Ack=102856 Win=127232 Len=0 TSval=3355461 TSecr=1682632338
 38   0.011267 172.31.8.238 -> 54.230.117.21 TCP 66 33764 > http [FIN, ACK] Seq=99 Ack=102856 Win=127232 Len=0 TSval=3355461 TSecr=1682632338
 39   0.011754 54.230.117.21 -> 172.31.8.238 TCP 66 http > 33764 [FIN, ACK] Seq=102856 Ack=100 Win=14592 Len=0 TSval=1682632338 TSecr=3355461
 40   0.011761 172.31.8.238 -> 54.230.117.21 TCP 66 33764 > http [ACK] Seq=100 Ack=102857 Win=127232 Len=0 TSval=3355461 TSecr=1682632338
