[Measurement for 100kb at 12:41:46 20.41.2014] 
Tshark:

  1   0.000000 172.31.8.238 -> 172.31.0.2   DNS 89 Standard query 0xbb11  A d1dx94olpiqj0t.cloudfront.net
  2   0.000038 172.31.8.238 -> 172.31.0.2   DNS 89 Standard query 0xc585  AAAA d1dx94olpiqj0t.cloudfront.net
  3   0.000641   172.31.0.2 -> 172.31.8.238 DNS 217 Standard query response 0xbb11  A 54.230.116.204 A 54.230.116.239 A 54.230.117.10 A 54.230.117.15 A 54.230.119.66 A 54.239.132.90 A 54.192.118.221 A 54.192.118.241
  4   0.000656   172.31.0.2 -> 172.31.8.238 DNS 176 Standard query response 0xc585 
  5   0.003852 172.31.8.238 -> 54.230.116.204 TCP 74 58259 > http [SYN] Seq=0 Win=26883 Len=0 MSS=8961 SACK_PERM=1 TSval=17733671 TSecr=0 WS=128
  6   0.004625 54.230.116.204 -> 172.31.8.238 TCP 74 http > 58259 [SYN, ACK] Seq=0 Ack=1 Win=14480 Len=0 MSS=1460 SACK_PERM=1 TSval=1685104597 TSecr=17733671 WS=128
  7   0.004640 172.31.8.238 -> 54.230.116.204 TCP 66 58259 > http [ACK] Seq=1 Ack=1 Win=27008 Len=0 TSval=17733671 TSecr=1685104597
  8   0.004690 172.31.8.238 -> 54.230.116.204 HTTP 164 GET /100kb HTTP/1.1 
  9   0.005328 54.230.116.204 -> 172.31.8.238 TCP 66 http > 58259 [ACK] Seq=1 Ack=99 Win=14592 Len=0 TSval=1685104597 TSecr=17733671
 10   0.008180 54.230.116.204 -> 172.31.8.238 TCP 2580 [TCP segment of a reassembled PDU]
 11   0.008189 172.31.8.238 -> 54.230.116.204 TCP 66 58259 > http [ACK] Seq=99 Ack=2515 Win=32000 Len=0 TSval=17733672 TSecr=1685104597
 12   0.008254 54.230.116.204 -> 172.31.8.238 TCP 11650 [TCP segment of a reassembled PDU]
 13   0.008276 172.31.8.238 -> 54.230.116.204 TCP 66 58259 > http [ACK] Seq=99 Ack=14099 Win=55168 Len=0 TSval=17733672 TSecr=1685104597
 14   0.008755 54.230.116.204 -> 172.31.8.238 TCP 2962 [TCP segment of a reassembled PDU]
 15   0.008760 172.31.8.238 -> 54.230.116.204 TCP 66 58259 > http [ACK] Seq=99 Ack=16995 Win=60928 Len=0 TSval=17733672 TSecr=1685104597
 16   0.008861 54.230.116.204 -> 172.31.8.238 TCP 10202 [TCP segment of a reassembled PDU]
 17   0.008869 172.31.8.238 -> 54.230.116.204 TCP 66 58259 > http [ACK] Seq=99 Ack=27131 Win=81152 Len=0 TSval=17733672 TSecr=1685104597
 18   0.009484 54.230.116.204 -> 172.31.8.238 TCP 14546 [TCP segment of a reassembled PDU]
 19   0.009494 172.31.8.238 -> 54.230.116.204 TCP 66 58259 > http [ACK] Seq=99 Ack=41611 Win=94080 Len=0 TSval=17733672 TSecr=1685104597
 20   0.009530 54.230.116.204 -> 172.31.8.238 TCP 5858 [TCP segment of a reassembled PDU]
 21   0.009536 172.31.8.238 -> 54.230.116.204 TCP 66 58259 > http [ACK] Seq=99 Ack=47403 Win=108416 Len=0 TSval=17733672 TSecr=1685104597
 22   0.010233 54.230.116.204 -> 172.31.8.238 TCP 5858 [TCP segment of a reassembled PDU]
 23   0.010239 172.31.8.238 -> 54.230.116.204 TCP 66 58259 > http [ACK] Seq=99 Ack=53195 Win=108416 Len=0 TSval=17733672 TSecr=1685104597
 24   0.010345 54.230.116.204 -> 172.31.8.238 TCP 13098 [TCP segment of a reassembled PDU]
 25   0.010353 172.31.8.238 -> 54.230.116.204 TCP 66 58259 > http [ACK] Seq=99 Ack=66227 Win=96512 Len=0 TSval=17733673 TSecr=1685104597
 26   0.011003 54.230.116.204 -> 172.31.8.238 TCP 8754 [TCP segment of a reassembled PDU]
 27   0.011011 172.31.8.238 -> 54.230.116.204 TCP 66 58259 > http [ACK] Seq=99 Ack=74915 Win=126464 Len=0 TSval=17733673 TSecr=1685104597
 28   0.011042 54.230.116.204 -> 172.31.8.238 TCP 2962 [TCP segment of a reassembled PDU]
 29   0.011047 172.31.8.238 -> 54.230.116.204 TCP 66 58259 > http [ACK] Seq=99 Ack=77811 Win=132224 Len=0 TSval=17733673 TSecr=1685104597
 30   0.011103 54.230.116.204 -> 172.31.8.238 TCP 1514 [TCP segment of a reassembled PDU]
 31   0.011108 172.31.8.238 -> 54.230.116.204 TCP 66 58259 > http [ACK] Seq=99 Ack=79259 Win=135168 Len=0 TSval=17733673 TSecr=1685104597
 32   0.011180 54.230.116.204 -> 172.31.8.238 TCP 13098 [TCP segment of a reassembled PDU]
 33   0.011189 172.31.8.238 -> 54.230.116.204 TCP 66 58259 > http [ACK] Seq=99 Ack=92291 Win=161152 Len=0 TSval=17733673 TSecr=1685104597
 34   0.011765 54.230.116.204 -> 172.31.8.238 HTTP 10632 HTTP/1.1 200 OK  (application/octet-stream)
 35   0.011773 172.31.8.238 -> 54.230.116.204 TCP 66 58259 > http [ACK] Seq=99 Ack=102857 Win=182272 Len=0 TSval=17733673 TSecr=1685104598
 36   0.011927 172.31.8.238 -> 54.230.116.204 TCP 66 58259 > http [FIN, ACK] Seq=99 Ack=102857 Win=182272 Len=0 TSval=17733673 TSecr=1685104598
 37   0.012463 54.230.116.204 -> 172.31.8.238 TCP 66 http > 58259 [FIN, ACK] Seq=102857 Ack=100 Win=14592 Len=0 TSval=1685104598 TSecr=17733673
 38   0.012471 172.31.8.238 -> 54.230.116.204 TCP 66 58259 > http [ACK] Seq=100 Ack=102858 Win=182272 Len=0 TSval=17733673 TSecr=1685104598
