[Measurement for 100kb at 05:41:46 20.41.2014] 
Tshark:

  1   0.000000 172.31.8.238 -> 172.31.0.2   DNS 89 Standard query 0xdeb6  A d1dx94olpiqj0t.cloudfront.net
  2   0.000040 172.31.8.238 -> 172.31.0.2   DNS 89 Standard query 0x4764  AAAA d1dx94olpiqj0t.cloudfront.net
  3   0.000637   172.31.0.2 -> 172.31.8.238 DNS 176 Standard query response 0x4764 
  4   0.000650   172.31.0.2 -> 172.31.8.238 DNS 217 Standard query response 0xdeb6  A 54.230.119.150 A 54.239.132.55 A 54.230.116.136 A 54.230.117.37 A 54.230.117.154 A 54.230.118.143 A 54.230.118.187 A 54.230.119.106
  5   0.003881 172.31.8.238 -> 54.230.119.150 TCP 74 44522 > http [SYN] Seq=0 Win=26883 Len=0 MSS=8961 SACK_PERM=1 TSval=11433495 TSecr=0 WS=128
  6   0.004532 54.230.119.150 -> 172.31.8.238 TCP 74 http > 44522 [SYN, ACK] Seq=0 Ack=1 Win=14480 Len=0 MSS=1460 SACK_PERM=1 TSval=1686170896 TSecr=11433495 WS=128
  7   0.004545 172.31.8.238 -> 54.230.119.150 TCP 66 44522 > http [ACK] Seq=1 Ack=1 Win=27008 Len=0 TSval=11433495 TSecr=1686170896
  8   0.004584 172.31.8.238 -> 54.230.119.150 HTTP 164 GET /100kb HTTP/1.1 
  9   0.005205 54.230.119.150 -> 172.31.8.238 TCP 66 http > 44522 [ACK] Seq=1 Ack=99 Win=14592 Len=0 TSval=1686170896 TSecr=11433495
 10   0.007631 54.230.119.150 -> 172.31.8.238 TCP 13098 [TCP segment of a reassembled PDU]
 11   0.007644 172.31.8.238 -> 54.230.119.150 TCP 66 44522 > http [ACK] Seq=99 Ack=13033 Win=52992 Len=0 TSval=11433496 TSecr=1686170896
 12   0.008091 54.230.119.150 -> 172.31.8.238 TCP 1514 [TCP segment of a reassembled PDU]
 13   0.008097 172.31.8.238 -> 54.230.119.150 TCP 66 44522 > http [ACK] Seq=99 Ack=14481 Win=55936 Len=0 TSval=11433496 TSecr=1686170896
 14   0.008109 54.230.119.150 -> 172.31.8.238 TCP 11650 [TCP segment of a reassembled PDU]
 15   0.008119 172.31.8.238 -> 54.230.119.150 TCP 66 44522 > http [ACK] Seq=99 Ack=26065 Win=79104 Len=0 TSval=11433496 TSecr=1686170896
 16   0.008633 54.230.119.150 -> 172.31.8.238 TCP 5858 [TCP segment of a reassembled PDU]
 17   0.008640 172.31.8.238 -> 54.230.119.150 TCP 66 44522 > http [ACK] Seq=99 Ack=31857 Win=90624 Len=0 TSval=11433496 TSecr=1686170896
 18   0.008650 54.230.119.150 -> 172.31.8.238 TCP 7306 [TCP segment of a reassembled PDU]
 19   0.008655 172.31.8.238 -> 54.230.119.150 TCP 66 44522 > http [ACK] Seq=99 Ack=39097 Win=96512 Len=0 TSval=11433496 TSecr=1686170896
 20   0.009138 54.230.119.150 -> 172.31.8.238 TCP 1514 [TCP segment of a reassembled PDU]
 21   0.009143 172.31.8.238 -> 54.230.119.150 TCP 66 44522 > http [ACK] Seq=99 Ack=40545 Win=108032 Len=0 TSval=11433496 TSecr=1686170896
 22   0.009198 54.230.119.150 -> 172.31.8.238 TCP 11650 [TCP segment of a reassembled PDU]
 23   0.009207 172.31.8.238 -> 54.230.119.150 TCP 66 44522 > http [ACK] Seq=99 Ack=52129 Win=98944 Len=0 TSval=11433496 TSecr=1686170896
 24   0.009395 54.230.119.150 -> 172.31.8.238 TCP 8754 [TCP segment of a reassembled PDU]
 25   0.009402 172.31.8.238 -> 54.230.119.150 TCP 66 44522 > http [ACK] Seq=99 Ack=60817 Win=103680 Len=0 TSval=11433496 TSecr=1686170896
 26   0.009826 54.230.119.150 -> 172.31.8.238 TCP 1514 [TCP segment of a reassembled PDU]
 27   0.009831 172.31.8.238 -> 54.230.119.150 TCP 66 44522 > http [ACK] Seq=99 Ack=62265 Win=109056 Len=0 TSval=11433496 TSecr=1686170896
 28   0.009968 54.230.119.150 -> 172.31.8.238 TCP 10202 [TCP segment of a reassembled PDU]
 29   0.009976 172.31.8.238 -> 54.230.119.150 TCP 66 44522 > http [ACK] Seq=99 Ack=72401 Win=101248 Len=0 TSval=11433496 TSecr=1686170896
 30   0.010033 54.230.119.150 -> 172.31.8.238 TCP 14546 [TCP segment of a reassembled PDU]
 31   0.010041 172.31.8.238 -> 54.230.119.150 TCP 66 44522 > http [ACK] Seq=99 Ack=86881 Win=94080 Len=0 TSval=11433496 TSecr=1686170896
 32   0.010609 54.230.119.150 -> 172.31.8.238 TCP 5858 [TCP segment of a reassembled PDU]
 33   0.010616 172.31.8.238 -> 54.230.119.150 TCP 66 44522 > http [ACK] Seq=99 Ack=92673 Win=108416 Len=0 TSval=11433497 TSecr=1686170897
 34   0.010729 54.230.119.150 -> 172.31.8.238 HTTP 10250 HTTP/1.1 200 OK  (application/octet-stream)
 35   0.010736 172.31.8.238 -> 54.230.119.150 TCP 66 44522 > http [ACK] Seq=99 Ack=102857 Win=129408 Len=0 TSval=11433497 TSecr=1686170897
 36   0.010874 172.31.8.238 -> 54.230.119.150 TCP 66 44522 > http [FIN, ACK] Seq=99 Ack=102857 Win=129408 Len=0 TSval=11433497 TSecr=1686170897
 37   0.011332 54.230.119.150 -> 172.31.8.238 TCP 66 http > 44522 [FIN, ACK] Seq=102857 Ack=100 Win=14592 Len=0 TSval=1686170897 TSecr=11433497
 38   0.011340 172.31.8.238 -> 54.230.119.150 TCP 66 44522 > http [ACK] Seq=100 Ack=102858 Win=129408 Len=0 TSval=11433497 TSecr=1686170897
