[Measurement for 100kb at 10:41:46 20.41.2014] 
Tshark:

  1   0.000000 172.31.8.238 -> 172.31.0.2   DNS 89 Standard query 0xb8b1  A d1dx94olpiqj0t.cloudfront.net
  2   0.000025 172.31.8.238 -> 172.31.0.2   DNS 89 Standard query 0x894b  AAAA d1dx94olpiqj0t.cloudfront.net
  3   0.000628   172.31.0.2 -> 172.31.8.238 DNS 217 Standard query response 0xb8b1  A 54.239.132.86 A 54.192.118.220 A 54.192.118.236 A 54.230.116.82 A 54.230.119.71 A 54.230.119.86 A 54.230.119.94 A 54.230.119.189
  4   0.000640   172.31.0.2 -> 172.31.8.238 DNS 176 Standard query response 0x894b 
  5   0.003881 172.31.8.238 -> 54.239.132.86 TCP 74 50440 > http [SYN] Seq=0 Win=26883 Len=0 MSS=8961 SACK_PERM=1 TSval=15933497 TSecr=0 WS=128
  6   0.004651 54.239.132.86 -> 172.31.8.238 TCP 74 http > 50440 [SYN, ACK] Seq=0 Ack=1 Win=14480 Len=0 MSS=1460 SACK_PERM=1 TSval=1689132216 TSecr=15933497 WS=128
  7   0.004665 172.31.8.238 -> 54.239.132.86 TCP 66 50440 > http [ACK] Seq=1 Ack=1 Win=27008 Len=0 TSval=15933497 TSecr=1689132216
  8   0.004700 172.31.8.238 -> 54.239.132.86 HTTP 164 GET /100kb HTTP/1.1 
  9   0.005366 54.239.132.86 -> 172.31.8.238 TCP 66 http > 50440 [ACK] Seq=1 Ack=99 Win=14592 Len=0 TSval=1689132216 TSecr=15933497
 10   0.006892 54.239.132.86 -> 172.31.8.238 TCP 522 [TCP segment of a reassembled PDU]
 11   0.006899 172.31.8.238 -> 54.239.132.86 TCP 66 50440 > http [ACK] Seq=99 Ack=457 Win=28032 Len=0 TSval=15933498 TSecr=1689132217
 12   0.006997 54.239.132.86 -> 172.31.8.238 TCP 13098 [TCP segment of a reassembled PDU]
 13   0.007007 172.31.8.238 -> 54.239.132.86 TCP 66 50440 > http [ACK] Seq=99 Ack=13489 Win=54144 Len=0 TSval=15933498 TSecr=1689132217
 14   0.007762 54.239.132.86 -> 172.31.8.238 TCP 13098 [TCP segment of a reassembled PDU]
 15   0.007772 172.31.8.238 -> 54.239.132.86 TCP 66 50440 > http [ACK] Seq=99 Ack=26521 Win=80128 Len=0 TSval=15933498 TSecr=1689132217
 16   0.008457 54.239.132.86 -> 172.31.8.238 TCP 1514 [TCP segment of a reassembled PDU]
 17   0.008462 172.31.8.238 -> 54.239.132.86 TCP 66 50440 > http [ACK] Seq=99 Ack=27969 Win=83072 Len=0 TSval=15933498 TSecr=1689132217
 18   0.008597 54.239.132.86 -> 172.31.8.238 TCP 11650 [TCP segment of a reassembled PDU]
 19   0.008606 172.31.8.238 -> 54.239.132.86 TCP 66 50440 > http [ACK] Seq=99 Ack=39553 Win=98944 Len=0 TSval=15933498 TSecr=1689132217
 20   0.008975 54.239.132.86 -> 172.31.8.238 TCP 8754 [TCP segment of a reassembled PDU]
 21   0.008982 172.31.8.238 -> 54.239.132.86 TCP 66 50440 > http [ACK] Seq=99 Ack=48241 Win=103680 Len=0 TSval=15933498 TSecr=1689132217
 22   0.009207 54.239.132.86 -> 172.31.8.238 TCP 11650 [TCP segment of a reassembled PDU]
 23   0.009216 172.31.8.238 -> 54.239.132.86 TCP 66 50440 > http [ACK] Seq=99 Ack=59825 Win=98944 Len=0 TSval=15933498 TSecr=1689132217
 24   0.009244 54.239.132.86 -> 172.31.8.238 TCP 1514 [TCP segment of a reassembled PDU]
 25   0.009248 172.31.8.238 -> 54.239.132.86 TCP 66 50440 > http [ACK] Seq=99 Ack=61273 Win=109056 Len=0 TSval=15933498 TSecr=1689132217
 26   0.009506 54.239.132.86 -> 172.31.8.238 TCP 4410 [TCP segment of a reassembled PDU]
 27   0.009511 172.31.8.238 -> 54.239.132.86 TCP 66 50440 > http [ACK] Seq=99 Ack=65617 Win=109056 Len=0 TSval=15933498 TSecr=1689132217
 28   0.009769 54.239.132.86 -> 172.31.8.238 TCP 13098 [TCP segment of a reassembled PDU]
 29   0.009778 172.31.8.238 -> 54.239.132.86 TCP 66 50440 > http [ACK] Seq=99 Ack=78649 Win=96512 Len=0 TSval=15933498 TSecr=1689132217
 30   0.010046 54.239.132.86 -> 172.31.8.238 TCP 13098 [TCP segment of a reassembled PDU]
 31   0.010055 172.31.8.238 -> 54.239.132.86 TCP 66 50440 > http [ACK] Seq=99 Ack=91681 Win=96512 Len=0 TSval=15933498 TSecr=1689132217
 32   0.010224 54.239.132.86 -> 172.31.8.238 TCP 7306 [TCP segment of a reassembled PDU]
 33   0.010231 172.31.8.238 -> 54.239.132.86 TCP 66 50440 > http [ACK] Seq=99 Ack=98921 Win=105984 Len=0 TSval=15933498 TSecr=1689132217
 34   0.010316 54.239.132.86 -> 172.31.8.238 HTTP 4002 HTTP/1.1 200 OK  (application/octet-stream)
 35   0.010322 172.31.8.238 -> 54.239.132.86 TCP 66 50440 > http [ACK] Seq=99 Ack=102857 Win=109056 Len=0 TSval=15933498 TSecr=1689132217
 36   0.010464 172.31.8.238 -> 54.239.132.86 TCP 66 50440 > http [FIN, ACK] Seq=99 Ack=102857 Win=109056 Len=0 TSval=15933498 TSecr=1689132217
 37   0.010943 54.239.132.86 -> 172.31.8.238 TCP 66 http > 50440 [FIN, ACK] Seq=102857 Ack=100 Win=14592 Len=0 TSval=1689132217 TSecr=15933498
 38   0.010950 172.31.8.238 -> 54.239.132.86 TCP 66 50440 > http [ACK] Seq=100 Ack=102858 Win=109056 Len=0 TSval=15933499 TSecr=1689132217
