[Measurement for 100kb at 03:41:46 20.41.2014] 
Tshark:

  1   0.000000 172.31.8.238 -> 172.31.0.2   DNS 89 Standard query 0x6ce9  A d1dx94olpiqj0t.cloudfront.net
  2   0.000028 172.31.8.238 -> 172.31.0.2   DNS 89 Standard query 0x90d1  AAAA d1dx94olpiqj0t.cloudfront.net
  3   0.000556   172.31.0.2 -> 172.31.8.238 DNS 176 Standard query response 0x90d1 
  4   0.000567   172.31.0.2 -> 172.31.8.238 DNS 217 Standard query response 0x6ce9  A 54.230.118.187 A 54.230.118.248 A 54.239.132.84 A 54.239.132.196 A 54.230.116.239 A 54.230.117.15 A 54.230.117.21 A 54.230.118.146
  5   0.003887 172.31.8.238 -> 54.230.118.187 TCP 74 50749 > http [SYN] Seq=0 Win=26883 Len=0 MSS=8961 SACK_PERM=1 TSval=9633587 TSecr=0 WS=128
  6   0.004643 54.230.118.187 -> 172.31.8.238 TCP 74 http > 50749 [SYN, ACK] Seq=0 Ack=1 Win=14480 Len=0 MSS=1460 SACK_PERM=1 TSval=1681864524 TSecr=9633587 WS=128
  7   0.004659 172.31.8.238 -> 54.230.118.187 TCP 66 50749 > http [ACK] Seq=1 Ack=1 Win=27008 Len=0 TSval=9633587 TSecr=1681864524
  8   0.004702 172.31.8.238 -> 54.230.118.187 HTTP 164 GET /100kb HTTP/1.1 
  9   0.005349 54.230.118.187 -> 172.31.8.238 TCP 66 http > 50749 [ACK] Seq=1 Ack=99 Win=14592 Len=0 TSval=1681864524 TSecr=9633587
 10   0.007417 54.230.118.187 -> 172.31.8.238 TCP 522 [TCP segment of a reassembled PDU]
 11   0.007432 172.31.8.238 -> 54.230.118.187 TCP 66 50749 > http [ACK] Seq=99 Ack=457 Win=28032 Len=0 TSval=9633588 TSecr=1681864524
 12   0.007572 54.230.118.187 -> 172.31.8.238 TCP 13098 [TCP segment of a reassembled PDU]
 13   0.007584 172.31.8.238 -> 54.230.118.187 TCP 66 50749 > http [ACK] Seq=99 Ack=13489 Win=54144 Len=0 TSval=9633588 TSecr=1681864524
 14   0.008223 54.230.118.187 -> 172.31.8.238 TCP 8754 [TCP segment of a reassembled PDU]
 15   0.008233 172.31.8.238 -> 54.230.118.187 TCP 66 50749 > http [ACK] Seq=99 Ack=22177 Win=71424 Len=0 TSval=9633588 TSecr=1681864524
 16   0.008279 54.230.118.187 -> 172.31.8.238 TCP 4410 [TCP segment of a reassembled PDU]
 17   0.008285 172.31.8.238 -> 54.230.118.187 TCP 66 50749 > http [ACK] Seq=99 Ack=26521 Win=80128 Len=0 TSval=9633588 TSecr=1681864524
 18   0.008970 54.230.118.187 -> 172.31.8.238 TCP 5858 [TCP segment of a reassembled PDU]
 19   0.008978 172.31.8.238 -> 54.230.118.187 TCP 66 50749 > http [ACK] Seq=99 Ack=32313 Win=91776 Len=0 TSval=9633588 TSecr=1681864524
 20   0.009092 54.230.118.187 -> 172.31.8.238 TCP 14546 [TCP segment of a reassembled PDU]
 21   0.009102 172.31.8.238 -> 54.230.118.187 TCP 66 50749 > http [ACK] Seq=99 Ack=46793 Win=94080 Len=0 TSval=9633588 TSecr=1681864524
 22   0.009737 54.230.118.187 -> 172.31.8.238 TCP 5858 [TCP segment of a reassembled PDU]
 23   0.009744 172.31.8.238 -> 54.230.118.187 TCP 66 50749 > http [ACK] Seq=99 Ack=52585 Win=108416 Len=0 TSval=9633588 TSecr=1681864524
 24   0.009851 54.230.118.187 -> 172.31.8.238 TCP 13098 [TCP segment of a reassembled PDU]
 25   0.009860 172.31.8.238 -> 54.230.118.187 TCP 66 50749 > http [ACK] Seq=99 Ack=65617 Win=96512 Len=0 TSval=9633589 TSecr=1681864524
 26   0.010504 54.230.118.187 -> 172.31.8.238 TCP 5858 [TCP segment of a reassembled PDU]
 27   0.010511 172.31.8.238 -> 54.230.118.187 TCP 66 50749 > http [ACK] Seq=99 Ack=71409 Win=120704 Len=0 TSval=9633589 TSecr=1681864524
 28   0.010606 54.230.118.187 -> 172.31.8.238 TCP 5858 [TCP segment of a reassembled PDU]
 29   0.010613 172.31.8.238 -> 54.230.118.187 TCP 66 50749 > http [ACK] Seq=99 Ack=77201 Win=132224 Len=0 TSval=9633589 TSecr=1681864524
 30   0.010661 54.230.118.187 -> 172.31.8.238 TCP 14546 [TCP segment of a reassembled PDU]
 31   0.010670 172.31.8.238 -> 54.230.118.187 TCP 66 50749 > http [ACK] Seq=99 Ack=91681 Win=161152 Len=0 TSval=9633589 TSecr=1681864524
 32   0.011290 54.230.118.187 -> 172.31.8.238 TCP 7306 [TCP segment of a reassembled PDU]
 33   0.011299 172.31.8.238 -> 54.230.118.187 TCP 66 50749 > http [ACK] Seq=99 Ack=98921 Win=175616 Len=0 TSval=9633589 TSecr=1681864524
 34   0.011331 54.230.118.187 -> 172.31.8.238 HTTP 4002 HTTP/1.1 200 OK  (application/octet-stream)
 35   0.011336 172.31.8.238 -> 54.230.118.187 TCP 66 50749 > http [ACK] Seq=99 Ack=102857 Win=183552 Len=0 TSval=9633589 TSecr=1681864524
 36   0.011500 172.31.8.238 -> 54.230.118.187 TCP 66 50749 > http [FIN, ACK] Seq=99 Ack=102857 Win=183552 Len=0 TSval=9633589 TSecr=1681864524
 37   0.012042 54.230.118.187 -> 172.31.8.238 TCP 66 http > 50749 [FIN, ACK] Seq=102857 Ack=100 Win=14592 Len=0 TSval=1681864524 TSecr=9633589
 38   0.012053 172.31.8.238 -> 54.230.118.187 TCP 66 50749 > http [ACK] Seq=100 Ack=102858 Win=183552 Len=0 TSval=9633589 TSecr=1681864524
