[Measurement for 100kb at 00:41:46 20.41.2014] 
Tshark:

  1   0.000000 172.31.8.238 -> 172.31.0.2   DNS 89 Standard query 0x2f82  A d1dx94olpiqj0t.cloudfront.net
  2   0.000027 172.31.8.238 -> 172.31.0.2   DNS 89 Standard query 0x640b  AAAA d1dx94olpiqj0t.cloudfront.net
  3   0.000548   172.31.0.2 -> 172.31.8.238 DNS 217 Standard query response 0x2f82  A 54.230.119.3 A 54.230.119.12 A 54.239.132.90 A 54.192.118.219 A 54.192.118.247 A 54.230.116.164 A 54.230.117.21 A 54.230.117.152
  4   0.000605   172.31.0.2 -> 172.31.8.238 DNS 176 Standard query response 0x640b 
  5   0.003857 172.31.8.238 -> 54.230.119.3 TCP 74 40874 > http [SYN] Seq=0 Win=26883 Len=0 MSS=8961 SACK_PERM=1 TSval=6933561 TSecr=0 WS=128
  6   0.004437 54.230.119.3 -> 172.31.8.238 TCP 74 http > 40874 [SYN, ACK] Seq=0 Ack=1 Win=14480 Len=0 MSS=1460 SACK_PERM=1 TSval=1683088504 TSecr=6933561 WS=128
  7   0.004451 172.31.8.238 -> 54.230.119.3 TCP 66 40874 > http [ACK] Seq=1 Ack=1 Win=27008 Len=0 TSval=6933561 TSecr=1683088504
  8   0.004491 172.31.8.238 -> 54.230.119.3 HTTP 164 GET /100kb HTTP/1.1 
  9   0.005179 54.230.119.3 -> 172.31.8.238 TCP 66 http > 40874 [ACK] Seq=1 Ack=99 Win=14592 Len=0 TSval=1683088505 TSecr=6933561
 10   0.007066 54.230.119.3 -> 172.31.8.238 TCP 8754 [TCP segment of a reassembled PDU]
 11   0.007076 172.31.8.238 -> 54.230.119.3 TCP 66 40874 > http [ACK] Seq=99 Ack=8689 Win=44288 Len=0 TSval=6933561 TSecr=1683088505
 12   0.007117 54.230.119.3 -> 172.31.8.238 TCP 4410 [TCP segment of a reassembled PDU]
 13   0.007123 172.31.8.238 -> 54.230.119.3 TCP 66 40874 > http [ACK] Seq=99 Ack=13033 Win=52992 Len=0 TSval=6933561 TSecr=1683088505
 14   0.007760 54.230.119.3 -> 172.31.8.238 TCP 2962 [TCP segment of a reassembled PDU]
 15   0.007767 172.31.8.238 -> 54.230.119.3 TCP 66 40874 > http [ACK] Seq=99 Ack=15929 Win=58752 Len=0 TSval=6933562 TSecr=1683088505
 16   0.007871 54.230.119.3 -> 172.31.8.238 TCP 10202 [TCP segment of a reassembled PDU]
 17   0.007880 172.31.8.238 -> 54.230.119.3 TCP 66 40874 > http [ACK] Seq=99 Ack=26065 Win=79104 Len=0 TSval=6933562 TSecr=1683088505
 18   0.008639 54.230.119.3 -> 172.31.8.238 TCP 20338 [TCP segment of a reassembled PDU]
 19   0.008652 172.31.8.238 -> 54.230.119.3 TCP 66 40874 > http [ACK] Seq=99 Ack=46337 Win=84608 Len=0 TSval=6933562 TSecr=1683088505
 20   0.009307 54.230.119.3 -> 172.31.8.238 TCP 11650 [TCP segment of a reassembled PDU]
 21   0.009316 172.31.8.238 -> 54.230.119.3 TCP 66 40874 > http [ACK] Seq=99 Ack=57921 Win=98944 Len=0 TSval=6933562 TSecr=1683088505
 22   0.009409 54.230.119.3 -> 172.31.8.238 TCP 7306 [TCP segment of a reassembled PDU]
 23   0.009416 172.31.8.238 -> 54.230.119.3 TCP 66 40874 > http [ACK] Seq=99 Ack=65161 Win=105984 Len=0 TSval=6933562 TSecr=1683088505
 24   0.010064 54.230.119.3 -> 172.31.8.238 TCP 7306 [TCP segment of a reassembled PDU]
 25   0.010071 172.31.8.238 -> 54.230.119.3 TCP 66 40874 > http [ACK] Seq=99 Ack=72401 Win=105984 Len=0 TSval=6933562 TSecr=1683088505
 26   0.010185 54.230.119.3 -> 172.31.8.238 TCP 17442 [TCP segment of a reassembled PDU]
 27   0.010196 172.31.8.238 -> 54.230.119.3 TCP 66 40874 > http [ACK] Seq=99 Ack=89777 Win=89344 Len=0 TSval=6933562 TSecr=1683088505
 28   0.010827 54.230.119.3 -> 172.31.8.238 TCP 5858 [TCP segment of a reassembled PDU]
 29   0.010834 172.31.8.238 -> 54.230.119.3 TCP 66 40874 > http [ACK] Seq=99 Ack=95569 Win=108416 Len=0 TSval=6933562 TSecr=1683088505
 30   0.010936 54.230.119.3 -> 172.31.8.238 HTTP 7354 HTTP/1.1 200 OK  (application/octet-stream)
 31   0.010943 172.31.8.238 -> 54.230.119.3 TCP 66 40874 > http [ACK] Seq=99 Ack=102857 Win=103680 Len=0 TSval=6933562 TSecr=1683088505
 32   0.011086 172.31.8.238 -> 54.230.119.3 TCP 66 40874 > http [FIN, ACK] Seq=99 Ack=102857 Win=109056 Len=0 TSval=6933562 TSecr=1683088505
 33   0.011819 54.230.119.3 -> 172.31.8.238 TCP 66 http > 40874 [FIN, ACK] Seq=102857 Ack=100 Win=14592 Len=0 TSval=1683088505 TSecr=6933562
 34   0.011828 172.31.8.238 -> 54.230.119.3 TCP 66 40874 > http [ACK] Seq=100 Ack=102858 Win=109056 Len=0 TSval=6933563 TSecr=1683088505
