[Measurement for 1mb at 07:43:47 20.43.2014] 
Tshark:

  1   0.000000 172.31.8.238 -> 172.31.0.2   DNS 89 Standard query 0x1fcb  A d3m1c4hwkgedal.cloudfront.net
  2   0.000074 172.31.8.238 -> 172.31.0.2   DNS 89 Standard query 0x8787  AAAA d3m1c4hwkgedal.cloudfront.net
  3   0.000634   172.31.0.2 -> 172.31.8.238 DNS 217 Standard query response 0x1fcb  A 54.230.117.86 A 54.230.117.156 A 54.230.117.238 A 54.230.118.187 A 54.192.118.220 A 54.230.116.44 A 54.230.116.73 A 54.230.117.21
  4   0.000644   172.31.0.2 -> 172.31.8.238 DNS 174 Standard query response 0x8787 
  5   0.003877 172.31.8.238 -> 54.230.117.86 TCP 74 52118 > http [SYN] Seq=0 Win=26883 Len=0 MSS=8961 SACK_PERM=1 TSval=13263773 TSecr=0 WS=128
  6   0.004588 54.230.117.86 -> 172.31.8.238 TCP 74 http > 52118 [SYN, ACK] Seq=0 Ack=1 Win=14480 Len=0 MSS=1460 SACK_PERM=1 TSval=1685081914 TSecr=13263773 WS=128
  7   0.004603 172.31.8.238 -> 54.230.117.86 TCP 66 52118 > http [ACK] Seq=1 Ack=1 Win=27008 Len=0 TSval=13263774 TSecr=1685081914
  8   0.004644 172.31.8.238 -> 54.230.117.86 HTTP 162 GET /1mb HTTP/1.1 
  9   0.005331 54.230.117.86 -> 172.31.8.238 TCP 66 http > 52118 [ACK] Seq=1 Ack=97 Win=14592 Len=0 TSval=1685081914 TSecr=13263774
 10   0.006643 54.230.117.86 -> 172.31.8.238 TCP 523 [TCP segment of a reassembled PDU]
 11   0.006649 172.31.8.238 -> 54.230.117.86 TCP 66 52118 > http [ACK] Seq=97 Ack=458 Win=28032 Len=0 TSval=13263774 TSecr=1685081914
 12   0.006904 54.230.117.86 -> 172.31.8.238 TCP 13098 [TCP segment of a reassembled PDU]
 13   0.006915 172.31.8.238 -> 54.230.117.86 TCP 66 52118 > http [ACK] Seq=97 Ack=13490 Win=54144 Len=0 TSval=13263774 TSecr=1685081914
 14   0.007648 54.230.117.86 -> 172.31.8.238 TCP 5858 [TCP segment of a reassembled PDU]
 15   0.007655 172.31.8.238 -> 54.230.117.86 TCP 66 52118 > http [ACK] Seq=97 Ack=19282 Win=65664 Len=0 TSval=13263774 TSecr=1685081914
 16   0.007757 54.230.117.86 -> 172.31.8.238 TCP 7306 [TCP segment of a reassembled PDU]
 17   0.007764 172.31.8.238 -> 54.230.117.86 TCP 66 52118 > http [ACK] Seq=97 Ack=26522 Win=80128 Len=0 TSval=13263774 TSecr=1685081914
 18   0.008421 54.230.117.86 -> 172.31.8.238 TCP 10202 [TCP segment of a reassembled PDU]
 19   0.008429 172.31.8.238 -> 54.230.117.86 TCP 66 52118 > http [ACK] Seq=97 Ack=36658 Win=100480 Len=0 TSval=13263775 TSecr=1685081915
 20   0.008524 54.230.117.86 -> 172.31.8.238 TCP 10202 [TCP segment of a reassembled PDU]
 21   0.008532 172.31.8.238 -> 54.230.117.86 TCP 66 52118 > http [ACK] Seq=97 Ack=46794 Win=120704 Len=0 TSval=13263775 TSecr=1685081915
 22   0.009180 54.230.117.86 -> 172.31.8.238 TCP 8754 [TCP segment of a reassembled PDU]
 23   0.009187 172.31.8.238 -> 54.230.117.86 TCP 66 52118 > http [ACK] Seq=97 Ack=55482 Win=138112 Len=0 TSval=13263775 TSecr=1685081915
 24   0.009284 54.230.117.86 -> 172.31.8.238 TCP 10202 [TCP segment of a reassembled PDU]
 25   0.009292 172.31.8.238 -> 54.230.117.86 TCP 66 52118 > http [ACK] Seq=97 Ack=65618 Win=158336 Len=0 TSval=13263775 TSecr=1685081915
 26   0.009944 54.230.117.86 -> 172.31.8.238 TCP 10202 [TCP segment of a reassembled PDU]
 27   0.009952 172.31.8.238 -> 54.230.117.86 TCP 66 52118 > http [ACK] Seq=97 Ack=75754 Win=178560 Len=0 TSval=13263775 TSecr=1685081915
 28   0.010060 54.230.117.86 -> 172.31.8.238 TCP 15994 [TCP segment of a reassembled PDU]
 29   0.010070 172.31.8.238 -> 54.230.117.86 TCP 66 52118 > http [ACK] Seq=97 Ack=91682 Win=210432 Len=0 TSval=13263775 TSecr=1685081915
 30   0.010543 54.230.117.86 -> 172.31.8.238 TCP 8754 [TCP segment of a reassembled PDU]
 31   0.010551 172.31.8.238 -> 54.230.117.86 TCP 66 52118 > http [ACK] Seq=97 Ack=100370 Win=227840 Len=0 TSval=13263775 TSecr=1685081915
 32   0.010653 54.230.117.86 -> 172.31.8.238 TCP 17442 [TCP segment of a reassembled PDU]
 33   0.010663 172.31.8.238 -> 54.230.117.86 TCP 66 52118 > http [ACK] Seq=97 Ack=117746 Win=262656 Len=0 TSval=13263775 TSecr=1685081915
 34   0.011097 54.230.117.86 -> 172.31.8.238 TCP 8754 [TCP segment of a reassembled PDU]
 35   0.011110 172.31.8.238 -> 54.230.117.86 TCP 66 52118 > http [ACK] Seq=97 Ack=126434 Win=279936 Len=0 TSval=13263775 TSecr=1685081915
 36   0.011174 54.230.117.86 -> 172.31.8.238 TCP 17442 [TCP segment of a reassembled PDU]
 37   0.011186 172.31.8.238 -> 54.230.117.86 TCP 66 52118 > http [ACK] Seq=97 Ack=143810 Win=281472 Len=0 TSval=13263775 TSecr=1685081915
 38   0.011573 54.230.117.86 -> 172.31.8.238 TCP 13098 [TCP segment of a reassembled PDU]
 39   0.011584 172.31.8.238 -> 54.230.117.86 TCP 66 52118 > http [ACK] Seq=97 Ack=156842 Win=302976 Len=0 TSval=13263775 TSecr=1685081915
 40   0.011840 54.230.117.86 -> 172.31.8.238 TCP 13098 [TCP segment of a reassembled PDU]
 41   0.011850 172.31.8.238 -> 54.230.117.86 TCP 66 52118 > http [ACK] Seq=97 Ack=169874 Win=302976 Len=0 TSval=13263775 TSecr=1685081915
 42   0.012118 54.230.117.86 -> 172.31.8.238 TCP 13098 [TCP segment of a reassembled PDU]
 43   0.012127 172.31.8.238 -> 54.230.117.86 TCP 66 52118 > http [ACK] Seq=97 Ack=182906 Win=302976 Len=0 TSval=13263776 TSecr=1685081915
 44   0.012386 54.230.117.86 -> 172.31.8.238 TCP 13098 [TCP segment of a reassembled PDU]
 45   0.012395 172.31.8.238 -> 54.230.117.86 TCP 66 52118 > http [ACK] Seq=97 Ack=195938 Win=340736 Len=0 TSval=13263776 TSecr=1685081915
 46   0.012684 54.230.117.86 -> 172.31.8.238 TCP 26130 [TCP segment of a reassembled PDU]
 47   0.012697 172.31.8.238 -> 54.230.117.86 TCP 66 52118 > http [ACK] Seq=97 Ack=222002 Win=392960 Len=0 TSval=13263776 TSecr=1685081915
 48   0.012830 54.230.117.86 -> 172.31.8.238 TCP 4410 [TCP segment of a reassembled PDU]
 49   0.012836 172.31.8.238 -> 54.230.117.86 TCP 66 52118 > http [ACK] Seq=97 Ack=226346 Win=401664 Len=0 TSval=13263776 TSecr=1685081915
 50   0.012961 54.230.117.86 -> 172.31.8.238 TCP 10202 [TCP segment of a reassembled PDU]
 51   0.012968 172.31.8.238 -> 54.230.117.86 TCP 66 52118 > http [ACK] Seq=97 Ack=236482 Win=421888 Len=0 TSval=13263776 TSecr=1685081915
 52   0.013380 54.230.117.86 -> 172.31.8.238 TCP 8754 [TCP segment of a reassembled PDU]
 53   0.013389 172.31.8.238 -> 54.230.117.86 TCP 66 52118 > http [ACK] Seq=97 Ack=245170 Win=439296 Len=0 TSval=13263776 TSecr=1685081915
 54   0.013530 54.230.117.86 -> 172.31.8.238 TCP 24682 [TCP segment of a reassembled PDU]
 55   0.013544 172.31.8.238 -> 54.230.117.86 TCP 66 52118 > http [ACK] Seq=97 Ack=269786 Win=488448 Len=0 TSval=13263776 TSecr=1685081915
 56   0.013852 54.230.117.86 -> 172.31.8.238 TCP 10202 [TCP segment of a reassembled PDU]
 57   0.013861 172.31.8.238 -> 54.230.117.86 TCP 66 52118 > http [ACK] Seq=97 Ack=279922 Win=508800 Len=0 TSval=13263776 TSecr=1685081915
 58   0.013989 54.230.117.86 -> 172.31.8.238 TCP 11650 [TCP segment of a reassembled PDU]
 59   0.013998 172.31.8.238 -> 54.230.117.86 TCP 66 52118 > http [ACK] Seq=97 Ack=291506 Win=531968 Len=0 TSval=13263776 TSecr=1685081915
 60   0.014239 54.230.117.86 -> 172.31.8.238 TCP 23234 [TCP segment of a reassembled PDU]
 61   0.014252 172.31.8.238 -> 54.230.117.86 TCP 66 52118 > http [ACK] Seq=97 Ack=314674 Win=578304 Len=0 TSval=13263776 TSecr=1685081915
 62   0.014624 54.230.117.86 -> 172.31.8.238 TCP 7306 [TCP segment of a reassembled PDU]
 63   0.014632 172.31.8.238 -> 54.230.117.86 TCP 66 52118 > http [ACK] Seq=97 Ack=321914 Win=592768 Len=0 TSval=13263776 TSecr=1685081915
 64   0.014788 54.230.117.86 -> 172.31.8.238 TCP 20338 [TCP segment of a reassembled PDU]
 65   0.014799 172.31.8.238 -> 54.230.117.86 TCP 66 52118 > http [ACK] Seq=97 Ack=342186 Win=633344 Len=0 TSval=13263776 TSecr=1685081915
 66   0.015025 54.230.117.86 -> 172.31.8.238 TCP 24682 [TCP segment of a reassembled PDU]
 67   0.015038 172.31.8.238 -> 54.230.117.86 TCP 66 52118 > http [ACK] Seq=97 Ack=366802 Win=682496 Len=0 TSval=13263776 TSecr=1685081915
 68   0.015387 54.230.117.86 -> 172.31.8.238 TCP 7306 [TCP segment of a reassembled PDU]
 69   0.015395 172.31.8.238 -> 54.230.117.86 TCP 66 52118 > http [ACK] Seq=97 Ack=374042 Win=696960 Len=0 TSval=13263776 TSecr=1685081915
 70   0.015521 54.230.117.86 -> 172.31.8.238 TCP 5858 [TCP segment of a reassembled PDU]
 71   0.015527 172.31.8.238 -> 54.230.117.86 TCP 66 52118 > http [ACK] Seq=97 Ack=379834 Win=708608 Len=0 TSval=13263776 TSecr=1685081915
 72   0.015825 54.230.117.86 -> 172.31.8.238 TCP 24682 [TCP segment of a reassembled PDU]
 73   0.015839 172.31.8.238 -> 54.230.117.86 TCP 66 52118 > http [ACK] Seq=97 Ack=404450 Win=757760 Len=0 TSval=13263776 TSecr=1685081915
 74   0.015878 54.230.117.86 -> 172.31.8.238 TCP 1514 [TCP segment of a reassembled PDU]
 75   0.015883 172.31.8.238 -> 54.230.117.86 TCP 66 52118 > http [ACK] Seq=97 Ack=405898 Win=760704 Len=0 TSval=13263776 TSecr=1685081915
 76   0.015959 54.230.117.86 -> 172.31.8.238 TCP 17442 [TCP segment of a reassembled PDU]
 77   0.015970 172.31.8.238 -> 54.230.117.86 TCP 66 52118 > http [ACK] Seq=97 Ack=423274 Win=795520 Len=0 TSval=13263777 TSecr=1685081915
 78   0.016415 54.230.117.86 -> 172.31.8.238 TCP 1514 [TCP segment of a reassembled PDU]
 79   0.016421 172.31.8.238 -> 54.230.117.86 TCP 66 52118 > http [ACK] Seq=97 Ack=424722 Win=798336 Len=0 TSval=13263777 TSecr=1685081915
 80   0.016606 54.230.117.86 -> 172.31.8.238 TCP 26130 [TCP segment of a reassembled PDU]
 81   0.016620 172.31.8.238 -> 54.230.117.86 TCP 66 52118 > http [ACK] Seq=97 Ack=450786 Win=850432 Len=0 TSval=13263777 TSecr=1685081915
 82   0.016657 54.230.117.86 -> 172.31.8.238 TCP 14546 [TCP segment of a reassembled PDU]
 83   0.016666 172.31.8.238 -> 54.230.117.86 TCP 66 52118 > http [ACK] Seq=97 Ack=465266 Win=879488 Len=0 TSval=13263777 TSecr=1685081915
 84   0.016741 54.230.117.86 -> 172.31.8.238 TCP 21786 [TCP segment of a reassembled PDU]
 85   0.016753 172.31.8.238 -> 54.230.117.86 TCP 66 52118 > http [ACK] Seq=97 Ack=486986 Win=922880 Len=0 TSval=13263777 TSecr=1685081915
 86   0.017436 54.230.117.86 -> 172.31.8.238 TCP 1514 [TCP segment of a reassembled PDU]
 87   0.017441 172.31.8.238 -> 54.230.117.86 TCP 66 52118 > http [ACK] Seq=97 Ack=488434 Win=925824 Len=0 TSval=13263777 TSecr=1685081915
 88   0.017623 54.230.117.86 -> 172.31.8.238 TCP 24682 [TCP segment of a reassembled PDU]
 89   0.017637 172.31.8.238 -> 54.230.117.86 TCP 66 52118 > http [ACK] Seq=97 Ack=513050 Win=974976 Len=0 TSval=13263777 TSecr=1685081915
 90   0.017747 54.230.117.86 -> 172.31.8.238 TCP 27578 [TCP segment of a reassembled PDU]
 91   0.017760 172.31.8.238 -> 54.230.117.86 TCP 66 52118 > http [ACK] Seq=97 Ack=540562 Win=1030016 Len=0 TSval=13263777 TSecr=1685081915
 92   0.017776 54.230.117.86 -> 172.31.8.238 TCP 15994 [TCP segment of a reassembled PDU]
 93   0.017791 172.31.8.238 -> 54.230.117.86 TCP 66 52118 > http [ACK] Seq=97 Ack=556490 Win=1061888 Len=0 TSval=13263777 TSecr=1685081915
 94   0.018201 54.230.117.86 -> 172.31.8.238 TCP 7306 [TCP segment of a reassembled PDU]
 95   0.018209 172.31.8.238 -> 54.230.117.86 TCP 66 52118 > http [ACK] Seq=97 Ack=563730 Win=1076352 Len=0 TSval=13263777 TSecr=1685081916
 96   0.018330 54.230.117.86 -> 172.31.8.238 TCP 11650 [TCP segment of a reassembled PDU]
 97   0.018338 172.31.8.238 -> 54.230.117.86 TCP 66 52118 > http [ACK] Seq=97 Ack=575314 Win=1099520 Len=0 TSval=13263777 TSecr=1685081916
 98   0.018574 54.230.117.86 -> 172.31.8.238 TCP 26130 [TCP segment of a reassembled PDU]
 99   0.018588 172.31.8.238 -> 54.230.117.86 TCP 66 52118 > http [ACK] Seq=97 Ack=601378 Win=1151616 Len=0 TSval=13263777 TSecr=1685081916
100   0.018622 54.230.117.86 -> 172.31.8.238 TCP 13098 [TCP segment of a reassembled PDU]
101   0.018633 172.31.8.238 -> 54.230.117.86 TCP 66 52118 > http [ACK] Seq=97 Ack=614410 Win=1177728 Len=0 TSval=13263777 TSecr=1685081916
102   0.018825 54.230.117.86 -> 172.31.8.238 TCP 26130 [TCP segment of a reassembled PDU]
103   0.018839 172.31.8.238 -> 54.230.117.86 TCP 66 52118 > http [ACK] Seq=97 Ack=640474 Win=1200640 Len=0 TSval=13263777 TSecr=1685081916
104   0.019233 54.230.117.86 -> 172.31.8.238 TCP 7306 [TCP segment of a reassembled PDU]
105   0.019240 172.31.8.238 -> 54.230.117.86 TCP 66 52118 > http [ACK] Seq=97 Ack=647714 Win=1231488 Len=0 TSval=13263777 TSecr=1685081916
106   0.019407 54.230.117.86 -> 172.31.8.238 TCP 26130 [TCP segment of a reassembled PDU]
107   0.019421 172.31.8.238 -> 54.230.117.86 TCP 66 52118 > http [ACK] Seq=97 Ack=673778 Win=1205504 Len=0 TSval=13263777 TSecr=1685081916
108   0.019441 54.230.117.86 -> 172.31.8.238 TCP 7306 [TCP segment of a reassembled PDU]
109   0.019447 172.31.8.238 -> 54.230.117.86 TCP 66 52118 > http [ACK] Seq=97 Ack=681018 Win=1198336 Len=0 TSval=13263777 TSecr=1685081916
110   0.019576 54.230.117.86 -> 172.31.8.238 TCP 17442 [TCP segment of a reassembled PDU]
111   0.019588 172.31.8.238 -> 54.230.117.86 TCP 66 52118 > http [ACK] Seq=97 Ack=698394 Win=1214848 Len=0 TSval=13263777 TSecr=1685081916
112   0.019624 54.230.117.86 -> 172.31.8.238 TCP 7306 [TCP segment of a reassembled PDU]
113   0.019631 172.31.8.238 -> 54.230.117.86 TCP 66 52118 > http [ACK] Seq=97 Ack=705634 Win=1231488 Len=0 TSval=13263777 TSecr=1685081916
114   0.019997 54.230.117.86 -> 172.31.8.238 TCP 7306 [TCP segment of a reassembled PDU]
115   0.020005 172.31.8.238 -> 54.230.117.86 TCP 66 52118 > http [ACK] Seq=97 Ack=712874 Win=1231488 Len=0 TSval=13263778 TSecr=1685081916
116   0.020184 54.230.117.86 -> 172.31.8.238 TCP 23234 [TCP segment of a reassembled PDU]
117   0.020196 172.31.8.238 -> 54.230.117.86 TCP 66 52118 > http [ACK] Seq=97 Ack=736042 Win=1208320 Len=0 TSval=13263778 TSecr=1685081916
118   0.020313 54.230.117.86 -> 172.31.8.238 TCP 34818 [TCP segment of a reassembled PDU]
119   0.020330 172.31.8.238 -> 54.230.117.86 TCP 66 52118 > http [ACK] Seq=97 Ack=770794 Win=1186304 Len=0 TSval=13263778 TSecr=1685081916
120   0.020637 54.230.117.86 -> 172.31.8.238 TCP 26130 [TCP segment of a reassembled PDU]
121   0.020651 172.31.8.238 -> 54.230.117.86 TCP 66 52118 > http [ACK] Seq=97 Ack=796858 Win=1200640 Len=0 TSval=13263778 TSecr=1685081916
122   0.020661 54.230.117.86 -> 172.31.8.238 TCP 7306 [TCP segment of a reassembled PDU]
123   0.020666 172.31.8.238 -> 54.230.117.86 TCP 66 52118 > http [ACK] Seq=97 Ack=804098 Win=1193472 Len=0 TSval=13263778 TSecr=1685081916
124   0.021082 54.230.117.86 -> 172.31.8.238 TCP 26130 [TCP segment of a reassembled PDU]
125   0.021095 172.31.8.238 -> 54.230.117.86 TCP 66 52118 > http [ACK] Seq=97 Ack=830162 Win=1200640 Len=0 TSval=13263778 TSecr=1685081916
126   0.021102 54.230.117.86 -> 172.31.8.238 TCP 1514 [TCP segment of a reassembled PDU]
127   0.021104 172.31.8.238 -> 54.230.117.86 TCP 66 52118 > http [ACK] Seq=97 Ack=831610 Win=1199232 Len=0 TSval=13263778 TSecr=1685081916
128   0.021107 54.230.117.86 -> 172.31.8.238 TCP 4410 [TCP segment of a reassembled PDU]
129   0.021111 172.31.8.238 -> 54.230.117.86 TCP 66 52118 > http [ACK] Seq=97 Ack=835954 Win=1195008 Len=0 TSval=13263778 TSecr=1685081916
130   0.021329 54.230.117.86 -> 172.31.8.238 TCP 23234 [TCP segment of a reassembled PDU]
131   0.021342 172.31.8.238 -> 54.230.117.86 TCP 66 52118 > http [ACK] Seq=97 Ack=859122 Win=1205376 Len=0 TSval=13263778 TSecr=1685081916
132   0.021351 54.230.117.86 -> 172.31.8.238 TCP 1514 [TCP segment of a reassembled PDU]
133   0.021473 54.230.117.86 -> 172.31.8.238 TCP 26130 [TCP segment of a reassembled PDU]
134   0.021498 172.31.8.238 -> 54.230.117.86 TCP 66 52118 > http [ACK] Seq=97 Ack=886634 Win=1200640 Len=0 TSval=13263778 TSecr=1685081916
135   0.021521 54.230.117.86 -> 172.31.8.238 TCP 14546 [TCP segment of a reassembled PDU]
136   0.021532 172.31.8.238 -> 54.230.117.86 TCP 66 52118 > http [ACK] Seq=97 Ack=901114 Win=1219584 Len=0 TSval=13263778 TSecr=1685081916
137   0.021847 54.230.117.86 -> 172.31.8.238 TCP 20338 [TCP segment of a reassembled PDU]
138   0.021869 54.230.117.86 -> 172.31.8.238 TCP 4410 [TCP segment of a reassembled PDU]
139   0.021880 172.31.8.238 -> 54.230.117.86 TCP 66 52118 > http [ACK] Seq=97 Ack=925730 Win=1202816 Len=0 TSval=13263778 TSecr=1685081916
140   0.021978 54.230.117.86 -> 172.31.8.238 TCP 11650 [TCP segment of a reassembled PDU]
141   0.021986 172.31.8.238 -> 54.230.117.86 TCP 66 52118 > http [ACK] Seq=97 Ack=937314 Win=1224448 Len=0 TSval=13263778 TSecr=1685081916
142   0.022122 54.230.117.86 -> 172.31.8.238 TCP 26130 [TCP segment of a reassembled PDU]
143   0.022161 172.31.8.238 -> 54.230.117.86 TCP 66 52118 > http [ACK] Seq=97 Ack=963378 Win=1200640 Len=0 TSval=13263778 TSecr=1685081916
144   0.022208 54.230.117.86 -> 172.31.8.238 TCP 20338 [TCP segment of a reassembled PDU]
145   0.022221 172.31.8.238 -> 54.230.117.86 TCP 66 52118 > http [ACK] Seq=97 Ack=983650 Win=1210112 Len=0 TSval=13263778 TSecr=1685081916
146   0.022305 54.230.117.86 -> 172.31.8.238 TCP 23234 [TCP segment of a reassembled PDU]
147   0.022329 172.31.8.238 -> 54.230.117.86 TCP 66 52118 > http [ACK] Seq=97 Ack=1006818 Win=1205376 Len=0 TSval=13263778 TSecr=1685081916
148   0.022350 54.230.117.86 -> 172.31.8.238 TCP 5858 [TCP segment of a reassembled PDU]
149   0.022356 172.31.8.238 -> 54.230.117.86 TCP 66 52118 > http [ACK] Seq=97 Ack=1012610 Win=1233920 Len=0 TSval=13263778 TSecr=1685081916
150   0.022495 54.230.117.86 -> 172.31.8.238 TCP 18890 [TCP segment of a reassembled PDU]
151   0.022561 172.31.8.238 -> 54.230.117.86 TCP 66 52118 > http [ACK] Seq=97 Ack=1031434 Win=1215104 Len=0 TSval=13263778 TSecr=1685081916
152   0.022929 54.230.117.86 -> 172.31.8.238 HTTP 17666 HTTP/1.1 200 OK  (application/octet-stream)
153   0.022953 172.31.8.238 -> 54.230.117.86 TCP 66 52118 > http [ACK] Seq=97 Ack=1049034 Win=1212416 Len=0 TSval=13263778 TSecr=1685081916
154   0.023087 172.31.8.238 -> 54.230.117.86 TCP 66 52118 > http [FIN, ACK] Seq=97 Ack=1049034 Win=1243520 Len=0 TSval=13263778 TSecr=1685081916
155   0.023801 54.230.117.86 -> 172.31.8.238 TCP 66 http > 52118 [FIN, ACK] Seq=1049034 Ack=98 Win=14592 Len=0 TSval=1685081916 TSecr=13263778
156   0.023810 172.31.8.238 -> 54.230.117.86 TCP 66 52118 > http [ACK] Seq=98 Ack=1049035 Win=1243520 Len=0 TSval=13263778 TSecr=1685081916
