[Measurement for 1mb at 05:43:47 20.43.2014] 
Tshark:

  1   0.000000 172.31.8.238 -> 172.31.0.2   DNS 89 Standard query 0xc185  A d3m1c4hwkgedal.cloudfront.net
  2   0.000037 172.31.8.238 -> 172.31.0.2   DNS 89 Standard query 0x7701  AAAA d3m1c4hwkgedal.cloudfront.net
  3   0.000641   172.31.0.2 -> 172.31.8.238 DNS 174 Standard query response 0x7701 
  4   0.000651   172.31.0.2 -> 172.31.8.238 DNS 217 Standard query response 0xc185  A 54.192.118.247 A 54.230.116.204 A 54.230.117.86 A 54.230.118.136 A 54.239.132.26 A 54.239.132.147 A 54.239.132.249 A 54.192.118.232
  5   0.003939 172.31.8.238 -> 54.192.118.247 TCP 74 39721 > http [SYN] Seq=0 Win=26883 Len=0 MSS=8961 SACK_PERM=1 TSval=11463810 TSecr=0 WS=128
  6   0.004539 54.192.118.247 -> 172.31.8.238 TCP 74 http > 39721 [SYN, ACK] Seq=0 Ack=1 Win=14480 Len=0 MSS=1460 SACK_PERM=1 TSval=1685111725 TSecr=11463810 WS=128
  7   0.004553 172.31.8.238 -> 54.192.118.247 TCP 66 39721 > http [ACK] Seq=1 Ack=1 Win=27008 Len=0 TSval=11463810 TSecr=1685111725
  8   0.004590 172.31.8.238 -> 54.192.118.247 HTTP 162 GET /1mb HTTP/1.1 
  9   0.004989 54.192.118.247 -> 172.31.8.238 TCP 66 http > 39721 [ACK] Seq=1 Ack=97 Win=14592 Len=0 TSval=1685111725 TSecr=11463810
 10   0.006831 54.192.118.247 -> 172.31.8.238 TCP 523 [TCP segment of a reassembled PDU]
 11   0.006839 172.31.8.238 -> 54.192.118.247 TCP 66 39721 > http [ACK] Seq=97 Ack=458 Win=28032 Len=0 TSval=11463811 TSecr=1685111726
 12   0.006855 54.192.118.247 -> 172.31.8.238 TCP 13098 [TCP segment of a reassembled PDU]
 13   0.006865 172.31.8.238 -> 54.192.118.247 TCP 66 39721 > http [ACK] Seq=97 Ack=13490 Win=54144 Len=0 TSval=11463811 TSecr=1685111726
 14   0.007666 54.192.118.247 -> 172.31.8.238 TCP 13098 [TCP segment of a reassembled PDU]
 15   0.007676 172.31.8.238 -> 54.192.118.247 TCP 66 39721 > http [ACK] Seq=97 Ack=26522 Win=80128 Len=0 TSval=11463811 TSecr=1685111726
 16   0.008462 54.192.118.247 -> 172.31.8.238 TCP 13098 [TCP segment of a reassembled PDU]
 17   0.008472 172.31.8.238 -> 54.192.118.247 TCP 66 39721 > http [ACK] Seq=97 Ack=39554 Win=96512 Len=0 TSval=11463811 TSecr=1685111726
 18   0.009212 54.192.118.247 -> 172.31.8.238 TCP 20338 [TCP segment of a reassembled PDU]
 19   0.009225 172.31.8.238 -> 54.192.118.247 TCP 66 39721 > http [ACK] Seq=97 Ack=59826 Win=84608 Len=0 TSval=11463811 TSecr=1685111726
 20   0.009991 54.192.118.247 -> 172.31.8.238 TCP 5858 [TCP segment of a reassembled PDU]
 21   0.009998 172.31.8.238 -> 54.192.118.247 TCP 66 39721 > http [ACK] Seq=97 Ack=65618 Win=108416 Len=0 TSval=11463811 TSecr=1685111726
 22   0.010010 54.192.118.247 -> 172.31.8.238 TCP 13098 [TCP segment of a reassembled PDU]
 23   0.010020 172.31.8.238 -> 54.192.118.247 TCP 66 39721 > http [ACK] Seq=97 Ack=78650 Win=95488 Len=0 TSval=11463811 TSecr=1685111726
 24   0.010787 54.192.118.247 -> 172.31.8.238 TCP 13098 [TCP segment of a reassembled PDU]
 25   0.010797 172.31.8.238 -> 54.192.118.247 TCP 66 39721 > http [ACK] Seq=97 Ack=91682 Win=96512 Len=0 TSval=11463812 TSecr=1685111726
 26   0.010813 54.192.118.247 -> 172.31.8.238 TCP 10202 [TCP segment of a reassembled PDU]
 27   0.010822 172.31.8.238 -> 54.192.118.247 TCP 66 39721 > http [ACK] Seq=97 Ack=101818 Win=86400 Len=0 TSval=11463812 TSecr=1685111726
 28   0.010869 54.192.118.247 -> 172.31.8.238 TCP 1514 [TCP segment of a reassembled PDU]
 29   0.010876 172.31.8.238 -> 54.192.118.247 TCP 66 39721 > http [ACK] Seq=97 Ack=103266 Win=112000 Len=0 TSval=11463812 TSecr=1685111726
 30   0.011538 54.192.118.247 -> 172.31.8.238 TCP 14546 [TCP segment of a reassembled PDU]
 31   0.011547 172.31.8.238 -> 54.192.118.247 TCP 66 39721 > http [ACK] Seq=97 Ack=117746 Win=140928 Len=0 TSval=11463812 TSecr=1685111726
 32   0.011561 54.192.118.247 -> 172.31.8.238 TCP 13098 [TCP segment of a reassembled PDU]
 33   0.011571 172.31.8.238 -> 54.192.118.247 TCP 66 39721 > http [ACK] Seq=97 Ack=130778 Win=167040 Len=0 TSval=11463812 TSecr=1685111726
 34   0.012352 54.192.118.247 -> 172.31.8.238 TCP 26130 [TCP segment of a reassembled PDU]
 35   0.012364 172.31.8.238 -> 54.192.118.247 TCP 66 39721 > http [ACK] Seq=97 Ack=156842 Win=219136 Len=0 TSval=11463812 TSecr=1685111726
 36   0.012979 54.192.118.247 -> 172.31.8.238 TCP 10202 [TCP segment of a reassembled PDU]
 37   0.012987 172.31.8.238 -> 54.192.118.247 TCP 66 39721 > http [ACK] Seq=97 Ack=166978 Win=239360 Len=0 TSval=11463812 TSecr=1685111726
 38   0.013079 54.192.118.247 -> 172.31.8.238 TCP 15994 [TCP segment of a reassembled PDU]
 39   0.013089 172.31.8.238 -> 54.192.118.247 TCP 66 39721 > http [ACK] Seq=97 Ack=182906 Win=271232 Len=0 TSval=11463812 TSecr=1685111726
 40   0.013578 54.192.118.247 -> 172.31.8.238 TCP 13098 [TCP segment of a reassembled PDU]
 41   0.013587 172.31.8.238 -> 54.192.118.247 TCP 66 39721 > http [ACK] Seq=97 Ack=195938 Win=297344 Len=0 TSval=11463812 TSecr=1685111726
 42   0.013850 54.192.118.247 -> 172.31.8.238 TCP 23234 [TCP segment of a reassembled PDU]
 43   0.013862 172.31.8.238 -> 54.192.118.247 TCP 66 39721 > http [ACK] Seq=97 Ack=219106 Win=343680 Len=0 TSval=11463812 TSecr=1685111726
 44   0.014298 54.192.118.247 -> 172.31.8.238 TCP 14546 [TCP segment of a reassembled PDU]
 45   0.014308 172.31.8.238 -> 54.192.118.247 TCP 66 39721 > http [ACK] Seq=97 Ack=233586 Win=372608 Len=0 TSval=11463813 TSecr=1685111726
 46   0.014605 54.192.118.247 -> 172.31.8.238 TCP 24682 [TCP segment of a reassembled PDU]
 47   0.014620 172.31.8.238 -> 54.192.118.247 TCP 66 39721 > http [ACK] Seq=97 Ack=258202 Win=421888 Len=0 TSval=11463813 TSecr=1685111726
 48   0.014875 54.192.118.247 -> 172.31.8.238 TCP 15994 [TCP segment of a reassembled PDU]
 49   0.014886 172.31.8.238 -> 54.192.118.247 TCP 66 39721 > http [ACK] Seq=97 Ack=274130 Win=453632 Len=0 TSval=11463813 TSecr=1685111726
 50   0.015289 54.192.118.247 -> 172.31.8.238 TCP 4410 [TCP segment of a reassembled PDU]
 51   0.015295 172.31.8.238 -> 54.192.118.247 TCP 66 39721 > http [ACK] Seq=97 Ack=278474 Win=462336 Len=0 TSval=11463813 TSecr=1685111726
 52   0.015415 54.192.118.247 -> 172.31.8.238 TCP 13098 [TCP segment of a reassembled PDU]
 53   0.015424 172.31.8.238 -> 54.192.118.247 TCP 66 39721 > http [ACK] Seq=97 Ack=291506 Win=488448 Len=0 TSval=11463813 TSecr=1685111726
 54   0.015670 54.192.118.247 -> 172.31.8.238 TCP 26130 [TCP segment of a reassembled PDU]
 55   0.015685 172.31.8.238 -> 54.192.118.247 TCP 66 39721 > http [ACK] Seq=97 Ack=317570 Win=540544 Len=0 TSval=11463813 TSecr=1685111726
 56   0.016094 54.192.118.247 -> 172.31.8.238 TCP 18890 [TCP segment of a reassembled PDU]
 57   0.016106 172.31.8.238 -> 54.192.118.247 TCP 66 39721 > http [ACK] Seq=97 Ack=336394 Win=578176 Len=0 TSval=11463813 TSecr=1685111726
 58   0.016113 54.192.118.247 -> 172.31.8.238 TCP 1514 [TCP segment of a reassembled PDU]
 59   0.016116 172.31.8.238 -> 54.192.118.247 TCP 66 39721 > http [ACK] Seq=97 Ack=337842 Win=581120 Len=0 TSval=11463813 TSecr=1685111726
 60   0.016519 54.192.118.247 -> 172.31.8.238 TCP 27578 [TCP segment of a reassembled PDU]
 61   0.016535 172.31.8.238 -> 54.192.118.247 TCP 66 39721 > http [ACK] Seq=97 Ack=365354 Win=636160 Len=0 TSval=11463813 TSecr=1685111726
 62   0.016687 54.192.118.247 -> 172.31.8.238 TCP 20338 [TCP segment of a reassembled PDU]
 63   0.016699 172.31.8.238 -> 54.192.118.247 TCP 66 39721 > http [ACK] Seq=97 Ack=385626 Win=676736 Len=0 TSval=11463813 TSecr=1685111727
 64   0.017078 54.192.118.247 -> 172.31.8.238 TCP 7306 [TCP segment of a reassembled PDU]
 65   0.017086 172.31.8.238 -> 54.192.118.247 TCP 66 39721 > http [ACK] Seq=97 Ack=392866 Win=691200 Len=0 TSval=11463813 TSecr=1685111727
 66   0.017224 54.192.118.247 -> 172.31.8.238 TCP 8754 [TCP segment of a reassembled PDU]
 67   0.017231 172.31.8.238 -> 54.192.118.247 TCP 66 39721 > http [ACK] Seq=97 Ack=401554 Win=708480 Len=0 TSval=11463813 TSecr=1685111727
 68   0.017552 54.192.118.247 -> 172.31.8.238 TCP 37714 [TCP segment of a reassembled PDU]
 69   0.017572 172.31.8.238 -> 54.192.118.247 TCP 66 39721 > http [ACK] Seq=97 Ack=439202 Win=783872 Len=0 TSval=11463813 TSecr=1685111727
 70   0.017890 54.192.118.247 -> 172.31.8.238 TCP 17442 [TCP segment of a reassembled PDU]
 71   0.017901 172.31.8.238 -> 54.192.118.247 TCP 66 39721 > http [ACK] Seq=97 Ack=456578 Win=818560 Len=0 TSval=11463813 TSecr=1685111727
 72   0.018142 54.192.118.247 -> 172.31.8.238 TCP 15994 [TCP segment of a reassembled PDU]
 73   0.018152 172.31.8.238 -> 54.192.118.247 TCP 66 39721 > http [ACK] Seq=97 Ack=472506 Win=829696 Len=0 TSval=11463813 TSecr=1685111727
 74   0.018256 54.192.118.247 -> 172.31.8.238 TCP 24682 [TCP segment of a reassembled PDU]
 75   0.018268 172.31.8.238 -> 54.192.118.247 TCP 66 39721 > http [ACK] Seq=97 Ack=497122 Win=815488 Len=0 TSval=11463813 TSecr=1685111727
 76   0.018860 54.192.118.247 -> 172.31.8.238 TCP 8754 [TCP segment of a reassembled PDU]
 77   0.018868 172.31.8.238 -> 54.192.118.247 TCP 66 39721 > http [ACK] Seq=97 Ack=505810 Win=867840 Len=0 TSval=11463814 TSecr=1685111727
 78   0.019148 54.192.118.247 -> 172.31.8.238 TCP 53642 [TCP segment of a reassembled PDU]
 79   0.019169 172.31.8.238 -> 54.192.118.247 TCP 66 39721 > http [ACK] Seq=97 Ack=559386 Win=974976 Len=0 TSval=11463814 TSecr=1685111727
 80   0.019617 54.192.118.247 -> 172.31.8.238 TCP 7306 [TCP segment of a reassembled PDU]
 81   0.019624 172.31.8.238 -> 54.192.118.247 TCP 66 39721 > http [ACK] Seq=97 Ack=566626 Win=989440 Len=0 TSval=11463814 TSecr=1685111727
 82   0.019906 54.192.118.247 -> 172.31.8.238 TCP 55090 [TCP segment of a reassembled PDU]
 83   0.019930 172.31.8.238 -> 54.192.118.247 TCP 66 39721 > http [ACK] Seq=97 Ack=621650 Win=1099520 Len=0 TSval=11463814 TSecr=1685111727
 84   0.019936 54.192.118.247 -> 172.31.8.238 TCP 2962 [TCP segment of a reassembled PDU]
 85   0.019939 172.31.8.238 -> 54.192.118.247 TCP 66 39721 > http [ACK] Seq=97 Ack=624546 Win=1105280 Len=0 TSval=11463814 TSecr=1685111727
 86   0.020395 54.192.118.247 -> 172.31.8.238 TCP 5858 [TCP segment of a reassembled PDU]
 87   0.020402 172.31.8.238 -> 54.192.118.247 TCP 66 39721 > http [ACK] Seq=97 Ack=630338 Win=1116928 Len=0 TSval=11463814 TSecr=1685111727
 88   0.020685 54.192.118.247 -> 172.31.8.238 TCP 53642 [TCP segment of a reassembled PDU]
 89   0.020707 172.31.8.238 -> 54.192.118.247 TCP 66 39721 > http [ACK] Seq=97 Ack=683914 Win=1224064 Len=0 TSval=11463814 TSecr=1685111727
 90   0.020715 54.192.118.247 -> 172.31.8.238 TCP 5858 [TCP segment of a reassembled PDU]
 91   0.020720 172.31.8.238 -> 54.192.118.247 TCP 66 39721 > http [ACK] Seq=97 Ack=689706 Win=1218304 Len=0 TSval=11463814 TSecr=1685111727
 92   0.021185 54.192.118.247 -> 172.31.8.238 TCP 10202 [TCP segment of a reassembled PDU]
 93   0.021194 172.31.8.238 -> 54.192.118.247 TCP 66 39721 > http [ACK] Seq=97 Ack=699842 Win=1244288 Len=0 TSval=11463814 TSecr=1685111727
 94   0.021482 54.192.118.247 -> 172.31.8.238 TCP 17442 [TCP segment of a reassembled PDU]
 95   0.021492 172.31.8.238 -> 54.192.118.247 TCP 66 39721 > http [ACK] Seq=97 Ack=717218 Win=1279104 Len=0 TSval=11463814 TSecr=1685111727
 96   0.021517 54.192.118.247 -> 172.31.8.238 TCP 29026 [TCP segment of a reassembled PDU]
 97   0.021529 172.31.8.238 -> 54.192.118.247 TCP 66 39721 > http [ACK] Seq=97 Ack=746178 Win=1250176 Len=0 TSval=11463814 TSecr=1685111727
 98   0.021579 54.192.118.247 -> 172.31.8.238 TCP 10202 [TCP segment of a reassembled PDU]
 99   0.021586 172.31.8.238 -> 54.192.118.247 TCP 66 39721 > http [ACK] Seq=97 Ack=756314 Win=1298944 Len=0 TSval=11463814 TSecr=1685111727
100   0.021933 54.192.118.247 -> 172.31.8.238 TCP 4410 [TCP segment of a reassembled PDU]
101   0.021939 172.31.8.238 -> 54.192.118.247 TCP 66 39721 > http [ACK] Seq=97 Ack=760658 Win=1307648 Len=0 TSval=11463814 TSecr=1685111727
102   0.022088 54.192.118.247 -> 172.31.8.238 TCP 21786 [TCP segment of a reassembled PDU]
103   0.022099 172.31.8.238 -> 54.192.118.247 TCP 66 39721 > http [ACK] Seq=97 Ack=782378 Win=1286016 Len=0 TSval=11463814 TSecr=1685111727
104   0.022222 54.192.118.247 -> 172.31.8.238 TCP 15994 [TCP segment of a reassembled PDU]
105   0.022232 172.31.8.238 -> 54.192.118.247 TCP 66 39721 > http [ACK] Seq=97 Ack=798306 Win=1289344 Len=0 TSval=11463815 TSecr=1685111727
106   0.022379 54.192.118.247 -> 172.31.8.238 TCP 26130 [TCP segment of a reassembled PDU]
107   0.022393 172.31.8.238 -> 54.192.118.247 TCP 66 39721 > http [ACK] Seq=97 Ack=824370 Win=1272704 Len=0 TSval=11463815 TSecr=1685111727
108   0.022701 54.192.118.247 -> 172.31.8.238 TCP 2962 [TCP segment of a reassembled PDU]
109   0.022707 172.31.8.238 -> 54.192.118.247 TCP 66 39721 > http [ACK] Seq=97 Ack=827266 Win=1307648 Len=0 TSval=11463815 TSecr=1685111727
110   0.022966 54.192.118.247 -> 172.31.8.238 TCP 20338 [TCP segment of a reassembled PDU]
111   0.022987 54.192.118.247 -> 172.31.8.238 TCP 13098 [TCP segment of a reassembled PDU]
112   0.023005 172.31.8.238 -> 54.192.118.247 TCP 66 39721 > http [ACK] Seq=97 Ack=860570 Win=1274368 Len=0 TSval=11463815 TSecr=1685111727
113   0.023023 54.192.118.247 -> 172.31.8.238 TCP 13098 [TCP segment of a reassembled PDU]
114   0.023038 172.31.8.238 -> 54.192.118.247 TCP 66 39721 > http [ACK] Seq=97 Ack=873602 Win=1272704 Len=0 TSval=11463815 TSecr=1685111727
115   0.023084 54.192.118.247 -> 172.31.8.238 TCP 8754 [TCP segment of a reassembled PDU]
116   0.023092 172.31.8.238 -> 54.192.118.247 TCP 66 39721 > http [ACK] Seq=97 Ack=882290 Win=1301248 Len=0 TSval=11463815 TSecr=1685111727
117   0.023267 54.192.118.247 -> 172.31.8.238 TCP 17442 [TCP segment of a reassembled PDU]
118   0.023289 172.31.8.238 -> 54.192.118.247 TCP 66 39721 > http [ACK] Seq=97 Ack=899666 Win=1286912 Len=0 TSval=11463815 TSecr=1685111727
119   0.023407 54.192.118.247 -> 172.31.8.238 TCP 13098 [TCP segment of a reassembled PDU]
120   0.023416 172.31.8.238 -> 54.192.118.247 TCP 66 39721 > http [ACK] Seq=97 Ack=912698 Win=1294208 Len=0 TSval=11463815 TSecr=1685111727
121   0.023603 54.192.118.247 -> 172.31.8.238 TCP 36266 [TCP segment of a reassembled PDU]
122   0.023632 172.31.8.238 -> 54.192.118.247 TCP 66 39721 > http [ACK] Seq=97 Ack=948898 Win=1258112 Len=0 TSval=11463815 TSecr=1685111727
123   0.023759 54.192.118.247 -> 172.31.8.238 TCP 13098 [TCP segment of a reassembled PDU]
124   0.023768 172.31.8.238 -> 54.192.118.247 TCP 66 39721 > http [ACK] Seq=97 Ack=961930 Win=1294208 Len=0 TSval=11463815 TSecr=1685111727
125   0.023888 54.192.118.247 -> 172.31.8.238 TCP 15994 [TCP segment of a reassembled PDU]
126   0.023913 172.31.8.238 -> 54.192.118.247 TCP 66 39721 > http [ACK] Seq=97 Ack=977858 Win=1307648 Len=0 TSval=11463815 TSecr=1685111727
127   0.024253 54.192.118.247 -> 172.31.8.238 TCP 7306 [TCP segment of a reassembled PDU]
128   0.024271 172.31.8.238 -> 54.192.118.247 TCP 66 39721 > http [ACK] Seq=97 Ack=985098 Win=1307648 Len=0 TSval=11463815 TSecr=1685111727
129   0.024550 54.192.118.247 -> 172.31.8.238 TCP 39162 [TCP segment of a reassembled PDU]
130   0.024583 54.192.118.247 -> 172.31.8.238 TCP 13098 [TCP segment of a reassembled PDU]
131   0.024599 54.192.118.247 -> 172.31.8.238 TCP 7306 [TCP segment of a reassembled PDU]
132   0.024605 54.192.118.247 -> 172.31.8.238 HTTP 4634 HTTP/1.1 200 OK  (application/octet-stream)
133   0.024609 172.31.8.238 -> 54.192.118.247 TCP 66 39721 > http [ACK] Seq=97 Ack=1037226 Win=1255552 Len=0 TSval=11463815 TSecr=1685111727
134   0.024623 172.31.8.238 -> 54.192.118.247 TCP 66 39721 > http [ACK] Seq=97 Ack=1049034 Win=1243776 Len=0 TSval=11463815 TSecr=1685111727
135   0.024739 172.31.8.238 -> 54.192.118.247 TCP 66 39721 > http [FIN, ACK] Seq=97 Ack=1049034 Win=1307648 Len=0 TSval=11463815 TSecr=1685111727
136   0.025517 54.192.118.247 -> 172.31.8.238 TCP 66 http > 39721 [FIN, ACK] Seq=1049034 Ack=98 Win=14592 Len=0 TSval=1685111727 TSecr=11463815
137   0.025526 172.31.8.238 -> 54.192.118.247 TCP 66 39721 > http [ACK] Seq=98 Ack=1049035 Win=1307648 Len=0 TSval=11463815 TSecr=1685111727
