[Measurement for 1mb at 10:43:47 20.43.2014] 
Tshark:

  1   0.000000 172.31.8.238 -> 172.31.0.2   DNS 89 Standard query 0x375a  A d3m1c4hwkgedal.cloudfront.net
  2   0.000035 172.31.8.238 -> 172.31.0.2   DNS 89 Standard query 0x6c9c  AAAA d3m1c4hwkgedal.cloudfront.net
  3   0.000622   172.31.0.2 -> 172.31.8.238 DNS 217 Standard query response 0x375a  A 54.230.117.152 A 54.230.117.154 A 54.230.118.214 A 54.230.119.40 A 54.239.132.41 A 54.192.118.220 A 54.192.118.230 A 54.230.116.154
  4   0.000632   172.31.0.2 -> 172.31.8.238 DNS 174 Standard query response 0x6c9c 
  5   0.003954 172.31.8.238 -> 54.230.117.152 TCP 74 53152 > http [SYN] Seq=0 Win=26883 Len=0 MSS=8961 SACK_PERM=1 TSval=15963799 TSecr=0 WS=128
  6   0.004544 54.230.117.152 -> 172.31.8.238 TCP 74 http > 53152 [SYN, ACK] Seq=0 Ack=1 Win=14480 Len=0 MSS=1460 SACK_PERM=1 TSval=1688731836 TSecr=15963799 WS=128
  7   0.004559 172.31.8.238 -> 54.230.117.152 TCP 66 53152 > http [ACK] Seq=1 Ack=1 Win=27008 Len=0 TSval=15963799 TSecr=1688731836
  8   0.004605 172.31.8.238 -> 54.230.117.152 HTTP 162 GET /1mb HTTP/1.1 
  9   0.005209 54.230.117.152 -> 172.31.8.238 TCP 66 http > 53152 [ACK] Seq=1 Ack=97 Win=14592 Len=0 TSval=1688731837 TSecr=15963799
 10   0.007287 54.230.117.152 -> 172.31.8.238 TCP 523 [TCP segment of a reassembled PDU]
 11   0.007295 172.31.8.238 -> 54.230.117.152 TCP 66 53152 > http [ACK] Seq=97 Ack=458 Win=28032 Len=0 TSval=15963800 TSecr=1688731837
 12   0.007377 54.230.117.152 -> 172.31.8.238 TCP 13098 [TCP segment of a reassembled PDU]
 13   0.007388 172.31.8.238 -> 54.230.117.152 TCP 66 53152 > http [ACK] Seq=97 Ack=13490 Win=54144 Len=0 TSval=15963800 TSecr=1688731837
 14   0.007907 54.230.117.152 -> 172.31.8.238 TCP 13098 [TCP segment of a reassembled PDU]
 15   0.007917 172.31.8.238 -> 54.230.117.152 TCP 66 53152 > http [ACK] Seq=97 Ack=26522 Win=80128 Len=0 TSval=15963800 TSecr=1688731837
 16   0.008341 54.230.117.152 -> 172.31.8.238 TCP 8754 [TCP segment of a reassembled PDU]
 17   0.008348 172.31.8.238 -> 54.230.117.152 TCP 66 53152 > http [ACK] Seq=97 Ack=35210 Win=97536 Len=0 TSval=15963800 TSecr=1688731837
 18   0.008385 54.230.117.152 -> 172.31.8.238 TCP 4410 [TCP segment of a reassembled PDU]
 19   0.008391 172.31.8.238 -> 54.230.117.152 TCP 66 53152 > http [ACK] Seq=97 Ack=39554 Win=106240 Len=0 TSval=15963800 TSecr=1688731837
 20   0.008845 54.230.117.152 -> 172.31.8.238 TCP 4410 [TCP segment of a reassembled PDU]
 21   0.008851 172.31.8.238 -> 54.230.117.152 TCP 66 53152 > http [ACK] Seq=97 Ack=43898 Win=109056 Len=0 TSval=15963800 TSecr=1688731837
 22   0.008949 54.230.117.152 -> 172.31.8.238 TCP 8754 [TCP segment of a reassembled PDU]
 23   0.008956 172.31.8.238 -> 54.230.117.152 TCP 66 53152 > http [ACK] Seq=97 Ack=52586 Win=103680 Len=0 TSval=15963800 TSecr=1688731837
 24   0.008985 54.230.117.152 -> 172.31.8.238 TCP 8754 [TCP segment of a reassembled PDU]
 25   0.008992 172.31.8.238 -> 54.230.117.152 TCP 66 53152 > http [ACK] Seq=97 Ack=61274 Win=95104 Len=0 TSval=15963800 TSecr=1688731837
 26   0.009657 54.230.117.152 -> 172.31.8.238 TCP 4410 [TCP segment of a reassembled PDU]
 27   0.009663 172.31.8.238 -> 54.230.117.152 TCP 66 53152 > http [ACK] Seq=97 Ack=65618 Win=109056 Len=0 TSval=15963800 TSecr=1688731837
 28   0.009779 54.230.117.152 -> 172.31.8.238 TCP 21786 [TCP segment of a reassembled PDU]
 29   0.009791 172.31.8.238 -> 54.230.117.152 TCP 66 53152 > http [ACK] Seq=97 Ack=87338 Win=87424 Len=0 TSval=15963800 TSecr=1688731837
 30   0.010202 54.230.117.152 -> 172.31.8.238 TCP 1514 [TCP segment of a reassembled PDU]
 31   0.010207 172.31.8.238 -> 54.230.117.152 TCP 66 53152 > http [ACK] Seq=97 Ack=88786 Win=109056 Len=0 TSval=15963800 TSecr=1688731837
 32   0.010291 54.230.117.152 -> 172.31.8.238 TCP 2962 [TCP segment of a reassembled PDU]
 33   0.010296 172.31.8.238 -> 54.230.117.152 TCP 66 53152 > http [ACK] Seq=97 Ack=91682 Win=109056 Len=0 TSval=15963800 TSecr=1688731837
 34   0.010437 54.230.117.152 -> 172.31.8.238 TCP 8754 [TCP segment of a reassembled PDU]
 35   0.010443 172.31.8.238 -> 54.230.117.152 TCP 66 53152 > http [ACK] Seq=97 Ack=100370 Win=103680 Len=0 TSval=15963800 TSecr=1688731837
 36   0.010547 54.230.117.152 -> 172.31.8.238 TCP 15994 [TCP segment of a reassembled PDU]
 37   0.010556 172.31.8.238 -> 54.230.117.152 TCP 66 53152 > http [ACK] Seq=97 Ack=116298 Win=91648 Len=0 TSval=15963800 TSecr=1688731837
 38   0.010945 54.230.117.152 -> 172.31.8.238 TCP 8754 [TCP segment of a reassembled PDU]
 39   0.010953 172.31.8.238 -> 54.230.117.152 TCP 66 53152 > http [ACK] Seq=97 Ack=124986 Win=103680 Len=0 TSval=15963800 TSecr=1688731837
 40   0.011057 54.230.117.152 -> 172.31.8.238 TCP 8754 [TCP segment of a reassembled PDU]
 41   0.011077 172.31.8.238 -> 54.230.117.152 TCP 66 53152 > http [ACK] Seq=97 Ack=133674 Win=95104 Len=0 TSval=15963800 TSecr=1688731837
 42   0.011214 54.230.117.152 -> 172.31.8.238 TCP 10202 [TCP segment of a reassembled PDU]
 43   0.011221 172.31.8.238 -> 54.230.117.152 TCP 66 53152 > http [ACK] Seq=97 Ack=143810 Win=84992 Len=0 TSval=15963801 TSecr=1688731837
 44   0.011499 54.230.117.152 -> 172.31.8.238 TCP 10202 [TCP segment of a reassembled PDU]
 45   0.011507 172.31.8.238 -> 54.230.117.152 TCP 66 53152 > http [ACK] Seq=97 Ack=153946 Win=129280 Len=0 TSval=15963801 TSecr=1688731837
 46   0.011597 54.230.117.152 -> 172.31.8.238 TCP 7306 [TCP segment of a reassembled PDU]
 47   0.011604 172.31.8.238 -> 54.230.117.152 TCP 66 53152 > http [ACK] Seq=97 Ack=161186 Win=143872 Len=0 TSval=15963801 TSecr=1688731837
 48   0.011819 54.230.117.152 -> 172.31.8.238 TCP 21786 [TCP segment of a reassembled PDU]
 49   0.011831 172.31.8.238 -> 54.230.117.152 TCP 66 53152 > http [ACK] Seq=97 Ack=182906 Win=187264 Len=0 TSval=15963801 TSecr=1688731837
 50   0.012201 54.230.117.152 -> 172.31.8.238 TCP 7306 [TCP segment of a reassembled PDU]
 51   0.012208 172.31.8.238 -> 54.230.117.152 TCP 66 53152 > http [ACK] Seq=97 Ack=190146 Win=201728 Len=0 TSval=15963801 TSecr=1688731837
 52   0.012329 54.230.117.152 -> 172.31.8.238 TCP 5858 [TCP segment of a reassembled PDU]
 53   0.012335 172.31.8.238 -> 54.230.117.152 TCP 66 53152 > http [ACK] Seq=97 Ack=195938 Win=213376 Len=0 TSval=15963801 TSecr=1688731837
 54   0.012574 54.230.117.152 -> 172.31.8.238 TCP 20338 [TCP segment of a reassembled PDU]
 55   0.012585 172.31.8.238 -> 54.230.117.152 TCP 66 53152 > http [ACK] Seq=97 Ack=216210 Win=253824 Len=0 TSval=15963801 TSecr=1688731837
 56   0.012601 54.230.117.152 -> 172.31.8.238 TCP 5858 [TCP segment of a reassembled PDU]
 57   0.012605 172.31.8.238 -> 54.230.117.152 TCP 66 53152 > http [ACK] Seq=97 Ack=222002 Win=265472 Len=0 TSval=15963801 TSecr=1688731837
 58   0.012655 54.230.117.152 -> 172.31.8.238 TCP 4410 [TCP segment of a reassembled PDU]
 59   0.012661 172.31.8.238 -> 54.230.117.152 TCP 66 53152 > http [ACK] Seq=97 Ack=226346 Win=274176 Len=0 TSval=15963801 TSecr=1688731837
 60   0.012969 54.230.117.152 -> 172.31.8.238 TCP 5858 [TCP segment of a reassembled PDU]
 61   0.012975 172.31.8.238 -> 54.230.117.152 TCP 66 53152 > http [ACK] Seq=97 Ack=232138 Win=285696 Len=0 TSval=15963801 TSecr=1688731837
 62   0.013111 54.230.117.152 -> 172.31.8.238 TCP 10202 [TCP segment of a reassembled PDU]
 63   0.013118 172.31.8.238 -> 54.230.117.152 TCP 66 53152 > http [ACK] Seq=97 Ack=242274 Win=306048 Len=0 TSval=15963801 TSecr=1688731837
 64   0.013313 54.230.117.152 -> 172.31.8.238 TCP 5858 [TCP segment of a reassembled PDU]
 65   0.013319 172.31.8.238 -> 54.230.117.152 TCP 66 53152 > http [ACK] Seq=97 Ack=248066 Win=317568 Len=0 TSval=15963801 TSecr=1688731837
 66   0.013412 54.230.117.152 -> 172.31.8.238 TCP 15994 [TCP segment of a reassembled PDU]
 67   0.013421 172.31.8.238 -> 54.230.117.152 TCP 66 53152 > http [ACK] Seq=97 Ack=263994 Win=349440 Len=0 TSval=15963801 TSecr=1688731837
 68   0.013615 54.230.117.152 -> 172.31.8.238 TCP 20338 [TCP segment of a reassembled PDU]
 69   0.013627 172.31.8.238 -> 54.230.117.152 TCP 66 53152 > http [ACK] Seq=97 Ack=284266 Win=390016 Len=0 TSval=15963801 TSecr=1688731837
 70   0.013981 54.230.117.152 -> 172.31.8.238 TCP 1514 [TCP segment of a reassembled PDU]
 71   0.013986 172.31.8.238 -> 54.230.117.152 TCP 66 53152 > http [ACK] Seq=97 Ack=285714 Win=392832 Len=0 TSval=15963801 TSecr=1688731837
 72   0.014158 54.230.117.152 -> 172.31.8.238 TCP 26130 [TCP segment of a reassembled PDU]
 73   0.014171 172.31.8.238 -> 54.230.117.152 TCP 66 53152 > http [ACK] Seq=97 Ack=311778 Win=445056 Len=0 TSval=15963801 TSecr=1688731837
 74   0.014191 54.230.117.152 -> 172.31.8.238 TCP 8754 [TCP segment of a reassembled PDU]
 75   0.014197 172.31.8.238 -> 54.230.117.152 TCP 66 53152 > http [ACK] Seq=97 Ack=320466 Win=462336 Len=0 TSval=15963801 TSecr=1688731837
 76   0.014375 54.230.117.152 -> 172.31.8.238 TCP 18890 [TCP segment of a reassembled PDU]
 77   0.014386 172.31.8.238 -> 54.230.117.152 TCP 66 53152 > http [ACK] Seq=97 Ack=339290 Win=499968 Len=0 TSval=15963801 TSecr=1688731837
 78   0.014466 54.230.117.152 -> 172.31.8.238 TCP 2962 [TCP segment of a reassembled PDU]
 79   0.014471 172.31.8.238 -> 54.230.117.152 TCP 66 53152 > http [ACK] Seq=97 Ack=342186 Win=505856 Len=0 TSval=15963801 TSecr=1688731837
 80   0.014872 54.230.117.152 -> 172.31.8.238 TCP 2962 [TCP segment of a reassembled PDU]
 81   0.014876 172.31.8.238 -> 54.230.117.152 TCP 66 53152 > http [ACK] Seq=97 Ack=345082 Win=511616 Len=0 TSval=15963801 TSecr=1688731837
 82   0.015058 54.230.117.152 -> 172.31.8.238 TCP 26130 [TCP segment of a reassembled PDU]
 83   0.015071 172.31.8.238 -> 54.230.117.152 TCP 66 53152 > http [ACK] Seq=97 Ack=371146 Win=563712 Len=0 TSval=15963802 TSecr=1688731837
 84   0.015129 54.230.117.152 -> 172.31.8.238 TCP 26130 [TCP segment of a reassembled PDU]
 85   0.015141 172.31.8.238 -> 54.230.117.152 TCP 66 53152 > http [ACK] Seq=97 Ack=397210 Win=615808 Len=0 TSval=15963802 TSecr=1688731837
 86   0.015186 54.230.117.152 -> 172.31.8.238 TCP 10202 [TCP segment of a reassembled PDU]
 87   0.015194 172.31.8.238 -> 54.230.117.152 TCP 66 53152 > http [ACK] Seq=97 Ack=407346 Win=636160 Len=0 TSval=15963802 TSecr=1688731837
 88   0.015677 54.230.117.152 -> 172.31.8.238 TCP 4410 [TCP segment of a reassembled PDU]
 89   0.015684 172.31.8.238 -> 54.230.117.152 TCP 66 53152 > http [ACK] Seq=97 Ack=411690 Win=644864 Len=0 TSval=15963802 TSecr=1688731838
 90   0.015846 54.230.117.152 -> 172.31.8.238 TCP 21786 [TCP segment of a reassembled PDU]
 91   0.015858 172.31.8.238 -> 54.230.117.152 TCP 66 53152 > http [ACK] Seq=97 Ack=433410 Win=688256 Len=0 TSval=15963802 TSecr=1688731838
 92   0.015874 54.230.117.152 -> 172.31.8.238 TCP 4410 [TCP segment of a reassembled PDU]
 93   0.015878 172.31.8.238 -> 54.230.117.152 TCP 66 53152 > http [ACK] Seq=97 Ack=437754 Win=696960 Len=0 TSval=15963802 TSecr=1688731838
 94   0.015942 54.230.117.152 -> 172.31.8.238 TCP 11650 [TCP segment of a reassembled PDU]
 95   0.015950 172.31.8.238 -> 54.230.117.152 TCP 66 53152 > http [ACK] Seq=97 Ack=449338 Win=720128 Len=0 TSval=15963802 TSecr=1688731838
 96   0.016056 54.230.117.152 -> 172.31.8.238 TCP 11650 [TCP segment of a reassembled PDU]
 97   0.016064 172.31.8.238 -> 54.230.117.152 TCP 66 53152 > http [ACK] Seq=97 Ack=460922 Win=743296 Len=0 TSval=15963802 TSecr=1688731838
 98   0.016701 54.230.117.152 -> 172.31.8.238 TCP 2962 [TCP segment of a reassembled PDU]
 99   0.016706 172.31.8.238 -> 54.230.117.152 TCP 66 53152 > http [ACK] Seq=97 Ack=463818 Win=749056 Len=0 TSval=15963802 TSecr=1688731838
100   0.016872 54.230.117.152 -> 172.31.8.238 TCP 26130 [TCP segment of a reassembled PDU]
101   0.016885 172.31.8.238 -> 54.230.117.152 TCP 66 53152 > http [ACK] Seq=97 Ack=489882 Win=801152 Len=0 TSval=15963802 TSecr=1688731838
102   0.016947 54.230.117.152 -> 172.31.8.238 TCP 26130 [TCP segment of a reassembled PDU]
103   0.016959 172.31.8.238 -> 54.230.117.152 TCP 66 53152 > http [ACK] Seq=97 Ack=515946 Win=853376 Len=0 TSval=15963802 TSecr=1688731838
104   0.017021 54.230.117.152 -> 172.31.8.238 TCP 10202 [TCP segment of a reassembled PDU]
105   0.017028 172.31.8.238 -> 54.230.117.152 TCP 66 53152 > http [ACK] Seq=97 Ack=526082 Win=873600 Len=0 TSval=15963802 TSecr=1688731838
106   0.017743 54.230.117.152 -> 172.31.8.238 TCP 5858 [TCP segment of a reassembled PDU]
107   0.017750 172.31.8.238 -> 54.230.117.152 TCP 66 53152 > http [ACK] Seq=97 Ack=531874 Win=885248 Len=0 TSval=15963802 TSecr=1688731838
108   0.017898 54.230.117.152 -> 172.31.8.238 TCP 20338 [TCP segment of a reassembled PDU]
109   0.017909 172.31.8.238 -> 54.230.117.152 TCP 66 53152 > http [ACK] Seq=97 Ack=552146 Win=925696 Len=0 TSval=15963802 TSecr=1688731838
110   0.017926 54.230.117.152 -> 172.31.8.238 TCP 5858 [TCP segment of a reassembled PDU]
111   0.017931 172.31.8.238 -> 54.230.117.152 TCP 66 53152 > http [ACK] Seq=97 Ack=557938 Win=937344 Len=0 TSval=15963802 TSecr=1688731838
112   0.018016 54.230.117.152 -> 172.31.8.238 TCP 26130 [TCP segment of a reassembled PDU]
113   0.018029 172.31.8.238 -> 54.230.117.152 TCP 66 53152 > http [ACK] Seq=97 Ack=584002 Win=989440 Len=0 TSval=15963802 TSecr=1688731838
114   0.018059 54.230.117.152 -> 172.31.8.238 TCP 7306 [TCP segment of a reassembled PDU]
115   0.018065 172.31.8.238 -> 54.230.117.152 TCP 66 53152 > http [ACK] Seq=97 Ack=591242 Win=1003904 Len=0 TSval=15963802 TSecr=1688731838
116   0.018755 54.230.117.152 -> 172.31.8.238 TCP 5858 [TCP segment of a reassembled PDU]
117   0.018761 172.31.8.238 -> 54.230.117.152 TCP 66 53152 > http [ACK] Seq=97 Ack=597034 Win=1015552 Len=0 TSval=15963802 TSecr=1688731838
118   0.018924 54.230.117.152 -> 172.31.8.238 TCP 17442 [TCP segment of a reassembled PDU]
119   0.018934 172.31.8.238 -> 54.230.117.152 TCP 66 53152 > http [ACK] Seq=97 Ack=614410 Win=1050240 Len=0 TSval=15963802 TSecr=1688731838
120   0.019050 54.230.117.152 -> 172.31.8.238 TCP 34818 [TCP segment of a reassembled PDU]
121   0.019066 172.31.8.238 -> 54.230.117.152 TCP 66 53152 > http [ACK] Seq=97 Ack=649162 Win=1119744 Len=0 TSval=15963803 TSecr=1688731838
122   0.019088 54.230.117.152 -> 172.31.8.238 TCP 7306 [TCP segment of a reassembled PDU]
123   0.019094 172.31.8.238 -> 54.230.117.152 TCP 66 53152 > http [ACK] Seq=97 Ack=656402 Win=1134208 Len=0 TSval=15963803 TSecr=1688731838
124   0.019394 54.230.117.152 -> 172.31.8.238 TCP 20338 [TCP segment of a reassembled PDU]
125   0.019405 172.31.8.238 -> 54.230.117.152 TCP 66 53152 > http [ACK] Seq=97 Ack=676674 Win=1174784 Len=0 TSval=15963803 TSecr=1688731838
126   0.019423 54.230.117.152 -> 172.31.8.238 TCP 5858 [TCP segment of a reassembled PDU]
127   0.019427 172.31.8.238 -> 54.230.117.152 TCP 66 53152 > http [ACK] Seq=97 Ack=682466 Win=1186432 Len=0 TSval=15963803 TSecr=1688731838
128   0.019480 54.230.117.152 -> 172.31.8.238 TCP 7306 [TCP segment of a reassembled PDU]
129   0.019487 172.31.8.238 -> 54.230.117.152 TCP 66 53152 > http [ACK] Seq=97 Ack=689706 Win=1200896 Len=0 TSval=15963803 TSecr=1688731838
130   0.019643 54.230.117.152 -> 172.31.8.238 TCP 26130 [TCP segment of a reassembled PDU]
131   0.019655 172.31.8.238 -> 54.230.117.152 TCP 66 53152 > http [ACK] Seq=97 Ack=715770 Win=1191680 Len=0 TSval=15963803 TSecr=1688731838
132   0.019740 54.230.117.152 -> 172.31.8.238 TCP 5858 [TCP segment of a reassembled PDU]
133   0.019746 172.31.8.238 -> 54.230.117.152 TCP 66 53152 > http [ACK] Seq=97 Ack=721562 Win=1212416 Len=0 TSval=15963803 TSecr=1688731838
134   0.019773 54.230.117.152 -> 172.31.8.238 TCP 1514 [TCP segment of a reassembled PDU]
135   0.019776 172.31.8.238 -> 54.230.117.152 TCP 66 53152 > http [ACK] Seq=97 Ack=723010 Win=1215360 Len=0 TSval=15963803 TSecr=1688731838
136   0.019907 54.230.117.152 -> 172.31.8.238 TCP 26130 [TCP segment of a reassembled PDU]
137   0.019919 172.31.8.238 -> 54.230.117.152 TCP 66 53152 > http [ACK] Seq=97 Ack=749074 Win=1189376 Len=0 TSval=15963803 TSecr=1688731838
138   0.019975 54.230.117.152 -> 172.31.8.238 TCP 26130 [TCP segment of a reassembled PDU]
139   0.019988 172.31.8.238 -> 54.230.117.152 TCP 66 53152 > http [ACK] Seq=97 Ack=775138 Win=1163392 Len=0 TSval=15963803 TSecr=1688731838
140   0.020281 54.230.117.152 -> 172.31.8.238 TCP 5858 [TCP segment of a reassembled PDU]
141   0.020288 172.31.8.238 -> 54.230.117.152 TCP 66 53152 > http [ACK] Seq=97 Ack=780930 Win=1224960 Len=0 TSval=15963803 TSecr=1688731838
142   0.020450 54.230.117.152 -> 172.31.8.238 TCP 26130 [TCP segment of a reassembled PDU]
143   0.020473 172.31.8.238 -> 54.230.117.152 TCP 66 53152 > http [ACK] Seq=97 Ack=806994 Win=1198976 Len=0 TSval=15963803 TSecr=1688731838
144   0.020521 54.230.117.152 -> 172.31.8.238 TCP 26130 [TCP segment of a reassembled PDU]
145   0.020545 172.31.8.238 -> 54.230.117.152 TCP 66 53152 > http [ACK] Seq=97 Ack=833058 Win=1191680 Len=0 TSval=15963803 TSecr=1688731838
146   0.020600 54.230.117.152 -> 172.31.8.238 TCP 18890 [TCP segment of a reassembled PDU]
147   0.020611 172.31.8.238 -> 54.230.117.152 TCP 66 53152 > http [ACK] Seq=97 Ack=851882 Win=1203456 Len=0 TSval=15963803 TSecr=1688731838
148   0.020875 54.230.117.152 -> 172.31.8.238 TCP 7306 [TCP segment of a reassembled PDU]
149   0.020883 172.31.8.238 -> 54.230.117.152 TCP 66 53152 > http [ACK] Seq=97 Ack=859122 Win=1222528 Len=0 TSval=15963803 TSecr=1688731838
150   0.021014 54.230.117.152 -> 172.31.8.238 TCP 15994 [TCP segment of a reassembled PDU]
151   0.021035 172.31.8.238 -> 54.230.117.152 TCP 66 53152 > http [ACK] Seq=97 Ack=875050 Win=1226880 Len=0 TSval=15963803 TSecr=1688731838
152   0.021150 54.230.117.152 -> 172.31.8.238 TCP 20338 [TCP segment of a reassembled PDU]
153   0.021170 54.230.117.152 -> 172.31.8.238 TCP 2962 [TCP segment of a reassembled PDU]
154   0.021180 172.31.8.238 -> 54.230.117.152 TCP 66 53152 > http [ACK] Seq=97 Ack=898218 Win=1203712 Len=0 TSval=15963803 TSecr=1688731838
155   0.021291 54.230.117.152 -> 172.31.8.238 TCP 26130 [TCP segment of a reassembled PDU]
156   0.021315 172.31.8.238 -> 54.230.117.152 TCP 66 53152 > http [ACK] Seq=97 Ack=924282 Win=1191680 Len=0 TSval=15963803 TSecr=1688731838
157   0.021359 54.230.117.152 -> 172.31.8.238 TCP 26130 [TCP segment of a reassembled PDU]
158   0.021372 172.31.8.238 -> 54.230.117.152 TCP 66 53152 > http [ACK] Seq=97 Ack=950346 Win=1191680 Len=0 TSval=15963803 TSecr=1688731838
159   0.021423 54.230.117.152 -> 172.31.8.238 TCP 15994 [TCP segment of a reassembled PDU]
160   0.021433 172.31.8.238 -> 54.230.117.152 TCP 66 53152 > http [ACK] Seq=97 Ack=966274 Win=1208192 Len=0 TSval=15963803 TSecr=1688731838
161   0.021823 54.230.117.152 -> 172.31.8.238 TCP 2962 [TCP segment of a reassembled PDU]
162   0.021828 172.31.8.238 -> 54.230.117.152 TCP 66 53152 > http [ACK] Seq=97 Ack=969170 Win=1229696 Len=0 TSval=15963803 TSecr=1688731838
163   0.021995 54.230.117.152 -> 172.31.8.238 TCP 26130 [TCP segment of a reassembled PDU]
164   0.022019 172.31.8.238 -> 54.230.117.152 TCP 66 53152 > http [ACK] Seq=97 Ack=995234 Win=1203712 Len=0 TSval=15963803 TSecr=1688731838
165   0.022057 54.230.117.152 -> 172.31.8.238 TCP 17442 [TCP segment of a reassembled PDU]
166   0.022067 172.31.8.238 -> 54.230.117.152 TCP 66 53152 > http [ACK] Seq=97 Ack=1012610 Win=1205888 Len=0 TSval=15963803 TSecr=1688731838
167   0.022170 54.230.117.152 -> 172.31.8.238 TCP 34818 [TCP segment of a reassembled PDU]
168   0.022200 54.230.117.152 -> 172.31.8.238 HTTP 1738 HTTP/1.1 200 OK  (application/octet-stream)
169   0.022217 172.31.8.238 -> 54.230.117.152 TCP 66 53152 > http [ACK] Seq=97 Ack=1049034 Win=1172480 Len=0 TSval=15963803 TSecr=1688731838
170   0.022347 172.31.8.238 -> 54.230.117.152 TCP 66 53152 > http [FIN, ACK] Seq=97 Ack=1049034 Win=1232384 Len=0 TSval=15963803 TSecr=1688731838
171   0.022833 54.230.117.152 -> 172.31.8.238 TCP 66 http > 53152 [FIN, ACK] Seq=1049034 Ack=98 Win=14592 Len=0 TSval=1688731838 TSecr=15963803
172   0.022843 172.31.8.238 -> 54.230.117.152 TCP 66 53152 > http [ACK] Seq=98 Ack=1049035 Win=1232384 Len=0 TSval=15963803 TSecr=1688731838
