[Measurement for 1mb at 04:43:47 20.43.2014] 
Tshark:

  1   0.000000 172.31.8.238 -> 172.31.0.2   DNS 89 Standard query 0xe44c  A d3m1c4hwkgedal.cloudfront.net
  2   0.000021 172.31.8.238 -> 172.31.0.2   DNS 89 Standard query 0x9d95  AAAA d3m1c4hwkgedal.cloudfront.net
  3   0.000674   172.31.0.2 -> 172.31.8.238 DNS 217 Standard query response 0xe44c  A 54.192.118.224 A 54.230.116.73 A 54.230.116.82 A 54.230.116.128 A 54.230.119.125 A 54.239.132.103 A 54.239.132.233 A 54.192.118.222
  4   0.000686   172.31.0.2 -> 172.31.8.238 DNS 174 Standard query response 0x9d95 
  5   0.003800 172.31.8.238 -> 54.192.118.224 TCP 74 55292 > http [SYN] Seq=0 Win=26883 Len=0 MSS=8961 SACK_PERM=1 TSval=10563832 TSecr=0 WS=128
  6   0.004667 54.192.118.224 -> 172.31.8.238 TCP 74 http > 55292 [SYN, ACK] Seq=0 Ack=1 Win=14480 Len=0 MSS=1460 SACK_PERM=1 TSval=1683668023 TSecr=10563832 WS=128
  7   0.004682 172.31.8.238 -> 54.192.118.224 TCP 66 55292 > http [ACK] Seq=1 Ack=1 Win=27008 Len=0 TSval=10563833 TSecr=1683668023
  8   0.004722 172.31.8.238 -> 54.192.118.224 HTTP 162 GET /1mb HTTP/1.1 
  9   0.005416 54.192.118.224 -> 172.31.8.238 TCP 66 http > 55292 [ACK] Seq=1 Ack=97 Win=14592 Len=0 TSval=1683668023 TSecr=10563833
 10   0.007200 54.192.118.224 -> 172.31.8.238 TCP 523 [TCP segment of a reassembled PDU]
 11   0.007207 172.31.8.238 -> 54.192.118.224 TCP 66 55292 > http [ACK] Seq=97 Ack=458 Win=28032 Len=0 TSval=10563833 TSecr=1683668023
 12   0.007319 54.192.118.224 -> 172.31.8.238 TCP 13098 [TCP segment of a reassembled PDU]
 13   0.007330 172.31.8.238 -> 54.192.118.224 TCP 66 55292 > http [ACK] Seq=97 Ack=13490 Win=54144 Len=0 TSval=10563833 TSecr=1683668024
 14   0.007970 54.192.118.224 -> 172.31.8.238 TCP 2962 [TCP segment of a reassembled PDU]
 15   0.007976 172.31.8.238 -> 54.192.118.224 TCP 66 55292 > http [ACK] Seq=97 Ack=16386 Win=59904 Len=0 TSval=10563834 TSecr=1683668024
 16   0.008072 54.192.118.224 -> 172.31.8.238 TCP 10202 [TCP segment of a reassembled PDU]
 17   0.008079 172.31.8.238 -> 54.192.118.224 TCP 66 55292 > http [ACK] Seq=97 Ack=26522 Win=80128 Len=0 TSval=10563834 TSecr=1683668024
 18   0.008815 54.192.118.224 -> 172.31.8.238 TCP 18890 [TCP segment of a reassembled PDU]
 19   0.008826 172.31.8.238 -> 54.192.118.224 TCP 66 55292 > http [ACK] Seq=97 Ack=45346 Win=86912 Len=0 TSval=10563834 TSecr=1683668024
 20   0.008835 54.192.118.224 -> 172.31.8.238 TCP 1514 [TCP segment of a reassembled PDU]
 21   0.008838 172.31.8.238 -> 54.192.118.224 TCP 66 55292 > http [ACK] Seq=97 Ack=46794 Win=85504 Len=0 TSval=10563834 TSecr=1683668024
 22   0.009523 54.192.118.224 -> 172.31.8.238 TCP 5858 [TCP segment of a reassembled PDU]
 23   0.009530 172.31.8.238 -> 54.192.118.224 TCP 66 55292 > http [ACK] Seq=97 Ack=52586 Win=108416 Len=0 TSval=10563834 TSecr=1683668024
 24   0.009627 54.192.118.224 -> 172.31.8.238 TCP 13098 [TCP segment of a reassembled PDU]
 25   0.009635 172.31.8.238 -> 54.192.118.224 TCP 66 55292 > http [ACK] Seq=97 Ack=65618 Win=96512 Len=0 TSval=10563834 TSecr=1683668024
 26   0.010292 54.192.118.224 -> 172.31.8.238 TCP 13098 [TCP segment of a reassembled PDU]
 27   0.010301 172.31.8.238 -> 54.192.118.224 TCP 66 55292 > http [ACK] Seq=97 Ack=78650 Win=96512 Len=0 TSval=10563834 TSecr=1683668024
 28   0.010349 54.192.118.224 -> 172.31.8.238 TCP 13098 [TCP segment of a reassembled PDU]
 29   0.010358 172.31.8.238 -> 54.192.118.224 TCP 66 55292 > http [ACK] Seq=97 Ack=91682 Win=96512 Len=0 TSval=10563834 TSecr=1683668024
 30   0.011061 54.192.118.224 -> 172.31.8.238 TCP 11650 [TCP segment of a reassembled PDU]
 31   0.011084 172.31.8.238 -> 54.192.118.224 TCP 66 55292 > http [ACK] Seq=97 Ack=103266 Win=98944 Len=0 TSval=10563834 TSecr=1683668024
 32   0.011188 54.192.118.224 -> 172.31.8.238 TCP 17442 [TCP segment of a reassembled PDU]
 33   0.011198 172.31.8.238 -> 54.192.118.224 TCP 66 55292 > http [ACK] Seq=97 Ack=120642 Win=89344 Len=0 TSval=10563834 TSecr=1683668024
 34   0.011782 54.192.118.224 -> 172.31.8.238 TCP 7306 [TCP segment of a reassembled PDU]
 35   0.011789 172.31.8.238 -> 54.192.118.224 TCP 66 55292 > http [ACK] Seq=97 Ack=127882 Win=105984 Len=0 TSval=10563834 TSecr=1683668024
 36   0.011873 54.192.118.224 -> 172.31.8.238 TCP 2962 [TCP segment of a reassembled PDU]
 37   0.011878 172.31.8.238 -> 54.192.118.224 TCP 66 55292 > http [ACK] Seq=97 Ack=130778 Win=103168 Len=0 TSval=10563834 TSecr=1683668024
 38   0.012005 54.192.118.224 -> 172.31.8.238 TCP 21786 [TCP segment of a reassembled PDU]
 39   0.012015 172.31.8.238 -> 54.192.118.224 TCP 66 55292 > http [ACK] Seq=97 Ack=152498 Win=81536 Len=0 TSval=10563835 TSecr=1683668024
 40   0.012557 54.192.118.224 -> 172.31.8.238 TCP 2962 [TCP segment of a reassembled PDU]
 41   0.012563 172.31.8.238 -> 54.192.118.224 TCP 66 55292 > http [ACK] Seq=97 Ack=155394 Win=114816 Len=0 TSval=10563835 TSecr=1683668024
 42   0.012644 54.192.118.224 -> 172.31.8.238 TCP 1514 [TCP segment of a reassembled PDU]
 43   0.012649 172.31.8.238 -> 54.192.118.224 TCP 66 55292 > http [ACK] Seq=97 Ack=156842 Win=117760 Len=0 TSval=10563835 TSecr=1683668024
 44   0.012771 54.192.118.224 -> 172.31.8.238 TCP 26130 [TCP segment of a reassembled PDU]
 45   0.012782 172.31.8.238 -> 54.192.118.224 TCP 66 55292 > http [ACK] Seq=97 Ack=182906 Win=169856 Len=0 TSval=10563835 TSecr=1683668024
 46   0.013381 54.192.118.224 -> 172.31.8.238 TCP 11650 [TCP segment of a reassembled PDU]
 47   0.013389 172.31.8.238 -> 54.192.118.224 TCP 66 55292 > http [ACK] Seq=97 Ack=194490 Win=193024 Len=0 TSval=10563835 TSecr=1683668024
 48   0.013412 54.192.118.224 -> 172.31.8.238 TCP 1514 [TCP segment of a reassembled PDU]
 49   0.013415 172.31.8.238 -> 54.192.118.224 TCP 66 55292 > http [ACK] Seq=97 Ack=195938 Win=195968 Len=0 TSval=10563835 TSecr=1683668024
 50   0.013695 54.192.118.224 -> 172.31.8.238 TCP 18890 [TCP segment of a reassembled PDU]
 51   0.013706 172.31.8.238 -> 54.192.118.224 TCP 66 55292 > http [ACK] Seq=97 Ack=214762 Win=233600 Len=0 TSval=10563835 TSecr=1683668024
 52   0.013724 54.192.118.224 -> 172.31.8.238 TCP 7306 [TCP segment of a reassembled PDU]
 53   0.013729 172.31.8.238 -> 54.192.118.224 TCP 66 55292 > http [ACK] Seq=97 Ack=222002 Win=248064 Len=0 TSval=10563835 TSecr=1683668024
 54   0.013770 54.192.118.224 -> 172.31.8.238 TCP 1514 [TCP segment of a reassembled PDU]
 55   0.013775 172.31.8.238 -> 54.192.118.224 TCP 66 55292 > http [ACK] Seq=97 Ack=223450 Win=251008 Len=0 TSval=10563835 TSecr=1683668024
 56   0.014088 54.192.118.224 -> 172.31.8.238 TCP 2962 [TCP segment of a reassembled PDU]
 57   0.014093 172.31.8.238 -> 54.192.118.224 TCP 66 55292 > http [ACK] Seq=97 Ack=226346 Win=256768 Len=0 TSval=10563835 TSecr=1683668024
 58   0.014266 54.192.118.224 -> 172.31.8.238 TCP 26130 [TCP segment of a reassembled PDU]
 59   0.014280 172.31.8.238 -> 54.192.118.224 TCP 66 55292 > http [ACK] Seq=97 Ack=252410 Win=308864 Len=0 TSval=10563835 TSecr=1683668024
 60   0.014317 54.192.118.224 -> 172.31.8.238 TCP 15994 [TCP segment of a reassembled PDU]
 61   0.014327 172.31.8.238 -> 54.192.118.224 TCP 66 55292 > http [ACK] Seq=97 Ack=268338 Win=340736 Len=0 TSval=10563835 TSecr=1683668024
 62   0.014843 54.192.118.224 -> 172.31.8.238 TCP 1514 [TCP segment of a reassembled PDU]
 63   0.014848 172.31.8.238 -> 54.192.118.224 TCP 66 55292 > http [ACK] Seq=97 Ack=269786 Win=343680 Len=0 TSval=10563835 TSecr=1683668024
 64   0.015022 54.192.118.224 -> 172.31.8.238 TCP 26130 [TCP segment of a reassembled PDU]
 65   0.015035 172.31.8.238 -> 54.192.118.224 TCP 66 55292 > http [ACK] Seq=97 Ack=295850 Win=395776 Len=0 TSval=10563835 TSecr=1683668024
 66   0.015093 54.192.118.224 -> 172.31.8.238 TCP 24682 [TCP segment of a reassembled PDU]
 67   0.015106 172.31.8.238 -> 54.192.118.224 TCP 66 55292 > http [ACK] Seq=97 Ack=320466 Win=445056 Len=0 TSval=10563835 TSecr=1683668024
 68   0.015895 54.192.118.224 -> 172.31.8.238 TCP 1514 [TCP segment of a reassembled PDU]
 69   0.015900 172.31.8.238 -> 54.192.118.224 TCP 66 55292 > http [ACK] Seq=97 Ack=321914 Win=447872 Len=0 TSval=10563836 TSecr=1683668024
 70   0.016039 54.192.118.224 -> 172.31.8.238 TCP 17442 [TCP segment of a reassembled PDU]
 71   0.016047 172.31.8.238 -> 54.192.118.224 TCP 66 55292 > http [ACK] Seq=97 Ack=339290 Win=482688 Len=0 TSval=10563836 TSecr=1683668024
 72   0.016164 54.192.118.224 -> 172.31.8.238 TCP 26130 [TCP segment of a reassembled PDU]
 73   0.016177 172.31.8.238 -> 54.192.118.224 TCP 66 55292 > http [ACK] Seq=97 Ack=365354 Win=534784 Len=0 TSval=10563836 TSecr=1683668024
 74   0.016188 54.192.118.224 -> 172.31.8.238 TCP 11650 [TCP segment of a reassembled PDU]
 75   0.016194 172.31.8.238 -> 54.192.118.224 TCP 66 55292 > http [ACK] Seq=97 Ack=376938 Win=557952 Len=0 TSval=10563836 TSecr=1683668024
 76   0.016651 54.192.118.224 -> 172.31.8.238 TCP 2962 [TCP segment of a reassembled PDU]
 77   0.016657 172.31.8.238 -> 54.192.118.224 TCP 66 55292 > http [ACK] Seq=97 Ack=379834 Win=563712 Len=0 TSval=10563836 TSecr=1683668024
 78   0.016825 54.192.118.224 -> 172.31.8.238 TCP 26130 [TCP segment of a reassembled PDU]
 79   0.016838 172.31.8.238 -> 54.192.118.224 TCP 66 55292 > http [ACK] Seq=97 Ack=405898 Win=615808 Len=0 TSval=10563836 TSecr=1683668024
 80   0.016886 54.192.118.224 -> 172.31.8.238 TCP 20338 [TCP segment of a reassembled PDU]
 81   0.016898 172.31.8.238 -> 54.192.118.224 TCP 66 55292 > http [ACK] Seq=97 Ack=426170 Win=656384 Len=0 TSval=10563836 TSecr=1683668024
 82   0.017422 54.192.118.224 -> 172.31.8.238 TCP 2962 [TCP segment of a reassembled PDU]
 83   0.017427 172.31.8.238 -> 54.192.118.224 TCP 66 55292 > http [ACK] Seq=97 Ack=429066 Win=662144 Len=0 TSval=10563836 TSecr=1683668025
 84   0.017598 54.192.118.224 -> 172.31.8.238 TCP 26130 [TCP segment of a reassembled PDU]
 85   0.017611 172.31.8.238 -> 54.192.118.224 TCP 66 55292 > http [ACK] Seq=97 Ack=455130 Win=714368 Len=0 TSval=10563836 TSecr=1683668025
 86   0.017648 54.192.118.224 -> 172.31.8.238 TCP 15994 [TCP segment of a reassembled PDU]
 87   0.017657 172.31.8.238 -> 54.192.118.224 TCP 66 55292 > http [ACK] Seq=97 Ack=471058 Win=746240 Len=0 TSval=10563836 TSecr=1683668025
 88   0.017935 54.192.118.224 -> 172.31.8.238 TCP 2962 [TCP segment of a reassembled PDU]
 89   0.017941 172.31.8.238 -> 54.192.118.224 TCP 66 55292 > http [ACK] Seq=97 Ack=473954 Win=752000 Len=0 TSval=10563836 TSecr=1683668025
 90   0.018093 54.192.118.224 -> 172.31.8.238 TCP 23234 [TCP segment of a reassembled PDU]
 91   0.018105 172.31.8.238 -> 54.192.118.224 TCP 66 55292 > http [ACK] Seq=97 Ack=497122 Win=798336 Len=0 TSval=10563836 TSecr=1683668025
 92   0.018186 54.192.118.224 -> 172.31.8.238 TCP 2962 [TCP segment of a reassembled PDU]
 93   0.018199 172.31.8.238 -> 54.192.118.224 TCP 66 55292 > http [ACK] Seq=97 Ack=500018 Win=804096 Len=0 TSval=10563836 TSecr=1683668025
 94   0.018352 54.192.118.224 -> 172.31.8.238 TCP 24682 [TCP segment of a reassembled PDU]
 95   0.018365 172.31.8.238 -> 54.192.118.224 TCP 66 55292 > http [ACK] Seq=97 Ack=524634 Win=853376 Len=0 TSval=10563836 TSecr=1683668025
 96   0.018694 54.192.118.224 -> 172.31.8.238 TCP 7306 [TCP segment of a reassembled PDU]
 97   0.018700 172.31.8.238 -> 54.192.118.224 TCP 66 55292 > http [ACK] Seq=97 Ack=531874 Win=867840 Len=0 TSval=10563836 TSecr=1683668025
 98   0.018865 54.192.118.224 -> 172.31.8.238 TCP 26130 [TCP segment of a reassembled PDU]
 99   0.018895 172.31.8.238 -> 54.192.118.224 TCP 66 55292 > http [ACK] Seq=97 Ack=557938 Win=919936 Len=0 TSval=10563836 TSecr=1683668025
100   0.018905 54.192.118.224 -> 172.31.8.238 TCP 7306 [TCP segment of a reassembled PDU]
101   0.018910 172.31.8.238 -> 54.192.118.224 TCP 66 55292 > http [ACK] Seq=97 Ack=565178 Win=934400 Len=0 TSval=10563836 TSecr=1683668025
102   0.019061 54.192.118.224 -> 172.31.8.238 TCP 14546 [TCP segment of a reassembled PDU]
103   0.019070 172.31.8.238 -> 54.192.118.224 TCP 66 55292 > http [ACK] Seq=97 Ack=579658 Win=963328 Len=0 TSval=10563836 TSecr=1683668025
104   0.019124 54.192.118.224 -> 172.31.8.238 TCP 21786 [TCP segment of a reassembled PDU]
105   0.019136 172.31.8.238 -> 54.192.118.224 TCP 66 55292 > http [ACK] Seq=97 Ack=601378 Win=1006848 Len=0 TSval=10563836 TSecr=1683668025
106   0.019537 54.192.118.224 -> 172.31.8.238 TCP 4410 [TCP segment of a reassembled PDU]
107   0.019543 172.31.8.238 -> 54.192.118.224 TCP 66 55292 > http [ACK] Seq=97 Ack=605722 Win=1015552 Len=0 TSval=10563836 TSecr=1683668025
108   0.019717 54.192.118.224 -> 172.31.8.238 TCP 24682 [TCP segment of a reassembled PDU]
109   0.019729 172.31.8.238 -> 54.192.118.224 TCP 66 55292 > http [ACK] Seq=97 Ack=630338 Win=1013760 Len=0 TSval=10563836 TSecr=1683668025
110   0.019836 54.192.118.224 -> 172.31.8.238 TCP 26130 [TCP segment of a reassembled PDU]
111   0.019850 172.31.8.238 -> 54.192.118.224 TCP 66 55292 > http [ACK] Seq=97 Ack=656402 Win=1011456 Len=0 TSval=10563836 TSecr=1683668025
112   0.019934 54.192.118.224 -> 172.31.8.238 TCP 5858 [TCP segment of a reassembled PDU]
113   0.019939 172.31.8.238 -> 54.192.118.224 TCP 66 55292 > http [ACK] Seq=97 Ack=662194 Win=1027072 Len=0 TSval=10563837 TSecr=1683668025
114   0.020302 54.192.118.224 -> 172.31.8.238 TCP 21786 [TCP segment of a reassembled PDU]
115   0.020313 172.31.8.238 -> 54.192.118.224 TCP 66 55292 > http [ACK] Seq=97 Ack=683914 Win=1070592 Len=0 TSval=10563837 TSecr=1683668025
116   0.020416 54.192.118.224 -> 172.31.8.238 TCP 11650 [TCP segment of a reassembled PDU]
117   0.020424 172.31.8.238 -> 54.192.118.224 TCP 66 55292 > http [ACK] Seq=97 Ack=695498 Win=1093760 Len=0 TSval=10563837 TSecr=1683668025
118   0.020536 54.192.118.224 -> 172.31.8.238 TCP 1514 [TCP segment of a reassembled PDU]
119   0.020540 172.31.8.238 -> 54.192.118.224 TCP 66 55292 > http [ACK] Seq=97 Ack=696946 Win=1096576 Len=0 TSval=10563837 TSecr=1683668025
120   0.020704 54.192.118.224 -> 172.31.8.238 TCP 26130 [TCP segment of a reassembled PDU]
121   0.020718 172.31.8.238 -> 54.192.118.224 TCP 66 55292 > http [ACK] Seq=97 Ack=723010 Win=1148672 Len=0 TSval=10563837 TSecr=1683668025
122   0.020768 54.192.118.224 -> 172.31.8.238 TCP 21786 [TCP segment of a reassembled PDU]
123   0.020779 172.31.8.238 -> 54.192.118.224 TCP 66 55292 > http [ACK] Seq=97 Ack=744730 Win=1192192 Len=0 TSval=10563837 TSecr=1683668025
124   0.021037 54.192.118.224 -> 172.31.8.238 TCP 10202 [TCP segment of a reassembled PDU]
125   0.021045 172.31.8.238 -> 54.192.118.224 TCP 66 55292 > http [ACK] Seq=97 Ack=754866 Win=1212416 Len=0 TSval=10563837 TSecr=1683668025
126   0.021158 54.192.118.224 -> 172.31.8.238 TCP 5858 [TCP segment of a reassembled PDU]
127   0.021164 172.31.8.238 -> 54.192.118.224 TCP 66 55292 > http [ACK] Seq=97 Ack=760658 Win=1224064 Len=0 TSval=10563837 TSecr=1683668025
128   0.021423 54.192.118.224 -> 172.31.8.238 TCP 26130 [TCP segment of a reassembled PDU]
129   0.021445 172.31.8.238 -> 54.192.118.224 TCP 66 55292 > http [ACK] Seq=97 Ack=786722 Win=1276160 Len=0 TSval=10563837 TSecr=1683668025
130   0.021498 54.192.118.224 -> 172.31.8.238 TCP 20338 [TCP segment of a reassembled PDU]
131   0.021509 172.31.8.238 -> 54.192.118.224 TCP 66 55292 > http [ACK] Seq=97 Ack=806994 Win=1316736 Len=0 TSval=10563837 TSecr=1683668025
132   0.021568 54.192.118.224 -> 172.31.8.238 TCP 18890 [TCP segment of a reassembled PDU]
133   0.021578 172.31.8.238 -> 54.192.118.224 TCP 66 55292 > http [ACK] Seq=97 Ack=825818 Win=1354368 Len=0 TSval=10563837 TSecr=1683668025
134   0.021817 54.192.118.224 -> 172.31.8.238 TCP 13098 [TCP segment of a reassembled PDU]
135   0.021828 172.31.8.238 -> 54.192.118.224 TCP 66 55292 > http [ACK] Seq=97 Ack=838850 Win=1380352 Len=0 TSval=10563837 TSecr=1683668025
136   0.021976 54.192.118.224 -> 172.31.8.238 TCP 21786 [TCP segment of a reassembled PDU]
137   0.021987 172.31.8.238 -> 54.192.118.224 TCP 66 55292 > http [ACK] Seq=97 Ack=860570 Win=1423872 Len=0 TSval=10563837 TSecr=1683668025
138   0.022063 54.192.118.224 -> 172.31.8.238 TCP 1514 [TCP segment of a reassembled PDU]
139   0.022069 172.31.8.238 -> 54.192.118.224 TCP 66 55292 > http [ACK] Seq=97 Ack=862018 Win=1426688 Len=0 TSval=10563837 TSecr=1683668025
140   0.022229 54.192.118.224 -> 172.31.8.238 TCP 26130 [TCP segment of a reassembled PDU]
141   0.022242 172.31.8.238 -> 54.192.118.224 TCP 66 55292 > http [ACK] Seq=97 Ack=888082 Win=1478912 Len=0 TSval=10563837 TSecr=1683668025
142   0.022249 54.192.118.224 -> 172.31.8.238 TCP 2962 [TCP segment of a reassembled PDU]
143   0.022252 172.31.8.238 -> 54.192.118.224 TCP 66 55292 > http [ACK] Seq=97 Ack=890978 Win=1484672 Len=0 TSval=10563837 TSecr=1683668025
144   0.022468 54.192.118.224 -> 172.31.8.238 TCP 26130 [TCP segment of a reassembled PDU]
145   0.022481 172.31.8.238 -> 54.192.118.224 TCP 66 55292 > http [ACK] Seq=97 Ack=917042 Win=1536768 Len=0 TSval=10563837 TSecr=1683668025
146   0.022510 54.192.118.224 -> 172.31.8.238 TCP 13098 [TCP segment of a reassembled PDU]
147   0.022517 172.31.8.238 -> 54.192.118.224 TCP 66 55292 > http [ACK] Seq=97 Ack=930074 Win=1530624 Len=0 TSval=10563837 TSecr=1683668025
148   0.022571 54.192.118.224 -> 172.31.8.238 TCP 8754 [TCP segment of a reassembled PDU]
149   0.022578 172.31.8.238 -> 54.192.118.224 TCP 66 55292 > http [ACK] Seq=97 Ack=938762 Win=1554176 Len=0 TSval=10563837 TSecr=1683668025
150   0.022699 54.192.118.224 -> 172.31.8.238 TCP 17442 [TCP segment of a reassembled PDU]
151   0.022709 172.31.8.238 -> 54.192.118.224 TCP 66 55292 > http [ACK] Seq=97 Ack=956138 Win=1566208 Len=0 TSval=10563837 TSecr=1683668025
152   0.022918 54.192.118.224 -> 172.31.8.238 TCP 21786 [TCP segment of a reassembled PDU]
153   0.022930 172.31.8.238 -> 54.192.118.224 TCP 66 55292 > http [ACK] Seq=97 Ack=977858 Win=1559168 Len=0 TSval=10563837 TSecr=1683668025
154   0.023055 54.192.118.224 -> 172.31.8.238 TCP 26130 [TCP segment of a reassembled PDU]
155   0.023068 172.31.8.238 -> 54.192.118.224 TCP 66 55292 > http [ACK] Seq=97 Ack=1003922 Win=1552000 Len=0 TSval=10563837 TSecr=1683668025
156   0.023108 54.192.118.224 -> 172.31.8.238 TCP 17442 [TCP segment of a reassembled PDU]
157   0.023118 172.31.8.238 -> 54.192.118.224 TCP 66 55292 > http [ACK] Seq=97 Ack=1021298 Win=1566208 Len=0 TSval=10563837 TSecr=1683668025
158   0.023406 54.192.118.224 -> 172.31.8.238 TCP 18890 [TCP segment of a reassembled PDU]
159   0.023424 54.192.118.224 -> 172.31.8.238 TCP 1514 [TCP segment of a reassembled PDU]
160   0.023433 172.31.8.238 -> 54.192.118.224 TCP 66 55292 > http [ACK] Seq=97 Ack=1041570 Win=1561344 Len=0 TSval=10563837 TSecr=1683668025
161   0.023518 54.192.118.224 -> 172.31.8.238 HTTP 7530 HTTP/1.1 200 OK  (application/octet-stream)
162   0.023525 172.31.8.238 -> 54.192.118.224 TCP 66 55292 > http [ACK] Seq=97 Ack=1049034 Win=1580544 Len=0 TSval=10563837 TSecr=1683668025
163   0.023638 172.31.8.238 -> 54.192.118.224 TCP 66 55292 > http [FIN, ACK] Seq=97 Ack=1049034 Win=1585664 Len=0 TSval=10563837 TSecr=1683668025
164   0.024352 54.192.118.224 -> 172.31.8.238 TCP 66 http > 55292 [FIN, ACK] Seq=1049034 Ack=98 Win=14592 Len=0 TSval=1683668025 TSecr=10563837
165   0.024361 172.31.8.238 -> 54.192.118.224 TCP 66 55292 > http [ACK] Seq=98 Ack=1049035 Win=1585664 Len=0 TSval=10563838 TSecr=1683668025
