[Measurement for 1mb at 06:43:47 20.43.2014] 
Tshark:

  1   0.000000 172.31.8.238 -> 172.31.0.2   DNS 89 Standard query 0x7509  A d3m1c4hwkgedal.cloudfront.net
  2   0.000023 172.31.8.238 -> 172.31.0.2   DNS 89 Standard query 0x3707  AAAA d3m1c4hwkgedal.cloudfront.net
  3   0.000671   172.31.0.2 -> 172.31.8.238 DNS 217 Standard query response 0x7509  A 54.239.132.233 A 54.239.132.250 A 54.192.118.219 A 54.230.117.10 A 54.230.119.71 A 54.230.119.86 A 54.230.119.189 A 54.239.132.98
  4   0.000683   172.31.0.2 -> 172.31.8.238 DNS 174 Standard query response 0x3707 
  5   0.003893 172.31.8.238 -> 54.239.132.233 TCP 74 54612 > http [SYN] Seq=0 Win=26883 Len=0 MSS=8961 SACK_PERM=1 TSval=12363849 TSecr=0 WS=128
  6   0.004562 54.239.132.233 -> 172.31.8.238 TCP 74 http > 54612 [SYN, ACK] Seq=0 Ack=1 Win=14480 Len=0 MSS=1460 SACK_PERM=1 TSval=1685260646 TSecr=12363849 WS=128
  7   0.004576 172.31.8.238 -> 54.239.132.233 TCP 66 54612 > http [ACK] Seq=1 Ack=1 Win=27008 Len=0 TSval=12363849 TSecr=1685260646
  8   0.004611 172.31.8.238 -> 54.239.132.233 HTTP 162 GET /1mb HTTP/1.1 
  9   0.005004 54.239.132.233 -> 172.31.8.238 TCP 66 http > 54612 [ACK] Seq=1 Ack=97 Win=14592 Len=0 TSval=1685260646 TSecr=12363849
 10   0.006679 54.239.132.233 -> 172.31.8.238 TCP 523 [TCP segment of a reassembled PDU]
 11   0.006686 172.31.8.238 -> 54.239.132.233 TCP 66 54612 > http [ACK] Seq=97 Ack=458 Win=28032 Len=0 TSval=12363850 TSecr=1685260647
 12   0.006793 54.239.132.233 -> 172.31.8.238 TCP 13098 [TCP segment of a reassembled PDU]
 13   0.006803 172.31.8.238 -> 54.239.132.233 TCP 66 54612 > http [ACK] Seq=97 Ack=13490 Win=54144 Len=0 TSval=12363850 TSecr=1685260647
 14   0.007489 54.239.132.233 -> 172.31.8.238 TCP 11650 [TCP segment of a reassembled PDU]
 15   0.007498 172.31.8.238 -> 54.239.132.233 TCP 66 54612 > http [ACK] Seq=97 Ack=25074 Win=77312 Len=0 TSval=12363850 TSecr=1685260647
 16   0.007528 54.239.132.233 -> 172.31.8.238 TCP 1514 [TCP segment of a reassembled PDU]
 17   0.007533 172.31.8.238 -> 54.239.132.233 TCP 66 54612 > http [ACK] Seq=97 Ack=26522 Win=80128 Len=0 TSval=12363850 TSecr=1685260647
 18   0.008014 54.239.132.233 -> 172.31.8.238 TCP 4410 [TCP segment of a reassembled PDU]
 19   0.008020 172.31.8.238 -> 54.239.132.233 TCP 66 54612 > http [ACK] Seq=97 Ack=30866 Win=88832 Len=0 TSval=12363850 TSecr=1685260647
 20   0.008125 54.239.132.233 -> 172.31.8.238 TCP 8754 [TCP segment of a reassembled PDU]
 21   0.008132 172.31.8.238 -> 54.239.132.233 TCP 66 54612 > http [ACK] Seq=97 Ack=39554 Win=103680 Len=0 TSval=12363850 TSecr=1685260647
 22   0.008240 54.239.132.233 -> 172.31.8.238 TCP 4410 [TCP segment of a reassembled PDU]
 23   0.008246 172.31.8.238 -> 54.239.132.233 TCP 66 54612 > http [ACK] Seq=97 Ack=43898 Win=109056 Len=0 TSval=12363850 TSecr=1685260647
 24   0.008342 54.239.132.233 -> 172.31.8.238 TCP 2962 [TCP segment of a reassembled PDU]
 25   0.008347 172.31.8.238 -> 54.239.132.233 TCP 66 54612 > http [ACK] Seq=97 Ack=46794 Win=109056 Len=0 TSval=12363850 TSecr=1685260647
 26   0.008773 54.239.132.233 -> 172.31.8.238 TCP 5858 [TCP segment of a reassembled PDU]
 27   0.008779 172.31.8.238 -> 54.239.132.233 TCP 66 54612 > http [ACK] Seq=97 Ack=52586 Win=108416 Len=0 TSval=12363850 TSecr=1685260647
 28   0.008875 54.239.132.233 -> 172.31.8.238 TCP 13098 [TCP segment of a reassembled PDU]
 29   0.008883 172.31.8.238 -> 54.239.132.233 TCP 66 54612 > http [ACK] Seq=97 Ack=65618 Win=96512 Len=0 TSval=12363850 TSecr=1685260647
 30   0.009516 54.239.132.233 -> 172.31.8.238 TCP 2962 [TCP segment of a reassembled PDU]
 31   0.009534 172.31.8.238 -> 54.239.132.233 TCP 66 54612 > http [ACK] Seq=97 Ack=68514 Win=109056 Len=0 TSval=12363850 TSecr=1685260647
 32   0.009644 54.239.132.233 -> 172.31.8.238 TCP 10202 [TCP segment of a reassembled PDU]
 33   0.009665 172.31.8.238 -> 54.239.132.233 TCP 66 54612 > http [ACK] Seq=97 Ack=78650 Win=101248 Len=0 TSval=12363850 TSecr=1685260647
 34   0.009701 54.239.132.233 -> 172.31.8.238 TCP 10202 [TCP segment of a reassembled PDU]
 35   0.009709 172.31.8.238 -> 54.239.132.233 TCP 66 54612 > http [ACK] Seq=97 Ack=88786 Win=101248 Len=0 TSval=12363850 TSecr=1685260647
 36   0.009750 54.239.132.233 -> 172.31.8.238 TCP 2962 [TCP segment of a reassembled PDU]
 37   0.009755 172.31.8.238 -> 54.239.132.233 TCP 66 54612 > http [ACK] Seq=97 Ack=91682 Win=109056 Len=0 TSval=12363851 TSecr=1685260647
 38   0.010354 54.239.132.233 -> 172.31.8.238 TCP 15994 [TCP segment of a reassembled PDU]
 39   0.010364 172.31.8.238 -> 54.239.132.233 TCP 66 54612 > http [ACK] Seq=97 Ack=107610 Win=140928 Len=0 TSval=12363851 TSecr=1685260647
 40   0.010402 54.239.132.233 -> 172.31.8.238 TCP 10202 [TCP segment of a reassembled PDU]
 41   0.010409 172.31.8.238 -> 54.239.132.233 TCP 66 54612 > http [ACK] Seq=97 Ack=117746 Win=161152 Len=0 TSval=12363851 TSecr=1685260647
 42   0.011112 54.239.132.233 -> 172.31.8.238 TCP 23234 [TCP segment of a reassembled PDU]
 43   0.011125 172.31.8.238 -> 54.239.132.233 TCP 66 54612 > http [ACK] Seq=97 Ack=140914 Win=207488 Len=0 TSval=12363851 TSecr=1685260647
 44   0.011130 54.239.132.233 -> 172.31.8.238 TCP 1514 [TCP segment of a reassembled PDU]
 45   0.011133 172.31.8.238 -> 54.239.132.233 TCP 66 54612 > http [ACK] Seq=97 Ack=142362 Win=210432 Len=0 TSval=12363851 TSecr=1685260647
 46   0.011143 54.239.132.233 -> 172.31.8.238 TCP 1514 [TCP segment of a reassembled PDU]
 47   0.011146 172.31.8.238 -> 54.239.132.233 TCP 66 54612 > http [ACK] Seq=97 Ack=143810 Win=213376 Len=0 TSval=12363851 TSecr=1685260647
 48   0.011834 54.239.132.233 -> 172.31.8.238 TCP 5858 [TCP segment of a reassembled PDU]
 49   0.011841 172.31.8.238 -> 54.239.132.233 TCP 66 54612 > http [ACK] Seq=97 Ack=149602 Win=224896 Len=0 TSval=12363851 TSecr=1685260647
 50   0.011957 54.239.132.233 -> 172.31.8.238 TCP 26130 [TCP segment of a reassembled PDU]
 51   0.011970 172.31.8.238 -> 54.239.132.233 TCP 66 54612 > http [ACK] Seq=97 Ack=175666 Win=276992 Len=0 TSval=12363851 TSecr=1685260647
 52   0.011978 54.239.132.233 -> 172.31.8.238 TCP 7306 [TCP segment of a reassembled PDU]
 53   0.011983 172.31.8.238 -> 54.239.132.233 TCP 66 54612 > http [ACK] Seq=97 Ack=182906 Win=291456 Len=0 TSval=12363851 TSecr=1685260647
 54   0.012615 54.239.132.233 -> 172.31.8.238 TCP 5858 [TCP segment of a reassembled PDU]
 55   0.012621 172.31.8.238 -> 54.239.132.233 TCP 66 54612 > http [ACK] Seq=97 Ack=188698 Win=303104 Len=0 TSval=12363851 TSecr=1685260647
 56   0.012760 54.239.132.233 -> 172.31.8.238 TCP 26130 [TCP segment of a reassembled PDU]
 57   0.012773 172.31.8.238 -> 54.239.132.233 TCP 66 54612 > http [ACK] Seq=97 Ack=214762 Win=355200 Len=0 TSval=12363851 TSecr=1685260647
 58   0.012797 54.239.132.233 -> 172.31.8.238 TCP 14546 [TCP segment of a reassembled PDU]
 59   0.012805 172.31.8.238 -> 54.239.132.233 TCP 66 54612 > http [ACK] Seq=97 Ack=229242 Win=384128 Len=0 TSval=12363851 TSecr=1685260647
 60   0.013391 54.239.132.233 -> 172.31.8.238 TCP 20338 [TCP segment of a reassembled PDU]
 61   0.013402 172.31.8.238 -> 54.239.132.233 TCP 66 54612 > http [ACK] Seq=97 Ack=249514 Win=424704 Len=0 TSval=12363851 TSecr=1685260647
 62   0.013522 54.239.132.233 -> 172.31.8.238 TCP 26130 [TCP segment of a reassembled PDU]
 63   0.013535 172.31.8.238 -> 54.239.132.233 TCP 66 54612 > http [ACK] Seq=97 Ack=275578 Win=476800 Len=0 TSval=12363851 TSecr=1685260647
 64   0.013545 54.239.132.233 -> 172.31.8.238 TCP 4410 [TCP segment of a reassembled PDU]
 65   0.013562 172.31.8.238 -> 54.239.132.233 TCP 66 54612 > http [ACK] Seq=97 Ack=279922 Win=485504 Len=0 TSval=12363851 TSecr=1685260647
 66   0.014156 54.239.132.233 -> 172.31.8.238 TCP 14546 [TCP segment of a reassembled PDU]
 67   0.014166 172.31.8.238 -> 54.239.132.233 TCP 66 54612 > http [ACK] Seq=97 Ack=294402 Win=514560 Len=0 TSval=12363852 TSecr=1685260647
 68   0.014273 54.239.132.233 -> 172.31.8.238 TCP 17442 [TCP segment of a reassembled PDU]
 69   0.014283 172.31.8.238 -> 54.239.132.233 TCP 66 54612 > http [ACK] Seq=97 Ack=311778 Win=549248 Len=0 TSval=12363852 TSecr=1685260647
 70   0.014304 54.239.132.233 -> 172.31.8.238 TCP 8754 [TCP segment of a reassembled PDU]
 71   0.014312 172.31.8.238 -> 54.239.132.233 TCP 66 54612 > http [ACK] Seq=97 Ack=320466 Win=566656 Len=0 TSval=12363852 TSecr=1685260647
 72   0.014383 54.239.132.233 -> 172.31.8.238 TCP 14546 [TCP segment of a reassembled PDU]
 73   0.014393 172.31.8.238 -> 54.239.132.233 TCP 66 54612 > http [ACK] Seq=97 Ack=334946 Win=595584 Len=0 TSval=12363852 TSecr=1685260647
 74   0.014862 54.239.132.233 -> 172.31.8.238 TCP 4410 [TCP segment of a reassembled PDU]
 75   0.014868 172.31.8.238 -> 54.239.132.233 TCP 66 54612 > http [ACK] Seq=97 Ack=339290 Win=604288 Len=0 TSval=12363852 TSecr=1685260647
 76   0.015033 54.239.132.233 -> 172.31.8.238 TCP 26130 [TCP segment of a reassembled PDU]
 77   0.015047 172.31.8.238 -> 54.239.132.233 TCP 66 54612 > http [ACK] Seq=97 Ack=365354 Win=656384 Len=0 TSval=12363852 TSecr=1685260647
 78   0.015053 54.239.132.233 -> 172.31.8.238 TCP 4410 [TCP segment of a reassembled PDU]
 79   0.015057 172.31.8.238 -> 54.239.132.233 TCP 66 54612 > http [ACK] Seq=97 Ack=369698 Win=665088 Len=0 TSval=12363852 TSecr=1685260647
 80   0.015189 54.239.132.233 -> 172.31.8.238 TCP 26130 [TCP segment of a reassembled PDU]
 81   0.015201 172.31.8.238 -> 54.239.132.233 TCP 66 54612 > http [ACK] Seq=97 Ack=395762 Win=717184 Len=0 TSval=12363852 TSecr=1685260647
 82   0.015662 54.239.132.233 -> 172.31.8.238 TCP 2962 [TCP segment of a reassembled PDU]
 83   0.015668 172.31.8.238 -> 54.239.132.233 TCP 66 54612 > http [ACK] Seq=97 Ack=398658 Win=723072 Len=0 TSval=12363852 TSecr=1685260648
 84   0.015840 54.239.132.233 -> 172.31.8.238 TCP 26130 [TCP segment of a reassembled PDU]
 85   0.015853 172.31.8.238 -> 54.239.132.233 TCP 66 54612 > http [ACK] Seq=97 Ack=424722 Win=775168 Len=0 TSval=12363852 TSecr=1685260648
 86   0.015914 54.239.132.233 -> 172.31.8.238 TCP 26130 [TCP segment of a reassembled PDU]
 87   0.015928 172.31.8.238 -> 54.239.132.233 TCP 66 54612 > http [ACK] Seq=97 Ack=450786 Win=827264 Len=0 TSval=12363852 TSecr=1685260648
 88   0.015988 54.239.132.233 -> 172.31.8.238 TCP 11650 [TCP segment of a reassembled PDU]
 89   0.015996 172.31.8.238 -> 54.239.132.233 TCP 66 54612 > http [ACK] Seq=97 Ack=462370 Win=850432 Len=0 TSval=12363852 TSecr=1685260648
 90   0.016420 54.239.132.233 -> 172.31.8.238 TCP 2962 [TCP segment of a reassembled PDU]
 91   0.016425 172.31.8.238 -> 54.239.132.233 TCP 66 54612 > http [ACK] Seq=97 Ack=465266 Win=856192 Len=0 TSval=12363852 TSecr=1685260648
 92   0.016596 54.239.132.233 -> 172.31.8.238 TCP 21786 [TCP segment of a reassembled PDU]
 93   0.016607 172.31.8.238 -> 54.239.132.233 TCP 66 54612 > http [ACK] Seq=97 Ack=486986 Win=899712 Len=0 TSval=12363852 TSecr=1685260648
 94   0.016622 54.239.132.233 -> 172.31.8.238 TCP 4410 [TCP segment of a reassembled PDU]
 95   0.016626 172.31.8.238 -> 54.239.132.233 TCP 66 54612 > http [ACK] Seq=97 Ack=491330 Win=908416 Len=0 TSval=12363852 TSecr=1685260648
 96   0.016712 54.239.132.233 -> 172.31.8.238 TCP 26130 [TCP segment of a reassembled PDU]
 97   0.016725 172.31.8.238 -> 54.239.132.233 TCP 66 54612 > http [ACK] Seq=97 Ack=517394 Win=960512 Len=0 TSval=12363852 TSecr=1685260648
 98   0.016777 54.239.132.233 -> 172.31.8.238 TCP 4410 [TCP segment of a reassembled PDU]
 99   0.016782 172.31.8.238 -> 54.239.132.233 TCP 66 54612 > http [ACK] Seq=97 Ack=521738 Win=969216 Len=0 TSval=12363852 TSecr=1685260648
100   0.017265 54.239.132.233 -> 172.31.8.238 TCP 23234 [TCP segment of a reassembled PDU]
101   0.017279 172.31.8.238 -> 54.239.132.233 TCP 66 54612 > http [ACK] Seq=97 Ack=544906 Win=1015552 Len=0 TSval=12363852 TSecr=1685260648
102   0.017367 54.239.132.233 -> 172.31.8.238 TCP 26130 [TCP segment of a reassembled PDU]
103   0.017381 172.31.8.238 -> 54.239.132.233 TCP 66 54612 > http [ACK] Seq=97 Ack=570970 Win=1056512 Len=0 TSval=12363852 TSecr=1685260648
104   0.017524 54.239.132.233 -> 172.31.8.238 TCP 24682 [TCP segment of a reassembled PDU]
105   0.017538 172.31.8.238 -> 54.239.132.233 TCP 66 54612 > http [ACK] Seq=97 Ack=595586 Win=1058816 Len=0 TSval=12363852 TSecr=1685260648
106   0.017963 54.239.132.233 -> 172.31.8.238 TCP 4410 [TCP segment of a reassembled PDU]
107   0.017970 172.31.8.238 -> 54.239.132.233 TCP 66 54612 > http [ACK] Seq=97 Ack=599930 Win=1076352 Len=0 TSval=12363853 TSecr=1685260648
108   0.018142 54.239.132.233 -> 172.31.8.238 TCP 26130 [TCP segment of a reassembled PDU]
109   0.018155 172.31.8.238 -> 54.239.132.233 TCP 66 54612 > http [ACK] Seq=97 Ack=625994 Win=1128448 Len=0 TSval=12363853 TSecr=1685260648
110   0.018231 54.239.132.233 -> 172.31.8.238 TCP 26130 [TCP segment of a reassembled PDU]
111   0.018245 172.31.8.238 -> 54.239.132.233 TCP 66 54612 > http [ACK] Seq=97 Ack=652058 Win=1180544 Len=0 TSval=12363853 TSecr=1685260648
112   0.018308 54.239.132.233 -> 172.31.8.238 TCP 20338 [TCP segment of a reassembled PDU]
113   0.018320 172.31.8.238 -> 54.239.132.233 TCP 66 54612 > http [ACK] Seq=97 Ack=672330 Win=1221120 Len=0 TSval=12363853 TSecr=1685260648
114   0.018758 54.239.132.233 -> 172.31.8.238 TCP 10202 [TCP segment of a reassembled PDU]
115   0.018766 172.31.8.238 -> 54.239.132.233 TCP 66 54612 > http [ACK] Seq=97 Ack=682466 Win=1241344 Len=0 TSval=12363853 TSecr=1685260648
116   0.018922 54.239.132.233 -> 172.31.8.238 TCP 26130 [TCP segment of a reassembled PDU]
117   0.018937 172.31.8.238 -> 54.239.132.233 TCP 66 54612 > http [ACK] Seq=97 Ack=708530 Win=1293568 Len=0 TSval=12363853 TSecr=1685260648
118   0.018996 54.239.132.233 -> 172.31.8.238 TCP 26130 [TCP segment of a reassembled PDU]
119   0.019010 172.31.8.238 -> 54.239.132.233 TCP 66 54612 > http [ACK] Seq=97 Ack=734594 Win=1345664 Len=0 TSval=12363853 TSecr=1685260648
120   0.019045 54.239.132.233 -> 172.31.8.238 TCP 2962 [TCP segment of a reassembled PDU]
121   0.019049 172.31.8.238 -> 54.239.132.233 TCP 66 54612 > http [ACK] Seq=97 Ack=737490 Win=1351424 Len=0 TSval=12363853 TSecr=1685260648
122   0.019345 54.239.132.233 -> 172.31.8.238 TCP 26130 [TCP segment of a reassembled PDU]
123   0.019360 172.31.8.238 -> 54.239.132.233 TCP 66 54612 > http [ACK] Seq=97 Ack=763554 Win=1403520 Len=0 TSval=12363853 TSecr=1685260648
124   0.019371 54.239.132.233 -> 172.31.8.238 TCP 10202 [TCP segment of a reassembled PDU]
125   0.019377 172.31.8.238 -> 54.239.132.233 TCP 66 54612 > http [ACK] Seq=97 Ack=773690 Win=1423872 Len=0 TSval=12363853 TSecr=1685260648
126   0.019661 54.239.132.233 -> 172.31.8.238 TCP 26130 [TCP segment of a reassembled PDU]
127   0.019676 172.31.8.238 -> 54.239.132.233 TCP 66 54612 > http [ACK] Seq=97 Ack=799754 Win=1470976 Len=0 TSval=12363853 TSecr=1685260648
128   0.019683 54.239.132.233 -> 172.31.8.238 TCP 2962 [TCP segment of a reassembled PDU]
129   0.019686 172.31.8.238 -> 54.239.132.233 TCP 66 54612 > http [ACK] Seq=97 Ack=802650 Win=1468160 Len=0 TSval=12363853 TSecr=1685260648
130   0.020098 54.239.132.233 -> 172.31.8.238 TCP 23234 [TCP segment of a reassembled PDU]
131   0.020125 172.31.8.238 -> 54.239.132.233 TCP 66 54612 > http [ACK] Seq=97 Ack=825818 Win=1475712 Len=0 TSval=12363853 TSecr=1685260648
132   0.020234 54.239.132.233 -> 172.31.8.238 TCP 29026 [TCP segment of a reassembled PDU]
133   0.020249 172.31.8.238 -> 54.239.132.233 TCP 66 54612 > http [ACK] Seq=97 Ack=854778 Win=1466112 Len=0 TSval=12363853 TSecr=1685260648
134   0.020262 54.239.132.233 -> 172.31.8.238 TCP 13098 [TCP segment of a reassembled PDU]
135   0.020269 172.31.8.238 -> 54.239.132.233 TCP 66 54612 > http [ACK] Seq=97 Ack=867810 Win=1453184 Len=0 TSval=12363853 TSecr=1685260648
136   0.020414 54.239.132.233 -> 172.31.8.238 TCP 20338 [TCP segment of a reassembled PDU]
137   0.020427 172.31.8.238 -> 54.239.132.233 TCP 66 54612 > http [ACK] Seq=97 Ack=888082 Win=1480448 Len=0 TSval=12363853 TSecr=1685260648
138   0.020448 54.239.132.233 -> 172.31.8.238 TCP 5858 [TCP segment of a reassembled PDU]
139   0.020454 172.31.8.238 -> 54.239.132.233 TCP 66 54612 > http [ACK] Seq=97 Ack=893874 Win=1474688 Len=0 TSval=12363853 TSecr=1685260648
140   0.020516 54.239.132.233 -> 172.31.8.238 TCP 10202 [TCP segment of a reassembled PDU]
141   0.020534 172.31.8.238 -> 54.239.132.233 TCP 66 54612 > http [ACK] Seq=97 Ack=904010 Win=1497088 Len=0 TSval=12363853 TSecr=1685260648
142   0.020951 54.239.132.233 -> 172.31.8.238 TCP 26130 [TCP segment of a reassembled PDU]
143   0.020978 172.31.8.238 -> 54.239.132.233 TCP 66 54612 > http [ACK] Seq=97 Ack=930074 Win=1471104 Len=0 TSval=12363853 TSecr=1685260648
144   0.021025 54.239.132.233 -> 172.31.8.238 TCP 20338 [TCP segment of a reassembled PDU]
145   0.021038 172.31.8.238 -> 54.239.132.233 TCP 66 54612 > http [ACK] Seq=97 Ack=950346 Win=1480448 Len=0 TSval=12363853 TSecr=1685260648
146   0.021201 54.239.132.233 -> 172.31.8.238 TCP 47850 [TCP segment of a reassembled PDU]
147   0.021288 172.31.8.238 -> 54.239.132.233 TCP 66 54612 > http [ACK] Seq=97 Ack=998130 Win=1435136 Len=0 TSval=12363853 TSecr=1685260648
148   0.021552 54.239.132.233 -> 172.31.8.238 TCP 4410 [TCP segment of a reassembled PDU]
149   0.021559 172.31.8.238 -> 54.239.132.233 TCP 66 54612 > http [ACK] Seq=97 Ack=1002474 Win=1506560 Len=0 TSval=12363853 TSecr=1685260648
150   0.021726 54.239.132.233 -> 172.31.8.238 TCP 26130 [TCP segment of a reassembled PDU]
151   0.021753 172.31.8.238 -> 54.239.132.233 TCP 66 54612 > http [ACK] Seq=97 Ack=1028538 Win=1480576 Len=0 TSval=12363854 TSecr=1685260648
152   0.021766 54.239.132.233 -> 172.31.8.238 TCP 13098 [TCP segment of a reassembled PDU]
153   0.021786 172.31.8.238 -> 54.239.132.233 TCP 66 54612 > http [ACK] Seq=97 Ack=1041570 Win=1492352 Len=0 TSval=12363854 TSecr=1685260648
154   0.021846 54.239.132.233 -> 172.31.8.238 HTTP 7530 HTTP/1.1 200 OK  (application/octet-stream)
155   0.021854 172.31.8.238 -> 54.239.132.233 TCP 66 54612 > http [ACK] Seq=97 Ack=1049034 Win=1499520 Len=0 TSval=12363854 TSecr=1685260648
156   0.021989 172.31.8.238 -> 54.239.132.233 TCP 66 54612 > http [FIN, ACK] Seq=97 Ack=1049034 Win=1508480 Len=0 TSval=12363854 TSecr=1685260648
157   0.022542 54.239.132.233 -> 172.31.8.238 TCP 66 http > 54612 [FIN, ACK] Seq=1049034 Ack=98 Win=14592 Len=0 TSval=1685260648 TSecr=12363854
158   0.022549 172.31.8.238 -> 54.239.132.233 TCP 66 54612 > http [ACK] Seq=98 Ack=1049035 Win=1508480 Len=0 TSval=12363854 TSecr=1685260648
