[Measurement for 1mb at 09:44:17 20.44.2014] 
Tshark:

  1   0.000000 06:b0:37:46:8f:13 -> 06:c7:b5:04:b8:d0 ARP 60 Who has 172.31.8.238?  Tell 172.31.0.1
  2   0.000020 06:c7:b5:04:b8:d0 -> 06:b0:37:46:8f:13 ARP 42 172.31.8.238 is at 06:c7:b5:04:b8:d0
  3   1.468960 172.31.8.238 -> 172.31.0.2   DNS 89 Standard query 0x1922  A d3m1c4hwkgedal.cloudfront.net
  4   1.469001 172.31.8.238 -> 172.31.0.2   DNS 89 Standard query 0x3c34  AAAA d3m1c4hwkgedal.cloudfront.net
  5   1.469530   172.31.0.2 -> 172.31.8.238 DNS 217 Standard query response 0x1922  A 54.192.118.219 A 54.192.118.228 A 54.192.118.238 A 54.230.116.82 A 54.230.117.21 A 54.230.117.37 A 54.239.132.74 A 54.239.132.83
  6   1.469618   172.31.0.2 -> 172.31.8.238 DNS 174 Standard query response 0x3c34 
  7   1.472819 172.31.8.238 -> 54.192.118.219 TCP 74 44480 > http [SYN] Seq=0 Win=26883 Len=0 MSS=8961 SACK_PERM=1 TSval=15071362 TSecr=0 WS=128
  8   1.473669 54.192.118.219 -> 172.31.8.238 TCP 74 http > 44480 [SYN, ACK] Seq=0 Ack=1 Win=14480 Len=0 MSS=1460 SACK_PERM=1 TSval=1684591955 TSecr=15071362 WS=128
  9   1.473683 172.31.8.238 -> 54.192.118.219 TCP 66 44480 > http [ACK] Seq=1 Ack=1 Win=27008 Len=0 TSval=15071362 TSecr=1684591955
 10   1.473724 172.31.8.238 -> 54.192.118.219 HTTP 162 GET /1mb HTTP/1.1 
 11   1.474170 54.192.118.219 -> 172.31.8.238 TCP 66 http > 44480 [ACK] Seq=1 Ack=97 Win=14592 Len=0 TSval=1684591955 TSecr=15071362
 12   1.476520 54.192.118.219 -> 172.31.8.238 TCP 523 [TCP segment of a reassembled PDU]
 13   1.476527 172.31.8.238 -> 54.192.118.219 TCP 66 44480 > http [ACK] Seq=97 Ack=458 Win=28032 Len=0 TSval=15071363 TSecr=1684591956
 14   1.476661 54.192.118.219 -> 172.31.8.238 TCP 13098 [TCP segment of a reassembled PDU]
 15   1.476672 172.31.8.238 -> 54.192.118.219 TCP 66 44480 > http [ACK] Seq=97 Ack=13490 Win=54144 Len=0 TSval=15071363 TSecr=1684591956
 16   1.477377 54.192.118.219 -> 172.31.8.238 TCP 13098 [TCP segment of a reassembled PDU]
 17   1.477387 172.31.8.238 -> 54.192.118.219 TCP 66 44480 > http [ACK] Seq=97 Ack=26522 Win=80128 Len=0 TSval=15071363 TSecr=1684591956
 18   1.478118 54.192.118.219 -> 172.31.8.238 TCP 13098 [TCP segment of a reassembled PDU]
 19   1.478128 172.31.8.238 -> 54.192.118.219 TCP 66 44480 > http [ACK] Seq=97 Ack=39554 Win=96512 Len=0 TSval=15071363 TSecr=1684591956
 20   1.478880 54.192.118.219 -> 172.31.8.238 TCP 7306 [TCP segment of a reassembled PDU]
 21   1.478887 172.31.8.238 -> 54.192.118.219 TCP 66 44480 > http [ACK] Seq=97 Ack=46794 Win=105984 Len=0 TSval=15071364 TSecr=1684591956
 22   1.478999 54.192.118.219 -> 172.31.8.238 TCP 13098 [TCP segment of a reassembled PDU]
 23   1.479008 172.31.8.238 -> 54.192.118.219 TCP 66 44480 > http [ACK] Seq=97 Ack=59826 Win=132224 Len=0 TSval=15071364 TSecr=1684591956
 24   1.479356 54.192.118.219 -> 172.31.8.238 TCP 5858 [TCP segment of a reassembled PDU]
 25   1.479363 172.31.8.238 -> 54.192.118.219 TCP 66 44480 > http [ACK] Seq=97 Ack=65618 Win=143872 Len=0 TSval=15071364 TSecr=1684591956
 26   1.479614 54.192.118.219 -> 172.31.8.238 TCP 5858 [TCP segment of a reassembled PDU]
 27   1.479620 172.31.8.238 -> 54.192.118.219 TCP 66 44480 > http [ACK] Seq=97 Ack=71410 Win=155392 Len=0 TSval=15071364 TSecr=1684591956
 28   1.479731 54.192.118.219 -> 172.31.8.238 TCP 7306 [TCP segment of a reassembled PDU]
 29   1.479738 172.31.8.238 -> 54.192.118.219 TCP 66 44480 > http [ACK] Seq=97 Ack=78650 Win=169984 Len=0 TSval=15071364 TSecr=1684591956
 30   1.479876 54.192.118.219 -> 172.31.8.238 TCP 10202 [TCP segment of a reassembled PDU]
 31   1.479884 172.31.8.238 -> 54.192.118.219 TCP 66 44480 > http [ACK] Seq=97 Ack=88786 Win=190208 Len=0 TSval=15071364 TSecr=1684591956
 32   1.479985 54.192.118.219 -> 172.31.8.238 TCP 1514 [TCP segment of a reassembled PDU]
 33   1.479989 172.31.8.238 -> 54.192.118.219 TCP 66 44480 > http [ACK] Seq=97 Ack=90234 Win=193152 Len=0 TSval=15071364 TSecr=1684591956
 34   1.480120 54.192.118.219 -> 172.31.8.238 TCP 1514 [TCP segment of a reassembled PDU]
 35   1.480124 172.31.8.238 -> 54.192.118.219 TCP 66 44480 > http [ACK] Seq=97 Ack=91682 Win=195968 Len=0 TSval=15071364 TSecr=1684591956
 36   1.480422 54.192.118.219 -> 172.31.8.238 TCP 13098 [TCP segment of a reassembled PDU]
 37   1.480431 172.31.8.238 -> 54.192.118.219 TCP 66 44480 > http [ACK] Seq=97 Ack=104714 Win=185856 Len=0 TSval=15071364 TSecr=1684591956
 38   1.480540 54.192.118.219 -> 172.31.8.238 TCP 13098 [TCP segment of a reassembled PDU]
 39   1.480548 172.31.8.238 -> 54.192.118.219 TCP 66 44480 > http [ACK] Seq=97 Ack=117746 Win=185856 Len=0 TSval=15071364 TSecr=1684591956
 40   1.480917 54.192.118.219 -> 172.31.8.238 TCP 5858 [TCP segment of a reassembled PDU]
 41   1.480923 172.31.8.238 -> 54.192.118.219 TCP 66 44480 > http [ACK] Seq=97 Ack=123538 Win=197760 Len=0 TSval=15071364 TSecr=1684591956
 42   1.481041 54.192.118.219 -> 172.31.8.238 TCP 7306 [TCP segment of a reassembled PDU]
 43   1.481048 172.31.8.238 -> 54.192.118.219 TCP 66 44480 > http [ACK] Seq=97 Ack=130778 Win=195328 Len=0 TSval=15071364 TSecr=1684591956
 44   1.481226 54.192.118.219 -> 172.31.8.238 TCP 13098 [TCP segment of a reassembled PDU]
 45   1.481235 172.31.8.238 -> 54.192.118.219 TCP 66 44480 > http [ACK] Seq=97 Ack=143810 Win=182400 Len=0 TSval=15071364 TSecr=1684591956
 46   1.481465 54.192.118.219 -> 172.31.8.238 TCP 13098 [TCP segment of a reassembled PDU]
 47   1.481476 172.31.8.238 -> 54.192.118.219 TCP 66 44480 > http [ACK] Seq=97 Ack=156842 Win=185856 Len=0 TSval=15071364 TSecr=1684591956
 48   1.481921 54.192.118.219 -> 172.31.8.238 TCP 2962 [TCP segment of a reassembled PDU]
 49   1.481926 172.31.8.238 -> 54.192.118.219 TCP 66 44480 > http [ACK] Seq=97 Ack=159738 Win=202496 Len=0 TSval=15071364 TSecr=1684591956
 50   1.482055 54.192.118.219 -> 172.31.8.238 TCP 10202 [TCP segment of a reassembled PDU]
 51   1.482062 172.31.8.238 -> 54.192.118.219 TCP 66 44480 > http [ACK] Seq=97 Ack=169874 Win=192384 Len=0 TSval=15071364 TSecr=1684591956
 52   1.482180 54.192.118.219 -> 172.31.8.238 TCP 13098 [TCP segment of a reassembled PDU]
 53   1.482201 172.31.8.238 -> 54.192.118.219 TCP 66 44480 > http [ACK] Seq=97 Ack=182906 Win=185856 Len=0 TSval=15071364 TSecr=1684591956
 54   1.482245 54.192.118.219 -> 172.31.8.238 TCP 13098 [TCP segment of a reassembled PDU]
 55   1.482253 172.31.8.238 -> 54.192.118.219 TCP 66 44480 > http [ACK] Seq=97 Ack=195938 Win=185856 Len=0 TSval=15071364 TSecr=1684591956
 56   1.482745 54.192.118.219 -> 172.31.8.238 TCP 17442 [TCP segment of a reassembled PDU]
 57   1.482756 172.31.8.238 -> 54.192.118.219 TCP 66 44480 > http [ACK] Seq=97 Ack=213314 Win=178688 Len=0 TSval=15071364 TSecr=1684591956
 58   1.482945 54.192.118.219 -> 172.31.8.238 TCP 10202 [TCP segment of a reassembled PDU]
 59   1.482953 172.31.8.238 -> 54.192.118.219 TCP 66 44480 > http [ACK] Seq=97 Ack=223450 Win=190592 Len=0 TSval=15071365 TSecr=1684591956
 60   1.483090 54.192.118.219 -> 172.31.8.238 TCP 18890 [TCP segment of a reassembled PDU]
 61   1.483101 172.31.8.238 -> 54.192.118.219 TCP 66 44480 > http [ACK] Seq=97 Ack=242274 Win=245248 Len=0 TSval=15071365 TSecr=1684591956
 62   1.483472 54.192.118.219 -> 172.31.8.238 TCP 5858 [TCP segment of a reassembled PDU]
 63   1.483478 172.31.8.238 -> 54.192.118.219 TCP 66 44480 > http [ACK] Seq=97 Ack=248066 Win=256768 Len=0 TSval=15071365 TSecr=1684591956
 64   1.483604 54.192.118.219 -> 172.31.8.238 TCP 24682 [TCP segment of a reassembled PDU]
 65   1.483617 172.31.8.238 -> 54.192.118.219 TCP 66 44480 > http [ACK] Seq=97 Ack=272682 Win=306048 Len=0 TSval=15071365 TSecr=1684591956
 66   1.483791 54.192.118.219 -> 172.31.8.238 TCP 20338 [TCP segment of a reassembled PDU]
 67   1.483801 172.31.8.238 -> 54.192.118.219 TCP 66 44480 > http [ACK] Seq=97 Ack=292954 Win=346624 Len=0 TSval=15071365 TSecr=1684591956
 68   1.484032 54.192.118.219 -> 172.31.8.238 TCP 7306 [TCP segment of a reassembled PDU]
 69   1.484040 172.31.8.238 -> 54.192.118.219 TCP 66 44480 > http [ACK] Seq=97 Ack=300194 Win=361088 Len=0 TSval=15071365 TSecr=1684591956
 70   1.484216 54.192.118.219 -> 172.31.8.238 TCP 8754 [TCP segment of a reassembled PDU]
 71   1.484223 172.31.8.238 -> 54.192.118.219 TCP 66 44480 > http [ACK] Seq=97 Ack=308882 Win=378496 Len=0 TSval=15071365 TSecr=1684591956
 72   1.484369 54.192.118.219 -> 172.31.8.238 TCP 17442 [TCP segment of a reassembled PDU]
 73   1.484380 172.31.8.238 -> 54.192.118.219 TCP 66 44480 > http [ACK] Seq=97 Ack=326258 Win=413184 Len=0 TSval=15071365 TSecr=1684591956
 74   1.484482 54.192.118.219 -> 172.31.8.238 TCP 8754 [TCP segment of a reassembled PDU]
 75   1.484490 172.31.8.238 -> 54.192.118.219 TCP 66 44480 > http [ACK] Seq=97 Ack=334946 Win=430592 Len=0 TSval=15071365 TSecr=1684591956
 76   1.484610 54.192.118.219 -> 172.31.8.238 TCP 13098 [TCP segment of a reassembled PDU]
 77   1.484619 172.31.8.238 -> 54.192.118.219 TCP 66 44480 > http [ACK] Seq=97 Ack=347978 Win=456576 Len=0 TSval=15071365 TSecr=1684591956
 78   1.484992 54.192.118.219 -> 172.31.8.238 TCP 1514 [TCP segment of a reassembled PDU]
 79   1.484997 172.31.8.238 -> 54.192.118.219 TCP 66 44480 > http [ACK] Seq=97 Ack=349426 Win=459520 Len=0 TSval=15071365 TSecr=1684591956
 80   1.485135 54.192.118.219 -> 172.31.8.238 TCP 15994 [TCP segment of a reassembled PDU]
 81   1.485145 172.31.8.238 -> 54.192.118.219 TCP 66 44480 > http [ACK] Seq=97 Ack=365354 Win=491392 Len=0 TSval=15071365 TSecr=1684591956
 82   1.485273 54.192.118.219 -> 172.31.8.238 TCP 20338 [TCP segment of a reassembled PDU]
 83   1.485284 172.31.8.238 -> 54.192.118.219 TCP 66 44480 > http [ACK] Seq=97 Ack=385626 Win=531968 Len=0 TSval=15071365 TSecr=1684591957
 84   1.485581 54.192.118.219 -> 172.31.8.238 TCP 24682 [TCP segment of a reassembled PDU]
 85   1.485594 172.31.8.238 -> 54.192.118.219 TCP 66 44480 > http [ACK] Seq=97 Ack=410242 Win=581120 Len=0 TSval=15071365 TSecr=1684591957
 86   1.485786 54.192.118.219 -> 172.31.8.238 TCP 20338 [TCP segment of a reassembled PDU]
 87   1.485797 172.31.8.238 -> 54.192.118.219 TCP 66 44480 > http [ACK] Seq=97 Ack=430514 Win=621696 Len=0 TSval=15071365 TSecr=1684591957
 88   1.486312 54.192.118.219 -> 172.31.8.238 TCP 20338 [TCP segment of a reassembled PDU]
 89   1.486324 172.31.8.238 -> 54.192.118.219 TCP 66 44480 > http [ACK] Seq=97 Ack=450786 Win=662272 Len=0 TSval=15071365 TSecr=1684591957
 90   1.486463 54.192.118.219 -> 172.31.8.238 TCP 21786 [TCP segment of a reassembled PDU]
 91   1.486475 172.31.8.238 -> 54.192.118.219 TCP 66 44480 > http [ACK] Seq=97 Ack=472506 Win=705664 Len=0 TSval=15071365 TSecr=1684591957
 92   1.486490 54.192.118.219 -> 172.31.8.238 TCP 4410 [TCP segment of a reassembled PDU]
 93   1.486495 172.31.8.238 -> 54.192.118.219 TCP 66 44480 > http [ACK] Seq=97 Ack=476850 Win=714368 Len=0 TSval=15071365 TSecr=1684591957
 94   1.486593 54.192.118.219 -> 172.31.8.238 TCP 18890 [TCP segment of a reassembled PDU]
 95   1.486604 172.31.8.238 -> 54.192.118.219 TCP 66 44480 > http [ACK] Seq=97 Ack=495674 Win=752000 Len=0 TSval=15071365 TSecr=1684591957
 96   1.487106 54.192.118.219 -> 172.31.8.238 TCP 14546 [TCP segment of a reassembled PDU]
 97   1.487117 172.31.8.238 -> 54.192.118.219 TCP 66 44480 > http [ACK] Seq=97 Ack=510154 Win=780928 Len=0 TSval=15071366 TSecr=1684591957
 98   1.487239 54.192.118.219 -> 172.31.8.238 TCP 24682 [TCP segment of a reassembled PDU]
 99   1.487252 172.31.8.238 -> 54.192.118.219 TCP 66 44480 > http [ACK] Seq=97 Ack=534770 Win=830208 Len=0 TSval=15071366 TSecr=1684591957
100   1.487265 54.192.118.219 -> 172.31.8.238 TCP 1514 [TCP segment of a reassembled PDU]
101   1.487270 172.31.8.238 -> 54.192.118.219 TCP 66 44480 > http [ACK] Seq=97 Ack=536218 Win=833152 Len=0 TSval=15071366 TSecr=1684591957
102   1.487364 54.192.118.219 -> 172.31.8.238 TCP 14546 [TCP segment of a reassembled PDU]
103   1.487373 172.31.8.238 -> 54.192.118.219 TCP 66 44480 > http [ACK] Seq=97 Ack=550698 Win=862080 Len=0 TSval=15071366 TSecr=1684591957
104   1.487536 54.192.118.219 -> 172.31.8.238 TCP 10202 [TCP segment of a reassembled PDU]
105   1.487544 172.31.8.238 -> 54.192.118.219 TCP 66 44480 > http [ACK] Seq=97 Ack=560834 Win=882304 Len=0 TSval=15071366 TSecr=1684591957
106   1.488026 54.192.118.219 -> 172.31.8.238 TCP 26130 [TCP segment of a reassembled PDU]
107   1.488040 172.31.8.238 -> 54.192.118.219 TCP 66 44480 > http [ACK] Seq=97 Ack=586898 Win=934528 Len=0 TSval=15071366 TSecr=1684591957
108   1.488147 54.192.118.219 -> 172.31.8.238 TCP 10202 [TCP segment of a reassembled PDU]
109   1.488153 172.31.8.238 -> 54.192.118.219 TCP 66 44480 > http [ACK] Seq=97 Ack=597034 Win=954752 Len=0 TSval=15071366 TSecr=1684591957
110   1.488274 54.192.118.219 -> 172.31.8.238 TCP 29026 [TCP segment of a reassembled PDU]
111   1.488289 172.31.8.238 -> 54.192.118.219 TCP 66 44480 > http [ACK] Seq=97 Ack=625994 Win=1012608 Len=0 TSval=15071366 TSecr=1684591957
112   1.488630 54.192.118.219 -> 172.31.8.238 TCP 11650 [TCP segment of a reassembled PDU]
113   1.488639 172.31.8.238 -> 54.192.118.219 TCP 66 44480 > http [ACK] Seq=97 Ack=637578 Win=1035776 Len=0 TSval=15071366 TSecr=1684591957
114   1.488796 54.192.118.219 -> 172.31.8.238 TCP 26130 [TCP segment of a reassembled PDU]
115   1.488810 172.31.8.238 -> 54.192.118.219 TCP 66 44480 > http [ACK] Seq=97 Ack=663642 Win=1088000 Len=0 TSval=15071366 TSecr=1684591957
116   1.488940 54.192.118.219 -> 172.31.8.238 TCP 27578 [TCP segment of a reassembled PDU]
117   1.488954 172.31.8.238 -> 54.192.118.219 TCP 66 44480 > http [ACK] Seq=97 Ack=691154 Win=1143040 Len=0 TSval=15071366 TSecr=1684591957
118   1.489392 54.192.118.219 -> 172.31.8.238 TCP 11650 [TCP segment of a reassembled PDU]
119   1.489400 172.31.8.238 -> 54.192.118.219 TCP 66 44480 > http [ACK] Seq=97 Ack=702738 Win=1166208 Len=0 TSval=15071366 TSecr=1684591957
120   1.489579 54.192.118.219 -> 172.31.8.238 TCP 23234 [TCP segment of a reassembled PDU]
121   1.489592 172.31.8.238 -> 54.192.118.219 TCP 66 44480 > http [ACK] Seq=97 Ack=725906 Win=1212544 Len=0 TSval=15071366 TSecr=1684591957
122   1.489649 54.192.118.219 -> 172.31.8.238 TCP 26130 [TCP segment of a reassembled PDU]
123   1.489663 172.31.8.238 -> 54.192.118.219 TCP 66 44480 > http [ACK] Seq=97 Ack=751970 Win=1264640 Len=0 TSval=15071366 TSecr=1684591957
124   1.489709 54.192.118.219 -> 172.31.8.238 TCP 4410 [TCP segment of a reassembled PDU]
125   1.489714 172.31.8.238 -> 54.192.118.219 TCP 66 44480 > http [ACK] Seq=97 Ack=756314 Win=1273344 Len=0 TSval=15071366 TSecr=1684591957
126   1.490145 54.192.118.219 -> 172.31.8.238 TCP 10202 [TCP segment of a reassembled PDU]
127   1.490153 172.31.8.238 -> 54.192.118.219 TCP 66 44480 > http [ACK] Seq=97 Ack=766450 Win=1293568 Len=0 TSval=15071366 TSecr=1684591957
128   1.490312 54.192.118.219 -> 172.31.8.238 TCP 26130 [TCP segment of a reassembled PDU]
129   1.490325 172.31.8.238 -> 54.192.118.219 TCP 66 44480 > http [ACK] Seq=97 Ack=792514 Win=1345664 Len=0 TSval=15071366 TSecr=1684591957
130   1.490332 54.192.118.219 -> 172.31.8.238 TCP 2962 [TCP segment of a reassembled PDU]
131   1.490335 172.31.8.238 -> 54.192.118.219 TCP 66 44480 > http [ACK] Seq=97 Ack=795410 Win=1351552 Len=0 TSval=15071366 TSecr=1684591957
132   1.490471 54.192.118.219 -> 172.31.8.238 TCP 8754 [TCP segment of a reassembled PDU]
133   1.490478 172.31.8.238 -> 54.192.118.219 TCP 66 44480 > http [ACK] Seq=97 Ack=804098 Win=1368832 Len=0 TSval=15071366 TSecr=1684591957
134   1.490581 54.192.118.219 -> 172.31.8.238 TCP 17442 [TCP segment of a reassembled PDU]
135   1.490591 172.31.8.238 -> 54.192.118.219 TCP 66 44480 > http [ACK] Seq=97 Ack=821474 Win=1403648 Len=0 TSval=15071366 TSecr=1684591957
136   1.490708 54.192.118.219 -> 172.31.8.238 TCP 15994 [TCP segment of a reassembled PDU]
137   1.490718 172.31.8.238 -> 54.192.118.219 TCP 66 44480 > http [ACK] Seq=97 Ack=837402 Win=1415424 Len=0 TSval=15071366 TSecr=1684591957
138   1.490858 54.192.118.219 -> 172.31.8.238 TCP 26130 [TCP segment of a reassembled PDU]
139   1.490873 172.31.8.238 -> 54.192.118.219 TCP 66 44480 > http [ACK] Seq=97 Ack=863466 Win=1398912 Len=0 TSval=15071367 TSecr=1684591957
140   1.490893 54.192.118.219 -> 172.31.8.238 TCP 15994 [TCP segment of a reassembled PDU]
141   1.490903 172.31.8.238 -> 54.192.118.219 TCP 66 44480 > http [ACK] Seq=97 Ack=879394 Win=1383040 Len=0 TSval=15071367 TSecr=1684591957
142   1.491095 54.192.118.219 -> 172.31.8.238 TCP 7306 [TCP segment of a reassembled PDU]
143   1.491102 172.31.8.238 -> 54.192.118.219 TCP 66 44480 > http [ACK] Seq=97 Ack=886634 Win=1429760 Len=0 TSval=15071367 TSecr=1684591957
144   1.491326 54.192.118.219 -> 172.31.8.238 TCP 26130 [TCP segment of a reassembled PDU]
145   1.491351 172.31.8.238 -> 54.192.118.219 TCP 66 44480 > http [ACK] Seq=97 Ack=912698 Win=1403776 Len=0 TSval=15071367 TSecr=1684591957
146   1.491397 54.192.118.219 -> 172.31.8.238 TCP 13098 [TCP segment of a reassembled PDU]
147   1.491406 172.31.8.238 -> 54.192.118.219 TCP 66 44480 > http [ACK] Seq=97 Ack=925730 Win=1420288 Len=0 TSval=15071367 TSecr=1684591957
148   1.491770 54.192.118.219 -> 172.31.8.238 TCP 26130 [TCP segment of a reassembled PDU]
149   1.491794 172.31.8.238 -> 54.192.118.219 TCP 66 44480 > http [ACK] Seq=97 Ack=951794 Win=1398912 Len=0 TSval=15071367 TSecr=1684591957
