[Measurement for 1mb at 02:43:48 20.43.2014] 
Tshark:

  1   0.000000 172.31.8.238 -> 172.31.0.2   DNS 89 Standard query 0x79c2  A d3m1c4hwkgedal.cloudfront.net
  2   0.000042 172.31.8.238 -> 172.31.0.2   DNS 89 Standard query 0xb285  AAAA d3m1c4hwkgedal.cloudfront.net
  3   0.000693   172.31.0.2 -> 172.31.8.238 DNS 174 Standard query response 0xb285 
  4   0.000704   172.31.0.2 -> 172.31.8.238 DNS 217 Standard query response 0x79c2  A 54.230.118.214 A 54.230.119.189 A 54.192.118.233 A 54.192.118.239 A 54.230.116.98 A 54.230.116.136 A 54.230.117.5 A 54.230.117.86
  5   0.003868 172.31.8.238 -> 54.230.118.214 TCP 74 45586 > http [SYN] Seq=0 Win=26883 Len=0 MSS=8961 SACK_PERM=1 TSval=8763951 TSecr=0 WS=128
  6   0.004485 54.230.118.214 -> 172.31.8.238 TCP 74 http > 45586 [SYN, ACK] Seq=0 Ack=1 Win=14480 Len=0 MSS=1460 SACK_PERM=1 TSval=1683281963 TSecr=8763951 WS=128
  7   0.004499 172.31.8.238 -> 54.230.118.214 TCP 66 45586 > http [ACK] Seq=1 Ack=1 Win=27008 Len=0 TSval=8763951 TSecr=1683281963
  8   0.004539 172.31.8.238 -> 54.230.118.214 HTTP 162 GET /1mb HTTP/1.1 
  9   0.004951 54.230.118.214 -> 172.31.8.238 TCP 66 http > 45586 [ACK] Seq=1 Ack=97 Win=14592 Len=0 TSval=1683281963 TSecr=8763951
 10   0.007257 54.230.118.214 -> 172.31.8.238 TCP 523 [TCP segment of a reassembled PDU]
 11   0.007264 172.31.8.238 -> 54.230.118.214 TCP 66 45586 > http [ACK] Seq=97 Ack=458 Win=28032 Len=0 TSval=8763952 TSecr=1683281964
 12   0.007381 54.230.118.214 -> 172.31.8.238 TCP 13098 [TCP segment of a reassembled PDU]
 13   0.007391 172.31.8.238 -> 54.230.118.214 TCP 66 45586 > http [ACK] Seq=97 Ack=13490 Win=54144 Len=0 TSval=8763952 TSecr=1683281964
 14   0.008056 54.230.118.214 -> 172.31.8.238 TCP 7306 [TCP segment of a reassembled PDU]
 15   0.008064 172.31.8.238 -> 54.230.118.214 TCP 66 45586 > http [ACK] Seq=97 Ack=20730 Win=68608 Len=0 TSval=8763952 TSecr=1683281964
 16   0.008153 54.230.118.214 -> 172.31.8.238 TCP 5858 [TCP segment of a reassembled PDU]
 17   0.008160 172.31.8.238 -> 54.230.118.214 TCP 66 45586 > http [ACK] Seq=97 Ack=26522 Win=80128 Len=0 TSval=8763952 TSecr=1683281964
 18   0.008547 54.230.118.214 -> 172.31.8.238 TCP 4410 [TCP segment of a reassembled PDU]
 19   0.008553 172.31.8.238 -> 54.230.118.214 TCP 66 45586 > http [ACK] Seq=97 Ack=30866 Win=88832 Len=0 TSval=8763952 TSecr=1683281964
 20   0.008664 54.230.118.214 -> 172.31.8.238 TCP 8754 [TCP segment of a reassembled PDU]
 21   0.008671 172.31.8.238 -> 54.230.118.214 TCP 66 45586 > http [ACK] Seq=97 Ack=39554 Win=103680 Len=0 TSval=8763952 TSecr=1683281964
 22   0.008818 54.230.118.214 -> 172.31.8.238 TCP 7306 [TCP segment of a reassembled PDU]
 23   0.008825 172.31.8.238 -> 54.230.118.214 TCP 66 45586 > http [ACK] Seq=97 Ack=46794 Win=105984 Len=0 TSval=8763952 TSecr=1683281964
 24   0.009074 54.230.118.214 -> 172.31.8.238 TCP 5858 [TCP segment of a reassembled PDU]
 25   0.009081 172.31.8.238 -> 54.230.118.214 TCP 66 45586 > http [ACK] Seq=97 Ack=52586 Win=108416 Len=0 TSval=8763953 TSecr=1683281964
 26   0.009311 54.230.118.214 -> 172.31.8.238 TCP 4410 [TCP segment of a reassembled PDU]
 27   0.009317 172.31.8.238 -> 54.230.118.214 TCP 66 45586 > http [ACK] Seq=97 Ack=56930 Win=117760 Len=0 TSval=8763953 TSecr=1683281964
 28   0.009410 54.230.118.214 -> 172.31.8.238 TCP 8754 [TCP segment of a reassembled PDU]
 29   0.009417 172.31.8.238 -> 54.230.118.214 TCP 66 45586 > http [ACK] Seq=97 Ack=65618 Win=135168 Len=0 TSval=8763953 TSecr=1683281964
 30   0.009552 54.230.118.214 -> 172.31.8.238 TCP 1514 [TCP segment of a reassembled PDU]
 31   0.009557 172.31.8.238 -> 54.230.118.214 TCP 66 45586 > http [ACK] Seq=97 Ack=67066 Win=137984 Len=0 TSval=8763953 TSecr=1683281964
 32   0.009661 54.230.118.214 -> 172.31.8.238 TCP 11650 [TCP segment of a reassembled PDU]
 33   0.009670 172.31.8.238 -> 54.230.118.214 TCP 66 45586 > http [ACK] Seq=97 Ack=78650 Win=161152 Len=0 TSval=8763953 TSecr=1683281964
 34   0.010089 54.230.118.214 -> 172.31.8.238 TCP 4410 [TCP segment of a reassembled PDU]
 35   0.010094 172.31.8.238 -> 54.230.118.214 TCP 66 45586 > http [ACK] Seq=97 Ack=82994 Win=169856 Len=0 TSval=8763953 TSecr=1683281964
 36   0.010190 54.230.118.214 -> 172.31.8.238 TCP 8754 [TCP segment of a reassembled PDU]
 37   0.010197 172.31.8.238 -> 54.230.118.214 TCP 66 45586 > http [ACK] Seq=97 Ack=91682 Win=187264 Len=0 TSval=8763953 TSecr=1683281964
 38   0.010330 54.230.118.214 -> 172.31.8.238 TCP 1514 [TCP segment of a reassembled PDU]
 39   0.010334 172.31.8.238 -> 54.230.118.214 TCP 66 45586 > http [ACK] Seq=97 Ack=93130 Win=190208 Len=0 TSval=8763953 TSecr=1683281964
 40   0.010446 54.230.118.214 -> 172.31.8.238 TCP 11650 [TCP segment of a reassembled PDU]
 41   0.010454 172.31.8.238 -> 54.230.118.214 TCP 66 45586 > http [ACK] Seq=97 Ack=104714 Win=213376 Len=0 TSval=8763953 TSecr=1683281964
 42   0.010595 54.230.118.214 -> 172.31.8.238 TCP 4410 [TCP segment of a reassembled PDU]
 43   0.010601 172.31.8.238 -> 54.230.118.214 TCP 66 45586 > http [ACK] Seq=97 Ack=109058 Win=221952 Len=0 TSval=8763953 TSecr=1683281964
 44   0.010695 54.230.118.214 -> 172.31.8.238 TCP 7306 [TCP segment of a reassembled PDU]
 45   0.010702 172.31.8.238 -> 54.230.118.214 TCP 66 45586 > http [ACK] Seq=97 Ack=116298 Win=236544 Len=0 TSval=8763953 TSecr=1683281964
 46   0.010839 54.230.118.214 -> 172.31.8.238 TCP 1514 [TCP segment of a reassembled PDU]
 47   0.010843 172.31.8.238 -> 54.230.118.214 TCP 66 45586 > http [ACK] Seq=97 Ack=117746 Win=239360 Len=0 TSval=8763953 TSecr=1683281964
 48   0.011143 54.230.118.214 -> 172.31.8.238 TCP 7306 [TCP segment of a reassembled PDU]
 49   0.011150 172.31.8.238 -> 54.230.118.214 TCP 66 45586 > http [ACK] Seq=97 Ack=124986 Win=253824 Len=0 TSval=8763953 TSecr=1683281964
 50   0.011257 54.230.118.214 -> 172.31.8.238 TCP 18890 [TCP segment of a reassembled PDU]
 51   0.011268 172.31.8.238 -> 54.230.118.214 TCP 66 45586 > http [ACK] Seq=97 Ack=143810 Win=290432 Len=0 TSval=8763953 TSecr=1683281964
 52   0.011408 54.230.118.214 -> 172.31.8.238 TCP 13098 [TCP segment of a reassembled PDU]
 53   0.011417 172.31.8.238 -> 54.230.118.214 TCP 66 45586 > http [ACK] Seq=97 Ack=156842 Win=277504 Len=0 TSval=8763953 TSecr=1683281964
 54   0.011875 54.230.118.214 -> 172.31.8.238 TCP 5858 [TCP segment of a reassembled PDU]
 55   0.011882 172.31.8.238 -> 54.230.118.214 TCP 66 45586 > http [ACK] Seq=97 Ack=162634 Win=303104 Len=0 TSval=8763953 TSecr=1683281964
 56   0.012057 54.230.118.214 -> 172.31.8.238 TCP 24682 [TCP segment of a reassembled PDU]
 57   0.012071 172.31.8.238 -> 54.230.118.214 TCP 66 45586 > http [ACK] Seq=97 Ack=187250 Win=292992 Len=0 TSval=8763953 TSecr=1683281964
 58   0.012076 54.230.118.214 -> 172.31.8.238 TCP 1514 [TCP segment of a reassembled PDU]
 59   0.012082 172.31.8.238 -> 54.230.118.214 TCP 66 45586 > http [ACK] Seq=97 Ack=188698 Win=291584 Len=0 TSval=8763953 TSecr=1683281964
 60   0.012150 54.230.118.214 -> 172.31.8.238 TCP 14546 [TCP segment of a reassembled PDU]
 61   0.012160 172.31.8.238 -> 54.230.118.214 TCP 66 45586 > http [ACK] Seq=97 Ack=203178 Win=309504 Len=0 TSval=8763953 TSecr=1683281964
 62   0.012462 54.230.118.214 -> 172.31.8.238 TCP 5858 [TCP segment of a reassembled PDU]
 63   0.012468 172.31.8.238 -> 54.230.118.214 TCP 66 45586 > http [ACK] Seq=97 Ack=208970 Win=323840 Len=0 TSval=8763953 TSecr=1683281964
 64   0.012786 54.230.118.214 -> 172.31.8.238 TCP 26130 [TCP segment of a reassembled PDU]
 65   0.012800 172.31.8.238 -> 54.230.118.214 TCP 66 45586 > http [ACK] Seq=97 Ack=235034 Win=297856 Len=0 TSval=8763953 TSecr=1683281964
 66   0.012849 54.230.118.214 -> 172.31.8.238 TCP 20338 [TCP segment of a reassembled PDU]
 67   0.012861 172.31.8.238 -> 54.230.118.214 TCP 66 45586 > http [ACK] Seq=97 Ack=255306 Win=300032 Len=0 TSval=8763953 TSecr=1683281964
 68   0.013213 54.230.118.214 -> 172.31.8.238 TCP 5858 [TCP segment of a reassembled PDU]
 69   0.013220 172.31.8.238 -> 54.230.118.214 TCP 66 45586 > http [ACK] Seq=97 Ack=261098 Win=343680 Len=0 TSval=8763954 TSecr=1683281964
 70   0.013521 54.230.118.214 -> 172.31.8.238 TCP 26130 [TCP segment of a reassembled PDU]
 71   0.013534 172.31.8.238 -> 54.230.118.214 TCP 66 45586 > http [ACK] Seq=97 Ack=287162 Win=395776 Len=0 TSval=8763954 TSecr=1683281964
 72   0.013587 54.230.118.214 -> 172.31.8.238 TCP 24682 [TCP segment of a reassembled PDU]
 73   0.013600 172.31.8.238 -> 54.230.118.214 TCP 66 45586 > http [ACK] Seq=97 Ack=311778 Win=445056 Len=0 TSval=8763954 TSecr=1683281964
 74   0.013738 54.230.118.214 -> 172.31.8.238 TCP 1514 [TCP segment of a reassembled PDU]
 75   0.013742 172.31.8.238 -> 54.230.118.214 TCP 66 45586 > http [ACK] Seq=97 Ack=313226 Win=447872 Len=0 TSval=8763954 TSecr=1683281964
 76   0.014170 54.230.118.214 -> 172.31.8.238 TCP 5858 [TCP segment of a reassembled PDU]
 77   0.014177 172.31.8.238 -> 54.230.118.214 TCP 66 45586 > http [ACK] Seq=97 Ack=319018 Win=459520 Len=0 TSval=8763954 TSecr=1683281964
 78   0.014326 54.230.118.214 -> 172.31.8.238 TCP 26130 [TCP segment of a reassembled PDU]
 79   0.014341 172.31.8.238 -> 54.230.118.214 TCP 66 45586 > http [ACK] Seq=97 Ack=345082 Win=511616 Len=0 TSval=8763954 TSecr=1683281964
 80   0.014411 54.230.118.214 -> 172.31.8.238 TCP 26130 [TCP segment of a reassembled PDU]
 81   0.014425 172.31.8.238 -> 54.230.118.214 TCP 66 45586 > http [ACK] Seq=97 Ack=371146 Win=563712 Len=0 TSval=8763954 TSecr=1683281964
 82   0.014456 54.230.118.214 -> 172.31.8.238 TCP 1514 [TCP segment of a reassembled PDU]
 83   0.014460 172.31.8.238 -> 54.230.118.214 TCP 66 45586 > http [ACK] Seq=97 Ack=372594 Win=566656 Len=0 TSval=8763954 TSecr=1683281964
 84   0.014948 54.230.118.214 -> 172.31.8.238 TCP 4410 [TCP segment of a reassembled PDU]
 85   0.014955 172.31.8.238 -> 54.230.118.214 TCP 66 45586 > http [ACK] Seq=97 Ack=376938 Win=575360 Len=0 TSval=8763954 TSecr=1683281964
 86   0.015113 54.230.118.214 -> 172.31.8.238 TCP 26130 [TCP segment of a reassembled PDU]
 87   0.015128 172.31.8.238 -> 54.230.118.214 TCP 66 45586 > http [ACK] Seq=97 Ack=403002 Win=627456 Len=0 TSval=8763954 TSecr=1683281964
 88   0.015188 54.230.118.214 -> 172.31.8.238 TCP 26130 [TCP segment of a reassembled PDU]
 89   0.015203 172.31.8.238 -> 54.230.118.214 TCP 66 45586 > http [ACK] Seq=97 Ack=429066 Win=679552 Len=0 TSval=8763954 TSecr=1683281964
 90   0.015245 54.230.118.214 -> 172.31.8.238 TCP 8754 [TCP segment of a reassembled PDU]
 91   0.015253 172.31.8.238 -> 54.230.118.214 TCP 66 45586 > http [ACK] Seq=97 Ack=437754 Win=696960 Len=0 TSval=8763954 TSecr=1683281964
 92   0.015488 54.230.118.214 -> 172.31.8.238 TCP 5858 [TCP segment of a reassembled PDU]
 93   0.015495 172.31.8.238 -> 54.230.118.214 TCP 66 45586 > http [ACK] Seq=97 Ack=443546 Win=708480 Len=0 TSval=8763954 TSecr=1683281965
 94   0.015778 54.230.118.214 -> 172.31.8.238 TCP 21786 [TCP segment of a reassembled PDU]
 95   0.015789 172.31.8.238 -> 54.230.118.214 TCP 66 45586 > http [ACK] Seq=97 Ack=465266 Win=752000 Len=0 TSval=8763954 TSecr=1683281965
 96   0.015798 54.230.118.214 -> 172.31.8.238 TCP 2962 [TCP segment of a reassembled PDU]
 97   0.015809 172.31.8.238 -> 54.230.118.214 TCP 66 45586 > http [ACK] Seq=97 Ack=468162 Win=757760 Len=0 TSval=8763954 TSecr=1683281965
 98   0.015953 54.230.118.214 -> 172.31.8.238 TCP 26130 [TCP segment of a reassembled PDU]
 99   0.015968 172.31.8.238 -> 54.230.118.214 TCP 66 45586 > http [ACK] Seq=97 Ack=494226 Win=809856 Len=0 TSval=8763954 TSecr=1683281965
100   0.015980 54.230.118.214 -> 172.31.8.238 TCP 14546 [TCP segment of a reassembled PDU]
101   0.015990 172.31.8.238 -> 54.230.118.214 TCP 66 45586 > http [ACK] Seq=97 Ack=508706 Win=838912 Len=0 TSval=8763954 TSecr=1683281965
102   0.016342 54.230.118.214 -> 172.31.8.238 TCP 18890 [TCP segment of a reassembled PDU]
103   0.016354 172.31.8.238 -> 54.230.118.214 TCP 66 45586 > http [ACK] Seq=97 Ack=527530 Win=876544 Len=0 TSval=8763954 TSecr=1683281965
104   0.016371 54.230.118.214 -> 172.31.8.238 TCP 7306 [TCP segment of a reassembled PDU]
105   0.016376 172.31.8.238 -> 54.230.118.214 TCP 66 45586 > http [ACK] Seq=97 Ack=534770 Win=891008 Len=0 TSval=8763954 TSecr=1683281965
106   0.016428 54.230.118.214 -> 172.31.8.238 TCP 7306 [TCP segment of a reassembled PDU]
107   0.016435 172.31.8.238 -> 54.230.118.214 TCP 66 45586 > http [ACK] Seq=97 Ack=542010 Win=905472 Len=0 TSval=8763954 TSecr=1683281965
108   0.016602 54.230.118.214 -> 172.31.8.238 TCP 26130 [TCP segment of a reassembled PDU]
109   0.016630 172.31.8.238 -> 54.230.118.214 TCP 66 45586 > http [ACK] Seq=97 Ack=568074 Win=957568 Len=0 TSval=8763954 TSecr=1683281965
110   0.016637 54.230.118.214 -> 172.31.8.238 TCP 1514 [TCP segment of a reassembled PDU]
111   0.016639 172.31.8.238 -> 54.230.118.214 TCP 66 45586 > http [ACK] Seq=97 Ack=569522 Win=960512 Len=0 TSval=8763954 TSecr=1683281965
112   0.016642 54.230.118.214 -> 172.31.8.238 TCP 4410 [TCP segment of a reassembled PDU]
113   0.016646 172.31.8.238 -> 54.230.118.214 TCP 66 45586 > http [ACK] Seq=97 Ack=573866 Win=969216 Len=0 TSval=8763954 TSecr=1683281965
114   0.017115 54.230.118.214 -> 172.31.8.238 TCP 26130 [TCP segment of a reassembled PDU]
115   0.017130 172.31.8.238 -> 54.230.118.214 TCP 66 45586 > http [ACK] Seq=97 Ack=599930 Win=1021312 Len=0 TSval=8763955 TSecr=1683281965
116   0.017159 54.230.118.214 -> 172.31.8.238 TCP 10202 [TCP segment of a reassembled PDU]
117   0.017166 172.31.8.238 -> 54.230.118.214 TCP 66 45586 > http [ACK] Seq=97 Ack=610066 Win=1041536 Len=0 TSval=8763955 TSecr=1683281965
118   0.017524 54.230.118.214 -> 172.31.8.238 TCP 5858 [TCP segment of a reassembled PDU]
119   0.017532 172.31.8.238 -> 54.230.118.214 TCP 66 45586 > http [ACK] Seq=97 Ack=615858 Win=1053184 Len=0 TSval=8763955 TSecr=1683281965
120   0.017687 54.230.118.214 -> 172.31.8.238 TCP 20338 [TCP segment of a reassembled PDU]
121   0.017708 172.31.8.238 -> 54.230.118.214 TCP 66 45586 > http [ACK] Seq=97 Ack=636130 Win=1093760 Len=0 TSval=8763955 TSecr=1683281965
122   0.017717 54.230.118.214 -> 172.31.8.238 TCP 2962 [TCP segment of a reassembled PDU]
123   0.017720 172.31.8.238 -> 54.230.118.214 TCP 66 45586 > http [ACK] Seq=97 Ack=639026 Win=1099520 Len=0 TSval=8763955 TSecr=1683281965
124   0.017855 54.230.118.214 -> 172.31.8.238 TCP 18890 [TCP segment of a reassembled PDU]
125   0.017867 172.31.8.238 -> 54.230.118.214 TCP 66 45586 > http [ACK] Seq=97 Ack=657850 Win=1137152 Len=0 TSval=8763955 TSecr=1683281965
126   0.017999 54.230.118.214 -> 172.31.8.238 TCP 26130 [TCP segment of a reassembled PDU]
127   0.018014 172.31.8.238 -> 54.230.118.214 TCP 66 45586 > http [ACK] Seq=97 Ack=683914 Win=1189248 Len=0 TSval=8763955 TSecr=1683281965
128   0.018023 54.230.118.214 -> 172.31.8.238 TCP 7306 [TCP segment of a reassembled PDU]
129   0.018028 172.31.8.238 -> 54.230.118.214 TCP 66 45586 > http [ACK] Seq=97 Ack=691154 Win=1203712 Len=0 TSval=8763955 TSecr=1683281965
130   0.018190 54.230.118.214 -> 172.31.8.238 TCP 13098 [TCP segment of a reassembled PDU]
131   0.018199 172.31.8.238 -> 54.230.118.214 TCP 66 45586 > http [ACK] Seq=97 Ack=704186 Win=1229824 Len=0 TSval=8763955 TSecr=1683281965
132   0.018643 54.230.118.214 -> 172.31.8.238 TCP 26130 [TCP segment of a reassembled PDU]
133   0.018656 172.31.8.238 -> 54.230.118.214 TCP 66 45586 > http [ACK] Seq=97 Ack=730250 Win=1281920 Len=0 TSval=8763955 TSecr=1683281965
134   0.018727 54.230.118.214 -> 172.31.8.238 TCP 26130 [TCP segment of a reassembled PDU]
135   0.018740 172.31.8.238 -> 54.230.118.214 TCP 66 45586 > http [ACK] Seq=97 Ack=756314 Win=1334016 Len=0 TSval=8763955 TSecr=1683281965
136   0.018801 54.230.118.214 -> 172.31.8.238 TCP 13098 [TCP segment of a reassembled PDU]
137   0.018811 172.31.8.238 -> 54.230.118.214 TCP 66 45586 > http [ACK] Seq=97 Ack=769346 Win=1360128 Len=0 TSval=8763955 TSecr=1683281965
138   0.018882 54.230.118.214 -> 172.31.8.238 TCP 18890 [TCP segment of a reassembled PDU]
139   0.018893 172.31.8.238 -> 54.230.118.214 TCP 66 45586 > http [ACK] Seq=97 Ack=788170 Win=1397760 Len=0 TSval=8763955 TSecr=1683281965
140   0.018992 54.230.118.214 -> 172.31.8.238 TCP 18890 [TCP segment of a reassembled PDU]
141   0.019003 172.31.8.238 -> 54.230.118.214 TCP 66 45586 > http [ACK] Seq=97 Ack=806994 Win=1435392 Len=0 TSval=8763955 TSecr=1683281965
142   0.019334 54.230.118.214 -> 172.31.8.238 TCP 13098 [TCP segment of a reassembled PDU]
143   0.019342 172.31.8.238 -> 54.230.118.214 TCP 66 45586 > http [ACK] Seq=97 Ack=820026 Win=1461504 Len=0 TSval=8763955 TSecr=1683281965
144   0.019471 54.230.118.214 -> 172.31.8.238 TCP 14546 [TCP segment of a reassembled PDU]
145   0.019481 172.31.8.238 -> 54.230.118.214 TCP 66 45586 > http [ACK] Seq=97 Ack=834506 Win=1490432 Len=0 TSval=8763955 TSecr=1683281965
146   0.019606 54.230.118.214 -> 172.31.8.238 TCP 26130 [TCP segment of a reassembled PDU]
147   0.019619 172.31.8.238 -> 54.230.118.214 TCP 66 45586 > http [ACK] Seq=97 Ack=860570 Win=1542528 Len=0 TSval=8763955 TSecr=1683281965
148   0.019668 54.230.118.214 -> 172.31.8.238 TCP 26130 [TCP segment of a reassembled PDU]
149   0.019681 172.31.8.238 -> 54.230.118.214 TCP 66 45586 > http [ACK] Seq=97 Ack=886634 Win=1563264 Len=0 TSval=8763955 TSecr=1683281965
150   0.019751 54.230.118.214 -> 172.31.8.238 TCP 13098 [TCP segment of a reassembled PDU]
151   0.019759 172.31.8.238 -> 54.230.118.214 TCP 66 45586 > http [ACK] Seq=97 Ack=899666 Win=1550336 Len=0 TSval=8763955 TSecr=1683281965
152   0.020203 54.230.118.214 -> 172.31.8.238 TCP 26130 [TCP segment of a reassembled PDU]
153   0.020217 172.31.8.238 -> 54.230.118.214 TCP 66 45586 > http [ACK] Seq=97 Ack=925730 Win=1594752 Len=0 TSval=8763955 TSecr=1683281965
154   0.020274 54.230.118.214 -> 172.31.8.238 TCP 21786 [TCP segment of a reassembled PDU]
155   0.020285 172.31.8.238 -> 54.230.118.214 TCP 66 45586 > http [ACK] Seq=97 Ack=947450 Win=1594752 Len=0 TSval=8763955 TSecr=1683281965
156   0.020492 54.230.118.214 -> 172.31.8.238 TCP 26130 [TCP segment of a reassembled PDU]
157   0.020505 172.31.8.238 -> 54.230.118.214 TCP 66 45586 > http [ACK] Seq=97 Ack=973514 Win=1594752 Len=0 TSval=8763955 TSecr=1683281965
158   0.020564 54.230.118.214 -> 172.31.8.238 TCP 26130 [TCP segment of a reassembled PDU]
159   0.020577 172.31.8.238 -> 54.230.118.214 TCP 66 45586 > http [ACK] Seq=97 Ack=999578 Win=1594752 Len=0 TSval=8763955 TSecr=1683281965
160   0.020633 54.230.118.214 -> 172.31.8.238 TCP 17442 [TCP segment of a reassembled PDU]
161   0.020642 172.31.8.238 -> 54.230.118.214 TCP 66 45586 > http [ACK] Seq=97 Ack=1016954 Win=1577472 Len=0 TSval=8763955 TSecr=1683281965
162   0.020921 54.230.118.214 -> 172.31.8.238 TCP 13098 [TCP segment of a reassembled PDU]
163   0.020930 172.31.8.238 -> 54.230.118.214 TCP 66 45586 > http [ACK] Seq=97 Ack=1029986 Win=1594752 Len=0 TSval=8763956 TSecr=1683281965
164   0.021191 54.230.118.214 -> 172.31.8.238 HTTP 19114 HTTP/1.1 200 OK  (application/octet-stream)
165   0.021200 172.31.8.238 -> 54.230.118.214 TCP 66 45586 > http [ACK] Seq=97 Ack=1049034 Win=1594752 Len=0 TSval=8763956 TSecr=1683281965
166   0.021329 172.31.8.238 -> 54.230.118.214 TCP 66 45586 > http [FIN, ACK] Seq=97 Ack=1049034 Win=1594752 Len=0 TSval=8763956 TSecr=1683281965
167   0.021829 54.230.118.214 -> 172.31.8.238 TCP 66 http > 45586 [FIN, ACK] Seq=1049034 Ack=98 Win=14592 Len=0 TSval=1683281965 TSecr=8763956
168   0.021835 172.31.8.238 -> 54.230.118.214 TCP 66 45586 > http [ACK] Seq=98 Ack=1049035 Win=1594752 Len=0 TSval=8763956 TSecr=1683281965
