[Measurement for 1kb at 09:36:09 20.36.2014] 
Tshark:

  1   0.000000 172.31.29.138 -> 172.31.0.2   DNS 89 Standard query 0x8276  A d1xvcg6dfvgaki.cloudfront.net
  2   0.000030 172.31.29.138 -> 172.31.0.2   DNS 89 Standard query 0xb6e1  AAAA d1xvcg6dfvgaki.cloudfront.net
  3   0.000633   172.31.0.2 -> 172.31.29.138 DNS 217 Standard query response 0x8276  A 54.230.159.143 A 54.192.159.77 A 54.230.158.139 A 54.230.158.188 A 54.230.158.205 A 54.230.158.246 A 54.230.159.124 A 54.230.159.141
  4   0.004248   172.31.0.2 -> 172.31.29.138 DNS 170 Standard query response 0xb6e1 
  5   0.011972 172.31.29.138 -> 54.230.159.143 TCP 74 38468 > http [SYN] Seq=0 Win=26883 Len=0 MSS=8961 SACK_PERM=1 TSval=15010588 TSecr=0 WS=128
  6   0.012789 54.230.159.143 -> 172.31.29.138 TCP 74 http > 38468 [SYN, ACK] Seq=0 Ack=1 Win=14480 Len=0 MSS=1460 SACK_PERM=1 TSval=812256758 TSecr=15010588 WS=128
  7   0.012804 172.31.29.138 -> 54.230.159.143 TCP 66 38468 > http [ACK] Seq=1 Ack=1 Win=27008 Len=0 TSval=15010588 TSecr=812256758
  8   0.012849 172.31.29.138 -> 54.230.159.143 HTTP 162 GET /1kb HTTP/1.1 
  9   0.013535 54.230.159.143 -> 172.31.29.138 TCP 66 http > 38468 [ACK] Seq=1 Ack=97 Win=14592 Len=0 TSval=812256758 TSecr=15010588
 10   0.016085 54.230.159.143 -> 172.31.29.138 HTTP 1544 HTTP/1.1 200 OK  (application/octet-stream)
 11   0.016092 172.31.29.138 -> 54.230.159.143 TCP 66 38468 > http [ACK] Seq=97 Ack=1479 Win=29952 Len=0 TSval=15010589 TSecr=812256759
 12   0.016274 172.31.29.138 -> 54.230.159.143 TCP 66 38468 > http [FIN, ACK] Seq=97 Ack=1479 Win=29952 Len=0 TSval=15010589 TSecr=812256759
 13   0.017072 54.230.159.143 -> 172.31.29.138 TCP 66 http > 38468 [FIN, ACK] Seq=1479 Ack=98 Win=14592 Len=0 TSval=812256759 TSecr=15010589
 14   0.017081 172.31.29.138 -> 54.230.159.143 TCP 66 38468 > http [ACK] Seq=98 Ack=1480 Win=29952 Len=0 TSval=15010589 TSecr=812256759
