[Measurement for 1kb at 21:36:09 19.36.2014] 
Tshark:

  1   0.000000 172.31.29.138 -> 172.31.0.2   DNS 89 Standard query 0x9a8f  A d1xvcg6dfvgaki.cloudfront.net
  2   0.000027 172.31.29.138 -> 172.31.0.2   DNS 89 Standard query 0xa82e  AAAA d1xvcg6dfvgaki.cloudfront.net
  3   0.000622   172.31.0.2 -> 172.31.29.138 DNS 217 Standard query response 0x9a8f  A 54.230.156.193 A 54.230.157.230 A 54.230.158.152 A 54.230.158.182 A 54.230.158.217 A 54.230.158.223 A 54.230.158.252 A 54.192.156.109
  4   0.003909   172.31.0.2 -> 172.31.29.138 DNS 170 Standard query response 0xa82e 
  5   0.012022 172.31.29.138 -> 54.230.156.193 TCP 74 38841 > http [SYN] Seq=0 Win=26883 Len=0 MSS=8961 SACK_PERM=1 TSval=4210543 TSecr=0 WS=128
  6   0.013007 54.230.156.193 -> 172.31.29.138 TCP 74 http > 38841 [SYN, ACK] Seq=0 Ack=1 Win=14480 Len=0 MSS=1460 SACK_PERM=1 TSval=807459722 TSecr=4210543 WS=128
  7   0.013021 172.31.29.138 -> 54.230.156.193 TCP 66 38841 > http [ACK] Seq=1 Ack=1 Win=27008 Len=0 TSval=4210543 TSecr=807459722
  8   0.013064 172.31.29.138 -> 54.230.156.193 HTTP 162 GET /1kb HTTP/1.1 
  9   0.013581 54.230.156.193 -> 172.31.29.138 TCP 66 http > 38841 [ACK] Seq=1 Ack=97 Win=14592 Len=0 TSval=807459722 TSecr=4210543
 10   0.017462 54.230.156.193 -> 172.31.29.138 HTTP 1544 HTTP/1.1 200 OK  (application/octet-stream)
 11   0.017469 172.31.29.138 -> 54.230.156.193 TCP 66 38841 > http [ACK] Seq=97 Ack=1479 Win=29952 Len=0 TSval=4210544 TSecr=807459723
 12   0.017636 172.31.29.138 -> 54.230.156.193 TCP 66 38841 > http [FIN, ACK] Seq=97 Ack=1479 Win=29952 Len=0 TSval=4210544 TSecr=807459723
 13   0.018230 54.230.156.193 -> 172.31.29.138 TCP 66 http > 38841 [FIN, ACK] Seq=1479 Ack=98 Win=14592 Len=0 TSval=807459723 TSecr=4210544
 14   0.018238 172.31.29.138 -> 54.230.156.193 TCP 66 38841 > http [ACK] Seq=98 Ack=1480 Win=29952 Len=0 TSval=4210545 TSecr=807459723
