[Measurement for 1kb at 05:36:09 20.36.2014] 
Tshark:

  1   0.000000 06:38:16:87:8c:c2 -> 06:4e:73:56:a6:a6 ARP 60 Who has 172.31.29.138?  Tell 172.31.16.1
  2   0.000021 06:4e:73:56:a6:a6 -> 06:38:16:87:8c:c2 ARP 42 172.31.29.138 is at 06:4e:73:56:a6:a6
  3   0.244073 172.31.29.138 -> 172.31.0.2   DNS 89 Standard query 0xc03b  A d1xvcg6dfvgaki.cloudfront.net
  4   0.244115 172.31.29.138 -> 172.31.0.2   DNS 89 Standard query 0x4872  AAAA d1xvcg6dfvgaki.cloudfront.net
  5   0.244632   172.31.0.2 -> 172.31.29.138 DNS 217 Standard query response 0xc03b  A 54.230.150.151 A 54.230.150.220 A 54.230.151.252 A 54.230.149.229 A 54.230.150.30 A 54.230.150.47 A 54.230.150.54 A 54.230.150.122
  6   0.246964   172.31.0.2 -> 172.31.29.138 DNS 170 Standard query response 0x4872 
  7   0.247950 172.31.29.138 -> 54.230.150.151 TCP 74 59739 > http [SYN] Seq=0 Win=26883 Len=0 MSS=8961 SACK_PERM=1 TSval=11410679 TSecr=0 WS=128
  8   0.249295 54.230.150.151 -> 172.31.29.138 TCP 74 http > 59739 [SYN, ACK] Seq=0 Ack=1 Win=14480 Len=0 MSS=1460 SACK_PERM=1 TSval=444463133 TSecr=11410679 WS=128
  9   0.249309 172.31.29.138 -> 54.230.150.151 TCP 66 59739 > http [ACK] Seq=1 Ack=1 Win=27008 Len=0 TSval=11410679 TSecr=444463133
 10   0.249352 172.31.29.138 -> 54.230.150.151 HTTP 162 GET /1kb HTTP/1.1 
 11   0.251812 54.230.150.151 -> 172.31.29.138 TCP 66 http > 59739 [ACK] Seq=1 Ack=97 Win=14592 Len=0 TSval=444463134 TSecr=11410679
 12   0.254117 54.230.150.151 -> 172.31.29.138 HTTP 1544 HTTP/1.1 200 OK  (application/octet-stream)
 13   0.254125 172.31.29.138 -> 54.230.150.151 TCP 66 59739 > http [ACK] Seq=97 Ack=1479 Win=29952 Len=0 TSval=11410681 TSecr=444463134
 14   0.254280 172.31.29.138 -> 54.230.150.151 TCP 66 59739 > http [FIN, ACK] Seq=97 Ack=1479 Win=29952 Len=0 TSval=11410681 TSecr=444463134
 15   0.255663 54.230.150.151 -> 172.31.29.138 TCP 66 http > 59739 [FIN, ACK] Seq=1479 Ack=98 Win=14592 Len=0 TSval=444463134 TSecr=11410681
 16   0.255671 172.31.29.138 -> 54.230.150.151 TCP 66 59739 > http [ACK] Seq=98 Ack=1480 Win=29952 Len=0 TSval=11410681 TSecr=444463134
