[Measurement for 1kb at 07:36:09 20.36.2014] 
Tshark:

  1   0.000000 06:38:16:87:8c:c2 -> 06:4e:73:56:a6:a6 ARP 60 Who has 172.31.29.138?  Tell 172.31.16.1
  2   0.000021 06:4e:73:56:a6:a6 -> 06:38:16:87:8c:c2 ARP 42 172.31.29.138 is at 06:4e:73:56:a6:a6
  3   0.497013 172.31.29.138 -> 172.31.0.2   DNS 89 Standard query 0x790a  A d1xvcg6dfvgaki.cloudfront.net
  4   0.497043 172.31.29.138 -> 172.31.0.2   DNS 89 Standard query 0x570a  AAAA d1xvcg6dfvgaki.cloudfront.net
  5   0.497735   172.31.0.2 -> 172.31.29.138 DNS 217 Standard query response 0x790a  A 54.230.151.214 A 54.230.151.234 A 54.230.149.71 A 54.230.150.36 A 54.230.150.106 A 54.230.150.107 A 54.230.150.109 A 54.230.150.148
  6   0.499856   172.31.0.2 -> 172.31.29.138 DNS 170 Standard query response 0x570a 
  7   0.500872 172.31.29.138 -> 54.230.151.214 TCP 74 52290 > http [SYN] Seq=0 Win=26883 Len=0 MSS=8961 SACK_PERM=1 TSval=13210638 TSecr=0 WS=128
  8   0.502311 54.230.151.214 -> 172.31.29.138 TCP 74 http > 52290 [SYN, ACK] Seq=0 Ack=1 Win=14480 Len=0 MSS=1460 SACK_PERM=1 TSval=1454777524 TSecr=13210638 WS=128
  9   0.502325 172.31.29.138 -> 54.230.151.214 TCP 66 52290 > http [ACK] Seq=1 Ack=1 Win=27008 Len=0 TSval=13210638 TSecr=1454777524
 10   0.502367 172.31.29.138 -> 54.230.151.214 HTTP 162 GET /1kb HTTP/1.1 
 11   0.503794 54.230.151.214 -> 172.31.29.138 TCP 66 http > 52290 [ACK] Seq=1 Ack=97 Win=14592 Len=0 TSval=1454777525 TSecr=13210638
 12   0.506625 54.230.151.214 -> 172.31.29.138 HTTP 1544 HTTP/1.1 200 OK  (application/octet-stream)
 13   0.506633 172.31.29.138 -> 54.230.151.214 TCP 66 52290 > http [ACK] Seq=97 Ack=1479 Win=29952 Len=0 TSval=13210640 TSecr=1454777525
 14   0.506795 172.31.29.138 -> 54.230.151.214 TCP 66 52290 > http [FIN, ACK] Seq=97 Ack=1479 Win=29952 Len=0 TSval=13210640 TSecr=1454777525
 15   0.508159 54.230.151.214 -> 172.31.29.138 TCP 66 http > 52290 [FIN, ACK] Seq=1479 Ack=98 Win=14592 Len=0 TSval=1454777525 TSecr=13210640
 16   0.508168 172.31.29.138 -> 54.230.151.214 TCP 66 52290 > http [ACK] Seq=98 Ack=1480 Win=29952 Len=0 TSval=13210640 TSecr=1454777525
