[Measurement for 10kb at 17:04:02 16.04.2014] 
Tshark:

  1   0.000000  192.168.1.2 -> 74.125.232.192 TCP 1454 [TCP segment of a reassembled PDU]
  2   0.000023  192.168.1.2 -> 74.125.232.192 TCP 1454 [TCP segment of a reassembled PDU]
  3   0.000036  192.168.1.2 -> 74.125.232.192 TLSv1.2 517 Application Data
  4   0.000446  192.168.1.2 -> 74.125.232.192 TLSv1.2 87 Application Data
  5   0.000680  192.168.1.2 -> 74.125.232.192 TCP 1454 [TCP segment of a reassembled PDU]
  6   0.000702  192.168.1.2 -> 74.125.232.192 TLSv1.2 389 Application Data
  7   0.061033 74.125.232.192 -> 192.168.1.2  TCP 54 443→63044 [ACK] Seq=1 Ack=1401 Win=1373 Len=0
  8   0.067098 74.125.232.192 -> 192.168.1.2  TCP 54 443→63044 [ACK] Seq=1 Ack=2801 Win=1373 Len=0
  9   0.067925 74.125.232.192 -> 192.168.1.2  TCP 54 443→63044 [ACK] Seq=1 Ack=3264 Win=1373 Len=0
 10   0.068526 74.125.232.192 -> 192.168.1.2  TCP 54 443→63044 [ACK] Seq=1 Ack=3297 Win=1373 Len=0
 11   0.068554 74.125.232.192 -> 192.168.1.2  TLSv1.2 87 Application Data
 12   0.070846 74.125.232.192 -> 192.168.1.2  TCP 54 443→63044 [ACK] Seq=34 Ack=5032 Win=1373 Len=0
 13   0.098704  192.168.1.2 -> 74.125.232.192 TCP 54 63044→443 [ACK] Seq=5032 Ack=34 Win=254 Len=0
 14   0.099687 74.125.232.192 -> 192.168.1.2  TLSv1.2 106 Application Data
 15   0.101287 74.125.232.192 -> 192.168.1.2  TLSv1.2 132 Application Data
 16   0.101376  192.168.1.2 -> 74.125.232.192 TCP 54 63044→443 [ACK] Seq=5032 Ack=164 Win=253 Len=0
 17   0.101525 74.125.232.192 -> 192.168.1.2  TLSv1.2 93 Application Data
 18   0.101565 74.125.232.192 -> 192.168.1.2  TLSv1.2 87 Application Data
 19   0.101613  192.168.1.2 -> 74.125.232.192 TCP 54 63044→443 [ACK] Seq=5032 Ack=236 Win=253 Len=0
 20   0.101886  192.168.1.2 -> 74.125.232.192 TLSv1.2 87 Application Data
 21   0.171061 74.125.232.192 -> 192.168.1.2  TCP 54 443→63044 [ACK] Seq=236 Ack=5065 Win=1373 Len=0
 22   0.635147  192.168.1.2 -> 74.125.205.188 SSL 55 Continuation Data
 23   0.675145 74.125.205.188 -> 192.168.1.2  TCP 66 443→63043 [ACK] Seq=1 Ack=2 Win=361 Len=0 SLE=1 SRE=2
 24   1.251018  192.168.1.2 -> 54.230.98.58 TCP 66 63377→80 [SYN] Seq=0 Win=8192 Len=0 MSS=1460 WS=256 SACK_PERM=1
 25   1.287293 54.230.98.58 -> 192.168.1.2  TCP 66 80→63377 [SYN, ACK] Seq=0 Ack=1 Win=14600 Len=0 MSS=1400 SACK_PERM=1 WS=128
 26   1.287505  192.168.1.2 -> 54.230.98.58 TCP 54 63377→80 [ACK] Seq=1 Ack=1 Win=65792 Len=0
 27   1.287897  192.168.1.2 -> 54.230.98.58 HTTP 151 GET /10kb HTTP/1.1 
 28   1.322821 54.230.98.58 -> 192.168.1.2  TCP 54 80→63377 [ACK] Seq=1 Ack=98 Win=14720 Len=0
 29   1.327956 54.230.98.58 -> 192.168.1.2  TCP 1454 [TCP segment of a reassembled PDU]
 30   1.331517 54.230.98.58 -> 192.168.1.2  TCP 1454 [TCP segment of a reassembled PDU]
 31   1.331596  192.168.1.2 -> 54.230.98.58 TCP 54 63377→80 [ACK] Seq=98 Ack=2801 Win=65792 Len=0
 32   1.333623 54.230.98.58 -> 192.168.1.2  TCP 1454 [TCP segment of a reassembled PDU]
 33   1.333662 54.230.98.58 -> 192.168.1.2  TCP 1454 [TCP segment of a reassembled PDU]
 34   1.333704  192.168.1.2 -> 54.230.98.58 TCP 54 63377→80 [ACK] Seq=98 Ack=5601 Win=65792 Len=0
 35   1.333762 54.230.98.58 -> 192.168.1.2  TCP 1454 [TCP segment of a reassembled PDU]
 36   1.333792 54.230.98.58 -> 192.168.1.2  TCP 1454 [TCP segment of a reassembled PDU]
 37   1.333823  192.168.1.2 -> 54.230.98.58 TCP 54 63377→80 [ACK] Seq=98 Ack=8401 Win=65792 Len=0
 38   1.333877 54.230.98.58 -> 192.168.1.2  TCP 1454 [TCP segment of a reassembled PDU]
 39   1.333898 54.230.98.58 -> 192.168.1.2  HTTP 949 HTTP/1.1 200 OK  (application/octet-stream)
 40   1.333916  192.168.1.2 -> 54.230.98.58 TCP 54 63377→80 [ACK] Seq=98 Ack=10696 Win=65792 Len=0
 41   1.334042  192.168.1.2 -> 54.230.98.58 TCP 54 63377→80 [FIN, ACK] Seq=98 Ack=10696 Win=65792 Len=0
 42   1.361441 54.230.98.58 -> 192.168.1.2  TCP 54 80→63377 [FIN, ACK] Seq=10696 Ack=99 Win=14720 Len=0
 43   1.361612  192.168.1.2 -> 54.230.98.58 TCP 54 63377→80 [ACK] Seq=99 Ack=10697 Win=65792 Len=0
