[Measurement for 10mb at 01:30:26 20.30.2014] 
Tshark:

  1   0.000000 172.31.36.109 -> 172.31.0.2   DNS 89 Standard query 0x62fa  A d39wppo36gwqpx.cloudfront.net
  2   0.000026 172.31.36.109 -> 172.31.0.2   DNS 89 Standard query 0xd6eb  AAAA d39wppo36gwqpx.cloudfront.net
  3   0.000529   172.31.0.2 -> 172.31.36.109 DNS 217 Standard query response 0x62fa  A 54.192.30.188 A 54.230.29.243 A 54.230.30.37 A 54.230.30.210 A 54.230.30.213 A 54.230.31.4 A 54.192.29.221 A 54.192.29.226
  4   0.000562   172.31.0.2 -> 172.31.36.109 DNS 170 Standard query response 0xd6eb 
  5   0.003882 172.31.36.109 -> 54.192.30.188 TCP 74 42805 > http [SYN] Seq=0 Win=26883 Len=0 MSS=8961 SACK_PERM=1 TSval=27678321 TSecr=0 WS=128
  6   0.005157 54.192.30.188 -> 172.31.36.109 TCP 74 http > 42805 [SYN, ACK] Seq=0 Ack=1 Win=14480 Len=0 MSS=1460 SACK_PERM=1 TSval=689069125 TSecr=27678321 WS=128
  7   0.005171 172.31.36.109 -> 54.192.30.188 TCP 66 42805 > http [ACK] Seq=1 Ack=1 Win=27008 Len=0 TSval=27678321 TSecr=689069125
  8   0.005208 172.31.36.109 -> 54.192.30.188 HTTP 163 GET /10mb HTTP/1.1 
  9   0.006414 54.192.30.188 -> 172.31.36.109 TCP 66 http > 42805 [ACK] Seq=1 Ack=98 Win=14592 Len=0 TSval=689069125 TSecr=27678321
 10   0.044326 54.192.30.188 -> 172.31.36.109 TCP 1144 [TCP segment of a reassembled PDU]
 11   0.044334 172.31.36.109 -> 54.192.30.188 TCP 66 42805 > http [ACK] Seq=98 Ack=1079 Win=29056 Len=0 TSval=27678331 TSecr=689069129
 12   0.044366 54.192.30.188 -> 172.31.36.109 TCP 13098 [TCP segment of a reassembled PDU]
 13   0.044374 172.31.36.109 -> 54.192.30.188 TCP 66 42805 > http [ACK] Seq=98 Ack=14111 Win=55168 Len=0 TSval=27678331 TSecr=689069129
 14   0.045582 54.192.30.188 -> 172.31.36.109 TCP 13098 [TCP segment of a reassembled PDU]
 15   0.045591 172.31.36.109 -> 54.192.30.188 TCP 66 42805 > http [ACK] Seq=98 Ack=27143 Win=81280 Len=0 TSval=27678331 TSecr=689069129
 16   0.046906 54.192.30.188 -> 172.31.36.109 TCP 13098 [TCP segment of a reassembled PDU]
 17   0.046916 172.31.36.109 -> 54.192.30.188 TCP 66 42805 > http [ACK] Seq=98 Ack=40175 Win=96512 Len=0 TSval=27678331 TSecr=689069129
 18   0.048192 54.192.30.188 -> 172.31.36.109 TCP 13098 [TCP segment of a reassembled PDU]
 19   0.048201 172.31.36.109 -> 54.192.30.188 TCP 66 42805 > http [ACK] Seq=98 Ack=53207 Win=96512 Len=0 TSval=27678332 TSecr=689069129
 20   0.048227 54.192.30.188 -> 172.31.36.109 TCP 7306 [TCP segment of a reassembled PDU]
 21   0.048233 172.31.36.109 -> 54.192.30.188 TCP 66 42805 > http [ACK] Seq=98 Ack=60447 Win=89344 Len=0 TSval=27678332 TSecr=689069129
 22   0.049478 54.192.30.188 -> 172.31.36.109 TCP 18890 [TCP segment of a reassembled PDU]
 23   0.049490 172.31.36.109 -> 54.192.30.188 TCP 66 42805 > http [ACK] Seq=98 Ack=79271 Win=144896 Len=0 TSval=27678332 TSecr=689069130
 24   0.050736 54.192.30.188 -> 172.31.36.109 TCP 18890 [TCP segment of a reassembled PDU]
 25   0.050756 172.31.36.109 -> 54.192.30.188 TCP 66 42805 > http [ACK] Seq=98 Ack=98095 Win=182528 Len=0 TSval=27678332 TSecr=689069130
 26   0.050880 54.192.30.188 -> 172.31.36.109 TCP 4410 [TCP segment of a reassembled PDU]
 27   0.050886 172.31.36.109 -> 54.192.30.188 TCP 66 42805 > http [ACK] Seq=98 Ack=102439 Win=191232 Len=0 TSval=27678332 TSecr=689069130
 28   0.050989 54.192.30.188 -> 172.31.36.109 TCP 1514 [TCP segment of a reassembled PDU]
 29   0.050994 172.31.36.109 -> 54.192.30.188 TCP 66 42805 > http [ACK] Seq=98 Ack=103887 Win=194176 Len=0 TSval=27678332 TSecr=689069130
 30   0.051995 54.192.30.188 -> 172.31.36.109 TCP 18890 [TCP segment of a reassembled PDU]
 31   0.052016 172.31.36.109 -> 54.192.30.188 TCP 66 42805 > http [ACK] Seq=98 Ack=122711 Win=231808 Len=0 TSval=27678333 TSecr=689069130
 32   0.052031 54.192.30.188 -> 172.31.36.109 TCP 1514 [TCP segment of a reassembled PDU]
 33   0.052033 172.31.36.109 -> 54.192.30.188 TCP 66 42805 > http [ACK] Seq=98 Ack=124159 Win=234752 Len=0 TSval=27678333 TSecr=689069130
 34   0.053228 54.192.30.188 -> 172.31.36.109 TCP 6748 [TCP segment of a reassembled PDU]
 35   0.053235 172.31.36.109 -> 54.192.30.188 TCP 66 42805 > http [ACK] Seq=98 Ack=130841 Win=248064 Len=0 TSval=27678333 TSecr=689069130
 36   0.053759 54.192.30.188 -> 172.31.36.109 TCP 1514 [TCP segment of a reassembled PDU]
 37   0.053765 172.31.36.109 -> 54.192.30.188 TCP 66 42805 > http [ACK] Seq=98 Ack=132289 Win=251008 Len=0 TSval=27678333 TSecr=689069130
 38   0.053775 54.192.30.188 -> 172.31.36.109 TCP 5858 [TCP segment of a reassembled PDU]
 39   0.053779 172.31.36.109 -> 54.192.30.188 TCP 66 42805 > http [ACK] Seq=98 Ack=138081 Win=262528 Len=0 TSval=27678333 TSecr=689069130
 40   0.054055 54.192.30.188 -> 172.31.36.109 TCP 15994 [TCP segment of a reassembled PDU]
 41   0.054075 172.31.36.109 -> 54.192.30.188 TCP 66 42805 > http [ACK] Seq=98 Ack=154009 Win=294400 Len=0 TSval=27678333 TSecr=689069130
 42   0.054724 54.192.30.188 -> 172.31.36.109 TCP 2962 [TCP segment of a reassembled PDU]
 43   0.054729 172.31.36.109 -> 54.192.30.188 TCP 66 42805 > http [ACK] Seq=98 Ack=156905 Win=300160 Len=0 TSval=27678333 TSecr=689069130
 44   0.054827 54.192.30.188 -> 172.31.36.109 TCP 5858 [TCP segment of a reassembled PDU]
 45   0.054833 172.31.36.109 -> 54.192.30.188 TCP 66 42805 > http [ACK] Seq=98 Ack=162697 Win=311808 Len=0 TSval=27678333 TSecr=689069130
 46   0.055285 54.192.30.188 -> 172.31.36.109 TCP 10202 [TCP segment of a reassembled PDU]
 47   0.055292 172.31.36.109 -> 54.192.30.188 TCP 66 42805 > http [ACK] Seq=98 Ack=172833 Win=332032 Len=0 TSval=27678333 TSecr=689069130
 48   0.055416 54.192.30.188 -> 172.31.36.109 TCP 11650 [TCP segment of a reassembled PDU]
 49   0.055423 172.31.36.109 -> 54.192.30.188 TCP 66 42805 > http [ACK] Seq=98 Ack=184417 Win=355200 Len=0 TSval=27678334 TSecr=689069130
 50   0.055617 54.192.30.188 -> 172.31.36.109 TCP 5858 [TCP segment of a reassembled PDU]
 51   0.055623 172.31.36.109 -> 54.192.30.188 TCP 66 42805 > http [ACK] Seq=98 Ack=190209 Win=366848 Len=0 TSval=27678334 TSecr=689069130
 52   0.056591 54.192.30.188 -> 172.31.36.109 TCP 18890 [TCP segment of a reassembled PDU]
 53   0.056612 172.31.36.109 -> 54.192.30.188 TCP 66 42805 > http [ACK] Seq=98 Ack=209033 Win=404480 Len=0 TSval=27678334 TSecr=689069130
 54   0.056698 54.192.30.188 -> 172.31.36.109 TCP 2962 [TCP segment of a reassembled PDU]
 55   0.056704 172.31.36.109 -> 54.192.30.188 TCP 66 42805 > http [ACK] Seq=98 Ack=211929 Win=410240 Len=0 TSval=27678334 TSecr=689069130
 56   0.056934 54.192.30.188 -> 172.31.36.109 TCP 1514 [TCP segment of a reassembled PDU]
 57   0.056938 172.31.36.109 -> 54.192.30.188 TCP 66 42805 > http [ACK] Seq=98 Ack=213377 Win=413184 Len=0 TSval=27678334 TSecr=689069130
 58   0.056952 54.192.30.188 -> 172.31.36.109 TCP 14546 [TCP segment of a reassembled PDU]
 59   0.056962 172.31.36.109 -> 54.192.30.188 TCP 66 42805 > http [ACK] Seq=98 Ack=227857 Win=442112 Len=0 TSval=27678334 TSecr=689069130
 60   0.057866 54.192.30.188 -> 172.31.36.109 TCP 8754 [TCP segment of a reassembled PDU]
 61   0.057873 172.31.36.109 -> 54.192.30.188 TCP 66 42805 > http [ACK] Seq=98 Ack=236545 Win=459520 Len=0 TSval=27678334 TSecr=689069130
 62   0.058015 54.192.30.188 -> 172.31.36.109 TCP 17442 [TCP segment of a reassembled PDU]
 63   0.058026 172.31.36.109 -> 54.192.30.188 TCP 66 42805 > http [ACK] Seq=98 Ack=253921 Win=466944 Len=0 TSval=27678334 TSecr=689069130
 64   0.058058 54.192.30.188 -> 172.31.36.109 TCP 5858 [TCP segment of a reassembled PDU]
 65   0.058064 172.31.36.109 -> 54.192.30.188 TCP 66 42805 > http [ACK] Seq=98 Ack=259713 Win=461184 Len=0 TSval=27678334 TSecr=689069130
 66   0.058215 54.192.30.188 -> 172.31.36.109 TCP 2266 [TCP segment of a reassembled PDU]
 67   0.058220 172.31.36.109 -> 54.192.30.188 TCP 66 42805 > http [ACK] Seq=98 Ack=261913 Win=459008 Len=0 TSval=27678334 TSecr=689069130
 68   0.080688 54.192.30.188 -> 172.31.36.109 TCP 1514 [TCP segment of a reassembled PDU]
 69   0.080695 172.31.36.109 -> 54.192.30.188 TCP 66 42805 > http [ACK] Seq=98 Ack=263361 Win=493184 Len=0 TSval=27678340 TSecr=689069133
 70   0.080706 54.192.30.188 -> 172.31.36.109 TCP 11650 [TCP segment of a reassembled PDU]
 71   0.080712 172.31.36.109 -> 54.192.30.188 TCP 66 42805 > http [ACK] Seq=98 Ack=274945 Win=481664 Len=0 TSval=27678340 TSecr=689069133
 72   0.080849 54.192.30.188 -> 172.31.36.109 TCP 4410 [TCP segment of a reassembled PDU]
 73   0.080855 172.31.36.109 -> 54.192.30.188 TCP 66 42805 > http [ACK] Seq=98 Ack=279289 Win=488448 Len=0 TSval=27678340 TSecr=689069133
 74   0.080957 54.192.30.188 -> 172.31.36.109 TCP 15994 [TCP segment of a reassembled PDU]
 75   0.080967 172.31.36.109 -> 54.192.30.188 TCP 66 42805 > http [ACK] Seq=98 Ack=295217 Win=472576 Len=0 TSval=27678340 TSecr=689069133
 76   0.081157 54.192.30.188 -> 172.31.36.109 TCP 4410 [TCP segment of a reassembled PDU]
 77   0.081162 172.31.36.109 -> 54.192.30.188 TCP 66 42805 > http [ACK] Seq=98 Ack=299561 Win=488448 Len=0 TSval=27678340 TSecr=689069133
 78   0.081959 54.192.30.188 -> 172.31.36.109 TCP 7306 [TCP segment of a reassembled PDU]
 79   0.081965 172.31.36.109 -> 54.192.30.188 TCP 66 42805 > http [ACK] Seq=98 Ack=306801 Win=483712 Len=0 TSval=27678340 TSecr=689069133
 80   0.081979 54.192.30.188 -> 172.31.36.109 TCP 11650 [TCP segment of a reassembled PDU]
 81   0.081985 172.31.36.109 -> 54.192.30.188 TCP 66 42805 > http [ACK] Seq=98 Ack=318385 Win=472192 Len=0 TSval=27678340 TSecr=689069133
 82   0.082168 54.192.30.188 -> 172.31.36.109 TCP 9130 [TCP segment of a reassembled PDU]
 83   0.082176 172.31.36.109 -> 54.192.30.188 TCP 66 42805 > http [ACK] Seq=98 Ack=327449 Win=478976 Len=0 TSval=27678340 TSecr=689069133
 84   0.088831 54.192.30.188 -> 172.31.36.109 TCP 1514 [TCP segment of a reassembled PDU]
 85   0.089141 54.192.30.188 -> 172.31.36.109 TCP 17442 [TCP segment of a reassembled PDU]
 86   0.089174 172.31.36.109 -> 54.192.30.188 TCP 66 42805 > http [ACK] Seq=98 Ack=346273 Win=466944 Len=0 TSval=27678342 TSecr=689069133
 87   0.089432 54.192.30.188 -> 172.31.36.109 TCP 7306 [TCP segment of a reassembled PDU]
 88   0.089439 172.31.36.109 -> 54.192.30.188 TCP 66 42805 > http [ACK] Seq=98 Ack=353513 Win=483712 Len=0 TSval=27678342 TSecr=689069133
 89   0.089452 54.192.30.188 -> 172.31.36.109 TCP 18890 [TCP segment of a reassembled PDU]
 90   0.089481 172.31.36.109 -> 54.192.30.188 TCP 66 42805 > http [ACK] Seq=98 Ack=372337 Win=464896 Len=0 TSval=27678342 TSecr=689069134
 91   0.090374 54.192.30.188 -> 172.31.36.109 TCP 2962 [TCP segment of a reassembled PDU]
 92   0.090380 172.31.36.109 -> 54.192.30.188 TCP 66 42805 > http [ACK] Seq=98 Ack=375233 Win=490752 Len=0 TSval=27678342 TSecr=689069134
 93   0.090501 54.192.30.188 -> 172.31.36.109 TCP 8754 [TCP segment of a reassembled PDU]
 94   0.090520 172.31.36.109 -> 54.192.30.188 TCP 66 42805 > http [ACK] Seq=98 Ack=383921 Win=494208 Len=0 TSval=27678342 TSecr=689069134
 95   0.090553 54.192.30.188 -> 172.31.36.109 TCP 1514 [TCP segment of a reassembled PDU]
 96   0.090798 54.192.30.188 -> 172.31.36.109 TCP 37714 [TCP segment of a reassembled PDU]
 97   0.090830 172.31.36.109 -> 54.192.30.188 TCP 66 42805 > http [ACK] Seq=98 Ack=423017 Win=455168 Len=0 TSval=27678342 TSecr=689069134
 98   0.090915 54.192.30.188 -> 172.31.36.109 TCP 10202 [TCP segment of a reassembled PDU]
 99   0.090923 172.31.36.109 -> 54.192.30.188 TCP 66 42805 > http [ACK] Seq=98 Ack=433153 Win=478976 Len=0 TSval=27678342 TSecr=689069134
100   0.092153 54.192.30.188 -> 172.31.36.109 TCP 4410 [TCP segment of a reassembled PDU]
101   0.092159 172.31.36.109 -> 54.192.30.188 TCP 66 42805 > http [ACK] Seq=98 Ack=437497 Win=488448 Len=0 TSval=27678343 TSecr=689069134
102   0.092257 54.192.30.188 -> 172.31.36.109 TCP 17442 [TCP segment of a reassembled PDU]
103   0.092300 172.31.36.109 -> 54.192.30.188 TCP 66 42805 > http [ACK] Seq=98 Ack=454873 Win=471168 Len=0 TSval=27678343 TSecr=689069134
104   0.092589 54.192.30.188 -> 172.31.36.109 TCP 30474 [TCP segment of a reassembled PDU]
105   0.092618 172.31.36.109 -> 54.192.30.188 TCP 66 42805 > http [ACK] Seq=98 Ack=485281 Win=445568 Len=0 TSval=27678343 TSecr=689069134
106   0.092687 54.192.30.188 -> 172.31.36.109 TCP 2962 [TCP segment of a reassembled PDU]
107   0.092692 172.31.36.109 -> 54.192.30.188 TCP 66 42805 > http [ACK] Seq=98 Ack=488177 Win=490752 Len=0 TSval=27678343 TSecr=689069134
108   0.093682 54.192.30.188 -> 172.31.36.109 TCP 5858 [TCP segment of a reassembled PDU]
109   0.093700 172.31.36.109 -> 54.192.30.188 TCP 66 42805 > http [ACK] Seq=98 Ack=493969 Win=494208 Len=0 TSval=27678343 TSecr=689069134
110   0.093827 54.192.30.188 -> 172.31.36.109 TCP 14546 [TCP segment of a reassembled PDU]
111   0.093836 172.31.36.109 -> 54.192.30.188 TCP 66 42805 > http [ACK] Seq=98 Ack=508449 Win=523264 Len=0 TSval=27678343 TSecr=689069134
112   0.094113 54.192.30.188 -> 172.31.36.109 TCP 30474 [TCP segment of a reassembled PDU]
113   0.094137 172.31.36.109 -> 54.192.30.188 TCP 66 42805 > http [ACK] Seq=98 Ack=538857 Win=584064 Len=0 TSval=27678343 TSecr=689069134
114   0.094266 54.192.30.188 -> 172.31.36.109 TCP 14546 [TCP segment of a reassembled PDU]
115   0.094276 172.31.36.109 -> 54.192.30.188 TCP 66 42805 > http [ACK] Seq=98 Ack=553337 Win=612992 Len=0 TSval=27678343 TSecr=689069134
116   0.094381 54.192.30.188 -> 172.31.36.109 TCP 2962 [TCP segment of a reassembled PDU]
117   0.094386 172.31.36.109 -> 54.192.30.188 TCP 66 42805 > http [ACK] Seq=98 Ack=556233 Win=618752 Len=0 TSval=27678343 TSecr=689069134
118   0.094939 54.192.30.188 -> 172.31.36.109 TCP 1514 [TCP segment of a reassembled PDU]
119   0.094944 172.31.36.109 -> 54.192.30.188 TCP 66 42805 > http [ACK] Seq=98 Ack=557681 Win=621696 Len=0 TSval=27678343 TSecr=689069134
120   0.095094 54.192.30.188 -> 172.31.36.109 TCP 18890 [TCP segment of a reassembled PDU]
121   0.095113 172.31.36.109 -> 54.192.30.188 TCP 66 42805 > http [ACK] Seq=98 Ack=576505 Win=659328 Len=0 TSval=27678343 TSecr=689069134
122   0.095205 54.192.30.188 -> 172.31.36.109 TCP 2962 [TCP segment of a reassembled PDU]
123   0.095210 172.31.36.109 -> 54.192.30.188 TCP 66 42805 > http [ACK] Seq=98 Ack=579401 Win=665088 Len=0 TSval=27678343 TSecr=689069134
124   0.095530 54.192.30.188 -> 172.31.36.109 TCP 13098 [TCP segment of a reassembled PDU]
125   0.095539 172.31.36.109 -> 54.192.30.188 TCP 66 42805 > http [ACK] Seq=98 Ack=592433 Win=691200 Len=0 TSval=27678344 TSecr=689069134
126   0.095776 54.192.30.188 -> 172.31.36.109 TCP 23234 [TCP segment of a reassembled PDU]
127   0.095789 172.31.36.109 -> 54.192.30.188 TCP 66 42805 > http [ACK] Seq=98 Ack=615601 Win=737536 Len=0 TSval=27678344 TSecr=689069134
128   0.096451 54.192.30.188 -> 172.31.36.109 TCP 2962 [TCP segment of a reassembled PDU]
129   0.096456 172.31.36.109 -> 54.192.30.188 TCP 66 42805 > http [ACK] Seq=98 Ack=618497 Win=743296 Len=0 TSval=27678344 TSecr=689069134
130   0.096643 54.192.30.188 -> 172.31.36.109 TCP 18890 [TCP segment of a reassembled PDU]
131   0.096664 172.31.36.109 -> 54.192.30.188 TCP 66 42805 > http [ACK] Seq=98 Ack=637321 Win=780928 Len=0 TSval=27678344 TSecr=689069134
132   0.096759 54.192.30.188 -> 172.31.36.109 TCP 4410 [TCP segment of a reassembled PDU]
133   0.096764 172.31.36.109 -> 54.192.30.188 TCP 66 42805 > http [ACK] Seq=98 Ack=641665 Win=789632 Len=0 TSval=27678344 TSecr=689069134
134   0.096887 54.192.30.188 -> 172.31.36.109 TCP 2962 [TCP segment of a reassembled PDU]
135   0.096891 172.31.36.109 -> 54.192.30.188 TCP 66 42805 > http [ACK] Seq=98 Ack=644561 Win=795392 Len=0 TSval=27678344 TSecr=689069134
136   0.096907 54.192.30.188 -> 172.31.36.109 TCP 18890 [TCP segment of a reassembled PDU]
137   0.096918 172.31.36.109 -> 54.192.30.188 TCP 66 42805 > http [ACK] Seq=98 Ack=663385 Win=833024 Len=0 TSval=27678344 TSecr=689069134
138   0.096964 54.192.30.188 -> 172.31.36.109 TCP 2962 [TCP segment of a reassembled PDU]
139   0.096969 172.31.36.109 -> 54.192.30.188 TCP 66 42805 > http [ACK] Seq=98 Ack=666281 Win=838912 Len=0 TSval=27678344 TSecr=689069134
140   0.097106 54.192.30.188 -> 172.31.36.109 TCP 11650 [TCP segment of a reassembled PDU]
141   0.097113 172.31.36.109 -> 54.192.30.188 TCP 66 42805 > http [ACK] Seq=98 Ack=677865 Win=862080 Len=0 TSval=27678344 TSecr=689069134
142   0.098018 54.192.30.188 -> 172.31.36.109 TCP 4410 [TCP segment of a reassembled PDU]
143   0.098024 172.31.36.109 -> 54.192.30.188 TCP 66 42805 > http [ACK] Seq=98 Ack=682209 Win=870784 Len=0 TSval=27678344 TSecr=689069134
144   0.098196 54.192.30.188 -> 172.31.36.109 TCP 18890 [TCP segment of a reassembled PDU]
145   0.098207 172.31.36.109 -> 54.192.30.188 TCP 66 42805 > http [ACK] Seq=98 Ack=701033 Win=908416 Len=0 TSval=27678344 TSecr=689069134
146   0.098279 54.192.30.188 -> 172.31.36.109 TCP 11650 [TCP segment of a reassembled PDU]
147   0.098288 172.31.36.109 -> 54.192.30.188 TCP 66 42805 > http [ACK] Seq=98 Ack=712617 Win=927104 Len=0 TSval=27678344 TSecr=689069134
148   0.098430 54.192.30.188 -> 172.31.36.109 TCP 21786 [TCP segment of a reassembled PDU]
149   0.098538 172.31.36.109 -> 54.192.30.188 TCP 66 42805 > http [ACK] Seq=98 Ack=734337 Win=910336 Len=0 TSval=27678344 TSecr=689069134
150   0.098554 54.192.30.188 -> 172.31.36.109 TCP 7306 [TCP segment of a reassembled PDU]
151   0.098573 172.31.36.109 -> 54.192.30.188 TCP 66 42805 > http [ACK] Seq=98 Ack=741577 Win=931584 Len=0 TSval=27678344 TSecr=689069134
152   0.098686 54.192.30.188 -> 172.31.36.109 TCP 21786 [TCP segment of a reassembled PDU]
153   0.098709 54.192.30.188 -> 172.31.36.109 TCP 2962 [TCP segment of a reassembled PDU]
154   0.098719 172.31.36.109 -> 54.192.30.188 TCP 66 42805 > http [ACK] Seq=98 Ack=766193 Win=907008 Len=0 TSval=27678344 TSecr=689069134
155   0.098884 54.192.30.188 -> 172.31.36.109 TCP 8754 [TCP segment of a reassembled PDU]
156   0.098891 172.31.36.109 -> 54.192.30.188 TCP 66 42805 > http [ACK] Seq=98 Ack=774881 Win=931840 Len=0 TSval=27678344 TSecr=689069134
157   0.099534 54.192.30.188 -> 172.31.36.109 TCP 1514 [TCP segment of a reassembled PDU]
158   0.099710 54.192.30.188 -> 172.31.36.109 TCP 9938 [TCP segment of a reassembled PDU]
159   0.099734 172.31.36.109 -> 54.192.30.188 TCP 66 42805 > http [ACK] Seq=98 Ack=786201 Win=946176 Len=0 TSval=27678345 TSecr=689069135
160   0.140203 54.192.30.188 -> 172.31.36.109 TCP 14546 [TCP segment of a reassembled PDU]
161   0.140239 54.192.30.188 -> 172.31.36.109 TCP 24682 [TCP segment of a reassembled PDU]
162   0.140275 54.192.30.188 -> 172.31.36.109 TCP 1514 [TCP segment of a reassembled PDU]
163   0.140295 54.192.30.188 -> 172.31.36.109 TCP 7306 [TCP segment of a reassembled PDU]
164   0.140303 172.31.36.109 -> 54.192.30.188 TCP 66 42805 > http [ACK] Seq=98 Ack=826745 Win=905728 Len=0 TSval=27678355 TSecr=689069139
165   0.140321 172.31.36.109 -> 54.192.30.188 TCP 66 42805 > http [ACK] Seq=98 Ack=833985 Win=898560 Len=0 TSval=27678355 TSecr=689069139
166   0.140348 54.192.30.188 -> 172.31.36.109 TCP 4410 [TCP segment of a reassembled PDU]
167   0.140353 172.31.36.109 -> 54.192.30.188 TCP 66 42805 > http [ACK] Seq=98 Ack=838329 Win=938880 Len=0 TSval=27678355 TSecr=689069139
168   0.140500 54.192.30.188 -> 172.31.36.109 TCP 10202 [TCP segment of a reassembled PDU]
169   0.140517 54.192.30.188 -> 172.31.36.109 TCP 14546 [TCP segment of a reassembled PDU]
170   0.140583 172.31.36.109 -> 54.192.30.188 TCP 66 42805 > http [ACK] Seq=98 Ack=862945 Win=922240 Len=0 TSval=27678355 TSecr=689069139
171   0.140690 54.192.30.188 -> 172.31.36.109 TCP 7306 [TCP segment of a reassembled PDU]
172   0.140698 172.31.36.109 -> 54.192.30.188 TCP 66 42805 > http [ACK] Seq=98 Ack=870185 Win=934144 Len=0 TSval=27678355 TSecr=689069139
173   0.141402 54.192.30.188 -> 172.31.36.109 TCP 2962 [TCP segment of a reassembled PDU]
174   0.141407 172.31.36.109 -> 54.192.30.188 TCP 66 42805 > http [ACK] Seq=98 Ack=873081 Win=941312 Len=0 TSval=27678355 TSecr=689069139
175   0.141554 54.192.30.188 -> 172.31.36.109 TCP 11650 [TCP segment of a reassembled PDU]
176   0.141574 172.31.36.109 -> 54.192.30.188 TCP 66 42805 > http [ACK] Seq=98 Ack=884665 Win=946176 Len=0 TSval=27678355 TSecr=689069139
177   0.141679 54.192.30.188 -> 172.31.36.109 TCP 14546 [TCP segment of a reassembled PDU]
178   0.141700 172.31.36.109 -> 54.192.30.188 TCP 66 42805 > http [ACK] Seq=98 Ack=899145 Win=946176 Len=0 TSval=27678355 TSecr=689069139
179   0.142025 54.192.30.188 -> 172.31.36.109 TCP 18194 [TCP segment of a reassembled PDU]
180   0.142050 172.31.36.109 -> 54.192.30.188 TCP 66 42805 > http [ACK] Seq=98 Ack=917273 Win=928128 Len=0 TSval=27678355 TSecr=689069139
181   0.172159 54.192.30.188 -> 172.31.36.109 TCP 1514 [TCP segment of a reassembled PDU]
182   0.172172 54.192.30.188 -> 172.31.36.109 TCP 8754 [TCP segment of a reassembled PDU]
183   0.172177 172.31.36.109 -> 54.192.30.188 TCP 66 42805 > http [ACK] Seq=98 Ack=927409 Win=929408 Len=0 TSval=27678363 TSecr=689069142
184   0.172498 54.192.30.188 -> 172.31.36.109 TCP 13098 [TCP segment of a reassembled PDU]
185   0.172520 172.31.36.109 -> 54.192.30.188 TCP 66 42805 > http [ACK] Seq=98 Ack=940441 Win=946176 Len=0 TSval=27678363 TSecr=689069142
186   0.172729 54.192.30.188 -> 172.31.36.109 TCP 5858 [TCP segment of a reassembled PDU]
187   0.172743 172.31.36.109 -> 54.192.30.188 TCP 66 42805 > http [ACK] Seq=98 Ack=946233 Win=946176 Len=0 TSval=27678363 TSecr=689069142
188   0.173035 54.192.30.188 -> 172.31.36.109 TCP 21786 [TCP segment of a reassembled PDU]
189   0.173054 54.192.30.188 -> 172.31.36.109 TCP 8754 [TCP segment of a reassembled PDU]
190   0.173068 172.31.36.109 -> 54.192.30.188 TCP 66 42805 > http [ACK] Seq=98 Ack=976641 Win=915840 Len=0 TSval=27678363 TSecr=689069142
191   0.173165 54.192.30.188 -> 172.31.36.109 TCP 6234 [TCP segment of a reassembled PDU]
192   0.173171 172.31.36.109 -> 54.192.30.188 TCP 66 42805 > http [ACK] Seq=98 Ack=982809 Win=934144 Len=0 TSval=27678363 TSecr=689069142
193   0.173178 54.192.30.188 -> 172.31.36.109 TCP 1514 [TCP segment of a reassembled PDU]
194   0.173409 54.192.30.188 -> 172.31.36.109 TCP 10202 [TCP segment of a reassembled PDU]
195   0.173525 54.192.30.188 -> 172.31.36.109 TCP 5858 [TCP segment of a reassembled PDU]
196   0.173646 54.192.30.188 -> 172.31.36.109 TCP 4410 [TCP segment of a reassembled PDU]
197   0.173770 54.192.30.188 -> 172.31.36.109 TCP 4410 [TCP segment of a reassembled PDU]
198   0.173895 54.192.30.188 -> 172.31.36.109 TCP 4410 [TCP segment of a reassembled PDU]
199   0.174053 54.192.30.188 -> 172.31.36.109 TCP 15994 [TCP segment of a reassembled PDU]
200   0.174156 54.192.30.188 -> 172.31.36.109 TCP 4410 [TCP segment of a reassembled PDU]
201   0.174300 54.192.30.188 -> 172.31.36.109 TCP 13098 [TCP segment of a reassembled PDU]
202   0.174412 54.192.30.188 -> 172.31.36.109 TCP 1890 [TCP segment of a reassembled PDU]
203   0.175466 172.31.36.109 -> 54.192.30.188 TCP 66 42805 > http [ACK] Seq=98 Ack=1048345 Win=868608 Len=0 TSval=27678364 TSecr=689069142
204   0.177483 54.192.30.188 -> 172.31.36.109 TCP 1514 [TCP segment of a reassembled PDU]
205   0.177750 54.192.30.188 -> 172.31.36.109 TCP 7306 [TCP segment of a reassembled PDU]
206   0.177758 172.31.36.109 -> 54.192.30.188 TCP 66 42805 > http [ACK] Seq=98 Ack=1057033 Win=934144 Len=0 TSval=27678364 TSecr=689069142
207   0.177842 54.192.30.188 -> 172.31.36.109 TCP 10202 [TCP segment of a reassembled PDU]
208   0.177856 172.31.36.109 -> 54.192.30.188 TCP 66 42805 > http [ACK] Seq=98 Ack=1067169 Win=946176 Len=0 TSval=27678364 TSecr=689069142
209   0.178055 54.192.30.188 -> 172.31.36.109 TCP 7306 [TCP segment of a reassembled PDU]
210   0.178077 54.192.30.188 -> 172.31.36.109 TCP 15994 [TCP segment of a reassembled PDU]
211   0.178128 54.192.30.188 -> 172.31.36.109 TCP 4410 [TCP segment of a reassembled PDU]
212   0.178135 54.192.30.188 -> 172.31.36.109 TCP 2962 [TCP segment of a reassembled PDU]
213   0.178280 172.31.36.109 -> 54.192.30.188 TCP 66 42805 > http [ACK] Seq=98 Ack=1097577 Win=915840 Len=0 TSval=27678364 TSecr=689069142
214   0.179131 54.192.30.188 -> 172.31.36.109 TCP 18890 [TCP segment of a reassembled PDU]
215   0.179163 54.192.30.188 -> 172.31.36.109 TCP 23234 [TCP segment of a reassembled PDU]
216   0.179188 54.192.30.188 -> 172.31.36.109 TCP 13098 [TCP segment of a reassembled PDU]
217   0.179204 172.31.36.109 -> 54.192.30.188 TCP 66 42805 > http [ACK] Seq=98 Ack=1152601 Win=860928 Len=0 TSval=27678364 TSecr=689069142
218   0.179243 54.192.30.188 -> 172.31.36.109 TCP 2962 [TCP segment of a reassembled PDU]
219   0.179248 172.31.36.109 -> 54.192.30.188 TCP 66 42805 > http [ACK] Seq=98 Ack=1155497 Win=941312 Len=0 TSval=27678364 TSecr=689069142
220   0.179337 54.192.30.188 -> 172.31.36.109 TCP 21786 [TCP segment of a reassembled PDU]
221   0.179371 172.31.36.109 -> 54.192.30.188 TCP 66 42805 > http [ACK] Seq=98 Ack=1177217 Win=919680 Len=0 TSval=27678364 TSecr=689069142
222   0.179464 54.192.30.188 -> 172.31.36.109 TCP 2266 [TCP segment of a reassembled PDU]
223   0.179469 172.31.36.109 -> 54.192.30.188 TCP 66 42805 > http [ACK] Seq=98 Ack=1179417 Win=941312 Len=0 TSval=27678365 TSecr=689069142
224   0.186201 54.192.30.188 -> 172.31.36.109 TCP 1514 [TCP segment of a reassembled PDU]
225   0.186211 172.31.36.109 -> 54.192.30.188 TCP 66 42805 > http [ACK] Seq=98 Ack=1180865 Win=949632 Len=0 TSval=27678366 TSecr=689069143
226   0.186510 54.192.30.188 -> 172.31.36.109 TCP 8754 [TCP segment of a reassembled PDU]
227   0.186519 172.31.36.109 -> 54.192.30.188 TCP 66 42805 > http [ACK] Seq=98 Ack=1189553 Win=958848 Len=0 TSval=27678366 TSecr=689069143
228   0.186554 54.192.30.188 -> 172.31.36.109 TCP 1514 [TCP segment of a reassembled PDU]
229   0.186559 172.31.36.109 -> 54.192.30.188 TCP 66 42805 > http [ACK] Seq=98 Ack=1191001 Win=969856 Len=0 TSval=27678366 TSecr=689069143
230   0.186855 54.192.30.188 -> 172.31.36.109 TCP 17442 [TCP segment of a reassembled PDU]
231   0.186886 54.192.30.188 -> 172.31.36.109 TCP 5858 [TCP segment of a reassembled PDU]
232   0.187010 54.192.30.188 -> 172.31.36.109 TCP 20338 [TCP segment of a reassembled PDU]
233   0.187024 54.192.30.188 -> 172.31.36.109 TCP 10578 [TCP segment of a reassembled PDU]
234   0.187151 172.31.36.109 -> 54.192.30.188 TCP 66 42805 > http [ACK] Seq=98 Ack=1244953 Win=915968 Len=0 TSval=27678366 TSecr=689069143
235   0.197781 54.192.30.188 -> 172.31.36.109 TCP 1514 [TCP segment of a reassembled PDU]
236   0.197788 172.31.36.109 -> 54.192.30.188 TCP 66 42805 > http [ACK] Seq=98 Ack=1246401 Win=970752 Len=0 TSval=27678369 TSecr=689069144
237   0.197979 54.192.30.188 -> 172.31.36.109 TCP 4410 [TCP segment of a reassembled PDU]
238   0.197996 172.31.36.109 -> 54.192.30.188 TCP 66 42805 > http [ACK] Seq=98 Ack=1250745 Win=970880 Len=0 TSval=27678369 TSecr=689069144
239   0.198108 54.192.30.188 -> 172.31.36.109 TCP 21786 [TCP segment of a reassembled PDU]
240   0.198135 172.31.36.109 -> 54.192.30.188 TCP 66 42805 > http [ACK] Seq=98 Ack=1272465 Win=949248 Len=0 TSval=27678369 TSecr=689069144
241   0.198297 54.192.30.188 -> 172.31.36.109 TCP 17442 [TCP segment of a reassembled PDU]
242   0.198318 172.31.36.109 -> 54.192.30.188 TCP 66 42805 > http [ACK] Seq=98 Ack=1289841 Win=944512 Len=0 TSval=27678369 TSecr=689069144
243   0.198402 54.192.30.188 -> 172.31.36.109 TCP 8754 [TCP segment of a reassembled PDU]
244   0.198409 172.31.36.109 -> 54.192.30.188 TCP 66 42805 > http [ACK] Seq=98 Ack=1298529 Win=958848 Len=0 TSval=27678369 TSecr=689069144
245   0.198420 54.192.30.188 -> 172.31.36.109 TCP 8754 [TCP segment of a reassembled PDU]
246   0.198440 172.31.36.109 -> 54.192.30.188 TCP 66 42805 > http [ACK] Seq=98 Ack=1307217 Win=958848 Len=0 TSval=27678369 TSecr=689069144
247   0.198612 54.192.30.188 -> 172.31.36.109 TCP 10202 [TCP segment of a reassembled PDU]
248   0.198630 54.192.30.188 -> 172.31.36.109 TCP 14546 [TCP segment of a reassembled PDU]
249   0.198739 54.192.30.188 -> 172.31.36.109 TCP 2962 [TCP segment of a reassembled PDU]
250   0.198834 54.192.30.188 -> 172.31.36.109 TCP 2962 [TCP segment of a reassembled PDU]
251   0.198849 172.31.36.109 -> 54.192.30.188 TCP 66 42805 > http [ACK] Seq=98 Ack=1337625 Win=939648 Len=0 TSval=27678369 TSecr=689069144
252   0.199967 54.192.30.188 -> 172.31.36.109 TCP 38466 [TCP segment of a reassembled PDU]
253   0.200003 172.31.36.109 -> 54.192.30.188 TCP 66 42805 > http [ACK] Seq=98 Ack=1376025 Win=908928 Len=0 TSval=27678370 TSecr=689069145
254   0.213415 54.192.30.188 -> 172.31.36.109 TCP 1514 [TCP segment of a reassembled PDU]
255   0.213424 54.192.30.188 -> 172.31.36.109 TCP 5858 [TCP segment of a reassembled PDU]
256   0.213430 172.31.36.109 -> 54.192.30.188 TCP 66 42805 > http [ACK] Seq=98 Ack=1383265 Win=961280 Len=0 TSval=27678373 TSecr=689069146
257   0.213437 54.192.30.188 -> 172.31.36.109 TCP 5858 [TCP segment of a reassembled PDU]
258   0.213463 172.31.36.109 -> 54.192.30.188 TCP 66 42805 > http [ACK] Seq=98 Ack=1389057 Win=970880 Len=0 TSval=27678373 TSecr=689069146
259   0.213706 54.192.30.188 -> 172.31.36.109 TCP 17442 [TCP segment of a reassembled PDU]
260   0.213729 172.31.36.109 -> 54.192.30.188 TCP 66 42805 > http [ACK] Seq=98 Ack=1406433 Win=953600 Len=0 TSval=27678373 TSecr=689069146
261   0.213979 54.192.30.188 -> 172.31.36.109 TCP 7306 [TCP segment of a reassembled PDU]
262   0.213986 172.31.36.109 -> 54.192.30.188 TCP 66 42805 > http [ACK] Seq=98 Ack=1413673 Win=961280 Len=0 TSval=27678373 TSecr=689069146
263   0.213995 54.192.30.188 -> 172.31.36.109 TCP 10202 [TCP segment of a reassembled PDU]
264   0.214008 54.192.30.188 -> 172.31.36.109 TCP 4410 [TCP segment of a reassembled PDU]
265   0.214028 172.31.36.109 -> 54.192.30.188 TCP 66 42805 > http [ACK] Seq=98 Ack=1428153 Win=949248 Len=0 TSval=27678373 TSecr=689069146
266   0.214272 54.192.30.188 -> 172.31.36.109 TCP 17442 [TCP segment of a reassembled PDU]
267   0.214301 54.192.30.188 -> 172.31.36.109 TCP 5858 [TCP segment of a reassembled PDU]
268   0.214393 54.192.30.188 -> 172.31.36.109 TCP 11650 [TCP segment of a reassembled PDU]
269   0.214501 172.31.36.109 -> 54.192.30.188 TCP 66 42805 > http [ACK] Seq=98 Ack=1462905 Win=915840 Len=0 TSval=27678373 TSecr=689069146
270   0.214645 54.192.30.188 -> 172.31.36.109 TCP 5858 [TCP segment of a reassembled PDU]
271   0.214651 172.31.36.109 -> 54.192.30.188 TCP 66 42805 > http [ACK] Seq=98 Ack=1468697 Win=963584 Len=0 TSval=27678373 TSecr=689069146
272   0.214775 54.192.30.188 -> 172.31.36.109 TCP 15994 [TCP segment of a reassembled PDU]
273   0.214797 172.31.36.109 -> 54.192.30.188 TCP 66 42805 > http [ACK] Seq=98 Ack=1484625 Win=970880 Len=0 TSval=27678373 TSecr=689069146
274   0.214867 54.192.30.188 -> 172.31.36.109 TCP 2962 [TCP segment of a reassembled PDU]
275   0.214882 172.31.36.109 -> 54.192.30.188 TCP 66 42805 > http [ACK] Seq=98 Ack=1487521 Win=970880 Len=0 TSval=27678373 TSecr=689069146
276   0.215023 54.192.30.188 -> 172.31.36.109 TCP 19642 [TCP segment of a reassembled PDU]
277   0.215048 172.31.36.109 -> 54.192.30.188 TCP 66 42805 > http [ACK] Seq=98 Ack=1507097 Win=951424 Len=0 TSval=27678373 TSecr=689069146
278   0.217417 54.192.30.188 -> 172.31.36.109 TCP 1514 [TCP segment of a reassembled PDU]
279   0.217767 54.192.30.188 -> 172.31.36.109 TCP 21786 [TCP segment of a reassembled PDU]
280   0.217791 172.31.36.109 -> 54.192.30.188 TCP 66 42805 > http [ACK] Seq=98 Ack=1530265 Win=937472 Len=0 TSval=27678374 TSecr=689069146
281   0.217828 54.192.30.188 -> 172.31.36.109 TCP 2962 [TCP segment of a reassembled PDU]
282   0.217834 172.31.36.109 -> 54.192.30.188 TCP 66 42805 > http [ACK] Seq=98 Ack=1533161 Win=968320 Len=0 TSval=27678374 TSecr=689069146
283   0.217845 54.192.30.188 -> 172.31.36.109 TCP 10202 [TCP segment of a reassembled PDU]
284   0.217868 172.31.36.109 -> 54.192.30.188 TCP 66 42805 > http [ACK] Seq=98 Ack=1543297 Win=970880 Len=0 TSval=27678374 TSecr=689069146
285   0.218101 54.192.30.188 -> 172.31.36.109 TCP 10202 [TCP segment of a reassembled PDU]
286   0.218120 54.192.30.188 -> 172.31.36.109 TCP 14546 [TCP segment of a reassembled PDU]
287   0.218149 172.31.36.109 -> 54.192.30.188 TCP 66 42805 > http [ACK] Seq=98 Ack=1567913 Win=949248 Len=0 TSval=27678374 TSecr=689069146
288   0.218297 54.192.30.188 -> 172.31.36.109 TCP 10202 [TCP segment of a reassembled PDU]
289   0.218305 172.31.36.109 -> 54.192.30.188 TCP 66 42805 > http [ACK] Seq=98 Ack=1578049 Win=956544 Len=0 TSval=27678374 TSecr=689069146
290   0.218324 54.192.30.188 -> 172.31.36.109 TCP 18890 [TCP segment of a reassembled PDU]
291   0.218425 172.31.36.109 -> 54.192.30.188 TCP 66 42805 > http [ACK] Seq=98 Ack=1596873 Win=942208 Len=0 TSval=27678374 TSecr=689069146
292   0.218546 54.192.30.188 -> 172.31.36.109 TCP 2962 [TCP segment of a reassembled PDU]
293   0.218552 172.31.36.109 -> 54.192.30.188 TCP 66 42805 > http [ACK] Seq=98 Ack=1599769 Win=968320 Len=0 TSval=27678374 TSecr=689069146
294   0.218790 54.192.30.188 -> 172.31.36.109 TCP 15994 [TCP segment of a reassembled PDU]
295   0.218812 172.31.36.109 -> 54.192.30.188 TCP 66 42805 > http [ACK] Seq=98 Ack=1615697 Win=970880 Len=0 TSval=27678374 TSecr=689069146
296   0.219071 54.192.30.188 -> 172.31.36.109 TCP 26130 [TCP segment of a reassembled PDU]
297   0.219097 172.31.36.109 -> 54.192.30.188 TCP 66 42805 > http [ACK] Seq=98 Ack=1641761 Win=944896 Len=0 TSval=27678374 TSecr=689069146
298   0.220321 54.192.30.188 -> 172.31.36.109 TCP 36266 [TCP segment of a reassembled PDU]
299   0.220350 172.31.36.109 -> 54.192.30.188 TCP 66 42805 > http [ACK] Seq=98 Ack=1677961 Win=913664 Len=0 TSval=27678375 TSecr=689069147
300   0.220458 54.192.30.188 -> 172.31.36.109 TCP 42058 [TCP segment of a reassembled PDU]
301   0.220489 172.31.36.109 -> 54.192.30.188 TCP 66 42805 > http [ACK] Seq=98 Ack=1719953 Win=904064 Len=0 TSval=27678375 TSecr=689069147
302   0.220693 54.192.30.188 -> 172.31.36.109 TCP 20338 [TCP segment of a reassembled PDU]
303   0.220704 172.31.36.109 -> 54.192.30.188 TCP 66 42805 > http [ACK] Seq=98 Ack=1740225 Win=939776 Len=0 TSval=27678375 TSecr=689069147
304   0.220790 54.192.30.188 -> 172.31.36.109 TCP 5858 [TCP segment of a reassembled PDU]
305   0.220796 172.31.36.109 -> 54.192.30.188 TCP 66 42805 > http [ACK] Seq=98 Ack=1746017 Win=963584 Len=0 TSval=27678375 TSecr=689069147
306   0.220933 54.192.30.188 -> 172.31.36.109 TCP 15994 [TCP segment of a reassembled PDU]
307   0.220954 172.31.36.109 -> 54.192.30.188 TCP 66 42805 > http [ACK] Seq=98 Ack=1761945 Win=970880 Len=0 TSval=27678375 TSecr=689069147
308   0.221558 54.192.30.188 -> 172.31.36.109 TCP 2962 [TCP segment of a reassembled PDU]
309   0.221573 172.31.36.109 -> 54.192.30.188 TCP 66 42805 > http [ACK] Seq=98 Ack=1764841 Win=970880 Len=0 TSval=27678375 TSecr=689069147
310   0.221681 54.192.30.188 -> 172.31.36.109 TCP 4466 [TCP segment of a reassembled PDU]
311   0.221698 172.31.36.109 -> 54.192.30.188 TCP 66 42805 > http [ACK] Seq=98 Ack=1769241 Win=970880 Len=0 TSval=27678375 TSecr=689069147
312   0.233611 54.192.30.188 -> 172.31.36.109 TCP 11650 [TCP segment of a reassembled PDU]
313   0.233632 172.31.36.109 -> 54.192.30.188 TCP 66 42805 > http [ACK] Seq=98 Ack=1780825 Win=970880 Len=0 TSval=27678378 TSecr=689069148
314   0.233717 54.192.30.188 -> 172.31.36.109 TCP 1514 [TCP segment of a reassembled PDU]
315   0.233797 54.192.30.188 -> 172.31.36.109 TCP 2962 [TCP segment of a reassembled PDU]
316   0.233811 172.31.36.109 -> 54.192.30.188 TCP 66 42805 > http [ACK] Seq=98 Ack=1785169 Win=970880 Len=0 TSval=27678378 TSecr=689069148
317   0.234039 54.192.30.188 -> 172.31.36.109 TCP 21786 [TCP segment of a reassembled PDU]
318   0.234055 54.192.30.188 -> 172.31.36.109 TCP 4410 [TCP segment of a reassembled PDU]
319   0.234061 54.192.30.188 -> 172.31.36.109 TCP 4410 [TCP segment of a reassembled PDU]
320   0.234087 172.31.36.109 -> 54.192.30.188 TCP 66 42805 > http [ACK] Seq=98 Ack=1815577 Win=940544 Len=0 TSval=27678378 TSecr=689069148
321   0.234231 54.192.30.188 -> 172.31.36.109 TCP 2962 [TCP segment of a reassembled PDU]
322   0.234249 172.31.36.109 -> 54.192.30.188 TCP 66 42805 > http [ACK] Seq=98 Ack=1818473 Win=968320 Len=0 TSval=27678378 TSecr=689069148
323   0.234277 54.192.30.188 -> 172.31.36.109 TCP 15994 [TCP segment of a reassembled PDU]
324   0.234350 172.31.36.109 -> 54.192.30.188 TCP 66 42805 > http [ACK] Seq=98 Ack=1834401 Win=952448 Len=0 TSval=27678378 TSecr=689069148
325   0.234459 54.192.30.188 -> 172.31.36.109 TCP 442 [TCP segment of a reassembled PDU]
326   0.234473 172.31.36.109 -> 54.192.30.188 TCP 66 42805 > http [ACK] Seq=98 Ack=1834777 Win=970880 Len=0 TSval=27678378 TSecr=689069148
327   0.235134 54.192.30.188 -> 172.31.36.109 TCP 1514 [TCP segment of a reassembled PDU]
328   0.235372 54.192.30.188 -> 172.31.36.109 TCP 2962 [TCP segment of a reassembled PDU]
329   0.235387 172.31.36.109 -> 54.192.30.188 TCP 66 42805 > http [ACK] Seq=98 Ack=1839121 Win=970880 Len=0 TSval=27678378 TSecr=689069148
330   0.235434 54.192.30.188 -> 172.31.36.109 TCP 8754 [TCP segment of a reassembled PDU]
331   0.235452 172.31.36.109 -> 54.192.30.188 TCP 66 42805 > http [ACK] Seq=98 Ack=1847809 Win=970880 Len=0 TSval=27678379 TSecr=689069148
332   0.235626 54.192.30.188 -> 172.31.36.109 TCP 5858 [TCP segment of a reassembled PDU]
333   0.235643 172.31.36.109 -> 54.192.30.188 TCP 66 42805 > http [ACK] Seq=98 Ack=1853601 Win=970880 Len=0 TSval=27678379 TSecr=689069148
334   0.235726 54.192.30.188 -> 172.31.36.109 TCP 7306 [TCP segment of a reassembled PDU]
335   0.235742 54.192.30.188 -> 172.31.36.109 TCP 14546 [TCP segment of a reassembled PDU]
336   0.235761 172.31.36.109 -> 54.192.30.188 TCP 66 42805 > http [ACK] Seq=98 Ack=1875321 Win=949248 Len=0 TSval=27678379 TSecr=689069148
337   0.235943 54.192.30.188 -> 172.31.36.109 TCP 2962 [TCP segment of a reassembled PDU]
338   0.235948 172.31.36.109 -> 54.192.30.188 TCP 66 42805 > http [ACK] Seq=98 Ack=1878217 Win=968320 Len=0 TSval=27678379 TSecr=689069148
339   0.235955 54.192.30.188 -> 172.31.36.109 TCP 5858 [TCP segment of a reassembled PDU]
340   0.235973 54.192.30.188 -> 172.31.36.109 TCP 11650 [TCP segment of a reassembled PDU]
341   0.235993 172.31.36.109 -> 54.192.30.188 TCP 66 42805 > http [ACK] Seq=98 Ack=1895593 Win=954112 Len=0 TSval=27678379 TSecr=689069148
342   0.236204 54.192.30.188 -> 172.31.36.109 TCP 4786 [TCP segment of a reassembled PDU]
343   0.236210 172.31.36.109 -> 54.192.30.188 TCP 66 42805 > http [ACK] Seq=98 Ack=1900313 Win=963584 Len=0 TSval=27678379 TSecr=689069148
344   0.245658 54.192.30.188 -> 172.31.36.109 TCP 14546 [TCP segment of a reassembled PDU]
345   0.245679 172.31.36.109 -> 54.192.30.188 TCP 66 42805 > http [ACK] Seq=98 Ack=1914793 Win=970880 Len=0 TSval=27678381 TSecr=689069149
346   0.245746 54.192.30.188 -> 172.31.36.109 TCP 15994 [TCP segment of a reassembled PDU]
347   0.245859 54.192.30.188 -> 172.31.36.109 TCP 1514 [TCP segment of a reassembled PDU]
348   0.245953 172.31.36.109 -> 54.192.30.188 TCP 66 42805 > http [ACK] Seq=98 Ack=1932169 Win=970752 Len=0 TSval=27678381 TSecr=689069149
349   0.245979 54.192.30.188 -> 172.31.36.109 TCP 11650 [TCP segment of a reassembled PDU]
350   0.245986 54.192.30.188 -> 172.31.36.109 TCP 1514 [TCP segment of a reassembled PDU]
351   0.246002 54.192.30.188 -> 172.31.36.109 TCP 11650 [TCP segment of a reassembled PDU]
352   0.246014 172.31.36.109 -> 54.192.30.188 TCP 66 42805 > http [ACK] Seq=98 Ack=1956785 Win=954112 Len=0 TSval=27678381 TSecr=689069149
353   0.246029 54.192.30.188 -> 172.31.36.109 TCP 4410 [TCP segment of a reassembled PDU]
354   0.246039 172.31.36.109 -> 54.192.30.188 TCP 66 42805 > http [ACK] Seq=98 Ack=1961129 Win=970880 Len=0 TSval=27678381 TSecr=689069149
355   0.246121 54.192.30.188 -> 172.31.36.109 TCP 4786 [TCP segment of a reassembled PDU]
356   0.246139 172.31.36.109 -> 54.192.30.188 TCP 66 42805 > http [ACK] Seq=98 Ack=1965849 Win=970880 Len=0 TSval=27678381 TSecr=689069149
357   0.378604 54.192.30.188 -> 172.31.36.109 TCP 1514 [TCP segment of a reassembled PDU]
358   0.378620 54.192.30.188 -> 172.31.36.109 TCP 14546 [TCP segment of a reassembled PDU]
359   0.378640 54.192.30.188 -> 172.31.36.109 TCP 13098 [TCP segment of a reassembled PDU]
360   0.378680 172.31.36.109 -> 54.192.30.188 TCP 66 42805 > http [ACK] Seq=98 Ack=1994809 Win=951808 Len=0 TSval=27678414 TSecr=689069162
361   0.378713 54.192.30.188 -> 172.31.36.109 TCP 2962 [TCP segment of a reassembled PDU]
362   0.378718 172.31.36.109 -> 54.192.30.188 TCP 66 42805 > http [ACK] Seq=98 Ack=1997705 Win=968320 Len=0 TSval=27678414 TSecr=689069162
363   0.378845 54.192.30.188 -> 172.31.36.109 TCP 8754 [TCP segment of a reassembled PDU]
364   0.378853 54.192.30.188 -> 172.31.36.109 TCP 4410 [TCP segment of a reassembled PDU]
365   0.378871 172.31.36.109 -> 54.192.30.188 TCP 66 42805 > http [ACK] Seq=98 Ack=2010737 Win=970880 Len=0 TSval=27678414 TSecr=689069162
366   0.378958 54.192.30.188 -> 172.31.36.109 TCP 1514 [TCP segment of a reassembled PDU]
367   0.379095 54.192.30.188 -> 172.31.36.109 TCP 8754 [TCP segment of a reassembled PDU]
368   0.379112 172.31.36.109 -> 54.192.30.188 TCP 66 42805 > http [ACK] Seq=98 Ack=2020873 Win=970880 Len=0 TSval=27678414 TSecr=689069162
369   0.379339 54.192.30.188 -> 172.31.36.109 TCP 13098 [TCP segment of a reassembled PDU]
370   0.379360 172.31.36.109 -> 54.192.30.188 TCP 66 42805 > http [ACK] Seq=98 Ack=2033905 Win=970880 Len=0 TSval=27678414 TSecr=689069162
371   0.379619 54.192.30.188 -> 172.31.36.109 TCP 2962 [TCP segment of a reassembled PDU]
372   0.379630 54.192.30.188 -> 172.31.36.109 TCP 11650 [TCP segment of a reassembled PDU]
373   0.379637 54.192.30.188 -> 172.31.36.109 TCP 1514 [TCP segment of a reassembled PDU]
374   0.379654 172.31.36.109 -> 54.192.30.188 TCP 66 42805 > http [ACK] Seq=98 Ack=2049833 Win=970880 Len=0 TSval=27678415 TSecr=689069162
375   0.379732 54.192.30.188 -> 172.31.36.109 TCP 1514 [TCP segment of a reassembled PDU]
376   0.379887 54.192.30.188 -> 172.31.36.109 TCP 13098 [TCP segment of a reassembled PDU]
377   0.379907 172.31.36.109 -> 54.192.30.188 TCP 66 42805 > http [ACK] Seq=98 Ack=2064313 Win=970880 Len=0 TSval=27678415 TSecr=689069162
378   0.380010 54.192.30.188 -> 172.31.36.109 TCP 5858 [TCP segment of a reassembled PDU]
379   0.380019 54.192.30.188 -> 172.31.36.109 TCP 4410 [TCP segment of a reassembled PDU]
380   0.380034 172.31.36.109 -> 54.192.30.188 TCP 66 42805 > http [ACK] Seq=98 Ack=2074449 Win=970880 Len=0 TSval=27678415 TSecr=689069162
381   0.380084 54.192.30.188 -> 172.31.36.109 TCP 4410 [TCP segment of a reassembled PDU]
382   0.380100 172.31.36.109 -> 54.192.30.188 TCP 66 42805 > http [ACK] Seq=98 Ack=2078793 Win=970880 Len=0 TSval=27678415 TSecr=689069163
383   0.380302 54.192.30.188 -> 172.31.36.109 TCP 15994 [TCP segment of a reassembled PDU]
384   0.380323 172.31.36.109 -> 54.192.30.188 TCP 66 42805 > http [ACK] Seq=98 Ack=2094721 Win=970880 Len=0 TSval=27678415 TSecr=689069163
385   0.380535 54.192.30.188 -> 172.31.36.109 TCP 10202 [TCP segment of a reassembled PDU]
386   0.380553 172.31.36.109 -> 54.192.30.188 TCP 66 42805 > http [ACK] Seq=98 Ack=2104857 Win=970880 Len=0 TSval=27678415 TSecr=689069163
387   0.380638 54.192.30.188 -> 172.31.36.109 TCP 4410 [TCP segment of a reassembled PDU]
388   0.380652 172.31.36.109 -> 54.192.30.188 TCP 66 42805 > http [ACK] Seq=98 Ack=2109201 Win=970880 Len=0 TSval=27678415 TSecr=689069163
389   0.380879 54.192.30.188 -> 172.31.36.109 TCP 5858 [TCP segment of a reassembled PDU]
390   0.380892 54.192.30.188 -> 172.31.36.109 TCP 10202 [TCP segment of a reassembled PDU]
391   0.380908 172.31.36.109 -> 54.192.30.188 TCP 66 42805 > http [ACK] Seq=98 Ack=2125129 Win=970880 Len=0 TSval=27678415 TSecr=689069163
392   0.381093 54.192.30.188 -> 172.31.36.109 TCP 14546 [TCP segment of a reassembled PDU]
393   0.381114 172.31.36.109 -> 54.192.30.188 TCP 66 42805 > http [ACK] Seq=98 Ack=2139609 Win=970880 Len=0 TSval=27678415 TSecr=689069163
394   0.381304 54.192.30.188 -> 172.31.36.109 TCP 10202 [TCP segment of a reassembled PDU]
395   0.381403 54.192.30.188 -> 172.31.36.109 TCP 4410 [TCP segment of a reassembled PDU]
396   0.381517 54.192.30.188 -> 172.31.36.109 TCP 2962 [TCP segment of a reassembled PDU]
397   0.381539 172.31.36.109 -> 54.192.30.188 TCP 66 42805 > http [ACK] Seq=98 Ack=2156985 Win=961280 Len=0 TSval=27678415 TSecr=689069163
398   0.381646 54.192.30.188 -> 172.31.36.109 TCP 7306 [TCP segment of a reassembled PDU]
399   0.381653 172.31.36.109 -> 54.192.30.188 TCP 66 42805 > http [ACK] Seq=98 Ack=2164225 Win=961280 Len=0 TSval=27678415 TSecr=689069163
400   0.381897 54.192.30.188 -> 172.31.36.109 TCP 14546 [TCP segment of a reassembled PDU]
401   0.381917 172.31.36.109 -> 54.192.30.188 TCP 66 42805 > http [ACK] Seq=98 Ack=2178705 Win=970880 Len=0 TSval=27678415 TSecr=689069163
402   0.382142 54.192.30.188 -> 172.31.36.109 TCP 15994 [TCP segment of a reassembled PDU]
403   0.382163 172.31.36.109 -> 54.192.30.188 TCP 66 42805 > http [ACK] Seq=98 Ack=2194633 Win=970880 Len=0 TSval=27678415 TSecr=689069163
404   0.382386 54.192.30.188 -> 172.31.36.109 TCP 10202 [TCP segment of a reassembled PDU]
405   0.382405 172.31.36.109 -> 54.192.30.188 TCP 66 42805 > http [ACK] Seq=98 Ack=2204769 Win=970880 Len=0 TSval=27678415 TSecr=689069163
406   0.382645 54.192.30.188 -> 172.31.36.109 TCP 10202 [TCP segment of a reassembled PDU]
407   0.382663 172.31.36.109 -> 54.192.30.188 TCP 66 42805 > http [ACK] Seq=98 Ack=2214905 Win=970880 Len=0 TSval=27678415 TSecr=689069163
408   0.382925 54.192.30.188 -> 172.31.36.109 TCP 13154 [TCP segment of a reassembled PDU]
409   0.382947 172.31.36.109 -> 54.192.30.188 TCP 66 42805 > http [ACK] Seq=98 Ack=2227993 Win=970880 Len=0 TSval=27678415 TSecr=689069163
410   0.414391 54.192.30.188 -> 172.31.36.109 TCP 7306 [TCP segment of a reassembled PDU]
411   0.414401 54.192.30.188 -> 172.31.36.109 TCP 5858 [TCP segment of a reassembled PDU]
412   0.414421 172.31.36.109 -> 54.192.30.188 TCP 66 42805 > http [ACK] Seq=98 Ack=2241025 Win=970880 Len=0 TSval=27678423 TSecr=689069166
413   0.414564 54.192.30.188 -> 172.31.36.109 TCP 4410 [TCP segment of a reassembled PDU]
414   0.414579 172.31.36.109 -> 54.192.30.188 TCP 66 42805 > http [ACK] Seq=98 Ack=2245369 Win=970880 Len=0 TSval=27678423 TSecr=689069166
415   0.414750 54.192.30.188 -> 172.31.36.109 TCP 20338 [TCP segment of a reassembled PDU]
416   0.414774 172.31.36.109 -> 54.192.30.188 TCP 66 42805 > http [ACK] Seq=98 Ack=2265641 Win=950656 Len=0 TSval=27678423 TSecr=689069166
417   0.414827 54.192.30.188 -> 172.31.36.109 TCP 4410 [TCP segment of a reassembled PDU]
418   0.414833 172.31.36.109 -> 54.192.30.188 TCP 66 42805 > http [ACK] Seq=98 Ack=2269985 Win=966016 Len=0 TSval=27678423 TSecr=689069166
419   0.414989 54.192.30.188 -> 172.31.36.109 TCP 2962 [TCP segment of a reassembled PDU]
420   0.414994 172.31.36.109 -> 54.192.30.188 TCP 66 42805 > http [ACK] Seq=98 Ack=2272881 Win=968320 Len=0 TSval=27678423 TSecr=689069166
421   0.415017 54.192.30.188 -> 172.31.36.109 TCP 17442 [TCP segment of a reassembled PDU]
422   0.415088 172.31.36.109 -> 54.192.30.188 TCP 66 42805 > http [ACK] Seq=98 Ack=2290257 Win=951040 Len=0 TSval=27678423 TSecr=689069166
423   0.415113 54.192.30.188 -> 172.31.36.109 TCP 7306 [TCP segment of a reassembled PDU]
424   0.415119 172.31.36.109 -> 54.192.30.188 TCP 66 42805 > http [ACK] Seq=98 Ack=2297497 Win=961280 Len=0 TSval=27678423 TSecr=689069166
425   0.415141 54.192.30.188 -> 172.31.36.109 TCP 8754 [TCP segment of a reassembled PDU]
426   0.415155 172.31.36.109 -> 54.192.30.188 TCP 66 42805 > http [ACK] Seq=98 Ack=2306185 Win=970880 Len=0 TSval=27678423 TSecr=689069166
427   0.415247 54.192.30.188 -> 172.31.36.109 TCP 8754 [TCP segment of a reassembled PDU]
428   0.415283 172.31.36.109 -> 54.192.30.188 TCP 66 42805 > http [ACK] Seq=98 Ack=2314873 Win=970880 Len=0 TSval=27678423 TSecr=689069166
429   0.415519 54.192.30.188 -> 172.31.36.109 TCP 2962 [TCP segment of a reassembled PDU]
430   0.415559 54.192.30.188 -> 172.31.36.109 TCP 23234 [TCP segment of a reassembled PDU]
431   0.415584 172.31.36.109 -> 54.192.30.188 TCP 66 42805 > http [ACK] Seq=98 Ack=2340937 Win=944896 Len=0 TSval=27678424 TSecr=689069166
432   0.415618 54.192.30.188 -> 172.31.36.109 TCP 2962 [TCP segment of a reassembled PDU]
433   0.415622 172.31.36.109 -> 54.192.30.188 TCP 66 42805 > http [ACK] Seq=98 Ack=2343833 Win=968320 Len=0 TSval=27678424 TSecr=689069166
434   0.415752 54.192.30.188 -> 172.31.36.109 TCP 4410 [TCP segment of a reassembled PDU]
435   0.415766 172.31.36.109 -> 54.192.30.188 TCP 66 42805 > http [ACK] Seq=98 Ack=2348177 Win=970880 Len=0 TSval=27678424 TSecr=689069166
436   0.415856 54.192.30.188 -> 172.31.36.109 TCP 4410 [TCP segment of a reassembled PDU]
437   0.415870 172.31.36.109 -> 54.192.30.188 TCP 66 42805 > http [ACK] Seq=98 Ack=2352521 Win=970880 Len=0 TSval=27678424 TSecr=689069166
438   0.416071 54.192.30.188 -> 172.31.36.109 TCP 31922 [TCP segment of a reassembled PDU]
439   0.416097 172.31.36.109 -> 54.192.30.188 TCP 66 42805 > http [ACK] Seq=98 Ack=2384377 Win=939136 Len=0 TSval=27678424 TSecr=689069166
440   0.416136 54.192.30.188 -> 172.31.36.109 TCP 2962 [TCP segment of a reassembled PDU]
441   0.416141 172.31.36.109 -> 54.192.30.188 TCP 66 42805 > http [ACK] Seq=98 Ack=2387273 Win=968320 Len=0 TSval=27678424 TSecr=689069166
442   0.416150 54.192.30.188 -> 172.31.36.109 TCP 4410 [TCP segment of a reassembled PDU]
443   0.416180 172.31.36.109 -> 54.192.30.188 TCP 66 42805 > http [ACK] Seq=98 Ack=2391617 Win=970880 Len=0 TSval=27678424 TSecr=689069166
444   0.416345 54.192.30.188 -> 172.31.36.109 TCP 1514 [TCP segment of a reassembled PDU]
445   0.416554 54.192.30.188 -> 172.31.36.109 TCP 34818 [TCP segment of a reassembled PDU]
446   0.416588 172.31.36.109 -> 54.192.30.188 TCP 66 42805 > http [ACK] Seq=98 Ack=2427817 Win=934784 Len=0 TSval=27678424 TSecr=689069166
447   0.416727 54.192.30.188 -> 172.31.36.109 TCP 2962 [TCP segment of a reassembled PDU]
448   0.416733 172.31.36.109 -> 54.192.30.188 TCP 66 42805 > http [ACK] Seq=98 Ack=2430713 Win=968320 Len=0 TSval=27678424 TSecr=689069166
449   0.416749 54.192.30.188 -> 172.31.36.109 TCP 17442 [TCP segment of a reassembled PDU]
450   0.416774 172.31.36.109 -> 54.192.30.188 TCP 66 42805 > http [ACK] Seq=98 Ack=2448089 Win=951040 Len=0 TSval=27678424 TSecr=689069166
451   0.416820 54.192.30.188 -> 172.31.36.109 TCP 10202 [TCP segment of a reassembled PDU]
452   0.416840 172.31.36.109 -> 54.192.30.188 TCP 66 42805 > http [ACK] Seq=98 Ack=2458225 Win=956544 Len=0 TSval=27678424 TSecr=689069166
453   0.416949 54.192.30.188 -> 172.31.36.109 TCP 13098 [TCP segment of a reassembled PDU]
454   0.416969 172.31.36.109 -> 54.192.30.188 TCP 66 42805 > http [ACK] Seq=98 Ack=2471257 Win=970880 Len=0 TSval=27678424 TSecr=689069166
455   0.417083 54.192.30.188 -> 172.31.36.109 TCP 2962 [TCP segment of a reassembled PDU]
456   0.417094 54.192.30.188 -> 172.31.36.109 TCP 10202 [TCP segment of a reassembled PDU]
457   0.417109 172.31.36.109 -> 54.192.30.188 TCP 66 42805 > http [ACK] Seq=98 Ack=2484289 Win=970880 Len=0 TSval=27678424 TSecr=689069166
458   0.417160 54.192.30.188 -> 172.31.36.109 TCP 4410 [TCP segment of a reassembled PDU]
459   0.417176 172.31.36.109 -> 54.192.30.188 TCP 66 42805 > http [ACK] Seq=98 Ack=2488633 Win=970880 Len=0 TSval=27678424 TSecr=689069166
460   0.417297 54.192.30.188 -> 172.31.36.109 TCP 20338 [TCP segment of a reassembled PDU]
461   0.417320 172.31.36.109 -> 54.192.30.188 TCP 66 42805 > http [ACK] Seq=98 Ack=2508905 Win=950656 Len=0 TSval=27678424 TSecr=689069166
462   0.417446 54.192.30.188 -> 172.31.36.109 TCP 13098 [TCP segment of a reassembled PDU]
463   0.417454 172.31.36.109 -> 54.192.30.188 TCP 66 42805 > http [ACK] Seq=98 Ack=2521937 Win=951808 Len=0 TSval=27678424 TSecr=689069166
464   0.417526 54.192.30.188 -> 172.31.36.109 TCP 11650 [TCP segment of a reassembled PDU]
465   0.417640 172.31.36.109 -> 54.192.30.188 TCP 66 42805 > http [ACK] Seq=98 Ack=2533521 Win=954112 Len=0 TSval=27678424 TSecr=689069166
466   0.417747 54.192.30.188 -> 172.31.36.109 TCP 7306 [TCP segment of a reassembled PDU]
467   0.417753 172.31.36.109 -> 54.192.30.188 TCP 66 42805 > http [ACK] Seq=98 Ack=2540761 Win=961280 Len=0 TSval=27678424 TSecr=689069166
468   0.417997 54.192.30.188 -> 172.31.36.109 TCP 14978 [TCP segment of a reassembled PDU]
469   0.418020 172.31.36.109 -> 54.192.30.188 TCP 66 42805 > http [ACK] Seq=98 Ack=2555673 Win=970880 Len=0 TSval=27678424 TSecr=689069166
470   0.436646 54.192.30.188 -> 172.31.36.109 TCP 1514 [TCP segment of a reassembled PDU]
471   0.436937 54.192.30.188 -> 172.31.36.109 TCP 17442 [TCP segment of a reassembled PDU]
472   0.436965 172.31.36.109 -> 54.192.30.188 TCP 66 42805 > http [ACK] Seq=98 Ack=2574497 Win=952064 Len=0 TSval=27678429 TSecr=689069168
473   0.437102 54.192.30.188 -> 172.31.36.109 TCP 2962 [TCP segment of a reassembled PDU]
474   0.437107 172.31.36.109 -> 54.192.30.188 TCP 66 42805 > http [ACK] Seq=98 Ack=2577393 Win=968320 Len=0 TSval=27678429 TSecr=689069168
475   0.437260 54.192.30.188 -> 172.31.36.109 TCP 5858 [TCP segment of a reassembled PDU]
476   0.437273 54.192.30.188 -> 172.31.36.109 TCP 17442 [TCP segment of a reassembled PDU]
477   0.437286 54.192.30.188 -> 172.31.36.109 TCP 2962 [TCP segment of a reassembled PDU]
478   0.437301 172.31.36.109 -> 54.192.30.188 TCP 66 42805 > http [ACK] Seq=98 Ack=2603457 Win=942336 Len=0 TSval=27678429 TSecr=689069168
479   0.437360 54.192.30.188 -> 172.31.36.109 TCP 4410 [TCP segment of a reassembled PDU]
480   0.437366 172.31.36.109 -> 54.192.30.188 TCP 66 42805 > http [ACK] Seq=98 Ack=2607801 Win=966016 Len=0 TSval=27678429 TSecr=689069168
481   0.437496 54.192.30.188 -> 172.31.36.109 TCP 7306 [TCP segment of a reassembled PDU]
482   0.437505 54.192.30.188 -> 172.31.36.109 TCP 6234 [TCP segment of a reassembled PDU]
483   0.437524 172.31.36.109 -> 54.192.30.188 TCP 66 42805 > http [ACK] Seq=98 Ack=2621209 Win=970880 Len=0 TSval=27678429 TSecr=689069168
484   0.442496 54.192.30.188 -> 172.31.36.109 TCP 5858 [TCP segment of a reassembled PDU]
485   0.442513 172.31.36.109 -> 54.192.30.188 TCP 66 42805 > http [ACK] Seq=98 Ack=2627001 Win=970880 Len=0 TSval=27678430 TSecr=689069169
486   0.442623 54.192.30.188 -> 172.31.36.109 TCP 20338 [TCP segment of a reassembled PDU]
487   0.442814 172.31.36.109 -> 54.192.30.188 TCP 66 42805 > http [ACK] Seq=98 Ack=2647273 Win=950656 Len=0 TSval=27678430 TSecr=689069169
488   0.442940 54.192.30.188 -> 172.31.36.109 TCP 17442 [TCP segment of a reassembled PDU]
489   0.442961 172.31.36.109 -> 54.192.30.188 TCP 66 42805 > http [ACK] Seq=98 Ack=2664649 Win=944512 Len=0 TSval=27678430 TSecr=689069169
490   0.442971 54.192.30.188 -> 172.31.36.109 TCP 4410 [TCP segment of a reassembled PDU]
491   0.442985 172.31.36.109 -> 54.192.30.188 TCP 66 42805 > http [ACK] Seq=98 Ack=2668993 Win=970880 Len=0 TSval=27678430 TSecr=689069169
492   0.443021 54.192.30.188 -> 172.31.36.109 TCP 14546 [TCP segment of a reassembled PDU]
493   0.443042 172.31.36.109 -> 54.192.30.188 TCP 66 42805 > http [ACK] Seq=98 Ack=2683473 Win=970880 Len=0 TSval=27678430 TSecr=689069169
494   0.443099 54.192.30.188 -> 172.31.36.109 TCP 11650 [TCP segment of a reassembled PDU]
495   0.443111 54.192.30.188 -> 172.31.36.109 TCP 4410 [TCP segment of a reassembled PDU]
496   0.443125 172.31.36.109 -> 54.192.30.188 TCP 66 42805 > http [ACK] Seq=98 Ack=2699401 Win=970880 Len=0 TSval=27678430 TSecr=689069169
497   0.443435 54.192.30.188 -> 172.31.36.109 TCP 17442 [TCP segment of a reassembled PDU]
498   0.443457 54.192.30.188 -> 172.31.36.109 TCP 10202 [TCP segment of a reassembled PDU]
499   0.443487 172.31.36.109 -> 54.192.30.188 TCP 66 42805 > http [ACK] Seq=98 Ack=2726913 Win=943488 Len=0 TSval=27678431 TSecr=689069169
500   0.443498 54.192.30.188 -> 172.31.36.109 TCP 8754 [TCP segment of a reassembled PDU]
501   0.443506 54.192.30.188 -> 172.31.36.109 TCP 2962 [TCP segment of a reassembled PDU]
502   0.443520 172.31.36.109 -> 54.192.30.188 TCP 66 42805 > http [ACK] Seq=98 Ack=2738497 Win=954112 Len=0 TSval=27678431 TSecr=689069169
503   0.443588 54.192.30.188 -> 172.31.36.109 TCP 20338 [TCP segment of a reassembled PDU]
504   0.443788 172.31.36.109 -> 54.192.30.188 TCP 66 42805 > http [ACK] Seq=98 Ack=2758769 Win=939776 Len=0 TSval=27678431 TSecr=689069169
505   0.444065 54.192.30.188 -> 172.31.36.109 TCP 5858 [TCP segment of a reassembled PDU]
506   0.444091 172.31.36.109 -> 54.192.30.188 TCP 66 42805 > http [ACK] Seq=98 Ack=2764561 Win=963584 Len=0 TSval=27678431 TSecr=689069169
507   0.444313 54.192.30.188 -> 172.31.36.109 TCP 11650 [TCP segment of a reassembled PDU]
508   0.444332 172.31.36.109 -> 54.192.30.188 TCP 66 42805 > http [ACK] Seq=98 Ack=2776145 Win=970880 Len=0 TSval=27678431 TSecr=689069169
509   0.444626 54.192.30.188 -> 172.31.36.109 TCP 13098 [TCP segment of a reassembled PDU]
510   0.444667 54.192.30.188 -> 172.31.36.109 TCP 21786 [TCP segment of a reassembled PDU]
511   0.444679 54.192.30.188 -> 172.31.36.109 TCP 6986 [TCP segment of a reassembled PDU]
512   0.444688 54.192.30.188 -> 172.31.36.109 TCP 7306 [TCP segment of a reassembled PDU]
513   0.444705 172.31.36.109 -> 54.192.30.188 TCP 66 42805 > http [ACK] Seq=98 Ack=2825057 Win=921984 Len=0 TSval=27678431 TSecr=689069169
514   0.444807 54.192.30.188 -> 172.31.36.109 TCP 8754 [TCP segment of a reassembled PDU]
515   0.444815 172.31.36.109 -> 54.192.30.188 TCP 66 42805 > http [ACK] Seq=98 Ack=2833745 Win=958848 Len=0 TSval=27678431 TSecr=689069169
516   0.445087 54.192.30.188 -> 172.31.36.109 TCP 10202 [TCP segment of a reassembled PDU]
517   0.445124 54.192.30.188 -> 172.31.36.109 TCP 18890 [TCP segment of a reassembled PDU]
518   0.445134 54.192.30.188 -> 172.31.36.109 TCP 2962 [TCP segment of a reassembled PDU]
519   0.445143 54.192.30.188 -> 172.31.36.109 TCP 11650 [TCP segment of a reassembled PDU]
520   0.445168 54.192.30.188 -> 172.31.36.109 TCP 6234 [TCP segment of a reassembled PDU]
521   0.445319 172.31.36.109 -> 54.192.30.188 TCP 66 42805 > http [ACK] Seq=98 Ack=2883353 Win=909312 Len=0 TSval=27678431 TSecr=689069169
522   0.478623 54.192.30.188 -> 172.31.36.109 TCP 1514 [TCP segment of a reassembled PDU]
523   0.478848 54.192.30.188 -> 172.31.36.109 TCP 4410 [TCP segment of a reassembled PDU]
524   0.478854 172.31.36.109 -> 54.192.30.188 TCP 66 42805 > http [ACK] Seq=98 Ack=2889145 Win=966016 Len=0 TSval=27678439 TSecr=689069172
525   0.479002 54.192.30.188 -> 172.31.36.109 TCP 20338 [TCP segment of a reassembled PDU]
526   0.479016 54.192.30.188 -> 172.31.36.109 TCP 5858 [TCP segment of a reassembled PDU]
527   0.479032 172.31.36.109 -> 54.192.30.188 TCP 66 42805 > http [ACK] Seq=98 Ack=2915209 Win=940032 Len=0 TSval=27678439 TSecr=689069172
528   0.479215 54.192.30.188 -> 172.31.36.109 TCP 14546 [TCP segment of a reassembled PDU]
529   0.479224 172.31.36.109 -> 54.192.30.188 TCP 66 42805 > http [ACK] Seq=98 Ack=2929689 Win=949248 Len=0 TSval=27678439 TSecr=689069172
530   0.479235 54.192.30.188 -> 172.31.36.109 TCP 7306 [TCP segment of a reassembled PDU]
531   0.479256 172.31.36.109 -> 54.192.30.188 TCP 66 42805 > http [ACK] Seq=98 Ack=2936929 Win=961280 Len=0 TSval=27678439 TSecr=689069172
532   0.479404 54.192.30.188 -> 172.31.36.109 TCP 12026 [TCP segment of a reassembled PDU]
533   0.479426 172.31.36.109 -> 54.192.30.188 TCP 66 42805 > http [ACK] Seq=98 Ack=2948889 Win=970880 Len=0 TSval=27678440 TSecr=689069172
534   0.519346 54.192.30.188 -> 172.31.36.109 TCP 1514 [TCP segment of a reassembled PDU]
535   0.519356 54.192.30.188 -> 172.31.36.109 TCP 13098 [TCP segment of a reassembled PDU]
536   0.519380 172.31.36.109 -> 54.192.30.188 TCP 66 42805 > http [ACK] Seq=98 Ack=2963369 Win=970880 Len=0 TSval=27678449 TSecr=689069177
537   0.519768 54.192.30.188 -> 172.31.36.109 TCP 23234 [TCP segment of a reassembled PDU]
538   0.519782 54.192.30.188 -> 172.31.36.109 TCP 1514 [TCP segment of a reassembled PDU]
539   0.519797 54.192.30.188 -> 172.31.36.109 TCP 5858 [TCP segment of a reassembled PDU]
540   0.519808 172.31.36.109 -> 54.192.30.188 TCP 66 42805 > http [ACK] Seq=98 Ack=2993777 Win=940544 Len=0 TSval=27678450 TSecr=689069177
541   0.519955 54.192.30.188 -> 172.31.36.109 TCP 2962 [TCP segment of a reassembled PDU]
542   0.519960 172.31.36.109 -> 54.192.30.188 TCP 66 42805 > http [ACK] Seq=98 Ack=2996673 Win=968320 Len=0 TSval=27678450 TSecr=689069177
543   0.519977 54.192.30.188 -> 172.31.36.109 TCP 17442 [TCP segment of a reassembled PDU]
544   0.520022 54.192.30.188 -> 172.31.36.109 TCP 442 [TCP segment of a reassembled PDU]
545   0.520074 172.31.36.109 -> 54.192.30.188 TCP 66 42805 > http [ACK] Seq=98 Ack=3014425 Win=950656 Len=0 TSval=27678450 TSecr=689069177
546   0.520345 54.192.30.188 -> 172.31.36.109 TCP 1514 [TCP segment of a reassembled PDU]
547   0.520610 54.192.30.188 -> 172.31.36.109 TCP 5858 [TCP segment of a reassembled PDU]
548   0.520617 172.31.36.109 -> 54.192.30.188 TCP 66 42805 > http [ACK] Seq=98 Ack=3021665 Win=963584 Len=0 TSval=27678450 TSecr=689069177
549   0.520685 54.192.30.188 -> 172.31.36.109 TCP 13098 [TCP segment of a reassembled PDU]
550   0.520704 172.31.36.109 -> 54.192.30.188 TCP 66 42805 > http [ACK] Seq=98 Ack=3034697 Win=970880 Len=0 TSval=27678450 TSecr=689069177
551   0.520864 54.192.30.188 -> 172.31.36.109 TCP 5858 [TCP segment of a reassembled PDU]
552   0.520875 54.192.30.188 -> 172.31.36.109 TCP 8754 [TCP segment of a reassembled PDU]
553   0.520899 172.31.36.109 -> 54.192.30.188 TCP 66 42805 > http [ACK] Seq=98 Ack=3049177 Win=970880 Len=0 TSval=27678450 TSecr=689069177
554   0.520992 54.192.30.188 -> 172.31.36.109 TCP 10202 [TCP segment of a reassembled PDU]
555   0.521010 172.31.36.109 -> 54.192.30.188 TCP 66 42805 > http [ACK] Seq=98 Ack=3059313 Win=970880 Len=0 TSval=27678450 TSecr=689069177
556   0.521294 54.192.30.188 -> 172.31.36.109 TCP 1514 [TCP segment of a reassembled PDU]
557   0.521307 54.192.30.188 -> 172.31.36.109 TCP 23234 [TCP segment of a reassembled PDU]
558   0.521331 54.192.30.188 -> 172.31.36.109 TCP 13098 [TCP segment of a reassembled PDU]
559   0.521349 172.31.36.109 -> 54.192.30.188 TCP 66 42805 > http [ACK] Seq=98 Ack=3096961 Win=933248 Len=0 TSval=27678450 TSecr=689069177
560   0.521420 54.192.30.188 -> 172.31.36.109 TCP 10202 [TCP segment of a reassembled PDU]
561   0.521427 172.31.36.109 -> 54.192.30.188 TCP 66 42805 > http [ACK] Seq=98 Ack=3107097 Win=956544 Len=0 TSval=27678450 TSecr=689069177
562   0.521598 54.192.30.188 -> 172.31.36.109 TCP 4410 [TCP segment of a reassembled PDU]
563   0.521603 172.31.36.109 -> 54.192.30.188 TCP 66 42805 > http [ACK] Seq=98 Ack=3111441 Win=966016 Len=0 TSval=27678450 TSecr=689069177
564   0.521753 54.192.30.188 -> 172.31.36.109 TCP 15994 [TCP segment of a reassembled PDU]
565   0.521770 54.192.30.188 -> 172.31.36.109 TCP 11650 [TCP segment of a reassembled PDU]
566   0.521918 54.192.30.188 -> 172.31.36.109 TCP 6610 [TCP segment of a reassembled PDU]
567   0.521977 172.31.36.109 -> 54.192.30.188 TCP 66 42805 > http [ACK] Seq=98 Ack=3145497 Win=942208 Len=0 TSval=27678450 TSecr=689069177
568   0.523107 54.192.30.188 -> 172.31.36.109 TCP 1514 [TCP segment of a reassembled PDU]
569   0.523410 54.192.30.188 -> 172.31.36.109 TCP 1514 [TCP segment of a reassembled PDU]
570   0.523414 172.31.36.109 -> 54.192.30.188 TCP 66 42805 > http [ACK] Seq=98 Ack=3148393 Win=970752 Len=0 TSval=27678451 TSecr=689069177
571   0.523506 54.192.30.188 -> 172.31.36.109 TCP 15994 [TCP segment of a reassembled PDU]
572   0.523536 172.31.36.109 -> 54.192.30.188 TCP 66 42805 > http [ACK] Seq=98 Ack=3164321 Win=970880 Len=0 TSval=27678451 TSecr=689069177
573   0.523705 54.192.30.188 -> 172.31.36.109 TCP 7306 [TCP segment of a reassembled PDU]
574   0.523719 54.192.30.188 -> 172.31.36.109 TCP 21786 [TCP segment of a reassembled PDU]
575   0.523732 54.192.30.188 -> 172.31.36.109 TCP 2962 [TCP segment of a reassembled PDU]
576   0.523747 172.31.36.109 -> 54.192.30.188 TCP 66 42805 > http [ACK] Seq=98 Ack=3196177 Win=939136 Len=0 TSval=27678451 TSecr=689069177
577   0.523799 54.192.30.188 -> 172.31.36.109 TCP 14922 [TCP segment of a reassembled PDU]
578   0.523807 172.31.36.109 -> 54.192.30.188 TCP 66 42805 > http [ACK] Seq=98 Ack=3211033 Win=946944 Len=0 TSval=27678451 TSecr=689069177
579   0.531062 54.192.30.188 -> 172.31.36.109 TCP 1514 [TCP segment of a reassembled PDU]
580   0.531178 54.192.30.188 -> 172.31.36.109 TCP 1514 [TCP segment of a reassembled PDU]
581   0.531183 172.31.36.109 -> 54.192.30.188 TCP 66 42805 > http [ACK] Seq=98 Ack=3213929 Win=970752 Len=0 TSval=27678452 TSecr=689069178
582   0.531500 54.192.30.188 -> 172.31.36.109 TCP 23234 [TCP segment of a reassembled PDU]
583   0.531524 54.192.30.188 -> 172.31.36.109 TCP 7306 [TCP segment of a reassembled PDU]
584   0.531545 54.192.30.188 -> 172.31.36.109 TCP 13098 [TCP segment of a reassembled PDU]
585   0.531564 172.31.36.109 -> 54.192.30.188 TCP 66 42805 > http [ACK] Seq=98 Ack=3257369 Win=927360 Len=0 TSval=27678453 TSecr=689069178
586   0.531652 54.192.30.188 -> 172.31.36.109 TCP 13098 [TCP segment of a reassembled PDU]
587   0.531660 172.31.36.109 -> 54.192.30.188 TCP 66 42805 > http [ACK] Seq=98 Ack=3270401 Win=951808 Len=0 TSval=27678453 TSecr=689069178
588   0.531670 54.192.30.188 -> 172.31.36.109 TCP 2962 [TCP segment of a reassembled PDU]
589   0.531804 172.31.36.109 -> 54.192.30.188 TCP 66 42805 > http [ACK] Seq=98 Ack=3273297 Win=970880 Len=0 TSval=27678453 TSecr=689069178
590   0.531959 54.192.30.188 -> 172.31.36.109 TCP 17442 [TCP segment of a reassembled PDU]
591   0.531984 54.192.30.188 -> 172.31.36.109 TCP 20338 [TCP segment of a reassembled PDU]
592   0.532016 172.31.36.109 -> 54.192.30.188 TCP 66 42805 > http [ACK] Seq=98 Ack=3310945 Win=933248 Len=0 TSval=27678453 TSecr=689069178
593   0.532132 54.192.30.188 -> 172.31.36.109 TCP 1514 [TCP segment of a reassembled PDU]
594   0.532146 54.192.30.188 -> 172.31.36.109 TCP 21786 [TCP segment of a reassembled PDU]
595   0.532156 172.31.36.109 -> 54.192.30.188 TCP 66 42805 > http [ACK] Seq=98 Ack=3334113 Win=934912 Len=0 TSval=27678453 TSecr=689069178
596   0.532394 54.192.30.188 -> 172.31.36.109 TCP 8058 [TCP segment of a reassembled PDU]
597   0.532401 172.31.36.109 -> 54.192.30.188 TCP 66 42805 > http [ACK] Seq=98 Ack=3342105 Win=958848 Len=0 TSval=27678453 TSecr=689069178
598   0.543104 54.192.30.188 -> 172.31.36.109 TCP 2962 [TCP segment of a reassembled PDU]
599   0.543114 172.31.36.109 -> 54.192.30.188 TCP 66 42805 > http [ACK] Seq=98 Ack=3345001 Win=968320 Len=0 TSval=27678455 TSecr=689069179
600   0.543185 54.192.30.188 -> 172.31.36.109 TCP 1514 [TCP segment of a reassembled PDU]
601   0.543469 54.192.30.188 -> 172.31.36.109 TCP 11650 [TCP segment of a reassembled PDU]
602   0.543493 54.192.30.188 -> 172.31.36.109 TCP 14546 [TCP segment of a reassembled PDU]
603   0.543527 54.192.30.188 -> 172.31.36.109 TCP 4410 [TCP segment of a reassembled PDU]
604   0.543636 54.192.30.188 -> 172.31.36.109 TCP 5858 [TCP segment of a reassembled PDU]
605   0.543651 54.192.30.188 -> 172.31.36.109 TCP 13098 [TCP segment of a reassembled PDU]
606   0.543670 54.192.30.188 -> 172.31.36.109 TCP 1514 [TCP segment of a reassembled PDU]
607   0.543755 172.31.36.109 -> 54.192.30.188 TCP 66 42805 > http [ACK] Seq=98 Ack=3397129 Win=916224 Len=0 TSval=27678456 TSecr=689069179
608   0.543846 54.192.30.188 -> 172.31.36.109 TCP 4410 [TCP segment of a reassembled PDU]
609   0.543853 172.31.36.109 -> 54.192.30.188 TCP 66 42805 > http [ACK] Seq=98 Ack=3401473 Win=966016 Len=0 TSval=27678456 TSecr=689069179
610   0.543934 54.192.30.188 -> 172.31.36.109 TCP 6234 [TCP segment of a reassembled PDU]
611   0.543953 172.31.36.109 -> 54.192.30.188 TCP 66 42805 > http [ACK] Seq=98 Ack=3407641 Win=970880 Len=0 TSval=27678456 TSecr=689069179
612   0.660726 54.192.30.188 -> 172.31.36.109 TCP 8754 [TCP segment of a reassembled PDU]
613   0.660744 54.192.30.188 -> 172.31.36.109 TCP 4410 [TCP segment of a reassembled PDU]
614   0.660782 172.31.36.109 -> 54.192.30.188 TCP 66 42805 > http [ACK] Seq=98 Ack=3420673 Win=970880 Len=0 TSval=27678485 TSecr=689069191
615   0.660986 54.192.30.188 -> 172.31.36.109 TCP 14546 [TCP segment of a reassembled PDU]
616   0.661010 172.31.36.109 -> 54.192.30.188 TCP 66 42805 > http [ACK] Seq=98 Ack=3435153 Win=970880 Len=0 TSval=27678485 TSecr=689069191
617   0.661106 54.192.30.188 -> 172.31.36.109 TCP 10202 [TCP segment of a reassembled PDU]
618   0.661124 54.192.30.188 -> 172.31.36.109 TCP 11650 [TCP segment of a reassembled PDU]
619   0.661143 172.31.36.109 -> 54.192.30.188 TCP 66 42805 > http [ACK] Seq=98 Ack=3456873 Win=954112 Len=0 TSval=27678485 TSecr=689069191
620   0.661247 54.192.30.188 -> 172.31.36.109 TCP 1514 [TCP segment of a reassembled PDU]
621   0.661417 54.192.30.188 -> 172.31.36.109 TCP 1514 [TCP segment of a reassembled PDU]
622   0.661421 172.31.36.109 -> 54.192.30.188 TCP 66 42805 > http [ACK] Seq=98 Ack=3459769 Win=970752 Len=0 TSval=27678485 TSecr=689069191
623   0.661531 54.192.30.188 -> 172.31.36.109 TCP 8754 [TCP segment of a reassembled PDU]
624   0.661549 172.31.36.109 -> 54.192.30.188 TCP 66 42805 > http [ACK] Seq=98 Ack=3468457 Win=970880 Len=0 TSval=27678485 TSecr=689069191
625   0.661730 54.192.30.188 -> 172.31.36.109 TCP 4786 [TCP segment of a reassembled PDU]
626   0.661750 172.31.36.109 -> 54.192.30.188 TCP 66 42805 > http [ACK] Seq=98 Ack=3473177 Win=970880 Len=0 TSval=27678485 TSecr=689069191
627   0.664532 54.192.30.188 -> 172.31.36.109 TCP 1514 [TCP segment of a reassembled PDU]
628   0.664783 54.192.30.188 -> 172.31.36.109 TCP 2962 [TCP segment of a reassembled PDU]
629   0.664800 172.31.36.109 -> 54.192.30.188 TCP 66 42805 > http [ACK] Seq=98 Ack=3477521 Win=970880 Len=0 TSval=27678486 TSecr=689069191
630   0.664900 54.192.30.188 -> 172.31.36.109 TCP 15994 [TCP segment of a reassembled PDU]
631   0.665161 54.192.30.188 -> 172.31.36.109 TCP 5858 [TCP segment of a reassembled PDU]
632   0.665178 54.192.30.188 -> 172.31.36.109 TCP 14546 [TCP segment of a reassembled PDU]
633   0.665188 54.192.30.188 -> 172.31.36.109 TCP 5858 [TCP segment of a reassembled PDU]
634   0.665206 54.192.30.188 -> 172.31.36.109 TCP 5858 [TCP segment of a reassembled PDU]
635   0.665234 172.31.36.109 -> 54.192.30.188 TCP 66 42805 > http [ACK] Seq=98 Ack=3525305 Win=923136 Len=0 TSval=27678486 TSecr=689069191
636   0.665371 54.192.30.188 -> 172.31.36.109 TCP 17442 [TCP segment of a reassembled PDU]
637   0.665380 172.31.36.109 -> 54.192.30.188 TCP 66 42805 > http [ACK] Seq=98 Ack=3542681 Win=944512 Len=0 TSval=27678486 TSecr=689069191
638   0.665395 54.192.30.188 -> 172.31.36.109 TCP 11650 [TCP segment of a reassembled PDU]
639   0.665420 172.31.36.109 -> 54.192.30.188 TCP 66 42805 > http [ACK] Seq=98 Ack=3554265 Win=932992 Len=0 TSval=27678486 TSecr=689069191
640   0.665760 54.192.30.188 -> 172.31.36.109 TCP 11650 [TCP segment of a reassembled PDU]
641   0.665768 172.31.36.109 -> 54.192.30.188 TCP 66 42805 > http [ACK] Seq=98 Ack=3565849 Win=954112 Len=0 TSval=27678486 TSecr=689069191
642   0.665797 54.192.30.188 -> 172.31.36.109 TCP 10202 [TCP segment of a reassembled PDU]
643   0.665816 172.31.36.109 -> 54.192.30.188 TCP 66 42805 > http [ACK] Seq=98 Ack=3575985 Win=956544 Len=0 TSval=27678486 TSecr=689069191
644   0.665940 54.192.30.188 -> 172.31.36.109 TCP 11650 [TCP segment of a reassembled PDU]
645   0.665962 54.192.30.188 -> 172.31.36.109 TCP 23234 [TCP segment of a reassembled PDU]
646   0.665990 54.192.30.188 -> 172.31.36.109 TCP 4410 [TCP segment of a reassembled PDU]
647   0.666011 172.31.36.109 -> 54.192.30.188 TCP 66 42805 > http [ACK] Seq=98 Ack=3615081 Win=927872 Len=0 TSval=27678486 TSecr=689069191
648   0.666124 54.192.30.188 -> 172.31.36.109 TCP 10202 [TCP segment of a reassembled PDU]
649   0.666132 172.31.36.109 -> 54.192.30.188 TCP 66 42805 > http [ACK] Seq=98 Ack=3625217 Win=956544 Len=0 TSval=27678486 TSecr=689069191
650   0.666243 54.192.30.188 -> 172.31.36.109 TCP 5858 [TCP segment of a reassembled PDU]
651   0.666288 172.31.36.109 -> 54.192.30.188 TCP 66 42805 > http [ACK] Seq=98 Ack=3631009 Win=970880 Len=0 TSval=27678486 TSecr=689069191
652   0.666410 54.192.30.188 -> 172.31.36.109 TCP 7306 [TCP segment of a reassembled PDU]
653   0.666434 172.31.36.109 -> 54.192.30.188 TCP 66 42805 > http [ACK] Seq=98 Ack=3638249 Win=970880 Len=0 TSval=27678486 TSecr=689069191
654   0.666660 54.192.30.188 -> 172.31.36.109 TCP 10202 [TCP segment of a reassembled PDU]
655   0.666691 172.31.36.109 -> 54.192.30.188 TCP 66 42805 > http [ACK] Seq=98 Ack=3648385 Win=970880 Len=0 TSval=27678486 TSecr=689069191
656   0.666766 54.192.30.188 -> 172.31.36.109 TCP 23234 [TCP segment of a reassembled PDU]
657   0.666790 172.31.36.109 -> 54.192.30.188 TCP 66 42805 > http [ACK] Seq=98 Ack=3671553 Win=947712 Len=0 TSval=27678486 TSecr=689069191
658   0.666811 54.192.30.188 -> 172.31.36.109 TCP 1514 [TCP segment of a reassembled PDU]
659   0.666984 54.192.30.188 -> 172.31.36.109 TCP 4410 [TCP segment of a reassembled PDU]
660   0.666990 172.31.36.109 -> 54.192.30.188 TCP 66 42805 > http [ACK] Seq=98 Ack=3677345 Win=966016 Len=0 TSval=27678486 TSecr=689069191
661   0.667004 54.192.30.188 -> 172.31.36.109 TCP 21786 [TCP segment of a reassembled PDU]
662   0.667015 54.192.30.188 -> 172.31.36.109 TCP 1514 [TCP segment of a reassembled PDU]
663   0.667030 54.192.30.188 -> 172.31.36.109 TCP 5858 [TCP segment of a reassembled PDU]
664   0.667043 172.31.36.109 -> 54.192.30.188 TCP 66 42805 > http [ACK] Seq=98 Ack=3706305 Win=937088 Len=0 TSval=27678486 TSecr=689069191
665   0.667128 54.192.30.188 -> 172.31.36.109 TCP 8754 [TCP segment of a reassembled PDU]
666   0.667135 172.31.36.109 -> 54.192.30.188 TCP 66 42805 > http [ACK] Seq=98 Ack=3714993 Win=958848 Len=0 TSval=27678486 TSecr=689069191
667   0.667238 54.192.30.188 -> 172.31.36.109 TCP 8754 [TCP segment of a reassembled PDU]
668   0.667245 172.31.36.109 -> 54.192.30.188 TCP 66 42805 > http [ACK] Seq=98 Ack=3723681 Win=958848 Len=0 TSval=27678486 TSecr=689069191
669   0.667466 54.192.30.188 -> 172.31.36.109 TCP 21786 [TCP segment of a reassembled PDU]
670   0.667497 172.31.36.109 -> 54.192.30.188 TCP 66 42805 > http [ACK] Seq=98 Ack=3745401 Win=937472 Len=0 TSval=27678487 TSecr=689069191
671   0.667584 54.192.30.188 -> 172.31.36.109 TCP 23234 [TCP segment of a reassembled PDU]
672   0.667609 172.31.36.109 -> 54.192.30.188 TCP 66 42805 > http [ACK] Seq=98 Ack=3768569 Win=935040 Len=0 TSval=27678487 TSecr=689069191
673   0.667673 54.192.30.188 -> 172.31.36.109 TCP 11650 [TCP segment of a reassembled PDU]
674   0.667681 172.31.36.109 -> 54.192.30.188 TCP 66 42805 > http [ACK] Seq=98 Ack=3780153 Win=954112 Len=0 TSval=27678487 TSecr=689069191
675   0.667748 54.192.30.188 -> 172.31.36.109 TCP 2962 [TCP segment of a reassembled PDU]
676   0.667753 172.31.36.109 -> 54.192.30.188 TCP 66 42805 > http [ACK] Seq=98 Ack=3783049 Win=968320 Len=0 TSval=27678487 TSecr=689069191
677   0.668004 54.192.30.188 -> 172.31.36.109 TCP 17874 [TCP segment of a reassembled PDU]
678   0.668028 172.31.36.109 -> 54.192.30.188 TCP 66 42805 > http [ACK] Seq=98 Ack=3800857 Win=950528 Len=0 TSval=27678487 TSecr=689069191
679   0.671466 54.192.30.188 -> 172.31.36.109 TCP 1514 [TCP segment of a reassembled PDU]
680   0.671473 54.192.30.188 -> 172.31.36.109 TCP 2962 [TCP segment of a reassembled PDU]
681   0.671477 172.31.36.109 -> 54.192.30.188 TCP 66 42805 > http [ACK] Seq=98 Ack=3805201 Win=966016 Len=0 TSval=27678488 TSecr=689069192
682   0.671635 54.192.30.188 -> 172.31.36.109 TCP 21786 [TCP segment of a reassembled PDU]
683   0.671667 172.31.36.109 -> 54.192.30.188 TCP 66 42805 > http [ACK] Seq=98 Ack=3826921 Win=944384 Len=0 TSval=27678488 TSecr=689069192
684   0.671879 54.192.30.188 -> 172.31.36.109 TCP 7306 [TCP segment of a reassembled PDU]
685   0.671886 172.31.36.109 -> 54.192.30.188 TCP 66 42805 > http [ACK] Seq=98 Ack=3834161 Win=961280 Len=0 TSval=27678488 TSecr=689069192
686   0.671965 54.192.30.188 -> 172.31.36.109 TCP 2962 [TCP segment of a reassembled PDU]
687   0.671970 172.31.36.109 -> 54.192.30.188 TCP 66 42805 > http [ACK] Seq=98 Ack=3837057 Win=968320 Len=0 TSval=27678488 TSecr=689069192
688   0.672206 54.192.30.188 -> 172.31.36.109 TCP 14546 [TCP segment of a reassembled PDU]
