[Measurement for 10mb at 05:30:29 20.30.2014] 
Tshark:

  1   0.000000 172.31.36.109 -> 172.31.0.2   DNS 89 Standard query 0x43d2  A d39wppo36gwqpx.cloudfront.net
  2   0.000031 172.31.36.109 -> 172.31.0.2   DNS 89 Standard query 0x808e  AAAA d39wppo36gwqpx.cloudfront.net
  3   0.000632   172.31.0.2 -> 172.31.36.109 DNS 217 Standard query response 0x43d2  A 54.230.21.185 A 54.230.22.101 A 54.230.22.220 A 54.230.23.11 A 54.230.23.117 A 216.137.41.122 A 54.230.20.192 A 54.230.21.160
  4   0.000642   172.31.0.2 -> 172.31.36.109 DNS 170 Standard query response 0x808e 
  5   0.003911 172.31.36.109 -> 54.230.21.185 TCP 74 47250 > http [SYN] Seq=0 Win=26883 Len=0 MSS=8961 SACK_PERM=1 TSval=31279061 TSecr=0 WS=128
  6   0.090518 54.230.21.185 -> 172.31.36.109 TCP 74 http > 47250 [SYN, ACK] Seq=0 Ack=1 Win=14480 Len=0 MSS=1460 SACK_PERM=1 TSval=935556575 TSecr=31279061 WS=128
  7   0.090534 172.31.36.109 -> 54.230.21.185 TCP 66 47250 > http [ACK] Seq=1 Ack=1 Win=27008 Len=0 TSval=31279083 TSecr=935556575
  8   0.090581 172.31.36.109 -> 54.230.21.185 HTTP 163 GET /10mb HTTP/1.1 
  9   0.176713 54.230.21.185 -> 172.31.36.109 TCP 66 http > 47250 [ACK] Seq=1 Ack=98 Win=14592 Len=0 TSval=935556584 TSecr=31279083
 10   0.188534 54.230.21.185 -> 172.31.36.109 TCP 14546 [TCP segment of a reassembled PDU]
 11   0.188548 172.31.36.109 -> 54.230.21.185 TCP 66 47250 > http [ACK] Seq=98 Ack=14481 Win=55936 Len=0 TSval=31279108 TSecr=935556585
 12   0.274824 54.230.21.185 -> 172.31.36.109 TCP 13098 [TCP segment of a reassembled PDU]
 13   0.274838 172.31.36.109 -> 54.230.21.185 TCP 66 47250 > http [ACK] Seq=98 Ack=27513 Win=81920 Len=0 TSval=31279129 TSecr=935556594
 14   0.361000 54.230.21.185 -> 172.31.36.109 TCP 1514 [TCP segment of a reassembled PDU]
 15   0.361007 172.31.36.109 -> 54.230.21.185 TCP 66 47250 > http [ACK] Seq=98 Ack=28961 Win=84864 Len=0 TSval=31279151 TSecr=935556602
 16   0.361190 54.230.21.185 -> 172.31.36.109 TCP 2962 [TCP segment of a reassembled PDU]
 17   0.361195 172.31.36.109 -> 54.230.21.185 TCP 66 47250 > http [ACK] Seq=98 Ack=31857 Win=90624 Len=0 TSval=31279151 TSecr=935556602
 18   0.361211 54.230.21.185 -> 172.31.36.109 TCP 8754 [TCP segment of a reassembled PDU]
 19   0.361219 172.31.36.109 -> 54.230.21.185 TCP 66 47250 > http [ACK] Seq=98 Ack=40545 Win=98944 Len=0 TSval=31279151 TSecr=935556602
 20   0.447516 54.230.21.185 -> 172.31.36.109 TCP 21786 [TCP segment of a reassembled PDU]
