[Measurement for 10mb at 09:30:32 20.30.2014] 
Tshark:

  1   0.000000 172.31.36.109 -> 172.31.0.2   DNS 89 Standard query 0xcc77  A d39wppo36gwqpx.cloudfront.net
  2   0.000041 172.31.36.109 -> 172.31.0.2   DNS 89 Standard query 0xd2d3  AAAA d39wppo36gwqpx.cloudfront.net
  3   0.000613   172.31.0.2 -> 172.31.36.109 DNS 217 Standard query response 0xcc77  A 54.230.184.251 A 54.230.185.183 A 54.230.185.254 A 54.230.186.130 A 54.230.187.27 A 54.230.187.225 A 54.239.158.219 A 54.230.184.236
  4   0.000624   172.31.0.2 -> 172.31.36.109 DNS 170 Standard query response 0xd2d3 
  5   0.003848 172.31.36.109 -> 54.230.184.251 TCP 74 55189 > http [SYN] Seq=0 Win=26883 Len=0 MSS=8961 SACK_PERM=1 TSval=34879672 TSecr=0 WS=128
  6   0.021887 54.230.184.251 -> 172.31.36.109 TCP 74 http > 55189 [SYN, ACK] Seq=0 Ack=1 Win=14480 Len=0 MSS=1460 SACK_PERM=1 TSval=1756878759 TSecr=34879672 WS=128
  7   0.021904 172.31.36.109 -> 54.230.184.251 TCP 66 55189 > http [ACK] Seq=1 Ack=1 Win=27008 Len=0 TSval=34879677 TSecr=1756878759
  8   0.021956 172.31.36.109 -> 54.230.184.251 HTTP 163 GET /10mb HTTP/1.1 
  9   0.039883 54.230.184.251 -> 172.31.36.109 TCP 66 http > 55189 [ACK] Seq=1 Ack=98 Win=14592 Len=0 TSval=1756878761 TSecr=34879677
 10   0.536529 54.230.184.251 -> 172.31.36.109 TCP 13529 [TCP segment of a reassembled PDU]
 11   0.536557 172.31.36.109 -> 54.230.184.251 TCP 66 55189 > http [ACK] Seq=98 Ack=13464 Win=53888 Len=0 TSval=34879805 TSecr=1756878811
 12   0.744097 54.230.184.251 -> 172.31.36.109 TCP 2974 [TCP segment of a reassembled PDU]
