[Measurement for 10mb at 00:42:53 20.42.2014] 
Tshark:

  1   0.000000 172.31.8.238 -> 172.31.0.2   DNS 88 Standard query 0x8807  A dm53kc3eax57k.cloudfront.net
  2   0.000039 172.31.8.238 -> 172.31.0.2   DNS 88 Standard query 0x4015  AAAA dm53kc3eax57k.cloudfront.net
  3   0.000748   172.31.0.2 -> 172.31.8.238 DNS 175 Standard query response 0x4015 
  4   0.000759   172.31.0.2 -> 172.31.8.238 DNS 216 Standard query response 0x8807  A 54.192.118.222 A 54.192.118.246 A 54.230.116.73 A 54.230.116.82 A 54.230.118.214 A 54.230.118.235 A 54.230.119.106 A 54.239.132.84
  5   0.003856 172.31.8.238 -> 54.192.118.222 TCP 74 34977 > http [SYN] Seq=0 Win=26883 Len=0 MSS=8961 SACK_PERM=1 TSval=6950192 TSecr=0 WS=128
  6   0.004433 54.192.118.222 -> 172.31.8.238 TCP 74 http > 34977 [SYN, ACK] Seq=0 Ack=1 Win=14480 Len=0 MSS=1460 SACK_PERM=1 TSval=1684445648 TSecr=6950192 WS=128
  7   0.004447 172.31.8.238 -> 54.192.118.222 TCP 66 34977 > http [ACK] Seq=1 Ack=1 Win=27008 Len=0 TSval=6950192 TSecr=1684445648
  8   0.004497 172.31.8.238 -> 54.192.118.222 HTTP 162 GET /10mb HTTP/1.1 
  9   0.005046 54.192.118.222 -> 172.31.8.238 TCP 66 http > 34977 [ACK] Seq=1 Ack=97 Win=14592 Len=0 TSval=1684445648 TSecr=6950192
 10   0.007162 54.192.118.222 -> 172.31.8.238 TCP 2580 [TCP segment of a reassembled PDU]
 11   0.007170 172.31.8.238 -> 54.192.118.222 TCP 66 34977 > http [ACK] Seq=97 Ack=2515 Win=32000 Len=0 TSval=6950193 TSecr=1684445648
 12   0.007415 54.192.118.222 -> 172.31.8.238 TCP 5858 [TCP segment of a reassembled PDU]
 13   0.007424 172.31.8.238 -> 54.192.118.222 TCP 66 34977 > http [ACK] Seq=97 Ack=8307 Win=43520 Len=0 TSval=6950193 TSecr=1684445648
 14   0.007528 54.192.118.222 -> 172.31.8.238 TCP 5858 [TCP segment of a reassembled PDU]
 15   0.007535 172.31.8.238 -> 54.192.118.222 TCP 66 34977 > http [ACK] Seq=97 Ack=14099 Win=55168 Len=0 TSval=6950193 TSecr=1684445648
 16   0.008093 54.192.118.222 -> 172.31.8.238 TCP 11650 [TCP segment of a reassembled PDU]
 17   0.008104 172.31.8.238 -> 54.192.118.222 TCP 66 34977 > http [ACK] Seq=97 Ack=25683 Win=78336 Len=0 TSval=6950193 TSecr=1684445648
 18   0.008125 54.192.118.222 -> 172.31.8.238 TCP 1514 [TCP segment of a reassembled PDU]
 19   0.008134 172.31.8.238 -> 54.192.118.222 TCP 66 34977 > http [ACK] Seq=97 Ack=27131 Win=81152 Len=0 TSval=6950193 TSecr=1684445648
 20   0.008732 54.192.118.222 -> 172.31.8.238 TCP 5858 [TCP segment of a reassembled PDU]
 21   0.008739 172.31.8.238 -> 54.192.118.222 TCP 66 34977 > http [ACK] Seq=97 Ack=32923 Win=92800 Len=0 TSval=6950193 TSecr=1684445648
 22   0.008855 54.192.118.222 -> 172.31.8.238 TCP 15994 [TCP segment of a reassembled PDU]
 23   0.008866 172.31.8.238 -> 54.192.118.222 TCP 66 34977 > http [ACK] Seq=97 Ack=48851 Win=91648 Len=0 TSval=6950193 TSecr=1684445648
 24   0.009188 54.192.118.222 -> 172.31.8.238 TCP 4410 [TCP segment of a reassembled PDU]
 25   0.009195 172.31.8.238 -> 54.192.118.222 TCP 66 34977 > http [ACK] Seq=97 Ack=53195 Win=101504 Len=0 TSval=6950193 TSecr=1684445648
 26   0.009465 54.192.118.222 -> 172.31.8.238 TCP 4410 [TCP segment of a reassembled PDU]
 27   0.009471 172.31.8.238 -> 54.192.118.222 TCP 66 34977 > http [ACK] Seq=97 Ack=57539 Win=109056 Len=0 TSval=6950193 TSecr=1684445648
 28   0.009566 54.192.118.222 -> 172.31.8.238 TCP 8754 [TCP segment of a reassembled PDU]
 29   0.009582 172.31.8.238 -> 54.192.118.222 TCP 66 34977 > http [ACK] Seq=97 Ack=66227 Win=103680 Len=0 TSval=6950193 TSecr=1684445648
 30   0.009698 54.192.118.222 -> 172.31.8.238 TCP 4410 [TCP segment of a reassembled PDU]
 31   0.009704 172.31.8.238 -> 54.192.118.222 TCP 66 34977 > http [ACK] Seq=97 Ack=70571 Win=109056 Len=0 TSval=6950193 TSecr=1684445648
 32   0.009806 54.192.118.222 -> 172.31.8.238 TCP 8754 [TCP segment of a reassembled PDU]
 33   0.009813 172.31.8.238 -> 54.192.118.222 TCP 66 34977 > http [ACK] Seq=97 Ack=79259 Win=103680 Len=0 TSval=6950193 TSecr=1684445648
 34   0.010242 54.192.118.222 -> 172.31.8.238 TCP 8754 [TCP segment of a reassembled PDU]
 35   0.010249 172.31.8.238 -> 54.192.118.222 TCP 66 34977 > http [ACK] Seq=97 Ack=87947 Win=103680 Len=0 TSval=6950193 TSecr=1684445648
 36   0.010356 54.192.118.222 -> 172.31.8.238 TCP 23234 [TCP segment of a reassembled PDU]
 37   0.010367 172.31.8.238 -> 54.192.118.222 TCP 66 34977 > http [ACK] Seq=97 Ack=111115 Win=80512 Len=0 TSval=6950193 TSecr=1684445648
 38   0.011215 54.192.118.222 -> 172.31.8.238 TCP 4410 [TCP segment of a reassembled PDU]
 39   0.011222 172.31.8.238 -> 54.192.118.222 TCP 66 34977 > http [ACK] Seq=97 Ack=115459 Win=109056 Len=0 TSval=6950194 TSecr=1684445648
 40   0.011368 54.192.118.222 -> 172.31.8.238 TCP 26130 [TCP segment of a reassembled PDU]
 41   0.011383 172.31.8.238 -> 54.192.118.222 TCP 66 34977 > http [ACK] Seq=97 Ack=141523 Win=161152 Len=0 TSval=6950194 TSecr=1684445648
 42   0.011388 54.192.118.222 -> 172.31.8.238 TCP 1514 [TCP segment of a reassembled PDU]
 43   0.011391 172.31.8.238 -> 54.192.118.222 TCP 66 34977 > http [ACK] Seq=97 Ack=142971 Win=164096 Len=0 TSval=6950194 TSecr=1684445648
 44   0.012068 54.192.118.222 -> 172.31.8.238 TCP 4410 [TCP segment of a reassembled PDU]
 45   0.012075 172.31.8.238 -> 54.192.118.222 TCP 66 34977 > http [ACK] Seq=97 Ack=147315 Win=172800 Len=0 TSval=6950194 TSecr=1684445648
 46   0.012262 54.192.118.222 -> 172.31.8.238 TCP 26130 [TCP segment of a reassembled PDU]
 47   0.012276 172.31.8.238 -> 54.192.118.222 TCP 66 34977 > http [ACK] Seq=97 Ack=173379 Win=224896 Len=0 TSval=6950194 TSecr=1684445648
 48   0.012292 54.192.118.222 -> 172.31.8.238 TCP 1514 [TCP segment of a reassembled PDU]
 49   0.012310 172.31.8.238 -> 54.192.118.222 TCP 66 34977 > http [ACK] Seq=97 Ack=174827 Win=227840 Len=0 TSval=6950194 TSecr=1684445648
 50   0.012763 54.192.118.222 -> 172.31.8.238 TCP 4410 [TCP segment of a reassembled PDU]
 51   0.012769 172.31.8.238 -> 54.192.118.222 TCP 66 34977 > http [ACK] Seq=97 Ack=179171 Win=236544 Len=0 TSval=6950194 TSecr=1684445649
 52   0.012943 54.192.118.222 -> 172.31.8.238 TCP 26130 [TCP segment of a reassembled PDU]
 53   0.012959 172.31.8.238 -> 54.192.118.222 TCP 66 34977 > http [ACK] Seq=97 Ack=205235 Win=288640 Len=0 TSval=6950194 TSecr=1684445649
 54   0.012980 54.192.118.222 -> 172.31.8.238 TCP 10202 [TCP segment of a reassembled PDU]
 55   0.012986 172.31.8.238 -> 54.192.118.222 TCP 66 34977 > http [ACK] Seq=97 Ack=215371 Win=308864 Len=0 TSval=6950194 TSecr=1684445649
 56   0.013524 54.192.118.222 -> 172.31.8.238 TCP 7306 [TCP segment of a reassembled PDU]
 57   0.013532 172.31.8.238 -> 54.192.118.222 TCP 66 34977 > http [ACK] Seq=97 Ack=222611 Win=323328 Len=0 TSval=6950194 TSecr=1684445649
 58   0.013666 54.192.118.222 -> 172.31.8.238 TCP 10202 [TCP segment of a reassembled PDU]
 59   0.013675 172.31.8.238 -> 54.192.118.222 TCP 66 34977 > http [ACK] Seq=97 Ack=232747 Win=343680 Len=0 TSval=6950194 TSecr=1684445649
 60   0.013916 54.192.118.222 -> 172.31.8.238 TCP 26130 [TCP segment of a reassembled PDU]
 61   0.013932 172.31.8.238 -> 54.192.118.222 TCP 66 34977 > http [ACK] Seq=97 Ack=258811 Win=395776 Len=0 TSval=6950194 TSecr=1684445649
 62   0.013940 54.192.118.222 -> 172.31.8.238 TCP 4410 [TCP segment of a reassembled PDU]
 63   0.013944 172.31.8.238 -> 54.192.118.222 TCP 66 34977 > http [ACK] Seq=97 Ack=263155 Win=404480 Len=0 TSval=6950194 TSecr=1684445649
 64   0.014349 54.192.118.222 -> 172.31.8.238 TCP 4410 [TCP segment of a reassembled PDU]
 65   0.014356 172.31.8.238 -> 54.192.118.222 TCP 66 34977 > http [ACK] Seq=97 Ack=267499 Win=413184 Len=0 TSval=6950194 TSecr=1684445649
 66   0.014526 54.192.118.222 -> 172.31.8.238 TCP 17442 [TCP segment of a reassembled PDU]
 67   0.014538 172.31.8.238 -> 54.192.118.222 TCP 66 34977 > http [ACK] Seq=97 Ack=284875 Win=447872 Len=0 TSval=6950194 TSecr=1684445649
 68   0.014558 54.192.118.222 -> 172.31.8.238 TCP 8754 [TCP segment of a reassembled PDU]
 69   0.014564 172.31.8.238 -> 54.192.118.222 TCP 66 34977 > http [ACK] Seq=97 Ack=293563 Win=465280 Len=0 TSval=6950194 TSecr=1684445649
 70   0.014633 54.192.118.222 -> 172.31.8.238 TCP 17442 [TCP segment of a reassembled PDU]
 71   0.014645 172.31.8.238 -> 54.192.118.222 TCP 66 34977 > http [ACK] Seq=97 Ack=310939 Win=499968 Len=0 TSval=6950194 TSecr=1684445649
 72   0.015316 54.192.118.222 -> 172.31.8.238 TCP 7306 [TCP segment of a reassembled PDU]
 73   0.015324 172.31.8.238 -> 54.192.118.222 TCP 66 34977 > http [ACK] Seq=97 Ack=318179 Win=514560 Len=0 TSval=6950195 TSecr=1684445649
 74   0.015494 54.192.118.222 -> 172.31.8.238 TCP 26130 [TCP segment of a reassembled PDU]
 75   0.015507 172.31.8.238 -> 54.192.118.222 TCP 66 34977 > http [ACK] Seq=97 Ack=344243 Win=566656 Len=0 TSval=6950195 TSecr=1684445649
 76   0.015565 54.192.118.222 -> 172.31.8.238 TCP 26130 [TCP segment of a reassembled PDU]
 77   0.015579 172.31.8.238 -> 54.192.118.222 TCP 66 34977 > http [ACK] Seq=97 Ack=370307 Win=618752 Len=0 TSval=6950195 TSecr=1684445649
 78   0.016079 54.192.118.222 -> 172.31.8.238 TCP 4410 [TCP segment of a reassembled PDU]
 79   0.016086 172.31.8.238 -> 54.192.118.222 TCP 66 34977 > http [ACK] Seq=97 Ack=374651 Win=627456 Len=0 TSval=6950195 TSecr=1684445649
 80   0.016260 54.192.118.222 -> 172.31.8.238 TCP 26130 [TCP segment of a reassembled PDU]
 81   0.016275 172.31.8.238 -> 54.192.118.222 TCP 66 34977 > http [ACK] Seq=97 Ack=400715 Win=679552 Len=0 TSval=6950195 TSecr=1684445649
 82   0.016336 54.192.118.222 -> 172.31.8.238 TCP 26130 [TCP segment of a reassembled PDU]
 83   0.016352 172.31.8.238 -> 54.192.118.222 TCP 66 34977 > http [ACK] Seq=97 Ack=426779 Win=731648 Len=0 TSval=6950195 TSecr=1684445649
 84   0.016392 54.192.118.222 -> 172.31.8.238 TCP 7306 [TCP segment of a reassembled PDU]
 85   0.016399 172.31.8.238 -> 54.192.118.222 TCP 66 34977 > http [ACK] Seq=97 Ack=434019 Win=746240 Len=0 TSval=6950195 TSecr=1684445649
 86   0.016918 54.192.118.222 -> 172.31.8.238 TCP 5858 [TCP segment of a reassembled PDU]
 87   0.016925 172.31.8.238 -> 54.192.118.222 TCP 66 34977 > http [ACK] Seq=97 Ack=439811 Win=757760 Len=0 TSval=6950195 TSecr=1684445649
 88   0.017123 54.192.118.222 -> 172.31.8.238 TCP 23234 [TCP segment of a reassembled PDU]
 89   0.017136 172.31.8.238 -> 54.192.118.222 TCP 66 34977 > http [ACK] Seq=97 Ack=462979 Win=804096 Len=0 TSval=6950195 TSecr=1684445649
 90   0.017257 54.192.118.222 -> 172.31.8.238 TCP 31922 [TCP segment of a reassembled PDU]
 91   0.017273 172.31.8.238 -> 54.192.118.222 TCP 66 34977 > http [ACK] Seq=97 Ack=494835 Win=867840 Len=0 TSval=6950195 TSecr=1684445649
 92   0.017668 54.192.118.222 -> 172.31.8.238 TCP 13098 [TCP segment of a reassembled PDU]
 93   0.017678 172.31.8.238 -> 54.192.118.222 TCP 66 34977 > http [ACK] Seq=97 Ack=507867 Win=893824 Len=0 TSval=6950195 TSecr=1684445649
 94   0.017830 54.192.118.222 -> 172.31.8.238 TCP 17442 [TCP segment of a reassembled PDU]
 95   0.017855 172.31.8.238 -> 54.192.118.222 TCP 66 34977 > http [ACK] Seq=97 Ack=525243 Win=928640 Len=0 TSval=6950195 TSecr=1684445649
 96   0.017889 54.192.118.222 -> 172.31.8.238 TCP 8754 [TCP segment of a reassembled PDU]
 97   0.017896 172.31.8.238 -> 54.192.118.222 TCP 66 34977 > http [ACK] Seq=97 Ack=533931 Win=946048 Len=0 TSval=6950195 TSecr=1684445649
 98   0.017987 54.192.118.222 -> 172.31.8.238 TCP 26130 [TCP segment of a reassembled PDU]
 99   0.018002 172.31.8.238 -> 54.192.118.222 TCP 66 34977 > http [ACK] Seq=97 Ack=559995 Win=998144 Len=0 TSval=6950195 TSecr=1684445649
100   0.018035 54.192.118.222 -> 172.31.8.238 TCP 8754 [TCP segment of a reassembled PDU]
101   0.018042 172.31.8.238 -> 54.192.118.222 TCP 66 34977 > http [ACK] Seq=97 Ack=568683 Win=1015552 Len=0 TSval=6950195 TSecr=1684445649
102   0.018180 54.192.118.222 -> 172.31.8.238 TCP 5858 [TCP segment of a reassembled PDU]
103   0.018187 172.31.8.238 -> 54.192.118.222 TCP 66 34977 > http [ACK] Seq=97 Ack=574475 Win=1027072 Len=0 TSval=6950195 TSecr=1684445649
104   0.018452 54.192.118.222 -> 172.31.8.238 TCP 24682 [TCP segment of a reassembled PDU]
105   0.018477 172.31.8.238 -> 54.192.118.222 TCP 66 34977 > http [ACK] Seq=97 Ack=599091 Win=1022848 Len=0 TSval=6950195 TSecr=1684445649
106   0.018626 54.192.118.222 -> 172.31.8.238 TCP 26130 [TCP segment of a reassembled PDU]
107   0.018687 54.192.118.222 -> 172.31.8.238 TCP 14546 [TCP segment of a reassembled PDU]
108   0.018709 172.31.8.238 -> 54.192.118.222 TCP 66 34977 > http [ACK] Seq=97 Ack=639635 Win=1027072 Len=0 TSval=6950196 TSecr=1684445649
109   0.019028 54.192.118.222 -> 172.31.8.238 TCP 26130 [TCP segment of a reassembled PDU]
110   0.019044 172.31.8.238 -> 54.192.118.222 TCP 66 34977 > http [ACK] Seq=97 Ack=665699 Win=1079168 Len=0 TSval=6950196 TSecr=1684445649
111   0.019084 54.192.118.222 -> 172.31.8.238 TCP 17442 [TCP segment of a reassembled PDU]
112   0.019094 172.31.8.238 -> 54.192.118.222 TCP 66 34977 > http [ACK] Seq=97 Ack=683075 Win=1113984 Len=0 TSval=6950196 TSecr=1684445649
113   0.019319 54.192.118.222 -> 172.31.8.238 TCP 21786 [TCP segment of a reassembled PDU]
114   0.019332 172.31.8.238 -> 54.192.118.222 TCP 66 34977 > http [ACK] Seq=97 Ack=704795 Win=1157376 Len=0 TSval=6950196 TSecr=1684445649
115   0.019442 54.192.118.222 -> 172.31.8.238 TCP 4410 [TCP segment of a reassembled PDU]
116   0.019448 172.31.8.238 -> 54.192.118.222 TCP 66 34977 > http [ACK] Seq=97 Ack=709139 Win=1166080 Len=0 TSval=6950196 TSecr=1684445649
117   0.019643 54.192.118.222 -> 172.31.8.238 TCP 26130 [TCP segment of a reassembled PDU]
118   0.019659 172.31.8.238 -> 54.192.118.222 TCP 66 34977 > http [ACK] Seq=97 Ack=735203 Win=1218176 Len=0 TSval=6950196 TSecr=1684445649
119   0.019697 54.192.118.222 -> 172.31.8.238 TCP 17442 [TCP segment of a reassembled PDU]
120   0.019708 172.31.8.238 -> 54.192.118.222 TCP 66 34977 > http [ACK] Seq=97 Ack=752579 Win=1252992 Len=0 TSval=6950196 TSecr=1684445649
121   0.019771 54.192.118.222 -> 172.31.8.238 TCP 17442 [TCP segment of a reassembled PDU]
122   0.019782 172.31.8.238 -> 54.192.118.222 TCP 66 34977 > http [ACK] Seq=97 Ack=769955 Win=1287680 Len=0 TSval=6950196 TSecr=1684445649
123   0.020160 54.192.118.222 -> 172.31.8.238 TCP 24682 [TCP segment of a reassembled PDU]
124   0.020174 172.31.8.238 -> 54.192.118.222 TCP 66 34977 > http [ACK] Seq=97 Ack=794571 Win=1336960 Len=0 TSval=6950196 TSecr=1684445649
125   0.020264 54.192.118.222 -> 172.31.8.238 TCP 5858 [TCP segment of a reassembled PDU]
126   0.020270 172.31.8.238 -> 54.192.118.222 TCP 66 34977 > http [ACK] Seq=97 Ack=800363 Win=1348608 Len=0 TSval=6950196 TSecr=1684445649
127   0.020506 54.192.118.222 -> 172.31.8.238 TCP 15994 [TCP segment of a reassembled PDU]
128   0.020515 172.31.8.238 -> 54.192.118.222 TCP 66 34977 > http [ACK] Seq=97 Ack=816291 Win=1380352 Len=0 TSval=6950196 TSecr=1684445649
129   0.020648 54.192.118.222 -> 172.31.8.238 TCP 18890 [TCP segment of a reassembled PDU]
130   0.020659 172.31.8.238 -> 54.192.118.222 TCP 66 34977 > http [ACK] Seq=97 Ack=835115 Win=1418112 Len=0 TSval=6950196 TSecr=1684445649
131   0.020992 54.192.118.222 -> 172.31.8.238 TCP 8754 [TCP segment of a reassembled PDU]
132   0.021000 172.31.8.238 -> 54.192.118.222 TCP 66 34977 > http [ACK] Seq=97 Ack=843803 Win=1435392 Len=0 TSval=6950196 TSecr=1684445649
133   0.021164 54.192.118.222 -> 172.31.8.238 TCP 26130 [TCP segment of a reassembled PDU]
134   0.021178 172.31.8.238 -> 54.192.118.222 TCP 66 34977 > http [ACK] Seq=97 Ack=869867 Win=1470976 Len=0 TSval=6950196 TSecr=1684445649
135   0.021238 54.192.118.222 -> 172.31.8.238 TCP 26130 [TCP segment of a reassembled PDU]
136   0.021254 172.31.8.238 -> 54.192.118.222 TCP 66 34977 > http [ACK] Seq=97 Ack=895931 Win=1470976 Len=0 TSval=6950196 TSecr=1684445649
137   0.021287 54.192.118.222 -> 172.31.8.238 TCP 4410 [TCP segment of a reassembled PDU]
138   0.021292 172.31.8.238 -> 54.192.118.222 TCP 66 34977 > http [ACK] Seq=97 Ack=900275 Win=1496192 Len=0 TSval=6950196 TSecr=1684445649
139   0.021629 54.192.118.222 -> 172.31.8.238 TCP 26130 [TCP segment of a reassembled PDU]
140   0.021668 54.192.118.222 -> 172.31.8.238 TCP 10202 [TCP segment of a reassembled PDU]
141   0.021684 172.31.8.238 -> 54.192.118.222 TCP 66 34977 > http [ACK] Seq=97 Ack=936475 Win=1460096 Len=0 TSval=6950196 TSecr=1684445649
142   0.021971 54.192.118.222 -> 172.31.8.238 TCP 4410 [TCP segment of a reassembled PDU]
143   0.021978 172.31.8.238 -> 54.192.118.222 TCP 66 34977 > http [ACK] Seq=97 Ack=940819 Win=1504896 Len=0 TSval=6950196 TSecr=1684445649
144   0.022130 54.192.118.222 -> 172.31.8.238 TCP 17442 [TCP segment of a reassembled PDU]
145   0.022153 172.31.8.238 -> 54.192.118.222 TCP 66 34977 > http [ACK] Seq=97 Ack=958195 Win=1487616 Len=0 TSval=6950196 TSecr=1684445649
146   0.022165 54.192.118.222 -> 172.31.8.238 TCP 8754 [TCP segment of a reassembled PDU]
147   0.022180 172.31.8.238 -> 54.192.118.222 TCP 66 34977 > http [ACK] Seq=97 Ack=966883 Win=1504896 Len=0 TSval=6950196 TSecr=1684445649
148   0.022213 54.192.118.222 -> 172.31.8.238 TCP 26130 [TCP segment of a reassembled PDU]
149   0.022239 172.31.8.238 -> 54.192.118.222 TCP 66 34977 > http [ACK] Seq=97 Ack=992947 Win=1478912 Len=0 TSval=6950196 TSecr=1684445649
150   0.022362 54.192.118.222 -> 172.31.8.238 TCP 27578 [TCP segment of a reassembled PDU]
151   0.022388 172.31.8.238 -> 54.192.118.222 TCP 66 34977 > http [ACK] Seq=97 Ack=1020459 Win=1468416 Len=0 TSval=6950196 TSecr=1684445649
152   0.022406 54.192.118.222 -> 172.31.8.238 TCP 10202 [TCP segment of a reassembled PDU]
153   0.022419 172.31.8.238 -> 54.192.118.222 TCP 66 34977 > http [ACK] Seq=97 Ack=1030595 Win=1497088 Len=0 TSval=6950196 TSecr=1684445649
154   0.023000 54.192.118.222 -> 172.31.8.238 TCP 5858 [TCP segment of a reassembled PDU]
155   0.023007 172.31.8.238 -> 54.192.118.222 TCP 66 34977 > http [ACK] Seq=97 Ack=1036387 Win=1504256 Len=0 TSval=6950197 TSecr=1684445650
156   0.023186 54.192.118.222 -> 172.31.8.238 TCP 26130 [TCP segment of a reassembled PDU]
157   0.023212 172.31.8.238 -> 54.192.118.222 TCP 66 34977 > http [ACK] Seq=97 Ack=1062451 Win=1478272 Len=0 TSval=6950197 TSecr=1684445650
158   0.023254 54.192.118.222 -> 172.31.8.238 TCP 20338 [TCP segment of a reassembled PDU]
159   0.023264 172.31.8.238 -> 54.192.118.222 TCP 66 34977 > http [ACK] Seq=97 Ack=1082723 Win=1480448 Len=0 TSval=6950197 TSecr=1684445650
160   0.023341 54.192.118.222 -> 172.31.8.238 TCP 31922 [TCP segment of a reassembled PDU]
161   0.023411 54.192.118.222 -> 172.31.8.238 TCP 21786 [TCP segment of a reassembled PDU]
162   0.023491 172.31.8.238 -> 54.192.118.222 TCP 66 34977 > http [ACK] Seq=97 Ack=1136299 Win=1426944 Len=0 TSval=6950197 TSecr=1684445650
163   0.023785 54.192.118.222 -> 172.31.8.238 TCP 7306 [TCP segment of a reassembled PDU]
164   0.023793 172.31.8.238 -> 54.192.118.222 TCP 66 34977 > http [ACK] Seq=97 Ack=1143539 Win=1501824 Len=0 TSval=6950197 TSecr=1684445650
165   0.023967 54.192.118.222 -> 172.31.8.238 TCP 26130 [TCP segment of a reassembled PDU]
166   0.023995 172.31.8.238 -> 54.192.118.222 TCP 66 34977 > http [ACK] Seq=97 Ack=1169603 Win=1475840 Len=0 TSval=6950197 TSecr=1684445650
167   0.024043 54.192.118.222 -> 172.31.8.238 TCP 26130 [TCP segment of a reassembled PDU]
168   0.024113 54.192.118.222 -> 172.31.8.238 TCP 13098 [TCP segment of a reassembled PDU]
169   0.024183 54.192.118.222 -> 172.31.8.238 TCP 17442 [TCP segment of a reassembled PDU]
170   0.024238 172.31.8.238 -> 54.192.118.222 TCP 66 34977 > http [ACK] Seq=97 Ack=1226075 Win=1420800 Len=0 TSval=6950197 TSecr=1684445650
171   0.024400 54.192.118.222 -> 172.31.8.238 TCP 4410 [TCP segment of a reassembled PDU]
172   0.024407 172.31.8.238 -> 54.192.118.222 TCP 66 34977 > http [ACK] Seq=97 Ack=1230419 Win=1506560 Len=0 TSval=6950197 TSecr=1684445650
173   0.024578 54.192.118.222 -> 172.31.8.238 TCP 26130 [TCP segment of a reassembled PDU]
174   0.024604 172.31.8.238 -> 54.192.118.222 TCP 66 34977 > http [ACK] Seq=97 Ack=1256483 Win=1480576 Len=0 TSval=6950197 TSecr=1684445650
175   0.024622 54.192.118.222 -> 172.31.8.238 TCP 11650 [TCP segment of a reassembled PDU]
176   0.024638 172.31.8.238 -> 54.192.118.222 TCP 66 34977 > http [ACK] Seq=97 Ack=1268067 Win=1494784 Len=0 TSval=6950197 TSecr=1684445650
177   0.024757 54.192.118.222 -> 172.31.8.238 TCP 21786 [TCP segment of a reassembled PDU]
178   0.024783 172.31.8.238 -> 54.192.118.222 TCP 66 34977 > http [ACK] Seq=97 Ack=1289787 Win=1478016 Len=0 TSval=6950197 TSecr=1684445650
179   0.024798 54.192.118.222 -> 172.31.8.238 TCP 1514 [TCP segment of a reassembled PDU]
180   0.024943 54.192.118.222 -> 172.31.8.238 TCP 13098 [TCP segment of a reassembled PDU]
181   0.024952 172.31.8.238 -> 54.192.118.222 TCP 66 34977 > http [ACK] Seq=97 Ack=1304267 Win=1492352 Len=0 TSval=6950197 TSecr=1684445650
182   0.025090 54.192.118.222 -> 172.31.8.238 TCP 26130 [TCP segment of a reassembled PDU]
183   0.025118 172.31.8.238 -> 54.192.118.222 TCP 66 34977 > http [ACK] Seq=97 Ack=1330331 Win=1470976 Len=0 TSval=6950197 TSecr=1684445650
184   0.025162 54.192.118.222 -> 172.31.8.238 TCP 26130 [TCP segment of a reassembled PDU]
185   0.025178 172.31.8.238 -> 54.192.118.222 TCP 66 34977 > http [ACK] Seq=97 Ack=1356395 Win=1470976 Len=0 TSval=6950197 TSecr=1684445650
186   0.025435 54.192.118.222 -> 172.31.8.238 TCP 11650 [TCP segment of a reassembled PDU]
187   0.025445 172.31.8.238 -> 54.192.118.222 TCP 66 34977 > http [ACK] Seq=97 Ack=1367979 Win=1494784 Len=0 TSval=6950197 TSecr=1684445650
188   0.025598 54.192.118.222 -> 172.31.8.238 TCP 26130 [TCP segment of a reassembled PDU]
189   0.025625 172.31.8.238 -> 54.192.118.222 TCP 66 34977 > http [ACK] Seq=97 Ack=1394043 Win=1470976 Len=0 TSval=6950197 TSecr=1684445650
190   0.025677 54.192.118.222 -> 172.31.8.238 TCP 24682 [TCP segment of a reassembled PDU]
191   0.025692 172.31.8.238 -> 54.192.118.222 TCP 66 34977 > http [ACK] Seq=97 Ack=1418659 Win=1473280 Len=0 TSval=6950197 TSecr=1684445650
192   0.025730 54.192.118.222 -> 172.31.8.238 TCP 2962 [TCP segment of a reassembled PDU]
193   0.025735 172.31.8.238 -> 54.192.118.222 TCP 66 34977 > http [ACK] Seq=97 Ack=1421555 Win=1508480 Len=0 TSval=6950197 TSecr=1684445650
194   0.025813 54.192.118.222 -> 172.31.8.238 TCP 23234 [TCP segment of a reassembled PDU]
195   0.025916 54.192.118.222 -> 172.31.8.238 TCP 26130 [TCP segment of a reassembled PDU]
196   0.025970 54.192.118.222 -> 172.31.8.238 TCP 15994 [TCP segment of a reassembled PDU]
197   0.025983 172.31.8.238 -> 54.192.118.222 TCP 66 34977 > http [ACK] Seq=97 Ack=1470787 Win=1459328 Len=0 TSval=6950197 TSecr=1684445650
198   0.026000 172.31.8.238 -> 54.192.118.222 TCP 66 34977 > http [ACK] Seq=97 Ack=1486715 Win=1444608 Len=0 TSval=6950197 TSecr=1684445650
199   0.026176 54.192.118.222 -> 172.31.8.238 TCP 21786 [TCP segment of a reassembled PDU]
200   0.026189 172.31.8.238 -> 54.192.118.222 TCP 66 34977 > http [ACK] Seq=97 Ack=1508435 Win=1478016 Len=0 TSval=6950197 TSecr=1684445650
201   0.026304 54.192.118.222 -> 172.31.8.238 TCP 24682 [TCP segment of a reassembled PDU]
202   0.026327 54.192.118.222 -> 172.31.8.238 TCP 1514 [TCP segment of a reassembled PDU]
203   0.026337 172.31.8.238 -> 54.192.118.222 TCP 66 34977 > http [ACK] Seq=97 Ack=1534499 Win=1470848 Len=0 TSval=6950197 TSecr=1684445650
204   0.026368 54.192.118.222 -> 172.31.8.238 TCP 2962 [TCP segment of a reassembled PDU]
205   0.026373 172.31.8.238 -> 54.192.118.222 TCP 66 34977 > http [ACK] Seq=97 Ack=1537395 Win=1508480 Len=0 TSval=6950197 TSecr=1684445650
206   0.026522 54.192.118.222 -> 172.31.8.238 TCP 14546 [TCP segment of a reassembled PDU]
207   0.026540 172.31.8.238 -> 54.192.118.222 TCP 66 34977 > http [ACK] Seq=97 Ack=1551875 Win=1494016 Len=0 TSval=6950197 TSecr=1684445650
208   0.026777 54.192.118.222 -> 172.31.8.238 TCP 26130 [TCP segment of a reassembled PDU]
209   0.026804 172.31.8.238 -> 54.192.118.222 TCP 66 34977 > http [ACK] Seq=97 Ack=1577939 Win=1508480 Len=0 TSval=6950198 TSecr=1684445650
210   0.026843 54.192.118.222 -> 172.31.8.238 TCP 17442 [TCP segment of a reassembled PDU]
211   0.026854 172.31.8.238 -> 54.192.118.222 TCP 66 34977 > http [ACK] Seq=97 Ack=1595315 Win=1543296 Len=0 TSval=6950198 TSecr=1684445650
212   0.026930 54.192.118.222 -> 172.31.8.238 TCP 21786 [TCP segment of a reassembled PDU]
213   0.026943 172.31.8.238 -> 54.192.118.222 TCP 66 34977 > http [ACK] Seq=97 Ack=1617035 Win=1586688 Len=0 TSval=6950198 TSecr=1684445650
214   0.027021 54.192.118.222 -> 172.31.8.238 TCP 26130 [TCP segment of a reassembled PDU]
215   0.027037 172.31.8.238 -> 54.192.118.222 TCP 66 34977 > http [ACK] Seq=97 Ack=1643099 Win=1586688 Len=0 TSval=6950198 TSecr=1684445650
216   0.027104 54.192.118.222 -> 172.31.8.238 TCP 26130 [TCP segment of a reassembled PDU]
217   0.027119 172.31.8.238 -> 54.192.118.222 TCP 66 34977 > http [ACK] Seq=97 Ack=1669163 Win=1586688 Len=0 TSval=6950198 TSecr=1684445650
218   0.027159 54.192.118.222 -> 172.31.8.238 TCP 13098 [TCP segment of a reassembled PDU]
219   0.027168 172.31.8.238 -> 54.192.118.222 TCP 66 34977 > http [ACK] Seq=97 Ack=1682195 Win=1586688 Len=0 TSval=6950198 TSecr=1684445650
220   0.027537 54.192.118.222 -> 172.31.8.238 TCP 4410 [TCP segment of a reassembled PDU]
221   0.027544 172.31.8.238 -> 54.192.118.222 TCP 66 34977 > http [ACK] Seq=97 Ack=1686539 Win=1586688 Len=0 TSval=6950198 TSecr=1684445650
222   0.027722 54.192.118.222 -> 172.31.8.238 TCP 18890 [TCP segment of a reassembled PDU]
223   0.027734 172.31.8.238 -> 54.192.118.222 TCP 66 34977 > http [ACK] Seq=97 Ack=1705363 Win=1586688 Len=0 TSval=6950198 TSecr=1684445650
224   0.027847 54.192.118.222 -> 172.31.8.238 TCP 33370 [TCP segment of a reassembled PDU]
225   0.027865 172.31.8.238 -> 54.192.118.222 TCP 66 34977 > http [ACK] Seq=97 Ack=1738667 Win=1586688 Len=0 TSval=6950198 TSecr=1684445650
226   0.027883 54.192.118.222 -> 172.31.8.238 TCP 26130 [TCP segment of a reassembled PDU]
227   0.027900 172.31.8.238 -> 54.192.118.222 TCP 66 34977 > http [ACK] Seq=97 Ack=1764731 Win=1586688 Len=0 TSval=6950198 TSecr=1684445650
228   0.027989 54.192.118.222 -> 172.31.8.238 TCP 26130 [TCP segment of a reassembled PDU]
229   0.028003 172.31.8.238 -> 54.192.118.222 TCP 66 34977 > http [ACK] Seq=97 Ack=1790795 Win=1586688 Len=0 TSval=6950198 TSecr=1684445650
230   0.028053 54.192.118.222 -> 172.31.8.238 TCP 21786 [TCP segment of a reassembled PDU]
231   0.028063 172.31.8.238 -> 54.192.118.222 TCP 66 34977 > http [ACK] Seq=97 Ack=1812515 Win=1586688 Len=0 TSval=6950198 TSecr=1684445650
232   0.028186 54.192.118.222 -> 172.31.8.238 TCP 4410 [TCP segment of a reassembled PDU]
233   0.028193 172.31.8.238 -> 54.192.118.222 TCP 66 34977 > http [ACK] Seq=97 Ack=1816859 Win=1586688 Len=0 TSval=6950198 TSecr=1684445650
234   0.028364 54.192.118.222 -> 172.31.8.238 TCP 26130 [TCP segment of a reassembled PDU]
235   0.028380 172.31.8.238 -> 54.192.118.222 TCP 66 34977 > http [ACK] Seq=97 Ack=1842923 Win=1586688 Len=0 TSval=6950198 TSecr=1684445650
236   0.028437 54.192.118.222 -> 172.31.8.238 TCP 26130 [TCP segment of a reassembled PDU]
237   0.028445 172.31.8.238 -> 54.192.118.222 TCP 66 34977 > http [ACK] Seq=97 Ack=1868987 Win=1586688 Len=0 TSval=6950198 TSecr=1684445650
238   0.028492 54.192.118.222 -> 172.31.8.238 TCP 8754 [TCP segment of a reassembled PDU]
239   0.028498 172.31.8.238 -> 54.192.118.222 TCP 66 34977 > http [ACK] Seq=97 Ack=1877675 Win=1586688 Len=0 TSval=6950198 TSecr=1684445650
240   0.028722 54.192.118.222 -> 172.31.8.238 TCP 7306 [TCP segment of a reassembled PDU]
241   0.028728 172.31.8.238 -> 54.192.118.222 TCP 66 34977 > http [ACK] Seq=97 Ack=1884915 Win=1586688 Len=0 TSval=6950198 TSecr=1684445650
242   0.028912 54.192.118.222 -> 172.31.8.238 TCP 26130 [TCP segment of a reassembled PDU]
243   0.028920 172.31.8.238 -> 54.192.118.222 TCP 66 34977 > http [ACK] Seq=97 Ack=1910979 Win=1586688 Len=0 TSval=6950198 TSecr=1684445650
244   0.028984 54.192.118.222 -> 172.31.8.238 TCP 20338 [TCP segment of a reassembled PDU]
245   0.028991 172.31.8.238 -> 54.192.118.222 TCP 66 34977 > http [ACK] Seq=97 Ack=1931251 Win=1586688 Len=0 TSval=6950198 TSecr=1684445650
246   0.029127 54.192.118.222 -> 172.31.8.238 TCP 31922 [TCP segment of a reassembled PDU]
247   0.029136 172.31.8.238 -> 54.192.118.222 TCP 66 34977 > http [ACK] Seq=97 Ack=1963107 Win=1586688 Len=0 TSval=6950198 TSecr=1684445650
248   0.029153 54.192.118.222 -> 172.31.8.238 TCP 26130 [TCP segment of a reassembled PDU]
249   0.029162 172.31.8.238 -> 54.192.118.222 TCP 66 34977 > http [ACK] Seq=97 Ack=1989171 Win=1586688 Len=0 TSval=6950198 TSecr=1684445650
250   0.029241 54.192.118.222 -> 172.31.8.238 TCP 18890 [TCP segment of a reassembled PDU]
251   0.029247 172.31.8.238 -> 54.192.118.222 TCP 66 34977 > http [ACK] Seq=97 Ack=2007995 Win=1586688 Len=0 TSval=6950198 TSecr=1684445650
252   0.029514 54.192.118.222 -> 172.31.8.238 TCP 20338 [TCP segment of a reassembled PDU]
253   0.029522 172.31.8.238 -> 54.192.118.222 TCP 66 34977 > http [ACK] Seq=97 Ack=2028267 Win=1586688 Len=0 TSval=6950198 TSecr=1684445650
254   0.029671 54.192.118.222 -> 172.31.8.238 TCP 23234 [TCP segment of a reassembled PDU]
255   0.029679 172.31.8.238 -> 54.192.118.222 TCP 66 34977 > http [ACK] Seq=97 Ack=2051435 Win=1586688 Len=0 TSval=6950198 TSecr=1684445650
256   0.029695 54.192.118.222 -> 172.31.8.238 TCP 2962 [TCP segment of a reassembled PDU]
257   0.029710 172.31.8.238 -> 54.192.118.222 TCP 66 34977 > http [ACK] Seq=97 Ack=2054331 Win=1586688 Len=0 TSval=6950198 TSecr=1684445650
258   0.029837 54.192.118.222 -> 172.31.8.238 TCP 40610 [TCP segment of a reassembled PDU]
259   0.029848 172.31.8.238 -> 54.192.118.222 TCP 66 34977 > http [ACK] Seq=97 Ack=2094875 Win=1586688 Len=0 TSval=6950198 TSecr=1684445650
260   0.029966 54.192.118.222 -> 172.31.8.238 TCP 18890 [TCP segment of a reassembled PDU]
261   0.029972 172.31.8.238 -> 54.192.118.222 TCP 66 34977 > http [ACK] Seq=97 Ack=2113699 Win=1586688 Len=0 TSval=6950198 TSecr=1684445650
262   0.029991 54.192.118.222 -> 172.31.8.238 TCP 7306 [TCP segment of a reassembled PDU]
263   0.029994 172.31.8.238 -> 54.192.118.222 TCP 66 34977 > http [ACK] Seq=97 Ack=2120939 Win=1586688 Len=0 TSval=6950198 TSecr=1684445650
264   0.030057 54.192.118.222 -> 172.31.8.238 TCP 17442 [TCP segment of a reassembled PDU]
265   0.030063 172.31.8.238 -> 54.192.118.222 TCP 66 34977 > http [ACK] Seq=97 Ack=2138315 Win=1586688 Len=0 TSval=6950198 TSecr=1684445650
266   0.030314 54.192.118.222 -> 172.31.8.238 TCP 26130 [TCP segment of a reassembled PDU]
267   0.030323 172.31.8.238 -> 54.192.118.222 TCP 66 34977 > http [ACK] Seq=97 Ack=2164379 Win=1586688 Len=0 TSval=6950198 TSecr=1684445650
268   0.030447 54.192.118.222 -> 172.31.8.238 TCP 26130 [TCP segment of a reassembled PDU]
269   0.030455 172.31.8.238 -> 54.192.118.222 TCP 66 34977 > http [ACK] Seq=97 Ack=2190443 Win=1586688 Len=0 TSval=6950198 TSecr=1684445650
270   0.030473 54.192.118.222 -> 172.31.8.238 TCP 26130 [TCP segment of a reassembled PDU]
271   0.030482 172.31.8.238 -> 54.192.118.222 TCP 66 34977 > http [ACK] Seq=97 Ack=2216507 Win=1586688 Len=0 TSval=6950198 TSecr=1684445650
272   0.030584 54.192.118.222 -> 172.31.8.238 TCP 26130 [TCP segment of a reassembled PDU]
273   0.030591 172.31.8.238 -> 54.192.118.222 TCP 66 34977 > http [ACK] Seq=97 Ack=2242571 Win=1586688 Len=0 TSval=6950198 TSecr=1684445650
274   0.030685 54.192.118.222 -> 172.31.8.238 TCP 26130 [TCP segment of a reassembled PDU]
275   0.030692 172.31.8.238 -> 54.192.118.222 TCP 66 34977 > http [ACK] Seq=97 Ack=2268635 Win=1586688 Len=0 TSval=6950199 TSecr=1684445650
276   0.031043 54.192.118.222 -> 172.31.8.238 TCP 2962 [TCP segment of a reassembled PDU]
277   0.031049 172.31.8.238 -> 54.192.118.222 TCP 66 34977 > http [ACK] Seq=97 Ack=2271531 Win=1586688 Len=0 TSval=6950199 TSecr=1684445650
278   0.031237 54.192.118.222 -> 172.31.8.238 TCP 26130 [TCP segment of a reassembled PDU]
279   0.031245 172.31.8.238 -> 54.192.118.222 TCP 66 34977 > http [ACK] Seq=97 Ack=2297595 Win=1586688 Len=0 TSval=6950199 TSecr=1684445650
280   0.031307 54.192.118.222 -> 172.31.8.238 TCP 26130 [TCP segment of a reassembled PDU]
281   0.031314 172.31.8.238 -> 54.192.118.222 TCP 66 34977 > http [ACK] Seq=97 Ack=2323659 Win=1586688 Len=0 TSval=6950199 TSecr=1684445650
282   0.031368 54.192.118.222 -> 172.31.8.238 TCP 10202 [TCP segment of a reassembled PDU]
283   0.031373 172.31.8.238 -> 54.192.118.222 TCP 66 34977 > http [ACK] Seq=97 Ack=2333795 Win=1586688 Len=0 TSval=6950199 TSecr=1684445650
284   0.031462 54.192.118.222 -> 172.31.8.238 TCP 26130 [TCP segment of a reassembled PDU]
285   0.031469 172.31.8.238 -> 54.192.118.222 TCP 66 34977 > http [ACK] Seq=97 Ack=2359859 Win=1586688 Len=0 TSval=6950199 TSecr=1684445650
286   0.031549 54.192.118.222 -> 172.31.8.238 TCP 26130 [TCP segment of a reassembled PDU]
287   0.031556 172.31.8.238 -> 54.192.118.222 TCP 66 34977 > http [ACK] Seq=97 Ack=2385923 Win=1586688 Len=0 TSval=6950199 TSecr=1684445650
288   0.031696 54.192.118.222 -> 172.31.8.238 TCP 13098 [TCP segment of a reassembled PDU]
289   0.031706 172.31.8.238 -> 54.192.118.222 TCP 66 34977 > http [ACK] Seq=97 Ack=2398955 Win=1586688 Len=0 TSval=6950199 TSecr=1684445650
290   0.031724 54.192.118.222 -> 172.31.8.238 TCP 26130 [TCP segment of a reassembled PDU]
291   0.031733 172.31.8.238 -> 54.192.118.222 TCP 66 34977 > http [ACK] Seq=97 Ack=2425019 Win=1586688 Len=0 TSval=6950199 TSecr=1684445650
292   0.031751 54.192.118.222 -> 172.31.8.238 TCP 23234 [TCP segment of a reassembled PDU]
293   0.031756 172.31.8.238 -> 54.192.118.222 TCP 66 34977 > http [ACK] Seq=97 Ack=2448187 Win=1586688 Len=0 TSval=6950199 TSecr=1684445650
294   0.031803 54.192.118.222 -> 172.31.8.238 TCP 15994 [TCP segment of a reassembled PDU]
295   0.031809 172.31.8.238 -> 54.192.118.222 TCP 66 34977 > http [ACK] Seq=97 Ack=2464115 Win=1586688 Len=0 TSval=6950199 TSecr=1684445650
296   0.032115 54.192.118.222 -> 172.31.8.238 TCP 26130 [TCP segment of a reassembled PDU]
297   0.032123 172.31.8.238 -> 54.192.118.222 TCP 66 34977 > http [ACK] Seq=97 Ack=2490179 Win=1586688 Len=0 TSval=6950199 TSecr=1684445650
298   0.032178 54.192.118.222 -> 172.31.8.238 TCP 20338 [TCP segment of a reassembled PDU]
299   0.032187 172.31.8.238 -> 54.192.118.222 TCP 66 34977 > http [ACK] Seq=97 Ack=2510451 Win=1586688 Len=0 TSval=6950199 TSecr=1684445650
300   0.032264 54.192.118.222 -> 172.31.8.238 TCP 31922 [TCP segment of a reassembled PDU]
301   0.032272 172.31.8.238 -> 54.192.118.222 TCP 66 34977 > http [ACK] Seq=97 Ack=2542307 Win=1586688 Len=0 TSval=6950199 TSecr=1684445650
302   0.032339 54.192.118.222 -> 172.31.8.238 TCP 26130 [TCP segment of a reassembled PDU]
303   0.032345 172.31.8.238 -> 54.192.118.222 TCP 66 34977 > http [ACK] Seq=97 Ack=2568371 Win=1586688 Len=0 TSval=6950199 TSecr=1684445650
304   0.032467 54.192.118.222 -> 172.31.8.238 TCP 26130 [TCP segment of a reassembled PDU]
305   0.032476 172.31.8.238 -> 54.192.118.222 TCP 66 34977 > http [ACK] Seq=97 Ack=2594435 Win=1586688 Len=0 TSval=6950199 TSecr=1684445650
306   0.032498 54.192.118.222 -> 172.31.8.238 TCP 26130 [TCP segment of a reassembled PDU]
307   0.032516 172.31.8.238 -> 54.192.118.222 TCP 66 34977 > http [ACK] Seq=97 Ack=2620499 Win=1586688 Len=0 TSval=6950199 TSecr=1684445650
308   0.032612 54.192.118.222 -> 172.31.8.238 TCP 26130 [TCP segment of a reassembled PDU]
309   0.032620 172.31.8.238 -> 54.192.118.222 TCP 66 34977 > http [ACK] Seq=97 Ack=2646563 Win=1586688 Len=0 TSval=6950199 TSecr=1684445650
310   0.032669 54.192.118.222 -> 172.31.8.238 TCP 13098 [TCP segment of a reassembled PDU]
311   0.032674 172.31.8.238 -> 54.192.118.222 TCP 66 34977 > http [ACK] Seq=97 Ack=2659595 Win=1586688 Len=0 TSval=6950199 TSecr=1684445650
312   0.033103 54.192.118.222 -> 172.31.8.238 TCP 23234 [TCP segment of a reassembled PDU]
313   0.033111 172.31.8.238 -> 54.192.118.222 TCP 66 34977 > http [ACK] Seq=97 Ack=2682763 Win=1586688 Len=0 TSval=6950199 TSecr=1684445651
314   0.033220 54.192.118.222 -> 172.31.8.238 TCP 29026 [TCP segment of a reassembled PDU]
315   0.033228 172.31.8.238 -> 54.192.118.222 TCP 66 34977 > http [ACK] Seq=97 Ack=2711723 Win=1586688 Len=0 TSval=6950199 TSecr=1684445651
316   0.033246 54.192.118.222 -> 172.31.8.238 TCP 26130 [TCP segment of a reassembled PDU]
317   0.033255 172.31.8.238 -> 54.192.118.222 TCP 66 34977 > http [ACK] Seq=97 Ack=2737787 Win=1586688 Len=0 TSval=6950199 TSecr=1684445651
318   0.033345 54.192.118.222 -> 172.31.8.238 TCP 26130 [TCP segment of a reassembled PDU]
319   0.033353 172.31.8.238 -> 54.192.118.222 TCP 66 34977 > http [ACK] Seq=97 Ack=2763851 Win=1586688 Len=0 TSval=6950199 TSecr=1684445651
320   0.033426 54.192.118.222 -> 172.31.8.238 TCP 26130 [TCP segment of a reassembled PDU]
321   0.033432 172.31.8.238 -> 54.192.118.222 TCP 66 34977 > http [ACK] Seq=97 Ack=2789915 Win=1586688 Len=0 TSval=6950199 TSecr=1684445651
322   0.033505 54.192.118.222 -> 172.31.8.238 TCP 26130 [TCP segment of a reassembled PDU]
323   0.033512 172.31.8.238 -> 54.192.118.222 TCP 66 34977 > http [ACK] Seq=97 Ack=2815979 Win=1586688 Len=0 TSval=6950199 TSecr=1684445651
324   0.033591 54.192.118.222 -> 172.31.8.238 TCP 26130 [TCP segment of a reassembled PDU]
325   0.033598 172.31.8.238 -> 54.192.118.222 TCP 66 34977 > http [ACK] Seq=97 Ack=2842043 Win=1586688 Len=0 TSval=6950199 TSecr=1684445651
326   0.033641 54.192.118.222 -> 172.31.8.238 TCP 13098 [TCP segment of a reassembled PDU]
327   0.033647 172.31.8.238 -> 54.192.118.222 TCP 66 34977 > http [ACK] Seq=97 Ack=2855075 Win=1586688 Len=0 TSval=6950199 TSecr=1684445651
328   0.034055 54.192.118.222 -> 172.31.8.238 TCP 17442 [TCP segment of a reassembled PDU]
329   0.034062 172.31.8.238 -> 54.192.118.222 TCP 66 34977 > http [ACK] Seq=97 Ack=2872451 Win=1586688 Len=0 TSval=6950199 TSecr=1684445651
330   0.034204 54.192.118.222 -> 172.31.8.238 TCP 26130 [TCP segment of a reassembled PDU]
331   0.034210 172.31.8.238 -> 54.192.118.222 TCP 66 34977 > http [ACK] Seq=97 Ack=2898515 Win=1586688 Len=0 TSval=6950199 TSecr=1684445651
332   0.034281 54.192.118.222 -> 172.31.8.238 TCP 26130 [TCP segment of a reassembled PDU]
333   0.034287 172.31.8.238 -> 54.192.118.222 TCP 66 34977 > http [ACK] Seq=97 Ack=2924579 Win=1586688 Len=0 TSval=6950199 TSecr=1684445651
334   0.034419 54.192.118.222 -> 172.31.8.238 TCP 26130 [TCP segment of a reassembled PDU]
335   0.034427 172.31.8.238 -> 54.192.118.222 TCP 66 34977 > http [ACK] Seq=97 Ack=2950643 Win=1586688 Len=0 TSval=6950199 TSecr=1684445651
336   0.034439 54.192.118.222 -> 172.31.8.238 TCP 10202 [TCP segment of a reassembled PDU]
337   0.034442 172.31.8.238 -> 54.192.118.222 TCP 66 34977 > http [ACK] Seq=97 Ack=2960779 Win=1586688 Len=0 TSval=6950199 TSecr=1684445651
338   0.034540 54.192.118.222 -> 172.31.8.238 TCP 24682 [TCP segment of a reassembled PDU]
339   0.034547 172.31.8.238 -> 54.192.118.222 TCP 66 34977 > http [ACK] Seq=97 Ack=2985395 Win=1586688 Len=0 TSval=6950199 TSecr=1684445651
340   0.034625 54.192.118.222 -> 172.31.8.238 TCP 26130 [TCP segment of a reassembled PDU]
341   0.034631 172.31.8.238 -> 54.192.118.222 TCP 66 34977 > http [ACK] Seq=97 Ack=3011459 Win=1586688 Len=0 TSval=6950199 TSecr=1684445651
342   0.034700 54.192.118.222 -> 172.31.8.238 TCP 26130 [TCP segment of a reassembled PDU]
343   0.034707 172.31.8.238 -> 54.192.118.222 TCP 66 34977 > http [ACK] Seq=97 Ack=3037523 Win=1586688 Len=0 TSval=6950199 TSecr=1684445651
344   0.034752 54.192.118.222 -> 172.31.8.238 TCP 13098 [TCP segment of a reassembled PDU]
345   0.034756 172.31.8.238 -> 54.192.118.222 TCP 66 34977 > http [ACK] Seq=97 Ack=3050555 Win=1586688 Len=0 TSval=6950200 TSecr=1684445651
346   0.035034 54.192.118.222 -> 172.31.8.238 TCP 21786 [TCP segment of a reassembled PDU]
347   0.035042 172.31.8.238 -> 54.192.118.222 TCP 66 34977 > http [ACK] Seq=97 Ack=3072275 Win=1586688 Len=0 TSval=6950200 TSecr=1684445651
348   0.035195 54.192.118.222 -> 172.31.8.238 TCP 26130 [TCP segment of a reassembled PDU]
