[Measurement for 10mb at 01:42:52 20.42.2014] 
Tshark:

  1   0.000000 172.31.8.238 -> 172.31.0.2   DNS 88 Standard query 0x9563  A dm53kc3eax57k.cloudfront.net
  2   0.000025 172.31.8.238 -> 172.31.0.2   DNS 88 Standard query 0xe0c7  AAAA dm53kc3eax57k.cloudfront.net
  3   0.000617   172.31.0.2 -> 172.31.8.238 DNS 216 Standard query response 0x9563  A 54.230.119.71 A 54.230.119.150 A 54.239.132.26 A 54.192.118.242 A 54.192.118.243 A 54.230.116.72 A 54.230.117.154 A 54.230.117.156
  4   0.000639   172.31.0.2 -> 172.31.8.238 DNS 175 Standard query response 0xe0c7 
  5   0.003963 172.31.8.238 -> 54.230.119.71 TCP 74 36434 > http [SYN] Seq=0 Win=26883 Len=0 MSS=8961 SACK_PERM=1 TSval=7850109 TSecr=0 WS=128
  6   0.004612 54.230.119.71 -> 172.31.8.238 TCP 74 http > 36434 [SYN, ACK] Seq=0 Ack=1 Win=14480 Len=0 MSS=1460 SACK_PERM=1 TSval=1683654721 TSecr=7850109 WS=128
  7   0.004627 172.31.8.238 -> 54.230.119.71 TCP 66 36434 > http [ACK] Seq=1 Ack=1 Win=27008 Len=0 TSval=7850109 TSecr=1683654721
  8   0.004664 172.31.8.238 -> 54.230.119.71 HTTP 162 GET /10mb HTTP/1.1 
  9   0.005258 54.230.119.71 -> 172.31.8.238 TCP 66 http > 36434 [ACK] Seq=1 Ack=97 Win=14592 Len=0 TSval=1683654721 TSecr=7850109
 10   0.007731 54.230.119.71 -> 172.31.8.238 TCP 13098 [TCP segment of a reassembled PDU]
 11   0.007744 172.31.8.238 -> 54.230.119.71 TCP 66 36434 > http [ACK] Seq=97 Ack=13033 Win=52992 Len=0 TSval=7850110 TSecr=1683654721
 12   0.008438 54.230.119.71 -> 172.31.8.238 TCP 13098 [TCP segment of a reassembled PDU]
 13   0.008449 172.31.8.238 -> 54.230.119.71 TCP 66 36434 > http [ACK] Seq=97 Ack=26065 Win=79104 Len=0 TSval=7850110 TSecr=1683654721
 14   0.008901 54.230.119.71 -> 172.31.8.238 TCP 5858 [TCP segment of a reassembled PDU]
 15   0.008908 172.31.8.238 -> 54.230.119.71 TCP 66 36434 > http [ACK] Seq=97 Ack=31857 Win=90624 Len=0 TSval=7850110 TSecr=1683654721
 16   0.008986 54.230.119.71 -> 172.31.8.238 TCP 7306 [TCP segment of a reassembled PDU]
 17   0.008993 172.31.8.238 -> 54.230.119.71 TCP 66 36434 > http [ACK] Seq=97 Ack=39097 Win=105088 Len=0 TSval=7850110 TSecr=1683654721
 18   0.009439 54.230.119.71 -> 172.31.8.238 TCP 15994 [TCP segment of a reassembled PDU]
 19   0.009450 172.31.8.238 -> 54.230.119.71 TCP 66 36434 > http [ACK] Seq=97 Ack=55025 Win=91648 Len=0 TSval=7850110 TSecr=1683654721
 20   0.009479 54.230.119.71 -> 172.31.8.238 TCP 4410 [TCP segment of a reassembled PDU]
 21   0.009485 172.31.8.238 -> 54.230.119.71 TCP 66 36434 > http [ACK] Seq=97 Ack=59369 Win=109056 Len=0 TSval=7850110 TSecr=1683654721
 22   0.009894 54.230.119.71 -> 172.31.8.238 TCP 2962 [TCP segment of a reassembled PDU]
 23   0.009900 172.31.8.238 -> 54.230.119.71 TCP 66 36434 > http [ACK] Seq=97 Ack=62265 Win=109056 Len=0 TSval=7850110 TSecr=1683654721
 24   0.009993 54.230.119.71 -> 172.31.8.238 TCP 2962 [TCP segment of a reassembled PDU]
 25   0.009999 172.31.8.238 -> 54.230.119.71 TCP 66 36434 > http [ACK] Seq=97 Ack=65161 Win=109056 Len=0 TSval=7850110 TSecr=1683654721
 26   0.010052 54.230.119.71 -> 172.31.8.238 TCP 13098 [TCP segment of a reassembled PDU]
 27   0.010068 172.31.8.238 -> 54.230.119.71 TCP 66 36434 > http [ACK] Seq=97 Ack=78193 Win=96512 Len=0 TSval=7850110 TSecr=1683654721
 28   0.010439 54.230.119.71 -> 172.31.8.238 TCP 4410 [TCP segment of a reassembled PDU]
 29   0.010446 172.31.8.238 -> 54.230.119.71 TCP 66 36434 > http [ACK] Seq=97 Ack=82537 Win=109056 Len=0 TSval=7850111 TSecr=1683654721
 30   0.010536 54.230.119.71 -> 172.31.8.238 TCP 4410 [TCP segment of a reassembled PDU]
 31   0.010542 172.31.8.238 -> 54.230.119.71 TCP 66 36434 > http [ACK] Seq=97 Ack=86881 Win=117760 Len=0 TSval=7850111 TSecr=1683654721
 32   0.010704 54.230.119.71 -> 172.31.8.238 TCP 14546 [TCP segment of a reassembled PDU]
 33   0.010714 172.31.8.238 -> 54.230.119.71 TCP 66 36434 > http [ACK] Seq=97 Ack=101361 Win=146688 Len=0 TSval=7850111 TSecr=1683654721
 34   0.010749 54.230.119.71 -> 172.31.8.238 TCP 2962 [TCP segment of a reassembled PDU]
 35   0.010754 172.31.8.238 -> 54.230.119.71 TCP 66 36434 > http [ACK] Seq=97 Ack=104257 Win=152448 Len=0 TSval=7850111 TSecr=1683654721
 36   0.010945 54.230.119.71 -> 172.31.8.238 TCP 2962 [TCP segment of a reassembled PDU]
 37   0.010950 172.31.8.238 -> 54.230.119.71 TCP 66 36434 > http [ACK] Seq=97 Ack=107153 Win=158336 Len=0 TSval=7850111 TSecr=1683654721
 38   0.011052 54.230.119.71 -> 172.31.8.238 TCP 10202 [TCP segment of a reassembled PDU]
 39   0.011060 172.31.8.238 -> 54.230.119.71 TCP 66 36434 > http [ACK] Seq=97 Ack=117289 Win=178560 Len=0 TSval=7850111 TSecr=1683654721
 40   0.011212 54.230.119.71 -> 172.31.8.238 TCP 4410 [TCP segment of a reassembled PDU]
 41   0.011230 172.31.8.238 -> 54.230.119.71 TCP 66 36434 > http [ACK] Seq=97 Ack=121633 Win=187264 Len=0 TSval=7850111 TSecr=1683654721
 42   0.011327 54.230.119.71 -> 172.31.8.238 TCP 8754 [TCP segment of a reassembled PDU]
 43   0.011335 172.31.8.238 -> 54.230.119.71 TCP 66 36434 > http [ACK] Seq=97 Ack=130321 Win=204672 Len=0 TSval=7850111 TSecr=1683654721
 44   0.011480 54.230.119.71 -> 172.31.8.238 TCP 2962 [TCP segment of a reassembled PDU]
 45   0.011486 172.31.8.238 -> 54.230.119.71 TCP 66 36434 > http [ACK] Seq=97 Ack=133217 Win=210432 Len=0 TSval=7850111 TSecr=1683654721
 46   0.011592 54.230.119.71 -> 172.31.8.238 TCP 8754 [TCP segment of a reassembled PDU]
 47   0.011599 172.31.8.238 -> 54.230.119.71 TCP 66 36434 > http [ACK] Seq=97 Ack=141905 Win=227840 Len=0 TSval=7850111 TSecr=1683654721
 48   0.011792 54.230.119.71 -> 172.31.8.238 TCP 14546 [TCP segment of a reassembled PDU]
 49   0.011803 172.31.8.238 -> 54.230.119.71 TCP 66 36434 > http [ACK] Seq=97 Ack=156385 Win=256768 Len=0 TSval=7850111 TSecr=1683654721
 50   0.011942 54.230.119.71 -> 172.31.8.238 TCP 1514 [TCP segment of a reassembled PDU]
 51   0.011947 172.31.8.238 -> 54.230.119.71 TCP 66 36434 > http [ACK] Seq=97 Ack=157833 Win=259712 Len=0 TSval=7850111 TSecr=1683654721
 52   0.012080 54.230.119.71 -> 172.31.8.238 TCP 11650 [TCP segment of a reassembled PDU]
 53   0.012089 172.31.8.238 -> 54.230.119.71 TCP 66 36434 > http [ACK] Seq=97 Ack=169417 Win=282880 Len=0 TSval=7850111 TSecr=1683654721
 54   0.012261 54.230.119.71 -> 172.31.8.238 TCP 13098 [TCP segment of a reassembled PDU]
 55   0.012270 172.31.8.238 -> 54.230.119.71 TCP 66 36434 > http [ACK] Seq=97 Ack=182449 Win=308864 Len=0 TSval=7850111 TSecr=1683654721
 56   0.012568 54.230.119.71 -> 172.31.8.238 TCP 26130 [TCP segment of a reassembled PDU]
 57   0.012579 172.31.8.238 -> 54.230.119.71 TCP 66 36434 > http [ACK] Seq=97 Ack=208513 Win=360960 Len=0 TSval=7850111 TSecr=1683654721
 58   0.012727 54.230.119.71 -> 172.31.8.238 TCP 8754 [TCP segment of a reassembled PDU]
 59   0.012735 172.31.8.238 -> 54.230.119.71 TCP 66 36434 > http [ACK] Seq=97 Ack=217201 Win=378368 Len=0 TSval=7850111 TSecr=1683654722
 60   0.012844 54.230.119.71 -> 172.31.8.238 TCP 13098 [TCP segment of a reassembled PDU]
 61   0.012852 172.31.8.238 -> 54.230.119.71 TCP 66 36434 > http [ACK] Seq=97 Ack=230233 Win=404480 Len=0 TSval=7850111 TSecr=1683654722
 62   0.013090 54.230.119.71 -> 172.31.8.238 TCP 26130 [TCP segment of a reassembled PDU]
 63   0.013104 172.31.8.238 -> 54.230.119.71 TCP 66 36434 > http [ACK] Seq=97 Ack=256297 Win=456576 Len=0 TSval=7850111 TSecr=1683654722
 64   0.013110 54.230.119.71 -> 172.31.8.238 TCP 1514 [TCP segment of a reassembled PDU]
 65   0.013113 172.31.8.238 -> 54.230.119.71 TCP 66 36434 > http [ACK] Seq=97 Ack=257745 Win=459520 Len=0 TSval=7850111 TSecr=1683654722
 66   0.013330 54.230.119.71 -> 172.31.8.238 TCP 24682 [TCP segment of a reassembled PDU]
 67   0.013343 172.31.8.238 -> 54.230.119.71 TCP 66 36434 > http [ACK] Seq=97 Ack=282361 Win=508672 Len=0 TSval=7850111 TSecr=1683654722
 68   0.013498 54.230.119.71 -> 172.31.8.238 TCP 1514 [TCP segment of a reassembled PDU]
 69   0.013502 172.31.8.238 -> 54.230.119.71 TCP 66 36434 > http [ACK] Seq=97 Ack=283809 Win=511616 Len=0 TSval=7850111 TSecr=1683654722
 70   0.013680 54.230.119.71 -> 172.31.8.238 TCP 26130 [TCP segment of a reassembled PDU]
 71   0.013694 172.31.8.238 -> 54.230.119.71 TCP 66 36434 > http [ACK] Seq=97 Ack=309873 Win=524800 Len=0 TSval=7850111 TSecr=1683654722
 72   0.013999 54.230.119.71 -> 172.31.8.238 TCP 1514 [TCP segment of a reassembled PDU]
 73   0.014004 172.31.8.238 -> 54.230.119.71 TCP 66 36434 > http [ACK] Seq=97 Ack=311321 Win=564480 Len=0 TSval=7850111 TSecr=1683654722
 74   0.014162 54.230.119.71 -> 172.31.8.238 TCP 26130 [TCP segment of a reassembled PDU]
 75   0.014175 172.31.8.238 -> 54.230.119.71 TCP 66 36434 > http [ACK] Seq=97 Ack=337385 Win=538496 Len=0 TSval=7850111 TSecr=1683654722
 76   0.014181 54.230.119.71 -> 172.31.8.238 TCP 1514 [TCP segment of a reassembled PDU]
 77   0.014183 172.31.8.238 -> 54.230.119.71 TCP 66 36434 > http [ACK] Seq=97 Ack=338833 Win=537088 Len=0 TSval=7850111 TSecr=1683654722
 78   0.014400 54.230.119.71 -> 172.31.8.238 TCP 26130 [TCP segment of a reassembled PDU]
 79   0.014423 54.230.119.71 -> 172.31.8.238 TCP 4410 [TCP segment of a reassembled PDU]
 80   0.014435 172.31.8.238 -> 54.230.119.71 TCP 66 36434 > http [ACK] Seq=97 Ack=369241 Win=564480 Len=0 TSval=7850112 TSecr=1683654722
 81   0.014769 54.230.119.71 -> 172.31.8.238 TCP 4410 [TCP segment of a reassembled PDU]
 82   0.014777 172.31.8.238 -> 54.230.119.71 TCP 66 36434 > http [ACK] Seq=97 Ack=373585 Win=573184 Len=0 TSval=7850112 TSecr=1683654722
 83   0.014954 54.230.119.71 -> 172.31.8.238 TCP 26130 [TCP segment of a reassembled PDU]
 84   0.014969 172.31.8.238 -> 54.230.119.71 TCP 66 36434 > http [ACK] Seq=97 Ack=399649 Win=625280 Len=0 TSval=7850112 TSecr=1683654722
 85   0.015035 54.230.119.71 -> 172.31.8.238 TCP 2962 [TCP segment of a reassembled PDU]
 86   0.015040 172.31.8.238 -> 54.230.119.71 TCP 66 36434 > http [ACK] Seq=97 Ack=402545 Win=631040 Len=0 TSval=7850112 TSecr=1683654722
 87   0.015200 54.230.119.71 -> 172.31.8.238 TCP 26130 [TCP segment of a reassembled PDU]
 88   0.015215 172.31.8.238 -> 54.230.119.71 TCP 66 36434 > http [ACK] Seq=97 Ack=428609 Win=683136 Len=0 TSval=7850112 TSecr=1683654722
 89   0.015230 54.230.119.71 -> 172.31.8.238 TCP 5858 [TCP segment of a reassembled PDU]
 90   0.015236 172.31.8.238 -> 54.230.119.71 TCP 66 36434 > http [ACK] Seq=97 Ack=434401 Win=694784 Len=0 TSval=7850112 TSecr=1683654722
 91   0.015787 54.230.119.71 -> 172.31.8.238 TCP 5858 [TCP segment of a reassembled PDU]
 92   0.015793 172.31.8.238 -> 54.230.119.71 TCP 66 36434 > http [ACK] Seq=97 Ack=440193 Win=706304 Len=0 TSval=7850112 TSecr=1683654722
 93   0.015969 54.230.119.71 -> 172.31.8.238 TCP 21786 [TCP segment of a reassembled PDU]
 94   0.015982 172.31.8.238 -> 54.230.119.71 TCP 66 36434 > http [ACK] Seq=97 Ack=461913 Win=749824 Len=0 TSval=7850112 TSecr=1683654722
 95   0.016000 54.230.119.71 -> 172.31.8.238 TCP 4410 [TCP segment of a reassembled PDU]
 96   0.016004 172.31.8.238 -> 54.230.119.71 TCP 66 36434 > http [ACK] Seq=97 Ack=466257 Win=758528 Len=0 TSval=7850112 TSecr=1683654722
 97   0.016100 54.230.119.71 -> 172.31.8.238 TCP 33370 [TCP segment of a reassembled PDU]
 98   0.016116 172.31.8.238 -> 54.230.119.71 TCP 66 36434 > http [ACK] Seq=97 Ack=499561 Win=825088 Len=0 TSval=7850112 TSecr=1683654722
 99   0.016382 54.230.119.71 -> 172.31.8.238 TCP 11650 [TCP segment of a reassembled PDU]
100   0.016391 172.31.8.238 -> 54.230.119.71 TCP 66 36434 > http [ACK] Seq=97 Ack=511145 Win=848256 Len=0 TSval=7850112 TSecr=1683654722
101   0.016697 54.230.119.71 -> 172.31.8.238 TCP 26130 [TCP segment of a reassembled PDU]
102   0.016710 172.31.8.238 -> 54.230.119.71 TCP 66 36434 > http [ACK] Seq=97 Ack=537209 Win=900352 Len=0 TSval=7850112 TSecr=1683654722
103   0.016773 54.230.119.71 -> 172.31.8.238 TCP 26130 [TCP segment of a reassembled PDU]
104   0.016787 172.31.8.238 -> 54.230.119.71 TCP 66 36434 > http [ACK] Seq=97 Ack=563273 Win=952448 Len=0 TSval=7850112 TSecr=1683654722
105   0.016832 54.230.119.71 -> 172.31.8.238 TCP 13098 [TCP segment of a reassembled PDU]
106   0.016840 172.31.8.238 -> 54.230.119.71 TCP 66 36434 > http [ACK] Seq=97 Ack=576305 Win=978560 Len=0 TSval=7850112 TSecr=1683654722
107   0.017355 54.230.119.71 -> 172.31.8.238 TCP 7306 [TCP segment of a reassembled PDU]
108   0.017362 172.31.8.238 -> 54.230.119.71 TCP 66 36434 > http [ACK] Seq=97 Ack=583545 Win=993024 Len=0 TSval=7850112 TSecr=1683654722
109   0.017558 54.230.119.71 -> 172.31.8.238 TCP 26130 [TCP segment of a reassembled PDU]
110   0.017571 172.31.8.238 -> 54.230.119.71 TCP 66 36434 > http [ACK] Seq=97 Ack=609609 Win=1045120 Len=0 TSval=7850112 TSecr=1683654722
111   0.017634 54.230.119.71 -> 172.31.8.238 TCP 26130 [TCP segment of a reassembled PDU]
112   0.017646 172.31.8.238 -> 54.230.119.71 TCP 66 36434 > http [ACK] Seq=97 Ack=635673 Win=1097344 Len=0 TSval=7850112 TSecr=1683654722
113   0.017689 54.230.119.71 -> 172.31.8.238 TCP 5858 [TCP segment of a reassembled PDU]
114   0.017695 172.31.8.238 -> 54.230.119.71 TCP 66 36434 > http [ACK] Seq=97 Ack=641465 Win=1108864 Len=0 TSval=7850112 TSecr=1683654722
115   0.018091 54.230.119.71 -> 172.31.8.238 TCP 5858 [TCP segment of a reassembled PDU]
116   0.018098 172.31.8.238 -> 54.230.119.71 TCP 66 36434 > http [ACK] Seq=97 Ack=647257 Win=1120512 Len=0 TSval=7850112 TSecr=1683654722
117   0.018273 54.230.119.71 -> 172.31.8.238 TCP 24682 [TCP segment of a reassembled PDU]
118   0.018285 172.31.8.238 -> 54.230.119.71 TCP 66 36434 > http [ACK] Seq=97 Ack=671873 Win=1169664 Len=0 TSval=7850112 TSecr=1683654722
119   0.018385 54.230.119.71 -> 172.31.8.238 TCP 27578 [TCP segment of a reassembled PDU]
120   0.018399 172.31.8.238 -> 54.230.119.71 TCP 66 36434 > http [ACK] Seq=97 Ack=699385 Win=1224704 Len=0 TSval=7850113 TSecr=1683654722
121   0.018408 54.230.119.71 -> 172.31.8.238 TCP 7306 [TCP segment of a reassembled PDU]
122   0.018413 172.31.8.238 -> 54.230.119.71 TCP 66 36434 > http [ACK] Seq=97 Ack=706625 Win=1239168 Len=0 TSval=7850113 TSecr=1683654722
123   0.018711 54.230.119.71 -> 172.31.8.238 TCP 21786 [TCP segment of a reassembled PDU]
124   0.018724 172.31.8.238 -> 54.230.119.71 TCP 66 36434 > http [ACK] Seq=97 Ack=728345 Win=1282688 Len=0 TSval=7850113 TSecr=1683654722
125   0.018831 54.230.119.71 -> 172.31.8.238 TCP 10202 [TCP segment of a reassembled PDU]
126   0.018838 172.31.8.238 -> 54.230.119.71 TCP 66 36434 > http [ACK] Seq=97 Ack=738481 Win=1302912 Len=0 TSval=7850113 TSecr=1683654722
127   0.019215 54.230.119.71 -> 172.31.8.238 TCP 26130 [TCP segment of a reassembled PDU]
128   0.019229 172.31.8.238 -> 54.230.119.71 TCP 66 36434 > http [ACK] Seq=97 Ack=764545 Win=1335808 Len=0 TSval=7850113 TSecr=1683654722
129   0.019285 54.230.119.71 -> 172.31.8.238 TCP 26130 [TCP segment of a reassembled PDU]
130   0.019299 172.31.8.238 -> 54.230.119.71 TCP 66 36434 > http [ACK] Seq=97 Ack=790609 Win=1335808 Len=0 TSval=7850113 TSecr=1683654722
131   0.019419 54.230.119.71 -> 172.31.8.238 TCP 34818 [TCP segment of a reassembled PDU]
132   0.019451 54.230.119.71 -> 172.31.8.238 TCP 11650 [TCP segment of a reassembled PDU]
133   0.019461 172.31.8.238 -> 54.230.119.71 TCP 66 36434 > http [ACK] Seq=97 Ack=825361 Win=1321472 Len=0 TSval=7850113 TSecr=1683654722
134   0.019475 172.31.8.238 -> 54.230.119.71 TCP 66 36434 > http [ACK] Seq=97 Ack=836945 Win=1309952 Len=0 TSval=7850113 TSecr=1683654722
135   0.020117 54.230.119.71 -> 172.31.8.238 TCP 1514 [TCP segment of a reassembled PDU]
136   0.020122 172.31.8.238 -> 54.230.119.71 TCP 66 36434 > http [ACK] Seq=97 Ack=838393 Win=1357952 Len=0 TSval=7850113 TSecr=1683654722
137   0.020292 54.230.119.71 -> 172.31.8.238 TCP 26130 [TCP segment of a reassembled PDU]
138   0.020315 172.31.8.238 -> 54.230.119.71 TCP 66 36434 > http [ACK] Seq=97 Ack=864457 Win=1335808 Len=0 TSval=7850113 TSecr=1683654722
139   0.020360 54.230.119.71 -> 172.31.8.238 TCP 26130 [TCP segment of a reassembled PDU]
140   0.020373 172.31.8.238 -> 54.230.119.71 TCP 66 36434 > http [ACK] Seq=97 Ack=890521 Win=1335808 Len=0 TSval=7850113 TSecr=1683654722
141   0.020439 54.230.119.71 -> 172.31.8.238 TCP 26130 [TCP segment of a reassembled PDU]
142   0.020452 172.31.8.238 -> 54.230.119.71 TCP 66 36434 > http [ACK] Seq=97 Ack=916585 Win=1335808 Len=0 TSval=7850113 TSecr=1683654722
143   0.020510 54.230.119.71 -> 172.31.8.238 TCP 24682 [TCP segment of a reassembled PDU]
144   0.020522 172.31.8.238 -> 54.230.119.71 TCP 66 36434 > http [ACK] Seq=97 Ack=941201 Win=1338112 Len=0 TSval=7850113 TSecr=1683654722
145   0.020909 54.230.119.71 -> 172.31.8.238 TCP 2962 [TCP segment of a reassembled PDU]
146   0.020915 172.31.8.238 -> 54.230.119.71 TCP 66 36434 > http [ACK] Seq=97 Ack=944097 Win=1363712 Len=0 TSval=7850113 TSecr=1683654722
147   0.021050 54.230.119.71 -> 172.31.8.238 TCP 8754 [TCP segment of a reassembled PDU]
148   0.021058 172.31.8.238 -> 54.230.119.71 TCP 66 36434 > http [ACK] Seq=97 Ack=952785 Win=1364352 Len=0 TSval=7850113 TSecr=1683654722
149   0.021088 54.230.119.71 -> 172.31.8.238 TCP 1514 [TCP Previous segment not captured] [TCP segment of a reassembled PDU]
150   0.021093 172.31.8.238 -> 54.230.119.71 TCP 78 [TCP Window Update] 36434 > http [ACK] Seq=97 Ack=952785 Win=1376128 Len=0 TSval=7850113 TSecr=1683654722 SLE=954233 SRE=955681
151   0.021147 54.230.119.71 -> 172.31.8.238 TCP 1514 [TCP Out-Of-Order] [TCP segment of a reassembled PDU]
152   0.021153 172.31.8.238 -> 54.230.119.71 TCP 66 36434 > http [ACK] Seq=97 Ack=955681 Win=1373696 Len=0 TSval=7850113 TSecr=1683654722
153   0.021312 54.230.119.71 -> 172.31.8.238 TCP 26130 [TCP segment of a reassembled PDU]
154   0.021324 172.31.8.238 -> 54.230.119.71 TCP 66 36434 > http [ACK] Seq=97 Ack=981745 Win=1347712 Len=0 TSval=7850113 TSecr=1683654722
155   0.021342 54.230.119.71 -> 172.31.8.238 TCP 21786 [TCP segment of a reassembled PDU]
156   0.021355 172.31.8.238 -> 54.230.119.71 TCP 66 36434 > http [ACK] Seq=97 Ack=1003465 Win=1326080 Len=0 TSval=7850113 TSecr=1683654722
157   0.021442 54.230.119.71 -> 172.31.8.238 TCP 29026 [TCP segment of a reassembled PDU]
158   0.021457 172.31.8.238 -> 54.230.119.71 TCP 66 36434 > http [ACK] Seq=97 Ack=1032425 Win=1330944 Len=0 TSval=7850113 TSecr=1683654722
159   0.021818 54.230.119.71 -> 172.31.8.238 TCP 26130 [TCP segment of a reassembled PDU]
160   0.021832 172.31.8.238 -> 54.230.119.71 TCP 66 36434 > http [ACK] Seq=97 Ack=1058489 Win=1335808 Len=0 TSval=7850113 TSecr=1683654722
161   0.021853 54.230.119.71 -> 172.31.8.238 TCP 7306 [TCP segment of a reassembled PDU]
162   0.021858 172.31.8.238 -> 54.230.119.71 TCP 66 36434 > http [ACK] Seq=97 Ack=1065729 Win=1328640 Len=0 TSval=7850113 TSecr=1683654722
163   0.021860 54.230.119.71 -> 172.31.8.238 TCP 1514 [TCP segment of a reassembled PDU]
164   0.021861 172.31.8.238 -> 54.230.119.71 TCP 66 36434 > http [ACK] Seq=97 Ack=1067177 Win=1327232 Len=0 TSval=7850113 TSecr=1683654722
165   0.022083 54.230.119.71 -> 172.31.8.238 TCP 26130 [TCP segment of a reassembled PDU]
166   0.022105 172.31.8.238 -> 54.230.119.71 TCP 66 36434 > http [ACK] Seq=97 Ack=1093241 Win=1335808 Len=0 TSval=7850113 TSecr=1683654722
167   0.022112 54.230.119.71 -> 172.31.8.238 TCP 4410 [TCP segment of a reassembled PDU]
168   0.022116 172.31.8.238 -> 54.230.119.71 TCP 66 36434 > http [ACK] Seq=97 Ack=1097585 Win=1331584 Len=0 TSval=7850113 TSecr=1683654722
169   0.022460 54.230.119.71 -> 172.31.8.238 TCP 1514 [TCP segment of a reassembled PDU]
170   0.022465 172.31.8.238 -> 54.230.119.71 TCP 66 36434 > http [ACK] Seq=97 Ack=1099033 Win=1376128 Len=0 TSval=7850114 TSecr=1683654722
171   0.022637 54.230.119.71 -> 172.31.8.238 TCP 21786 [TCP segment of a reassembled PDU]
172   0.022649 172.31.8.238 -> 54.230.119.71 TCP 66 36434 > http [ACK] Seq=97 Ack=1120753 Win=1354496 Len=0 TSval=7850114 TSecr=1683654722
173   0.022669 54.230.119.71 -> 172.31.8.238 TCP 4410 [TCP segment of a reassembled PDU]
174   0.022674 172.31.8.238 -> 54.230.119.71 TCP 66 36434 > http [ACK] Seq=97 Ack=1125097 Win=1350272 Len=0 TSval=7850114 TSecr=1683654722
175   0.022754 54.230.119.71 -> 172.31.8.238 TCP 23234 [TCP segment of a reassembled PDU]
176   0.022765 172.31.8.238 -> 54.230.119.71 TCP 66 36434 > http [ACK] Seq=97 Ack=1148265 Win=1340544 Len=0 TSval=7850114 TSecr=1683654722
177   0.023065 54.230.119.71 -> 172.31.8.238 TCP 14546 [TCP segment of a reassembled PDU]
178   0.023074 172.31.8.238 -> 54.230.119.71 TCP 66 36434 > http [ACK] Seq=97 Ack=1162745 Win=1354752 Len=0 TSval=7850114 TSecr=1683654723
179   0.023215 54.230.119.71 -> 172.31.8.238 TCP 4410 [TCP segment of a reassembled PDU]
180   0.023220 172.31.8.238 -> 54.230.119.71 TCP 66 36434 > http [ACK] Seq=97 Ack=1167089 Win=1371392 Len=0 TSval=7850114 TSecr=1683654723
181   0.023389 54.230.119.71 -> 172.31.8.238 TCP 26130 [TCP segment of a reassembled PDU]
182   0.023412 172.31.8.238 -> 54.230.119.71 TCP 66 36434 > http [ACK] Seq=97 Ack=1193153 Win=1345408 Len=0 TSval=7850114 TSecr=1683654723
183   0.023459 54.230.119.71 -> 172.31.8.238 TCP 26130 [TCP segment of a reassembled PDU]
184   0.023484 172.31.8.238 -> 54.230.119.71 TCP 66 36434 > http [ACK] Seq=97 Ack=1219217 Win=1335808 Len=0 TSval=7850114 TSecr=1683654723
185   0.023517 54.230.119.71 -> 172.31.8.238 TCP 8754 [TCP segment of a reassembled PDU]
186   0.023524 172.31.8.238 -> 54.230.119.71 TCP 66 36434 > http [ACK] Seq=97 Ack=1227905 Win=1364352 Len=0 TSval=7850114 TSecr=1683654723
187   0.023795 54.230.119.71 -> 172.31.8.238 TCP 20338 [TCP segment of a reassembled PDU]
188   0.023818 172.31.8.238 -> 54.230.119.71 TCP 66 36434 > http [ACK] Seq=97 Ack=1248177 Win=1345280 Len=0 TSval=7850114 TSecr=1683654723
189   0.023929 54.230.119.71 -> 172.31.8.238 TCP 17442 [TCP segment of a reassembled PDU]
190   0.023940 172.31.8.238 -> 54.230.119.71 TCP 66 36434 > http [ACK] Seq=97 Ack=1265553 Win=1350016 Len=0 TSval=7850114 TSecr=1683654723
191   0.024023 54.230.119.71 -> 172.31.8.238 TCP 4410 [TCP segment of a reassembled PDU]
192   0.024028 172.31.8.238 -> 54.230.119.71 TCP 66 36434 > http [ACK] Seq=97 Ack=1269897 Win=1371392 Len=0 TSval=7850114 TSecr=1683654723
193   0.024179 54.230.119.71 -> 172.31.8.238 TCP 26130 [TCP segment of a reassembled PDU]
194   0.024203 172.31.8.238 -> 54.230.119.71 TCP 66 36434 > http [ACK] Seq=97 Ack=1295961 Win=1345408 Len=0 TSval=7850114 TSecr=1683654723
195   0.024261 54.230.119.71 -> 172.31.8.238 TCP 26130 [TCP segment of a reassembled PDU]
196   0.024286 172.31.8.238 -> 54.230.119.71 TCP 66 36434 > http [ACK] Seq=97 Ack=1322025 Win=1335808 Len=0 TSval=7850114 TSecr=1683654723
197   0.024340 54.230.119.71 -> 172.31.8.238 TCP 26130 [TCP segment of a reassembled PDU]
198   0.024353 172.31.8.238 -> 54.230.119.71 TCP 66 36434 > http [ACK] Seq=97 Ack=1348089 Win=1335808 Len=0 TSval=7850114 TSecr=1683654723
199   0.024402 54.230.119.71 -> 172.31.8.238 TCP 10202 [TCP segment of a reassembled PDU]
200   0.024409 172.31.8.238 -> 54.230.119.71 TCP 66 36434 > http [ACK] Seq=97 Ack=1358225 Win=1361920 Len=0 TSval=7850114 TSecr=1683654723
201   0.024740 54.230.119.71 -> 172.31.8.238 TCP 2962 [TCP segment of a reassembled PDU]
202   0.024746 172.31.8.238 -> 54.230.119.71 TCP 66 36434 > http [ACK] Seq=97 Ack=1361121 Win=1373824 Len=0 TSval=7850114 TSecr=1683654723
203   0.024909 54.230.119.71 -> 172.31.8.238 TCP 23234 [TCP segment of a reassembled PDU]
204   0.024932 172.31.8.238 -> 54.230.119.71 TCP 66 36434 > http [ACK] Seq=97 Ack=1384289 Win=1350656 Len=0 TSval=7850114 TSecr=1683654723
205   0.024962 54.230.119.71 -> 172.31.8.238 TCP 2962 [TCP segment of a reassembled PDU]
206   0.024967 172.31.8.238 -> 54.230.119.71 TCP 66 36434 > http [ACK] Seq=97 Ack=1387185 Win=1373824 Len=0 TSval=7850114 TSecr=1683654723
207   0.025090 54.230.119.71 -> 172.31.8.238 TCP 52194 [TCP segment of a reassembled PDU]
208   0.025121 172.31.8.238 -> 54.230.119.71 TCP 66 36434 > http [ACK] Seq=97 Ack=1439313 Win=1321728 Len=0 TSval=7850114 TSecr=1683654723
209   0.025153 54.230.119.71 -> 172.31.8.238 TCP 26130 [TCP segment of a reassembled PDU]
210   0.025170 172.31.8.238 -> 54.230.119.71 TCP 66 36434 > http [ACK] Seq=97 Ack=1465377 Win=1295744 Len=0 TSval=7850114 TSecr=1683654723
211   0.025553 54.230.119.71 -> 172.31.8.238 TCP 2962 [TCP segment of a reassembled PDU]
212   0.025559 172.31.8.238 -> 54.230.119.71 TCP 66 36434 > http [ACK] Seq=97 Ack=1468273 Win=1373824 Len=0 TSval=7850114 TSecr=1683654723
213   0.025752 54.230.119.71 -> 172.31.8.238 TCP 26130 [TCP segment of a reassembled PDU]
214   0.025779 172.31.8.238 -> 54.230.119.71 TCP 66 36434 > http [ACK] Seq=97 Ack=1494337 Win=1347840 Len=0 TSval=7850114 TSecr=1683654723
215   0.025826 54.230.119.71 -> 172.31.8.238 TCP 26130 [TCP segment of a reassembled PDU]
216   0.025853 172.31.8.238 -> 54.230.119.71 TCP 66 36434 > http [ACK] Seq=97 Ack=1520401 Win=1335808 Len=0 TSval=7850114 TSecr=1683654723
217   0.025920 54.230.119.71 -> 172.31.8.238 TCP 26130 [TCP segment of a reassembled PDU]
218   0.025934 172.31.8.238 -> 54.230.119.71 TCP 66 36434 > http [ACK] Seq=97 Ack=1546465 Win=1335808 Len=0 TSval=7850114 TSecr=1683654723
219   0.025974 54.230.119.71 -> 172.31.8.238 TCP 7306 [TCP segment of a reassembled PDU]
220   0.025981 172.31.8.238 -> 54.230.119.71 TCP 66 36434 > http [ACK] Seq=97 Ack=1553705 Win=1366656 Len=0 TSval=7850114 TSecr=1683654723
221   0.026471 54.230.119.71 -> 172.31.8.238 TCP 5858 [TCP segment of a reassembled PDU]
222   0.026477 172.31.8.238 -> 54.230.119.71 TCP 66 36434 > http [ACK] Seq=97 Ack=1559497 Win=1369088 Len=0 TSval=7850115 TSecr=1683654723
223   0.026645 54.230.119.71 -> 172.31.8.238 TCP 26130 [TCP segment of a reassembled PDU]
224   0.026670 172.31.8.238 -> 54.230.119.71 TCP 66 36434 > http [ACK] Seq=97 Ack=1585561 Win=1343104 Len=0 TSval=7850115 TSecr=1683654723
225   0.026715 54.230.119.71 -> 172.31.8.238 TCP 23234 [TCP segment of a reassembled PDU]
226   0.026795 54.230.119.71 -> 172.31.8.238 TCP 29026 [TCP segment of a reassembled PDU]
227   0.026878 54.230.119.71 -> 172.31.8.238 TCP 26130 [TCP segment of a reassembled PDU]
228   0.026913 54.230.119.71 -> 172.31.8.238 TCP 10202 [TCP segment of a reassembled PDU]
229   0.026948 54.230.119.71 -> 172.31.8.238 TCP 1514 [TCP Previous segment not captured] [TCP segment of a reassembled PDU]
230   0.026952 172.31.8.238 -> 54.230.119.71 TCP 78 36434 > http [ACK] Seq=97 Ack=1673889 Win=1254784 Len=0 TSval=7850115 TSecr=1683654723 SLE=1678233 SRE=1679681
231   0.027051 54.230.119.71 -> 172.31.8.238 TCP 1514 [TCP Out-Of-Order] [TCP segment of a reassembled PDU]
232   0.027057 172.31.8.238 -> 54.230.119.71 TCP 78 36434 > http [ACK] Seq=97 Ack=1675337 Win=1373696 Len=0 TSval=7850115 TSecr=1683654723 SLE=1678233 SRE=1679681
233   0.027062 54.230.119.71 -> 172.31.8.238 TCP 1514 [TCP segment of a reassembled PDU]
234   0.027065 172.31.8.238 -> 54.230.119.71 TCP 78 [TCP Dup ACK 232#1] 36434 > http [ACK] Seq=97 Ack=1675337 Win=1373696 Len=0 TSval=7850115 TSecr=1683654723 SLE=1678233 SRE=1681129
235   0.027282 54.230.119.71 -> 172.31.8.238 TCP 1514 [TCP Out-Of-Order] [TCP segment of a reassembled PDU]
236   0.027287 172.31.8.238 -> 54.230.119.71 TCP 78 36434 > http [ACK] Seq=97 Ack=1676785 Win=1372288 Len=0 TSval=7850115 TSecr=1683654723 SLE=1678233 SRE=1681129
237   0.027290 54.230.119.71 -> 172.31.8.238 TCP 1514 [TCP segment of a reassembled PDU]
238   0.027293 172.31.8.238 -> 54.230.119.71 TCP 78 [TCP Dup ACK 236#1] 36434 > http [ACK] Seq=97 Ack=1676785 Win=1372288 Len=0 TSval=7850115 TSecr=1683654723 SLE=1678233 SRE=1682577
239   0.027294 54.230.119.71 -> 172.31.8.238 TCP 1514 [TCP Out-Of-Order] [TCP segment of a reassembled PDU]
240   0.027296 172.31.8.238 -> 54.230.119.71 TCP 66 36434 > http [ACK] Seq=97 Ack=1682577 Win=1366528 Len=0 TSval=7850115 TSecr=1683654723
241   0.027298 54.230.119.71 -> 172.31.8.238 TCP 1514 [TCP segment of a reassembled PDU]
242   0.027300 172.31.8.238 -> 54.230.119.71 TCP 66 36434 > http [ACK] Seq=97 Ack=1684025 Win=1365120 Len=0 TSval=7850115 TSecr=1683654723
243   0.027749 54.230.119.71 -> 172.31.8.238 TCP 1514 [TCP Out-Of-Order] [TCP segment of a reassembled PDU]
244   0.027753 172.31.8.238 -> 54.230.119.71 TCP 78 [TCP Window Update] 36434 > http [ACK] Seq=97 Ack=1684025 Win=1377152 Len=0 TSval=7850115 TSecr=1683654723 SLE=1673889 SRE=1675337
245   0.027867 54.230.119.71 -> 172.31.8.238 TCP 26130 [TCP segment of a reassembled PDU]
246   0.027880 172.31.8.238 -> 54.230.119.71 TCP 66 36434 > http [ACK] Seq=97 Ack=1710089 Win=1351168 Len=0 TSval=7850115 TSecr=1683654723
247   0.027921 54.230.119.71 -> 172.31.8.238 TCP 26130 [TCP segment of a reassembled PDU]
248   0.027946 172.31.8.238 -> 54.230.119.71 TCP 66 36434 > http [ACK] Seq=97 Ack=1736153 Win=1335808 Len=0 TSval=7850115 TSecr=1683654723
249   0.027995 54.230.119.71 -> 172.31.8.238 TCP 8754 [TCP segment of a reassembled PDU]
250   0.028002 172.31.8.238 -> 54.230.119.71 TCP 66 36434 > http [ACK] Seq=97 Ack=1744841 Win=1364352 Len=0 TSval=7850115 TSecr=1683654723
251   0.028054 54.230.119.71 -> 172.31.8.238 TCP 1514 [TCP Out-Of-Order] [TCP segment of a reassembled PDU]
252   0.028058 172.31.8.238 -> 54.230.119.71 TCP 78 [TCP Dup ACK 250#1] 36434 > http [ACK] Seq=97 Ack=1744841 Win=1364352 Len=0 TSval=7850115 TSecr=1683654723 SLE=1675337 SRE=1676785
253   0.028064 54.230.119.71 -> 172.31.8.238 TCP 2962 [TCP segment of a reassembled PDU]
254   0.028068 172.31.8.238 -> 54.230.119.71 TCP 66 36434 > http [ACK] Seq=97 Ack=1747737 Win=1361536 Len=0 TSval=7850115 TSecr=1683654723
255   0.028107 54.230.119.71 -> 172.31.8.238 TCP 1514 [TCP Out-Of-Order] [TCP segment of a reassembled PDU]
256   0.028110 172.31.8.238 -> 54.230.119.71 TCP 78 [TCP Dup ACK 254#1] 36434 > http [ACK] Seq=97 Ack=1747737 Win=1361536 Len=0 TSval=7850115 TSecr=1683654723 SLE=1676785 SRE=1678233
257   0.028221 54.230.119.71 -> 172.31.8.238 TCP 2962 [TCP segment of a reassembled PDU]
258   0.028227 172.31.8.238 -> 54.230.119.71 TCP 66 36434 > http [ACK] Seq=97 Ack=1750633 Win=1358720 Len=0 TSval=7850115 TSecr=1683654723
259   0.028752 54.230.119.71 -> 172.31.8.238 TCP 1514 [TCP segment of a reassembled PDU]
260   0.028757 172.31.8.238 -> 54.230.119.71 TCP 66 36434 > http [ACK] Seq=97 Ack=1752081 Win=1376128 Len=0 TSval=7850115 TSecr=1683654723
261   0.029014 54.230.119.71 -> 172.31.8.238 TCP 5858 [TCP segment of a reassembled PDU]
262   0.029020 172.31.8.238 -> 54.230.119.71 TCP 66 36434 > http [ACK] Seq=97 Ack=1757873 Win=1370368 Len=0 TSval=7850115 TSecr=1683654723
263   0.029540 54.230.119.71 -> 172.31.8.238 TCP 2962 [TCP segment of a reassembled PDU]
264   0.029545 172.31.8.238 -> 54.230.119.71 TCP 66 36434 > http [ACK] Seq=97 Ack=1760769 Win=1373824 Len=0 TSval=7850115 TSecr=1683654723
265   0.029858 54.230.119.71 -> 172.31.8.238 TCP 7306 [TCP segment of a reassembled PDU]
266   0.029864 172.31.8.238 -> 54.230.119.71 TCP 66 36434 > http [ACK] Seq=97 Ack=1768009 Win=1366656 Len=0 TSval=7850115 TSecr=1683654723
267   0.030292 54.230.119.71 -> 172.31.8.238 TCP 2962 [TCP segment of a reassembled PDU]
268   0.030297 172.31.8.238 -> 54.230.119.71 TCP 66 36434 > http [ACK] Seq=97 Ack=1770905 Win=1373824 Len=0 TSval=7850115 TSecr=1683654723
269   0.030409 54.230.119.71 -> 172.31.8.238 TCP 1514 [TCP segment of a reassembled PDU]
270   0.030413 172.31.8.238 -> 54.230.119.71 TCP 66 36434 > http [ACK] Seq=97 Ack=1772353 Win=1376128 Len=0 TSval=7850116 TSecr=1683654723
271   0.030628 54.230.119.71 -> 172.31.8.238 TCP 8754 [TCP segment of a reassembled PDU]
272   0.030636 172.31.8.238 -> 54.230.119.71 TCP 66 36434 > http [ACK] Seq=97 Ack=1781041 Win=1367552 Len=0 TSval=7850116 TSecr=1683654723
273   0.031064 54.230.119.71 -> 172.31.8.238 TCP 2962 [TCP segment of a reassembled PDU]
274   0.031068 172.31.8.238 -> 54.230.119.71 TCP 66 36434 > http [ACK] Seq=97 Ack=1783937 Win=1373824 Len=0 TSval=7850116 TSecr=1683654723
275   0.031176 54.230.119.71 -> 172.31.8.238 TCP 4410 [TCP segment of a reassembled PDU]
276   0.031181 172.31.8.238 -> 54.230.119.71 TCP 66 36434 > http [ACK] Seq=97 Ack=1788281 Win=1371392 Len=0 TSval=7850116 TSecr=1683654723
277   0.031373 54.230.119.71 -> 172.31.8.238 TCP 10202 [TCP segment of a reassembled PDU]
278   0.031381 172.31.8.238 -> 54.230.119.71 TCP 66 36434 > http [ACK] Seq=97 Ack=1798417 Win=1361920 Len=0 TSval=7850116 TSecr=1683654723
279   0.031845 54.230.119.71 -> 172.31.8.238 TCP 2962 [TCP segment of a reassembled PDU]
280   0.031851 172.31.8.238 -> 54.230.119.71 TCP 66 36434 > http [ACK] Seq=97 Ack=1801313 Win=1373824 Len=0 TSval=7850116 TSecr=1683654723
281   0.031994 54.230.119.71 -> 172.31.8.238 TCP 13098 [TCP segment of a reassembled PDU]
282   0.032002 172.31.8.238 -> 54.230.119.71 TCP 66 36434 > http [ACK] Seq=97 Ack=1814345 Win=1360896 Len=0 TSval=7850116 TSecr=1683654723
283   0.032600 54.230.119.71 -> 172.31.8.238 TCP 2962 [TCP segment of a reassembled PDU]
284   0.032606 172.31.8.238 -> 54.230.119.71 TCP 66 36434 > http [ACK] Seq=97 Ack=1817241 Win=1373824 Len=0 TSval=7850116 TSecr=1683654723
285   0.032751 54.230.119.71 -> 172.31.8.238 TCP 21786 [TCP segment of a reassembled PDU]
286   0.032763 172.31.8.238 -> 54.230.119.71 TCP 66 36434 > http [ACK] Seq=97 Ack=1838961 Win=1352192 Len=0 TSval=7850116 TSecr=1683654723
287   0.033392 54.230.119.71 -> 172.31.8.238 TCP 4410 [TCP segment of a reassembled PDU]
288   0.033399 172.31.8.238 -> 54.230.119.71 TCP 66 36434 > http [ACK] Seq=97 Ack=1843305 Win=1371392 Len=0 TSval=7850116 TSecr=1683654724
289   0.033546 54.230.119.71 -> 172.31.8.238 TCP 23234 [TCP segment of a reassembled PDU]
290   0.033571 172.31.8.238 -> 54.230.119.71 TCP 66 36434 > http [ACK] Seq=97 Ack=1866473 Win=1348224 Len=0 TSval=7850116 TSecr=1683654724
291   0.034172 54.230.119.71 -> 172.31.8.238 TCP 7306 [TCP segment of a reassembled PDU]
292   0.034179 172.31.8.238 -> 54.230.119.71 TCP 66 36434 > http [ACK] Seq=97 Ack=1873713 Win=1366656 Len=0 TSval=7850116 TSecr=1683654724
293   0.034314 54.230.119.71 -> 172.31.8.238 TCP 23234 [TCP segment of a reassembled PDU]
294   0.034337 172.31.8.238 -> 54.230.119.71 TCP 66 36434 > http [ACK] Seq=97 Ack=1896881 Win=1343488 Len=0 TSval=7850117 TSecr=1683654724
295   0.034935 54.230.119.71 -> 172.31.8.238 TCP 4410 [TCP segment of a reassembled PDU]
296   0.034941 172.31.8.238 -> 54.230.119.71 TCP 66 36434 > http [ACK] Seq=97 Ack=1901225 Win=1371392 Len=0 TSval=7850117 TSecr=1683654724
297   0.035106 54.230.119.71 -> 172.31.8.238 TCP 26130 [TCP segment of a reassembled PDU]
298   0.035121 54.230.119.71 -> 172.31.8.238 TCP 2962 [TCP segment of a reassembled PDU]
299   0.035134 172.31.8.238 -> 54.230.119.71 TCP 66 36434 > http [ACK] Seq=97 Ack=1930185 Win=1342464 Len=0 TSval=7850117 TSecr=1683654724
300   0.035760 54.230.119.71 -> 172.31.8.238 TCP 7306 [TCP segment of a reassembled PDU]
301   0.035765 172.31.8.238 -> 54.230.119.71 TCP 66 36434 > http [ACK] Seq=97 Ack=1937425 Win=1366656 Len=0 TSval=7850117 TSecr=1683654724
302   0.035928 54.230.119.71 -> 172.31.8.238 TCP 26130 [TCP segment of a reassembled PDU]
303   0.035946 54.230.119.71 -> 172.31.8.238 TCP 2962 [TCP segment of a reassembled PDU]
304   0.035953 172.31.8.238 -> 54.230.119.71 TCP 66 36434 > http [ACK] Seq=97 Ack=1966385 Win=1337728 Len=0 TSval=7850117 TSecr=1683654724
305   0.036682 54.230.119.71 -> 172.31.8.238 TCP 1514 [TCP segment of a reassembled PDU]
306   0.036885 54.230.119.71 -> 172.31.8.238 TCP 21786 [TCP segment of a reassembled PDU]
307   0.036892 172.31.8.238 -> 54.230.119.71 TCP 66 36434 > http [ACK] Seq=97 Ack=1989553 Win=1342848 Len=0 TSval=7850117 TSecr=1683654724
308   0.036914 54.230.119.71 -> 172.31.8.238 TCP 4410 [TCP segment of a reassembled PDU]
309   0.036925 172.31.8.238 -> 54.230.119.71 TCP 66 36434 > http [ACK] Seq=97 Ack=1993897 Win=1377152 Len=0 TSval=7850117 TSecr=1683654724
310   0.036976 54.230.119.71 -> 172.31.8.238 TCP 11650 [TCP segment of a reassembled PDU]
311   0.036992 172.31.8.238 -> 54.230.119.71 TCP 66 36434 > http [ACK] Seq=97 Ack=2005481 Win=1377152 Len=0 TSval=7850117 TSecr=1683654724
312   0.037291 54.230.119.71 -> 172.31.8.238 TCP 4410 [TCP segment of a reassembled PDU]
313   0.037306 172.31.8.238 -> 54.230.119.71 TCP 66 36434 > http [ACK] Seq=97 Ack=2009825 Win=1377152 Len=0 TSval=7850117 TSecr=1683654724
314   0.037370 54.230.119.71 -> 172.31.8.238 TCP 17442 [TCP segment of a reassembled PDU]
315   0.037387 172.31.8.238 -> 54.230.119.71 TCP 66 36434 > http [ACK] Seq=97 Ack=2027201 Win=1359872 Len=0 TSval=7850117 TSecr=1683654724
316   0.037433 54.230.119.71 -> 172.31.8.238 TCP 1514 [TCP Previous segment not captured] [TCP segment of a reassembled PDU]
317   0.037438 172.31.8.238 -> 54.230.119.71 TCP 78 [TCP Window Update] 36434 > http [ACK] Seq=97 Ack=2027201 Win=1376128 Len=0 TSval=7850117 TSecr=1683654724 SLE=2028649 SRE=2030097
318   0.037504 54.230.119.71 -> 172.31.8.238 TCP 1514 [TCP Out-Of-Order] [TCP segment of a reassembled PDU]
319   0.037508 172.31.8.238 -> 54.230.119.71 TCP 66 36434 > http [ACK] Seq=97 Ack=2030097 Win=1373696 Len=0 TSval=7850117 TSecr=1683654724
320   0.037761 54.230.119.71 -> 172.31.8.238 TCP 4410 [TCP segment of a reassembled PDU]
321   0.037765 172.31.8.238 -> 54.230.119.71 TCP 66 36434 > http [ACK] Seq=97 Ack=2034441 Win=1371392 Len=0 TSval=7850117 TSecr=1683654724
322   0.037930 54.230.119.71 -> 172.31.8.238 TCP 17442 [TCP segment of a reassembled PDU]
323   0.037936 172.31.8.238 -> 54.230.119.71 TCP 66 36434 > http [ACK] Seq=97 Ack=2051817 Win=1354112 Len=0 TSval=7850117 TSecr=1683654724
324   0.037980 54.230.119.71 -> 172.31.8.238 TCP 8754 [TCP segment of a reassembled PDU]
325   0.037984 172.31.8.238 -> 54.230.119.71 TCP 66 36434 > http [ACK] Seq=97 Ack=2060505 Win=1364352 Len=0 TSval=7850117 TSecr=1683654724
326   0.038042 54.230.119.71 -> 172.31.8.238 TCP 13098 [TCP segment of a reassembled PDU]
327   0.038047 172.31.8.238 -> 54.230.119.71 TCP 66 36434 > http [ACK] Seq=97 Ack=2073537 Win=1357184 Len=0 TSval=7850117 TSecr=1683654724
328   0.038131 54.230.119.71 -> 172.31.8.238 TCP 1514 [TCP segment of a reassembled PDU]
329   0.038135 172.31.8.238 -> 54.230.119.71 TCP 66 36434 > http [ACK] Seq=97 Ack=2074985 Win=1355776 Len=0 TSval=7850117 TSecr=1683654724
330   0.038800 54.230.119.71 -> 172.31.8.238 TCP 4410 [TCP segment of a reassembled PDU]
331   0.038806 172.31.8.238 -> 54.230.119.71 TCP 66 36434 > http [ACK] Seq=97 Ack=2079329 Win=1371392 Len=0 TSval=7850118 TSecr=1683654724
332   0.038947 54.230.119.71 -> 172.31.8.238 TCP 26130 [TCP segment of a reassembled PDU]
333   0.038954 172.31.8.238 -> 54.230.119.71 TCP 66 36434 > http [ACK] Seq=97 Ack=2105393 Win=1345408 Len=0 TSval=7850118 TSecr=1683654724
334   0.039034 54.230.119.71 -> 172.31.8.238 TCP 21786 [TCP segment of a reassembled PDU]
335   0.039041 172.31.8.238 -> 54.230.119.71 TCP 66 36434 > http [ACK] Seq=97 Ack=2127113 Win=1342848 Len=0 TSval=7850118 TSecr=1683654724
336   0.039562 54.230.119.71 -> 172.31.8.238 TCP 5858 [TCP segment of a reassembled PDU]
337   0.039567 172.31.8.238 -> 54.230.119.71 TCP 66 36434 > http [ACK] Seq=97 Ack=2132905 Win=1369088 Len=0 TSval=7850118 TSecr=1683654724
338   0.039717 54.230.119.71 -> 172.31.8.238 TCP 26130 [TCP segment of a reassembled PDU]
339   0.039724 172.31.8.238 -> 54.230.119.71 TCP 66 36434 > http [ACK] Seq=97 Ack=2158969 Win=1343104 Len=0 TSval=7850118 TSecr=1683654724
340   0.039795 54.230.119.71 -> 172.31.8.238 TCP 26130 [TCP segment of a reassembled PDU]
341   0.039802 172.31.8.238 -> 54.230.119.71 TCP 66 36434 > http [ACK] Seq=97 Ack=2185033 Win=1335808 Len=0 TSval=7850118 TSecr=1683654724
342   0.039847 54.230.119.71 -> 172.31.8.238 TCP 1514 [TCP segment of a reassembled PDU]
343   0.039851 172.31.8.238 -> 54.230.119.71 TCP 66 36434 > http [ACK] Seq=97 Ack=2186481 Win=1376128 Len=0 TSval=7850118 TSecr=1683654724
344   0.040570 54.230.119.71 -> 172.31.8.238 TCP 2962 [TCP segment of a reassembled PDU]
345   0.040575 172.31.8.238 -> 54.230.119.71 TCP 66 36434 > http [ACK] Seq=97 Ack=2189377 Win=1373824 Len=0 TSval=7850118 TSecr=1683654724
346   0.040720 54.230.119.71 -> 172.31.8.238 TCP 26130 [TCP segment of a reassembled PDU]
