[Measurement for 10mb at 08:42:53 20.42.2014] 
Tshark:

  1   0.000000 172.31.8.238 -> 172.31.0.2   DNS 88 Standard query 0x1335  A dm53kc3eax57k.cloudfront.net
  2   0.000024 172.31.8.238 -> 172.31.0.2   DNS 88 Standard query 0x375a  AAAA dm53kc3eax57k.cloudfront.net
  3   0.000656   172.31.0.2 -> 172.31.8.238 DNS 216 Standard query response 0x1335  A 54.192.118.247 A 54.230.116.167 A 54.230.118.235 A 54.230.119.55 A 54.230.119.118 A 54.192.118.221 A 54.192.118.230 A 54.192.118.238
  4   0.000667   172.31.0.2 -> 172.31.8.238 DNS 175 Standard query response 0x375a 
  5   0.003859 172.31.8.238 -> 54.192.118.247 TCP 74 39849 > http [SYN] Seq=0 Win=26883 Len=0 MSS=8961 SACK_PERM=1 TSval=14150398 TSecr=0 WS=128
  6   0.004573 54.192.118.247 -> 172.31.8.238 TCP 74 http > 39849 [SYN, ACK] Seq=0 Ack=1 Win=14480 Len=0 MSS=1460 SACK_PERM=1 TSval=1685102666 TSecr=14150398 WS=128
  7   0.004588 172.31.8.238 -> 54.192.118.247 TCP 66 39849 > http [ACK] Seq=1 Ack=1 Win=27008 Len=0 TSval=14150398 TSecr=1685102666
  8   0.004626 172.31.8.238 -> 54.192.118.247 HTTP 162 GET /10mb HTTP/1.1 
  9   0.005232 54.192.118.247 -> 172.31.8.238 TCP 66 http > 39849 [ACK] Seq=1 Ack=97 Win=14592 Len=0 TSval=1685102667 TSecr=14150398
 10   0.006524 54.192.118.247 -> 172.31.8.238 TCP 524 [TCP segment of a reassembled PDU]
 11   0.006531 172.31.8.238 -> 54.192.118.247 TCP 66 39849 > http [ACK] Seq=97 Ack=459 Win=28032 Len=0 TSval=14150399 TSecr=1685102667
 12   0.006816 54.192.118.247 -> 172.31.8.238 TCP 5858 [TCP segment of a reassembled PDU]
 13   0.006824 172.31.8.238 -> 54.192.118.247 TCP 66 39849 > http [ACK] Seq=97 Ack=6251 Win=39552 Len=0 TSval=14150399 TSecr=1685102667
 14   0.006877 54.192.118.247 -> 172.31.8.238 TCP 7306 [TCP segment of a reassembled PDU]
 15   0.006884 172.31.8.238 -> 54.192.118.247 TCP 66 39849 > http [ACK] Seq=97 Ack=13491 Win=54144 Len=0 TSval=14150399 TSecr=1685102667
 16   0.007353 54.192.118.247 -> 172.31.8.238 TCP 10202 [TCP segment of a reassembled PDU]
 17   0.007362 172.31.8.238 -> 54.192.118.247 TCP 66 39849 > http [ACK] Seq=97 Ack=23627 Win=74368 Len=0 TSval=14150399 TSecr=1685102667
 18   0.007395 54.192.118.247 -> 172.31.8.238 TCP 2962 [TCP segment of a reassembled PDU]
 19   0.007401 172.31.8.238 -> 54.192.118.247 TCP 66 39849 > http [ACK] Seq=97 Ack=26523 Win=80128 Len=0 TSval=14150399 TSecr=1685102667
 20   0.007827 54.192.118.247 -> 172.31.8.238 TCP 2962 [TCP segment of a reassembled PDU]
 21   0.007833 172.31.8.238 -> 54.192.118.247 TCP 66 39849 > http [ACK] Seq=97 Ack=29419 Win=85888 Len=0 TSval=14150399 TSecr=1685102667
 22   0.007972 54.192.118.247 -> 172.31.8.238 TCP 18890 [TCP segment of a reassembled PDU]
 23   0.007984 172.31.8.238 -> 54.192.118.247 TCP 66 39849 > http [ACK] Seq=97 Ack=48243 Win=86912 Len=0 TSval=14150399 TSecr=1685102667
 24   0.008370 54.192.118.247 -> 172.31.8.238 TCP 1514 [TCP segment of a reassembled PDU]
 25   0.008374 172.31.8.238 -> 54.192.118.247 TCP 66 39849 > http [ACK] Seq=97 Ack=49691 Win=109056 Len=0 TSval=14150399 TSecr=1685102667
 26   0.008458 54.192.118.247 -> 172.31.8.238 TCP 2962 [TCP segment of a reassembled PDU]
 27   0.008463 172.31.8.238 -> 54.192.118.247 TCP 66 39849 > http [ACK] Seq=97 Ack=52587 Win=109056 Len=0 TSval=14150399 TSecr=1685102667
 28   0.008727 54.192.118.247 -> 172.31.8.238 TCP 13098 [TCP segment of a reassembled PDU]
 29   0.008736 172.31.8.238 -> 54.192.118.247 TCP 66 39849 > http [ACK] Seq=97 Ack=65619 Win=96512 Len=0 TSval=14150399 TSecr=1685102667
 30   0.008887 54.192.118.247 -> 172.31.8.238 TCP 10202 [TCP segment of a reassembled PDU]
 31   0.008895 172.31.8.238 -> 54.192.118.247 TCP 66 39849 > http [ACK] Seq=97 Ack=75755 Win=101248 Len=0 TSval=14150399 TSecr=1685102667
 32   0.009143 54.192.118.247 -> 172.31.8.238 TCP 2962 [TCP segment of a reassembled PDU]
 33   0.009148 172.31.8.238 -> 54.192.118.247 TCP 66 39849 > http [ACK] Seq=97 Ack=78651 Win=109056 Len=0 TSval=14150399 TSecr=1685102667
 34   0.009452 54.192.118.247 -> 172.31.8.238 TCP 13098 [TCP segment of a reassembled PDU]
 35   0.009461 172.31.8.238 -> 54.192.118.247 TCP 66 39849 > http [ACK] Seq=97 Ack=91683 Win=96512 Len=0 TSval=14150399 TSecr=1685102667
 36   0.009506 54.192.118.247 -> 172.31.8.238 TCP 13098 [TCP segment of a reassembled PDU]
 37   0.009515 172.31.8.238 -> 54.192.118.247 TCP 66 39849 > http [ACK] Seq=97 Ack=104715 Win=96512 Len=0 TSval=14150399 TSecr=1685102667
 38   0.010221 54.192.118.247 -> 172.31.8.238 TCP 5858 [TCP segment of a reassembled PDU]
 39   0.010227 172.31.8.238 -> 54.192.118.247 TCP 66 39849 > http [ACK] Seq=97 Ack=110507 Win=108416 Len=0 TSval=14150400 TSecr=1685102667
 40   0.010316 54.192.118.247 -> 172.31.8.238 TCP 7306 [TCP segment of a reassembled PDU]
 41   0.010323 172.31.8.238 -> 54.192.118.247 TCP 66 39849 > http [ACK] Seq=97 Ack=117747 Win=123520 Len=0 TSval=14150400 TSecr=1685102667
 42   0.010355 54.192.118.247 -> 172.31.8.238 TCP 13098 [TCP segment of a reassembled PDU]
 43   0.010364 172.31.8.238 -> 54.192.118.247 TCP 66 39849 > http [ACK] Seq=97 Ack=130779 Win=149632 Len=0 TSval=14150400 TSecr=1685102667
 44   0.011025 54.192.118.247 -> 172.31.8.238 TCP 7306 [TCP segment of a reassembled PDU]
 45   0.011032 172.31.8.238 -> 54.192.118.247 TCP 66 39849 > http [ACK] Seq=97 Ack=138019 Win=164096 Len=0 TSval=14150400 TSecr=1685102667
 46   0.011137 54.192.118.247 -> 172.31.8.238 TCP 18890 [TCP segment of a reassembled PDU]
 47   0.011146 172.31.8.238 -> 54.192.118.247 TCP 66 39849 > http [ACK] Seq=97 Ack=156843 Win=201728 Len=0 TSval=14150400 TSecr=1685102667
 48   0.011157 54.192.118.247 -> 172.31.8.238 TCP 5858 [TCP segment of a reassembled PDU]
 49   0.011165 172.31.8.238 -> 54.192.118.247 TCP 66 39849 > http [ACK] Seq=97 Ack=162635 Win=213376 Len=0 TSval=14150400 TSecr=1685102667
 50   0.011173 54.192.118.247 -> 172.31.8.238 TCP 7306 [TCP segment of a reassembled PDU]
 51   0.011179 172.31.8.238 -> 54.192.118.247 TCP 66 39849 > http [ACK] Seq=97 Ack=169875 Win=227840 Len=0 TSval=14150400 TSecr=1685102667
 52   0.011772 54.192.118.247 -> 172.31.8.238 TCP 13098 [TCP segment of a reassembled PDU]
 53   0.011780 172.31.8.238 -> 54.192.118.247 TCP 66 39849 > http [ACK] Seq=97 Ack=182907 Win=253824 Len=0 TSval=14150400 TSecr=1685102667
 54   0.011897 54.192.118.247 -> 172.31.8.238 TCP 26130 [TCP segment of a reassembled PDU]
 55   0.011910 172.31.8.238 -> 54.192.118.247 TCP 66 39849 > http [ACK] Seq=97 Ack=208971 Win=306048 Len=0 TSval=14150400 TSecr=1685102667
 56   0.011918 54.192.118.247 -> 172.31.8.238 TCP 5858 [TCP segment of a reassembled PDU]
 57   0.011923 172.31.8.238 -> 54.192.118.247 TCP 66 39849 > http [ACK] Seq=97 Ack=214763 Win=317568 Len=0 TSval=14150400 TSecr=1685102667
 58   0.012496 54.192.118.247 -> 172.31.8.238 TCP 5858 [TCP segment of a reassembled PDU]
 59   0.012503 172.31.8.238 -> 54.192.118.247 TCP 66 39849 > http [ACK] Seq=97 Ack=220555 Win=329216 Len=0 TSval=14150400 TSecr=1685102667
 60   0.012684 54.192.118.247 -> 172.31.8.238 TCP 24682 [TCP segment of a reassembled PDU]
 61   0.012709 172.31.8.238 -> 54.192.118.247 TCP 66 39849 > http [ACK] Seq=97 Ack=245171 Win=378368 Len=0 TSval=14150400 TSecr=1685102667
 62   0.012716 54.192.118.247 -> 172.31.8.238 TCP 1514 [TCP segment of a reassembled PDU]
 63   0.012719 172.31.8.238 -> 54.192.118.247 TCP 66 39849 > http [ACK] Seq=97 Ack=246619 Win=381312 Len=0 TSval=14150400 TSecr=1685102667
 64   0.012797 54.192.118.247 -> 172.31.8.238 TCP 10202 [TCP segment of a reassembled PDU]
 65   0.012805 172.31.8.238 -> 54.192.118.247 TCP 66 39849 > http [ACK] Seq=97 Ack=256755 Win=401536 Len=0 TSval=14150400 TSecr=1685102667
 66   0.013321 54.192.118.247 -> 172.31.8.238 TCP 4410 [TCP segment of a reassembled PDU]
 67   0.013328 172.31.8.238 -> 54.192.118.247 TCP 66 39849 > http [ACK] Seq=97 Ack=261099 Win=410240 Len=0 TSval=14150400 TSecr=1685102667
 68   0.013469 54.192.118.247 -> 172.31.8.238 TCP 21786 [TCP segment of a reassembled PDU]
 69   0.013482 172.31.8.238 -> 54.192.118.247 TCP 66 39849 > http [ACK] Seq=97 Ack=282819 Win=453632 Len=0 TSval=14150400 TSecr=1685102667
 70   0.013612 54.192.118.247 -> 172.31.8.238 TCP 24682 [TCP segment of a reassembled PDU]
 71   0.013625 172.31.8.238 -> 54.192.118.247 TCP 66 39849 > http [ACK] Seq=97 Ack=307435 Win=502912 Len=0 TSval=14150400 TSecr=1685102667
 72   0.013634 54.192.118.247 -> 172.31.8.238 TCP 1514 [TCP segment of a reassembled PDU]
 73   0.013637 172.31.8.238 -> 54.192.118.247 TCP 66 39849 > http [ACK] Seq=97 Ack=308883 Win=505856 Len=0 TSval=14150400 TSecr=1685102667
 74   0.013689 54.192.118.247 -> 172.31.8.238 TCP 2962 [TCP segment of a reassembled PDU]
 75   0.013694 172.31.8.238 -> 54.192.118.247 TCP 66 39849 > http [ACK] Seq=97 Ack=311779 Win=511616 Len=0 TSval=14150400 TSecr=1685102667
 76   0.014062 54.192.118.247 -> 172.31.8.238 TCP 14546 [TCP segment of a reassembled PDU]
 77   0.014071 172.31.8.238 -> 54.192.118.247 TCP 66 39849 > http [ACK] Seq=97 Ack=326259 Win=540544 Len=0 TSval=14150401 TSecr=1685102667
 78   0.014465 54.192.118.247 -> 172.31.8.238 TCP 26130 [TCP segment of a reassembled PDU]
 79   0.014478 172.31.8.238 -> 54.192.118.247 TCP 66 39849 > http [ACK] Seq=97 Ack=352323 Win=592640 Len=0 TSval=14150401 TSecr=1685102667
 80   0.014513 54.192.118.247 -> 172.31.8.238 TCP 14546 [TCP segment of a reassembled PDU]
 81   0.014523 172.31.8.238 -> 54.192.118.247 TCP 66 39849 > http [ACK] Seq=97 Ack=366803 Win=621696 Len=0 TSval=14150401 TSecr=1685102667
 82   0.014807 54.192.118.247 -> 172.31.8.238 TCP 2962 [TCP segment of a reassembled PDU]
 83   0.014812 172.31.8.238 -> 54.192.118.247 TCP 66 39849 > http [ACK] Seq=97 Ack=369699 Win=627456 Len=0 TSval=14150401 TSecr=1685102667
 84   0.014948 54.192.118.247 -> 172.31.8.238 TCP 10202 [TCP segment of a reassembled PDU]
 85   0.014956 172.31.8.238 -> 54.192.118.247 TCP 66 39849 > http [ACK] Seq=97 Ack=379835 Win=647680 Len=0 TSval=14150401 TSecr=1685102667
 86   0.015124 54.192.118.247 -> 172.31.8.238 TCP 26130 [TCP segment of a reassembled PDU]
 87   0.015136 172.31.8.238 -> 54.192.118.247 TCP 66 39849 > http [ACK] Seq=97 Ack=405899 Win=699904 Len=0 TSval=14150401 TSecr=1685102667
 88   0.015196 54.192.118.247 -> 172.31.8.238 TCP 23234 [TCP segment of a reassembled PDU]
 89   0.015209 172.31.8.238 -> 54.192.118.247 TCP 66 39849 > http [ACK] Seq=97 Ack=429067 Win=746240 Len=0 TSval=14150401 TSecr=1685102667
 90   0.015242 54.192.118.247 -> 172.31.8.238 TCP 4410 [TCP segment of a reassembled PDU]
 91   0.015248 172.31.8.238 -> 54.192.118.247 TCP 66 39849 > http [ACK] Seq=97 Ack=433411 Win=754816 Len=0 TSval=14150401 TSecr=1685102667
 92   0.015800 54.192.118.247 -> 172.31.8.238 TCP 7306 [TCP segment of a reassembled PDU]
 93   0.015807 172.31.8.238 -> 54.192.118.247 TCP 66 39849 > http [ACK] Seq=97 Ack=440651 Win=769408 Len=0 TSval=14150401 TSecr=1685102668
 94   0.015973 54.192.118.247 -> 172.31.8.238 TCP 26130 [TCP segment of a reassembled PDU]
 95   0.015986 172.31.8.238 -> 54.192.118.247 TCP 66 39849 > http [ACK] Seq=97 Ack=466715 Win=821504 Len=0 TSval=14150401 TSecr=1685102668
 96   0.016031 54.192.118.247 -> 172.31.8.238 TCP 20338 [TCP segment of a reassembled PDU]
 97   0.016054 172.31.8.238 -> 54.192.118.247 TCP 66 39849 > http [ACK] Seq=97 Ack=486987 Win=862080 Len=0 TSval=14150401 TSecr=1685102668
 98   0.016345 54.192.118.247 -> 172.31.8.238 TCP 18890 [TCP segment of a reassembled PDU]
 99   0.016357 172.31.8.238 -> 54.192.118.247 TCP 66 39849 > http [ACK] Seq=97 Ack=505811 Win=899712 Len=0 TSval=14150401 TSecr=1685102668
100   0.016460 54.192.118.247 -> 172.31.8.238 TCP 10202 [TCP segment of a reassembled PDU]
101   0.016468 172.31.8.238 -> 54.192.118.247 TCP 66 39849 > http [ACK] Seq=97 Ack=515947 Win=919936 Len=0 TSval=14150401 TSecr=1685102668
102   0.016587 54.192.118.247 -> 172.31.8.238 TCP 2962 [TCP segment of a reassembled PDU]
103   0.016592 172.31.8.238 -> 54.192.118.247 TCP 66 39849 > http [ACK] Seq=97 Ack=518843 Win=925696 Len=0 TSval=14150401 TSecr=1685102668
104   0.016719 54.192.118.247 -> 172.31.8.238 TCP 1514 [TCP Previous segment not captured] [TCP segment of a reassembled PDU]
105   0.016724 172.31.8.238 -> 54.192.118.247 TCP 78 [TCP Window Update] 39849 > http [ACK] Seq=97 Ack=518843 Win=928640 Len=0 TSval=14150401 TSecr=1685102668 SLE=520291 SRE=521739
106   0.016762 54.192.118.247 -> 172.31.8.238 TCP 1514 [TCP Out-Of-Order] [TCP segment of a reassembled PDU]
107   0.016766 172.31.8.238 -> 54.192.118.247 TCP 66 39849 > http [ACK] Seq=97 Ack=521739 Win=931584 Len=0 TSval=14150401 TSecr=1685102668
108   0.016913 54.192.118.247 -> 172.31.8.238 TCP 27578 [TCP segment of a reassembled PDU]
109   0.016928 172.31.8.238 -> 54.192.118.247 TCP 66 39849 > http [ACK] Seq=97 Ack=549251 Win=986496 Len=0 TSval=14150401 TSecr=1685102668
110   0.016934 54.192.118.247 -> 172.31.8.238 TCP 1514 [TCP segment of a reassembled PDU]
111   0.016936 172.31.8.238 -> 54.192.118.247 TCP 66 39849 > http [ACK] Seq=97 Ack=550699 Win=989440 Len=0 TSval=14150401 TSecr=1685102668
112   0.016944 54.192.118.247 -> 172.31.8.238 TCP 1514 [TCP segment of a reassembled PDU]
113   0.016946 172.31.8.238 -> 54.192.118.247 TCP 66 39849 > http [ACK] Seq=97 Ack=552147 Win=992384 Len=0 TSval=14150401 TSecr=1685102668
114   0.017074 54.192.118.247 -> 172.31.8.238 TCP 1514 [TCP segment of a reassembled PDU]
115   0.017079 172.31.8.238 -> 54.192.118.247 TCP 66 39849 > http [ACK] Seq=97 Ack=553595 Win=995200 Len=0 TSval=14150401 TSecr=1685102668
116   0.017244 54.192.118.247 -> 172.31.8.238 TCP 26130 [TCP segment of a reassembled PDU]
117   0.017257 172.31.8.238 -> 54.192.118.247 TCP 66 39849 > http [ACK] Seq=97 Ack=579659 Win=1047424 Len=0 TSval=14150401 TSecr=1685102668
118   0.017273 54.192.118.247 -> 172.31.8.238 TCP 5858 [TCP segment of a reassembled PDU]
119   0.017278 172.31.8.238 -> 54.192.118.247 TCP 66 39849 > http [ACK] Seq=97 Ack=585451 Win=1058944 Len=0 TSval=14150401 TSecr=1685102668
120   0.017437 54.192.118.247 -> 172.31.8.238 TCP 4410 [TCP segment of a reassembled PDU]
121   0.017443 172.31.8.238 -> 54.192.118.247 TCP 66 39849 > http [ACK] Seq=97 Ack=589795 Win=1067648 Len=0 TSval=14150401 TSecr=1685102668
122   0.017744 54.192.118.247 -> 172.31.8.238 TCP 21786 [TCP segment of a reassembled PDU]
123   0.017756 172.31.8.238 -> 54.192.118.247 TCP 66 39849 > http [ACK] Seq=97 Ack=611515 Win=1111040 Len=0 TSval=14150401 TSecr=1685102668
124   0.017761 54.192.118.247 -> 172.31.8.238 TCP 1514 [TCP segment of a reassembled PDU]
125   0.017763 172.31.8.238 -> 54.192.118.247 TCP 66 39849 > http [ACK] Seq=97 Ack=612963 Win=1113984 Len=0 TSval=14150401 TSecr=1685102668
126   0.017771 54.192.118.247 -> 172.31.8.238 TCP 2962 [TCP segment of a reassembled PDU]
127   0.017774 172.31.8.238 -> 54.192.118.247 TCP 66 39849 > http [ACK] Seq=97 Ack=615859 Win=1111168 Len=0 TSval=14150401 TSecr=1685102668
128   0.017821 54.192.118.247 -> 172.31.8.238 TCP 1514 [TCP segment of a reassembled PDU]
129   0.017825 172.31.8.238 -> 54.192.118.247 TCP 66 39849 > http [ACK] Seq=97 Ack=617307 Win=1116928 Len=0 TSval=14150402 TSecr=1685102668
130   0.017928 54.192.118.247 -> 172.31.8.238 TCP 11650 [TCP segment of a reassembled PDU]
131   0.017936 172.31.8.238 -> 54.192.118.247 TCP 66 39849 > http [ACK] Seq=97 Ack=628891 Win=1131904 Len=0 TSval=14150402 TSecr=1685102668
132   0.018066 54.192.118.247 -> 172.31.8.238 TCP 29026 [TCP segment of a reassembled PDU]
133   0.018080 172.31.8.238 -> 54.192.118.247 TCP 66 39849 > http [ACK] Seq=97 Ack=657851 Win=1105664 Len=0 TSval=14150402 TSecr=1685102668
134   0.018405 54.192.118.247 -> 172.31.8.238 TCP 5858 [TCP segment of a reassembled PDU]
135   0.018412 172.31.8.238 -> 54.192.118.247 TCP 66 39849 > http [ACK] Seq=97 Ack=663643 Win=1143808 Len=0 TSval=14150402 TSecr=1685102668
136   0.018554 54.192.118.247 -> 172.31.8.238 TCP 18890 [TCP segment of a reassembled PDU]
137   0.018565 172.31.8.238 -> 54.192.118.247 TCP 66 39849 > http [ACK] Seq=97 Ack=682467 Win=1124992 Len=0 TSval=14150402 TSecr=1685102668
138   0.018809 54.192.118.247 -> 172.31.8.238 TCP 26130 [TCP segment of a reassembled PDU]
139   0.018822 172.31.8.238 -> 54.192.118.247 TCP 66 39849 > http [ACK] Seq=97 Ack=708531 Win=1110528 Len=0 TSval=14150402 TSecr=1685102668
140   0.018893 54.192.118.247 -> 172.31.8.238 TCP 26130 [TCP segment of a reassembled PDU]
141   0.018906 172.31.8.238 -> 54.192.118.247 TCP 66 39849 > http [ACK] Seq=97 Ack=734595 Win=1110528 Len=0 TSval=14150402 TSecr=1685102668
142   0.018955 54.192.118.247 -> 172.31.8.238 TCP 13098 [TCP segment of a reassembled PDU]
143   0.018962 172.31.8.238 -> 54.192.118.247 TCP 66 39849 > http [ACK] Seq=97 Ack=747627 Win=1131904 Len=0 TSval=14150402 TSecr=1685102668
144   0.019457 54.192.118.247 -> 172.31.8.238 TCP 2962 [TCP segment of a reassembled PDU]
145   0.019463 172.31.8.238 -> 54.192.118.247 TCP 66 39849 > http [ACK] Seq=97 Ack=750523 Win=1148544 Len=0 TSval=14150402 TSecr=1685102668
146   0.019618 54.192.118.247 -> 172.31.8.238 TCP 20338 [TCP segment of a reassembled PDU]
147   0.019629 172.31.8.238 -> 54.192.118.247 TCP 66 39849 > http [ACK] Seq=97 Ack=770795 Win=1128320 Len=0 TSval=14150402 TSecr=1685102668
148   0.019750 54.192.118.247 -> 172.31.8.238 TCP 31922 [TCP segment of a reassembled PDU]
149   0.019766 172.31.8.238 -> 54.192.118.247 TCP 66 39849 > http [ACK] Seq=97 Ack=802651 Win=1100928 Len=0 TSval=14150402 TSecr=1685102668
150   0.019785 54.192.118.247 -> 172.31.8.238 TCP 10202 [TCP segment of a reassembled PDU]
151   0.019790 172.31.8.238 -> 54.192.118.247 TCP 66 39849 > http [ACK] Seq=97 Ack=812787 Win=1090816 Len=0 TSval=14150402 TSecr=1685102668
152   0.020198 54.192.118.247 -> 172.31.8.238 TCP 2962 [TCP segment of a reassembled PDU]
153   0.020204 172.31.8.238 -> 54.192.118.247 TCP 66 39849 > http [ACK] Seq=97 Ack=815683 Win=1148544 Len=0 TSval=14150402 TSecr=1685102668
154   0.020378 54.192.118.247 -> 172.31.8.238 TCP 17442 [TCP segment of a reassembled PDU]
155   0.020390 172.31.8.238 -> 54.192.118.247 TCP 66 39849 > http [ACK] Seq=97 Ack=833059 Win=1131264 Len=0 TSval=14150402 TSecr=1685102668
156   0.020412 54.192.118.247 -> 172.31.8.238 TCP 8754 [TCP segment of a reassembled PDU]
157   0.020420 172.31.8.238 -> 54.192.118.247 TCP 66 39849 > http [ACK] Seq=97 Ack=841747 Win=1122688 Len=0 TSval=14150402 TSecr=1685102668
158   0.020502 54.192.118.247 -> 172.31.8.238 TCP 26130 [TCP segment of a reassembled PDU]
159   0.020516 172.31.8.238 -> 54.192.118.247 TCP 66 39849 > http [ACK] Seq=97 Ack=867811 Win=1110528 Len=0 TSval=14150402 TSecr=1685102668
160   0.020589 54.192.118.247 -> 172.31.8.238 TCP 26130 [TCP segment of a reassembled PDU]
161   0.020602 172.31.8.238 -> 54.192.118.247 TCP 66 39849 > http [ACK] Seq=97 Ack=893875 Win=1110528 Len=0 TSval=14150402 TSecr=1685102668
162   0.020651 54.192.118.247 -> 172.31.8.238 TCP 21786 [TCP segment of a reassembled PDU]
163   0.020751 172.31.8.238 -> 54.192.118.247 TCP 66 39849 > http [ACK] Seq=97 Ack=915595 Win=1088896 Len=0 TSval=14150402 TSecr=1685102668
164   0.021306 54.192.118.247 -> 172.31.8.238 TCP 7306 [TCP segment of a reassembled PDU]
165   0.021314 172.31.8.238 -> 54.192.118.247 TCP 66 39849 > http [ACK] Seq=97 Ack=922835 Win=1141376 Len=0 TSval=14150402 TSecr=1685102668
166   0.021476 54.192.118.247 -> 172.31.8.238 TCP 26130 [TCP segment of a reassembled PDU]
167   0.021501 172.31.8.238 -> 54.192.118.247 TCP 66 39849 > http [ACK] Seq=97 Ack=948899 Win=1115392 Len=0 TSval=14150402 TSecr=1685102668
168   0.021545 54.192.118.247 -> 172.31.8.238 TCP 26130 [TCP segment of a reassembled PDU]
169   0.021572 172.31.8.238 -> 54.192.118.247 TCP 66 39849 > http [ACK] Seq=97 Ack=974963 Win=1110528 Len=0 TSval=14150402 TSecr=1685102668
170   0.021628 54.192.118.247 -> 172.31.8.238 TCP 26130 [TCP segment of a reassembled PDU]
171   0.021640 172.31.8.238 -> 54.192.118.247 TCP 66 39849 > http [ACK] Seq=97 Ack=1001027 Win=1110528 Len=0 TSval=14150402 TSecr=1685102668
172   0.021679 54.192.118.247 -> 172.31.8.238 TCP 7306 [TCP segment of a reassembled PDU]
173   0.021767 172.31.8.238 -> 54.192.118.247 TCP 66 39849 > http [ACK] Seq=97 Ack=1008267 Win=1103360 Len=0 TSval=14150402 TSecr=1685102668
174   0.022251 54.192.118.247 -> 172.31.8.238 TCP 1514 [TCP segment of a reassembled PDU]
175   0.022429 54.192.118.247 -> 172.31.8.238 TCP 26130 [TCP segment of a reassembled PDU]
176   0.022442 172.31.8.238 -> 54.192.118.247 TCP 66 39849 > http [ACK] Seq=97 Ack=1035779 Win=1201536 Len=0 TSval=14150403 TSecr=1685102668
177   0.022518 54.192.118.247 -> 172.31.8.238 TCP 26130 [TCP segment of a reassembled PDU]
178   0.022533 172.31.8.238 -> 54.192.118.247 TCP 66 39849 > http [ACK] Seq=97 Ack=1061843 Win=1253632 Len=0 TSval=14150403 TSecr=1685102668
179   0.022581 54.192.118.247 -> 172.31.8.238 TCP 11650 [TCP segment of a reassembled PDU]
180   0.022590 172.31.8.238 -> 54.192.118.247 TCP 66 39849 > http [ACK] Seq=97 Ack=1073427 Win=1276800 Len=0 TSval=14150403 TSecr=1685102668
181   0.022686 54.192.118.247 -> 172.31.8.238 TCP 26130 [TCP segment of a reassembled PDU]
182   0.022700 172.31.8.238 -> 54.192.118.247 TCP 66 39849 > http [ACK] Seq=97 Ack=1099491 Win=1329024 Len=0 TSval=14150403 TSecr=1685102668
183   0.022753 54.192.118.247 -> 172.31.8.238 TCP 18890 [TCP segment of a reassembled PDU]
184   0.022763 172.31.8.238 -> 54.192.118.247 TCP 66 39849 > http [ACK] Seq=97 Ack=1118315 Win=1366656 Len=0 TSval=14150403 TSecr=1685102668
185   0.023310 54.192.118.247 -> 172.31.8.238 TCP 8754 [TCP segment of a reassembled PDU]
186   0.023318 172.31.8.238 -> 54.192.118.247 TCP 66 39849 > http [ACK] Seq=97 Ack=1127003 Win=1384064 Len=0 TSval=14150403 TSecr=1685102668
187   0.023466 54.192.118.247 -> 172.31.8.238 TCP 26130 [TCP segment of a reassembled PDU]
188   0.023493 172.31.8.238 -> 54.192.118.247 TCP 66 39849 > http [ACK] Seq=97 Ack=1153067 Win=1389824 Len=0 TSval=14150403 TSecr=1685102668
189   0.023555 54.192.118.247 -> 172.31.8.238 TCP 26130 [TCP segment of a reassembled PDU]
190   0.023568 172.31.8.238 -> 54.192.118.247 TCP 66 39849 > http [ACK] Seq=97 Ack=1179131 Win=1389824 Len=0 TSval=14150403 TSecr=1685102668
191   0.023631 54.192.118.247 -> 172.31.8.238 TCP 24682 [TCP segment of a reassembled PDU]
192   0.023644 172.31.8.238 -> 54.192.118.247 TCP 66 39849 > http [ACK] Seq=97 Ack=1203747 Win=1392256 Len=0 TSval=14150403 TSecr=1685102668
193   0.024040 54.192.118.247 -> 172.31.8.238 TCP 1514 [TCP segment of a reassembled PDU]
194   0.024207 54.192.118.247 -> 172.31.8.238 TCP 26130 [TCP segment of a reassembled PDU]
195   0.024233 172.31.8.238 -> 54.192.118.247 TCP 66 39849 > http [ACK] Seq=97 Ack=1231259 Win=1389824 Len=0 TSval=14150403 TSecr=1685102668
196   0.024285 54.192.118.247 -> 172.31.8.238 TCP 26130 [TCP segment of a reassembled PDU]
197   0.024299 172.31.8.238 -> 54.192.118.247 TCP 66 39849 > http [ACK] Seq=97 Ack=1257323 Win=1389824 Len=0 TSval=14150403 TSecr=1685102668
198   0.024364 54.192.118.247 -> 172.31.8.238 TCP 11650 [TCP segment of a reassembled PDU]
199   0.024375 172.31.8.238 -> 54.192.118.247 TCP 66 39849 > http [ACK] Seq=97 Ack=1268907 Win=1413632 Len=0 TSval=14150403 TSecr=1685102668
200   0.024455 54.192.118.247 -> 172.31.8.238 TCP 17442 [TCP segment of a reassembled PDU]
201   0.024477 172.31.8.238 -> 54.192.118.247 TCP 66 39849 > http [ACK] Seq=97 Ack=1286283 Win=1404032 Len=0 TSval=14150403 TSecr=1685102668
202   0.024535 54.192.118.247 -> 172.31.8.238 TCP 26130 [TCP segment of a reassembled PDU]
203   0.024559 172.31.8.238 -> 54.192.118.247 TCP 66 39849 > http [ACK] Seq=97 Ack=1312347 Win=1389824 Len=0 TSval=14150403 TSecr=1685102668
204   0.024607 54.192.118.247 -> 172.31.8.238 TCP 21786 [TCP segment of a reassembled PDU]
205   0.024618 172.31.8.238 -> 54.192.118.247 TCP 66 39849 > http [ACK] Seq=97 Ack=1334067 Win=1396992 Len=0 TSval=14150403 TSecr=1685102668
206   0.025088 54.192.118.247 -> 172.31.8.238 TCP 7306 [TCP segment of a reassembled PDU]
207   0.025096 172.31.8.238 -> 54.192.118.247 TCP 66 39849 > http [ACK] Seq=97 Ack=1341307 Win=1420800 Len=0 TSval=14150403 TSecr=1685102668
208   0.025240 54.192.118.247 -> 172.31.8.238 TCP 26130 [TCP segment of a reassembled PDU]
209   0.025265 172.31.8.238 -> 54.192.118.247 TCP 66 39849 > http [ACK] Seq=97 Ack=1367371 Win=1394816 Len=0 TSval=14150403 TSecr=1685102668
210   0.025323 54.192.118.247 -> 172.31.8.238 TCP 26130 [TCP segment of a reassembled PDU]
211   0.025347 172.31.8.238 -> 54.192.118.247 TCP 66 39849 > http [ACK] Seq=97 Ack=1393435 Win=1389824 Len=0 TSval=14150403 TSecr=1685102668
212   0.025401 54.192.118.247 -> 172.31.8.238 TCP 26130 [TCP segment of a reassembled PDU]
213   0.025414 172.31.8.238 -> 54.192.118.247 TCP 66 39849 > http [ACK] Seq=97 Ack=1419499 Win=1389824 Len=0 TSval=14150403 TSecr=1685102668
214   0.025480 54.192.118.247 -> 172.31.8.238 TCP 26130 [TCP segment of a reassembled PDU]
215   0.025493 172.31.8.238 -> 54.192.118.247 TCP 66 39849 > http [ACK] Seq=97 Ack=1445563 Win=1389824 Len=0 TSval=14150403 TSecr=1685102668
216   0.025538 54.192.118.247 -> 172.31.8.238 TCP 18890 [TCP segment of a reassembled PDU]
217   0.025620 172.31.8.238 -> 54.192.118.247 TCP 66 39849 > http [ACK] Seq=97 Ack=1464387 Win=1371008 Len=0 TSval=14150403 TSecr=1685102668
218   0.026113 54.192.118.247 -> 172.31.8.238 TCP 2962 [TCP segment of a reassembled PDU]
219   0.026119 172.31.8.238 -> 54.192.118.247 TCP 66 39849 > http [ACK] Seq=97 Ack=1467283 Win=1425408 Len=0 TSval=14150404 TSecr=1685102669
220   0.026273 54.192.118.247 -> 172.31.8.238 TCP 26130 [TCP segment of a reassembled PDU]
221   0.026297 172.31.8.238 -> 54.192.118.247 TCP 66 39849 > http [ACK] Seq=97 Ack=1493347 Win=1399424 Len=0 TSval=14150404 TSecr=1685102669
222   0.026340 54.192.118.247 -> 172.31.8.238 TCP 26130 [TCP segment of a reassembled PDU]
223   0.026360 172.31.8.238 -> 54.192.118.247 TCP 66 39849 > http [ACK] Seq=97 Ack=1519411 Win=1389824 Len=0 TSval=14150404 TSecr=1685102669
224   0.026419 54.192.118.247 -> 172.31.8.238 TCP 26130 [TCP segment of a reassembled PDU]
225   0.026432 172.31.8.238 -> 54.192.118.247 TCP 66 39849 > http [ACK] Seq=97 Ack=1545475 Win=1389824 Len=0 TSval=14150404 TSecr=1685102669
226   0.026494 54.192.118.247 -> 172.31.8.238 TCP 26130 [TCP segment of a reassembled PDU]
227   0.026506 172.31.8.238 -> 54.192.118.247 TCP 66 39849 > http [ACK] Seq=97 Ack=1571539 Win=1389824 Len=0 TSval=14150404 TSecr=1685102669
228   0.026564 54.192.118.247 -> 172.31.8.238 TCP 23234 [TCP segment of a reassembled PDU]
229   0.026661 172.31.8.238 -> 54.192.118.247 TCP 66 39849 > http [ACK] Seq=97 Ack=1594707 Win=1366656 Len=0 TSval=14150404 TSecr=1685102669
230   0.026952 54.192.118.247 -> 172.31.8.238 TCP 15994 [TCP segment of a reassembled PDU]
231   0.026962 172.31.8.238 -> 54.192.118.247 TCP 66 39849 > http [ACK] Seq=97 Ack=1610635 Win=1406464 Len=0 TSval=14150404 TSecr=1685102669
232   0.027108 54.192.118.247 -> 172.31.8.238 TCP 26130 [TCP segment of a reassembled PDU]
233   0.027133 172.31.8.238 -> 54.192.118.247 TCP 66 39849 > http [ACK] Seq=97 Ack=1636699 Win=1389824 Len=0 TSval=14150404 TSecr=1685102669
234   0.027192 54.192.118.247 -> 172.31.8.238 TCP 20338 [TCP segment of a reassembled PDU]
235   0.027203 172.31.8.238 -> 54.192.118.247 TCP 66 39849 > http [ACK] Seq=97 Ack=1656971 Win=1399296 Len=0 TSval=14150404 TSecr=1685102669
236   0.027333 54.192.118.247 -> 172.31.8.238 TCP 31922 [TCP segment of a reassembled PDU]
237   0.027360 54.192.118.247 -> 172.31.8.238 TCP 26130 [TCP segment of a reassembled PDU]
238   0.027401 54.192.118.247 -> 172.31.8.238 TCP 10202 [TCP segment of a reassembled PDU]
239   0.027446 172.31.8.238 -> 54.192.118.247 TCP 66 39849 > http [ACK] Seq=97 Ack=1725027 Win=1331328 Len=0 TSval=14150404 TSecr=1685102669
240   0.027928 54.192.118.247 -> 172.31.8.238 TCP 1514 [TCP segment of a reassembled PDU]
241   0.028109 54.192.118.247 -> 172.31.8.238 TCP 26130 [TCP segment of a reassembled PDU]
242   0.028122 172.31.8.238 -> 54.192.118.247 TCP 66 39849 > http [ACK] Seq=97 Ack=1752539 Win=1389824 Len=0 TSval=14150404 TSecr=1685102669
243   0.028180 54.192.118.247 -> 172.31.8.238 TCP 24682 [TCP segment of a reassembled PDU]
244   0.028192 172.31.8.238 -> 54.192.118.247 TCP 66 39849 > http [ACK] Seq=97 Ack=1777155 Win=1392256 Len=0 TSval=14150404 TSecr=1685102669
245   0.028322 54.192.118.247 -> 172.31.8.238 TCP 27578 [TCP segment of a reassembled PDU]
246   0.028361 54.192.118.247 -> 172.31.8.238 TCP 26130 [TCP segment of a reassembled PDU]
247   0.028415 54.192.118.247 -> 172.31.8.238 TCP 24682 [TCP segment of a reassembled PDU]
248   0.028457 172.31.8.238 -> 54.192.118.247 TCP 66 39849 > http [ACK] Seq=97 Ack=1855347 Win=1314176 Len=0 TSval=14150404 TSecr=1685102669
249   0.028759 54.192.118.247 -> 172.31.8.238 TCP 7306 [TCP segment of a reassembled PDU]
250   0.028766 172.31.8.238 -> 54.192.118.247 TCP 66 39849 > http [ACK] Seq=97 Ack=1862587 Win=1420800 Len=0 TSval=14150404 TSecr=1685102669
251   0.028919 54.192.118.247 -> 172.31.8.238 TCP 26130 [TCP segment of a reassembled PDU]
252   0.028937 172.31.8.238 -> 54.192.118.247 TCP 66 39849 > http [ACK] Seq=97 Ack=1888651 Win=1394816 Len=0 TSval=14150404 TSecr=1685102669
253   0.028986 54.192.118.247 -> 172.31.8.238 TCP 26130 [TCP segment of a reassembled PDU]
254   0.029003 172.31.8.238 -> 54.192.118.247 TCP 66 39849 > http [ACK] Seq=97 Ack=1914715 Win=1389824 Len=0 TSval=14150404 TSecr=1685102669
255   0.029034 54.192.118.247 -> 172.31.8.238 TCP 5858 [TCP segment of a reassembled PDU]
256   0.029038 172.31.8.238 -> 54.192.118.247 TCP 66 39849 > http [ACK] Seq=97 Ack=1920507 Win=1423104 Len=0 TSval=14150404 TSecr=1685102669
257   0.029289 54.192.118.247 -> 172.31.8.238 TCP 5858 [TCP segment of a reassembled PDU]
258   0.029295 172.31.8.238 -> 54.192.118.247 TCP 66 39849 > http [ACK] Seq=97 Ack=1926299 Win=1423104 Len=0 TSval=14150404 TSecr=1685102669
259   0.029457 54.192.118.247 -> 172.31.8.238 TCP 24682 [TCP segment of a reassembled PDU]
260   0.029478 54.192.118.247 -> 172.31.8.238 TCP 1514 [TCP segment of a reassembled PDU]
261   0.029480 172.31.8.238 -> 54.192.118.247 TCP 66 39849 > http [ACK] Seq=97 Ack=1950915 Win=1398528 Len=0 TSval=14150404 TSecr=1685102669
262   0.029536 54.192.118.247 -> 172.31.8.238 TCP 20338 [TCP segment of a reassembled PDU]
263   0.029542 172.31.8.238 -> 54.192.118.247 TCP 66 39849 > http [ACK] Seq=97 Ack=1972635 Win=1399296 Len=0 TSval=14150404 TSecr=1685102669
264   0.029603 54.192.118.247 -> 172.31.8.238 TCP 7306 [TCP segment of a reassembled PDU]
265   0.029608 172.31.8.238 -> 54.192.118.247 TCP 66 39849 > http [ACK] Seq=97 Ack=1979875 Win=1420800 Len=0 TSval=14150404 TSecr=1685102669
266   0.029746 54.192.118.247 -> 172.31.8.238 TCP 26130 [TCP segment of a reassembled PDU]
267   0.029756 54.192.118.247 -> 172.31.8.238 TCP 7306 [TCP segment of a reassembled PDU]
268   0.029771 172.31.8.238 -> 54.192.118.247 TCP 66 39849 > http [ACK] Seq=97 Ack=2013179 Win=1387520 Len=0 TSval=14150404 TSecr=1685102669
269   0.029812 54.192.118.247 -> 172.31.8.238 TCP 18890 [TCP segment of a reassembled PDU]
270   0.029818 172.31.8.238 -> 54.192.118.247 TCP 66 39849 > http [ACK] Seq=97 Ack=2032003 Win=1401728 Len=0 TSval=14150404 TSecr=1685102669
271   0.029887 54.192.118.247 -> 172.31.8.238 TCP 18890 [TCP segment of a reassembled PDU]
272   0.029892 172.31.8.238 -> 54.192.118.247 TCP 66 39849 > http [ACK] Seq=97 Ack=2050827 Win=1401728 Len=0 TSval=14150404 TSecr=1685102669
273   0.030147 54.192.118.247 -> 172.31.8.238 TCP 17442 [TCP segment of a reassembled PDU]
274   0.030154 172.31.8.238 -> 54.192.118.247 TCP 66 39849 > http [ACK] Seq=97 Ack=2068203 Win=1404032 Len=0 TSval=14150405 TSecr=1685102669
275   0.030269 54.192.118.247 -> 172.31.8.238 TCP 34818 [TCP segment of a reassembled PDU]
276   0.030278 172.31.8.238 -> 54.192.118.247 TCP 66 39849 > http [ACK] Seq=97 Ack=2102955 Win=1494912 Len=0 TSval=14150405 TSecr=1685102669
277   0.030290 54.192.118.247 -> 172.31.8.238 TCP 13098 [TCP segment of a reassembled PDU]
278   0.030294 172.31.8.238 -> 54.192.118.247 TCP 66 39849 > http [ACK] Seq=97 Ack=2115987 Win=1521024 Len=0 TSval=14150405 TSecr=1685102669
279   0.030435 54.192.118.247 -> 172.31.8.238 TCP 18890 [TCP segment of a reassembled PDU]
280   0.030440 172.31.8.238 -> 54.192.118.247 TCP 66 39849 > http [ACK] Seq=97 Ack=2134811 Win=1558656 Len=0 TSval=14150405 TSecr=1685102669
281   0.030488 54.192.118.247 -> 172.31.8.238 TCP 26130 [TCP segment of a reassembled PDU]
282   0.030494 172.31.8.238 -> 54.192.118.247 TCP 66 39849 > http [ACK] Seq=97 Ack=2160875 Win=1610752 Len=0 TSval=14150405 TSecr=1685102669
283   0.030561 54.192.118.247 -> 172.31.8.238 TCP 17442 [TCP segment of a reassembled PDU]
284   0.030567 172.31.8.238 -> 54.192.118.247 TCP 66 39849 > http [ACK] Seq=97 Ack=2178251 Win=1610752 Len=0 TSval=14150405 TSecr=1685102669
285   0.030606 54.192.118.247 -> 172.31.8.238 TCP 2962 [TCP segment of a reassembled PDU]
286   0.030610 172.31.8.238 -> 54.192.118.247 TCP 66 39849 > http [ACK] Seq=97 Ack=2181147 Win=1610752 Len=0 TSval=14150405 TSecr=1685102669
287   0.030616 54.192.118.247 -> 172.31.8.238 TCP 1514 [TCP segment of a reassembled PDU]
288   0.030684 54.192.118.247 -> 172.31.8.238 TCP 24682 [TCP segment of a reassembled PDU]
289   0.030692 172.31.8.238 -> 54.192.118.247 TCP 66 39849 > http [ACK] Seq=97 Ack=2207211 Win=1610752 Len=0 TSval=14150405 TSecr=1685102669
290   0.030758 54.192.118.247 -> 172.31.8.238 TCP 26130 [TCP segment of a reassembled PDU]
291   0.030766 172.31.8.238 -> 54.192.118.247 TCP 66 39849 > http [ACK] Seq=97 Ack=2233275 Win=1610752 Len=0 TSval=14150405 TSecr=1685102669
292   0.030828 54.192.118.247 -> 172.31.8.238 TCP 13098 [TCP segment of a reassembled PDU]
293   0.030833 172.31.8.238 -> 54.192.118.247 TCP 66 39849 > http [ACK] Seq=97 Ack=2246307 Win=1610752 Len=0 TSval=14150405 TSecr=1685102669
294   0.031161 54.192.118.247 -> 172.31.8.238 TCP 26130 [TCP segment of a reassembled PDU]
295   0.031169 172.31.8.238 -> 54.192.118.247 TCP 66 39849 > http [ACK] Seq=97 Ack=2272371 Win=1610752 Len=0 TSval=14150405 TSecr=1685102669
296   0.031244 54.192.118.247 -> 172.31.8.238 TCP 23234 [TCP segment of a reassembled PDU]
297   0.031251 172.31.8.238 -> 54.192.118.247 TCP 66 39849 > http [ACK] Seq=97 Ack=2295539 Win=1610752 Len=0 TSval=14150405 TSecr=1685102669
298   0.031332 54.192.118.247 -> 172.31.8.238 TCP 15994 [TCP segment of a reassembled PDU]
299   0.031337 172.31.8.238 -> 54.192.118.247 TCP 66 39849 > http [ACK] Seq=97 Ack=2311467 Win=1610752 Len=0 TSval=14150405 TSecr=1685102669
300   0.031389 54.192.118.247 -> 172.31.8.238 TCP 14546 [TCP segment of a reassembled PDU]
301   0.031394 172.31.8.238 -> 54.192.118.247 TCP 66 39849 > http [ACK] Seq=97 Ack=2325947 Win=1610752 Len=0 TSval=14150405 TSecr=1685102669
302   0.031542 54.192.118.247 -> 172.31.8.238 TCP 26130 [TCP segment of a reassembled PDU]
303   0.031549 172.31.8.238 -> 54.192.118.247 TCP 66 39849 > http [ACK] Seq=97 Ack=2352011 Win=1610752 Len=0 TSval=14150405 TSecr=1685102669
304   0.031557 54.192.118.247 -> 172.31.8.238 TCP 5858 [TCP segment of a reassembled PDU]
305   0.031559 172.31.8.238 -> 54.192.118.247 TCP 66 39849 > http [ACK] Seq=97 Ack=2357803 Win=1610752 Len=0 TSval=14150405 TSecr=1685102669
306   0.031589 54.192.118.247 -> 172.31.8.238 TCP 18890 [TCP segment of a reassembled PDU]
307   0.031597 172.31.8.238 -> 54.192.118.247 TCP 66 39849 > http [ACK] Seq=97 Ack=2376627 Win=1610752 Len=0 TSval=14150405 TSecr=1685102669
308   0.031738 54.192.118.247 -> 172.31.8.238 TCP 26130 [TCP segment of a reassembled PDU]
309   0.031745 172.31.8.238 -> 54.192.118.247 TCP 66 39849 > http [ACK] Seq=97 Ack=2402691 Win=1610752 Len=0 TSval=14150405 TSecr=1685102669
310   0.031835 54.192.118.247 -> 172.31.8.238 TCP 39162 [TCP segment of a reassembled PDU]
311   0.031843 172.31.8.238 -> 54.192.118.247 TCP 66 39849 > http [ACK] Seq=97 Ack=2441787 Win=1610752 Len=0 TSval=14150405 TSecr=1685102669
312   0.032125 54.192.118.247 -> 172.31.8.238 TCP 14546 [TCP segment of a reassembled PDU]
313   0.032132 172.31.8.238 -> 54.192.118.247 TCP 66 39849 > http [ACK] Seq=97 Ack=2456267 Win=1610752 Len=0 TSval=14150405 TSecr=1685102669
314   0.032291 54.192.118.247 -> 172.31.8.238 TCP 26130 [TCP segment of a reassembled PDU]
315   0.032297 172.31.8.238 -> 54.192.118.247 TCP 66 39849 > http [ACK] Seq=97 Ack=2482331 Win=1610752 Len=0 TSval=14150405 TSecr=1685102669
316   0.032353 54.192.118.247 -> 172.31.8.238 TCP 24682 [TCP segment of a reassembled PDU]
317   0.032360 172.31.8.238 -> 54.192.118.247 TCP 66 39849 > http [ACK] Seq=97 Ack=2506947 Win=1610752 Len=0 TSval=14150405 TSecr=1685102669
318   0.032436 54.192.118.247 -> 172.31.8.238 TCP 26130 [TCP segment of a reassembled PDU]
319   0.032443 172.31.8.238 -> 54.192.118.247 TCP 66 39849 > http [ACK] Seq=97 Ack=2533011 Win=1610752 Len=0 TSval=14150405 TSecr=1685102669
320   0.032514 54.192.118.247 -> 172.31.8.238 TCP 26130 [TCP segment of a reassembled PDU]
321   0.032521 172.31.8.238 -> 54.192.118.247 TCP 66 39849 > http [ACK] Seq=97 Ack=2559075 Win=1610752 Len=0 TSval=14150405 TSecr=1685102669
322   0.032603 54.192.118.247 -> 172.31.8.238 TCP 26130 [TCP segment of a reassembled PDU]
323   0.032611 172.31.8.238 -> 54.192.118.247 TCP 66 39849 > http [ACK] Seq=97 Ack=2585139 Win=1610752 Len=0 TSval=14150405 TSecr=1685102669
324   0.032683 54.192.118.247 -> 172.31.8.238 TCP 26130 [TCP segment of a reassembled PDU]
325   0.032690 172.31.8.238 -> 54.192.118.247 TCP 66 39849 > http [ACK] Seq=97 Ack=2611203 Win=1610752 Len=0 TSval=14150405 TSecr=1685102669
326   0.032759 54.192.118.247 -> 172.31.8.238 TCP 26130 [TCP segment of a reassembled PDU]
327   0.032765 172.31.8.238 -> 54.192.118.247 TCP 66 39849 > http [ACK] Seq=97 Ack=2637267 Win=1610752 Len=0 TSval=14150405 TSecr=1685102669
328   0.033083 54.192.118.247 -> 172.31.8.238 TCP 21786 [TCP segment of a reassembled PDU]
329   0.033090 172.31.8.238 -> 54.192.118.247 TCP 66 39849 > http [ACK] Seq=97 Ack=2658987 Win=1610752 Len=0 TSval=14150405 TSecr=1685102669
330   0.033237 54.192.118.247 -> 172.31.8.238 TCP 26130 [TCP segment of a reassembled PDU]
331   0.033248 172.31.8.238 -> 54.192.118.247 TCP 66 39849 > http [ACK] Seq=97 Ack=2685051 Win=1610752 Len=0 TSval=14150405 TSecr=1685102669
332   0.033313 54.192.118.247 -> 172.31.8.238 TCP 26130 [TCP segment of a reassembled PDU]
333   0.033320 172.31.8.238 -> 54.192.118.247 TCP 66 39849 > http [ACK] Seq=97 Ack=2711115 Win=1610752 Len=0 TSval=14150405 TSecr=1685102669
334   0.033418 54.192.118.247 -> 172.31.8.238 TCP 26130 [TCP segment of a reassembled PDU]
335   0.033424 172.31.8.238 -> 54.192.118.247 TCP 66 39849 > http [ACK] Seq=97 Ack=2737179 Win=1610752 Len=0 TSval=14150405 TSecr=1685102669
336   0.033503 54.192.118.247 -> 172.31.8.238 TCP 26130 [TCP segment of a reassembled PDU]
337   0.033509 172.31.8.238 -> 54.192.118.247 TCP 66 39849 > http [ACK] Seq=97 Ack=2763243 Win=1610752 Len=0 TSval=14150405 TSecr=1685102669
338   0.033595 54.192.118.247 -> 172.31.8.238 TCP 26130 [TCP segment of a reassembled PDU]
339   0.033601 172.31.8.238 -> 54.192.118.247 TCP 66 39849 > http [ACK] Seq=97 Ack=2789307 Win=1610752 Len=0 TSval=14150405 TSecr=1685102669
340   0.033677 54.192.118.247 -> 172.31.8.238 TCP 26130 [TCP segment of a reassembled PDU]
341   0.033684 172.31.8.238 -> 54.192.118.247 TCP 66 39849 > http [ACK] Seq=97 Ack=2815371 Win=1610752 Len=0 TSval=14150405 TSecr=1685102669
342   0.033754 54.192.118.247 -> 172.31.8.238 TCP 17442 [TCP segment of a reassembled PDU]
343   0.033759 172.31.8.238 -> 54.192.118.247 TCP 66 39849 > http [ACK] Seq=97 Ack=2832747 Win=1610752 Len=0 TSval=14150405 TSecr=1685102669
344   0.034507 54.192.118.247 -> 172.31.8.238 TCP 44954 [TCP segment of a reassembled PDU]
345   0.034517 172.31.8.238 -> 54.192.118.247 TCP 66 39849 > http [ACK] Seq=97 Ack=2877635 Win=1610752 Len=0 TSval=14150406 TSecr=1685102669
346   0.034546 54.192.118.247 -> 172.31.8.238 TCP 7306 [TCP segment of a reassembled PDU]
