[Measurement for 10mb at 10:42:52 20.42.2014] 
Tshark:

  1   0.000000 172.31.8.238 -> 172.31.0.2   DNS 88 Standard query 0xc3f6  A dm53kc3eax57k.cloudfront.net
  2   0.000037 172.31.8.238 -> 172.31.0.2   DNS 88 Standard query 0x86d6  AAAA dm53kc3eax57k.cloudfront.net
  3   0.000526   172.31.0.2 -> 172.31.8.238 DNS 175 Standard query response 0x86d6 
  4   0.000536   172.31.0.2 -> 172.31.8.238 DNS 216 Standard query response 0xc3f6  A 54.239.132.90 A 54.239.132.196 A 54.192.118.237 A 54.230.117.42 A 54.230.117.87 A 54.230.118.136 A 54.230.118.187 A 54.239.132.41
  5   0.003855 172.31.8.238 -> 54.239.132.90 TCP 74 55790 > http [SYN] Seq=0 Win=26883 Len=0 MSS=8961 SACK_PERM=1 TSval=15950148 TSecr=0 WS=128
  6   0.004473 54.239.132.90 -> 172.31.8.238 TCP 74 http > 55790 [SYN, ACK] Seq=0 Ack=1 Win=14480 Len=0 MSS=1460 SACK_PERM=1 TSval=1584152475 TSecr=15950148 WS=128
  7   0.004487 172.31.8.238 -> 54.239.132.90 TCP 66 55790 > http [ACK] Seq=1 Ack=1 Win=27008 Len=0 TSval=15950148 TSecr=1584152475
  8   0.004537 172.31.8.238 -> 54.239.132.90 HTTP 162 GET /10mb HTTP/1.1 
  9   0.004989 54.239.132.90 -> 172.31.8.238 TCP 66 http > 55790 [ACK] Seq=1 Ack=97 Win=14592 Len=0 TSval=1584152476 TSecr=15950148
 10   0.007043 54.239.132.90 -> 172.31.8.238 TCP 524 [TCP segment of a reassembled PDU]
 11   0.007050 172.31.8.238 -> 54.239.132.90 TCP 66 55790 > http [ACK] Seq=97 Ack=459 Win=28032 Len=0 TSval=15950149 TSecr=1584152476
 12   0.007328 54.239.132.90 -> 172.31.8.238 TCP 5858 [TCP segment of a reassembled PDU]
 13   0.007336 172.31.8.238 -> 54.239.132.90 TCP 66 55790 > http [ACK] Seq=97 Ack=6251 Win=39552 Len=0 TSval=15950149 TSecr=1584152476
 14   0.007433 54.239.132.90 -> 172.31.8.238 TCP 7306 [TCP segment of a reassembled PDU]
 15   0.007440 172.31.8.238 -> 54.239.132.90 TCP 66 55790 > http [ACK] Seq=97 Ack=13491 Win=54144 Len=0 TSval=15950149 TSecr=1584152476
 16   0.007851 54.239.132.90 -> 172.31.8.238 TCP 7306 [TCP segment of a reassembled PDU]
 17   0.007859 172.31.8.238 -> 54.239.132.90 TCP 66 55790 > http [ACK] Seq=97 Ack=20731 Win=68608 Len=0 TSval=15950149 TSecr=1584152476
 18   0.007893 54.239.132.90 -> 172.31.8.238 TCP 2962 [TCP segment of a reassembled PDU]
 19   0.007898 172.31.8.238 -> 54.239.132.90 TCP 66 55790 > http [ACK] Seq=97 Ack=23627 Win=74368 Len=0 TSval=15950149 TSecr=1584152476
 20   0.008108 54.239.132.90 -> 172.31.8.238 TCP 2962 [TCP segment of a reassembled PDU]
 21   0.008113 172.31.8.238 -> 54.239.132.90 TCP 66 55790 > http [ACK] Seq=97 Ack=26523 Win=80128 Len=0 TSval=15950149 TSecr=1584152476
 22   0.008370 54.239.132.90 -> 172.31.8.238 TCP 11650 [TCP segment of a reassembled PDU]
 23   0.008379 172.31.8.238 -> 54.239.132.90 TCP 66 55790 > http [ACK] Seq=97 Ack=38107 Win=98944 Len=0 TSval=15950149 TSecr=1584152476
 24   0.008405 54.239.132.90 -> 172.31.8.238 TCP 1514 [TCP segment of a reassembled PDU]
 25   0.008409 172.31.8.238 -> 54.239.132.90 TCP 66 55790 > http [ACK] Seq=97 Ack=39555 Win=106240 Len=0 TSval=15950149 TSecr=1584152476
 26   0.008625 54.239.132.90 -> 172.31.8.238 TCP 10202 [TCP segment of a reassembled PDU]
 27   0.008632 172.31.8.238 -> 54.239.132.90 TCP 66 55790 > http [ACK] Seq=97 Ack=49691 Win=101248 Len=0 TSval=15950149 TSecr=1584152476
 28   0.008851 54.239.132.90 -> 172.31.8.238 TCP 2962 [TCP segment of a reassembled PDU]
 29   0.008856 172.31.8.238 -> 54.239.132.90 TCP 66 55790 > http [ACK] Seq=97 Ack=52587 Win=109056 Len=0 TSval=15950149 TSecr=1584152476
 30   0.008955 54.239.132.90 -> 172.31.8.238 TCP 13098 [TCP segment of a reassembled PDU]
 31   0.008964 172.31.8.238 -> 54.239.132.90 TCP 66 55790 > http [ACK] Seq=97 Ack=65619 Win=96512 Len=0 TSval=15950149 TSecr=1584152476
 32   0.009116 54.239.132.90 -> 172.31.8.238 TCP 7306 [TCP segment of a reassembled PDU]
 33   0.009123 172.31.8.238 -> 54.239.132.90 TCP 66 55790 > http [ACK] Seq=97 Ack=72859 Win=105984 Len=0 TSval=15950149 TSecr=1584152476
 34   0.009219 54.239.132.90 -> 172.31.8.238 TCP 4410 [TCP segment of a reassembled PDU]
 35   0.009224 172.31.8.238 -> 54.239.132.90 TCP 66 55790 > http [ACK] Seq=97 Ack=77203 Win=109056 Len=0 TSval=15950149 TSecr=1584152476
 36   0.009426 54.239.132.90 -> 172.31.8.238 TCP 1514 [TCP segment of a reassembled PDU]
 37   0.009430 172.31.8.238 -> 54.239.132.90 TCP 66 55790 > http [ACK] Seq=97 Ack=78651 Win=109056 Len=0 TSval=15950149 TSecr=1584152476
 38   0.009677 54.239.132.90 -> 172.31.8.238 TCP 13098 [TCP segment of a reassembled PDU]
 39   0.009685 172.31.8.238 -> 54.239.132.90 TCP 66 55790 > http [ACK] Seq=97 Ack=91683 Win=96512 Len=0 TSval=15950149 TSecr=1584152476
 40   0.009780 54.239.132.90 -> 172.31.8.238 TCP 13098 [TCP segment of a reassembled PDU]
 41   0.009788 172.31.8.238 -> 54.239.132.90 TCP 66 55790 > http [ACK] Seq=97 Ack=104715 Win=96512 Len=0 TSval=15950149 TSecr=1584152476
 42   0.010143 54.239.132.90 -> 172.31.8.238 TCP 7306 [TCP segment of a reassembled PDU]
 43   0.010149 172.31.8.238 -> 54.239.132.90 TCP 66 55790 > http [ACK] Seq=97 Ack=111955 Win=105984 Len=0 TSval=15950149 TSecr=1584152476
 44   0.010235 54.239.132.90 -> 172.31.8.238 TCP 5858 [TCP segment of a reassembled PDU]
 45   0.010240 172.31.8.238 -> 54.239.132.90 TCP 66 55790 > http [ACK] Seq=97 Ack=117747 Win=108416 Len=0 TSval=15950149 TSecr=1584152476
 46   0.010413 54.239.132.90 -> 172.31.8.238 TCP 8754 [TCP segment of a reassembled PDU]
 47   0.010420 172.31.8.238 -> 54.239.132.90 TCP 66 55790 > http [ACK] Seq=97 Ack=126435 Win=103680 Len=0 TSval=15950149 TSecr=1584152476
 48   0.010505 54.239.132.90 -> 172.31.8.238 TCP 4410 [TCP segment of a reassembled PDU]
 49   0.010511 172.31.8.238 -> 54.239.132.90 TCP 66 55790 > http [ACK] Seq=97 Ack=130779 Win=99456 Len=0 TSval=15950149 TSecr=1584152476
 50   0.010697 54.239.132.90 -> 172.31.8.238 TCP 13098 [TCP segment of a reassembled PDU]
 51   0.010706 172.31.8.238 -> 54.239.132.90 TCP 66 55790 > http [ACK] Seq=97 Ack=143811 Win=86528 Len=0 TSval=15950150 TSecr=1584152476
 52   0.010972 54.239.132.90 -> 172.31.8.238 TCP 13098 [TCP segment of a reassembled PDU]
 53   0.010981 172.31.8.238 -> 54.239.132.90 TCP 66 55790 > http [ACK] Seq=97 Ack=156843 Win=135168 Len=0 TSval=15950150 TSecr=1584152476
 54   0.011156 54.239.132.90 -> 172.31.8.238 TCP 5858 [TCP segment of a reassembled PDU]
 55   0.011162 172.31.8.238 -> 54.239.132.90 TCP 66 55790 > http [ACK] Seq=97 Ack=162635 Win=146688 Len=0 TSval=15950150 TSecr=1584152476
 56   0.011287 54.239.132.90 -> 172.31.8.238 TCP 7306 [TCP segment of a reassembled PDU]
 57   0.011294 172.31.8.238 -> 54.239.132.90 TCP 66 55790 > http [ACK] Seq=97 Ack=169875 Win=161152 Len=0 TSval=15950150 TSecr=1584152476
 58   0.011382 54.239.132.90 -> 172.31.8.238 TCP 13098 [TCP segment of a reassembled PDU]
 59   0.011391 172.31.8.238 -> 54.239.132.90 TCP 66 55790 > http [ACK] Seq=97 Ack=182907 Win=187264 Len=0 TSval=15950150 TSecr=1584152476
 60   0.011526 54.239.132.90 -> 172.31.8.238 TCP 13098 [TCP segment of a reassembled PDU]
 61   0.011535 172.31.8.238 -> 54.239.132.90 TCP 66 55790 > http [ACK] Seq=97 Ack=195939 Win=213376 Len=0 TSval=15950150 TSecr=1584152476
 62   0.011939 54.239.132.90 -> 172.31.8.238 TCP 8754 [TCP segment of a reassembled PDU]
 63   0.011947 172.31.8.238 -> 54.239.132.90 TCP 66 55790 > http [ACK] Seq=97 Ack=204627 Win=230656 Len=0 TSval=15950150 TSecr=1584152476
 64   0.012075 54.239.132.90 -> 172.31.8.238 TCP 14546 [TCP segment of a reassembled PDU]
 65   0.012084 172.31.8.238 -> 54.239.132.90 TCP 66 55790 > http [ACK] Seq=97 Ack=219107 Win=259712 Len=0 TSval=15950150 TSecr=1584152476
 66   0.012320 54.239.132.90 -> 172.31.8.238 TCP 26130 [TCP segment of a reassembled PDU]
 67   0.012333 172.31.8.238 -> 54.239.132.90 TCP 66 55790 > http [ACK] Seq=97 Ack=245171 Win=311808 Len=0 TSval=15950150 TSecr=1584152476
 68   0.012693 54.239.132.90 -> 172.31.8.238 TCP 2962 [TCP segment of a reassembled PDU]
 69   0.012699 172.31.8.238 -> 54.239.132.90 TCP 66 55790 > http [ACK] Seq=97 Ack=248067 Win=317568 Len=0 TSval=15950150 TSecr=1584152476
 70   0.012867 54.239.132.90 -> 172.31.8.238 TCP 18890 [TCP segment of a reassembled PDU]
 71   0.012878 172.31.8.238 -> 54.239.132.90 TCP 66 55790 > http [ACK] Seq=97 Ack=266891 Win=355200 Len=0 TSval=15950150 TSecr=1584152476
 72   0.012895 54.239.132.90 -> 172.31.8.238 TCP 7306 [TCP segment of a reassembled PDU]
 73   0.012901 172.31.8.238 -> 54.239.132.90 TCP 66 55790 > http [ACK] Seq=97 Ack=274131 Win=369664 Len=0 TSval=15950150 TSecr=1584152476
 74   0.013092 54.239.132.90 -> 172.31.8.238 TCP 23234 [TCP segment of a reassembled PDU]
 75   0.013105 172.31.8.238 -> 54.239.132.90 TCP 66 55790 > http [ACK] Seq=97 Ack=297299 Win=416000 Len=0 TSval=15950150 TSecr=1584152476
 76   0.013469 54.239.132.90 -> 172.31.8.238 TCP 2962 [TCP segment of a reassembled PDU]
 77   0.013474 172.31.8.238 -> 54.239.132.90 TCP 66 55790 > http [ACK] Seq=97 Ack=300195 Win=421888 Len=0 TSval=15950150 TSecr=1584152476
 78   0.013635 54.239.132.90 -> 172.31.8.238 TCP 26130 [TCP segment of a reassembled PDU]
 79   0.013648 172.31.8.238 -> 54.239.132.90 TCP 66 55790 > http [ACK] Seq=97 Ack=326259 Win=473984 Len=0 TSval=15950150 TSecr=1584152476
 80   0.013744 54.239.132.90 -> 172.31.8.238 TCP 2962 [TCP segment of a reassembled PDU]
 81   0.013749 172.31.8.238 -> 54.239.132.90 TCP 66 55790 > http [ACK] Seq=97 Ack=329155 Win=479744 Len=0 TSval=15950150 TSecr=1584152476
 82   0.013890 54.239.132.90 -> 172.31.8.238 TCP 21786 [TCP segment of a reassembled PDU]
 83   0.013902 172.31.8.238 -> 54.239.132.90 TCP 66 55790 > http [ACK] Seq=97 Ack=350875 Win=523136 Len=0 TSval=15950150 TSecr=1584152476
 84   0.014232 54.239.132.90 -> 172.31.8.238 TCP 2962 [TCP segment of a reassembled PDU]
 85   0.014237 172.31.8.238 -> 54.239.132.90 TCP 66 55790 > http [ACK] Seq=97 Ack=353771 Win=529024 Len=0 TSval=15950150 TSecr=1584152476
 86   0.014423 54.239.132.90 -> 172.31.8.238 TCP 26130 [TCP segment of a reassembled PDU]
 87   0.014437 172.31.8.238 -> 54.239.132.90 TCP 66 55790 > http [ACK] Seq=97 Ack=379835 Win=581120 Len=0 TSval=15950150 TSecr=1584152476
 88   0.014462 54.239.132.90 -> 172.31.8.238 TCP 11650 [TCP segment of a reassembled PDU]
 89   0.014470 172.31.8.238 -> 54.239.132.90 TCP 66 55790 > http [ACK] Seq=97 Ack=391419 Win=604288 Len=0 TSval=15950150 TSecr=1584152476
 90   0.014532 54.239.132.90 -> 172.31.8.238 TCP 13098 [TCP segment of a reassembled PDU]
 91   0.014540 172.31.8.238 -> 54.239.132.90 TCP 66 55790 > http [ACK] Seq=97 Ack=404451 Win=630400 Len=0 TSval=15950150 TSecr=1584152476
 92   0.015029 54.239.132.90 -> 172.31.8.238 TCP 14546 [TCP segment of a reassembled PDU]
 93   0.015040 172.31.8.238 -> 54.239.132.90 TCP 66 55790 > http [ACK] Seq=97 Ack=418931 Win=659328 Len=0 TSval=15950151 TSecr=1584152477
 94   0.015198 54.239.132.90 -> 172.31.8.238 TCP 23234 [TCP segment of a reassembled PDU]
 95   0.015211 172.31.8.238 -> 54.239.132.90 TCP 66 55790 > http [ACK] Seq=97 Ack=442099 Win=705664 Len=0 TSval=15950151 TSecr=1584152477
 96   0.015216 54.239.132.90 -> 172.31.8.238 TCP 1514 [TCP segment of a reassembled PDU]
 97   0.015218 172.31.8.238 -> 54.239.132.90 TCP 66 55790 > http [ACK] Seq=97 Ack=443547 Win=708480 Len=0 TSval=15950151 TSecr=1584152477
 98   0.015225 54.239.132.90 -> 172.31.8.238 TCP 1514 [TCP segment of a reassembled PDU]
 99   0.015228 172.31.8.238 -> 54.239.132.90 TCP 66 55790 > http [ACK] Seq=97 Ack=444995 Win=711424 Len=0 TSval=15950151 TSecr=1584152477
100   0.015304 54.239.132.90 -> 172.31.8.238 TCP 13098 [TCP segment of a reassembled PDU]
101   0.015312 172.31.8.238 -> 54.239.132.90 TCP 66 55790 > http [ACK] Seq=97 Ack=458027 Win=737536 Len=0 TSval=15950151 TSecr=1584152477
102   0.015530 54.239.132.90 -> 172.31.8.238 TCP 8754 [TCP segment of a reassembled PDU]
103   0.015537 172.31.8.238 -> 54.239.132.90 TCP 66 55790 > http [ACK] Seq=97 Ack=466715 Win=754816 Len=0 TSval=15950151 TSecr=1584152477
104   0.015703 54.239.132.90 -> 172.31.8.238 TCP 26130 [TCP segment of a reassembled PDU]
105   0.015716 172.31.8.238 -> 54.239.132.90 TCP 66 55790 > http [ACK] Seq=97 Ack=492779 Win=807040 Len=0 TSval=15950151 TSecr=1584152477
106   0.015722 54.239.132.90 -> 172.31.8.238 TCP 1514 [TCP segment of a reassembled PDU]
107   0.015725 172.31.8.238 -> 54.239.132.90 TCP 66 55790 > http [ACK] Seq=97 Ack=494227 Win=809856 Len=0 TSval=15950151 TSecr=1584152477
108   0.015849 54.239.132.90 -> 172.31.8.238 TCP 14546 [TCP segment of a reassembled PDU]
109   0.015857 172.31.8.238 -> 54.239.132.90 TCP 66 55790 > http [ACK] Seq=97 Ack=508707 Win=838912 Len=0 TSval=15950151 TSecr=1584152477
110   0.015950 54.239.132.90 -> 172.31.8.238 TCP 2962 [TCP segment of a reassembled PDU]
111   0.015955 172.31.8.238 -> 54.239.132.90 TCP 66 55790 > http [ACK] Seq=97 Ack=511603 Win=844672 Len=0 TSval=15950151 TSecr=1584152477
112   0.016038 54.239.132.90 -> 172.31.8.238 TCP 1514 [TCP segment of a reassembled PDU]
113   0.016043 172.31.8.238 -> 54.239.132.90 TCP 66 55790 > http [ACK] Seq=97 Ack=513051 Win=847488 Len=0 TSval=15950151 TSecr=1584152477
114   0.016229 54.239.132.90 -> 172.31.8.238 TCP 26130 [TCP segment of a reassembled PDU]
115   0.016243 172.31.8.238 -> 54.239.132.90 TCP 66 55790 > http [ACK] Seq=97 Ack=539115 Win=899712 Len=0 TSval=15950151 TSecr=1584152477
116   0.016415 54.239.132.90 -> 172.31.8.238 TCP 26130 [TCP segment of a reassembled PDU]
117   0.016429 172.31.8.238 -> 54.239.132.90 TCP 66 55790 > http [ACK] Seq=97 Ack=565179 Win=951808 Len=0 TSval=15950151 TSecr=1584152477
118   0.016643 54.239.132.90 -> 172.31.8.238 TCP 26130 [TCP segment of a reassembled PDU]
119   0.016656 172.31.8.238 -> 54.239.132.90 TCP 66 55790 > http [ACK] Seq=97 Ack=591243 Win=1003904 Len=0 TSval=15950151 TSecr=1584152477
120   0.016664 54.239.132.90 -> 172.31.8.238 TCP 4410 [TCP segment of a reassembled PDU]
121   0.016668 172.31.8.238 -> 54.239.132.90 TCP 66 55790 > http [ACK] Seq=97 Ack=595587 Win=1012608 Len=0 TSval=15950151 TSecr=1584152477
122   0.016819 54.239.132.90 -> 172.31.8.238 TCP 14546 [TCP segment of a reassembled PDU]
123   0.016828 172.31.8.238 -> 54.239.132.90 TCP 66 55790 > http [ACK] Seq=97 Ack=610067 Win=1041536 Len=0 TSval=15950151 TSecr=1584152477
124   0.016921 54.239.132.90 -> 172.31.8.238 TCP 8754 [TCP segment of a reassembled PDU]
125   0.016929 172.31.8.238 -> 54.239.132.90 TCP 66 55790 > http [ACK] Seq=97 Ack=618755 Win=1058944 Len=0 TSval=15950151 TSecr=1584152477
126   0.017198 54.239.132.90 -> 172.31.8.238 TCP 26130 [TCP segment of a reassembled PDU]
127   0.017212 172.31.8.238 -> 54.239.132.90 TCP 66 55790 > http [ACK] Seq=97 Ack=644819 Win=1111040 Len=0 TSval=15950151 TSecr=1584152477
128   0.017244 54.239.132.90 -> 172.31.8.238 TCP 13098 [TCP segment of a reassembled PDU]
129   0.017255 172.31.8.238 -> 54.239.132.90 TCP 66 55790 > http [ACK] Seq=97 Ack=657851 Win=1137152 Len=0 TSval=15950151 TSecr=1584152477
130   0.017456 54.239.132.90 -> 172.31.8.238 TCP 10202 [TCP segment of a reassembled PDU]
131   0.017463 172.31.8.238 -> 54.239.132.90 TCP 66 55790 > http [ACK] Seq=97 Ack=667987 Win=1157376 Len=0 TSval=15950151 TSecr=1584152477
132   0.017476 54.239.132.90 -> 172.31.8.238 TCP 17442 [TCP segment of a reassembled PDU]
133   0.017483 172.31.8.238 -> 54.239.132.90 TCP 66 55790 > http [ACK] Seq=97 Ack=685363 Win=1192192 Len=0 TSval=15950151 TSecr=1584152477
134   0.017494 54.239.132.90 -> 172.31.8.238 TCP 8754 [TCP segment of a reassembled PDU]
135   0.017499 172.31.8.238 -> 54.239.132.90 TCP 66 55790 > http [ACK] Seq=97 Ack=694051 Win=1209600 Len=0 TSval=15950151 TSecr=1584152477
136   0.017576 54.239.132.90 -> 172.31.8.238 TCP 13098 [TCP segment of a reassembled PDU]
137   0.017585 172.31.8.238 -> 54.239.132.90 TCP 66 55790 > http [ACK] Seq=97 Ack=707083 Win=1235584 Len=0 TSval=15950151 TSecr=1584152477
138   0.017882 54.239.132.90 -> 172.31.8.238 TCP 18890 [TCP segment of a reassembled PDU]
139   0.017893 172.31.8.238 -> 54.239.132.90 TCP 66 55790 > http [ACK] Seq=97 Ack=725907 Win=1273216 Len=0 TSval=15950151 TSecr=1584152477
140   0.018097 54.239.132.90 -> 172.31.8.238 TCP 7306 [TCP segment of a reassembled PDU]
141   0.018104 172.31.8.238 -> 54.239.132.90 TCP 66 55790 > http [ACK] Seq=97 Ack=733147 Win=1287680 Len=0 TSval=15950151 TSecr=1584152477
142   0.018263 54.239.132.90 -> 172.31.8.238 TCP 23234 [TCP segment of a reassembled PDU]
143   0.018275 172.31.8.238 -> 54.239.132.90 TCP 66 55790 > http [ACK] Seq=97 Ack=756315 Win=1334016 Len=0 TSval=15950151 TSecr=1584152477
144   0.018382 54.239.132.90 -> 172.31.8.238 TCP 34818 [TCP segment of a reassembled PDU]
145   0.018398 172.31.8.238 -> 54.239.132.90 TCP 66 55790 > http [ACK] Seq=97 Ack=791067 Win=1330432 Len=0 TSval=15950151 TSecr=1584152477
146   0.018705 54.239.132.90 -> 172.31.8.238 TCP 26130 [TCP segment of a reassembled PDU]
147   0.018719 172.31.8.238 -> 54.239.132.90 TCP 66 55790 > http [ACK] Seq=97 Ack=817131 Win=1344768 Len=0 TSval=15950152 TSecr=1584152477
148   0.018753 54.239.132.90 -> 172.31.8.238 TCP 17442 [TCP segment of a reassembled PDU]
149   0.018762 172.31.8.238 -> 54.239.132.90 TCP 66 55790 > http [ACK] Seq=97 Ack=834507 Win=1361152 Len=0 TSval=15950152 TSecr=1584152477
150   0.018964 54.239.132.90 -> 172.31.8.238 TCP 26130 [TCP segment of a reassembled PDU]
151   0.018978 172.31.8.238 -> 54.239.132.90 TCP 66 55790 > http [ACK] Seq=97 Ack=860571 Win=1389824 Len=0 TSval=15950152 TSecr=1584152477
152   0.019032 54.239.132.90 -> 172.31.8.238 TCP 18890 [TCP segment of a reassembled PDU]
153   0.019042 172.31.8.238 -> 54.239.132.90 TCP 66 55790 > http [ACK] Seq=97 Ack=879395 Win=1401728 Len=0 TSval=15950152 TSecr=1584152477
154   0.019103 54.239.132.90 -> 172.31.8.238 TCP 24682 [TCP segment of a reassembled PDU]
155   0.019230 172.31.8.238 -> 54.239.132.90 TCP 66 55790 > http [ACK] Seq=97 Ack=904011 Win=1377152 Len=0 TSval=15950152 TSecr=1584152477
156   0.019360 54.239.132.90 -> 172.31.8.238 TCP 4410 [TCP segment of a reassembled PDU]
157   0.019366 172.31.8.238 -> 54.239.132.90 TCP 66 55790 > http [ACK] Seq=97 Ack=908355 Win=1423872 Len=0 TSval=15950152 TSecr=1584152477
158   0.019501 54.239.132.90 -> 172.31.8.238 TCP 13098 [TCP segment of a reassembled PDU]
159   0.019520 172.31.8.238 -> 54.239.132.90 TCP 66 55790 > http [ACK] Seq=97 Ack=921387 Win=1423872 Len=0 TSval=15950152 TSecr=1584152477
160   0.019782 54.239.132.90 -> 172.31.8.238 TCP 20338 [TCP segment of a reassembled PDU]
161   0.019804 172.31.8.238 -> 54.239.132.90 TCP 66 55790 > http [ACK] Seq=97 Ack=941659 Win=1403648 Len=0 TSval=15950152 TSecr=1584152477
162   0.019976 54.239.132.90 -> 172.31.8.238 TCP 57986 [TCP segment of a reassembled PDU]
163   0.020002 54.239.132.90 -> 172.31.8.238 TCP 4410 [TCP segment of a reassembled PDU]
164   0.020018 172.31.8.238 -> 54.239.132.90 TCP 66 55790 > http [ACK] Seq=97 Ack=1003923 Win=1341440 Len=0 TSval=15950152 TSecr=1584152477
165   0.020049 54.239.132.90 -> 172.31.8.238 TCP 21786 [TCP segment of a reassembled PDU]
166   0.020071 172.31.8.238 -> 54.239.132.90 TCP 66 55790 > http [ACK] Seq=97 Ack=1025643 Win=1396992 Len=0 TSval=15950152 TSecr=1584152477
167   0.020092 54.239.132.90 -> 172.31.8.238 TCP 4410 [TCP segment of a reassembled PDU]
168   0.020097 172.31.8.238 -> 54.239.132.90 TCP 66 55790 > http [ACK] Seq=97 Ack=1029987 Win=1423872 Len=0 TSval=15950152 TSecr=1584152477
169   0.020496 54.239.132.90 -> 172.31.8.238 TCP 18890 [TCP segment of a reassembled PDU]
170   0.020520 172.31.8.238 -> 54.239.132.90 TCP 66 55790 > http [ACK] Seq=97 Ack=1048811 Win=1405056 Len=0 TSval=15950152 TSecr=1584152477
171   0.020602 54.239.132.90 -> 172.31.8.238 TCP 2962 [TCP segment of a reassembled PDU]
172   0.020607 172.31.8.238 -> 54.239.132.90 TCP 66 55790 > http [ACK] Seq=97 Ack=1051707 Win=1423872 Len=0 TSval=15950152 TSecr=1584152477
173   0.020769 54.239.132.90 -> 172.31.8.238 TCP 21786 [TCP segment of a reassembled PDU]
174   0.020792 172.31.8.238 -> 54.239.132.90 TCP 66 55790 > http [ACK] Seq=97 Ack=1073427 Win=1402240 Len=0 TSval=15950152 TSecr=1584152477
175   0.020916 54.239.132.90 -> 172.31.8.238 TCP 26130 [TCP segment of a reassembled PDU]
176   0.020951 54.239.132.90 -> 172.31.8.238 TCP 17442 [TCP segment of a reassembled PDU]
177   0.021002 172.31.8.238 -> 54.239.132.90 TCP 66 55790 > http [ACK] Seq=97 Ack=1116867 Win=1361152 Len=0 TSval=15950152 TSecr=1584152477
178   0.021301 54.239.132.90 -> 172.31.8.238 TCP 26130 [TCP segment of a reassembled PDU]
179   0.021314 172.31.8.238 -> 54.239.132.90 TCP 66 55790 > http [ACK] Seq=97 Ack=1142931 Win=1389824 Len=0 TSval=15950152 TSecr=1584152477
180   0.021371 54.239.132.90 -> 172.31.8.238 TCP 18890 [TCP segment of a reassembled PDU]
181   0.021382 172.31.8.238 -> 54.239.132.90 TCP 66 55790 > http [ACK] Seq=97 Ack=1161755 Win=1401728 Len=0 TSval=15950152 TSecr=1584152477
182   0.021443 54.239.132.90 -> 172.31.8.238 TCP 20338 [TCP segment of a reassembled PDU]
183   0.021466 172.31.8.238 -> 54.239.132.90 TCP 66 55790 > http [ACK] Seq=97 Ack=1182027 Win=1399296 Len=0 TSval=15950152 TSecr=1584152477
184   0.021687 54.239.132.90 -> 172.31.8.238 TCP 1514 [TCP segment of a reassembled PDU]
185   0.021874 54.239.132.90 -> 172.31.8.238 TCP 26130 [TCP segment of a reassembled PDU]
186   0.021912 172.31.8.238 -> 54.239.132.90 TCP 66 55790 > http [ACK] Seq=97 Ack=1209539 Win=1389824 Len=0 TSval=15950152 TSecr=1584152477
187   0.021957 54.239.132.90 -> 172.31.8.238 TCP 26130 [TCP segment of a reassembled PDU]
188   0.021970 172.31.8.238 -> 54.239.132.90 TCP 66 55790 > http [ACK] Seq=97 Ack=1235603 Win=1389824 Len=0 TSval=15950152 TSecr=1584152477
189   0.022039 54.239.132.90 -> 172.31.8.238 TCP 26130 [TCP segment of a reassembled PDU]
190   0.022053 172.31.8.238 -> 54.239.132.90 TCP 66 55790 > http [ACK] Seq=97 Ack=1261667 Win=1389824 Len=0 TSval=15950152 TSecr=1584152477
191   0.022132 54.239.132.90 -> 172.31.8.238 TCP 26130 [TCP segment of a reassembled PDU]
192   0.022145 172.31.8.238 -> 54.239.132.90 TCP 66 55790 > http [ACK] Seq=97 Ack=1287731 Win=1389824 Len=0 TSval=15950152 TSecr=1584152477
193   0.022202 54.239.132.90 -> 172.31.8.238 TCP 24682 [TCP segment of a reassembled PDU]
194   0.022215 172.31.8.238 -> 54.239.132.90 TCP 66 55790 > http [ACK] Seq=97 Ack=1312347 Win=1392256 Len=0 TSval=15950152 TSecr=1584152477
195   0.022755 54.239.132.90 -> 172.31.8.238 TCP 2962 [TCP segment of a reassembled PDU]
196   0.022761 172.31.8.238 -> 54.239.132.90 TCP 66 55790 > http [ACK] Seq=97 Ack=1315243 Win=1423872 Len=0 TSval=15950153 TSecr=1584152477
197   0.022938 54.239.132.90 -> 172.31.8.238 TCP 26130 [TCP segment of a reassembled PDU]
198   0.022951 172.31.8.238 -> 54.239.132.90 TCP 66 55790 > http [ACK] Seq=97 Ack=1341307 Win=1475968 Len=0 TSval=15950153 TSecr=1584152477
199   0.023012 54.239.132.90 -> 172.31.8.238 TCP 26130 [TCP segment of a reassembled PDU]
200   0.023026 172.31.8.238 -> 54.239.132.90 TCP 66 55790 > http [ACK] Seq=97 Ack=1367371 Win=1528064 Len=0 TSval=15950153 TSecr=1584152477
201   0.023103 54.239.132.90 -> 172.31.8.238 TCP 26130 [TCP segment of a reassembled PDU]
202   0.023121 172.31.8.238 -> 54.239.132.90 TCP 66 55790 > http [ACK] Seq=97 Ack=1393435 Win=1580160 Len=0 TSval=15950153 TSecr=1584152477
203   0.023217 54.239.132.90 -> 172.31.8.238 TCP 26130 [TCP segment of a reassembled PDU]
204   0.023231 172.31.8.238 -> 54.239.132.90 TCP 66 55790 > http [ACK] Seq=97 Ack=1419499 Win=1580160 Len=0 TSval=15950153 TSecr=1584152477
205   0.023285 54.239.132.90 -> 172.31.8.238 TCP 23234 [TCP segment of a reassembled PDU]
206   0.023297 172.31.8.238 -> 54.239.132.90 TCP 66 55790 > http [ACK] Seq=97 Ack=1442667 Win=1580160 Len=0 TSval=15950153 TSecr=1584152477
207   0.023642 54.239.132.90 -> 172.31.8.238 TCP 15994 [TCP segment of a reassembled PDU]
208   0.023652 172.31.8.238 -> 54.239.132.90 TCP 66 55790 > http [ACK] Seq=97 Ack=1458595 Win=1580160 Len=0 TSval=15950153 TSecr=1584152477
209   0.023803 54.239.132.90 -> 172.31.8.238 TCP 23234 [TCP segment of a reassembled PDU]
210   0.023815 172.31.8.238 -> 54.239.132.90 TCP 66 55790 > http [ACK] Seq=97 Ack=1481763 Win=1580160 Len=0 TSval=15950153 TSecr=1584152477
211   0.023921 54.239.132.90 -> 172.31.8.238 TCP 26130 [TCP segment of a reassembled PDU]
212   0.023932 172.31.8.238 -> 54.239.132.90 TCP 66 55790 > http [ACK] Seq=97 Ack=1507827 Win=1580160 Len=0 TSval=15950153 TSecr=1584152477
213   0.023952 54.239.132.90 -> 172.31.8.238 TCP 26130 [TCP segment of a reassembled PDU]
214   0.023967 172.31.8.238 -> 54.239.132.90 TCP 66 55790 > http [ACK] Seq=97 Ack=1533891 Win=1580160 Len=0 TSval=15950153 TSecr=1584152477
215   0.024059 54.239.132.90 -> 172.31.8.238 TCP 26130 [TCP segment of a reassembled PDU]
216   0.024072 172.31.8.238 -> 54.239.132.90 TCP 66 55790 > http [ACK] Seq=97 Ack=1559955 Win=1580160 Len=0 TSval=15950153 TSecr=1584152477
217   0.024113 54.239.132.90 -> 172.31.8.238 TCP 13098 [TCP segment of a reassembled PDU]
218   0.024121 172.31.8.238 -> 54.239.132.90 TCP 66 55790 > http [ACK] Seq=97 Ack=1572987 Win=1580160 Len=0 TSval=15950153 TSecr=1584152477
219   0.024517 54.239.132.90 -> 172.31.8.238 TCP 23234 [TCP segment of a reassembled PDU]
220   0.024530 172.31.8.238 -> 54.239.132.90 TCP 66 55790 > http [ACK] Seq=97 Ack=1596155 Win=1580160 Len=0 TSval=15950153 TSecr=1584152477
221   0.024628 54.239.132.90 -> 172.31.8.238 TCP 29026 [TCP segment of a reassembled PDU]
222   0.024642 172.31.8.238 -> 54.239.132.90 TCP 66 55790 > http [ACK] Seq=97 Ack=1625115 Win=1580160 Len=0 TSval=15950153 TSecr=1584152477
223   0.024659 54.239.132.90 -> 172.31.8.238 TCP 26130 [TCP segment of a reassembled PDU]
224   0.024674 172.31.8.238 -> 54.239.132.90 TCP 66 55790 > http [ACK] Seq=97 Ack=1651179 Win=1580160 Len=0 TSval=15950153 TSecr=1584152477
225   0.024756 54.239.132.90 -> 172.31.8.238 TCP 26130 [TCP segment of a reassembled PDU]
226   0.024769 172.31.8.238 -> 54.239.132.90 TCP 66 55790 > http [ACK] Seq=97 Ack=1677243 Win=1580160 Len=0 TSval=15950153 TSecr=1584152477
227   0.024829 54.239.132.90 -> 172.31.8.238 TCP 17442 [TCP segment of a reassembled PDU]
228   0.024838 172.31.8.238 -> 54.239.132.90 TCP 66 55790 > http [ACK] Seq=97 Ack=1694619 Win=1580160 Len=0 TSval=15950153 TSecr=1584152477
229   0.024851 54.239.132.90 -> 172.31.8.238 TCP 8754 [TCP segment of a reassembled PDU]
230   0.024856 172.31.8.238 -> 54.239.132.90 TCP 66 55790 > http [ACK] Seq=97 Ack=1703307 Win=1580160 Len=0 TSval=15950153 TSecr=1584152478
231   0.025028 54.239.132.90 -> 172.31.8.238 TCP 20338 [TCP segment of a reassembled PDU]
232   0.025040 172.31.8.238 -> 54.239.132.90 TCP 66 55790 > http [ACK] Seq=97 Ack=1723579 Win=1580160 Len=0 TSval=15950153 TSecr=1584152478
233   0.025170 54.239.132.90 -> 172.31.8.238 TCP 26130 [TCP segment of a reassembled PDU]
234   0.025183 172.31.8.238 -> 54.239.132.90 TCP 66 55790 > http [ACK] Seq=97 Ack=1749643 Win=1580160 Len=0 TSval=15950153 TSecr=1584152478
235   0.025209 54.239.132.90 -> 172.31.8.238 TCP 11650 [TCP segment of a reassembled PDU]
236   0.025216 172.31.8.238 -> 54.239.132.90 TCP 66 55790 > http [ACK] Seq=97 Ack=1761227 Win=1580160 Len=0 TSval=15950153 TSecr=1584152478
237   0.025269 54.239.132.90 -> 172.31.8.238 TCP 7306 [TCP segment of a reassembled PDU]
238   0.025277 172.31.8.238 -> 54.239.132.90 TCP 66 55790 > http [ACK] Seq=97 Ack=1768467 Win=1580160 Len=0 TSval=15950153 TSecr=1584152478
239   0.025509 54.239.132.90 -> 172.31.8.238 TCP 7306 [TCP segment of a reassembled PDU]
240   0.025517 172.31.8.238 -> 54.239.132.90 TCP 66 55790 > http [ACK] Seq=97 Ack=1775707 Win=1580160 Len=0 TSval=15950153 TSecr=1584152478
241   0.025691 54.239.132.90 -> 172.31.8.238 TCP 26130 [TCP segment of a reassembled PDU]
242   0.025704 172.31.8.238 -> 54.239.132.90 TCP 66 55790 > http [ACK] Seq=97 Ack=1801771 Win=1580160 Len=0 TSval=15950153 TSecr=1584152478
243   0.025762 54.239.132.90 -> 172.31.8.238 TCP 26130 [TCP segment of a reassembled PDU]
244   0.025775 172.31.8.238 -> 54.239.132.90 TCP 66 55790 > http [ACK] Seq=97 Ack=1827835 Win=1580160 Len=0 TSval=15950153 TSecr=1584152478
245   0.025844 54.239.132.90 -> 172.31.8.238 TCP 26130 [TCP segment of a reassembled PDU]
246   0.025857 172.31.8.238 -> 54.239.132.90 TCP 66 55790 > http [ACK] Seq=97 Ack=1853899 Win=1580160 Len=0 TSval=15950153 TSecr=1584152478
247   0.025920 54.239.132.90 -> 172.31.8.238 TCP 26130 [TCP segment of a reassembled PDU]
248   0.025927 172.31.8.238 -> 54.239.132.90 TCP 66 55790 > http [ACK] Seq=97 Ack=1879963 Win=1580160 Len=0 TSval=15950153 TSecr=1584152478
249   0.025981 54.239.132.90 -> 172.31.8.238 TCP 18890 [TCP segment of a reassembled PDU]
250   0.025986 172.31.8.238 -> 54.239.132.90 TCP 66 55790 > http [ACK] Seq=97 Ack=1898787 Win=1580160 Len=0 TSval=15950153 TSecr=1584152478
251   0.026321 54.239.132.90 -> 172.31.8.238 TCP 1514 [TCP segment of a reassembled PDU]
252   0.026489 54.239.132.90 -> 172.31.8.238 TCP 26130 [TCP segment of a reassembled PDU]
253   0.026496 172.31.8.238 -> 54.239.132.90 TCP 66 55790 > http [ACK] Seq=97 Ack=1926299 Win=1580160 Len=0 TSval=15950154 TSecr=1584152478
254   0.026617 54.239.132.90 -> 172.31.8.238 TCP 26130 [TCP segment of a reassembled PDU]
255   0.026624 172.31.8.238 -> 54.239.132.90 TCP 66 55790 > http [ACK] Seq=97 Ack=1952363 Win=1580160 Len=0 TSval=15950154 TSecr=1584152478
256   0.026633 54.239.132.90 -> 172.31.8.238 TCP 10202 [TCP segment of a reassembled PDU]
257   0.026638 172.31.8.238 -> 54.239.132.90 TCP 66 55790 > http [ACK] Seq=97 Ack=1962499 Win=1580160 Len=0 TSval=15950154 TSecr=1584152478
258   0.026716 54.239.132.90 -> 172.31.8.238 TCP 15994 [TCP segment of a reassembled PDU]
259   0.026722 172.31.8.238 -> 54.239.132.90 TCP 66 55790 > http [ACK] Seq=97 Ack=1978427 Win=1580160 Len=0 TSval=15950154 TSecr=1584152478
260   0.026810 54.239.132.90 -> 172.31.8.238 TCP 36266 [TCP segment of a reassembled PDU]
261   0.026819 172.31.8.238 -> 54.239.132.90 TCP 66 55790 > http [ACK] Seq=97 Ack=2014627 Win=1580160 Len=0 TSval=15950154 TSecr=1584152478
262   0.026870 54.239.132.90 -> 172.31.8.238 TCP 14546 [TCP segment of a reassembled PDU]
263   0.026874 172.31.8.238 -> 54.239.132.90 TCP 66 55790 > http [ACK] Seq=97 Ack=2029107 Win=1580160 Len=0 TSval=15950154 TSecr=1584152478
264   0.027172 54.239.132.90 -> 172.31.8.238 TCP 17442 [TCP segment of a reassembled PDU]
265   0.027179 172.31.8.238 -> 54.239.132.90 TCP 66 55790 > http [ACK] Seq=97 Ack=2046483 Win=1580160 Len=0 TSval=15950154 TSecr=1584152478
266   0.027317 54.239.132.90 -> 172.31.8.238 TCP 26130 [TCP segment of a reassembled PDU]
267   0.027324 172.31.8.238 -> 54.239.132.90 TCP 66 55790 > http [ACK] Seq=97 Ack=2072547 Win=1580160 Len=0 TSval=15950154 TSecr=1584152478
268   0.027383 54.239.132.90 -> 172.31.8.238 TCP 26130 [TCP segment of a reassembled PDU]
269   0.027390 172.31.8.238 -> 54.239.132.90 TCP 66 55790 > http [ACK] Seq=97 Ack=2098611 Win=1580160 Len=0 TSval=15950154 TSecr=1584152478
270   0.027460 54.239.132.90 -> 172.31.8.238 TCP 26130 [TCP segment of a reassembled PDU]
271   0.027467 172.31.8.238 -> 54.239.132.90 TCP 66 55790 > http [ACK] Seq=97 Ack=2124675 Win=1580160 Len=0 TSval=15950154 TSecr=1584152478
272   0.027531 54.239.132.90 -> 172.31.8.238 TCP 26130 [TCP segment of a reassembled PDU]
273   0.027538 172.31.8.238 -> 54.239.132.90 TCP 66 55790 > http [ACK] Seq=97 Ack=2150739 Win=1580160 Len=0 TSval=15950154 TSecr=1584152478
274   0.027631 54.239.132.90 -> 172.31.8.238 TCP 8754 [TCP segment of a reassembled PDU]
275   0.027635 172.31.8.238 -> 54.239.132.90 TCP 66 55790 > http [ACK] Seq=97 Ack=2159427 Win=1580160 Len=0 TSval=15950154 TSecr=1584152478
276   0.027798 54.239.132.90 -> 172.31.8.238 TCP 26130 [TCP segment of a reassembled PDU]
277   0.027806 172.31.8.238 -> 54.239.132.90 TCP 66 55790 > http [ACK] Seq=97 Ack=2185491 Win=1580160 Len=0 TSval=15950154 TSecr=1584152478
278   0.027881 54.239.132.90 -> 172.31.8.238 TCP 26130 [TCP segment of a reassembled PDU]
279   0.027888 172.31.8.238 -> 54.239.132.90 TCP 66 55790 > http [ACK] Seq=97 Ack=2211555 Win=1580160 Len=0 TSval=15950154 TSecr=1584152478
280   0.027957 54.239.132.90 -> 172.31.8.238 TCP 13098 [TCP segment of a reassembled PDU]
281   0.027966 172.31.8.238 -> 54.239.132.90 TCP 66 55790 > http [ACK] Seq=97 Ack=2224587 Win=1580160 Len=0 TSval=15950154 TSecr=1584152478
282   0.028256 54.239.132.90 -> 172.31.8.238 TCP 23234 [TCP segment of a reassembled PDU]
283   0.028263 172.31.8.238 -> 54.239.132.90 TCP 66 55790 > http [ACK] Seq=97 Ack=2247755 Win=1580160 Len=0 TSval=15950154 TSecr=1584152478
284   0.028381 54.239.132.90 -> 172.31.8.238 TCP 29026 [TCP segment of a reassembled PDU]
285   0.028388 172.31.8.238 -> 54.239.132.90 TCP 66 55790 > http [ACK] Seq=97 Ack=2276715 Win=1580160 Len=0 TSval=15950154 TSecr=1584152478
286   0.028406 54.239.132.90 -> 172.31.8.238 TCP 26130 [TCP segment of a reassembled PDU]
287   0.028415 172.31.8.238 -> 54.239.132.90 TCP 66 55790 > http [ACK] Seq=97 Ack=2302779 Win=1580160 Len=0 TSval=15950154 TSecr=1584152478
288   0.028502 54.239.132.90 -> 172.31.8.238 TCP 26130 [TCP segment of a reassembled PDU]
289   0.028508 172.31.8.238 -> 54.239.132.90 TCP 66 55790 > http [ACK] Seq=97 Ack=2328843 Win=1580160 Len=0 TSval=15950154 TSecr=1584152478
290   0.028572 54.239.132.90 -> 172.31.8.238 TCP 26130 [TCP segment of a reassembled PDU]
291   0.028578 172.31.8.238 -> 54.239.132.90 TCP 66 55790 > http [ACK] Seq=97 Ack=2354907 Win=1580160 Len=0 TSval=15950154 TSecr=1584152478
292   0.028725 54.239.132.90 -> 172.31.8.238 TCP 20338 [TCP segment of a reassembled PDU]
293   0.028730 172.31.8.238 -> 54.239.132.90 TCP 66 55790 > http [ACK] Seq=97 Ack=2375179 Win=1580160 Len=0 TSval=15950154 TSecr=1584152478
294   0.028877 54.239.132.90 -> 172.31.8.238 TCP 26130 [TCP segment of a reassembled PDU]
295   0.028885 172.31.8.238 -> 54.239.132.90 TCP 66 55790 > http [ACK] Seq=97 Ack=2401243 Win=1580160 Len=0 TSval=15950154 TSecr=1584152478
296   0.028929 54.239.132.90 -> 172.31.8.238 TCP 18890 [TCP segment of a reassembled PDU]
297   0.028935 172.31.8.238 -> 54.239.132.90 TCP 66 55790 > http [ACK] Seq=97 Ack=2420067 Win=1580160 Len=0 TSval=15950154 TSecr=1584152478
298   0.029248 54.239.132.90 -> 172.31.8.238 TCP 23234 [TCP segment of a reassembled PDU]
299   0.029255 172.31.8.238 -> 54.239.132.90 TCP 66 55790 > http [ACK] Seq=97 Ack=2443235 Win=1580160 Len=0 TSval=15950154 TSecr=1584152478
300   0.029385 54.239.132.90 -> 172.31.8.238 TCP 20338 [TCP segment of a reassembled PDU]
301   0.029392 172.31.8.238 -> 54.239.132.90 TCP 66 55790 > http [ACK] Seq=97 Ack=2463507 Win=1580160 Len=0 TSval=15950154 TSecr=1584152478
302   0.029485 54.239.132.90 -> 172.31.8.238 TCP 5858 [TCP segment of a reassembled PDU]
303   0.029490 172.31.8.238 -> 54.239.132.90 TCP 66 55790 > http [ACK] Seq=97 Ack=2469299 Win=1580160 Len=0 TSval=15950154 TSecr=1584152478
304   0.029518 54.239.132.90 -> 172.31.8.238 TCP 26130 [TCP segment of a reassembled PDU]
305   0.029523 172.31.8.238 -> 54.239.132.90 TCP 66 55790 > http [ACK] Seq=97 Ack=2495363 Win=1580160 Len=0 TSval=15950154 TSecr=1584152478
306   0.029605 54.239.132.90 -> 172.31.8.238 TCP 26130 [TCP segment of a reassembled PDU]
307   0.029611 172.31.8.238 -> 54.239.132.90 TCP 66 55790 > http [ACK] Seq=97 Ack=2521427 Win=1580160 Len=0 TSval=15950154 TSecr=1584152478
308   0.029677 54.239.132.90 -> 172.31.8.238 TCP 26130 [TCP segment of a reassembled PDU]
309   0.029683 172.31.8.238 -> 54.239.132.90 TCP 66 55790 > http [ACK] Seq=97 Ack=2547491 Win=1580160 Len=0 TSval=15950154 TSecr=1584152478
310   0.029773 54.239.132.90 -> 172.31.8.238 TCP 36266 [TCP segment of a reassembled PDU]
311   0.029782 172.31.8.238 -> 54.239.132.90 TCP 66 55790 > http [ACK] Seq=97 Ack=2583691 Win=1580160 Len=0 TSval=15950154 TSecr=1584152478
312   0.029832 54.239.132.90 -> 172.31.8.238 TCP 15994 [TCP segment of a reassembled PDU]
313   0.029837 172.31.8.238 -> 54.239.132.90 TCP 66 55790 > http [ACK] Seq=97 Ack=2599619 Win=1580160 Len=0 TSval=15950154 TSecr=1584152478
314   0.029899 54.239.132.90 -> 172.31.8.238 TCP 13098 [TCP segment of a reassembled PDU]
315   0.029903 172.31.8.238 -> 54.239.132.90 TCP 66 55790 > http [ACK] Seq=97 Ack=2612651 Win=1580160 Len=0 TSval=15950154 TSecr=1584152478
316   0.029909 54.239.132.90 -> 172.31.8.238 TCP 1514 [TCP Previous segment not captured] [TCP segment of a reassembled PDU]
317   0.029911 172.31.8.238 -> 54.239.132.90 TCP 78 [TCP Dup ACK 315#1] 55790 > http [ACK] Seq=97 Ack=2612651 Win=1580160 Len=0 TSval=15950154 TSecr=1584152478 SLE=2614099 SRE=2615547
318   0.029914 54.239.132.90 -> 172.31.8.238 TCP 1514 [TCP Out-Of-Order] [TCP segment of a reassembled PDU]
319   0.029916 172.31.8.238 -> 54.239.132.90 TCP 66 55790 > http [ACK] Seq=97 Ack=2615547 Win=1580160 Len=0 TSval=15950154 TSecr=1584152478
320   0.029978 54.239.132.90 -> 172.31.8.238 TCP 26130 [TCP segment of a reassembled PDU]
321   0.029984 172.31.8.238 -> 54.239.132.90 TCP 66 55790 > http [ACK] Seq=97 Ack=2641611 Win=1580160 Len=0 TSval=15950154 TSecr=1584152478
322   0.030187 54.239.132.90 -> 172.31.8.238 TCP 52194 [TCP segment of a reassembled PDU]
323   0.030197 172.31.8.238 -> 54.239.132.90 TCP 66 55790 > http [ACK] Seq=97 Ack=2693739 Win=1580160 Len=0 TSval=15950154 TSecr=1584152478
324   0.030254 54.239.132.90 -> 172.31.8.238 TCP 26130 [TCP segment of a reassembled PDU]
325   0.030260 172.31.8.238 -> 54.239.132.90 TCP 66 55790 > http [ACK] Seq=97 Ack=2719803 Win=1580160 Len=0 TSval=15950154 TSecr=1584152478
326   0.030313 54.239.132.90 -> 172.31.8.238 TCP 26130 [TCP segment of a reassembled PDU]
327   0.030319 172.31.8.238 -> 54.239.132.90 TCP 66 55790 > http [ACK] Seq=97 Ack=2745867 Win=1580160 Len=0 TSval=15950154 TSecr=1584152478
328   0.030478 54.239.132.90 -> 172.31.8.238 TCP 26130 [TCP segment of a reassembled PDU]
329   0.030498 172.31.8.238 -> 54.239.132.90 TCP 66 55790 > http [ACK] Seq=97 Ack=2771931 Win=1580160 Len=0 TSval=15950154 TSecr=1584152478
330   0.030574 54.239.132.90 -> 172.31.8.238 TCP 26130 [TCP segment of a reassembled PDU]
331   0.030580 172.31.8.238 -> 54.239.132.90 TCP 66 55790 > http [ACK] Seq=97 Ack=2797995 Win=1580160 Len=0 TSval=15950155 TSecr=1584152478
332   0.030646 54.239.132.90 -> 172.31.8.238 TCP 15994 [TCP segment of a reassembled PDU]
333   0.030652 172.31.8.238 -> 54.239.132.90 TCP 66 55790 > http [ACK] Seq=97 Ack=2813923 Win=1580160 Len=0 TSval=15950155 TSecr=1584152478
334   0.030702 54.239.132.90 -> 172.31.8.238 TCP 1514 [TCP segment of a reassembled PDU]
335   0.030705 172.31.8.238 -> 54.239.132.90 TCP 66 55790 > http [ACK] Seq=97 Ack=2815371 Win=1580160 Len=0 TSval=15950155 TSecr=1584152478
336   0.030968 54.239.132.90 -> 172.31.8.238 TCP 26130 [TCP segment of a reassembled PDU]
337   0.030976 172.31.8.238 -> 54.239.132.90 TCP 66 55790 > http [ACK] Seq=97 Ack=2841435 Win=1580160 Len=0 TSval=15950155 TSecr=1584152478
338   0.031034 54.239.132.90 -> 172.31.8.238 TCP 18890 [TCP segment of a reassembled PDU]
339   0.031041 172.31.8.238 -> 54.239.132.90 TCP 66 55790 > http [ACK] Seq=97 Ack=2860259 Win=1580160 Len=0 TSval=15950155 TSecr=1584152478
340   0.031123 54.239.132.90 -> 172.31.8.238 TCP 33370 [TCP segment of a reassembled PDU]
341   0.031132 172.31.8.238 -> 54.239.132.90 TCP 66 55790 > http [ACK] Seq=97 Ack=2893563 Win=1580160 Len=0 TSval=15950155 TSecr=1584152478
342   0.031212 54.239.132.90 -> 172.31.8.238 TCP 26130 [TCP segment of a reassembled PDU]
343   0.031218 172.31.8.238 -> 54.239.132.90 TCP 66 55790 > http [ACK] Seq=97 Ack=2919627 Win=1580160 Len=0 TSval=15950155 TSecr=1584152478
344   0.031284 54.239.132.90 -> 172.31.8.238 TCP 21786 [TCP segment of a reassembled PDU]
345   0.031290 172.31.8.238 -> 54.239.132.90 TCP 66 55790 > http [ACK] Seq=97 Ack=2941347 Win=1580160 Len=0 TSval=15950155 TSecr=1584152478
346   0.031343 54.239.132.90 -> 172.31.8.238 TCP 10202 [TCP segment of a reassembled PDU]
347   0.031347 172.31.8.238 -> 54.239.132.90 TCP 66 55790 > http [ACK] Seq=97 Ack=2951483 Win=1580160 Len=0 TSval=15950155 TSecr=1584152478
348   0.031395 54.239.132.90 -> 172.31.8.238 TCP 1514 [TCP Previous segment not captured] [TCP segment of a reassembled PDU]
