[Measurement for 1kb at 10:00:15 17.00.2014] 
Tshark:

  1   0.000000  192.168.1.2 -> 54.230.98.5  TCP 66 51989→80 [SYN] Seq=0 Win=8192 Len=0 MSS=1460 WS=256 SACK_PERM=1
  2   0.051185  54.230.98.5 -> 192.168.1.2  TCP 66 80→51989 [SYN, ACK] Seq=0 Ack=1 Win=14600 Len=0 MSS=1400 SACK_PERM=1 WS=128
  3   0.051343  192.168.1.2 -> 54.230.98.5  TCP 54 51989→80 [ACK] Seq=1 Ack=1 Win=65792 Len=0
  4   0.051513  192.168.1.2 -> 54.230.98.5  HTTP 150 GET /1kb HTTP/1.1 
  5   0.079778  54.230.98.5 -> 192.168.1.2  TCP 54 80→51989 [ACK] Seq=1 Ack=97 Win=14720 Len=0
  6   0.083337  54.230.98.5 -> 192.168.1.2  TCP 1454 [TCP segment of a reassembled PDU]
  7   0.083981  54.230.98.5 -> 192.168.1.2  HTTP 132 HTTP/1.1 200 OK  (application/octet-stream)
  8   0.084065  192.168.1.2 -> 54.230.98.5  TCP 54 51989→80 [ACK] Seq=97 Ack=1479 Win=65792 Len=0
  9   0.084159  192.168.1.2 -> 54.230.98.5  TCP 54 51989→80 [FIN, ACK] Seq=97 Ack=1479 Win=65792 Len=0
 10   0.112946  54.230.98.5 -> 192.168.1.2  TCP 54 80→51989 [FIN, ACK] Seq=1479 Ack=98 Win=14720 Len=0
 11   0.113098  192.168.1.2 -> 54.230.98.5  TCP 54 51989→80 [ACK] Seq=98 Ack=1480 Win=65792 Len=0
 12   1.381945 64.233.164.189 -> 192.168.1.2  TLSv1.2 105 Application Data
 13   1.432076  192.168.1.2 -> 64.233.164.189 TCP 54 51511→443 [ACK] Seq=1 Ack=52 Win=253 Len=0
 14   1.683794  192.168.1.2 -> 54.221.227.112 TLSv1.2 90 Application Data
