[Measurement for 1mb at 22:34:11 19.34.2014] 
Tshark:

  1   0.000000 172.31.36.109 -> 172.31.0.2   DNS 89 Standard query 0x25a9  A d3m1c4hwkgedal.cloudfront.net
  2   0.000028 172.31.36.109 -> 172.31.0.2   DNS 89 Standard query 0x594d  AAAA d3m1c4hwkgedal.cloudfront.net
  3   0.000550   172.31.0.2 -> 172.31.36.109 DNS 217 Standard query response 0x25a9  A 54.230.184.251 A 54.230.185.186 A 54.230.186.26 A 54.230.187.67 A 54.239.158.150 A 54.239.158.207 A 54.239.158.213 A 54.230.184.223
  4   0.000562   172.31.0.2 -> 172.31.36.109 DNS 174 Standard query response 0x594d 
  5   0.003865 172.31.36.109 -> 54.230.184.251 TCP 74 54726 > http [SYN] Seq=0 Win=26883 Len=0 MSS=8961 SACK_PERM=1 TSval=25034386 TSecr=0 WS=128
  6   0.021802 54.230.184.251 -> 172.31.36.109 TCP 74 http > 54726 [SYN, ACK] Seq=0 Ack=1 Win=14480 Len=0 MSS=1460 SACK_PERM=1 TSval=1394583840 TSecr=25034386 WS=128
  7   0.021836 172.31.36.109 -> 54.230.184.251 TCP 66 54726 > http [ACK] Seq=1 Ack=1 Win=27008 Len=0 TSval=25034391 TSecr=1394583840
  8   0.021880 172.31.36.109 -> 54.230.184.251 HTTP 162 GET /1mb HTTP/1.1 
  9   0.040250 54.230.184.251 -> 172.31.36.109 TCP 66 http > 54726 [ACK] Seq=1 Ack=97 Win=14592 Len=0 TSval=1394583842 TSecr=25034391
 10   0.362369 54.230.184.251 -> 172.31.36.109 TCP 13181 [TCP segment of a reassembled PDU]
 11   0.362395 172.31.36.109 -> 54.230.184.251 TCP 66 54726 > http [ACK] Seq=97 Ack=13116 Win=53120 Len=0 TSval=25034476 TSecr=1394583874
 12   0.380542 54.230.184.251 -> 172.31.36.109 TCP 13098 [TCP segment of a reassembled PDU]
 13   0.380552 172.31.36.109 -> 54.230.184.251 TCP 66 54726 > http [ACK] Seq=97 Ack=26148 Win=79232 Len=0 TSval=25034481 TSecr=1394583876
 14   0.398664 54.230.184.251 -> 172.31.36.109 TCP 13098 [TCP segment of a reassembled PDU]
 15   0.398674 172.31.36.109 -> 54.230.184.251 TCP 66 54726 > http [ACK] Seq=97 Ack=39180 Win=96512 Len=0 TSval=25034485 TSecr=1394583878
 16   0.416891 54.230.184.251 -> 172.31.36.109 TCP 10202 [TCP segment of a reassembled PDU]
 17   0.416900 172.31.36.109 -> 54.230.184.251 TCP 66 54726 > http [ACK] Seq=97 Ack=49316 Win=101248 Len=0 TSval=25034490 TSecr=1394583880
 18   0.417001 54.230.184.251 -> 172.31.36.109 TCP 2962 [TCP segment of a reassembled PDU]
 19   0.417006 172.31.36.109 -> 54.230.184.251 TCP 66 54726 > http [ACK] Seq=97 Ack=52212 Win=98432 Len=0 TSval=25034490 TSecr=1394583880
 20   0.435036 54.230.184.251 -> 172.31.36.109 TCP 18890 [TCP segment of a reassembled PDU]
 21   0.435049 172.31.36.109 -> 54.230.184.251 TCP 66 54726 > http [ACK] Seq=97 Ack=71036 Win=142976 Len=0 TSval=25034494 TSecr=1394583882
 22   0.435193 54.230.184.251 -> 172.31.36.109 TCP 2962 [TCP segment of a reassembled PDU]
 23   0.435198 172.31.36.109 -> 54.230.184.251 TCP 66 54726 > http [ACK] Seq=97 Ack=73932 Win=148736 Len=0 TSval=25034494 TSecr=1394583882
 24   0.453213 54.230.184.251 -> 172.31.36.109 TCP 1126 [TCP segment of a reassembled PDU]
 25   0.453218 172.31.36.109 -> 54.230.184.251 TCP 66 54726 > http [ACK] Seq=97 Ack=74992 Win=151680 Len=0 TSval=25034499 TSecr=1394583883
 26   0.630638 54.230.184.251 -> 172.31.36.109 TCP 1514 [TCP segment of a reassembled PDU]
 27   0.630663 172.31.36.109 -> 54.230.184.251 TCP 66 54726 > http [ACK] Seq=97 Ack=76440 Win=154496 Len=0 TSval=25034543 TSecr=1394583901
 28   0.630676 54.230.184.251 -> 172.31.36.109 TCP 1538 [TCP segment of a reassembled PDU]
 29   0.630679 172.31.36.109 -> 54.230.184.251 TCP 66 54726 > http [ACK] Seq=97 Ack=77912 Win=157440 Len=0 TSval=25034543 TSecr=1394583901
 30   0.630903 54.230.184.251 -> 172.31.36.109 TCP 1526 [TCP segment of a reassembled PDU]
 31   0.630909 172.31.36.109 -> 54.230.184.251 TCP 66 54726 > http [ACK] Seq=97 Ack=79372 Win=160384 Len=0 TSval=25034543 TSecr=1394583901
 32   0.630914 54.230.184.251 -> 172.31.36.109 TCP 1514 [TCP segment of a reassembled PDU]
 33   0.630917 172.31.36.109 -> 54.230.184.251 TCP 66 54726 > http [ACK] Seq=97 Ack=80820 Win=163328 Len=0 TSval=25034543 TSecr=1394583901
 34   0.630920 54.230.184.251 -> 172.31.36.109 TCP 2998 [TCP segment of a reassembled PDU]
 35   0.630923 172.31.36.109 -> 54.230.184.251 TCP 66 54726 > http [ACK] Seq=97 Ack=83752 Win=169216 Len=0 TSval=25034543 TSecr=1394583901
 36   0.631140 54.230.184.251 -> 172.31.36.109 TCP 7366 [TCP segment of a reassembled PDU]
 37   0.631147 172.31.36.109 -> 54.230.184.251 TCP 66 54726 > http [ACK] Seq=97 Ack=91052 Win=183808 Len=0 TSval=25034543 TSecr=1394583901
 38   0.648468 54.230.184.251 -> 172.31.36.109 TCP 4410 [TCP segment of a reassembled PDU]
 39   0.648475 172.31.36.109 -> 54.230.184.251 TCP 66 54726 > http [ACK] Seq=97 Ack=95396 Win=192512 Len=0 TSval=25034548 TSecr=1394583903
 40   0.648711 54.230.184.251 -> 172.31.36.109 TCP 2962 [TCP segment of a reassembled PDU]
 41   0.648717 172.31.36.109 -> 54.230.184.251 TCP 66 54726 > http [ACK] Seq=97 Ack=98292 Win=198272 Len=0 TSval=25034548 TSecr=1394583903
 42   0.648953 54.230.184.251 -> 172.31.36.109 TCP 2962 [TCP segment of a reassembled PDU]
 43   0.648959 172.31.36.109 -> 54.230.184.251 TCP 66 54726 > http [ACK] Seq=97 Ack=101188 Win=204032 Len=0 TSval=25034548 TSecr=1394583903
 44   0.649038 54.230.184.251 -> 172.31.36.109 TCP 1610 [TCP segment of a reassembled PDU]
 45   0.649043 172.31.36.109 -> 54.230.184.251 TCP 66 54726 > http [ACK] Seq=97 Ack=102732 Win=207104 Len=0 TSval=25034548 TSecr=1394583903
 46   0.870784 54.230.184.251 -> 172.31.36.109 TCP 1514 [TCP segment of a reassembled PDU]
 47   0.870808 172.31.36.109 -> 54.230.184.251 TCP 66 54726 > http [ACK] Seq=97 Ack=104180 Win=210048 Len=0 TSval=25034603 TSecr=1394583925
 48   0.871450 54.230.184.251 -> 172.31.36.109 TCP 78 [TCP segment of a reassembled PDU]
 49   0.871455 172.31.36.109 -> 54.230.184.251 TCP 66 54726 > http [ACK] Seq=97 Ack=104192 Win=210048 Len=0 TSval=25034603 TSecr=1394583925
 50   0.900477 54.230.184.251 -> 172.31.36.109 TCP 4410 [TCP segment of a reassembled PDU]
 51   0.900494 172.31.36.109 -> 54.230.184.251 TCP 66 54726 > http [ACK] Seq=97 Ack=108536 Win=218752 Len=0 TSval=25034611 TSecr=1394583928
 52   0.900676 54.230.184.251 -> 172.31.36.109 TCP 3022 [TCP segment of a reassembled PDU]
 53   0.900681 172.31.36.109 -> 54.230.184.251 TCP 66 54726 > http [ACK] Seq=97 Ack=111492 Win=224640 Len=0 TSval=25034611 TSecr=1394583928
 54   0.900686 54.230.184.251 -> 172.31.36.109 TCP 1514 [TCP segment of a reassembled PDU]
 55   0.900689 172.31.36.109 -> 54.230.184.251 TCP 66 54726 > http [ACK] Seq=97 Ack=112940 Win=227456 Len=0 TSval=25034611 TSecr=1394583928
 56   0.900925 54.230.184.251 -> 172.31.36.109 TCP 4410 [TCP segment of a reassembled PDU]
 57   0.900931 172.31.36.109 -> 54.230.184.251 TCP 66 54726 > http [ACK] Seq=97 Ack=117284 Win=236160 Len=0 TSval=25034611 TSecr=1394583928
 58   0.900939 54.230.184.251 -> 172.31.36.109 TCP 2962 [TCP segment of a reassembled PDU]
 59   0.900943 172.31.36.109 -> 54.230.184.251 TCP 66 54726 > http [ACK] Seq=97 Ack=120180 Win=242048 Len=0 TSval=25034611 TSecr=1394583928
 60   0.901179 54.230.184.251 -> 172.31.36.109 TCP 3058 [TCP segment of a reassembled PDU]
 61   0.901184 172.31.36.109 -> 54.230.184.251 TCP 66 54726 > http [ACK] Seq=97 Ack=123172 Win=247936 Len=0 TSval=25034611 TSecr=1394583928
 62   0.918656 54.230.184.251 -> 172.31.36.109 TCP 10286 [TCP segment of a reassembled PDU]
 63   0.918671 172.31.36.109 -> 54.230.184.251 TCP 66 54726 > http [ACK] Seq=97 Ack=133392 Win=268416 Len=0 TSval=25034615 TSecr=1394583930
 64   1.140352 54.230.184.251 -> 172.31.36.109 TCP 1526 [TCP segment of a reassembled PDU]
 65   1.140376 172.31.36.109 -> 54.230.184.251 TCP 66 54726 > http [ACK] Seq=97 Ack=134852 Win=271360 Len=0 TSval=25034670 TSecr=1394583952
 66   1.140401 54.230.184.251 -> 172.31.36.109 TCP 4446 [TCP segment of a reassembled PDU]
 67   1.140409 172.31.36.109 -> 54.230.184.251 TCP 66 54726 > http [ACK] Seq=97 Ack=139232 Win=280064 Len=0 TSval=25034670 TSecr=1394583952
