[Measurement for 1mb at 17:37:27 19.37.2014] 
Tshark:

  1   0.000000 172.31.36.109 -> 172.31.0.2   DNS 89 Standard query 0xc086  A d3m1c4hwkgedal.cloudfront.net
  2   0.000035 172.31.36.109 -> 172.31.0.2   DNS 89 Standard query 0x507e  AAAA d3m1c4hwkgedal.cloudfront.net
  3   0.000485   172.31.0.2 -> 172.31.36.109 DNS 217 Standard query response 0xc086  A 54.230.30.204 A 54.230.30.230 A 54.192.29.229 A 54.192.30.135 A 54.192.30.192 A 54.230.30.37 A 54.230.30.69 A 54.230.30.70
  4   0.000497   172.31.0.2 -> 172.31.36.109 DNS 174 Standard query response 0x507e 
  5   0.001317 172.31.36.109 -> 54.230.30.204 TCP 74 34784 > http [SYN] Seq=0 Win=26883 Len=0 MSS=8961 SACK_PERM=1 TSval=20583456 TSecr=0 WS=128
  6   0.002645 54.230.30.204 -> 172.31.36.109 TCP 74 http > 34784 [SYN, ACK] Seq=0 Ack=1 Win=14480 Len=0 MSS=1460 SACK_PERM=1 TSval=649369472 TSecr=20583456 WS=128
  7   0.002660 172.31.36.109 -> 54.230.30.204 TCP 66 34784 > http [ACK] Seq=1 Ack=1 Win=27008 Len=0 TSval=20583456 TSecr=649369472
  8   0.002713 172.31.36.109 -> 54.230.30.204 HTTP 162 GET /1mb HTTP/1.1 
  9   0.003715 54.230.30.204 -> 172.31.36.109 TCP 66 http > 34784 [ACK] Seq=1 Ack=97 Win=14592 Len=0 TSval=649369472 TSecr=20583456
 10   0.616638 54.230.30.204 -> 172.31.36.109 TCP 4410 [TCP segment of a reassembled PDU]
