[Measurement for 1mb at 06:34:01 20.34.2014] 
Tshark:

  1   0.000000 172.31.36.109 -> 172.31.0.2   DNS 89 Standard query 0x0fe7  A d3m1c4hwkgedal.cloudfront.net
  2   0.000028 172.31.36.109 -> 172.31.0.2   DNS 89 Standard query 0x1db6  AAAA d3m1c4hwkgedal.cloudfront.net
  3   0.000462   172.31.0.2 -> 172.31.36.109 DNS 217 Standard query response 0x0fe7  A 54.230.30.37 A 54.230.30.53 A 54.230.30.210 A 54.230.30.242 A 54.192.30.139 A 54.192.30.227 A 54.230.30.2 A 54.230.30.8
  4   0.000472   172.31.0.2 -> 172.31.36.109 DNS 174 Standard query response 0x1db6 
  5   0.003893 172.31.36.109 -> 54.230.30.37 TCP 74 34681 > http [SYN] Seq=0 Win=26883 Len=0 MSS=8961 SACK_PERM=1 TSval=32232023 TSecr=0 WS=128
  6   0.005105 54.230.30.37 -> 172.31.36.109 TCP 74 http > 34681 [SYN, ACK] Seq=0 Ack=1 Win=14480 Len=0 MSS=1460 SACK_PERM=1 TSval=668191700 TSecr=32232023 WS=128
  7   0.005120 172.31.36.109 -> 54.230.30.37 TCP 66 34681 > http [ACK] Seq=1 Ack=1 Win=27008 Len=0 TSval=32232024 TSecr=668191700
  8   0.005162 172.31.36.109 -> 54.230.30.37 HTTP 162 GET /1mb HTTP/1.1 
  9   0.006392 54.230.30.37 -> 172.31.36.109 TCP 66 http > 34681 [ACK] Seq=1 Ack=97 Win=14592 Len=0 TSval=668191700 TSecr=32232024
 10   0.022847 54.230.30.37 -> 172.31.36.109 TCP 13098 [TCP segment of a reassembled PDU]
 11   0.022860 172.31.36.109 -> 54.230.30.37 TCP 66 34681 > http [ACK] Seq=97 Ack=13033 Win=52992 Len=0 TSval=32232028 TSecr=668191702
 12   0.023886 54.230.30.37 -> 172.31.36.109 TCP 10202 [TCP segment of a reassembled PDU]
 13   0.023895 172.31.36.109 -> 54.230.30.37 TCP 66 34681 > http [ACK] Seq=97 Ack=23169 Win=73344 Len=0 TSval=32232028 TSecr=668191702
 14   0.024061 54.230.30.37 -> 172.31.36.109 TCP 2962 [TCP segment of a reassembled PDU]
 15   0.024067 172.31.36.109 -> 54.230.30.37 TCP 66 34681 > http [ACK] Seq=97 Ack=26065 Win=79104 Len=0 TSval=32232028 TSecr=668191702
 16   0.024873 54.230.30.37 -> 172.31.36.109 TCP 8754 [TCP segment of a reassembled PDU]
 17   0.024880 172.31.36.109 -> 54.230.30.37 TCP 66 34681 > http [ACK] Seq=97 Ack=34753 Win=96512 Len=0 TSval=32232029 TSecr=668191702
 18   0.025076 54.230.30.37 -> 172.31.36.109 TCP 4410 [TCP segment of a reassembled PDU]
 19   0.025082 172.31.36.109 -> 54.230.30.37 TCP 66 34681 > http [ACK] Seq=97 Ack=39097 Win=105088 Len=0 TSval=32232029 TSecr=668191702
 20   0.025849 54.230.30.37 -> 172.31.36.109 TCP 1514 [TCP segment of a reassembled PDU]
 21   0.025854 172.31.36.109 -> 54.230.30.37 TCP 66 34681 > http [ACK] Seq=97 Ack=40545 Win=108032 Len=0 TSval=32232029 TSecr=668191702
 22   0.025930 54.230.30.37 -> 172.31.36.109 TCP 10202 [TCP segment of a reassembled PDU]
 23   0.025938 172.31.36.109 -> 54.230.30.37 TCP 66 34681 > http [ACK] Seq=97 Ack=50681 Win=128256 Len=0 TSval=32232029 TSecr=668191702
 24   0.026131 54.230.30.37 -> 172.31.36.109 TCP 1514 [TCP segment of a reassembled PDU]
 25   0.026135 172.31.36.109 -> 54.230.30.37 TCP 66 34681 > http [ACK] Seq=97 Ack=52129 Win=131200 Len=0 TSval=32232029 TSecr=668191702
 26   0.026146 54.230.30.37 -> 172.31.36.109 TCP 5858 [TCP segment of a reassembled PDU]
 27   0.026151 172.31.36.109 -> 54.230.30.37 TCP 66 34681 > http [ACK] Seq=97 Ack=57921 Win=142848 Len=0 TSval=32232029 TSecr=668191702
 28   0.026367 54.230.30.37 -> 172.31.36.109 TCP 2962 [TCP segment of a reassembled PDU]
 29   0.026372 172.31.36.109 -> 54.230.30.37 TCP 66 34681 > http [ACK] Seq=97 Ack=60817 Win=148608 Len=0 TSval=32232029 TSecr=668191702
 30   0.026884 54.230.30.37 -> 172.31.36.109 TCP 1514 [TCP segment of a reassembled PDU]
 31   0.026889 172.31.36.109 -> 54.230.30.37 TCP 66 34681 > http [ACK] Seq=97 Ack=62265 Win=151424 Len=0 TSval=32232029 TSecr=668191702
 32   0.027143 54.230.30.37 -> 172.31.36.109 TCP 3095 [TCP segment of a reassembled PDU]
 33   0.027149 172.31.36.109 -> 54.230.30.37 TCP 66 34681 > http [ACK] Seq=97 Ack=65294 Win=157568 Len=0 TSval=32232029 TSecr=668191702
 34   0.033797 54.230.30.37 -> 172.31.36.109 TCP 1514 [TCP segment of a reassembled PDU]
 35   0.033804 172.31.36.109 -> 54.230.30.37 TCP 66 34681 > http [ACK] Seq=97 Ack=66742 Win=160384 Len=0 TSval=32232031 TSecr=668191703
 36   0.034040 54.230.30.37 -> 172.31.36.109 TCP 1514 [TCP segment of a reassembled PDU]
 37   0.034045 172.31.36.109 -> 54.230.30.37 TCP 66 34681 > http [ACK] Seq=97 Ack=68190 Win=163328 Len=0 TSval=32232031 TSecr=668191703
 38   0.034166 54.230.30.37 -> 172.31.36.109 TCP 20338 [TCP segment of a reassembled PDU]
 39   0.034177 172.31.36.109 -> 54.230.30.37 TCP 66 34681 > http [ACK] Seq=97 Ack=88462 Win=164864 Len=0 TSval=32232031 TSecr=668191703
 40   0.035073 54.230.30.37 -> 172.31.36.109 TCP 2962 [TCP segment of a reassembled PDU]
 41   0.035079 172.31.36.109 -> 54.230.30.37 TCP 66 34681 > http [ACK] Seq=97 Ack=91358 Win=193408 Len=0 TSval=32232031 TSecr=668191703
 42   0.035164 54.230.30.37 -> 172.31.36.109 TCP 5858 [TCP segment of a reassembled PDU]
 43   0.035171 172.31.36.109 -> 54.230.30.37 TCP 66 34681 > http [ACK] Seq=97 Ack=97150 Win=188672 Len=0 TSval=32232031 TSecr=668191703
 44   0.035318 54.230.30.37 -> 172.31.36.109 TCP 2962 [TCP segment of a reassembled PDU]
 45   0.035324 172.31.36.109 -> 54.230.30.37 TCP 66 34681 > http [ACK] Seq=97 Ack=100046 Win=193408 Len=0 TSval=32232031 TSecr=668191703
 46   0.035434 54.230.30.37 -> 172.31.36.109 TCP 17442 [TCP segment of a reassembled PDU]
 47   0.035445 172.31.36.109 -> 54.230.30.37 TCP 66 34681 > http [ACK] Seq=97 Ack=117422 Win=176128 Len=0 TSval=32232031 TSecr=668191703
 48   0.036101 54.230.30.37 -> 172.31.36.109 TCP 7306 [TCP segment of a reassembled PDU]
 49   0.036109 172.31.36.109 -> 54.230.30.37 TCP 66 34681 > http [ACK] Seq=97 Ack=124662 Win=186368 Len=0 TSval=32232031 TSecr=668191703
 50   0.036426 54.230.30.37 -> 172.31.36.109 TCP 15994 [TCP segment of a reassembled PDU]
 51   0.036437 172.31.36.109 -> 54.230.30.37 TCP 66 34681 > http [ACK] Seq=97 Ack=140590 Win=172032 Len=0 TSval=32232031 TSecr=668191703
 52   0.036603 54.230.30.37 -> 172.31.36.109 TCP 2962 [TCP segment of a reassembled PDU]
 53   0.036608 172.31.36.109 -> 54.230.30.37 TCP 66 34681 > http [ACK] Seq=97 Ack=143486 Win=193408 Len=0 TSval=32232032 TSecr=668191703
 54   0.036723 54.230.30.37 -> 172.31.36.109 TCP 8754 [TCP segment of a reassembled PDU]
 55   0.036730 172.31.36.109 -> 54.230.30.37 TCP 66 34681 > http [ACK] Seq=97 Ack=152174 Win=215680 Len=0 TSval=32232032 TSecr=668191703
 56   0.037384 54.230.30.37 -> 172.31.36.109 TCP 4410 [TCP segment of a reassembled PDU]
 57   0.037390 172.31.36.109 -> 54.230.30.37 TCP 66 34681 > http [ACK] Seq=97 Ack=156518 Win=224384 Len=0 TSval=32232032 TSecr=668191703
 58   0.037503 54.230.30.37 -> 172.31.36.109 TCP 7306 [TCP segment of a reassembled PDU]
 59   0.037510 172.31.36.109 -> 54.230.30.37 TCP 66 34681 > http [ACK] Seq=97 Ack=163758 Win=238848 Len=0 TSval=32232032 TSecr=668191703
 60   0.037597 54.230.30.37 -> 172.31.36.109 TCP 1514 [TCP segment of a reassembled PDU]
 61   0.037602 172.31.36.109 -> 54.230.30.37 TCP 66 34681 > http [ACK] Seq=97 Ack=165206 Win=241664 Len=0 TSval=32232032 TSecr=668191703
 62   0.037766 54.230.30.37 -> 172.31.36.109 TCP 13098 [TCP segment of a reassembled PDU]
 63   0.037773 172.31.36.109 -> 54.230.30.37 TCP 66 34681 > http [ACK] Seq=97 Ack=178238 Win=267776 Len=0 TSval=32232032 TSecr=668191703
 64   0.037783 54.230.30.37 -> 172.31.36.109 TCP 4410 [TCP segment of a reassembled PDU]
 65   0.037787 172.31.36.109 -> 54.230.30.37 TCP 66 34681 > http [ACK] Seq=97 Ack=182582 Win=276480 Len=0 TSval=32232032 TSecr=668191703
 66   0.038406 54.230.30.37 -> 172.31.36.109 TCP 5858 [TCP segment of a reassembled PDU]
 67   0.038413 172.31.36.109 -> 54.230.30.37 TCP 66 34681 > http [ACK] Seq=97 Ack=188374 Win=288000 Len=0 TSval=32232032 TSecr=668191703
 68   0.038504 54.230.30.37 -> 172.31.36.109 TCP 4410 [TCP segment of a reassembled PDU]
 69   0.038510 172.31.36.109 -> 54.230.30.37 TCP 66 34681 > http [ACK] Seq=97 Ack=192718 Win=296704 Len=0 TSval=32232032 TSecr=668191703
 70   0.038732 54.230.30.37 -> 172.31.36.109 TCP 5858 [TCP segment of a reassembled PDU]
 71   0.038738 172.31.36.109 -> 54.230.30.37 TCP 66 34681 > http [ACK] Seq=97 Ack=198510 Win=308352 Len=0 TSval=32232032 TSecr=668191703
 72   0.039150 54.230.30.37 -> 172.31.36.109 TCP 2962 [TCP segment of a reassembled PDU]
 73   0.039155 172.31.36.109 -> 54.230.30.37 TCP 66 34681 > http [ACK] Seq=97 Ack=201406 Win=314112 Len=0 TSval=32232032 TSecr=668191704
 74   0.039312 54.230.30.37 -> 172.31.36.109 TCP 23234 [TCP segment of a reassembled PDU]
 75   0.039325 172.31.36.109 -> 54.230.30.37 TCP 66 34681 > http [ACK] Seq=97 Ack=224574 Win=360448 Len=0 TSval=32232032 TSecr=668191704
 76   0.039424 54.230.30.37 -> 172.31.36.109 TCP 4410 [TCP segment of a reassembled PDU]
 77   0.039430 172.31.36.109 -> 54.230.30.37 TCP 66 34681 > http [ACK] Seq=97 Ack=228918 Win=369152 Len=0 TSval=32232032 TSecr=668191704
 78   0.039530 54.230.30.37 -> 172.31.36.109 TCP 1514 [TCP segment of a reassembled PDU]
 79   0.039535 172.31.36.109 -> 54.230.30.37 TCP 66 34681 > http [ACK] Seq=97 Ack=230366 Win=371968 Len=0 TSval=32232032 TSecr=668191704
 80   0.039789 54.230.30.37 -> 172.31.36.109 TCP 17442 [TCP segment of a reassembled PDU]
 81   0.039798 172.31.36.109 -> 54.230.30.37 TCP 66 34681 > http [ACK] Seq=97 Ack=247742 Win=406784 Len=0 TSval=32232032 TSecr=668191704
 82   0.040475 54.230.30.37 -> 172.31.36.109 TCP 10202 [TCP segment of a reassembled PDU]
 83   0.040485 172.31.36.109 -> 54.230.30.37 TCP 66 34681 > http [ACK] Seq=97 Ack=257878 Win=427008 Len=0 TSval=32232033 TSecr=668191704
 84   0.040804 54.230.30.37 -> 172.31.36.109 TCP 24682 [TCP segment of a reassembled PDU]
 85   0.040818 172.31.36.109 -> 54.230.30.37 TCP 66 34681 > http [ACK] Seq=97 Ack=282494 Win=476288 Len=0 TSval=32232033 TSecr=668191704
 86   0.040885 54.230.30.37 -> 172.31.36.109 TCP 11650 [TCP segment of a reassembled PDU]
 87   0.040893 172.31.36.109 -> 54.230.30.37 TCP 66 34681 > http [ACK] Seq=97 Ack=294078 Win=499456 Len=0 TSval=32232033 TSecr=668191704
 88   0.040992 54.230.30.37 -> 172.31.36.109 TCP 13098 [TCP segment of a reassembled PDU]
 89   0.041001 172.31.36.109 -> 54.230.30.37 TCP 66 34681 > http [ACK] Seq=97 Ack=307110 Win=525568 Len=0 TSval=32232033 TSecr=668191704
 90   0.041513 54.230.30.37 -> 172.31.36.109 TCP 4410 [TCP segment of a reassembled PDU]
 91   0.041519 172.31.36.109 -> 54.230.30.37 TCP 66 34681 > http [ACK] Seq=97 Ack=311454 Win=534144 Len=0 TSval=32232033 TSecr=668191704
 92   0.041574 54.230.30.37 -> 172.31.36.109 TCP 1514 [TCP segment of a reassembled PDU]
 93   0.041579 172.31.36.109 -> 54.230.30.37 TCP 66 34681 > http [ACK] Seq=97 Ack=312902 Win=537088 Len=0 TSval=32232033 TSecr=668191704
 94   0.041972 54.230.30.37 -> 172.31.36.109 TCP 1514 [TCP segment of a reassembled PDU]
 95   0.041977 172.31.36.109 -> 54.230.30.37 TCP 66 34681 > http [ACK] Seq=97 Ack=314350 Win=540032 Len=0 TSval=32232033 TSecr=668191704
 96   0.042057 54.230.30.37 -> 172.31.36.109 TCP 1514 [TCP segment of a reassembled PDU]
 97   0.042061 172.31.36.109 -> 54.230.30.37 TCP 66 34681 > http [ACK] Seq=97 Ack=315798 Win=542848 Len=0 TSval=32232033 TSecr=668191704
 98   0.042239 54.230.30.37 -> 172.31.36.109 TCP 2962 [TCP segment of a reassembled PDU]
 99   0.042244 172.31.36.109 -> 54.230.30.37 TCP 66 34681 > http [ACK] Seq=97 Ack=318694 Win=548736 Len=0 TSval=32232033 TSecr=668191704
100   0.042343 54.230.30.37 -> 172.31.36.109 TCP 8810 [TCP segment of a reassembled PDU]
101   0.042351 172.31.36.109 -> 54.230.30.37 TCP 66 34681 > http [ACK] Seq=97 Ack=327438 Win=566144 Len=0 TSval=32232033 TSecr=668191704
102   0.058614 54.230.30.37 -> 172.31.36.109 TCP 1514 [TCP segment of a reassembled PDU]
103   0.058619 172.31.36.109 -> 54.230.30.37 TCP 66 34681 > http [ACK] Seq=97 Ack=328886 Win=569088 Len=0 TSval=32232037 TSecr=668191705
104   0.058869 54.230.30.37 -> 172.31.36.109 TCP 2962 [TCP segment of a reassembled PDU]
105   0.058874 172.31.36.109 -> 54.230.30.37 TCP 66 34681 > http [ACK] Seq=97 Ack=331782 Win=574848 Len=0 TSval=32232037 TSecr=668191706
106   0.058981 54.230.30.37 -> 172.31.36.109 TCP 15994 [TCP segment of a reassembled PDU]
107   0.059006 172.31.36.109 -> 54.230.30.37 TCP 66 34681 > http [ACK] Seq=97 Ack=347710 Win=574848 Len=0 TSval=32232037 TSecr=668191706
108   0.059073 54.230.30.37 -> 172.31.36.109 TCP 7306 [TCP segment of a reassembled PDU]
109   0.059080 172.31.36.109 -> 54.230.30.37 TCP 66 34681 > http [ACK] Seq=97 Ack=354950 Win=582784 Len=0 TSval=32232037 TSecr=668191706
110   0.059090 54.230.30.37 -> 172.31.36.109 TCP 10202 [TCP segment of a reassembled PDU]
111   0.059233 54.230.30.37 -> 172.31.36.109 TCP 20338 [TCP segment of a reassembled PDU]
112   0.059347 172.31.36.109 -> 54.230.30.37 TCP 66 34681 > http [ACK] Seq=97 Ack=385358 Win=552448 Len=0 TSval=32232037 TSecr=668191706
113   0.059394 54.230.30.37 -> 172.31.36.109 TCP 1514 [TCP segment of a reassembled PDU]
114   0.059400 172.31.36.109 -> 54.230.30.37 TCP 66 34681 > http [ACK] Seq=97 Ack=386806 Win=592256 Len=0 TSval=32232037 TSecr=668191706
115   0.060164 54.230.30.37 -> 172.31.36.109 TCP 4410 [TCP segment of a reassembled PDU]
116   0.060180 172.31.36.109 -> 54.230.30.37 TCP 66 34681 > http [ACK] Seq=97 Ack=391150 Win=592256 Len=0 TSval=32232037 TSecr=668191706
117   0.060236 54.230.30.37 -> 172.31.36.109 TCP 1890 [TCP segment of a reassembled PDU]
118   0.060252 172.31.36.109 -> 54.230.30.37 TCP 66 34681 > http [ACK] Seq=97 Ack=392974 Win=592256 Len=0 TSval=32232037 TSecr=668191706
119   0.063732 54.230.30.37 -> 172.31.36.109 TCP 1514 [TCP segment of a reassembled PDU]
120   0.063737 172.31.36.109 -> 54.230.30.37 TCP 66 34681 > http [ACK] Seq=97 Ack=394422 Win=592256 Len=0 TSval=32232038 TSecr=668191706
121   0.063984 54.230.30.37 -> 172.31.36.109 TCP 1514 [TCP segment of a reassembled PDU]
122   0.064091 54.230.30.37 -> 172.31.36.109 TCP 13098 [TCP segment of a reassembled PDU]
123   0.064110 172.31.36.109 -> 54.230.30.37 TCP 66 34681 > http [ACK] Seq=97 Ack=408902 Win=593408 Len=0 TSval=32232038 TSecr=668191706
124   0.064190 54.230.30.37 -> 172.31.36.109 TCP 10202 [TCP segment of a reassembled PDU]
125   0.064200 54.230.30.37 -> 172.31.36.109 TCP 5858 [TCP segment of a reassembled PDU]
126   0.064220 172.31.36.109 -> 54.230.30.37 TCP 66 34681 > http [ACK] Seq=97 Ack=424830 Win=593408 Len=0 TSval=32232038 TSecr=668191706
127   0.064310 54.230.30.37 -> 172.31.36.109 TCP 10202 [TCP segment of a reassembled PDU]
128   0.064333 172.31.36.109 -> 54.230.30.37 TCP 66 34681 > http [ACK] Seq=97 Ack=434966 Win=593408 Len=0 TSval=32232038 TSecr=668191706
129   0.064574 54.230.30.37 -> 172.31.36.109 TCP 11650 [TCP segment of a reassembled PDU]
130   0.064597 172.31.36.109 -> 54.230.30.37 TCP 66 34681 > http [ACK] Seq=97 Ack=446550 Win=593408 Len=0 TSval=32232039 TSecr=668191706
131   0.065276 54.230.30.37 -> 172.31.36.109 TCP 2962 [TCP segment of a reassembled PDU]
132   0.065293 172.31.36.109 -> 54.230.30.37 TCP 66 34681 > http [ACK] Seq=97 Ack=449446 Win=593408 Len=0 TSval=32232039 TSecr=668191706
133   0.065427 54.230.30.37 -> 172.31.36.109 TCP 26130 [TCP segment of a reassembled PDU]
134   0.065454 172.31.36.109 -> 54.230.30.37 TCP 66 34681 > http [ACK] Seq=97 Ack=475510 Win=567424 Len=0 TSval=32232039 TSecr=668191706
135   0.065609 54.230.30.37 -> 172.31.36.109 TCP 20338 [TCP segment of a reassembled PDU]
136   0.065669 54.230.30.37 -> 172.31.36.109 TCP 2962 [TCP segment of a reassembled PDU]
137   0.065794 54.230.30.37 -> 172.31.36.109 TCP 2962 [TCP segment of a reassembled PDU]
138   0.065838 172.31.36.109 -> 54.230.30.37 TCP 66 34681 > http [ACK] Seq=97 Ack=501574 Win=551808 Len=0 TSval=32232039 TSecr=668191706
139   0.065940 54.230.30.37 -> 172.31.36.109 TCP 20338 [TCP segment of a reassembled PDU]
140   0.065952 172.31.36.109 -> 54.230.30.37 TCP 66 34681 > http [ACK] Seq=97 Ack=521846 Win=561408 Len=0 TSval=32232039 TSecr=668191706
141   0.066116 54.230.30.37 -> 172.31.36.109 TCP 1514 [TCP segment of a reassembled PDU]
142   0.066564 54.230.30.37 -> 172.31.36.109 TCP 1514 [TCP segment of a reassembled PDU]
143   0.066569 172.31.36.109 -> 54.230.30.37 TCP 66 34681 > http [ACK] Seq=97 Ack=524742 Win=592256 Len=0 TSval=32232039 TSecr=668191706
144   0.066683 54.230.30.37 -> 172.31.36.109 TCP 11650 [TCP segment of a reassembled PDU]
145   0.066702 172.31.36.109 -> 54.230.30.37 TCP 66 34681 > http [ACK] Seq=97 Ack=536326 Win=593408 Len=0 TSval=32232039 TSecr=668191706
146   0.066796 54.230.30.37 -> 172.31.36.109 TCP 2962 [TCP segment of a reassembled PDU]
147   0.066812 172.31.36.109 -> 54.230.30.37 TCP 66 34681 > http [ACK] Seq=97 Ack=539222 Win=593408 Len=0 TSval=32232039 TSecr=668191706
148   0.066931 54.230.30.37 -> 172.31.36.109 TCP 18890 [TCP segment of a reassembled PDU]
149   0.066957 172.31.36.109 -> 54.230.30.37 TCP 66 34681 > http [ACK] Seq=97 Ack=558046 Win=574592 Len=0 TSval=32232039 TSecr=668191706
150   0.066965 54.230.30.37 -> 172.31.36.109 TCP 4410 [TCP segment of a reassembled PDU]
151   0.066983 172.31.36.109 -> 54.230.30.37 TCP 66 34681 > http [ACK] Seq=97 Ack=562390 Win=593408 Len=0 TSval=32232039 TSecr=668191706
152   0.067102 54.230.30.37 -> 172.31.36.109 TCP 10202 [TCP segment of a reassembled PDU]
153   0.067121 172.31.36.109 -> 54.230.30.37 TCP 66 34681 > http [ACK] Seq=97 Ack=572526 Win=593408 Len=0 TSval=32232039 TSecr=668191706
154   0.067228 54.230.30.37 -> 172.31.36.109 TCP 15994 [TCP segment of a reassembled PDU]
155   0.067250 172.31.36.109 -> 54.230.30.37 TCP 66 34681 > http [ACK] Seq=97 Ack=588454 Win=593408 Len=0 TSval=32232039 TSecr=668191706
156   0.067865 54.230.30.37 -> 172.31.36.109 TCP 2962 [TCP segment of a reassembled PDU]
157   0.067882 172.31.36.109 -> 54.230.30.37 TCP 66 34681 > http [ACK] Seq=97 Ack=591350 Win=593408 Len=0 TSval=32232039 TSecr=668191706
158   0.067978 54.230.30.37 -> 172.31.36.109 TCP 11650 [TCP segment of a reassembled PDU]
159   0.068079 54.230.30.37 -> 172.31.36.109 TCP 2962 [TCP segment of a reassembled PDU]
160   0.068182 172.31.36.109 -> 54.230.30.37 TCP 66 34681 > http [ACK] Seq=97 Ack=605830 Win=593408 Len=0 TSval=32232039 TSecr=668191706
161   0.068249 54.230.30.37 -> 172.31.36.109 TCP 24682 [TCP segment of a reassembled PDU]
162   0.068277 172.31.36.109 -> 54.230.30.37 TCP 66 34681 > http [ACK] Seq=97 Ack=630446 Win=568832 Len=0 TSval=32232039 TSecr=668191706
163   0.068460 54.230.30.37 -> 172.31.36.109 TCP 23234 [TCP segment of a reassembled PDU]
164   0.068486 172.31.36.109 -> 54.230.30.37 TCP 66 34681 > http [ACK] Seq=97 Ack=653614 Win=593408 Len=0 TSval=32232040 TSecr=668191706
165   0.068876 54.230.30.37 -> 172.31.36.109 TCP 1570 [TCP segment of a reassembled PDU]
166   0.068881 172.31.36.109 -> 54.230.30.37 TCP 66 34681 > http [ACK] Seq=97 Ack=655118 Win=596352 Len=0 TSval=32232040 TSecr=668191707
167   0.077826 54.230.30.37 -> 172.31.36.109 TCP 1514 [TCP segment of a reassembled PDU]
168   0.077831 172.31.36.109 -> 54.230.30.37 TCP 66 34681 > http [ACK] Seq=97 Ack=656566 Win=599296 Len=0 TSval=32232042 TSecr=668191707
169   0.078068 54.230.30.37 -> 172.31.36.109 TCP 1514 [TCP segment of a reassembled PDU]
170   0.078073 172.31.36.109 -> 54.230.30.37 TCP 66 34681 > http [ACK] Seq=97 Ack=658014 Win=602240 Len=0 TSval=32232042 TSecr=668191707
171   0.078221 54.230.30.37 -> 172.31.36.109 TCP 23234 [TCP segment of a reassembled PDU]
172   0.078231 172.31.36.109 -> 54.230.30.37 TCP 66 34681 > http [ACK] Seq=97 Ack=681182 Win=648576 Len=0 TSval=32232042 TSecr=668191707
173   0.078244 54.230.30.37 -> 172.31.36.109 TCP 7306 [TCP segment of a reassembled PDU]
174   0.078249 172.31.36.109 -> 54.230.30.37 TCP 66 34681 > http [ACK] Seq=97 Ack=688422 Win=663040 Len=0 TSval=32232042 TSecr=668191707
175   0.078327 54.230.30.37 -> 172.31.36.109 TCP 2962 [TCP segment of a reassembled PDU]
176   0.078333 172.31.36.109 -> 54.230.30.37 TCP 66 34681 > http [ACK] Seq=97 Ack=691318 Win=668800 Len=0 TSval=32232042 TSecr=668191707
177   0.078444 54.230.30.37 -> 172.31.36.109 TCP 1514 [TCP segment of a reassembled PDU]
178   0.078449 172.31.36.109 -> 54.230.30.37 TCP 66 34681 > http [ACK] Seq=97 Ack=692766 Win=671744 Len=0 TSval=32232042 TSecr=668191707
179   0.078466 54.230.30.37 -> 172.31.36.109 TCP 17442 [TCP segment of a reassembled PDU]
180   0.078478 172.31.36.109 -> 54.230.30.37 TCP 66 34681 > http [ACK] Seq=97 Ack=710142 Win=706432 Len=0 TSval=32232042 TSecr=668191707
181   0.078577 54.230.30.37 -> 172.31.36.109 TCP 2962 [TCP segment of a reassembled PDU]
182   0.078583 172.31.36.109 -> 54.230.30.37 TCP 66 34681 > http [ACK] Seq=97 Ack=713038 Win=712192 Len=0 TSval=32232042 TSecr=668191707
183   0.078676 54.230.30.37 -> 172.31.36.109 TCP 1514 [TCP segment of a reassembled PDU]
184   0.078681 172.31.36.109 -> 54.230.30.37 TCP 66 34681 > http [ACK] Seq=97 Ack=714486 Win=715136 Len=0 TSval=32232042 TSecr=668191707
185   0.078689 54.230.30.37 -> 172.31.36.109 TCP 6234 [TCP segment of a reassembled PDU]
186   0.078694 172.31.36.109 -> 54.230.30.37 TCP 66 34681 > http [ACK] Seq=97 Ack=720654 Win=727424 Len=0 TSval=32232042 TSecr=668191707
187   0.087866 54.230.30.37 -> 172.31.36.109 TCP 1514 [TCP segment of a reassembled PDU]
188   0.087872 172.31.36.109 -> 54.230.30.37 TCP 66 34681 > http [ACK] Seq=97 Ack=722102 Win=730368 Len=0 TSval=32232044 TSecr=668191708
189   0.088076 54.230.30.37 -> 172.31.36.109 TCP 8754 [TCP segment of a reassembled PDU]
190   0.088084 172.31.36.109 -> 54.230.30.37 TCP 66 34681 > http [ACK] Seq=97 Ack=730790 Win=747776 Len=0 TSval=32232044 TSecr=668191708
191   0.088165 54.230.30.37 -> 172.31.36.109 TCP 11650 [TCP segment of a reassembled PDU]
192   0.088174 172.31.36.109 -> 54.230.30.37 TCP 66 34681 > http [ACK] Seq=97 Ack=742374 Win=770944 Len=0 TSval=32232044 TSecr=668191708
193   0.088327 54.230.30.37 -> 172.31.36.109 TCP 4410 [TCP segment of a reassembled PDU]
194   0.088332 172.31.36.109 -> 54.230.30.37 TCP 66 34681 > http [ACK] Seq=97 Ack=746718 Win=779648 Len=0 TSval=32232044 TSecr=668191708
195   0.088468 54.230.30.37 -> 172.31.36.109 TCP 1514 [TCP segment of a reassembled PDU]
196   0.088472 172.31.36.109 -> 54.230.30.37 TCP 66 34681 > http [ACK] Seq=97 Ack=748166 Win=782464 Len=0 TSval=32232045 TSecr=668191708
197   0.088481 54.230.30.37 -> 172.31.36.109 TCP 8754 [TCP segment of a reassembled PDU]
198   0.088486 172.31.36.109 -> 54.230.30.37 TCP 66 34681 > http [ACK] Seq=97 Ack=756854 Win=799872 Len=0 TSval=32232045 TSecr=668191708
199   0.088502 54.230.30.37 -> 172.31.36.109 TCP 14546 [TCP segment of a reassembled PDU]
200   0.088509 172.31.36.109 -> 54.230.30.37 TCP 66 34681 > http [ACK] Seq=97 Ack=771334 Win=828800 Len=0 TSval=32232045 TSecr=668191708
201   0.088553 54.230.30.37 -> 172.31.36.109 TCP 4410 [TCP segment of a reassembled PDU]
202   0.088559 172.31.36.109 -> 54.230.30.37 TCP 66 34681 > http [ACK] Seq=97 Ack=775678 Win=837504 Len=0 TSval=32232045 TSecr=668191708
203   0.088625 54.230.30.37 -> 172.31.36.109 TCP 2962 [TCP segment of a reassembled PDU]
204   0.088631 172.31.36.109 -> 54.230.30.37 TCP 66 34681 > http [ACK] Seq=97 Ack=778574 Win=843264 Len=0 TSval=32232045 TSecr=668191708
205   0.088640 54.230.30.37 -> 172.31.36.109 TCP 8754 [TCP segment of a reassembled PDU]
206   0.088645 172.31.36.109 -> 54.230.30.37 TCP 66 34681 > http [ACK] Seq=97 Ack=787262 Win=860672 Len=0 TSval=32232045 TSecr=668191708
207   0.088928 54.230.30.37 -> 172.31.36.109 TCP 10202 [TCP segment of a reassembled PDU]
208   0.088936 172.31.36.109 -> 54.230.30.37 TCP 66 34681 > http [ACK] Seq=97 Ack=797398 Win=881024 Len=0 TSval=32232045 TSecr=668191709
209   0.089015 54.230.30.37 -> 172.31.36.109 TCP 2962 [TCP segment of a reassembled PDU]
210   0.089020 172.31.36.109 -> 54.230.30.37 TCP 66 34681 > http [ACK] Seq=97 Ack=800294 Win=886784 Len=0 TSval=32232045 TSecr=668191709
211   0.089138 54.230.30.37 -> 172.31.36.109 TCP 11650 [TCP segment of a reassembled PDU]
212   0.089146 172.31.36.109 -> 54.230.30.37 TCP 66 34681 > http [ACK] Seq=97 Ack=811878 Win=909952 Len=0 TSval=32232045 TSecr=668191709
213   0.089360 54.230.30.37 -> 172.31.36.109 TCP 5858 [TCP segment of a reassembled PDU]
214   0.089367 172.31.36.109 -> 54.230.30.37 TCP 66 34681 > http [ACK] Seq=97 Ack=817670 Win=921472 Len=0 TSval=32232045 TSecr=668191709
215   0.089458 54.230.30.37 -> 172.31.36.109 TCP 2962 [TCP segment of a reassembled PDU]
216   0.089463 172.31.36.109 -> 54.230.30.37 TCP 66 34681 > http [ACK] Seq=97 Ack=820566 Win=927360 Len=0 TSval=32232045 TSecr=668191709
217   0.089805 54.230.30.37 -> 172.31.36.109 TCP 30474 [TCP segment of a reassembled PDU]
218   0.089820 172.31.36.109 -> 54.230.30.37 TCP 66 34681 > http [ACK] Seq=97 Ack=850974 Win=988160 Len=0 TSval=32232045 TSecr=668191709
219   0.089839 54.230.30.37 -> 172.31.36.109 TCP 17442 [TCP segment of a reassembled PDU]
220   0.089852 172.31.36.109 -> 54.230.30.37 TCP 66 34681 > http [ACK] Seq=97 Ack=868350 Win=1011584 Len=0 TSval=32232045 TSecr=668191709
221   0.089940 54.230.30.37 -> 172.31.36.109 TCP 13098 [TCP segment of a reassembled PDU]
222   0.089948 172.31.36.109 -> 54.230.30.37 TCP 66 34681 > http [ACK] Seq=97 Ack=881382 Win=1048960 Len=0 TSval=32232045 TSecr=668191709
223   0.090191 54.230.30.37 -> 172.31.36.109 TCP 4410 [TCP segment of a reassembled PDU]
224   0.090198 172.31.36.109 -> 54.230.30.37 TCP 66 34681 > http [ACK] Seq=97 Ack=885726 Win=1057664 Len=0 TSval=32232045 TSecr=668191709
225   0.090212 54.230.30.37 -> 172.31.36.109 TCP 13098 [TCP segment of a reassembled PDU]
226   0.090221 172.31.36.109 -> 54.230.30.37 TCP 66 34681 > http [ACK] Seq=97 Ack=898758 Win=1061632 Len=0 TSval=32232045 TSecr=668191709
227   0.090274 54.230.30.37 -> 172.31.36.109 TCP 1514 [TCP segment of a reassembled PDU]
228   0.090278 172.31.36.109 -> 54.230.30.37 TCP 66 34681 > http [ACK] Seq=97 Ack=900206 Win=1086592 Len=0 TSval=32232045 TSecr=668191709
229   0.090417 54.230.30.37 -> 172.31.36.109 TCP 14546 [TCP segment of a reassembled PDU]
230   0.090435 172.31.36.109 -> 54.230.30.37 TCP 66 34681 > http [ACK] Seq=97 Ack=914686 Win=1086592 Len=0 TSval=32232045 TSecr=668191709
231   0.090494 54.230.30.37 -> 172.31.36.109 TCP 2642 [TCP segment of a reassembled PDU]
232   0.090507 172.31.36.109 -> 54.230.30.37 TCP 66 34681 > http [ACK] Seq=97 Ack=917262 Win=1086592 Len=0 TSval=32232045 TSecr=668191709
233   0.091424 54.230.30.37 -> 172.31.36.109 TCP 1514 [TCP segment of a reassembled PDU]
234   0.091428 172.31.36.109 -> 54.230.30.37 TCP 66 34681 > http [ACK] Seq=97 Ack=918710 Win=1087488 Len=0 TSval=32232045 TSecr=668191709
235   0.091679 54.230.30.37 -> 172.31.36.109 TCP 1514 [TCP segment of a reassembled PDU]
236   0.091851 54.230.30.37 -> 172.31.36.109 TCP 23234 [TCP segment of a reassembled PDU]
237   0.091867 54.230.30.37 -> 172.31.36.109 TCP 13098 [TCP segment of a reassembled PDU]
238   0.091886 172.31.36.109 -> 54.230.30.37 TCP 66 34681 > http [ACK] Seq=97 Ack=956358 Win=1049856 Len=0 TSval=32232045 TSecr=668191709
239   0.091959 54.230.30.37 -> 172.31.36.109 TCP 10202 [TCP segment of a reassembled PDU]
240   0.091967 172.31.36.109 -> 54.230.30.37 TCP 66 34681 > http [ACK] Seq=97 Ack=966494 Win=1073664 Len=0 TSval=32232045 TSecr=668191709
241   0.092038 54.230.30.37 -> 172.31.36.109 TCP 2962 [TCP segment of a reassembled PDU]
242   0.092125 172.31.36.109 -> 54.230.30.37 TCP 66 34681 > http [ACK] Seq=97 Ack=969390 Win=1087488 Len=0 TSval=32232045 TSecr=668191709
243   0.092236 54.230.30.37 -> 172.31.36.109 TCP 10202 [TCP segment of a reassembled PDU]
244   0.092245 54.230.30.37 -> 172.31.36.109 TCP 3338 [TCP segment of a reassembled PDU]
245   0.092259 172.31.36.109 -> 54.230.30.37 TCP 66 34681 > http [ACK] Seq=97 Ack=982798 Win=1087488 Len=0 TSval=32232045 TSecr=668191709
246   0.099837 54.230.30.37 -> 172.31.36.109 TCP 1514 [TCP segment of a reassembled PDU]
247   0.100096 54.230.30.37 -> 172.31.36.109 TCP 1514 [TCP segment of a reassembled PDU]
248   0.100102 172.31.36.109 -> 54.230.30.37 TCP 66 34681 > http [ACK] Seq=97 Ack=985694 Win=1087488 Len=0 TSval=32232047 TSecr=668191710
249   0.100209 54.230.30.37 -> 172.31.36.109 TCP 15994 [TCP segment of a reassembled PDU]
250   0.100233 172.31.36.109 -> 54.230.30.37 TCP 66 34681 > http [ACK] Seq=97 Ack=1001622 Win=1087488 Len=0 TSval=32232047 TSecr=668191710
251   0.100348 54.230.30.37 -> 172.31.36.109 TCP 7306 [TCP segment of a reassembled PDU]
252   0.100358 54.230.30.37 -> 172.31.36.109 TCP 8754 [TCP segment of a reassembled PDU]
253   0.100375 54.230.30.37 -> 172.31.36.109 TCP 10202 [TCP segment of a reassembled PDU]
254   0.100394 172.31.36.109 -> 54.230.30.37 TCP 66 34681 > http [ACK] Seq=97 Ack=1027686 Win=1073664 Len=0 TSval=32232047 TSecr=668191710
255   0.100404 54.230.30.37 -> 172.31.36.109 TCP 4410 [TCP segment of a reassembled PDU]
256   0.100423 172.31.36.109 -> 54.230.30.37 TCP 66 34681 > http [ACK] Seq=97 Ack=1032030 Win=1087488 Len=0 TSval=32232047 TSecr=668191710
257   0.100668 54.230.30.37 -> 172.31.36.109 HTTP 17070 HTTP/1.1 200 OK  (application/octet-stream)
258   0.100694 172.31.36.109 -> 54.230.30.37 TCP 66 34681 > http [ACK] Seq=97 Ack=1049034 Win=1070592 Len=0 TSval=32232048 TSecr=668191710
259   0.100817 172.31.36.109 -> 54.230.30.37 TCP 66 34681 > http [FIN, ACK] Seq=97 Ack=1049034 Win=1087488 Len=0 TSval=32232048 TSecr=668191710
260   0.101879 54.230.30.37 -> 172.31.36.109 TCP 66 http > 34681 [FIN, ACK] Seq=1049034 Ack=98 Win=14592 Len=0 TSval=668191710 TSecr=32232048
261   0.101887 172.31.36.109 -> 54.230.30.37 TCP 66 34681 > http [ACK] Seq=98 Ack=1049035 Win=1087488 Len=0 TSval=32232048 TSecr=668191710
