[Measurement for 1mb at 11:34:07 20.34.2014] 
Tshark:

  1   0.000000 172.31.36.109 -> 172.31.0.2   DNS 89 Standard query 0xd899  A d3m1c4hwkgedal.cloudfront.net
  2   0.000029 172.31.36.109 -> 172.31.0.2   DNS 89 Standard query 0x0d0f  AAAA d3m1c4hwkgedal.cloudfront.net
  3   0.000520   172.31.0.2 -> 172.31.36.109 DNS 217 Standard query response 0xd899  A 54.230.30.193 A 54.230.30.207 A 54.230.30.247 A 54.230.30.249 A 54.192.29.221 A 54.230.30.27 A 54.230.30.69 A 54.230.30.192
  4   0.000623   172.31.0.2 -> 172.31.36.109 DNS 174 Standard query response 0x0d0f 
  5   0.003768 172.31.36.109 -> 54.230.30.193 TCP 74 42229 > http [SYN] Seq=0 Win=26883 Len=0 MSS=8961 SACK_PERM=1 TSval=36733433 TSecr=0 WS=128
  6   0.005038 54.230.30.193 -> 172.31.36.109 TCP 74 http > 42229 [SYN, ACK] Seq=0 Ack=1 Win=14480 Len=0 MSS=1460 SACK_PERM=1 TSval=721122207 TSecr=36733433 WS=128
  7   0.005052 172.31.36.109 -> 54.230.30.193 TCP 66 42229 > http [ACK] Seq=1 Ack=1 Win=27008 Len=0 TSval=36733433 TSecr=721122207
  8   0.005093 172.31.36.109 -> 54.230.30.193 HTTP 162 GET /1mb HTTP/1.1 
  9   0.006366 54.230.30.193 -> 172.31.36.109 TCP 66 http > 42229 [ACK] Seq=1 Ack=97 Win=14592 Len=0 TSval=721122207 TSecr=36733433
 10   0.051983 54.230.30.193 -> 172.31.36.109 TCP 523 [TCP segment of a reassembled PDU]
 11   0.052010 172.31.36.109 -> 54.230.30.193 TCP 66 42229 > http [ACK] Seq=97 Ack=458 Win=28032 Len=0 TSval=36733445 TSecr=721122212
 12   0.052036 54.230.30.193 -> 172.31.36.109 TCP 8754 [TCP segment of a reassembled PDU]
 13   0.052047 172.31.36.109 -> 54.230.30.193 TCP 66 42229 > http [ACK] Seq=97 Ack=9146 Win=45440 Len=0 TSval=36733445 TSecr=721122212
 14   0.052136 54.230.30.193 -> 172.31.36.109 TCP 2962 [TCP segment of a reassembled PDU]
 15   0.052143 172.31.36.109 -> 54.230.30.193 TCP 66 42229 > http [ACK] Seq=97 Ack=12042 Win=51200 Len=0 TSval=36733445 TSecr=721122212
 16   0.052198 54.230.30.193 -> 172.31.36.109 TCP 1514 [TCP segment of a reassembled PDU]
 17   0.052203 172.31.36.109 -> 54.230.30.193 TCP 66 42229 > http [ACK] Seq=97 Ack=13490 Win=54144 Len=0 TSval=36733445 TSecr=721122212
 18   0.053183 54.230.30.193 -> 172.31.36.109 TCP 5858 [TCP segment of a reassembled PDU]
 19   0.053190 172.31.36.109 -> 54.230.30.193 TCP 66 42229 > http [ACK] Seq=97 Ack=19282 Win=65664 Len=0 TSval=36733445 TSecr=721122212
 20   0.053295 54.230.30.193 -> 172.31.36.109 TCP 7306 [TCP segment of a reassembled PDU]
 21   0.053302 172.31.36.109 -> 54.230.30.193 TCP 66 42229 > http [ACK] Seq=97 Ack=26522 Win=80128 Len=0 TSval=36733445 TSecr=721122212
 22   0.053528 54.230.30.193 -> 172.31.36.109 TCP 7306 [TCP segment of a reassembled PDU]
 23   0.053536 172.31.36.109 -> 54.230.30.193 TCP 66 42229 > http [ACK] Seq=97 Ack=33762 Win=94592 Len=0 TSval=36733445 TSecr=721122212
 24   0.054469 54.230.30.193 -> 172.31.36.109 TCP 5858 [TCP segment of a reassembled PDU]
 25   0.054477 172.31.36.109 -> 54.230.30.193 TCP 66 42229 > http [ACK] Seq=97 Ack=39554 Win=106240 Len=0 TSval=36733445 TSecr=721122212
 26   0.054587 54.230.30.193 -> 172.31.36.109 TCP 2962 [TCP segment of a reassembled PDU]
 27   0.054593 172.31.36.109 -> 54.230.30.193 TCP 66 42229 > http [ACK] Seq=97 Ack=42450 Win=109056 Len=0 TSval=36733445 TSecr=721122212
 28   0.054790 54.230.30.193 -> 172.31.36.109 TCP 10202 [TCP segment of a reassembled PDU]
 29   0.054798 172.31.36.109 -> 54.230.30.193 TCP 66 42229 > http [ACK] Seq=97 Ack=52586 Win=101248 Len=0 TSval=36733445 TSecr=721122212
 30   0.055742 54.230.30.193 -> 172.31.36.109 TCP 2962 [TCP segment of a reassembled PDU]
 31   0.055748 172.31.36.109 -> 54.230.30.193 TCP 66 42229 > http [ACK] Seq=97 Ack=55482 Win=109056 Len=0 TSval=36733446 TSecr=721122212
 32   0.055884 54.230.30.193 -> 172.31.36.109 TCP 10202 [TCP segment of a reassembled PDU]
 33   0.055892 172.31.36.109 -> 54.230.30.193 TCP 66 42229 > http [ACK] Seq=97 Ack=65618 Win=129280 Len=0 TSval=36733446 TSecr=721122212
 34   0.056066 54.230.30.193 -> 172.31.36.109 TCP 10202 [TCP segment of a reassembled PDU]
 35   0.056074 172.31.36.109 -> 54.230.30.193 TCP 66 42229 > http [ACK] Seq=97 Ack=75754 Win=149632 Len=0 TSval=36733446 TSecr=721122212
 36   0.056308 54.230.30.193 -> 172.31.36.109 TCP 2962 [TCP segment of a reassembled PDU]
 37   0.056313 172.31.36.109 -> 54.230.30.193 TCP 66 42229 > http [ACK] Seq=97 Ack=78650 Win=155392 Len=0 TSval=36733446 TSecr=721122212
 38   0.057156 54.230.30.193 -> 172.31.36.109 TCP 13098 [TCP segment of a reassembled PDU]
 39   0.057166 172.31.36.109 -> 54.230.30.193 TCP 66 42229 > http [ACK] Seq=97 Ack=91682 Win=181504 Len=0 TSval=36733446 TSecr=721122212
 40   0.057360 54.230.30.193 -> 172.31.36.109 TCP 2962 [TCP segment of a reassembled PDU]
 41   0.057365 172.31.36.109 -> 54.230.30.193 TCP 66 42229 > http [ACK] Seq=97 Ack=94578 Win=187264 Len=0 TSval=36733446 TSecr=721122212
 42   0.057461 54.230.30.193 -> 172.31.36.109 TCP 7306 [TCP segment of a reassembled PDU]
 43   0.057468 172.31.36.109 -> 54.230.30.193 TCP 66 42229 > http [ACK] Seq=97 Ack=101818 Win=201728 Len=0 TSval=36733446 TSecr=721122212
 44   0.057678 54.230.30.193 -> 172.31.36.109 TCP 2962 [TCP segment of a reassembled PDU]
 45   0.057684 172.31.36.109 -> 54.230.30.193 TCP 66 42229 > http [ACK] Seq=97 Ack=104714 Win=207488 Len=0 TSval=36733446 TSecr=721122212
 46   0.058709 54.230.30.193 -> 172.31.36.109 TCP 13098 [TCP segment of a reassembled PDU]
 47   0.058718 172.31.36.109 -> 54.230.30.193 TCP 66 42229 > http [ACK] Seq=97 Ack=117746 Win=233600 Len=0 TSval=36733446 TSecr=721122212
 48   0.058735 54.230.30.193 -> 172.31.36.109 TCP 13098 [TCP segment of a reassembled PDU]
 49   0.058743 172.31.36.109 -> 54.230.30.193 TCP 66 42229 > http [ACK] Seq=97 Ack=130778 Win=259712 Len=0 TSval=36733446 TSecr=721122212
 50   0.058849 54.230.30.193 -> 172.31.36.109 TCP 5858 [TCP segment of a reassembled PDU]
 51   0.058856 172.31.36.109 -> 54.230.30.193 TCP 66 42229 > http [ACK] Seq=97 Ack=136570 Win=271232 Len=0 TSval=36733446 TSecr=721122212
 52   0.058960 54.230.30.193 -> 172.31.36.109 TCP 7306 [TCP segment of a reassembled PDU]
 53   0.058968 172.31.36.109 -> 54.230.30.193 TCP 66 42229 > http [ACK] Seq=97 Ack=143810 Win=285696 Len=0 TSval=36733446 TSecr=721122212
 54   0.060139 54.230.30.193 -> 172.31.36.109 TCP 4410 [TCP segment of a reassembled PDU]
 55   0.060147 172.31.36.109 -> 54.230.30.193 TCP 66 42229 > http [ACK] Seq=97 Ack=148154 Win=294400 Len=0 TSval=36733447 TSecr=721122212
 56   0.060524 54.230.30.193 -> 172.31.36.109 TCP 8754 [TCP segment of a reassembled PDU]
 57   0.060532 172.31.36.109 -> 54.230.30.193 TCP 66 42229 > http [ACK] Seq=97 Ack=156842 Win=311808 Len=0 TSval=36733447 TSecr=721122212
 58   0.060553 54.230.30.193 -> 172.31.36.109 TCP 26130 [TCP segment of a reassembled PDU]
 59   0.060565 172.31.36.109 -> 54.230.30.193 TCP 66 42229 > http [ACK] Seq=97 Ack=182906 Win=363904 Len=0 TSval=36733447 TSecr=721122212
 60   0.061367 54.230.30.193 -> 172.31.36.109 TCP 2962 [TCP segment of a reassembled PDU]
 61   0.061373 172.31.36.109 -> 54.230.30.193 TCP 66 42229 > http [ACK] Seq=97 Ack=185802 Win=369664 Len=0 TSval=36733447 TSecr=721122213
 62   0.061477 54.230.30.193 -> 172.31.36.109 TCP 4410 [TCP segment of a reassembled PDU]
 63   0.061482 172.31.36.109 -> 54.230.30.193 TCP 66 42229 > http [ACK] Seq=97 Ack=190146 Win=378368 Len=0 TSval=36733447 TSecr=721122213
 64   0.061751 54.230.30.193 -> 172.31.36.109 TCP 18890 [TCP segment of a reassembled PDU]
 65   0.061763 172.31.36.109 -> 54.230.30.193 TCP 66 42229 > http [ACK] Seq=97 Ack=208970 Win=416000 Len=0 TSval=36733447 TSecr=721122213
 66   0.061859 54.230.30.193 -> 172.31.36.109 TCP 2962 [TCP segment of a reassembled PDU]
 67   0.061865 172.31.36.109 -> 54.230.30.193 TCP 66 42229 > http [ACK] Seq=97 Ack=211866 Win=421888 Len=0 TSval=36733447 TSecr=721122213
 68   0.062037 54.230.30.193 -> 172.31.36.109 TCP 21786 [TCP segment of a reassembled PDU]
 69   0.062049 172.31.36.109 -> 54.230.30.193 TCP 66 42229 > http [ACK] Seq=97 Ack=233586 Win=465280 Len=0 TSval=36733447 TSecr=721122213
 70   0.062740 54.230.30.193 -> 172.31.36.109 TCP 7306 [TCP segment of a reassembled PDU]
 71   0.062747 172.31.36.109 -> 54.230.30.193 TCP 66 42229 > http [ACK] Seq=97 Ack=240826 Win=479744 Len=0 TSval=36733447 TSecr=721122213
 72   0.062794 54.230.30.193 -> 172.31.36.109 TCP 1514 [TCP segment of a reassembled PDU]
 73   0.062799 172.31.36.109 -> 54.230.30.193 TCP 66 42229 > http [ACK] Seq=97 Ack=242274 Win=482688 Len=0 TSval=36733447 TSecr=721122213
 74   0.063153 54.230.30.193 -> 172.31.36.109 TCP 1514 [TCP segment of a reassembled PDU]
 75   0.063158 172.31.36.109 -> 54.230.30.193 TCP 66 42229 > http [ACK] Seq=97 Ack=243722 Win=485504 Len=0 TSval=36733447 TSecr=721122213
 76   0.063276 54.230.30.193 -> 172.31.36.109 TCP 17965 [TCP segment of a reassembled PDU]
 77   0.063286 172.31.36.109 -> 54.230.30.193 TCP 66 42229 > http [ACK] Seq=97 Ack=261621 Win=521344 Len=0 TSval=36733447 TSecr=721122213
 78   0.103735 54.230.30.193 -> 172.31.36.109 TCP 1514 [TCP segment of a reassembled PDU]
 79   0.103749 172.31.36.109 -> 54.230.30.193 TCP 66 42229 > http [ACK] Seq=97 Ack=263069 Win=524288 Len=0 TSval=36733458 TSecr=721122217
 80   0.103967 54.230.30.193 -> 172.31.36.109 TCP 39162 [TCP segment of a reassembled PDU]
 81   0.103986 172.31.36.109 -> 54.230.30.193 TCP 66 42229 > http [ACK] Seq=97 Ack=302165 Win=593536 Len=0 TSval=36733458 TSecr=721122217
 82   0.104002 54.230.30.193 -> 172.31.36.109 TCP 11650 [TCP segment of a reassembled PDU]
 83   0.104014 172.31.36.109 -> 54.230.30.193 TCP 66 42229 > http [ACK] Seq=97 Ack=313749 Win=582016 Len=0 TSval=36733458 TSecr=721122217
 84   0.104160 54.230.30.193 -> 172.31.36.109 TCP 5858 [TCP segment of a reassembled PDU]
 85   0.104167 172.31.36.109 -> 54.230.30.193 TCP 66 42229 > http [ACK] Seq=97 Ack=319541 Win=614016 Len=0 TSval=36733458 TSecr=721122217
 86   0.105435 54.230.30.193 -> 172.31.36.109 TCP 7306 [TCP segment of a reassembled PDU]
 87   0.105442 172.31.36.109 -> 54.230.30.193 TCP 66 42229 > http [ACK] Seq=97 Ack=326781 Win=628480 Len=0 TSval=36733458 TSecr=721122217
 88   0.105533 54.230.30.193 -> 172.31.36.109 TCP 21786 [TCP segment of a reassembled PDU]
 89   0.105546 172.31.36.109 -> 54.230.30.193 TCP 66 42229 > http [ACK] Seq=97 Ack=348501 Win=622080 Len=0 TSval=36733458 TSecr=721122217
 90   0.105748 54.230.30.193 -> 172.31.36.109 TCP 2962 [TCP segment of a reassembled PDU]
 91   0.105753 172.31.36.109 -> 54.230.30.193 TCP 66 42229 > http [ACK] Seq=97 Ack=351397 Win=634240 Len=0 TSval=36733458 TSecr=721122217
 92   0.105934 54.230.30.193 -> 172.31.36.109 TCP 11650 [TCP segment of a reassembled PDU]
 93   0.105943 172.31.36.109 -> 54.230.30.193 TCP 66 42229 > http [ACK] Seq=97 Ack=362981 Win=638720 Len=0 TSval=36733458 TSecr=721122217
 94   0.106944 54.230.30.193 -> 172.31.36.109 TCP 1514 [TCP segment of a reassembled PDU]
 95   0.106949 172.31.36.109 -> 54.230.30.193 TCP 66 42229 > http [ACK] Seq=97 Ack=364429 Win=655360 Len=0 TSval=36733458 TSecr=721122217
 96   0.107299 54.230.30.193 -> 172.31.36.109 TCP 33370 [TCP segment of a reassembled PDU]
 97   0.107318 172.31.36.109 -> 54.230.30.193 TCP 66 42229 > http [ACK] Seq=97 Ack=397733 Win=622080 Len=0 TSval=36733458 TSecr=721122217
 98   0.107340 54.230.30.193 -> 172.31.36.109 TCP 17442 [TCP segment of a reassembled PDU]
 99   0.107349 172.31.36.109 -> 54.230.30.193 TCP 66 42229 > http [ACK] Seq=97 Ack=415109 Win=604800 Len=0 TSval=36733458 TSecr=721122217
100   0.108516 54.230.30.193 -> 172.31.36.109 TCP 1514 [TCP segment of a reassembled PDU]
101   0.108523 172.31.36.109 -> 54.230.30.193 TCP 66 42229 > http [ACK] Seq=97 Ack=416557 Win=655360 Len=0 TSval=36733459 TSecr=721122217
102   0.108586 54.230.30.193 -> 172.31.36.109 TCP 1514 [TCP segment of a reassembled PDU]
103   0.108591 172.31.36.109 -> 54.230.30.193 TCP 66 42229 > http [ACK] Seq=97 Ack=418005 Win=655360 Len=0 TSval=36733459 TSecr=721122217
104   0.108930 54.230.30.193 -> 172.31.36.109 TCP 34818 [TCP segment of a reassembled PDU]
105   0.108947 172.31.36.109 -> 54.230.30.193 TCP 66 42229 > http [ACK] Seq=97 Ack=452757 Win=620672 Len=0 TSval=36733459 TSecr=721122217
106   0.109173 54.230.30.193 -> 172.31.36.109 TCP 14546 [TCP segment of a reassembled PDU]
107   0.109183 172.31.36.109 -> 54.230.30.193 TCP 66 42229 > http [ACK] Seq=97 Ack=467237 Win=633856 Len=0 TSval=36733459 TSecr=721122217
108   0.109196 54.230.30.193 -> 172.31.36.109 TCP 10202 [TCP segment of a reassembled PDU]
109   0.109202 172.31.36.109 -> 54.230.30.193 TCP 66 42229 > http [ACK] Seq=97 Ack=477373 Win=623744 Len=0 TSval=36733459 TSecr=721122217
110   0.109206 54.230.30.193 -> 172.31.36.109 TCP 2962 [TCP segment of a reassembled PDU]
111   0.109209 172.31.36.109 -> 54.230.30.193 TCP 66 42229 > http [ACK] Seq=97 Ack=480269 Win=620928 Len=0 TSval=36733459 TSecr=721122217
112   0.109221 54.230.30.193 -> 172.31.36.109 TCP 8754 [TCP segment of a reassembled PDU]
113   0.109226 172.31.36.109 -> 54.230.30.193 TCP 66 42229 > http [ACK] Seq=97 Ack=488957 Win=612352 Len=0 TSval=36733459 TSecr=721122217
114   0.110038 54.230.30.193 -> 172.31.36.109 TCP 2962 [TCP segment of a reassembled PDU]
115   0.110043 172.31.36.109 -> 54.230.30.193 TCP 66 42229 > http [ACK] Seq=97 Ack=491853 Win=652928 Len=0 TSval=36733459 TSecr=721122217
116   0.110170 54.230.30.193 -> 172.31.36.109 TCP 10202 [TCP segment of a reassembled PDU]
117   0.110179 172.31.36.109 -> 54.230.30.193 TCP 66 42229 > http [ACK] Seq=97 Ack=501989 Win=677376 Len=0 TSval=36733459 TSecr=721122217
118   0.110396 54.230.30.193 -> 172.31.36.109 TCP 15994 [TCP segment of a reassembled PDU]
119   0.110407 172.31.36.109 -> 54.230.30.193 TCP 66 42229 > http [ACK] Seq=97 Ack=517917 Win=709248 Len=0 TSval=36733459 TSecr=721122217
120   0.110624 54.230.30.193 -> 172.31.36.109 TCP 20338 [TCP segment of a reassembled PDU]
121   0.110637 172.31.36.109 -> 54.230.30.193 TCP 66 42229 > http [ACK] Seq=97 Ack=538189 Win=749824 Len=0 TSval=36733459 TSecr=721122217
122   0.110713 54.230.30.193 -> 172.31.36.109 TCP 8754 [TCP segment of a reassembled PDU]
123   0.110721 172.31.36.109 -> 54.230.30.193 TCP 66 42229 > http [ACK] Seq=97 Ack=546877 Win=767104 Len=0 TSval=36733459 TSecr=721122217
124   0.111344 54.230.30.193 -> 172.31.36.109 TCP 4410 [TCP segment of a reassembled PDU]
125   0.111350 172.31.36.109 -> 54.230.30.193 TCP 66 42229 > http [ACK] Seq=97 Ack=551221 Win=775808 Len=0 TSval=36733459 TSecr=721122217
126   0.111586 54.230.30.193 -> 172.31.36.109 TCP 2962 [TCP segment of a reassembled PDU]
127   0.111591 172.31.36.109 -> 54.230.30.193 TCP 66 42229 > http [ACK] Seq=97 Ack=554117 Win=781696 Len=0 TSval=36733459 TSecr=721122217
128   0.111814 54.230.30.193 -> 172.31.36.109 TCP 23234 [TCP segment of a reassembled PDU]
129   0.111825 172.31.36.109 -> 54.230.30.193 TCP 66 42229 > http [ACK] Seq=97 Ack=577285 Win=828032 Len=0 TSval=36733460 TSecr=721122217
130   0.111838 54.230.30.193 -> 172.31.36.109 TCP 2962 [TCP segment of a reassembled PDU]
131   0.111841 172.31.36.109 -> 54.230.30.193 TCP 66 42229 > http [ACK] Seq=97 Ack=580181 Win=833792 Len=0 TSval=36733460 TSecr=721122218
132   0.111943 54.230.30.193 -> 172.31.36.109 TCP 2962 [TCP segment of a reassembled PDU]
133   0.111949 172.31.36.109 -> 54.230.30.193 TCP 66 42229 > http [ACK] Seq=97 Ack=583077 Win=839552 Len=0 TSval=36733460 TSecr=721122218
134   0.112100 54.230.30.193 -> 172.31.36.109 TCP 2962 [TCP segment of a reassembled PDU]
135   0.112105 172.31.36.109 -> 54.230.30.193 TCP 66 42229 > http [ACK] Seq=97 Ack=585973 Win=845312 Len=0 TSval=36733460 TSecr=721122218
136   0.112188 54.230.30.193 -> 172.31.36.109 TCP 14546 [TCP segment of a reassembled PDU]
137   0.112198 172.31.36.109 -> 54.230.30.193 TCP 66 42229 > http [ACK] Seq=97 Ack=600453 Win=874368 Len=0 TSval=36733460 TSecr=721122218
138   0.112343 54.230.30.193 -> 172.31.36.109 TCP 20338 [TCP segment of a reassembled PDU]
139   0.112360 172.31.36.109 -> 54.230.30.193 TCP 66 42229 > http [ACK] Seq=97 Ack=620725 Win=914816 Len=0 TSval=36733460 TSecr=721122218
140   0.112396 54.230.30.193 -> 172.31.36.109 TCP 7306 [TCP segment of a reassembled PDU]
141   0.112404 172.31.36.109 -> 54.230.30.193 TCP 66 42229 > http [ACK] Seq=97 Ack=627965 Win=929280 Len=0 TSval=36733460 TSecr=721122218
142   0.112830 54.230.30.193 -> 172.31.36.109 TCP 4410 [TCP segment of a reassembled PDU]
143   0.112838 172.31.36.109 -> 54.230.30.193 TCP 66 42229 > http [ACK] Seq=97 Ack=632309 Win=937984 Len=0 TSval=36733460 TSecr=721122218
144   0.112943 54.230.30.193 -> 172.31.36.109 TCP 4410 [TCP segment of a reassembled PDU]
145   0.112948 172.31.36.109 -> 54.230.30.193 TCP 66 42229 > http [ACK] Seq=97 Ack=636653 Win=946688 Len=0 TSval=36733460 TSecr=721122218
146   0.113153 54.230.30.193 -> 172.31.36.109 TCP 8754 [TCP segment of a reassembled PDU]
147   0.113161 172.31.36.109 -> 54.230.30.193 TCP 66 42229 > http [ACK] Seq=97 Ack=645341 Win=964096 Len=0 TSval=36733460 TSecr=721122218
148   0.113171 54.230.30.193 -> 172.31.36.109 TCP 7306 [TCP segment of a reassembled PDU]
149   0.113176 172.31.36.109 -> 54.230.30.193 TCP 66 42229 > http [ACK] Seq=97 Ack=652581 Win=978560 Len=0 TSval=36733460 TSecr=721122218
150   0.113458 54.230.30.193 -> 172.31.36.109 TCP 17442 [TCP segment of a reassembled PDU]
151   0.113468 172.31.36.109 -> 54.230.30.193 TCP 66 42229 > http [ACK] Seq=97 Ack=669957 Win=1013376 Len=0 TSval=36733460 TSecr=721122218
152   0.113556 54.230.30.193 -> 172.31.36.109 TCP 11650 [TCP segment of a reassembled PDU]
153   0.113566 172.31.36.109 -> 54.230.30.193 TCP 66 42229 > http [ACK] Seq=97 Ack=681541 Win=1036544 Len=0 TSval=36733460 TSecr=721122218
154   0.113772 54.230.30.193 -> 172.31.36.109 TCP 13098 [TCP segment of a reassembled PDU]
155   0.113781 172.31.36.109 -> 54.230.30.193 TCP 66 42229 > http [ACK] Seq=97 Ack=694573 Win=1062528 Len=0 TSval=36733460 TSecr=721122218
156   0.113894 54.230.30.193 -> 172.31.36.109 TCP 5858 [TCP segment of a reassembled PDU]
157   0.113900 172.31.36.109 -> 54.230.30.193 TCP 66 42229 > http [ACK] Seq=97 Ack=700365 Win=1074176 Len=0 TSval=36733460 TSecr=721122218
158   0.114014 54.230.30.193 -> 172.31.36.109 TCP 10202 [TCP segment of a reassembled PDU]
159   0.114021 172.31.36.109 -> 54.230.30.193 TCP 66 42229 > http [ACK] Seq=97 Ack=710501 Win=1094400 Len=0 TSval=36733460 TSecr=721122218
160   0.114392 54.230.30.193 -> 172.31.36.109 TCP 2962 [TCP segment of a reassembled PDU]
161   0.114398 172.31.36.109 -> 54.230.30.193 TCP 66 42229 > http [ACK] Seq=97 Ack=713397 Win=1100160 Len=0 TSval=36733460 TSecr=721122218
162   0.114538 54.230.30.193 -> 172.31.36.109 TCP 1514 [TCP Previous segment not captured] [TCP segment of a reassembled PDU]
163   0.114544 172.31.36.109 -> 54.230.30.193 TCP 78 [TCP Window Update] 42229 > http [ACK] Seq=97 Ack=713397 Win=1103104 Len=0 TSval=36733460 TSecr=721122218 SLE=714845 SRE=716293
164   0.114548 54.230.30.193 -> 172.31.36.109 TCP 1514 [TCP Out-Of-Order] [TCP segment of a reassembled PDU]
165   0.114552 172.31.36.109 -> 54.230.30.193 TCP 66 42229 > http [ACK] Seq=97 Ack=716293 Win=1106048 Len=0 TSval=36733460 TSecr=721122218
166   0.114558 54.230.30.193 -> 172.31.36.109 TCP 7306 [TCP segment of a reassembled PDU]
167   0.114562 172.31.36.109 -> 54.230.30.193 TCP 66 42229 > http [ACK] Seq=97 Ack=723533 Win=1120512 Len=0 TSval=36733460 TSecr=721122218
168   0.114658 54.230.30.193 -> 172.31.36.109 TCP 2962 [TCP segment of a reassembled PDU]
169   0.114663 172.31.36.109 -> 54.230.30.193 TCP 66 42229 > http [ACK] Seq=97 Ack=726429 Win=1126272 Len=0 TSval=36733460 TSecr=721122218
170   0.114800 54.230.30.193 -> 172.31.36.109 TCP 17442 [TCP segment of a reassembled PDU]
171   0.114810 172.31.36.109 -> 54.230.30.193 TCP 66 42229 > http [ACK] Seq=97 Ack=743805 Win=1160960 Len=0 TSval=36733460 TSecr=721122218
172   0.114879 54.230.30.193 -> 172.31.36.109 TCP 15994 [TCP segment of a reassembled PDU]
173   0.114888 172.31.36.109 -> 54.230.30.193 TCP 66 42229 > http [ACK] Seq=97 Ack=759733 Win=1181184 Len=0 TSval=36733460 TSecr=721122218
174   0.115001 54.230.30.193 -> 172.31.36.109 TCP 15994 [TCP segment of a reassembled PDU]
175   0.115010 172.31.36.109 -> 54.230.30.193 TCP 66 42229 > http [ACK] Seq=97 Ack=775661 Win=1165312 Len=0 TSval=36733460 TSecr=721122218
176   0.115227 54.230.30.193 -> 172.31.36.109 TCP 5858 [TCP segment of a reassembled PDU]
177   0.115235 172.31.36.109 -> 54.230.30.193 TCP 66 42229 > http [ACK] Seq=97 Ack=781453 Win=1197824 Len=0 TSval=36733460 TSecr=721122218
178   0.115323 54.230.30.193 -> 172.31.36.109 TCP 1514 [TCP segment of a reassembled PDU]
179   0.115327 172.31.36.109 -> 54.230.30.193 TCP 66 42229 > http [ACK] Seq=97 Ack=782901 Win=1201536 Len=0 TSval=36733460 TSecr=721122218
180   0.115478 54.230.30.193 -> 172.31.36.109 TCP 10202 [TCP segment of a reassembled PDU]
181   0.115486 172.31.36.109 -> 54.230.30.193 TCP 66 42229 > http [ACK] Seq=97 Ack=793037 Win=1191424 Len=0 TSval=36733460 TSecr=721122218
182   0.115624 54.230.30.193 -> 172.31.36.109 TCP 23234 [TCP segment of a reassembled PDU]
183   0.115637 172.31.36.109 -> 54.230.30.193 TCP 66 42229 > http [ACK] Seq=97 Ack=816205 Win=1169280 Len=0 TSval=36733460 TSecr=721122218
184   0.115692 54.230.30.193 -> 172.31.36.109 TCP 4410 [TCP segment of a reassembled PDU]
185   0.115698 172.31.36.109 -> 54.230.30.193 TCP 66 42229 > http [ACK] Seq=97 Ack=820549 Win=1200256 Len=0 TSval=36733461 TSecr=721122218
186   0.116041 54.230.30.193 -> 172.31.36.109 TCP 11650 [TCP segment of a reassembled PDU]
187   0.116049 172.31.36.109 -> 54.230.30.193 TCP 66 42229 > http [ACK] Seq=97 Ack=832133 Win=1188736 Len=0 TSval=36733461 TSecr=721122218
188   0.116160 54.230.30.193 -> 172.31.36.109 TCP 5858 [TCP segment of a reassembled PDU]
189   0.116167 172.31.36.109 -> 54.230.30.193 TCP 66 42229 > http [ACK] Seq=97 Ack=837925 Win=1197824 Len=0 TSval=36733461 TSecr=721122218
190   0.116290 54.230.30.193 -> 172.31.36.109 TCP 17442 [TCP segment of a reassembled PDU]
191   0.116301 172.31.36.109 -> 54.230.30.193 TCP 66 42229 > http [ACK] Seq=97 Ack=855301 Win=1180544 Len=0 TSval=36733461 TSecr=721122218
192   0.116311 54.230.30.193 -> 172.31.36.109 TCP 2962 [TCP segment of a reassembled PDU]
193   0.116315 172.31.36.109 -> 54.230.30.193 TCP 66 42229 > http [ACK] Seq=97 Ack=858197 Win=1177728 Len=0 TSval=36733461 TSecr=721122218
194   0.116514 54.230.30.193 -> 172.31.36.109 TCP 14546 [TCP segment of a reassembled PDU]
195   0.116525 172.31.36.109 -> 54.230.30.193 TCP 66 42229 > http [ACK] Seq=97 Ack=872677 Win=1183488 Len=0 TSval=36733461 TSecr=721122218
196   0.116651 54.230.30.193 -> 172.31.36.109 TCP 17442 [TCP segment of a reassembled PDU]
197   0.116662 172.31.36.109 -> 54.230.30.193 TCP 66 42229 > http [ACK] Seq=97 Ack=890053 Win=1178752 Len=0 TSval=36733461 TSecr=721122218
198   0.116737 54.230.30.193 -> 172.31.36.109 TCP 8754 [TCP segment of a reassembled PDU]
199   0.116744 172.31.36.109 -> 54.230.30.193 TCP 66 42229 > http [ACK] Seq=97 Ack=898741 Win=1193088 Len=0 TSval=36733461 TSecr=721122218
200   0.116837 54.230.30.193 -> 172.31.36.109 TCP 7306 [TCP segment of a reassembled PDU]
201   0.116844 172.31.36.109 -> 54.230.30.193 TCP 66 42229 > http [ACK] Seq=97 Ack=905981 Win=1195520 Len=0 TSval=36733461 TSecr=721122218
202   0.117248 54.230.30.193 -> 172.31.36.109 TCP 5858 [TCP segment of a reassembled PDU]
203   0.117254 172.31.36.109 -> 54.230.30.193 TCP 66 42229 > http [ACK] Seq=97 Ack=911773 Win=1197824 Len=0 TSval=36733461 TSecr=721122218
204   0.117385 54.230.30.193 -> 172.31.36.109 TCP 10202 [TCP segment of a reassembled PDU]
205   0.117392 172.31.36.109 -> 54.230.30.193 TCP 66 42229 > http [ACK] Seq=97 Ack=921909 Win=1190784 Len=0 TSval=36733461 TSecr=721122218
206   0.117622 54.230.30.193 -> 172.31.36.109 TCP 29026 [TCP segment of a reassembled PDU]
207   0.117647 172.31.36.109 -> 54.230.30.193 TCP 66 42229 > http [ACK] Seq=97 Ack=950869 Win=1161856 Len=0 TSval=36733461 TSecr=721122218
208   0.117764 54.230.30.193 -> 172.31.36.109 TCP 17442 [TCP segment of a reassembled PDU]
209   0.117775 172.31.36.109 -> 54.230.30.193 TCP 66 42229 > http [ACK] Seq=97 Ack=968245 Win=1178752 Len=0 TSval=36733461 TSecr=721122218
210   0.117782 54.230.30.193 -> 172.31.36.109 TCP 2962 [TCP segment of a reassembled PDU]
211   0.117802 172.31.36.109 -> 54.230.30.193 TCP 66 42229 > http [ACK] Seq=97 Ack=971141 Win=1175936 Len=0 TSval=36733461 TSecr=721122218
212   0.118205 54.230.30.193 -> 172.31.36.109 TCP 1514 [TCP segment of a reassembled PDU]
213   0.118469 54.230.30.193 -> 172.31.36.109 TCP 37714 [TCP segment of a reassembled PDU]
214   0.118500 172.31.36.109 -> 54.230.30.193 TCP 66 42229 > http [ACK] Seq=97 Ack=1010237 Win=1145472 Len=0 TSval=36733461 TSecr=721122218
215   0.118614 54.230.30.193 -> 172.31.36.109 TCP 20338 [TCP segment of a reassembled PDU]
216   0.118629 172.31.36.109 -> 54.230.30.193 TCP 66 42229 > http [ACK] Seq=97 Ack=1030509 Win=1174016 Len=0 TSval=36733461 TSecr=721122218
217   0.118657 54.230.30.193 -> 172.31.36.109 TCP 4410 [TCP segment of a reassembled PDU]
218   0.118667 172.31.36.109 -> 54.230.30.193 TCP 66 42229 > http [ACK] Seq=97 Ack=1034853 Win=1169792 Len=0 TSval=36733461 TSecr=721122218
219   0.118741 54.230.30.193 -> 172.31.36.109 TCP 1514 [TCP segment of a reassembled PDU]
220   0.119204 54.230.30.193 -> 172.31.36.109 TCP 2962 [TCP segment of a reassembled PDU]
221   0.119210 172.31.36.109 -> 54.230.30.193 TCP 66 42229 > http [ACK] Seq=97 Ack=1039197 Win=1201536 Len=0 TSval=36733461 TSecr=721122218
222   0.119312 54.230.30.193 -> 172.31.36.109 HTTP 9903 HTTP/1.1 200 OK  (application/octet-stream)
223   0.119334 172.31.36.109 -> 54.230.30.193 TCP 66 42229 > http [ACK] Seq=97 Ack=1049034 Win=1201536 Len=0 TSval=36733461 TSecr=721122218
224   0.119486 172.31.36.109 -> 54.230.30.193 TCP 66 42229 > http [FIN, ACK] Seq=97 Ack=1049034 Win=1201536 Len=0 TSval=36733461 TSecr=721122218
225   0.120510 54.230.30.193 -> 172.31.36.109 TCP 66 http > 42229 [FIN, ACK] Seq=1049034 Ack=98 Win=14592 Len=0 TSval=721122218 TSecr=36733461
226   0.120521 172.31.36.109 -> 54.230.30.193 TCP 66 42229 > http [ACK] Seq=98 Ack=1049035 Win=1201536 Len=0 TSval=36733462 TSecr=721122218
