[Measurement for 1mb at 17:36:47 19.36.2014] 
Tshark:

  1   0.000000 172.31.36.109 -> 172.31.0.2   DNS 89 Standard query 0x1ae2  A d1n0gskdvzj94j.cloudfront.net
  2   0.000027 172.31.36.109 -> 172.31.0.2   DNS 89 Standard query 0x18d0  AAAA d1n0gskdvzj94j.cloudfront.net
  3   0.000507   172.31.0.2 -> 172.31.36.109 DNS 217 Standard query response 0x1ae2  A 54.230.20.43 A 54.230.20.115 A 54.230.20.154 A 54.230.21.79 A 54.230.21.146 A 54.230.21.237 A 54.230.23.102 A 54.230.23.104
  4   0.000536   172.31.0.2 -> 172.31.36.109 DNS 176 Standard query response 0x18d0 
  5   0.003843 172.31.36.109 -> 54.230.20.43 TCP 74 51310 > http [SYN] Seq=0 Win=26883 Len=0 MSS=8961 SACK_PERM=1 TSval=20573427 TSecr=0 WS=128
  6   0.100641 54.230.20.43 -> 172.31.36.109 TCP 74 http > 51310 [SYN, ACK] Seq=0 Ack=1 Win=14480 Len=0 MSS=1460 SACK_PERM=1 TSval=947983434 TSecr=20573427 WS=128
  7   0.100675 172.31.36.109 -> 54.230.20.43 TCP 66 51310 > http [ACK] Seq=1 Ack=1 Win=27008 Len=0 TSval=20573452 TSecr=947983434
  8   0.100765 172.31.36.109 -> 54.230.20.43 HTTP 162 GET /1mb HTTP/1.1 
  9   0.197481 54.230.20.43 -> 172.31.36.109 TCP 66 http > 51310 [ACK] Seq=1 Ack=97 Win=14592 Len=0 TSval=947983444 TSecr=20573452
 10   0.305129 54.230.20.43 -> 172.31.36.109 TCP 5989 [TCP segment of a reassembled PDU]
 11   0.305146 172.31.36.109 -> 54.230.20.43 TCP 66 51310 > http [ACK] Seq=97 Ack=5924 Win=38784 Len=0 TSval=20573503 TSecr=947983455
 12   0.305155 54.230.20.43 -> 172.31.36.109 TCP 7306 [TCP segment of a reassembled PDU]
 13   0.305174 172.31.36.109 -> 54.230.20.43 TCP 66 51310 > http [ACK] Seq=97 Ack=13164 Win=53248 Len=0 TSval=20573503 TSecr=947983455
 14   0.401818 54.230.20.43 -> 172.31.36.109 TCP 10202 [TCP segment of a reassembled PDU]
 15   0.401829 172.31.36.109 -> 54.230.20.43 TCP 66 51310 > http [ACK] Seq=97 Ack=23300 Win=73600 Len=0 TSval=20573527 TSecr=947983465
 16   0.401950 54.230.20.43 -> 172.31.36.109 TCP 2962 [TCP segment of a reassembled PDU]
 17   0.401956 172.31.36.109 -> 54.230.20.43 TCP 66 51310 > http [ACK] Seq=97 Ack=26196 Win=79360 Len=0 TSval=20573527 TSecr=947983465
 18   0.431563 54.230.20.43 -> 172.31.36.109 TCP 4410 [TCP segment of a reassembled PDU]
 19   0.431571 172.31.36.109 -> 54.230.20.43 TCP 66 51310 > http [ACK] Seq=97 Ack=30540 Win=88064 Len=0 TSval=20573534 TSecr=947983468
 20   0.498623 54.230.20.43 -> 172.31.36.109 TCP 15994 [TCP segment of a reassembled PDU]
 21   0.498635 172.31.36.109 -> 54.230.20.43 TCP 66 51310 > http [ACK] Seq=97 Ack=46468 Win=91648 Len=0 TSval=20573551 TSecr=947983474
 22   0.528314 54.230.20.43 -> 172.31.36.109 TCP 5858 [TCP segment of a reassembled PDU]
 23   0.528321 172.31.36.109 -> 54.230.20.43 TCP 66 51310 > http [ACK] Seq=97 Ack=52260 Win=120704 Len=0 TSval=20573559 TSecr=947983477
 24   0.595298 54.230.20.43 -> 172.31.36.109 TCP 2962 [TCP segment of a reassembled PDU]
 25   0.595319 172.31.36.109 -> 54.230.20.43 TCP 66 51310 > http [ACK] Seq=97 Ack=55156 Win=126464 Len=0 TSval=20573575 TSecr=947983484
 26   0.595344 54.230.20.43 -> 172.31.36.109 TCP 10202 [TCP segment of a reassembled PDU]
 27   0.595352 172.31.36.109 -> 54.230.20.43 TCP 66 51310 > http [ACK] Seq=97 Ack=65292 Win=146688 Len=0 TSval=20573575 TSecr=947983484
 28   0.625060 54.230.20.43 -> 172.31.36.109 TCP 11650 [TCP segment of a reassembled PDU]
 29   0.625069 172.31.36.109 -> 54.230.20.43 TCP 66 51310 > http [ACK] Seq=97 Ack=76876 Win=169856 Len=0 TSval=20573583 TSecr=947983487
 30   0.692109 54.230.20.43 -> 172.31.36.109 TCP 15994 [TCP segment of a reassembled PDU]
