[Measurement for 1mb at 13:34:14 20.34.2014] 
Tshark:

  1   0.000000 172.31.36.109 -> 172.31.0.2   DNS 89 Standard query 0x8506  A d1n0gskdvzj94j.cloudfront.net
  2   0.000029 172.31.36.109 -> 172.31.0.2   DNS 89 Standard query 0xf3e3  AAAA d1n0gskdvzj94j.cloudfront.net
  3   0.000528   172.31.0.2 -> 172.31.36.109 DNS 176 Standard query response 0xf3e3 
  4   0.000539   172.31.0.2 -> 172.31.36.109 DNS 217 Standard query response 0x8506  A 54.230.23.210 A 216.137.41.10 A 54.230.20.101 A 54.230.21.222 A 54.230.22.127 A 54.230.22.245 A 54.230.23.48 A 54.230.23.144
  5   0.003877 172.31.36.109 -> 54.230.23.210 TCP 74 46982 > http [SYN] Seq=0 Win=26883 Len=0 MSS=8961 SACK_PERM=1 TSval=38535311 TSecr=0 WS=128
  6   0.093740 54.230.23.210 -> 172.31.36.109 TCP 74 http > 46982 [SYN, ACK] Seq=0 Ack=1 Win=14480 Len=0 MSS=1460 SACK_PERM=1 TSval=927120002 TSecr=38535311 WS=128
  7   0.093793 172.31.36.109 -> 54.230.23.210 TCP 66 46982 > http [ACK] Seq=1 Ack=1 Win=27008 Len=0 TSval=38535333 TSecr=927120002
  8   0.093912 172.31.36.109 -> 54.230.23.210 HTTP 162 GET /1mb HTTP/1.1 
  9   0.183658 54.230.23.210 -> 172.31.36.109 TCP 66 http > 46982 [ACK] Seq=1 Ack=97 Win=14592 Len=0 TSval=927120011 TSecr=38535333
 10   0.187904 54.230.23.210 -> 172.31.36.109 TCP 523 [TCP segment of a reassembled PDU]
 11   0.187920 172.31.36.109 -> 54.230.23.210 TCP 66 46982 > http [ACK] Seq=97 Ack=458 Win=28032 Len=0 TSval=38535357 TSecr=927120011
 12   0.188172 54.230.23.210 -> 172.31.36.109 TCP 4410 [TCP segment of a reassembled PDU]
 13   0.188180 172.31.36.109 -> 54.230.23.210 TCP 66 46982 > http [ACK] Seq=97 Ack=4802 Win=36736 Len=0 TSval=38535357 TSecr=927120011
 14   0.188257 54.230.23.210 -> 172.31.36.109 TCP 8754 [TCP segment of a reassembled PDU]
 15   0.188265 172.31.36.109 -> 54.230.23.210 TCP 66 46982 > http [ACK] Seq=97 Ack=13490 Win=54144 Len=0 TSval=38535357 TSecr=927120011
 16   0.277789 54.230.23.210 -> 172.31.36.109 TCP 2962 [TCP segment of a reassembled PDU]
 17   0.277816 172.31.36.109 -> 54.230.23.210 TCP 66 46982 > http [ACK] Seq=97 Ack=16386 Win=59904 Len=0 TSval=38535379 TSecr=927120020
 18   0.277836 54.230.23.210 -> 172.31.36.109 TCP 10202 [TCP segment of a reassembled PDU]
 19   0.277848 172.31.36.109 -> 54.230.23.210 TCP 66 46982 > http [ACK] Seq=97 Ack=26522 Win=80128 Len=0 TSval=38535379 TSecr=927120020
 20   0.367460 54.230.23.210 -> 172.31.36.109 TCP 13098 [TCP segment of a reassembled PDU]
 21   0.367490 172.31.36.109 -> 54.230.23.210 TCP 66 46982 > http [ACK] Seq=97 Ack=39554 Win=96512 Len=0 TSval=38535402 TSecr=927120029
 22   0.367518 54.230.23.210 -> 172.31.36.109 TCP 8754 [TCP segment of a reassembled PDU]
 23   0.367527 172.31.36.109 -> 54.230.23.210 TCP 66 46982 > http [ACK] Seq=97 Ack=48242 Win=87936 Len=0 TSval=38535402 TSecr=927120029
 24   0.457190 54.230.23.210 -> 172.31.36.109 TCP 14546 [TCP segment of a reassembled PDU]
