[Measurement for 1mb at 08:33:34 20.33.2014] 
Tshark:

  1   0.000000 172.31.36.109 -> 172.31.0.2   DNS 89 Standard query 0xc6fb  A d1n0gskdvzj94j.cloudfront.net
  2   0.000030 172.31.36.109 -> 172.31.0.2   DNS 89 Standard query 0x92d7  AAAA d1n0gskdvzj94j.cloudfront.net
  3   0.000590   172.31.0.2 -> 172.31.36.109 DNS 217 Standard query response 0xc6fb  A 54.230.30.230 A 54.230.30.254 A 54.192.29.221 A 54.192.30.191 A 54.192.30.218 A 54.230.30.67 A 54.230.30.215 A 54.230.30.217
  4   0.000634   172.31.0.2 -> 172.31.36.109 DNS 176 Standard query response 0x92d7 
  5   0.003880 172.31.36.109 -> 54.230.30.230 TCP 74 51356 > http [SYN] Seq=0 Win=26883 Len=0 MSS=8961 SACK_PERM=1 TSval=34025327 TSecr=0 WS=128
  6   0.005132 54.230.30.230 -> 172.31.36.109 TCP 74 http > 51356 [SYN, ACK] Seq=0 Ack=1 Win=14480 Len=0 MSS=1460 SACK_PERM=1 TSval=700227348 TSecr=34025327 WS=128
  7   0.005147 172.31.36.109 -> 54.230.30.230 TCP 66 51356 > http [ACK] Seq=1 Ack=1 Win=27008 Len=0 TSval=34025328 TSecr=700227348
  8   0.005187 172.31.36.109 -> 54.230.30.230 HTTP 162 GET /1mb HTTP/1.1 
  9   0.006388 54.230.30.230 -> 172.31.36.109 TCP 66 http > 51356 [ACK] Seq=1 Ack=97 Win=14592 Len=0 TSval=700227348 TSecr=34025328
 10   0.040155 54.230.30.230 -> 172.31.36.109 TCP 13098 [TCP segment of a reassembled PDU]
 11   0.040184 172.31.36.109 -> 54.230.30.230 TCP 66 51356 > http [ACK] Seq=97 Ack=13033 Win=52992 Len=0 TSval=34025336 TSecr=700227352
 12   0.041385 54.230.30.230 -> 172.31.36.109 TCP 4410 [TCP segment of a reassembled PDU]
 13   0.041392 172.31.36.109 -> 54.230.30.230 TCP 66 51356 > http [ACK] Seq=97 Ack=17377 Win=61696 Len=0 TSval=34025337 TSecr=700227352
 14   0.041431 54.230.30.230 -> 172.31.36.109 TCP 8754 [TCP segment of a reassembled PDU]
 15   0.041438 172.31.36.109 -> 54.230.30.230 TCP 66 51356 > http [ACK] Seq=97 Ack=26065 Win=79104 Len=0 TSval=34025337 TSecr=700227352
 16   0.042628 54.230.30.230 -> 172.31.36.109 TCP 5858 [TCP segment of a reassembled PDU]
 17   0.042635 172.31.36.109 -> 54.230.30.230 TCP 66 51356 > http [ACK] Seq=97 Ack=31857 Win=90624 Len=0 TSval=34025337 TSecr=700227352
 18   0.042657 54.230.30.230 -> 172.31.36.109 TCP 4410 [TCP segment of a reassembled PDU]
 19   0.042663 172.31.36.109 -> 54.230.30.230 TCP 66 51356 > http [ACK] Seq=97 Ack=36201 Win=99328 Len=0 TSval=34025337 TSecr=700227352
 20   0.042861 54.230.30.230 -> 172.31.36.109 TCP 2962 [TCP segment of a reassembled PDU]
 21   0.042866 172.31.36.109 -> 54.230.30.230 TCP 66 51356 > http [ACK] Seq=97 Ack=39097 Win=105088 Len=0 TSval=34025337 TSecr=700227352
 22   0.043646 54.230.30.230 -> 172.31.36.109 TCP 2962 [TCP segment of a reassembled PDU]
 23   0.043664 172.31.36.109 -> 54.230.30.230 TCP 66 51356 > http [ACK] Seq=97 Ack=41993 Win=109056 Len=0 TSval=34025337 TSecr=700227352
 24   0.043694 54.230.30.230 -> 172.31.36.109 TCP 4410 [TCP segment of a reassembled PDU]
 25   0.043698 172.31.36.109 -> 54.230.30.230 TCP 66 51356 > http [ACK] Seq=97 Ack=46337 Win=105984 Len=0 TSval=34025337 TSecr=700227352
 26   0.043946 54.230.30.230 -> 172.31.36.109 TCP 5858 [TCP segment of a reassembled PDU]
 27   0.043952 172.31.36.109 -> 54.230.30.230 TCP 66 51356 > http [ACK] Seq=97 Ack=52129 Win=120704 Len=0 TSval=34025337 TSecr=700227352
 28   0.043972 54.230.30.230 -> 172.31.36.109 TCP 10202 [TCP segment of a reassembled PDU]
 29   0.043978 172.31.36.109 -> 54.230.30.230 TCP 66 51356 > http [ACK] Seq=97 Ack=62265 Win=140928 Len=0 TSval=34025337 TSecr=700227352
 30   0.044691 54.230.30.230 -> 172.31.36.109 TCP 2962 [TCP segment of a reassembled PDU]
 31   0.044696 172.31.36.109 -> 54.230.30.230 TCP 66 51356 > http [ACK] Seq=97 Ack=65161 Win=146688 Len=0 TSval=34025338 TSecr=700227352
 32   0.045213 54.230.30.230 -> 172.31.36.109 TCP 5858 [TCP segment of a reassembled PDU]
 33   0.045219 172.31.36.109 -> 54.230.30.230 TCP 66 51356 > http [ACK] Seq=97 Ack=70953 Win=158336 Len=0 TSval=34025338 TSecr=700227352
 34   0.045340 54.230.30.230 -> 172.31.36.109 TCP 7306 [TCP segment of a reassembled PDU]
 35   0.045346 172.31.36.109 -> 54.230.30.230 TCP 66 51356 > http [ACK] Seq=97 Ack=78193 Win=172800 Len=0 TSval=34025338 TSecr=700227352
 36   0.045388 54.230.30.230 -> 172.31.36.109 TCP 4410 [TCP segment of a reassembled PDU]
 37   0.045393 172.31.36.109 -> 54.230.30.230 TCP 66 51356 > http [ACK] Seq=97 Ack=82537 Win=181504 Len=0 TSval=34025338 TSecr=700227352
 38   0.045556 54.230.30.230 -> 172.31.36.109 TCP 8754 [TCP segment of a reassembled PDU]
 39   0.045569 172.31.36.109 -> 54.230.30.230 TCP 66 51356 > http [ACK] Seq=97 Ack=91225 Win=193024 Len=0 TSval=34025338 TSecr=700227352
 40   0.046533 54.230.30.230 -> 172.31.36.109 TCP 5858 [TCP segment of a reassembled PDU]
 41   0.046541 172.31.36.109 -> 54.230.30.230 TCP 66 51356 > http [ACK] Seq=97 Ack=97017 Win=197760 Len=0 TSval=34025338 TSecr=700227352
 42   0.046629 54.230.30.230 -> 172.31.36.109 TCP 8754 [TCP segment of a reassembled PDU]
 43   0.046637 172.31.36.109 -> 54.230.30.230 TCP 66 51356 > http [ACK] Seq=97 Ack=105705 Win=193024 Len=0 TSval=34025338 TSecr=700227352
 44   0.046687 54.230.30.230 -> 172.31.36.109 TCP 7306 [TCP segment of a reassembled PDU]
 45   0.046694 172.31.36.109 -> 54.230.30.230 TCP 66 51356 > http [ACK] Seq=97 Ack=112945 Win=195328 Len=0 TSval=34025338 TSecr=700227352
 46   0.046790 54.230.30.230 -> 172.31.36.109 TCP 4410 [TCP segment of a reassembled PDU]
 47   0.046795 172.31.36.109 -> 54.230.30.230 TCP 66 51356 > http [ACK] Seq=97 Ack=117289 Win=200064 Len=0 TSval=34025338 TSecr=700227352
 48   0.047747 54.230.30.230 -> 172.31.36.109 TCP 5858 [TCP segment of a reassembled PDU]
 49   0.047753 172.31.36.109 -> 54.230.30.230 TCP 66 51356 > http [ACK] Seq=97 Ack=123081 Win=197760 Len=0 TSval=34025338 TSecr=700227352
 50   0.047889 54.230.30.230 -> 172.31.36.109 TCP 7306 [TCP segment of a reassembled PDU]
 51   0.047897 172.31.36.109 -> 54.230.30.230 TCP 66 51356 > http [ACK] Seq=97 Ack=130321 Win=195328 Len=0 TSval=34025338 TSecr=700227352
 52   0.047908 54.230.30.230 -> 172.31.36.109 TCP 2962 [TCP segment of a reassembled PDU]
 53   0.048148 54.230.30.230 -> 172.31.36.109 TCP 11650 [TCP segment of a reassembled PDU]
 54   0.048177 54.230.30.230 -> 172.31.36.109 TCP 11650 [TCP segment of a reassembled PDU]
 55   0.048291 172.31.36.109 -> 54.230.30.230 TCP 66 51356 > http [ACK] Seq=97 Ack=156385 Win=169344 Len=0 TSval=34025338 TSecr=700227352
 56   0.049054 54.230.30.230 -> 172.31.36.109 TCP 2962 [TCP segment of a reassembled PDU]
 57   0.049060 172.31.36.109 -> 54.230.30.230 TCP 66 51356 > http [ACK] Seq=97 Ack=159281 Win=202496 Len=0 TSval=34025339 TSecr=700227353
 58   0.049260 54.230.30.230 -> 172.31.36.109 TCP 14546 [TCP segment of a reassembled PDU]
 59   0.049280 172.31.36.109 -> 54.230.30.230 TCP 66 51356 > http [ACK] Seq=97 Ack=173761 Win=236544 Len=0 TSval=34025339 TSecr=700227353
 60   0.049334 54.230.30.230 -> 172.31.36.109 TCP 1514 [TCP segment of a reassembled PDU]
 61   0.049339 172.31.36.109 -> 54.230.30.230 TCP 66 51356 > http [ACK] Seq=97 Ack=175209 Win=239360 Len=0 TSval=34025339 TSecr=700227353
 62   0.049658 54.230.30.230 -> 172.31.36.109 TCP 7306 [TCP segment of a reassembled PDU]
 63   0.049665 172.31.36.109 -> 54.230.30.230 TCP 66 51356 > http [ACK] Seq=97 Ack=182449 Win=253824 Len=0 TSval=34025339 TSecr=700227353
 64   0.049685 54.230.30.230 -> 172.31.36.109 TCP 7306 [TCP segment of a reassembled PDU]
 65   0.049689 172.31.36.109 -> 54.230.30.230 TCP 66 51356 > http [ACK] Seq=97 Ack=189689 Win=268288 Len=0 TSval=34025339 TSecr=700227353
 66   0.049824 54.230.30.230 -> 172.31.36.109 TCP 5858 [TCP segment of a reassembled PDU]
 67   0.049830 172.31.36.109 -> 54.230.30.230 TCP 66 51356 > http [ACK] Seq=97 Ack=195481 Win=279936 Len=0 TSval=34025339 TSecr=700227353
 68   0.049915 54.230.30.230 -> 172.31.36.109 TCP 1514 [TCP Previous segment not captured] [TCP segment of a reassembled PDU]
 69   0.049920 172.31.36.109 -> 54.230.30.230 TCP 78 [TCP Window Update] 51356 > http [ACK] Seq=97 Ack=195481 Win=282880 Len=0 TSval=34025339 TSecr=700227353 SLE=196929 SRE=198377
 70   0.049925 54.230.30.230 -> 172.31.36.109 TCP 1514 [TCP Out-Of-Order] [TCP segment of a reassembled PDU]
 71   0.049929 172.31.36.109 -> 54.230.30.230 TCP 66 51356 > http [ACK] Seq=97 Ack=198377 Win=285696 Len=0 TSval=34025339 TSecr=700227353
 72   0.049933 54.230.30.230 -> 172.31.36.109 TCP 4410 [TCP segment of a reassembled PDU]
 73   0.049937 172.31.36.109 -> 54.230.30.230 TCP 66 51356 > http [ACK] Seq=97 Ack=202721 Win=294400 Len=0 TSval=34025339 TSecr=700227353
 74   0.050322 54.230.30.230 -> 172.31.36.109 TCP 4410 [TCP segment of a reassembled PDU]
 75   0.050328 172.31.36.109 -> 54.230.30.230 TCP 66 51356 > http [ACK] Seq=97 Ack=207065 Win=303104 Len=0 TSval=34025339 TSecr=700227353
 76   0.050432 54.230.30.230 -> 172.31.36.109 TCP 1514 [TCP segment of a reassembled PDU]
 77   0.050437 172.31.36.109 -> 54.230.30.230 TCP 66 51356 > http [ACK] Seq=97 Ack=208513 Win=306048 Len=0 TSval=34025339 TSecr=700227353
 78   0.050632 54.230.30.230 -> 172.31.36.109 TCP 10202 [TCP segment of a reassembled PDU]
 79   0.050640 172.31.36.109 -> 54.230.30.230 TCP 66 51356 > http [ACK] Seq=97 Ack=218649 Win=326272 Len=0 TSval=34025339 TSecr=700227353
 80   0.050682 54.230.30.230 -> 172.31.36.109 TCP 7306 [TCP segment of a reassembled PDU]
 81   0.050689 172.31.36.109 -> 54.230.30.230 TCP 66 51356 > http [ACK] Seq=97 Ack=225889 Win=340736 Len=0 TSval=34025339 TSecr=700227353
 82   0.051055 54.230.30.230 -> 172.31.36.109 TCP 1514 [TCP segment of a reassembled PDU]
 83   0.051059 172.31.36.109 -> 54.230.30.230 TCP 66 51356 > http [ACK] Seq=97 Ack=227337 Win=343680 Len=0 TSval=34025339 TSecr=700227353
 84   0.051231 54.230.30.230 -> 172.31.36.109 TCP 10202 [TCP segment of a reassembled PDU]
 85   0.051239 172.31.36.109 -> 54.230.30.230 TCP 66 51356 > http [ACK] Seq=97 Ack=237473 Win=363904 Len=0 TSval=34025339 TSecr=700227353
 86   0.051353 54.230.30.230 -> 172.31.36.109 TCP 5858 [TCP segment of a reassembled PDU]
 87   0.051360 172.31.36.109 -> 54.230.30.230 TCP 66 51356 > http [ACK] Seq=97 Ack=243265 Win=375552 Len=0 TSval=34025339 TSecr=700227353
 88   0.051413 54.230.30.230 -> 172.31.36.109 TCP 8754 [TCP segment of a reassembled PDU]
 89   0.051421 172.31.36.109 -> 54.230.30.230 TCP 66 51356 > http [ACK] Seq=97 Ack=251953 Win=392832 Len=0 TSval=34025339 TSecr=700227353
 90   0.051579 54.230.30.230 -> 172.31.36.109 TCP 2962 [TCP segment of a reassembled PDU]
 91   0.051584 172.31.36.109 -> 54.230.30.230 TCP 66 51356 > http [ACK] Seq=97 Ack=254849 Win=398720 Len=0 TSval=34025339 TSecr=700227353
 92   0.051797 54.230.30.230 -> 172.31.36.109 TCP 2962 [TCP segment of a reassembled PDU]
 93   0.051803 172.31.36.109 -> 54.230.30.230 TCP 66 51356 > http [ACK] Seq=97 Ack=257745 Win=404480 Len=0 TSval=34025339 TSecr=700227353
 94   0.051922 54.230.30.230 -> 172.31.36.109 TCP 10202 [TCP segment of a reassembled PDU]
 95   0.051929 172.31.36.109 -> 54.230.30.230 TCP 66 51356 > http [ACK] Seq=97 Ack=267881 Win=424704 Len=0 TSval=34025339 TSecr=700227353
 96   0.052170 54.230.30.230 -> 172.31.36.109 TCP 21786 [TCP segment of a reassembled PDU]
 97   0.052182 172.31.36.109 -> 54.230.30.230 TCP 66 51356 > http [ACK] Seq=97 Ack=289601 Win=468224 Len=0 TSval=34025339 TSecr=700227353
 98   0.052599 54.230.30.230 -> 172.31.36.109 TCP 1514 [TCP segment of a reassembled PDU]
 99   0.052604 172.31.36.109 -> 54.230.30.230 TCP 66 51356 > http [ACK] Seq=97 Ack=291049 Win=471040 Len=0 TSval=34025339 TSecr=700227353
100   0.052759 54.230.30.230 -> 172.31.36.109 TCP 24682 [TCP segment of a reassembled PDU]
101   0.052772 172.31.36.109 -> 54.230.30.230 TCP 66 51356 > http [ACK] Seq=97 Ack=315665 Win=520320 Len=0 TSval=34025340 TSecr=700227353
102   0.053125 54.230.30.230 -> 172.31.36.109 TCP 5858 [TCP segment of a reassembled PDU]
103   0.053131 172.31.36.109 -> 54.230.30.230 TCP 66 51356 > http [ACK] Seq=97 Ack=321457 Win=531840 Len=0 TSval=34025340 TSecr=700227353
104   0.053237 54.230.30.230 -> 172.31.36.109 TCP 8754 [TCP segment of a reassembled PDU]
105   0.053245 172.31.36.109 -> 54.230.30.230 TCP 66 51356 > http [ACK] Seq=97 Ack=330145 Win=549248 Len=0 TSval=34025340 TSecr=700227353
106   0.053455 54.230.30.230 -> 172.31.36.109 TCP 11650 [TCP segment of a reassembled PDU]
107   0.053464 172.31.36.109 -> 54.230.30.230 TCP 66 51356 > http [ACK] Seq=97 Ack=341729 Win=572416 Len=0 TSval=34025340 TSecr=700227353
108   0.053649 54.230.30.230 -> 172.31.36.109 TCP 1514 [TCP segment of a reassembled PDU]
109   0.053654 172.31.36.109 -> 54.230.30.230 TCP 66 51356 > http [ACK] Seq=97 Ack=343177 Win=575360 Len=0 TSval=34025340 TSecr=700227353
110   0.053881 54.230.30.230 -> 172.31.36.109 TCP 8754 [TCP segment of a reassembled PDU]
111   0.053888 172.31.36.109 -> 54.230.30.230 TCP 66 51356 > http [ACK] Seq=97 Ack=351865 Win=592640 Len=0 TSval=34025340 TSecr=700227353
112   0.054038 54.230.30.230 -> 172.31.36.109 TCP 15994 [TCP segment of a reassembled PDU]
113   0.054048 172.31.36.109 -> 54.230.30.230 TCP 66 51356 > http [ACK] Seq=97 Ack=367793 Win=624512 Len=0 TSval=34025340 TSecr=700227353
114   0.054064 54.230.30.230 -> 172.31.36.109 TCP 10202 [TCP segment of a reassembled PDU]
115   0.054073 172.31.36.109 -> 54.230.30.230 TCP 66 51356 > http [ACK] Seq=97 Ack=377929 Win=644864 Len=0 TSval=34025340 TSecr=700227353
116   0.054105 54.230.30.230 -> 172.31.36.109 TCP 2962 [TCP segment of a reassembled PDU]
117   0.054109 172.31.36.109 -> 54.230.30.230 TCP 66 51356 > http [ACK] Seq=97 Ack=380825 Win=650624 Len=0 TSval=34025340 TSecr=700227353
118   0.054410 54.230.30.230 -> 172.31.36.109 TCP 1514 [TCP segment of a reassembled PDU]
119   0.054415 172.31.36.109 -> 54.230.30.230 TCP 66 51356 > http [ACK] Seq=97 Ack=382273 Win=653568 Len=0 TSval=34025340 TSecr=700227353
120   0.054541 54.230.30.230 -> 172.31.36.109 TCP 13098 [TCP segment of a reassembled PDU]
121   0.054550 172.31.36.109 -> 54.230.30.230 TCP 66 51356 > http [ACK] Seq=97 Ack=395305 Win=679552 Len=0 TSval=34025340 TSecr=700227353
122   0.054628 54.230.30.230 -> 172.31.36.109 TCP 7306 [TCP segment of a reassembled PDU]
123   0.054635 172.31.36.109 -> 54.230.30.230 TCP 66 51356 > http [ACK] Seq=97 Ack=402545 Win=694016 Len=0 TSval=34025340 TSecr=700227353
124   0.054717 54.230.30.230 -> 172.31.36.109 TCP 8754 [TCP segment of a reassembled PDU]
125   0.054724 172.31.36.109 -> 54.230.30.230 TCP 66 51356 > http [ACK] Seq=97 Ack=411233 Win=711424 Len=0 TSval=34025340 TSecr=700227353
126   0.055198 54.230.30.230 -> 172.31.36.109 TCP 1514 [TCP segment of a reassembled PDU]
127   0.055202 172.31.36.109 -> 54.230.30.230 TCP 66 51356 > http [ACK] Seq=97 Ack=412681 Win=714368 Len=0 TSval=34025340 TSecr=700227353
128   0.055318 54.230.30.230 -> 172.31.36.109 TCP 14546 [TCP segment of a reassembled PDU]
129   0.055327 172.31.36.109 -> 54.230.30.230 TCP 66 51356 > http [ACK] Seq=97 Ack=427161 Win=743296 Len=0 TSval=34025340 TSecr=700227353
130   0.055393 54.230.30.230 -> 172.31.36.109 TCP 1514 [TCP segment of a reassembled PDU]
131   0.055398 172.31.36.109 -> 54.230.30.230 TCP 66 51356 > http [ACK] Seq=97 Ack=428609 Win=746240 Len=0 TSval=34025340 TSecr=700227353
132   0.055508 54.230.30.230 -> 172.31.36.109 TCP 17442 [TCP segment of a reassembled PDU]
133   0.055518 172.31.36.109 -> 54.230.30.230 TCP 66 51356 > http [ACK] Seq=97 Ack=445985 Win=780928 Len=0 TSval=34025340 TSecr=700227353
134   0.055692 54.230.30.230 -> 172.31.36.109 TCP 4410 [TCP segment of a reassembled PDU]
135   0.055698 172.31.36.109 -> 54.230.30.230 TCP 66 51356 > http [ACK] Seq=97 Ack=450329 Win=789632 Len=0 TSval=34025340 TSecr=700227353
136   0.055901 54.230.30.230 -> 172.31.36.109 TCP 5858 [TCP segment of a reassembled PDU]
137   0.055908 172.31.36.109 -> 54.230.30.230 TCP 66 51356 > http [ACK] Seq=97 Ack=456121 Win=801152 Len=0 TSval=34025340 TSecr=700227353
138   0.056078 54.230.30.230 -> 172.31.36.109 TCP 31922 [TCP segment of a reassembled PDU]
139   0.056094 172.31.36.109 -> 54.230.30.230 TCP 66 51356 > http [ACK] Seq=97 Ack=487977 Win=830592 Len=0 TSval=34025340 TSecr=700227353
140   0.056422 54.230.30.230 -> 172.31.36.109 TCP 1514 [TCP segment of a reassembled PDU]
141   0.056427 172.31.36.109 -> 54.230.30.230 TCP 66 51356 > http [ACK] Seq=97 Ack=489425 Win=867840 Len=0 TSval=34025340 TSecr=700227353
142   0.056543 54.230.30.230 -> 172.31.36.109 TCP 7306 [TCP segment of a reassembled PDU]
143   0.056550 172.31.36.109 -> 54.230.30.230 TCP 66 51356 > http [ACK] Seq=97 Ack=496665 Win=871168 Len=0 TSval=34025340 TSecr=700227353
144   0.056742 54.230.30.230 -> 172.31.36.109 TCP 11650 [TCP segment of a reassembled PDU]
145   0.056750 172.31.36.109 -> 54.230.30.230 TCP 66 51356 > http [ACK] Seq=97 Ack=508249 Win=864000 Len=0 TSval=34025341 TSecr=700227353
146   0.056859 54.230.30.230 -> 172.31.36.109 TCP 20338 [TCP segment of a reassembled PDU]
147   0.056871 172.31.36.109 -> 54.230.30.230 TCP 66 51356 > http [ACK] Seq=97 Ack=528521 Win=849664 Len=0 TSval=34025341 TSecr=700227353
148   0.056944 54.230.30.230 -> 172.31.36.109 TCP 7306 [TCP segment of a reassembled PDU]
149   0.056952 172.31.36.109 -> 54.230.30.230 TCP 66 51356 > http [ACK] Seq=97 Ack=535761 Win=871168 Len=0 TSval=34025341 TSecr=700227353
150   0.057043 54.230.30.230 -> 172.31.36.109 TCP 11650 [TCP segment of a reassembled PDU]
151   0.057051 172.31.36.109 -> 54.230.30.230 TCP 66 51356 > http [ACK] Seq=97 Ack=547345 Win=864000 Len=0 TSval=34025341 TSecr=700227353
152   0.057258 54.230.30.230 -> 172.31.36.109 TCP 8754 [TCP segment of a reassembled PDU]
153   0.057266 172.31.36.109 -> 54.230.30.230 TCP 66 51356 > http [ACK] Seq=97 Ack=556033 Win=868736 Len=0 TSval=34025341 TSecr=700227353
154   0.057351 54.230.30.230 -> 172.31.36.109 TCP 4410 [TCP segment of a reassembled PDU]
155   0.057356 172.31.36.109 -> 54.230.30.230 TCP 66 51356 > http [ACK] Seq=97 Ack=560377 Win=875904 Len=0 TSval=34025341 TSecr=700227353
156   0.057462 54.230.30.230 -> 172.31.36.109 TCP 5858 [TCP segment of a reassembled PDU]
157   0.057468 172.31.36.109 -> 54.230.30.230 TCP 66 51356 > http [ACK] Seq=97 Ack=566169 Win=873472 Len=0 TSval=34025341 TSecr=700227353
158   0.057582 54.230.30.230 -> 172.31.36.109 TCP 10202 [TCP segment of a reassembled PDU]
159   0.057590 172.31.36.109 -> 54.230.30.230 TCP 66 51356 > http [ACK] Seq=97 Ack=576305 Win=866432 Len=0 TSval=34025341 TSecr=700227353
160   0.057976 54.230.30.230 -> 172.31.36.109 TCP 1514 [TCP segment of a reassembled PDU]
161   0.057980 172.31.36.109 -> 54.230.30.230 TCP 66 51356 > http [ACK] Seq=97 Ack=577753 Win=878976 Len=0 TSval=34025341 TSecr=700227354
162   0.058122 54.230.30.230 -> 172.31.36.109 TCP 13098 [TCP segment of a reassembled PDU]
163   0.058131 172.31.36.109 -> 54.230.30.230 TCP 66 51356 > http [ACK] Seq=97 Ack=590785 Win=866048 Len=0 TSval=34025341 TSecr=700227354
164   0.058195 54.230.30.230 -> 172.31.36.109 TCP 1514 [TCP segment of a reassembled PDU]
165   0.058200 172.31.36.109 -> 54.230.30.230 TCP 66 51356 > http [ACK] Seq=97 Ack=592233 Win=878976 Len=0 TSval=34025341 TSecr=700227354
166   0.058333 54.230.30.230 -> 172.31.36.109 TCP 13098 [TCP segment of a reassembled PDU]
167   0.058341 172.31.36.109 -> 54.230.30.230 TCP 66 51356 > http [ACK] Seq=97 Ack=605265 Win=866048 Len=0 TSval=34025341 TSecr=700227354
168   0.058457 54.230.30.230 -> 172.31.36.109 TCP 23234 [TCP segment of a reassembled PDU]
169   0.058470 172.31.36.109 -> 54.230.30.230 TCP 66 51356 > http [ACK] Seq=97 Ack=628433 Win=844928 Len=0 TSval=34025341 TSecr=700227354
170   0.058515 54.230.30.230 -> 172.31.36.109 TCP 7306 [TCP segment of a reassembled PDU]
171   0.058521 172.31.36.109 -> 54.230.30.230 TCP 66 51356 > http [ACK] Seq=97 Ack=635673 Win=871168 Len=0 TSval=34025341 TSecr=700227354
172   0.058606 54.230.30.230 -> 172.31.36.109 TCP 5858 [TCP segment of a reassembled PDU]
173   0.058612 172.31.36.109 -> 54.230.30.230 TCP 66 51356 > http [ACK] Seq=97 Ack=641465 Win=865408 Len=0 TSval=34025341 TSecr=700227354
174   0.058906 54.230.30.230 -> 172.31.36.109 TCP 40610 [TCP segment of a reassembled PDU]
175   0.058926 172.31.36.109 -> 54.230.30.230 TCP 66 51356 > http [ACK] Seq=97 Ack=682009 Win=824960 Len=0 TSval=34025341 TSecr=700227354
176   0.059011 54.230.30.230 -> 172.31.36.109 TCP 2962 [TCP segment of a reassembled PDU]
177   0.059017 172.31.36.109 -> 54.230.30.230 TCP 66 51356 > http [ACK] Seq=97 Ack=684905 Win=878208 Len=0 TSval=34025341 TSecr=700227354
178   0.059274 54.230.30.230 -> 172.31.36.109 TCP 1514 [TCP segment of a reassembled PDU]
179   0.059487 54.230.30.230 -> 172.31.36.109 TCP 2962 [TCP segment of a reassembled PDU]
180   0.059492 172.31.36.109 -> 54.230.30.230 TCP 66 51356 > http [ACK] Seq=97 Ack=689249 Win=878208 Len=0 TSval=34025341 TSecr=700227354
181   0.059672 54.230.30.230 -> 172.31.36.109 TCP 30474 [TCP segment of a reassembled PDU]
182   0.059699 172.31.36.109 -> 54.230.30.230 TCP 66 51356 > http [ACK] Seq=97 Ack=719657 Win=847872 Len=0 TSval=34025341 TSecr=700227354
183   0.059813 54.230.30.230 -> 172.31.36.109 TCP 17442 [TCP segment of a reassembled PDU]
184   0.059823 172.31.36.109 -> 54.230.30.230 TCP 66 51356 > http [ACK] Seq=97 Ack=737033 Win=854400 Len=0 TSval=34025341 TSecr=700227354
185   0.059911 54.230.30.230 -> 172.31.36.109 TCP 13098 [TCP segment of a reassembled PDU]
186   0.059919 172.31.36.109 -> 54.230.30.230 TCP 66 51356 > http [ACK] Seq=97 Ack=750065 Win=861696 Len=0 TSval=34025341 TSecr=700227354
187   0.059981 54.230.30.230 -> 172.31.36.109 TCP 1514 [TCP segment of a reassembled PDU]
188   0.060140 54.230.30.230 -> 172.31.36.109 TCP 18890 [TCP segment of a reassembled PDU]
189   0.060163 172.31.36.109 -> 54.230.30.230 TCP 66 51356 > http [ACK] Seq=97 Ack=770337 Win=852096 Len=0 TSval=34025341 TSecr=700227354
190   0.060206 54.230.30.230 -> 172.31.36.109 TCP 4410 [TCP segment of a reassembled PDU]
191   0.060212 172.31.36.109 -> 54.230.30.230 TCP 66 51356 > http [ACK] Seq=97 Ack=774681 Win=875904 Len=0 TSval=34025341 TSecr=700227354
192   0.060289 54.230.30.230 -> 172.31.36.109 TCP 1514 [TCP segment of a reassembled PDU]
193   0.060454 54.230.30.230 -> 172.31.36.109 TCP 23234 [TCP segment of a reassembled PDU]
194   0.060477 172.31.36.109 -> 54.230.30.230 TCP 66 51356 > http [ACK] Seq=97 Ack=799297 Win=851328 Len=0 TSval=34025341 TSecr=700227354
195   0.060498 54.230.30.230 -> 172.31.36.109 TCP 5858 [TCP segment of a reassembled PDU]
196   0.060504 172.31.36.109 -> 54.230.30.230 TCP 66 51356 > http [ACK] Seq=97 Ack=805089 Win=873472 Len=0 TSval=34025341 TSecr=700227354
197   0.060595 54.230.30.230 -> 172.31.36.109 TCP 13098 [TCP segment of a reassembled PDU]
198   0.060616 172.31.36.109 -> 54.230.30.230 TCP 66 51356 > http [ACK] Seq=97 Ack=818121 Win=878976 Len=0 TSval=34025341 TSecr=700227354
199   0.060841 54.230.30.230 -> 172.31.36.109 TCP 1514 [TCP segment of a reassembled PDU]
200   0.061004 54.230.30.230 -> 172.31.36.109 TCP 1514 [TCP segment of a reassembled PDU]
201   0.061009 172.31.36.109 -> 54.230.30.230 TCP 66 51356 > http [ACK] Seq=97 Ack=821017 Win=881920 Len=0 TSval=34025342 TSecr=700227354
202   0.061152 54.230.30.230 -> 172.31.36.109 TCP 15994 [TCP segment of a reassembled PDU]
203   0.061162 172.31.36.109 -> 54.230.30.230 TCP 66 51356 > http [ACK] Seq=97 Ack=836945 Win=913792 Len=0 TSval=34025342 TSecr=700227354
204   0.061176 54.230.30.230 -> 172.31.36.109 TCP 11650 [TCP segment of a reassembled PDU]
205   0.061183 172.31.36.109 -> 54.230.30.230 TCP 66 51356 > http [ACK] Seq=97 Ack=848529 Win=936960 Len=0 TSval=34025342 TSecr=700227354
206   0.061255 54.230.30.230 -> 172.31.36.109 TCP 1514 [TCP segment of a reassembled PDU]
207   0.061260 172.31.36.109 -> 54.230.30.230 TCP 66 51356 > http [ACK] Seq=97 Ack=849977 Win=939904 Len=0 TSval=34025342 TSecr=700227354
208   0.061266 54.230.30.230 -> 172.31.36.109 TCP 1514 [TCP Previous segment not captured] [TCP segment of a reassembled PDU]
209   0.061269 172.31.36.109 -> 54.230.30.230 TCP 78 [TCP Window Update] 51356 > http [ACK] Seq=97 Ack=849977 Win=942720 Len=0 TSval=34025342 TSecr=700227354 SLE=851425 SRE=852873
210   0.061271 54.230.30.230 -> 172.31.36.109 TCP 1514 [TCP Out-Of-Order] [TCP segment of a reassembled PDU]
211   0.061273 172.31.36.109 -> 54.230.30.230 TCP 66 51356 > http [ACK] Seq=97 Ack=852873 Win=945664 Len=0 TSval=34025342 TSecr=700227354
212   0.061278 54.230.30.230 -> 172.31.36.109 TCP 4410 [TCP segment of a reassembled PDU]
213   0.061281 172.31.36.109 -> 54.230.30.230 TCP 66 51356 > http [ACK] Seq=97 Ack=857217 Win=954368 Len=0 TSval=34025342 TSecr=700227354
214   0.061396 54.230.30.230 -> 172.31.36.109 TCP 17442 [TCP segment of a reassembled PDU]
215   0.061406 172.31.36.109 -> 54.230.30.230 TCP 66 51356 > http [ACK] Seq=97 Ack=874593 Win=989056 Len=0 TSval=34025342 TSecr=700227354
216   0.061452 54.230.30.230 -> 172.31.36.109 TCP 4410 [TCP segment of a reassembled PDU]
217   0.061457 172.31.36.109 -> 54.230.30.230 TCP 66 51356 > http [ACK] Seq=97 Ack=878937 Win=997760 Len=0 TSval=34025342 TSecr=700227354
218   0.061537 54.230.30.230 -> 172.31.36.109 TCP 2962 [TCP segment of a reassembled PDU]
219   0.061543 172.31.36.109 -> 54.230.30.230 TCP 66 51356 > http [ACK] Seq=97 Ack=881833 Win=1003520 Len=0 TSval=34025342 TSecr=700227354
220   0.061696 54.230.30.230 -> 172.31.36.109 TCP 27578 [TCP segment of a reassembled PDU]
221   0.061710 172.31.36.109 -> 54.230.30.230 TCP 66 51356 > http [ACK] Seq=97 Ack=909345 Win=1058560 Len=0 TSval=34025342 TSecr=700227354
222   0.061779 54.230.30.230 -> 172.31.36.109 TCP 2962 [TCP segment of a reassembled PDU]
223   0.061785 172.31.36.109 -> 54.230.30.230 TCP 66 51356 > http [ACK] Seq=97 Ack=912241 Win=1064320 Len=0 TSval=34025342 TSecr=700227354
224   0.061933 54.230.30.230 -> 172.31.36.109 TCP 27578 [TCP segment of a reassembled PDU]
225   0.061948 172.31.36.109 -> 54.230.30.230 TCP 66 51356 > http [ACK] Seq=97 Ack=939753 Win=1119360 Len=0 TSval=34025342 TSecr=700227354
226   0.062089 54.230.30.230 -> 172.31.36.109 TCP 10202 [TCP segment of a reassembled PDU]
227   0.062097 172.31.36.109 -> 54.230.30.230 TCP 66 51356 > http [ACK] Seq=97 Ack=949889 Win=1139712 Len=0 TSval=34025342 TSecr=700227354
228   0.062216 54.230.30.230 -> 172.31.36.109 TCP 14546 [TCP segment of a reassembled PDU]
