[Measurement for 1mb at 05:33:47 20.33.2014] 
Tshark:

  1   0.000000 172.31.36.109 -> 172.31.0.2   DNS 89 Standard query 0x4cb8  A d1n0gskdvzj94j.cloudfront.net
  2   0.000024 172.31.36.109 -> 172.31.0.2   DNS 89 Standard query 0xd15a  AAAA d1n0gskdvzj94j.cloudfront.net
  3   0.000482   172.31.0.2 -> 172.31.36.109 DNS 217 Standard query response 0x4cb8  A 54.192.30.190 A 54.192.30.214 A 54.192.30.222 A 54.230.30.3 A 54.230.30.202 A 54.230.30.218 A 54.230.30.222 A 54.192.30.188
  4   0.000493   172.31.0.2 -> 172.31.36.109 DNS 176 Standard query response 0xd15a 
  5   0.003923 172.31.36.109 -> 54.192.30.190 TCP 74 44878 > http [SYN] Seq=0 Win=26883 Len=0 MSS=8961 SACK_PERM=1 TSval=31328604 TSecr=0 WS=128
  6   0.005083 54.192.30.190 -> 172.31.36.109 TCP 74 http > 44878 [SYN, ACK] Seq=0 Ack=1 Win=14480 Len=0 MSS=1460 SACK_PERM=1 TSval=635701342 TSecr=31328604 WS=128
  7   0.005098 172.31.36.109 -> 54.192.30.190 TCP 66 44878 > http [ACK] Seq=1 Ack=1 Win=27008 Len=0 TSval=31328605 TSecr=635701342
  8   0.005150 172.31.36.109 -> 54.192.30.190 HTTP 162 GET /1mb HTTP/1.1 
  9   0.006373 54.192.30.190 -> 172.31.36.109 TCP 66 http > 44878 [ACK] Seq=1 Ack=97 Win=14592 Len=0 TSval=635701342 TSecr=31328605
 10   0.018193 54.192.30.190 -> 172.31.36.109 TCP 1144 [TCP segment of a reassembled PDU]
 11   0.018200 172.31.36.109 -> 54.192.30.190 TCP 66 44878 > http [ACK] Seq=97 Ack=1079 Win=29056 Len=0 TSval=31328608 TSecr=635701343
 12   0.018212 54.192.30.190 -> 172.31.36.109 TCP 5858 [TCP segment of a reassembled PDU]
 13   0.018217 172.31.36.109 -> 54.192.30.190 TCP 66 44878 > http [ACK] Seq=97 Ack=6871 Win=40704 Len=0 TSval=31328608 TSecr=635701343
 14   0.018408 54.192.30.190 -> 172.31.36.109 TCP 7306 [TCP segment of a reassembled PDU]
 15   0.018415 172.31.36.109 -> 54.192.30.190 TCP 66 44878 > http [ACK] Seq=97 Ack=14111 Win=55168 Len=0 TSval=31328608 TSecr=635701343
 16   0.019540 54.192.30.190 -> 172.31.36.109 TCP 10202 [TCP segment of a reassembled PDU]
 17   0.019557 172.31.36.109 -> 54.192.30.190 TCP 66 44878 > http [ACK] Seq=97 Ack=24247 Win=75392 Len=0 TSval=31328608 TSecr=635701343
 18   0.019723 54.192.30.190 -> 172.31.36.109 TCP 2962 [TCP segment of a reassembled PDU]
 19   0.019737 172.31.36.109 -> 54.192.30.190 TCP 66 44878 > http [ACK] Seq=97 Ack=27143 Win=81280 Len=0 TSval=31328608 TSecr=635701343
 20   0.020835 54.192.30.190 -> 172.31.36.109 TCP 13098 [TCP segment of a reassembled PDU]
 21   0.020844 172.31.36.109 -> 54.192.30.190 TCP 66 44878 > http [ACK] Seq=97 Ack=40175 Win=96512 Len=0 TSval=31328608 TSecr=635701344
 22   0.021009 54.192.30.190 -> 172.31.36.109 TCP 7306 [TCP segment of a reassembled PDU]
 23   0.021016 172.31.36.109 -> 54.192.30.190 TCP 66 44878 > http [ACK] Seq=97 Ack=47415 Win=121728 Len=0 TSval=31328609 TSecr=635701344
 24   0.021022 54.192.30.190 -> 172.31.36.109 TCP 1514 [TCP segment of a reassembled PDU]
 25   0.021025 172.31.36.109 -> 54.192.30.190 TCP 66 44878 > http [ACK] Seq=97 Ack=48863 Win=124672 Len=0 TSval=31328609 TSecr=635701344
 26   0.022053 54.192.30.190 -> 172.31.36.109 TCP 2962 [TCP segment of a reassembled PDU]
 27   0.022065 172.31.36.109 -> 54.192.30.190 TCP 66 44878 > http [ACK] Seq=97 Ack=51759 Win=130432 Len=0 TSval=31328609 TSecr=635701344
 28   0.022258 54.192.30.190 -> 172.31.36.109 TCP 1514 [TCP segment of a reassembled PDU]
 29   0.022262 172.31.36.109 -> 54.192.30.190 TCP 66 44878 > http [ACK] Seq=97 Ack=53207 Win=133376 Len=0 TSval=31328609 TSecr=635701344
 30   0.022285 54.192.30.190 -> 172.31.36.109 TCP 10202 [TCP segment of a reassembled PDU]
 31   0.022290 172.31.36.109 -> 54.192.30.190 TCP 66 44878 > http [ACK] Seq=97 Ack=63343 Win=153600 Len=0 TSval=31328609 TSecr=635701344
 32   0.022347 54.192.30.190 -> 172.31.36.109 TCP 11650 [TCP segment of a reassembled PDU]
 33   0.022371 172.31.36.109 -> 54.192.30.190 TCP 66 44878 > http [ACK] Seq=97 Ack=74927 Win=176768 Len=0 TSval=31328609 TSecr=635701344
 34   0.023560 54.192.30.190 -> 172.31.36.109 TCP 8754 [TCP segment of a reassembled PDU]
 35   0.023567 172.31.36.109 -> 54.192.30.190 TCP 66 44878 > http [ACK] Seq=97 Ack=83615 Win=193024 Len=0 TSval=31328609 TSecr=635701344
 36   0.023620 54.192.30.190 -> 172.31.36.109 TCP 10202 [TCP segment of a reassembled PDU]
 37   0.023628 172.31.36.109 -> 54.192.30.190 TCP 66 44878 > http [ACK] Seq=97 Ack=93751 Win=190592 Len=0 TSval=31328609 TSecr=635701344
 38   0.023833 54.192.30.190 -> 172.31.36.109 TCP 5858 [TCP segment of a reassembled PDU]
 39   0.023863 172.31.36.109 -> 54.192.30.190 TCP 66 44878 > http [ACK] Seq=97 Ack=99543 Win=197760 Len=0 TSval=31328609 TSecr=635701344
 40   0.024865 54.192.30.190 -> 172.31.36.109 TCP 13098 [TCP segment of a reassembled PDU]
 41   0.024889 172.31.36.109 -> 54.192.30.190 TCP 66 44878 > http [ACK] Seq=97 Ack=112575 Win=185856 Len=0 TSval=31328610 TSecr=635701344
 42   0.024898 54.192.30.190 -> 172.31.36.109 TCP 7306 [TCP segment of a reassembled PDU]
 43   0.024902 172.31.36.109 -> 54.192.30.190 TCP 66 44878 > http [ACK] Seq=97 Ack=119815 Win=178688 Len=0 TSval=31328610 TSecr=635701344
 44   0.025152 54.192.30.190 -> 172.31.36.109 TCP 15994 [TCP segment of a reassembled PDU]
 45   0.025163 172.31.36.109 -> 54.192.30.190 TCP 66 44878 > http [ACK] Seq=97 Ack=135743 Win=237568 Len=0 TSval=31328610 TSecr=635701344
 46   0.026170 54.192.30.190 -> 172.31.36.109 TCP 7306 [TCP segment of a reassembled PDU]
 47   0.026178 172.31.36.109 -> 54.192.30.190 TCP 66 44878 > http [ACK] Seq=97 Ack=142983 Win=252032 Len=0 TSval=31328610 TSecr=635701344
 48   0.026271 54.192.30.190 -> 172.31.36.109 TCP 4410 [TCP segment of a reassembled PDU]
 49   0.026286 172.31.36.109 -> 54.192.30.190 TCP 66 44878 > http [ACK] Seq=97 Ack=147327 Win=260736 Len=0 TSval=31328610 TSecr=635701344
 50   0.026646 54.192.30.190 -> 172.31.36.109 TCP 2962 [TCP segment of a reassembled PDU]
 51   0.026655 172.31.36.109 -> 54.192.30.190 TCP 66 44878 > http [ACK] Seq=97 Ack=150223 Win=266624 Len=0 TSval=31328610 TSecr=635701344
 52   0.026795 54.192.30.190 -> 172.31.36.109 TCP 24682 [TCP segment of a reassembled PDU]
 53   0.026810 172.31.36.109 -> 54.192.30.190 TCP 66 44878 > http [ACK] Seq=97 Ack=174839 Win=315776 Len=0 TSval=31328610 TSecr=635701344
 54   0.027705 54.192.30.190 -> 172.31.36.109 TCP 7306 [TCP segment of a reassembled PDU]
 55   0.027713 172.31.36.109 -> 54.192.30.190 TCP 66 44878 > http [ACK] Seq=97 Ack=182079 Win=330240 Len=0 TSval=31328610 TSecr=635701344
 56   0.027782 54.192.30.190 -> 172.31.36.109 TCP 8754 [TCP segment of a reassembled PDU]
 57   0.027789 172.31.36.109 -> 54.192.30.190 TCP 66 44878 > http [ACK] Seq=97 Ack=190767 Win=347648 Len=0 TSval=31328610 TSecr=635701344
 58   0.028209 54.192.30.190 -> 172.31.36.109 TCP 13098 [TCP segment of a reassembled PDU]
 59   0.028218 172.31.36.109 -> 54.192.30.190 TCP 66 44878 > http [ACK] Seq=97 Ack=203799 Win=373760 Len=0 TSval=31328610 TSecr=635701344
 60   0.028332 54.192.30.190 -> 172.31.36.109 TCP 11650 [TCP segment of a reassembled PDU]
 61   0.028366 172.31.36.109 -> 54.192.30.190 TCP 66 44878 > http [ACK] Seq=97 Ack=215383 Win=396928 Len=0 TSval=31328610 TSecr=635701344
 62   0.029201 54.192.30.190 -> 172.31.36.109 TCP 8754 [TCP segment of a reassembled PDU]
 63   0.029218 172.31.36.109 -> 54.192.30.190 TCP 66 44878 > http [ACK] Seq=97 Ack=224071 Win=414208 Len=0 TSval=31328611 TSecr=635701344
 64   0.029334 54.192.30.190 -> 172.31.36.109 TCP 15994 [TCP segment of a reassembled PDU]
 65   0.029344 172.31.36.109 -> 54.192.30.190 TCP 66 44878 > http [ACK] Seq=97 Ack=239999 Win=446080 Len=0 TSval=31328611 TSecr=635701344
 66   0.029680 54.192.30.190 -> 172.31.36.109 TCP 2962 [TCP segment of a reassembled PDU]
 67   0.029685 172.31.36.109 -> 54.192.30.190 TCP 66 44878 > http [ACK] Seq=97 Ack=242895 Win=451968 Len=0 TSval=31328611 TSecr=635701344
 68   0.029846 54.192.30.190 -> 172.31.36.109 TCP 17442 [TCP segment of a reassembled PDU]
 69   0.029860 172.31.36.109 -> 54.192.30.190 TCP 66 44878 > http [ACK] Seq=97 Ack=260271 Win=486656 Len=0 TSval=31328611 TSecr=635701344
 70   0.029936 54.192.30.190 -> 172.31.36.109 TCP 4410 [TCP segment of a reassembled PDU]
 71   0.029942 172.31.36.109 -> 54.192.30.190 TCP 66 44878 > http [ACK] Seq=97 Ack=264615 Win=495360 Len=0 TSval=31328611 TSecr=635701344
 72   0.030008 54.192.30.190 -> 172.31.36.109 TCP 2962 [TCP segment of a reassembled PDU]
 73   0.030013 172.31.36.109 -> 54.192.30.190 TCP 66 44878 > http [ACK] Seq=97 Ack=267511 Win=501120 Len=0 TSval=31328611 TSecr=635701344
 74   0.030735 54.192.30.190 -> 172.31.36.109 TCP 11650 [TCP segment of a reassembled PDU]
 75   0.030771 172.31.36.109 -> 54.192.30.190 TCP 66 44878 > http [ACK] Seq=97 Ack=279095 Win=524288 Len=0 TSval=31328611 TSecr=635701345
 76   0.030852 54.192.30.190 -> 172.31.36.109 TCP 1514 [TCP segment of a reassembled PDU]
 77   0.030857 172.31.36.109 -> 54.192.30.190 TCP 66 44878 > http [ACK] Seq=97 Ack=280543 Win=527232 Len=0 TSval=31328611 TSecr=635701345
 78   0.030985 54.192.30.190 -> 172.31.36.109 TCP 17442 [TCP segment of a reassembled PDU]
 79   0.030995 172.31.36.109 -> 54.192.30.190 TCP 66 44878 > http [ACK] Seq=97 Ack=297919 Win=561920 Len=0 TSval=31328611 TSecr=635701345
 80   0.031043 54.192.30.190 -> 172.31.36.109 TCP 1514 [TCP segment of a reassembled PDU]
 81   0.031048 172.31.36.109 -> 54.192.30.190 TCP 66 44878 > http [ACK] Seq=97 Ack=299367 Win=564864 Len=0 TSval=31328611 TSecr=635701345
 82   0.031414 54.192.30.190 -> 172.31.36.109 TCP 24682 [TCP segment of a reassembled PDU]
 83   0.031428 172.31.36.109 -> 54.192.30.190 TCP 66 44878 > http [ACK] Seq=97 Ack=323983 Win=614144 Len=0 TSval=31328611 TSecr=635701345
 84   0.032239 54.192.30.190 -> 172.31.36.109 TCP 4410 [TCP segment of a reassembled PDU]
 85   0.032254 172.31.36.109 -> 54.192.30.190 TCP 66 44878 > http [ACK] Seq=97 Ack=328327 Win=622720 Len=0 TSval=31328611 TSecr=635701345
 86   0.032351 54.192.30.190 -> 172.31.36.109 TCP 13098 [TCP segment of a reassembled PDU]
 87   0.032359 172.31.36.109 -> 54.192.30.190 TCP 66 44878 > http [ACK] Seq=97 Ack=341359 Win=648832 Len=0 TSval=31328611 TSecr=635701345
 88   0.032562 54.192.30.190 -> 172.31.36.109 TCP 4410 [TCP segment of a reassembled PDU]
 89   0.032568 172.31.36.109 -> 54.192.30.190 TCP 66 44878 > http [ACK] Seq=97 Ack=345703 Win=657536 Len=0 TSval=31328611 TSecr=635701345
 90   0.032843 54.192.30.190 -> 172.31.36.109 TCP 13098 [TCP segment of a reassembled PDU]
 91   0.032852 172.31.36.109 -> 54.192.30.190 TCP 66 44878 > http [ACK] Seq=97 Ack=358735 Win=683648 Len=0 TSval=31328611 TSecr=635701345
 92   0.033024 54.192.30.190 -> 172.31.36.109 TCP 17442 [TCP segment of a reassembled PDU]
 93   0.033035 172.31.36.109 -> 54.192.30.190 TCP 66 44878 > http [ACK] Seq=97 Ack=376111 Win=701184 Len=0 TSval=31328612 TSecr=635701345
 94   0.033043 54.192.30.190 -> 172.31.36.109 TCP 2962 [TCP segment of a reassembled PDU]
 95   0.033046 172.31.36.109 -> 54.192.30.190 TCP 66 44878 > http [ACK] Seq=97 Ack=379007 Win=698368 Len=0 TSval=31328612 TSecr=635701345
 96   0.033144 54.192.30.190 -> 172.31.36.109 TCP 13098 [TCP segment of a reassembled PDU]
 97   0.033155 172.31.36.109 -> 54.192.30.190 TCP 66 44878 > http [ACK] Seq=97 Ack=392039 Win=708480 Len=0 TSval=31328612 TSecr=635701345
 98   0.033597 54.192.30.190 -> 172.31.36.109 TCP 10202 [TCP segment of a reassembled PDU]
 99   0.033606 172.31.36.109 -> 54.192.30.190 TCP 66 44878 > http [ACK] Seq=97 Ack=402175 Win=713216 Len=0 TSval=31328612 TSecr=635701345
100   0.033712 54.192.30.190 -> 172.31.36.109 TCP 8754 [TCP segment of a reassembled PDU]
101   0.033745 172.31.36.109 -> 54.192.30.190 TCP 66 44878 > http [ACK] Seq=97 Ack=410863 Win=715520 Len=0 TSval=31328612 TSecr=635701345
102   0.034577 54.192.30.190 -> 172.31.36.109 TCP 14546 [TCP segment of a reassembled PDU]
103   0.034595 172.31.36.109 -> 54.192.30.190 TCP 66 44878 > http [ACK] Seq=97 Ack=425343 Win=705920 Len=0 TSval=31328612 TSecr=635701345
104   0.034750 54.192.30.190 -> 172.31.36.109 TCP 18890 [TCP segment of a reassembled PDU]
105   0.034770 172.31.36.109 -> 54.192.30.190 TCP 66 44878 > http [ACK] Seq=97 Ack=444167 Win=698880 Len=0 TSval=31328612 TSecr=635701345
106   0.034887 54.192.30.190 -> 172.31.36.109 TCP 7306 [TCP segment of a reassembled PDU]
107   0.034893 172.31.36.109 -> 54.192.30.190 TCP 66 44878 > http [ACK] Seq=97 Ack=451407 Win=717952 Len=0 TSval=31328612 TSecr=635701345
108   0.035247 54.192.30.190 -> 172.31.36.109 TCP 24682 [TCP segment of a reassembled PDU]
109   0.035261 172.31.36.109 -> 54.192.30.190 TCP 66 44878 > http [ACK] Seq=97 Ack=476023 Win=693376 Len=0 TSval=31328612 TSecr=635701345
110   0.035809 54.192.30.190 -> 172.31.36.109 TCP 1514 [TCP segment of a reassembled PDU]
111   0.035821 172.31.36.109 -> 54.192.30.190 TCP 66 44878 > http [ACK] Seq=97 Ack=477471 Win=721280 Len=0 TSval=31328612 TSecr=635701345
112   0.036054 54.192.30.190 -> 172.31.36.109 TCP 27578 [TCP segment of a reassembled PDU]
113   0.036071 54.192.30.190 -> 172.31.36.109 TCP 4410 [TCP segment of a reassembled PDU]
114   0.036086 172.31.36.109 -> 54.192.30.190 TCP 66 44878 > http [ACK] Seq=97 Ack=509327 Win=689536 Len=0 TSval=31328612 TSecr=635701345
115   0.036192 54.192.30.190 -> 172.31.36.109 TCP 23234 [TCP segment of a reassembled PDU]
116   0.036214 172.31.36.109 -> 54.192.30.190 TCP 66 44878 > http [ACK] Seq=97 Ack=532495 Win=691712 Len=0 TSval=31328612 TSecr=635701345
117   0.036421 54.192.30.190 -> 172.31.36.109 TCP 4410 [TCP segment of a reassembled PDU]
118   0.036427 172.31.36.109 -> 54.192.30.190 TCP 66 44878 > http [ACK] Seq=97 Ack=536839 Win=722688 Len=0 TSval=31328612 TSecr=635701345
119   0.036571 54.192.30.190 -> 172.31.36.109 TCP 4410 [TCP segment of a reassembled PDU]
120   0.036589 172.31.36.109 -> 54.192.30.190 TCP 66 44878 > http [ACK] Seq=97 Ack=541183 Win=722688 Len=0 TSval=31328612 TSecr=635701345
121   0.037413 54.192.30.190 -> 172.31.36.109 TCP 7306 [TCP segment of a reassembled PDU]
122   0.037431 172.31.36.109 -> 54.192.30.190 TCP 66 44878 > http [ACK] Seq=97 Ack=548423 Win=729984 Len=0 TSval=31328613 TSecr=635701345
123   0.037537 54.192.30.190 -> 172.31.36.109 TCP 18890 [TCP segment of a reassembled PDU]
124   0.037548 172.31.36.109 -> 54.192.30.190 TCP 66 44878 > http [ACK] Seq=97 Ack=567247 Win=752896 Len=0 TSval=31328613 TSecr=635701345
125   0.037554 54.192.30.190 -> 172.31.36.109 TCP 1514 [TCP segment of a reassembled PDU]
126   0.037811 54.192.30.190 -> 172.31.36.109 TCP 29026 [TCP segment of a reassembled PDU]
127   0.037842 54.192.30.190 -> 172.31.36.109 TCP 5858 [TCP segment of a reassembled PDU]
128   0.037847 172.31.36.109 -> 54.192.30.190 TCP 66 44878 > http [ACK] Seq=97 Ack=597655 Win=736256 Len=0 TSval=31328613 TSecr=635701345
129   0.037865 172.31.36.109 -> 54.192.30.190 TCP 66 44878 > http [ACK] Seq=97 Ack=603447 Win=767616 Len=0 TSval=31328613 TSecr=635701345
130   0.037986 54.192.30.190 -> 172.31.36.109 TCP 2962 [TCP segment of a reassembled PDU]
131   0.038013 172.31.36.109 -> 54.192.30.190 TCP 66 44878 > http [ACK] Seq=97 Ack=606343 Win=773376 Len=0 TSval=31328613 TSecr=635701345
132   0.038909 54.192.30.190 -> 172.31.36.109 TCP 8754 [TCP segment of a reassembled PDU]
133   0.038933 172.31.36.109 -> 54.192.30.190 TCP 66 44878 > http [ACK] Seq=97 Ack=615031 Win=773376 Len=0 TSval=31328613 TSecr=635701345
134   0.039072 54.192.30.190 -> 172.31.36.109 TCP 24682 [TCP segment of a reassembled PDU]
135   0.039095 172.31.36.109 -> 54.192.30.190 TCP 66 44878 > http [ACK] Seq=97 Ack=639647 Win=748800 Len=0 TSval=31328613 TSecr=635701345
136   0.039115 54.192.30.190 -> 172.31.36.109 TCP 2962 [TCP segment of a reassembled PDU]
137   0.039120 172.31.36.109 -> 54.192.30.190 TCP 66 44878 > http [ACK] Seq=97 Ack=642543 Win=779136 Len=0 TSval=31328613 TSecr=635701345
138   0.039379 54.192.30.190 -> 172.31.36.109 TCP 26130 [TCP segment of a reassembled PDU]
139   0.039404 172.31.36.109 -> 54.192.30.190 TCP 66 44878 > http [ACK] Seq=97 Ack=668607 Win=753152 Len=0 TSval=31328613 TSecr=635701345
140   0.039553 54.192.30.190 -> 172.31.36.109 TCP 24682 [TCP segment of a reassembled PDU]
141   0.039592 54.192.30.190 -> 172.31.36.109 TCP 5858 [TCP segment of a reassembled PDU]
142   0.039608 172.31.36.109 -> 54.192.30.190 TCP 66 44878 > http [ACK] Seq=97 Ack=699015 Win=733824 Len=0 TSval=31328613 TSecr=635701345
143   0.039671 54.192.30.190 -> 172.31.36.109 TCP 7306 [TCP segment of a reassembled PDU]
144   0.039678 172.31.36.109 -> 54.192.30.190 TCP 66 44878 > http [ACK] Seq=97 Ack=706255 Win=771968 Len=0 TSval=31328613 TSecr=635701345
145   0.039738 54.192.30.190 -> 172.31.36.109 TCP 1514 [TCP segment of a reassembled PDU]
146   0.039743 172.31.36.109 -> 54.192.30.190 TCP 66 44878 > http [ACK] Seq=97 Ack=707703 Win=781440 Len=0 TSval=31328613 TSecr=635701345
147   0.040473 54.192.30.190 -> 172.31.36.109 TCP 8754 [TCP segment of a reassembled PDU]
148   0.040490 172.31.36.109 -> 54.192.30.190 TCP 66 44878 > http [ACK] Seq=97 Ack=716391 Win=782080 Len=0 TSval=31328613 TSecr=635701346
149   0.040650 54.192.30.190 -> 172.31.36.109 TCP 15994 [TCP segment of a reassembled PDU]
150   0.040662 54.192.30.190 -> 172.31.36.109 TCP 4410 [TCP segment of a reassembled PDU]
151   0.040677 172.31.36.109 -> 54.192.30.190 TCP 66 44878 > http [ACK] Seq=97 Ack=736663 Win=776704 Len=0 TSval=31328613 TSecr=635701346
152   0.040826 54.192.30.190 -> 172.31.36.109 TCP 26130 [TCP segment of a reassembled PDU]
153   0.040914 172.31.36.109 -> 54.192.30.190 TCP 66 44878 > http [ACK] Seq=97 Ack=762727 Win=750720 Len=0 TSval=31328614 TSecr=635701346
154   0.041039 54.192.30.190 -> 172.31.36.109 TCP 23541 [TCP segment of a reassembled PDU]
155   0.041064 172.31.36.109 -> 54.192.30.190 TCP 66 44878 > http [ACK] Seq=97 Ack=786202 Win=743424 Len=0 TSval=31328614 TSecr=635701346
156   0.070370 54.192.30.190 -> 172.31.36.109 TCP 1514 [TCP segment of a reassembled PDU]
157   0.070615 54.192.30.190 -> 172.31.36.109 TCP 2962 [TCP segment of a reassembled PDU]
158   0.070620 172.31.36.109 -> 54.192.30.190 TCP 66 44878 > http [ACK] Seq=97 Ack=790546 Win=779136 Len=0 TSval=31328621 TSecr=635701349
159   0.070731 54.192.30.190 -> 172.31.36.109 TCP 11650 [TCP segment of a reassembled PDU]
160   0.070752 172.31.36.109 -> 54.192.30.190 TCP 66 44878 > http [ACK] Seq=97 Ack=802130 Win=782080 Len=0 TSval=31328621 TSecr=635701349
161   0.070852 54.192.30.190 -> 172.31.36.109 TCP 10202 [TCP segment of a reassembled PDU]
162   0.070866 54.192.30.190 -> 172.31.36.109 TCP 5858 [TCP segment of a reassembled PDU]
163   0.070883 172.31.36.109 -> 54.192.30.190 TCP 66 44878 > http [ACK] Seq=97 Ack=818058 Win=782080 Len=0 TSval=31328621 TSecr=635701349
164   0.070962 54.192.30.190 -> 172.31.36.109 TCP 8754 [TCP segment of a reassembled PDU]
165   0.070975 54.192.30.190 -> 172.31.36.109 TCP 7306 [TCP segment of a reassembled PDU]
166   0.070992 172.31.36.109 -> 54.192.30.190 TCP 66 44878 > http [ACK] Seq=97 Ack=833986 Win=782080 Len=0 TSval=31328621 TSecr=635701349
167   0.071203 54.192.30.190 -> 172.31.36.109 TCP 11650 [TCP segment of a reassembled PDU]
168   0.071219 54.192.30.190 -> 172.31.36.109 TCP 11650 [TCP segment of a reassembled PDU]
169   0.071237 54.192.30.190 -> 172.31.36.109 TCP 5858 [TCP segment of a reassembled PDU]
170   0.071250 172.31.36.109 -> 54.192.30.190 TCP 66 44878 > http [ACK] Seq=97 Ack=862946 Win=755328 Len=0 TSval=31328621 TSecr=635701349
171   0.071376 54.192.30.190 -> 172.31.36.109 TCP 1514 [TCP segment of a reassembled PDU]
172   0.072016 54.192.30.190 -> 172.31.36.109 TCP 20338 [TCP segment of a reassembled PDU]
173   0.072042 54.192.30.190 -> 172.31.36.109 TCP 8754 [TCP segment of a reassembled PDU]
174   0.072059 172.31.36.109 -> 54.192.30.190 TCP 66 44878 > http [ACK] Seq=97 Ack=893354 Win=736256 Len=0 TSval=31328621 TSecr=635701349
175   0.072170 54.192.30.190 -> 172.31.36.109 TCP 5858 [TCP segment of a reassembled PDU]
176   0.072177 172.31.36.109 -> 54.192.30.190 TCP 66 44878 > http [ACK] Seq=97 Ack=899146 Win=774400 Len=0 TSval=31328621 TSecr=635701349
177   0.072291 54.192.30.190 -> 172.31.36.109 TCP 5858 [TCP segment of a reassembled PDU]
178   0.072296 172.31.36.109 -> 54.192.30.190 TCP 66 44878 > http [ACK] Seq=97 Ack=904938 Win=774400 Len=0 TSval=31328621 TSecr=635701349
179   0.072503 54.192.30.190 -> 172.31.36.109 TCP 7306 [TCP segment of a reassembled PDU]
180   0.072528 172.31.36.109 -> 54.192.30.190 TCP 66 44878 > http [ACK] Seq=97 Ack=912178 Win=782080 Len=0 TSval=31328621 TSecr=635701349
181   0.072622 54.192.30.190 -> 172.31.36.109 TCP 5162 [TCP segment of a reassembled PDU]
182   0.072640 172.31.36.109 -> 54.192.30.190 TCP 66 44878 > http [ACK] Seq=97 Ack=917274 Win=782080 Len=0 TSval=31328621 TSecr=635701349
183   0.090867 54.192.30.190 -> 172.31.36.109 TCP 1514 [TCP segment of a reassembled PDU]
184   0.090886 54.192.30.190 -> 172.31.36.109 TCP 11650 [TCP segment of a reassembled PDU]
185   0.090909 172.31.36.109 -> 54.192.30.190 TCP 66 44878 > http [ACK] Seq=97 Ack=930306 Win=782080 Len=0 TSval=31328626 TSecr=635701351
186   0.091096 54.192.30.190 -> 172.31.36.109 TCP 7306 [TCP segment of a reassembled PDU]
187   0.091113 172.31.36.109 -> 54.192.30.190 TCP 66 44878 > http [ACK] Seq=97 Ack=937546 Win=782080 Len=0 TSval=31328626 TSecr=635701351
188   0.091190 54.192.30.190 -> 172.31.36.109 TCP 10202 [TCP segment of a reassembled PDU]
189   0.091210 172.31.36.109 -> 54.192.30.190 TCP 66 44878 > http [ACK] Seq=97 Ack=947682 Win=782080 Len=0 TSval=31328626 TSecr=635701351
190   0.091469 54.192.30.190 -> 172.31.36.109 TCP 18890 [TCP segment of a reassembled PDU]
191   0.091504 172.31.36.109 -> 54.192.30.190 TCP 66 44878 > http [ACK] Seq=97 Ack=966506 Win=763264 Len=0 TSval=31328626 TSecr=635701351
192   0.091903 54.192.30.190 -> 172.31.36.109 TCP 8754 [TCP segment of a reassembled PDU]
193   0.091925 172.31.36.109 -> 54.192.30.190 TCP 66 44878 > http [ACK] Seq=97 Ack=975194 Win=769664 Len=0 TSval=31328626 TSecr=635701351
194   0.092024 54.192.30.190 -> 172.31.36.109 TCP 7682 [TCP segment of a reassembled PDU]
195   0.092031 172.31.36.109 -> 54.192.30.190 TCP 66 44878 > http [ACK] Seq=97 Ack=982810 Win=769664 Len=0 TSval=31328626 TSecr=635701351
196   0.095769 54.192.30.190 -> 172.31.36.109 TCP 1514 [TCP segment of a reassembled PDU]
197   0.095775 54.192.30.190 -> 172.31.36.109 TCP 2962 [TCP segment of a reassembled PDU]
198   0.095778 172.31.36.109 -> 54.192.30.190 TCP 66 44878 > http [ACK] Seq=97 Ack=987154 Win=776704 Len=0 TSval=31328627 TSecr=635701351
199   0.096073 54.192.30.190 -> 172.31.36.109 TCP 15994 [TCP segment of a reassembled PDU]
200   0.096109 172.31.36.109 -> 54.192.30.190 TCP 66 44878 > http [ACK] Seq=97 Ack=1003082 Win=782080 Len=0 TSval=31328627 TSecr=635701351
201   0.096194 54.192.30.190 -> 172.31.36.109 TCP 7306 [TCP segment of a reassembled PDU]
202   0.096206 54.192.30.190 -> 172.31.36.109 TCP 13098 [TCP segment of a reassembled PDU]
203   0.096215 54.192.30.190 -> 172.31.36.109 TCP 1514 [TCP segment of a reassembled PDU]
204   0.096229 172.31.36.109 -> 54.192.30.190 TCP 66 44878 > http [ACK] Seq=97 Ack=1024802 Win=760448 Len=0 TSval=31328627 TSecr=635701351
205   0.096257 54.192.30.190 -> 172.31.36.109 TCP 13098 [TCP segment of a reassembled PDU]
206   0.096264 172.31.36.109 -> 54.192.30.190 TCP 66 44878 > http [ACK] Seq=97 Ack=1037834 Win=762496 Len=0 TSval=31328627 TSecr=635701351
207   0.096569 54.192.30.190 -> 172.31.36.109 TCP 8754 [TCP segment of a reassembled PDU]
208   0.096600 172.31.36.109 -> 54.192.30.190 TCP 66 44878 > http [ACK] Seq=97 Ack=1046522 Win=769664 Len=0 TSval=31328627 TSecr=635701351
209   0.096607 54.192.30.190 -> 172.31.36.109 HTTP 2578 HTTP/1.1 200 OK  (application/octet-stream)
210   0.096621 172.31.36.109 -> 54.192.30.190 TCP 66 44878 > http [ACK] Seq=97 Ack=1049034 Win=782080 Len=0 TSval=31328627 TSecr=635701351
211   0.096740 172.31.36.109 -> 54.192.30.190 TCP 66 44878 > http [FIN, ACK] Seq=97 Ack=1049034 Win=782080 Len=0 TSval=31328627 TSecr=635701351
212   0.098034 54.192.30.190 -> 172.31.36.109 TCP 66 http > 44878 [FIN, ACK] Seq=1049034 Ack=98 Win=14592 Len=0 TSval=635701351 TSecr=31328627
213   0.098043 172.31.36.109 -> 54.192.30.190 TCP 66 44878 > http [ACK] Seq=98 Ack=1049035 Win=782080 Len=0 TSval=31328628 TSecr=635701351
