[Measurement for 1mb at 10:33:41 20.33.2014] 
Tshark:

  1   0.000000 172.31.36.109 -> 172.31.0.2   DNS 89 Standard query 0x6434  A d1n0gskdvzj94j.cloudfront.net
  2   0.000026 172.31.36.109 -> 172.31.0.2   DNS 89 Standard query 0xc145  AAAA d1n0gskdvzj94j.cloudfront.net
  3   0.000550   172.31.0.2 -> 172.31.36.109 DNS 217 Standard query response 0x6434  A 54.230.30.245 A 54.192.29.220 A 54.192.30.186 A 54.192.30.217 A 54.192.30.218 A 54.230.30.27 A 54.230.30.202 A 54.230.30.215
  4   0.000560   172.31.0.2 -> 172.31.36.109 DNS 176 Standard query response 0xc145 
  5   0.003843 172.31.36.109 -> 54.230.30.245 TCP 74 45168 > http [SYN] Seq=0 Win=26883 Len=0 MSS=8961 SACK_PERM=1 TSval=35826935 TSecr=0 WS=128
  6   0.005419 54.230.30.245 -> 172.31.36.109 TCP 74 http > 45168 [SYN, ACK] Seq=0 Ack=1 Win=14480 Len=0 MSS=1460 SACK_PERM=1 TSval=641632285 TSecr=35826935 WS=128
  7   0.005434 172.31.36.109 -> 54.230.30.245 TCP 66 45168 > http [ACK] Seq=1 Ack=1 Win=27008 Len=0 TSval=35826935 TSecr=641632285
  8   0.005473 172.31.36.109 -> 54.230.30.245 HTTP 162 GET /1mb HTTP/1.1 
  9   0.006917 54.230.30.245 -> 172.31.36.109 TCP 66 http > 45168 [ACK] Seq=1 Ack=97 Win=14592 Len=0 TSval=641632285 TSecr=35826935
 10   0.031046 54.230.30.245 -> 172.31.36.109 TCP 6936 [TCP segment of a reassembled PDU]
 11   0.031071 172.31.36.109 -> 54.230.30.245 TCP 66 45168 > http [ACK] Seq=97 Ack=6871 Win=40704 Len=0 TSval=35826942 TSecr=641632288
 12   0.031084 54.230.30.245 -> 172.31.36.109 TCP 7306 [TCP segment of a reassembled PDU]
 13   0.031093 172.31.36.109 -> 54.230.30.245 TCP 66 45168 > http [ACK] Seq=97 Ack=14111 Win=55168 Len=0 TSval=35826942 TSecr=641632288
 14   0.032575 54.230.30.245 -> 172.31.36.109 TCP 5858 [TCP segment of a reassembled PDU]
 15   0.032582 172.31.36.109 -> 54.230.30.245 TCP 66 45168 > http [ACK] Seq=97 Ack=19903 Win=66688 Len=0 TSval=35826942 TSecr=641632288
 16   0.032594 54.230.30.245 -> 172.31.36.109 TCP 7306 [TCP segment of a reassembled PDU]
 17   0.032601 172.31.36.109 -> 54.230.30.245 TCP 66 45168 > http [ACK] Seq=97 Ack=27143 Win=81280 Len=0 TSval=35826942 TSecr=641632288
 18   0.034077 54.230.30.245 -> 172.31.36.109 TCP 2962 [TCP segment of a reassembled PDU]
 19   0.034083 172.31.36.109 -> 54.230.30.245 TCP 66 45168 > http [ACK] Seq=97 Ack=30039 Win=87040 Len=0 TSval=35826942 TSecr=641632288
 20   0.034129 54.230.30.245 -> 172.31.36.109 TCP 13098 [TCP segment of a reassembled PDU]
 21   0.034137 172.31.36.109 -> 54.230.30.245 TCP 66 45168 > http [ACK] Seq=97 Ack=43071 Win=96512 Len=0 TSval=35826942 TSecr=641632288
 22   0.034179 54.230.30.245 -> 172.31.36.109 TCP 4410 [TCP segment of a reassembled PDU]
 23   0.034184 172.31.36.109 -> 54.230.30.245 TCP 66 45168 > http [ACK] Seq=97 Ack=47415 Win=92288 Len=0 TSval=35826942 TSecr=641632288
 24   0.035638 54.230.30.245 -> 172.31.36.109 TCP 5858 [TCP segment of a reassembled PDU]
 25   0.035663 172.31.36.109 -> 54.230.30.245 TCP 66 45168 > http [ACK] Seq=97 Ack=53207 Win=108416 Len=0 TSval=35826943 TSecr=641632288
 26   0.035694 54.230.30.245 -> 172.31.36.109 TCP 13098 [TCP segment of a reassembled PDU]
 27   0.035702 172.31.36.109 -> 54.230.30.245 TCP 66 45168 > http [ACK] Seq=97 Ack=66239 Win=95488 Len=0 TSval=35826943 TSecr=641632288
 28   0.037183 54.230.30.245 -> 172.31.36.109 TCP 4410 [TCP segment of a reassembled PDU]
 29   0.037212 172.31.36.109 -> 54.230.30.245 TCP 66 45168 > http [ACK] Seq=97 Ack=70583 Win=117760 Len=0 TSval=35826943 TSecr=641632288
 30   0.037222 54.230.30.245 -> 172.31.36.109 TCP 2962 [TCP segment of a reassembled PDU]
 31   0.037225 172.31.36.109 -> 54.230.30.245 TCP 66 45168 > http [ACK] Seq=97 Ack=73479 Win=123520 Len=0 TSval=35826943 TSecr=641632288
 32   0.037376 54.230.30.245 -> 172.31.36.109 TCP 2962 [TCP segment of a reassembled PDU]
 33   0.037405 172.31.36.109 -> 54.230.30.245 TCP 66 45168 > http [ACK] Seq=97 Ack=76375 Win=129280 Len=0 TSval=35826943 TSecr=641632288
 34   0.037557 54.230.30.245 -> 172.31.36.109 TCP 11650 [TCP segment of a reassembled PDU]
 35   0.037580 172.31.36.109 -> 54.230.30.245 TCP 66 45168 > http [ACK] Seq=97 Ack=87959 Win=152448 Len=0 TSval=35826943 TSecr=641632288
 36   0.037592 54.230.30.245 -> 172.31.36.109 TCP 5858 [TCP segment of a reassembled PDU]
 37   0.037600 172.31.36.109 -> 54.230.30.245 TCP 66 45168 > http [ACK] Seq=97 Ack=93751 Win=164096 Len=0 TSval=35826943 TSecr=641632288
 38   0.038671 54.230.30.245 -> 172.31.36.109 TCP 2962 [TCP segment of a reassembled PDU]
 39   0.038676 172.31.36.109 -> 54.230.30.245 TCP 66 45168 > http [ACK] Seq=97 Ack=96647 Win=169856 Len=0 TSval=35826943 TSecr=641632288
 40   0.038799 54.230.30.245 -> 172.31.36.109 TCP 7306 [TCP segment of a reassembled PDU]
 41   0.038806 172.31.36.109 -> 54.230.30.245 TCP 66 45168 > http [ACK] Seq=97 Ack=103887 Win=184320 Len=0 TSval=35826944 TSecr=641632288
 42   0.039202 54.230.30.245 -> 172.31.36.109 TCP 7306 [TCP segment of a reassembled PDU]
 43   0.039209 172.31.36.109 -> 54.230.30.245 TCP 66 45168 > http [ACK] Seq=97 Ack=111127 Win=198784 Len=0 TSval=35826944 TSecr=641632288
 44   0.039357 54.230.30.245 -> 172.31.36.109 TCP 15994 [TCP segment of a reassembled PDU]
 45   0.039368 172.31.36.109 -> 54.230.30.245 TCP 66 45168 > http [ACK] Seq=97 Ack=127055 Win=230656 Len=0 TSval=35826944 TSecr=641632288
 46   0.040249 54.230.30.245 -> 172.31.36.109 TCP 2962 [TCP segment of a reassembled PDU]
 47   0.040256 172.31.36.109 -> 54.230.30.245 TCP 66 45168 > http [ACK] Seq=97 Ack=129951 Win=236544 Len=0 TSval=35826944 TSecr=641632289
 48   0.040393 54.230.30.245 -> 172.31.36.109 TCP 11650 [TCP segment of a reassembled PDU]
 49   0.040401 172.31.36.109 -> 54.230.30.245 TCP 66 45168 > http [ACK] Seq=97 Ack=141535 Win=259712 Len=0 TSval=35826944 TSecr=641632289
 50   0.040780 54.230.30.245 -> 172.31.36.109 TCP 5858 [TCP segment of a reassembled PDU]
 51   0.040786 172.31.36.109 -> 54.230.30.245 TCP 66 45168 > http [ACK] Seq=97 Ack=147327 Win=271232 Len=0 TSval=35826944 TSecr=641632289
 52   0.040935 54.230.30.245 -> 172.31.36.109 TCP 11650 [TCP segment of a reassembled PDU]
 53   0.040952 172.31.36.109 -> 54.230.30.245 TCP 66 45168 > http [ACK] Seq=97 Ack=158911 Win=294400 Len=0 TSval=35826944 TSecr=641632289
 54   0.041070 54.230.30.245 -> 172.31.36.109 TCP 8754 [TCP segment of a reassembled PDU]
 55   0.041087 172.31.36.109 -> 54.230.30.245 TCP 66 45168 > http [ACK] Seq=97 Ack=167599 Win=311808 Len=0 TSval=35826944 TSecr=641632289
 56   0.041753 54.230.30.245 -> 172.31.36.109 TCP 1514 [TCP segment of a reassembled PDU]
 57   0.041758 172.31.36.109 -> 54.230.30.245 TCP 66 45168 > http [ACK] Seq=97 Ack=169047 Win=314624 Len=0 TSval=35826944 TSecr=641632289
 58   0.041888 54.230.30.245 -> 172.31.36.109 TCP 5858 [TCP segment of a reassembled PDU]
 59   0.041894 172.31.36.109 -> 54.230.30.245 TCP 66 45168 > http [ACK] Seq=97 Ack=174839 Win=326272 Len=0 TSval=35826944 TSecr=641632289
 60   0.042345 54.230.30.245 -> 172.31.36.109 TCP 1514 [TCP segment of a reassembled PDU]
 61   0.042349 172.31.36.109 -> 54.230.30.245 TCP 66 45168 > http [ACK] Seq=97 Ack=176287 Win=329216 Len=0 TSval=35826944 TSecr=641632289
 62   0.042503 54.230.30.245 -> 172.31.36.109 TCP 20338 [TCP segment of a reassembled PDU]
 63   0.042525 172.31.36.109 -> 54.230.30.245 TCP 66 45168 > http [ACK] Seq=97 Ack=196559 Win=369664 Len=0 TSval=35826944 TSecr=641632289
 64   0.042632 54.230.30.245 -> 172.31.36.109 TCP 8754 [TCP segment of a reassembled PDU]
 65   0.042639 172.31.36.109 -> 54.230.30.245 TCP 66 45168 > http [ACK] Seq=97 Ack=205247 Win=387072 Len=0 TSval=35826944 TSecr=641632289
 66   0.042782 54.230.30.245 -> 172.31.36.109 TCP 10202 [TCP segment of a reassembled PDU]
 67   0.042790 172.31.36.109 -> 54.230.30.245 TCP 66 45168 > http [ACK] Seq=97 Ack=215383 Win=407296 Len=0 TSval=35826945 TSecr=641632289
 68   0.043251 54.230.30.245 -> 172.31.36.109 TCP 1514 [TCP segment of a reassembled PDU]
 69   0.043255 172.31.36.109 -> 54.230.30.245 TCP 66 45168 > http [ACK] Seq=97 Ack=216831 Win=410240 Len=0 TSval=35826945 TSecr=641632289
 70   0.043372 54.230.30.245 -> 172.31.36.109 TCP 5858 [TCP segment of a reassembled PDU]
 71   0.043378 172.31.36.109 -> 54.230.30.245 TCP 66 45168 > http [ACK] Seq=97 Ack=222623 Win=421888 Len=0 TSval=35826945 TSecr=641632289
 72   0.044058 54.230.30.245 -> 172.31.36.109 TCP 10202 [TCP segment of a reassembled PDU]
 73   0.044066 172.31.36.109 -> 54.230.30.245 TCP 66 45168 > http [ACK] Seq=97 Ack=232759 Win=442112 Len=0 TSval=35826945 TSecr=641632289
 74   0.044224 54.230.30.245 -> 172.31.36.109 TCP 15994 [TCP segment of a reassembled PDU]
 75   0.044234 172.31.36.109 -> 54.230.30.245 TCP 66 45168 > http [ACK] Seq=97 Ack=248687 Win=473984 Len=0 TSval=35826945 TSecr=641632289
 76   0.044320 54.230.30.245 -> 172.31.36.109 TCP 1514 [TCP segment of a reassembled PDU]
 77   0.044325 172.31.36.109 -> 54.230.30.245 TCP 66 45168 > http [ACK] Seq=97 Ack=250135 Win=476800 Len=0 TSval=35826945 TSecr=641632289
 78   0.044427 54.230.30.245 -> 172.31.36.109 TCP 20338 [TCP segment of a reassembled PDU]
 79   0.044439 172.31.36.109 -> 54.230.30.245 TCP 66 45168 > http [ACK] Seq=97 Ack=270407 Win=517376 Len=0 TSval=35826945 TSecr=641632289
 80   0.045567 54.230.30.245 -> 172.31.36.109 TCP 4410 [TCP segment of a reassembled PDU]
 81   0.045574 172.31.36.109 -> 54.230.30.245 TCP 66 45168 > http [ACK] Seq=97 Ack=274751 Win=526080 Len=0 TSval=35826945 TSecr=641632289
 82   0.045666 54.230.30.245 -> 172.31.36.109 TCP 18890 [TCP segment of a reassembled PDU]
 83   0.045677 172.31.36.109 -> 54.230.30.245 TCP 66 45168 > http [ACK] Seq=97 Ack=293575 Win=563712 Len=0 TSval=35826945 TSecr=641632289
 84   0.045850 54.230.30.245 -> 172.31.36.109 TCP 7306 [TCP segment of a reassembled PDU]
 85   0.045856 172.31.36.109 -> 54.230.30.245 TCP 66 45168 > http [ACK] Seq=97 Ack=300815 Win=578176 Len=0 TSval=35826945 TSecr=641632289
 86   0.045931 54.230.30.245 -> 172.31.36.109 TCP 11650 [TCP segment of a reassembled PDU]
 87   0.045939 172.31.36.109 -> 54.230.30.245 TCP 66 45168 > http [ACK] Seq=97 Ack=312399 Win=601344 Len=0 TSval=35826945 TSecr=641632289
 88   0.045966 54.230.30.245 -> 172.31.36.109 TCP 5858 [TCP segment of a reassembled PDU]
 89   0.045971 172.31.36.109 -> 54.230.30.245 TCP 66 45168 > http [ACK] Seq=97 Ack=318191 Win=612992 Len=0 TSval=35826945 TSecr=641632289
 90   0.047081 54.230.30.245 -> 172.31.36.109 TCP 1514 [TCP segment of a reassembled PDU]
 91   0.047085 172.31.36.109 -> 54.230.30.245 TCP 66 45168 > http [ACK] Seq=97 Ack=319639 Win=615808 Len=0 TSval=35826946 TSecr=641632289
 92   0.047252 54.230.30.245 -> 172.31.36.109 TCP 18890 [TCP segment of a reassembled PDU]
 93   0.047263 172.31.36.109 -> 54.230.30.245 TCP 66 45168 > http [ACK] Seq=97 Ack=338463 Win=653568 Len=0 TSval=35826946 TSecr=641632289
 94   0.047270 54.230.30.245 -> 172.31.36.109 TCP 2962 [TCP segment of a reassembled PDU]
 95   0.047273 172.31.36.109 -> 54.230.30.245 TCP 66 45168 > http [ACK] Seq=97 Ack=341359 Win=659328 Len=0 TSval=35826946 TSecr=641632289
 96   0.047372 54.230.30.245 -> 172.31.36.109 TCP 4410 [TCP segment of a reassembled PDU]
 97   0.047386 172.31.36.109 -> 54.230.30.245 TCP 66 45168 > http [ACK] Seq=97 Ack=345703 Win=668032 Len=0 TSval=35826946 TSecr=641632289
 98   0.047525 54.230.30.245 -> 172.31.36.109 TCP 17442 [TCP segment of a reassembled PDU]
 99   0.047551 172.31.36.109 -> 54.230.30.245 TCP 66 45168 > http [ACK] Seq=97 Ack=363079 Win=701184 Len=0 TSval=35826946 TSecr=641632289
100   0.047558 54.230.30.245 -> 172.31.36.109 TCP 2962 [TCP segment of a reassembled PDU]
101   0.047561 172.31.36.109 -> 54.230.30.245 TCP 66 45168 > http [ACK] Seq=97 Ack=365975 Win=698368 Len=0 TSval=35826946 TSecr=641632289
102   0.047641 54.230.30.245 -> 172.31.36.109 TCP 4410 [TCP segment of a reassembled PDU]
103   0.047646 172.31.36.109 -> 54.230.30.245 TCP 66 45168 > http [ACK] Seq=97 Ack=370319 Win=711424 Len=0 TSval=35826946 TSecr=641632289
104   0.047721 54.230.30.245 -> 172.31.36.109 TCP 13098 [TCP segment of a reassembled PDU]
105   0.047730 172.31.36.109 -> 54.230.30.245 TCP 66 45168 > http [ACK] Seq=97 Ack=383351 Win=701184 Len=0 TSval=35826946 TSecr=641632289
106   0.048882 54.230.30.245 -> 172.31.36.109 TCP 4410 [TCP segment of a reassembled PDU]
107   0.048889 172.31.36.109 -> 54.230.30.245 TCP 66 45168 > http [ACK] Seq=97 Ack=387695 Win=720128 Len=0 TSval=35826946 TSecr=641632289
108   0.049086 54.230.30.245 -> 172.31.36.109 TCP 26130 [TCP segment of a reassembled PDU]
109   0.049106 54.230.30.245 -> 172.31.36.109 TCP 10202 [TCP segment of a reassembled PDU]
110   0.049122 172.31.36.109 -> 54.230.30.245 TCP 66 45168 > http [ACK] Seq=97 Ack=423895 Win=684032 Len=0 TSval=35826946 TSecr=641632289
111   0.049276 54.230.30.245 -> 172.31.36.109 TCP 18890 [TCP segment of a reassembled PDU]
112   0.049287 172.31.36.109 -> 54.230.30.245 TCP 66 45168 > http [ACK] Seq=97 Ack=442719 Win=698880 Len=0 TSval=35826946 TSecr=641632289
113   0.049423 54.230.30.245 -> 172.31.36.109 TCP 5858 [TCP segment of a reassembled PDU]
114   0.049450 172.31.36.109 -> 54.230.30.245 TCP 66 45168 > http [ACK] Seq=97 Ack=448511 Win=720256 Len=0 TSval=35826946 TSecr=641632289
115   0.050453 54.230.30.245 -> 172.31.36.109 TCP 4410 [TCP segment of a reassembled PDU]
116   0.050459 172.31.36.109 -> 54.230.30.245 TCP 66 45168 > http [ACK] Seq=97 Ack=452855 Win=722688 Len=0 TSval=35826946 TSecr=641632290
117   0.050604 54.230.30.245 -> 172.31.36.109 TCP 13098 [TCP segment of a reassembled PDU]
118   0.050639 172.31.36.109 -> 54.230.30.245 TCP 66 45168 > http [ACK] Seq=97 Ack=465887 Win=729856 Len=0 TSval=35826946 TSecr=641632290
119   0.050665 54.230.30.245 -> 172.31.36.109 TCP 1514 [TCP segment of a reassembled PDU]
120   0.050842 54.230.30.245 -> 172.31.36.109 TCP 30474 [TCP segment of a reassembled PDU]
121   0.050871 172.31.36.109 -> 54.230.30.245 TCP 66 45168 > http [ACK] Seq=97 Ack=497743 Win=698112 Len=0 TSval=35826947 TSecr=641632290
122   0.051000 54.230.30.245 -> 172.31.36.109 TCP 14546 [TCP segment of a reassembled PDU]
123   0.051010 172.31.36.109 -> 54.230.30.245 TCP 66 45168 > http [ACK] Seq=97 Ack=512223 Win=705920 Len=0 TSval=35826947 TSecr=641632290
124   0.051084 54.230.30.245 -> 172.31.36.109 TCP 1514 [TCP segment of a reassembled PDU]
125   0.051962 54.230.30.245 -> 172.31.36.109 TCP 5858 [TCP segment of a reassembled PDU]
126   0.051968 172.31.36.109 -> 54.230.30.245 TCP 66 45168 > http [ACK] Seq=97 Ack=519463 Win=720256 Len=0 TSval=35826947 TSecr=641632290
127   0.052183 54.230.30.245 -> 172.31.36.109 TCP 24682 [TCP segment of a reassembled PDU]
128   0.052208 172.31.36.109 -> 54.230.30.245 TCP 66 45168 > http [ACK] Seq=97 Ack=544079 Win=695680 Len=0 TSval=35826947 TSecr=641632290
129   0.052297 54.230.30.245 -> 172.31.36.109 TCP 8754 [TCP segment of a reassembled PDU]
130   0.052304 172.31.36.109 -> 54.230.30.245 TCP 66 45168 > http [ACK] Seq=97 Ack=552767 Win=715520 Len=0 TSval=35826947 TSecr=641632290
131   0.052373 54.230.30.245 -> 172.31.36.109 TCP 10202 [TCP segment of a reassembled PDU]
132   0.052391 172.31.36.109 -> 54.230.30.245 TCP 66 45168 > http [ACK] Seq=97 Ack=562903 Win=729856 Len=0 TSval=35826947 TSecr=641632290
133   0.052572 54.230.30.245 -> 172.31.36.109 TCP 15994 [TCP segment of a reassembled PDU]
134   0.052593 172.31.36.109 -> 54.230.30.245 TCP 66 45168 > http [ACK] Seq=97 Ack=578831 Win=729856 Len=0 TSval=35826947 TSecr=641632290
135   0.053276 54.230.30.245 -> 172.31.36.109 TCP 7306 [TCP segment of a reassembled PDU]
136   0.053298 172.31.36.109 -> 54.230.30.245 TCP 66 45168 > http [ACK] Seq=97 Ack=586071 Win=729856 Len=0 TSval=35826947 TSecr=641632290
137   0.053439 54.230.30.245 -> 172.31.36.109 TCP 5858 [TCP segment of a reassembled PDU]
138   0.053471 172.31.36.109 -> 54.230.30.245 TCP 66 45168 > http [ACK] Seq=97 Ack=591863 Win=729856 Len=0 TSval=35826947 TSecr=641632290
139   0.053563 54.230.30.245 -> 172.31.36.109 TCP 11650 [TCP segment of a reassembled PDU]
140   0.053582 172.31.36.109 -> 54.230.30.245 TCP 66 45168 > http [ACK] Seq=97 Ack=603447 Win=729856 Len=0 TSval=35826947 TSecr=641632290
141   0.053628 54.230.30.245 -> 172.31.36.109 TCP 17442 [TCP segment of a reassembled PDU]
142   0.053778 172.31.36.109 -> 54.230.30.245 TCP 66 45168 > http [ACK] Seq=97 Ack=620823 Win=712576 Len=0 TSval=35826947 TSecr=641632290
143   0.053904 54.230.30.245 -> 172.31.36.109 TCP 23234 [TCP segment of a reassembled PDU]
144   0.053923 54.230.30.245 -> 172.31.36.109 TCP 10202 [TCP segment of a reassembled PDU]
145   0.053941 172.31.36.109 -> 54.230.30.245 TCP 66 45168 > http [ACK] Seq=97 Ack=654127 Win=679296 Len=0 TSval=35826947 TSecr=641632290
146   0.054117 54.230.30.245 -> 172.31.36.109 TCP 24682 [TCP segment of a reassembled PDU]
147   0.054143 172.31.36.109 -> 54.230.30.245 TCP 66 45168 > http [ACK] Seq=97 Ack=678743 Win=689408 Len=0 TSval=35826947 TSecr=641632290
148   0.054212 54.230.30.245 -> 172.31.36.109 TCP 2962 [TCP segment of a reassembled PDU]
149   0.054217 172.31.36.109 -> 54.230.30.245 TCP 66 45168 > http [ACK] Seq=97 Ack=681639 Win=724992 Len=0 TSval=35826947 TSecr=641632290
150   0.054828 54.230.30.245 -> 172.31.36.109 TCP 4410 [TCP segment of a reassembled PDU]
151   0.054845 172.31.36.109 -> 54.230.30.245 TCP 66 45168 > http [ACK] Seq=97 Ack=685983 Win=729856 Len=0 TSval=35826948 TSecr=641632290
152   0.055094 54.230.30.245 -> 172.31.36.109 TCP 11650 [TCP segment of a reassembled PDU]
153   0.055115 172.31.36.109 -> 54.230.30.245 TCP 66 45168 > http [ACK] Seq=97 Ack=697567 Win=729856 Len=0 TSval=35826948 TSecr=641632290
154   0.055209 54.230.30.245 -> 172.31.36.109 TCP 11650 [TCP segment of a reassembled PDU]
155   0.055228 172.31.36.109 -> 54.230.30.245 TCP 66 45168 > http [ACK] Seq=97 Ack=709151 Win=729856 Len=0 TSval=35826948 TSecr=641632290
156   0.055314 54.230.30.245 -> 172.31.36.109 TCP 4410 [TCP segment of a reassembled PDU]
157   0.055329 172.31.36.109 -> 54.230.30.245 TCP 66 45168 > http [ACK] Seq=97 Ack=713495 Win=729856 Len=0 TSval=35826948 TSecr=641632290
158   0.055555 54.230.30.245 -> 172.31.36.109 TCP 8754 [TCP segment of a reassembled PDU]
159   0.055572 172.31.36.109 -> 54.230.30.245 TCP 66 45168 > http [ACK] Seq=97 Ack=722183 Win=729856 Len=0 TSval=35826948 TSecr=641632290
160   0.055715 54.230.30.245 -> 172.31.36.109 TCP 18890 [TCP segment of a reassembled PDU]
161   0.055744 54.230.30.245 -> 172.31.36.109 TCP 7306 [TCP segment of a reassembled PDU]
162   0.055750 54.230.30.245 -> 172.31.36.109 TCP 2962 [TCP segment of a reassembled PDU]
163   0.055791 54.230.30.245 -> 172.31.36.109 TCP 4410 [TCP segment of a reassembled PDU]
164   0.055814 172.31.36.109 -> 54.230.30.245 TCP 66 45168 > http [ACK] Seq=97 Ack=755487 Win=696576 Len=0 TSval=35826948 TSecr=641632290
165   0.055949 54.230.30.245 -> 172.31.36.109 TCP 18890 [TCP segment of a reassembled PDU]
166   0.055960 172.31.36.109 -> 54.230.30.245 TCP 66 45168 > http [ACK] Seq=97 Ack=774311 Win=698880 Len=0 TSval=35826948 TSecr=641632290
167   0.056357 54.230.30.245 -> 172.31.36.109 TCP 1514 [TCP segment of a reassembled PDU]
168   0.056499 54.230.30.245 -> 172.31.36.109 TCP 10509 [TCP segment of a reassembled PDU]
169   0.056506 172.31.36.109 -> 54.230.30.245 TCP 66 45168 > http [ACK] Seq=97 Ack=786202 Win=710784 Len=0 TSval=35826948 TSecr=641632290
170   0.078858 54.230.30.245 -> 172.31.36.109 TCP 1514 [TCP segment of a reassembled PDU]
171   0.078892 54.230.30.245 -> 172.31.36.109 TCP 4410 [TCP segment of a reassembled PDU]
172   0.078897 172.31.36.109 -> 54.230.30.245 TCP 66 45168 > http [ACK] Seq=97 Ack=791994 Win=720256 Len=0 TSval=35826954 TSecr=641632292
173   0.079343 54.230.30.245 -> 172.31.36.109 TCP 7306 [TCP segment of a reassembled PDU]
174   0.079356 54.230.30.245 -> 172.31.36.109 TCP 13098 [TCP segment of a reassembled PDU]
175   0.079366 54.230.30.245 -> 172.31.36.109 TCP 2962 [TCP segment of a reassembled PDU]
176   0.079406 172.31.36.109 -> 54.230.30.245 TCP 66 45168 > http [ACK] Seq=97 Ack=815162 Win=703616 Len=0 TSval=35826954 TSecr=641632292
177   0.079511 54.230.30.245 -> 172.31.36.109 TCP 10202 [TCP segment of a reassembled PDU]
178   0.079528 172.31.36.109 -> 54.230.30.245 TCP 66 45168 > http [ACK] Seq=97 Ack=825298 Win=713216 Len=0 TSval=35826954 TSecr=641632293
179   0.079760 54.230.30.245 -> 172.31.36.109 TCP 5858 [TCP segment of a reassembled PDU]
180   0.079767 172.31.36.109 -> 54.230.30.245 TCP 66 45168 > http [ACK] Seq=97 Ack=831090 Win=720256 Len=0 TSval=35826954 TSecr=641632293
181   0.079890 54.230.30.245 -> 172.31.36.109 TCP 4410 [TCP segment of a reassembled PDU]
182   0.079896 172.31.36.109 -> 54.230.30.245 TCP 66 45168 > http [ACK] Seq=97 Ack=835434 Win=722688 Len=0 TSval=35826954 TSecr=641632293
183   0.079998 54.230.30.245 -> 172.31.36.109 TCP 13098 [TCP segment of a reassembled PDU]
184   0.080014 54.230.30.245 -> 172.31.36.109 TCP 8754 [TCP segment of a reassembled PDU]
185   0.080044 172.31.36.109 -> 54.230.30.245 TCP 66 45168 > http [ACK] Seq=97 Ack=857154 Win=715520 Len=0 TSval=35826954 TSecr=641632293
186   0.080137 54.230.30.245 -> 172.31.36.109 TCP 5858 [TCP segment of a reassembled PDU]
187   0.080143 172.31.36.109 -> 54.230.30.245 TCP 66 45168 > http [ACK] Seq=97 Ack=862946 Win=720256 Len=0 TSval=35826954 TSecr=641632293
188   0.080253 54.230.30.245 -> 172.31.36.109 TCP 5858 [TCP segment of a reassembled PDU]
189   0.080331 172.31.36.109 -> 54.230.30.245 TCP 66 45168 > http [ACK] Seq=97 Ack=868738 Win=729856 Len=0 TSval=35826954 TSecr=641632293
190   0.080405 54.230.30.245 -> 172.31.36.109 TCP 5858 [TCP segment of a reassembled PDU]
191   0.080422 172.31.36.109 -> 54.230.30.245 TCP 66 45168 > http [ACK] Seq=97 Ack=874530 Win=729856 Len=0 TSval=35826954 TSecr=641632293
192   0.080586 54.230.30.245 -> 172.31.36.109 TCP 23234 [TCP segment of a reassembled PDU]
193   0.080621 172.31.36.109 -> 54.230.30.245 TCP 66 45168 > http [ACK] Seq=97 Ack=897698 Win=706688 Len=0 TSval=35826954 TSecr=641632293
194   0.080630 54.230.30.245 -> 172.31.36.109 TCP 1514 [TCP segment of a reassembled PDU]
195   0.080707 54.230.30.245 -> 172.31.36.109 TCP 5858 [TCP segment of a reassembled PDU]
196   0.080713 172.31.36.109 -> 54.230.30.245 TCP 66 45168 > http [ACK] Seq=97 Ack=904938 Win=720256 Len=0 TSval=35826954 TSecr=641632293
197   0.081007 54.230.30.245 -> 172.31.36.109 TCP 5858 [TCP segment of a reassembled PDU]
198   0.081023 172.31.36.109 -> 54.230.30.245 TCP 66 45168 > http [ACK] Seq=97 Ack=910730 Win=720256 Len=0 TSval=35826954 TSecr=641632293
199   0.081152 54.230.30.245 -> 172.31.36.109 TCP 4410 [TCP segment of a reassembled PDU]
200   0.081157 172.31.36.109 -> 54.230.30.245 TCP 66 45168 > http [ACK] Seq=97 Ack=915074 Win=722688 Len=0 TSval=35826954 TSecr=641632293
201   0.081268 54.230.30.245 -> 172.31.36.109 TCP 2266 [TCP segment of a reassembled PDU]
202   0.081273 172.31.36.109 -> 54.230.30.245 TCP 66 45168 > http [ACK] Seq=97 Ack=917274 Win=724992 Len=0 TSval=35826954 TSecr=641632293
203   0.099383 54.230.30.245 -> 172.31.36.109 TCP 1514 [TCP segment of a reassembled PDU]
204   0.099434 54.230.30.245 -> 172.31.36.109 TCP 13098 [TCP segment of a reassembled PDU]
205   0.099447 172.31.36.109 -> 54.230.30.245 TCP 66 45168 > http [ACK] Seq=97 Ack=931754 Win=729856 Len=0 TSval=35826959 TSecr=641632295
206   0.099640 54.230.30.245 -> 172.31.36.109 TCP 1514 [TCP segment of a reassembled PDU]
207   0.099760 54.230.30.245 -> 172.31.36.109 TCP 20338 [TCP segment of a reassembled PDU]
208   0.099787 172.31.36.109 -> 54.230.30.245 TCP 66 45168 > http [ACK] Seq=97 Ack=953474 Win=708224 Len=0 TSval=35826959 TSecr=641632295
209   0.099917 54.230.30.245 -> 172.31.36.109 TCP 7306 [TCP segment of a reassembled PDU]
210   0.099932 172.31.36.109 -> 54.230.30.245 TCP 66 45168 > http [ACK] Seq=97 Ack=960714 Win=717952 Len=0 TSval=35826959 TSecr=641632295
211   0.099969 54.230.30.245 -> 172.31.36.109 TCP 5858 [TCP segment of a reassembled PDU]
212   0.099985 172.31.36.109 -> 54.230.30.245 TCP 66 45168 > http [ACK] Seq=97 Ack=966506 Win=729856 Len=0 TSval=35826959 TSecr=641632295
213   0.100097 54.230.30.245 -> 172.31.36.109 TCP 4410 [TCP segment of a reassembled PDU]
214   0.100226 172.31.36.109 -> 54.230.30.245 TCP 66 45168 > http [ACK] Seq=97 Ack=970850 Win=729856 Len=0 TSval=35826959 TSecr=641632295
215   0.100260 54.230.30.245 -> 172.31.36.109 TCP 8754 [TCP segment of a reassembled PDU]
216   0.100279 172.31.36.109 -> 54.230.30.245 TCP 66 45168 > http [ACK] Seq=97 Ack=979538 Win=729856 Len=0 TSval=35826959 TSecr=641632295
217   0.100287 54.230.30.245 -> 172.31.36.109 TCP 1514 [TCP segment of a reassembled PDU]
218   0.100506 54.230.30.245 -> 172.31.36.109 TCP 1890 [TCP segment of a reassembled PDU]
219   0.100548 172.31.36.109 -> 54.230.30.245 TCP 66 45168 > http [ACK] Seq=97 Ack=982810 Win=729856 Len=0 TSval=35826959 TSecr=641632295
220   0.104190 54.230.30.245 -> 172.31.36.109 TCP 1514 [TCP segment of a reassembled PDU]
221   0.104485 54.230.30.245 -> 172.31.36.109 TCP 5858 [TCP segment of a reassembled PDU]
222   0.104507 172.31.36.109 -> 54.230.30.245 TCP 66 45168 > http [ACK] Seq=97 Ack=990050 Win=729856 Len=0 TSval=35826960 TSecr=641632295
223   0.104591 54.230.30.245 -> 172.31.36.109 TCP 18890 [TCP segment of a reassembled PDU]
224   0.104615 172.31.36.109 -> 54.230.30.245 TCP 66 45168 > http [ACK] Seq=97 Ack=1008874 Win=711040 Len=0 TSval=35826960 TSecr=641632295
225   0.104748 54.230.30.245 -> 172.31.36.109 TCP 7306 [TCP segment of a reassembled PDU]
226   0.104773 172.31.36.109 -> 54.230.30.245 TCP 66 45168 > http [ACK] Seq=97 Ack=1016114 Win=717952 Len=0 TSval=35826960 TSecr=641632295
227   0.104803 54.230.30.245 -> 172.31.36.109 TCP 4410 [TCP segment of a reassembled PDU]
228   0.104808 172.31.36.109 -> 54.230.30.245 TCP 66 45168 > http [ACK] Seq=97 Ack=1020458 Win=722688 Len=0 TSval=35826960 TSecr=641632295
229   0.104948 54.230.30.245 -> 172.31.36.109 TCP 13098 [TCP segment of a reassembled PDU]
230   0.104968 172.31.36.109 -> 54.230.30.245 TCP 66 45168 > http [ACK] Seq=97 Ack=1033490 Win=729856 Len=0 TSval=35826960 TSecr=641632295
231   0.105062 54.230.30.245 -> 172.31.36.109 TCP 1514 [TCP segment of a reassembled PDU]
232   0.105124 54.230.30.245 -> 172.31.36.109 HTTP 14162 HTTP/1.1 200 OK  (application/octet-stream)
233   0.105141 172.31.36.109 -> 54.230.30.245 TCP 66 45168 > http [ACK] Seq=97 Ack=1049034 Win=729856 Len=0 TSval=35826960 TSecr=641632295
234   0.105252 172.31.36.109 -> 54.230.30.245 TCP 66 45168 > http [FIN, ACK] Seq=97 Ack=1049034 Win=729856 Len=0 TSval=35826960 TSecr=641632295
235   0.106534 54.230.30.245 -> 172.31.36.109 TCP 66 http > 45168 [FIN, ACK] Seq=1049034 Ack=98 Win=14592 Len=0 TSval=641632295 TSecr=35826960
236   0.106543 172.31.36.109 -> 54.230.30.245 TCP 66 45168 > http [ACK] Seq=98 Ack=1049035 Win=729856 Len=0 TSval=35826960 TSecr=641632295
