[Measurement for 1mb at 03:33:33 20.33.2014] 
Tshark:

  1   0.000000 172.31.36.109 -> 172.31.0.2   DNS 89 Standard query 0x7a04  A d1n0gskdvzj94j.cloudfront.net
  2   0.000023 172.31.36.109 -> 172.31.0.2   DNS 89 Standard query 0xe2f6  AAAA d1n0gskdvzj94j.cloudfront.net
  3   0.000572   172.31.0.2 -> 172.31.36.109 DNS 217 Standard query response 0x7a04  A 54.230.30.50 A 54.230.30.53 A 54.230.30.73 A 54.230.30.221 A 54.192.29.221 A 54.192.30.184 A 54.230.30.3 A 54.230.30.37
  4   0.000583   172.31.0.2 -> 172.31.36.109 DNS 176 Standard query response 0xe2f6 
  5   0.003907 172.31.36.109 -> 54.230.30.50 TCP 74 35593 > http [SYN] Seq=0 Win=26883 Len=0 MSS=8961 SACK_PERM=1 TSval=29525042 TSecr=0 WS=128
  6   0.005317 54.230.30.50 -> 172.31.36.109 TCP 74 http > 35593 [SYN, ACK] Seq=0 Ack=1 Win=14480 Len=0 MSS=1460 SACK_PERM=1 TSval=721819487 TSecr=29525042 WS=128
  7   0.005330 172.31.36.109 -> 54.230.30.50 TCP 66 35593 > http [ACK] Seq=1 Ack=1 Win=27008 Len=0 TSval=29525042 TSecr=721819487
  8   0.005367 172.31.36.109 -> 54.230.30.50 HTTP 162 GET /1mb HTTP/1.1 
  9   0.006740 54.230.30.50 -> 172.31.36.109 TCP 66 http > 35593 [ACK] Seq=1 Ack=97 Win=14592 Len=0 TSval=721819487 TSecr=29525042
 10   0.021060 54.230.30.50 -> 172.31.36.109 TCP 7306 [TCP segment of a reassembled PDU]
 11   0.021070 172.31.36.109 -> 54.230.30.50 TCP 66 35593 > http [ACK] Seq=97 Ack=7241 Win=41472 Len=0 TSval=29525046 TSecr=721819489
 12   0.021204 54.230.30.50 -> 172.31.36.109 TCP 5858 [TCP segment of a reassembled PDU]
 13   0.021211 172.31.36.109 -> 54.230.30.50 TCP 66 35593 > http [ACK] Seq=97 Ack=13033 Win=52992 Len=0 TSval=29525046 TSecr=721819489
 14   0.022377 54.230.30.50 -> 172.31.36.109 TCP 10202 [TCP segment of a reassembled PDU]
 15   0.022387 172.31.36.109 -> 54.230.30.50 TCP 66 35593 > http [ACK] Seq=97 Ack=23169 Win=73344 Len=0 TSval=29525046 TSecr=721819489
 16   0.022505 54.230.30.50 -> 172.31.36.109 TCP 2962 [TCP segment of a reassembled PDU]
 17   0.022518 172.31.36.109 -> 54.230.30.50 TCP 66 35593 > http [ACK] Seq=97 Ack=26065 Win=79104 Len=0 TSval=29525046 TSecr=721819489
 18   0.023342 54.230.30.50 -> 172.31.36.109 TCP 2962 [TCP segment of a reassembled PDU]
 19   0.023347 172.31.36.109 -> 54.230.30.50 TCP 66 35593 > http [ACK] Seq=97 Ack=28961 Win=84864 Len=0 TSval=29525046 TSecr=721819489
 20   0.023567 54.230.30.50 -> 172.31.36.109 TCP 4410 [TCP segment of a reassembled PDU]
 21   0.023572 172.31.36.109 -> 54.230.30.50 TCP 66 35593 > http [ACK] Seq=97 Ack=33305 Win=93568 Len=0 TSval=29525047 TSecr=721819489
 22   0.023631 54.230.30.50 -> 172.31.36.109 TCP 5858 [TCP segment of a reassembled PDU]
 23   0.023636 172.31.36.109 -> 54.230.30.50 TCP 66 35593 > http [ACK] Seq=97 Ack=39097 Win=105088 Len=0 TSval=29525047 TSecr=721819489
 24   0.023865 54.230.30.50 -> 172.31.36.109 TCP 7306 [TCP segment of a reassembled PDU]
 25   0.023871 172.31.36.109 -> 54.230.30.50 TCP 66 35593 > http [ACK] Seq=97 Ack=46337 Win=119680 Len=0 TSval=29525047 TSecr=721819489
 26   0.024690 54.230.30.50 -> 172.31.36.109 TCP 7306 [TCP segment of a reassembled PDU]
 27   0.024697 172.31.36.109 -> 54.230.30.50 TCP 66 35593 > http [ACK] Seq=97 Ack=53577 Win=134144 Len=0 TSval=29525047 TSecr=721819489
 28   0.024715 54.230.30.50 -> 172.31.36.109 TCP 1514 [TCP segment of a reassembled PDU]
 29   0.024718 172.31.36.109 -> 54.230.30.50 TCP 66 35593 > http [ACK] Seq=97 Ack=55025 Win=136960 Len=0 TSval=29525047 TSecr=721819489
 30   0.024962 54.230.30.50 -> 172.31.36.109 TCP 10202 [TCP segment of a reassembled PDU]
 31   0.024970 172.31.36.109 -> 54.230.30.50 TCP 66 35593 > http [ACK] Seq=97 Ack=65161 Win=157312 Len=0 TSval=29525047 TSecr=721819489
 32   0.025700 54.230.30.50 -> 172.31.36.109 TCP 2962 [TCP segment of a reassembled PDU]
 33   0.025712 172.31.36.109 -> 54.230.30.50 TCP 66 35593 > http [ACK] Seq=97 Ack=68057 Win=163072 Len=0 TSval=29525047 TSecr=721819489
 34   0.025861 54.230.30.50 -> 172.31.36.109 TCP 1514 [TCP segment of a reassembled PDU]
 35   0.025884 172.31.36.109 -> 54.230.30.50 TCP 66 35593 > http [ACK] Seq=97 Ack=69505 Win=166016 Len=0 TSval=29525047 TSecr=721819489
 36   0.025990 54.230.30.50 -> 172.31.36.109 TCP 8754 [TCP segment of a reassembled PDU]
 37   0.025997 172.31.36.109 -> 54.230.30.50 TCP 66 35593 > http [ACK] Seq=97 Ack=78193 Win=183296 Len=0 TSval=29525047 TSecr=721819489
 38   0.026177 54.230.30.50 -> 172.31.36.109 TCP 8754 [TCP segment of a reassembled PDU]
 39   0.026184 172.31.36.109 -> 54.230.30.50 TCP 66 35593 > http [ACK] Seq=97 Ack=86881 Win=193024 Len=0 TSval=29525047 TSecr=721819489
 40   0.026248 54.230.30.50 -> 172.31.36.109 TCP 8754 [TCP segment of a reassembled PDU]
 41   0.026256 172.31.36.109 -> 54.230.30.50 TCP 66 35593 > http [ACK] Seq=97 Ack=95569 Win=193024 Len=0 TSval=29525047 TSecr=721819489
 42   0.026967 54.230.30.50 -> 172.31.36.109 TCP 4410 [TCP segment of a reassembled PDU]
 43   0.026980 172.31.36.109 -> 54.230.30.50 TCP 66 35593 > http [ACK] Seq=97 Ack=99913 Win=200064 Len=0 TSval=29525047 TSecr=721819489
 44   0.027307 54.230.30.50 -> 172.31.36.109 TCP 8754 [TCP segment of a reassembled PDU]
 45   0.027323 172.31.36.109 -> 54.230.30.50 TCP 66 35593 > http [ACK] Seq=97 Ack=108601 Win=193024 Len=0 TSval=29525047 TSecr=721819489
 46   0.027496 54.230.30.50 -> 172.31.36.109 TCP 11650 [TCP segment of a reassembled PDU]
 47   0.027505 172.31.36.109 -> 54.230.30.50 TCP 66 35593 > http [ACK] Seq=97 Ack=120185 Win=188288 Len=0 TSval=29525048 TSecr=721819489
 48   0.027611 54.230.30.50 -> 172.31.36.109 TCP 10202 [TCP segment of a reassembled PDU]
 49   0.027636 172.31.36.109 -> 54.230.30.50 TCP 66 35593 > http [ACK] Seq=97 Ack=130321 Win=220928 Len=0 TSval=29525048 TSecr=721819489
 50   0.028486 54.230.30.50 -> 172.31.36.109 TCP 10202 [TCP segment of a reassembled PDU]
 51   0.028495 172.31.36.109 -> 54.230.30.50 TCP 66 35593 > http [ACK] Seq=97 Ack=140457 Win=241280 Len=0 TSval=29525048 TSecr=721819489
 52   0.028621 54.230.30.50 -> 172.31.36.109 TCP 8754 [TCP segment of a reassembled PDU]
 53   0.028629 172.31.36.109 -> 54.230.30.50 TCP 66 35593 > http [ACK] Seq=97 Ack=149145 Win=258688 Len=0 TSval=29525048 TSecr=721819489
 54   0.028830 54.230.30.50 -> 172.31.36.109 TCP 5858 [TCP segment of a reassembled PDU]
 55   0.028836 172.31.36.109 -> 54.230.30.50 TCP 66 35593 > http [ACK] Seq=97 Ack=154937 Win=270208 Len=0 TSval=29525048 TSecr=721819489
 56   0.029001 54.230.30.50 -> 172.31.36.109 TCP 8754 [TCP segment of a reassembled PDU]
 57   0.029033 172.31.36.109 -> 54.230.30.50 TCP 66 35593 > http [ACK] Seq=97 Ack=163625 Win=287616 Len=0 TSval=29525048 TSecr=721819489
 58   0.029179 54.230.30.50 -> 172.31.36.109 TCP 10202 [TCP segment of a reassembled PDU]
 59   0.029186 172.31.36.109 -> 54.230.30.50 TCP 66 35593 > http [ACK] Seq=97 Ack=173761 Win=307840 Len=0 TSval=29525048 TSecr=721819489
 60   0.029463 54.230.30.50 -> 172.31.36.109 TCP 4410 [TCP segment of a reassembled PDU]
 61   0.029468 172.31.36.109 -> 54.230.30.50 TCP 66 35593 > http [ACK] Seq=97 Ack=178105 Win=316544 Len=0 TSval=29525048 TSecr=721819489
 62   0.029587 54.230.30.50 -> 172.31.36.109 TCP 1514 [TCP segment of a reassembled PDU]
 63   0.029591 172.31.36.109 -> 54.230.30.50 TCP 66 35593 > http [ACK] Seq=97 Ack=179553 Win=319488 Len=0 TSval=29525048 TSecr=721819489
 64   0.029702 54.230.30.50 -> 172.31.36.109 TCP 1514 [TCP segment of a reassembled PDU]
 65   0.029706 172.31.36.109 -> 54.230.30.50 TCP 66 35593 > http [ACK] Seq=97 Ack=181001 Win=322304 Len=0 TSval=29525048 TSecr=721819489
 66   0.029801 54.230.30.50 -> 172.31.36.109 TCP 1514 [TCP segment of a reassembled PDU]
 67   0.029805 172.31.36.109 -> 54.230.30.50 TCP 66 35593 > http [ACK] Seq=97 Ack=182449 Win=325248 Len=0 TSval=29525048 TSecr=721819489
 68   0.030002 54.230.30.50 -> 172.31.36.109 TCP 4410 [TCP segment of a reassembled PDU]
 69   0.030012 172.31.36.109 -> 54.230.30.50 TCP 66 35593 > http [ACK] Seq=97 Ack=186793 Win=333952 Len=0 TSval=29525048 TSecr=721819490
 70   0.030219 54.230.30.50 -> 172.31.36.109 TCP 2962 [TCP segment of a reassembled PDU]
 71   0.030225 172.31.36.109 -> 54.230.30.50 TCP 66 35593 > http [ACK] Seq=97 Ack=189689 Win=339712 Len=0 TSval=29525048 TSecr=721819490
 72   0.030344 54.230.30.50 -> 172.31.36.109 TCP 18890 [TCP segment of a reassembled PDU]
 73   0.030355 172.31.36.109 -> 54.230.30.50 TCP 66 35593 > http [ACK] Seq=97 Ack=208513 Win=377344 Len=0 TSval=29525048 TSecr=721819490
 74   0.030432 54.230.30.50 -> 172.31.36.109 TCP 11650 [TCP segment of a reassembled PDU]
 75   0.030441 172.31.36.109 -> 54.230.30.50 TCP 66 35593 > http [ACK] Seq=97 Ack=220097 Win=400512 Len=0 TSval=29525048 TSecr=721819490
 76   0.030494 54.230.30.50 -> 172.31.36.109 TCP 4410 [TCP segment of a reassembled PDU]
 77   0.030500 172.31.36.109 -> 54.230.30.50 TCP 66 35593 > http [ACK] Seq=97 Ack=224441 Win=409216 Len=0 TSval=29525048 TSecr=721819490
 78   0.031031 54.230.30.50 -> 172.31.36.109 TCP 4410 [TCP segment of a reassembled PDU]
 79   0.031036 172.31.36.109 -> 54.230.30.50 TCP 66 35593 > http [ACK] Seq=97 Ack=228785 Win=417920 Len=0 TSval=29525048 TSecr=721819490
 80   0.031240 54.230.30.50 -> 172.31.36.109 TCP 2962 [TCP segment of a reassembled PDU]
 81   0.031246 172.31.36.109 -> 54.230.30.50 TCP 66 35593 > http [ACK] Seq=97 Ack=231681 Win=423680 Len=0 TSval=29525048 TSecr=721819490
 82   0.031380 54.230.30.50 -> 172.31.36.109 TCP 10202 [TCP segment of a reassembled PDU]
 83   0.031404 172.31.36.109 -> 54.230.30.50 TCP 66 35593 > http [ACK] Seq=97 Ack=241817 Win=444032 Len=0 TSval=29525048 TSecr=721819490
 84   0.031640 54.230.30.50 -> 172.31.36.109 TCP 18890 [TCP segment of a reassembled PDU]
 85   0.031652 172.31.36.109 -> 54.230.30.50 TCP 66 35593 > http [ACK] Seq=97 Ack=260641 Win=481664 Len=0 TSval=29525049 TSecr=721819490
 86   0.031712 54.230.30.50 -> 172.31.36.109 TCP 7306 [TCP segment of a reassembled PDU]
 87   0.031720 172.31.36.109 -> 54.230.30.50 TCP 66 35593 > http [ACK] Seq=97 Ack=267881 Win=496128 Len=0 TSval=29525049 TSecr=721819490
 88   0.031805 54.230.30.50 -> 172.31.36.109 TCP 1514 [TCP segment of a reassembled PDU]
 89   0.031810 172.31.36.109 -> 54.230.30.50 TCP 66 35593 > http [ACK] Seq=97 Ack=269329 Win=498944 Len=0 TSval=29525049 TSecr=721819490
 90   0.032277 54.230.30.50 -> 172.31.36.109 TCP 4410 [TCP segment of a reassembled PDU]
 91   0.032292 172.31.36.109 -> 54.230.30.50 TCP 66 35593 > http [ACK] Seq=97 Ack=273673 Win=507648 Len=0 TSval=29525049 TSecr=721819490
 92   0.032442 54.230.30.50 -> 172.31.36.109 TCP 30474 [TCP segment of a reassembled PDU]
 93   0.032457 172.31.36.109 -> 54.230.30.50 TCP 66 35593 > http [ACK] Seq=97 Ack=304081 Win=568448 Len=0 TSval=29525049 TSecr=721819490
 94   0.032544 54.230.30.50 -> 172.31.36.109 TCP 2962 [TCP segment of a reassembled PDU]
 95   0.032550 172.31.36.109 -> 54.230.30.50 TCP 66 35593 > http [ACK] Seq=97 Ack=306977 Win=574336 Len=0 TSval=29525049 TSecr=721819490
 96   0.032799 54.230.30.50 -> 172.31.36.109 TCP 1514 [TCP segment of a reassembled PDU]
 97   0.032804 172.31.36.109 -> 54.230.30.50 TCP 66 35593 > http [ACK] Seq=97 Ack=308425 Win=577152 Len=0 TSval=29525049 TSecr=721819490
 98   0.032937 54.230.30.50 -> 172.31.36.109 TCP 14546 [TCP segment of a reassembled PDU]
 99   0.032959 172.31.36.109 -> 54.230.30.50 TCP 66 35593 > http [ACK] Seq=97 Ack=322905 Win=606208 Len=0 TSval=29525049 TSecr=721819490
100   0.033052 54.230.30.50 -> 172.31.36.109 TCP 4410 [TCP segment of a reassembled PDU]
101   0.033066 172.31.36.109 -> 54.230.30.50 TCP 66 35593 > http [ACK] Seq=97 Ack=327249 Win=614784 Len=0 TSval=29525049 TSecr=721819490
102   0.033131 54.230.30.50 -> 172.31.36.109 TCP 2962 [TCP segment of a reassembled PDU]
103   0.033148 172.31.36.109 -> 54.230.30.50 TCP 66 35593 > http [ACK] Seq=97 Ack=330145 Win=620672 Len=0 TSval=29525049 TSecr=721819490
104   0.033589 54.230.30.50 -> 172.31.36.109 TCP 2962 [TCP segment of a reassembled PDU]
105   0.033594 172.31.36.109 -> 54.230.30.50 TCP 66 35593 > http [ACK] Seq=97 Ack=333041 Win=626432 Len=0 TSval=29525049 TSecr=721819490
106   0.033680 54.230.30.50 -> 172.31.36.109 TCP 2962 [TCP segment of a reassembled PDU]
107   0.033685 172.31.36.109 -> 54.230.30.50 TCP 66 35593 > http [ACK] Seq=97 Ack=335937 Win=632192 Len=0 TSval=29525049 TSecr=721819490
108   0.033931 54.230.30.50 -> 172.31.36.109 TCP 20338 [TCP segment of a reassembled PDU]
109   0.033942 172.31.36.109 -> 54.230.30.50 TCP 66 35593 > http [ACK] Seq=97 Ack=356209 Win=672768 Len=0 TSval=29525049 TSecr=721819490
110   0.034015 54.230.30.50 -> 172.31.36.109 TCP 8754 [TCP segment of a reassembled PDU]
111   0.034022 172.31.36.109 -> 54.230.30.50 TCP 66 35593 > http [ACK] Seq=97 Ack=364897 Win=690176 Len=0 TSval=29525049 TSecr=721819490
112   0.034106 54.230.30.50 -> 172.31.36.109 TCP 7306 [TCP segment of a reassembled PDU]
113   0.034125 172.31.36.109 -> 54.230.30.50 TCP 66 35593 > http [ACK] Seq=97 Ack=372137 Win=704640 Len=0 TSval=29525049 TSecr=721819490
114   0.034244 54.230.30.50 -> 172.31.36.109 TCP 18890 [TCP segment of a reassembled PDU]
115   0.034254 172.31.36.109 -> 54.230.30.50 TCP 66 35593 > http [ACK] Seq=97 Ack=390961 Win=742272 Len=0 TSval=29525049 TSecr=721819490
116   0.034336 54.230.30.50 -> 172.31.36.109 TCP 10202 [TCP segment of a reassembled PDU]
117   0.034343 172.31.36.109 -> 54.230.30.50 TCP 66 35593 > http [ACK] Seq=97 Ack=401097 Win=732160 Len=0 TSval=29525049 TSecr=721819490
118   0.034431 54.230.30.50 -> 172.31.36.109 TCP 1514 [TCP segment of a reassembled PDU]
119   0.034436 172.31.36.109 -> 54.230.30.50 TCP 66 35593 > http [ACK] Seq=97 Ack=402545 Win=745216 Len=0 TSval=29525049 TSecr=721819490
120   0.035097 54.230.30.50 -> 172.31.36.109 TCP 2962 [TCP segment of a reassembled PDU]
121   0.035102 172.31.36.109 -> 54.230.30.50 TCP 66 35593 > http [ACK] Seq=97 Ack=405441 Win=750976 Len=0 TSval=29525049 TSecr=721819490
122   0.035184 54.230.30.50 -> 172.31.36.109 TCP 1514 [TCP segment of a reassembled PDU]
123   0.035201 172.31.36.109 -> 54.230.30.50 TCP 66 35593 > http [ACK] Seq=97 Ack=406889 Win=753792 Len=0 TSval=29525049 TSecr=721819490
124   0.035395 54.230.30.50 -> 172.31.36.109 TCP 10202 [TCP segment of a reassembled PDU]
125   0.035402 172.31.36.109 -> 54.230.30.50 TCP 66 35593 > http [ACK] Seq=97 Ack=417025 Win=758272 Len=0 TSval=29525049 TSecr=721819490
126   0.035484 54.230.30.50 -> 172.31.36.109 TCP 15994 [TCP segment of a reassembled PDU]
127   0.035493 172.31.36.109 -> 54.230.30.50 TCP 66 35593 > http [ACK] Seq=97 Ack=432953 Win=748672 Len=0 TSval=29525050 TSecr=721819490
128   0.035581 54.230.30.50 -> 172.31.36.109 TCP 21786 [TCP segment of a reassembled PDU]
129   0.035592 172.31.36.109 -> 54.230.30.50 TCP 66 35593 > http [ACK] Seq=97 Ack=454673 Win=816384 Len=0 TSval=29525050 TSecr=721819490
130   0.035617 54.230.30.50 -> 172.31.36.109 TCP 4410 [TCP segment of a reassembled PDU]
131   0.035621 172.31.36.109 -> 54.230.30.50 TCP 66 35593 > http [ACK] Seq=97 Ack=459017 Win=825088 Len=0 TSval=29525050 TSecr=721819490
132   0.035741 54.230.30.50 -> 172.31.36.109 TCP 17442 [TCP segment of a reassembled PDU]
133   0.035751 172.31.36.109 -> 54.230.30.50 TCP 66 35593 > http [ACK] Seq=97 Ack=476393 Win=859776 Len=0 TSval=29525050 TSecr=721819490
134   0.035916 54.230.30.50 -> 172.31.36.109 TCP 5858 [TCP segment of a reassembled PDU]
135   0.035922 172.31.36.109 -> 54.230.30.50 TCP 66 35593 > http [ACK] Seq=97 Ack=482185 Win=871424 Len=0 TSval=29525050 TSecr=721819490
136   0.036117 54.230.30.50 -> 172.31.36.109 TCP 2962 [TCP segment of a reassembled PDU]
137   0.036121 172.31.36.109 -> 54.230.30.50 TCP 66 35593 > http [ACK] Seq=97 Ack=485081 Win=877184 Len=0 TSval=29525050 TSecr=721819490
138   0.036225 54.230.30.50 -> 172.31.36.109 TCP 1514 [TCP segment of a reassembled PDU]
139   0.036229 172.31.36.109 -> 54.230.30.50 TCP 66 35593 > http [ACK] Seq=97 Ack=486529 Win=880128 Len=0 TSval=29525050 TSecr=721819490
140   0.036442 54.230.30.50 -> 172.31.36.109 TCP 15994 [TCP segment of a reassembled PDU]
141   0.036451 172.31.36.109 -> 54.230.30.50 TCP 66 35593 > http [ACK] Seq=97 Ack=502457 Win=912000 Len=0 TSval=29525050 TSecr=721819490
142   0.036878 54.230.30.50 -> 172.31.36.109 TCP 4410 [TCP segment of a reassembled PDU]
143   0.036885 172.31.36.109 -> 54.230.30.50 TCP 66 35593 > http [ACK] Seq=97 Ack=506801 Win=920704 Len=0 TSval=29525050 TSecr=721819490
144   0.037073 54.230.30.50 -> 172.31.36.109 TCP 31922 [TCP segment of a reassembled PDU]
145   0.037088 172.31.36.109 -> 54.230.30.50 TCP 66 35593 > http [ACK] Seq=97 Ack=538657 Win=984320 Len=0 TSval=29525050 TSecr=721819490
146   0.037198 54.230.30.50 -> 172.31.36.109 TCP 15994 [TCP segment of a reassembled PDU]
147   0.037221 172.31.36.109 -> 54.230.30.50 TCP 66 35593 > http [ACK] Seq=97 Ack=554585 Win=1016192 Len=0 TSval=29525050 TSecr=721819490
148   0.037298 54.230.30.50 -> 172.31.36.109 TCP 8754 [TCP segment of a reassembled PDU]
149   0.037305 172.31.36.109 -> 54.230.30.50 TCP 66 35593 > http [ACK] Seq=97 Ack=563273 Win=1033600 Len=0 TSval=29525050 TSecr=721819490
150   0.037369 54.230.30.50 -> 172.31.36.109 TCP 1514 [TCP segment of a reassembled PDU]
151   0.037373 172.31.36.109 -> 54.230.30.50 TCP 66 35593 > http [ACK] Seq=97 Ack=564721 Win=1036544 Len=0 TSval=29525050 TSecr=721819490
152   0.037477 54.230.30.50 -> 172.31.36.109 TCP 5858 [TCP segment of a reassembled PDU]
153   0.037484 172.31.36.109 -> 54.230.30.50 TCP 66 35593 > http [ACK] Seq=97 Ack=570513 Win=1044736 Len=0 TSval=29525050 TSecr=721819490
154   0.037571 54.230.30.50 -> 172.31.36.109 TCP 5858 [TCP segment of a reassembled PDU]
155   0.037577 172.31.36.109 -> 54.230.30.50 TCP 66 35593 > http [ACK] Seq=97 Ack=576305 Win=1044736 Len=0 TSval=29525050 TSecr=721819490
156   0.037667 54.230.30.50 -> 172.31.36.109 TCP 8754 [TCP segment of a reassembled PDU]
157   0.037683 172.31.36.109 -> 54.230.30.50 TCP 66 35593 > http [ACK] Seq=97 Ack=584993 Win=1048064 Len=0 TSval=29525050 TSecr=721819490
158   0.037788 54.230.30.50 -> 172.31.36.109 TCP 20338 [TCP segment of a reassembled PDU]
159   0.037810 172.31.36.109 -> 54.230.30.50 TCP 66 35593 > http [ACK] Seq=97 Ack=605265 Win=1027840 Len=0 TSval=29525050 TSecr=721819490
160   0.037979 54.230.30.50 -> 172.31.36.109 TCP 7306 [TCP segment of a reassembled PDU]
161   0.037985 172.31.36.109 -> 54.230.30.50 TCP 66 35593 > http [ACK] Seq=97 Ack=612505 Win=1042304 Len=0 TSval=29525050 TSecr=721819490
162   0.038178 54.230.30.50 -> 172.31.36.109 TCP 4410 [TCP segment of a reassembled PDU]
163   0.038184 172.31.36.109 -> 54.230.30.50 TCP 66 35593 > http [ACK] Seq=97 Ack=616849 Win=1047040 Len=0 TSval=29525050 TSecr=721819490
164   0.038276 54.230.30.50 -> 172.31.36.109 TCP 1514 [TCP segment of a reassembled PDU]
165   0.038280 172.31.36.109 -> 54.230.30.50 TCP 66 35593 > http [ACK] Seq=97 Ack=618297 Win=1051008 Len=0 TSval=29525050 TSecr=721819490
166   0.038547 54.230.30.50 -> 172.31.36.109 TCP 14546 [TCP segment of a reassembled PDU]
167   0.038564 54.230.30.50 -> 172.31.36.109 TCP 11650 [TCP segment of a reassembled PDU]
168   0.038582 172.31.36.109 -> 54.230.30.50 TCP 66 35593 > http [ACK] Seq=97 Ack=644361 Win=1035264 Len=0 TSval=29525050 TSecr=721819490
169   0.038681 54.230.30.50 -> 172.31.36.109 TCP 2962 [TCP segment of a reassembled PDU]
170   0.038686 172.31.36.109 -> 54.230.30.50 TCP 66 35593 > http [ACK] Seq=97 Ack=647257 Win=1049472 Len=0 TSval=29525050 TSecr=721819490
171   0.038776 54.230.30.50 -> 172.31.36.109 TCP 7939 [TCP segment of a reassembled PDU]
172   0.038795 172.31.36.109 -> 54.230.30.50 TCP 66 35593 > http [ACK] Seq=97 Ack=655130 Win=1051008 Len=0 TSval=29525050 TSecr=721819490
173   0.042005 54.230.30.50 -> 172.31.36.109 TCP 1514 [TCP segment of a reassembled PDU]
174   0.042323 54.230.30.50 -> 172.31.36.109 TCP 5858 [TCP segment of a reassembled PDU]
175   0.042360 172.31.36.109 -> 54.230.30.50 TCP 66 35593 > http [ACK] Seq=97 Ack=662370 Win=1051008 Len=0 TSval=29525051 TSecr=721819491
176   0.042392 54.230.30.50 -> 172.31.36.109 TCP 13098 [TCP segment of a reassembled PDU]
177   0.042411 172.31.36.109 -> 54.230.30.50 TCP 66 35593 > http [ACK] Seq=97 Ack=675402 Win=1051008 Len=0 TSval=29525051 TSecr=721819491
178   0.042636 54.230.30.50 -> 172.31.36.109 TCP 5858 [TCP segment of a reassembled PDU]
179   0.042645 54.230.30.50 -> 172.31.36.109 TCP 8754 [TCP segment of a reassembled PDU]
180   0.042657 54.230.30.50 -> 172.31.36.109 TCP 8754 [TCP segment of a reassembled PDU]
181   0.042674 172.31.36.109 -> 54.230.30.50 TCP 66 35593 > http [ACK] Seq=97 Ack=698570 Win=1040000 Len=0 TSval=29525051 TSecr=721819491
182   0.043048 54.230.30.50 -> 172.31.36.109 TCP 14546 [TCP segment of a reassembled PDU]
183   0.043064 54.230.30.50 -> 172.31.36.109 TCP 14546 [TCP segment of a reassembled PDU]
184   0.043078 54.230.30.50 -> 172.31.36.109 TCP 4410 [TCP segment of a reassembled PDU]
185   0.043101 172.31.36.109 -> 54.230.30.50 TCP 66 35593 > http [ACK] Seq=97 Ack=731874 Win=1023104 Len=0 TSval=29525051 TSecr=721819491
186   0.043144 54.230.30.50 -> 172.31.36.109 TCP 7306 [TCP segment of a reassembled PDU]
187   0.043151 172.31.36.109 -> 54.230.30.50 TCP 66 35593 > http [ACK] Seq=97 Ack=739114 Win=1042304 Len=0 TSval=29525051 TSecr=721819491
188   0.043188 54.230.30.50 -> 172.31.36.109 TCP 2962 [TCP segment of a reassembled PDU]
189   0.043193 172.31.36.109 -> 54.230.30.50 TCP 66 35593 > http [ACK] Seq=97 Ack=742010 Win=1049472 Len=0 TSval=29525051 TSecr=721819491
190   0.043299 54.230.30.50 -> 172.31.36.109 TCP 10202 [TCP segment of a reassembled PDU]
191   0.043440 172.31.36.109 -> 54.230.30.50 TCP 66 35593 > http [ACK] Seq=97 Ack=752146 Win=1051008 Len=0 TSval=29525051 TSecr=721819491
192   0.043586 54.230.30.50 -> 172.31.36.109 TCP 13098 [TCP segment of a reassembled PDU]
193   0.043634 172.31.36.109 -> 54.230.30.50 TCP 66 35593 > http [ACK] Seq=97 Ack=765178 Win=1051008 Len=0 TSval=29525052 TSecr=721819491
194   0.044285 54.230.30.50 -> 172.31.36.109 TCP 5858 [TCP segment of a reassembled PDU]
195   0.044334 172.31.36.109 -> 54.230.30.50 TCP 66 35593 > http [ACK] Seq=97 Ack=770970 Win=1051008 Len=0 TSval=29525052 TSecr=721819491
196   0.044550 54.230.30.50 -> 172.31.36.109 TCP 7306 [TCP segment of a reassembled PDU]
197   0.044591 54.230.30.50 -> 172.31.36.109 TCP 8058 [TCP segment of a reassembled PDU]
198   0.044602 172.31.36.109 -> 54.230.30.50 TCP 66 35593 > http [ACK] Seq=97 Ack=786202 Win=1051008 Len=0 TSval=29525052 TSecr=721819491
199   0.097848 54.230.30.50 -> 172.31.36.109 TCP 1514 [TCP segment of a reassembled PDU]
200   0.098040 54.230.30.50 -> 172.31.36.109 TCP 2962 [TCP segment of a reassembled PDU]
201   0.098068 172.31.36.109 -> 54.230.30.50 TCP 66 35593 > http [ACK] Seq=97 Ack=790546 Win=1051008 Len=0 TSval=29525065 TSecr=721819496
202   0.098188 54.230.30.50 -> 172.31.36.109 TCP 20338 [TCP segment of a reassembled PDU]
203   0.098218 172.31.36.109 -> 54.230.30.50 TCP 66 35593 > http [ACK] Seq=97 Ack=810818 Win=1030784 Len=0 TSval=29525065 TSecr=721819496
204   0.098423 54.230.30.50 -> 172.31.36.109 TCP 2962 [TCP segment of a reassembled PDU]
205   0.098428 172.31.36.109 -> 54.230.30.50 TCP 66 35593 > http [ACK] Seq=97 Ack=813714 Win=1049472 Len=0 TSval=29525065 TSecr=721819496
206   0.098437 54.230.30.50 -> 172.31.36.109 TCP 10202 [TCP segment of a reassembled PDU]
207   0.098455 54.230.30.50 -> 172.31.36.109 TCP 17442 [TCP segment of a reassembled PDU]
208   0.098464 54.230.30.50 -> 172.31.36.109 TCP 1514 [TCP segment of a reassembled PDU]
209   0.098481 172.31.36.109 -> 54.230.30.50 TCP 66 35593 > http [ACK] Seq=97 Ack=842674 Win=1023104 Len=0 TSval=29525065 TSecr=721819496
210   0.098618 54.230.30.50 -> 172.31.36.109 TCP 2962 [TCP segment of a reassembled PDU]
211   0.098630 172.31.36.109 -> 54.230.30.50 TCP 66 35593 > http [ACK] Seq=97 Ack=845570 Win=1049472 Len=0 TSval=29525065 TSecr=721819496
212   0.098663 54.230.30.50 -> 172.31.36.109 TCP 14546 [TCP segment of a reassembled PDU]
213   0.098674 54.230.30.50 -> 172.31.36.109 TCP 2962 [TCP segment of a reassembled PDU]
214   0.098690 172.31.36.109 -> 54.230.30.50 TCP 66 35593 > http [ACK] Seq=97 Ack=862946 Win=1032192 Len=0 TSval=29525065 TSecr=721819496
215   0.098934 54.230.30.50 -> 172.31.36.109 TCP 17442 [TCP segment of a reassembled PDU]
216   0.098955 172.31.36.109 -> 54.230.30.50 TCP 66 35593 > http [ACK] Seq=97 Ack=880322 Win=1025664 Len=0 TSval=29525065 TSecr=721819496
217   0.098979 54.230.30.50 -> 172.31.36.109 TCP 5858 [TCP segment of a reassembled PDU]
218   0.098984 172.31.36.109 -> 54.230.30.50 TCP 66 35593 > http [ACK] Seq=97 Ack=886114 Win=1044736 Len=0 TSval=29525065 TSecr=721819496
219   0.099374 54.230.30.50 -> 172.31.36.109 TCP 7306 [TCP segment of a reassembled PDU]
220   0.099411 172.31.36.109 -> 54.230.30.50 TCP 66 35593 > http [ACK] Seq=97 Ack=893354 Win=1051008 Len=0 TSval=29525065 TSecr=721819496
221   0.099535 54.230.30.50 -> 172.31.36.109 TCP 17442 [TCP segment of a reassembled PDU]
222   0.099562 54.230.30.50 -> 172.31.36.109 TCP 2962 [TCP segment of a reassembled PDU]
223   0.099576 172.31.36.109 -> 54.230.30.50 TCP 66 35593 > http [ACK] Seq=97 Ack=913626 Win=1030784 Len=0 TSval=29525066 TSecr=721819496
224   0.099696 54.230.30.50 -> 172.31.36.109 TCP 3714 [TCP segment of a reassembled PDU]
225   0.099701 172.31.36.109 -> 54.230.30.50 TCP 66 35593 > http [ACK] Seq=97 Ack=917274 Win=1047040 Len=0 TSval=29525066 TSecr=721819496
226   0.101424 54.230.30.50 -> 172.31.36.109 TCP 1514 [TCP segment of a reassembled PDU]
227   0.101666 54.230.30.50 -> 172.31.36.109 TCP 4410 [TCP segment of a reassembled PDU]
228   0.101671 172.31.36.109 -> 54.230.30.50 TCP 66 35593 > http [ACK] Seq=97 Ack=923066 Win=1047040 Len=0 TSval=29525066 TSecr=721819497
229   0.101745 54.230.30.50 -> 172.31.36.109 TCP 7306 [TCP segment of a reassembled PDU]
230   0.101768 172.31.36.109 -> 54.230.30.50 TCP 66 35593 > http [ACK] Seq=97 Ack=930306 Win=1051008 Len=0 TSval=29525066 TSecr=721819497
231   0.102102 54.230.30.50 -> 172.31.36.109 TCP 13098 [TCP segment of a reassembled PDU]
232   0.102116 54.230.30.50 -> 172.31.36.109 TCP 11650 [TCP segment of a reassembled PDU]
233   0.102130 54.230.30.50 -> 172.31.36.109 TCP 7306 [TCP segment of a reassembled PDU]
234   0.102146 172.31.36.109 -> 54.230.30.50 TCP 66 35593 > http [ACK] Seq=97 Ack=962162 Win=1023232 Len=0 TSval=29525066 TSecr=721819497
235   0.102235 54.230.30.50 -> 172.31.36.109 TCP 4410 [TCP segment of a reassembled PDU]
236   0.102248 172.31.36.109 -> 54.230.30.50 TCP 66 35593 > http [ACK] Seq=97 Ack=966506 Win=1047040 Len=0 TSval=29525066 TSecr=721819497
237   0.102350 54.230.30.50 -> 172.31.36.109 TCP 10202 [TCP segment of a reassembled PDU]
238   0.102371 54.230.30.50 -> 172.31.36.109 TCP 6234 [TCP segment of a reassembled PDU]
239   0.102409 172.31.36.109 -> 54.230.30.50 TCP 66 35593 > http [ACK] Seq=97 Ack=982810 Win=1051008 Len=0 TSval=29525066 TSecr=721819497
240   0.106326 54.230.30.50 -> 172.31.36.109 TCP 1514 [TCP segment of a reassembled PDU]
241   0.106550 54.230.30.50 -> 172.31.36.109 TCP 1514 [TCP segment of a reassembled PDU]
242   0.106554 172.31.36.109 -> 54.230.30.50 TCP 66 35593 > http [ACK] Seq=97 Ack=985706 Win=1051008 Len=0 TSval=29525067 TSecr=721819497
243   0.106722 54.230.30.50 -> 172.31.36.109 TCP 2962 [TCP segment of a reassembled PDU]
244   0.106735 172.31.36.109 -> 54.230.30.50 TCP 66 35593 > http [ACK] Seq=97 Ack=988602 Win=1051008 Len=0 TSval=29525067 TSecr=721819497
245   0.106883 54.230.30.50 -> 172.31.36.109 TCP 13098 [TCP segment of a reassembled PDU]
