[Measurement for 10kb at 00:33:52 20.33.2014] 
Tshark:

  1   0.000000 172.31.36.109 -> 172.31.0.2   DNS 89 Standard query 0x55f2  A d3m1c4hwkgedal.cloudfront.net
  2   0.000022 172.31.36.109 -> 172.31.0.2   DNS 89 Standard query 0xf7da  AAAA d3m1c4hwkgedal.cloudfront.net
  3   0.000525   172.31.0.2 -> 172.31.36.109 DNS 174 Standard query response 0xf7da 
  4   0.000535   172.31.0.2 -> 172.31.36.109 DNS 217 Standard query response 0x55f2  A 54.192.30.227 A 54.230.29.240 A 54.230.30.229 A 54.230.30.245 A 54.230.30.251 A 54.230.31.5 A 54.192.29.224 A 54.192.30.225
  5   0.003895 172.31.36.109 -> 54.192.30.227 TCP 74 33562 > http [SYN] Seq=0 Win=26883 Len=0 MSS=8961 SACK_PERM=1 TSval=26829837 TSecr=0 WS=128
  6   0.005144 54.192.30.227 -> 172.31.36.109 TCP 74 http > 33562 [SYN, ACK] Seq=0 Ack=1 Win=14480 Len=0 MSS=1460 SACK_PERM=1 TSval=669706957 TSecr=26829837 WS=128
  7   0.005158 172.31.36.109 -> 54.192.30.227 TCP 66 33562 > http [ACK] Seq=1 Ack=1 Win=27008 Len=0 TSval=26829837 TSecr=669706957
  8   0.005197 172.31.36.109 -> 54.192.30.227 HTTP 163 GET /10kb HTTP/1.1 
  9   0.006206 54.192.30.227 -> 172.31.36.109 TCP 66 http > 33562 [ACK] Seq=1 Ack=98 Win=14592 Len=0 TSval=669706957 TSecr=26829837
 10   0.012362 54.192.30.227 -> 172.31.36.109 HTTP 10761 HTTP/1.1 200 OK  (application/octet-stream)
 11   0.012374 172.31.36.109 -> 54.192.30.227 TCP 66 33562 > http [ACK] Seq=98 Ack=10696 Win=48384 Len=0 TSval=26829839 TSecr=669706958
 12   0.012518 172.31.36.109 -> 54.192.30.227 TCP 66 33562 > http [FIN, ACK] Seq=98 Ack=10696 Win=48384 Len=0 TSval=26829839 TSecr=669706958
 13   0.013561 54.192.30.227 -> 172.31.36.109 TCP 66 http > 33562 [FIN, ACK] Seq=10696 Ack=99 Win=14592 Len=0 TSval=669706958 TSecr=26829839
 14   0.013590 172.31.36.109 -> 54.192.30.227 TCP 66 33562 > http [ACK] Seq=99 Ack=10697 Win=48384 Len=0 TSval=26829840 TSecr=669706958
