[Measurement for 10kb at 06:33:53 20.33.2014] 
Tshark:

  1   0.000000 172.31.36.109 -> 172.31.0.2   DNS 89 Standard query 0x9642  A d3m1c4hwkgedal.cloudfront.net
  2   0.000026 172.31.36.109 -> 172.31.0.2   DNS 89 Standard query 0xdf6b  AAAA d3m1c4hwkgedal.cloudfront.net
  3   0.000512   172.31.0.2 -> 172.31.36.109 DNS 174 Standard query response 0xdf6b 
  4   0.000522   172.31.0.2 -> 172.31.36.109 DNS 217 Standard query response 0x9642  A 54.230.30.210 A 54.230.30.242 A 54.192.30.139 A 54.192.30.227 A 54.230.30.2 A 54.230.30.8 A 54.230.30.37 A 54.230.30.53
  5   0.003875 172.31.36.109 -> 54.230.30.210 TCP 74 52107 > http [SYN] Seq=0 Win=26883 Len=0 MSS=8961 SACK_PERM=1 TSval=32229999 TSecr=0 WS=128
  6   0.005408 54.230.30.210 -> 172.31.36.109 TCP 74 http > 52107 [SYN, ACK] Seq=0 Ack=1 Win=14480 Len=0 MSS=1460 SACK_PERM=1 TSval=717319165 TSecr=32229999 WS=128
  7   0.005422 172.31.36.109 -> 54.230.30.210 TCP 66 52107 > http [ACK] Seq=1 Ack=1 Win=27008 Len=0 TSval=32229999 TSecr=717319165
  8   0.005464 172.31.36.109 -> 54.230.30.210 HTTP 163 GET /10kb HTTP/1.1 
  9   0.006718 54.230.30.210 -> 172.31.36.109 TCP 66 http > 52107 [ACK] Seq=1 Ack=98 Win=14592 Len=0 TSval=717319165 TSecr=32229999
 10   0.039441 54.230.30.210 -> 172.31.36.109 TCP 7306 [TCP segment of a reassembled PDU]
 11   0.039451 172.31.36.109 -> 54.230.30.210 TCP 66 52107 > http [ACK] Seq=98 Ack=7241 Win=41472 Len=0 TSval=32230008 TSecr=717319169
 12   0.039471 54.230.30.210 -> 172.31.36.109 TCP 1514 [TCP segment of a reassembled PDU]
 13   0.039476 172.31.36.109 -> 54.230.30.210 TCP 66 52107 > http [ACK] Seq=98 Ack=8689 Win=44288 Len=0 TSval=32230008 TSecr=717319169
 14   0.039541 54.230.30.210 -> 172.31.36.109 HTTP 2073 HTTP/1.1 200 OK  (application/octet-stream)
 15   0.039548 172.31.36.109 -> 54.230.30.210 TCP 66 52107 > http [ACK] Seq=98 Ack=10696 Win=48384 Len=0 TSval=32230008 TSecr=717319169
 16   0.039728 172.31.36.109 -> 54.230.30.210 TCP 66 52107 > http [FIN, ACK] Seq=98 Ack=10696 Win=48384 Len=0 TSval=32230008 TSecr=717319169
 17   0.041113 54.230.30.210 -> 172.31.36.109 TCP 66 http > 52107 [FIN, ACK] Seq=10696 Ack=99 Win=14592 Len=0 TSval=717319169 TSecr=32230008
 18   0.041122 172.31.36.109 -> 54.230.30.210 TCP 66 52107 > http [ACK] Seq=99 Ack=10697 Win=48384 Len=0 TSval=32230008 TSecr=717319169
