[Measurement for 1kb at 20:01:25 16.01.2014] 
Tshark:

  1   0.000000 64.233.164.189 -> 192.168.1.2  TLSv1.2 105 Application Data
  2   0.051208  192.168.1.2 -> 64.233.164.189 TCP 54 64307→443 [ACK] Seq=1 Ack=52 Win=252 Len=0
  3   1.340566  192.168.1.2 -> 54.230.98.198 TCP 66 64574→80 [SYN] Seq=0 Win=8192 Len=0 MSS=1460 WS=256 SACK_PERM=1
  4   1.390350 54.230.98.198 -> 192.168.1.2  TCP 66 80→64574 [SYN, ACK] Seq=0 Ack=1 Win=14600 Len=0 MSS=1400 SACK_PERM=1 WS=128
  5   1.390492  192.168.1.2 -> 54.230.98.198 TCP 54 64574→80 [ACK] Seq=1 Ack=1 Win=65792 Len=0
  6   1.390656  192.168.1.2 -> 54.230.98.198 HTTP 150 GET /1kb HTTP/1.1 
  7   1.418300 54.230.98.198 -> 192.168.1.2  TCP 54 80→64574 [ACK] Seq=1 Ack=97 Win=14720 Len=0
  8   1.421772 54.230.98.198 -> 192.168.1.2  TCP 1454 [TCP segment of a reassembled PDU]
  9   1.422311 54.230.98.198 -> 192.168.1.2  HTTP 132 HTTP/1.1 200 OK  (application/octet-stream)
 10   1.422381  192.168.1.2 -> 54.230.98.198 TCP 54 64574→80 [ACK] Seq=97 Ack=1479 Win=65792 Len=0
 11   1.422627  192.168.1.2 -> 54.230.98.198 TCP 54 64574→80 [FIN, ACK] Seq=97 Ack=1479 Win=65792 Len=0
 12   1.462473 54.230.98.198 -> 192.168.1.2  TCP 54 80→64574 [FIN, ACK] Seq=1479 Ack=98 Win=14720 Len=0
 13   1.462608  192.168.1.2 -> 54.230.98.198 TCP 54 64574→80 [ACK] Seq=98 Ack=1480 Win=65792 Len=0
