[Measurement for 10mb at 20:33:25 19.33.2014] 
Tshark:

  1   0.000000 172.31.36.109 -> 172.31.0.2   DNS 88 Standard query 0x3269  A dm53kc3eax57k.cloudfront.net
  2   0.000061 172.31.36.109 -> 172.31.0.2   DNS 88 Standard query 0xd4d6  AAAA dm53kc3eax57k.cloudfront.net
  3   0.000444   172.31.0.2 -> 172.31.36.109 DNS 175 Standard query response 0xd4d6 
  4   0.000454   172.31.0.2 -> 172.31.36.109 DNS 216 Standard query response 0x3269  A 54.230.31.8 A 54.192.30.188 A 54.192.30.189 A 54.230.29.244 A 54.230.30.190 A 54.230.30.219 A 54.230.30.251 A 54.230.31.5
  5   0.003843 172.31.36.109 -> 54.230.31.8  TCP 74 42947 > http [SYN] Seq=0 Win=26883 Len=0 MSS=8961 SACK_PERM=1 TSval=23223062 TSecr=0 WS=128
  6   0.005022  54.230.31.8 -> 172.31.36.109 TCP 74 http > 42947 [SYN, ACK] Seq=0 Ack=1 Win=14480 Len=0 MSS=1460 SACK_PERM=1 TSval=710362454 TSecr=23223062 WS=128
  7   0.005037 172.31.36.109 -> 54.230.31.8  TCP 66 42947 > http [ACK] Seq=1 Ack=1 Win=27008 Len=0 TSval=23223063 TSecr=710362454
  8   0.005079 172.31.36.109 -> 54.230.31.8  HTTP 162 GET /10mb HTTP/1.1 
  9   0.006332  54.230.31.8 -> 172.31.36.109 TCP 66 http > 42947 [ACK] Seq=1 Ack=97 Win=14592 Len=0 TSval=710362454 TSecr=23223063
 10   0.020035  54.230.31.8 -> 172.31.36.109 TCP 1132 [TCP segment of a reassembled PDU]
 11   0.020051 172.31.36.109 -> 54.230.31.8  TCP 66 42947 > http [ACK] Seq=97 Ack=1067 Win=29056 Len=0 TSval=23223067 TSecr=710362455
 12   0.020067  54.230.31.8 -> 172.31.36.109 TCP 13098 [TCP segment of a reassembled PDU]
 13   0.020079 172.31.36.109 -> 54.230.31.8  TCP 66 42947 > http [ACK] Seq=97 Ack=14099 Win=55168 Len=0 TSval=23223067 TSecr=710362455
 14   0.021175  54.230.31.8 -> 172.31.36.109 TCP 2962 [TCP segment of a reassembled PDU]
 15   0.021181 172.31.36.109 -> 54.230.31.8  TCP 66 42947 > http [ACK] Seq=97 Ack=16995 Win=60928 Len=0 TSval=23223067 TSecr=710362455
 16   0.021191  54.230.31.8 -> 172.31.36.109 TCP 4410 [TCP segment of a reassembled PDU]
 17   0.021194 172.31.36.109 -> 54.230.31.8  TCP 66 42947 > http [ACK] Seq=97 Ack=21339 Win=69632 Len=0 TSval=23223067 TSecr=710362455
 18   0.021234  54.230.31.8 -> 172.31.36.109 TCP 5858 [TCP segment of a reassembled PDU]
 19   0.021241 172.31.36.109 -> 54.230.31.8  TCP 66 42947 > http [ACK] Seq=97 Ack=27131 Win=81152 Len=0 TSval=23223067 TSecr=710362455
 20   0.022571  54.230.31.8 -> 172.31.36.109 TCP 2962 [TCP segment of a reassembled PDU]
 21   0.022577 172.31.36.109 -> 54.230.31.8  TCP 66 42947 > http [ACK] Seq=97 Ack=30027 Win=87040 Len=0 TSval=23223067 TSecr=710362455
 22   0.022591  54.230.31.8 -> 172.31.36.109 TCP 8754 [TCP segment of a reassembled PDU]
 23   0.022597 172.31.36.109 -> 54.230.31.8  TCP 66 42947 > http [ACK] Seq=97 Ack=38715 Win=98944 Len=0 TSval=23223067 TSecr=710362455
 24   0.022632  54.230.31.8 -> 172.31.36.109 TCP 7306 [TCP segment of a reassembled PDU]
 25   0.022638 172.31.36.109 -> 54.230.31.8  TCP 66 42947 > http [ACK] Seq=97 Ack=45955 Win=105984 Len=0 TSval=23223067 TSecr=710362455
 26   0.022708  54.230.31.8 -> 172.31.36.109 TCP 2962 [TCP segment of a reassembled PDU]
 27   0.022713 172.31.36.109 -> 54.230.31.8  TCP 66 42947 > http [ACK] Seq=97 Ack=48851 Win=109056 Len=0 TSval=23223067 TSecr=710362455
 28   0.023756  54.230.31.8 -> 172.31.36.109 TCP 5858 [TCP segment of a reassembled PDU]
 29   0.023762 172.31.36.109 -> 54.230.31.8  TCP 66 42947 > http [ACK] Seq=97 Ack=54643 Win=108416 Len=0 TSval=23223067 TSecr=710362456
 30   0.023823  54.230.31.8 -> 172.31.36.109 TCP 11650 [TCP segment of a reassembled PDU]
 31   0.023831 172.31.36.109 -> 54.230.31.8  TCP 66 42947 > http [ACK] Seq=97 Ack=66227 Win=98944 Len=0 TSval=23223067 TSecr=710362456
 32   0.024033  54.230.31.8 -> 172.31.36.109 TCP 4410 [TCP segment of a reassembled PDU]
 33   0.024038 172.31.36.109 -> 54.230.31.8  TCP 66 42947 > http [ACK] Seq=97 Ack=70571 Win=109056 Len=0 TSval=23223068 TSecr=710362456
 34   0.024074  54.230.31.8 -> 172.31.36.109 TCP 5858 [TCP segment of a reassembled PDU]
 35   0.024080 172.31.36.109 -> 54.230.31.8  TCP 66 42947 > http [ACK] Seq=97 Ack=76363 Win=120704 Len=0 TSval=23223068 TSecr=710362456
 36   0.025029  54.230.31.8 -> 172.31.36.109 TCP 1514 [TCP segment of a reassembled PDU]
 37   0.025035 172.31.36.109 -> 54.230.31.8  TCP 66 42947 > http [ACK] Seq=97 Ack=77811 Win=123520 Len=0 TSval=23223068 TSecr=710362456
 38   0.025204  54.230.31.8 -> 172.31.36.109 TCP 1514 [TCP segment of a reassembled PDU]
 39   0.025209 172.31.36.109 -> 54.230.31.8  TCP 66 42947 > http [ACK] Seq=97 Ack=79259 Win=126464 Len=0 TSval=23223068 TSecr=710362456
 40   0.025227  54.230.31.8 -> 172.31.36.109 TCP 17442 [TCP segment of a reassembled PDU]
 41   0.025236 172.31.36.109 -> 54.230.31.8  TCP 66 42947 > http [ACK] Seq=97 Ack=96635 Win=161152 Len=0 TSval=23223068 TSecr=710362456
 42   0.025247  54.230.31.8 -> 172.31.36.109 TCP 2962 [TCP segment of a reassembled PDU]
 43   0.025250 172.31.36.109 -> 54.230.31.8  TCP 66 42947 > http [ACK] Seq=97 Ack=99531 Win=167040 Len=0 TSval=23223068 TSecr=710362456
 44   0.025346  54.230.31.8 -> 172.31.36.109 TCP 10202 [TCP segment of a reassembled PDU]
 45   0.025354 172.31.36.109 -> 54.230.31.8  TCP 66 42947 > http [ACK] Seq=97 Ack=109667 Win=187264 Len=0 TSval=23223068 TSecr=710362456
 46   0.026579  54.230.31.8 -> 172.31.36.109 TCP 10202 [TCP segment of a reassembled PDU]
 47   0.026598 172.31.36.109 -> 54.230.31.8  TCP 66 42947 > http [ACK] Seq=97 Ack=119803 Win=207488 Len=0 TSval=23223068 TSecr=710362456
 48   0.026769  54.230.31.8 -> 172.31.36.109 TCP 27578 [TCP segment of a reassembled PDU]
 49   0.026784 172.31.36.109 -> 54.230.31.8  TCP 66 42947 > http [ACK] Seq=97 Ack=147315 Win=262528 Len=0 TSval=23223068 TSecr=710362456
 50   0.026793  54.230.31.8 -> 172.31.36.109 TCP 2962 [TCP segment of a reassembled PDU]
 51   0.026796 172.31.36.109 -> 54.230.31.8  TCP 66 42947 > http [ACK] Seq=97 Ack=150211 Win=268288 Len=0 TSval=23223068 TSecr=710362456
 52   0.027850  54.230.31.8 -> 172.31.36.109 TCP 2962 [TCP segment of a reassembled PDU]
 53   0.027857 172.31.36.109 -> 54.230.31.8  TCP 66 42947 > http [ACK] Seq=97 Ack=153107 Win=274176 Len=0 TSval=23223068 TSecr=710362456
 54   0.028006  54.230.31.8 -> 172.31.36.109 TCP 7306 [TCP segment of a reassembled PDU]
 55   0.028024 172.31.36.109 -> 54.230.31.8  TCP 66 42947 > http [ACK] Seq=97 Ack=160347 Win=288640 Len=0 TSval=23223069 TSecr=710362456
 56   0.028155  54.230.31.8 -> 172.31.36.109 TCP 4410 [TCP segment of a reassembled PDU]
 57   0.028161 172.31.36.109 -> 54.230.31.8  TCP 66 42947 > http [ACK] Seq=97 Ack=164691 Win=297344 Len=0 TSval=23223069 TSecr=710362456
 58   0.028310  54.230.31.8 -> 172.31.36.109 TCP 26130 [TCP segment of a reassembled PDU]
 59   0.028324 172.31.36.109 -> 54.230.31.8  TCP 66 42947 > http [ACK] Seq=97 Ack=190755 Win=349440 Len=0 TSval=23223069 TSecr=710362456
 60   0.029099  54.230.31.8 -> 172.31.36.109 TCP 1514 [TCP segment of a reassembled PDU]
 61   0.029104 172.31.36.109 -> 54.230.31.8  TCP 66 42947 > http [ACK] Seq=97 Ack=192203 Win=352384 Len=0 TSval=23223069 TSecr=710362456
 62   0.029230  54.230.31.8 -> 172.31.36.109 TCP 8754 [TCP segment of a reassembled PDU]
 63   0.029237 172.31.36.109 -> 54.230.31.8  TCP 66 42947 > http [ACK] Seq=97 Ack=200891 Win=369664 Len=0 TSval=23223069 TSecr=710362456
 64   0.029622  54.230.31.8 -> 172.31.36.109 TCP 1514 [TCP segment of a reassembled PDU]
 65   0.029626 172.31.36.109 -> 54.230.31.8  TCP 66 42947 > http [ACK] Seq=97 Ack=202339 Win=372608 Len=0 TSval=23223069 TSecr=710362456
 66   0.029854  54.230.31.8 -> 172.31.36.109 TCP 27578 [TCP segment of a reassembled PDU]
 67   0.029880 172.31.36.109 -> 54.230.31.8  TCP 66 42947 > http [ACK] Seq=97 Ack=229851 Win=427648 Len=0 TSval=23223069 TSecr=710362456
 68   0.029984  54.230.31.8 -> 172.31.36.109 TCP 11650 [TCP segment of a reassembled PDU]
 69   0.029993 172.31.36.109 -> 54.230.31.8  TCP 66 42947 > http [ACK] Seq=97 Ack=241435 Win=450816 Len=0 TSval=23223069 TSecr=710362456
 70   0.031212  54.230.31.8 -> 172.31.36.109 TCP 1514 [TCP segment of a reassembled PDU]
 71   0.031217 172.31.36.109 -> 54.230.31.8  TCP 66 42947 > http [ACK] Seq=97 Ack=242883 Win=453632 Len=0 TSval=23223069 TSecr=710362456
 72   0.031428  54.230.31.8 -> 172.31.36.109 TCP 2962 [TCP segment of a reassembled PDU]
 73   0.031433 172.31.36.109 -> 54.230.31.8  TCP 66 42947 > http [ACK] Seq=97 Ack=245779 Win=459520 Len=0 TSval=23223069 TSecr=710362456
 74   0.031506  54.230.31.8 -> 172.31.36.109 TCP 13098 [TCP segment of a reassembled PDU]
 75   0.031515 172.31.36.109 -> 54.230.31.8  TCP 66 42947 > http [ACK] Seq=97 Ack=258811 Win=485504 Len=0 TSval=23223069 TSecr=710362456
 76   0.031602  54.230.31.8 -> 172.31.36.109 TCP 20338 [TCP segment of a reassembled PDU]
 77   0.031612 172.31.36.109 -> 54.230.31.8  TCP 66 42947 > http [ACK] Seq=97 Ack=279083 Win=512896 Len=0 TSval=23223069 TSecr=710362456
 78   0.031664  54.230.31.8 -> 172.31.36.109 TCP 2962 [TCP segment of a reassembled PDU]
 79   0.031669 172.31.36.109 -> 54.230.31.8  TCP 66 42947 > http [ACK] Seq=97 Ack=281979 Win=510080 Len=0 TSval=23223069 TSecr=710362456
 80   0.032468  54.230.31.8 -> 172.31.36.109 TCP 2962 [TCP segment of a reassembled PDU]
 81   0.032474 172.31.36.109 -> 54.230.31.8  TCP 66 42947 > http [ACK] Seq=97 Ack=284875 Win=531840 Len=0 TSval=23223070 TSecr=710362456
 82   0.032596  54.230.31.8 -> 172.31.36.109 TCP 17442 [TCP segment of a reassembled PDU]
 83   0.032616 172.31.36.109 -> 54.230.31.8  TCP 66 42947 > http [ACK] Seq=97 Ack=302251 Win=557056 Len=0 TSval=23223070 TSecr=710362456
 84   0.032962  54.230.31.8 -> 172.31.36.109 TCP 1514 [TCP segment of a reassembled PDU]
 85   0.032967 172.31.36.109 -> 54.230.31.8  TCP 66 42947 > http [ACK] Seq=97 Ack=303699 Win=569472 Len=0 TSval=23223070 TSecr=710362457
 86   0.033085  54.230.31.8 -> 172.31.36.109 TCP 17442 [TCP segment of a reassembled PDU]
 87   0.033096 172.31.36.109 -> 54.230.31.8  TCP 66 42947 > http [ACK] Seq=97 Ack=321075 Win=557056 Len=0 TSval=23223070 TSecr=710362457
 88   0.033138  54.230.31.8 -> 172.31.36.109 TCP 8754 [TCP segment of a reassembled PDU]
 89   0.033144 172.31.36.109 -> 54.230.31.8  TCP 66 42947 > http [ACK] Seq=97 Ack=329763 Win=571392 Len=0 TSval=23223070 TSecr=710362457
 90   0.033168  54.230.31.8 -> 172.31.36.109 TCP 1514 [TCP segment of a reassembled PDU]
 91   0.033173 172.31.36.109 -> 54.230.31.8  TCP 66 42947 > http [ACK] Seq=97 Ack=331211 Win=583296 Len=0 TSval=23223070 TSecr=710362457
 92   0.033253  54.230.31.8 -> 172.31.36.109 TCP 8754 [TCP segment of a reassembled PDU]
 93   0.033260 172.31.36.109 -> 54.230.31.8  TCP 66 42947 > http [ACK] Seq=97 Ack=339899 Win=574720 Len=0 TSval=23223070 TSecr=710362457
 94   0.033326  54.230.31.8 -> 172.31.36.109 TCP 1514 [TCP segment of a reassembled PDU]
 95   0.033331 172.31.36.109 -> 54.230.31.8  TCP 66 42947 > http [ACK] Seq=97 Ack=341347 Win=583296 Len=0 TSval=23223070 TSecr=710362457
 96   0.033713  54.230.31.8 -> 172.31.36.109 TCP 1514 [TCP segment of a reassembled PDU]
 97   0.033717 172.31.36.109 -> 54.230.31.8  TCP 66 42947 > http [ACK] Seq=97 Ack=342795 Win=583296 Len=0 TSval=23223070 TSecr=710362457
 98   0.033840  54.230.31.8 -> 172.31.36.109 TCP 20338 [TCP segment of a reassembled PDU]
 99   0.033872 172.31.36.109 -> 54.230.31.8  TCP 66 42947 > http [ACK] Seq=97 Ack=363067 Win=563072 Len=0 TSval=23223070 TSecr=710362457
100   0.033969  54.230.31.8 -> 172.31.36.109 TCP 7306 [TCP segment of a reassembled PDU]
101   0.033976 172.31.36.109 -> 54.230.31.8  TCP 66 42947 > http [ACK] Seq=97 Ack=370307 Win=573824 Len=0 TSval=23223070 TSecr=710362457
102   0.034196  54.230.31.8 -> 172.31.36.109 TCP 1514 [TCP segment of a reassembled PDU]
103   0.034365  54.230.31.8 -> 172.31.36.109 TCP 29026 [TCP segment of a reassembled PDU]
104   0.034584 172.31.36.109 -> 54.230.31.8  TCP 66 42947 > http [ACK] Seq=97 Ack=400715 Win=543488 Len=0 TSval=23223070 TSecr=710362457
105   0.035234  54.230.31.8 -> 172.31.36.109 TCP 2962 [TCP segment of a reassembled PDU]
106   0.035239 172.31.36.109 -> 54.230.31.8  TCP 66 42947 > http [ACK] Seq=97 Ack=403611 Win=580864 Len=0 TSval=23223070 TSecr=710362457
107   0.035384  54.230.31.8 -> 172.31.36.109 TCP 21786 [TCP segment of a reassembled PDU]
108   0.035409 172.31.36.109 -> 54.230.31.8  TCP 66 42947 > http [ACK] Seq=97 Ack=425331 Win=559232 Len=0 TSval=23223070 TSecr=710362457
109   0.035489  54.230.31.8 -> 172.31.36.109 TCP 8754 [TCP segment of a reassembled PDU]
110   0.035496 172.31.36.109 -> 54.230.31.8  TCP 66 42947 > http [ACK] Seq=97 Ack=434019 Win=571392 Len=0 TSval=23223070 TSecr=710362457
111   0.035557  54.230.31.8 -> 172.31.36.109 TCP 8754 [TCP segment of a reassembled PDU]
112   0.035565 172.31.36.109 -> 54.230.31.8  TCP 66 42947 > http [ACK] Seq=97 Ack=442707 Win=571392 Len=0 TSval=23223070 TSecr=710362457
113   0.035876  54.230.31.8 -> 172.31.36.109 TCP 7306 [TCP segment of a reassembled PDU]
114   0.035883 172.31.36.109 -> 54.230.31.8  TCP 66 42947 > http [ACK] Seq=97 Ack=449947 Win=573824 Len=0 TSval=23223070 TSecr=710362457
115   0.035945  54.230.31.8 -> 172.31.36.109 TCP 10202 [TCP segment of a reassembled PDU]
116   0.035977 172.31.36.109 -> 54.230.31.8  TCP 66 42947 > http [ACK] Seq=97 Ack=460083 Win=586880 Len=0 TSval=23223071 TSecr=710362457
117   0.036762  54.230.31.8 -> 172.31.36.109 TCP 1514 [TCP segment of a reassembled PDU]
118   0.036766 172.31.36.109 -> 54.230.31.8  TCP 66 42947 > http [ACK] Seq=97 Ack=461531 Win=589824 Len=0 TSval=23223071 TSecr=710362457
119   0.036946  54.230.31.8 -> 172.31.36.109 TCP 26130 [TCP segment of a reassembled PDU]
120   0.036961 172.31.36.109 -> 54.230.31.8  TCP 66 42947 > http [ACK] Seq=97 Ack=487595 Win=641920 Len=0 TSval=23223071 TSecr=710362457
121   0.037044  54.230.31.8 -> 172.31.36.109 TCP 5858 [TCP segment of a reassembled PDU]
122   0.037051 172.31.36.109 -> 54.230.31.8  TCP 66 42947 > http [ACK] Seq=97 Ack=493387 Win=653568 Len=0 TSval=23223071 TSecr=710362457
123   0.037102  54.230.31.8 -> 172.31.36.109 TCP 8754 [TCP segment of a reassembled PDU]
124   0.037109 172.31.36.109 -> 54.230.31.8  TCP 66 42947 > http [ACK] Seq=97 Ack=502075 Win=670848 Len=0 TSval=23223071 TSecr=710362457
125   0.037222  54.230.31.8 -> 172.31.36.109 TCP 15994 [TCP segment of a reassembled PDU]
126   0.037231 172.31.36.109 -> 54.230.31.8  TCP 66 42947 > http [ACK] Seq=97 Ack=518003 Win=698240 Len=0 TSval=23223071 TSecr=710362457
127   0.037403  54.230.31.8 -> 172.31.36.109 TCP 7306 [TCP segment of a reassembled PDU]
128   0.037410 172.31.36.109 -> 54.230.31.8  TCP 66 42947 > http [ACK] Seq=97 Ack=525243 Win=717184 Len=0 TSval=23223071 TSecr=710362457
129   0.038311  54.230.31.8 -> 172.31.36.109 TCP 1514 [TCP segment of a reassembled PDU]
130   0.038316 172.31.36.109 -> 54.230.31.8  TCP 66 42947 > http [ACK] Seq=97 Ack=526691 Win=720128 Len=0 TSval=23223071 TSecr=710362457
131   0.038510  54.230.31.8 -> 172.31.36.109 TCP 23234 [TCP segment of a reassembled PDU]
132   0.038545 172.31.36.109 -> 54.230.31.8  TCP 66 42947 > http [ACK] Seq=97 Ack=549859 Win=700800 Len=0 TSval=23223071 TSecr=710362457
133   0.038576  54.230.31.8 -> 172.31.36.109 TCP 2962 [TCP segment of a reassembled PDU]
134   0.038590 172.31.36.109 -> 54.230.31.8  TCP 66 42947 > http [ACK] Seq=97 Ack=552755 Win=725888 Len=0 TSval=23223071 TSecr=710362457
135   0.038691  54.230.31.8 -> 172.31.36.109 TCP 26130 [TCP segment of a reassembled PDU]
136   0.038723  54.230.31.8 -> 172.31.36.109 TCP 5858 [TCP segment of a reassembled PDU]
137   0.038728 172.31.36.109 -> 54.230.31.8  TCP 66 42947 > http [ACK] Seq=97 Ack=578819 Win=699904 Len=0 TSval=23223071 TSecr=710362457
138   0.038756 172.31.36.109 -> 54.230.31.8  TCP 66 42947 > http [ACK] Seq=97 Ack=584611 Win=725888 Len=0 TSval=23223071 TSecr=710362457
139   0.038814  54.230.31.8 -> 172.31.36.109 TCP 2962 [TCP segment of a reassembled PDU]
140   0.038819 172.31.36.109 -> 54.230.31.8  TCP 66 42947 > http [ACK] Seq=97 Ack=587507 Win=731648 Len=0 TSval=23223071 TSecr=710362457
141   0.038953  54.230.31.8 -> 172.31.36.109 TCP 14546 [TCP segment of a reassembled PDU]
142   0.038974 172.31.36.109 -> 54.230.31.8  TCP 66 42947 > http [ACK] Seq=97 Ack=601987 Win=731648 Len=0 TSval=23223071 TSecr=710362457
143   0.039070  54.230.31.8 -> 172.31.36.109 TCP 15994 [TCP segment of a reassembled PDU]
144   0.039092 172.31.36.109 -> 54.230.31.8  TCP 66 42947 > http [ACK] Seq=97 Ack=617915 Win=731648 Len=0 TSval=23223071 TSecr=710362457
145   0.039167  54.230.31.8 -> 172.31.36.109 TCP 7306 [TCP segment of a reassembled PDU]
146   0.039184 172.31.36.109 -> 54.230.31.8  TCP 66 42947 > http [ACK] Seq=97 Ack=625155 Win=731648 Len=0 TSval=23223071 TSecr=710362457
147   0.039839  54.230.31.8 -> 172.31.36.109 TCP 2962 [TCP segment of a reassembled PDU]
148   0.039845 172.31.36.109 -> 54.230.31.8  TCP 66 42947 > http [ACK] Seq=97 Ack=628051 Win=734080 Len=0 TSval=23223071 TSecr=710362457
149   0.040008  54.230.31.8 -> 172.31.36.109 TCP 23234 [TCP segment of a reassembled PDU]
150   0.040045 172.31.36.109 -> 54.230.31.8  TCP 66 42947 > http [ACK] Seq=97 Ack=651219 Win=710912 Len=0 TSval=23223072 TSecr=710362457
151   0.040122  54.230.31.8 -> 172.31.36.109 TCP 5858 [TCP segment of a reassembled PDU]
152   0.040129 172.31.36.109 -> 54.230.31.8  TCP 66 42947 > http [ACK] Seq=97 Ack=657011 Win=729344 Len=0 TSval=23223072 TSecr=710362457
153   0.040282  54.230.31.8 -> 172.31.36.109 TCP 26130 [TCP segment of a reassembled PDU]
154   0.040307 172.31.36.109 -> 54.230.31.8  TCP 66 42947 > http [ACK] Seq=97 Ack=683075 Win=703360 Len=0 TSval=23223072 TSecr=710362457
155   0.040368  54.230.31.8 -> 172.31.36.109 TCP 2962 [TCP segment of a reassembled PDU]
156   0.040373 172.31.36.109 -> 54.230.31.8  TCP 66 42947 > http [ACK] Seq=97 Ack=685971 Win=734080 Len=0 TSval=23223072 TSecr=710362457
157   0.040539  54.230.31.8 -> 172.31.36.109 TCP 27578 [TCP segment of a reassembled PDU]
158   0.040567  54.230.31.8 -> 172.31.36.109 TCP 1514 [TCP segment of a reassembled PDU]
159   0.040580 172.31.36.109 -> 54.230.31.8  TCP 66 42947 > http [ACK] Seq=97 Ack=714931 Win=705152 Len=0 TSval=23223072 TSecr=710362457
160   0.040617  54.230.31.8 -> 172.31.36.109 TCP 2962 [TCP segment of a reassembled PDU]
161   0.040622 172.31.36.109 -> 54.230.31.8  TCP 66 42947 > http [ACK] Seq=97 Ack=717827 Win=734080 Len=0 TSval=23223072 TSecr=710362457
162   0.040729  54.230.31.8 -> 172.31.36.109 TCP 2962 [TCP segment of a reassembled PDU]
163   0.040734 172.31.36.109 -> 54.230.31.8  TCP 66 42947 > http [ACK] Seq=97 Ack=720723 Win=734080 Len=0 TSval=23223072 TSecr=710362457
164   0.041419  54.230.31.8 -> 172.31.36.109 TCP 7306 [TCP segment of a reassembled PDU]
165   0.041436 172.31.36.109 -> 54.230.31.8  TCP 66 42947 > http [ACK] Seq=97 Ack=727963 Win=737536 Len=0 TSval=23223072 TSecr=710362457
166   0.041559  54.230.31.8 -> 172.31.36.109 TCP 20338 [TCP segment of a reassembled PDU]
167   0.041653  54.230.31.8 -> 172.31.36.109 TCP 5858 [TCP segment of a reassembled PDU]
168   0.041744 172.31.36.109 -> 54.230.31.8  TCP 66 42947 > http [ACK] Seq=97 Ack=754027 Win=711552 Len=0 TSval=23223072 TSecr=710362457
169   0.041812  54.230.31.8 -> 172.31.36.109 TCP 13098 [TCP segment of a reassembled PDU]
170   0.041821 172.31.36.109 -> 54.230.31.8  TCP 66 42947 > http [ACK] Seq=97 Ack=767059 Win=717440 Len=0 TSval=23223072 TSecr=710362457
171   0.041893  54.230.31.8 -> 172.31.36.109 TCP 4410 [TCP segment of a reassembled PDU]
172   0.041899 172.31.36.109 -> 54.230.31.8  TCP 66 42947 > http [ACK] Seq=97 Ack=771403 Win=731648 Len=0 TSval=23223072 TSecr=710362457
173   0.042064  54.230.31.8 -> 172.31.36.109 TCP 14546 [TCP segment of a reassembled PDU]
174   0.042074  54.230.31.8 -> 172.31.36.109 TCP 1514 [TCP segment of a reassembled PDU]
175   0.042088 172.31.36.109 -> 54.230.31.8  TCP 66 42947 > http [ACK] Seq=97 Ack=787331 Win=737536 Len=0 TSval=23223072 TSecr=710362457
176   0.042136  54.230.31.8 -> 172.31.36.109 TCP 1514 [TCP segment of a reassembled PDU]
177   0.042299  54.230.31.8 -> 172.31.36.109 TCP 20338 [TCP segment of a reassembled PDU]
178   0.042321 172.31.36.109 -> 54.230.31.8  TCP 66 42947 > http [ACK] Seq=97 Ack=809051 Win=715904 Len=0 TSval=23223072 TSecr=710362457
179   0.042409  54.230.31.8 -> 172.31.36.109 TCP 13098 [TCP segment of a reassembled PDU]
180   0.042418 172.31.36.109 -> 54.230.31.8  TCP 66 42947 > http [ACK] Seq=97 Ack=822083 Win=717440 Len=0 TSval=23223072 TSecr=710362457
181   0.042497  54.230.31.8 -> 172.31.36.109 TCP 7306 [TCP segment of a reassembled PDU]
182   0.042504 172.31.36.109 -> 54.230.31.8  TCP 66 42947 > http [ACK] Seq=97 Ack=829323 Win=726912 Len=0 TSval=23223072 TSecr=710362457
183   0.042597  54.230.31.8 -> 172.31.36.109 TCP 7306 [TCP segment of a reassembled PDU]
184   0.042603 172.31.36.109 -> 54.230.31.8  TCP 66 42947 > http [ACK] Seq=97 Ack=836563 Win=726912 Len=0 TSval=23223072 TSecr=710362457
185   0.042725  54.230.31.8 -> 172.31.36.109 TCP 13098 [TCP segment of a reassembled PDU]
186   0.042746 172.31.36.109 -> 54.230.31.8  TCP 66 42947 > http [ACK] Seq=97 Ack=849595 Win=737536 Len=0 TSval=23223072 TSecr=710362458
187   0.042818  54.230.31.8 -> 172.31.36.109 TCP 1514 [TCP segment of a reassembled PDU]
188   0.043062  54.230.31.8 -> 172.31.36.109 TCP 17442 [TCP segment of a reassembled PDU]
189   0.043140  54.230.31.8 -> 172.31.36.109 TCP 2962 [TCP segment of a reassembled PDU]
190   0.043263  54.230.31.8 -> 172.31.36.109 TCP 23234 [TCP segment of a reassembled PDU]
191   0.043301 172.31.36.109 -> 54.230.31.8  TCP 66 42947 > http [ACK] Seq=97 Ack=894483 Win=692736 Len=0 TSval=23223072 TSecr=710362458
192   0.043325  54.230.31.8 -> 172.31.36.109 TCP 5858 [TCP segment of a reassembled PDU]
193   0.043340 172.31.36.109 -> 54.230.31.8  TCP 66 42947 > http [ACK] Seq=97 Ack=900275 Win=729344 Len=0 TSval=23223072 TSecr=710362458
194   0.043407  54.230.31.8 -> 172.31.36.109 TCP 1514 [TCP segment of a reassembled PDU]
195   0.043542  54.230.31.8 -> 172.31.36.109 TCP 14546 [TCP segment of a reassembled PDU]
196   0.043563 172.31.36.109 -> 54.230.31.8  TCP 66 42947 > http [ACK] Seq=97 Ack=916203 Win=737536 Len=0 TSval=23223072 TSecr=710362458
197   0.043835  54.230.31.8 -> 172.31.36.109 TCP 23234 [TCP segment of a reassembled PDU]
198   0.043858 172.31.36.109 -> 54.230.31.8  TCP 66 42947 > http [ACK] Seq=97 Ack=939371 Win=714368 Len=0 TSval=23223072 TSecr=710362458
199   0.044116  54.230.31.8 -> 172.31.36.109 TCP 31922 [TCP segment of a reassembled PDU]
200   0.044143 172.31.36.109 -> 54.230.31.8  TCP 66 42947 > http [ACK] Seq=97 Ack=971227 Win=737536 Len=0 TSval=23223073 TSecr=710362458
201   0.044255  54.230.31.8 -> 172.31.36.109 TCP 5858 [TCP segment of a reassembled PDU]
202   0.044262 172.31.36.109 -> 54.230.31.8  TCP 66 42947 > http [ACK] Seq=97 Ack=977019 Win=749056 Len=0 TSval=23223073 TSecr=710362458
203   0.044367  54.230.31.8 -> 172.31.36.109 TCP 4410 [TCP segment of a reassembled PDU]
204   0.044373 172.31.36.109 -> 54.230.31.8  TCP 66 42947 > http [ACK] Seq=97 Ack=981363 Win=757760 Len=0 TSval=23223073 TSecr=710362458
205   0.044462  54.230.31.8 -> 172.31.36.109 TCP 2962 [TCP segment of a reassembled PDU]
206   0.044480 172.31.36.109 -> 54.230.31.8  TCP 66 42947 > http [ACK] Seq=97 Ack=984259 Win=763520 Len=0 TSval=23223073 TSecr=710362458
207   0.044639  54.230.31.8 -> 172.31.36.109 TCP 27578 [TCP segment of a reassembled PDU]
208   0.044653 172.31.36.109 -> 54.230.31.8  TCP 66 42947 > http [ACK] Seq=97 Ack=1011771 Win=818560 Len=0 TSval=23223073 TSecr=710362458
209   0.044701  54.230.31.8 -> 172.31.36.109 TCP 1514 [TCP segment of a reassembled PDU]
210   0.044719 172.31.36.109 -> 54.230.31.8  TCP 66 42947 > http [ACK] Seq=97 Ack=1013219 Win=821504 Len=0 TSval=23223073 TSecr=710362458
211   0.044860  54.230.31.8 -> 172.31.36.109 TCP 20338 [TCP segment of a reassembled PDU]
212   0.044871 172.31.36.109 -> 54.230.31.8  TCP 66 42947 > http [ACK] Seq=97 Ack=1033491 Win=862080 Len=0 TSval=23223073 TSecr=710362458
213   0.044877  54.230.31.8 -> 172.31.36.109 TCP 2962 [TCP segment of a reassembled PDU]
214   0.044883 172.31.36.109 -> 54.230.31.8  TCP 66 42947 > http [ACK] Seq=97 Ack=1036387 Win=867840 Len=0 TSval=23223073 TSecr=710362458
215   0.044941  54.230.31.8 -> 172.31.36.109 TCP 5858 [TCP segment of a reassembled PDU]
216   0.044948 172.31.36.109 -> 54.230.31.8  TCP 66 42947 > http [ACK] Seq=97 Ack=1042179 Win=879360 Len=0 TSval=23223073 TSecr=710362458
217   0.045020  54.230.31.8 -> 172.31.36.109 TCP 4410 [TCP segment of a reassembled PDU]
218   0.045026 172.31.36.109 -> 54.230.31.8  TCP 66 42947 > http [ACK] Seq=97 Ack=1046523 Win=888064 Len=0 TSval=23223073 TSecr=710362458
219   0.045238  54.230.31.8 -> 172.31.36.109 TCP 5858 [TCP segment of a reassembled PDU]
220   0.045244 172.31.36.109 -> 54.230.31.8  TCP 66 42947 > http [ACK] Seq=97 Ack=1052315 Win=899712 Len=0 TSval=23223073 TSecr=710362458
221   0.045389  54.230.31.8 -> 172.31.36.109 TCP 26130 [TCP segment of a reassembled PDU]
222   0.045403 172.31.36.109 -> 54.230.31.8  TCP 66 42947 > http [ACK] Seq=97 Ack=1078379 Win=951808 Len=0 TSval=23223073 TSecr=710362458
223   0.045484  54.230.31.8 -> 172.31.36.109 TCP 5858 [TCP segment of a reassembled PDU]
224   0.045490 172.31.36.109 -> 54.230.31.8  TCP 66 42947 > http [ACK] Seq=97 Ack=1084171 Win=963328 Len=0 TSval=23223073 TSecr=710362458
225   0.045621  54.230.31.8 -> 172.31.36.109 TCP 21786 [TCP segment of a reassembled PDU]
226   0.045632 172.31.36.109 -> 54.230.31.8  TCP 66 42947 > http [ACK] Seq=97 Ack=1105891 Win=1006848 Len=0 TSval=23223073 TSecr=710362458
227   0.045811  54.230.31.8 -> 172.31.36.109 TCP 5858 [TCP segment of a reassembled PDU]
228   0.045818 172.31.36.109 -> 54.230.31.8  TCP 66 42947 > http [ACK] Seq=97 Ack=1111683 Win=1018368 Len=0 TSval=23223073 TSecr=710362458
229   0.046093  54.230.31.8 -> 172.31.36.109 TCP 26130 [TCP segment of a reassembled PDU]
230   0.046107 172.31.36.109 -> 54.230.31.8  TCP 66 42947 > http [ACK] Seq=97 Ack=1137747 Win=1070592 Len=0 TSval=23223073 TSecr=710362458
231   0.046166  54.230.31.8 -> 172.31.36.109 TCP 5858 [TCP segment of a reassembled PDU]
232   0.046173 172.31.36.109 -> 54.230.31.8  TCP 66 42947 > http [ACK] Seq=97 Ack=1143539 Win=1082112 Len=0 TSval=23223073 TSecr=710362458
233   0.046295  54.230.31.8 -> 172.31.36.109 TCP 8754 [TCP segment of a reassembled PDU]
234   0.046303 172.31.36.109 -> 54.230.31.8  TCP 66 42947 > http [ACK] Seq=97 Ack=1152227 Win=1099520 Len=0 TSval=23223073 TSecr=710362458
235   0.046432  54.230.31.8 -> 172.31.36.109 TCP 24682 [TCP segment of a reassembled PDU]
236   0.046444 172.31.36.109 -> 54.230.31.8  TCP 66 42947 > http [ACK] Seq=97 Ack=1176843 Win=1148672 Len=0 TSval=23223073 TSecr=710362458
237   0.046653  54.230.31.8 -> 172.31.36.109 TCP 2962 [TCP segment of a reassembled PDU]
238   0.046658 172.31.36.109 -> 54.230.31.8  TCP 66 42947 > http [ACK] Seq=97 Ack=1179739 Win=1154560 Len=0 TSval=23223073 TSecr=710362458
239   0.046766  54.230.31.8 -> 172.31.36.109 TCP 2962 [TCP segment of a reassembled PDU]
240   0.046771 172.31.36.109 -> 54.230.31.8  TCP 66 42947 > http [ACK] Seq=97 Ack=1182635 Win=1160320 Len=0 TSval=23223073 TSecr=710362458
241   0.046945  54.230.31.8 -> 172.31.36.109 TCP 17442 [TCP segment of a reassembled PDU]
242   0.046955 172.31.36.109 -> 54.230.31.8  TCP 66 42947 > http [ACK] Seq=97 Ack=1200011 Win=1195008 Len=0 TSval=23223073 TSecr=710362458
243   0.047012  54.230.31.8 -> 172.31.36.109 TCP 8754 [TCP segment of a reassembled PDU]
244   0.047019 172.31.36.109 -> 54.230.31.8  TCP 66 42947 > http [ACK] Seq=97 Ack=1208699 Win=1212416 Len=0 TSval=23223073 TSecr=710362458
245   0.047059  54.230.31.8 -> 172.31.36.109 TCP 18890 [TCP segment of a reassembled PDU]
246   0.047069 172.31.36.109 -> 54.230.31.8  TCP 66 42947 > http [ACK] Seq=97 Ack=1227523 Win=1250048 Len=0 TSval=23223073 TSecr=710362458
247   0.047165  54.230.31.8 -> 172.31.36.109 TCP 14546 [TCP segment of a reassembled PDU]
248   0.047173 172.31.36.109 -> 54.230.31.8  TCP 66 42947 > http [ACK] Seq=97 Ack=1242003 Win=1279104 Len=0 TSval=23223073 TSecr=710362458
249   0.047420  54.230.31.8 -> 172.31.36.109 TCP 20338 [TCP segment of a reassembled PDU]
250   0.047432 172.31.36.109 -> 54.230.31.8  TCP 66 42947 > http [ACK] Seq=97 Ack=1262275 Win=1319552 Len=0 TSval=23223073 TSecr=710362458
251   0.047443  54.230.31.8 -> 172.31.36.109 TCP 4410 [TCP segment of a reassembled PDU]
252   0.047446 172.31.36.109 -> 54.230.31.8  TCP 66 42947 > http [ACK] Seq=97 Ack=1266619 Win=1328256 Len=0 TSval=23223073 TSecr=710362458
253   0.047521  54.230.31.8 -> 172.31.36.109 TCP 7306 [TCP segment of a reassembled PDU]
254   0.047527 172.31.36.109 -> 54.230.31.8  TCP 66 42947 > http [ACK] Seq=97 Ack=1273859 Win=1342720 Len=0 TSval=23223073 TSecr=710362458
255   0.047697  54.230.31.8 -> 172.31.36.109 TCP 31922 [TCP segment of a reassembled PDU]
256   0.047711 172.31.36.109 -> 54.230.31.8  TCP 66 42947 > http [ACK] Seq=97 Ack=1305715 Win=1406464 Len=0 TSval=23223073 TSecr=710362458
257   0.047862  54.230.31.8 -> 172.31.36.109 TCP 1514 [TCP segment of a reassembled PDU]
258   0.047867 172.31.36.109 -> 54.230.31.8  TCP 66 42947 > http [ACK] Seq=97 Ack=1307163 Win=1409408 Len=0 TSval=23223073 TSecr=710362458
259   0.048092  54.230.31.8 -> 172.31.36.109 TCP 1514 [TCP segment of a reassembled PDU]
260   0.048096 172.31.36.109 -> 54.230.31.8  TCP 66 42947 > http [ACK] Seq=97 Ack=1308611 Win=1412224 Len=0 TSval=23223074 TSecr=710362458
261   0.048233  54.230.31.8 -> 172.31.36.109 TCP 21786 [TCP segment of a reassembled PDU]
262   0.048244 172.31.36.109 -> 54.230.31.8  TCP 66 42947 > http [ACK] Seq=97 Ack=1330331 Win=1455744 Len=0 TSval=23223074 TSecr=710362458
263   0.048311  54.230.31.8 -> 172.31.36.109 TCP 13098 [TCP segment of a reassembled PDU]
264   0.048320 172.31.36.109 -> 54.230.31.8  TCP 66 42947 > http [ACK] Seq=97 Ack=1343363 Win=1481728 Len=0 TSval=23223074 TSecr=710362458
265   0.048401  54.230.31.8 -> 172.31.36.109 TCP 10202 [TCP segment of a reassembled PDU]
266   0.048409 172.31.36.109 -> 54.230.31.8  TCP 66 42947 > http [ACK] Seq=97 Ack=1353499 Win=1502080 Len=0 TSval=23223074 TSecr=710362458
267   0.048502  54.230.31.8 -> 172.31.36.109 TCP 15994 [TCP segment of a reassembled PDU]
268   0.048565 172.31.36.109 -> 54.230.31.8  TCP 66 42947 > http [ACK] Seq=97 Ack=1369427 Win=1502080 Len=0 TSval=23223074 TSecr=710362458
269   0.048578  54.230.31.8 -> 172.31.36.109 TCP 2962 [TCP segment of a reassembled PDU]
270   0.048582 172.31.36.109 -> 54.230.31.8  TCP 66 42947 > http [ACK] Seq=97 Ack=1372323 Win=1507840 Len=0 TSval=23223074 TSecr=710362458
271   0.048691  54.230.31.8 -> 172.31.36.109 TCP 18890 [TCP segment of a reassembled PDU]
272   0.048702 172.31.36.109 -> 54.230.31.8  TCP 66 42947 > http [ACK] Seq=97 Ack=1391147 Win=1509760 Len=0 TSval=23223074 TSecr=710362458
273   0.048872  54.230.31.8 -> 172.31.36.109 TCP 5858 [TCP segment of a reassembled PDU]
274   0.048879 172.31.36.109 -> 54.230.31.8  TCP 66 42947 > http [ACK] Seq=97 Ack=1396939 Win=1531264 Len=0 TSval=23223074 TSecr=710362458
275   0.049038  54.230.31.8 -> 172.31.36.109 TCP 29026 [TCP segment of a reassembled PDU]
276   0.049063 172.31.36.109 -> 54.230.31.8  TCP 66 42947 > http [ACK] Seq=97 Ack=1425899 Win=1502336 Len=0 TSval=23223074 TSecr=710362458
277   0.049094  54.230.31.8 -> 172.31.36.109 TCP 2962 [TCP segment of a reassembled PDU]
278   0.049099 172.31.36.109 -> 54.230.31.8  TCP 66 42947 > http [ACK] Seq=97 Ack=1428795 Win=1531648 Len=0 TSval=23223074 TSecr=710362458
279   0.049211  54.230.31.8 -> 172.31.36.109 TCP 8754 [TCP segment of a reassembled PDU]
280   0.049228 172.31.36.109 -> 54.230.31.8  TCP 66 42947 > http [ACK] Seq=97 Ack=1437483 Win=1531648 Len=0 TSval=23223074 TSecr=710362458
281   0.049600  54.230.31.8 -> 172.31.36.109 TCP 1514 [TCP segment of a reassembled PDU]
282   0.049803  54.230.31.8 -> 172.31.36.109 TCP 36266 [TCP segment of a reassembled PDU]
283   0.049820  54.230.31.8 -> 172.31.36.109 TCP 1514 [TCP segment of a reassembled PDU]
284   0.049834 172.31.36.109 -> 54.230.31.8  TCP 66 42947 > http [ACK] Seq=97 Ack=1476579 Win=1492608 Len=0 TSval=23223074 TSecr=710362458
285   0.049959  54.230.31.8 -> 172.31.36.109 TCP 21786 [TCP segment of a reassembled PDU]
286   0.049971 172.31.36.109 -> 54.230.31.8  TCP 66 42947 > http [ACK] Seq=97 Ack=1498299 Win=1505024 Len=0 TSval=23223074 TSecr=710362458
287   0.050204  54.230.31.8 -> 172.31.36.109 TCP 4410 [TCP segment of a reassembled PDU]
288   0.050211 172.31.36.109 -> 54.230.31.8  TCP 66 42947 > http [ACK] Seq=97 Ack=1502643 Win=1531648 Len=0 TSval=23223074 TSecr=710362458
289   0.050232  54.230.31.8 -> 172.31.36.109 TCP 23234 [TCP segment of a reassembled PDU]
290   0.050256 172.31.36.109 -> 54.230.31.8  TCP 66 42947 > http [ACK] Seq=97 Ack=1525811 Win=1508480 Len=0 TSval=23223074 TSecr=710362458
291   0.050353  54.230.31.8 -> 172.31.36.109 TCP 7306 [TCP segment of a reassembled PDU]
292   0.050360 172.31.36.109 -> 54.230.31.8  TCP 66 42947 > http [ACK] Seq=97 Ack=1533051 Win=1528832 Len=0 TSval=23223074 TSecr=710362458
293   0.050476  54.230.31.8 -> 172.31.36.109 TCP 17442 [TCP segment of a reassembled PDU]
294   0.050497 172.31.36.109 -> 54.230.31.8  TCP 66 42947 > http [ACK] Seq=97 Ack=1550427 Win=1512192 Len=0 TSval=23223074 TSecr=710362458
295   0.050579  54.230.31.8 -> 172.31.36.109 TCP 4410 [TCP segment of a reassembled PDU]
296   0.050584 172.31.36.109 -> 54.230.31.8  TCP 66 42947 > http [ACK] Seq=97 Ack=1554771 Win=1531648 Len=0 TSval=23223074 TSecr=710362458
297   0.050668  54.230.31.8 -> 172.31.36.109 TCP 7306 [TCP segment of a reassembled PDU]
298   0.050685 172.31.36.109 -> 54.230.31.8  TCP 66 42947 > http [ACK] Seq=97 Ack=1562011 Win=1531648 Len=0 TSval=23223074 TSecr=710362458
299   0.050801  54.230.31.8 -> 172.31.36.109 TCP 23234 [TCP segment of a reassembled PDU]
300   0.050825 172.31.36.109 -> 54.230.31.8  TCP 66 42947 > http [ACK] Seq=97 Ack=1585179 Win=1508480 Len=0 TSval=23223074 TSecr=710362458
301   0.050875  54.230.31.8 -> 172.31.36.109 TCP 4410 [TCP segment of a reassembled PDU]
302   0.050880 172.31.36.109 -> 54.230.31.8  TCP 66 42947 > http [ACK] Seq=97 Ack=1589523 Win=1531648 Len=0 TSval=23223074 TSecr=710362458
303   0.051017  54.230.31.8 -> 172.31.36.109 TCP 21786 [TCP segment of a reassembled PDU]
304   0.051070 172.31.36.109 -> 54.230.31.8  TCP 66 42947 > http [ACK] Seq=97 Ack=1611243 Win=1510016 Len=0 TSval=23223074 TSecr=710362458
305   0.051115  54.230.31.8 -> 172.31.36.109 TCP 1514 [TCP segment of a reassembled PDU]
306   0.051307  54.230.31.8 -> 172.31.36.109 TCP 29026 [TCP segment of a reassembled PDU]
307   0.051334 172.31.36.109 -> 54.230.31.8  TCP 66 42947 > http [ACK] Seq=97 Ack=1641651 Win=1493120 Len=0 TSval=23223074 TSecr=710362458
308   0.051355  54.230.31.8 -> 172.31.36.109 TCP 4410 [TCP segment of a reassembled PDU]
309   0.051361 172.31.36.109 -> 54.230.31.8  TCP 66 42947 > http [ACK] Seq=97 Ack=1645995 Win=1531648 Len=0 TSval=23223074 TSecr=710362458
310   0.051489  54.230.31.8 -> 172.31.36.109 TCP 18890 [TCP segment of a reassembled PDU]
311   0.051511 172.31.36.109 -> 54.230.31.8  TCP 66 42947 > http [ACK] Seq=97 Ack=1664819 Win=1512832 Len=0 TSval=23223074 TSecr=710362458
312   0.051712  54.230.31.8 -> 172.31.36.109 TCP 10202 [TCP segment of a reassembled PDU]
313   0.051720 172.31.36.109 -> 54.230.31.8  TCP 66 42947 > http [ACK] Seq=97 Ack=1674955 Win=1524096 Len=0 TSval=23223074 TSecr=710362458
314   0.051866  54.230.31.8 -> 172.31.36.109 TCP 26130 [TCP segment of a reassembled PDU]
315   0.051892 172.31.36.109 -> 54.230.31.8  TCP 66 42947 > http [ACK] Seq=97 Ack=1701019 Win=1498112 Len=0 TSval=23223074 TSecr=710362458
316   0.051945  54.230.31.8 -> 172.31.36.109 TCP 14546 [TCP segment of a reassembled PDU]
317   0.051953 172.31.36.109 -> 54.230.31.8  TCP 66 42947 > http [ACK] Seq=97 Ack=1715499 Win=1516928 Len=0 TSval=23223074 TSecr=710362458
318   0.052048  54.230.31.8 -> 172.31.36.109 TCP 11650 [TCP segment of a reassembled PDU]
319   0.052068 172.31.36.109 -> 54.230.31.8  TCP 66 42947 > http [ACK] Seq=97 Ack=1727083 Win=1521792 Len=0 TSval=23223075 TSecr=710362458
320   0.052130  54.230.31.8 -> 172.31.36.109 TCP 1514 [TCP segment of a reassembled PDU]
321   0.052304  54.230.31.8 -> 172.31.36.109 TCP 24682 [TCP segment of a reassembled PDU]
322   0.052329 172.31.36.109 -> 54.230.31.8  TCP 66 42947 > http [ACK] Seq=97 Ack=1753147 Win=1500288 Len=0 TSval=23223075 TSecr=710362458
323   0.052379  54.230.31.8 -> 172.31.36.109 TCP 2962 [TCP segment of a reassembled PDU]
324   0.052384 172.31.36.109 -> 54.230.31.8  TCP 66 42947 > http [ACK] Seq=97 Ack=1756043 Win=1531648 Len=0 TSval=23223075 TSecr=710362458
325   0.052486  54.230.31.8 -> 172.31.36.109 TCP 7306 [TCP segment of a reassembled PDU]
326   0.052502 172.31.36.109 -> 54.230.31.8  TCP 66 42947 > http [ACK] Seq=97 Ack=1763283 Win=1531648 Len=0 TSval=23223075 TSecr=710362458
327   0.052696  54.230.31.8 -> 172.31.36.109 TCP 7306 [TCP segment of a reassembled PDU]
328   0.052712 172.31.36.109 -> 54.230.31.8  TCP 66 42947 > http [ACK] Seq=97 Ack=1770523 Win=1531648 Len=0 TSval=23223075 TSecr=710362458
329   0.052916  54.230.31.8 -> 172.31.36.109 TCP 2962 [TCP segment of a reassembled PDU]
330   0.052921 172.31.36.109 -> 54.230.31.8  TCP 66 42947 > http [ACK] Seq=97 Ack=1773419 Win=1531648 Len=0 TSval=23223075 TSecr=710362458
331   0.053096  54.230.31.8 -> 172.31.36.109 TCP 34818 [TCP segment of a reassembled PDU]
332   0.053146 172.31.36.109 -> 54.230.31.8  TCP 66 42947 > http [ACK] Seq=97 Ack=1808171 Win=1496960 Len=0 TSval=23223075 TSecr=710362458
333   0.053279  54.230.31.8 -> 172.31.36.109 TCP 20338 [TCP segment of a reassembled PDU]
334   0.053290 172.31.36.109 -> 54.230.31.8  TCP 66 42947 > http [ACK] Seq=97 Ack=1828443 Win=1507456 Len=0 TSval=23223075 TSecr=710362458
335   0.053366  54.230.31.8 -> 172.31.36.109 TCP 4410 [TCP segment of a reassembled PDU]
336   0.053373 172.31.36.109 -> 54.230.31.8  TCP 66 42947 > http [ACK] Seq=97 Ack=1832787 Win=1531648 Len=0 TSval=23223075 TSecr=710362459
337   0.053502  54.230.31.8 -> 172.31.36.109 TCP 17442 [TCP segment of a reassembled PDU]
338   0.053524 172.31.36.109 -> 54.230.31.8  TCP 66 42947 > http [ACK] Seq=97 Ack=1850163 Win=1514368 Len=0 TSval=23223075 TSecr=710362459
339   0.053744  54.230.31.8 -> 172.31.36.109 TCP 13098 [TCP segment of a reassembled PDU]
340   0.053753 172.31.36.109 -> 54.230.31.8  TCP 66 42947 > http [ACK] Seq=97 Ack=1863195 Win=1519360 Len=0 TSval=23223075 TSecr=710362459
341   0.053966  54.230.31.8 -> 172.31.36.109 TCP 5858 [TCP segment of a reassembled PDU]
342   0.053972 172.31.36.109 -> 54.230.31.8  TCP 66 42947 > http [ACK] Seq=97 Ack=1868987 Win=1531264 Len=0 TSval=23223075 TSecr=710362459
343   0.054143  54.230.31.8 -> 172.31.36.109 TCP 24682 [TCP segment of a reassembled PDU]
344   0.054158  54.230.31.8 -> 172.31.36.109 TCP 4410 [TCP segment of a reassembled PDU]
345   0.054172 172.31.36.109 -> 54.230.31.8  TCP 66 42947 > http [ACK] Seq=97 Ack=1897947 Win=1502336 Len=0 TSval=23223075 TSecr=710362459
346   0.054214  54.230.31.8 -> 172.31.36.109 TCP 5858 [TCP segment of a reassembled PDU]
347   0.054219 172.31.36.109 -> 54.230.31.8  TCP 66 42947 > http [ACK] Seq=97 Ack=1903739 Win=1531264 Len=0 TSval=23223075 TSecr=710362459
348   0.054358  54.230.31.8 -> 172.31.36.109 TCP 20338 [TCP segment of a reassembled PDU]
349   0.054407 172.31.36.109 -> 54.230.31.8  TCP 66 42947 > http [ACK] Seq=97 Ack=1924011 Win=1511040 Len=0 TSval=23223075 TSecr=710362459
350   0.054454  54.230.31.8 -> 172.31.36.109 TCP 4410 [TCP segment of a reassembled PDU]
351   0.054458 172.31.36.109 -> 54.230.31.8  TCP 66 42947 > http [ACK] Seq=97 Ack=1928355 Win=1531648 Len=0 TSval=23223075 TSecr=710362459
352   0.054597  54.230.31.8 -> 172.31.36.109 TCP 18890 [TCP segment of a reassembled PDU]
353   0.054614 172.31.36.109 -> 54.230.31.8  TCP 66 42947 > http [ACK] Seq=97 Ack=1947179 Win=1512832 Len=0 TSval=23223075 TSecr=710362459
