[Measurement for 1kb at 02:37:36 20.37.2014] 
Tshark:

  1   0.000000 172.31.29.138 -> 172.31.0.2   DNS 88 Standard query 0xe93a  A dm53kc3eax57k.cloudfront.net
  2   0.000038 172.31.29.138 -> 172.31.0.2   DNS 88 Standard query 0xb17a  AAAA dm53kc3eax57k.cloudfront.net
  3   0.000663   172.31.0.2 -> 172.31.29.138 DNS 216 Standard query response 0xe93a  A 54.230.156.193 A 54.230.157.230 A 54.230.158.189 A 54.230.158.231 A 54.230.159.7 A 54.230.159.137 A 54.192.157.146 A 54.192.159.174
  4   0.040516   172.31.0.2 -> 172.31.29.138 DNS 175 Standard query response 0xb17a 
  5   0.062503 172.31.29.138 -> 54.230.156.193 TCP 74 39081 > http [SYN] Seq=0 Win=26883 Len=0 MSS=8961 SACK_PERM=1 TSval=8732337 TSecr=0 WS=128
  6   0.063320 54.230.156.193 -> 172.31.29.138 TCP 74 http > 39081 [SYN, ACK] Seq=0 Ack=1 Win=14480 Len=0 MSS=1460 SACK_PERM=1 TSval=729743645 TSecr=8732337 WS=128
  7   0.063337 172.31.29.138 -> 54.230.156.193 TCP 66 39081 > http [ACK] Seq=1 Ack=1 Win=27008 Len=0 TSval=8732337 TSecr=729743645
  8   0.063393 172.31.29.138 -> 54.230.156.193 HTTP 161 GET /1kb HTTP/1.1 
  9   0.064047 54.230.156.193 -> 172.31.29.138 TCP 66 http > 39081 [ACK] Seq=1 Ack=96 Win=14592 Len=0 TSval=729743645 TSecr=8732337
 10   0.066382 54.230.156.193 -> 172.31.29.138 HTTP 1544 HTTP/1.1 200 OK  (application/octet-stream)
 11   0.066390 172.31.29.138 -> 54.230.156.193 TCP 66 39081 > http [ACK] Seq=96 Ack=1479 Win=29952 Len=0 TSval=8732338 TSecr=729743646
 12   0.066558 172.31.29.138 -> 54.230.156.193 TCP 66 39081 > http [FIN, ACK] Seq=96 Ack=1479 Win=29952 Len=0 TSval=8732338 TSecr=729743646
 13   0.067311 54.230.156.193 -> 172.31.29.138 TCP 66 http > 39081 [FIN, ACK] Seq=1479 Ack=97 Win=14592 Len=0 TSval=729743646 TSecr=8732338
 14   0.067320 172.31.29.138 -> 54.230.156.193 TCP 66 39081 > http [ACK] Seq=97 Ack=1480 Win=29952 Len=0 TSval=8732338 TSecr=729743646
