[Measurement for 1kb at 17:39:29 19.39.2014] 
Tshark:

  1   0.000000 172.31.29.138 -> 172.31.0.2   DNS 88 Standard query 0x88dd  A dm53kc3eax57k.cloudfront.net
  2   0.000038 172.31.29.138 -> 172.31.0.2   DNS 88 Standard query 0x9cd6  AAAA dm53kc3eax57k.cloudfront.net
  3   0.000683   172.31.0.2 -> 172.31.29.138 DNS 216 Standard query response 0x88dd  A 54.192.159.170 A 54.192.159.178 A 54.230.159.4 A 54.230.159.8 A 54.230.159.147 A 54.192.159.72 A 54.192.159.78 A 54.192.159.102
  4   0.039043   172.31.0.2 -> 172.31.29.138 DNS 175 Standard query response 0x9cd6 
  5   0.060307 172.31.29.138 -> 54.192.159.170 TCP 74 42744 > http [SYN] Seq=0 Win=26883 Len=0 MSS=8961 SACK_PERM=1 TSval=660491 TSecr=0 WS=128
  6   0.061077 54.192.159.170 -> 172.31.29.138 TCP 74 http > 42744 [SYN, ACK] Seq=0 Ack=1 Win=14480 Len=0 MSS=1460 SACK_PERM=1 TSval=831664085 TSecr=660491 WS=128
  7   0.061094 172.31.29.138 -> 54.192.159.170 TCP 66 42744 > http [ACK] Seq=1 Ack=1 Win=27008 Len=0 TSval=660491 TSecr=831664085
  8   0.061156 172.31.29.138 -> 54.192.159.170 HTTP 161 GET /1kb HTTP/1.1 
  9   0.061801 54.192.159.170 -> 172.31.29.138 TCP 66 http > 42744 [ACK] Seq=1 Ack=96 Win=14592 Len=0 TSval=831664085 TSecr=660491
 10   0.528855 54.192.159.170 -> 172.31.29.138 HTTP 1533 HTTP/1.1 200 OK  (application/octet-stream)
 11   0.528881 172.31.29.138 -> 54.192.159.170 TCP 66 42744 > http [ACK] Seq=96 Ack=1468 Win=29824 Len=0 TSval=660608 TSecr=831664131
 12   0.529099 172.31.29.138 -> 54.192.159.170 TCP 66 42744 > http [FIN, ACK] Seq=96 Ack=1468 Win=29824 Len=0 TSval=660608 TSecr=831664131
 13   0.529771 54.192.159.170 -> 172.31.29.138 TCP 66 http > 42744 [FIN, ACK] Seq=1468 Ack=97 Win=14592 Len=0 TSval=831664131 TSecr=660608
 14   0.529805 172.31.29.138 -> 54.192.159.170 TCP 66 42744 > http [ACK] Seq=97 Ack=1469 Win=29824 Len=0 TSval=660609 TSecr=831664131
