[Measurement for 1mb at 10:42:19 20.42.2014] 
Tshark:

  1   0.000000 172.31.8.238 -> 172.31.0.2   DNS 89 Standard query 0x66f4  A d1xzxs93r3iphc.cloudfront.net
  2   0.000027 172.31.8.238 -> 172.31.0.2   DNS 89 Standard query 0x5fd8  AAAA d1xzxs93r3iphc.cloudfront.net
  3   0.001183   172.31.0.2 -> 172.31.8.238 DNS 217 Standard query response 0x66f4  A 54.192.118.222 A 54.230.116.128 A 54.230.117.21 A 54.230.117.154 A 54.230.119.66 A 54.230.119.71 A 54.230.119.125 A 54.239.132.147
  4   0.001279   172.31.0.2 -> 172.31.8.238 DNS 170 Standard query response 0x5fd8 
  5   0.003774 172.31.8.238 -> 54.192.118.222 TCP 74 35423 > http [SYN] Seq=0 Win=26883 Len=0 MSS=8961 SACK_PERM=1 TSval=15941819 TSecr=0 WS=128
  6   0.004459 54.192.118.222 -> 172.31.8.238 TCP 74 http > 35423 [SYN, ACK] Seq=0 Ack=1 Win=14480 Len=0 MSS=1460 SACK_PERM=1 TSval=1687633546 TSecr=15941819 WS=128
  7   0.004472 172.31.8.238 -> 54.192.118.222 TCP 66 35423 > http [ACK] Seq=1 Ack=1 Win=27008 Len=0 TSval=15941819 TSecr=1687633546
  8   0.004511 172.31.8.238 -> 54.192.118.222 HTTP 162 GET /1mb HTTP/1.1 
  9   0.005013 54.192.118.222 -> 172.31.8.238 TCP 66 http > 35423 [ACK] Seq=1 Ack=97 Win=14592 Len=0 TSval=1687633546 TSecr=15941819
 10   0.007043 54.192.118.222 -> 172.31.8.238 TCP 523 [TCP segment of a reassembled PDU]
 11   0.007050 172.31.8.238 -> 54.192.118.222 TCP 66 35423 > http [ACK] Seq=97 Ack=458 Win=28032 Len=0 TSval=15941820 TSecr=1687633546
 12   0.007190 54.192.118.222 -> 172.31.8.238 TCP 13098 [TCP segment of a reassembled PDU]
 13   0.007201 172.31.8.238 -> 54.192.118.222 TCP 66 35423 > http [ACK] Seq=97 Ack=13490 Win=54144 Len=0 TSval=15941820 TSecr=1687633546
 14   0.007830 54.192.118.222 -> 172.31.8.238 TCP 2962 [TCP segment of a reassembled PDU]
 15   0.007838 172.31.8.238 -> 54.192.118.222 TCP 66 35423 > http [ACK] Seq=97 Ack=16386 Win=59904 Len=0 TSval=15941820 TSecr=1687633546
 16   0.007964 54.192.118.222 -> 172.31.8.238 TCP 10202 [TCP segment of a reassembled PDU]
 17   0.007972 172.31.8.238 -> 54.192.118.222 TCP 66 35423 > http [ACK] Seq=97 Ack=26522 Win=80128 Len=0 TSval=15941820 TSecr=1687633546
 18   0.008347 54.192.118.222 -> 172.31.8.238 TCP 2962 [TCP segment of a reassembled PDU]
 19   0.008352 172.31.8.238 -> 54.192.118.222 TCP 66 35423 > http [ACK] Seq=97 Ack=29418 Win=85888 Len=0 TSval=15941820 TSecr=1687633546
 20   0.008453 54.192.118.222 -> 172.31.8.238 TCP 5858 [TCP segment of a reassembled PDU]
 21   0.008459 172.31.8.238 -> 54.192.118.222 TCP 66 35423 > http [ACK] Seq=97 Ack=35210 Win=97536 Len=0 TSval=15941820 TSecr=1687633546
 22   0.008586 54.192.118.222 -> 172.31.8.238 TCP 2962 [TCP segment of a reassembled PDU]
 23   0.008591 172.31.8.238 -> 54.192.118.222 TCP 66 35423 > http [ACK] Seq=97 Ack=38106 Win=103296 Len=0 TSval=15941820 TSecr=1687633546
 24   0.008699 54.192.118.222 -> 172.31.8.238 TCP 8754 [TCP segment of a reassembled PDU]
 25   0.008706 172.31.8.238 -> 54.192.118.222 TCP 66 35423 > http [ACK] Seq=97 Ack=46794 Win=103680 Len=0 TSval=15941820 TSecr=1687633546
 26   0.009109 54.192.118.222 -> 172.31.8.238 TCP 2962 [TCP segment of a reassembled PDU]
 27   0.009114 172.31.8.238 -> 54.192.118.222 TCP 66 35423 > http [ACK] Seq=97 Ack=49690 Win=109056 Len=0 TSval=15941820 TSecr=1687633546
 28   0.009226 54.192.118.222 -> 172.31.8.238 TCP 13098 [TCP segment of a reassembled PDU]
 29   0.009235 172.31.8.238 -> 54.192.118.222 TCP 66 35423 > http [ACK] Seq=97 Ack=62722 Win=96512 Len=0 TSval=15941820 TSecr=1687633546
 30   0.009349 54.192.118.222 -> 172.31.8.238 TCP 2962 [TCP segment of a reassembled PDU]
 31   0.009354 172.31.8.238 -> 54.192.118.222 TCP 66 35423 > http [ACK] Seq=97 Ack=65618 Win=109056 Len=0 TSval=15941820 TSecr=1687633546
 32   0.009610 54.192.118.222 -> 172.31.8.238 TCP 4410 [TCP segment of a reassembled PDU]
 33   0.009615 172.31.8.238 -> 54.192.118.222 TCP 66 35423 > http [ACK] Seq=97 Ack=69962 Win=109056 Len=0 TSval=15941820 TSecr=1687633546
 34   0.009709 54.192.118.222 -> 172.31.8.238 TCP 7306 [TCP segment of a reassembled PDU]
 35   0.009716 172.31.8.238 -> 54.192.118.222 TCP 66 35423 > http [ACK] Seq=97 Ack=77202 Win=105984 Len=0 TSval=15941820 TSecr=1687633546
 36   0.009858 54.192.118.222 -> 172.31.8.238 TCP 2962 [TCP segment of a reassembled PDU]
 37   0.009864 172.31.8.238 -> 54.192.118.222 TCP 66 35423 > http [ACK] Seq=97 Ack=80098 Win=109056 Len=0 TSval=15941820 TSecr=1687633546
 38   0.009955 54.192.118.222 -> 172.31.8.238 TCP 11650 [TCP segment of a reassembled PDU]
 39   0.009963 172.31.8.238 -> 54.192.118.222 TCP 66 35423 > http [ACK] Seq=97 Ack=91682 Win=98944 Len=0 TSval=15941820 TSecr=1687633546
 40   0.010116 54.192.118.222 -> 172.31.8.238 TCP 8754 [TCP segment of a reassembled PDU]
 41   0.010123 172.31.8.238 -> 54.192.118.222 TCP 66 35423 > http [ACK] Seq=97 Ack=100370 Win=103680 Len=0 TSval=15941820 TSecr=1687633546
 42   0.010214 54.192.118.222 -> 172.31.8.238 TCP 4410 [TCP segment of a reassembled PDU]
 43   0.010219 172.31.8.238 -> 54.192.118.222 TCP 66 35423 > http [ACK] Seq=97 Ack=104714 Win=109056 Len=0 TSval=15941820 TSecr=1687633546
 44   0.010370 54.192.118.222 -> 172.31.8.238 TCP 7306 [TCP segment of a reassembled PDU]
 45   0.010377 172.31.8.238 -> 54.192.118.222 TCP 66 35423 > http [ACK] Seq=97 Ack=111954 Win=105984 Len=0 TSval=15941821 TSecr=1687633546
 46   0.010467 54.192.118.222 -> 172.31.8.238 TCP 5858 [TCP segment of a reassembled PDU]
 47   0.010473 172.31.8.238 -> 54.192.118.222 TCP 66 35423 > http [ACK] Seq=97 Ack=117746 Win=120704 Len=0 TSval=15941821 TSecr=1687633546
 48   0.010646 54.192.118.222 -> 172.31.8.238 TCP 8754 [TCP segment of a reassembled PDU]
 49   0.010653 172.31.8.238 -> 54.192.118.222 TCP 66 35423 > http [ACK] Seq=97 Ack=126434 Win=137984 Len=0 TSval=15941821 TSecr=1687633546
 50   0.010786 54.192.118.222 -> 172.31.8.238 TCP 17442 [TCP segment of a reassembled PDU]
 51   0.010797 172.31.8.238 -> 54.192.118.222 TCP 66 35423 > http [ACK] Seq=97 Ack=143810 Win=172800 Len=0 TSval=15941821 TSecr=1687633546
 52   0.010952 54.192.118.222 -> 172.31.8.238 TCP 13098 [TCP segment of a reassembled PDU]
 53   0.010961 172.31.8.238 -> 54.192.118.222 TCP 66 35423 > http [ACK] Seq=97 Ack=156842 Win=198784 Len=0 TSval=15941821 TSecr=1687633546
 54   0.011169 54.192.118.222 -> 172.31.8.238 TCP 11650 [TCP segment of a reassembled PDU]
 55   0.011178 172.31.8.238 -> 54.192.118.222 TCP 66 35423 > http [ACK] Seq=97 Ack=168426 Win=221952 Len=0 TSval=15941821 TSecr=1687633546
 56   0.011267 54.192.118.222 -> 172.31.8.238 TCP 1514 [TCP segment of a reassembled PDU]
 57   0.011272 172.31.8.238 -> 54.192.118.222 TCP 66 35423 > http [ACK] Seq=97 Ack=169874 Win=224896 Len=0 TSval=15941821 TSecr=1687633546
 58   0.011524 54.192.118.222 -> 172.31.8.238 TCP 26130 [TCP segment of a reassembled PDU]
 59   0.011537 172.31.8.238 -> 54.192.118.222 TCP 66 35423 > http [ACK] Seq=97 Ack=195938 Win=276992 Len=0 TSval=15941821 TSecr=1687633546
 60   0.011904 54.192.118.222 -> 172.31.8.238 TCP 1514 [TCP segment of a reassembled PDU]
 61   0.011909 172.31.8.238 -> 54.192.118.222 TCP 66 35423 > http [ACK] Seq=97 Ack=197386 Win=279936 Len=0 TSval=15941821 TSecr=1687633547
 62   0.012055 54.192.118.222 -> 172.31.8.238 TCP 18890 [TCP segment of a reassembled PDU]
 63   0.012066 172.31.8.238 -> 54.192.118.222 TCP 66 35423 > http [ACK] Seq=97 Ack=216210 Win=317568 Len=0 TSval=15941821 TSecr=1687633547
 64   0.012247 54.192.118.222 -> 172.31.8.238 TCP 26130 [TCP segment of a reassembled PDU]
 65   0.012260 172.31.8.238 -> 54.192.118.222 TCP 66 35423 > http [ACK] Seq=97 Ack=242274 Win=369664 Len=0 TSval=15941821 TSecr=1687633547
 66   0.012268 54.192.118.222 -> 172.31.8.238 TCP 4410 [TCP segment of a reassembled PDU]
 67   0.012272 172.31.8.238 -> 54.192.118.222 TCP 66 35423 > http [ACK] Seq=97 Ack=246618 Win=378368 Len=0 TSval=15941821 TSecr=1687633547
 68   0.012699 54.192.118.222 -> 172.31.8.238 TCP 10202 [TCP segment of a reassembled PDU]
 69   0.012708 172.31.8.238 -> 54.192.118.222 TCP 66 35423 > http [ACK] Seq=97 Ack=256754 Win=398720 Len=0 TSval=15941821 TSecr=1687633547
 70   0.012842 54.192.118.222 -> 172.31.8.238 TCP 26130 [TCP segment of a reassembled PDU]
 71   0.012856 172.31.8.238 -> 54.192.118.222 TCP 66 35423 > http [ACK] Seq=97 Ack=282818 Win=450816 Len=0 TSval=15941821 TSecr=1687633547
 72   0.012901 54.192.118.222 -> 172.31.8.238 TCP 14546 [TCP segment of a reassembled PDU]
 73   0.012923 172.31.8.238 -> 54.192.118.222 TCP 66 35423 > http [ACK] Seq=97 Ack=297298 Win=479744 Len=0 TSval=15941821 TSecr=1687633547
 74   0.013477 54.192.118.222 -> 172.31.8.238 TCP 4410 [TCP segment of a reassembled PDU]
 75   0.013483 172.31.8.238 -> 54.192.118.222 TCP 66 35423 > http [ACK] Seq=97 Ack=301642 Win=488448 Len=0 TSval=15941821 TSecr=1687633547
 76   0.013650 54.192.118.222 -> 172.31.8.238 TCP 26130 [TCP segment of a reassembled PDU]
 77   0.013664 172.31.8.238 -> 54.192.118.222 TCP 66 35423 > http [ACK] Seq=97 Ack=327706 Win=540544 Len=0 TSval=15941821 TSecr=1687633547
 78   0.013725 54.192.118.222 -> 172.31.8.238 TCP 23234 [TCP segment of a reassembled PDU]
 79   0.013737 172.31.8.238 -> 54.192.118.222 TCP 66 35423 > http [ACK] Seq=97 Ack=350874 Win=586880 Len=0 TSval=15941821 TSecr=1687633547
 80   0.014227 54.192.118.222 -> 172.31.8.238 TCP 1514 [TCP segment of a reassembled PDU]
 81   0.014232 172.31.8.238 -> 54.192.118.222 TCP 66 35423 > http [ACK] Seq=97 Ack=352322 Win=589824 Len=0 TSval=15941821 TSecr=1687633547
 82   0.014413 54.192.118.222 -> 172.31.8.238 TCP 26130 [TCP segment of a reassembled PDU]
 83   0.014427 172.31.8.238 -> 54.192.118.222 TCP 66 35423 > http [ACK] Seq=97 Ack=378386 Win=641920 Len=0 TSval=15941822 TSecr=1687633547
 84   0.014484 54.192.118.222 -> 172.31.8.238 TCP 26130 [TCP segment of a reassembled PDU]
 85   0.014495 172.31.8.238 -> 54.192.118.222 TCP 66 35423 > http [ACK] Seq=97 Ack=404450 Win=694016 Len=0 TSval=15941822 TSecr=1687633547
 86   0.014999 54.192.118.222 -> 172.31.8.238 TCP 5858 [TCP segment of a reassembled PDU]
 87   0.015007 172.31.8.238 -> 54.192.118.222 TCP 66 35423 > http [ACK] Seq=97 Ack=410242 Win=705664 Len=0 TSval=15941822 TSecr=1687633547
 88   0.015167 54.192.118.222 -> 172.31.8.238 TCP 26130 [TCP segment of a reassembled PDU]
 89   0.015181 172.31.8.238 -> 54.192.118.222 TCP 66 35423 > http [ACK] Seq=97 Ack=436306 Win=757760 Len=0 TSval=15941822 TSecr=1687633547
 90   0.015241 54.192.118.222 -> 172.31.8.238 TCP 21786 [TCP segment of a reassembled PDU]
 91   0.015254 172.31.8.238 -> 54.192.118.222 TCP 66 35423 > http [ACK] Seq=97 Ack=458026 Win=801152 Len=0 TSval=15941822 TSecr=1687633547
 92   0.015788 54.192.118.222 -> 172.31.8.238 TCP 7306 [TCP segment of a reassembled PDU]
 93   0.015795 172.31.8.238 -> 54.192.118.222 TCP 66 35423 > http [ACK] Seq=97 Ack=465266 Win=815744 Len=0 TSval=15941822 TSecr=1687633547
 94   0.015980 54.192.118.222 -> 172.31.8.238 TCP 26130 [TCP segment of a reassembled PDU]
 95   0.015994 172.31.8.238 -> 54.192.118.222 TCP 66 35423 > http [ACK] Seq=97 Ack=491330 Win=867840 Len=0 TSval=15941822 TSecr=1687633547
 96   0.016103 54.192.118.222 -> 172.31.8.238 TCP 26130 [TCP segment of a reassembled PDU]
 97   0.016116 172.31.8.238 -> 54.192.118.222 TCP 66 35423 > http [ACK] Seq=97 Ack=517394 Win=919936 Len=0 TSval=15941822 TSecr=1687633547
 98   0.016160 54.192.118.222 -> 172.31.8.238 TCP 5858 [TCP segment of a reassembled PDU]
 99   0.016166 172.31.8.238 -> 54.192.118.222 TCP 66 35423 > http [ACK] Seq=97 Ack=523186 Win=931584 Len=0 TSval=15941822 TSecr=1687633547
100   0.016802 54.192.118.222 -> 172.31.8.238 TCP 2962 [TCP segment of a reassembled PDU]
101   0.016808 172.31.8.238 -> 54.192.118.222 TCP 66 35423 > http [ACK] Seq=97 Ack=526082 Win=937344 Len=0 TSval=15941822 TSecr=1687633547
102   0.016963 54.192.118.222 -> 172.31.8.238 TCP 26130 [TCP segment of a reassembled PDU]
103   0.016977 172.31.8.238 -> 54.192.118.222 TCP 66 35423 > http [ACK] Seq=97 Ack=552146 Win=989440 Len=0 TSval=15941822 TSecr=1687633547
104   0.017100 54.192.118.222 -> 172.31.8.238 TCP 27578 [TCP segment of a reassembled PDU]
105   0.017114 172.31.8.238 -> 54.192.118.222 TCP 66 35423 > http [ACK] Seq=97 Ack=579658 Win=1044480 Len=0 TSval=15941822 TSecr=1687633547
106   0.017138 54.192.118.222 -> 172.31.8.238 TCP 8754 [TCP segment of a reassembled PDU]
107   0.017145 172.31.8.238 -> 54.192.118.222 TCP 66 35423 > http [ACK] Seq=97 Ack=588346 Win=1061888 Len=0 TSval=15941822 TSecr=1687633547
108   0.017713 54.192.118.222 -> 172.31.8.238 TCP 13098 [TCP segment of a reassembled PDU]
109   0.017723 172.31.8.238 -> 54.192.118.222 TCP 66 35423 > http [ACK] Seq=97 Ack=601378 Win=1087872 Len=0 TSval=15941822 TSecr=1687633547
110   0.017741 54.192.118.222 -> 172.31.8.238 TCP 26130 [TCP segment of a reassembled PDU]
111   0.017757 172.31.8.238 -> 54.192.118.222 TCP 66 35423 > http [ACK] Seq=97 Ack=627442 Win=1140096 Len=0 TSval=15941822 TSecr=1687633547
112   0.017855 54.192.118.222 -> 172.31.8.238 TCP 26130 [TCP segment of a reassembled PDU]
113   0.017868 172.31.8.238 -> 54.192.118.222 TCP 66 35423 > http [ACK] Seq=97 Ack=653506 Win=1192192 Len=0 TSval=15941822 TSecr=1687633547
114   0.018337 54.192.118.222 -> 172.31.8.238 TCP 5858 [TCP segment of a reassembled PDU]
115   0.018344 172.31.8.238 -> 54.192.118.222 TCP 66 35423 > http [ACK] Seq=97 Ack=659298 Win=1203712 Len=0 TSval=15941823 TSecr=1687633547
116   0.018480 54.192.118.222 -> 172.31.8.238 TCP 26130 [TCP segment of a reassembled PDU]
117   0.018493 172.31.8.238 -> 54.192.118.222 TCP 66 35423 > http [ACK] Seq=97 Ack=685362 Win=1209600 Len=0 TSval=15941823 TSecr=1687633547
118   0.018639 54.192.118.222 -> 172.31.8.238 TCP 26130 [TCP segment of a reassembled PDU]
119   0.018652 172.31.8.238 -> 54.192.118.222 TCP 66 35423 > http [ACK] Seq=97 Ack=711426 Win=1209600 Len=0 TSval=15941823 TSecr=1687633547
120   0.018661 54.192.118.222 -> 172.31.8.238 TCP 7306 [TCP segment of a reassembled PDU]
121   0.018666 172.31.8.238 -> 54.192.118.222 TCP 66 35423 > http [ACK] Seq=97 Ack=718666 Win=1202432 Len=0 TSval=15941823 TSecr=1687633547
122   0.019124 54.192.118.222 -> 172.31.8.238 TCP 4410 [TCP segment of a reassembled PDU]
123   0.019131 172.31.8.238 -> 54.192.118.222 TCP 66 35423 > http [ACK] Seq=97 Ack=723010 Win=1245312 Len=0 TSval=15941823 TSecr=1687633547
124   0.019263 54.192.118.222 -> 172.31.8.238 TCP 24682 [TCP segment of a reassembled PDU]
125   0.019277 172.31.8.238 -> 54.192.118.222 TCP 66 35423 > http [ACK] Seq=97 Ack=747626 Win=1220736 Len=0 TSval=15941823 TSecr=1687633547
126   0.019395 54.192.118.222 -> 172.31.8.238 TCP 27578 [TCP segment of a reassembled PDU]
127   0.019409 172.31.8.238 -> 54.192.118.222 TCP 66 35423 > http [ACK] Seq=97 Ack=775138 Win=1207168 Len=0 TSval=15941823 TSecr=1687633547
128   0.019417 54.192.118.222 -> 172.31.8.238 TCP 8754 [TCP segment of a reassembled PDU]
129   0.019422 172.31.8.238 -> 54.192.118.222 TCP 66 35423 > http [ACK] Seq=97 Ack=783826 Win=1198592 Len=0 TSval=15941823 TSecr=1687633547
130   0.019880 54.192.118.222 -> 172.31.8.238 TCP 5858 [TCP segment of a reassembled PDU]
131   0.019886 172.31.8.238 -> 54.192.118.222 TCP 66 35423 > http [ACK] Seq=97 Ack=789618 Win=1242880 Len=0 TSval=15941823 TSecr=1687633547
132   0.020045 54.192.118.222 -> 172.31.8.238 TCP 20338 [TCP segment of a reassembled PDU]
133   0.020067 172.31.8.238 -> 54.192.118.222 TCP 66 35423 > http [ACK] Seq=97 Ack=809890 Win=1222656 Len=0 TSval=15941823 TSecr=1687633547
134   0.020081 54.192.118.222 -> 172.31.8.238 TCP 5858 [TCP segment of a reassembled PDU]
135   0.020095 172.31.8.238 -> 54.192.118.222 TCP 66 35423 > http [ACK] Seq=97 Ack=815682 Win=1247872 Len=0 TSval=15941823 TSecr=1687633547
136   0.020137 54.192.118.222 -> 172.31.8.238 TCP 4410 [TCP segment of a reassembled PDU]
137   0.020153 172.31.8.238 -> 54.192.118.222 TCP 66 35423 > http [ACK] Seq=97 Ack=820026 Win=1247872 Len=0 TSval=15941823 TSecr=1687633547
138   0.020307 54.192.118.222 -> 172.31.8.238 TCP 26130 [TCP segment of a reassembled PDU]
139   0.020333 172.31.8.238 -> 54.192.118.222 TCP 66 35423 > http [ACK] Seq=97 Ack=846090 Win=1221888 Len=0 TSval=15941823 TSecr=1687633547
140   0.020398 54.192.118.222 -> 172.31.8.238 TCP 26130 [TCP segment of a reassembled PDU]
141   0.020459 54.192.118.222 -> 172.31.8.238 TCP 13098 [TCP segment of a reassembled PDU]
142   0.020597 172.31.8.238 -> 54.192.118.222 TCP 66 35423 > http [ACK] Seq=97 Ack=885186 Win=1188224 Len=0 TSval=15941823 TSecr=1687633547
143   0.020769 54.192.118.222 -> 172.31.8.238 TCP 26130 [TCP segment of a reassembled PDU]
144   0.020784 172.31.8.238 -> 54.192.118.222 TCP 66 35423 > http [ACK] Seq=97 Ack=911250 Win=1209600 Len=0 TSval=15941823 TSecr=1687633547
145   0.020791 54.192.118.222 -> 172.31.8.238 TCP 2962 [TCP segment of a reassembled PDU]
146   0.020810 172.31.8.238 -> 54.192.118.222 TCP 66 35423 > http [ACK] Seq=97 Ack=914146 Win=1206784 Len=0 TSval=15941823 TSecr=1687633547
147   0.021168 54.192.118.222 -> 172.31.8.238 TCP 10202 [TCP segment of a reassembled PDU]
148   0.021176 172.31.8.238 -> 54.192.118.222 TCP 66 35423 > http [ACK] Seq=97 Ack=924282 Win=1235840 Len=0 TSval=15941823 TSecr=1687633547
149   0.021333 54.192.118.222 -> 172.31.8.238 TCP 26130 [TCP segment of a reassembled PDU]
150   0.021359 172.31.8.238 -> 54.192.118.222 TCP 66 35423 > http [ACK] Seq=97 Ack=950346 Win=1209856 Len=0 TSval=15941823 TSecr=1687633547
151   0.021414 54.192.118.222 -> 172.31.8.238 TCP 26130 [TCP segment of a reassembled PDU]
152   0.021496 54.192.118.222 -> 172.31.8.238 TCP 26130 [TCP segment of a reassembled PDU]
153   0.021558 54.192.118.222 -> 172.31.8.238 TCP 20338 [TCP segment of a reassembled PDU]
154   0.021598 172.31.8.238 -> 54.192.118.222 TCP 66 35423 > http [ACK] Seq=97 Ack=1022746 Win=1137536 Len=0 TSval=15941823 TSecr=1687633547
155   0.022001 54.192.118.222 -> 172.31.8.238 TCP 2962 [TCP segment of a reassembled PDU]
156   0.022007 172.31.8.238 -> 54.192.118.222 TCP 66 35423 > http [ACK] Seq=97 Ack=1025642 Win=1247616 Len=0 TSval=15941823 TSecr=1687633548
157   0.022175 54.192.118.222 -> 172.31.8.238 HTTP 23458 HTTP/1.1 200 OK  (application/octet-stream)
158   0.022205 172.31.8.238 -> 54.192.118.222 TCP 66 35423 > http [ACK] Seq=97 Ack=1049034 Win=1224320 Len=0 TSval=15941823 TSecr=1687633548
159   0.022344 172.31.8.238 -> 54.192.118.222 TCP 66 35423 > http [FIN, ACK] Seq=97 Ack=1049034 Win=1247872 Len=0 TSval=15941823 TSecr=1687633548
160   0.023059 54.192.118.222 -> 172.31.8.238 TCP 66 http > 35423 [FIN, ACK] Seq=1049034 Ack=98 Win=14592 Len=0 TSval=1687633548 TSecr=15941823
161   0.023068 172.31.8.238 -> 54.192.118.222 TCP 66 35423 > http [ACK] Seq=98 Ack=1049035 Win=1247872 Len=0 TSval=15941824 TSecr=1687633548
