[Measurement for 1mb at 11:42:19 20.42.2014] 
Tshark:

  1   0.000000 06:b0:37:46:8f:13 -> 06:c7:b5:04:b8:d0 ARP 60 Who has 172.31.8.238?  Tell 172.31.0.1
  2   0.000018 06:c7:b5:04:b8:d0 -> 06:b0:37:46:8f:13 ARP 42 172.31.8.238 is at 06:c7:b5:04:b8:d0
  3   1.800835 172.31.8.238 -> 172.31.0.2   DNS 89 Standard query 0x388a  A d1xzxs93r3iphc.cloudfront.net
  4   1.800865 172.31.8.238 -> 172.31.0.2   DNS 89 Standard query 0x67fd  AAAA d1xzxs93r3iphc.cloudfront.net
  5   1.801630   172.31.0.2 -> 172.31.8.238 DNS 170 Standard query response 0x67fd 
  6   1.801643   172.31.0.2 -> 172.31.8.238 DNS 217 Standard query response 0x388a  A 54.230.119.55 A 54.230.119.86 A 54.230.119.150 A 54.239.132.173 A 54.192.118.237 A 54.192.118.239 A 54.230.116.44 A 54.230.117.69
  7   1.804716 172.31.8.238 -> 54.230.119.55 TCP 74 43336 > http [SYN] Seq=0 Win=26883 Len=0 MSS=8961 SACK_PERM=1 TSval=16841809 TSecr=0 WS=128
  8   1.805593 54.230.119.55 -> 172.31.8.238 TCP 74 http > 43336 [SYN, ACK] Seq=0 Ack=1 Win=14480 Len=0 MSS=1460 SACK_PERM=1 TSval=1686405042 TSecr=16841809 WS=128
  9   1.805607 172.31.8.238 -> 54.230.119.55 TCP 66 43336 > http [ACK] Seq=1 Ack=1 Win=27008 Len=0 TSval=16841809 TSecr=1686405042
 10   1.805647 172.31.8.238 -> 54.230.119.55 HTTP 162 GET /1mb HTTP/1.1 
 11   1.806274 54.230.119.55 -> 172.31.8.238 TCP 66 http > 43336 [ACK] Seq=1 Ack=97 Win=14592 Len=0 TSval=1686405042 TSecr=16841809
 12   1.807569 54.230.119.55 -> 172.31.8.238 TCP 523 [TCP segment of a reassembled PDU]
 13   1.807576 172.31.8.238 -> 54.230.119.55 TCP 66 43336 > http [ACK] Seq=97 Ack=458 Win=28032 Len=0 TSval=16841810 TSecr=1686405042
 14   1.807700 54.230.119.55 -> 172.31.8.238 TCP 13098 [TCP segment of a reassembled PDU]
 15   1.807724 172.31.8.238 -> 54.230.119.55 TCP 66 43336 > http [ACK] Seq=97 Ack=13490 Win=54144 Len=0 TSval=16841810 TSecr=1686405042
 16   1.808382 54.230.119.55 -> 172.31.8.238 TCP 5858 [TCP segment of a reassembled PDU]
 17   1.808391 172.31.8.238 -> 54.230.119.55 TCP 66 43336 > http [ACK] Seq=97 Ack=19282 Win=65664 Len=0 TSval=16841810 TSecr=1686405042
 18   1.808495 54.230.119.55 -> 172.31.8.238 TCP 7306 [TCP segment of a reassembled PDU]
 19   1.808502 172.31.8.238 -> 54.230.119.55 TCP 66 43336 > http [ACK] Seq=97 Ack=26522 Win=80128 Len=0 TSval=16841810 TSecr=1686405042
 20   1.809125 54.230.119.55 -> 172.31.8.238 TCP 4410 [TCP segment of a reassembled PDU]
 21   1.809131 172.31.8.238 -> 54.230.119.55 TCP 66 43336 > http [ACK] Seq=97 Ack=30866 Win=88832 Len=0 TSval=16841810 TSecr=1686405042
 22   1.809263 54.230.119.55 -> 172.31.8.238 TCP 15994 [TCP segment of a reassembled PDU]
 23   1.809272 172.31.8.238 -> 54.230.119.55 TCP 66 43336 > http [ACK] Seq=97 Ack=46794 Win=91648 Len=0 TSval=16841810 TSecr=1686405042
 24   1.809924 54.230.119.55 -> 172.31.8.238 TCP 5858 [TCP segment of a reassembled PDU]
 25   1.809931 172.31.8.238 -> 54.230.119.55 TCP 66 43336 > http [ACK] Seq=97 Ack=52586 Win=108416 Len=0 TSval=16841811 TSecr=1686405042
 26   1.810032 54.230.119.55 -> 172.31.8.238 TCP 13098 [TCP segment of a reassembled PDU]
 27   1.810041 172.31.8.238 -> 54.230.119.55 TCP 66 43336 > http [ACK] Seq=97 Ack=65618 Win=135168 Len=0 TSval=16841811 TSecr=1686405042
 28   1.810493 54.230.119.55 -> 172.31.8.238 TCP 11650 [TCP segment of a reassembled PDU]
 29   1.810502 172.31.8.238 -> 54.230.119.55 TCP 66 43336 > http [ACK] Seq=97 Ack=77202 Win=158336 Len=0 TSval=16841811 TSecr=1686405042
 30   1.810609 54.230.119.55 -> 172.31.8.238 TCP 1514 [TCP segment of a reassembled PDU]
 31   1.810614 172.31.8.238 -> 54.230.119.55 TCP 66 43336 > http [ACK] Seq=97 Ack=78650 Win=161152 Len=0 TSval=16841811 TSecr=1686405042
 32   1.810624 54.230.119.55 -> 172.31.8.238 TCP 13098 [TCP segment of a reassembled PDU]
 33   1.810631 172.31.8.238 -> 54.230.119.55 TCP 66 43336 > http [ACK] Seq=97 Ack=91682 Win=187264 Len=0 TSval=16841811 TSecr=1686405042
 34   1.811165 54.230.119.55 -> 172.31.8.238 TCP 4410 [TCP segment of a reassembled PDU]
 35   1.811172 172.31.8.238 -> 54.230.119.55 TCP 66 43336 > http [ACK] Seq=97 Ack=96026 Win=195968 Len=0 TSval=16841811 TSecr=1686405042
 36   1.811266 54.230.119.55 -> 172.31.8.238 TCP 8754 [TCP segment of a reassembled PDU]
 37   1.811273 172.31.8.238 -> 54.230.119.55 TCP 66 43336 > http [ACK] Seq=97 Ack=104714 Win=213376 Len=0 TSval=16841811 TSecr=1686405042
 38   1.811422 54.230.119.55 -> 172.31.8.238 TCP 5858 [TCP segment of a reassembled PDU]
 39   1.811428 172.31.8.238 -> 54.230.119.55 TCP 66 43336 > http [ACK] Seq=97 Ack=110506 Win=224896 Len=0 TSval=16841811 TSecr=1686405042
 40   1.811516 54.230.119.55 -> 172.31.8.238 TCP 7306 [TCP segment of a reassembled PDU]
 41   1.811523 172.31.8.238 -> 54.230.119.55 TCP 66 43336 > http [ACK] Seq=97 Ack=117746 Win=239360 Len=0 TSval=16841811 TSecr=1686405042
 42   1.811965 54.230.119.55 -> 172.31.8.238 TCP 4410 [TCP segment of a reassembled PDU]
 43   1.811971 172.31.8.238 -> 54.230.119.55 TCP 66 43336 > http [ACK] Seq=97 Ack=122090 Win=248064 Len=0 TSval=16841811 TSecr=1686405042
 44   1.812099 54.230.119.55 -> 172.31.8.238 TCP 17442 [TCP segment of a reassembled PDU]
 45   1.812110 172.31.8.238 -> 54.230.119.55 TCP 66 43336 > http [ACK] Seq=97 Ack=139466 Win=282880 Len=0 TSval=16841811 TSecr=1686405042
 46   1.812118 54.230.119.55 -> 172.31.8.238 TCP 4410 [TCP segment of a reassembled PDU]
 47   1.812125 172.31.8.238 -> 54.230.119.55 TCP 66 43336 > http [ACK] Seq=97 Ack=143810 Win=291456 Len=0 TSval=16841811 TSecr=1686405042
 48   1.812542 54.230.119.55 -> 172.31.8.238 TCP 13098 [TCP segment of a reassembled PDU]
 49   1.812552 172.31.8.238 -> 54.230.119.55 TCP 66 43336 > http [ACK] Seq=97 Ack=156842 Win=312064 Len=0 TSval=16841811 TSecr=1686405042
 50   1.812654 54.230.119.55 -> 172.31.8.238 TCP 13098 [TCP segment of a reassembled PDU]
 51   1.812663 172.31.8.238 -> 54.230.119.55 TCP 66 43336 > http [ACK] Seq=97 Ack=169874 Win=312064 Len=0 TSval=16841811 TSecr=1686405042
 52   1.813011 54.230.119.55 -> 172.31.8.238 TCP 1514 [TCP segment of a reassembled PDU]
 53   1.813016 172.31.8.238 -> 54.230.119.55 TCP 66 43336 > http [ACK] Seq=97 Ack=171322 Win=320512 Len=0 TSval=16841811 TSecr=1686405043
 54   1.813146 54.230.119.55 -> 172.31.8.238 TCP 24682 [TCP segment of a reassembled PDU]
 55   1.813159 172.31.8.238 -> 54.230.119.55 TCP 66 43336 > http [ACK] Seq=97 Ack=195938 Win=295936 Len=0 TSval=16841811 TSecr=1686405043
 56   1.813520 54.230.119.55 -> 172.31.8.238 TCP 4410 [TCP segment of a reassembled PDU]
 57   1.813527 172.31.8.238 -> 54.230.119.55 TCP 66 43336 > http [ACK] Seq=97 Ack=200282 Win=326272 Len=0 TSval=16841811 TSecr=1686405043
 58   1.813650 54.230.119.55 -> 172.31.8.238 TCP 13098 [TCP segment of a reassembled PDU]
 59   1.813669 172.31.8.238 -> 54.230.119.55 TCP 66 43336 > http [ACK] Seq=97 Ack=213314 Win=313344 Len=0 TSval=16841811 TSecr=1686405043
 60   1.814011 54.230.119.55 -> 172.31.8.238 TCP 2962 [TCP segment of a reassembled PDU]
 61   1.814017 172.31.8.238 -> 54.230.119.55 TCP 66 43336 > http [ACK] Seq=97 Ack=216210 Win=328576 Len=0 TSval=16841812 TSecr=1686405043
 62   1.814175 54.230.119.55 -> 172.31.8.238 TCP 24682 [TCP segment of a reassembled PDU]
 63   1.814190 172.31.8.238 -> 54.230.119.55 TCP 66 43336 > http [ACK] Seq=97 Ack=240826 Win=378368 Len=0 TSval=16841812 TSecr=1686405043
 64   1.814533 54.230.119.55 -> 172.31.8.238 TCP 10202 [TCP segment of a reassembled PDU]
 65   1.814543 172.31.8.238 -> 54.230.119.55 TCP 66 43336 > http [ACK] Seq=97 Ack=250962 Win=398720 Len=0 TSval=16841812 TSecr=1686405043
 66   1.814658 54.230.119.55 -> 172.31.8.238 TCP 11650 [TCP segment of a reassembled PDU]
 67   1.814667 172.31.8.238 -> 54.230.119.55 TCP 66 43336 > http [ACK] Seq=97 Ack=262546 Win=421888 Len=0 TSval=16841812 TSecr=1686405043
 68   1.815038 54.230.119.55 -> 172.31.8.238 TCP 4410 [TCP segment of a reassembled PDU]
 69   1.815045 172.31.8.238 -> 54.230.119.55 TCP 66 43336 > http [ACK] Seq=97 Ack=266890 Win=430464 Len=0 TSval=16841812 TSecr=1686405043
 70   1.815221 54.230.119.55 -> 172.31.8.238 TCP 26130 [TCP segment of a reassembled PDU]
 71   1.815236 172.31.8.238 -> 54.230.119.55 TCP 66 43336 > http [ACK] Seq=97 Ack=292954 Win=482688 Len=0 TSval=16841812 TSecr=1686405043
 72   1.815288 54.230.119.55 -> 172.31.8.238 TCP 11650 [TCP segment of a reassembled PDU]
 73   1.815297 172.31.8.238 -> 54.230.119.55 TCP 66 43336 > http [ACK] Seq=97 Ack=304538 Win=505856 Len=0 TSval=16841812 TSecr=1686405043
 74   1.815798 54.230.119.55 -> 172.31.8.238 TCP 4410 [TCP segment of a reassembled PDU]
 75   1.815804 172.31.8.238 -> 54.230.119.55 TCP 66 43336 > http [ACK] Seq=97 Ack=308882 Win=514560 Len=0 TSval=16841812 TSecr=1686405043
 76   1.815925 54.230.119.55 -> 172.31.8.238 TCP 21786 [TCP segment of a reassembled PDU]
 77   1.815935 172.31.8.238 -> 54.230.119.55 TCP 66 43336 > http [ACK] Seq=97 Ack=330602 Win=557952 Len=0 TSval=16841812 TSecr=1686405043
 78   1.816061 54.230.119.55 -> 172.31.8.238 TCP 20338 [TCP segment of a reassembled PDU]
 79   1.816073 172.31.8.238 -> 54.230.119.55 TCP 66 43336 > http [ACK] Seq=97 Ack=350874 Win=598528 Len=0 TSval=16841812 TSecr=1686405043
 80   1.816556 54.230.119.55 -> 172.31.8.238 TCP 5858 [TCP segment of a reassembled PDU]
 81   1.816562 172.31.8.238 -> 54.230.119.55 TCP 66 43336 > http [ACK] Seq=97 Ack=356666 Win=610048 Len=0 TSval=16841812 TSecr=1686405043
 82   1.816728 54.230.119.55 -> 172.31.8.238 TCP 26130 [TCP segment of a reassembled PDU]
 83   1.816741 172.31.8.238 -> 54.230.119.55 TCP 66 43336 > http [ACK] Seq=97 Ack=382730 Win=662144 Len=0 TSval=16841812 TSecr=1686405043
 84   1.816790 54.230.119.55 -> 172.31.8.238 TCP 13098 [TCP segment of a reassembled PDU]
 85   1.816798 172.31.8.238 -> 54.230.119.55 TCP 66 43336 > http [ACK] Seq=97 Ack=395762 Win=688256 Len=0 TSval=16841812 TSecr=1686405043
 86   1.817165 54.230.119.55 -> 172.31.8.238 TCP 17442 [TCP segment of a reassembled PDU]
 87   1.817176 172.31.8.238 -> 54.230.119.55 TCP 66 43336 > http [ACK] Seq=97 Ack=413138 Win=723072 Len=0 TSval=16841812 TSecr=1686405043
 88   1.817198 54.230.119.55 -> 172.31.8.238 TCP 5858 [TCP segment of a reassembled PDU]
 89   1.817206 172.31.8.238 -> 54.230.119.55 TCP 66 43336 > http [ACK] Seq=97 Ack=418930 Win=734592 Len=0 TSval=16841812 TSecr=1686405043
 90   1.817277 54.230.119.55 -> 172.31.8.238 TCP 2962 [TCP segment of a reassembled PDU]
 91   1.817283 172.31.8.238 -> 54.230.119.55 TCP 66 43336 > http [ACK] Seq=97 Ack=421826 Win=740352 Len=0 TSval=16841812 TSecr=1686405043
 92   1.817419 54.230.119.55 -> 172.31.8.238 TCP 26130 [TCP segment of a reassembled PDU]
 93   1.817433 172.31.8.238 -> 54.230.119.55 TCP 66 43336 > http [ACK] Seq=97 Ack=447890 Win=792576 Len=0 TSval=16841812 TSecr=1686405043
 94   1.817446 54.230.119.55 -> 172.31.8.238 TCP 13098 [TCP segment of a reassembled PDU]
 95   1.817456 172.31.8.238 -> 54.230.119.55 TCP 66 43336 > http [ACK] Seq=97 Ack=460922 Win=818560 Len=0 TSval=16841812 TSecr=1686405043
 96   1.817959 54.230.119.55 -> 172.31.8.238 TCP 26130 [TCP segment of a reassembled PDU]
 97   1.817974 172.31.8.238 -> 54.230.119.55 TCP 66 43336 > http [ACK] Seq=97 Ack=486986 Win=870656 Len=0 TSval=16841813 TSecr=1686405043
 98   1.817982 54.230.119.55 -> 172.31.8.238 TCP 2962 [TCP segment of a reassembled PDU]
 99   1.817985 172.31.8.238 -> 54.230.119.55 TCP 66 43336 > http [ACK] Seq=97 Ack=489882 Win=876544 Len=0 TSval=16841813 TSecr=1686405043
100   1.818113 54.230.119.55 -> 172.31.8.238 TCP 2962 [TCP segment of a reassembled PDU]
101   1.818118 172.31.8.238 -> 54.230.119.55 TCP 66 43336 > http [ACK] Seq=97 Ack=492778 Win=882304 Len=0 TSval=16841813 TSecr=1686405043
102   1.818262 54.230.119.55 -> 172.31.8.238 TCP 26130 [TCP segment of a reassembled PDU]
103   1.818277 172.31.8.238 -> 54.230.119.55 TCP 66 43336 > http [ACK] Seq=97 Ack=518842 Win=934400 Len=0 TSval=16841813 TSecr=1686405043
104   1.818301 54.230.119.55 -> 172.31.8.238 TCP 7306 [TCP segment of a reassembled PDU]
105   1.818308 172.31.8.238 -> 54.230.119.55 TCP 66 43336 > http [ACK] Seq=97 Ack=526082 Win=948864 Len=0 TSval=16841813 TSecr=1686405043
106   1.818677 54.230.119.55 -> 172.31.8.238 TCP 23234 [TCP segment of a reassembled PDU]
107   1.818689 172.31.8.238 -> 54.230.119.55 TCP 66 43336 > http [ACK] Seq=97 Ack=549250 Win=995200 Len=0 TSval=16841813 TSecr=1686405043
108   1.818807 54.230.119.55 -> 172.31.8.238 TCP 14546 [TCP segment of a reassembled PDU]
109   1.818817 172.31.8.238 -> 54.230.119.55 TCP 66 43336 > http [ACK] Seq=97 Ack=563730 Win=1024256 Len=0 TSval=16841813 TSecr=1686405043
110   1.818916 54.230.119.55 -> 172.31.8.238 TCP 11650 [TCP segment of a reassembled PDU]
111   1.818925 172.31.8.238 -> 54.230.119.55 TCP 66 43336 > http [ACK] Seq=97 Ack=575314 Win=1047424 Len=0 TSval=16841813 TSecr=1686405043
112   1.819031 54.230.119.55 -> 172.31.8.238 TCP 15994 [TCP segment of a reassembled PDU]
113   1.819040 172.31.8.238 -> 54.230.119.55 TCP 66 43336 > http [ACK] Seq=97 Ack=591242 Win=1079168 Len=0 TSval=16841813 TSecr=1686405043
114   1.819130 54.230.119.55 -> 172.31.8.238 TCP 5858 [TCP segment of a reassembled PDU]
115   1.819136 172.31.8.238 -> 54.230.119.55 TCP 66 43336 > http [ACK] Seq=97 Ack=597034 Win=1090816 Len=0 TSval=16841813 TSecr=1686405043
116   1.819296 54.230.119.55 -> 172.31.8.238 TCP 26130 [TCP segment of a reassembled PDU]
117   1.819310 172.31.8.238 -> 54.230.119.55 TCP 66 43336 > http [ACK] Seq=97 Ack=623098 Win=1142912 Len=0 TSval=16841813 TSecr=1686405043
118   1.819340 54.230.119.55 -> 172.31.8.238 TCP 10202 [TCP segment of a reassembled PDU]
119   1.819350 172.31.8.238 -> 54.230.119.55 TCP 66 43336 > http [ACK] Seq=97 Ack=633234 Win=1163264 Len=0 TSval=16841813 TSecr=1686405043
120   1.819725 54.230.119.55 -> 172.31.8.238 TCP 26130 [TCP segment of a reassembled PDU]
121   1.819740 172.31.8.238 -> 54.230.119.55 TCP 66 43336 > http [ACK] Seq=97 Ack=659298 Win=1215360 Len=0 TSval=16841813 TSecr=1686405043
122   1.819872 54.230.119.55 -> 172.31.8.238 TCP 26130 [TCP segment of a reassembled PDU]
123   1.819886 172.31.8.238 -> 54.230.119.55 TCP 66 43336 > http [ACK] Seq=97 Ack=685362 Win=1267456 Len=0 TSval=16841813 TSecr=1686405043
124   1.819906 54.230.119.55 -> 172.31.8.238 TCP 1514 [TCP segment of a reassembled PDU]
125   1.819911 172.31.8.238 -> 54.230.119.55 TCP 66 43336 > http [ACK] Seq=97 Ack=686810 Win=1270400 Len=0 TSval=16841813 TSecr=1686405043
126   1.820210 54.230.119.55 -> 172.31.8.238 TCP 26130 [TCP segment of a reassembled PDU]
127   1.820224 172.31.8.238 -> 54.230.119.55 TCP 66 43336 > http [ACK] Seq=97 Ack=712874 Win=1290752 Len=0 TSval=16841813 TSecr=1686405043
128   1.820363 54.230.119.55 -> 172.31.8.238 TCP 34818 [TCP segment of a reassembled PDU]
129   1.820379 172.31.8.238 -> 54.230.119.55 TCP 66 43336 > http [ACK] Seq=97 Ack=747626 Win=1276416 Len=0 TSval=16841813 TSecr=1686405043
130   1.820389 54.230.119.55 -> 172.31.8.238 TCP 5858 [TCP segment of a reassembled PDU]
131   1.820396 172.31.8.238 -> 54.230.119.55 TCP 66 43336 > http [ACK] Seq=97 Ack=753418 Win=1270656 Len=0 TSval=16841813 TSecr=1686405043
132   1.820905 54.230.119.55 -> 172.31.8.238 TCP 8754 [TCP segment of a reassembled PDU]
133   1.820914 172.31.8.238 -> 54.230.119.55 TCP 66 43336 > http [ACK] Seq=97 Ack=762106 Win=1319296 Len=0 TSval=16841813 TSecr=1686405043
134   1.821086 54.230.119.55 -> 172.31.8.238 TCP 26130 [TCP segment of a reassembled PDU]
135   1.821099 172.31.8.238 -> 54.230.119.55 TCP 66 43336 > http [ACK] Seq=97 Ack=788170 Win=1293312 Len=0 TSval=16841813 TSecr=1686405043
136   1.821229 54.230.119.55 -> 172.31.8.238 TCP 21786 [TCP segment of a reassembled PDU]
137   1.821241 172.31.8.238 -> 54.230.119.55 TCP 66 43336 > http [ACK] Seq=97 Ack=809890 Win=1297792 Len=0 TSval=16841813 TSecr=1686405043
138   1.821289 54.230.119.55 -> 172.31.8.238 TCP 4410 [TCP segment of a reassembled PDU]
139   1.821295 172.31.8.238 -> 54.230.119.55 TCP 66 43336 > http [ACK] Seq=97 Ack=814234 Win=1326336 Len=0 TSval=16841813 TSecr=1686405043
140   1.821412 54.230.119.55 -> 172.31.8.238 TCP 37714 [TCP segment of a reassembled PDU]
141   1.821426 172.31.8.238 -> 54.230.119.55 TCP 66 43336 > http [ACK] Seq=97 Ack=851882 Win=1288704 Len=0 TSval=16841813 TSecr=1686405043
142   1.821951 54.230.119.55 -> 172.31.8.238 TCP 7306 [TCP segment of a reassembled PDU]
143   1.821959 172.31.8.238 -> 54.230.119.55 TCP 66 43336 > http [ACK] Seq=97 Ack=859122 Win=1321600 Len=0 TSval=16841814 TSecr=1686405043
144   1.822102 54.230.119.55 -> 172.31.8.238 TCP 26130 [TCP segment of a reassembled PDU]
145   1.822127 172.31.8.238 -> 54.230.119.55 TCP 66 43336 > http [ACK] Seq=97 Ack=885186 Win=1317760 Len=0 TSval=16841814 TSecr=1686405043
146   1.822281 54.230.119.55 -> 172.31.8.238 TCP 26130 [TCP segment of a reassembled PDU]
147   1.822295 172.31.8.238 -> 54.230.119.55 TCP 66 43336 > http [ACK] Seq=97 Ack=911250 Win=1317760 Len=0 TSval=16841814 TSecr=1686405043
148   1.822308 54.230.119.55 -> 172.31.8.238 TCP 10202 [TCP segment of a reassembled PDU]
149   1.822328 172.31.8.238 -> 54.230.119.55 TCP 66 43336 > http [ACK] Seq=97 Ack=921386 Win=1307648 Len=0 TSval=16841814 TSecr=1686405043
150   1.822451 54.230.119.55 -> 172.31.8.238 TCP 39162 [TCP segment of a reassembled PDU]
151   1.822484 172.31.8.238 -> 54.230.119.55 TCP 66 43336 > http [ACK] Seq=97 Ack=960482 Win=1296384 Len=0 TSval=16841814 TSecr=1686405043
152   1.823026 54.230.119.55 -> 172.31.8.238 TCP 26130 [TCP segment of a reassembled PDU]
153   1.823041 172.31.8.238 -> 54.230.119.55 TCP 66 43336 > http [ACK] Seq=97 Ack=986546 Win=1317760 Len=0 TSval=16841814 TSecr=1686405044
154   1.823105 54.230.119.55 -> 172.31.8.238 TCP 26130 [TCP segment of a reassembled PDU]
155   1.823119 172.31.8.238 -> 54.230.119.55 TCP 66 43336 > http [ACK] Seq=97 Ack=1012610 Win=1317760 Len=0 TSval=16841814 TSecr=1686405044
156   1.823189 54.230.119.55 -> 172.31.8.238 TCP 26130 [TCP segment of a reassembled PDU]
157   1.823203 172.31.8.238 -> 54.230.119.55 TCP 66 43336 > http [ACK] Seq=97 Ack=1038674 Win=1317760 Len=0 TSval=16841814 TSecr=1686405044
158   1.823250 54.230.119.55 -> 172.31.8.238 TCP 8754 [TCP segment of a reassembled PDU]
159   1.823258 172.31.8.238 -> 54.230.119.55 TCP 66 43336 > http [ACK] Seq=97 Ack=1047362 Win=1346304 Len=0 TSval=16841814 TSecr=1686405044
160   1.823699 54.230.119.55 -> 172.31.8.238 HTTP 1738 HTTP/1.1 200 OK  (application/octet-stream)
161   1.823704 172.31.8.238 -> 54.230.119.55 TCP 66 43336 > http [ACK] Seq=97 Ack=1049034 Win=1348224 Len=0 TSval=16841814 TSecr=1686405044
162   1.823830 172.31.8.238 -> 54.230.119.55 TCP 66 43336 > http [FIN, ACK] Seq=97 Ack=1049034 Win=1348224 Len=0 TSval=16841814 TSecr=1686405044
163   1.824439 54.230.119.55 -> 172.31.8.238 TCP 66 http > 43336 [FIN, ACK] Seq=1049034 Ack=98 Win=14592 Len=0 TSval=1686405044 TSecr=16841814
164   1.824446 172.31.8.238 -> 54.230.119.55 TCP 66 43336 > http [ACK] Seq=98 Ack=1049035 Win=1348224 Len=0 TSval=16841814 TSecr=1686405044
