[Measurement for 1mb at 02:42:20 20.42.2014] 
Tshark:

  1   0.000000 172.31.8.238 -> 172.31.0.2   DNS 89 Standard query 0x7ca1  A d1xzxs93r3iphc.cloudfront.net
  2   0.000040 172.31.8.238 -> 172.31.0.2   DNS 89 Standard query 0x3a44  AAAA d1xzxs93r3iphc.cloudfront.net
  3   0.000589   172.31.0.2 -> 172.31.8.238 DNS 170 Standard query response 0x3a44 
  4   0.000611   172.31.0.2 -> 172.31.8.238 DNS 217 Standard query response 0x7ca1  A 54.239.132.41 A 54.239.132.98 A 54.192.118.219 A 54.230.116.164 A 54.230.116.204 A 54.230.117.50 A 54.230.119.11 A 54.230.119.58
  5   0.003898 172.31.8.238 -> 54.239.132.41 TCP 74 54478 > http [SYN] Seq=0 Win=26883 Len=0 MSS=8961 SACK_PERM=1 TSval=8741972 TSecr=0 WS=128
  6   0.004640 54.239.132.41 -> 172.31.8.238 TCP 74 http > 54478 [SYN, ACK] Seq=0 Ack=1 Win=14480 Len=0 MSS=1460 SACK_PERM=1 TSval=1683273172 TSecr=8741972 WS=128
  7   0.004662 172.31.8.238 -> 54.239.132.41 TCP 66 54478 > http [ACK] Seq=1 Ack=1 Win=27008 Len=0 TSval=8741973 TSecr=1683273172
  8   0.004744 172.31.8.238 -> 54.239.132.41 HTTP 162 GET /1mb HTTP/1.1 
  9   0.005366 54.239.132.41 -> 172.31.8.238 TCP 66 http > 54478 [ACK] Seq=1 Ack=97 Win=14592 Len=0 TSval=1683273172 TSecr=8741973
 10   0.006700 54.239.132.41 -> 172.31.8.238 TCP 5858 [TCP segment of a reassembled PDU]
 11   0.006708 172.31.8.238 -> 54.239.132.41 TCP 66 54478 > http [ACK] Seq=97 Ack=5793 Win=38528 Len=0 TSval=8741973 TSecr=1683273172
 12   0.006819 54.239.132.41 -> 172.31.8.238 TCP 7306 [TCP segment of a reassembled PDU]
 13   0.006827 172.31.8.238 -> 54.239.132.41 TCP 66 54478 > http [ACK] Seq=97 Ack=13033 Win=52992 Len=0 TSval=8741973 TSecr=1683273172
 14   0.007456 54.239.132.41 -> 172.31.8.238 TCP 4410 [TCP segment of a reassembled PDU]
 15   0.007462 172.31.8.238 -> 54.239.132.41 TCP 66 54478 > http [ACK] Seq=97 Ack=17377 Win=61696 Len=0 TSval=8741973 TSecr=1683273172
 16   0.007546 54.239.132.41 -> 172.31.8.238 TCP 4410 [TCP segment of a reassembled PDU]
 17   0.007552 172.31.8.238 -> 54.239.132.41 TCP 66 54478 > http [ACK] Seq=97 Ack=21721 Win=70400 Len=0 TSval=8741973 TSecr=1683273172
 18   0.007711 54.239.132.41 -> 172.31.8.238 TCP 2962 [TCP segment of a reassembled PDU]
 19   0.007716 172.31.8.238 -> 54.239.132.41 TCP 66 54478 > http [ACK] Seq=97 Ack=24617 Win=76160 Len=0 TSval=8741973 TSecr=1683273172
 20   0.007790 54.239.132.41 -> 172.31.8.238 TCP 1514 [TCP segment of a reassembled PDU]
 21   0.007794 172.31.8.238 -> 54.239.132.41 TCP 66 54478 > http [ACK] Seq=97 Ack=26065 Win=79104 Len=0 TSval=8741973 TSecr=1683273172
 22   0.008215 54.239.132.41 -> 172.31.8.238 TCP 4410 [TCP segment of a reassembled PDU]
 23   0.008221 172.31.8.238 -> 54.239.132.41 TCP 66 54478 > http [ACK] Seq=97 Ack=30409 Win=87808 Len=0 TSval=8741973 TSecr=1683273172
 24   0.008317 54.239.132.41 -> 172.31.8.238 TCP 8754 [TCP segment of a reassembled PDU]
 25   0.008325 172.31.8.238 -> 54.239.132.41 TCP 66 54478 > http [ACK] Seq=97 Ack=39097 Win=103680 Len=0 TSval=8741973 TSecr=1683273172
 26   0.008357 54.239.132.41 -> 172.31.8.238 TCP 5858 [TCP segment of a reassembled PDU]
 27   0.008363 172.31.8.238 -> 54.239.132.41 TCP 66 54478 > http [ACK] Seq=97 Ack=44889 Win=108416 Len=0 TSval=8741973 TSecr=1683273172
 28   0.008416 54.239.132.41 -> 172.31.8.238 TCP 1514 [TCP segment of a reassembled PDU]
 29   0.008420 172.31.8.238 -> 54.239.132.41 TCP 66 54478 > http [ACK] Seq=97 Ack=46337 Win=109056 Len=0 TSval=8741973 TSecr=1683273172
 30   0.008846 54.239.132.41 -> 172.31.8.238 TCP 8754 [TCP segment of a reassembled PDU]
 31   0.008853 172.31.8.238 -> 54.239.132.41 TCP 66 54478 > http [ACK] Seq=97 Ack=55025 Win=103680 Len=0 TSval=8741974 TSecr=1683273172
 32   0.008909 54.239.132.41 -> 172.31.8.238 TCP 10202 [TCP segment of a reassembled PDU]
 33   0.008917 172.31.8.238 -> 54.239.132.41 TCP 66 54478 > http [ACK] Seq=97 Ack=65161 Win=129280 Len=0 TSval=8741974 TSecr=1683273172
 34   0.009076 54.239.132.41 -> 172.31.8.238 TCP 1514 [TCP segment of a reassembled PDU]
 35   0.009081 172.31.8.238 -> 54.239.132.41 TCP 66 54478 > http [ACK] Seq=97 Ack=66609 Win=132224 Len=0 TSval=8741974 TSecr=1683273172
 36   0.009170 54.239.132.41 -> 172.31.8.238 TCP 4410 [TCP segment of a reassembled PDU]
 37   0.009175 172.31.8.238 -> 54.239.132.41 TCP 66 54478 > http [ACK] Seq=97 Ack=70953 Win=140928 Len=0 TSval=8741974 TSecr=1683273172
 38   0.009271 54.239.132.41 -> 172.31.8.238 TCP 4410 [TCP segment of a reassembled PDU]
 39   0.009276 172.31.8.238 -> 54.239.132.41 TCP 66 54478 > http [ACK] Seq=97 Ack=75297 Win=149632 Len=0 TSval=8741974 TSecr=1683273172
 40   0.009359 54.239.132.41 -> 172.31.8.238 TCP 2962 [TCP segment of a reassembled PDU]
 41   0.009363 172.31.8.238 -> 54.239.132.41 TCP 66 54478 > http [ACK] Seq=97 Ack=78193 Win=155392 Len=0 TSval=8741974 TSecr=1683273172
 42   0.009601 54.239.132.41 -> 172.31.8.238 TCP 5858 [TCP segment of a reassembled PDU]
 43   0.009607 172.31.8.238 -> 54.239.132.41 TCP 66 54478 > http [ACK] Seq=97 Ack=83985 Win=167040 Len=0 TSval=8741974 TSecr=1683273172
 44   0.009691 54.239.132.41 -> 172.31.8.238 TCP 4410 [TCP segment of a reassembled PDU]
 45   0.009696 172.31.8.238 -> 54.239.132.41 TCP 66 54478 > http [ACK] Seq=97 Ack=88329 Win=175616 Len=0 TSval=8741974 TSecr=1683273172
 46   0.009886 54.239.132.41 -> 172.31.8.238 TCP 13098 [TCP segment of a reassembled PDU]
 47   0.009895 172.31.8.238 -> 54.239.132.41 TCP 66 54478 > http [ACK] Seq=97 Ack=101361 Win=201728 Len=0 TSval=8741974 TSecr=1683273172
 48   0.009974 54.239.132.41 -> 172.31.8.238 TCP 2962 [TCP segment of a reassembled PDU]
 49   0.009979 172.31.8.238 -> 54.239.132.41 TCP 66 54478 > http [ACK] Seq=97 Ack=104257 Win=207488 Len=0 TSval=8741974 TSecr=1683273172
 50   0.010166 54.239.132.41 -> 172.31.8.238 TCP 10202 [TCP segment of a reassembled PDU]
 51   0.010173 172.31.8.238 -> 54.239.132.41 TCP 66 54478 > http [ACK] Seq=97 Ack=114393 Win=227840 Len=0 TSval=8741974 TSecr=1683273172
 52   0.010267 54.239.132.41 -> 172.31.8.238 TCP 8754 [TCP segment of a reassembled PDU]
 53   0.010288 172.31.8.238 -> 54.239.132.41 TCP 66 54478 > http [ACK] Seq=97 Ack=123081 Win=245120 Len=0 TSval=8741974 TSecr=1683273172
 54   0.010626 54.239.132.41 -> 172.31.8.238 TCP 5858 [TCP segment of a reassembled PDU]
 55   0.010634 172.31.8.238 -> 54.239.132.41 TCP 66 54478 > http [ACK] Seq=97 Ack=128873 Win=256768 Len=0 TSval=8741974 TSecr=1683273172
 56   0.010715 54.239.132.41 -> 172.31.8.238 TCP 1514 [TCP segment of a reassembled PDU]
 57   0.010720 172.31.8.238 -> 54.239.132.41 TCP 66 54478 > http [ACK] Seq=97 Ack=130321 Win=259712 Len=0 TSval=8741974 TSecr=1683273172
 58   0.010823 54.239.132.41 -> 172.31.8.238 TCP 17442 [TCP segment of a reassembled PDU]
 59   0.010835 172.31.8.238 -> 54.239.132.41 TCP 66 54478 > http [ACK] Seq=97 Ack=147697 Win=294400 Len=0 TSval=8741974 TSecr=1683273172
 60   0.010986 54.239.132.41 -> 172.31.8.238 TCP 8754 [TCP segment of a reassembled PDU]
 61   0.010994 172.31.8.238 -> 54.239.132.41 TCP 66 54478 > http [ACK] Seq=97 Ack=156385 Win=311808 Len=0 TSval=8741974 TSecr=1683273172
 62   0.011342 54.239.132.41 -> 172.31.8.238 TCP 20338 [TCP segment of a reassembled PDU]
 63   0.011354 172.31.8.238 -> 54.239.132.41 TCP 66 54478 > http [ACK] Seq=97 Ack=176657 Win=352384 Len=0 TSval=8741974 TSecr=1683273172
 64   0.011488 54.239.132.41 -> 172.31.8.238 TCP 5858 [TCP segment of a reassembled PDU]
 65   0.011494 172.31.8.238 -> 54.239.132.41 TCP 66 54478 > http [ACK] Seq=97 Ack=182449 Win=363904 Len=0 TSval=8741974 TSecr=1683273172
 66   0.011878 54.239.132.41 -> 172.31.8.238 TCP 26130 [TCP segment of a reassembled PDU]
 67   0.011891 172.31.8.238 -> 54.239.132.41 TCP 66 54478 > http [ACK] Seq=97 Ack=208513 Win=416000 Len=0 TSval=8741974 TSecr=1683273172
 68   0.012104 54.239.132.41 -> 172.31.8.238 TCP 13098 [TCP segment of a reassembled PDU]
 69   0.012114 172.31.8.238 -> 54.239.132.41 TCP 66 54478 > http [ACK] Seq=97 Ack=221545 Win=442112 Len=0 TSval=8741974 TSecr=1683273172
 70   0.012207 54.239.132.41 -> 172.31.8.238 TCP 8754 [TCP segment of a reassembled PDU]
 71   0.012214 172.31.8.238 -> 54.239.132.41 TCP 66 54478 > http [ACK] Seq=97 Ack=230233 Win=459520 Len=0 TSval=8741974 TSecr=1683273172
 72   0.012572 54.239.132.41 -> 172.31.8.238 TCP 14546 [TCP segment of a reassembled PDU]
 73   0.012582 172.31.8.238 -> 54.239.132.41 TCP 66 54478 > http [ACK] Seq=97 Ack=244713 Win=480768 Len=0 TSval=8741974 TSecr=1683273173
 74   0.012711 54.239.132.41 -> 172.31.8.238 TCP 14546 [TCP segment of a reassembled PDU]
 75   0.012720 172.31.8.238 -> 54.239.132.41 TCP 66 54478 > http [ACK] Seq=97 Ack=259193 Win=466304 Len=0 TSval=8741974 TSecr=1683273173
 76   0.012816 54.239.132.41 -> 172.31.8.238 TCP 2962 [TCP segment of a reassembled PDU]
 77   0.012822 172.31.8.238 -> 54.239.132.41 TCP 66 54478 > http [ACK] Seq=97 Ack=262089 Win=463488 Len=0 TSval=8741975 TSecr=1683273173
 78   0.012956 54.239.132.41 -> 172.31.8.238 TCP 17442 [TCP segment of a reassembled PDU]
 79   0.012965 172.31.8.238 -> 54.239.132.41 TCP 66 54478 > http [ACK] Seq=97 Ack=279465 Win=523136 Len=0 TSval=8741975 TSecr=1683273173
 80   0.013332 54.239.132.41 -> 172.31.8.238 TCP 26130 [TCP segment of a reassembled PDU]
 81   0.013345 172.31.8.238 -> 54.239.132.41 TCP 66 54478 > http [ACK] Seq=97 Ack=305529 Win=575360 Len=0 TSval=8741975 TSecr=1683273173
 82   0.013604 54.239.132.41 -> 172.31.8.238 TCP 4410 [TCP segment of a reassembled PDU]
 83   0.013610 172.31.8.238 -> 54.239.132.41 TCP 66 54478 > http [ACK] Seq=97 Ack=309873 Win=584064 Len=0 TSval=8741975 TSecr=1683273173
 84   0.013725 54.239.132.41 -> 172.31.8.238 TCP 26130 [TCP segment of a reassembled PDU]
 85   0.013738 172.31.8.238 -> 54.239.132.41 TCP 66 54478 > http [ACK] Seq=97 Ack=335937 Win=636160 Len=0 TSval=8741975 TSecr=1683273173
 86   0.013757 54.239.132.41 -> 172.31.8.238 TCP 8754 [TCP segment of a reassembled PDU]
 87   0.013763 172.31.8.238 -> 54.239.132.41 TCP 66 54478 > http [ACK] Seq=97 Ack=344625 Win=653568 Len=0 TSval=8741975 TSecr=1683273173
 88   0.014039 54.239.132.41 -> 172.31.8.238 TCP 23234 [TCP segment of a reassembled PDU]
 89   0.014052 172.31.8.238 -> 54.239.132.41 TCP 66 54478 > http [ACK] Seq=97 Ack=367793 Win=699904 Len=0 TSval=8741975 TSecr=1683273173
 90   0.014066 54.239.132.41 -> 172.31.8.238 TCP 2962 [TCP segment of a reassembled PDU]
 91   0.014069 172.31.8.238 -> 54.239.132.41 TCP 66 54478 > http [ACK] Seq=97 Ack=370689 Win=705664 Len=0 TSval=8741975 TSecr=1683273173
 92   0.014070 54.239.132.41 -> 172.31.8.238 TCP 1514 [TCP segment of a reassembled PDU]
 93   0.014073 172.31.8.238 -> 54.239.132.41 TCP 66 54478 > http [ACK] Seq=97 Ack=372137 Win=708480 Len=0 TSval=8741975 TSecr=1683273173
 94   0.014284 54.239.132.41 -> 172.31.8.238 TCP 11650 [TCP segment of a reassembled PDU]
 95   0.014293 172.31.8.238 -> 54.239.132.41 TCP 66 54478 > http [ACK] Seq=97 Ack=383721 Win=731648 Len=0 TSval=8741975 TSecr=1683273173
 96   0.014405 54.239.132.41 -> 172.31.8.238 TCP 17442 [TCP segment of a reassembled PDU]
 97   0.014430 172.31.8.238 -> 54.239.132.41 TCP 66 54478 > http [ACK] Seq=97 Ack=401097 Win=766464 Len=0 TSval=8741975 TSecr=1683273173
 98   0.014516 54.239.132.41 -> 172.31.8.238 TCP 4410 [TCP segment of a reassembled PDU]
 99   0.014522 172.31.8.238 -> 54.239.132.41 TCP 66 54478 > http [ACK] Seq=97 Ack=405441 Win=775168 Len=0 TSval=8741975 TSecr=1683273173
100   0.014911 54.239.132.41 -> 172.31.8.238 TCP 24682 [TCP segment of a reassembled PDU]
101   0.014924 172.31.8.238 -> 54.239.132.41 TCP 66 54478 > http [ACK] Seq=97 Ack=430057 Win=824320 Len=0 TSval=8741975 TSecr=1683273173
102   0.014930 54.239.132.41 -> 172.31.8.238 TCP 1514 [TCP segment of a reassembled PDU]
103   0.014932 172.31.8.238 -> 54.239.132.41 TCP 66 54478 > http [ACK] Seq=97 Ack=431505 Win=827264 Len=0 TSval=8741975 TSecr=1683273173
104   0.015069 54.239.132.41 -> 172.31.8.238 TCP 20338 [TCP segment of a reassembled PDU]
105   0.015081 172.31.8.238 -> 54.239.132.41 TCP 66 54478 > http [ACK] Seq=97 Ack=451777 Win=867840 Len=0 TSval=8741975 TSecr=1683273173
106   0.015197 54.239.132.41 -> 172.31.8.238 TCP 27578 [TCP segment of a reassembled PDU]
107   0.015211 172.31.8.238 -> 54.239.132.41 TCP 66 54478 > http [ACK] Seq=97 Ack=479289 Win=922880 Len=0 TSval=8741975 TSecr=1683273173
108   0.015522 54.239.132.41 -> 172.31.8.238 TCP 13098 [TCP segment of a reassembled PDU]
109   0.015532 172.31.8.238 -> 54.239.132.41 TCP 66 54478 > http [ACK] Seq=97 Ack=492321 Win=948864 Len=0 TSval=8741975 TSecr=1683273173
110   0.015671 54.239.132.41 -> 172.31.8.238 TCP 13098 [TCP segment of a reassembled PDU]
111   0.015680 172.31.8.238 -> 54.239.132.41 TCP 66 54478 > http [ACK] Seq=97 Ack=505353 Win=974976 Len=0 TSval=8741975 TSecr=1683273173
112   0.015932 54.239.132.41 -> 172.31.8.238 TCP 26130 [TCP segment of a reassembled PDU]
113   0.015946 172.31.8.238 -> 54.239.132.41 TCP 66 54478 > http [ACK] Seq=97 Ack=531417 Win=1002368 Len=0 TSval=8741975 TSecr=1683273173
114   0.016005 54.239.132.41 -> 172.31.8.238 TCP 26130 [TCP segment of a reassembled PDU]
115   0.016018 172.31.8.238 -> 54.239.132.41 TCP 66 54478 > http [ACK] Seq=97 Ack=557481 Win=1002368 Len=0 TSval=8741975 TSecr=1683273173
116   0.016062 54.239.132.41 -> 172.31.8.238 TCP 7306 [TCP segment of a reassembled PDU]
117   0.016069 172.31.8.238 -> 54.239.132.41 TCP 66 54478 > http [ACK] Seq=97 Ack=564721 Win=1033344 Len=0 TSval=8741975 TSecr=1683273173
118   0.016213 54.239.132.41 -> 172.31.8.238 TCP 5858 [TCP segment of a reassembled PDU]
119   0.016218 172.31.8.238 -> 54.239.132.41 TCP 66 54478 > http [ACK] Seq=97 Ack=570513 Win=1035648 Len=0 TSval=8741975 TSecr=1683273173
120   0.016499 54.239.132.41 -> 172.31.8.238 TCP 17442 [TCP segment of a reassembled PDU]
121   0.016509 172.31.8.238 -> 54.239.132.41 TCP 66 54478 > http [ACK] Seq=97 Ack=587889 Win=1018368 Len=0 TSval=8741975 TSecr=1683273173
122   0.016659 54.239.132.41 -> 172.31.8.238 TCP 26130 [TCP segment of a reassembled PDU]
123   0.016691 172.31.8.238 -> 54.239.132.41 TCP 66 54478 > http [ACK] Seq=97 Ack=613953 Win=1041536 Len=0 TSval=8741976 TSecr=1683273173
124   0.016721 54.239.132.41 -> 172.31.8.238 TCP 21786 [TCP segment of a reassembled PDU]
125   0.016731 172.31.8.238 -> 54.239.132.41 TCP 66 54478 > http [ACK] Seq=97 Ack=635673 Win=1085056 Len=0 TSval=8741976 TSecr=1683273173
126   0.017147 54.239.132.41 -> 172.31.8.238 TCP 4410 [TCP segment of a reassembled PDU]
127   0.017154 172.31.8.238 -> 54.239.132.41 TCP 66 54478 > http [ACK] Seq=97 Ack=640017 Win=1093760 Len=0 TSval=8741976 TSecr=1683273173
128   0.017325 54.239.132.41 -> 172.31.8.238 TCP 26130 [TCP segment of a reassembled PDU]
129   0.017339 172.31.8.238 -> 54.239.132.41 TCP 66 54478 > http [ACK] Seq=97 Ack=666081 Win=1145856 Len=0 TSval=8741976 TSecr=1683273173
130   0.017385 54.239.132.41 -> 172.31.8.238 TCP 17442 [TCP segment of a reassembled PDU]
131   0.017395 172.31.8.238 -> 54.239.132.41 TCP 66 54478 > http [ACK] Seq=97 Ack=683457 Win=1180544 Len=0 TSval=8741976 TSecr=1683273173
132   0.017440 54.239.132.41 -> 172.31.8.238 TCP 7306 [TCP segment of a reassembled PDU]
133   0.017446 172.31.8.238 -> 54.239.132.41 TCP 66 54478 > http [ACK] Seq=97 Ack=690697 Win=1195008 Len=0 TSval=8741976 TSecr=1683273173
134   0.017606 54.239.132.41 -> 172.31.8.238 TCP 26130 [TCP segment of a reassembled PDU]
135   0.017619 172.31.8.238 -> 54.239.132.41 TCP 66 54478 > http [ACK] Seq=97 Ack=716761 Win=1247232 Len=0 TSval=8741976 TSecr=1683273173
136   0.017661 54.239.132.41 -> 172.31.8.238 TCP 17442 [TCP segment of a reassembled PDU]
137   0.017670 172.31.8.238 -> 54.239.132.41 TCP 66 54478 > http [ACK] Seq=97 Ack=734137 Win=1281920 Len=0 TSval=8741976 TSecr=1683273173
138   0.018114 54.239.132.41 -> 172.31.8.238 TCP 4410 [TCP segment of a reassembled PDU]
139   0.018121 172.31.8.238 -> 54.239.132.41 TCP 66 54478 > http [ACK] Seq=97 Ack=738481 Win=1290624 Len=0 TSval=8741976 TSecr=1683273173
140   0.018286 54.239.132.41 -> 172.31.8.238 TCP 26130 [TCP segment of a reassembled PDU]
141   0.018300 172.31.8.238 -> 54.239.132.41 TCP 66 54478 > http [ACK] Seq=97 Ack=764545 Win=1342720 Len=0 TSval=8741976 TSecr=1683273173
142   0.018305 54.239.132.41 -> 172.31.8.238 TCP 1514 [TCP segment of a reassembled PDU]
143   0.018314 172.31.8.238 -> 54.239.132.41 TCP 66 54478 > http [ACK] Seq=97 Ack=765993 Win=1345664 Len=0 TSval=8741976 TSecr=1683273173
144   0.018456 54.239.132.41 -> 172.31.8.238 TCP 21786 [TCP segment of a reassembled PDU]
145   0.018468 172.31.8.238 -> 54.239.132.41 TCP 66 54478 > http [ACK] Seq=97 Ack=787713 Win=1389056 Len=0 TSval=8741976 TSecr=1683273173
146   0.018585 54.239.132.41 -> 172.31.8.238 TCP 26130 [TCP segment of a reassembled PDU]
147   0.018598 172.31.8.238 -> 54.239.132.41 TCP 66 54478 > http [ACK] Seq=97 Ack=813777 Win=1441280 Len=0 TSval=8741976 TSecr=1683273173
148   0.018608 54.239.132.41 -> 172.31.8.238 TCP 17442 [TCP segment of a reassembled PDU]
149   0.018631 172.31.8.238 -> 54.239.132.41 TCP 66 54478 > http [ACK] Seq=97 Ack=831153 Win=1475968 Len=0 TSval=8741976 TSecr=1683273173
150   0.019019 54.239.132.41 -> 172.31.8.238 TCP 7306 [TCP segment of a reassembled PDU]
151   0.019026 172.31.8.238 -> 54.239.132.41 TCP 66 54478 > http [ACK] Seq=97 Ack=838393 Win=1490432 Len=0 TSval=8741976 TSecr=1683273173
152   0.019191 54.239.132.41 -> 172.31.8.238 TCP 26130 [TCP segment of a reassembled PDU]
153   0.019205 172.31.8.238 -> 54.239.132.41 TCP 66 54478 > http [ACK] Seq=97 Ack=864457 Win=1542528 Len=0 TSval=8741976 TSecr=1683273173
154   0.019225 54.239.132.41 -> 172.31.8.238 TCP 10202 [TCP segment of a reassembled PDU]
155   0.019231 172.31.8.238 -> 54.239.132.41 TCP 66 54478 > http [ACK] Seq=97 Ack=874593 Win=1562880 Len=0 TSval=8741976 TSecr=1683273173
156   0.019428 54.239.132.41 -> 172.31.8.238 TCP 21786 [TCP segment of a reassembled PDU]
157   0.019440 172.31.8.238 -> 54.239.132.41 TCP 66 54478 > http [ACK] Seq=97 Ack=896313 Win=1606272 Len=0 TSval=8741976 TSecr=1683273173
158   0.019582 54.239.132.41 -> 172.31.8.238 TCP 26130 [TCP segment of a reassembled PDU]
159   0.019595 172.31.8.238 -> 54.239.132.41 TCP 66 54478 > http [ACK] Seq=97 Ack=922377 Win=1606272 Len=0 TSval=8741976 TSecr=1683273173
160   0.019630 54.239.132.41 -> 172.31.8.238 TCP 15994 [TCP segment of a reassembled PDU]
161   0.019638 172.31.8.238 -> 54.239.132.41 TCP 66 54478 > http [ACK] Seq=97 Ack=938305 Win=1606272 Len=0 TSval=8741976 TSecr=1683273173
162   0.019693 54.239.132.41 -> 172.31.8.238 TCP 8754 [TCP segment of a reassembled PDU]
163   0.019701 172.31.8.238 -> 54.239.132.41 TCP 66 54478 > http [ACK] Seq=97 Ack=946993 Win=1606272 Len=0 TSval=8741976 TSecr=1683273173
164   0.019920 54.239.132.41 -> 172.31.8.238 TCP 2962 [TCP segment of a reassembled PDU]
165   0.019926 172.31.8.238 -> 54.239.132.41 TCP 66 54478 > http [ACK] Seq=97 Ack=949889 Win=1606272 Len=0 TSval=8741976 TSecr=1683273173
166   0.020095 54.239.132.41 -> 172.31.8.238 TCP 24682 [TCP segment of a reassembled PDU]
167   0.020108 172.31.8.238 -> 54.239.132.41 TCP 66 54478 > http [ACK] Seq=97 Ack=974505 Win=1606272 Len=0 TSval=8741976 TSecr=1683273173
168   0.020232 54.239.132.41 -> 172.31.8.238 TCP 24682 [TCP segment of a reassembled PDU]
169   0.020244 172.31.8.238 -> 54.239.132.41 TCP 66 54478 > http [ACK] Seq=97 Ack=999121 Win=1606272 Len=0 TSval=8741976 TSecr=1683273173
170   0.020370 54.239.132.41 -> 172.31.8.238 TCP 26130 [TCP segment of a reassembled PDU]
171   0.020383 172.31.8.238 -> 54.239.132.41 TCP 66 54478 > http [ACK] Seq=97 Ack=1025185 Win=1606272 Len=0 TSval=8741976 TSecr=1683273173
172   0.020388 54.239.132.41 -> 172.31.8.238 TCP 1514 [TCP segment of a reassembled PDU]
173   0.020506 54.239.132.41 -> 172.31.8.238 TCP 8754 [TCP segment of a reassembled PDU]
174   0.020513 172.31.8.238 -> 54.239.132.41 TCP 66 54478 > http [ACK] Seq=97 Ack=1035321 Win=1606272 Len=0 TSval=8741976 TSecr=1683273173
175   0.020606 54.239.132.41 -> 172.31.8.238 HTTP 13779 HTTP/1.1 200 OK  (application/octet-stream)
176   0.020615 172.31.8.238 -> 54.239.132.41 TCP 66 54478 > http [ACK] Seq=97 Ack=1049034 Win=1606272 Len=0 TSval=8741977 TSecr=1683273173
177   0.020772 172.31.8.238 -> 54.239.132.41 TCP 66 54478 > http [FIN, ACK] Seq=97 Ack=1049034 Win=1606272 Len=0 TSval=8741977 TSecr=1683273173
178   0.021423 54.239.132.41 -> 172.31.8.238 TCP 66 http > 54478 [FIN, ACK] Seq=1049034 Ack=98 Win=14592 Len=0 TSval=1683273173 TSecr=8741977
179   0.021432 172.31.8.238 -> 54.239.132.41 TCP 66 54478 > http [ACK] Seq=98 Ack=1049035 Win=1606272 Len=0 TSval=8741977 TSecr=1683273173
