[Measurement for 1mb at 01:42:19 20.42.2014] 
Tshark:

  1   0.000000 172.31.8.238 -> 172.31.0.2   DNS 89 Standard query 0x2875  A d1xzxs93r3iphc.cloudfront.net
  2   0.000028 172.31.8.238 -> 172.31.0.2   DNS 89 Standard query 0x0af1  AAAA d1xzxs93r3iphc.cloudfront.net
  3   0.000682   172.31.0.2 -> 172.31.8.238 DNS 217 Standard query response 0x2875  A 54.230.118.239 A 54.230.119.18 A 54.230.119.58 A 54.239.132.90 A 54.192.118.219 A 54.192.118.235 A 54.192.118.236 A 54.230.118.136
  4   0.000786   172.31.0.2 -> 172.31.8.238 DNS 170 Standard query response 0x0af1 
  5   0.003876 172.31.8.238 -> 54.230.118.239 TCP 74 36178 > http [SYN] Seq=0 Win=26883 Len=0 MSS=8961 SACK_PERM=1 TSval=7841782 TSecr=0 WS=128
  6   0.004451 54.230.118.239 -> 172.31.8.238 TCP 74 http > 36178 [SYN, ACK] Seq=0 Ack=1 Win=14480 Len=0 MSS=1460 SACK_PERM=1 TSval=1685895491 TSecr=7841782 WS=128
  7   0.004464 172.31.8.238 -> 54.230.118.239 TCP 66 36178 > http [ACK] Seq=1 Ack=1 Win=27008 Len=0 TSval=7841782 TSecr=1685895491
  8   0.004503 172.31.8.238 -> 54.230.118.239 HTTP 162 GET /1mb HTTP/1.1 
  9   0.005175 54.230.118.239 -> 172.31.8.238 TCP 66 http > 36178 [ACK] Seq=1 Ack=97 Win=14592 Len=0 TSval=1685895491 TSecr=7841782
 10   0.007480 54.230.118.239 -> 172.31.8.238 TCP 523 [TCP segment of a reassembled PDU]
 11   0.007486 172.31.8.238 -> 54.230.118.239 TCP 66 36178 > http [ACK] Seq=97 Ack=458 Win=28032 Len=0 TSval=7841783 TSecr=1685895491
 12   0.007603 54.230.118.239 -> 172.31.8.238 TCP 13098 [TCP segment of a reassembled PDU]
 13   0.007613 172.31.8.238 -> 54.230.118.239 TCP 66 36178 > http [ACK] Seq=97 Ack=13490 Win=54144 Len=0 TSval=7841783 TSecr=1685895491
 14   0.008263 54.230.118.239 -> 172.31.8.238 TCP 4410 [TCP segment of a reassembled PDU]
 15   0.008270 172.31.8.238 -> 54.230.118.239 TCP 66 36178 > http [ACK] Seq=97 Ack=17834 Win=62720 Len=0 TSval=7841783 TSecr=1685895491
 16   0.008368 54.230.118.239 -> 172.31.8.238 TCP 8754 [TCP segment of a reassembled PDU]
 17   0.008374 172.31.8.238 -> 54.230.118.239 TCP 66 36178 > http [ACK] Seq=97 Ack=26522 Win=80128 Len=0 TSval=7841783 TSecr=1685895491
 18   0.008786 54.230.118.239 -> 172.31.8.238 TCP 4410 [TCP segment of a reassembled PDU]
 19   0.008792 172.31.8.238 -> 54.230.118.239 TCP 66 36178 > http [ACK] Seq=97 Ack=30866 Win=88832 Len=0 TSval=7841784 TSecr=1685895491
 20   0.008891 54.230.118.239 -> 172.31.8.238 TCP 5858 [TCP segment of a reassembled PDU]
 21   0.008897 172.31.8.238 -> 54.230.118.239 TCP 66 36178 > http [ACK] Seq=97 Ack=36658 Win=100480 Len=0 TSval=7841784 TSecr=1685895491
 22   0.009072 54.230.118.239 -> 172.31.8.238 TCP 10202 [TCP segment of a reassembled PDU]
 23   0.009080 172.31.8.238 -> 54.230.118.239 TCP 66 36178 > http [ACK] Seq=97 Ack=46794 Win=101248 Len=0 TSval=7841784 TSecr=1685895491
 24   0.009544 54.230.118.239 -> 172.31.8.238 TCP 5858 [TCP segment of a reassembled PDU]
 25   0.009551 172.31.8.238 -> 54.230.118.239 TCP 66 36178 > http [ACK] Seq=97 Ack=52586 Win=108416 Len=0 TSval=7841784 TSecr=1685895491
 26   0.009788 54.230.118.239 -> 172.31.8.238 TCP 4410 [TCP segment of a reassembled PDU]
 27   0.009793 172.31.8.238 -> 54.230.118.239 TCP 66 36178 > http [ACK] Seq=97 Ack=56930 Win=109056 Len=0 TSval=7841784 TSecr=1685895491
 28   0.009888 54.230.118.239 -> 172.31.8.238 TCP 8754 [TCP segment of a reassembled PDU]
 29   0.009894 172.31.8.238 -> 54.230.118.239 TCP 66 36178 > http [ACK] Seq=97 Ack=65618 Win=103680 Len=0 TSval=7841784 TSecr=1685895491
 30   0.010316 54.230.118.239 -> 172.31.8.238 TCP 7306 [TCP segment of a reassembled PDU]
 31   0.010323 172.31.8.238 -> 54.230.118.239 TCP 66 36178 > http [ACK] Seq=97 Ack=72858 Win=105984 Len=0 TSval=7841784 TSecr=1685895492
 32   0.010413 54.230.118.239 -> 172.31.8.238 TCP 5858 [TCP segment of a reassembled PDU]
 33   0.010419 172.31.8.238 -> 54.230.118.239 TCP 66 36178 > http [ACK] Seq=97 Ack=78650 Win=108416 Len=0 TSval=7841784 TSecr=1685895492
 34   0.010665 54.230.118.239 -> 172.31.8.238 TCP 15994 [TCP segment of a reassembled PDU]
 35   0.010675 172.31.8.238 -> 54.230.118.239 TCP 66 36178 > http [ACK] Seq=97 Ack=94578 Win=92544 Len=0 TSval=7841784 TSecr=1685895492
 36   0.011075 54.230.118.239 -> 172.31.8.238 TCP 5858 [TCP segment of a reassembled PDU]
 37   0.011082 172.31.8.238 -> 54.230.118.239 TCP 66 36178 > http [ACK] Seq=97 Ack=100370 Win=108416 Len=0 TSval=7841784 TSecr=1685895492
 38   0.011167 54.230.118.239 -> 172.31.8.238 TCP 4410 [TCP segment of a reassembled PDU]
 39   0.011173 172.31.8.238 -> 54.230.118.239 TCP 66 36178 > http [ACK] Seq=97 Ack=104714 Win=109056 Len=0 TSval=7841784 TSecr=1685895492
 40   0.011324 54.230.118.239 -> 172.31.8.238 TCP 1514 [TCP segment of a reassembled PDU]
 41   0.011329 172.31.8.238 -> 54.230.118.239 TCP 66 36178 > http [ACK] Seq=97 Ack=106162 Win=109056 Len=0 TSval=7841784 TSecr=1685895492
 42   0.011477 54.230.118.239 -> 172.31.8.238 TCP 21786 [TCP segment of a reassembled PDU]
 43   0.011491 172.31.8.238 -> 54.230.118.239 TCP 66 36178 > http [ACK] Seq=97 Ack=127882 Win=87424 Len=0 TSval=7841784 TSecr=1685895492
 44   0.011832 54.230.118.239 -> 172.31.8.238 TCP 2962 [TCP segment of a reassembled PDU]
 45   0.011838 172.31.8.238 -> 54.230.118.239 TCP 66 36178 > http [ACK] Seq=97 Ack=130778 Win=109056 Len=0 TSval=7841784 TSecr=1685895492
 46   0.012099 54.230.118.239 -> 172.31.8.238 TCP 5858 [TCP segment of a reassembled PDU]
 47   0.012105 172.31.8.238 -> 54.230.118.239 TCP 66 36178 > http [ACK] Seq=97 Ack=136570 Win=108416 Len=0 TSval=7841784 TSecr=1685895492
 48   0.012247 54.230.118.239 -> 172.31.8.238 TCP 20338 [TCP segment of a reassembled PDU]
 49   0.012258 172.31.8.238 -> 54.230.118.239 TCP 66 36178 > http [ACK] Seq=97 Ack=156842 Win=88192 Len=0 TSval=7841784 TSecr=1685895492
 50   0.012618 54.230.118.239 -> 172.31.8.238 TCP 7306 [TCP segment of a reassembled PDU]
 51   0.012625 172.31.8.238 -> 54.230.118.239 TCP 66 36178 > http [ACK] Seq=97 Ack=164082 Win=105984 Len=0 TSval=7841785 TSecr=1685895492
 52   0.012730 54.230.118.239 -> 172.31.8.238 TCP 7306 [TCP segment of a reassembled PDU]
 53   0.012737 172.31.8.238 -> 54.230.118.239 TCP 66 36178 > http [ACK] Seq=97 Ack=171322 Win=123520 Len=0 TSval=7841785 TSecr=1685895492
 54   0.012956 54.230.118.239 -> 172.31.8.238 TCP 11650 [TCP segment of a reassembled PDU]
 55   0.012964 172.31.8.238 -> 54.230.118.239 TCP 66 36178 > http [ACK] Seq=97 Ack=182906 Win=146688 Len=0 TSval=7841785 TSecr=1685895492
 56   0.013072 54.230.118.239 -> 172.31.8.238 TCP 17442 [TCP segment of a reassembled PDU]
 57   0.013082 172.31.8.238 -> 54.230.118.239 TCP 66 36178 > http [ACK] Seq=97 Ack=200282 Win=181504 Len=0 TSval=7841785 TSecr=1685895492
 58   0.013378 54.230.118.239 -> 172.31.8.238 TCP 5858 [TCP segment of a reassembled PDU]
 59   0.013384 172.31.8.238 -> 54.230.118.239 TCP 66 36178 > http [ACK] Seq=97 Ack=206074 Win=193024 Len=0 TSval=7841785 TSecr=1685895492
 60   0.013495 54.230.118.239 -> 172.31.8.238 TCP 2962 [TCP segment of a reassembled PDU]
 61   0.013500 172.31.8.238 -> 54.230.118.239 TCP 66 36178 > http [ACK] Seq=97 Ack=208970 Win=198784 Len=0 TSval=7841785 TSecr=1685895492
 62   0.013790 54.230.118.239 -> 172.31.8.238 TCP 26130 [TCP segment of a reassembled PDU]
 63   0.013804 172.31.8.238 -> 54.230.118.239 TCP 66 36178 > http [ACK] Seq=97 Ack=235034 Win=251008 Len=0 TSval=7841785 TSecr=1685895492
 64   0.013839 54.230.118.239 -> 172.31.8.238 TCP 14546 [TCP segment of a reassembled PDU]
 65   0.013849 172.31.8.238 -> 54.230.118.239 TCP 66 36178 > http [ACK] Seq=97 Ack=249514 Win=279936 Len=0 TSval=7841785 TSecr=1685895492
 66   0.014156 54.230.118.239 -> 172.31.8.238 TCP 7306 [TCP segment of a reassembled PDU]
 67   0.014164 172.31.8.238 -> 54.230.118.239 TCP 66 36178 > http [ACK] Seq=97 Ack=256754 Win=294400 Len=0 TSval=7841785 TSecr=1685895492
 68   0.014268 54.230.118.239 -> 172.31.8.238 TCP 1514 [TCP segment of a reassembled PDU]
 69   0.014272 172.31.8.238 -> 54.230.118.239 TCP 66 36178 > http [ACK] Seq=97 Ack=258202 Win=297344 Len=0 TSval=7841785 TSecr=1685895492
 70   0.014535 54.230.118.239 -> 172.31.8.238 TCP 26130 [TCP segment of a reassembled PDU]
 71   0.014548 172.31.8.238 -> 54.230.118.239 TCP 66 36178 > http [ACK] Seq=97 Ack=284266 Win=349440 Len=0 TSval=7841785 TSecr=1685895492
 72   0.014556 54.230.118.239 -> 172.31.8.238 TCP 4410 [TCP segment of a reassembled PDU]
 73   0.014560 172.31.8.238 -> 54.230.118.239 TCP 66 36178 > http [ACK] Seq=97 Ack=288610 Win=358144 Len=0 TSval=7841785 TSecr=1685895492
 74   0.014929 54.230.118.239 -> 172.31.8.238 TCP 2962 [TCP segment of a reassembled PDU]
 75   0.014935 172.31.8.238 -> 54.230.118.239 TCP 66 36178 > http [ACK] Seq=97 Ack=291506 Win=363904 Len=0 TSval=7841785 TSecr=1685895492
 76   0.015071 54.230.118.239 -> 172.31.8.238 TCP 15994 [TCP segment of a reassembled PDU]
 77   0.015080 172.31.8.238 -> 54.230.118.239 TCP 66 36178 > http [ACK] Seq=97 Ack=307434 Win=395776 Len=0 TSval=7841785 TSecr=1685895492
 78   0.015287 54.230.118.239 -> 172.31.8.238 TCP 23234 [TCP segment of a reassembled PDU]
 79   0.015299 172.31.8.238 -> 54.230.118.239 TCP 66 36178 > http [ACK] Seq=97 Ack=330602 Win=442112 Len=0 TSval=7841785 TSecr=1685895492
 80   0.015417 54.230.118.239 -> 172.31.8.238 TCP 13098 [TCP segment of a reassembled PDU]
 81   0.015426 172.31.8.238 -> 54.230.118.239 TCP 66 36178 > http [ACK] Seq=97 Ack=343634 Win=468224 Len=0 TSval=7841785 TSecr=1685895492
 82   0.015714 54.230.118.239 -> 172.31.8.238 TCP 2962 [TCP segment of a reassembled PDU]
 83   0.015733 172.31.8.238 -> 54.230.118.239 TCP 66 36178 > http [ACK] Seq=97 Ack=346530 Win=473984 Len=0 TSval=7841785 TSecr=1685895492
 84   0.015846 54.230.118.239 -> 172.31.8.238 TCP 10202 [TCP segment of a reassembled PDU]
 85   0.015854 172.31.8.238 -> 54.230.118.239 TCP 66 36178 > http [ACK] Seq=97 Ack=356666 Win=494208 Len=0 TSval=7841785 TSecr=1685895492
 86   0.016109 54.230.118.239 -> 172.31.8.238 TCP 26130 [TCP segment of a reassembled PDU]
 87   0.016121 172.31.8.238 -> 54.230.118.239 TCP 66 36178 > http [ACK] Seq=97 Ack=382730 Win=546304 Len=0 TSval=7841785 TSecr=1685895492
 88   0.016186 54.230.118.239 -> 172.31.8.238 TCP 26130 [TCP segment of a reassembled PDU]
 89   0.016200 172.31.8.238 -> 54.230.118.239 TCP 66 36178 > http [ACK] Seq=97 Ack=408794 Win=598528 Len=0 TSval=7841785 TSecr=1685895492
 90   0.016228 54.230.118.239 -> 172.31.8.238 TCP 1514 [TCP segment of a reassembled PDU]
 91   0.016235 172.31.8.238 -> 54.230.118.239 TCP 66 36178 > http [ACK] Seq=97 Ack=410242 Win=601344 Len=0 TSval=7841785 TSecr=1685895492
 92   0.016727 54.230.118.239 -> 172.31.8.238 TCP 2962 [TCP segment of a reassembled PDU]
 93   0.016732 172.31.8.238 -> 54.230.118.239 TCP 66 36178 > http [ACK] Seq=97 Ack=413138 Win=607232 Len=0 TSval=7841786 TSecr=1685895492
 94   0.016917 54.230.118.239 -> 172.31.8.238 TCP 26130 [TCP segment of a reassembled PDU]
 95   0.016931 172.31.8.238 -> 54.230.118.239 TCP 66 36178 > http [ACK] Seq=97 Ack=439202 Win=659328 Len=0 TSval=7841786 TSecr=1685895492
 96   0.016991 54.230.118.239 -> 172.31.8.238 TCP 24682 [TCP segment of a reassembled PDU]
 97   0.017005 172.31.8.238 -> 54.230.118.239 TCP 66 36178 > http [ACK] Seq=97 Ack=463818 Win=708480 Len=0 TSval=7841786 TSecr=1685895492
 98   0.017760 54.230.118.239 -> 172.31.8.238 TCP 2962 [TCP segment of a reassembled PDU]
 99   0.017767 172.31.8.238 -> 54.230.118.239 TCP 66 36178 > http [ACK] Seq=97 Ack=466714 Win=714368 Len=0 TSval=7841786 TSecr=1685895492
100   0.017930 54.230.118.239 -> 172.31.8.238 TCP 26130 [TCP segment of a reassembled PDU]
101   0.017943 172.31.8.238 -> 54.230.118.239 TCP 66 36178 > http [ACK] Seq=97 Ack=492778 Win=766464 Len=0 TSval=7841786 TSecr=1685895492
102   0.018002 54.230.118.239 -> 172.31.8.238 TCP 24682 [TCP segment of a reassembled PDU]
103   0.018015 172.31.8.238 -> 54.230.118.239 TCP 66 36178 > http [ACK] Seq=97 Ack=517394 Win=815744 Len=0 TSval=7841786 TSecr=1685895492
104   0.018519 54.230.118.239 -> 172.31.8.238 TCP 2962 [TCP segment of a reassembled PDU]
105   0.018524 172.31.8.238 -> 54.230.118.239 TCP 66 36178 > http [ACK] Seq=97 Ack=520290 Win=821504 Len=0 TSval=7841786 TSecr=1685895492
106   0.018699 54.230.118.239 -> 172.31.8.238 TCP 26130 [TCP segment of a reassembled PDU]
107   0.018714 172.31.8.238 -> 54.230.118.239 TCP 66 36178 > http [ACK] Seq=97 Ack=546354 Win=873600 Len=0 TSval=7841786 TSecr=1685895492
108   0.018837 54.230.118.239 -> 172.31.8.238 TCP 26130 [TCP segment of a reassembled PDU]
109   0.018852 172.31.8.238 -> 54.230.118.239 TCP 66 36178 > http [ACK] Seq=97 Ack=572418 Win=925696 Len=0 TSval=7841786 TSecr=1685895492
110   0.018860 54.230.118.239 -> 172.31.8.238 TCP 7306 [TCP segment of a reassembled PDU]
111   0.018865 172.31.8.238 -> 54.230.118.239 TCP 66 36178 > http [ACK] Seq=97 Ack=579658 Win=940160 Len=0 TSval=7841786 TSecr=1685895492
112   0.018884 54.230.118.239 -> 172.31.8.238 TCP 18890 [TCP segment of a reassembled PDU]
113   0.018894 172.31.8.238 -> 54.230.118.239 TCP 66 36178 > http [ACK] Seq=97 Ack=598482 Win=977920 Len=0 TSval=7841786 TSecr=1685895492
114   0.018995 54.230.118.239 -> 172.31.8.238 TCP 1514 [TCP segment of a reassembled PDU]
115   0.019000 172.31.8.238 -> 54.230.118.239 TCP 66 36178 > http [ACK] Seq=97 Ack=599930 Win=980736 Len=0 TSval=7841786 TSecr=1685895492
116   0.019377 54.230.118.239 -> 172.31.8.238 TCP 21786 [TCP segment of a reassembled PDU]
117   0.019390 172.31.8.238 -> 54.230.118.239 TCP 66 36178 > http [ACK] Seq=97 Ack=621650 Win=1024256 Len=0 TSval=7841786 TSecr=1685895492
118   0.019492 54.230.118.239 -> 172.31.8.238 TCP 14546 [TCP segment of a reassembled PDU]
119   0.019502 172.31.8.238 -> 54.230.118.239 TCP 66 36178 > http [ACK] Seq=97 Ack=636130 Win=1053184 Len=0 TSval=7841786 TSecr=1685895492
120   0.019597 54.230.118.239 -> 172.31.8.238 TCP 11650 [TCP segment of a reassembled PDU]
121   0.019604 172.31.8.238 -> 54.230.118.239 TCP 66 36178 > http [ACK] Seq=97 Ack=647714 Win=1076352 Len=0 TSval=7841786 TSecr=1685895492
122   0.019741 54.230.118.239 -> 172.31.8.238 TCP 20338 [TCP segment of a reassembled PDU]
123   0.019752 172.31.8.238 -> 54.230.118.239 TCP 66 36178 > http [ACK] Seq=97 Ack=667986 Win=1116928 Len=0 TSval=7841786 TSecr=1685895492
124   0.020133 54.230.118.239 -> 172.31.8.238 TCP 1514 [TCP segment of a reassembled PDU]
125   0.020138 172.31.8.238 -> 54.230.118.239 TCP 66 36178 > http [ACK] Seq=97 Ack=669434 Win=1119744 Len=0 TSval=7841786 TSecr=1685895493
126   0.020323 54.230.118.239 -> 172.31.8.238 TCP 26130 [TCP segment of a reassembled PDU]
127   0.020337 172.31.8.238 -> 54.230.118.239 TCP 66 36178 > http [ACK] Seq=97 Ack=695498 Win=1171840 Len=0 TSval=7841786 TSecr=1685895493
128   0.020399 54.230.118.239 -> 172.31.8.238 TCP 26130 [TCP segment of a reassembled PDU]
129   0.020412 172.31.8.238 -> 54.230.118.239 TCP 66 36178 > http [ACK] Seq=97 Ack=721562 Win=1224064 Len=0 TSval=7841786 TSecr=1685895493
130   0.020473 54.230.118.239 -> 172.31.8.238 TCP 21786 [TCP segment of a reassembled PDU]
131   0.020484 172.31.8.238 -> 54.230.118.239 TCP 66 36178 > http [ACK] Seq=97 Ack=743282 Win=1209856 Len=0 TSval=7841786 TSecr=1685895493
132   0.020865 54.230.118.239 -> 172.31.8.238 TCP 8754 [TCP segment of a reassembled PDU]
133   0.020873 172.31.8.238 -> 54.230.118.239 TCP 66 36178 > http [ACK] Seq=97 Ack=751970 Win=1241344 Len=0 TSval=7841787 TSecr=1685895493
134   0.021014 54.230.118.239 -> 172.31.8.238 TCP 26130 [TCP segment of a reassembled PDU]
135   0.021027 172.31.8.238 -> 54.230.118.239 TCP 66 36178 > http [ACK] Seq=97 Ack=778034 Win=1245696 Len=0 TSval=7841787 TSecr=1685895493
136   0.021082 54.230.118.239 -> 172.31.8.238 TCP 23234 [TCP segment of a reassembled PDU]
137   0.021095 172.31.8.238 -> 54.230.118.239 TCP 66 36178 > http [ACK] Seq=97 Ack=801202 Win=1250432 Len=0 TSval=7841787 TSecr=1685895493
138   0.021137 54.230.118.239 -> 172.31.8.238 TCP 2962 [TCP Previous segment not captured] [TCP segment of a reassembled PDU]
139   0.021142 172.31.8.238 -> 54.230.118.239 TCP 78 [TCP Window Update] 36178 > http [ACK] Seq=97 Ack=801202 Win=1282688 Len=0 TSval=7841787 TSecr=1685895493 SLE=802650 SRE=805546
140   0.021195 54.230.118.239 -> 172.31.8.238 TCP 1514 [TCP Out-Of-Order] [TCP segment of a reassembled PDU]
141   0.021201 172.31.8.238 -> 54.230.118.239 TCP 66 36178 > http [ACK] Seq=97 Ack=805546 Win=1281152 Len=0 TSval=7841787 TSecr=1685895493
142   0.021287 54.230.118.239 -> 172.31.8.238 TCP 26130 [TCP segment of a reassembled PDU]
143   0.021300 172.31.8.238 -> 54.230.118.239 TCP 66 36178 > http [ACK] Seq=97 Ack=831610 Win=1255168 Len=0 TSval=7841787 TSecr=1685895493
144   0.021675 54.230.118.239 -> 172.31.8.238 TCP 23234 [TCP segment of a reassembled PDU]
145   0.021688 172.31.8.238 -> 54.230.118.239 TCP 66 36178 > http [ACK] Seq=97 Ack=854778 Win=1250432 Len=0 TSval=7841787 TSecr=1685895493
146   0.021817 54.230.118.239 -> 172.31.8.238 TCP 26130 [TCP segment of a reassembled PDU]
147   0.021830 172.31.8.238 -> 54.230.118.239 TCP 66 36178 > http [ACK] Seq=97 Ack=880842 Win=1245696 Len=0 TSval=7841787 TSecr=1685895493
148   0.021837 54.230.118.239 -> 172.31.8.238 TCP 1514 [TCP segment of a reassembled PDU]
149   0.021839 172.31.8.238 -> 54.230.118.239 TCP 66 36178 > http [ACK] Seq=97 Ack=882290 Win=1244288 Len=0 TSval=7841787 TSecr=1685895493
150   0.021842 54.230.118.239 -> 172.31.8.238 TCP 2962 [TCP segment of a reassembled PDU]
151   0.021845 172.31.8.238 -> 54.230.118.239 TCP 66 36178 > http [ACK] Seq=97 Ack=885186 Win=1241472 Len=0 TSval=7841787 TSecr=1685895493
152   0.022024 54.230.118.239 -> 172.31.8.238 TCP 11650 [TCP segment of a reassembled PDU]
153   0.022032 172.31.8.238 -> 54.230.118.239 TCP 66 36178 > http [ACK] Seq=97 Ack=896770 Win=1269504 Len=0 TSval=7841787 TSecr=1685895493
154   0.022041 54.230.118.239 -> 172.31.8.238 TCP 4410 [TCP segment of a reassembled PDU]
155   0.022044 172.31.8.238 -> 54.230.118.239 TCP 66 36178 > http [ACK] Seq=97 Ack=901114 Win=1265280 Len=0 TSval=7841787 TSecr=1685895493
156   0.022441 54.230.118.239 -> 172.31.8.238 TCP 26130 [TCP segment of a reassembled PDU]
157   0.022455 172.31.8.238 -> 54.230.118.239 TCP 66 36178 > http [ACK] Seq=97 Ack=927178 Win=1245696 Len=0 TSval=7841787 TSecr=1685895493
158   0.022511 54.230.118.239 -> 172.31.8.238 TCP 24682 [TCP segment of a reassembled PDU]
159   0.022523 172.31.8.238 -> 54.230.118.239 TCP 66 36178 > http [ACK] Seq=97 Ack=951794 Win=1248000 Len=0 TSval=7841787 TSecr=1685895493
160   0.022585 54.230.118.239 -> 172.31.8.238 TCP 20338 [TCP segment of a reassembled PDU]
161   0.022596 172.31.8.238 -> 54.230.118.239 TCP 66 36178 > http [ACK] Seq=97 Ack=972066 Win=1227776 Len=0 TSval=7841787 TSecr=1685895493
162   0.022724 54.230.118.239 -> 172.31.8.238 TCP 17442 [TCP segment of a reassembled PDU]
163   0.022735 172.31.8.238 -> 54.230.118.239 TCP 66 36178 > http [ACK] Seq=97 Ack=989442 Win=1210496 Len=0 TSval=7841787 TSecr=1685895493
164   0.022772 54.230.118.239 -> 172.31.8.238 TCP 8754 [TCP segment of a reassembled PDU]
165   0.022778 172.31.8.238 -> 54.230.118.239 TCP 66 36178 > http [ACK] Seq=97 Ack=998130 Win=1201920 Len=0 TSval=7841787 TSecr=1685895493
166   0.022839 54.230.118.239 -> 172.31.8.238 TCP 5858 [TCP segment of a reassembled PDU]
167   0.022849 172.31.8.238 -> 54.230.118.239 TCP 66 36178 > http [ACK] Seq=97 Ack=1003922 Win=1235968 Len=0 TSval=7841787 TSecr=1685895493
168   0.025216 54.230.118.239 -> 172.31.8.238 TCP 26130 [TCP segment of a reassembled PDU]
169   0.025230 172.31.8.238 -> 54.230.118.239 TCP 66 36178 > http [ACK] Seq=97 Ack=1029986 Win=1245696 Len=0 TSval=7841788 TSecr=1685895493
170   0.025274 54.230.118.239 -> 172.31.8.238 HTTP 19114 HTTP/1.1 200 OK  (application/octet-stream)
171   0.025285 172.31.8.238 -> 54.230.118.239 TCP 66 36178 > http [ACK] Seq=97 Ack=1049034 Win=1255168 Len=0 TSval=7841788 TSecr=1685895493
172   0.025424 172.31.8.238 -> 54.230.118.239 TCP 66 36178 > http [FIN, ACK] Seq=97 Ack=1049034 Win=1282688 Len=0 TSval=7841788 TSecr=1685895493
173   0.026266 54.230.118.239 -> 172.31.8.238 TCP 66 http > 36178 [FIN, ACK] Seq=1049034 Ack=98 Win=14592 Len=0 TSval=1685895493 TSecr=7841788
174   0.026273 172.31.8.238 -> 54.230.118.239 TCP 66 36178 > http [ACK] Seq=98 Ack=1049035 Win=1282688 Len=0 TSval=7841788 TSecr=1685895493
