[Measurement for 1mb at 20:42:19 19.42.2014] 
Tshark:

  1   0.000000 172.31.8.238 -> 172.31.0.2   DNS 89 Standard query 0xb00c  A d1xzxs93r3iphc.cloudfront.net
  2   0.000028 172.31.8.238 -> 172.31.0.2   DNS 89 Standard query 0xb528  AAAA d1xzxs93r3iphc.cloudfront.net
  3   0.000670   172.31.0.2 -> 172.31.8.238 DNS 217 Standard query response 0xb00c  A 54.230.119.165 A 54.239.132.173 A 54.239.132.196 A 54.239.132.250 A 54.230.116.53 A 54.230.116.164 A 54.230.119.55 A 54.230.119.86
  4   0.000695   172.31.0.2 -> 172.31.8.238 DNS 170 Standard query response 0xb528 
  5   0.003871 172.31.8.238 -> 54.230.119.165 TCP 74 39240 > http [SYN] Seq=0 Win=26883 Len=0 MSS=8961 SACK_PERM=1 TSval=3341826 TSecr=0 WS=128
  6   0.004404 54.230.119.165 -> 172.31.8.238 TCP 74 http > 39240 [SYN, ACK] Seq=0 Ack=1 Win=14480 Len=0 MSS=1460 SACK_PERM=1 TSval=1680779185 TSecr=3341826 WS=128
  7   0.004418 172.31.8.238 -> 54.230.119.165 TCP 66 39240 > http [ACK] Seq=1 Ack=1 Win=27008 Len=0 TSval=3341826 TSecr=1680779185
  8   0.004471 172.31.8.238 -> 54.230.119.165 HTTP 162 GET /1mb HTTP/1.1 
  9   0.005098 54.230.119.165 -> 172.31.8.238 TCP 66 http > 39240 [ACK] Seq=1 Ack=97 Win=14592 Len=0 TSval=1680779185 TSecr=3341826
 10   0.007230 54.230.119.165 -> 172.31.8.238 TCP 522 [TCP segment of a reassembled PDU]
 11   0.007237 172.31.8.238 -> 54.230.119.165 TCP 66 39240 > http [ACK] Seq=97 Ack=457 Win=28032 Len=0 TSval=3341827 TSecr=1680779186
 12   0.007359 54.230.119.165 -> 172.31.8.238 TCP 13098 [TCP segment of a reassembled PDU]
 13   0.007370 172.31.8.238 -> 54.230.119.165 TCP 66 39240 > http [ACK] Seq=97 Ack=13489 Win=54144 Len=0 TSval=3341827 TSecr=1680779186
 14   0.008107 54.230.119.165 -> 172.31.8.238 TCP 10202 [TCP segment of a reassembled PDU]
 15   0.008118 172.31.8.238 -> 54.230.119.165 TCP 66 39240 > http [ACK] Seq=97 Ack=23625 Win=74368 Len=0 TSval=3341827 TSecr=1680779186
 16   0.008156 54.230.119.165 -> 172.31.8.238 TCP 2962 [TCP segment of a reassembled PDU]
 17   0.008161 172.31.8.238 -> 54.230.119.165 TCP 66 39240 > http [ACK] Seq=97 Ack=26521 Win=80128 Len=0 TSval=3341827 TSecr=1680779186
 18   0.008805 54.230.119.165 -> 172.31.8.238 TCP 5858 [TCP segment of a reassembled PDU]
 19   0.008811 172.31.8.238 -> 54.230.119.165 TCP 66 39240 > http [ACK] Seq=97 Ack=32313 Win=91776 Len=0 TSval=3341827 TSecr=1680779186
 20   0.008926 54.230.119.165 -> 172.31.8.238 TCP 14546 [TCP segment of a reassembled PDU]
 21   0.008935 172.31.8.238 -> 54.230.119.165 TCP 66 39240 > http [ACK] Seq=97 Ack=46793 Win=94080 Len=0 TSval=3341827 TSecr=1680779186
 22   0.009276 54.230.119.165 -> 172.31.8.238 TCP 2962 [TCP segment of a reassembled PDU]
 23   0.009281 172.31.8.238 -> 54.230.119.165 TCP 66 39240 > http [ACK] Seq=97 Ack=49689 Win=109056 Len=0 TSval=3341827 TSecr=1680779186
 24   0.009364 54.230.119.165 -> 172.31.8.238 TCP 2962 [TCP segment of a reassembled PDU]
 25   0.009369 172.31.8.238 -> 54.230.119.165 TCP 66 39240 > http [ACK] Seq=97 Ack=52585 Win=109056 Len=0 TSval=3341827 TSecr=1680779186
 26   0.009560 54.230.119.165 -> 172.31.8.238 TCP 4410 [TCP segment of a reassembled PDU]
 27   0.009565 172.31.8.238 -> 54.230.119.165 TCP 66 39240 > http [ACK] Seq=97 Ack=56929 Win=117760 Len=0 TSval=3341828 TSecr=1680779186
 28   0.009664 54.230.119.165 -> 172.31.8.238 TCP 8754 [TCP segment of a reassembled PDU]
 29   0.009671 172.31.8.238 -> 54.230.119.165 TCP 66 39240 > http [ACK] Seq=97 Ack=65617 Win=135168 Len=0 TSval=3341828 TSecr=1680779186
 30   0.009799 54.230.119.165 -> 172.31.8.238 TCP 7306 [TCP segment of a reassembled PDU]
 31   0.009806 172.31.8.238 -> 54.230.119.165 TCP 66 39240 > http [ACK] Seq=97 Ack=72857 Win=149632 Len=0 TSval=3341828 TSecr=1680779186
 32   0.010368 54.230.119.165 -> 172.31.8.238 TCP 7306 [TCP segment of a reassembled PDU]
 33   0.010374 172.31.8.238 -> 54.230.119.165 TCP 66 39240 > http [ACK] Seq=97 Ack=80097 Win=164096 Len=0 TSval=3341828 TSecr=1680779186
 34   0.010490 54.230.119.165 -> 172.31.8.238 TCP 11650 [TCP segment of a reassembled PDU]
 35   0.010498 172.31.8.238 -> 54.230.119.165 TCP 66 39240 > http [ACK] Seq=97 Ack=91681 Win=187264 Len=0 TSval=3341828 TSecr=1680779186
 36   0.011186 54.230.119.165 -> 172.31.8.238 TCP 7306 [TCP segment of a reassembled PDU]
 37   0.011193 172.31.8.238 -> 54.230.119.165 TCP 66 39240 > http [ACK] Seq=97 Ack=98921 Win=201728 Len=0 TSval=3341828 TSecr=1680779186
 38   0.011297 54.230.119.165 -> 172.31.8.238 TCP 13098 [TCP segment of a reassembled PDU]
 39   0.011306 172.31.8.238 -> 54.230.119.165 TCP 66 39240 > http [ACK] Seq=97 Ack=111953 Win=227840 Len=0 TSval=3341828 TSecr=1680779186
 40   0.011975 54.230.119.165 -> 172.31.8.238 TCP 2962 [TCP segment of a reassembled PDU]
 41   0.011980 172.31.8.238 -> 54.230.119.165 TCP 66 39240 > http [ACK] Seq=97 Ack=114849 Win=233600 Len=0 TSval=3341828 TSecr=1680779186
 42   0.012080 54.230.119.165 -> 172.31.8.238 TCP 2962 [TCP segment of a reassembled PDU]
 43   0.012085 172.31.8.238 -> 54.230.119.165 TCP 66 39240 > http [ACK] Seq=97 Ack=117745 Win=239360 Len=0 TSval=3341828 TSecr=1680779186
 44   0.012192 54.230.119.165 -> 172.31.8.238 TCP 13098 [TCP segment of a reassembled PDU]
 45   0.012201 172.31.8.238 -> 54.230.119.165 TCP 66 39240 > http [ACK] Seq=97 Ack=130777 Win=265472 Len=0 TSval=3341828 TSecr=1680779186
 46   0.012732 54.230.119.165 -> 172.31.8.238 TCP 7306 [TCP segment of a reassembled PDU]
 47   0.012740 172.31.8.238 -> 54.230.119.165 TCP 66 39240 > http [ACK] Seq=97 Ack=138017 Win=279936 Len=0 TSval=3341828 TSecr=1680779186
 48   0.012880 54.230.119.165 -> 172.31.8.238 TCP 13098 [TCP segment of a reassembled PDU]
 49   0.012889 172.31.8.238 -> 54.230.119.165 TCP 66 39240 > http [ACK] Seq=97 Ack=151049 Win=306048 Len=0 TSval=3341828 TSecr=1680779186
 50   0.013502 54.230.119.165 -> 172.31.8.238 TCP 5858 [TCP segment of a reassembled PDU]
 51   0.013508 172.31.8.238 -> 54.230.119.165 TCP 66 39240 > http [ACK] Seq=97 Ack=156841 Win=317568 Len=0 TSval=3341829 TSecr=1680779186
 52   0.013606 54.230.119.165 -> 172.31.8.238 TCP 13098 [TCP segment of a reassembled PDU]
 53   0.013615 172.31.8.238 -> 54.230.119.165 TCP 66 39240 > http [ACK] Seq=97 Ack=169873 Win=343680 Len=0 TSval=3341829 TSecr=1680779186
 54   0.014253 54.230.119.165 -> 172.31.8.238 TCP 5858 [TCP segment of a reassembled PDU]
 55   0.014259 172.31.8.238 -> 54.230.119.165 TCP 66 39240 > http [ACK] Seq=97 Ack=175665 Win=355200 Len=0 TSval=3341829 TSecr=1680779186
 56   0.014382 54.230.119.165 -> 172.31.8.238 TCP 7306 [TCP segment of a reassembled PDU]
 57   0.014388 172.31.8.238 -> 54.230.119.165 TCP 66 39240 > http [ACK] Seq=97 Ack=182905 Win=369664 Len=0 TSval=3341829 TSecr=1680779186
 58   0.014474 54.230.119.165 -> 172.31.8.238 TCP 8754 [TCP segment of a reassembled PDU]
 59   0.014481 172.31.8.238 -> 54.230.119.165 TCP 66 39240 > http [ACK] Seq=97 Ack=191593 Win=387072 Len=0 TSval=3341829 TSecr=1680779186
 60   0.015030 54.230.119.165 -> 172.31.8.238 TCP 5858 [TCP segment of a reassembled PDU]
 61   0.015036 172.31.8.238 -> 54.230.119.165 TCP 66 39240 > http [ACK] Seq=97 Ack=197385 Win=398720 Len=0 TSval=3341829 TSecr=1680779186
 62   0.015192 54.230.119.165 -> 172.31.8.238 TCP 15994 [TCP segment of a reassembled PDU]
 63   0.015202 172.31.8.238 -> 54.230.119.165 TCP 66 39240 > http [ACK] Seq=97 Ack=213313 Win=430464 Len=0 TSval=3341829 TSecr=1680779186
 64   0.015788 54.230.119.165 -> 172.31.8.238 TCP 2962 [TCP segment of a reassembled PDU]
 65   0.015793 172.31.8.238 -> 54.230.119.165 TCP 66 39240 > http [ACK] Seq=97 Ack=216209 Win=436352 Len=0 TSval=3341829 TSecr=1680779187
 66   0.015948 54.230.119.165 -> 172.31.8.238 TCP 18890 [TCP segment of a reassembled PDU]
 67   0.015960 172.31.8.238 -> 54.230.119.165 TCP 66 39240 > http [ACK] Seq=97 Ack=235033 Win=473984 Len=0 TSval=3341829 TSecr=1680779187
 68   0.016571 54.230.119.165 -> 172.31.8.238 TCP 2962 [TCP segment of a reassembled PDU]
 69   0.016577 172.31.8.238 -> 54.230.119.165 TCP 66 39240 > http [ACK] Seq=97 Ack=237929 Win=479744 Len=0 TSval=3341829 TSecr=1680779187
 70   0.016782 54.230.119.165 -> 172.31.8.238 TCP 18890 [TCP segment of a reassembled PDU]
 71   0.016793 172.31.8.238 -> 54.230.119.165 TCP 66 39240 > http [ACK] Seq=97 Ack=256753 Win=517376 Len=0 TSval=3341829 TSecr=1680779187
 72   0.017333 54.230.119.165 -> 172.31.8.238 TCP 7306 [TCP segment of a reassembled PDU]
 73   0.017341 172.31.8.238 -> 54.230.119.165 TCP 66 39240 > http [ACK] Seq=97 Ack=263993 Win=531840 Len=0 TSval=3341829 TSecr=1680779187
 74   0.017482 54.230.119.165 -> 172.31.8.238 TCP 14546 [TCP segment of a reassembled PDU]
 75   0.017492 172.31.8.238 -> 54.230.119.165 TCP 66 39240 > http [ACK] Seq=97 Ack=278473 Win=560896 Len=0 TSval=3341830 TSecr=1680779187
 76   0.017849 54.230.119.165 -> 172.31.8.238 TCP 2962 [TCP segment of a reassembled PDU]
 77   0.017855 172.31.8.238 -> 54.230.119.165 TCP 66 39240 > http [ACK] Seq=97 Ack=281369 Win=566656 Len=0 TSval=3341830 TSecr=1680779187
 78   0.017982 54.230.119.165 -> 172.31.8.238 TCP 4410 [TCP segment of a reassembled PDU]
 79   0.017988 172.31.8.238 -> 54.230.119.165 TCP 66 39240 > http [ACK] Seq=97 Ack=285713 Win=575360 Len=0 TSval=3341830 TSecr=1680779187
 80   0.018248 54.230.119.165 -> 172.31.8.238 TCP 14546 [TCP segment of a reassembled PDU]
 81   0.018257 172.31.8.238 -> 54.230.119.165 TCP 66 39240 > http [ACK] Seq=97 Ack=300193 Win=604288 Len=0 TSval=3341830 TSecr=1680779187
 82   0.018644 54.230.119.165 -> 172.31.8.238 TCP 5858 [TCP segment of a reassembled PDU]
 83   0.018650 172.31.8.238 -> 54.230.119.165 TCP 66 39240 > http [ACK] Seq=97 Ack=305985 Win=615808 Len=0 TSval=3341830 TSecr=1680779187
 84   0.018768 54.230.119.165 -> 172.31.8.238 TCP 2962 [TCP segment of a reassembled PDU]
 85   0.018774 172.31.8.238 -> 54.230.119.165 TCP 66 39240 > http [ACK] Seq=97 Ack=308881 Win=621696 Len=0 TSval=3341830 TSecr=1680779187
 86   0.019010 54.230.119.165 -> 172.31.8.238 TCP 14546 [TCP segment of a reassembled PDU]
 87   0.019020 172.31.8.238 -> 54.230.119.165 TCP 66 39240 > http [ACK] Seq=97 Ack=323361 Win=650624 Len=0 TSval=3341830 TSecr=1680779187
 88   0.019447 54.230.119.165 -> 172.31.8.238 TCP 8754 [TCP segment of a reassembled PDU]
 89   0.019455 172.31.8.238 -> 54.230.119.165 TCP 66 39240 > http [ACK] Seq=97 Ack=332049 Win=668032 Len=0 TSval=3341830 TSecr=1680779187
 90   0.019750 54.230.119.165 -> 172.31.8.238 TCP 14546 [TCP segment of a reassembled PDU]
 91   0.019759 172.31.8.238 -> 54.230.119.165 TCP 66 39240 > http [ACK] Seq=97 Ack=346529 Win=678912 Len=0 TSval=3341830 TSecr=1680779187
 92   0.020150 54.230.119.165 -> 172.31.8.238 TCP 7306 [TCP segment of a reassembled PDU]
 93   0.020157 172.31.8.238 -> 54.230.119.165 TCP 66 39240 > http [ACK] Seq=97 Ack=353769 Win=690944 Len=0 TSval=3341830 TSecr=1680779187
 94   0.020402 54.230.119.165 -> 172.31.8.238 TCP 1514 [TCP segment of a reassembled PDU]
 95   0.020407 172.31.8.238 -> 54.230.119.165 TCP 66 39240 > http [ACK] Seq=97 Ack=355217 Win=699904 Len=0 TSval=3341830 TSecr=1680779187
 96   0.020544 54.230.119.165 -> 172.31.8.238 TCP 1514 [TCP Previous segment not captured] [TCP segment of a reassembled PDU]
 97   0.020549 172.31.8.238 -> 54.230.119.165 TCP 78 [TCP Window Update] 39240 > http [ACK] Seq=97 Ack=355217 Win=700416 Len=0 TSval=3341830 TSecr=1680779187 SLE=356665 SRE=358113
 98   0.020603 54.230.119.165 -> 172.31.8.238 TCP 1514 [TCP Out-Of-Order] [TCP segment of a reassembled PDU]
 99   0.020607 172.31.8.238 -> 54.230.119.165 TCP 66 39240 > http [ACK] Seq=97 Ack=358113 Win=697856 Len=0 TSval=3341830 TSecr=1680779187
100   0.020685 54.230.119.165 -> 172.31.8.238 TCP 11650 [TCP segment of a reassembled PDU]
101   0.020693 172.31.8.238 -> 54.230.119.165 TCP 66 39240 > http [ACK] Seq=97 Ack=369697 Win=686336 Len=0 TSval=3341830 TSecr=1680779187
102   0.022579 54.230.119.165 -> 172.31.8.238 TCP 23234 [TCP segment of a reassembled PDU]
103   0.022592 172.31.8.238 -> 54.230.119.165 TCP 66 39240 > http [ACK] Seq=97 Ack=392865 Win=664704 Len=0 TSval=3341831 TSecr=1680779187
104   0.023407 54.230.119.165 -> 172.31.8.238 TCP 23234 [TCP segment of a reassembled PDU]
105   0.023419 172.31.8.238 -> 54.230.119.165 TCP 66 39240 > http [ACK] Seq=97 Ack=416033 Win=664704 Len=0 TSval=3341831 TSecr=1680779187
106   0.024047 54.230.119.165 -> 172.31.8.238 TCP 7306 [TCP segment of a reassembled PDU]
107   0.024055 172.31.8.238 -> 54.230.119.165 TCP 66 39240 > http [ACK] Seq=97 Ack=423273 Win=690944 Len=0 TSval=3341831 TSecr=1680779187
108   0.024205 54.230.119.165 -> 172.31.8.238 TCP 15994 [TCP segment of a reassembled PDU]
109   0.024215 172.31.8.238 -> 54.230.119.165 TCP 66 39240 > http [ACK] Seq=97 Ack=439201 Win=676608 Len=0 TSval=3341831 TSecr=1680779187
110   0.024831 54.230.119.165 -> 172.31.8.238 TCP 7306 [TCP segment of a reassembled PDU]
111   0.024838 172.31.8.238 -> 54.230.119.165 TCP 66 39240 > http [ACK] Seq=97 Ack=446441 Win=690944 Len=0 TSval=3341831 TSecr=1680779187
112   0.024970 54.230.119.165 -> 172.31.8.238 TCP 15994 [TCP segment of a reassembled PDU]
113   0.024980 172.31.8.238 -> 54.230.119.165 TCP 66 39240 > http [ACK] Seq=97 Ack=462369 Win=676608 Len=0 TSval=3341831 TSecr=1680779187
114   0.025647 54.230.119.165 -> 172.31.8.238 TCP 10202 [TCP segment of a reassembled PDU]
115   0.025668 172.31.8.238 -> 54.230.119.165 TCP 66 39240 > http [ACK] Seq=97 Ack=472505 Win=686208 Len=0 TSval=3341832 TSecr=1680779187
116   0.025773 54.230.119.165 -> 172.31.8.238 TCP 11650 [TCP segment of a reassembled PDU]
117   0.025782 172.31.8.238 -> 54.230.119.165 TCP 66 39240 > http [ACK] Seq=97 Ack=484089 Win=683776 Len=0 TSval=3341832 TSecr=1680779187
118   0.026339 54.230.119.165 -> 172.31.8.238 TCP 2962 [TCP segment of a reassembled PDU]
119   0.026345 172.31.8.238 -> 54.230.119.165 TCP 66 39240 > http [ACK] Seq=97 Ack=486985 Win=697984 Len=0 TSval=3341832 TSecr=1680779188
120   0.026498 54.230.119.165 -> 172.31.8.238 TCP 21786 [TCP segment of a reassembled PDU]
121   0.026510 172.31.8.238 -> 54.230.119.165 TCP 66 39240 > http [ACK] Seq=97 Ack=508705 Win=676352 Len=0 TSval=3341832 TSecr=1680779188
122   0.027113 54.230.119.165 -> 172.31.8.238 TCP 5858 [TCP segment of a reassembled PDU]
123   0.027120 172.31.8.238 -> 54.230.119.165 TCP 66 39240 > http [ACK] Seq=97 Ack=514497 Win=693248 Len=0 TSval=3341832 TSecr=1680779188
124   0.027260 54.230.119.165 -> 172.31.8.238 TCP 18890 [TCP segment of a reassembled PDU]
125   0.027271 172.31.8.238 -> 54.230.119.165 TCP 66 39240 > http [ACK] Seq=97 Ack=533321 Win=674432 Len=0 TSval=3341832 TSecr=1680779188
126   0.027911 54.230.119.165 -> 172.31.8.238 TCP 7306 [TCP segment of a reassembled PDU]
127   0.027918 172.31.8.238 -> 54.230.119.165 TCP 66 39240 > http [ACK] Seq=97 Ack=540561 Win=690944 Len=0 TSval=3341832 TSecr=1680779188
128   0.028058 54.230.119.165 -> 172.31.8.238 TCP 17442 [TCP segment of a reassembled PDU]
129   0.028069 172.31.8.238 -> 54.230.119.165 TCP 66 39240 > http [ACK] Seq=97 Ack=557937 Win=674176 Len=0 TSval=3341832 TSecr=1680779188
130   0.028639 54.230.119.165 -> 172.31.8.238 TCP 2962 [TCP segment of a reassembled PDU]
131   0.028645 172.31.8.238 -> 54.230.119.165 TCP 66 39240 > http [ACK] Seq=97 Ack=560833 Win=697984 Len=0 TSval=3341832 TSecr=1680779188
132   0.028807 54.230.119.165 -> 172.31.8.238 TCP 21786 [TCP segment of a reassembled PDU]
133   0.028844 172.31.8.238 -> 54.230.119.165 TCP 66 39240 > http [ACK] Seq=97 Ack=582553 Win=676352 Len=0 TSval=3341832 TSecr=1680779188
134   0.029412 54.230.119.165 -> 172.31.8.238 TCP 5858 [TCP segment of a reassembled PDU]
135   0.029418 172.31.8.238 -> 54.230.119.165 TCP 66 39240 > http [ACK] Seq=97 Ack=588345 Win=693248 Len=0 TSval=3341833 TSecr=1680779188
136   0.029642 54.230.119.165 -> 172.31.8.238 TCP 18890 [TCP segment of a reassembled PDU]
137   0.029678 172.31.8.238 -> 54.230.119.165 TCP 66 39240 > http [ACK] Seq=97 Ack=607169 Win=674432 Len=0 TSval=3341833 TSecr=1680779188
138   0.030482 54.230.119.165 -> 172.31.8.238 TCP 7306 [TCP segment of a reassembled PDU]
139   0.030489 172.31.8.238 -> 54.230.119.165 TCP 66 39240 > http [ACK] Seq=97 Ack=614409 Win=690944 Len=0 TSval=3341833 TSecr=1680779188
140   0.030608 54.230.119.165 -> 172.31.8.238 TCP 17442 [TCP segment of a reassembled PDU]
141   0.030699 172.31.8.238 -> 54.230.119.165 TCP 66 39240 > http [ACK] Seq=97 Ack=631785 Win=674176 Len=0 TSval=3341833 TSecr=1680779188
142   0.031576 54.230.119.165 -> 172.31.8.238 TCP 24682 [TCP segment of a reassembled PDU]
143   0.031600 172.31.8.238 -> 54.230.119.165 TCP 66 39240 > http [ACK] Seq=97 Ack=656401 Win=662400 Len=0 TSval=3341833 TSecr=1680779188
144   0.032229 54.230.119.165 -> 172.31.8.238 TCP 5858 [TCP segment of a reassembled PDU]
145   0.032236 172.31.8.238 -> 54.230.119.165 TCP 66 39240 > http [ACK] Seq=97 Ack=662193 Win=693248 Len=0 TSval=3341833 TSecr=1680779188
146   0.032380 54.230.119.165 -> 172.31.8.238 TCP 17442 [TCP segment of a reassembled PDU]
147   0.032401 172.31.8.238 -> 54.230.119.165 TCP 66 39240 > http [ACK] Seq=97 Ack=679569 Win=675968 Len=0 TSval=3341833 TSecr=1680779188
148   0.033019 54.230.119.165 -> 172.31.8.238 TCP 8754 [TCP segment of a reassembled PDU]
149   0.033027 172.31.8.238 -> 54.230.119.165 TCP 66 39240 > http [ACK] Seq=97 Ack=688257 Win=688512 Len=0 TSval=3341833 TSecr=1680779188
150   0.033148 54.230.119.165 -> 172.31.8.238 TCP 15994 [TCP segment of a reassembled PDU]
151   0.033171 172.31.8.238 -> 54.230.119.165 TCP 66 39240 > http [ACK] Seq=97 Ack=704185 Win=702720 Len=0 TSval=3341833 TSecr=1680779188
152   0.033773 54.230.119.165 -> 172.31.8.238 TCP 7306 [TCP segment of a reassembled PDU]
153   0.033790 172.31.8.238 -> 54.230.119.165 TCP 66 39240 > http [ACK] Seq=97 Ack=711425 Win=702720 Len=0 TSval=3341834 TSecr=1680779188
154   0.033923 54.230.119.165 -> 172.31.8.238 TCP 18890 [TCP segment of a reassembled PDU]
155   0.033944 172.31.8.238 -> 54.230.119.165 TCP 66 39240 > http [ACK] Seq=97 Ack=730249 Win=683904 Len=0 TSval=3341834 TSecr=1680779188
156   0.034528 54.230.119.165 -> 172.31.8.238 TCP 5858 [TCP segment of a reassembled PDU]
157   0.034534 172.31.8.238 -> 54.230.119.165 TCP 66 39240 > http [ACK] Seq=97 Ack=736041 Win=693248 Len=0 TSval=3341834 TSecr=1680779188
158   0.034663 54.230.119.165 -> 172.31.8.238 TCP 8754 [TCP segment of a reassembled PDU]
159   0.034717 54.230.119.165 -> 172.31.8.238 TCP 11650 [TCP segment of a reassembled PDU]
160   0.034755 172.31.8.238 -> 54.230.119.165 TCP 66 39240 > http [ACK] Seq=97 Ack=756313 Win=683776 Len=0 TSval=3341834 TSecr=1680779188
161   0.035347 54.230.119.165 -> 172.31.8.238 TCP 2962 [TCP segment of a reassembled PDU]
162   0.035353 172.31.8.238 -> 54.230.119.165 TCP 66 39240 > http [ACK] Seq=97 Ack=759209 Win=697984 Len=0 TSval=3341834 TSecr=1680779188
163   0.035553 54.230.119.165 -> 172.31.8.238 TCP 23234 [TCP segment of a reassembled PDU]
164   0.035577 172.31.8.238 -> 54.230.119.165 TCP 66 39240 > http [ACK] Seq=97 Ack=782377 Win=674816 Len=0 TSval=3341834 TSecr=1680779188
165   0.036356 54.230.119.165 -> 172.31.8.238 TCP 8754 [TCP segment of a reassembled PDU]
166   0.036363 172.31.8.238 -> 54.230.119.165 TCP 66 39240 > http [ACK] Seq=97 Ack=791065 Win=688512 Len=0 TSval=3341834 TSecr=1680779189
167   0.036512 54.230.119.165 -> 172.31.8.238 TCP 17442 [TCP segment of a reassembled PDU]
168   0.036534 172.31.8.238 -> 54.230.119.165 TCP 66 39240 > http [ACK] Seq=97 Ack=808441 Win=674176 Len=0 TSval=3341834 TSecr=1680779189
169   0.036852 54.230.119.165 -> 172.31.8.238 TCP 1514 [TCP segment of a reassembled PDU]
170   0.037116 54.230.119.165 -> 172.31.8.238 TCP 8754 [TCP segment of a reassembled PDU]
171   0.037135 172.31.8.238 -> 54.230.119.165 TCP 66 39240 > http [ACK] Seq=97 Ack=818577 Win=688512 Len=0 TSval=3341834 TSecr=1680779189
172   0.037235 54.230.119.165 -> 172.31.8.238 TCP 15994 [TCP segment of a reassembled PDU]
173   0.037257 172.31.8.238 -> 54.230.119.165 TCP 66 39240 > http [ACK] Seq=97 Ack=834505 Win=702720 Len=0 TSval=3341834 TSecr=1680779189
174   0.037878 54.230.119.165 -> 172.31.8.238 TCP 13098 [TCP segment of a reassembled PDU]
175   0.037900 172.31.8.238 -> 54.230.119.165 TCP 66 39240 > http [ACK] Seq=97 Ack=847537 Win=702720 Len=0 TSval=3341835 TSecr=1680779189
176   0.038008 54.230.119.165 -> 172.31.8.238 TCP 13098 [TCP segment of a reassembled PDU]
177   0.038028 172.31.8.238 -> 54.230.119.165 TCP 66 39240 > http [ACK] Seq=97 Ack=860569 Win=702720 Len=0 TSval=3341835 TSecr=1680779189
178   0.038395 54.230.119.165 -> 172.31.8.238 TCP 5858 [TCP segment of a reassembled PDU]
179   0.038413 172.31.8.238 -> 54.230.119.165 TCP 66 39240 > http [ACK] Seq=97 Ack=866361 Win=702720 Len=0 TSval=3341835 TSecr=1680779189
180   0.038518 54.230.119.165 -> 172.31.8.238 TCP 7306 [TCP segment of a reassembled PDU]
181   0.038535 172.31.8.238 -> 54.230.119.165 TCP 66 39240 > http [ACK] Seq=97 Ack=873601 Win=702720 Len=0 TSval=3341835 TSecr=1680779189
182   0.038633 54.230.119.165 -> 172.31.8.238 TCP 1514 [TCP segment of a reassembled PDU]
183   0.038705 54.230.119.165 -> 172.31.8.238 TCP 11650 [TCP segment of a reassembled PDU]
184   0.038724 172.31.8.238 -> 54.230.119.165 TCP 66 39240 > http [ACK] Seq=97 Ack=886633 Win=702720 Len=0 TSval=3341835 TSecr=1680779189
185   0.039150 54.230.119.165 -> 172.31.8.238 TCP 5858 [TCP segment of a reassembled PDU]
186   0.039167 172.31.8.238 -> 54.230.119.165 TCP 66 39240 > http [ACK] Seq=97 Ack=892425 Win=702720 Len=0 TSval=3341835 TSecr=1680779189
187   0.039261 54.230.119.165 -> 172.31.8.238 TCP 7306 [TCP segment of a reassembled PDU]
188   0.039279 172.31.8.238 -> 54.230.119.165 TCP 66 39240 > http [ACK] Seq=97 Ack=899665 Win=702720 Len=0 TSval=3341835 TSecr=1680779189
189   0.039534 54.230.119.165 -> 172.31.8.238 TCP 13098 [TCP segment of a reassembled PDU]
190   0.039568 172.31.8.238 -> 54.230.119.165 TCP 66 39240 > http [ACK] Seq=97 Ack=912697 Win=702720 Len=0 TSval=3341835 TSecr=1680779189
191   0.039940 54.230.119.165 -> 172.31.8.238 TCP 5858 [TCP segment of a reassembled PDU]
192   0.039956 172.31.8.238 -> 54.230.119.165 TCP 66 39240 > http [ACK] Seq=97 Ack=918489 Win=702720 Len=0 TSval=3341835 TSecr=1680779189
193   0.040047 54.230.119.165 -> 172.31.8.238 TCP 7306 [TCP segment of a reassembled PDU]
194   0.040064 172.31.8.238 -> 54.230.119.165 TCP 66 39240 > http [ACK] Seq=97 Ack=925729 Win=702720 Len=0 TSval=3341835 TSecr=1680779189
195   0.040189 54.230.119.165 -> 172.31.8.238 TCP 13098 [TCP segment of a reassembled PDU]
196   0.040209 172.31.8.238 -> 54.230.119.165 TCP 66 39240 > http [ACK] Seq=97 Ack=938761 Win=702720 Len=0 TSval=3341835 TSecr=1680779189
197   0.040675 54.230.119.165 -> 172.31.8.238 TCP 5858 [TCP segment of a reassembled PDU]
198   0.040691 172.31.8.238 -> 54.230.119.165 TCP 66 39240 > http [ACK] Seq=97 Ack=944553 Win=702720 Len=0 TSval=3341835 TSecr=1680779189
199   0.040861 54.230.119.165 -> 172.31.8.238 TCP 21786 [TCP segment of a reassembled PDU]
200   0.040885 172.31.8.238 -> 54.230.119.165 TCP 66 39240 > http [ACK] Seq=97 Ack=966273 Win=681088 Len=0 TSval=3341835 TSecr=1680779189
201   0.041447 54.230.119.165 -> 172.31.8.238 TCP 4410 [TCP segment of a reassembled PDU]
202   0.041452 172.31.8.238 -> 54.230.119.165 TCP 66 39240 > http [ACK] Seq=97 Ack=970617 Win=695680 Len=0 TSval=3341836 TSecr=1680779189
203   0.041612 54.230.119.165 -> 172.31.8.238 TCP 23234 [TCP segment of a reassembled PDU]
204   0.041816 172.31.8.238 -> 54.230.119.165 TCP 66 39240 > http [ACK] Seq=97 Ack=993785 Win=672512 Len=0 TSval=3341836 TSecr=1680779189
205   0.042476 54.230.119.165 -> 172.31.8.238 TCP 5858 [TCP segment of a reassembled PDU]
206   0.042482 172.31.8.238 -> 54.230.119.165 TCP 66 39240 > http [ACK] Seq=97 Ack=999577 Win=693248 Len=0 TSval=3341836 TSecr=1680779189
207   0.042632 54.230.119.165 -> 172.31.8.238 TCP 21786 [TCP segment of a reassembled PDU]
208   0.042655 172.31.8.238 -> 54.230.119.165 TCP 66 39240 > http [ACK] Seq=97 Ack=1021297 Win=671616 Len=0 TSval=3341836 TSecr=1680779189
209   0.043256 54.230.119.165 -> 172.31.8.238 TCP 2962 [TCP segment of a reassembled PDU]
210   0.043261 172.31.8.238 -> 54.230.119.165 TCP 66 39240 > http [ACK] Seq=97 Ack=1024193 Win=697984 Len=0 TSval=3341836 TSecr=1680779189
211   0.043417 54.230.119.165 -> 172.31.8.238 TCP 24682 [TCP segment of a reassembled PDU]
212   0.043441 172.31.8.238 -> 54.230.119.165 TCP 66 39240 > http [ACK] Seq=97 Ack=1048809 Win=673408 Len=0 TSval=3341836 TSecr=1680779189
213   0.043731 54.230.119.165 -> 172.31.8.238 HTTP 290 HTTP/1.1 200 OK  (application/octet-stream)
214   0.043744 172.31.8.238 -> 54.230.119.165 TCP 66 39240 > http [ACK] Seq=97 Ack=1049033 Win=702720 Len=0 TSval=3341836 TSecr=1680779189
215   0.043861 172.31.8.238 -> 54.230.119.165 TCP 66 39240 > http [FIN, ACK] Seq=97 Ack=1049033 Win=702720 Len=0 TSval=3341836 TSecr=1680779189
216   0.044248 54.230.119.165 -> 172.31.8.238 TCP 66 http > 39240 [FIN, ACK] Seq=1049033 Ack=98 Win=14592 Len=0 TSval=1680779189 TSecr=3341836
217   0.044257 172.31.8.238 -> 54.230.119.165 TCP 66 39240 > http [ACK] Seq=98 Ack=1049034 Win=702720 Len=0 TSval=3341836 TSecr=1680779189
