[Measurement for 1kb at 18:36:14 19.36.2014] 
Tshark:

  1   0.000000 172.31.36.109 -> 172.31.0.2   DNS 89 Standard query 0x6998  A d3m1c4hwkgedal.cloudfront.net
  2   0.000035 172.31.36.109 -> 172.31.0.2   DNS 89 Standard query 0x1738  AAAA d3m1c4hwkgedal.cloudfront.net
  3   0.000639   172.31.0.2 -> 172.31.36.109 DNS 217 Standard query response 0x6998  A 54.230.30.229 A 54.230.30.231 A 54.230.30.232 A 54.230.30.238 A 54.192.29.225 A 54.192.30.219 A 54.230.29.243 A 54.230.29.244
  4   0.024311   172.31.0.2 -> 172.31.36.109 DNS 174 Standard query response 0x1738 
  5   0.028172 172.31.36.109 -> 54.230.30.229 TCP 74 54916 > http [SYN] Seq=0 Win=26883 Len=0 MSS=8961 SACK_PERM=1 TSval=21465345 TSecr=0 WS=128
  6   0.029616 54.230.30.229 -> 172.31.36.109 TCP 74 http > 54916 [SYN, ACK] Seq=0 Ack=1 Win=14480 Len=0 MSS=1460 SACK_PERM=1 TSval=906692979 TSecr=21465345 WS=128
  7   0.029630 172.31.36.109 -> 54.230.30.229 TCP 66 54916 > http [ACK] Seq=1 Ack=1 Win=27008 Len=0 TSval=21465346 TSecr=906692979
  8   0.029673 172.31.36.109 -> 54.230.30.229 HTTP 162 GET /1kb HTTP/1.1 
  9   0.030890 54.230.30.229 -> 172.31.36.109 TCP 66 http > 54916 [ACK] Seq=1 Ack=97 Win=14592 Len=0 TSval=906692979 TSecr=21465346
 10   0.052733 54.230.30.229 -> 172.31.36.109 HTTP 1543 HTTP/1.1 200 OK  (application/octet-stream)
 11   0.052739 172.31.36.109 -> 54.230.30.229 TCP 66 54916 > http [ACK] Seq=97 Ack=1478 Win=29952 Len=0 TSval=21465351 TSecr=906692981
 12   0.052890 172.31.36.109 -> 54.230.30.229 TCP 66 54916 > http [FIN, ACK] Seq=97 Ack=1478 Win=29952 Len=0 TSval=21465351 TSecr=906692981
 13   0.054619 54.230.30.229 -> 172.31.36.109 TCP 66 http > 54916 [FIN, ACK] Seq=1478 Ack=98 Win=14592 Len=0 TSval=906692981 TSecr=21465351
 14   0.054628 172.31.36.109 -> 54.230.30.229 TCP 66 54916 > http [ACK] Seq=98 Ack=1479 Win=29952 Len=0 TSval=21465352 TSecr=906692981
