[Measurement for 1kb at 08:33:53 20.33.2014] 
Tshark:

  1   0.000000 172.31.36.109 -> 172.31.0.2   DNS 89 Standard query 0xd84b  A d3m1c4hwkgedal.cloudfront.net
  2   0.000040 172.31.36.109 -> 172.31.0.2   DNS 89 Standard query 0x8879  AAAA d3m1c4hwkgedal.cloudfront.net
  3   0.000431   172.31.0.2 -> 172.31.36.109 DNS 217 Standard query response 0xd84b  A 54.230.30.230 A 54.192.30.188 A 54.192.30.191 A 54.192.30.222 A 54.230.30.26 A 54.230.30.53 A 54.230.30.223 A 54.230.30.226
  4   0.012959   172.31.0.2 -> 172.31.36.109 DNS 174 Standard query response 0x8879 
  5   0.028138 172.31.36.109 -> 54.230.30.230 TCP 74 51358 > http [SYN] Seq=0 Win=26883 Len=0 MSS=8961 SACK_PERM=1 TSval=34030042 TSecr=0 WS=128
  6   0.031144 54.230.30.230 -> 172.31.36.109 TCP 74 http > 51358 [SYN, ACK] Seq=0 Ack=1 Win=14480 Len=0 MSS=1460 SACK_PERM=1 TSval=621583705 TSecr=34030042 WS=128
  7   0.031159 172.31.36.109 -> 54.230.30.230 TCP 66 51358 > http [ACK] Seq=1 Ack=1 Win=27008 Len=0 TSval=34030043 TSecr=621583705
  8   0.031207 172.31.36.109 -> 54.230.30.230 HTTP 162 GET /1kb HTTP/1.1 
  9   0.032405 54.230.30.230 -> 172.31.36.109 TCP 66 http > 51358 [ACK] Seq=1 Ack=97 Win=14592 Len=0 TSval=621583705 TSecr=34030043
 10   0.057362 54.230.30.230 -> 172.31.36.109 HTTP 1544 HTTP/1.1 200 OK  (application/octet-stream)
 11   0.057376 172.31.36.109 -> 54.230.30.230 TCP 66 51358 > http [ACK] Seq=97 Ack=1479 Win=29952 Len=0 TSval=34030049 TSecr=621583707
 12   0.057574 172.31.36.109 -> 54.230.30.230 TCP 66 51358 > http [FIN, ACK] Seq=97 Ack=1479 Win=29952 Len=0 TSval=34030049 TSecr=621583707
 13   0.059034 54.230.30.230 -> 172.31.36.109 TCP 66 http > 51358 [FIN, ACK] Seq=1479 Ack=98 Win=14592 Len=0 TSval=621583707 TSecr=34030049
 14   0.059043 172.31.36.109 -> 54.230.30.230 TCP 66 51358 > http [ACK] Seq=98 Ack=1480 Win=29952 Len=0 TSval=34030050 TSecr=621583707
