[Measurement for 10mb at 08:31:00 20.31.2014] 
Tshark:

  1   0.000000 172.31.36.109 -> 172.31.0.2   DNS 89 Standard query 0xacd0  A d3796nkzln59xv.cloudfront.net
  2   0.000021 172.31.36.109 -> 172.31.0.2   DNS 89 Standard query 0x7584  AAAA d3796nkzln59xv.cloudfront.net
  3   0.000466   172.31.0.2 -> 172.31.36.109 DNS 170 Standard query response 0x7584 
  4   0.000476   172.31.0.2 -> 172.31.36.109 DNS 217 Standard query response 0xacd0  A 54.230.20.109 A 54.230.21.51 A 54.230.21.115 A 54.230.22.51 A 54.230.23.102 A 216.137.41.101 A 216.137.41.254 A 54.230.20.3
  5   0.003762 172.31.36.109 -> 54.230.20.109 TCP 74 58498 > http [SYN] Seq=0 Win=26883 Len=0 MSS=8961 SACK_PERM=1 TSval=33986783 TSecr=0 WS=128
  6   0.093546 54.230.20.109 -> 172.31.36.109 TCP 74 http > 58498 [SYN, ACK] Seq=0 Ack=1 Win=14480 Len=0 MSS=1460 SACK_PERM=1 TSval=898180733 TSecr=33986783 WS=128
  7   0.093562 172.31.36.109 -> 54.230.20.109 TCP 66 58498 > http [ACK] Seq=1 Ack=1 Win=27008 Len=0 TSval=33986805 TSecr=898180733
  8   0.093624 172.31.36.109 -> 54.230.20.109 HTTP 163 GET /10mb HTTP/1.1 
  9   0.183424 54.230.20.109 -> 172.31.36.109 TCP 66 http > 58498 [ACK] Seq=1 Ack=98 Win=14592 Len=0 TSval=898180742 TSecr=33986805
 10   0.186015 54.230.20.109 -> 172.31.36.109 TCP 8754 [TCP segment of a reassembled PDU]
 11   0.186026 172.31.36.109 -> 54.230.20.109 TCP 66 58498 > http [ACK] Seq=98 Ack=8689 Win=44288 Len=0 TSval=33986828 TSecr=898180742
 12   0.186037 54.230.20.109 -> 172.31.36.109 TCP 5858 [TCP segment of a reassembled PDU]
 13   0.186042 172.31.36.109 -> 54.230.20.109 TCP 66 58498 > http [ACK] Seq=98 Ack=14481 Win=55936 Len=0 TSval=33986828 TSecr=898180742
 14   0.275640 54.230.20.109 -> 172.31.36.109 TCP 13098 [TCP segment of a reassembled PDU]
 15   0.275652 172.31.36.109 -> 54.230.20.109 TCP 66 58498 > http [ACK] Seq=98 Ack=27513 Win=81920 Len=0 TSval=33986850 TSecr=898180751
 16   0.365177 54.230.20.109 -> 172.31.36.109 TCP 13098 [TCP segment of a reassembled PDU]
 17   0.365189 172.31.36.109 -> 54.230.20.109 TCP 66 58498 > http [ACK] Seq=98 Ack=40545 Win=96512 Len=0 TSval=33986873 TSecr=898180760
 18   0.455023 54.230.20.109 -> 172.31.36.109 TCP 20338 [TCP segment of a reassembled PDU]
