[Measurement for 10mb at 20:30:58 19.30.2014] 
Tshark:

  1   0.000000 172.31.36.109 -> 172.31.0.2   DNS 89 Standard query 0x6a6f  A d3796nkzln59xv.cloudfront.net
  2   0.000033 172.31.36.109 -> 172.31.0.2   DNS 89 Standard query 0x43e5  AAAA d3796nkzln59xv.cloudfront.net
  3   0.000497   172.31.0.2 -> 172.31.36.109 DNS 217 Standard query response 0x6a6f  A 54.230.30.206 A 54.230.30.213 A 54.230.30.251 A 54.230.31.8 A 54.192.29.229 A 54.230.30.3 A 54.230.30.4 A 54.230.30.59
  4   0.000508   172.31.0.2 -> 172.31.36.109 DNS 170 Standard query response 0x43e5 
  5   0.003858 172.31.36.109 -> 54.230.30.206 TCP 74 33263 > http [SYN] Seq=0 Win=26883 Len=0 MSS=8961 SACK_PERM=1 TSval=23186145 TSecr=0 WS=128
  6   0.005085 54.230.30.206 -> 172.31.36.109 TCP 74 http > 33263 [SYN, ACK] Seq=0 Ack=1 Win=14480 Len=0 MSS=1460 SACK_PERM=1 TSval=686013394 TSecr=23186145 WS=128
  7   0.005098 172.31.36.109 -> 54.230.30.206 TCP 66 33263 > http [ACK] Seq=1 Ack=1 Win=27008 Len=0 TSval=23186145 TSecr=686013394
  8   0.005152 172.31.36.109 -> 54.230.30.206 HTTP 163 GET /10mb HTTP/1.1 
  9   0.006317 54.230.30.206 -> 172.31.36.109 TCP 66 http > 33263 [ACK] Seq=1 Ack=98 Win=14592 Len=0 TSval=686013394 TSecr=23186145
 10   0.024149 54.230.30.206 -> 172.31.36.109 TCP 6924 [TCP segment of a reassembled PDU]
 11   0.024178 172.31.36.109 -> 54.230.30.206 TCP 66 33263 > http [ACK] Seq=98 Ack=6859 Win=40704 Len=0 TSval=23186150 TSecr=686013396
 12   0.024190 54.230.30.206 -> 172.31.36.109 TCP 7306 [TCP segment of a reassembled PDU]
 13   0.024196 172.31.36.109 -> 54.230.30.206 TCP 66 33263 > http [ACK] Seq=98 Ack=14099 Win=55168 Len=0 TSval=23186150 TSecr=686013396
 14   0.025366 54.230.30.206 -> 172.31.36.109 TCP 2962 [TCP segment of a reassembled PDU]
 15   0.025390 172.31.36.109 -> 54.230.30.206 TCP 66 33263 > http [ACK] Seq=98 Ack=16995 Win=60928 Len=0 TSval=23186150 TSecr=686013396
 16   0.025534 54.230.30.206 -> 172.31.36.109 TCP 2962 [TCP segment of a reassembled PDU]
 17   0.025539 172.31.36.109 -> 54.230.30.206 TCP 66 33263 > http [ACK] Seq=98 Ack=19891 Win=66688 Len=0 TSval=23186150 TSecr=686013396
 18   0.025565 54.230.30.206 -> 172.31.36.109 TCP 5858 [TCP segment of a reassembled PDU]
 19   0.025571 172.31.36.109 -> 54.230.30.206 TCP 66 33263 > http [ACK] Seq=98 Ack=25683 Win=78336 Len=0 TSval=23186150 TSecr=686013396
 20   0.025584 54.230.30.206 -> 172.31.36.109 TCP 1514 [TCP segment of a reassembled PDU]
 21   0.025587 172.31.36.109 -> 54.230.30.206 TCP 66 33263 > http [ACK] Seq=98 Ack=27131 Win=81152 Len=0 TSval=23186150 TSecr=686013396
 22   0.026640 54.230.30.206 -> 172.31.36.109 TCP 4410 [TCP segment of a reassembled PDU]
 23   0.026667 172.31.36.109 -> 54.230.30.206 TCP 66 33263 > http [ACK] Seq=98 Ack=31475 Win=89856 Len=0 TSval=23186151 TSecr=686013396
 24   0.026687 54.230.30.206 -> 172.31.36.109 TCP 13098 [TCP segment of a reassembled PDU]
 25   0.026694 172.31.36.109 -> 54.230.30.206 TCP 66 33263 > http [ACK] Seq=98 Ack=44507 Win=89344 Len=0 TSval=23186151 TSecr=686013396
 26   0.026810 54.230.30.206 -> 172.31.36.109 TCP 2962 [TCP segment of a reassembled PDU]
 27   0.026834 172.31.36.109 -> 54.230.30.206 TCP 66 33263 > http [ACK] Seq=98 Ack=47403 Win=95744 Len=0 TSval=23186151 TSecr=686013396
 28   0.027921 54.230.30.206 -> 172.31.36.109 TCP 5858 [TCP segment of a reassembled PDU]
 29   0.027952 172.31.36.109 -> 54.230.30.206 TCP 66 33263 > http [ACK] Seq=98 Ack=53195 Win=107264 Len=0 TSval=23186151 TSecr=686013396
 30   0.027961 54.230.30.206 -> 172.31.36.109 TCP 4410 [TCP segment of a reassembled PDU]
 31   0.027965 172.31.36.109 -> 54.230.30.206 TCP 66 33263 > http [ACK] Seq=98 Ack=57539 Win=103040 Len=0 TSval=23186151 TSecr=686013396
 32   0.028059 54.230.30.206 -> 172.31.36.109 TCP 4410 [TCP segment of a reassembled PDU]
 33   0.028087 172.31.36.109 -> 54.230.30.206 TCP 66 33263 > http [ACK] Seq=98 Ack=61883 Win=109056 Len=0 TSval=23186151 TSecr=686013396
 34   0.028127 54.230.30.206 -> 172.31.36.109 TCP 4410 [TCP segment of a reassembled PDU]
 35   0.028133 172.31.36.109 -> 54.230.30.206 TCP 66 33263 > http [ACK] Seq=98 Ack=66227 Win=109056 Len=0 TSval=23186151 TSecr=686013396
 36   0.029185 54.230.30.206 -> 172.31.36.109 TCP 1514 [TCP segment of a reassembled PDU]
 37   0.029195 172.31.36.109 -> 54.230.30.206 TCP 66 33263 > http [ACK] Seq=98 Ack=67675 Win=109056 Len=0 TSval=23186151 TSecr=686013396
 38   0.029226 54.230.30.206 -> 172.31.36.109 TCP 1514 [TCP segment of a reassembled PDU]
 39   0.029228 172.31.36.109 -> 54.230.30.206 TCP 66 33263 > http [ACK] Seq=98 Ack=69123 Win=109056 Len=0 TSval=23186151 TSecr=686013396
 40   0.029410 54.230.30.206 -> 172.31.36.109 TCP 2962 [TCP segment of a reassembled PDU]
 41   0.029422 172.31.36.109 -> 54.230.30.206 TCP 66 33263 > http [ACK] Seq=98 Ack=72019 Win=109056 Len=0 TSval=23186151 TSecr=686013396
 42   0.029534 54.230.30.206 -> 172.31.36.109 TCP 7306 [TCP segment of a reassembled PDU]
 43   0.029590 54.230.30.206 -> 172.31.36.109 TCP 14546 [TCP segment of a reassembled PDU]
 44   0.029611 172.31.36.109 -> 54.230.30.206 TCP 66 33263 > http [ACK] Seq=98 Ack=93739 Win=94080 Len=0 TSval=23186151 TSecr=686013396
 45   0.030728 54.230.30.206 -> 172.31.36.109 TCP 4410 [TCP segment of a reassembled PDU]
 46   0.030742 172.31.36.109 -> 54.230.30.206 TCP 66 33263 > http [ACK] Seq=98 Ack=98083 Win=109056 Len=0 TSval=23186152 TSecr=686013396
 47   0.030804 54.230.30.206 -> 172.31.36.109 TCP 17442 [TCP segment of a reassembled PDU]
 48   0.030814 172.31.36.109 -> 54.230.30.206 TCP 66 33263 > http [ACK] Seq=98 Ack=115459 Win=143872 Len=0 TSval=23186152 TSecr=686013396
 49   0.030863 54.230.30.206 -> 172.31.36.109 TCP 2962 [TCP segment of a reassembled PDU]
 50   0.030867 172.31.36.109 -> 54.230.30.206 TCP 66 33263 > http [ACK] Seq=98 Ack=118355 Win=149632 Len=0 TSval=23186152 TSecr=686013396
 51   0.030999 54.230.30.206 -> 172.31.36.109 TCP 12540 [TCP segment of a reassembled PDU]
 52   0.031026 172.31.36.109 -> 54.230.30.206 TCP 66 33263 > http [ACK] Seq=98 Ack=130829 Win=174592 Len=0 TSval=23186152 TSecr=686013396
 53   0.031974 54.230.30.206 -> 172.31.36.109 TCP 4410 [TCP segment of a reassembled PDU]
 54   0.032006 172.31.36.109 -> 54.230.30.206 TCP 66 33263 > http [ACK] Seq=98 Ack=135173 Win=183296 Len=0 TSval=23186152 TSecr=686013396
 55   0.032147 54.230.30.206 -> 172.31.36.109 TCP 20338 [TCP segment of a reassembled PDU]
 56   0.032158 172.31.36.109 -> 54.230.30.206 TCP 66 33263 > http [ACK] Seq=98 Ack=155445 Win=223744 Len=0 TSval=23186152 TSecr=686013396
 57   0.032167 54.230.30.206 -> 172.31.36.109 TCP 1514 [TCP segment of a reassembled PDU]
 58   0.032170 172.31.36.109 -> 54.230.30.206 TCP 66 33263 > http [ACK] Seq=98 Ack=156893 Win=226688 Len=0 TSval=23186152 TSecr=686013396
 59   0.032337 54.230.30.206 -> 172.31.36.109 TCP 7306 [TCP segment of a reassembled PDU]
 60   0.032344 172.31.36.109 -> 54.230.30.206 TCP 66 33263 > http [ACK] Seq=98 Ack=164133 Win=241152 Len=0 TSval=23186152 TSecr=686013396
 61   0.032781 54.230.30.206 -> 172.31.36.109 TCP 4410 [TCP segment of a reassembled PDU]
 62   0.032814 172.31.36.109 -> 54.230.30.206 TCP 66 33263 > http [ACK] Seq=98 Ack=168477 Win=249856 Len=0 TSval=23186152 TSecr=686013397
 63   0.032924 54.230.30.206 -> 172.31.36.109 TCP 7306 [TCP segment of a reassembled PDU]
 64   0.032949 172.31.36.109 -> 54.230.30.206 TCP 66 33263 > http [ACK] Seq=98 Ack=175717 Win=264320 Len=0 TSval=23186152 TSecr=686013397
 65   0.033253 54.230.30.206 -> 172.31.36.109 TCP 1514 [TCP segment of a reassembled PDU]
 66   0.033257 172.31.36.109 -> 54.230.30.206 TCP 66 33263 > http [ACK] Seq=98 Ack=177165 Win=267264 Len=0 TSval=23186152 TSecr=686013397
 67   0.033614 54.230.30.206 -> 172.31.36.109 TCP 17442 [TCP segment of a reassembled PDU]
 68   0.033624 172.31.36.109 -> 54.230.30.206 TCP 66 33263 > http [ACK] Seq=98 Ack=194541 Win=301952 Len=0 TSval=23186152 TSecr=686013397
 69   0.033648 54.230.30.206 -> 172.31.36.109 TCP 8754 [TCP segment of a reassembled PDU]
 70   0.033654 172.31.36.109 -> 54.230.30.206 TCP 66 33263 > http [ACK] Seq=98 Ack=203229 Win=319360 Len=0 TSval=23186152 TSecr=686013397
 71   0.034049 54.230.30.206 -> 172.31.36.109 TCP 5858 [TCP segment of a reassembled PDU]
 72   0.034081 172.31.36.109 -> 54.230.30.206 TCP 66 33263 > http [ACK] Seq=98 Ack=209021 Win=330880 Len=0 TSval=23186152 TSecr=686013397
 73   0.034348 54.230.30.206 -> 172.31.36.109 TCP 11650 [TCP segment of a reassembled PDU]
 74   0.034374 172.31.36.109 -> 54.230.30.206 TCP 66 33263 > http [ACK] Seq=98 Ack=220605 Win=354048 Len=0 TSval=23186152 TSecr=686013397
 75   0.035046 54.230.30.206 -> 172.31.36.109 TCP 4410 [TCP segment of a reassembled PDU]
 76   0.035078 172.31.36.109 -> 54.230.30.206 TCP 66 33263 > http [ACK] Seq=98 Ack=224949 Win=362752 Len=0 TSval=23186153 TSecr=686013397
 77   0.035331 54.230.30.206 -> 172.31.36.109 TCP 36266 [TCP segment of a reassembled PDU]
 78   0.035351 172.31.36.109 -> 54.230.30.206 TCP 66 33263 > http [ACK] Seq=98 Ack=261149 Win=435200 Len=0 TSval=23186153 TSecr=686013397
 79   0.035616 54.230.30.206 -> 172.31.36.109 TCP 2962 [TCP segment of a reassembled PDU]
 80   0.035630 172.31.36.109 -> 54.230.30.206 TCP 66 33263 > http [ACK] Seq=98 Ack=264045 Win=440960 Len=0 TSval=23186153 TSecr=686013397
 81   0.035892 54.230.30.206 -> 172.31.36.109 TCP 13098 [TCP segment of a reassembled PDU]
 82   0.035917 172.31.36.109 -> 54.230.30.206 TCP 66 33263 > http [ACK] Seq=98 Ack=277077 Win=467072 Len=0 TSval=23186153 TSecr=686013397
 83   0.035924 54.230.30.206 -> 172.31.36.109 TCP 4410 [TCP segment of a reassembled PDU]
 84   0.035927 172.31.36.109 -> 54.230.30.206 TCP 66 33263 > http [ACK] Seq=98 Ack=281421 Win=475776 Len=0 TSval=23186153 TSecr=686013397
 85   0.036576 54.230.30.206 -> 172.31.36.109 TCP 7306 [TCP segment of a reassembled PDU]
 86   0.036583 172.31.36.109 -> 54.230.30.206 TCP 66 33263 > http [ACK] Seq=98 Ack=288661 Win=490240 Len=0 TSval=23186153 TSecr=686013397
 87   0.036658 54.230.30.206 -> 172.31.36.109 TCP 8754 [TCP segment of a reassembled PDU]
 88   0.036665 172.31.36.109 -> 54.230.30.206 TCP 66 33263 > http [ACK] Seq=98 Ack=297349 Win=507648 Len=0 TSval=23186153 TSecr=686013397
 89   0.036779 54.230.30.206 -> 172.31.36.109 TCP 18890 [TCP segment of a reassembled PDU]
 90   0.036803 172.31.36.109 -> 54.230.30.206 TCP 66 33263 > http [ACK] Seq=98 Ack=316173 Win=545280 Len=0 TSval=23186153 TSecr=686013397
 91   0.036907 54.230.30.206 -> 172.31.36.109 TCP 10202 [TCP segment of a reassembled PDU]
 92   0.036915 172.31.36.109 -> 54.230.30.206 TCP 66 33263 > http [ACK] Seq=98 Ack=326309 Win=565504 Len=0 TSval=23186153 TSecr=686013397
 93   0.036950 54.230.30.206 -> 172.31.36.109 TCP 2962 [TCP segment of a reassembled PDU]
 94   0.036955 172.31.36.109 -> 54.230.30.206 TCP 66 33263 > http [ACK] Seq=98 Ack=329205 Win=571264 Len=0 TSval=23186153 TSecr=686013397
 95   0.037623 54.230.30.206 -> 172.31.36.109 TCP 1514 [TCP segment of a reassembled PDU]
 96   0.037633 172.31.36.109 -> 54.230.30.206 TCP 66 33263 > http [ACK] Seq=98 Ack=330653 Win=574208 Len=0 TSval=23186153 TSecr=686013397
 97   0.038031 54.230.30.206 -> 172.31.36.109 TCP 27578 [TCP segment of a reassembled PDU]
 98   0.038046 172.31.36.109 -> 54.230.30.206 TCP 66 33263 > http [ACK] Seq=98 Ack=358165 Win=629248 Len=0 TSval=23186153 TSecr=686013397
 99   0.038118 54.230.30.206 -> 172.31.36.109 TCP 8754 [TCP segment of a reassembled PDU]
100   0.038124 172.31.36.109 -> 54.230.30.206 TCP 66 33263 > http [ACK] Seq=98 Ack=366853 Win=646656 Len=0 TSval=23186153 TSecr=686013397
101   0.038158 54.230.30.206 -> 172.31.36.109 TCP 1514 [TCP segment of a reassembled PDU]
102   0.038162 172.31.36.109 -> 54.230.30.206 TCP 66 33263 > http [ACK] Seq=98 Ack=368301 Win=649472 Len=0 TSval=23186153 TSecr=686013397
103   0.038410 54.230.30.206 -> 172.31.36.109 TCP 7306 [TCP segment of a reassembled PDU]
104   0.038417 172.31.36.109 -> 54.230.30.206 TCP 66 33263 > http [ACK] Seq=98 Ack=375541 Win=663936 Len=0 TSval=23186153 TSecr=686013397
105   0.038429 54.230.30.206 -> 172.31.36.109 TCP 13098 [TCP segment of a reassembled PDU]
106   0.038438 172.31.36.109 -> 54.230.30.206 TCP 66 33263 > http [ACK] Seq=98 Ack=388573 Win=690048 Len=0 TSval=23186153 TSecr=686013397
107   0.039166 54.230.30.206 -> 172.31.36.109 TCP 4466 [TCP segment of a reassembled PDU]
108   0.039172 172.31.36.109 -> 54.230.30.206 TCP 66 33263 > http [ACK] Seq=98 Ack=392973 Win=698880 Len=0 TSval=23186154 TSecr=686013397
109   0.039449 54.230.30.206 -> 172.31.36.109 TCP 1514 [TCP segment of a reassembled PDU]
110   0.039461 172.31.36.109 -> 54.230.30.206 TCP 66 33263 > http [ACK] Seq=98 Ack=394421 Win=701696 Len=0 TSval=23186154 TSecr=686013397
111   0.040937 54.230.30.206 -> 172.31.36.109 TCP 5858 [TCP segment of a reassembled PDU]
112   0.040951 172.31.36.109 -> 54.230.30.206 TCP 66 33263 > http [ACK] Seq=98 Ack=400213 Win=713344 Len=0 TSval=23186154 TSecr=686013397
113   0.041020 54.230.30.206 -> 172.31.36.109 TCP 24682 [TCP segment of a reassembled PDU]
114   0.041036 172.31.36.109 -> 54.230.30.206 TCP 66 33263 > http [ACK] Seq=98 Ack=424829 Win=752512 Len=0 TSval=23186154 TSecr=686013397
115   0.041068 54.230.30.206 -> 172.31.36.109 TCP 7306 [TCP segment of a reassembled PDU]
116   0.041076 172.31.36.109 -> 54.230.30.206 TCP 66 33263 > http [ACK] Seq=98 Ack=432069 Win=777088 Len=0 TSval=23186154 TSecr=686013397
117   0.041131 54.230.30.206 -> 172.31.36.109 TCP 1514 [TCP segment of a reassembled PDU]
118   0.041138 172.31.36.109 -> 54.230.30.206 TCP 66 33263 > http [ACK] Seq=98 Ack=433517 Win=779904 Len=0 TSval=23186154 TSecr=686013397
119   0.041268 54.230.30.206 -> 172.31.36.109 TCP 24682 [TCP segment of a reassembled PDU]
120   0.041291 172.31.36.109 -> 54.230.30.206 TCP 66 33263 > http [ACK] Seq=98 Ack=458133 Win=755328 Len=0 TSval=23186154 TSecr=686013397
121   0.041461 54.230.30.206 -> 172.31.36.109 TCP 442 [TCP segment of a reassembled PDU]
122   0.041510 172.31.36.109 -> 54.230.30.206 TCP 66 33263 > http [ACK] Seq=98 Ack=458509 Win=779904 Len=0 TSval=23186154 TSecr=686013397
123   0.054979 54.230.30.206 -> 172.31.36.109 TCP 1514 [TCP segment of a reassembled PDU]
124   0.054984 172.31.36.109 -> 54.230.30.206 TCP 66 33263 > http [ACK] Seq=98 Ack=459957 Win=782848 Len=0 TSval=23186158 TSecr=686013399
125   0.055122 54.230.30.206 -> 172.31.36.109 TCP 5858 [TCP segment of a reassembled PDU]
126   0.055148 172.31.36.109 -> 54.230.30.206 TCP 66 33263 > http [ACK] Seq=98 Ack=465749 Win=783360 Len=0 TSval=23186158 TSecr=686013399
127   0.055157 54.230.30.206 -> 172.31.36.109 TCP 11650 [TCP segment of a reassembled PDU]
128   0.055180 172.31.36.109 -> 54.230.30.206 TCP 66 33263 > http [ACK] Seq=98 Ack=477333 Win=773888 Len=0 TSval=23186158 TSecr=686013399
129   0.055254 54.230.30.206 -> 172.31.36.109 TCP 5858 [TCP segment of a reassembled PDU]
130   0.055275 172.31.36.109 -> 54.230.30.206 TCP 66 33263 > http [ACK] Seq=98 Ack=483125 Win=783360 Len=0 TSval=23186158 TSecr=686013399
131   0.055407 54.230.30.206 -> 172.31.36.109 TCP 17442 [TCP segment of a reassembled PDU]
132   0.055427 172.31.36.109 -> 54.230.30.206 TCP 66 33263 > http [ACK] Seq=98 Ack=500501 Win=766080 Len=0 TSval=23186158 TSecr=686013399
133   0.055583 54.230.30.206 -> 172.31.36.109 TCP 1514 [TCP segment of a reassembled PDU]
134   0.060658 54.230.30.206 -> 172.31.36.109 TCP 5858 [TCP segment of a reassembled PDU]
135   0.060683 172.31.36.109 -> 54.230.30.206 TCP 66 33263 > http [ACK] Seq=98 Ack=507741 Win=783360 Len=0 TSval=23186159 TSecr=686013399
136   0.060726 54.230.30.206 -> 172.31.36.109 TCP 18890 [TCP segment of a reassembled PDU]
137   0.060763 172.31.36.109 -> 54.230.30.206 TCP 66 33263 > http [ACK] Seq=98 Ack=526565 Win=764544 Len=0 TSval=23186159 TSecr=686013399
138   0.060768 54.230.30.206 -> 172.31.36.109 TCP 1514 [TCP segment of a reassembled PDU]
139   0.060852 54.230.30.206 -> 172.31.36.109 TCP 4410 [TCP segment of a reassembled PDU]
140   0.060858 172.31.36.109 -> 54.230.30.206 TCP 66 33263 > http [ACK] Seq=98 Ack=532357 Win=785792 Len=0 TSval=23186159 TSecr=686013399
141   0.061012 54.230.30.206 -> 172.31.36.109 TCP 24682 [TCP segment of a reassembled PDU]
142   0.061037 172.31.36.109 -> 54.230.30.206 TCP 66 33263 > http [ACK] Seq=98 Ack=556973 Win=761216 Len=0 TSval=23186159 TSecr=686013399
143   0.061292 54.230.30.206 -> 172.31.36.109 TCP 10578 [TCP segment of a reassembled PDU]
144   0.061314 172.31.36.109 -> 54.230.30.206 TCP 66 33263 > http [ACK] Seq=98 Ack=567485 Win=773888 Len=0 TSval=23186159 TSecr=686013399
145   0.061330 54.230.30.206 -> 172.31.36.109 TCP 13098 [TCP segment of a reassembled PDU]
146   0.061348 172.31.36.109 -> 54.230.30.206 TCP 66 33263 > http [ACK] Seq=98 Ack=580517 Win=771584 Len=0 TSval=23186159 TSecr=686013399
147   0.061881 54.230.30.206 -> 172.31.36.109 TCP 2962 [TCP segment of a reassembled PDU]
148   0.061894 172.31.36.109 -> 54.230.30.206 TCP 66 33263 > http [ACK] Seq=98 Ack=583413 Win=788096 Len=0 TSval=23186159 TSecr=686013399
149   0.062045 54.230.30.206 -> 172.31.36.109 TCP 26130 [TCP segment of a reassembled PDU]
150   0.062288 172.31.36.109 -> 54.230.30.206 TCP 66 33263 > http [ACK] Seq=98 Ack=609477 Win=762112 Len=0 TSval=23186159 TSecr=686013399
151   0.062696 54.230.30.206 -> 172.31.36.109 TCP 33370 [TCP segment of a reassembled PDU]
152   0.062725 172.31.36.109 -> 54.230.30.206 TCP 66 33263 > http [ACK] Seq=98 Ack=642781 Win=738176 Len=0 TSval=23186160 TSecr=686013399
153   0.062796 54.230.30.206 -> 172.31.36.109 TCP 2962 [TCP segment of a reassembled PDU]
154   0.062802 172.31.36.109 -> 54.230.30.206 TCP 66 33263 > http [ACK] Seq=98 Ack=645677 Win=788096 Len=0 TSval=23186160 TSecr=686013400
155   0.063479 54.230.30.206 -> 172.31.36.109 TCP 4410 [TCP segment of a reassembled PDU]
156   0.063517 172.31.36.109 -> 54.230.30.206 TCP 66 33263 > http [ACK] Seq=98 Ack=650021 Win=792960 Len=0 TSval=23186160 TSecr=686013400
157   0.063729 54.230.30.206 -> 172.31.36.109 TCP 5162 [TCP segment of a reassembled PDU]
158   0.063768 172.31.36.109 -> 54.230.30.206 TCP 66 33263 > http [ACK] Seq=98 Ack=655117 Win=792960 Len=0 TSval=23186160 TSecr=686013400
159   0.070848 54.230.30.206 -> 172.31.36.109 TCP 1514 [TCP segment of a reassembled PDU]
160   0.071368 54.230.30.206 -> 172.31.36.109 TCP 2962 [TCP segment of a reassembled PDU]
161   0.071405 172.31.36.109 -> 54.230.30.206 TCP 66 33263 > http [ACK] Seq=98 Ack=659461 Win=792960 Len=0 TSval=23186162 TSecr=686013400
162   0.071576 54.230.30.206 -> 172.31.36.109 TCP 13098 [TCP segment of a reassembled PDU]
163   0.071609 54.230.30.206 -> 172.31.36.109 TCP 26130 [TCP segment of a reassembled PDU]
164   0.071635 172.31.36.109 -> 54.230.30.206 TCP 66 33263 > http [ACK] Seq=98 Ack=698557 Win=753920 Len=0 TSval=23186162 TSecr=686013400
165   0.071900 54.230.30.206 -> 172.31.36.109 TCP 7306 [TCP segment of a reassembled PDU]
166   0.071907 172.31.36.109 -> 54.230.30.206 TCP 66 33263 > http [ACK] Seq=98 Ack=705797 Win=781056 Len=0 TSval=23186162 TSecr=686013400
167   0.072040 54.230.30.206 -> 172.31.36.109 TCP 2962 [TCP segment of a reassembled PDU]
168   0.072046 172.31.36.109 -> 54.230.30.206 TCP 66 33263 > http [ACK] Seq=98 Ack=708693 Win=788096 Len=0 TSval=23186162 TSecr=686013400
169   0.072055 54.230.30.206 -> 172.31.36.109 TCP 12026 [TCP segment of a reassembled PDU]
170   0.072275 172.31.36.109 -> 54.230.30.206 TCP 66 33263 > http [ACK] Seq=98 Ack=720653 Win=792960 Len=0 TSval=23186162 TSecr=686013400
171   0.093248 54.230.30.206 -> 172.31.36.109 TCP 13098 [TCP segment of a reassembled PDU]
172   0.093272 172.31.36.109 -> 54.230.30.206 TCP 66 33263 > http [ACK] Seq=98 Ack=733685 Win=792960 Len=0 TSval=23186167 TSecr=686013403
173   0.093331 54.230.30.206 -> 172.31.36.109 TCP 11650 [TCP segment of a reassembled PDU]
174   0.093347 54.230.30.206 -> 172.31.36.109 TCP 10202 [TCP segment of a reassembled PDU]
175   0.093364 172.31.36.109 -> 54.230.30.206 TCP 66 33263 > http [ACK] Seq=98 Ack=755405 Win=776320 Len=0 TSval=23186167 TSecr=686013403
176   0.093414 54.230.30.206 -> 172.31.36.109 TCP 4410 [TCP segment of a reassembled PDU]
177   0.093420 172.31.36.109 -> 54.230.30.206 TCP 66 33263 > http [ACK] Seq=98 Ack=759749 Win=785792 Len=0 TSval=23186167 TSecr=686013403
178   0.093428 54.230.30.206 -> 172.31.36.109 TCP 5858 [TCP segment of a reassembled PDU]
179   0.093446 172.31.36.109 -> 54.230.30.206 TCP 66 33263 > http [ACK] Seq=98 Ack=765541 Win=792960 Len=0 TSval=23186167 TSecr=686013403
180   0.093533 54.230.30.206 -> 172.31.36.109 TCP 11650 [TCP segment of a reassembled PDU]
181   0.093557 172.31.36.109 -> 54.230.30.206 TCP 66 33263 > http [ACK] Seq=98 Ack=777125 Win=792960 Len=0 TSval=23186167 TSecr=686013403
182   0.093657 54.230.30.206 -> 172.31.36.109 TCP 4410 [TCP segment of a reassembled PDU]
183   0.093672 172.31.36.109 -> 54.230.30.206 TCP 66 33263 > http [ACK] Seq=98 Ack=781469 Win=792960 Len=0 TSval=23186167 TSecr=686013403
184   0.093766 54.230.30.206 -> 172.31.36.109 TCP 1514 [TCP segment of a reassembled PDU]
185   0.093771 54.230.30.206 -> 172.31.36.109 TCP 3338 [TCP segment of a reassembled PDU]
186   0.093786 172.31.36.109 -> 54.230.30.206 TCP 66 33263 > http [ACK] Seq=98 Ack=786189 Win=792960 Len=0 TSval=23186167 TSecr=686013403
187   0.105664 54.230.30.206 -> 172.31.36.109 TCP 4410 [TCP segment of a reassembled PDU]
188   0.105679 172.31.36.109 -> 54.230.30.206 TCP 66 33263 > http [ACK] Seq=98 Ack=790533 Win=792960 Len=0 TSval=23186170 TSecr=686013404
189   0.105796 54.230.30.206 -> 172.31.36.109 TCP 2962 [TCP segment of a reassembled PDU]
190   0.105803 54.230.30.206 -> 172.31.36.109 TCP 5858 [TCP segment of a reassembled PDU]
191   0.105819 172.31.36.109 -> 54.230.30.206 TCP 66 33263 > http [ACK] Seq=98 Ack=799221 Win=792960 Len=0 TSval=23186170 TSecr=686013404
192   0.106182 54.230.30.206 -> 172.31.36.109 TCP 2962 [TCP segment of a reassembled PDU]
193   0.106197 172.31.36.109 -> 54.230.30.206 TCP 66 33263 > http [ACK] Seq=98 Ack=802117 Win=792960 Len=0 TSval=23186170 TSecr=686013404
194   0.106371 54.230.30.206 -> 172.31.36.109 TCP 26130 [TCP segment of a reassembled PDU]
195   0.106390 54.230.30.206 -> 172.31.36.109 TCP 11650 [TCP segment of a reassembled PDU]
196   0.106414 54.230.30.206 -> 172.31.36.109 TCP 1514 [TCP segment of a reassembled PDU]
197   0.106572 54.230.30.206 -> 172.31.36.109 TCP 1514 [TCP segment of a reassembled PDU]
198   0.106587 54.230.30.206 -> 172.31.36.109 TCP 17442 [TCP segment of a reassembled PDU]
199   0.106649 172.31.36.109 -> 54.230.30.206 TCP 66 33263 > http [ACK] Seq=98 Ack=860037 Win=735104 Len=0 TSval=23186171 TSecr=686013404
200   0.106684 54.230.30.206 -> 172.31.36.109 TCP 4410 [TCP segment of a reassembled PDU]
201   0.106688 172.31.36.109 -> 54.230.30.206 TCP 66 33263 > http [ACK] Seq=98 Ack=864381 Win=785792 Len=0 TSval=23186171 TSecr=686013404
202   0.106834 54.230.30.206 -> 172.31.36.109 TCP 2962 [TCP segment of a reassembled PDU]
203   0.106839 172.31.36.109 -> 54.230.30.206 TCP 66 33263 > http [ACK] Seq=98 Ack=867277 Win=788096 Len=0 TSval=23186171 TSecr=686013404
204   0.107522 54.230.30.206 -> 172.31.36.109 TCP 5858 [TCP segment of a reassembled PDU]
205   0.107561 172.31.36.109 -> 54.230.30.206 TCP 66 33263 > http [ACK] Seq=98 Ack=873069 Win=792960 Len=0 TSval=23186171 TSecr=686013404
206   0.107761 54.230.30.206 -> 172.31.36.109 TCP 29026 [TCP segment of a reassembled PDU]
207   0.107787 172.31.36.109 -> 54.230.30.206 TCP 66 33263 > http [ACK] Seq=98 Ack=902029 Win=764032 Len=0 TSval=23186171 TSecr=686013404
208   0.108076 54.230.30.206 -> 172.31.36.109 TCP 14546 [TCP segment of a reassembled PDU]
209   0.108085 172.31.36.109 -> 54.230.30.206 TCP 66 33263 > http [ACK] Seq=98 Ack=916509 Win=769024 Len=0 TSval=23186171 TSecr=686013404
210   0.108161 54.230.30.206 -> 172.31.36.109 TCP 1514 [TCP segment of a reassembled PDU]
211   0.108387 54.230.30.206 -> 172.31.36.109 TCP 26130 [TCP segment of a reassembled PDU]
212   0.108422 172.31.36.109 -> 54.230.30.206 TCP 66 33263 > http [ACK] Seq=98 Ack=944021 Win=750080 Len=0 TSval=23186171 TSecr=686013404
213   0.108565 54.230.30.206 -> 172.31.36.109 TCP 10202 [TCP segment of a reassembled PDU]
214   0.108599 172.31.36.109 -> 54.230.30.206 TCP 66 33263 > http [ACK] Seq=98 Ack=954157 Win=776320 Len=0 TSval=23186171 TSecr=686013404
215   0.108693 54.230.30.206 -> 172.31.36.109 TCP 4410 [TCP segment of a reassembled PDU]
216   0.108706 172.31.36.109 -> 54.230.30.206 TCP 66 33263 > http [ACK] Seq=98 Ack=958501 Win=785792 Len=0 TSval=23186171 TSecr=686013404
217   0.108734 54.230.30.206 -> 172.31.36.109 TCP 2962 [TCP segment of a reassembled PDU]
218   0.108749 172.31.36.109 -> 54.230.30.206 TCP 66 33263 > http [ACK] Seq=98 Ack=961397 Win=792960 Len=0 TSval=23186171 TSecr=686013404
219   0.108849 54.230.30.206 -> 172.31.36.109 TCP 10202 [TCP segment of a reassembled PDU]
220   0.108949 172.31.36.109 -> 54.230.30.206 TCP 66 33263 > http [ACK] Seq=98 Ack=971533 Win=792960 Len=0 TSval=23186171 TSecr=686013404
221   0.109317 54.230.30.206 -> 172.31.36.109 TCP 7306 [TCP segment of a reassembled PDU]
222   0.109357 172.31.36.109 -> 54.230.30.206 TCP 66 33263 > http [ACK] Seq=98 Ack=978773 Win=792960 Len=0 TSval=23186171 TSecr=686013404
223   0.109436 54.230.30.206 -> 172.31.36.109 TCP 14546 [TCP segment of a reassembled PDU]
224   0.109456 172.31.36.109 -> 54.230.30.206 TCP 66 33263 > http [ACK] Seq=98 Ack=993253 Win=792960 Len=0 TSval=23186171 TSecr=686013404
225   0.109513 54.230.30.206 -> 172.31.36.109 TCP 4410 [TCP segment of a reassembled PDU]
226   0.109528 172.31.36.109 -> 54.230.30.206 TCP 66 33263 > http [ACK] Seq=98 Ack=997597 Win=792960 Len=0 TSval=23186171 TSecr=686013404
227   0.109638 54.230.30.206 -> 172.31.36.109 TCP 14546 [TCP segment of a reassembled PDU]
228   0.109658 172.31.36.109 -> 54.230.30.206 TCP 66 33263 > http [ACK] Seq=98 Ack=1012077 Win=792960 Len=0 TSval=23186171 TSecr=686013404
229   0.109907 54.230.30.206 -> 172.31.36.109 TCP 21786 [TCP segment of a reassembled PDU]
230   0.109928 54.230.30.206 -> 172.31.36.109 TCP 2962 [TCP segment of a reassembled PDU]
231   0.109937 172.31.36.109 -> 54.230.30.206 TCP 66 33263 > http [ACK] Seq=98 Ack=1036693 Win=768384 Len=0 TSval=23186171 TSecr=686013404
232   0.110020 54.230.30.206 -> 172.31.36.109 TCP 1514 [TCP segment of a reassembled PDU]
233   0.110162 54.230.30.206 -> 172.31.36.109 TCP 5858 [TCP segment of a reassembled PDU]
234   0.110168 172.31.36.109 -> 54.230.30.206 TCP 66 33263 > http [ACK] Seq=98 Ack=1043933 Win=783360 Len=0 TSval=23186171 TSecr=686013404
235   0.110261 54.230.30.206 -> 172.31.36.109 TCP 2962 [TCP segment of a reassembled PDU]
236   0.110266 172.31.36.109 -> 54.230.30.206 TCP 66 33263 > http [ACK] Seq=98 Ack=1046829 Win=788096 Len=0 TSval=23186171 TSecr=686013404
237   0.110366 54.230.30.206 -> 172.31.36.109 TCP 1570 [TCP segment of a reassembled PDU]
238   0.110370 172.31.36.109 -> 54.230.30.206 TCP 66 33263 > http [ACK] Seq=98 Ack=1048333 Win=788096 Len=0 TSval=23186171 TSecr=686013404
239   0.127433 54.230.30.206 -> 172.31.36.109 TCP 4410 [TCP segment of a reassembled PDU]
240   0.127449 172.31.36.109 -> 54.230.30.206 TCP 66 33263 > http [ACK] Seq=98 Ack=1052677 Win=792960 Len=0 TSval=23186176 TSecr=686013406
241   0.127595 54.230.30.206 -> 172.31.36.109 TCP 21786 [TCP segment of a reassembled PDU]
242   0.127618 172.31.36.109 -> 54.230.30.206 TCP 66 33263 > http [ACK] Seq=98 Ack=1074397 Win=771328 Len=0 TSval=23186176 TSecr=686013406
243   0.127738 54.230.30.206 -> 172.31.36.109 TCP 7306 [TCP segment of a reassembled PDU]
244   0.127761 172.31.36.109 -> 54.230.30.206 TCP 66 33263 > http [ACK] Seq=98 Ack=1081637 Win=781056 Len=0 TSval=23186176 TSecr=686013406
245   0.127855 54.230.30.206 -> 172.31.36.109 TCP 4410 [TCP segment of a reassembled PDU]
246   0.127864 54.230.30.206 -> 172.31.36.109 TCP 13098 [TCP segment of a reassembled PDU]
247   0.127872 54.230.30.206 -> 172.31.36.109 TCP 2962 [TCP segment of a reassembled PDU]
248   0.127972 172.31.36.109 -> 54.230.30.206 TCP 66 33263 > http [ACK] Seq=98 Ack=1101909 Win=766720 Len=0 TSval=23186176 TSecr=686013406
249   0.128065 54.230.30.206 -> 172.31.36.109 TCP 12026 [TCP segment of a reassembled PDU]
250   0.128096 172.31.36.109 -> 54.230.30.206 TCP 66 33263 > http [ACK] Seq=98 Ack=1113869 Win=771584 Len=0 TSval=23186176 TSecr=686013406
251   0.133855 54.230.30.206 -> 172.31.36.109 TCP 2962 [TCP segment of a reassembled PDU]
252   0.133860 172.31.36.109 -> 54.230.30.206 TCP 66 33263 > http [ACK] Seq=98 Ack=1116765 Win=788096 Len=0 TSval=23186177 TSecr=686013407
253   0.133998 54.230.30.206 -> 172.31.36.109 TCP 18890 [TCP segment of a reassembled PDU]
254   0.134033 172.31.36.109 -> 54.230.30.206 TCP 66 33263 > http [ACK] Seq=98 Ack=1135589 Win=769280 Len=0 TSval=23186177 TSecr=686013407
255   0.134086 54.230.30.206 -> 172.31.36.109 TCP 2962 [TCP segment of a reassembled PDU]
256   0.134091 172.31.36.109 -> 54.230.30.206 TCP 66 33263 > http [ACK] Seq=98 Ack=1138485 Win=788096 Len=0 TSval=23186177 TSecr=686013407
257   0.134250 54.230.30.206 -> 172.31.36.109 TCP 29026 [TCP segment of a reassembled PDU]
258   0.134285 172.31.36.109 -> 54.230.30.206 TCP 66 33263 > http [ACK] Seq=98 Ack=1167445 Win=759168 Len=0 TSval=23186177 TSecr=686013407
259   0.134440 54.230.30.206 -> 172.31.36.109 TCP 12026 [TCP segment of a reassembled PDU]
260   0.134473 172.31.36.109 -> 54.230.30.206 TCP 66 33263 > http [ACK] Seq=98 Ack=1179405 Win=771584 Len=0 TSval=23186177 TSecr=686013407
261   0.238564 54.230.30.206 -> 172.31.36.109 TCP 7306 [TCP segment of a reassembled PDU]
262   0.238572 172.31.36.109 -> 54.230.30.206 TCP 66 33263 > http [ACK] Seq=98 Ack=1186645 Win=781056 Len=0 TSval=23186204 TSecr=686013417
263   0.238593 54.230.30.206 -> 172.31.36.109 TCP 5858 [TCP segment of a reassembled PDU]
264   0.238605 172.31.36.109 -> 54.230.30.206 TCP 66 33263 > http [ACK] Seq=98 Ack=1192437 Win=792960 Len=0 TSval=23186204 TSecr=686013417
265   0.238861 54.230.30.206 -> 172.31.36.109 TCP 24682 [TCP segment of a reassembled PDU]
266   0.238880 54.230.30.206 -> 172.31.36.109 TCP 10202 [TCP segment of a reassembled PDU]
267   0.238994 54.230.30.206 -> 172.31.36.109 TCP 5858 [TCP segment of a reassembled PDU]
268   0.239003 54.230.30.206 -> 172.31.36.109 TCP 2962 [TCP segment of a reassembled PDU]
269   0.239096 54.230.30.206 -> 172.31.36.109 TCP 11650 [TCP segment of a reassembled PDU]
270   0.239219 54.230.30.206 -> 172.31.36.109 TCP 2962 [TCP segment of a reassembled PDU]
271   0.239376 54.230.30.206 -> 172.31.36.109 TCP 5858 [TCP segment of a reassembled PDU]
272   0.239387 54.230.30.206 -> 172.31.36.109 TCP 18890 [TCP segment of a reassembled PDU]
273   0.242718 172.31.36.109 -> 54.230.30.206 TCP 66 33263 > http [ACK] Seq=98 Ack=1274973 Win=710528 Len=0 TSval=23186205 TSecr=686013417
274   0.243969 54.230.30.206 -> 172.31.36.109 TCP 7306 [TCP segment of a reassembled PDU]
275   0.243977 172.31.36.109 -> 54.230.30.206 TCP 66 33263 > http [ACK] Seq=98 Ack=1282213 Win=781056 Len=0 TSval=23186205 TSecr=686013418
276   0.244056 54.230.30.206 -> 172.31.36.109 TCP 23234 [TCP segment of a reassembled PDU]
277   0.244077 172.31.36.109 -> 54.230.30.206 TCP 66 33263 > http [ACK] Seq=98 Ack=1305381 Win=757888 Len=0 TSval=23186205 TSecr=686013418
278   0.244133 54.230.30.206 -> 172.31.36.109 TCP 5162 [TCP segment of a reassembled PDU]
279   0.244139 172.31.36.109 -> 54.230.30.206 TCP 66 33263 > http [ACK] Seq=98 Ack=1310477 Win=783360 Len=0 TSval=23186205 TSecr=686013418
280   0.308192 54.230.30.206 -> 172.31.36.109 TCP 1514 [TCP segment of a reassembled PDU]
281   0.308349 54.230.30.206 -> 172.31.36.109 TCP 2962 [TCP segment of a reassembled PDU]
282   0.308356 172.31.36.109 -> 54.230.30.206 TCP 66 33263 > http [ACK] Seq=98 Ack=1314821 Win=788096 Len=0 TSval=23186221 TSecr=686013424
283   0.308513 54.230.30.206 -> 172.31.36.109 TCP 21786 [TCP segment of a reassembled PDU]
284   0.308548 54.230.30.206 -> 172.31.36.109 TCP 7306 [TCP segment of a reassembled PDU]
285   0.308565 54.230.30.206 -> 172.31.36.109 TCP 1514 [TCP segment of a reassembled PDU]
286   0.308569 172.31.36.109 -> 54.230.30.206 TCP 66 33263 > http [ACK] Seq=98 Ack=1343781 Win=759168 Len=0 TSval=23186221 TSecr=686013424
287   0.308687 54.230.30.206 -> 172.31.36.109 TCP 7306 [TCP segment of a reassembled PDU]
288   0.308693 172.31.36.109 -> 54.230.30.206 TCP 66 33263 > http [ACK] Seq=98 Ack=1352469 Win=781056 Len=0 TSval=23186221 TSecr=686013424
289   0.309116 54.230.30.206 -> 172.31.36.109 TCP 1514 [TCP segment of a reassembled PDU]
290   0.309342 54.230.30.206 -> 172.31.36.109 TCP 29026 [TCP segment of a reassembled PDU]
291   0.309367 172.31.36.109 -> 54.230.30.206 TCP 66 33263 > http [ACK] Seq=98 Ack=1382877 Win=750720 Len=0 TSval=23186221 TSecr=686013424
292   0.309388 54.230.30.206 -> 172.31.36.109 TCP 5858 [TCP segment of a reassembled PDU]
293   0.309394 172.31.36.109 -> 54.230.30.206 TCP 66 33263 > http [ACK] Seq=98 Ack=1388669 Win=783360 Len=0 TSval=23186221 TSecr=686013424
294   0.309620 54.230.30.206 -> 172.31.36.109 TCP 17442 [TCP segment of a reassembled PDU]
295   0.309661 172.31.36.109 -> 54.230.30.206 TCP 66 33263 > http [ACK] Seq=98 Ack=1406045 Win=766080 Len=0 TSval=23186221 TSecr=686013424
296   0.309700 54.230.30.206 -> 172.31.36.109 TCP 7306 [TCP segment of a reassembled PDU]
297   0.309706 172.31.36.109 -> 54.230.30.206 TCP 66 33263 > http [ACK] Seq=98 Ack=1413285 Win=781056 Len=0 TSval=23186221 TSecr=686013424
298   0.309841 54.230.30.206 -> 172.31.36.109 TCP 2962 [TCP segment of a reassembled PDU]
299   0.309845 172.31.36.109 -> 54.230.30.206 TCP 66 33263 > http [ACK] Seq=98 Ack=1416181 Win=788096 Len=0 TSval=23186221 TSecr=686013424
300   0.309867 54.230.30.206 -> 172.31.36.109 TCP 26130 [TCP segment of a reassembled PDU]
301   0.309893 172.31.36.109 -> 54.230.30.206 TCP 66 33263 > http [ACK] Seq=98 Ack=1442245 Win=762112 Len=0 TSval=23186221 TSecr=686013424
302   0.309979 54.230.30.206 -> 172.31.36.109 TCP 10202 [TCP segment of a reassembled PDU]
303   0.309987 172.31.36.109 -> 54.230.30.206 TCP 66 33263 > http [ACK] Seq=98 Ack=1452381 Win=776320 Len=0 TSval=23186221 TSecr=686013424
304   0.310443 54.230.30.206 -> 172.31.36.109 TCP 5858 [TCP segment of a reassembled PDU]
305   0.310450 172.31.36.109 -> 54.230.30.206 TCP 66 33263 > http [ACK] Seq=98 Ack=1458173 Win=783360 Len=0 TSval=23186221 TSecr=686013424
306   0.310581 54.230.30.206 -> 172.31.36.109 TCP 13098 [TCP segment of a reassembled PDU]
307   0.310601 172.31.36.109 -> 54.230.30.206 TCP 66 33263 > http [ACK] Seq=98 Ack=1471205 Win=792960 Len=0 TSval=23186222 TSecr=686013424
308   0.310867 54.230.30.206 -> 172.31.36.109 TCP 33370 [TCP segment of a reassembled PDU]
309   0.310907 172.31.36.109 -> 54.230.30.206 TCP 66 33263 > http [ACK] Seq=98 Ack=1504509 Win=759680 Len=0 TSval=23186222 TSecr=686013424
310   0.310991 54.230.30.206 -> 172.31.36.109 TCP 10202 [TCP segment of a reassembled PDU]
311   0.310999 172.31.36.109 -> 54.230.30.206 TCP 66 33263 > http [ACK] Seq=98 Ack=1514645 Win=776320 Len=0 TSval=23186222 TSecr=686013424
312   0.311075 54.230.30.206 -> 172.31.36.109 TCP 17442 [TCP segment of a reassembled PDU]
313   0.311094 172.31.36.109 -> 54.230.30.206 TCP 66 33263 > http [ACK] Seq=98 Ack=1532021 Win=764288 Len=0 TSval=23186222 TSecr=686013424
314   0.311346 54.230.30.206 -> 172.31.36.109 TCP 8754 [TCP segment of a reassembled PDU]
315   0.311353 172.31.36.109 -> 54.230.30.206 TCP 66 33263 > http [ACK] Seq=98 Ack=1540709 Win=778624 Len=0 TSval=23186222 TSecr=686013424
316   0.311362 54.230.30.206 -> 172.31.36.109 TCP 11650 [TCP segment of a reassembled PDU]
317   0.311388 172.31.36.109 -> 54.230.30.206 TCP 66 33263 > http [ACK] Seq=98 Ack=1552293 Win=773888 Len=0 TSval=23186222 TSecr=686013424
318   0.311750 54.230.30.206 -> 172.31.36.109 TCP 13098 [TCP segment of a reassembled PDU]
319   0.311787 172.31.36.109 -> 54.230.30.206 TCP 66 33263 > http [ACK] Seq=98 Ack=1565325 Win=792960 Len=0 TSval=23186222 TSecr=686013424
320   0.311922 54.230.30.206 -> 172.31.36.109 TCP 14546 [TCP segment of a reassembled PDU]
321   0.311949 54.230.30.206 -> 172.31.36.109 TCP 5858 [TCP segment of a reassembled PDU]
322   0.311965 172.31.36.109 -> 54.230.30.206 TCP 66 33263 > http [ACK] Seq=98 Ack=1585597 Win=783360 Len=0 TSval=23186222 TSecr=686013424
323   0.312095 54.230.30.206 -> 172.31.36.109 TCP 7306 [TCP segment of a reassembled PDU]
324   0.312171 172.31.36.109 -> 54.230.30.206 TCP 66 33263 > http [ACK] Seq=98 Ack=1592837 Win=792960 Len=0 TSval=23186222 TSecr=686013424
325   0.312254 54.230.30.206 -> 172.31.36.109 TCP 4410 [TCP segment of a reassembled PDU]
326   0.312295 172.31.36.109 -> 54.230.30.206 TCP 66 33263 > http [ACK] Seq=98 Ack=1597181 Win=792960 Len=0 TSval=23186222 TSecr=686013424
327   0.312399 54.230.30.206 -> 172.31.36.109 TCP 17442 [TCP segment of a reassembled PDU]
328   0.312436 54.230.30.206 -> 172.31.36.109 TCP 8754 [TCP segment of a reassembled PDU]
329   0.312458 172.31.36.109 -> 54.230.30.206 TCP 66 33263 > http [ACK] Seq=98 Ack=1623245 Win=766976 Len=0 TSval=23186222 TSecr=686013424
330   0.312638 54.230.30.206 -> 172.31.36.109 TCP 13098 [TCP segment of a reassembled PDU]
331   0.312670 172.31.36.109 -> 54.230.30.206 TCP 66 33263 > http [ACK] Seq=98 Ack=1636277 Win=771584 Len=0 TSval=23186222 TSecr=686013424
332   0.312684 54.230.30.206 -> 172.31.36.109 TCP 11650 [TCP segment of a reassembled PDU]
333   0.312711 172.31.36.109 -> 54.230.30.206 TCP 66 33263 > http [ACK] Seq=98 Ack=1647861 Win=773888 Len=0 TSval=23186222 TSecr=686013425
334   0.312914 54.230.30.206 -> 172.31.36.109 TCP 29026 [TCP segment of a reassembled PDU]
335   0.312943 172.31.36.109 -> 54.230.30.206 TCP 66 33263 > http [ACK] Seq=98 Ack=1676821 Win=745216 Len=0 TSval=23186222 TSecr=686013425
336   0.313225 54.230.30.206 -> 172.31.36.109 TCP 2962 [TCP segment of a reassembled PDU]
337   0.313256 172.31.36.109 -> 54.230.30.206 TCP 66 33263 > http [ACK] Seq=98 Ack=1679717 Win=788096 Len=0 TSval=23186222 TSecr=686013425
338   0.313411 54.230.30.206 -> 172.31.36.109 TCP 24042 [TCP segment of a reassembled PDU]
339   0.313599 172.31.36.109 -> 54.230.30.206 TCP 66 33263 > http [ACK] Seq=98 Ack=1703693 Win=764160 Len=0 TSval=23186222 TSecr=686013425
340   0.319094 54.230.30.206 -> 172.31.36.109 TCP 1514 [TCP segment of a reassembled PDU]
341   0.319393 54.230.30.206 -> 172.31.36.109 TCP 4410 [TCP segment of a reassembled PDU]
342   0.319399 172.31.36.109 -> 54.230.30.206 TCP 66 33263 > http [ACK] Seq=98 Ack=1709485 Win=802560 Len=0 TSval=23186224 TSecr=686013425
343   0.319620 54.230.30.206 -> 172.31.36.109 TCP 23234 [TCP segment of a reassembled PDU]
344   0.319639 172.31.36.109 -> 54.230.30.206 TCP 66 33263 > http [ACK] Seq=98 Ack=1732653 Win=848896 Len=0 TSval=23186224 TSecr=686013425
345   0.319653 54.230.30.206 -> 172.31.36.109 TCP 5858 [TCP segment of a reassembled PDU]
346   0.319657 172.31.36.109 -> 54.230.30.206 TCP 66 33263 > http [ACK] Seq=98 Ack=1738445 Win=860544 Len=0 TSval=23186224 TSecr=686013425
347   0.319822 54.230.30.206 -> 172.31.36.109 TCP 20338 [TCP segment of a reassembled PDU]
348   0.319835 172.31.36.109 -> 54.230.30.206 TCP 66 33263 > http [ACK] Seq=98 Ack=1758717 Win=900992 Len=0 TSval=23186224 TSecr=686013425
349   0.319844 54.230.30.206 -> 172.31.36.109 TCP 2962 [TCP segment of a reassembled PDU]
350   0.319847 172.31.36.109 -> 54.230.30.206 TCP 66 33263 > http [ACK] Seq=98 Ack=1761613 Win=906880 Len=0 TSval=23186224 TSecr=686013425
351   0.319935 54.230.30.206 -> 172.31.36.109 TCP 7682 [TCP segment of a reassembled PDU]
352   0.319943 172.31.36.109 -> 54.230.30.206 TCP 66 33263 > http [ACK] Seq=98 Ack=1769229 Win=922112 Len=0 TSval=23186224 TSecr=686013425
353   0.324619 54.230.30.206 -> 172.31.36.109 TCP 1514 [TCP segment of a reassembled PDU]
354   0.324631 172.31.36.109 -> 54.230.30.206 TCP 66 33263 > http [ACK] Seq=98 Ack=1770677 Win=924928 Len=0 TSval=23186225 TSecr=686013426
355   0.324663 54.230.30.206 -> 172.31.36.109 TCP 7306 [TCP segment of a reassembled PDU]
