[Measurement for 10mb at 00:31:02 20.31.2014] 
Tshark:

  1   0.000000 172.31.36.109 -> 172.31.0.2   DNS 89 Standard query 0x5246  A d3796nkzln59xv.cloudfront.net
  2   0.000024 172.31.36.109 -> 172.31.0.2   DNS 89 Standard query 0xf984  AAAA d3796nkzln59xv.cloudfront.net
  3   0.000594   172.31.0.2 -> 172.31.36.109 DNS 170 Standard query response 0xf984 
  4   0.000604   172.31.0.2 -> 172.31.36.109 DNS 217 Standard query response 0x5246  A 54.230.30.5 A 54.230.30.71 A 54.230.30.190 A 54.230.30.191 A 54.230.30.221 A 54.230.31.2 A 54.192.30.228 A 54.230.29.240
  5   0.003873 172.31.36.109 -> 54.230.30.5  TCP 74 59842 > http [SYN] Seq=0 Win=26883 Len=0 MSS=8961 SACK_PERM=1 TSval=26787296 TSecr=0 WS=128
  6   0.004920  54.230.30.5 -> 172.31.36.109 TCP 74 http > 59842 [SYN, ACK] Seq=0 Ack=1 Win=14480 Len=0 MSS=1460 SACK_PERM=1 TSval=713573810 TSecr=26787296 WS=128
  7   0.004935 172.31.36.109 -> 54.230.30.5  TCP 66 59842 > http [ACK] Seq=1 Ack=1 Win=27008 Len=0 TSval=26787297 TSecr=713573810
  8   0.004975 172.31.36.109 -> 54.230.30.5  HTTP 163 GET /10mb HTTP/1.1 
  9   0.005984  54.230.30.5 -> 172.31.36.109 TCP 66 http > 59842 [ACK] Seq=1 Ack=98 Win=14592 Len=0 TSval=713573810 TSecr=26787297
 10   0.029395  54.230.30.5 -> 172.31.36.109 TCP 1514 [TCP segment of a reassembled PDU]
 11   0.029407 172.31.36.109 -> 54.230.30.5  TCP 66 59842 > http [ACK] Seq=98 Ack=1449 Win=29824 Len=0 TSval=26787303 TSecr=713573812
 12   0.029625  54.230.30.5 -> 172.31.36.109 TCP 2962 [TCP segment of a reassembled PDU]
 13   0.029632 172.31.36.109 -> 54.230.30.5  TCP 66 59842 > http [ACK] Seq=98 Ack=4345 Win=35584 Len=0 TSval=26787303 TSecr=713573812
 14   0.029672  54.230.30.5 -> 172.31.36.109 TCP 8754 [TCP segment of a reassembled PDU]
 15   0.029681 172.31.36.109 -> 54.230.30.5  TCP 66 59842 > http [ACK] Seq=98 Ack=13033 Win=52992 Len=0 TSval=26787303 TSecr=713573812
 16   0.031178  54.230.30.5 -> 172.31.36.109 TCP 2962 [TCP segment of a reassembled PDU]
 17   0.031185 172.31.36.109 -> 54.230.30.5  TCP 66 59842 > http [ACK] Seq=98 Ack=15929 Win=58752 Len=0 TSval=26787303 TSecr=713573812
 18   0.031231  54.230.30.5 -> 172.31.36.109 TCP 10202 [TCP segment of a reassembled PDU]
 19   0.031238 172.31.36.109 -> 54.230.30.5  TCP 66 59842 > http [ACK] Seq=98 Ack=26065 Win=79104 Len=0 TSval=26787303 TSecr=713573812
 20   0.032344  54.230.30.5 -> 172.31.36.109 TCP 4410 [TCP segment of a reassembled PDU]
 21   0.032351 172.31.36.109 -> 54.230.30.5  TCP 66 59842 > http [ACK] Seq=98 Ack=30409 Win=87808 Len=0 TSval=26787303 TSecr=713573813
 22   0.032436  54.230.30.5 -> 172.31.36.109 TCP 1514 [TCP segment of a reassembled PDU]
 23   0.032440 172.31.36.109 -> 54.230.30.5  TCP 66 59842 > http [ACK] Seq=98 Ack=31857 Win=90624 Len=0 TSval=26787303 TSecr=713573813
 24   0.032530  54.230.30.5 -> 172.31.36.109 TCP 14546 [TCP segment of a reassembled PDU]
 25   0.032540 172.31.36.109 -> 54.230.30.5  TCP 66 59842 > http [ACK] Seq=98 Ack=46337 Win=94080 Len=0 TSval=26787303 TSecr=713573813
 26   0.032820  54.230.30.5 -> 172.31.36.109 TCP 1514 [TCP segment of a reassembled PDU]
 27   0.032825 172.31.36.109 -> 54.230.30.5  TCP 66 59842 > http [ACK] Seq=98 Ack=47785 Win=109056 Len=0 TSval=26787304 TSecr=713573813
 28   0.033471  54.230.30.5 -> 172.31.36.109 TCP 2962 [TCP segment of a reassembled PDU]
 29   0.033477 172.31.36.109 -> 54.230.30.5  TCP 66 59842 > http [ACK] Seq=98 Ack=50681 Win=114816 Len=0 TSval=26787304 TSecr=713573813
 30   0.033528  54.230.30.5 -> 172.31.36.109 TCP 1514 [TCP segment of a reassembled PDU]
 31   0.033533 172.31.36.109 -> 54.230.30.5  TCP 66 59842 > http [ACK] Seq=98 Ack=52129 Win=117760 Len=0 TSval=26787304 TSecr=713573813
 32   0.033767  54.230.30.5 -> 172.31.36.109 TCP 4410 [TCP segment of a reassembled PDU]
 33   0.033772 172.31.36.109 -> 54.230.30.5  TCP 66 59842 > http [ACK] Seq=98 Ack=56473 Win=126464 Len=0 TSval=26787304 TSecr=713573813
 34   0.033854  54.230.30.5 -> 172.31.36.109 TCP 8754 [TCP segment of a reassembled PDU]
 35   0.033861 172.31.36.109 -> 54.230.30.5  TCP 66 59842 > http [ACK] Seq=98 Ack=65161 Win=143872 Len=0 TSval=26787304 TSecr=713573813
 36   0.034022  54.230.30.5 -> 172.31.36.109 TCP 10202 [TCP segment of a reassembled PDU]
 37   0.034030 172.31.36.109 -> 54.230.30.5  TCP 66 59842 > http [ACK] Seq=98 Ack=75297 Win=164096 Len=0 TSval=26787304 TSecr=713573813
 38   0.034752  54.230.30.5 -> 172.31.36.109 TCP 2962 [TCP segment of a reassembled PDU]
 39   0.034757 172.31.36.109 -> 54.230.30.5  TCP 66 59842 > http [ACK] Seq=98 Ack=78193 Win=169856 Len=0 TSval=26787304 TSecr=713573813
 40   0.035071  54.230.30.5 -> 172.31.36.109 TCP 14546 [TCP segment of a reassembled PDU]
 41   0.035080 172.31.36.109 -> 54.230.30.5  TCP 66 59842 > http [ACK] Seq=98 Ack=92673 Win=198784 Len=0 TSval=26787304 TSecr=713573813
 42   0.035373  54.230.30.5 -> 172.31.36.109 TCP 14546 [TCP segment of a reassembled PDU]
 43   0.035382 172.31.36.109 -> 54.230.30.5  TCP 66 59842 > http [ACK] Seq=98 Ack=107153 Win=227840 Len=0 TSval=26787304 TSecr=713573813
 44   0.036314  54.230.30.5 -> 172.31.36.109 TCP 1514 [TCP segment of a reassembled PDU]
 45   0.036320 172.31.36.109 -> 54.230.30.5  TCP 66 59842 > http [ACK] Seq=98 Ack=108601 Win=230656 Len=0 TSval=26787304 TSecr=713573813
 46   0.036453  54.230.30.5 -> 172.31.36.109 TCP 13098 [TCP segment of a reassembled PDU]
 47   0.036462 172.31.36.109 -> 54.230.30.5  TCP 66 59842 > http [ACK] Seq=98 Ack=121633 Win=256768 Len=0 TSval=26787304 TSecr=713573813
 48   0.036680  54.230.30.5 -> 172.31.36.109 TCP 10710 [TCP segment of a reassembled PDU]
 49   0.036690 172.31.36.109 -> 54.230.30.5  TCP 66 59842 > http [ACK] Seq=98 Ack=132277 Win=278016 Len=0 TSval=26787305 TSecr=713573813
 50   0.036707  54.230.30.5 -> 172.31.36.109 TCP 8754 [TCP segment of a reassembled PDU]
 51   0.036713 172.31.36.109 -> 54.230.30.5  TCP 66 59842 > http [ACK] Seq=98 Ack=140965 Win=295424 Len=0 TSval=26787305 TSecr=713573813
 52   0.036765  54.230.30.5 -> 172.31.36.109 TCP 4410 [TCP segment of a reassembled PDU]
 53   0.036770 172.31.36.109 -> 54.230.30.5  TCP 66 59842 > http [ACK] Seq=98 Ack=145309 Win=304128 Len=0 TSval=26787305 TSecr=713573813
 54   0.037577  54.230.30.5 -> 172.31.36.109 TCP 4410 [TCP segment of a reassembled PDU]
 55   0.037583 172.31.36.109 -> 54.230.30.5  TCP 66 59842 > http [ACK] Seq=98 Ack=149653 Win=312832 Len=0 TSval=26787305 TSecr=713573813
 56   0.037709  54.230.30.5 -> 172.31.36.109 TCP 13098 [TCP segment of a reassembled PDU]
 57   0.037718 172.31.36.109 -> 54.230.30.5  TCP 66 59842 > http [ACK] Seq=98 Ack=162685 Win=338816 Len=0 TSval=26787305 TSecr=713573813
 58   0.037931  54.230.30.5 -> 172.31.36.109 TCP 10202 [TCP segment of a reassembled PDU]
 59   0.037939 172.31.36.109 -> 54.230.30.5  TCP 66 59842 > http [ACK] Seq=98 Ack=172821 Win=359168 Len=0 TSval=26787305 TSecr=713573813
 60   0.038163  54.230.30.5 -> 172.31.36.109 TCP 13098 [TCP segment of a reassembled PDU]
 61   0.038172 172.31.36.109 -> 54.230.30.5  TCP 66 59842 > http [ACK] Seq=98 Ack=185853 Win=385152 Len=0 TSval=26787305 TSecr=713573813
 62   0.038839  54.230.30.5 -> 172.31.36.109 TCP 2962 [TCP segment of a reassembled PDU]
 63   0.038845 172.31.36.109 -> 54.230.30.5  TCP 66 59842 > http [ACK] Seq=98 Ack=188749 Win=391040 Len=0 TSval=26787305 TSecr=713573813
 64   0.039004  54.230.30.5 -> 172.31.36.109 TCP 21786 [TCP segment of a reassembled PDU]
 65   0.039016 172.31.36.109 -> 54.230.30.5  TCP 66 59842 > http [ACK] Seq=98 Ack=210469 Win=434432 Len=0 TSval=26787305 TSecr=713573813
 66   0.039364  54.230.30.5 -> 172.31.36.109 TCP 2962 [TCP segment of a reassembled PDU]
 67   0.039370 172.31.36.109 -> 54.230.30.5  TCP 66 59842 > http [ACK] Seq=98 Ack=213365 Win=440192 Len=0 TSval=26787305 TSecr=713573813
 68   0.039555  54.230.30.5 -> 172.31.36.109 TCP 24682 [TCP segment of a reassembled PDU]
 69   0.039568 172.31.36.109 -> 54.230.30.5  TCP 66 59842 > http [ACK] Seq=98 Ack=237981 Win=489472 Len=0 TSval=26787305 TSecr=713573813
 70   0.040127  54.230.30.5 -> 172.31.36.109 TCP 1514 [TCP segment of a reassembled PDU]
 71   0.040132 172.31.36.109 -> 54.230.30.5  TCP 66 59842 > http [ACK] Seq=98 Ack=239429 Win=492288 Len=0 TSval=26787305 TSecr=713573813
 72   0.040352  54.230.30.5 -> 172.31.36.109 TCP 23234 [TCP segment of a reassembled PDU]
 73   0.040365 172.31.36.109 -> 54.230.30.5  TCP 66 59842 > http [ACK] Seq=98 Ack=262597 Win=538624 Len=0 TSval=26787305 TSecr=713573813
 74   0.040390  54.230.30.5 -> 172.31.36.109 TCP 2962 [TCP segment of a reassembled PDU]
 75   0.040394 172.31.36.109 -> 54.230.30.5  TCP 66 59842 > http [ACK] Seq=98 Ack=265493 Win=544512 Len=0 TSval=26787305 TSecr=713573813
 76   0.040843  54.230.30.5 -> 172.31.36.109 TCP 26130 [TCP segment of a reassembled PDU]
 77   0.040858 172.31.36.109 -> 54.230.30.5  TCP 66 59842 > http [ACK] Seq=98 Ack=291557 Win=578944 Len=0 TSval=26787306 TSecr=713573813
 78   0.040978  54.230.30.5 -> 172.31.36.109 TCP 4410 [TCP segment of a reassembled PDU]
 79   0.040984 172.31.36.109 -> 54.230.30.5  TCP 66 59842 > http [ACK] Seq=98 Ack=295901 Win=605312 Len=0 TSval=26787306 TSecr=713573813
 80   0.041714  54.230.30.5 -> 172.31.36.109 TCP 1514 [TCP segment of a reassembled PDU]
 81   0.041718 172.31.36.109 -> 54.230.30.5  TCP 66 59842 > http [ACK] Seq=98 Ack=297349 Win=608128 Len=0 TSval=26787306 TSecr=713573813
 82   0.041902  54.230.30.5 -> 172.31.36.109 TCP 26130 [TCP segment of a reassembled PDU]
 83   0.041915 172.31.36.109 -> 54.230.30.5  TCP 66 59842 > http [ACK] Seq=98 Ack=323413 Win=660352 Len=0 TSval=26787306 TSecr=713573813
 84   0.041946  54.230.30.5 -> 172.31.36.109 TCP 2962 [TCP segment of a reassembled PDU]
 85   0.041953 172.31.36.109 -> 54.230.30.5  TCP 66 59842 > http [ACK] Seq=98 Ack=326309 Win=666112 Len=0 TSval=26787306 TSecr=713573813
 86   0.042062  54.230.30.5 -> 172.31.36.109 TCP 14546 [TCP segment of a reassembled PDU]
 87   0.042072 172.31.36.109 -> 54.230.30.5  TCP 66 59842 > http [ACK] Seq=98 Ack=340789 Win=695040 Len=0 TSval=26787306 TSecr=713573813
 88   0.043009  54.230.30.5 -> 172.31.36.109 TCP 5858 [TCP segment of a reassembled PDU]
 89   0.043016 172.31.36.109 -> 54.230.30.5  TCP 66 59842 > http [ACK] Seq=98 Ack=346581 Win=706688 Len=0 TSval=26787306 TSecr=713573814
 90   0.043161  54.230.30.5 -> 172.31.36.109 TCP 18890 [TCP segment of a reassembled PDU]
 91   0.043172 172.31.36.109 -> 54.230.30.5  TCP 66 59842 > http [ACK] Seq=98 Ack=365405 Win=744320 Len=0 TSval=26787306 TSecr=713573814
 92   0.043234  54.230.30.5 -> 172.31.36.109 TCP 4410 [TCP segment of a reassembled PDU]
 93   0.043241 172.31.36.109 -> 54.230.30.5  TCP 66 59842 > http [ACK] Seq=98 Ack=369749 Win=753024 Len=0 TSval=26787306 TSecr=713573814
 94   0.043363  54.230.30.5 -> 172.31.36.109 TCP 15994 [TCP segment of a reassembled PDU]
 95   0.043372 172.31.36.109 -> 54.230.30.5  TCP 66 59842 > http [ACK] Seq=98 Ack=385677 Win=784896 Len=0 TSval=26787306 TSecr=713573814
 96   0.043575  54.230.30.5 -> 172.31.36.109 TCP 5858 [TCP segment of a reassembled PDU]
 97   0.043582 172.31.36.109 -> 54.230.30.5  TCP 66 59842 > http [ACK] Seq=98 Ack=391469 Win=796416 Len=0 TSval=26787306 TSecr=713573814
 98   0.044259  54.230.30.5 -> 172.31.36.109 TCP 1570 [TCP segment of a reassembled PDU]
 99   0.044264 172.31.36.109 -> 54.230.30.5  TCP 66 59842 > http [ACK] Seq=98 Ack=392973 Win=796416 Len=0 TSval=26787306 TSecr=713573814
100   0.045065  54.230.30.5 -> 172.31.36.109 TCP 1514 [TCP segment of a reassembled PDU]
101   0.045069 172.31.36.109 -> 54.230.30.5  TCP 66 59842 > http [ACK] Seq=98 Ack=394421 Win=799360 Len=0 TSval=26787307 TSecr=713573814
102   0.045303  54.230.30.5 -> 172.31.36.109 TCP 2962 [TCP segment of a reassembled PDU]
103   0.045308 172.31.36.109 -> 54.230.30.5  TCP 66 59842 > http [ACK] Seq=98 Ack=397317 Win=805120 Len=0 TSval=26787307 TSecr=713573814
104   0.045363  54.230.30.5 -> 172.31.36.109 TCP 1514 [TCP segment of a reassembled PDU]
105   0.045367 172.31.36.109 -> 54.230.30.5  TCP 66 59842 > http [ACK] Seq=98 Ack=398765 Win=808064 Len=0 TSval=26787307 TSecr=713573814
106   0.045559  54.230.30.5 -> 172.31.36.109 TCP 11722 [TCP segment of a reassembled PDU]
107   0.045569 172.31.36.109 -> 54.230.30.5  TCP 66 59842 > http [ACK] Seq=98 Ack=410421 Win=831360 Len=0 TSval=26787307 TSecr=713573814
108   0.045598  54.230.30.5 -> 172.31.36.109 TCP 8682 [TCP segment of a reassembled PDU]
109   0.045604 172.31.36.109 -> 54.230.30.5  TCP 66 59842 > http [ACK] Seq=98 Ack=419037 Win=847360 Len=0 TSval=26787307 TSecr=713573814
110   0.045640  54.230.30.5 -> 172.31.36.109 TCP 2962 [TCP segment of a reassembled PDU]
111   0.045645 172.31.36.109 -> 54.230.30.5  TCP 66 59842 > http [ACK] Seq=98 Ack=421933 Win=854400 Len=0 TSval=26787307 TSecr=713573814
112   0.045653  54.230.30.5 -> 172.31.36.109 TCP 2962 [TCP segment of a reassembled PDU]
113   0.045656 172.31.36.109 -> 54.230.30.5  TCP 66 59842 > http [ACK] Seq=98 Ack=424829 Win=860160 Len=0 TSval=26787307 TSecr=713573814
114   0.045839  54.230.30.5 -> 172.31.36.109 TCP 17442 [TCP segment of a reassembled PDU]
115   0.045848 172.31.36.109 -> 54.230.30.5  TCP 66 59842 > http [ACK] Seq=98 Ack=442205 Win=854400 Len=0 TSval=26787307 TSecr=713573814
116   0.046285  54.230.30.5 -> 172.31.36.109 TCP 4410 [TCP segment of a reassembled PDU]
117   0.046291 172.31.36.109 -> 54.230.30.5  TCP 66 59842 > http [ACK] Seq=98 Ack=446549 Win=868864 Len=0 TSval=26787307 TSecr=713573814
118   0.046373  54.230.30.5 -> 172.31.36.109 TCP 2962 [TCP segment of a reassembled PDU]
119   0.046378 172.31.36.109 -> 54.230.30.5  TCP 66 59842 > http [ACK] Seq=98 Ack=449445 Win=874624 Len=0 TSval=26787307 TSecr=713573814
120   0.046810  54.230.30.5 -> 172.31.36.109 TCP 5858 [TCP segment of a reassembled PDU]
121   0.046816 172.31.36.109 -> 54.230.30.5  TCP 66 59842 > http [ACK] Seq=98 Ack=455237 Win=873472 Len=0 TSval=26787307 TSecr=713573814
122   0.046901  54.230.30.5 -> 172.31.36.109 TCP 3338 [TCP segment of a reassembled PDU]
123   0.046906 172.31.36.109 -> 54.230.30.5  TCP 66 59842 > http [ACK] Seq=98 Ack=458509 Win=874624 Len=0 TSval=26787307 TSecr=713573814
124   0.060307  54.230.30.5 -> 172.31.36.109 TCP 1514 [TCP segment of a reassembled PDU]
125   0.060312 172.31.36.109 -> 54.230.30.5  TCP 66 59842 > http [ACK] Seq=98 Ack=459957 Win=877568 Len=0 TSval=26787310 TSecr=713573815
126   0.061456  54.230.30.5 -> 172.31.36.109 TCP 20338 [TCP segment of a reassembled PDU]
127   0.061482 172.31.36.109 -> 54.230.30.5  TCP 66 59842 > http [ACK] Seq=98 Ack=480229 Win=857344 Len=0 TSval=26787311 TSecr=713573815
128   0.061582  54.230.30.5 -> 172.31.36.109 TCP 5858 [TCP segment of a reassembled PDU]
129   0.061588 172.31.36.109 -> 54.230.30.5  TCP 66 59842 > http [ACK] Seq=98 Ack=486021 Win=873472 Len=0 TSval=26787311 TSecr=713573815
130   0.061599  54.230.30.5 -> 172.31.36.109 TCP 15994 [TCP segment of a reassembled PDU]
131   0.061613  54.230.30.5 -> 172.31.36.109 TCP 8754 [TCP segment of a reassembled PDU]
132   0.061624  54.230.30.5 -> 172.31.36.109 TCP 17442 [TCP segment of a reassembled PDU]
133   0.061852 172.31.36.109 -> 54.230.30.5  TCP 66 59842 > http [ACK] Seq=98 Ack=528013 Win=831488 Len=0 TSval=26787311 TSecr=713573815
134   0.061923  54.230.30.5 -> 172.31.36.109 TCP 4410 [TCP segment of a reassembled PDU]
135   0.061930 172.31.36.109 -> 54.230.30.5  TCP 66 59842 > http [ACK] Seq=98 Ack=532357 Win=875904 Len=0 TSval=26787311 TSecr=713573815
136   0.062028  54.230.30.5 -> 172.31.36.109 TCP 7306 [TCP segment of a reassembled PDU]
137   0.062046 172.31.36.109 -> 54.230.30.5  TCP 66 59842 > http [ACK] Seq=98 Ack=539597 Win=877568 Len=0 TSval=26787311 TSecr=713573815
138   0.062613  54.230.30.5 -> 172.31.36.109 TCP 4410 [TCP segment of a reassembled PDU]
139   0.062628 172.31.36.109 -> 54.230.30.5  TCP 66 59842 > http [ACK] Seq=98 Ack=543941 Win=877568 Len=0 TSval=26787311 TSecr=713573816
140   0.062703  54.230.30.5 -> 172.31.36.109 TCP 2962 [TCP segment of a reassembled PDU]
141   0.062708 172.31.36.109 -> 54.230.30.5  TCP 66 59842 > http [ACK] Seq=98 Ack=546837 Win=878208 Len=0 TSval=26787311 TSecr=713573816
142   0.062846  54.230.30.5 -> 172.31.36.109 TCP 10202 [TCP segment of a reassembled PDU]
143   0.062864 172.31.36.109 -> 54.230.30.5  TCP 66 59842 > http [ACK] Seq=98 Ack=556973 Win=883072 Len=0 TSval=26787311 TSecr=713573816
144   0.063096  54.230.30.5 -> 172.31.36.109 TCP 26130 [TCP segment of a reassembled PDU]
145   0.063131  54.230.30.5 -> 172.31.36.109 TCP 13098 [TCP segment of a reassembled PDU]
146   0.063150 172.31.36.109 -> 54.230.30.5  TCP 66 59842 > http [ACK] Seq=98 Ack=596069 Win=844032 Len=0 TSval=26787311 TSecr=713573816
147   0.063394  54.230.30.5 -> 172.31.36.109 TCP 8754 [TCP segment of a reassembled PDU]
148   0.063402 172.31.36.109 -> 54.230.30.5  TCP 66 59842 > http [ACK] Seq=98 Ack=604757 Win=868736 Len=0 TSval=26787311 TSecr=713573816
149   0.063953  54.230.30.5 -> 172.31.36.109 TCP 4410 [TCP segment of a reassembled PDU]
150   0.063959 172.31.36.109 -> 54.230.30.5  TCP 66 59842 > http [ACK] Seq=98 Ack=609101 Win=875904 Len=0 TSval=26787311 TSecr=713573816
151   0.064110  54.230.30.5 -> 172.31.36.109 TCP 21786 [TCP segment of a reassembled PDU]
152   0.064313 172.31.36.109 -> 54.230.30.5  TCP 66 59842 > http [ACK] Seq=98 Ack=630821 Win=854272 Len=0 TSval=26787311 TSecr=713573816
153   0.064354  54.230.30.5 -> 172.31.36.109 TCP 24362 [TCP segment of a reassembled PDU]
154   0.064380 172.31.36.109 -> 54.230.30.5  TCP 66 59842 > http [ACK] Seq=98 Ack=655117 Win=842624 Len=0 TSval=26787311 TSecr=713573816
155   0.076027  54.230.30.5 -> 172.31.36.109 TCP 4410 [TCP segment of a reassembled PDU]
156   0.076033 172.31.36.109 -> 54.230.30.5  TCP 66 59842 > http [ACK] Seq=98 Ack=659461 Win=875904 Len=0 TSval=26787314 TSecr=713573817
157   0.076281  54.230.30.5 -> 172.31.36.109 TCP 4410 [TCP segment of a reassembled PDU]
158   0.076287 172.31.36.109 -> 54.230.30.5  TCP 66 59842 > http [ACK] Seq=98 Ack=663805 Win=875904 Len=0 TSval=26787314 TSecr=713573817
159   0.076391  54.230.30.5 -> 172.31.36.109 TCP 15994 [TCP segment of a reassembled PDU]
160   0.076421  54.230.30.5 -> 172.31.36.109 TCP 8754 [TCP segment of a reassembled PDU]
161   0.076431 172.31.36.109 -> 54.230.30.5  TCP 66 59842 > http [ACK] Seq=98 Ack=688421 Win=868736 Len=0 TSval=26787314 TSecr=713573817
162   0.076712  54.230.30.5 -> 172.31.36.109 TCP 5858 [TCP segment of a reassembled PDU]
163   0.076718 172.31.36.109 -> 54.230.30.5  TCP 66 59842 > http [ACK] Seq=98 Ack=694213 Win=873472 Len=0 TSval=26787315 TSecr=713573817
164   0.076733  54.230.30.5 -> 172.31.36.109 TCP 23234 [TCP segment of a reassembled PDU]
165   0.076773 172.31.36.109 -> 54.230.30.5  TCP 66 59842 > http [ACK] Seq=98 Ack=717381 Win=850304 Len=0 TSval=26787315 TSecr=713573817
166   0.077301  54.230.30.5 -> 172.31.36.109 TCP 3338 [TCP segment of a reassembled PDU]
167   0.077306 172.31.36.109 -> 54.230.30.5  TCP 66 59842 > http [ACK] Seq=98 Ack=720653 Win=875904 Len=0 TSval=26787315 TSecr=713573817
168   0.098605  54.230.30.5 -> 172.31.36.109 TCP 10202 [TCP segment of a reassembled PDU]
169   0.098629 172.31.36.109 -> 54.230.30.5  TCP 66 59842 > http [ACK] Seq=98 Ack=730789 Win=883072 Len=0 TSval=26787320 TSecr=713573819
170   0.098705  54.230.30.5 -> 172.31.36.109 TCP 4410 [TCP segment of a reassembled PDU]
171   0.098722 172.31.36.109 -> 54.230.30.5  TCP 66 59842 > http [ACK] Seq=98 Ack=735133 Win=883072 Len=0 TSval=26787320 TSecr=713573819
172   0.098752  54.230.30.5 -> 172.31.36.109 TCP 2962 [TCP segment of a reassembled PDU]
173   0.098937 172.31.36.109 -> 54.230.30.5  TCP 66 59842 > http [ACK] Seq=98 Ack=738029 Win=883072 Len=0 TSval=26787320 TSecr=713573819
174   0.099327  54.230.30.5 -> 172.31.36.109 TCP 48226 [TCP segment of a reassembled PDU]
175   0.099365 172.31.36.109 -> 54.230.30.5  TCP 66 59842 > http [ACK] Seq=98 Ack=786189 Win=834944 Len=0 TSval=26787320 TSecr=713573819
176   0.112341  54.230.30.5 -> 172.31.36.109 TCP 1514 [TCP segment of a reassembled PDU]
177   0.112416  54.230.30.5 -> 172.31.36.109 TCP 17442 [TCP segment of a reassembled PDU]
178   0.112426 172.31.36.109 -> 54.230.30.5  TCP 66 59842 > http [ACK] Seq=98 Ack=805013 Win=854400 Len=0 TSval=26787323 TSecr=713573821
179   0.112578  54.230.30.5 -> 172.31.36.109 TCP 2962 [TCP segment of a reassembled PDU]
180   0.112583 172.31.36.109 -> 54.230.30.5  TCP 66 59842 > http [ACK] Seq=98 Ack=807909 Win=878208 Len=0 TSval=26787323 TSecr=713573821
181   0.112705  54.230.30.5 -> 172.31.36.109 TCP 4410 [TCP segment of a reassembled PDU]
182   0.112721 172.31.36.109 -> 54.230.30.5  TCP 66 59842 > http [ACK] Seq=98 Ack=812253 Win=883072 Len=0 TSval=26787324 TSecr=713573821
183   0.112766  54.230.30.5 -> 172.31.36.109 TCP 11650 [TCP segment of a reassembled PDU]
184   0.112790 172.31.36.109 -> 54.230.30.5  TCP 66 59842 > http [ACK] Seq=98 Ack=823837 Win=883072 Len=0 TSval=26787324 TSecr=713573821
185   0.112815  54.230.30.5 -> 172.31.36.109 TCP 5858 [TCP segment of a reassembled PDU]
186   0.112830 172.31.36.109 -> 54.230.30.5  TCP 66 59842 > http [ACK] Seq=98 Ack=829629 Win=883072 Len=0 TSval=26787324 TSecr=713573821
187   0.112852  54.230.30.5 -> 172.31.36.109 TCP 2962 [TCP segment of a reassembled PDU]
188   0.112866 172.31.36.109 -> 54.230.30.5  TCP 66 59842 > http [ACK] Seq=98 Ack=832525 Win=883072 Len=0 TSval=26787324 TSecr=713573821
189   0.112982  54.230.30.5 -> 172.31.36.109 TCP 13098 [TCP segment of a reassembled PDU]
190   0.113004 172.31.36.109 -> 54.230.30.5  TCP 66 59842 > http [ACK] Seq=98 Ack=845557 Win=883072 Len=0 TSval=26787324 TSecr=713573821
191   0.113049  54.230.30.5 -> 172.31.36.109 TCP 15994 [TCP segment of a reassembled PDU]
192   0.113072 172.31.36.109 -> 54.230.30.5  TCP 66 59842 > http [ACK] Seq=98 Ack=861485 Win=883072 Len=0 TSval=26787324 TSecr=713573821
193   0.113164  54.230.30.5 -> 172.31.36.109 TCP 2962 [TCP segment of a reassembled PDU]
194   0.113351 172.31.36.109 -> 54.230.30.5  TCP 66 59842 > http [ACK] Seq=98 Ack=864381 Win=883072 Len=0 TSval=26787324 TSecr=713573821
195   0.113748  54.230.30.5 -> 172.31.36.109 TCP 8754 [TCP segment of a reassembled PDU]
196   0.113766 172.31.36.109 -> 54.230.30.5  TCP 66 59842 > http [ACK] Seq=98 Ack=873069 Win=883072 Len=0 TSval=26787324 TSecr=713573821
197   0.113803  54.230.30.5 -> 172.31.36.109 TCP 13098 [TCP segment of a reassembled PDU]
198   0.113822 172.31.36.109 -> 54.230.30.5  TCP 66 59842 > http [ACK] Seq=98 Ack=886101 Win=883072 Len=0 TSval=26787324 TSecr=713573821
199   0.113919  54.230.30.5 -> 172.31.36.109 TCP 15994 [TCP segment of a reassembled PDU]
200   0.113940 172.31.36.109 -> 54.230.30.5  TCP 66 59842 > http [ACK] Seq=98 Ack=902029 Win=883072 Len=0 TSval=26787324 TSecr=713573821
201   0.114424  54.230.30.5 -> 172.31.36.109 TCP 5858 [TCP segment of a reassembled PDU]
202   0.114440 172.31.36.109 -> 54.230.30.5  TCP 66 59842 > http [ACK] Seq=98 Ack=907821 Win=883072 Len=0 TSval=26787324 TSecr=713573821
203   0.114625  54.230.30.5 -> 172.31.36.109 TCP 26130 [TCP segment of a reassembled PDU]
204   0.114655 172.31.36.109 -> 54.230.30.5  TCP 66 59842 > http [ACK] Seq=98 Ack=933885 Win=857088 Len=0 TSval=26787324 TSecr=713573821
205   0.114668  54.230.30.5 -> 172.31.36.109 TCP 8754 [TCP segment of a reassembled PDU]
206   0.114677  54.230.30.5 -> 172.31.36.109 TCP 7306 [TCP segment of a reassembled PDU]
207   0.114705 172.31.36.109 -> 54.230.30.5  TCP 66 59842 > http [ACK] Seq=98 Ack=949813 Win=856832 Len=0 TSval=26787324 TSecr=713573821
208   0.114842  54.230.30.5 -> 172.31.36.109 TCP 17442 [TCP segment of a reassembled PDU]
209   0.114853  54.230.30.5 -> 172.31.36.109 TCP 1514 [TCP segment of a reassembled PDU]
210   0.114867 172.31.36.109 -> 54.230.30.5  TCP 66 59842 > http [ACK] Seq=98 Ack=968637 Win=851968 Len=0 TSval=26787324 TSecr=713573821
211   0.115211  54.230.30.5 -> 172.31.36.109 TCP 8754 [TCP segment of a reassembled PDU]
212   0.115231 172.31.36.109 -> 54.230.30.5  TCP 66 59842 > http [ACK] Seq=98 Ack=977325 Win=868736 Len=0 TSval=26787324 TSecr=713573821
213   0.115473  54.230.30.5 -> 172.31.36.109 TCP 13098 [TCP segment of a reassembled PDU]
214   0.115647  54.230.30.5 -> 172.31.36.109 TCP 24682 [TCP segment of a reassembled PDU]
215   0.115711 172.31.36.109 -> 54.230.30.5  TCP 66 59842 > http [ACK] Seq=98 Ack=1014973 Win=842624 Len=0 TSval=26787324 TSecr=713573821
216   0.116003  54.230.30.5 -> 172.31.36.109 TCP 18890 [TCP segment of a reassembled PDU]
217   0.116014 172.31.36.109 -> 54.230.30.5  TCP 66 59842 > http [ACK] Seq=98 Ack=1033797 Win=852096 Len=0 TSval=26787324 TSecr=713573821
218   0.116291  54.230.30.5 -> 172.31.36.109 TCP 14602 [TCP segment of a reassembled PDU]
219   0.116300 172.31.36.109 -> 54.230.30.5  TCP 66 59842 > http [ACK] Seq=98 Ack=1048333 Win=856832 Len=0 TSval=26787324 TSecr=713573821
220   0.120659  54.230.30.5 -> 172.31.36.109 TCP 1514 [TCP segment of a reassembled PDU]
221   0.120796  54.230.30.5 -> 172.31.36.109 TCP 1514 [TCP segment of a reassembled PDU]
222   0.120800 172.31.36.109 -> 54.230.30.5  TCP 66 59842 > http [ACK] Seq=98 Ack=1051229 Win=880640 Len=0 TSval=26787326 TSecr=713573821
223   0.121086  54.230.30.5 -> 172.31.36.109 TCP 7306 [TCP segment of a reassembled PDU]
224   0.121102 172.31.36.109 -> 54.230.30.5  TCP 66 59842 > http [ACK] Seq=98 Ack=1058469 Win=883072 Len=0 TSval=26787326 TSecr=713573821
225   0.121270  54.230.30.5 -> 172.31.36.109 TCP 7378 [TCP segment of a reassembled PDU]
226   0.121280  54.230.30.5 -> 172.31.36.109 TCP 8682 [TCP segment of a reassembled PDU]
227   0.121286  54.230.30.5 -> 172.31.36.109 TCP 5858 [TCP segment of a reassembled PDU]
228   0.121305 172.31.36.109 -> 54.230.30.5  TCP 66 59842 > http [ACK] Seq=98 Ack=1080189 Win=873472 Len=0 TSval=26787326 TSecr=713573821
229   0.121332  54.230.30.5 -> 172.31.36.109 TCP 15994 [TCP segment of a reassembled PDU]
230   0.121348 172.31.36.109 -> 54.230.30.5  TCP 66 59842 > http [ACK] Seq=98 Ack=1096117 Win=883072 Len=0 TSval=26787326 TSecr=713573821
231   0.121486  54.230.30.5 -> 172.31.36.109 TCP 1514 [TCP segment of a reassembled PDU]
232   0.121583  54.230.30.5 -> 172.31.36.109 TCP 16370 [TCP segment of a reassembled PDU]
233   0.121771 172.31.36.109 -> 54.230.30.5  TCP 66 59842 > http [ACK] Seq=98 Ack=1113869 Win=883072 Len=0 TSval=26787326 TSecr=713573821
234   0.150788  54.230.30.5 -> 172.31.36.109 TCP 1514 [TCP segment of a reassembled PDU]
235   0.150993  54.230.30.5 -> 172.31.36.109 TCP 4410 [TCP segment of a reassembled PDU]
236   0.151013 172.31.36.109 -> 54.230.30.5  TCP 66 59842 > http [ACK] Seq=98 Ack=1119661 Win=883072 Len=0 TSval=26787333 TSecr=713573824
237   0.151128  54.230.30.5 -> 172.31.36.109 TCP 20338 [TCP segment of a reassembled PDU]
238   0.151152  54.230.30.5 -> 172.31.36.109 TCP 8754 [TCP segment of a reassembled PDU]
239   0.151171 172.31.36.109 -> 54.230.30.5  TCP 66 59842 > http [ACK] Seq=98 Ack=1148621 Win=854144 Len=0 TSval=26787333 TSecr=713573824
240   0.151280  54.230.30.5 -> 172.31.36.109 TCP 4410 [TCP segment of a reassembled PDU]
241   0.151286 172.31.36.109 -> 54.230.30.5  TCP 66 59842 > http [ACK] Seq=98 Ack=1152965 Win=875904 Len=0 TSval=26787333 TSecr=713573824
242   0.151323  54.230.30.5 -> 172.31.36.109 TCP 8754 [TCP segment of a reassembled PDU]
243   0.151341 172.31.36.109 -> 54.230.30.5  TCP 66 59842 > http [ACK] Seq=98 Ack=1161653 Win=883072 Len=0 TSval=26787333 TSecr=713573824
244   0.151612  54.230.30.5 -> 172.31.36.109 TCP 13098 [TCP segment of a reassembled PDU]
245   0.151627  54.230.30.5 -> 172.31.36.109 TCP 4786 [TCP segment of a reassembled PDU]
246   0.151647 172.31.36.109 -> 54.230.30.5  TCP 66 59842 > http [ACK] Seq=98 Ack=1179405 Win=873472 Len=0 TSval=26787333 TSecr=713573824
247   0.157902  54.230.30.5 -> 172.31.36.109 TCP 1514 [TCP segment of a reassembled PDU]
248   0.158210  54.230.30.5 -> 172.31.36.109 TCP 4410 [TCP segment of a reassembled PDU]
249   0.158216 172.31.36.109 -> 54.230.30.5  TCP 66 59842 > http [ACK] Seq=98 Ack=1185197 Win=875904 Len=0 TSval=26787335 TSecr=713573825
250   0.158325  54.230.30.5 -> 172.31.36.109 TCP 20338 [TCP segment of a reassembled PDU]
251   0.158343  54.230.30.5 -> 172.31.36.109 TCP 2962 [TCP segment of a reassembled PDU]
252   0.158358 172.31.36.109 -> 54.230.30.5  TCP 66 59842 > http [ACK] Seq=98 Ack=1208365 Win=852736 Len=0 TSval=26787335 TSecr=713573825
253   0.158507  54.230.30.5 -> 172.31.36.109 TCP 7306 [TCP segment of a reassembled PDU]
254   0.158514 172.31.36.109 -> 54.230.30.5  TCP 66 59842 > http [ACK] Seq=98 Ack=1215605 Win=871168 Len=0 TSval=26787335 TSecr=713573825
255   0.158569  54.230.30.5 -> 172.31.36.109 TCP 15994 [TCP segment of a reassembled PDU]
256   0.158662 172.31.36.109 -> 54.230.30.5  TCP 66 59842 > http [ACK] Seq=98 Ack=1231533 Win=883072 Len=0 TSval=26787335 TSecr=713573825
257   0.158746  54.230.30.5 -> 172.31.36.109 TCP 5858 [TCP segment of a reassembled PDU]
258   0.158774  54.230.30.5 -> 172.31.36.109 TCP 8754 [TCP segment of a reassembled PDU]
259   0.158921  54.230.30.5 -> 172.31.36.109 TCP 2962 [TCP segment of a reassembled PDU]
260   0.159077  54.230.30.5 -> 172.31.36.109 TCP 18890 [TCP segment of a reassembled PDU]
261   0.159093  54.230.30.5 -> 172.31.36.109 TCP 2962 [TCP segment of a reassembled PDU]
262   0.159466  54.230.30.5 -> 172.31.36.109 TCP 5858 [TCP segment of a reassembled PDU]
263   0.159591  54.230.30.5 -> 172.31.36.109 TCP 4410 [TCP segment of a reassembled PDU]
264   0.159707  54.230.30.5 -> 172.31.36.109 TCP 7306 [TCP segment of a reassembled PDU]
265   0.159852  54.230.30.5 -> 172.31.36.109 TCP 22538 [TCP segment of a reassembled PDU]
266   0.164704 172.31.36.109 -> 54.230.30.5  TCP 66 59842 > http [ACK] Seq=98 Ack=1310477 Win=804224 Len=0 TSval=26787337 TSecr=713573825
267   0.173016  54.230.30.5 -> 172.31.36.109 TCP 1514 [TCP segment of a reassembled PDU]
268   0.173278  54.230.30.5 -> 172.31.36.109 TCP 5858 [TCP segment of a reassembled PDU]
269   0.173286 172.31.36.109 -> 54.230.30.5  TCP 66 59842 > http [ACK] Seq=98 Ack=1317717 Win=873472 Len=0 TSval=26787339 TSecr=713573827
270   0.173370  54.230.30.5 -> 172.31.36.109 TCP 5858 [TCP segment of a reassembled PDU]
271   0.173378 172.31.36.109 -> 54.230.30.5  TCP 66 59842 > http [ACK] Seq=98 Ack=1323509 Win=873472 Len=0 TSval=26787339 TSecr=713573827
272   0.173419  54.230.30.5 -> 172.31.36.109 TCP 11650 [TCP segment of a reassembled PDU]
273   0.173437 172.31.36.109 -> 54.230.30.5  TCP 66 59842 > http [ACK] Seq=98 Ack=1335093 Win=883072 Len=0 TSval=26787339 TSecr=713573827
274   0.173610  54.230.30.5 -> 172.31.36.109 TCP 14546 [TCP segment of a reassembled PDU]
275   0.173678  54.230.30.5 -> 172.31.36.109 TCP 1514 [TCP segment of a reassembled PDU]
276   0.173733  54.230.30.5 -> 172.31.36.109 TCP 13098 [TCP segment of a reassembled PDU]
277   0.173768  54.230.30.5 -> 172.31.36.109 TCP 10202 [TCP segment of a reassembled PDU]
278   0.173795  54.230.30.5 -> 172.31.36.109 TCP 1890 [TCP segment of a reassembled PDU]
279   0.173892 172.31.36.109 -> 54.230.30.5  TCP 66 59842 > http [ACK] Seq=98 Ack=1376013 Win=842240 Len=0 TSval=26787339 TSecr=713573827
280   0.199737  54.230.30.5 -> 172.31.36.109 TCP 10202 [TCP segment of a reassembled PDU]
281   0.199749 172.31.36.109 -> 54.230.30.5  TCP 66 59842 > http [ACK] Seq=98 Ack=1386149 Win=866432 Len=0 TSval=26787345 TSecr=713573829
282   0.199829  54.230.30.5 -> 172.31.36.109 TCP 15994 [TCP segment of a reassembled PDU]
283   0.199844  54.230.30.5 -> 172.31.36.109 TCP 1514 [TCP segment of a reassembled PDU]
284   0.199860 172.31.36.109 -> 54.230.30.5  TCP 66 59842 > http [ACK] Seq=98 Ack=1403525 Win=880640 Len=0 TSval=26787345 TSecr=713573829
285   0.199890  54.230.30.5 -> 172.31.36.109 TCP 4410 [TCP segment of a reassembled PDU]
286   0.199907 172.31.36.109 -> 54.230.30.5  TCP 66 59842 > http [ACK] Seq=98 Ack=1407869 Win=883072 Len=0 TSval=26787345 TSecr=713573829
287   0.200024  54.230.30.5 -> 172.31.36.109 TCP 17442 [TCP segment of a reassembled PDU]
288   0.200046 172.31.36.109 -> 54.230.30.5  TCP 66 59842 > http [ACK] Seq=98 Ack=1425245 Win=865792 Len=0 TSval=26787345 TSecr=713573829
289   0.200204  54.230.30.5 -> 172.31.36.109 TCP 11650 [TCP segment of a reassembled PDU]
290   0.200224 172.31.36.109 -> 54.230.30.5  TCP 66 59842 > http [ACK] Seq=98 Ack=1436829 Win=883072 Len=0 TSval=26787345 TSecr=713573829
291   0.200294  54.230.30.5 -> 172.31.36.109 TCP 4786 [TCP segment of a reassembled PDU]
292   0.200312 172.31.36.109 -> 54.230.30.5  TCP 66 59842 > http [ACK] Seq=98 Ack=1441549 Win=883072 Len=0 TSval=26787345 TSecr=713573829
293   0.205016  54.230.30.5 -> 172.31.36.109 TCP 1514 [TCP segment of a reassembled PDU]
294   0.205284  54.230.30.5 -> 172.31.36.109 TCP 4410 [TCP segment of a reassembled PDU]
295   0.205296 172.31.36.109 -> 54.230.30.5  TCP 66 59842 > http [ACK] Seq=98 Ack=1447341 Win=883072 Len=0 TSval=26787347 TSecr=713573830
296   0.205411  54.230.30.5 -> 172.31.36.109 TCP 18890 [TCP segment of a reassembled PDU]
297   0.205451  54.230.30.5 -> 172.31.36.109 TCP 11650 [TCP segment of a reassembled PDU]
298   0.205598  54.230.30.5 -> 172.31.36.109 TCP 5858 [TCP segment of a reassembled PDU]
299   0.205646 172.31.36.109 -> 54.230.30.5  TCP 66 59842 > http [ACK] Seq=98 Ack=1483541 Win=846976 Len=0 TSval=26787347 TSecr=713573830
300   0.205674  54.230.30.5 -> 172.31.36.109 TCP 15994 [TCP segment of a reassembled PDU]
301   0.205694 172.31.36.109 -> 54.230.30.5  TCP 66 59842 > http [ACK] Seq=98 Ack=1499469 Win=847232 Len=0 TSval=26787347 TSecr=713573830
302   0.205801  54.230.30.5 -> 172.31.36.109 TCP 2962 [TCP segment of a reassembled PDU]
303   0.205806 172.31.36.109 -> 54.230.30.5  TCP 66 59842 > http [ACK] Seq=98 Ack=1502365 Win=878208 Len=0 TSval=26787347 TSecr=713573830
304   0.205901  54.230.30.5 -> 172.31.36.109 TCP 2962 [TCP segment of a reassembled PDU]
305   0.205906 172.31.36.109 -> 54.230.30.5  TCP 66 59842 > http [ACK] Seq=98 Ack=1505261 Win=878208 Len=0 TSval=26787347 TSecr=713573830
306   0.205924  54.230.30.5 -> 172.31.36.109 TCP 1890 [TCP segment of a reassembled PDU]
307   0.205928 172.31.36.109 -> 54.230.30.5  TCP 66 59842 > http [ACK] Seq=98 Ack=1507085 Win=878208 Len=0 TSval=26787347 TSecr=713573830
308   0.209155  54.230.30.5 -> 172.31.36.109 TCP 1514 [TCP segment of a reassembled PDU]
309   0.209412  54.230.30.5 -> 172.31.36.109 TCP 4410 [TCP segment of a reassembled PDU]
310   0.209429 172.31.36.109 -> 54.230.30.5  TCP 66 59842 > http [ACK] Seq=98 Ack=1512877 Win=883072 Len=0 TSval=26787348 TSecr=713573830
311   0.209512  54.230.30.5 -> 172.31.36.109 TCP 10202 [TCP segment of a reassembled PDU]
312   0.209533 172.31.36.109 -> 54.230.30.5  TCP 66 59842 > http [ACK] Seq=98 Ack=1523013 Win=883072 Len=0 TSval=26787348 TSecr=713573830
313   0.209727  54.230.30.5 -> 172.31.36.109 TCP 10202 [TCP segment of a reassembled PDU]
314   0.209755  54.230.30.5 -> 172.31.36.109 TCP 7306 [TCP segment of a reassembled PDU]
315   0.209763 172.31.36.109 -> 54.230.30.5  TCP 66 59842 > http [ACK] Seq=98 Ack=1533149 Win=883072 Len=0 TSval=26787348 TSecr=713573830
316   0.209775 172.31.36.109 -> 54.230.30.5  TCP 66 59842 > http [ACK] Seq=98 Ack=1540389 Win=883072 Len=0 TSval=26787348 TSecr=713573830
317   0.209808  54.230.30.5 -> 172.31.36.109 TCP 13098 [TCP segment of a reassembled PDU]
318   0.209833 172.31.36.109 -> 54.230.30.5  TCP 66 59842 > http [ACK] Seq=98 Ack=1553421 Win=883072 Len=0 TSval=26787348 TSecr=713573830
319   0.209870  54.230.30.5 -> 172.31.36.109 TCP 2962 [TCP segment of a reassembled PDU]
320   0.209886 172.31.36.109 -> 54.230.30.5  TCP 66 59842 > http [ACK] Seq=98 Ack=1556317 Win=883072 Len=0 TSval=26787348 TSecr=713573830
321   0.209985  54.230.30.5 -> 172.31.36.109 TCP 2962 [TCP segment of a reassembled PDU]
322   0.210002 172.31.36.109 -> 54.230.30.5  TCP 66 59842 > http [ACK] Seq=98 Ack=1559213 Win=883072 Len=0 TSval=26787348 TSecr=713573830
323   0.210042  54.230.30.5 -> 172.31.36.109 TCP 13474 [TCP segment of a reassembled PDU]
324   0.210068 172.31.36.109 -> 54.230.30.5  TCP 66 59842 > http [ACK] Seq=98 Ack=1572621 Win=883072 Len=0 TSval=26787348 TSecr=713573830
325   0.226015  54.230.30.5 -> 172.31.36.109 TCP 1514 [TCP segment of a reassembled PDU]
326   0.226286  54.230.30.5 -> 172.31.36.109 TCP 5858 [TCP segment of a reassembled PDU]
327   0.226306 172.31.36.109 -> 54.230.30.5  TCP 66 59842 > http [ACK] Seq=98 Ack=1579861 Win=883072 Len=0 TSval=26787352 TSecr=713573832
328   0.226410  54.230.30.5 -> 172.31.36.109 TCP 18890 [TCP segment of a reassembled PDU]
329   0.226425  54.230.30.5 -> 172.31.36.109 TCP 2962 [TCP segment of a reassembled PDU]
330   0.226441 172.31.36.109 -> 54.230.30.5  TCP 66 59842 > http [ACK] Seq=98 Ack=1601581 Win=861440 Len=0 TSval=26787352 TSecr=713573832
331   0.226648  54.230.30.5 -> 172.31.36.109 TCP 11650 [TCP segment of a reassembled PDU]
332   0.226656 172.31.36.109 -> 54.230.30.5  TCP 66 59842 > http [ACK] Seq=98 Ack=1613165 Win=864000 Len=0 TSval=26787352 TSecr=713573832
333   0.226670  54.230.30.5 -> 172.31.36.109 TCP 8754 [TCP segment of a reassembled PDU]
334   0.226693 172.31.36.109 -> 54.230.30.5  TCP 66 59842 > http [ACK] Seq=98 Ack=1621853 Win=868736 Len=0 TSval=26787352 TSecr=713573832
335   0.226818  54.230.30.5 -> 172.31.36.109 TCP 10202 [TCP segment of a reassembled PDU]
336   0.226841 172.31.36.109 -> 54.230.30.5  TCP 66 59842 > http [ACK] Seq=98 Ack=1631989 Win=883072 Len=0 TSval=26787352 TSecr=713573832
337   0.226885  54.230.30.5 -> 172.31.36.109 TCP 18890 [TCP segment of a reassembled PDU]
338   0.226908 172.31.36.109 -> 54.230.30.5  TCP 66 59842 > http [ACK] Seq=98 Ack=1650813 Win=864256 Len=0 TSval=26787352 TSecr=713573832
339   0.227007  54.230.30.5 -> 172.31.36.109 TCP 1514 [TCP segment of a reassembled PDU]
340   0.227124  54.230.30.5 -> 172.31.36.109 TCP 2962 [TCP segment of a reassembled PDU]
341   0.227129 172.31.36.109 -> 54.230.30.5  TCP 66 59842 > http [ACK] Seq=98 Ack=1655157 Win=878208 Len=0 TSval=26787352 TSecr=713573832
342   0.227214  54.230.30.5 -> 172.31.36.109 TCP 20338 [TCP segment of a reassembled PDU]
343   0.227241 172.31.36.109 -> 54.230.30.5  TCP 66 59842 > http [ACK] Seq=98 Ack=1675429 Win=857984 Len=0 TSval=26787352 TSecr=713573832
344   0.227554  54.230.30.5 -> 172.31.36.109 TCP 4410 [TCP segment of a reassembled PDU]
345   0.227560 172.31.36.109 -> 54.230.30.5  TCP 66 59842 > http [ACK] Seq=98 Ack=1679773 Win=875904 Len=0 TSval=26787352 TSecr=713573832
346   0.227684  54.230.30.5 -> 172.31.36.109 TCP 17442 [TCP segment of a reassembled PDU]
347   0.227707 172.31.36.109 -> 54.230.30.5  TCP 66 59842 > http [ACK] Seq=98 Ack=1697149 Win=858624 Len=0 TSval=26787352 TSecr=713573832
348   0.227922  54.230.30.5 -> 172.31.36.109 TCP 20338 [TCP segment of a reassembled PDU]
349   0.228048  54.230.30.5 -> 172.31.36.109 TCP 4410 [TCP segment of a reassembled PDU]
350   0.228141 172.31.36.109 -> 54.230.30.5  TCP 66 59842 > http [ACK] Seq=98 Ack=1721765 Win=842496 Len=0 TSval=26787352 TSecr=713573832
351   0.228175  54.230.30.5 -> 172.31.36.109 TCP 8754 [TCP segment of a reassembled PDU]
352   0.228181 172.31.36.109 -> 54.230.30.5  TCP 66 59842 > http [ACK] Seq=98 Ack=1730453 Win=868736 Len=0 TSval=26787352 TSecr=713573832
353   0.228449  54.230.30.5 -> 172.31.36.109 TCP 26130 [TCP segment of a reassembled PDU]
354   0.228470  54.230.30.5 -> 172.31.36.109 TCP 10202 [TCP segment of a reassembled PDU]
355   0.228488 172.31.36.109 -> 54.230.30.5  TCP 66 59842 > http [ACK] Seq=98 Ack=1766653 Win=832640 Len=0 TSval=26787352 TSecr=713573832
356   0.228651  54.230.30.5 -> 172.31.36.109 TCP 15994 [TCP segment of a reassembled PDU]
357   0.228661 172.31.36.109 -> 54.230.30.5  TCP 66 59842 > http [ACK] Seq=98 Ack=1782581 Win=856832 Len=0 TSval=26787353 TSecr=713573832
358   0.228880  54.230.30.5 -> 172.31.36.109 TCP 14546 [TCP segment of a reassembled PDU]
359   0.228889 172.31.36.109 -> 54.230.30.5  TCP 66 59842 > http [ACK] Seq=98 Ack=1797061 Win=859136 Len=0 TSval=26787353 TSecr=713573832
360   0.228981  54.230.30.5 -> 172.31.36.109 TCP 7306 [TCP segment of a reassembled PDU]
