[Measurement for 10mb at 09:31:16 20.31.2014] 
Tshark:

  1   0.000000 172.31.36.109 -> 172.31.0.2   DNS 89 Standard query 0x19bb  A d3796nkzln59xv.cloudfront.net
  2   0.000030 172.31.36.109 -> 172.31.0.2   DNS 89 Standard query 0x7757  AAAA d3796nkzln59xv.cloudfront.net
  3   0.000349   172.31.0.2 -> 172.31.36.109 DNS 217 Standard query response 0x19bb  A 54.192.30.221 A 54.230.30.2 A 54.230.30.69 A 54.230.30.207 A 54.192.30.139 A 54.192.30.185 A 54.192.30.193 A 54.192.30.217
  4   0.000361   172.31.0.2 -> 172.31.36.109 DNS 170 Standard query response 0x7757 
  5   0.003877 172.31.36.109 -> 54.192.30.221 TCP 74 44654 > http [SYN] Seq=0 Win=26883 Len=0 MSS=8961 SACK_PERM=1 TSval=34890806 TSecr=0 WS=128
  6   0.005531 54.192.30.221 -> 172.31.36.109 TCP 74 http > 44654 [SYN, ACK] Seq=0 Ack=1 Win=14480 Len=0 MSS=1460 SACK_PERM=1 TSval=644072156 TSecr=34890806 WS=128
  7   0.005546 172.31.36.109 -> 54.192.30.221 TCP 66 44654 > http [ACK] Seq=1 Ack=1 Win=27008 Len=0 TSval=34890807 TSecr=644072156
  8   0.005591 172.31.36.109 -> 54.192.30.221 HTTP 163 GET /10mb HTTP/1.1 
  9   0.006792 54.192.30.221 -> 172.31.36.109 TCP 66 http > 44654 [ACK] Seq=1 Ack=98 Win=14592 Len=0 TSval=644072156 TSecr=34890807
 10   0.028852 54.192.30.221 -> 172.31.36.109 TCP 2962 [TCP segment of a reassembled PDU]
 11   0.028862 172.31.36.109 -> 54.192.30.221 TCP 66 44654 > http [ACK] Seq=98 Ack=2897 Win=32768 Len=0 TSval=34890813 TSecr=644072158
 12   0.028880 54.192.30.221 -> 172.31.36.109 TCP 10202 [TCP segment of a reassembled PDU]
 13   0.028887 172.31.36.109 -> 54.192.30.221 TCP 66 44654 > http [ACK] Seq=98 Ack=13033 Win=52992 Len=0 TSval=34890813 TSecr=644072158
 14   0.030086 54.192.30.221 -> 172.31.36.109 TCP 1514 [TCP segment of a reassembled PDU]
 15   0.030092 172.31.36.109 -> 54.192.30.221 TCP 66 44654 > http [ACK] Seq=98 Ack=14481 Win=55936 Len=0 TSval=34890813 TSecr=644072158
 16   0.030127 54.192.30.221 -> 172.31.36.109 TCP 11650 [TCP segment of a reassembled PDU]
 17   0.030137 172.31.36.109 -> 54.192.30.221 TCP 66 44654 > http [ACK] Seq=98 Ack=26065 Win=79104 Len=0 TSval=34890813 TSecr=644072158
 18   0.031414 54.192.30.221 -> 172.31.36.109 TCP 7306 [TCP segment of a reassembled PDU]
 19   0.031422 172.31.36.109 -> 54.192.30.221 TCP 66 44654 > http [ACK] Seq=98 Ack=33305 Win=93568 Len=0 TSval=34890813 TSecr=644072158
 20   0.031438 54.192.30.221 -> 172.31.36.109 TCP 8754 [TCP segment of a reassembled PDU]
 21   0.031444 172.31.36.109 -> 54.192.30.221 TCP 66 44654 > http [ACK] Seq=98 Ack=41993 Win=91648 Len=0 TSval=34890813 TSecr=644072158
 22   0.031661 54.192.30.221 -> 172.31.36.109 TCP 4410 [TCP segment of a reassembled PDU]
 23   0.031668 172.31.36.109 -> 54.192.30.221 TCP 66 44654 > http [ACK] Seq=98 Ack=46337 Win=102272 Len=0 TSval=34890813 TSecr=644072158
 24   0.032643 54.192.30.221 -> 172.31.36.109 TCP 2962 [TCP segment of a reassembled PDU]
 25   0.032649 172.31.36.109 -> 54.192.30.221 TCP 66 44654 > http [ACK] Seq=98 Ack=49233 Win=108032 Len=0 TSval=34890814 TSecr=644072159
 26   0.032735 54.192.30.221 -> 172.31.36.109 TCP 13098 [TCP segment of a reassembled PDU]
 27   0.032744 172.31.36.109 -> 54.192.30.221 TCP 66 44654 > http [ACK] Seq=98 Ack=62265 Win=134144 Len=0 TSval=34890814 TSecr=644072159
 28   0.032879 54.192.30.221 -> 172.31.36.109 TCP 2962 [TCP segment of a reassembled PDU]
 29   0.032885 172.31.36.109 -> 54.192.30.221 TCP 66 44654 > http [ACK] Seq=98 Ack=65161 Win=139904 Len=0 TSval=34890814 TSecr=644072159
 30   0.033906 54.192.30.221 -> 172.31.36.109 TCP 2962 [TCP segment of a reassembled PDU]
 31   0.033922 172.31.36.109 -> 54.192.30.221 TCP 66 44654 > http [ACK] Seq=98 Ack=68057 Win=145664 Len=0 TSval=34890814 TSecr=644072159
 32   0.034065 54.192.30.221 -> 172.31.36.109 TCP 14546 [TCP segment of a reassembled PDU]
 33   0.034075 172.31.36.109 -> 54.192.30.221 TCP 66 44654 > http [ACK] Seq=98 Ack=82537 Win=174592 Len=0 TSval=34890814 TSecr=644072159
 34   0.034187 54.192.30.221 -> 172.31.36.109 TCP 4410 [TCP segment of a reassembled PDU]
 35   0.034193 172.31.36.109 -> 54.192.30.221 TCP 66 44654 > http [ACK] Seq=98 Ack=86881 Win=183296 Len=0 TSval=34890814 TSecr=644072159
 36   0.034248 54.192.30.221 -> 172.31.36.109 TCP 2962 [TCP segment of a reassembled PDU]
 37   0.034253 172.31.36.109 -> 54.192.30.221 TCP 66 44654 > http [ACK] Seq=98 Ack=89777 Win=189184 Len=0 TSval=34890814 TSecr=644072159
 38   0.035467 54.192.30.221 -> 172.31.36.109 TCP 4410 [TCP segment of a reassembled PDU]
 39   0.035482 172.31.36.109 -> 54.192.30.221 TCP 66 44654 > http [ACK] Seq=98 Ack=94121 Win=197760 Len=0 TSval=34890814 TSecr=644072159
 40   0.035617 54.192.30.221 -> 172.31.36.109 TCP 11650 [TCP segment of a reassembled PDU]
 41   0.035626 172.31.36.109 -> 54.192.30.221 TCP 66 44654 > http [ACK] Seq=98 Ack=105705 Win=220928 Len=0 TSval=34890814 TSecr=644072159
 42   0.035759 54.192.30.221 -> 172.31.36.109 TCP 14546 [TCP segment of a reassembled PDU]
 43   0.035779 172.31.36.109 -> 54.192.30.221 TCP 66 44654 > http [ACK] Seq=98 Ack=120185 Win=249984 Len=0 TSval=34890814 TSecr=644072159
 44   0.036743 54.192.30.221 -> 172.31.36.109 TCP 2962 [TCP segment of a reassembled PDU]
 45   0.036749 172.31.36.109 -> 54.192.30.221 TCP 66 44654 > http [ACK] Seq=98 Ack=123081 Win=255744 Len=0 TSval=34890815 TSecr=644072159
 46   0.036848 54.192.30.221 -> 172.31.36.109 TCP 7306 [TCP segment of a reassembled PDU]
 47   0.036856 172.31.36.109 -> 54.192.30.221 TCP 66 44654 > http [ACK] Seq=98 Ack=130321 Win=270208 Len=0 TSval=34890815 TSecr=644072159
 48   0.037072 54.192.30.221 -> 172.31.36.109 TCP 20338 [TCP segment of a reassembled PDU]
 49   0.037084 172.31.36.109 -> 54.192.30.221 TCP 66 44654 > http [ACK] Seq=98 Ack=150593 Win=310784 Len=0 TSval=34890815 TSecr=644072159
 50   0.037135 54.192.30.221 -> 172.31.36.109 TCP 1514 [TCP segment of a reassembled PDU]
 51   0.037139 172.31.36.109 -> 54.192.30.221 TCP 66 44654 > http [ACK] Seq=98 Ack=152041 Win=313600 Len=0 TSval=34890815 TSecr=644072159
 52   0.037254 54.192.30.221 -> 172.31.36.109 TCP 7306 [TCP segment of a reassembled PDU]
 53   0.037262 172.31.36.109 -> 54.192.30.221 TCP 66 44654 > http [ACK] Seq=98 Ack=159281 Win=328192 Len=0 TSval=34890815 TSecr=644072159
 54   0.038366 54.192.30.221 -> 172.31.36.109 TCP 5858 [TCP segment of a reassembled PDU]
 55   0.038373 172.31.36.109 -> 54.192.30.221 TCP 66 44654 > http [ACK] Seq=98 Ack=165073 Win=339712 Len=0 TSval=34890815 TSecr=644072159
 56   0.038387 54.192.30.221 -> 172.31.36.109 TCP 7306 [TCP segment of a reassembled PDU]
 57   0.038392 172.31.36.109 -> 54.192.30.221 TCP 66 44654 > http [ACK] Seq=98 Ack=172313 Win=354176 Len=0 TSval=34890815 TSecr=644072159
 58   0.038645 54.192.30.221 -> 172.31.36.109 TCP 20338 [TCP segment of a reassembled PDU]
 59   0.038656 172.31.36.109 -> 54.192.30.221 TCP 66 44654 > http [ACK] Seq=98 Ack=192585 Win=394752 Len=0 TSval=34890815 TSecr=644072159
 60   0.038664 54.192.30.221 -> 172.31.36.109 TCP 2962 [TCP segment of a reassembled PDU]
 61   0.038671 172.31.36.109 -> 54.192.30.221 TCP 66 44654 > http [ACK] Seq=98 Ack=195481 Win=400512 Len=0 TSval=34890815 TSecr=644072159
 62   0.039546 54.192.30.221 -> 172.31.36.109 TCP 4410 [TCP segment of a reassembled PDU]
 63   0.039552 172.31.36.109 -> 54.192.30.221 TCP 66 44654 > http [ACK] Seq=98 Ack=199825 Win=409216 Len=0 TSval=34890815 TSecr=644072159
 64   0.039674 54.192.30.221 -> 172.31.36.109 TCP 11650 [TCP segment of a reassembled PDU]
 65   0.039681 172.31.36.109 -> 54.192.30.221 TCP 66 44654 > http [ACK] Seq=98 Ack=211409 Win=432384 Len=0 TSval=34890815 TSecr=644072159
 66   0.039924 54.192.30.221 -> 172.31.36.109 TCP 21786 [TCP segment of a reassembled PDU]
 67   0.039936 172.31.36.109 -> 54.192.30.221 TCP 66 44654 > http [ACK] Seq=98 Ack=233129 Win=475776 Len=0 TSval=34890815 TSecr=644072159
 68   0.040032 54.192.30.221 -> 172.31.36.109 TCP 1514 [TCP segment of a reassembled PDU]
 69   0.040037 172.31.36.109 -> 54.192.30.221 TCP 66 44654 > http [ACK] Seq=98 Ack=234577 Win=478720 Len=0 TSval=34890815 TSecr=644072159
 70   0.040170 54.192.30.221 -> 172.31.36.109 TCP 8754 [TCP segment of a reassembled PDU]
 71   0.040177 172.31.36.109 -> 54.192.30.221 TCP 66 44654 > http [ACK] Seq=98 Ack=243265 Win=496128 Len=0 TSval=34890815 TSecr=644072159
 72   0.040885 54.192.30.221 -> 172.31.36.109 TCP 4410 [TCP segment of a reassembled PDU]
 73   0.040891 172.31.36.109 -> 54.192.30.221 TCP 66 44654 > http [ACK] Seq=98 Ack=247609 Win=504832 Len=0 TSval=34890816 TSecr=644072159
 74   0.041012 54.192.30.221 -> 172.31.36.109 TCP 13098 [TCP segment of a reassembled PDU]
 75   0.041021 172.31.36.109 -> 54.192.30.221 TCP 66 44654 > http [ACK] Seq=98 Ack=260641 Win=530816 Len=0 TSval=34890816 TSecr=644072159
 76   0.041091 54.192.30.221 -> 172.31.36.109 TCP 4410 [TCP segment of a reassembled PDU]
 77   0.041097 172.31.36.109 -> 54.192.30.221 TCP 66 44654 > http [ACK] Seq=98 Ack=264985 Win=539520 Len=0 TSval=34890816 TSecr=644072159
 78   0.041229 54.192.30.221 -> 172.31.36.109 TCP 14546 [TCP segment of a reassembled PDU]
 79   0.041237 172.31.36.109 -> 54.192.30.221 TCP 66 44654 > http [ACK] Seq=98 Ack=279465 Win=568448 Len=0 TSval=34890816 TSecr=644072159
 80   0.041336 54.192.30.221 -> 172.31.36.109 TCP 5858 [TCP segment of a reassembled PDU]
 81   0.041343 172.31.36.109 -> 54.192.30.221 TCP 66 44654 > http [ACK] Seq=98 Ack=285257 Win=580096 Len=0 TSval=34890816 TSecr=644072159
 82   0.041443 54.192.30.221 -> 172.31.36.109 TCP 4410 [TCP segment of a reassembled PDU]
 83   0.041449 172.31.36.109 -> 54.192.30.221 TCP 66 44654 > http [ACK] Seq=98 Ack=289601 Win=588800 Len=0 TSval=34890816 TSecr=644072159
 84   0.042367 54.192.30.221 -> 172.31.36.109 TCP 1514 [TCP segment of a reassembled PDU]
 85   0.042372 172.31.36.109 -> 54.192.30.221 TCP 66 44654 > http [ACK] Seq=98 Ack=291049 Win=591616 Len=0 TSval=34890816 TSecr=644072159
 86   0.042925 54.192.30.221 -> 172.31.36.109 TCP 26130 [TCP segment of a reassembled PDU]
 87   0.042939 172.31.36.109 -> 54.192.30.221 TCP 66 44654 > http [ACK] Seq=98 Ack=317113 Win=643840 Len=0 TSval=34890816 TSecr=644072159
 88   0.042985 54.192.30.221 -> 172.31.36.109 TCP 26130 [TCP segment of a reassembled PDU]
 89   0.043001 172.31.36.109 -> 54.192.30.221 TCP 66 44654 > http [ACK] Seq=98 Ack=343177 Win=695936 Len=0 TSval=34890816 TSecr=644072159
 90   0.043024 54.192.30.221 -> 172.31.36.109 TCP 8754 [TCP segment of a reassembled PDU]
 91   0.043030 172.31.36.109 -> 54.192.30.221 TCP 66 44654 > http [ACK] Seq=98 Ack=351865 Win=713344 Len=0 TSval=34890816 TSecr=644072159
 92   0.044185 54.192.30.221 -> 172.31.36.109 TCP 4410 [TCP segment of a reassembled PDU]
 93   0.044191 172.31.36.109 -> 54.192.30.221 TCP 66 44654 > http [ACK] Seq=98 Ack=356209 Win=722048 Len=0 TSval=34890816 TSecr=644072160
 94   0.044337 54.192.30.221 -> 172.31.36.109 TCP 13098 [TCP segment of a reassembled PDU]
 95   0.044346 172.31.36.109 -> 54.192.30.221 TCP 66 44654 > http [ACK] Seq=98 Ack=369241 Win=748032 Len=0 TSval=34890816 TSecr=644072160
 96   0.044533 54.192.30.221 -> 172.31.36.109 TCP 21786 [TCP segment of a reassembled PDU]
 97   0.044543 172.31.36.109 -> 54.192.30.221 TCP 66 44654 > http [ACK] Seq=98 Ack=390961 Win=748160 Len=0 TSval=34890817 TSecr=644072160
 98   0.044550 54.192.30.221 -> 172.31.36.109 TCP 3526 [TCP segment of a reassembled PDU]
 99   0.044553 172.31.36.109 -> 54.192.30.221 TCP 66 44654 > http [ACK] Seq=98 Ack=394421 Win=744704 Len=0 TSval=34890817 TSecr=644072160
100   0.044564 54.192.30.221 -> 172.31.36.109 TCP 7306 [TCP segment of a reassembled PDU]
101   0.044568 172.31.36.109 -> 54.192.30.221 TCP 66 44654 > http [ACK] Seq=98 Ack=401661 Win=737536 Len=0 TSval=34890817 TSecr=644072160
102   0.044655 54.192.30.221 -> 172.31.36.109 TCP 4410 [TCP segment of a reassembled PDU]
103   0.044660 172.31.36.109 -> 54.192.30.221 TCP 66 44654 > http [ACK] Seq=98 Ack=406005 Win=776704 Len=0 TSval=34890817 TSecr=644072160
104   0.044792 54.192.30.221 -> 172.31.36.109 TCP 13098 [TCP segment of a reassembled PDU]
105   0.044803 172.31.36.109 -> 54.192.30.221 TCP 66 44654 > http [ACK] Seq=98 Ack=419037 Win=763776 Len=0 TSval=34890817 TSecr=644072160
106   0.045462 54.192.30.221 -> 172.31.36.109 TCP 5858 [TCP segment of a reassembled PDU]
107   0.045470 172.31.36.109 -> 54.192.30.221 TCP 66 44654 > http [ACK] Seq=98 Ack=424829 Win=774400 Len=0 TSval=34890817 TSecr=644072160
108   0.045570 54.192.30.221 -> 172.31.36.109 TCP 5858 [TCP segment of a reassembled PDU]
109   0.045576 172.31.36.109 -> 54.192.30.221 TCP 66 44654 > http [ACK] Seq=98 Ack=430621 Win=774400 Len=0 TSval=34890817 TSecr=644072160
110   0.045675 54.192.30.221 -> 172.31.36.109 TCP 1514 [TCP segment of a reassembled PDU]
111   0.045818 54.192.30.221 -> 172.31.36.109 TCP 13098 [TCP segment of a reassembled PDU]
112   0.045838 172.31.36.109 -> 54.192.30.221 TCP 66 44654 > http [ACK] Seq=98 Ack=445101 Win=784000 Len=0 TSval=34890817 TSecr=644072160
113   0.045937 54.192.30.221 -> 172.31.36.109 TCP 4410 [TCP segment of a reassembled PDU]
114   0.045953 172.31.36.109 -> 54.192.30.221 TCP 66 44654 > http [ACK] Seq=98 Ack=449445 Win=784000 Len=0 TSval=34890817 TSecr=644072160
115   0.046053 54.192.30.221 -> 172.31.36.109 TCP 9130 [TCP segment of a reassembled PDU]
116   0.046074 172.31.36.109 -> 54.192.30.221 TCP 66 44654 > http [ACK] Seq=98 Ack=458509 Win=784000 Len=0 TSval=34890817 TSecr=644072160
117   0.055975 54.192.30.221 -> 172.31.36.109 TCP 8754 [TCP segment of a reassembled PDU]
118   0.056012 172.31.36.109 -> 54.192.30.221 TCP 66 44654 > http [ACK] Seq=98 Ack=467197 Win=784000 Len=0 TSval=34890819 TSecr=644072161
119   0.056129 54.192.30.221 -> 172.31.36.109 TCP 5858 [TCP segment of a reassembled PDU]
120   0.056150 54.192.30.221 -> 172.31.36.109 TCP 17442 [TCP segment of a reassembled PDU]
121   0.056174 172.31.36.109 -> 54.192.30.221 TCP 66 44654 > http [ACK] Seq=98 Ack=490365 Win=760832 Len=0 TSval=34890819 TSecr=644072161
122   0.056194 54.192.30.221 -> 172.31.36.109 TCP 2962 [TCP segment of a reassembled PDU]
123   0.056202 172.31.36.109 -> 54.192.30.221 TCP 66 44654 > http [ACK] Seq=98 Ack=493261 Win=779136 Len=0 TSval=34890819 TSecr=644072161
124   0.056322 54.192.30.221 -> 172.31.36.109 TCP 4410 [TCP segment of a reassembled PDU]
125   0.056342 172.31.36.109 -> 54.192.30.221 TCP 66 44654 > http [ACK] Seq=98 Ack=497605 Win=784000 Len=0 TSval=34890819 TSecr=644072161
126   0.056388 54.192.30.221 -> 172.31.36.109 TCP 15994 [TCP segment of a reassembled PDU]
127   0.056419 54.192.30.221 -> 172.31.36.109 TCP 8754 [TCP segment of a reassembled PDU]
128   0.056653 172.31.36.109 -> 54.192.30.221 TCP 66 44654 > http [ACK] Seq=98 Ack=522221 Win=769664 Len=0 TSval=34890820 TSecr=644072161
129   0.056996 54.192.30.221 -> 172.31.36.109 TCP 8754 [TCP segment of a reassembled PDU]
130   0.057004 172.31.36.109 -> 54.192.30.221 TCP 66 44654 > http [ACK] Seq=98 Ack=530909 Win=769664 Len=0 TSval=34890820 TSecr=644072161
131   0.057225 54.192.30.221 -> 172.31.36.109 TCP 8754 [TCP segment of a reassembled PDU]
132   0.057233 172.31.36.109 -> 54.192.30.221 TCP 66 44654 > http [ACK] Seq=98 Ack=539597 Win=769664 Len=0 TSval=34890820 TSecr=644072161
133   0.057324 54.192.30.221 -> 172.31.36.109 TCP 1514 [TCP segment of a reassembled PDU]
134   0.057485 54.192.30.221 -> 172.31.36.109 TCP 4410 [TCP segment of a reassembled PDU]
135   0.057491 172.31.36.109 -> 54.192.30.221 TCP 66 44654 > http [ACK] Seq=98 Ack=545389 Win=776704 Len=0 TSval=34890820 TSecr=644072161
136   0.057590 54.192.30.221 -> 172.31.36.109 TCP 5858 [TCP segment of a reassembled PDU]
137   0.057607 172.31.36.109 -> 54.192.30.221 TCP 66 44654 > http [ACK] Seq=98 Ack=551181 Win=784000 Len=0 TSval=34890820 TSecr=644072161
138   0.057838 54.192.30.221 -> 172.31.36.109 TCP 24682 [TCP segment of a reassembled PDU]
139   0.057864 172.31.36.109 -> 54.192.30.221 TCP 66 44654 > http [ACK] Seq=98 Ack=575797 Win=759424 Len=0 TSval=34890820 TSecr=644072161
140   0.058044 54.192.30.221 -> 172.31.36.109 TCP 15994 [TCP segment of a reassembled PDU]
141   0.058068 172.31.36.109 -> 54.192.30.221 TCP 66 44654 > http [ACK] Seq=98 Ack=591725 Win=784000 Len=0 TSval=34890820 TSecr=644072161
142   0.058121 54.192.30.221 -> 172.31.36.109 TCP 1514 [TCP segment of a reassembled PDU]
143   0.058243 54.192.30.221 -> 172.31.36.109 TCP 5858 [TCP segment of a reassembled PDU]
144   0.058260 172.31.36.109 -> 54.192.30.221 TCP 66 44654 > http [ACK] Seq=98 Ack=598965 Win=784000 Len=0 TSval=34890820 TSecr=644072161
145   0.058350 54.192.30.221 -> 172.31.36.109 TCP 7306 [TCP segment of a reassembled PDU]
146   0.058367 172.31.36.109 -> 54.192.30.221 TCP 66 44654 > http [ACK] Seq=98 Ack=606205 Win=784000 Len=0 TSval=34890820 TSecr=644072161
147   0.058766 54.192.30.221 -> 172.31.36.109 TCP 1514 [TCP segment of a reassembled PDU]
148   0.058995 54.192.30.221 -> 172.31.36.109 TCP 2962 [TCP segment of a reassembled PDU]
149   0.059010 172.31.36.109 -> 54.192.30.221 TCP 66 44654 > http [ACK] Seq=98 Ack=610549 Win=784000 Len=0 TSval=34890820 TSecr=644072161
150   0.059117 54.192.30.221 -> 172.31.36.109 TCP 13098 [TCP segment of a reassembled PDU]
151   0.059138 172.31.36.109 -> 54.192.30.221 TCP 66 44654 > http [ACK] Seq=98 Ack=623581 Win=784000 Len=0 TSval=34890820 TSecr=644072161
152   0.059257 54.192.30.221 -> 172.31.36.109 TCP 26130 [TCP segment of a reassembled PDU]
153   0.059274 54.192.30.221 -> 172.31.36.109 TCP 5538 [TCP segment of a reassembled PDU]
154   0.059395 172.31.36.109 -> 54.192.30.221 TCP 66 44654 > http [ACK] Seq=98 Ack=655117 Win=752512 Len=0 TSval=34890820 TSecr=644072161
155   0.071295 54.192.30.221 -> 172.31.36.109 TCP 4410 [TCP segment of a reassembled PDU]
156   0.071302 172.31.36.109 -> 54.192.30.221 TCP 66 44654 > http [ACK] Seq=98 Ack=659461 Win=776704 Len=0 TSval=34890823 TSecr=644072162
157   0.071421 54.192.30.221 -> 172.31.36.109 TCP 8754 [TCP segment of a reassembled PDU]
158   0.071442 172.31.36.109 -> 54.192.30.221 TCP 66 44654 > http [ACK] Seq=98 Ack=668149 Win=784000 Len=0 TSval=34890823 TSecr=644072162
159   0.071494 54.192.30.221 -> 172.31.36.109 TCP 11650 [TCP segment of a reassembled PDU]
160   0.071516 172.31.36.109 -> 54.192.30.221 TCP 66 44654 > http [ACK] Seq=98 Ack=679733 Win=784000 Len=0 TSval=34890823 TSecr=644072162
161   0.071668 54.192.30.221 -> 172.31.36.109 TCP 13098 [TCP segment of a reassembled PDU]
162   0.071691 172.31.36.109 -> 54.192.30.221 TCP 66 44654 > http [ACK] Seq=98 Ack=692765 Win=784000 Len=0 TSval=34890823 TSecr=644072162
163   0.071740 54.192.30.221 -> 172.31.36.109 TCP 15994 [TCP segment of a reassembled PDU]
164   0.071765 172.31.36.109 -> 54.192.30.221 TCP 66 44654 > http [ACK] Seq=98 Ack=708693 Win=784000 Len=0 TSval=34890823 TSecr=644072162
165   0.071873 54.192.30.221 -> 172.31.36.109 TCP 5858 [TCP segment of a reassembled PDU]
166   0.071892 172.31.36.109 -> 54.192.30.221 TCP 66 44654 > http [ACK] Seq=98 Ack=714485 Win=784000 Len=0 TSval=34890823 TSecr=644072162
167   0.071903 54.192.30.221 -> 172.31.36.109 TCP 6234 [TCP segment of a reassembled PDU]
168   0.071920 172.31.36.109 -> 54.192.30.221 TCP 66 44654 > http [ACK] Seq=98 Ack=720653 Win=784000 Len=0 TSval=34890823 TSecr=644072162
169   0.093783 54.192.30.221 -> 172.31.36.109 TCP 4410 [TCP segment of a reassembled PDU]
170   0.093801 172.31.36.109 -> 54.192.30.221 TCP 66 44654 > http [ACK] Seq=98 Ack=724997 Win=784000 Len=0 TSval=34890829 TSecr=644072165
171   0.093953 54.192.30.221 -> 172.31.36.109 TCP 11650 [TCP segment of a reassembled PDU]
172   0.093973 172.31.36.109 -> 54.192.30.221 TCP 66 44654 > http [ACK] Seq=98 Ack=736581 Win=784000 Len=0 TSval=34890829 TSecr=644072165
173   0.094045 54.192.30.221 -> 172.31.36.109 TCP 1514 [TCP segment of a reassembled PDU]
174   0.094095 54.192.30.221 -> 172.31.36.109 TCP 11650 [TCP segment of a reassembled PDU]
175   0.094128 54.192.30.221 -> 172.31.36.109 TCP 10202 [TCP segment of a reassembled PDU]
176   0.094166 54.192.30.221 -> 172.31.36.109 TCP 10202 [TCP segment of a reassembled PDU]
177   0.094335 54.192.30.221 -> 172.31.36.109 TCP 4410 [TCP segment of a reassembled PDU]
178   0.094351 172.31.36.109 -> 54.192.30.221 TCP 66 44654 > http [ACK] Seq=98 Ack=774229 Win=746368 Len=0 TSval=34890829 TSecr=644072165
179   0.094459 54.192.30.221 -> 172.31.36.109 TCP 1514 [TCP segment of a reassembled PDU]
180   0.094508 54.192.30.221 -> 172.31.36.109 TCP 10578 [TCP segment of a reassembled PDU]
181   0.094526 172.31.36.109 -> 54.192.30.221 TCP 66 44654 > http [ACK] Seq=98 Ack=786189 Win=764928 Len=0 TSval=34890829 TSecr=644072165
182   0.099734 54.192.30.221 -> 172.31.36.109 TCP 5858 [TCP segment of a reassembled PDU]
183   0.099741 172.31.36.109 -> 54.192.30.221 TCP 66 44654 > http [ACK] Seq=98 Ack=791981 Win=774400 Len=0 TSval=34890830 TSecr=644072165
184   0.099892 54.192.30.221 -> 172.31.36.109 TCP 21786 [TCP segment of a reassembled PDU]
185   0.099915 172.31.36.109 -> 54.192.30.221 TCP 66 44654 > http [ACK] Seq=98 Ack=813701 Win=752768 Len=0 TSval=34890830 TSecr=644072165
186   0.100021 54.192.30.221 -> 172.31.36.109 TCP 26130 [TCP segment of a reassembled PDU]
187   0.100039 54.192.30.221 -> 172.31.36.109 TCP 5858 [TCP segment of a reassembled PDU]
188   0.100055 172.31.36.109 -> 54.192.30.221 TCP 66 44654 > http [ACK] Seq=98 Ack=845557 Win=731520 Len=0 TSval=34890830 TSecr=644072165
189   0.100347 54.192.30.221 -> 172.31.36.109 TCP 6234 [TCP segment of a reassembled PDU]
190   0.100354 172.31.36.109 -> 54.192.30.221 TCP 66 44654 > http [ACK] Seq=98 Ack=851725 Win=771968 Len=0 TSval=34890830 TSecr=644072165
191   0.100456 54.192.30.221 -> 172.31.36.109 TCP 23234 [TCP segment of a reassembled PDU]
192   0.100481 172.31.36.109 -> 54.192.30.221 TCP 66 44654 > http [ACK] Seq=98 Ack=874893 Win=748800 Len=0 TSval=34890830 TSecr=644072165
193   0.100495 54.192.30.221 -> 172.31.36.109 TCP 8754 [TCP segment of a reassembled PDU]
194   0.100528 172.31.36.109 -> 54.192.30.221 TCP 66 44654 > http [ACK] Seq=98 Ack=883581 Win=784000 Len=0 TSval=34890830 TSecr=644072165
195   0.100592 54.192.30.221 -> 172.31.36.109 TCP 1514 [TCP segment of a reassembled PDU]
196   0.101364 54.192.30.221 -> 172.31.36.109 TCP 4410 [TCP segment of a reassembled PDU]
197   0.101389 172.31.36.109 -> 54.192.30.221 TCP 66 44654 > http [ACK] Seq=98 Ack=889373 Win=784000 Len=0 TSval=34890831 TSecr=644072165
198   0.101499 54.192.30.221 -> 172.31.36.109 TCP 13098 [TCP segment of a reassembled PDU]
199   0.101520 172.31.36.109 -> 54.192.30.221 TCP 66 44654 > http [ACK] Seq=98 Ack=902405 Win=784000 Len=0 TSval=34890831 TSecr=644072165
200   0.101569 54.192.30.221 -> 172.31.36.109 TCP 18890 [TCP segment of a reassembled PDU]
201   0.101592 172.31.36.109 -> 54.192.30.221 TCP 66 44654 > http [ACK] Seq=98 Ack=921229 Win=765184 Len=0 TSval=34890831 TSecr=644072165
202   0.101659 54.192.30.221 -> 172.31.36.109 TCP 10202 [TCP segment of a reassembled PDU]
203   0.101667 172.31.36.109 -> 54.192.30.221 TCP 66 44654 > http [ACK] Seq=98 Ack=931365 Win=767232 Len=0 TSval=34890831 TSecr=644072165
204   0.101942 54.192.30.221 -> 172.31.36.109 TCP 21786 [TCP segment of a reassembled PDU]
205   0.101965 172.31.36.109 -> 54.192.30.221 TCP 66 44654 > http [ACK] Seq=98 Ack=953085 Win=748160 Len=0 TSval=34890831 TSecr=644072165
206   0.101990 54.192.30.221 -> 172.31.36.109 TCP 13098 [TCP segment of a reassembled PDU]
207   0.102001 172.31.36.109 -> 54.192.30.221 TCP 66 44654 > http [ACK] Seq=98 Ack=966117 Win=762496 Len=0 TSval=34890831 TSecr=644072165
208   0.102086 54.192.30.221 -> 172.31.36.109 TCP 7306 [TCP segment of a reassembled PDU]
209   0.102104 172.31.36.109 -> 54.192.30.221 TCP 66 44654 > http [ACK] Seq=98 Ack=973357 Win=771968 Len=0 TSval=34890831 TSecr=644072165
210   0.102254 54.192.30.221 -> 172.31.36.109 TCP 17442 [TCP segment of a reassembled PDU]
211   0.102278 54.192.30.221 -> 172.31.36.109 TCP 1514 [TCP segment of a reassembled PDU]
212   0.102283 172.31.36.109 -> 54.192.30.221 TCP 66 44654 > http [ACK] Seq=98 Ack=990733 Win=755328 Len=0 TSval=34890831 TSecr=644072165
213   0.102807 54.192.30.221 -> 172.31.36.109 TCP 4410 [TCP segment of a reassembled PDU]
214   0.102814 172.31.36.109 -> 54.192.30.221 TCP 66 44654 > http [ACK] Seq=98 Ack=996525 Win=776704 Len=0 TSval=34890831 TSecr=644072165
215   0.102932 54.192.30.221 -> 172.31.36.109 TCP 13098 [TCP segment of a reassembled PDU]
216   0.102953 172.31.36.109 -> 54.192.30.221 TCP 66 44654 > http [ACK] Seq=98 Ack=1009557 Win=784000 Len=0 TSval=34890831 TSecr=644072166
217   0.103086 54.192.30.221 -> 172.31.36.109 TCP 4410 [TCP segment of a reassembled PDU]
218   0.103102 172.31.36.109 -> 54.192.30.221 TCP 66 44654 > http [ACK] Seq=98 Ack=1013901 Win=784000 Len=0 TSval=34890831 TSecr=644072166
219   0.103180 54.192.30.221 -> 172.31.36.109 TCP 1514 [TCP segment of a reassembled PDU]
220   0.103372 54.192.30.221 -> 172.31.36.109 TCP 4410 [TCP segment of a reassembled PDU]
221   0.103388 172.31.36.109 -> 54.192.30.221 TCP 66 44654 > http [ACK] Seq=98 Ack=1019693 Win=784000 Len=0 TSval=34890831 TSecr=644072166
222   0.103506 54.192.30.221 -> 172.31.36.109 TCP 24682 [TCP segment of a reassembled PDU]
223   0.103532 172.31.36.109 -> 54.192.30.221 TCP 66 44654 > http [ACK] Seq=98 Ack=1044309 Win=759424 Len=0 TSval=34890831 TSecr=644072166
224   0.103633 54.192.30.221 -> 172.31.36.109 TCP 4090 [TCP segment of a reassembled PDU]
225   0.103638 172.31.36.109 -> 54.192.30.221 TCP 66 44654 > http [ACK] Seq=98 Ack=1048333 Win=776704 Len=0 TSval=34890831 TSecr=644072166
226   0.115612 54.192.30.221 -> 172.31.36.109 TCP 1514 [TCP segment of a reassembled PDU]
227   0.115892 54.192.30.221 -> 172.31.36.109 TCP 7306 [TCP segment of a reassembled PDU]
228   0.115911 172.31.36.109 -> 54.192.30.221 TCP 66 44654 > http [ACK] Seq=98 Ack=1057021 Win=784000 Len=0 TSval=34890834 TSecr=644072167
229   0.115995 54.192.30.221 -> 172.31.36.109 TCP 15994 [TCP segment of a reassembled PDU]
230   0.116022 172.31.36.109 -> 54.192.30.221 TCP 66 44654 > http [ACK] Seq=98 Ack=1072949 Win=784000 Len=0 TSval=34890834 TSecr=644072167
231   0.116028 54.192.30.221 -> 172.31.36.109 TCP 1514 [TCP segment of a reassembled PDU]
232   0.116099 54.192.30.221 -> 172.31.36.109 TCP 10202 [TCP segment of a reassembled PDU]
233   0.116118 172.31.36.109 -> 54.192.30.221 TCP 66 44654 > http [ACK] Seq=98 Ack=1084533 Win=784000 Len=0 TSval=34890834 TSecr=644072167
234   0.116226 54.192.30.221 -> 172.31.36.109 TCP 11650 [TCP segment of a reassembled PDU]
235   0.116248 172.31.36.109 -> 54.192.30.221 TCP 66 44654 > http [ACK] Seq=98 Ack=1096117 Win=784000 Len=0 TSval=34890834 TSecr=644072167
236   0.116284 54.192.30.221 -> 172.31.36.109 TCP 17818 [TCP segment of a reassembled PDU]
237   0.116307 172.31.36.109 -> 54.192.30.221 TCP 66 44654 > http [ACK] Seq=98 Ack=1113869 Win=766336 Len=0 TSval=34890834 TSecr=644072167
238   0.138093 54.192.30.221 -> 172.31.36.109 TCP 4410 [TCP segment of a reassembled PDU]
239   0.138137 172.31.36.109 -> 54.192.30.221 TCP 66 44654 > http [ACK] Seq=98 Ack=1118213 Win=776704 Len=0 TSval=34890840 TSecr=644072169
240   0.138153 54.192.30.221 -> 172.31.36.109 TCP 8754 [TCP segment of a reassembled PDU]
241   0.138212 172.31.36.109 -> 54.192.30.221 TCP 66 44654 > http [ACK] Seq=98 Ack=1126901 Win=784000 Len=0 TSval=34890840 TSecr=644072169
242   0.138241 54.192.30.221 -> 172.31.36.109 TCP 4410 [TCP segment of a reassembled PDU]
243   0.138253 172.31.36.109 -> 54.192.30.221 TCP 66 44654 > http [ACK] Seq=98 Ack=1131245 Win=784000 Len=0 TSval=34890840 TSecr=644072169
244   0.138428 54.192.30.221 -> 172.31.36.109 TCP 7306 [TCP segment of a reassembled PDU]
245   0.138446 172.31.36.109 -> 54.192.30.221 TCP 66 44654 > http [ACK] Seq=98 Ack=1138485 Win=784000 Len=0 TSval=34890840 TSecr=644072169
246   0.138536 54.192.30.221 -> 172.31.36.109 TCP 13098 [TCP segment of a reassembled PDU]
247   0.138560 54.192.30.221 -> 172.31.36.109 TCP 21786 [TCP segment of a reassembled PDU]
248   0.138575 54.192.30.221 -> 172.31.36.109 TCP 1514 [TCP segment of a reassembled PDU]
249   0.138592 172.31.36.109 -> 54.192.30.221 TCP 66 44654 > http [ACK] Seq=98 Ack=1174685 Win=747904 Len=0 TSval=34890840 TSecr=644072169
250   0.138726 54.192.30.221 -> 172.31.36.109 TCP 4786 [TCP segment of a reassembled PDU]
251   0.138732 172.31.36.109 -> 54.192.30.221 TCP 66 44654 > http [ACK] Seq=98 Ack=1179405 Win=774400 Len=0 TSval=34890840 TSecr=644072169
252   0.145091 54.192.30.221 -> 172.31.36.109 TCP 1514 [TCP segment of a reassembled PDU]
253   0.145300 54.192.30.221 -> 172.31.36.109 TCP 2962 [TCP segment of a reassembled PDU]
254   0.145305 172.31.36.109 -> 54.192.30.221 TCP 66 44654 > http [ACK] Seq=98 Ack=1183749 Win=779136 Len=0 TSval=34890842 TSecr=644072170
255   0.145436 54.192.30.221 -> 172.31.36.109 TCP 11650 [TCP segment of a reassembled PDU]
256   0.145456 172.31.36.109 -> 54.192.30.221 TCP 66 44654 > http [ACK] Seq=98 Ack=1195333 Win=784000 Len=0 TSval=34890842 TSecr=644072170
257   0.145931 54.192.30.221 -> 172.31.36.109 TCP 10202 [TCP segment of a reassembled PDU]
258   0.145953 172.31.36.109 -> 54.192.30.221 TCP 66 44654 > http [ACK] Seq=98 Ack=1205469 Win=784000 Len=0 TSval=34890842 TSecr=644072170
259   0.145996 54.192.30.221 -> 172.31.36.109 TCP 18890 [TCP segment of a reassembled PDU]
260   0.146041 54.192.30.221 -> 172.31.36.109 TCP 10202 [TCP segment of a reassembled PDU]
261   0.146070 54.192.30.221 -> 172.31.36.109 TCP 14922 [TCP segment of a reassembled PDU]
262   0.146092 54.192.30.221 -> 172.31.36.109 TCP 14546 [TCP segment of a reassembled PDU]
263   0.146122 54.192.30.221 -> 172.31.36.109 TCP 5858 [TCP segment of a reassembled PDU]
264   0.146285 172.31.36.109 -> 54.192.30.221 TCP 66 44654 > http [ACK] Seq=98 Ack=1269557 Win=720000 Len=0 TSval=34890842 TSecr=644072170
265   0.146837 54.192.30.221 -> 172.31.36.109 TCP 2962 [TCP segment of a reassembled PDU]
266   0.146842 172.31.36.109 -> 54.192.30.221 TCP 66 44654 > http [ACK] Seq=98 Ack=1272453 Win=779136 Len=0 TSval=34890842 TSecr=644072170
267   0.146976 54.192.30.221 -> 172.31.36.109 TCP 17442 [TCP segment of a reassembled PDU]
268   0.146997 172.31.36.109 -> 54.192.30.221 TCP 66 44654 > http [ACK] Seq=98 Ack=1289829 Win=761856 Len=0 TSval=34890842 TSecr=644072170
269   0.147480 54.192.30.221 -> 172.31.36.109 TCP 20714 [TCP segment of a reassembled PDU]
270   0.147505 172.31.36.109 -> 54.192.30.221 TCP 66 44654 > http [ACK] Seq=98 Ack=1310477 Win=748160 Len=0 TSval=34890842 TSecr=644072170
271   0.165084 54.192.30.221 -> 172.31.36.109 TCP 1514 [TCP segment of a reassembled PDU]
272   0.165296 54.192.30.221 -> 172.31.36.109 TCP 2962 [TCP segment of a reassembled PDU]
273   0.165301 172.31.36.109 -> 54.192.30.221 TCP 66 44654 > http [ACK] Seq=98 Ack=1314821 Win=779136 Len=0 TSval=34890847 TSecr=644072172
274   0.165434 54.192.30.221 -> 172.31.36.109 TCP 18890 [TCP segment of a reassembled PDU]
275   0.165454 172.31.36.109 -> 54.192.30.221 TCP 66 44654 > http [ACK] Seq=98 Ack=1333645 Win=760320 Len=0 TSval=34890847 TSecr=644072172
276   0.165560 54.192.30.221 -> 172.31.36.109 TCP 5858 [TCP segment of a reassembled PDU]
277   0.165572 172.31.36.109 -> 54.192.30.221 TCP 66 44654 > http [ACK] Seq=98 Ack=1339437 Win=774400 Len=0 TSval=34890847 TSecr=644072172
278   0.165631 54.192.30.221 -> 172.31.36.109 TCP 4410 [TCP segment of a reassembled PDU]
279   0.165637 172.31.36.109 -> 54.192.30.221 TCP 66 44654 > http [ACK] Seq=98 Ack=1343781 Win=776704 Len=0 TSval=34890847 TSecr=644072172
280   0.165665 54.192.30.221 -> 172.31.36.109 TCP 7306 [TCP segment of a reassembled PDU]
281   0.165714 172.31.36.109 -> 54.192.30.221 TCP 66 44654 > http [ACK] Seq=98 Ack=1351021 Win=784000 Len=0 TSval=34890847 TSecr=644072172
282   0.165764 54.192.30.221 -> 172.31.36.109 TCP 15994 [TCP segment of a reassembled PDU]
283   0.165837 54.192.30.221 -> 172.31.36.109 TCP 1514 [TCP segment of a reassembled PDU]
284   0.165877 54.192.30.221 -> 172.31.36.109 TCP 7682 [TCP segment of a reassembled PDU]
285   0.172566 172.31.36.109 -> 54.192.30.221 TCP 66 44654 > http [ACK] Seq=98 Ack=1376013 Win=767232 Len=0 TSval=34890849 TSecr=644072172
286   0.197945 54.192.30.221 -> 172.31.36.109 TCP 2962 [TCP segment of a reassembled PDU]
287   0.197954 172.31.36.109 -> 54.192.30.221 TCP 66 44654 > http [ACK] Seq=98 Ack=1378909 Win=779136 Len=0 TSval=34890855 TSecr=644072175
288   0.198101 54.192.30.221 -> 172.31.36.109 TCP 2962 [TCP segment of a reassembled PDU]
289   0.198107 172.31.36.109 -> 54.192.30.221 TCP 66 44654 > http [ACK] Seq=98 Ack=1381805 Win=779136 Len=0 TSval=34890855 TSecr=644072175
290   0.198234 54.192.30.221 -> 172.31.36.109 TCP 11650 [TCP segment of a reassembled PDU]
291   0.198256 172.31.36.109 -> 54.192.30.221 TCP 66 44654 > http [ACK] Seq=98 Ack=1393389 Win=784000 Len=0 TSval=34890855 TSecr=644072175
292   0.198349 54.192.30.221 -> 172.31.36.109 TCP 8754 [TCP segment of a reassembled PDU]
293   0.198379 54.192.30.221 -> 172.31.36.109 TCP 8754 [TCP segment of a reassembled PDU]
294   0.198387 172.31.36.109 -> 54.192.30.221 TCP 66 44654 > http [ACK] Seq=98 Ack=1402077 Win=784000 Len=0 TSval=34890855 TSecr=644072175
295   0.198403 172.31.36.109 -> 54.192.30.221 TCP 66 44654 > http [ACK] Seq=98 Ack=1410765 Win=784000 Len=0 TSval=34890855 TSecr=644072175
296   0.198525 54.192.30.221 -> 172.31.36.109 TCP 2962 [TCP segment of a reassembled PDU]
297   0.198541 172.31.36.109 -> 54.192.30.221 TCP 66 44654 > http [ACK] Seq=98 Ack=1413661 Win=784000 Len=0 TSval=34890855 TSecr=644072175
298   0.198564 54.192.30.221 -> 172.31.36.109 TCP 1514 [TCP segment of a reassembled PDU]
299   0.198795 54.192.30.221 -> 172.31.36.109 TCP 26506 [TCP segment of a reassembled PDU]
300   0.198826 172.31.36.109 -> 54.192.30.221 TCP 66 44654 > http [ACK] Seq=98 Ack=1441549 Win=756224 Len=0 TSval=34890855 TSecr=644072175
301   0.201683 54.192.30.221 -> 172.31.36.109 TCP 1514 [TCP segment of a reassembled PDU]
302   0.201787 54.192.30.221 -> 172.31.36.109 TCP 8754 [TCP segment of a reassembled PDU]
303   0.201794 172.31.36.109 -> 54.192.30.221 TCP 66 44654 > http [ACK] Seq=98 Ack=1451685 Win=769664 Len=0 TSval=34890856 TSecr=644072175
304   0.201875 54.192.30.221 -> 172.31.36.109 TCP 2962 [TCP segment of a reassembled PDU]
305   0.201880 172.31.36.109 -> 54.192.30.221 TCP 66 44654 > http [ACK] Seq=98 Ack=1454581 Win=779136 Len=0 TSval=34890856 TSecr=644072175
306   0.201996 54.192.30.221 -> 172.31.36.109 TCP 11650 [TCP segment of a reassembled PDU]
307   0.202077 54.192.30.221 -> 172.31.36.109 TCP 1514 [TCP segment of a reassembled PDU]
308   0.202174 54.192.30.221 -> 172.31.36.109 TCP 20338 [TCP segment of a reassembled PDU]
309   0.202188 54.192.30.221 -> 172.31.36.109 TCP 5858 [TCP segment of a reassembled PDU]
310   0.202195 54.192.30.221 -> 172.31.36.109 TCP 4410 [TCP segment of a reassembled PDU]
311   0.202271 172.31.36.109 -> 54.192.30.221 TCP 66 44654 > http [ACK] Seq=98 Ack=1498021 Win=735744 Len=0 TSval=34890856 TSecr=644072175
312   0.202366 54.192.30.221 -> 172.31.36.109 TCP 11650 [TCP segment of a reassembled PDU]
313   0.202375 172.31.36.109 -> 54.192.30.221 TCP 66 44654 > http [ACK] Seq=98 Ack=1509605 Win=764928 Len=0 TSval=34890856 TSecr=644072175
314   0.202404 54.192.30.221 -> 172.31.36.109 TCP 3338 [TCP segment of a reassembled PDU]
315   0.202409 172.31.36.109 -> 54.192.30.221 TCP 66 44654 > http [ACK] Seq=98 Ack=1512877 Win=776704 Len=0 TSval=34890856 TSecr=644072175
316   0.202464 54.192.30.221 -> 172.31.36.109 TCP 17442 [TCP segment of a reassembled PDU]
317   0.202485 172.31.36.109 -> 54.192.30.221 TCP 66 44654 > http [ACK] Seq=98 Ack=1530253 Win=759424 Len=0 TSval=34890856 TSecr=644072175
318   0.202507 54.192.30.221 -> 172.31.36.109 TCP 2962 [TCP segment of a reassembled PDU]
319   0.202511 172.31.36.109 -> 54.192.30.221 TCP 66 44654 > http [ACK] Seq=98 Ack=1533149 Win=779136 Len=0 TSval=34890856 TSecr=644072175
320   0.203210 54.192.30.221 -> 172.31.36.109 TCP 2962 [TCP segment of a reassembled PDU]
321   0.203215 172.31.36.109 -> 54.192.30.221 TCP 66 44654 > http [ACK] Seq=98 Ack=1536045 Win=779136 Len=0 TSval=34890856 TSecr=644072176
322   0.203375 54.192.30.221 -> 172.31.36.109 TCP 27578 [TCP segment of a reassembled PDU]
323   0.203401 172.31.36.109 -> 54.192.30.221 TCP 66 44654 > http [ACK] Seq=98 Ack=1563557 Win=751744 Len=0 TSval=34890856 TSecr=644072176
324   0.203432 54.192.30.221 -> 172.31.36.109 TCP 5858 [TCP segment of a reassembled PDU]
325   0.203438 172.31.36.109 -> 54.192.30.221 TCP 66 44654 > http [ACK] Seq=98 Ack=1569349 Win=774400 Len=0 TSval=34890856 TSecr=644072176
326   0.203554 54.192.30.221 -> 172.31.36.109 TCP 8754 [TCP segment of a reassembled PDU]
327   0.203572 172.31.36.109 -> 54.192.30.221 TCP 66 44654 > http [ACK] Seq=98 Ack=1578037 Win=784000 Len=0 TSval=34890856 TSecr=644072176
328   0.203716 54.192.30.221 -> 172.31.36.109 TCP 1514 [TCP segment of a reassembled PDU]
329   0.203851 54.192.30.221 -> 172.31.36.109 TCP 26130 [TCP segment of a reassembled PDU]
330   0.204003 54.192.30.221 -> 172.31.36.109 TCP 7306 [TCP segment of a reassembled PDU]
331   0.204076 172.31.36.109 -> 54.192.30.221 TCP 66 44654 > http [ACK] Seq=98 Ack=1612789 Win=749312 Len=0 TSval=34890856 TSecr=644072176
332   0.204145 54.192.30.221 -> 172.31.36.109 TCP 24682 [TCP segment of a reassembled PDU]
333   0.204171 172.31.36.109 -> 54.192.30.221 TCP 66 44654 > http [ACK] Seq=98 Ack=1637405 Win=743424 Len=0 TSval=34890856 TSecr=644072176
334   0.204250 54.192.30.221 -> 172.31.36.109 TCP 7306 [TCP segment of a reassembled PDU]
335   0.204269 172.31.36.109 -> 54.192.30.221 TCP 66 44654 > http [ACK] Seq=98 Ack=1644645 Win=771968 Len=0 TSval=34890856 TSecr=644072176
336   0.204780 54.192.30.221 -> 172.31.36.109 TCP 2962 [TCP segment of a reassembled PDU]
337   0.204785 172.31.36.109 -> 54.192.30.221 TCP 66 44654 > http [ACK] Seq=98 Ack=1647541 Win=779136 Len=0 TSval=34890857 TSecr=644072176
338   0.204931 54.192.30.221 -> 172.31.36.109 TCP 27578 [TCP segment of a reassembled PDU]
339   0.204954 172.31.36.109 -> 54.192.30.221 TCP 66 44654 > http [ACK] Seq=98 Ack=1675053 Win=751744 Len=0 TSval=34890857 TSecr=644072176
340   0.204996 54.192.30.221 -> 172.31.36.109 TCP 15994 [TCP segment of a reassembled PDU]
341   0.205006 172.31.36.109 -> 54.192.30.221 TCP 66 44654 > http [ACK] Seq=98 Ack=1690981 Win=757632 Len=0 TSval=34890857 TSecr=644072176
342   0.205069 54.192.30.221 -> 172.31.36.109 TCP 1514 [TCP segment of a reassembled PDU]
343   0.205258 54.192.30.221 -> 172.31.36.109 TCP 5858 [TCP segment of a reassembled PDU]
344   0.205264 172.31.36.109 -> 54.192.30.221 TCP 66 44654 > http [ACK] Seq=98 Ack=1698221 Win=774400 Len=0 TSval=34890857 TSecr=644072176
345   0.205319 54.192.30.221 -> 172.31.36.109 TCP 1514 [TCP segment of a reassembled PDU]
346   0.205492 54.192.30.221 -> 172.31.36.109 TCP 4090 [TCP segment of a reassembled PDU]
347   0.205497 172.31.36.109 -> 54.192.30.221 TCP 66 44654 > http [ACK] Seq=98 Ack=1703693 Win=776704 Len=0 TSval=34890857 TSecr=644072176
348   0.208549 54.192.30.221 -> 172.31.36.109 TCP 1514 [TCP segment of a reassembled PDU]
349   0.208856 54.192.30.221 -> 172.31.36.109 TCP 7306 [TCP segment of a reassembled PDU]
350   0.208938 54.192.30.221 -> 172.31.36.109 TCP 7306 [TCP segment of a reassembled PDU]
351   0.209033 54.192.30.221 -> 172.31.36.109 TCP 11650 [TCP segment of a reassembled PDU]
352   0.209096 54.192.30.221 -> 172.31.36.109 TCP 20338 [TCP segment of a reassembled PDU]
353   0.209109 54.192.30.221 -> 172.31.36.109 TCP 1514 [TCP segment of a reassembled PDU]
354   0.209114 172.31.36.109 -> 54.192.30.221 TCP 66 44654 > http [ACK] Seq=98 Ack=1731205 Win=764928 Len=0 TSval=34890858 TSecr=644072176
355   0.209135 172.31.36.109 -> 54.192.30.221 TCP 66 44654 > http [ACK] Seq=98 Ack=1752925 Win=748032 Len=0 TSval=34890858 TSecr=644072176
356   0.209322 54.192.30.221 -> 172.31.36.109 TCP 2962 [TCP segment of a reassembled PDU]
357   0.209328 172.31.36.109 -> 54.192.30.221 TCP 66 44654 > http [ACK] Seq=98 Ack=1755821 Win=779136 Len=0 TSval=34890858 TSecr=644072176
