[Measurement for 10mb at 03:30:58 20.30.2014] 
Tshark:

  1   0.000000 172.31.36.109 -> 172.31.0.2   DNS 89 Standard query 0xeced  A d3796nkzln59xv.cloudfront.net
  2   0.000021 172.31.36.109 -> 172.31.0.2   DNS 89 Standard query 0x43cd  AAAA d3796nkzln59xv.cloudfront.net
  3   0.000547   172.31.0.2 -> 172.31.36.109 DNS 217 Standard query response 0xeced  A 54.230.30.50 A 54.230.30.72 A 54.230.30.189 A 54.230.30.210 A 54.230.30.221 A 54.192.30.184 A 54.192.30.216 A 54.192.30.218
  4   0.000557   172.31.0.2 -> 172.31.36.109 DNS 170 Standard query response 0x43cd 
  5   0.003930 172.31.36.109 -> 54.230.30.50 TCP 74 35569 > http [SYN] Seq=0 Win=26883 Len=0 MSS=8961 SACK_PERM=1 TSval=29486133 TSecr=0 WS=128
  6   0.005046 54.230.30.50 -> 172.31.36.109 TCP 74 http > 35569 [SYN, ACK] Seq=0 Ack=1 Win=14480 Len=0 MSS=1460 SACK_PERM=1 TSval=909901209 TSecr=29486133 WS=128
  7   0.005060 172.31.36.109 -> 54.230.30.50 TCP 66 35569 > http [ACK] Seq=1 Ack=1 Win=27008 Len=0 TSval=29486134 TSecr=909901209
  8   0.005099 172.31.36.109 -> 54.230.30.50 HTTP 163 GET /10mb HTTP/1.1 
  9   0.006317 54.230.30.50 -> 172.31.36.109 TCP 66 http > 35569 [ACK] Seq=1 Ack=98 Win=14592 Len=0 TSval=909901209 TSecr=29486134
 10   0.019417 54.230.30.50 -> 172.31.36.109 TCP 1132 [TCP segment of a reassembled PDU]
 11   0.019440 172.31.36.109 -> 54.230.30.50 TCP 66 35569 > http [ACK] Seq=98 Ack=1067 Win=29056 Len=0 TSval=29486137 TSecr=909901210
 12   0.019453 54.230.30.50 -> 172.31.36.109 TCP 13098 [TCP segment of a reassembled PDU]
 13   0.019463 172.31.36.109 -> 54.230.30.50 TCP 66 35569 > http [ACK] Seq=98 Ack=14099 Win=55168 Len=0 TSval=29486137 TSecr=909901210
 14   0.020559 54.230.30.50 -> 172.31.36.109 TCP 2962 [TCP segment of a reassembled PDU]
 15   0.020584 172.31.36.109 -> 54.230.30.50 TCP 66 35569 > http [ACK] Seq=98 Ack=16995 Win=60928 Len=0 TSval=29486138 TSecr=909901210
 16   0.020844 54.230.30.50 -> 172.31.36.109 TCP 10202 [TCP segment of a reassembled PDU]
 17   0.020852 172.31.36.109 -> 54.230.30.50 TCP 66 35569 > http [ACK] Seq=98 Ack=27131 Win=81152 Len=0 TSval=29486138 TSecr=909901210
 18   0.022114 54.230.30.50 -> 172.31.36.109 TCP 8754 [TCP segment of a reassembled PDU]
 19   0.022121 172.31.36.109 -> 54.230.30.50 TCP 66 35569 > http [ACK] Seq=98 Ack=35819 Win=98560 Len=0 TSval=29486138 TSecr=909901211
 20   0.022468 54.230.30.50 -> 172.31.36.109 TCP 11650 [TCP segment of a reassembled PDU]
 21   0.022476 172.31.36.109 -> 54.230.30.50 TCP 66 35569 > http [ACK] Seq=98 Ack=47403 Win=121728 Len=0 TSval=29486138 TSecr=909901211
 22   0.023437 54.230.30.50 -> 172.31.36.109 TCP 5858 [TCP segment of a reassembled PDU]
 23   0.023463 172.31.36.109 -> 54.230.30.50 TCP 66 35569 > http [ACK] Seq=98 Ack=53195 Win=133376 Len=0 TSval=29486138 TSecr=909901211
 24   0.023639 54.230.30.50 -> 172.31.36.109 TCP 2962 [TCP segment of a reassembled PDU]
 25   0.023651 172.31.36.109 -> 54.230.30.50 TCP 66 35569 > http [ACK] Seq=98 Ack=56091 Win=139136 Len=0 TSval=29486138 TSecr=909901211
 26   0.023867 54.230.30.50 -> 172.31.36.109 TCP 4410 [TCP segment of a reassembled PDU]
 27   0.023879 172.31.36.109 -> 54.230.30.50 TCP 66 35569 > http [ACK] Seq=98 Ack=60435 Win=147840 Len=0 TSval=29486138 TSecr=909901211
 28   0.023926 54.230.30.50 -> 172.31.36.109 TCP 5858 [TCP segment of a reassembled PDU]
 29   0.023931 172.31.36.109 -> 54.230.30.50 TCP 66 35569 > http [ACK] Seq=98 Ack=66227 Win=159360 Len=0 TSval=29486138 TSecr=909901211
 30   0.024652 54.230.30.50 -> 172.31.36.109 TCP 4410 [TCP segment of a reassembled PDU]
 31   0.024677 172.31.36.109 -> 54.230.30.50 TCP 66 35569 > http [ACK] Seq=98 Ack=70571 Win=168064 Len=0 TSval=29486139 TSecr=909901211
 32   0.024894 54.230.30.50 -> 172.31.36.109 TCP 5858 [TCP segment of a reassembled PDU]
 33   0.024908 172.31.36.109 -> 54.230.30.50 TCP 66 35569 > http [ACK] Seq=98 Ack=76363 Win=179712 Len=0 TSval=29486139 TSecr=909901211
 34   0.025020 54.230.30.50 -> 172.31.36.109 TCP 2962 [TCP segment of a reassembled PDU]
 35   0.025032 172.31.36.109 -> 54.230.30.50 TCP 66 35569 > http [ACK] Seq=98 Ack=79259 Win=185472 Len=0 TSval=29486139 TSecr=909901211
 36   0.025060 54.230.30.50 -> 172.31.36.109 TCP 7306 [TCP segment of a reassembled PDU]
 37   0.025068 172.31.36.109 -> 54.230.30.50 TCP 66 35569 > http [ACK] Seq=98 Ack=86499 Win=199936 Len=0 TSval=29486139 TSecr=909901211
 38   0.025315 54.230.30.50 -> 172.31.36.109 TCP 8754 [TCP segment of a reassembled PDU]
 39   0.025339 172.31.36.109 -> 54.230.30.50 TCP 66 35569 > http [ACK] Seq=98 Ack=95187 Win=217344 Len=0 TSval=29486139 TSecr=909901211
 40   0.025941 54.230.30.50 -> 172.31.36.109 TCP 4410 [TCP segment of a reassembled PDU]
 41   0.025955 172.31.36.109 -> 54.230.30.50 TCP 66 35569 > http [ACK] Seq=98 Ack=99531 Win=226048 Len=0 TSval=29486139 TSecr=909901211
 42   0.026304 54.230.30.50 -> 172.31.36.109 TCP 13098 [TCP segment of a reassembled PDU]
 43   0.026312 172.31.36.109 -> 54.230.30.50 TCP 66 35569 > http [ACK] Seq=98 Ack=112563 Win=252032 Len=0 TSval=29486139 TSecr=909901211
 44   0.026450 54.230.30.50 -> 172.31.36.109 TCP 8754 [TCP segment of a reassembled PDU]
 45   0.026475 172.31.36.109 -> 54.230.30.50 TCP 66 35569 > http [ACK] Seq=98 Ack=121251 Win=269440 Len=0 TSval=29486139 TSecr=909901211
 46   0.026776 54.230.30.50 -> 172.31.36.109 TCP 2962 [TCP segment of a reassembled PDU]
 47   0.026781 172.31.36.109 -> 54.230.30.50 TCP 66 35569 > http [ACK] Seq=98 Ack=124147 Win=275200 Len=0 TSval=29486139 TSecr=909901211
 48   0.026859 54.230.30.50 -> 172.31.36.109 TCP 7306 [TCP segment of a reassembled PDU]
 49   0.026866 172.31.36.109 -> 54.230.30.50 TCP 66 35569 > http [ACK] Seq=98 Ack=131387 Win=289664 Len=0 TSval=29486139 TSecr=909901211
 50   0.027553 54.230.30.50 -> 172.31.36.109 TCP 2962 [TCP segment of a reassembled PDU]
 51   0.027560 172.31.36.109 -> 54.230.30.50 TCP 66 35569 > http [ACK] Seq=98 Ack=134283 Win=295552 Len=0 TSval=29486139 TSecr=909901211
 52   0.027824 54.230.30.50 -> 172.31.36.109 TCP 4410 [TCP segment of a reassembled PDU]
 53   0.027830 172.31.36.109 -> 54.230.30.50 TCP 66 35569 > http [ACK] Seq=98 Ack=138627 Win=304256 Len=0 TSval=29486139 TSecr=909901211
 54   0.027975 54.230.30.50 -> 172.31.36.109 TCP 13098 [TCP segment of a reassembled PDU]
 55   0.027984 172.31.36.109 -> 54.230.30.50 TCP 66 35569 > http [ACK] Seq=98 Ack=151659 Win=294016 Len=0 TSval=29486139 TSecr=909901211
 56   0.028080 54.230.30.50 -> 172.31.36.109 TCP 1514 [TCP segment of a reassembled PDU]
 57   0.028085 172.31.36.109 -> 54.230.30.50 TCP 66 35569 > http [ACK] Seq=98 Ack=153107 Win=307072 Len=0 TSval=29486139 TSecr=909901211
 58   0.028239 54.230.30.50 -> 172.31.36.109 TCP 13098 [TCP segment of a reassembled PDU]
 59   0.028248 172.31.36.109 -> 54.230.30.50 TCP 66 35569 > http [ACK] Seq=98 Ack=166139 Win=294144 Len=0 TSval=29486139 TSecr=909901211
 60   0.028927 54.230.30.50 -> 172.31.36.109 TCP 2962 [TCP segment of a reassembled PDU]
 61   0.028932 172.31.36.109 -> 54.230.30.50 TCP 66 35569 > http [ACK] Seq=98 Ack=169035 Win=310528 Len=0 TSval=29486140 TSecr=909901211
 62   0.029041 54.230.30.50 -> 172.31.36.109 TCP 2962 [TCP segment of a reassembled PDU]
 63   0.029046 172.31.36.109 -> 54.230.30.50 TCP 66 35569 > http [ACK] Seq=98 Ack=171931 Win=318720 Len=0 TSval=29486140 TSecr=909901211
 64   0.029276 54.230.30.50 -> 172.31.36.109 TCP 5858 [TCP segment of a reassembled PDU]
 65   0.029282 172.31.36.109 -> 54.230.30.50 TCP 66 35569 > http [ACK] Seq=98 Ack=177723 Win=330240 Len=0 TSval=29486140 TSecr=909901211
 66   0.029366 54.230.30.50 -> 172.31.36.109 TCP 2962 [TCP segment of a reassembled PDU]
 67   0.029371 172.31.36.109 -> 54.230.30.50 TCP 66 35569 > http [ACK] Seq=98 Ack=180619 Win=336000 Len=0 TSval=29486140 TSecr=909901211
 68   0.029512 54.230.30.50 -> 172.31.36.109 TCP 7306 [TCP segment of a reassembled PDU]
 69   0.029539 172.31.36.109 -> 54.230.30.50 TCP 66 35569 > http [ACK] Seq=98 Ack=187859 Win=350592 Len=0 TSval=29486140 TSecr=909901211
 70   0.029760 54.230.30.50 -> 172.31.36.109 TCP 26130 [TCP segment of a reassembled PDU]
 71   0.029774 172.31.36.109 -> 54.230.30.50 TCP 66 35569 > http [ACK] Seq=98 Ack=213923 Win=402688 Len=0 TSval=29486140 TSecr=909901211
 72   0.029795 54.230.30.50 -> 172.31.36.109 TCP 2962 [TCP segment of a reassembled PDU]
 73   0.029802 172.31.36.109 -> 54.230.30.50 TCP 66 35569 > http [ACK] Seq=98 Ack=216819 Win=408448 Len=0 TSval=29486140 TSecr=909901211
 74   0.030492 54.230.30.50 -> 172.31.36.109 TCP 1514 [TCP segment of a reassembled PDU]
 75   0.030496 172.31.36.109 -> 54.230.30.50 TCP 66 35569 > http [ACK] Seq=98 Ack=218267 Win=411392 Len=0 TSval=29486140 TSecr=909901211
 76   0.030898 54.230.30.50 -> 172.31.36.109 TCP 14546 [TCP segment of a reassembled PDU]
 77   0.030922 172.31.36.109 -> 54.230.30.50 TCP 66 35569 > http [ACK] Seq=98 Ack=232747 Win=440320 Len=0 TSval=29486140 TSecr=909901211
 78   0.031018 54.230.30.50 -> 172.31.36.109 TCP 18890 [TCP segment of a reassembled PDU]
 79   0.031051 172.31.36.109 -> 54.230.30.50 TCP 66 35569 > http [ACK] Seq=98 Ack=251571 Win=477952 Len=0 TSval=29486140 TSecr=909901211
 80   0.031080 54.230.30.50 -> 172.31.36.109 TCP 10202 [TCP segment of a reassembled PDU]
 81   0.031086 172.31.36.109 -> 54.230.30.50 TCP 66 35569 > http [ACK] Seq=98 Ack=261707 Win=498176 Len=0 TSval=29486140 TSecr=909901211
 82   0.031171 54.230.30.50 -> 172.31.36.109 TCP 11650 [TCP segment of a reassembled PDU]
 83   0.031178 172.31.36.109 -> 54.230.30.50 TCP 66 35569 > http [ACK] Seq=98 Ack=273291 Win=521344 Len=0 TSval=29486140 TSecr=909901211
 84   0.032103 54.230.30.50 -> 172.31.36.109 TCP 8754 [TCP segment of a reassembled PDU]
 85   0.032110 172.31.36.109 -> 54.230.30.50 TCP 66 35569 > http [ACK] Seq=98 Ack=281979 Win=538752 Len=0 TSval=29486140 TSecr=909901212
 86   0.032207 54.230.30.50 -> 172.31.36.109 TCP 2962 [TCP segment of a reassembled PDU]
 87   0.032212 172.31.36.109 -> 54.230.30.50 TCP 66 35569 > http [ACK] Seq=98 Ack=284875 Win=544512 Len=0 TSval=29486140 TSecr=909901212
 88   0.032467 54.230.30.50 -> 172.31.36.109 TCP 21786 [TCP segment of a reassembled PDU]
 89   0.032477 172.31.36.109 -> 54.230.30.50 TCP 66 35569 > http [ACK] Seq=98 Ack=306595 Win=588032 Len=0 TSval=29486140 TSecr=909901212
 90   0.032582 54.230.30.50 -> 172.31.36.109 TCP 17442 [TCP segment of a reassembled PDU]
 91   0.032592 172.31.36.109 -> 54.230.30.50 TCP 66 35569 > http [ACK] Seq=98 Ack=323971 Win=622720 Len=0 TSval=29486141 TSecr=909901212
 92   0.032614 54.230.30.50 -> 172.31.36.109 TCP 3532 [TCP segment of a reassembled PDU]
 93   0.032618 172.31.36.109 -> 54.230.30.50 TCP 66 35569 > http [ACK] Seq=98 Ack=327437 Win=629632 Len=0 TSval=29486141 TSecr=909901212
 94   0.036581 54.230.30.50 -> 172.31.36.109 TCP 1514 [TCP segment of a reassembled PDU]
 95   0.036585 172.31.36.109 -> 54.230.30.50 TCP 66 35569 > http [ACK] Seq=98 Ack=328885 Win=632576 Len=0 TSval=29486142 TSecr=909901212
 96   0.036998 54.230.30.50 -> 172.31.36.109 TCP 4410 [TCP segment of a reassembled PDU]
 97   0.037003 172.31.36.109 -> 54.230.30.50 TCP 66 35569 > http [ACK] Seq=98 Ack=333229 Win=641280 Len=0 TSval=29486142 TSecr=909901212
 98   0.037259 54.230.30.50 -> 172.31.36.109 TCP 20338 [TCP segment of a reassembled PDU]
 99   0.037270 172.31.36.109 -> 54.230.30.50 TCP 66 35569 > http [ACK] Seq=98 Ack=353501 Win=651392 Len=0 TSval=29486142 TSecr=909901212
100   0.037285 54.230.30.50 -> 172.31.36.109 TCP 17442 [TCP segment of a reassembled PDU]
101   0.037293 172.31.36.109 -> 54.230.30.50 TCP 66 35569 > http [ACK] Seq=98 Ack=370877 Win=634112 Len=0 TSval=29486142 TSecr=909901212
102   0.037352 54.230.30.50 -> 172.31.36.109 TCP 4410 [TCP segment of a reassembled PDU]
103   0.037358 172.31.36.109 -> 54.230.30.50 TCP 66 35569 > http [ACK] Seq=98 Ack=375221 Win=677632 Len=0 TSval=29486142 TSecr=909901212
104   0.037431 54.230.30.50 -> 172.31.36.109 TCP 2962 [TCP segment of a reassembled PDU]
105   0.037435 172.31.36.109 -> 54.230.30.50 TCP 66 35569 > http [ACK] Seq=98 Ack=378117 Win=674816 Len=0 TSval=29486142 TSecr=909901212
106   0.038342 54.230.30.50 -> 172.31.36.109 TCP 11650 [TCP segment of a reassembled PDU]
107   0.038351 172.31.36.109 -> 54.230.30.50 TCP 66 35569 > http [ACK] Seq=98 Ack=389701 Win=665728 Len=0 TSval=29486142 TSecr=909901212
108   0.038442 54.230.30.50 -> 172.31.36.109 TCP 3338 [TCP segment of a reassembled PDU]
109   0.038454 172.31.36.109 -> 54.230.30.50 TCP 66 35569 > http [ACK] Seq=98 Ack=392973 Win=677632 Len=0 TSval=29486142 TSecr=909901212
110   0.039786 54.230.30.50 -> 172.31.36.109 TCP 1514 [TCP segment of a reassembled PDU]
111   0.039796 172.31.36.109 -> 54.230.30.50 TCP 66 35569 > http [ACK] Seq=98 Ack=394421 Win=680320 Len=0 TSval=29486142 TSecr=909901212
112   0.040119 54.230.30.50 -> 172.31.36.109 TCP 23234 [TCP segment of a reassembled PDU]
113   0.040132 172.31.36.109 -> 54.230.30.50 TCP 66 35569 > http [ACK] Seq=98 Ack=417589 Win=657152 Len=0 TSval=29486142 TSecr=909901212
114   0.040503 54.230.30.50 -> 172.31.36.109 TCP 1514 [TCP segment of a reassembled PDU]
115   0.040515 172.31.36.109 -> 54.230.30.50 TCP 66 35569 > http [ACK] Seq=98 Ack=419037 Win=680320 Len=0 TSval=29486143 TSecr=909901212
116   0.040546 54.230.30.50 -> 172.31.36.109 TCP 20338 [TCP segment of a reassembled PDU]
117   0.040563 54.230.30.50 -> 172.31.36.109 TCP 19266 [TCP segment of a reassembled PDU]
118   0.040590 172.31.36.109 -> 54.230.30.50 TCP 66 35569 > http [ACK] Seq=98 Ack=458509 Win=640896 Len=0 TSval=29486143 TSecr=909901212
119   0.046316 54.230.30.50 -> 172.31.36.109 TCP 4410 [TCP segment of a reassembled PDU]
120   0.046322 172.31.36.109 -> 54.230.30.50 TCP 66 35569 > http [ACK] Seq=98 Ack=462853 Win=677632 Len=0 TSval=29486144 TSecr=909901213
121   0.046671 54.230.30.50 -> 172.31.36.109 TCP 14546 [TCP segment of a reassembled PDU]
122   0.046706 172.31.36.109 -> 54.230.30.50 TCP 66 35569 > http [ACK] Seq=98 Ack=477333 Win=680320 Len=0 TSval=29486144 TSecr=909901213
123   0.046812 54.230.30.50 -> 172.31.36.109 TCP 7306 [TCP segment of a reassembled PDU]
124   0.046830 172.31.36.109 -> 54.230.30.50 TCP 66 35569 > http [ACK] Seq=98 Ack=484573 Win=680320 Len=0 TSval=29486144 TSecr=909901213
125   0.046950 54.230.30.50 -> 172.31.36.109 TCP 7306 [TCP segment of a reassembled PDU]
126   0.046971 54.230.30.50 -> 172.31.36.109 TCP 21786 [TCP segment of a reassembled PDU]
127   0.047075 172.31.36.109 -> 54.230.30.50 TCP 66 35569 > http [ACK] Seq=98 Ack=513533 Win=651392 Len=0 TSval=29486144 TSecr=909901213
128   0.047119 54.230.30.50 -> 172.31.36.109 TCP 4410 [TCP segment of a reassembled PDU]
129   0.047124 172.31.36.109 -> 54.230.30.50 TCP 66 35569 > http [ACK] Seq=98 Ack=517877 Win=677632 Len=0 TSval=29486144 TSecr=909901213
130   0.048076 54.230.30.50 -> 172.31.36.109 TCP 4410 [TCP segment of a reassembled PDU]
131   0.048089 172.31.36.109 -> 54.230.30.50 TCP 66 35569 > http [ACK] Seq=98 Ack=522221 Win=677632 Len=0 TSval=29486144 TSecr=909901213
132   0.048196 54.230.30.50 -> 172.31.36.109 TCP 1890 [TCP segment of a reassembled PDU]
133   0.048207 172.31.36.109 -> 54.230.30.50 TCP 66 35569 > http [ACK] Seq=98 Ack=524045 Win=679936 Len=0 TSval=29486144 TSecr=909901213
134   0.049743 54.230.30.50 -> 172.31.36.109 TCP 2962 [TCP segment of a reassembled PDU]
135   0.049754 172.31.36.109 -> 54.230.30.50 TCP 66 35569 > http [ACK] Seq=98 Ack=526941 Win=679936 Len=0 TSval=29486145 TSecr=909901213
136   0.049873 54.230.30.50 -> 172.31.36.109 TCP 4410 [TCP segment of a reassembled PDU]
137   0.049906 54.230.30.50 -> 172.31.36.109 TCP 4410 [TCP segment of a reassembled PDU]
138   0.049919 172.31.36.109 -> 54.230.30.50 TCP 66 35569 > http [ACK] Seq=98 Ack=535629 Win=680320 Len=0 TSval=29486145 TSecr=909901213
139   0.050099 54.230.30.50 -> 172.31.36.109 TCP 7306 [TCP segment of a reassembled PDU]
140   0.050131 54.230.30.50 -> 172.31.36.109 TCP 11650 [TCP segment of a reassembled PDU]
141   0.050151 172.31.36.109 -> 54.230.30.50 TCP 66 35569 > http [ACK] Seq=98 Ack=554453 Win=665728 Len=0 TSval=29486145 TSecr=909901213
142   0.050308 54.230.30.50 -> 172.31.36.109 TCP 20338 [TCP segment of a reassembled PDU]
143   0.050358 172.31.36.109 -> 54.230.30.50 TCP 66 35569 > http [ACK] Seq=98 Ack=574725 Win=651392 Len=0 TSval=29486145 TSecr=909901213
144   0.050604 54.230.30.50 -> 172.31.36.109 TCP 14922 [TCP segment of a reassembled PDU]
145   0.050613 172.31.36.109 -> 54.230.30.50 TCP 66 35569 > http [ACK] Seq=98 Ack=589581 Win=658560 Len=0 TSval=29486145 TSecr=909901213
146   0.053599 54.230.30.50 -> 172.31.36.109 TCP 1514 [TCP segment of a reassembled PDU]
147   0.053806 54.230.30.50 -> 172.31.36.109 TCP 10202 [TCP segment of a reassembled PDU]
148   0.053831 172.31.36.109 -> 54.230.30.50 TCP 66 35569 > http [ACK] Seq=98 Ack=601165 Win=668160 Len=0 TSval=29486146 TSecr=909901214
149   0.053873 54.230.30.50 -> 172.31.36.109 TCP 5858 [TCP segment of a reassembled PDU]
150   0.053879 172.31.36.109 -> 54.230.30.50 TCP 66 35569 > http [ACK] Seq=98 Ack=606957 Win=675200 Len=0 TSval=29486146 TSecr=909901214
151   0.054292 54.230.30.50 -> 172.31.36.109 TCP 2962 [TCP segment of a reassembled PDU]
152   0.054306 172.31.36.109 -> 54.230.30.50 TCP 66 35569 > http [ACK] Seq=98 Ack=609853 Win=679936 Len=0 TSval=29486146 TSecr=909901214
153   0.054331 54.230.30.50 -> 172.31.36.109 TCP 15994 [TCP segment of a reassembled PDU]
154   0.054352 54.230.30.50 -> 172.31.36.109 TCP 10202 [TCP segment of a reassembled PDU]
155   0.054383 172.31.36.109 -> 54.230.30.50 TCP 66 35569 > http [ACK] Seq=98 Ack=635917 Win=653952 Len=0 TSval=29486146 TSecr=909901214
156   0.054404 54.230.30.50 -> 172.31.36.109 TCP 11650 [TCP segment of a reassembled PDU]
157   0.054415 172.31.36.109 -> 54.230.30.50 TCP 66 35569 > http [ACK] Seq=98 Ack=647501 Win=665728 Len=0 TSval=29486146 TSecr=909901214
158   0.054910 54.230.30.50 -> 172.31.36.109 TCP 5858 [TCP segment of a reassembled PDU]
159   0.054936 172.31.36.109 -> 54.230.30.50 TCP 66 35569 > http [ACK] Seq=98 Ack=653293 Win=675200 Len=0 TSval=29486146 TSecr=909901214
160   0.055005 54.230.30.50 -> 172.31.36.109 TCP 1890 [TCP segment of a reassembled PDU]
161   0.055009 172.31.36.109 -> 54.230.30.50 TCP 66 35569 > http [ACK] Seq=98 Ack=655117 Win=679936 Len=0 TSval=29486146 TSecr=909901214
162   0.059829 54.230.30.50 -> 172.31.36.109 TCP 1514 [TCP segment of a reassembled PDU]
163   0.060344 54.230.30.50 -> 172.31.36.109 TCP 11650 [TCP segment of a reassembled PDU]
164   0.060379 172.31.36.109 -> 54.230.30.50 TCP 66 35569 > http [ACK] Seq=98 Ack=668149 Win=680320 Len=0 TSval=29486147 TSecr=909901214
165   0.060569 54.230.30.50 -> 172.31.36.109 TCP 13098 [TCP segment of a reassembled PDU]
166   0.060606 54.230.30.50 -> 172.31.36.109 TCP 15994 [TCP segment of a reassembled PDU]
167   0.060627 54.230.30.50 -> 172.31.36.109 TCP 2962 [TCP segment of a reassembled PDU]
168   0.060633 172.31.36.109 -> 54.230.30.50 TCP 66 35569 > http [ACK] Seq=98 Ack=697109 Win=658560 Len=0 TSval=29486148 TSecr=909901214
169   0.060645 172.31.36.109 -> 54.230.30.50 TCP 66 35569 > http [ACK] Seq=98 Ack=700005 Win=680320 Len=0 TSval=29486148 TSecr=909901214
170   0.060681 54.230.30.50 -> 172.31.36.109 TCP 15994 [TCP segment of a reassembled PDU]
171   0.060702 172.31.36.109 -> 54.230.30.50 TCP 66 35569 > http [ACK] Seq=98 Ack=715933 Win=680320 Len=0 TSval=29486148 TSecr=909901214
172   0.060795 54.230.30.50 -> 172.31.36.109 TCP 4786 [TCP segment of a reassembled PDU]
173   0.060833 172.31.36.109 -> 54.230.30.50 TCP 66 35569 > http [ACK] Seq=98 Ack=720653 Win=680320 Len=0 TSval=29486148 TSecr=909901214
174   0.072081 54.230.30.50 -> 172.31.36.109 TCP 1514 [TCP segment of a reassembled PDU]
175   0.072111 54.230.30.50 -> 172.31.36.109 TCP 11650 [TCP segment of a reassembled PDU]
176   0.072245 54.230.30.50 -> 172.31.36.109 TCP 7306 [TCP segment of a reassembled PDU]
177   0.072318 172.31.36.109 -> 54.230.30.50 TCP 66 35569 > http [ACK] Seq=98 Ack=740925 Win=672896 Len=0 TSval=29486150 TSecr=909901216
178   0.072400 54.230.30.50 -> 172.31.36.109 TCP 4410 [TCP segment of a reassembled PDU]
179   0.072414 172.31.36.109 -> 54.230.30.50 TCP 66 35569 > http [ACK] Seq=98 Ack=745269 Win=677632 Len=0 TSval=29486150 TSecr=909901216
180   0.072440 54.230.30.50 -> 172.31.36.109 TCP 4410 [TCP segment of a reassembled PDU]
181   0.072459 172.31.36.109 -> 54.230.30.50 TCP 66 35569 > http [ACK] Seq=98 Ack=749613 Win=680320 Len=0 TSval=29486150 TSecr=909901216
182   0.072676 54.230.30.50 -> 172.31.36.109 TCP 14546 [TCP segment of a reassembled PDU]
183   0.072695 54.230.30.50 -> 172.31.36.109 TCP 15994 [TCP segment of a reassembled PDU]
184   0.072715 172.31.36.109 -> 54.230.30.50 TCP 66 35569 > http [ACK] Seq=98 Ack=780021 Win=658560 Len=0 TSval=29486151 TSecr=909901216
185   0.072743 54.230.30.50 -> 172.31.36.109 TCP 1514 [TCP segment of a reassembled PDU]
186   0.073439 54.230.30.50 -> 172.31.36.109 TCP 1514 [TCP segment of a reassembled PDU]
187   0.073443 172.31.36.109 -> 54.230.30.50 TCP 66 35569 > http [ACK] Seq=98 Ack=782917 Win=680320 Len=0 TSval=29486151 TSecr=909901216
188   0.073656 54.230.30.50 -> 172.31.36.109 TCP 3338 [TCP segment of a reassembled PDU]
189   0.073672 172.31.36.109 -> 54.230.30.50 TCP 66 35569 > http [ACK] Seq=98 Ack=786189 Win=680320 Len=0 TSval=29486151 TSecr=909901216
190   0.169953 54.230.30.50 -> 172.31.36.109 TCP 1514 [TCP segment of a reassembled PDU]
191   0.169964 54.230.30.50 -> 172.31.36.109 TCP 11650 [TCP segment of a reassembled PDU]
192   0.169986 172.31.36.109 -> 54.230.30.50 TCP 66 35569 > http [ACK] Seq=98 Ack=799221 Win=680320 Len=0 TSval=29486175 TSecr=909901225
193   0.170323 54.230.30.50 -> 172.31.36.109 TCP 8754 [TCP segment of a reassembled PDU]
194   0.170361 172.31.36.109 -> 54.230.30.50 TCP 66 35569 > http [ACK] Seq=98 Ack=807909 Win=680320 Len=0 TSval=29486175 TSecr=909901225
195   0.170405 54.230.30.50 -> 172.31.36.109 TCP 11650 [TCP segment of a reassembled PDU]
196   0.170422 172.31.36.109 -> 54.230.30.50 TCP 66 35569 > http [ACK] Seq=98 Ack=819493 Win=680320 Len=0 TSval=29486175 TSecr=909901225
197   0.170660 54.230.30.50 -> 172.31.36.109 TCP 26130 [TCP segment of a reassembled PDU]
198   0.170694 172.31.36.109 -> 54.230.30.50 TCP 66 35569 > http [ACK] Seq=98 Ack=845557 Win=654336 Len=0 TSval=29486175 TSecr=909901225
199   0.170801 54.230.30.50 -> 172.31.36.109 TCP 7306 [TCP segment of a reassembled PDU]
200   0.170808 172.31.36.109 -> 54.230.30.50 TCP 66 35569 > http [ACK] Seq=98 Ack=852797 Win=672896 Len=0 TSval=29486175 TSecr=909901225
201   0.170934 54.230.30.50 -> 172.31.36.109 TCP 15994 [TCP segment of a reassembled PDU]
202   0.171095 54.230.30.50 -> 172.31.36.109 TCP 4410 [TCP segment of a reassembled PDU]
203   0.171565 54.230.30.50 -> 172.31.36.109 TCP 2962 [TCP segment of a reassembled PDU]
204   0.171724 54.230.30.50 -> 172.31.36.109 TCP 15994 [TCP segment of a reassembled PDU]
205   0.171817 54.230.30.50 -> 172.31.36.109 TCP 2962 [TCP segment of a reassembled PDU]
206   0.172000 54.230.30.50 -> 172.31.36.109 TCP 24682 [TCP segment of a reassembled PDU]
207   0.172073 54.230.30.50 -> 172.31.36.109 TCP 8754 [TCP segment of a reassembled PDU]
208   0.172196 54.230.30.50 -> 172.31.36.109 TCP 10202 [TCP segment of a reassembled PDU]
209   0.176522 172.31.36.109 -> 54.230.30.50 TCP 66 35569 > http [ACK] Seq=98 Ack=938229 Win=587520 Len=0 TSval=29486177 TSecr=909901225
210   0.177794 54.230.30.50 -> 172.31.36.109 TCP 4410 [TCP segment of a reassembled PDU]
211   0.177802 172.31.36.109 -> 54.230.30.50 TCP 66 35569 > http [ACK] Seq=98 Ack=942573 Win=677632 Len=0 TSval=29486177 TSecr=909901226
212   0.177956 54.230.30.50 -> 172.31.36.109 TCP 24682 [TCP segment of a reassembled PDU]
213   0.177977 172.31.36.109 -> 54.230.30.50 TCP 66 35569 > http [ACK] Seq=98 Ack=967189 Win=653056 Len=0 TSval=29486177 TSecr=909901226
214   0.178151 54.230.30.50 -> 172.31.36.109 TCP 33370 [TCP segment of a reassembled PDU]
215   0.178178 54.230.30.50 -> 172.31.36.109 TCP 2962 [TCP segment of a reassembled PDU]
216   0.178328 172.31.36.109 -> 54.230.30.50 TCP 66 35569 > http [ACK] Seq=98 Ack=1003389 Win=625152 Len=0 TSval=29486177 TSecr=909901226
217   0.178980 54.230.30.50 -> 172.31.36.109 TCP 2962 [TCP segment of a reassembled PDU]
218   0.178986 172.31.36.109 -> 54.230.30.50 TCP 66 35569 > http [ACK] Seq=98 Ack=1006285 Win=679936 Len=0 TSval=29486177 TSecr=909901226
219   0.179224 54.230.30.50 -> 172.31.36.109 TCP 30474 [TCP segment of a reassembled PDU]
220   0.179249 172.31.36.109 -> 54.230.30.50 TCP 66 35569 > http [ACK] Seq=98 Ack=1036693 Win=649600 Len=0 TSval=29486177 TSecr=909901226
221   0.179340 54.230.30.50 -> 172.31.36.109 TCP 2962 [TCP segment of a reassembled PDU]
222   0.179345 172.31.36.109 -> 54.230.30.50 TCP 66 35569 > http [ACK] Seq=98 Ack=1039589 Win=679936 Len=0 TSval=29486177 TSecr=909901226
223   0.179623 54.230.30.50 -> 172.31.36.109 TCP 8810 [TCP segment of a reassembled PDU]
224   0.179653 172.31.36.109 -> 54.230.30.50 TCP 66 35569 > http [ACK] Seq=98 Ack=1048333 Win=680320 Len=0 TSval=29486177 TSecr=909901226
225   0.181822 54.230.30.50 -> 172.31.36.109 TCP 5858 [TCP segment of a reassembled PDU]
226   0.181838 172.31.36.109 -> 54.230.30.50 TCP 66 35569 > http [ACK] Seq=98 Ack=1054125 Win=680320 Len=0 TSval=29486178 TSecr=909901227
227   0.181982 54.230.30.50 -> 172.31.36.109 TCP 8754 [TCP segment of a reassembled PDU]
228   0.181989 172.31.36.109 -> 54.230.30.50 TCP 66 35569 > http [ACK] Seq=98 Ack=1062813 Win=697600 Len=0 TSval=29486178 TSecr=909901227
229   0.181996 54.230.30.50 -> 172.31.36.109 TCP 1514 [TCP segment of a reassembled PDU]
230   0.181999 172.31.36.109 -> 54.230.30.50 TCP 66 35569 > http [ACK] Seq=98 Ack=1064261 Win=700544 Len=0 TSval=29486178 TSecr=909901227
231   0.182050 54.230.30.50 -> 172.31.36.109 TCP 1514 [TCP segment of a reassembled PDU]
232   0.182054 172.31.36.109 -> 54.230.30.50 TCP 66 35569 > http [ACK] Seq=98 Ack=1065709 Win=703488 Len=0 TSval=29486178 TSecr=909901227
233   0.182262 54.230.30.50 -> 172.31.36.109 TCP 14546 [TCP segment of a reassembled PDU]
234   0.182272 172.31.36.109 -> 54.230.30.50 TCP 66 35569 > http [ACK] Seq=98 Ack=1080189 Win=732416 Len=0 TSval=29486178 TSecr=909901227
235   0.182283 54.230.30.50 -> 172.31.36.109 TCP 8754 [TCP segment of a reassembled PDU]
236   0.182288 172.31.36.109 -> 54.230.30.50 TCP 66 35569 > http [ACK] Seq=98 Ack=1088877 Win=749824 Len=0 TSval=29486178 TSecr=909901227
237   0.182448 54.230.30.50 -> 172.31.36.109 TCP 7306 [TCP segment of a reassembled PDU]
238   0.182456 172.31.36.109 -> 54.230.30.50 TCP 66 35569 > http [ACK] Seq=98 Ack=1096117 Win=764288 Len=0 TSval=29486178 TSecr=909901227
239   0.182467 54.230.30.50 -> 172.31.36.109 TCP 7306 [TCP segment of a reassembled PDU]
240   0.182471 172.31.36.109 -> 54.230.30.50 TCP 66 35569 > http [ACK] Seq=98 Ack=1103357 Win=778752 Len=0 TSval=29486178 TSecr=909901227
241   0.182695 54.230.30.50 -> 172.31.36.109 TCP 10578 [TCP segment of a reassembled PDU]
242   0.182703 172.31.36.109 -> 54.230.30.50 TCP 66 35569 > http [ACK] Seq=98 Ack=1113869 Win=799744 Len=0 TSval=29486178 TSecr=909901227
243   0.182712 54.230.30.50 -> 172.31.36.109 TCP 11650 [TCP segment of a reassembled PDU]
244   0.182718 172.31.36.109 -> 54.230.30.50 TCP 66 35569 > http [ACK] Seq=98 Ack=1125453 Win=822912 Len=0 TSval=29486178 TSecr=909901227
245   0.183341 54.230.30.50 -> 172.31.36.109 TCP 10202 [TCP segment of a reassembled PDU]
246   0.183349 172.31.36.109 -> 54.230.30.50 TCP 66 35569 > http [ACK] Seq=98 Ack=1135589 Win=843264 Len=0 TSval=29486178 TSecr=909901227
247   0.183496 54.230.30.50 -> 172.31.36.109 TCP 23234 [TCP segment of a reassembled PDU]
248   0.183508 172.31.36.109 -> 54.230.30.50 TCP 66 35569 > http [ACK] Seq=98 Ack=1158757 Win=889600 Len=0 TSval=29486178 TSecr=909901227
249   0.183720 54.230.30.50 -> 172.31.36.109 TCP 20714 [TCP segment of a reassembled PDU]
250   0.183729 172.31.36.109 -> 54.230.30.50 TCP 66 35569 > http [ACK] Seq=98 Ack=1179405 Win=930816 Len=0 TSval=29486178 TSecr=909901227
251   0.195403 54.230.30.50 -> 172.31.36.109 TCP 1514 [TCP segment of a reassembled PDU]
252   0.195430 172.31.36.109 -> 54.230.30.50 TCP 66 35569 > http [ACK] Seq=98 Ack=1180853 Win=933760 Len=0 TSval=29486181 TSecr=909901228
253   0.195873 54.230.30.50 -> 172.31.36.109 TCP 5858 [TCP segment of a reassembled PDU]
254   0.195880 172.31.36.109 -> 54.230.30.50 TCP 66 35569 > http [ACK] Seq=98 Ack=1186645 Win=945280 Len=0 TSval=29486181 TSecr=909901228
255   0.196089 54.230.30.50 -> 172.31.36.109 TCP 18890 [TCP segment of a reassembled PDU]
256   0.196098 172.31.36.109 -> 54.230.30.50 TCP 66 35569 > http [ACK] Seq=98 Ack=1205469 Win=982912 Len=0 TSval=29486181 TSecr=909901228
257   0.196104 54.230.30.50 -> 172.31.36.109 TCP 2962 [TCP segment of a reassembled PDU]
258   0.196106 172.31.36.109 -> 54.230.30.50 TCP 66 35569 > http [ACK] Seq=98 Ack=1208365 Win=988800 Len=0 TSval=29486181 TSecr=909901228
259   0.196117 54.230.30.50 -> 172.31.36.109 TCP 8754 [TCP segment of a reassembled PDU]
260   0.196122 172.31.36.109 -> 54.230.30.50 TCP 66 35569 > http [ACK] Seq=98 Ack=1217053 Win=1006080 Len=0 TSval=29486181 TSecr=909901228
261   0.196328 54.230.30.50 -> 172.31.36.109 TCP 17442 [TCP segment of a reassembled PDU]
262   0.196335 172.31.36.109 -> 54.230.30.50 TCP 66 35569 > http [ACK] Seq=98 Ack=1234429 Win=1040896 Len=0 TSval=29486181 TSecr=909901228
263   0.196344 54.230.30.50 -> 172.31.36.109 TCP 10578 [TCP segment of a reassembled PDU]
264   0.196349 172.31.36.109 -> 54.230.30.50 TCP 66 35569 > http [ACK] Seq=98 Ack=1244941 Win=1061888 Len=0 TSval=29486181 TSecr=909901228
265   0.206954 54.230.30.50 -> 172.31.36.109 TCP 1514 [TCP segment of a reassembled PDU]
266   0.206959 172.31.36.109 -> 54.230.30.50 TCP 66 35569 > http [ACK] Seq=98 Ack=1246389 Win=1064832 Len=0 TSval=29486184 TSecr=909901229
267   0.207191 54.230.30.50 -> 172.31.36.109 TCP 2962 [TCP segment of a reassembled PDU]
268   0.207195 172.31.36.109 -> 54.230.30.50 TCP 66 35569 > http [ACK] Seq=98 Ack=1249285 Win=1070592 Len=0 TSval=29486184 TSecr=909901229
269   0.207275 54.230.30.50 -> 172.31.36.109 TCP 7306 [TCP segment of a reassembled PDU]
270   0.207281 172.31.36.109 -> 54.230.30.50 TCP 66 35569 > http [ACK] Seq=98 Ack=1256525 Win=1085056 Len=0 TSval=29486184 TSecr=909901229
271   0.207373 54.230.30.50 -> 172.31.36.109 TCP 2962 [TCP segment of a reassembled PDU]
272   0.207378 172.31.36.109 -> 54.230.30.50 TCP 66 35569 > http [ACK] Seq=98 Ack=1259421 Win=1090816 Len=0 TSval=29486184 TSecr=909901229
273   0.207477 54.230.30.50 -> 172.31.36.109 TCP 4410 [TCP segment of a reassembled PDU]
274   0.207482 172.31.36.109 -> 54.230.30.50 TCP 66 35569 > http [ACK] Seq=98 Ack=1263765 Win=1099520 Len=0 TSval=29486184 TSecr=909901229
275   0.207661 54.230.30.50 -> 172.31.36.109 TCP 7306 [TCP segment of a reassembled PDU]
276   0.207667 172.31.36.109 -> 54.230.30.50 TCP 66 35569 > http [ACK] Seq=98 Ack=1271005 Win=1113984 Len=0 TSval=29486184 TSecr=909901229
277   0.207681 54.230.30.50 -> 172.31.36.109 TCP 23234 [TCP segment of a reassembled PDU]
278   0.207692 172.31.36.109 -> 54.230.30.50 TCP 66 35569 > http [ACK] Seq=98 Ack=1294173 Win=1160320 Len=0 TSval=29486184 TSecr=909901229
279   0.207905 54.230.30.50 -> 172.31.36.109 TCP 16370 [TCP segment of a reassembled PDU]
280   0.207915 172.31.36.109 -> 54.230.30.50 TCP 66 35569 > http [ACK] Seq=98 Ack=1310477 Win=1192960 Len=0 TSval=29486184 TSecr=909901229
281   0.227853 54.230.30.50 -> 172.31.36.109 TCP 1514 [TCP segment of a reassembled PDU]
282   0.227860 172.31.36.109 -> 54.230.30.50 TCP 66 35569 > http [ACK] Seq=98 Ack=1311925 Win=1195904 Len=0 TSval=29486189 TSecr=909901231
283   0.227979 54.230.30.50 -> 172.31.36.109 TCP 18890 [TCP segment of a reassembled PDU]
284   0.227991 172.31.36.109 -> 54.230.30.50 TCP 66 35569 > http [ACK] Seq=98 Ack=1330749 Win=1233536 Len=0 TSval=29486189 TSecr=909901231
285   0.228079 54.230.30.50 -> 172.31.36.109 TCP 5858 [TCP segment of a reassembled PDU]
286   0.228086 172.31.36.109 -> 54.230.30.50 TCP 66 35569 > http [ACK] Seq=98 Ack=1336541 Win=1245056 Len=0 TSval=29486189 TSecr=909901231
287   0.228096 54.230.30.50 -> 172.31.36.109 TCP 8754 [TCP segment of a reassembled PDU]
288   0.228101 172.31.36.109 -> 54.230.30.50 TCP 66 35569 > http [ACK] Seq=98 Ack=1345229 Win=1262464 Len=0 TSval=29486189 TSecr=909901231
289   0.228321 54.230.30.50 -> 172.31.36.109 TCP 13098 [TCP segment of a reassembled PDU]
290   0.228330 172.31.36.109 -> 54.230.30.50 TCP 66 35569 > http [ACK] Seq=98 Ack=1358261 Win=1285120 Len=0 TSval=29486189 TSecr=909901231
291   0.228348 54.230.30.50 -> 172.31.36.109 TCP 14546 [TCP segment of a reassembled PDU]
292   0.228372 172.31.36.109 -> 54.230.30.50 TCP 66 35569 > http [ACK] Seq=98 Ack=1372741 Win=1282688 Len=0 TSval=29486189 TSecr=909901231
293   0.228393 54.230.30.50 -> 172.31.36.109 TCP 3338 [TCP segment of a reassembled PDU]
294   0.228398 172.31.36.109 -> 54.230.30.50 TCP 66 35569 > http [ACK] Seq=98 Ack=1376013 Win=1288576 Len=0 TSval=29486189 TSecr=909901231
295   0.280553 54.230.30.50 -> 172.31.36.109 TCP 1514 [TCP segment of a reassembled PDU]
296   0.280561 172.31.36.109 -> 54.230.30.50 TCP 66 35569 > http [ACK] Seq=98 Ack=1377461 Win=1291392 Len=0 TSval=29486203 TSecr=909901236
297   0.280659 54.230.30.50 -> 172.31.36.109 TCP 5858 [TCP segment of a reassembled PDU]
298   0.280666 172.31.36.109 -> 54.230.30.50 TCP 66 35569 > http [ACK] Seq=98 Ack=1383253 Win=1297024 Len=0 TSval=29486203 TSecr=909901236
299   0.280810 54.230.30.50 -> 172.31.36.109 TCP 26130 [TCP segment of a reassembled PDU]
300   0.280835 172.31.36.109 -> 54.230.30.50 TCP 66 35569 > http [ACK] Seq=98 Ack=1409317 Win=1271040 Len=0 TSval=29486203 TSecr=909901236
301   0.281004 54.230.30.50 -> 172.31.36.109 TCP 8754 [TCP segment of a reassembled PDU]
302   0.281011 172.31.36.109 -> 54.230.30.50 TCP 66 35569 > http [ACK] Seq=98 Ack=1418005 Win=1292288 Len=0 TSval=29486203 TSecr=909901236
303   0.281033 54.230.30.50 -> 172.31.36.109 TCP 15994 [TCP segment of a reassembled PDU]
304   0.281059 172.31.36.109 -> 54.230.30.50 TCP 66 35569 > http [ACK] Seq=98 Ack=1433933 Win=1280256 Len=0 TSval=29486203 TSecr=909901236
305   0.281065 54.230.30.50 -> 172.31.36.109 TCP 1514 [TCP segment of a reassembled PDU]
306   0.281260 54.230.30.50 -> 172.31.36.109 TCP 4410 [TCP segment of a reassembled PDU]
307   0.281266 172.31.36.109 -> 54.230.30.50 TCP 66 35569 > http [ACK] Seq=98 Ack=1439725 Win=1299328 Len=0 TSval=29486203 TSecr=909901236
308   0.281272 54.230.30.50 -> 172.31.36.109 TCP 1890 [TCP segment of a reassembled PDU]
309   0.281291 172.31.36.109 -> 54.230.30.50 TCP 66 35569 > http [ACK] Seq=98 Ack=1441549 Win=1303040 Len=0 TSval=29486203 TSecr=909901236
310   0.281948 54.230.30.50 -> 172.31.36.109 TCP 1514 [TCP segment of a reassembled PDU]
311   0.281953 172.31.36.109 -> 54.230.30.50 TCP 66 35569 > http [ACK] Seq=98 Ack=1442997 Win=1304064 Len=0 TSval=29486203 TSecr=909901237
312   0.282180 54.230.30.50 -> 172.31.36.109 TCP 10202 [TCP segment of a reassembled PDU]
313   0.282200 172.31.36.109 -> 54.230.30.50 TCP 66 35569 > http [ACK] Seq=98 Ack=1453133 Win=1305984 Len=0 TSval=29486203 TSecr=909901237
314   0.282243 54.230.30.50 -> 172.31.36.109 TCP 10202 [TCP segment of a reassembled PDU]
315   0.282371 54.230.30.50 -> 172.31.36.109 TCP 4410 [TCP segment of a reassembled PDU]
316   0.282498 172.31.36.109 -> 54.230.30.50 TCP 66 35569 > http [ACK] Seq=98 Ack=1467613 Win=1305984 Len=0 TSval=29486203 TSecr=909901237
317   0.282603 54.230.30.50 -> 172.31.36.109 TCP 10202 [TCP segment of a reassembled PDU]
318   0.282623 172.31.36.109 -> 54.230.30.50 TCP 66 35569 > http [ACK] Seq=98 Ack=1477749 Win=1305984 Len=0 TSval=29486203 TSecr=909901237
319   0.282692 54.230.30.50 -> 172.31.36.109 TCP 17442 [TCP segment of a reassembled PDU]
320   0.282716 54.230.30.50 -> 172.31.36.109 TCP 4410 [TCP segment of a reassembled PDU]
321   0.282725 172.31.36.109 -> 54.230.30.50 TCP 66 35569 > http [ACK] Seq=98 Ack=1499469 Win=1284352 Len=0 TSval=29486203 TSecr=909901237
322   0.282811 54.230.30.50 -> 172.31.36.109 TCP 1514 [TCP segment of a reassembled PDU]
323   0.282822 54.230.30.50 -> 172.31.36.109 TCP 11650 [TCP segment of a reassembled PDU]
324   0.282828 172.31.36.109 -> 54.230.30.50 TCP 66 35569 > http [ACK] Seq=98 Ack=1512501 Win=1285120 Len=0 TSval=29486203 TSecr=909901237
325   0.283125 54.230.30.50 -> 172.31.36.109 TCP 6234 [TCP segment of a reassembled PDU]
326   0.283131 172.31.36.109 -> 54.230.30.50 TCP 66 35569 > http [ACK] Seq=98 Ack=1518669 Win=1294592 Len=0 TSval=29486203 TSecr=909901237
327   0.283141 54.230.30.50 -> 172.31.36.109 TCP 13098 [TCP segment of a reassembled PDU]
328   0.283169 172.31.36.109 -> 54.230.30.50 TCP 66 35569 > http [ACK] Seq=98 Ack=1531701 Win=1285120 Len=0 TSval=29486203 TSecr=909901237
329   0.283288 54.230.30.50 -> 172.31.36.109 TCP 2962 [TCP segment of a reassembled PDU]
330   0.283293 172.31.36.109 -> 54.230.30.50 TCP 66 35569 > http [ACK] Seq=98 Ack=1534597 Win=1301760 Len=0 TSval=29486203 TSecr=909901237
331   0.283430 54.230.30.50 -> 172.31.36.109 TCP 17442 [TCP segment of a reassembled PDU]
332   0.283460 172.31.36.109 -> 54.230.30.50 TCP 66 35569 > http [ACK] Seq=98 Ack=1551973 Win=1284480 Len=0 TSval=29486203 TSecr=909901237
333   0.283564 54.230.30.50 -> 172.31.36.109 TCP 2962 [TCP segment of a reassembled PDU]
334   0.283569 172.31.36.109 -> 54.230.30.50 TCP 66 35569 > http [ACK] Seq=98 Ack=1554869 Win=1301760 Len=0 TSval=29486203 TSecr=909901237
335   0.283669 54.230.30.50 -> 172.31.36.109 TCP 7306 [TCP segment of a reassembled PDU]
336   0.283686 172.31.36.109 -> 54.230.30.50 TCP 66 35569 > http [ACK] Seq=98 Ack=1562109 Win=1305984 Len=0 TSval=29486203 TSecr=909901237
337   0.283797 54.230.30.50 -> 172.31.36.109 TCP 10202 [TCP segment of a reassembled PDU]
338   0.283818 172.31.36.109 -> 54.230.30.50 TCP 66 35569 > http [ACK] Seq=98 Ack=1572245 Win=1305984 Len=0 TSval=29486203 TSecr=909901237
339   0.284084 54.230.30.50 -> 172.31.36.109 TCP 2962 [TCP segment of a reassembled PDU]
340   0.284107 172.31.36.109 -> 54.230.30.50 TCP 66 35569 > http [ACK] Seq=98 Ack=1575141 Win=1305984 Len=0 TSval=29486203 TSecr=909901237
341   0.284223 54.230.30.50 -> 172.31.36.109 TCP 2962 [TCP segment of a reassembled PDU]
342   0.284249 172.31.36.109 -> 54.230.30.50 TCP 66 35569 > http [ACK] Seq=98 Ack=1578037 Win=1305984 Len=0 TSval=29486203 TSecr=909901237
343   0.284469 54.230.30.50 -> 172.31.36.109 TCP 4410 [TCP segment of a reassembled PDU]
344   0.284607 54.230.30.50 -> 172.31.36.109 TCP 4410 [TCP segment of a reassembled PDU]
345   0.284742 172.31.36.109 -> 54.230.30.50 TCP 66 35569 > http [ACK] Seq=98 Ack=1586725 Win=1305984 Len=0 TSval=29486204 TSecr=909901237
346   0.284878 54.230.30.50 -> 172.31.36.109 TCP 5858 [TCP segment of a reassembled PDU]
347   0.284900 172.31.36.109 -> 54.230.30.50 TCP 66 35569 > http [ACK] Seq=98 Ack=1592517 Win=1305984 Len=0 TSval=29486204 TSecr=909901237
348   0.285018 54.230.30.50 -> 172.31.36.109 TCP 7306 [TCP segment of a reassembled PDU]
349   0.285048 172.31.36.109 -> 54.230.30.50 TCP 66 35569 > http [ACK] Seq=98 Ack=1599757 Win=1305984 Len=0 TSval=29486204 TSecr=909901237
350   0.285289 54.230.30.50 -> 172.31.36.109 TCP 24682 [TCP segment of a reassembled PDU]
351   0.285315 172.31.36.109 -> 54.230.30.50 TCP 66 35569 > http [ACK] Seq=98 Ack=1624373 Win=1281408 Len=0 TSval=29486204 TSecr=909901237
352   0.285410 54.230.30.50 -> 172.31.36.109 TCP 21786 [TCP segment of a reassembled PDU]
353   0.285434 172.31.36.109 -> 54.230.30.50 TCP 66 35569 > http [ACK] Seq=98 Ack=1646093 Win=1270784 Len=0 TSval=29486204 TSecr=909901237
354   0.285481 54.230.30.50 -> 172.31.36.109 TCP 1514 [TCP segment of a reassembled PDU]
355   0.285744 54.230.30.50 -> 172.31.36.109 TCP 17817 [TCP segment of a reassembled PDU]
356   0.285754 172.31.36.109 -> 54.230.30.50 TCP 66 35569 > http [ACK] Seq=98 Ack=1665292 Win=1275520 Len=0 TSval=29486204 TSecr=909901237
