[Measurement for 10mb at 19:30:59 19.30.2014] 
Tshark:

  1   0.000000 172.31.36.109 -> 172.31.0.2   DNS 89 Standard query 0x9f65  A d3796nkzln59xv.cloudfront.net
  2   0.000023 172.31.36.109 -> 172.31.0.2   DNS 89 Standard query 0xe2d0  AAAA d3796nkzln59xv.cloudfront.net
  3   0.000557   172.31.0.2 -> 172.31.36.109 DNS 170 Standard query response 0xe2d0 
  4   0.000567   172.31.0.2 -> 172.31.36.109 DNS 217 Standard query response 0x9f65  A 54.230.30.244 A 54.192.29.221 A 54.192.29.227 A 54.192.30.223 A 54.230.29.244 A 54.230.30.37 A 54.230.30.40 A 54.230.30.222
  5   0.003909 172.31.36.109 -> 54.230.30.244 TCP 74 48956 > http [SYN] Seq=0 Win=26883 Len=0 MSS=8961 SACK_PERM=1 TSval=22286381 TSecr=0 WS=128
  6   0.005363 54.230.30.244 -> 172.31.36.109 TCP 74 http > 48956 [SYN, ACK] Seq=0 Ack=1 Win=14480 Len=0 MSS=1460 SACK_PERM=1 TSval=675006076 TSecr=22286381 WS=128
  7   0.005376 172.31.36.109 -> 54.230.30.244 TCP 66 48956 > http [ACK] Seq=1 Ack=1 Win=27008 Len=0 TSval=22286382 TSecr=675006076
  8   0.005417 172.31.36.109 -> 54.230.30.244 HTTP 163 GET /10mb HTTP/1.1 
  9   0.006702 54.230.30.244 -> 172.31.36.109 TCP 66 http > 48956 [ACK] Seq=1 Ack=98 Win=14592 Len=0 TSval=675006076 TSecr=22286382
 10   0.024799 54.230.30.244 -> 172.31.36.109 TCP 14165 [TCP segment of a reassembled PDU]
 11   0.024811 172.31.36.109 -> 54.230.30.244 TCP 66 48956 > http [ACK] Seq=98 Ack=14100 Win=55168 Len=0 TSval=22286386 TSecr=675006078
 12   0.026300 54.230.30.244 -> 172.31.36.109 TCP 10202 [TCP segment of a reassembled PDU]
 13   0.026308 172.31.36.109 -> 54.230.30.244 TCP 66 48956 > http [ACK] Seq=98 Ack=24236 Win=75392 Len=0 TSval=22286387 TSecr=675006078
 14   0.026316 54.230.30.244 -> 172.31.36.109 TCP 2962 [TCP segment of a reassembled PDU]
 15   0.026320 172.31.36.109 -> 54.230.30.244 TCP 66 48956 > http [ACK] Seq=98 Ack=27132 Win=81152 Len=0 TSval=22286387 TSecr=675006078
 16   0.027913 54.230.30.244 -> 172.31.36.109 TCP 13098 [TCP segment of a reassembled PDU]
 17   0.027923 172.31.36.109 -> 54.230.30.244 TCP 66 48956 > http [ACK] Seq=98 Ack=40164 Win=96512 Len=0 TSval=22286387 TSecr=675006079
 18   0.029427 54.230.30.244 -> 172.31.36.109 TCP 1514 [TCP segment of a reassembled PDU]
 19   0.029453 172.31.36.109 -> 54.230.30.244 TCP 66 48956 > http [ACK] Seq=98 Ack=41612 Win=109056 Len=0 TSval=22286388 TSecr=675006079
 20   0.029514 54.230.30.244 -> 172.31.36.109 TCP 11650 [TCP segment of a reassembled PDU]
 21   0.029522 172.31.36.109 -> 54.230.30.244 TCP 66 48956 > http [ACK] Seq=98 Ack=53196 Win=132224 Len=0 TSval=22286388 TSecr=675006079
 22   0.029611 54.230.30.244 -> 172.31.36.109 TCP 4410 [TCP segment of a reassembled PDU]
 23   0.029616 172.31.36.109 -> 54.230.30.244 TCP 66 48956 > http [ACK] Seq=98 Ack=57540 Win=140928 Len=0 TSval=22286388 TSecr=675006079
 24   0.029666 54.230.30.244 -> 172.31.36.109 TCP 2962 [TCP segment of a reassembled PDU]
 25   0.029671 172.31.36.109 -> 54.230.30.244 TCP 66 48956 > http [ACK] Seq=98 Ack=60436 Win=146688 Len=0 TSval=22286388 TSecr=675006079
 26   0.031076 54.230.30.244 -> 172.31.36.109 TCP 5858 [TCP segment of a reassembled PDU]
 27   0.031106 172.31.36.109 -> 54.230.30.244 TCP 66 48956 > http [ACK] Seq=98 Ack=66228 Win=158336 Len=0 TSval=22286388 TSecr=675006079
 28   0.031123 54.230.30.244 -> 172.31.36.109 TCP 13098 [TCP segment of a reassembled PDU]
 29   0.031130 172.31.36.109 -> 54.230.30.244 TCP 66 48956 > http [ACK] Seq=98 Ack=79260 Win=167296 Len=0 TSval=22286388 TSecr=675006079
 30   0.032542 54.230.30.244 -> 172.31.36.109 TCP 2962 [TCP segment of a reassembled PDU]
 31   0.032562 172.31.36.109 -> 54.230.30.244 TCP 66 48956 > http [ACK] Seq=98 Ack=82156 Win=190208 Len=0 TSval=22286388 TSecr=675006079
 32   0.032633 54.230.30.244 -> 172.31.36.109 TCP 17442 [TCP segment of a reassembled PDU]
 33   0.032643 172.31.36.109 -> 54.230.30.244 TCP 66 48956 > http [ACK] Seq=98 Ack=99532 Win=172928 Len=0 TSval=22286388 TSecr=675006079
 34   0.032683 54.230.30.244 -> 172.31.36.109 TCP 7306 [TCP segment of a reassembled PDU]
 35   0.032689 172.31.36.109 -> 54.230.30.244 TCP 66 48956 > http [ACK] Seq=98 Ack=106772 Win=186368 Len=0 TSval=22286388 TSecr=675006079
 36   0.034039 54.230.30.244 -> 172.31.36.109 TCP 2962 [TCP segment of a reassembled PDU]
 37   0.034044 172.31.36.109 -> 54.230.30.244 TCP 66 48956 > http [ACK] Seq=98 Ack=109668 Win=193408 Len=0 TSval=22286389 TSecr=675006079
 38   0.034176 54.230.30.244 -> 172.31.36.109 TCP 21786 [TCP segment of a reassembled PDU]
 39   0.034188 172.31.36.109 -> 54.230.30.244 TCP 66 48956 > http [ACK] Seq=98 Ack=131388 Win=239360 Len=0 TSval=22286389 TSecr=675006079
 40   0.035408 54.230.30.244 -> 172.31.36.109 TCP 2962 [TCP segment of a reassembled PDU]
 41   0.035435 172.31.36.109 -> 54.230.30.244 TCP 66 48956 > http [ACK] Seq=98 Ack=134284 Win=245120 Len=0 TSval=22286389 TSecr=675006079
 42   0.035505 54.230.30.244 -> 172.31.36.109 TCP 1514 [TCP segment of a reassembled PDU]
 43   0.035509 172.31.36.109 -> 54.230.30.244 TCP 66 48956 > http [ACK] Seq=98 Ack=135732 Win=248064 Len=0 TSval=22286389 TSecr=675006079
 44   0.035572 54.230.30.244 -> 172.31.36.109 TCP 1514 [TCP segment of a reassembled PDU]
 45   0.035576 172.31.36.109 -> 54.230.30.244 TCP 66 48956 > http [ACK] Seq=98 Ack=137180 Win=251008 Len=0 TSval=22286389 TSecr=675006079
 46   0.035686 54.230.30.244 -> 172.31.36.109 TCP 18890 [TCP segment of a reassembled PDU]
 47   0.035696 172.31.36.109 -> 54.230.30.244 TCP 66 48956 > http [ACK] Seq=98 Ack=156004 Win=288640 Len=0 TSval=22286389 TSecr=675006079
 48   0.035760 54.230.30.244 -> 172.31.36.109 TCP 8754 [TCP segment of a reassembled PDU]
 49   0.035767 172.31.36.109 -> 54.230.30.244 TCP 66 48956 > http [ACK] Seq=98 Ack=164692 Win=306048 Len=0 TSval=22286389 TSecr=675006079
 50   0.035841 54.230.30.244 -> 172.31.36.109 TCP 2962 [TCP segment of a reassembled PDU]
 51   0.035853 172.31.36.109 -> 54.230.30.244 TCP 66 48956 > http [ACK] Seq=98 Ack=167588 Win=311808 Len=0 TSval=22286389 TSecr=675006079
 52   0.036738 54.230.30.244 -> 172.31.36.109 TCP 4410 [TCP segment of a reassembled PDU]
 53   0.036743 172.31.36.109 -> 54.230.30.244 TCP 66 48956 > http [ACK] Seq=98 Ack=171932 Win=320512 Len=0 TSval=22286389 TSecr=675006079
 54   0.037200 54.230.30.244 -> 172.31.36.109 TCP 7306 [TCP segment of a reassembled PDU]
 55   0.037234 172.31.36.109 -> 54.230.30.244 TCP 66 48956 > http [ACK] Seq=98 Ack=179172 Win=334976 Len=0 TSval=22286389 TSecr=675006079
 56   0.037379 54.230.30.244 -> 172.31.36.109 TCP 18890 [TCP segment of a reassembled PDU]
 57   0.037397 172.31.36.109 -> 54.230.30.244 TCP 66 48956 > http [ACK] Seq=98 Ack=197996 Win=372608 Len=0 TSval=22286390 TSecr=675006079
 58   0.038235 54.230.30.244 -> 172.31.36.109 TCP 2962 [TCP segment of a reassembled PDU]
 59   0.038269 172.31.36.109 -> 54.230.30.244 TCP 66 48956 > http [ACK] Seq=98 Ack=200892 Win=378368 Len=0 TSval=22286390 TSecr=675006080
 60   0.038387 54.230.30.244 -> 172.31.36.109 TCP 17442 [TCP segment of a reassembled PDU]
 61   0.038397 172.31.36.109 -> 54.230.30.244 TCP 66 48956 > http [ACK] Seq=98 Ack=218268 Win=413184 Len=0 TSval=22286390 TSecr=675006080
 62   0.038915 54.230.30.244 -> 172.31.36.109 TCP 4410 [TCP segment of a reassembled PDU]
 63   0.038923 172.31.36.109 -> 54.230.30.244 TCP 66 48956 > http [ACK] Seq=98 Ack=222612 Win=421888 Len=0 TSval=22286390 TSecr=675006080
 64   0.039058 54.230.30.244 -> 172.31.36.109 TCP 14546 [TCP segment of a reassembled PDU]
 65   0.039078 172.31.36.109 -> 54.230.30.244 TCP 66 48956 > http [ACK] Seq=98 Ack=237092 Win=450816 Len=0 TSval=22286390 TSecr=675006080
 66   0.039689 54.230.30.244 -> 172.31.36.109 TCP 2962 [TCP segment of a reassembled PDU]
 67   0.039720 172.31.36.109 -> 54.230.30.244 TCP 66 48956 > http [ACK] Seq=98 Ack=239988 Win=456576 Len=0 TSval=22286390 TSecr=675006080
 68   0.039850 54.230.30.244 -> 172.31.36.109 TCP 20338 [TCP segment of a reassembled PDU]
 69   0.039861 172.31.36.109 -> 54.230.30.244 TCP 66 48956 > http [ACK] Seq=98 Ack=260260 Win=497152 Len=0 TSval=22286390 TSecr=675006080
 70   0.039890 54.230.30.244 -> 172.31.36.109 TCP 2962 [TCP segment of a reassembled PDU]
 71   0.039895 172.31.36.109 -> 54.230.30.244 TCP 66 48956 > http [ACK] Seq=98 Ack=263156 Win=502912 Len=0 TSval=22286390 TSecr=675006080
 72   0.040108 54.230.30.244 -> 172.31.36.109 TCP 7306 [TCP segment of a reassembled PDU]
 73   0.040137 172.31.36.109 -> 54.230.30.244 TCP 66 48956 > http [ACK] Seq=98 Ack=270396 Win=517376 Len=0 TSval=22286390 TSecr=675006080
 74   0.040417 54.230.30.244 -> 172.31.36.109 TCP 2962 [TCP segment of a reassembled PDU]
 75   0.040429 172.31.36.109 -> 54.230.30.244 TCP 66 48956 > http [ACK] Seq=98 Ack=273292 Win=523136 Len=0 TSval=22286390 TSecr=675006080
 76   0.040615 54.230.30.244 -> 172.31.36.109 TCP 8754 [TCP segment of a reassembled PDU]
 77   0.040622 172.31.36.109 -> 54.230.30.244 TCP 66 48956 > http [ACK] Seq=98 Ack=281980 Win=540544 Len=0 TSval=22286390 TSecr=675006080
 78   0.040739 54.230.30.244 -> 172.31.36.109 TCP 10202 [TCP segment of a reassembled PDU]
 79   0.040764 172.31.36.109 -> 54.230.30.244 TCP 66 48956 > http [ACK] Seq=98 Ack=292116 Win=541952 Len=0 TSval=22286390 TSecr=675006080
 80   0.041306 54.230.30.244 -> 172.31.36.109 TCP 5858 [TCP segment of a reassembled PDU]
 81   0.041338 172.31.36.109 -> 54.230.30.244 TCP 66 48956 > http [ACK] Seq=98 Ack=297908 Win=549120 Len=0 TSval=22286391 TSecr=675006080
 82   0.041471 54.230.30.244 -> 172.31.36.109 TCP 24682 [TCP segment of a reassembled PDU]
 83   0.041483 172.31.36.109 -> 54.230.30.244 TCP 66 48956 > http [ACK] Seq=98 Ack=322524 Win=607872 Len=0 TSval=22286391 TSecr=675006080
 84   0.042078 54.230.30.244 -> 172.31.36.109 TCP 2962 [TCP segment of a reassembled PDU]
 85   0.042083 172.31.36.109 -> 54.230.30.244 TCP 66 48956 > http [ACK] Seq=98 Ack=325420 Win=613632 Len=0 TSval=22286391 TSecr=675006080
 86   0.042353 54.230.30.244 -> 172.31.36.109 TCP 10202 [TCP segment of a reassembled PDU]
 87   0.042382 172.31.36.109 -> 54.230.30.244 TCP 66 48956 > http [ACK] Seq=98 Ack=335556 Win=633984 Len=0 TSval=22286391 TSecr=675006080
 88   0.042499 54.230.30.244 -> 172.31.36.109 TCP 10202 [TCP segment of a reassembled PDU]
 89   0.042522 172.31.36.109 -> 54.230.30.244 TCP 66 48956 > http [ACK] Seq=98 Ack=345692 Win=654208 Len=0 TSval=22286391 TSecr=675006080
 90   0.042815 54.230.30.244 -> 172.31.36.109 TCP 2962 [TCP segment of a reassembled PDU]
 91   0.042820 172.31.36.109 -> 54.230.30.244 TCP 66 48956 > http [ACK] Seq=98 Ack=348588 Win=659968 Len=0 TSval=22286391 TSecr=675006080
 92   0.042997 54.230.30.244 -> 172.31.36.109 TCP 10202 [TCP segment of a reassembled PDU]
 93   0.043005 172.31.36.109 -> 54.230.30.244 TCP 66 48956 > http [ACK] Seq=98 Ack=358724 Win=680320 Len=0 TSval=22286391 TSecr=675006080
 94   0.043186 54.230.30.244 -> 172.31.36.109 TCP 8754 [TCP segment of a reassembled PDU]
 95   0.043193 172.31.36.109 -> 54.230.30.244 TCP 66 48956 > http [ACK] Seq=98 Ack=367412 Win=697600 Len=0 TSval=22286391 TSecr=675006080
 96   0.043212 54.230.30.244 -> 172.31.36.109 TCP 17442 [TCP segment of a reassembled PDU]
 97   0.043224 172.31.36.109 -> 54.230.30.244 TCP 66 48956 > http [ACK] Seq=98 Ack=384788 Win=706304 Len=0 TSval=22286391 TSecr=675006080
 98   0.043258 54.230.30.244 -> 172.31.36.109 TCP 5858 [TCP segment of a reassembled PDU]
 99   0.043263 172.31.36.109 -> 54.230.30.244 TCP 66 48956 > http [ACK] Seq=98 Ack=390580 Win=700544 Len=0 TSval=22286391 TSecr=675006080
100   0.043916 54.230.30.244 -> 172.31.36.109 TCP 4410 [TCP segment of a reassembled PDU]
101   0.043945 172.31.36.109 -> 54.230.30.244 TCP 66 48956 > http [ACK] Seq=98 Ack=394924 Win=741120 Len=0 TSval=22286391 TSecr=675006080
102   0.044034 54.230.30.244 -> 172.31.36.109 TCP 1514 [TCP segment of a reassembled PDU]
103   0.044045 172.31.36.109 -> 54.230.30.244 TCP 66 48956 > http [ACK] Seq=98 Ack=396372 Win=743936 Len=0 TSval=22286391 TSecr=675006080
104   0.044145 54.230.30.244 -> 172.31.36.109 TCP 13098 [TCP segment of a reassembled PDU]
105   0.044153 172.31.36.109 -> 54.230.30.244 TCP 66 48956 > http [ACK] Seq=98 Ack=409404 Win=744576 Len=0 TSval=22286391 TSecr=675006080
106   0.044250 54.230.30.244 -> 172.31.36.109 TCP 8754 [TCP segment of a reassembled PDU]
107   0.044257 172.31.36.109 -> 54.230.30.244 TCP 66 48956 > http [ACK] Seq=98 Ack=418092 Win=751616 Len=0 TSval=22286391 TSecr=675006080
108   0.044450 54.230.30.244 -> 172.31.36.109 TCP 2962 [TCP segment of a reassembled PDU]
109   0.044455 172.31.36.109 -> 54.230.30.244 TCP 66 48956 > http [ACK] Seq=98 Ack=420988 Win=761088 Len=0 TSval=22286391 TSecr=675006080
110   0.044586 54.230.30.244 -> 172.31.36.109 TCP 18890 [TCP segment of a reassembled PDU]
111   0.044607 172.31.36.109 -> 54.230.30.244 TCP 66 48956 > http [ACK] Seq=98 Ack=439812 Win=742272 Len=0 TSval=22286391 TSecr=675006080
112   0.044699 54.230.30.244 -> 172.31.36.109 TCP 13098 [TCP segment of a reassembled PDU]
113   0.044707 172.31.36.109 -> 54.230.30.244 TCP 66 48956 > http [ACK] Seq=98 Ack=452844 Win=744576 Len=0 TSval=22286391 TSecr=675006080
114   0.044914 54.230.30.244 -> 172.31.36.109 TCP 5730 [TCP segment of a reassembled PDU]
115   0.044920 172.31.36.109 -> 54.230.30.244 TCP 66 48956 > http [ACK] Seq=98 Ack=458508 Win=756352 Len=0 TSval=22286391 TSecr=675006080
116   0.052832 54.230.30.244 -> 172.31.36.109 TCP 4410 [TCP segment of a reassembled PDU]
117   0.052854 172.31.36.109 -> 54.230.30.244 TCP 66 48956 > http [ACK] Seq=98 Ack=462852 Win=758784 Len=0 TSval=22286393 TSecr=675006081
118   0.053101 54.230.30.244 -> 172.31.36.109 TCP 39162 [TCP segment of a reassembled PDU]
119   0.053147 172.31.36.109 -> 54.230.30.244 TCP 66 48956 > http [ACK] Seq=98 Ack=501948 Win=719744 Len=0 TSval=22286393 TSecr=675006081
120   0.053184 54.230.30.244 -> 172.31.36.109 TCP 14546 [TCP segment of a reassembled PDU]
121   0.053192 172.31.36.109 -> 54.230.30.244 TCP 66 48956 > http [ACK] Seq=98 Ack=516428 Win=742016 Len=0 TSval=22286393 TSecr=675006081
122   0.053317 54.230.30.244 -> 172.31.36.109 TCP 7682 [TCP segment of a reassembled PDU]
123   0.053333 54.230.30.244 -> 172.31.36.109 TCP 15994 [TCP segment of a reassembled PDU]
124   0.053391 54.230.30.244 -> 172.31.36.109 TCP 1514 [TCP segment of a reassembled PDU]
125   0.053438 172.31.36.109 -> 54.230.30.244 TCP 66 48956 > http [ACK] Seq=98 Ack=541420 Win=722816 Len=0 TSval=22286394 TSecr=675006081
126   0.054368 54.230.30.244 -> 172.31.36.109 TCP 4410 [TCP segment of a reassembled PDU]
127   0.054393 172.31.36.109 -> 54.230.30.244 TCP 66 48956 > http [ACK] Seq=98 Ack=545764 Win=758784 Len=0 TSval=22286394 TSecr=675006081
128   0.054443 54.230.30.244 -> 172.31.36.109 TCP 1514 [TCP segment of a reassembled PDU]
129   0.054662 54.230.30.244 -> 172.31.36.109 TCP 15994 [TCP segment of a reassembled PDU]
130   0.054683 172.31.36.109 -> 54.230.30.244 TCP 66 48956 > http [ACK] Seq=98 Ack=563140 Win=761344 Len=0 TSval=22286394 TSecr=675006081
131   0.054733 54.230.30.244 -> 172.31.36.109 TCP 8754 [TCP segment of a reassembled PDU]
132   0.054749 172.31.36.109 -> 54.230.30.244 TCP 66 48956 > http [ACK] Seq=98 Ack=571828 Win=761344 Len=0 TSval=22286394 TSecr=675006081
133   0.054917 54.230.30.244 -> 172.31.36.109 TCP 14546 [TCP segment of a reassembled PDU]
134   0.054937 172.31.36.109 -> 54.230.30.244 TCP 66 48956 > http [ACK] Seq=98 Ack=586308 Win=761344 Len=0 TSval=22286394 TSecr=675006081
135   0.055000 54.230.30.244 -> 172.31.36.109 TCP 1514 [TCP segment of a reassembled PDU]
136   0.055006 54.230.30.244 -> 172.31.36.109 TCP 2962 [TCP segment of a reassembled PDU]
137   0.055018 172.31.36.109 -> 54.230.30.244 TCP 66 48956 > http [ACK] Seq=98 Ack=590652 Win=761344 Len=0 TSval=22286394 TSecr=675006081
138   0.055215 54.230.30.244 -> 172.31.36.109 TCP 8754 [TCP segment of a reassembled PDU]
139   0.055232 172.31.36.109 -> 54.230.30.244 TCP 66 48956 > http [ACK] Seq=98 Ack=599340 Win=761344 Len=0 TSval=22286394 TSecr=675006081
140   0.055285 54.230.30.244 -> 172.31.36.109 TCP 7306 [TCP segment of a reassembled PDU]
141   0.055423 172.31.36.109 -> 54.230.30.244 TCP 66 48956 > http [ACK] Seq=98 Ack=606580 Win=761344 Len=0 TSval=22286394 TSecr=675006081
142   0.055657 54.230.30.244 -> 172.31.36.109 TCP 4410 [TCP segment of a reassembled PDU]
143   0.055694 172.31.36.109 -> 54.230.30.244 TCP 66 48956 > http [ACK] Seq=98 Ack=610924 Win=761344 Len=0 TSval=22286394 TSecr=675006081
144   0.055765 54.230.30.244 -> 172.31.36.109 TCP 1514 [TCP segment of a reassembled PDU]
145   0.055850 54.230.30.244 -> 172.31.36.109 TCP 1514 [TCP segment of a reassembled PDU]
146   0.055854 172.31.36.109 -> 54.230.30.244 TCP 66 48956 > http [ACK] Seq=98 Ack=613820 Win=761344 Len=0 TSval=22286394 TSecr=675006081
147   0.056009 54.230.30.244 -> 172.31.36.109 TCP 23234 [TCP segment of a reassembled PDU]
148   0.056030 172.31.36.109 -> 54.230.30.244 TCP 66 48956 > http [ACK] Seq=98 Ack=636988 Win=738176 Len=0 TSval=22286394 TSecr=675006081
149   0.056247 54.230.30.244 -> 172.31.36.109 TCP 13098 [TCP segment of a reassembled PDU]
150   0.056255 172.31.36.109 -> 54.230.30.244 TCP 66 48956 > http [ACK] Seq=98 Ack=650020 Win=744576 Len=0 TSval=22286394 TSecr=675006081
151   0.056447 54.230.30.244 -> 172.31.36.109 TCP 5162 [TCP segment of a reassembled PDU]
152   0.056453 172.31.36.109 -> 54.230.30.244 TCP 66 48956 > http [ACK] Seq=98 Ack=655116 Win=756352 Len=0 TSval=22286394 TSecr=675006081
153   0.070002 54.230.30.244 -> 172.31.36.109 TCP 2962 [TCP segment of a reassembled PDU]
154   0.070008 172.31.36.109 -> 54.230.30.244 TCP 66 48956 > http [ACK] Seq=98 Ack=658012 Win=761088 Len=0 TSval=22286398 TSecr=675006083
155   0.070102 54.230.30.244 -> 172.31.36.109 TCP 8754 [TCP segment of a reassembled PDU]
156   0.070120 172.31.36.109 -> 54.230.30.244 TCP 66 48956 > http [ACK] Seq=98 Ack=666700 Win=761344 Len=0 TSval=22286398 TSecr=675006083
157   0.070238 54.230.30.244 -> 172.31.36.109 TCP 20338 [TCP segment of a reassembled PDU]
158   0.070260 172.31.36.109 -> 54.230.30.244 TCP 66 48956 > http [ACK] Seq=98 Ack=686972 Win=741120 Len=0 TSval=22286398 TSecr=675006083
159   0.070436 54.230.30.244 -> 172.31.36.109 TCP 7306 [TCP segment of a reassembled PDU]
160   0.070442 172.31.36.109 -> 54.230.30.244 TCP 66 48956 > http [ACK] Seq=98 Ack=694212 Win=754048 Len=0 TSval=22286398 TSecr=675006083
161   0.070693 54.230.30.244 -> 172.31.36.109 TCP 10202 [TCP segment of a reassembled PDU]
162   0.070701 54.230.30.244 -> 172.31.36.109 TCP 1514 [TCP segment of a reassembled PDU]
163   0.070711 54.230.30.244 -> 172.31.36.109 TCP 5858 [TCP segment of a reassembled PDU]
164   0.070727 172.31.36.109 -> 54.230.30.244 TCP 66 48956 > http [ACK] Seq=98 Ack=711588 Win=756352 Len=0 TSval=22286398 TSecr=675006083
165   0.070737 54.230.30.244 -> 172.31.36.109 TCP 5858 [TCP segment of a reassembled PDU]
166   0.070746 54.230.30.244 -> 172.31.36.109 TCP 3338 [TCP segment of a reassembled PDU]
167   0.070760 172.31.36.109 -> 54.230.30.244 TCP 66 48956 > http [ACK] Seq=98 Ack=720652 Win=761344 Len=0 TSval=22286398 TSecr=675006083
168   0.089499 54.230.30.244 -> 172.31.36.109 TCP 1514 [TCP segment of a reassembled PDU]
169   0.089507 54.230.30.244 -> 172.31.36.109 TCP 5858 [TCP segment of a reassembled PDU]
170   0.089514 54.230.30.244 -> 172.31.36.109 TCP 7306 [TCP segment of a reassembled PDU]
171   0.089534 172.31.36.109 -> 54.230.30.244 TCP 66 48956 > http [ACK] Seq=98 Ack=735132 Win=761344 Len=0 TSval=22286403 TSecr=675006085
172   0.089860 54.230.30.244 -> 172.31.36.109 TCP 1514 [TCP segment of a reassembled PDU]
173   0.090021 54.230.30.244 -> 172.31.36.109 TCP 20338 [TCP segment of a reassembled PDU]
174   0.090041 54.230.30.244 -> 172.31.36.109 TCP 13098 [TCP segment of a reassembled PDU]
175   0.090056 54.230.30.244 -> 172.31.36.109 TCP 2962 [TCP segment of a reassembled PDU]
176   0.090067 172.31.36.109 -> 54.230.30.244 TCP 66 48956 > http [ACK] Seq=98 Ack=772780 Win=723712 Len=0 TSval=22286403 TSecr=675006085
177   0.090315 54.230.30.244 -> 172.31.36.109 TCP 8754 [TCP segment of a reassembled PDU]
178   0.090344 172.31.36.109 -> 54.230.30.244 TCP 66 48956 > http [ACK] Seq=98 Ack=781468 Win=751616 Len=0 TSval=22286403 TSecr=675006085
179   0.090394 54.230.30.244 -> 172.31.36.109 TCP 4786 [TCP segment of a reassembled PDU]
180   0.090400 172.31.36.109 -> 54.230.30.244 TCP 66 48956 > http [ACK] Seq=98 Ack=786188 Win=756352 Len=0 TSval=22286403 TSecr=675006085
181   0.099393 54.230.30.244 -> 172.31.36.109 TCP 5858 [TCP segment of a reassembled PDU]
182   0.099401 172.31.36.109 -> 54.230.30.244 TCP 66 48956 > http [ACK] Seq=98 Ack=791980 Win=756352 Len=0 TSval=22286405 TSecr=675006086
183   0.099488 54.230.30.244 -> 172.31.36.109 TCP 21786 [TCP segment of a reassembled PDU]
184   0.099510 172.31.36.109 -> 54.230.30.244 TCP 66 48956 > http [ACK] Seq=98 Ack=813700 Win=734720 Len=0 TSval=22286405 TSecr=675006086
185   0.099579 54.230.30.244 -> 172.31.36.109 TCP 14546 [TCP segment of a reassembled PDU]
186   0.099589 172.31.36.109 -> 54.230.30.244 TCP 66 48956 > http [ACK] Seq=98 Ack=828180 Win=742016 Len=0 TSval=22286405 TSecr=675006086
187   0.099667 54.230.30.244 -> 172.31.36.109 TCP 2962 [TCP segment of a reassembled PDU]
188   0.099672 172.31.36.109 -> 54.230.30.244 TCP 66 48956 > http [ACK] Seq=98 Ack=831076 Win=761088 Len=0 TSval=22286405 TSecr=675006086
189   0.099908 54.230.30.244 -> 172.31.36.109 TCP 18890 [TCP segment of a reassembled PDU]
190   0.099949 54.230.30.244 -> 172.31.36.109 TCP 1890 [TCP segment of a reassembled PDU]
191   0.099967 54.230.30.244 -> 172.31.36.109 TCP 26130 [TCP segment of a reassembled PDU]
192   0.100065 54.230.30.244 -> 172.31.36.109 TCP 2962 [TCP segment of a reassembled PDU]
193   0.100172 172.31.36.109 -> 54.230.30.244 TCP 66 48956 > http [ACK] Seq=98 Ack=880684 Win=711552 Len=0 TSval=22286405 TSecr=675006086
194   0.100193 54.230.30.244 -> 172.31.36.109 TCP 4410 [TCP segment of a reassembled PDU]
195   0.100209 172.31.36.109 -> 54.230.30.244 TCP 66 48956 > http [ACK] Seq=98 Ack=885028 Win=754048 Len=0 TSval=22286405 TSecr=675006086
196   0.101032 54.230.30.244 -> 172.31.36.109 TCP 2962 [TCP segment of a reassembled PDU]
197   0.101065 172.31.36.109 -> 54.230.30.244 TCP 66 48956 > http [ACK] Seq=98 Ack=887924 Win=761088 Len=0 TSval=22286405 TSecr=675006086
198   0.101293 54.230.30.244 -> 172.31.36.109 TCP 7306 [TCP segment of a reassembled PDU]
199   0.101334 172.31.36.109 -> 54.230.30.244 TCP 66 48956 > http [ACK] Seq=98 Ack=895164 Win=761344 Len=0 TSval=22286406 TSecr=675006086
200   0.101487 54.230.30.244 -> 172.31.36.109 TCP 36266 [TCP segment of a reassembled PDU]
201   0.101523 172.31.36.109 -> 54.230.30.244 TCP 66 48956 > http [ACK] Seq=98 Ack=931364 Win=725248 Len=0 TSval=22286406 TSecr=675006086
202   0.101667 54.230.30.244 -> 172.31.36.109 TCP 5858 [TCP segment of a reassembled PDU]
203   0.101682 172.31.36.109 -> 54.230.30.244 TCP 66 48956 > http [ACK] Seq=98 Ack=937156 Win=756352 Len=0 TSval=22286406 TSecr=675006086
204   0.101843 54.230.30.244 -> 172.31.36.109 TCP 21786 [TCP segment of a reassembled PDU]
205   0.101855 54.230.30.244 -> 172.31.36.109 TCP 1514 [TCP segment of a reassembled PDU]
206   0.101877 172.31.36.109 -> 54.230.30.244 TCP 66 48956 > http [ACK] Seq=98 Ack=960324 Win=733184 Len=0 TSval=22286406 TSecr=675006086
207   0.101990 54.230.30.244 -> 172.31.36.109 TCP 4410 [TCP segment of a reassembled PDU]
208   0.101995 172.31.36.109 -> 54.230.30.244 TCP 66 48956 > http [ACK] Seq=98 Ack=964668 Win=758784 Len=0 TSval=22286406 TSecr=675006086
209   0.102111 54.230.30.244 -> 172.31.36.109 TCP 18890 [TCP segment of a reassembled PDU]
210   0.102143 172.31.36.109 -> 54.230.30.244 TCP 66 48956 > http [ACK] Seq=98 Ack=983492 Win=739968 Len=0 TSval=22286406 TSecr=675006086
211   0.102245 54.230.30.244 -> 172.31.36.109 TCP 4410 [TCP segment of a reassembled PDU]
212   0.102259 172.31.36.109 -> 54.230.30.244 TCP 66 48956 > http [ACK] Seq=98 Ack=987836 Win=758784 Len=0 TSval=22286406 TSecr=675006086
213   0.103059 54.230.30.244 -> 172.31.36.109 TCP 4410 [TCP segment of a reassembled PDU]
214   0.103091 172.31.36.109 -> 54.230.30.244 TCP 66 48956 > http [ACK] Seq=98 Ack=992180 Win=758784 Len=0 TSval=22286406 TSecr=675006086
215   0.103297 54.230.30.244 -> 172.31.36.109 TCP 27578 [TCP segment of a reassembled PDU]
216   0.103322 172.31.36.109 -> 54.230.30.244 TCP 66 48956 > http [ACK] Seq=98 Ack=1019692 Win=731392 Len=0 TSval=22286406 TSecr=675006086
217   0.103503 54.230.30.244 -> 172.31.36.109 TCP 26130 [TCP segment of a reassembled PDU]
218   0.103538 172.31.36.109 -> 54.230.30.244 TCP 66 48956 > http [ACK] Seq=98 Ack=1045756 Win=723072 Len=0 TSval=22286406 TSecr=675006086
219   0.103614 54.230.30.244 -> 172.31.36.109 TCP 2642 [TCP segment of a reassembled PDU]
220   0.103619 172.31.36.109 -> 54.230.30.244 TCP 66 48956 > http [ACK] Seq=98 Ack=1048332 Win=761088 Len=0 TSval=22286406 TSecr=675006086
221   0.104112 54.230.30.244 -> 172.31.36.109 TCP 1514 [TCP segment of a reassembled PDU]
222   0.104151 54.230.30.244 -> 172.31.36.109 TCP 7306 [TCP segment of a reassembled PDU]
223   0.104165 172.31.36.109 -> 54.230.30.244 TCP 66 48956 > http [ACK] Seq=98 Ack=1057020 Win=761344 Len=0 TSval=22286406 TSecr=675006086
224   0.104297 54.230.30.244 -> 172.31.36.109 TCP 17442 [TCP segment of a reassembled PDU]
225   0.104325 172.31.36.109 -> 54.230.30.244 TCP 66 48956 > http [ACK] Seq=98 Ack=1074396 Win=744064 Len=0 TSval=22286406 TSecr=675006086
226   0.104426 54.230.30.244 -> 172.31.36.109 TCP 2962 [TCP segment of a reassembled PDU]
227   0.104431 172.31.36.109 -> 54.230.30.244 TCP 66 48956 > http [ACK] Seq=98 Ack=1077292 Win=761088 Len=0 TSval=22286406 TSecr=675006086
228   0.105114 54.230.30.244 -> 172.31.36.109 TCP 4410 [TCP segment of a reassembled PDU]
229   0.105152 172.31.36.109 -> 54.230.30.244 TCP 66 48956 > http [ACK] Seq=98 Ack=1081636 Win=761344 Len=0 TSval=22286406 TSecr=675006086
230   0.105354 54.230.30.244 -> 172.31.36.109 TCP 26130 [TCP segment of a reassembled PDU]
231   0.105380 172.31.36.109 -> 54.230.30.244 TCP 66 48956 > http [ACK] Seq=98 Ack=1107700 Win=735360 Len=0 TSval=22286407 TSecr=675006086
232   0.105457 54.230.30.244 -> 172.31.36.109 TCP 6234 [TCP segment of a reassembled PDU]
233   0.105463 172.31.36.109 -> 54.230.30.244 TCP 66 48956 > http [ACK] Seq=98 Ack=1113868 Win=754048 Len=0 TSval=22286407 TSecr=675006086
234   0.134391 54.230.30.244 -> 172.31.36.109 TCP 1514 [TCP segment of a reassembled PDU]
235   0.134400 54.230.30.244 -> 172.31.36.109 TCP 2962 [TCP segment of a reassembled PDU]
236   0.134404 172.31.36.109 -> 54.230.30.244 TCP 66 48956 > http [ACK] Seq=98 Ack=1118212 Win=758784 Len=0 TSval=22286414 TSecr=675006089
237   0.134599 54.230.30.244 -> 172.31.36.109 TCP 20338 [TCP segment of a reassembled PDU]
238   0.134622 172.31.36.109 -> 54.230.30.244 TCP 66 48956 > http [ACK] Seq=98 Ack=1138484 Win=738560 Len=0 TSval=22286414 TSecr=675006089
239   0.134718 54.230.30.244 -> 172.31.36.109 TCP 1514 [TCP segment of a reassembled PDU]
240   0.134727 54.230.30.244 -> 172.31.36.109 TCP 7306 [TCP segment of a reassembled PDU]
241   0.134732 172.31.36.109 -> 54.230.30.244 TCP 66 48956 > http [ACK] Seq=98 Ack=1147172 Win=751616 Len=0 TSval=22286414 TSecr=675006089
242   0.134865 54.230.30.244 -> 172.31.36.109 TCP 13098 [TCP segment of a reassembled PDU]
243   0.134894 54.230.30.244 -> 172.31.36.109 TCP 8754 [TCP segment of a reassembled PDU]
244   0.134910 172.31.36.109 -> 54.230.30.244 TCP 66 48956 > http [ACK] Seq=98 Ack=1168892 Win=751616 Len=0 TSval=22286414 TSecr=675006089
245   0.135014 54.230.30.244 -> 172.31.36.109 TCP 10578 [TCP segment of a reassembled PDU]
246   0.135057 172.31.36.109 -> 54.230.30.244 TCP 66 48956 > http [ACK] Seq=98 Ack=1179404 Win=761344 Len=0 TSval=22286414 TSecr=675006089
247   0.142374 54.230.30.244 -> 172.31.36.109 TCP 1514 [TCP segment of a reassembled PDU]
248   0.142528 54.230.30.244 -> 172.31.36.109 TCP 7306 [TCP segment of a reassembled PDU]
249   0.142541 172.31.36.109 -> 54.230.30.244 TCP 66 48956 > http [ACK] Seq=98 Ack=1188092 Win=761344 Len=0 TSval=22286416 TSecr=675006090
250   0.142651 54.230.30.244 -> 172.31.36.109 TCP 18890 [TCP segment of a reassembled PDU]
251   0.142669 54.230.30.244 -> 172.31.36.109 TCP 10202 [TCP segment of a reassembled PDU]
252   0.142681 172.31.36.109 -> 54.230.30.244 TCP 66 48956 > http [ACK] Seq=98 Ack=1217052 Win=732416 Len=0 TSval=22286416 TSecr=675006090
253   0.142706 54.230.30.244 -> 172.31.36.109 TCP 5858 [TCP segment of a reassembled PDU]
254   0.142711 172.31.36.109 -> 54.230.30.244 TCP 66 48956 > http [ACK] Seq=98 Ack=1222844 Win=756352 Len=0 TSval=22286416 TSecr=675006090
255   0.142855 54.230.30.244 -> 172.31.36.109 TCP 11650 [TCP segment of a reassembled PDU]
256   0.142869 54.230.30.244 -> 172.31.36.109 TCP 10202 [TCP segment of a reassembled PDU]
257   0.142921 172.31.36.109 -> 54.230.30.244 TCP 66 48956 > http [ACK] Seq=98 Ack=1244564 Win=749312 Len=0 TSval=22286416 TSecr=675006090
258   0.143200 54.230.30.244 -> 172.31.36.109 TCP 10202 [TCP segment of a reassembled PDU]
259   0.143208 172.31.36.109 -> 54.230.30.244 TCP 66 48956 > http [ACK] Seq=98 Ack=1254700 Win=749312 Len=0 TSval=22286416 TSecr=675006090
260   0.143229 54.230.30.244 -> 172.31.36.109 TCP 20338 [TCP segment of a reassembled PDU]
261   0.143247 172.31.36.109 -> 54.230.30.244 TCP 66 48956 > http [ACK] Seq=98 Ack=1274972 Win=732544 Len=0 TSval=22286416 TSecr=675006090
262   0.143313 54.230.30.244 -> 172.31.36.109 TCP 1514 [TCP segment of a reassembled PDU]
263   0.144107 54.230.30.244 -> 172.31.36.109 TCP 7306 [TCP segment of a reassembled PDU]
264   0.144114 172.31.36.109 -> 54.230.30.244 TCP 66 48956 > http [ACK] Seq=98 Ack=1283660 Win=754048 Len=0 TSval=22286416 TSecr=675006090
265   0.144165 54.230.30.244 -> 172.31.36.109 TCP 7306 [TCP segment of a reassembled PDU]
266   0.144172 172.31.36.109 -> 54.230.30.244 TCP 66 48956 > http [ACK] Seq=98 Ack=1290900 Win=754048 Len=0 TSval=22286416 TSecr=675006090
267   0.144429 54.230.30.244 -> 172.31.36.109 TCP 15994 [TCP segment of a reassembled PDU]
268   0.144456 54.230.30.244 -> 172.31.36.109 TCP 3714 [TCP segment of a reassembled PDU]
269   0.144467 172.31.36.109 -> 54.230.30.244 TCP 66 48956 > http [ACK] Seq=98 Ack=1310476 Win=758784 Len=0 TSval=22286416 TSecr=675006090
270   0.153761 54.230.30.244 -> 172.31.36.109 TCP 2962 [TCP segment of a reassembled PDU]
271   0.153766 172.31.36.109 -> 54.230.30.244 TCP 66 48956 > http [ACK] Seq=98 Ack=1313372 Win=761088 Len=0 TSval=22286419 TSecr=675006091
272   0.153909 54.230.30.244 -> 172.31.36.109 TCP 2962 [TCP segment of a reassembled PDU]
273   0.153914 172.31.36.109 -> 54.230.30.244 TCP 66 48956 > http [ACK] Seq=98 Ack=1316268 Win=761088 Len=0 TSval=22286419 TSecr=675006091
274   0.153920 54.230.30.244 -> 172.31.36.109 TCP 2962 [TCP segment of a reassembled PDU]
275   0.153932 54.230.30.244 -> 172.31.36.109 TCP 11650 [TCP segment of a reassembled PDU]
276   0.153968 172.31.36.109 -> 54.230.30.244 TCP 66 48956 > http [ACK] Seq=98 Ack=1330748 Win=746880 Len=0 TSval=22286419 TSecr=675006091
277   0.154079 54.230.30.244 -> 172.31.36.109 TCP 4410 [TCP segment of a reassembled PDU]
278   0.154085 172.31.36.109 -> 54.230.30.244 TCP 66 48956 > http [ACK] Seq=98 Ack=1335092 Win=758784 Len=0 TSval=22286419 TSecr=675006091
279   0.154300 54.230.30.244 -> 172.31.36.109 TCP 4410 [TCP segment of a reassembled PDU]
280   0.154465 54.230.30.244 -> 172.31.36.109 TCP 14546 [TCP segment of a reassembled PDU]
281   0.154479 54.230.30.244 -> 172.31.36.109 TCP 11650 [TCP segment of a reassembled PDU]
282   0.154573 54.230.30.244 -> 172.31.36.109 TCP 1514 [TCP segment of a reassembled PDU]
283   0.154580 54.230.30.244 -> 172.31.36.109 TCP 5858 [TCP segment of a reassembled PDU]
284   0.154669 54.230.30.244 -> 172.31.36.109 TCP 3338 [TCP segment of a reassembled PDU]
285   0.157486 172.31.36.109 -> 54.230.30.244 TCP 66 48956 > http [ACK] Seq=98 Ack=1376012 Win=717952 Len=0 TSval=22286420 TSecr=675006091
286   0.206039 54.230.30.244 -> 172.31.36.109 TCP 2962 [TCP segment of a reassembled PDU]
287   0.206048 172.31.36.109 -> 54.230.30.244 TCP 66 48956 > http [ACK] Seq=98 Ack=1378908 Win=761088 Len=0 TSval=22286432 TSecr=675006096
288   0.206134 54.230.30.244 -> 172.31.36.109 TCP 10202 [TCP segment of a reassembled PDU]
289   0.206153 172.31.36.109 -> 54.230.30.244 TCP 66 48956 > http [ACK] Seq=98 Ack=1389044 Win=761344 Len=0 TSval=22286432 TSecr=675006096
290   0.206724 54.230.30.244 -> 172.31.36.109 TCP 2962 [TCP segment of a reassembled PDU]
291   0.206740 172.31.36.109 -> 54.230.30.244 TCP 66 48956 > http [ACK] Seq=98 Ack=1391940 Win=761344 Len=0 TSval=22286432 TSecr=675006096
292   0.206858 54.230.30.244 -> 172.31.36.109 TCP 11650 [TCP segment of a reassembled PDU]
293   0.206880 172.31.36.109 -> 54.230.30.244 TCP 66 48956 > http [ACK] Seq=98 Ack=1403524 Win=761344 Len=0 TSval=22286432 TSecr=675006096
294   0.207014 54.230.30.244 -> 172.31.36.109 TCP 23234 [TCP segment of a reassembled PDU]
295   0.207037 54.230.30.244 -> 172.31.36.109 TCP 8754 [TCP segment of a reassembled PDU]
296   0.207054 54.230.30.244 -> 172.31.36.109 TCP 1514 [TCP segment of a reassembled PDU]
297   0.207060 172.31.36.109 -> 54.230.30.244 TCP 66 48956 > http [ACK] Seq=98 Ack=1435380 Win=729600 Len=0 TSval=22286432 TSecr=675006096
298   0.207246 54.230.30.244 -> 172.31.36.109 TCP 4786 [TCP segment of a reassembled PDU]
299   0.207252 172.31.36.109 -> 54.230.30.244 TCP 66 48956 > http [ACK] Seq=98 Ack=1441548 Win=756352 Len=0 TSval=22286432 TSecr=675006096
300   0.207983 54.230.30.244 -> 172.31.36.109 TCP 2962 [TCP segment of a reassembled PDU]
301   0.207988 172.31.36.109 -> 54.230.30.244 TCP 66 48956 > http [ACK] Seq=98 Ack=1444444 Win=761088 Len=0 TSval=22286432 TSecr=675006097
302   0.208081 54.230.30.244 -> 172.31.36.109 TCP 15994 [TCP segment of a reassembled PDU]
303   0.208302 54.230.30.244 -> 172.31.36.109 TCP 29026 [TCP segment of a reassembled PDU]
304   0.208345 172.31.36.109 -> 54.230.30.244 TCP 66 48956 > http [ACK] Seq=98 Ack=1489332 Win=718208 Len=0 TSval=22286432 TSecr=675006097
305   0.208436 54.230.30.244 -> 172.31.36.109 TCP 15994 [TCP segment of a reassembled PDU]
306   0.208446 172.31.36.109 -> 54.230.30.244 TCP 66 48956 > http [ACK] Seq=98 Ack=1505260 Win=739712 Len=0 TSval=22286432 TSecr=675006097
307   0.208527 54.230.30.244 -> 172.31.36.109 TCP 1890 [TCP segment of a reassembled PDU]
308   0.208532 172.31.36.109 -> 54.230.30.244 TCP 66 48956 > http [ACK] Seq=98 Ack=1507084 Win=761088 Len=0 TSval=22286432 TSecr=675006097
309   0.220596 54.230.30.244 -> 172.31.36.109 TCP 1514 [TCP segment of a reassembled PDU]
310   0.220605 54.230.30.244 -> 172.31.36.109 TCP 2962 [TCP segment of a reassembled PDU]
311   0.220622 172.31.36.109 -> 54.230.30.244 TCP 66 48956 > http [ACK] Seq=98 Ack=1511428 Win=761344 Len=0 TSval=22286435 TSecr=675006098
312   0.220711 54.230.30.244 -> 172.31.36.109 TCP 8754 [TCP segment of a reassembled PDU]
313   0.220727 54.230.30.244 -> 172.31.36.109 TCP 10202 [TCP segment of a reassembled PDU]
314   0.220745 172.31.36.109 -> 54.230.30.244 TCP 66 48956 > http [ACK] Seq=98 Ack=1530252 Win=749312 Len=0 TSval=22286435 TSecr=675006098
315   0.220761 54.230.30.244 -> 172.31.36.109 TCP 5858 [TCP segment of a reassembled PDU]
316   0.220776 172.31.36.109 -> 54.230.30.244 TCP 66 48956 > http [ACK] Seq=98 Ack=1536044 Win=761344 Len=0 TSval=22286435 TSecr=675006098
317   0.220960 54.230.30.244 -> 172.31.36.109 TCP 4410 [TCP segment of a reassembled PDU]
318   0.220978 172.31.36.109 -> 54.230.30.244 TCP 66 48956 > http [ACK] Seq=98 Ack=1540388 Win=761344 Len=0 TSval=22286435 TSecr=675006098
319   0.221144 54.230.30.244 -> 172.31.36.109 TCP 4410 [TCP segment of a reassembled PDU]
320   0.221155 54.230.30.244 -> 172.31.36.109 TCP 13098 [TCP segment of a reassembled PDU]
321   0.221171 54.230.30.244 -> 172.31.36.109 TCP 14546 [TCP segment of a reassembled PDU]
322   0.221193 172.31.36.109 -> 54.230.30.244 TCP 66 48956 > http [ACK] Seq=98 Ack=1572244 Win=729600 Len=0 TSval=22286435 TSecr=675006098
323   0.221420 54.230.30.244 -> 172.31.36.109 TCP 2962 [TCP segment of a reassembled PDU]
324   0.221426 172.31.36.109 -> 54.230.30.244 TCP 66 48956 > http [ACK] Seq=98 Ack=1575140 Win=761088 Len=0 TSval=22286436 TSecr=675006098
325   0.221576 54.230.30.244 -> 172.31.36.109 TCP 7306 [TCP segment of a reassembled PDU]
326   0.221597 54.230.30.244 -> 172.31.36.109 TCP 15994 [TCP segment of a reassembled PDU]
327   0.221615 54.230.30.244 -> 172.31.36.109 TCP 1514 [TCP segment of a reassembled PDU]
328   0.221702 172.31.36.109 -> 54.230.30.244 TCP 66 48956 > http [ACK] Seq=98 Ack=1599756 Win=737152 Len=0 TSval=22286436 TSecr=675006098
329   0.221937 54.230.30.244 -> 172.31.36.109 TCP 2962 [TCP segment of a reassembled PDU]
330   0.221943 172.31.36.109 -> 54.230.30.244 TCP 66 48956 > http [ACK] Seq=98 Ack=1602652 Win=761088 Len=0 TSval=22286436 TSecr=675006098
331   0.222092 54.230.30.244 -> 172.31.36.109 TCP 24682 [TCP segment of a reassembled PDU]
332   0.222118 172.31.36.109 -> 54.230.30.244 TCP 66 48956 > http [ACK] Seq=98 Ack=1627268 Win=736512 Len=0 TSval=22286436 TSecr=675006098
333   0.222189 54.230.30.244 -> 172.31.36.109 TCP 13098 [TCP segment of a reassembled PDU]
334   0.222198 172.31.36.109 -> 54.230.30.244 TCP 66 48956 > http [ACK] Seq=98 Ack=1640300 Win=744576 Len=0 TSval=22286436 TSecr=675006098
335   0.222539 54.230.30.244 -> 172.31.36.109 TCP 17442 [TCP segment of a reassembled PDU]
336   0.222561 172.31.36.109 -> 54.230.30.244 TCP 66 48956 > http [ACK] Seq=98 Ack=1657676 Win=737280 Len=0 TSval=22286436 TSecr=675006098
337   0.222651 54.230.30.244 -> 172.31.36.109 TCP 4410 [TCP segment of a reassembled PDU]
338   0.222657 172.31.36.109 -> 54.230.30.244 TCP 66 48956 > http [ACK] Seq=98 Ack=1662020 Win=758784 Len=0 TSval=22286436 TSecr=675006098
339   0.222796 54.230.30.244 -> 172.31.36.109 TCP 17442 [TCP segment of a reassembled PDU]
340   0.222818 172.31.36.109 -> 54.230.30.244 TCP 66 48956 > http [ACK] Seq=98 Ack=1679396 Win=741504 Len=0 TSval=22286436 TSecr=675006098
341   0.222908 54.230.30.244 -> 172.31.36.109 TCP 8754 [TCP segment of a reassembled PDU]
342   0.222916 172.31.36.109 -> 54.230.30.244 TCP 66 48956 > http [ACK] Seq=98 Ack=1688084 Win=751616 Len=0 TSval=22286436 TSecr=675006098
343   0.223151 54.230.30.244 -> 172.31.36.109 TCP 15674 [TCP segment of a reassembled PDU]
344   0.223177 172.31.36.109 -> 54.230.30.244 TCP 66 48956 > http [ACK] Seq=98 Ack=1703692 Win=761344 Len=0 TSval=22286436 TSecr=675006098
345   0.224248 54.230.30.244 -> 172.31.36.109 TCP 1514 [TCP segment of a reassembled PDU]
346   0.224259 54.230.30.244 -> 172.31.36.109 TCP 8754 [TCP segment of a reassembled PDU]
347   0.224284 172.31.36.109 -> 54.230.30.244 TCP 66 48956 > http [ACK] Seq=98 Ack=1713828 Win=761344 Len=0 TSval=22286436 TSecr=675006098
348   0.224498 54.230.30.244 -> 172.31.36.109 TCP 7306 [TCP segment of a reassembled PDU]
349   0.224526 172.31.36.109 -> 54.230.30.244 TCP 66 48956 > http [ACK] Seq=98 Ack=1721068 Win=761344 Len=0 TSval=22286436 TSecr=675006098
350   0.224719 54.230.30.244 -> 172.31.36.109 TCP 10202 [TCP segment of a reassembled PDU]
351   0.224736 54.230.30.244 -> 172.31.36.109 TCP 24682 [TCP segment of a reassembled PDU]
352   0.224755 54.230.30.244 -> 172.31.36.109 TCP 7306 [TCP segment of a reassembled PDU]
353   0.224773 172.31.36.109 -> 54.230.30.244 TCP 66 48956 > http [ACK] Seq=98 Ack=1763060 Win=719360 Len=0 TSval=22286436 TSecr=675006098
354   0.224866 54.230.30.244 -> 172.31.36.109 TCP 6234 [TCP segment of a reassembled PDU]
355   0.224873 172.31.36.109 -> 54.230.30.244 TCP 66 48956 > http [ACK] Seq=98 Ack=1769228 Win=754048 Len=0 TSval=22286436 TSecr=675006098
356   0.230111 54.230.30.244 -> 172.31.36.109 TCP 1514 [TCP segment of a reassembled PDU]
357   0.230390 54.230.30.244 -> 172.31.36.109 TCP 5858 [TCP segment of a reassembled PDU]
