[Measurement for 10mb at 18:36:25 19.36.2014] 
Tshark:

  1   0.000000 172.31.29.138 -> 172.31.0.2   DNS 89 Standard query 0x1409  A d1xvcg6dfvgaki.cloudfront.net
  2   0.000032 172.31.29.138 -> 172.31.0.2   DNS 89 Standard query 0xe42a  AAAA d1xvcg6dfvgaki.cloudfront.net
  3   0.000661   172.31.0.2 -> 172.31.29.138 DNS 217 Standard query response 0x1409  A 54.230.158.148 A 54.230.158.223 A 54.230.159.6 A 54.240.168.150 A 54.192.156.106 A 54.192.157.141 A 54.192.159.157 A 54.230.156.193
  4   0.000671   172.31.0.2 -> 172.31.29.138 DNS 170 Standard query response 0xe42a 
  5   0.003864 172.31.29.138 -> 54.230.158.148 TCP 74 48023 > http [SYN] Seq=0 Win=26883 Len=0 MSS=8961 SACK_PERM=1 TSval=1514445 TSecr=0 WS=128
  6   0.004428 54.230.158.148 -> 172.31.29.138 TCP 74 http > 48023 [SYN, ACK] Seq=0 Ack=1 Win=14480 Len=0 MSS=1460 SACK_PERM=1 TSval=728595066 TSecr=1514445 WS=128
  7   0.004442 172.31.29.138 -> 54.230.158.148 TCP 66 48023 > http [ACK] Seq=1 Ack=1 Win=27008 Len=0 TSval=1514445 TSecr=728595066
  8   0.004485 172.31.29.138 -> 54.230.158.148 HTTP 163 GET /10mb HTTP/1.1 
  9   0.005132 54.230.158.148 -> 172.31.29.138 TCP 66 http > 48023 [ACK] Seq=1 Ack=98 Win=14592 Len=0 TSval=728595067 TSecr=1514445
 10   0.008540 54.230.158.148 -> 172.31.29.138 TCP 13098 [TCP segment of a reassembled PDU]
 11   0.008551 172.31.29.138 -> 54.230.158.148 TCP 66 48023 > http [ACK] Seq=98 Ack=13033 Win=52992 Len=0 TSval=1514446 TSecr=728595067
 12   0.009024 54.230.158.148 -> 172.31.29.138 TCP 7306 [TCP segment of a reassembled PDU]
 13   0.009032 172.31.29.138 -> 54.230.158.148 TCP 66 48023 > http [ACK] Seq=98 Ack=20273 Win=67456 Len=0 TSval=1514447 TSecr=728595067
 14   0.009041 54.230.158.148 -> 172.31.29.138 TCP 2962 [TCP segment of a reassembled PDU]
 15   0.009044 172.31.29.138 -> 54.230.158.148 TCP 66 48023 > http [ACK] Seq=98 Ack=23169 Win=73344 Len=0 TSval=1514447 TSecr=728595067
 16   0.009240 54.230.158.148 -> 172.31.29.138 TCP 2962 [TCP segment of a reassembled PDU]
 17   0.009245 172.31.29.138 -> 54.230.158.148 TCP 66 48023 > http [ACK] Seq=98 Ack=26065 Win=79104 Len=0 TSval=1514447 TSecr=728595067
 18   0.009508 54.230.158.148 -> 172.31.29.138 TCP 4410 [TCP segment of a reassembled PDU]
 19   0.009513 172.31.29.138 -> 54.230.158.148 TCP 66 48023 > http [ACK] Seq=98 Ack=30409 Win=87808 Len=0 TSval=1514447 TSecr=728595067
 20   0.009557 54.230.158.148 -> 172.31.29.138 TCP 8754 [TCP segment of a reassembled PDU]
 21   0.009564 172.31.29.138 -> 54.230.158.148 TCP 66 48023 > http [ACK] Seq=98 Ack=39097 Win=103680 Len=0 TSval=1514447 TSecr=728595067
 22   0.009740 54.230.158.148 -> 172.31.29.138 TCP 4410 [TCP segment of a reassembled PDU]
 23   0.009746 172.31.29.138 -> 54.230.158.148 TCP 66 48023 > http [ACK] Seq=98 Ack=43441 Win=109056 Len=0 TSval=1514447 TSecr=728595067
 24   0.009774 54.230.158.148 -> 172.31.29.138 TCP 2962 [TCP segment of a reassembled PDU]
 25   0.009779 172.31.29.138 -> 54.230.158.148 TCP 66 48023 > http [ACK] Seq=98 Ack=46337 Win=109056 Len=0 TSval=1514447 TSecr=728595067
 26   0.009998 54.230.158.148 -> 172.31.29.138 TCP 4410 [TCP segment of a reassembled PDU]
 27   0.010003 172.31.29.138 -> 54.230.158.148 TCP 66 48023 > http [ACK] Seq=98 Ack=50681 Win=109056 Len=0 TSval=1514447 TSecr=728595067
 28   0.010059 54.230.158.148 -> 172.31.29.138 TCP 1514 [TCP segment of a reassembled PDU]
 29   0.010063 172.31.29.138 -> 54.230.158.148 TCP 66 48023 > http [ACK] Seq=98 Ack=52129 Win=109056 Len=0 TSval=1514447 TSecr=728595067
 30   0.010095 54.230.158.148 -> 172.31.29.138 TCP 10202 [TCP segment of a reassembled PDU]
 31   0.010102 172.31.29.138 -> 54.230.158.148 TCP 66 48023 > http [ACK] Seq=98 Ack=62265 Win=101248 Len=0 TSval=1514447 TSecr=728595067
 32   0.010507 54.230.158.148 -> 172.31.29.138 TCP 2962 [TCP segment of a reassembled PDU]
 33   0.010511 172.31.29.138 -> 54.230.158.148 TCP 66 48023 > http [ACK] Seq=98 Ack=65161 Win=109056 Len=0 TSval=1514447 TSecr=728595067
 34   0.010696 54.230.158.148 -> 172.31.29.138 TCP 24682 [TCP segment of a reassembled PDU]
 35   0.010709 172.31.29.138 -> 54.230.158.148 TCP 66 48023 > http [ACK] Seq=98 Ack=89777 Win=84480 Len=0 TSval=1514447 TSecr=728595067
 36   0.010716 54.230.158.148 -> 172.31.29.138 TCP 2962 [TCP segment of a reassembled PDU]
 37   0.010720 172.31.29.138 -> 54.230.158.148 TCP 66 48023 > http [ACK] Seq=98 Ack=92673 Win=81664 Len=0 TSval=1514447 TSecr=728595067
 38   0.011279 54.230.158.148 -> 172.31.29.138 TCP 2962 [TCP segment of a reassembled PDU]
 39   0.011285 172.31.29.138 -> 54.230.158.148 TCP 66 48023 > http [ACK] Seq=98 Ack=95569 Win=109056 Len=0 TSval=1514447 TSecr=728595067
 40   0.011480 54.230.158.148 -> 172.31.29.138 TCP 24682 [TCP segment of a reassembled PDU]
 41   0.011506 172.31.29.138 -> 54.230.158.148 TCP 66 48023 > http [ACK] Seq=98 Ack=120185 Win=84480 Len=0 TSval=1514447 TSecr=728595067
 42   0.011570 54.230.158.148 -> 172.31.29.138 TCP 2962 [TCP segment of a reassembled PDU]
 43   0.011575 172.31.29.138 -> 54.230.158.148 TCP 66 48023 > http [ACK] Seq=98 Ack=123081 Win=109056 Len=0 TSval=1514447 TSecr=728595067
 44   0.011845 54.230.158.148 -> 172.31.29.138 TCP 7306 [TCP segment of a reassembled PDU]
 45   0.012106 54.230.158.148 -> 172.31.29.138 TCP 2962 [TCP segment of a reassembled PDU]
 46   0.012117 172.31.29.138 -> 54.230.158.148 TCP 66 48023 > http [ACK] Seq=98 Ack=133217 Win=109056 Len=0 TSval=1514447 TSecr=728595067
 47   0.012269 54.230.158.148 -> 172.31.29.138 TCP 18890 [TCP segment of a reassembled PDU]
 48   0.012291 54.230.158.148 -> 172.31.29.138 TCP 4410 [TCP segment of a reassembled PDU]
 49   0.012303 172.31.29.138 -> 54.230.158.148 TCP 66 48023 > http [ACK] Seq=98 Ack=156385 Win=85888 Len=0 TSval=1514447 TSecr=728595067
 50   0.012555 54.230.158.148 -> 172.31.29.138 TCP 2962 [TCP segment of a reassembled PDU]
 51   0.012560 172.31.29.138 -> 54.230.158.148 TCP 66 48023 > http [ACK] Seq=98 Ack=159281 Win=109056 Len=0 TSval=1514447 TSecr=728595067
 52   0.012728 54.230.158.148 -> 172.31.29.138 TCP 14546 [TCP segment of a reassembled PDU]
 53   0.012751 172.31.29.138 -> 54.230.158.148 TCP 66 48023 > http [ACK] Seq=98 Ack=173761 Win=109056 Len=0 TSval=1514448 TSecr=728595067
 54   0.012849 54.230.158.148 -> 172.31.29.138 TCP 10202 [TCP segment of a reassembled PDU]
 55   0.012857 172.31.29.138 -> 54.230.158.148 TCP 66 48023 > http [ACK] Seq=98 Ack=183897 Win=129280 Len=0 TSval=1514448 TSecr=728595067
 56   0.012942 54.230.158.148 -> 172.31.29.138 TCP 7306 [TCP segment of a reassembled PDU]
 57   0.012949 172.31.29.138 -> 54.230.158.148 TCP 66 48023 > http [ACK] Seq=98 Ack=191137 Win=143872 Len=0 TSval=1514448 TSecr=728595067
 58   0.013176 54.230.158.148 -> 172.31.29.138 TCP 7306 [TCP segment of a reassembled PDU]
 59   0.013182 172.31.29.138 -> 54.230.158.148 TCP 66 48023 > http [ACK] Seq=98 Ack=198377 Win=158336 Len=0 TSval=1514448 TSecr=728595067
 60   0.013419 54.230.158.148 -> 172.31.29.138 TCP 10202 [TCP segment of a reassembled PDU]
 61   0.013427 172.31.29.138 -> 54.230.158.148 TCP 66 48023 > http [ACK] Seq=98 Ack=208513 Win=178560 Len=0 TSval=1514448 TSecr=728595067
 62   0.013491 54.230.158.148 -> 172.31.29.138 TCP 18890 [TCP segment of a reassembled PDU]
 63   0.013501 172.31.29.138 -> 54.230.158.148 TCP 66 48023 > http [ACK] Seq=98 Ack=227337 Win=216192 Len=0 TSval=1514448 TSecr=728595067
 64   0.013715 54.230.158.148 -> 172.31.29.138 TCP 20338 [TCP segment of a reassembled PDU]
 65   0.013726 172.31.29.138 -> 54.230.158.148 TCP 66 48023 > http [ACK] Seq=98 Ack=247609 Win=256768 Len=0 TSval=1514448 TSecr=728595067
 66   0.014106 54.230.158.148 -> 172.31.29.138 TCP 4410 [TCP segment of a reassembled PDU]
 67   0.014112 172.31.29.138 -> 54.230.158.148 TCP 66 48023 > http [ACK] Seq=98 Ack=251953 Win=265472 Len=0 TSval=1514448 TSecr=728595067
 68   0.014274 54.230.158.148 -> 172.31.29.138 TCP 24682 [TCP segment of a reassembled PDU]
 69   0.014286 172.31.29.138 -> 54.230.158.148 TCP 66 48023 > http [ACK] Seq=98 Ack=276569 Win=314624 Len=0 TSval=1514448 TSecr=728595067
 70   0.014345 54.230.158.148 -> 172.31.29.138 TCP 2962 [TCP segment of a reassembled PDU]
 71   0.014350 172.31.29.138 -> 54.230.158.148 TCP 66 48023 > http [ACK] Seq=98 Ack=279465 Win=320512 Len=0 TSval=1514448 TSecr=728595067
 72   0.014603 54.230.158.148 -> 172.31.29.138 TCP 4410 [TCP segment of a reassembled PDU]
 73   0.014608 172.31.29.138 -> 54.230.158.148 TCP 66 48023 > http [ACK] Seq=98 Ack=283809 Win=329216 Len=0 TSval=1514448 TSecr=728595067
 74   0.014765 54.230.158.148 -> 172.31.29.138 TCP 17442 [TCP segment of a reassembled PDU]
 75   0.014775 172.31.29.138 -> 54.230.158.148 TCP 66 48023 > http [ACK] Seq=98 Ack=301185 Win=363904 Len=0 TSval=1514448 TSecr=728595067
 76   0.014859 54.230.158.148 -> 172.31.29.138 TCP 4410 [TCP segment of a reassembled PDU]
 77   0.014864 172.31.29.138 -> 54.230.158.148 TCP 66 48023 > http [ACK] Seq=98 Ack=305529 Win=372608 Len=0 TSval=1514448 TSecr=728595068
 78   0.015036 54.230.158.148 -> 172.31.29.138 TCP 23234 [TCP segment of a reassembled PDU]
 79   0.015047 172.31.29.138 -> 54.230.158.148 TCP 66 48023 > http [ACK] Seq=98 Ack=328697 Win=418944 Len=0 TSval=1514448 TSecr=728595068
 80   0.015151 54.230.158.148 -> 172.31.29.138 TCP 8754 [TCP segment of a reassembled PDU]
 81   0.015168 172.31.29.138 -> 54.230.158.148 TCP 66 48023 > http [ACK] Seq=98 Ack=337385 Win=436352 Len=0 TSval=1514448 TSecr=728595068
 82   0.015366 54.230.158.148 -> 172.31.29.138 TCP 1514 [TCP segment of a reassembled PDU]
 83   0.015371 172.31.29.138 -> 54.230.158.148 TCP 66 48023 > http [ACK] Seq=98 Ack=338833 Win=439168 Len=0 TSval=1514448 TSecr=728595068
 84   0.015557 54.230.158.148 -> 172.31.29.138 TCP 23234 [TCP segment of a reassembled PDU]
 85   0.015569 172.31.29.138 -> 54.230.158.148 TCP 66 48023 > http [ACK] Seq=98 Ack=362001 Win=485504 Len=0 TSval=1514448 TSecr=728595068
 86   0.015671 54.230.158.148 -> 172.31.29.138 TCP 5858 [TCP segment of a reassembled PDU]
 87   0.015678 172.31.29.138 -> 54.230.158.148 TCP 66 48023 > http [ACK] Seq=98 Ack=367793 Win=497152 Len=0 TSval=1514448 TSecr=728595068
 88   0.015749 54.230.158.148 -> 172.31.29.138 TCP 1514 [TCP segment of a reassembled PDU]
 89   0.015753 172.31.29.138 -> 54.230.158.148 TCP 66 48023 > http [ACK] Seq=98 Ack=369241 Win=499968 Len=0 TSval=1514448 TSecr=728595068
 90   0.015820 54.230.158.148 -> 172.31.29.138 TCP 18890 [TCP segment of a reassembled PDU]
 91   0.015832 172.31.29.138 -> 54.230.158.148 TCP 66 48023 > http [ACK] Seq=98 Ack=388065 Win=537728 Len=0 TSval=1514448 TSecr=728595068
 92   0.015962 54.230.158.148 -> 172.31.29.138 TCP 4410 [TCP segment of a reassembled PDU]
 93   0.015967 172.31.29.138 -> 54.230.158.148 TCP 66 48023 > http [ACK] Seq=98 Ack=392409 Win=546304 Len=0 TSval=1514448 TSecr=728595068
 94   0.016416 54.230.158.148 -> 172.31.29.138 TCP 5858 [TCP segment of a reassembled PDU]
 95   0.016422 172.31.29.138 -> 54.230.158.148 TCP 66 48023 > http [ACK] Seq=98 Ack=398201 Win=557952 Len=0 TSval=1514448 TSecr=728595068
 96   0.016577 54.230.158.148 -> 172.31.29.138 TCP 26130 [TCP segment of a reassembled PDU]
 97   0.016590 172.31.29.138 -> 54.230.158.148 TCP 66 48023 > http [ACK] Seq=98 Ack=424265 Win=610048 Len=0 TSval=1514448 TSecr=728595068
 98   0.016693 54.230.158.148 -> 172.31.29.138 TCP 31922 [TCP segment of a reassembled PDU]
 99   0.016707 172.31.29.138 -> 54.230.158.148 TCP 66 48023 > http [ACK] Seq=98 Ack=456121 Win=673792 Len=0 TSval=1514449 TSecr=728595068
100   0.016771 54.230.158.148 -> 172.31.29.138 TCP 4410 [TCP segment of a reassembled PDU]
101   0.016777 172.31.29.138 -> 54.230.158.148 TCP 66 48023 > http [ACK] Seq=98 Ack=460465 Win=682496 Len=0 TSval=1514449 TSecr=728595068
102   0.017435 54.230.158.148 -> 172.31.29.138 TCP 4410 [TCP segment of a reassembled PDU]
103   0.017440 172.31.29.138 -> 54.230.158.148 TCP 66 48023 > http [ACK] Seq=98 Ack=464809 Win=691200 Len=0 TSval=1514449 TSecr=728595068
104   0.017567 54.230.158.148 -> 172.31.29.138 TCP 11650 [TCP segment of a reassembled PDU]
105   0.017575 172.31.29.138 -> 54.230.158.148 TCP 66 48023 > http [ACK] Seq=98 Ack=476393 Win=714368 Len=0 TSval=1514449 TSecr=728595068
106   0.017658 54.230.158.148 -> 172.31.29.138 TCP 26130 [TCP segment of a reassembled PDU]
107   0.017672 172.31.29.138 -> 54.230.158.148 TCP 66 48023 > http [ACK] Seq=98 Ack=502457 Win=766464 Len=0 TSval=1514449 TSecr=728595068
108   0.017715 54.230.158.148 -> 172.31.29.138 TCP 26130 [TCP segment of a reassembled PDU]
109   0.017726 54.230.158.148 -> 172.31.29.138 TCP 1514 [TCP segment of a reassembled PDU]
110   0.017731 172.31.29.138 -> 54.230.158.148 TCP 66 48023 > http [ACK] Seq=98 Ack=528521 Win=818560 Len=0 TSval=1514449 TSecr=728595068
111   0.017737 172.31.29.138 -> 54.230.158.148 TCP 66 48023 > http [ACK] Seq=98 Ack=529969 Win=821504 Len=0 TSval=1514449 TSecr=728595068
112   0.018213 54.230.158.148 -> 172.31.29.138 TCP 7306 [TCP segment of a reassembled PDU]
113   0.018220 172.31.29.138 -> 54.230.158.148 TCP 66 48023 > http [ACK] Seq=98 Ack=537209 Win=835968 Len=0 TSval=1514449 TSecr=728595068
114   0.018382 54.230.158.148 -> 172.31.29.138 TCP 26130 [TCP segment of a reassembled PDU]
115   0.018408 172.31.29.138 -> 54.230.158.148 TCP 66 48023 > http [ACK] Seq=98 Ack=563273 Win=888064 Len=0 TSval=1514449 TSecr=728595068
116   0.018415 54.230.158.148 -> 172.31.29.138 TCP 1514 [TCP segment of a reassembled PDU]
117   0.018417 172.31.29.138 -> 54.230.158.148 TCP 66 48023 > http [ACK] Seq=98 Ack=564721 Win=891008 Len=0 TSval=1514449 TSecr=728595068
118   0.018433 54.230.158.148 -> 172.31.29.138 TCP 20338 [TCP segment of a reassembled PDU]
119   0.018443 172.31.29.138 -> 54.230.158.148 TCP 66 48023 > http [ACK] Seq=98 Ack=584993 Win=931584 Len=0 TSval=1514449 TSecr=728595068
120   0.018450 54.230.158.148 -> 172.31.29.138 TCP 4410 [TCP segment of a reassembled PDU]
121   0.018466 172.31.29.138 -> 54.230.158.148 TCP 66 48023 > http [ACK] Seq=98 Ack=589337 Win=940160 Len=0 TSval=1514449 TSecr=728595068
122   0.018493 54.230.158.148 -> 172.31.29.138 TCP 1514 [TCP segment of a reassembled PDU]
123   0.018498 172.31.29.138 -> 54.230.158.148 TCP 66 48023 > http [ACK] Seq=98 Ack=590785 Win=943104 Len=0 TSval=1514449 TSecr=728595068
124   0.018571 54.230.158.148 -> 172.31.29.138 TCP 4410 [TCP segment of a reassembled PDU]
125   0.018577 172.31.29.138 -> 54.230.158.148 TCP 66 48023 > http [ACK] Seq=98 Ack=595129 Win=951808 Len=0 TSval=1514449 TSecr=728595068
126   0.018957 54.230.158.148 -> 172.31.29.138 TCP 4410 [TCP segment of a reassembled PDU]
127   0.018963 172.31.29.138 -> 54.230.158.148 TCP 66 48023 > http [ACK] Seq=98 Ack=599473 Win=960512 Len=0 TSval=1514449 TSecr=728595068
128   0.019134 54.230.158.148 -> 172.31.29.138 TCP 26130 [TCP segment of a reassembled PDU]
129   0.019147 172.31.29.138 -> 54.230.158.148 TCP 66 48023 > http [ACK] Seq=98 Ack=625537 Win=1012608 Len=0 TSval=1514449 TSecr=728595068
130   0.019171 54.230.158.148 -> 172.31.29.138 TCP 21786 [TCP segment of a reassembled PDU]
131   0.019181 172.31.29.138 -> 54.230.158.148 TCP 66 48023 > http [ACK] Seq=98 Ack=647257 Win=1056000 Len=0 TSval=1514449 TSecr=728595068
132   0.019219 54.230.158.148 -> 172.31.29.138 TCP 11650 [TCP segment of a reassembled PDU]
133   0.019226 172.31.29.138 -> 54.230.158.148 TCP 66 48023 > http [ACK] Seq=98 Ack=658841 Win=1079168 Len=0 TSval=1514449 TSecr=728595068
134   0.019302 54.230.158.148 -> 172.31.29.138 TCP 1514 [TCP segment of a reassembled PDU]
135   0.019307 172.31.29.138 -> 54.230.158.148 TCP 66 48023 > http [ACK] Seq=98 Ack=660289 Win=1082112 Len=0 TSval=1514449 TSecr=728595068
136   0.019592 54.230.158.148 -> 172.31.29.138 TCP 27578 [TCP segment of a reassembled PDU]
137   0.019606 172.31.29.138 -> 54.230.158.148 TCP 66 48023 > http [ACK] Seq=98 Ack=687801 Win=1137152 Len=0 TSval=1514449 TSecr=728595068
138   0.019872 54.230.158.148 -> 172.31.29.138 TCP 21786 [TCP segment of a reassembled PDU]
139   0.019883 172.31.29.138 -> 54.230.158.148 TCP 66 48023 > http [ACK] Seq=98 Ack=709521 Win=1180544 Len=0 TSval=1514449 TSecr=728595068
140   0.019894 54.230.158.148 -> 172.31.29.138 TCP 4410 [TCP segment of a reassembled PDU]
141   0.019897 172.31.29.138 -> 54.230.158.148 TCP 66 48023 > http [ACK] Seq=98 Ack=713865 Win=1189248 Len=0 TSval=1514449 TSecr=728595068
142   0.019993 54.230.158.148 -> 172.31.29.138 TCP 43506 [TCP segment of a reassembled PDU]
143   0.020014 54.230.158.148 -> 172.31.29.138 TCP 4410 [TCP segment of a reassembled PDU]
144   0.020030 172.31.29.138 -> 54.230.158.148 TCP 66 48023 > http [ACK] Seq=98 Ack=761649 Win=1173760 Len=0 TSval=1514449 TSecr=728595068
145   0.020221 54.230.158.148 -> 172.31.29.138 TCP 1514 [TCP segment of a reassembled PDU]
146   0.020226 172.31.29.138 -> 54.230.158.148 TCP 66 48023 > http [ACK] Seq=98 Ack=763097 Win=1192192 Len=0 TSval=1514449 TSecr=728595068
147   0.020393 54.230.158.148 -> 172.31.29.138 TCP 27578 [TCP segment of a reassembled PDU]
148   0.020407 172.31.29.138 -> 54.230.158.148 TCP 66 48023 > http [ACK] Seq=98 Ack=790609 Win=1207168 Len=0 TSval=1514449 TSecr=728595068
149   0.020494 54.230.158.148 -> 172.31.29.138 TCP 4410 [TCP segment of a reassembled PDU]
150   0.020499 172.31.29.138 -> 54.230.158.148 TCP 66 48023 > http [ACK] Seq=98 Ack=794953 Win=1245312 Len=0 TSval=1514449 TSecr=728595068
151   0.020651 54.230.158.148 -> 172.31.29.138 TCP 24682 [TCP segment of a reassembled PDU]
152   0.020665 54.230.158.148 -> 172.31.29.138 TCP 1514 [TCP segment of a reassembled PDU]
153   0.020679 172.31.29.138 -> 54.230.158.148 TCP 66 48023 > http [ACK] Seq=98 Ack=821017 Win=1247232 Len=0 TSval=1514450 TSecr=728595068
154   0.020723 54.230.158.148 -> 172.31.29.138 TCP 23234 [TCP segment of a reassembled PDU]
155   0.020736 172.31.29.138 -> 54.230.158.148 TCP 66 48023 > http [ACK] Seq=98 Ack=844185 Win=1293568 Len=0 TSval=1514450 TSecr=728595068
156   0.020744 54.230.158.148 -> 172.31.29.138 TCP 2962 [TCP segment of a reassembled PDU]
157   0.020746 172.31.29.138 -> 54.230.158.148 TCP 66 48023 > http [ACK] Seq=98 Ack=847081 Win=1299328 Len=0 TSval=1514450 TSecr=728595068
158   0.020819 54.230.158.148 -> 172.31.29.138 TCP 8754 [TCP segment of a reassembled PDU]
159   0.020826 172.31.29.138 -> 54.230.158.148 TCP 66 48023 > http [ACK] Seq=98 Ack=855769 Win=1316736 Len=0 TSval=1514450 TSecr=728595068
160   0.021256 54.230.158.148 -> 172.31.29.138 TCP 2962 [TCP segment of a reassembled PDU]
161   0.021262 172.31.29.138 -> 54.230.158.148 TCP 66 48023 > http [ACK] Seq=98 Ack=858665 Win=1322496 Len=0 TSval=1514450 TSecr=728595068
162   0.021440 54.230.158.148 -> 172.31.29.138 TCP 23234 [TCP segment of a reassembled PDU]
163   0.021452 172.31.29.138 -> 54.230.158.148 TCP 66 48023 > http [ACK] Seq=98 Ack=881833 Win=1368832 Len=0 TSval=1514450 TSecr=728595068
164   0.021459 54.230.158.148 -> 172.31.29.138 TCP 2962 [TCP segment of a reassembled PDU]
165   0.021477 172.31.29.138 -> 54.230.158.148 TCP 66 48023 > http [ACK] Seq=98 Ack=884729 Win=1374592 Len=0 TSval=1514450 TSecr=728595068
166   0.021576 54.230.158.148 -> 172.31.29.138 TCP 18890 [TCP segment of a reassembled PDU]
167   0.021599 172.31.29.138 -> 54.230.158.148 TCP 66 48023 > http [ACK] Seq=98 Ack=903553 Win=1412224 Len=0 TSval=1514450 TSecr=728595068
168   0.021633 54.230.158.148 -> 172.31.29.138 TCP 36266 [TCP segment of a reassembled PDU]
169   0.021648 172.31.29.138 -> 54.230.158.148 TCP 66 48023 > http [ACK] Seq=98 Ack=939753 Win=1484672 Len=0 TSval=1514450 TSecr=728595068
170   0.021656 54.230.158.148 -> 172.31.29.138 TCP 4410 [TCP segment of a reassembled PDU]
171   0.021659 172.31.29.138 -> 54.230.158.148 TCP 66 48023 > http [ACK] Seq=98 Ack=944097 Win=1493376 Len=0 TSval=1514450 TSecr=728595068
172   0.021699 54.230.158.148 -> 172.31.29.138 TCP 17442 [TCP segment of a reassembled PDU]
173   0.021711 172.31.29.138 -> 54.230.158.148 TCP 66 48023 > http [ACK] Seq=98 Ack=961473 Win=1528064 Len=0 TSval=1514450 TSecr=728595068
174   0.022130 54.230.158.148 -> 172.31.29.138 TCP 7306 [TCP segment of a reassembled PDU]
175   0.022137 172.31.29.138 -> 54.230.158.148 TCP 66 48023 > http [ACK] Seq=98 Ack=968713 Win=1542528 Len=0 TSval=1514450 TSecr=728595068
176   0.022289 54.230.158.148 -> 172.31.29.138 TCP 26130 [TCP segment of a reassembled PDU]
177   0.022302 172.31.29.138 -> 54.230.158.148 TCP 66 48023 > http [ACK] Seq=98 Ack=994777 Win=1594752 Len=0 TSval=1514450 TSecr=728595068
178   0.022311 54.230.158.148 -> 172.31.29.138 TCP 7306 [TCP segment of a reassembled PDU]
179   0.022316 172.31.29.138 -> 54.230.158.148 TCP 66 48023 > http [ACK] Seq=98 Ack=1002017 Win=1594752 Len=0 TSval=1514450 TSecr=728595068
180   0.022322 54.230.158.148 -> 172.31.29.138 TCP 8754 [TCP segment of a reassembled PDU]
181   0.022327 172.31.29.138 -> 54.230.158.148 TCP 66 48023 > http [ACK] Seq=98 Ack=1010705 Win=1594752 Len=0 TSval=1514450 TSecr=728595068
182   0.022337 54.230.158.148 -> 172.31.29.138 TCP 10202 [TCP segment of a reassembled PDU]
183   0.022342 172.31.29.138 -> 54.230.158.148 TCP 66 48023 > http [ACK] Seq=98 Ack=1020841 Win=1594752 Len=0 TSval=1514450 TSecr=728595068
184   0.022422 54.230.158.148 -> 172.31.29.138 TCP 23234 [TCP segment of a reassembled PDU]
185   0.022437 172.31.29.138 -> 54.230.158.148 TCP 66 48023 > http [ACK] Seq=98 Ack=1044009 Win=1594752 Len=0 TSval=1514450 TSecr=728595068
186   0.022478 54.230.158.148 -> 172.31.29.138 TCP 7306 [TCP segment of a reassembled PDU]
187   0.022485 172.31.29.138 -> 54.230.158.148 TCP 66 48023 > http [ACK] Seq=98 Ack=1051249 Win=1594752 Len=0 TSval=1514450 TSecr=728595068
188   0.022758 54.230.158.148 -> 172.31.29.138 TCP 24682 [TCP segment of a reassembled PDU]
189   0.022770 172.31.29.138 -> 54.230.158.148 TCP 66 48023 > http [ACK] Seq=98 Ack=1075865 Win=1594752 Len=0 TSval=1514450 TSecr=728595068
190   0.022884 54.230.158.148 -> 172.31.29.138 TCP 26130 [TCP segment of a reassembled PDU]
191   0.022896 172.31.29.138 -> 54.230.158.148 TCP 66 48023 > http [ACK] Seq=98 Ack=1101929 Win=1594752 Len=0 TSval=1514450 TSecr=728595068
192   0.022911 54.230.158.148 -> 172.31.29.138 TCP 10202 [TCP segment of a reassembled PDU]
193   0.022917 172.31.29.138 -> 54.230.158.148 TCP 66 48023 > http [ACK] Seq=98 Ack=1112065 Win=1594752 Len=0 TSval=1514450 TSecr=728595068
194   0.022977 54.230.158.148 -> 172.31.29.138 TCP 4410 [TCP segment of a reassembled PDU]
195   0.022982 172.31.29.138 -> 54.230.158.148 TCP 66 48023 > http [ACK] Seq=98 Ack=1116409 Win=1594752 Len=0 TSval=1514450 TSecr=728595068
196   0.023218 54.230.158.148 -> 172.31.29.138 TCP 14546 [TCP segment of a reassembled PDU]
197   0.023228 172.31.29.138 -> 54.230.158.148 TCP 66 48023 > http [ACK] Seq=98 Ack=1130889 Win=1594752 Len=0 TSval=1514450 TSecr=728595068
198   0.023398 54.230.158.148 -> 172.31.29.138 TCP 26130 [TCP segment of a reassembled PDU]
199   0.023411 172.31.29.138 -> 54.230.158.148 TCP 66 48023 > http [ACK] Seq=98 Ack=1156953 Win=1594752 Len=0 TSval=1514450 TSecr=728595068
200   0.023421 54.230.158.148 -> 172.31.29.138 TCP 7306 [TCP segment of a reassembled PDU]
201   0.023426 172.31.29.138 -> 54.230.158.148 TCP 66 48023 > http [ACK] Seq=98 Ack=1164193 Win=1594752 Len=0 TSval=1514450 TSecr=728595068
202   0.023462 54.230.158.148 -> 172.31.29.138 TCP 17442 [TCP segment of a reassembled PDU]
203   0.023475 172.31.29.138 -> 54.230.158.148 TCP 66 48023 > http [ACK] Seq=98 Ack=1181569 Win=1594752 Len=0 TSval=1514450 TSecr=728595068
204   0.023582 54.230.158.148 -> 172.31.29.138 TCP 37714 [TCP segment of a reassembled PDU]
205   0.023599 172.31.29.138 -> 54.230.158.148 TCP 66 48023 > http [ACK] Seq=98 Ack=1219217 Win=1594752 Len=0 TSval=1514450 TSecr=728595068
206   0.023615 54.230.158.148 -> 172.31.29.138 TCP 10202 [TCP segment of a reassembled PDU]
207   0.023620 172.31.29.138 -> 54.230.158.148 TCP 66 48023 > http [ACK] Seq=98 Ack=1229353 Win=1594752 Len=0 TSval=1514450 TSecr=728595068
208   0.023670 54.230.158.148 -> 172.31.29.138 TCP 17442 [TCP segment of a reassembled PDU]
209   0.023693 172.31.29.138 -> 54.230.158.148 TCP 66 48023 > http [ACK] Seq=98 Ack=1246729 Win=1594752 Len=0 TSval=1514450 TSecr=728595068
210   0.023923 54.230.158.148 -> 172.31.29.138 TCP 2962 [TCP segment of a reassembled PDU]
211   0.023928 172.31.29.138 -> 54.230.158.148 TCP 66 48023 > http [ACK] Seq=98 Ack=1249625 Win=1594752 Len=0 TSval=1514450 TSecr=728595068
212   0.024235 54.230.158.148 -> 172.31.29.138 TCP 26130 [TCP segment of a reassembled PDU]
213   0.024248 172.31.29.138 -> 54.230.158.148 TCP 66 48023 > http [ACK] Seq=98 Ack=1275689 Win=1594752 Len=0 TSval=1514450 TSecr=728595068
214   0.024257 54.230.158.148 -> 172.31.29.138 TCP 5858 [TCP segment of a reassembled PDU]
215   0.024260 172.31.29.138 -> 54.230.158.148 TCP 66 48023 > http [ACK] Seq=98 Ack=1281481 Win=1594752 Len=0 TSval=1514450 TSecr=728595068
216   0.024289 54.230.158.148 -> 172.31.29.138 TCP 14546 [TCP segment of a reassembled PDU]
217   0.024295 172.31.29.138 -> 54.230.158.148 TCP 66 48023 > http [ACK] Seq=98 Ack=1295961 Win=1594752 Len=0 TSval=1514450 TSecr=728595068
218   0.024384 54.230.158.148 -> 172.31.29.138 TCP 26130 [TCP segment of a reassembled PDU]
219   0.024408 172.31.29.138 -> 54.230.158.148 TCP 66 48023 > http [ACK] Seq=98 Ack=1322025 Win=1594752 Len=0 TSval=1514450 TSecr=728595068
220   0.024427 54.230.158.148 -> 172.31.29.138 TCP 15994 [TCP segment of a reassembled PDU]
221   0.024434 172.31.29.138 -> 54.230.158.148 TCP 66 48023 > http [ACK] Seq=98 Ack=1337953 Win=1594752 Len=0 TSval=1514450 TSecr=728595068
222   0.024491 54.230.158.148 -> 172.31.29.138 TCP 18890 [TCP segment of a reassembled PDU]
223   0.024500 172.31.29.138 -> 54.230.158.148 TCP 66 48023 > http [ACK] Seq=98 Ack=1356777 Win=1594752 Len=0 TSval=1514450 TSecr=728595068
224   0.024605 54.230.158.148 -> 172.31.29.138 TCP 20338 [TCP segment of a reassembled PDU]
225   0.024616 172.31.29.138 -> 54.230.158.148 TCP 66 48023 > http [ACK] Seq=98 Ack=1377049 Win=1594752 Len=0 TSval=1514450 TSecr=728595068
226   0.025016 54.230.158.148 -> 172.31.29.138 TCP 2962 [TCP segment of a reassembled PDU]
227   0.025035 172.31.29.138 -> 54.230.158.148 TCP 66 48023 > http [ACK] Seq=98 Ack=1379945 Win=1594752 Len=0 TSval=1514451 TSecr=728595069
228   0.025203 54.230.158.148 -> 172.31.29.138 TCP 26130 [TCP segment of a reassembled PDU]
229   0.025216 172.31.29.138 -> 54.230.158.148 TCP 66 48023 > http [ACK] Seq=98 Ack=1406009 Win=1594752 Len=0 TSval=1514451 TSecr=728595069
230   0.025232 54.230.158.148 -> 172.31.29.138 TCP 11650 [TCP segment of a reassembled PDU]
231   0.025238 172.31.29.138 -> 54.230.158.148 TCP 66 48023 > http [ACK] Seq=98 Ack=1417593 Win=1594752 Len=0 TSval=1514451 TSecr=728595069
232   0.025254 54.230.158.148 -> 172.31.29.138 TCP 14546 [TCP segment of a reassembled PDU]
233   0.025261 172.31.29.138 -> 54.230.158.148 TCP 66 48023 > http [ACK] Seq=98 Ack=1432073 Win=1594752 Len=0 TSval=1514451 TSecr=728595069
234   0.025308 54.230.158.148 -> 172.31.29.138 TCP 26130 [TCP segment of a reassembled PDU]
235   0.025324 172.31.29.138 -> 54.230.158.148 TCP 66 48023 > http [ACK] Seq=98 Ack=1458137 Win=1594752 Len=0 TSval=1514451 TSecr=728595069
236   0.025364 54.230.158.148 -> 172.31.29.138 TCP 11650 [TCP segment of a reassembled PDU]
237   0.025371 172.31.29.138 -> 54.230.158.148 TCP 66 48023 > http [ACK] Seq=98 Ack=1469721 Win=1594752 Len=0 TSval=1514451 TSecr=728595069
238   0.025469 54.230.158.148 -> 172.31.29.138 TCP 24682 [TCP segment of a reassembled PDU]
239   0.025481 172.31.29.138 -> 54.230.158.148 TCP 66 48023 > http [ACK] Seq=98 Ack=1494337 Win=1594752 Len=0 TSval=1514451 TSecr=728595069
240   0.025487 54.230.158.148 -> 172.31.29.138 TCP 1514 [TCP segment of a reassembled PDU]
241   0.025516 54.230.158.148 -> 172.31.29.138 TCP 11650 [TCP segment of a reassembled PDU]
242   0.025522 172.31.29.138 -> 54.230.158.148 TCP 66 48023 > http [ACK] Seq=98 Ack=1507369 Win=1594752 Len=0 TSval=1514451 TSecr=728595069
243   0.025850 54.230.158.148 -> 172.31.29.138 TCP 26130 [TCP segment of a reassembled PDU]
244   0.025863 172.31.29.138 -> 54.230.158.148 TCP 66 48023 > http [ACK] Seq=98 Ack=1533433 Win=1594752 Len=0 TSval=1514451 TSecr=728595069
245   0.025889 54.230.158.148 -> 172.31.29.138 TCP 23234 [TCP segment of a reassembled PDU]
246   0.025900 172.31.29.138 -> 54.230.158.148 TCP 66 48023 > http [ACK] Seq=98 Ack=1556601 Win=1594752 Len=0 TSval=1514451 TSecr=728595069
247   0.025921 54.230.158.148 -> 172.31.29.138 TCP 2962 [TCP segment of a reassembled PDU]
248   0.025924 172.31.29.138 -> 54.230.158.148 TCP 66 48023 > http [ACK] Seq=98 Ack=1559497 Win=1594752 Len=0 TSval=1514451 TSecr=728595069
249   0.026002 54.230.158.148 -> 172.31.29.138 TCP 29026 [TCP segment of a reassembled PDU]
250   0.026016 172.31.29.138 -> 54.230.158.148 TCP 66 48023 > http [ACK] Seq=98 Ack=1588457 Win=1594752 Len=0 TSval=1514451 TSecr=728595069
251   0.026120 54.230.158.148 -> 172.31.29.138 TCP 26130 [TCP segment of a reassembled PDU]
252   0.026133 172.31.29.138 -> 54.230.158.148 TCP 66 48023 > http [ACK] Seq=98 Ack=1614521 Win=1594752 Len=0 TSval=1514451 TSecr=728595069
253   0.026141 54.230.158.148 -> 172.31.29.138 TCP 4410 [TCP segment of a reassembled PDU]
254   0.026144 172.31.29.138 -> 54.230.158.148 TCP 66 48023 > http [ACK] Seq=98 Ack=1618865 Win=1594752 Len=0 TSval=1514451 TSecr=728595069
255   0.026162 54.230.158.148 -> 172.31.29.138 TCP 18890 [TCP segment of a reassembled PDU]
256   0.026168 172.31.29.138 -> 54.230.158.148 TCP 66 48023 > http [ACK] Seq=98 Ack=1637689 Win=1594752 Len=0 TSval=1514451 TSecr=728595069
257   0.026614 54.230.158.148 -> 172.31.29.138 TCP 5858 [TCP segment of a reassembled PDU]
258   0.026620 172.31.29.138 -> 54.230.158.148 TCP 66 48023 > http [ACK] Seq=98 Ack=1643481 Win=1594752 Len=0 TSval=1514451 TSecr=728595069
259   0.026798 54.230.158.148 -> 172.31.29.138 TCP 26130 [TCP segment of a reassembled PDU]
260   0.026811 172.31.29.138 -> 54.230.158.148 TCP 66 48023 > http [ACK] Seq=98 Ack=1669545 Win=1594752 Len=0 TSval=1514451 TSecr=728595069
261   0.026821 54.230.158.148 -> 172.31.29.138 TCP 7306 [TCP segment of a reassembled PDU]
262   0.026826 172.31.29.138 -> 54.230.158.148 TCP 66 48023 > http [ACK] Seq=98 Ack=1676785 Win=1594752 Len=0 TSval=1514451 TSecr=728595069
263   0.026832 54.230.158.148 -> 172.31.29.138 TCP 7306 [TCP segment of a reassembled PDU]
264   0.026836 172.31.29.138 -> 54.230.158.148 TCP 66 48023 > http [ACK] Seq=98 Ack=1684025 Win=1594752 Len=0 TSval=1514451 TSecr=728595069
265   0.026847 54.230.158.148 -> 172.31.29.138 TCP 11650 [TCP segment of a reassembled PDU]
266   0.026852 172.31.29.138 -> 54.230.158.148 TCP 66 48023 > http [ACK] Seq=98 Ack=1695609 Win=1594752 Len=0 TSval=1514451 TSecr=728595069
267   0.026940 54.230.158.148 -> 172.31.29.138 TCP 33370 [TCP segment of a reassembled PDU]
268   0.026958 172.31.29.138 -> 54.230.158.148 TCP 66 48023 > http [ACK] Seq=98 Ack=1728913 Win=1594752 Len=0 TSval=1514451 TSecr=728595069
269   0.027065 54.230.158.148 -> 172.31.29.138 TCP 26130 [TCP segment of a reassembled PDU]
270   0.027077 172.31.29.138 -> 54.230.158.148 TCP 66 48023 > http [ACK] Seq=98 Ack=1754977 Win=1594752 Len=0 TSval=1514451 TSecr=728595069
271   0.027091 54.230.158.148 -> 172.31.29.138 TCP 13098 [TCP segment of a reassembled PDU]
272   0.027100 172.31.29.138 -> 54.230.158.148 TCP 66 48023 > http [ACK] Seq=98 Ack=1768009 Win=1594752 Len=0 TSval=1514451 TSecr=728595069
273   0.027428 54.230.158.148 -> 172.31.29.138 TCP 23234 [TCP segment of a reassembled PDU]
274   0.027440 172.31.29.138 -> 54.230.158.148 TCP 66 48023 > http [ACK] Seq=98 Ack=1791177 Win=1594752 Len=0 TSval=1514451 TSecr=728595069
275   0.027450 54.230.158.148 -> 172.31.29.138 TCP 2962 [TCP segment of a reassembled PDU]
276   0.027453 172.31.29.138 -> 54.230.158.148 TCP 66 48023 > http [ACK] Seq=98 Ack=1794073 Win=1594752 Len=0 TSval=1514451 TSecr=728595069
277   0.027569 54.230.158.148 -> 172.31.29.138 TCP 44954 [TCP segment of a reassembled PDU]
278   0.027588 172.31.29.138 -> 54.230.158.148 TCP 66 48023 > http [ACK] Seq=98 Ack=1838961 Win=1594752 Len=0 TSval=1514451 TSecr=728595069
279   0.027686 54.230.158.148 -> 172.31.29.138 TCP 26130 [TCP segment of a reassembled PDU]
280   0.027699 172.31.29.138 -> 54.230.158.148 TCP 66 48023 > http [ACK] Seq=98 Ack=1865025 Win=1594752 Len=0 TSval=1514451 TSecr=728595069
281   0.027804 54.230.158.148 -> 172.31.29.138 TCP 26130 [TCP segment of a reassembled PDU]
282   0.027816 172.31.29.138 -> 54.230.158.148 TCP 66 48023 > http [ACK] Seq=98 Ack=1891089 Win=1594752 Len=0 TSval=1514451 TSecr=728595069
283   0.027829 54.230.158.148 -> 172.31.29.138 TCP 10202 [TCP segment of a reassembled PDU]
284   0.027832 172.31.29.138 -> 54.230.158.148 TCP 66 48023 > http [ACK] Seq=98 Ack=1901225 Win=1594752 Len=0 TSval=1514451 TSecr=728595069
285   0.027850 54.230.158.148 -> 172.31.29.138 TCP 8754 [TCP segment of a reassembled PDU]
286   0.027853 172.31.29.138 -> 54.230.158.148 TCP 66 48023 > http [ACK] Seq=98 Ack=1909913 Win=1594752 Len=0 TSval=1514451 TSecr=728595069
287   0.027862 54.230.158.148 -> 172.31.29.138 TCP 7306 [TCP segment of a reassembled PDU]
288   0.027864 172.31.29.138 -> 54.230.158.148 TCP 66 48023 > http [ACK] Seq=98 Ack=1917153 Win=1594752 Len=0 TSval=1514451 TSecr=728595069
289   0.027977 54.230.158.148 -> 172.31.29.138 TCP 36266 [TCP segment of a reassembled PDU]
290   0.027985 172.31.29.138 -> 54.230.158.148 TCP 66 48023 > http [ACK] Seq=98 Ack=1953353 Win=1594752 Len=0 TSval=1514451 TSecr=728595069
291   0.028017 54.230.158.148 -> 172.31.29.138 TCP 4410 [TCP segment of a reassembled PDU]
292   0.028023 172.31.29.138 -> 54.230.158.148 TCP 66 48023 > http [ACK] Seq=98 Ack=1957697 Win=1594752 Len=0 TSval=1514451 TSecr=728595069
293   0.028056 54.230.158.148 -> 172.31.29.138 TCP 5858 [TCP segment of a reassembled PDU]
294   0.028059 172.31.29.138 -> 54.230.158.148 TCP 66 48023 > http [ACK] Seq=98 Ack=1963489 Win=1594752 Len=0 TSval=1514451 TSecr=728595069
295   0.028470 54.230.158.148 -> 172.31.29.138 TCP 2962 [TCP segment of a reassembled PDU]
296   0.028475 172.31.29.138 -> 54.230.158.148 TCP 66 48023 > http [ACK] Seq=98 Ack=1966385 Win=1594752 Len=0 TSval=1514451 TSecr=728595069
297   0.028665 54.230.158.148 -> 172.31.29.138 TCP 26130 [TCP segment of a reassembled PDU]
298   0.028672 172.31.29.138 -> 54.230.158.148 TCP 66 48023 > http [ACK] Seq=98 Ack=1992449 Win=1594752 Len=0 TSval=1514452 TSecr=728595069
299   0.028713 54.230.158.148 -> 172.31.29.138 TCP 23234 [TCP segment of a reassembled PDU]
300   0.028718 172.31.29.138 -> 54.230.158.148 TCP 66 48023 > http [ACK] Seq=98 Ack=2015617 Win=1594752 Len=0 TSval=1514452 TSecr=728595069
301   0.028735 54.230.158.148 -> 172.31.29.138 TCP 2962 [TCP segment of a reassembled PDU]
302   0.028737 172.31.29.138 -> 54.230.158.148 TCP 66 48023 > http [ACK] Seq=98 Ack=2018513 Win=1594752 Len=0 TSval=1514452 TSecr=728595069
303   0.028822 54.230.158.148 -> 172.31.29.138 TCP 37714 [TCP segment of a reassembled PDU]
304   0.028831 172.31.29.138 -> 54.230.158.148 TCP 66 48023 > http [ACK] Seq=98 Ack=2056161 Win=1594752 Len=0 TSval=1514452 TSecr=728595069
305   0.028936 54.230.158.148 -> 172.31.29.138 TCP 21786 [TCP segment of a reassembled PDU]
306   0.028942 172.31.29.138 -> 54.230.158.148 TCP 66 48023 > http [ACK] Seq=98 Ack=2077881 Win=1594752 Len=0 TSval=1514452 TSecr=728595069
307   0.028961 54.230.158.148 -> 172.31.29.138 TCP 4410 [TCP segment of a reassembled PDU]
308   0.028963 172.31.29.138 -> 54.230.158.148 TCP 66 48023 > http [ACK] Seq=98 Ack=2082225 Win=1594752 Len=0 TSval=1514452 TSecr=728595069
309   0.029069 54.230.158.148 -> 172.31.29.138 TCP 47850 [TCP segment of a reassembled PDU]
310   0.029078 172.31.29.138 -> 54.230.158.148 TCP 66 48023 > http [ACK] Seq=98 Ack=2130009 Win=1594752 Len=0 TSval=1514452 TSecr=728595069
311   0.029096 54.230.158.148 -> 172.31.29.138 TCP 14546 [TCP segment of a reassembled PDU]
312   0.029100 172.31.29.138 -> 54.230.158.148 TCP 66 48023 > http [ACK] Seq=98 Ack=2144489 Win=1594752 Len=0 TSval=1514452 TSecr=728595069
313   0.029156 54.230.158.148 -> 172.31.29.138 TCP 14546 [TCP segment of a reassembled PDU]
314   0.029161 172.31.29.138 -> 54.230.158.148 TCP 66 48023 > http [ACK] Seq=98 Ack=2158969 Win=1594752 Len=0 TSval=1514452 TSecr=728595069
315   0.029402 54.230.158.148 -> 172.31.29.138 TCP 11650 [TCP segment of a reassembled PDU]
316   0.029408 172.31.29.138 -> 54.230.158.148 TCP 66 48023 > http [ACK] Seq=98 Ack=2170553 Win=1594752 Len=0 TSval=1514452 TSecr=728595069
317   0.029564 54.230.158.148 -> 172.31.29.138 TCP 21786 [TCP segment of a reassembled PDU]
318   0.029570 172.31.29.138 -> 54.230.158.148 TCP 66 48023 > http [ACK] Seq=98 Ack=2192273 Win=1594752 Len=0 TSval=1514452 TSecr=728595069
319   0.029588 54.230.158.148 -> 172.31.29.138 TCP 4410 [TCP segment of a reassembled PDU]
320   0.029590 172.31.29.138 -> 54.230.158.148 TCP 66 48023 > http [ACK] Seq=98 Ack=2196617 Win=1594752 Len=0 TSval=1514452 TSecr=728595069
321   0.029678 54.230.158.148 -> 172.31.29.138 TCP 27578 [TCP segment of a reassembled PDU]
322   0.029685 172.31.29.138 -> 54.230.158.148 TCP 66 48023 > http [ACK] Seq=98 Ack=2224129 Win=1594752 Len=0 TSval=1514452 TSecr=728595069
323   0.029707 54.230.158.148 -> 172.31.29.138 TCP 18890 [TCP segment of a reassembled PDU]
324   0.029711 172.31.29.138 -> 54.230.158.148 TCP 66 48023 > http [ACK] Seq=98 Ack=2242953 Win=1594752 Len=0 TSval=1514452 TSecr=728595069
325   0.029721 54.230.158.148 -> 172.31.29.138 TCP 8754 [TCP segment of a reassembled PDU]
326   0.029723 172.31.29.138 -> 54.230.158.148 TCP 66 48023 > http [ACK] Seq=98 Ack=2251641 Win=1594752 Len=0 TSval=1514452 TSecr=728595069
327   0.029837 54.230.158.148 -> 172.31.29.138 TCP 26130 [TCP segment of a reassembled PDU]
328   0.029844 172.31.29.138 -> 54.230.158.148 TCP 66 48023 > http [ACK] Seq=98 Ack=2277705 Win=1594752 Len=0 TSval=1514452 TSecr=728595069
329   0.029871 54.230.158.148 -> 172.31.29.138 TCP 26130 [TCP segment of a reassembled PDU]
330   0.029876 172.31.29.138 -> 54.230.158.148 TCP 66 48023 > http [ACK] Seq=98 Ack=2303769 Win=1594752 Len=0 TSval=1514452 TSecr=728595069
331   0.029881 54.230.158.148 -> 172.31.29.138 TCP 1514 [TCP segment of a reassembled PDU]
332   0.029930 54.230.158.148 -> 172.31.29.138 TCP 20338 [TCP segment of a reassembled PDU]
333   0.029935 172.31.29.138 -> 54.230.158.148 TCP 66 48023 > http [ACK] Seq=98 Ack=2325489 Win=1594752 Len=0 TSval=1514452 TSecr=728595069
334   0.029974 54.230.158.148 -> 172.31.29.138 TCP 15994 [TCP segment of a reassembled PDU]
335   0.029978 172.31.29.138 -> 54.230.158.148 TCP 66 48023 > http [ACK] Seq=98 Ack=2341417 Win=1594752 Len=0 TSval=1514452 TSecr=728595069
336   0.030097 54.230.158.148 -> 172.31.29.138 TCP 24682 [TCP segment of a reassembled PDU]
337   0.030104 172.31.29.138 -> 54.230.158.148 TCP 66 48023 > http [ACK] Seq=98 Ack=2366033 Win=1594752 Len=0 TSval=1514452 TSecr=728595069
338   0.030228 54.230.158.148 -> 172.31.29.138 TCP 26130 [TCP segment of a reassembled PDU]
339   0.030235 172.31.29.138 -> 54.230.158.148 TCP 66 48023 > http [ACK] Seq=98 Ack=2392097 Win=1594752 Len=0 TSval=1514452 TSecr=728595069
340   0.030248 54.230.158.148 -> 172.31.29.138 TCP 13098 [TCP segment of a reassembled PDU]
341   0.030255 172.31.29.138 -> 54.230.158.148 TCP 66 48023 > http [ACK] Seq=98 Ack=2405129 Win=1594752 Len=0 TSval=1514452 TSecr=728595069
342   0.030317 54.230.158.148 -> 172.31.29.138 TCP 14546 [TCP segment of a reassembled PDU]
343   0.030322 172.31.29.138 -> 54.230.158.148 TCP 66 48023 > http [ACK] Seq=98 Ack=2419609 Win=1594752 Len=0 TSval=1514452 TSecr=728595069
344   0.030458 54.230.158.148 -> 172.31.29.138 TCP 21786 [TCP segment of a reassembled PDU]
345   0.030464 172.31.29.138 -> 54.230.158.148 TCP 66 48023 > http [ACK] Seq=98 Ack=2441329 Win=1594752 Len=0 TSval=1514452 TSecr=728595069
346   0.030602 54.230.158.148 -> 172.31.29.138 TCP 26130 [TCP segment of a reassembled PDU]
