[Measurement for 10mb at 06:36:25 20.36.2014] 
Tshark:

  1   0.000000 172.31.29.138 -> 172.31.0.2   DNS 89 Standard query 0x8172  A d1xvcg6dfvgaki.cloudfront.net
  2   0.000028 172.31.29.138 -> 172.31.0.2   DNS 89 Standard query 0x1bdf  AAAA d1xvcg6dfvgaki.cloudfront.net
  3   0.000438   172.31.0.2 -> 172.31.29.138 DNS 170 Standard query response 0x1bdf 
  4   0.000449   172.31.0.2 -> 172.31.29.138 DNS 217 Standard query response 0x8172  A 54.230.150.30 A 54.230.150.34 A 54.230.150.43 A 54.230.150.45 A 54.230.150.65 A 54.230.150.114 A 54.230.151.226 A 54.230.149.71
  5   0.003865 172.31.29.138 -> 54.230.150.30 TCP 74 54826 > http [SYN] Seq=0 Win=26883 Len=0 MSS=8961 SACK_PERM=1 TSval=12314447 TSecr=0 WS=128
  6   0.005261 54.230.150.30 -> 172.31.29.138 TCP 74 http > 54826 [SYN, ACK] Seq=0 Ack=1 Win=14480 Len=0 MSS=1460 SACK_PERM=1 TSval=1454756642 TSecr=12314447 WS=128
  7   0.005276 172.31.29.138 -> 54.230.150.30 TCP 66 54826 > http [ACK] Seq=1 Ack=1 Win=27008 Len=0 TSval=12314448 TSecr=1454756642
  8   0.005323 172.31.29.138 -> 54.230.150.30 HTTP 163 GET /10mb HTTP/1.1 
  9   0.006733 54.230.150.30 -> 172.31.29.138 TCP 66 http > 54826 [ACK] Seq=1 Ack=98 Win=14592 Len=0 TSval=1454756642 TSecr=12314448
 10   0.008456 54.230.150.30 -> 172.31.29.138 TCP 524 [TCP segment of a reassembled PDU]
 11   0.008463 172.31.29.138 -> 54.230.150.30 TCP 66 54826 > http [ACK] Seq=98 Ack=459 Win=28032 Len=0 TSval=12314448 TSecr=1454756642
 12   0.008501 54.230.150.30 -> 172.31.29.138 TCP 5858 [TCP segment of a reassembled PDU]
 13   0.008508 172.31.29.138 -> 54.230.150.30 TCP 66 54826 > http [ACK] Seq=98 Ack=6251 Win=39552 Len=0 TSval=12314448 TSecr=1454756642
 14   0.008565 54.230.150.30 -> 172.31.29.138 TCP 4410 [TCP segment of a reassembled PDU]
 15   0.008572 172.31.29.138 -> 54.230.150.30 TCP 66 54826 > http [ACK] Seq=98 Ack=10595 Win=48256 Len=0 TSval=12314448 TSecr=1454756642
 16   0.008599 54.230.150.30 -> 172.31.29.138 TCP 2962 [TCP segment of a reassembled PDU]
 17   0.008604 172.31.29.138 -> 54.230.150.30 TCP 66 54826 > http [ACK] Seq=98 Ack=13491 Win=54144 Len=0 TSval=12314448 TSecr=1454756642
 18   0.009874 54.230.150.30 -> 172.31.29.138 TCP 1514 [TCP segment of a reassembled PDU]
 19   0.009889 172.31.29.138 -> 54.230.150.30 TCP 66 54826 > http [ACK] Seq=98 Ack=14939 Win=56960 Len=0 TSval=12314449 TSecr=1454756642
 20   0.009920 54.230.150.30 -> 172.31.29.138 TCP 5858 [TCP segment of a reassembled PDU]
 21   0.009926 172.31.29.138 -> 54.230.150.30 TCP 66 54826 > http [ACK] Seq=98 Ack=20731 Win=68608 Len=0 TSval=12314449 TSecr=1454756642
 22   0.009964 54.230.150.30 -> 172.31.29.138 TCP 5858 [TCP segment of a reassembled PDU]
 23   0.009970 172.31.29.138 -> 54.230.150.30 TCP 66 54826 > http [ACK] Seq=98 Ack=26523 Win=80128 Len=0 TSval=12314449 TSecr=1454756642
 24   0.010025 54.230.150.30 -> 172.31.29.138 TCP 1514 [TCP segment of a reassembled PDU]
 25   0.010030 172.31.29.138 -> 54.230.150.30 TCP 66 54826 > http [ACK] Seq=98 Ack=27971 Win=83072 Len=0 TSval=12314449 TSecr=1454756642
 26   0.010103 54.230.150.30 -> 172.31.29.138 TCP 5858 [TCP segment of a reassembled PDU]
 27   0.010122 172.31.29.138 -> 54.230.150.30 TCP 66 54826 > http [ACK] Seq=98 Ack=33763 Win=94592 Len=0 TSval=12314449 TSecr=1454756642
 28   0.011505 54.230.150.30 -> 172.31.29.138 TCP 2962 [TCP segment of a reassembled PDU]
 29   0.011510 172.31.29.138 -> 54.230.150.30 TCP 66 54826 > http [ACK] Seq=98 Ack=36659 Win=100480 Len=0 TSval=12314449 TSecr=1454756643
 30   0.011587 54.230.150.30 -> 172.31.29.138 TCP 10202 [TCP segment of a reassembled PDU]
 31   0.011607 172.31.29.138 -> 54.230.150.30 TCP 66 54826 > http [ACK] Seq=98 Ack=46795 Win=101248 Len=0 TSval=12314449 TSecr=1454756643
 32   0.011616 54.230.150.30 -> 172.31.29.138 TCP 4410 [TCP segment of a reassembled PDU]
 33   0.011620 172.31.29.138 -> 54.230.150.30 TCP 66 54826 > http [ACK] Seq=98 Ack=51139 Win=97024 Len=0 TSval=12314449 TSecr=1454756643
 34   0.011687 54.230.150.30 -> 172.31.29.138 TCP 1514 [TCP segment of a reassembled PDU]
 35   0.011704 172.31.29.138 -> 54.230.150.30 TCP 66 54826 > http [ACK] Seq=98 Ack=52587 Win=109056 Len=0 TSval=12314449 TSecr=1454756643
 36   0.013028 54.230.150.30 -> 172.31.29.138 TCP 4410 [TCP segment of a reassembled PDU]
 37   0.013033 172.31.29.138 -> 54.230.150.30 TCP 66 54826 > http [ACK] Seq=98 Ack=56931 Win=109056 Len=0 TSval=12314449 TSecr=1454756643
 38   0.013149 54.230.150.30 -> 172.31.29.138 TCP 21786 [TCP segment of a reassembled PDU]
 39   0.013161 172.31.29.138 -> 54.230.150.30 TCP 66 54826 > http [ACK] Seq=98 Ack=78651 Win=87424 Len=0 TSval=12314450 TSecr=1454756643
 40   0.014372 54.230.150.30 -> 172.31.29.138 TCP 4410 [TCP segment of a reassembled PDU]
 41   0.014378 172.31.29.138 -> 54.230.150.30 TCP 66 54826 > http [ACK] Seq=98 Ack=82995 Win=117760 Len=0 TSval=12314450 TSecr=1454756643
 42   0.014449 54.230.150.30 -> 172.31.29.138 TCP 8754 [TCP segment of a reassembled PDU]
 43   0.014456 172.31.29.138 -> 54.230.150.30 TCP 66 54826 > http [ACK] Seq=98 Ack=91683 Win=135168 Len=0 TSval=12314450 TSecr=1454756643
 44   0.014511 54.230.150.30 -> 172.31.29.138 TCP 15994 [TCP segment of a reassembled PDU]
 45   0.014520 172.31.29.138 -> 54.230.150.30 TCP 66 54826 > http [ACK] Seq=98 Ack=107611 Win=167040 Len=0 TSval=12314450 TSecr=1454756643
 46   0.014540 54.230.150.30 -> 172.31.29.138 TCP 5858 [TCP segment of a reassembled PDU]
 47   0.014545 172.31.29.138 -> 54.230.150.30 TCP 66 54826 > http [ACK] Seq=98 Ack=113403 Win=178560 Len=0 TSval=12314450 TSecr=1454756643
 48   0.014685 54.230.150.30 -> 172.31.29.138 TCP 1514 [TCP segment of a reassembled PDU]
 49   0.014689 172.31.29.138 -> 54.230.150.30 TCP 66 54826 > http [ACK] Seq=98 Ack=114851 Win=181504 Len=0 TSval=12314450 TSecr=1454756643
 50   0.015648 54.230.150.30 -> 172.31.29.138 TCP 1514 [TCP segment of a reassembled PDU]
 51   0.015652 172.31.29.138 -> 54.230.150.30 TCP 66 54826 > http [ACK] Seq=98 Ack=116299 Win=184320 Len=0 TSval=12314450 TSecr=1454756643
 52   0.015898 54.230.150.30 -> 172.31.29.138 TCP 2962 [TCP segment of a reassembled PDU]
 53   0.015903 172.31.29.138 -> 54.230.150.30 TCP 66 54826 > http [ACK] Seq=98 Ack=119195 Win=190208 Len=0 TSval=12314450 TSecr=1454756643
 54   0.016010 54.230.150.30 -> 172.31.29.138 TCP 15994 [TCP segment of a reassembled PDU]
 55   0.016021 172.31.29.138 -> 54.230.150.30 TCP 66 54826 > http [ACK] Seq=98 Ack=135123 Win=221952 Len=0 TSval=12314450 TSecr=1454756643
 56   0.016059 54.230.150.30 -> 172.31.29.138 TCP 8754 [TCP segment of a reassembled PDU]
 57   0.016066 172.31.29.138 -> 54.230.150.30 TCP 66 54826 > http [ACK] Seq=98 Ack=143811 Win=239360 Len=0 TSval=12314450 TSecr=1454756643
 58   0.016119 54.230.150.30 -> 172.31.29.138 TCP 4410 [TCP segment of a reassembled PDU]
 59   0.016124 172.31.29.138 -> 54.230.150.30 TCP 66 54826 > http [ACK] Seq=98 Ack=148155 Win=248064 Len=0 TSval=12314450 TSecr=1454756643
 60   0.016207 54.230.150.30 -> 172.31.29.138 TCP 7306 [TCP segment of a reassembled PDU]
 61   0.016213 172.31.29.138 -> 54.230.150.30 TCP 66 54826 > http [ACK] Seq=98 Ack=155395 Win=262528 Len=0 TSval=12314450 TSecr=1454756643
 62   0.016944 54.230.150.30 -> 172.31.29.138 TCP 5858 [TCP segment of a reassembled PDU]
 63   0.016952 172.31.29.138 -> 54.230.150.30 TCP 66 54826 > http [ACK] Seq=98 Ack=161187 Win=274176 Len=0 TSval=12314450 TSecr=1454756643
 64   0.017199 54.230.150.30 -> 172.31.29.138 TCP 1514 [TCP segment of a reassembled PDU]
 65   0.017203 172.31.29.138 -> 54.230.150.30 TCP 66 54826 > http [ACK] Seq=98 Ack=162635 Win=276992 Len=0 TSval=12314451 TSecr=1454756643
 66   0.017448 54.230.150.30 -> 172.31.29.138 TCP 5858 [TCP segment of a reassembled PDU]
 67   0.017454 172.31.29.138 -> 54.230.150.30 TCP 66 54826 > http [ACK] Seq=98 Ack=168427 Win=288640 Len=0 TSval=12314451 TSecr=1454756643
 68   0.017566 54.230.150.30 -> 172.31.29.138 TCP 18890 [TCP segment of a reassembled PDU]
 69   0.017575 172.31.29.138 -> 54.230.150.30 TCP 66 54826 > http [ACK] Seq=98 Ack=187251 Win=326272 Len=0 TSval=12314451 TSecr=1454756643
 70   0.017597 54.230.150.30 -> 172.31.29.138 TCP 1514 [TCP segment of a reassembled PDU]
 71   0.017600 172.31.29.138 -> 54.230.150.30 TCP 66 54826 > http [ACK] Seq=98 Ack=188699 Win=329216 Len=0 TSval=12314451 TSecr=1454756643
 72   0.017712 54.230.150.30 -> 172.31.29.138 TCP 8754 [TCP segment of a reassembled PDU]
 73   0.017719 172.31.29.138 -> 54.230.150.30 TCP 66 54826 > http [ACK] Seq=98 Ack=197387 Win=346496 Len=0 TSval=12314451 TSecr=1454756643
 74   0.017801 54.230.150.30 -> 172.31.29.138 TCP 10202 [TCP segment of a reassembled PDU]
 75   0.017809 172.31.29.138 -> 54.230.150.30 TCP 66 54826 > http [ACK] Seq=98 Ack=207523 Win=366848 Len=0 TSval=12314451 TSecr=1454756643
 76   0.018800 54.230.150.30 -> 172.31.29.138 TCP 2962 [TCP segment of a reassembled PDU]
 77   0.018805 172.31.29.138 -> 54.230.150.30 TCP 66 54826 > http [ACK] Seq=98 Ack=210419 Win=372608 Len=0 TSval=12314451 TSecr=1454756643
 78   0.018962 54.230.150.30 -> 172.31.29.138 TCP 26130 [TCP segment of a reassembled PDU]
 79   0.018975 172.31.29.138 -> 54.230.150.30 TCP 66 54826 > http [ACK] Seq=98 Ack=236483 Win=424704 Len=0 TSval=12314451 TSecr=1454756643
 80   0.018984 54.230.150.30 -> 172.31.29.138 TCP 4410 [TCP segment of a reassembled PDU]
 81   0.018987 172.31.29.138 -> 54.230.150.30 TCP 66 54826 > http [ACK] Seq=98 Ack=240827 Win=433408 Len=0 TSval=12314451 TSecr=1454756643
 82   0.019209 54.230.150.30 -> 172.31.29.138 TCP 10202 [TCP segment of a reassembled PDU]
 83   0.019218 172.31.29.138 -> 54.230.150.30 TCP 66 54826 > http [ACK] Seq=98 Ack=250963 Win=453632 Len=0 TSval=12314451 TSecr=1454756643
 84   0.019360 54.230.150.30 -> 172.31.29.138 TCP 18890 [TCP segment of a reassembled PDU]
 85   0.019370 172.31.29.138 -> 54.230.150.30 TCP 66 54826 > http [ACK] Seq=98 Ack=269787 Win=491392 Len=0 TSval=12314451 TSecr=1454756643
 86   0.020403 54.230.150.30 -> 172.31.29.138 TCP 4410 [TCP segment of a reassembled PDU]
 87   0.020409 172.31.29.138 -> 54.230.150.30 TCP 66 54826 > http [ACK] Seq=98 Ack=274131 Win=499968 Len=0 TSval=12314451 TSecr=1454756643
 88   0.020564 54.230.150.30 -> 172.31.29.138 TCP 20338 [TCP segment of a reassembled PDU]
 89   0.020576 172.31.29.138 -> 54.230.150.30 TCP 66 54826 > http [ACK] Seq=98 Ack=294403 Win=540544 Len=0 TSval=12314451 TSecr=1454756643
 90   0.020929 54.230.150.30 -> 172.31.29.138 TCP 24682 [TCP segment of a reassembled PDU]
 91   0.020942 172.31.29.138 -> 54.230.150.30 TCP 66 54826 > http [ACK] Seq=98 Ack=319019 Win=589824 Len=0 TSval=12314451 TSecr=1454756644
 92   0.021681 54.230.150.30 -> 172.31.29.138 TCP 5858 [TCP segment of a reassembled PDU]
 93   0.021688 172.31.29.138 -> 54.230.150.30 TCP 66 54826 > http [ACK] Seq=98 Ack=324811 Win=601344 Len=0 TSval=12314452 TSecr=1454756644
 94   0.021828 54.230.150.30 -> 172.31.29.138 TCP 20338 [TCP segment of a reassembled PDU]
 95   0.021840 172.31.29.138 -> 54.230.150.30 TCP 66 54826 > http [ACK] Seq=98 Ack=345083 Win=641920 Len=0 TSval=12314452 TSecr=1454756644
 96   0.022030 54.230.150.30 -> 172.31.29.138 TCP 2962 [TCP segment of a reassembled PDU]
 97   0.022035 172.31.29.138 -> 54.230.150.30 TCP 66 54826 > http [ACK] Seq=98 Ack=347979 Win=647680 Len=0 TSval=12314452 TSecr=1454756644
 98   0.022274 54.230.150.30 -> 172.31.29.138 TCP 5858 [TCP segment of a reassembled PDU]
 99   0.022280 172.31.29.138 -> 54.230.150.30 TCP 66 54826 > http [ACK] Seq=98 Ack=353771 Win=659328 Len=0 TSval=12314452 TSecr=1454756644
100   0.022466 54.230.150.30 -> 172.31.29.138 TCP 26130 [TCP segment of a reassembled PDU]
101   0.022480 172.31.29.138 -> 54.230.150.30 TCP 66 54826 > http [ACK] Seq=98 Ack=379835 Win=711424 Len=0 TSval=12314452 TSecr=1454756644
102   0.022495 54.230.150.30 -> 172.31.29.138 TCP 13098 [TCP segment of a reassembled PDU]
103   0.022505 172.31.29.138 -> 54.230.150.30 TCP 66 54826 > http [ACK] Seq=98 Ack=392867 Win=737536 Len=0 TSval=12314452 TSecr=1454756644
104   0.023224 54.230.150.30 -> 172.31.29.138 TCP 4410 [TCP segment of a reassembled PDU]
105   0.023231 172.31.29.138 -> 54.230.150.30 TCP 66 54826 > http [ACK] Seq=98 Ack=397211 Win=746240 Len=0 TSval=12314452 TSecr=1454756644
106   0.023379 54.230.150.30 -> 172.31.29.138 TCP 15994 [TCP segment of a reassembled PDU]
107   0.023389 172.31.29.138 -> 54.230.150.30 TCP 66 54826 > http [ACK] Seq=98 Ack=413139 Win=777984 Len=0 TSval=12314452 TSecr=1454756644
108   0.023847 54.230.150.30 -> 172.31.29.138 TCP 5858 [TCP segment of a reassembled PDU]
109   0.023854 172.31.29.138 -> 54.230.150.30 TCP 66 54826 > http [ACK] Seq=98 Ack=418931 Win=789632 Len=0 TSval=12314452 TSecr=1454756644
110   0.024036 54.230.150.30 -> 172.31.29.138 TCP 26130 [TCP segment of a reassembled PDU]
111   0.024051 172.31.29.138 -> 54.230.150.30 TCP 66 54826 > http [ACK] Seq=98 Ack=444995 Win=841728 Len=0 TSval=12314452 TSecr=1454756644
112   0.024070 54.230.150.30 -> 172.31.29.138 TCP 15994 [TCP segment of a reassembled PDU]
113   0.024078 172.31.29.138 -> 54.230.150.30 TCP 66 54826 > http [ACK] Seq=98 Ack=460923 Win=867968 Len=0 TSval=12314452 TSecr=1454756644
114   0.024590 54.230.150.30 -> 172.31.29.138 TCP 5858 [TCP segment of a reassembled PDU]
115   0.024597 172.31.29.138 -> 54.230.150.30 TCP 66 54826 > http [ACK] Seq=98 Ack=466715 Win=885248 Len=0 TSval=12314452 TSecr=1454756644
116   0.024731 54.230.150.30 -> 172.31.29.138 TCP 11650 [TCP segment of a reassembled PDU]
117   0.024739 172.31.29.138 -> 54.230.150.30 TCP 66 54826 > http [ACK] Seq=98 Ack=478299 Win=908416 Len=0 TSval=12314452 TSecr=1454756644
118   0.025622 54.230.150.30 -> 172.31.29.138 TCP 7306 [TCP segment of a reassembled PDU]
119   0.025629 172.31.29.138 -> 54.230.150.30 TCP 66 54826 > http [ACK] Seq=98 Ack=485539 Win=922880 Len=0 TSval=12314453 TSecr=1454756644
120   0.025822 54.230.150.30 -> 172.31.29.138 TCP 21786 [TCP segment of a reassembled PDU]
121   0.025834 172.31.29.138 -> 54.230.150.30 TCP 66 54826 > http [ACK] Seq=98 Ack=507259 Win=901376 Len=0 TSval=12314453 TSecr=1454756644
122   0.025847 54.230.150.30 -> 172.31.29.138 TCP 4410 [TCP segment of a reassembled PDU]
123   0.025850 172.31.29.138 -> 54.230.150.30 TCP 66 54826 > http [ACK] Seq=98 Ack=511603 Win=897152 Len=0 TSval=12314453 TSecr=1454756644
124   0.025939 54.230.150.30 -> 172.31.29.138 TCP 31922 [TCP segment of a reassembled PDU]
125   0.025956 172.31.29.138 -> 54.230.150.30 TCP 66 54826 > http [ACK] Seq=98 Ack=543459 Win=884736 Len=0 TSval=12314453 TSecr=1454756644
126   0.026934 54.230.150.30 -> 172.31.29.138 TCP 2962 [TCP segment of a reassembled PDU]
127   0.026940 172.31.29.138 -> 54.230.150.30 TCP 66 54826 > http [ACK] Seq=98 Ack=546355 Win=928640 Len=0 TSval=12314453 TSecr=1454756644
128   0.027123 54.230.150.30 -> 172.31.29.138 TCP 23234 [TCP segment of a reassembled PDU]
129   0.027135 172.31.29.138 -> 54.230.150.30 TCP 66 54826 > http [ACK] Seq=98 Ack=569523 Win=905472 Len=0 TSval=12314453 TSecr=1454756644
130   0.027142 54.230.150.30 -> 172.31.29.138 TCP 2962 [TCP segment of a reassembled PDU]
131   0.027146 172.31.29.138 -> 54.230.150.30 TCP 66 54826 > http [ACK] Seq=98 Ack=572419 Win=902656 Len=0 TSval=12314453 TSecr=1454756644
132   0.027228 54.230.150.30 -> 172.31.29.138 TCP 26130 [TCP segment of a reassembled PDU]
133   0.027242 172.31.29.138 -> 54.230.150.30 TCP 66 54826 > http [ACK] Seq=98 Ack=598483 Win=894336 Len=0 TSval=12314453 TSecr=1454756644
134   0.027322 54.230.150.30 -> 172.31.29.138 TCP 10202 [TCP segment of a reassembled PDU]
135   0.027330 172.31.29.138 -> 54.230.150.30 TCP 66 54826 > http [ACK] Seq=98 Ack=608619 Win=920448 Len=0 TSval=12314453 TSecr=1454756644
136   0.027358 54.230.150.30 -> 172.31.29.138 TCP 8754 [TCP segment of a reassembled PDU]
137   0.027367 172.31.29.138 -> 54.230.150.30 TCP 66 54826 > http [ACK] Seq=98 Ack=617307 Win=922880 Len=0 TSval=12314453 TSecr=1454756644
138   0.027491 54.230.150.30 -> 172.31.29.138 TCP 23234 [TCP segment of a reassembled PDU]
139   0.027503 172.31.29.138 -> 54.230.150.30 TCP 66 54826 > http [ACK] Seq=98 Ack=640475 Win=899712 Len=0 TSval=12314453 TSecr=1454756644
140   0.027614 54.230.150.30 -> 172.31.29.138 TCP 1514 [TCP segment of a reassembled PDU]
141   0.027620 172.31.29.138 -> 54.230.150.30 TCP 66 54826 > http [ACK] Seq=98 Ack=641923 Win=931584 Len=0 TSval=12314453 TSecr=1454756644
142   0.028336 54.230.150.30 -> 172.31.29.138 TCP 2962 [TCP segment of a reassembled PDU]
143   0.028341 172.31.29.138 -> 54.230.150.30 TCP 66 54826 > http [ACK] Seq=98 Ack=644819 Win=932352 Len=0 TSval=12314453 TSecr=1454756644
144   0.028474 54.230.150.30 -> 172.31.29.138 TCP 20338 [TCP segment of a reassembled PDU]
145   0.028486 172.31.29.138 -> 54.230.150.30 TCP 66 54826 > http [ACK] Seq=98 Ack=665091 Win=912128 Len=0 TSval=12314453 TSecr=1454756644
146   0.028620 54.230.150.30 -> 172.31.29.138 TCP 8754 [TCP segment of a reassembled PDU]
147   0.028628 172.31.29.138 -> 54.230.150.30 TCP 66 54826 > http [ACK] Seq=98 Ack=673779 Win=922880 Len=0 TSval=12314453 TSecr=1454756644
148   0.028877 54.230.150.30 -> 172.31.29.138 TCP 15994 [TCP segment of a reassembled PDU]
149   0.028901 172.31.29.138 -> 54.230.150.30 TCP 66 54826 > http [ACK] Seq=98 Ack=689707 Win=935168 Len=0 TSval=12314453 TSecr=1454756644
150   0.029001 54.230.150.30 -> 172.31.29.138 TCP 24682 [TCP segment of a reassembled PDU]
151   0.029027 172.31.29.138 -> 54.230.150.30 TCP 66 54826 > http [ACK] Seq=98 Ack=714323 Win=910592 Len=0 TSval=12314453 TSecr=1454756644
152   0.029037 54.230.150.30 -> 172.31.29.138 TCP 2962 [TCP segment of a reassembled PDU]
153   0.029054 172.31.29.138 -> 54.230.150.30 TCP 66 54826 > http [ACK] Seq=98 Ack=717219 Win=935168 Len=0 TSval=12314453 TSecr=1454756644
154   0.029193 54.230.150.30 -> 172.31.29.138 TCP 21786 [TCP segment of a reassembled PDU]
155   0.029219 172.31.29.138 -> 54.230.150.30 TCP 66 54826 > http [ACK] Seq=98 Ack=738939 Win=935168 Len=0 TSval=12314454 TSecr=1454756644
156   0.030136 54.230.150.30 -> 172.31.29.138 TCP 2962 [TCP segment of a reassembled PDU]
157   0.030143 172.31.29.138 -> 54.230.150.30 TCP 66 54826 > http [ACK] Seq=98 Ack=741835 Win=940928 Len=0 TSval=12314454 TSecr=1454756644
158   0.030313 54.230.150.30 -> 172.31.29.138 TCP 26130 [TCP segment of a reassembled PDU]
159   0.030327 172.31.29.138 -> 54.230.150.30 TCP 66 54826 > http [ACK] Seq=98 Ack=767899 Win=993024 Len=0 TSval=12314454 TSecr=1454756644
160   0.030339 54.230.150.30 -> 172.31.29.138 TCP 10202 [TCP segment of a reassembled PDU]
161   0.030348 172.31.29.138 -> 54.230.150.30 TCP 66 54826 > http [ACK] Seq=98 Ack=778035 Win=1013376 Len=0 TSval=12314454 TSecr=1454756644
162   0.030427 54.230.150.30 -> 172.31.29.138 TCP 26130 [TCP segment of a reassembled PDU]
163   0.030441 172.31.29.138 -> 54.230.150.30 TCP 66 54826 > http [ACK] Seq=98 Ack=804099 Win=1065472 Len=0 TSval=12314454 TSecr=1454756644
164   0.030760 54.230.150.30 -> 172.31.29.138 TCP 23234 [TCP segment of a reassembled PDU]
165   0.030773 172.31.29.138 -> 54.230.150.30 TCP 66 54826 > http [ACK] Seq=98 Ack=827267 Win=1111808 Len=0 TSval=12314454 TSecr=1454756645
166   0.030868 54.230.150.30 -> 172.31.29.138 TCP 23234 [TCP segment of a reassembled PDU]
167   0.030881 172.31.29.138 -> 54.230.150.30 TCP 66 54826 > http [ACK] Seq=98 Ack=850435 Win=1158144 Len=0 TSval=12314454 TSecr=1454756645
168   0.030947 54.230.150.30 -> 172.31.29.138 TCP 8754 [TCP segment of a reassembled PDU]
169   0.030954 172.31.29.138 -> 54.230.150.30 TCP 66 54826 > http [ACK] Seq=98 Ack=859123 Win=1175552 Len=0 TSval=12314454 TSecr=1454756645
170   0.031795 54.230.150.30 -> 172.31.29.138 TCP 4410 [TCP segment of a reassembled PDU]
171   0.031802 172.31.29.138 -> 54.230.150.30 TCP 66 54826 > http [ACK] Seq=98 Ack=863467 Win=1184128 Len=0 TSval=12314454 TSecr=1454756645
172   0.031920 54.230.150.30 -> 172.31.29.138 TCP 5858 [TCP segment of a reassembled PDU]
173   0.031926 172.31.29.138 -> 54.230.150.30 TCP 66 54826 > http [ACK] Seq=98 Ack=869259 Win=1195776 Len=0 TSval=12314454 TSecr=1454756645
174   0.032020 54.230.150.30 -> 172.31.29.138 TCP 20338 [TCP segment of a reassembled PDU]
175   0.032032 172.31.29.138 -> 54.230.150.30 TCP 66 54826 > http [ACK] Seq=98 Ack=889531 Win=1236352 Len=0 TSval=12314454 TSecr=1454756645
176   0.032038 54.230.150.30 -> 172.31.29.138 TCP 1514 [TCP segment of a reassembled PDU]
177   0.032040 172.31.29.138 -> 54.230.150.30 TCP 66 54826 > http [ACK] Seq=98 Ack=890979 Win=1239168 Len=0 TSval=12314454 TSecr=1454756645
178   0.032050 54.230.150.30 -> 172.31.29.138 TCP 4410 [TCP segment of a reassembled PDU]
179   0.032068 172.31.29.138 -> 54.230.150.30 TCP 66 54826 > http [ACK] Seq=98 Ack=895323 Win=1236608 Len=0 TSval=12314454 TSecr=1454756645
180   0.032142 54.230.150.30 -> 172.31.29.138 TCP 39162 [TCP segment of a reassembled PDU]
181   0.032176 172.31.29.138 -> 54.230.150.30 TCP 66 54826 > http [ACK] Seq=98 Ack=934419 Win=1215232 Len=0 TSval=12314454 TSecr=1454756645
182   0.032349 54.230.150.30 -> 172.31.29.138 TCP 17442 [TCP segment of a reassembled PDU]
183   0.032359 172.31.29.138 -> 54.230.150.30 TCP 66 54826 > http [ACK] Seq=98 Ack=951795 Win=1250944 Len=0 TSval=12314454 TSecr=1454756645
184   0.032380 54.230.150.30 -> 172.31.29.138 TCP 8754 [TCP segment of a reassembled PDU]
185   0.032393 172.31.29.138 -> 54.230.150.30 TCP 66 54826 > http [ACK] Seq=98 Ack=960483 Win=1242368 Len=0 TSval=12314454 TSecr=1454756645
186   0.032435 54.230.150.30 -> 172.31.29.138 TCP 15994 [TCP segment of a reassembled PDU]
187   0.032443 172.31.29.138 -> 54.230.150.30 TCP 66 54826 > http [ACK] Seq=98 Ack=976411 Win=1253248 Len=0 TSval=12314454 TSecr=1454756645
188   0.032540 54.230.150.30 -> 172.31.29.138 TCP 2962 [TCP segment of a reassembled PDU]
189   0.032620 172.31.29.138 -> 54.230.150.30 TCP 66 54826 > http [ACK] Seq=98 Ack=979307 Win=1273984 Len=0 TSval=12314454 TSecr=1454756645
190   0.033114 54.230.150.30 -> 172.31.29.138 TCP 1514 [TCP segment of a reassembled PDU]
191   0.033119 172.31.29.138 -> 54.230.150.30 TCP 66 54826 > http [ACK] Seq=98 Ack=980755 Win=1276800 Len=0 TSval=12314455 TSecr=1454756645
192   0.033290 54.230.150.30 -> 172.31.29.138 TCP 18890 [TCP segment of a reassembled PDU]
193   0.033313 172.31.29.138 -> 54.230.150.30 TCP 66 54826 > http [ACK] Seq=98 Ack=999579 Win=1257984 Len=0 TSval=12314455 TSecr=1454756645
194   0.033550 54.230.150.30 -> 172.31.29.138 TCP 11650 [TCP segment of a reassembled PDU]
195   0.033559 172.31.29.138 -> 54.230.150.30 TCP 66 54826 > http [ACK] Seq=98 Ack=1011163 Win=1260544 Len=0 TSval=12314455 TSecr=1454756645
196   0.033701 54.230.150.30 -> 172.31.29.138 TCP 26130 [TCP segment of a reassembled PDU]
197   0.033737 54.230.150.30 -> 172.31.29.138 TCP 17442 [TCP segment of a reassembled PDU]
198   0.033752 172.31.29.138 -> 54.230.150.30 TCP 66 54826 > http [ACK] Seq=98 Ack=1054603 Win=1217152 Len=0 TSval=12314455 TSecr=1454756645
199   0.033779 54.230.150.30 -> 172.31.29.138 TCP 10202 [TCP segment of a reassembled PDU]
200   0.033785 172.31.29.138 -> 54.230.150.30 TCP 66 54826 > http [ACK] Seq=98 Ack=1064739 Win=1234176 Len=0 TSval=12314455 TSecr=1454756645
201   0.033889 54.230.150.30 -> 172.31.29.138 TCP 8754 [TCP segment of a reassembled PDU]
202   0.033897 172.31.29.138 -> 54.230.150.30 TCP 66 54826 > http [ACK] Seq=98 Ack=1073427 Win=1265280 Len=0 TSval=12314455 TSecr=1454756645
203   0.034057 54.230.150.30 -> 172.31.29.138 TCP 26130 [TCP segment of a reassembled PDU]
204   0.034076 54.230.150.30 -> 172.31.29.138 TCP 7306 [TCP segment of a reassembled PDU]
205   0.034094 172.31.29.138 -> 54.230.150.30 TCP 66 54826 > http [ACK] Seq=98 Ack=1106731 Win=1232000 Len=0 TSval=12314455 TSecr=1454756645
206   0.034118 54.230.150.30 -> 172.31.29.138 TCP 10202 [TCP segment of a reassembled PDU]
207   0.034127 172.31.29.138 -> 54.230.150.30 TCP 66 54826 > http [ACK] Seq=98 Ack=1116867 Win=1250944 Len=0 TSval=12314455 TSecr=1454756645
208   0.034213 54.230.150.30 -> 172.31.29.138 TCP 2962 [TCP segment of a reassembled PDU]
209   0.034218 172.31.29.138 -> 54.230.150.30 TCP 66 54826 > http [ACK] Seq=98 Ack=1119763 Win=1274752 Len=0 TSval=12314455 TSecr=1454756645
210   0.034724 54.230.150.30 -> 172.31.29.138 TCP 2962 [TCP segment of a reassembled PDU]
211   0.034731 172.31.29.138 -> 54.230.150.30 TCP 66 54826 > http [ACK] Seq=98 Ack=1122659 Win=1274752 Len=0 TSval=12314455 TSecr=1454756645
212   0.034853 54.230.150.30 -> 172.31.29.138 TCP 7306 [TCP segment of a reassembled PDU]
213   0.034871 172.31.29.138 -> 54.230.150.30 TCP 66 54826 > http [ACK] Seq=98 Ack=1129899 Win=1276800 Len=0 TSval=12314455 TSecr=1454756645
214   0.035230 54.230.150.30 -> 172.31.29.138 TCP 2962 [TCP segment of a reassembled PDU]
215   0.035245 172.31.29.138 -> 54.230.150.30 TCP 66 54826 > http [ACK] Seq=98 Ack=1132795 Win=1276800 Len=0 TSval=12314455 TSecr=1454756645
216   0.035400 54.230.150.30 -> 172.31.29.138 TCP 21786 [TCP segment of a reassembled PDU]
217   0.035423 172.31.29.138 -> 54.230.150.30 TCP 66 54826 > http [ACK] Seq=98 Ack=1154515 Win=1255168 Len=0 TSval=12314455 TSecr=1454756645
218   0.035532 54.230.150.30 -> 172.31.29.138 TCP 26130 [TCP segment of a reassembled PDU]
219   0.035549 54.230.150.30 -> 172.31.29.138 TCP 4410 [TCP segment of a reassembled PDU]
220   0.035564 172.31.29.138 -> 54.230.150.30 TCP 66 54826 > http [ACK] Seq=98 Ack=1184923 Win=1229440 Len=0 TSval=12314455 TSecr=1454756645
221   0.035637 54.230.150.30 -> 172.31.29.138 TCP 10202 [TCP segment of a reassembled PDU]
222   0.035645 172.31.29.138 -> 54.230.150.30 TCP 66 54826 > http [ACK] Seq=98 Ack=1195059 Win=1262848 Len=0 TSval=12314455 TSecr=1454756645
223   0.035665 54.230.150.30 -> 172.31.29.138 TCP 15994 [TCP segment of a reassembled PDU]
224   0.035688 172.31.29.138 -> 54.230.150.30 TCP 66 54826 > http [ACK] Seq=98 Ack=1210987 Win=1253248 Len=0 TSval=12314455 TSecr=1454756645
225   0.035766 54.230.150.30 -> 172.31.29.138 TCP 15994 [TCP segment of a reassembled PDU]
226   0.035775 172.31.29.138 -> 54.230.150.30 TCP 66 54826 > http [ACK] Seq=98 Ack=1226915 Win=1253248 Len=0 TSval=12314455 TSecr=1454756645
227   0.035899 54.230.150.30 -> 172.31.29.138 TCP 26130 [TCP segment of a reassembled PDU]
228   0.035949 172.31.29.138 -> 54.230.150.30 TCP 66 54826 > http [ACK] Seq=98 Ack=1252979 Win=1236736 Len=0 TSval=12314455 TSecr=1454756645
229   0.035973 54.230.150.30 -> 172.31.29.138 TCP 7306 [TCP segment of a reassembled PDU]
230   0.035983 172.31.29.138 -> 54.230.150.30 TCP 66 54826 > http [ACK] Seq=98 Ack=1260219 Win=1229568 Len=0 TSval=12314455 TSecr=1454756645
231   0.036968 54.230.150.30 -> 172.31.29.138 TCP 4410 [TCP segment of a reassembled PDU]
232   0.036974 172.31.29.138 -> 54.230.150.30 TCP 66 54826 > http [ACK] Seq=98 Ack=1264563 Win=1272320 Len=0 TSval=12314455 TSecr=1454756645
233   0.037139 54.230.150.30 -> 172.31.29.138 TCP 26130 [TCP segment of a reassembled PDU]
234   0.037166 172.31.29.138 -> 54.230.150.30 TCP 66 54826 > http [ACK] Seq=98 Ack=1290627 Win=1246336 Len=0 TSval=12314456 TSecr=1454756645
235   0.037202 54.230.150.30 -> 172.31.29.138 TCP 26130 [TCP segment of a reassembled PDU]
236   0.037231 54.230.150.30 -> 172.31.29.138 TCP 8754 [TCP segment of a reassembled PDU]
237   0.037238 172.31.29.138 -> 54.230.150.30 TCP 66 54826 > http [ACK] Seq=98 Ack=1316691 Win=1236736 Len=0 TSval=12314456 TSecr=1454756645
238   0.037251 172.31.29.138 -> 54.230.150.30 TCP 66 54826 > http [ACK] Seq=98 Ack=1325379 Win=1228160 Len=0 TSval=12314456 TSecr=1454756645
239   0.037419 54.230.150.30 -> 172.31.29.138 TCP 26130 [TCP segment of a reassembled PDU]
240   0.037432 172.31.29.138 -> 54.230.150.30 TCP 66 54826 > http [ACK] Seq=98 Ack=1351443 Win=1236736 Len=0 TSval=12314456 TSecr=1454756645
241   0.037452 54.230.150.30 -> 172.31.29.138 TCP 13098 [TCP segment of a reassembled PDU]
242   0.037486 172.31.29.138 -> 54.230.150.30 TCP 66 54826 > http [ACK] Seq=98 Ack=1364475 Win=1223808 Len=0 TSval=12314456 TSecr=1454756645
243   0.037509 54.230.150.30 -> 172.31.29.138 TCP 13098 [TCP segment of a reassembled PDU]
244   0.037526 172.31.29.138 -> 54.230.150.30 TCP 66 54826 > http [ACK] Seq=98 Ack=1377507 Win=1236736 Len=0 TSval=12314456 TSecr=1454756645
245   0.037641 54.230.150.30 -> 172.31.29.138 TCP 13098 [TCP segment of a reassembled PDU]
246   0.037650 172.31.29.138 -> 54.230.150.30 TCP 66 54826 > http [ACK] Seq=98 Ack=1390539 Win=1258112 Len=0 TSval=12314456 TSecr=1454756645
247   0.038579 54.230.150.30 -> 172.31.29.138 TCP 5858 [TCP segment of a reassembled PDU]
248   0.038586 172.31.29.138 -> 54.230.150.30 TCP 66 54826 > http [ACK] Seq=98 Ack=1396331 Win=1270016 Len=0 TSval=12314456 TSecr=1454756645
249   0.038810 54.230.150.30 -> 172.31.29.138 TCP 26130 [TCP segment of a reassembled PDU]
250   0.038826 54.230.150.30 -> 172.31.29.138 TCP 4410 [TCP segment of a reassembled PDU]
251   0.038856 172.31.29.138 -> 54.230.150.30 TCP 66 54826 > http [ACK] Seq=98 Ack=1426739 Win=1239680 Len=0 TSval=12314456 TSecr=1454756645
252   0.038883 54.230.150.30 -> 172.31.29.138 TCP 21786 [TCP segment of a reassembled PDU]
253   0.038901 172.31.29.138 -> 54.230.150.30 TCP 66 54826 > http [ACK] Seq=98 Ack=1448459 Win=1243776 Len=0 TSval=12314456 TSecr=1454756645
254   0.038970 54.230.150.30 -> 172.31.29.138 TCP 26130 [TCP segment of a reassembled PDU]
255   0.039110 54.230.150.30 -> 172.31.29.138 TCP 26130 [TCP segment of a reassembled PDU]
256   0.039157 172.31.29.138 -> 54.230.150.30 TCP 66 54826 > http [ACK] Seq=98 Ack=1500587 Win=1193856 Len=0 TSval=12314456 TSecr=1454756645
257   0.039221 54.230.150.30 -> 172.31.29.138 TCP 20338 [TCP segment of a reassembled PDU]
258   0.039233 172.31.29.138 -> 54.230.150.30 TCP 66 54826 > http [ACK] Seq=98 Ack=1520859 Win=1246208 Len=0 TSval=12314456 TSecr=1454756645
259   0.040058 54.230.150.30 -> 172.31.29.138 TCP 2962 [TCP segment of a reassembled PDU]
260   0.040064 172.31.29.138 -> 54.230.150.30 TCP 66 54826 > http [ACK] Seq=98 Ack=1523755 Win=1274752 Len=0 TSval=12314456 TSecr=1454756645
261   0.040240 54.230.150.30 -> 172.31.29.138 TCP 26130 [TCP segment of a reassembled PDU]
262   0.040266 172.31.29.138 -> 54.230.150.30 TCP 66 54826 > http [ACK] Seq=98 Ack=1549819 Win=1248768 Len=0 TSval=12314456 TSecr=1454756645
263   0.040294 54.230.150.30 -> 172.31.29.138 TCP 27578 [TCP segment of a reassembled PDU]
264   0.040319 172.31.29.138 -> 54.230.150.30 TCP 66 54826 > http [ACK] Seq=98 Ack=1577331 Win=1234176 Len=0 TSval=12314456 TSecr=1454756645
265   0.040339 54.230.150.30 -> 172.31.29.138 TCP 8754 [TCP segment of a reassembled PDU]
266   0.040356 172.31.29.138 -> 54.230.150.30 TCP 66 54826 > http [ACK] Seq=98 Ack=1586019 Win=1276800 Len=0 TSval=12314456 TSecr=1454756645
267   0.040596 54.230.150.30 -> 172.31.29.138 TCP 11650 [TCP segment of a reassembled PDU]
268   0.040619 172.31.29.138 -> 54.230.150.30 TCP 66 54826 > http [ACK] Seq=98 Ack=1597603 Win=1276800 Len=0 TSval=12314456 TSecr=1454756646
269   0.040771 54.230.150.30 -> 172.31.29.138 TCP 26130 [TCP segment of a reassembled PDU]
270   0.040804 54.230.150.30 -> 172.31.29.138 TCP 15994 [TCP segment of a reassembled PDU]
271   0.040817 54.230.150.30 -> 172.31.29.138 TCP 11650 [TCP segment of a reassembled PDU]
272   0.040832 172.31.29.138 -> 54.230.150.30 TCP 66 54826 > http [ACK] Seq=98 Ack=1651179 Win=1223296 Len=0 TSval=12314456 TSecr=1454756646
273   0.041510 54.230.150.30 -> 172.31.29.138 TCP 4410 [TCP segment of a reassembled PDU]
274   0.041516 172.31.29.138 -> 54.230.150.30 TCP 66 54826 > http [ACK] Seq=98 Ack=1655523 Win=1272320 Len=0 TSval=12314457 TSecr=1454756646
275   0.041672 54.230.150.30 -> 172.31.29.138 TCP 26130 [TCP segment of a reassembled PDU]
276   0.041699 172.31.29.138 -> 54.230.150.30 TCP 66 54826 > http [ACK] Seq=98 Ack=1681587 Win=1246336 Len=0 TSval=12314457 TSecr=1454756646
277   0.041750 54.230.150.30 -> 172.31.29.138 TCP 26130 [TCP segment of a reassembled PDU]
278   0.041835 54.230.150.30 -> 172.31.29.138 TCP 33370 [TCP segment of a reassembled PDU]
279   0.041949 172.31.29.138 -> 54.230.150.30 TCP 66 54826 > http [ACK] Seq=98 Ack=1740955 Win=1187072 Len=0 TSval=12314457 TSecr=1454756646
280   0.041980 54.230.150.30 -> 172.31.29.138 TCP 24682 [TCP segment of a reassembled PDU]
281   0.042001 172.31.29.138 -> 54.230.150.30 TCP 66 54826 > http [ACK] Seq=98 Ack=1765571 Win=1184256 Len=0 TSval=12314457 TSecr=1454756646
282   0.042054 54.230.150.30 -> 172.31.29.138 TCP 15994 [TCP segment of a reassembled PDU]
283   0.042065 172.31.29.138 -> 54.230.150.30 TCP 66 54826 > http [ACK] Seq=98 Ack=1781499 Win=1253248 Len=0 TSval=12314457 TSecr=1454756646
284   0.042334 54.230.150.30 -> 172.31.29.138 TCP 20338 [TCP segment of a reassembled PDU]
285   0.042358 172.31.29.138 -> 54.230.150.30 TCP 66 54826 > http [ACK] Seq=98 Ack=1801771 Win=1246208 Len=0 TSval=12314457 TSecr=1454756646
286   0.042475 54.230.150.30 -> 172.31.29.138 TCP 26130 [TCP segment of a reassembled PDU]
287   0.042501 54.230.150.30 -> 172.31.29.138 TCP 18890 [TCP segment of a reassembled PDU]
288   0.042582 172.31.29.138 -> 54.230.150.30 TCP 66 54826 > http [ACK] Seq=98 Ack=1846659 Win=1205632 Len=0 TSval=12314457 TSecr=1454756646
289   0.043152 54.230.150.30 -> 172.31.29.138 TCP 4410 [TCP segment of a reassembled PDU]
290   0.043159 172.31.29.138 -> 54.230.150.30 TCP 66 54826 > http [ACK] Seq=98 Ack=1851003 Win=1272320 Len=0 TSval=12314457 TSecr=1454756646
291   0.043325 54.230.150.30 -> 172.31.29.138 TCP 26130 [TCP segment of a reassembled PDU]
292   0.043356 54.230.150.30 -> 172.31.29.138 TCP 27578 [TCP segment of a reassembled PDU]
293   0.043381 172.31.29.138 -> 54.230.150.30 TCP 66 54826 > http [ACK] Seq=98 Ack=1904579 Win=1218816 Len=0 TSval=12314457 TSecr=1454756646
294   0.043466 54.230.150.30 -> 172.31.29.138 TCP 11650 [TCP segment of a reassembled PDU]
295   0.043473 172.31.29.138 -> 54.230.150.30 TCP 66 54826 > http [ACK] Seq=98 Ack=1916163 Win=1260544 Len=0 TSval=12314457 TSecr=1454756646
296   0.043567 54.230.150.30 -> 172.31.29.138 TCP 26130 [TCP segment of a reassembled PDU]
297   0.043620 54.230.150.30 -> 172.31.29.138 TCP 24682 [TCP segment of a reassembled PDU]
298   0.043702 54.230.150.30 -> 172.31.29.138 TCP 5858 [TCP segment of a reassembled PDU]
299   0.043725 172.31.29.138 -> 54.230.150.30 TCP 66 54826 > http [ACK] Seq=98 Ack=1972635 Win=1204096 Len=0 TSval=12314457 TSecr=1454756646
300   0.043812 54.230.150.30 -> 172.31.29.138 TCP 4410 [TCP segment of a reassembled PDU]
301   0.043817 172.31.29.138 -> 54.230.150.30 TCP 66 54826 > http [ACK] Seq=98 Ack=1976979 Win=1272320 Len=0 TSval=12314457 TSecr=1454756646
302   0.043897 54.230.150.30 -> 172.31.29.138 TCP 5858 [TCP segment of a reassembled PDU]
303   0.043913 172.31.29.138 -> 54.230.150.30 TCP 66 54826 > http [ACK] Seq=98 Ack=1982771 Win=1276800 Len=0 TSval=12314457 TSecr=1454756646
304   0.044074 54.230.150.30 -> 172.31.29.138 TCP 26130 [TCP segment of a reassembled PDU]
305   0.044115 54.230.150.30 -> 172.31.29.138 TCP 20338 [TCP segment of a reassembled PDU]
306   0.044124 172.31.29.138 -> 54.230.150.30 TCP 66 54826 > http [ACK] Seq=98 Ack=2008835 Win=1250816 Len=0 TSval=12314457 TSecr=1454756646
307   0.044139 172.31.29.138 -> 54.230.150.30 TCP 66 54826 > http [ACK] Seq=98 Ack=2029107 Win=1246208 Len=0 TSval=12314457 TSecr=1454756646
308   0.044224 54.230.150.30 -> 172.31.29.138 TCP 13098 [TCP segment of a reassembled PDU]
309   0.044231 172.31.29.138 -> 54.230.150.30 TCP 66 54826 > http [ACK] Seq=98 Ack=2042139 Win=1258112 Len=0 TSval=12314457 TSecr=1454756646
310   0.044802 54.230.150.30 -> 172.31.29.138 TCP 4410 [TCP segment of a reassembled PDU]
311   0.044808 172.31.29.138 -> 54.230.150.30 TCP 66 54826 > http [ACK] Seq=98 Ack=2046483 Win=1272320 Len=0 TSval=12314457 TSecr=1454756646
312   0.044976 54.230.150.30 -> 172.31.29.138 TCP 26130 [TCP segment of a reassembled PDU]
313   0.045017 54.230.150.30 -> 172.31.29.138 TCP 18890 [TCP segment of a reassembled PDU]
314   0.045023 172.31.29.138 -> 54.230.150.30 TCP 66 54826 > http [ACK] Seq=98 Ack=2072547 Win=1246336 Len=0 TSval=12314457 TSecr=1454756646
315   0.045043 54.230.150.30 -> 172.31.29.138 TCP 5858 [TCP segment of a reassembled PDU]
316   0.045051 172.31.29.138 -> 54.230.150.30 TCP 66 54826 > http [ACK] Seq=98 Ack=2097163 Win=1238912 Len=0 TSval=12314457 TSecr=1454756646
317   0.045095 54.230.150.30 -> 172.31.29.138 TCP 10202 [TCP segment of a reassembled PDU]
318   0.045101 172.31.29.138 -> 54.230.150.30 TCP 66 54826 > http [ACK] Seq=98 Ack=2107299 Win=1262848 Len=0 TSval=12314457 TSecr=1454756646
319   0.045338 54.230.150.30 -> 172.31.29.138 TCP 8754 [TCP segment of a reassembled PDU]
320   0.045344 172.31.29.138 -> 54.230.150.30 TCP 66 54826 > http [ACK] Seq=98 Ack=2115987 Win=1265280 Len=0 TSval=12314458 TSecr=1454756646
321   0.045491 54.230.150.30 -> 172.31.29.138 TCP 26130 [TCP segment of a reassembled PDU]
322   0.045507 54.230.150.30 -> 172.31.29.138 TCP 11650 [TCP segment of a reassembled PDU]
323   0.045517 54.230.150.30 -> 172.31.29.138 TCP 8754 [TCP segment of a reassembled PDU]
324   0.045534 172.31.29.138 -> 54.230.150.30 TCP 66 54826 > http [ACK] Seq=98 Ack=2162323 Win=1218944 Len=0 TSval=12314458 TSecr=1454756646
325   0.045586 54.230.150.30 -> 172.31.29.138 TCP 21786 [TCP segment of a reassembled PDU]
326   0.045593 172.31.29.138 -> 54.230.150.30 TCP 66 54826 > http [ACK] Seq=98 Ack=2184043 Win=1243776 Len=0 TSval=12314458 TSecr=1454756646
327   0.045668 54.230.150.30 -> 172.31.29.138 TCP 14546 [TCP segment of a reassembled PDU]
328   0.045781 172.31.29.138 -> 54.230.150.30 TCP 66 54826 > http [ACK] Seq=98 Ack=2198523 Win=1229312 Len=0 TSval=12314458 TSecr=1454756646
329   0.045818 54.230.150.30 -> 172.31.29.138 TCP 26130 [TCP segment of a reassembled PDU]
330   0.045837 172.31.29.138 -> 54.230.150.30 TCP 66 54826 > http [ACK] Seq=98 Ack=2224587 Win=1236736 Len=0 TSval=12314458 TSecr=1454756646
331   0.045859 54.230.150.30 -> 172.31.29.138 TCP 13098 [TCP segment of a reassembled PDU]
332   0.045869 172.31.29.138 -> 54.230.150.30 TCP 66 54826 > http [ACK] Seq=98 Ack=2237619 Win=1258112 Len=0 TSval=12314458 TSecr=1454756646
333   0.046529 54.230.150.30 -> 172.31.29.138 TCP 5858 [TCP segment of a reassembled PDU]
334   0.046535 172.31.29.138 -> 54.230.150.30 TCP 66 54826 > http [ACK] Seq=98 Ack=2243411 Win=1270016 Len=0 TSval=12314458 TSecr=1454756646
335   0.046708 54.230.150.30 -> 172.31.29.138 TCP 17442 [TCP segment of a reassembled PDU]
336   0.046727 172.31.29.138 -> 54.230.150.30 TCP 66 54826 > http [ACK] Seq=98 Ack=2260787 Win=1252736 Len=0 TSval=12314458 TSecr=1454756646
337   0.046741 54.230.150.30 -> 172.31.29.138 TCP 8754 [TCP segment of a reassembled PDU]
338   0.046755 172.31.29.138 -> 54.230.150.30 TCP 66 54826 > http [ACK] Seq=98 Ack=2269475 Win=1276800 Len=0 TSval=12314458 TSecr=1454756646
339   0.046825 54.230.150.30 -> 172.31.29.138 TCP 33370 [TCP segment of a reassembled PDU]
340   0.046848 172.31.29.138 -> 54.230.150.30 TCP 66 54826 > http [ACK] Seq=98 Ack=2302779 Win=1243520 Len=0 TSval=12314458 TSecr=1454756646
341   0.047183 54.230.150.30 -> 172.31.29.138 TCP 20338 [TCP segment of a reassembled PDU]
342   0.047191 172.31.29.138 -> 54.230.150.30 TCP 66 54826 > http [ACK] Seq=98 Ack=2323051 Win=1246208 Len=0 TSval=12314458 TSecr=1454756646
343   0.047210 54.230.150.30 -> 172.31.29.138 TCP 5858 [TCP segment of a reassembled PDU]
344   0.047221 172.31.29.138 -> 54.230.150.30 TCP 66 54826 > http [ACK] Seq=98 Ack=2328843 Win=1240448 Len=0 TSval=12314458 TSecr=1454756646
345   0.047292 54.230.150.30 -> 172.31.29.138 TCP 34818 [TCP segment of a reassembled PDU]
346   0.047320 54.230.150.30 -> 172.31.29.138 TCP 13098 [TCP segment of a reassembled PDU]
347   0.047333 172.31.29.138 -> 54.230.150.30 TCP 66 54826 > http [ACK] Seq=98 Ack=2376627 Win=1200896 Len=0 TSval=12314458 TSecr=1454756646
348   0.047441 54.230.150.30 -> 172.31.29.138 TCP 26130 [TCP segment of a reassembled PDU]
349   0.047452 172.31.29.138 -> 54.230.150.30 TCP 66 54826 > http [ACK] Seq=98 Ack=2402691 Win=1236736 Len=0 TSval=12314458 TSecr=1454756646
