[Measurement for 10mb at 22:36:25 19.36.2014] 
Tshark:

  1   0.000000 172.31.29.138 -> 172.31.0.2   DNS 89 Standard query 0x1162  A d1xvcg6dfvgaki.cloudfront.net
  2   0.000029 172.31.29.138 -> 172.31.0.2   DNS 89 Standard query 0xdcd2  AAAA d1xvcg6dfvgaki.cloudfront.net
  3   0.000439   172.31.0.2 -> 172.31.29.138 DNS 170 Standard query response 0xdcd2 
  4   0.000450   172.31.0.2 -> 172.31.29.138 DNS 217 Standard query response 0x1162  A 54.230.159.153 A 54.192.157.144 A 54.230.156.193 A 54.230.158.139 A 54.230.158.182 A 54.230.158.223 A 54.230.159.4 A 54.230.159.7
  5   0.003863 172.31.29.138 -> 54.230.159.153 TCP 74 58541 > http [SYN] Seq=0 Win=26883 Len=0 MSS=8961 SACK_PERM=1 TSval=5114566 TSecr=0 WS=128
  6   0.004498 54.230.159.153 -> 172.31.29.138 TCP 74 http > 58541 [SYN, ACK] Seq=0 Ack=1 Win=14480 Len=0 MSS=1460 SACK_PERM=1 TSval=832079725 TSecr=5114566 WS=128
  7   0.004513 172.31.29.138 -> 54.230.159.153 TCP 66 58541 > http [ACK] Seq=1 Ack=1 Win=27008 Len=0 TSval=5114566 TSecr=832079725
  8   0.004554 172.31.29.138 -> 54.230.159.153 HTTP 163 GET /10mb HTTP/1.1 
  9   0.005252 54.230.159.153 -> 172.31.29.138 TCP 66 http > 58541 [ACK] Seq=1 Ack=98 Win=14592 Len=0 TSval=832079725 TSecr=5114566
 10   0.007373 54.230.159.153 -> 172.31.29.138 TCP 14546 [TCP segment of a reassembled PDU]
 11   0.007386 172.31.29.138 -> 54.230.159.153 TCP 66 58541 > http [ACK] Seq=98 Ack=14481 Win=55936 Len=0 TSval=5114567 TSecr=832079726
 12   0.008258 54.230.159.153 -> 172.31.29.138 TCP 13098 [TCP segment of a reassembled PDU]
 13   0.008268 172.31.29.138 -> 54.230.159.153 TCP 66 58541 > http [ACK] Seq=98 Ack=27513 Win=81920 Len=0 TSval=5114567 TSecr=832079726
 14   0.009003 54.230.159.153 -> 172.31.29.138 TCP 13098 [TCP segment of a reassembled PDU]
 15   0.009013 172.31.29.138 -> 54.230.159.153 TCP 66 58541 > http [ACK] Seq=98 Ack=40545 Win=96512 Len=0 TSval=5114567 TSecr=832079726
 16   0.009804 54.230.159.153 -> 172.31.29.138 TCP 13098 [TCP segment of a reassembled PDU]
 17   0.009813 172.31.29.138 -> 54.230.159.153 TCP 66 58541 > http [ACK] Seq=98 Ack=53577 Win=96512 Len=0 TSval=5114567 TSecr=832079726
 18   0.010847 54.230.159.153 -> 172.31.29.138 TCP 15994 [TCP segment of a reassembled PDU]
 19   0.010860 172.31.29.138 -> 54.230.159.153 TCP 66 58541 > http [ACK] Seq=98 Ack=69505 Win=91648 Len=0 TSval=5114568 TSecr=832079726
 20   0.010891 54.230.159.153 -> 172.31.29.138 TCP 4410 [TCP segment of a reassembled PDU]
 21   0.010897 172.31.29.138 -> 54.230.159.153 TCP 66 58541 > http [ACK] Seq=98 Ack=73849 Win=87424 Len=0 TSval=5114568 TSecr=832079726
 22   0.011651 54.230.159.153 -> 172.31.29.138 TCP 5858 [TCP segment of a reassembled PDU]
 23   0.011657 172.31.29.138 -> 54.230.159.153 TCP 66 58541 > http [ACK] Seq=98 Ack=79641 Win=119680 Len=0 TSval=5114568 TSecr=832079726
 24   0.011692 54.230.159.153 -> 172.31.29.138 TCP 11650 [TCP segment of a reassembled PDU]
 25   0.011700 172.31.29.138 -> 54.230.159.153 TCP 66 58541 > http [ACK] Seq=98 Ack=91225 Win=142848 Len=0 TSval=5114568 TSecr=832079726
 26   0.012401 54.230.159.153 -> 172.31.29.138 TCP 2962 [TCP segment of a reassembled PDU]
 27   0.012416 172.31.29.138 -> 54.230.159.153 TCP 66 58541 > http [ACK] Seq=98 Ack=94121 Win=148608 Len=0 TSval=5114568 TSecr=832079726
 28   0.012542 54.230.159.153 -> 172.31.29.138 TCP 23234 [TCP segment of a reassembled PDU]
 29   0.012555 172.31.29.138 -> 54.230.159.153 TCP 66 58541 > http [ACK] Seq=98 Ack=117289 Win=194944 Len=0 TSval=5114568 TSecr=832079726
 30   0.013158 54.230.159.153 -> 172.31.29.138 TCP 8754 [TCP segment of a reassembled PDU]
 31   0.013165 172.31.29.138 -> 54.230.159.153 TCP 66 58541 > http [ACK] Seq=98 Ack=125977 Win=212352 Len=0 TSval=5114568 TSecr=832079726
 32   0.013255 54.230.159.153 -> 172.31.29.138 TCP 8754 [TCP segment of a reassembled PDU]
 33   0.013261 172.31.29.138 -> 54.230.159.153 TCP 66 58541 > http [ACK] Seq=98 Ack=134665 Win=229632 Len=0 TSval=5114568 TSecr=832079726
 34   0.013332 54.230.159.153 -> 172.31.29.138 TCP 11650 [TCP segment of a reassembled PDU]
 35   0.013339 172.31.29.138 -> 54.230.159.153 TCP 66 58541 > http [ACK] Seq=98 Ack=146249 Win=252800 Len=0 TSval=5114568 TSecr=832079726
 36   0.013947 54.230.159.153 -> 172.31.29.138 TCP 14546 [TCP segment of a reassembled PDU]
 37   0.013957 172.31.29.138 -> 54.230.159.153 TCP 66 58541 > http [ACK] Seq=98 Ack=160729 Win=281856 Len=0 TSval=5114568 TSecr=832079726
 38   0.014070 54.230.159.153 -> 172.31.29.138 TCP 18890 [TCP segment of a reassembled PDU]
 39   0.014081 172.31.29.138 -> 54.230.159.153 TCP 66 58541 > http [ACK] Seq=98 Ack=179553 Win=319488 Len=0 TSval=5114568 TSecr=832079726
 40   0.014706 54.230.159.153 -> 172.31.29.138 TCP 2962 [TCP segment of a reassembled PDU]
 41   0.014712 172.31.29.138 -> 54.230.159.153 TCP 66 58541 > http [ACK] Seq=98 Ack=182449 Win=325248 Len=0 TSval=5114569 TSecr=832079726
 42   0.014830 54.230.159.153 -> 172.31.29.138 TCP 7306 [TCP segment of a reassembled PDU]
 43   0.014837 172.31.29.138 -> 54.230.159.153 TCP 66 58541 > http [ACK] Seq=98 Ack=189689 Win=339712 Len=0 TSval=5114569 TSecr=832079726
 44   0.014930 54.230.159.153 -> 172.31.29.138 TCP 18890 [TCP segment of a reassembled PDU]
 45   0.014941 172.31.29.138 -> 54.230.159.153 TCP 66 58541 > http [ACK] Seq=98 Ack=208513 Win=377344 Len=0 TSval=5114569 TSecr=832079726
 46   0.014960 54.230.159.153 -> 172.31.29.138 TCP 7306 [TCP segment of a reassembled PDU]
 47   0.014965 172.31.29.138 -> 54.230.159.153 TCP 66 58541 > http [ACK] Seq=98 Ack=215753 Win=391808 Len=0 TSval=5114569 TSecr=832079726
 48   0.015473 54.230.159.153 -> 172.31.29.138 TCP 1514 [TCP segment of a reassembled PDU]
 49   0.015478 172.31.29.138 -> 54.230.159.153 TCP 66 58541 > http [ACK] Seq=98 Ack=217201 Win=394752 Len=0 TSval=5114569 TSecr=832079726
 50   0.015767 54.230.159.153 -> 172.31.29.138 TCP 14546 [TCP segment of a reassembled PDU]
 51   0.015777 172.31.29.138 -> 54.230.159.153 TCP 66 58541 > http [ACK] Seq=98 Ack=231681 Win=423680 Len=0 TSval=5114569 TSecr=832079726
 52   0.015860 54.230.159.153 -> 172.31.29.138 TCP 17442 [TCP segment of a reassembled PDU]
 53   0.015870 172.31.29.138 -> 54.230.159.153 TCP 66 58541 > http [ACK] Seq=98 Ack=249057 Win=458496 Len=0 TSval=5114569 TSecr=832079726
 54   0.016516 54.230.159.153 -> 172.31.29.138 TCP 5858 [TCP segment of a reassembled PDU]
 55   0.016523 172.31.29.138 -> 54.230.159.153 TCP 66 58541 > http [ACK] Seq=98 Ack=254849 Win=470016 Len=0 TSval=5114569 TSecr=832079727
 56   0.016662 54.230.159.153 -> 172.31.29.138 TCP 26130 [TCP segment of a reassembled PDU]
 57   0.016676 172.31.29.138 -> 54.230.159.153 TCP 66 58541 > http [ACK] Seq=98 Ack=280913 Win=522112 Len=0 TSval=5114569 TSecr=832079727
 58   0.016704 54.230.159.153 -> 172.31.29.138 TCP 14546 [TCP segment of a reassembled PDU]
 59   0.016713 172.31.29.138 -> 54.230.159.153 TCP 66 58541 > http [ACK] Seq=98 Ack=295393 Win=551168 Len=0 TSval=5114569 TSecr=832079727
 60   0.017339 54.230.159.153 -> 172.31.29.138 TCP 14546 [TCP segment of a reassembled PDU]
 61   0.017349 172.31.29.138 -> 54.230.159.153 TCP 66 58541 > http [ACK] Seq=98 Ack=309873 Win=580096 Len=0 TSval=5114569 TSecr=832079727
 62   0.017468 54.230.159.153 -> 172.31.29.138 TCP 20338 [TCP segment of a reassembled PDU]
 63   0.017480 172.31.29.138 -> 54.230.159.153 TCP 66 58541 > http [ACK] Seq=98 Ack=330145 Win=620672 Len=0 TSval=5114569 TSecr=832079727
 64   0.018188 54.230.159.153 -> 172.31.29.138 TCP 18890 [TCP segment of a reassembled PDU]
 65   0.018199 172.31.29.138 -> 54.230.159.153 TCP 66 58541 > http [ACK] Seq=98 Ack=348969 Win=658304 Len=0 TSval=5114569 TSecr=832079727
 66   0.018271 54.230.159.153 -> 172.31.29.138 TCP 11650 [TCP segment of a reassembled PDU]
 67   0.018280 172.31.29.138 -> 54.230.159.153 TCP 66 58541 > http [ACK] Seq=98 Ack=360553 Win=681472 Len=0 TSval=5114569 TSecr=832079727
 68   0.018386 54.230.159.153 -> 172.31.29.138 TCP 23234 [TCP segment of a reassembled PDU]
 69   0.018398 172.31.29.138 -> 54.230.159.153 TCP 66 58541 > http [ACK] Seq=98 Ack=383721 Win=700800 Len=0 TSval=5114570 TSecr=832079727
 70   0.018888 54.230.159.153 -> 172.31.29.138 TCP 5858 [TCP segment of a reassembled PDU]
 71   0.018895 172.31.29.138 -> 54.230.159.153 TCP 66 58541 > http [ACK] Seq=98 Ack=389513 Win=739328 Len=0 TSval=5114570 TSecr=832079727
 72   0.019069 54.230.159.153 -> 172.31.29.138 TCP 14546 [TCP segment of a reassembled PDU]
 73   0.019078 172.31.29.138 -> 54.230.159.153 TCP 66 58541 > http [ACK] Seq=98 Ack=403993 Win=768384 Len=0 TSval=5114570 TSecr=832079727
 74   0.019193 54.230.159.153 -> 172.31.29.138 TCP 18890 [TCP segment of a reassembled PDU]
 75   0.019205 172.31.29.138 -> 54.230.159.153 TCP 66 58541 > http [ACK] Seq=98 Ack=422817 Win=806016 Len=0 TSval=5114570 TSecr=832079727
 76   0.019221 54.230.159.153 -> 172.31.29.138 TCP 2962 [TCP segment of a reassembled PDU]
 77   0.019225 172.31.29.138 -> 54.230.159.153 TCP 66 58541 > http [ACK] Seq=98 Ack=425713 Win=811776 Len=0 TSval=5114570 TSecr=832079727
 78   0.019442 54.230.159.153 -> 172.31.29.138 TCP 2962 [TCP segment of a reassembled PDU]
 79   0.019447 172.31.29.138 -> 54.230.159.153 TCP 66 58541 > http [ACK] Seq=98 Ack=428609 Win=817536 Len=0 TSval=5114570 TSecr=832079727
 80   0.019596 54.230.159.153 -> 172.31.29.138 TCP 11650 [TCP segment of a reassembled PDU]
 81   0.019605 172.31.29.138 -> 54.230.159.153 TCP 66 58541 > http [ACK] Seq=98 Ack=440193 Win=840704 Len=0 TSval=5114570 TSecr=832079727
 82   0.019736 54.230.159.153 -> 172.31.29.138 TCP 23234 [TCP segment of a reassembled PDU]
 83   0.019749 172.31.29.138 -> 54.230.159.153 TCP 66 58541 > http [ACK] Seq=98 Ack=463361 Win=887040 Len=0 TSval=5114570 TSecr=832079727
 84   0.019880 54.230.159.153 -> 172.31.29.138 TCP 21786 [TCP segment of a reassembled PDU]
 85   0.019892 172.31.29.138 -> 54.230.159.153 TCP 66 58541 > http [ACK] Seq=98 Ack=485081 Win=930560 Len=0 TSval=5114570 TSecr=832079727
 86   0.019919 54.230.159.153 -> 172.31.29.138 TCP 5858 [TCP segment of a reassembled PDU]
 87   0.019924 172.31.29.138 -> 54.230.159.153 TCP 66 58541 > http [ACK] Seq=98 Ack=490873 Win=942080 Len=0 TSval=5114570 TSecr=832079727
 88   0.020162 54.230.159.153 -> 172.31.29.138 TCP 2962 [TCP segment of a reassembled PDU]
 89   0.020168 172.31.29.138 -> 54.230.159.153 TCP 66 58541 > http [ACK] Seq=98 Ack=493769 Win=947840 Len=0 TSval=5114570 TSecr=832079727
 90   0.020371 54.230.159.153 -> 172.31.29.138 TCP 26130 [TCP segment of a reassembled PDU]
 91   0.020385 172.31.29.138 -> 54.230.159.153 TCP 66 58541 > http [ACK] Seq=98 Ack=519833 Win=1000064 Len=0 TSval=5114570 TSecr=832079727
 92   0.020417 54.230.159.153 -> 172.31.29.138 TCP 11650 [TCP segment of a reassembled PDU]
 93   0.020425 172.31.29.138 -> 54.230.159.153 TCP 66 58541 > http [ACK] Seq=98 Ack=531417 Win=1001344 Len=0 TSval=5114570 TSecr=832079727
 94   0.020530 54.230.159.153 -> 172.31.29.138 TCP 21786 [TCP segment of a reassembled PDU]
 95   0.020542 172.31.29.138 -> 54.230.159.153 TCP 66 58541 > http [ACK] Seq=98 Ack=553137 Win=1027584 Len=0 TSval=5114570 TSecr=832079727
 96   0.020599 54.230.159.153 -> 172.31.29.138 TCP 2962 [TCP segment of a reassembled PDU]
 97   0.020604 172.31.29.138 -> 54.230.159.153 TCP 66 58541 > http [ACK] Seq=98 Ack=556033 Win=1058432 Len=0 TSval=5114570 TSecr=832079727
 98   0.021017 54.230.159.153 -> 172.31.29.138 TCP 20338 [TCP segment of a reassembled PDU]
 99   0.021028 172.31.29.138 -> 54.230.159.153 TCP 66 58541 > http [ACK] Seq=98 Ack=576305 Win=1038208 Len=0 TSval=5114570 TSecr=832079727
100   0.021148 54.230.159.153 -> 172.31.29.138 TCP 17442 [TCP segment of a reassembled PDU]
101   0.021158 172.31.29.138 -> 54.230.159.153 TCP 66 58541 > http [ACK] Seq=98 Ack=593681 Win=1034624 Len=0 TSval=5114570 TSecr=832079727
102   0.021179 54.230.159.153 -> 172.31.29.138 TCP 8754 [TCP segment of a reassembled PDU]
103   0.021184 172.31.29.138 -> 54.230.159.153 TCP 66 58541 > http [ACK] Seq=98 Ack=602369 Win=1026048 Len=0 TSval=5114570 TSecr=832079727
104   0.021236 54.230.159.153 -> 172.31.29.138 TCP 18890 [TCP segment of a reassembled PDU]
105   0.021245 172.31.29.138 -> 54.230.159.153 TCP 66 58541 > http [ACK] Seq=98 Ack=621193 Win=1032320 Len=0 TSval=5114570 TSecr=832079727
106   0.021555 54.230.159.153 -> 172.31.29.138 TCP 26130 [TCP segment of a reassembled PDU]
107   0.021581 172.31.29.138 -> 54.230.159.153 TCP 66 58541 > http [ACK] Seq=98 Ack=647257 Win=1020416 Len=0 TSval=5114570 TSecr=832079727
108   0.021620 54.230.159.153 -> 172.31.29.138 TCP 8754 [TCP segment of a reassembled PDU]
109   0.021627 172.31.29.138 -> 54.230.159.153 TCP 66 58541 > http [ACK] Seq=98 Ack=655945 Win=1048960 Len=0 TSval=5114570 TSecr=832079727
110   0.021751 54.230.159.153 -> 172.31.29.138 TCP 10202 [TCP segment of a reassembled PDU]
111   0.021769 172.31.29.138 -> 54.230.159.153 TCP 66 58541 > http [ACK] Seq=98 Ack=666081 Win=1063296 Len=0 TSval=5114570 TSecr=832079727
112   0.021920 54.230.159.153 -> 172.31.29.138 TCP 20338 [TCP segment of a reassembled PDU]
113   0.021943 172.31.29.138 -> 54.230.159.153 TCP 66 58541 > http [ACK] Seq=98 Ack=686353 Win=1043072 Len=0 TSval=5114570 TSecr=832079727
114   0.022313 54.230.159.153 -> 172.31.29.138 TCP 23234 [TCP segment of a reassembled PDU]
115   0.022338 172.31.29.138 -> 54.230.159.153 TCP 66 58541 > http [ACK] Seq=98 Ack=709521 Win=1064320 Len=0 TSval=5114571 TSecr=832079727
116   0.022366 54.230.159.153 -> 172.31.29.138 TCP 2962 [TCP segment of a reassembled PDU]
117   0.022370 172.31.29.138 -> 54.230.159.153 TCP 66 58541 > http [ACK] Seq=98 Ack=712417 Win=1070208 Len=0 TSval=5114571 TSecr=832079727
118   0.022442 54.230.159.153 -> 172.31.29.138 TCP 26130 [TCP segment of a reassembled PDU]
119   0.022455 172.31.29.138 -> 54.230.159.153 TCP 66 58541 > http [ACK] Seq=98 Ack=738481 Win=1122304 Len=0 TSval=5114571 TSecr=832079727
120   0.022462 54.230.159.153 -> 172.31.29.138 TCP 1514 [TCP segment of a reassembled PDU]
121   0.022464 172.31.29.138 -> 54.230.159.153 TCP 66 58541 > http [ACK] Seq=98 Ack=739929 Win=1125248 Len=0 TSval=5114571 TSecr=832079727
122   0.022478 54.230.159.153 -> 172.31.29.138 TCP 11650 [TCP segment of a reassembled PDU]
123   0.022484 172.31.29.138 -> 54.230.159.153 TCP 66 58541 > http [ACK] Seq=98 Ack=751513 Win=1148416 Len=0 TSval=5114571 TSecr=832079727
124   0.023261 54.230.159.153 -> 172.31.29.138 TCP 5858 [TCP segment of a reassembled PDU]
125   0.023268 172.31.29.138 -> 54.230.159.153 TCP 66 58541 > http [ACK] Seq=98 Ack=757305 Win=1159936 Len=0 TSval=5114571 TSecr=832079727
126   0.023432 54.230.159.153 -> 172.31.29.138 TCP 26130 [TCP segment of a reassembled PDU]
127   0.023446 172.31.29.138 -> 54.230.159.153 TCP 66 58541 > http [ACK] Seq=98 Ack=783369 Win=1212032 Len=0 TSval=5114571 TSecr=832079727
128   0.023531 54.230.159.153 -> 172.31.29.138 TCP 26130 [TCP segment of a reassembled PDU]
129   0.023544 172.31.29.138 -> 54.230.159.153 TCP 66 58541 > http [ACK] Seq=98 Ack=809433 Win=1264256 Len=0 TSval=5114571 TSecr=832079727
130   0.023555 54.230.159.153 -> 172.31.29.138 TCP 7306 [TCP segment of a reassembled PDU]
131   0.023559 172.31.29.138 -> 54.230.159.153 TCP 66 58541 > http [ACK] Seq=98 Ack=816673 Win=1278720 Len=0 TSval=5114571 TSecr=832079727
132   0.023921 54.230.159.153 -> 172.31.29.138 TCP 26130 [TCP segment of a reassembled PDU]
133   0.023934 172.31.29.138 -> 54.230.159.153 TCP 66 58541 > http [ACK] Seq=98 Ack=842737 Win=1330816 Len=0 TSval=5114571 TSecr=832079727
134   0.023949 54.230.159.153 -> 172.31.29.138 TCP 13098 [TCP segment of a reassembled PDU]
135   0.023959 172.31.29.138 -> 54.230.159.153 TCP 66 58541 > http [ACK] Seq=98 Ack=855769 Win=1356928 Len=0 TSval=5114571 TSecr=832079727
136   0.024013 54.230.159.153 -> 172.31.29.138 TCP 2962 [TCP segment of a reassembled PDU]
137   0.024018 172.31.29.138 -> 54.230.159.153 TCP 66 58541 > http [ACK] Seq=98 Ack=858665 Win=1362688 Len=0 TSval=5114571 TSecr=832079727
138   0.024194 54.230.159.153 -> 172.31.29.138 TCP 23234 [TCP segment of a reassembled PDU]
139   0.024205 172.31.29.138 -> 54.230.159.153 TCP 66 58541 > http [ACK] Seq=98 Ack=881833 Win=1409024 Len=0 TSval=5114571 TSecr=832079727
140   0.024280 54.230.159.153 -> 172.31.29.138 TCP 26130 [TCP segment of a reassembled PDU]
141   0.024307 172.31.29.138 -> 54.230.159.153 TCP 66 58541 > http [ACK] Seq=98 Ack=907897 Win=1461120 Len=0 TSval=5114571 TSecr=832079727
142   0.024322 54.230.159.153 -> 172.31.29.138 TCP 11650 [TCP segment of a reassembled PDU]
143   0.024328 172.31.29.138 -> 54.230.159.153 TCP 66 58541 > http [ACK] Seq=98 Ack=919481 Win=1484288 Len=0 TSval=5114571 TSecr=832079727
144   0.024673 54.230.159.153 -> 172.31.29.138 TCP 27578 [TCP segment of a reassembled PDU]
145   0.024688 172.31.29.138 -> 54.230.159.153 TCP 66 58541 > http [ACK] Seq=98 Ack=946993 Win=1539328 Len=0 TSval=5114571 TSecr=832079727
146   0.024911 54.230.159.153 -> 172.31.29.138 TCP 10202 [TCP segment of a reassembled PDU]
147   0.024920 172.31.29.138 -> 54.230.159.153 TCP 66 58541 > http [ACK] Seq=98 Ack=957129 Win=1559552 Len=0 TSval=5114571 TSecr=832079727
148   0.025064 54.230.159.153 -> 172.31.29.138 TCP 26130 [TCP segment of a reassembled PDU]
149   0.025090 172.31.29.138 -> 54.230.159.153 TCP 66 58541 > http [ACK] Seq=98 Ack=983193 Win=1552000 Len=0 TSval=5114571 TSecr=832079727
150   0.025141 54.230.159.153 -> 172.31.29.138 TCP 26130 [TCP segment of a reassembled PDU]
151   0.025155 172.31.29.138 -> 54.230.159.153 TCP 66 58541 > http [ACK] Seq=98 Ack=1009257 Win=1552000 Len=0 TSval=5114571 TSecr=832079727
152   0.025163 54.230.159.153 -> 172.31.29.138 TCP 2962 [TCP segment of a reassembled PDU]
153   0.025182 172.31.29.138 -> 54.230.159.153 TCP 66 58541 > http [ACK] Seq=98 Ack=1012153 Win=1549184 Len=0 TSval=5114571 TSecr=832079727
154   0.025319 54.230.159.153 -> 172.31.29.138 TCP 1514 [TCP segment of a reassembled PDU]
155   0.025323 172.31.29.138 -> 54.230.159.153 TCP 66 58541 > http [ACK] Seq=98 Ack=1013601 Win=1562496 Len=0 TSval=5114571 TSecr=832079727
156   0.025517 54.230.159.153 -> 172.31.29.138 TCP 26130 [TCP segment of a reassembled PDU]
157   0.025542 172.31.29.138 -> 54.230.159.153 TCP 66 58541 > http [ACK] Seq=98 Ack=1039665 Win=1552000 Len=0 TSval=5114571 TSecr=832079727
158   0.025574 54.230.159.153 -> 172.31.29.138 TCP 20338 [TCP segment of a reassembled PDU]
159   0.025584 172.31.29.138 -> 54.230.159.153 TCP 66 58541 > http [ACK] Seq=98 Ack=1059937 Win=1561472 Len=0 TSval=5114571 TSecr=832079727
160   0.025616 54.230.159.153 -> 172.31.29.138 TCP 11650 [TCP segment of a reassembled PDU]
161   0.025622 172.31.29.138 -> 54.230.159.153 TCP 66 58541 > http [ACK] Seq=98 Ack=1071521 Win=1575808 Len=0 TSval=5114571 TSecr=832079727
162   0.025781 54.230.159.153 -> 172.31.29.138 TCP 26130 [TCP segment of a reassembled PDU]
163   0.025802 172.31.29.138 -> 54.230.159.153 TCP 66 58541 > http [ACK] Seq=98 Ack=1097585 Win=1552000 Len=0 TSval=5114571 TSecr=832079727
164   0.025861 54.230.159.153 -> 172.31.29.138 TCP 24682 [TCP segment of a reassembled PDU]
165   0.025875 172.31.29.138 -> 54.230.159.153 TCP 66 58541 > http [ACK] Seq=98 Ack=1122201 Win=1554432 Len=0 TSval=5114571 TSecr=832079727
166   0.025881 54.230.159.153 -> 172.31.29.138 TCP 1514 [TCP segment of a reassembled PDU]
167   0.025895 54.230.159.153 -> 172.31.29.138 TCP 2962 [TCP segment of a reassembled PDU]
168   0.025904 172.31.29.138 -> 54.230.159.153 TCP 66 58541 > http [ACK] Seq=98 Ack=1126545 Win=1550208 Len=0 TSval=5114571 TSecr=832079727
169   0.026209 54.230.159.153 -> 172.31.29.138 TCP 26130 [TCP segment of a reassembled PDU]
170   0.026223 172.31.29.138 -> 54.230.159.153 TCP 66 58541 > http [ACK] Seq=98 Ack=1152609 Win=1552000 Len=0 TSval=5114571 TSecr=832079728
171   0.026299 54.230.159.153 -> 172.31.29.138 TCP 26130 [TCP segment of a reassembled PDU]
172   0.026313 172.31.29.138 -> 54.230.159.153 TCP 66 58541 > http [ACK] Seq=98 Ack=1178673 Win=1552000 Len=0 TSval=5114571 TSecr=832079728
173   0.026342 54.230.159.153 -> 172.31.29.138 TCP 13098 [TCP segment of a reassembled PDU]
174   0.026366 54.230.159.153 -> 172.31.29.138 TCP 4410 [TCP segment of a reassembled PDU]
175   0.026373 172.31.29.138 -> 54.230.159.153 TCP 66 58541 > http [ACK] Seq=98 Ack=1196049 Win=1550464 Len=0 TSval=5114572 TSecr=832079728
176   0.026394 54.230.159.153 -> 172.31.29.138 TCP 5858 [TCP segment of a reassembled PDU]
177   0.026402 172.31.29.138 -> 54.230.159.153 TCP 66 58541 > http [ACK] Seq=98 Ack=1201841 Win=1583872 Len=0 TSval=5114572 TSecr=832079728
178   0.026608 54.230.159.153 -> 172.31.29.138 TCP 2962 [TCP segment of a reassembled PDU]
179   0.026615 172.31.29.138 -> 54.230.159.153 TCP 66 58541 > http [ACK] Seq=98 Ack=1204737 Win=1585664 Len=0 TSval=5114572 TSecr=832079728
180   0.026721 54.230.159.153 -> 172.31.29.138 TCP 2962 [TCP segment of a reassembled PDU]
181   0.026726 172.31.29.138 -> 54.230.159.153 TCP 66 58541 > http [ACK] Seq=98 Ack=1207633 Win=1585664 Len=0 TSval=5114572 TSecr=832079728
182   0.026838 54.230.159.153 -> 172.31.29.138 TCP 26130 [TCP segment of a reassembled PDU]
183   0.026864 172.31.29.138 -> 54.230.159.153 TCP 66 58541 > http [ACK] Seq=98 Ack=1233697 Win=1579136 Len=0 TSval=5114572 TSecr=832079728
184   0.026918 54.230.159.153 -> 172.31.29.138 TCP 23234 [TCP segment of a reassembled PDU]
185   0.026930 172.31.29.138 -> 54.230.159.153 TCP 66 58541 > http [ACK] Seq=98 Ack=1256865 Win=1583872 Len=0 TSval=5114572 TSecr=832079728
186   0.026984 54.230.159.153 -> 172.31.29.138 TCP 15994 [TCP segment of a reassembled PDU]
187   0.026993 172.31.29.138 -> 54.230.159.153 TCP 66 58541 > http [ACK] Seq=98 Ack=1272793 Win=1585664 Len=0 TSval=5114572 TSecr=832079728
188   0.027097 54.230.159.153 -> 172.31.29.138 TCP 23234 [TCP segment of a reassembled PDU]
189   0.027112 54.230.159.153 -> 172.31.29.138 TCP 2962 [TCP segment of a reassembled PDU]
190   0.027127 172.31.29.138 -> 54.230.159.153 TCP 66 58541 > http [ACK] Seq=98 Ack=1298857 Win=1579008 Len=0 TSval=5114572 TSecr=832079728
191   0.027189 54.230.159.153 -> 172.31.29.138 TCP 26130 [TCP segment of a reassembled PDU]
192   0.027201 172.31.29.138 -> 54.230.159.153 TCP 66 58541 > http [ACK] Seq=98 Ack=1324921 Win=1579136 Len=0 TSval=5114572 TSecr=832079728
193   0.027229 54.230.159.153 -> 172.31.29.138 TCP 13098 [TCP segment of a reassembled PDU]
194   0.027380 172.31.29.138 -> 54.230.159.153 TCP 66 58541 > http [ACK] Seq=98 Ack=1337953 Win=1566208 Len=0 TSval=5114572 TSecr=832079728
195   0.027711 54.230.159.153 -> 172.31.29.138 TCP 11650 [TCP segment of a reassembled PDU]
196   0.027720 172.31.29.138 -> 54.230.159.153 TCP 66 58541 > http [ACK] Seq=98 Ack=1349537 Win=1585664 Len=0 TSval=5114572 TSecr=832079728
197   0.027872 54.230.159.153 -> 172.31.29.138 TCP 26130 [TCP segment of a reassembled PDU]
198   0.027897 172.31.29.138 -> 54.230.159.153 TCP 66 58541 > http [ACK] Seq=98 Ack=1375601 Win=1579136 Len=0 TSval=5114572 TSecr=832079728
199   0.027939 54.230.159.153 -> 172.31.29.138 TCP 26130 [TCP segment of a reassembled PDU]
200   0.027952 172.31.29.138 -> 54.230.159.153 TCP 66 58541 > http [ACK] Seq=98 Ack=1401665 Win=1579136 Len=0 TSval=5114572 TSecr=832079728
201   0.028006 54.230.159.153 -> 172.31.29.138 TCP 26130 [TCP segment of a reassembled PDU]
202   0.028019 172.31.29.138 -> 54.230.159.153 TCP 66 58541 > http [ACK] Seq=98 Ack=1427729 Win=1579136 Len=0 TSval=5114572 TSecr=832079728
203   0.028085 54.230.159.153 -> 172.31.29.138 TCP 26130 [TCP segment of a reassembled PDU]
204   0.028101 172.31.29.138 -> 54.230.159.153 TCP 66 58541 > http [ACK] Seq=98 Ack=1453793 Win=1579136 Len=0 TSval=5114572 TSecr=832079728
205   0.028125 54.230.159.153 -> 172.31.29.138 TCP 14546 [TCP segment of a reassembled PDU]
206   0.028261 172.31.29.138 -> 54.230.159.153 TCP 66 58541 > http [ACK] Seq=98 Ack=1468273 Win=1564672 Len=0 TSval=5114572 TSecr=832079728
207   0.028594 54.230.159.153 -> 172.31.29.138 TCP 26130 [TCP segment of a reassembled PDU]
208   0.028607 172.31.29.138 -> 54.230.159.153 TCP 66 58541 > http [ACK] Seq=98 Ack=1494337 Win=1579136 Len=0 TSval=5114572 TSecr=832079728
209   0.028661 54.230.159.153 -> 172.31.29.138 TCP 21786 [TCP segment of a reassembled PDU]
210   0.028673 172.31.29.138 -> 54.230.159.153 TCP 66 58541 > http [ACK] Seq=98 Ack=1516057 Win=1585664 Len=0 TSval=5114572 TSecr=832079728
211   0.028680 54.230.159.153 -> 172.31.29.138 TCP 4410 [TCP segment of a reassembled PDU]
212   0.028695 172.31.29.138 -> 54.230.159.153 TCP 66 58541 > http [ACK] Seq=98 Ack=1520401 Win=1581440 Len=0 TSval=5114572 TSecr=832079728
213   0.028724 54.230.159.153 -> 172.31.29.138 TCP 13098 [TCP segment of a reassembled PDU]
214   0.028738 172.31.29.138 -> 54.230.159.153 TCP 66 58541 > http [ACK] Seq=98 Ack=1533433 Win=1585664 Len=0 TSval=5114572 TSecr=832079728
215   0.028800 54.230.159.153 -> 172.31.29.138 TCP 18890 [TCP segment of a reassembled PDU]
216   0.028810 172.31.29.138 -> 54.230.159.153 TCP 66 58541 > http [ACK] Seq=98 Ack=1552257 Win=1585664 Len=0 TSval=5114572 TSecr=832079728
217   0.028925 54.230.159.153 -> 172.31.29.138 TCP 26130 [TCP segment of a reassembled PDU]
218   0.028994 54.230.159.153 -> 172.31.29.138 TCP 20338 [TCP segment of a reassembled PDU]
219   0.029035 172.31.29.138 -> 54.230.159.153 TCP 66 58541 > http [ACK] Seq=98 Ack=1598593 Win=1539328 Len=0 TSval=5114572 TSecr=832079728
220   0.029413 54.230.159.153 -> 172.31.29.138 TCP 26130 [TCP segment of a reassembled PDU]
221   0.029427 172.31.29.138 -> 54.230.159.153 TCP 66 58541 > http [ACK] Seq=98 Ack=1624657 Win=1579136 Len=0 TSval=5114572 TSecr=832079728
222   0.029460 54.230.159.153 -> 172.31.29.138 TCP 15994 [TCP segment of a reassembled PDU]
223   0.029478 172.31.29.138 -> 54.230.159.153 TCP 66 58541 > http [ACK] Seq=98 Ack=1640585 Win=1585664 Len=0 TSval=5114572 TSecr=832079728
224   0.029549 54.230.159.153 -> 172.31.29.138 TCP 23234 [TCP segment of a reassembled PDU]
225   0.029573 172.31.29.138 -> 54.230.159.153 TCP 66 58541 > http [ACK] Seq=98 Ack=1663753 Win=1583872 Len=0 TSval=5114572 TSecr=832079728
226   0.029867 54.230.159.153 -> 172.31.29.138 TCP 23234 [TCP segment of a reassembled PDU]
227   0.029881 172.31.29.138 -> 54.230.159.153 TCP 66 58541 > http [ACK] Seq=98 Ack=1686921 Win=1583872 Len=0 TSval=5114572 TSecr=832079728
228   0.029909 54.230.159.153 -> 172.31.29.138 TCP 2962 [TCP segment of a reassembled PDU]
229   0.029920 172.31.29.138 -> 54.230.159.153 TCP 66 58541 > http [ACK] Seq=98 Ack=1689817 Win=1585664 Len=0 TSval=5114572 TSecr=832079728
230   0.030035 54.230.159.153 -> 172.31.29.138 TCP 39162 [TCP segment of a reassembled PDU]
231   0.030066 172.31.29.138 -> 54.230.159.153 TCP 66 58541 > http [ACK] Seq=98 Ack=1728913 Win=1557632 Len=0 TSval=5114572 TSecr=832079728
232   0.030123 54.230.159.153 -> 172.31.29.138 TCP 20338 [TCP segment of a reassembled PDU]
233   0.030133 172.31.29.138 -> 54.230.159.153 TCP 66 58541 > http [ACK] Seq=98 Ack=1749185 Win=1585664 Len=0 TSval=5114572 TSecr=832079728
234   0.030169 54.230.159.153 -> 172.31.29.138 TCP 5858 [TCP segment of a reassembled PDU]
235   0.030176 172.31.29.138 -> 54.230.159.153 TCP 66 58541 > http [ACK] Seq=98 Ack=1754977 Win=1585664 Len=0 TSval=5114572 TSecr=832079728
236   0.030261 54.230.159.153 -> 172.31.29.138 TCP 34818 [TCP segment of a reassembled PDU]
237   0.030281 54.230.159.153 -> 172.31.29.138 TCP 4410 [TCP segment of a reassembled PDU]
238   0.030298 172.31.29.138 -> 54.230.159.153 TCP 66 58541 > http [ACK] Seq=98 Ack=1794073 Win=1557504 Len=0 TSval=5114572 TSecr=832079728
239   0.030578 54.230.159.153 -> 172.31.29.138 TCP 17442 [TCP segment of a reassembled PDU]
240   0.030589 172.31.29.138 -> 54.230.159.153 TCP 66 58541 > http [ACK] Seq=98 Ack=1811449 Win=1585664 Len=0 TSval=5114573 TSecr=832079728
241   0.030624 54.230.159.153 -> 172.31.29.138 TCP 8754 [TCP segment of a reassembled PDU]
242   0.030630 172.31.29.138 -> 54.230.159.153 TCP 66 58541 > http [ACK] Seq=98 Ack=1820137 Win=1585664 Len=0 TSval=5114573 TSecr=832079728
243   0.030722 54.230.159.153 -> 172.31.29.138 TCP 39162 [TCP segment of a reassembled PDU]
244   0.030740 172.31.29.138 -> 54.230.159.153 TCP 66 58541 > http [ACK] Seq=98 Ack=1859233 Win=1585664 Len=0 TSval=5114573 TSecr=832079728
245   0.030923 54.230.159.153 -> 172.31.29.138 TCP 26130 [TCP segment of a reassembled PDU]
246   0.030932 172.31.29.138 -> 54.230.159.153 TCP 66 58541 > http [ACK] Seq=98 Ack=1885297 Win=1585664 Len=0 TSval=5114573 TSecr=832079728
247   0.030997 54.230.159.153 -> 172.31.29.138 TCP 26130 [TCP segment of a reassembled PDU]
248   0.031006 172.31.29.138 -> 54.230.159.153 TCP 66 58541 > http [ACK] Seq=98 Ack=1911361 Win=1585664 Len=0 TSval=5114573 TSecr=832079728
249   0.031033 54.230.159.153 -> 172.31.29.138 TCP 13098 [TCP segment of a reassembled PDU]
250   0.031039 172.31.29.138 -> 54.230.159.153 TCP 66 58541 > http [ACK] Seq=98 Ack=1924393 Win=1585664 Len=0 TSval=5114573 TSecr=832079728
251   0.031386 54.230.159.153 -> 172.31.29.138 TCP 26130 [TCP segment of a reassembled PDU]
252   0.031396 172.31.29.138 -> 54.230.159.153 TCP 66 58541 > http [ACK] Seq=98 Ack=1950457 Win=1585664 Len=0 TSval=5114573 TSecr=832079728
253   0.031455 54.230.159.153 -> 172.31.29.138 TCP 23234 [TCP segment of a reassembled PDU]
254   0.031463 172.31.29.138 -> 54.230.159.153 TCP 66 58541 > http [ACK] Seq=98 Ack=1973625 Win=1585664 Len=0 TSval=5114573 TSecr=832079728
255   0.031499 54.230.159.153 -> 172.31.29.138 TCP 2962 [TCP segment of a reassembled PDU]
256   0.031503 172.31.29.138 -> 54.230.159.153 TCP 66 58541 > http [ACK] Seq=98 Ack=1976521 Win=1585664 Len=0 TSval=5114573 TSecr=832079728
257   0.031552 54.230.159.153 -> 172.31.29.138 TCP 13098 [TCP segment of a reassembled PDU]
258   0.031558 172.31.29.138 -> 54.230.159.153 TCP 66 58541 > http [ACK] Seq=98 Ack=1989553 Win=1585664 Len=0 TSval=5114573 TSecr=832079728
259   0.031703 54.230.159.153 -> 172.31.29.138 TCP 26130 [TCP segment of a reassembled PDU]
260   0.031711 172.31.29.138 -> 54.230.159.153 TCP 66 58541 > http [ACK] Seq=98 Ack=2015617 Win=1585664 Len=0 TSval=5114573 TSecr=832079728
261   0.031771 54.230.159.153 -> 172.31.29.138 TCP 20338 [TCP segment of a reassembled PDU]
262   0.031794 172.31.29.138 -> 54.230.159.153 TCP 66 58541 > http [ACK] Seq=98 Ack=2035889 Win=1585664 Len=0 TSval=5114573 TSecr=832079728
263   0.031806 54.230.159.153 -> 172.31.29.138 TCP 5858 [TCP segment of a reassembled PDU]
264   0.031809 172.31.29.138 -> 54.230.159.153 TCP 66 58541 > http [ACK] Seq=98 Ack=2041681 Win=1585664 Len=0 TSval=5114573 TSecr=832079728
265   0.031851 54.230.159.153 -> 172.31.29.138 TCP 13098 [TCP segment of a reassembled PDU]
266   0.031858 172.31.29.138 -> 54.230.159.153 TCP 66 58541 > http [ACK] Seq=98 Ack=2054713 Win=1585664 Len=0 TSval=5114573 TSecr=832079728
267   0.032121 54.230.159.153 -> 172.31.29.138 TCP 13098 [TCP segment of a reassembled PDU]
268   0.032127 172.31.29.138 -> 54.230.159.153 TCP 66 58541 > http [ACK] Seq=98 Ack=2067745 Win=1585664 Len=0 TSval=5114573 TSecr=832079728
269   0.032134 54.230.159.153 -> 172.31.29.138 TCP 1514 [TCP Previous segment not captured] [TCP segment of a reassembled PDU]
270   0.032136 172.31.29.138 -> 54.230.159.153 TCP 78 [TCP Dup ACK 268#1] 58541 > http [ACK] Seq=98 Ack=2067745 Win=1585664 Len=0 TSval=5114573 TSecr=832079728 SLE=2069193 SRE=2070641
271   0.032203 54.230.159.153 -> 172.31.29.138 TCP 1514 [TCP Out-Of-Order] [TCP segment of a reassembled PDU]
272   0.032208 172.31.29.138 -> 54.230.159.153 TCP 66 58541 > http [ACK] Seq=98 Ack=2070641 Win=1585664 Len=0 TSval=5114573 TSecr=832079728
273   0.032311 54.230.159.153 -> 172.31.29.138 TCP 26130 [TCP segment of a reassembled PDU]
274   0.032320 172.31.29.138 -> 54.230.159.153 TCP 66 58541 > http [ACK] Seq=98 Ack=2096705 Win=1585664 Len=0 TSval=5114573 TSecr=832079728
275   0.032326 54.230.159.153 -> 172.31.29.138 TCP 1514 [TCP segment of a reassembled PDU]
276   0.032328 172.31.29.138 -> 54.230.159.153 TCP 66 58541 > http [ACK] Seq=98 Ack=2098153 Win=1585664 Len=0 TSval=5114573 TSecr=832079728
277   0.032485 54.230.159.153 -> 172.31.29.138 TCP 50746 [TCP segment of a reassembled PDU]
278   0.032497 172.31.29.138 -> 54.230.159.153 TCP 66 58541 > http [ACK] Seq=98 Ack=2148833 Win=1585664 Len=0 TSval=5114573 TSecr=832079728
279   0.032510 54.230.159.153 -> 172.31.29.138 TCP 10202 [TCP segment of a reassembled PDU]
280   0.032513 172.31.29.138 -> 54.230.159.153 TCP 66 58541 > http [ACK] Seq=98 Ack=2158969 Win=1585664 Len=0 TSval=5114573 TSecr=832079728
281   0.032520 54.230.159.153 -> 172.31.29.138 TCP 7306 [TCP segment of a reassembled PDU]
282   0.032523 172.31.29.138 -> 54.230.159.153 TCP 66 58541 > http [ACK] Seq=98 Ack=2166209 Win=1585664 Len=0 TSval=5114573 TSecr=832079728
283   0.032534 54.230.159.153 -> 172.31.29.138 TCP 8754 [TCP segment of a reassembled PDU]
284   0.032536 172.31.29.138 -> 54.230.159.153 TCP 66 58541 > http [ACK] Seq=98 Ack=2174897 Win=1585664 Len=0 TSval=5114573 TSecr=832079728
285   0.032599 54.230.159.153 -> 172.31.29.138 TCP 10202 [TCP segment of a reassembled PDU]
286   0.032605 172.31.29.138 -> 54.230.159.153 TCP 66 58541 > http [ACK] Seq=98 Ack=2185033 Win=1585664 Len=0 TSval=5114573 TSecr=832079728
287   0.032692 54.230.159.153 -> 172.31.29.138 TCP 26130 [TCP segment of a reassembled PDU]
288   0.032699 172.31.29.138 -> 54.230.159.153 TCP 66 58541 > http [ACK] Seq=98 Ack=2211097 Win=1585664 Len=0 TSval=5114573 TSecr=832079728
289   0.032798 54.230.159.153 -> 172.31.29.138 TCP 39162 [TCP segment of a reassembled PDU]
290   0.032806 172.31.29.138 -> 54.230.159.153 TCP 66 58541 > http [ACK] Seq=98 Ack=2250193 Win=1585664 Len=0 TSval=5114573 TSecr=832079728
291   0.032911 54.230.159.153 -> 172.31.29.138 TCP 4410 [TCP segment of a reassembled PDU]
292   0.032915 172.31.29.138 -> 54.230.159.153 TCP 66 58541 > http [ACK] Seq=98 Ack=2254537 Win=1585664 Len=0 TSval=5114573 TSecr=832079728
293   0.033348 54.230.159.153 -> 172.31.29.138 TCP 11650 [TCP segment of a reassembled PDU]
294   0.033354 172.31.29.138 -> 54.230.159.153 TCP 66 58541 > http [ACK] Seq=98 Ack=2266121 Win=1585664 Len=0 TSval=5114573 TSecr=832079728
295   0.033503 54.230.159.153 -> 172.31.29.138 TCP 26130 [TCP segment of a reassembled PDU]
296   0.033510 172.31.29.138 -> 54.230.159.153 TCP 66 58541 > http [ACK] Seq=98 Ack=2292185 Win=1585664 Len=0 TSval=5114573 TSecr=832079728
297   0.033578 54.230.159.153 -> 172.31.29.138 TCP 26130 [TCP segment of a reassembled PDU]
298   0.033585 172.31.29.138 -> 54.230.159.153 TCP 66 58541 > http [ACK] Seq=98 Ack=2318249 Win=1585664 Len=0 TSval=5114573 TSecr=832079728
299   0.033660 54.230.159.153 -> 172.31.29.138 TCP 26130 [TCP segment of a reassembled PDU]
300   0.033667 172.31.29.138 -> 54.230.159.153 TCP 66 58541 > http [ACK] Seq=98 Ack=2344313 Win=1585664 Len=0 TSval=5114573 TSecr=832079728
301   0.033736 54.230.159.153 -> 172.31.29.138 TCP 26130 [TCP segment of a reassembled PDU]
302   0.033742 172.31.29.138 -> 54.230.159.153 TCP 66 58541 > http [ACK] Seq=98 Ack=2370377 Win=1585664 Len=0 TSval=5114573 TSecr=832079728
303   0.033811 54.230.159.153 -> 172.31.29.138 TCP 26130 [TCP segment of a reassembled PDU]
304   0.033817 172.31.29.138 -> 54.230.159.153 TCP 66 58541 > http [ACK] Seq=98 Ack=2396441 Win=1585664 Len=0 TSval=5114573 TSecr=832079728
305   0.033885 54.230.159.153 -> 172.31.29.138 TCP 26130 [TCP segment of a reassembled PDU]
306   0.033891 172.31.29.138 -> 54.230.159.153 TCP 66 58541 > http [ACK] Seq=98 Ack=2422505 Win=1585664 Len=0 TSval=5114573 TSecr=832079728
307   0.033952 54.230.159.153 -> 172.31.29.138 TCP 23234 [TCP segment of a reassembled PDU]
308   0.033961 172.31.29.138 -> 54.230.159.153 TCP 66 58541 > http [ACK] Seq=98 Ack=2445673 Win=1585664 Len=0 TSval=5114573 TSecr=832079728
309   0.034338 54.230.159.153 -> 172.31.29.138 TCP 5858 [TCP segment of a reassembled PDU]
310   0.034343 172.31.29.138 -> 54.230.159.153 TCP 66 58541 > http [ACK] Seq=98 Ack=2451465 Win=1585664 Len=0 TSval=5114574 TSecr=832079728
311   0.034520 54.230.159.153 -> 172.31.29.138 TCP 26130 [TCP segment of a reassembled PDU]
312   0.034528 172.31.29.138 -> 54.230.159.153 TCP 66 58541 > http [ACK] Seq=98 Ack=2477529 Win=1585664 Len=0 TSval=5114574 TSecr=832079728
313   0.034592 54.230.159.153 -> 172.31.29.138 TCP 26130 [TCP segment of a reassembled PDU]
314   0.034599 172.31.29.138 -> 54.230.159.153 TCP 66 58541 > http [ACK] Seq=98 Ack=2503593 Win=1585664 Len=0 TSval=5114574 TSecr=832079728
315   0.034671 54.230.159.153 -> 172.31.29.138 TCP 26130 [TCP segment of a reassembled PDU]
316   0.034678 172.31.29.138 -> 54.230.159.153 TCP 66 58541 > http [ACK] Seq=98 Ack=2529657 Win=1585664 Len=0 TSval=5114574 TSecr=832079728
317   0.034735 54.230.159.153 -> 172.31.29.138 TCP 26130 [TCP segment of a reassembled PDU]
318   0.034742 172.31.29.138 -> 54.230.159.153 TCP 66 58541 > http [ACK] Seq=98 Ack=2555721 Win=1585664 Len=0 TSval=5114574 TSecr=832079728
319   0.034817 54.230.159.153 -> 172.31.29.138 TCP 26130 [TCP segment of a reassembled PDU]
320   0.034824 172.31.29.138 -> 54.230.159.153 TCP 66 58541 > http [ACK] Seq=98 Ack=2581785 Win=1585664 Len=0 TSval=5114574 TSecr=832079728
321   0.034899 54.230.159.153 -> 172.31.29.138 TCP 26130 [TCP segment of a reassembled PDU]
322   0.034906 172.31.29.138 -> 54.230.159.153 TCP 66 58541 > http [ACK] Seq=98 Ack=2607849 Win=1585664 Len=0 TSval=5114574 TSecr=832079728
323   0.034974 54.230.159.153 -> 172.31.29.138 TCP 26130 [TCP segment of a reassembled PDU]
324   0.034980 172.31.29.138 -> 54.230.159.153 TCP 66 58541 > http [ACK] Seq=98 Ack=2633913 Win=1585664 Len=0 TSval=5114574 TSecr=832079728
325   0.035003 54.230.159.153 -> 172.31.29.138 TCP 7306 [TCP segment of a reassembled PDU]
326   0.035006 172.31.29.138 -> 54.230.159.153 TCP 66 58541 > http [ACK] Seq=98 Ack=2641153 Win=1585664 Len=0 TSval=5114574 TSecr=832079728
327   0.035483 54.230.159.153 -> 172.31.29.138 TCP 11650 [TCP segment of a reassembled PDU]
328   0.035490 172.31.29.138 -> 54.230.159.153 TCP 66 58541 > http [ACK] Seq=98 Ack=2652737 Win=1585664 Len=0 TSval=5114574 TSecr=832079728
329   0.035647 54.230.159.153 -> 172.31.29.138 TCP 26130 [TCP segment of a reassembled PDU]
330   0.035659 172.31.29.138 -> 54.230.159.153 TCP 66 58541 > http [ACK] Seq=98 Ack=2678801 Win=1585664 Len=0 TSval=5114574 TSecr=832079728
331   0.035705 54.230.159.153 -> 172.31.29.138 TCP 17442 [TCP segment of a reassembled PDU]
332   0.035710 172.31.29.138 -> 54.230.159.153 TCP 66 58541 > http [ACK] Seq=98 Ack=2696177 Win=1585664 Len=0 TSval=5114574 TSecr=832079728
333   0.035741 54.230.159.153 -> 172.31.29.138 TCP 8754 [TCP segment of a reassembled PDU]
334   0.035745 172.31.29.138 -> 54.230.159.153 TCP 66 58541 > http [ACK] Seq=98 Ack=2704865 Win=1585664 Len=0 TSval=5114574 TSecr=832079728
335   0.035769 54.230.159.153 -> 172.31.29.138 TCP 1514 [TCP segment of a reassembled PDU]
336   0.035775 54.230.159.153 -> 172.31.29.138 TCP 2962 [TCP segment of a reassembled PDU]
337   0.035777 172.31.29.138 -> 54.230.159.153 TCP 66 58541 > http [ACK] Seq=98 Ack=2709209 Win=1585664 Len=0 TSval=5114574 TSecr=832079728
338   0.035797 54.230.159.153 -> 172.31.29.138 TCP 1514 [TCP Previous segment not captured] [TCP segment of a reassembled PDU]
339   0.035800 172.31.29.138 -> 54.230.159.153 TCP 78 [TCP Dup ACK 337#1] 58541 > http [ACK] Seq=98 Ack=2709209 Win=1585664 Len=0 TSval=5114574 TSecr=832079728 SLE=2710657 SRE=2712105
340   0.035826 54.230.159.153 -> 172.31.29.138 TCP 1514 [TCP Out-Of-Order] [TCP segment of a reassembled PDU]
341   0.035831 172.31.29.138 -> 54.230.159.153 TCP 66 58541 > http [ACK] Seq=98 Ack=2712105 Win=1585664 Len=0 TSval=5114574 TSecr=832079728
342   0.035970 54.230.159.153 -> 172.31.29.138 TCP 26130 [TCP segment of a reassembled PDU]
343   0.035977 172.31.29.138 -> 54.230.159.153 TCP 66 58541 > http [ACK] Seq=98 Ack=2738169 Win=1585664 Len=0 TSval=5114574 TSecr=832079728
344   0.036041 54.230.159.153 -> 172.31.29.138 TCP 20338 [TCP segment of a reassembled PDU]
