[Measurement for 10mb at 12:36:25 20.36.2014] 
Tshark:

  1   0.000000 172.31.29.138 -> 172.31.0.2   DNS 89 Standard query 0x0d76  A d1xvcg6dfvgaki.cloudfront.net
  2   0.000027 172.31.29.138 -> 172.31.0.2   DNS 89 Standard query 0x43d1  AAAA d1xvcg6dfvgaki.cloudfront.net
  3   0.000520   172.31.0.2 -> 172.31.29.138 DNS 217 Standard query response 0x0d76  A 54.230.158.223 A 54.230.158.225 A 54.230.159.132 A 54.192.159.164 A 54.192.159.168 A 54.192.159.180 A 54.230.158.141 A 54.230.158.149
  4   0.000531   172.31.0.2 -> 172.31.29.138 DNS 170 Standard query response 0x43d1 
  5   0.003927 172.31.29.138 -> 54.230.158.223 TCP 74 45275 > http [SYN] Seq=0 Win=26883 Len=0 MSS=8961 SACK_PERM=1 TSval=17714631 TSecr=0 WS=128
  6   0.004654 54.230.158.223 -> 172.31.29.138 TCP 74 http > 45275 [SYN, ACK] Seq=0 Ack=1 Win=14480 Len=0 MSS=1460 SACK_PERM=1 TSval=733336092 TSecr=17714631 WS=128
  7   0.004668 172.31.29.138 -> 54.230.158.223 TCP 66 45275 > http [ACK] Seq=1 Ack=1 Win=27008 Len=0 TSval=17714631 TSecr=733336092
  8   0.004708 172.31.29.138 -> 54.230.158.223 HTTP 163 GET /10mb HTTP/1.1 
  9   0.005306 54.230.158.223 -> 172.31.29.138 TCP 66 http > 45275 [ACK] Seq=1 Ack=98 Win=14592 Len=0 TSval=733336092 TSecr=17714631
 10   0.009762 54.230.158.223 -> 172.31.29.138 TCP 13098 [TCP segment of a reassembled PDU]
 11   0.009773 172.31.29.138 -> 54.230.158.223 TCP 66 45275 > http [ACK] Seq=98 Ack=13033 Win=52992 Len=0 TSval=17714633 TSecr=733336093
 12   0.010519 54.230.158.223 -> 172.31.29.138 TCP 5858 [TCP segment of a reassembled PDU]
 13   0.010527 172.31.29.138 -> 54.230.158.223 TCP 66 45275 > http [ACK] Seq=98 Ack=18825 Win=64640 Len=0 TSval=17714633 TSecr=733336093
 14   0.010566 54.230.158.223 -> 172.31.29.138 TCP 7306 [TCP segment of a reassembled PDU]
 15   0.010573 172.31.29.138 -> 54.230.158.223 TCP 66 45275 > http [ACK] Seq=98 Ack=26065 Win=79104 Len=0 TSval=17714633 TSecr=733336093
 16   0.011026 54.230.158.223 -> 172.31.29.138 TCP 13098 [TCP segment of a reassembled PDU]
 17   0.011034 172.31.29.138 -> 54.230.158.223 TCP 66 45275 > http [ACK] Seq=98 Ack=39097 Win=96512 Len=0 TSval=17714633 TSecr=733336093
 18   0.011801 54.230.158.223 -> 172.31.29.138 TCP 11650 [TCP segment of a reassembled PDU]
 19   0.011810 172.31.29.138 -> 54.230.158.223 TCP 66 45275 > http [ACK] Seq=98 Ack=50681 Win=98944 Len=0 TSval=17714633 TSecr=733336093
 20   0.011866 54.230.158.223 -> 172.31.29.138 TCP 8754 [TCP segment of a reassembled PDU]
 21   0.011873 172.31.29.138 -> 54.230.158.223 TCP 66 45275 > http [ACK] Seq=98 Ack=59369 Win=103680 Len=0 TSval=17714633 TSecr=733336093
 22   0.012314 54.230.158.223 -> 172.31.29.138 TCP 5858 [TCP segment of a reassembled PDU]
 23   0.012320 172.31.29.138 -> 54.230.158.223 TCP 66 45275 > http [ACK] Seq=98 Ack=65161 Win=108416 Len=0 TSval=17714633 TSecr=733336093
 24   0.012407 54.230.158.223 -> 172.31.29.138 TCP 17442 [TCP segment of a reassembled PDU]
 25   0.012417 172.31.29.138 -> 54.230.158.223 TCP 66 45275 > http [ACK] Seq=98 Ack=82537 Win=91136 Len=0 TSval=17714633 TSecr=733336093
 26   0.013150 54.230.158.223 -> 172.31.29.138 TCP 18890 [TCP segment of a reassembled PDU]
 27   0.013161 172.31.29.138 -> 54.230.158.223 TCP 66 45275 > http [ACK] Seq=98 Ack=101361 Win=86912 Len=0 TSval=17714634 TSecr=733336093
 28   0.013225 54.230.158.223 -> 172.31.29.138 TCP 7306 [TCP segment of a reassembled PDU]
 29   0.013231 172.31.29.138 -> 54.230.158.223 TCP 66 45275 > http [ACK] Seq=98 Ack=108601 Win=123520 Len=0 TSval=17714634 TSecr=733336093
 30   0.013937 54.230.158.223 -> 172.31.29.138 TCP 15994 [TCP segment of a reassembled PDU]
 31   0.013947 172.31.29.138 -> 54.230.158.223 TCP 66 45275 > http [ACK] Seq=98 Ack=124529 Win=155392 Len=0 TSval=17714634 TSecr=733336093
 32   0.013956 54.230.158.223 -> 172.31.29.138 TCP 4410 [TCP segment of a reassembled PDU]
 33   0.013960 172.31.29.138 -> 54.230.158.223 TCP 66 45275 > http [ACK] Seq=98 Ack=128873 Win=164096 Len=0 TSval=17714634 TSecr=733336093
 34   0.014600 54.230.158.223 -> 172.31.29.138 TCP 15994 [TCP segment of a reassembled PDU]
 35   0.014610 172.31.29.138 -> 54.230.158.223 TCP 66 45275 > http [ACK] Seq=98 Ack=144801 Win=195968 Len=0 TSval=17714634 TSecr=733336093
 36   0.014643 54.230.158.223 -> 172.31.29.138 TCP 10202 [TCP segment of a reassembled PDU]
 37   0.014649 172.31.29.138 -> 54.230.158.223 TCP 66 45275 > http [ACK] Seq=98 Ack=154937 Win=216192 Len=0 TSval=17714634 TSecr=733336093
 38   0.015377 54.230.158.223 -> 172.31.29.138 TCP 1514 [TCP segment of a reassembled PDU]
 39   0.015381 172.31.29.138 -> 54.230.158.223 TCP 66 45275 > http [ACK] Seq=98 Ack=156385 Win=219136 Len=0 TSval=17714634 TSecr=733336093
 40   0.015556 54.230.158.223 -> 172.31.29.138 TCP 26130 [TCP segment of a reassembled PDU]
 41   0.015569 172.31.29.138 -> 54.230.158.223 TCP 66 45275 > http [ACK] Seq=98 Ack=182449 Win=271232 Len=0 TSval=17714634 TSecr=733336093
 42   0.015579 54.230.158.223 -> 172.31.29.138 TCP 7306 [TCP segment of a reassembled PDU]
 43   0.015584 172.31.29.138 -> 54.230.158.223 TCP 66 45275 > http [ACK] Seq=98 Ack=189689 Win=285696 Len=0 TSval=17714634 TSecr=733336093
 44   0.016240 54.230.158.223 -> 172.31.29.138 TCP 17442 [TCP segment of a reassembled PDU]
 45   0.016250 172.31.29.138 -> 54.230.158.223 TCP 66 45275 > http [ACK] Seq=98 Ack=207065 Win=320512 Len=0 TSval=17714634 TSecr=733336093
 46   0.016335 54.230.158.223 -> 172.31.29.138 TCP 13098 [TCP segment of a reassembled PDU]
 47   0.016344 172.31.29.138 -> 54.230.158.223 TCP 66 45275 > http [ACK] Seq=98 Ack=220097 Win=346496 Len=0 TSval=17714634 TSecr=733336093
 48   0.016871 54.230.158.223 -> 172.31.29.138 TCP 5858 [TCP segment of a reassembled PDU]
 49   0.016877 172.31.29.138 -> 54.230.158.223 TCP 66 45275 > http [ACK] Seq=98 Ack=225889 Win=358144 Len=0 TSval=17714635 TSecr=733336093
 50   0.017035 54.230.158.223 -> 172.31.29.138 TCP 26130 [TCP segment of a reassembled PDU]
 51   0.017049 172.31.29.138 -> 54.230.158.223 TCP 66 45275 > http [ACK] Seq=98 Ack=251953 Win=410240 Len=0 TSval=17714635 TSecr=733336093
 52   0.017058 54.230.158.223 -> 172.31.29.138 TCP 10014 [TCP segment of a reassembled PDU]
 53   0.017064 172.31.29.138 -> 54.230.158.223 TCP 66 45275 > http [ACK] Seq=98 Ack=261901 Win=430080 Len=0 TSval=17714635 TSecr=733336093
 54   0.018210 54.230.158.223 -> 172.31.29.138 TCP 15994 [TCP segment of a reassembled PDU]
 55   0.018220 172.31.29.138 -> 54.230.158.223 TCP 66 45275 > http [ACK] Seq=98 Ack=277829 Win=461952 Len=0 TSval=17714635 TSecr=733336094
 56   0.018349 54.230.158.223 -> 172.31.29.138 TCP 26130 [TCP segment of a reassembled PDU]
 57   0.018362 172.31.29.138 -> 54.230.158.223 TCP 66 45275 > http [ACK] Seq=98 Ack=303893 Win=514176 Len=0 TSval=17714635 TSecr=733336094
 58   0.018368 54.230.158.223 -> 172.31.29.138 TCP 2962 [TCP segment of a reassembled PDU]
 59   0.018371 172.31.29.138 -> 54.230.158.223 TCP 66 45275 > http [ACK] Seq=98 Ack=306789 Win=519936 Len=0 TSval=17714635 TSecr=733336094
 60   0.018988 54.230.158.223 -> 172.31.29.138 TCP 15994 [TCP segment of a reassembled PDU]
 61   0.018998 172.31.29.138 -> 54.230.158.223 TCP 66 45275 > http [ACK] Seq=98 Ack=322717 Win=551808 Len=0 TSval=17714635 TSecr=733336094
 62   0.019059 54.230.158.223 -> 172.31.29.138 TCP 4786 [TCP segment of a reassembled PDU]
 63   0.019065 172.31.29.138 -> 54.230.158.223 TCP 66 45275 > http [ACK] Seq=98 Ack=327437 Win=561152 Len=0 TSval=17714635 TSecr=733336094
 64   0.019969 54.230.158.223 -> 172.31.29.138 TCP 5858 [TCP segment of a reassembled PDU]
 65   0.019975 172.31.29.138 -> 54.230.158.223 TCP 66 45275 > http [ACK] Seq=98 Ack=333229 Win=572800 Len=0 TSval=17714635 TSecr=733336094
 66   0.020154 54.230.158.223 -> 172.31.29.138 TCP 26130 [TCP segment of a reassembled PDU]
 67   0.020167 172.31.29.138 -> 54.230.158.223 TCP 66 45275 > http [ACK] Seq=98 Ack=359293 Win=587904 Len=0 TSval=17714635 TSecr=733336094
 68   0.020190 54.230.158.223 -> 172.31.29.138 TCP 10202 [TCP segment of a reassembled PDU]
 69   0.020198 172.31.29.138 -> 54.230.158.223 TCP 66 45275 > http [ACK] Seq=98 Ack=369429 Win=577792 Len=0 TSval=17714635 TSecr=733336094
 70   0.020797 54.230.158.223 -> 172.31.29.138 TCP 13098 [TCP segment of a reassembled PDU]
 71   0.020806 172.31.29.138 -> 54.230.158.223 TCP 66 45275 > http [ACK] Seq=98 Ack=382461 Win=609408 Len=0 TSval=17714636 TSecr=733336094
 72   0.020904 54.230.158.223 -> 172.31.29.138 TCP 10578 [TCP segment of a reassembled PDU]
 73   0.020911 172.31.29.138 -> 54.230.158.223 TCP 66 45275 > http [ACK] Seq=98 Ack=392973 Win=611712 Len=0 TSval=17714636 TSecr=733336094
 74   0.021831 54.230.158.223 -> 172.31.29.138 TCP 2962 [TCP segment of a reassembled PDU]
 75   0.021837 172.31.29.138 -> 54.230.158.223 TCP 66 45275 > http [ACK] Seq=98 Ack=395869 Win=625920 Len=0 TSval=17714636 TSecr=733336094
 76   0.021962 54.230.158.223 -> 172.31.29.138 TCP 26130 [TCP segment of a reassembled PDU]
 77   0.021986 172.31.29.138 -> 54.230.158.223 TCP 66 45275 > http [ACK] Seq=98 Ack=421933 Win=599936 Len=0 TSval=17714636 TSecr=733336094
 78   0.022032 54.230.158.223 -> 172.31.29.138 TCP 23234 [TCP segment of a reassembled PDU]
 79   0.022056 172.31.29.138 -> 54.230.158.223 TCP 66 45275 > http [ACK] Seq=98 Ack=445101 Win=592640 Len=0 TSval=17714636 TSecr=733336094
 80   0.022553 54.230.158.223 -> 172.31.29.138 TCP 4410 [TCP segment of a reassembled PDU]
 81   0.022558 172.31.29.138 -> 54.230.158.223 TCP 66 45275 > http [ACK] Seq=98 Ack=449445 Win=623616 Len=0 TSval=17714636 TSecr=733336094
 82   0.022690 54.230.158.223 -> 172.31.29.138 TCP 9130 [TCP segment of a reassembled PDU]
 83   0.022709 172.31.29.138 -> 54.230.158.223 TCP 66 45275 > http [ACK] Seq=98 Ack=458509 Win=630016 Len=0 TSval=17714636 TSecr=733336094
 84   0.026126 54.230.158.223 -> 172.31.29.138 TCP 13098 [TCP segment of a reassembled PDU]
 85   0.026147 172.31.29.138 -> 54.230.158.223 TCP 66 45275 > http [ACK] Seq=98 Ack=471541 Win=630016 Len=0 TSval=17714637 TSecr=733336094
 86   0.026276 54.230.158.223 -> 172.31.29.138 TCP 26130 [TCP segment of a reassembled PDU]
 87   0.026315 172.31.29.138 -> 54.230.158.223 TCP 66 45275 > http [ACK] Seq=98 Ack=497605 Win=604032 Len=0 TSval=17714637 TSecr=733336094
 88   0.026338 54.230.158.223 -> 172.31.29.138 TCP 17442 [TCP segment of a reassembled PDU]
 89   0.026356 172.31.29.138 -> 54.230.158.223 TCP 66 45275 > http [ACK] Seq=98 Ack=514981 Win=602112 Len=0 TSval=17714637 TSecr=733336094
 90   0.026971 54.230.158.223 -> 172.31.29.138 TCP 8754 [TCP segment of a reassembled PDU]
 91   0.026979 172.31.29.138 -> 54.230.158.223 TCP 66 45275 > http [ACK] Seq=98 Ack=523669 Win=616448 Len=0 TSval=17714637 TSecr=733336094
 92   0.027151 54.230.158.223 -> 172.31.29.138 TCP 26130 [TCP segment of a reassembled PDU]
 93   0.027168 54.230.158.223 -> 172.31.29.138 TCP 7306 [TCP segment of a reassembled PDU]
 94   0.027184 172.31.29.138 -> 54.230.158.223 TCP 66 45275 > http [ACK] Seq=98 Ack=556973 Win=583168 Len=0 TSval=17714637 TSecr=733336094
 95   0.027645 54.230.158.223 -> 172.31.29.138 TCP 2962 [TCP segment of a reassembled PDU]
 96   0.027650 172.31.29.138 -> 54.230.158.223 TCP 66 45275 > http [ACK] Seq=98 Ack=559869 Win=625920 Len=0 TSval=17714637 TSecr=733336094
 97   0.027844 54.230.158.223 -> 172.31.29.138 TCP 26130 [TCP segment of a reassembled PDU]
 98   0.027868 172.31.29.138 -> 54.230.158.223 TCP 66 45275 > http [ACK] Seq=98 Ack=585933 Win=599936 Len=0 TSval=17714637 TSecr=733336094
 99   0.027883 54.230.158.223 -> 172.31.29.138 TCP 3714 [TCP segment of a reassembled PDU]
100   0.027894 172.31.29.138 -> 54.230.158.223 TCP 66 45275 > http [ACK] Seq=98 Ack=589581 Win=630016 Len=0 TSval=17714637 TSecr=733336094
101   0.028657 54.230.158.223 -> 172.31.29.138 TCP 2962 [TCP segment of a reassembled PDU]
102   0.028686 172.31.29.138 -> 54.230.158.223 TCP 66 45275 > http [ACK] Seq=98 Ack=592477 Win=630016 Len=0 TSval=17714637 TSecr=733336095
103   0.028784 54.230.158.223 -> 172.31.29.138 TCP 26130 [TCP segment of a reassembled PDU]
104   0.028811 172.31.29.138 -> 54.230.158.223 TCP 66 45275 > http [ACK] Seq=98 Ack=618541 Win=604032 Len=0 TSval=17714638 TSecr=733336095
105   0.028853 54.230.158.223 -> 172.31.29.138 TCP 22002 [TCP segment of a reassembled PDU]
106   0.029037 172.31.29.138 -> 54.230.158.223 TCP 66 45275 > http [ACK] Seq=98 Ack=640477 Win=592640 Len=0 TSval=17714638 TSecr=733336095
107   0.029509 54.230.158.223 -> 172.31.29.138 TCP 14546 [TCP segment of a reassembled PDU]
108   0.029518 172.31.29.138 -> 54.230.158.223 TCP 66 45275 > http [ACK] Seq=98 Ack=654957 Win=606848 Len=0 TSval=17714638 TSecr=733336095
109   0.029536 54.230.158.223 -> 172.31.29.138 TCP 226 [TCP segment of a reassembled PDU]
110   0.029554 172.31.29.138 -> 54.230.158.223 TCP 66 45275 > http [ACK] Seq=98 Ack=655117 Win=630016 Len=0 TSval=17714638 TSecr=733336095
111   0.031220 54.230.158.223 -> 172.31.29.138 TCP 17442 [TCP segment of a reassembled PDU]
112   0.031241 172.31.29.138 -> 54.230.158.223 TCP 66 45275 > http [ACK] Seq=98 Ack=672493 Win=612736 Len=0 TSval=17714638 TSecr=733336095
113   0.031371 54.230.158.223 -> 172.31.29.138 TCP 26130 [TCP segment of a reassembled PDU]
114   0.031395 172.31.29.138 -> 54.230.158.223 TCP 66 45275 > http [ACK] Seq=98 Ack=698557 Win=587904 Len=0 TSval=17714638 TSecr=733336095
115   0.031436 54.230.158.223 -> 172.31.29.138 TCP 22161 [TCP segment of a reassembled PDU]
116   0.031445 172.31.29.138 -> 54.230.158.223 TCP 66 45275 > http [ACK] Seq=98 Ack=720652 Win=592640 Len=0 TSval=17714638 TSecr=733336095
117   0.031942 54.230.158.223 -> 172.31.29.138 TCP 67 [TCP segment of a reassembled PDU]
118   0.031955 172.31.29.138 -> 54.230.158.223 TCP 66 45275 > http [ACK] Seq=98 Ack=720653 Win=630016 Len=0 TSval=17714638 TSecr=733336095
119   0.034127 54.230.158.223 -> 172.31.29.138 TCP 26130 [TCP segment of a reassembled PDU]
120   0.034153 172.31.29.138 -> 54.230.158.223 TCP 66 45275 > http [ACK] Seq=98 Ack=746717 Win=604032 Len=0 TSval=17714639 TSecr=733336095
121   0.034198 54.230.158.223 -> 172.31.29.138 TCP 26130 [TCP segment of a reassembled PDU]
122   0.034241 54.230.158.223 -> 172.31.29.138 TCP 13473 [TCP segment of a reassembled PDU]
123   0.034248 54.230.158.223 -> 172.31.29.138 TCP 67 [TCP segment of a reassembled PDU]
124   0.034406 172.31.29.138 -> 54.230.158.223 TCP 66 45275 > http [ACK] Seq=98 Ack=786189 Win=564608 Len=0 TSval=17714639 TSecr=733336095
125   0.035804 54.230.158.223 -> 172.31.29.138 TCP 10202 [TCP segment of a reassembled PDU]
126   0.035812 172.31.29.138 -> 54.230.158.223 TCP 66 45275 > http [ACK] Seq=98 Ack=796325 Win=614144 Len=0 TSval=17714639 TSecr=733336095
127   0.035963 54.230.158.223 -> 172.31.29.138 TCP 26130 [TCP segment of a reassembled PDU]
128   0.035982 54.230.158.223 -> 172.31.29.138 TCP 10202 [TCP segment of a reassembled PDU]
129   0.036001 54.230.158.223 -> 172.31.29.138 TCP 138 [TCP segment of a reassembled PDU]
130   0.036005 172.31.29.138 -> 54.230.158.223 TCP 66 45275 > http [ACK] Seq=98 Ack=832525 Win=578048 Len=0 TSval=17714639 TSecr=733336095
131   0.036022 172.31.29.138 -> 54.230.158.223 TCP 66 45275 > http [ACK] Seq=98 Ack=832597 Win=630016 Len=0 TSval=17714639 TSecr=733336095
132   0.036349 54.230.158.223 -> 172.31.29.138 TCP 17442 [TCP segment of a reassembled PDU]
133   0.036371 172.31.29.138 -> 54.230.158.223 TCP 66 45275 > http [ACK] Seq=98 Ack=849973 Win=612736 Len=0 TSval=17714639 TSecr=733336095
134   0.036398 54.230.158.223 -> 172.31.29.138 TCP 1818 [TCP segment of a reassembled PDU]
135   0.036403 172.31.29.138 -> 54.230.158.223 TCP 66 45275 > http [ACK] Seq=98 Ack=851725 Win=625920 Len=0 TSval=17714639 TSecr=733336095
136   0.038153 54.230.158.223 -> 172.31.29.138 TCP 2962 [TCP segment of a reassembled PDU]
137   0.038158 172.31.29.138 -> 54.230.158.223 TCP 66 45275 > http [ACK] Seq=98 Ack=854621 Win=625920 Len=0 TSval=17714640 TSecr=733336095
138   0.038268 54.230.158.223 -> 172.31.29.138 TCP 26130 [TCP segment of a reassembled PDU]
139   0.038345 54.230.158.223 -> 172.31.29.138 TCP 26130 [TCP segment of a reassembled PDU]
140   0.038358 54.230.158.223 -> 172.31.29.138 TCP 2962 [TCP segment of a reassembled PDU]
141   0.038484 172.31.29.138 -> 54.230.158.223 TCP 66 45275 > http [ACK] Seq=98 Ack=909645 Win=571008 Len=0 TSval=17714640 TSecr=733336095
142   0.039194 54.230.158.223 -> 172.31.29.138 TCP 5858 [TCP segment of a reassembled PDU]
143   0.039200 172.31.29.138 -> 54.230.158.223 TCP 66 45275 > http [ACK] Seq=98 Ack=915437 Win=621184 Len=0 TSval=17714640 TSecr=733336096
144   0.039256 54.230.158.223 -> 172.31.29.138 TCP 1890 [TCP segment of a reassembled PDU]
145   0.039260 172.31.29.138 -> 54.230.158.223 TCP 66 45275 > http [ACK] Seq=98 Ack=917261 Win=625920 Len=0 TSval=17714640 TSecr=733336096
146   0.040201 54.230.158.223 -> 172.31.29.138 TCP 2962 [TCP segment of a reassembled PDU]
147   0.040206 172.31.29.138 -> 54.230.158.223 TCP 66 45275 > http [ACK] Seq=98 Ack=920157 Win=625920 Len=0 TSval=17714640 TSecr=733336096
148   0.040471 54.230.158.223 -> 172.31.29.138 TCP 7306 [TCP segment of a reassembled PDU]
149   0.040487 172.31.29.138 -> 54.230.158.223 TCP 66 45275 > http [ACK] Seq=98 Ack=927397 Win=630016 Len=0 TSval=17714640 TSecr=733336096
150   0.040620 54.230.158.223 -> 172.31.29.138 TCP 26130 [TCP segment of a reassembled PDU]
151   0.040645 172.31.29.138 -> 54.230.158.223 TCP 66 45275 > http [ACK] Seq=98 Ack=953461 Win=604032 Len=0 TSval=17714640 TSecr=733336096
152   0.040696 54.230.158.223 -> 172.31.29.138 TCP 26130 [TCP segment of a reassembled PDU]
153   0.040720 54.230.158.223 -> 172.31.29.138 TCP 3338 [TCP segment of a reassembled PDU]
154   0.040731 172.31.29.138 -> 54.230.158.223 TCP 66 45275 > http [ACK] Seq=98 Ack=982797 Win=580736 Len=0 TSval=17714641 TSecr=733336096
155   0.042759 54.230.158.223 -> 172.31.29.138 TCP 2962 [TCP segment of a reassembled PDU]
156   0.042764 172.31.29.138 -> 54.230.158.223 TCP 66 45275 > http [ACK] Seq=98 Ack=985693 Win=625920 Len=0 TSval=17714641 TSecr=733336096
157   0.042842 54.230.158.223 -> 172.31.29.138 TCP 11650 [TCP segment of a reassembled PDU]
158   0.042947 54.230.158.223 -> 172.31.29.138 TCP 17442 [TCP segment of a reassembled PDU]
159   0.042997 54.230.158.223 -> 172.31.29.138 TCP 8754 [TCP segment of a reassembled PDU]
160   0.043039 54.230.158.223 -> 172.31.29.138 TCP 17442 [TCP segment of a reassembled PDU]
161   0.043050 54.230.158.223 -> 172.31.29.138 TCP 1514 [TCP Previous segment not captured] [TCP segment of a reassembled PDU]
162   0.043054 172.31.29.138 -> 54.230.158.223 TCP 78 45275 > http [ACK] Seq=98 Ack=1040717 Win=571008 Len=0 TSval=17714641 TSecr=733336096 SLE=1042165 SRE=1043613
163   0.043059 54.230.158.223 -> 172.31.29.138 TCP 1514 [TCP Out-Of-Order] [TCP segment of a reassembled PDU]
164   0.043062 172.31.29.138 -> 54.230.158.223 TCP 66 45275 > http [ACK] Seq=98 Ack=1043613 Win=568192 Len=0 TSval=17714641 TSecr=733336096
165   0.043149 54.230.158.223 -> 172.31.29.138 TCP 4786 [TCP segment of a reassembled PDU]
166   0.043156 172.31.29.138 -> 54.230.158.223 TCP 66 45275 > http [ACK] Seq=98 Ack=1048333 Win=621184 Len=0 TSval=17714641 TSecr=733336096
167   0.047027 54.230.158.223 -> 172.31.29.138 TCP 4410 [TCP segment of a reassembled PDU]
168   0.047033 172.31.29.138 -> 54.230.158.223 TCP 66 45275 > http [ACK] Seq=98 Ack=1052677 Win=623616 Len=0 TSval=17714642 TSecr=733336096
169   0.047148 54.230.158.223 -> 172.31.29.138 TCP 7306 [TCP segment of a reassembled PDU]
170   0.047154 172.31.29.138 -> 54.230.158.223 TCP 66 45275 > http [ACK] Seq=98 Ack=1059917 Win=618880 Len=0 TSval=17714642 TSecr=733336096
171   0.047538 54.230.158.223 -> 172.31.29.138 TCP 4410 [TCP segment of a reassembled PDU]
172   0.047543 172.31.29.138 -> 54.230.158.223 TCP 66 45275 > http [ACK] Seq=98 Ack=1064261 Win=623616 Len=0 TSval=17714642 TSecr=733336096
173   0.047672 54.230.158.223 -> 172.31.29.138 TCP 1514 [TCP segment of a reassembled PDU]
174   0.047677 172.31.29.138 -> 54.230.158.223 TCP 66 45275 > http [ACK] Seq=98 Ack=1065709 Win=628352 Len=0 TSval=17714642 TSecr=733336096
175   0.047897 54.230.158.223 -> 172.31.29.138 TCP 8754 [TCP segment of a reassembled PDU]
176   0.047903 172.31.29.138 -> 54.230.158.223 TCP 66 45275 > http [ACK] Seq=98 Ack=1074397 Win=619776 Len=0 TSval=17714642 TSecr=733336096
177   0.048135 54.230.158.223 -> 172.31.29.138 TCP 5858 [TCP segment of a reassembled PDU]
178   0.048140 172.31.29.138 -> 54.230.158.223 TCP 66 45275 > http [ACK] Seq=98 Ack=1080189 Win=621184 Len=0 TSval=17714642 TSecr=733336096
179   0.048561 54.230.158.223 -> 172.31.29.138 TCP 4410 [TCP segment of a reassembled PDU]
180   0.048567 172.31.29.138 -> 54.230.158.223 TCP 66 45275 > http [ACK] Seq=98 Ack=1084533 Win=623616 Len=0 TSval=17714642 TSecr=733336097
181   0.048674 54.230.158.223 -> 172.31.29.138 TCP 8754 [TCP segment of a reassembled PDU]
182   0.048680 172.31.29.138 -> 54.230.158.223 TCP 66 45275 > http [ACK] Seq=98 Ack=1093221 Win=616448 Len=0 TSval=17714642 TSecr=733336097
183   0.048874 54.230.158.223 -> 172.31.29.138 TCP 4410 [TCP segment of a reassembled PDU]
184   0.048879 172.31.29.138 -> 54.230.158.223 TCP 66 45275 > http [ACK] Seq=98 Ack=1097565 Win=623616 Len=0 TSval=17714643 TSecr=733336097
185   0.048977 54.230.158.223 -> 172.31.29.138 TCP 2962 [TCP segment of a reassembled PDU]
186   0.048982 172.31.29.138 -> 54.230.158.223 TCP 66 45275 > http [ACK] Seq=98 Ack=1100461 Win=625920 Len=0 TSval=17714643 TSecr=733336097
187   0.049327 54.230.158.223 -> 172.31.29.138 TCP 4410 [TCP segment of a reassembled PDU]
188   0.049332 172.31.29.138 -> 54.230.158.223 TCP 66 45275 > http [ACK] Seq=98 Ack=1104805 Win=623616 Len=0 TSval=17714643 TSecr=733336097
189   0.049487 54.230.158.223 -> 172.31.29.138 TCP 11650 [TCP segment of a reassembled PDU]
190   0.049496 172.31.29.138 -> 54.230.158.223 TCP 66 45275 > http [ACK] Seq=98 Ack=1116389 Win=612096 Len=0 TSval=17714643 TSecr=733336097
191   0.049709 54.230.158.223 -> 172.31.29.138 TCP 8754 [TCP segment of a reassembled PDU]
192   0.049715 172.31.29.138 -> 54.230.158.223 TCP 66 45275 > http [ACK] Seq=98 Ack=1125077 Win=616448 Len=0 TSval=17714643 TSecr=733336097
193   0.050136 54.230.158.223 -> 172.31.29.138 TCP 8754 [TCP segment of a reassembled PDU]
194   0.050144 172.31.29.138 -> 54.230.158.223 TCP 66 45275 > http [ACK] Seq=98 Ack=1133765 Win=616448 Len=0 TSval=17714643 TSecr=733336097
195   0.050238 54.230.158.223 -> 172.31.29.138 TCP 11650 [TCP segment of a reassembled PDU]
196   0.050258 172.31.29.138 -> 54.230.158.223 TCP 66 45275 > http [ACK] Seq=98 Ack=1145349 Win=630016 Len=0 TSval=17714643 TSecr=733336097
197   0.050480 54.230.158.223 -> 172.31.29.138 TCP 10202 [TCP segment of a reassembled PDU]
198   0.050499 172.31.29.138 -> 54.230.158.223 TCP 66 45275 > http [ACK] Seq=98 Ack=1155485 Win=630016 Len=0 TSval=17714643 TSecr=733336097
199   0.050870 54.230.158.223 -> 172.31.29.138 TCP 2962 [TCP segment of a reassembled PDU]
200   0.050883 172.31.29.138 -> 54.230.158.223 TCP 66 45275 > http [ACK] Seq=98 Ack=1158381 Win=630016 Len=0 TSval=17714643 TSecr=733336097
201   0.051044 54.230.158.223 -> 172.31.29.138 TCP 20338 [TCP segment of a reassembled PDU]
202   0.051066 172.31.29.138 -> 54.230.158.223 TCP 66 45275 > http [ACK] Seq=98 Ack=1178653 Win=609792 Len=0 TSval=17714643 TSecr=733336097
203   0.051263 54.230.158.223 -> 172.31.29.138 TCP 11650 [TCP segment of a reassembled PDU]
204   0.051270 172.31.29.138 -> 54.230.158.223 TCP 66 45275 > http [ACK] Seq=98 Ack=1190237 Win=611712 Len=0 TSval=17714643 TSecr=733336097
205   0.051631 54.230.158.223 -> 172.31.29.138 TCP 4410 [TCP segment of a reassembled PDU]
206   0.051636 172.31.29.138 -> 54.230.158.223 TCP 66 45275 > http [ACK] Seq=98 Ack=1194581 Win=623616 Len=0 TSval=17714643 TSecr=733336097
207   0.051804 54.230.158.223 -> 172.31.29.138 TCP 21786 [TCP segment of a reassembled PDU]
208   0.051826 172.31.29.138 -> 54.230.158.223 TCP 66 45275 > http [ACK] Seq=98 Ack=1216301 Win=601984 Len=0 TSval=17714643 TSecr=733336097
209   0.051906 54.230.158.223 -> 172.31.29.138 TCP 4410 [TCP segment of a reassembled PDU]
210   0.051911 172.31.29.138 -> 54.230.158.223 TCP 66 45275 > http [ACK] Seq=98 Ack=1220645 Win=623616 Len=0 TSval=17714643 TSecr=733336097
211   0.052044 54.230.158.223 -> 172.31.29.138 TCP 8754 [TCP segment of a reassembled PDU]
212   0.052061 172.31.29.138 -> 54.230.158.223 TCP 66 45275 > http [ACK] Seq=98 Ack=1229333 Win=630016 Len=0 TSval=17714643 TSecr=733336097
213   0.052446 54.230.158.223 -> 172.31.29.138 TCP 21786 [TCP segment of a reassembled PDU]
214   0.052469 172.31.29.138 -> 54.230.158.223 TCP 66 45275 > http [ACK] Seq=98 Ack=1251053 Win=608384 Len=0 TSval=17714643 TSecr=733336097
215   0.052544 54.230.158.223 -> 172.31.29.138 TCP 7306 [TCP segment of a reassembled PDU]
216   0.052550 172.31.29.138 -> 54.230.158.223 TCP 66 45275 > http [ACK] Seq=98 Ack=1258293 Win=618880 Len=0 TSval=17714643 TSecr=733336097
217   0.052765 54.230.158.223 -> 172.31.29.138 TCP 4410 [TCP segment of a reassembled PDU]
218   0.052771 172.31.29.138 -> 54.230.158.223 TCP 66 45275 > http [ACK] Seq=98 Ack=1262637 Win=623616 Len=0 TSval=17714644 TSecr=733336097
219   0.052919 54.230.158.223 -> 172.31.29.138 TCP 11650 [TCP segment of a reassembled PDU]
220   0.052939 172.31.29.138 -> 54.230.158.223 TCP 66 45275 > http [ACK] Seq=98 Ack=1274221 Win=630016 Len=0 TSval=17714644 TSecr=733336097
221   0.053041 54.230.158.223 -> 172.31.29.138 TCP 8754 [TCP segment of a reassembled PDU]
222   0.053060 172.31.29.138 -> 54.230.158.223 TCP 66 45275 > http [ACK] Seq=98 Ack=1282909 Win=630016 Len=0 TSval=17714644 TSecr=733336097
223   0.053184 54.230.158.223 -> 172.31.29.138 TCP 14546 [TCP segment of a reassembled PDU]
224   0.053206 172.31.29.138 -> 54.230.158.223 TCP 66 45275 > http [ACK] Seq=98 Ack=1297389 Win=630016 Len=0 TSval=17714644 TSecr=733336097
225   0.053552 54.230.158.223 -> 172.31.29.138 TCP 13098 [TCP segment of a reassembled PDU]
226   0.053561 54.230.158.223 -> 172.31.29.138 TCP 122 [TCP segment of a reassembled PDU]
227   0.053574 172.31.29.138 -> 54.230.158.223 TCP 66 45275 > http [ACK] Seq=98 Ack=1310477 Win=630016 Len=0 TSval=17714644 TSecr=733336097
228   0.053903 54.230.158.223 -> 172.31.29.138 TCP 2962 [TCP segment of a reassembled PDU]
229   0.053918 172.31.29.138 -> 54.230.158.223 TCP 66 45275 > http [ACK] Seq=98 Ack=1313373 Win=630016 Len=0 TSval=17714644 TSecr=733336097
230   0.054141 54.230.158.223 -> 172.31.29.138 TCP 26130 [TCP segment of a reassembled PDU]
231   0.054157 54.230.158.223 -> 172.31.29.138 TCP 4410 [TCP segment of a reassembled PDU]
232   0.054163 54.230.158.223 -> 172.31.29.138 TCP 4410 [TCP segment of a reassembled PDU]
233   0.054178 172.31.29.138 -> 54.230.158.223 TCP 66 45275 > http [ACK] Seq=98 Ack=1348125 Win=595328 Len=0 TSval=17714644 TSecr=733336097
234   0.054562 54.230.158.223 -> 172.31.29.138 TCP 10202 [TCP segment of a reassembled PDU]
235   0.054570 172.31.29.138 -> 54.230.158.223 TCP 66 45275 > http [ACK] Seq=98 Ack=1358261 Win=614144 Len=0 TSval=17714644 TSecr=733336097
236   0.054685 54.230.158.223 -> 172.31.29.138 TCP 10202 [TCP segment of a reassembled PDU]
237   0.054692 172.31.29.138 -> 54.230.158.223 TCP 66 45275 > http [ACK] Seq=98 Ack=1368397 Win=614144 Len=0 TSval=17714644 TSecr=733336097
238   0.054834 54.230.158.223 -> 172.31.29.138 TCP 7682 [TCP segment of a reassembled PDU]
239   0.054842 172.31.29.138 -> 54.230.158.223 TCP 66 45275 > http [ACK] Seq=98 Ack=1376013 Win=616448 Len=0 TSval=17714644 TSecr=733336097
240   0.056195 54.230.158.223 -> 172.31.29.138 TCP 2962 [TCP segment of a reassembled PDU]
241   0.056200 172.31.29.138 -> 54.230.158.223 TCP 66 45275 > http [ACK] Seq=98 Ack=1378909 Win=625920 Len=0 TSval=17714644 TSecr=733336097
242   0.056321 54.230.158.223 -> 172.31.29.138 TCP 21786 [TCP segment of a reassembled PDU]
243   0.056348 54.230.158.223 -> 172.31.29.138 TCP 4410 [TCP segment of a reassembled PDU]
244   0.056354 172.31.29.138 -> 54.230.158.223 TCP 66 45275 > http [ACK] Seq=98 Ack=1400629 Win=604288 Len=0 TSval=17714644 TSecr=733336097
245   0.056367 172.31.29.138 -> 54.230.158.223 TCP 66 45275 > http [ACK] Seq=98 Ack=1404973 Win=630016 Len=0 TSval=17714644 TSecr=733336097
246   0.056426 54.230.158.223 -> 172.31.29.138 TCP 27578 [TCP segment of a reassembled PDU]
247   0.056455 172.31.29.138 -> 54.230.158.223 TCP 66 45275 > http [ACK] Seq=98 Ack=1432485 Win=602624 Len=0 TSval=17714644 TSecr=733336097
248   0.056946 54.230.158.223 -> 172.31.29.138 TCP 1514 [TCP segment of a reassembled PDU]
249   0.057102 54.230.158.223 -> 172.31.29.138 TCP 7682 [TCP segment of a reassembled PDU]
250   0.057109 172.31.29.138 -> 54.230.158.223 TCP 66 45275 > http [ACK] Seq=98 Ack=1441549 Win=616448 Len=0 TSval=17714645 TSecr=733336097
251   0.058763 54.230.158.223 -> 172.31.29.138 TCP 10202 [TCP segment of a reassembled PDU]
252   0.058781 172.31.29.138 -> 54.230.158.223 TCP 66 45275 > http [ACK] Seq=98 Ack=1451685 Win=630016 Len=0 TSval=17714645 TSecr=733336098
253   0.058913 54.230.158.223 -> 172.31.29.138 TCP 26130 [TCP segment of a reassembled PDU]
254   0.058938 172.31.29.138 -> 54.230.158.223 TCP 66 45275 > http [ACK] Seq=98 Ack=1477749 Win=604032 Len=0 TSval=17714645 TSecr=733336098
255   0.058986 54.230.158.223 -> 172.31.29.138 TCP 24682 [TCP segment of a reassembled PDU]
256   0.059138 172.31.29.138 -> 54.230.158.223 TCP 66 45275 > http [ACK] Seq=98 Ack=1502365 Win=590336 Len=0 TSval=17714645 TSecr=733336098
257   0.059530 54.230.158.223 -> 172.31.29.138 TCP 4786 [TCP segment of a reassembled PDU]
258   0.059536 172.31.29.138 -> 54.230.158.223 TCP 66 45275 > http [ACK] Seq=98 Ack=1507085 Win=621184 Len=0 TSval=17714645 TSecr=733336098
259   0.062903 54.230.158.223 -> 172.31.29.138 TCP 5858 [TCP segment of a reassembled PDU]
260   0.062909 172.31.29.138 -> 54.230.158.223 TCP 66 45275 > http [ACK] Seq=98 Ack=1512877 Win=621184 Len=0 TSval=17714646 TSecr=733336098
261   0.063070 54.230.158.223 -> 172.31.29.138 TCP 26130 [TCP segment of a reassembled PDU]
262   0.063095 172.31.29.138 -> 54.230.158.223 TCP 66 45275 > http [ACK] Seq=98 Ack=1538941 Win=595200 Len=0 TSval=17714646 TSecr=733336098
263   0.063140 54.230.158.223 -> 172.31.29.138 TCP 24682 [TCP segment of a reassembled PDU]
264   0.063153 54.230.158.223 -> 172.31.29.138 TCP 1514 [TCP segment of a reassembled PDU]
265   0.063167 172.31.29.138 -> 54.230.158.223 TCP 66 45275 > http [ACK] Seq=98 Ack=1565005 Win=587776 Len=0 TSval=17714646 TSecr=733336098
266   0.063186 54.230.158.223 -> 172.31.29.138 TCP 5858 [TCP segment of a reassembled PDU]
267   0.063194 172.31.29.138 -> 54.230.158.223 TCP 66 45275 > http [ACK] Seq=98 Ack=1570797 Win=621184 Len=0 TSval=17714646 TSecr=733336098
268   0.063683 54.230.158.223 -> 172.31.29.138 TCP 4410 [TCP segment of a reassembled PDU]
269   0.063689 172.31.29.138 -> 54.230.158.223 TCP 66 45275 > http [ACK] Seq=98 Ack=1575141 Win=623616 Len=0 TSval=17714646 TSecr=733336098
270   0.063859 54.230.158.223 -> 172.31.29.138 TCP 26130 [TCP segment of a reassembled PDU]
271   0.063898 172.31.29.138 -> 54.230.158.223 TCP 66 45275 > http [ACK] Seq=98 Ack=1601205 Win=597632 Len=0 TSval=17714646 TSecr=733336098
272   0.063963 54.230.158.223 -> 172.31.29.138 TCP 24682 [TCP segment of a reassembled PDU]
273   0.063977 54.230.158.223 -> 172.31.29.138 TCP 1514 [TCP segment of a reassembled PDU]
274   0.064025 54.230.158.223 -> 172.31.29.138 TCP 8754 [TCP segment of a reassembled PDU]
275   0.064169 172.31.29.138 -> 54.230.158.223 TCP 66 45275 > http [ACK] Seq=98 Ack=1635957 Win=573568 Len=0 TSval=17714646 TSecr=733336098
276   0.064440 54.230.158.223 -> 172.31.29.138 TCP 2266 [TCP segment of a reassembled PDU]
277   0.064446 172.31.29.138 -> 54.230.158.223 TCP 66 45275 > http [ACK] Seq=98 Ack=1638157 Win=625920 Len=0 TSval=17714646 TSecr=733336098
278   0.065199 54.230.158.223 -> 172.31.29.138 TCP 1514 [TCP segment of a reassembled PDU]
279   0.065477 54.230.158.223 -> 172.31.29.138 TCP 5858 [TCP segment of a reassembled PDU]
280   0.065494 172.31.29.138 -> 54.230.158.223 TCP 66 45275 > http [ACK] Seq=98 Ack=1645397 Win=630016 Len=0 TSval=17714647 TSecr=733336098
281   0.065626 54.230.158.223 -> 172.31.29.138 TCP 26130 [TCP segment of a reassembled PDU]
282   0.065651 172.31.29.138 -> 54.230.158.223 TCP 66 45275 > http [ACK] Seq=98 Ack=1671461 Win=604032 Len=0 TSval=17714647 TSecr=733336098
283   0.065716 54.230.158.223 -> 172.31.29.138 TCP 26130 [TCP segment of a reassembled PDU]
284   0.065749 54.230.158.223 -> 172.31.29.138 TCP 6234 [TCP segment of a reassembled PDU]
285   0.065774 172.31.29.138 -> 54.230.158.223 TCP 66 45275 > http [ACK] Seq=98 Ack=1703693 Win=576000 Len=0 TSval=17714647 TSecr=733336098
286   0.072388 54.230.158.223 -> 172.31.29.138 TCP 4410 [TCP segment of a reassembled PDU]
287   0.072394 172.31.29.138 -> 54.230.158.223 TCP 66 45275 > http [ACK] Seq=98 Ack=1708037 Win=623616 Len=0 TSval=17714648 TSecr=733336099
288   0.072536 54.230.158.223 -> 172.31.29.138 TCP 24682 [TCP segment of a reassembled PDU]
289   0.072556 54.230.158.223 -> 172.31.29.138 TCP 1514 [TCP segment of a reassembled PDU]
290   0.072644 54.230.158.223 -> 172.31.29.138 TCP 26130 [TCP segment of a reassembled PDU]
291   0.072660 54.230.158.223 -> 172.31.29.138 TCP 9130 [TCP segment of a reassembled PDU]
292   0.072676 172.31.29.138 -> 54.230.158.223 TCP 66 45275 > http [ACK] Seq=98 Ack=1769229 Win=562432 Len=0 TSval=17714648 TSecr=733336099
293   0.072692 54.230.158.223 -> 172.31.29.138 TCP 8754 [TCP segment of a reassembled PDU]
294   0.072710 172.31.29.138 -> 54.230.158.223 TCP 66 45275 > http [ACK] Seq=98 Ack=1777917 Win=556928 Len=0 TSval=17714648 TSecr=733336099
295   0.073140 54.230.158.223 -> 172.31.29.138 TCP 11650 [TCP segment of a reassembled PDU]
296   0.073148 172.31.29.138 -> 54.230.158.223 TCP 66 45275 > http [ACK] Seq=98 Ack=1789501 Win=611712 Len=0 TSval=17714649 TSecr=733336099
297   0.073320 54.230.158.223 -> 172.31.29.138 TCP 26130 [TCP segment of a reassembled PDU]
298   0.073346 172.31.29.138 -> 54.230.158.223 TCP 66 45275 > http [ACK] Seq=98 Ack=1815565 Win=587904 Len=0 TSval=17714649 TSecr=733336099
299   0.073395 54.230.158.223 -> 172.31.29.138 TCP 24682 [TCP segment of a reassembled PDU]
300   0.073408 172.31.29.138 -> 54.230.158.223 TCP 66 45275 > http [ACK] Seq=98 Ack=1840181 Win=590336 Len=0 TSval=17714649 TSecr=733336099
301   0.073414 54.230.158.223 -> 172.31.29.138 TCP 1514 [TCP segment of a reassembled PDU]
302   0.073429 54.230.158.223 -> 172.31.29.138 TCP 1514 [TCP segment of a reassembled PDU]
303   0.073439 172.31.29.138 -> 54.230.158.223 TCP 66 45275 > http [ACK] Seq=98 Ack=1843077 Win=587520 Len=0 TSval=17714649 TSecr=733336099
304   0.073820 54.230.158.223 -> 172.31.29.138 TCP 11650 [TCP segment of a reassembled PDU]
305   0.073829 172.31.29.138 -> 54.230.158.223 TCP 66 45275 > http [ACK] Seq=98 Ack=1854661 Win=611712 Len=0 TSval=17714649 TSecr=733336099
306   0.073984 54.230.158.223 -> 172.31.29.138 TCP 15994 [TCP segment of a reassembled PDU]
307   0.074007 172.31.29.138 -> 54.230.158.223 TCP 66 45275 > http [ACK] Seq=98 Ack=1870589 Win=630016 Len=0 TSval=17714649 TSecr=733336099
308   0.074144 54.230.158.223 -> 172.31.29.138 TCP 4410 [TCP segment of a reassembled PDU]
309   0.074160 172.31.29.138 -> 54.230.158.223 TCP 66 45275 > http [ACK] Seq=98 Ack=1874933 Win=630016 Len=0 TSval=17714649 TSecr=733336099
310   0.074352 54.230.158.223 -> 172.31.29.138 TCP 26130 [TCP segment of a reassembled PDU]
311   0.074366 54.230.158.223 -> 172.31.29.138 TCP 2266 [TCP segment of a reassembled PDU]
312   0.074381 172.31.29.138 -> 54.230.158.223 TCP 66 45275 > http [ACK] Seq=98 Ack=1903197 Win=601856 Len=0 TSval=17714649 TSecr=733336099
313   0.074423 54.230.158.223 -> 172.31.29.138 TCP 10202 [TCP segment of a reassembled PDU]
314   0.074430 172.31.29.138 -> 54.230.158.223 TCP 66 45275 > http [ACK] Seq=98 Ack=1913333 Win=614144 Len=0 TSval=17714649 TSecr=733336099
315   0.074596 54.230.158.223 -> 172.31.29.138 TCP 27578 [TCP segment of a reassembled PDU]
316   0.074621 172.31.29.138 -> 54.230.158.223 TCP 66 45275 > http [ACK] Seq=98 Ack=1940845 Win=586752 Len=0 TSval=17714649 TSecr=733336099
317   0.075160 54.230.158.223 -> 172.31.29.138 TCP 2962 [TCP segment of a reassembled PDU]
318   0.075165 172.31.29.138 -> 54.230.158.223 TCP 66 45275 > http [ACK] Seq=98 Ack=1943741 Win=625920 Len=0 TSval=17714649 TSecr=733336099
319   0.075335 54.230.158.223 -> 172.31.29.138 TCP 18890 [TCP segment of a reassembled PDU]
320   0.075357 54.230.158.223 -> 172.31.29.138 TCP 3338 [TCP segment of a reassembled PDU]
321   0.075381 172.31.29.138 -> 54.230.158.223 TCP 66 45275 > http [ACK] Seq=98 Ack=1965837 Win=603904 Len=0 TSval=17714649 TSecr=733336099
322   0.077461 54.230.158.223 -> 172.31.29.138 TCP 2962 [TCP segment of a reassembled PDU]
323   0.077466 172.31.29.138 -> 54.230.158.223 TCP 66 45275 > http [ACK] Seq=98 Ack=1968733 Win=625920 Len=0 TSval=17714650 TSecr=733336099
324   0.077649 54.230.158.223 -> 172.31.29.138 TCP 26130 [TCP segment of a reassembled PDU]
325   0.077669 172.31.29.138 -> 54.230.158.223 TCP 66 45275 > http [ACK] Seq=98 Ack=1994797 Win=599936 Len=0 TSval=17714650 TSecr=733336099
326   0.077725 54.230.158.223 -> 172.31.29.138 TCP 26130 [TCP segment of a reassembled PDU]
327   0.077754 54.230.158.223 -> 172.31.29.138 TCP 10578 [TCP segment of a reassembled PDU]
328   0.077759 172.31.29.138 -> 54.230.158.223 TCP 66 45275 > http [ACK] Seq=98 Ack=2020861 Win=587904 Len=0 TSval=17714650 TSecr=733336099
329   0.077773 172.31.29.138 -> 54.230.158.223 TCP 66 45275 > http [ACK] Seq=98 Ack=2031373 Win=611712 Len=0 TSval=17714650 TSecr=733336099
330   0.078414 54.230.158.223 -> 172.31.29.138 TCP 11650 [TCP segment of a reassembled PDU]
331   0.078420 172.31.29.138 -> 54.230.158.223 TCP 66 45275 > http [ACK] Seq=98 Ack=2042957 Win=611712 Len=0 TSval=17714650 TSecr=733336100
332   0.078575 54.230.158.223 -> 172.31.29.138 TCP 26130 [TCP segment of a reassembled PDU]
333   0.078595 172.31.29.138 -> 54.230.158.223 TCP 66 45275 > http [ACK] Seq=98 Ack=2069021 Win=587904 Len=0 TSval=17714650 TSecr=733336100
334   0.078645 54.230.158.223 -> 172.31.29.138 TCP 26130 [TCP segment of a reassembled PDU]
335   0.078653 172.31.29.138 -> 54.230.158.223 TCP 66 45275 > http [ACK] Seq=98 Ack=2095085 Win=587904 Len=0 TSval=17714650 TSecr=733336100
336   0.078659 54.230.158.223 -> 172.31.29.138 TCP 1514 [TCP segment of a reassembled PDU]
337   0.078661 54.230.158.223 -> 172.31.29.138 TCP 441 [TCP segment of a reassembled PDU]
338   0.078663 54.230.158.223 -> 172.31.29.138 TCP 67 [TCP segment of a reassembled PDU]
339   0.078680 172.31.29.138 -> 54.230.158.223 TCP 66 45275 > http [ACK] Seq=98 Ack=2096909 Win=586112 Len=0 TSval=17714650 TSecr=733336100
340   0.080635 54.230.158.223 -> 172.31.29.138 TCP 11650 [TCP segment of a reassembled PDU]
341   0.080642 172.31.29.138 -> 54.230.158.223 TCP 66 45275 > http [ACK] Seq=98 Ack=2108493 Win=611712 Len=0 TSval=17714650 TSecr=733336100
342   0.080825 54.230.158.223 -> 172.31.29.138 TCP 20338 [TCP segment of a reassembled PDU]
343   0.080845 172.31.29.138 -> 54.230.158.223 TCP 66 45275 > http [ACK] Seq=98 Ack=2128765 Win=597376 Len=0 TSval=17714651 TSecr=733336100
344   0.080858 54.230.158.223 -> 172.31.29.138 TCP 5858 [TCP segment of a reassembled PDU]
345   0.080871 172.31.29.138 -> 54.230.158.223 TCP 66 45275 > http [ACK] Seq=98 Ack=2134557 Win=630016 Len=0 TSval=17714651 TSecr=733336100
346   0.080935 54.230.158.223 -> 172.31.29.138 TCP 27954 [TCP segment of a reassembled PDU]
347   0.080959 172.31.29.138 -> 54.230.158.223 TCP 66 45275 > http [ACK] Seq=98 Ack=2162445 Win=602240 Len=0 TSval=17714651 TSecr=733336100
348   0.082094 54.230.158.223 -> 172.31.29.138 TCP 1514 [TCP segment of a reassembled PDU]
349   0.082209 54.230.158.223 -> 172.31.29.138 TCP 26130 [TCP segment of a reassembled PDU]
350   0.082228 172.31.29.138 -> 54.230.158.223 TCP 66 45275 > http [ACK] Seq=98 Ack=2189957 Win=587904 Len=0 TSval=17714651 TSecr=733336100
