[Measurement for 10mb at 10:42:23 20.42.2014] 
Tshark:

  1   0.000000 172.31.8.238 -> 172.31.0.2   DNS 89 Standard query 0x136a  A d1xzxs93r3iphc.cloudfront.net
  2   0.000039 172.31.8.238 -> 172.31.0.2   DNS 89 Standard query 0x2dbd  AAAA d1xzxs93r3iphc.cloudfront.net
  3   0.000664   172.31.0.2 -> 172.31.8.238 DNS 217 Standard query response 0x136a  A 54.239.132.147 A 54.192.118.222 A 54.230.116.128 A 54.230.117.21 A 54.230.117.154 A 54.230.119.66 A 54.230.119.71 A 54.230.119.125
  4   0.000682   172.31.0.2 -> 172.31.8.238 DNS 170 Standard query response 0x2dbd 
  5   0.003884 172.31.8.238 -> 54.239.132.147 TCP 74 60008 > http [SYN] Seq=0 Win=26883 Len=0 MSS=8961 SACK_PERM=1 TSval=15942827 TSecr=0 WS=128
  6   0.004599 54.239.132.147 -> 172.31.8.238 TCP 74 http > 60008 [SYN, ACK] Seq=0 Ack=1 Win=14480 Len=0 MSS=1460 SACK_PERM=1 TSval=1689142549 TSecr=15942827 WS=128
  7   0.004613 172.31.8.238 -> 54.239.132.147 TCP 66 60008 > http [ACK] Seq=1 Ack=1 Win=27008 Len=0 TSval=15942827 TSecr=1689142549
  8   0.004652 172.31.8.238 -> 54.239.132.147 HTTP 163 GET /10mb HTTP/1.1 
  9   0.005074 54.239.132.147 -> 172.31.8.238 TCP 66 http > 60008 [ACK] Seq=1 Ack=98 Win=14592 Len=0 TSval=1689142549 TSecr=15942827
 10   0.007739 54.239.132.147 -> 172.31.8.238 TCP 14164 [TCP segment of a reassembled PDU]
 11   0.007750 172.31.8.238 -> 54.239.132.147 TCP 66 60008 > http [ACK] Seq=98 Ack=14099 Win=55168 Len=0 TSval=15942828 TSecr=1689142549
 12   0.008453 54.239.132.147 -> 172.31.8.238 TCP 7306 [TCP segment of a reassembled PDU]
 13   0.008461 172.31.8.238 -> 54.239.132.147 TCP 66 60008 > http [ACK] Seq=98 Ack=21339 Win=69632 Len=0 TSval=15942828 TSecr=1689142549
 14   0.008547 54.239.132.147 -> 172.31.8.238 TCP 5858 [TCP segment of a reassembled PDU]
 15   0.008553 172.31.8.238 -> 54.239.132.147 TCP 66 60008 > http [ACK] Seq=98 Ack=27131 Win=81152 Len=0 TSval=15942828 TSecr=1689142549
 16   0.008940 54.239.132.147 -> 172.31.8.238 TCP 2962 [TCP segment of a reassembled PDU]
 17   0.008946 172.31.8.238 -> 54.239.132.147 TCP 66 60008 > http [ACK] Seq=98 Ack=30027 Win=87040 Len=0 TSval=15942828 TSecr=1689142549
 18   0.009046 54.239.132.147 -> 172.31.8.238 TCP 10202 [TCP segment of a reassembled PDU]
 19   0.009054 172.31.8.238 -> 54.239.132.147 TCP 66 60008 > http [ACK] Seq=98 Ack=40163 Win=101248 Len=0 TSval=15942828 TSecr=1689142549
 20   0.009478 54.239.132.147 -> 172.31.8.238 TCP 10202 [TCP segment of a reassembled PDU]
 21   0.009485 172.31.8.238 -> 54.239.132.147 TCP 66 60008 > http [ACK] Seq=98 Ack=50299 Win=101248 Len=0 TSval=15942828 TSecr=1689142549
 22   0.009516 54.239.132.147 -> 172.31.8.238 TCP 2962 [TCP segment of a reassembled PDU]
 23   0.009521 172.31.8.238 -> 54.239.132.147 TCP 66 60008 > http [ACK] Seq=98 Ack=53195 Win=109056 Len=0 TSval=15942828 TSecr=1689142549
 24   0.009590 54.239.132.147 -> 172.31.8.238 TCP 8754 [TCP segment of a reassembled PDU]
 25   0.009597 172.31.8.238 -> 54.239.132.147 TCP 66 60008 > http [ACK] Seq=98 Ack=61883 Win=103680 Len=0 TSval=15942828 TSecr=1689142549
 26   0.010213 54.239.132.147 -> 172.31.8.238 TCP 1514 [TCP segment of a reassembled PDU]
 27   0.010218 172.31.8.238 -> 54.239.132.147 TCP 66 60008 > http [ACK] Seq=98 Ack=63331 Win=109056 Len=0 TSval=15942828 TSecr=1689142550
 28   0.010331 54.239.132.147 -> 172.31.8.238 TCP 18890 [TCP segment of a reassembled PDU]
 29   0.010342 172.31.8.238 -> 54.239.132.147 TCP 66 60008 > http [ACK] Seq=98 Ack=82155 Win=90240 Len=0 TSval=15942828 TSecr=1689142550
 30   0.010373 54.239.132.147 -> 172.31.8.238 TCP 5858 [TCP segment of a reassembled PDU]
 31   0.010382 172.31.8.238 -> 54.239.132.147 TCP 66 60008 > http [ACK] Seq=98 Ack=87947 Win=108416 Len=0 TSval=15942828 TSecr=1689142550
 32   0.011024 54.239.132.147 -> 172.31.8.238 TCP 11650 [TCP segment of a reassembled PDU]
 33   0.011032 172.31.8.238 -> 54.239.132.147 TCP 66 60008 > http [ACK] Seq=98 Ack=99531 Win=98944 Len=0 TSval=15942828 TSecr=1689142550
 34   0.011141 54.239.132.147 -> 172.31.8.238 TCP 18890 [TCP segment of a reassembled PDU]
 35   0.011152 172.31.8.238 -> 54.239.132.147 TCP 66 60008 > http [ACK] Seq=98 Ack=118355 Win=86912 Len=0 TSval=15942828 TSecr=1689142550
 36   0.011759 54.239.132.147 -> 172.31.8.238 TCP 5858 [TCP segment of a reassembled PDU]
 37   0.011765 172.31.8.238 -> 54.239.132.147 TCP 66 60008 > http [ACK] Seq=98 Ack=124147 Win=108416 Len=0 TSval=15942829 TSecr=1689142550
 38   0.011875 54.239.132.147 -> 172.31.8.238 TCP 10202 [TCP segment of a reassembled PDU]
 39   0.011883 172.31.8.238 -> 54.239.132.147 TCP 66 60008 > http [ACK] Seq=98 Ack=134283 Win=129280 Len=0 TSval=15942829 TSecr=1689142550
 40   0.011980 54.239.132.147 -> 172.31.8.238 TCP 17442 [TCP segment of a reassembled PDU]
 41   0.011990 172.31.8.238 -> 54.239.132.147 TCP 66 60008 > http [ACK] Seq=98 Ack=151659 Win=164096 Len=0 TSval=15942829 TSecr=1689142550
 42   0.012450 54.239.132.147 -> 172.31.8.238 TCP 2962 [TCP segment of a reassembled PDU]
 43   0.012456 172.31.8.238 -> 54.239.132.147 TCP 66 60008 > http [ACK] Seq=98 Ack=154555 Win=169856 Len=0 TSval=15942829 TSecr=1689142550
 44   0.012633 54.239.132.147 -> 172.31.8.238 TCP 26130 [TCP segment of a reassembled PDU]
 45   0.012647 172.31.8.238 -> 54.239.132.147 TCP 66 60008 > http [ACK] Seq=98 Ack=180619 Win=221952 Len=0 TSval=15942829 TSecr=1689142550
 46   0.012746 54.239.132.147 -> 172.31.8.238 TCP 8754 [TCP segment of a reassembled PDU]
 47   0.012753 172.31.8.238 -> 54.239.132.147 TCP 66 60008 > http [ACK] Seq=98 Ack=189307 Win=239360 Len=0 TSval=15942829 TSecr=1689142550
 48   0.013220 54.239.132.147 -> 172.31.8.238 TCP 2962 [TCP segment of a reassembled PDU]
 49   0.013225 172.31.8.238 -> 54.239.132.147 TCP 66 60008 > http [ACK] Seq=98 Ack=192203 Win=245120 Len=0 TSval=15942829 TSecr=1689142550
 50   0.013389 54.239.132.147 -> 172.31.8.238 TCP 26130 [TCP segment of a reassembled PDU]
 51   0.013402 172.31.8.238 -> 54.239.132.147 TCP 66 60008 > http [ACK] Seq=98 Ack=218267 Win=297344 Len=0 TSval=15942829 TSecr=1689142550
 52   0.013437 54.239.132.147 -> 172.31.8.238 TCP 13098 [TCP segment of a reassembled PDU]
 53   0.013447 172.31.8.238 -> 54.239.132.147 TCP 66 60008 > http [ACK] Seq=98 Ack=231299 Win=323328 Len=0 TSval=15942829 TSecr=1689142550
 54   0.013984 54.239.132.147 -> 172.31.8.238 TCP 4410 [TCP segment of a reassembled PDU]
 55   0.013990 172.31.8.238 -> 54.239.132.147 TCP 66 60008 > http [ACK] Seq=98 Ack=235643 Win=332032 Len=0 TSval=15942829 TSecr=1689142550
 56   0.014157 54.239.132.147 -> 172.31.8.238 TCP 26130 [TCP segment of a reassembled PDU]
 57   0.014170 172.31.8.238 -> 54.239.132.147 TCP 66 60008 > http [ACK] Seq=98 Ack=261707 Win=384128 Len=0 TSval=15942829 TSecr=1689142550
 58   0.014215 54.239.132.147 -> 172.31.8.238 TCP 8754 [TCP segment of a reassembled PDU]
 59   0.014223 172.31.8.238 -> 54.239.132.147 TCP 66 60008 > http [ACK] Seq=98 Ack=270395 Win=401536 Len=0 TSval=15942829 TSecr=1689142550
 60   0.014750 54.239.132.147 -> 172.31.8.238 TCP 2962 [TCP segment of a reassembled PDU]
 61   0.014757 172.31.8.238 -> 54.239.132.147 TCP 66 60008 > http [ACK] Seq=98 Ack=273291 Win=407296 Len=0 TSval=15942829 TSecr=1689142550
 62   0.014920 54.239.132.147 -> 172.31.8.238 TCP 20338 [TCP segment of a reassembled PDU]
 63   0.014932 172.31.8.238 -> 54.239.132.147 TCP 66 60008 > http [ACK] Seq=98 Ack=293563 Win=447872 Len=0 TSval=15942829 TSecr=1689142550
 64   0.014957 54.239.132.147 -> 172.31.8.238 TCP 5858 [TCP segment of a reassembled PDU]
 65   0.014962 172.31.8.238 -> 54.239.132.147 TCP 66 60008 > http [ACK] Seq=98 Ack=299355 Win=459520 Len=0 TSval=15942829 TSecr=1689142550
 66   0.015024 54.239.132.147 -> 172.31.8.238 TCP 11650 [TCP segment of a reassembled PDU]
 67   0.015032 172.31.8.238 -> 54.239.132.147 TCP 66 60008 > http [ACK] Seq=98 Ack=310939 Win=482688 Len=0 TSval=15942829 TSecr=1689142550
 68   0.015518 54.239.132.147 -> 172.31.8.238 TCP 2962 [TCP segment of a reassembled PDU]
 69   0.015524 172.31.8.238 -> 54.239.132.147 TCP 66 60008 > http [ACK] Seq=98 Ack=313835 Win=488448 Len=0 TSval=15942829 TSecr=1689142550
 70   0.015701 54.239.132.147 -> 172.31.8.238 TCP 26130 [TCP segment of a reassembled PDU]
 71   0.015714 172.31.8.238 -> 54.239.132.147 TCP 66 60008 > http [ACK] Seq=98 Ack=339899 Win=540544 Len=0 TSval=15942830 TSecr=1689142550
 72   0.015778 54.239.132.147 -> 172.31.8.238 TCP 26130 [TCP segment of a reassembled PDU]
 73   0.015792 172.31.8.238 -> 54.239.132.147 TCP 66 60008 > http [ACK] Seq=98 Ack=365963 Win=592640 Len=0 TSval=15942830 TSecr=1689142550
 74   0.015823 54.239.132.147 -> 172.31.8.238 TCP 1514 [TCP segment of a reassembled PDU]
 75   0.015828 172.31.8.238 -> 54.239.132.147 TCP 66 60008 > http [ACK] Seq=98 Ack=367411 Win=595584 Len=0 TSval=15942830 TSecr=1689142550
 76   0.016293 54.239.132.147 -> 172.31.8.238 TCP 1514 [TCP segment of a reassembled PDU]
 77   0.016299 172.31.8.238 -> 54.239.132.147 TCP 66 60008 > http [ACK] Seq=98 Ack=368859 Win=598528 Len=0 TSval=15942830 TSecr=1689142550
 78   0.016470 54.239.132.147 -> 172.31.8.238 TCP 26130 [TCP segment of a reassembled PDU]
 79   0.016484 172.31.8.238 -> 54.239.132.147 TCP 66 60008 > http [ACK] Seq=98 Ack=394923 Win=650624 Len=0 TSval=15942830 TSecr=1689142550
 80   0.016559 54.239.132.147 -> 172.31.8.238 TCP 26130 [TCP segment of a reassembled PDU]
 81   0.016573 172.31.8.238 -> 54.239.132.147 TCP 66 60008 > http [ACK] Seq=98 Ack=420987 Win=702720 Len=0 TSval=15942830 TSecr=1689142550
 82   0.016628 54.239.132.147 -> 172.31.8.238 TCP 5858 [TCP segment of a reassembled PDU]
 83   0.016634 172.31.8.238 -> 54.239.132.147 TCP 66 60008 > http [ACK] Seq=98 Ack=426779 Win=714368 Len=0 TSval=15942830 TSecr=1689142550
 84   0.017067 54.239.132.147 -> 172.31.8.238 TCP 4410 [TCP segment of a reassembled PDU]
 85   0.017073 172.31.8.238 -> 54.239.132.147 TCP 66 60008 > http [ACK] Seq=98 Ack=431123 Win=723072 Len=0 TSval=15942830 TSecr=1689142550
 86   0.017235 54.239.132.147 -> 172.31.8.238 TCP 20338 [TCP segment of a reassembled PDU]
 87   0.017247 172.31.8.238 -> 54.239.132.147 TCP 66 60008 > http [ACK] Seq=98 Ack=451395 Win=763520 Len=0 TSval=15942830 TSecr=1689142550
 88   0.017479 54.239.132.147 -> 172.31.8.238 TCP 26130 [TCP segment of a reassembled PDU]
 89   0.017493 172.31.8.238 -> 54.239.132.147 TCP 66 60008 > http [ACK] Seq=98 Ack=477459 Win=815744 Len=0 TSval=15942830 TSecr=1689142550
 90   0.017517 54.239.132.147 -> 172.31.8.238 TCP 10202 [TCP segment of a reassembled PDU]
 91   0.017524 172.31.8.238 -> 54.239.132.147 TCP 66 60008 > http [ACK] Seq=98 Ack=487595 Win=835968 Len=0 TSval=15942830 TSecr=1689142550
 92   0.017890 54.239.132.147 -> 172.31.8.238 TCP 17442 [TCP segment of a reassembled PDU]
 93   0.017901 172.31.8.238 -> 54.239.132.147 TCP 66 60008 > http [ACK] Seq=98 Ack=504971 Win=870656 Len=0 TSval=15942830 TSecr=1689142550
 94   0.018048 54.239.132.147 -> 172.31.8.238 TCP 26130 [TCP segment of a reassembled PDU]
 95   0.018062 172.31.8.238 -> 54.239.132.147 TCP 66 60008 > http [ACK] Seq=98 Ack=531035 Win=922880 Len=0 TSval=15942830 TSecr=1689142550
 96   0.018107 54.239.132.147 -> 172.31.8.238 TCP 18890 [TCP segment of a reassembled PDU]
 97   0.018118 172.31.8.238 -> 54.239.132.147 TCP 66 60008 > http [ACK] Seq=98 Ack=549859 Win=960512 Len=0 TSval=15942830 TSecr=1689142550
 98   0.018597 54.239.132.147 -> 172.31.8.238 TCP 4410 [TCP segment of a reassembled PDU]
 99   0.018603 172.31.8.238 -> 54.239.132.147 TCP 66 60008 > http [ACK] Seq=98 Ack=554203 Win=969216 Len=0 TSval=15942830 TSecr=1689142550
100   0.018779 54.239.132.147 -> 172.31.8.238 TCP 26130 [TCP segment of a reassembled PDU]
101   0.018791 172.31.8.238 -> 54.239.132.147 TCP 66 60008 > http [ACK] Seq=98 Ack=580267 Win=1021312 Len=0 TSval=15942830 TSecr=1689142550
102   0.018856 54.239.132.147 -> 172.31.8.238 TCP 26130 [TCP segment of a reassembled PDU]
103   0.018870 172.31.8.238 -> 54.239.132.147 TCP 66 60008 > http [ACK] Seq=98 Ack=606331 Win=1073408 Len=0 TSval=15942830 TSecr=1689142550
104   0.018903 54.239.132.147 -> 172.31.8.238 TCP 1514 [TCP segment of a reassembled PDU]
105   0.018906 172.31.8.238 -> 54.239.132.147 TCP 66 60008 > http [ACK] Seq=98 Ack=607779 Win=1076352 Len=0 TSval=15942830 TSecr=1689142550
106   0.019366 54.239.132.147 -> 172.31.8.238 TCP 8754 [TCP segment of a reassembled PDU]
107   0.019374 172.31.8.238 -> 54.239.132.147 TCP 66 60008 > http [ACK] Seq=98 Ack=616467 Win=1093760 Len=0 TSval=15942830 TSecr=1689142550
108   0.019544 54.239.132.147 -> 172.31.8.238 TCP 26130 [TCP segment of a reassembled PDU]
109   0.019558 54.239.132.147 -> 172.31.8.238 TCP 1514 [TCP segment of a reassembled PDU]
110   0.019575 172.31.8.238 -> 54.239.132.147 TCP 66 60008 > http [ACK] Seq=98 Ack=643979 Win=1080960 Len=0 TSval=15942831 TSecr=1689142550
111   0.019671 54.239.132.147 -> 172.31.8.238 TCP 4410 [TCP segment of a reassembled PDU]
112   0.019677 172.31.8.238 -> 54.239.132.147 TCP 66 60008 > http [ACK] Seq=98 Ack=648323 Win=1102336 Len=0 TSval=15942831 TSecr=1689142550
113   0.019807 54.239.132.147 -> 172.31.8.238 TCP 20338 [TCP segment of a reassembled PDU]
114   0.019827 172.31.8.238 -> 54.239.132.147 TCP 66 60008 > http [ACK] Seq=98 Ack=668595 Win=1092992 Len=0 TSval=15942831 TSecr=1689142550
115   0.019839 54.239.132.147 -> 172.31.8.238 TCP 5858 [TCP segment of a reassembled PDU]
116   0.019853 172.31.8.238 -> 54.239.132.147 TCP 66 60008 > http [ACK] Seq=98 Ack=674387 Win=1102336 Len=0 TSval=15942831 TSecr=1689142550
117   0.019905 54.239.132.147 -> 172.31.8.238 TCP 14546 [TCP segment of a reassembled PDU]
118   0.019914 172.31.8.238 -> 54.239.132.147 TCP 66 60008 > http [ACK] Seq=98 Ack=688867 Win=1102464 Len=0 TSval=15942831 TSecr=1689142550
119   0.020391 54.239.132.147 -> 172.31.8.238 TCP 8754 [TCP segment of a reassembled PDU]
120   0.020398 172.31.8.238 -> 54.239.132.147 TCP 66 60008 > http [ACK] Seq=98 Ack=697555 Win=1112064 Len=0 TSval=15942831 TSecr=1689142551
121   0.020571 54.239.132.147 -> 172.31.8.238 TCP 26130 [TCP segment of a reassembled PDU]
122   0.020606 172.31.8.238 -> 54.239.132.147 TCP 66 60008 > http [ACK] Seq=98 Ack=723619 Win=1086080 Len=0 TSval=15942831 TSecr=1689142551
123   0.020661 54.239.132.147 -> 172.31.8.238 TCP 26130 [TCP segment of a reassembled PDU]
124   0.020739 54.239.132.147 -> 172.31.8.238 TCP 24682 [TCP segment of a reassembled PDU]
125   0.020859 172.31.8.238 -> 54.239.132.147 TCP 66 60008 > http [ACK] Seq=98 Ack=774299 Win=1042944 Len=0 TSval=15942831 TSecr=1689142551
126   0.021411 54.239.132.147 -> 172.31.8.238 TCP 2962 [TCP segment of a reassembled PDU]
127   0.021417 172.31.8.238 -> 54.239.132.147 TCP 66 60008 > http [ACK] Seq=98 Ack=777195 Win=1121536 Len=0 TSval=15942831 TSecr=1689142551
128   0.021588 54.239.132.147 -> 172.31.8.238 TCP 26130 [TCP segment of a reassembled PDU]
129   0.021608 172.31.8.238 -> 54.239.132.147 TCP 66 60008 > http [ACK] Seq=98 Ack=803259 Win=1095552 Len=0 TSval=15942831 TSecr=1689142551
130   0.021672 54.239.132.147 -> 172.31.8.238 TCP 26130 [TCP segment of a reassembled PDU]
131   0.021694 172.31.8.238 -> 54.239.132.147 TCP 66 60008 > http [ACK] Seq=98 Ack=829323 Win=1083520 Len=0 TSval=15942831 TSecr=1689142551
132   0.021738 54.239.132.147 -> 172.31.8.238 TCP 10202 [TCP segment of a reassembled PDU]
133   0.021745 172.31.8.238 -> 54.239.132.147 TCP 66 60008 > http [ACK] Seq=98 Ack=839459 Win=1109632 Len=0 TSval=15942831 TSecr=1689142551
134   0.022178 54.239.132.147 -> 172.31.8.238 TCP 2962 [TCP segment of a reassembled PDU]
135   0.022184 172.31.8.238 -> 54.239.132.147 TCP 66 60008 > http [ACK] Seq=98 Ack=842355 Win=1121536 Len=0 TSval=15942831 TSecr=1689142551
136   0.022385 54.239.132.147 -> 172.31.8.238 TCP 26130 [TCP segment of a reassembled PDU]
137   0.022406 172.31.8.238 -> 54.239.132.147 TCP 66 60008 > http [ACK] Seq=98 Ack=868419 Win=1095552 Len=0 TSval=15942831 TSecr=1689142551
138   0.022462 54.239.132.147 -> 172.31.8.238 TCP 23234 [TCP segment of a reassembled PDU]
139   0.022484 172.31.8.238 -> 54.239.132.147 TCP 66 60008 > http [ACK] Seq=98 Ack=891587 Win=1088256 Len=0 TSval=15942831 TSecr=1689142551
140   0.022567 54.239.132.147 -> 172.31.8.238 TCP 2962 [TCP segment of a reassembled PDU]
141   0.022573 172.31.8.238 -> 54.239.132.147 TCP 66 60008 > http [ACK] Seq=98 Ack=894483 Win=1121536 Len=0 TSval=15942831 TSecr=1689142551
142   0.022619 54.239.132.147 -> 172.31.8.238 TCP 10202 [TCP segment of a reassembled PDU]
143   0.022635 172.31.8.238 -> 54.239.132.147 TCP 66 60008 > http [ACK] Seq=98 Ack=904619 Win=1122688 Len=0 TSval=15942831 TSecr=1689142551
144   0.022716 54.239.132.147 -> 172.31.8.238 TCP 37714 [TCP segment of a reassembled PDU]
145   0.022741 172.31.8.238 -> 54.239.132.147 TCP 66 60008 > http [ACK] Seq=98 Ack=942267 Win=1085056 Len=0 TSval=15942831 TSecr=1689142551
146   0.023089 54.239.132.147 -> 172.31.8.238 TCP 26130 [TCP segment of a reassembled PDU]
147   0.023104 54.239.132.147 -> 172.31.8.238 TCP 1514 [TCP segment of a reassembled PDU]
148   0.023114 172.31.8.238 -> 54.239.132.147 TCP 66 60008 > http [ACK] Seq=98 Ack=969779 Win=1080960 Len=0 TSval=15942831 TSecr=1689142551
149   0.023454 54.239.132.147 -> 172.31.8.238 TCP 7306 [TCP segment of a reassembled PDU]
150   0.023460 172.31.8.238 -> 54.239.132.147 TCP 66 60008 > http [ACK] Seq=98 Ack=977019 Win=1114368 Len=0 TSval=15942831 TSecr=1689142551
151   0.023628 54.239.132.147 -> 172.31.8.238 TCP 26130 [TCP segment of a reassembled PDU]
152   0.023651 172.31.8.238 -> 54.239.132.147 TCP 66 60008 > http [ACK] Seq=98 Ack=1003083 Win=1088384 Len=0 TSval=15942832 TSecr=1689142551
153   0.023699 54.239.132.147 -> 172.31.8.238 TCP 26130 [TCP segment of a reassembled PDU]
154   0.023724 172.31.8.238 -> 54.239.132.147 TCP 66 60008 > http [ACK] Seq=98 Ack=1029147 Win=1083520 Len=0 TSval=15942832 TSecr=1689142551
155   0.023781 54.239.132.147 -> 172.31.8.238 TCP 26130 [TCP segment of a reassembled PDU]
156   0.023795 172.31.8.238 -> 54.239.132.147 TCP 66 60008 > http [ACK] Seq=98 Ack=1055211 Win=1083520 Len=0 TSval=15942832 TSecr=1689142551
157   0.023856 54.239.132.147 -> 172.31.8.238 TCP 26130 [TCP segment of a reassembled PDU]
158   0.023869 172.31.8.238 -> 54.239.132.147 TCP 66 60008 > http [ACK] Seq=98 Ack=1081275 Win=1083520 Len=0 TSval=15942832 TSecr=1689142551
159   0.023902 54.239.132.147 -> 172.31.8.238 TCP 1514 [TCP segment of a reassembled PDU]
160   0.024216 54.239.132.147 -> 172.31.8.238 TCP 2962 [TCP segment of a reassembled PDU]
161   0.024222 172.31.8.238 -> 54.239.132.147 TCP 66 60008 > http [ACK] Seq=98 Ack=1085619 Win=1121536 Len=0 TSval=15942832 TSecr=1689142551
162   0.024380 54.239.132.147 -> 172.31.8.238 TCP 14546 [TCP segment of a reassembled PDU]
163   0.024401 172.31.8.238 -> 54.239.132.147 TCP 66 60008 > http [ACK] Seq=98 Ack=1100099 Win=1122688 Len=0 TSval=15942832 TSecr=1689142551
164   0.024646 54.239.132.147 -> 172.31.8.238 TCP 17442 [TCP segment of a reassembled PDU]
165   0.024667 172.31.8.238 -> 54.239.132.147 TCP 66 60008 > http [ACK] Seq=98 Ack=1117475 Win=1105408 Len=0 TSval=15942832 TSecr=1689142551
166   0.024681 54.239.132.147 -> 172.31.8.238 TCP 8754 [TCP segment of a reassembled PDU]
167   0.024695 172.31.8.238 -> 54.239.132.147 TCP 66 60008 > http [ACK] Seq=98 Ack=1126163 Win=1122688 Len=0 TSval=15942832 TSecr=1689142551
168   0.024771 54.239.132.147 -> 172.31.8.238 TCP 26130 [TCP segment of a reassembled PDU]
169   0.024797 172.31.8.238 -> 54.239.132.147 TCP 66 60008 > http [ACK] Seq=98 Ack=1152227 Win=1096704 Len=0 TSval=15942832 TSecr=1689142551
170   0.024858 54.239.132.147 -> 172.31.8.238 TCP 26130 [TCP segment of a reassembled PDU]
171   0.024884 172.31.8.238 -> 54.239.132.147 TCP 66 60008 > http [ACK] Seq=98 Ack=1178291 Win=1083520 Len=0 TSval=15942832 TSecr=1689142551
172   0.024939 54.239.132.147 -> 172.31.8.238 TCP 29026 [TCP segment of a reassembled PDU]
173   0.025083 172.31.8.238 -> 54.239.132.147 TCP 66 60008 > http [ACK] Seq=98 Ack=1207251 Win=1078656 Len=0 TSval=15942832 TSecr=1689142551
174   0.025369 54.239.132.147 -> 172.31.8.238 TCP 23234 [TCP segment of a reassembled PDU]
175   0.025380 172.31.8.238 -> 54.239.132.147 TCP 66 60008 > http [ACK] Seq=98 Ack=1230419 Win=1088256 Len=0 TSval=15942832 TSecr=1689142551
176   0.025681 54.239.132.147 -> 172.31.8.238 TCP 26130 [TCP segment of a reassembled PDU]
177   0.025705 172.31.8.238 -> 54.239.132.147 TCP 66 60008 > http [ACK] Seq=98 Ack=1256483 Win=1083520 Len=0 TSval=15942832 TSecr=1689142551
178   0.025754 54.239.132.147 -> 172.31.8.238 TCP 26130 [TCP segment of a reassembled PDU]
179   0.025767 172.31.8.238 -> 54.239.132.147 TCP 66 60008 > http [ACK] Seq=98 Ack=1282547 Win=1083520 Len=0 TSval=15942832 TSecr=1689142551
180   0.025816 54.239.132.147 -> 172.31.8.238 TCP 13098 [TCP segment of a reassembled PDU]
181   0.025824 172.31.8.238 -> 54.239.132.147 TCP 66 60008 > http [ACK] Seq=98 Ack=1295579 Win=1104896 Len=0 TSval=15942832 TSecr=1689142551
182   0.026122 54.239.132.147 -> 172.31.8.238 TCP 23234 [TCP segment of a reassembled PDU]
183   0.026146 172.31.8.238 -> 54.239.132.147 TCP 66 60008 > http [ACK] Seq=98 Ack=1318747 Win=1088256 Len=0 TSval=15942832 TSecr=1689142551
184   0.026280 54.239.132.147 -> 172.31.8.238 TCP 26130 [TCP segment of a reassembled PDU]
185   0.026305 172.31.8.238 -> 54.239.132.147 TCP 66 60008 > http [ACK] Seq=98 Ack=1344811 Win=1083520 Len=0 TSval=15942832 TSecr=1689142551
186   0.026418 54.239.132.147 -> 172.31.8.238 TCP 26130 [TCP segment of a reassembled PDU]
187   0.026431 172.31.8.238 -> 54.239.132.147 TCP 66 60008 > http [ACK] Seq=98 Ack=1370875 Win=1083520 Len=0 TSval=15942832 TSecr=1689142551
188   0.026472 54.239.132.147 -> 172.31.8.238 TCP 26130 [TCP segment of a reassembled PDU]
189   0.026487 172.31.8.238 -> 54.239.132.147 TCP 66 60008 > http [ACK] Seq=98 Ack=1396939 Win=1083520 Len=0 TSval=15942832 TSecr=1689142551
190   0.026535 54.239.132.147 -> 172.31.8.238 TCP 20338 [TCP segment of a reassembled PDU]
191   0.026546 172.31.8.238 -> 54.239.132.147 TCP 66 60008 > http [ACK] Seq=98 Ack=1417211 Win=1092992 Len=0 TSval=15942832 TSecr=1689142551
192   0.026636 54.239.132.147 -> 172.31.8.238 TCP 8754 [TCP segment of a reassembled PDU]
193   0.026685 172.31.8.238 -> 54.239.132.147 TCP 66 60008 > http [ACK] Seq=98 Ack=1425899 Win=1084416 Len=0 TSval=15942832 TSecr=1689142551
194   0.026881 54.239.132.147 -> 172.31.8.238 TCP 8754 [TCP segment of a reassembled PDU]
195   0.026889 172.31.8.238 -> 54.239.132.147 TCP 66 60008 > http [ACK] Seq=98 Ack=1434587 Win=1112064 Len=0 TSval=15942832 TSecr=1689142551
196   0.027052 54.239.132.147 -> 172.31.8.238 TCP 24682 [TCP segment of a reassembled PDU]
197   0.027076 172.31.8.238 -> 54.239.132.147 TCP 66 60008 > http [ACK] Seq=98 Ack=1459203 Win=1087488 Len=0 TSval=15942832 TSecr=1689142551
198   0.027230 54.239.132.147 -> 172.31.8.238 TCP 53642 [TCP segment of a reassembled PDU]
199   0.027256 54.239.132.147 -> 172.31.8.238 TCP 8754 [TCP segment of a reassembled PDU]
200   0.027274 172.31.8.238 -> 54.239.132.147 TCP 66 60008 > http [ACK] Seq=98 Ack=1521467 Win=1025280 Len=0 TSval=15942832 TSecr=1689142551
201   0.027306 54.239.132.147 -> 172.31.8.238 TCP 17442 [TCP segment of a reassembled PDU]
202   0.027320 172.31.8.238 -> 54.239.132.147 TCP 66 60008 > http [ACK] Seq=98 Ack=1538843 Win=1097728 Len=0 TSval=15942832 TSecr=1689142551
203   0.027381 54.239.132.147 -> 172.31.8.238 TCP 17442 [TCP segment of a reassembled PDU]
204   0.027391 172.31.8.238 -> 54.239.132.147 TCP 66 60008 > http [ACK] Seq=98 Ack=1556219 Win=1097728 Len=0 TSval=15942832 TSecr=1689142551
205   0.027782 54.239.132.147 -> 172.31.8.238 TCP 18890 [TCP segment of a reassembled PDU]
206   0.027811 54.239.132.147 -> 172.31.8.238 TCP 7306 [TCP segment of a reassembled PDU]
207   0.027817 172.31.8.238 -> 54.239.132.147 TCP 66 60008 > http [ACK] Seq=98 Ack=1575043 Win=1122688 Len=0 TSval=15942833 TSecr=1689142551
208   0.027821 172.31.8.238 -> 54.239.132.147 TCP 66 60008 > http [ACK] Seq=98 Ack=1582283 Win=1137152 Len=0 TSval=15942833 TSecr=1689142551
209   0.027981 54.239.132.147 -> 172.31.8.238 TCP 39162 [TCP segment of a reassembled PDU]
210   0.027997 172.31.8.238 -> 54.239.132.147 TCP 66 60008 > http [ACK] Seq=98 Ack=1621379 Win=1215360 Len=0 TSval=15942833 TSecr=1689142551
211   0.028212 54.239.132.147 -> 172.31.8.238 TCP 17442 [TCP segment of a reassembled PDU]
212   0.028223 172.31.8.238 -> 54.239.132.147 TCP 66 60008 > http [ACK] Seq=98 Ack=1638755 Win=1250176 Len=0 TSval=15942833 TSecr=1689142551
213   0.028371 54.239.132.147 -> 172.31.8.238 TCP 26130 [TCP segment of a reassembled PDU]
214   0.028385 172.31.8.238 -> 54.239.132.147 TCP 66 60008 > http [ACK] Seq=98 Ack=1664819 Win=1302272 Len=0 TSval=15942833 TSecr=1689142551
215   0.028431 54.239.132.147 -> 172.31.8.238 TCP 18890 [TCP segment of a reassembled PDU]
216   0.028442 172.31.8.238 -> 54.239.132.147 TCP 66 60008 > http [ACK] Seq=98 Ack=1683643 Win=1339904 Len=0 TSval=15942833 TSecr=1689142551
217   0.028470 54.239.132.147 -> 172.31.8.238 TCP 2962 [TCP segment of a reassembled PDU]
218   0.028474 172.31.8.238 -> 54.239.132.147 TCP 66 60008 > http [ACK] Seq=98 Ack=1686539 Win=1345664 Len=0 TSval=15942833 TSecr=1689142551
219   0.028732 54.239.132.147 -> 172.31.8.238 TCP 13098 [TCP segment of a reassembled PDU]
220   0.028741 172.31.8.238 -> 54.239.132.147 TCP 66 60008 > http [ACK] Seq=98 Ack=1699571 Win=1371776 Len=0 TSval=15942833 TSecr=1689142551
221   0.028911 54.239.132.147 -> 172.31.8.238 TCP 26130 [TCP segment of a reassembled PDU]
222   0.028924 172.31.8.238 -> 54.239.132.147 TCP 66 60008 > http [ACK] Seq=98 Ack=1725635 Win=1423872 Len=0 TSval=15942833 TSecr=1689142551
223   0.028975 54.239.132.147 -> 172.31.8.238 TCP 20338 [TCP segment of a reassembled PDU]
224   0.028986 172.31.8.238 -> 54.239.132.147 TCP 66 60008 > http [ACK] Seq=98 Ack=1745907 Win=1464448 Len=0 TSval=15942833 TSecr=1689142551
225   0.029019 54.239.132.147 -> 172.31.8.238 TCP 5858 [TCP segment of a reassembled PDU]
226   0.029024 172.31.8.238 -> 54.239.132.147 TCP 66 60008 > http [ACK] Seq=98 Ack=1751699 Win=1476096 Len=0 TSval=15942833 TSecr=1689142551
227   0.029301 54.239.132.147 -> 172.31.8.238 TCP 26130 [TCP segment of a reassembled PDU]
228   0.029315 172.31.8.238 -> 54.239.132.147 TCP 66 60008 > http [ACK] Seq=98 Ack=1777763 Win=1528192 Len=0 TSval=15942833 TSecr=1689142551
229   0.029372 54.239.132.147 -> 172.31.8.238 TCP 26130 [TCP segment of a reassembled PDU]
230   0.029386 172.31.8.238 -> 54.239.132.147 TCP 66 60008 > http [ACK] Seq=98 Ack=1803827 Win=1580288 Len=0 TSval=15942833 TSecr=1689142551
231   0.029434 54.239.132.147 -> 172.31.8.238 TCP 13098 [TCP segment of a reassembled PDU]
232   0.029443 172.31.8.238 -> 54.239.132.147 TCP 66 60008 > http [ACK] Seq=98 Ack=1816859 Win=1580288 Len=0 TSval=15942833 TSecr=1689142551
233   0.029627 54.239.132.147 -> 172.31.8.238 TCP 26130 [TCP segment of a reassembled PDU]
234   0.029640 172.31.8.238 -> 54.239.132.147 TCP 66 60008 > http [ACK] Seq=98 Ack=1842923 Win=1580288 Len=0 TSval=15942833 TSecr=1689142551
235   0.029695 54.239.132.147 -> 172.31.8.238 TCP 23234 [TCP segment of a reassembled PDU]
236   0.029706 172.31.8.238 -> 54.239.132.147 TCP 66 60008 > http [ACK] Seq=98 Ack=1866091 Win=1580288 Len=0 TSval=15942833 TSecr=1689142551
237   0.029774 54.239.132.147 -> 172.31.8.238 TCP 15994 [TCP segment of a reassembled PDU]
238   0.029783 172.31.8.238 -> 54.239.132.147 TCP 66 60008 > http [ACK] Seq=98 Ack=1882019 Win=1580288 Len=0 TSval=15942833 TSecr=1689142551
239   0.029859 54.239.132.147 -> 172.31.8.238 TCP 26130 [TCP segment of a reassembled PDU]
240   0.029871 172.31.8.238 -> 54.239.132.147 TCP 66 60008 > http [ACK] Seq=98 Ack=1908083 Win=1580288 Len=0 TSval=15942833 TSecr=1689142551
241   0.029936 54.239.132.147 -> 172.31.8.238 TCP 20338 [TCP segment of a reassembled PDU]
242   0.029950 172.31.8.238 -> 54.239.132.147 TCP 66 60008 > http [ACK] Seq=98 Ack=1928355 Win=1580288 Len=0 TSval=15942833 TSecr=1689142551
243   0.029977 54.239.132.147 -> 172.31.8.238 TCP 5858 [TCP segment of a reassembled PDU]
244   0.029982 172.31.8.238 -> 54.239.132.147 TCP 66 60008 > http [ACK] Seq=98 Ack=1934147 Win=1580288 Len=0 TSval=15942833 TSecr=1689142551
245   0.030031 54.239.132.147 -> 172.31.8.238 TCP 13098 [TCP segment of a reassembled PDU]
246   0.030039 172.31.8.238 -> 54.239.132.147 TCP 66 60008 > http [ACK] Seq=98 Ack=1947179 Win=1580288 Len=0 TSval=15942833 TSecr=1689142551
247   0.030472 54.239.132.147 -> 172.31.8.238 TCP 5858 [TCP segment of a reassembled PDU]
248   0.030478 172.31.8.238 -> 54.239.132.147 TCP 66 60008 > http [ACK] Seq=98 Ack=1952971 Win=1580288 Len=0 TSval=15942833 TSecr=1689142552
249   0.030663 54.239.132.147 -> 172.31.8.238 TCP 26130 [TCP segment of a reassembled PDU]
250   0.030675 172.31.8.238 -> 54.239.132.147 TCP 66 60008 > http [ACK] Seq=98 Ack=1979035 Win=1580288 Len=0 TSval=15942833 TSecr=1689142552
251   0.030731 54.239.132.147 -> 172.31.8.238 TCP 26130 [TCP segment of a reassembled PDU]
252   0.030744 172.31.8.238 -> 54.239.132.147 TCP 66 60008 > http [ACK] Seq=98 Ack=2005099 Win=1580288 Len=0 TSval=15942833 TSecr=1689142552
253   0.030831 54.239.132.147 -> 172.31.8.238 TCP 26130 [TCP segment of a reassembled PDU]
254   0.030843 172.31.8.238 -> 54.239.132.147 TCP 66 60008 > http [ACK] Seq=98 Ack=2031163 Win=1580288 Len=0 TSval=15942833 TSecr=1689142552
255   0.030922 54.239.132.147 -> 172.31.8.238 TCP 26130 [TCP segment of a reassembled PDU]
256   0.030935 172.31.8.238 -> 54.239.132.147 TCP 66 60008 > http [ACK] Seq=98 Ack=2057227 Win=1580288 Len=0 TSval=15942833 TSecr=1689142552
257   0.030989 54.239.132.147 -> 172.31.8.238 TCP 20338 [TCP segment of a reassembled PDU]
258   0.030997 172.31.8.238 -> 54.239.132.147 TCP 66 60008 > http [ACK] Seq=98 Ack=2077499 Win=1580288 Len=0 TSval=15942833 TSecr=1689142552
259   0.031374 54.239.132.147 -> 172.31.8.238 TCP 4410 [TCP segment of a reassembled PDU]
260   0.031380 172.31.8.238 -> 54.239.132.147 TCP 66 60008 > http [ACK] Seq=98 Ack=2081843 Win=1580288 Len=0 TSval=15942833 TSecr=1689142552
261   0.031555 54.239.132.147 -> 172.31.8.238 TCP 26130 [TCP segment of a reassembled PDU]
262   0.031567 172.31.8.238 -> 54.239.132.147 TCP 66 60008 > http [ACK] Seq=98 Ack=2107907 Win=1580288 Len=0 TSval=15942833 TSecr=1689142552
263   0.031628 54.239.132.147 -> 172.31.8.238 TCP 26130 [TCP segment of a reassembled PDU]
264   0.031640 172.31.8.238 -> 54.239.132.147 TCP 66 60008 > http [ACK] Seq=98 Ack=2133971 Win=1580288 Len=0 TSval=15942834 TSecr=1689142552
265   0.031773 54.239.132.147 -> 172.31.8.238 TCP 26130 [TCP segment of a reassembled PDU]
266   0.031784 172.31.8.238 -> 54.239.132.147 TCP 66 60008 > http [ACK] Seq=98 Ack=2160035 Win=1580288 Len=0 TSval=15942834 TSecr=1689142552
267   0.031800 54.239.132.147 -> 172.31.8.238 TCP 26130 [TCP segment of a reassembled PDU]
268   0.031815 172.31.8.238 -> 54.239.132.147 TCP 66 60008 > http [ACK] Seq=98 Ack=2186099 Win=1580288 Len=0 TSval=15942834 TSecr=1689142552
269   0.031896 54.239.132.147 -> 172.31.8.238 TCP 21786 [TCP segment of a reassembled PDU]
270   0.031906 172.31.8.238 -> 54.239.132.147 TCP 66 60008 > http [ACK] Seq=98 Ack=2207819 Win=1580288 Len=0 TSval=15942834 TSecr=1689142552
271   0.031943 54.239.132.147 -> 172.31.8.238 TCP 4410 [TCP segment of a reassembled PDU]
272   0.031948 172.31.8.238 -> 54.239.132.147 TCP 66 60008 > http [ACK] Seq=98 Ack=2212163 Win=1580288 Len=0 TSval=15942834 TSecr=1689142552
273   0.032105 54.239.132.147 -> 172.31.8.238 TCP 26130 [TCP segment of a reassembled PDU]
274   0.032116 172.31.8.238 -> 54.239.132.147 TCP 66 60008 > http [ACK] Seq=98 Ack=2238227 Win=1580288 Len=0 TSval=15942834 TSecr=1689142552
275   0.032178 54.239.132.147 -> 172.31.8.238 TCP 26130 [TCP segment of a reassembled PDU]
276   0.032189 172.31.8.238 -> 54.239.132.147 TCP 66 60008 > http [ACK] Seq=98 Ack=2264291 Win=1580288 Len=0 TSval=15942834 TSecr=1689142552
277   0.032236 54.239.132.147 -> 172.31.8.238 TCP 8754 [TCP segment of a reassembled PDU]
278   0.032243 172.31.8.238 -> 54.239.132.147 TCP 66 60008 > http [ACK] Seq=98 Ack=2272979 Win=1580288 Len=0 TSval=15942834 TSecr=1689142552
279   0.032539 54.239.132.147 -> 172.31.8.238 TCP 23234 [TCP segment of a reassembled PDU]
280   0.032550 172.31.8.238 -> 54.239.132.147 TCP 66 60008 > http [ACK] Seq=98 Ack=2296147 Win=1580288 Len=0 TSval=15942834 TSecr=1689142552
281   0.032690 54.239.132.147 -> 172.31.8.238 TCP 26130 [TCP segment of a reassembled PDU]
282   0.032700 172.31.8.238 -> 54.239.132.147 TCP 66 60008 > http [ACK] Seq=98 Ack=2322211 Win=1580288 Len=0 TSval=15942834 TSecr=1689142552
283   0.032774 54.239.132.147 -> 172.31.8.238 TCP 26130 [TCP segment of a reassembled PDU]
284   0.032783 172.31.8.238 -> 54.239.132.147 TCP 66 60008 > http [ACK] Seq=98 Ack=2348275 Win=1580288 Len=0 TSval=15942834 TSecr=1689142552
285   0.032856 54.239.132.147 -> 172.31.8.238 TCP 26130 [TCP segment of a reassembled PDU]
286   0.032865 172.31.8.238 -> 54.239.132.147 TCP 66 60008 > http [ACK] Seq=98 Ack=2374339 Win=1580288 Len=0 TSval=15942834 TSecr=1689142552
287   0.032940 54.239.132.147 -> 172.31.8.238 TCP 26130 [TCP segment of a reassembled PDU]
288   0.032951 172.31.8.238 -> 54.239.132.147 TCP 66 60008 > http [ACK] Seq=98 Ack=2400403 Win=1580288 Len=0 TSval=15942834 TSecr=1689142552
289   0.033056 54.239.132.147 -> 172.31.8.238 TCP 26130 [TCP segment of a reassembled PDU]
290   0.033079 172.31.8.238 -> 54.239.132.147 TCP 66 60008 > http [ACK] Seq=98 Ack=2426467 Win=1580288 Len=0 TSval=15942834 TSecr=1689142552
291   0.033153 54.239.132.147 -> 172.31.8.238 TCP 26130 [TCP segment of a reassembled PDU]
292   0.033161 172.31.8.238 -> 54.239.132.147 TCP 66 60008 > http [ACK] Seq=98 Ack=2452531 Win=1580288 Len=0 TSval=15942834 TSecr=1689142552
293   0.033223 54.239.132.147 -> 172.31.8.238 TCP 15994 [TCP segment of a reassembled PDU]
294   0.033229 172.31.8.238 -> 54.239.132.147 TCP 66 60008 > http [ACK] Seq=98 Ack=2468459 Win=1580288 Len=0 TSval=15942834 TSecr=1689142552
295   0.033613 54.239.132.147 -> 172.31.8.238 TCP 10202 [TCP segment of a reassembled PDU]
296   0.033620 172.31.8.238 -> 54.239.132.147 TCP 66 60008 > http [ACK] Seq=98 Ack=2478595 Win=1580288 Len=0 TSval=15942834 TSecr=1689142552
297   0.033644 54.239.132.147 -> 172.31.8.238 TCP 1514 [TCP Previous segment not captured] [TCP segment of a reassembled PDU]
298   0.033648 172.31.8.238 -> 54.239.132.147 TCP 78 [TCP Dup ACK 296#1] 60008 > http [ACK] Seq=98 Ack=2478595 Win=1580288 Len=0 TSval=15942834 TSecr=1689142552 SLE=2480043 SRE=2481491
299   0.033703 54.239.132.147 -> 172.31.8.238 TCP 1514 [TCP Out-Of-Order] [TCP segment of a reassembled PDU]
300   0.033708 172.31.8.238 -> 54.239.132.147 TCP 66 60008 > http [ACK] Seq=98 Ack=2481491 Win=1580288 Len=0 TSval=15942834 TSecr=1689142552
301   0.033866 54.239.132.147 -> 172.31.8.238 TCP 26130 [TCP segment of a reassembled PDU]
302   0.033876 172.31.8.238 -> 54.239.132.147 TCP 66 60008 > http [ACK] Seq=98 Ack=2507555 Win=1580288 Len=0 TSval=15942834 TSecr=1689142552
303   0.033884 54.239.132.147 -> 172.31.8.238 TCP 7306 [TCP segment of a reassembled PDU]
304   0.033890 172.31.8.238 -> 54.239.132.147 TCP 66 60008 > http [ACK] Seq=98 Ack=2514795 Win=1580288 Len=0 TSval=15942834 TSecr=1689142552
305   0.034015 54.239.132.147 -> 172.31.8.238 TCP 44954 [TCP segment of a reassembled PDU]
306   0.034029 172.31.8.238 -> 54.239.132.147 TCP 66 60008 > http [ACK] Seq=98 Ack=2559683 Win=1580288 Len=0 TSval=15942834 TSecr=1689142552
307   0.034061 54.239.132.147 -> 172.31.8.238 TCP 10202 [TCP segment of a reassembled PDU]
308   0.034067 172.31.8.238 -> 54.239.132.147 TCP 66 60008 > http [ACK] Seq=98 Ack=2569819 Win=1580288 Len=0 TSval=15942834 TSecr=1689142552
309   0.034171 54.239.132.147 -> 172.31.8.238 TCP 42058 [TCP segment of a reassembled PDU]
310   0.034181 172.31.8.238 -> 54.239.132.147 TCP 66 60008 > http [ACK] Seq=98 Ack=2611811 Win=1580288 Len=0 TSval=15942834 TSecr=1689142552
311   0.034219 54.239.132.147 -> 172.31.8.238 TCP 10202 [TCP segment of a reassembled PDU]
312   0.034224 172.31.8.238 -> 54.239.132.147 TCP 66 60008 > http [ACK] Seq=98 Ack=2621947 Win=1580288 Len=0 TSval=15942834 TSecr=1689142552
313   0.034318 54.239.132.147 -> 172.31.8.238 TCP 42058 [TCP segment of a reassembled PDU]
314   0.034327 172.31.8.238 -> 54.239.132.147 TCP 66 60008 > http [ACK] Seq=98 Ack=2663939 Win=1580288 Len=0 TSval=15942834 TSecr=1689142552
315   0.034358 54.239.132.147 -> 172.31.8.238 TCP 4410 [TCP segment of a reassembled PDU]
316   0.034361 172.31.8.238 -> 54.239.132.147 TCP 66 60008 > http [ACK] Seq=98 Ack=2668283 Win=1580288 Len=0 TSval=15942834 TSecr=1689142552
317   0.034757 54.239.132.147 -> 172.31.8.238 TCP 2962 [TCP segment of a reassembled PDU]
318   0.034762 172.31.8.238 -> 54.239.132.147 TCP 66 60008 > http [ACK] Seq=98 Ack=2671179 Win=1580288 Len=0 TSval=15942834 TSecr=1689142552
319   0.034935 54.239.132.147 -> 172.31.8.238 TCP 26130 [TCP segment of a reassembled PDU]
320   0.034943 172.31.8.238 -> 54.239.132.147 TCP 66 60008 > http [ACK] Seq=98 Ack=2697243 Win=1580288 Len=0 TSval=15942834 TSecr=1689142552
321   0.035017 54.239.132.147 -> 172.31.8.238 TCP 26130 [TCP segment of a reassembled PDU]
322   0.035025 172.31.8.238 -> 54.239.132.147 TCP 66 60008 > http [ACK] Seq=98 Ack=2723307 Win=1580288 Len=0 TSval=15942834 TSecr=1689142552
323   0.035099 54.239.132.147 -> 172.31.8.238 TCP 26130 [TCP segment of a reassembled PDU]
324   0.035113 172.31.8.238 -> 54.239.132.147 TCP 66 60008 > http [ACK] Seq=98 Ack=2749371 Win=1580288 Len=0 TSval=15942834 TSecr=1689142552
325   0.035180 54.239.132.147 -> 172.31.8.238 TCP 26130 [TCP segment of a reassembled PDU]
326   0.035189 172.31.8.238 -> 54.239.132.147 TCP 66 60008 > http [ACK] Seq=98 Ack=2775435 Win=1580288 Len=0 TSval=15942834 TSecr=1689142552
327   0.035260 54.239.132.147 -> 172.31.8.238 TCP 26130 [TCP segment of a reassembled PDU]
328   0.035267 172.31.8.238 -> 54.239.132.147 TCP 66 60008 > http [ACK] Seq=98 Ack=2801499 Win=1580288 Len=0 TSval=15942834 TSecr=1689142552
329   0.035341 54.239.132.147 -> 172.31.8.238 TCP 26130 [TCP segment of a reassembled PDU]
330   0.035348 172.31.8.238 -> 54.239.132.147 TCP 66 60008 > http [ACK] Seq=98 Ack=2827563 Win=1580288 Len=0 TSval=15942834 TSecr=1689142552
331   0.035420 54.239.132.147 -> 172.31.8.238 TCP 26130 [TCP segment of a reassembled PDU]
332   0.035427 172.31.8.238 -> 54.239.132.147 TCP 66 60008 > http [ACK] Seq=98 Ack=2853627 Win=1580288 Len=0 TSval=15942834 TSecr=1689142552
333   0.035465 54.239.132.147 -> 172.31.8.238 TCP 5858 [TCP segment of a reassembled PDU]
334   0.035469 172.31.8.238 -> 54.239.132.147 TCP 66 60008 > http [ACK] Seq=98 Ack=2859419 Win=1580288 Len=0 TSval=15942834 TSecr=1689142552
335   0.035770 54.239.132.147 -> 172.31.8.238 TCP 26130 [TCP segment of a reassembled PDU]
336   0.035779 172.31.8.238 -> 54.239.132.147 TCP 66 60008 > http [ACK] Seq=98 Ack=2885483 Win=1580288 Len=0 TSval=15942835 TSecr=1689142552
337   0.035838 54.239.132.147 -> 172.31.8.238 TCP 26130 [TCP segment of a reassembled PDU]
338   0.035845 172.31.8.238 -> 54.239.132.147 TCP 66 60008 > http [ACK] Seq=98 Ack=2911547 Win=1580288 Len=0 TSval=15942835 TSecr=1689142552
339   0.035900 54.239.132.147 -> 172.31.8.238 TCP 13098 [TCP segment of a reassembled PDU]
340   0.035905 172.31.8.238 -> 54.239.132.147 TCP 66 60008 > http [ACK] Seq=98 Ack=2924579 Win=1580288 Len=0 TSval=15942835 TSecr=1689142552
341   0.036216 54.239.132.147 -> 172.31.8.238 TCP 23234 [TCP segment of a reassembled PDU]
342   0.036224 172.31.8.238 -> 54.239.132.147 TCP 66 60008 > http [ACK] Seq=98 Ack=2947747 Win=1580288 Len=0 TSval=15942835 TSecr=1689142552
343   0.036344 54.239.132.147 -> 172.31.8.238 TCP 29026 [TCP segment of a reassembled PDU]
344   0.036353 172.31.8.238 -> 54.239.132.147 TCP 66 60008 > http [ACK] Seq=98 Ack=2976707 Win=1580288 Len=0 TSval=15942835 TSecr=1689142552
345   0.036371 54.239.132.147 -> 172.31.8.238 TCP 26130 [TCP segment of a reassembled PDU]
