[Measurement for 10mb at 12:42:24 20.42.2014] 
Tshark:

  1   0.000000 172.31.8.238 -> 172.31.0.2   DNS 89 Standard query 0x3ec5  A d1xzxs93r3iphc.cloudfront.net
  2   0.000038 172.31.8.238 -> 172.31.0.2   DNS 89 Standard query 0x9070  AAAA d1xzxs93r3iphc.cloudfront.net
  3   0.000876   172.31.0.2 -> 172.31.8.238 DNS 170 Standard query response 0x9070 
  4   0.000889   172.31.0.2 -> 172.31.8.238 DNS 217 Standard query response 0x3ec5  A 54.230.117.50 A 54.230.117.87 A 54.230.119.18 A 54.239.132.41 A 54.239.132.86 A 54.239.132.147 A 54.239.132.173 A 54.230.117.21
  5   0.003884 172.31.8.238 -> 54.230.117.50 TCP 74 51961 > http [SYN] Seq=0 Win=26883 Len=0 MSS=8961 SACK_PERM=1 TSval=17743009 TSecr=0 WS=128
  6   0.004464 54.230.117.50 -> 172.31.8.238 TCP 74 http > 51961 [SYN, ACK] Seq=0 Ack=1 Win=14480 Len=0 MSS=1460 SACK_PERM=1 TSval=1689056733 TSecr=17743009 WS=128
  7   0.004477 172.31.8.238 -> 54.230.117.50 TCP 66 51961 > http [ACK] Seq=1 Ack=1 Win=27008 Len=0 TSval=17743009 TSecr=1689056733
  8   0.004525 172.31.8.238 -> 54.230.117.50 HTTP 163 GET /10mb HTTP/1.1 
  9   0.005203 54.230.117.50 -> 172.31.8.238 TCP 66 http > 51961 [ACK] Seq=1 Ack=98 Win=14592 Len=0 TSval=1689056733 TSecr=17743009
 10   0.007738 54.230.117.50 -> 172.31.8.238 TCP 524 [TCP segment of a reassembled PDU]
 11   0.007745 172.31.8.238 -> 54.230.117.50 TCP 66 51961 > http [ACK] Seq=98 Ack=459 Win=28032 Len=0 TSval=17743010 TSecr=1689056733
 12   0.007823 54.230.117.50 -> 172.31.8.238 TCP 13098 [TCP segment of a reassembled PDU]
 13   0.007834 172.31.8.238 -> 54.230.117.50 TCP 66 51961 > http [ACK] Seq=98 Ack=13491 Win=54144 Len=0 TSval=17743010 TSecr=1689056733
 14   0.008559 54.230.117.50 -> 172.31.8.238 TCP 8754 [TCP segment of a reassembled PDU]
 15   0.008567 172.31.8.238 -> 54.230.117.50 TCP 66 51961 > http [ACK] Seq=98 Ack=22179 Win=71424 Len=0 TSval=17743010 TSecr=1689056733
 16   0.008623 54.230.117.50 -> 172.31.8.238 TCP 4410 [TCP segment of a reassembled PDU]
 17   0.008629 172.31.8.238 -> 54.230.117.50 TCP 66 51961 > http [ACK] Seq=98 Ack=26523 Win=80128 Len=0 TSval=17743010 TSecr=1689056733
 18   0.009077 54.230.117.50 -> 172.31.8.238 TCP 4410 [TCP segment of a reassembled PDU]
 19   0.009083 172.31.8.238 -> 54.230.117.50 TCP 66 51961 > http [ACK] Seq=98 Ack=30867 Win=88832 Len=0 TSval=17743010 TSecr=1689056733
 20   0.009205 54.230.117.50 -> 172.31.8.238 TCP 15994 [TCP segment of a reassembled PDU]
 21   0.009216 172.31.8.238 -> 54.230.117.50 TCP 66 51961 > http [ACK] Seq=98 Ack=46795 Win=91648 Len=0 TSval=17743011 TSecr=1689056733
 22   0.009566 54.230.117.50 -> 172.31.8.238 TCP 5858 [TCP segment of a reassembled PDU]
 23   0.009573 172.31.8.238 -> 54.230.117.50 TCP 66 51961 > http [ACK] Seq=98 Ack=52587 Win=120704 Len=0 TSval=17743011 TSecr=1689056733
 24   0.009910 54.230.117.50 -> 172.31.8.238 TCP 7306 [TCP segment of a reassembled PDU]
 25   0.009918 172.31.8.238 -> 54.230.117.50 TCP 66 51961 > http [ACK] Seq=98 Ack=59827 Win=135168 Len=0 TSval=17743011 TSecr=1689056733
 26   0.009956 54.230.117.50 -> 172.31.8.238 TCP 5858 [TCP segment of a reassembled PDU]
 27   0.009962 172.31.8.238 -> 54.230.117.50 TCP 66 51961 > http [ACK] Seq=98 Ack=65619 Win=146688 Len=0 TSval=17743011 TSecr=1689056733
 28   0.010152 54.230.117.50 -> 172.31.8.238 TCP 7306 [TCP segment of a reassembled PDU]
 29   0.010160 172.31.8.238 -> 54.230.117.50 TCP 66 51961 > http [ACK] Seq=98 Ack=72859 Win=161152 Len=0 TSval=17743011 TSecr=1689056733
 30   0.010249 54.230.117.50 -> 172.31.8.238 TCP 4410 [TCP segment of a reassembled PDU]
 31   0.010254 172.31.8.238 -> 54.230.117.50 TCP 66 51961 > http [ACK] Seq=98 Ack=77203 Win=169856 Len=0 TSval=17743011 TSecr=1689056733
 32   0.010578 54.230.117.50 -> 172.31.8.238 TCP 2962 [TCP segment of a reassembled PDU]
 33   0.010584 172.31.8.238 -> 54.230.117.50 TCP 66 51961 > http [ACK] Seq=98 Ack=80099 Win=175616 Len=0 TSval=17743011 TSecr=1689056733
 34   0.010690 54.230.117.50 -> 172.31.8.238 TCP 11650 [TCP segment of a reassembled PDU]
 35   0.010699 172.31.8.238 -> 54.230.117.50 TCP 66 51961 > http [ACK] Seq=98 Ack=91683 Win=188288 Len=0 TSval=17743011 TSecr=1689056733
 36   0.010742 54.230.117.50 -> 172.31.8.238 TCP 10202 [TCP segment of a reassembled PDU]
 37   0.010750 172.31.8.238 -> 54.230.117.50 TCP 66 51961 > http [ACK] Seq=98 Ack=101819 Win=190592 Len=0 TSval=17743011 TSecr=1689056733
 38   0.010874 54.230.117.50 -> 172.31.8.238 TCP 2962 [TCP segment of a reassembled PDU]
 39   0.010879 172.31.8.238 -> 54.230.117.50 TCP 66 51961 > http [ACK] Seq=98 Ack=104715 Win=202496 Len=0 TSval=17743011 TSecr=1689056733
 40   0.011347 54.230.117.50 -> 172.31.8.238 TCP 4410 [TCP segment of a reassembled PDU]
 41   0.011352 172.31.8.238 -> 54.230.117.50 TCP 66 51961 > http [ACK] Seq=98 Ack=109059 Win=200064 Len=0 TSval=17743011 TSecr=1689056733
 42   0.011448 54.230.117.50 -> 172.31.8.238 TCP 8754 [TCP segment of a reassembled PDU]
 43   0.011455 172.31.8.238 -> 54.230.117.50 TCP 66 51961 > http [ACK] Seq=98 Ack=117747 Win=193024 Len=0 TSval=17743011 TSecr=1689056733
 44   0.011552 54.230.117.50 -> 172.31.8.238 TCP 13098 [TCP segment of a reassembled PDU]
 45   0.011561 172.31.8.238 -> 54.230.117.50 TCP 66 51961 > http [ACK] Seq=98 Ack=130779 Win=185856 Len=0 TSval=17743011 TSecr=1689056733
 46   0.011872 54.230.117.50 -> 172.31.8.238 TCP 4410 [TCP segment of a reassembled PDU]
 47   0.011879 172.31.8.238 -> 54.230.117.50 TCP 66 51961 > http [ACK] Seq=98 Ack=135123 Win=200064 Len=0 TSval=17743011 TSecr=1689056733
 48   0.011977 54.230.117.50 -> 172.31.8.238 TCP 8754 [TCP segment of a reassembled PDU]
 49   0.011985 172.31.8.238 -> 54.230.117.50 TCP 66 51961 > http [ACK] Seq=98 Ack=143811 Win=193024 Len=0 TSval=17743011 TSecr=1689056733
 50   0.012169 54.230.117.50 -> 172.31.8.238 TCP 10202 [TCP segment of a reassembled PDU]
 51   0.012177 172.31.8.238 -> 54.230.117.50 TCP 66 51961 > http [ACK] Seq=98 Ack=153947 Win=190592 Len=0 TSval=17743011 TSecr=1689056733
 52   0.012267 54.230.117.50 -> 172.31.8.238 TCP 2962 [TCP segment of a reassembled PDU]
 53   0.012272 172.31.8.238 -> 54.230.117.50 TCP 66 51961 > http [ACK] Seq=98 Ack=156843 Win=202496 Len=0 TSval=17743011 TSecr=1689056733
 54   0.012372 54.230.117.50 -> 172.31.8.238 TCP 13098 [TCP segment of a reassembled PDU]
 55   0.012381 172.31.8.238 -> 54.230.117.50 TCP 66 51961 > http [ACK] Seq=98 Ack=169875 Win=189568 Len=0 TSval=17743011 TSecr=1689056733
 56   0.012730 54.230.117.50 -> 172.31.8.238 TCP 13098 [TCP segment of a reassembled PDU]
 57   0.012739 172.31.8.238 -> 54.230.117.50 TCP 66 51961 > http [ACK] Seq=98 Ack=182907 Win=185856 Len=0 TSval=17743011 TSecr=1689056733
 58   0.012877 54.230.117.50 -> 172.31.8.238 TCP 1514 [TCP segment of a reassembled PDU]
 59   0.012882 172.31.8.238 -> 54.230.117.50 TCP 66 51961 > http [ACK] Seq=98 Ack=184355 Win=204800 Len=0 TSval=17743011 TSecr=1689056733
 60   0.013019 54.230.117.50 -> 172.31.8.238 TCP 11650 [TCP segment of a reassembled PDU]
 61   0.013028 172.31.8.238 -> 54.230.117.50 TCP 66 51961 > http [ACK] Seq=98 Ack=195939 Win=193280 Len=0 TSval=17743011 TSecr=1689056733
 62   0.013142 54.230.117.50 -> 172.31.8.238 TCP 20338 [TCP segment of a reassembled PDU]
 63   0.013155 172.31.8.238 -> 54.230.117.50 TCP 66 51961 > http [ACK] Seq=98 Ack=216211 Win=173952 Len=0 TSval=17743011 TSecr=1689056733
 64   0.013163 54.230.117.50 -> 172.31.8.238 TCP 1514 [TCP segment of a reassembled PDU]
 65   0.013166 172.31.8.238 -> 54.230.117.50 TCP 66 51961 > http [ACK] Seq=98 Ack=217659 Win=172544 Len=0 TSval=17743011 TSecr=1689056733
 66   0.013480 54.230.117.50 -> 172.31.8.238 TCP 15994 [TCP segment of a reassembled PDU]
 67   0.013490 172.31.8.238 -> 54.230.117.50 TCP 66 51961 > http [ACK] Seq=98 Ack=233587 Win=239360 Len=0 TSval=17743012 TSecr=1689056733
 68   0.013577 54.230.117.50 -> 172.31.8.238 TCP 1514 [TCP segment of a reassembled PDU]
 69   0.013581 172.31.8.238 -> 54.230.117.50 TCP 66 51961 > http [ACK] Seq=98 Ack=235035 Win=242304 Len=0 TSval=17743012 TSecr=1689056733
 70   0.013766 54.230.117.50 -> 172.31.8.238 TCP 26130 [TCP segment of a reassembled PDU]
 71   0.013781 172.31.8.238 -> 54.230.117.50 TCP 66 51961 > http [ACK] Seq=98 Ack=261099 Win=294400 Len=0 TSval=17743012 TSecr=1689056733
 72   0.013823 54.230.117.50 -> 172.31.8.238 TCP 8754 [TCP segment of a reassembled PDU]
 73   0.013829 172.31.8.238 -> 54.230.117.50 TCP 66 51961 > http [ACK] Seq=98 Ack=269787 Win=311808 Len=0 TSval=17743012 TSecr=1689056733
 74   0.014221 54.230.117.50 -> 172.31.8.238 TCP 4410 [TCP segment of a reassembled PDU]
 75   0.014228 172.31.8.238 -> 54.230.117.50 TCP 66 51961 > http [ACK] Seq=98 Ack=274131 Win=320512 Len=0 TSval=17743012 TSecr=1689056733
 76   0.014335 54.230.117.50 -> 172.31.8.238 TCP 11650 [TCP segment of a reassembled PDU]
 77   0.014343 172.31.8.238 -> 54.230.117.50 TCP 66 51961 > http [ACK] Seq=98 Ack=285715 Win=343680 Len=0 TSval=17743012 TSecr=1689056733
 78   0.014436 54.230.117.50 -> 172.31.8.238 TCP 7306 [TCP segment of a reassembled PDU]
 79   0.014442 172.31.8.238 -> 54.230.117.50 TCP 66 51961 > http [ACK] Seq=98 Ack=292955 Win=358144 Len=0 TSval=17743012 TSecr=1689056734
 80   0.014596 54.230.117.50 -> 172.31.8.238 TCP 26130 [TCP segment of a reassembled PDU]
 81   0.014610 172.31.8.238 -> 54.230.117.50 TCP 66 51961 > http [ACK] Seq=98 Ack=319019 Win=410240 Len=0 TSval=17743012 TSecr=1689056734
 82   0.014641 54.230.117.50 -> 172.31.8.238 TCP 11650 [TCP segment of a reassembled PDU]
 83   0.014648 172.31.8.238 -> 54.230.117.50 TCP 66 51961 > http [ACK] Seq=98 Ack=330603 Win=433408 Len=0 TSval=17743012 TSecr=1689056734
 84   0.015044 54.230.117.50 -> 172.31.8.238 TCP 17442 [TCP segment of a reassembled PDU]
 85   0.015054 172.31.8.238 -> 54.230.117.50 TCP 66 51961 > http [ACK] Seq=98 Ack=347979 Win=468224 Len=0 TSval=17743012 TSecr=1689056734
 86   0.015174 54.230.117.50 -> 172.31.8.238 TCP 10202 [TCP segment of a reassembled PDU]
 87   0.015182 172.31.8.238 -> 54.230.117.50 TCP 66 51961 > http [ACK] Seq=98 Ack=358115 Win=488448 Len=0 TSval=17743012 TSecr=1689056734
 88   0.015339 54.230.117.50 -> 172.31.8.238 TCP 23234 [TCP segment of a reassembled PDU]
 89   0.015351 172.31.8.238 -> 54.230.117.50 TCP 66 51961 > http [ACK] Seq=98 Ack=381283 Win=534784 Len=0 TSval=17743012 TSecr=1689056734
 90   0.015367 54.230.117.50 -> 172.31.8.238 TCP 2962 [TCP segment of a reassembled PDU]
 91   0.015371 172.31.8.238 -> 54.230.117.50 TCP 66 51961 > http [ACK] Seq=98 Ack=384179 Win=540544 Len=0 TSval=17743012 TSecr=1689056734
 92   0.015442 54.230.117.50 -> 172.31.8.238 TCP 11650 [TCP segment of a reassembled PDU]
 93   0.015451 172.31.8.238 -> 54.230.117.50 TCP 66 51961 > http [ACK] Seq=98 Ack=395763 Win=563712 Len=0 TSval=17743012 TSecr=1689056734
 94   0.015831 54.230.117.50 -> 172.31.8.238 TCP 26130 [TCP segment of a reassembled PDU]
 95   0.015845 172.31.8.238 -> 54.230.117.50 TCP 66 51961 > http [ACK] Seq=98 Ack=421827 Win=615808 Len=0 TSval=17743012 TSecr=1689056734
 96   0.015865 54.230.117.50 -> 172.31.8.238 TCP 7306 [TCP segment of a reassembled PDU]
 97   0.015870 172.31.8.238 -> 54.230.117.50 TCP 66 51961 > http [ACK] Seq=98 Ack=429067 Win=630400 Len=0 TSval=17743012 TSecr=1689056734
 98   0.016096 54.230.117.50 -> 172.31.8.238 TCP 26130 [TCP segment of a reassembled PDU]
 99   0.016109 172.31.8.238 -> 54.230.117.50 TCP 66 51961 > http [ACK] Seq=98 Ack=455131 Win=682496 Len=0 TSval=17743012 TSecr=1689056734
100   0.016127 54.230.117.50 -> 172.31.8.238 TCP 5858 [TCP segment of a reassembled PDU]
101   0.016131 172.31.8.238 -> 54.230.117.50 TCP 66 51961 > http [ACK] Seq=98 Ack=460923 Win=694016 Len=0 TSval=17743012 TSecr=1689056734
102   0.016597 54.230.117.50 -> 172.31.8.238 TCP 26130 [TCP segment of a reassembled PDU]
103   0.016611 172.31.8.238 -> 54.230.117.50 TCP 66 51961 > http [ACK] Seq=98 Ack=486987 Win=746240 Len=0 TSval=17743012 TSecr=1689056734
104   0.016634 54.230.117.50 -> 172.31.8.238 TCP 11650 [TCP segment of a reassembled PDU]
105   0.016641 172.31.8.238 -> 54.230.117.50 TCP 66 51961 > http [ACK] Seq=98 Ack=498571 Win=769408 Len=0 TSval=17743012 TSecr=1689056734
106   0.016861 54.230.117.50 -> 172.31.8.238 TCP 26130 [TCP segment of a reassembled PDU]
107   0.016874 172.31.8.238 -> 54.230.117.50 TCP 66 51961 > http [ACK] Seq=98 Ack=524635 Win=821504 Len=0 TSval=17743012 TSecr=1689056734
108   0.016881 54.230.117.50 -> 172.31.8.238 TCP 1514 [TCP segment of a reassembled PDU]
109   0.016883 172.31.8.238 -> 54.230.117.50 TCP 66 51961 > http [ACK] Seq=98 Ack=526083 Win=824320 Len=0 TSval=17743012 TSecr=1689056734
110   0.017320 54.230.117.50 -> 172.31.8.238 TCP 4410 [TCP segment of a reassembled PDU]
111   0.017326 172.31.8.238 -> 54.230.117.50 TCP 66 51961 > http [ACK] Seq=98 Ack=530427 Win=833024 Len=0 TSval=17743013 TSecr=1689056734
112   0.017524 54.230.117.50 -> 172.31.8.238 TCP 18890 [TCP segment of a reassembled PDU]
113   0.017535 172.31.8.238 -> 54.230.117.50 TCP 66 51961 > http [ACK] Seq=98 Ack=549251 Win=870656 Len=0 TSval=17743013 TSecr=1689056734
114   0.017562 54.230.117.50 -> 172.31.8.238 TCP 7306 [TCP segment of a reassembled PDU]
115   0.017567 172.31.8.238 -> 54.230.117.50 TCP 66 51961 > http [ACK] Seq=98 Ack=556491 Win=885248 Len=0 TSval=17743013 TSecr=1689056734
116   0.017662 54.230.117.50 -> 172.31.8.238 TCP 26130 [TCP segment of a reassembled PDU]
117   0.017676 172.31.8.238 -> 54.230.117.50 TCP 66 51961 > http [ACK] Seq=98 Ack=582555 Win=937344 Len=0 TSval=17743013 TSecr=1689056734
118   0.017710 54.230.117.50 -> 172.31.8.238 TCP 8754 [TCP segment of a reassembled PDU]
119   0.017720 172.31.8.238 -> 54.230.117.50 TCP 66 51961 > http [ACK] Seq=98 Ack=591243 Win=954752 Len=0 TSval=17743013 TSecr=1689056734
120   0.018261 54.230.117.50 -> 172.31.8.238 TCP 4410 [TCP segment of a reassembled PDU]
121   0.018267 172.31.8.238 -> 54.230.117.50 TCP 66 51961 > http [ACK] Seq=98 Ack=595587 Win=963328 Len=0 TSval=17743013 TSecr=1689056734
122   0.018457 54.230.117.50 -> 172.31.8.238 TCP 26130 [TCP segment of a reassembled PDU]
123   0.018470 172.31.8.238 -> 54.230.117.50 TCP 66 51961 > http [ACK] Seq=98 Ack=621651 Win=1015552 Len=0 TSval=17743013 TSecr=1689056734
124   0.018535 54.230.117.50 -> 172.31.8.238 TCP 26130 [TCP segment of a reassembled PDU]
125   0.018548 172.31.8.238 -> 54.230.117.50 TCP 66 51961 > http [ACK] Seq=98 Ack=647715 Win=1067648 Len=0 TSval=17743013 TSecr=1689056734
126   0.018606 54.230.117.50 -> 172.31.8.238 TCP 8754 [TCP segment of a reassembled PDU]
127   0.018613 172.31.8.238 -> 54.230.117.50 TCP 66 51961 > http [ACK] Seq=98 Ack=656403 Win=1085056 Len=0 TSval=17743013 TSecr=1689056734
128   0.018913 54.230.117.50 -> 172.31.8.238 TCP 17442 [TCP segment of a reassembled PDU]
129   0.018924 172.31.8.238 -> 54.230.117.50 TCP 66 51961 > http [ACK] Seq=98 Ack=673779 Win=1119744 Len=0 TSval=17743013 TSecr=1689056734
130   0.019028 54.230.117.50 -> 172.31.8.238 TCP 17442 [TCP segment of a reassembled PDU]
131   0.019038 172.31.8.238 -> 54.230.117.50 TCP 66 51961 > http [ACK] Seq=98 Ack=691155 Win=1154560 Len=0 TSval=17743013 TSecr=1689056734
132   0.019415 54.230.117.50 -> 172.31.8.238 TCP 18890 [TCP segment of a reassembled PDU]
133   0.019428 172.31.8.238 -> 54.230.117.50 TCP 66 51961 > http [ACK] Seq=98 Ack=709979 Win=1192192 Len=0 TSval=17743013 TSecr=1689056734
134   0.019585 54.230.117.50 -> 172.31.8.238 TCP 46402 [TCP segment of a reassembled PDU]
135   0.019612 172.31.8.238 -> 54.230.117.50 TCP 66 51961 > http [ACK] Seq=98 Ack=756315 Win=1284864 Len=0 TSval=17743013 TSecr=1689056734
136   0.019635 54.230.117.50 -> 172.31.8.238 TCP 21786 [TCP segment of a reassembled PDU]
137   0.019646 172.31.8.238 -> 54.230.117.50 TCP 66 51961 > http [ACK] Seq=98 Ack=778035 Win=1328256 Len=0 TSval=17743013 TSecr=1689056734
138   0.019755 54.230.117.50 -> 172.31.8.238 TCP 8754 [TCP segment of a reassembled PDU]
139   0.019762 172.31.8.238 -> 54.230.117.50 TCP 66 51961 > http [ACK] Seq=98 Ack=786723 Win=1345664 Len=0 TSval=17743013 TSecr=1689056734
140   0.020343 54.230.117.50 -> 172.31.8.238 TCP 4410 [TCP segment of a reassembled PDU]
141   0.020351 172.31.8.238 -> 54.230.117.50 TCP 66 51961 > http [ACK] Seq=98 Ack=791067 Win=1354368 Len=0 TSval=17743013 TSecr=1689056734
142   0.020510 54.230.117.50 -> 172.31.8.238 TCP 26130 [TCP segment of a reassembled PDU]
143   0.020524 172.31.8.238 -> 54.230.117.50 TCP 66 51961 > http [ACK] Seq=98 Ack=817131 Win=1406464 Len=0 TSval=17743013 TSecr=1689056734
144   0.020584 54.230.117.50 -> 172.31.8.238 TCP 26130 [TCP segment of a reassembled PDU]
145   0.020598 172.31.8.238 -> 54.230.117.50 TCP 66 51961 > http [ACK] Seq=98 Ack=843195 Win=1458560 Len=0 TSval=17743013 TSecr=1689056734
146   0.020645 54.230.117.50 -> 172.31.8.238 TCP 8754 [TCP segment of a reassembled PDU]
147   0.020652 172.31.8.238 -> 54.230.117.50 TCP 66 51961 > http [ACK] Seq=98 Ack=851883 Win=1475968 Len=0 TSval=17743013 TSecr=1689056734
148   0.020743 54.230.117.50 -> 172.31.8.238 TCP 26130 [TCP segment of a reassembled PDU]
149   0.020756 172.31.8.238 -> 54.230.117.50 TCP 66 51961 > http [ACK] Seq=98 Ack=877947 Win=1510656 Len=0 TSval=17743013 TSecr=1689056734
150   0.020806 54.230.117.50 -> 172.31.8.238 TCP 17442 [TCP segment of a reassembled PDU]
151   0.020852 172.31.8.238 -> 54.230.117.50 TCP 66 51961 > http [ACK] Seq=98 Ack=895323 Win=1496320 Len=0 TSval=17743013 TSecr=1689056734
152   0.021247 54.230.117.50 -> 172.31.8.238 TCP 26130 [TCP segment of a reassembled PDU]
153   0.021262 172.31.8.238 -> 54.230.117.50 TCP 66 51961 > http [ACK] Seq=98 Ack=921387 Win=1524992 Len=0 TSval=17743014 TSecr=1689056734
154   0.021312 54.230.117.50 -> 172.31.8.238 TCP 18890 [TCP segment of a reassembled PDU]
155   0.021323 172.31.8.238 -> 54.230.117.50 TCP 66 51961 > http [ACK] Seq=98 Ack=940211 Win=1536896 Len=0 TSval=17743014 TSecr=1689056734
156   0.021366 54.230.117.50 -> 172.31.8.238 TCP 7306 [TCP segment of a reassembled PDU]
157   0.021374 172.31.8.238 -> 54.230.117.50 TCP 66 51961 > http [ACK] Seq=98 Ack=947451 Win=1555968 Len=0 TSval=17743014 TSecr=1689056734
158   0.021418 54.230.117.50 -> 172.31.8.238 TCP 8754 [TCP segment of a reassembled PDU]
159   0.021567 54.230.117.50 -> 172.31.8.238 TCP 26130 [TCP segment of a reassembled PDU]
160   0.021604 172.31.8.238 -> 54.230.117.50 TCP 66 51961 > http [ACK] Seq=98 Ack=982203 Win=1524992 Len=0 TSval=17743014 TSecr=1689056734
161   0.021927 54.230.117.50 -> 172.31.8.238 TCP 7306 [TCP segment of a reassembled PDU]
162   0.021935 172.31.8.238 -> 54.230.117.50 TCP 66 51961 > http [ACK] Seq=98 Ack=989443 Win=1555968 Len=0 TSval=17743014 TSecr=1689056734
163   0.022095 54.230.117.50 -> 172.31.8.238 TCP 26130 [TCP segment of a reassembled PDU]
164   0.022121 172.31.8.238 -> 54.230.117.50 TCP 66 51961 > http [ACK] Seq=98 Ack=1015507 Win=1529984 Len=0 TSval=17743014 TSecr=1689056734
165   0.022174 54.230.117.50 -> 172.31.8.238 TCP 26130 [TCP segment of a reassembled PDU]
166   0.022201 172.31.8.238 -> 54.230.117.50 TCP 66 51961 > http [ACK] Seq=98 Ack=1041571 Win=1524992 Len=0 TSval=17743014 TSecr=1689056734
167   0.022274 54.230.117.50 -> 172.31.8.238 TCP 26130 [TCP segment of a reassembled PDU]
168   0.022288 172.31.8.238 -> 54.230.117.50 TCP 66 51961 > http [ACK] Seq=98 Ack=1067635 Win=1524992 Len=0 TSval=17743014 TSecr=1689056734
169   0.022363 54.230.117.50 -> 172.31.8.238 TCP 26130 [TCP segment of a reassembled PDU]
170   0.022377 172.31.8.238 -> 54.230.117.50 TCP 66 51961 > http [ACK] Seq=98 Ack=1093699 Win=1524992 Len=0 TSval=17743014 TSecr=1689056734
171   0.022416 54.230.117.50 -> 172.31.8.238 TCP 11650 [TCP segment of a reassembled PDU]
172   0.022423 172.31.8.238 -> 54.230.117.50 TCP 66 51961 > http [ACK] Seq=98 Ack=1105283 Win=1548800 Len=0 TSval=17743014 TSecr=1689056734
173   0.022684 54.230.117.50 -> 172.31.8.238 TCP 7306 [TCP segment of a reassembled PDU]
174   0.022691 172.31.8.238 -> 54.230.117.50 TCP 66 51961 > http [ACK] Seq=98 Ack=1112523 Win=1555968 Len=0 TSval=17743014 TSecr=1689056734
175   0.022959 54.230.117.50 -> 172.31.8.238 TCP 2962 [TCP segment of a reassembled PDU]
176   0.022964 172.31.8.238 -> 54.230.117.50 TCP 66 51961 > http [ACK] Seq=98 Ack=1115419 Win=1558784 Len=0 TSval=17743014 TSecr=1689056734
177   0.023138 54.230.117.50 -> 172.31.8.238 TCP 26130 [TCP segment of a reassembled PDU]
178   0.023164 172.31.8.238 -> 54.230.117.50 TCP 66 51961 > http [ACK] Seq=98 Ack=1141483 Win=1532800 Len=0 TSval=17743014 TSecr=1689056734
179   0.023210 54.230.117.50 -> 172.31.8.238 TCP 26130 [TCP segment of a reassembled PDU]
180   0.023235 172.31.8.238 -> 54.230.117.50 TCP 66 51961 > http [ACK] Seq=98 Ack=1167547 Win=1524992 Len=0 TSval=17743014 TSecr=1689056734
181   0.023296 54.230.117.50 -> 172.31.8.238 TCP 26130 [TCP segment of a reassembled PDU]
182   0.023310 172.31.8.238 -> 54.230.117.50 TCP 66 51961 > http [ACK] Seq=98 Ack=1193611 Win=1524992 Len=0 TSval=17743014 TSecr=1689056734
183   0.023380 54.230.117.50 -> 172.31.8.238 TCP 26130 [TCP segment of a reassembled PDU]
184   0.023394 172.31.8.238 -> 54.230.117.50 TCP 66 51961 > http [ACK] Seq=98 Ack=1219675 Win=1524992 Len=0 TSval=17743014 TSecr=1689056734
185   0.023430 54.230.117.50 -> 172.31.8.238 TCP 4410 [TCP segment of a reassembled PDU]
186   0.023435 172.31.8.238 -> 54.230.117.50 TCP 66 51961 > http [ACK] Seq=98 Ack=1224019 Win=1558784 Len=0 TSval=17743014 TSecr=1689056734
187   0.023511 54.230.117.50 -> 172.31.8.238 TCP 11650 [TCP segment of a reassembled PDU]
188   0.023591 54.230.117.50 -> 172.31.8.238 TCP 7306 [TCP segment of a reassembled PDU]
189   0.023644 172.31.8.238 -> 54.230.117.50 TCP 66 51961 > http [ACK] Seq=98 Ack=1242843 Win=1555968 Len=0 TSval=17743014 TSecr=1689056734
190   0.024008 54.230.117.50 -> 172.31.8.238 TCP 1514 [TCP segment of a reassembled PDU]
191   0.024172 54.230.117.50 -> 172.31.8.238 TCP 26130 [TCP segment of a reassembled PDU]
192   0.024199 172.31.8.238 -> 54.230.117.50 TCP 66 51961 > http [ACK] Seq=98 Ack=1270355 Win=1528576 Len=0 TSval=17743014 TSecr=1689056734
193   0.024248 54.230.117.50 -> 172.31.8.238 TCP 26130 [TCP segment of a reassembled PDU]
194   0.024274 172.31.8.238 -> 54.230.117.50 TCP 66 51961 > http [ACK] Seq=98 Ack=1296419 Win=1524992 Len=0 TSval=17743014 TSecr=1689056734
195   0.024336 54.230.117.50 -> 172.31.8.238 TCP 26130 [TCP segment of a reassembled PDU]
196   0.024350 172.31.8.238 -> 54.230.117.50 TCP 66 51961 > http [ACK] Seq=98 Ack=1322483 Win=1524992 Len=0 TSval=17743014 TSecr=1689056734
197   0.024435 54.230.117.50 -> 172.31.8.238 TCP 26130 [TCP segment of a reassembled PDU]
198   0.024449 172.31.8.238 -> 54.230.117.50 TCP 66 51961 > http [ACK] Seq=98 Ack=1348547 Win=1524992 Len=0 TSval=17743014 TSecr=1689056734
199   0.024509 54.230.117.50 -> 172.31.8.238 TCP 24682 [TCP segment of a reassembled PDU]
200   0.024522 172.31.8.238 -> 54.230.117.50 TCP 66 51961 > http [ACK] Seq=98 Ack=1373163 Win=1527424 Len=0 TSval=17743014 TSecr=1689056734
201   0.024911 54.230.117.50 -> 172.31.8.238 TCP 8754 [TCP segment of a reassembled PDU]
202   0.024919 172.31.8.238 -> 54.230.117.50 TCP 66 51961 > http [ACK] Seq=98 Ack=1381851 Win=1553536 Len=0 TSval=17743014 TSecr=1689056735
203   0.025087 54.230.117.50 -> 172.31.8.238 TCP 26130 [TCP segment of a reassembled PDU]
204   0.025116 172.31.8.238 -> 54.230.117.50 TCP 66 51961 > http [ACK] Seq=98 Ack=1407915 Win=1527552 Len=0 TSval=17743014 TSecr=1689056735
205   0.025179 54.230.117.50 -> 172.31.8.238 TCP 26130 [TCP segment of a reassembled PDU]
206   0.025206 172.31.8.238 -> 54.230.117.50 TCP 66 51961 > http [ACK] Seq=98 Ack=1433979 Win=1558784 Len=0 TSval=17743015 TSecr=1689056735
207   0.025263 54.230.117.50 -> 172.31.8.238 TCP 26130 [TCP segment of a reassembled PDU]
208   0.025277 172.31.8.238 -> 54.230.117.50 TCP 66 51961 > http [ACK] Seq=98 Ack=1460043 Win=1611008 Len=0 TSval=17743015 TSecr=1689056735
209   0.025343 54.230.117.50 -> 172.31.8.238 TCP 26130 [TCP segment of a reassembled PDU]
210   0.025356 172.31.8.238 -> 54.230.117.50 TCP 66 51961 > http [ACK] Seq=98 Ack=1486107 Win=1611008 Len=0 TSval=17743015 TSecr=1689056735
211   0.025415 54.230.117.50 -> 172.31.8.238 TCP 17442 [TCP segment of a reassembled PDU]
212   0.025425 172.31.8.238 -> 54.230.117.50 TCP 66 51961 > http [ACK] Seq=98 Ack=1503483 Win=1611008 Len=0 TSval=17743015 TSecr=1689056735
213   0.025849 54.230.117.50 -> 172.31.8.238 TCP 18890 [TCP segment of a reassembled PDU]
214   0.025861 172.31.8.238 -> 54.230.117.50 TCP 66 51961 > http [ACK] Seq=98 Ack=1522307 Win=1611008 Len=0 TSval=17743015 TSecr=1689056735
215   0.025989 54.230.117.50 -> 172.31.8.238 TCP 39162 [TCP segment of a reassembled PDU]
216   0.026007 172.31.8.238 -> 54.230.117.50 TCP 66 51961 > http [ACK] Seq=98 Ack=1561403 Win=1611008 Len=0 TSval=17743015 TSecr=1689056735
217   0.026048 54.230.117.50 -> 172.31.8.238 TCP 23234 [TCP segment of a reassembled PDU]
218   0.026060 172.31.8.238 -> 54.230.117.50 TCP 66 51961 > http [ACK] Seq=98 Ack=1584571 Win=1611008 Len=0 TSval=17743015 TSecr=1689056735
219   0.026184 54.230.117.50 -> 172.31.8.238 TCP 29026 [TCP segment of a reassembled PDU]
220   0.026198 172.31.8.238 -> 54.230.117.50 TCP 66 51961 > http [ACK] Seq=98 Ack=1613531 Win=1611008 Len=0 TSval=17743015 TSecr=1689056735
221   0.026215 54.230.117.50 -> 172.31.8.238 TCP 20338 [TCP segment of a reassembled PDU]
222   0.026227 172.31.8.238 -> 54.230.117.50 TCP 66 51961 > http [ACK] Seq=98 Ack=1633803 Win=1611008 Len=0 TSval=17743015 TSecr=1689056735
223   0.026682 54.230.117.50 -> 172.31.8.238 TCP 4410 [TCP segment of a reassembled PDU]
224   0.026689 172.31.8.238 -> 54.230.117.50 TCP 66 51961 > http [ACK] Seq=98 Ack=1638147 Win=1611008 Len=0 TSval=17743015 TSecr=1689056735
225   0.026860 54.230.117.50 -> 172.31.8.238 TCP 26130 [TCP segment of a reassembled PDU]
226   0.026873 172.31.8.238 -> 54.230.117.50 TCP 66 51961 > http [ACK] Seq=98 Ack=1664211 Win=1611008 Len=0 TSval=17743015 TSecr=1689056735
227   0.026933 54.230.117.50 -> 172.31.8.238 TCP 26130 [TCP segment of a reassembled PDU]
228   0.026947 172.31.8.238 -> 54.230.117.50 TCP 66 51961 > http [ACK] Seq=98 Ack=1690275 Win=1611008 Len=0 TSval=17743015 TSecr=1689056735
229   0.026989 54.230.117.50 -> 172.31.8.238 TCP 8754 [TCP segment of a reassembled PDU]
230   0.026996 172.31.8.238 -> 54.230.117.50 TCP 66 51961 > http [ACK] Seq=98 Ack=1698963 Win=1611008 Len=0 TSval=17743015 TSecr=1689056735
231   0.027089 54.230.117.50 -> 172.31.8.238 TCP 26130 [TCP segment of a reassembled PDU]
232   0.027103 172.31.8.238 -> 54.230.117.50 TCP 66 51961 > http [ACK] Seq=98 Ack=1725027 Win=1611008 Len=0 TSval=17743015 TSecr=1689056735
233   0.027181 54.230.117.50 -> 172.31.8.238 TCP 26130 [TCP segment of a reassembled PDU]
234   0.027194 172.31.8.238 -> 54.230.117.50 TCP 66 51961 > http [ACK] Seq=98 Ack=1751091 Win=1611008 Len=0 TSval=17743015 TSecr=1689056735
235   0.027241 54.230.117.50 -> 172.31.8.238 TCP 13098 [TCP segment of a reassembled PDU]
236   0.027250 172.31.8.238 -> 54.230.117.50 TCP 66 51961 > http [ACK] Seq=98 Ack=1764123 Win=1611008 Len=0 TSval=17743015 TSecr=1689056735
237   0.027649 54.230.117.50 -> 172.31.8.238 TCP 26130 [TCP segment of a reassembled PDU]
238   0.027664 172.31.8.238 -> 54.230.117.50 TCP 66 51961 > http [ACK] Seq=98 Ack=1790187 Win=1611008 Len=0 TSval=17743015 TSecr=1689056735
239   0.027719 54.230.117.50 -> 172.31.8.238 TCP 23234 [TCP segment of a reassembled PDU]
240   0.027731 172.31.8.238 -> 54.230.117.50 TCP 66 51961 > http [ACK] Seq=98 Ack=1813355 Win=1611008 Len=0 TSval=17743015 TSecr=1689056735
241   0.027770 54.230.117.50 -> 172.31.8.238 TCP 2962 [TCP segment of a reassembled PDU]
242   0.027775 172.31.8.238 -> 54.230.117.50 TCP 66 51961 > http [ACK] Seq=98 Ack=1816251 Win=1611008 Len=0 TSval=17743015 TSecr=1689056735
243   0.027862 54.230.117.50 -> 172.31.8.238 TCP 31922 [TCP segment of a reassembled PDU]
244   0.027878 172.31.8.238 -> 54.230.117.50 TCP 66 51961 > http [ACK] Seq=98 Ack=1848107 Win=1611008 Len=0 TSval=17743015 TSecr=1689056735
245   0.027998 54.230.117.50 -> 172.31.8.238 TCP 26130 [TCP segment of a reassembled PDU]
246   0.028011 172.31.8.238 -> 54.230.117.50 TCP 66 51961 > http [ACK] Seq=98 Ack=1874171 Win=1611008 Len=0 TSval=17743015 TSecr=1689056735
247   0.028018 54.230.117.50 -> 172.31.8.238 TCP 1514 [TCP segment of a reassembled PDU]
248   0.028038 54.230.117.50 -> 172.31.8.238 TCP 14546 [TCP segment of a reassembled PDU]
249   0.028047 172.31.8.238 -> 54.230.117.50 TCP 66 51961 > http [ACK] Seq=98 Ack=1890099 Win=1611008 Len=0 TSval=17743015 TSecr=1689056735
250   0.028087 54.230.117.50 -> 172.31.8.238 TCP 4410 [TCP segment of a reassembled PDU]
251   0.028092 172.31.8.238 -> 54.230.117.50 TCP 66 51961 > http [ACK] Seq=98 Ack=1894443 Win=1611008 Len=0 TSval=17743015 TSecr=1689056735
252   0.028362 54.230.117.50 -> 172.31.8.238 TCP 20338 [TCP segment of a reassembled PDU]
253   0.028374 172.31.8.238 -> 54.230.117.50 TCP 66 51961 > http [ACK] Seq=98 Ack=1914715 Win=1611008 Len=0 TSval=17743015 TSecr=1689056735
254   0.028502 54.230.117.50 -> 172.31.8.238 TCP 21786 [TCP segment of a reassembled PDU]
255   0.028515 172.31.8.238 -> 54.230.117.50 TCP 66 51961 > http [ACK] Seq=98 Ack=1936435 Win=1611008 Len=0 TSval=17743015 TSecr=1689056735
256   0.028610 54.230.117.50 -> 172.31.8.238 TCP 4410 [TCP segment of a reassembled PDU]
257   0.028616 172.31.8.238 -> 54.230.117.50 TCP 66 51961 > http [ACK] Seq=98 Ack=1940779 Win=1611008 Len=0 TSval=17743015 TSecr=1689056735
258   0.028644 54.230.117.50 -> 172.31.8.238 TCP 26130 [TCP segment of a reassembled PDU]
259   0.028654 172.31.8.238 -> 54.230.117.50 TCP 66 51961 > http [ACK] Seq=98 Ack=1966843 Win=1611008 Len=0 TSval=17743015 TSecr=1689056735
260   0.028738 54.230.117.50 -> 172.31.8.238 TCP 26130 [TCP segment of a reassembled PDU]
261   0.028747 172.31.8.238 -> 54.230.117.50 TCP 66 51961 > http [ACK] Seq=98 Ack=1992907 Win=1611008 Len=0 TSval=17743015 TSecr=1689056735
262   0.028821 54.230.117.50 -> 172.31.8.238 TCP 31922 [TCP segment of a reassembled PDU]
263   0.028833 172.31.8.238 -> 54.230.117.50 TCP 66 51961 > http [ACK] Seq=98 Ack=2024763 Win=1611008 Len=0 TSval=17743015 TSecr=1689056735
264   0.029234 54.230.117.50 -> 172.31.8.238 TCP 26130 [TCP segment of a reassembled PDU]
265   0.029246 172.31.8.238 -> 54.230.117.50 TCP 66 51961 > http [ACK] Seq=98 Ack=2050827 Win=1611008 Len=0 TSval=17743016 TSecr=1689056735
266   0.029306 54.230.117.50 -> 172.31.8.238 TCP 26130 [TCP segment of a reassembled PDU]
267   0.029316 172.31.8.238 -> 54.230.117.50 TCP 66 51961 > http [ACK] Seq=98 Ack=2076891 Win=1611008 Len=0 TSval=17743016 TSecr=1689056735
268   0.029391 54.230.117.50 -> 172.31.8.238 TCP 26130 [TCP segment of a reassembled PDU]
269   0.029399 172.31.8.238 -> 54.230.117.50 TCP 66 51961 > http [ACK] Seq=98 Ack=2102955 Win=1611008 Len=0 TSval=17743016 TSecr=1689056735
270   0.029485 54.230.117.50 -> 172.31.8.238 TCP 26130 [TCP segment of a reassembled PDU]
271   0.029495 172.31.8.238 -> 54.230.117.50 TCP 66 51961 > http [ACK] Seq=98 Ack=2129019 Win=1611008 Len=0 TSval=17743016 TSecr=1689056735
272   0.029565 54.230.117.50 -> 172.31.8.238 TCP 26130 [TCP segment of a reassembled PDU]
273   0.029575 172.31.8.238 -> 54.230.117.50 TCP 66 51961 > http [ACK] Seq=98 Ack=2155083 Win=1611008 Len=0 TSval=17743016 TSecr=1689056735
274   0.029775 54.230.117.50 -> 172.31.8.238 TCP 26130 [TCP segment of a reassembled PDU]
275   0.029785 172.31.8.238 -> 54.230.117.50 TCP 66 51961 > http [ACK] Seq=98 Ack=2181147 Win=1611008 Len=0 TSval=17743016 TSecr=1689056735
276   0.029847 54.230.117.50 -> 172.31.8.238 TCP 26130 [TCP segment of a reassembled PDU]
277   0.029855 172.31.8.238 -> 54.230.117.50 TCP 66 51961 > http [ACK] Seq=98 Ack=2207211 Win=1611008 Len=0 TSval=17743016 TSecr=1689056735
278   0.029908 54.230.117.50 -> 172.31.8.238 TCP 13098 [TCP segment of a reassembled PDU]
279   0.029915 172.31.8.238 -> 54.230.117.50 TCP 66 51961 > http [ACK] Seq=98 Ack=2220243 Win=1611008 Len=0 TSval=17743016 TSecr=1689056735
280   0.030214 54.230.117.50 -> 172.31.8.238 TCP 20338 [TCP segment of a reassembled PDU]
281   0.030223 172.31.8.238 -> 54.230.117.50 TCP 66 51961 > http [ACK] Seq=98 Ack=2240515 Win=1611008 Len=0 TSval=17743016 TSecr=1689056735
282   0.030376 54.230.117.50 -> 172.31.8.238 TCP 26130 [TCP segment of a reassembled PDU]
283   0.030385 172.31.8.238 -> 54.230.117.50 TCP 66 51961 > http [ACK] Seq=98 Ack=2266579 Win=1611008 Len=0 TSval=17743016 TSecr=1689056735
284   0.030447 54.230.117.50 -> 172.31.8.238 TCP 26130 [TCP segment of a reassembled PDU]
285   0.030456 172.31.8.238 -> 54.230.117.50 TCP 66 51961 > http [ACK] Seq=98 Ack=2292643 Win=1611008 Len=0 TSval=17743016 TSecr=1689056735
286   0.030532 54.230.117.50 -> 172.31.8.238 TCP 26130 [TCP segment of a reassembled PDU]
287   0.030540 172.31.8.238 -> 54.230.117.50 TCP 66 51961 > http [ACK] Seq=98 Ack=2318707 Win=1611008 Len=0 TSval=17743016 TSecr=1689056735
288   0.030615 54.230.117.50 -> 172.31.8.238 TCP 26130 [TCP segment of a reassembled PDU]
289   0.030623 172.31.8.238 -> 54.230.117.50 TCP 66 51961 > http [ACK] Seq=98 Ack=2344771 Win=1611008 Len=0 TSval=17743016 TSecr=1689056735
290   0.030675 54.230.117.50 -> 172.31.8.238 TCP 5858 [TCP segment of a reassembled PDU]
291   0.030679 172.31.8.238 -> 54.230.117.50 TCP 66 51961 > http [ACK] Seq=98 Ack=2350563 Win=1611008 Len=0 TSval=17743016 TSecr=1689056735
292   0.030768 54.230.117.50 -> 172.31.8.238 TCP 26130 [TCP segment of a reassembled PDU]
293   0.030776 172.31.8.238 -> 54.230.117.50 TCP 66 51961 > http [ACK] Seq=98 Ack=2376627 Win=1611008 Len=0 TSval=17743016 TSecr=1689056735
294   0.030852 54.230.117.50 -> 172.31.8.238 TCP 26130 [TCP segment of a reassembled PDU]
295   0.030861 172.31.8.238 -> 54.230.117.50 TCP 66 51961 > http [ACK] Seq=98 Ack=2402691 Win=1611008 Len=0 TSval=17743016 TSecr=1689056735
296   0.030906 54.230.117.50 -> 172.31.8.238 TCP 13098 [TCP segment of a reassembled PDU]
297   0.030911 172.31.8.238 -> 54.230.117.50 TCP 66 51961 > http [ACK] Seq=98 Ack=2415723 Win=1611008 Len=0 TSval=17743016 TSecr=1689056735
298   0.031081 54.230.117.50 -> 172.31.8.238 TCP 23234 [TCP segment of a reassembled PDU]
299   0.031090 172.31.8.238 -> 54.230.117.50 TCP 66 51961 > http [ACK] Seq=98 Ack=2438891 Win=1611008 Len=0 TSval=17743016 TSecr=1689056735
300   0.031110 54.230.117.50 -> 172.31.8.238 TCP 2962 [TCP segment of a reassembled PDU]
301   0.031112 172.31.8.238 -> 54.230.117.50 TCP 66 51961 > http [ACK] Seq=98 Ack=2441787 Win=1611008 Len=0 TSval=17743016 TSecr=1689056735
302   0.031264 54.230.117.50 -> 172.31.8.238 TCP 26130 [TCP segment of a reassembled PDU]
303   0.031273 172.31.8.238 -> 54.230.117.50 TCP 66 51961 > http [ACK] Seq=98 Ack=2467851 Win=1611008 Len=0 TSval=17743016 TSecr=1689056735
304   0.031285 54.230.117.50 -> 172.31.8.238 TCP 13098 [TCP segment of a reassembled PDU]
305   0.031289 172.31.8.238 -> 54.230.117.50 TCP 66 51961 > http [ACK] Seq=98 Ack=2480883 Win=1611008 Len=0 TSval=17743016 TSecr=1689056735
306   0.031438 54.230.117.50 -> 172.31.8.238 TCP 2962 [TCP segment of a reassembled PDU]
307   0.031443 172.31.8.238 -> 54.230.117.50 TCP 66 51961 > http [ACK] Seq=98 Ack=2483779 Win=1611008 Len=0 TSval=17743016 TSecr=1689056735
308   0.031605 54.230.117.50 -> 172.31.8.238 TCP 17442 [TCP segment of a reassembled PDU]
309   0.031613 172.31.8.238 -> 54.230.117.50 TCP 66 51961 > http [ACK] Seq=98 Ack=2501155 Win=1611008 Len=0 TSval=17743016 TSecr=1689056735
310   0.031740 54.230.117.50 -> 172.31.8.238 TCP 34818 [TCP segment of a reassembled PDU]
311   0.031750 172.31.8.238 -> 54.230.117.50 TCP 66 51961 > http [ACK] Seq=98 Ack=2535907 Win=1611008 Len=0 TSval=17743016 TSecr=1689056735
312   0.031768 54.230.117.50 -> 172.31.8.238 TCP 26130 [TCP segment of a reassembled PDU]
313   0.031774 172.31.8.238 -> 54.230.117.50 TCP 66 51961 > http [ACK] Seq=98 Ack=2561971 Win=1611008 Len=0 TSval=17743016 TSecr=1689056735
314   0.031874 54.230.117.50 -> 172.31.8.238 TCP 26130 [TCP segment of a reassembled PDU]
315   0.031882 172.31.8.238 -> 54.230.117.50 TCP 66 51961 > http [ACK] Seq=98 Ack=2588035 Win=1611008 Len=0 TSval=17743016 TSecr=1689056735
316   0.031944 54.230.117.50 -> 172.31.8.238 TCP 23234 [TCP segment of a reassembled PDU]
317   0.031951 172.31.8.238 -> 54.230.117.50 TCP 66 51961 > http [ACK] Seq=98 Ack=2611203 Win=1611008 Len=0 TSval=17743016 TSecr=1689056735
318   0.032132 54.230.117.50 -> 172.31.8.238 TCP 26130 [TCP segment of a reassembled PDU]
319   0.032141 172.31.8.238 -> 54.230.117.50 TCP 66 51961 > http [ACK] Seq=98 Ack=2637267 Win=1611008 Len=0 TSval=17743016 TSecr=1689056735
320   0.032203 54.230.117.50 -> 172.31.8.238 TCP 26130 [TCP segment of a reassembled PDU]
321   0.032211 172.31.8.238 -> 54.230.117.50 TCP 66 51961 > http [ACK] Seq=98 Ack=2663331 Win=1611008 Len=0 TSval=17743016 TSecr=1689056735
322   0.032267 54.230.117.50 -> 172.31.8.238 TCP 13098 [TCP segment of a reassembled PDU]
323   0.032273 172.31.8.238 -> 54.230.117.50 TCP 66 51961 > http [ACK] Seq=98 Ack=2676363 Win=1611008 Len=0 TSval=17743016 TSecr=1689056735
324   0.032591 54.230.117.50 -> 172.31.8.238 TCP 26130 [TCP segment of a reassembled PDU]
325   0.032602 172.31.8.238 -> 54.230.117.50 TCP 66 51961 > http [ACK] Seq=98 Ack=2702427 Win=1611008 Len=0 TSval=17743016 TSecr=1689056735
326   0.032690 54.230.117.50 -> 172.31.8.238 TCP 23234 [TCP segment of a reassembled PDU]
327   0.032704 172.31.8.238 -> 54.230.117.50 TCP 66 51961 > http [ACK] Seq=98 Ack=2725595 Win=1611008 Len=0 TSval=17743016 TSecr=1689056735
328   0.032865 54.230.117.50 -> 172.31.8.238 TCP 55090 [TCP segment of a reassembled PDU]
329   0.032880 172.31.8.238 -> 54.230.117.50 TCP 66 51961 > http [ACK] Seq=98 Ack=2780619 Win=1611008 Len=0 TSval=17743016 TSecr=1689056735
330   0.032891 54.230.117.50 -> 172.31.8.238 TCP 7306 [TCP segment of a reassembled PDU]
331   0.032894 172.31.8.238 -> 54.230.117.50 TCP 66 51961 > http [ACK] Seq=98 Ack=2787859 Win=1611008 Len=0 TSval=17743016 TSecr=1689056735
332   0.033108 54.230.117.50 -> 172.31.8.238 TCP 55090 [TCP segment of a reassembled PDU]
333   0.033125 172.31.8.238 -> 54.230.117.50 TCP 66 51961 > http [ACK] Seq=98 Ack=2842883 Win=1611008 Len=0 TSval=17743016 TSecr=1689056735
334   0.033157 54.230.117.50 -> 172.31.8.238 TCP 15994 [TCP segment of a reassembled PDU]
335   0.033164 172.31.8.238 -> 54.230.117.50 TCP 66 51961 > http [ACK] Seq=98 Ack=2858811 Win=1611008 Len=0 TSval=17743016 TSecr=1689056735
336   0.033222 54.230.117.50 -> 172.31.8.238 TCP 13098 [TCP segment of a reassembled PDU]
337   0.033227 172.31.8.238 -> 54.230.117.50 TCP 66 51961 > http [ACK] Seq=98 Ack=2871843 Win=1611008 Len=0 TSval=17743016 TSecr=1689056735
338   0.033370 54.230.117.50 -> 172.31.8.238 TCP 24682 [TCP segment of a reassembled PDU]
339   0.033378 172.31.8.238 -> 54.230.117.50 TCP 66 51961 > http [ACK] Seq=98 Ack=2896459 Win=1611008 Len=0 TSval=17743017 TSecr=1689056735
340   0.033447 54.230.117.50 -> 172.31.8.238 TCP 26130 [TCP segment of a reassembled PDU]
341   0.033455 172.31.8.238 -> 54.230.117.50 TCP 66 51961 > http [ACK] Seq=98 Ack=2922523 Win=1611008 Len=0 TSval=17743017 TSecr=1689056735
342   0.033532 54.230.117.50 -> 172.31.8.238 TCP 26130 [TCP segment of a reassembled PDU]
343   0.033542 172.31.8.238 -> 54.230.117.50 TCP 66 51961 > http [ACK] Seq=98 Ack=2948587 Win=1611008 Len=0 TSval=17743017 TSecr=1689056735
344   0.033615 54.230.117.50 -> 172.31.8.238 TCP 26130 [TCP segment of a reassembled PDU]
345   0.033625 172.31.8.238 -> 54.230.117.50 TCP 66 51961 > http [ACK] Seq=98 Ack=2974651 Win=1611008 Len=0 TSval=17743017 TSecr=1689056735
346   0.033700 54.230.117.50 -> 172.31.8.238 TCP 26130 [TCP segment of a reassembled PDU]
347   0.033708 172.31.8.238 -> 54.230.117.50 TCP 66 51961 > http [ACK] Seq=98 Ack=3000715 Win=1611008 Len=0 TSval=17743017 TSecr=1689056735
348   0.033750 54.230.117.50 -> 172.31.8.238 TCP 1514 [TCP segment of a reassembled PDU]
349   0.033839 54.230.117.50 -> 172.31.8.238 TCP 26130 [TCP segment of a reassembled PDU]
