[Measurement for 10mb at 00:42:23 20.42.2014] 
Tshark:

  1   0.000000 172.31.8.238 -> 172.31.0.2   DNS 89 Standard query 0x029a  A d1xzxs93r3iphc.cloudfront.net
  2   0.000024 172.31.8.238 -> 172.31.0.2   DNS 89 Standard query 0xe190  AAAA d1xzxs93r3iphc.cloudfront.net
  3   0.000714   172.31.0.2 -> 172.31.8.238 DNS 170 Standard query response 0xe190 
  4   0.000734   172.31.0.2 -> 172.31.8.238 DNS 217 Standard query response 0x029a  A 54.192.118.243 A 54.230.116.53 A 54.230.116.136 A 54.230.116.189 A 54.230.117.238 A 54.230.119.91 A 54.192.118.221 A 54.192.118.224
  5   0.003870 172.31.8.238 -> 54.192.118.243 TCP 74 35531 > http [SYN] Seq=0 Win=26883 Len=0 MSS=8961 SACK_PERM=1 TSval=6942872 TSecr=0 WS=128
  6   0.004663 54.192.118.243 -> 172.31.8.238 TCP 74 http > 35531 [SYN, ACK] Seq=0 Ack=1 Win=14480 Len=0 MSS=1460 SACK_PERM=1 TSval=1685190525 TSecr=6942872 WS=128
  7   0.004676 172.31.8.238 -> 54.192.118.243 TCP 66 35531 > http [ACK] Seq=1 Ack=1 Win=27008 Len=0 TSval=6942872 TSecr=1685190525
  8   0.004719 172.31.8.238 -> 54.192.118.243 HTTP 163 GET /10mb HTTP/1.1 
  9   0.005402 54.192.118.243 -> 172.31.8.238 TCP 66 http > 35531 [ACK] Seq=1 Ack=98 Win=14592 Len=0 TSval=1685190525 TSecr=6942872
 10   0.007429 54.192.118.243 -> 172.31.8.238 TCP 524 [TCP segment of a reassembled PDU]
 11   0.007436 172.31.8.238 -> 54.192.118.243 TCP 66 35531 > http [ACK] Seq=98 Ack=459 Win=28032 Len=0 TSval=6942873 TSecr=1685190525
 12   0.007734 54.192.118.243 -> 172.31.8.238 TCP 10202 [TCP segment of a reassembled PDU]
 13   0.007744 172.31.8.238 -> 54.192.118.243 TCP 66 35531 > http [ACK] Seq=98 Ack=10595 Win=48256 Len=0 TSval=6942873 TSecr=1685190525
 14   0.007775 54.192.118.243 -> 172.31.8.238 TCP 2962 [TCP segment of a reassembled PDU]
 15   0.007780 172.31.8.238 -> 54.192.118.243 TCP 66 35531 > http [ACK] Seq=98 Ack=13491 Win=54144 Len=0 TSval=6942873 TSecr=1685190525
 16   0.008222 54.192.118.243 -> 172.31.8.238 TCP 4410 [TCP segment of a reassembled PDU]
 17   0.008229 172.31.8.238 -> 54.192.118.243 TCP 66 35531 > http [ACK] Seq=98 Ack=17835 Win=62720 Len=0 TSval=6942873 TSecr=1685190525
 18   0.008329 54.192.118.243 -> 172.31.8.238 TCP 8754 [TCP segment of a reassembled PDU]
 19   0.008336 172.31.8.238 -> 54.192.118.243 TCP 66 35531 > http [ACK] Seq=98 Ack=26523 Win=80128 Len=0 TSval=6942873 TSecr=1685190525
 20   0.008742 54.192.118.243 -> 172.31.8.238 TCP 4410 [TCP segment of a reassembled PDU]
 21   0.008748 172.31.8.238 -> 54.192.118.243 TCP 66 35531 > http [ACK] Seq=98 Ack=30867 Win=88832 Len=0 TSval=6942873 TSecr=1685190525
 22   0.008843 54.192.118.243 -> 172.31.8.238 TCP 7306 [TCP segment of a reassembled PDU]
 23   0.008850 172.31.8.238 -> 54.192.118.243 TCP 66 35531 > http [ACK] Seq=98 Ack=38107 Win=103296 Len=0 TSval=6942873 TSecr=1685190525
 24   0.008991 54.192.118.243 -> 172.31.8.238 TCP 1514 [TCP segment of a reassembled PDU]
 25   0.008996 172.31.8.238 -> 54.192.118.243 TCP 66 35531 > http [ACK] Seq=98 Ack=39555 Win=106240 Len=0 TSval=6942873 TSecr=1685190525
 26   0.009095 54.192.118.243 -> 172.31.8.238 TCP 8754 [TCP segment of a reassembled PDU]
 27   0.009102 172.31.8.238 -> 54.192.118.243 TCP 66 35531 > http [ACK] Seq=98 Ack=48243 Win=103680 Len=0 TSval=6942873 TSecr=1685190525
 28   0.009242 54.192.118.243 -> 172.31.8.238 TCP 4410 [TCP segment of a reassembled PDU]
 29   0.009247 172.31.8.238 -> 54.192.118.243 TCP 66 35531 > http [ACK] Seq=98 Ack=52587 Win=109056 Len=0 TSval=6942873 TSecr=1685190525
 30   0.009502 54.192.118.243 -> 172.31.8.238 TCP 4410 [TCP segment of a reassembled PDU]
 31   0.009509 172.31.8.238 -> 54.192.118.243 TCP 66 35531 > http [ACK] Seq=98 Ack=56931 Win=109056 Len=0 TSval=6942873 TSecr=1685190525
 32   0.009603 54.192.118.243 -> 172.31.8.238 TCP 8754 [TCP segment of a reassembled PDU]
 33   0.009610 172.31.8.238 -> 54.192.118.243 TCP 66 35531 > http [ACK] Seq=98 Ack=65619 Win=103680 Len=0 TSval=6942873 TSecr=1685190525
 34   0.009794 54.192.118.243 -> 172.31.8.238 TCP 13098 [TCP segment of a reassembled PDU]
 35   0.009803 172.31.8.238 -> 54.192.118.243 TCP 66 35531 > http [ACK] Seq=98 Ack=78651 Win=96512 Len=0 TSval=6942873 TSecr=1685190525
 36   0.010284 54.192.118.243 -> 172.31.8.238 TCP 2962 [TCP segment of a reassembled PDU]
 37   0.010289 172.31.8.238 -> 54.192.118.243 TCP 66 35531 > http [ACK] Seq=98 Ack=81547 Win=109056 Len=0 TSval=6942873 TSecr=1685190525
 38   0.010384 54.192.118.243 -> 172.31.8.238 TCP 10202 [TCP segment of a reassembled PDU]
 39   0.010392 172.31.8.238 -> 54.192.118.243 TCP 66 35531 > http [ACK] Seq=98 Ack=91683 Win=101248 Len=0 TSval=6942873 TSecr=1685190525
 40   0.010495 54.192.118.243 -> 172.31.8.238 TCP 13098 [TCP segment of a reassembled PDU]
 41   0.010503 172.31.8.238 -> 54.192.118.243 TCP 66 35531 > http [ACK] Seq=98 Ack=104715 Win=96512 Len=0 TSval=6942873 TSecr=1685190525
 42   0.010785 54.192.118.243 -> 172.31.8.238 TCP 5858 [TCP segment of a reassembled PDU]
 43   0.010791 172.31.8.238 -> 54.192.118.243 TCP 66 35531 > http [ACK] Seq=98 Ack=110507 Win=108416 Len=0 TSval=6942874 TSecr=1685190525
 44   0.010882 54.192.118.243 -> 172.31.8.238 TCP 5858 [TCP segment of a reassembled PDU]
 45   0.010888 172.31.8.238 -> 54.192.118.243 TCP 66 35531 > http [ACK] Seq=98 Ack=116299 Win=120704 Len=0 TSval=6942874 TSecr=1685190525
 46   0.011056 54.192.118.243 -> 172.31.8.238 TCP 1514 [TCP segment of a reassembled PDU]
 47   0.011061 172.31.8.238 -> 54.192.118.243 TCP 66 35531 > http [ACK] Seq=98 Ack=117747 Win=123520 Len=0 TSval=6942874 TSecr=1685190525
 48   0.011160 54.192.118.243 -> 172.31.8.238 TCP 13098 [TCP segment of a reassembled PDU]
 49   0.011169 172.31.8.238 -> 54.192.118.243 TCP 66 35531 > http [ACK] Seq=98 Ack=130779 Win=149632 Len=0 TSval=6942874 TSecr=1685190525
 50   0.011401 54.192.118.243 -> 172.31.8.238 TCP 13098 [TCP segment of a reassembled PDU]
 51   0.011411 172.31.8.238 -> 54.192.118.243 TCP 66 35531 > http [ACK] Seq=98 Ack=143811 Win=175616 Len=0 TSval=6942874 TSecr=1685190525
 52   0.011551 54.192.118.243 -> 172.31.8.238 TCP 2962 [TCP segment of a reassembled PDU]
 53   0.011558 172.31.8.238 -> 54.192.118.243 TCP 66 35531 > http [ACK] Seq=98 Ack=146707 Win=181504 Len=0 TSval=6942874 TSecr=1685190525
 54   0.011693 54.192.118.243 -> 172.31.8.238 TCP 13098 [TCP segment of a reassembled PDU]
 55   0.011701 172.31.8.238 -> 54.192.118.243 TCP 66 35531 > http [ACK] Seq=98 Ack=159739 Win=207488 Len=0 TSval=6942874 TSecr=1685190525
 56   0.011879 54.192.118.243 -> 172.31.8.238 TCP 7306 [TCP segment of a reassembled PDU]
 57   0.011886 172.31.8.238 -> 54.192.118.243 TCP 66 35531 > http [ACK] Seq=98 Ack=166979 Win=221952 Len=0 TSval=6942874 TSecr=1685190525
 58   0.012180 54.192.118.243 -> 172.31.8.238 TCP 23234 [TCP segment of a reassembled PDU]
 59   0.012191 172.31.8.238 -> 54.192.118.243 TCP 66 35531 > http [ACK] Seq=98 Ack=190147 Win=268288 Len=0 TSval=6942874 TSecr=1685190525
 60   0.012345 54.192.118.243 -> 172.31.8.238 TCP 14546 [TCP segment of a reassembled PDU]
 61   0.012354 172.31.8.238 -> 54.192.118.243 TCP 66 35531 > http [ACK] Seq=98 Ack=204627 Win=297344 Len=0 TSval=6942874 TSecr=1685190525
 62   0.012443 54.192.118.243 -> 172.31.8.238 TCP 2962 [TCP segment of a reassembled PDU]
 63   0.012449 172.31.8.238 -> 54.192.118.243 TCP 66 35531 > http [ACK] Seq=98 Ack=207523 Win=303104 Len=0 TSval=6942874 TSecr=1685190525
 64   0.012831 54.192.118.243 -> 172.31.8.238 TCP 5858 [TCP segment of a reassembled PDU]
 65   0.012838 172.31.8.238 -> 54.192.118.243 TCP 66 35531 > http [ACK] Seq=98 Ack=213315 Win=314624 Len=0 TSval=6942874 TSecr=1685190525
 66   0.013016 54.192.118.243 -> 172.31.8.238 TCP 26130 [TCP segment of a reassembled PDU]
 67   0.013029 172.31.8.238 -> 54.192.118.243 TCP 66 35531 > http [ACK] Seq=98 Ack=239379 Win=366848 Len=0 TSval=6942874 TSecr=1685190525
 68   0.013074 54.192.118.243 -> 172.31.8.238 TCP 17442 [TCP segment of a reassembled PDU]
 69   0.013085 172.31.8.238 -> 54.192.118.243 TCP 66 35531 > http [ACK] Seq=98 Ack=256755 Win=401536 Len=0 TSval=6942874 TSecr=1685190525
 70   0.013601 54.192.118.243 -> 172.31.8.238 TCP 5858 [TCP segment of a reassembled PDU]
 71   0.013609 172.31.8.238 -> 54.192.118.243 TCP 66 35531 > http [ACK] Seq=98 Ack=262547 Win=413184 Len=0 TSval=6942874 TSecr=1685190526
 72   0.013780 54.192.118.243 -> 172.31.8.238 TCP 26130 [TCP segment of a reassembled PDU]
 73   0.013794 172.31.8.238 -> 54.192.118.243 TCP 66 35531 > http [ACK] Seq=98 Ack=288611 Win=465280 Len=0 TSval=6942874 TSecr=1685190526
 74   0.013817 54.192.118.243 -> 172.31.8.238 TCP 7306 [TCP segment of a reassembled PDU]
 75   0.013823 172.31.8.238 -> 54.192.118.243 TCP 66 35531 > http [ACK] Seq=98 Ack=295851 Win=479744 Len=0 TSval=6942874 TSecr=1685190526
 76   0.014142 54.192.118.243 -> 172.31.8.238 TCP 15994 [TCP segment of a reassembled PDU]
 77   0.014153 172.31.8.238 -> 54.192.118.243 TCP 66 35531 > http [ACK] Seq=98 Ack=311779 Win=511616 Len=0 TSval=6942874 TSecr=1685190526
 78   0.014255 54.192.118.243 -> 172.31.8.238 TCP 8754 [TCP segment of a reassembled PDU]
 79   0.014262 172.31.8.238 -> 54.192.118.243 TCP 66 35531 > http [ACK] Seq=98 Ack=320467 Win=529024 Len=0 TSval=6942874 TSecr=1685190526
 80   0.014394 54.192.118.243 -> 172.31.8.238 TCP 14546 [TCP segment of a reassembled PDU]
 81   0.014404 172.31.8.238 -> 54.192.118.243 TCP 66 35531 > http [ACK] Seq=98 Ack=334947 Win=557952 Len=0 TSval=6942874 TSecr=1685190526
 82   0.014516 54.192.118.243 -> 172.31.8.238 TCP 14546 [TCP segment of a reassembled PDU]
 83   0.014527 172.31.8.238 -> 54.192.118.243 TCP 66 35531 > http [ACK] Seq=98 Ack=349427 Win=586880 Len=0 TSval=6942874 TSecr=1685190526
 84   0.014916 54.192.118.243 -> 172.31.8.238 TCP 4410 [TCP segment of a reassembled PDU]
 85   0.014922 172.31.8.238 -> 54.192.118.243 TCP 66 35531 > http [ACK] Seq=98 Ack=353771 Win=595584 Len=0 TSval=6942875 TSecr=1685190526
 86   0.015101 54.192.118.243 -> 172.31.8.238 TCP 20338 [TCP segment of a reassembled PDU]
 87   0.015113 172.31.8.238 -> 54.192.118.243 TCP 66 35531 > http [ACK] Seq=98 Ack=374043 Win=636160 Len=0 TSval=6942875 TSecr=1685190526
 88   0.015130 54.192.118.243 -> 172.31.8.238 TCP 5858 [TCP segment of a reassembled PDU]
 89   0.015135 172.31.8.238 -> 54.192.118.243 TCP 66 35531 > http [ACK] Seq=98 Ack=379835 Win=647680 Len=0 TSval=6942875 TSecr=1685190526
 90   0.015214 54.192.118.243 -> 172.31.8.238 TCP 21786 [TCP segment of a reassembled PDU]
 91   0.015225 172.31.8.238 -> 54.192.118.243 TCP 66 35531 > http [ACK] Seq=98 Ack=401555 Win=691200 Len=0 TSval=6942875 TSecr=1685190526
 92   0.015891 54.192.118.243 -> 172.31.8.238 TCP 2962 [TCP segment of a reassembled PDU]
 93   0.015898 172.31.8.238 -> 54.192.118.243 TCP 66 35531 > http [ACK] Seq=98 Ack=404451 Win=696960 Len=0 TSval=6942875 TSecr=1685190526
 94   0.016078 54.192.118.243 -> 172.31.8.238 TCP 26130 [TCP segment of a reassembled PDU]
 95   0.016091 172.31.8.238 -> 54.192.118.243 TCP 66 35531 > http [ACK] Seq=98 Ack=430515 Win=749056 Len=0 TSval=6942875 TSecr=1685190526
 96   0.016142 54.192.118.243 -> 172.31.8.238 TCP 21786 [TCP segment of a reassembled PDU]
 97   0.016154 172.31.8.238 -> 54.192.118.243 TCP 66 35531 > http [ACK] Seq=98 Ack=452235 Win=792576 Len=0 TSval=6942875 TSecr=1685190526
 98   0.016445 54.192.118.243 -> 172.31.8.238 TCP 13098 [TCP segment of a reassembled PDU]
 99   0.016455 172.31.8.238 -> 54.192.118.243 TCP 66 35531 > http [ACK] Seq=98 Ack=465267 Win=818560 Len=0 TSval=6942875 TSecr=1685190526
100   0.016588 54.192.118.243 -> 172.31.8.238 TCP 14546 [TCP segment of a reassembled PDU]
101   0.016598 172.31.8.238 -> 54.192.118.243 TCP 66 35531 > http [ACK] Seq=98 Ack=479747 Win=847488 Len=0 TSval=6942875 TSecr=1685190526
102   0.016682 54.192.118.243 -> 172.31.8.238 TCP 1514 [TCP segment of a reassembled PDU]
103   0.016687 172.31.8.238 -> 54.192.118.243 TCP 66 35531 > http [ACK] Seq=98 Ack=481195 Win=850432 Len=0 TSval=6942875 TSecr=1685190526
104   0.016857 54.192.118.243 -> 172.31.8.238 TCP 26130 [TCP segment of a reassembled PDU]
105   0.016871 172.31.8.238 -> 54.192.118.243 TCP 66 35531 > http [ACK] Seq=98 Ack=507259 Win=902528 Len=0 TSval=6942875 TSecr=1685190526
106   0.016953 54.192.118.243 -> 172.31.8.238 TCP 5858 [TCP segment of a reassembled PDU]
107   0.016959 172.31.8.238 -> 54.192.118.243 TCP 66 35531 > http [ACK] Seq=98 Ack=513051 Win=914176 Len=0 TSval=6942875 TSecr=1685190526
108   0.017091 54.192.118.243 -> 172.31.8.238 TCP 26130 [TCP segment of a reassembled PDU]
109   0.017104 172.31.8.238 -> 54.192.118.243 TCP 66 35531 > http [ACK] Seq=98 Ack=539115 Win=966272 Len=0 TSval=6942875 TSecr=1685190526
110   0.017124 54.192.118.243 -> 172.31.8.238 TCP 5858 [TCP segment of a reassembled PDU]
111   0.017129 172.31.8.238 -> 54.192.118.243 TCP 66 35531 > http [ACK] Seq=98 Ack=544907 Win=977920 Len=0 TSval=6942875 TSecr=1685190526
112   0.017190 54.192.118.243 -> 172.31.8.238 TCP 1514 [TCP segment of a reassembled PDU]
113   0.017195 172.31.8.238 -> 54.192.118.243 TCP 66 35531 > http [ACK] Seq=98 Ack=546355 Win=980736 Len=0 TSval=6942875 TSecr=1685190526
114   0.017526 54.192.118.243 -> 172.31.8.238 TCP 21786 [TCP segment of a reassembled PDU]
115   0.017539 172.31.8.238 -> 54.192.118.243 TCP 66 35531 > http [ACK] Seq=98 Ack=568075 Win=1024256 Len=0 TSval=6942875 TSecr=1685190526
116   0.017650 54.192.118.243 -> 172.31.8.238 TCP 23234 [TCP segment of a reassembled PDU]
117   0.017663 172.31.8.238 -> 54.192.118.243 TCP 66 35531 > http [ACK] Seq=98 Ack=591243 Win=1070592 Len=0 TSval=6942875 TSecr=1685190526
118   0.017822 54.192.118.243 -> 172.31.8.238 TCP 20338 [TCP segment of a reassembled PDU]
119   0.017834 172.31.8.238 -> 54.192.118.243 TCP 66 35531 > http [ACK] Seq=98 Ack=611515 Win=1111040 Len=0 TSval=6942875 TSecr=1685190526
120   0.018232 54.192.118.243 -> 172.31.8.238 TCP 7306 [TCP segment of a reassembled PDU]
121   0.018239 172.31.8.238 -> 54.192.118.243 TCP 66 35531 > http [ACK] Seq=98 Ack=618755 Win=1125504 Len=0 TSval=6942875 TSecr=1685190526
122   0.018397 54.192.118.243 -> 172.31.8.238 TCP 26130 [TCP segment of a reassembled PDU]
123   0.018411 172.31.8.238 -> 54.192.118.243 TCP 66 35531 > http [ACK] Seq=98 Ack=644819 Win=1177728 Len=0 TSval=6942875 TSecr=1685190526
124   0.018473 54.192.118.243 -> 172.31.8.238 TCP 26130 [TCP segment of a reassembled PDU]
125   0.018488 172.31.8.238 -> 54.192.118.243 TCP 66 35531 > http [ACK] Seq=98 Ack=670883 Win=1218688 Len=0 TSval=6942875 TSecr=1685190526
126   0.018530 54.192.118.243 -> 172.31.8.238 TCP 5858 [TCP segment of a reassembled PDU]
127   0.018536 172.31.8.238 -> 54.192.118.243 TCP 66 35531 > http [ACK] Seq=98 Ack=676675 Win=1241344 Len=0 TSval=6942875 TSecr=1685190526
128   0.018775 54.192.118.243 -> 172.31.8.238 TCP 10202 [TCP segment of a reassembled PDU]
129   0.018783 172.31.8.238 -> 54.192.118.243 TCP 66 35531 > http [ACK] Seq=98 Ack=686811 Win=1244800 Len=0 TSval=6942876 TSecr=1685190526
130   0.018932 54.192.118.243 -> 172.31.8.238 TCP 20338 [TCP segment of a reassembled PDU]
131   0.018945 172.31.8.238 -> 54.192.118.243 TCP 66 35531 > http [ACK] Seq=98 Ack=707083 Win=1228160 Len=0 TSval=6942876 TSecr=1685190526
132   0.018962 54.192.118.243 -> 172.31.8.238 TCP 5858 [TCP segment of a reassembled PDU]
133   0.018965 172.31.8.238 -> 54.192.118.243 TCP 66 35531 > http [ACK] Seq=98 Ack=712875 Win=1222400 Len=0 TSval=6942876 TSecr=1685190526
134   0.019033 54.192.118.243 -> 172.31.8.238 TCP 4410 [TCP segment of a reassembled PDU]
135   0.019039 172.31.8.238 -> 54.192.118.243 TCP 66 35531 > http [ACK] Seq=98 Ack=717219 Win=1254272 Len=0 TSval=6942876 TSecr=1685190526
136   0.019130 54.192.118.243 -> 172.31.8.238 TCP 26130 [TCP segment of a reassembled PDU]
137   0.019154 172.31.8.238 -> 54.192.118.243 TCP 66 35531 > http [ACK] Seq=98 Ack=743283 Win=1228288 Len=0 TSval=6942876 TSecr=1685190526
138   0.019220 54.192.118.243 -> 172.31.8.238 TCP 26130 [TCP segment of a reassembled PDU]
139   0.019234 172.31.8.238 -> 54.192.118.243 TCP 66 35531 > http [ACK] Seq=98 Ack=769347 Win=1218688 Len=0 TSval=6942876 TSecr=1685190526
140   0.019259 54.192.118.243 -> 172.31.8.238 TCP 7306 [TCP segment of a reassembled PDU]
141   0.019264 172.31.8.238 -> 54.192.118.243 TCP 66 35531 > http [ACK] Seq=98 Ack=776587 Win=1211520 Len=0 TSval=6942876 TSecr=1685190526
142   0.019623 54.192.118.243 -> 172.31.8.238 TCP 26130 [TCP segment of a reassembled PDU]
143   0.019638 172.31.8.238 -> 54.192.118.243 TCP 66 35531 > http [ACK] Seq=98 Ack=802651 Win=1218688 Len=0 TSval=6942876 TSecr=1685190526
144   0.019645 54.192.118.243 -> 172.31.8.238 TCP 4410 [TCP segment of a reassembled PDU]
145   0.019671 172.31.8.238 -> 54.192.118.243 TCP 66 35531 > http [ACK] Seq=98 Ack=806995 Win=1214464 Len=0 TSval=6942876 TSecr=1685190526
146   0.019820 54.192.118.243 -> 172.31.8.238 TCP 8754 [TCP segment of a reassembled PDU]
147   0.019827 172.31.8.238 -> 54.192.118.243 TCP 66 35531 > http [ACK] Seq=98 Ack=815683 Win=1247232 Len=0 TSval=6942876 TSecr=1685190526
148   0.019947 54.192.118.243 -> 172.31.8.238 TCP 26130 [TCP segment of a reassembled PDU]
149   0.019974 172.31.8.238 -> 54.192.118.243 TCP 66 35531 > http [ACK] Seq=98 Ack=841747 Win=1221248 Len=0 TSval=6942876 TSecr=1685190526
150   0.020001 54.192.118.243 -> 172.31.8.238 TCP 26130 [TCP segment of a reassembled PDU]
151   0.020020 172.31.8.238 -> 54.192.118.243 TCP 66 35531 > http [ACK] Seq=98 Ack=867811 Win=1218688 Len=0 TSval=6942876 TSecr=1685190526
152   0.020055 54.192.118.243 -> 172.31.8.238 TCP 4410 [TCP segment of a reassembled PDU]
153   0.020060 172.31.8.238 -> 54.192.118.243 TCP 66 35531 > http [ACK] Seq=98 Ack=872155 Win=1254272 Len=0 TSval=6942876 TSecr=1685190526
154   0.020326 54.192.118.243 -> 172.31.8.238 TCP 8754 [TCP segment of a reassembled PDU]
155   0.020345 172.31.8.238 -> 54.192.118.243 TCP 66 35531 > http [ACK] Seq=98 Ack=880843 Win=1259520 Len=0 TSval=6942876 TSecr=1685190526
156   0.020509 54.192.118.243 -> 172.31.8.238 TCP 26130 [TCP segment of a reassembled PDU]
157   0.020535 172.31.8.238 -> 54.192.118.243 TCP 66 35531 > http [ACK] Seq=98 Ack=906907 Win=1233536 Len=0 TSval=6942876 TSecr=1685190526
158   0.020551 54.192.118.243 -> 172.31.8.238 TCP 11650 [TCP segment of a reassembled PDU]
159   0.020569 172.31.8.238 -> 54.192.118.243 TCP 66 35531 > http [ACK] Seq=98 Ack=918491 Win=1242496 Len=0 TSval=6942876 TSecr=1685190526
160   0.020888 54.192.118.243 -> 172.31.8.238 TCP 26130 [TCP segment of a reassembled PDU]
161   0.020914 172.31.8.238 -> 54.192.118.243 TCP 66 35531 > http [ACK] Seq=98 Ack=944555 Win=1218688 Len=0 TSval=6942876 TSecr=1685190526
162   0.020951 54.192.118.243 -> 172.31.8.238 TCP 21786 [TCP segment of a reassembled PDU]
163   0.020963 172.31.8.238 -> 54.192.118.243 TCP 66 35531 > http [ACK] Seq=98 Ack=966275 Win=1225728 Len=0 TSval=6942876 TSecr=1685190526
164   0.021019 54.192.118.243 -> 172.31.8.238 TCP 18890 [TCP segment of a reassembled PDU]
165   0.021030 172.31.8.238 -> 54.192.118.243 TCP 66 35531 > http [ACK] Seq=98 Ack=985099 Win=1230464 Len=0 TSval=6942876 TSecr=1685190526
166   0.021374 54.192.118.243 -> 172.31.8.238 TCP 17442 [TCP segment of a reassembled PDU]
167   0.021385 172.31.8.238 -> 54.192.118.243 TCP 66 35531 > http [ACK] Seq=98 Ack=1002475 Win=1232896 Len=0 TSval=6942876 TSecr=1685190526
168   0.021523 54.192.118.243 -> 172.31.8.238 TCP 2962 [TCP segment of a reassembled PDU]
169   0.021529 172.31.8.238 -> 54.192.118.243 TCP 66 35531 > http [ACK] Seq=98 Ack=1005371 Win=1256704 Len=0 TSval=6942876 TSecr=1685190526
170   0.021710 54.192.118.243 -> 172.31.8.238 TCP 23234 [TCP segment of a reassembled PDU]
171   0.021734 172.31.8.238 -> 54.192.118.243 TCP 66 35531 > http [ACK] Seq=98 Ack=1028539 Win=1233536 Len=0 TSval=6942876 TSecr=1685190526
172   0.021888 54.192.118.243 -> 172.31.8.238 TCP 55090 [TCP segment of a reassembled PDU]
173   0.021940 54.192.118.243 -> 172.31.8.238 TCP 26130 [TCP segment of a reassembled PDU]
174   0.021953 172.31.8.238 -> 54.192.118.243 TCP 66 35531 > http [ACK] Seq=98 Ack=1083563 Win=1178624 Len=0 TSval=6942876 TSecr=1685190526
175   0.021962 54.192.118.243 -> 172.31.8.238 TCP 2962 [TCP segment of a reassembled PDU]
176   0.021979 172.31.8.238 -> 54.192.118.243 TCP 66 35531 > http [ACK] Seq=98 Ack=1112523 Win=1149696 Len=0 TSval=6942876 TSecr=1685190526
177   0.022037 54.192.118.243 -> 172.31.8.238 TCP 1514 [TCP segment of a reassembled PDU]
178   0.022181 54.192.118.243 -> 172.31.8.238 TCP 18890 [TCP segment of a reassembled PDU]
179   0.022191 172.31.8.238 -> 54.192.118.243 TCP 66 35531 > http [ACK] Seq=98 Ack=1132795 Win=1230464 Len=0 TSval=6942876 TSecr=1685190526
180   0.022553 54.192.118.243 -> 172.31.8.238 TCP 5858 [TCP segment of a reassembled PDU]
181   0.022560 172.31.8.238 -> 54.192.118.243 TCP 66 35531 > http [ACK] Seq=98 Ack=1138587 Win=1251968 Len=0 TSval=6942876 TSecr=1685190526
182   0.022729 54.192.118.243 -> 172.31.8.238 TCP 26130 [TCP segment of a reassembled PDU]
183   0.022754 172.31.8.238 -> 54.192.118.243 TCP 66 35531 > http [ACK] Seq=98 Ack=1164651 Win=1225984 Len=0 TSval=6942876 TSecr=1685190526
184   0.022806 54.192.118.243 -> 172.31.8.238 TCP 26130 [TCP segment of a reassembled PDU]
185   0.022832 172.31.8.238 -> 54.192.118.243 TCP 66 35531 > http [ACK] Seq=98 Ack=1190715 Win=1259520 Len=0 TSval=6942877 TSecr=1685190526
186   0.022899 54.192.118.243 -> 172.31.8.238 TCP 26130 [TCP segment of a reassembled PDU]
187   0.022913 172.31.8.238 -> 54.192.118.243 TCP 66 35531 > http [ACK] Seq=98 Ack=1216779 Win=1311616 Len=0 TSval=6942877 TSecr=1685190526
188   0.022982 54.192.118.243 -> 172.31.8.238 TCP 26130 [TCP segment of a reassembled PDU]
189   0.022996 172.31.8.238 -> 54.192.118.243 TCP 66 35531 > http [ACK] Seq=98 Ack=1242843 Win=1363712 Len=0 TSval=6942877 TSecr=1685190526
190   0.023045 54.192.118.243 -> 172.31.8.238 TCP 20338 [TCP segment of a reassembled PDU]
191   0.023056 172.31.8.238 -> 54.192.118.243 TCP 66 35531 > http [ACK] Seq=98 Ack=1263115 Win=1404288 Len=0 TSval=6942877 TSecr=1685190526
192   0.023442 54.192.118.243 -> 172.31.8.238 TCP 26130 [TCP segment of a reassembled PDU]
193   0.023457 172.31.8.238 -> 54.192.118.243 TCP 66 35531 > http [ACK] Seq=98 Ack=1289179 Win=1456384 Len=0 TSval=6942877 TSecr=1685190526
194   0.023519 54.192.118.243 -> 172.31.8.238 TCP 24682 [TCP segment of a reassembled PDU]
195   0.023532 172.31.8.238 -> 54.192.118.243 TCP 66 35531 > http [ACK] Seq=98 Ack=1313795 Win=1505664 Len=0 TSval=6942877 TSecr=1685190526
196   0.023584 54.192.118.243 -> 172.31.8.238 TCP 14546 [TCP segment of a reassembled PDU]
197   0.023594 172.31.8.238 -> 54.192.118.243 TCP 66 35531 > http [ACK] Seq=98 Ack=1328275 Win=1534592 Len=0 TSval=6942877 TSecr=1685190526
198   0.023709 54.192.118.243 -> 172.31.8.238 TCP 18890 [TCP segment of a reassembled PDU]
199   0.023720 172.31.8.238 -> 54.192.118.243 TCP 66 35531 > http [ACK] Seq=98 Ack=1347099 Win=1572224 Len=0 TSval=6942877 TSecr=1685190527
200   0.023839 54.192.118.243 -> 172.31.8.238 TCP 26130 [TCP segment of a reassembled PDU]
201   0.023854 172.31.8.238 -> 54.192.118.243 TCP 66 35531 > http [ACK] Seq=98 Ack=1373163 Win=1624320 Len=0 TSval=6942877 TSecr=1685190527
202   0.023895 54.192.118.243 -> 172.31.8.238 TCP 20338 [TCP segment of a reassembled PDU]
203   0.023906 172.31.8.238 -> 54.192.118.243 TCP 66 35531 > http [ACK] Seq=98 Ack=1393435 Win=1624320 Len=0 TSval=6942877 TSecr=1685190527
204   0.024217 54.192.118.243 -> 172.31.8.238 TCP 26130 [TCP segment of a reassembled PDU]
205   0.024231 172.31.8.238 -> 54.192.118.243 TCP 66 35531 > http [ACK] Seq=98 Ack=1419499 Win=1624320 Len=0 TSval=6942877 TSecr=1685190527
206   0.024294 54.192.118.243 -> 172.31.8.238 TCP 26130 [TCP segment of a reassembled PDU]
207   0.024308 172.31.8.238 -> 54.192.118.243 TCP 66 35531 > http [ACK] Seq=98 Ack=1445563 Win=1624320 Len=0 TSval=6942877 TSecr=1685190527
208   0.024362 54.192.118.243 -> 172.31.8.238 TCP 13098 [TCP segment of a reassembled PDU]
209   0.024371 172.31.8.238 -> 54.192.118.243 TCP 66 35531 > http [ACK] Seq=98 Ack=1458595 Win=1624320 Len=0 TSval=6942877 TSecr=1685190527
210   0.024428 54.192.118.243 -> 172.31.8.238 TCP 11650 [TCP segment of a reassembled PDU]
211   0.024435 172.31.8.238 -> 54.192.118.243 TCP 66 35531 > http [ACK] Seq=98 Ack=1470179 Win=1624320 Len=0 TSval=6942877 TSecr=1685190527
212   0.024570 54.192.118.243 -> 172.31.8.238 TCP 26130 [TCP segment of a reassembled PDU]
213   0.024584 172.31.8.238 -> 54.192.118.243 TCP 66 35531 > http [ACK] Seq=98 Ack=1496243 Win=1624320 Len=0 TSval=6942877 TSecr=1685190527
214   0.024644 54.192.118.243 -> 172.31.8.238 TCP 26130 [TCP segment of a reassembled PDU]
215   0.024658 172.31.8.238 -> 54.192.118.243 TCP 66 35531 > http [ACK] Seq=98 Ack=1522307 Win=1624320 Len=0 TSval=6942877 TSecr=1685190527
216   0.024689 54.192.118.243 -> 172.31.8.238 TCP 1514 [TCP segment of a reassembled PDU]
217   0.024992 54.192.118.243 -> 172.31.8.238 TCP 21786 [TCP segment of a reassembled PDU]
218   0.025005 172.31.8.238 -> 54.192.118.243 TCP 66 35531 > http [ACK] Seq=98 Ack=1545475 Win=1624320 Len=0 TSval=6942877 TSecr=1685190527
219   0.025148 54.192.118.243 -> 172.31.8.238 TCP 26130 [TCP segment of a reassembled PDU]
220   0.025162 172.31.8.238 -> 54.192.118.243 TCP 66 35531 > http [ACK] Seq=98 Ack=1571539 Win=1624320 Len=0 TSval=6942877 TSecr=1685190527
221   0.025223 54.192.118.243 -> 172.31.8.238 TCP 26130 [TCP segment of a reassembled PDU]
222   0.025236 172.31.8.238 -> 54.192.118.243 TCP 66 35531 > http [ACK] Seq=98 Ack=1597603 Win=1624320 Len=0 TSval=6942877 TSecr=1685190527
223   0.025307 54.192.118.243 -> 172.31.8.238 TCP 26130 [TCP segment of a reassembled PDU]
224   0.025391 54.192.118.243 -> 172.31.8.238 TCP 26130 [TCP segment of a reassembled PDU]
225   0.025406 54.192.118.243 -> 172.31.8.238 TCP 4410 [TCP segment of a reassembled PDU]
226   0.025458 172.31.8.238 -> 54.192.118.243 TCP 66 35531 > http [ACK] Seq=98 Ack=1654075 Win=1567872 Len=0 TSval=6942877 TSecr=1685190527
227   0.025769 54.192.118.243 -> 172.31.8.238 TCP 26130 [TCP segment of a reassembled PDU]
228   0.025783 172.31.8.238 -> 54.192.118.243 TCP 66 35531 > http [ACK] Seq=98 Ack=1680139 Win=1624320 Len=0 TSval=6942877 TSecr=1685190527
229   0.025843 54.192.118.243 -> 172.31.8.238 TCP 26130 [TCP segment of a reassembled PDU]
230   0.025856 172.31.8.238 -> 54.192.118.243 TCP 66 35531 > http [ACK] Seq=98 Ack=1706203 Win=1624320 Len=0 TSval=6942877 TSecr=1685190527
231   0.025896 54.192.118.243 -> 172.31.8.238 TCP 2962 [TCP segment of a reassembled PDU]
232   0.025901 172.31.8.238 -> 54.192.118.243 TCP 66 35531 > http [ACK] Seq=98 Ack=1709099 Win=1624320 Len=0 TSval=6942877 TSecr=1685190527
233   0.025972 54.192.118.243 -> 172.31.8.238 TCP 10202 [TCP segment of a reassembled PDU]
234   0.025979 172.31.8.238 -> 54.192.118.243 TCP 66 35531 > http [ACK] Seq=98 Ack=1719235 Win=1624320 Len=0 TSval=6942877 TSecr=1685190527
235   0.026410 54.192.118.243 -> 172.31.8.238 TCP 4410 [TCP segment of a reassembled PDU]
236   0.026416 172.31.8.238 -> 54.192.118.243 TCP 66 35531 > http [ACK] Seq=98 Ack=1723579 Win=1624320 Len=0 TSval=6942877 TSecr=1685190527
237   0.026588 54.192.118.243 -> 172.31.8.238 TCP 26130 [TCP segment of a reassembled PDU]
238   0.026602 172.31.8.238 -> 54.192.118.243 TCP 66 35531 > http [ACK] Seq=98 Ack=1749643 Win=1624320 Len=0 TSval=6942877 TSecr=1685190527
239   0.026658 54.192.118.243 -> 172.31.8.238 TCP 18890 [TCP segment of a reassembled PDU]
240   0.026669 172.31.8.238 -> 54.192.118.243 TCP 66 35531 > http [ACK] Seq=98 Ack=1768467 Win=1624320 Len=0 TSval=6942877 TSecr=1685190527
241   0.026746 54.192.118.243 -> 172.31.8.238 TCP 33370 [TCP segment of a reassembled PDU]
242   0.026762 172.31.8.238 -> 54.192.118.243 TCP 66 35531 > http [ACK] Seq=98 Ack=1801771 Win=1624320 Len=0 TSval=6942877 TSecr=1685190527
243   0.026823 54.192.118.243 -> 172.31.8.238 TCP 26130 [TCP segment of a reassembled PDU]
244   0.026836 172.31.8.238 -> 54.192.118.243 TCP 66 35531 > http [ACK] Seq=98 Ack=1827835 Win=1624320 Len=0 TSval=6942878 TSecr=1685190527
245   0.026894 54.192.118.243 -> 172.31.8.238 TCP 21786 [TCP segment of a reassembled PDU]
246   0.026905 172.31.8.238 -> 54.192.118.243 TCP 66 35531 > http [ACK] Seq=98 Ack=1849555 Win=1624320 Len=0 TSval=6942878 TSecr=1685190527
247   0.027242 54.192.118.243 -> 172.31.8.238 TCP 2962 [TCP segment of a reassembled PDU]
248   0.027249 172.31.8.238 -> 54.192.118.243 TCP 66 35531 > http [ACK] Seq=98 Ack=1852451 Win=1624320 Len=0 TSval=6942878 TSecr=1685190527
249   0.027423 54.192.118.243 -> 172.31.8.238 TCP 26130 [TCP segment of a reassembled PDU]
250   0.027436 172.31.8.238 -> 54.192.118.243 TCP 66 35531 > http [ACK] Seq=98 Ack=1878515 Win=1624320 Len=0 TSval=6942878 TSecr=1685190527
251   0.027496 54.192.118.243 -> 172.31.8.238 TCP 26130 [TCP segment of a reassembled PDU]
252   0.027505 172.31.8.238 -> 54.192.118.243 TCP 66 35531 > http [ACK] Seq=98 Ack=1904579 Win=1624320 Len=0 TSval=6942878 TSecr=1685190527
253   0.027582 54.192.118.243 -> 172.31.8.238 TCP 26130 [TCP segment of a reassembled PDU]
254   0.027590 172.31.8.238 -> 54.192.118.243 TCP 66 35531 > http [ACK] Seq=98 Ack=1930643 Win=1624320 Len=0 TSval=6942878 TSecr=1685190527
255   0.027663 54.192.118.243 -> 172.31.8.238 TCP 26130 [TCP segment of a reassembled PDU]
256   0.027737 54.192.118.243 -> 172.31.8.238 TCP 23234 [TCP segment of a reassembled PDU]
257   0.027752 172.31.8.238 -> 54.192.118.243 TCP 66 35531 > http [ACK] Seq=98 Ack=1979875 Win=1579136 Len=0 TSval=6942878 TSecr=1685190527
258   0.028112 54.192.118.243 -> 172.31.8.238 TCP 5858 [TCP segment of a reassembled PDU]
259   0.028118 172.31.8.238 -> 54.192.118.243 TCP 66 35531 > http [ACK] Seq=98 Ack=1985667 Win=1624320 Len=0 TSval=6942878 TSecr=1685190527
260   0.028287 54.192.118.243 -> 172.31.8.238 TCP 26130 [TCP segment of a reassembled PDU]
261   0.028295 172.31.8.238 -> 54.192.118.243 TCP 66 35531 > http [ACK] Seq=98 Ack=2011731 Win=1624320 Len=0 TSval=6942878 TSecr=1685190527
262   0.028357 54.192.118.243 -> 172.31.8.238 TCP 26130 [TCP segment of a reassembled PDU]
263   0.028364 172.31.8.238 -> 54.192.118.243 TCP 66 35531 > http [ACK] Seq=98 Ack=2037795 Win=1624320 Len=0 TSval=6942878 TSecr=1685190527
264   0.028418 54.192.118.243 -> 172.31.8.238 TCP 7306 [TCP segment of a reassembled PDU]
265   0.028423 172.31.8.238 -> 54.192.118.243 TCP 66 35531 > http [ACK] Seq=98 Ack=2045035 Win=1624320 Len=0 TSval=6942878 TSecr=1685190527
266   0.028511 54.192.118.243 -> 172.31.8.238 TCP 26130 [TCP segment of a reassembled PDU]
267   0.028518 172.31.8.238 -> 54.192.118.243 TCP 66 35531 > http [ACK] Seq=98 Ack=2071099 Win=1624320 Len=0 TSval=6942878 TSecr=1685190527
268   0.028599 54.192.118.243 -> 172.31.8.238 TCP 26130 [TCP segment of a reassembled PDU]
269   0.028608 172.31.8.238 -> 54.192.118.243 TCP 66 35531 > http [ACK] Seq=98 Ack=2097163 Win=1624320 Len=0 TSval=6942878 TSecr=1685190527
270   0.028654 54.192.118.243 -> 172.31.8.238 TCP 13098 [TCP segment of a reassembled PDU]
271   0.028661 172.31.8.238 -> 54.192.118.243 TCP 66 35531 > http [ACK] Seq=98 Ack=2110195 Win=1624320 Len=0 TSval=6942878 TSecr=1685190527
272   0.028955 54.192.118.243 -> 172.31.8.238 TCP 24682 [TCP segment of a reassembled PDU]
273   0.028963 172.31.8.238 -> 54.192.118.243 TCP 66 35531 > http [ACK] Seq=98 Ack=2134811 Win=1624320 Len=0 TSval=6942878 TSecr=1685190527
274   0.029105 54.192.118.243 -> 172.31.8.238 TCP 24682 [TCP segment of a reassembled PDU]
275   0.029112 172.31.8.238 -> 54.192.118.243 TCP 66 35531 > http [ACK] Seq=98 Ack=2159427 Win=1624320 Len=0 TSval=6942878 TSecr=1685190527
276   0.029225 54.192.118.243 -> 172.31.8.238 TCP 27578 [TCP segment of a reassembled PDU]
277   0.029234 172.31.8.238 -> 54.192.118.243 TCP 66 35531 > http [ACK] Seq=98 Ack=2186939 Win=1624320 Len=0 TSval=6942878 TSecr=1685190527
278   0.029253 54.192.118.243 -> 172.31.8.238 TCP 26130 [TCP segment of a reassembled PDU]
279   0.029277 172.31.8.238 -> 54.192.118.243 TCP 66 35531 > http [ACK] Seq=98 Ack=2213003 Win=1614848 Len=0 TSval=6942878 TSecr=1685190527
280   0.029356 54.192.118.243 -> 172.31.8.238 TCP 26130 [TCP segment of a reassembled PDU]
281   0.029367 172.31.8.238 -> 54.192.118.243 TCP 66 35531 > http [ACK] Seq=98 Ack=2239067 Win=1624320 Len=0 TSval=6942878 TSecr=1685190527
282   0.029411 54.192.118.243 -> 172.31.8.238 TCP 1514 [TCP segment of a reassembled PDU]
283   0.029464 54.192.118.243 -> 172.31.8.238 TCP 7306 [TCP segment of a reassembled PDU]
284   0.029468 172.31.8.238 -> 54.192.118.243 TCP 66 35531 > http [ACK] Seq=98 Ack=2247755 Win=1624320 Len=0 TSval=6942878 TSecr=1685190527
285   0.029598 54.192.118.243 -> 172.31.8.238 TCP 26130 [TCP segment of a reassembled PDU]
286   0.029605 172.31.8.238 -> 54.192.118.243 TCP 66 35531 > http [ACK] Seq=98 Ack=2273819 Win=1624320 Len=0 TSval=6942878 TSecr=1685190527
287   0.029836 54.192.118.243 -> 172.31.8.238 TCP 31922 [TCP segment of a reassembled PDU]
288   0.029844 172.31.8.238 -> 54.192.118.243 TCP 66 35531 > http [ACK] Seq=98 Ack=2305675 Win=1624320 Len=0 TSval=6942878 TSecr=1685190527
289   0.029938 54.192.118.243 -> 172.31.8.238 TCP 4410 [TCP segment of a reassembled PDU]
290   0.029943 172.31.8.238 -> 54.192.118.243 TCP 66 35531 > http [ACK] Seq=98 Ack=2310019 Win=1624320 Len=0 TSval=6942878 TSecr=1685190527
291   0.030118 54.192.118.243 -> 172.31.8.238 TCP 26130 [TCP segment of a reassembled PDU]
292   0.030126 172.31.8.238 -> 54.192.118.243 TCP 66 35531 > http [ACK] Seq=98 Ack=2336083 Win=1624320 Len=0 TSval=6942878 TSecr=1685190527
293   0.030243 54.192.118.243 -> 172.31.8.238 TCP 26130 [TCP segment of a reassembled PDU]
294   0.030251 172.31.8.238 -> 54.192.118.243 TCP 66 35531 > http [ACK] Seq=98 Ack=2362147 Win=1624320 Len=0 TSval=6942878 TSecr=1685190527
295   0.030269 54.192.118.243 -> 172.31.8.238 TCP 26130 [TCP segment of a reassembled PDU]
296   0.030292 172.31.8.238 -> 54.192.118.243 TCP 66 35531 > http [ACK] Seq=98 Ack=2388211 Win=1617280 Len=0 TSval=6942878 TSecr=1685190527
297   0.030373 54.192.118.243 -> 172.31.8.238 TCP 26130 [TCP segment of a reassembled PDU]
298   0.030380 172.31.8.238 -> 54.192.118.243 TCP 66 35531 > http [ACK] Seq=98 Ack=2414275 Win=1624320 Len=0 TSval=6942878 TSecr=1685190527
299   0.030446 54.192.118.243 -> 172.31.8.238 TCP 21786 [TCP segment of a reassembled PDU]
300   0.030453 172.31.8.238 -> 54.192.118.243 TCP 66 35531 > http [ACK] Seq=98 Ack=2435995 Win=1624320 Len=0 TSval=6942878 TSecr=1685190527
301   0.030635 54.192.118.243 -> 172.31.8.238 TCP 26130 [TCP segment of a reassembled PDU]
302   0.030644 172.31.8.238 -> 54.192.118.243 TCP 66 35531 > http [ACK] Seq=98 Ack=2462059 Win=1624320 Len=0 TSval=6942878 TSecr=1685190527
303   0.030707 54.192.118.243 -> 172.31.8.238 TCP 26130 [TCP segment of a reassembled PDU]
304   0.030719 172.31.8.238 -> 54.192.118.243 TCP 66 35531 > http [ACK] Seq=98 Ack=2488123 Win=1624320 Len=0 TSval=6942878 TSecr=1685190527
305   0.030778 54.192.118.243 -> 172.31.8.238 TCP 14546 [TCP segment of a reassembled PDU]
306   0.030785 172.31.8.238 -> 54.192.118.243 TCP 66 35531 > http [ACK] Seq=98 Ack=2502603 Win=1624320 Len=0 TSval=6942879 TSecr=1685190527
307   0.030871 54.192.118.243 -> 172.31.8.238 TCP 26130 [TCP segment of a reassembled PDU]
308   0.030878 172.31.8.238 -> 54.192.118.243 TCP 66 35531 > http [ACK] Seq=98 Ack=2528667 Win=1624320 Len=0 TSval=6942879 TSecr=1685190527
309   0.030954 54.192.118.243 -> 172.31.8.238 TCP 21786 [TCP segment of a reassembled PDU]
310   0.030961 172.31.8.238 -> 54.192.118.243 TCP 66 35531 > http [ACK] Seq=98 Ack=2550387 Win=1624320 Len=0 TSval=6942879 TSecr=1685190527
311   0.031037 54.192.118.243 -> 172.31.8.238 TCP 23234 [TCP segment of a reassembled PDU]
312   0.031044 172.31.8.238 -> 54.192.118.243 TCP 66 35531 > http [ACK] Seq=98 Ack=2573555 Win=1624320 Len=0 TSval=6942879 TSecr=1685190527
313   0.031120 54.192.118.243 -> 172.31.8.238 TCP 24682 [TCP segment of a reassembled PDU]
314   0.031127 172.31.8.238 -> 54.192.118.243 TCP 66 35531 > http [ACK] Seq=98 Ack=2598171 Win=1624320 Len=0 TSval=6942879 TSecr=1685190527
315   0.031265 54.192.118.243 -> 172.31.8.238 TCP 33370 [TCP segment of a reassembled PDU]
316   0.031278 172.31.8.238 -> 54.192.118.243 TCP 66 35531 > http [ACK] Seq=98 Ack=2631475 Win=1624320 Len=0 TSval=6942879 TSecr=1685190527
317   0.031578 54.192.118.243 -> 172.31.8.238 TCP 23234 [TCP segment of a reassembled PDU]
318   0.031586 172.31.8.238 -> 54.192.118.243 TCP 66 35531 > http [ACK] Seq=98 Ack=2654643 Win=1624320 Len=0 TSval=6942879 TSecr=1685190527
319   0.031759 54.192.118.243 -> 172.31.8.238 TCP 26130 [TCP segment of a reassembled PDU]
320   0.031774 172.31.8.238 -> 54.192.118.243 TCP 66 35531 > http [ACK] Seq=98 Ack=2680707 Win=1624320 Len=0 TSval=6942879 TSecr=1685190527
321   0.031787 54.192.118.243 -> 172.31.8.238 TCP 15994 [TCP segment of a reassembled PDU]
322   0.031793 172.31.8.238 -> 54.192.118.243 TCP 66 35531 > http [ACK] Seq=98 Ack=2696635 Win=1624320 Len=0 TSval=6942879 TSecr=1685190527
323   0.031897 54.192.118.243 -> 172.31.8.238 TCP 20338 [TCP segment of a reassembled PDU]
324   0.031906 172.31.8.238 -> 54.192.118.243 TCP 66 35531 > http [ACK] Seq=98 Ack=2716907 Win=1624320 Len=0 TSval=6942879 TSecr=1685190527
325   0.031970 54.192.118.243 -> 172.31.8.238 TCP 5858 [TCP segment of a reassembled PDU]
326   0.031979 172.31.8.238 -> 54.192.118.243 TCP 66 35531 > http [ACK] Seq=98 Ack=2722699 Win=1624320 Len=0 TSval=6942879 TSecr=1685190527
327   0.032087 54.192.118.243 -> 172.31.8.238 TCP 52194 [TCP segment of a reassembled PDU]
328   0.032122 54.192.118.243 -> 172.31.8.238 TCP 4410 [TCP segment of a reassembled PDU]
329   0.032126 172.31.8.238 -> 54.192.118.243 TCP 66 35531 > http [ACK] Seq=98 Ack=2774827 Win=1617280 Len=0 TSval=6942879 TSecr=1685190527
330   0.032141 172.31.8.238 -> 54.192.118.243 TCP 66 35531 > http [ACK] Seq=98 Ack=2779171 Win=1613056 Len=0 TSval=6942879 TSecr=1685190527
331   0.032183 54.192.118.243 -> 172.31.8.238 TCP 21786 [TCP segment of a reassembled PDU]
332   0.032191 172.31.8.238 -> 54.192.118.243 TCP 66 35531 > http [ACK] Seq=98 Ack=2800891 Win=1624320 Len=0 TSval=6942879 TSecr=1685190527
333   0.032296 54.192.118.243 -> 172.31.8.238 TCP 26130 [TCP segment of a reassembled PDU]
334   0.032304 172.31.8.238 -> 54.192.118.243 TCP 66 35531 > http [ACK] Seq=98 Ack=2826955 Win=1624320 Len=0 TSval=6942879 TSecr=1685190527
335   0.032546 54.192.118.243 -> 172.31.8.238 TCP 26130 [TCP segment of a reassembled PDU]
336   0.032556 172.31.8.238 -> 54.192.118.243 TCP 66 35531 > http [ACK] Seq=98 Ack=2853019 Win=1624320 Len=0 TSval=6942879 TSecr=1685190527
337   0.032618 54.192.118.243 -> 172.31.8.238 TCP 26130 [TCP segment of a reassembled PDU]
338   0.032626 172.31.8.238 -> 54.192.118.243 TCP 66 35531 > http [ACK] Seq=98 Ack=2879083 Win=1624320 Len=0 TSval=6942879 TSecr=1685190527
339   0.032747 54.192.118.243 -> 172.31.8.238 TCP 26130 [TCP segment of a reassembled PDU]
340   0.032757 172.31.8.238 -> 54.192.118.243 TCP 66 35531 > http [ACK] Seq=98 Ack=2905147 Win=1624320 Len=0 TSval=6942879 TSecr=1685190527
341   0.032885 54.192.118.243 -> 172.31.8.238 TCP 26130 [TCP segment of a reassembled PDU]
342   0.032895 172.31.8.238 -> 54.192.118.243 TCP 66 35531 > http [ACK] Seq=98 Ack=2931211 Win=1624320 Len=0 TSval=6942879 TSecr=1685190527
343   0.032905 54.192.118.243 -> 172.31.8.238 TCP 10202 [TCP segment of a reassembled PDU]
344   0.032909 172.31.8.238 -> 54.192.118.243 TCP 66 35531 > http [ACK] Seq=98 Ack=2941347 Win=1624320 Len=0 TSval=6942879 TSecr=1685190527
345   0.032924 54.192.118.243 -> 172.31.8.238 TCP 15994 [TCP segment of a reassembled PDU]
346   0.032944 172.31.8.238 -> 54.192.118.243 TCP 66 35531 > http [ACK] Seq=98 Ack=2957275 Win=1617152 Len=0 TSval=6942879 TSecr=1685190527
347   0.033129 54.192.118.243 -> 172.31.8.238 TCP 26130 [TCP segment of a reassembled PDU]
348   0.033139 172.31.8.238 -> 54.192.118.243 TCP 66 35531 > http [ACK] Seq=98 Ack=2983339 Win=1624320 Len=0 TSval=6942879 TSecr=1685190527
