[Measurement for 10mb at 18:43:02 19.43.2014] 
Tshark:

  1   0.000000 172.31.8.238 -> 172.31.0.2   DNS 89 Standard query 0x4b66  A d1xzxs93r3iphc.cloudfront.net
  2   0.000027 172.31.8.238 -> 172.31.0.2   DNS 89 Standard query 0x71e3  AAAA d1xzxs93r3iphc.cloudfront.net
  3   0.001110   172.31.0.2 -> 172.31.8.238 DNS 217 Standard query response 0x4b66  A 54.230.118.138 A 54.230.118.248 A 54.230.119.12 A 54.239.132.84 A 54.239.132.90 A 54.239.132.103 A 54.192.118.218 A 54.230.117.42
  4   0.001199   172.31.0.2 -> 172.31.8.238 DNS 170 Standard query response 0x71e3 
  5   0.002204 172.31.8.238 -> 54.230.118.138 TCP 74 58261 > http [SYN] Seq=0 Win=26883 Len=0 MSS=8961 SACK_PERM=1 TSval=1552568 TSecr=0 WS=128
  6   0.002815 54.230.118.138 -> 172.31.8.238 TCP 74 http > 58261 [SYN, ACK] Seq=0 Ack=1 Win=14480 Len=0 MSS=1460 SACK_PERM=1 TSval=1683386376 TSecr=1552568 WS=128
  7   0.002830 172.31.8.238 -> 54.230.118.138 TCP 66 58261 > http [ACK] Seq=1 Ack=1 Win=27008 Len=0 TSval=1552568 TSecr=1683386376
  8   0.002870 172.31.8.238 -> 54.230.118.138 HTTP 163 GET /10mb HTTP/1.1 
  9   0.003567 54.230.118.138 -> 172.31.8.238 TCP 66 http > 58261 [ACK] Seq=1 Ack=98 Win=14592 Len=0 TSval=1683386376 TSecr=1552568
 10   0.218291 54.230.118.138 -> 172.31.8.238 TCP 11650 [TCP segment of a reassembled PDU]
 11   0.218319 172.31.8.238 -> 54.230.118.138 TCP 66 58261 > http [ACK] Seq=98 Ack=11585 Win=50176 Len=0 TSval=1552622 TSecr=1683386397
 12   0.218326 54.230.118.138 -> 172.31.8.238 TCP 1514 [TCP segment of a reassembled PDU]
 13   0.218330 172.31.8.238 -> 54.230.118.138 TCP 66 58261 > http [ACK] Seq=98 Ack=13033 Win=52992 Len=0 TSval=1552622 TSecr=1683386397
 14   0.219190 54.230.118.138 -> 172.31.8.238 TCP 4410 [TCP segment of a reassembled PDU]
 15   0.219199 172.31.8.238 -> 54.230.118.138 TCP 66 58261 > http [ACK] Seq=98 Ack=17377 Win=61696 Len=0 TSval=1552622 TSecr=1683386397
 16   0.219262 54.230.118.138 -> 172.31.8.238 TCP 8754 [TCP segment of a reassembled PDU]
 17   0.219269 172.31.8.238 -> 54.230.118.138 TCP 66 58261 > http [ACK] Seq=98 Ack=26065 Win=75136 Len=0 TSval=1552622 TSecr=1683386397
 18   0.219692 54.230.118.138 -> 172.31.8.238 TCP 3993 [TCP segment of a reassembled PDU]
 19   0.219697 172.31.8.238 -> 54.230.118.138 TCP 66 58261 > http [ACK] Seq=98 Ack=29992 Win=71296 Len=0 TSval=1552622 TSecr=1683386397
 20   0.378272 54.230.118.138 -> 172.31.8.238 TCP 1526 [TCP segment of a reassembled PDU]
 21   0.378299 172.31.8.238 -> 54.230.118.138 TCP 66 58261 > http [ACK] Seq=98 Ack=31452 Win=82048 Len=0 TSval=1552662 TSecr=1683386413
 22   0.378520 54.230.118.138 -> 172.31.8.238 TCP 10202 [TCP segment of a reassembled PDU]
 23   0.378529 172.31.8.238 -> 54.230.118.138 TCP 66 58261 > http [ACK] Seq=98 Ack=41588 Win=101248 Len=0 TSval=1552662 TSecr=1683386413
 24   0.378570 54.230.118.138 -> 172.31.8.238 TCP 7306 [TCP segment of a reassembled PDU]
 25   0.378578 172.31.8.238 -> 54.230.118.138 TCP 66 58261 > http [ACK] Seq=98 Ack=48828 Win=105984 Len=0 TSval=1552662 TSecr=1683386413
 26   0.379210 54.230.118.138 -> 172.31.8.238 TCP 1514 [TCP segment of a reassembled PDU]
 27   0.379215 172.31.8.238 -> 54.230.118.138 TCP 66 58261 > http [ACK] Seq=98 Ack=50276 Win=109056 Len=0 TSval=1552662 TSecr=1683386413
 28   0.379364 54.230.118.138 -> 172.31.8.238 TCP 23234 [TCP segment of a reassembled PDU]
 29   0.379377 172.31.8.238 -> 54.230.118.138 TCP 66 58261 > http [ACK] Seq=98 Ack=73444 Win=85888 Len=0 TSval=1552662 TSecr=1683386413
 30   0.380054 54.230.118.138 -> 172.31.8.238 TCP 6254 [TCP segment of a reassembled PDU]
 31   0.380066 172.31.8.238 -> 54.230.118.138 TCP 66 58261 > http [ACK] Seq=98 Ack=79632 Win=105984 Len=0 TSval=1552662 TSecr=1683386413
 32   0.539085 54.230.118.138 -> 172.31.8.238 TCP 1514 [TCP segment of a reassembled PDU]
 33   0.539109 172.31.8.238 -> 54.230.118.138 TCP 66 58261 > http [ACK] Seq=98 Ack=81080 Win=109056 Len=0 TSval=1552702 TSecr=1683386429
 34   0.539122 54.230.118.138 -> 172.31.8.238 TCP 1538 [TCP segment of a reassembled PDU]
 35   0.539126 172.31.8.238 -> 54.230.118.138 TCP 66 58261 > http [ACK] Seq=98 Ack=82552 Win=109056 Len=0 TSval=1552702 TSecr=1683386429
 36   0.539290 54.230.118.138 -> 172.31.8.238 TCP 7366 [TCP segment of a reassembled PDU]
 37   0.539298 172.31.8.238 -> 54.230.118.138 TCP 66 58261 > http [ACK] Seq=98 Ack=89852 Win=123648 Len=0 TSval=1552702 TSecr=1683386429
 38   0.539314 54.230.118.138 -> 172.31.8.238 TCP 5858 [TCP segment of a reassembled PDU]
 39   0.539318 172.31.8.238 -> 54.230.118.138 TCP 66 58261 > http [ACK] Seq=98 Ack=95644 Win=135296 Len=0 TSval=1552702 TSecr=1683386429
 40   0.539325 54.230.118.138 -> 172.31.8.238 TCP 114 [TCP segment of a reassembled PDU]
 41   0.539348 172.31.8.238 -> 54.230.118.138 TCP 66 58261 > http [ACK] Seq=98 Ack=95692 Win=135296 Len=0 TSval=1552702 TSecr=1683386429
 42   0.539798 54.230.118.138 -> 172.31.8.238 TCP 8754 [TCP segment of a reassembled PDU]
 43   0.539807 172.31.8.238 -> 54.230.118.138 TCP 66 58261 > http [ACK] Seq=98 Ack=104380 Win=152576 Len=0 TSval=1552702 TSecr=1683386429
 44   0.539934 54.230.118.138 -> 172.31.8.238 TCP 15994 [TCP segment of a reassembled PDU]
 45   0.539944 172.31.8.238 -> 54.230.118.138 TCP 66 58261 > http [ACK] Seq=98 Ack=120308 Win=184448 Len=0 TSval=1552702 TSecr=1683386429
 46   0.540495 54.230.118.138 -> 172.31.8.238 TCP 2962 [TCP segment of a reassembled PDU]
 47   0.540501 172.31.8.238 -> 54.230.118.138 TCP 66 58261 > http [ACK] Seq=98 Ack=123204 Win=190208 Len=0 TSval=1552702 TSecr=1683386429
 48   0.540635 54.230.118.138 -> 172.31.8.238 TCP 17814 [TCP segment of a reassembled PDU]
 49   0.540645 172.31.8.238 -> 54.230.118.138 TCP 66 58261 > http [ACK] Seq=98 Ack=140952 Win=225792 Len=0 TSval=1552702 TSecr=1683386429
 50   0.699676 54.230.118.138 -> 172.31.8.238 TCP 1526 [TCP segment of a reassembled PDU]
