[Measurement for 10mb at 01:42:23 20.42.2014] 
Tshark:

  1   0.000000 172.31.8.238 -> 172.31.0.2   DNS 89 Standard query 0x80c3  A d1xzxs93r3iphc.cloudfront.net
  2   0.000040 172.31.8.238 -> 172.31.0.2   DNS 89 Standard query 0x5d87  AAAA d1xzxs93r3iphc.cloudfront.net
  3   0.000662   172.31.0.2 -> 172.31.8.238 DNS 170 Standard query response 0x5d87 
  4   0.000673   172.31.0.2 -> 172.31.8.238 DNS 217 Standard query response 0x80c3  A 54.230.118.136 A 54.230.118.239 A 54.230.119.18 A 54.230.119.58 A 54.239.132.90 A 54.192.118.219 A 54.192.118.235 A 54.192.118.236
  5   0.003868 172.31.8.238 -> 54.230.118.136 TCP 74 43339 > http [SYN] Seq=0 Win=26883 Len=0 MSS=8961 SACK_PERM=1 TSval=7842791 TSecr=0 WS=128
  6   0.004573 54.230.118.136 -> 172.31.8.238 TCP 74 http > 43339 [SYN, ACK] Seq=0 Ack=1 Win=14480 Len=0 MSS=1460 SACK_PERM=1 TSval=1681893472 TSecr=7842791 WS=128
  7   0.004586 172.31.8.238 -> 54.230.118.136 TCP 66 43339 > http [ACK] Seq=1 Ack=1 Win=27008 Len=0 TSval=7842791 TSecr=1681893472
  8   0.004627 172.31.8.238 -> 54.230.118.136 HTTP 163 GET /10mb HTTP/1.1 
  9   0.005081 54.230.118.136 -> 172.31.8.238 TCP 66 http > 43339 [ACK] Seq=1 Ack=98 Win=14592 Len=0 TSval=1681893472 TSecr=7842791
 10   0.006591 54.230.118.136 -> 172.31.8.238 TCP 524 [TCP segment of a reassembled PDU]
 11   0.006599 172.31.8.238 -> 54.230.118.136 TCP 66 43339 > http [ACK] Seq=98 Ack=459 Win=28032 Len=0 TSval=7842792 TSecr=1681893472
 12   0.006726 54.230.118.136 -> 172.31.8.238 TCP 13098 [TCP segment of a reassembled PDU]
 13   0.006737 172.31.8.238 -> 54.230.118.136 TCP 66 43339 > http [ACK] Seq=98 Ack=13491 Win=54144 Len=0 TSval=7842792 TSecr=1681893472
 14   0.007414 54.230.118.136 -> 172.31.8.238 TCP 4410 [TCP segment of a reassembled PDU]
 15   0.007421 172.31.8.238 -> 54.230.118.136 TCP 66 43339 > http [ACK] Seq=98 Ack=17835 Win=62720 Len=0 TSval=7842792 TSecr=1681893472
 16   0.007517 54.230.118.136 -> 172.31.8.238 TCP 8754 [TCP segment of a reassembled PDU]
 17   0.007524 172.31.8.238 -> 54.230.118.136 TCP 66 43339 > http [ACK] Seq=98 Ack=26523 Win=80128 Len=0 TSval=7842792 TSecr=1681893472
 18   0.007924 54.230.118.136 -> 172.31.8.238 TCP 7306 [TCP segment of a reassembled PDU]
 19   0.007931 172.31.8.238 -> 54.230.118.136 TCP 66 43339 > http [ACK] Seq=98 Ack=33763 Win=94592 Len=0 TSval=7842792 TSecr=1681893472
 20   0.007965 54.230.118.136 -> 172.31.8.238 TCP 2962 [TCP segment of a reassembled PDU]
 21   0.007970 172.31.8.238 -> 54.230.118.136 TCP 66 43339 > http [ACK] Seq=98 Ack=36659 Win=100480 Len=0 TSval=7842792 TSecr=1681893472
 22   0.008144 54.230.118.136 -> 172.31.8.238 TCP 5858 [TCP segment of a reassembled PDU]
 23   0.008150 172.31.8.238 -> 54.230.118.136 TCP 66 43339 > http [ACK] Seq=98 Ack=42451 Win=108416 Len=0 TSval=7842792 TSecr=1681893472
 24   0.008190 54.230.118.136 -> 172.31.8.238 TCP 4410 [TCP segment of a reassembled PDU]
 25   0.008195 172.31.8.238 -> 54.230.118.136 TCP 66 43339 > http [ACK] Seq=98 Ack=46795 Win=109056 Len=0 TSval=7842792 TSecr=1681893472
 26   0.008464 54.230.118.136 -> 172.31.8.238 TCP 5858 [TCP segment of a reassembled PDU]
 27   0.008471 172.31.8.238 -> 54.230.118.136 TCP 66 43339 > http [ACK] Seq=98 Ack=52587 Win=108416 Len=0 TSval=7842792 TSecr=1681893472
 28   0.008685 54.230.118.136 -> 172.31.8.238 TCP 5858 [TCP segment of a reassembled PDU]
 29   0.008692 172.31.8.238 -> 54.230.118.136 TCP 66 43339 > http [ACK] Seq=98 Ack=58379 Win=108416 Len=0 TSval=7842792 TSecr=1681893472
 30   0.008756 54.230.118.136 -> 172.31.8.238 TCP 7306 [TCP segment of a reassembled PDU]
 31   0.008763 172.31.8.238 -> 54.230.118.136 TCP 66 43339 > http [ACK] Seq=98 Ack=65619 Win=105984 Len=0 TSval=7842792 TSecr=1681893472
 32   0.009173 54.230.118.136 -> 172.31.8.238 TCP 8754 [TCP segment of a reassembled PDU]
 33   0.009181 172.31.8.238 -> 54.230.118.136 TCP 66 43339 > http [ACK] Seq=98 Ack=74307 Win=103680 Len=0 TSval=7842792 TSecr=1681893473
 34   0.009313 54.230.118.136 -> 172.31.8.238 TCP 21786 [TCP segment of a reassembled PDU]
 35   0.009335 172.31.8.238 -> 54.230.118.136 TCP 66 43339 > http [ACK] Seq=98 Ack=96027 Win=82176 Len=0 TSval=7842792 TSecr=1681893473
 36   0.009934 54.230.118.136 -> 172.31.8.238 TCP 4410 [TCP segment of a reassembled PDU]
 37   0.009940 172.31.8.238 -> 54.230.118.136 TCP 66 43339 > http [ACK] Seq=98 Ack=100371 Win=109056 Len=0 TSval=7842792 TSecr=1681893473
 38   0.010109 54.230.118.136 -> 172.31.8.238 TCP 26130 [TCP segment of a reassembled PDU]
 39   0.010125 172.31.8.238 -> 54.230.118.136 TCP 66 43339 > http [ACK] Seq=98 Ack=126435 Win=83072 Len=0 TSval=7842792 TSecr=1681893473
 40   0.010133 54.230.118.136 -> 172.31.8.238 TCP 2962 [TCP segment of a reassembled PDU]
 41   0.010137 172.31.8.238 -> 54.230.118.136 TCP 66 43339 > http [ACK] Seq=98 Ack=129331 Win=80256 Len=0 TSval=7842792 TSecr=1681893473
 42   0.010458 54.230.118.136 -> 172.31.8.238 TCP 1514 [TCP segment of a reassembled PDU]
 43   0.010464 172.31.8.238 -> 54.230.118.136 TCP 66 43339 > http [ACK] Seq=98 Ack=130779 Win=109056 Len=0 TSval=7842792 TSecr=1681893473
 44   0.010698 54.230.118.136 -> 172.31.8.238 TCP 5858 [TCP segment of a reassembled PDU]
 45   0.010705 172.31.8.238 -> 54.230.118.136 TCP 66 43339 > http [ACK] Seq=98 Ack=136571 Win=108416 Len=0 TSval=7842793 TSecr=1681893473
 46   0.010833 54.230.118.136 -> 172.31.8.238 TCP 20338 [TCP segment of a reassembled PDU]
 47   0.010845 172.31.8.238 -> 54.230.118.136 TCP 66 43339 > http [ACK] Seq=98 Ack=156843 Win=149632 Len=0 TSval=7842793 TSecr=1681893473
 48   0.010994 54.230.118.136 -> 172.31.8.238 TCP 8754 [TCP segment of a reassembled PDU]
 49   0.011002 172.31.8.238 -> 54.230.118.136 TCP 66 43339 > http [ACK] Seq=98 Ack=165531 Win=167040 Len=0 TSval=7842793 TSecr=1681893473
 50   0.011095 54.230.118.136 -> 172.31.8.238 TCP 4410 [TCP segment of a reassembled PDU]
 51   0.011101 172.31.8.238 -> 54.230.118.136 TCP 66 43339 > http [ACK] Seq=98 Ack=169875 Win=175616 Len=0 TSval=7842793 TSecr=1681893473
 52   0.011490 54.230.118.136 -> 172.31.8.238 TCP 4410 [TCP segment of a reassembled PDU]
 53   0.011496 172.31.8.238 -> 54.230.118.136 TCP 66 43339 > http [ACK] Seq=98 Ack=174219 Win=184320 Len=0 TSval=7842793 TSecr=1681893473
 54   0.011620 54.230.118.136 -> 172.31.8.238 TCP 8754 [TCP segment of a reassembled PDU]
 55   0.011628 172.31.8.238 -> 54.230.118.136 TCP 66 43339 > http [ACK] Seq=98 Ack=182907 Win=201728 Len=0 TSval=7842793 TSecr=1681893473
 56   0.011767 54.230.118.136 -> 172.31.8.238 TCP 26130 [TCP segment of a reassembled PDU]
 57   0.011782 172.31.8.238 -> 54.230.118.136 TCP 66 43339 > http [ACK] Seq=98 Ack=208971 Win=253824 Len=0 TSval=7842793 TSecr=1681893473
 58   0.012516 54.230.118.136 -> 172.31.8.238 TCP 8754 [TCP segment of a reassembled PDU]
 59   0.012524 172.31.8.238 -> 54.230.118.136 TCP 66 43339 > http [ACK] Seq=98 Ack=217659 Win=271232 Len=0 TSval=7842793 TSecr=1681893473
 60   0.012666 54.230.118.136 -> 172.31.8.238 TCP 26130 [TCP segment of a reassembled PDU]
 61   0.012682 172.31.8.238 -> 54.230.118.136 TCP 66 43339 > http [ACK] Seq=98 Ack=243723 Win=323328 Len=0 TSval=7842793 TSecr=1681893473
 62   0.012719 54.230.118.136 -> 172.31.8.238 TCP 14546 [TCP segment of a reassembled PDU]
 63   0.012729 172.31.8.238 -> 54.230.118.136 TCP 66 43339 > http [ACK] Seq=98 Ack=258203 Win=352384 Len=0 TSval=7842793 TSecr=1681893473
 64   0.013112 54.230.118.136 -> 172.31.8.238 TCP 4410 [TCP segment of a reassembled PDU]
 65   0.013119 172.31.8.238 -> 54.230.118.136 TCP 66 43339 > http [ACK] Seq=98 Ack=262547 Win=360960 Len=0 TSval=7842793 TSecr=1681893473
 66   0.013273 54.230.118.136 -> 172.31.8.238 TCP 8754 [TCP segment of a reassembled PDU]
 67   0.013281 172.31.8.238 -> 54.230.118.136 TCP 66 43339 > http [ACK] Seq=98 Ack=271235 Win=378368 Len=0 TSval=7842793 TSecr=1681893473
 68   0.013434 54.230.118.136 -> 172.31.8.238 TCP 24682 [TCP segment of a reassembled PDU]
 69   0.013448 172.31.8.238 -> 54.230.118.136 TCP 66 43339 > http [ACK] Seq=98 Ack=295851 Win=427648 Len=0 TSval=7842793 TSecr=1681893473
 70   0.013652 54.230.118.136 -> 172.31.8.238 TCP 20338 [TCP segment of a reassembled PDU]
 71   0.013664 172.31.8.238 -> 54.230.118.136 TCP 66 43339 > http [ACK] Seq=98 Ack=316123 Win=468224 Len=0 TSval=7842793 TSecr=1681893473
 72   0.014290 54.230.118.136 -> 172.31.8.238 TCP 4410 [TCP segment of a reassembled PDU]
 73   0.014296 172.31.8.238 -> 54.230.118.136 TCP 66 43339 > http [ACK] Seq=98 Ack=320467 Win=476800 Len=0 TSval=7842793 TSecr=1681893473
 74   0.014462 54.230.118.136 -> 172.31.8.238 TCP 21786 [TCP segment of a reassembled PDU]
 75   0.014474 172.31.8.238 -> 54.230.118.136 TCP 66 43339 > http [ACK] Seq=98 Ack=342187 Win=520320 Len=0 TSval=7842794 TSecr=1681893473
 76   0.014479 54.230.118.136 -> 172.31.8.238 TCP 1514 [TCP Previous segment not captured] [TCP segment of a reassembled PDU]
 77   0.014482 172.31.8.238 -> 54.230.118.136 TCP 78 [TCP Window Update] 43339 > http [ACK] Seq=98 Ack=342187 Win=523136 Len=0 TSval=7842794 TSecr=1681893473 SLE=343635 SRE=345083
 78   0.014620 54.230.118.136 -> 172.31.8.238 TCP 1514 [TCP Out-Of-Order] [TCP segment of a reassembled PDU]
 79   0.014626 172.31.8.238 -> 54.230.118.136 TCP 66 43339 > http [ACK] Seq=98 Ack=345083 Win=526080 Len=0 TSval=7842794 TSecr=1681893473
 80   0.014636 54.230.118.136 -> 172.31.8.238 TCP 24682 [TCP segment of a reassembled PDU]
 81   0.014647 172.31.8.238 -> 54.230.118.136 TCP 66 43339 > http [ACK] Seq=98 Ack=369699 Win=575360 Len=0 TSval=7842794 TSecr=1681893473
 82   0.015069 54.230.118.136 -> 172.31.8.238 TCP 7306 [TCP segment of a reassembled PDU]
 83   0.015077 172.31.8.238 -> 54.230.118.136 TCP 66 43339 > http [ACK] Seq=98 Ack=376939 Win=589824 Len=0 TSval=7842794 TSecr=1681893473
 84   0.015257 54.230.118.136 -> 172.31.8.238 TCP 26130 [TCP segment of a reassembled PDU]
 85   0.015271 172.31.8.238 -> 54.230.118.136 TCP 66 43339 > http [ACK] Seq=98 Ack=403003 Win=641920 Len=0 TSval=7842794 TSecr=1681893473
 86   0.015317 54.230.118.136 -> 172.31.8.238 TCP 20338 [TCP segment of a reassembled PDU]
 87   0.015330 172.31.8.238 -> 54.230.118.136 TCP 66 43339 > http [ACK] Seq=98 Ack=423275 Win=682496 Len=0 TSval=7842794 TSecr=1681893473
 88   0.016104 54.230.118.136 -> 172.31.8.238 TCP 2962 [TCP segment of a reassembled PDU]
 89   0.016109 172.31.8.238 -> 54.230.118.136 TCP 66 43339 > http [ACK] Seq=98 Ack=426171 Win=688256 Len=0 TSval=7842794 TSecr=1681893473
 90   0.016291 54.230.118.136 -> 172.31.8.238 TCP 26130 [TCP segment of a reassembled PDU]
 91   0.016305 172.31.8.238 -> 54.230.118.136 TCP 66 43339 > http [ACK] Seq=98 Ack=452235 Win=740352 Len=0 TSval=7842794 TSecr=1681893473
 92   0.016367 54.230.118.136 -> 172.31.8.238 TCP 24682 [TCP segment of a reassembled PDU]
 93   0.016379 172.31.8.238 -> 54.230.118.136 TCP 66 43339 > http [ACK] Seq=98 Ack=476851 Win=789632 Len=0 TSval=7842794 TSecr=1681893473
 94   0.016866 54.230.118.136 -> 172.31.8.238 TCP 7306 [TCP segment of a reassembled PDU]
 95   0.016874 172.31.8.238 -> 54.230.118.136 TCP 66 43339 > http [ACK] Seq=98 Ack=484091 Win=804096 Len=0 TSval=7842794 TSecr=1681893473
 96   0.017049 54.230.118.136 -> 172.31.8.238 TCP 26130 [TCP segment of a reassembled PDU]
 97   0.017063 172.31.8.238 -> 54.230.118.136 TCP 66 43339 > http [ACK] Seq=98 Ack=510155 Win=856192 Len=0 TSval=7842794 TSecr=1681893473
 98   0.017124 54.230.118.136 -> 172.31.8.238 TCP 26130 [TCP segment of a reassembled PDU]
 99   0.017139 172.31.8.238 -> 54.230.118.136 TCP 66 43339 > http [ACK] Seq=98 Ack=536219 Win=908416 Len=0 TSval=7842794 TSecr=1681893473
100   0.017175 54.230.118.136 -> 172.31.8.238 TCP 5858 [TCP segment of a reassembled PDU]
101   0.017181 172.31.8.238 -> 54.230.118.136 TCP 66 43339 > http [ACK] Seq=98 Ack=542011 Win=919936 Len=0 TSval=7842794 TSecr=1681893473
102   0.017642 54.230.118.136 -> 172.31.8.238 TCP 4410 [TCP segment of a reassembled PDU]
103   0.017648 172.31.8.238 -> 54.230.118.136 TCP 66 43339 > http [ACK] Seq=98 Ack=546355 Win=928640 Len=0 TSval=7842794 TSecr=1681893473
104   0.017813 54.230.118.136 -> 172.31.8.238 TCP 26130 [TCP segment of a reassembled PDU]
105   0.017828 172.31.8.238 -> 54.230.118.136 TCP 66 43339 > http [ACK] Seq=98 Ack=572419 Win=980736 Len=0 TSval=7842794 TSecr=1681893473
106   0.017891 54.230.118.136 -> 172.31.8.238 TCP 26130 [TCP segment of a reassembled PDU]
107   0.017906 172.31.8.238 -> 54.230.118.136 TCP 66 43339 > http [ACK] Seq=98 Ack=598483 Win=1032832 Len=0 TSval=7842794 TSecr=1681893473
108   0.017977 54.230.118.136 -> 172.31.8.238 TCP 8754 [TCP segment of a reassembled PDU]
109   0.017984 172.31.8.238 -> 54.230.118.136 TCP 66 43339 > http [ACK] Seq=98 Ack=607171 Win=1050240 Len=0 TSval=7842794 TSecr=1681893473
110   0.018403 54.230.118.136 -> 172.31.8.238 TCP 7306 [TCP segment of a reassembled PDU]
111   0.018411 172.31.8.238 -> 54.230.118.136 TCP 66 43339 > http [ACK] Seq=98 Ack=614411 Win=1064704 Len=0 TSval=7842794 TSecr=1681893473
112   0.018582 54.230.118.136 -> 172.31.8.238 TCP 26130 [TCP segment of a reassembled PDU]
113   0.018597 172.31.8.238 -> 54.230.118.136 TCP 66 43339 > http [ACK] Seq=98 Ack=640475 Win=1047424 Len=0 TSval=7842795 TSecr=1681893473
114   0.018656 54.230.118.136 -> 172.31.8.238 TCP 20338 [TCP segment of a reassembled PDU]
115   0.018669 172.31.8.238 -> 54.230.118.136 TCP 66 43339 > http [ACK] Seq=98 Ack=660747 Win=1065984 Len=0 TSval=7842795 TSecr=1681893473
116   0.018714 54.230.118.136 -> 172.31.8.238 TCP 5858 [TCP segment of a reassembled PDU]
117   0.018720 172.31.8.238 -> 54.230.118.136 TCP 66 43339 > http [ACK] Seq=98 Ack=666539 Win=1089792 Len=0 TSval=7842795 TSecr=1681893473
118   0.018765 54.230.118.136 -> 172.31.8.238 TCP 5858 [TCP segment of a reassembled PDU]
119   0.018772 172.31.8.238 -> 54.230.118.136 TCP 66 43339 > http [ACK] Seq=98 Ack=672331 Win=1089792 Len=0 TSval=7842795 TSecr=1681893473
120   0.019039 54.230.118.136 -> 172.31.8.238 TCP 26130 [TCP segment of a reassembled PDU]
121   0.019054 172.31.8.238 -> 54.230.118.136 TCP 66 43339 > http [ACK] Seq=98 Ack=698395 Win=1063808 Len=0 TSval=7842795 TSecr=1681893474
122   0.019061 54.230.118.136 -> 172.31.8.238 TCP 2962 [TCP segment of a reassembled PDU]
123   0.019065 172.31.8.238 -> 54.230.118.136 TCP 66 43339 > http [ACK] Seq=98 Ack=701291 Win=1060992 Len=0 TSval=7842795 TSecr=1681893474
124   0.019187 54.230.118.136 -> 172.31.8.238 TCP 5858 [TCP segment of a reassembled PDU]
125   0.019193 172.31.8.238 -> 54.230.118.136 TCP 66 43339 > http [ACK] Seq=98 Ack=707083 Win=1089792 Len=0 TSval=7842795 TSecr=1681893474
126   0.019365 54.230.118.136 -> 172.31.8.238 TCP 26130 [TCP segment of a reassembled PDU]
127   0.019379 172.31.8.238 -> 54.230.118.136 TCP 66 43339 > http [ACK] Seq=98 Ack=733147 Win=1063808 Len=0 TSval=7842795 TSecr=1681893474
128   0.019388 54.230.118.136 -> 172.31.8.238 TCP 4410 [TCP segment of a reassembled PDU]
129   0.019391 172.31.8.238 -> 54.230.118.136 TCP 66 43339 > http [ACK] Seq=98 Ack=737491 Win=1059584 Len=0 TSval=7842795 TSecr=1681893474
130   0.019719 54.230.118.136 -> 172.31.8.238 TCP 11650 [TCP segment of a reassembled PDU]
131   0.019727 172.31.8.238 -> 54.230.118.136 TCP 66 43339 > http [ACK] Seq=98 Ack=749075 Win=1080320 Len=0 TSval=7842795 TSecr=1681893474
132   0.019865 54.230.118.136 -> 172.31.8.238 TCP 20338 [TCP segment of a reassembled PDU]
133   0.019876 172.31.8.238 -> 54.230.118.136 TCP 66 43339 > http [ACK] Seq=98 Ack=769347 Win=1065984 Len=0 TSval=7842795 TSecr=1681893474
134   0.019987 54.230.118.136 -> 172.31.8.238 TCP 33370 [TCP segment of a reassembled PDU]
135   0.020001 172.31.8.238 -> 54.230.118.136 TCP 66 43339 > http [ACK] Seq=98 Ack=802651 Win=1044480 Len=0 TSval=7842795 TSecr=1681893474
136   0.020072 54.230.118.136 -> 172.31.8.238 TCP 26130 [TCP segment of a reassembled PDU]
137   0.020086 172.31.8.238 -> 54.230.118.136 TCP 66 43339 > http [ACK] Seq=98 Ack=828715 Win=1056512 Len=0 TSval=7842795 TSecr=1681893474
138   0.020127 54.230.118.136 -> 172.31.8.238 TCP 8754 [TCP segment of a reassembled PDU]
139   0.020134 172.31.8.238 -> 54.230.118.136 TCP 66 43339 > http [ACK] Seq=98 Ack=837403 Win=1085056 Len=0 TSval=7842795 TSecr=1681893474
140   0.020480 54.230.118.136 -> 172.31.8.238 TCP 2962 [TCP segment of a reassembled PDU]
141   0.020487 172.31.8.238 -> 54.230.118.136 TCP 66 43339 > http [ACK] Seq=98 Ack=840299 Win=1094528 Len=0 TSval=7842795 TSecr=1681893474
142   0.020669 54.230.118.136 -> 172.31.8.238 TCP 26130 [TCP segment of a reassembled PDU]
143   0.020683 172.31.8.238 -> 54.230.118.136 TCP 66 43339 > http [ACK] Seq=98 Ack=866363 Win=1068544 Len=0 TSval=7842795 TSecr=1681893474
144   0.020744 54.230.118.136 -> 172.31.8.238 TCP 24682 [TCP segment of a reassembled PDU]
145   0.020768 172.31.8.238 -> 54.230.118.136 TCP 66 43339 > http [ACK] Seq=98 Ack=890979 Win=1058816 Len=0 TSval=7842795 TSecr=1681893474
146   0.020900 54.230.118.136 -> 172.31.8.238 TCP 42058 [TCP segment of a reassembled PDU]
147   0.020931 172.31.8.238 -> 54.230.118.136 TCP 66 43339 > http [ACK] Seq=98 Ack=932971 Win=1030144 Len=0 TSval=7842795 TSecr=1681893474
148   0.021263 54.230.118.136 -> 172.31.8.238 TCP 7306 [TCP segment of a reassembled PDU]
149   0.021271 172.31.8.238 -> 54.230.118.136 TCP 66 43339 > http [ACK] Seq=98 Ack=940211 Win=1087360 Len=0 TSval=7842795 TSecr=1681893474
150   0.021440 54.230.118.136 -> 172.31.8.238 TCP 26130 [TCP segment of a reassembled PDU]
151   0.021466 172.31.8.238 -> 54.230.118.136 TCP 66 43339 > http [ACK] Seq=98 Ack=966275 Win=1061376 Len=0 TSval=7842795 TSecr=1681893474
152   0.021526 54.230.118.136 -> 172.31.8.238 TCP 26130 [TCP segment of a reassembled PDU]
153   0.021551 172.31.8.238 -> 54.230.118.136 TCP 66 43339 > http [ACK] Seq=98 Ack=992339 Win=1056512 Len=0 TSval=7842795 TSecr=1681893474
154   0.021663 54.230.118.136 -> 172.31.8.238 TCP 26130 [TCP segment of a reassembled PDU]
155   0.021676 172.31.8.238 -> 54.230.118.136 TCP 66 43339 > http [ACK] Seq=98 Ack=1018403 Win=1056512 Len=0 TSval=7842795 TSecr=1681893474
156   0.021693 54.230.118.136 -> 172.31.8.238 TCP 26130 [TCP segment of a reassembled PDU]
157   0.021707 54.230.118.136 -> 172.31.8.238 TCP 1514 [TCP segment of a reassembled PDU]
158   0.021723 172.31.8.238 -> 54.230.118.136 TCP 66 43339 > http [ACK] Seq=98 Ack=1045915 Win=1029120 Len=0 TSval=7842795 TSecr=1681893474
159   0.022017 54.230.118.136 -> 172.31.8.238 TCP 2962 [TCP segment of a reassembled PDU]
160   0.022023 172.31.8.238 -> 54.230.118.136 TCP 66 43339 > http [ACK] Seq=98 Ack=1048811 Win=1094528 Len=0 TSval=7842795 TSecr=1681893474
161   0.022186 54.230.118.136 -> 172.31.8.238 TCP 26130 [TCP segment of a reassembled PDU]
162   0.022210 172.31.8.238 -> 54.230.118.136 TCP 66 43339 > http [ACK] Seq=98 Ack=1074875 Win=1068544 Len=0 TSval=7842795 TSecr=1681893474
163   0.022256 54.230.118.136 -> 172.31.8.238 TCP 26130 [TCP segment of a reassembled PDU]
164   0.022280 172.31.8.238 -> 54.230.118.136 TCP 66 43339 > http [ACK] Seq=98 Ack=1100939 Win=1056512 Len=0 TSval=7842795 TSecr=1681893474
165   0.022312 54.230.118.136 -> 172.31.8.238 TCP 8754 [TCP segment of a reassembled PDU]
166   0.022319 172.31.8.238 -> 54.230.118.136 TCP 66 43339 > http [ACK] Seq=98 Ack=1109627 Win=1085056 Len=0 TSval=7842795 TSecr=1681893474
167   0.022357 54.230.118.136 -> 172.31.8.238 TCP 1514 [TCP segment of a reassembled PDU]
168   0.022477 54.230.118.136 -> 172.31.8.238 TCP 17442 [TCP segment of a reassembled PDU]
169   0.022502 172.31.8.238 -> 54.230.118.136 TCP 66 43339 > http [ACK] Seq=98 Ack=1128451 Win=1096704 Len=0 TSval=7842796 TSecr=1681893474
170   0.022604 54.230.118.136 -> 172.31.8.238 TCP 20338 [TCP segment of a reassembled PDU]
171   0.022616 172.31.8.238 -> 54.230.118.136 TCP 66 43339 > http [ACK] Seq=98 Ack=1148723 Win=1137152 Len=0 TSval=7842796 TSecr=1681893474
172   0.022714 54.230.118.136 -> 172.31.8.238 TCP 21786 [TCP segment of a reassembled PDU]
173   0.022724 172.31.8.238 -> 54.230.118.136 TCP 66 43339 > http [ACK] Seq=98 Ack=1170443 Win=1180672 Len=0 TSval=7842796 TSecr=1681893474
174   0.023060 54.230.118.136 -> 172.31.8.238 TCP 4410 [TCP segment of a reassembled PDU]
175   0.023067 172.31.8.238 -> 54.230.118.136 TCP 66 43339 > http [ACK] Seq=98 Ack=1174787 Win=1189376 Len=0 TSval=7842796 TSecr=1681893474
176   0.023231 54.230.118.136 -> 172.31.8.238 TCP 26130 [TCP segment of a reassembled PDU]
177   0.023245 172.31.8.238 -> 54.230.118.136 TCP 66 43339 > http [ACK] Seq=98 Ack=1200851 Win=1241472 Len=0 TSval=7842796 TSecr=1681893474
178   0.023300 54.230.118.136 -> 172.31.8.238 TCP 26130 [TCP segment of a reassembled PDU]
179   0.023313 172.31.8.238 -> 54.230.118.136 TCP 66 43339 > http [ACK] Seq=98 Ack=1226915 Win=1293568 Len=0 TSval=7842796 TSecr=1681893474
180   0.023370 54.230.118.136 -> 172.31.8.238 TCP 8754 [TCP segment of a reassembled PDU]
181   0.023377 172.31.8.238 -> 54.230.118.136 TCP 66 43339 > http [ACK] Seq=98 Ack=1235603 Win=1310976 Len=0 TSval=7842796 TSecr=1681893474
182   0.023446 54.230.118.136 -> 172.31.8.238 TCP 23234 [TCP segment of a reassembled PDU]
183   0.023459 172.31.8.238 -> 54.230.118.136 TCP 66 43339 > http [ACK] Seq=98 Ack=1258771 Win=1357312 Len=0 TSval=7842796 TSecr=1681893474
184   0.023703 54.230.118.136 -> 172.31.8.238 TCP 4410 [TCP segment of a reassembled PDU]
185   0.023709 172.31.8.238 -> 54.230.118.136 TCP 66 43339 > http [ACK] Seq=98 Ack=1263115 Win=1366016 Len=0 TSval=7842796 TSecr=1681893474
186   0.023860 54.230.118.136 -> 172.31.8.238 TCP 26130 [TCP segment of a reassembled PDU]
187   0.023872 172.31.8.238 -> 54.230.118.136 TCP 66 43339 > http [ACK] Seq=98 Ack=1289179 Win=1418112 Len=0 TSval=7842796 TSecr=1681893474
188   0.023928 54.230.118.136 -> 172.31.8.238 TCP 26130 [TCP segment of a reassembled PDU]
189   0.023941 172.31.8.238 -> 54.230.118.136 TCP 66 43339 > http [ACK] Seq=98 Ack=1315243 Win=1470208 Len=0 TSval=7842796 TSecr=1681893474
190   0.023980 54.230.118.136 -> 172.31.8.238 TCP 8754 [TCP segment of a reassembled PDU]
191   0.023988 172.31.8.238 -> 54.230.118.136 TCP 66 43339 > http [ACK] Seq=98 Ack=1323931 Win=1487616 Len=0 TSval=7842796 TSecr=1681893474
192   0.024154 54.230.118.136 -> 172.31.8.238 TCP 23234 [TCP segment of a reassembled PDU]
193   0.024166 172.31.8.238 -> 54.230.118.136 TCP 66 43339 > http [ACK] Seq=98 Ack=1347099 Win=1533952 Len=0 TSval=7842796 TSecr=1681893474
194   0.024299 54.230.118.136 -> 172.31.8.238 TCP 26130 [TCP segment of a reassembled PDU]
195   0.024313 172.31.8.238 -> 54.230.118.136 TCP 66 43339 > http [ACK] Seq=98 Ack=1373163 Win=1586048 Len=0 TSval=7842796 TSecr=1681893474
196   0.024346 54.230.118.136 -> 172.31.8.238 TCP 15994 [TCP segment of a reassembled PDU]
197   0.024356 172.31.8.238 -> 54.230.118.136 TCP 66 43339 > http [ACK] Seq=98 Ack=1389091 Win=1586048 Len=0 TSval=7842796 TSecr=1681893474
198   0.024633 54.230.118.136 -> 172.31.8.238 TCP 8754 [TCP segment of a reassembled PDU]
199   0.024641 172.31.8.238 -> 54.230.118.136 TCP 66 43339 > http [ACK] Seq=98 Ack=1397779 Win=1586048 Len=0 TSval=7842796 TSecr=1681893474
200   0.024799 54.230.118.136 -> 172.31.8.238 TCP 26130 [TCP segment of a reassembled PDU]
201   0.024813 172.31.8.238 -> 54.230.118.136 TCP 66 43339 > http [ACK] Seq=98 Ack=1423843 Win=1586048 Len=0 TSval=7842796 TSecr=1681893474
202   0.024865 54.230.118.136 -> 172.31.8.238 TCP 26130 [TCP segment of a reassembled PDU]
203   0.024877 172.31.8.238 -> 54.230.118.136 TCP 66 43339 > http [ACK] Seq=98 Ack=1449907 Win=1586048 Len=0 TSval=7842796 TSecr=1681893474
204   0.024943 54.230.118.136 -> 172.31.8.238 TCP 26130 [TCP segment of a reassembled PDU]
205   0.024956 172.31.8.238 -> 54.230.118.136 TCP 66 43339 > http [ACK] Seq=98 Ack=1475971 Win=1586048 Len=0 TSval=7842796 TSecr=1681893474
206   0.025022 54.230.118.136 -> 172.31.8.238 TCP 26130 [TCP segment of a reassembled PDU]
207   0.025035 172.31.8.238 -> 54.230.118.136 TCP 66 43339 > http [ACK] Seq=98 Ack=1502035 Win=1586048 Len=0 TSval=7842796 TSecr=1681893474
208   0.025078 54.230.118.136 -> 172.31.8.238 TCP 17442 [TCP segment of a reassembled PDU]
209   0.025086 172.31.8.238 -> 54.230.118.136 TCP 66 43339 > http [ACK] Seq=98 Ack=1519411 Win=1586048 Len=0 TSval=7842796 TSecr=1681893474
210   0.025493 54.230.118.136 -> 172.31.8.238 TCP 18890 [TCP segment of a reassembled PDU]
211   0.025504 172.31.8.238 -> 54.230.118.136 TCP 66 43339 > http [ACK] Seq=98 Ack=1538235 Win=1586048 Len=0 TSval=7842796 TSecr=1681893474
212   0.025514 54.230.118.136 -> 172.31.8.238 TCP 2962 [TCP segment of a reassembled PDU]
213   0.025517 172.31.8.238 -> 54.230.118.136 TCP 66 43339 > http [ACK] Seq=98 Ack=1541131 Win=1586048 Len=0 TSval=7842796 TSecr=1681893474
214   0.025670 54.230.118.136 -> 172.31.8.238 TCP 26130 [TCP segment of a reassembled PDU]
215   0.025683 172.31.8.238 -> 54.230.118.136 TCP 66 43339 > http [ACK] Seq=98 Ack=1567195 Win=1586048 Len=0 TSval=7842796 TSecr=1681893474
216   0.025718 54.230.118.136 -> 172.31.8.238 TCP 20338 [TCP segment of a reassembled PDU]
217   0.025728 172.31.8.238 -> 54.230.118.136 TCP 66 43339 > http [ACK] Seq=98 Ack=1587467 Win=1586048 Len=0 TSval=7842796 TSecr=1681893474
218   0.025851 54.230.118.136 -> 172.31.8.238 TCP 26130 [TCP segment of a reassembled PDU]
219   0.025864 172.31.8.238 -> 54.230.118.136 TCP 66 43339 > http [ACK] Seq=98 Ack=1613531 Win=1586048 Len=0 TSval=7842796 TSecr=1681893474
220   0.025881 54.230.118.136 -> 172.31.8.238 TCP 26130 [TCP segment of a reassembled PDU]
221   0.025895 172.31.8.238 -> 54.230.118.136 TCP 66 43339 > http [ACK] Seq=98 Ack=1639595 Win=1586048 Len=0 TSval=7842796 TSecr=1681893474
222   0.025952 54.230.118.136 -> 172.31.8.238 TCP 10202 [TCP segment of a reassembled PDU]
223   0.025959 172.31.8.238 -> 54.230.118.136 TCP 66 43339 > http [ACK] Seq=98 Ack=1649731 Win=1586048 Len=0 TSval=7842796 TSecr=1681893474
224   0.026431 54.230.118.136 -> 172.31.8.238 TCP 4410 [TCP segment of a reassembled PDU]
225   0.026437 172.31.8.238 -> 54.230.118.136 TCP 66 43339 > http [ACK] Seq=98 Ack=1654075 Win=1586048 Len=0 TSval=7842796 TSecr=1681893474
226   0.026586 54.230.118.136 -> 172.31.8.238 TCP 26130 [TCP segment of a reassembled PDU]
227   0.026599 172.31.8.238 -> 54.230.118.136 TCP 66 43339 > http [ACK] Seq=98 Ack=1680139 Win=1586048 Len=0 TSval=7842797 TSecr=1681893474
228   0.026652 54.230.118.136 -> 172.31.8.238 TCP 21786 [TCP segment of a reassembled PDU]
229   0.026663 172.31.8.238 -> 54.230.118.136 TCP 66 43339 > http [ACK] Seq=98 Ack=1701859 Win=1586048 Len=0 TSval=7842797 TSecr=1681893474
230   0.026736 54.230.118.136 -> 172.31.8.238 TCP 30474 [TCP segment of a reassembled PDU]
231   0.026750 172.31.8.238 -> 54.230.118.136 TCP 66 43339 > http [ACK] Seq=98 Ack=1732267 Win=1586048 Len=0 TSval=7842797 TSecr=1681893474
232   0.026809 54.230.118.136 -> 172.31.8.238 TCP 26130 [TCP segment of a reassembled PDU]
233   0.026821 172.31.8.238 -> 54.230.118.136 TCP 66 43339 > http [ACK] Seq=98 Ack=1758331 Win=1586048 Len=0 TSval=7842797 TSecr=1681893474
234   0.026877 54.230.118.136 -> 172.31.8.238 TCP 21786 [TCP segment of a reassembled PDU]
235   0.026887 172.31.8.238 -> 54.230.118.136 TCP 66 43339 > http [ACK] Seq=98 Ack=1780051 Win=1586048 Len=0 TSval=7842797 TSecr=1681893474
236   0.027220 54.230.118.136 -> 172.31.8.238 TCP 2962 [TCP segment of a reassembled PDU]
237   0.027226 172.31.8.238 -> 54.230.118.136 TCP 66 43339 > http [ACK] Seq=98 Ack=1782947 Win=1586048 Len=0 TSval=7842797 TSecr=1681893474
238   0.027386 54.230.118.136 -> 172.31.8.238 TCP 26130 [TCP segment of a reassembled PDU]
239   0.027399 172.31.8.238 -> 54.230.118.136 TCP 66 43339 > http [ACK] Seq=98 Ack=1809011 Win=1586048 Len=0 TSval=7842797 TSecr=1681893474
240   0.027455 54.230.118.136 -> 172.31.8.238 TCP 26130 [TCP segment of a reassembled PDU]
241   0.027462 172.31.8.238 -> 54.230.118.136 TCP 66 43339 > http [ACK] Seq=98 Ack=1835075 Win=1586048 Len=0 TSval=7842797 TSecr=1681893474
242   0.027545 54.230.118.136 -> 172.31.8.238 TCP 26130 [TCP segment of a reassembled PDU]
243   0.027552 172.31.8.238 -> 54.230.118.136 TCP 66 43339 > http [ACK] Seq=98 Ack=1861139 Win=1586048 Len=0 TSval=7842797 TSecr=1681893474
244   0.027621 54.230.118.136 -> 172.31.8.238 TCP 26130 [TCP segment of a reassembled PDU]
245   0.027627 172.31.8.238 -> 54.230.118.136 TCP 66 43339 > http [ACK] Seq=98 Ack=1887203 Win=1586048 Len=0 TSval=7842797 TSecr=1681893474
246   0.027692 54.230.118.136 -> 172.31.8.238 TCP 23234 [TCP segment of a reassembled PDU]
247   0.027699 172.31.8.238 -> 54.230.118.136 TCP 66 43339 > http [ACK] Seq=98 Ack=1910371 Win=1586048 Len=0 TSval=7842797 TSecr=1681893474
248   0.028070 54.230.118.136 -> 172.31.8.238 TCP 2962 [TCP segment of a reassembled PDU]
249   0.028075 172.31.8.238 -> 54.230.118.136 TCP 66 43339 > http [ACK] Seq=98 Ack=1913267 Win=1586048 Len=0 TSval=7842797 TSecr=1681893474
250   0.028243 54.230.118.136 -> 172.31.8.238 TCP 26130 [TCP segment of a reassembled PDU]
251   0.028250 172.31.8.238 -> 54.230.118.136 TCP 66 43339 > http [ACK] Seq=98 Ack=1939331 Win=1586048 Len=0 TSval=7842797 TSecr=1681893474
252   0.028309 54.230.118.136 -> 172.31.8.238 TCP 26130 [TCP segment of a reassembled PDU]
253   0.028315 172.31.8.238 -> 54.230.118.136 TCP 66 43339 > http [ACK] Seq=98 Ack=1965395 Win=1586048 Len=0 TSval=7842797 TSecr=1681893474
254   0.028387 54.230.118.136 -> 172.31.8.238 TCP 26130 [TCP segment of a reassembled PDU]
255   0.028393 172.31.8.238 -> 54.230.118.136 TCP 66 43339 > http [ACK] Seq=98 Ack=1991459 Win=1586048 Len=0 TSval=7842797 TSecr=1681893474
256   0.028471 54.230.118.136 -> 172.31.8.238 TCP 26130 [TCP segment of a reassembled PDU]
257   0.028478 172.31.8.238 -> 54.230.118.136 TCP 66 43339 > http [ACK] Seq=98 Ack=2017523 Win=1586048 Len=0 TSval=7842797 TSecr=1681893474
258   0.028533 54.230.118.136 -> 172.31.8.238 TCP 23234 [TCP segment of a reassembled PDU]
259   0.028540 172.31.8.238 -> 54.230.118.136 TCP 66 43339 > http [ACK] Seq=98 Ack=2040691 Win=1586048 Len=0 TSval=7842797 TSecr=1681893474
260   0.029108 54.230.118.136 -> 172.31.8.238 TCP 5858 [TCP segment of a reassembled PDU]
261   0.029113 172.31.8.238 -> 54.230.118.136 TCP 66 43339 > http [ACK] Seq=98 Ack=2046483 Win=1586048 Len=0 TSval=7842797 TSecr=1681893475
262   0.029280 54.230.118.136 -> 172.31.8.238 TCP 26130 [TCP segment of a reassembled PDU]
263   0.029287 172.31.8.238 -> 54.230.118.136 TCP 66 43339 > http [ACK] Seq=98 Ack=2072547 Win=1586048 Len=0 TSval=7842797 TSecr=1681893475
264   0.029343 54.230.118.136 -> 172.31.8.238 TCP 26130 [TCP segment of a reassembled PDU]
265   0.029350 172.31.8.238 -> 54.230.118.136 TCP 66 43339 > http [ACK] Seq=98 Ack=2098611 Win=1586048 Len=0 TSval=7842797 TSecr=1681893475
266   0.029433 54.230.118.136 -> 172.31.8.238 TCP 26130 [TCP segment of a reassembled PDU]
267   0.029440 172.31.8.238 -> 54.230.118.136 TCP 66 43339 > http [ACK] Seq=98 Ack=2124675 Win=1586048 Len=0 TSval=7842797 TSecr=1681893475
268   0.029509 54.230.118.136 -> 172.31.8.238 TCP 26130 [TCP segment of a reassembled PDU]
269   0.029516 172.31.8.238 -> 54.230.118.136 TCP 66 43339 > http [ACK] Seq=98 Ack=2150739 Win=1586048 Len=0 TSval=7842797 TSecr=1681893475
270   0.029577 54.230.118.136 -> 172.31.8.238 TCP 20338 [TCP segment of a reassembled PDU]
271   0.029583 172.31.8.238 -> 54.230.118.136 TCP 66 43339 > http [ACK] Seq=98 Ack=2171011 Win=1586048 Len=0 TSval=7842797 TSecr=1681893475
272   0.029789 54.230.118.136 -> 172.31.8.238 TCP 26130 [TCP segment of a reassembled PDU]
273   0.029796 172.31.8.238 -> 54.230.118.136 TCP 66 43339 > http [ACK] Seq=98 Ack=2197075 Win=1586048 Len=0 TSval=7842797 TSecr=1681893475
274   0.029855 54.230.118.136 -> 172.31.8.238 TCP 26130 [TCP segment of a reassembled PDU]
275   0.029863 172.31.8.238 -> 54.230.118.136 TCP 66 43339 > http [ACK] Seq=98 Ack=2223139 Win=1586048 Len=0 TSval=7842797 TSecr=1681893475
276   0.029916 54.230.118.136 -> 172.31.8.238 TCP 13098 [TCP segment of a reassembled PDU]
277   0.029922 172.31.8.238 -> 54.230.118.136 TCP 66 43339 > http [ACK] Seq=98 Ack=2236171 Win=1586048 Len=0 TSval=7842797 TSecr=1681893475
278   0.030239 54.230.118.136 -> 172.31.8.238 TCP 26130 [TCP segment of a reassembled PDU]
279   0.030247 172.31.8.238 -> 54.230.118.136 TCP 66 43339 > http [ACK] Seq=98 Ack=2262235 Win=1586048 Len=0 TSval=7842797 TSecr=1681893475
280   0.030261 54.230.118.136 -> 172.31.8.238 TCP 2962 [TCP segment of a reassembled PDU]
281   0.030277 172.31.8.238 -> 54.230.118.136 TCP 66 43339 > http [ACK] Seq=98 Ack=2265131 Win=1586048 Len=0 TSval=7842797 TSecr=1681893475
282   0.030345 54.230.118.136 -> 172.31.8.238 TCP 1514 [TCP Previous segment not captured] [TCP segment of a reassembled PDU]
283   0.030350 172.31.8.238 -> 54.230.118.136 TCP 78 [TCP Dup ACK 281#1] 43339 > http [ACK] Seq=98 Ack=2265131 Win=1586048 Len=0 TSval=7842797 TSecr=1681893475 SLE=2266579 SRE=2268027
284   0.030401 54.230.118.136 -> 172.31.8.238 TCP 1514 [TCP Out-Of-Order] [TCP segment of a reassembled PDU]
285   0.030406 172.31.8.238 -> 54.230.118.136 TCP 66 43339 > http [ACK] Seq=98 Ack=2268027 Win=1586048 Len=0 TSval=7842797 TSecr=1681893475
286   0.030486 54.230.118.136 -> 172.31.8.238 TCP 17442 [TCP segment of a reassembled PDU]
287   0.030493 172.31.8.238 -> 54.230.118.136 TCP 66 43339 > http [ACK] Seq=98 Ack=2285403 Win=1586048 Len=0 TSval=7842798 TSecr=1681893475
288   0.030690 54.230.118.136 -> 172.31.8.238 TCP 60882 [TCP segment of a reassembled PDU]
289   0.030700 172.31.8.238 -> 54.230.118.136 TCP 66 43339 > http [ACK] Seq=98 Ack=2346219 Win=1586048 Len=0 TSval=7842798 TSecr=1681893475
290   0.030710 54.230.118.136 -> 172.31.8.238 TCP 1514 [TCP segment of a reassembled PDU]
291   0.030712 172.31.8.238 -> 54.230.118.136 TCP 66 43339 > http [ACK] Seq=98 Ack=2347667 Win=1586048 Len=0 TSval=7842798 TSecr=1681893475
292   0.030847 54.230.118.136 -> 172.31.8.238 TCP 50746 [TCP segment of a reassembled PDU]
293   0.030857 172.31.8.238 -> 54.230.118.136 TCP 66 43339 > http [ACK] Seq=98 Ack=2398347 Win=1586048 Len=0 TSval=7842798 TSecr=1681893475
294   0.030889 54.230.118.136 -> 172.31.8.238 TCP 10202 [TCP segment of a reassembled PDU]
295   0.030896 172.31.8.238 -> 54.230.118.136 TCP 66 43339 > http [ACK] Seq=98 Ack=2408483 Win=1586048 Len=0 TSval=7842798 TSecr=1681893475
296   0.030968 54.230.118.136 -> 172.31.8.238 TCP 27578 [TCP segment of a reassembled PDU]
297   0.030974 172.31.8.238 -> 54.230.118.136 TCP 66 43339 > http [ACK] Seq=98 Ack=2435995 Win=1586048 Len=0 TSval=7842798 TSecr=1681893475
298   0.031426 54.230.118.136 -> 172.31.8.238 TCP 1514 [TCP segment of a reassembled PDU]
299   0.031431 172.31.8.238 -> 54.230.118.136 TCP 66 43339 > http [ACK] Seq=98 Ack=2437443 Win=1586048 Len=0 TSval=7842798 TSecr=1681893475
300   0.031598 54.230.118.136 -> 172.31.8.238 TCP 23234 [TCP segment of a reassembled PDU]
301   0.031604 172.31.8.238 -> 54.230.118.136 TCP 66 43339 > http [ACK] Seq=98 Ack=2460611 Win=1586048 Len=0 TSval=7842798 TSecr=1681893475
302   0.031708 54.230.118.136 -> 172.31.8.238 TCP 29026 [TCP segment of a reassembled PDU]
303   0.031716 172.31.8.238 -> 54.230.118.136 TCP 66 43339 > http [ACK] Seq=98 Ack=2489571 Win=1586048 Len=0 TSval=7842798 TSecr=1681893475
304   0.031732 54.230.118.136 -> 172.31.8.238 TCP 26130 [TCP segment of a reassembled PDU]
305   0.031737 172.31.8.238 -> 54.230.118.136 TCP 66 43339 > http [ACK] Seq=98 Ack=2515635 Win=1586048 Len=0 TSval=7842798 TSecr=1681893475
306   0.031829 54.230.118.136 -> 172.31.8.238 TCP 26130 [TCP segment of a reassembled PDU]
307   0.031835 172.31.8.238 -> 54.230.118.136 TCP 66 43339 > http [ACK] Seq=98 Ack=2541699 Win=1586048 Len=0 TSval=7842798 TSecr=1681893475
308   0.031883 54.230.118.136 -> 172.31.8.238 TCP 7306 [TCP segment of a reassembled PDU]
309   0.031887 172.31.8.238 -> 54.230.118.136 TCP 66 43339 > http [ACK] Seq=98 Ack=2548939 Win=1586048 Len=0 TSval=7842798 TSecr=1681893475
310   0.031894 54.230.118.136 -> 172.31.8.238 TCP 1514 [TCP Previous segment not captured] [TCP segment of a reassembled PDU]
311   0.031896 172.31.8.238 -> 54.230.118.136 TCP 78 [TCP Dup ACK 309#1] 43339 > http [ACK] Seq=98 Ack=2548939 Win=1586048 Len=0 TSval=7842798 TSecr=1681893475 SLE=2550387 SRE=2551835
312   0.031934 54.230.118.136 -> 172.31.8.238 TCP 1514 [TCP Out-Of-Order] [TCP segment of a reassembled PDU]
313   0.031939 172.31.8.238 -> 54.230.118.136 TCP 66 43339 > http [ACK] Seq=98 Ack=2551835 Win=1586048 Len=0 TSval=7842798 TSecr=1681893475
314   0.032043 54.230.118.136 -> 172.31.8.238 TCP 10202 [TCP segment of a reassembled PDU]
315   0.032049 172.31.8.238 -> 54.230.118.136 TCP 66 43339 > http [ACK] Seq=98 Ack=2561971 Win=1586048 Len=0 TSval=7842798 TSecr=1681893475
316   0.032288 54.230.118.136 -> 172.31.8.238 TCP 24682 [TCP segment of a reassembled PDU]
317   0.032299 172.31.8.238 -> 54.230.118.136 TCP 66 43339 > http [ACK] Seq=98 Ack=2586587 Win=1586048 Len=0 TSval=7842798 TSecr=1681893475
318   0.032423 54.230.118.136 -> 172.31.8.238 TCP 26130 [TCP segment of a reassembled PDU]
319   0.032430 172.31.8.238 -> 54.230.118.136 TCP 66 43339 > http [ACK] Seq=98 Ack=2612651 Win=1586048 Len=0 TSval=7842798 TSecr=1681893475
320   0.032468 54.230.118.136 -> 172.31.8.238 TCP 14546 [TCP segment of a reassembled PDU]
321   0.032472 172.31.8.238 -> 54.230.118.136 TCP 66 43339 > http [ACK] Seq=98 Ack=2627131 Win=1586048 Len=0 TSval=7842798 TSecr=1681893475
322   0.032606 54.230.118.136 -> 172.31.8.238 TCP 26130 [TCP segment of a reassembled PDU]
323   0.032612 172.31.8.238 -> 54.230.118.136 TCP 66 43339 > http [ACK] Seq=98 Ack=2653195 Win=1586048 Len=0 TSval=7842798 TSecr=1681893475
324   0.032632 54.230.118.136 -> 172.31.8.238 TCP 21786 [TCP segment of a reassembled PDU]
325   0.032639 172.31.8.238 -> 54.230.118.136 TCP 66 43339 > http [ACK] Seq=98 Ack=2674915 Win=1586048 Len=0 TSval=7842798 TSecr=1681893475
326   0.032720 54.230.118.136 -> 172.31.8.238 TCP 21786 [TCP segment of a reassembled PDU]
327   0.032731 172.31.8.238 -> 54.230.118.136 TCP 66 43339 > http [ACK] Seq=98 Ack=2696635 Win=1586048 Len=0 TSval=7842798 TSecr=1681893475
328   0.033096 54.230.118.136 -> 172.31.8.238 TCP 26130 [TCP segment of a reassembled PDU]
329   0.033104 172.31.8.238 -> 54.230.118.136 TCP 66 43339 > http [ACK] Seq=98 Ack=2722699 Win=1586048 Len=0 TSval=7842798 TSecr=1681893475
330   0.033162 54.230.118.136 -> 172.31.8.238 TCP 26130 [TCP segment of a reassembled PDU]
331   0.033168 172.31.8.238 -> 54.230.118.136 TCP 66 43339 > http [ACK] Seq=98 Ack=2748763 Win=1586048 Len=0 TSval=7842798 TSecr=1681893475
332   0.033214 54.230.118.136 -> 172.31.8.238 TCP 8754 [TCP segment of a reassembled PDU]
333   0.033218 172.31.8.238 -> 54.230.118.136 TCP 66 43339 > http [ACK] Seq=98 Ack=2757451 Win=1586048 Len=0 TSval=7842798 TSecr=1681893475
334   0.033567 54.230.118.136 -> 172.31.8.238 TCP 14546 [TCP segment of a reassembled PDU]
335   0.033573 172.31.8.238 -> 54.230.118.136 TCP 66 43339 > http [ACK] Seq=98 Ack=2771931 Win=1586048 Len=0 TSval=7842798 TSecr=1681893475
336   0.033723 54.230.118.136 -> 172.31.8.238 TCP 26130 [TCP segment of a reassembled PDU]
337   0.033730 172.31.8.238 -> 54.230.118.136 TCP 66 43339 > http [ACK] Seq=98 Ack=2797995 Win=1586048 Len=0 TSval=7842798 TSecr=1681893475
338   0.033802 54.230.118.136 -> 172.31.8.238 TCP 26130 [TCP segment of a reassembled PDU]
339   0.033809 172.31.8.238 -> 54.230.118.136 TCP 66 43339 > http [ACK] Seq=98 Ack=2824059 Win=1586048 Len=0 TSval=7842798 TSecr=1681893475
340   0.033877 54.230.118.136 -> 172.31.8.238 TCP 26130 [TCP segment of a reassembled PDU]
341   0.033884 172.31.8.238 -> 54.230.118.136 TCP 66 43339 > http [ACK] Seq=98 Ack=2850123 Win=1586048 Len=0 TSval=7842798 TSecr=1681893475
342   0.033953 54.230.118.136 -> 172.31.8.238 TCP 26130 [TCP segment of a reassembled PDU]
343   0.033959 172.31.8.238 -> 54.230.118.136 TCP 66 43339 > http [ACK] Seq=98 Ack=2876187 Win=1586048 Len=0 TSval=7842798 TSecr=1681893475
344   0.034083 54.230.118.136 -> 172.31.8.238 TCP 11650 [TCP segment of a reassembled PDU]
