[Measurement for 10kb at 05:41:42 20.41.2014] 
Tshark:

  1   0.000000 172.31.8.238 -> 172.31.0.2   DNS 89 Standard query 0xf3db  A d1dx94olpiqj0t.cloudfront.net
  2   0.000038 172.31.8.238 -> 172.31.0.2   DNS 89 Standard query 0xcbae  AAAA d1dx94olpiqj0t.cloudfront.net
  3   0.000641   172.31.0.2 -> 172.31.8.238 DNS 176 Standard query response 0xcbae 
  4   0.000651   172.31.0.2 -> 172.31.8.238 DNS 217 Standard query response 0xf3db  A 54.239.132.55 A 54.230.116.136 A 54.230.117.37 A 54.230.117.154 A 54.230.118.143 A 54.230.118.187 A 54.230.119.106 A 54.230.119.150
  5   0.003941 172.31.8.238 -> 54.239.132.55 TCP 74 35771 > http [SYN] Seq=0 Win=26883 Len=0 MSS=8961 SACK_PERM=1 TSval=11432491 TSecr=0 WS=128
  6   0.004479 54.239.132.55 -> 172.31.8.238 TCP 74 http > 35771 [SYN, ACK] Seq=0 Ack=1 Win=14480 Len=0 MSS=1460 SACK_PERM=1 TSval=1683855391 TSecr=11432491 WS=128
  7   0.004493 172.31.8.238 -> 54.239.132.55 TCP 66 35771 > http [ACK] Seq=1 Ack=1 Win=27008 Len=0 TSval=11432491 TSecr=1683855391
  8   0.004530 172.31.8.238 -> 54.239.132.55 HTTP 163 GET /10kb HTTP/1.1 
  9   0.005243 54.239.132.55 -> 172.31.8.238 TCP 66 http > 35771 [ACK] Seq=1 Ack=98 Win=14592 Len=0 TSval=1683855391 TSecr=11432491
 10   0.007310 54.239.132.55 -> 172.31.8.238 HTTP 10761 HTTP/1.1 200 OK  (application/octet-stream)
 11   0.007322 172.31.8.238 -> 54.239.132.55 TCP 66 35771 > http [ACK] Seq=98 Ack=10696 Win=48384 Len=0 TSval=11432492 TSecr=1683855391
 12   0.007478 172.31.8.238 -> 54.239.132.55 TCP 66 35771 > http [FIN, ACK] Seq=98 Ack=10696 Win=48384 Len=0 TSval=11432492 TSecr=1683855391
 13   0.007999 54.239.132.55 -> 172.31.8.238 TCP 66 http > 35771 [FIN, ACK] Seq=10696 Ack=99 Win=14592 Len=0 TSval=1683855391 TSecr=11432492
 14   0.008019 172.31.8.238 -> 54.239.132.55 TCP 66 35771 > http [ACK] Seq=99 Ack=10697 Win=48384 Len=0 TSval=11432492 TSecr=1683855391
