[Measurement for 10kb at 20:41:42 19.41.2014] 
Tshark:

  1   0.000000 172.31.8.238 -> 172.31.0.2   DNS 89 Standard query 0x2312  A d1dx94olpiqj0t.cloudfront.net
  2   0.000034 172.31.8.238 -> 172.31.0.2   DNS 89 Standard query 0xf039  AAAA d1dx94olpiqj0t.cloudfront.net
  3   0.000555   172.31.0.2 -> 172.31.8.238 DNS 217 Standard query response 0x2312  A 54.192.118.220 A 54.192.118.221 A 54.192.118.230 A 54.192.118.239 A 54.230.116.44 A 54.230.116.154 A 54.230.119.110 A 54.239.132.86
  4   0.000568   172.31.0.2 -> 172.31.8.238 DNS 176 Standard query response 0xf039 
  5   0.003833 172.31.8.238 -> 54.192.118.220 TCP 74 47720 > http [SYN] Seq=0 Win=26883 Len=0 MSS=8961 SACK_PERM=1 TSval=3332517 TSecr=0 WS=128
  6   0.004344 54.192.118.220 -> 172.31.8.238 TCP 74 http > 47720 [SYN, ACK] Seq=0 Ack=1 Win=14480 Len=0 MSS=1460 SACK_PERM=1 TSval=1681078761 TSecr=3332517 WS=128
  7   0.004357 172.31.8.238 -> 54.192.118.220 TCP 66 47720 > http [ACK] Seq=1 Ack=1 Win=27008 Len=0 TSval=3332517 TSecr=1681078761
  8   0.004396 172.31.8.238 -> 54.192.118.220 HTTP 163 GET /10kb HTTP/1.1 
  9   0.004816 54.192.118.220 -> 172.31.8.238 TCP 66 http > 47720 [ACK] Seq=1 Ack=98 Win=14592 Len=0 TSval=1681078761 TSecr=3332517
 10   0.008209 54.192.118.220 -> 172.31.8.238 HTTP 10760 HTTP/1.1 200 OK  (application/octet-stream)
 11   0.008221 172.31.8.238 -> 54.192.118.220 TCP 66 47720 > http [ACK] Seq=98 Ack=10695 Win=48384 Len=0 TSval=3332518 TSecr=1681078761
 12   0.008392 172.31.8.238 -> 54.192.118.220 TCP 66 47720 > http [FIN, ACK] Seq=98 Ack=10695 Win=48384 Len=0 TSval=3332518 TSecr=1681078761
 13   0.009168 54.192.118.220 -> 172.31.8.238 TCP 66 http > 47720 [FIN, ACK] Seq=10695 Ack=99 Win=14592 Len=0 TSval=1681078761 TSecr=3332518
 14   0.009176 172.31.8.238 -> 54.192.118.220 TCP 66 47720 > http [ACK] Seq=99 Ack=10696 Win=48384 Len=0 TSval=3332518 TSecr=1681078761
