[Measurement for 10kb at 12:41:42 20.41.2014] 
Tshark:

  1   0.000000 172.31.8.238 -> 172.31.0.2   DNS 89 Standard query 0x31b3  A d1dx94olpiqj0t.cloudfront.net
  2   0.000026 172.31.8.238 -> 172.31.0.2   DNS 89 Standard query 0xdc4a  AAAA d1dx94olpiqj0t.cloudfront.net
  3   0.000652   172.31.0.2 -> 172.31.8.238 DNS 176 Standard query response 0xdc4a 
  4   0.000663   172.31.0.2 -> 172.31.8.238 DNS 217 Standard query response 0x31b3  A 54.230.116.239 A 54.230.117.10 A 54.230.117.15 A 54.230.119.66 A 54.239.132.90 A 54.192.118.221 A 54.192.118.241 A 54.230.116.204
  5   0.003912 172.31.8.238 -> 54.230.116.239 TCP 74 36655 > http [SYN] Seq=0 Win=26883 Len=0 MSS=8961 SACK_PERM=1 TSval=17732667 TSecr=0 WS=128
  6   0.004481 54.230.116.239 -> 172.31.8.238 TCP 74 http > 36655 [SYN, ACK] Seq=0 Ack=1 Win=14480 Len=0 MSS=1460 SACK_PERM=1 TSval=973892392 TSecr=17732667 WS=128
  7   0.004495 172.31.8.238 -> 54.230.116.239 TCP 66 36655 > http [ACK] Seq=1 Ack=1 Win=27008 Len=0 TSval=17732667 TSecr=973892392
  8   0.004539 172.31.8.238 -> 54.230.116.239 HTTP 163 GET /10kb HTTP/1.1 
  9   0.004969 54.230.116.239 -> 172.31.8.238 TCP 66 http > 36655 [ACK] Seq=1 Ack=98 Win=14592 Len=0 TSval=973892392 TSecr=17732667
 10   0.006813 54.230.116.239 -> 172.31.8.238 TCP 2580 [TCP segment of a reassembled PDU]
 11   0.006821 172.31.8.238 -> 54.230.116.239 TCP 66 36655 > http [ACK] Seq=98 Ack=2515 Win=32000 Len=0 TSval=17732668 TSecr=973892393
 12   0.006914 54.230.116.239 -> 172.31.8.238 HTTP 8247 HTTP/1.1 200 OK  (application/octet-stream)
 13   0.006922 172.31.8.238 -> 54.230.116.239 TCP 66 36655 > http [ACK] Seq=98 Ack=10696 Win=48384 Len=0 TSval=17732668 TSecr=973892393
 14   0.007045 172.31.8.238 -> 54.230.116.239 TCP 66 36655 > http [FIN, ACK] Seq=98 Ack=10696 Win=48384 Len=0 TSval=17732668 TSecr=973892393
 15   0.007570 54.230.116.239 -> 172.31.8.238 TCP 66 http > 36655 [FIN, ACK] Seq=10696 Ack=99 Win=14592 Len=0 TSval=973892393 TSecr=17732668
 16   0.007578 172.31.8.238 -> 54.230.116.239 TCP 66 36655 > http [ACK] Seq=99 Ack=10697 Win=48384 Len=0 TSval=17732668 TSecr=973892393
