[Measurement for 10kb at 00:41:42 20.41.2014] 
Tshark:

  1   0.000000 172.31.8.238 -> 172.31.0.2   DNS 89 Standard query 0x5279  A d1dx94olpiqj0t.cloudfront.net
  2   0.000025 172.31.8.238 -> 172.31.0.2   DNS 89 Standard query 0x5bf8  AAAA d1dx94olpiqj0t.cloudfront.net
  3   0.000711   172.31.0.2 -> 172.31.8.238 DNS 217 Standard query response 0x5279  A 54.230.119.12 A 54.239.132.90 A 54.192.118.219 A 54.192.118.247 A 54.230.116.164 A 54.230.117.21 A 54.230.117.152 A 54.230.119.3
  4   0.000722   172.31.0.2 -> 172.31.8.238 DNS 176 Standard query response 0x5bf8 
  5   0.003849 172.31.8.238 -> 54.230.119.12 TCP 74 51526 > http [SYN] Seq=0 Win=26883 Len=0 MSS=8961 SACK_PERM=1 TSval=6932557 TSecr=0 WS=128
  6   0.004572 54.230.119.12 -> 172.31.8.238 TCP 74 http > 51526 [SYN, ACK] Seq=0 Ack=1 Win=14480 Len=0 MSS=1460 SACK_PERM=1 TSval=1683262192 TSecr=6932557 WS=128
  7   0.004585 172.31.8.238 -> 54.230.119.12 TCP 66 51526 > http [ACK] Seq=1 Ack=1 Win=27008 Len=0 TSval=6932557 TSecr=1683262192
  8   0.004637 172.31.8.238 -> 54.230.119.12 HTTP 163 GET /10kb HTTP/1.1 
  9   0.005391 54.230.119.12 -> 172.31.8.238 TCP 66 http > 51526 [ACK] Seq=1 Ack=98 Win=14592 Len=0 TSval=1683262192 TSecr=6932557
 10   0.006696 54.230.119.12 -> 172.31.8.238 TCP 10202 [TCP segment of a reassembled PDU]
 11   0.006706 172.31.8.238 -> 54.230.119.12 TCP 66 51526 > http [ACK] Seq=98 Ack=10137 Win=47232 Len=0 TSval=6932558 TSecr=1683262192
 12   0.006730 54.230.119.12 -> 172.31.8.238 HTTP 625 HTTP/1.1 200 OK  (application/octet-stream)
 13   0.006752 172.31.8.238 -> 54.230.119.12 TCP 66 51526 > http [ACK] Seq=98 Ack=10696 Win=50176 Len=0 TSval=6932558 TSecr=1683262192
 14   0.006888 172.31.8.238 -> 54.230.119.12 TCP 66 51526 > http [FIN, ACK] Seq=98 Ack=10696 Win=50176 Len=0 TSval=6932558 TSecr=1683262192
 15   0.007345 54.230.119.12 -> 172.31.8.238 TCP 66 http > 51526 [FIN, ACK] Seq=10696 Ack=99 Win=14592 Len=0 TSval=1683262192 TSecr=6932558
 16   0.007353 172.31.8.238 -> 54.230.119.12 TCP 66 51526 > http [ACK] Seq=99 Ack=10697 Win=50176 Len=0 TSval=6932558 TSecr=1683262192
