[Measurement for 10kb at 17:42:32 19.42.2014] 
Tshark:

  1   0.000000 172.31.8.238 -> 172.31.0.2   DNS 89 Standard query 0x9729  A d1dx94olpiqj0t.cloudfront.net
  2   0.000026 172.31.8.238 -> 172.31.0.2   DNS 89 Standard query 0x7f6c  AAAA d1dx94olpiqj0t.cloudfront.net
  3   0.000621   172.31.0.2 -> 172.31.8.238 DNS 176 Standard query response 0x7f6c 
  4   0.000634   172.31.0.2 -> 172.31.8.238 DNS 217 Standard query response 0x9729  A 54.230.142.31 A 54.230.142.220 A 54.230.143.62 A 54.230.143.66 A 54.230.143.227 A 205.251.215.191 A 205.251.215.193 A 54.192.141.189
  5   0.003857 172.31.8.238 -> 54.230.142.31 TCP 74 36736 > http [SYN] Seq=0 Win=26883 Len=0 MSS=8961 SACK_PERM=1 TSval=645057 TSecr=0 WS=128
  6   0.006065 54.230.142.31 -> 172.31.8.238 TCP 74 http > 36736 [SYN, ACK] Seq=0 Ack=1 Win=14480 Len=0 MSS=1460 SACK_PERM=1 TSval=901624864 TSecr=645057 WS=128
  7   0.006080 172.31.8.238 -> 54.230.142.31 TCP 66 36736 > http [ACK] Seq=1 Ack=1 Win=27008 Len=0 TSval=645058 TSecr=901624864
  8   0.006124 172.31.8.238 -> 54.230.142.31 HTTP 163 GET /10kb HTTP/1.1 
  9   0.008280 54.230.142.31 -> 172.31.8.238 TCP 66 http > 36736 [ACK] Seq=1 Ack=98 Win=14592 Len=0 TSval=901624865 TSecr=645058
 10   0.060902 54.230.142.31 -> 172.31.8.238 TCP 2962 [TCP segment of a reassembled PDU]
 11   0.060931 172.31.8.238 -> 54.230.142.31 TCP 66 36736 > http [ACK] Seq=98 Ack=2897 Win=32768 Len=0 TSval=645071 TSecr=901624870
 12   0.060939 54.230.142.31 -> 172.31.8.238 TCP 161 [TCP segment of a reassembled PDU]
 13   0.060943 172.31.8.238 -> 54.230.142.31 TCP 66 36736 > http [ACK] Seq=98 Ack=2992 Win=32768 Len=0 TSval=645071 TSecr=901624870
 14   0.060961 54.230.142.31 -> 172.31.8.238 TCP 1514 [TCP segment of a reassembled PDU]
 15   0.060964 172.31.8.238 -> 54.230.142.31 TCP 66 36736 > http [ACK] Seq=98 Ack=4440 Win=35584 Len=0 TSval=645072 TSecr=901624870
 16   0.061140 54.230.142.31 -> 172.31.8.238 HTTP 6311 HTTP/1.1 200 OK  (application/octet-stream)
 17   0.061148 172.31.8.238 -> 54.230.142.31 TCP 66 36736 > http [ACK] Seq=98 Ack=10685 Win=48128 Len=0 TSval=645072 TSecr=901624870
 18   0.061317 172.31.8.238 -> 54.230.142.31 TCP 66 36736 > http [FIN, ACK] Seq=98 Ack=10685 Win=48128 Len=0 TSval=645072 TSecr=901624870
 19   0.063419 54.230.142.31 -> 172.31.8.238 TCP 66 http > 36736 [FIN, ACK] Seq=10685 Ack=99 Win=14592 Len=0 TSval=901624870 TSecr=645072
 20   0.063429 172.31.8.238 -> 54.230.142.31 TCP 66 36736 > http [ACK] Seq=99 Ack=10686 Win=48128 Len=0 TSval=645072 TSecr=901624870
