[Measurement for 1kb at 22:02:03 16.02.2014] 
Tshark:

  1   0.000000  192.168.1.2 -> 54.230.98.197 TCP 66 49214→80 [SYN] Seq=0 Win=8192 Len=0 MSS=1460 WS=256 SACK_PERM=1
  2   0.053596 54.230.98.197 -> 192.168.1.2  TCP 66 80→49214 [SYN, ACK] Seq=0 Ack=1 Win=14600 Len=0 MSS=1400 SACK_PERM=1 WS=128
  3   0.053789  192.168.1.2 -> 54.230.98.197 TCP 54 49214→80 [ACK] Seq=1 Ack=1 Win=65792 Len=0
  4   0.054686  192.168.1.2 -> 54.230.98.197 HTTP 150 GET /1kb HTTP/1.1 
  5   0.092864 54.230.98.197 -> 192.168.1.2  TCP 54 80→49214 [ACK] Seq=1 Ack=97 Win=14720 Len=0
  6   0.099245 54.230.98.197 -> 192.168.1.2  TCP 1454 [TCP segment of a reassembled PDU]
  7   0.099868 54.230.98.197 -> 192.168.1.2  HTTP 132 HTTP/1.1 200 OK  (application/octet-stream)
  8   0.099965  192.168.1.2 -> 54.230.98.197 TCP 54 49214→80 [ACK] Seq=97 Ack=1479 Win=65792 Len=0
  9   0.100071  192.168.1.2 -> 54.230.98.197 TCP 54 49214→80 [FIN, ACK] Seq=97 Ack=1479 Win=65792 Len=0
 10   0.136522 54.230.98.197 -> 192.168.1.2  TCP 54 80→49214 [FIN, ACK] Seq=1479 Ack=98 Win=14720 Len=0
 11   0.136671  192.168.1.2 -> 54.230.98.197 TCP 54 49214→80 [ACK] Seq=98 Ack=1480 Win=65792 Len=0
 12   1.083967  192.168.1.2 -> 192.241.187.124 SSL 55 Continuation Data
 13   1.254672 192.241.187.124 -> 192.168.1.2  TCP 66 443→58317 [ACK] Seq=1 Ack=2 Win=16 Len=0 SLE=1 SRE=2
