[Measurement for 1kb at 03:02:05 17.02.2014] 
Tshark:

  1   0.000000  192.168.1.2 -> 239.255.255.250 SSDP 175 M-SEARCH * HTTP/1.1 
  2   0.005402  192.168.1.1 -> 192.168.1.2  SSDP 482 HTTP/1.1 200 OK 
  3   0.870029  192.168.1.2 -> 54.230.99.53 TCP 66 49887→80 [SYN] Seq=0 Win=8192 Len=0 MSS=1460 WS=256 SACK_PERM=1
  4   0.898034 54.230.99.53 -> 192.168.1.2  TCP 66 80→49887 [SYN, ACK] Seq=0 Ack=1 Win=14600 Len=0 MSS=1400 SACK_PERM=1 WS=128
  5   0.898172  192.168.1.2 -> 54.230.99.53 TCP 54 49887→80 [ACK] Seq=1 Ack=1 Win=65792 Len=0
  6   0.898303  192.168.1.2 -> 54.230.99.53 HTTP 150 GET /1kb HTTP/1.1 
  7   0.927203 54.230.99.53 -> 192.168.1.2  TCP 54 80→49887 [ACK] Seq=1 Ack=97 Win=14720 Len=0
  8   0.933694 54.230.99.53 -> 192.168.1.2  TCP 1454 [TCP segment of a reassembled PDU]
  9   0.934233 54.230.99.53 -> 192.168.1.2  HTTP 132 HTTP/1.1 200 OK  (application/octet-stream)
 10   0.934317  192.168.1.2 -> 54.230.99.53 TCP 54 49887→80 [ACK] Seq=97 Ack=1479 Win=65792 Len=0
 11   0.934411  192.168.1.2 -> 54.230.99.53 TCP 54 49887→80 [FIN, ACK] Seq=97 Ack=1479 Win=65792 Len=0
 12   0.963273 54.230.99.53 -> 192.168.1.2  TCP 54 80→49887 [FIN, ACK] Seq=1479 Ack=98 Win=14720 Len=0
 13   0.963406  192.168.1.2 -> 54.230.99.53 TCP 54 49887→80 [ACK] Seq=98 Ack=1480 Win=65792 Len=0
 14   2.363546  192.168.1.2 -> 64.233.164.125 TCP 55 [TCP segment of a reassembled PDU]
