[Measurement for 1kb at 15:01:22 16.01.2014] 
Tshark:

  1   0.000000  192.168.1.2 -> 54.230.99.246 TCP 66 62536→80 [SYN] Seq=0 Win=8192 Len=0 MSS=1460 WS=256 SACK_PERM=1
  2   0.046413 54.230.99.246 -> 192.168.1.2  TCP 66 80→62536 [SYN, ACK] Seq=0 Ack=1 Win=14600 Len=0 MSS=1400 SACK_PERM=1 WS=128
  3   0.046550  192.168.1.2 -> 54.230.99.246 TCP 54 62536→80 [ACK] Seq=1 Ack=1 Win=65792 Len=0
  4   0.046688  192.168.1.2 -> 54.230.99.246 HTTP 150 GET /1kb HTTP/1.1 
  5   0.077979 54.230.99.246 -> 192.168.1.2  TCP 54 80→62536 [ACK] Seq=1 Ack=97 Win=14720 Len=0
  6   0.087047 54.230.99.246 -> 192.168.1.2  TCP 1454 [TCP segment of a reassembled PDU]
  7   0.089706 54.230.99.246 -> 192.168.1.2  HTTP 131 HTTP/1.1 200 OK  (application/octet-stream)
  8   0.089788  192.168.1.2 -> 54.230.99.246 TCP 54 62536→80 [ACK] Seq=97 Ack=1478 Win=65792 Len=0
  9   0.089883  192.168.1.2 -> 54.230.99.246 TCP 54 62536→80 [FIN, ACK] Seq=97 Ack=1478 Win=65792 Len=0
 10   0.118993 54.230.99.246 -> 192.168.1.2  TCP 54 80→62536 [FIN, ACK] Seq=1478 Ack=98 Win=14720 Len=0
 11   0.119127  192.168.1.2 -> 54.230.99.246 TCP 54 62536→80 [ACK] Seq=98 Ack=1479 Win=65792 Len=0
