[Measurement for 1kb at 09:01:25 17.01.2014] 
Tshark:

  1   0.000000  192.168.1.2 -> 74.125.232.199 TCP 1454 [TCP segment of a reassembled PDU]
  2   0.000023  192.168.1.2 -> 74.125.232.199 TLSv1.2 916 Application Data
  3   0.000332  192.168.1.2 -> 74.125.232.199 TLSv1.2 87 Application Data
  4   0.049990 74.125.232.199 -> 192.168.1.2  TCP 54 443→51243 [ACK] Seq=1 Ack=1401 Win=1373 Len=0
  5   0.052925 74.125.232.199 -> 192.168.1.2  TCP 54 443→51243 [ACK] Seq=1 Ack=2263 Win=1373 Len=0
  6   0.053944 74.125.232.199 -> 192.168.1.2  TCP 54 443→51243 [ACK] Seq=1 Ack=2296 Win=1373 Len=0
  7   0.054936 74.125.232.199 -> 192.168.1.2  TLSv1.2 87 Application Data
  8   0.063970 74.125.232.199 -> 192.168.1.2  TLSv1.2 101 Application Data
  9   0.064030  192.168.1.2 -> 74.125.232.199 TCP 54 51243→443 [ACK] Seq=2296 Ack=81 Win=768 Len=0
 10   0.064916 74.125.232.199 -> 192.168.1.2  TLSv1.2 116 Application Data, Application Data
 11   0.065462  192.168.1.2 -> 74.125.232.199 TLSv1.2 87 Application Data
 12   0.128869 74.125.232.199 -> 192.168.1.2  TCP 54 443→51243 [ACK] Seq=143 Ack=2329 Win=1373 Len=0
 13   0.387104 173.255.112.173 -> 192.168.1.2  TLSv1.2 100 Application Data
 14   0.438043  192.168.1.2 -> 173.255.112.173 TCP 54 51329→443 [ACK] Seq=1 Ack=47 Win=256 Len=0
 15   0.761439  192.168.1.2 -> 54.230.98.174 TCP 66 51393→80 [SYN] Seq=0 Win=8192 Len=0 MSS=1460 WS=256 SACK_PERM=1
 16   0.798477 54.230.98.174 -> 192.168.1.2  TCP 66 80→51393 [SYN, ACK] Seq=0 Ack=1 Win=14600 Len=0 MSS=1400 SACK_PERM=1 WS=128
 17   0.798628  192.168.1.2 -> 54.230.98.174 TCP 54 51393→80 [ACK] Seq=1 Ack=1 Win=65792 Len=0
 18   0.798782  192.168.1.2 -> 54.230.98.174 HTTP 150 GET /1kb HTTP/1.1 
 19   0.872942 54.230.98.174 -> 192.168.1.2  TCP 54 80→51393 [ACK] Seq=1 Ack=97 Win=14720 Len=0
 20   0.877980 54.230.98.174 -> 192.168.1.2  TCP 1454 [TCP segment of a reassembled PDU]
 21   0.880884 54.230.98.174 -> 192.168.1.2  HTTP 132 HTTP/1.1 200 OK  (application/octet-stream)
 22   0.880962  192.168.1.2 -> 54.230.98.174 TCP 54 51393→80 [ACK] Seq=97 Ack=1479 Win=65792 Len=0
 23   0.881096  192.168.1.2 -> 54.230.98.174 TCP 54 51393→80 [FIN, ACK] Seq=97 Ack=1479 Win=65792 Len=0
 24   0.909904 54.230.98.174 -> 192.168.1.2  TCP 54 80→51393 [FIN, ACK] Seq=1479 Ack=98 Win=14720 Len=0
 25   0.910062  192.168.1.2 -> 54.230.98.174 TCP 54 51393→80 [ACK] Seq=98 Ack=1480 Win=65792 Len=0
 26   1.308049 fe80::5ef9:6aff:fe25:83d4 -> fe80::446a:b521:8794:ef65 ICMPv6 86 Neighbor Solicitation for fe80::446a:b521:8794:ef65 from 5c:f9:6a:25:83:d4
 27   1.308135 fe80::446a:b521:8794:ef65 -> fe80::5ef9:6aff:fe25:83d4 ICMPv6 86 Neighbor Advertisement fe80::446a:b521:8794:ef65 (sol, ovr) is at 00:24:d7:3f:fc:98
