[Measurement for 1kb at 18:01:26 16.01.2014] 
Tshark:

  1   0.000000  192.168.1.2 -> 74.125.232.206 TCP 1454 [TCP segment of a reassembled PDU]
  2   0.000022  192.168.1.2 -> 74.125.232.206 TCP 1454 [TCP segment of a reassembled PDU]
  3   0.000035  192.168.1.2 -> 74.125.232.206 TLSv1.2 517 Application Data
  4   0.000430  192.168.1.2 -> 74.125.232.206 TLSv1.2 87 Application Data
  5   0.000824  192.168.1.2 -> 74.125.232.206 TCP 1454 [TCP segment of a reassembled PDU]
  6   0.000859  192.168.1.2 -> 74.125.232.206 TCP 1454 [TCP segment of a reassembled PDU]
  7   0.000878  192.168.1.2 -> 74.125.232.206 TLSv1.2 135 Application Data
  8   0.001372  192.168.1.2 -> 74.125.232.206 TLSv1.2 621 Application Data
  9   0.064317 74.125.232.206 -> 192.168.1.2  TCP 54 443→63450 [ACK] Seq=1 Ack=1401 Win=1373 Len=0
 10   0.071364 74.125.232.206 -> 192.168.1.2  TCP 54 443→63450 [ACK] Seq=1 Ack=2801 Win=1373 Len=0
 11   0.073707 74.125.232.206 -> 192.168.1.2  TCP 54 443→63450 [ACK] Seq=1 Ack=3264 Win=1373 Len=0
 12   0.080411 74.125.232.206 -> 192.168.1.2  TCP 54 443→63450 [ACK] Seq=1 Ack=3297 Win=1373 Len=0
 13   0.080932 74.125.232.206 -> 192.168.1.2  TLSv1.2 87 Application Data
 14   0.090392 74.125.232.206 -> 192.168.1.2  TCP 54 443→63450 [ACK] Seq=34 Ack=6097 Win=1373 Len=0
 15   0.095402 74.125.232.206 -> 192.168.1.2  TCP 54 443→63450 [ACK] Seq=34 Ack=6745 Win=1373 Len=0
 16   0.095561  192.168.1.2 -> 74.125.232.206 TCP 54 63450→443 [ACK] Seq=6745 Ack=34 Win=254 Len=0
 17   0.128146 74.125.232.206 -> 192.168.1.2  TLSv1.2 104 Application Data
 18   0.128845 74.125.232.206 -> 192.168.1.2  TLSv1.2 132 Application Data
 19   0.128901  192.168.1.2 -> 74.125.232.206 TCP 54 63450→443 [ACK] Seq=6745 Ack=162 Win=253 Len=0
 20   0.129063 74.125.232.206 -> 192.168.1.2  TLSv1.2 93 Application Data
 21   0.129086 74.125.232.206 -> 192.168.1.2  TLSv1.2 87 Application Data
 22   0.129120  192.168.1.2 -> 74.125.232.206 TCP 54 63450→443 [ACK] Seq=6745 Ack=234 Win=253 Len=0
 23   0.130019  192.168.1.2 -> 74.125.232.206 TLSv1.2 87 Application Data
 24   0.148485  192.168.1.2 -> 54.230.99.41 TCP 66 63736→80 [SYN] Seq=0 Win=8192 Len=0 MSS=1460 WS=256 SACK_PERM=1
 25   0.175993 54.230.99.41 -> 192.168.1.2  TCP 66 80→63736 [SYN, ACK] Seq=0 Ack=1 Win=14600 Len=0 MSS=1400 SACK_PERM=1 WS=128
 26   0.176123  192.168.1.2 -> 54.230.99.41 TCP 54 63736→80 [ACK] Seq=1 Ack=1 Win=65792 Len=0
 27   0.176481  192.168.1.2 -> 54.230.99.41 HTTP 150 GET /1kb HTTP/1.1 
 28   0.198636 74.125.232.206 -> 192.168.1.2  TCP 54 443→63450 [ACK] Seq=234 Ack=6778 Win=1373 Len=0
 29   0.208845 54.230.99.41 -> 192.168.1.2  TCP 54 80→63736 [ACK] Seq=1 Ack=97 Win=14720 Len=0
 30   0.209673 54.230.99.41 -> 192.168.1.2  TCP 1454 [TCP segment of a reassembled PDU]
 31   0.209759 54.230.99.41 -> 192.168.1.2  HTTP 132 HTTP/1.1 200 OK  (application/octet-stream)
 32   0.209819  192.168.1.2 -> 54.230.99.41 TCP 54 63736→80 [ACK] Seq=97 Ack=1479 Win=65792 Len=0
 33   0.210139  192.168.1.2 -> 54.230.99.41 TCP 54 63736→80 [FIN, ACK] Seq=97 Ack=1479 Win=65792 Len=0
 34   0.242799 54.230.99.41 -> 192.168.1.2  TCP 54 80→63736 [FIN, ACK] Seq=1479 Ack=98 Win=14720 Len=0
 35   0.242927  192.168.1.2 -> 54.230.99.41 TCP 54 63736→80 [ACK] Seq=98 Ack=1480 Win=65792 Len=0
 36   1.087964  192.168.1.1 -> 239.255.255.250 SSDP 451 NOTIFY * HTTP/1.1 
 37   1.094860  192.168.1.1 -> 239.255.255.250 SSDP 523 NOTIFY * HTTP/1.1 
 38   1.099912  192.168.1.1 -> 239.255.255.250 SSDP 519 NOTIFY * HTTP/1.1 
 39   1.109495  192.168.1.1 -> 239.255.255.250 SSDP 531 NOTIFY * HTTP/1.1 
 40   1.116647  192.168.1.1 -> 239.255.255.250 SSDP 513 NOTIFY * HTTP/1.1 
 41   1.121352  192.168.1.1 -> 239.255.255.250 SSDP 515 NOTIFY * HTTP/1.1 
 42   1.129765  192.168.1.1 -> 239.255.255.250 SSDP 460 NOTIFY * HTTP/1.1 
 43   1.134213  192.168.1.1 -> 239.255.255.250 SSDP 460 NOTIFY * HTTP/1.1 
 44   1.138584  192.168.1.1 -> 239.255.255.250 SSDP 460 NOTIFY * HTTP/1.1 
 45   1.142976  192.168.1.1 -> 239.255.255.250 SSDP 460 NOTIFY * HTTP/1.1 
