[Measurement for 100kb at 20:30:18 19.30.2014] 
Tshark:

  1   0.000000 172.31.36.109 -> 172.31.0.2   DNS 89 Standard query 0xe4e3  A d39wppo36gwqpx.cloudfront.net
  2   0.000030 172.31.36.109 -> 172.31.0.2   DNS 89 Standard query 0xfdd0  AAAA d39wppo36gwqpx.cloudfront.net
  3   0.000603   172.31.0.2 -> 172.31.36.109 DNS 170 Standard query response 0xfdd0 
  4   0.000614   172.31.0.2 -> 172.31.36.109 DNS 217 Standard query response 0xe4e3  A 54.230.30.252 A 54.192.30.228 A 54.230.29.241 A 54.230.30.49 A 54.230.30.71 A 54.230.30.72 A 54.230.30.190 A 54.230.30.230
  5   0.003924 172.31.36.109 -> 54.230.30.252 TCP 74 50161 > http [SYN] Seq=0 Win=26883 Len=0 MSS=8961 SACK_PERM=1 TSval=23176244 TSecr=0 WS=128
  6   0.004947 54.230.30.252 -> 172.31.36.109 TCP 74 http > 50161 [SYN, ACK] Seq=0 Ack=1 Win=14480 Len=0 MSS=1460 SACK_PERM=1 TSval=676788262 TSecr=23176244 WS=128
  7   0.004962 172.31.36.109 -> 54.230.30.252 TCP 66 50161 > http [ACK] Seq=1 Ack=1 Win=27008 Len=0 TSval=23176244 TSecr=676788262
  8   0.005002 172.31.36.109 -> 54.230.30.252 HTTP 164 GET /100kb HTTP/1.1 
  9   0.006139 54.230.30.252 -> 172.31.36.109 TCP 66 http > 50161 [ACK] Seq=1 Ack=99 Win=14592 Len=0 TSval=676788262 TSecr=23176244
 10   0.055498 54.230.30.252 -> 172.31.36.109 TCP 14546 [TCP segment of a reassembled PDU]
 11   0.055530 172.31.36.109 -> 54.230.30.252 TCP 66 50161 > http [ACK] Seq=99 Ack=14481 Win=55936 Len=0 TSval=23176257 TSecr=676788267
 12   0.056704 54.230.30.252 -> 172.31.36.109 TCP 4410 [TCP segment of a reassembled PDU]
 13   0.056711 172.31.36.109 -> 54.230.30.252 TCP 66 50161 > http [ACK] Seq=99 Ack=18825 Win=64640 Len=0 TSval=23176257 TSecr=676788267
 14   0.056859 54.230.30.252 -> 172.31.36.109 TCP 2962 [TCP segment of a reassembled PDU]
 15   0.056865 172.31.36.109 -> 54.230.30.252 TCP 66 50161 > http [ACK] Seq=99 Ack=21721 Win=70400 Len=0 TSval=23176257 TSecr=676788267
 16   0.056909 54.230.30.252 -> 172.31.36.109 TCP 5858 [TCP segment of a reassembled PDU]
 17   0.056916 172.31.36.109 -> 54.230.30.252 TCP 66 50161 > http [ACK] Seq=99 Ack=27513 Win=81920 Len=0 TSval=23176257 TSecr=676788267
 18   0.057887 54.230.30.252 -> 172.31.36.109 TCP 4410 [TCP segment of a reassembled PDU]
 19   0.057893 172.31.36.109 -> 54.230.30.252 TCP 66 50161 > http [ACK] Seq=99 Ack=31857 Win=90624 Len=0 TSval=23176257 TSecr=676788267
 20   0.057937 54.230.30.252 -> 172.31.36.109 TCP 4410 [TCP segment of a reassembled PDU]
 21   0.057942 172.31.36.109 -> 54.230.30.252 TCP 66 50161 > http [ACK] Seq=99 Ack=36201 Win=99328 Len=0 TSval=23176257 TSecr=676788267
 22   0.057996 54.230.30.252 -> 172.31.36.109 TCP 4410 [TCP segment of a reassembled PDU]
 23   0.058002 172.31.36.109 -> 54.230.30.252 TCP 66 50161 > http [ACK] Seq=99 Ack=40545 Win=108032 Len=0 TSval=23176257 TSecr=676788267
 24   0.058045 54.230.30.252 -> 172.31.36.109 TCP 2962 [TCP segment of a reassembled PDU]
 25   0.058050 172.31.36.109 -> 54.230.30.252 TCP 66 50161 > http [ACK] Seq=99 Ack=43441 Win=109056 Len=0 TSval=23176257 TSecr=676788267
 26   0.058152 54.230.30.252 -> 172.31.36.109 TCP 2962 [TCP segment of a reassembled PDU]
 27   0.058158 172.31.36.109 -> 54.230.30.252 TCP 66 50161 > http [ACK] Seq=99 Ack=46337 Win=109056 Len=0 TSval=23176257 TSecr=676788267
 28   0.058206 54.230.30.252 -> 172.31.36.109 TCP 1514 [TCP segment of a reassembled PDU]
 29   0.058210 172.31.36.109 -> 54.230.30.252 TCP 66 50161 > http [ACK] Seq=99 Ack=47785 Win=109056 Len=0 TSval=23176257 TSecr=676788267
 30   0.059002 54.230.30.252 -> 172.31.36.109 TCP 1514 [TCP segment of a reassembled PDU]
 31   0.059006 172.31.36.109 -> 54.230.30.252 TCP 66 50161 > http [ACK] Seq=99 Ack=49233 Win=109056 Len=0 TSval=23176258 TSecr=676788267
 32   0.059178 54.230.30.252 -> 172.31.36.109 TCP 5858 [TCP segment of a reassembled PDU]
 33   0.059184 172.31.36.109 -> 54.230.30.252 TCP 66 50161 > http [ACK] Seq=99 Ack=55025 Win=120704 Len=0 TSval=23176258 TSecr=676788267
 34   0.059255 54.230.30.252 -> 172.31.36.109 TCP 10202 [TCP segment of a reassembled PDU]
 35   0.059262 172.31.36.109 -> 54.230.30.252 TCP 66 50161 > http [ACK] Seq=99 Ack=65161 Win=140928 Len=0 TSval=23176258 TSecr=676788267
 36   0.059320 54.230.30.252 -> 172.31.36.109 TCP 1514 [TCP segment of a reassembled PDU]
 37   0.059324 172.31.36.109 -> 54.230.30.252 TCP 66 50161 > http [ACK] Seq=99 Ack=66609 Win=143872 Len=0 TSval=23176258 TSecr=676788267
 38   0.059473 54.230.30.252 -> 172.31.36.109 TCP 10202 [TCP segment of a reassembled PDU]
 39   0.059480 172.31.36.109 -> 54.230.30.252 TCP 66 50161 > http [ACK] Seq=99 Ack=76745 Win=164096 Len=0 TSval=23176258 TSecr=676788267
 40   0.060182 54.230.30.252 -> 172.31.36.109 TCP 1514 [TCP segment of a reassembled PDU]
 41   0.060186 172.31.36.109 -> 54.230.30.252 TCP 66 50161 > http [ACK] Seq=99 Ack=78193 Win=167040 Len=0 TSval=23176258 TSecr=676788267
 42   0.060250 54.230.30.252 -> 172.31.36.109 TCP 1514 [TCP segment of a reassembled PDU]
 43   0.060254 172.31.36.109 -> 54.230.30.252 TCP 66 50161 > http [ACK] Seq=99 Ack=79641 Win=169856 Len=0 TSval=23176258 TSecr=676788267
 44   0.060504 54.230.30.252 -> 172.31.36.109 TCP 8754 [TCP segment of a reassembled PDU]
 45   0.060510 172.31.36.109 -> 54.230.30.252 TCP 66 50161 > http [ACK] Seq=99 Ack=88329 Win=187264 Len=0 TSval=23176258 TSecr=676788267
 46   0.060609 54.230.30.252 -> 172.31.36.109 TCP 10202 [TCP segment of a reassembled PDU]
 47   0.060617 172.31.36.109 -> 54.230.30.252 TCP 66 50161 > http [ACK] Seq=99 Ack=98465 Win=207488 Len=0 TSval=23176258 TSecr=676788267
 48   0.060737 54.230.30.252 -> 172.31.36.109 TCP 2962 [TCP segment of a reassembled PDU]
 49   0.060742 172.31.36.109 -> 54.230.30.252 TCP 66 50161 > http [ACK] Seq=99 Ack=101361 Win=213376 Len=0 TSval=23176258 TSecr=676788267
 50   0.060823 54.230.30.252 -> 172.31.36.109 HTTP 1561 HTTP/1.1 200 OK  (application/octet-stream)
 51   0.060828 172.31.36.109 -> 54.230.30.252 TCP 66 50161 > http [ACK] Seq=99 Ack=102856 Win=216320 Len=0 TSval=23176258 TSecr=676788267
 52   0.060961 172.31.36.109 -> 54.230.30.252 TCP 66 50161 > http [FIN, ACK] Seq=99 Ack=102856 Win=216320 Len=0 TSval=23176258 TSecr=676788267
 53   0.062235 54.230.30.252 -> 172.31.36.109 TCP 66 http > 50161 [FIN, ACK] Seq=102856 Ack=100 Win=14592 Len=0 TSval=676788267 TSecr=23176258
 54   0.062244 172.31.36.109 -> 54.230.30.252 TCP 66 50161 > http [ACK] Seq=100 Ack=102857 Win=216320 Len=0 TSval=23176258 TSecr=676788267
