[Measurement for 100kb at 09:30:19 20.30.2014] 
Tshark:

  1   0.000000 172.31.36.109 -> 172.31.0.2   DNS 89 Standard query 0xe1aa  A d39wppo36gwqpx.cloudfront.net
  2   0.000029 172.31.36.109 -> 172.31.0.2   DNS 89 Standard query 0x8538  AAAA d39wppo36gwqpx.cloudfront.net
  3   0.000665   172.31.0.2 -> 172.31.36.109 DNS 170 Standard query response 0x8538 
  4   0.000676   172.31.0.2 -> 172.31.36.109 DNS 217 Standard query response 0xe1aa  A 54.230.185.254 A 54.230.186.130 A 54.230.187.27 A 54.230.187.225 A 54.239.158.219 A 54.230.184.236 A 54.230.184.251 A 54.230.185.183
  5   0.003885 172.31.36.109 -> 54.230.185.254 TCP 74 56258 > http [SYN] Seq=0 Win=26883 Len=0 MSS=8961 SACK_PERM=1 TSval=34876476 TSecr=0 WS=128
  6   0.022119 54.230.185.254 -> 172.31.36.109 TCP 74 http > 56258 [SYN, ACK] Seq=0 Ack=1 Win=14480 Len=0 MSS=1460 SACK_PERM=1 TSval=1258404069 TSecr=34876476 WS=128
  7   0.022154 172.31.36.109 -> 54.230.185.254 TCP 66 56258 > http [ACK] Seq=1 Ack=1 Win=27008 Len=0 TSval=34876481 TSecr=1258404069
  8   0.022248 172.31.36.109 -> 54.230.185.254 HTTP 164 GET /100kb HTTP/1.1 
  9   0.040186 54.230.185.254 -> 172.31.36.109 TCP 66 http > 56258 [ACK] Seq=1 Ack=99 Win=14592 Len=0 TSval=1258404071 TSecr=34876481
 10   0.124789 06:ab:f2:b7:83:1d -> 06:87:bf:67:ca:e7 ARP 60 Who has 172.31.36.109?  Tell 172.31.32.1
 11   0.124809 06:87:bf:67:ca:e7 -> 06:ab:f2:b7:83:1d ARP 42 172.31.36.109 is at 06:87:bf:67:ca:e7
 12   0.510941 54.230.185.254 -> 172.31.36.109 TCP 4529 [TCP segment of a reassembled PDU]
 13   0.510965 172.31.36.109 -> 54.230.185.254 TCP 66 56258 > http [ACK] Seq=99 Ack=4464 Win=35840 Len=0 TSval=34876603 TSecr=1258404118
 14   0.718906 54.230.185.254 -> 172.31.36.109 TCP 4446 [TCP segment of a reassembled PDU]
