[Measurement for 1kb at 23:35:10 19.35.2014] 
Tshark:

  1   0.000000 172.31.29.138 -> 172.31.0.2   DNS 89 Standard query 0xc387  A d39wppo36gwqpx.cloudfront.net
  2   0.000027 172.31.29.138 -> 172.31.0.2   DNS 89 Standard query 0xb51d  AAAA d39wppo36gwqpx.cloudfront.net
  3   0.000581   172.31.0.2 -> 172.31.29.138 DNS 217 Standard query response 0xc387  A 54.230.157.230 A 54.230.158.139 A 54.230.158.241 A 54.230.159.7 A 54.230.159.132 A 54.230.159.153 A 54.192.157.144 A 54.192.159.174
  4   0.039093   172.31.0.2 -> 172.31.29.138 DNS 170 Standard query response 0xb51d 
  5   0.060305 172.31.29.138 -> 54.230.157.230 TCP 74 60521 > http [SYN] Seq=0 Win=26883 Len=0 MSS=8961 SACK_PERM=1 TSval=5995798 TSecr=0 WS=128
  6   0.060860 54.230.157.230 -> 172.31.29.138 TCP 74 http > 60521 [SYN, ACK] Seq=0 Ack=1 Win=14480 Len=0 MSS=1460 SACK_PERM=1 TSval=728649022 TSecr=5995798 WS=128
  7   0.060876 172.31.29.138 -> 54.230.157.230 TCP 66 60521 > http [ACK] Seq=1 Ack=1 Win=27008 Len=0 TSval=5995798 TSecr=728649022
  8   0.060934 172.31.29.138 -> 54.230.157.230 HTTP 162 GET /1kb HTTP/1.1 
  9   0.061382 54.230.157.230 -> 172.31.29.138 TCP 66 http > 60521 [ACK] Seq=1 Ack=97 Win=14592 Len=0 TSval=728649022 TSecr=5995798
 10   0.062939 54.230.157.230 -> 172.31.29.138 HTTP 1544 HTTP/1.1 200 OK  (application/octet-stream)
 11   0.062947 172.31.29.138 -> 54.230.157.230 TCP 66 60521 > http [ACK] Seq=97 Ack=1479 Win=29952 Len=0 TSval=5995798 TSecr=728649022
 12   0.063130 172.31.29.138 -> 54.230.157.230 TCP 66 60521 > http [FIN, ACK] Seq=97 Ack=1479 Win=29952 Len=0 TSval=5995798 TSecr=728649022
 13   0.063888 54.230.157.230 -> 172.31.29.138 TCP 66 http > 60521 [FIN, ACK] Seq=1479 Ack=98 Win=14592 Len=0 TSval=728649023 TSecr=5995798
 14   0.063896 172.31.29.138 -> 54.230.157.230 TCP 66 60521 > http [ACK] Seq=98 Ack=1480 Win=29952 Len=0 TSval=5995799 TSecr=728649023
