[Measurement for 1kb at 06:42:07 20.42.2014] 
Tshark:

  1   0.000000 172.31.8.238 -> 172.31.0.2   DNS 89 Standard query 0x564e  A d1xzxs93r3iphc.cloudfront.net
  2   0.000036 172.31.8.238 -> 172.31.0.2   DNS 89 Standard query 0x348f  AAAA d1xzxs93r3iphc.cloudfront.net
  3   0.000771   172.31.0.2 -> 172.31.8.238 DNS 217 Standard query response 0x564e  A 54.239.132.196 A 54.239.132.249 A 54.230.116.128 A 54.230.117.154 A 54.230.118.187 A 54.230.119.12 A 54.230.119.86 A 54.230.119.125
  4   0.007542   172.31.0.2 -> 172.31.8.238 DNS 170 Standard query response 0x348f 
  5   0.012001 172.31.8.238 -> 54.239.132.196 TCP 74 35081 > http [SYN] Seq=0 Win=26883 Len=0 MSS=8961 SACK_PERM=1 TSval=12338848 TSecr=0 WS=128
  6   0.012780 54.239.132.196 -> 172.31.8.238 TCP 74 http > 35081 [SYN, ACK] Seq=0 Ack=1 Win=14480 Len=0 MSS=1460 SACK_PERM=1 TSval=1687753437 TSecr=12338848 WS=128
  7   0.012794 172.31.8.238 -> 54.239.132.196 TCP 66 35081 > http [ACK] Seq=1 Ack=1 Win=27008 Len=0 TSval=12338848 TSecr=1687753437
  8   0.012830 172.31.8.238 -> 54.239.132.196 HTTP 162 GET /1kb HTTP/1.1 
  9   0.013486 54.239.132.196 -> 172.31.8.238 TCP 66 http > 35081 [ACK] Seq=1 Ack=97 Win=14592 Len=0 TSval=1687753437 TSecr=12338848
 10   0.015066 54.239.132.196 -> 172.31.8.238 HTTP 1544 HTTP/1.1 200 OK  (application/octet-stream)
 11   0.015075 172.31.8.238 -> 54.239.132.196 TCP 66 35081 > http [ACK] Seq=97 Ack=1479 Win=29952 Len=0 TSval=12338848 TSecr=1687753437
 12   0.015216 172.31.8.238 -> 54.239.132.196 TCP 66 35081 > http [FIN, ACK] Seq=97 Ack=1479 Win=29952 Len=0 TSval=12338848 TSecr=1687753437
 13   0.015795 54.239.132.196 -> 172.31.8.238 TCP 66 http > 35081 [FIN, ACK] Seq=1479 Ack=98 Win=14592 Len=0 TSval=1687753437 TSecr=12338848
 14   0.015803 172.31.8.238 -> 54.239.132.196 TCP 66 35081 > http [ACK] Seq=98 Ack=1480 Win=29952 Len=0 TSval=12338849 TSecr=1687753437
