[Measurement for 1kb at 17:43:00 19.43.2014] 
Tshark:

  1   0.000000 172.31.8.238 -> 172.31.0.2   DNS 89 Standard query 0x584d  A d1xzxs93r3iphc.cloudfront.net
  2   0.000037 172.31.8.238 -> 172.31.0.2   DNS 89 Standard query 0x2ab9  AAAA d1xzxs93r3iphc.cloudfront.net
  3   0.001613   172.31.0.2 -> 172.31.8.238 DNS 217 Standard query response 0x584d  A 54.192.141.185 A 54.230.141.138 A 54.230.141.198 A 54.230.143.143 A 54.230.143.227 A 205.251.215.109 A 54.192.141.4 A 54.192.141.181
  4   0.005961   172.31.0.2 -> 172.31.8.238 DNS 170 Standard query response 0x2ab9 
  5   0.013434 172.31.8.238 -> 54.192.141.185 TCP 74 41929 > http [SYN] Seq=0 Win=26883 Len=0 MSS=8961 SACK_PERM=1 TSval=651996 TSecr=0 WS=128
  6   0.020886 54.192.141.185 -> 172.31.8.238 TCP 74 http > 41929 [SYN, ACK] Seq=0 Ack=1 Win=14480 Len=0 MSS=1460 SACK_PERM=1 TSval=897300844 TSecr=651996 WS=128
  7   0.020926 172.31.8.238 -> 54.192.141.185 TCP 66 41929 > http [ACK] Seq=1 Ack=1 Win=27008 Len=0 TSval=651998 TSecr=897300844
  8   0.021040 172.31.8.238 -> 54.192.141.185 HTTP 162 GET /1kb HTTP/1.1 
  9   0.025991 54.192.141.185 -> 172.31.8.238 TCP 66 http > 41929 [ACK] Seq=1 Ack=97 Win=14592 Len=0 TSval=897300844 TSecr=651998
 10   0.219723 54.192.141.185 -> 172.31.8.238 HTTP 1533 HTTP/1.1 200 OK  (application/octet-stream)
 11   0.219750 172.31.8.238 -> 54.192.141.185 TCP 66 41929 > http [ACK] Seq=97 Ack=1468 Win=29824 Len=0 TSval=652048 TSecr=897300864
 12   0.222954 172.31.8.238 -> 54.192.141.185 TCP 66 41929 > http [FIN, ACK] Seq=97 Ack=1468 Win=29824 Len=0 TSval=652049 TSecr=897300864
 13   0.226074 54.192.141.185 -> 172.31.8.238 TCP 66 http > 41929 [FIN, ACK] Seq=1468 Ack=98 Win=14592 Len=0 TSval=897300865 TSecr=652049
 14   0.226088 172.31.8.238 -> 54.192.141.185 TCP 66 41929 > http [ACK] Seq=98 Ack=1469 Win=29824 Len=0 TSval=652049 TSecr=897300865
