[Measurement for 1kb at 00:42:07 20.42.2014] 
Tshark:

  1   0.000000 172.31.8.238 -> 172.31.0.2   DNS 89 Standard query 0xb3ee  A d1xzxs93r3iphc.cloudfront.net
  2   0.000039 172.31.8.238 -> 172.31.0.2   DNS 89 Standard query 0xf504  AAAA d1xzxs93r3iphc.cloudfront.net
  3   0.000515   172.31.0.2 -> 172.31.8.238 DNS 217 Standard query response 0xb3ee  A 54.230.117.238 A 54.230.119.91 A 54.192.118.221 A 54.192.118.224 A 54.192.118.243 A 54.230.116.53 A 54.230.116.136 A 54.230.116.189
  4   0.003390   172.31.0.2 -> 172.31.8.238 DNS 170 Standard query response 0xf504 
  5   0.003844 172.31.8.238 -> 54.230.117.238 TCP 74 36909 > http [SYN] Seq=0 Win=26883 Len=0 MSS=8961 SACK_PERM=1 TSval=6938851 TSecr=0 WS=128
  6   0.004756 54.230.117.238 -> 172.31.8.238 TCP 74 http > 36909 [SYN, ACK] Seq=0 Ack=1 Win=14480 Len=0 MSS=1460 SACK_PERM=1 TSval=1685532215 TSecr=6938851 WS=128
  7   0.004769 172.31.8.238 -> 54.230.117.238 TCP 66 36909 > http [ACK] Seq=1 Ack=1 Win=27008 Len=0 TSval=6938851 TSecr=1685532215
  8   0.004819 172.31.8.238 -> 54.230.117.238 HTTP 162 GET /1kb HTTP/1.1 
  9   0.005484 54.230.117.238 -> 172.31.8.238 TCP 66 http > 36909 [ACK] Seq=1 Ack=97 Win=14592 Len=0 TSval=1685532215 TSecr=6938851
 10   0.007801 54.230.117.238 -> 172.31.8.238 HTTP 1544 HTTP/1.1 200 OK  (application/octet-stream)
 11   0.007808 172.31.8.238 -> 54.230.117.238 TCP 66 36909 > http [ACK] Seq=97 Ack=1479 Win=29952 Len=0 TSval=6938852 TSecr=1685532215
 12   0.007968 172.31.8.238 -> 54.230.117.238 TCP 66 36909 > http [FIN, ACK] Seq=97 Ack=1479 Win=29952 Len=0 TSval=6938852 TSecr=1685532215
 13   0.008563 54.230.117.238 -> 172.31.8.238 TCP 66 http > 36909 [FIN, ACK] Seq=1479 Ack=98 Win=14592 Len=0 TSval=1685532215 TSecr=6938852
 14   0.008571 172.31.8.238 -> 54.230.117.238 TCP 66 36909 > http [ACK] Seq=98 Ack=1480 Win=29952 Len=0 TSval=6938852 TSecr=1685532215
