[Measurement for 1kb at 07:42:07 20.42.2014] 
Tshark:

  1   0.000000 172.31.8.238 -> 172.31.0.2   DNS 89 Standard query 0xdc1b  A d1xzxs93r3iphc.cloudfront.net
  2   0.000030 172.31.8.238 -> 172.31.0.2   DNS 89 Standard query 0x6b2b  AAAA d1xzxs93r3iphc.cloudfront.net
  3   0.000581   172.31.0.2 -> 172.31.8.238 DNS 217 Standard query response 0xdc1b  A 54.230.119.150 A 54.230.119.165 A 54.239.132.74 A 54.239.132.83 A 54.239.132.147 A 54.230.116.239 A 54.230.117.157 A 54.230.119.91
  4   0.005882   172.31.0.2 -> 172.31.8.238 DNS 170 Standard query response 0x6b2b 
  5   0.011997 172.31.8.238 -> 54.230.119.150 TCP 74 44617 > http [SYN] Seq=0 Win=26883 Len=0 MSS=8961 SACK_PERM=1 TSval=13238795 TSecr=0 WS=128
  6   0.012797 54.230.119.150 -> 172.31.8.238 TCP 74 http > 44617 [SYN, ACK] Seq=0 Ack=1 Win=14480 Len=0 MSS=1460 SACK_PERM=1 TSval=1684894522 TSecr=13238795 WS=128
  7   0.012811 172.31.8.238 -> 54.230.119.150 TCP 66 44617 > http [ACK] Seq=1 Ack=1 Win=27008 Len=0 TSval=13238795 TSecr=1684894522
  8   0.012854 172.31.8.238 -> 54.230.119.150 HTTP 162 GET /1kb HTTP/1.1 
  9   0.013506 54.230.119.150 -> 172.31.8.238 TCP 66 http > 44617 [ACK] Seq=1 Ack=97 Win=14592 Len=0 TSval=1684894522 TSecr=13238795
 10   0.014816 54.230.119.150 -> 172.31.8.238 HTTP 1544 HTTP/1.1 200 OK  (application/octet-stream)
 11   0.014825 172.31.8.238 -> 54.230.119.150 TCP 66 44617 > http [ACK] Seq=97 Ack=1479 Win=29952 Len=0 TSval=13238796 TSecr=1684894522
 12   0.014971 172.31.8.238 -> 54.230.119.150 TCP 66 44617 > http [FIN, ACK] Seq=97 Ack=1479 Win=29952 Len=0 TSval=13238796 TSecr=1684894522
 13   0.015521 54.230.119.150 -> 172.31.8.238 TCP 66 http > 44617 [FIN, ACK] Seq=1479 Ack=98 Win=14592 Len=0 TSval=1684894522 TSecr=13238796
 14   0.015530 172.31.8.238 -> 54.230.119.150 TCP 66 44617 > http [ACK] Seq=98 Ack=1480 Win=29952 Len=0 TSval=13238796 TSecr=1684894522
