[Measurement for 100kb at 00:40:18 20.40.2014] 
Tshark:

  1   0.000000 172.31.8.238 -> 172.31.0.2   DNS 89 Standard query 0x9d2b  A d39wppo36gwqpx.cloudfront.net
  2   0.000038 172.31.8.238 -> 172.31.0.2   DNS 89 Standard query 0xe45e  AAAA d39wppo36gwqpx.cloudfront.net
  3   0.000599   172.31.0.2 -> 172.31.8.238 DNS 217 Standard query response 0x9d2b  A 54.239.132.166 A 54.192.118.240 A 54.192.118.241 A 54.230.116.141 A 54.230.117.37 A 54.230.117.87 A 54.230.118.239 A 54.230.119.55
  4   0.000610   172.31.0.2 -> 172.31.8.238 DNS 170 Standard query response 0xe45e 
  5   0.003890 172.31.8.238 -> 54.239.132.166 TCP 74 54202 > http [SYN] Seq=0 Win=26883 Len=0 MSS=8961 SACK_PERM=1 TSval=6911505 TSecr=0 WS=128
  6   0.004343 54.239.132.166 -> 172.31.8.238 TCP 74 http > 54202 [SYN, ACK] Seq=0 Ack=1 Win=14480 Len=0 MSS=1460 SACK_PERM=1 TSval=1683316877 TSecr=6911505 WS=128
  7   0.004357 172.31.8.238 -> 54.239.132.166 TCP 66 54202 > http [ACK] Seq=1 Ack=1 Win=27008 Len=0 TSval=6911505 TSecr=1683316877
  8   0.004404 172.31.8.238 -> 54.239.132.166 HTTP 164 GET /100kb HTTP/1.1 
  9   0.004878 54.239.132.166 -> 172.31.8.238 TCP 66 http > 54202 [ACK] Seq=1 Ack=99 Win=14592 Len=0 TSval=1683316877 TSecr=6911505
 10   0.006891 54.239.132.166 -> 172.31.8.238 TCP 2592 [TCP segment of a reassembled PDU]
 11   0.006898 172.31.8.238 -> 54.239.132.166 TCP 66 54202 > http [ACK] Seq=99 Ack=2527 Win=32000 Len=0 TSval=6911506 TSecr=1683316878
 12   0.007054 54.239.132.166 -> 172.31.8.238 TCP 11650 [TCP segment of a reassembled PDU]
 13   0.007065 172.31.8.238 -> 54.239.132.166 TCP 66 54202 > http [ACK] Seq=99 Ack=14111 Win=55168 Len=0 TSval=6911506 TSecr=1683316878
 14   0.007681 54.239.132.166 -> 172.31.8.238 TCP 4410 [TCP segment of a reassembled PDU]
 15   0.007687 172.31.8.238 -> 54.239.132.166 TCP 66 54202 > http [ACK] Seq=99 Ack=18455 Win=63872 Len=0 TSval=6911506 TSecr=1683316878
 16   0.007758 54.239.132.166 -> 172.31.8.238 TCP 8754 [TCP segment of a reassembled PDU]
 17   0.007766 172.31.8.238 -> 54.239.132.166 TCP 66 54202 > http [ACK] Seq=99 Ack=27143 Win=81280 Len=0 TSval=6911506 TSecr=1683316878
 18   0.008195 54.239.132.166 -> 172.31.8.238 TCP 5858 [TCP segment of a reassembled PDU]
 19   0.008202 172.31.8.238 -> 54.239.132.166 TCP 66 54202 > http [ACK] Seq=99 Ack=32935 Win=92800 Len=0 TSval=6911506 TSecr=1683316878
 20   0.008320 54.239.132.166 -> 172.31.8.238 TCP 14546 [TCP segment of a reassembled PDU]
 21   0.008330 172.31.8.238 -> 54.239.132.166 TCP 66 54202 > http [ACK] Seq=99 Ack=47415 Win=94080 Len=0 TSval=6911506 TSecr=1683316878
 22   0.008707 54.239.132.166 -> 172.31.8.238 TCP 4410 [TCP segment of a reassembled PDU]
 23   0.008714 172.31.8.238 -> 54.239.132.166 TCP 66 54202 > http [ACK] Seq=99 Ack=51759 Win=109056 Len=0 TSval=6911506 TSecr=1683316878
 24   0.008739 54.239.132.166 -> 172.31.8.238 TCP 1514 [TCP segment of a reassembled PDU]
 25   0.008746 172.31.8.238 -> 54.239.132.166 TCP 66 54202 > http [ACK] Seq=99 Ack=53207 Win=109056 Len=0 TSval=6911506 TSecr=1683316878
 26   0.008953 54.239.132.166 -> 172.31.8.238 TCP 2962 [TCP segment of a reassembled PDU]
 27   0.008958 172.31.8.238 -> 54.239.132.166 TCP 66 54202 > http [ACK] Seq=99 Ack=56103 Win=109056 Len=0 TSval=6911506 TSecr=1683316878
 28   0.009072 54.239.132.166 -> 172.31.8.238 TCP 10202 [TCP segment of a reassembled PDU]
 29   0.009080 172.31.8.238 -> 54.239.132.166 TCP 66 54202 > http [ACK] Seq=99 Ack=66239 Win=101248 Len=0 TSval=6911506 TSecr=1683316878
 30   0.009208 54.239.132.166 -> 172.31.8.238 TCP 4410 [TCP segment of a reassembled PDU]
 31   0.009227 172.31.8.238 -> 54.239.132.166 TCP 66 54202 > http [ACK] Seq=99 Ack=70583 Win=109056 Len=0 TSval=6911506 TSecr=1683316878
 32   0.009321 54.239.132.166 -> 172.31.8.238 TCP 8754 [TCP segment of a reassembled PDU]
 33   0.009329 172.31.8.238 -> 54.239.132.166 TCP 66 54202 > http [ACK] Seq=99 Ack=79271 Win=103680 Len=0 TSval=6911506 TSecr=1683316878
 34   0.009713 54.239.132.166 -> 172.31.8.238 TCP 5858 [TCP segment of a reassembled PDU]
 35   0.009720 172.31.8.238 -> 54.239.132.166 TCP 66 54202 > http [ACK] Seq=99 Ack=85063 Win=108416 Len=0 TSval=6911506 TSecr=1683316878
 36   0.009817 54.239.132.166 -> 172.31.8.238 TCP 10202 [TCP segment of a reassembled PDU]
 37   0.009825 172.31.8.238 -> 54.239.132.166 TCP 66 54202 > http [ACK] Seq=99 Ack=95199 Win=101248 Len=0 TSval=6911506 TSecr=1683316878
 38   0.009968 54.239.132.166 -> 172.31.8.238 TCP 5858 [TCP segment of a reassembled PDU]
 39   0.009974 172.31.8.238 -> 54.239.132.166 TCP 66 54202 > http [ACK] Seq=99 Ack=100991 Win=108416 Len=0 TSval=6911506 TSecr=1683316878
 40   0.010055 54.239.132.166 -> 172.31.8.238 HTTP 1932 HTTP/1.1 200 OK  (application/octet-stream)
 41   0.010059 172.31.8.238 -> 54.239.132.166 TCP 66 54202 > http [ACK] Seq=99 Ack=102857 Win=109056 Len=0 TSval=6911506 TSecr=1683316878
 42   0.010195 172.31.8.238 -> 54.239.132.166 TCP 66 54202 > http [FIN, ACK] Seq=99 Ack=102857 Win=109056 Len=0 TSval=6911506 TSecr=1683316878
 43   0.010728 54.239.132.166 -> 172.31.8.238 TCP 66 http > 54202 [FIN, ACK] Seq=102857 Ack=100 Win=14592 Len=0 TSval=1683316878 TSecr=6911506
 44   0.010735 172.31.8.238 -> 54.239.132.166 TCP 66 54202 > http [ACK] Seq=100 Ack=102858 Win=109056 Len=0 TSval=6911507 TSecr=1683316878
