[Measurement for 100kb at 01:40:18 20.40.2014] 
Tshark:

  1   0.000000 172.31.8.238 -> 172.31.0.2   DNS 89 Standard query 0xf4ea  A d39wppo36gwqpx.cloudfront.net
  2   0.000029 172.31.8.238 -> 172.31.0.2   DNS 89 Standard query 0x30db  AAAA d39wppo36gwqpx.cloudfront.net
  3   0.000608   172.31.0.2 -> 172.31.8.238 DNS 170 Standard query response 0x30db 
  4   0.000618   172.31.0.2 -> 172.31.8.238 DNS 217 Standard query response 0xf4ea  A 54.230.119.94 A 54.230.119.165 A 54.239.132.84 A 54.239.132.147 A 54.192.118.218 A 54.192.118.239 A 54.192.118.242 A 54.230.117.10
  5   0.003354 172.31.8.238 -> 54.230.119.94 TCP 74 40971 > http [SYN] Seq=0 Win=26883 Len=0 MSS=8961 SACK_PERM=1 TSval=7811473 TSecr=0 WS=128
  6   0.004093 54.230.119.94 -> 172.31.8.238 TCP 74 http > 40971 [SYN, ACK] Seq=0 Ack=1 Win=14480 Len=0 MSS=1460 SACK_PERM=1 TSval=1682014663 TSecr=7811473 WS=128
  7   0.004107 172.31.8.238 -> 54.230.119.94 TCP 66 40971 > http [ACK] Seq=1 Ack=1 Win=27008 Len=0 TSval=7811474 TSecr=1682014663
  8   0.004150 172.31.8.238 -> 54.230.119.94 HTTP 164 GET /100kb HTTP/1.1 
  9   0.004557 54.230.119.94 -> 172.31.8.238 TCP 66 http > 40971 [ACK] Seq=1 Ack=99 Win=14592 Len=0 TSval=1682014663 TSecr=7811474
 10   0.005849 54.230.119.94 -> 172.31.8.238 TCP 522 [TCP segment of a reassembled PDU]
 11   0.005855 172.31.8.238 -> 54.230.119.94 TCP 66 40971 > http [ACK] Seq=99 Ack=457 Win=28032 Len=0 TSval=7811474 TSecr=1682014664
 12   0.005934 54.230.119.94 -> 172.31.8.238 TCP 7306 [TCP segment of a reassembled PDU]
 13   0.005943 172.31.8.238 -> 54.230.119.94 TCP 66 40971 > http [ACK] Seq=99 Ack=7697 Win=42496 Len=0 TSval=7811474 TSecr=1682014664
 14   0.006006 54.230.119.94 -> 172.31.8.238 TCP 5858 [TCP segment of a reassembled PDU]
 15   0.006014 172.31.8.238 -> 54.230.119.94 TCP 66 40971 > http [ACK] Seq=99 Ack=13489 Win=54144 Len=0 TSval=7811474 TSecr=1682014664
 16   0.006412 54.230.119.94 -> 172.31.8.238 TCP 10202 [TCP segment of a reassembled PDU]
 17   0.006421 172.31.8.238 -> 54.230.119.94 TCP 66 40971 > http [ACK] Seq=99 Ack=23625 Win=74368 Len=0 TSval=7811474 TSecr=1682014664
 18   0.006455 54.230.119.94 -> 172.31.8.238 TCP 1514 [TCP segment of a reassembled PDU]
 19   0.006459 172.31.8.238 -> 54.230.119.94 TCP 66 40971 > http [ACK] Seq=99 Ack=25073 Win=77312 Len=0 TSval=7811474 TSecr=1682014664
 20   0.006774 54.230.119.94 -> 172.31.8.238 TCP 1514 [TCP segment of a reassembled PDU]
 21   0.006778 172.31.8.238 -> 54.230.119.94 TCP 66 40971 > http [ACK] Seq=99 Ack=26521 Win=80128 Len=0 TSval=7811474 TSecr=1682014664
 22   0.007165 54.230.119.94 -> 172.31.8.238 TCP 8754 [TCP segment of a reassembled PDU]
 23   0.007173 172.31.8.238 -> 54.230.119.94 TCP 66 40971 > http [ACK] Seq=99 Ack=35209 Win=97536 Len=0 TSval=7811474 TSecr=1682014664
 24   0.007313 54.230.119.94 -> 172.31.8.238 TCP 11650 [TCP segment of a reassembled PDU]
 25   0.007323 172.31.8.238 -> 54.230.119.94 TCP 66 40971 > http [ACK] Seq=99 Ack=46793 Win=98944 Len=0 TSval=7811474 TSecr=1682014664
 26   0.007671 54.230.119.94 -> 172.31.8.238 TCP 4410 [TCP segment of a reassembled PDU]
 27   0.007677 172.31.8.238 -> 54.230.119.94 TCP 66 40971 > http [ACK] Seq=99 Ack=51137 Win=109056 Len=0 TSval=7811475 TSecr=1682014664
 28   0.007714 54.230.119.94 -> 172.31.8.238 TCP 1514 [TCP segment of a reassembled PDU]
 29   0.007718 172.31.8.238 -> 54.230.119.94 TCP 66 40971 > http [ACK] Seq=99 Ack=52585 Win=112000 Len=0 TSval=7811475 TSecr=1682014664
 30   0.007888 54.230.119.94 -> 172.31.8.238 TCP 1514 [TCP segment of a reassembled PDU]
 31   0.007892 172.31.8.238 -> 54.230.119.94 TCP 66 40971 > http [ACK] Seq=99 Ack=54033 Win=114816 Len=0 TSval=7811475 TSecr=1682014664
 32   0.008083 54.230.119.94 -> 172.31.8.238 TCP 11650 [TCP segment of a reassembled PDU]
 33   0.008097 172.31.8.238 -> 54.230.119.94 TCP 66 40971 > http [ACK] Seq=99 Ack=65617 Win=137984 Len=0 TSval=7811475 TSecr=1682014664
 34   0.008199 54.230.119.94 -> 172.31.8.238 TCP 2962 [TCP segment of a reassembled PDU]
 35   0.008206 172.31.8.238 -> 54.230.119.94 TCP 66 40971 > http [ACK] Seq=99 Ack=68513 Win=143872 Len=0 TSval=7811475 TSecr=1682014664
 36   0.008329 54.230.119.94 -> 172.31.8.238 TCP 10202 [TCP segment of a reassembled PDU]
 37   0.008337 172.31.8.238 -> 54.230.119.94 TCP 66 40971 > http [ACK] Seq=99 Ack=78649 Win=164096 Len=0 TSval=7811475 TSecr=1682014664
 38   0.008689 54.230.119.94 -> 172.31.8.238 TCP 5858 [TCP segment of a reassembled PDU]
 39   0.008696 172.31.8.238 -> 54.230.119.94 TCP 66 40971 > http [ACK] Seq=99 Ack=84441 Win=175616 Len=0 TSval=7811475 TSecr=1682014664
 40   0.008805 54.230.119.94 -> 172.31.8.238 TCP 14546 [TCP segment of a reassembled PDU]
 41   0.008815 172.31.8.238 -> 54.230.119.94 TCP 66 40971 > http [ACK] Seq=99 Ack=98921 Win=204672 Len=0 TSval=7811475 TSecr=1682014664
 42   0.008951 54.230.119.94 -> 172.31.8.238 TCP 2962 [TCP segment of a reassembled PDU]
 43   0.008957 172.31.8.238 -> 54.230.119.94 TCP 66 40971 > http [ACK] Seq=99 Ack=101817 Win=210432 Len=0 TSval=7811475 TSecr=1682014664
 44   0.009048 54.230.119.94 -> 172.31.8.238 HTTP 1106 HTTP/1.1 200 OK  (application/octet-stream)
 45   0.009052 172.31.8.238 -> 54.230.119.94 TCP 66 40971 > http [ACK] Seq=99 Ack=102857 Win=213376 Len=0 TSval=7811475 TSecr=1682014664
 46   0.009178 172.31.8.238 -> 54.230.119.94 TCP 66 40971 > http [FIN, ACK] Seq=99 Ack=102857 Win=213376 Len=0 TSval=7811475 TSecr=1682014664
 47   0.010237 54.230.119.94 -> 172.31.8.238 TCP 66 http > 40971 [FIN, ACK] Seq=102857 Ack=100 Win=14592 Len=0 TSval=1682014664 TSecr=7811475
 48   0.010246 172.31.8.238 -> 54.230.119.94 TCP 66 40971 > http [ACK] Seq=100 Ack=102858 Win=213376 Len=0 TSval=7811475 TSecr=1682014664
