[Measurement for 100kb at 18:40:18 19.40.2014] 
Tshark:

  1   0.000000 172.31.8.238 -> 172.31.0.2   DNS 89 Standard query 0x93e6  A d39wppo36gwqpx.cloudfront.net
  2   0.000028 172.31.8.238 -> 172.31.0.2   DNS 89 Standard query 0x80e7  AAAA d39wppo36gwqpx.cloudfront.net
  3   0.000659   172.31.0.2 -> 172.31.8.238 DNS 170 Standard query response 0x80e7 
  4   0.000671   172.31.0.2 -> 172.31.8.238 DNS 217 Standard query response 0x93e6  A 54.192.118.239 A 54.192.118.240 A 54.192.118.241 A 54.230.117.45 A 54.230.118.143 A 54.230.119.18 A 54.239.132.233 A 54.192.118.222
  5   0.003892 172.31.8.238 -> 54.192.118.239 TCP 74 47505 > http [SYN] Seq=0 Win=26883 Len=0 MSS=8961 SACK_PERM=1 TSval=1511589 TSecr=0 WS=128
  6   0.004349 54.192.118.239 -> 172.31.8.238 TCP 74 http > 47505 [SYN, ACK] Seq=0 Ack=1 Win=14480 Len=0 MSS=1460 SACK_PERM=1 TSval=966124685 TSecr=1511589 WS=128
  7   0.004364 172.31.8.238 -> 54.192.118.239 TCP 66 47505 > http [ACK] Seq=1 Ack=1 Win=27008 Len=0 TSval=1511589 TSecr=966124685
  8   0.004405 172.31.8.238 -> 54.192.118.239 HTTP 164 GET /100kb HTTP/1.1 
  9   0.004843 54.192.118.239 -> 172.31.8.238 TCP 66 http > 47505 [ACK] Seq=1 Ack=99 Win=14592 Len=0 TSval=966124685 TSecr=1511589
 10   0.552812 54.192.118.239 -> 172.31.8.238 TCP 4410 [TCP segment of a reassembled PDU]
