[Measurement for 100kb at 10:40:18 20.40.2014] 
Tshark:

  1   0.000000 172.31.8.238 -> 172.31.0.2   DNS 89 Standard query 0x78f6  A d39wppo36gwqpx.cloudfront.net
  2   0.000038 172.31.8.238 -> 172.31.0.2   DNS 89 Standard query 0xbdd7  AAAA d39wppo36gwqpx.cloudfront.net
  3   0.000601   172.31.0.2 -> 172.31.8.238 DNS 170 Standard query response 0xbdd7 
  4   0.000641   172.31.0.2 -> 172.31.8.238 DNS 217 Standard query response 0x78f6  A 54.192.118.232 A 54.192.118.242 A 54.192.118.246 A 54.230.116.72 A 54.230.119.40 A 54.239.132.98 A 54.239.132.233 A 54.239.132.250
  5   0.003856 172.31.8.238 -> 54.192.118.232 TCP 74 39572 > http [SYN] Seq=0 Win=26883 Len=0 MSS=8961 SACK_PERM=1 TSval=15911534 TSecr=0 WS=128
  6   0.004428 54.192.118.232 -> 172.31.8.238 TCP 74 http > 39572 [SYN, ACK] Seq=0 Ack=1 Win=14480 Len=0 MSS=1460 SACK_PERM=1 TSval=1688163241 TSecr=15911534 WS=128
  7   0.004442 172.31.8.238 -> 54.192.118.232 TCP 66 39572 > http [ACK] Seq=1 Ack=1 Win=27008 Len=0 TSval=15911535 TSecr=1688163241
  8   0.004496 172.31.8.238 -> 54.192.118.232 HTTP 164 GET /100kb HTTP/1.1 
  9   0.005096 54.192.118.232 -> 172.31.8.238 TCP 66 http > 39572 [ACK] Seq=1 Ack=99 Win=14592 Len=0 TSval=1688163241 TSecr=15911535
 10   0.006387 54.192.118.232 -> 172.31.8.238 TCP 522 [TCP segment of a reassembled PDU]
 11   0.006393 172.31.8.238 -> 54.192.118.232 TCP 66 39572 > http [ACK] Seq=99 Ack=457 Win=28032 Len=0 TSval=15911535 TSecr=1688163241
 12   0.006512 54.192.118.232 -> 172.31.8.238 TCP 13098 [TCP segment of a reassembled PDU]
 13   0.006522 172.31.8.238 -> 54.192.118.232 TCP 66 39572 > http [ACK] Seq=99 Ack=13489 Win=54144 Len=0 TSval=15911535 TSecr=1688163241
 14   0.007205 54.192.118.232 -> 172.31.8.238 TCP 11650 [TCP segment of a reassembled PDU]
 15   0.007214 172.31.8.238 -> 54.192.118.232 TCP 66 39572 > http [ACK] Seq=99 Ack=25073 Win=77312 Len=0 TSval=15911535 TSecr=1688163241
 16   0.007238 54.192.118.232 -> 172.31.8.238 TCP 1514 [TCP segment of a reassembled PDU]
 17   0.007245 172.31.8.238 -> 54.192.118.232 TCP 66 39572 > http [ACK] Seq=99 Ack=26521 Win=80128 Len=0 TSval=15911535 TSecr=1688163241
 18   0.008004 54.192.118.232 -> 172.31.8.238 TCP 20338 [TCP segment of a reassembled PDU]
 19   0.008016 172.31.8.238 -> 54.192.118.232 TCP 66 39572 > http [ACK] Seq=99 Ack=46793 Win=84608 Len=0 TSval=15911535 TSecr=1688163241
 20   0.008453 54.192.118.232 -> 172.31.8.238 TCP 5858 [TCP segment of a reassembled PDU]
 21   0.008460 172.31.8.238 -> 54.192.118.232 TCP 66 39572 > http [ACK] Seq=99 Ack=52585 Win=108416 Len=0 TSval=15911536 TSecr=1688163241
 22   0.008564 54.192.118.232 -> 172.31.8.238 TCP 13098 [TCP segment of a reassembled PDU]
 23   0.008573 172.31.8.238 -> 54.192.118.232 TCP 66 39572 > http [ACK] Seq=99 Ack=65617 Win=135168 Len=0 TSval=15911536 TSecr=1688163241
 24   0.008987 54.192.118.232 -> 172.31.8.238 TCP 10202 [TCP segment of a reassembled PDU]
 25   0.008995 172.31.8.238 -> 54.192.118.232 TCP 66 39572 > http [ACK] Seq=99 Ack=75753 Win=155392 Len=0 TSval=15911536 TSecr=1688163241
 26   0.009302 54.192.118.232 -> 172.31.8.238 TCP 14546 [TCP segment of a reassembled PDU]
 27   0.009311 172.31.8.238 -> 54.192.118.232 TCP 66 39572 > http [ACK] Seq=99 Ack=90233 Win=184320 Len=0 TSval=15911536 TSecr=1688163241
 28   0.009775 54.192.118.232 -> 172.31.8.238 TCP 1514 [TCP segment of a reassembled PDU]
 29   0.009780 172.31.8.238 -> 54.192.118.232 TCP 66 39572 > http [ACK] Seq=99 Ack=91681 Win=187264 Len=0 TSval=15911536 TSecr=1688163241
 30   0.010035 54.192.118.232 -> 172.31.8.238 HTTP 11242 HTTP/1.1 200 OK  (application/octet-stream)
 31   0.010049 172.31.8.238 -> 54.192.118.232 TCP 66 39572 > http [ACK] Seq=99 Ack=102857 Win=209664 Len=0 TSval=15911536 TSecr=1688163241
 32   0.010199 172.31.8.238 -> 54.192.118.232 TCP 66 39572 > http [FIN, ACK] Seq=99 Ack=102857 Win=209664 Len=0 TSval=15911536 TSecr=1688163241
 33   0.010822 54.192.118.232 -> 172.31.8.238 TCP 66 http > 39572 [FIN, ACK] Seq=102857 Ack=100 Win=14592 Len=0 TSval=1688163241 TSecr=15911536
 34   0.010831 172.31.8.238 -> 54.192.118.232 TCP 66 39572 > http [ACK] Seq=100 Ack=102858 Win=209664 Len=0 TSval=15911536 TSecr=1688163241
