[Measurement for 1kb at 21:34:17 19.34.2014] 
Tshark:

  1   0.000000 172.31.36.109 -> 172.31.0.2   DNS 89 Standard query 0xf191  A d1n0gskdvzj94j.cloudfront.net
  2   0.000028 172.31.36.109 -> 172.31.0.2   DNS 89 Standard query 0x6e23  AAAA d1n0gskdvzj94j.cloudfront.net
  3   0.000630   172.31.0.2 -> 172.31.36.109 DNS 217 Standard query response 0xf191  A 54.230.21.17 A 54.230.21.71 A 54.230.21.108 A 54.230.21.239 A 54.230.23.46 A 54.230.20.48 A 54.230.20.182 A 54.230.20.233
  4   0.044178   172.31.0.2 -> 172.31.36.109 DNS 176 Standard query response 0x6e23 
  5   0.060383 172.31.36.109 -> 54.230.21.17 TCP 74 37076 > http [SYN] Seq=0 Win=26883 Len=0 MSS=8961 SACK_PERM=1 TSval=24135918 TSecr=0 WS=128
  6   0.155213 54.230.21.17 -> 172.31.36.109 TCP 74 http > 37076 [SYN, ACK] Seq=0 Ack=1 Win=14480 Len=0 MSS=1460 SACK_PERM=1 TSval=952064995 TSecr=24135918 WS=128
  7   0.155246 172.31.36.109 -> 54.230.21.17 TCP 66 37076 > http [ACK] Seq=1 Ack=1 Win=27008 Len=0 TSval=24135942 TSecr=952064995
  8   0.155369 172.31.36.109 -> 54.230.21.17 HTTP 162 GET /1kb HTTP/1.1 
  9   0.250226 54.230.21.17 -> 172.31.36.109 TCP 66 http > 37076 [ACK] Seq=1 Ack=97 Win=14592 Len=0 TSval=952065004 TSecr=24135942
 10   0.255093 54.230.21.17 -> 172.31.36.109 HTTP 1544 HTTP/1.1 200 OK  (application/octet-stream)
 11   0.255107 172.31.36.109 -> 54.230.21.17 TCP 66 37076 > http [ACK] Seq=97 Ack=1479 Win=29952 Len=0 TSval=24135967 TSecr=952065005
 12   0.255295 172.31.36.109 -> 54.230.21.17 TCP 66 37076 > http [FIN, ACK] Seq=97 Ack=1479 Win=29952 Len=0 TSval=24135967 TSecr=952065005
 13   0.350037 54.230.21.17 -> 172.31.36.109 TCP 66 http > 37076 [FIN, ACK] Seq=1479 Ack=98 Win=14592 Len=0 TSval=952065014 TSecr=24135967
 14   0.350066 172.31.36.109 -> 54.230.21.17 TCP 66 37076 > http [ACK] Seq=98 Ack=1480 Win=29952 Len=0 TSval=24135991 TSecr=952065014
