[Measurement for 1kb at 23:33:17 19.33.2014] 
Tshark:

  1   0.000000 172.31.36.109 -> 172.31.0.2   DNS 89 Standard query 0x4f9d  A d1n0gskdvzj94j.cloudfront.net
  2   0.000029 172.31.36.109 -> 172.31.0.2   DNS 89 Standard query 0xa635  AAAA d1n0gskdvzj94j.cloudfront.net
  3   0.000450   172.31.0.2 -> 172.31.36.109 DNS 217 Standard query response 0x4f9d  A 54.239.158.232 A 54.239.158.238 A 54.230.185.176 A 54.230.186.217 A 54.230.187.34 A 54.230.187.123 A 54.239.158.150 A 54.239.158.207
  4   0.023374   172.31.0.2 -> 172.31.36.109 DNS 176 Standard query response 0xa635 
  5   0.028223 172.31.36.109 -> 54.239.158.232 TCP 74 50050 > http [SYN] Seq=0 Win=26883 Len=0 MSS=8961 SACK_PERM=1 TSval=25921002 TSecr=0 WS=128
  6   0.046322 54.239.158.232 -> 172.31.36.109 TCP 74 http > 50050 [SYN, ACK] Seq=0 Ack=1 Win=14480 Len=0 MSS=1460 SACK_PERM=1 TSval=1250977379 TSecr=25921002 WS=128
  7   0.046336 172.31.36.109 -> 54.239.158.232 TCP 66 50050 > http [ACK] Seq=1 Ack=1 Win=27008 Len=0 TSval=25921007 TSecr=1250977379
  8   0.046383 172.31.36.109 -> 54.239.158.232 HTTP 162 GET /1kb HTTP/1.1 
  9   0.064478 54.239.158.232 -> 172.31.36.109 TCP 66 http > 50050 [ACK] Seq=1 Ack=97 Win=14592 Len=0 TSval=1250977381 TSecr=25921007
 10   0.071190 54.239.158.232 -> 172.31.36.109 HTTP 1543 HTTP/1.1 200 OK  (application/octet-stream)
 11   0.071199 172.31.36.109 -> 54.239.158.232 TCP 66 50050 > http [ACK] Seq=97 Ack=1478 Win=29952 Len=0 TSval=25921013 TSecr=1250977381
 12   0.071379 172.31.36.109 -> 54.239.158.232 TCP 66 50050 > http [FIN, ACK] Seq=97 Ack=1478 Win=29952 Len=0 TSval=25921013 TSecr=1250977381
 13   0.089332 54.239.158.232 -> 172.31.36.109 TCP 66 http > 50050 [FIN, ACK] Seq=1478 Ack=98 Win=14592 Len=0 TSval=1250977383 TSecr=25921013
 14   0.089344 172.31.36.109 -> 54.239.158.232 TCP 66 50050 > http [ACK] Seq=98 Ack=1479 Win=29952 Len=0 TSval=25921018 TSecr=1250977383
