[Measurement for 1kb at 12:33:20 20.33.2014] 
Tshark:

  1   0.000000 172.31.36.109 -> 172.31.0.2   DNS 89 Standard query 0x7038  A d1n0gskdvzj94j.cloudfront.net
  2   0.000040 172.31.36.109 -> 172.31.0.2   DNS 89 Standard query 0x8c49  AAAA d1n0gskdvzj94j.cloudfront.net
  3   0.000814   172.31.0.2 -> 172.31.36.109 DNS 217 Standard query response 0x7038  A 54.230.30.17 A 54.230.30.50 A 54.230.30.207 A 54.230.30.245 A 54.192.30.137 A 54.192.30.227 A 54.230.29.245 A 54.230.30.7
  4   0.025847   172.31.0.2 -> 172.31.36.109 DNS 176 Standard query response 0x8c49 
  5   0.030839 172.31.36.109 -> 54.230.30.17 TCP 74 51356 > http [SYN] Seq=0 Win=26883 Len=0 MSS=8961 SACK_PERM=1 TSval=37621667 TSecr=0 WS=128
  6   0.032285 54.230.30.17 -> 172.31.36.109 TCP 74 http > 51356 [SYN, ACK] Seq=0 Ack=1 Win=14480 Len=0 MSS=1460 SACK_PERM=1 TSval=624239845 TSecr=37621667 WS=128
  7   0.032299 172.31.36.109 -> 54.230.30.17 TCP 66 51356 > http [ACK] Seq=1 Ack=1 Win=27008 Len=0 TSval=37621667 TSecr=624239845
  8   0.032349 172.31.36.109 -> 54.230.30.17 HTTP 162 GET /1kb HTTP/1.1 
  9   0.033541 54.230.30.17 -> 172.31.36.109 TCP 66 http > 51356 [ACK] Seq=1 Ack=97 Win=14592 Len=0 TSval=624239845 TSecr=37621667
 10   0.261468 54.230.30.17 -> 172.31.36.109 HTTP 1533 HTTP/1.1 200 OK  (application/octet-stream)
 11   0.261489 172.31.36.109 -> 54.230.30.17 TCP 66 51356 > http [ACK] Seq=97 Ack=1468 Win=29824 Len=0 TSval=37621725 TSecr=624239868
 12   0.261665 172.31.36.109 -> 54.230.30.17 TCP 66 51356 > http [FIN, ACK] Seq=97 Ack=1468 Win=29824 Len=0 TSval=37621725 TSecr=624239868
 13   0.262881 54.230.30.17 -> 172.31.36.109 TCP 66 http > 51356 [FIN, ACK] Seq=1468 Ack=98 Win=14592 Len=0 TSval=624239868 TSecr=37621725
 14   0.262891 172.31.36.109 -> 54.230.30.17 TCP 66 51356 > http [ACK] Seq=98 Ack=1469 Win=29824 Len=0 TSval=37621725 TSecr=624239868
