[Measurement for 1kb at 08:33:22 20.33.2014] 
Tshark:

  1   0.000000 172.31.36.109 -> 172.31.0.2   DNS 89 Standard query 0x719b  A d1n0gskdvzj94j.cloudfront.net
  2   0.000026 172.31.36.109 -> 172.31.0.2   DNS 89 Standard query 0x8219  AAAA d1n0gskdvzj94j.cloudfront.net
  3   0.000542   172.31.0.2 -> 172.31.36.109 DNS 217 Standard query response 0x719b  A 54.192.30.191 A 54.192.30.218 A 54.230.30.67 A 54.230.30.215 A 54.230.30.217 A 54.230.30.230 A 54.230.30.254 A 54.192.29.221
  4   0.023590   172.31.0.2 -> 172.31.36.109 DNS 176 Standard query response 0x8219 
  5   0.030503 172.31.36.109 -> 54.192.30.191 TCP 74 40888 > http [SYN] Seq=0 Win=26883 Len=0 MSS=8961 SACK_PERM=1 TSval=34022289 TSecr=0 WS=128
  6   0.031968 54.192.30.191 -> 172.31.36.109 TCP 74 http > 40888 [SYN, ACK] Seq=0 Ack=1 Win=14480 Len=0 MSS=1460 SACK_PERM=1 TSval=692984908 TSecr=34022289 WS=128
  7   0.031982 172.31.36.109 -> 54.192.30.191 TCP 66 40888 > http [ACK] Seq=1 Ack=1 Win=27008 Len=0 TSval=34022289 TSecr=692984908
  8   0.032047 172.31.36.109 -> 54.192.30.191 HTTP 162 GET /1kb HTTP/1.1 
  9   0.033491 54.192.30.191 -> 172.31.36.109 TCP 66 http > 40888 [ACK] Seq=1 Ack=97 Win=14592 Len=0 TSval=692984908 TSecr=34022289
 10   0.055310 54.192.30.191 -> 172.31.36.109 HTTP 1544 HTTP/1.1 200 OK  (application/octet-stream)
 11   0.055320 172.31.36.109 -> 54.192.30.191 TCP 66 40888 > http [ACK] Seq=97 Ack=1479 Win=29952 Len=0 TSval=34022295 TSecr=692984910
 12   0.055497 172.31.36.109 -> 54.192.30.191 TCP 66 40888 > http [FIN, ACK] Seq=97 Ack=1479 Win=29952 Len=0 TSval=34022295 TSecr=692984910
 13   0.056773 54.192.30.191 -> 172.31.36.109 TCP 66 http > 40888 [FIN, ACK] Seq=1479 Ack=98 Win=14592 Len=0 TSval=692984910 TSecr=34022295
 14   0.056782 172.31.36.109 -> 54.192.30.191 TCP 66 40888 > http [ACK] Seq=98 Ack=1480 Win=29952 Len=0 TSval=34022295 TSecr=692984910
