[Measurement for 1kb at 22:33:14 19.33.2014] 
Tshark:

  1   0.000000 172.31.36.109 -> 172.31.0.2   DNS 89 Standard query 0xe4df  A d1n0gskdvzj94j.cloudfront.net
  2   0.000026 172.31.36.109 -> 172.31.0.2   DNS 89 Standard query 0xdcba  AAAA d1n0gskdvzj94j.cloudfront.net
  3   0.000635   172.31.0.2 -> 172.31.36.109 DNS 217 Standard query response 0xe4df  A 54.230.185.61 A 54.230.186.26 A 54.230.187.34 A 54.239.158.96 A 54.239.158.213 A 54.239.158.244 A 54.230.184.78 A 54.230.184.223
  4   0.023647   172.31.0.2 -> 172.31.36.109 DNS 176 Standard query response 0xdcba 
  5   0.028188 172.31.36.109 -> 54.230.185.61 TCP 74 39054 > http [SYN] Seq=0 Win=26883 Len=0 MSS=8961 SACK_PERM=1 TSval=25020296 TSecr=0 WS=128
  6   0.046342 54.230.185.61 -> 172.31.36.109 TCP 74 http > 39054 [SYN, ACK] Seq=0 Ack=1 Win=14480 Len=0 MSS=1460 SACK_PERM=1 TSval=1403578107 TSecr=25020296 WS=128
  7   0.046356 172.31.36.109 -> 54.230.185.61 TCP 66 39054 > http [ACK] Seq=1 Ack=1 Win=27008 Len=0 TSval=25020300 TSecr=1403578107
  8   0.046400 172.31.36.109 -> 54.230.185.61 HTTP 162 GET /1kb HTTP/1.1 
  9   0.064536 54.230.185.61 -> 172.31.36.109 TCP 66 http > 39054 [ACK] Seq=1 Ack=97 Win=14592 Len=0 TSval=1403578109 TSecr=25020300
 10   0.288213 54.230.185.61 -> 172.31.36.109 HTTP 1533 HTTP/1.1 200 OK  (application/octet-stream)
 11   0.288222 172.31.36.109 -> 54.230.185.61 TCP 66 39054 > http [ACK] Seq=97 Ack=1468 Win=29824 Len=0 TSval=25020361 TSecr=1403578131
 12   0.288379 172.31.36.109 -> 54.230.185.61 TCP 66 39054 > http [FIN, ACK] Seq=97 Ack=1468 Win=29824 Len=0 TSval=25020361 TSecr=1403578131
 13   0.306237 54.230.185.61 -> 172.31.36.109 TCP 66 http > 39054 [FIN, ACK] Seq=1468 Ack=98 Win=14592 Len=0 TSval=1403578133 TSecr=25020361
 14   0.306245 172.31.36.109 -> 54.230.185.61 TCP 66 39054 > http [ACK] Seq=98 Ack=1469 Win=29824 Len=0 TSval=25020365 TSecr=1403578133
