[Measurement for 1kb at 06:33:18 20.33.2014] 
Tshark:

  1   0.000000 172.31.36.109 -> 172.31.0.2   DNS 89 Standard query 0x5319  A d1n0gskdvzj94j.cloudfront.net
  2   0.000026 172.31.36.109 -> 172.31.0.2   DNS 89 Standard query 0xff1a  AAAA d1n0gskdvzj94j.cloudfront.net
  3   0.000485   172.31.0.2 -> 172.31.36.109 DNS 217 Standard query response 0x5319  A 54.230.30.2 A 54.230.30.58 A 54.230.30.189 A 54.230.30.242 A 54.230.31.9 A 54.192.30.139 A 54.192.30.216 A 54.192.30.221
  4   0.023185   172.31.0.2 -> 172.31.36.109 DNS 176 Standard query response 0xff1a 
  5   0.030271 172.31.36.109 -> 54.230.30.2  TCP 74 59000 > http [SYN] Seq=0 Win=26883 Len=0 MSS=8961 SACK_PERM=1 TSval=32221362 TSecr=0 WS=128
  6   0.031769  54.230.30.2 -> 172.31.36.109 TCP 74 http > 59000 [SYN, ACK] Seq=0 Ack=1 Win=14480 Len=0 MSS=1460 SACK_PERM=1 TSval=713961677 TSecr=32221362 WS=128
  7   0.031783 172.31.36.109 -> 54.230.30.2  TCP 66 59000 > http [ACK] Seq=1 Ack=1 Win=27008 Len=0 TSval=32221362 TSecr=713961677
  8   0.031829 172.31.36.109 -> 54.230.30.2  HTTP 162 GET /1kb HTTP/1.1 
  9   0.032788  54.230.30.2 -> 172.31.36.109 TCP 66 http > 59000 [ACK] Seq=1 Ack=97 Win=14592 Len=0 TSval=713961677 TSecr=32221362
 10   0.041284  54.230.30.2 -> 172.31.36.109 HTTP 1544 HTTP/1.1 200 OK  (application/octet-stream)
 11   0.041292 172.31.36.109 -> 54.230.30.2  TCP 66 59000 > http [ACK] Seq=97 Ack=1479 Win=29952 Len=0 TSval=32221365 TSecr=713961678
 12   0.041447 172.31.36.109 -> 54.230.30.2  TCP 66 59000 > http [FIN, ACK] Seq=97 Ack=1479 Win=29952 Len=0 TSval=32221365 TSecr=713961678
 13   0.042514  54.230.30.2 -> 172.31.36.109 TCP 66 http > 59000 [FIN, ACK] Seq=1479 Ack=98 Win=14592 Len=0 TSval=713961678 TSecr=32221365
 14   0.042523 172.31.36.109 -> 54.230.30.2  TCP 66 59000 > http [ACK] Seq=98 Ack=1480 Win=29952 Len=0 TSval=32221365 TSecr=713961678
