[Measurement for 1kb at 04:33:16 20.33.2014] 
Tshark:

  1   0.000000 172.31.36.109 -> 172.31.0.2   DNS 89 Standard query 0x7e64  A d1n0gskdvzj94j.cloudfront.net
  2   0.000035 172.31.36.109 -> 172.31.0.2   DNS 89 Standard query 0x8db5  AAAA d1n0gskdvzj94j.cloudfront.net
  3   0.000537   172.31.0.2 -> 172.31.36.109 DNS 217 Standard query response 0x7e64  A 54.230.30.245 A 54.192.30.184 A 54.192.30.214 A 54.192.30.218 A 54.230.30.50 A 54.230.30.73 A 54.230.30.189 A 54.230.30.213
  4   0.023090   172.31.0.2 -> 172.31.36.109 DNS 176 Standard query response 0x8db5 
  5   0.028068 172.31.36.109 -> 54.230.30.245 TCP 74 44893 > http [SYN] Seq=0 Win=26883 Len=0 MSS=8961 SACK_PERM=1 TSval=30420777 TSecr=0 WS=128
  6   0.029305 54.230.30.245 -> 172.31.36.109 TCP 74 http > 44893 [SYN, ACK] Seq=0 Ack=1 Win=14480 Len=0 MSS=1460 SACK_PERM=1 TSval=732433163 TSecr=30420777 WS=128
  7   0.029318 172.31.36.109 -> 54.230.30.245 TCP 66 44893 > http [ACK] Seq=1 Ack=1 Win=27008 Len=0 TSval=30420777 TSecr=732433163
  8   0.029360 172.31.36.109 -> 54.230.30.245 HTTP 162 GET /1kb HTTP/1.1 
  9   0.030543 54.230.30.245 -> 172.31.36.109 TCP 66 http > 44893 [ACK] Seq=1 Ack=97 Win=14592 Len=0 TSval=732433163 TSecr=30420777
 10   0.046040 54.230.30.245 -> 172.31.36.109 HTTP 1544 HTTP/1.1 200 OK  (application/octet-stream)
 11   0.046048 172.31.36.109 -> 54.230.30.245 TCP 66 44893 > http [ACK] Seq=97 Ack=1479 Win=29952 Len=0 TSval=30420781 TSecr=732433164
 12   0.046192 172.31.36.109 -> 54.230.30.245 TCP 66 44893 > http [FIN, ACK] Seq=97 Ack=1479 Win=29952 Len=0 TSval=30420781 TSecr=732433164
 13   0.047207 54.230.30.245 -> 172.31.36.109 TCP 66 http > 44893 [FIN, ACK] Seq=1479 Ack=98 Win=14592 Len=0 TSval=732433164 TSecr=30420781
 14   0.047215 172.31.36.109 -> 54.230.30.245 TCP 66 44893 > http [ACK] Seq=98 Ack=1480 Win=29952 Len=0 TSval=30420781 TSecr=732433164
