[Measurement for 10kb at 07:31:21 20.31.2014] 
Tshark:

  1   0.000000 172.31.36.109 -> 172.31.0.2   DNS 89 Standard query 0x3ff0  A d1xvcg6dfvgaki.cloudfront.net
  2   0.000026 172.31.36.109 -> 172.31.0.2   DNS 89 Standard query 0x6dc3  AAAA d1xvcg6dfvgaki.cloudfront.net
  3   0.000412   172.31.0.2 -> 172.31.36.109 DNS 170 Standard query response 0x6dc3 
  4   0.000423   172.31.0.2 -> 172.31.36.109 DNS 217 Standard query response 0x3ff0  A 54.192.30.216 A 54.192.30.218 A 54.230.30.2 A 54.230.30.50 A 54.230.30.52 A 54.230.30.53 A 54.230.30.202 A 54.192.30.190
  5   0.003896 172.31.36.109 -> 54.192.30.216 TCP 74 60784 > http [SYN] Seq=0 Win=26883 Len=0 MSS=8961 SACK_PERM=1 TSval=33091988 TSecr=0 WS=128
  6   0.005261 54.192.30.216 -> 172.31.36.109 TCP 74 http > 60784 [SYN, ACK] Seq=0 Ack=1 Win=14480 Len=0 MSS=1460 SACK_PERM=1 TSval=626825308 TSecr=33091988 WS=128
  7   0.005276 172.31.36.109 -> 54.192.30.216 TCP 66 60784 > http [ACK] Seq=1 Ack=1 Win=27008 Len=0 TSval=33091988 TSecr=626825308
  8   0.005317 172.31.36.109 -> 54.192.30.216 HTTP 163 GET /10kb HTTP/1.1 
  9   0.006466 54.192.30.216 -> 172.31.36.109 TCP 66 http > 60784 [ACK] Seq=1 Ack=98 Win=14592 Len=0 TSval=626825308 TSecr=33091988
 10   0.051193 54.192.30.216 -> 172.31.36.109 TCP 8754 [TCP segment of a reassembled PDU]
 11   0.051221 172.31.36.109 -> 54.192.30.216 TCP 66 60784 > http [ACK] Seq=98 Ack=8689 Win=44288 Len=0 TSval=33092000 TSecr=626825313
 12   0.051276 54.192.30.216 -> 172.31.36.109 HTTP 2073 HTTP/1.1 200 OK  (application/octet-stream)
 13   0.051285 172.31.36.109 -> 54.192.30.216 TCP 66 60784 > http [ACK] Seq=98 Ack=10696 Win=48384 Len=0 TSval=33092000 TSecr=626825313
 14   0.051575 172.31.36.109 -> 54.192.30.216 TCP 66 60784 > http [FIN, ACK] Seq=98 Ack=10696 Win=48384 Len=0 TSval=33092000 TSecr=626825313
 15   0.052809 54.192.30.216 -> 172.31.36.109 TCP 66 http > 60784 [FIN, ACK] Seq=10696 Ack=99 Win=14592 Len=0 TSval=626825313 TSecr=33092000
 16   0.052818 172.31.36.109 -> 54.192.30.216 TCP 66 60784 > http [ACK] Seq=99 Ack=10697 Win=48384 Len=0 TSval=33092000 TSecr=626825313
