[Measurement for 10kb at 03:31:16 20.31.2014] 
Tshark:

  1   0.000000 172.31.36.109 -> 172.31.0.2   DNS 89 Standard query 0x88fd  A d1xvcg6dfvgaki.cloudfront.net
  2   0.000034 172.31.36.109 -> 172.31.0.2   DNS 89 Standard query 0x31e9  AAAA d1xvcg6dfvgaki.cloudfront.net
  3   0.000430   172.31.0.2 -> 172.31.36.109 DNS 217 Standard query response 0x88fd  A 54.230.21.120 A 54.230.22.217 A 54.230.23.43 A 54.230.23.46 A 54.230.20.109 A 54.230.20.115 A 54.230.20.220 A 54.230.21.17
  4   0.000481   172.31.0.2 -> 172.31.36.109 DNS 170 Standard query response 0x31e9 
  5   0.003895 172.31.36.109 -> 54.230.21.120 TCP 74 37362 > http [SYN] Seq=0 Win=26883 Len=0 MSS=8961 SACK_PERM=1 TSval=29490745 TSecr=0 WS=128
  6   0.089916 54.230.21.120 -> 172.31.36.109 TCP 74 http > 37362 [SYN, ACK] Seq=0 Ack=1 Win=14480 Len=0 MSS=1460 SACK_PERM=1 TSval=966293571 TSecr=29490745 WS=128
  7   0.089949 172.31.36.109 -> 54.230.21.120 TCP 66 37362 > http [ACK] Seq=1 Ack=1 Win=27008 Len=0 TSval=29490767 TSecr=966293571
  8   0.090079 172.31.36.109 -> 54.230.21.120 HTTP 163 GET /10kb HTTP/1.1 
  9   0.176482 54.230.21.120 -> 172.31.36.109 TCP 66 http > 37362 [ACK] Seq=1 Ack=98 Win=14592 Len=0 TSval=966293580 TSecr=29490767
 10   0.181528 54.230.21.120 -> 172.31.36.109 TCP 2962 [TCP segment of a reassembled PDU]
 11   0.181537 172.31.36.109 -> 54.230.21.120 TCP 66 37362 > http [ACK] Seq=98 Ack=2897 Win=32768 Len=0 TSval=29490790 TSecr=966293580
 12   0.181547 54.230.21.120 -> 172.31.36.109 HTTP 7865 HTTP/1.1 200 OK  (application/octet-stream)
 13   0.181554 172.31.36.109 -> 54.230.21.120 TCP 66 37362 > http [ACK] Seq=98 Ack=10696 Win=48384 Len=0 TSval=29490790 TSecr=966293580
 14   0.181704 172.31.36.109 -> 54.230.21.120 TCP 66 37362 > http [FIN, ACK] Seq=98 Ack=10696 Win=48384 Len=0 TSval=29490790 TSecr=966293580
 15   0.268537 54.230.21.120 -> 172.31.36.109 TCP 66 http > 37362 [FIN, ACK] Seq=10696 Ack=99 Win=14592 Len=0 TSval=966293589 TSecr=29490790
 16   0.268565 172.31.36.109 -> 54.230.21.120 TCP 66 37362 > http [ACK] Seq=99 Ack=10697 Win=48384 Len=0 TSval=29490812 TSecr=966293589
