[Measurement for 10kb at 19:31:17 19.31.2014] 
Tshark:

  1   0.000000 06:ab:f2:b7:83:1d -> 06:87:bf:67:ca:e7 ARP 60 Who has 172.31.36.109?  Tell 172.31.32.1
  2   0.000020 06:87:bf:67:ca:e7 -> 06:ab:f2:b7:83:1d ARP 42 172.31.36.109 is at 06:87:bf:67:ca:e7
  3   0.426684 172.31.36.109 -> 172.31.0.2   DNS 89 Standard query 0x3468  A d1xvcg6dfvgaki.cloudfront.net
  4   0.426712 172.31.36.109 -> 172.31.0.2   DNS 89 Standard query 0xe1d4  AAAA d1xvcg6dfvgaki.cloudfront.net
  5   0.427182   172.31.0.2 -> 172.31.36.109 DNS 170 Standard query response 0xe1d4 
  6   0.427192   172.31.0.2 -> 172.31.36.109 DNS 217 Standard query response 0x3468  A 54.230.30.251 A 54.192.29.224 A 54.192.29.226 A 54.192.30.135 A 54.230.30.37 A 54.230.30.38 A 54.230.30.233 A 54.230.30.243
  7   0.430533 172.31.36.109 -> 54.230.30.251 TCP 74 38158 > http [SYN] Seq=0 Win=26883 Len=0 MSS=8961 SACK_PERM=1 TSval=22290989 TSecr=0 WS=128
  8   0.431841 54.230.30.251 -> 172.31.36.109 TCP 74 http > 38158 [SYN, ACK] Seq=0 Ack=1 Win=14480 Len=0 MSS=1460 SACK_PERM=1 TSval=828818254 TSecr=22290989 WS=128
  9   0.431855 172.31.36.109 -> 54.230.30.251 TCP 66 38158 > http [ACK] Seq=1 Ack=1 Win=27008 Len=0 TSval=22290990 TSecr=828818254
 10   0.431899 172.31.36.109 -> 54.230.30.251 HTTP 163 GET /10kb HTTP/1.1 
 11   0.433089 54.230.30.251 -> 172.31.36.109 TCP 66 http > 38158 [ACK] Seq=1 Ack=98 Win=14592 Len=0 TSval=828818254 TSecr=22290990
 12   0.450137 54.230.30.251 -> 172.31.36.109 TCP 6925 [TCP segment of a reassembled PDU]
 13   0.450147 172.31.36.109 -> 54.230.30.251 TCP 66 38158 > http [ACK] Seq=98 Ack=6860 Win=40704 Len=0 TSval=22290994 TSecr=828818256
 14   0.450154 54.230.30.251 -> 172.31.36.109 HTTP 3901 HTTP/1.1 200 OK  (application/octet-stream)
 15   0.450159 172.31.36.109 -> 54.230.30.251 TCP 66 38158 > http [ACK] Seq=98 Ack=10695 Win=48384 Len=0 TSval=22290994 TSecr=828818256
 16   0.450320 172.31.36.109 -> 54.230.30.251 TCP 66 38158 > http [FIN, ACK] Seq=98 Ack=10695 Win=48384 Len=0 TSval=22290994 TSecr=828818256
 17   0.451584 54.230.30.251 -> 172.31.36.109 TCP 66 http > 38158 [FIN, ACK] Seq=10695 Ack=99 Win=14592 Len=0 TSval=828818256 TSecr=22290994
 18   0.451592 172.31.36.109 -> 54.230.30.251 TCP 66 38158 > http [ACK] Seq=99 Ack=10696 Win=48384 Len=0 TSval=22290995 TSecr=828818256
