[Measurement for 1kb at 03:32:20 20.32.2014] 
Tshark:

  1   0.000000 172.31.36.109 -> 172.31.0.2   DNS 89 Standard query 0x765a  A d1xzxs93r3iphc.cloudfront.net
  2   0.000022 172.31.36.109 -> 172.31.0.2   DNS 89 Standard query 0x0ea4  AAAA d1xzxs93r3iphc.cloudfront.net
  3   0.000850   172.31.0.2 -> 172.31.36.109 DNS 217 Standard query response 0x765a  A 54.192.30.218 A 54.230.30.72 A 54.230.30.73 A 54.230.30.189 A 54.230.30.243 A 54.230.30.249 A 54.192.29.221 A 54.192.30.216
  4   0.033669   172.31.0.2 -> 172.31.36.109 DNS 170 Standard query response 0x0ea4 
  5   0.062641 172.31.36.109 -> 54.192.30.218 TCP 74 45821 > http [SYN] Seq=0 Win=26883 Len=0 MSS=8961 SACK_PERM=1 TSval=29506797 TSecr=0 WS=128
  6   0.063982 54.192.30.218 -> 172.31.36.109 TCP 74 http > 45821 [SYN, ACK] Seq=0 Ack=1 Win=14480 Len=0 MSS=1460 SACK_PERM=1 TSval=637762202 TSecr=29506797 WS=128
  7   0.063996 172.31.36.109 -> 54.192.30.218 TCP 66 45821 > http [ACK] Seq=1 Ack=1 Win=27008 Len=0 TSval=29506797 TSecr=637762202
  8   0.064051 172.31.36.109 -> 54.192.30.218 HTTP 162 GET /1kb HTTP/1.1 
  9   0.065219 54.192.30.218 -> 172.31.36.109 TCP 66 http > 45821 [ACK] Seq=1 Ack=97 Win=14592 Len=0 TSval=637762202 TSecr=29506797
 10   0.089393 54.192.30.218 -> 172.31.36.109 HTTP 1544 HTTP/1.1 200 OK  (application/octet-stream)
 11   0.089401 172.31.36.109 -> 54.192.30.218 TCP 66 45821 > http [ACK] Seq=97 Ack=1479 Win=29952 Len=0 TSval=29506804 TSecr=637762205
 12   0.089558 172.31.36.109 -> 54.192.30.218 TCP 66 45821 > http [FIN, ACK] Seq=97 Ack=1479 Win=29952 Len=0 TSval=29506804 TSecr=637762205
 13   0.090834 54.192.30.218 -> 172.31.36.109 TCP 66 http > 45821 [FIN, ACK] Seq=1479 Ack=98 Win=14592 Len=0 TSval=637762205 TSecr=29506804
 14   0.090842 172.31.36.109 -> 54.192.30.218 TCP 66 45821 > http [ACK] Seq=98 Ack=1480 Win=29952 Len=0 TSval=29506804 TSecr=637762205
