[Measurement for 1kb at 10:32:15 20.32.2014] 
Tshark:

  1   0.000000 172.31.36.109 -> 172.31.0.2   DNS 89 Standard query 0x5d91  A d1xzxs93r3iphc.cloudfront.net
  2   0.000037 172.31.36.109 -> 172.31.0.2   DNS 89 Standard query 0x91fd  AAAA d1xzxs93r3iphc.cloudfront.net
  3   0.000451   172.31.0.2 -> 172.31.36.109 DNS 217 Standard query response 0x5d91  A 216.137.41.199 A 216.137.41.237 A 54.230.20.33 A 54.230.20.254 A 54.230.21.51 A 54.230.22.78 A 216.137.41.10 A 216.137.41.20
  4   0.024194   172.31.0.2 -> 172.31.36.109 DNS 170 Standard query response 0x91fd 
  5   0.028148 172.31.36.109 -> 216.137.41.199 TCP 74 41188 > http [SYN] Seq=0 Win=26883 Len=0 MSS=8961 SACK_PERM=1 TSval=35805602 TSecr=0 WS=128
  6   0.117770 216.137.41.199 -> 172.31.36.109 TCP 74 http > 41188 [SYN, ACK] Seq=0 Ack=1 Win=14480 Len=0 MSS=1460 SACK_PERM=1 TSval=985155840 TSecr=35805602 WS=128
  7   0.117805 172.31.36.109 -> 216.137.41.199 TCP 66 41188 > http [ACK] Seq=1 Ack=1 Win=27008 Len=0 TSval=35805624 TSecr=985155840
  8   0.117925 172.31.36.109 -> 216.137.41.199 HTTP 162 GET /1kb HTTP/1.1 
  9   0.207342 216.137.41.199 -> 172.31.36.109 TCP 66 http > 41188 [ACK] Seq=1 Ack=97 Win=14592 Len=0 TSval=985155849 TSecr=35805624
 10   0.209124 216.137.41.199 -> 172.31.36.109 HTTP 1544 HTTP/1.1 200 OK  (application/octet-stream)
 11   0.209138 172.31.36.109 -> 216.137.41.199 TCP 66 41188 > http [ACK] Seq=97 Ack=1479 Win=29952 Len=0 TSval=35805647 TSecr=985155849
 12   0.209322 172.31.36.109 -> 216.137.41.199 TCP 66 41188 > http [FIN, ACK] Seq=97 Ack=1479 Win=29952 Len=0 TSval=35805647 TSecr=985155849
 13   0.299046 216.137.41.199 -> 172.31.36.109 TCP 66 http > 41188 [FIN, ACK] Seq=1479 Ack=98 Win=14592 Len=0 TSval=985155858 TSecr=35805647
 14   0.299072 172.31.36.109 -> 216.137.41.199 TCP 66 41188 > http [ACK] Seq=98 Ack=1480 Win=29952 Len=0 TSval=35805670 TSecr=985155858
 15   0.505302 06:ab:f2:b7:83:1d -> 06:87:bf:67:ca:e7 ARP 60 Who has 172.31.36.109?  Tell 172.31.32.1
 16   0.505321 06:87:bf:67:ca:e7 -> 06:ab:f2:b7:83:1d ARP 42 172.31.36.109 is at 06:87:bf:67:ca:e7
