[Measurement for 1kb at 02:32:12 20.32.2014] 
Tshark:

  1   0.000000 172.31.36.109 -> 172.31.0.2   DNS 89 Standard query 0x1edd  A d1xzxs93r3iphc.cloudfront.net
  2   0.000025 172.31.36.109 -> 172.31.0.2   DNS 89 Standard query 0x60ac  AAAA d1xzxs93r3iphc.cloudfront.net
  3   0.000527   172.31.0.2 -> 172.31.36.109 DNS 217 Standard query response 0x1edd  A 54.230.23.30 A 54.230.23.241 A 216.137.41.24 A 216.137.41.134 A 216.137.41.227 A 54.230.20.174 A 54.230.21.108 A 54.230.22.176
  4   0.022921   172.31.0.2 -> 172.31.36.109 DNS 170 Standard query response 0x60ac 
  5   0.028102 172.31.36.109 -> 54.230.23.30 TCP 74 39248 > http [SYN] Seq=0 Win=26883 Len=0 MSS=8961 SACK_PERM=1 TSval=28604815 TSecr=0 WS=128
  6   0.116667 54.230.23.30 -> 172.31.36.109 TCP 74 http > 39248 [SYN, ACK] Seq=0 Ack=1 Win=14480 Len=0 MSS=1460 SACK_PERM=1 TSval=929886509 TSecr=28604815 WS=128
  7   0.116702 172.31.36.109 -> 54.230.23.30 TCP 66 39248 > http [ACK] Seq=1 Ack=1 Win=27008 Len=0 TSval=28604837 TSecr=929886509
  8   0.116748 172.31.36.109 -> 54.230.23.30 HTTP 162 GET /1kb HTTP/1.1 
  9   0.204996 54.230.23.30 -> 172.31.36.109 TCP 66 http > 39248 [ACK] Seq=1 Ack=97 Win=14592 Len=0 TSval=929886518 TSecr=28604837
 10   0.207328 54.230.23.30 -> 172.31.36.109 HTTP 1544 HTTP/1.1 200 OK  (application/octet-stream)
 11   0.207337 172.31.36.109 -> 54.230.23.30 TCP 66 39248 > http [ACK] Seq=97 Ack=1479 Win=29952 Len=0 TSval=28604859 TSecr=929886518
 12   0.207470 172.31.36.109 -> 54.230.23.30 TCP 66 39248 > http [FIN, ACK] Seq=97 Ack=1479 Win=29952 Len=0 TSval=28604859 TSecr=929886518
 13   0.295847 54.230.23.30 -> 172.31.36.109 TCP 66 http > 39248 [FIN, ACK] Seq=1479 Ack=98 Win=14592 Len=0 TSval=929886527 TSecr=28604859
 14   0.295856 172.31.36.109 -> 54.230.23.30 TCP 66 39248 > http [ACK] Seq=98 Ack=1480 Win=29952 Len=0 TSval=28604881 TSecr=929886527
