[Measurement for 1kb at 06:32:19 20.32.2014] 
Tshark:

  1   0.000000 172.31.36.109 -> 172.31.0.2   DNS 89 Standard query 0x1983  A d1xzxs93r3iphc.cloudfront.net
  2   0.000024 172.31.36.109 -> 172.31.0.2   DNS 89 Standard query 0xe0ed  AAAA d1xzxs93r3iphc.cloudfront.net
  3   0.000460   172.31.0.2 -> 172.31.36.109 DNS 217 Standard query response 0x1983  A 54.192.29.221 A 54.192.30.184 A 54.192.30.190 A 54.230.30.8 A 54.230.30.37 A 54.230.30.53 A 54.230.30.213 A 54.230.31.7
  4   0.033412   172.31.0.2 -> 172.31.36.109 DNS 170 Standard query response 0xe0ed 
  5   0.060277 172.31.36.109 -> 54.192.29.221 TCP 74 58484 > http [SYN] Seq=0 Win=26883 Len=0 MSS=8961 SACK_PERM=1 TSval=32206417 TSecr=0 WS=128
  6   0.061497 54.192.29.221 -> 172.31.36.109 TCP 74 http > 58484 [SYN, ACK] Seq=0 Ack=1 Win=14480 Len=0 MSS=1460 SACK_PERM=1 TSval=722892007 TSecr=32206417 WS=128
  7   0.061512 172.31.36.109 -> 54.192.29.221 TCP 66 58484 > http [ACK] Seq=1 Ack=1 Win=27008 Len=0 TSval=32206417 TSecr=722892007
  8   0.061560 172.31.36.109 -> 54.192.29.221 HTTP 162 GET /1kb HTTP/1.1 
  9   0.062785 54.192.29.221 -> 172.31.36.109 TCP 66 http > 58484 [ACK] Seq=1 Ack=97 Win=14592 Len=0 TSval=722892008 TSecr=32206417
 10   0.072762 54.192.29.221 -> 172.31.36.109 HTTP 1544 HTTP/1.1 200 OK  (application/octet-stream)
 11   0.072772 172.31.36.109 -> 54.192.29.221 TCP 66 58484 > http [ACK] Seq=97 Ack=1479 Win=29952 Len=0 TSval=32206420 TSecr=722892009
 12   0.072942 172.31.36.109 -> 54.192.29.221 TCP 66 58484 > http [FIN, ACK] Seq=97 Ack=1479 Win=29952 Len=0 TSval=32206420 TSecr=722892009
 13   0.074157 54.192.29.221 -> 172.31.36.109 TCP 66 http > 58484 [FIN, ACK] Seq=1479 Ack=98 Win=14592 Len=0 TSval=722892009 TSecr=32206420
 14   0.074165 172.31.36.109 -> 54.192.29.221 TCP 66 58484 > http [ACK] Seq=98 Ack=1480 Win=29952 Len=0 TSval=32206420 TSecr=722892009
