[Measurement for 1kb at 19:32:22 19.32.2014] 
Tshark:

  1   0.000000 172.31.36.109 -> 172.31.0.2   DNS 89 Standard query 0xc32e  A d1xzxs93r3iphc.cloudfront.net
  2   0.000028 172.31.36.109 -> 172.31.0.2   DNS 89 Standard query 0xf566  AAAA d1xzxs93r3iphc.cloudfront.net
  3   0.000543   172.31.0.2 -> 172.31.36.109 DNS 217 Standard query response 0xc32e  A 54.230.21.159 A 54.230.22.78 A 54.230.22.217 A 54.230.23.102 A 54.230.20.43 A 54.230.20.174 A 54.230.20.192 A 54.230.21.133
  4   0.025255   172.31.0.2 -> 172.31.36.109 DNS 170 Standard query response 0xf566 
  5   0.028205 172.31.36.109 -> 54.230.21.159 TCP 74 35791 > http [SYN] Seq=0 Win=26883 Len=0 MSS=8961 SACK_PERM=1 TSval=22307255 TSecr=0 WS=128
  6   0.123098 54.230.21.159 -> 172.31.36.109 TCP 74 http > 35791 [SYN, ACK] Seq=0 Ack=1 Win=14480 Len=0 MSS=1460 SACK_PERM=1 TSval=828287548 TSecr=22307255 WS=128
  7   0.123121 172.31.36.109 -> 54.230.21.159 TCP 66 35791 > http [ACK] Seq=1 Ack=1 Win=27008 Len=0 TSval=22307279 TSecr=828287548
  8   0.123186 172.31.36.109 -> 54.230.21.159 HTTP 162 GET /1kb HTTP/1.1 
  9   0.217766 54.230.21.159 -> 172.31.36.109 TCP 66 http > 35791 [ACK] Seq=1 Ack=97 Win=14592 Len=0 TSval=828287558 TSecr=22307279
 10   0.220655 54.230.21.159 -> 172.31.36.109 TCP 1145 [TCP segment of a reassembled PDU]
 11   0.220671 172.31.36.109 -> 54.230.21.159 TCP 66 35791 > http [ACK] Seq=97 Ack=1080 Win=29056 Len=0 TSval=22307303 TSecr=828287558
 12   0.220813 54.230.21.159 -> 172.31.36.109 HTTP 464 HTTP/1.1 200 OK  (application/octet-stream)
 13   0.220819 172.31.36.109 -> 54.230.21.159 TCP 66 35791 > http [ACK] Seq=97 Ack=1478 Win=31232 Len=0 TSval=22307303 TSecr=828287558
 14   0.220966 172.31.36.109 -> 54.230.21.159 TCP 66 35791 > http [FIN, ACK] Seq=97 Ack=1478 Win=31232 Len=0 TSval=22307303 TSecr=828287558
 15   0.316495 54.230.21.159 -> 172.31.36.109 TCP 66 http > 35791 [FIN, ACK] Seq=1478 Ack=98 Win=14592 Len=0 TSval=828287567 TSecr=22307303
 16   0.316523 172.31.36.109 -> 54.230.21.159 TCP 66 35791 > http [ACK] Seq=98 Ack=1479 Win=31232 Len=0 TSval=22307327 TSecr=828287567
