[Measurement for 1kb at 07:30:41 20.30.2014] 
Tshark:

  1   0.000000 172.31.36.109 -> 172.31.0.2   DNS 89 Standard query 0x5e83  A d3796nkzln59xv.cloudfront.net
  2   0.000028 172.31.36.109 -> 172.31.0.2   DNS 89 Standard query 0x5fe9  AAAA d3796nkzln59xv.cloudfront.net
  3   0.000575   172.31.0.2 -> 172.31.36.109 DNS 217 Standard query response 0x5e83  A 54.230.20.115 A 54.230.21.51 A 54.230.21.159 A 54.230.21.160 A 54.230.21.222 A 54.230.22.128 A 54.230.22.220 A 54.230.20.3
  4   0.179586   172.31.0.2 -> 172.31.36.109 DNS 170 Standard query response 0x5fe9 
  5   0.252734 172.31.36.109 -> 54.230.20.115 TCP 74 52184 > http [SYN] Seq=0 Win=26883 Len=0 MSS=8961 SACK_PERM=1 TSval=33082104 TSecr=0 WS=128
  6   0.341274 54.230.20.115 -> 172.31.36.109 TCP 74 http > 52184 [SYN, ACK] Seq=0 Ack=1 Win=14480 Len=0 MSS=1460 SACK_PERM=1 TSval=980368776 TSecr=33082104 WS=128
  7   0.341296 172.31.36.109 -> 54.230.20.115 TCP 66 52184 > http [ACK] Seq=1 Ack=1 Win=27008 Len=0 TSval=33082126 TSecr=980368776
  8   0.341368 172.31.36.109 -> 54.230.20.115 HTTP 162 GET /1kb HTTP/1.1 
  9   0.429588 54.230.20.115 -> 172.31.36.109 TCP 66 http > 52184 [ACK] Seq=1 Ack=97 Win=14592 Len=0 TSval=980368785 TSecr=33082126
