[Measurement for 1kb at 19:30:42 19.30.2014] 
Tshark:

  1   0.000000 172.31.36.109 -> 172.31.0.2   DNS 89 Standard query 0xae44  A d3796nkzln59xv.cloudfront.net
  2   0.000022 172.31.36.109 -> 172.31.0.2   DNS 89 Standard query 0x378e  AAAA d3796nkzln59xv.cloudfront.net
  3   0.000468   172.31.0.2 -> 172.31.36.109 DNS 217 Standard query response 0xae44  A 54.230.29.244 A 54.230.30.37 A 54.230.30.40 A 54.230.30.222 A 54.230.30.244 A 54.192.29.221 A 54.192.29.227 A 54.192.30.223
  4   0.027360   172.31.0.2 -> 172.31.36.109 DNS 170 Standard query response 0x378e 
  5   0.030469 172.31.36.109 -> 54.230.29.244 TCP 74 44434 > http [SYN] Seq=0 Win=26883 Len=0 MSS=8961 SACK_PERM=1 TSval=22282314 TSecr=0 WS=128
  6   0.031515 54.230.29.244 -> 172.31.36.109 TCP 74 http > 44434 [SYN, ACK] Seq=0 Ack=1 Win=14480 Len=0 MSS=1460 SACK_PERM=1 TSval=828590506 TSecr=22282314 WS=128
  7   0.031528 172.31.36.109 -> 54.230.29.244 TCP 66 44434 > http [ACK] Seq=1 Ack=1 Win=27008 Len=0 TSval=22282314 TSecr=828590506
  8   0.031568 172.31.36.109 -> 54.230.29.244 HTTP 162 GET /1kb HTTP/1.1 
  9   0.032784 54.230.29.244 -> 172.31.36.109 TCP 66 http > 44434 [ACK] Seq=1 Ack=97 Win=14592 Len=0 TSval=828590506 TSecr=22282314
 10   0.062011 54.230.29.244 -> 172.31.36.109 HTTP 1543 HTTP/1.1 200 OK  (application/octet-stream)
 11   0.062035 172.31.36.109 -> 54.230.29.244 TCP 66 44434 > http [ACK] Seq=97 Ack=1478 Win=29952 Len=0 TSval=22282322 TSecr=828590509
 12   0.062184 172.31.36.109 -> 54.230.29.244 TCP 66 44434 > http [FIN, ACK] Seq=97 Ack=1478 Win=29952 Len=0 TSval=22282322 TSecr=828590509
 13   0.063540 54.230.29.244 -> 172.31.36.109 TCP 66 http > 44434 [FIN, ACK] Seq=1478 Ack=98 Win=14592 Len=0 TSval=828590510 TSecr=22282322
 14   0.063548 172.31.36.109 -> 54.230.29.244 TCP 66 44434 > http [ACK] Seq=98 Ack=1479 Win=29952 Len=0 TSval=22282322 TSecr=828590510
