[Measurement for 1kb at 23:02:05 16.02.2014] 
Tshark:

  1   0.000000  192.168.1.2 -> 54.230.98.242 TCP 66 49480→80 [SYN] Seq=0 Win=8192 Len=0 MSS=1460 WS=256 SACK_PERM=1
  2   0.043768 54.230.98.242 -> 192.168.1.2  TCP 66 80→49480 [SYN, ACK] Seq=0 Ack=1 Win=14600 Len=0 MSS=1400 SACK_PERM=1 WS=128
  3   0.043880  192.168.1.2 -> 54.230.98.242 TCP 54 49480→80 [ACK] Seq=1 Ack=1 Win=65792 Len=0
  4   0.044175  192.168.1.2 -> 54.230.98.242 HTTP 150 GET /1kb HTTP/1.1 
  5   0.073580 54.230.98.242 -> 192.168.1.2  TCP 54 80→49480 [ACK] Seq=1 Ack=97 Win=14720 Len=0
  6   0.078523 54.230.98.242 -> 192.168.1.2  TCP 1454 [TCP segment of a reassembled PDU]
  7   0.082086 54.230.98.242 -> 192.168.1.2  HTTP 132 HTTP/1.1 200 OK  (application/octet-stream)
  8   0.082207  192.168.1.2 -> 54.230.98.242 TCP 54 49480→80 [ACK] Seq=97 Ack=1479 Win=65792 Len=0
  9   0.082473  192.168.1.2 -> 54.230.98.242 TCP 54 49480→80 [FIN, ACK] Seq=97 Ack=1479 Win=65792 Len=0
 10   0.111547 54.230.98.242 -> 192.168.1.2  TCP 54 80→49480 [FIN, ACK] Seq=1479 Ack=98 Win=14720 Len=0
 11   0.111690  192.168.1.2 -> 54.230.98.242 TCP 54 49480→80 [ACK] Seq=98 Ack=1480 Win=65792 Len=0
