[Measurement for 1kb at 05:02:04 17.02.2014] 
Tshark:

  1   0.000000  192.168.1.2 -> 64.233.164.125 TCP 55 [TCP segment of a reassembled PDU]
  2   0.065820 64.233.164.125 -> 192.168.1.2  TCP 66 5222→49965 [ACK] Seq=1 Ack=2 Win=557 Len=0 SLE=1 SRE=2
  3   0.394903  192.168.1.1 -> 239.255.255.250 SSDP 451 NOTIFY * HTTP/1.1 
  4   0.399702  192.168.1.1 -> 239.255.255.250 SSDP 523 NOTIFY * HTTP/1.1 
  5   0.404519  192.168.1.1 -> 239.255.255.250 SSDP 519 NOTIFY * HTTP/1.1 
  6   0.409340  192.168.1.1 -> 239.255.255.250 SSDP 499 NOTIFY * HTTP/1.1 
  7   0.415902  192.168.1.1 -> 239.255.255.250 SSDP 531 NOTIFY * HTTP/1.1 
  8   0.420691  192.168.1.1 -> 239.255.255.250 SSDP 513 NOTIFY * HTTP/1.1 
  9   0.425415  192.168.1.1 -> 239.255.255.250 SSDP 515 NOTIFY * HTTP/1.1 
 10   0.431895  192.168.1.1 -> 239.255.255.250 SSDP 460 NOTIFY * HTTP/1.1 
 11   0.436282  192.168.1.1 -> 239.255.255.250 SSDP 460 NOTIFY * HTTP/1.1 
 12   0.440608  192.168.1.1 -> 239.255.255.250 SSDP 460 NOTIFY * HTTP/1.1 
 13   0.445199  192.168.1.1 -> 239.255.255.250 SSDP 460 NOTIFY * HTTP/1.1 
 14   0.883221  192.168.1.2 -> 54.230.98.195 TCP 66 50084→80 [SYN] Seq=0 Win=8192 Len=0 MSS=1460 WS=256 SACK_PERM=1
 15   0.943702 54.230.98.195 -> 192.168.1.2  TCP 66 80→50084 [SYN, ACK] Seq=0 Ack=1 Win=14600 Len=0 MSS=1400 SACK_PERM=1 WS=128
 16   0.943835  192.168.1.2 -> 54.230.98.195 TCP 54 50084→80 [ACK] Seq=1 Ack=1 Win=65792 Len=0
 17   0.953288  192.168.1.2 -> 54.230.98.195 HTTP 150 GET /1kb HTTP/1.1 
 18   0.980817 54.230.98.195 -> 192.168.1.2  TCP 54 80→50084 [ACK] Seq=1 Ack=97 Win=14720 Len=0
 19   0.987606 54.230.98.195 -> 192.168.1.2  TCP 1454 [TCP segment of a reassembled PDU]
 20   0.991092 54.230.98.195 -> 192.168.1.2  HTTP 132 HTTP/1.1 200 OK  (application/octet-stream)
 21   0.991160  192.168.1.2 -> 54.230.98.195 TCP 54 50084→80 [ACK] Seq=97 Ack=1479 Win=65792 Len=0
 22   0.991295  192.168.1.2 -> 54.230.98.195 TCP 54 50084→80 [FIN, ACK] Seq=97 Ack=1479 Win=65792 Len=0
 23   1.018157 54.230.98.195 -> 192.168.1.2  TCP 54 80→50084 [FIN, ACK] Seq=1479 Ack=98 Win=14720 Len=0
 24   1.018291  192.168.1.2 -> 54.230.98.195 TCP 54 50084→80 [ACK] Seq=98 Ack=1480 Win=65792 Len=0
