[Measurement for 1kb at 09:03:10 17.03.2014] 
Tshark:

  1   0.000000  192.168.1.2 -> 72.21.195.190 TCP 1414 [TCP segment of a reassembled PDU]
  2   0.000022  192.168.1.2 -> 72.21.195.190 TCP 1414 [TCP segment of a reassembled PDU]
  3   0.000035  192.168.1.2 -> 72.21.195.190 TLSv1 1021 Application Data
  4   0.170918 72.21.195.190 -> 192.168.1.2  TCP 54 443→50825 [ACK] Seq=1 Ack=2721 Win=32725 Len=0
  5   0.172659 72.21.195.190 -> 192.168.1.2  TCP 54 443→50825 [ACK] Seq=1 Ack=3688 Win=32710 Len=0
  6   0.218412 72.21.195.190 -> 192.168.1.2  TLSv1 331 Application Data
  7   0.218963 72.21.195.190 -> 192.168.1.2  TLSv1 118 Application Data
  8   0.219015  192.168.1.2 -> 72.21.195.190 TCP 54 50825→443 [ACK] Seq=3688 Ack=342 Win=257 Len=0
  9   0.301846  192.168.1.2 -> 54.230.97.191 TCP 66 51442→80 [SYN] Seq=0 Win=8192 Len=0 MSS=1460 WS=256 SACK_PERM=1
 10   0.371134 54.230.97.191 -> 192.168.1.2  TCP 66 80→51442 [SYN, ACK] Seq=0 Ack=1 Win=14600 Len=0 MSS=1400 SACK_PERM=1 WS=128
 11   0.371309  192.168.1.2 -> 54.230.97.191 TCP 54 51442→80 [ACK] Seq=1 Ack=1 Win=65792 Len=0
 12   0.371462  192.168.1.2 -> 54.230.97.191 HTTP 150 GET /1kb HTTP/1.1 
 13   0.405863 54.230.97.191 -> 192.168.1.2  TCP 54 80→51442 [ACK] Seq=1 Ack=97 Win=14720 Len=0
 14   0.409277 54.230.97.191 -> 192.168.1.2  TCP 1454 [TCP segment of a reassembled PDU]
 15   0.410413 54.230.97.191 -> 192.168.1.2  HTTP 132 HTTP/1.1 200 OK  (application/octet-stream)
 16   0.410531  192.168.1.2 -> 54.230.97.191 TCP 54 51442→80 [ACK] Seq=97 Ack=1479 Win=65792 Len=0
 17   0.410642  192.168.1.2 -> 54.230.97.191 TCP 54 51442→80 [FIN, ACK] Seq=97 Ack=1479 Win=65792 Len=0
 18   0.459190 54.230.97.191 -> 192.168.1.2  TCP 54 80→51442 [FIN, ACK] Seq=1479 Ack=98 Win=14720 Len=0
 19   0.459307  192.168.1.2 -> 54.230.97.191 TCP 54 51442→80 [ACK] Seq=98 Ack=1480 Win=65792 Len=0
 20   1.750558  192.168.1.2 -> 74.125.232.199 TCP 1454 [TCP segment of a reassembled PDU]
 21   1.750581  192.168.1.2 -> 74.125.232.199 TLSv1.2 942 Application Data
 22   1.750890  192.168.1.2 -> 74.125.232.199 TLSv1.2 87 Application Data
 23   1.798824 74.125.232.199 -> 192.168.1.2  TCP 54 443→51243 [ACK] Seq=1 Ack=1401 Win=1373 Len=0
