[Measurement for 1kb at 23:03:19 16.03.2014] 
Tshark:

  1   0.000000  192.168.1.1 -> 239.255.255.250 SSDP 451 NOTIFY * HTTP/1.1 
  2   0.004708  192.168.1.1 -> 239.255.255.250 SSDP 523 NOTIFY * HTTP/1.1 
  3   0.011954  192.168.1.1 -> 239.255.255.250 SSDP 519 NOTIFY * HTTP/1.1 
  4   0.016609  192.168.1.1 -> 239.255.255.250 SSDP 499 NOTIFY * HTTP/1.1 
  5   0.021901  192.168.1.1 -> 239.255.255.250 SSDP 531 NOTIFY * HTTP/1.1 
  6   0.026620  192.168.1.1 -> 239.255.255.250 SSDP 513 NOTIFY * HTTP/1.1 
  7   0.037736  192.168.1.1 -> 239.255.255.250 SSDP 460 NOTIFY * HTTP/1.1 
  8   0.042033  192.168.1.1 -> 239.255.255.250 SSDP 460 NOTIFY * HTTP/1.1 
  9   0.047090  192.168.1.1 -> 239.255.255.250 SSDP 460 NOTIFY * HTTP/1.1 
 10   0.052297  192.168.1.1 -> 239.255.255.250 SSDP 460 NOTIFY * HTTP/1.1 
 11   1.168221  192.168.1.2 -> 54.230.98.127 TCP 66 49490→80 [SYN] Seq=0 Win=8192 Len=0 MSS=1460 WS=256 SACK_PERM=1
 12   1.225732 54.230.98.127 -> 192.168.1.2  TCP 66 80→49490 [SYN, ACK] Seq=0 Ack=1 Win=14600 Len=0 MSS=1400 SACK_PERM=1 WS=128
 13   1.225871  192.168.1.2 -> 54.230.98.127 TCP 54 49490→80 [ACK] Seq=1 Ack=1 Win=65792 Len=0
 14   1.236135  192.168.1.2 -> 54.230.98.127 HTTP 150 GET /1kb HTTP/1.1 
 15   1.265435 54.230.98.127 -> 192.168.1.2  TCP 54 80→49490 [ACK] Seq=1 Ack=97 Win=14720 Len=0
 16   1.272585 54.230.98.127 -> 192.168.1.2  TCP 1454 [TCP segment of a reassembled PDU]
 17   1.273873 54.230.98.127 -> 192.168.1.2  HTTP 132 HTTP/1.1 200 OK  (application/octet-stream)
 18   1.273952  192.168.1.2 -> 54.230.98.127 TCP 54 49490→80 [ACK] Seq=97 Ack=1479 Win=65792 Len=0
 19   1.274045  192.168.1.2 -> 54.230.98.127 TCP 54 49490→80 [FIN, ACK] Seq=97 Ack=1479 Win=65792 Len=0
 20   1.304685 54.230.98.127 -> 192.168.1.2  TCP 54 80→49490 [FIN, ACK] Seq=1479 Ack=98 Win=14720 Len=0
 21   1.304830  192.168.1.2 -> 54.230.98.127 TCP 54 49490→80 [ACK] Seq=98 Ack=1480 Win=65792 Len=0
 22   2.652069 fe80::5ef9:6aff:fe25:83d4 -> fe80::446a:b521:8794:ef65 ICMPv6 86 Neighbor Solicitation for fe80::446a:b521:8794:ef65 from 5c:f9:6a:25:83:d4
