[Measurement for 10kb at 08:00:52 17.00.2014] 
Tshark:

  1   0.000000  192.168.1.2 -> 54.230.96.45 TCP 66 50602→80 [SYN] Seq=0 Win=8192 Len=0 MSS=1460 WS=256 SACK_PERM=1
  2   0.028473 54.230.96.45 -> 192.168.1.2  TCP 66 80→50602 [SYN, ACK] Seq=0 Ack=1 Win=14600 Len=0 MSS=1400 SACK_PERM=1 WS=128
  3   0.028609  192.168.1.2 -> 54.230.96.45 TCP 54 50602→80 [ACK] Seq=1 Ack=1 Win=65792 Len=0
  4   0.038595  192.168.1.2 -> 54.230.96.45 HTTP 151 GET /10kb HTTP/1.1 
  5   0.073304 54.230.96.45 -> 192.168.1.2  TCP 54 80→50602 [ACK] Seq=1 Ack=98 Win=14720 Len=0
  6   0.075413 54.230.96.45 -> 192.168.1.2  TCP 1454 [TCP segment of a reassembled PDU]
  7   0.087841 54.230.96.45 -> 192.168.1.2  TCP 1454 [TCP segment of a reassembled PDU]
  8   0.087951  192.168.1.2 -> 54.230.96.45 TCP 54 50602→80 [ACK] Seq=98 Ack=2801 Win=65792 Len=0
  9   0.091843 54.230.96.45 -> 192.168.1.2  TCP 1454 [TCP segment of a reassembled PDU]
 10   0.091931 54.230.96.45 -> 192.168.1.2  TCP 1454 [TCP segment of a reassembled PDU]
 11   0.092030  192.168.1.2 -> 54.230.96.45 TCP 54 50602→80 [ACK] Seq=98 Ack=5601 Win=65792 Len=0
 12   0.092126 54.230.96.45 -> 192.168.1.2  TCP 1454 [TCP segment of a reassembled PDU]
 13   0.092196 54.230.96.45 -> 192.168.1.2  TCP 1454 [TCP segment of a reassembled PDU]
 14   0.092236  192.168.1.2 -> 54.230.96.45 TCP 54 50602→80 [ACK] Seq=98 Ack=8401 Win=65792 Len=0
 15   0.092325 54.230.96.45 -> 192.168.1.2  TCP 1454 [TCP segment of a reassembled PDU]
 16   0.092360 54.230.96.45 -> 192.168.1.2  HTTP 949 HTTP/1.1 200 OK  (application/octet-stream)
 17   0.092412  192.168.1.2 -> 54.230.96.45 TCP 54 50602→80 [ACK] Seq=98 Ack=10696 Win=65792 Len=0
 18   0.092534  192.168.1.2 -> 54.230.96.45 TCP 54 50602→80 [FIN, ACK] Seq=98 Ack=10696 Win=65792 Len=0
 19   0.122047 54.230.96.45 -> 192.168.1.2  TCP 54 80→50602 [FIN, ACK] Seq=10696 Ack=99 Win=14720 Len=0
 20   0.122189  192.168.1.2 -> 54.230.96.45 TCP 54 50602→80 [ACK] Seq=99 Ack=10697 Win=65792 Len=0
