[Measurement for 100kb at 23:42:15 19.42.2014] 
Tshark:

  1   0.000000 172.31.8.238 -> 172.31.0.2   DNS 89 Standard query 0x0b39  A d1xzxs93r3iphc.cloudfront.net
  2   0.000042 172.31.8.238 -> 172.31.0.2   DNS 89 Standard query 0xfd7e  AAAA d1xzxs93r3iphc.cloudfront.net
  3   0.000629   172.31.0.2 -> 172.31.8.238 DNS 217 Standard query response 0x0b39  A 54.230.116.164 A 54.230.118.235 A 54.230.119.11 A 54.230.119.58 A 54.230.119.94 A 54.230.119.165 A 54.230.119.189 A 54.192.118.246
  4   0.000641   172.31.0.2 -> 172.31.8.238 DNS 170 Standard query response 0xfd7e 
  5   0.003849 172.31.8.238 -> 54.230.116.164 TCP 74 41838 > http [SYN] Seq=0 Win=26883 Len=0 MSS=8961 SACK_PERM=1 TSval=6040843 TSecr=0 WS=128
  6   0.004559 54.230.116.164 -> 172.31.8.238 TCP 74 http > 41838 [SYN, ACK] Seq=0 Ack=1 Win=14480 Len=0 MSS=1460 SACK_PERM=1 TSval=1681757006 TSecr=6040843 WS=128
  7   0.004574 172.31.8.238 -> 54.230.116.164 TCP 66 41838 > http [ACK] Seq=1 Ack=1 Win=27008 Len=0 TSval=6040843 TSecr=1681757006
  8   0.004616 172.31.8.238 -> 54.230.116.164 HTTP 164 GET /100kb HTTP/1.1 
  9   0.005299 54.230.116.164 -> 172.31.8.238 TCP 66 http > 41838 [ACK] Seq=1 Ack=99 Win=14592 Len=0 TSval=1681757006 TSecr=6040843
 10   0.007086 54.230.116.164 -> 172.31.8.238 TCP 522 [TCP segment of a reassembled PDU]
 11   0.007094 172.31.8.238 -> 54.230.116.164 TCP 66 41838 > http [ACK] Seq=99 Ack=457 Win=28032 Len=0 TSval=6040844 TSecr=1681757006
 12   0.007200 54.230.116.164 -> 172.31.8.238 TCP 13098 [TCP segment of a reassembled PDU]
 13   0.007212 172.31.8.238 -> 54.230.116.164 TCP 66 41838 > http [ACK] Seq=99 Ack=13489 Win=54144 Len=0 TSval=6040844 TSecr=1681757006
 14   0.007843 54.230.116.164 -> 172.31.8.238 TCP 2962 [TCP segment of a reassembled PDU]
 15   0.007849 172.31.8.238 -> 54.230.116.164 TCP 66 41838 > http [ACK] Seq=99 Ack=16385 Win=59904 Len=0 TSval=6040844 TSecr=1681757006
 16   0.007958 54.230.116.164 -> 172.31.8.238 TCP 10202 [TCP segment of a reassembled PDU]
 17   0.007966 172.31.8.238 -> 54.230.116.164 TCP 66 41838 > http [ACK] Seq=99 Ack=26521 Win=80128 Len=0 TSval=6040844 TSecr=1681757006
 18   0.008370 54.230.116.164 -> 172.31.8.238 TCP 4410 [TCP segment of a reassembled PDU]
 19   0.008377 172.31.8.238 -> 54.230.116.164 TCP 66 41838 > http [ACK] Seq=99 Ack=30865 Win=88832 Len=0 TSval=6040844 TSecr=1681757007
 20   0.008484 54.230.116.164 -> 172.31.8.238 TCP 4410 [TCP segment of a reassembled PDU]
 21   0.008490 172.31.8.238 -> 54.230.116.164 TCP 66 41838 > http [ACK] Seq=99 Ack=35209 Win=97536 Len=0 TSval=6040844 TSecr=1681757007
 22   0.008669 54.230.116.164 -> 172.31.8.238 TCP 5858 [TCP segment of a reassembled PDU]
 23   0.008675 172.31.8.238 -> 54.230.116.164 TCP 66 41838 > http [ACK] Seq=99 Ack=41001 Win=108416 Len=0 TSval=6040844 TSecr=1681757007
 24   0.008783 54.230.116.164 -> 172.31.8.238 TCP 5858 [TCP segment of a reassembled PDU]
 25   0.008790 172.31.8.238 -> 54.230.116.164 TCP 66 41838 > http [ACK] Seq=99 Ack=46793 Win=108416 Len=0 TSval=6040844 TSecr=1681757007
 26   0.008975 54.230.116.164 -> 172.31.8.238 TCP 5858 [TCP segment of a reassembled PDU]
 27   0.008981 172.31.8.238 -> 54.230.116.164 TCP 66 41838 > http [ACK] Seq=99 Ack=52585 Win=108416 Len=0 TSval=6040844 TSecr=1681757007
 28   0.009374 54.230.116.164 -> 172.31.8.238 TCP 2962 [TCP segment of a reassembled PDU]
 29   0.009379 172.31.8.238 -> 54.230.116.164 TCP 66 41838 > http [ACK] Seq=99 Ack=55481 Win=109056 Len=0 TSval=6040845 TSecr=1681757007
 30   0.009474 54.230.116.164 -> 172.31.8.238 TCP 10202 [TCP segment of a reassembled PDU]
 31   0.009482 172.31.8.238 -> 54.230.116.164 TCP 66 41838 > http [ACK] Seq=99 Ack=65617 Win=129280 Len=0 TSval=6040845 TSecr=1681757007
 32   0.009700 54.230.116.164 -> 172.31.8.238 TCP 13098 [TCP segment of a reassembled PDU]
 33   0.009708 172.31.8.238 -> 54.230.116.164 TCP 66 41838 > http [ACK] Seq=99 Ack=78649 Win=155392 Len=0 TSval=6040845 TSecr=1681757007
 34   0.010151 54.230.116.164 -> 172.31.8.238 TCP 2962 [TCP segment of a reassembled PDU]
 35   0.010157 172.31.8.238 -> 54.230.116.164 TCP 66 41838 > http [ACK] Seq=99 Ack=81545 Win=161152 Len=0 TSval=6040845 TSecr=1681757007
 36   0.010259 54.230.116.164 -> 172.31.8.238 TCP 10202 [TCP segment of a reassembled PDU]
 37   0.010267 172.31.8.238 -> 54.230.116.164 TCP 66 41838 > http [ACK] Seq=99 Ack=91681 Win=181504 Len=0 TSval=6040845 TSecr=1681757007
 38   0.010382 54.230.116.164 -> 172.31.8.238 HTTP 11242 HTTP/1.1 200 OK  (application/octet-stream)
 39   0.010390 172.31.8.238 -> 54.230.116.164 TCP 66 41838 > http [ACK] Seq=99 Ack=102857 Win=203776 Len=0 TSval=6040845 TSecr=1681757007
 40   0.010557 172.31.8.238 -> 54.230.116.164 TCP 66 41838 > http [FIN, ACK] Seq=99 Ack=102857 Win=203776 Len=0 TSval=6040845 TSecr=1681757007
 41   0.011208 54.230.116.164 -> 172.31.8.238 TCP 66 http > 41838 [FIN, ACK] Seq=102857 Ack=100 Win=14592 Len=0 TSval=1681757007 TSecr=6040845
 42   0.011216 172.31.8.238 -> 54.230.116.164 TCP 66 41838 > http [ACK] Seq=100 Ack=102858 Win=203776 Len=0 TSval=6040845 TSecr=1681757007
