[Measurement for 100kb at 20:42:15 19.42.2014] 
Tshark:

  1   0.000000 172.31.8.238 -> 172.31.0.2   DNS 89 Standard query 0x1662  A d1xzxs93r3iphc.cloudfront.net
  2   0.000025 172.31.8.238 -> 172.31.0.2   DNS 89 Standard query 0x21d4  AAAA d1xzxs93r3iphc.cloudfront.net
  3   0.000593   172.31.0.2 -> 172.31.8.238 DNS 217 Standard query response 0x1662  A 54.239.132.173 A 54.239.132.196 A 54.239.132.250 A 54.230.116.53 A 54.230.116.164 A 54.230.119.55 A 54.230.119.86 A 54.230.119.165
  4   0.000652   172.31.0.2 -> 172.31.8.238 DNS 170 Standard query response 0x21d4 
  5   0.003907 172.31.8.238 -> 54.239.132.173 TCP 74 45459 > http [SYN] Seq=0 Win=26883 Len=0 MSS=8961 SACK_PERM=1 TSval=3340822 TSecr=0 WS=128
  6   0.004556 54.239.132.173 -> 172.31.8.238 TCP 74 http > 45459 [SYN, ACK] Seq=0 Ack=1 Win=14480 Len=0 MSS=1460 SACK_PERM=1 TSval=1682415383 TSecr=3340822 WS=128
  7   0.004570 172.31.8.238 -> 54.239.132.173 TCP 66 45459 > http [ACK] Seq=1 Ack=1 Win=27008 Len=0 TSval=3340822 TSecr=1682415383
  8   0.004609 172.31.8.238 -> 54.239.132.173 HTTP 164 GET /100kb HTTP/1.1 
  9   0.005042 54.239.132.173 -> 172.31.8.238 TCP 66 http > 45459 [ACK] Seq=1 Ack=99 Win=14592 Len=0 TSval=1682415383 TSecr=3340822
 10   0.006371 54.239.132.173 -> 172.31.8.238 TCP 4410 [TCP segment of a reassembled PDU]
 11   0.006379 172.31.8.238 -> 54.239.132.173 TCP 66 45459 > http [ACK] Seq=99 Ack=4345 Win=35584 Len=0 TSval=3340822 TSecr=1682415383
 12   0.006478 54.239.132.173 -> 172.31.8.238 TCP 8754 [TCP segment of a reassembled PDU]
 13   0.006487 172.31.8.238 -> 54.239.132.173 TCP 66 45459 > http [ACK] Seq=99 Ack=13033 Win=52992 Len=0 TSval=3340822 TSecr=1682415383
 14   0.006928 54.239.132.173 -> 172.31.8.238 TCP 7306 [TCP segment of a reassembled PDU]
 15   0.006936 172.31.8.238 -> 54.239.132.173 TCP 66 45459 > http [ACK] Seq=99 Ack=20273 Win=67456 Len=0 TSval=3340823 TSecr=1682415383
 16   0.007134 54.239.132.173 -> 172.31.8.238 TCP 4410 [TCP segment of a reassembled PDU]
 17   0.007140 172.31.8.238 -> 54.239.132.173 TCP 66 45459 > http [ACK] Seq=99 Ack=24617 Win=76160 Len=0 TSval=3340823 TSecr=1682415383
 18   0.007222 54.239.132.173 -> 172.31.8.238 TCP 1514 [TCP segment of a reassembled PDU]
 19   0.007227 172.31.8.238 -> 54.239.132.173 TCP 66 45459 > http [ACK] Seq=99 Ack=26065 Win=79104 Len=0 TSval=3340823 TSecr=1682415383
 20   0.007386 54.239.132.173 -> 172.31.8.238 TCP 10202 [TCP segment of a reassembled PDU]
 21   0.007394 172.31.8.238 -> 54.239.132.173 TCP 66 45459 > http [ACK] Seq=99 Ack=36201 Win=99328 Len=0 TSval=3340823 TSecr=1682415383
 22   0.007471 54.239.132.173 -> 172.31.8.238 TCP 2962 [TCP segment of a reassembled PDU]
 23   0.007476 172.31.8.238 -> 54.239.132.173 TCP 66 45459 > http [ACK] Seq=99 Ack=39097 Win=105088 Len=0 TSval=3340823 TSecr=1682415383
 24   0.007864 54.239.132.173 -> 172.31.8.238 TCP 8754 [TCP segment of a reassembled PDU]
 25   0.007871 172.31.8.238 -> 54.239.132.173 TCP 66 45459 > http [ACK] Seq=99 Ack=47785 Win=103680 Len=0 TSval=3340823 TSecr=1682415384
 26   0.007952 54.239.132.173 -> 172.31.8.238 TCP 4410 [TCP segment of a reassembled PDU]
 27   0.007957 172.31.8.238 -> 54.239.132.173 TCP 66 45459 > http [ACK] Seq=99 Ack=52129 Win=109056 Len=0 TSval=3340823 TSecr=1682415384
 28   0.008125 54.239.132.173 -> 172.31.8.238 TCP 4410 [TCP segment of a reassembled PDU]
 29   0.008131 172.31.8.238 -> 54.239.132.173 TCP 66 45459 > http [ACK] Seq=99 Ack=56473 Win=109056 Len=0 TSval=3340823 TSecr=1682415384
 30   0.008223 54.239.132.173 -> 172.31.8.238 TCP 7306 [TCP segment of a reassembled PDU]
 31   0.008230 172.31.8.238 -> 54.239.132.173 TCP 66 45459 > http [ACK] Seq=99 Ack=63713 Win=105984 Len=0 TSval=3340823 TSecr=1682415384
 32   0.008382 54.239.132.173 -> 172.31.8.238 TCP 13098 [TCP segment of a reassembled PDU]
 33   0.008391 172.31.8.238 -> 54.239.132.173 TCP 66 45459 > http [ACK] Seq=99 Ack=76745 Win=96512 Len=0 TSval=3340823 TSecr=1682415384
 34   0.008467 54.239.132.173 -> 172.31.8.238 TCP 1514 [TCP segment of a reassembled PDU]
 35   0.008472 172.31.8.238 -> 54.239.132.173 TCP 66 45459 > http [ACK] Seq=99 Ack=78193 Win=109056 Len=0 TSval=3340823 TSecr=1682415384
 36   0.008954 54.239.132.173 -> 172.31.8.238 TCP 15994 [TCP segment of a reassembled PDU]
 37   0.008966 172.31.8.238 -> 54.239.132.173 TCP 66 45459 > http [ACK] Seq=99 Ack=94121 Win=93184 Len=0 TSval=3340823 TSecr=1682415384
 38   0.009078 54.239.132.173 -> 172.31.8.238 HTTP 8801 HTTP/1.1 200 OK  (application/octet-stream)
 39   0.009085 172.31.8.238 -> 54.239.132.173 TCP 66 45459 > http [ACK] Seq=99 Ack=102856 Win=101248 Len=0 TSval=3340823 TSecr=1682415384
 40   0.009204 172.31.8.238 -> 54.239.132.173 TCP 66 45459 > http [FIN, ACK] Seq=99 Ack=102856 Win=109056 Len=0 TSval=3340823 TSecr=1682415384
 41   0.010367 54.239.132.173 -> 172.31.8.238 TCP 66 http > 45459 [FIN, ACK] Seq=102856 Ack=100 Win=14592 Len=0 TSval=1682415384 TSecr=3340823
 42   0.010375 172.31.8.238 -> 54.239.132.173 TCP 66 45459 > http [ACK] Seq=100 Ack=102857 Win=109056 Len=0 TSval=3340823 TSecr=1682415384
