[Measurement for 100kb at 12:42:16 20.42.2014] 
Tshark:

  1   0.000000 172.31.8.238 -> 172.31.0.2   DNS 89 Standard query 0x5e77  A d1xzxs93r3iphc.cloudfront.net
  2   0.000029 172.31.8.238 -> 172.31.0.2   DNS 89 Standard query 0x36d2  AAAA d1xzxs93r3iphc.cloudfront.net
  3   0.000585   172.31.0.2 -> 172.31.8.238 DNS 170 Standard query response 0x36d2 
  4   0.000595   172.31.0.2 -> 172.31.8.238 DNS 217 Standard query response 0x5e77  A 54.230.119.18 A 54.239.132.41 A 54.239.132.86 A 54.239.132.147 A 54.239.132.173 A 54.230.117.21 A 54.230.117.50 A 54.230.117.87
  5   0.003843 172.31.8.238 -> 54.230.119.18 TCP 74 43606 > http [SYN] Seq=0 Win=26883 Len=0 MSS=8961 SACK_PERM=1 TSval=17740997 TSecr=0 WS=128
  6   0.004485 54.230.119.18 -> 172.31.8.238 TCP 74 http > 43606 [SYN, ACK] Seq=0 Ack=1 Win=14480 Len=0 MSS=1460 SACK_PERM=1 TSval=1687622631 TSecr=17740997 WS=128
  7   0.004499 172.31.8.238 -> 54.230.119.18 TCP 66 43606 > http [ACK] Seq=1 Ack=1 Win=27008 Len=0 TSval=17740997 TSecr=1687622631
  8   0.004536 172.31.8.238 -> 54.230.119.18 HTTP 164 GET /100kb HTTP/1.1 
  9   0.005236 54.230.119.18 -> 172.31.8.238 TCP 66 http > 43606 [ACK] Seq=1 Ack=99 Win=14592 Len=0 TSval=1687622631 TSecr=17740997
 10   0.006790 54.230.119.18 -> 172.31.8.238 TCP 2592 [TCP segment of a reassembled PDU]
 11   0.006798 172.31.8.238 -> 54.230.119.18 TCP 66 43606 > http [ACK] Seq=99 Ack=2527 Win=32000 Len=0 TSval=17740998 TSecr=1687622632
 12   0.006874 54.230.119.18 -> 172.31.8.238 TCP 11650 [TCP segment of a reassembled PDU]
 13   0.006883 172.31.8.238 -> 54.230.119.18 TCP 66 43606 > http [ACK] Seq=99 Ack=14111 Win=55168 Len=0 TSval=17740998 TSecr=1687622632
 14   0.007542 54.230.119.18 -> 172.31.8.238 TCP 4410 [TCP segment of a reassembled PDU]
 15   0.007548 172.31.8.238 -> 54.230.119.18 TCP 66 43606 > http [ACK] Seq=99 Ack=18455 Win=63872 Len=0 TSval=17740998 TSecr=1687622632
 16   0.007633 54.230.119.18 -> 172.31.8.238 TCP 8754 [TCP segment of a reassembled PDU]
 17   0.007639 172.31.8.238 -> 54.230.119.18 TCP 66 43606 > http [ACK] Seq=99 Ack=27143 Win=81280 Len=0 TSval=17740998 TSecr=1687622632
 18   0.008172 54.230.119.18 -> 172.31.8.238 TCP 7306 [TCP segment of a reassembled PDU]
 19   0.008180 172.31.8.238 -> 54.230.119.18 TCP 66 43606 > http [ACK] Seq=99 Ack=34383 Win=95744 Len=0 TSval=17740998 TSecr=1687622632
 20   0.008314 54.230.119.18 -> 172.31.8.238 TCP 13098 [TCP segment of a reassembled PDU]
 21   0.008323 172.31.8.238 -> 54.230.119.18 TCP 66 43606 > http [ACK] Seq=99 Ack=47415 Win=96512 Len=0 TSval=17740998 TSecr=1687622632
 22   0.008688 54.230.119.18 -> 172.31.8.238 TCP 2962 [TCP segment of a reassembled PDU]
 23   0.008694 172.31.8.238 -> 54.230.119.18 TCP 66 43606 > http [ACK] Seq=99 Ack=50311 Win=109056 Len=0 TSval=17740998 TSecr=1687622632
 24   0.008791 54.230.119.18 -> 172.31.8.238 TCP 2962 [TCP segment of a reassembled PDU]
 25   0.008796 172.31.8.238 -> 54.230.119.18 TCP 66 43606 > http [ACK] Seq=99 Ack=53207 Win=109056 Len=0 TSval=17740998 TSecr=1687622632
 26   0.008959 54.230.119.18 -> 172.31.8.238 TCP 5858 [TCP segment of a reassembled PDU]
 27   0.008965 172.31.8.238 -> 54.230.119.18 TCP 66 43606 > http [ACK] Seq=99 Ack=58999 Win=108416 Len=0 TSval=17740998 TSecr=1687622632
 28   0.009085 54.230.119.18 -> 172.31.8.238 TCP 7306 [TCP segment of a reassembled PDU]
 29   0.009093 172.31.8.238 -> 54.230.119.18 TCP 66 43606 > http [ACK] Seq=99 Ack=66239 Win=105984 Len=0 TSval=17740998 TSecr=1687622632
 30   0.009229 54.230.119.18 -> 172.31.8.238 TCP 11650 [TCP segment of a reassembled PDU]
 31   0.009237 172.31.8.238 -> 54.230.119.18 TCP 66 43606 > http [ACK] Seq=99 Ack=77823 Win=98944 Len=0 TSval=17740998 TSecr=1687622632
 32   0.009272 54.230.119.18 -> 172.31.8.238 TCP 1514 [TCP segment of a reassembled PDU]
 33   0.009279 172.31.8.238 -> 54.230.119.18 TCP 66 43606 > http [ACK] Seq=99 Ack=79271 Win=109056 Len=0 TSval=17740998 TSecr=1687622632
 34   0.009703 54.230.119.18 -> 172.31.8.238 TCP 4410 [TCP segment of a reassembled PDU]
 35   0.009709 172.31.8.238 -> 54.230.119.18 TCP 66 43606 > http [ACK] Seq=99 Ack=83615 Win=109056 Len=0 TSval=17740999 TSecr=1687622632
 36   0.009847 54.230.119.18 -> 172.31.8.238 HTTP 19308 HTTP/1.1 200 OK  (application/octet-stream)
 37   0.009860 172.31.8.238 -> 54.230.119.18 TCP 66 43606 > http [ACK] Seq=99 Ack=102857 Win=147584 Len=0 TSval=17740999 TSecr=1687622632
 38   0.010015 172.31.8.238 -> 54.230.119.18 TCP 66 43606 > http [FIN, ACK] Seq=99 Ack=102857 Win=147584 Len=0 TSval=17740999 TSecr=1687622632
 39   0.010704 54.230.119.18 -> 172.31.8.238 TCP 66 http > 43606 [FIN, ACK] Seq=102857 Ack=100 Win=14592 Len=0 TSval=1687622632 TSecr=17740999
 40   0.010712 172.31.8.238 -> 54.230.119.18 TCP 66 43606 > http [ACK] Seq=100 Ack=102858 Win=147584 Len=0 TSval=17740999 TSecr=1687622632
