[Measurement for 100kb at 09:42:16 20.42.2014] 
Tshark:

  1   0.000000 172.31.8.238 -> 172.31.0.2   DNS 89 Standard query 0x3408  A d1xzxs93r3iphc.cloudfront.net
  2   0.000030 172.31.8.238 -> 172.31.0.2   DNS 89 Standard query 0x0bfe  AAAA d1xzxs93r3iphc.cloudfront.net
  3   0.000771   172.31.0.2 -> 172.31.8.238 DNS 170 Standard query response 0x0bfe 
  4   0.000806   172.31.0.2 -> 172.31.8.238 DNS 217 Standard query response 0x3408  A 54.230.141.103 A 54.192.141.182 A 54.192.141.186 A 54.192.141.192 A 54.192.141.200 A 54.230.140.33 A 54.230.140.236 A 54.230.141.31
  5   0.003873 172.31.8.238 -> 54.230.141.103 TCP 74 37717 > http [SYN] Seq=0 Win=26883 Len=0 MSS=8961 SACK_PERM=1 TSval=15041063 TSecr=0 WS=128
  6   0.006971 54.230.141.103 -> 172.31.8.238 TCP 74 http > 37717 [SYN, ACK] Seq=0 Ack=1 Win=14480 Len=0 MSS=1460 SACK_PERM=1 TSval=716966407 TSecr=15041063 WS=128
  7   0.006987 172.31.8.238 -> 54.230.141.103 TCP 66 37717 > http [ACK] Seq=1 Ack=1 Win=27008 Len=0 TSval=15041063 TSecr=716966407
  8   0.007030 172.31.8.238 -> 54.230.141.103 HTTP 164 GET /100kb HTTP/1.1 
  9   0.010239 54.230.141.103 -> 172.31.8.238 TCP 66 http > 37717 [ACK] Seq=1 Ack=99 Win=14592 Len=0 TSval=716966408 TSecr=15041063
 10   0.236152 54.230.141.103 -> 172.31.8.238 TCP 7306 [TCP segment of a reassembled PDU]
 11   0.236178 172.31.8.238 -> 54.230.141.103 TCP 66 37717 > http [ACK] Seq=99 Ack=7241 Win=41472 Len=0 TSval=15041121 TSecr=716966430
 12   0.236186 54.230.141.103 -> 172.31.8.238 TCP 197 [TCP segment of a reassembled PDU]
 13   0.236189 172.31.8.238 -> 54.230.141.103 TCP 66 37717 > http [ACK] Seq=99 Ack=7372 Win=44288 Len=0 TSval=15041121 TSecr=716966430
 14   0.415326 54.230.141.103 -> 172.31.8.238 TCP 1514 [TCP segment of a reassembled PDU]
