[Measurement for 100kb at 08:42:16 20.42.2014] 
Tshark:

  1   0.000000 172.31.8.238 -> 172.31.0.2   DNS 89 Standard query 0x2115  A d1xzxs93r3iphc.cloudfront.net
  2   0.000032 172.31.8.238 -> 172.31.0.2   DNS 89 Standard query 0x1b1b  AAAA d1xzxs93r3iphc.cloudfront.net
  3   0.000739   172.31.0.2 -> 172.31.8.238 DNS 217 Standard query response 0x2115  A 54.239.132.196 A 54.192.118.240 A 54.230.116.141 A 54.230.117.5 A 54.230.117.10 A 54.230.117.45 A 54.230.117.86 A 54.230.119.91
  4   0.000760   172.31.0.2 -> 172.31.8.238 DNS 170 Standard query response 0x1b1b 
  5   0.003786 172.31.8.238 -> 54.239.132.196 TCP 74 35173 > http [SYN] Seq=0 Win=26883 Len=0 MSS=8961 SACK_PERM=1 TSval=14141056 TSecr=0 WS=128
  6   0.004471 54.239.132.196 -> 172.31.8.238 TCP 74 http > 35173 [SYN, ACK] Seq=0 Ack=1 Win=14480 Len=0 MSS=1460 SACK_PERM=1 TSval=1688474329 TSecr=14141056 WS=128
  7   0.004485 172.31.8.238 -> 54.239.132.196 TCP 66 35173 > http [ACK] Seq=1 Ack=1 Win=27008 Len=0 TSval=14141057 TSecr=1688474329
  8   0.004531 172.31.8.238 -> 54.239.132.196 HTTP 164 GET /100kb HTTP/1.1 
  9   0.005156 54.239.132.196 -> 172.31.8.238 TCP 66 http > 35173 [ACK] Seq=1 Ack=99 Win=14592 Len=0 TSval=1688474329 TSecr=14141057
 10   0.006550 54.239.132.196 -> 172.31.8.238 TCP 522 [TCP segment of a reassembled PDU]
 11   0.006556 172.31.8.238 -> 54.239.132.196 TCP 66 35173 > http [ACK] Seq=99 Ack=457 Win=28032 Len=0 TSval=14141057 TSecr=1688474329
 12   0.006686 54.239.132.196 -> 172.31.8.238 TCP 13098 [TCP segment of a reassembled PDU]
 13   0.006696 172.31.8.238 -> 54.239.132.196 TCP 66 35173 > http [ACK] Seq=99 Ack=13489 Win=54144 Len=0 TSval=14141057 TSecr=1688474329
 14   0.007263 54.239.132.196 -> 172.31.8.238 TCP 7306 [TCP segment of a reassembled PDU]
 15   0.007271 172.31.8.238 -> 54.239.132.196 TCP 66 35173 > http [ACK] Seq=99 Ack=20729 Win=68608 Len=0 TSval=14141057 TSecr=1688474329
 16   0.007355 54.239.132.196 -> 172.31.8.238 TCP 5858 [TCP segment of a reassembled PDU]
 17   0.007361 172.31.8.238 -> 54.239.132.196 TCP 66 35173 > http [ACK] Seq=99 Ack=26521 Win=80128 Len=0 TSval=14141057 TSecr=1688474329
 18   0.008033 54.239.132.196 -> 172.31.8.238 TCP 7306 [TCP segment of a reassembled PDU]
 19   0.008040 172.31.8.238 -> 54.239.132.196 TCP 66 35173 > http [ACK] Seq=99 Ack=33761 Win=94592 Len=0 TSval=14141058 TSecr=1688474329
 20   0.008170 54.239.132.196 -> 172.31.8.238 TCP 13098 [TCP segment of a reassembled PDU]
 21   0.008178 172.31.8.238 -> 54.239.132.196 TCP 66 35173 > http [ACK] Seq=99 Ack=46793 Win=120704 Len=0 TSval=14141058 TSecr=1688474329
 22   0.008812 54.239.132.196 -> 172.31.8.238 TCP 5858 [TCP segment of a reassembled PDU]
 23   0.008818 172.31.8.238 -> 54.239.132.196 TCP 66 35173 > http [ACK] Seq=99 Ack=52585 Win=132224 Len=0 TSval=14141058 TSecr=1688474329
 24   0.008919 54.239.132.196 -> 172.31.8.238 TCP 13098 [TCP segment of a reassembled PDU]
 25   0.008927 172.31.8.238 -> 54.239.132.196 TCP 66 35173 > http [ACK] Seq=99 Ack=65617 Win=158336 Len=0 TSval=14141058 TSecr=1688474329
 26   0.009644 54.239.132.196 -> 172.31.8.238 TCP 26130 [TCP segment of a reassembled PDU]
 27   0.009658 172.31.8.238 -> 54.239.132.196 TCP 66 35173 > http [ACK] Seq=99 Ack=91681 Win=210432 Len=0 TSval=14141058 TSecr=1688474329
 28   0.010338 54.239.132.196 -> 172.31.8.238 TCP 7306 [TCP segment of a reassembled PDU]
 29   0.010345 172.31.8.238 -> 54.239.132.196 TCP 66 35173 > http [ACK] Seq=99 Ack=98921 Win=224896 Len=0 TSval=14141058 TSecr=1688474330
 30   0.010377 54.239.132.196 -> 172.31.8.238 HTTP 4002 HTTP/1.1 200 OK  (application/octet-stream)
 31   0.010382 172.31.8.238 -> 54.239.132.196 TCP 66 35173 > http [ACK] Seq=99 Ack=102857 Win=232832 Len=0 TSval=14141058 TSecr=1688474330
 32   0.010529 172.31.8.238 -> 54.239.132.196 TCP 66 35173 > http [FIN, ACK] Seq=99 Ack=102857 Win=232832 Len=0 TSval=14141058 TSecr=1688474330
 33   0.011052 54.239.132.196 -> 172.31.8.238 TCP 66 http > 35173 [FIN, ACK] Seq=102857 Ack=100 Win=14592 Len=0 TSval=1688474330 TSecr=14141058
 34   0.011060 172.31.8.238 -> 54.239.132.196 TCP 66 35173 > http [ACK] Seq=100 Ack=102858 Win=232832 Len=0 TSval=14141058 TSecr=1688474330
