[Measurement for 1mb at 00:43:18 20.43.2014] 
Tshark:

  1   0.000000 172.31.8.238 -> 172.31.0.2   DNS 89 Standard query 0xf346  A d1n0gskdvzj94j.cloudfront.net
  2   0.000042 172.31.8.238 -> 172.31.0.2   DNS 89 Standard query 0xfa91  AAAA d1n0gskdvzj94j.cloudfront.net
  3   0.000708   172.31.0.2 -> 172.31.8.238 DNS 176 Standard query response 0xfa91 
  4   0.000718   172.31.0.2 -> 172.31.8.238 DNS 217 Standard query response 0xf346  A 54.230.117.154 A 54.230.118.146 A 54.230.118.248 A 54.230.119.58 A 54.192.118.220 A 54.192.118.221 A 54.192.118.239 A 54.230.116.98
  5   0.003883 172.31.8.238 -> 54.230.117.154 TCP 74 41943 > http [SYN] Seq=0 Win=26883 Len=0 MSS=8961 SACK_PERM=1 TSval=6956516 TSecr=0 WS=128
  6   0.004373 54.230.117.154 -> 172.31.8.238 TCP 74 http > 41943 [SYN, ACK] Seq=0 Ack=1 Win=14480 Len=0 MSS=1460 SACK_PERM=1 TSval=1682064979 TSecr=6956516 WS=128
  7   0.004386 172.31.8.238 -> 54.230.117.154 TCP 66 41943 > http [ACK] Seq=1 Ack=1 Win=27008 Len=0 TSval=6956516 TSecr=1682064979
  8   0.004436 172.31.8.238 -> 54.230.117.154 HTTP 162 GET /1mb HTTP/1.1 
  9   0.004870 54.230.117.154 -> 172.31.8.238 TCP 66 http > 41943 [ACK] Seq=1 Ack=97 Win=14592 Len=0 TSval=1682064979 TSecr=6956516
 10   0.006960 54.230.117.154 -> 172.31.8.238 TCP 4410 [TCP segment of a reassembled PDU]
 11   0.006969 172.31.8.238 -> 54.230.117.154 TCP 66 41943 > http [ACK] Seq=97 Ack=4345 Win=35584 Len=0 TSval=6956517 TSecr=1682064979
 12   0.007094 54.230.117.154 -> 172.31.8.238 TCP 6936 [TCP segment of a reassembled PDU]
 13   0.007103 172.31.8.238 -> 54.230.117.154 TCP 66 41943 > http [ACK] Seq=97 Ack=11215 Win=49408 Len=0 TSval=6956517 TSecr=1682064979
 14   0.007112 54.230.117.154 -> 172.31.8.238 TCP 2962 [TCP segment of a reassembled PDU]
 15   0.007119 172.31.8.238 -> 54.230.117.154 TCP 66 41943 > http [ACK] Seq=97 Ack=14111 Win=55168 Len=0 TSval=6956517 TSecr=1682064979
 16   0.007480 54.230.117.154 -> 172.31.8.238 TCP 5858 [TCP segment of a reassembled PDU]
 17   0.007487 172.31.8.238 -> 54.230.117.154 TCP 66 41943 > http [ACK] Seq=97 Ack=19903 Win=66688 Len=0 TSval=6956517 TSecr=1682064979
 18   0.007764 54.230.117.154 -> 172.31.8.238 TCP 7306 [TCP segment of a reassembled PDU]
 19   0.007771 172.31.8.238 -> 54.230.117.154 TCP 66 41943 > http [ACK] Seq=97 Ack=27143 Win=81280 Len=0 TSval=6956517 TSecr=1682064979
 20   0.007987 54.230.117.154 -> 172.31.8.238 TCP 5858 [TCP segment of a reassembled PDU]
 21   0.007994 172.31.8.238 -> 54.230.117.154 TCP 66 41943 > http [ACK] Seq=97 Ack=32935 Win=92800 Len=0 TSval=6956517 TSecr=1682064979
 22   0.008083 54.230.117.154 -> 172.31.8.238 TCP 7306 [TCP segment of a reassembled PDU]
 23   0.008089 172.31.8.238 -> 54.230.117.154 TCP 66 41943 > http [ACK] Seq=97 Ack=40175 Win=105984 Len=0 TSval=6956517 TSecr=1682064979
 24   0.008291 54.230.117.154 -> 172.31.8.238 TCP 8754 [TCP segment of a reassembled PDU]
 25   0.008299 172.31.8.238 -> 54.230.117.154 TCP 66 41943 > http [ACK] Seq=97 Ack=48863 Win=103680 Len=0 TSval=6956517 TSecr=1682064979
 26   0.008510 54.230.117.154 -> 172.31.8.238 TCP 4410 [TCP segment of a reassembled PDU]
 27   0.008516 172.31.8.238 -> 54.230.117.154 TCP 66 41943 > http [ACK] Seq=97 Ack=53207 Win=109056 Len=0 TSval=6956517 TSecr=1682064979
 28   0.008612 54.230.117.154 -> 172.31.8.238 TCP 11650 [TCP segment of a reassembled PDU]
 29   0.008620 172.31.8.238 -> 54.230.117.154 TCP 66 41943 > http [ACK] Seq=97 Ack=64791 Win=98944 Len=0 TSval=6956517 TSecr=1682064979
 30   0.008870 54.230.117.154 -> 172.31.8.238 TCP 10202 [TCP segment of a reassembled PDU]
 31   0.008879 172.31.8.238 -> 54.230.117.154 TCP 66 41943 > http [ACK] Seq=97 Ack=74927 Win=101248 Len=0 TSval=6956517 TSecr=1682064979
 32   0.009109 54.230.117.154 -> 172.31.8.238 TCP 4410 [TCP segment of a reassembled PDU]
 33   0.009114 172.31.8.238 -> 54.230.117.154 TCP 66 41943 > http [ACK] Seq=97 Ack=79271 Win=109056 Len=0 TSval=6956517 TSecr=1682064979
 34   0.009253 54.230.117.154 -> 172.31.8.238 TCP 2962 [TCP segment of a reassembled PDU]
 35   0.009258 172.31.8.238 -> 54.230.117.154 TCP 66 41943 > http [ACK] Seq=97 Ack=82167 Win=109056 Len=0 TSval=6956517 TSecr=1682064979
 36   0.009351 54.230.117.154 -> 172.31.8.238 TCP 11650 [TCP segment of a reassembled PDU]
 37   0.009359 172.31.8.238 -> 54.230.117.154 TCP 66 41943 > http [ACK] Seq=97 Ack=93751 Win=98944 Len=0 TSval=6956517 TSecr=1682064979
 38   0.009643 54.230.117.154 -> 172.31.8.238 TCP 10202 [TCP segment of a reassembled PDU]
 39   0.009650 172.31.8.238 -> 54.230.117.154 TCP 66 41943 > http [ACK] Seq=97 Ack=103887 Win=101248 Len=0 TSval=6956518 TSecr=1682064980
 40   0.009816 54.230.117.154 -> 172.31.8.238 TCP 4410 [TCP segment of a reassembled PDU]
 41   0.009822 172.31.8.238 -> 54.230.117.154 TCP 66 41943 > http [ACK] Seq=97 Ack=108231 Win=117760 Len=0 TSval=6956518 TSecr=1682064980
 42   0.009916 54.230.117.154 -> 172.31.8.238 TCP 7306 [TCP segment of a reassembled PDU]
 43   0.009923 172.31.8.238 -> 54.230.117.154 TCP 66 41943 > http [ACK] Seq=97 Ack=115471 Win=132224 Len=0 TSval=6956518 TSecr=1682064980
 44   0.010120 54.230.117.154 -> 172.31.8.238 TCP 13098 [TCP segment of a reassembled PDU]
 45   0.010129 172.31.8.238 -> 54.230.117.154 TCP 66 41943 > http [ACK] Seq=97 Ack=128503 Win=158336 Len=0 TSval=6956518 TSecr=1682064980
 46   0.010445 54.230.117.154 -> 172.31.8.238 TCP 17442 [TCP segment of a reassembled PDU]
 47   0.010457 172.31.8.238 -> 54.230.117.154 TCP 66 41943 > http [ACK] Seq=97 Ack=145879 Win=193024 Len=0 TSval=6956518 TSecr=1682064980
 48   0.010802 54.230.117.154 -> 172.31.8.238 TCP 4410 [TCP segment of a reassembled PDU]
 49   0.010810 172.31.8.238 -> 54.230.117.154 TCP 66 41943 > http [ACK] Seq=97 Ack=150223 Win=201728 Len=0 TSval=6956518 TSecr=1682064980
 50   0.010912 54.230.117.154 -> 172.31.8.238 TCP 5858 [TCP segment of a reassembled PDU]
 51   0.010919 172.31.8.238 -> 54.230.117.154 TCP 66 41943 > http [ACK] Seq=97 Ack=156015 Win=213376 Len=0 TSval=6956518 TSecr=1682064980
 52   0.011187 54.230.117.154 -> 172.31.8.238 TCP 26130 [TCP segment of a reassembled PDU]
 53   0.011216 172.31.8.238 -> 54.230.117.154 TCP 66 41943 > http [ACK] Seq=97 Ack=182079 Win=265472 Len=0 TSval=6956518 TSecr=1682064980
 54   0.011222 54.230.117.154 -> 172.31.8.238 TCP 1514 [TCP segment of a reassembled PDU]
 55   0.011224 172.31.8.238 -> 54.230.117.154 TCP 66 41943 > http [ACK] Seq=97 Ack=183527 Win=268288 Len=0 TSval=6956518 TSecr=1682064980
 56   0.011618 54.230.117.154 -> 172.31.8.238 TCP 17442 [TCP segment of a reassembled PDU]
 57   0.011628 172.31.8.238 -> 54.230.117.154 TCP 66 41943 > http [ACK] Seq=97 Ack=200903 Win=303104 Len=0 TSval=6956518 TSecr=1682064980
 58   0.011887 54.230.117.154 -> 172.31.8.238 TCP 26130 [TCP segment of a reassembled PDU]
 59   0.011901 172.31.8.238 -> 54.230.117.154 TCP 66 41943 > http [ACK] Seq=97 Ack=226967 Win=355200 Len=0 TSval=6956518 TSecr=1682064980
 60   0.011907 54.230.117.154 -> 172.31.8.238 TCP 1514 [TCP segment of a reassembled PDU]
 61   0.011910 172.31.8.238 -> 54.230.117.154 TCP 66 41943 > http [ACK] Seq=97 Ack=228415 Win=358144 Len=0 TSval=6956518 TSecr=1682064980
 62   0.012133 54.230.117.154 -> 172.31.8.238 TCP 21786 [TCP segment of a reassembled PDU]
 63   0.012155 172.31.8.238 -> 54.230.117.154 TCP 66 41943 > http [ACK] Seq=97 Ack=250135 Win=401536 Len=0 TSval=6956518 TSecr=1682064980
 64   0.012358 54.230.117.154 -> 172.31.8.238 TCP 17442 [TCP segment of a reassembled PDU]
 65   0.012371 172.31.8.238 -> 54.230.117.154 TCP 66 41943 > http [ACK] Seq=97 Ack=267511 Win=436352 Len=0 TSval=6956518 TSecr=1682064980
 66   0.012465 54.230.117.154 -> 172.31.8.238 TCP 13098 [TCP segment of a reassembled PDU]
 67   0.012475 172.31.8.238 -> 54.230.117.154 TCP 66 41943 > http [ACK] Seq=97 Ack=280543 Win=462336 Len=0 TSval=6956518 TSecr=1682064980
 68   0.012562 54.230.117.154 -> 172.31.8.238 TCP 5858 [TCP segment of a reassembled PDU]
 69   0.012569 172.31.8.238 -> 54.230.117.154 TCP 66 41943 > http [ACK] Seq=97 Ack=286335 Win=473984 Len=0 TSval=6956518 TSecr=1682064980
 70   0.012725 54.230.117.154 -> 172.31.8.238 TCP 17442 [TCP segment of a reassembled PDU]
 71   0.012736 172.31.8.238 -> 54.230.117.154 TCP 66 41943 > http [ACK] Seq=97 Ack=303711 Win=508672 Len=0 TSval=6956518 TSecr=1682064980
 72   0.012820 54.230.117.154 -> 172.31.8.238 TCP 8754 [TCP segment of a reassembled PDU]
 73   0.012827 172.31.8.238 -> 54.230.117.154 TCP 66 41943 > http [ACK] Seq=97 Ack=312399 Win=526080 Len=0 TSval=6956518 TSecr=1682064980
 74   0.012924 54.230.117.154 -> 172.31.8.238 TCP 2962 [TCP segment of a reassembled PDU]
 75   0.012929 172.31.8.238 -> 54.230.117.154 TCP 66 41943 > http [ACK] Seq=97 Ack=315295 Win=531840 Len=0 TSval=6956518 TSecr=1682064980
 76   0.013217 54.230.117.154 -> 172.31.8.238 TCP 21786 [TCP segment of a reassembled PDU]
 77   0.013230 172.31.8.238 -> 54.230.117.154 TCP 66 41943 > http [ACK] Seq=97 Ack=337015 Win=575360 Len=0 TSval=6956518 TSecr=1682064980
 78   0.013317 54.230.117.154 -> 172.31.8.238 TCP 4410 [TCP segment of a reassembled PDU]
 79   0.013322 172.31.8.238 -> 54.230.117.154 TCP 66 41943 > http [ACK] Seq=97 Ack=341359 Win=584064 Len=0 TSval=6956518 TSecr=1682064980
 80   0.013505 54.230.117.154 -> 172.31.8.238 TCP 26130 [TCP segment of a reassembled PDU]
 81   0.013519 172.31.8.238 -> 54.230.117.154 TCP 66 41943 > http [ACK] Seq=97 Ack=367423 Win=636160 Len=0 TSval=6956519 TSecr=1682064980
 82   0.013524 54.230.117.154 -> 172.31.8.238 TCP 1514 [TCP segment of a reassembled PDU]
 83   0.013527 172.31.8.238 -> 54.230.117.154 TCP 66 41943 > http [ACK] Seq=97 Ack=368871 Win=638976 Len=0 TSval=6956519 TSecr=1682064980
 84   0.013854 54.230.117.154 -> 172.31.8.238 TCP 4410 [TCP segment of a reassembled PDU]
 85   0.013861 172.31.8.238 -> 54.230.117.154 TCP 66 41943 > http [ACK] Seq=97 Ack=373215 Win=647680 Len=0 TSval=6956519 TSecr=1682064980
 86   0.014055 54.230.117.154 -> 172.31.8.238 TCP 26130 [TCP segment of a reassembled PDU]
 87   0.014070 172.31.8.238 -> 54.230.117.154 TCP 66 41943 > http [ACK] Seq=97 Ack=399279 Win=699904 Len=0 TSval=6956519 TSecr=1682064980
 88   0.014098 54.230.117.154 -> 172.31.8.238 TCP 1514 [TCP segment of a reassembled PDU]
 89   0.014104 172.31.8.238 -> 54.230.117.154 TCP 66 41943 > http [ACK] Seq=97 Ack=400727 Win=702720 Len=0 TSval=6956519 TSecr=1682064980
 90   0.014171 54.230.117.154 -> 172.31.8.238 TCP 7306 [TCP segment of a reassembled PDU]
 91   0.014179 172.31.8.238 -> 54.230.117.154 TCP 66 41943 > http [ACK] Seq=97 Ack=407967 Win=717184 Len=0 TSval=6956519 TSecr=1682064980
 92   0.014293 54.230.117.154 -> 172.31.8.238 TCP 14546 [TCP segment of a reassembled PDU]
 93   0.014303 172.31.8.238 -> 54.230.117.154 TCP 66 41943 > http [ACK] Seq=97 Ack=422447 Win=746240 Len=0 TSval=6956519 TSecr=1682064980
 94   0.014678 54.230.117.154 -> 172.31.8.238 TCP 10202 [TCP segment of a reassembled PDU]
 95   0.014687 172.31.8.238 -> 54.230.117.154 TCP 66 41943 > http [ACK] Seq=97 Ack=432583 Win=766464 Len=0 TSval=6956519 TSecr=1682064980
 96   0.014828 54.230.117.154 -> 172.31.8.238 TCP 26130 [TCP segment of a reassembled PDU]
 97   0.014852 172.31.8.238 -> 54.230.117.154 TCP 66 41943 > http [ACK] Seq=97 Ack=458647 Win=818560 Len=0 TSval=6956519 TSecr=1682064980
 98   0.014899 54.230.117.154 -> 172.31.8.238 TCP 17442 [TCP segment of a reassembled PDU]
 99   0.014910 172.31.8.238 -> 54.230.117.154 TCP 66 41943 > http [ACK] Seq=97 Ack=476023 Win=853376 Len=0 TSval=6956519 TSecr=1682064980
100   0.015255 54.230.117.154 -> 172.31.8.238 TCP 26130 [TCP segment of a reassembled PDU]
101   0.015271 172.31.8.238 -> 54.230.117.154 TCP 66 41943 > http [ACK] Seq=97 Ack=502087 Win=905472 Len=0 TSval=6956519 TSecr=1682064980
102   0.015290 54.230.117.154 -> 172.31.8.238 TCP 7306 [TCP segment of a reassembled PDU]
103   0.015296 172.31.8.238 -> 54.230.117.154 TCP 66 41943 > http [ACK] Seq=97 Ack=509327 Win=919936 Len=0 TSval=6956519 TSecr=1682064980
104   0.015659 54.230.117.154 -> 172.31.8.238 TCP 5858 [TCP segment of a reassembled PDU]
105   0.015666 172.31.8.238 -> 54.230.117.154 TCP 66 41943 > http [ACK] Seq=97 Ack=515119 Win=931584 Len=0 TSval=6956519 TSecr=1682064980
106   0.015819 54.230.117.154 -> 172.31.8.238 TCP 26130 [TCP segment of a reassembled PDU]
107   0.015834 172.31.8.238 -> 54.230.117.154 TCP 66 41943 > http [ACK] Seq=97 Ack=541183 Win=983680 Len=0 TSval=6956519 TSecr=1682064980
108   0.015919 54.230.117.154 -> 172.31.8.238 TCP 5858 [TCP segment of a reassembled PDU]
109   0.015926 172.31.8.238 -> 54.230.117.154 TCP 66 41943 > http [ACK] Seq=97 Ack=546975 Win=995200 Len=0 TSval=6956519 TSecr=1682064980
110   0.016081 54.230.117.154 -> 172.31.8.238 TCP 24682 [TCP segment of a reassembled PDU]
111   0.016095 172.31.8.238 -> 54.230.117.154 TCP 66 41943 > http [ACK] Seq=97 Ack=571591 Win=1044480 Len=0 TSval=6956519 TSecr=1682064980
112   0.016101 54.230.117.154 -> 172.31.8.238 TCP 1514 [TCP segment of a reassembled PDU]
113   0.016103 172.31.8.238 -> 54.230.117.154 TCP 66 41943 > http [ACK] Seq=97 Ack=573039 Win=1047424 Len=0 TSval=6956519 TSecr=1682064980
114   0.016124 54.230.117.154 -> 172.31.8.238 TCP 10202 [TCP segment of a reassembled PDU]
115   0.016131 172.31.8.238 -> 54.230.117.154 TCP 66 41943 > http [ACK] Seq=97 Ack=583175 Win=1067648 Len=0 TSval=6956519 TSecr=1682064980
116   0.016425 54.230.117.154 -> 172.31.8.238 TCP 8754 [TCP segment of a reassembled PDU]
117   0.016433 172.31.8.238 -> 54.230.117.154 TCP 66 41943 > http [ACK] Seq=97 Ack=591863 Win=1085056 Len=0 TSval=6956519 TSecr=1682064980
118   0.016560 54.230.117.154 -> 172.31.8.238 TCP 14546 [TCP segment of a reassembled PDU]
119   0.016569 172.31.8.238 -> 54.230.117.154 TCP 66 41943 > http [ACK] Seq=97 Ack=606343 Win=1113984 Len=0 TSval=6956519 TSecr=1682064980
120   0.016695 54.230.117.154 -> 172.31.8.238 TCP 15994 [TCP segment of a reassembled PDU]
121   0.016707 172.31.8.238 -> 54.230.117.154 TCP 66 41943 > http [ACK] Seq=97 Ack=622271 Win=1145856 Len=0 TSval=6956519 TSecr=1682064980
122   0.016846 54.230.117.154 -> 172.31.8.238 TCP 26130 [TCP segment of a reassembled PDU]
123   0.016861 172.31.8.238 -> 54.230.117.154 TCP 66 41943 > http [ACK] Seq=97 Ack=648335 Win=1197952 Len=0 TSval=6956519 TSecr=1682064980
124   0.016966 54.230.117.154 -> 172.31.8.238 TCP 23234 [TCP segment of a reassembled PDU]
125   0.016980 172.31.8.238 -> 54.230.117.154 TCP 66 41943 > http [ACK] Seq=97 Ack=671503 Win=1244288 Len=0 TSval=6956519 TSecr=1682064980
126   0.017319 54.230.117.154 -> 172.31.8.238 TCP 26130 [TCP segment of a reassembled PDU]
127   0.017334 172.31.8.238 -> 54.230.117.154 TCP 66 41943 > http [ACK] Seq=97 Ack=697567 Win=1263744 Len=0 TSval=6956519 TSecr=1682064980
128   0.017386 54.230.117.154 -> 172.31.8.238 TCP 20338 [TCP segment of a reassembled PDU]
129   0.017399 172.31.8.238 -> 54.230.117.154 TCP 66 41943 > http [ACK] Seq=97 Ack=717839 Win=1273216 Len=0 TSval=6956519 TSecr=1682064980
130   0.017433 54.230.117.154 -> 172.31.8.238 TCP 1514 [TCP segment of a reassembled PDU]
131   0.017437 172.31.8.238 -> 54.230.117.154 TCP 66 41943 > http [ACK] Seq=97 Ack=719287 Win=1299328 Len=0 TSval=6956519 TSecr=1682064980
132   0.017607 54.230.117.154 -> 172.31.8.238 TCP 17442 [TCP segment of a reassembled PDU]
133   0.017646 172.31.8.238 -> 54.230.117.154 TCP 66 41943 > http [ACK] Seq=97 Ack=736663 Win=1282048 Len=0 TSval=6956520 TSecr=1682064980
134   0.017704 54.230.117.154 -> 172.31.8.238 TCP 26130 [TCP segment of a reassembled PDU]
135   0.017731 172.31.8.238 -> 54.230.117.154 TCP 66 41943 > http [ACK] Seq=97 Ack=762727 Win=1263744 Len=0 TSval=6956520 TSecr=1682064980
136   0.017761 54.230.117.154 -> 172.31.8.238 TCP 7306 [TCP segment of a reassembled PDU]
137   0.017768 172.31.8.238 -> 54.230.117.154 TCP 66 41943 > http [ACK] Seq=97 Ack=769967 Win=1294592 Len=0 TSval=6956520 TSecr=1682064980
138   0.018054 54.230.117.154 -> 172.31.8.238 TCP 18890 [TCP segment of a reassembled PDU]
139   0.018077 172.31.8.238 -> 54.230.117.154 TCP 66 41943 > http [ACK] Seq=97 Ack=788791 Win=1275776 Len=0 TSval=6956520 TSecr=1682064980
140   0.018168 54.230.117.154 -> 172.31.8.238 TCP 13098 [TCP segment of a reassembled PDU]
141   0.018177 172.31.8.238 -> 54.230.117.154 TCP 66 41943 > http [ACK] Seq=97 Ack=801823 Win=1285120 Len=0 TSval=6956520 TSecr=1682064980
142   0.018514 54.230.117.154 -> 172.31.8.238 TCP 10202 [TCP segment of a reassembled PDU]
143   0.018522 172.31.8.238 -> 54.230.117.154 TCP 66 41943 > http [ACK] Seq=97 Ack=811959 Win=1289856 Len=0 TSval=6956520 TSecr=1682064980
144   0.018645 54.230.117.154 -> 172.31.8.238 TCP 20338 [TCP segment of a reassembled PDU]
145   0.018668 172.31.8.238 -> 54.230.117.154 TCP 66 41943 > http [ACK] Seq=97 Ack=832231 Win=1273216 Len=0 TSval=6956520 TSecr=1682064980
146   0.018684 54.230.117.154 -> 172.31.8.238 TCP 5858 [TCP segment of a reassembled PDU]
147   0.018694 172.31.8.238 -> 54.230.117.154 TCP 66 41943 > http [ACK] Seq=97 Ack=838023 Win=1299328 Len=0 TSval=6956520 TSecr=1682064980
148   0.018774 54.230.117.154 -> 172.31.8.238 TCP 26130 [TCP segment of a reassembled PDU]
149   0.018829 54.230.117.154 -> 172.31.8.238 TCP 2962 [TCP segment of a reassembled PDU]
150   0.018915 172.31.8.238 -> 54.230.117.154 TCP 66 41943 > http [ACK] Seq=97 Ack=866983 Win=1270400 Len=0 TSval=6956520 TSecr=1682064980
151   0.019143 54.230.117.154 -> 172.31.8.238 TCP 26130 [TCP segment of a reassembled PDU]
152   0.019170 172.31.8.238 -> 54.230.117.154 TCP 66 41943 > http [ACK] Seq=97 Ack=893047 Win=1263744 Len=0 TSval=6956520 TSecr=1682064980
153   0.019206 54.230.117.154 -> 172.31.8.238 TCP 18890 [TCP segment of a reassembled PDU]
154   0.019218 172.31.8.238 -> 54.230.117.154 TCP 66 41943 > http [ACK] Seq=97 Ack=911871 Win=1275520 Len=0 TSval=6956520 TSecr=1682064980
155   0.019297 54.230.117.154 -> 172.31.8.238 TCP 20338 [TCP segment of a reassembled PDU]
156   0.019322 172.31.8.238 -> 54.230.117.154 TCP 66 41943 > http [ACK] Seq=97 Ack=932143 Win=1273216 Len=0 TSval=6956520 TSecr=1682064980
157   0.019542 54.230.117.154 -> 172.31.8.238 TCP 13098 [TCP segment of a reassembled PDU]
158   0.019551 172.31.8.238 -> 54.230.117.154 TCP 66 41943 > http [ACK] Seq=97 Ack=945175 Win=1285120 Len=0 TSval=6956520 TSecr=1682064981
159   0.019684 54.230.117.154 -> 172.31.8.238 TCP 26130 [TCP segment of a reassembled PDU]
160   0.019782 54.230.117.154 -> 172.31.8.238 TCP 24682 [TCP segment of a reassembled PDU]
161   0.019818 54.230.117.154 -> 172.31.8.238 TCP 1514 [TCP segment of a reassembled PDU]
162   0.019823 172.31.8.238 -> 54.230.117.154 TCP 66 41943 > http [ACK] Seq=97 Ack=995855 Win=1234560 Len=0 TSval=6956520 TSecr=1682064981
163   0.019934 54.230.117.154 -> 172.31.8.238 TCP 26130 [TCP segment of a reassembled PDU]
164   0.019948 172.31.8.238 -> 54.230.117.154 TCP 66 41943 > http [ACK] Seq=97 Ack=1023367 Win=1263744 Len=0 TSval=6956520 TSecr=1682064981
165   0.020012 54.230.117.154 -> 172.31.8.238 TCP 20338 [TCP segment of a reassembled PDU]
166   0.020024 172.31.8.238 -> 54.230.117.154 TCP 66 41943 > http [ACK] Seq=97 Ack=1043639 Win=1273216 Len=0 TSval=6956520 TSecr=1682064981
167   0.020079 54.230.117.154 -> 172.31.8.238 HTTP 5461 HTTP/1.1 200 OK  (application/octet-stream)
168   0.020085 172.31.8.238 -> 54.230.117.154 TCP 66 41943 > http [ACK] Seq=97 Ack=1049034 Win=1297024 Len=0 TSval=6956520 TSecr=1682064981
169   0.020233 172.31.8.238 -> 54.230.117.154 TCP 66 41943 > http [FIN, ACK] Seq=97 Ack=1049034 Win=1299328 Len=0 TSval=6956520 TSecr=1682064981
170   0.020730 54.230.117.154 -> 172.31.8.238 TCP 66 http > 41943 [FIN, ACK] Seq=1049034 Ack=98 Win=14592 Len=0 TSval=1682064981 TSecr=6956520
171   0.020737 172.31.8.238 -> 54.230.117.154 TCP 66 41943 > http [ACK] Seq=98 Ack=1049035 Win=1299328 Len=0 TSval=6956520 TSecr=1682064981
