[Measurement for 1mb at 09:43:48 20.43.2014] 
Tshark:

  1   0.000000 172.31.8.238 -> 172.31.0.2   DNS 89 Standard query 0x6cbb  A d1n0gskdvzj94j.cloudfront.net
  2   0.000027 172.31.8.238 -> 172.31.0.2   DNS 89 Standard query 0x7c63  AAAA d1n0gskdvzj94j.cloudfront.net
  3   0.000695   172.31.0.2 -> 172.31.8.238 DNS 217 Standard query response 0x6cbb  A 54.230.116.98 A 54.230.118.146 A 54.230.119.11 A 54.230.119.55 A 54.230.119.150 A 54.239.132.147 A 54.239.132.233 A 54.192.118.218
  4   0.000706   172.31.0.2 -> 172.31.8.238 DNS 176 Standard query response 0x7c63 
  5   0.003892 172.31.8.238 -> 54.230.116.98 TCP 74 39998 > http [SYN] Seq=0 Win=26883 Len=0 MSS=8961 SACK_PERM=1 TSval=15064035 TSecr=0 WS=128
  6   0.004459 54.230.116.98 -> 172.31.8.238 TCP 74 http > 39998 [SYN, ACK] Seq=0 Ack=1 Win=14480 Len=0 MSS=1460 SACK_PERM=1 TSval=1684990628 TSecr=15064035 WS=128
  7   0.004474 172.31.8.238 -> 54.230.116.98 TCP 66 39998 > http [ACK] Seq=1 Ack=1 Win=27008 Len=0 TSval=15064035 TSecr=1684990628
  8   0.004515 172.31.8.238 -> 54.230.116.98 HTTP 162 GET /1mb HTTP/1.1 
  9   0.005204 54.230.116.98 -> 172.31.8.238 TCP 66 http > 39998 [ACK] Seq=1 Ack=97 Win=14592 Len=0 TSval=1684990628 TSecr=15064035
 10   0.005680 54.230.116.98 -> 172.31.8.238 TCP 523 [TCP segment of a reassembled PDU]
 11   0.005687 172.31.8.238 -> 54.230.116.98 TCP 66 39998 > http [ACK] Seq=97 Ack=458 Win=28032 Len=0 TSval=15064035 TSecr=1684990628
 12   0.006009 54.230.116.98 -> 172.31.8.238 TCP 10202 [TCP segment of a reassembled PDU]
 13   0.006018 172.31.8.238 -> 54.230.116.98 TCP 66 39998 > http [ACK] Seq=97 Ack=10594 Win=48256 Len=0 TSval=15064035 TSecr=1684990628
 14   0.006048 54.230.116.98 -> 172.31.8.238 TCP 2962 [TCP segment of a reassembled PDU]
 15   0.006053 172.31.8.238 -> 54.230.116.98 TCP 66 39998 > http [ACK] Seq=97 Ack=13490 Win=54144 Len=0 TSval=15064035 TSecr=1684990628
 16   0.006512 54.230.116.98 -> 172.31.8.238 TCP 13098 [TCP segment of a reassembled PDU]
 17   0.006521 172.31.8.238 -> 54.230.116.98 TCP 66 39998 > http [ACK] Seq=97 Ack=26522 Win=80128 Len=0 TSval=15064035 TSecr=1684990628
 18   0.007062 54.230.116.98 -> 172.31.8.238 TCP 18890 [TCP segment of a reassembled PDU]
 19   0.007075 172.31.8.238 -> 54.230.116.98 TCP 66 39998 > http [ACK] Seq=97 Ack=45346 Win=86912 Len=0 TSval=15064036 TSecr=1684990628
 20   0.007081 54.230.116.98 -> 172.31.8.238 TCP 1514 [TCP segment of a reassembled PDU]
 21   0.007083 172.31.8.238 -> 54.230.116.98 TCP 66 39998 > http [ACK] Seq=97 Ack=46794 Win=85504 Len=0 TSval=15064036 TSecr=1684990628
 22   0.007530 54.230.116.98 -> 172.31.8.238 TCP 5858 [TCP segment of a reassembled PDU]
 23   0.007537 172.31.8.238 -> 54.230.116.98 TCP 66 39998 > http [ACK] Seq=97 Ack=52586 Win=120704 Len=0 TSval=15064036 TSecr=1684990628
 24   0.007639 54.230.116.98 -> 172.31.8.238 TCP 13098 [TCP segment of a reassembled PDU]
 25   0.007648 172.31.8.238 -> 54.230.116.98 TCP 66 39998 > http [ACK] Seq=97 Ack=65618 Win=146688 Len=0 TSval=15064036 TSecr=1684990628
 26   0.008004 54.230.116.98 -> 172.31.8.238 TCP 10202 [TCP segment of a reassembled PDU]
 27   0.008012 172.31.8.238 -> 54.230.116.98 TCP 66 39998 > http [ACK] Seq=97 Ack=75754 Win=167040 Len=0 TSval=15064036 TSecr=1684990628
 28   0.008052 54.230.116.98 -> 172.31.8.238 TCP 1514 [TCP segment of a reassembled PDU]
 29   0.008056 172.31.8.238 -> 54.230.116.98 TCP 66 39998 > http [ACK] Seq=97 Ack=77202 Win=169856 Len=0 TSval=15064036 TSecr=1684990628
 30   0.008337 54.230.116.98 -> 172.31.8.238 TCP 1514 [TCP segment of a reassembled PDU]
 31   0.008347 172.31.8.238 -> 54.230.116.98 TCP 66 39998 > http [ACK] Seq=97 Ack=78650 Win=172800 Len=0 TSval=15064036 TSecr=1684990628
 32   0.008402 54.230.116.98 -> 172.31.8.238 TCP 13098 [TCP segment of a reassembled PDU]
 33   0.008412 172.31.8.238 -> 54.230.116.98 TCP 66 39998 > http [ACK] Seq=97 Ack=91682 Win=198784 Len=0 TSval=15064036 TSecr=1684990628
 34   0.008525 54.230.116.98 -> 172.31.8.238 TCP 1514 [TCP segment of a reassembled PDU]
 35   0.008530 172.31.8.238 -> 54.230.116.98 TCP 66 39998 > http [ACK] Seq=97 Ack=93130 Win=201728 Len=0 TSval=15064036 TSecr=1684990628
 36   0.008631 54.230.116.98 -> 172.31.8.238 TCP 11650 [TCP segment of a reassembled PDU]
 37   0.008640 172.31.8.238 -> 54.230.116.98 TCP 66 39998 > http [ACK] Seq=97 Ack=104714 Win=224896 Len=0 TSval=15064036 TSecr=1684990628
 38   0.009100 54.230.116.98 -> 172.31.8.238 TCP 4410 [TCP segment of a reassembled PDU]
 39   0.009105 172.31.8.238 -> 54.230.116.98 TCP 66 39998 > http [ACK] Seq=97 Ack=109058 Win=233600 Len=0 TSval=15064036 TSecr=1684990628
 40   0.009195 54.230.116.98 -> 172.31.8.238 TCP 8754 [TCP segment of a reassembled PDU]
 41   0.009202 172.31.8.238 -> 54.230.116.98 TCP 66 39998 > http [ACK] Seq=97 Ack=117746 Win=251008 Len=0 TSval=15064036 TSecr=1684990628
 42   0.009354 54.230.116.98 -> 172.31.8.238 TCP 13098 [TCP segment of a reassembled PDU]
 43   0.009364 172.31.8.238 -> 54.230.116.98 TCP 66 39998 > http [ACK] Seq=97 Ack=130778 Win=276992 Len=0 TSval=15064036 TSecr=1684990628
 44   0.009608 54.230.116.98 -> 172.31.8.238 TCP 13098 [TCP segment of a reassembled PDU]
 45   0.009617 172.31.8.238 -> 54.230.116.98 TCP 66 39998 > http [ACK] Seq=97 Ack=143810 Win=303104 Len=0 TSval=15064036 TSecr=1684990628
 46   0.009912 54.230.116.98 -> 172.31.8.238 TCP 13098 [TCP segment of a reassembled PDU]
 47   0.009921 172.31.8.238 -> 54.230.116.98 TCP 66 39998 > http [ACK] Seq=97 Ack=156842 Win=329216 Len=0 TSval=15064036 TSecr=1684990628
 48   0.009989 54.230.116.98 -> 172.31.8.238 TCP 13098 [TCP segment of a reassembled PDU]
 49   0.009998 172.31.8.238 -> 54.230.116.98 TCP 66 39998 > http [ACK] Seq=97 Ack=169874 Win=355200 Len=0 TSval=15064036 TSecr=1684990628
 50   0.010084 54.230.116.98 -> 172.31.8.238 TCP 7306 [TCP segment of a reassembled PDU]
 51   0.010091 172.31.8.238 -> 54.230.116.98 TCP 66 39998 > http [ACK] Seq=97 Ack=177114 Win=369664 Len=0 TSval=15064036 TSecr=1684990628
 52   0.010158 54.230.116.98 -> 172.31.8.238 TCP 5858 [TCP segment of a reassembled PDU]
 53   0.010164 172.31.8.238 -> 54.230.116.98 TCP 66 39998 > http [ACK] Seq=97 Ack=182906 Win=381312 Len=0 TSval=15064036 TSecr=1684990628
 54   0.010844 54.230.116.98 -> 172.31.8.238 TCP 4410 [TCP segment of a reassembled PDU]
 55   0.010852 172.31.8.238 -> 54.230.116.98 TCP 66 39998 > http [ACK] Seq=97 Ack=187250 Win=390016 Len=0 TSval=15064037 TSecr=1684990629
 56   0.011021 54.230.116.98 -> 172.31.8.238 TCP 18890 [TCP segment of a reassembled PDU]
 57   0.011034 172.31.8.238 -> 54.230.116.98 TCP 66 39998 > http [ACK] Seq=97 Ack=206074 Win=427648 Len=0 TSval=15064037 TSecr=1684990629
 58   0.011078 54.230.116.98 -> 172.31.8.238 TCP 7306 [TCP segment of a reassembled PDU]
 59   0.011085 172.31.8.238 -> 54.230.116.98 TCP 66 39998 > http [ACK] Seq=97 Ack=213314 Win=442112 Len=0 TSval=15064037 TSecr=1684990629
 60   0.011182 54.230.116.98 -> 172.31.8.238 TCP 15994 [TCP segment of a reassembled PDU]
 61   0.011192 172.31.8.238 -> 54.230.116.98 TCP 66 39998 > http [ACK] Seq=97 Ack=229242 Win=473984 Len=0 TSval=15064037 TSecr=1684990629
 62   0.011611 54.230.116.98 -> 172.31.8.238 TCP 17442 [TCP segment of a reassembled PDU]
 63   0.011623 172.31.8.238 -> 54.230.116.98 TCP 66 39998 > http [ACK] Seq=97 Ack=246618 Win=508672 Len=0 TSval=15064037 TSecr=1684990629
 64   0.011813 54.230.116.98 -> 172.31.8.238 TCP 21786 [TCP segment of a reassembled PDU]
 65   0.011827 172.31.8.238 -> 54.230.116.98 TCP 66 39998 > http [ACK] Seq=97 Ack=268338 Win=552192 Len=0 TSval=15064037 TSecr=1684990629
 66   0.011930 54.230.116.98 -> 172.31.8.238 TCP 13098 [TCP segment of a reassembled PDU]
 67   0.011941 172.31.8.238 -> 54.230.116.98 TCP 66 39998 > http [ACK] Seq=97 Ack=281370 Win=578176 Len=0 TSval=15064037 TSecr=1684990629
 68   0.012134 54.230.116.98 -> 172.31.8.238 TCP 1514 [TCP segment of a reassembled PDU]
 69   0.012139 172.31.8.238 -> 54.230.116.98 TCP 66 39998 > http [ACK] Seq=97 Ack=282818 Win=581120 Len=0 TSval=15064037 TSecr=1684990629
 70   0.012446 54.230.116.98 -> 172.31.8.238 TCP 26130 [TCP segment of a reassembled PDU]
 71   0.012461 172.31.8.238 -> 54.230.116.98 TCP 66 39998 > http [ACK] Seq=97 Ack=308882 Win=633216 Len=0 TSval=15064037 TSecr=1684990629
 72   0.012495 54.230.116.98 -> 172.31.8.238 TCP 14546 [TCP segment of a reassembled PDU]
 73   0.012505 172.31.8.238 -> 54.230.116.98 TCP 66 39998 > http [ACK] Seq=97 Ack=323362 Win=662144 Len=0 TSval=15064037 TSecr=1684990629
 74   0.012858 54.230.116.98 -> 172.31.8.238 TCP 1514 [TCP segment of a reassembled PDU]
 75   0.012863 172.31.8.238 -> 54.230.116.98 TCP 66 39998 > http [ACK] Seq=97 Ack=324810 Win=665088 Len=0 TSval=15064037 TSecr=1684990629
 76   0.013032 54.230.116.98 -> 172.31.8.238 TCP 26130 [TCP segment of a reassembled PDU]
 77   0.013045 172.31.8.238 -> 54.230.116.98 TCP 66 39998 > http [ACK] Seq=97 Ack=350874 Win=717184 Len=0 TSval=15064037 TSecr=1684990629
 78   0.013097 54.230.116.98 -> 172.31.8.238 TCP 17442 [TCP segment of a reassembled PDU]
 79   0.013108 172.31.8.238 -> 54.230.116.98 TCP 66 39998 > http [ACK] Seq=97 Ack=368250 Win=752000 Len=0 TSval=15064037 TSecr=1684990629
 80   0.013621 54.230.116.98 -> 172.31.8.238 TCP 4410 [TCP segment of a reassembled PDU]
 81   0.013628 172.31.8.238 -> 54.230.116.98 TCP 66 39998 > http [ACK] Seq=97 Ack=372594 Win=760704 Len=0 TSval=15064037 TSecr=1684990629
 82   0.013788 54.230.116.98 -> 172.31.8.238 TCP 26130 [TCP segment of a reassembled PDU]
 83   0.013802 172.31.8.238 -> 54.230.116.98 TCP 66 39998 > http [ACK] Seq=97 Ack=398658 Win=812800 Len=0 TSval=15064037 TSecr=1684990629
 84   0.013857 54.230.116.98 -> 172.31.8.238 TCP 14546 [TCP segment of a reassembled PDU]
 85   0.013866 172.31.8.238 -> 54.230.116.98 TCP 66 39998 > http [ACK] Seq=97 Ack=413138 Win=841088 Len=0 TSval=15064037 TSecr=1684990629
 86   0.014268 54.230.116.98 -> 172.31.8.238 TCP 21786 [TCP segment of a reassembled PDU]
 87   0.014280 172.31.8.238 -> 54.230.116.98 TCP 66 39998 > http [ACK] Seq=97 Ack=434858 Win=829312 Len=0 TSval=15064037 TSecr=1684990629
 88   0.014287 54.230.116.98 -> 172.31.8.238 TCP 2962 [TCP segment of a reassembled PDU]
 89   0.014293 172.31.8.238 -> 54.230.116.98 TCP 66 39998 > http [ACK] Seq=97 Ack=437754 Win=826496 Len=0 TSval=15064037 TSecr=1684990629
 90   0.014298 54.230.116.98 -> 172.31.8.238 TCP 1514 [TCP segment of a reassembled PDU]
 91   0.014300 172.31.8.238 -> 54.230.116.98 TCP 66 39998 > http [ACK] Seq=97 Ack=439202 Win=825088 Len=0 TSval=15064037 TSecr=1684990629
 92   0.014501 54.230.116.98 -> 172.31.8.238 TCP 26130 [TCP segment of a reassembled PDU]
 93   0.014514 172.31.8.238 -> 54.230.116.98 TCP 66 39998 > http [ACK] Seq=97 Ack=465266 Win=822144 Len=0 TSval=15064037 TSecr=1684990629
 94   0.014549 54.230.116.98 -> 172.31.8.238 TCP 13098 [TCP segment of a reassembled PDU]
 95   0.014556 172.31.8.238 -> 54.230.116.98 TCP 66 39998 > http [ACK] Seq=97 Ack=478298 Win=843648 Len=0 TSval=15064037 TSecr=1684990629
 96   0.014931 54.230.116.98 -> 172.31.8.238 TCP 5858 [TCP segment of a reassembled PDU]
 97   0.014938 172.31.8.238 -> 54.230.116.98 TCP 66 39998 > http [ACK] Seq=97 Ack=484090 Win=855424 Len=0 TSval=15064038 TSecr=1684990629
 98   0.015102 54.230.116.98 -> 172.31.8.238 TCP 26130 [TCP segment of a reassembled PDU]
 99   0.015115 172.31.8.238 -> 54.230.116.98 TCP 66 39998 > http [ACK] Seq=97 Ack=510154 Win=915968 Len=0 TSval=15064038 TSecr=1684990629
100   0.015179 54.230.116.98 -> 172.31.8.238 TCP 26130 [TCP segment of a reassembled PDU]
101   0.015196 172.31.8.238 -> 54.230.116.98 TCP 66 39998 > http [ACK] Seq=97 Ack=536218 Win=968064 Len=0 TSval=15064038 TSecr=1684990629
102   0.015238 54.230.116.98 -> 172.31.8.238 TCP 7306 [TCP segment of a reassembled PDU]
103   0.015245 172.31.8.238 -> 54.230.116.98 TCP 66 39998 > http [ACK] Seq=97 Ack=543458 Win=982528 Len=0 TSval=15064038 TSecr=1684990629
104   0.015675 54.230.116.98 -> 172.31.8.238 TCP 5858 [TCP segment of a reassembled PDU]
105   0.015682 172.31.8.238 -> 54.230.116.98 TCP 66 39998 > http [ACK] Seq=97 Ack=549250 Win=994176 Len=0 TSval=15064038 TSecr=1684990629
106   0.015866 54.230.116.98 -> 172.31.8.238 TCP 26130 [TCP segment of a reassembled PDU]
107   0.015879 172.31.8.238 -> 54.230.116.98 TCP 66 39998 > http [ACK] Seq=97 Ack=575314 Win=1046272 Len=0 TSval=15064038 TSecr=1684990629
108   0.015958 54.230.116.98 -> 172.31.8.238 TCP 23234 [TCP segment of a reassembled PDU]
109   0.015972 172.31.8.238 -> 54.230.116.98 TCP 66 39998 > http [ACK] Seq=97 Ack=598482 Win=1092608 Len=0 TSval=15064038 TSecr=1684990629
110   0.016018 54.230.116.98 -> 172.31.8.238 TCP 10202 [TCP segment of a reassembled PDU]
111   0.016026 172.31.8.238 -> 54.230.116.98 TCP 66 39998 > http [ACK] Seq=97 Ack=608618 Win=1112832 Len=0 TSval=15064038 TSecr=1684990629
112   0.016457 54.230.116.98 -> 172.31.8.238 TCP 1514 [TCP segment of a reassembled PDU]
113   0.016462 172.31.8.238 -> 54.230.116.98 TCP 66 39998 > http [ACK] Seq=97 Ack=610066 Win=1115776 Len=0 TSval=15064038 TSecr=1684990629
114   0.016651 54.230.116.98 -> 172.31.8.238 TCP 26130 [TCP segment of a reassembled PDU]
115   0.016665 172.31.8.238 -> 54.230.116.98 TCP 66 39998 > http [ACK] Seq=97 Ack=636130 Win=1167872 Len=0 TSval=15064038 TSecr=1684990629
116   0.016826 54.230.116.98 -> 172.31.8.238 TCP 24682 [TCP segment of a reassembled PDU]
117   0.016839 172.31.8.238 -> 54.230.116.98 TCP 66 39998 > http [ACK] Seq=97 Ack=660746 Win=1217152 Len=0 TSval=15064038 TSecr=1684990629
118   0.016852 54.230.116.98 -> 172.31.8.238 TCP 1514 [TCP segment of a reassembled PDU]
119   0.016855 172.31.8.238 -> 54.230.116.98 TCP 66 39998 > http [ACK] Seq=97 Ack=662194 Win=1219968 Len=0 TSval=15064038 TSecr=1684990629
120   0.016946 54.230.116.98 -> 172.31.8.238 TCP 11650 [TCP segment of a reassembled PDU]
121   0.016955 172.31.8.238 -> 54.230.116.98 TCP 66 39998 > http [ACK] Seq=97 Ack=673778 Win=1243136 Len=0 TSval=15064038 TSecr=1684990629
122   0.017460 54.230.116.98 -> 172.31.8.238 TCP 26130 [TCP segment of a reassembled PDU]
123   0.017478 172.31.8.238 -> 54.230.116.98 TCP 66 39998 > http [ACK] Seq=97 Ack=699842 Win=1295360 Len=0 TSval=15064038 TSecr=1684990629
124   0.017554 54.230.116.98 -> 172.31.8.238 TCP 23234 [TCP segment of a reassembled PDU]
125   0.017568 172.31.8.238 -> 54.230.116.98 TCP 66 39998 > http [ACK] Seq=97 Ack=723010 Win=1341696 Len=0 TSval=15064038 TSecr=1684990629
126   0.017641 54.230.116.98 -> 172.31.8.238 TCP 15994 [TCP segment of a reassembled PDU]
127   0.017652 172.31.8.238 -> 54.230.116.98 TCP 66 39998 > http [ACK] Seq=97 Ack=738938 Win=1373440 Len=0 TSval=15064038 TSecr=1684990629
128   0.018072 54.230.116.98 -> 172.31.8.238 TCP 8754 [TCP segment of a reassembled PDU]
129   0.018081 172.31.8.238 -> 54.230.116.98 TCP 66 39998 > http [ACK] Seq=97 Ack=747626 Win=1390848 Len=0 TSval=15064038 TSecr=1684990629
130   0.018242 54.230.116.98 -> 172.31.8.238 TCP 26130 [TCP segment of a reassembled PDU]
131   0.018256 172.31.8.238 -> 54.230.116.98 TCP 66 39998 > http [ACK] Seq=97 Ack=773690 Win=1434880 Len=0 TSval=15064038 TSecr=1684990629
132   0.018332 54.230.116.98 -> 172.31.8.238 TCP 26130 [TCP segment of a reassembled PDU]
133   0.018346 172.31.8.238 -> 54.230.116.98 TCP 66 39998 > http [ACK] Seq=97 Ack=799754 Win=1434880 Len=0 TSval=15064038 TSecr=1684990629
134   0.018418 54.230.116.98 -> 172.31.8.238 TCP 26130 [TCP segment of a reassembled PDU]
135   0.018432 172.31.8.238 -> 54.230.116.98 TCP 66 39998 > http [ACK] Seq=97 Ack=825818 Win=1434880 Len=0 TSval=15064038 TSecr=1684990629
136   0.018486 54.230.116.98 -> 172.31.8.238 TCP 13098 [TCP segment of a reassembled PDU]
137   0.018495 172.31.8.238 -> 54.230.116.98 TCP 66 39998 > http [ACK] Seq=97 Ack=838850 Win=1456384 Len=0 TSval=15064038 TSecr=1684990629
138   0.018926 54.230.116.98 -> 172.31.8.238 TCP 26130 [TCP segment of a reassembled PDU]
139   0.018940 172.31.8.238 -> 54.230.116.98 TCP 66 39998 > http [ACK] Seq=97 Ack=864914 Win=1434880 Len=0 TSval=15064039 TSecr=1684990629
140   0.018949 54.230.116.98 -> 172.31.8.238 TCP 4410 [TCP segment of a reassembled PDU]
141   0.018953 172.31.8.238 -> 54.230.116.98 TCP 66 39998 > http [ACK] Seq=97 Ack=869258 Win=1430656 Len=0 TSval=15064039 TSecr=1684990629
142   0.019179 54.230.116.98 -> 172.31.8.238 TCP 18890 [TCP segment of a reassembled PDU]
143   0.019191 172.31.8.238 -> 54.230.116.98 TCP 66 39998 > http [ACK] Seq=97 Ack=888082 Win=1446784 Len=0 TSval=15064039 TSecr=1684990629
144   0.019325 54.230.116.98 -> 172.31.8.238 TCP 33370 [TCP segment of a reassembled PDU]
145   0.019341 172.31.8.238 -> 54.230.116.98 TCP 66 39998 > http [ACK] Seq=97 Ack=921386 Win=1422976 Len=0 TSval=15064039 TSecr=1684990629
146   0.019354 54.230.116.98 -> 172.31.8.238 TCP 13098 [TCP segment of a reassembled PDU]
147   0.019361 172.31.8.238 -> 54.230.116.98 TCP 66 39998 > http [ACK] Seq=97 Ack=934418 Win=1410048 Len=0 TSval=15064039 TSecr=1684990629
148   0.019671 54.230.116.98 -> 172.31.8.238 TCP 26130 [TCP segment of a reassembled PDU]
149   0.019685 172.31.8.238 -> 54.230.116.98 TCP 66 39998 > http [ACK] Seq=97 Ack=960482 Win=1434880 Len=0 TSval=15064039 TSecr=1684990629
150   0.019715 54.230.116.98 -> 172.31.8.238 TCP 13098 [TCP segment of a reassembled PDU]
151   0.019731 172.31.8.238 -> 54.230.116.98 TCP 66 39998 > http [ACK] Seq=97 Ack=973514 Win=1456384 Len=0 TSval=15064039 TSecr=1684990629
152   0.019929 54.230.116.98 -> 172.31.8.238 TCP 23234 [TCP segment of a reassembled PDU]
153   0.019953 54.230.116.98 -> 172.31.8.238 TCP 2962 [TCP segment of a reassembled PDU]
154   0.019962 172.31.8.238 -> 54.230.116.98 TCP 66 39998 > http [ACK] Seq=97 Ack=999578 Win=1434752 Len=0 TSval=15064039 TSecr=1684990629
155   0.020346 54.230.116.98 -> 172.31.8.238 TCP 7306 [TCP segment of a reassembled PDU]
156   0.020353 172.31.8.238 -> 54.230.116.98 TCP 66 39998 > http [ACK] Seq=97 Ack=1006818 Win=1465856 Len=0 TSval=15064039 TSecr=1684990629
157   0.020505 54.230.116.98 -> 172.31.8.238 TCP 26130 [TCP segment of a reassembled PDU]
158   0.020530 172.31.8.238 -> 54.230.116.98 TCP 66 39998 > http [ACK] Seq=97 Ack=1032882 Win=1439872 Len=0 TSval=15064039 TSecr=1684990629
159   0.020555 54.230.116.98 -> 172.31.8.238 HTTP 16218 HTTP/1.1 200 OK  (application/octet-stream)
160   0.020564 172.31.8.238 -> 54.230.116.98 TCP 66 39998 > http [ACK] Seq=97 Ack=1049034 Win=1449088 Len=0 TSval=15064039 TSecr=1684990629
161   0.020704 172.31.8.238 -> 54.230.116.98 TCP 66 39998 > http [FIN, ACK] Seq=97 Ack=1049034 Win=1469056 Len=0 TSval=15064039 TSecr=1684990629
162   0.021289 54.230.116.98 -> 172.31.8.238 TCP 66 http > 39998 [FIN, ACK] Seq=1049034 Ack=98 Win=14592 Len=0 TSval=1684990630 TSecr=15064039
163   0.021297 172.31.8.238 -> 54.230.116.98 TCP 66 39998 > http [ACK] Seq=98 Ack=1049035 Win=1469056 Len=0 TSval=15064039 TSecr=1684990630
