[Measurement for 1mb at 23:43:18 19.43.2014] 
Tshark:

  1   0.000000 172.31.8.238 -> 172.31.0.2   DNS 89 Standard query 0x6ef5  A d1n0gskdvzj94j.cloudfront.net
  2   0.000027 172.31.8.238 -> 172.31.0.2   DNS 89 Standard query 0xfef1  AAAA d1n0gskdvzj94j.cloudfront.net
  3   0.000675   172.31.0.2 -> 172.31.8.238 DNS 217 Standard query response 0x6ef5  A 54.230.118.138 A 54.230.119.110 A 54.230.119.189 A 54.239.132.86 A 54.192.118.236 A 54.192.118.240 A 54.230.116.154 A 54.230.117.86
  4   0.000687   172.31.0.2 -> 172.31.8.238 DNS 176 Standard query response 0xfef1 
  5   0.003865 172.31.8.238 -> 54.230.118.138 TCP 74 58495 > http [SYN] Seq=0 Win=26883 Len=0 MSS=8961 SACK_PERM=1 TSval=6056471 TSecr=0 WS=128
  6   0.004598 54.230.118.138 -> 172.31.8.238 TCP 74 http > 58495 [SYN, ACK] Seq=0 Ack=1 Win=14480 Len=0 MSS=1460 SACK_PERM=1 TSval=1683712755 TSecr=6056471 WS=128
  7   0.004612 172.31.8.238 -> 54.230.118.138 TCP 66 58495 > http [ACK] Seq=1 Ack=1 Win=27008 Len=0 TSval=6056471 TSecr=1683712755
  8   0.004651 172.31.8.238 -> 54.230.118.138 HTTP 162 GET /1mb HTTP/1.1 
  9   0.005297 54.230.118.138 -> 172.31.8.238 TCP 66 http > 58495 [ACK] Seq=1 Ack=97 Win=14592 Len=0 TSval=1683712755 TSecr=6056471
 10   0.007350 54.230.118.138 -> 172.31.8.238 TCP 523 [TCP segment of a reassembled PDU]
 11   0.007357 172.31.8.238 -> 54.230.118.138 TCP 66 58495 > http [ACK] Seq=97 Ack=458 Win=28032 Len=0 TSval=6056472 TSecr=1683712755
 12   0.007462 54.230.118.138 -> 172.31.8.238 TCP 13098 [TCP segment of a reassembled PDU]
 13   0.007473 172.31.8.238 -> 54.230.118.138 TCP 66 58495 > http [ACK] Seq=97 Ack=13490 Win=54144 Len=0 TSval=6056472 TSecr=1683712755
 14   0.008249 54.230.118.138 -> 172.31.8.238 TCP 8754 [TCP segment of a reassembled PDU]
 15   0.008258 172.31.8.238 -> 54.230.118.138 TCP 66 58495 > http [ACK] Seq=97 Ack=22178 Win=71424 Len=0 TSval=6056472 TSecr=1683712756
 16   0.008343 54.230.118.138 -> 172.31.8.238 TCP 4410 [TCP segment of a reassembled PDU]
 17   0.008349 172.31.8.238 -> 54.230.118.138 TCP 66 58495 > http [ACK] Seq=97 Ack=26522 Win=80128 Len=0 TSval=6056472 TSecr=1683712756
 18   0.009022 54.230.118.138 -> 172.31.8.238 TCP 10202 [TCP segment of a reassembled PDU]
 19   0.009030 172.31.8.238 -> 54.230.118.138 TCP 66 58495 > http [ACK] Seq=97 Ack=36658 Win=100480 Len=0 TSval=6056472 TSecr=1683712756
 20   0.009130 54.230.118.138 -> 172.31.8.238 TCP 10202 [TCP segment of a reassembled PDU]
 21   0.009138 172.31.8.238 -> 54.230.118.138 TCP 66 58495 > http [ACK] Seq=97 Ack=46794 Win=101248 Len=0 TSval=6056472 TSecr=1683712756
 22   0.009779 54.230.118.138 -> 172.31.8.238 TCP 5858 [TCP segment of a reassembled PDU]
 23   0.009786 172.31.8.238 -> 54.230.118.138 TCP 66 58495 > http [ACK] Seq=97 Ack=52586 Win=108416 Len=0 TSval=6056472 TSecr=1683712756
 24   0.009882 54.230.118.138 -> 172.31.8.238 TCP 13098 [TCP segment of a reassembled PDU]
 25   0.009891 172.31.8.238 -> 54.230.118.138 TCP 66 58495 > http [ACK] Seq=97 Ack=65618 Win=96512 Len=0 TSval=6056472 TSecr=1683712756
 26   0.010279 54.230.118.138 -> 172.31.8.238 TCP 5858 [TCP segment of a reassembled PDU]
 27   0.010297 172.31.8.238 -> 54.230.118.138 TCP 66 58495 > http [ACK] Seq=97 Ack=71410 Win=108416 Len=0 TSval=6056472 TSecr=1683712756
 28   0.010383 54.230.118.138 -> 172.31.8.238 TCP 5858 [TCP segment of a reassembled PDU]
 29   0.010389 172.31.8.238 -> 54.230.118.138 TCP 66 58495 > http [ACK] Seq=97 Ack=77202 Win=108416 Len=0 TSval=6056472 TSecr=1683712756
 30   0.010481 54.230.118.138 -> 172.31.8.238 TCP 14546 [TCP segment of a reassembled PDU]
 31   0.010490 172.31.8.238 -> 54.230.118.138 TCP 66 58495 > http [ACK] Seq=97 Ack=91682 Win=94080 Len=0 TSval=6056472 TSecr=1683712756
 32   0.011051 54.230.118.138 -> 172.31.8.238 TCP 4410 [TCP segment of a reassembled PDU]
 33   0.011057 172.31.8.238 -> 54.230.118.138 TCP 66 58495 > http [ACK] Seq=97 Ack=96026 Win=109056 Len=0 TSval=6056473 TSecr=1683712756
 34   0.011160 54.230.118.138 -> 172.31.8.238 TCP 21786 [TCP segment of a reassembled PDU]
 35   0.011171 172.31.8.238 -> 54.230.118.138 TCP 66 58495 > http [ACK] Seq=97 Ack=117746 Win=152448 Len=0 TSval=6056473 TSecr=1683712756
 36   0.011650 54.230.118.138 -> 172.31.8.238 TCP 2962 [TCP segment of a reassembled PDU]
 37   0.011655 172.31.8.238 -> 54.230.118.138 TCP 66 58495 > http [ACK] Seq=97 Ack=120642 Win=158336 Len=0 TSval=6056473 TSecr=1683712756
 38   0.011771 54.230.118.138 -> 172.31.8.238 TCP 23234 [TCP segment of a reassembled PDU]
 39   0.011783 172.31.8.238 -> 54.230.118.138 TCP 66 58495 > http [ACK] Seq=97 Ack=143810 Win=204672 Len=0 TSval=6056473 TSecr=1683712756
 40   0.012321 54.230.118.138 -> 172.31.8.238 TCP 4410 [TCP segment of a reassembled PDU]
 41   0.012328 172.31.8.238 -> 54.230.118.138 TCP 66 58495 > http [ACK] Seq=97 Ack=148154 Win=213376 Len=0 TSval=6056473 TSecr=1683712756
 42   0.012447 54.230.118.138 -> 172.31.8.238 TCP 21786 [TCP segment of a reassembled PDU]
 43   0.012458 172.31.8.238 -> 54.230.118.138 TCP 66 58495 > http [ACK] Seq=97 Ack=169874 Win=256768 Len=0 TSval=6056473 TSecr=1683712756
 44   0.013138 54.230.118.138 -> 172.31.8.238 TCP 11650 [TCP segment of a reassembled PDU]
 45   0.013146 172.31.8.238 -> 54.230.118.138 TCP 66 58495 > http [ACK] Seq=97 Ack=181458 Win=279936 Len=0 TSval=6056473 TSecr=1683712756
 46   0.013238 54.230.118.138 -> 172.31.8.238 TCP 14546 [TCP segment of a reassembled PDU]
 47   0.013247 172.31.8.238 -> 54.230.118.138 TCP 66 58495 > http [ACK] Seq=97 Ack=195938 Win=308864 Len=0 TSval=6056473 TSecr=1683712756
 48   0.013345 54.230.118.138 -> 172.31.8.238 TCP 13098 [TCP segment of a reassembled PDU]
 49   0.013352 172.31.8.238 -> 54.230.118.138 TCP 66 58495 > http [ACK] Seq=97 Ack=208970 Win=334976 Len=0 TSval=6056473 TSecr=1683712756
 50   0.013891 54.230.118.138 -> 172.31.8.238 TCP 10202 [TCP segment of a reassembled PDU]
 51   0.013898 172.31.8.238 -> 54.230.118.138 TCP 66 58495 > http [ACK] Seq=97 Ack=219106 Win=355200 Len=0 TSval=6056473 TSecr=1683712756
 52   0.014015 54.230.118.138 -> 172.31.8.238 TCP 18890 [TCP segment of a reassembled PDU]
 53   0.014026 172.31.8.238 -> 54.230.118.138 TCP 66 58495 > http [ACK] Seq=97 Ack=237930 Win=392832 Len=0 TSval=6056473 TSecr=1683712756
 54   0.014188 54.230.118.138 -> 172.31.8.238 TCP 7306 [TCP segment of a reassembled PDU]
 55   0.014195 172.31.8.238 -> 54.230.118.138 TCP 66 58495 > http [ACK] Seq=97 Ack=245170 Win=407296 Len=0 TSval=6056473 TSecr=1683712756
 56   0.014641 54.230.118.138 -> 172.31.8.238 TCP 8754 [TCP segment of a reassembled PDU]
 57   0.014649 172.31.8.238 -> 54.230.118.138 TCP 66 58495 > http [ACK] Seq=97 Ack=253858 Win=424704 Len=0 TSval=6056473 TSecr=1683712756
 58   0.014818 54.230.118.138 -> 172.31.8.238 TCP 26130 [TCP segment of a reassembled PDU]
 59   0.014831 172.31.8.238 -> 54.230.118.138 TCP 66 58495 > http [ACK] Seq=97 Ack=279922 Win=476800 Len=0 TSval=6056473 TSecr=1683712756
 60   0.014838 54.230.118.138 -> 172.31.8.238 TCP 4410 [TCP segment of a reassembled PDU]
 61   0.014842 172.31.8.238 -> 54.230.118.138 TCP 66 58495 > http [ACK] Seq=97 Ack=284266 Win=485504 Len=0 TSval=6056473 TSecr=1683712756
 62   0.015412 54.230.118.138 -> 172.31.8.238 TCP 8754 [TCP segment of a reassembled PDU]
 63   0.015420 172.31.8.238 -> 54.230.118.138 TCP 66 58495 > http [ACK] Seq=97 Ack=292954 Win=502912 Len=0 TSval=6056474 TSecr=1683712756
 64   0.015586 54.230.118.138 -> 172.31.8.238 TCP 26130 [TCP segment of a reassembled PDU]
 65   0.015599 172.31.8.238 -> 54.230.118.138 TCP 66 58495 > http [ACK] Seq=97 Ack=319018 Win=555008 Len=0 TSval=6056474 TSecr=1683712756
 66   0.015633 54.230.118.138 -> 172.31.8.238 TCP 11650 [TCP segment of a reassembled PDU]
 67   0.015643 172.31.8.238 -> 54.230.118.138 TCP 66 58495 > http [ACK] Seq=97 Ack=330602 Win=578176 Len=0 TSval=6056474 TSecr=1683712756
 68   0.016167 54.230.118.138 -> 172.31.8.238 TCP 7306 [TCP segment of a reassembled PDU]
 69   0.016173 172.31.8.238 -> 54.230.118.138 TCP 66 58495 > http [ACK] Seq=97 Ack=337842 Win=592640 Len=0 TSval=6056474 TSecr=1683712756
 70   0.016334 54.230.118.138 -> 172.31.8.238 TCP 17442 [TCP segment of a reassembled PDU]
 71   0.016344 172.31.8.238 -> 54.230.118.138 TCP 66 58495 > http [ACK] Seq=97 Ack=355218 Win=627456 Len=0 TSval=6056474 TSecr=1683712756
 72   0.016397 54.230.118.138 -> 172.31.8.238 TCP 18890 [TCP segment of a reassembled PDU]
 73   0.016409 172.31.8.238 -> 54.230.118.138 TCP 66 58495 > http [ACK] Seq=97 Ack=374042 Win=665088 Len=0 TSval=6056474 TSecr=1683712756
 74   0.016815 54.230.118.138 -> 172.31.8.238 TCP 21786 [TCP segment of a reassembled PDU]
 75   0.016828 172.31.8.238 -> 54.230.118.138 TCP 66 58495 > http [ACK] Seq=97 Ack=395762 Win=708480 Len=0 TSval=6056474 TSecr=1683712756
 76   0.016942 54.230.118.138 -> 172.31.8.238 TCP 5858 [TCP segment of a reassembled PDU]
 77   0.016948 172.31.8.238 -> 54.230.118.138 TCP 66 58495 > http [ACK] Seq=97 Ack=401554 Win=720128 Len=0 TSval=6056474 TSecr=1683712756
 78   0.017181 54.230.118.138 -> 172.31.8.238 TCP 4410 [TCP segment of a reassembled PDU]
 79   0.017187 172.31.8.238 -> 54.230.118.138 TCP 66 58495 > http [ACK] Seq=97 Ack=405898 Win=728832 Len=0 TSval=6056474 TSecr=1683712756
 80   0.017381 54.230.118.138 -> 172.31.8.238 TCP 26130 [TCP segment of a reassembled PDU]
 81   0.017394 172.31.8.238 -> 54.230.118.138 TCP 66 58495 > http [ACK] Seq=97 Ack=431962 Win=780928 Len=0 TSval=6056474 TSecr=1683712756
 82   0.017401 54.230.118.138 -> 172.31.8.238 TCP 2962 [TCP segment of a reassembled PDU]
 83   0.017404 172.31.8.238 -> 54.230.118.138 TCP 66 58495 > http [ACK] Seq=97 Ack=434858 Win=786688 Len=0 TSval=6056474 TSecr=1683712756
 84   0.017563 54.230.118.138 -> 172.31.8.238 TCP 20338 [TCP segment of a reassembled PDU]
 85   0.017575 172.31.8.238 -> 54.230.118.138 TCP 66 58495 > http [ACK] Seq=97 Ack=455130 Win=827264 Len=0 TSval=6056474 TSecr=1683712757
 86   0.018003 54.230.118.138 -> 172.31.8.238 TCP 17442 [TCP segment of a reassembled PDU]
 87   0.018014 172.31.8.238 -> 54.230.118.138 TCP 66 58495 > http [ACK] Seq=97 Ack=472506 Win=862080 Len=0 TSval=6056474 TSecr=1683712757
 88   0.018147 54.230.118.138 -> 172.31.8.238 TCP 26130 [TCP segment of a reassembled PDU]
 89   0.018161 172.31.8.238 -> 54.230.118.138 TCP 66 58495 > http [ACK] Seq=97 Ack=498570 Win=914176 Len=0 TSval=6056474 TSecr=1683712757
 90   0.018265 54.230.118.138 -> 172.31.8.238 TCP 10202 [TCP segment of a reassembled PDU]
 91   0.018273 172.31.8.238 -> 54.230.118.138 TCP 66 58495 > http [ACK] Seq=97 Ack=508706 Win=934400 Len=0 TSval=6056474 TSecr=1683712757
 92   0.018374 54.230.118.138 -> 172.31.8.238 TCP 11650 [TCP segment of a reassembled PDU]
 93   0.018381 172.31.8.238 -> 54.230.118.138 TCP 66 58495 > http [ACK] Seq=97 Ack=520290 Win=957568 Len=0 TSval=6056474 TSecr=1683712757
 94   0.018725 54.230.118.138 -> 172.31.8.238 TCP 4410 [TCP segment of a reassembled PDU]
 95   0.018731 172.31.8.238 -> 54.230.118.138 TCP 66 58495 > http [ACK] Seq=97 Ack=524634 Win=966272 Len=0 TSval=6056474 TSecr=1683712757
 96   0.018917 54.230.118.138 -> 172.31.8.238 TCP 26130 [TCP segment of a reassembled PDU]
 97   0.018930 172.31.8.238 -> 54.230.118.138 TCP 66 58495 > http [ACK] Seq=97 Ack=550698 Win=1018368 Len=0 TSval=6056474 TSecr=1683712757
 98   0.018984 54.230.118.138 -> 172.31.8.238 TCP 20338 [TCP segment of a reassembled PDU]
 99   0.018996 172.31.8.238 -> 54.230.118.138 TCP 66 58495 > http [ACK] Seq=97 Ack=570970 Win=1047936 Len=0 TSval=6056474 TSecr=1683712757
100   0.019066 54.230.118.138 -> 172.31.8.238 TCP 14546 [TCP segment of a reassembled PDU]
101   0.019077 172.31.8.238 -> 54.230.118.138 TCP 66 58495 > http [ACK] Seq=97 Ack=585450 Win=1057408 Len=0 TSval=6056475 TSecr=1683712757
102   0.019762 54.230.118.138 -> 172.31.8.238 TCP 5858 [TCP segment of a reassembled PDU]
103   0.019770 172.31.8.238 -> 54.230.118.138 TCP 66 58495 > http [ACK] Seq=97 Ack=591242 Win=1070592 Len=0 TSval=6056475 TSecr=1683712757
104   0.019942 54.230.118.138 -> 172.31.8.238 TCP 26130 [TCP segment of a reassembled PDU]
105   0.019956 172.31.8.238 -> 54.230.118.138 TCP 66 58495 > http [ACK] Seq=97 Ack=617306 Win=1044608 Len=0 TSval=6056475 TSecr=1683712757
106   0.020014 54.230.118.138 -> 172.31.8.238 TCP 26130 [TCP segment of a reassembled PDU]
107   0.020026 172.31.8.238 -> 54.230.118.138 TCP 66 58495 > http [ACK] Seq=97 Ack=643370 Win=1038464 Len=0 TSval=6056475 TSecr=1683712757
108   0.020071 54.230.118.138 -> 172.31.8.238 TCP 7306 [TCP segment of a reassembled PDU]
109   0.020077 172.31.8.238 -> 54.230.118.138 TCP 66 58495 > http [ACK] Seq=97 Ack=650610 Win=1031296 Len=0 TSval=6056475 TSecr=1683712757
110   0.020635 54.230.118.138 -> 172.31.8.238 TCP 7306 [TCP segment of a reassembled PDU]
111   0.020643 172.31.8.238 -> 54.230.118.138 TCP 66 58495 > http [ACK] Seq=97 Ack=657850 Win=1069312 Len=0 TSval=6056475 TSecr=1683712757
112   0.020844 54.230.118.138 -> 172.31.8.238 TCP 21786 [TCP segment of a reassembled PDU]
113   0.020874 172.31.8.238 -> 54.230.118.138 TCP 66 58495 > http [ACK] Seq=97 Ack=679570 Win=1047680 Len=0 TSval=6056475 TSecr=1683712757
114   0.020900 54.230.118.138 -> 172.31.8.238 TCP 4410 [TCP segment of a reassembled PDU]
115   0.020905 172.31.8.238 -> 54.230.118.138 TCP 66 58495 > http [ACK] Seq=97 Ack=683914 Win=1043456 Len=0 TSval=6056475 TSecr=1683712757
116   0.021007 54.230.118.138 -> 172.31.8.238 TCP 31922 [TCP segment of a reassembled PDU]
117   0.021023 172.31.8.238 -> 54.230.118.138 TCP 66 58495 > http [ACK] Seq=97 Ack=715770 Win=1028864 Len=0 TSval=6056475 TSecr=1683712757
118   0.021463 54.230.118.138 -> 172.31.8.238 TCP 26130 [TCP segment of a reassembled PDU]
119   0.021477 172.31.8.238 -> 54.230.118.138 TCP 66 58495 > http [ACK] Seq=97 Ack=741834 Win=1038464 Len=0 TSval=6056475 TSecr=1683712757
120   0.021501 54.230.118.138 -> 172.31.8.238 TCP 4410 [TCP segment of a reassembled PDU]
121   0.021514 172.31.8.238 -> 54.230.118.138 TCP 66 58495 > http [ACK] Seq=97 Ack=746178 Win=1070592 Len=0 TSval=6056475 TSecr=1683712757
122   0.021945 54.230.118.138 -> 172.31.8.238 TCP 26130 [TCP segment of a reassembled PDU]
123   0.021973 54.230.118.138 -> 172.31.8.238 TCP 8754 [TCP segment of a reassembled PDU]
124   0.021986 172.31.8.238 -> 54.230.118.138 TCP 66 58495 > http [ACK] Seq=97 Ack=780930 Win=1035904 Len=0 TSval=6056475 TSecr=1683712757
125   0.022358 54.230.118.138 -> 172.31.8.238 TCP 8754 [TCP segment of a reassembled PDU]
126   0.022367 172.31.8.238 -> 54.230.118.138 TCP 66 58495 > http [ACK] Seq=97 Ack=789618 Win=1067008 Len=0 TSval=6056475 TSecr=1683712757
127   0.022542 54.230.118.138 -> 172.31.8.238 TCP 26130 [TCP segment of a reassembled PDU]
128   0.022572 172.31.8.238 -> 54.230.118.138 TCP 66 58495 > http [ACK] Seq=97 Ack=815682 Win=1041024 Len=0 TSval=6056475 TSecr=1683712757
129   0.022616 54.230.118.138 -> 172.31.8.238 TCP 23234 [TCP segment of a reassembled PDU]
130   0.022628 172.31.8.238 -> 54.230.118.138 TCP 66 58495 > http [ACK] Seq=97 Ack=838850 Win=1043200 Len=0 TSval=6056475 TSecr=1683712757
131   0.022671 54.230.118.138 -> 172.31.8.238 TCP 4410 [TCP segment of a reassembled PDU]
132   0.022690 172.31.8.238 -> 54.230.118.138 TCP 66 58495 > http [ACK] Seq=97 Ack=843194 Win=1074048 Len=0 TSval=6056475 TSecr=1683712757
133   0.022745 54.230.118.138 -> 172.31.8.238 TCP 1514 [TCP Previous segment not captured] [TCP segment of a reassembled PDU]
134   0.022751 172.31.8.238 -> 54.230.118.138 TCP 78 [TCP Window Update] 58495 > http [ACK] Seq=97 Ack=843194 Win=1074176 Len=0 TSval=6056475 TSecr=1683712757 SLE=844642 SRE=846090
135   0.022808 54.230.118.138 -> 172.31.8.238 TCP 1514 [TCP Out-Of-Order] [TCP segment of a reassembled PDU]
136   0.022814 172.31.8.238 -> 54.230.118.138 TCP 66 58495 > http [ACK] Seq=97 Ack=846090 Win=1074176 Len=0 TSval=6056475 TSecr=1683712757
137   0.023086 54.230.118.138 -> 172.31.8.238 TCP 10202 [TCP segment of a reassembled PDU]
138   0.023095 172.31.8.238 -> 54.230.118.138 TCP 66 58495 > http [ACK] Seq=97 Ack=856226 Win=1064576 Len=0 TSval=6056476 TSecr=1683712757
139   0.023261 54.230.118.138 -> 172.31.8.238 TCP 26130 [TCP segment of a reassembled PDU]
140   0.023275 172.31.8.238 -> 54.230.118.138 TCP 66 58495 > http [ACK] Seq=97 Ack=882290 Win=1038592 Len=0 TSval=6056476 TSecr=1683712757
141   0.023339 54.230.118.138 -> 172.31.8.238 TCP 18890 [TCP segment of a reassembled PDU]
142   0.023350 172.31.8.238 -> 54.230.118.138 TCP 66 58495 > http [ACK] Seq=97 Ack=901114 Win=1050240 Len=0 TSval=6056476 TSecr=1683712757
143   0.023441 54.230.118.138 -> 172.31.8.238 TCP 33370 [TCP segment of a reassembled PDU]
144   0.023458 172.31.8.238 -> 54.230.118.138 TCP 66 58495 > http [ACK] Seq=97 Ack=934418 Win=1026432 Len=0 TSval=6056476 TSecr=1683712757
145   0.023506 54.230.118.138 -> 172.31.8.238 TCP 13098 [TCP segment of a reassembled PDU]
146   0.023515 172.31.8.238 -> 54.230.118.138 TCP 66 58495 > http [ACK] Seq=97 Ack=947450 Win=1059840 Len=0 TSval=6056476 TSecr=1683712757
147   0.024016 54.230.118.138 -> 172.31.8.238 TCP 10202 [TCP segment of a reassembled PDU]
148   0.024024 172.31.8.238 -> 54.230.118.138 TCP 66 58495 > http [ACK] Seq=97 Ack=957586 Win=1064576 Len=0 TSval=6056476 TSecr=1683712757
149   0.024190 54.230.118.138 -> 172.31.8.238 TCP 26130 [TCP segment of a reassembled PDU]
150   0.024204 172.31.8.238 -> 54.230.118.138 TCP 66 58495 > http [ACK] Seq=97 Ack=983650 Win=1038592 Len=0 TSval=6056476 TSecr=1683712757
151   0.024265 54.230.118.138 -> 172.31.8.238 TCP 26130 [TCP segment of a reassembled PDU]
152   0.024279 172.31.8.238 -> 54.230.118.138 TCP 66 58495 > http [ACK] Seq=97 Ack=1009714 Win=1038464 Len=0 TSval=6056476 TSecr=1683712757
153   0.024353 54.230.118.138 -> 172.31.8.238 TCP 26130 [TCP segment of a reassembled PDU]
154   0.024368 172.31.8.238 -> 54.230.118.138 TCP 66 58495 > http [ACK] Seq=97 Ack=1035778 Win=1012480 Len=0 TSval=6056476 TSecr=1683712757
155   0.024406 54.230.118.138 -> 172.31.8.238 TCP 5858 [TCP segment of a reassembled PDU]
156   0.024423 172.31.8.238 -> 54.230.118.138 TCP 66 58495 > http [ACK] Seq=97 Ack=1041570 Win=1006720 Len=0 TSval=6056476 TSecr=1683712757
157   0.024822 54.230.118.138 -> 172.31.8.238 HTTP 7530 HTTP/1.1 200 OK  (application/octet-stream)
158   0.024830 172.31.8.238 -> 54.230.118.138 TCP 66 58495 > http [ACK] Seq=97 Ack=1049034 Win=1067008 Len=0 TSval=6056476 TSecr=1683712757
159   0.024991 172.31.8.238 -> 54.230.118.138 TCP 66 58495 > http [FIN, ACK] Seq=97 Ack=1049034 Win=1074176 Len=0 TSval=6056476 TSecr=1683712757
160   0.025464 54.230.118.138 -> 172.31.8.238 TCP 66 http > 58495 [FIN, ACK] Seq=1049034 Ack=98 Win=14592 Len=0 TSval=1683712757 TSecr=6056476
161   0.025472 172.31.8.238 -> 54.230.118.138 TCP 66 58495 > http [ACK] Seq=98 Ack=1049035 Win=1074176 Len=0 TSval=6056476 TSecr=1683712757
