[Measurement for 1mb at 08:43:19 20.43.2014] 
Tshark:

  1   0.000000 172.31.8.238 -> 172.31.0.2   DNS 89 Standard query 0xd11e  A d1n0gskdvzj94j.cloudfront.net
  2   0.000027 172.31.8.238 -> 172.31.0.2   DNS 89 Standard query 0xd02d  AAAA d1n0gskdvzj94j.cloudfront.net
  3   0.000552   172.31.0.2 -> 172.31.8.238 DNS 176 Standard query response 0xd02d 
  4   0.000565   172.31.0.2 -> 172.31.8.238 DNS 217 Standard query response 0xd11e  A 54.239.132.196 A 54.230.116.53 A 54.230.116.154 A 54.230.118.138 A 54.230.118.214 A 54.230.119.3 A 54.230.119.189 A 54.239.132.98
  5   0.003899 172.31.8.238 -> 54.239.132.196 TCP 74 35184 > http [SYN] Seq=0 Win=26883 Len=0 MSS=8961 SACK_PERM=1 TSval=14156713 TSecr=0 WS=128
  6   0.004476 54.239.132.196 -> 172.31.8.238 TCP 74 http > 35184 [SYN, ACK] Seq=0 Ack=1 Win=14480 Len=0 MSS=1460 SACK_PERM=1 TSval=1686952891 TSecr=14156713 WS=128
  7   0.004490 172.31.8.238 -> 54.239.132.196 TCP 66 35184 > http [ACK] Seq=1 Ack=1 Win=27008 Len=0 TSval=14156713 TSecr=1686952891
  8   0.004530 172.31.8.238 -> 54.239.132.196 HTTP 162 GET /1mb HTTP/1.1 
  9   0.004973 54.239.132.196 -> 172.31.8.238 TCP 66 http > 35184 [ACK] Seq=1 Ack=97 Win=14592 Len=0 TSval=1686952892 TSecr=14156713
 10   0.007066 54.239.132.196 -> 172.31.8.238 TCP 10202 [TCP segment of a reassembled PDU]
 11   0.007077 172.31.8.238 -> 54.239.132.196 TCP 66 35184 > http [ACK] Seq=97 Ack=10137 Win=47232 Len=0 TSval=14156713 TSecr=1686952892
 12   0.007128 54.239.132.196 -> 172.31.8.238 TCP 2962 [TCP segment of a reassembled PDU]
 13   0.007135 172.31.8.238 -> 54.239.132.196 TCP 66 35184 > http [ACK] Seq=97 Ack=13033 Win=52992 Len=0 TSval=14156713 TSecr=1686952892
 14   0.009179 54.239.132.196 -> 172.31.8.238 TCP 13098 [TCP segment of a reassembled PDU]
 15   0.009190 172.31.8.238 -> 54.239.132.196 TCP 66 35184 > http [ACK] Seq=97 Ack=26065 Win=79104 Len=0 TSval=14156714 TSecr=1686952892
 16   0.010056 54.239.132.196 -> 172.31.8.238 TCP 10202 [TCP segment of a reassembled PDU]
 17   0.010065 172.31.8.238 -> 54.239.132.196 TCP 66 35184 > http [ACK] Seq=97 Ack=36201 Win=99328 Len=0 TSval=14156714 TSecr=1686952892
 18   0.010205 54.239.132.196 -> 172.31.8.238 TCP 2962 [TCP segment of a reassembled PDU]
 19   0.010210 172.31.8.238 -> 54.239.132.196 TCP 66 35184 > http [ACK] Seq=97 Ack=39097 Win=105088 Len=0 TSval=14156714 TSecr=1686952892
 20   0.010785 54.239.132.196 -> 172.31.8.238 TCP 11650 [TCP segment of a reassembled PDU]
 21   0.010794 172.31.8.238 -> 54.239.132.196 TCP 66 35184 > http [ACK] Seq=97 Ack=50681 Win=98944 Len=0 TSval=14156714 TSecr=1686952892
 22   0.010946 54.239.132.196 -> 172.31.8.238 TCP 1514 [TCP segment of a reassembled PDU]
 23   0.010951 172.31.8.238 -> 54.239.132.196 TCP 66 35184 > http [ACK] Seq=97 Ack=52129 Win=108032 Len=0 TSval=14156714 TSecr=1686952892
 24   0.011012 54.239.132.196 -> 172.31.8.238 TCP 4410 [TCP segment of a reassembled PDU]
 25   0.011019 172.31.8.238 -> 54.239.132.196 TCP 66 35184 > http [ACK] Seq=97 Ack=56473 Win=109056 Len=0 TSval=14156714 TSecr=1686952892
 26   0.011078 54.239.132.196 -> 172.31.8.238 TCP 4410 [TCP segment of a reassembled PDU]
 27   0.011084 172.31.8.238 -> 54.239.132.196 TCP 66 35184 > http [ACK] Seq=97 Ack=60817 Win=109056 Len=0 TSval=14156714 TSecr=1686952892
 28   0.011568 54.239.132.196 -> 172.31.8.238 TCP 4410 [TCP segment of a reassembled PDU]
 29   0.011573 172.31.8.238 -> 54.239.132.196 TCP 66 35184 > http [ACK] Seq=97 Ack=65161 Win=109056 Len=0 TSval=14156715 TSecr=1686952892
 30   0.011721 54.239.132.196 -> 172.31.8.238 TCP 8754 [TCP segment of a reassembled PDU]
 31   0.011728 172.31.8.238 -> 54.239.132.196 TCP 66 35184 > http [ACK] Seq=97 Ack=73849 Win=126464 Len=0 TSval=14156715 TSecr=1686952892
 32   0.011784 54.239.132.196 -> 172.31.8.238 TCP 5858 [TCP segment of a reassembled PDU]
 33   0.011791 172.31.8.238 -> 54.239.132.196 TCP 66 35184 > http [ACK] Seq=97 Ack=79641 Win=137984 Len=0 TSval=14156715 TSecr=1686952892
 34   0.011857 54.239.132.196 -> 172.31.8.238 TCP 8754 [TCP segment of a reassembled PDU]
 35   0.011864 172.31.8.238 -> 54.239.132.196 TCP 66 35184 > http [ACK] Seq=97 Ack=88329 Win=155392 Len=0 TSval=14156715 TSecr=1686952892
 36   0.012815 54.239.132.196 -> 172.31.8.238 TCP 33370 [TCP segment of a reassembled PDU]
 37   0.012832 172.31.8.238 -> 54.239.132.196 TCP 66 35184 > http [ACK] Seq=97 Ack=121633 Win=221952 Len=0 TSval=14156715 TSecr=1686952892
 38   0.013572 54.239.132.196 -> 172.31.8.238 TCP 8754 [TCP segment of a reassembled PDU]
 39   0.013580 172.31.8.238 -> 54.239.132.196 TCP 66 35184 > http [ACK] Seq=97 Ack=130321 Win=239360 Len=0 TSval=14156715 TSecr=1686952892
 40   0.013775 54.239.132.196 -> 172.31.8.238 TCP 20338 [TCP segment of a reassembled PDU]
 41   0.013787 172.31.8.238 -> 54.239.132.196 TCP 66 35184 > http [ACK] Seq=97 Ack=150593 Win=279936 Len=0 TSval=14156715 TSecr=1686952892
 42   0.013804 54.239.132.196 -> 172.31.8.238 TCP 5858 [TCP segment of a reassembled PDU]
 43   0.013809 172.31.8.238 -> 54.239.132.196 TCP 66 35184 > http [ACK] Seq=97 Ack=156385 Win=276096 Len=0 TSval=14156715 TSecr=1686952892
 44   0.014338 54.239.132.196 -> 172.31.8.238 TCP 13098 [TCP segment of a reassembled PDU]
 45   0.014348 172.31.8.238 -> 54.239.132.196 TCP 66 35184 > http [ACK] Seq=97 Ack=169417 Win=306048 Len=0 TSval=14156715 TSecr=1686952892
 46   0.014446 54.239.132.196 -> 172.31.8.238 TCP 13098 [TCP segment of a reassembled PDU]
 47   0.014454 172.31.8.238 -> 54.239.132.196 TCP 66 35184 > http [ACK] Seq=97 Ack=182449 Win=312064 Len=0 TSval=14156715 TSecr=1686952892
 48   0.014649 54.239.132.196 -> 172.31.8.238 TCP 13098 [TCP segment of a reassembled PDU]
 49   0.014658 172.31.8.238 -> 54.239.132.196 TCP 66 35184 > http [ACK] Seq=97 Ack=195481 Win=312064 Len=0 TSval=14156715 TSecr=1686952892
 50   0.015098 54.239.132.196 -> 172.31.8.238 TCP 7306 [TCP segment of a reassembled PDU]
 51   0.015105 172.31.8.238 -> 54.239.132.196 TCP 66 35184 > http [ACK] Seq=97 Ack=202721 Win=321536 Len=0 TSval=14156715 TSecr=1686952893
 52   0.015250 54.239.132.196 -> 172.31.8.238 TCP 21786 [TCP segment of a reassembled PDU]
 53   0.015274 172.31.8.238 -> 54.239.132.196 TCP 66 35184 > http [ACK] Seq=97 Ack=224441 Win=299904 Len=0 TSval=14156715 TSecr=1686952893
 54   0.015443 54.239.132.196 -> 172.31.8.238 TCP 14546 [TCP segment of a reassembled PDU]
 55   0.015453 172.31.8.238 -> 54.239.132.196 TCP 66 35184 > http [ACK] Seq=97 Ack=238921 Win=309504 Len=0 TSval=14156716 TSecr=1686952893
 56   0.015892 54.239.132.196 -> 172.31.8.238 TCP 7306 [TCP segment of a reassembled PDU]
 57   0.015899 172.31.8.238 -> 54.239.132.196 TCP 66 35184 > http [ACK] Seq=97 Ack=246161 Win=346496 Len=0 TSval=14156716 TSecr=1686952893
 58   0.016079 54.239.132.196 -> 172.31.8.238 TCP 15994 [TCP segment of a reassembled PDU]
 59   0.016089 172.31.8.238 -> 54.239.132.196 TCP 66 35184 > http [ACK] Seq=97 Ack=262089 Win=378368 Len=0 TSval=14156716 TSecr=1686952893
 60   0.016394 54.239.132.196 -> 172.31.8.238 TCP 4410 [TCP segment of a reassembled PDU]
 61   0.016401 172.31.8.238 -> 54.239.132.196 TCP 66 35184 > http [ACK] Seq=97 Ack=266433 Win=387072 Len=0 TSval=14156716 TSecr=1686952893
 62   0.016565 54.239.132.196 -> 172.31.8.238 TCP 20338 [TCP segment of a reassembled PDU]
 63   0.016576 172.31.8.238 -> 54.239.132.196 TCP 66 35184 > http [ACK] Seq=97 Ack=286705 Win=427648 Len=0 TSval=14156716 TSecr=1686952893
 64   0.016861 54.239.132.196 -> 172.31.8.238 TCP 1514 [TCP segment of a reassembled PDU]
 65   0.016866 172.31.8.238 -> 54.239.132.196 TCP 66 35184 > http [ACK] Seq=97 Ack=288153 Win=430464 Len=0 TSval=14156716 TSecr=1686952893
 66   0.017054 54.239.132.196 -> 172.31.8.238 TCP 26130 [TCP segment of a reassembled PDU]
 67   0.017067 172.31.8.238 -> 54.239.132.196 TCP 66 35184 > http [ACK] Seq=97 Ack=314217 Win=482688 Len=0 TSval=14156716 TSecr=1686952893
 68   0.017140 54.239.132.196 -> 172.31.8.238 TCP 26130 [TCP segment of a reassembled PDU]
 69   0.017153 172.31.8.238 -> 54.239.132.196 TCP 66 35184 > http [ACK] Seq=97 Ack=340281 Win=534784 Len=0 TSval=14156716 TSecr=1686952893
 70   0.017674 54.239.132.196 -> 172.31.8.238 TCP 8754 [TCP segment of a reassembled PDU]
 71   0.017683 172.31.8.238 -> 54.239.132.196 TCP 66 35184 > http [ACK] Seq=97 Ack=348969 Win=552192 Len=0 TSval=14156716 TSecr=1686952893
 72   0.017831 54.239.132.196 -> 172.31.8.238 TCP 20338 [TCP segment of a reassembled PDU]
 73   0.017842 172.31.8.238 -> 54.239.132.196 TCP 66 35184 > http [ACK] Seq=97 Ack=369241 Win=592640 Len=0 TSval=14156716 TSecr=1686952893
 74   0.018073 54.239.132.196 -> 172.31.8.238 TCP 26130 [TCP segment of a reassembled PDU]
 75   0.018087 172.31.8.238 -> 54.239.132.196 TCP 66 35184 > http [ACK] Seq=97 Ack=395305 Win=644864 Len=0 TSval=14156716 TSecr=1686952893
 76   0.018109 54.239.132.196 -> 172.31.8.238 TCP 2962 [TCP segment of a reassembled PDU]
 77   0.018116 172.31.8.238 -> 54.239.132.196 TCP 66 35184 > http [ACK] Seq=97 Ack=398201 Win=650624 Len=0 TSval=14156716 TSecr=1686952893
 78   0.018493 54.239.132.196 -> 172.31.8.238 TCP 18890 [TCP segment of a reassembled PDU]
 79   0.018505 172.31.8.238 -> 54.239.132.196 TCP 66 35184 > http [ACK] Seq=97 Ack=417025 Win=688256 Len=0 TSval=14156716 TSecr=1686952893
 80   0.018629 54.239.132.196 -> 172.31.8.238 TCP 13098 [TCP segment of a reassembled PDU]
 81   0.018639 172.31.8.238 -> 54.239.132.196 TCP 66 35184 > http [ACK] Seq=97 Ack=430057 Win=714368 Len=0 TSval=14156716 TSecr=1686952893
 82   0.018760 54.239.132.196 -> 172.31.8.238 TCP 17442 [TCP segment of a reassembled PDU]
 83   0.018771 172.31.8.238 -> 54.239.132.196 TCP 66 35184 > http [ACK] Seq=97 Ack=447433 Win=749056 Len=0 TSval=14156716 TSecr=1686952893
 84   0.018877 54.239.132.196 -> 172.31.8.238 TCP 10202 [TCP segment of a reassembled PDU]
 85   0.018885 172.31.8.238 -> 54.239.132.196 TCP 66 35184 > http [ACK] Seq=97 Ack=457569 Win=769408 Len=0 TSval=14156716 TSecr=1686952893
 86   0.019332 54.239.132.196 -> 172.31.8.238 TCP 21786 [TCP segment of a reassembled PDU]
 87   0.019344 172.31.8.238 -> 54.239.132.196 TCP 66 35184 > http [ACK] Seq=97 Ack=479289 Win=812800 Len=0 TSval=14156716 TSecr=1686952893
 88   0.019358 54.239.132.196 -> 172.31.8.238 TCP 2962 [TCP segment of a reassembled PDU]
 89   0.019364 172.31.8.238 -> 54.239.132.196 TCP 66 35184 > http [ACK] Seq=97 Ack=482185 Win=818560 Len=0 TSval=14156716 TSecr=1686952893
 90   0.019443 54.239.132.196 -> 172.31.8.238 TCP 2962 [TCP segment of a reassembled PDU]
 91   0.019449 172.31.8.238 -> 54.239.132.196 TCP 66 35184 > http [ACK] Seq=97 Ack=485081 Win=824320 Len=0 TSval=14156717 TSecr=1686952893
 92   0.019631 54.239.132.196 -> 172.31.8.238 TCP 26130 [TCP segment of a reassembled PDU]
 93   0.019646 172.31.8.238 -> 54.239.132.196 TCP 66 35184 > http [ACK] Seq=97 Ack=511145 Win=876544 Len=0 TSval=14156717 TSecr=1686952893
 94   0.019694 54.239.132.196 -> 172.31.8.238 TCP 15994 [TCP segment of a reassembled PDU]
 95   0.019704 172.31.8.238 -> 54.239.132.196 TCP 66 35184 > http [ACK] Seq=97 Ack=527073 Win=908416 Len=0 TSval=14156717 TSecr=1686952893
 96   0.020214 54.239.132.196 -> 172.31.8.238 TCP 5858 [TCP segment of a reassembled PDU]
 97   0.020222 172.31.8.238 -> 54.239.132.196 TCP 66 35184 > http [ACK] Seq=97 Ack=532865 Win=919936 Len=0 TSval=14156717 TSecr=1686952893
 98   0.020387 54.239.132.196 -> 172.31.8.238 TCP 21786 [TCP segment of a reassembled PDU]
 99   0.020400 172.31.8.238 -> 54.239.132.196 TCP 66 35184 > http [ACK] Seq=97 Ack=554585 Win=946432 Len=0 TSval=14156717 TSecr=1686952893
100   0.020532 54.239.132.196 -> 172.31.8.238 TCP 26130 [TCP segment of a reassembled PDU]
101   0.020550 54.239.132.196 -> 172.31.8.238 TCP 8754 [TCP segment of a reassembled PDU]
102   0.020573 54.239.132.196 -> 172.31.8.238 TCP 14546 [TCP segment of a reassembled PDU]
103   0.020587 172.31.8.238 -> 54.239.132.196 TCP 66 35184 > http [ACK] Seq=97 Ack=603817 Win=901120 Len=0 TSval=14156717 TSecr=1686952893
104   0.020982 54.239.132.196 -> 172.31.8.238 TCP 5858 [TCP segment of a reassembled PDU]
105   0.020989 172.31.8.238 -> 54.239.132.196 TCP 66 35184 > http [ACK] Seq=97 Ack=609609 Win=972672 Len=0 TSval=14156717 TSecr=1686952893
106   0.021141 54.239.132.196 -> 172.31.8.238 TCP 20338 [TCP segment of a reassembled PDU]
107   0.021169 172.31.8.238 -> 54.239.132.196 TCP 66 35184 > http [ACK] Seq=97 Ack=629881 Win=952448 Len=0 TSval=14156717 TSecr=1686952893
108   0.021255 54.239.132.196 -> 172.31.8.238 TCP 4410 [TCP segment of a reassembled PDU]
109   0.021261 172.31.8.238 -> 54.239.132.196 TCP 66 35184 > http [ACK] Seq=97 Ack=634225 Win=974976 Len=0 TSval=14156717 TSecr=1686952893
110   0.021420 54.239.132.196 -> 172.31.8.238 TCP 26130 [TCP segment of a reassembled PDU]
111   0.021447 172.31.8.238 -> 54.239.132.196 TCP 66 35184 > http [ACK] Seq=97 Ack=660289 Win=948992 Len=0 TSval=14156717 TSecr=1686952893
112   0.021496 54.239.132.196 -> 172.31.8.238 TCP 24682 [TCP segment of a reassembled PDU]
113   0.021522 172.31.8.238 -> 54.239.132.196 TCP 66 35184 > http [ACK] Seq=97 Ack=684905 Win=941696 Len=0 TSval=14156717 TSecr=1686952893
114   0.021790 54.239.132.196 -> 172.31.8.238 TCP 10202 [TCP segment of a reassembled PDU]
115   0.021798 172.31.8.238 -> 54.239.132.196 TCP 66 35184 > http [ACK] Seq=97 Ack=695041 Win=965504 Len=0 TSval=14156717 TSecr=1686952893
116   0.022114 54.239.132.196 -> 172.31.8.238 TCP 26130 [TCP segment of a reassembled PDU]
117   0.022140 172.31.8.238 -> 54.239.132.196 TCP 66 35184 > http [ACK] Seq=97 Ack=721105 Win=939520 Len=0 TSval=14156717 TSecr=1686952893
118   0.022204 54.239.132.196 -> 172.31.8.238 TCP 26130 [TCP segment of a reassembled PDU]
119   0.022232 172.31.8.238 -> 54.239.132.196 TCP 66 35184 > http [ACK] Seq=97 Ack=747169 Win=939392 Len=0 TSval=14156717 TSecr=1686952893
120   0.022273 54.239.132.196 -> 172.31.8.238 TCP 13098 [TCP segment of a reassembled PDU]
121   0.022282 172.31.8.238 -> 54.239.132.196 TCP 66 35184 > http [ACK] Seq=97 Ack=760201 Win=960768 Len=0 TSval=14156717 TSecr=1686952893
122   0.022878 54.239.132.196 -> 172.31.8.238 TCP 1514 [TCP segment of a reassembled PDU]
123   0.023014 54.239.132.196 -> 172.31.8.238 TCP 15994 [TCP segment of a reassembled PDU]
124   0.023037 172.31.8.238 -> 54.239.132.196 TCP 66 35184 > http [ACK] Seq=97 Ack=777577 Win=981504 Len=0 TSval=14156717 TSecr=1686952893
125   0.023123 54.239.132.196 -> 172.31.8.238 TCP 1514 [TCP Previous segment not captured] [TCP segment of a reassembled PDU]
126   0.023128 172.31.8.238 -> 54.239.132.196 TCP 78 [TCP Dup ACK 124#1] 35184 > http [ACK] Seq=97 Ack=777577 Win=981504 Len=0 TSval=14156717 TSecr=1686952893 SLE=779025 SRE=780473
127   0.023133 54.239.132.196 -> 172.31.8.238 TCP 1514 [TCP Out-Of-Order] [TCP segment of a reassembled PDU]
128   0.023137 172.31.8.238 -> 54.239.132.196 TCP 66 35184 > http [ACK] Seq=97 Ack=780473 Win=978688 Len=0 TSval=14156717 TSecr=1686952893
129   0.023371 54.239.132.196 -> 172.31.8.238 TCP 29026 [TCP segment of a reassembled PDU]
130   0.023386 172.31.8.238 -> 54.239.132.196 TCP 66 35184 > http [ACK] Seq=97 Ack=809433 Win=949760 Len=0 TSval=14156717 TSecr=1686952893
131   0.023422 54.239.132.196 -> 172.31.8.238 TCP 15994 [TCP segment of a reassembled PDU]
132   0.023435 172.31.8.238 -> 54.239.132.196 TCP 66 35184 > http [ACK] Seq=97 Ack=825361 Win=955904 Len=0 TSval=14156717 TSecr=1686952893
133   0.023849 54.239.132.196 -> 172.31.8.238 TCP 2962 [TCP segment of a reassembled PDU]
134   0.023854 172.31.8.238 -> 54.239.132.196 TCP 66 35184 > http [ACK] Seq=97 Ack=828257 Win=977408 Len=0 TSval=14156718 TSecr=1686952893
135   0.024026 54.239.132.196 -> 172.31.8.238 TCP 26130 [TCP segment of a reassembled PDU]
136   0.024040 172.31.8.238 -> 54.239.132.196 TCP 66 35184 > http [ACK] Seq=97 Ack=854321 Win=1033600 Len=0 TSval=14156718 TSecr=1686952893
137   0.024096 54.239.132.196 -> 172.31.8.238 TCP 17442 [TCP segment of a reassembled PDU]
138   0.024109 172.31.8.238 -> 54.239.132.196 TCP 66 35184 > http [ACK] Seq=97 Ack=871697 Win=1068288 Len=0 TSval=14156718 TSecr=1686952893
139   0.024254 54.239.132.196 -> 172.31.8.238 TCP 18890 [TCP segment of a reassembled PDU]
140   0.024263 172.31.8.238 -> 54.239.132.196 TCP 66 35184 > http [ACK] Seq=97 Ack=890521 Win=1106048 Len=0 TSval=14156718 TSecr=1686952893
141   0.024283 54.239.132.196 -> 172.31.8.238 TCP 26130 [TCP segment of a reassembled PDU]
142   0.024299 172.31.8.238 -> 54.239.132.196 TCP 66 35184 > http [ACK] Seq=97 Ack=916585 Win=1149952 Len=0 TSval=14156718 TSecr=1686952893
143   0.024309 54.239.132.196 -> 172.31.8.238 TCP 8754 [TCP segment of a reassembled PDU]
144   0.024314 172.31.8.238 -> 54.239.132.196 TCP 66 35184 > http [ACK] Seq=97 Ack=925273 Win=1141376 Len=0 TSval=14156718 TSecr=1686952893
145   0.024890 54.239.132.196 -> 172.31.8.238 TCP 2962 [TCP segment of a reassembled PDU]
146   0.024897 172.31.8.238 -> 54.239.132.196 TCP 66 35184 > http [ACK] Seq=97 Ack=928169 Win=1163904 Len=0 TSval=14156718 TSecr=1686952893
147   0.025069 54.239.132.196 -> 172.31.8.238 TCP 26130 [TCP segment of a reassembled PDU]
148   0.025083 172.31.8.238 -> 54.239.132.196 TCP 66 35184 > http [ACK] Seq=97 Ack=954233 Win=1209600 Len=0 TSval=14156718 TSecr=1686952893
149   0.025090 54.239.132.196 -> 172.31.8.238 TCP 1514 [TCP segment of a reassembled PDU]
150   0.025092 172.31.8.238 -> 54.239.132.196 TCP 66 35184 > http [ACK] Seq=97 Ack=955681 Win=1208192 Len=0 TSval=14156718 TSecr=1686952893
151   0.025264 54.239.132.196 -> 172.31.8.238 TCP 26130 [TCP segment of a reassembled PDU]
152   0.025279 172.31.8.238 -> 54.239.132.196 TCP 66 35184 > http [ACK] Seq=97 Ack=981745 Win=1209600 Len=0 TSval=14156718 TSecr=1686952894
153   0.025287 54.239.132.196 -> 172.31.8.238 TCP 5858 [TCP segment of a reassembled PDU]
154   0.025292 172.31.8.238 -> 54.239.132.196 TCP 66 35184 > http [ACK] Seq=97 Ack=987537 Win=1203840 Len=0 TSval=14156718 TSecr=1686952894
155   0.025335 54.239.132.196 -> 172.31.8.238 TCP 20338 [TCP segment of a reassembled PDU]
156   0.025346 172.31.8.238 -> 54.239.132.196 TCP 66 35184 > http [ACK] Seq=97 Ack=1007809 Win=1219072 Len=0 TSval=14156718 TSecr=1686952894
157   0.025465 54.239.132.196 -> 172.31.8.238 TCP 13098 [TCP segment of a reassembled PDU]
158   0.025473 172.31.8.238 -> 54.239.132.196 TCP 66 35184 > http [ACK] Seq=97 Ack=1020841 Win=1206144 Len=0 TSval=14156718 TSecr=1686952894
159   0.025802 54.239.132.196 -> 172.31.8.238 TCP 23234 [TCP segment of a reassembled PDU]
160   0.025815 172.31.8.238 -> 54.239.132.196 TCP 66 35184 > http [ACK] Seq=97 Ack=1044009 Win=1214336 Len=0 TSval=14156718 TSecr=1686952894
161   0.025891 54.239.132.196 -> 172.31.8.238 HTTP 5091 HTTP/1.1 200 OK  (application/octet-stream)
162   0.025898 172.31.8.238 -> 54.239.132.196 TCP 66 35184 > http [ACK] Seq=97 Ack=1049034 Win=1242880 Len=0 TSval=14156718 TSecr=1686952894
163   0.026056 172.31.8.238 -> 54.239.132.196 TCP 66 35184 > http [FIN, ACK] Seq=97 Ack=1049034 Win=1244416 Len=0 TSval=14156718 TSecr=1686952894
164   0.026666 54.239.132.196 -> 172.31.8.238 TCP 66 http > 35184 [FIN, ACK] Seq=1049034 Ack=98 Win=14592 Len=0 TSval=1686952894 TSecr=14156718
165   0.026674 172.31.8.238 -> 54.239.132.196 TCP 66 35184 > http [ACK] Seq=98 Ack=1049035 Win=1244416 Len=0 TSval=14156718 TSecr=1686952894
