[Measurement for 1mb at 12:43:18 20.43.2014] 
Tshark:

  1   0.000000 172.31.8.238 -> 172.31.0.2   DNS 89 Standard query 0xb4b2  A d1n0gskdvzj94j.cloudfront.net
  2   0.000028 172.31.8.238 -> 172.31.0.2   DNS 89 Standard query 0xd348  AAAA d1n0gskdvzj94j.cloudfront.net
  3   0.000710   172.31.0.2 -> 172.31.8.238 DNS 176 Standard query response 0xd348 
  4   0.000720   172.31.0.2 -> 172.31.8.238 DNS 217 Standard query response 0xb4b2  A 54.230.117.154 A 54.230.117.238 A 54.230.118.114 A 54.239.132.41 A 54.239.132.98 A 54.239.132.173 A 54.230.117.37 A 54.230.117.42
  5   0.003853 172.31.8.238 -> 54.230.117.154 TCP 74 42485 > http [SYN] Seq=0 Win=26883 Len=0 MSS=8961 SACK_PERM=1 TSval=17756639 TSecr=0 WS=128
  6   0.004504 54.230.117.154 -> 172.31.8.238 TCP 74 http > 42485 [SYN, ACK] Seq=0 Ack=1 Win=14480 Len=0 MSS=1460 SACK_PERM=1 TSval=1686848481 TSecr=17756639 WS=128
  7   0.004518 172.31.8.238 -> 54.230.117.154 TCP 66 42485 > http [ACK] Seq=1 Ack=1 Win=27008 Len=0 TSval=17756639 TSecr=1686848481
  8   0.004557 172.31.8.238 -> 54.230.117.154 HTTP 162 GET /1mb HTTP/1.1 
  9   0.005032 54.230.117.154 -> 172.31.8.238 TCP 66 http > 42485 [ACK] Seq=1 Ack=97 Win=14592 Len=0 TSval=1686848481 TSecr=17756639
 10   0.006850 54.230.117.154 -> 172.31.8.238 TCP 4410 [TCP segment of a reassembled PDU]
 11   0.006858 172.31.8.238 -> 54.230.117.154 TCP 66 42485 > http [ACK] Seq=97 Ack=4345 Win=35584 Len=0 TSval=17756640 TSecr=1686848481
 12   0.006980 54.230.117.154 -> 172.31.8.238 TCP 8754 [TCP segment of a reassembled PDU]
 13   0.006989 172.31.8.238 -> 54.230.117.154 TCP 66 42485 > http [ACK] Seq=97 Ack=13033 Win=52992 Len=0 TSval=17756640 TSecr=1686848481
 14   0.007360 54.230.117.154 -> 172.31.8.238 TCP 4410 [TCP segment of a reassembled PDU]
 15   0.007367 172.31.8.238 -> 54.230.117.154 TCP 66 42485 > http [ACK] Seq=97 Ack=17377 Win=61696 Len=0 TSval=17756640 TSecr=1686848481
 16   0.007471 54.230.117.154 -> 172.31.8.238 TCP 2962 [TCP segment of a reassembled PDU]
 17   0.007477 172.31.8.238 -> 54.230.117.154 TCP 66 42485 > http [ACK] Seq=97 Ack=20273 Win=67456 Len=0 TSval=17756640 TSecr=1686848481
 18   0.007640 54.230.117.154 -> 172.31.8.238 TCP 4410 [TCP segment of a reassembled PDU]
 19   0.007646 172.31.8.238 -> 54.230.117.154 TCP 66 42485 > http [ACK] Seq=97 Ack=24617 Win=76160 Len=0 TSval=17756640 TSecr=1686848481
 20   0.007727 54.230.117.154 -> 172.31.8.238 TCP 1514 [TCP segment of a reassembled PDU]
 21   0.007732 172.31.8.238 -> 54.230.117.154 TCP 66 42485 > http [ACK] Seq=97 Ack=26065 Win=79104 Len=0 TSval=17756640 TSecr=1686848481
 22   0.007921 54.230.117.154 -> 172.31.8.238 TCP 13098 [TCP segment of a reassembled PDU]
 23   0.007931 172.31.8.238 -> 54.230.117.154 TCP 66 42485 > http [ACK] Seq=97 Ack=39097 Win=96512 Len=0 TSval=17756640 TSecr=1686848481
 24   0.008174 54.230.117.154 -> 172.31.8.238 TCP 7306 [TCP segment of a reassembled PDU]
 25   0.008181 172.31.8.238 -> 54.230.117.154 TCP 66 42485 > http [ACK] Seq=97 Ack=46337 Win=105984 Len=0 TSval=17756640 TSecr=1686848481
 26   0.008416 54.230.117.154 -> 172.31.8.238 TCP 14546 [TCP segment of a reassembled PDU]
 27   0.008426 172.31.8.238 -> 54.230.117.154 TCP 66 42485 > http [ACK] Seq=97 Ack=60817 Win=94080 Len=0 TSval=17756640 TSecr=1686848481
 28   0.008453 54.230.117.154 -> 172.31.8.238 TCP 2962 [TCP segment of a reassembled PDU]
 29   0.008458 172.31.8.238 -> 54.230.117.154 TCP 66 42485 > http [ACK] Seq=97 Ack=63713 Win=109056 Len=0 TSval=17756640 TSecr=1686848481
 30   0.008633 54.230.117.154 -> 172.31.8.238 TCP 1514 [TCP segment of a reassembled PDU]
 31   0.008638 172.31.8.238 -> 54.230.117.154 TCP 66 42485 > http [ACK] Seq=97 Ack=65161 Win=109056 Len=0 TSval=17756640 TSecr=1686848481
 32   0.008899 54.230.117.154 -> 172.31.8.238 TCP 2962 [TCP segment of a reassembled PDU]
 33   0.008905 172.31.8.238 -> 54.230.117.154 TCP 66 42485 > http [ACK] Seq=97 Ack=68057 Win=109056 Len=0 TSval=17756641 TSecr=1686848481
 34   0.009048 54.230.117.154 -> 172.31.8.238 TCP 20338 [TCP segment of a reassembled PDU]
 35   0.009061 172.31.8.238 -> 54.230.117.154 TCP 66 42485 > http [ACK] Seq=97 Ack=88329 Win=149632 Len=0 TSval=17756641 TSecr=1686848481
 36   0.009427 54.230.117.154 -> 172.31.8.238 TCP 4410 [TCP segment of a reassembled PDU]
 37   0.009433 172.31.8.238 -> 54.230.117.154 TCP 66 42485 > http [ACK] Seq=97 Ack=92673 Win=158336 Len=0 TSval=17756641 TSecr=1686848481
 38   0.009529 54.230.117.154 -> 172.31.8.238 TCP 7306 [TCP segment of a reassembled PDU]
 39   0.009535 172.31.8.238 -> 54.230.117.154 TCP 66 42485 > http [ACK] Seq=97 Ack=99913 Win=172800 Len=0 TSval=17756641 TSecr=1686848481
 40   0.009758 54.230.117.154 -> 172.31.8.238 TCP 21786 [TCP segment of a reassembled PDU]
 41   0.009771 172.31.8.238 -> 54.230.117.154 TCP 66 42485 > http [ACK] Seq=97 Ack=121633 Win=216192 Len=0 TSval=17756641 TSecr=1686848481
 42   0.010229 54.230.117.154 -> 172.31.8.238 TCP 8754 [TCP segment of a reassembled PDU]
 43   0.010237 172.31.8.238 -> 54.230.117.154 TCP 66 42485 > http [ACK] Seq=97 Ack=130321 Win=233600 Len=0 TSval=17756641 TSecr=1686848481
 44   0.010349 54.230.117.154 -> 172.31.8.238 TCP 20338 [TCP segment of a reassembled PDU]
 45   0.010360 172.31.8.238 -> 54.230.117.154 TCP 66 42485 > http [ACK] Seq=97 Ack=150593 Win=274176 Len=0 TSval=17756641 TSecr=1686848481
 46   0.010375 54.230.117.154 -> 172.31.8.238 TCP 5858 [TCP segment of a reassembled PDU]
 47   0.010380 172.31.8.238 -> 54.230.117.154 TCP 66 42485 > http [ACK] Seq=97 Ack=156385 Win=285696 Len=0 TSval=17756641 TSecr=1686848481
 48   0.010718 54.230.117.154 -> 172.31.8.238 TCP 5858 [TCP segment of a reassembled PDU]
 49   0.010726 172.31.8.238 -> 54.230.117.154 TCP 66 42485 > http [ACK] Seq=97 Ack=162177 Win=297344 Len=0 TSval=17756641 TSecr=1686848481
 50   0.010812 54.230.117.154 -> 172.31.8.238 TCP 7306 [TCP segment of a reassembled PDU]
 51   0.010819 172.31.8.238 -> 54.230.117.154 TCP 66 42485 > http [ACK] Seq=97 Ack=169417 Win=311808 Len=0 TSval=17756641 TSecr=1686848481
 52   0.011072 54.230.117.154 -> 172.31.8.238 TCP 13098 [TCP segment of a reassembled PDU]
 53   0.011081 172.31.8.238 -> 54.230.117.154 TCP 66 42485 > http [ACK] Seq=97 Ack=182449 Win=337792 Len=0 TSval=17756641 TSecr=1686848481
 54   0.011200 54.230.117.154 -> 172.31.8.238 TCP 15994 [TCP segment of a reassembled PDU]
 55   0.011210 172.31.8.238 -> 54.230.117.154 TCP 66 42485 > http [ACK] Seq=97 Ack=198377 Win=369664 Len=0 TSval=17756641 TSecr=1686848481
 56   0.011219 54.230.117.154 -> 172.31.8.238 TCP 5858 [TCP segment of a reassembled PDU]
 57   0.011224 172.31.8.238 -> 54.230.117.154 TCP 66 42485 > http [ACK] Seq=97 Ack=204169 Win=381312 Len=0 TSval=17756641 TSecr=1686848481
 58   0.011378 54.230.117.154 -> 172.31.8.238 TCP 4410 [TCP segment of a reassembled PDU]
 59   0.011384 172.31.8.238 -> 54.230.117.154 TCP 66 42485 > http [ACK] Seq=97 Ack=208513 Win=390016 Len=0 TSval=17756641 TSecr=1686848481
 60   0.011775 54.230.117.154 -> 172.31.8.238 TCP 20338 [TCP segment of a reassembled PDU]
 61   0.011786 172.31.8.238 -> 54.230.117.154 TCP 66 42485 > http [ACK] Seq=97 Ack=228785 Win=430464 Len=0 TSval=17756641 TSecr=1686848481
 62   0.012010 54.230.117.154 -> 172.31.8.238 TCP 17442 [TCP segment of a reassembled PDU]
 63   0.012020 172.31.8.238 -> 54.230.117.154 TCP 66 42485 > http [ACK] Seq=97 Ack=246161 Win=465280 Len=0 TSval=17756641 TSecr=1686848481
 64   0.012403 54.230.117.154 -> 172.31.8.238 TCP 26130 [TCP segment of a reassembled PDU]
 65   0.012417 172.31.8.238 -> 54.230.117.154 TCP 66 42485 > http [ACK] Seq=97 Ack=272225 Win=497792 Len=0 TSval=17756641 TSecr=1686848481
 66   0.012446 54.230.117.154 -> 172.31.8.238 TCP 8754 [TCP segment of a reassembled PDU]
 67   0.012452 172.31.8.238 -> 54.230.117.154 TCP 66 42485 > http [ACK] Seq=97 Ack=280913 Win=489216 Len=0 TSval=17756641 TSecr=1686848481
 68   0.012509 54.230.117.154 -> 172.31.8.238 TCP 4410 [TCP segment of a reassembled PDU]
 69   0.012515 172.31.8.238 -> 54.230.117.154 TCP 66 42485 > http [ACK] Seq=97 Ack=285257 Win=484992 Len=0 TSval=17756641 TSecr=1686848481
 70   0.012670 54.230.117.154 -> 172.31.8.238 TCP 14546 [TCP segment of a reassembled PDU]
 71   0.012680 172.31.8.238 -> 54.230.117.154 TCP 66 42485 > http [ACK] Seq=97 Ack=299737 Win=470528 Len=0 TSval=17756641 TSecr=1686848481
 72   0.013014 54.230.117.154 -> 172.31.8.238 TCP 4410 [TCP segment of a reassembled PDU]
 73   0.013021 172.31.8.238 -> 54.230.117.154 TCP 66 42485 > http [ACK] Seq=97 Ack=304081 Win=526080 Len=0 TSval=17756642 TSecr=1686848482
 74   0.013223 54.230.117.154 -> 172.31.8.238 TCP 26130 [TCP segment of a reassembled PDU]
 75   0.013237 172.31.8.238 -> 54.230.117.154 TCP 66 42485 > http [ACK] Seq=97 Ack=330145 Win=578176 Len=0 TSval=17756642 TSecr=1686848482
 76   0.013317 54.230.117.154 -> 172.31.8.238 TCP 26130 [TCP segment of a reassembled PDU]
 77   0.013331 172.31.8.238 -> 54.230.117.154 TCP 66 42485 > http [ACK] Seq=97 Ack=356209 Win=630400 Len=0 TSval=17756642 TSecr=1686848482
 78   0.013377 54.230.117.154 -> 172.31.8.238 TCP 2962 [TCP segment of a reassembled PDU]
 79   0.013383 172.31.8.238 -> 54.230.117.154 TCP 66 42485 > http [ACK] Seq=97 Ack=359105 Win=636160 Len=0 TSval=17756642 TSecr=1686848482
 80   0.013556 54.230.117.154 -> 172.31.8.238 TCP 5858 [TCP segment of a reassembled PDU]
 81   0.013563 172.31.8.238 -> 54.230.117.154 TCP 66 42485 > http [ACK] Seq=97 Ack=364897 Win=647680 Len=0 TSval=17756642 TSecr=1686848482
 82   0.013784 54.230.117.154 -> 172.31.8.238 TCP 2962 [TCP segment of a reassembled PDU]
 83   0.013789 172.31.8.238 -> 54.230.117.154 TCP 66 42485 > http [ACK] Seq=97 Ack=367793 Win=653568 Len=0 TSval=17756642 TSecr=1686848482
 84   0.013973 54.230.117.154 -> 172.31.8.238 TCP 26130 [TCP segment of a reassembled PDU]
 85   0.013988 172.31.8.238 -> 54.230.117.154 TCP 66 42485 > http [ACK] Seq=97 Ack=393857 Win=705664 Len=0 TSval=17756642 TSecr=1686848482
 86   0.014068 54.230.117.154 -> 172.31.8.238 TCP 24682 [TCP segment of a reassembled PDU]
 87   0.014080 172.31.8.238 -> 54.230.117.154 TCP 66 42485 > http [ACK] Seq=97 Ack=418473 Win=754816 Len=0 TSval=17756642 TSecr=1686848482
 88   0.014127 54.230.117.154 -> 172.31.8.238 TCP 1514 [TCP segment of a reassembled PDU]
 89   0.014131 172.31.8.238 -> 54.230.117.154 TCP 66 42485 > http [ACK] Seq=97 Ack=419921 Win=757760 Len=0 TSval=17756642 TSecr=1686848482
 90   0.014191 54.230.117.154 -> 172.31.8.238 TCP 10202 [TCP segment of a reassembled PDU]
 91   0.014198 172.31.8.238 -> 54.230.117.154 TCP 66 42485 > http [ACK] Seq=97 Ack=430057 Win=777984 Len=0 TSval=17756642 TSecr=1686848482
 92   0.014689 54.230.117.154 -> 172.31.8.238 TCP 26130 [TCP segment of a reassembled PDU]
 93   0.014703 172.31.8.238 -> 54.230.117.154 TCP 66 42485 > http [ACK] Seq=97 Ack=456121 Win=830208 Len=0 TSval=17756642 TSecr=1686848482
 94   0.014768 54.230.117.154 -> 172.31.8.238 TCP 24682 [TCP segment of a reassembled PDU]
 95   0.014781 172.31.8.238 -> 54.230.117.154 TCP 66 42485 > http [ACK] Seq=97 Ack=480737 Win=879360 Len=0 TSval=17756642 TSecr=1686848482
 96   0.014813 54.230.117.154 -> 172.31.8.238 TCP 1514 [TCP segment of a reassembled PDU]
 97   0.014829 172.31.8.238 -> 54.230.117.154 TCP 66 42485 > http [ACK] Seq=97 Ack=482185 Win=882304 Len=0 TSval=17756642 TSecr=1686848482
 98   0.014906 54.230.117.154 -> 172.31.8.238 TCP 13098 [TCP segment of a reassembled PDU]
 99   0.014915 172.31.8.238 -> 54.230.117.154 TCP 66 42485 > http [ACK] Seq=97 Ack=495217 Win=908416 Len=0 TSval=17756642 TSecr=1686848482
100   0.015337 54.230.117.154 -> 172.31.8.238 TCP 8754 [TCP segment of a reassembled PDU]
101   0.015344 172.31.8.238 -> 54.230.117.154 TCP 66 42485 > http [ACK] Seq=97 Ack=503905 Win=925696 Len=0 TSval=17756642 TSecr=1686848482
102   0.015480 54.230.117.154 -> 172.31.8.238 TCP 26130 [TCP segment of a reassembled PDU]
103   0.015493 172.31.8.238 -> 54.230.117.154 TCP 66 42485 > http [ACK] Seq=97 Ack=529969 Win=977920 Len=0 TSval=17756642 TSecr=1686848482
104   0.015620 54.230.117.154 -> 172.31.8.238 TCP 30474 [TCP segment of a reassembled PDU]
105   0.015635 172.31.8.238 -> 54.230.117.154 TCP 66 42485 > http [ACK] Seq=97 Ack=560377 Win=1038720 Len=0 TSval=17756642 TSecr=1686848482
106   0.016087 54.230.117.154 -> 172.31.8.238 TCP 2962 [TCP segment of a reassembled PDU]
107   0.016093 172.31.8.238 -> 54.230.117.154 TCP 66 42485 > http [ACK] Seq=97 Ack=563273 Win=1044480 Len=0 TSval=17756642 TSecr=1686848482
108   0.016276 54.230.117.154 -> 172.31.8.238 TCP 26130 [TCP segment of a reassembled PDU]
109   0.016289 172.31.8.238 -> 54.230.117.154 TCP 66 42485 > http [ACK] Seq=97 Ack=589337 Win=1096576 Len=0 TSval=17756642 TSecr=1686848482
110   0.016426 54.230.117.154 -> 172.31.8.238 TCP 26130 [TCP segment of a reassembled PDU]
111   0.016440 172.31.8.238 -> 54.230.117.154 TCP 66 42485 > http [ACK] Seq=97 Ack=615401 Win=1148672 Len=0 TSval=17756642 TSecr=1686848482
112   0.016449 54.230.117.154 -> 172.31.8.238 TCP 10202 [TCP segment of a reassembled PDU]
113   0.016455 172.31.8.238 -> 54.230.117.154 TCP 66 42485 > http [ACK] Seq=97 Ack=625537 Win=1169024 Len=0 TSval=17756642 TSecr=1686848482
114   0.016930 54.230.117.154 -> 172.31.8.238 TCP 11650 [TCP segment of a reassembled PDU]
115   0.016940 172.31.8.238 -> 54.230.117.154 TCP 66 42485 > http [ACK] Seq=97 Ack=637121 Win=1192192 Len=0 TSval=17756643 TSecr=1686848482
116   0.017080 54.230.117.154 -> 172.31.8.238 TCP 26130 [TCP segment of a reassembled PDU]
117   0.017106 172.31.8.238 -> 54.230.117.154 TCP 66 42485 > http [ACK] Seq=97 Ack=663185 Win=1191680 Len=0 TSval=17756643 TSecr=1686848482
118   0.017163 54.230.117.154 -> 172.31.8.238 TCP 26130 [TCP segment of a reassembled PDU]
119   0.017177 172.31.8.238 -> 54.230.117.154 TCP 66 42485 > http [ACK] Seq=97 Ack=689249 Win=1191680 Len=0 TSval=17756643 TSecr=1686848482
120   0.017210 54.230.117.154 -> 172.31.8.238 TCP 1514 [TCP segment of a reassembled PDU]
121   0.017214 172.31.8.238 -> 54.230.117.154 TCP 66 42485 > http [ACK] Seq=97 Ack=690697 Win=1195008 Len=0 TSval=17756643 TSecr=1686848482
122   0.017389 54.230.117.154 -> 172.31.8.238 TCP 5858 [TCP segment of a reassembled PDU]
123   0.017395 172.31.8.238 -> 54.230.117.154 TCP 66 42485 > http [ACK] Seq=97 Ack=696489 Win=1206656 Len=0 TSval=17756643 TSecr=1686848482
124   0.017574 54.230.117.154 -> 172.31.8.238 TCP 26130 [TCP segment of a reassembled PDU]
125   0.017600 172.31.8.238 -> 54.230.117.154 TCP 66 42485 > http [ACK] Seq=97 Ack=722553 Win=1191680 Len=0 TSval=17756643 TSecr=1686848482
126   0.017621 54.230.117.154 -> 172.31.8.238 TCP 14546 [TCP segment of a reassembled PDU]
127   0.017638 172.31.8.238 -> 54.230.117.154 TCP 66 42485 > http [ACK] Seq=97 Ack=737033 Win=1206656 Len=0 TSval=17756643 TSecr=1686848482
128   0.017732 54.230.117.154 -> 172.31.8.238 TCP 18890 [TCP segment of a reassembled PDU]
129   0.017757 172.31.8.238 -> 54.230.117.154 TCP 66 42485 > http [ACK] Seq=97 Ack=755857 Win=1203456 Len=0 TSval=17756643 TSecr=1686848482
130   0.017954 54.230.117.154 -> 172.31.8.238 TCP 23234 [TCP segment of a reassembled PDU]
131   0.017980 172.31.8.238 -> 54.230.117.154 TCP 66 42485 > http [ACK] Seq=97 Ack=779025 Win=1196416 Len=0 TSval=17756643 TSecr=1686848482
132   0.018036 54.230.117.154 -> 172.31.8.238 TCP 14546 [TCP segment of a reassembled PDU]
133   0.018046 172.31.8.238 -> 54.230.117.154 TCP 66 42485 > http [ACK] Seq=97 Ack=793505 Win=1210624 Len=0 TSval=17756643 TSecr=1686848482
134   0.018346 54.230.117.154 -> 172.31.8.238 TCP 26130 [TCP segment of a reassembled PDU]
135   0.018374 172.31.8.238 -> 54.230.117.154 TCP 66 42485 > http [ACK] Seq=97 Ack=819569 Win=1191680 Len=0 TSval=17756643 TSecr=1686848482
136   0.018379 54.230.117.154 -> 172.31.8.238 TCP 1514 [TCP segment of a reassembled PDU]
137   0.018507 54.230.117.154 -> 172.31.8.238 TCP 26130 [TCP segment of a reassembled PDU]
138   0.018521 172.31.8.238 -> 54.230.117.154 TCP 66 42485 > http [ACK] Seq=97 Ack=847081 Win=1191680 Len=0 TSval=17756643 TSecr=1686848482
139   0.018549 54.230.117.154 -> 172.31.8.238 TCP 10202 [TCP segment of a reassembled PDU]
140   0.018564 172.31.8.238 -> 54.230.117.154 TCP 66 42485 > http [ACK] Seq=97 Ack=857217 Win=1217792 Len=0 TSval=17756643 TSecr=1686848482
141   0.018793 54.230.117.154 -> 172.31.8.238 TCP 26130 [TCP segment of a reassembled PDU]
142   0.018816 54.230.117.154 -> 172.31.8.238 TCP 2962 [TCP segment of a reassembled PDU]
143   0.018827 172.31.8.238 -> 54.230.117.154 TCP 66 42485 > http [ACK] Seq=97 Ack=886177 Win=1188864 Len=0 TSval=17756643 TSecr=1686848482
144   0.019047 54.230.117.154 -> 172.31.8.238 TCP 23234 [TCP segment of a reassembled PDU]
145   0.019061 172.31.8.238 -> 54.230.117.154 TCP 66 42485 > http [ACK] Seq=97 Ack=909345 Win=1196416 Len=0 TSval=17756643 TSecr=1686848482
146   0.019079 54.230.117.154 -> 172.31.8.238 TCP 2962 [TCP segment of a reassembled PDU]
147   0.019088 172.31.8.238 -> 54.230.117.154 TCP 66 42485 > http [ACK] Seq=97 Ack=912241 Win=1193600 Len=0 TSval=17756643 TSecr=1686848482
148   0.019170 54.230.117.154 -> 172.31.8.238 TCP 14546 [TCP segment of a reassembled PDU]
149   0.019179 172.31.8.238 -> 54.230.117.154 TCP 66 42485 > http [ACK] Seq=97 Ack=926721 Win=1210624 Len=0 TSval=17756643 TSecr=1686848482
150   0.019336 54.230.117.154 -> 172.31.8.238 TCP 24682 [TCP segment of a reassembled PDU]
151   0.019360 172.31.8.238 -> 54.230.117.154 TCP 66 42485 > http [ACK] Seq=97 Ack=951337 Win=1193984 Len=0 TSval=17756643 TSecr=1686848482
152   0.019377 54.230.117.154 -> 172.31.8.238 TCP 1514 [TCP segment of a reassembled PDU]
153   0.019528 54.230.117.154 -> 172.31.8.238 TCP 18890 [TCP segment of a reassembled PDU]
154   0.019540 172.31.8.238 -> 54.230.117.154 TCP 66 42485 > http [ACK] Seq=97 Ack=971609 Win=1203456 Len=0 TSval=17756643 TSecr=1686848482
155   0.019566 54.230.117.154 -> 172.31.8.238 TCP 7306 [TCP segment of a reassembled PDU]
156   0.019579 172.31.8.238 -> 54.230.117.154 TCP 66 42485 > http [ACK] Seq=97 Ack=978849 Win=1230464 Len=0 TSval=17756643 TSecr=1686848482
157   0.019659 54.230.117.154 -> 172.31.8.238 TCP 17442 [TCP segment of a reassembled PDU]
