[Measurement for 1mb at 05:43:18 20.43.2014] 
Tshark:

  1   0.000000 172.31.8.238 -> 172.31.0.2   DNS 89 Standard query 0xfe82  A d1n0gskdvzj94j.cloudfront.net
  2   0.000029 172.31.8.238 -> 172.31.0.2   DNS 89 Standard query 0x93fe  AAAA d1n0gskdvzj94j.cloudfront.net
  3   0.000594   172.31.0.2 -> 172.31.8.238 DNS 217 Standard query response 0xfe82  A 54.230.119.40 A 54.230.119.55 A 54.192.118.234 A 54.230.116.128 A 54.230.117.5 A 54.230.117.21 A 54.230.117.154 A 54.230.118.248
  4   0.000632   172.31.0.2 -> 172.31.8.238 DNS 176 Standard query response 0x93fe 
  5   0.003878 172.31.8.238 -> 54.230.119.40 TCP 74 42846 > http [SYN] Seq=0 Win=26883 Len=0 MSS=8961 SACK_PERM=1 TSval=11456456 TSecr=0 WS=128
  6   0.004642 54.230.119.40 -> 172.31.8.238 TCP 74 http > 42846 [SYN, ACK] Seq=0 Ack=1 Win=14480 Len=0 MSS=1460 SACK_PERM=1 TSval=1687330179 TSecr=11456456 WS=128
  7   0.004657 172.31.8.238 -> 54.230.119.40 TCP 66 42846 > http [ACK] Seq=1 Ack=1 Win=27008 Len=0 TSval=11456457 TSecr=1687330179
  8   0.004700 172.31.8.238 -> 54.230.119.40 HTTP 162 GET /1mb HTTP/1.1 
  9   0.005423 54.230.119.40 -> 172.31.8.238 TCP 66 http > 42846 [ACK] Seq=1 Ack=97 Win=14592 Len=0 TSval=1687330180 TSecr=11456457
 10   0.007330 54.230.119.40 -> 172.31.8.238 TCP 1144 [TCP segment of a reassembled PDU]
 11   0.007336 172.31.8.238 -> 54.230.119.40 TCP 66 42846 > http [ACK] Seq=97 Ack=1079 Win=29056 Len=0 TSval=11456457 TSecr=1687330180
 12   0.007355 54.230.119.40 -> 172.31.8.238 TCP 13098 [TCP segment of a reassembled PDU]
 13   0.007367 172.31.8.238 -> 54.230.119.40 TCP 66 42846 > http [ACK] Seq=97 Ack=14111 Win=55168 Len=0 TSval=11456457 TSecr=1687330180
 14   0.008050 54.230.119.40 -> 172.31.8.238 TCP 13098 [TCP segment of a reassembled PDU]
 15   0.008060 172.31.8.238 -> 54.230.119.40 TCP 66 42846 > http [ACK] Seq=97 Ack=27143 Win=81280 Len=0 TSval=11456457 TSecr=1687330180
 16   0.008835 54.230.119.40 -> 172.31.8.238 TCP 13098 [TCP segment of a reassembled PDU]
 17   0.008845 172.31.8.238 -> 54.230.119.40 TCP 66 42846 > http [ACK] Seq=97 Ack=40175 Win=96512 Len=0 TSval=11456458 TSecr=1687330180
 18   0.009623 54.230.119.40 -> 172.31.8.238 TCP 13098 [TCP segment of a reassembled PDU]
 19   0.009632 172.31.8.238 -> 54.230.119.40 TCP 66 42846 > http [ACK] Seq=97 Ack=53207 Win=133376 Len=0 TSval=11456458 TSecr=1687330180
 20   0.009647 54.230.119.40 -> 172.31.8.238 TCP 7306 [TCP segment of a reassembled PDU]
 21   0.009652 172.31.8.238 -> 54.230.119.40 TCP 66 42846 > http [ACK] Seq=97 Ack=60447 Win=147840 Len=0 TSval=11456458 TSecr=1687330180
 22   0.010403 54.230.119.40 -> 172.31.8.238 TCP 18890 [TCP segment of a reassembled PDU]
 23   0.010414 172.31.8.238 -> 54.230.119.40 TCP 66 42846 > http [ACK] Seq=97 Ack=79271 Win=185472 Len=0 TSval=11456458 TSecr=1687330180
 24   0.011192 54.230.119.40 -> 172.31.8.238 TCP 13098 [TCP segment of a reassembled PDU]
 25   0.011202 172.31.8.238 -> 54.230.119.40 TCP 66 42846 > http [ACK] Seq=97 Ack=92303 Win=211584 Len=0 TSval=11456458 TSecr=1687330180
 26   0.011215 54.230.119.40 -> 172.31.8.238 TCP 11650 [TCP segment of a reassembled PDU]
 27   0.011220 172.31.8.238 -> 54.230.119.40 TCP 66 42846 > http [ACK] Seq=97 Ack=103887 Win=234752 Len=0 TSval=11456458 TSecr=1687330180
 28   0.011878 54.230.119.40 -> 172.31.8.238 TCP 5858 [TCP segment of a reassembled PDU]
 29   0.011885 172.31.8.238 -> 54.230.119.40 TCP 66 42846 > http [ACK] Seq=97 Ack=109679 Win=246272 Len=0 TSval=11456458 TSecr=1687330180
 30   0.011996 54.230.119.40 -> 172.31.8.238 TCP 21786 [TCP segment of a reassembled PDU]
 31   0.012010 172.31.8.238 -> 54.230.119.40 TCP 66 42846 > http [ACK] Seq=97 Ack=131399 Win=289792 Len=0 TSval=11456458 TSecr=1687330180
 32   0.012415 54.230.119.40 -> 172.31.8.238 TCP 2962 [TCP segment of a reassembled PDU]
 33   0.012422 172.31.8.238 -> 54.230.119.40 TCP 66 42846 > http [ACK] Seq=97 Ack=134295 Win=295552 Len=0 TSval=11456459 TSecr=1687330180
 34   0.012889 54.230.119.40 -> 172.31.8.238 TCP 4410 [TCP segment of a reassembled PDU]
 35   0.012895 172.31.8.238 -> 54.230.119.40 TCP 66 42846 > http [ACK] Seq=97 Ack=138639 Win=304256 Len=0 TSval=11456459 TSecr=1687330180
 36   0.013055 54.230.119.40 -> 172.31.8.238 TCP 23234 [TCP segment of a reassembled PDU]
 37   0.013067 172.31.8.238 -> 54.230.119.40 TCP 66 42846 > http [ACK] Seq=97 Ack=161807 Win=350592 Len=0 TSval=11456459 TSecr=1687330180
 38   0.013873 54.230.119.40 -> 172.31.8.238 TCP 4410 [TCP segment of a reassembled PDU]
 39   0.013879 172.31.8.238 -> 54.230.119.40 TCP 66 42846 > http [ACK] Seq=97 Ack=166151 Win=359296 Len=0 TSval=11456459 TSecr=1687330180
 40   0.014027 54.230.119.40 -> 172.31.8.238 TCP 23234 [TCP segment of a reassembled PDU]
 41   0.014036 172.31.8.238 -> 54.230.119.40 TCP 66 42846 > http [ACK] Seq=97 Ack=189319 Win=405632 Len=0 TSval=11456459 TSecr=1687330180
 42   0.014398 54.230.119.40 -> 172.31.8.238 TCP 7306 [TCP segment of a reassembled PDU]
 43   0.014405 172.31.8.238 -> 54.230.119.40 TCP 66 42846 > http [ACK] Seq=97 Ack=196559 Win=420096 Len=0 TSval=11456459 TSecr=1687330180
 44   0.014486 54.230.119.40 -> 172.31.8.238 TCP 5858 [TCP segment of a reassembled PDU]
 45   0.014492 172.31.8.238 -> 54.230.119.40 TCP 66 42846 > http [ACK] Seq=97 Ack=202351 Win=431616 Len=0 TSval=11456459 TSecr=1687330180
 46   0.014719 54.230.119.40 -> 172.31.8.238 TCP 14546 [TCP segment of a reassembled PDU]
 47   0.014728 172.31.8.238 -> 54.230.119.40 TCP 66 42846 > http [ACK] Seq=97 Ack=216831 Win=460544 Len=0 TSval=11456459 TSecr=1687330180
 48   0.015184 54.230.119.40 -> 172.31.8.238 TCP 1514 [TCP segment of a reassembled PDU]
 49   0.015188 172.31.8.238 -> 54.230.119.40 TCP 66 42846 > http [ACK] Seq=97 Ack=218279 Win=463488 Len=0 TSval=11456459 TSecr=1687330181
 50   0.015413 54.230.119.40 -> 172.31.8.238 TCP 40610 [TCP segment of a reassembled PDU]
 51   0.015433 172.31.8.238 -> 54.230.119.40 TCP 66 42846 > http [ACK] Seq=97 Ack=258823 Win=544640 Len=0 TSval=11456459 TSecr=1687330181
 52   0.018036 54.230.119.40 -> 172.31.8.238 TCP 20338 [TCP segment of a reassembled PDU]
 53   0.018048 172.31.8.238 -> 54.230.119.40 TCP 66 42846 > http [ACK] Seq=97 Ack=279095 Win=585088 Len=0 TSval=11456460 TSecr=1687330181
 54   0.018235 54.230.119.40 -> 172.31.8.238 TCP 24682 [TCP segment of a reassembled PDU]
 55   0.018249 172.31.8.238 -> 54.230.119.40 TCP 66 42846 > http [ACK] Seq=97 Ack=303711 Win=626304 Len=0 TSval=11456460 TSecr=1687330181
 56   0.018783 54.230.119.40 -> 172.31.8.238 TCP 8754 [TCP segment of a reassembled PDU]
 57   0.018791 172.31.8.238 -> 54.230.119.40 TCP 66 42846 > http [ACK] Seq=97 Ack=312399 Win=651776 Len=0 TSval=11456460 TSecr=1687330181
 58   0.018974 54.230.119.40 -> 172.31.8.238 TCP 29026 [TCP segment of a reassembled PDU]
 59   0.018990 172.31.8.238 -> 54.230.119.40 TCP 66 42846 > http [ACK] Seq=97 Ack=341359 Win=622848 Len=0 TSval=11456460 TSecr=1687330181
 60   0.019020 54.230.119.40 -> 172.31.8.238 TCP 5858 [TCP segment of a reassembled PDU]
 61   0.019031 172.31.8.238 -> 54.230.119.40 TCP 66 42846 > http [ACK] Seq=97 Ack=347151 Win=657280 Len=0 TSval=11456460 TSecr=1687330181
 62   0.019988 54.230.119.40 -> 172.31.8.238 TCP 44954 [TCP segment of a reassembled PDU]
 63   0.020010 172.31.8.238 -> 54.230.119.40 TCP 66 42846 > http [ACK] Seq=97 Ack=392039 Win=612480 Len=0 TSval=11456460 TSecr=1687330181
 64   0.020561 54.230.119.40 -> 172.31.8.238 TCP 4410 [TCP segment of a reassembled PDU]
 65   0.020568 172.31.8.238 -> 54.230.119.40 TCP 66 42846 > http [ACK] Seq=97 Ack=396383 Win=659584 Len=0 TSval=11456461 TSecr=1687330181
 66   0.020935 54.230.119.40 -> 172.31.8.238 TCP 15994 [TCP segment of a reassembled PDU]
 67   0.020943 172.31.8.238 -> 54.230.119.40 TCP 66 42846 > http [ACK] Seq=97 Ack=412311 Win=643712 Len=0 TSval=11456461 TSecr=1687330181
 68   0.020969 54.230.119.40 -> 172.31.8.238 TCP 33370 [TCP segment of a reassembled PDU]
 69   0.020987 172.31.8.238 -> 54.230.119.40 TCP 66 42846 > http [ACK] Seq=97 Ack=445615 Win=610432 Len=0 TSval=11456461 TSecr=1687330181
 70   0.021578 54.230.119.40 -> 172.31.8.238 TCP 7306 [TCP segment of a reassembled PDU]
 71   0.021585 172.31.8.238 -> 54.230.119.40 TCP 66 42846 > http [ACK] Seq=97 Ack=452855 Win=654848 Len=0 TSval=11456461 TSecr=1687330181
 72   0.021924 54.230.119.40 -> 172.31.8.238 TCP 50746 [TCP segment of a reassembled PDU]
 73   0.021947 172.31.8.238 -> 54.230.119.40 TCP 66 42846 > http [ACK] Seq=97 Ack=503535 Win=604288 Len=0 TSval=11456461 TSecr=1687330181
 74   0.023028 54.230.119.40 -> 172.31.8.238 TCP 60882 [TCP segment of a reassembled PDU]
 75   0.023053 172.31.8.238 -> 54.230.119.40 TCP 66 42846 > http [ACK] Seq=97 Ack=564351 Win=566784 Len=0 TSval=11456461 TSecr=1687330181
 76   0.023728 54.230.119.40 -> 172.31.8.238 TCP 2962 [TCP segment of a reassembled PDU]
 77   0.023734 172.31.8.238 -> 54.230.119.40 TCP 66 42846 > http [ACK] Seq=97 Ack=567247 Win=662016 Len=0 TSval=11456461 TSecr=1687330181
 78   0.024033 54.230.119.40 -> 172.31.8.238 TCP 40610 [TCP segment of a reassembled PDU]
 79   0.024048 172.31.8.238 -> 54.230.119.40 TCP 66 42846 > http [ACK] Seq=97 Ack=607791 Win=621568 Len=0 TSval=11456461 TSecr=1687330181
 80   0.024982 54.230.119.40 -> 172.31.8.238 TCP 18890 [TCP segment of a reassembled PDU]
 81   0.024994 172.31.8.238 -> 54.230.119.40 TCP 66 42846 > http [ACK] Seq=97 Ack=626615 Win=635776 Len=0 TSval=11456462 TSecr=1687330181
 82   0.025025 54.230.119.40 -> 172.31.8.238 TCP 14546 [TCP segment of a reassembled PDU]
 83   0.025033 172.31.8.238 -> 54.230.119.40 TCP 66 42846 > http [ACK] Seq=97 Ack=641095 Win=691840 Len=0 TSval=11456462 TSecr=1687330181
 84   0.025116 54.230.119.40 -> 172.31.8.238 TCP 31922 [TCP segment of a reassembled PDU]
 85   0.025131 172.31.8.238 -> 54.230.119.40 TCP 66 42846 > http [ACK] Seq=97 Ack=672951 Win=755584 Len=0 TSval=11456462 TSecr=1687330181
 86   0.025721 54.230.119.40 -> 172.31.8.238 TCP 2962 [TCP segment of a reassembled PDU]
 87   0.025728 172.31.8.238 -> 54.230.119.40 TCP 66 42846 > http [ACK] Seq=97 Ack=675847 Win=761344 Len=0 TSval=11456462 TSecr=1687330182
 88   0.026039 54.230.119.40 -> 172.31.8.238 TCP 59434 [TCP segment of a reassembled PDU]
 89   0.026076 172.31.8.238 -> 54.230.119.40 TCP 66 42846 > http [ACK] Seq=97 Ack=735215 Win=880128 Len=0 TSval=11456462 TSecr=1687330182
 90   0.026084 54.230.119.40 -> 172.31.8.238 TCP 2962 [TCP segment of a reassembled PDU]
 91   0.026087 172.31.8.238 -> 54.230.119.40 TCP 66 42846 > http [ACK] Seq=97 Ack=738111 Win=885888 Len=0 TSval=11456462 TSecr=1687330182
 92   0.026749 54.230.119.40 -> 172.31.8.238 TCP 7306 [TCP segment of a reassembled PDU]
 93   0.026771 172.31.8.238 -> 54.230.119.40 TCP 66 42846 > http [ACK] Seq=97 Ack=745351 Win=900352 Len=0 TSval=11456462 TSecr=1687330182
 94   0.027100 54.230.119.40 -> 172.31.8.238 TCP 52194 [TCP segment of a reassembled PDU]
 95   0.027122 172.31.8.238 -> 54.230.119.40 TCP 66 42846 > http [ACK] Seq=97 Ack=797479 Win=1004672 Len=0 TSval=11456462 TSecr=1687330182
 96   0.027147 54.230.119.40 -> 172.31.8.238 TCP 5858 [TCP segment of a reassembled PDU]
 97   0.027152 172.31.8.238 -> 54.230.119.40 TCP 66 42846 > http [ACK] Seq=97 Ack=803271 Win=1016192 Len=0 TSval=11456462 TSecr=1687330182
 98   0.027790 54.230.119.40 -> 172.31.8.238 TCP 1514 [TCP segment of a reassembled PDU]
 99   0.027795 172.31.8.238 -> 54.230.119.40 TCP 66 42846 > http [ACK] Seq=97 Ack=804719 Win=1019136 Len=0 TSval=11456462 TSecr=1687330182
100   0.028115 54.230.119.40 -> 172.31.8.238 TCP 55090 [TCP segment of a reassembled PDU]
101   0.028152 172.31.8.238 -> 54.230.119.40 TCP 66 42846 > http [ACK] Seq=97 Ack=859743 Win=1107840 Len=0 TSval=11456462 TSecr=1687330182
102   0.028160 54.230.119.40 -> 172.31.8.238 TCP 8754 [TCP segment of a reassembled PDU]
103   0.028184 172.31.8.238 -> 54.230.119.40 TCP 66 42846 > http [ACK] Seq=97 Ack=868431 Win=1099264 Len=0 TSval=11456462 TSecr=1687330182
104   0.028782 54.230.119.40 -> 172.31.8.238 TCP 7306 [TCP segment of a reassembled PDU]
105   0.028790 172.31.8.238 -> 54.230.119.40 TCP 66 42846 > http [ACK] Seq=97 Ack=875671 Win=1143680 Len=0 TSval=11456463 TSecr=1687330182
106   0.029061 54.230.119.40 -> 172.31.8.238 TCP 46402 [TCP segment of a reassembled PDU]
107   0.029086 54.230.119.40 -> 172.31.8.238 TCP 5858 [TCP segment of a reassembled PDU]
108   0.029105 54.230.119.40 -> 172.31.8.238 TCP 5858 [TCP segment of a reassembled PDU]
109   0.029114 172.31.8.238 -> 54.230.119.40 TCP 66 42846 > http [ACK] Seq=97 Ack=933591 Win=1103104 Len=0 TSval=11456463 TSecr=1687330182
110   0.029558 54.230.119.40 -> 172.31.8.238 TCP 4410 [TCP segment of a reassembled PDU]
111   0.029564 172.31.8.238 -> 54.230.119.40 TCP 66 42846 > http [ACK] Seq=97 Ack=937935 Win=1152384 Len=0 TSval=11456463 TSecr=1687330182
112   0.029831 54.230.119.40 -> 172.31.8.238 TCP 46402 [TCP segment of a reassembled PDU]
113   0.029855 54.230.119.40 -> 172.31.8.238 TCP 5858 [TCP segment of a reassembled PDU]
114   0.029879 54.230.119.40 -> 172.31.8.238 TCP 8754 [TCP segment of a reassembled PDU]
115   0.029886 172.31.8.238 -> 54.230.119.40 TCP 66 42846 > http [ACK] Seq=97 Ack=990063 Win=1112576 Len=0 TSval=11456463 TSecr=1687330182
116   0.029900 172.31.8.238 -> 54.230.119.40 TCP 66 42846 > http [ACK] Seq=97 Ack=998751 Win=1104000 Len=0 TSval=11456463 TSecr=1687330182
117   0.030345 54.230.119.40 -> 172.31.8.238 TCP 7306 [TCP segment of a reassembled PDU]
118   0.030353 172.31.8.238 -> 54.230.119.40 TCP 66 42846 > http [ACK] Seq=97 Ack=1005991 Win=1166848 Len=0 TSval=11456463 TSecr=1687330182
119   0.030586 54.230.119.40 -> 172.31.8.238 TCP 40610 [TCP segment of a reassembled PDU]
120   0.030619 54.230.119.40 -> 172.31.8.238 HTTP 2565 HTTP/1.1 200 OK  (application/octet-stream)
121   0.030627 172.31.8.238 -> 54.230.119.40 TCP 66 42846 > http [ACK] Seq=97 Ack=1049034 Win=1126784 Len=0 TSval=11456463 TSecr=1687330182
122   0.030796 172.31.8.238 -> 54.230.119.40 TCP 66 42846 > http [FIN, ACK] Seq=97 Ack=1049034 Win=1166848 Len=0 TSval=11456463 TSecr=1687330182
123   0.031642 54.230.119.40 -> 172.31.8.238 TCP 66 http > 42846 [FIN, ACK] Seq=1049034 Ack=98 Win=14592 Len=0 TSval=1687330182 TSecr=11456463
124   0.031652 172.31.8.238 -> 54.230.119.40 TCP 66 42846 > http [ACK] Seq=98 Ack=1049035 Win=1166848 Len=0 TSval=11456463 TSecr=1687330182
