[Measurement for 1mb at 13:43:18 20.43.2014] 
Tshark:

  1   0.000000 172.31.8.238 -> 172.31.0.2   DNS 89 Standard query 0x5053  A d1n0gskdvzj94j.cloudfront.net
  2   0.000029 172.31.8.238 -> 172.31.0.2   DNS 89 Standard query 0x7389  AAAA d1n0gskdvzj94j.cloudfront.net
  3   0.000538   172.31.0.2 -> 172.31.8.238 DNS 176 Standard query response 0x7389 
  4   0.000551   172.31.0.2 -> 172.31.8.238 DNS 217 Standard query response 0x5053  A 54.230.117.45 A 54.230.117.69 A 54.230.117.154 A 54.239.132.83 A 54.239.132.249 A 54.192.118.241 A 54.230.116.154 A 54.230.116.239
  5   0.003889 172.31.8.238 -> 54.230.117.45 TCP 74 38508 > http [SYN] Seq=0 Win=26883 Len=0 MSS=8961 SACK_PERM=1 TSval=18656583 TSecr=0 WS=128
  6   0.004610 54.230.117.45 -> 172.31.8.238 TCP 74 http > 38508 [SYN, ACK] Seq=0 Ack=1 Win=14480 Len=0 MSS=1460 SACK_PERM=1 TSval=1690250761 TSecr=18656583 WS=128
  7   0.004624 172.31.8.238 -> 54.230.117.45 TCP 66 38508 > http [ACK] Seq=1 Ack=1 Win=27008 Len=0 TSval=18656583 TSecr=1690250761
  8   0.004662 172.31.8.238 -> 54.230.117.45 HTTP 162 GET /1mb HTTP/1.1 
  9   0.005208 54.230.117.45 -> 172.31.8.238 TCP 66 http > 38508 [ACK] Seq=1 Ack=97 Win=14592 Len=0 TSval=1690250761 TSecr=18656583
 10   0.006766 54.230.117.45 -> 172.31.8.238 TCP 4410 [TCP segment of a reassembled PDU]
 11   0.006774 172.31.8.238 -> 54.230.117.45 TCP 66 38508 > http [ACK] Seq=97 Ack=4345 Win=35584 Len=0 TSval=18656584 TSecr=1690250761
 12   0.007019 54.230.117.45 -> 172.31.8.238 TCP 7306 [TCP segment of a reassembled PDU]
 13   0.007028 172.31.8.238 -> 54.230.117.45 TCP 66 38508 > http [ACK] Seq=97 Ack=11585 Win=50176 Len=0 TSval=18656584 TSecr=1690250761
 14   0.007059 54.230.117.45 -> 172.31.8.238 TCP 1514 [TCP segment of a reassembled PDU]
 15   0.007064 172.31.8.238 -> 54.230.117.45 TCP 66 38508 > http [ACK] Seq=97 Ack=13033 Win=52992 Len=0 TSval=18656584 TSecr=1690250761
 16   0.007254 54.230.117.45 -> 172.31.8.238 TCP 1514 [TCP segment of a reassembled PDU]
 17   0.007258 172.31.8.238 -> 54.230.117.45 TCP 66 38508 > http [ACK] Seq=97 Ack=14481 Win=55936 Len=0 TSval=18656584 TSecr=1690250761
 18   0.007366 54.230.117.45 -> 172.31.8.238 TCP 5858 [TCP segment of a reassembled PDU]
 19   0.007385 172.31.8.238 -> 54.230.117.45 TCP 66 38508 > http [ACK] Seq=97 Ack=20273 Win=67456 Len=0 TSval=18656584 TSecr=1690250761
 20   0.007530 54.230.117.45 -> 172.31.8.238 TCP 5858 [TCP segment of a reassembled PDU]
 21   0.007536 172.31.8.238 -> 54.230.117.45 TCP 66 38508 > http [ACK] Seq=97 Ack=26065 Win=79104 Len=0 TSval=18656584 TSecr=1690250761
 22   0.007770 54.230.117.45 -> 172.31.8.238 TCP 4410 [TCP segment of a reassembled PDU]
 23   0.007776 172.31.8.238 -> 54.230.117.45 TCP 66 38508 > http [ACK] Seq=97 Ack=30409 Win=87808 Len=0 TSval=18656584 TSecr=1690250761
 24   0.007871 54.230.117.45 -> 172.31.8.238 TCP 2962 [TCP segment of a reassembled PDU]
 25   0.007876 172.31.8.238 -> 54.230.117.45 TCP 66 38508 > http [ACK] Seq=97 Ack=33305 Win=93568 Len=0 TSval=18656584 TSecr=1690250761
 26   0.008023 54.230.117.45 -> 172.31.8.238 TCP 1514 [TCP segment of a reassembled PDU]
 27   0.008027 172.31.8.238 -> 54.230.117.45 TCP 66 38508 > http [ACK] Seq=97 Ack=34753 Win=96512 Len=0 TSval=18656584 TSecr=1690250761
 28   0.008122 54.230.117.45 -> 172.31.8.238 TCP 4410 [TCP segment of a reassembled PDU]
 29   0.008128 172.31.8.238 -> 54.230.117.45 TCP 66 38508 > http [ACK] Seq=97 Ack=39097 Win=105088 Len=0 TSval=18656584 TSecr=1690250761
 30   0.008281 54.230.117.45 -> 172.31.8.238 TCP 4410 [TCP segment of a reassembled PDU]
 31   0.008287 172.31.8.238 -> 54.230.117.45 TCP 66 38508 > http [ACK] Seq=97 Ack=43441 Win=109056 Len=0 TSval=18656584 TSecr=1690250761
 32   0.008389 54.230.117.45 -> 172.31.8.238 TCP 8754 [TCP segment of a reassembled PDU]
 33   0.008396 172.31.8.238 -> 54.230.117.45 TCP 66 38508 > http [ACK] Seq=97 Ack=52129 Win=103680 Len=0 TSval=18656584 TSecr=1690250761
 34   0.008547 54.230.117.45 -> 172.31.8.238 TCP 2962 [TCP segment of a reassembled PDU]
 35   0.008552 172.31.8.238 -> 54.230.117.45 TCP 66 38508 > http [ACK] Seq=97 Ack=55025 Win=109056 Len=0 TSval=18656584 TSecr=1690250761
 36   0.008787 54.230.117.45 -> 172.31.8.238 TCP 4410 [TCP segment of a reassembled PDU]
 37   0.008793 172.31.8.238 -> 54.230.117.45 TCP 66 38508 > http [ACK] Seq=97 Ack=59369 Win=109056 Len=0 TSval=18656584 TSecr=1690250761
 38   0.008896 54.230.117.45 -> 172.31.8.238 TCP 10202 [TCP segment of a reassembled PDU]
 39   0.008904 172.31.8.238 -> 54.230.117.45 TCP 66 38508 > http [ACK] Seq=97 Ack=69505 Win=101248 Len=0 TSval=18656584 TSecr=1690250761
 40   0.009046 54.230.117.45 -> 172.31.8.238 TCP 4410 [TCP segment of a reassembled PDU]
 41   0.009064 172.31.8.238 -> 54.230.117.45 TCP 66 38508 > http [ACK] Seq=97 Ack=73849 Win=117760 Len=0 TSval=18656585 TSecr=1690250761
 42   0.009155 54.230.117.45 -> 172.31.8.238 TCP 4410 [TCP segment of a reassembled PDU]
 43   0.009161 172.31.8.238 -> 54.230.117.45 TCP 66 38508 > http [ACK] Seq=97 Ack=78193 Win=126464 Len=0 TSval=18656585 TSecr=1690250761
 44   0.009557 54.230.117.45 -> 172.31.8.238 TCP 4410 [TCP segment of a reassembled PDU]
 45   0.009563 172.31.8.238 -> 54.230.117.45 TCP 66 38508 > http [ACK] Seq=97 Ack=82537 Win=135168 Len=0 TSval=18656585 TSecr=1690250762
 46   0.009700 54.230.117.45 -> 172.31.8.238 TCP 20338 [TCP segment of a reassembled PDU]
 47   0.009712 172.31.8.238 -> 54.230.117.45 TCP 66 38508 > http [ACK] Seq=97 Ack=102809 Win=175616 Len=0 TSval=18656585 TSecr=1690250762
 48   0.009739 54.230.117.45 -> 172.31.8.238 TCP 1514 [TCP segment of a reassembled PDU]
 49   0.009744 172.31.8.238 -> 54.230.117.45 TCP 66 38508 > http [ACK] Seq=97 Ack=104257 Win=178560 Len=0 TSval=18656585 TSecr=1690250762
 50   0.009819 54.230.117.45 -> 172.31.8.238 TCP 4410 [TCP segment of a reassembled PDU]
 51   0.009825 172.31.8.238 -> 54.230.117.45 TCP 66 38508 > http [ACK] Seq=97 Ack=108601 Win=187264 Len=0 TSval=18656585 TSecr=1690250762
 52   0.009891 54.230.117.45 -> 172.31.8.238 TCP 8754 [TCP segment of a reassembled PDU]
 53   0.009898 172.31.8.238 -> 54.230.117.45 TCP 66 38508 > http [ACK] Seq=97 Ack=117289 Win=204672 Len=0 TSval=18656585 TSecr=1690250762
 54   0.010585 54.230.117.45 -> 172.31.8.238 TCP 5858 [TCP segment of a reassembled PDU]
 55   0.010592 172.31.8.238 -> 54.230.117.45 TCP 66 38508 > http [ACK] Seq=97 Ack=123081 Win=216192 Len=0 TSval=18656585 TSecr=1690250762
 56   0.010702 54.230.117.45 -> 172.31.8.238 TCP 7306 [TCP segment of a reassembled PDU]
 57   0.010709 172.31.8.238 -> 54.230.117.45 TCP 66 38508 > http [ACK] Seq=97 Ack=130321 Win=230656 Len=0 TSval=18656585 TSecr=1690250762
 58   0.010839 54.230.117.45 -> 172.31.8.238 TCP 26130 [TCP segment of a reassembled PDU]
 59   0.010853 172.31.8.238 -> 54.230.117.45 TCP 66 38508 > http [ACK] Seq=97 Ack=156385 Win=282880 Len=0 TSval=18656585 TSecr=1690250762
 60   0.011367 54.230.117.45 -> 172.31.8.238 TCP 4410 [TCP segment of a reassembled PDU]
 61   0.011374 172.31.8.238 -> 54.230.117.45 TCP 66 38508 > http [ACK] Seq=97 Ack=160729 Win=291456 Len=0 TSval=18656585 TSecr=1690250762
 62   0.011518 54.230.117.45 -> 172.31.8.238 TCP 21786 [TCP segment of a reassembled PDU]
 63   0.011530 172.31.8.238 -> 54.230.117.45 TCP 66 38508 > http [ACK] Seq=97 Ack=182449 Win=334976 Len=0 TSval=18656585 TSecr=1690250762
 64   0.011584 54.230.117.45 -> 172.31.8.238 TCP 15994 [TCP segment of a reassembled PDU]
 65   0.011594 172.31.8.238 -> 54.230.117.45 TCP 66 38508 > http [ACK] Seq=97 Ack=198377 Win=366848 Len=0 TSval=18656585 TSecr=1690250762
 66   0.011707 54.230.117.45 -> 172.31.8.238 TCP 8754 [TCP segment of a reassembled PDU]
 67   0.011715 172.31.8.238 -> 54.230.117.45 TCP 66 38508 > http [ACK] Seq=97 Ack=207065 Win=384128 Len=0 TSval=18656585 TSecr=1690250762
 68   0.011866 54.230.117.45 -> 172.31.8.238 TCP 1514 [TCP segment of a reassembled PDU]
 69   0.011870 172.31.8.238 -> 54.230.117.45 TCP 66 38508 > http [ACK] Seq=97 Ack=208513 Win=387072 Len=0 TSval=18656585 TSecr=1690250762
 70   0.012154 54.230.117.45 -> 172.31.8.238 TCP 10202 [TCP segment of a reassembled PDU]
 71   0.012162 172.31.8.238 -> 54.230.117.45 TCP 66 38508 > http [ACK] Seq=97 Ack=218649 Win=407296 Len=0 TSval=18656585 TSecr=1690250762
 72   0.012307 54.230.117.45 -> 172.31.8.238 TCP 26130 [TCP segment of a reassembled PDU]
 73   0.012321 172.31.8.238 -> 54.230.117.45 TCP 66 38508 > http [ACK] Seq=97 Ack=244713 Win=459520 Len=0 TSval=18656585 TSecr=1690250762
 74   0.012349 54.230.117.45 -> 172.31.8.238 TCP 2962 [TCP segment of a reassembled PDU]
 75   0.012357 172.31.8.238 -> 54.230.117.45 TCP 66 38508 > http [ACK] Seq=97 Ack=247609 Win=465280 Len=0 TSval=18656585 TSecr=1690250762
 76   0.012419 54.230.117.45 -> 172.31.8.238 TCP 5858 [TCP segment of a reassembled PDU]
 77   0.012425 172.31.8.238 -> 54.230.117.45 TCP 66 38508 > http [ACK] Seq=97 Ack=253401 Win=476800 Len=0 TSval=18656585 TSecr=1690250762
 78   0.012476 54.230.117.45 -> 172.31.8.238 TCP 1514 [TCP segment of a reassembled PDU]
 79   0.012480 172.31.8.238 -> 54.230.117.45 TCP 66 38508 > http [ACK] Seq=97 Ack=254849 Win=479744 Len=0 TSval=18656585 TSecr=1690250762
 80   0.012681 54.230.117.45 -> 172.31.8.238 TCP 10202 [TCP segment of a reassembled PDU]
 81   0.012689 172.31.8.238 -> 54.230.117.45 TCP 66 38508 > http [ACK] Seq=97 Ack=264985 Win=499968 Len=0 TSval=18656585 TSecr=1690250762
 82   0.012779 54.230.117.45 -> 172.31.8.238 TCP 4410 [TCP segment of a reassembled PDU]
 83   0.012785 172.31.8.238 -> 54.230.117.45 TCP 66 38508 > http [ACK] Seq=97 Ack=269329 Win=508672 Len=0 TSval=18656585 TSecr=1690250762
 84   0.012951 54.230.117.45 -> 172.31.8.238 TCP 11650 [TCP segment of a reassembled PDU]
 85   0.012959 172.31.8.238 -> 54.230.117.45 TCP 66 38508 > http [ACK] Seq=97 Ack=280913 Win=530688 Len=0 TSval=18656586 TSecr=1690250762
 86   0.013069 54.230.117.45 -> 172.31.8.238 TCP 20338 [TCP segment of a reassembled PDU]
 87   0.013080 172.31.8.238 -> 54.230.117.45 TCP 66 38508 > http [ACK] Seq=97 Ack=301185 Win=572416 Len=0 TSval=18656586 TSecr=1690250762
 88   0.013225 54.230.117.45 -> 172.31.8.238 TCP 7306 [TCP segment of a reassembled PDU]
 89   0.013232 172.31.8.238 -> 54.230.117.45 TCP 66 38508 > http [ACK] Seq=97 Ack=308425 Win=586880 Len=0 TSval=18656586 TSecr=1690250762
 90   0.013361 54.230.117.45 -> 172.31.8.238 TCP 20338 [TCP segment of a reassembled PDU]
 91   0.013372 172.31.8.238 -> 54.230.117.45 TCP 66 38508 > http [ACK] Seq=97 Ack=328697 Win=627456 Len=0 TSval=18656586 TSecr=1690250762
 92   0.013522 54.230.117.45 -> 172.31.8.238 TCP 2962 [TCP segment of a reassembled PDU]
 93   0.013527 172.31.8.238 -> 54.230.117.45 TCP 66 38508 > http [ACK] Seq=97 Ack=331593 Win=633216 Len=0 TSval=18656586 TSecr=1690250762
 94   0.013630 54.230.117.45 -> 172.31.8.238 TCP 15994 [TCP segment of a reassembled PDU]
 95   0.013638 172.31.8.238 -> 54.230.117.45 TCP 66 38508 > http [ACK] Seq=97 Ack=347521 Win=665088 Len=0 TSval=18656586 TSecr=1690250762
 96   0.013799 54.230.117.45 -> 172.31.8.238 TCP 23234 [TCP segment of a reassembled PDU]
 97   0.013811 172.31.8.238 -> 54.230.117.45 TCP 66 38508 > http [ACK] Seq=97 Ack=370689 Win=711424 Len=0 TSval=18656586 TSecr=1690250762
 98   0.014068 54.230.117.45 -> 172.31.8.238 TCP 26130 [TCP segment of a reassembled PDU]
 99   0.014082 172.31.8.238 -> 54.230.117.45 TCP 66 38508 > http [ACK] Seq=97 Ack=396753 Win=763520 Len=0 TSval=18656586 TSecr=1690250762
100   0.014092 54.230.117.45 -> 172.31.8.238 TCP 5858 [TCP segment of a reassembled PDU]
101   0.014096 172.31.8.238 -> 54.230.117.45 TCP 66 38508 > http [ACK] Seq=97 Ack=402545 Win=775168 Len=0 TSval=18656586 TSecr=1690250762
102   0.014267 54.230.117.45 -> 172.31.8.238 TCP 1514 [TCP segment of a reassembled PDU]
103   0.014271 172.31.8.238 -> 54.230.117.45 TCP 66 38508 > http [ACK] Seq=97 Ack=403993 Win=777984 Len=0 TSval=18656586 TSecr=1690250762
104   0.014589 54.230.117.45 -> 172.31.8.238 TCP 26130 [TCP segment of a reassembled PDU]
105   0.014603 172.31.8.238 -> 54.230.117.45 TCP 66 38508 > http [ACK] Seq=97 Ack=430057 Win=830208 Len=0 TSval=18656586 TSecr=1690250762
106   0.014620 54.230.117.45 -> 172.31.8.238 TCP 8754 [TCP segment of a reassembled PDU]
107   0.014626 172.31.8.238 -> 54.230.117.45 TCP 66 38508 > http [ACK] Seq=97 Ack=438745 Win=847488 Len=0 TSval=18656586 TSecr=1690250762
108   0.014793 54.230.117.45 -> 172.31.8.238 TCP 8754 [TCP segment of a reassembled PDU]
109   0.014801 172.31.8.238 -> 54.230.117.45 TCP 66 38508 > http [ACK] Seq=97 Ack=447433 Win=864896 Len=0 TSval=18656586 TSecr=1690250762
110   0.014854 54.230.117.45 -> 172.31.8.238 TCP 23234 [TCP segment of a reassembled PDU]
111   0.014866 172.31.8.238 -> 54.230.117.45 TCP 66 38508 > http [ACK] Seq=97 Ack=470601 Win=911232 Len=0 TSval=18656586 TSecr=1690250762
112   0.015009 54.230.117.45 -> 172.31.8.238 TCP 1514 [TCP segment of a reassembled PDU]
113   0.015014 172.31.8.238 -> 54.230.117.45 TCP 66 38508 > http [ACK] Seq=97 Ack=472049 Win=914176 Len=0 TSval=18656586 TSecr=1690250762
114   0.015182 54.230.117.45 -> 172.31.8.238 TCP 4410 [TCP segment of a reassembled PDU]
115   0.015188 172.31.8.238 -> 54.230.117.45 TCP 66 38508 > http [ACK] Seq=97 Ack=476393 Win=922880 Len=0 TSval=18656586 TSecr=1690250762
116   0.015328 54.230.117.45 -> 172.31.8.238 TCP 26130 [TCP segment of a reassembled PDU]
117   0.015342 172.31.8.238 -> 54.230.117.45 TCP 66 38508 > http [ACK] Seq=97 Ack=502457 Win=974976 Len=0 TSval=18656586 TSecr=1690250762
118   0.015400 54.230.117.45 -> 172.31.8.238 TCP 23234 [TCP segment of a reassembled PDU]
119   0.015411 172.31.8.238 -> 54.230.117.45 TCP 66 38508 > http [ACK] Seq=97 Ack=525625 Win=1021312 Len=0 TSval=18656586 TSecr=1690250762
120   0.015461 54.230.117.45 -> 172.31.8.238 TCP 5858 [TCP segment of a reassembled PDU]
121   0.015467 172.31.8.238 -> 54.230.117.45 TCP 66 38508 > http [ACK] Seq=97 Ack=531417 Win=1032832 Len=0 TSval=18656586 TSecr=1690250762
122   0.015567 54.230.117.45 -> 172.31.8.238 TCP 2962 [TCP segment of a reassembled PDU]
123   0.015571 172.31.8.238 -> 54.230.117.45 TCP 66 38508 > http [ACK] Seq=97 Ack=534313 Win=1038720 Len=0 TSval=18656586 TSecr=1690250762
124   0.015962 54.230.117.45 -> 172.31.8.238 TCP 4410 [TCP segment of a reassembled PDU]
125   0.015969 172.31.8.238 -> 54.230.117.45 TCP 66 38508 > http [ACK] Seq=97 Ack=538657 Win=1047424 Len=0 TSval=18656586 TSecr=1690250762
126   0.016131 54.230.117.45 -> 172.31.8.238 TCP 26130 [TCP segment of a reassembled PDU]
127   0.016145 172.31.8.238 -> 54.230.117.45 TCP 66 38508 > http [ACK] Seq=97 Ack=564721 Win=1092480 Len=0 TSval=18656586 TSecr=1690250762
128   0.016251 54.230.117.45 -> 172.31.8.238 TCP 26130 [TCP segment of a reassembled PDU]
129   0.016265 172.31.8.238 -> 54.230.117.45 TCP 66 38508 > http [ACK] Seq=97 Ack=590785 Win=1092480 Len=0 TSval=18656586 TSecr=1690250762
130   0.016354 54.230.117.45 -> 172.31.8.238 TCP 8754 [TCP segment of a reassembled PDU]
131   0.016362 172.31.8.238 -> 54.230.117.45 TCP 66 38508 > http [ACK] Seq=97 Ack=599473 Win=1116928 Len=0 TSval=18656586 TSecr=1690250762
132   0.016587 54.230.117.45 -> 172.31.8.238 TCP 26130 [TCP segment of a reassembled PDU]
133   0.016600 172.31.8.238 -> 54.230.117.45 TCP 66 38508 > http [ACK] Seq=97 Ack=625537 Win=1092480 Len=0 TSval=18656586 TSecr=1690250762
134   0.016621 54.230.117.45 -> 172.31.8.238 TCP 8754 [TCP segment of a reassembled PDU]
135   0.016627 172.31.8.238 -> 54.230.117.45 TCP 66 38508 > http [ACK] Seq=97 Ack=634225 Win=1083904 Len=0 TSval=18656586 TSecr=1690250762
136   0.016821 54.230.117.45 -> 172.31.8.238 TCP 20338 [TCP segment of a reassembled PDU]
137   0.016833 172.31.8.238 -> 54.230.117.45 TCP 66 38508 > http [ACK] Seq=97 Ack=654497 Win=1101952 Len=0 TSval=18656586 TSecr=1690250762
138   0.016978 54.230.117.45 -> 172.31.8.238 TCP 26130 [TCP segment of a reassembled PDU]
139   0.017005 172.31.8.238 -> 54.230.117.45 TCP 66 38508 > http [ACK] Seq=97 Ack=680561 Win=1116928 Len=0 TSval=18656587 TSecr=1690250762
140   0.017048 54.230.117.45 -> 172.31.8.238 TCP 21786 [TCP segment of a reassembled PDU]
141   0.017061 172.31.8.238 -> 54.230.117.45 TCP 66 38508 > http [ACK] Seq=97 Ack=702281 Win=1160320 Len=0 TSval=18656587 TSecr=1690250762
142   0.017341 54.230.117.45 -> 172.31.8.238 TCP 20338 [TCP segment of a reassembled PDU]
143   0.017353 172.31.8.238 -> 54.230.117.45 TCP 66 38508 > http [ACK] Seq=97 Ack=722553 Win=1200896 Len=0 TSval=18656587 TSecr=1690250762
144   0.017447 54.230.117.45 -> 172.31.8.238 TCP 7306 [TCP segment of a reassembled PDU]
145   0.017455 172.31.8.238 -> 54.230.117.45 TCP 66 38508 > http [ACK] Seq=97 Ack=729793 Win=1215360 Len=0 TSval=18656587 TSecr=1690250762
146   0.017596 54.230.117.45 -> 172.31.8.238 TCP 23234 [TCP segment of a reassembled PDU]
147   0.017607 172.31.8.238 -> 54.230.117.45 TCP 66 38508 > http [ACK] Seq=97 Ack=752961 Win=1261696 Len=0 TSval=18656587 TSecr=1690250762
148   0.017745 54.230.117.45 -> 172.31.8.238 TCP 26130 [TCP segment of a reassembled PDU]
149   0.017760 172.31.8.238 -> 54.230.117.45 TCP 66 38508 > http [ACK] Seq=97 Ack=779025 Win=1313792 Len=0 TSval=18656587 TSecr=1690250762
150   0.017795 54.230.117.45 -> 172.31.8.238 TCP 15994 [TCP segment of a reassembled PDU]
151   0.017804 172.31.8.238 -> 54.230.117.45 TCP 66 38508 > http [ACK] Seq=97 Ack=794953 Win=1345664 Len=0 TSval=18656587 TSecr=1690250762
152   0.017876 54.230.117.45 -> 172.31.8.238 TCP 20338 [TCP segment of a reassembled PDU]
153   0.017887 172.31.8.238 -> 54.230.117.45 TCP 66 38508 > http [ACK] Seq=97 Ack=815225 Win=1386240 Len=0 TSval=18656587 TSecr=1690250762
154   0.018000 54.230.117.45 -> 172.31.8.238 TCP 10202 [TCP segment of a reassembled PDU]
155   0.018008 172.31.8.238 -> 54.230.117.45 TCP 66 38508 > http [ACK] Seq=97 Ack=825361 Win=1406464 Len=0 TSval=18656587 TSecr=1690250762
156   0.018099 54.230.117.45 -> 172.31.8.238 TCP 8754 [TCP segment of a reassembled PDU]
157   0.018106 172.31.8.238 -> 54.230.117.45 TCP 66 38508 > http [ACK] Seq=97 Ack=834049 Win=1423872 Len=0 TSval=18656587 TSecr=1690250762
158   0.018339 54.230.117.45 -> 172.31.8.238 TCP 18890 [TCP segment of a reassembled PDU]
159   0.018349 172.31.8.238 -> 54.230.117.45 TCP 66 38508 > http [ACK] Seq=97 Ack=852873 Win=1461504 Len=0 TSval=18656587 TSecr=1690250762
160   0.018467 54.230.117.45 -> 172.31.8.238 TCP 7306 [TCP segment of a reassembled PDU]
161   0.018473 172.31.8.238 -> 54.230.117.45 TCP 66 38508 > http [ACK] Seq=97 Ack=860113 Win=1475968 Len=0 TSval=18656587 TSecr=1690250762
162   0.018600 54.230.117.45 -> 172.31.8.238 TCP 26130 [TCP segment of a reassembled PDU]
163   0.018615 172.31.8.238 -> 54.230.117.45 TCP 66 38508 > http [ACK] Seq=97 Ack=886177 Win=1528064 Len=0 TSval=18656587 TSecr=1690250762
164   0.018621 54.230.117.45 -> 172.31.8.238 TCP 1514 [TCP segment of a reassembled PDU]
165   0.018623 172.31.8.238 -> 54.230.117.45 TCP 66 38508 > http [ACK] Seq=97 Ack=887625 Win=1531008 Len=0 TSval=18656587 TSecr=1690250762
166   0.018792 54.230.117.45 -> 172.31.8.238 TCP 37714 [TCP segment of a reassembled PDU]
167   0.018809 172.31.8.238 -> 54.230.117.45 TCP 66 38508 > http [ACK] Seq=97 Ack=925273 Win=1606272 Len=0 TSval=18656587 TSecr=1690250762
168   0.019033 54.230.117.45 -> 172.31.8.238 TCP 23234 [TCP segment of a reassembled PDU]
169   0.019046 172.31.8.238 -> 54.230.117.45 TCP 66 38508 > http [ACK] Seq=97 Ack=948441 Win=1606272 Len=0 TSval=18656587 TSecr=1690250762
170   0.019061 54.230.117.45 -> 172.31.8.238 TCP 2962 [TCP segment of a reassembled PDU]
171   0.019064 172.31.8.238 -> 54.230.117.45 TCP 66 38508 > http [ACK] Seq=97 Ack=951337 Win=1606272 Len=0 TSval=18656587 TSecr=1690250762
172   0.019153 54.230.117.45 -> 172.31.8.238 TCP 24682 [TCP segment of a reassembled PDU]
173   0.019166 172.31.8.238 -> 54.230.117.45 TCP 66 38508 > http [ACK] Seq=97 Ack=975953 Win=1606272 Len=0 TSval=18656587 TSecr=1690250762
174   0.019274 54.230.117.45 -> 172.31.8.238 TCP 14546 [TCP segment of a reassembled PDU]
175   0.019283 172.31.8.238 -> 54.230.117.45 TCP 66 38508 > http [ACK] Seq=97 Ack=990433 Win=1606272 Len=0 TSval=18656587 TSecr=1690250762
176   0.019415 54.230.117.45 -> 172.31.8.238 TCP 20338 [TCP segment of a reassembled PDU]
177   0.019427 172.31.8.238 -> 54.230.117.45 TCP 66 38508 > http [ACK] Seq=97 Ack=1010705 Win=1606272 Len=0 TSval=18656587 TSecr=1690250763
178   0.019446 54.230.117.45 -> 172.31.8.238 TCP 5858 [TCP segment of a reassembled PDU]
179   0.019451 172.31.8.238 -> 54.230.117.45 TCP 66 38508 > http [ACK] Seq=97 Ack=1016497 Win=1606272 Len=0 TSval=18656587 TSecr=1690250763
180   0.019531 54.230.117.45 -> 172.31.8.238 TCP 24682 [TCP segment of a reassembled PDU]
181   0.019544 172.31.8.238 -> 54.230.117.45 TCP 66 38508 > http [ACK] Seq=97 Ack=1041113 Win=1606272 Len=0 TSval=18656587 TSecr=1690250763
182   0.019632 54.230.117.45 -> 172.31.8.238 HTTP 7987 HTTP/1.1 200 OK  (application/octet-stream)
183   0.019639 172.31.8.238 -> 54.230.117.45 TCP 66 38508 > http [ACK] Seq=97 Ack=1049034 Win=1606272 Len=0 TSval=18656587 TSecr=1690250763
184   0.019776 172.31.8.238 -> 54.230.117.45 TCP 66 38508 > http [FIN, ACK] Seq=97 Ack=1049034 Win=1606272 Len=0 TSval=18656587 TSecr=1690250763
185   0.020519 54.230.117.45 -> 172.31.8.238 TCP 66 http > 38508 [FIN, ACK] Seq=1049034 Ack=98 Win=14592 Len=0 TSval=1690250763 TSecr=18656587
186   0.020527 172.31.8.238 -> 54.230.117.45 TCP 66 38508 > http [ACK] Seq=98 Ack=1049035 Win=1606272 Len=0 TSval=18656587 TSecr=1690250763
