[Measurement for 10kb at 11:32:22 20.32.2014] 
Tshark:

  1   0.000000 172.31.36.109 -> 172.31.0.2   DNS 89 Standard query 0x9abd  A d1xzxs93r3iphc.cloudfront.net
  2   0.000026 172.31.36.109 -> 172.31.0.2   DNS 89 Standard query 0x6854  AAAA d1xzxs93r3iphc.cloudfront.net
  3   0.000540   172.31.0.2 -> 172.31.36.109 DNS 170 Standard query response 0x6854 
  4   0.000552   172.31.0.2 -> 172.31.36.109 DNS 217 Standard query response 0x9abd  A 54.230.29.245 A 54.230.30.56 A 54.230.30.58 A 54.230.30.213 A 54.230.30.234 A 54.230.30.239 A 54.230.30.249 A 54.230.31.7
  5   0.003886 172.31.36.109 -> 54.230.29.245 TCP 74 51197 > http [SYN] Seq=0 Win=26883 Len=0 MSS=8961 SACK_PERM=1 TSval=36707295 TSecr=0 WS=128
  6   0.004996 54.230.29.245 -> 172.31.36.109 TCP 74 http > 51197 [SYN, ACK] Seq=0 Ack=1 Win=14480 Len=0 MSS=1460 SACK_PERM=1 TSval=679135208 TSecr=36707295 WS=128
  7   0.005011 172.31.36.109 -> 54.230.29.245 TCP 66 51197 > http [ACK] Seq=1 Ack=1 Win=27008 Len=0 TSval=36707295 TSecr=679135208
  8   0.005051 172.31.36.109 -> 54.230.29.245 HTTP 163 GET /10kb HTTP/1.1 
  9   0.006215 54.230.29.245 -> 172.31.36.109 TCP 66 http > 51197 [ACK] Seq=1 Ack=98 Win=14592 Len=0 TSval=679135208 TSecr=36707295
 10   0.048492 54.230.29.245 -> 172.31.36.109 HTTP 10761 HTTP/1.1 200 OK  (application/octet-stream)
 11   0.048506 172.31.36.109 -> 54.230.29.245 TCP 66 51197 > http [ACK] Seq=98 Ack=10696 Win=48384 Len=0 TSval=36707306 TSecr=679135212
 12   0.048678 172.31.36.109 -> 54.230.29.245 TCP 66 51197 > http [FIN, ACK] Seq=98 Ack=10696 Win=48384 Len=0 TSval=36707306 TSecr=679135212
 13   0.049943 54.230.29.245 -> 172.31.36.109 TCP 66 http > 51197 [FIN, ACK] Seq=10696 Ack=99 Win=14592 Len=0 TSval=679135212 TSecr=36707306
 14   0.049952 172.31.36.109 -> 54.230.29.245 TCP 66 51197 > http [ACK] Seq=99 Ack=10697 Win=48384 Len=0 TSval=36707306 TSecr=679135212
