[Measurement for 10kb at 07:33:00 20.33.2014] 
Tshark:

  1   0.000000 172.31.36.109 -> 172.31.0.2   DNS 89 Standard query 0xee8b  A d1xzxs93r3iphc.cloudfront.net
  2   0.000023 172.31.36.109 -> 172.31.0.2   DNS 89 Standard query 0x6afa  AAAA d1xzxs93r3iphc.cloudfront.net
  3   0.000536   172.31.0.2 -> 172.31.36.109 DNS 170 Standard query response 0x6afa 
  4   0.000547   172.31.0.2 -> 172.31.36.109 DNS 217 Standard query response 0xee8b  A 54.192.30.214 A 54.230.29.242 A 54.230.30.19 A 54.230.30.50 A 54.230.30.73 A 54.230.30.207 A 54.230.30.218 A 54.230.30.234
  5   0.003914 172.31.36.109 -> 54.192.30.214 TCP 74 50514 > http [SYN] Seq=0 Win=26883 Len=0 MSS=8961 SACK_PERM=1 TSval=33116780 TSecr=0 WS=128
  6   0.005224 54.192.30.214 -> 172.31.36.109 TCP 74 http > 50514 [SYN, ACK] Seq=0 Ack=1 Win=14480 Len=0 MSS=1460 SACK_PERM=1 TSval=716105535 TSecr=33116780 WS=128
  7   0.005260 172.31.36.109 -> 54.192.30.214 TCP 66 50514 > http [ACK] Seq=1 Ack=1 Win=27008 Len=0 TSval=33116780 TSecr=716105535
  8   0.005299 172.31.36.109 -> 54.192.30.214 HTTP 163 GET /10kb HTTP/1.1 
  9   0.006463 54.192.30.214 -> 172.31.36.109 TCP 66 http > 50514 [ACK] Seq=1 Ack=98 Win=14592 Len=0 TSval=716105535 TSecr=33116780
 10   0.013477 54.192.30.214 -> 172.31.36.109 HTTP 10761 HTTP/1.1 200 OK  (application/octet-stream)
 11   0.013487 172.31.36.109 -> 54.192.30.214 TCP 66 50514 > http [ACK] Seq=98 Ack=10696 Win=48384 Len=0 TSval=33116782 TSecr=716105535
 12   0.013651 172.31.36.109 -> 54.192.30.214 TCP 66 50514 > http [FIN, ACK] Seq=98 Ack=10696 Win=48384 Len=0 TSval=33116782 TSecr=716105535
 13   0.014868 54.192.30.214 -> 172.31.36.109 TCP 66 http > 50514 [FIN, ACK] Seq=10696 Ack=99 Win=14592 Len=0 TSval=716105536 TSecr=33116782
 14   0.014875 172.31.36.109 -> 54.192.30.214 TCP 66 50514 > http [ACK] Seq=99 Ack=10697 Win=48384 Len=0 TSval=33116783 TSecr=716105536
