[Measurement for 10kb at 22:32:18 19.32.2014] 
Tshark:

  1   0.000000 172.31.36.109 -> 172.31.0.2   DNS 89 Standard query 0xa7ab  A d1xzxs93r3iphc.cloudfront.net
  2   0.000029 172.31.36.109 -> 172.31.0.2   DNS 89 Standard query 0xa357  AAAA d1xzxs93r3iphc.cloudfront.net
  3   0.000468   172.31.0.2 -> 172.31.36.109 DNS 217 Standard query response 0xa7ab  A 54.192.30.214 A 54.192.30.219 A 54.192.30.226 A 54.192.30.227 A 54.230.30.243 A 54.230.30.245 A 54.192.29.222 A 54.192.29.223
  4   0.000500   172.31.0.2 -> 172.31.36.109 DNS 170 Standard query response 0xa357 
  5   0.003790 172.31.36.109 -> 54.192.30.214 TCP 74 50107 > http [SYN] Seq=0 Win=26883 Len=0 MSS=8961 SACK_PERM=1 TSval=25006209 TSecr=0 WS=128
  6   0.005154 54.192.30.214 -> 172.31.36.109 TCP 74 http > 50107 [SYN, ACK] Seq=0 Ack=1 Win=14480 Len=0 MSS=1460 SACK_PERM=1 TSval=633172451 TSecr=25006209 WS=128
  7   0.005169 172.31.36.109 -> 54.192.30.214 TCP 66 50107 > http [ACK] Seq=1 Ack=1 Win=27008 Len=0 TSval=25006210 TSecr=633172451
  8   0.005208 172.31.36.109 -> 54.192.30.214 HTTP 163 GET /10kb HTTP/1.1 
  9   0.006391 54.192.30.214 -> 172.31.36.109 TCP 66 http > 50107 [ACK] Seq=1 Ack=98 Win=14592 Len=0 TSval=633172452 TSecr=25006210
 10   0.026747 54.192.30.214 -> 172.31.36.109 HTTP 10761 HTTP/1.1 200 OK  (application/octet-stream)
 11   0.026759 172.31.36.109 -> 54.192.30.214 TCP 66 50107 > http [ACK] Seq=98 Ack=10696 Win=48384 Len=0 TSval=25006215 TSecr=633172454
 12   0.026911 172.31.36.109 -> 54.192.30.214 TCP 66 50107 > http [FIN, ACK] Seq=98 Ack=10696 Win=48384 Len=0 TSval=25006215 TSecr=633172454
 13   0.028116 54.192.30.214 -> 172.31.36.109 TCP 66 http > 50107 [FIN, ACK] Seq=10696 Ack=99 Win=14592 Len=0 TSval=633172454 TSecr=25006215
 14   0.028124 172.31.36.109 -> 54.192.30.214 TCP 66 50107 > http [ACK] Seq=99 Ack=10697 Win=48384 Len=0 TSval=25006215 TSecr=633172454
