[Measurement for 100kb at 18:35:18 19.35.2014] 
Tshark:

  1   0.000000 172.31.29.138 -> 172.31.0.2   DNS 89 Standard query 0x60b1  A d39wppo36gwqpx.cloudfront.net
  2   0.000027 172.31.29.138 -> 172.31.0.2   DNS 89 Standard query 0x837e  AAAA d39wppo36gwqpx.cloudfront.net
  3   0.000624   172.31.0.2 -> 172.31.29.138 DNS 170 Standard query response 0x837e 
  4   0.000635   172.31.0.2 -> 172.31.29.138 DNS 217 Standard query response 0x60b1  A 54.192.159.177 A 54.230.156.193 A 54.230.157.230 A 54.230.158.136 A 54.230.158.139 A 54.230.158.246 A 54.192.156.106 A 54.192.159.157
  5   0.003898 172.31.29.138 -> 54.192.159.177 TCP 74 34856 > http [SYN] Seq=0 Win=26883 Len=0 MSS=8961 SACK_PERM=1 TSval=1497782 TSecr=0 WS=128
  6   0.004743 54.192.159.177 -> 172.31.29.138 TCP 74 http > 34856 [SYN, ACK] Seq=0 Ack=1 Win=14480 Len=0 MSS=1460 SACK_PERM=1 TSval=832194705 TSecr=1497782 WS=128
  7   0.004757 172.31.29.138 -> 54.192.159.177 TCP 66 34856 > http [ACK] Seq=1 Ack=1 Win=27008 Len=0 TSval=1497782 TSecr=832194705
  8   0.004796 172.31.29.138 -> 54.192.159.177 HTTP 164 GET /100kb HTTP/1.1 
  9   0.005470 54.192.159.177 -> 172.31.29.138 TCP 66 http > 34856 [ACK] Seq=1 Ack=99 Win=14592 Len=0 TSval=832194705 TSecr=1497782
 10   0.010390 54.192.159.177 -> 172.31.29.138 TCP 5858 [TCP segment of a reassembled PDU]
 11   0.010399 172.31.29.138 -> 54.192.159.177 TCP 66 34856 > http [ACK] Seq=99 Ack=5793 Win=38528 Len=0 TSval=1497783 TSecr=832194705
 12   0.010446 54.192.159.177 -> 172.31.29.138 TCP 7306 [TCP segment of a reassembled PDU]
 13   0.010454 172.31.29.138 -> 54.192.159.177 TCP 66 34856 > http [ACK] Seq=99 Ack=13033 Win=52992 Len=0 TSval=1497783 TSecr=832194705
 14   0.010895 54.192.159.177 -> 172.31.29.138 TCP 4410 [TCP segment of a reassembled PDU]
 15   0.010902 172.31.29.138 -> 54.192.159.177 TCP 66 34856 > http [ACK] Seq=99 Ack=17377 Win=61696 Len=0 TSval=1497784 TSecr=832194705
 16   0.010973 54.192.159.177 -> 172.31.29.138 TCP 8754 [TCP segment of a reassembled PDU]
 17   0.010981 172.31.29.138 -> 54.192.159.177 TCP 66 34856 > http [ACK] Seq=99 Ack=26065 Win=79104 Len=0 TSval=1497784 TSecr=832194705
 18   0.011419 54.192.159.177 -> 172.31.29.138 TCP 4410 [TCP segment of a reassembled PDU]
 19   0.011424 172.31.29.138 -> 54.192.159.177 TCP 66 34856 > http [ACK] Seq=99 Ack=30409 Win=87808 Len=0 TSval=1497784 TSecr=832194705
 20   0.011513 54.192.159.177 -> 172.31.29.138 TCP 15994 [TCP segment of a reassembled PDU]
 21   0.011523 172.31.29.138 -> 54.192.159.177 TCP 66 34856 > http [ACK] Seq=99 Ack=46337 Win=91648 Len=0 TSval=1497784 TSecr=832194705
 22   0.012222 54.192.159.177 -> 172.31.29.138 TCP 5858 [TCP segment of a reassembled PDU]
 23   0.012229 172.31.29.138 -> 54.192.159.177 TCP 66 34856 > http [ACK] Seq=99 Ack=52129 Win=108416 Len=0 TSval=1497784 TSecr=832194705
 24   0.012306 54.192.159.177 -> 172.31.29.138 TCP 13098 [TCP segment of a reassembled PDU]
 25   0.012315 172.31.29.138 -> 54.192.159.177 TCP 66 34856 > http [ACK] Seq=99 Ack=65161 Win=96512 Len=0 TSval=1497784 TSecr=832194705
 26   0.012717 54.192.159.177 -> 172.31.29.138 TCP 5858 [TCP segment of a reassembled PDU]
 27   0.012723 172.31.29.138 -> 54.192.159.177 TCP 66 34856 > http [ACK] Seq=99 Ack=70953 Win=108416 Len=0 TSval=1497784 TSecr=832194706
 28   0.012827 54.192.159.177 -> 172.31.29.138 TCP 20338 [TCP segment of a reassembled PDU]
 29   0.012839 172.31.29.138 -> 54.192.159.177 TCP 66 34856 > http [ACK] Seq=99 Ack=91225 Win=88192 Len=0 TSval=1497784 TSecr=832194706
 30   0.013511 54.192.159.177 -> 172.31.29.138 TCP 10202 [TCP segment of a reassembled PDU]
 31   0.013518 172.31.29.138 -> 54.192.159.177 TCP 66 34856 > http [ACK] Seq=99 Ack=101361 Win=101248 Len=0 TSval=1497784 TSecr=832194706
 32   0.013549 54.192.159.177 -> 172.31.29.138 HTTP 1561 HTTP/1.1 200 OK  (application/octet-stream)
 33   0.013553 172.31.29.138 -> 54.192.159.177 TCP 66 34856 > http [ACK] Seq=99 Ack=102856 Win=109056 Len=0 TSval=1497784 TSecr=832194706
 34   0.013699 172.31.29.138 -> 54.192.159.177 TCP 66 34856 > http [FIN, ACK] Seq=99 Ack=102856 Win=109056 Len=0 TSval=1497784 TSecr=832194706
 35   0.014215 54.192.159.177 -> 172.31.29.138 TCP 66 http > 34856 [FIN, ACK] Seq=102856 Ack=100 Win=14592 Len=0 TSval=832194706 TSecr=1497784
 36   0.014223 172.31.29.138 -> 54.192.159.177 TCP 66 34856 > http [ACK] Seq=100 Ack=102857 Win=109056 Len=0 TSval=1497784 TSecr=832194706
