[Measurement for 100kb at 23:35:18 19.35.2014] 
Tshark:

  1   0.000000 06:38:16:87:8c:c2 -> 06:4e:73:56:a6:a6 ARP 60 Who has 172.31.29.138?  Tell 172.31.16.1
  2   0.000021 06:4e:73:56:a6:a6 -> 06:38:16:87:8c:c2 ARP 42 172.31.29.138 is at 06:4e:73:56:a6:a6
  3   0.724270 172.31.29.138 -> 172.31.0.2   DNS 89 Standard query 0xcc6b  A d39wppo36gwqpx.cloudfront.net
  4   0.724299 172.31.29.138 -> 172.31.0.2   DNS 89 Standard query 0xd4e3  AAAA d39wppo36gwqpx.cloudfront.net
  5   0.724963   172.31.0.2 -> 172.31.29.138 DNS 170 Standard query response 0xd4e3 
  6   0.724975   172.31.0.2 -> 172.31.29.138 DNS 217 Standard query response 0xcc6b  A 54.192.157.144 A 54.192.159.174 A 54.230.157.230 A 54.230.158.139 A 54.230.158.241 A 54.230.159.7 A 54.230.159.132 A 54.230.159.153
  7   0.728114 172.31.29.138 -> 54.192.157.144 TCP 74 46343 > http [SYN] Seq=0 Win=26883 Len=0 MSS=8961 SACK_PERM=1 TSval=5997806 TSecr=0 WS=128
  8   0.728910 54.192.157.144 -> 172.31.29.138 TCP 74 http > 46343 [SYN, ACK] Seq=0 Ack=1 Win=14480 Len=0 MSS=1460 SACK_PERM=1 TSval=832433024 TSecr=5997806 WS=128
  9   0.728925 172.31.29.138 -> 54.192.157.144 TCP 66 46343 > http [ACK] Seq=1 Ack=1 Win=27008 Len=0 TSval=5997806 TSecr=832433024
 10   0.728966 172.31.29.138 -> 54.192.157.144 HTTP 164 GET /100kb HTTP/1.1 
 11   0.729627 54.192.157.144 -> 172.31.29.138 TCP 66 http > 46343 [ACK] Seq=1 Ack=99 Win=14592 Len=0 TSval=832433024 TSecr=5997806
 12   0.731758 54.192.157.144 -> 172.31.29.138 TCP 522 [TCP segment of a reassembled PDU]
 13   0.731765 172.31.29.138 -> 54.192.157.144 TCP 66 46343 > http [ACK] Seq=99 Ack=457 Win=28032 Len=0 TSval=5997806 TSecr=832433024
 14   0.731830 54.192.157.144 -> 172.31.29.138 TCP 13098 [TCP segment of a reassembled PDU]
 15   0.731842 172.31.29.138 -> 54.192.157.144 TCP 66 46343 > http [ACK] Seq=99 Ack=13489 Win=54144 Len=0 TSval=5997806 TSecr=832433024
 16   0.732316 54.192.157.144 -> 172.31.29.138 TCP 8754 [TCP segment of a reassembled PDU]
 17   0.732325 172.31.29.138 -> 54.192.157.144 TCP 66 46343 > http [ACK] Seq=99 Ack=22177 Win=71424 Len=0 TSval=5997807 TSecr=832433024
 18   0.732335 54.192.157.144 -> 172.31.29.138 TCP 4410 [TCP segment of a reassembled PDU]
 19   0.732339 172.31.29.138 -> 54.192.157.144 TCP 66 46343 > http [ACK] Seq=99 Ack=26521 Win=80128 Len=0 TSval=5997807 TSecr=832433024
 20   0.732829 54.192.157.144 -> 172.31.29.138 TCP 2962 [TCP segment of a reassembled PDU]
 21   0.732834 172.31.29.138 -> 54.192.157.144 TCP 66 46343 > http [ACK] Seq=99 Ack=29417 Win=85888 Len=0 TSval=5997807 TSecr=832433024
 22   0.732924 54.192.157.144 -> 172.31.29.138 TCP 13098 [TCP segment of a reassembled PDU]
 23   0.732932 172.31.29.138 -> 54.192.157.144 TCP 66 46343 > http [ACK] Seq=99 Ack=42449 Win=96512 Len=0 TSval=5997807 TSecr=832433024
 24   0.732942 54.192.157.144 -> 172.31.29.138 TCP 4410 [TCP segment of a reassembled PDU]
 25   0.732946 172.31.29.138 -> 54.192.157.144 TCP 66 46343 > http [ACK] Seq=99 Ack=46793 Win=92288 Len=0 TSval=5997807 TSecr=832433024
 26   0.733355 54.192.157.144 -> 172.31.29.138 TCP 5858 [TCP segment of a reassembled PDU]
 27   0.733362 172.31.29.138 -> 54.192.157.144 TCP 66 46343 > http [ACK] Seq=99 Ack=52585 Win=108416 Len=0 TSval=5997807 TSecr=832433024
 28   0.733396 54.192.157.144 -> 172.31.29.138 TCP 8754 [TCP segment of a reassembled PDU]
 29   0.733403 172.31.29.138 -> 54.192.157.144 TCP 66 46343 > http [ACK] Seq=99 Ack=61273 Win=103680 Len=0 TSval=5997807 TSecr=832433024
 30   0.733428 54.192.157.144 -> 172.31.29.138 TCP 4410 [TCP segment of a reassembled PDU]
 31   0.733432 172.31.29.138 -> 54.192.157.144 TCP 66 46343 > http [ACK] Seq=99 Ack=65617 Win=109056 Len=0 TSval=5997807 TSecr=832433024
 32   0.733861 54.192.157.144 -> 172.31.29.138 TCP 1514 [TCP segment of a reassembled PDU]
 33   0.733879 172.31.29.138 -> 54.192.157.144 TCP 66 46343 > http [ACK] Seq=99 Ack=67065 Win=109056 Len=0 TSval=5997807 TSecr=832433024
 34   0.733984 54.192.157.144 -> 172.31.29.138 TCP 17442 [TCP segment of a reassembled PDU]
 35   0.733994 172.31.29.138 -> 54.192.157.144 TCP 66 46343 > http [ACK] Seq=99 Ack=84441 Win=91776 Len=0 TSval=5997807 TSecr=832433024
 36   0.734013 54.192.157.144 -> 172.31.29.138 TCP 4410 [TCP segment of a reassembled PDU]
 37   0.734018 172.31.29.138 -> 54.192.157.144 TCP 66 46343 > http [ACK] Seq=99 Ack=88785 Win=87552 Len=0 TSval=5997807 TSecr=832433024
 38   0.734647 54.192.157.144 -> 172.31.29.138 TCP 10202 [TCP segment of a reassembled PDU]
 39   0.734655 172.31.29.138 -> 54.192.157.144 TCP 66 46343 > http [ACK] Seq=99 Ack=98921 Win=101248 Len=0 TSval=5997807 TSecr=832433024
 40   0.734721 54.192.157.144 -> 172.31.29.138 HTTP 4002 HTTP/1.1 200 OK  (application/octet-stream)
 41   0.734727 172.31.29.138 -> 54.192.157.144 TCP 66 46343 > http [ACK] Seq=99 Ack=102857 Win=109056 Len=0 TSval=5997807 TSecr=832433024
 42   0.734847 172.31.29.138 -> 54.192.157.144 TCP 66 46343 > http [FIN, ACK] Seq=99 Ack=102857 Win=109056 Len=0 TSval=5997807 TSecr=832433024
 43   0.735353 54.192.157.144 -> 172.31.29.138 TCP 66 http > 46343 [FIN, ACK] Seq=102857 Ack=100 Win=14592 Len=0 TSval=832433024 TSecr=5997807
 44   0.735374 172.31.29.138 -> 54.192.157.144 TCP 66 46343 > http [ACK] Seq=100 Ack=102858 Win=109056 Len=0 TSval=5997807 TSecr=832433024
