[Measurement for 1mb at 00:37:19 20.37.2014] 
Tshark:

  1   0.000000 172.31.29.138 -> 172.31.0.2   DNS 89 Standard query 0x9e72  A d1xzxs93r3iphc.cloudfront.net
  2   0.000040 172.31.29.138 -> 172.31.0.2   DNS 89 Standard query 0xeeec  AAAA d1xzxs93r3iphc.cloudfront.net
  3   0.000590   172.31.0.2 -> 172.31.29.138 DNS 170 Standard query response 0xeeec 
  4   0.000601   172.31.0.2 -> 172.31.29.138 DNS 217 Standard query response 0x9e72  A 54.230.150.57 A 54.230.150.65 A 54.230.150.69 A 54.230.150.74 A 54.230.151.219 A 54.230.149.221 A 54.230.150.31 A 54.230.150.45
  5   0.003870 172.31.29.138 -> 54.230.150.57 TCP 74 58218 > http [SYN] Seq=0 Win=26883 Len=0 MSS=8961 SACK_PERM=1 TSval=6928138 TSecr=0 WS=128
  6   0.005478 54.230.150.57 -> 172.31.29.138 TCP 74 http > 58218 [SYN, ACK] Seq=0 Ack=1 Win=14480 Len=0 MSS=1460 SACK_PERM=1 TSval=1452111899 TSecr=6928138 WS=128
  7   0.005492 172.31.29.138 -> 54.230.150.57 TCP 66 58218 > http [ACK] Seq=1 Ack=1 Win=27008 Len=0 TSval=6928138 TSecr=1452111899
  8   0.005538 172.31.29.138 -> 54.230.150.57 HTTP 162 GET /1mb HTTP/1.1 
  9   0.006929 54.230.150.57 -> 172.31.29.138 TCP 66 http > 58218 [ACK] Seq=1 Ack=97 Win=14592 Len=0 TSval=1452111899 TSecr=6928138
 10   0.008514 54.230.150.57 -> 172.31.29.138 TCP 2581 [TCP segment of a reassembled PDU]
 11   0.008523 172.31.29.138 -> 54.230.150.57 TCP 66 58218 > http [ACK] Seq=97 Ack=2516 Win=32000 Len=0 TSval=6928139 TSecr=1452111899
 12   0.008560 54.230.150.57 -> 172.31.29.138 TCP 7306 [TCP segment of a reassembled PDU]
 13   0.008567 172.31.29.138 -> 54.230.150.57 TCP 66 58218 > http [ACK] Seq=97 Ack=9756 Win=46464 Len=0 TSval=6928139 TSecr=1452111899
 14   0.008698 54.230.150.57 -> 172.31.29.138 TCP 2962 [TCP segment of a reassembled PDU]
 15   0.008705 172.31.29.138 -> 54.230.150.57 TCP 66 58218 > http [ACK] Seq=97 Ack=12652 Win=52224 Len=0 TSval=6928139 TSecr=1452111899
 16   0.008726 54.230.150.57 -> 172.31.29.138 TCP 1514 [TCP segment of a reassembled PDU]
 17   0.008731 172.31.29.138 -> 54.230.150.57 TCP 66 58218 > http [ACK] Seq=97 Ack=14100 Win=55168 Len=0 TSval=6928139 TSecr=1452111899
 18   0.010020 54.230.150.57 -> 172.31.29.138 TCP 5858 [TCP segment of a reassembled PDU]
 19   0.010026 172.31.29.138 -> 54.230.150.57 TCP 66 58218 > http [ACK] Seq=97 Ack=19892 Win=66688 Len=0 TSval=6928140 TSecr=1452111899
 20   0.010063 54.230.150.57 -> 172.31.29.138 TCP 7306 [TCP segment of a reassembled PDU]
 21   0.010070 172.31.29.138 -> 54.230.150.57 TCP 66 58218 > http [ACK] Seq=97 Ack=27132 Win=81152 Len=0 TSval=6928140 TSecr=1452111899
 22   0.010246 54.230.150.57 -> 172.31.29.138 TCP 2962 [TCP segment of a reassembled PDU]
 23   0.010251 172.31.29.138 -> 54.230.150.57 TCP 66 58218 > http [ACK] Seq=97 Ack=30028 Win=87040 Len=0 TSval=6928140 TSecr=1452111899
 24   0.010285 54.230.150.57 -> 172.31.29.138 TCP 4410 [TCP segment of a reassembled PDU]
 25   0.010290 172.31.29.138 -> 54.230.150.57 TCP 66 58218 > http [ACK] Seq=97 Ack=34372 Win=95744 Len=0 TSval=6928140 TSecr=1452111899
 26   0.011534 54.230.150.57 -> 172.31.29.138 TCP 2962 [TCP segment of a reassembled PDU]
 27   0.011540 172.31.29.138 -> 54.230.150.57 TCP 66 58218 > http [ACK] Seq=97 Ack=37268 Win=101504 Len=0 TSval=6928140 TSecr=1452111900
 28   0.011625 54.230.150.57 -> 172.31.29.138 TCP 13098 [TCP segment of a reassembled PDU]
 29   0.011634 172.31.29.138 -> 54.230.150.57 TCP 66 58218 > http [ACK] Seq=97 Ack=50300 Win=96512 Len=0 TSval=6928140 TSecr=1452111900
 30   0.011804 54.230.150.57 -> 172.31.29.138 TCP 2962 [TCP segment of a reassembled PDU]
 31   0.011809 172.31.29.138 -> 54.230.150.57 TCP 66 58218 > http [ACK] Seq=97 Ack=53196 Win=107264 Len=0 TSval=6928140 TSecr=1452111900
 32   0.013062 54.230.150.57 -> 172.31.29.138 TCP 1514 [TCP segment of a reassembled PDU]
 33   0.013067 172.31.29.138 -> 54.230.150.57 TCP 66 58218 > http [ACK] Seq=97 Ack=54644 Win=109056 Len=0 TSval=6928140 TSecr=1452111900
 34   0.013220 54.230.150.57 -> 172.31.29.138 TCP 24682 [TCP segment of a reassembled PDU]
 35   0.013233 172.31.29.138 -> 54.230.150.57 TCP 66 58218 > http [ACK] Seq=97 Ack=79260 Win=84480 Len=0 TSval=6928140 TSecr=1452111900
 36   0.014588 54.230.150.57 -> 172.31.29.138 TCP 2962 [TCP segment of a reassembled PDU]
 37   0.014593 172.31.29.138 -> 54.230.150.57 TCP 66 58218 > http [ACK] Seq=97 Ack=82156 Win=109056 Len=0 TSval=6928141 TSecr=1452111900
 38   0.014745 54.230.150.57 -> 172.31.29.138 TCP 29026 [TCP segment of a reassembled PDU]
 39   0.014757 172.31.29.138 -> 54.230.150.57 TCP 66 58218 > http [ACK] Seq=97 Ack=111116 Win=167040 Len=0 TSval=6928141 TSecr=1452111900
 40   0.016198 54.230.150.57 -> 172.31.29.138 TCP 2962 [TCP segment of a reassembled PDU]
 41   0.016205 172.31.29.138 -> 54.230.150.57 TCP 66 58218 > http [ACK] Seq=97 Ack=114012 Win=172800 Len=0 TSval=6928141 TSecr=1452111900
 42   0.016374 54.230.150.57 -> 172.31.29.138 TCP 27578 [TCP segment of a reassembled PDU]
 43   0.016389 172.31.29.138 -> 54.230.150.57 TCP 66 58218 > http [ACK] Seq=97 Ack=141524 Win=227840 Len=0 TSval=6928141 TSecr=1452111900
 44   0.016395 54.230.150.57 -> 172.31.29.138 TCP 1514 [TCP segment of a reassembled PDU]
 45   0.016397 172.31.29.138 -> 54.230.150.57 TCP 66 58218 > http [ACK] Seq=97 Ack=142972 Win=230656 Len=0 TSval=6928141 TSecr=1452111900
 46   0.017695 54.230.150.57 -> 172.31.29.138 TCP 2962 [TCP segment of a reassembled PDU]
 47   0.017714 172.31.29.138 -> 54.230.150.57 TCP 66 58218 > http [ACK] Seq=97 Ack=145868 Win=236544 Len=0 TSval=6928142 TSecr=1452111900
 48   0.017871 54.230.150.57 -> 172.31.29.138 TCP 26130 [TCP segment of a reassembled PDU]
 49   0.017885 172.31.29.138 -> 54.230.150.57 TCP 66 58218 > http [ACK] Seq=97 Ack=171932 Win=288640 Len=0 TSval=6928142 TSecr=1452111900
 50   0.018050 54.230.150.57 -> 172.31.29.138 TCP 8754 [TCP segment of a reassembled PDU]
 51   0.018057 172.31.29.138 -> 54.230.150.57 TCP 66 58218 > http [ACK] Seq=97 Ack=180620 Win=306048 Len=0 TSval=6928142 TSecr=1452111900
 52   0.019264 54.230.150.57 -> 172.31.29.138 TCP 8754 [TCP segment of a reassembled PDU]
 53   0.019271 172.31.29.138 -> 54.230.150.57 TCP 66 58218 > http [ACK] Seq=97 Ack=189308 Win=323328 Len=0 TSval=6928142 TSecr=1452111900
 54   0.019314 54.230.150.57 -> 172.31.29.138 TCP 14546 [TCP segment of a reassembled PDU]
 55   0.019323 172.31.29.138 -> 54.230.150.57 TCP 66 58218 > http [ACK] Seq=97 Ack=203788 Win=352384 Len=0 TSval=6928142 TSecr=1452111900
 56   0.019354 54.230.150.57 -> 172.31.29.138 TCP 7306 [TCP segment of a reassembled PDU]
 57   0.019360 172.31.29.138 -> 54.230.150.57 TCP 66 58218 > http [ACK] Seq=97 Ack=211028 Win=366848 Len=0 TSval=6928142 TSecr=1452111900
 58   0.019478 54.230.150.57 -> 172.31.29.138 TCP 4410 [TCP segment of a reassembled PDU]
 59   0.019484 172.31.29.138 -> 54.230.150.57 TCP 66 58218 > http [ACK] Seq=97 Ack=215372 Win=375552 Len=0 TSval=6928142 TSecr=1452111900
 60   0.020523 54.230.150.57 -> 172.31.29.138 TCP 4410 [TCP segment of a reassembled PDU]
 61   0.020529 172.31.29.138 -> 54.230.150.57 TCP 66 58218 > http [ACK] Seq=97 Ack=219716 Win=384128 Len=0 TSval=6928142 TSecr=1452111901
 62   0.020679 54.230.150.57 -> 172.31.29.138 TCP 17442 [TCP segment of a reassembled PDU]
 63   0.020690 172.31.29.138 -> 54.230.150.57 TCP 66 58218 > http [ACK] Seq=97 Ack=237092 Win=418944 Len=0 TSval=6928142 TSecr=1452111901
 64   0.020764 54.230.150.57 -> 172.31.29.138 TCP 5858 [TCP segment of a reassembled PDU]
 65   0.020771 172.31.29.138 -> 54.230.150.57 TCP 66 58218 > http [ACK] Seq=97 Ack=242884 Win=430464 Len=0 TSval=6928142 TSecr=1452111901
 66   0.020890 54.230.150.57 -> 172.31.29.138 TCP 8754 [TCP segment of a reassembled PDU]
 67   0.020897 172.31.29.138 -> 54.230.150.57 TCP 66 58218 > http [ACK] Seq=97 Ack=251572 Win=447872 Len=0 TSval=6928142 TSecr=1452111901
 68   0.021006 54.230.150.57 -> 172.31.29.138 TCP 5858 [TCP segment of a reassembled PDU]
 69   0.021013 172.31.29.138 -> 54.230.150.57 TCP 66 58218 > http [ACK] Seq=97 Ack=257364 Win=459520 Len=0 TSval=6928142 TSecr=1452111901
 70   0.021125 54.230.150.57 -> 172.31.29.138 TCP 2962 [TCP segment of a reassembled PDU]
 71   0.021130 172.31.29.138 -> 54.230.150.57 TCP 66 58218 > http [ACK] Seq=97 Ack=260260 Win=465280 Len=0 TSval=6928142 TSecr=1452111901
 72   0.022117 54.230.150.57 -> 172.31.29.138 TCP 4410 [TCP segment of a reassembled PDU]
 73   0.022123 172.31.29.138 -> 54.230.150.57 TCP 66 58218 > http [ACK] Seq=97 Ack=264604 Win=473984 Len=0 TSval=6928143 TSecr=1452111901
 74   0.022290 54.230.150.57 -> 172.31.29.138 TCP 26130 [TCP segment of a reassembled PDU]
 75   0.022303 172.31.29.138 -> 54.230.150.57 TCP 66 58218 > http [ACK] Seq=97 Ack=290668 Win=526080 Len=0 TSval=6928143 TSecr=1452111901
 76   0.022313 54.230.150.57 -> 172.31.29.138 TCP 5858 [TCP segment of a reassembled PDU]
 77   0.022317 172.31.29.138 -> 54.230.150.57 TCP 66 58218 > http [ACK] Seq=97 Ack=296460 Win=537728 Len=0 TSval=6928143 TSecr=1452111901
 78   0.022636 54.230.150.57 -> 172.31.29.138 TCP 14546 [TCP segment of a reassembled PDU]
 79   0.022645 172.31.29.138 -> 54.230.150.57 TCP 66 58218 > http [ACK] Seq=97 Ack=310940 Win=566656 Len=0 TSval=6928143 TSecr=1452111901
 80   0.022730 54.230.150.57 -> 172.31.29.138 TCP 8754 [TCP segment of a reassembled PDU]
 81   0.022737 172.31.29.138 -> 54.230.150.57 TCP 66 58218 > http [ACK] Seq=97 Ack=319628 Win=584064 Len=0 TSval=6928143 TSecr=1452111901
 82   0.023619 54.230.150.57 -> 172.31.29.138 TCP 2962 [TCP segment of a reassembled PDU]
 83   0.023624 172.31.29.138 -> 54.230.150.57 TCP 66 58218 > http [ACK] Seq=97 Ack=322524 Win=589824 Len=0 TSval=6928143 TSecr=1452111901
 84   0.023822 54.230.150.57 -> 172.31.29.138 TCP 27578 [TCP segment of a reassembled PDU]
 85   0.023849 172.31.29.138 -> 54.230.150.57 TCP 66 58218 > http [ACK] Seq=97 Ack=350036 Win=644864 Len=0 TSval=6928143 TSecr=1452111901
 86   0.023916 54.230.150.57 -> 172.31.29.138 TCP 8754 [TCP segment of a reassembled PDU]
 87   0.023923 172.31.29.138 -> 54.230.150.57 TCP 66 58218 > http [ACK] Seq=97 Ack=358724 Win=662144 Len=0 TSval=6928143 TSecr=1452111901
 88   0.024043 54.230.150.57 -> 172.31.29.138 TCP 17442 [TCP segment of a reassembled PDU]
 89   0.024053 172.31.29.138 -> 54.230.150.57 TCP 66 58218 > http [ACK] Seq=97 Ack=376100 Win=696960 Len=0 TSval=6928143 TSecr=1452111901
 90   0.025390 54.230.150.57 -> 172.31.29.138 TCP 2962 [TCP segment of a reassembled PDU]
 91   0.025397 172.31.29.138 -> 54.230.150.57 TCP 66 58218 > http [ACK] Seq=97 Ack=378996 Win=702720 Len=0 TSval=6928143 TSecr=1452111901
 92   0.025583 54.230.150.57 -> 172.31.29.138 TCP 26130 [TCP segment of a reassembled PDU]
 93   0.025597 172.31.29.138 -> 54.230.150.57 TCP 66 58218 > http [ACK] Seq=97 Ack=405060 Win=723072 Len=0 TSval=6928143 TSecr=1452111901
 94   0.025607 54.230.150.57 -> 172.31.29.138 TCP 7306 [TCP segment of a reassembled PDU]
 95   0.025612 172.31.29.138 -> 54.230.150.57 TCP 66 58218 > http [ACK] Seq=97 Ack=412300 Win=715904 Len=0 TSval=6928143 TSecr=1452111901
 96   0.025647 54.230.150.57 -> 172.31.29.138 TCP 18890 [TCP segment of a reassembled PDU]
 97   0.025657 172.31.29.138 -> 54.230.150.57 TCP 66 58218 > http [ACK] Seq=97 Ack=431124 Win=697088 Len=0 TSval=6928144 TSecr=1452111901
 98   0.025723 54.230.150.57 -> 172.31.29.138 TCP 17442 [TCP segment of a reassembled PDU]
 99   0.025733 172.31.29.138 -> 54.230.150.57 TCP 66 58218 > http [ACK] Seq=97 Ack=448500 Win=737280 Len=0 TSval=6928144 TSecr=1452111901
100   0.026976 54.230.150.57 -> 172.31.29.138 TCP 5858 [TCP segment of a reassembled PDU]
101   0.026985 172.31.29.138 -> 54.230.150.57 TCP 66 58218 > http [ACK] Seq=97 Ack=454292 Win=756352 Len=0 TSval=6928144 TSecr=1452111901
102   0.027160 54.230.150.57 -> 172.31.29.138 TCP 26130 [TCP segment of a reassembled PDU]
103   0.027201 172.31.29.138 -> 54.230.150.57 TCP 66 58218 > http [ACK] Seq=97 Ack=480356 Win=730368 Len=0 TSval=6928144 TSecr=1452111901
104   0.027245 54.230.150.57 -> 172.31.29.138 TCP 26130 [TCP segment of a reassembled PDU]
105   0.027260 54.230.150.57 -> 172.31.29.138 TCP 2962 [TCP segment of a reassembled PDU]
106   0.027271 172.31.29.138 -> 54.230.150.57 TCP 66 58218 > http [ACK] Seq=97 Ack=509316 Win=718208 Len=0 TSval=6928144 TSecr=1452111901
107   0.028733 54.230.150.57 -> 172.31.29.138 TCP 5858 [TCP segment of a reassembled PDU]
108   0.028740 172.31.29.138 -> 54.230.150.57 TCP 66 58218 > http [ACK] Seq=97 Ack=515108 Win=756352 Len=0 TSval=6928144 TSecr=1452111901
109   0.028922 54.230.150.57 -> 172.31.29.138 TCP 26130 [TCP segment of a reassembled PDU]
110   0.028949 172.31.29.138 -> 54.230.150.57 TCP 66 58218 > http [ACK] Seq=97 Ack=541172 Win=730368 Len=0 TSval=6928144 TSecr=1452111901
111   0.028988 54.230.150.57 -> 172.31.29.138 TCP 26130 [TCP segment of a reassembled PDU]
112   0.029004 54.230.150.57 -> 172.31.29.138 TCP 5858 [TCP segment of a reassembled PDU]
113   0.029014 172.31.29.138 -> 54.230.150.57 TCP 66 58218 > http [ACK] Seq=97 Ack=573028 Win=713472 Len=0 TSval=6928144 TSecr=1452111901
114   0.029039 54.230.150.57 -> 172.31.29.138 TCP 20338 [TCP segment of a reassembled PDU]
115   0.029055 172.31.29.138 -> 54.230.150.57 TCP 66 58218 > http [ACK] Seq=97 Ack=593300 Win=732544 Len=0 TSval=6928144 TSecr=1452111901
116   0.030336 54.230.150.57 -> 172.31.29.138 TCP 2962 [TCP segment of a reassembled PDU]
117   0.030341 172.31.29.138 -> 54.230.150.57 TCP 66 58218 > http [ACK] Seq=97 Ack=596196 Win=761088 Len=0 TSval=6928145 TSecr=1452111901
118   0.030487 54.230.150.57 -> 172.31.29.138 TCP 14546 [TCP segment of a reassembled PDU]
119   0.030497 172.31.29.138 -> 54.230.150.57 TCP 66 58218 > http [ACK] Seq=97 Ack=610676 Win=790272 Len=0 TSval=6928145 TSecr=1452111901
120   0.030551 54.230.150.57 -> 172.31.29.138 TCP 18890 [TCP segment of a reassembled PDU]
121   0.030561 172.31.29.138 -> 54.230.150.57 TCP 66 58218 > http [ACK] Seq=97 Ack=629500 Win=828032 Len=0 TSval=6928145 TSecr=1452111901
122   0.030580 54.230.150.57 -> 172.31.29.138 TCP 7306 [TCP segment of a reassembled PDU]
123   0.030598 172.31.29.138 -> 54.230.150.57 TCP 66 58218 > http [ACK] Seq=97 Ack=636740 Win=842496 Len=0 TSval=6928145 TSecr=1452111901
124   0.030657 54.230.150.57 -> 172.31.29.138 TCP 24682 [TCP segment of a reassembled PDU]
125   0.030668 172.31.29.138 -> 54.230.150.57 TCP 66 58218 > http [ACK] Seq=97 Ack=661356 Win=891648 Len=0 TSval=6928145 TSecr=1452111901
126   0.030683 54.230.150.57 -> 172.31.29.138 TCP 8754 [TCP segment of a reassembled PDU]
127   0.030691 172.31.29.138 -> 54.230.150.57 TCP 66 58218 > http [ACK] Seq=97 Ack=670044 Win=909056 Len=0 TSval=6928145 TSecr=1452111902
128   0.030700 54.230.150.57 -> 172.31.29.138 TCP 5858 [TCP segment of a reassembled PDU]
129   0.030704 172.31.29.138 -> 54.230.150.57 TCP 66 58218 > http [ACK] Seq=97 Ack=675836 Win=920704 Len=0 TSval=6928145 TSecr=1452111902
130   0.032166 54.230.150.57 -> 172.31.29.138 TCP 7306 [TCP segment of a reassembled PDU]
131   0.032174 172.31.29.138 -> 54.230.150.57 TCP 66 58218 > http [ACK] Seq=97 Ack=683076 Win=935168 Len=0 TSval=6928145 TSecr=1452111902
132   0.032330 54.230.150.57 -> 172.31.29.138 TCP 26130 [TCP segment of a reassembled PDU]
133   0.032344 172.31.29.138 -> 54.230.150.57 TCP 66 58218 > http [ACK] Seq=97 Ack=709140 Win=987264 Len=0 TSval=6928145 TSecr=1452111902
134   0.032398 54.230.150.57 -> 172.31.29.138 TCP 26130 [TCP segment of a reassembled PDU]
135   0.032424 172.31.29.138 -> 54.230.150.57 TCP 66 58218 > http [ACK] Seq=97 Ack=735204 Win=1039360 Len=0 TSval=6928145 TSecr=1452111902
136   0.032431 54.230.150.57 -> 172.31.29.138 TCP 1514 [TCP segment of a reassembled PDU]
137   0.032433 172.31.29.138 -> 54.230.150.57 TCP 66 58218 > http [ACK] Seq=97 Ack=736652 Win=1042304 Len=0 TSval=6928145 TSecr=1452111902
138   0.032441 54.230.150.57 -> 172.31.29.138 TCP 1514 [TCP segment of a reassembled PDU]
139   0.032443 172.31.29.138 -> 54.230.150.57 TCP 66 58218 > http [ACK] Seq=97 Ack=738100 Win=1042560 Len=0 TSval=6928145 TSecr=1452111902
140   0.032533 54.230.150.57 -> 172.31.29.138 TCP 37714 [TCP segment of a reassembled PDU]
141   0.032659 172.31.29.138 -> 54.230.150.57 TCP 66 58218 > http [ACK] Seq=97 Ack=775748 Win=1004928 Len=0 TSval=6928145 TSecr=1452111902
142   0.033878 54.230.150.57 -> 172.31.29.138 TCP 4410 [TCP segment of a reassembled PDU]
143   0.033884 172.31.29.138 -> 54.230.150.57 TCP 66 58218 > http [ACK] Seq=97 Ack=780092 Win=1053824 Len=0 TSval=6928146 TSecr=1452111902
144   0.034049 54.230.150.57 -> 172.31.29.138 TCP 17442 [TCP segment of a reassembled PDU]
145   0.034059 172.31.29.138 -> 54.230.150.57 TCP 66 58218 > http [ACK] Seq=97 Ack=797468 Win=1061632 Len=0 TSval=6928146 TSecr=1452111902
146   0.034079 54.230.150.57 -> 172.31.29.138 TCP 8754 [TCP segment of a reassembled PDU]
147   0.034091 172.31.29.138 -> 54.230.150.57 TCP 66 58218 > http [ACK] Seq=97 Ack=806156 Win=1053056 Len=0 TSval=6928146 TSecr=1452111902
148   0.034147 54.230.150.57 -> 172.31.29.138 TCP 26130 [TCP segment of a reassembled PDU]
149   0.034177 54.230.150.57 -> 172.31.29.138 TCP 11650 [TCP segment of a reassembled PDU]
150   0.034190 172.31.29.138 -> 54.230.150.57 TCP 66 58218 > http [ACK] Seq=97 Ack=843804 Win=1028352 Len=0 TSval=6928146 TSecr=1452111902
151   0.034305 54.230.150.57 -> 172.31.29.138 TCP 27578 [TCP segment of a reassembled PDU]
152   0.034316 172.31.29.138 -> 54.230.150.57 TCP 66 58218 > http [ACK] Seq=97 Ack=871316 Win=1044992 Len=0 TSval=6928146 TSecr=1452111902
153   0.035540 54.230.150.57 -> 172.31.29.138 TCP 8754 [TCP segment of a reassembled PDU]
154   0.035548 172.31.29.138 -> 54.230.150.57 TCP 66 58218 > http [ACK] Seq=97 Ack=880004 Win=1075968 Len=0 TSval=6928146 TSecr=1452111902
155   0.035717 54.230.150.57 -> 172.31.29.138 TCP 26130 [TCP segment of a reassembled PDU]
156   0.035756 172.31.29.138 -> 54.230.150.57 TCP 66 58218 > http [ACK] Seq=97 Ack=906068 Win=1049984 Len=0 TSval=6928146 TSecr=1452111902
157   0.035924 54.230.150.57 -> 172.31.29.138 TCP 52194 [TCP segment of a reassembled PDU]
158   0.035955 54.230.150.57 -> 172.31.29.138 TCP 15994 [TCP segment of a reassembled PDU]
