[Measurement for 1mb at 12:37:20 20.37.2014] 
Tshark:

  1   0.000000 172.31.29.138 -> 172.31.0.2   DNS 89 Standard query 0x5a37  A d1xzxs93r3iphc.cloudfront.net
  2   0.000024 172.31.29.138 -> 172.31.0.2   DNS 89 Standard query 0xcf54  AAAA d1xzxs93r3iphc.cloudfront.net
  3   0.000730   172.31.0.2 -> 172.31.29.138 DNS 170 Standard query response 0xcf54 
  4   0.000740   172.31.0.2 -> 172.31.29.138 DNS 217 Standard query response 0x5a37  A 54.230.159.4 A 54.230.159.141 A 54.192.156.109 A 54.192.157.155 A 54.192.157.156 A 54.192.159.168 A 54.230.158.173 A 54.230.158.243
  5   0.003808 172.31.29.138 -> 54.230.159.4 TCP 74 47333 > http [SYN] Seq=0 Win=26883 Len=0 MSS=8961 SACK_PERM=1 TSval=17728335 TSecr=0 WS=128
  6   0.004486 54.230.159.4 -> 172.31.29.138 TCP 74 http > 47333 [SYN, ACK] Seq=0 Ack=1 Win=14480 Len=0 MSS=1460 SACK_PERM=1 TSval=733342064 TSecr=17728335 WS=128
  7   0.004500 172.31.29.138 -> 54.230.159.4 TCP 66 47333 > http [ACK] Seq=1 Ack=1 Win=27008 Len=0 TSval=17728336 TSecr=733342064
  8   0.004539 172.31.29.138 -> 54.230.159.4 HTTP 162 GET /1mb HTTP/1.1 
  9   0.005228 54.230.159.4 -> 172.31.29.138 TCP 66 http > 47333 [ACK] Seq=1 Ack=97 Win=14592 Len=0 TSval=733342064 TSecr=17728336
 10   0.010657 54.230.159.4 -> 172.31.29.138 TCP 2962 [TCP segment of a reassembled PDU]
 11   0.010665 172.31.29.138 -> 54.230.159.4 TCP 66 47333 > http [ACK] Seq=97 Ack=2897 Win=32768 Len=0 TSval=17728337 TSecr=733342065
 12   0.010738 54.230.159.4 -> 172.31.29.138 TCP 10202 [TCP segment of a reassembled PDU]
 13   0.010747 172.31.29.138 -> 54.230.159.4 TCP 66 47333 > http [ACK] Seq=97 Ack=13033 Win=52992 Len=0 TSval=17728337 TSecr=733342065
 14   0.011171 54.230.159.4 -> 172.31.29.138 TCP 5858 [TCP segment of a reassembled PDU]
 15   0.011178 172.31.29.138 -> 54.230.159.4 TCP 66 47333 > http [ACK] Seq=97 Ack=18825 Win=64640 Len=0 TSval=17728337 TSecr=733342065
 16   0.011669 54.230.159.4 -> 172.31.29.138 TCP 7306 [TCP segment of a reassembled PDU]
 17   0.011676 172.31.29.138 -> 54.230.159.4 TCP 66 47333 > http [ACK] Seq=97 Ack=26065 Win=79104 Len=0 TSval=17728337 TSecr=733342065
 18   0.011946 54.230.159.4 -> 172.31.29.138 TCP 5858 [TCP segment of a reassembled PDU]
 19   0.011953 172.31.29.138 -> 54.230.159.4 TCP 66 47333 > http [ACK] Seq=97 Ack=31857 Win=90624 Len=0 TSval=17728337 TSecr=733342065
 20   0.012000 54.230.159.4 -> 172.31.29.138 TCP 5858 [TCP segment of a reassembled PDU]
 21   0.012006 172.31.29.138 -> 54.230.159.4 TCP 66 47333 > http [ACK] Seq=97 Ack=37649 Win=102272 Len=0 TSval=17728337 TSecr=733342065
 22   0.012194 54.230.159.4 -> 172.31.29.138 TCP 2962 [TCP segment of a reassembled PDU]
 23   0.012199 172.31.29.138 -> 54.230.159.4 TCP 66 47333 > http [ACK] Seq=97 Ack=40545 Win=108032 Len=0 TSval=17728337 TSecr=733342065
 24   0.012276 54.230.159.4 -> 172.31.29.138 TCP 2962 [TCP segment of a reassembled PDU]
 25   0.012281 172.31.29.138 -> 54.230.159.4 TCP 66 47333 > http [ACK] Seq=97 Ack=43441 Win=109056 Len=0 TSval=17728337 TSecr=733342065
 26   0.012445 54.230.159.4 -> 172.31.29.138 TCP 8754 [TCP segment of a reassembled PDU]
 27   0.012452 172.31.29.138 -> 54.230.159.4 TCP 66 47333 > http [ACK] Seq=97 Ack=52129 Win=103680 Len=0 TSval=17728338 TSecr=733342065
 28   0.012971 54.230.159.4 -> 172.31.29.138 TCP 7306 [TCP segment of a reassembled PDU]
 29   0.012978 172.31.29.138 -> 54.230.159.4 TCP 66 47333 > http [ACK] Seq=97 Ack=59369 Win=123520 Len=0 TSval=17728338 TSecr=733342065
 30   0.013022 54.230.159.4 -> 172.31.29.138 TCP 5858 [TCP segment of a reassembled PDU]
 31   0.013027 172.31.29.138 -> 54.230.159.4 TCP 66 47333 > http [ACK] Seq=97 Ack=65161 Win=135168 Len=0 TSval=17728338 TSecr=733342065
 32   0.013098 54.230.159.4 -> 172.31.29.138 TCP 14546 [TCP segment of a reassembled PDU]
 33   0.013107 172.31.29.138 -> 54.230.159.4 TCP 66 47333 > http [ACK] Seq=97 Ack=79641 Win=164096 Len=0 TSval=17728338 TSecr=733342065
 34   0.013751 54.230.159.4 -> 172.31.29.138 TCP 5858 [TCP segment of a reassembled PDU]
 35   0.013757 172.31.29.138 -> 54.230.159.4 TCP 66 47333 > http [ACK] Seq=97 Ack=85433 Win=175616 Len=0 TSval=17728338 TSecr=733342065
 36   0.013891 54.230.159.4 -> 172.31.29.138 TCP 20338 [TCP segment of a reassembled PDU]
 37   0.013903 172.31.29.138 -> 54.230.159.4 TCP 66 47333 > http [ACK] Seq=97 Ack=105705 Win=216192 Len=0 TSval=17728338 TSecr=733342065
 38   0.013930 54.230.159.4 -> 172.31.29.138 TCP 5858 [TCP segment of a reassembled PDU]
 39   0.013936 172.31.29.138 -> 54.230.159.4 TCP 66 47333 > http [ACK] Seq=97 Ack=111497 Win=227840 Len=0 TSval=17728338 TSecr=733342065
 40   0.014535 54.230.159.4 -> 172.31.29.138 TCP 13098 [TCP segment of a reassembled PDU]
 41   0.014544 172.31.29.138 -> 54.230.159.4 TCP 66 47333 > http [ACK] Seq=97 Ack=124529 Win=253824 Len=0 TSval=17728338 TSecr=733342065
 42   0.014587 54.230.159.4 -> 172.31.29.138 TCP 6367 [TCP segment of a reassembled PDU]
 43   0.014593 172.31.29.138 -> 54.230.159.4 TCP 66 47333 > http [ACK] Seq=97 Ack=130830 Win=266496 Len=0 TSval=17728338 TSecr=733342065
 44   0.015769 54.230.159.4 -> 172.31.29.138 TCP 5858 [TCP segment of a reassembled PDU]
 45   0.015777 172.31.29.138 -> 54.230.159.4 TCP 66 47333 > http [ACK] Seq=97 Ack=136622 Win=278016 Len=0 TSval=17728338 TSecr=733342065
 46   0.015943 54.230.159.4 -> 172.31.29.138 TCP 17442 [TCP segment of a reassembled PDU]
 47   0.015952 172.31.29.138 -> 54.230.159.4 TCP 66 47333 > http [ACK] Seq=97 Ack=153998 Win=312832 Len=0 TSval=17728338 TSecr=733342065
 48   0.015969 54.230.159.4 -> 172.31.29.138 TCP 13098 [TCP segment of a reassembled PDU]
 49   0.015976 172.31.29.138 -> 54.230.159.4 TCP 66 47333 > http [ACK] Seq=97 Ack=167030 Win=338816 Len=0 TSval=17728338 TSecr=733342065
 50   0.016551 54.230.159.4 -> 172.31.29.138 TCP 5858 [TCP segment of a reassembled PDU]
 51   0.016558 172.31.29.138 -> 54.230.159.4 TCP 66 47333 > http [ACK] Seq=97 Ack=172822 Win=350464 Len=0 TSval=17728339 TSecr=733342065
 52   0.016723 54.230.159.4 -> 172.31.29.138 TCP 23610 [TCP segment of a reassembled PDU]
 53   0.016746 172.31.29.138 -> 54.230.159.4 TCP 66 47333 > http [ACK] Seq=97 Ack=196366 Win=397568 Len=0 TSval=17728339 TSecr=733342065
 54   0.018397 54.230.159.4 -> 172.31.29.138 TCP 1514 [TCP segment of a reassembled PDU]
 55   0.018405 172.31.29.138 -> 54.230.159.4 TCP 66 47333 > http [ACK] Seq=97 Ack=197814 Win=400384 Len=0 TSval=17728339 TSecr=733342065
 56   0.018554 54.230.159.4 -> 172.31.29.138 TCP 17442 [TCP segment of a reassembled PDU]
 57   0.018570 172.31.29.138 -> 54.230.159.4 TCP 66 47333 > http [ACK] Seq=97 Ack=215190 Win=435200 Len=0 TSval=17728339 TSecr=733342065
 58   0.018578 54.230.159.4 -> 172.31.29.138 TCP 2962 [TCP segment of a reassembled PDU]
 59   0.018582 172.31.29.138 -> 54.230.159.4 TCP 66 47333 > http [ACK] Seq=97 Ack=218086 Win=440960 Len=0 TSval=17728339 TSecr=733342065
 60   0.018656 54.230.159.4 -> 172.31.29.138 TCP 15994 [TCP segment of a reassembled PDU]
 61   0.018666 172.31.29.138 -> 54.230.159.4 TCP 66 47333 > http [ACK] Seq=97 Ack=234014 Win=472832 Len=0 TSval=17728339 TSecr=733342065
 62   0.019183 54.230.159.4 -> 172.31.29.138 TCP 21786 [TCP segment of a reassembled PDU]
 63   0.019197 172.31.29.138 -> 54.230.159.4 TCP 66 47333 > http [ACK] Seq=97 Ack=255734 Win=516224 Len=0 TSval=17728339 TSecr=733342065
 64   0.019241 54.230.159.4 -> 172.31.29.138 TCP 6234 [TCP segment of a reassembled PDU]
 65   0.019247 172.31.29.138 -> 54.230.159.4 TCP 66 47333 > http [ACK] Seq=97 Ack=261902 Win=528640 Len=0 TSval=17728339 TSecr=733342065
 66   0.020380 54.230.159.4 -> 172.31.29.138 TCP 2962 [TCP segment of a reassembled PDU]
 67   0.020387 172.31.29.138 -> 54.230.159.4 TCP 66 47333 > http [ACK] Seq=97 Ack=264798 Win=534400 Len=0 TSval=17728340 TSecr=733342066
 68   0.020508 54.230.159.4 -> 172.31.29.138 TCP 26130 [TCP segment of a reassembled PDU]
 69   0.020534 172.31.29.138 -> 54.230.159.4 TCP 66 47333 > http [ACK] Seq=97 Ack=290862 Win=586496 Len=0 TSval=17728340 TSecr=733342066
 70   0.020573 54.230.159.4 -> 172.31.29.138 TCP 18890 [TCP segment of a reassembled PDU]
 71   0.020584 172.31.29.138 -> 54.230.159.4 TCP 66 47333 > http [ACK] Seq=97 Ack=309686 Win=624128 Len=0 TSval=17728340 TSecr=733342066
 72   0.021205 54.230.159.4 -> 172.31.29.138 TCP 2962 [TCP segment of a reassembled PDU]
 73   0.021211 172.31.29.138 -> 54.230.159.4 TCP 66 47333 > http [ACK] Seq=97 Ack=312582 Win=630016 Len=0 TSval=17728340 TSecr=733342066
 74   0.021517 54.230.159.4 -> 172.31.29.138 TCP 14922 [TCP segment of a reassembled PDU]
 75   0.021527 172.31.29.138 -> 54.230.159.4 TCP 66 47333 > http [ACK] Seq=97 Ack=327438 Win=659712 Len=0 TSval=17728340 TSecr=733342066
 76   0.022169 54.230.159.4 -> 172.31.29.138 TCP 10202 [TCP segment of a reassembled PDU]
 77   0.022177 172.31.29.138 -> 54.230.159.4 TCP 66 47333 > http [ACK] Seq=97 Ack=337574 Win=679936 Len=0 TSval=17728340 TSecr=733342066
 78   0.022337 54.230.159.4 -> 172.31.29.138 TCP 26130 [TCP segment of a reassembled PDU]
 79   0.022350 172.31.29.138 -> 54.230.159.4 TCP 66 47333 > http [ACK] Seq=97 Ack=363638 Win=723072 Len=0 TSval=17728340 TSecr=733342066
 80   0.022701 54.230.159.4 -> 172.31.29.138 TCP 4410 [TCP segment of a reassembled PDU]
 81   0.022708 172.31.29.138 -> 54.230.159.4 TCP 66 47333 > http [ACK] Seq=97 Ack=367982 Win=740736 Len=0 TSval=17728340 TSecr=733342066
 82   0.022892 54.230.159.4 -> 172.31.29.138 TCP 24682 [TCP segment of a reassembled PDU]
 83   0.022906 172.31.29.138 -> 54.230.159.4 TCP 66 47333 > http [ACK] Seq=97 Ack=392598 Win=725504 Len=0 TSval=17728340 TSecr=733342066
 84   0.023185 54.230.159.4 -> 172.31.29.138 TCP 442 [TCP segment of a reassembled PDU]
 85   0.023190 172.31.29.138 -> 54.230.159.4 TCP 66 47333 > http [ACK] Seq=97 Ack=392974 Win=740736 Len=0 TSval=17728340 TSecr=733342066
 86   0.024457 54.230.159.4 -> 172.31.29.138 TCP 2962 [TCP segment of a reassembled PDU]
 87   0.024462 172.31.29.138 -> 54.230.159.4 TCP 66 47333 > http [ACK] Seq=97 Ack=395870 Win=746624 Len=0 TSval=17728341 TSecr=733342066
 88   0.024595 54.230.159.4 -> 172.31.29.138 TCP 26130 [TCP segment of a reassembled PDU]
 89   0.024608 172.31.29.138 -> 54.230.159.4 TCP 66 47333 > http [ACK] Seq=97 Ack=421934 Win=723072 Len=0 TSval=17728341 TSecr=733342066
 90   0.024678 54.230.159.4 -> 172.31.29.138 TCP 26130 [TCP segment of a reassembled PDU]
 91   0.024692 172.31.29.138 -> 54.230.159.4 TCP 66 47333 > http [ACK] Seq=97 Ack=447998 Win=723072 Len=0 TSval=17728341 TSecr=733342066
 92   0.024698 54.230.159.4 -> 172.31.29.138 TCP 1514 [TCP segment of a reassembled PDU]
 93   0.024701 172.31.29.138 -> 54.230.159.4 TCP 66 47333 > http [ACK] Seq=97 Ack=449446 Win=721664 Len=0 TSval=17728341 TSecr=733342066
 94   0.025291 54.230.159.4 -> 172.31.29.138 TCP 4410 [TCP segment of a reassembled PDU]
 95   0.025300 172.31.29.138 -> 54.230.159.4 TCP 66 47333 > http [ACK] Seq=97 Ack=453790 Win=755200 Len=0 TSval=17728341 TSecr=733342066
 96   0.025369 54.230.159.4 -> 172.31.29.138 TCP 4786 [TCP segment of a reassembled PDU]
 97   0.025377 172.31.29.138 -> 54.230.159.4 TCP 66 47333 > http [ACK] Seq=97 Ack=458510 Win=756352 Len=0 TSval=17728341 TSecr=733342066
 98   0.026834 54.230.159.4 -> 172.31.29.138 TCP 2962 [TCP segment of a reassembled PDU]
 99   0.026840 172.31.29.138 -> 54.230.159.4 TCP 66 47333 > http [ACK] Seq=97 Ack=461406 Win=761088 Len=0 TSval=17728341 TSecr=733342066
100   0.027242 54.230.159.4 -> 172.31.29.138 TCP 21786 [TCP segment of a reassembled PDU]
101   0.027310 54.230.159.4 -> 172.31.29.138 TCP 4410 [TCP segment of a reassembled PDU]
102   0.027402 54.230.159.4 -> 172.31.29.138 TCP 30474 [TCP segment of a reassembled PDU]
103   0.027510 172.31.29.138 -> 54.230.159.4 TCP 66 47333 > http [ACK] Seq=97 Ack=517878 Win=704640 Len=0 TSval=17728341 TSecr=733342066
104   0.028060 54.230.159.4 -> 172.31.29.138 TCP 2962 [TCP segment of a reassembled PDU]
105   0.028066 172.31.29.138 -> 54.230.159.4 TCP 66 47333 > http [ACK] Seq=97 Ack=520774 Win=761088 Len=0 TSval=17728341 TSecr=733342066
106   0.028187 54.230.159.4 -> 172.31.29.138 TCP 3338 [TCP segment of a reassembled PDU]
107   0.028205 172.31.29.138 -> 54.230.159.4 TCP 66 47333 > http [ACK] Seq=97 Ack=524046 Win=764672 Len=0 TSval=17728341 TSecr=733342066
108   0.029593 54.230.159.4 -> 172.31.29.138 TCP 1514 [TCP segment of a reassembled PDU]
109   0.029826 54.230.159.4 -> 172.31.29.138 TCP 2962 [TCP segment of a reassembled PDU]
110   0.029843 172.31.29.138 -> 54.230.159.4 TCP 66 47333 > http [ACK] Seq=97 Ack=528390 Win=764672 Len=0 TSval=17728342 TSecr=733342066
111   0.030033 54.230.159.4 -> 172.31.29.138 TCP 26130 [TCP segment of a reassembled PDU]
112   0.030059 172.31.29.138 -> 54.230.159.4 TCP 66 47333 > http [ACK] Seq=97 Ack=554454 Win=738688 Len=0 TSval=17728342 TSecr=733342066
113   0.030117 54.230.159.4 -> 172.31.29.138 TCP 26130 [TCP segment of a reassembled PDU]
114   0.030144 54.230.159.4 -> 172.31.29.138 TCP 5858 [TCP segment of a reassembled PDU]
115   0.030156 172.31.29.138 -> 54.230.159.4 TCP 66 47333 > http [ACK] Seq=97 Ack=586310 Win=713472 Len=0 TSval=17728342 TSecr=733342066
116   0.030642 54.230.159.4 -> 172.31.29.138 TCP 3338 [TCP segment of a reassembled PDU]
117   0.030647 172.31.29.138 -> 54.230.159.4 TCP 66 47333 > http [ACK] Seq=97 Ack=589582 Win=758784 Len=0 TSval=17728342 TSecr=733342067
118   0.032178 54.230.159.4 -> 172.31.29.138 TCP 2962 [TCP segment of a reassembled PDU]
119   0.032184 172.31.29.138 -> 54.230.159.4 TCP 66 47333 > http [ACK] Seq=97 Ack=592478 Win=761088 Len=0 TSval=17728342 TSecr=733342067
120   0.032287 54.230.159.4 -> 172.31.29.138 TCP 26130 [TCP segment of a reassembled PDU]
121   0.032386 54.230.159.4 -> 172.31.29.138 TCP 23234 [TCP segment of a reassembled PDU]
122   0.032408 54.230.159.4 -> 172.31.29.138 TCP 2962 [TCP segment of a reassembled PDU]
123   0.032421 54.230.159.4 -> 172.31.29.138 TCP 2962 [TCP segment of a reassembled PDU]
124   0.032483 172.31.29.138 -> 54.230.159.4 TCP 66 47333 > http [ACK] Seq=97 Ack=647502 Win=706176 Len=0 TSval=17728343 TSecr=733342067
125   0.033165 54.230.159.4 -> 172.31.29.138 TCP 4410 [TCP segment of a reassembled PDU]
126   0.033171 172.31.29.138 -> 54.230.159.4 TCP 66 47333 > http [ACK] Seq=97 Ack=651846 Win=758784 Len=0 TSval=17728343 TSecr=733342067
127   0.033277 54.230.159.4 -> 172.31.29.138 TCP 3338 [TCP segment of a reassembled PDU]
128   0.033282 172.31.29.138 -> 54.230.159.4 TCP 66 47333 > http [ACK] Seq=97 Ack=655118 Win=758784 Len=0 TSval=17728343 TSecr=733342067
129   0.035211 54.230.159.4 -> 172.31.29.138 TCP 2962 [TCP segment of a reassembled PDU]
130   0.035216 172.31.29.138 -> 54.230.159.4 TCP 66 47333 > http [ACK] Seq=97 Ack=658014 Win=761088 Len=0 TSval=17728343 TSecr=733342067
131   0.035324 54.230.159.4 -> 172.31.29.138 TCP 26130 [TCP segment of a reassembled PDU]
132   0.035350 172.31.29.138 -> 54.230.159.4 TCP 66 47333 > http [ACK] Seq=97 Ack=684078 Win=735104 Len=0 TSval=17728343 TSecr=733342067
133   0.035401 54.230.159.4 -> 172.31.29.138 TCP 18890 [TCP segment of a reassembled PDU]
134   0.035424 172.31.29.138 -> 54.230.159.4 TCP 66 47333 > http [ACK] Seq=97 Ack=702902 Win=734976 Len=0 TSval=17728343 TSecr=733342067
135   0.035437 54.230.159.4 -> 172.31.29.138 TCP 7306 [TCP segment of a reassembled PDU]
136   0.035452 172.31.29.138 -> 54.230.159.4 TCP 66 47333 > http [ACK] Seq=97 Ack=710142 Win=764672 Len=0 TSval=17728343 TSecr=733342067
137   0.035480 54.230.159.4 -> 172.31.29.138 TCP 10578 [TCP segment of a reassembled PDU]
138   0.035504 172.31.29.138 -> 54.230.159.4 TCP 66 47333 > http [ACK] Seq=97 Ack=720654 Win=764672 Len=0 TSval=17728343 TSecr=733342067
139   0.037526 54.230.159.4 -> 172.31.29.138 TCP 1514 [TCP segment of a reassembled PDU]
140   0.037632 54.230.159.4 -> 172.31.29.138 TCP 1514 [TCP segment of a reassembled PDU]
141   0.037648 172.31.29.138 -> 54.230.159.4 TCP 66 47333 > http [ACK] Seq=97 Ack=723550 Win=764672 Len=0 TSval=17728344 TSecr=733342067
142   0.037788 54.230.159.4 -> 172.31.29.138 TCP 5858 [TCP segment of a reassembled PDU]
143   0.037804 172.31.29.138 -> 54.230.159.4 TCP 66 47333 > http [ACK] Seq=97 Ack=729342 Win=764672 Len=0 TSval=17728344 TSecr=733342067
144   0.037956 54.230.159.4 -> 172.31.29.138 TCP 26130 [TCP segment of a reassembled PDU]
145   0.037982 172.31.29.138 -> 54.230.159.4 TCP 66 47333 > http [ACK] Seq=97 Ack=755406 Win=738688 Len=0 TSval=17728344 TSecr=733342067
146   0.038035 54.230.159.4 -> 172.31.29.138 TCP 26130 [TCP segment of a reassembled PDU]
147   0.038076 54.230.159.4 -> 172.31.29.138 TCP 4786 [TCP segment of a reassembled PDU]
148   0.038083 172.31.29.138 -> 54.230.159.4 TCP 66 47333 > http [ACK] Seq=97 Ack=781470 Win=723072 Len=0 TSval=17728344 TSecr=733342067
149   0.038097 172.31.29.138 -> 54.230.159.4 TCP 66 47333 > http [ACK] Seq=97 Ack=786190 Win=764672 Len=0 TSval=17728344 TSecr=733342067
150   0.039559 54.230.159.4 -> 172.31.29.138 TCP 2962 [TCP segment of a reassembled PDU]
151   0.039574 172.31.29.138 -> 54.230.159.4 TCP 66 47333 > http [ACK] Seq=97 Ack=789086 Win=764672 Len=0 TSval=17728344 TSecr=733342067
152   0.039667 54.230.159.4 -> 172.31.29.138 TCP 20338 [TCP segment of a reassembled PDU]
153   0.039689 172.31.29.138 -> 54.230.159.4 TCP 66 47333 > http [ACK] Seq=97 Ack=809358 Win=744448 Len=0 TSval=17728344 TSecr=733342067
154   0.039740 54.230.159.4 -> 172.31.29.138 TCP 26130 [TCP segment of a reassembled PDU]
155   0.039778 172.31.29.138 -> 54.230.159.4 TCP 66 47333 > http [ACK] Seq=97 Ack=835422 Win=723072 Len=0 TSval=17728344 TSecr=733342067
156   0.039794 54.230.159.4 -> 172.31.29.138 TCP 16370 [TCP segment of a reassembled PDU]
157   0.039818 172.31.29.138 -> 54.230.159.4 TCP 66 47333 > http [ACK] Seq=97 Ack=851726 Win=737280 Len=0 TSval=17728344 TSecr=733342067
158   0.040388 54.230.159.4 -> 172.31.29.138 TCP 8754 [TCP segment of a reassembled PDU]
159   0.040396 172.31.29.138 -> 54.230.159.4 TCP 66 47333 > http [ACK] Seq=97 Ack=860414 Win=751616 Len=0 TSval=17728345 TSecr=733342068
160   0.040539 54.230.159.4 -> 172.31.29.138 TCP 26130 [TCP segment of a reassembled PDU]
161   0.040564 172.31.29.138 -> 54.230.159.4 TCP 66 47333 > http [ACK] Seq=97 Ack=886478 Win=725632 Len=0 TSval=17728345 TSecr=733342068
162   0.040616 54.230.159.4 -> 172.31.29.138 TCP 26130 [TCP segment of a reassembled PDU]
163   0.040638 54.230.159.4 -> 172.31.29.138 TCP 1514 [TCP segment of a reassembled PDU]
164   0.040648 172.31.29.138 -> 54.230.159.4 TCP 66 47333 > http [ACK] Seq=97 Ack=913990 Win=720640 Len=0 TSval=17728345 TSecr=733342068
165   0.041078 54.230.159.4 -> 172.31.29.138 TCP 3338 [TCP segment of a reassembled PDU]
166   0.041084 172.31.29.138 -> 54.230.159.4 TCP 66 47333 > http [ACK] Seq=97 Ack=917262 Win=758784 Len=0 TSval=17728345 TSecr=733342068
167   0.044180 54.230.159.4 -> 172.31.29.138 TCP 8754 [TCP segment of a reassembled PDU]
168   0.044201 172.31.29.138 -> 54.230.159.4 TCP 66 47333 > http [ACK] Seq=97 Ack=925950 Win=764672 Len=0 TSval=17728345 TSecr=733342068
169   0.044343 54.230.159.4 -> 172.31.29.138 TCP 26130 [TCP segment of a reassembled PDU]
170   0.044367 172.31.29.138 -> 54.230.159.4 TCP 66 47333 > http [ACK] Seq=97 Ack=952014 Win=738688 Len=0 TSval=17728346 TSecr=733342068
171   0.044415 54.230.159.4 -> 172.31.29.138 TCP 21786 [TCP segment of a reassembled PDU]
172   0.044440 54.230.159.4 -> 172.31.29.138 TCP 4410 [TCP segment of a reassembled PDU]
173   0.044446 54.230.159.4 -> 172.31.29.138 TCP 4786 [TCP segment of a reassembled PDU]
174   0.044451 54.230.159.4 -> 172.31.29.138 TCP 1514 [TCP segment of a reassembled PDU]
175   0.044459 172.31.29.138 -> 54.230.159.4 TCP 66 47333 > http [ACK] Seq=97 Ack=984246 Win=711168 Len=0 TSval=17728346 TSecr=733342068
176   0.045183 54.230.159.4 -> 172.31.29.138 TCP 4410 [TCP segment of a reassembled PDU]
177   0.045189 172.31.29.138 -> 54.230.159.4 TCP 66 47333 > http [ACK] Seq=97 Ack=988590 Win=758784 Len=0 TSval=17728346 TSecr=733342068
178   0.045365 54.230.159.4 -> 172.31.29.138 TCP 26130 [TCP segment of a reassembled PDU]
179   0.045388 172.31.29.138 -> 54.230.159.4 TCP 66 47333 > http [ACK] Seq=97 Ack=1014654 Win=732800 Len=0 TSval=17728346 TSecr=733342068
180   0.045433 54.230.159.4 -> 172.31.29.138 TCP 20338 [TCP segment of a reassembled PDU]
181   0.045463 54.230.159.4 -> 172.31.29.138 TCP 5858 [TCP segment of a reassembled PDU]
182   0.045469 54.230.159.4 -> 172.31.29.138 TCP 4410 [TCP segment of a reassembled PDU]
183   0.045473 54.230.159.4 -> 172.31.29.138 HTTP 4038 HTTP/1.1 200 OK  (application/octet-stream)
184   0.045477 172.31.29.138 -> 54.230.159.4 TCP 66 47333 > http [ACK] Seq=97 Ack=1034926 Win=732544 Len=0 TSval=17728346 TSecr=733342068
185   0.045491 172.31.29.138 -> 54.230.159.4 TCP 66 47333 > http [ACK] Seq=97 Ack=1049034 Win=758784 Len=0 TSval=17728346 TSecr=733342068
186   0.045626 172.31.29.138 -> 54.230.159.4 TCP 66 47333 > http [FIN, ACK] Seq=97 Ack=1049034 Win=764672 Len=0 TSval=17728346 TSecr=733342068
187   0.046485 54.230.159.4 -> 172.31.29.138 TCP 66 http > 47333 [FIN, ACK] Seq=1049034 Ack=98 Win=14592 Len=0 TSval=733342068 TSecr=17728346
188   0.046494 172.31.29.138 -> 54.230.159.4 TCP 66 47333 > http [ACK] Seq=98 Ack=1049035 Win=764672 Len=0 TSval=17728346 TSecr=733342068
