[Measurement for 1mb at 04:37:20 20.37.2014] 
Tshark:

  1   0.000000 172.31.29.138 -> 172.31.0.2   DNS 89 Standard query 0x62c0  A d1xzxs93r3iphc.cloudfront.net
  2   0.000035 172.31.29.138 -> 172.31.0.2   DNS 89 Standard query 0x1f7d  AAAA d1xzxs93r3iphc.cloudfront.net
  3   0.000685   172.31.0.2 -> 172.31.29.138 DNS 217 Standard query response 0x62c0  A 54.230.150.16 A 54.230.150.31 A 54.230.150.42 A 54.230.150.43 A 54.230.150.154 A 54.230.148.75 A 54.230.149.38 A 54.230.149.226
  4   0.000696   172.31.0.2 -> 172.31.29.138 DNS 170 Standard query response 0x1f7d 
  5   0.003896 172.31.29.138 -> 54.230.150.16 TCP 74 41611 > http [SYN] Seq=0 Win=26883 Len=0 MSS=8961 SACK_PERM=1 TSval=10528296 TSecr=0 WS=128
  6   0.005349 54.230.150.16 -> 172.31.29.138 TCP 74 http > 41611 [SYN, ACK] Seq=0 Ack=1 Win=14480 Len=0 MSS=1460 SACK_PERM=1 TSval=1453894472 TSecr=10528296 WS=128
  7   0.005363 172.31.29.138 -> 54.230.150.16 TCP 66 41611 > http [ACK] Seq=1 Ack=1 Win=27008 Len=0 TSval=10528296 TSecr=1453894472
  8   0.005403 172.31.29.138 -> 54.230.150.16 HTTP 162 GET /1mb HTTP/1.1 
  9   0.006841 54.230.150.16 -> 172.31.29.138 TCP 66 http > 41611 [ACK] Seq=1 Ack=97 Win=14592 Len=0 TSval=1453894472 TSecr=10528296
 10   0.009477 54.230.150.16 -> 172.31.29.138 TCP 523 [TCP segment of a reassembled PDU]
 11   0.009484 172.31.29.138 -> 54.230.150.16 TCP 66 41611 > http [ACK] Seq=97 Ack=458 Win=28032 Len=0 TSval=10528297 TSecr=1453894473
 12   0.009541 54.230.150.16 -> 172.31.29.138 TCP 13098 [TCP segment of a reassembled PDU]
 13   0.009551 172.31.29.138 -> 54.230.150.16 TCP 66 41611 > http [ACK] Seq=97 Ack=13490 Win=54144 Len=0 TSval=10528297 TSecr=1453894473
 14   0.010950 54.230.150.16 -> 172.31.29.138 TCP 4410 [TCP segment of a reassembled PDU]
 15   0.010956 172.31.29.138 -> 54.230.150.16 TCP 66 41611 > http [ACK] Seq=97 Ack=17834 Win=62720 Len=0 TSval=10528298 TSecr=1453894473
 16   0.011044 54.230.150.16 -> 172.31.29.138 TCP 8754 [TCP segment of a reassembled PDU]
 17   0.011052 172.31.29.138 -> 54.230.150.16 TCP 66 41611 > http [ACK] Seq=97 Ack=26522 Win=80128 Len=0 TSval=10528298 TSecr=1453894473
 18   0.012470 54.230.150.16 -> 172.31.29.138 TCP 4410 [TCP segment of a reassembled PDU]
 19   0.012476 172.31.29.138 -> 54.230.150.16 TCP 66 41611 > http [ACK] Seq=97 Ack=30866 Win=88832 Len=0 TSval=10528298 TSecr=1453894473
 20   0.012546 54.230.150.16 -> 172.31.29.138 TCP 8754 [TCP segment of a reassembled PDU]
 21   0.012553 172.31.29.138 -> 54.230.150.16 TCP 66 41611 > http [ACK] Seq=97 Ack=39554 Win=103680 Len=0 TSval=10528298 TSecr=1453894473
 22   0.012567 54.230.150.16 -> 172.31.29.138 TCP 7306 [TCP segment of a reassembled PDU]
 23   0.012576 172.31.29.138 -> 54.230.150.16 TCP 66 41611 > http [ACK] Seq=97 Ack=46794 Win=96512 Len=0 TSval=10528298 TSecr=1453894473
 24   0.013871 54.230.150.16 -> 172.31.29.138 TCP 2962 [TCP segment of a reassembled PDU]
 25   0.013876 172.31.29.138 -> 54.230.150.16 TCP 66 41611 > http [ACK] Seq=97 Ack=49690 Win=109056 Len=0 TSval=10528298 TSecr=1453894473
 26   0.013933 54.230.150.16 -> 172.31.29.138 TCP 2962 [TCP segment of a reassembled PDU]
 27   0.013938 172.31.29.138 -> 54.230.150.16 TCP 66 41611 > http [ACK] Seq=97 Ack=52586 Win=109056 Len=0 TSval=10528298 TSecr=1453894473
 28   0.014128 54.230.150.16 -> 172.31.29.138 TCP 4410 [TCP segment of a reassembled PDU]
 29   0.014133 172.31.29.138 -> 54.230.150.16 TCP 66 41611 > http [ACK] Seq=97 Ack=56930 Win=109056 Len=0 TSval=10528299 TSecr=1453894473
 30   0.014209 54.230.150.16 -> 172.31.29.138 TCP 8754 [TCP segment of a reassembled PDU]
 31   0.014216 172.31.29.138 -> 54.230.150.16 TCP 66 41611 > http [ACK] Seq=97 Ack=65618 Win=126464 Len=0 TSval=10528299 TSecr=1453894473
 32   0.015420 54.230.150.16 -> 172.31.29.138 TCP 5858 [TCP segment of a reassembled PDU]
 33   0.015439 172.31.29.138 -> 54.230.150.16 TCP 66 41611 > http [ACK] Seq=97 Ack=71410 Win=137984 Len=0 TSval=10528299 TSecr=1453894473
 34   0.015519 54.230.150.16 -> 172.31.29.138 TCP 7306 [TCP segment of a reassembled PDU]
 35   0.015525 172.31.29.138 -> 54.230.150.16 TCP 66 41611 > http [ACK] Seq=97 Ack=78650 Win=152448 Len=0 TSval=10528299 TSecr=1453894473
 36   0.015782 54.230.150.16 -> 172.31.29.138 TCP 17442 [TCP segment of a reassembled PDU]
 37   0.015806 172.31.29.138 -> 54.230.150.16 TCP 66 41611 > http [ACK] Seq=97 Ack=96026 Win=187264 Len=0 TSval=10528299 TSecr=1453894473
 38   0.016969 54.230.150.16 -> 172.31.29.138 TCP 8754 [TCP segment of a reassembled PDU]
 39   0.016977 172.31.29.138 -> 54.230.150.16 TCP 66 41611 > http [ACK] Seq=97 Ack=104714 Win=204672 Len=0 TSval=10528299 TSecr=1453894473
 40   0.017291 54.230.150.16 -> 172.31.29.138 TCP 26130 [TCP segment of a reassembled PDU]
 41   0.017303 172.31.29.138 -> 54.230.150.16 TCP 66 41611 > http [ACK] Seq=97 Ack=130778 Win=256768 Len=0 TSval=10528299 TSecr=1453894473
 42   0.018740 54.230.150.16 -> 172.31.29.138 TCP 7306 [TCP segment of a reassembled PDU]
 43   0.018748 172.31.29.138 -> 54.230.150.16 TCP 66 41611 > http [ACK] Seq=97 Ack=138018 Win=271232 Len=0 TSval=10528300 TSecr=1453894473
 44   0.018877 54.230.150.16 -> 172.31.29.138 TCP 18890 [TCP segment of a reassembled PDU]
 45   0.018888 172.31.29.138 -> 54.230.150.16 TCP 66 41611 > http [ACK] Seq=97 Ack=156842 Win=308864 Len=0 TSval=10528300 TSecr=1453894473
 46   0.020291 54.230.150.16 -> 172.31.29.138 TCP 11650 [TCP segment of a reassembled PDU]
 47   0.020300 172.31.29.138 -> 54.230.150.16 TCP 66 41611 > http [ACK] Seq=97 Ack=168426 Win=332032 Len=0 TSval=10528300 TSecr=1453894474
 48   0.020416 54.230.150.16 -> 172.31.29.138 TCP 14546 [TCP segment of a reassembled PDU]
 49   0.020426 172.31.29.138 -> 54.230.150.16 TCP 66 41611 > http [ACK] Seq=97 Ack=182906 Win=360960 Len=0 TSval=10528300 TSecr=1453894474
 50   0.020463 54.230.150.16 -> 172.31.29.138 TCP 14546 [TCP segment of a reassembled PDU]
 51   0.020474 172.31.29.138 -> 54.230.150.16 TCP 66 41611 > http [ACK] Seq=97 Ack=197386 Win=390016 Len=0 TSval=10528300 TSecr=1453894474
 52   0.021729 54.230.150.16 -> 172.31.29.138 TCP 8754 [TCP segment of a reassembled PDU]
 53   0.021737 172.31.29.138 -> 54.230.150.16 TCP 66 41611 > http [ACK] Seq=97 Ack=206074 Win=407296 Len=0 TSval=10528300 TSecr=1453894474
 54   0.021819 54.230.150.16 -> 172.31.29.138 TCP 2962 [TCP segment of a reassembled PDU]
 55   0.021824 172.31.29.138 -> 54.230.150.16 TCP 66 41611 > http [ACK] Seq=97 Ack=208970 Win=413184 Len=0 TSval=10528300 TSecr=1453894474
 56   0.022122 54.230.150.16 -> 172.31.29.138 TCP 26130 [TCP segment of a reassembled PDU]
 57   0.022135 172.31.29.138 -> 54.230.150.16 TCP 66 41611 > http [ACK] Seq=97 Ack=235034 Win=465280 Len=0 TSval=10528301 TSecr=1453894474
 58   0.022146 54.230.150.16 -> 172.31.29.138 TCP 7306 [TCP segment of a reassembled PDU]
 59   0.022151 172.31.29.138 -> 54.230.150.16 TCP 66 41611 > http [ACK] Seq=97 Ack=242274 Win=479744 Len=0 TSval=10528301 TSecr=1453894474
 60   0.023518 54.230.150.16 -> 172.31.29.138 TCP 7306 [TCP segment of a reassembled PDU]
 61   0.023526 172.31.29.138 -> 54.230.150.16 TCP 66 41611 > http [ACK] Seq=97 Ack=249514 Win=494208 Len=0 TSval=10528301 TSecr=1453894474
 62   0.023680 54.230.150.16 -> 172.31.29.138 TCP 18890 [TCP segment of a reassembled PDU]
 63   0.023690 172.31.29.138 -> 54.230.150.16 TCP 66 41611 > http [ACK] Seq=97 Ack=268338 Win=531840 Len=0 TSval=10528301 TSecr=1453894474
 64   0.023715 54.230.150.16 -> 172.31.29.138 TCP 7306 [TCP segment of a reassembled PDU]
 65   0.023721 172.31.29.138 -> 54.230.150.16 TCP 66 41611 > http [ACK] Seq=97 Ack=275578 Win=546304 Len=0 TSval=10528301 TSecr=1453894474
 66   0.023767 54.230.150.16 -> 172.31.29.138 TCP 8754 [TCP segment of a reassembled PDU]
 67   0.023774 172.31.29.138 -> 54.230.150.16 TCP 66 41611 > http [ACK] Seq=97 Ack=284266 Win=563712 Len=0 TSval=10528301 TSecr=1453894474
 68   0.025057 54.230.150.16 -> 172.31.29.138 TCP 10202 [TCP segment of a reassembled PDU]
 69   0.025065 172.31.29.138 -> 54.230.150.16 TCP 66 41611 > http [ACK] Seq=97 Ack=294402 Win=584064 Len=0 TSval=10528301 TSecr=1453894474
 70   0.025238 54.230.150.16 -> 172.31.29.138 TCP 26130 [TCP segment of a reassembled PDU]
 71   0.025251 172.31.29.138 -> 54.230.150.16 TCP 66 41611 > http [ACK] Seq=97 Ack=320466 Win=569856 Len=0 TSval=10528301 TSecr=1453894474
 72   0.025263 54.230.150.16 -> 172.31.29.138 TCP 10202 [TCP segment of a reassembled PDU]
 73   0.025272 172.31.29.138 -> 54.230.150.16 TCP 66 41611 > http [ACK] Seq=97 Ack=330602 Win=559744 Len=0 TSval=10528301 TSecr=1453894474
 74   0.026592 54.230.150.16 -> 172.31.29.138 TCP 7306 [TCP segment of a reassembled PDU]
 75   0.026601 172.31.29.138 -> 54.230.150.16 TCP 66 41611 > http [ACK] Seq=97 Ack=337842 Win=598528 Len=0 TSval=10528302 TSecr=1453894474
 76   0.026757 54.230.150.16 -> 172.31.29.138 TCP 26130 [TCP segment of a reassembled PDU]
 77   0.026770 172.31.29.138 -> 54.230.150.16 TCP 66 41611 > http [ACK] Seq=97 Ack=363906 Win=572544 Len=0 TSval=10528302 TSecr=1453894474
 78   0.026804 54.230.150.16 -> 172.31.29.138 TCP 14546 [TCP segment of a reassembled PDU]
 79   0.026813 172.31.29.138 -> 54.230.150.16 TCP 66 41611 > http [ACK] Seq=97 Ack=378386 Win=558080 Len=0 TSval=10528302 TSecr=1453894474
 80   0.026820 54.230.150.16 -> 172.31.29.138 TCP 4410 [TCP segment of a reassembled PDU]
 81   0.026823 172.31.29.138 -> 54.230.150.16 TCP 66 41611 > http [ACK] Seq=97 Ack=382730 Win=553856 Len=0 TSval=10528302 TSecr=1453894474
 82   0.026846 54.230.150.16 -> 172.31.29.138 TCP 8754 [TCP segment of a reassembled PDU]
 83   0.026853 172.31.29.138 -> 54.230.150.16 TCP 66 41611 > http [ACK] Seq=97 Ack=391418 Win=545280 Len=0 TSval=10528302 TSecr=1453894474
 84   0.028149 54.230.150.16 -> 172.31.29.138 TCP 11650 [TCP segment of a reassembled PDU]
 85   0.028158 172.31.29.138 -> 54.230.150.16 TCP 66 41611 > http [ACK] Seq=97 Ack=403002 Win=593664 Len=0 TSval=10528302 TSecr=1453894474
 86   0.028314 54.230.150.16 -> 172.31.29.138 TCP 26130 [TCP segment of a reassembled PDU]
 87   0.028328 172.31.29.138 -> 54.230.150.16 TCP 66 41611 > http [ACK] Seq=97 Ack=429066 Win=569856 Len=0 TSval=10528302 TSecr=1453894474
 88   0.028345 54.230.150.16 -> 172.31.29.138 TCP 11650 [TCP segment of a reassembled PDU]
 89   0.028351 172.31.29.138 -> 54.230.150.16 TCP 66 41611 > http [ACK] Seq=97 Ack=440650 Win=558336 Len=0 TSval=10528302 TSecr=1453894474
 90   0.028362 54.230.150.16 -> 172.31.29.138 TCP 8754 [TCP segment of a reassembled PDU]
 91   0.028367 172.31.29.138 -> 54.230.150.16 TCP 66 41611 > http [ACK] Seq=97 Ack=449338 Win=549760 Len=0 TSval=10528302 TSecr=1453894474
 92   0.029420 54.230.150.16 -> 172.31.29.138 TCP 5858 [TCP segment of a reassembled PDU]
 93   0.029426 172.31.29.138 -> 54.230.150.16 TCP 66 41611 > http [ACK] Seq=97 Ack=455130 Win=603136 Len=0 TSval=10528302 TSecr=1453894475
 94   0.029591 54.230.150.16 -> 172.31.29.138 TCP 17442 [TCP segment of a reassembled PDU]
 95   0.029601 172.31.29.138 -> 54.230.150.16 TCP 66 41611 > http [ACK] Seq=97 Ack=472506 Win=585856 Len=0 TSval=10528302 TSecr=1453894475
 96   0.029670 54.230.150.16 -> 172.31.29.138 TCP 4410 [TCP segment of a reassembled PDU]
 97   0.029676 172.31.29.138 -> 54.230.150.16 TCP 66 41611 > http [ACK] Seq=97 Ack=476850 Win=605568 Len=0 TSval=10528302 TSecr=1453894475
 98   0.029855 54.230.150.16 -> 172.31.29.138 TCP 26130 [TCP segment of a reassembled PDU]
 99   0.029901 54.230.150.16 -> 172.31.29.138 TCP 20338 [TCP segment of a reassembled PDU]
100   0.029919 172.31.29.138 -> 54.230.150.16 TCP 66 41611 > http [ACK] Seq=97 Ack=523186 Win=559232 Len=0 TSval=10528302 TSecr=1453894475
101   0.030969 54.230.150.16 -> 172.31.29.138 TCP 4410 [TCP segment of a reassembled PDU]
102   0.030980 172.31.29.138 -> 54.230.150.16 TCP 66 41611 > http [ACK] Seq=97 Ack=527530 Win=605568 Len=0 TSval=10528303 TSecr=1453894475
103   0.031118 54.230.150.16 -> 172.31.29.138 TCP 21786 [TCP segment of a reassembled PDU]
104   0.031131 172.31.29.138 -> 54.230.150.16 TCP 66 41611 > http [ACK] Seq=97 Ack=549250 Win=653568 Len=0 TSval=10528303 TSecr=1453894475
105   0.031462 54.230.150.16 -> 172.31.29.138 TCP 8754 [TCP segment of a reassembled PDU]
106   0.031471 172.31.29.138 -> 54.230.150.16 TCP 66 41611 > http [ACK] Seq=97 Ack=557938 Win=670848 Len=0 TSval=10528303 TSecr=1453894475
107   0.031649 54.230.150.16 -> 172.31.29.138 TCP 26130 [TCP segment of a reassembled PDU]
108   0.031663 172.31.29.138 -> 54.230.150.16 TCP 66 41611 > http [ACK] Seq=97 Ack=584002 Win=723072 Len=0 TSval=10528303 TSecr=1453894475
109   0.031671 54.230.150.16 -> 172.31.29.138 TCP 1514 [TCP segment of a reassembled PDU]
110   0.031673 172.31.29.138 -> 54.230.150.16 TCP 66 41611 > http [ACK] Seq=97 Ack=585450 Win=725888 Len=0 TSval=10528303 TSecr=1453894475
111   0.031698 54.230.150.16 -> 172.31.29.138 TCP 17442 [TCP segment of a reassembled PDU]
112   0.031707 172.31.29.138 -> 54.230.150.16 TCP 66 41611 > http [ACK] Seq=97 Ack=602826 Win=760704 Len=0 TSval=10528303 TSecr=1453894475
113   0.032495 54.230.150.16 -> 172.31.29.138 TCP 5858 [TCP segment of a reassembled PDU]
114   0.032503 172.31.29.138 -> 54.230.150.16 TCP 66 41611 > http [ACK] Seq=97 Ack=608618 Win=772224 Len=0 TSval=10528303 TSecr=1453894475
115   0.032626 54.230.150.16 -> 172.31.29.138 TCP 13098 [TCP segment of a reassembled PDU]
116   0.032635 172.31.29.138 -> 54.230.150.16 TCP 66 41611 > http [ACK] Seq=97 Ack=621650 Win=798336 Len=0 TSval=10528303 TSecr=1453894475
117   0.033010 54.230.150.16 -> 172.31.29.138 TCP 8754 [TCP segment of a reassembled PDU]
118   0.033018 172.31.29.138 -> 54.230.150.16 TCP 66 41611 > http [ACK] Seq=97 Ack=630338 Win=815744 Len=0 TSval=10528303 TSecr=1453894475
119   0.033189 54.230.150.16 -> 172.31.29.138 TCP 26130 [TCP segment of a reassembled PDU]
120   0.033203 172.31.29.138 -> 54.230.150.16 TCP 66 41611 > http [ACK] Seq=97 Ack=656402 Win=867840 Len=0 TSval=10528303 TSecr=1453894475
121   0.033246 54.230.150.16 -> 172.31.29.138 TCP 26130 [TCP segment of a reassembled PDU]
122   0.033259 172.31.29.138 -> 54.230.150.16 TCP 66 41611 > http [ACK] Seq=97 Ack=682466 Win=919936 Len=0 TSval=10528303 TSecr=1453894475
123   0.033267 54.230.150.16 -> 172.31.29.138 TCP 4410 [TCP segment of a reassembled PDU]
124   0.033271 172.31.29.138 -> 54.230.150.16 TCP 66 41611 > http [ACK] Seq=97 Ack=686810 Win=928640 Len=0 TSval=10528303 TSecr=1453894475
125   0.034314 54.230.150.16 -> 172.31.29.138 TCP 10202 [TCP segment of a reassembled PDU]
126   0.034323 172.31.29.138 -> 54.230.150.16 TCP 66 41611 > http [ACK] Seq=97 Ack=696946 Win=948864 Len=0 TSval=10528304 TSecr=1453894475
127   0.034487 54.230.150.16 -> 172.31.29.138 TCP 26130 [TCP segment of a reassembled PDU]
128   0.034502 172.31.29.138 -> 54.230.150.16 TCP 66 41611 > http [ACK] Seq=97 Ack=723010 Win=1001088 Len=0 TSval=10528304 TSecr=1453894475
129   0.034631 54.230.150.16 -> 172.31.29.138 TCP 21786 [TCP segment of a reassembled PDU]
130   0.034643 172.31.29.138 -> 54.230.150.16 TCP 66 41611 > http [ACK] Seq=97 Ack=744730 Win=1009536 Len=0 TSval=10528304 TSecr=1453894475
131   0.034708 54.230.150.16 -> 172.31.29.138 TCP 7306 [TCP segment of a reassembled PDU]
132   0.034769 172.31.29.138 -> 54.230.150.16 TCP 66 41611 > http [ACK] Seq=97 Ack=751970 Win=1002368 Len=0 TSval=10528304 TSecr=1453894475
133   0.035581 54.230.150.16 -> 172.31.29.138 TCP 5858 [TCP segment of a reassembled PDU]
134   0.035588 172.31.29.138 -> 54.230.150.16 TCP 66 41611 > http [ACK] Seq=97 Ack=757762 Win=1035648 Len=0 TSval=10528304 TSecr=1453894475
135   0.035760 54.230.150.16 -> 172.31.29.138 TCP 26130 [TCP segment of a reassembled PDU]
136   0.035781 54.230.150.16 -> 172.31.29.138 TCP 11650 [TCP segment of a reassembled PDU]
137   0.035801 172.31.29.138 -> 54.230.150.16 TCP 66 41611 > http [ACK] Seq=97 Ack=795410 Win=998016 Len=0 TSval=10528304 TSecr=1453894475
138   0.035993 54.230.150.16 -> 172.31.29.138 TCP 21786 [TCP segment of a reassembled PDU]
139   0.036006 172.31.29.138 -> 54.230.150.16 TCP 66 41611 > http [ACK] Seq=97 Ack=817130 Win=1009536 Len=0 TSval=10528304 TSecr=1453894475
140   0.036101 54.230.150.16 -> 172.31.29.138 TCP 5858 [TCP segment of a reassembled PDU]
141   0.036107 172.31.29.138 -> 54.230.150.16 TCP 66 41611 > http [ACK] Seq=97 Ack=822922 Win=1035648 Len=0 TSval=10528304 TSecr=1453894475
142   0.036282 54.230.150.16 -> 172.31.29.138 TCP 26130 [TCP segment of a reassembled PDU]
143   0.036300 54.230.150.16 -> 172.31.29.138 TCP 5858 [TCP segment of a reassembled PDU]
144   0.036316 172.31.29.138 -> 54.230.150.16 TCP 66 41611 > http [ACK] Seq=97 Ack=854778 Win=1003904 Len=0 TSval=10528304 TSecr=1453894475
145   0.037156 54.230.150.16 -> 172.31.29.138 TCP 11650 [TCP segment of a reassembled PDU]
146   0.037166 172.31.29.138 -> 54.230.150.16 TCP 66 41611 > http [ACK] Seq=97 Ack=866362 Win=1026176 Len=0 TSval=10528304 TSecr=1453894475
147   0.037277 54.230.150.16 -> 172.31.29.138 TCP 15994 [TCP segment of a reassembled PDU]
148   0.037303 172.31.29.138 -> 54.230.150.16 TCP 66 41611 > http [ACK] Seq=97 Ack=882290 Win=1044480 Len=0 TSval=10528304 TSecr=1453894475
149   0.037562 54.230.150.16 -> 172.31.29.138 TCP 26130 [TCP segment of a reassembled PDU]
150   0.037578 54.230.150.16 -> 172.31.29.138 TCP 2962 [TCP segment of a reassembled PDU]
151   0.037603 54.230.150.16 -> 172.31.29.138 TCP 13098 [TCP segment of a reassembled PDU]
152   0.037613 172.31.29.138 -> 54.230.150.16 TCP 66 41611 > http [ACK] Seq=97 Ack=911250 Win=1015552 Len=0 TSval=10528304 TSecr=1453894475
153   0.037629 172.31.29.138 -> 54.230.150.16 TCP 66 41611 > http [ACK] Seq=97 Ack=924282 Win=1023872 Len=0 TSval=10528304 TSecr=1453894475
154   0.037651 54.230.150.16 -> 172.31.29.138 TCP 10202 [TCP segment of a reassembled PDU]
155   0.037658 172.31.29.138 -> 54.230.150.16 TCP 66 41611 > http [ACK] Seq=97 Ack=934418 Win=1028608 Len=0 TSval=10528304 TSecr=1453894475
156   0.037779 54.230.150.16 -> 172.31.29.138 TCP 13098 [TCP segment of a reassembled PDU]
157   0.037800 172.31.29.138 -> 54.230.150.16 TCP 66 41611 > http [ACK] Seq=97 Ack=947450 Win=1044480 Len=0 TSval=10528304 TSecr=1453894475
158   0.038652 54.230.150.16 -> 172.31.29.138 TCP 4410 [TCP segment of a reassembled PDU]
159   0.038670 172.31.29.138 -> 54.230.150.16 TCP 66 41611 > http [ACK] Seq=97 Ack=951794 Win=1044480 Len=0 TSval=10528305 TSecr=1453894475
160   0.038821 54.230.150.16 -> 172.31.29.138 TCP 18890 [TCP segment of a reassembled PDU]
161   0.038853 54.230.150.16 -> 172.31.29.138 TCP 7306 [TCP segment of a reassembled PDU]
162   0.038894 54.230.150.16 -> 172.31.29.138 TCP 17442 [TCP segment of a reassembled PDU]
163   0.038937 172.31.29.138 -> 54.230.150.16 TCP 66 41611 > http [ACK] Seq=97 Ack=995234 Win=1001088 Len=0 TSval=10528305 TSecr=1453894475
164   0.039086 54.230.150.16 -> 172.31.29.138 TCP 26130 [TCP segment of a reassembled PDU]
165   0.039100 172.31.29.138 -> 54.230.150.16 TCP 66 41611 > http [ACK] Seq=97 Ack=1021298 Win=1002368 Len=0 TSval=10528305 TSecr=1453894476
166   0.039113 54.230.150.16 -> 172.31.29.138 TCP 11650 [TCP segment of a reassembled PDU]
167   0.039120 54.230.150.16 -> 172.31.29.138 TCP 2962 [TCP segment of a reassembled PDU]
168   0.039133 54.230.150.16 -> 172.31.29.138 TCP 11650 [TCP segment of a reassembled PDU]
169   0.039155 172.31.29.138 -> 54.230.150.16 TCP 66 41611 > http [ACK] Seq=97 Ack=1047362 Win=976384 Len=0 TSval=10528305 TSecr=1453894476
170   0.039170 54.230.150.16 -> 172.31.29.138 HTTP 1738 HTTP/1.1 200 OK  (application/octet-stream)
171   0.039182 172.31.29.138 -> 54.230.150.16 TCP 66 41611 > http [ACK] Seq=97 Ack=1049034 Win=997376 Len=0 TSval=10528305 TSecr=1453894476
172   0.039308 172.31.29.138 -> 54.230.150.16 TCP 66 41611 > http [FIN, ACK] Seq=97 Ack=1049034 Win=1044480 Len=0 TSval=10528305 TSecr=1453894476
173   0.040679 54.230.150.16 -> 172.31.29.138 TCP 66 http > 41611 [FIN, ACK] Seq=1049034 Ack=98 Win=14592 Len=0 TSval=1453894476 TSecr=10528305
174   0.040689 172.31.29.138 -> 54.230.150.16 TCP 66 41611 > http [ACK] Seq=98 Ack=1049035 Win=1044480 Len=0 TSval=10528305 TSecr=1453894476
