[Measurement for 1mb at 09:37:20 20.37.2014] 
Tshark:

  1   0.000000 172.31.29.138 -> 172.31.0.2   DNS 89 Standard query 0xe9d0  A d1xzxs93r3iphc.cloudfront.net
  2   0.000033 172.31.29.138 -> 172.31.0.2   DNS 89 Standard query 0xff8d  AAAA d1xzxs93r3iphc.cloudfront.net
  3   0.000639   172.31.0.2 -> 172.31.29.138 DNS 217 Standard query response 0xe9d0  A 54.230.158.191 A 54.230.158.246 A 54.230.159.141 A 54.192.156.109 A 54.192.157.142 A 54.192.159.104 A 54.192.159.108 A 54.230.156.40
  4   0.000649   172.31.0.2 -> 172.31.29.138 DNS 170 Standard query response 0xff8d 
  5   0.003863 172.31.29.138 -> 54.230.158.191 TCP 74 39437 > http [SYN] Seq=0 Win=26883 Len=0 MSS=8961 SACK_PERM=1 TSval=15028261 TSecr=0 WS=128
  6   0.004733 54.230.158.191 -> 172.31.29.138 TCP 74 http > 39437 [SYN, ACK] Seq=0 Ack=1 Win=14480 Len=0 MSS=1460 SACK_PERM=1 TSval=732257833 TSecr=15028261 WS=128
  7   0.004747 172.31.29.138 -> 54.230.158.191 TCP 66 39437 > http [ACK] Seq=1 Ack=1 Win=27008 Len=0 TSval=15028261 TSecr=732257833
  8   0.004790 172.31.29.138 -> 54.230.158.191 HTTP 162 GET /1mb HTTP/1.1 
  9   0.005475 54.230.158.191 -> 172.31.29.138 TCP 66 http > 39437 [ACK] Seq=1 Ack=97 Win=14592 Len=0 TSval=732257833 TSecr=15028261
 10   0.010876 54.230.158.191 -> 172.31.29.138 TCP 5858 [TCP segment of a reassembled PDU]
 11   0.010886 172.31.29.138 -> 54.230.158.191 TCP 66 39437 > http [ACK] Seq=97 Ack=5793 Win=38528 Len=0 TSval=15028263 TSecr=732257834
 12   0.010897 54.230.158.191 -> 172.31.29.138 TCP 7306 [TCP segment of a reassembled PDU]
 13   0.010903 172.31.29.138 -> 54.230.158.191 TCP 66 39437 > http [ACK] Seq=97 Ack=13033 Win=52992 Len=0 TSval=15028263 TSecr=732257834
 14   0.011700 54.230.158.191 -> 172.31.29.138 TCP 13098 [TCP segment of a reassembled PDU]
 15   0.011731 172.31.29.138 -> 54.230.158.191 TCP 66 39437 > http [ACK] Seq=97 Ack=26065 Win=79104 Len=0 TSval=15028263 TSecr=732257834
 16   0.012401 54.230.158.191 -> 172.31.29.138 TCP 2962 [TCP segment of a reassembled PDU]
 17   0.012406 172.31.29.138 -> 54.230.158.191 TCP 66 39437 > http [ACK] Seq=97 Ack=28961 Win=84864 Len=0 TSval=15028263 TSecr=732257834
 18   0.012458 54.230.158.191 -> 172.31.29.138 TCP 10202 [TCP segment of a reassembled PDU]
 19   0.012464 172.31.29.138 -> 54.230.158.191 TCP 66 39437 > http [ACK] Seq=97 Ack=39097 Win=101248 Len=0 TSval=15028263 TSecr=732257834
 20   0.013212 54.230.158.191 -> 172.31.29.138 TCP 13098 [TCP segment of a reassembled PDU]
 21   0.013221 172.31.29.138 -> 54.230.158.191 TCP 66 39437 > http [ACK] Seq=97 Ack=52129 Win=96512 Len=0 TSval=15028263 TSecr=732257834
 22   0.013239 54.230.158.191 -> 172.31.29.138 TCP 8754 [TCP segment of a reassembled PDU]
 23   0.013248 172.31.29.138 -> 54.230.158.191 TCP 66 39437 > http [ACK] Seq=97 Ack=60817 Win=87936 Len=0 TSval=15028263 TSecr=732257834
 24   0.013920 54.230.158.191 -> 172.31.29.138 TCP 4410 [TCP segment of a reassembled PDU]
 25   0.013926 172.31.29.138 -> 54.230.158.191 TCP 66 39437 > http [ACK] Seq=97 Ack=65161 Win=109056 Len=0 TSval=15028263 TSecr=732257834
 26   0.014065 54.230.158.191 -> 172.31.29.138 TCP 20338 [TCP segment of a reassembled PDU]
 27   0.014076 172.31.29.138 -> 54.230.158.191 TCP 66 39437 > http [ACK] Seq=97 Ack=85433 Win=88832 Len=0 TSval=15028263 TSecr=732257834
 28   0.014718 54.230.158.191 -> 172.31.29.138 TCP 8754 [TCP segment of a reassembled PDU]
 29   0.014725 172.31.29.138 -> 54.230.158.191 TCP 66 39437 > http [ACK] Seq=97 Ack=94121 Win=103680 Len=0 TSval=15028263 TSecr=732257834
 30   0.014765 54.230.158.191 -> 172.31.29.138 TCP 10202 [TCP segment of a reassembled PDU]
 31   0.014773 172.31.29.138 -> 54.230.158.191 TCP 66 39437 > http [ACK] Seq=97 Ack=104257 Win=101248 Len=0 TSval=15028263 TSecr=732257834
 32   0.015488 54.230.158.191 -> 172.31.29.138 TCP 7306 [TCP segment of a reassembled PDU]
 33   0.015495 172.31.29.138 -> 54.230.158.191 TCP 66 39437 > http [ACK] Seq=97 Ack=111497 Win=105984 Len=0 TSval=15028264 TSecr=732257834
 34   0.015616 54.230.158.191 -> 172.31.29.138 TCP 19399 [TCP segment of a reassembled PDU]
 35   0.015637 172.31.29.138 -> 54.230.158.191 TCP 66 39437 > http [ACK] Seq=97 Ack=130830 Win=147712 Len=0 TSval=15028264 TSecr=732257834
 36   0.015662 54.230.158.191 -> 172.31.29.138 TCP 2962 [TCP segment of a reassembled PDU]
 37   0.015665 172.31.29.138 -> 54.230.158.191 TCP 66 39437 > http [ACK] Seq=97 Ack=133726 Win=153472 Len=0 TSval=15028264 TSecr=732257834
 38   0.016540 54.230.158.191 -> 172.31.29.138 TCP 11650 [TCP segment of a reassembled PDU]
 39   0.016549 172.31.29.138 -> 54.230.158.191 TCP 66 39437 > http [ACK] Seq=97 Ack=145310 Win=176640 Len=0 TSval=15028264 TSecr=732257834
 40   0.016608 54.230.158.191 -> 172.31.29.138 TCP 18890 [TCP segment of a reassembled PDU]
 41   0.016619 172.31.29.138 -> 54.230.158.191 TCP 66 39437 > http [ACK] Seq=97 Ack=164134 Win=214400 Len=0 TSval=15028264 TSecr=732257834
 42   0.017248 54.230.158.191 -> 172.31.29.138 TCP 7306 [TCP segment of a reassembled PDU]
 43   0.017256 172.31.29.138 -> 54.230.158.191 TCP 66 39437 > http [ACK] Seq=97 Ack=171374 Win=228864 Len=0 TSval=15028264 TSecr=732257834
 44   0.017401 54.230.158.191 -> 172.31.29.138 TCP 25058 [TCP segment of a reassembled PDU]
 45   0.017412 172.31.29.138 -> 54.230.158.191 TCP 66 39437 > http [ACK] Seq=97 Ack=196366 Win=278784 Len=0 TSval=15028264 TSecr=732257834
 46   0.018031 54.230.158.191 -> 172.31.29.138 TCP 2962 [TCP segment of a reassembled PDU]
 47   0.018036 172.31.29.138 -> 54.230.158.191 TCP 66 39437 > http [ACK] Seq=97 Ack=199262 Win=284544 Len=0 TSval=15028264 TSecr=732257834
 48   0.018277 54.230.158.191 -> 172.31.29.138 TCP 10202 [TCP segment of a reassembled PDU]
 49   0.018284 172.31.29.138 -> 54.230.158.191 TCP 66 39437 > http [ACK] Seq=97 Ack=209398 Win=304896 Len=0 TSval=15028264 TSecr=732257834
 50   0.018490 54.230.158.191 -> 172.31.29.138 TCP 26130 [TCP segment of a reassembled PDU]
 51   0.018503 172.31.29.138 -> 54.230.158.191 TCP 66 39437 > http [ACK] Seq=97 Ack=235462 Win=356992 Len=0 TSval=15028264 TSecr=732257834
 52   0.019113 54.230.158.191 -> 172.31.29.138 TCP 11650 [TCP segment of a reassembled PDU]
 53   0.019143 172.31.29.138 -> 54.230.158.191 TCP 66 39437 > http [ACK] Seq=97 Ack=247046 Win=380160 Len=0 TSval=15028265 TSecr=732257834
 54   0.019177 54.230.158.191 -> 172.31.29.138 TCP 4410 [TCP segment of a reassembled PDU]
 55   0.019182 172.31.29.138 -> 54.230.158.191 TCP 66 39437 > http [ACK] Seq=97 Ack=251390 Win=388864 Len=0 TSval=15028265 TSecr=732257834
 56   0.019431 54.230.158.191 -> 172.31.29.138 TCP 10578 [TCP segment of a reassembled PDU]
 57   0.019461 172.31.29.138 -> 54.230.158.191 TCP 66 39437 > http [ACK] Seq=97 Ack=261902 Win=409856 Len=0 TSval=15028265 TSecr=732257834
 58   0.020689 54.230.158.191 -> 172.31.29.138 TCP 18890 [TCP segment of a reassembled PDU]
 59   0.020700 172.31.29.138 -> 54.230.158.191 TCP 66 39437 > http [ACK] Seq=97 Ack=280726 Win=447488 Len=0 TSval=15028265 TSecr=732257835
 60   0.020806 54.230.158.191 -> 172.31.29.138 TCP 24682 [TCP segment of a reassembled PDU]
 61   0.020819 172.31.29.138 -> 54.230.158.191 TCP 66 39437 > http [ACK] Seq=97 Ack=305342 Win=496768 Len=0 TSval=15028265 TSecr=732257835
 62   0.021465 54.230.158.191 -> 172.31.29.138 TCP 18890 [TCP segment of a reassembled PDU]
 63   0.021477 172.31.29.138 -> 54.230.158.191 TCP 66 39437 > http [ACK] Seq=97 Ack=324166 Win=534400 Len=0 TSval=15028265 TSecr=732257835
 64   0.021493 54.230.158.191 -> 172.31.29.138 TCP 3338 [TCP segment of a reassembled PDU]
 65   0.021496 172.31.29.138 -> 54.230.158.191 TCP 66 39437 > http [ACK] Seq=97 Ack=327438 Win=540928 Len=0 TSval=15028265 TSecr=732257835
 66   0.022451 54.230.158.191 -> 172.31.29.138 TCP 1514 [TCP segment of a reassembled PDU]
 67   0.022457 172.31.29.138 -> 54.230.158.191 TCP 66 39437 > http [ACK] Seq=97 Ack=328886 Win=543872 Len=0 TSval=15028265 TSecr=732257835
 68   0.022584 54.230.158.191 -> 172.31.29.138 TCP 21786 [TCP segment of a reassembled PDU]
 69   0.022596 172.31.29.138 -> 54.230.158.191 TCP 66 39437 > http [ACK] Seq=97 Ack=350606 Win=587264 Len=0 TSval=15028265 TSecr=732257835
 70   0.022652 54.230.158.191 -> 172.31.29.138 TCP 23234 [TCP segment of a reassembled PDU]
 71   0.022664 172.31.29.138 -> 54.230.158.191 TCP 66 39437 > http [ACK] Seq=97 Ack=373774 Win=633600 Len=0 TSval=15028265 TSecr=732257835
 72   0.023501 54.230.158.191 -> 172.31.29.138 TCP 19266 [TCP segment of a reassembled PDU]
 73   0.023526 172.31.29.138 -> 54.230.158.191 TCP 66 39437 > http [ACK] Seq=97 Ack=392974 Win=651392 Len=0 TSval=15028266 TSecr=732257835
 74   0.025454 54.230.158.191 -> 172.31.29.138 TCP 7306 [TCP segment of a reassembled PDU]
 75   0.025461 172.31.29.138 -> 54.230.158.191 TCP 66 39437 > http [ACK] Seq=97 Ack=400214 Win=672896 Len=0 TSval=15028266 TSecr=732257835
 76   0.025640 54.230.158.191 -> 172.31.29.138 TCP 26130 [TCP segment of a reassembled PDU]
 77   0.025654 172.31.29.138 -> 54.230.158.191 TCP 66 39437 > http [ACK] Seq=97 Ack=426278 Win=646912 Len=0 TSval=15028266 TSecr=732257835
 78   0.025664 54.230.158.191 -> 172.31.29.138 TCP 8754 [TCP segment of a reassembled PDU]
 79   0.025669 172.31.29.138 -> 54.230.158.191 TCP 66 39437 > http [ACK] Seq=97 Ack=434966 Win=638336 Len=0 TSval=15028266 TSecr=732257835
 80   0.025676 54.230.158.191 -> 172.31.29.138 TCP 8754 [TCP segment of a reassembled PDU]
 81   0.025692 172.31.29.138 -> 54.230.158.191 TCP 66 39437 > http [ACK] Seq=97 Ack=443654 Win=629760 Len=0 TSval=15028266 TSecr=732257835
 82   0.026316 54.230.158.191 -> 172.31.29.138 TCP 13098 [TCP segment of a reassembled PDU]
 83   0.026324 172.31.29.138 -> 54.230.158.191 TCP 66 39437 > http [ACK] Seq=97 Ack=456686 Win=663424 Len=0 TSval=15028266 TSecr=732257835
 84   0.026395 54.230.158.191 -> 172.31.29.138 TCP 1890 [TCP segment of a reassembled PDU]
 85   0.026400 172.31.29.138 -> 54.230.158.191 TCP 66 39437 > http [ACK] Seq=97 Ack=458510 Win=679936 Len=0 TSval=15028266 TSecr=732257835
 86   0.026788 54.230.158.191 -> 172.31.29.138 TCP 2962 [TCP segment of a reassembled PDU]
 87   0.026793 172.31.29.138 -> 54.230.158.191 TCP 66 39437 > http [ACK] Seq=97 Ack=461406 Win=679936 Len=0 TSval=15028266 TSecr=732257835
 88   0.026912 54.230.158.191 -> 172.31.29.138 TCP 26130 [TCP segment of a reassembled PDU]
 89   0.026937 172.31.29.138 -> 54.230.158.191 TCP 66 39437 > http [ACK] Seq=97 Ack=487470 Win=653952 Len=0 TSval=15028267 TSecr=732257835
 90   0.026977 54.230.158.191 -> 172.31.29.138 TCP 8754 [TCP segment of a reassembled PDU]
 91   0.026984 172.31.29.138 -> 54.230.158.191 TCP 66 39437 > http [ACK] Seq=97 Ack=496158 Win=670464 Len=0 TSval=15028267 TSecr=732257835
 92   0.027063 54.230.158.191 -> 172.31.29.138 TCP 18890 [TCP segment of a reassembled PDU]
 93   0.027187 172.31.29.138 -> 54.230.158.191 TCP 66 39437 > http [ACK] Seq=97 Ack=514982 Win=653824 Len=0 TSval=15028267 TSecr=732257835
 94   0.027810 54.230.158.191 -> 172.31.29.138 TCP 9130 [TCP segment of a reassembled PDU]
 95   0.027827 172.31.29.138 -> 54.230.158.191 TCP 66 39437 > http [ACK] Seq=97 Ack=524046 Win=668160 Len=0 TSval=15028267 TSecr=732257835
 96   0.029357 54.230.158.191 -> 172.31.29.138 TCP 2962 [TCP segment of a reassembled PDU]
 97   0.029362 172.31.29.138 -> 54.230.158.191 TCP 66 39437 > http [ACK] Seq=97 Ack=526942 Win=679936 Len=0 TSval=15028267 TSecr=732257835
 98   0.029498 54.230.158.191 -> 172.31.29.138 TCP 21786 [TCP segment of a reassembled PDU]
 99   0.029521 172.31.29.138 -> 54.230.158.191 TCP 66 39437 > http [ACK] Seq=97 Ack=548662 Win=658304 Len=0 TSval=15028267 TSecr=732257835
100   0.029686 54.230.158.191 -> 172.31.29.138 TCP 34818 [TCP segment of a reassembled PDU]
101   0.029714 172.31.29.138 -> 54.230.158.191 TCP 66 39437 > http [ACK] Seq=97 Ack=583414 Win=627584 Len=0 TSval=15028267 TSecr=732257835
102   0.030351 54.230.158.191 -> 172.31.29.138 TCP 6234 [TCP segment of a reassembled PDU]
103   0.030358 172.31.29.138 -> 54.230.158.191 TCP 66 39437 > http [ACK] Seq=97 Ack=589582 Win=672896 Len=0 TSval=15028267 TSecr=732257836
104   0.031558 54.230.158.191 -> 172.31.29.138 TCP 1514 [TCP segment of a reassembled PDU]
105   0.031617 54.230.158.191 -> 172.31.29.138 TCP 13098 [TCP segment of a reassembled PDU]
106   0.031738 54.230.158.191 -> 172.31.29.138 TCP 26130 [TCP segment of a reassembled PDU]
107   0.031789 54.230.158.191 -> 172.31.29.138 TCP 23234 [TCP segment of a reassembled PDU]
108   0.031825 172.31.29.138 -> 54.230.158.191 TCP 66 39437 > http [ACK] Seq=97 Ack=653294 Win=609280 Len=0 TSval=15028268 TSecr=732257836
109   0.032594 54.230.158.191 -> 172.31.29.138 TCP 1890 [TCP segment of a reassembled PDU]
110   0.032600 172.31.29.138 -> 54.230.158.191 TCP 66 39437 > http [ACK] Seq=97 Ack=655118 Win=679936 Len=0 TSval=15028268 TSecr=732257836
111   0.034390 54.230.158.191 -> 172.31.29.138 TCP 5858 [TCP segment of a reassembled PDU]
112   0.034406 172.31.29.138 -> 54.230.158.191 TCP 66 39437 > http [ACK] Seq=97 Ack=660910 Win=680320 Len=0 TSval=15028268 TSecr=732257836
113   0.034544 54.230.158.191 -> 172.31.29.138 TCP 26130 [TCP segment of a reassembled PDU]
114   0.034570 172.31.29.138 -> 54.230.158.191 TCP 66 39437 > http [ACK] Seq=97 Ack=686974 Win=654336 Len=0 TSval=15028268 TSecr=732257836
115   0.034620 54.230.158.191 -> 172.31.29.138 TCP 26130 [TCP segment of a reassembled PDU]
116   0.034634 54.230.158.191 -> 172.31.29.138 TCP 1514 [TCP segment of a reassembled PDU]
117   0.034648 54.230.158.191 -> 172.31.29.138 TCP 5858 [TCP segment of a reassembled PDU]
118   0.034655 172.31.29.138 -> 54.230.158.191 TCP 66 39437 > http [ACK] Seq=97 Ack=714486 Win=639488 Len=0 TSval=15028268 TSecr=732257836
119   0.034668 172.31.29.138 -> 54.230.158.191 TCP 66 39437 > http [ACK] Seq=97 Ack=720278 Win=633728 Len=0 TSval=15028268 TSecr=732257836
120   0.035132 54.230.158.191 -> 172.31.29.138 TCP 442 [TCP segment of a reassembled PDU]
121   0.035150 172.31.29.138 -> 54.230.158.191 TCP 66 39437 > http [ACK] Seq=97 Ack=720654 Win=680320 Len=0 TSval=15028269 TSecr=732257836
122   0.037007 54.230.158.191 -> 172.31.29.138 TCP 10202 [TCP segment of a reassembled PDU]
123   0.037026 172.31.29.138 -> 54.230.158.191 TCP 66 39437 > http [ACK] Seq=97 Ack=730790 Win=680320 Len=0 TSval=15028269 TSecr=732257836
124   0.037095 54.230.158.191 -> 172.31.29.138 TCP 26130 [TCP segment of a reassembled PDU]
125   0.037120 172.31.29.138 -> 54.230.158.191 TCP 66 39437 > http [ACK] Seq=97 Ack=756854 Win=654336 Len=0 TSval=15028269 TSecr=732257836
126   0.037146 54.230.158.191 -> 172.31.29.138 TCP 17442 [TCP segment of a reassembled PDU]
127   0.037163 172.31.29.138 -> 54.230.158.191 TCP 66 39437 > http [ACK] Seq=97 Ack=774230 Win=656128 Len=0 TSval=15028269 TSecr=732257836
128   0.037194 54.230.158.191 -> 172.31.29.138 TCP 12026 [TCP segment of a reassembled PDU]
129   0.037202 172.31.29.138 -> 54.230.158.191 TCP 66 39437 > http [ACK] Seq=97 Ack=786190 Win=663424 Len=0 TSval=15028269 TSecr=732257836
130   0.039030 54.230.158.191 -> 172.31.29.138 TCP 2962 [TCP segment of a reassembled PDU]
131   0.039036 172.31.29.138 -> 54.230.158.191 TCP 66 39437 > http [ACK] Seq=97 Ack=789086 Win=679936 Len=0 TSval=15028270 TSecr=732257836
132   0.039362 54.230.158.191 -> 172.31.29.138 TCP 26130 [TCP segment of a reassembled PDU]
133   0.039378 54.230.158.191 -> 172.31.29.138 TCP 2962 [TCP segment of a reassembled PDU]
134   0.039395 54.230.158.191 -> 172.31.29.138 TCP 17442 [TCP segment of a reassembled PDU]
135   0.039414 172.31.29.138 -> 54.230.158.191 TCP 66 39437 > http [ACK] Seq=97 Ack=835422 Win=633600 Len=0 TSval=15028270 TSecr=732257836
136   0.039422 54.230.158.191 -> 172.31.29.138 TCP 1514 [TCP segment of a reassembled PDU]
137   0.039824 54.230.158.191 -> 172.31.29.138 TCP 11650 [TCP segment of a reassembled PDU]
138   0.039856 172.31.29.138 -> 54.230.158.191 TCP 66 39437 > http [ACK] Seq=97 Ack=848454 Win=665728 Len=0 TSval=15028270 TSecr=732257836
139   0.039917 54.230.158.191 -> 172.31.29.138 TCP 4786 [TCP segment of a reassembled PDU]
140   0.040039 172.31.29.138 -> 54.230.158.191 TCP 66 39437 > http [ACK] Seq=97 Ack=853174 Win=680320 Len=0 TSval=15028270 TSecr=732257836
141   0.040154 54.230.158.191 -> 172.31.29.138 TCP 26130 [TCP segment of a reassembled PDU]
142   0.040173 54.230.158.191 -> 172.31.29.138 TCP 2962 [TCP segment of a reassembled PDU]
143   0.040184 54.230.158.191 -> 172.31.29.138 TCP 14546 [TCP segment of a reassembled PDU]
144   0.040205 54.230.158.191 -> 172.31.29.138 TCP 8754 [TCP segment of a reassembled PDU]
145   0.040211 54.230.158.191 -> 172.31.29.138 TCP 2962 [TCP segment of a reassembled PDU]
146   0.040219 172.31.29.138 -> 54.230.158.191 TCP 66 39437 > http [ACK] Seq=97 Ack=908198 Win=625408 Len=0 TSval=15028270 TSecr=732257837
147   0.041099 54.230.158.191 -> 172.31.29.138 TCP 9130 [TCP segment of a reassembled PDU]
148   0.041107 172.31.29.138 -> 54.230.158.191 TCP 66 39437 > http [ACK] Seq=97 Ack=917262 Win=668160 Len=0 TSval=15028270 TSecr=732257837
149   0.041183 54.230.158.191 -> 172.31.29.138 TCP 26130 [TCP segment of a reassembled PDU]
150   0.041208 172.31.29.138 -> 54.230.158.191 TCP 66 39437 > http [ACK] Seq=97 Ack=943326 Win=642176 Len=0 TSval=15028270 TSecr=732257837
151   0.041277 54.230.158.191 -> 172.31.29.138 TCP 26130 [TCP segment of a reassembled PDU]
152   0.041302 172.31.29.138 -> 54.230.158.191 TCP 66 39437 > http [ACK] Seq=97 Ack=969390 Win=641920 Len=0 TSval=15028270 TSecr=732257837
153   0.041317 54.230.158.191 -> 172.31.29.138 TCP 13474 [TCP segment of a reassembled PDU]
154   0.041339 172.31.29.138 -> 54.230.158.191 TCP 66 39437 > http [ACK] Seq=97 Ack=982798 Win=660864 Len=0 TSval=15028270 TSecr=732257837
155   0.044261 54.230.158.191 -> 172.31.29.138 TCP 18890 [TCP segment of a reassembled PDU]
156   0.044299 172.31.29.138 -> 54.230.158.191 TCP 66 39437 > http [ACK] Seq=97 Ack=1001622 Win=680320 Len=0 TSval=15028271 TSecr=732257837
157   0.044364 54.230.158.191 -> 172.31.29.138 TCP 26130 [TCP segment of a reassembled PDU]
158   0.044391 172.31.29.138 -> 54.230.158.191 TCP 66 39437 > http [ACK] Seq=97 Ack=1027686 Win=732416 Len=0 TSval=15028271 TSecr=732257837
159   0.044430 54.230.158.191 -> 172.31.29.138 TCP 20714 [TCP segment of a reassembled PDU]
160   0.044439 54.230.158.191 -> 172.31.29.138 HTTP 766 HTTP/1.1 200 OK  (application/octet-stream)
161   0.044449 172.31.29.138 -> 54.230.158.191 TCP 66 39437 > http [ACK] Seq=97 Ack=1048334 Win=773760 Len=0 TSval=15028271 TSecr=732257837
162   0.044455 172.31.29.138 -> 54.230.158.191 TCP 66 39437 > http [ACK] Seq=97 Ack=1049034 Win=776576 Len=0 TSval=15028271 TSecr=732257837
163   0.044585 172.31.29.138 -> 54.230.158.191 TCP 66 39437 > http [FIN, ACK] Seq=97 Ack=1049034 Win=776576 Len=0 TSval=15028271 TSecr=732257837
164   0.045174 54.230.158.191 -> 172.31.29.138 TCP 66 http > 39437 [FIN, ACK] Seq=1049034 Ack=98 Win=14592 Len=0 TSval=732257837 TSecr=15028271
165   0.045182 172.31.29.138 -> 54.230.158.191 TCP 66 39437 > http [ACK] Seq=98 Ack=1049035 Win=776576 Len=0 TSval=15028271 TSecr=732257837
