[Measurement for 1mb at 17:38:58 19.38.2014] 
Tshark:

  1   0.000000 172.31.29.138 -> 172.31.0.2   DNS 89 Standard query 0xa235  A d1xzxs93r3iphc.cloudfront.net
  2   0.000025 172.31.29.138 -> 172.31.0.2   DNS 89 Standard query 0xf485  AAAA d1xzxs93r3iphc.cloudfront.net
  3   0.000524   172.31.0.2 -> 172.31.29.138 DNS 170 Standard query response 0xf485 
  4   0.000535   172.31.0.2 -> 172.31.29.138 DNS 217 Standard query response 0xa235  A 54.192.159.157 A 54.230.156.193 A 54.230.158.80 A 54.230.159.6 A 54.240.168.128 A 54.192.156.101 A 54.192.156.110 A 54.192.159.78
  5   0.003878 172.31.29.138 -> 54.192.159.157 TCP 74 41057 > http [SYN] Seq=0 Win=26883 Len=0 MSS=8961 SACK_PERM=1 TSval=652797 TSecr=0 WS=128
  6   0.004323 54.192.159.157 -> 172.31.29.138 TCP 74 http > 41057 [SYN, ACK] Seq=0 Ack=1 Win=14480 Len=0 MSS=1460 SACK_PERM=1 TSval=806500701 TSecr=652797 WS=128
  7   0.004338 172.31.29.138 -> 54.192.159.157 TCP 66 41057 > http [ACK] Seq=1 Ack=1 Win=27008 Len=0 TSval=652797 TSecr=806500701
  8   0.004401 172.31.29.138 -> 54.192.159.157 HTTP 162 GET /1mb HTTP/1.1 
  9   0.004819 54.192.159.157 -> 172.31.29.138 TCP 66 http > 41057 [ACK] Seq=1 Ack=97 Win=14592 Len=0 TSval=806500701 TSecr=652797
 10   0.229888 54.192.159.157 -> 172.31.29.138 TCP 13400 [TCP segment of a reassembled PDU]
 11   0.229914 172.31.29.138 -> 54.192.159.157 TCP 66 41057 > http [ACK] Seq=97 Ack=13335 Win=53632 Len=0 TSval=652853 TSecr=806500723
 12   0.420237 54.192.159.157 -> 172.31.29.138 TCP 2930 [TCP segment of a reassembled PDU]
 13   0.420255 172.31.29.138 -> 54.192.159.157 TCP 66 41057 > http [ACK] Seq=97 Ack=16199 Win=59392 Len=0 TSval=652901 TSecr=806500742
 14   0.420388 54.192.159.157 -> 172.31.29.138 TCP 1514 [TCP segment of a reassembled PDU]
 15   0.420394 172.31.29.138 -> 54.192.159.157 TCP 66 41057 > http [ACK] Seq=97 Ack=17647 Win=62208 Len=0 TSval=652901 TSecr=806500742
 16   0.420448 54.192.159.157 -> 172.31.29.138 TCP 11650 [TCP segment of a reassembled PDU]
 17   0.420456 172.31.29.138 -> 54.192.159.157 TCP 66 41057 > http [ACK] Seq=97 Ack=29231 Win=85376 Len=0 TSval=652901 TSecr=806500742
 18   0.420929 54.192.159.157 -> 172.31.29.138 TCP 5650 [TCP segment of a reassembled PDU]
 19   0.420935 172.31.29.138 -> 54.192.159.157 TCP 66 41057 > http [ACK] Seq=97 Ack=34815 Win=96512 Len=0 TSval=652901 TSecr=806500742
 20   0.612970 54.192.159.157 -> 172.31.29.138 TCP 2930 [TCP segment of a reassembled PDU]
 21   0.612996 172.31.29.138 -> 54.192.159.157 TCP 66 41057 > http [ACK] Seq=97 Ack=37679 Win=102272 Len=0 TSval=652949 TSecr=806500761
 22   0.613006 54.192.159.157 -> 172.31.29.138 TCP 2930 [TCP segment of a reassembled PDU]
 23   0.613010 172.31.29.138 -> 54.192.159.157 TCP 66 41057 > http [ACK] Seq=97 Ack=40543 Win=108032 Len=0 TSval=652949 TSecr=806500761
 24   0.613023 54.192.159.157 -> 172.31.29.138 TCP 4362 [TCP segment of a reassembled PDU]
 25   0.613026 172.31.29.138 -> 54.192.159.157 TCP 66 41057 > http [ACK] Seq=97 Ack=44839 Win=103808 Len=0 TSval=652949 TSecr=806500761
 26   0.613153 54.192.159.157 -> 172.31.29.138 TCP 10202 [TCP segment of a reassembled PDU]
 27   0.613161 172.31.29.138 -> 54.192.159.157 TCP 66 41057 > http [ACK] Seq=97 Ack=54975 Win=101248 Len=0 TSval=652949 TSecr=806500761
 28   0.613822 54.192.159.157 -> 172.31.29.138 TCP 9978 [TCP segment of a reassembled PDU]
 29   0.613831 172.31.29.138 -> 54.192.159.157 TCP 66 41057 > http [ACK] Seq=97 Ack=64887 Win=101248 Len=0 TSval=652949 TSecr=806500762
