[Measurement for 1mb at 03:37:20 20.37.2014] 
Tshark:

  1   0.000000 172.31.29.138 -> 172.31.0.2   DNS 89 Standard query 0x8a66  A d1xzxs93r3iphc.cloudfront.net
  2   0.000037 172.31.29.138 -> 172.31.0.2   DNS 89 Standard query 0xf9ce  AAAA d1xzxs93r3iphc.cloudfront.net
  3   0.000564   172.31.0.2 -> 172.31.29.138 DNS 170 Standard query response 0xf9ce 
  4   0.000580   172.31.0.2 -> 172.31.29.138 DNS 217 Standard query response 0x8a66  A 54.230.158.211 A 54.230.159.4 A 54.230.159.7 A 54.230.159.132 A 54.230.159.137 A 54.230.159.142 A 54.192.159.174 A 54.192.159.180
  5   0.003876 172.31.29.138 -> 54.230.158.211 TCP 74 53646 > http [SYN] Seq=0 Win=26883 Len=0 MSS=8961 SACK_PERM=1 TSval=9628319 TSecr=0 WS=128
  6   0.004492 54.230.158.211 -> 172.31.29.138 TCP 74 http > 53646 [SYN, ACK] Seq=0 Ack=1 Win=14480 Len=0 MSS=1460 SACK_PERM=1 TSval=810104043 TSecr=9628319 WS=128
  7   0.004506 172.31.29.138 -> 54.230.158.211 TCP 66 53646 > http [ACK] Seq=1 Ack=1 Win=27008 Len=0 TSval=9628319 TSecr=810104043
  8   0.004548 172.31.29.138 -> 54.230.158.211 HTTP 162 GET /1mb HTTP/1.1 
  9   0.005149 54.230.158.211 -> 172.31.29.138 TCP 66 http > 53646 [ACK] Seq=1 Ack=97 Win=14592 Len=0 TSval=810104043 TSecr=9628319
 10   0.010137 54.230.158.211 -> 172.31.29.138 TCP 10202 [TCP segment of a reassembled PDU]
 11   0.010148 172.31.29.138 -> 54.230.158.211 TCP 66 53646 > http [ACK] Seq=97 Ack=10137 Win=47232 Len=0 TSval=9628320 TSecr=810104044
 12   0.010155 54.230.158.211 -> 172.31.29.138 TCP 2580 [TCP segment of a reassembled PDU]
 13   0.010160 172.31.29.138 -> 54.230.158.211 TCP 66 53646 > http [ACK] Seq=97 Ack=12651 Win=52224 Len=0 TSval=9628320 TSecr=810104044
 14   0.010163 54.230.158.211 -> 172.31.29.138 TCP 1514 [TCP segment of a reassembled PDU]
 15   0.010165 172.31.29.138 -> 54.230.158.211 TCP 66 53646 > http [ACK] Seq=97 Ack=14099 Win=55168 Len=0 TSval=9628320 TSecr=810104044
 16   0.010830 54.230.158.211 -> 172.31.29.138 TCP 2962 [TCP segment of a reassembled PDU]
 17   0.010837 172.31.29.138 -> 54.230.158.211 TCP 66 53646 > http [ACK] Seq=97 Ack=16995 Win=60928 Len=0 TSval=9628320 TSecr=810104044
 18   0.010884 54.230.158.211 -> 172.31.29.138 TCP 7306 [TCP segment of a reassembled PDU]
 19   0.010891 172.31.29.138 -> 54.230.158.211 TCP 66 53646 > http [ACK] Seq=97 Ack=24235 Win=75392 Len=0 TSval=9628320 TSecr=810104044
 20   0.010933 54.230.158.211 -> 172.31.29.138 TCP 2962 [TCP segment of a reassembled PDU]
 21   0.010938 172.31.29.138 -> 54.230.158.211 TCP 66 53646 > http [ACK] Seq=97 Ack=27131 Win=81152 Len=0 TSval=9628320 TSecr=810104044
 22   0.011384 54.230.158.211 -> 172.31.29.138 TCP 2962 [TCP segment of a reassembled PDU]
 23   0.011389 172.31.29.138 -> 54.230.158.211 TCP 66 53646 > http [ACK] Seq=97 Ack=30027 Win=87040 Len=0 TSval=9628320 TSecr=810104044
 24   0.011503 54.230.158.211 -> 172.31.29.138 TCP 15994 [TCP segment of a reassembled PDU]
 25   0.011512 172.31.29.138 -> 54.230.158.211 TCP 66 53646 > http [ACK] Seq=97 Ack=45955 Win=91648 Len=0 TSval=9628320 TSecr=810104044
 26   0.011590 54.230.158.211 -> 172.31.29.138 TCP 2962 [TCP segment of a reassembled PDU]
 27   0.011595 172.31.29.138 -> 54.230.158.211 TCP 66 53646 > http [ACK] Seq=97 Ack=48851 Win=109056 Len=0 TSval=9628320 TSecr=810104044
 28   0.011664 54.230.158.211 -> 172.31.29.138 TCP 1514 [TCP segment of a reassembled PDU]
 29   0.011669 172.31.29.138 -> 54.230.158.211 TCP 66 53646 > http [ACK] Seq=97 Ack=50299 Win=109056 Len=0 TSval=9628320 TSecr=810104044
 30   0.012108 54.230.158.211 -> 172.31.29.138 TCP 2962 [TCP segment of a reassembled PDU]
 31   0.012114 172.31.29.138 -> 54.230.158.211 TCP 66 53646 > http [ACK] Seq=97 Ack=53195 Win=109056 Len=0 TSval=9628321 TSecr=810104044
 32   0.012153 54.230.158.211 -> 172.31.29.138 TCP 7306 [TCP segment of a reassembled PDU]
 33   0.012160 172.31.29.138 -> 54.230.158.211 TCP 66 53646 > http [ACK] Seq=97 Ack=60435 Win=123520 Len=0 TSval=9628321 TSecr=810104044
 34   0.012199 54.230.158.211 -> 172.31.29.138 TCP 1514 [TCP segment of a reassembled PDU]
 35   0.012204 172.31.29.138 -> 54.230.158.211 TCP 66 53646 > http [ACK] Seq=97 Ack=61883 Win=126464 Len=0 TSval=9628321 TSecr=810104044
 36   0.012399 54.230.158.211 -> 172.31.29.138 TCP 3477 [TCP segment of a reassembled PDU]
 37   0.012404 172.31.29.138 -> 54.230.158.211 TCP 66 53646 > http [ACK] Seq=97 Ack=65294 Win=133248 Len=0 TSval=9628321 TSecr=810104044
 38   0.012908 54.230.158.211 -> 172.31.29.138 TCP 2962 [TCP segment of a reassembled PDU]
 39   0.012913 172.31.29.138 -> 54.230.158.211 TCP 66 53646 > http [ACK] Seq=97 Ack=68190 Win=139008 Len=0 TSval=9628321 TSecr=810104044
 40   0.013048 54.230.158.211 -> 172.31.29.138 TCP 18890 [TCP segment of a reassembled PDU]
 41   0.013059 172.31.29.138 -> 54.230.158.211 TCP 66 53646 > http [ACK] Seq=97 Ack=87014 Win=176640 Len=0 TSval=9628321 TSecr=810104044
 42   0.013072 54.230.158.211 -> 172.31.29.138 TCP 1514 [TCP segment of a reassembled PDU]
 43   0.013075 172.31.29.138 -> 54.230.158.211 TCP 66 53646 > http [ACK] Seq=97 Ack=88462 Win=179584 Len=0 TSval=9628321 TSecr=810104044
 44   0.013642 54.230.158.211 -> 172.31.29.138 TCP 2962 [TCP segment of a reassembled PDU]
 45   0.013647 172.31.29.138 -> 54.230.158.211 TCP 66 53646 > http [ACK] Seq=97 Ack=91358 Win=185344 Len=0 TSval=9628321 TSecr=810104044
 46   0.013758 54.230.158.211 -> 172.31.29.138 TCP 18890 [TCP segment of a reassembled PDU]
 47   0.013769 172.31.29.138 -> 54.230.158.211 TCP 66 53646 > http [ACK] Seq=97 Ack=110182 Win=222976 Len=0 TSval=9628321 TSecr=810104044
 48   0.013806 54.230.158.211 -> 172.31.29.138 TCP 8754 [TCP segment of a reassembled PDU]
 49   0.013813 172.31.29.138 -> 54.230.158.211 TCP 66 53646 > http [ACK] Seq=97 Ack=118870 Win=240384 Len=0 TSval=9628321 TSecr=810104044
 50   0.014718 54.230.158.211 -> 172.31.29.138 TCP 2962 [TCP segment of a reassembled PDU]
 51   0.014725 172.31.29.138 -> 54.230.158.211 TCP 66 53646 > http [ACK] Seq=97 Ack=121766 Win=246144 Len=0 TSval=9628321 TSecr=810104044
 52   0.014769 54.230.158.211 -> 172.31.29.138 TCP 9130 [TCP segment of a reassembled PDU]
 53   0.014778 172.31.29.138 -> 54.230.158.211 TCP 66 53646 > http [ACK] Seq=97 Ack=130830 Win=264320 Len=0 TSval=9628321 TSecr=810104044
 54   0.015965 54.230.158.211 -> 172.31.29.138 TCP 2962 [TCP segment of a reassembled PDU]
 55   0.015972 172.31.29.138 -> 54.230.158.211 TCP 66 53646 > http [ACK] Seq=97 Ack=133726 Win=270080 Len=0 TSval=9628322 TSecr=810104044
 56   0.016115 54.230.158.211 -> 172.31.29.138 TCP 18890 [TCP segment of a reassembled PDU]
 57   0.016127 172.31.29.138 -> 54.230.158.211 TCP 66 53646 > http [ACK] Seq=97 Ack=152550 Win=307712 Len=0 TSval=9628322 TSecr=810104044
 58   0.016154 54.230.158.211 -> 172.31.29.138 TCP 7306 [TCP segment of a reassembled PDU]
 59   0.016161 172.31.29.138 -> 54.230.158.211 TCP 66 53646 > http [ACK] Seq=97 Ack=159790 Win=322304 Len=0 TSval=9628322 TSecr=810104044
 60   0.016208 54.230.158.211 -> 172.31.29.138 TCP 7306 [TCP segment of a reassembled PDU]
 61   0.016215 172.31.29.138 -> 54.230.158.211 TCP 66 53646 > http [ACK] Seq=97 Ack=167030 Win=336768 Len=0 TSval=9628322 TSecr=810104044
 62   0.016946 54.230.158.211 -> 172.31.29.138 TCP 2962 [TCP segment of a reassembled PDU]
 63   0.016951 172.31.29.138 -> 54.230.158.211 TCP 66 53646 > http [ACK] Seq=97 Ack=169926 Win=342528 Len=0 TSval=9628322 TSecr=810104044
 64   0.017140 54.230.158.211 -> 172.31.29.138 TCP 26506 [TCP segment of a reassembled PDU]
 65   0.017150 172.31.29.138 -> 54.230.158.211 TCP 66 53646 > http [ACK] Seq=97 Ack=196366 Win=395392 Len=0 TSval=9628322 TSecr=810104044
 66   0.018251 54.230.158.211 -> 172.31.29.138 TCP 2962 [TCP segment of a reassembled PDU]
 67   0.018256 172.31.29.138 -> 54.230.158.211 TCP 66 53646 > http [ACK] Seq=97 Ack=199262 Win=401152 Len=0 TSval=9628322 TSecr=810104044
 68   0.018280 54.230.158.211 -> 172.31.29.138 TCP 4410 [TCP segment of a reassembled PDU]
 69   0.018285 172.31.29.138 -> 54.230.158.211 TCP 66 53646 > http [ACK] Seq=97 Ack=203606 Win=409856 Len=0 TSval=9628322 TSecr=810104044
 70   0.018441 54.230.158.211 -> 172.31.29.138 TCP 23234 [TCP segment of a reassembled PDU]
 71   0.018452 172.31.29.138 -> 54.230.158.211 TCP 66 53646 > http [ACK] Seq=97 Ack=226774 Win=456192 Len=0 TSval=9628322 TSecr=810104044
 72   0.018994 54.230.158.211 -> 172.31.29.138 TCP 1514 [TCP segment of a reassembled PDU]
 73   0.018999 172.31.29.138 -> 54.230.158.211 TCP 66 53646 > http [ACK] Seq=97 Ack=228222 Win=459136 Len=0 TSval=9628322 TSecr=810104044
 74   0.019187 54.230.158.211 -> 172.31.29.138 TCP 26130 [TCP segment of a reassembled PDU]
 75   0.019201 172.31.29.138 -> 54.230.158.211 TCP 66 53646 > http [ACK] Seq=97 Ack=254286 Win=511232 Len=0 TSval=9628322 TSecr=810104044
 76   0.019334 54.230.158.211 -> 172.31.29.138 TCP 7682 [TCP segment of a reassembled PDU]
 77   0.019341 172.31.29.138 -> 54.230.158.211 TCP 66 53646 > http [ACK] Seq=97 Ack=261902 Win=526464 Len=0 TSval=9628322 TSecr=810104044
 78   0.020807 54.230.158.211 -> 172.31.29.138 TCP 1514 [TCP segment of a reassembled PDU]
 79   0.020813 172.31.29.138 -> 54.230.158.211 TCP 66 53646 > http [ACK] Seq=97 Ack=263350 Win=529408 Len=0 TSval=9628323 TSecr=810104045
 80   0.020955 54.230.158.211 -> 172.31.29.138 TCP 14618 [TCP segment of a reassembled PDU]
 81   0.020965 172.31.29.138 -> 54.230.158.211 TCP 66 53646 > http [ACK] Seq=97 Ack=277902 Win=558464 Len=0 TSval=9628323 TSecr=810104045
 82   0.021020 54.230.158.211 -> 172.31.29.138 TCP 14474 [TCP segment of a reassembled PDU]
 83   0.021030 172.31.29.138 -> 54.230.158.211 TCP 66 53646 > http [ACK] Seq=97 Ack=292310 Win=587264 Len=0 TSval=9628323 TSecr=810104045
 84   0.021097 54.230.158.211 -> 172.31.29.138 TCP 18890 [TCP segment of a reassembled PDU]
 85   0.021108 172.31.29.138 -> 54.230.158.211 TCP 66 53646 > http [ACK] Seq=97 Ack=311134 Win=624896 Len=0 TSval=9628323 TSecr=810104045
 86   0.021834 54.230.158.211 -> 172.31.29.138 TCP 2962 [TCP segment of a reassembled PDU]
 87   0.021839 172.31.29.138 -> 54.230.158.211 TCP 66 53646 > http [ACK] Seq=97 Ack=314030 Win=630784 Len=0 TSval=9628323 TSecr=810104045
 88   0.021971 54.230.158.211 -> 172.31.29.138 TCP 13474 [TCP segment of a reassembled PDU]
 89   0.021979 172.31.29.138 -> 54.230.158.211 TCP 66 53646 > http [ACK] Seq=97 Ack=327438 Win=657536 Len=0 TSval=9628323 TSecr=810104045
 90   0.023157 54.230.158.211 -> 172.31.29.138 TCP 2962 [TCP segment of a reassembled PDU]
 91   0.023162 172.31.29.138 -> 54.230.158.211 TCP 66 53646 > http [ACK] Seq=97 Ack=330334 Win=663296 Len=0 TSval=9628323 TSecr=810104045
 92   0.023171 54.230.158.211 -> 172.31.29.138 TCP 5858 [TCP segment of a reassembled PDU]
 93   0.023175 172.31.29.138 -> 54.230.158.211 TCP 66 53646 > http [ACK] Seq=97 Ack=336126 Win=674944 Len=0 TSval=9628323 TSecr=810104045
 94   0.023284 54.230.158.211 -> 172.31.29.138 TCP 10274 [TCP segment of a reassembled PDU]
 95   0.023292 172.31.29.138 -> 54.230.158.211 TCP 66 53646 > http [ACK] Seq=97 Ack=346334 Win=695296 Len=0 TSval=9628323 TSecr=810104045
 96   0.023353 54.230.158.211 -> 172.31.29.138 TCP 24682 [TCP segment of a reassembled PDU]
 97   0.023366 172.31.29.138 -> 54.230.158.211 TCP 66 53646 > http [ACK] Seq=97 Ack=370950 Win=744576 Len=0 TSval=9628323 TSecr=810104045
 98   0.023372 54.230.158.211 -> 172.31.29.138 TCP 1514 [TCP segment of a reassembled PDU]
 99   0.023375 172.31.29.138 -> 54.230.158.211 TCP 66 53646 > http [ACK] Seq=97 Ack=372398 Win=747520 Len=0 TSval=9628323 TSecr=810104045
100   0.023433 54.230.158.211 -> 172.31.29.138 TCP 8754 [TCP segment of a reassembled PDU]
101   0.023441 172.31.29.138 -> 54.230.158.211 TCP 66 53646 > http [ACK] Seq=97 Ack=381086 Win=744832 Len=0 TSval=9628323 TSecr=810104045
102   0.023902 54.230.158.211 -> 172.31.29.138 TCP 2962 [TCP segment of a reassembled PDU]
103   0.023909 172.31.29.138 -> 54.230.158.211 TCP 66 53646 > http [ACK] Seq=97 Ack=383982 Win=753280 Len=0 TSval=9628324 TSecr=810104045
104   0.024036 54.230.158.211 -> 172.31.29.138 TCP 8754 [TCP segment of a reassembled PDU]
105   0.024044 172.31.29.138 -> 54.230.158.211 TCP 66 53646 > http [ACK] Seq=97 Ack=392670 Win=770688 Len=0 TSval=9628324 TSecr=810104045
106   0.024122 54.230.158.211 -> 172.31.29.138 TCP 370 [TCP segment of a reassembled PDU]
107   0.024127 172.31.29.138 -> 54.230.158.211 TCP 66 53646 > http [ACK] Seq=97 Ack=392974 Win=770688 Len=0 TSval=9628324 TSecr=810104045
108   0.025162 54.230.158.211 -> 172.31.29.138 TCP 2962 [TCP segment of a reassembled PDU]
109   0.025167 172.31.29.138 -> 54.230.158.211 TCP 66 53646 > http [ACK] Seq=97 Ack=395870 Win=776448 Len=0 TSval=9628324 TSecr=810104045
110   0.025330 54.230.158.211 -> 172.31.29.138 TCP 26130 [TCP segment of a reassembled PDU]
111   0.025351 54.230.158.211 -> 172.31.29.138 TCP 10202 [TCP segment of a reassembled PDU]
112   0.025371 172.31.29.138 -> 54.230.158.211 TCP 66 53646 > http [ACK] Seq=97 Ack=432070 Win=742400 Len=0 TSval=9628324 TSecr=810104045
113   0.025392 54.230.158.211 -> 172.31.29.138 TCP 10202 [TCP segment of a reassembled PDU]
114   0.025406 172.31.29.138 -> 54.230.158.211 TCP 66 53646 > http [ACK] Seq=97 Ack=442206 Win=768640 Len=0 TSval=9628324 TSecr=810104045
115   0.025458 54.230.158.211 -> 172.31.29.138 TCP 11650 [TCP segment of a reassembled PDU]
116   0.025466 172.31.29.138 -> 54.230.158.211 TCP 66 53646 > http [ACK] Seq=97 Ack=453790 Win=782976 Len=0 TSval=9628324 TSecr=810104045
117   0.026168 54.230.158.211 -> 172.31.29.138 TCP 2962 [TCP segment of a reassembled PDU]
118   0.026173 172.31.29.138 -> 54.230.158.211 TCP 66 53646 > http [ACK] Seq=97 Ack=456686 Win=797184 Len=0 TSval=9628324 TSecr=810104045
119   0.026266 54.230.158.211 -> 172.31.29.138 TCP 1890 [TCP segment of a reassembled PDU]
120   0.026272 172.31.29.138 -> 54.230.158.211 TCP 66 53646 > http [ACK] Seq=97 Ack=458510 Win=797184 Len=0 TSval=9628324 TSecr=810104045
121   0.027443 54.230.158.211 -> 172.31.29.138 TCP 1514 [TCP segment of a reassembled PDU]
122   0.027707 54.230.158.211 -> 172.31.29.138 TCP 1514 [TCP segment of a reassembled PDU]
123   0.027711 172.31.29.138 -> 54.230.158.211 TCP 66 53646 > http [ACK] Seq=97 Ack=461406 Win=799488 Len=0 TSval=9628324 TSecr=810104045
124   0.027809 54.230.158.211 -> 172.31.29.138 TCP 13098 [TCP segment of a reassembled PDU]
125   0.027824 54.230.158.211 -> 172.31.29.138 TCP 8754 [TCP segment of a reassembled PDU]
126   0.027867 54.230.158.211 -> 172.31.29.138 TCP 4410 [TCP segment of a reassembled PDU]
127   0.027929 54.230.158.211 -> 172.31.29.138 TCP 23234 [TCP segment of a reassembled PDU]
128   0.027961 54.230.158.211 -> 172.31.29.138 TCP 11650 [TCP segment of a reassembled PDU]
129   0.028091 172.31.29.138 -> 54.230.158.211 TCP 66 53646 > http [ACK] Seq=97 Ack=522222 Win=738688 Len=0 TSval=9628325 TSecr=810104045
130   0.028727 54.230.158.211 -> 172.31.29.138 TCP 1890 [TCP segment of a reassembled PDU]
131   0.028732 172.31.29.138 -> 54.230.158.211 TCP 66 53646 > http [ACK] Seq=97 Ack=524046 Win=797184 Len=0 TSval=9628325 TSecr=810104045
132   0.030013 54.230.158.211 -> 172.31.29.138 TCP 2962 [TCP segment of a reassembled PDU]
133   0.030018 172.31.29.138 -> 54.230.158.211 TCP 66 53646 > http [ACK] Seq=97 Ack=526942 Win=797184 Len=0 TSval=9628325 TSecr=810104046
134   0.030254 54.230.158.211 -> 172.31.29.138 TCP 1514 [TCP segment of a reassembled PDU]
135   0.030400 54.230.158.211 -> 172.31.29.138 TCP 20338 [TCP segment of a reassembled PDU]
136   0.030424 172.31.29.138 -> 54.230.158.211 TCP 66 53646 > http [ACK] Seq=97 Ack=548662 Win=775552 Len=0 TSval=9628325 TSecr=810104046
137   0.030465 54.230.158.211 -> 172.31.29.138 TCP 15994 [TCP segment of a reassembled PDU]
138   0.030474 172.31.29.138 -> 54.230.158.211 TCP 66 53646 > http [ACK] Seq=97 Ack=564590 Win=775680 Len=0 TSval=9628325 TSecr=810104046
139   0.030577 54.230.158.211 -> 172.31.29.138 TCP 18890 [TCP segment of a reassembled PDU]
140   0.030600 172.31.29.138 -> 54.230.158.211 TCP 66 53646 > http [ACK] Seq=97 Ack=583414 Win=770944 Len=0 TSval=9628325 TSecr=810104046
141   0.030614 54.230.158.211 -> 172.31.29.138 TCP 6234 [TCP segment of a reassembled PDU]
142   0.030630 172.31.29.138 -> 54.230.158.211 TCP 66 53646 > http [ACK] Seq=97 Ack=589582 Win=799616 Len=0 TSval=9628325 TSecr=810104046
143   0.032407 54.230.158.211 -> 172.31.29.138 TCP 1514 [TCP segment of a reassembled PDU]
144   0.032437 54.230.158.211 -> 172.31.29.138 TCP 4410 [TCP segment of a reassembled PDU]
145   0.032449 172.31.29.138 -> 54.230.158.211 TCP 66 53646 > http [ACK] Seq=97 Ack=595374 Win=799616 Len=0 TSval=9628326 TSecr=810104046
146   0.032553 54.230.158.211 -> 172.31.29.138 TCP 17442 [TCP segment of a reassembled PDU]
147   0.032575 172.31.29.138 -> 54.230.158.211 TCP 66 53646 > http [ACK] Seq=97 Ack=612750 Win=782336 Len=0 TSval=9628326 TSecr=810104046
148   0.032685 54.230.158.211 -> 172.31.29.138 TCP 20338 [TCP segment of a reassembled PDU]
149   0.032709 172.31.29.138 -> 54.230.158.211 TCP 66 53646 > http [ACK] Seq=97 Ack=633022 Win=768640 Len=0 TSval=9628326 TSecr=810104046
150   0.032760 54.230.158.211 -> 172.31.29.138 TCP 20338 [TCP segment of a reassembled PDU]
151   0.032772 172.31.29.138 -> 54.230.158.211 TCP 66 53646 > http [ACK] Seq=97 Ack=653294 Win=768640 Len=0 TSval=9628326 TSecr=810104046
152   0.032794 54.230.158.211 -> 172.31.29.138 TCP 1890 [TCP segment of a reassembled PDU]
153   0.032808 172.31.29.138 -> 54.230.158.211 TCP 66 53646 > http [ACK] Seq=97 Ack=655118 Win=799616 Len=0 TSval=9628326 TSecr=810104046
154   0.036357 54.230.158.211 -> 172.31.29.138 TCP 5858 [TCP segment of a reassembled PDU]
155   0.036375 172.31.29.138 -> 54.230.158.211 TCP 66 53646 > http [ACK] Seq=97 Ack=660910 Win=799616 Len=0 TSval=9628327 TSecr=810104046
156   0.036539 54.230.158.211 -> 172.31.29.138 TCP 26130 [TCP segment of a reassembled PDU]
157   0.036557 54.230.158.211 -> 172.31.29.138 TCP 7306 [TCP segment of a reassembled PDU]
158   0.036573 172.31.29.138 -> 54.230.158.211 TCP 66 53646 > http [ACK] Seq=97 Ack=694214 Win=766336 Len=0 TSval=9628327 TSecr=810104046
159   0.036611 54.230.158.211 -> 172.31.29.138 TCP 10202 [TCP segment of a reassembled PDU]
160   0.036619 172.31.29.138 -> 54.230.158.211 TCP 66 53646 > http [ACK] Seq=97 Ack=704350 Win=785280 Len=0 TSval=9628327 TSecr=810104046
161   0.036682 54.230.158.211 -> 172.31.29.138 TCP 16370 [TCP segment of a reassembled PDU]
162   0.036706 172.31.29.138 -> 54.230.158.211 TCP 66 53646 > http [ACK] Seq=97 Ack=720654 Win=799616 Len=0 TSval=9628327 TSecr=810104046
163   0.038383 54.230.158.211 -> 172.31.29.138 TCP 2962 [TCP segment of a reassembled PDU]
164   0.038401 172.31.29.138 -> 54.230.158.211 TCP 66 53646 > http [ACK] Seq=97 Ack=723550 Win=799616 Len=0 TSval=9628327 TSecr=810104046
165   0.038544 54.230.158.211 -> 172.31.29.138 TCP 24682 [TCP segment of a reassembled PDU]
166   0.038573 172.31.29.138 -> 54.230.158.211 TCP 66 53646 > http [ACK] Seq=97 Ack=748166 Win=775040 Len=0 TSval=9628327 TSecr=810104046
167   0.038579 54.230.158.211 -> 172.31.29.138 TCP 1514 [TCP segment of a reassembled PDU]
168   0.038620 54.230.158.211 -> 172.31.29.138 TCP 11650 [TCP segment of a reassembled PDU]
169   0.038628 172.31.29.138 -> 54.230.158.211 TCP 66 53646 > http [ACK] Seq=97 Ack=761198 Win=782976 Len=0 TSval=9628327 TSecr=810104046
170   0.038691 54.230.158.211 -> 172.31.29.138 TCP 15994 [TCP segment of a reassembled PDU]
171   0.038714 172.31.29.138 -> 54.230.158.211 TCP 66 53646 > http [ACK] Seq=97 Ack=777126 Win=799616 Len=0 TSval=9628327 TSecr=810104046
172   0.038746 54.230.158.211 -> 172.31.29.138 TCP 9130 [TCP segment of a reassembled PDU]
173   0.038766 172.31.29.138 -> 54.230.158.211 TCP 66 53646 > http [ACK] Seq=97 Ack=786190 Win=799616 Len=0 TSval=9628327 TSecr=810104046
174   0.039727 54.230.158.211 -> 172.31.29.138 TCP 4410 [TCP segment of a reassembled PDU]
175   0.039745 172.31.29.138 -> 54.230.158.211 TCP 66 53646 > http [ACK] Seq=97 Ack=790534 Win=799616 Len=0 TSval=9628327 TSecr=810104046
176   0.039822 54.230.158.211 -> 172.31.29.138 TCP 4410 [TCP segment of a reassembled PDU]
177   0.039841 172.31.29.138 -> 54.230.158.211 TCP 66 53646 > http [ACK] Seq=97 Ack=794878 Win=799616 Len=0 TSval=9628328 TSecr=810104046
178   0.039903 54.230.158.211 -> 172.31.29.138 TCP 26130 [TCP segment of a reassembled PDU]
179   0.039929 172.31.29.138 -> 54.230.158.211 TCP 66 53646 > http [ACK] Seq=97 Ack=820942 Win=773632 Len=0 TSval=9628328 TSecr=810104047
180   0.039974 54.230.158.211 -> 172.31.29.138 TCP 4410 [TCP segment of a reassembled PDU]
181   0.039980 172.31.29.138 -> 54.230.158.211 TCP 66 53646 > http [ACK] Seq=97 Ack=825286 Win=794752 Len=0 TSval=9628328 TSecr=810104047
182   0.039999 54.230.158.211 -> 172.31.29.138 TCP 21786 [TCP segment of a reassembled PDU]
183   0.040024 54.230.158.211 -> 172.31.29.138 TCP 4786 [TCP segment of a reassembled PDU]
184   0.040039 172.31.29.138 -> 54.230.158.211 TCP 66 53646 > http [ACK] Seq=97 Ack=851726 Win=768384 Len=0 TSval=9628328 TSecr=810104047
185   0.040493 54.230.158.211 -> 172.31.29.138 TCP 4410 [TCP segment of a reassembled PDU]
186   0.040500 172.31.29.138 -> 54.230.158.211 TCP 66 53646 > http [ACK] Seq=97 Ack=856070 Win=794752 Len=0 TSval=9628328 TSecr=810104047
187   0.040615 54.230.158.211 -> 172.31.29.138 TCP 7306 [TCP segment of a reassembled PDU]
188   0.040633 172.31.29.138 -> 54.230.158.211 TCP 66 53646 > http [ACK] Seq=97 Ack=863310 Win=799616 Len=0 TSval=9628328 TSecr=810104047
189   0.040698 54.230.158.211 -> 172.31.29.138 TCP 24682 [TCP segment of a reassembled PDU]
190   0.040724 172.31.29.138 -> 54.230.158.211 TCP 66 53646 > http [ACK] Seq=97 Ack=887926 Win=775040 Len=0 TSval=9628328 TSecr=810104047
191   0.040766 54.230.158.211 -> 172.31.29.138 TCP 17442 [TCP segment of a reassembled PDU]
192   0.040791 172.31.29.138 -> 54.230.158.211 TCP 66 53646 > http [ACK] Seq=97 Ack=905302 Win=773376 Len=0 TSval=9628328 TSecr=810104047
193   0.040880 54.230.158.211 -> 172.31.29.138 TCP 12026 [TCP segment of a reassembled PDU]
194   0.040888 172.31.29.138 -> 54.230.158.211 TCP 66 53646 > http [ACK] Seq=97 Ack=917262 Win=780544 Len=0 TSval=9628328 TSecr=810104047
195   0.041833 54.230.158.211 -> 172.31.29.138 TCP 2962 [TCP segment of a reassembled PDU]
196   0.041838 172.31.29.138 -> 54.230.158.211 TCP 66 53646 > http [ACK] Seq=97 Ack=920158 Win=797184 Len=0 TSval=9628328 TSecr=810104047
197   0.041949 54.230.158.211 -> 172.31.29.138 TCP 2962 [TCP segment of a reassembled PDU]
198   0.041955 172.31.29.138 -> 54.230.158.211 TCP 66 53646 > http [ACK] Seq=97 Ack=923054 Win=797184 Len=0 TSval=9628328 TSecr=810104047
199   0.042095 54.230.158.211 -> 172.31.29.138 TCP 39162 [TCP segment of a reassembled PDU]
200   0.042125 54.230.158.211 -> 172.31.29.138 TCP 4410 [TCP segment of a reassembled PDU]
201   0.042141 172.31.29.138 -> 54.230.158.211 TCP 66 53646 > http [ACK] Seq=97 Ack=966494 Win=753792 Len=0 TSval=9628328 TSecr=810104047
202   0.042178 54.230.158.211 -> 172.31.29.138 TCP 16370 [TCP segment of a reassembled PDU]
203   0.042187 172.31.29.138 -> 54.230.158.211 TCP 66 53646 > http [ACK] Seq=97 Ack=982798 Win=773376 Len=0 TSval=9628328 TSecr=810104047
204   0.046464 54.230.158.211 -> 172.31.29.138 TCP 4410 [TCP segment of a reassembled PDU]
205   0.046470 172.31.29.138 -> 54.230.158.211 TCP 66 53646 > http [ACK] Seq=97 Ack=987142 Win=794752 Len=0 TSval=9628329 TSecr=810104047
206   0.046651 54.230.158.211 -> 172.31.29.138 TCP 26130 [TCP segment of a reassembled PDU]
207   0.046671 54.230.158.211 -> 172.31.29.138 TCP 10202 [TCP segment of a reassembled PDU]
208   0.046695 172.31.29.138 -> 54.230.158.211 TCP 66 53646 > http [ACK] Seq=97 Ack=1023342 Win=758656 Len=0 TSval=9628329 TSecr=810104047
209   0.046712 54.230.158.211 -> 172.31.29.138 TCP 20338 [TCP segment of a reassembled PDU]
210   0.046727 54.230.158.211 -> 172.31.29.138 TCP 4786 [TCP segment of a reassembled PDU]
211   0.046744 172.31.29.138 -> 54.230.158.211 TCP 66 53646 > http [ACK] Seq=97 Ack=1048334 Win=742272 Len=0 TSval=9628329 TSecr=810104047
212   0.046770 54.230.158.211 -> 172.31.29.138 HTTP 766 HTTP/1.1 200 OK  (application/octet-stream)
213   0.046781 172.31.29.138 -> 54.230.158.211 TCP 66 53646 > http [ACK] Seq=97 Ack=1049034 Win=799616 Len=0 TSval=9628329 TSecr=810104047
214   0.046895 172.31.29.138 -> 54.230.158.211 TCP 66 53646 > http [FIN, ACK] Seq=97 Ack=1049034 Win=799616 Len=0 TSval=9628329 TSecr=810104047
215   0.047465 54.230.158.211 -> 172.31.29.138 TCP 66 http > 53646 [FIN, ACK] Seq=1049034 Ack=98 Win=14592 Len=0 TSval=810104047 TSecr=9628329
216   0.047473 172.31.29.138 -> 54.230.158.211 TCP 66 53646 > http [ACK] Seq=98 Ack=1049035 Win=799616 Len=0 TSval=9628329 TSecr=810104047
