[Measurement for 1mb at 13:37:20 20.37.2014] 
Tshark:

  1   0.000000 172.31.29.138 -> 172.31.0.2   DNS 89 Standard query 0x0ae0  A d1xzxs93r3iphc.cloudfront.net
  2   0.000032 172.31.29.138 -> 172.31.0.2   DNS 89 Standard query 0x49a2  AAAA d1xzxs93r3iphc.cloudfront.net
  3   0.000515   172.31.0.2 -> 172.31.29.138 DNS 217 Standard query response 0x0ae0  A 54.230.158.177 A 54.230.158.187 A 54.230.159.131 A 54.240.168.205 A 54.192.157.143 A 54.192.159.99 A 54.192.159.106 A 54.230.157.86
  4   0.000528   172.31.0.2 -> 172.31.29.138 DNS 170 Standard query response 0x49a2 
  5   0.003889 172.31.29.138 -> 54.230.158.177 TCP 74 51682 > http [SYN] Seq=0 Win=26883 Len=0 MSS=8961 SACK_PERM=1 TSval=18628190 TSecr=0 WS=128
  6   0.004427 54.230.158.177 -> 172.31.29.138 TCP 74 http > 51682 [SYN, ACK] Seq=0 Ack=1 Win=14480 Len=0 MSS=1460 SACK_PERM=1 TSval=733702008 TSecr=18628190 WS=128
  7   0.004441 172.31.29.138 -> 54.230.158.177 TCP 66 51682 > http [ACK] Seq=1 Ack=1 Win=27008 Len=0 TSval=18628190 TSecr=733702008
  8   0.004479 172.31.29.138 -> 54.230.158.177 HTTP 162 GET /1mb HTTP/1.1 
  9   0.004916 54.230.158.177 -> 172.31.29.138 TCP 66 http > 51682 [ACK] Seq=1 Ack=97 Win=14592 Len=0 TSval=733702008 TSecr=18628190
 10   0.008528 54.230.158.177 -> 172.31.29.138 TCP 2962 [TCP segment of a reassembled PDU]
 11   0.008536 172.31.29.138 -> 54.230.158.177 TCP 66 51682 > http [ACK] Seq=97 Ack=2897 Win=32768 Len=0 TSval=18628191 TSecr=733702009
 12   0.008611 54.230.158.177 -> 172.31.29.138 TCP 10202 [TCP segment of a reassembled PDU]
 13   0.008620 172.31.29.138 -> 54.230.158.177 TCP 66 51682 > http [ACK] Seq=97 Ack=13033 Win=52992 Len=0 TSval=18628191 TSecr=733702009
 14   0.009288 54.230.158.177 -> 172.31.29.138 TCP 4410 [TCP segment of a reassembled PDU]
 15   0.009294 172.31.29.138 -> 54.230.158.177 TCP 66 51682 > http [ACK] Seq=97 Ack=17377 Win=61696 Len=0 TSval=18628191 TSecr=733702009
 16   0.009379 54.230.158.177 -> 172.31.29.138 TCP 8754 [TCP segment of a reassembled PDU]
 17   0.009386 172.31.29.138 -> 54.230.158.177 TCP 66 51682 > http [ACK] Seq=97 Ack=26065 Win=79104 Len=0 TSval=18628191 TSecr=733702009
 18   0.009811 54.230.158.177 -> 172.31.29.138 TCP 2962 [TCP segment of a reassembled PDU]
 19   0.009816 172.31.29.138 -> 54.230.158.177 TCP 66 51682 > http [ACK] Seq=97 Ack=28961 Win=84864 Len=0 TSval=18628191 TSecr=733702009
 20   0.009890 54.230.158.177 -> 172.31.29.138 TCP 11650 [TCP segment of a reassembled PDU]
 21   0.009898 172.31.29.138 -> 54.230.158.177 TCP 66 51682 > http [ACK] Seq=97 Ack=40545 Win=98944 Len=0 TSval=18628191 TSecr=733702009
 22   0.009908 54.230.158.177 -> 172.31.29.138 TCP 5858 [TCP segment of a reassembled PDU]
 23   0.009917 172.31.29.138 -> 54.230.158.177 TCP 66 51682 > http [ACK] Seq=97 Ack=46337 Win=93184 Len=0 TSval=18628191 TSecr=733702009
 24   0.010374 54.230.158.177 -> 172.31.29.138 TCP 5858 [TCP segment of a reassembled PDU]
 25   0.010380 172.31.29.138 -> 54.230.158.177 TCP 66 51682 > http [ACK] Seq=97 Ack=52129 Win=108416 Len=0 TSval=18628192 TSecr=733702009
 26   0.010473 54.230.158.177 -> 172.31.29.138 TCP 11650 [TCP segment of a reassembled PDU]
 27   0.010481 172.31.29.138 -> 54.230.158.177 TCP 66 51682 > http [ACK] Seq=97 Ack=63713 Win=132224 Len=0 TSval=18628192 TSecr=733702009
 28   0.010836 54.230.158.177 -> 172.31.29.138 TCP 2962 [TCP segment of a reassembled PDU]
 29   0.010841 172.31.29.138 -> 54.230.158.177 TCP 66 51682 > http [ACK] Seq=97 Ack=66609 Win=137984 Len=0 TSval=18628192 TSecr=733702009
 30   0.010914 54.230.158.177 -> 172.31.29.138 TCP 11650 [TCP segment of a reassembled PDU]
 31   0.010922 172.31.29.138 -> 54.230.158.177 TCP 66 51682 > http [ACK] Seq=97 Ack=78193 Win=161152 Len=0 TSval=18628192 TSecr=733702009
 32   0.011084 54.230.158.177 -> 172.31.29.138 TCP 2962 [TCP segment of a reassembled PDU]
 33   0.011089 172.31.29.138 -> 54.230.158.177 TCP 66 51682 > http [ACK] Seq=97 Ack=81089 Win=167040 Len=0 TSval=18628192 TSecr=733702009
 34   0.011189 54.230.158.177 -> 172.31.29.138 TCP 10202 [TCP segment of a reassembled PDU]
 35   0.011197 172.31.29.138 -> 54.230.158.177 TCP 66 51682 > http [ACK] Seq=97 Ack=91225 Win=187264 Len=0 TSval=18628192 TSecr=733702009
 36   0.011434 54.230.158.177 -> 172.31.29.138 TCP 17442 [TCP segment of a reassembled PDU]
 37   0.011445 172.31.29.138 -> 54.230.158.177 TCP 66 51682 > http [ACK] Seq=97 Ack=108601 Win=221952 Len=0 TSval=18628192 TSecr=733702009
 38   0.011854 54.230.158.177 -> 172.31.29.138 TCP 4410 [TCP segment of a reassembled PDU]
 39   0.011860 172.31.29.138 -> 54.230.158.177 TCP 66 51682 > http [ACK] Seq=97 Ack=112945 Win=230656 Len=0 TSval=18628192 TSecr=733702009
 40   0.012039 54.230.158.177 -> 172.31.29.138 TCP 27578 [TCP segment of a reassembled PDU]
 41   0.012055 172.31.29.138 -> 54.230.158.177 TCP 66 51682 > http [ACK] Seq=97 Ack=140457 Win=285696 Len=0 TSval=18628192 TSecr=733702009
 42   0.012638 54.230.158.177 -> 172.31.29.138 TCP 2962 [TCP segment of a reassembled PDU]
 43   0.012644 172.31.29.138 -> 54.230.158.177 TCP 66 51682 > http [ACK] Seq=97 Ack=143353 Win=291456 Len=0 TSval=18628192 TSecr=733702009
 44   0.012800 54.230.158.177 -> 172.31.29.138 TCP 26130 [TCP segment of a reassembled PDU]
 45   0.012814 172.31.29.138 -> 54.230.158.177 TCP 66 51682 > http [ACK] Seq=97 Ack=169417 Win=343680 Len=0 TSval=18628192 TSecr=733702009
 46   0.012826 54.230.158.177 -> 172.31.29.138 TCP 8754 [TCP segment of a reassembled PDU]
 47   0.012835 172.31.29.138 -> 54.230.158.177 TCP 66 51682 > http [ACK] Seq=97 Ack=178105 Win=360960 Len=0 TSval=18628192 TSecr=733702009
 48   0.013404 54.230.158.177 -> 172.31.29.138 TCP 2962 [TCP segment of a reassembled PDU]
 49   0.013409 172.31.29.138 -> 54.230.158.177 TCP 66 51682 > http [ACK] Seq=97 Ack=181001 Win=366848 Len=0 TSval=18628192 TSecr=733702009
 50   0.013521 54.230.158.177 -> 172.31.29.138 TCP 8754 [TCP segment of a reassembled PDU]
 51   0.013527 172.31.29.138 -> 54.230.158.177 TCP 66 51682 > http [ACK] Seq=97 Ack=189689 Win=384128 Len=0 TSval=18628192 TSecr=733702009
 52   0.013587 54.230.158.177 -> 172.31.29.138 TCP 20338 [TCP segment of a reassembled PDU]
 53   0.013598 172.31.29.138 -> 54.230.158.177 TCP 66 51682 > http [ACK] Seq=97 Ack=209961 Win=424704 Len=0 TSval=18628192 TSecr=733702009
 54   0.014144 54.230.158.177 -> 172.31.29.138 TCP 2962 [TCP segment of a reassembled PDU]
 55   0.014149 172.31.29.138 -> 54.230.158.177 TCP 66 51682 > http [ACK] Seq=97 Ack=212857 Win=430464 Len=0 TSval=18628192 TSecr=733702009
 56   0.014333 54.230.158.177 -> 172.31.29.138 TCP 26130 [TCP segment of a reassembled PDU]
 57   0.014346 172.31.29.138 -> 54.230.158.177 TCP 66 51682 > http [ACK] Seq=97 Ack=238921 Win=443776 Len=0 TSval=18628193 TSecr=733702009
 58   0.014364 54.230.158.177 -> 172.31.29.138 TCP 15994 [TCP segment of a reassembled PDU]
 59   0.014372 172.31.29.138 -> 54.230.158.177 TCP 66 51682 > http [ACK] Seq=97 Ack=254849 Win=427904 Len=0 TSval=18628193 TSecr=733702009
 60   0.014964 54.230.158.177 -> 172.31.29.138 TCP 7306 [TCP segment of a reassembled PDU]
 61   0.014972 172.31.29.138 -> 54.230.158.177 TCP 66 51682 > http [ACK] Seq=97 Ack=262089 Win=497152 Len=0 TSval=18628193 TSecr=733702009
 62   0.015141 54.230.158.177 -> 172.31.29.138 TCP 26130 [TCP segment of a reassembled PDU]
 63   0.015154 172.31.29.138 -> 54.230.158.177 TCP 66 51682 > http [ACK] Seq=97 Ack=288153 Win=549248 Len=0 TSval=18628193 TSecr=733702009
 64   0.015172 54.230.158.177 -> 172.31.29.138 TCP 17442 [TCP segment of a reassembled PDU]
 65   0.015180 172.31.29.138 -> 54.230.158.177 TCP 66 51682 > http [ACK] Seq=97 Ack=305529 Win=584064 Len=0 TSval=18628193 TSecr=733702009
 66   0.015681 54.230.158.177 -> 172.31.29.138 TCP 2962 [TCP segment of a reassembled PDU]
 67   0.015686 172.31.29.138 -> 54.230.158.177 TCP 66 51682 > http [ACK] Seq=97 Ack=308425 Win=589824 Len=0 TSval=18628193 TSecr=733702009
 68   0.015918 54.230.158.177 -> 172.31.29.138 TCP 26130 [TCP segment of a reassembled PDU]
 69   0.015933 172.31.29.138 -> 54.230.158.177 TCP 66 51682 > http [ACK] Seq=97 Ack=334489 Win=641920 Len=0 TSval=18628193 TSecr=733702009
 70   0.015957 54.230.158.177 -> 172.31.29.138 TCP 26130 [TCP segment of a reassembled PDU]
 71   0.015970 172.31.29.138 -> 54.230.158.177 TCP 66 51682 > http [ACK] Seq=97 Ack=360553 Win=694016 Len=0 TSval=18628193 TSecr=733702009
 72   0.016517 54.230.158.177 -> 172.31.29.138 TCP 7306 [TCP segment of a reassembled PDU]
 73   0.016525 172.31.29.138 -> 54.230.158.177 TCP 66 51682 > http [ACK] Seq=97 Ack=367793 Win=708480 Len=0 TSval=18628193 TSecr=733702009
 74   0.016708 54.230.158.177 -> 172.31.29.138 TCP 26130 [TCP segment of a reassembled PDU]
 75   0.016721 172.31.29.138 -> 54.230.158.177 TCP 66 51682 > http [ACK] Seq=97 Ack=393857 Win=760704 Len=0 TSval=18628193 TSecr=733702009
 76   0.016729 54.230.158.177 -> 172.31.29.138 TCP 2962 [TCP segment of a reassembled PDU]
 77   0.016732 172.31.29.138 -> 54.230.158.177 TCP 66 51682 > http [ACK] Seq=97 Ack=396753 Win=766464 Len=0 TSval=18628193 TSecr=733702009
 78   0.016759 54.230.158.177 -> 172.31.29.138 TCP 23234 [TCP segment of a reassembled PDU]
 79   0.016780 172.31.29.138 -> 54.230.158.177 TCP 66 51682 > http [ACK] Seq=97 Ack=419921 Win=812800 Len=0 TSval=18628193 TSecr=733702009
 80   0.017278 54.230.158.177 -> 172.31.29.138 TCP 7306 [TCP segment of a reassembled PDU]
 81   0.017286 172.31.29.138 -> 54.230.158.177 TCP 66 51682 > http [ACK] Seq=97 Ack=427161 Win=827264 Len=0 TSval=18628193 TSecr=733702009
 82   0.017453 54.230.158.177 -> 172.31.29.138 TCP 29026 [TCP segment of a reassembled PDU]
 83   0.017468 172.31.29.138 -> 54.230.158.177 TCP 66 51682 > http [ACK] Seq=97 Ack=456121 Win=885248 Len=0 TSval=18628193 TSecr=733702009
 84   0.017474 54.230.158.177 -> 172.31.29.138 TCP 2174 [TCP segment of a reassembled PDU]
 85   0.017477 172.31.29.138 -> 54.230.158.177 TCP 66 51682 > http [ACK] Seq=97 Ack=458229 Win=885248 Len=0 TSval=18628193 TSecr=733702009
 86   0.017532 54.230.158.177 -> 172.31.29.138 TCP 7306 [TCP segment of a reassembled PDU]
 87   0.017539 172.31.29.138 -> 54.230.158.177 TCP 66 51682 > http [ACK] Seq=97 Ack=465469 Win=899712 Len=0 TSval=18628193 TSecr=733702009
 88   0.017675 54.230.158.177 -> 172.31.29.138 TCP 18890 [TCP segment of a reassembled PDU]
 89   0.017686 172.31.29.138 -> 54.230.158.177 TCP 66 51682 > http [ACK] Seq=97 Ack=484293 Win=937344 Len=0 TSval=18628193 TSecr=733702009
 90   0.018018 54.230.158.177 -> 172.31.29.138 TCP 2962 [TCP segment of a reassembled PDU]
 91   0.018023 172.31.29.138 -> 54.230.158.177 TCP 66 51682 > http [ACK] Seq=97 Ack=487189 Win=943104 Len=0 TSval=18628193 TSecr=733702010
 92   0.018208 54.230.158.177 -> 172.31.29.138 TCP 27578 [TCP segment of a reassembled PDU]
 93   0.018222 172.31.29.138 -> 54.230.158.177 TCP 66 51682 > http [ACK] Seq=97 Ack=514701 Win=954880 Len=0 TSval=18628193 TSecr=733702010
 94   0.018235 54.230.158.177 -> 172.31.29.138 TCP 9130 [TCP segment of a reassembled PDU]
 95   0.018240 172.31.29.138 -> 54.230.158.177 TCP 66 51682 > http [ACK] Seq=97 Ack=523765 Win=945920 Len=0 TSval=18628193 TSecr=733702010
 96   0.018576 54.230.158.177 -> 172.31.29.138 TCP 5858 [TCP segment of a reassembled PDU]
 97   0.018583 172.31.29.138 -> 54.230.158.177 TCP 66 51682 > http [ACK] Seq=97 Ack=529557 Win=990592 Len=0 TSval=18628194 TSecr=733702010
 98   0.018773 54.230.158.177 -> 172.31.29.138 TCP 26130 [TCP segment of a reassembled PDU]
 99   0.018787 172.31.29.138 -> 54.230.158.177 TCP 66 51682 > http [ACK] Seq=97 Ack=555621 Win=1047040 Len=0 TSval=18628194 TSecr=733702010
100   0.018879 54.230.158.177 -> 172.31.29.138 TCP 15994 [TCP segment of a reassembled PDU]
101   0.018889 172.31.29.138 -> 54.230.158.177 TCP 66 51682 > http [ACK] Seq=97 Ack=571549 Win=1078912 Len=0 TSval=18628194 TSecr=733702010
102   0.019004 54.230.158.177 -> 172.31.29.138 TCP 17818 [TCP segment of a reassembled PDU]
103   0.019013 172.31.29.138 -> 54.230.158.177 TCP 66 51682 > http [ACK] Seq=97 Ack=589301 Win=1114368 Len=0 TSval=18628194 TSecr=733702010
104   0.028062 54.230.158.177 -> 172.31.29.138 TCP 11650 [TCP segment of a reassembled PDU]
105   0.028072 172.31.29.138 -> 54.230.158.177 TCP 66 51682 > http [ACK] Seq=97 Ack=600885 Win=1137536 Len=0 TSval=18628196 TSecr=733702011
106   0.028270 54.230.158.177 -> 172.31.29.138 TCP 26130 [TCP segment of a reassembled PDU]
107   0.028285 172.31.29.138 -> 54.230.158.177 TCP 66 51682 > http [ACK] Seq=97 Ack=626949 Win=1189632 Len=0 TSval=18628196 TSecr=733702011
108   0.028294 54.230.158.177 -> 172.31.29.138 TCP 5858 [TCP segment of a reassembled PDU]
109   0.028298 172.31.29.138 -> 54.230.158.177 TCP 66 51682 > http [ACK] Seq=97 Ack=632741 Win=1201280 Len=0 TSval=18628196 TSecr=733702011
110   0.028341 54.230.158.177 -> 172.31.29.138 TCP 20338 [TCP segment of a reassembled PDU]
111   0.028351 172.31.29.138 -> 54.230.158.177 TCP 66 51682 > http [ACK] Seq=97 Ack=653013 Win=1241728 Len=0 TSval=18628196 TSecr=733702011
112   0.028408 54.230.158.177 -> 172.31.29.138 TCP 1890 [TCP segment of a reassembled PDU]
113   0.028413 172.31.29.138 -> 54.230.158.177 TCP 66 51682 > http [ACK] Seq=97 Ack=654837 Win=1241728 Len=0 TSval=18628196 TSecr=733702011
114   0.028427 54.230.158.177 -> 172.31.29.138 TCP 13098 [TCP segment of a reassembled PDU]
115   0.028437 172.31.29.138 -> 54.230.158.177 TCP 66 51682 > http [ACK] Seq=97 Ack=667869 Win=1267840 Len=0 TSval=18628196 TSecr=733702011
116   0.029000 54.230.158.177 -> 172.31.29.138 TCP 2962 [TCP segment of a reassembled PDU]
117   0.029006 172.31.29.138 -> 54.230.158.177 TCP 66 51682 > http [ACK] Seq=97 Ack=670765 Win=1273600 Len=0 TSval=18628196 TSecr=733702011
118   0.029212 54.230.158.177 -> 172.31.29.138 TCP 17442 [TCP segment of a reassembled PDU]
119   0.029222 172.31.29.138 -> 54.230.158.177 TCP 66 51682 > http [ACK] Seq=97 Ack=688141 Win=1308416 Len=0 TSval=18628196 TSecr=733702011
120   0.029331 54.230.158.177 -> 172.31.29.138 TCP 44954 [TCP segment of a reassembled PDU]
121   0.029353 172.31.29.138 -> 54.230.158.177 TCP 66 51682 > http [ACK] Seq=97 Ack=733029 Win=1398144 Len=0 TSval=18628196 TSecr=733702011
122   0.029782 54.230.158.177 -> 172.31.29.138 TCP 4410 [TCP segment of a reassembled PDU]
123   0.029789 172.31.29.138 -> 54.230.158.177 TCP 66 51682 > http [ACK] Seq=97 Ack=737373 Win=1406848 Len=0 TSval=18628196 TSecr=733702011
124   0.029987 54.230.158.177 -> 172.31.29.138 TCP 26130 [TCP segment of a reassembled PDU]
125   0.030000 172.31.29.138 -> 54.230.158.177 TCP 66 51682 > http [ACK] Seq=97 Ack=763437 Win=1452928 Len=0 TSval=18628196 TSecr=733702011
126   0.030024 54.230.158.177 -> 172.31.29.138 TCP 23234 [TCP segment of a reassembled PDU]
127   0.030036 54.230.158.177 -> 172.31.29.138 TCP 2962 [TCP segment of a reassembled PDU]
128   0.030053 172.31.29.138 -> 54.230.158.177 TCP 66 51682 > http [ACK] Seq=97 Ack=789501 Win=1426944 Len=0 TSval=18628196 TSecr=733702011
129   0.030070 54.230.158.177 -> 172.31.29.138 TCP 2962 [TCP segment of a reassembled PDU]
130   0.030074 54.230.158.177 -> 172.31.29.138 TCP 1514 [TCP Previous segment not captured] [TCP segment of a reassembled PDU]
131   0.030077 172.31.29.138 -> 54.230.158.177 TCP 78 51682 > http [ACK] Seq=97 Ack=792397 Win=1424128 Len=0 TSval=18628196 TSecr=733702011 SLE=793845 SRE=795293
132   0.030084 54.230.158.177 -> 172.31.29.138 TCP 1514 [TCP Out-Of-Order] [TCP segment of a reassembled PDU]
133   0.030087 172.31.29.138 -> 54.230.158.177 TCP 66 51682 > http [ACK] Seq=97 Ack=795293 Win=1421312 Len=0 TSval=18628196 TSecr=733702011
134   0.030113 54.230.158.177 -> 172.31.29.138 TCP 2962 [TCP segment of a reassembled PDU]
135   0.030117 172.31.29.138 -> 54.230.158.177 TCP 66 51682 > http [ACK] Seq=97 Ack=798189 Win=1464832 Len=0 TSval=18628196 TSecr=733702011
136   0.030434 54.230.158.177 -> 172.31.29.138 TCP 26130 [TCP segment of a reassembled PDU]
137   0.030448 172.31.29.138 -> 54.230.158.177 TCP 66 51682 > http [ACK] Seq=97 Ack=824253 Win=1452928 Len=0 TSval=18628197 TSecr=733702011
138   0.030458 54.230.158.177 -> 172.31.29.138 TCP 7306 [TCP segment of a reassembled PDU]
139   0.030467 172.31.29.138 -> 54.230.158.177 TCP 66 51682 > http [ACK] Seq=97 Ack=831493 Win=1445760 Len=0 TSval=18628197 TSecr=733702011
140   0.030528 54.230.158.177 -> 172.31.29.138 TCP 2962 [TCP segment of a reassembled PDU]
141   0.030533 172.31.29.138 -> 54.230.158.177 TCP 66 51682 > http [ACK] Seq=97 Ack=834389 Win=1470592 Len=0 TSval=18628197 TSecr=733702011
142   0.030719 54.230.158.177 -> 172.31.29.138 TCP 26130 [TCP segment of a reassembled PDU]
143   0.030746 172.31.29.138 -> 54.230.158.177 TCP 66 51682 > http [ACK] Seq=97 Ack=860453 Win=1452928 Len=0 TSval=18628197 TSecr=733702011
144   0.030756 54.230.158.177 -> 172.31.29.138 TCP 7306 [TCP segment of a reassembled PDU]
145   0.030764 172.31.29.138 -> 54.230.158.177 TCP 66 51682 > http [ACK] Seq=97 Ack=867693 Win=1445760 Len=0 TSval=18628197 TSecr=733702011
146   0.031127 54.230.158.177 -> 172.31.29.138 TCP 14546 [TCP segment of a reassembled PDU]
147   0.031136 172.31.29.138 -> 54.230.158.177 TCP 66 51682 > http [ACK] Seq=97 Ack=882173 Win=1471872 Len=0 TSval=18628197 TSecr=733702011
148   0.031277 54.230.158.177 -> 172.31.29.138 TCP 20338 [TCP segment of a reassembled PDU]
149   0.031289 172.31.29.138 -> 54.230.158.177 TCP 66 51682 > http [ACK] Seq=97 Ack=902445 Win=1462400 Len=0 TSval=18628197 TSecr=733702011
150   0.031400 54.230.158.177 -> 172.31.29.138 TCP 21786 [TCP segment of a reassembled PDU]
151   0.031412 172.31.29.138 -> 54.230.158.177 TCP 66 51682 > http [ACK] Seq=97 Ack=924165 Win=1459968 Len=0 TSval=18628197 TSecr=733702011
152   0.031477 54.230.158.177 -> 172.31.29.138 TCP 4410 [TCP segment of a reassembled PDU]
153   0.031483 172.31.29.138 -> 54.230.158.177 TCP 66 51682 > http [ACK] Seq=97 Ack=928509 Win=1487744 Len=0 TSval=18628197 TSecr=733702011
154   0.031808 54.230.158.177 -> 172.31.29.138 TCP 4410 [TCP segment of a reassembled PDU]
155   0.031814 172.31.29.138 -> 54.230.158.177 TCP 66 51682 > http [ACK] Seq=97 Ack=932853 Win=1487744 Len=0 TSval=18628197 TSecr=733702011
156   0.031994 54.230.158.177 -> 172.31.29.138 TCP 26130 [TCP segment of a reassembled PDU]
157   0.032017 172.31.29.138 -> 54.230.158.177 TCP 66 51682 > http [ACK] Seq=97 Ack=958917 Win=1461760 Len=0 TSval=18628197 TSecr=733702011
158   0.032050 54.230.158.177 -> 172.31.29.138 TCP 23666 [TCP segment of a reassembled PDU]
159   0.032066 172.31.29.138 -> 54.230.158.177 TCP 66 51682 > http [ACK] Seq=97 Ack=982517 Win=1438208 Len=0 TSval=18628197 TSecr=733702011
160   0.032588 54.230.158.177 -> 172.31.29.138 TCP 2962 [TCP segment of a reassembled PDU]
161   0.032594 172.31.29.138 -> 54.230.158.177 TCP 66 51682 > http [ACK] Seq=97 Ack=985413 Win=1487744 Len=0 TSval=18628197 TSecr=733702011
162   0.032765 54.230.158.177 -> 172.31.29.138 TCP 26130 [TCP segment of a reassembled PDU]
163   0.032779 172.31.29.138 -> 54.230.158.177 TCP 66 51682 > http [ACK] Seq=97 Ack=1011477 Win=1461760 Len=0 TSval=18628197 TSecr=733702011
164   0.032821 54.230.158.177 -> 172.31.29.138 TCP 26130 [TCP segment of a reassembled PDU]
165   0.032833 172.31.29.138 -> 54.230.158.177 TCP 66 51682 > http [ACK] Seq=97 Ack=1037541 Win=1435776 Len=0 TSval=18628197 TSecr=733702011
166   0.032867 54.230.158.177 -> 172.31.29.138 HTTP 11559 HTTP/1.1 200 OK  (application/octet-stream)
167   0.032879 172.31.29.138 -> 54.230.158.177 TCP 66 51682 > http [ACK] Seq=97 Ack=1049034 Win=1433856 Len=0 TSval=18628197 TSecr=733702011
168   0.033014 172.31.29.138 -> 54.230.158.177 TCP 66 51682 > http [FIN, ACK] Seq=97 Ack=1049034 Win=1487744 Len=0 TSval=18628197 TSecr=733702011
169   0.034143 54.230.158.177 -> 172.31.29.138 TCP 66 http > 51682 [FIN, ACK] Seq=1049034 Ack=98 Win=14592 Len=0 TSval=733702011 TSecr=18628197
170   0.034151 172.31.29.138 -> 54.230.158.177 TCP 66 51682 > http [ACK] Seq=98 Ack=1049035 Win=1487744 Len=0 TSval=18628197 TSecr=733702011
