[Measurement for 1mb at 18:37:19 19.37.2014] 
Tshark:

  1   0.000000 172.31.29.138 -> 172.31.0.2   DNS 89 Standard query 0xca7f  A d1xzxs93r3iphc.cloudfront.net
  2   0.000025 172.31.29.138 -> 172.31.0.2   DNS 89 Standard query 0xd518  AAAA d1xzxs93r3iphc.cloudfront.net
  3   0.000635   172.31.0.2 -> 172.31.29.138 DNS 170 Standard query response 0xd518 
  4   0.000645   172.31.0.2 -> 172.31.29.138 DNS 217 Standard query response 0xca7f  A 54.230.158.80 A 54.230.158.150 A 54.230.158.152 A 54.230.158.182 A 54.230.159.6 A 54.192.159.74 A 54.192.159.157 A 54.230.157.230
  5   0.003874 172.31.29.138 -> 54.230.158.80 TCP 74 48521 > http [SYN] Seq=0 Win=26883 Len=0 MSS=8961 SACK_PERM=1 TSval=1528118 TSecr=0 WS=128
  6   0.004722 54.230.158.80 -> 172.31.29.138 TCP 74 http > 48521 [SYN, ACK] Seq=0 Ack=1 Win=14480 Len=0 MSS=1460 SACK_PERM=1 TSval=806792433 TSecr=1528118 WS=128
  7   0.004736 172.31.29.138 -> 54.230.158.80 TCP 66 48521 > http [ACK] Seq=1 Ack=1 Win=27008 Len=0 TSval=1528118 TSecr=806792433
  8   0.004780 172.31.29.138 -> 54.230.158.80 HTTP 162 GET /1mb HTTP/1.1 
  9   0.005451 54.230.158.80 -> 172.31.29.138 TCP 66 http > 48521 [ACK] Seq=1 Ack=97 Win=14592 Len=0 TSval=806792433 TSecr=1528118
 10   0.010072 54.230.158.80 -> 172.31.29.138 TCP 2581 [TCP segment of a reassembled PDU]
 11   0.010079 172.31.29.138 -> 54.230.158.80 TCP 66 48521 > http [ACK] Seq=97 Ack=2516 Win=32000 Len=0 TSval=1528120 TSecr=806792433
 12   0.010093 54.230.158.80 -> 172.31.29.138 TCP 11650 [TCP segment of a reassembled PDU]
 13   0.010109 172.31.29.138 -> 54.230.158.80 TCP 66 48521 > http [ACK] Seq=97 Ack=14100 Win=55168 Len=0 TSval=1528120 TSecr=806792433
 14   0.010671 54.230.158.80 -> 172.31.29.138 TCP 13098 [TCP segment of a reassembled PDU]
 15   0.010680 172.31.29.138 -> 54.230.158.80 TCP 66 48521 > http [ACK] Seq=97 Ack=27132 Win=81152 Len=0 TSval=1528120 TSecr=806792433
 16   0.011319 54.230.158.80 -> 172.31.29.138 TCP 2962 [TCP segment of a reassembled PDU]
 17   0.011324 172.31.29.138 -> 54.230.158.80 TCP 66 48521 > http [ACK] Seq=97 Ack=30028 Win=87040 Len=0 TSval=1528120 TSecr=806792433
 18   0.011356 54.230.158.80 -> 172.31.29.138 TCP 10202 [TCP segment of a reassembled PDU]
 19   0.011363 172.31.29.138 -> 54.230.158.80 TCP 66 48521 > http [ACK] Seq=97 Ack=40164 Win=101248 Len=0 TSval=1528120 TSecr=806792433
 20   0.011817 54.230.158.80 -> 172.31.29.138 TCP 2962 [TCP segment of a reassembled PDU]
 21   0.011831 172.31.29.138 -> 54.230.158.80 TCP 66 48521 > http [ACK] Seq=97 Ack=43060 Win=109056 Len=0 TSval=1528120 TSecr=806792433
 22   0.011875 54.230.158.80 -> 172.31.29.138 TCP 10202 [TCP segment of a reassembled PDU]
 23   0.011890 172.31.29.138 -> 54.230.158.80 TCP 66 48521 > http [ACK] Seq=97 Ack=53196 Win=101248 Len=0 TSval=1528120 TSecr=806792433
 24   0.011910 54.230.158.80 -> 172.31.29.138 TCP 7306 [TCP segment of a reassembled PDU]
 25   0.011915 172.31.29.138 -> 54.230.158.80 TCP 66 48521 > http [ACK] Seq=97 Ack=60436 Win=94080 Len=0 TSval=1528120 TSecr=806792433
 26   0.012581 54.230.158.80 -> 172.31.29.138 TCP 4410 [TCP segment of a reassembled PDU]
 27   0.012586 172.31.29.138 -> 54.230.158.80 TCP 66 48521 > http [ACK] Seq=97 Ack=64780 Win=109056 Len=0 TSval=1528120 TSecr=806792433
 28   0.012661 54.230.158.80 -> 172.31.29.138 TCP 15994 [TCP segment of a reassembled PDU]
 29   0.012670 172.31.29.138 -> 54.230.158.80 TCP 66 48521 > http [ACK] Seq=97 Ack=80708 Win=93184 Len=0 TSval=1528120 TSecr=806792433
 30   0.013103 54.230.158.80 -> 172.31.29.138 TCP 4410 [TCP segment of a reassembled PDU]
 31   0.013108 172.31.29.138 -> 54.230.158.80 TCP 66 48521 > http [ACK] Seq=97 Ack=85052 Win=109056 Len=0 TSval=1528120 TSecr=806792433
 32   0.013189 54.230.158.80 -> 172.31.29.138 TCP 15994 [TCP segment of a reassembled PDU]
 33   0.013207 172.31.29.138 -> 54.230.158.80 TCP 66 48521 > http [ACK] Seq=97 Ack=100980 Win=93184 Len=0 TSval=1528120 TSecr=806792433
 34   0.013856 54.230.158.80 -> 172.31.29.138 TCP 2962 [TCP segment of a reassembled PDU]
 35   0.013870 172.31.29.138 -> 54.230.158.80 TCP 66 48521 > http [ACK] Seq=97 Ack=103876 Win=109056 Len=0 TSval=1528121 TSecr=806792434
 36   0.013968 54.230.158.80 -> 172.31.29.138 TCP 17442 [TCP segment of a reassembled PDU]
 37   0.013987 172.31.29.138 -> 54.230.158.80 TCP 66 48521 > http [ACK] Seq=97 Ack=121252 Win=143872 Len=0 TSval=1528121 TSecr=806792434
 38   0.014644 54.230.158.80 -> 172.31.29.138 TCP 4410 [TCP segment of a reassembled PDU]
 39   0.014649 172.31.29.138 -> 54.230.158.80 TCP 66 48521 > http [ACK] Seq=97 Ack=125596 Win=152448 Len=0 TSval=1528121 TSecr=806792434
 40   0.014706 54.230.158.80 -> 172.31.29.138 TCP 5299 [TCP segment of a reassembled PDU]
 41   0.014712 172.31.29.138 -> 54.230.158.80 TCP 66 48521 > http [ACK] Seq=97 Ack=130829 Win=162944 Len=0 TSval=1528121 TSecr=806792434
 42   0.014958 54.230.158.80 -> 172.31.29.138 TCP 10202 [TCP segment of a reassembled PDU]
 43   0.014966 172.31.29.138 -> 54.230.158.80 TCP 66 48521 > http [ACK] Seq=97 Ack=140965 Win=183296 Len=0 TSval=1528121 TSecr=806792434
 44   0.015398 54.230.158.80 -> 172.31.29.138 TCP 7306 [TCP segment of a reassembled PDU]
 45   0.015405 172.31.29.138 -> 54.230.158.80 TCP 66 48521 > http [ACK] Seq=97 Ack=148205 Win=197760 Len=0 TSval=1528121 TSecr=806792434
 46   0.015461 54.230.158.80 -> 172.31.29.138 TCP 2962 [TCP segment of a reassembled PDU]
 47   0.015466 172.31.29.138 -> 54.230.158.80 TCP 66 48521 > http [ACK] Seq=97 Ack=151101 Win=203520 Len=0 TSval=1528121 TSecr=806792434
 48   0.015697 54.230.158.80 -> 172.31.29.138 TCP 10202 [TCP segment of a reassembled PDU]
 49   0.015705 172.31.29.138 -> 54.230.158.80 TCP 66 48521 > http [ACK] Seq=97 Ack=161237 Win=223744 Len=0 TSval=1528121 TSecr=806792434
 50   0.016131 54.230.158.80 -> 172.31.29.138 TCP 5858 [TCP segment of a reassembled PDU]
 51   0.016150 172.31.29.138 -> 54.230.158.80 TCP 66 48521 > http [ACK] Seq=97 Ack=167029 Win=235392 Len=0 TSval=1528121 TSecr=806792434
 52   0.016287 54.230.158.80 -> 172.31.29.138 TCP 15994 [TCP segment of a reassembled PDU]
 53   0.016296 172.31.29.138 -> 54.230.158.80 TCP 66 48521 > http [ACK] Seq=97 Ack=182957 Win=267264 Len=0 TSval=1528121 TSecr=806792434
 54   0.017171 54.230.158.80 -> 172.31.29.138 TCP 8754 [TCP segment of a reassembled PDU]
 55   0.017178 172.31.29.138 -> 54.230.158.80 TCP 66 48521 > http [ACK] Seq=97 Ack=191645 Win=284544 Len=0 TSval=1528121 TSecr=806792434
 56   0.017302 54.230.158.80 -> 172.31.29.138 TCP 13098 [TCP segment of a reassembled PDU]
 57   0.017310 172.31.29.138 -> 54.230.158.80 TCP 66 48521 > http [ACK] Seq=97 Ack=204677 Win=310656 Len=0 TSval=1528122 TSecr=806792434
 58   0.017679 54.230.158.80 -> 172.31.29.138 TCP 5858 [TCP segment of a reassembled PDU]
 59   0.017685 172.31.29.138 -> 54.230.158.80 TCP 66 48521 > http [ACK] Seq=97 Ack=210469 Win=322304 Len=0 TSval=1528122 TSecr=806792434
 60   0.017784 54.230.158.80 -> 172.31.29.138 TCP 2962 [TCP segment of a reassembled PDU]
 61   0.017789 172.31.29.138 -> 54.230.158.80 TCP 66 48521 > http [ACK] Seq=97 Ack=213365 Win=328064 Len=0 TSval=1528122 TSecr=806792434
 62   0.018180 54.230.158.80 -> 172.31.29.138 TCP 4410 [TCP segment of a reassembled PDU]
 63   0.018185 172.31.29.138 -> 54.230.158.80 TCP 66 48521 > http [ACK] Seq=97 Ack=217709 Win=336768 Len=0 TSval=1528122 TSecr=806792434
 64   0.018316 54.230.158.80 -> 172.31.29.138 TCP 8754 [TCP segment of a reassembled PDU]
 65   0.018323 172.31.29.138 -> 54.230.158.80 TCP 66 48521 > http [ACK] Seq=97 Ack=226397 Win=354048 Len=0 TSval=1528122 TSecr=806792434
 66   0.018560 54.230.158.80 -> 172.31.29.138 TCP 8754 [TCP segment of a reassembled PDU]
 67   0.018567 172.31.29.138 -> 54.230.158.80 TCP 66 48521 > http [ACK] Seq=97 Ack=235085 Win=371456 Len=0 TSval=1528122 TSecr=806792434
 68   0.018957 54.230.158.80 -> 172.31.29.138 TCP 4410 [TCP segment of a reassembled PDU]
 69   0.018962 172.31.29.138 -> 54.230.158.80 TCP 66 48521 > http [ACK] Seq=97 Ack=239429 Win=380160 Len=0 TSval=1528122 TSecr=806792434
 70   0.019119 54.230.158.80 -> 172.31.29.138 TCP 17442 [TCP segment of a reassembled PDU]
 71   0.019130 172.31.29.138 -> 54.230.158.80 TCP 66 48521 > http [ACK] Seq=97 Ack=256805 Win=414976 Len=0 TSval=1528122 TSecr=806792434
 72   0.019728 54.230.158.80 -> 172.31.29.138 TCP 2962 [TCP segment of a reassembled PDU]
 73   0.019734 172.31.29.138 -> 54.230.158.80 TCP 66 48521 > http [ACK] Seq=97 Ack=259701 Win=420736 Len=0 TSval=1528122 TSecr=806792434
 74   0.019892 54.230.158.80 -> 172.31.29.138 TCP 18890 [TCP segment of a reassembled PDU]
 75   0.019903 172.31.29.138 -> 54.230.158.80 TCP 66 48521 > http [ACK] Seq=97 Ack=278525 Win=458368 Len=0 TSval=1528122 TSecr=806792434
 76   0.020527 54.230.158.80 -> 172.31.29.138 TCP 14546 [TCP segment of a reassembled PDU]
 77   0.020536 172.31.29.138 -> 54.230.158.80 TCP 66 48521 > http [ACK] Seq=97 Ack=293005 Win=487296 Len=0 TSval=1528122 TSecr=806792434
 78   0.020630 54.230.158.80 -> 172.31.29.138 TCP 7306 [TCP segment of a reassembled PDU]
 79   0.020637 172.31.29.138 -> 54.230.158.80 TCP 66 48521 > http [ACK] Seq=97 Ack=300245 Win=501760 Len=0 TSval=1528122 TSecr=806792434
 80   0.021013 54.230.158.80 -> 172.31.29.138 TCP 4410 [TCP segment of a reassembled PDU]
 81   0.021019 172.31.29.138 -> 54.230.158.80 TCP 66 48521 > http [ACK] Seq=97 Ack=304589 Win=510464 Len=0 TSval=1528122 TSecr=806792434
 82   0.021130 54.230.158.80 -> 172.31.29.138 TCP 1514 [TCP Previous segment not captured] [TCP segment of a reassembled PDU]
 83   0.021135 172.31.29.138 -> 54.230.158.80 TCP 78 [TCP Window Update] 48521 > http [ACK] Seq=97 Ack=304589 Win=513408 Len=0 TSval=1528122 TSecr=806792434 SLE=306037 SRE=307485
 84   0.021154 54.230.158.80 -> 172.31.29.138 TCP 1514 [TCP Out-Of-Order] [TCP segment of a reassembled PDU]
 85   0.021159 172.31.29.138 -> 54.230.158.80 TCP 66 48521 > http [ACK] Seq=97 Ack=307485 Win=516224 Len=0 TSval=1528122 TSecr=806792434
 86   0.021195 54.230.158.80 -> 172.31.29.138 TCP 5858 [TCP segment of a reassembled PDU]
 87   0.021201 172.31.29.138 -> 54.230.158.80 TCP 66 48521 > http [ACK] Seq=97 Ack=313277 Win=527872 Len=0 TSval=1528122 TSecr=806792434
 88   0.021236 54.230.158.80 -> 172.31.29.138 TCP 10202 [TCP segment of a reassembled PDU]
 89   0.021243 172.31.29.138 -> 54.230.158.80 TCP 66 48521 > http [ACK] Seq=97 Ack=323413 Win=548096 Len=0 TSval=1528122 TSecr=806792434
 90   0.021512 54.230.158.80 -> 172.31.29.138 TCP 4410 [TCP segment of a reassembled PDU]
 91   0.021518 172.31.29.138 -> 54.230.158.80 TCP 66 48521 > http [ACK] Seq=97 Ack=327757 Win=556800 Len=0 TSval=1528123 TSecr=806792434
 92   0.021790 54.230.158.80 -> 172.31.29.138 TCP 10202 [TCP segment of a reassembled PDU]
 93   0.021797 172.31.29.138 -> 54.230.158.80 TCP 66 48521 > http [ACK] Seq=97 Ack=337893 Win=577152 Len=0 TSval=1528123 TSecr=806792434
 94   0.021898 54.230.158.80 -> 172.31.29.138 TCP 7306 [TCP segment of a reassembled PDU]
 95   0.021904 172.31.29.138 -> 54.230.158.80 TCP 66 48521 > http [ACK] Seq=97 Ack=345133 Win=591616 Len=0 TSval=1528123 TSecr=806792434
 96   0.022290 54.230.158.80 -> 172.31.29.138 TCP 8754 [TCP segment of a reassembled PDU]
 97   0.022297 172.31.29.138 -> 54.230.158.80 TCP 66 48521 > http [ACK] Seq=97 Ack=353821 Win=608896 Len=0 TSval=1528123 TSecr=806792434
 98   0.022441 54.230.158.80 -> 172.31.29.138 TCP 13098 [TCP segment of a reassembled PDU]
 99   0.022450 172.31.29.138 -> 54.230.158.80 TCP 66 48521 > http [ACK] Seq=97 Ack=366853 Win=635008 Len=0 TSval=1528123 TSecr=806792434
100   0.022826 54.230.158.80 -> 172.31.29.138 TCP 4410 [TCP segment of a reassembled PDU]
101   0.022833 172.31.29.138 -> 54.230.158.80 TCP 66 48521 > http [ACK] Seq=97 Ack=371197 Win=643712 Len=0 TSval=1528123 TSecr=806792434
102   0.022930 54.230.158.80 -> 172.31.29.138 TCP 4410 [TCP segment of a reassembled PDU]
103   0.022935 172.31.29.138 -> 54.230.158.80 TCP 66 48521 > http [ACK] Seq=97 Ack=375541 Win=652416 Len=0 TSval=1528123 TSecr=806792434
104   0.023094 54.230.158.80 -> 172.31.29.138 TCP 13098 [TCP segment of a reassembled PDU]
105   0.023103 172.31.29.138 -> 54.230.158.80 TCP 66 48521 > http [ACK] Seq=97 Ack=388573 Win=672384 Len=0 TSval=1528123 TSecr=806792434
106   0.023318 54.230.158.80 -> 172.31.29.138 TCP 2962 [TCP segment of a reassembled PDU]
107   0.023323 172.31.29.138 -> 54.230.158.80 TCP 66 48521 > http [ACK] Seq=97 Ack=391469 Win=684288 Len=0 TSval=1528123 TSecr=806792434
108   0.023449 54.230.158.80 -> 172.31.29.138 TCP 5858 [TCP segment of a reassembled PDU]
109   0.023455 172.31.29.138 -> 54.230.158.80 TCP 66 48521 > http [ACK] Seq=97 Ack=397261 Win=684288 Len=0 TSval=1528123 TSecr=806792434
110   0.023582 54.230.158.80 -> 172.31.29.138 TCP 13098 [TCP segment of a reassembled PDU]
111   0.023591 172.31.29.138 -> 54.230.158.80 TCP 66 48521 > http [ACK] Seq=97 Ack=410293 Win=672384 Len=0 TSval=1528123 TSecr=806792434
112   0.023816 54.230.158.80 -> 172.31.29.138 TCP 4410 [TCP segment of a reassembled PDU]
113   0.023822 172.31.29.138 -> 54.230.158.80 TCP 66 48521 > http [ACK] Seq=97 Ack=414637 Win=686592 Len=0 TSval=1528123 TSecr=806792435
114   0.023929 54.230.158.80 -> 172.31.29.138 TCP 4410 [TCP segment of a reassembled PDU]
115   0.023934 172.31.29.138 -> 54.230.158.80 TCP 66 48521 > http [ACK] Seq=97 Ack=418981 Win=686592 Len=0 TSval=1528123 TSecr=806792435
116   0.024045 54.230.158.80 -> 172.31.29.138 TCP 1514 [TCP segment of a reassembled PDU]
117   0.024049 172.31.29.138 -> 54.230.158.80 TCP 66 48521 > http [ACK] Seq=97 Ack=420429 Win=691328 Len=0 TSval=1528123 TSecr=806792435
118   0.024199 54.230.158.80 -> 172.31.29.138 TCP 11650 [TCP segment of a reassembled PDU]
119   0.024206 172.31.29.138 -> 54.230.158.80 TCP 66 48521 > http [ACK] Seq=97 Ack=432013 Win=679808 Len=0 TSval=1528123 TSecr=806792435
120   0.024432 54.230.158.80 -> 172.31.29.138 TCP 10202 [TCP segment of a reassembled PDU]
121   0.024440 172.31.29.138 -> 54.230.158.80 TCP 66 48521 > http [ACK] Seq=97 Ack=442149 Win=677120 Len=0 TSval=1528123 TSecr=806792435
122   0.024677 54.230.158.80 -> 172.31.29.138 TCP 13098 [TCP segment of a reassembled PDU]
123   0.024686 172.31.29.138 -> 54.230.158.80 TCP 66 48521 > http [ACK] Seq=97 Ack=455181 Win=672384 Len=0 TSval=1528123 TSecr=806792435
124   0.025104 54.230.158.80 -> 172.31.29.138 TCP 3394 [TCP segment of a reassembled PDU]
125   0.025109 172.31.29.138 -> 54.230.158.80 TCP 66 48521 > http [ACK] Seq=97 Ack=458509 Win=686592 Len=0 TSval=1528123 TSecr=806792435
126   0.025342 54.230.158.80 -> 172.31.29.138 TCP 2962 [TCP segment of a reassembled PDU]
127   0.025360 172.31.29.138 -> 54.230.158.80 TCP 66 48521 > http [ACK] Seq=97 Ack=461405 Win=689024 Len=0 TSval=1528124 TSecr=806792435
128   0.025498 54.230.158.80 -> 172.31.29.138 TCP 15994 [TCP segment of a reassembled PDU]
129   0.025507 172.31.29.138 -> 54.230.158.80 TCP 66 48521 > http [ACK] Seq=97 Ack=477333 Win=673152 Len=0 TSval=1528124 TSecr=806792435
130   0.025848 54.230.158.80 -> 172.31.29.138 TCP 1514 [TCP segment of a reassembled PDU]
131   0.025853 172.31.29.138 -> 54.230.158.80 TCP 66 48521 > http [ACK] Seq=97 Ack=478781 Win=691328 Len=0 TSval=1528124 TSecr=806792435
132   0.025973 54.230.158.80 -> 172.31.29.138 TCP 2962 [TCP segment of a reassembled PDU]
133   0.025978 172.31.29.138 -> 54.230.158.80 TCP 66 48521 > http [ACK] Seq=97 Ack=481677 Win=689024 Len=0 TSval=1528124 TSecr=806792435
134   0.026233 54.230.158.80 -> 172.31.29.138 TCP 18890 [TCP segment of a reassembled PDU]
135   0.026244 172.31.29.138 -> 54.230.158.80 TCP 66 48521 > http [ACK] Seq=97 Ack=500501 Win=670208 Len=0 TSval=1528124 TSecr=806792435
136   0.026896 54.230.158.80 -> 172.31.29.138 TCP 4410 [TCP segment of a reassembled PDU]
137   0.026903 172.31.29.138 -> 54.230.158.80 TCP 66 48521 > http [ACK] Seq=97 Ack=504845 Win=686592 Len=0 TSval=1528124 TSecr=806792435
138   0.027065 54.230.158.80 -> 172.31.29.138 TCP 18890 [TCP segment of a reassembled PDU]
139   0.027075 172.31.29.138 -> 54.230.158.80 TCP 66 48521 > http [ACK] Seq=97 Ack=523669 Win=667776 Len=0 TSval=1528124 TSecr=806792435
140   0.027392 54.230.158.80 -> 172.31.29.138 TCP 442 [TCP segment of a reassembled PDU]
141   0.027396 172.31.29.138 -> 54.230.158.80 TCP 66 48521 > http [ACK] Seq=97 Ack=524045 Win=691328 Len=0 TSval=1528124 TSecr=806792435
142   0.027909 54.230.158.80 -> 172.31.29.138 TCP 1514 [TCP segment of a reassembled PDU]
143   0.028060 54.230.158.80 -> 172.31.29.138 TCP 20338 [TCP segment of a reassembled PDU]
144   0.028082 172.31.29.138 -> 54.230.158.80 TCP 66 48521 > http [ACK] Seq=97 Ack=545765 Win=669696 Len=0 TSval=1528124 TSecr=806792435
145   0.028741 54.230.158.80 -> 172.31.29.138 TCP 8754 [TCP segment of a reassembled PDU]
146   0.028749 172.31.29.138 -> 54.230.158.80 TCP 66 48521 > http [ACK] Seq=97 Ack=554453 Win=679552 Len=0 TSval=1528124 TSecr=806792435
147   0.028842 54.230.158.80 -> 172.31.29.138 TCP 14546 [TCP segment of a reassembled PDU]
148   0.028863 172.31.29.138 -> 54.230.158.80 TCP 66 48521 > http [ACK] Seq=97 Ack=568933 Win=691840 Len=0 TSval=1528124 TSecr=806792435
149   0.029208 54.230.158.80 -> 172.31.29.138 TCP 4410 [TCP segment of a reassembled PDU]
150   0.029224 172.31.29.138 -> 54.230.158.80 TCP 66 48521 > http [ACK] Seq=97 Ack=573277 Win=691840 Len=0 TSval=1528124 TSecr=806792435
151   0.029311 54.230.158.80 -> 172.31.29.138 TCP 4410 [TCP segment of a reassembled PDU]
152   0.029327 172.31.29.138 -> 54.230.158.80 TCP 66 48521 > http [ACK] Seq=97 Ack=577621 Win=691840 Len=0 TSval=1528125 TSecr=806792435
153   0.029710 54.230.158.80 -> 172.31.29.138 TCP 4410 [TCP segment of a reassembled PDU]
154   0.029726 172.31.29.138 -> 54.230.158.80 TCP 66 48521 > http [ACK] Seq=97 Ack=581965 Win=691840 Len=0 TSval=1528125 TSecr=806792435
155   0.029831 54.230.158.80 -> 172.31.29.138 TCP 7682 [TCP segment of a reassembled PDU]
156   0.029850 172.31.29.138 -> 54.230.158.80 TCP 66 48521 > http [ACK] Seq=97 Ack=589581 Win=691840 Len=0 TSval=1528125 TSecr=806792435
157   0.030490 54.230.158.80 -> 172.31.29.138 TCP 2962 [TCP segment of a reassembled PDU]
158   0.030508 172.31.29.138 -> 54.230.158.80 TCP 66 48521 > http [ACK] Seq=97 Ack=592477 Win=691840 Len=0 TSval=1528125 TSecr=806792435
159   0.030520 54.230.158.80 -> 172.31.29.138 TCP 5858 [TCP segment of a reassembled PDU]
160   0.030535 172.31.29.138 -> 54.230.158.80 TCP 66 48521 > http [ACK] Seq=97 Ack=598269 Win=691840 Len=0 TSval=1528125 TSecr=806792435
161   0.030645 54.230.158.80 -> 172.31.29.138 TCP 15994 [TCP segment of a reassembled PDU]
162   0.030837 172.31.29.138 -> 54.230.158.80 TCP 66 48521 > http [ACK] Seq=97 Ack=614197 Win=691840 Len=0 TSval=1528125 TSecr=806792435
163   0.031091 54.230.158.80 -> 172.31.29.138 TCP 8754 [TCP segment of a reassembled PDU]
164   0.031109 172.31.29.138 -> 54.230.158.80 TCP 66 48521 > http [ACK] Seq=97 Ack=622885 Win=691840 Len=0 TSval=1528125 TSecr=806792435
165   0.031492 54.230.158.80 -> 172.31.29.138 TCP 5858 [TCP segment of a reassembled PDU]
166   0.031507 172.31.29.138 -> 54.230.158.80 TCP 66 48521 > http [ACK] Seq=97 Ack=628677 Win=691840 Len=0 TSval=1528125 TSecr=806792435
167   0.031654 54.230.158.80 -> 172.31.29.138 TCP 18890 [TCP segment of a reassembled PDU]
168   0.031676 172.31.29.138 -> 54.230.158.80 TCP 66 48521 > http [ACK] Seq=97 Ack=647501 Win=673024 Len=0 TSval=1528125 TSecr=806792435
169   0.032528 54.230.158.80 -> 172.31.29.138 TCP 4410 [TCP segment of a reassembled PDU]
170   0.032534 172.31.29.138 -> 54.230.158.80 TCP 66 48521 > http [ACK] Seq=97 Ack=651845 Win=686592 Len=0 TSval=1528125 TSecr=806792435
171   0.032642 54.230.158.80 -> 172.31.29.138 TCP 3338 [TCP segment of a reassembled PDU]
172   0.032648 172.31.29.138 -> 54.230.158.80 TCP 66 48521 > http [ACK] Seq=97 Ack=655117 Win=686592 Len=0 TSval=1528125 TSecr=806792435
173   0.032903 54.230.158.80 -> 172.31.29.138 TCP 2962 [TCP segment of a reassembled PDU]
174   0.032908 172.31.29.138 -> 54.230.158.80 TCP 66 48521 > http [ACK] Seq=97 Ack=658013 Win=689024 Len=0 TSval=1528125 TSecr=806792435
175   0.032961 54.230.158.80 -> 172.31.29.138 TCP 13098 [TCP segment of a reassembled PDU]
176   0.032980 172.31.29.138 -> 54.230.158.80 TCP 66 48521 > http [ACK] Seq=97 Ack=671045 Win=691840 Len=0 TSval=1528125 TSecr=806792435
177   0.033284 54.230.158.80 -> 172.31.29.138 TCP 1514 [TCP segment of a reassembled PDU]
178   0.033425 54.230.158.80 -> 172.31.29.138 TCP 7306 [TCP segment of a reassembled PDU]
179   0.033442 172.31.29.138 -> 54.230.158.80 TCP 66 48521 > http [ACK] Seq=97 Ack=679733 Win=691840 Len=0 TSval=1528126 TSecr=806792435
180   0.033551 54.230.158.80 -> 172.31.29.138 TCP 1514 [TCP segment of a reassembled PDU]
181   0.033697 54.230.158.80 -> 172.31.29.138 TCP 13098 [TCP segment of a reassembled PDU]
182   0.033717 172.31.29.138 -> 54.230.158.80 TCP 66 48521 > http [ACK] Seq=97 Ack=694213 Win=691840 Len=0 TSval=1528126 TSecr=806792435
183   0.033791 54.230.158.80 -> 172.31.29.138 TCP 1514 [TCP segment of a reassembled PDU]
184   0.034092 54.230.158.80 -> 172.31.29.138 TCP 8754 [TCP segment of a reassembled PDU]
185   0.034110 172.31.29.138 -> 54.230.158.80 TCP 66 48521 > http [ACK] Seq=97 Ack=704349 Win=691840 Len=0 TSval=1528126 TSecr=806792435
186   0.034357 54.230.158.80 -> 172.31.29.138 TCP 10202 [TCP segment of a reassembled PDU]
187   0.034376 172.31.29.138 -> 54.230.158.80 TCP 66 48521 > http [ACK] Seq=97 Ack=714485 Win=691840 Len=0 TSval=1528126 TSecr=806792436
188   0.034449 54.230.158.80 -> 172.31.29.138 TCP 4410 [TCP segment of a reassembled PDU]
189   0.034465 172.31.29.138 -> 54.230.158.80 TCP 66 48521 > http [ACK] Seq=97 Ack=718829 Win=691840 Len=0 TSval=1528126 TSecr=806792436
190   0.034626 54.230.158.80 -> 172.31.29.138 TCP 1890 [TCP segment of a reassembled PDU]
191   0.034642 172.31.29.138 -> 54.230.158.80 TCP 66 48521 > http [ACK] Seq=97 Ack=720653 Win=691840 Len=0 TSval=1528126 TSecr=806792436
192   0.035094 54.230.158.80 -> 172.31.29.138 TCP 7306 [TCP segment of a reassembled PDU]
193   0.035178 54.230.158.80 -> 172.31.29.138 TCP 10202 [TCP segment of a reassembled PDU]
194   0.035307 172.31.29.138 -> 54.230.158.80 TCP 66 48521 > http [ACK] Seq=97 Ack=738029 Win=677120 Len=0 TSval=1528126 TSecr=806792436
195   0.035340 54.230.158.80 -> 172.31.29.138 TCP 7306 [TCP segment of a reassembled PDU]
196   0.035347 172.31.29.138 -> 54.230.158.80 TCP 66 48521 > http [ACK] Seq=97 Ack=745269 Win=681856 Len=0 TSval=1528126 TSecr=806792436
197   0.035420 54.230.158.80 -> 172.31.29.138 TCP 1514 [TCP segment of a reassembled PDU]
198   0.035851 54.230.158.80 -> 172.31.29.138 TCP 4410 [TCP segment of a reassembled PDU]
199   0.035856 172.31.29.138 -> 54.230.158.80 TCP 66 48521 > http [ACK] Seq=97 Ack=751061 Win=686592 Len=0 TSval=1528126 TSecr=806792436
200   0.035948 54.230.158.80 -> 172.31.29.138 TCP 13098 [TCP segment of a reassembled PDU]
201   0.035967 172.31.29.138 -> 54.230.158.80 TCP 66 48521 > http [ACK] Seq=97 Ack=764093 Win=691840 Len=0 TSval=1528126 TSecr=806792436
202   0.036368 54.230.158.80 -> 172.31.29.138 TCP 7306 [TCP segment of a reassembled PDU]
203   0.036398 172.31.29.138 -> 54.230.158.80 TCP 66 48521 > http [ACK] Seq=97 Ack=771333 Win=691840 Len=0 TSval=1528126 TSecr=806792436
204   0.036522 54.230.158.80 -> 172.31.29.138 TCP 14922 [TCP segment of a reassembled PDU]
205   0.036544 172.31.29.138 -> 54.230.158.80 TCP 66 48521 > http [ACK] Seq=97 Ack=786189 Win=691840 Len=0 TSval=1528126 TSecr=806792436
206   0.037369 54.230.158.80 -> 172.31.29.138 TCP 2962 [TCP segment of a reassembled PDU]
207   0.037385 172.31.29.138 -> 54.230.158.80 TCP 66 48521 > http [ACK] Seq=97 Ack=789085 Win=691840 Len=0 TSval=1528127 TSecr=806792436
208   0.037437 54.230.158.80 -> 172.31.29.138 TCP 17442 [TCP segment of a reassembled PDU]
209   0.037460 172.31.29.138 -> 54.230.158.80 TCP 66 48521 > http [ACK] Seq=97 Ack=806461 Win=674560 Len=0 TSval=1528127 TSecr=806792436
210   0.037476 54.230.158.80 -> 172.31.29.138 TCP 5858 [TCP segment of a reassembled PDU]
211   0.037488 172.31.29.138 -> 54.230.158.80 TCP 66 48521 > http [ACK] Seq=97 Ack=812253 Win=691840 Len=0 TSval=1528127 TSecr=806792436
212   0.037950 54.230.158.80 -> 172.31.29.138 TCP 5858 [TCP segment of a reassembled PDU]
213   0.037967 172.31.29.138 -> 54.230.158.80 TCP 66 48521 > http [ACK] Seq=97 Ack=818045 Win=691840 Len=0 TSval=1528127 TSecr=806792436
214   0.038076 54.230.158.80 -> 172.31.29.138 TCP 14546 [TCP segment of a reassembled PDU]
215   0.038097 172.31.29.138 -> 54.230.158.80 TCP 66 48521 > http [ACK] Seq=97 Ack=832525 Win=691840 Len=0 TSval=1528127 TSecr=806792436
216   0.038675 54.230.158.80 -> 172.31.29.138 TCP 5858 [TCP segment of a reassembled PDU]
217   0.038692 172.31.29.138 -> 54.230.158.80 TCP 66 48521 > http [ACK] Seq=97 Ack=838317 Win=691840 Len=0 TSval=1528127 TSecr=806792436
218   0.038802 54.230.158.80 -> 172.31.29.138 TCP 13474 [TCP segment of a reassembled PDU]
219   0.039037 172.31.29.138 -> 54.230.158.80 TCP 66 48521 > http [ACK] Seq=97 Ack=851725 Win=691840 Len=0 TSval=1528127 TSecr=806792436
220   0.039703 54.230.158.80 -> 172.31.29.138 TCP 2962 [TCP segment of a reassembled PDU]
221   0.039719 172.31.29.138 -> 54.230.158.80 TCP 66 48521 > http [ACK] Seq=97 Ack=854621 Win=691840 Len=0 TSval=1528127 TSecr=806792436
222   0.039729 54.230.158.80 -> 172.31.29.138 TCP 4410 [TCP segment of a reassembled PDU]
223   0.039743 172.31.29.138 -> 54.230.158.80 TCP 66 48521 > http [ACK] Seq=97 Ack=858965 Win=691840 Len=0 TSval=1528127 TSecr=806792436
224   0.039858 54.230.158.80 -> 172.31.29.138 TCP 18890 [TCP segment of a reassembled PDU]
225   0.039880 172.31.29.138 -> 54.230.158.80 TCP 66 48521 > http [ACK] Seq=97 Ack=877789 Win=673024 Len=0 TSval=1528127 TSecr=806792436
226   0.040492 54.230.158.80 -> 172.31.29.138 TCP 2962 [TCP segment of a reassembled PDU]
227   0.040499 172.31.29.138 -> 54.230.158.80 TCP 66 48521 > http [ACK] Seq=97 Ack=880685 Win=689024 Len=0 TSval=1528127 TSecr=806792436
228   0.040665 54.230.158.80 -> 172.31.29.138 TCP 23234 [TCP segment of a reassembled PDU]
229   0.040690 172.31.29.138 -> 54.230.158.80 TCP 66 48521 > http [ACK] Seq=97 Ack=903853 Win=665856 Len=0 TSval=1528127 TSecr=806792436
230   0.041220 54.230.158.80 -> 172.31.29.138 TCP 4410 [TCP segment of a reassembled PDU]
231   0.041226 172.31.29.138 -> 54.230.158.80 TCP 66 48521 > http [ACK] Seq=97 Ack=908197 Win=686592 Len=0 TSval=1528127 TSecr=806792436
232   0.041495 54.230.158.80 -> 172.31.29.138 TCP 7306 [TCP segment of a reassembled PDU]
233   0.041513 172.31.29.138 -> 54.230.158.80 TCP 66 48521 > http [ACK] Seq=97 Ack=915437 Win=691840 Len=0 TSval=1528128 TSecr=806792436
234   0.041581 54.230.158.80 -> 172.31.29.138 TCP 1890 [TCP segment of a reassembled PDU]
235   0.041598 172.31.29.138 -> 54.230.158.80 TCP 66 48521 > http [ACK] Seq=97 Ack=917261 Win=691840 Len=0 TSval=1528128 TSecr=806792436
236   0.041994 54.230.158.80 -> 172.31.29.138 TCP 2962 [TCP segment of a reassembled PDU]
237   0.042010 172.31.29.138 -> 54.230.158.80 TCP 66 48521 > http [ACK] Seq=97 Ack=920157 Win=691840 Len=0 TSval=1528128 TSecr=806792436
238   0.042274 54.230.158.80 -> 172.31.29.138 TCP 13098 [TCP segment of a reassembled PDU]
239   0.042296 172.31.29.138 -> 54.230.158.80 TCP 66 48521 > http [ACK] Seq=97 Ack=933189 Win=691840 Len=0 TSval=1528128 TSecr=806792436
240   0.042404 54.230.158.80 -> 172.31.29.138 TCP 10202 [TCP segment of a reassembled PDU]
241   0.042423 172.31.29.138 -> 54.230.158.80 TCP 66 48521 > http [ACK] Seq=97 Ack=943325 Win=691840 Len=0 TSval=1528128 TSecr=806792436
242   0.042760 54.230.158.80 -> 172.31.29.138 TCP 4410 [TCP segment of a reassembled PDU]
243   0.042776 172.31.29.138 -> 54.230.158.80 TCP 66 48521 > http [ACK] Seq=97 Ack=947669 Win=691840 Len=0 TSval=1528128 TSecr=806792436
244   0.042916 54.230.158.80 -> 172.31.29.138 TCP 11650 [TCP segment of a reassembled PDU]
245   0.042937 172.31.29.138 -> 54.230.158.80 TCP 66 48521 > http [ACK] Seq=97 Ack=959253 Win=691840 Len=0 TSval=1528128 TSecr=806792436
246   0.043119 54.230.158.80 -> 172.31.29.138 TCP 11650 [TCP segment of a reassembled PDU]
