[Measurement for 1mb at 07:37:20 20.37.2014] 
Tshark:

  1   0.000000 172.31.29.138 -> 172.31.0.2   DNS 89 Standard query 0xc9cf  A d1xzxs93r3iphc.cloudfront.net
  2   0.000023 172.31.29.138 -> 172.31.0.2   DNS 89 Standard query 0x5591  AAAA d1xzxs93r3iphc.cloudfront.net
  3   0.000573   172.31.0.2 -> 172.31.29.138 DNS 217 Standard query response 0xc9cf  A 54.230.159.141 A 54.192.157.136 A 54.192.159.106 A 54.192.159.171 A 54.230.156.193 A 54.230.158.190 A 54.230.158.207 A 54.230.158.225
  4   0.000583   172.31.0.2 -> 172.31.29.138 DNS 170 Standard query response 0x5591 
  5   0.003885 172.31.29.138 -> 54.230.159.141 TCP 74 59886 > http [SYN] Seq=0 Win=26883 Len=0 MSS=8961 SACK_PERM=1 TSval=13228302 TSecr=0 WS=128
  6   0.004765 54.230.159.141 -> 172.31.29.138 TCP 74 http > 59886 [SYN, ACK] Seq=0 Ack=1 Win=14480 Len=0 MSS=1460 SACK_PERM=1 TSval=842948343 TSecr=13228302 WS=128
  7   0.004778 172.31.29.138 -> 54.230.159.141 TCP 66 59886 > http [ACK] Seq=1 Ack=1 Win=27008 Len=0 TSval=13228302 TSecr=842948343
  8   0.004825 172.31.29.138 -> 54.230.159.141 HTTP 162 GET /1mb HTTP/1.1 
  9   0.005712 54.230.159.141 -> 172.31.29.138 TCP 66 http > 59886 [ACK] Seq=1 Ack=97 Win=14592 Len=0 TSval=842948343 TSecr=13228302
 10   0.010401 54.230.159.141 -> 172.31.29.138 TCP 11650 [TCP segment of a reassembled PDU]
 11   0.010412 172.31.29.138 -> 54.230.159.141 TCP 66 59886 > http [ACK] Seq=97 Ack=11585 Win=50176 Len=0 TSval=13228304 TSecr=842948344
 12   0.010418 54.230.159.141 -> 172.31.29.138 TCP 1514 [TCP segment of a reassembled PDU]
 13   0.010421 172.31.29.138 -> 54.230.159.141 TCP 66 59886 > http [ACK] Seq=97 Ack=13033 Win=52992 Len=0 TSval=13228304 TSecr=842948344
 14   0.011156 54.230.159.141 -> 172.31.29.138 TCP 8754 [TCP segment of a reassembled PDU]
 15   0.011164 172.31.29.138 -> 54.230.159.141 TCP 66 59886 > http [ACK] Seq=97 Ack=21721 Win=70400 Len=0 TSval=13228304 TSecr=842948344
 16   0.011172 54.230.159.141 -> 172.31.29.138 TCP 4410 [TCP segment of a reassembled PDU]
 17   0.011175 172.31.29.138 -> 54.230.159.141 TCP 66 59886 > http [ACK] Seq=97 Ack=26065 Win=79104 Len=0 TSval=13228304 TSecr=842948344
 18   0.011909 54.230.159.141 -> 172.31.29.138 TCP 8754 [TCP segment of a reassembled PDU]
 19   0.011916 172.31.29.138 -> 54.230.159.141 TCP 66 59886 > http [ACK] Seq=97 Ack=34753 Win=96512 Len=0 TSval=13228304 TSecr=842948344
 20   0.011979 54.230.159.141 -> 172.31.29.138 TCP 11650 [TCP segment of a reassembled PDU]
 21   0.011987 172.31.29.138 -> 54.230.159.141 TCP 66 59886 > http [ACK] Seq=97 Ack=46337 Win=98944 Len=0 TSval=13228304 TSecr=842948344
 22   0.012421 54.230.159.141 -> 172.31.29.138 TCP 5858 [TCP segment of a reassembled PDU]
 23   0.012427 172.31.29.138 -> 54.230.159.141 TCP 66 59886 > http [ACK] Seq=97 Ack=52129 Win=108416 Len=0 TSval=13228304 TSecr=842948344
 24   0.012644 54.230.159.141 -> 172.31.29.138 TCP 7306 [TCP segment of a reassembled PDU]
 25   0.012651 172.31.29.138 -> 54.230.159.141 TCP 66 59886 > http [ACK] Seq=97 Ack=59369 Win=105984 Len=0 TSval=13228304 TSecr=842948344
 26   0.012679 54.230.159.141 -> 172.31.29.138 TCP 5858 [TCP segment of a reassembled PDU]
 27   0.012685 172.31.29.138 -> 54.230.159.141 TCP 66 59886 > http [ACK] Seq=97 Ack=65161 Win=108416 Len=0 TSval=13228304 TSecr=842948344
 28   0.012900 54.230.159.141 -> 172.31.29.138 TCP 5858 [TCP segment of a reassembled PDU]
 29   0.012906 172.31.29.138 -> 54.230.159.141 TCP 66 59886 > http [ACK] Seq=97 Ack=70953 Win=108416 Len=0 TSval=13228304 TSecr=842948344
 30   0.012972 54.230.159.141 -> 172.31.29.138 TCP 5858 [TCP segment of a reassembled PDU]
 31   0.012979 172.31.29.138 -> 54.230.159.141 TCP 66 59886 > http [ACK] Seq=97 Ack=76745 Win=108416 Len=0 TSval=13228304 TSecr=842948344
 32   0.013185 54.230.159.141 -> 172.31.29.138 TCP 8754 [TCP segment of a reassembled PDU]
 33   0.013193 172.31.29.138 -> 54.230.159.141 TCP 66 59886 > http [ACK] Seq=97 Ack=85433 Win=103680 Len=0 TSval=13228304 TSecr=842948344
 34   0.013425 54.230.159.141 -> 172.31.29.138 TCP 2962 [TCP segment of a reassembled PDU]
 35   0.013430 172.31.29.138 -> 54.230.159.141 TCP 66 59886 > http [ACK] Seq=97 Ack=88329 Win=109056 Len=0 TSval=13228304 TSecr=842948344
 36   0.013545 54.230.159.141 -> 172.31.29.138 TCP 15994 [TCP segment of a reassembled PDU]
 37   0.013555 172.31.29.138 -> 54.230.159.141 TCP 66 59886 > http [ACK] Seq=97 Ack=104257 Win=93184 Len=0 TSval=13228305 TSecr=842948344
 38   0.013691 54.230.159.141 -> 172.31.29.138 TCP 8754 [TCP segment of a reassembled PDU]
 39   0.013698 172.31.29.138 -> 54.230.159.141 TCP 66 59886 > http [ACK] Seq=97 Ack=112945 Win=126464 Len=0 TSval=13228305 TSecr=842948344
 40   0.013764 54.230.159.141 -> 172.31.29.138 TCP 4410 [TCP segment of a reassembled PDU]
 41   0.013770 172.31.29.138 -> 54.230.159.141 TCP 66 59886 > http [ACK] Seq=97 Ack=117289 Win=135168 Len=0 TSval=13228305 TSecr=842948344
 42   0.014192 54.230.159.141 -> 172.31.29.138 TCP 8754 [TCP segment of a reassembled PDU]
 43   0.014213 172.31.29.138 -> 54.230.159.141 TCP 66 59886 > http [ACK] Seq=97 Ack=125977 Win=152448 Len=0 TSval=13228305 TSecr=842948344
 44   0.014275 54.230.159.141 -> 172.31.29.138 TCP 4919 [TCP segment of a reassembled PDU]
 45   0.014284 172.31.29.138 -> 54.230.159.141 TCP 66 59886 > http [ACK] Seq=97 Ack=130830 Win=162176 Len=0 TSval=13228305 TSecr=842948344
 46   0.014683 54.230.159.141 -> 172.31.29.138 TCP 2962 [TCP segment of a reassembled PDU]
 47   0.014689 172.31.29.138 -> 54.230.159.141 TCP 66 59886 > http [ACK] Seq=97 Ack=133726 Win=168064 Len=0 TSval=13228305 TSecr=842948344
 48   0.014790 54.230.159.141 -> 172.31.29.138 TCP 18890 [TCP segment of a reassembled PDU]
 49   0.014801 172.31.29.138 -> 54.230.159.141 TCP 66 59886 > http [ACK] Seq=97 Ack=152550 Win=205696 Len=0 TSval=13228305 TSecr=842948344
 50   0.015052 54.230.159.141 -> 172.31.29.138 TCP 17442 [TCP segment of a reassembled PDU]
 51   0.015062 172.31.29.138 -> 54.230.159.141 TCP 66 59886 > http [ACK] Seq=97 Ack=169926 Win=240384 Len=0 TSval=13228305 TSecr=842948344
 52   0.015458 54.230.159.141 -> 172.31.29.138 TCP 5858 [TCP segment of a reassembled PDU]
 53   0.015465 172.31.29.138 -> 54.230.159.141 TCP 66 59886 > http [ACK] Seq=97 Ack=175718 Win=252032 Len=0 TSval=13228305 TSecr=842948344
 54   0.015609 54.230.159.141 -> 172.31.29.138 TCP 18890 [TCP segment of a reassembled PDU]
 55   0.015620 172.31.29.138 -> 54.230.159.141 TCP 66 59886 > http [ACK] Seq=97 Ack=194542 Win=289664 Len=0 TSval=13228305 TSecr=842948344
 56   0.015787 54.230.159.141 -> 172.31.29.138 TCP 1890 [TCP segment of a reassembled PDU]
 57   0.015792 172.31.29.138 -> 54.230.159.141 TCP 66 59886 > http [ACK] Seq=97 Ack=196366 Win=293248 Len=0 TSval=13228305 TSecr=842948344
 58   0.017519 54.230.159.141 -> 172.31.29.138 TCP 7306 [TCP segment of a reassembled PDU]
 59   0.017526 172.31.29.138 -> 54.230.159.141 TCP 66 59886 > http [ACK] Seq=97 Ack=203606 Win=307712 Len=0 TSval=13228306 TSecr=842948344
 60   0.017611 54.230.159.141 -> 172.31.29.138 TCP 11722 [TCP segment of a reassembled PDU]
 61   0.017618 172.31.29.138 -> 54.230.159.141 TCP 66 59886 > http [ACK] Seq=97 Ack=215262 Win=331136 Len=0 TSval=13228306 TSecr=842948344
 62   0.017708 54.230.159.141 -> 172.31.29.138 TCP 20266 [TCP segment of a reassembled PDU]
 63   0.017718 172.31.29.138 -> 54.230.159.141 TCP 66 59886 > http [ACK] Seq=97 Ack=235462 Win=371456 Len=0 TSval=13228306 TSecr=842948344
 64   0.017723 54.230.159.141 -> 172.31.29.138 TCP 1514 [TCP segment of a reassembled PDU]
 65   0.017725 172.31.29.138 -> 54.230.159.141 TCP 66 59886 > http [ACK] Seq=97 Ack=236910 Win=374400 Len=0 TSval=13228306 TSecr=842948344
 66   0.018272 54.230.159.141 -> 172.31.29.138 TCP 1514 [TCP segment of a reassembled PDU]
 67   0.018276 172.31.29.138 -> 54.230.159.141 TCP 66 59886 > http [ACK] Seq=97 Ack=238358 Win=377216 Len=0 TSval=13228306 TSecr=842948344
 68   0.018437 54.230.159.141 -> 172.31.29.138 TCP 23610 [TCP segment of a reassembled PDU]
 69   0.018447 172.31.29.138 -> 54.230.159.141 TCP 66 59886 > http [ACK] Seq=97 Ack=261902 Win=424320 Len=0 TSval=13228306 TSecr=842948344
 70   0.019289 54.230.159.141 -> 172.31.29.138 TCP 2962 [TCP segment of a reassembled PDU]
 71   0.019295 172.31.29.138 -> 54.230.159.141 TCP 66 59886 > http [ACK] Seq=97 Ack=264798 Win=430208 Len=0 TSval=13228306 TSecr=842948344
 72   0.019405 54.230.159.141 -> 172.31.29.138 TCP 24682 [TCP segment of a reassembled PDU]
 73   0.019418 172.31.29.138 -> 54.230.159.141 TCP 66 59886 > http [ACK] Seq=97 Ack=289414 Win=479360 Len=0 TSval=13228306 TSecr=842948344
 74   0.019430 54.230.159.141 -> 172.31.29.138 TCP 14546 [TCP segment of a reassembled PDU]
 75   0.019436 172.31.29.138 -> 54.230.159.141 TCP 66 59886 > http [ACK] Seq=97 Ack=303894 Win=508288 Len=0 TSval=13228306 TSecr=842948344
 76   0.020081 54.230.159.141 -> 172.31.29.138 TCP 2962 [TCP segment of a reassembled PDU]
 77   0.020087 172.31.29.138 -> 54.230.159.141 TCP 66 59886 > http [ACK] Seq=97 Ack=306790 Win=514176 Len=0 TSval=13228306 TSecr=842948345
 78   0.020225 54.230.159.141 -> 172.31.29.138 TCP 17442 [TCP segment of a reassembled PDU]
 79   0.020235 172.31.29.138 -> 54.230.159.141 TCP 66 59886 > http [ACK] Seq=97 Ack=324166 Win=548864 Len=0 TSval=13228306 TSecr=842948345
 80   0.020251 54.230.159.141 -> 172.31.29.138 TCP 3338 [TCP segment of a reassembled PDU]
 81   0.020255 172.31.29.138 -> 54.230.159.141 TCP 66 59886 > http [ACK] Seq=97 Ack=327438 Win=555392 Len=0 TSval=13228306 TSecr=842948345
 82   0.021617 54.230.159.141 -> 172.31.29.138 TCP 7306 [TCP segment of a reassembled PDU]
 83   0.021624 172.31.29.138 -> 54.230.159.141 TCP 66 59886 > http [ACK] Seq=97 Ack=334678 Win=569856 Len=0 TSval=13228307 TSecr=842948345
 84   0.022003 54.230.159.141 -> 172.31.29.138 TCP 26130 [TCP segment of a reassembled PDU]
 85   0.022016 172.31.29.138 -> 54.230.159.141 TCP 66 59886 > http [ACK] Seq=97 Ack=360742 Win=605952 Len=0 TSval=13228307 TSecr=842948345
 86   0.022037 54.230.159.141 -> 172.31.29.138 TCP 18890 [TCP segment of a reassembled PDU]
 87   0.022061 172.31.29.138 -> 54.230.159.141 TCP 66 59886 > http [ACK] Seq=97 Ack=379566 Win=587136 Len=0 TSval=13228307 TSecr=842948345
 88   0.022368 54.230.159.141 -> 172.31.29.138 TCP 4410 [TCP segment of a reassembled PDU]
 89   0.022374 172.31.29.138 -> 54.230.159.141 TCP 66 59886 > http [ACK] Seq=97 Ack=383910 Win=630784 Len=0 TSval=13228307 TSecr=842948345
 90   0.022620 54.230.159.141 -> 172.31.29.138 TCP 5858 [TCP segment of a reassembled PDU]
 91   0.022626 172.31.29.138 -> 54.230.159.141 TCP 66 59886 > http [ACK] Seq=97 Ack=389702 Win=639232 Len=0 TSval=13228307 TSecr=842948345
 92   0.022734 54.230.159.141 -> 172.31.29.138 TCP 3338 [TCP segment of a reassembled PDU]
 93   0.022740 172.31.29.138 -> 54.230.159.141 TCP 66 59886 > http [ACK] Seq=97 Ack=392974 Win=641536 Len=0 TSval=13228307 TSecr=842948345
 94   0.023688 54.230.159.141 -> 172.31.29.138 TCP 11650 [TCP segment of a reassembled PDU]
 95   0.023707 172.31.29.138 -> 54.230.159.141 TCP 66 59886 > http [ACK] Seq=97 Ack=404558 Win=642304 Len=0 TSval=13228307 TSecr=842948345
 96   0.023837 54.230.159.141 -> 172.31.29.138 TCP 26130 [TCP segment of a reassembled PDU]
 97   0.023854 54.230.159.141 -> 172.31.29.138 TCP 7306 [TCP segment of a reassembled PDU]
 98   0.023858 54.230.159.141 -> 172.31.29.138 TCP 1514 [TCP segment of a reassembled PDU]
 99   0.023873 172.31.29.138 -> 54.230.159.141 TCP 66 59886 > http [ACK] Seq=97 Ack=439310 Win=607616 Len=0 TSval=13228307 TSecr=842948345
100   0.024167 54.230.159.141 -> 172.31.29.138 TCP 5858 [TCP segment of a reassembled PDU]
101   0.024173 172.31.29.138 -> 54.230.159.141 TCP 66 59886 > http [ACK] Seq=97 Ack=445102 Win=639232 Len=0 TSval=13228307 TSecr=842948345
102   0.024314 54.230.159.141 -> 172.31.29.138 TCP 13474 [TCP segment of a reassembled PDU]
103   0.024336 172.31.29.138 -> 54.230.159.141 TCP 66 59886 > http [ACK] Seq=97 Ack=458510 Win=642304 Len=0 TSval=13228307 TSecr=842948345
104   0.026477 54.230.159.141 -> 172.31.29.138 TCP 8754 [TCP segment of a reassembled PDU]
105   0.026497 172.31.29.138 -> 54.230.159.141 TCP 66 59886 > http [ACK] Seq=97 Ack=467198 Win=642304 Len=0 TSval=13228308 TSecr=842948345
106   0.026659 54.230.159.141 -> 172.31.29.138 TCP 24682 [TCP segment of a reassembled PDU]
107   0.026681 54.230.159.141 -> 172.31.29.138 TCP 1514 [TCP segment of a reassembled PDU]
108   0.026716 54.230.159.141 -> 172.31.29.138 TCP 11650 [TCP segment of a reassembled PDU]
109   0.026857 172.31.29.138 -> 54.230.159.141 TCP 66 59886 > http [ACK] Seq=97 Ack=504846 Win=604672 Len=0 TSval=13228308 TSecr=842948345
110   0.026975 54.230.159.141 -> 172.31.29.138 TCP 2962 [TCP segment of a reassembled PDU]
111   0.026981 172.31.29.138 -> 54.230.159.141 TCP 66 59886 > http [ACK] Seq=97 Ack=507742 Win=643968 Len=0 TSval=13228308 TSecr=842948345
112   0.027146 54.230.159.141 -> 172.31.29.138 TCP 16370 [TCP segment of a reassembled PDU]
113   0.027171 172.31.29.138 -> 54.230.159.141 TCP 66 59886 > http [ACK] Seq=97 Ack=524046 Win=648064 Len=0 TSval=13228308 TSecr=842948345
114   0.029282 54.230.159.141 -> 172.31.29.138 TCP 5858 [TCP segment of a reassembled PDU]
115   0.029298 172.31.29.138 -> 54.230.159.141 TCP 66 59886 > http [ACK] Seq=97 Ack=529838 Win=648064 Len=0 TSval=13228308 TSecr=842948345
116   0.029466 54.230.159.141 -> 172.31.29.138 TCP 23234 [TCP segment of a reassembled PDU]
117   0.029488 54.230.159.141 -> 172.31.29.138 TCP 2962 [TCP segment of a reassembled PDU]
118   0.029512 172.31.29.138 -> 54.230.159.141 TCP 66 59886 > http [ACK] Seq=97 Ack=555902 Win=622080 Len=0 TSval=13228309 TSecr=842948345
119   0.029540 54.230.159.141 -> 172.31.29.138 TCP 14546 [TCP segment of a reassembled PDU]
120   0.029548 172.31.29.138 -> 54.230.159.141 TCP 66 59886 > http [ACK] Seq=97 Ack=570382 Win=624896 Len=0 TSval=13228309 TSecr=842948345
121   0.029553 54.230.159.141 -> 172.31.29.138 TCP 1514 [TCP segment of a reassembled PDU]
122   0.030063 54.230.159.141 -> 172.31.29.138 TCP 7306 [TCP segment of a reassembled PDU]
123   0.030070 172.31.29.138 -> 54.230.159.141 TCP 66 59886 > http [ACK] Seq=97 Ack=579070 Win=636800 Len=0 TSval=13228309 TSecr=842948345
124   0.030197 54.230.159.141 -> 172.31.29.138 TCP 10578 [TCP segment of a reassembled PDU]
125   0.030214 172.31.29.138 -> 54.230.159.141 TCP 66 59886 > http [ACK] Seq=97 Ack=589582 Win=648064 Len=0 TSval=13228309 TSecr=842948346
126   0.031596 54.230.159.141 -> 172.31.29.138 TCP 2962 [TCP segment of a reassembled PDU]
127   0.031608 172.31.29.138 -> 54.230.159.141 TCP 66 59886 > http [ACK] Seq=97 Ack=592478 Win=648064 Len=0 TSval=13228309 TSecr=842948346
128   0.031701 54.230.159.141 -> 172.31.29.138 TCP 20338 [TCP segment of a reassembled PDU]
129   0.031719 172.31.29.138 -> 54.230.159.141 TCP 66 59886 > http [ACK] Seq=97 Ack=612750 Win=627840 Len=0 TSval=13228309 TSecr=842948346
130   0.031855 54.230.159.141 -> 172.31.29.138 TCP 11650 [TCP segment of a reassembled PDU]
131   0.031861 172.31.29.138 -> 54.230.159.141 TCP 66 59886 > http [ACK] Seq=97 Ack=624334 Win=629760 Len=0 TSval=13228309 TSecr=842948346
132   0.031981 54.230.159.141 -> 172.31.29.138 TCP 11650 [TCP segment of a reassembled PDU]
133   0.031990 172.31.29.138 -> 54.230.159.141 TCP 66 59886 > http [ACK] Seq=97 Ack=635918 Win=629760 Len=0 TSval=13228309 TSecr=842948346
134   0.032081 54.230.159.141 -> 172.31.29.138 TCP 2962 [TCP segment of a reassembled PDU]
135   0.032086 172.31.29.138 -> 54.230.159.141 TCP 66 59886 > http [ACK] Seq=97 Ack=638814 Win=643968 Len=0 TSval=13228309 TSecr=842948346
136   0.032245 54.230.159.141 -> 172.31.29.138 TCP 16370 [TCP segment of a reassembled PDU]
137   0.032266 172.31.29.138 -> 54.230.159.141 TCP 66 59886 > http [ACK] Seq=97 Ack=655118 Win=648064 Len=0 TSval=13228309 TSecr=842948346
138   0.034678 54.230.159.141 -> 172.31.29.138 TCP 4410 [TCP segment of a reassembled PDU]
139   0.034699 172.31.29.138 -> 54.230.159.141 TCP 66 59886 > http [ACK] Seq=97 Ack=659462 Win=648064 Len=0 TSval=13228310 TSecr=842948346
140   0.034770 54.230.159.141 -> 172.31.29.138 TCP 26130 [TCP segment of a reassembled PDU]
141   0.034796 172.31.29.138 -> 54.230.159.141 TCP 66 59886 > http [ACK] Seq=97 Ack=685526 Win=622080 Len=0 TSval=13228310 TSecr=842948346
142   0.034821 54.230.159.141 -> 172.31.29.138 TCP 17442 [TCP segment of a reassembled PDU]
143   0.034840 172.31.29.138 -> 54.230.159.141 TCP 66 59886 > http [ACK] Seq=97 Ack=702902 Win=620160 Len=0 TSval=13228310 TSecr=842948346
144   0.035232 54.230.159.141 -> 172.31.29.138 TCP 17818 [TCP segment of a reassembled PDU]
145   0.035258 172.31.29.138 -> 54.230.159.141 TCP 66 59886 > http [ACK] Seq=97 Ack=720654 Win=617728 Len=0 TSval=13228310 TSecr=842948346
146   0.037229 54.230.159.141 -> 172.31.29.138 TCP 2962 [TCP segment of a reassembled PDU]
147   0.037234 172.31.29.138 -> 54.230.159.141 TCP 66 59886 > http [ACK] Seq=97 Ack=723550 Win=643968 Len=0 TSval=13228310 TSecr=842948346
148   0.037504 54.230.159.141 -> 172.31.29.138 TCP 8754 [TCP segment of a reassembled PDU]
149   0.037524 172.31.29.138 -> 54.230.159.141 TCP 66 59886 > http [ACK] Seq=97 Ack=732238 Win=648064 Len=0 TSval=13228311 TSecr=842948346
150   0.037652 54.230.159.141 -> 172.31.29.138 TCP 26130 [TCP segment of a reassembled PDU]
151   0.037670 54.230.159.141 -> 172.31.29.138 TCP 10202 [TCP segment of a reassembled PDU]
152   0.037690 172.31.29.138 -> 54.230.159.141 TCP 66 59886 > http [ACK] Seq=97 Ack=768438 Win=611968 Len=0 TSval=13228311 TSecr=842948346
153   0.037726 54.230.159.141 -> 172.31.29.138 TCP 7306 [TCP segment of a reassembled PDU]
154   0.037732 172.31.29.138 -> 54.230.159.141 TCP 66 59886 > http [ACK] Seq=97 Ack=775678 Win=636800 Len=0 TSval=13228311 TSecr=842948346
155   0.037860 54.230.159.141 -> 172.31.29.138 TCP 10578 [TCP segment of a reassembled PDU]
156   0.037881 172.31.29.138 -> 54.230.159.141 TCP 66 59886 > http [ACK] Seq=97 Ack=786190 Win=648064 Len=0 TSval=13228311 TSecr=842948346
157   0.039003 54.230.159.141 -> 172.31.29.138 TCP 4410 [TCP segment of a reassembled PDU]
158   0.039019 172.31.29.138 -> 54.230.159.141 TCP 66 59886 > http [ACK] Seq=97 Ack=790534 Win=648064 Len=0 TSval=13228311 TSecr=842948346
159   0.039203 54.230.159.141 -> 172.31.29.138 TCP 26130 [TCP segment of a reassembled PDU]
160   0.039236 54.230.159.141 -> 172.31.29.138 TCP 13098 [TCP segment of a reassembled PDU]
161   0.039243 54.230.159.141 -> 172.31.29.138 TCP 4410 [TCP segment of a reassembled PDU]
162   0.039259 172.31.29.138 -> 54.230.159.141 TCP 66 59886 > http [ACK] Seq=97 Ack=833974 Win=604672 Len=0 TSval=13228311 TSecr=842948346
163   0.039276 54.230.159.141 -> 172.31.29.138 TCP 5858 [TCP segment of a reassembled PDU]
164   0.039289 172.31.29.138 -> 54.230.159.141 TCP 66 59886 > http [ACK] Seq=97 Ack=839766 Win=610688 Len=0 TSval=13228311 TSecr=842948346
165   0.039406 54.230.159.141 -> 172.31.29.138 TCP 12026 [TCP segment of a reassembled PDU]
166   0.039415 172.31.29.138 -> 54.230.159.141 TCP 66 59886 > http [ACK] Seq=97 Ack=851726 Win=627328 Len=0 TSval=13228311 TSecr=842948346
167   0.039797 54.230.159.141 -> 172.31.29.138 TCP 2962 [TCP segment of a reassembled PDU]
168   0.039803 172.31.29.138 -> 54.230.159.141 TCP 66 59886 > http [ACK] Seq=97 Ack=854622 Win=643968 Len=0 TSval=13228311 TSecr=842948346
169   0.039984 54.230.159.141 -> 172.31.29.138 TCP 23234 [TCP segment of a reassembled PDU]
170   0.040006 54.230.159.141 -> 172.31.29.138 TCP 2962 [TCP segment of a reassembled PDU]
171   0.040016 172.31.29.138 -> 54.230.159.141 TCP 66 59886 > http [ACK] Seq=97 Ack=880686 Win=617984 Len=0 TSval=13228311 TSecr=842948346
172   0.040060 54.230.159.141 -> 172.31.29.138 TCP 18890 [TCP segment of a reassembled PDU]
173   0.040099 172.31.29.138 -> 54.230.159.141 TCP 66 59886 > http [ACK] Seq=97 Ack=899510 Win=617728 Len=0 TSval=13228311 TSecr=842948346
174   0.040115 54.230.159.141 -> 172.31.29.138 TCP 13098 [TCP segment of a reassembled PDU]
175   0.040135 172.31.29.138 -> 54.230.159.141 TCP 66 59886 > http [ACK] Seq=97 Ack=912542 Win=648064 Len=0 TSval=13228311 TSecr=842948347
176   0.040188 54.230.159.141 -> 172.31.29.138 TCP 4786 [TCP segment of a reassembled PDU]
177   0.040206 172.31.29.138 -> 54.230.159.141 TCP 66 59886 > http [ACK] Seq=97 Ack=917262 Win=648064 Len=0 TSval=13228311 TSecr=842948347
178   0.041039 54.230.159.141 -> 172.31.29.138 TCP 1514 [TCP segment of a reassembled PDU]
179   0.041123 54.230.159.141 -> 172.31.29.138 TCP 20338 [TCP segment of a reassembled PDU]
180   0.041146 54.230.159.141 -> 172.31.29.138 TCP 4410 [TCP segment of a reassembled PDU]
181   0.041157 172.31.29.138 -> 54.230.159.141 TCP 66 59886 > http [ACK] Seq=97 Ack=943326 Win=622080 Len=0 TSval=13228311 TSecr=842948347
182   0.041181 54.230.159.141 -> 172.31.29.138 TCP 7306 [TCP segment of a reassembled PDU]
183   0.041186 172.31.29.138 -> 54.230.159.141 TCP 66 59886 > http [ACK] Seq=97 Ack=950566 Win=636800 Len=0 TSval=13228311 TSecr=842948347
184   0.041238 54.230.159.141 -> 172.31.29.138 TCP 14546 [TCP segment of a reassembled PDU]
185   0.041261 54.230.159.141 -> 172.31.29.138 TCP 2962 [TCP segment of a reassembled PDU]
186   0.041272 172.31.29.138 -> 54.230.159.141 TCP 66 59886 > http [ACK] Seq=97 Ack=967942 Win=643968 Len=0 TSval=13228311 TSecr=842948347
187   0.041452 54.230.159.141 -> 172.31.29.138 TCP 14922 [TCP segment of a reassembled PDU]
188   0.041473 172.31.29.138 -> 54.230.159.141 TCP 66 59886 > http [ACK] Seq=97 Ack=982798 Win=648064 Len=0 TSval=13228311 TSecr=842948347
189   0.043887 54.230.159.141 -> 172.31.29.138 TCP 7306 [TCP segment of a reassembled PDU]
190   0.043906 172.31.29.138 -> 54.230.159.141 TCP 66 59886 > http [ACK] Seq=97 Ack=990038 Win=648064 Len=0 TSval=13228312 TSecr=842948347
191   0.044033 54.230.159.141 -> 172.31.29.138 TCP 18890 [TCP segment of a reassembled PDU]
192   0.044043 172.31.29.138 -> 54.230.159.141 TCP 66 59886 > http [ACK] Seq=97 Ack=1008862 Win=685696 Len=0 TSval=13228312 TSecr=842948347
193   0.044083 54.230.159.141 -> 172.31.29.138 TCP 21786 [TCP segment of a reassembled PDU]
194   0.044093 172.31.29.138 -> 54.230.159.141 TCP 66 59886 > http [ACK] Seq=97 Ack=1030582 Win=729216 Len=0 TSval=13228312 TSecr=842948347
195   0.044140 54.230.159.141 -> 172.31.29.138 HTTP 18518 HTTP/1.1 200 OK  (application/octet-stream)
196   0.044150 172.31.29.138 -> 54.230.159.141 TCP 66 59886 > http [ACK] Seq=97 Ack=1049034 Win=766080 Len=0 TSval=13228312 TSecr=842948347
197   0.044278 172.31.29.138 -> 54.230.159.141 TCP 66 59886 > http [FIN, ACK] Seq=97 Ack=1049034 Win=766080 Len=0 TSval=13228312 TSecr=842948347
198   0.044859 54.230.159.141 -> 172.31.29.138 TCP 66 http > 59886 [FIN, ACK] Seq=1049034 Ack=98 Win=14592 Len=0 TSval=842948347 TSecr=13228312
199   0.044867 172.31.29.138 -> 54.230.159.141 TCP 66 59886 > http [ACK] Seq=98 Ack=1049035 Win=766080 Len=0 TSval=13228312 TSecr=842948347
