[Measurement for 10kb at 11:03:11 17.03.2014] 
Tshark:

  1   0.000000  192.168.1.2 -> 72.21.195.190 TCP 1414 [TCP segment of a reassembled PDU]
  2   0.000013  192.168.1.2 -> 72.21.195.190 TCP 1414 [TCP segment of a reassembled PDU]
  3   0.000019  192.168.1.2 -> 72.21.195.190 TCP 1414 [TCP segment of a reassembled PDU]
  4   0.000030  192.168.1.2 -> 72.21.195.190 TLSv1 884 Application Data
  5   0.000387  192.168.1.2 -> 72.21.195.190 TLSv1 393 Application Data
  6   0.141631 72.21.195.190 -> 192.168.1.2  TCP 54 443→50824 [ACK] Seq=1 Ack=1 Win=32725 Len=0
  7   0.143133 72.21.195.190 -> 192.168.1.2  TCP 54 443→50824 [ACK] Seq=1 Ack=2191 Win=32691 Len=0
  8   0.144148 72.21.195.190 -> 192.168.1.2  TCP 54 443→50824 [ACK] Seq=1 Ack=2521 Win=32686 Len=0
  9   0.158185 72.21.195.190 -> 192.168.1.2  TCP 54 443→50825 [ACK] Seq=1 Ack=2721 Win=32725 Len=0
 10   0.161232 72.21.195.190 -> 192.168.1.2  TCP 54 443→50825 [ACK] Seq=1 Ack=4911 Win=32691 Len=0
 11   0.162146 72.21.195.190 -> 192.168.1.2  TCP 54 443→50825 [ACK] Seq=1 Ack=5250 Win=32685 Len=0
 12   0.227171 72.21.195.190 -> 192.168.1.2  TLSv1 360 Application Data
 13   0.228123 72.21.195.190 -> 192.168.1.2  TLSv1 123 Application Data
 14   0.228191  192.168.1.2 -> 72.21.195.190 TCP 54 50825→443 [ACK] Seq=5250 Ack=376 Win=258 Len=0
 15   0.246146  192.168.1.2 -> 72.21.195.190 TCP 1414 [TCP segment of a reassembled PDU]
 16   0.246168  192.168.1.2 -> 72.21.195.190 TCP 1414 [TCP segment of a reassembled PDU]
 17   0.246181  192.168.1.2 -> 72.21.195.190 TLSv1 1021 Application Data
 18   0.260895 72.21.195.190 -> 192.168.1.2  TLSv1 386 Application Data
 19   0.262804 72.21.195.190 -> 192.168.1.2  TLSv1 1255 Application Data
 20   0.262884  192.168.1.2 -> 72.21.195.190 TCP 54 50824→443 [ACK] Seq=2521 Ack=1534 Win=260 Len=0
 21   0.402135 72.21.195.190 -> 192.168.1.2  TCP 54 443→50825 [ACK] Seq=376 Ack=7970 Win=32725 Len=0
 22   0.417839 72.21.195.190 -> 192.168.1.2  TCP 54 443→50825 [ACK] Seq=376 Ack=8937 Win=32710 Len=0
 23   0.417840 72.21.195.190 -> 192.168.1.2  TLSv1 331 Application Data
 24   0.417841 72.21.195.190 -> 192.168.1.2  TLSv1 118 Application Data
 25   0.417912  192.168.1.2 -> 72.21.195.190 TCP 54 50825→443 [ACK] Seq=8937 Ack=717 Win=257 Len=0
 26   1.181619  192.168.1.2 -> 54.243.28.148 TCP 55 52510→80 [ACK] Seq=1 Ack=1 Win=257 Len=1
 27   1.341067 54.243.28.148 -> 192.168.1.2  TCP 66 80→52510 [ACK] Seq=1 Ack=2 Win=71 Len=0 SLE=1 SRE=2
 28   1.341662  192.168.1.2 -> 54.230.99.64 TCP 66 52540→80 [SYN] Seq=0 Win=8192 Len=0 MSS=1460 WS=256 SACK_PERM=1
 29   1.370309 54.230.99.64 -> 192.168.1.2  TCP 66 80→52540 [SYN, ACK] Seq=0 Ack=1 Win=14600 Len=0 MSS=1400 SACK_PERM=1 WS=128
 30   1.370461  192.168.1.2 -> 54.230.99.64 TCP 54 52540→80 [ACK] Seq=1 Ack=1 Win=65792 Len=0
 31   1.380896  192.168.1.2 -> 54.230.99.64 HTTP 151 GET /10kb HTTP/1.1 
 32   1.413600 54.230.99.64 -> 192.168.1.2  TCP 54 80→52540 [ACK] Seq=1 Ack=98 Win=14720 Len=0
 33   1.415295 54.230.99.64 -> 192.168.1.2  TCP 1454 [TCP segment of a reassembled PDU]
 34   1.415296 54.230.99.64 -> 192.168.1.2  TCP 1454 [TCP segment of a reassembled PDU]
 35   1.415297 54.230.99.64 -> 192.168.1.2  TCP 1454 [TCP segment of a reassembled PDU]
 36   1.415299 54.230.99.64 -> 192.168.1.2  TCP 1454 [TCP segment of a reassembled PDU]
 37   1.415301 54.230.99.64 -> 192.168.1.2  TCP 1454 [TCP segment of a reassembled PDU]
 38   1.415302 54.230.99.64 -> 192.168.1.2  TCP 1454 [TCP segment of a reassembled PDU]
 39   1.415303 54.230.99.64 -> 192.168.1.2  TCP 1454 [TCP segment of a reassembled PDU]
 40   1.415304 54.230.99.64 -> 192.168.1.2  HTTP 949 HTTP/1.1 200 OK  (application/octet-stream)
 41   1.415501  192.168.1.2 -> 54.230.99.64 TCP 54 52540→80 [ACK] Seq=98 Ack=10696 Win=65792 Len=0
 42   1.415594  192.168.1.2 -> 54.230.99.64 TCP 54 52540→80 [FIN, ACK] Seq=98 Ack=10696 Win=65792 Len=0
 43   1.442273 54.230.99.64 -> 192.168.1.2  TCP 54 80→52540 [FIN, ACK] Seq=10696 Ack=99 Win=14720 Len=0
 44   1.442418  192.168.1.2 -> 54.230.99.64 TCP 54 52540→80 [ACK] Seq=99 Ack=10697 Win=65792 Len=0
