[Measurement for 1mb at 10:40:51 20.40.2014] 
Tshark:

  1   0.000000 172.31.8.238 -> 172.31.0.2   DNS 89 Standard query 0x53f8  A d3796nkzln59xv.cloudfront.net
  2   0.000038 172.31.8.238 -> 172.31.0.2   DNS 89 Standard query 0x64da  AAAA d3796nkzln59xv.cloudfront.net
  3   0.000756   172.31.0.2 -> 172.31.8.238 DNS 170 Standard query response 0x64da 
  4   0.000776   172.31.0.2 -> 172.31.8.238 DNS 217 Standard query response 0x53f8  A 54.192.118.220 A 54.192.118.222 A 54.230.116.53 A 54.230.116.141 A 54.230.117.238 A 54.230.118.214 A 54.230.119.110 A 54.239.132.173
  5   0.003916 172.31.8.238 -> 54.192.118.220 TCP 74 48344 > http [SYN] Seq=0 Win=26883 Len=0 MSS=8961 SACK_PERM=1 TSval=15919837 TSecr=0 WS=128
  6   0.004710 54.192.118.220 -> 172.31.8.238 TCP 74 http > 48344 [SYN, ACK] Seq=0 Ack=1 Win=14480 Len=0 MSS=1460 SACK_PERM=1 TSval=1688338753 TSecr=15919837 WS=128
  7   0.004725 172.31.8.238 -> 54.192.118.220 TCP 66 48344 > http [ACK] Seq=1 Ack=1 Win=27008 Len=0 TSval=15919837 TSecr=1688338753
  8   0.004773 172.31.8.238 -> 54.192.118.220 HTTP 162 GET /1mb HTTP/1.1 
  9   0.005483 54.192.118.220 -> 172.31.8.238 TCP 66 http > 48344 [ACK] Seq=1 Ack=97 Win=14592 Len=0 TSval=1688338753 TSecr=15919837
 10   0.007517 54.192.118.220 -> 172.31.8.238 TCP 523 [TCP segment of a reassembled PDU]
 11   0.007526 172.31.8.238 -> 54.192.118.220 TCP 66 48344 > http [ACK] Seq=97 Ack=458 Win=28032 Len=0 TSval=15919838 TSecr=1688338753
 12   0.007659 54.192.118.220 -> 172.31.8.238 TCP 13098 [TCP segment of a reassembled PDU]
 13   0.007670 172.31.8.238 -> 54.192.118.220 TCP 66 48344 > http [ACK] Seq=97 Ack=13490 Win=54144 Len=0 TSval=15919838 TSecr=1688338753
 14   0.008325 54.192.118.220 -> 172.31.8.238 TCP 2962 [TCP segment of a reassembled PDU]
 15   0.008331 172.31.8.238 -> 54.192.118.220 TCP 66 48344 > http [ACK] Seq=97 Ack=16386 Win=59904 Len=0 TSval=15919838 TSecr=1688338753
 16   0.008437 54.192.118.220 -> 172.31.8.238 TCP 10202 [TCP segment of a reassembled PDU]
 17   0.008445 172.31.8.238 -> 54.192.118.220 TCP 66 48344 > http [ACK] Seq=97 Ack=26522 Win=80128 Len=0 TSval=15919838 TSecr=1688338753
 18   0.008923 54.192.118.220 -> 172.31.8.238 TCP 11650 [TCP segment of a reassembled PDU]
 19   0.008932 172.31.8.238 -> 54.192.118.220 TCP 66 48344 > http [ACK] Seq=97 Ack=38106 Win=98944 Len=0 TSval=15919838 TSecr=1688338753
 20   0.008980 54.192.118.220 -> 172.31.8.238 TCP 8754 [TCP segment of a reassembled PDU]
 21   0.008988 172.31.8.238 -> 54.192.118.220 TCP 66 48344 > http [ACK] Seq=97 Ack=46794 Win=103680 Len=0 TSval=15919838 TSecr=1688338753
 22   0.009567 54.192.118.220 -> 172.31.8.238 TCP 2962 [TCP segment of a reassembled PDU]
 23   0.009572 172.31.8.238 -> 54.192.118.220 TCP 66 48344 > http [ACK] Seq=97 Ack=49690 Win=109056 Len=0 TSval=15919838 TSecr=1688338753
 24   0.009691 54.192.118.220 -> 172.31.8.238 TCP 14546 [TCP segment of a reassembled PDU]
 25   0.009700 172.31.8.238 -> 54.192.118.220 TCP 66 48344 > http [ACK] Seq=97 Ack=64170 Win=94592 Len=0 TSval=15919839 TSecr=1688338753
 26   0.009707 54.192.118.220 -> 172.31.8.238 TCP 1514 [TCP segment of a reassembled PDU]
 27   0.009710 172.31.8.238 -> 54.192.118.220 TCP 66 48344 > http [ACK] Seq=97 Ack=65618 Win=93184 Len=0 TSval=15919839 TSecr=1688338753
 28   0.010331 54.192.118.220 -> 172.31.8.238 TCP 1514 [TCP segment of a reassembled PDU]
 29   0.010335 172.31.8.238 -> 54.192.118.220 TCP 66 48344 > http [ACK] Seq=97 Ack=67066 Win=112000 Len=0 TSval=15919839 TSecr=1688338753
 30   0.010434 54.192.118.220 -> 172.31.8.238 TCP 7306 [TCP segment of a reassembled PDU]
 31   0.010441 172.31.8.238 -> 54.192.118.220 TCP 66 48344 > http [ACK] Seq=97 Ack=74306 Win=126464 Len=0 TSval=15919839 TSecr=1688338753
 32   0.010500 54.192.118.220 -> 172.31.8.238 TCP 15994 [TCP segment of a reassembled PDU]
 33   0.010510 172.31.8.238 -> 54.192.118.220 TCP 66 48344 > http [ACK] Seq=97 Ack=90234 Win=158336 Len=0 TSval=15919839 TSecr=1688338753
 34   0.011135 54.192.118.220 -> 172.31.8.238 TCP 2962 [TCP segment of a reassembled PDU]
 35   0.011141 172.31.8.238 -> 54.192.118.220 TCP 66 48344 > http [ACK] Seq=97 Ack=93130 Win=164096 Len=0 TSval=15919839 TSecr=1688338754
 36   0.011288 54.192.118.220 -> 172.31.8.238 TCP 29026 [TCP segment of a reassembled PDU]
 37   0.011303 172.31.8.238 -> 54.192.118.220 TCP 66 48344 > http [ACK] Seq=97 Ack=122090 Win=221952 Len=0 TSval=15919839 TSecr=1688338754
 38   0.011893 54.192.118.220 -> 172.31.8.238 TCP 8754 [TCP segment of a reassembled PDU]
 39   0.011901 172.31.8.238 -> 54.192.118.220 TCP 66 48344 > http [ACK] Seq=97 Ack=130778 Win=239360 Len=0 TSval=15919839 TSecr=1688338754
 40   0.012017 54.192.118.220 -> 172.31.8.238 TCP 21786 [TCP segment of a reassembled PDU]
 41   0.012029 172.31.8.238 -> 54.192.118.220 TCP 66 48344 > http [ACK] Seq=97 Ack=152498 Win=282880 Len=0 TSval=15919839 TSecr=1688338754
 42   0.012037 54.192.118.220 -> 172.31.8.238 TCP 4410 [TCP segment of a reassembled PDU]
 43   0.012044 172.31.8.238 -> 54.192.118.220 TCP 66 48344 > http [ACK] Seq=97 Ack=156842 Win=291456 Len=0 TSval=15919839 TSecr=1688338754
 44   0.012646 54.192.118.220 -> 172.31.8.238 TCP 7306 [TCP segment of a reassembled PDU]
 45   0.012655 172.31.8.238 -> 54.192.118.220 TCP 66 48344 > http [ACK] Seq=97 Ack=164082 Win=306048 Len=0 TSval=15919839 TSecr=1688338754
 46   0.012763 54.192.118.220 -> 172.31.8.238 TCP 18890 [TCP segment of a reassembled PDU]
 47   0.012772 172.31.8.238 -> 54.192.118.220 TCP 66 48344 > http [ACK] Seq=97 Ack=182906 Win=343680 Len=0 TSval=15919839 TSecr=1688338754
 48   0.012819 54.192.118.220 -> 172.31.8.238 TCP 13098 [TCP segment of a reassembled PDU]
 49   0.012828 172.31.8.238 -> 54.192.118.220 TCP 66 48344 > http [ACK] Seq=97 Ack=195938 Win=369664 Len=0 TSval=15919839 TSecr=1688338754
 50   0.013426 54.192.118.220 -> 172.31.8.238 TCP 1514 [TCP segment of a reassembled PDU]
 51   0.013431 172.31.8.238 -> 54.192.118.220 TCP 66 48344 > http [ACK] Seq=97 Ack=197386 Win=372608 Len=0 TSval=15919839 TSecr=1688338754
 52   0.013599 54.192.118.220 -> 172.31.8.238 TCP 17442 [TCP segment of a reassembled PDU]
 53   0.013610 172.31.8.238 -> 54.192.118.220 TCP 66 48344 > http [ACK] Seq=97 Ack=214762 Win=407296 Len=0 TSval=15919839 TSecr=1688338754
 54   0.013635 54.192.118.220 -> 172.31.8.238 TCP 8754 [TCP segment of a reassembled PDU]
 55   0.013642 172.31.8.238 -> 54.192.118.220 TCP 66 48344 > http [ACK] Seq=97 Ack=223450 Win=424704 Len=0 TSval=15919840 TSecr=1688338754
 56   0.013708 54.192.118.220 -> 172.31.8.238 TCP 15994 [TCP segment of a reassembled PDU]
 57   0.013719 172.31.8.238 -> 54.192.118.220 TCP 66 48344 > http [ACK] Seq=97 Ack=239378 Win=456576 Len=0 TSval=15919840 TSecr=1688338754
 58   0.014204 54.192.118.220 -> 172.31.8.238 TCP 7306 [TCP segment of a reassembled PDU]
 59   0.014212 172.31.8.238 -> 54.192.118.220 TCP 66 48344 > http [ACK] Seq=97 Ack=246618 Win=471040 Len=0 TSval=15919840 TSecr=1688338754
 60   0.014325 54.192.118.220 -> 172.31.8.238 TCP 13098 [TCP segment of a reassembled PDU]
 61   0.014334 172.31.8.238 -> 54.192.118.220 TCP 66 48344 > http [ACK] Seq=97 Ack=259650 Win=497152 Len=0 TSval=15919840 TSecr=1688338754
 62   0.014547 54.192.118.220 -> 172.31.8.238 TCP 17442 [TCP segment of a reassembled PDU]
 63   0.014558 172.31.8.238 -> 54.192.118.220 TCP 66 48344 > http [ACK] Seq=97 Ack=277026 Win=531840 Len=0 TSval=15919840 TSecr=1688338754
 64   0.014580 54.192.118.220 -> 172.31.8.238 TCP 8754 [TCP segment of a reassembled PDU]
 65   0.014586 172.31.8.238 -> 54.192.118.220 TCP 66 48344 > http [ACK] Seq=97 Ack=285714 Win=549248 Len=0 TSval=15919840 TSecr=1688338754
 66   0.014633 54.192.118.220 -> 172.31.8.238 TCP 2962 [TCP segment of a reassembled PDU]
 67   0.014638 172.31.8.238 -> 54.192.118.220 TCP 66 48344 > http [ACK] Seq=97 Ack=288610 Win=555008 Len=0 TSval=15919840 TSecr=1688338754
 68   0.015006 54.192.118.220 -> 172.31.8.238 TCP 21786 [TCP segment of a reassembled PDU]
 69   0.015018 172.31.8.238 -> 54.192.118.220 TCP 66 48344 > http [ACK] Seq=97 Ack=310330 Win=598528 Len=0 TSval=15919840 TSecr=1688338754
 70   0.015344 54.192.118.220 -> 172.31.8.238 TCP 20338 [TCP segment of a reassembled PDU]
 71   0.015355 172.31.8.238 -> 54.192.118.220 TCP 66 48344 > http [ACK] Seq=97 Ack=330602 Win=638976 Len=0 TSval=15919840 TSecr=1688338754
 72   0.015769 54.192.118.220 -> 172.31.8.238 TCP 14546 [TCP segment of a reassembled PDU]
 73   0.015779 172.31.8.238 -> 54.192.118.220 TCP 66 48344 > http [ACK] Seq=97 Ack=345082 Win=668032 Len=0 TSval=15919840 TSecr=1688338754
 74   0.015914 54.192.118.220 -> 172.31.8.238 TCP 26130 [TCP segment of a reassembled PDU]
 75   0.015928 172.31.8.238 -> 54.192.118.220 TCP 66 48344 > http [ACK] Seq=97 Ack=371146 Win=720128 Len=0 TSval=15919840 TSecr=1688338754
 76   0.015951 54.192.118.220 -> 172.31.8.238 TCP 4410 [TCP segment of a reassembled PDU]
 77   0.015956 172.31.8.238 -> 54.192.118.220 TCP 66 48344 > http [ACK] Seq=97 Ack=375490 Win=728832 Len=0 TSval=15919840 TSecr=1688338754
 78   0.016490 54.192.118.220 -> 172.31.8.238 TCP 7306 [TCP segment of a reassembled PDU]
 79   0.016497 172.31.8.238 -> 54.192.118.220 TCP 66 48344 > http [ACK] Seq=97 Ack=382730 Win=743296 Len=0 TSval=15919840 TSecr=1688338754
 80   0.016669 54.192.118.220 -> 172.31.8.238 TCP 26130 [TCP segment of a reassembled PDU]
 81   0.016683 172.31.8.238 -> 54.192.118.220 TCP 66 48344 > http [ACK] Seq=97 Ack=408794 Win=795392 Len=0 TSval=15919840 TSecr=1688338754
 82   0.016741 54.192.118.220 -> 172.31.8.238 TCP 24682 [TCP segment of a reassembled PDU]
 83   0.016755 172.31.8.238 -> 54.192.118.220 TCP 66 48344 > http [ACK] Seq=97 Ack=433410 Win=842624 Len=0 TSval=15919840 TSecr=1688338754
 84   0.017246 54.192.118.220 -> 172.31.8.238 TCP 5858 [TCP segment of a reassembled PDU]
 85   0.017252 172.31.8.238 -> 54.192.118.220 TCP 66 48344 > http [ACK] Seq=97 Ack=439202 Win=856192 Len=0 TSval=15919840 TSecr=1688338754
 86   0.017422 54.192.118.220 -> 172.31.8.238 TCP 26130 [TCP segment of a reassembled PDU]
 87   0.017436 172.31.8.238 -> 54.192.118.220 TCP 66 48344 > http [ACK] Seq=97 Ack=465266 Win=840192 Len=0 TSval=15919840 TSecr=1688338754
 88   0.017498 54.192.118.220 -> 172.31.8.238 TCP 26130 [TCP segment of a reassembled PDU]
 89   0.017511 172.31.8.238 -> 54.192.118.220 TCP 66 48344 > http [ACK] Seq=97 Ack=491330 Win=840192 Len=0 TSval=15919840 TSecr=1688338754
 90   0.017627 54.192.118.220 -> 172.31.8.238 TCP 10202 [TCP segment of a reassembled PDU]
 91   0.017636 172.31.8.238 -> 54.192.118.220 TCP 66 48344 > http [ACK] Seq=97 Ack=501466 Win=866432 Len=0 TSval=15919841 TSecr=1688338754
 92   0.018015 54.192.118.220 -> 172.31.8.238 TCP 4410 [TCP segment of a reassembled PDU]
 93   0.018022 172.31.8.238 -> 54.192.118.220 TCP 66 48344 > http [ACK] Seq=97 Ack=505810 Win=885248 Len=0 TSval=15919841 TSecr=1688338754
 94   0.018434 54.192.118.220 -> 172.31.8.238 TCP 26130 [TCP segment of a reassembled PDU]
 95   0.018448 172.31.8.238 -> 54.192.118.220 TCP 66 48344 > http [ACK] Seq=97 Ack=531874 Win=937344 Len=0 TSval=15919841 TSecr=1688338754
 96   0.018509 54.192.118.220 -> 172.31.8.238 TCP 21786 [TCP segment of a reassembled PDU]
 97   0.018522 172.31.8.238 -> 54.192.118.220 TCP 66 48344 > http [ACK] Seq=97 Ack=553594 Win=980736 Len=0 TSval=15919841 TSecr=1688338754
 98   0.018567 54.192.118.220 -> 172.31.8.238 TCP 4410 [TCP segment of a reassembled PDU]
 99   0.018573 172.31.8.238 -> 54.192.118.220 TCP 66 48344 > http [ACK] Seq=97 Ack=557938 Win=989440 Len=0 TSval=15919841 TSecr=1688338754
100   0.018629 54.192.118.220 -> 172.31.8.238 TCP 5858 [TCP segment of a reassembled PDU]
101   0.018635 172.31.8.238 -> 54.192.118.220 TCP 66 48344 > http [ACK] Seq=97 Ack=563730 Win=1001088 Len=0 TSval=15919841 TSecr=1688338754
102   0.018641 54.192.118.220 -> 172.31.8.238 TCP 7306 [TCP segment of a reassembled PDU]
103   0.018646 172.31.8.238 -> 54.192.118.220 TCP 66 48344 > http [ACK] Seq=97 Ack=570970 Win=1015552 Len=0 TSval=15919841 TSecr=1688338754
104   0.019031 54.192.118.220 -> 172.31.8.238 TCP 2962 [TCP segment of a reassembled PDU]
105   0.019037 172.31.8.238 -> 54.192.118.220 TCP 66 48344 > http [ACK] Seq=97 Ack=573866 Win=1021312 Len=0 TSval=15919841 TSecr=1688338754
106   0.019218 54.192.118.220 -> 172.31.8.238 TCP 26130 [TCP segment of a reassembled PDU]
107   0.019231 172.31.8.238 -> 54.192.118.220 TCP 66 48344 > http [ACK] Seq=97 Ack=599930 Win=1073408 Len=0 TSval=15919841 TSecr=1688338754
108   0.019294 54.192.118.220 -> 172.31.8.238 TCP 26130 [TCP segment of a reassembled PDU]
109   0.019307 172.31.8.238 -> 54.192.118.220 TCP 66 48344 > http [ACK] Seq=97 Ack=625994 Win=1125504 Len=0 TSval=15919841 TSecr=1688338754
110   0.019352 54.192.118.220 -> 172.31.8.238 TCP 10202 [TCP segment of a reassembled PDU]
111   0.019359 172.31.8.238 -> 54.192.118.220 TCP 66 48344 > http [ACK] Seq=97 Ack=636130 Win=1145856 Len=0 TSval=15919841 TSecr=1688338754
112   0.019819 54.192.118.220 -> 172.31.8.238 TCP 2962 [TCP segment of a reassembled PDU]
113   0.019825 172.31.8.238 -> 54.192.118.220 TCP 66 48344 > http [ACK] Seq=97 Ack=639026 Win=1151616 Len=0 TSval=15919841 TSecr=1688338754
114   0.019999 54.192.118.220 -> 172.31.8.238 TCP 23234 [TCP segment of a reassembled PDU]
115   0.020012 172.31.8.238 -> 54.192.118.220 TCP 66 48344 > http [ACK] Seq=97 Ack=662194 Win=1197952 Len=0 TSval=15919841 TSecr=1688338754
116   0.020018 54.192.118.220 -> 172.31.8.238 TCP 1514 [TCP segment of a reassembled PDU]
117   0.020023 172.31.8.238 -> 54.192.118.220 TCP 66 48344 > http [ACK] Seq=97 Ack=663642 Win=1200896 Len=0 TSval=15919841 TSecr=1688338754
118   0.020029 54.192.118.220 -> 172.31.8.238 TCP 1514 [TCP segment of a reassembled PDU]
119   0.020032 172.31.8.238 -> 54.192.118.220 TCP 66 48344 > http [ACK] Seq=97 Ack=665090 Win=1203712 Len=0 TSval=15919841 TSecr=1688338754
120   0.020119 54.192.118.220 -> 172.31.8.238 TCP 26130 [TCP segment of a reassembled PDU]
121   0.020133 172.31.8.238 -> 54.192.118.220 TCP 66 48344 > http [ACK] Seq=97 Ack=691154 Win=1255936 Len=0 TSval=15919841 TSecr=1688338754
122   0.020205 54.192.118.220 -> 172.31.8.238 TCP 10202 [TCP segment of a reassembled PDU]
123   0.020212 172.31.8.238 -> 54.192.118.220 TCP 66 48344 > http [ACK] Seq=97 Ack=701290 Win=1276160 Len=0 TSval=15919841 TSecr=1688338754
124   0.020599 54.192.118.220 -> 172.31.8.238 TCP 4410 [TCP segment of a reassembled PDU]
125   0.020605 172.31.8.238 -> 54.192.118.220 TCP 66 48344 > http [ACK] Seq=97 Ack=705634 Win=1284864 Len=0 TSval=15919841 TSecr=1688338755
126   0.020776 54.192.118.220 -> 172.31.8.238 TCP 18890 [TCP segment of a reassembled PDU]
127   0.020786 172.31.8.238 -> 54.192.118.220 TCP 66 48344 > http [ACK] Seq=97 Ack=724458 Win=1322496 Len=0 TSval=15919841 TSecr=1688338755
128   0.020808 54.192.118.220 -> 172.31.8.238 TCP 7306 [TCP segment of a reassembled PDU]
129   0.020814 172.31.8.238 -> 54.192.118.220 TCP 66 48344 > http [ACK] Seq=97 Ack=731698 Win=1336960 Len=0 TSval=15919841 TSecr=1688338755
130   0.020900 54.192.118.220 -> 172.31.8.238 TCP 26130 [TCP segment of a reassembled PDU]
131   0.020912 172.31.8.238 -> 54.192.118.220 TCP 66 48344 > http [ACK] Seq=97 Ack=757762 Win=1389056 Len=0 TSval=15919841 TSecr=1688338755
132   0.020945 54.192.118.220 -> 172.31.8.238 TCP 8754 [TCP segment of a reassembled PDU]
133   0.020951 172.31.8.238 -> 54.192.118.220 TCP 66 48344 > http [ACK] Seq=97 Ack=766450 Win=1384576 Len=0 TSval=15919841 TSecr=1688338755
134   0.021379 54.192.118.220 -> 172.31.8.238 TCP 1514 [TCP segment of a reassembled PDU]
135   0.021384 172.31.8.238 -> 54.192.118.220 TCP 66 48344 > http [ACK] Seq=97 Ack=767898 Win=1392000 Len=0 TSval=15919841 TSecr=1688338755
136   0.021556 54.192.118.220 -> 172.31.8.238 TCP 18890 [TCP segment of a reassembled PDU]
137   0.021567 172.31.8.238 -> 54.192.118.220 TCP 66 48344 > http [ACK] Seq=97 Ack=786722 Win=1410688 Len=0 TSval=15919841 TSecr=1688338755
138   0.021589 54.192.118.220 -> 172.31.8.238 TCP 7306 [TCP segment of a reassembled PDU]
139   0.021607 172.31.8.238 -> 54.192.118.220 TCP 66 48344 > http [ACK] Seq=97 Ack=793962 Win=1403520 Len=0 TSval=15919841 TSecr=1688338755
140   0.021701 54.192.118.220 -> 172.31.8.238 TCP 26130 [TCP segment of a reassembled PDU]
141   0.021715 172.31.8.238 -> 54.192.118.220 TCP 66 48344 > http [ACK] Seq=97 Ack=820026 Win=1398912 Len=0 TSval=15919842 TSecr=1688338755
142   0.021759 54.192.118.220 -> 172.31.8.238 TCP 11650 [TCP segment of a reassembled PDU]
143   0.021768 172.31.8.238 -> 54.192.118.220 TCP 66 48344 > http [ACK] Seq=97 Ack=831610 Win=1422720 Len=0 TSval=15919842 TSecr=1688338755
144   0.021843 54.192.118.220 -> 172.31.8.238 TCP 17442 [TCP segment of a reassembled PDU]
145   0.021854 172.31.8.238 -> 54.192.118.220 TCP 66 48344 > http [ACK] Seq=97 Ack=848986 Win=1413120 Len=0 TSval=15919842 TSecr=1688338755
146   0.021890 54.192.118.220 -> 172.31.8.238 TCP 8754 [TCP segment of a reassembled PDU]
147   0.021898 172.31.8.238 -> 54.192.118.220 TCP 66 48344 > http [ACK] Seq=97 Ack=857674 Win=1427456 Len=0 TSval=15919842 TSecr=1688338755
148   0.021952 54.192.118.220 -> 172.31.8.238 TCP 13098 [TCP segment of a reassembled PDU]
149   0.021960 172.31.8.238 -> 54.192.118.220 TCP 66 48344 > http [ACK] Seq=97 Ack=870706 Win=1420288 Len=0 TSval=15919842 TSecr=1688338755
150   0.022404 54.192.118.220 -> 172.31.8.238 TCP 7306 [TCP segment of a reassembled PDU]
151   0.022412 172.31.8.238 -> 54.192.118.220 TCP 66 48344 > http [ACK] Seq=97 Ack=877946 Win=1429760 Len=0 TSval=15919842 TSecr=1688338755
152   0.022560 54.192.118.220 -> 172.31.8.238 TCP 18890 [TCP segment of a reassembled PDU]
153   0.022571 172.31.8.238 -> 54.192.118.220 TCP 66 48344 > http [ACK] Seq=97 Ack=896770 Win=1410944 Len=0 TSval=15919842 TSecr=1688338755
154   0.022635 54.192.118.220 -> 172.31.8.238 TCP 26130 [TCP segment of a reassembled PDU]
155   0.022649 172.31.8.238 -> 54.192.118.220 TCP 66 48344 > http [ACK] Seq=97 Ack=922834 Win=1398912 Len=0 TSval=15919842 TSecr=1688338755
156   0.022785 54.192.118.220 -> 172.31.8.238 TCP 36266 [TCP segment of a reassembled PDU]
157   0.022805 54.192.118.220 -> 172.31.8.238 TCP 2962 [TCP segment of a reassembled PDU]
158   0.022819 172.31.8.238 -> 54.192.118.220 TCP 66 48344 > http [ACK] Seq=97 Ack=961930 Win=1377280 Len=0 TSval=15919842 TSecr=1688338755
159   0.023171 54.192.118.220 -> 172.31.8.238 TCP 4410 [TCP segment of a reassembled PDU]
160   0.023177 172.31.8.238 -> 54.192.118.220 TCP 66 48344 > http [ACK] Seq=97 Ack=966274 Win=1434496 Len=0 TSval=15919842 TSecr=1688338755
161   0.023342 54.192.118.220 -> 172.31.8.238 TCP 26130 [TCP segment of a reassembled PDU]
162   0.023368 172.31.8.238 -> 54.192.118.220 TCP 66 48344 > http [ACK] Seq=97 Ack=992338 Win=1408512 Len=0 TSval=15919842 TSecr=1688338755
163   0.023434 54.192.118.220 -> 172.31.8.238 TCP 26130 [TCP segment of a reassembled PDU]
164   0.023511 54.192.118.220 -> 172.31.8.238 TCP 26130 [TCP segment of a reassembled PDU]
165   0.023532 54.192.118.220 -> 172.31.8.238 HTTP 4634 HTTP/1.1 200 OK  (application/octet-stream)
166   0.023635 172.31.8.238 -> 54.192.118.220 TCP 66 48344 > http [ACK] Seq=97 Ack=1049034 Win=1351936 Len=0 TSval=15919842 TSecr=1688338755
167   0.023779 172.31.8.238 -> 54.192.118.220 TCP 66 48344 > http [FIN, ACK] Seq=97 Ack=1049034 Win=1437184 Len=0 TSval=15919842 TSecr=1688338755
168   0.024436 54.192.118.220 -> 172.31.8.238 TCP 66 http > 48344 [FIN, ACK] Seq=1049034 Ack=98 Win=14592 Len=0 TSval=1688338755 TSecr=15919842
169   0.024444 172.31.8.238 -> 54.192.118.220 TCP 66 48344 > http [ACK] Seq=98 Ack=1049035 Win=1437184 Len=0 TSval=15919842 TSecr=1688338755
