[Measurement for 1mb at 18:41:10 19.41.2014] 
Tshark:

  1   0.000000 172.31.8.238 -> 172.31.0.2   DNS 89 Standard query 0x049a  A d3796nkzln59xv.cloudfront.net
  2   0.000029 172.31.8.238 -> 172.31.0.2   DNS 89 Standard query 0x694d  AAAA d3796nkzln59xv.cloudfront.net
  3   0.001005   172.31.0.2 -> 172.31.8.238 DNS 170 Standard query response 0x694d 
  4   0.001016   172.31.0.2 -> 172.31.8.238 DNS 217 Standard query response 0x049a  A 54.230.116.53 A 54.230.116.136 A 54.230.117.5 A 54.230.117.15 A 54.230.117.37 A 54.230.118.248 A 54.239.132.84 A 54.192.118.233
  5   0.003869 172.31.8.238 -> 54.230.116.53 TCP 74 37556 > http [SYN] Seq=0 Win=26883 Len=0 MSS=8961 SACK_PERM=1 TSval=1524587 TSecr=0 WS=128
  6   0.004687 54.230.116.53 -> 172.31.8.238 TCP 74 http > 37556 [SYN, ACK] Seq=0 Ack=1 Win=14480 Len=0 MSS=1460 SACK_PERM=1 TSval=1679357683 TSecr=1524587 WS=128
  7   0.004702 172.31.8.238 -> 54.230.116.53 TCP 66 37556 > http [ACK] Seq=1 Ack=1 Win=27008 Len=0 TSval=1524588 TSecr=1679357683
  8   0.004744 172.31.8.238 -> 54.230.116.53 HTTP 162 GET /1mb HTTP/1.1 
  9   0.005446 54.230.116.53 -> 172.31.8.238 TCP 66 http > 37556 [ACK] Seq=1 Ack=97 Win=14592 Len=0 TSval=1679357683 TSecr=1524588
 10   0.134281 54.230.116.53 -> 172.31.8.238 TCP 2617 [TCP segment of a reassembled PDU]
 11   0.134309 172.31.8.238 -> 54.230.116.53 TCP 66 37556 > http [ACK] Seq=97 Ack=2552 Win=32000 Len=0 TSval=1524620 TSecr=1679357696
 12   0.134330 54.230.116.53 -> 172.31.8.238 TCP 11650 [TCP segment of a reassembled PDU]
 13   0.134336 172.31.8.238 -> 54.230.116.53 TCP 66 37556 > http [ACK] Seq=97 Ack=14136 Win=55168 Len=0 TSval=1524620 TSecr=1679357696
 14   0.135022 54.230.116.53 -> 172.31.8.238 TCP 4410 [TCP segment of a reassembled PDU]
 15   0.135029 172.31.8.238 -> 54.230.116.53 TCP 66 37556 > http [ACK] Seq=97 Ack=18480 Win=63872 Len=0 TSval=1524620 TSecr=1679357696
 16   0.135141 54.230.116.53 -> 172.31.8.238 TCP 8754 [TCP segment of a reassembled PDU]
 17   0.135149 172.31.8.238 -> 54.230.116.53 TCP 66 37556 > http [ACK] Seq=97 Ack=27168 Win=81280 Len=0 TSval=1524620 TSecr=1679357696
 18   0.135537 54.230.116.53 -> 172.31.8.238 TCP 7306 [TCP segment of a reassembled PDU]
 19   0.135545 172.31.8.238 -> 54.230.116.53 TCP 66 37556 > http [ACK] Seq=97 Ack=34408 Win=95744 Len=0 TSval=1524620 TSecr=1679357697
 20   0.135635 54.230.116.53 -> 172.31.8.238 TCP 2962 [TCP segment of a reassembled PDU]
 21   0.135640 172.31.8.238 -> 54.230.116.53 TCP 66 37556 > http [ACK] Seq=97 Ack=37304 Win=101504 Len=0 TSval=1524620 TSecr=1679357697
 22   0.135814 54.230.116.53 -> 172.31.8.238 TCP 4686 [TCP segment of a reassembled PDU]
 23   0.135820 172.31.8.238 -> 54.230.116.53 TCP 66 37556 > http [ACK] Seq=97 Ack=41924 Win=108416 Len=0 TSval=1524620 TSecr=1679357697
 24   0.217619 54.230.116.53 -> 172.31.8.238 TCP 1526 [TCP segment of a reassembled PDU]
 25   0.217643 172.31.8.238 -> 54.230.116.53 TCP 66 37556 > http [ACK] Seq=97 Ack=43384 Win=109056 Len=0 TSval=1524641 TSecr=1679357705
 26   0.217656 54.230.116.53 -> 172.31.8.238 TCP 2962 [TCP segment of a reassembled PDU]
 27   0.217660 172.31.8.238 -> 54.230.116.53 TCP 66 37556 > http [ACK] Seq=97 Ack=46280 Win=108416 Len=0 TSval=1524641 TSecr=1679357705
 28   0.217759 54.230.116.53 -> 172.31.8.238 TCP 90 [TCP segment of a reassembled PDU]
 29   0.217763 172.31.8.238 -> 54.230.116.53 TCP 66 37556 > http [ACK] Seq=97 Ack=46304 Win=108416 Len=0 TSval=1524641 TSecr=1679357705
 30   0.217770 54.230.116.53 -> 172.31.8.238 TCP 2962 [TCP segment of a reassembled PDU]
 31   0.217773 172.31.8.238 -> 54.230.116.53 TCP 66 37556 > http [ACK] Seq=97 Ack=49200 Win=105600 Len=0 TSval=1524641 TSecr=1679357705
 32   0.217851 54.230.116.53 -> 172.31.8.238 TCP 11650 [TCP segment of a reassembled PDU]
 33   0.217859 172.31.8.238 -> 54.230.116.53 TCP 66 37556 > http [ACK] Seq=97 Ack=60784 Win=94080 Len=0 TSval=1524641 TSecr=1679357705
 34   0.218522 54.230.116.53 -> 172.31.8.238 TCP 8754 [TCP segment of a reassembled PDU]
 35   0.218532 172.31.8.238 -> 54.230.116.53 TCP 66 37556 > http [ACK] Seq=97 Ack=69472 Win=85504 Len=0 TSval=1524641 TSecr=1679357705
 36   0.218630 54.230.116.53 -> 172.31.8.238 TCP 7558 [TCP segment of a reassembled PDU]
 37   0.220409 172.31.8.238 -> 54.230.116.53 TCP 66 37556 > http [ACK] Seq=97 Ack=76964 Win=109056 Len=0 TSval=1524642 TSecr=1679357705
 38   0.300705 54.230.116.53 -> 172.31.8.238 TCP 2962 [TCP segment of a reassembled PDU]
 39   0.300735 172.31.8.238 -> 54.230.116.53 TCP 66 37556 > http [ACK] Seq=97 Ack=79860 Win=114816 Len=0 TSval=1524662 TSecr=1679357713
 40   0.300743 54.230.116.53 -> 172.31.8.238 TCP 90 [TCP segment of a reassembled PDU]
 41   0.300766 54.230.116.53 -> 172.31.8.238 TCP 4410 [TCP segment of a reassembled PDU]
 42   0.300771 172.31.8.238 -> 54.230.116.53 TCP 66 37556 > http [ACK] Seq=97 Ack=84228 Win=123520 Len=0 TSval=1524662 TSecr=1679357713
 43   0.300826 54.230.116.53 -> 172.31.8.238 TCP 102 [TCP segment of a reassembled PDU]
 44   0.300836 172.31.8.238 -> 54.230.116.53 TCP 66 37556 > http [ACK] Seq=97 Ack=84264 Win=123520 Len=0 TSval=1524662 TSecr=1679357713
 45   0.300947 54.230.116.53 -> 172.31.8.238 TCP 2962 [TCP segment of a reassembled PDU]
 46   0.300952 172.31.8.238 -> 54.230.116.53 TCP 66 37556 > http [ACK] Seq=97 Ack=87160 Win=129280 Len=0 TSval=1524662 TSecr=1679357713
 47   0.301167 54.230.116.53 -> 172.31.8.238 TCP 2962 [TCP segment of a reassembled PDU]
 48   0.301173 172.31.8.238 -> 54.230.116.53 TCP 66 37556 > http [ACK] Seq=97 Ack=90056 Win=135168 Len=0 TSval=1524662 TSecr=1679357713
 49   0.301288 54.230.116.53 -> 172.31.8.238 TCP 13098 [TCP segment of a reassembled PDU]
 50   0.301297 172.31.8.238 -> 54.230.116.53 TCP 66 37556 > http [ACK] Seq=97 Ack=103088 Win=161152 Len=0 TSval=1524662 TSecr=1679357713
 51   0.301446 54.230.116.53 -> 172.31.8.238 TCP 5858 [TCP segment of a reassembled PDU]
 52   0.301453 172.31.8.238 -> 54.230.116.53 TCP 66 37556 > http [ACK] Seq=97 Ack=108880 Win=172800 Len=0 TSval=1524662 TSecr=1679357713
 53   0.301536 54.230.116.53 -> 172.31.8.238 TCP 5858 [TCP segment of a reassembled PDU]
 54   0.301542 172.31.8.238 -> 54.230.116.53 TCP 66 37556 > http [ACK] Seq=97 Ack=114672 Win=184320 Len=0 TSval=1524662 TSecr=1679357713
 55   0.301940 54.230.116.53 -> 172.31.8.238 TCP 4410 [TCP segment of a reassembled PDU]
 56   0.301946 172.31.8.238 -> 54.230.116.53 TCP 66 37556 > http [ACK] Seq=97 Ack=119016 Win=193024 Len=0 TSval=1524662 TSecr=1679357713
 57   0.302062 54.230.116.53 -> 172.31.8.238 TCP 17442 [TCP segment of a reassembled PDU]
 58   0.302073 172.31.8.238 -> 54.230.116.53 TCP 66 37556 > http [ACK] Seq=97 Ack=136392 Win=227840 Len=0 TSval=1524662 TSecr=1679357713
 59   0.302111 54.230.116.53 -> 172.31.8.238 TCP 4410 [TCP segment of a reassembled PDU]
 60   0.302117 172.31.8.238 -> 54.230.116.53 TCP 66 37556 > http [ACK] Seq=97 Ack=140736 Win=236544 Len=0 TSval=1524662 TSecr=1679357713
 61   0.302291 54.230.116.53 -> 172.31.8.238 TCP 14546 [TCP segment of a reassembled PDU]
 62   0.302301 172.31.8.238 -> 54.230.116.53 TCP 66 37556 > http [ACK] Seq=97 Ack=155216 Win=265472 Len=0 TSval=1524662 TSecr=1679357713
 63   0.302718 54.230.116.53 -> 172.31.8.238 TCP 5858 [TCP segment of a reassembled PDU]
 64   0.302724 172.31.8.238 -> 54.230.116.53 TCP 66 37556 > http [ACK] Seq=97 Ack=161008 Win=276992 Len=0 TSval=1524662 TSecr=1679357713
 65   0.302799 54.230.116.53 -> 172.31.8.238 TCP 2162 [TCP segment of a reassembled PDU]
 66   0.302804 172.31.8.238 -> 54.230.116.53 TCP 66 37556 > http [ACK] Seq=97 Ack=163104 Win=281216 Len=0 TSval=1524662 TSecr=1679357713
 67   0.384214 54.230.116.53 -> 172.31.8.238 TCP 1526 [TCP segment of a reassembled PDU]
 68   0.384245 172.31.8.238 -> 54.230.116.53 TCP 66 37556 > http [ACK] Seq=97 Ack=164564 Win=284160 Len=0 TSval=1524682 TSecr=1679357721
 69   0.384259 54.230.116.53 -> 172.31.8.238 TCP 2962 [TCP segment of a reassembled PDU]
 70   0.384266 172.31.8.238 -> 54.230.116.53 TCP 66 37556 > http [ACK] Seq=97 Ack=167460 Win=289920 Len=0 TSval=1524682 TSecr=1679357721
 71   0.384281 54.230.116.53 -> 172.31.8.238 TCP 90 [TCP segment of a reassembled PDU]
 72   0.384465 54.230.116.53 -> 172.31.8.238 TCP 4446 [TCP segment of a reassembled PDU]
 73   0.384472 172.31.8.238 -> 54.230.116.53 TCP 66 37556 > http [ACK] Seq=97 Ack=171864 Win=298752 Len=0 TSval=1524683 TSecr=1679357721
 74   0.384478 54.230.116.53 -> 172.31.8.238 TCP 2986 [TCP segment of a reassembled PDU]
 75   0.384481 172.31.8.238 -> 54.230.116.53 TCP 66 37556 > http [ACK] Seq=97 Ack=174784 Win=304512 Len=0 TSval=1524683 TSecr=1679357721
 76   0.384709 54.230.116.53 -> 172.31.8.238 TCP 2986 [TCP segment of a reassembled PDU]
 77   0.384716 172.31.8.238 -> 54.230.116.53 TCP 66 37556 > http [ACK] Seq=97 Ack=177704 Win=310400 Len=0 TSval=1524683 TSecr=1679357721
 78   0.384769 54.230.116.53 -> 172.31.8.238 TCP 2962 [TCP segment of a reassembled PDU]
 79   0.384775 172.31.8.238 -> 54.230.116.53 TCP 66 37556 > http [ACK] Seq=97 Ack=180600 Win=316160 Len=0 TSval=1524683 TSecr=1679357721
 80   0.384976 54.230.116.53 -> 172.31.8.238 TCP 15994 [TCP segment of a reassembled PDU]
 81   0.384986 172.31.8.238 -> 54.230.116.53 TCP 66 37556 > http [ACK] Seq=97 Ack=196528 Win=348032 Len=0 TSval=1524683 TSecr=1679357721
 82   0.385074 54.230.116.53 -> 172.31.8.238 TCP 8754 [TCP segment of a reassembled PDU]
 83   0.385082 172.31.8.238 -> 54.230.116.53 TCP 66 37556 > http [ACK] Seq=97 Ack=205216 Win=365440 Len=0 TSval=1524683 TSecr=1679357721
 84   0.385465 54.230.116.53 -> 172.31.8.238 TCP 8754 [TCP segment of a reassembled PDU]
 85   0.385473 172.31.8.238 -> 54.230.116.53 TCP 66 37556 > http [ACK] Seq=97 Ack=213904 Win=382720 Len=0 TSval=1524683 TSecr=1679357721
 86   0.385643 54.230.116.53 -> 172.31.8.238 TCP 11650 [TCP segment of a reassembled PDU]
 87   0.385652 172.31.8.238 -> 54.230.116.53 TCP 66 37556 > http [ACK] Seq=97 Ack=225488 Win=405888 Len=0 TSval=1524683 TSecr=1679357721
 88   0.385809 54.230.116.53 -> 172.31.8.238 TCP 18890 [TCP segment of a reassembled PDU]
 89   0.385822 172.31.8.238 -> 54.230.116.53 TCP 66 37556 > http [ACK] Seq=97 Ack=244312 Win=443648 Len=0 TSval=1524683 TSecr=1679357722
 90   0.385829 54.230.116.53 -> 172.31.8.238 TCP 2962 [TCP segment of a reassembled PDU]
 91   0.385832 172.31.8.238 -> 54.230.116.53 TCP 66 37556 > http [ACK] Seq=97 Ack=247208 Win=449408 Len=0 TSval=1524683 TSecr=1679357722
 92   0.386243 54.230.116.53 -> 172.31.8.238 TCP 5022 [TCP segment of a reassembled PDU]
 93   0.386250 172.31.8.238 -> 54.230.116.53 TCP 66 37556 > http [ACK] Seq=97 Ack=252164 Win=459264 Len=0 TSval=1524683 TSecr=1679357722
 94   0.467717 54.230.116.53 -> 172.31.8.238 TCP 2962 [TCP segment of a reassembled PDU]
 95   0.467747 172.31.8.238 -> 54.230.116.53 TCP 66 37556 > http [ACK] Seq=97 Ack=255060 Win=465024 Len=0 TSval=1524703 TSecr=1679357730
 96   0.467776 54.230.116.53 -> 172.31.8.238 TCP 78 [TCP segment of a reassembled PDU]
 97   0.467785 54.230.116.53 -> 172.31.8.238 TCP 2962 [TCP segment of a reassembled PDU]
 98   0.467788 172.31.8.238 -> 54.230.116.53 TCP 66 37556 > http [ACK] Seq=97 Ack=257968 Win=470912 Len=0 TSval=1524703 TSecr=1679357730
 99   0.467864 54.230.116.53 -> 172.31.8.238 TCP 102 [TCP segment of a reassembled PDU]
100   0.467872 54.230.116.53 -> 172.31.8.238 TCP 4410 [TCP segment of a reassembled PDU]
101   0.467875 172.31.8.238 -> 54.230.116.53 TCP 66 37556 > http [ACK] Seq=97 Ack=262348 Win=479616 Len=0 TSval=1524703 TSecr=1679357730
102   0.467920 54.230.116.53 -> 172.31.8.238 TCP 90 [TCP segment of a reassembled PDU]
103   0.467933 172.31.8.238 -> 54.230.116.53 TCP 66 37556 > http [ACK] Seq=97 Ack=262372 Win=479616 Len=0 TSval=1524703 TSecr=1679357730
104   0.468005 54.230.116.53 -> 172.31.8.238 TCP 4410 [TCP segment of a reassembled PDU]
105   0.468010 172.31.8.238 -> 54.230.116.53 TCP 66 37556 > http [ACK] Seq=97 Ack=266716 Win=488192 Len=0 TSval=1524703 TSecr=1679357730
106   0.468066 54.230.116.53 -> 172.31.8.238 TCP 114 [TCP segment of a reassembled PDU]
107   0.468072 54.230.116.53 -> 172.31.8.238 TCP 2962 [TCP segment of a reassembled PDU]
108   0.468076 172.31.8.238 -> 54.230.116.53 TCP 66 37556 > http [ACK] Seq=97 Ack=269660 Win=494080 Len=0 TSval=1524703 TSecr=1679357730
109   0.468127 54.230.116.53 -> 172.31.8.238 TCP 90 [TCP segment of a reassembled PDU]
110   0.468141 172.31.8.238 -> 54.230.116.53 TCP 66 37556 > http [ACK] Seq=97 Ack=269684 Win=494080 Len=0 TSval=1524703 TSecr=1679357730
111   0.468188 54.230.116.53 -> 172.31.8.238 TCP 2962 [TCP segment of a reassembled PDU]
112   0.468193 172.31.8.238 -> 54.230.116.53 TCP 66 37556 > http [ACK] Seq=97 Ack=272580 Win=499840 Len=0 TSval=1524703 TSecr=1679357730
113   0.468704 54.230.116.53 -> 172.31.8.238 TCP 27578 [TCP segment of a reassembled PDU]
114   0.468718 172.31.8.238 -> 54.230.116.53 TCP 66 37556 > http [ACK] Seq=97 Ack=300092 Win=554880 Len=0 TSval=1524704 TSecr=1679357730
115   0.468732 54.230.116.53 -> 172.31.8.238 TCP 5858 [TCP segment of a reassembled PDU]
116   0.468736 172.31.8.238 -> 54.230.116.53 TCP 66 37556 > http [ACK] Seq=97 Ack=305884 Win=566400 Len=0 TSval=1524704 TSecr=1679357730
117   0.468780 54.230.116.53 -> 172.31.8.238 TCP 14546 [TCP segment of a reassembled PDU]
118   0.469035 172.31.8.238 -> 54.230.116.53 TCP 66 37556 > http [ACK] Seq=97 Ack=320364 Win=560896 Len=0 TSval=1524704 TSecr=1679357730
119   0.469431 54.230.116.53 -> 172.31.8.238 TCP 4410 [TCP segment of a reassembled PDU]
120   0.469437 172.31.8.238 -> 54.230.116.53 TCP 66 37556 > http [ACK] Seq=97 Ack=324708 Win=575104 Len=0 TSval=1524704 TSecr=1679357730
121   0.469553 54.230.116.53 -> 172.31.8.238 TCP 23882 [TCP segment of a reassembled PDU]
122   0.469563 172.31.8.238 -> 54.230.116.53 TCP 66 37556 > http [ACK] Seq=97 Ack=348524 Win=599296 Len=0 TSval=1524704 TSecr=1679357730
123   0.551211 54.230.116.53 -> 172.31.8.238 TCP 2962 [TCP segment of a reassembled PDU]
124   0.551241 172.31.8.238 -> 54.230.116.53 TCP 66 37556 > http [ACK] Seq=97 Ack=351420 Win=628608 Len=0 TSval=1524724 TSecr=1679357738
125   0.551250 54.230.116.53 -> 172.31.8.238 TCP 1550 [TCP segment of a reassembled PDU]
126   0.551254 172.31.8.238 -> 54.230.116.53 TCP 66 37556 > http [ACK] Seq=97 Ack=352904 Win=630272 Len=0 TSval=1524724 TSecr=1679357738
127   0.551263 54.230.116.53 -> 172.31.8.238 TCP 2986 [TCP segment of a reassembled PDU]
128   0.551305 172.31.8.238 -> 54.230.116.53 TCP 66 37556 > http [ACK] Seq=97 Ack=355824 Win=631552 Len=0 TSval=1524724 TSecr=1679357738
129   0.551390 54.230.116.53 -> 172.31.8.238 TCP 2962 [TCP segment of a reassembled PDU]
130   0.551396 172.31.8.238 -> 54.230.116.53 TCP 66 37556 > http [ACK] Seq=97 Ack=358720 Win=635008 Len=0 TSval=1524724 TSecr=1679357738
131   0.551447 54.230.116.53 -> 172.31.8.238 TCP 90 [TCP segment of a reassembled PDU]
132   0.551461 172.31.8.238 -> 54.230.116.53 TCP 66 37556 > http [ACK] Seq=97 Ack=358744 Win=636928 Len=0 TSval=1524724 TSecr=1679357738
133   0.551625 54.230.116.53 -> 172.31.8.238 TCP 2962 [TCP segment of a reassembled PDU]
134   0.551641 172.31.8.238 -> 54.230.116.53 TCP 66 37556 > http [ACK] Seq=97 Ack=361640 Win=636928 Len=0 TSval=1524724 TSecr=1679357738
135   0.551736 54.230.116.53 -> 172.31.8.238 TCP 2962 [TCP segment of a reassembled PDU]
136   0.551752 172.31.8.238 -> 54.230.116.53 TCP 66 37556 > http [ACK] Seq=97 Ack=364536 Win=636928 Len=0 TSval=1524724 TSecr=1679357738
137   0.551771 54.230.116.53 -> 172.31.8.238 TCP 114 [TCP segment of a reassembled PDU]
138   0.551787 172.31.8.238 -> 54.230.116.53 TCP 66 37556 > http [ACK] Seq=97 Ack=364584 Win=636928 Len=0 TSval=1524724 TSecr=1679357738
139   0.551930 54.230.116.53 -> 172.31.8.238 TCP 19046 [TCP segment of a reassembled PDU]
140   0.551960 172.31.8.238 -> 54.230.116.53 TCP 66 37556 > http [ACK] Seq=97 Ack=383564 Win=617984 Len=0 TSval=1524724 TSecr=1679357738
141   0.552008 54.230.116.53 -> 172.31.8.238 TCP 15994 [TCP segment of a reassembled PDU]
142   0.552035 172.31.8.238 -> 54.230.116.53 TCP 66 37556 > http [ACK] Seq=97 Ack=399492 Win=636928 Len=0 TSval=1524724 TSecr=1679357738
143   0.552122 54.230.116.53 -> 172.31.8.238 TCP 4410 [TCP segment of a reassembled PDU]
144   0.552245 54.230.116.53 -> 172.31.8.238 TCP 17442 [TCP segment of a reassembled PDU]
145   0.552273 54.230.116.53 -> 172.31.8.238 TCP 4758 [TCP segment of a reassembled PDU]
146   0.552340 172.31.8.238 -> 54.230.116.53 TCP 66 37556 > http [ACK] Seq=97 Ack=425904 Win=610560 Len=0 TSval=1524724 TSecr=1679357738
147   0.552641 54.230.116.53 -> 172.31.8.238 TCP 2962 [TCP segment of a reassembled PDU]
148   0.552647 172.31.8.238 -> 54.230.116.53 TCP 66 37556 > http [ACK] Seq=97 Ack=428800 Win=635008 Len=0 TSval=1524725 TSecr=1679357738
149   0.552799 54.230.116.53 -> 172.31.8.238 TCP 21990 [TCP segment of a reassembled PDU]
150   0.552827 172.31.8.238 -> 54.230.116.53 TCP 66 37556 > http [ACK] Seq=97 Ack=450724 Win=613120 Len=0 TSval=1524725 TSecr=1679357738
151   0.580398 06:c7:b5:04:b8:d0 -> 06:b0:37:46:8f:13 ARP 42 Who has 172.31.0.2?  Tell 172.31.8.238
152   0.580528 06:b0:37:46:8f:13 -> 06:c7:b5:04:b8:d0 ARP 60 172.31.0.2 is at 06:b0:37:46:8f:13
153   0.590928 54.230.116.53 -> 172.31.8.238 TCP 1526 [TCP segment of a reassembled PDU]
154   0.590938 172.31.8.238 -> 54.230.116.53 TCP 66 37556 > http [ACK] Seq=97 Ack=452184 Win=635008 Len=0 TSval=1524734 TSecr=1679357742
155   0.634773 54.230.116.53 -> 172.31.8.238 TCP 2962 [TCP segment of a reassembled PDU]
156   0.634812 172.31.8.238 -> 54.230.116.53 TCP 66 37556 > http [ACK] Seq=97 Ack=455080 Win=635008 Len=0 TSval=1524745 TSecr=1679357746
157   0.634832 54.230.116.53 -> 172.31.8.238 TCP 7306 [TCP segment of a reassembled PDU]
158   0.634882 172.31.8.238 -> 54.230.116.53 TCP 66 37556 > http [ACK] Seq=97 Ack=462320 Win=636928 Len=0 TSval=1524745 TSecr=1679357746
159   0.634916 54.230.116.53 -> 172.31.8.238 TCP 150 [TCP segment of a reassembled PDU]
160   0.634922 54.230.116.53 -> 172.31.8.238 TCP 1526 [TCP segment of a reassembled PDU]
161   0.634936 172.31.8.238 -> 54.230.116.53 TCP 66 37556 > http [ACK] Seq=97 Ack=463864 Win=636928 Len=0 TSval=1524745 TSecr=1679357746
162   0.635003 54.230.116.53 -> 172.31.8.238 TCP 8754 [TCP segment of a reassembled PDU]
163   0.635022 172.31.8.238 -> 54.230.116.53 TCP 66 37556 > http [ACK] Seq=97 Ack=472552 Win=636928 Len=0 TSval=1524745 TSecr=1679357746
164   0.635065 54.230.116.53 -> 172.31.8.238 TCP 138 [TCP segment of a reassembled PDU]
165   0.635071 54.230.116.53 -> 172.31.8.238 TCP 1526 [TCP segment of a reassembled PDU]
166   0.635084 172.31.8.238 -> 54.230.116.53 TCP 66 37556 > http [ACK] Seq=97 Ack=474084 Win=636928 Len=0 TSval=1524745 TSecr=1679357746
167   0.635216 54.230.116.53 -> 172.31.8.238 TCP 15994 [TCP segment of a reassembled PDU]
168   0.635230 54.230.116.53 -> 172.31.8.238 TCP 198 [TCP segment of a reassembled PDU]
169   0.635247 172.31.8.238 -> 54.230.116.53 TCP 66 37556 > http [ACK] Seq=97 Ack=490144 Win=636928 Len=0 TSval=1524745 TSecr=1679357746
170   0.635334 54.230.116.53 -> 172.31.8.238 TCP 1526 [TCP segment of a reassembled PDU]
171   0.635339 54.230.116.53 -> 172.31.8.238 TCP 1526 [TCP segment of a reassembled PDU]
172   0.635353 172.31.8.238 -> 54.230.116.53 TCP 66 37556 > http [ACK] Seq=97 Ack=493064 Win=636928 Len=0 TSval=1524745 TSecr=1679357746
173   0.635509 54.230.116.53 -> 172.31.8.238 TCP 2962 [TCP segment of a reassembled PDU]
174   0.635525 172.31.8.238 -> 54.230.116.53 TCP 66 37556 > http [ACK] Seq=97 Ack=495960 Win=636928 Len=0 TSval=1524745 TSecr=1679357746
175   0.635659 54.230.116.53 -> 172.31.8.238 TCP 2962 [TCP segment of a reassembled PDU]
176   0.635677 172.31.8.238 -> 54.230.116.53 TCP 66 37556 > http [ACK] Seq=97 Ack=498856 Win=636928 Len=0 TSval=1524745 TSecr=1679357747
177   0.635796 54.230.116.53 -> 172.31.8.238 TCP 21786 [TCP segment of a reassembled PDU]
