[Measurement for 1mb at 07:40:51 20.40.2014] 
Tshark:

  1   0.000000 172.31.8.238 -> 172.31.0.2   DNS 89 Standard query 0x5855  A d3796nkzln59xv.cloudfront.net
  2   0.000029 172.31.8.238 -> 172.31.0.2   DNS 89 Standard query 0x329e  AAAA d3796nkzln59xv.cloudfront.net
  3   0.000655   172.31.0.2 -> 172.31.8.238 DNS 217 Standard query response 0x5855  A 54.192.118.219 A 54.192.118.224 A 54.230.119.3 A 54.230.119.55 A 54.230.119.71 A 54.230.119.94 A 54.239.132.55 A 54.239.132.83
  4   0.000674   172.31.0.2 -> 172.31.8.238 DNS 170 Standard query response 0x329e 
  5   0.003929 172.31.8.238 -> 54.192.118.219 TCP 74 44360 > http [SYN] Seq=0 Win=26883 Len=0 MSS=8961 SACK_PERM=1 TSval=13219842 TSecr=0 WS=128
  6   0.004438 54.192.118.219 -> 172.31.8.238 TCP 74 http > 44360 [SYN, ACK] Seq=0 Ack=1 Win=14480 Len=0 MSS=1460 SACK_PERM=1 TSval=1685603048 TSecr=13219842 WS=128
  7   0.004452 172.31.8.238 -> 54.192.118.219 TCP 66 44360 > http [ACK] Seq=1 Ack=1 Win=27008 Len=0 TSval=13219842 TSecr=1685603048
  8   0.004496 172.31.8.238 -> 54.192.118.219 HTTP 162 GET /1mb HTTP/1.1 
  9   0.005171 54.192.118.219 -> 172.31.8.238 TCP 66 http > 44360 [ACK] Seq=1 Ack=97 Win=14592 Len=0 TSval=1685603048 TSecr=13219842
 10   0.007000 54.192.118.219 -> 172.31.8.238 TCP 523 [TCP segment of a reassembled PDU]
 11   0.007007 172.31.8.238 -> 54.192.118.219 TCP 66 44360 > http [ACK] Seq=97 Ack=458 Win=28032 Len=0 TSval=13219843 TSecr=1685603048
 12   0.007216 54.192.118.219 -> 172.31.8.238 TCP 4410 [TCP segment of a reassembled PDU]
 13   0.007224 172.31.8.238 -> 54.192.118.219 TCP 66 44360 > http [ACK] Seq=97 Ack=4802 Win=36736 Len=0 TSval=13219843 TSecr=1685603048
 14   0.007338 54.192.118.219 -> 172.31.8.238 TCP 8754 [TCP segment of a reassembled PDU]
 15   0.007347 172.31.8.238 -> 54.192.118.219 TCP 66 44360 > http [ACK] Seq=97 Ack=13490 Win=54144 Len=0 TSval=13219843 TSecr=1685603048
 16   0.007714 54.192.118.219 -> 172.31.8.238 TCP 4410 [TCP segment of a reassembled PDU]
 17   0.007720 172.31.8.238 -> 54.192.118.219 TCP 66 44360 > http [ACK] Seq=97 Ack=17834 Win=62720 Len=0 TSval=13219843 TSecr=1685603048
 18   0.007812 54.192.118.219 -> 172.31.8.238 TCP 4410 [TCP segment of a reassembled PDU]
 19   0.007818 172.31.8.238 -> 54.192.118.219 TCP 66 44360 > http [ACK] Seq=97 Ack=22178 Win=71424 Len=0 TSval=13219843 TSecr=1685603048
 20   0.007964 54.192.118.219 -> 172.31.8.238 TCP 4410 [TCP segment of a reassembled PDU]
 21   0.007970 172.31.8.238 -> 54.192.118.219 TCP 66 44360 > http [ACK] Seq=97 Ack=26522 Win=80128 Len=0 TSval=13219843 TSecr=1685603048
 22   0.008280 54.192.118.219 -> 172.31.8.238 TCP 10202 [TCP segment of a reassembled PDU]
 23   0.008289 172.31.8.238 -> 54.192.118.219 TCP 66 44360 > http [ACK] Seq=97 Ack=36658 Win=100480 Len=0 TSval=13219843 TSecr=1685603048
 24   0.008321 54.192.118.219 -> 172.31.8.238 TCP 1514 [TCP segment of a reassembled PDU]
 25   0.008325 172.31.8.238 -> 54.192.118.219 TCP 66 44360 > http [ACK] Seq=97 Ack=38106 Win=103296 Len=0 TSval=13219843 TSecr=1685603048
 26   0.008475 54.192.118.219 -> 172.31.8.238 TCP 2962 [TCP segment of a reassembled PDU]
 27   0.008480 172.31.8.238 -> 54.192.118.219 TCP 66 44360 > http [ACK] Seq=97 Ack=41002 Win=109056 Len=0 TSval=13219843 TSecr=1685603048
 28   0.008585 54.192.118.219 -> 172.31.8.238 TCP 8754 [TCP segment of a reassembled PDU]
 29   0.008592 172.31.8.238 -> 54.192.118.219 TCP 66 44360 > http [ACK] Seq=97 Ack=49690 Win=103680 Len=0 TSval=13219843 TSecr=1685603048
 30   0.008733 54.192.118.219 -> 172.31.8.238 TCP 2962 [TCP segment of a reassembled PDU]
 31   0.008738 172.31.8.238 -> 54.192.118.219 TCP 66 44360 > http [ACK] Seq=97 Ack=52586 Win=109056 Len=0 TSval=13219843 TSecr=1685603048
 32   0.008834 54.192.118.219 -> 172.31.8.238 TCP 8754 [TCP segment of a reassembled PDU]
 33   0.008842 172.31.8.238 -> 54.192.118.219 TCP 66 44360 > http [ACK] Seq=97 Ack=61274 Win=103680 Len=0 TSval=13219843 TSecr=1685603048
 34   0.009040 54.192.118.219 -> 172.31.8.238 TCP 4410 [TCP segment of a reassembled PDU]
 35   0.009046 172.31.8.238 -> 54.192.118.219 TCP 66 44360 > http [ACK] Seq=97 Ack=65618 Win=109056 Len=0 TSval=13219843 TSecr=1685603048
 36   0.009163 54.192.118.219 -> 172.31.8.238 TCP 13098 [TCP segment of a reassembled PDU]
 37   0.009172 172.31.8.238 -> 54.192.118.219 TCP 66 44360 > http [ACK] Seq=97 Ack=78650 Win=96512 Len=0 TSval=13219843 TSecr=1685603048
 38   0.009263 54.192.118.219 -> 172.31.8.238 TCP 2962 [TCP segment of a reassembled PDU]
 39   0.009268 172.31.8.238 -> 54.192.118.219 TCP 66 44360 > http [ACK] Seq=97 Ack=81546 Win=109056 Len=0 TSval=13219843 TSecr=1685603048
 40   0.009360 54.192.118.219 -> 172.31.8.238 TCP 10202 [TCP segment of a reassembled PDU]
 41   0.009368 172.31.8.238 -> 54.192.118.219 TCP 66 44360 > http [ACK] Seq=97 Ack=91682 Win=101248 Len=0 TSval=13219843 TSecr=1685603048
 42   0.009747 54.192.118.219 -> 172.31.8.238 TCP 2962 [TCP segment of a reassembled PDU]
 43   0.009752 172.31.8.238 -> 54.192.118.219 TCP 66 44360 > http [ACK] Seq=97 Ack=94578 Win=109056 Len=0 TSval=13219843 TSecr=1685603048
 44   0.009914 54.192.118.219 -> 172.31.8.238 TCP 23234 [TCP segment of a reassembled PDU]
 45   0.009928 172.31.8.238 -> 54.192.118.219 TCP 66 44360 > http [ACK] Seq=97 Ack=117746 Win=85888 Len=0 TSval=13219843 TSecr=1685603048
 46   0.010263 54.192.118.219 -> 172.31.8.238 TCP 1514 [TCP segment of a reassembled PDU]
 47   0.010268 172.31.8.238 -> 54.192.118.219 TCP 66 44360 > http [ACK] Seq=97 Ack=119194 Win=109056 Len=0 TSval=13219843 TSecr=1685603048
 48   0.010405 54.192.118.219 -> 172.31.8.238 TCP 11650 [TCP segment of a reassembled PDU]
 49   0.010414 172.31.8.238 -> 54.192.118.219 TCP 66 44360 > http [ACK] Seq=97 Ack=130778 Win=98944 Len=0 TSval=13219843 TSecr=1685603048
 50   0.010572 54.192.118.219 -> 172.31.8.238 TCP 14546 [TCP segment of a reassembled PDU]
 51   0.010581 172.31.8.238 -> 54.192.118.219 TCP 66 44360 > http [ACK] Seq=97 Ack=145258 Win=84480 Len=0 TSval=13219843 TSecr=1685603048
 52   0.010678 54.192.118.219 -> 172.31.8.238 TCP 2962 [TCP segment of a reassembled PDU]
 53   0.010683 172.31.8.238 -> 54.192.118.219 TCP 66 44360 > http [ACK] Seq=97 Ack=148154 Win=81664 Len=0 TSval=13219843 TSecr=1685603048
 54   0.011066 54.192.118.219 -> 172.31.8.238 TCP 7306 [TCP segment of a reassembled PDU]
 55   0.011074 172.31.8.238 -> 54.192.118.219 TCP 66 44360 > http [ACK] Seq=97 Ack=155394 Win=123520 Len=0 TSval=13219844 TSecr=1685603048
 56   0.011236 54.192.118.219 -> 172.31.8.238 TCP 26130 [TCP segment of a reassembled PDU]
 57   0.011250 172.31.8.238 -> 54.192.118.219 TCP 66 44360 > http [ACK] Seq=97 Ack=181458 Win=175616 Len=0 TSval=13219844 TSecr=1685603048
 58   0.011256 54.192.118.219 -> 172.31.8.238 TCP 1514 [TCP segment of a reassembled PDU]
 59   0.011258 172.31.8.238 -> 54.192.118.219 TCP 66 44360 > http [ACK] Seq=97 Ack=182906 Win=178560 Len=0 TSval=13219844 TSecr=1685603048
 60   0.011518 54.192.118.219 -> 172.31.8.238 TCP 1514 [TCP segment of a reassembled PDU]
 61   0.011523 172.31.8.238 -> 54.192.118.219 TCP 66 44360 > http [ACK] Seq=97 Ack=184354 Win=181504 Len=0 TSval=13219844 TSecr=1685603048
 62   0.011667 54.192.118.219 -> 172.31.8.238 TCP 15994 [TCP segment of a reassembled PDU]
 63   0.011677 172.31.8.238 -> 54.192.118.219 TCP 66 44360 > http [ACK] Seq=97 Ack=200282 Win=213376 Len=0 TSval=13219844 TSecr=1685603048
 64   0.011876 54.192.118.219 -> 172.31.8.238 TCP 21786 [TCP segment of a reassembled PDU]
 65   0.011888 172.31.8.238 -> 54.192.118.219 TCP 66 44360 > http [ACK] Seq=97 Ack=222002 Win=256768 Len=0 TSval=13219844 TSecr=1685603048
 66   0.011979 54.192.118.219 -> 172.31.8.238 TCP 8754 [TCP segment of a reassembled PDU]
 67   0.011987 172.31.8.238 -> 54.192.118.219 TCP 66 44360 > http [ACK] Seq=97 Ack=230690 Win=274176 Len=0 TSval=13219844 TSecr=1685603048
 68   0.012300 54.192.118.219 -> 172.31.8.238 TCP 2962 [TCP segment of a reassembled PDU]
 69   0.012306 172.31.8.238 -> 54.192.118.219 TCP 66 44360 > http [ACK] Seq=97 Ack=233586 Win=279936 Len=0 TSval=13219844 TSecr=1685603048
 70   0.012499 54.192.118.219 -> 172.31.8.238 TCP 26130 [TCP segment of a reassembled PDU]
 71   0.012513 172.31.8.238 -> 54.192.118.219 TCP 66 44360 > http [ACK] Seq=97 Ack=259650 Win=332032 Len=0 TSval=13219844 TSecr=1685603048
 72   0.012560 54.192.118.219 -> 172.31.8.238 TCP 17442 [TCP segment of a reassembled PDU]
 73   0.012570 172.31.8.238 -> 54.192.118.219 TCP 66 44360 > http [ACK] Seq=97 Ack=277026 Win=366848 Len=0 TSval=13219844 TSecr=1685603048
 74   0.013074 54.192.118.219 -> 172.31.8.238 TCP 2962 [TCP segment of a reassembled PDU]
 75   0.013080 172.31.8.238 -> 54.192.118.219 TCP 66 44360 > http [ACK] Seq=97 Ack=279922 Win=372608 Len=0 TSval=13219844 TSecr=1685603048
 76   0.013240 54.192.118.219 -> 172.31.8.238 TCP 21786 [TCP segment of a reassembled PDU]
 77   0.013252 172.31.8.238 -> 54.192.118.219 TCP 66 44360 > http [ACK] Seq=97 Ack=301642 Win=416000 Len=0 TSval=13219844 TSecr=1685603048
 78   0.013317 54.192.118.219 -> 172.31.8.238 TCP 26130 [TCP segment of a reassembled PDU]
 79   0.013331 172.31.8.238 -> 54.192.118.219 TCP 66 44360 > http [ACK] Seq=97 Ack=327706 Win=468224 Len=0 TSval=13219844 TSecr=1685603049
 80   0.013375 54.192.118.219 -> 172.31.8.238 TCP 10202 [TCP segment of a reassembled PDU]
 81   0.013383 172.31.8.238 -> 54.192.118.219 TCP 66 44360 > http [ACK] Seq=97 Ack=337842 Win=488448 Len=0 TSval=13219844 TSecr=1685603049
 82   0.013895 54.192.118.219 -> 172.31.8.238 TCP 8754 [TCP segment of a reassembled PDU]
 83   0.013903 172.31.8.238 -> 54.192.118.219 TCP 66 44360 > http [ACK] Seq=97 Ack=346530 Win=505856 Len=0 TSval=13219844 TSecr=1685603049
 84   0.014068 54.192.118.219 -> 172.31.8.238 TCP 26130 [TCP segment of a reassembled PDU]
 85   0.014082 172.31.8.238 -> 54.192.118.219 TCP 66 44360 > http [ACK] Seq=97 Ack=372594 Win=557952 Len=0 TSval=13219844 TSecr=1685603049
 86   0.014141 54.192.118.219 -> 172.31.8.238 TCP 17442 [TCP segment of a reassembled PDU]
 87   0.014151 172.31.8.238 -> 54.192.118.219 TCP 66 44360 > http [ACK] Seq=97 Ack=389970 Win=592640 Len=0 TSval=13219844 TSecr=1685603049
 88   0.014183 54.192.118.219 -> 172.31.8.238 TCP 2962 [TCP segment of a reassembled PDU]
 89   0.014187 172.31.8.238 -> 54.192.118.219 TCP 66 44360 > http [ACK] Seq=97 Ack=392866 Win=598528 Len=0 TSval=13219844 TSecr=1685603049
 90   0.014651 54.192.118.219 -> 172.31.8.238 TCP 2962 [TCP segment of a reassembled PDU]
 91   0.014657 172.31.8.238 -> 54.192.118.219 TCP 66 44360 > http [ACK] Seq=97 Ack=395762 Win=604288 Len=0 TSval=13219844 TSecr=1685603049
 92   0.014793 54.192.118.219 -> 172.31.8.238 TCP 26130 [TCP segment of a reassembled PDU]
 93   0.014807 172.31.8.238 -> 54.192.118.219 TCP 66 44360 > http [ACK] Seq=97 Ack=421826 Win=656384 Len=0 TSval=13219845 TSecr=1685603049
 94   0.014955 54.192.118.219 -> 172.31.8.238 TCP 27578 [TCP segment of a reassembled PDU]
 95   0.014969 172.31.8.238 -> 54.192.118.219 TCP 66 44360 > http [ACK] Seq=97 Ack=449338 Win=711424 Len=0 TSval=13219845 TSecr=1685603049
 96   0.014976 54.192.118.219 -> 172.31.8.238 TCP 2962 [TCP segment of a reassembled PDU]
 97   0.014980 172.31.8.238 -> 54.192.118.219 TCP 66 44360 > http [ACK] Seq=97 Ack=452234 Win=717184 Len=0 TSval=13219845 TSecr=1685603049
 98   0.014985 54.192.118.219 -> 172.31.8.238 TCP 7306 [TCP segment of a reassembled PDU]
 99   0.014990 172.31.8.238 -> 54.192.118.219 TCP 66 44360 > http [ACK] Seq=97 Ack=459474 Win=731648 Len=0 TSval=13219845 TSecr=1685603049
100   0.015429 54.192.118.219 -> 172.31.8.238 TCP 5858 [TCP segment of a reassembled PDU]
101   0.015436 172.31.8.238 -> 54.192.118.219 TCP 66 44360 > http [ACK] Seq=97 Ack=465266 Win=743296 Len=0 TSval=13219845 TSecr=1685603049
102   0.015615 54.192.118.219 -> 172.31.8.238 TCP 26130 [TCP segment of a reassembled PDU]
103   0.015629 172.31.8.238 -> 54.192.118.219 TCP 66 44360 > http [ACK] Seq=97 Ack=491330 Win=795392 Len=0 TSval=13219845 TSecr=1685603049
104   0.015648 54.192.118.219 -> 172.31.8.238 TCP 5858 [TCP segment of a reassembled PDU]
105   0.015652 172.31.8.238 -> 54.192.118.219 TCP 66 44360 > http [ACK] Seq=97 Ack=497122 Win=807040 Len=0 TSval=13219845 TSecr=1685603049
106   0.015725 54.192.118.219 -> 172.31.8.238 TCP 13098 [TCP segment of a reassembled PDU]
107   0.015732 172.31.8.238 -> 54.192.118.219 TCP 66 44360 > http [ACK] Seq=97 Ack=510154 Win=833024 Len=0 TSval=13219845 TSecr=1685603049
108   0.015826 54.192.118.219 -> 172.31.8.238 TCP 2962 [TCP segment of a reassembled PDU]
109   0.015831 172.31.8.238 -> 54.192.118.219 TCP 66 44360 > http [ACK] Seq=97 Ack=513050 Win=838912 Len=0 TSval=13219845 TSecr=1685603049
110   0.016225 54.192.118.219 -> 172.31.8.238 TCP 20338 [TCP segment of a reassembled PDU]
111   0.016236 172.31.8.238 -> 54.192.118.219 TCP 66 44360 > http [ACK] Seq=97 Ack=533322 Win=879360 Len=0 TSval=13219845 TSecr=1685603049
112   0.016410 54.192.118.219 -> 172.31.8.238 TCP 26130 [TCP segment of a reassembled PDU]
113   0.016423 172.31.8.238 -> 54.192.118.219 TCP 66 44360 > http [ACK] Seq=97 Ack=559386 Win=931584 Len=0 TSval=13219845 TSecr=1685603049
114   0.016532 54.192.118.219 -> 172.31.8.238 TCP 26130 [TCP segment of a reassembled PDU]
115   0.016545 172.31.8.238 -> 54.192.118.219 TCP 66 44360 > http [ACK] Seq=97 Ack=585450 Win=983680 Len=0 TSval=13219845 TSecr=1685603049
116   0.016556 54.192.118.219 -> 172.31.8.238 TCP 10202 [TCP segment of a reassembled PDU]
117   0.016560 172.31.8.238 -> 54.192.118.219 TCP 66 44360 > http [ACK] Seq=97 Ack=595586 Win=1003904 Len=0 TSval=13219845 TSecr=1685603049
118   0.016964 54.192.118.219 -> 172.31.8.238 TCP 4410 [TCP segment of a reassembled PDU]
119   0.016971 172.31.8.238 -> 54.192.118.219 TCP 66 44360 > http [ACK] Seq=97 Ack=599930 Win=1012608 Len=0 TSval=13219845 TSecr=1685603049
120   0.017155 54.192.118.219 -> 172.31.8.238 TCP 21786 [TCP segment of a reassembled PDU]
121   0.017168 172.31.8.238 -> 54.192.118.219 TCP 66 44360 > http [ACK] Seq=97 Ack=621650 Win=1056000 Len=0 TSval=13219845 TSecr=1685603049
122   0.017185 54.192.118.219 -> 172.31.8.238 TCP 4410 [TCP segment of a reassembled PDU]
123   0.017189 172.31.8.238 -> 54.192.118.219 TCP 66 44360 > http [ACK] Seq=97 Ack=625994 Win=1064704 Len=0 TSval=13219845 TSecr=1685603049
124   0.017257 54.192.118.219 -> 172.31.8.238 TCP 10202 [TCP segment of a reassembled PDU]
125   0.017265 172.31.8.238 -> 54.192.118.219 TCP 66 44360 > http [ACK] Seq=97 Ack=636130 Win=1085056 Len=0 TSval=13219845 TSecr=1685603049
126   0.017416 54.192.118.219 -> 172.31.8.238 TCP 26130 [TCP segment of a reassembled PDU]
127   0.017429 172.31.8.238 -> 54.192.118.219 TCP 66 44360 > http [ACK] Seq=97 Ack=662194 Win=1137152 Len=0 TSval=13219845 TSecr=1685603049
128   0.017467 54.192.118.219 -> 172.31.8.238 TCP 14546 [TCP segment of a reassembled PDU]
129   0.017476 172.31.8.238 -> 54.192.118.219 TCP 66 44360 > http [ACK] Seq=97 Ack=676674 Win=1166080 Len=0 TSval=13219845 TSecr=1685603049
130   0.017811 54.192.118.219 -> 172.31.8.238 TCP 20338 [TCP segment of a reassembled PDU]
131   0.017823 172.31.8.238 -> 54.192.118.219 TCP 66 44360 > http [ACK] Seq=97 Ack=696946 Win=1206656 Len=0 TSval=13219845 TSecr=1685603049
132   0.017944 54.192.118.219 -> 172.31.8.238 TCP 1514 [TCP segment of a reassembled PDU]
133   0.017949 172.31.8.238 -> 54.192.118.219 TCP 66 44360 > http [ACK] Seq=97 Ack=698394 Win=1209600 Len=0 TSval=13219845 TSecr=1685603049
134   0.018140 54.192.118.219 -> 172.31.8.238 TCP 26130 [TCP segment of a reassembled PDU]
135   0.018154 172.31.8.238 -> 54.192.118.219 TCP 66 44360 > http [ACK] Seq=97 Ack=724458 Win=1261696 Len=0 TSval=13219845 TSecr=1685603049
136   0.018214 54.192.118.219 -> 172.31.8.238 TCP 26130 [TCP segment of a reassembled PDU]
137   0.018227 172.31.8.238 -> 54.192.118.219 TCP 66 44360 > http [ACK] Seq=97 Ack=750522 Win=1313792 Len=0 TSval=13219845 TSecr=1685603049
138   0.018297 54.192.118.219 -> 172.31.8.238 TCP 26130 [TCP segment of a reassembled PDU]
139   0.018311 172.31.8.238 -> 54.192.118.219 TCP 66 44360 > http [ACK] Seq=97 Ack=776586 Win=1328896 Len=0 TSval=13219845 TSecr=1685603049
140   0.018370 54.192.118.219 -> 172.31.8.238 TCP 23234 [TCP segment of a reassembled PDU]
141   0.018383 172.31.8.238 -> 54.192.118.219 TCP 66 44360 > http [ACK] Seq=97 Ack=799754 Win=1305728 Len=0 TSval=13219845 TSecr=1685603049
142   0.018761 54.192.118.219 -> 172.31.8.238 TCP 5858 [TCP segment of a reassembled PDU]
143   0.018769 172.31.8.238 -> 54.192.118.219 TCP 66 44360 > http [ACK] Seq=97 Ack=805546 Win=1377536 Len=0 TSval=13219846 TSecr=1685603049
144   0.018928 54.192.118.219 -> 172.31.8.238 TCP 26130 [TCP segment of a reassembled PDU]
145   0.018953 172.31.8.238 -> 54.192.118.219 TCP 66 44360 > http [ACK] Seq=97 Ack=831610 Win=1371776 Len=0 TSval=13219846 TSecr=1685603049
146   0.019012 54.192.118.219 -> 172.31.8.238 TCP 26130 [TCP segment of a reassembled PDU]
147   0.019025 172.31.8.238 -> 54.192.118.219 TCP 66 44360 > http [ACK] Seq=97 Ack=857674 Win=1371776 Len=0 TSval=13219846 TSecr=1685603049
148   0.019104 54.192.118.219 -> 172.31.8.238 TCP 26130 [TCP segment of a reassembled PDU]
149   0.019158 54.192.118.219 -> 172.31.8.238 TCP 8754 [TCP segment of a reassembled PDU]
150   0.019211 172.31.8.238 -> 54.192.118.219 TCP 66 44360 > http [ACK] Seq=97 Ack=892426 Win=1337088 Len=0 TSval=13219846 TSecr=1685603049
151   0.019531 54.192.118.219 -> 172.31.8.238 TCP 4410 [TCP segment of a reassembled PDU]
152   0.019537 172.31.8.238 -> 54.192.118.219 TCP 66 44360 > http [ACK] Seq=97 Ack=896770 Win=1386240 Len=0 TSval=13219846 TSecr=1685603049
153   0.019702 54.192.118.219 -> 172.31.8.238 TCP 26130 [TCP segment of a reassembled PDU]
154   0.019727 172.31.8.238 -> 54.192.118.219 TCP 66 44360 > http [ACK] Seq=97 Ack=922834 Win=1371776 Len=0 TSval=13219846 TSecr=1685603049
155   0.019775 54.192.118.219 -> 172.31.8.238 TCP 23234 [TCP segment of a reassembled PDU]
156   0.019788 172.31.8.238 -> 54.192.118.219 TCP 66 44360 > http [ACK] Seq=97 Ack=946002 Win=1376512 Len=0 TSval=13219846 TSecr=1685603049
157   0.019853 54.192.118.219 -> 172.31.8.238 TCP 14546 [TCP segment of a reassembled PDU]
158   0.019862 172.31.8.238 -> 54.192.118.219 TCP 66 44360 > http [ACK] Seq=97 Ack=960482 Win=1390720 Len=0 TSval=13219846 TSecr=1685603049
159   0.019933 54.192.118.219 -> 172.31.8.238 TCP 26130 [TCP segment of a reassembled PDU]
160   0.020007 54.192.118.219 -> 172.31.8.238 TCP 21786 [TCP segment of a reassembled PDU]
161   0.020047 172.31.8.238 -> 54.192.118.219 TCP 66 44360 > http [ACK] Seq=97 Ack=1008266 Win=1342976 Len=0 TSval=13219846 TSecr=1685603049
162   0.020351 54.192.118.219 -> 172.31.8.238 TCP 23234 [TCP segment of a reassembled PDU]
163   0.020364 172.31.8.238 -> 54.192.118.219 TCP 66 44360 > http [ACK] Seq=97 Ack=1031434 Win=1376512 Len=0 TSval=13219846 TSecr=1685603049
164   0.020492 54.192.118.219 -> 172.31.8.238 HTTP 17666 HTTP/1.1 200 OK  (application/octet-stream)
165   0.020503 172.31.8.238 -> 54.192.118.219 TCP 66 44360 > http [ACK] Seq=97 Ack=1049034 Win=1383680 Len=0 TSval=13219846 TSecr=1685603049
166   0.020642 172.31.8.238 -> 54.192.118.219 TCP 66 44360 > http [FIN, ACK] Seq=97 Ack=1049034 Win=1411840 Len=0 TSval=13219846 TSecr=1685603049
167   0.021020 54.192.118.219 -> 172.31.8.238 TCP 66 http > 44360 [FIN, ACK] Seq=1049034 Ack=98 Win=14592 Len=0 TSval=1685603049 TSecr=13219846
168   0.021027 172.31.8.238 -> 54.192.118.219 TCP 66 44360 > http [ACK] Seq=98 Ack=1049035 Win=1411840 Len=0 TSval=13219846 TSecr=1685603049
