[Measurement for 1mb at 17:41:13 19.41.2014] 
Tshark:

  1   0.000000 06:b0:37:46:8f:13 -> 06:c7:b5:04:b8:d0 ARP 60 Who has 172.31.8.238?  Tell 172.31.0.1
  2   0.000021 06:c7:b5:04:b8:d0 -> 06:b0:37:46:8f:13 ARP 42 172.31.8.238 is at 06:c7:b5:04:b8:d0
  3   0.183633 172.31.8.238 -> 172.31.0.2   DNS 89 Standard query 0x8f89  A d3796nkzln59xv.cloudfront.net
  4   0.183681 172.31.8.238 -> 172.31.0.2   DNS 89 Standard query 0x8e2b  AAAA d3796nkzln59xv.cloudfront.net
  5   0.184386   172.31.0.2 -> 172.31.8.238 DNS 217 Standard query response 0x8f89  A 205.251.215.155 A 205.251.215.224 A 54.192.141.180 A 54.192.141.189 A 54.230.140.236 A 54.230.143.14 A 205.251.215.109 A 205.251.215.126
  6   0.184412   172.31.0.2 -> 172.31.8.238 DNS 170 Standard query response 0x8e2b 
  7   0.187487 172.31.8.238 -> 205.251.215.155 TCP 74 55190 > http [SYN] Seq=0 Win=26883 Len=0 MSS=8961 SACK_PERM=1 TSval=625199 TSecr=0 WS=128
  8   0.189522 205.251.215.155 -> 172.31.8.238 TCP 74 http > 55190 [SYN, ACK] Seq=0 Ack=1 Win=14480 Len=0 MSS=1460 SACK_PERM=1 TSval=759188122 TSecr=625199 WS=128
  9   0.189537 172.31.8.238 -> 205.251.215.155 TCP 66 55190 > http [ACK] Seq=1 Ack=1 Win=27008 Len=0 TSval=625199 TSecr=759188122
 10   0.189577 172.31.8.238 -> 205.251.215.155 HTTP 162 GET /1mb HTTP/1.1 
 11   0.191547 205.251.215.155 -> 172.31.8.238 TCP 66 http > 55190 [ACK] Seq=1 Ack=97 Win=14592 Len=0 TSval=759188122 TSecr=625199
 12   0.396048 205.251.215.155 -> 172.31.8.238 TCP 11650 [TCP segment of a reassembled PDU]
 13   0.396076 172.31.8.238 -> 205.251.215.155 TCP 66 55190 > http [ACK] Seq=97 Ack=11585 Win=50176 Len=0 TSval=625251 TSecr=759188142
 14   0.396084 205.251.215.155 -> 172.31.8.238 TCP 185 [TCP segment of a reassembled PDU]
 15   0.396088 172.31.8.238 -> 205.251.215.155 TCP 66 55190 > http [ACK] Seq=97 Ack=11704 Win=50176 Len=0 TSval=625251 TSecr=759188142
 16   0.397653 205.251.215.155 -> 172.31.8.238 TCP 1514 [TCP segment of a reassembled PDU]
 17   0.397660 172.31.8.238 -> 205.251.215.155 TCP 66 55190 > http [ACK] Seq=97 Ack=13152 Win=52992 Len=0 TSval=625251 TSecr=759188143
 18   0.398152 205.251.215.155 -> 172.31.8.238 TCP 378 [TCP segment of a reassembled PDU]
 19   0.398158 172.31.8.238 -> 205.251.215.155 TCP 66 55190 > http [ACK] Seq=97 Ack=13464 Win=55936 Len=0 TSval=625251 TSecr=759188143
 20   0.475377 205.251.215.155 -> 172.31.8.238 TCP 2962 [TCP segment of a reassembled PDU]
 21   0.475388 172.31.8.238 -> 205.251.215.155 TCP 66 55190 > http [ACK] Seq=97 Ack=16360 Win=61696 Len=0 TSval=625271 TSecr=759188150
 22   0.475395 205.251.215.155 -> 172.31.8.238 TCP 90 [TCP segment of a reassembled PDU]
 23   0.475397 172.31.8.238 -> 205.251.215.155 TCP 66 55190 > http [ACK] Seq=97 Ack=16384 Win=61696 Len=0 TSval=625271 TSecr=759188150
 24   0.476344 205.251.215.155 -> 172.31.8.238 TCP 5858 [TCP segment of a reassembled PDU]
 25   0.476351 172.31.8.238 -> 205.251.215.155 TCP 66 55190 > http [ACK] Seq=97 Ack=22176 Win=73344 Len=0 TSval=625271 TSecr=759188150
 26   0.476428 205.251.215.155 -> 172.31.8.238 TCP 1514 [TCP segment of a reassembled PDU]
 27   0.476433 172.31.8.238 -> 205.251.215.155 TCP 66 55190 > http [ACK] Seq=97 Ack=23624 Win=76160 Len=0 TSval=625271 TSecr=759188150
 28   0.477349 205.251.215.155 -> 172.31.8.238 TCP 4410 [TCP segment of a reassembled PDU]
 29   0.477354 172.31.8.238 -> 205.251.215.155 TCP 66 55190 > http [ACK] Seq=97 Ack=27968 Win=84864 Len=0 TSval=625271 TSecr=759188151
 30   0.477433 205.251.215.155 -> 172.31.8.238 TCP 4410 [TCP segment of a reassembled PDU]
 31   0.477439 172.31.8.238 -> 205.251.215.155 TCP 66 55190 > http [ACK] Seq=97 Ack=32312 Win=93568 Len=0 TSval=625271 TSecr=759188151
 32   0.478370 205.251.215.155 -> 172.31.8.238 TCP 1514 [TCP segment of a reassembled PDU]
 33   0.478375 172.31.8.238 -> 205.251.215.155 TCP 66 55190 > http [ACK] Seq=97 Ack=33760 Win=96512 Len=0 TSval=625271 TSecr=759188151
 34   0.478478 205.251.215.155 -> 172.31.8.238 TCP 1514 [TCP segment of a reassembled PDU]
 35   0.478482 172.31.8.238 -> 205.251.215.155 TCP 66 55190 > http [ACK] Seq=97 Ack=35208 Win=99328 Len=0 TSval=625271 TSecr=759188151
 36   0.478618 205.251.215.155 -> 172.31.8.238 TCP 1514 [TCP segment of a reassembled PDU]
 37   0.478635 172.31.8.238 -> 205.251.215.155 TCP 66 55190 > http [ACK] Seq=97 Ack=36656 Win=102272 Len=0 TSval=625271 TSecr=759188151
 38   0.478718 205.251.215.155 -> 172.31.8.238 TCP 5858 [TCP segment of a reassembled PDU]
 39   0.478724 172.31.8.238 -> 205.251.215.155 TCP 66 55190 > http [ACK] Seq=97 Ack=42448 Win=108416 Len=0 TSval=625271 TSecr=759188151
 40   0.479469 205.251.215.155 -> 172.31.8.238 TCP 2962 [TCP segment of a reassembled PDU]
 41   0.479474 172.31.8.238 -> 205.251.215.155 TCP 66 55190 > http [ACK] Seq=97 Ack=45344 Win=114816 Len=0 TSval=625272 TSecr=759188151
 42   0.479553 205.251.215.155 -> 172.31.8.238 TCP 2962 [TCP segment of a reassembled PDU]
 43   0.479558 172.31.8.238 -> 205.251.215.155 TCP 66 55190 > http [ACK] Seq=97 Ack=48240 Win=120704 Len=0 TSval=625272 TSecr=759188151
 44   0.479577 205.251.215.155 -> 172.31.8.238 TCP 138 [TCP segment of a reassembled PDU]
 45   0.479584 172.31.8.238 -> 205.251.215.155 TCP 66 55190 > http [ACK] Seq=97 Ack=48312 Win=120704 Len=0 TSval=625272 TSecr=759188151
 46   0.479650 205.251.215.155 -> 172.31.8.238 TCP 258 [TCP segment of a reassembled PDU]
 47   0.479654 172.31.8.238 -> 205.251.215.155 TCP 66 55190 > http [ACK] Seq=97 Ack=48504 Win=123520 Len=0 TSval=625272 TSecr=759188151
 48   0.560765 205.251.215.155 -> 172.31.8.238 TCP 1526 [TCP segment of a reassembled PDU]
 49   0.560784 172.31.8.238 -> 205.251.215.155 TCP 66 55190 > http [ACK] Seq=97 Ack=49964 Win=126464 Len=0 TSval=625292 TSecr=759188159
 50   0.561089 205.251.215.155 -> 172.31.8.238 TCP 1514 [TCP segment of a reassembled PDU]
 51   0.561095 172.31.8.238 -> 205.251.215.155 TCP 66 55190 > http [ACK] Seq=97 Ack=51412 Win=129408 Len=0 TSval=625292 TSecr=759188159
 52   0.561566 205.251.215.155 -> 172.31.8.238 TCP 2962 [TCP segment of a reassembled PDU]
 53   0.561572 172.31.8.238 -> 205.251.215.155 TCP 66 55190 > http [ACK] Seq=97 Ack=54308 Win=135168 Len=0 TSval=625292 TSecr=759188159
 54   0.561592 205.251.215.155 -> 172.31.8.238 TCP 1514 [TCP segment of a reassembled PDU]
 55   0.561600 172.31.8.238 -> 205.251.215.155 TCP 66 55190 > http [ACK] Seq=97 Ack=55756 Win=137984 Len=0 TSval=625292 TSecr=759188159
 56   0.562283 205.251.215.155 -> 172.31.8.238 TCP 1514 [TCP segment of a reassembled PDU]
 57   0.562291 172.31.8.238 -> 205.251.215.155 TCP 66 55190 > http [ACK] Seq=97 Ack=57204 Win=140928 Len=0 TSval=625292 TSecr=759188159
 58   0.562376 205.251.215.155 -> 172.31.8.238 TCP 126 [TCP segment of a reassembled PDU]
 59   0.562381 172.31.8.238 -> 205.251.215.155 TCP 66 55190 > http [ACK] Seq=97 Ack=57264 Win=140928 Len=0 TSval=625292 TSecr=759188159
 60   0.563575 205.251.215.155 -> 172.31.8.238 TCP 1514 [TCP segment of a reassembled PDU]
 61   0.563580 172.31.8.238 -> 205.251.215.155 TCP 66 55190 > http [ACK] Seq=97 Ack=58712 Win=143872 Len=0 TSval=625293 TSecr=759188159
 62   0.563669 205.251.215.155 -> 172.31.8.238 TCP 5858 [TCP segment of a reassembled PDU]
 63   0.563676 172.31.8.238 -> 205.251.215.155 TCP 66 55190 > http [ACK] Seq=97 Ack=64504 Win=155392 Len=0 TSval=625293 TSecr=759188159
 64   0.563853 205.251.215.155 -> 172.31.8.238 TCP 5858 [TCP segment of a reassembled PDU]
 65   0.563859 172.31.8.238 -> 205.251.215.155 TCP 66 55190 > http [ACK] Seq=97 Ack=70296 Win=167040 Len=0 TSval=625293 TSecr=759188159
 66   0.563883 205.251.215.155 -> 172.31.8.238 TCP 174 [TCP segment of a reassembled PDU]
 67   0.563893 172.31.8.238 -> 205.251.215.155 TCP 66 55190 > http [ACK] Seq=97 Ack=70404 Win=167040 Len=0 TSval=625293 TSecr=759188159
 68   0.567171 205.251.215.155 -> 172.31.8.238 TCP 7306 [TCP segment of a reassembled PDU]
 69   0.567179 172.31.8.238 -> 205.251.215.155 TCP 66 55190 > http [ACK] Seq=97 Ack=77644 Win=181504 Len=0 TSval=625294 TSecr=759188159
 70   0.567270 205.251.215.155 -> 172.31.8.238 TCP 4410 [TCP segment of a reassembled PDU]
 71   0.567276 172.31.8.238 -> 205.251.215.155 TCP 66 55190 > http [ACK] Seq=97 Ack=81988 Win=190208 Len=0 TSval=625294 TSecr=759188159
 72   0.568415 205.251.215.155 -> 172.31.8.238 TCP 1514 [TCP segment of a reassembled PDU]
 73   0.568421 172.31.8.238 -> 205.251.215.155 TCP 66 55190 > http [ACK] Seq=97 Ack=83436 Win=193024 Len=0 TSval=625294 TSecr=759188160
 74   0.568636 205.251.215.155 -> 172.31.8.238 TCP 174 [TCP segment of a reassembled PDU]
 75   0.568656 172.31.8.238 -> 205.251.215.155 TCP 66 55190 > http [ACK] Seq=97 Ack=83544 Win=193024 Len=0 TSval=625294 TSecr=759188160
 76   0.636302 205.251.215.155 -> 172.31.8.238 TCP 5858 [TCP segment of a reassembled PDU]
 77   0.636330 205.251.215.155 -> 172.31.8.238 TCP 1574 [TCP segment of a reassembled PDU]
 78   0.636534 205.251.215.155 -> 172.31.8.238 TCP 2962 [TCP segment of a reassembled PDU]
 79   0.636589 205.251.215.155 -> 172.31.8.238 TCP 2962 [TCP segment of a reassembled PDU]
 80   0.636664 172.31.8.238 -> 205.251.215.155 TCP 66 55190 > http [ACK] Seq=97 Ack=96636 Win=193024 Len=0 TSval=625311 TSecr=759188166
 81   0.637128 205.251.215.155 -> 172.31.8.238 TCP 1514 [TCP segment of a reassembled PDU]
 82   0.637134 172.31.8.238 -> 205.251.215.155 TCP 66 55190 > http [ACK] Seq=97 Ack=98084 Win=195968 Len=0 TSval=625311 TSecr=759188166
 83   0.637624 205.251.215.155 -> 172.31.8.238 TCP 2962 [TCP segment of a reassembled PDU]
 84   0.637631 172.31.8.238 -> 205.251.215.155 TCP 66 55190 > http [ACK] Seq=97 Ack=100980 Win=201728 Len=0 TSval=625311 TSecr=759188167
 85   0.637637 205.251.215.155 -> 172.31.8.238 TCP 1514 [TCP segment of a reassembled PDU]
 86   0.637639 172.31.8.238 -> 205.251.215.155 TCP 66 55190 > http [ACK] Seq=97 Ack=102428 Win=204672 Len=0 TSval=625311 TSecr=759188167
 87   0.637653 205.251.215.155 -> 172.31.8.238 TCP 8754 [TCP segment of a reassembled PDU]
 88   0.637658 172.31.8.238 -> 205.251.215.155 TCP 66 55190 > http [ACK] Seq=97 Ack=111116 Win=222080 Len=0 TSval=625311 TSecr=759188167
 89   0.638872 205.251.215.155 -> 172.31.8.238 TCP 3154 [TCP segment of a reassembled PDU]
 90   0.638877 172.31.8.238 -> 205.251.215.155 TCP 66 55190 > http [ACK] Seq=97 Ack=114204 Win=228224 Len=0 TSval=625311 TSecr=759188167
 91   0.639374 205.251.215.155 -> 172.31.8.238 TCP 1514 [TCP segment of a reassembled PDU]
 92   0.639378 172.31.8.238 -> 205.251.215.155 TCP 66 55190 > http [ACK] Seq=97 Ack=115652 Win=231040 Len=0 TSval=625312 TSecr=759188167
 93   0.639461 205.251.215.155 -> 172.31.8.238 TCP 5858 [TCP segment of a reassembled PDU]
 94   0.639467 172.31.8.238 -> 205.251.215.155 TCP 66 55190 > http [ACK] Seq=97 Ack=121444 Win=242688 Len=0 TSval=625312 TSecr=759188167
 95   0.639890 205.251.215.155 -> 172.31.8.238 TCP 5858 [TCP segment of a reassembled PDU]
 96   0.639896 172.31.8.238 -> 205.251.215.155 TCP 66 55190 > http [ACK] Seq=97 Ack=127236 Win=254208 Len=0 TSval=625312 TSecr=759188167
 97   0.639975 205.251.215.155 -> 172.31.8.238 TCP 5858 [TCP segment of a reassembled PDU]
 98   0.639981 172.31.8.238 -> 205.251.215.155 TCP 66 55190 > http [ACK] Seq=97 Ack=133028 Win=265856 Len=0 TSval=625312 TSecr=759188167
 99   0.640607 205.251.215.155 -> 172.31.8.238 TCP 1514 [TCP segment of a reassembled PDU]
100   0.640612 172.31.8.238 -> 205.251.215.155 TCP 66 55190 > http [ACK] Seq=97 Ack=134476 Win=268800 Len=0 TSval=625312 TSecr=759188167
101   0.641652 205.251.215.155 -> 172.31.8.238 TCP 2962 [TCP segment of a reassembled PDU]
102   0.641670 172.31.8.238 -> 205.251.215.155 TCP 66 55190 > http [ACK] Seq=97 Ack=137372 Win=274560 Len=0 TSval=625312 TSecr=759188167
103   0.641758 205.251.215.155 -> 172.31.8.238 TCP 13398 [TCP segment of a reassembled PDU]
104   0.641767 172.31.8.238 -> 205.251.215.155 TCP 66 55190 > http [ACK] Seq=97 Ack=150704 Win=301184 Len=0 TSval=625312 TSecr=759188167
105   0.720400 205.251.215.155 -> 172.31.8.238 TCP 7366 [TCP segment of a reassembled PDU]
106   0.720417 172.31.8.238 -> 205.251.215.155 TCP 66 55190 > http [ACK] Seq=97 Ack=158004 Win=315776 Len=0 TSval=625332 TSecr=759188175
107   0.721356 205.251.215.155 -> 172.31.8.238 TCP 11650 [TCP segment of a reassembled PDU]
108   0.721366 172.31.8.238 -> 205.251.215.155 TCP 66 55190 > http [ACK] Seq=97 Ack=169588 Win=338944 Len=0 TSval=625332 TSecr=759188175
109   0.721421 205.251.215.155 -> 172.31.8.238 TCP 10202 [TCP segment of a reassembled PDU]
110   0.721429 172.31.8.238 -> 205.251.215.155 TCP 66 55190 > http [ACK] Seq=97 Ack=179724 Win=359296 Len=0 TSval=625332 TSecr=759188175
111   0.721472 205.251.215.155 -> 172.31.8.238 TCP 246 [TCP segment of a reassembled PDU]
112   0.721489 172.31.8.238 -> 205.251.215.155 TCP 66 55190 > http [ACK] Seq=97 Ack=179904 Win=359296 Len=0 TSval=625332 TSecr=759188175
113   0.723587 205.251.215.155 -> 172.31.8.238 TCP 1514 [TCP segment of a reassembled PDU]
114   0.723592 172.31.8.238 -> 205.251.215.155 TCP 66 55190 > http [ACK] Seq=97 Ack=181352 Win=362112 Len=0 TSval=625333 TSecr=759188175
115   0.723697 205.251.215.155 -> 172.31.8.238 TCP 5858 [TCP segment of a reassembled PDU]
116   0.723703 172.31.8.238 -> 205.251.215.155 TCP 66 55190 > http [ACK] Seq=97 Ack=187144 Win=373760 Len=0 TSval=625333 TSecr=759188175
117   0.723946 205.251.215.155 -> 172.31.8.238 TCP 8754 [TCP segment of a reassembled PDU]
118   0.723953 172.31.8.238 -> 205.251.215.155 TCP 66 55190 > http [ACK] Seq=97 Ack=195832 Win=391040 Len=0 TSval=625333 TSecr=759188175
119   0.724977 205.251.215.155 -> 172.31.8.238 TCP 1514 [TCP segment of a reassembled PDU]
120   0.724987 172.31.8.238 -> 205.251.215.155 TCP 66 55190 > http [ACK] Seq=97 Ack=197280 Win=393984 Len=0 TSval=625333 TSecr=759188175
121   0.724996 205.251.215.155 -> 172.31.8.238 TCP 5858 [TCP segment of a reassembled PDU]
122   0.725042 172.31.8.238 -> 205.251.215.155 TCP 66 55190 > http [ACK] Seq=97 Ack=203072 Win=393984 Len=0 TSval=625333 TSecr=759188175
123   0.725412 205.251.215.155 -> 172.31.8.238 TCP 5858 [TCP segment of a reassembled PDU]
124   0.725420 172.31.8.238 -> 205.251.215.155 TCP 66 55190 > http [ACK] Seq=97 Ack=208864 Win=395904 Len=0 TSval=625333 TSecr=759188175
125   0.725774 205.251.215.155 -> 172.31.8.238 TCP 11650 [TCP segment of a reassembled PDU]
126   0.725796 172.31.8.238 -> 205.251.215.155 TCP 66 55190 > http [ACK] Seq=97 Ack=220448 Win=405504 Len=0 TSval=625333 TSecr=759188175
127   0.725873 205.251.215.155 -> 172.31.8.238 TCP 402 [TCP segment of a reassembled PDU]
128   0.725888 172.31.8.238 -> 205.251.215.155 TCP 66 55190 > http [ACK] Seq=97 Ack=220784 Win=405504 Len=0 TSval=625333 TSecr=759188175
129   0.801479 205.251.215.155 -> 172.31.8.238 TCP 1514 [TCP segment of a reassembled PDU]
130   0.801511 205.251.215.155 -> 172.31.8.238 TCP 5858 [TCP segment of a reassembled PDU]
131   0.801539 172.31.8.238 -> 205.251.215.155 TCP 66 55190 > http [ACK] Seq=97 Ack=228024 Win=405504 Len=0 TSval=625352 TSecr=759188183
132   0.801719 205.251.215.155 -> 172.31.8.238 TCP 2962 [TCP segment of a reassembled PDU]
133   0.801735 172.31.8.238 -> 205.251.215.155 TCP 66 55190 > http [ACK] Seq=97 Ack=230920 Win=405504 Len=0 TSval=625352 TSecr=759188183
134   0.801755 205.251.215.155 -> 172.31.8.238 TCP 78 [TCP segment of a reassembled PDU]
135   0.801769 172.31.8.238 -> 205.251.215.155 TCP 66 55190 > http [ACK] Seq=97 Ack=230932 Win=405504 Len=0 TSval=625352 TSecr=759188183
136   0.802483 205.251.215.155 -> 172.31.8.238 TCP 1514 [TCP segment of a reassembled PDU]
137   0.802558 205.251.215.155 -> 172.31.8.238 TCP 10202 [TCP segment of a reassembled PDU]
138   0.802583 172.31.8.238 -> 205.251.215.155 TCP 66 55190 > http [ACK] Seq=97 Ack=242516 Win=405504 Len=0 TSval=625352 TSecr=759188183
139   0.802729 205.251.215.155 -> 172.31.8.238 TCP 4614 [TCP segment of a reassembled PDU]
140   0.802769 172.31.8.238 -> 205.251.215.155 TCP 66 55190 > http [ACK] Seq=97 Ack=247064 Win=405504 Len=0 TSval=625352 TSecr=759188183
141   0.803236 205.251.215.155 -> 172.31.8.238 TCP 2962 [TCP segment of a reassembled PDU]
142   0.803252 172.31.8.238 -> 205.251.215.155 TCP 66 55190 > http [ACK] Seq=97 Ack=249960 Win=405504 Len=0 TSval=625353 TSecr=759188183
143   0.803342 205.251.215.155 -> 172.31.8.238 TCP 10202 [TCP segment of a reassembled PDU]
144   0.803364 172.31.8.238 -> 205.251.215.155 TCP 66 55190 > http [ACK] Seq=97 Ack=260096 Win=405504 Len=0 TSval=625353 TSecr=759188183
145   0.803995 205.251.215.155 -> 172.31.8.238 TCP 4410 [TCP segment of a reassembled PDU]
146   0.804010 172.31.8.238 -> 205.251.215.155 TCP 66 55190 > http [ACK] Seq=97 Ack=264440 Win=405504 Len=0 TSval=625353 TSecr=759188183
147   0.804087 205.251.215.155 -> 172.31.8.238 TCP 2962 [TCP segment of a reassembled PDU]
148   0.804101 172.31.8.238 -> 205.251.215.155 TCP 66 55190 > http [ACK] Seq=97 Ack=267336 Win=405504 Len=0 TSval=625353 TSecr=759188183
149   0.808245 205.251.215.155 -> 172.31.8.238 TCP 1514 [TCP segment of a reassembled PDU]
150   0.808363 205.251.215.155 -> 172.31.8.238 TCP 1514 [TCP segment of a reassembled PDU]
151   0.808378 172.31.8.238 -> 205.251.215.155 TCP 66 55190 > http [ACK] Seq=97 Ack=270232 Win=405504 Len=0 TSval=625354 TSecr=759188184
152   0.808642 205.251.215.155 -> 172.31.8.238 TCP 2962 [TCP segment of a reassembled PDU]
153   0.808658 172.31.8.238 -> 205.251.215.155 TCP 66 55190 > http [ACK] Seq=97 Ack=273128 Win=405504 Len=0 TSval=625354 TSecr=759188184
154   0.808800 205.251.215.155 -> 172.31.8.238 TCP 4410 [TCP segment of a reassembled PDU]
155   0.808818 172.31.8.238 -> 205.251.215.155 TCP 66 55190 > http [ACK] Seq=97 Ack=277472 Win=405504 Len=0 TSval=625354 TSecr=759188184
156   0.809122 205.251.215.155 -> 172.31.8.238 TCP 1514 [TCP segment of a reassembled PDU]
157   0.809392 205.251.215.155 -> 172.31.8.238 TCP 5858 [TCP segment of a reassembled PDU]
158   0.809409 172.31.8.238 -> 205.251.215.155 TCP 66 55190 > http [ACK] Seq=97 Ack=284712 Win=405504 Len=0 TSval=625354 TSecr=759188184
159   0.809512 205.251.215.155 -> 172.31.8.238 TCP 5858 [TCP segment of a reassembled PDU]
160   0.809532 172.31.8.238 -> 205.251.215.155 TCP 66 55190 > http [ACK] Seq=97 Ack=290504 Win=405504 Len=0 TSval=625354 TSecr=759188184
161   0.810402 205.251.215.155 -> 172.31.8.238 TCP 1514 [TCP segment of a reassembled PDU]
162   0.810464 205.251.215.155 -> 172.31.8.238 TCP 7306 [TCP segment of a reassembled PDU]
163   0.810485 172.31.8.238 -> 205.251.215.155 TCP 66 55190 > http [ACK] Seq=97 Ack=299192 Win=405504 Len=0 TSval=625354 TSecr=759188184
164   0.810924 205.251.215.155 -> 172.31.8.238 TCP 7306 [TCP segment of a reassembled PDU]
165   0.810941 172.31.8.238 -> 205.251.215.155 TCP 66 55190 > http [ACK] Seq=97 Ack=306432 Win=405504 Len=0 TSval=625354 TSecr=759188184
166   0.811024 205.251.215.155 -> 172.31.8.238 TCP 2962 [TCP segment of a reassembled PDU]
167   0.811041 172.31.8.238 -> 205.251.215.155 TCP 66 55190 > http [ACK] Seq=97 Ack=309328 Win=405504 Len=0 TSval=625354 TSecr=759188184
168   0.814238 205.251.215.155 -> 172.31.8.238 TCP 1514 [TCP segment of a reassembled PDU]
169   0.814495 205.251.215.155 -> 172.31.8.238 TCP 1514 [TCP segment of a reassembled PDU]
170   0.814510 172.31.8.238 -> 205.251.215.155 TCP 66 55190 > http [ACK] Seq=97 Ack=312224 Win=405504 Len=0 TSval=625355 TSecr=759188184
171   0.814637 205.251.215.155 -> 172.31.8.238 TCP 13098 [TCP segment of a reassembled PDU]
172   0.814662 172.31.8.238 -> 205.251.215.155 TCP 66 55190 > http [ACK] Seq=97 Ack=325256 Win=405504 Len=0 TSval=625355 TSecr=759188184
173   0.814669 205.251.215.155 -> 172.31.8.238 TCP 714 [TCP segment of a reassembled PDU]
174   0.814684 172.31.8.238 -> 205.251.215.155 TCP 66 55190 > http [ACK] Seq=97 Ack=325904 Win=405504 Len=0 TSval=625355 TSecr=759188184
175   0.885748 205.251.215.155 -> 172.31.8.238 TCP 4410 [TCP segment of a reassembled PDU]
176   0.885770 205.251.215.155 -> 172.31.8.238 TCP 4410 [TCP segment of a reassembled PDU]
177   0.885863 205.251.215.155 -> 172.31.8.238 TCP 1514 [TCP segment of a reassembled PDU]
178   0.885988 205.251.215.155 -> 172.31.8.238 TCP 24970 [TCP segment of a reassembled PDU]
179   0.886152 172.31.8.238 -> 205.251.215.155 TCP 66 55190 > http [ACK] Seq=97 Ack=360944 Win=370560 Len=0 TSval=625373 TSecr=759188191
180   0.892845 205.251.215.155 -> 172.31.8.238 TCP 7306 [TCP segment of a reassembled PDU]
181   0.892854 172.31.8.238 -> 205.251.215.155 TCP 66 55190 > http [ACK] Seq=97 Ack=368184 Win=393600 Len=0 TSval=625375 TSecr=759188192
182   0.892903 205.251.215.155 -> 172.31.8.238 TCP 8754 [TCP segment of a reassembled PDU]
183   0.892916 172.31.8.238 -> 205.251.215.155 TCP 66 55190 > http [ACK] Seq=97 Ack=376872 Win=405504 Len=0 TSval=625375 TSecr=759188192
184   0.893079 205.251.215.155 -> 172.31.8.238 TCP 14546 [TCP segment of a reassembled PDU]
185   0.893106 172.31.8.238 -> 205.251.215.155 TCP 66 55190 > http [ACK] Seq=97 Ack=391352 Win=405504 Len=0 TSval=625375 TSecr=759188192
186   0.893358 205.251.215.155 -> 172.31.8.238 TCP 5858 [TCP segment of a reassembled PDU]
187   0.893375 172.31.8.238 -> 205.251.215.155 TCP 66 55190 > http [ACK] Seq=97 Ack=397144 Win=405504 Len=0 TSval=625375 TSecr=759188192
188   0.893475 205.251.215.155 -> 172.31.8.238 TCP 13098 [TCP segment of a reassembled PDU]
189   0.893499 172.31.8.238 -> 205.251.215.155 TCP 66 55190 > http [ACK] Seq=97 Ack=410176 Win=405504 Len=0 TSval=625375 TSecr=759188192
190   0.899703 205.251.215.155 -> 172.31.8.238 TCP 1514 [TCP segment of a reassembled PDU]
191   0.899959 205.251.215.155 -> 172.31.8.238 TCP 2962 [TCP segment of a reassembled PDU]
192   0.899976 172.31.8.238 -> 205.251.215.155 TCP 66 55190 > http [ACK] Seq=97 Ack=414520 Win=405504 Len=0 TSval=625377 TSecr=759188193
193   0.900217 205.251.215.155 -> 172.31.8.238 TCP 7306 [TCP segment of a reassembled PDU]
194   0.900235 172.31.8.238 -> 205.251.215.155 TCP 66 55190 > http [ACK] Seq=97 Ack=421760 Win=405504 Len=0 TSval=625377 TSecr=759188193
195   0.900320 205.251.215.155 -> 172.31.8.238 TCP 9330 [TCP segment of a reassembled PDU]
196   0.900355 172.31.8.238 -> 205.251.215.155 TCP 66 55190 > http [ACK] Seq=97 Ack=431024 Win=405504 Len=0 TSval=625377 TSecr=759188193
197   0.967570 205.251.215.155 -> 172.31.8.238 TCP 1514 [TCP segment of a reassembled PDU]
198   0.967616 205.251.215.155 -> 172.31.8.238 TCP 5858 [TCP segment of a reassembled PDU]
199   0.967635 172.31.8.238 -> 205.251.215.155 TCP 66 55190 > http [ACK] Seq=97 Ack=438264 Win=405504 Len=0 TSval=625394 TSecr=759188200
200   0.967644 205.251.215.155 -> 172.31.8.238 TCP 126 [TCP segment of a reassembled PDU]
201   0.967673 172.31.8.238 -> 205.251.215.155 TCP 66 55190 > http [ACK] Seq=97 Ack=438324 Win=405504 Len=0 TSval=625394 TSecr=759188200
202   0.967982 205.251.215.155 -> 172.31.8.238 TCP 1514 [TCP segment of a reassembled PDU]
203   0.968253 205.251.215.155 -> 172.31.8.238 TCP 2962 [TCP segment of a reassembled PDU]
204   0.968271 172.31.8.238 -> 205.251.215.155 TCP 66 55190 > http [ACK] Seq=97 Ack=442668 Win=405504 Len=0 TSval=625394 TSecr=759188200
205   0.968532 205.251.215.155 -> 172.31.8.238 TCP 4410 [TCP segment of a reassembled PDU]
206   0.968551 172.31.8.238 -> 205.251.215.155 TCP 66 55190 > http [ACK] Seq=97 Ack=447012 Win=405504 Len=0 TSval=625394 TSecr=759188200
207   0.969262 205.251.215.155 -> 172.31.8.238 TCP 1514 [TCP segment of a reassembled PDU]
208   0.969540 205.251.215.155 -> 172.31.8.238 TCP 1514 [TCP segment of a reassembled PDU]
209   0.969554 172.31.8.238 -> 205.251.215.155 TCP 66 55190 > http [ACK] Seq=97 Ack=449908 Win=405504 Len=0 TSval=625394 TSecr=759188200
210   0.972350 205.251.215.155 -> 172.31.8.238 TCP 2962 [TCP segment of a reassembled PDU]
211   0.972490 205.251.215.155 -> 172.31.8.238 TCP 5858 [TCP segment of a reassembled PDU]
212   0.972539 205.251.215.155 -> 172.31.8.238 TCP 234 [TCP segment of a reassembled PDU]
213   0.972700 172.31.8.238 -> 205.251.215.155 TCP 66 55190 > http [ACK] Seq=97 Ack=458764 Win=405504 Len=0 TSval=625395 TSecr=759188200
214   0.973109 205.251.215.155 -> 172.31.8.238 TCP 2962 [TCP segment of a reassembled PDU]
215   0.973127 172.31.8.238 -> 205.251.215.155 TCP 66 55190 > http [ACK] Seq=97 Ack=461660 Win=405504 Len=0 TSval=625395 TSecr=759188200
216   0.973217 205.251.215.155 -> 172.31.8.238 TCP 4410 [TCP segment of a reassembled PDU]
217   0.973235 172.31.8.238 -> 205.251.215.155 TCP 66 55190 > http [ACK] Seq=97 Ack=466004 Win=405504 Len=0 TSval=625395 TSecr=759188200
218   0.973369 205.251.215.155 -> 172.31.8.238 TCP 2962 [TCP segment of a reassembled PDU]
219   0.973385 172.31.8.238 -> 205.251.215.155 TCP 66 55190 > http [ACK] Seq=97 Ack=468900 Win=405504 Len=0 TSval=625395 TSecr=759188200
220   0.973650 205.251.215.155 -> 172.31.8.238 TCP 4410 [TCP segment of a reassembled PDU]
221   0.973683 172.31.8.238 -> 205.251.215.155 TCP 66 55190 > http [ACK] Seq=97 Ack=473244 Win=405504 Len=0 TSval=625395 TSecr=759188200
222   0.973906 205.251.215.155 -> 172.31.8.238 TCP 186 [TCP segment of a reassembled PDU]
223   0.973922 172.31.8.238 -> 205.251.215.155 TCP 66 55190 > http [ACK] Seq=97 Ack=473364 Win=405504 Len=0 TSval=625395 TSecr=759188200
224   0.982851 205.251.215.155 -> 172.31.8.238 TCP 1514 [TCP segment of a reassembled PDU]
225   0.983088 205.251.215.155 -> 172.31.8.238 TCP 5858 [TCP segment of a reassembled PDU]
226   0.983105 172.31.8.238 -> 205.251.215.155 TCP 66 55190 > http [ACK] Seq=97 Ack=480604 Win=405504 Len=0 TSval=625398 TSecr=759188201
227   0.983194 205.251.215.155 -> 172.31.8.238 TCP 10202 [TCP segment of a reassembled PDU]
228   0.983218 172.31.8.238 -> 205.251.215.155 TCP 66 55190 > http [ACK] Seq=97 Ack=490740 Win=405504 Len=0 TSval=625398 TSecr=759188201
229   0.983230 205.251.215.155 -> 172.31.8.238 TCP 2962 [TCP segment of a reassembled PDU]
230   0.983241 172.31.8.238 -> 205.251.215.155 TCP 66 55190 > http [ACK] Seq=97 Ack=493636 Win=405504 Len=0 TSval=625398 TSecr=759188201
231   0.985644 205.251.215.155 -> 172.31.8.238 TCP 1514 [TCP segment of a reassembled PDU]
232   0.985707 205.251.215.155 -> 172.31.8.238 TCP 5858 [TCP segment of a reassembled PDU]
233   0.985726 172.31.8.238 -> 205.251.215.155 TCP 66 55190 > http [ACK] Seq=97 Ack=500876 Win=405504 Len=0 TSval=625398 TSecr=759188201
234   0.986017 205.251.215.155 -> 172.31.8.238 TCP 13098 [TCP segment of a reassembled PDU]
235   0.986057 172.31.8.238 -> 205.251.215.155 TCP 66 55190 > http [ACK] Seq=97 Ack=513908 Win=405504 Len=0 TSval=625398 TSecr=759188201
236   0.992894 205.251.215.155 -> 172.31.8.238 TCP 1514 [TCP segment of a reassembled PDU]
237   0.993094 205.251.215.155 -> 172.31.8.238 TCP 2962 [TCP segment of a reassembled PDU]
238   0.993111 172.31.8.238 -> 205.251.215.155 TCP 66 55190 > http [ACK] Seq=97 Ack=518252 Win=405504 Len=0 TSval=625400 TSecr=759188202
239   0.993202 205.251.215.155 -> 172.31.8.238 TCP 7306 [TCP segment of a reassembled PDU]
240   0.993223 172.31.8.238 -> 205.251.215.155 TCP 66 55190 > http [ACK] Seq=97 Ack=525492 Win=405504 Len=0 TSval=625400 TSecr=759188202
241   0.993261 205.251.215.155 -> 172.31.8.238 TCP 10202 [TCP segment of a reassembled PDU]
242   0.993287 172.31.8.238 -> 205.251.215.155 TCP 66 55190 > http [ACK] Seq=97 Ack=535628 Win=405504 Len=0 TSval=625400 TSecr=759188202
243   0.993603 205.251.215.155 -> 172.31.8.238 TCP 582 [TCP segment of a reassembled PDU]
244   0.993619 172.31.8.238 -> 205.251.215.155 TCP 66 55190 > http [ACK] Seq=97 Ack=536144 Win=405504 Len=0 TSval=625400 TSecr=759188202
245   1.046383 205.251.215.155 -> 172.31.8.238 TCP 1514 [TCP segment of a reassembled PDU]
246   1.046652 205.251.215.155 -> 172.31.8.238 TCP 1514 [TCP segment of a reassembled PDU]
247   1.046671 172.31.8.238 -> 205.251.215.155 TCP 66 55190 > http [ACK] Seq=97 Ack=539040 Win=405504 Len=0 TSval=625413 TSecr=759188207
248   1.046692 205.251.215.155 -> 172.31.8.238 TCP 1514 [TCP segment of a reassembled PDU]
249   1.046885 205.251.215.155 -> 172.31.8.238 TCP 78 [TCP segment of a reassembled PDU]
250   1.046900 172.31.8.238 -> 205.251.215.155 TCP 66 55190 > http [ACK] Seq=97 Ack=540500 Win=405504 Len=0 TSval=625413 TSecr=759188207
251   1.047643 205.251.215.155 -> 172.31.8.238 TCP 1514 [TCP segment of a reassembled PDU]
252   1.047867 205.251.215.155 -> 172.31.8.238 TCP 1514 [TCP segment of a reassembled PDU]
253   1.047882 172.31.8.238 -> 205.251.215.155 TCP 66 55190 > http [ACK] Seq=97 Ack=543396 Win=405504 Len=0 TSval=625414 TSecr=759188208
254   1.047917 205.251.215.155 -> 172.31.8.238 TCP 114 [TCP segment of a reassembled PDU]
255   1.047945 172.31.8.238 -> 205.251.215.155 TCP 66 55190 > http [ACK] Seq=97 Ack=543444 Win=405504 Len=0 TSval=625414 TSecr=759188208
256   1.048131 205.251.215.155 -> 172.31.8.238 TCP 1514 [TCP segment of a reassembled PDU]
257   1.048187 205.251.215.155 -> 172.31.8.238 TCP 5858 [TCP segment of a reassembled PDU]
258   1.048220 172.31.8.238 -> 205.251.215.155 TCP 66 55190 > http [ACK] Seq=97 Ack=550684 Win=405504 Len=0 TSval=625414 TSecr=759188208
259   1.048461 205.251.215.155 -> 172.31.8.238 TCP 1514 [TCP segment of a reassembled PDU]
260   1.048648 205.251.215.155 -> 172.31.8.238 TCP 2962 [TCP segment of a reassembled PDU]
261   1.048664 172.31.8.238 -> 205.251.215.155 TCP 66 55190 > http [ACK] Seq=97 Ack=555028 Win=405504 Len=0 TSval=625414 TSecr=759188208
262   1.048758 205.251.215.155 -> 172.31.8.238 TCP 4410 [TCP segment of a reassembled PDU]
263   1.048780 172.31.8.238 -> 205.251.215.155 TCP 66 55190 > http [ACK] Seq=97 Ack=559372 Win=405504 Len=0 TSval=625414 TSecr=759188208
264   1.049451 205.251.215.155 -> 172.31.8.238 TCP 1514 [TCP segment of a reassembled PDU]
265   1.049495 205.251.215.155 -> 172.31.8.238 TCP 2962 [TCP segment of a reassembled PDU]
266   1.049510 172.31.8.238 -> 205.251.215.155 TCP 66 55190 > http [ACK] Seq=97 Ack=563716 Win=405504 Len=0 TSval=625414 TSecr=759188208
267   1.049780 205.251.215.155 -> 172.31.8.238 TCP 2962 [TCP segment of a reassembled PDU]
268   1.049796 172.31.8.238 -> 205.251.215.155 TCP 66 55190 > http [ACK] Seq=97 Ack=566612 Win=405504 Len=0 TSval=625414 TSecr=759188208
269   1.049824 205.251.215.155 -> 172.31.8.238 TCP 2962 [TCP segment of a reassembled PDU]
270   1.049839 172.31.8.238 -> 205.251.215.155 TCP 66 55190 > http [ACK] Seq=97 Ack=569508 Win=405504 Len=0 TSval=625414 TSecr=759188208
271   1.049878 205.251.215.155 -> 172.31.8.238 TCP 210 [TCP segment of a reassembled PDU]
272   1.049892 172.31.8.238 -> 205.251.215.155 TCP 66 55190 > http [ACK] Seq=97 Ack=569652 Win=405504 Len=0 TSval=625414 TSecr=759188208
273   1.057404 205.251.215.155 -> 172.31.8.238 TCP 2962 [TCP segment of a reassembled PDU]
274   1.057600 205.251.215.155 -> 172.31.8.238 TCP 2962 [TCP segment of a reassembled PDU]
275   1.057666 205.251.215.155 -> 172.31.8.238 TCP 11650 [TCP segment of a reassembled PDU]
276   1.057733 172.31.8.238 -> 205.251.215.155 TCP 66 55190 > http [ACK] Seq=97 Ack=587028 Win=388224 Len=0 TSval=625416 TSecr=759188209
277   1.059185 205.251.215.155 -> 172.31.8.238 TCP 1514 [TCP segment of a reassembled PDU]
278   1.059419 205.251.215.155 -> 172.31.8.238 TCP 5858 [TCP segment of a reassembled PDU]
279   1.059426 172.31.8.238 -> 205.251.215.155 TCP 66 55190 > http [ACK] Seq=97 Ack=594268 Win=395904 Len=0 TSval=625417 TSecr=759188209
280   1.059761 205.251.215.155 -> 172.31.8.238 TCP 14546 [TCP segment of a reassembled PDU]
281   1.059780 172.31.8.238 -> 205.251.215.155 TCP 66 55190 > http [ACK] Seq=97 Ack=608748 Win=405504 Len=0 TSval=625417 TSecr=759188209
282   1.065592 205.251.215.155 -> 172.31.8.238 TCP 4410 [TCP segment of a reassembled PDU]
283   1.065614 172.31.8.238 -> 205.251.215.155 TCP 66 55190 > http [ACK] Seq=97 Ack=613092 Win=405504 Len=0 TSval=625418 TSecr=759188209
284   1.065910 205.251.215.155 -> 172.31.8.238 TCP 11650 [TCP segment of a reassembled PDU]
285   1.065933 172.31.8.238 -> 205.251.215.155 TCP 66 55190 > http [ACK] Seq=97 Ack=624676 Win=405504 Len=0 TSval=625418 TSecr=759188209
286   1.066049 205.251.215.155 -> 172.31.8.238 TCP 1514 [TCP segment of a reassembled PDU]
287   1.069890 205.251.215.155 -> 172.31.8.238 TCP 1514 [TCP segment of a reassembled PDU]
288   1.069911 172.31.8.238 -> 205.251.215.155 TCP 66 55190 > http [ACK] Seq=97 Ack=627572 Win=405504 Len=0 TSval=625419 TSecr=759188209
289   1.069942 205.251.215.155 -> 172.31.8.238 TCP 5858 [TCP segment of a reassembled PDU]
290   1.069964 172.31.8.238 -> 205.251.215.155 TCP 66 55190 > http [ACK] Seq=97 Ack=633364 Win=405504 Len=0 TSval=625419 TSecr=759188210
291   1.070403 205.251.215.155 -> 172.31.8.238 TCP 4410 [TCP segment of a reassembled PDU]
292   1.070420 172.31.8.238 -> 205.251.215.155 TCP 66 55190 > http [ACK] Seq=97 Ack=637708 Win=405504 Len=0 TSval=625419 TSecr=759188210
293   1.070533 205.251.215.155 -> 172.31.8.238 TCP 3622 [TCP segment of a reassembled PDU]
294   1.070551 172.31.8.238 -> 205.251.215.155 TCP 66 55190 > http [ACK] Seq=97 Ack=641264 Win=405504 Len=0 TSval=625419 TSecr=759188210
295   1.132832 205.251.215.155 -> 172.31.8.238 TCP 4410 [TCP segment of a reassembled PDU]
296   1.132892 172.31.8.238 -> 205.251.215.155 TCP 66 55190 > http [ACK] Seq=97 Ack=645608 Win=405504 Len=0 TSval=625435 TSecr=759188216
297   1.132997 205.251.215.155 -> 172.31.8.238 TCP 2962 [TCP segment of a reassembled PDU]
298   1.133019 172.31.8.238 -> 205.251.215.155 TCP 66 55190 > http [ACK] Seq=97 Ack=648504 Win=405504 Len=0 TSval=625435 TSecr=759188216
299   1.133041 205.251.215.155 -> 172.31.8.238 TCP 1514 [TCP segment of a reassembled PDU]
300   1.133215 205.251.215.155 -> 172.31.8.238 TCP 138 [TCP segment of a reassembled PDU]
301   1.133234 172.31.8.238 -> 205.251.215.155 TCP 66 55190 > http [ACK] Seq=97 Ack=650024 Win=405504 Len=0 TSval=625435 TSecr=759188216
302   1.133492 205.251.215.155 -> 172.31.8.238 TCP 7306 [TCP segment of a reassembled PDU]
303   1.133513 172.31.8.238 -> 205.251.215.155 TCP 66 55190 > http [ACK] Seq=97 Ack=657264 Win=405504 Len=0 TSval=625435 TSecr=759188216
304   1.133541 205.251.215.155 -> 172.31.8.238 TCP 1586 [TCP segment of a reassembled PDU]
305   1.133558 172.31.8.238 -> 205.251.215.155 TCP 66 55190 > http [ACK] Seq=97 Ack=658784 Win=405504 Len=0 TSval=625435 TSecr=759188216
306   1.133724 205.251.215.155 -> 172.31.8.238 TCP 2962 [TCP segment of a reassembled PDU]
307   1.133741 172.31.8.238 -> 205.251.215.155 TCP 66 55190 > http [ACK] Seq=97 Ack=661680 Win=405504 Len=0 TSval=625435 TSecr=759188216
308   1.133827 205.251.215.155 -> 172.31.8.238 TCP 5858 [TCP segment of a reassembled PDU]
309   1.133860 172.31.8.238 -> 205.251.215.155 TCP 66 55190 > http [ACK] Seq=97 Ack=667472 Win=405504 Len=0 TSval=625435 TSecr=759188216
310   1.134731 205.251.215.155 -> 172.31.8.238 TCP 138 [TCP segment of a reassembled PDU]
311   1.134746 172.31.8.238 -> 205.251.215.155 TCP 66 55190 > http [ACK] Seq=97 Ack=667544 Win=405504 Len=0 TSval=625435 TSecr=759188216
312   1.137350 205.251.215.155 -> 172.31.8.238 TCP 4410 [TCP segment of a reassembled PDU]
313   1.137374 172.31.8.238 -> 205.251.215.155 TCP 66 55190 > http [ACK] Seq=97 Ack=671888 Win=405504 Len=0 TSval=625436 TSecr=759188217
314   1.137411 205.251.215.155 -> 172.31.8.238 TCP 1514 [TCP segment of a reassembled PDU]
315   1.137591 205.251.215.155 -> 172.31.8.238 TCP 1514 [TCP segment of a reassembled PDU]
316   1.137611 172.31.8.238 -> 205.251.215.155 TCP 66 55190 > http [ACK] Seq=97 Ack=674784 Win=405504 Len=0 TSval=625436 TSecr=759188217
317   1.137681 205.251.215.155 -> 172.31.8.238 TCP 5858 [TCP segment of a reassembled PDU]
318   1.137712 172.31.8.238 -> 205.251.215.155 TCP 66 55190 > http [ACK] Seq=97 Ack=680576 Win=405504 Len=0 TSval=625436 TSecr=759188217
319   1.137873 205.251.215.155 -> 172.31.8.238 TCP 7306 [TCP segment of a reassembled PDU]
320   1.137896 172.31.8.238 -> 205.251.215.155 TCP 66 55190 > http [ACK] Seq=97 Ack=687816 Win=405504 Len=0 TSval=625436 TSecr=759188217
321   1.145809 205.251.215.155 -> 172.31.8.238 TCP 1514 [TCP segment of a reassembled PDU]
322   1.145886 205.251.215.155 -> 172.31.8.238 TCP 8754 [TCP segment of a reassembled PDU]
323   1.146054 205.251.215.155 -> 172.31.8.238 TCP 7306 [TCP segment of a reassembled PDU]
324   1.146113 205.251.215.155 -> 172.31.8.238 TCP 2962 [TCP segment of a reassembled PDU]
325   1.146263 172.31.8.238 -> 205.251.215.155 TCP 66 55190 > http [ACK] Seq=97 Ack=708088 Win=388864 Len=0 TSval=625438 TSecr=759188217
326   1.149130 205.251.215.155 -> 172.31.8.238 TCP 1514 [TCP segment of a reassembled PDU]
327   1.149207 205.251.215.155 -> 172.31.8.238 TCP 5858 [TCP segment of a reassembled PDU]
328   1.149213 172.31.8.238 -> 205.251.215.155 TCP 66 55190 > http [ACK] Seq=97 Ack=715328 Win=395904 Len=0 TSval=625439 TSecr=759188218
329   1.149370 205.251.215.155 -> 172.31.8.238 TCP 8754 [TCP segment of a reassembled PDU]
330   1.149389 172.31.8.238 -> 205.251.215.155 TCP 66 55190 > http [ACK] Seq=97 Ack=724016 Win=405504 Len=0 TSval=625439 TSecr=759188218
331   1.149462 205.251.215.155 -> 172.31.8.238 TCP 1514 [TCP segment of a reassembled PDU]
332   1.157352 205.251.215.155 -> 172.31.8.238 TCP 7306 [TCP segment of a reassembled PDU]
333   1.157375 172.31.8.238 -> 205.251.215.155 TCP 66 55190 > http [ACK] Seq=97 Ack=732704 Win=405504 Len=0 TSval=625441 TSecr=759188218
334   1.158588 205.251.215.155 -> 172.31.8.238 TCP 7306 [TCP segment of a reassembled PDU]
335   1.158607 172.31.8.238 -> 205.251.215.155 TCP 66 55190 > http [ACK] Seq=97 Ack=739944 Win=405504 Len=0 TSval=625441 TSecr=759188219
336   1.158703 205.251.215.155 -> 172.31.8.238 TCP 9426 [TCP segment of a reassembled PDU]
337   1.158737 172.31.8.238 -> 205.251.215.155 TCP 66 55190 > http [ACK] Seq=97 Ack=749304 Win=405504 Len=0 TSval=625441 TSecr=759188219
338   1.208356 205.251.215.155 -> 172.31.8.238 TCP 1526 [TCP segment of a reassembled PDU]
339   1.208376 172.31.8.238 -> 205.251.215.155 TCP 66 55190 > http [ACK] Seq=97 Ack=750764 Win=405504 Len=0 TSval=625454 TSecr=759188224
340   1.208934 205.251.215.155 -> 172.31.8.238 TCP 1514 [TCP segment of a reassembled PDU]
341   1.208944 205.251.215.155 -> 172.31.8.238 TCP 5858 [TCP segment of a reassembled PDU]
342   1.208955 205.251.215.155 -> 172.31.8.238 TCP 126 [TCP segment of a reassembled PDU]
343   1.208965 172.31.8.238 -> 205.251.215.155 TCP 66 55190 > http [ACK] Seq=97 Ack=758064 Win=405504 Len=0 TSval=625454 TSecr=759188224
344   1.210068 205.251.215.155 -> 172.31.8.238 TCP 5858 [TCP segment of a reassembled PDU]
345   1.210087 172.31.8.238 -> 205.251.215.155 TCP 66 55190 > http [ACK] Seq=97 Ack=763856 Win=405504 Len=0 TSval=625454 TSecr=759188224
346   1.210169 205.251.215.155 -> 172.31.8.238 TCP 2962 [TCP segment of a reassembled PDU]
347   1.210180 205.251.215.155 -> 172.31.8.238 TCP 138 [TCP segment of a reassembled PDU]
348   1.210189 172.31.8.238 -> 205.251.215.155 TCP 66 55190 > http [ACK] Seq=97 Ack=766824 Win=405504 Len=0 TSval=625454 TSecr=759188224
349   1.210389 205.251.215.155 -> 172.31.8.238 TCP 1514 [TCP segment of a reassembled PDU]
350   1.210434 205.251.215.155 -> 172.31.8.238 TCP 2962 [TCP segment of a reassembled PDU]
351   1.210450 172.31.8.238 -> 205.251.215.155 TCP 66 55190 > http [ACK] Seq=97 Ack=771168 Win=405504 Len=0 TSval=625454 TSecr=759188224
352   1.210564 205.251.215.155 -> 172.31.8.238 TCP 4410 [TCP segment of a reassembled PDU]
353   1.210580 172.31.8.238 -> 205.251.215.155 TCP 66 55190 > http [ACK] Seq=97 Ack=775512 Win=405504 Len=0 TSval=625454 TSecr=759188224
354   1.210599 205.251.215.155 -> 172.31.8.238 TCP 138 [TCP segment of a reassembled PDU]
355   1.210612 172.31.8.238 -> 205.251.215.155 TCP 66 55190 > http [ACK] Seq=97 Ack=775584 Win=405504 Len=0 TSval=625454 TSecr=759188224
356   1.210920 205.251.215.155 -> 172.31.8.238 TCP 11650 [TCP segment of a reassembled PDU]
357   1.210943 172.31.8.238 -> 205.251.215.155 TCP 66 55190 > http [ACK] Seq=97 Ack=787168 Win=405504 Len=0 TSval=625454 TSecr=759188224
358   1.211074 205.251.215.155 -> 172.31.8.238 TCP 4410 [TCP segment of a reassembled PDU]
359   1.211091 172.31.8.238 -> 205.251.215.155 TCP 66 55190 > http [ACK] Seq=97 Ack=791512 Win=405504 Len=0 TSval=625455 TSecr=759188224
360   1.211105 205.251.215.155 -> 172.31.8.238 TCP 198 [TCP segment of a reassembled PDU]
361   1.211114 172.31.8.238 -> 205.251.215.155 TCP 66 55190 > http [ACK] Seq=97 Ack=791644 Win=405504 Len=0 TSval=625455 TSecr=759188224
362   1.216448 205.251.215.155 -> 172.31.8.238 TCP 1514 [TCP segment of a reassembled PDU]
363   1.216502 205.251.215.155 -> 172.31.8.238 TCP 5858 [TCP segment of a reassembled PDU]
364   1.216521 172.31.8.238 -> 205.251.215.155 TCP 66 55190 > http [ACK] Seq=97 Ack=798884 Win=405504 Len=0 TSval=625456 TSecr=759188224
365   1.216817 205.251.215.155 -> 172.31.8.238 TCP 14546 [TCP segment of a reassembled PDU]
366   1.216843 172.31.8.238 -> 205.251.215.155 TCP 66 55190 > http [ACK] Seq=97 Ack=813364 Win=405504 Len=0 TSval=625456 TSecr=759188224
367   1.217976 205.251.215.155 -> 172.31.8.238 TCP 1514 [TCP segment of a reassembled PDU]
368   1.218251 205.251.215.155 -> 172.31.8.238 TCP 4410 [TCP segment of a reassembled PDU]
369   1.218266 172.31.8.238 -> 205.251.215.155 TCP 66 55190 > http [ACK] Seq=97 Ack=819156 Win=405504 Len=0 TSval=625456 TSecr=759188225
370   1.218347 205.251.215.155 -> 172.31.8.238 TCP 7306 [TCP segment of a reassembled PDU]
371   1.218365 172.31.8.238 -> 205.251.215.155 TCP 66 55190 > http [ACK] Seq=97 Ack=826396 Win=405504 Len=0 TSval=625456 TSecr=759188225
372   1.218602 205.251.215.155 -> 172.31.8.238 TCP 10202 [TCP segment of a reassembled PDU]
373   1.218622 172.31.8.238 -> 205.251.215.155 TCP 66 55190 > http [ACK] Seq=97 Ack=836532 Win=405504 Len=0 TSval=625456 TSecr=759188225
374   1.221081 205.251.215.155 -> 172.31.8.238 TCP 1514 [TCP segment of a reassembled PDU]
375   1.221138 205.251.215.155 -> 172.31.8.238 TCP 8754 [TCP segment of a reassembled PDU]
376   1.221157 172.31.8.238 -> 205.251.215.155 TCP 66 55190 > http [ACK] Seq=97 Ack=846668 Win=405504 Len=0 TSval=625457 TSecr=759188225
377   1.221310 205.251.215.155 -> 172.31.8.238 TCP 8754 [TCP segment of a reassembled PDU]
378   1.221327 172.31.8.238 -> 205.251.215.155 TCP 66 55190 > http [ACK] Seq=97 Ack=855356 Win=405504 Len=0 TSval=625457 TSecr=759188225
379   1.221420 205.251.215.155 -> 172.31.8.238 TCP 2054 [TCP segment of a reassembled PDU]
380   1.221435 172.31.8.238 -> 205.251.215.155 TCP 66 55190 > http [ACK] Seq=97 Ack=857344 Win=405504 Len=0 TSval=625457 TSecr=759188225
381   1.288733 205.251.215.155 -> 172.31.8.238 TCP 1514 [TCP segment of a reassembled PDU]
382   1.288928 205.251.215.155 -> 172.31.8.238 TCP 78 [TCP segment of a reassembled PDU]
383   1.288945 172.31.8.238 -> 205.251.215.155 TCP 66 55190 > http [ACK] Seq=97 Ack=858804 Win=405504 Len=0 TSval=625474 TSecr=759188232
384   1.290008 205.251.215.155 -> 172.31.8.238 TCP 1514 [TCP segment of a reassembled PDU]
385   1.290053 205.251.215.155 -> 172.31.8.238 TCP 5858 [TCP segment of a reassembled PDU]
386   1.290073 172.31.8.238 -> 205.251.215.155 TCP 66 55190 > http [ACK] Seq=97 Ack=866044 Win=405504 Len=0 TSval=625474 TSecr=759188232
387   1.290230 205.251.215.155 -> 172.31.8.238 TCP 1586 [TCP segment of a reassembled PDU]
388   1.290247 172.31.8.238 -> 205.251.215.155 TCP 66 55190 > http [ACK] Seq=97 Ack=867564 Win=405504 Len=0 TSval=625474 TSecr=759188232
389   1.291274 205.251.215.155 -> 172.31.8.238 TCP 1514 [TCP segment of a reassembled PDU]
390   1.291320 205.251.215.155 -> 172.31.8.238 TCP 4410 [TCP segment of a reassembled PDU]
391   1.291337 172.31.8.238 -> 205.251.215.155 TCP 66 55190 > http [ACK] Seq=97 Ack=873356 Win=405504 Len=0 TSval=625475 TSecr=759188232
392   1.291357 205.251.215.155 -> 172.31.8.238 TCP 114 [TCP segment of a reassembled PDU]
393   1.291370 172.31.8.238 -> 205.251.215.155 TCP 66 55190 > http [ACK] Seq=97 Ack=873404 Win=405504 Len=0 TSval=625475 TSecr=759188232
394   1.292042 205.251.215.155 -> 172.31.8.238 TCP 1514 [TCP segment of a reassembled PDU]
395   1.292092 205.251.215.155 -> 172.31.8.238 TCP 5858 [TCP segment of a reassembled PDU]
396   1.292110 172.31.8.238 -> 205.251.215.155 TCP 66 55190 > http [ACK] Seq=97 Ack=880644 Win=405504 Len=0 TSval=625475 TSecr=759188232
397   1.292290 205.251.215.155 -> 172.31.8.238 TCP 2962 [TCP segment of a reassembled PDU]
398   1.292305 172.31.8.238 -> 205.251.215.155 TCP 66 55190 > http [ACK] Seq=97 Ack=883540 Win=405504 Len=0 TSval=625475 TSecr=759188232
399   1.292324 205.251.215.155 -> 172.31.8.238 TCP 78 [TCP segment of a reassembled PDU]
400   1.292337 172.31.8.238 -> 205.251.215.155 TCP 66 55190 > http [ACK] Seq=97 Ack=883552 Win=405504 Len=0 TSval=625475 TSecr=759188232
401   1.292793 205.251.215.155 -> 172.31.8.238 TCP 1514 [TCP segment of a reassembled PDU]
402   1.292848 205.251.215.155 -> 172.31.8.238 TCP 5858 [TCP segment of a reassembled PDU]
403   1.292865 172.31.8.238 -> 205.251.215.155 TCP 66 55190 > http [ACK] Seq=97 Ack=890792 Win=405504 Len=0 TSval=625475 TSecr=759188232
404   1.292884 205.251.215.155 -> 172.31.8.238 TCP 138 [TCP segment of a reassembled PDU]
405   1.292898 172.31.8.238 -> 205.251.215.155 TCP 66 55190 > http [ACK] Seq=97 Ack=890864 Win=405504 Len=0 TSval=625475 TSecr=759188232
406   1.297905 205.251.215.155 -> 172.31.8.238 TCP 4410 [TCP segment of a reassembled PDU]
407   1.297926 172.31.8.238 -> 205.251.215.155 TCP 66 55190 > http [ACK] Seq=97 Ack=895208 Win=405504 Len=0 TSval=625476 TSecr=759188233
408   1.298162 205.251.215.155 -> 172.31.8.238 TCP 2962 [TCP segment of a reassembled PDU]
409   1.298177 172.31.8.238 -> 205.251.215.155 TCP 66 55190 > http [ACK] Seq=97 Ack=898104 Win=405504 Len=0 TSval=625476 TSecr=759188233
410   1.298284 205.251.215.155 -> 172.31.8.238 TCP 13098 [TCP segment of a reassembled PDU]
411   1.298309 172.31.8.238 -> 205.251.215.155 TCP 66 55190 > http [ACK] Seq=97 Ack=911136 Win=405504 Len=0 TSval=625476 TSecr=759188233
412   1.300986 205.251.215.155 -> 172.31.8.238 TCP 1514 [TCP segment of a reassembled PDU]
413   1.301230 205.251.215.155 -> 172.31.8.238 TCP 4410 [TCP segment of a reassembled PDU]
414   1.301246 172.31.8.238 -> 205.251.215.155 TCP 66 55190 > http [ACK] Seq=97 Ack=916928 Win=405504 Len=0 TSval=625477 TSecr=759188233
415   1.301341 205.251.215.155 -> 172.31.8.238 TCP 13098 [TCP segment of a reassembled PDU]
416   1.301365 172.31.8.238 -> 205.251.215.155 TCP 66 55190 > http [ACK] Seq=97 Ack=929960 Win=405504 Len=0 TSval=625477 TSecr=759188233
417   1.303576 205.251.215.155 -> 172.31.8.238 TCP 1514 [TCP segment of a reassembled PDU]
