[Measurement for 1kb at 19:02:36 16.02.2014] 
Tshark:

  1   0.000000  192.168.1.2 -> 54.230.97.210 TCP 66 64166→80 [SYN] Seq=0 Win=8192 Len=0 MSS=1460 WS=256 SACK_PERM=1
  2   0.049704 54.230.97.210 -> 192.168.1.2  TCP 66 80→64166 [SYN, ACK] Seq=0 Ack=1 Win=14600 Len=0 MSS=1400 SACK_PERM=1 WS=128
  3   0.049851  192.168.1.2 -> 54.230.97.210 TCP 54 64166→80 [ACK] Seq=1 Ack=1 Win=65792 Len=0
  4   0.050255  192.168.1.2 -> 54.230.97.210 HTTP 150 GET /1kb HTTP/1.1 
  5   0.079825 54.230.97.210 -> 192.168.1.2  TCP 54 80→64166 [ACK] Seq=1 Ack=97 Win=14720 Len=0
  6   0.081292 54.230.97.210 -> 192.168.1.2  TCP 1454 [TCP segment of a reassembled PDU]
  7   0.081402 54.230.97.210 -> 192.168.1.2  HTTP 132 HTTP/1.1 200 OK  (application/octet-stream)
  8   0.081473  192.168.1.2 -> 54.230.97.210 TCP 54 64166→80 [ACK] Seq=97 Ack=1479 Win=65792 Len=0
  9   0.081597  192.168.1.2 -> 54.230.97.210 TCP 54 64166→80 [FIN, ACK] Seq=97 Ack=1479 Win=65792 Len=0
 10   0.110235 54.230.97.210 -> 192.168.1.2  TCP 54 80→64166 [FIN, ACK] Seq=1479 Ack=98 Win=14720 Len=0
 11   0.110371  192.168.1.2 -> 54.230.97.210 TCP 54 64166→80 [ACK] Seq=98 Ack=1480 Win=65792 Len=0
 12   0.931551  192.168.1.2 -> 64.233.164.84 SSL 55 Continuation Data
 13   0.957571  192.168.1.2 -> 74.125.232.201 TCP 1454 [TCP segment of a reassembled PDU]
 14   0.957594  192.168.1.2 -> 74.125.232.201 TCP 1454 [TCP segment of a reassembled PDU]
 15   0.957608  192.168.1.2 -> 74.125.232.201 TLSv1.2 517 Application Data
 16   0.958002  192.168.1.2 -> 74.125.232.201 TLSv1.2 87 Application Data
 17   0.958253  192.168.1.2 -> 74.125.232.201 TCP 1454 [TCP segment of a reassembled PDU]
 18   0.958276  192.168.1.2 -> 74.125.232.201 TCP 1454 [TCP segment of a reassembled PDU]
 19   0.958297  192.168.1.2 -> 74.125.232.201 TLSv1.2 135 Application Data
 20   0.958936  192.168.1.2 -> 74.125.232.201 TLSv1.2 621 Application Data
 21   0.984980 64.233.164.84 -> 192.168.1.2  TCP 66 443→64109 [ACK] Seq=1 Ack=2 Win=361 Len=0 SLE=1 SRE=2
 22   0.993211 74.125.232.201 -> 192.168.1.2  TCP 54 443→63842 [ACK] Seq=1 Ack=1401 Win=5987 Len=0
 23   0.997932 74.125.232.201 -> 192.168.1.2  TCP 54 443→63842 [ACK] Seq=1 Ack=2801 Win=5987 Len=0
 24   1.000438 74.125.232.201 -> 192.168.1.2  TCP 54 443→63842 [ACK] Seq=1 Ack=3264 Win=5987 Len=0
 25   1.000508 74.125.232.201 -> 192.168.1.2  TCP 54 443→63842 [ACK] Seq=1 Ack=3297 Win=5987 Len=0
 26   1.000525 74.125.232.201 -> 192.168.1.2  TLSv1.2 87 Application Data
 27   1.001811 74.125.232.201 -> 192.168.1.2  TCP 54 443→63842 [ACK] Seq=34 Ack=6097 Win=5987 Len=0
 28   1.003484 74.125.232.201 -> 192.168.1.2  TCP 54 443→63842 [ACK] Seq=34 Ack=6745 Win=5987 Len=0
 29   1.042723 74.125.232.201 -> 192.168.1.2  TLSv1.2 104 Application Data
 30   1.042788  192.168.1.2 -> 74.125.232.201 TCP 54 63842→443 [ACK] Seq=6745 Ack=84 Win=588 Len=0
 31   1.043729 74.125.232.201 -> 192.168.1.2  TLSv1.2 132 Application Data
 32   1.043773 74.125.232.201 -> 192.168.1.2  TLSv1.2 93 Application Data
 33   1.043811  192.168.1.2 -> 74.125.232.201 TCP 54 63842→443 [ACK] Seq=6745 Ack=201 Win=587 Len=0
 34   1.043943 74.125.232.201 -> 192.168.1.2  TLSv1.2 87 Application Data
 35   1.044438  192.168.1.2 -> 74.125.232.201 TLSv1.2 87 Application Data
 36   1.108978 74.125.232.201 -> 192.168.1.2  TCP 54 443→63842 [ACK] Seq=234 Ack=6778 Win=5987 Len=0
 37   1.288367 HuaweiTe_25:83:d4 -> IntelCor_3f:fc:98 ARP 42 Who has 192.168.1.2?  Tell 192.168.1.1
 38   1.288408 IntelCor_3f:fc:98 -> HuaweiTe_25:83:d4 ARP 42 192.168.1.2 is at 00:24:d7:3f:fc:98
 39   1.878617  192.168.1.2 -> 176.32.98.131 TCP 54 64143→80 [FIN, ACK] Seq=1 Ack=1 Win=260 Len=0
 40   1.878877  192.168.1.2 -> 176.32.96.156 TCP 54 64159→443 [FIN, ACK] Seq=1 Ack=1 Win=260 Len=0
 41   1.879009  192.168.1.2 -> 54.235.136.252 TCP 54 64149→80 [FIN, ACK] Seq=1 Ack=1 Win=257 Len=0
 42   2.032935 176.32.98.131 -> 192.168.1.2  TCP 54 80→64143 [FIN, ACK] Seq=1 Ack=2 Win=127 Len=0
