[Measurement for 1kb at 01:02:42 17.02.2014] 
Tshark:

  1   0.000000  192.168.1.2 -> 54.230.98.98 TCP 66 49683→80 [SYN] Seq=0 Win=8192 Len=0 MSS=1460 WS=256 SACK_PERM=1
  2   0.049820 54.230.98.98 -> 192.168.1.2  TCP 66 80→49683 [SYN, ACK] Seq=0 Ack=1 Win=14600 Len=0 MSS=1400 SACK_PERM=1 WS=128
  3   0.049944  192.168.1.2 -> 54.230.98.98 TCP 54 49683→80 [ACK] Seq=1 Ack=1 Win=65792 Len=0
  4   0.050269  192.168.1.2 -> 54.230.98.98 HTTP 150 GET /1kb HTTP/1.1 
  5   0.076748 54.230.98.98 -> 192.168.1.2  TCP 54 80→49683 [ACK] Seq=1 Ack=97 Win=14720 Len=0
  6   0.082604 54.230.98.98 -> 192.168.1.2  TCP 1454 [TCP segment of a reassembled PDU]
  7   0.082714 54.230.98.98 -> 192.168.1.2  HTTP 132 HTTP/1.1 200 OK  (application/octet-stream)
  8   0.082785  192.168.1.2 -> 54.230.98.98 TCP 54 49683→80 [ACK] Seq=97 Ack=1479 Win=65792 Len=0
  9   0.082918  192.168.1.2 -> 54.230.98.98 TCP 54 49683→80 [FIN, ACK] Seq=97 Ack=1479 Win=65792 Len=0
 10   0.110821 54.230.98.98 -> 192.168.1.2  TCP 54 80→49683 [FIN, ACK] Seq=1479 Ack=98 Win=14720 Len=0
 11   0.110980  192.168.1.2 -> 54.230.98.98 TCP 54 49683→80 [ACK] Seq=98 Ack=1480 Win=65792 Len=0
