[Measurement for 1kb at 09:34:38 20.34.2014] 
Tshark:

  1   0.000000 172.31.36.109 -> 172.31.0.2   DNS 89 Standard query 0x65bf  A d2pcb72msibvx3.cloudfront.net
  2   0.000022 172.31.36.109 -> 172.31.0.2   DNS 89 Standard query 0xf25a  AAAA d2pcb72msibvx3.cloudfront.net
  3   0.000351   172.31.0.2 -> 172.31.36.109 DNS 217 Standard query response 0x65bf  A 54.192.30.214 A 54.230.30.6 A 54.230.30.52 A 54.230.30.67 A 54.230.30.68 A 54.192.30.137 A 54.192.30.184 A 54.192.30.187
  4   0.023375   172.31.0.2 -> 172.31.36.109 DNS 169 Standard query response 0xf25a 
  5   0.028176 172.31.36.109 -> 54.192.30.214 TCP 74 50623 > http [SYN] Seq=0 Win=26883 Len=0 MSS=8961 SACK_PERM=1 TSval=34941294 TSecr=0 WS=128
  6   0.029564 54.192.30.214 -> 172.31.36.109 TCP 74 http > 50623 [SYN, ACK] Seq=0 Ack=1 Win=14480 Len=0 MSS=1460 SACK_PERM=1 TSval=637146379 TSecr=34941294 WS=128
  7   0.029601 172.31.36.109 -> 54.192.30.214 TCP 66 50623 > http [ACK] Seq=1 Ack=1 Win=27008 Len=0 TSval=34941294 TSecr=637146379
  8   0.029641 172.31.36.109 -> 54.192.30.214 HTTP 162 GET /1kb HTTP/1.1 
  9   0.030841 54.192.30.214 -> 172.31.36.109 TCP 66 http > 50623 [ACK] Seq=1 Ack=97 Win=14592 Len=0 TSval=637146379 TSecr=34941294
 10   0.061524 54.192.30.214 -> 172.31.36.109 HTTP 1544 HTTP/1.1 200 OK  (application/octet-stream)
 11   0.061552 172.31.36.109 -> 54.192.30.214 TCP 66 50623 > http [ACK] Seq=97 Ack=1479 Win=29952 Len=0 TSval=34941302 TSecr=637146382
 12   0.061684 172.31.36.109 -> 54.192.30.214 TCP 66 50623 > http [FIN, ACK] Seq=97 Ack=1479 Win=29952 Len=0 TSval=34941302 TSecr=637146382
 13   0.062757 54.192.30.214 -> 172.31.36.109 TCP 66 http > 50623 [FIN, ACK] Seq=1479 Ack=98 Win=14592 Len=0 TSval=637146382 TSecr=34941302
 14   0.062765 172.31.36.109 -> 54.192.30.214 TCP 66 50623 > http [ACK] Seq=98 Ack=1480 Win=29952 Len=0 TSval=34941302 TSecr=637146382
