[Measurement for 1kb at 17:37:58 19.37.2014] 
Tshark:

  1   0.000000 172.31.36.109 -> 172.31.0.2   DNS 89 Standard query 0x84a9  A d2pcb72msibvx3.cloudfront.net
  2   0.000021 172.31.36.109 -> 172.31.0.2   DNS 89 Standard query 0xde5b  AAAA d2pcb72msibvx3.cloudfront.net
  3   0.000418   172.31.0.2 -> 172.31.36.109 DNS 217 Standard query response 0x84a9  A 54.230.30.214 A 54.192.30.136 A 54.192.30.137 A 54.192.30.215 A 54.230.30.47 A 54.230.30.50 A 54.230.30.191 A 54.230.30.193
  4   0.024147   172.31.0.2 -> 172.31.36.109 DNS 169 Standard query response 0xde5b 
  5   0.030359 172.31.36.109 -> 54.230.30.214 TCP 74 38796 > http [SYN] Seq=0 Win=26883 Len=0 MSS=8961 SACK_PERM=1 TSval=20591304 TSecr=0 WS=128
  6   0.031562 54.230.30.214 -> 172.31.36.109 TCP 74 http > 38796 [SYN, ACK] Seq=0 Ack=1 Win=14480 Len=0 MSS=1460 SACK_PERM=1 TSval=827914120 TSecr=20591304 WS=128
  7   0.031576 172.31.36.109 -> 54.230.30.214 TCP 66 38796 > http [ACK] Seq=1 Ack=1 Win=27008 Len=0 TSval=20591304 TSecr=827914120
  8   0.031615 172.31.36.109 -> 54.230.30.214 HTTP 162 GET /1kb HTTP/1.1 
  9   0.032781 54.230.30.214 -> 172.31.36.109 TCP 66 http > 38796 [ACK] Seq=1 Ack=97 Win=14592 Len=0 TSval=827914120 TSecr=20591304
 10   0.748341 54.230.30.214 -> 172.31.36.109 HTTP 1533 HTTP/1.1 200 OK  (application/octet-stream)
