[Measurement for 1kb at 22:34:52 19.34.2014] 
Tshark:

  1   0.000000 172.31.36.109 -> 172.31.0.2   DNS 89 Standard query 0xd240  A d2pcb72msibvx3.cloudfront.net
  2   0.000022 172.31.36.109 -> 172.31.0.2   DNS 89 Standard query 0xf77b  AAAA d2pcb72msibvx3.cloudfront.net
  3   0.000481   172.31.0.2 -> 172.31.36.109 DNS 217 Standard query response 0xd240  A 54.230.30.253 A 54.192.30.137 A 54.192.30.219 A 54.192.30.224 A 54.192.30.225 A 54.230.29.243 A 54.230.30.41 A 54.230.30.59
  4   0.033163   172.31.0.2 -> 172.31.36.109 DNS 169 Standard query response 0xf77b 
  5   0.062639 172.31.36.109 -> 54.230.30.253 TCP 74 47191 > http [SYN] Seq=0 Win=26883 Len=0 MSS=8961 SACK_PERM=1 TSval=25044727 TSecr=0 WS=128
  6   0.064039 54.230.30.253 -> 172.31.36.109 TCP 74 http > 47191 [SYN, ACK] Seq=0 Ack=1 Win=14480 Len=0 MSS=1460 SACK_PERM=1 TSval=721763005 TSecr=25044727 WS=128
  7   0.064053 172.31.36.109 -> 54.230.30.253 TCP 66 47191 > http [ACK] Seq=1 Ack=1 Win=27008 Len=0 TSval=25044727 TSecr=721763005
  8   0.064099 172.31.36.109 -> 54.230.30.253 HTTP 162 GET /1kb HTTP/1.1 
  9   0.065241 54.230.30.253 -> 172.31.36.109 TCP 66 http > 47191 [ACK] Seq=1 Ack=97 Win=14592 Len=0 TSval=721763006 TSecr=25044727
 10   0.079427 54.230.30.253 -> 172.31.36.109 HTTP 1544 HTTP/1.1 200 OK  (application/octet-stream)
 11   0.079436 172.31.36.109 -> 54.230.30.253 TCP 66 47191 > http [ACK] Seq=97 Ack=1479 Win=29952 Len=0 TSval=25044731 TSecr=721763007
 12   0.079595 172.31.36.109 -> 54.230.30.253 TCP 66 47191 > http [FIN, ACK] Seq=97 Ack=1479 Win=29952 Len=0 TSval=25044731 TSecr=721763007
 13   0.080857 54.230.30.253 -> 172.31.36.109 TCP 66 http > 47191 [FIN, ACK] Seq=1479 Ack=98 Win=14592 Len=0 TSval=721763007 TSecr=25044731
 14   0.080886 172.31.36.109 -> 54.230.30.253 TCP 66 47191 > http [ACK] Seq=98 Ack=1480 Win=29952 Len=0 TSval=25044731 TSecr=721763007
