[Measurement for 1kb at 08:34:23 20.34.2014] 
Tshark:

  1   0.000000 172.31.36.109 -> 172.31.0.2   DNS 89 Standard query 0x83db  A d2pcb72msibvx3.cloudfront.net
  2   0.000020 172.31.36.109 -> 172.31.0.2   DNS 89 Standard query 0x6f94  AAAA d2pcb72msibvx3.cloudfront.net
  3   0.000496   172.31.0.2 -> 172.31.36.109 DNS 217 Standard query response 0x83db  A 216.137.41.10 A 216.137.41.34 A 216.137.41.199 A 54.230.20.3 A 54.230.20.252 A 54.230.20.254 A 54.230.21.160 A 54.230.21.222
  4   0.043394   172.31.0.2 -> 172.31.36.109 DNS 169 Standard query response 0x6f94 
  5   0.060411 172.31.36.109 -> 216.137.41.10 TCP 74 40902 > http [SYN] Seq=0 Win=26883 Len=0 MSS=8961 SACK_PERM=1 TSval=34037516 TSecr=0 WS=128
  6   0.145950 216.137.41.10 -> 172.31.36.109 TCP 74 http > 40902 [SYN, ACK] Seq=0 Ack=1 Win=14480 Len=0 MSS=1460 SACK_PERM=1 TSval=833273824 TSecr=34037516 WS=128
  7   0.145965 172.31.36.109 -> 216.137.41.10 TCP 66 40902 > http [ACK] Seq=1 Ack=1 Win=27008 Len=0 TSval=34037537 TSecr=833273824
  8   0.146009 172.31.36.109 -> 216.137.41.10 HTTP 162 GET /1kb HTTP/1.1 
  9   0.231771 216.137.41.10 -> 172.31.36.109 TCP 66 http > 40902 [ACK] Seq=1 Ack=97 Win=14592 Len=0 TSval=833273833 TSecr=34037537
 10   0.232440 216.137.41.10 -> 172.31.36.109 HTTP 1544 HTTP/1.1 200 OK  (application/octet-stream)
 11   0.232448 172.31.36.109 -> 216.137.41.10 TCP 66 40902 > http [ACK] Seq=97 Ack=1479 Win=29952 Len=0 TSval=34037559 TSecr=833273833
 12   0.234976 172.31.36.109 -> 216.137.41.10 TCP 66 40902 > http [FIN, ACK] Seq=97 Ack=1479 Win=29952 Len=0 TSval=34037560 TSecr=833273833
 13   0.320398 216.137.41.10 -> 172.31.36.109 TCP 66 http > 40902 [FIN, ACK] Seq=1479 Ack=98 Win=14592 Len=0 TSval=833273841 TSecr=34037560
 14   0.320427 172.31.36.109 -> 216.137.41.10 TCP 66 40902 > http [ACK] Seq=98 Ack=1480 Win=29952 Len=0 TSval=34037581 TSecr=833273841
