[Measurement for 1mb at 01:31:30 20.31.2014] 
Tshark:

  1   0.000000 172.31.36.109 -> 172.31.0.2   DNS 89 Standard query 0x0701  A d1xvcg6dfvgaki.cloudfront.net
  2   0.000021 172.31.36.109 -> 172.31.0.2   DNS 89 Standard query 0xe2f5  AAAA d1xvcg6dfvgaki.cloudfront.net
  3   0.000556   172.31.0.2 -> 172.31.36.109 DNS 217 Standard query response 0x0701  A 54.230.30.50 A 54.230.30.219 A 54.230.30.222 A 54.192.29.227 A 54.192.30.188 A 54.192.30.218 A 54.230.29.244 A 54.230.30.11
  4   0.000566   172.31.0.2 -> 172.31.36.109 DNS 170 Standard query response 0xe2f5 
  5   0.003918 172.31.36.109 -> 54.230.30.50 TCP 74 35483 > http [SYN] Seq=0 Win=26883 Len=0 MSS=8961 SACK_PERM=1 TSval=27694178 TSecr=0 WS=128
  6   0.005368 54.230.30.50 -> 172.31.36.109 TCP 74 http > 35483 [SYN, ACK] Seq=0 Ack=1 Win=14480 Len=0 MSS=1460 SACK_PERM=1 TSval=721087160 TSecr=27694178 WS=128
  7   0.005404 172.31.36.109 -> 54.230.30.50 TCP 66 35483 > http [ACK] Seq=1 Ack=1 Win=27008 Len=0 TSval=27694178 TSecr=721087160
  8   0.005441 172.31.36.109 -> 54.230.30.50 HTTP 162 GET /1mb HTTP/1.1 
  9   0.006634 54.230.30.50 -> 172.31.36.109 TCP 66 http > 35483 [ACK] Seq=1 Ack=97 Win=14592 Len=0 TSval=721087160 TSecr=27694178
 10   0.024143 54.230.30.50 -> 172.31.36.109 TCP 2962 [TCP segment of a reassembled PDU]
 11   0.024150 172.31.36.109 -> 54.230.30.50 TCP 66 35483 > http [ACK] Seq=97 Ack=2897 Win=32768 Len=0 TSval=27694183 TSecr=721087162
 12   0.024313 54.230.30.50 -> 172.31.36.109 TCP 2962 [TCP segment of a reassembled PDU]
 13   0.024319 172.31.36.109 -> 54.230.30.50 TCP 66 35483 > http [ACK] Seq=97 Ack=5793 Win=38528 Len=0 TSval=27694183 TSecr=721087162
 14   0.024349 54.230.30.50 -> 172.31.36.109 TCP 8754 [TCP segment of a reassembled PDU]
 15   0.024356 172.31.36.109 -> 54.230.30.50 TCP 66 35483 > http [ACK] Seq=97 Ack=14481 Win=55936 Len=0 TSval=27694183 TSecr=721087162
 16   0.025650 54.230.30.50 -> 172.31.36.109 TCP 8754 [TCP segment of a reassembled PDU]
 17   0.025681 172.31.36.109 -> 54.230.30.50 TCP 66 35483 > http [ACK] Seq=97 Ack=23169 Win=73344 Len=0 TSval=27694183 TSecr=721087162
 18   0.025692 54.230.30.50 -> 172.31.36.109 TCP 4410 [TCP segment of a reassembled PDU]
 19   0.025696 172.31.36.109 -> 54.230.30.50 TCP 66 35483 > http [ACK] Seq=97 Ack=27513 Win=81920 Len=0 TSval=27694183 TSecr=721087162
 20   0.027199 54.230.30.50 -> 172.31.36.109 TCP 8754 [TCP segment of a reassembled PDU]
 21   0.027208 172.31.36.109 -> 54.230.30.50 TCP 66 35483 > http [ACK] Seq=97 Ack=36201 Win=99328 Len=0 TSval=27694183 TSecr=721087162
 22   0.027216 54.230.30.50 -> 172.31.36.109 TCP 2962 [TCP segment of a reassembled PDU]
 23   0.027220 172.31.36.109 -> 54.230.30.50 TCP 66 35483 > http [ACK] Seq=97 Ack=39097 Win=98944 Len=0 TSval=27694183 TSecr=721087162
 24   0.027256 54.230.30.50 -> 172.31.36.109 TCP 10202 [TCP segment of a reassembled PDU]
 25   0.027264 172.31.36.109 -> 54.230.30.50 TCP 66 35483 > http [ACK] Seq=97 Ack=49233 Win=101248 Len=0 TSval=27694183 TSecr=721087162
 26   0.028378 54.230.30.50 -> 172.31.36.109 TCP 2962 [TCP segment of a reassembled PDU]
 27   0.028383 172.31.36.109 -> 54.230.30.50 TCP 66 35483 > http [ACK] Seq=97 Ack=52129 Win=109056 Len=0 TSval=27694184 TSecr=721087163
 28   0.028445 54.230.30.50 -> 172.31.36.109 TCP 1514 [TCP segment of a reassembled PDU]
 29   0.028449 172.31.36.109 -> 54.230.30.50 TCP 66 35483 > http [ACK] Seq=97 Ack=53577 Win=112000 Len=0 TSval=27694184 TSecr=721087163
 30   0.028763 54.230.30.50 -> 172.31.36.109 TCP 11783 [TCP segment of a reassembled PDU]
 31   0.028770 172.31.36.109 -> 54.230.30.50 TCP 66 35483 > http [ACK] Seq=97 Ack=65294 Win=135424 Len=0 TSval=27694184 TSecr=721087163
 32   0.032237 54.230.30.50 -> 172.31.36.109 TCP 1514 [TCP segment of a reassembled PDU]
 33   0.032242 172.31.36.109 -> 54.230.30.50 TCP 66 35483 > http [ACK] Seq=97 Ack=66742 Win=138240 Len=0 TSval=27694185 TSecr=721087163
 34   0.032422 54.230.30.50 -> 172.31.36.109 TCP 2962 [TCP segment of a reassembled PDU]
 35   0.032427 172.31.36.109 -> 54.230.30.50 TCP 66 35483 > http [ACK] Seq=97 Ack=69638 Win=144128 Len=0 TSval=27694185 TSecr=721087163
 36   0.032516 54.230.30.50 -> 172.31.36.109 TCP 11650 [TCP segment of a reassembled PDU]
 37   0.032524 172.31.36.109 -> 54.230.30.50 TCP 66 35483 > http [ACK] Seq=97 Ack=81222 Win=167296 Len=0 TSval=27694185 TSecr=721087163
 38   0.032579 54.230.30.50 -> 172.31.36.109 TCP 4410 [TCP segment of a reassembled PDU]
 39   0.032584 172.31.36.109 -> 54.230.30.50 TCP 66 35483 > http [ACK] Seq=97 Ack=85566 Win=176000 Len=0 TSval=27694185 TSecr=721087163
 40   0.033650 54.230.30.50 -> 172.31.36.109 TCP 4410 [TCP segment of a reassembled PDU]
 41   0.033655 172.31.36.109 -> 54.230.30.50 TCP 66 35483 > http [ACK] Seq=97 Ack=89910 Win=184576 Len=0 TSval=27694185 TSecr=721087163
 42   0.033828 54.230.30.50 -> 172.31.36.109 TCP 18890 [TCP segment of a reassembled PDU]
 43   0.033855 172.31.36.109 -> 54.230.30.50 TCP 66 35483 > http [ACK] Seq=97 Ack=108734 Win=222336 Len=0 TSval=27694185 TSecr=721087163
 44   0.033995 54.230.30.50 -> 172.31.36.109 TCP 2962 [TCP segment of a reassembled PDU]
 45   0.034000 172.31.36.109 -> 54.230.30.50 TCP 66 35483 > http [ACK] Seq=97 Ack=111630 Win=228096 Len=0 TSval=27694185 TSecr=721087163
 46   0.034994 54.230.30.50 -> 172.31.36.109 TCP 2962 [TCP segment of a reassembled PDU]
 47   0.035013 172.31.36.109 -> 54.230.30.50 TCP 66 35483 > http [ACK] Seq=97 Ack=114526 Win=233856 Len=0 TSval=27694185 TSecr=721087163
 48   0.035139 54.230.30.50 -> 172.31.36.109 TCP 8754 [TCP segment of a reassembled PDU]
 49   0.035168 172.31.36.109 -> 54.230.30.50 TCP 66 35483 > http [ACK] Seq=97 Ack=123214 Win=251264 Len=0 TSval=27694185 TSecr=721087163
 50   0.035289 54.230.30.50 -> 172.31.36.109 TCP 7682 [TCP segment of a reassembled PDU]
 51   0.035295 172.31.36.109 -> 54.230.30.50 TCP 66 35483 > http [ACK] Seq=97 Ack=130830 Win=266496 Len=0 TSval=27694185 TSecr=721087163
 52   0.056887 54.230.30.50 -> 172.31.36.109 TCP 1514 [TCP segment of a reassembled PDU]
 53   0.056903 172.31.36.109 -> 54.230.30.50 TCP 66 35483 > http [ACK] Seq=97 Ack=132278 Win=269312 Len=0 TSval=27694191 TSecr=721087165
 54   0.057104 54.230.30.50 -> 172.31.36.109 TCP 1514 [TCP segment of a reassembled PDU]
 55   0.057108 172.31.36.109 -> 54.230.30.50 TCP 66 35483 > http [ACK] Seq=97 Ack=133726 Win=272256 Len=0 TSval=27694191 TSecr=721087165
 56   0.057206 54.230.30.50 -> 172.31.36.109 TCP 8754 [TCP segment of a reassembled PDU]
 57   0.057213 172.31.36.109 -> 54.230.30.50 TCP 66 35483 > http [ACK] Seq=97 Ack=142414 Win=289664 Len=0 TSval=27694191 TSecr=721087165
 58   0.057290 54.230.30.50 -> 172.31.36.109 TCP 7306 [TCP segment of a reassembled PDU]
 59   0.057297 172.31.36.109 -> 54.230.30.50 TCP 66 35483 > http [ACK] Seq=97 Ack=149654 Win=304128 Len=0 TSval=27694191 TSecr=721087165
 60   0.057359 54.230.30.50 -> 172.31.36.109 TCP 1514 [TCP segment of a reassembled PDU]
 61   0.057363 172.31.36.109 -> 54.230.30.50 TCP 66 35483 > http [ACK] Seq=97 Ack=151102 Win=307072 Len=0 TSval=27694191 TSecr=721087165
 62   0.057475 54.230.30.50 -> 172.31.36.109 TCP 5858 [TCP segment of a reassembled PDU]
 63   0.057493 172.31.36.109 -> 54.230.30.50 TCP 66 35483 > http [ACK] Seq=97 Ack=156894 Win=318592 Len=0 TSval=27694191 TSecr=721087165
 64   0.058415 54.230.30.50 -> 172.31.36.109 TCP 5858 [TCP segment of a reassembled PDU]
 65   0.058421 172.31.36.109 -> 54.230.30.50 TCP 66 35483 > http [ACK] Seq=97 Ack=162686 Win=330240 Len=0 TSval=27694191 TSecr=721087166
 66   0.058431 54.230.30.50 -> 172.31.36.109 TCP 7306 [TCP segment of a reassembled PDU]
 67   0.058436 172.31.36.109 -> 54.230.30.50 TCP 66 35483 > http [ACK] Seq=97 Ack=169926 Win=344704 Len=0 TSval=27694191 TSecr=721087166
 68   0.058527 54.230.30.50 -> 172.31.36.109 TCP 5858 [TCP segment of a reassembled PDU]
 69   0.058542 172.31.36.109 -> 54.230.30.50 TCP 66 35483 > http [ACK] Seq=97 Ack=175718 Win=356224 Len=0 TSval=27694191 TSecr=721087166
 70   0.058715 54.230.30.50 -> 172.31.36.109 TCP 14546 [TCP segment of a reassembled PDU]
 71   0.058725 172.31.36.109 -> 54.230.30.50 TCP 66 35483 > http [ACK] Seq=97 Ack=190198 Win=385152 Len=0 TSval=27694191 TSecr=721087166
 72   0.059740 54.230.30.50 -> 172.31.36.109 TCP 2962 [TCP segment of a reassembled PDU]
 73   0.059753 172.31.36.109 -> 54.230.30.50 TCP 66 35483 > http [ACK] Seq=97 Ack=193094 Win=391040 Len=0 TSval=27694191 TSecr=721087166
 74   0.059872 54.230.30.50 -> 172.31.36.109 TCP 3338 [TCP segment of a reassembled PDU]
 75   0.059884 172.31.36.109 -> 54.230.30.50 TCP 66 35483 > http [ACK] Seq=97 Ack=196366 Win=397568 Len=0 TSval=27694192 TSecr=721087166
 76   0.067171 54.230.30.50 -> 172.31.36.109 TCP 1514 [TCP segment of a reassembled PDU]
 77   0.067182 172.31.36.109 -> 54.230.30.50 TCP 66 35483 > http [ACK] Seq=97 Ack=197814 Win=400384 Len=0 TSval=27694193 TSecr=721087166
 78   0.067650 54.230.30.50 -> 172.31.36.109 TCP 4410 [TCP segment of a reassembled PDU]
 79   0.067663 172.31.36.109 -> 54.230.30.50 TCP 66 35483 > http [ACK] Seq=97 Ack=202158 Win=409088 Len=0 TSval=27694193 TSecr=721087167
 80   0.067685 54.230.30.50 -> 172.31.36.109 TCP 1514 [TCP segment of a reassembled PDU]
 81   0.067687 172.31.36.109 -> 54.230.30.50 TCP 66 35483 > http [ACK] Seq=97 Ack=203606 Win=412032 Len=0 TSval=27694193 TSecr=721087167
 82   0.067693 54.230.30.50 -> 172.31.36.109 TCP 5858 [TCP segment of a reassembled PDU]
 83   0.067696 172.31.36.109 -> 54.230.30.50 TCP 66 35483 > http [ACK] Seq=97 Ack=209398 Win=423552 Len=0 TSval=27694193 TSecr=721087167
 84   0.067828 54.230.30.50 -> 172.31.36.109 TCP 8754 [TCP segment of a reassembled PDU]
 85   0.067835 172.31.36.109 -> 54.230.30.50 TCP 66 35483 > http [ACK] Seq=97 Ack=218086 Win=440960 Len=0 TSval=27694194 TSecr=721087167
 86   0.067923 54.230.30.50 -> 172.31.36.109 TCP 4410 [TCP segment of a reassembled PDU]
 87   0.067937 172.31.36.109 -> 54.230.30.50 TCP 66 35483 > http [ACK] Seq=97 Ack=222430 Win=449664 Len=0 TSval=27694194 TSecr=721087167
 88   0.067960 54.230.30.50 -> 172.31.36.109 TCP 7306 [TCP segment of a reassembled PDU]
 89   0.067965 172.31.36.109 -> 54.230.30.50 TCP 66 35483 > http [ACK] Seq=97 Ack=229670 Win=464128 Len=0 TSval=27694194 TSecr=721087167
 90   0.068214 54.230.30.50 -> 172.31.36.109 TCP 1514 [TCP segment of a reassembled PDU]
 91   0.068225 172.31.36.109 -> 54.230.30.50 TCP 66 35483 > http [ACK] Seq=97 Ack=231118 Win=467072 Len=0 TSval=27694194 TSecr=721087167
 92   0.068357 54.230.30.50 -> 172.31.36.109 TCP 11650 [TCP segment of a reassembled PDU]
 93   0.068383 172.31.36.109 -> 54.230.30.50 TCP 66 35483 > http [ACK] Seq=97 Ack=242702 Win=467584 Len=0 TSval=27694194 TSecr=721087167
 94   0.068864 54.230.30.50 -> 172.31.36.109 TCP 1514 [TCP segment of a reassembled PDU]
 95   0.068868 172.31.36.109 -> 54.230.30.50 TCP 66 35483 > http [ACK] Seq=97 Ack=244150 Win=483328 Len=0 TSval=27694194 TSecr=721087167
 96   0.068980 54.230.30.50 -> 172.31.36.109 TCP 8754 [TCP segment of a reassembled PDU]
 97   0.068986 172.31.36.109 -> 54.230.30.50 TCP 66 35483 > http [ACK] Seq=97 Ack=252838 Win=474752 Len=0 TSval=27694194 TSecr=721087167
 98   0.069065 54.230.30.50 -> 172.31.36.109 TCP 8754 [TCP segment of a reassembled PDU]
 99   0.069071 172.31.36.109 -> 54.230.30.50 TCP 66 35483 > http [ACK] Seq=97 Ack=261526 Win=466176 Len=0 TSval=27694194 TSecr=721087167
100   0.069297 54.230.30.50 -> 172.31.36.109 TCP 11650 [TCP segment of a reassembled PDU]
101   0.069328 172.31.36.109 -> 54.230.30.50 TCP 66 35483 > http [ACK] Seq=97 Ack=273110 Win=454656 Len=0 TSval=27694194 TSecr=721087167
102   0.069391 54.230.30.50 -> 172.31.36.109 TCP 13098 [TCP segment of a reassembled PDU]
103   0.069400 172.31.36.109 -> 54.230.30.50 TCP 66 35483 > http [ACK] Seq=97 Ack=286142 Win=465152 Len=0 TSval=27694194 TSecr=721087167
104   0.070172 54.230.30.50 -> 172.31.36.109 TCP 1514 [TCP segment of a reassembled PDU]
105   0.070348 54.230.30.50 -> 172.31.36.109 TCP 11650 [TCP segment of a reassembled PDU]
106   0.070356 172.31.36.109 -> 54.230.30.50 TCP 66 35483 > http [ACK] Seq=97 Ack=299174 Win=467584 Len=0 TSval=27694194 TSecr=721087167
107   0.070364 54.230.30.50 -> 172.31.36.109 TCP 5858 [TCP segment of a reassembled PDU]
108   0.070384 172.31.36.109 -> 54.230.30.50 TCP 66 35483 > http [ACK] Seq=97 Ack=304966 Win=477056 Len=0 TSval=27694194 TSecr=721087167
109   0.070457 54.230.30.50 -> 172.31.36.109 TCP 2962 [TCP segment of a reassembled PDU]
110   0.070469 172.31.36.109 -> 54.230.30.50 TCP 66 35483 > http [ACK] Seq=97 Ack=307862 Win=481792 Len=0 TSval=27694194 TSecr=721087167
111   0.070796 54.230.30.50 -> 172.31.36.109 TCP 4410 [TCP segment of a reassembled PDU]
112   0.070834 172.31.36.109 -> 54.230.30.50 TCP 66 35483 > http [ACK] Seq=97 Ack=312206 Win=483328 Len=0 TSval=27694194 TSecr=721087167
113   0.070946 54.230.30.50 -> 172.31.36.109 TCP 10202 [TCP segment of a reassembled PDU]
114   0.070971 54.230.30.50 -> 172.31.36.109 TCP 1514 [TCP segment of a reassembled PDU]
115   0.070984 172.31.36.109 -> 54.230.30.50 TCP 66 35483 > http [ACK] Seq=97 Ack=323790 Win=483328 Len=0 TSval=27694194 TSecr=721087167
116   0.071220 54.230.30.50 -> 172.31.36.109 TCP 2962 [TCP segment of a reassembled PDU]
117   0.071263 172.31.36.109 -> 54.230.30.50 TCP 66 35483 > http [ACK] Seq=97 Ack=326686 Win=483328 Len=0 TSval=27694194 TSecr=721087167
118   0.071276 54.230.30.50 -> 172.31.36.109 TCP 10202 [TCP segment of a reassembled PDU]
119   0.071292 172.31.36.109 -> 54.230.30.50 TCP 66 35483 > http [ACK] Seq=97 Ack=336822 Win=483328 Len=0 TSval=27694194 TSecr=721087167
120   0.071374 54.230.30.50 -> 172.31.36.109 TCP 1514 [TCP segment of a reassembled PDU]
121   0.072031 54.230.30.50 -> 172.31.36.109 TCP 4410 [TCP segment of a reassembled PDU]
122   0.072047 172.31.36.109 -> 54.230.30.50 TCP 66 35483 > http [ACK] Seq=97 Ack=342614 Win=483328 Len=0 TSval=27694195 TSecr=721087167
123   0.072082 54.230.30.50 -> 172.31.36.109 TCP 4410 [TCP segment of a reassembled PDU]
124   0.072098 172.31.36.109 -> 54.230.30.50 TCP 66 35483 > http [ACK] Seq=97 Ack=346958 Win=483328 Len=0 TSval=27694195 TSecr=721087167
125   0.072178 54.230.30.50 -> 172.31.36.109 TCP 10202 [TCP segment of a reassembled PDU]
126   0.072202 172.31.36.109 -> 54.230.30.50 TCP 66 35483 > http [ACK] Seq=97 Ack=357094 Win=483328 Len=0 TSval=27694195 TSecr=721087167
127   0.072306 54.230.30.50 -> 172.31.36.109 TCP 10202 [TCP segment of a reassembled PDU]
128   0.072324 172.31.36.109 -> 54.230.30.50 TCP 66 35483 > http [ACK] Seq=97 Ack=367230 Win=483328 Len=0 TSval=27694195 TSecr=721087167
129   0.072352 54.230.30.50 -> 172.31.36.109 TCP 5858 [TCP segment of a reassembled PDU]
130   0.072564 54.230.30.50 -> 172.31.36.109 TCP 8754 [TCP segment of a reassembled PDU]
131   0.072593 172.31.36.109 -> 54.230.30.50 TCP 66 35483 > http [ACK] Seq=97 Ack=381710 Win=483328 Len=0 TSval=27694195 TSecr=721087167
132   0.072698 54.230.30.50 -> 172.31.36.109 TCP 11330 [TCP segment of a reassembled PDU]
133   0.072720 172.31.36.109 -> 54.230.30.50 TCP 66 35483 > http [ACK] Seq=97 Ack=392974 Win=483328 Len=0 TSval=27694195 TSecr=721087167
134   0.078104 54.230.30.50 -> 172.31.36.109 TCP 1514 [TCP segment of a reassembled PDU]
135   0.078397 54.230.30.50 -> 172.31.36.109 TCP 4410 [TCP segment of a reassembled PDU]
136   0.078438 172.31.36.109 -> 54.230.30.50 TCP 66 35483 > http [ACK] Seq=97 Ack=398766 Win=483328 Len=0 TSval=27694196 TSecr=721087168
137   0.078573 54.230.30.50 -> 172.31.36.109 TCP 10202 [TCP segment of a reassembled PDU]
138   0.078600 54.230.30.50 -> 172.31.36.109 TCP 4410 [TCP segment of a reassembled PDU]
139   0.078614 172.31.36.109 -> 54.230.30.50 TCP 66 35483 > http [ACK] Seq=97 Ack=413246 Win=483328 Len=0 TSval=27694196 TSecr=721087168
140   0.078704 54.230.30.50 -> 172.31.36.109 TCP 5858 [TCP segment of a reassembled PDU]
141   0.078739 54.230.30.50 -> 172.31.36.109 TCP 5858 [TCP segment of a reassembled PDU]
142   0.078754 172.31.36.109 -> 54.230.30.50 TCP 66 35483 > http [ACK] Seq=97 Ack=424830 Win=483328 Len=0 TSval=27694196 TSecr=721087168
143   0.078866 54.230.30.50 -> 172.31.36.109 TCP 11650 [TCP segment of a reassembled PDU]
144   0.078885 172.31.36.109 -> 54.230.30.50 TCP 66 35483 > http [ACK] Seq=97 Ack=436414 Win=483328 Len=0 TSval=27694196 TSecr=721087168
145   0.079001 54.230.30.50 -> 172.31.36.109 TCP 7306 [TCP segment of a reassembled PDU]
146   0.079026 54.230.30.50 -> 172.31.36.109 TCP 8754 [TCP segment of a reassembled PDU]
147   0.079053 172.31.36.109 -> 54.230.30.50 TCP 66 35483 > http [ACK] Seq=97 Ack=452342 Win=483328 Len=0 TSval=27694196 TSecr=721087168
148   0.079143 54.230.30.50 -> 172.31.36.109 TCP 6234 [TCP segment of a reassembled PDU]
149   0.079192 172.31.36.109 -> 54.230.30.50 TCP 66 35483 > http [ACK] Seq=97 Ack=458510 Win=483328 Len=0 TSval=27694196 TSecr=721087168
150   0.089286 54.230.30.50 -> 172.31.36.109 TCP 1514 [TCP segment of a reassembled PDU]
151   0.089444 54.230.30.50 -> 172.31.36.109 TCP 2962 [TCP segment of a reassembled PDU]
152   0.089459 172.31.36.109 -> 54.230.30.50 TCP 66 35483 > http [ACK] Seq=97 Ack=462854 Win=483328 Len=0 TSval=27694199 TSecr=721087169
153   0.089563 54.230.30.50 -> 172.31.36.109 TCP 10202 [TCP segment of a reassembled PDU]
154   0.089601 172.31.36.109 -> 54.230.30.50 TCP 66 35483 > http [ACK] Seq=97 Ack=472990 Win=483328 Len=0 TSval=27694199 TSecr=721087169
155   0.089709 54.230.30.50 -> 172.31.36.109 TCP 11650 [TCP segment of a reassembled PDU]
156   0.089741 54.230.30.50 -> 172.31.36.109 TCP 8754 [TCP segment of a reassembled PDU]
157   0.089750 54.230.30.50 -> 172.31.36.109 TCP 5858 [TCP segment of a reassembled PDU]
158   0.089895 54.230.30.50 -> 172.31.36.109 TCP 7306 [TCP segment of a reassembled PDU]
159   0.089907 54.230.30.50 -> 172.31.36.109 TCP 11650 [TCP segment of a reassembled PDU]
160   0.090005 172.31.36.109 -> 54.230.30.50 TCP 66 35483 > http [ACK] Seq=97 Ack=517878 Win=438528 Len=0 TSval=27694199 TSecr=721087169
161   0.090076 54.230.30.50 -> 172.31.36.109 TCP 6234 [TCP segment of a reassembled PDU]
162   0.090083 172.31.36.109 -> 54.230.30.50 TCP 66 35483 > http [ACK] Seq=97 Ack=524046 Win=474624 Len=0 TSval=27694199 TSecr=721087169
163   0.093599 54.230.30.50 -> 172.31.36.109 TCP 1514 [TCP segment of a reassembled PDU]
164   0.093874 54.230.30.50 -> 172.31.36.109 TCP 2962 [TCP segment of a reassembled PDU]
165   0.093886 172.31.36.109 -> 54.230.30.50 TCP 66 35483 > http [ACK] Seq=97 Ack=528390 Win=481792 Len=0 TSval=27694200 TSecr=721087169
166   0.093978 54.230.30.50 -> 172.31.36.109 TCP 11650 [TCP segment of a reassembled PDU]
167   0.093996 172.31.36.109 -> 54.230.30.50 TCP 66 35483 > http [ACK] Seq=97 Ack=539974 Win=483328 Len=0 TSval=27694200 TSecr=721087169
168   0.094113 54.230.30.50 -> 172.31.36.109 TCP 10202 [TCP segment of a reassembled PDU]
169   0.094125 54.230.30.50 -> 172.31.36.109 TCP 4410 [TCP segment of a reassembled PDU]
170   0.094142 172.31.36.109 -> 54.230.30.50 TCP 66 35483 > http [ACK] Seq=97 Ack=554454 Win=483328 Len=0 TSval=27694200 TSecr=721087169
171   0.094186 54.230.30.50 -> 172.31.36.109 TCP 14546 [TCP segment of a reassembled PDU]
172   0.094220 172.31.36.109 -> 54.230.30.50 TCP 66 35483 > http [ACK] Seq=97 Ack=568934 Win=483328 Len=0 TSval=27694200 TSecr=721087169
173   0.094294 54.230.30.50 -> 172.31.36.109 TCP 1514 [TCP segment of a reassembled PDU]
174   0.094303 54.230.30.50 -> 172.31.36.109 TCP 7306 [TCP segment of a reassembled PDU]
175   0.094319 172.31.36.109 -> 54.230.30.50 TCP 66 35483 > http [ACK] Seq=97 Ack=577622 Win=483328 Len=0 TSval=27694200 TSecr=721087169
176   0.094389 54.230.30.50 -> 172.31.36.109 TCP 12026 [TCP segment of a reassembled PDU]
177   0.094397 172.31.36.109 -> 54.230.30.50 TCP 66 35483 > http [ACK] Seq=97 Ack=589582 Win=507264 Len=0 TSval=27694200 TSecr=721087169
178   0.172663 54.230.30.50 -> 172.31.36.109 TCP 1514 [TCP segment of a reassembled PDU]
179   0.172691 172.31.36.109 -> 54.230.30.50 TCP 66 35483 > http [ACK] Seq=97 Ack=591030 Win=510208 Len=0 TSval=27694220 TSecr=721087177
180   0.172998 54.230.30.50 -> 172.31.36.109 TCP 2962 [TCP segment of a reassembled PDU]
181   0.173004 172.31.36.109 -> 54.230.30.50 TCP 66 35483 > http [ACK] Seq=97 Ack=593926 Win=515968 Len=0 TSval=27694220 TSecr=721087177
182   0.173127 54.230.30.50 -> 172.31.36.109 TCP 21786 [TCP segment of a reassembled PDU]
183   0.173138 172.31.36.109 -> 54.230.30.50 TCP 66 35483 > http [ACK] Seq=97 Ack=615646 Win=531968 Len=0 TSval=27694220 TSecr=721087177
184   0.173203 54.230.30.50 -> 172.31.36.109 TCP 14546 [TCP segment of a reassembled PDU]
185   0.173213 172.31.36.109 -> 54.230.30.50 TCP 66 35483 > http [ACK] Seq=97 Ack=630126 Win=543744 Len=0 TSval=27694220 TSecr=721087177
186   0.173290 54.230.30.50 -> 172.31.36.109 TCP 4410 [TCP segment of a reassembled PDU]
187   0.173296 172.31.36.109 -> 54.230.30.50 TCP 66 35483 > http [ACK] Seq=97 Ack=634470 Win=560512 Len=0 TSval=27694220 TSecr=721087177
188   0.173307 54.230.30.50 -> 172.31.36.109 TCP 8754 [TCP segment of a reassembled PDU]
189   0.173632 54.230.30.50 -> 172.31.36.109 TCP 13098 [TCP segment of a reassembled PDU]
190   0.174043 54.230.30.50 -> 172.31.36.109 TCP 7306 [TCP segment of a reassembled PDU]
191   0.174157 54.230.30.50 -> 172.31.36.109 TCP 4410 [TCP segment of a reassembled PDU]
192   0.174292 54.230.30.50 -> 172.31.36.109 TCP 4410 [TCP segment of a reassembled PDU]
193   0.174420 54.230.30.50 -> 172.31.36.109 TCP 7306 [TCP segment of a reassembled PDU]
194   0.174555 54.230.30.50 -> 172.31.36.109 TCP 4410 [TCP segment of a reassembled PDU]
195   0.174716 54.230.30.50 -> 172.31.36.109 TCP 21786 [TCP segment of a reassembled PDU]
196   0.174764 54.230.30.50 -> 172.31.36.109 TCP 10202 [TCP segment of a reassembled PDU]
197   0.174905 54.230.30.50 -> 172.31.36.109 TCP 7306 [TCP segment of a reassembled PDU]
198   0.175872 172.31.36.109 -> 54.230.30.50 TCP 66 35483 > http [ACK] Seq=97 Ack=722798 Win=472192 Len=0 TSval=27694221 TSecr=721087177
199   0.177065 54.230.30.50 -> 172.31.36.109 TCP 4410 [TCP segment of a reassembled PDU]
200   0.177074 172.31.36.109 -> 54.230.30.50 TCP 66 35483 > http [ACK] Seq=97 Ack=727142 Win=560512 Len=0 TSval=27694221 TSecr=721087177
201   0.177135 54.230.30.50 -> 172.31.36.109 TCP 1514 [TCP segment of a reassembled PDU]
202   0.177298 54.230.30.50 -> 172.31.36.109 TCP 21786 [TCP segment of a reassembled PDU]
203   0.177403 54.230.30.50 -> 172.31.36.109 TCP 17442 [TCP segment of a reassembled PDU]
204   0.177524 54.230.30.50 -> 172.31.36.109 TCP 10202 [TCP segment of a reassembled PDU]
205   0.177604 172.31.36.109 -> 54.230.30.50 TCP 66 35483 > http [ACK] Seq=97 Ack=777822 Win=509952 Len=0 TSval=27694221 TSecr=721087177
206   0.177700 54.230.30.50 -> 172.31.36.109 TCP 8754 [TCP segment of a reassembled PDU]
207   0.177708 172.31.36.109 -> 54.230.30.50 TCP 66 35483 > http [ACK] Seq=97 Ack=786510 Win=553344 Len=0 TSval=27694221 TSecr=721087177
208   0.177804 54.230.30.50 -> 172.31.36.109 TCP 20338 [TCP segment of a reassembled PDU]
209   0.177823 172.31.36.109 -> 54.230.30.50 TCP 66 35483 > http [ACK] Seq=97 Ack=806782 Win=534272 Len=0 TSval=27694221 TSecr=721087177
210   0.177977 54.230.30.50 -> 172.31.36.109 TCP 2962 [TCP segment of a reassembled PDU]
211   0.177982 172.31.36.109 -> 54.230.30.50 TCP 66 35483 > http [ACK] Seq=97 Ack=809678 Win=562816 Len=0 TSval=27694221 TSecr=721087177
212   0.178931 54.230.30.50 -> 172.31.36.109 TCP 2962 [TCP segment of a reassembled PDU]
213   0.178938 172.31.36.109 -> 54.230.30.50 TCP 66 35483 > http [ACK] Seq=97 Ack=812574 Win=562816 Len=0 TSval=27694221 TSecr=721087178
214   0.179095 54.230.30.50 -> 172.31.36.109 TCP 17442 [TCP segment of a reassembled PDU]
215   0.179136 172.31.36.109 -> 54.230.30.50 TCP 66 35483 > http [ACK] Seq=97 Ack=829950 Win=545536 Len=0 TSval=27694221 TSecr=721087178
216   0.179173 54.230.30.50 -> 172.31.36.109 TCP 5858 [TCP segment of a reassembled PDU]
217   0.179178 172.31.36.109 -> 54.230.30.50 TCP 66 35483 > http [ACK] Seq=97 Ack=835742 Win=558080 Len=0 TSval=27694221 TSecr=721087178
218   0.179223 54.230.30.50 -> 172.31.36.109 TCP 1514 [TCP segment of a reassembled PDU]
219   0.179394 54.230.30.50 -> 172.31.36.109 TCP 18890 [TCP segment of a reassembled PDU]
220   0.179414 172.31.36.109 -> 54.230.30.50 TCP 66 35483 > http [ACK] Seq=97 Ack=856014 Win=537856 Len=0 TSval=27694221 TSecr=721087178
221   0.179443 54.230.30.50 -> 172.31.36.109 TCP 10202 [TCP segment of a reassembled PDU]
222   0.179450 172.31.36.109 -> 54.230.30.50 TCP 66 35483 > http [ACK] Seq=97 Ack=866150 Win=551040 Len=0 TSval=27694221 TSecr=721087178
223   0.179588 54.230.30.50 -> 172.31.36.109 TCP 20338 [TCP segment of a reassembled PDU]
224   0.179682 172.31.36.109 -> 54.230.30.50 TCP 66 35483 > http [ACK] Seq=97 Ack=886422 Win=567808 Len=0 TSval=27694221 TSecr=721087178
225   0.179702 54.230.30.50 -> 172.31.36.109 TCP 15994 [TCP segment of a reassembled PDU]
226   0.179715 172.31.36.109 -> 54.230.30.50 TCP 66 35483 > http [ACK] Seq=97 Ack=902350 Win=599680 Len=0 TSval=27694221 TSecr=721087178
227   0.179770 54.230.30.50 -> 172.31.36.109 TCP 10202 [TCP segment of a reassembled PDU]
228   0.179778 172.31.36.109 -> 54.230.30.50 TCP 66 35483 > http [ACK] Seq=97 Ack=912486 Win=619904 Len=0 TSval=27694221 TSecr=721087178
229   0.180469 54.230.30.50 -> 172.31.36.109 TCP 2962 [TCP segment of a reassembled PDU]
230   0.180475 172.31.36.109 -> 54.230.30.50 TCP 66 35483 > http [ACK] Seq=97 Ack=915382 Win=625792 Len=0 TSval=27694222 TSecr=721087178
231   0.180593 54.230.30.50 -> 172.31.36.109 TCP 23234 [TCP segment of a reassembled PDU]
232   0.180617 172.31.36.109 -> 54.230.30.50 TCP 66 35483 > http [ACK] Seq=97 Ack=938550 Win=672128 Len=0 TSval=27694222 TSecr=721087178
233   0.180701 54.230.30.50 -> 172.31.36.109 TCP 1514 [TCP segment of a reassembled PDU]
234   0.180706 172.31.36.109 -> 54.230.30.50 TCP 66 35483 > http [ACK] Seq=97 Ack=939998 Win=674944 Len=0 TSval=27694222 TSecr=721087178
235   0.180891 54.230.30.50 -> 172.31.36.109 TCP 7306 [TCP segment of a reassembled PDU]
236   0.180898 172.31.36.109 -> 54.230.30.50 TCP 66 35483 > http [ACK] Seq=97 Ack=947238 Win=689408 Len=0 TSval=27694222 TSecr=721087178
237   0.181097 54.230.30.50 -> 172.31.36.109 TCP 2962 [TCP segment of a reassembled PDU]
238   0.181103 172.31.36.109 -> 54.230.30.50 TCP 66 35483 > http [ACK] Seq=97 Ack=950134 Win=695296 Len=0 TSval=27694222 TSecr=721087178
239   0.181241 54.230.30.50 -> 172.31.36.109 TCP 23234 [TCP segment of a reassembled PDU]
240   0.181253 172.31.36.109 -> 54.230.30.50 TCP 66 35483 > http [ACK] Seq=97 Ack=973302 Win=741632 Len=0 TSval=27694222 TSecr=721087178
241   0.181320 54.230.30.50 -> 172.31.36.109 TCP 17442 [TCP segment of a reassembled PDU]
242   0.181333 172.31.36.109 -> 54.230.30.50 TCP 66 35483 > http [ACK] Seq=97 Ack=990678 Win=776320 Len=0 TSval=27694222 TSecr=721087178
243   0.181415 54.230.30.50 -> 172.31.36.109 TCP 11650 [TCP segment of a reassembled PDU]
244   0.181423 172.31.36.109 -> 54.230.30.50 TCP 66 35483 > http [ACK] Seq=97 Ack=1002262 Win=799488 Len=0 TSval=27694222 TSecr=721087178
245   0.181529 54.230.30.50 -> 172.31.36.109 TCP 2962 [TCP segment of a reassembled PDU]
246   0.181533 172.31.36.109 -> 54.230.30.50 TCP 66 35483 > http [ACK] Seq=97 Ack=1005158 Win=805248 Len=0 TSval=27694222 TSecr=721087178
247   0.182031 54.230.30.50 -> 172.31.36.109 TCP 2962 [TCP segment of a reassembled PDU]
248   0.182037 172.31.36.109 -> 54.230.30.50 TCP 66 35483 > http [ACK] Seq=97 Ack=1008054 Win=811136 Len=0 TSval=27694222 TSecr=721087178
249   0.182168 54.230.30.50 -> 172.31.36.109 TCP 24682 [TCP segment of a reassembled PDU]
250   0.182193 172.31.36.109 -> 54.230.30.50 TCP 66 35483 > http [ACK] Seq=97 Ack=1032670 Win=860288 Len=0 TSval=27694222 TSecr=721087178
251   0.182254 54.230.30.50 -> 172.31.36.109 TCP 13098 [TCP segment of a reassembled PDU]
252   0.182263 172.31.36.109 -> 54.230.30.50 TCP 66 35483 > http [ACK] Seq=97 Ack=1045702 Win=886400 Len=0 TSval=27694222 TSecr=721087178
253   0.182335 54.230.30.50 -> 172.31.36.109 HTTP 3398 HTTP/1.1 200 OK  (application/octet-stream)
254   0.182340 172.31.36.109 -> 54.230.30.50 TCP 66 35483 > http [ACK] Seq=97 Ack=1049034 Win=886400 Len=0 TSval=27694222 TSecr=721087178
255   0.182458 172.31.36.109 -> 54.230.30.50 TCP 66 35483 > http [FIN, ACK] Seq=97 Ack=1049034 Win=886400 Len=0 TSval=27694222 TSecr=721087178
256   0.183766 54.230.30.50 -> 172.31.36.109 TCP 66 http > 35483 [FIN, ACK] Seq=1049034 Ack=98 Win=14592 Len=0 TSval=721087178 TSecr=27694222
257   0.183775 172.31.36.109 -> 54.230.30.50 TCP 66 35483 > http [ACK] Seq=98 Ack=1049035 Win=886400 Len=0 TSval=27694222 TSecr=721087178
