[Measurement for 10kb at 23:01:33 16.01.2014] 
Tshark:

  1   0.000000  192.168.1.2 -> 54.230.99.28 TCP 66 49476→80 [SYN] Seq=0 Win=8192 Len=0 MSS=1460 WS=256 SACK_PERM=1
  2   0.050315 54.230.99.28 -> 192.168.1.2  TCP 66 80→49476 [SYN, ACK] Seq=0 Ack=1 Win=14600 Len=0 MSS=1400 SACK_PERM=1 WS=128
  3   0.050453  192.168.1.2 -> 54.230.99.28 TCP 54 49476→80 [ACK] Seq=1 Ack=1 Win=65792 Len=0
  4   0.050627  192.168.1.2 -> 54.230.99.28 HTTP 151 GET /10kb HTTP/1.1 
  5   0.084747 54.230.99.28 -> 192.168.1.2  TCP 54 80→49476 [ACK] Seq=1 Ack=98 Win=14720 Len=0
  6   0.089253 54.230.99.28 -> 192.168.1.2  TCP 1454 [TCP segment of a reassembled PDU]
  7   0.091050 54.230.99.28 -> 192.168.1.2  TCP 1454 [TCP segment of a reassembled PDU]
  8   0.091168  192.168.1.2 -> 54.230.99.28 TCP 54 49476→80 [ACK] Seq=98 Ack=2801 Win=65792 Len=0
  9   0.091322 54.230.99.28 -> 192.168.1.2  TCP 1454 [TCP segment of a reassembled PDU]
 10   0.091368 54.230.99.28 -> 192.168.1.2  TCP 1454 [TCP segment of a reassembled PDU]
 11   0.091421  192.168.1.2 -> 54.230.99.28 TCP 54 49476→80 [ACK] Seq=98 Ack=5601 Win=65792 Len=0
 12   0.092712 54.230.99.28 -> 192.168.1.2  TCP 1454 [TCP segment of a reassembled PDU]
 13   0.092815 54.230.99.28 -> 192.168.1.2  TCP 1454 [TCP segment of a reassembled PDU]
 14   0.092879  192.168.1.2 -> 54.230.99.28 TCP 54 49476→80 [ACK] Seq=98 Ack=8401 Win=65792 Len=0
 15   0.093006 54.230.99.28 -> 192.168.1.2  TCP 1454 [TCP segment of a reassembled PDU]
 16   0.093076 54.230.99.28 -> 192.168.1.2  HTTP 949 HTTP/1.1 200 OK  (application/octet-stream)
 17   0.093115  192.168.1.2 -> 54.230.99.28 TCP 54 49476→80 [ACK] Seq=98 Ack=10696 Win=65792 Len=0
 18   0.093235  192.168.1.2 -> 54.230.99.28 TCP 54 49476→80 [FIN, ACK] Seq=98 Ack=10696 Win=65792 Len=0
 19   0.121139 54.230.99.28 -> 192.168.1.2  TCP 54 80→49476 [FIN, ACK] Seq=10696 Ack=99 Win=14720 Len=0
 20   0.121269  192.168.1.2 -> 54.230.99.28 TCP 54 49476→80 [ACK] Seq=99 Ack=10697 Win=65792 Len=0
