[Measurement for 10kb at 11:33:23 20.33.2014] 
Tshark:

  1   0.000000 172.31.36.109 -> 172.31.0.2   DNS 89 Standard query 0xb6b7  A d1n0gskdvzj94j.cloudfront.net
  2   0.000026 172.31.36.109 -> 172.31.0.2   DNS 89 Standard query 0xa34c  AAAA d1n0gskdvzj94j.cloudfront.net
  3   0.000537   172.31.0.2 -> 172.31.36.109 DNS 217 Standard query response 0xb6b7  A 54.230.21.70 A 54.230.21.79 A 54.230.21.222 A 54.230.23.210 A 216.137.41.20 A 216.137.41.37 A 216.137.41.104 A 54.230.21.2
  4   0.000550   172.31.0.2 -> 172.31.36.109 DNS 176 Standard query response 0xa34c 
  5   0.003875 172.31.36.109 -> 54.230.21.70 TCP 74 48423 > http [SYN] Seq=0 Win=26883 Len=0 MSS=8961 SACK_PERM=1 TSval=36722408 TSecr=0 WS=128
  6   0.089853 54.230.21.70 -> 172.31.36.109 TCP 74 http > 48423 [SYN, ACK] Seq=0 Ack=1 Win=14480 Len=0 MSS=1460 SACK_PERM=1 TSval=948813357 TSecr=36722408 WS=128
  7   0.089877 172.31.36.109 -> 54.230.21.70 TCP 66 48423 > http [ACK] Seq=1 Ack=1 Win=27008 Len=0 TSval=36722430 TSecr=948813357
  8   0.089946 172.31.36.109 -> 54.230.21.70 HTTP 163 GET /10kb HTTP/1.1 
  9   0.176137 54.230.21.70 -> 172.31.36.109 TCP 66 http > 48423 [ACK] Seq=1 Ack=98 Win=14592 Len=0 TSval=948813365 TSecr=36722430
 10   0.184172 54.230.21.70 -> 172.31.36.109 HTTP 10761 HTTP/1.1 200 OK  (application/octet-stream)
 11   0.184187 172.31.36.109 -> 54.230.21.70 TCP 66 48423 > http [ACK] Seq=98 Ack=10696 Win=48384 Len=0 TSval=36722453 TSecr=948813366
 12   0.184373 172.31.36.109 -> 54.230.21.70 TCP 66 48423 > http [FIN, ACK] Seq=98 Ack=10696 Win=48384 Len=0 TSval=36722454 TSecr=948813366
 13   0.270542 54.230.21.70 -> 172.31.36.109 TCP 66 http > 48423 [FIN, ACK] Seq=10696 Ack=99 Win=14592 Len=0 TSval=948813375 TSecr=36722454
 14   0.270552 172.31.36.109 -> 54.230.21.70 TCP 66 48423 > http [ACK] Seq=99 Ack=10697 Win=48384 Len=0 TSval=36722475 TSecr=948813375
