[Measurement for 10kb at 17:36:38 19.36.2014] 
Tshark:

  1   0.000000 172.31.36.109 -> 172.31.0.2   DNS 89 Standard query 0x6023  A d1n0gskdvzj94j.cloudfront.net
  2   0.000025 172.31.36.109 -> 172.31.0.2   DNS 89 Standard query 0x6f51  AAAA d1n0gskdvzj94j.cloudfront.net
  3   0.000536   172.31.0.2 -> 172.31.36.109 DNS 217 Standard query response 0x6023  A 54.230.20.154 A 54.230.21.79 A 54.230.21.146 A 54.230.21.237 A 54.230.23.102 A 54.230.23.104 A 54.230.20.43 A 54.230.20.115
  4   0.000546   172.31.0.2 -> 172.31.36.109 DNS 176 Standard query response 0x6f51 
  5   0.003891 172.31.36.109 -> 54.230.20.154 TCP 74 53004 > http [SYN] Seq=0 Win=26883 Len=0 MSS=8961 SACK_PERM=1 TSval=20571193 TSecr=0 WS=128
  6   0.093923 54.230.20.154 -> 172.31.36.109 TCP 74 http > 53004 [SYN, ACK] Seq=0 Ack=1 Win=14480 Len=0 MSS=1460 SACK_PERM=1 TSval=929377243 TSecr=20571193 WS=128
  7   0.093939 172.31.36.109 -> 54.230.20.154 TCP 66 53004 > http [ACK] Seq=1 Ack=1 Win=27008 Len=0 TSval=20571216 TSecr=929377243
  8   0.093997 172.31.36.109 -> 54.230.20.154 HTTP 163 GET /10kb HTTP/1.1 
  9   0.183841 54.230.20.154 -> 172.31.36.109 TCP 66 http > 53004 [ACK] Seq=1 Ack=98 Win=14592 Len=0 TSval=929377252 TSecr=20571216
 10   0.299640 54.230.20.154 -> 172.31.36.109 TCP 1169 [TCP segment of a reassembled PDU]
 11   0.299665 172.31.36.109 -> 54.230.20.154 TCP 66 53004 > http [ACK] Seq=98 Ack=1104 Win=29184 Len=0 TSval=20571267 TSecr=929377263
 12   0.299677 54.230.20.154 -> 172.31.36.109 HTTP 9647 HTTP/1.1 200 OK  (application/octet-stream)
 13   0.299684 172.31.36.109 -> 54.230.20.154 TCP 66 53004 > http [ACK] Seq=98 Ack=10685 Win=48256 Len=0 TSval=20571267 TSecr=929377263
 14   0.299946 172.31.36.109 -> 54.230.20.154 TCP 66 53004 > http [FIN, ACK] Seq=98 Ack=10685 Win=48256 Len=0 TSval=20571267 TSecr=929377263
 15   0.389780 54.230.20.154 -> 172.31.36.109 TCP 66 http > 53004 [FIN, ACK] Seq=10685 Ack=99 Win=14592 Len=0 TSval=929377272 TSecr=20571267
 16   0.389789 172.31.36.109 -> 54.230.20.154 TCP 66 53004 > http [ACK] Seq=99 Ack=10686 Win=48256 Len=0 TSval=20571290 TSecr=929377272
