[Measurement for 10kb at 23:33:21 19.33.2014] 
Tshark:

  1   0.000000 172.31.36.109 -> 172.31.0.2   DNS 89 Standard query 0xbce2  A d1n0gskdvzj94j.cloudfront.net
  2   0.000024 172.31.36.109 -> 172.31.0.2   DNS 89 Standard query 0xb0bd  AAAA d1n0gskdvzj94j.cloudfront.net
  3   0.000400   172.31.0.2 -> 172.31.36.109 DNS 176 Standard query response 0xb0bd 
  4   0.000413   172.31.0.2 -> 172.31.36.109 DNS 217 Standard query response 0xbce2  A 54.239.158.207 A 54.239.158.232 A 54.239.158.238 A 54.230.185.176 A 54.230.186.217 A 54.230.187.34 A 54.230.187.123 A 54.239.158.150
  5   0.003884 172.31.36.109 -> 54.239.158.207 TCP 74 50243 > http [SYN] Seq=0 Win=26883 Len=0 MSS=8961 SACK_PERM=1 TSval=25922016 TSecr=0 WS=128
  6   0.021978 54.239.158.207 -> 172.31.36.109 TCP 74 http > 50243 [SYN, ACK] Seq=0 Ack=1 Win=14480 Len=0 MSS=1460 SACK_PERM=1 TSval=1028390491 TSecr=25922016 WS=128
  7   0.021992 172.31.36.109 -> 54.239.158.207 TCP 66 50243 > http [ACK] Seq=1 Ack=1 Win=27008 Len=0 TSval=25922021 TSecr=1028390491
  8   0.022036 172.31.36.109 -> 54.239.158.207 HTTP 163 GET /10kb HTTP/1.1 
  9   0.040136 54.239.158.207 -> 172.31.36.109 TCP 66 http > 50243 [ACK] Seq=1 Ack=98 Win=14592 Len=0 TSval=1028390493 TSecr=25922021
 10   0.047361 54.239.158.207 -> 172.31.36.109 TCP 4041 [TCP segment of a reassembled PDU]
 11   0.047371 172.31.36.109 -> 54.239.158.207 TCP 66 50243 > http [ACK] Seq=98 Ack=3976 Win=34944 Len=0 TSval=25922027 TSecr=1028390494
 12   0.047394 54.239.158.207 -> 172.31.36.109 HTTP 6785 HTTP/1.1 200 OK  (application/octet-stream)
 13   0.047403 172.31.36.109 -> 54.239.158.207 TCP 66 50243 > http [ACK] Seq=98 Ack=10695 Win=48384 Len=0 TSval=25922027 TSecr=1028390494
 14   0.047587 172.31.36.109 -> 54.239.158.207 TCP 66 50243 > http [FIN, ACK] Seq=98 Ack=10695 Win=48384 Len=0 TSval=25922027 TSecr=1028390494
 15   0.065752 54.239.158.207 -> 172.31.36.109 TCP 66 http > 50243 [FIN, ACK] Seq=10695 Ack=99 Win=14592 Len=0 TSval=1028390495 TSecr=25922027
 16   0.065763 172.31.36.109 -> 54.239.158.207 TCP 66 50243 > http [ACK] Seq=99 Ack=10696 Win=48384 Len=0 TSval=25922032 TSecr=1028390495
