[Measurement for 10kb at 19:33:32 19.33.2014] 
Tshark:

  1   0.000000 172.31.36.109 -> 172.31.0.2   DNS 89 Standard query 0x98e1  A d1n0gskdvzj94j.cloudfront.net
  2   0.000023 172.31.36.109 -> 172.31.0.2   DNS 89 Standard query 0xedc6  AAAA d1n0gskdvzj94j.cloudfront.net
  3   0.000560   172.31.0.2 -> 172.31.36.109 DNS 217 Standard query response 0x98e1  A 54.230.22.167 A 54.230.22.217 A 216.137.41.29 A 216.137.41.64 A 216.137.41.87 A 54.230.20.48 A 54.230.20.182 A 54.230.20.193
  4   0.000571   172.31.0.2 -> 172.31.36.109 DNS 176 Standard query response 0xedc6 
  5   0.003900 172.31.36.109 -> 54.230.22.167 TCP 74 38898 > http [SYN] Seq=0 Win=26883 Len=0 MSS=8961 SACK_PERM=1 TSval=22324787 TSecr=0 WS=128
  6   0.100037 54.230.22.167 -> 172.31.36.109 TCP 74 http > 38898 [SYN, ACK] Seq=0 Ack=1 Win=14480 Len=0 MSS=1460 SACK_PERM=1 TSval=945955762 TSecr=22324787 WS=128
  7   0.100054 172.31.36.109 -> 54.230.22.167 TCP 66 38898 > http [ACK] Seq=1 Ack=1 Win=27008 Len=0 TSval=22324811 TSecr=945955762
  8   0.100102 172.31.36.109 -> 54.230.22.167 HTTP 163 GET /10kb HTTP/1.1 
  9   0.196323 54.230.22.167 -> 172.31.36.109 TCP 66 http > 38898 [ACK] Seq=1 Ack=98 Win=14592 Len=0 TSval=945955772 TSecr=22324811
 10   0.199169 54.230.22.167 -> 172.31.36.109 HTTP 10760 HTTP/1.1 200 OK  (application/octet-stream)
 11   0.199181 172.31.36.109 -> 54.230.22.167 TCP 66 38898 > http [ACK] Seq=98 Ack=10695 Win=48384 Len=0 TSval=22324836 TSecr=945955772
 12   0.199369 172.31.36.109 -> 54.230.22.167 TCP 66 38898 > http [FIN, ACK] Seq=98 Ack=10695 Win=48384 Len=0 TSval=22324836 TSecr=945955772
 13   0.295633 54.230.22.167 -> 172.31.36.109 TCP 66 http > 38898 [FIN, ACK] Seq=10695 Ack=99 Win=14592 Len=0 TSval=945955782 TSecr=22324836
 14   0.295642 172.31.36.109 -> 54.230.22.167 TCP 66 38898 > http [ACK] Seq=99 Ack=10696 Win=48384 Len=0 TSval=22324860 TSecr=945955782
