[Measurement for 10kb at 08:33:26 20.33.2014] 
Tshark:

  1   0.000000 172.31.36.109 -> 172.31.0.2   DNS 89 Standard query 0xf693  A d1n0gskdvzj94j.cloudfront.net
  2   0.000026 172.31.36.109 -> 172.31.0.2   DNS 89 Standard query 0x8809  AAAA d1n0gskdvzj94j.cloudfront.net
  3   0.000714   172.31.0.2 -> 172.31.36.109 DNS 217 Standard query response 0xf693  A 54.192.29.221 A 54.192.30.191 A 54.192.30.218 A 54.230.30.67 A 54.230.30.215 A 54.230.30.217 A 54.230.30.230 A 54.230.30.254
  4   0.000725   172.31.0.2 -> 172.31.36.109 DNS 176 Standard query response 0x8809 
  5   0.003857 172.31.36.109 -> 54.192.29.221 TCP 74 58585 > http [SYN] Seq=0 Win=26883 Len=0 MSS=8961 SACK_PERM=1 TSval=34023298 TSecr=0 WS=128
  6   0.005127 54.192.29.221 -> 172.31.36.109 TCP 74 http > 58585 [SYN, ACK] Seq=0 Ack=1 Win=14480 Len=0 MSS=1460 SACK_PERM=1 TSval=718036465 TSecr=34023298 WS=128
  7   0.005141 172.31.36.109 -> 54.192.29.221 TCP 66 58585 > http [ACK] Seq=1 Ack=1 Win=27008 Len=0 TSval=34023298 TSecr=718036465
  8   0.005183 172.31.36.109 -> 54.192.29.221 HTTP 163 GET /10kb HTTP/1.1 
  9   0.006342 54.192.29.221 -> 172.31.36.109 TCP 66 http > 58585 [ACK] Seq=1 Ack=98 Win=14592 Len=0 TSval=718036465 TSecr=34023298
 10   0.018745 54.192.29.221 -> 172.31.36.109 TCP 2962 [TCP segment of a reassembled PDU]
 11   0.018768 172.31.36.109 -> 54.192.29.221 TCP 66 58585 > http [ACK] Seq=98 Ack=2897 Win=32768 Len=0 TSval=34023302 TSecr=718036467
 12   0.018917 54.192.29.221 -> 172.31.36.109 TCP 4040 [TCP segment of a reassembled PDU]
 13   0.018924 172.31.36.109 -> 54.192.29.221 TCP 66 58585 > http [ACK] Seq=98 Ack=6871 Win=40704 Len=0 TSval=34023302 TSecr=718036467
 14   0.018931 54.192.29.221 -> 172.31.36.109 HTTP 3891 HTTP/1.1 200 OK  (application/octet-stream)
 15   0.018936 172.31.36.109 -> 54.192.29.221 TCP 66 58585 > http [ACK] Seq=98 Ack=10696 Win=48384 Len=0 TSval=34023302 TSecr=718036467
 16   0.019048 172.31.36.109 -> 54.192.29.221 TCP 66 58585 > http [FIN, ACK] Seq=98 Ack=10696 Win=48384 Len=0 TSval=34023302 TSecr=718036467
 17   0.020445 54.192.29.221 -> 172.31.36.109 TCP 66 http > 58585 [FIN, ACK] Seq=10696 Ack=99 Win=14592 Len=0 TSval=718036467 TSecr=34023302
 18   0.020453 172.31.36.109 -> 54.192.29.221 TCP 66 58585 > http [ACK] Seq=99 Ack=10697 Win=48384 Len=0 TSval=34023302 TSecr=718036467
