[Measurement for 10kb at 00:33:21 20.33.2014] 
Tshark:

  1   0.000000 172.31.36.109 -> 172.31.0.2   DNS 89 Standard query 0xd186  A d1n0gskdvzj94j.cloudfront.net
  2   0.000029 172.31.36.109 -> 172.31.0.2   DNS 89 Standard query 0x4c07  AAAA d1n0gskdvzj94j.cloudfront.net
  3   0.000494   172.31.0.2 -> 172.31.36.109 DNS 217 Standard query response 0xd186  A 54.230.30.218 A 54.230.30.222 A 54.230.30.249 A 54.230.31.2 A 54.230.29.244 A 54.230.30.5 A 54.230.30.11 A 54.230.30.191
  4   0.000539   172.31.0.2 -> 172.31.36.109 DNS 176 Standard query response 0x4c07 
  5   0.003851 172.31.36.109 -> 54.230.30.218 TCP 74 51694 > http [SYN] Seq=0 Win=26883 Len=0 MSS=8961 SACK_PERM=1 TSval=26822053 TSecr=0 WS=128
  6   0.005164 54.230.30.218 -> 172.31.36.109 TCP 74 http > 51694 [SYN, ACK] Seq=0 Ack=1 Win=14480 Len=0 MSS=1460 SACK_PERM=1 TSval=718975525 TSecr=26822053 WS=128
  7   0.005178 172.31.36.109 -> 54.230.30.218 TCP 66 51694 > http [ACK] Seq=1 Ack=1 Win=27008 Len=0 TSval=26822054 TSecr=718975525
  8   0.005221 172.31.36.109 -> 54.230.30.218 HTTP 163 GET /10kb HTTP/1.1 
  9   0.006417 54.230.30.218 -> 172.31.36.109 TCP 66 http > 51694 [ACK] Seq=1 Ack=98 Win=14592 Len=0 TSval=718975526 TSecr=26822054
 10   0.026244 54.230.30.218 -> 172.31.36.109 TCP 5858 [TCP segment of a reassembled PDU]
 11   0.026258 172.31.36.109 -> 54.230.30.218 TCP 66 51694 > http [ACK] Seq=98 Ack=5793 Win=38528 Len=0 TSval=26822059 TSecr=718975528
 12   0.026371 54.230.30.218 -> 172.31.36.109 HTTP 4969 HTTP/1.1 200 OK  (application/octet-stream)
 13   0.026378 172.31.36.109 -> 54.230.30.218 TCP 66 51694 > http [ACK] Seq=98 Ack=10696 Win=48384 Len=0 TSval=26822059 TSecr=718975528
 14   0.026507 172.31.36.109 -> 54.230.30.218 TCP 66 51694 > http [FIN, ACK] Seq=98 Ack=10696 Win=48384 Len=0 TSval=26822059 TSecr=718975528
 15   0.027658 54.230.30.218 -> 172.31.36.109 TCP 66 http > 51694 [FIN, ACK] Seq=10696 Ack=99 Win=14592 Len=0 TSval=718975528 TSecr=26822059
 16   0.027667 172.31.36.109 -> 54.230.30.218 TCP 66 51694 > http [ACK] Seq=99 Ack=10697 Win=48384 Len=0 TSval=26822059 TSecr=718975528
