[Measurement for 10kb at 15:04:31 16.04.2014] 
Tshark:

  1   0.000000  192.168.1.2 -> 54.230.99.21 TCP 66 62585→80 [SYN] Seq=0 Win=8192 Len=0 MSS=1460 WS=256 SACK_PERM=1
  2   0.053824 54.230.99.21 -> 192.168.1.2  TCP 66 80→62585 [SYN, ACK] Seq=0 Ack=1 Win=14600 Len=0 MSS=1400 SACK_PERM=1 WS=128
  3   0.053955  192.168.1.2 -> 54.230.99.21 TCP 54 62585→80 [ACK] Seq=1 Ack=1 Win=65792 Len=0
  4   0.054301  192.168.1.2 -> 54.230.99.21 HTTP 151 GET /10kb HTTP/1.1 
  5   0.095159 54.230.99.21 -> 192.168.1.2  TCP 54 80→62585 [ACK] Seq=1 Ack=98 Win=14720 Len=0
  6   0.100258 54.230.99.21 -> 192.168.1.2  TCP 1454 [TCP segment of a reassembled PDU]
  7   0.101236 54.230.99.21 -> 192.168.1.2  TCP 1454 [TCP segment of a reassembled PDU]
  8   0.101315  192.168.1.2 -> 54.230.99.21 TCP 54 62585→80 [ACK] Seq=98 Ack=2801 Win=65792 Len=0
  9   0.102566 54.230.99.21 -> 192.168.1.2  TCP 1454 [TCP segment of a reassembled PDU]
 10   0.104022 54.230.99.21 -> 192.168.1.2  TCP 1454 [TCP segment of a reassembled PDU]
 11   0.104086  192.168.1.2 -> 54.230.99.21 TCP 54 62585→80 [ACK] Seq=98 Ack=5601 Win=65792 Len=0
 12   0.104183 54.230.99.21 -> 192.168.1.2  TCP 1454 [TCP segment of a reassembled PDU]
 13   0.104221 54.230.99.21 -> 192.168.1.2  TCP 1454 [TCP segment of a reassembled PDU]
 14   0.104268  192.168.1.2 -> 54.230.99.21 TCP 54 62585→80 [ACK] Seq=98 Ack=8401 Win=65792 Len=0
 15   0.104384 54.230.99.21 -> 192.168.1.2  TCP 1454 [TCP segment of a reassembled PDU]
 16   0.104426 54.230.99.21 -> 192.168.1.2  HTTP 948 HTTP/1.1 200 OK  (application/octet-stream)
 17   0.104471  192.168.1.2 -> 54.230.99.21 TCP 54 62585→80 [ACK] Seq=98 Ack=10695 Win=65792 Len=0
 18   0.104546  192.168.1.2 -> 54.230.99.21 TCP 54 62585→80 [FIN, ACK] Seq=98 Ack=10695 Win=65792 Len=0
 19   0.134267 54.230.99.21 -> 192.168.1.2  TCP 54 80→62585 [FIN, ACK] Seq=10695 Ack=99 Win=14720 Len=0
 20   0.134378  192.168.1.2 -> 54.230.99.21 TCP 54 62585→80 [ACK] Seq=99 Ack=10696 Win=65792 Len=0
 21   0.930057 fe80::446a:b521:8794:ef65 -> fe80::5ef9:6aff:fe25:83d4 DNS 99 Standard query 0x7728  A clients4.google.com
 22   0.958647 fe80::5ef9:6aff:fe25:83d4 -> fe80::446a:b521:8794:ef65 DNS 299 Standard query response 0x7728  CNAME clients.l.google.com A 74.125.232.194 A 74.125.232.197 A 74.125.232.196 A 74.125.232.198 A 74.125.232.201 A 74.125.232.192 A 74.125.232.199 A 74.125.232.193 A 74.125.232.195 A 74.125.232.200 A 74.125.232.206
 23   0.960299  192.168.1.2 -> 74.125.232.194 TCP 66 62586→443 [SYN] Seq=0 Win=8192 Len=0 MSS=1460 WS=256 SACK_PERM=1
 24   0.988421 74.125.232.194 -> 192.168.1.2  TCP 66 443→62586 [SYN, ACK] Seq=0 Ack=1 Win=42900 Len=0 MSS=1400 SACK_PERM=1 WS=128
 25   0.988531  192.168.1.2 -> 74.125.232.194 TCP 54 62586→443 [ACK] Seq=1 Ack=1 Win=65792 Len=0
 26   0.989221  192.168.1.2 -> 74.125.232.194 SSL 571 Client Hello
 27   1.021210 74.125.232.194 -> 192.168.1.2  TCP 54 443→62586 [ACK] Seq=1 Ack=518 Win=44032 Len=0
 28   1.021962 74.125.232.194 -> 192.168.1.2  TLSv1.2 198 Server Hello, Change Cipher Spec, Encrypted Handshake Message
 29   1.022716  192.168.1.2 -> 74.125.232.194 TLSv1.2 97 Change Cipher Spec, Encrypted Handshake Message
 30   1.038326  192.168.1.2 -> 74.125.232.194 TLSv1.2 103 Application Data
 31   1.038565  192.168.1.2 -> 74.125.232.194 TLSv1.2 91 Application Data
 32   1.038776  192.168.1.2 -> 74.125.232.194 TLSv1.2 111 Application Data
 33   1.039599  192.168.1.2 -> 74.125.232.194 TLSv1.2 464 Application Data
 34   1.039948  192.168.1.2 -> 74.125.232.194 TCP 1454 [TCP segment of a reassembled PDU]
 35   1.039966  192.168.1.2 -> 74.125.232.194 TCP 1454 [TCP segment of a reassembled PDU]
 36   1.039982  192.168.1.2 -> 74.125.232.194 TLSv1.2 135 Application Data
 37   1.040358  192.168.1.2 -> 74.125.232.194 TCP 1454 [TCP segment of a reassembled PDU]
 38   1.040375  192.168.1.2 -> 74.125.232.194 TLSv1.2 482 Application Data
 39   1.048204 74.125.232.194 -> 192.168.1.2  TLSv1.2 103 Application Data
 40   1.049157 74.125.232.194 -> 192.168.1.2  TLSv1.2 91 Application Data
 41   1.049201  192.168.1.2 -> 74.125.232.194 TCP 54 62586→443 [ACK] Seq=5823 Ack=231 Win=65536 Len=0
 42   1.073141 74.125.232.194 -> 192.168.1.2  TCP 54 443→62586 [ACK] Seq=231 Ack=647 Win=44032 Len=0
 43   1.074079 74.125.232.194 -> 192.168.1.2  TCP 54 443→62586 [ACK] Seq=231 Ack=1114 Win=45056 Len=0
 44   1.083877 74.125.232.194 -> 192.168.1.2  TCP 54 443→62586 [ACK] Seq=231 Ack=3914 Win=50688 Len=0
 45   1.084639 74.125.232.194 -> 192.168.1.2  TCP 54 443→62586 [ACK] Seq=231 Ack=5395 Win=53504 Len=0
 46   1.098873 74.125.232.194 -> 192.168.1.2  TLSv1.2 355 Application Data
 47   1.108659 74.125.232.194 -> 192.168.1.2  TLSv1.2 1454 Application Data
 48   1.108712  192.168.1.2 -> 74.125.232.194 TCP 54 62586→443 [ACK] Seq=5823 Ack=1932 Win=65792 Len=0
 49   1.108866 74.125.232.194 -> 192.168.1.2  TLSv1.2 1454 Application Data
 50   1.108890 74.125.232.194 -> 192.168.1.2  TLSv1.2 1454 Application Data
 51   1.108924  192.168.1.2 -> 74.125.232.194 TCP 54 62586→443 [ACK] Seq=5823 Ack=4732 Win=65792 Len=0
 52   1.109065 74.125.232.194 -> 192.168.1.2  TLSv1.2 512 Application Data, Application Data
 53   1.109665  192.168.1.2 -> 74.125.232.194 TLSv1.2 87 Application Data
 54   1.112133  192.168.1.2 -> 74.125.232.194 TLSv1.2 310 Application Data
 55   1.112362  192.168.1.2 -> 74.125.232.194 TLSv1.2 753 Application Data
 56   1.140056 74.125.232.194 -> 192.168.1.2  TCP 54 443→62586 [ACK] Seq=5190 Ack=6112 Win=59136 Len=0
 57   1.186401 74.125.232.194 -> 192.168.1.2  TLSv1.2 108 Application Data
 58   1.186992 74.125.232.194 -> 192.168.1.2  TLSv1.2 436 Application Data, Application Data
 59   1.187039  192.168.1.2 -> 74.125.232.194 TCP 54 62586→443 [ACK] Seq=6811 Ack=5626 Win=64768 Len=0
 60   1.187504  192.168.1.2 -> 74.125.232.194 TLSv1.2 87 Application Data
 61   1.253223 74.125.232.194 -> 192.168.1.2  TCP 54 443→62586 [ACK] Seq=5626 Ack=6844 Win=61952 Len=0
