[Measurement for 10kb at 09:04:24 17.04.2014] 
Tshark:

  1   0.000000 74.125.232.199 -> 192.168.1.2  TCP 66 443→51243 [ACK] Seq=1 Ack=1 Win=1373 Len=0 SLE=0 SRE=1
  2   1.308149  192.168.1.2 -> 54.230.96.45 TCP 66 51458→80 [SYN] Seq=0 Win=8192 Len=0 MSS=1460 WS=256 SACK_PERM=1
  3   1.363052 54.230.96.45 -> 192.168.1.2  TCP 66 80→51458 [SYN, ACK] Seq=0 Ack=1 Win=14600 Len=0 MSS=1400 SACK_PERM=1 WS=128
  4   1.363215  192.168.1.2 -> 54.230.96.45 TCP 54 51458→80 [ACK] Seq=1 Ack=1 Win=65792 Len=0
  5   1.363383  192.168.1.2 -> 54.230.96.45 HTTP 151 GET /10kb HTTP/1.1 
  6   1.405959 54.230.96.45 -> 192.168.1.2  TCP 54 80→51458 [ACK] Seq=1 Ack=98 Win=14720 Len=0
  7   1.410148 54.230.96.45 -> 192.168.1.2  TCP 1454 [TCP segment of a reassembled PDU]
  8   1.412348 54.230.96.45 -> 192.168.1.2  TCP 1454 [TCP segment of a reassembled PDU]
  9   1.412422  192.168.1.2 -> 54.230.96.45 TCP 54 51458→80 [ACK] Seq=98 Ack=2801 Win=65792 Len=0
 10   1.412555 54.230.96.45 -> 192.168.1.2  TCP 1454 [TCP segment of a reassembled PDU]
 11   1.412595 54.230.96.45 -> 192.168.1.2  TCP 1454 [TCP segment of a reassembled PDU]
 12   1.412639  192.168.1.2 -> 54.230.96.45 TCP 54 51458→80 [ACK] Seq=98 Ack=5601 Win=65792 Len=0
 13   1.412747 54.230.96.45 -> 192.168.1.2  TCP 1454 [TCP segment of a reassembled PDU]
 14   1.412795 54.230.96.45 -> 192.168.1.2  TCP 1454 [TCP segment of a reassembled PDU]
 15   1.412840  192.168.1.2 -> 54.230.96.45 TCP 54 51458→80 [ACK] Seq=98 Ack=8401 Win=65792 Len=0
 16   1.412959 54.230.96.45 -> 192.168.1.2  TCP 1454 [TCP segment of a reassembled PDU]
 17   1.413004 54.230.96.45 -> 192.168.1.2  HTTP 949 HTTP/1.1 200 OK  (application/octet-stream)
 18   1.413049  192.168.1.2 -> 54.230.96.45 TCP 54 51458→80 [ACK] Seq=98 Ack=10696 Win=65792 Len=0
 19   1.413339  192.168.1.2 -> 54.230.96.45 TCP 54 51458→80 [FIN, ACK] Seq=98 Ack=10696 Win=65792 Len=0
 20   1.442976 54.230.96.45 -> 192.168.1.2  TCP 54 80→51458 [FIN, ACK] Seq=10696 Ack=99 Win=14720 Len=0
 21   1.443134  192.168.1.2 -> 54.230.96.45 TCP 54 51458→80 [ACK] Seq=99 Ack=10697 Win=65792 Len=0
 22   2.139832 173.255.112.173 -> 192.168.1.2  TLSv1.2 100 Application Data
