[Measurement for 10kb at 11:04:20 17.04.2014] 
Tshark:

  1   0.000000 HuaweiTe_25:83:d4 -> IntelCor_3f:fc:98 ARP 42 Who has 192.168.1.2?  Tell 192.168.1.1
  2   0.000041 IntelCor_3f:fc:98 -> HuaweiTe_25:83:d4 ARP 42 192.168.1.2 is at 00:24:d7:3f:fc:98
  3   0.425360  192.168.1.2 -> 54.231.1.168 TCP 54 52552→443 [FIN, ACK] Seq=1 Ack=1 Win=255 Len=0
  4   0.585744 54.231.1.168 -> 192.168.1.2  TCP 54 443→52552 [ACK] Seq=1 Ack=2 Win=280 Len=0
  5   0.688421  192.168.1.2 -> 54.230.98.246 TCP 66 52557→80 [SYN] Seq=0 Win=8192 Len=0 MSS=1460 WS=256 SACK_PERM=1
  6   0.715672 54.230.98.246 -> 192.168.1.2  TCP 66 80→52557 [SYN, ACK] Seq=0 Ack=1 Win=14600 Len=0 MSS=1400 SACK_PERM=1 WS=128
  7   0.715822  192.168.1.2 -> 54.230.98.246 TCP 54 52557→80 [ACK] Seq=1 Ack=1 Win=65792 Len=0
  8   0.725668  192.168.1.2 -> 54.230.98.246 HTTP 151 GET /10kb HTTP/1.1 
  9   0.756883 54.230.98.246 -> 192.168.1.2  TCP 54 80→52557 [ACK] Seq=1 Ack=98 Win=14720 Len=0
 10   0.760562 54.230.98.246 -> 192.168.1.2  TCP 1454 [TCP segment of a reassembled PDU]
 11   0.761467 54.230.98.246 -> 192.168.1.2  TCP 1454 [TCP segment of a reassembled PDU]
 12   0.761545  192.168.1.2 -> 54.230.98.246 TCP 54 52557→80 [ACK] Seq=98 Ack=2801 Win=65792 Len=0
 13   0.762449 54.230.98.246 -> 192.168.1.2  TCP 1454 [TCP segment of a reassembled PDU]
 14   0.763761 54.230.98.246 -> 192.168.1.2  TCP 1454 [TCP segment of a reassembled PDU]
 15   0.763763 54.230.98.246 -> 192.168.1.2  TCP 1454 [TCP segment of a reassembled PDU]
 16   0.763763 54.230.98.246 -> 192.168.1.2  TCP 1454 [TCP segment of a reassembled PDU]
 17   0.763766 54.230.98.246 -> 192.168.1.2  TCP 1454 [TCP segment of a reassembled PDU]
 18   0.763767 54.230.98.246 -> 192.168.1.2  HTTP 949 HTTP/1.1 200 OK  (application/octet-stream)
 19   0.763898  192.168.1.2 -> 54.230.98.246 TCP 54 52557→80 [ACK] Seq=98 Ack=10696 Win=65792 Len=0
 20   0.763981  192.168.1.2 -> 54.230.98.246 TCP 54 52557→80 [FIN, ACK] Seq=98 Ack=10696 Win=65792 Len=0
 21   0.791612 54.230.98.246 -> 192.168.1.2  TCP 54 80→52557 [FIN, ACK] Seq=10696 Ack=99 Win=14720 Len=0
 22   0.791753  192.168.1.2 -> 54.230.98.246 TCP 54 52557→80 [ACK] Seq=99 Ack=10697 Win=65792 Len=0
