[Measurement for 10kb at 14:05:55 16.05.2014] 
Tshark:

  1   0.000000  192.168.1.2 -> 69.171.248.18 SSL 55 Continuation Data
  2   0.103838 54.231.32.216 -> 192.168.1.2  TLSv1.2 363 Application Data
  3   0.104622 54.231.32.216 -> 192.168.1.2  TLSv1.2 347 Application Data
  4   0.104698  192.168.1.2 -> 54.231.32.216 TCP 54 61961→443 [ACK] Seq=1 Ack=603 Win=255 Len=0
  5   0.184563 69.171.248.18 -> 192.168.1.2  TCP 54 443→61652 [ACK] Seq=1 Ack=2 Win=1650 Len=0
  6   0.515902  192.168.1.2 -> 74.125.232.195 TCP 1454 [TCP segment of a reassembled PDU]
  7   0.515927  192.168.1.2 -> 74.125.232.195 TCP 1454 [TCP segment of a reassembled PDU]
  8   0.515942  192.168.1.2 -> 74.125.232.195 TLSv1.2 517 Application Data
  9   0.516349  192.168.1.2 -> 74.125.232.195 TLSv1.2 87 Application Data
 10   0.516592  192.168.1.2 -> 74.125.232.195 TCP 1454 [TCP segment of a reassembled PDU]
 11   0.516618  192.168.1.2 -> 74.125.232.195 TLSv1.2 389 Application Data
 12   0.562750 74.125.232.195 -> 192.168.1.2  TCP 54 443→61714 [ACK] Seq=1 Ack=1401 Win=7780 Len=0
 13   0.581950 74.125.232.195 -> 192.168.1.2  TCP 54 443→61714 [ACK] Seq=1 Ack=2801 Win=7780 Len=0
 14   0.601283 74.125.232.195 -> 192.168.1.2  TCP 54 443→61714 [ACK] Seq=1 Ack=3264 Win=7780 Len=0
 15   0.601321 74.125.232.195 -> 192.168.1.2  TCP 54 443→61714 [ACK] Seq=1 Ack=3297 Win=7780 Len=0
 16   0.601331 74.125.232.195 -> 192.168.1.2  TCP 54 443→61714 [ACK] Seq=1 Ack=4697 Win=7780 Len=0
 17   0.601337 74.125.232.195 -> 192.168.1.2  TCP 54 443→61714 [ACK] Seq=1 Ack=5032 Win=7780 Len=0
 18   0.601342 74.125.232.195 -> 192.168.1.2  TLSv1.2 87 Application Data
 19   0.601359 74.125.232.195 -> 192.168.1.2  TLSv1.2 106 Application Data
 20   0.601401  192.168.1.2 -> 74.125.232.195 TCP 54 61714→443 [ACK] Seq=5032 Ack=86 Win=251 Len=0
 21   0.601539 74.125.232.195 -> 192.168.1.2  TLSv1.2 132 Application Data
 22   0.642881 74.125.232.195 -> 192.168.1.2  TLSv1.2 93 Application Data
 23   0.643025  192.168.1.2 -> 74.125.232.195 TCP 54 61714→443 [ACK] Seq=5032 Ack=203 Win=257 Len=0
 24   0.643771 74.125.232.195 -> 192.168.1.2  TLSv1.2 87 Application Data
 25   0.643958  192.168.1.2 -> 74.125.232.195 TLSv1.2 87 Application Data
 26   0.711602 74.125.232.195 -> 192.168.1.2  TCP 54 443→61714 [ACK] Seq=236 Ack=5065 Win=7780 Len=0
 27   1.360844  192.168.1.2 -> 54.230.99.105 TCP 66 61962→80 [SYN] Seq=0 Win=8192 Len=0 MSS=1460 WS=256 SACK_PERM=1
 28   1.396510 54.230.99.105 -> 192.168.1.2  TCP 66 80→61962 [SYN, ACK] Seq=0 Ack=1 Win=14600 Len=0 MSS=1400 SACK_PERM=1 WS=128
 29   1.396624  192.168.1.2 -> 54.230.99.105 TCP 54 61962→80 [ACK] Seq=1 Ack=1 Win=65792 Len=0
 30   1.406711  192.168.1.2 -> 54.230.99.105 HTTP 151 GET /10kb HTTP/1.1 
 31   1.443108 54.230.99.105 -> 192.168.1.2  TCP 54 80→61962 [ACK] Seq=1 Ack=98 Win=14720 Len=0
 32   1.452887 54.230.99.105 -> 192.168.1.2  TCP 1454 [TCP segment of a reassembled PDU]
 33   1.457350 54.230.99.105 -> 192.168.1.2  TCP 1454 [TCP segment of a reassembled PDU]
 34   1.457441  192.168.1.2 -> 54.230.99.105 TCP 54 61962→80 [ACK] Seq=98 Ack=2801 Win=65792 Len=0
 35   1.458786 54.230.99.105 -> 192.168.1.2  TCP 1454 [TCP segment of a reassembled PDU]
 36   1.458855 54.230.99.105 -> 192.168.1.2  TCP 1454 [TCP segment of a reassembled PDU]
 37   1.458901  192.168.1.2 -> 54.230.99.105 TCP 54 61962→80 [ACK] Seq=98 Ack=5601 Win=65792 Len=0
 38   1.459010 54.230.99.105 -> 192.168.1.2  TCP 1454 [TCP segment of a reassembled PDU]
 39   1.459055 54.230.99.105 -> 192.168.1.2  TCP 1454 [TCP segment of a reassembled PDU]
 40   1.459106  192.168.1.2 -> 54.230.99.105 TCP 54 61962→80 [ACK] Seq=98 Ack=8401 Win=65792 Len=0
 41   1.459204 54.230.99.105 -> 192.168.1.2  TCP 1454 [TCP segment of a reassembled PDU]
 42   1.459256 54.230.99.105 -> 192.168.1.2  HTTP 948 HTTP/1.1 200 OK  (application/octet-stream)
 43   1.459312  192.168.1.2 -> 54.230.99.105 TCP 54 61962→80 [ACK] Seq=98 Ack=10695 Win=65792 Len=0
 44   1.459429  192.168.1.2 -> 54.230.99.105 TCP 54 61962→80 [FIN, ACK] Seq=98 Ack=10695 Win=65792 Len=0
 45   1.492908 54.230.99.105 -> 192.168.1.2  TCP 54 80→61962 [FIN, ACK] Seq=10695 Ack=99 Win=14720 Len=0
 46   1.493040  192.168.1.2 -> 54.230.99.105 TCP 54 61962→80 [ACK] Seq=99 Ack=10696 Win=65792 Len=0
 47   2.151697  82.96.58.32 -> 192.168.1.2  TLSv1.2 95 Application Data
 48   2.152107  192.168.1.2 -> 82.96.58.32  TCP 54 61952→443 [FIN, ACK] Seq=1 Ack=42 Win=251 Len=0
 49   2.153029  82.96.58.32 -> 192.168.1.2  TLSv1.2 81 Encrypted Alert
 50   2.153078  192.168.1.2 -> 82.96.58.32  TCP 54 61952→443 [RST, ACK] Seq=2 Ack=69 Win=0 Len=0
 51   2.154108  82.96.58.32 -> 192.168.1.2  TCP 54 443→61952 [FIN, ACK] Seq=69 Ack=1 Win=524 Len=0
 52   2.203957  82.96.58.32 -> 192.168.1.2  TCP 54 443→61952 [ACK] Seq=70 Ack=2 Win=524 Len=0
 53   3.448662  192.168.1.2 -> 64.233.164.125 TCP 76 [TCP segment of a reassembled PDU]
