[Measurement for 1kb at 14:06:30 16.06.2014] 
Tshark:

  1   0.000000  192.168.1.2 -> 54.230.98.156 TCP 66 61966→80 [SYN] Seq=0 Win=8192 Len=0 MSS=1460 WS=256 SACK_PERM=1
  2   0.062620 54.230.98.156 -> 192.168.1.2  TCP 66 80→61966 [SYN, ACK] Seq=0 Ack=1 Win=14600 Len=0 MSS=1400 SACK_PERM=1 WS=128
  3   0.062763  192.168.1.2 -> 54.230.98.156 TCP 54 61966→80 [ACK] Seq=1 Ack=1 Win=65792 Len=0
  4   0.063132  192.168.1.2 -> 54.230.98.156 HTTP 149 GET /1kb HTTP/1.1 
  5   0.099015 54.230.98.156 -> 192.168.1.2  TCP 54 80→61966 [ACK] Seq=1 Ack=96 Win=14720 Len=0
  6   0.102182 54.230.98.156 -> 192.168.1.2  TCP 1454 [TCP segment of a reassembled PDU]
  7   0.107084 54.230.98.156 -> 192.168.1.2  HTTP 130 HTTP/1.1 200 OK  (application/octet-stream)
  8   0.107170  192.168.1.2 -> 54.230.98.156 TCP 54 61966→80 [ACK] Seq=96 Ack=1477 Win=65792 Len=0
  9   0.107452  192.168.1.2 -> 54.230.98.156 TCP 54 61966→80 [FIN, ACK] Seq=96 Ack=1477 Win=65792 Len=0
 10   0.137485 54.230.98.156 -> 192.168.1.2  TCP 54 80→61966 [FIN, ACK] Seq=1477 Ack=97 Win=14720 Len=0
 11   0.137629  192.168.1.2 -> 54.230.98.156 TCP 54 61966→80 [ACK] Seq=97 Ack=1478 Win=65792 Len=0
