[Measurement for 1kb at 08:04:53 17.04.2014] 
Tshark:

  1   0.000000  192.168.1.2 -> 54.230.98.197 TCP 66 50638→80 [SYN] Seq=0 Win=8192 Len=0 MSS=1460 WS=256 SACK_PERM=1
  2   0.046880 54.230.98.197 -> 192.168.1.2  TCP 66 80→50638 [SYN, ACK] Seq=0 Ack=1 Win=14600 Len=0 MSS=1400 SACK_PERM=1 WS=128
  3   0.047013  192.168.1.2 -> 54.230.98.197 TCP 54 50638→80 [ACK] Seq=1 Ack=1 Win=65792 Len=0
  4   0.056849  192.168.1.2 -> 54.230.98.197 HTTP 149 GET /1kb HTTP/1.1 
  5   0.085449 54.230.98.197 -> 192.168.1.2  TCP 54 80→50638 [ACK] Seq=1 Ack=96 Win=14720 Len=0
  6   0.087499 54.230.98.197 -> 192.168.1.2  TCP 1454 [TCP segment of a reassembled PDU]
  7   0.088368 54.230.98.197 -> 192.168.1.2  HTTP 132 HTTP/1.1 200 OK  (application/octet-stream)
  8   0.088431  192.168.1.2 -> 54.230.98.197 TCP 54 50638→80 [ACK] Seq=96 Ack=1479 Win=65792 Len=0
  9   0.088656  192.168.1.2 -> 54.230.98.197 TCP 54 50638→80 [FIN, ACK] Seq=96 Ack=1479 Win=65792 Len=0
 10   0.116346 54.230.98.197 -> 192.168.1.2  TCP 54 80→50638 [FIN, ACK] Seq=1479 Ack=97 Win=14720 Len=0
 11   0.116480  192.168.1.2 -> 54.230.98.197 TCP 54 50638→80 [ACK] Seq=97 Ack=1480 Win=65792 Len=0
