[Measurement for 1kb at 11:04:51 17.04.2014] 
Tshark:

  1   0.000000 54.221.227.112 -> 192.168.1.2  TLSv1.2 86 Application Data
  2   0.049486  192.168.1.2 -> 54.221.227.112 TCP 54 50741→443 [ACK] Seq=1 Ack=33 Win=253 Len=0
  3   1.324547  192.168.1.2 -> 54.230.99.49 TCP 66 52563→80 [SYN] Seq=0 Win=8192 Len=0 MSS=1460 WS=256 SACK_PERM=1
  4   1.376282 54.230.99.49 -> 192.168.1.2  TCP 66 80→52563 [SYN, ACK] Seq=0 Ack=1 Win=14600 Len=0 MSS=1400 SACK_PERM=1 WS=128
  5   1.376438  192.168.1.2 -> 54.230.99.49 TCP 54 52563→80 [ACK] Seq=1 Ack=1 Win=65792 Len=0
  6   1.385808  192.168.1.2 -> 54.230.99.49 HTTP 149 GET /1kb HTTP/1.1 
  7   1.421163 54.230.99.49 -> 192.168.1.2  TCP 54 80→52563 [ACK] Seq=1 Ack=96 Win=14720 Len=0
  8   1.422301 54.230.99.49 -> 192.168.1.2  TCP 1454 [TCP segment of a reassembled PDU]
  9   1.422302 54.230.99.49 -> 192.168.1.2  HTTP 132 HTTP/1.1 200 OK  (application/octet-stream)
 10   1.422461  192.168.1.2 -> 54.230.99.49 TCP 54 52563→80 [ACK] Seq=96 Ack=1479 Win=65792 Len=0
 11   1.422632  192.168.1.2 -> 54.230.99.49 TCP 54 52563→80 [FIN, ACK] Seq=96 Ack=1479 Win=65792 Len=0
 12   1.460032 54.230.99.49 -> 192.168.1.2  TCP 54 80→52563 [FIN, ACK] Seq=1479 Ack=97 Win=14720 Len=0
 13   1.460180  192.168.1.2 -> 54.230.99.49 TCP 54 52563→80 [ACK] Seq=97 Ack=1480 Win=65792 Len=0
