[Measurement for 10kb at 09:42:12 20.42.2014] 
Tshark:

  1   0.000000 172.31.8.238 -> 172.31.0.2   DNS 89 Standard query 0x8ba4  A d1xzxs93r3iphc.cloudfront.net
  2   0.000028 172.31.8.238 -> 172.31.0.2   DNS 89 Standard query 0x8d36  AAAA d1xzxs93r3iphc.cloudfront.net
  3   0.000797   172.31.0.2 -> 172.31.8.238 DNS 217 Standard query response 0x8ba4  A 54.192.141.182 A 54.192.141.186 A 54.192.141.192 A 54.192.141.200 A 54.230.140.33 A 54.230.140.236 A 54.230.141.31 A 54.230.141.103
  4   0.000807   172.31.0.2 -> 172.31.8.238 DNS 170 Standard query response 0x8d36 
  5   0.003868 172.31.8.238 -> 54.192.141.182 TCP 74 39357 > http [SYN] Seq=0 Win=26883 Len=0 MSS=8961 SACK_PERM=1 TSval=15039967 TSecr=0 WS=128
  6   0.009382 54.192.141.182 -> 172.31.8.238 TCP 74 http > 39357 [SYN, ACK] Seq=0 Ack=1 Win=14480 Len=0 MSS=1460 SACK_PERM=1 TSval=776626996 TSecr=15039967 WS=128
  7   0.009397 172.31.8.238 -> 54.192.141.182 TCP 66 39357 > http [ACK] Seq=1 Ack=1 Win=27008 Len=0 TSval=15039969 TSecr=776626996
  8   0.009449 172.31.8.238 -> 54.192.141.182 HTTP 163 GET /10kb HTTP/1.1 
  9   0.011588 54.192.141.182 -> 172.31.8.238 TCP 66 http > 39357 [ACK] Seq=1 Ack=98 Win=14592 Len=0 TSval=776626997 TSecr=15039969
 10   0.203545 54.192.141.182 -> 172.31.8.238 TCP 5858 [TCP segment of a reassembled PDU]
 11   0.203575 172.31.8.238 -> 54.192.141.182 TCP 66 39357 > http [ACK] Seq=98 Ack=5793 Win=38528 Len=0 TSval=15040017 TSecr=776627016
 12   0.203584 54.192.141.182 -> 172.31.8.238 TCP 1657 [TCP segment of a reassembled PDU]
 13   0.203589 172.31.8.238 -> 54.192.141.182 TCP 66 39357 > http [ACK] Seq=98 Ack=7384 Win=41728 Len=0 TSval=15040017 TSecr=776627016
 14   0.203747 54.192.141.182 -> 172.31.8.238 TCP 1766 [TCP segment of a reassembled PDU]
 15   0.203755 172.31.8.238 -> 54.192.141.182 TCP 66 39357 > http [ACK] Seq=98 Ack=9084 Win=45056 Len=0 TSval=15040017 TSecr=776627016
 16   0.371864 54.192.141.182 -> 172.31.8.238 HTTP 1667 HTTP/1.1 200 OK  (application/octet-stream)
 17   0.371895 172.31.8.238 -> 54.192.141.182 TCP 66 39357 > http [ACK] Seq=98 Ack=10685 Win=48256 Len=0 TSval=15040059 TSecr=776627033
 18   0.372111 172.31.8.238 -> 54.192.141.182 TCP 66 39357 > http [FIN, ACK] Seq=98 Ack=10685 Win=48256 Len=0 TSval=15040060 TSecr=776627033
 19   0.374148 54.192.141.182 -> 172.31.8.238 TCP 66 http > 39357 [FIN, ACK] Seq=10685 Ack=99 Win=14592 Len=0 TSval=776627033 TSecr=15040060
 20   0.374159 172.31.8.238 -> 54.192.141.182 TCP 66 39357 > http [ACK] Seq=99 Ack=10686 Win=48256 Len=0 TSval=15040060 TSecr=776627033
