[Measurement for 10kb at 01:42:11 20.42.2014] 
Tshark:

  1   0.000000 172.31.8.238 -> 172.31.0.2   DNS 89 Standard query 0x275b  A d1xzxs93r3iphc.cloudfront.net
  2   0.000028 172.31.8.238 -> 172.31.0.2   DNS 89 Standard query 0x5fb9  AAAA d1xzxs93r3iphc.cloudfront.net
  3   0.000805   172.31.0.2 -> 172.31.8.238 DNS 170 Standard query response 0x5fb9 
  4   0.000816   172.31.0.2 -> 172.31.8.238 DNS 217 Standard query response 0x275b  A 54.230.119.58 A 54.239.132.90 A 54.192.118.219 A 54.192.118.235 A 54.192.118.236 A 54.230.118.136 A 54.230.118.239 A 54.230.119.18
  5   0.003875 172.31.8.238 -> 54.230.119.58 TCP 74 36433 > http [SYN] Seq=0 Win=26883 Len=0 MSS=8961 SACK_PERM=1 TSval=7839773 TSecr=0 WS=128
  6   0.004683 54.230.119.58 -> 172.31.8.238 TCP 74 http > 36433 [SYN, ACK] Seq=0 Ack=1 Win=14480 Len=0 MSS=1460 SACK_PERM=1 TSval=1683688189 TSecr=7839773 WS=128
  7   0.004698 172.31.8.238 -> 54.230.119.58 TCP 66 36433 > http [ACK] Seq=1 Ack=1 Win=27008 Len=0 TSval=7839774 TSecr=1683688189
  8   0.004738 172.31.8.238 -> 54.230.119.58 HTTP 163 GET /10kb HTTP/1.1 
  9   0.005379 54.230.119.58 -> 172.31.8.238 TCP 66 http > 36433 [ACK] Seq=1 Ack=98 Win=14592 Len=0 TSval=1683688189 TSecr=7839774
 10   0.007209 54.230.119.58 -> 172.31.8.238 TCP 7306 [TCP segment of a reassembled PDU]
 11   0.007218 172.31.8.238 -> 54.230.119.58 TCP 66 36433 > http [ACK] Seq=98 Ack=7241 Win=41472 Len=0 TSval=7839774 TSecr=1683688190
 12   0.007270 54.230.119.58 -> 172.31.8.238 HTTP 3521 HTTP/1.1 200 OK  (application/octet-stream)
 13   0.007277 172.31.8.238 -> 54.230.119.58 TCP 66 36433 > http [ACK] Seq=98 Ack=10696 Win=48384 Len=0 TSval=7839774 TSecr=1683688190
 14   0.007410 172.31.8.238 -> 54.230.119.58 TCP 66 36433 > http [FIN, ACK] Seq=98 Ack=10696 Win=48384 Len=0 TSval=7839774 TSecr=1683688190
 15   0.007982 54.230.119.58 -> 172.31.8.238 TCP 66 http > 36433 [FIN, ACK] Seq=10696 Ack=99 Win=14592 Len=0 TSval=1683688190 TSecr=7839774
 16   0.007990 172.31.8.238 -> 54.230.119.58 TCP 66 36433 > http [ACK] Seq=99 Ack=10697 Win=48384 Len=0 TSval=7839774 TSecr=1683688190
 17   0.275477 06:b0:37:46:8f:13 -> 06:c7:b5:04:b8:d0 ARP 60 Who has 172.31.8.238?  Tell 172.31.0.1
 18   0.275491 06:c7:b5:04:b8:d0 -> 06:b0:37:46:8f:13 ARP 42 172.31.8.238 is at 06:c7:b5:04:b8:d0
