[Measurement for 10kb at 18:42:47 19.42.2014] 
Tshark:

  1   0.000000 172.31.8.238 -> 172.31.0.2   DNS 89 Standard query 0x0b8e  A d1xzxs93r3iphc.cloudfront.net
  2   0.000028 172.31.8.238 -> 172.31.0.2   DNS 89 Standard query 0x5632  AAAA d1xzxs93r3iphc.cloudfront.net
  3   0.000618   172.31.0.2 -> 172.31.8.238 DNS 217 Standard query response 0x0b8e  A 54.239.132.84 A 54.239.132.90 A 54.239.132.103 A 54.192.118.218 A 54.230.117.42 A 54.230.118.138 A 54.230.118.248 A 54.230.119.12
  4   0.000628   172.31.0.2 -> 172.31.8.238 DNS 170 Standard query response 0x5632 
  5   0.003775 172.31.8.238 -> 54.239.132.84 TCP 74 44125 > http [SYN] Seq=0 Win=26883 Len=0 MSS=8961 SACK_PERM=1 TSval=1548694 TSecr=0 WS=128
  6   0.004309 54.239.132.84 -> 172.31.8.238 TCP 74 http > 44125 [SYN, ACK] Seq=0 Ack=1 Win=14480 Len=0 MSS=1460 SACK_PERM=1 TSval=1681846322 TSecr=1548694 WS=128
  7   0.004324 172.31.8.238 -> 54.239.132.84 TCP 66 44125 > http [ACK] Seq=1 Ack=1 Win=27008 Len=0 TSval=1548695 TSecr=1681846322
  8   0.004366 172.31.8.238 -> 54.239.132.84 HTTP 163 GET /10kb HTTP/1.1 
  9   0.004766 54.239.132.84 -> 172.31.8.238 TCP 66 http > 44125 [ACK] Seq=1 Ack=98 Win=14592 Len=0 TSval=1681846322 TSecr=1548695
 10   0.455787 54.239.132.84 -> 172.31.8.238 TCP 4410 [TCP segment of a reassembled PDU]
 11   0.455828 172.31.8.238 -> 54.239.132.84 TCP 66 44125 > http [ACK] Seq=98 Ack=4345 Win=35584 Len=0 TSval=1548807 TSecr=1681846367
 12   0.455853 54.239.132.84 -> 172.31.8.238 HTTP 6406 HTTP/1.1 200 OK  (application/octet-stream)
 13   0.455860 172.31.8.238 -> 54.239.132.84 TCP 66 44125 > http [ACK] Seq=98 Ack=10685 Win=48256 Len=0 TSval=1548807 TSecr=1681846367
 14   0.456192 172.31.8.238 -> 54.239.132.84 TCP 66 44125 > http [FIN, ACK] Seq=98 Ack=10685 Win=48256 Len=0 TSval=1548808 TSecr=1681846367
 15   0.456769 54.239.132.84 -> 172.31.8.238 TCP 66 http > 44125 [FIN, ACK] Seq=10685 Ack=99 Win=14592 Len=0 TSval=1681846367 TSecr=1548808
 16   0.456779 172.31.8.238 -> 54.239.132.84 TCP 66 44125 > http [ACK] Seq=99 Ack=10686 Win=48256 Len=0 TSval=1548808 TSecr=1681846367
