[Measurement for 10kb at 13:42:11 20.42.2014] 
Tshark:

  1   0.000000 172.31.8.238 -> 172.31.0.2   DNS 89 Standard query 0xdf7d  A d1xzxs93r3iphc.cloudfront.net
  2   0.000029 172.31.8.238 -> 172.31.0.2   DNS 89 Standard query 0x2cde  AAAA d1xzxs93r3iphc.cloudfront.net
  3   0.000520   172.31.0.2 -> 172.31.8.238 DNS 217 Standard query response 0xdf7d  A 54.230.116.136 A 54.230.118.138 A 54.230.119.11 A 54.230.119.91 A 54.230.119.125 A 54.192.118.232 A 54.192.118.237 A 54.192.118.246
  4   0.000542   172.31.0.2 -> 172.31.8.238 DNS 170 Standard query response 0x2cde 
  5   0.003876 172.31.8.238 -> 54.230.116.136 TCP 74 34993 > http [SYN] Seq=0 Win=26883 Len=0 MSS=8961 SACK_PERM=1 TSval=18639909 TSecr=0 WS=128
  6   0.004716 54.230.116.136 -> 172.31.8.238 TCP 74 http > 34993 [SYN, ACK] Seq=0 Ack=1 Win=14480 Len=0 MSS=1460 SACK_PERM=1 TSval=1689053497 TSecr=18639909 WS=128
  7   0.004731 172.31.8.238 -> 54.230.116.136 TCP 66 34993 > http [ACK] Seq=1 Ack=1 Win=27008 Len=0 TSval=18639909 TSecr=1689053497
  8   0.004769 172.31.8.238 -> 54.230.116.136 HTTP 163 GET /10kb HTTP/1.1 
  9   0.005319 54.230.116.136 -> 172.31.8.238 TCP 66 http > 34993 [ACK] Seq=1 Ack=98 Win=14592 Len=0 TSval=1689053497 TSecr=18639909
 10   0.012393 54.230.116.136 -> 172.31.8.238 HTTP 10761 HTTP/1.1 200 OK  (application/octet-stream)
 11   0.012408 172.31.8.238 -> 54.230.116.136 TCP 66 34993 > http [ACK] Seq=98 Ack=10696 Win=48384 Len=0 TSval=18639911 TSecr=1689053498
 12   0.012620 172.31.8.238 -> 54.230.116.136 TCP 66 34993 > http [FIN, ACK] Seq=98 Ack=10696 Win=48384 Len=0 TSval=18639911 TSecr=1689053498
 13   0.013533 54.230.116.136 -> 172.31.8.238 TCP 66 http > 34993 [FIN, ACK] Seq=10696 Ack=99 Win=14592 Len=0 TSval=1689053498 TSecr=18639911
 14   0.013543 172.31.8.238 -> 54.230.116.136 TCP 66 34993 > http [ACK] Seq=99 Ack=10697 Win=48384 Len=0 TSval=18639912 TSecr=1689053498
 15   0.989135 06:c7:b5:04:b8:d0 -> 06:b0:37:46:8f:13 ARP 42 Who has 172.31.0.2?  Tell 172.31.8.238
 16   0.989395 06:b0:37:46:8f:13 -> 06:c7:b5:04:b8:d0 ARP 60 172.31.0.2 is at 06:b0:37:46:8f:13
