[Measurement for 10kb at 05:42:11 20.42.2014] 
Tshark:

  1   0.000000 06:b0:37:46:8f:13 -> 06:c7:b5:04:b8:d0 ARP 60 Who has 172.31.8.238?  Tell 172.31.0.1
  2   0.000032 06:c7:b5:04:b8:d0 -> 06:b0:37:46:8f:13 ARP 42 172.31.8.238 is at 06:c7:b5:04:b8:d0
  3   0.858961 172.31.8.238 -> 172.31.0.2   DNS 89 Standard query 0x987e  A d1xzxs93r3iphc.cloudfront.net
  4   0.858989 172.31.8.238 -> 172.31.0.2   DNS 89 Standard query 0x4ff3  AAAA d1xzxs93r3iphc.cloudfront.net
  5   0.859658   172.31.0.2 -> 172.31.8.238 DNS 170 Standard query response 0x4ff3 
  6   0.859670   172.31.0.2 -> 172.31.8.238 DNS 217 Standard query response 0x987e  A 54.230.117.50 A 54.230.117.69 A 54.230.119.18 A 54.230.119.40 A 54.239.132.83 A 54.192.118.222 A 54.230.116.44 A 54.230.116.73
  7   0.862850 172.31.8.238 -> 54.230.117.50 TCP 74 51641 > http [SYN] Seq=0 Win=26883 Len=0 MSS=8961 SACK_PERM=1 TSval=11439844 TSecr=0 WS=128
  8   0.863347 54.230.117.50 -> 172.31.8.238 TCP 74 http > 51641 [SYN, ACK] Seq=0 Ack=1 Win=14480 Len=0 MSS=1460 SACK_PERM=1 TSval=1687351030 TSecr=11439844 WS=128
  9   0.863361 172.31.8.238 -> 54.230.117.50 TCP 66 51641 > http [ACK] Seq=1 Ack=1 Win=27008 Len=0 TSval=11439845 TSecr=1687351030
 10   0.863401 172.31.8.238 -> 54.230.117.50 HTTP 163 GET /10kb HTTP/1.1 
 11   0.863865 54.230.117.50 -> 172.31.8.238 TCP 66 http > 51641 [ACK] Seq=1 Ack=98 Win=14592 Len=0 TSval=1687351030 TSecr=11439845
 12   0.865290 54.230.117.50 -> 172.31.8.238 TCP 2580 [TCP segment of a reassembled PDU]
 13   0.865297 172.31.8.238 -> 54.230.117.50 TCP 66 51641 > http [ACK] Seq=98 Ack=2515 Win=32000 Len=0 TSval=11439845 TSecr=1687351030
 14   0.865305 54.230.117.50 -> 172.31.8.238 HTTP 8247 HTTP/1.1 200 OK  (application/octet-stream)
 15   0.865311 172.31.8.238 -> 54.230.117.50 TCP 66 51641 > http [ACK] Seq=98 Ack=10696 Win=48384 Len=0 TSval=11439845 TSecr=1687351030
 16   0.865457 172.31.8.238 -> 54.230.117.50 TCP 66 51641 > http [FIN, ACK] Seq=98 Ack=10696 Win=48384 Len=0 TSval=11439845 TSecr=1687351030
 17   0.865931 54.230.117.50 -> 172.31.8.238 TCP 66 http > 51641 [FIN, ACK] Seq=10696 Ack=99 Win=14592 Len=0 TSval=1687351031 TSecr=11439845
 18   0.865938 172.31.8.238 -> 54.230.117.50 TCP 66 51641 > http [ACK] Seq=99 Ack=10697 Win=48384 Len=0 TSval=11439845 TSecr=1687351031
