[Measurement for 10kb at 19:42:12 19.42.2014] 
Tshark:

  1   0.000000 06:b0:37:46:8f:13 -> 06:c7:b5:04:b8:d0 ARP 60 Who has 172.31.8.238?  Tell 172.31.0.1
  2   0.000020 06:c7:b5:04:b8:d0 -> 06:b0:37:46:8f:13 ARP 42 172.31.8.238 is at 06:c7:b5:04:b8:d0
  3   1.729477 172.31.8.238 -> 172.31.0.2   DNS 89 Standard query 0xff05  A d1xzxs93r3iphc.cloudfront.net
  4   1.729516 172.31.8.238 -> 172.31.0.2   DNS 89 Standard query 0xfc1c  AAAA d1xzxs93r3iphc.cloudfront.net
  5   1.730101   172.31.0.2 -> 172.31.8.238 DNS 217 Standard query response 0xff05  A 54.192.118.243 A 54.230.116.73 A 54.230.117.154 A 54.230.119.12 A 54.239.132.90 A 54.239.132.173 A 54.192.118.236 A 54.192.118.239
  6   1.730182   172.31.0.2 -> 172.31.8.238 DNS 170 Standard query response 0xfc1c 
  7   1.733366 172.31.8.238 -> 54.192.118.243 TCP 74 35303 > http [SYN] Seq=0 Win=26883 Len=0 MSS=8961 SACK_PERM=1 TSval=2440159 TSecr=0 WS=128
  8   1.733931 54.192.118.243 -> 172.31.8.238 TCP 74 http > 35303 [SYN, ACK] Seq=0 Ack=1 Win=14480 Len=0 MSS=1460 SACK_PERM=1 TSval=1680721814 TSecr=2440159 WS=128
  9   1.733944 172.31.8.238 -> 54.192.118.243 TCP 66 35303 > http [ACK] Seq=1 Ack=1 Win=27008 Len=0 TSval=2440160 TSecr=1680721814
 10   1.733984 172.31.8.238 -> 54.192.118.243 HTTP 163 GET /10kb HTTP/1.1 
 11   1.734425 54.192.118.243 -> 172.31.8.238 TCP 66 http > 35303 [ACK] Seq=1 Ack=98 Win=14592 Len=0 TSval=1680721814 TSecr=2440160
 12   1.736511 54.192.118.243 -> 172.31.8.238 TCP 2581 [TCP segment of a reassembled PDU]
 13   1.736518 172.31.8.238 -> 54.192.118.243 TCP 66 35303 > http [ACK] Seq=98 Ack=2516 Win=32000 Len=0 TSval=2440160 TSecr=1680721814
 14   1.736627 54.192.118.243 -> 172.31.8.238 HTTP 8245 HTTP/1.1 200 OK  (application/octet-stream)
 15   1.736636 172.31.8.238 -> 54.192.118.243 TCP 66 35303 > http [ACK] Seq=98 Ack=10695 Win=48384 Len=0 TSval=2440160 TSecr=1680721814
 16   1.736753 172.31.8.238 -> 54.192.118.243 TCP 66 35303 > http [FIN, ACK] Seq=98 Ack=10695 Win=48384 Len=0 TSval=2440160 TSecr=1680721814
 17   1.739559 54.192.118.243 -> 172.31.8.238 TCP 66 http > 35303 [FIN, ACK] Seq=10695 Ack=99 Win=14592 Len=0 TSval=1680721814 TSecr=2440160
 18   1.739567 172.31.8.238 -> 54.192.118.243 TCP 66 35303 > http [ACK] Seq=99 Ack=10696 Win=48384 Len=0 TSval=2440161 TSecr=1680721814
