[Measurement for 10kb at 00:42:11 20.42.2014] 
Tshark:

  1   0.000000 172.31.8.238 -> 172.31.0.2   DNS 89 Standard query 0xfeab  A d1xzxs93r3iphc.cloudfront.net
  2   0.000041 172.31.8.238 -> 172.31.0.2   DNS 89 Standard query 0x275c  AAAA d1xzxs93r3iphc.cloudfront.net
  3   0.000840   172.31.0.2 -> 172.31.8.238 DNS 170 Standard query response 0x275c 
  4   0.000850   172.31.0.2 -> 172.31.8.238 DNS 217 Standard query response 0xfeab  A 54.230.116.189 A 54.230.117.238 A 54.230.119.91 A 54.192.118.221 A 54.192.118.224 A 54.192.118.243 A 54.230.116.53 A 54.230.116.136
  5   0.003904 172.31.8.238 -> 54.230.116.189 TCP 74 49652 > http [SYN] Seq=0 Win=26883 Len=0 MSS=8961 SACK_PERM=1 TSval=6939855 TSecr=0 WS=128
  6   0.004810 54.230.116.189 -> 172.31.8.238 TCP 74 http > 49652 [SYN, ACK] Seq=0 Ack=1 Win=14480 Len=0 MSS=1460 SACK_PERM=1 TSval=1684990912 TSecr=6939855 WS=128
  7   0.004823 172.31.8.238 -> 54.230.116.189 TCP 66 49652 > http [ACK] Seq=1 Ack=1 Win=27008 Len=0 TSval=6939855 TSecr=1684990912
  8   0.004862 172.31.8.238 -> 54.230.116.189 HTTP 163 GET /10kb HTTP/1.1 
  9   0.005534 54.230.116.189 -> 172.31.8.238 TCP 66 http > 49652 [ACK] Seq=1 Ack=98 Win=14592 Len=0 TSval=1684990912 TSecr=6939855
 10   0.007366 54.230.116.189 -> 172.31.8.238 TCP 2580 [TCP segment of a reassembled PDU]
 11   0.007374 172.31.8.238 -> 54.230.116.189 TCP 66 49652 > http [ACK] Seq=98 Ack=2515 Win=32000 Len=0 TSval=6939856 TSecr=1684990912
 12   0.007474 54.230.116.189 -> 172.31.8.238 HTTP 8247 HTTP/1.1 200 OK  (application/octet-stream)
 13   0.007483 172.31.8.238 -> 54.230.116.189 TCP 66 49652 > http [ACK] Seq=98 Ack=10696 Win=48384 Len=0 TSval=6939856 TSecr=1684990912
 14   0.007610 172.31.8.238 -> 54.230.116.189 TCP 66 49652 > http [FIN, ACK] Seq=98 Ack=10696 Win=48384 Len=0 TSval=6939856 TSecr=1684990912
 15   0.008323 54.230.116.189 -> 172.31.8.238 TCP 66 http > 49652 [FIN, ACK] Seq=10696 Ack=99 Win=14592 Len=0 TSval=1684990912 TSecr=6939856
 16   0.008332 172.31.8.238 -> 54.230.116.189 TCP 66 49652 > http [ACK] Seq=99 Ack=10697 Win=48384 Len=0 TSval=6939856 TSecr=1684990912
