[Measurement for 10kb at 02:42:12 20.42.2014] 
Tshark:

  1   0.000000 172.31.8.238 -> 172.31.0.2   DNS 89 Standard query 0x873a  A d1xzxs93r3iphc.cloudfront.net
  2   0.000027 172.31.8.238 -> 172.31.0.2   DNS 89 Standard query 0xe976  AAAA d1xzxs93r3iphc.cloudfront.net
  3   0.000552   172.31.0.2 -> 172.31.8.238 DNS 170 Standard query response 0xe976 
  4   0.000564   172.31.0.2 -> 172.31.8.238 DNS 217 Standard query response 0x873a  A 54.192.118.219 A 54.230.116.164 A 54.230.116.204 A 54.230.117.50 A 54.230.119.11 A 54.230.119.58 A 54.239.132.41 A 54.239.132.98
  5   0.003882 172.31.8.238 -> 54.192.118.219 TCP 74 44146 > http [SYN] Seq=0 Win=26883 Len=0 MSS=8961 SACK_PERM=1 TSval=8739964 TSecr=0 WS=128
  6   0.004640 54.192.118.219 -> 172.31.8.238 TCP 74 http > 44146 [SYN, ACK] Seq=0 Ack=1 Win=14480 Len=0 MSS=1460 SACK_PERM=1 TSval=1683987775 TSecr=8739964 WS=128
  7   0.004654 172.31.8.238 -> 54.192.118.219 TCP 66 44146 > http [ACK] Seq=1 Ack=1 Win=27008 Len=0 TSval=8739964 TSecr=1683987775
  8   0.004692 172.31.8.238 -> 54.192.118.219 HTTP 163 GET /10kb HTTP/1.1 
  9   0.005376 54.192.118.219 -> 172.31.8.238 TCP 66 http > 44146 [ACK] Seq=1 Ack=98 Win=14592 Len=0 TSval=1683987775 TSecr=8739964
 10   0.007288 54.192.118.219 -> 172.31.8.238 HTTP 10761 HTTP/1.1 200 OK  (application/octet-stream)
 11   0.007299 172.31.8.238 -> 54.192.118.219 TCP 66 44146 > http [ACK] Seq=98 Ack=10696 Win=48384 Len=0 TSval=8739965 TSecr=1683987775
 12   0.007443 172.31.8.238 -> 54.192.118.219 TCP 66 44146 > http [FIN, ACK] Seq=98 Ack=10696 Win=48384 Len=0 TSval=8739965 TSecr=1683987775
 13   0.008445 54.192.118.219 -> 172.31.8.238 TCP 66 http > 44146 [FIN, ACK] Seq=10696 Ack=99 Win=14592 Len=0 TSval=1683987775 TSecr=8739965
 14   0.008453 172.31.8.238 -> 54.192.118.219 TCP 66 44146 > http [ACK] Seq=99 Ack=10697 Win=48384 Len=0 TSval=8739965 TSecr=1683987775
