[Measurement for 10kb at 12:42:12 20.42.2014] 
Tshark:

  1   0.000000 172.31.8.238 -> 172.31.0.2   DNS 89 Standard query 0xfe8c  A d1xzxs93r3iphc.cloudfront.net
  2   0.000028 172.31.8.238 -> 172.31.0.2   DNS 89 Standard query 0x9afe  AAAA d1xzxs93r3iphc.cloudfront.net
  3   0.000535   172.31.0.2 -> 172.31.8.238 DNS 217 Standard query response 0xfe8c  A 54.239.132.41 A 54.239.132.86 A 54.239.132.147 A 54.239.132.173 A 54.230.117.21 A 54.230.117.50 A 54.230.117.87 A 54.230.119.18
  4   0.000600   172.31.0.2 -> 172.31.8.238 DNS 170 Standard query response 0x9afe 
  5   0.003884 172.31.8.238 -> 54.239.132.41 TCP 74 54928 > http [SYN] Seq=0 Win=26883 Len=0 MSS=8961 SACK_PERM=1 TSval=17739993 TSecr=0 WS=128
  6   0.004522 54.239.132.41 -> 172.31.8.238 TCP 74 http > 54928 [SYN, ACK] Seq=0 Ack=1 Win=14480 Len=0 MSS=1460 SACK_PERM=1 TSval=1687587830 TSecr=17739993 WS=128
  7   0.004537 172.31.8.238 -> 54.239.132.41 TCP 66 54928 > http [ACK] Seq=1 Ack=1 Win=27008 Len=0 TSval=17739993 TSecr=1687587830
  8   0.004575 172.31.8.238 -> 54.239.132.41 HTTP 163 GET /10kb HTTP/1.1 
  9   0.005254 54.239.132.41 -> 172.31.8.238 TCP 66 http > 54928 [ACK] Seq=1 Ack=98 Win=14592 Len=0 TSval=1687587830 TSecr=17739993
 10   0.006748 54.239.132.41 -> 172.31.8.238 TCP 1514 [TCP segment of a reassembled PDU]
 11   0.006755 172.31.8.238 -> 54.239.132.41 TCP 66 54928 > http [ACK] Seq=98 Ack=1449 Win=29824 Len=0 TSval=17739994 TSecr=1687587831
 12   0.006847 54.239.132.41 -> 172.31.8.238 HTTP 9313 HTTP/1.1 200 OK  (application/octet-stream)
 13   0.006856 172.31.8.238 -> 54.239.132.41 TCP 66 54928 > http [ACK] Seq=98 Ack=10696 Win=48384 Len=0 TSval=17739994 TSecr=1687587831
 14   0.006992 172.31.8.238 -> 54.239.132.41 TCP 66 54928 > http [FIN, ACK] Seq=98 Ack=10696 Win=48384 Len=0 TSval=17739994 TSecr=1687587831
 15   0.007528 54.239.132.41 -> 172.31.8.238 TCP 66 http > 54928 [FIN, ACK] Seq=10696 Ack=99 Win=14592 Len=0 TSval=1687587831 TSecr=17739994
 16   0.007536 172.31.8.238 -> 54.239.132.41 TCP 66 54928 > http [ACK] Seq=99 Ack=10697 Win=48384 Len=0 TSval=17739994 TSecr=1687587831
