[Measurement for 10kb at 07:42:11 20.42.2014] 
Tshark:

  1   0.000000 172.31.8.238 -> 172.31.0.1   DHCP 342 DHCP Request  - Transaction ID 0xf1dd8330
  2   0.000684   172.31.0.1 -> 172.31.8.238 DHCP 371 DHCP ACK      - Transaction ID 0xf1dd8330
  3   1.700103 172.31.8.238 -> 172.31.0.2   DNS 89 Standard query 0x7c9c  A d1xzxs93r3iphc.cloudfront.net
  4   1.700134 172.31.8.238 -> 172.31.0.2   DNS 89 Standard query 0x322d  AAAA d1xzxs93r3iphc.cloudfront.net
  5   1.700898   172.31.0.2 -> 172.31.8.238 DNS 217 Standard query response 0x7c9c  A 54.230.119.91 A 54.230.119.150 A 54.230.119.165 A 54.239.132.74 A 54.239.132.83 A 54.239.132.147 A 54.230.116.239 A 54.230.117.157
  6   1.700926   172.31.0.2 -> 172.31.8.238 DNS 170 Standard query response 0x322d 
  7   1.703965 172.31.8.238 -> 54.230.119.91 TCP 74 43625 > http [SYN] Seq=0 Win=26883 Len=0 MSS=8961 SACK_PERM=1 TSval=13239800 TSecr=0 WS=128
  8   1.704586 54.230.119.91 -> 172.31.8.238 TCP 74 http > 43625 [SYN, ACK] Seq=0 Ack=1 Win=14480 Len=0 MSS=1460 SACK_PERM=1 TSval=1688084020 TSecr=13239800 WS=128
  9   1.704601 172.31.8.238 -> 54.230.119.91 TCP 66 43625 > http [ACK] Seq=1 Ack=1 Win=27008 Len=0 TSval=13239800 TSecr=1688084020
 10   1.704643 172.31.8.238 -> 54.230.119.91 HTTP 163 GET /10kb HTTP/1.1 
 11   1.705296 54.230.119.91 -> 172.31.8.238 TCP 66 http > 43625 [ACK] Seq=1 Ack=98 Win=14592 Len=0 TSval=1688084021 TSecr=13239800
 12   1.706956 54.230.119.91 -> 172.31.8.238 TCP 8754 [TCP segment of a reassembled PDU]
 13   1.706967 172.31.8.238 -> 54.230.119.91 TCP 66 43625 > http [ACK] Seq=98 Ack=8689 Win=44288 Len=0 TSval=13239801 TSecr=1688084021
 14   1.707008 54.230.119.91 -> 172.31.8.238 HTTP 2073 HTTP/1.1 200 OK  (application/octet-stream)
 15   1.707014 172.31.8.238 -> 54.230.119.91 TCP 66 43625 > http [ACK] Seq=98 Ack=10696 Win=48384 Len=0 TSval=13239801 TSecr=1688084021
 16   1.707150 172.31.8.238 -> 54.230.119.91 TCP 66 43625 > http [FIN, ACK] Seq=98 Ack=10696 Win=48384 Len=0 TSval=13239801 TSecr=1688084021
 17   1.707600 54.230.119.91 -> 172.31.8.238 TCP 66 http > 43625 [FIN, ACK] Seq=10696 Ack=99 Win=14592 Len=0 TSval=1688084021 TSecr=13239801
 18   1.707608 172.31.8.238 -> 54.230.119.91 TCP 66 43625 > http [ACK] Seq=99 Ack=10697 Win=48384 Len=0 TSval=13239801 TSecr=1688084021
