[Measurement for 10kb at 06:42:11 20.42.2014] 
Tshark:

  1   0.000000 172.31.8.238 -> 172.31.0.2   DNS 89 Standard query 0x9621  A d1xzxs93r3iphc.cloudfront.net
  2   0.000078 172.31.8.238 -> 172.31.0.2   DNS 89 Standard query 0x9a35  AAAA d1xzxs93r3iphc.cloudfront.net
  3   0.000641   172.31.0.2 -> 172.31.8.238 DNS 217 Standard query response 0x9621  A 54.230.119.125 A 54.239.132.196 A 54.239.132.249 A 54.230.116.128 A 54.230.117.154 A 54.230.118.187 A 54.230.119.12 A 54.230.119.86
  4   0.000654   172.31.0.2 -> 172.31.8.238 DNS 170 Standard query response 0x9a35 
  5   0.003875 172.31.8.238 -> 54.230.119.125 TCP 74 44567 > http [SYN] Seq=0 Win=26883 Len=0 MSS=8961 SACK_PERM=1 TSval=12339851 TSecr=0 WS=128
  6   0.004534 54.230.119.125 -> 172.31.8.238 TCP 74 http > 44567 [SYN, ACK] Seq=0 Ack=1 Win=14480 Len=0 MSS=1460 SACK_PERM=1 TSval=1686606747 TSecr=12339851 WS=128
  7   0.004548 172.31.8.238 -> 54.230.119.125 TCP 66 44567 > http [ACK] Seq=1 Ack=1 Win=27008 Len=0 TSval=12339852 TSecr=1686606747
  8   0.004590 172.31.8.238 -> 54.230.119.125 HTTP 163 GET /10kb HTTP/1.1 
  9   0.005202 54.230.119.125 -> 172.31.8.238 TCP 66 http > 44567 [ACK] Seq=1 Ack=98 Win=14592 Len=0 TSval=1686606747 TSecr=12339852
 10   0.007527 54.230.119.125 -> 172.31.8.238 TCP 2962 [TCP segment of a reassembled PDU]
 11   0.007534 172.31.8.238 -> 54.230.119.125 TCP 66 44567 > http [ACK] Seq=98 Ack=2897 Win=32768 Len=0 TSval=12339852 TSecr=1686606747
 12   0.007637 54.230.119.125 -> 172.31.8.238 HTTP 7865 HTTP/1.1 200 OK  (application/octet-stream)
 13   0.007646 172.31.8.238 -> 54.230.119.125 TCP 66 44567 > http [ACK] Seq=98 Ack=10696 Win=48384 Len=0 TSval=12339852 TSecr=1686606747
 14   0.007767 172.31.8.238 -> 54.230.119.125 TCP 66 44567 > http [FIN, ACK] Seq=98 Ack=10696 Win=48384 Len=0 TSval=12339852 TSecr=1686606747
 15   0.008333 54.230.119.125 -> 172.31.8.238 TCP 66 http > 44567 [FIN, ACK] Seq=10696 Ack=99 Win=14592 Len=0 TSval=1686606747 TSecr=12339852
 16   0.008341 172.31.8.238 -> 54.230.119.125 TCP 66 44567 > http [ACK] Seq=99 Ack=10697 Win=48384 Len=0 TSval=12339853 TSecr=1686606747
