[Measurement for 10kb at 11:42:11 20.42.2014] 
Tshark:

  1   0.000000 172.31.8.238 -> 172.31.0.2   DNS 89 Standard query 0xfea1  A d1xzxs93r3iphc.cloudfront.net
  2   0.000024 172.31.8.238 -> 172.31.0.2   DNS 89 Standard query 0x542a  AAAA d1xzxs93r3iphc.cloudfront.net
  3   0.000602   172.31.0.2 -> 172.31.8.238 DNS 217 Standard query response 0xfea1  A 54.230.119.150 A 54.239.132.173 A 54.192.118.237 A 54.192.118.239 A 54.230.116.44 A 54.230.117.69 A 54.230.119.55 A 54.230.119.86
  4   0.000615   172.31.0.2 -> 172.31.8.238 DNS 170 Standard query response 0x542a 
  5   0.003910 172.31.8.238 -> 54.230.119.150 TCP 74 44798 > http [SYN] Seq=0 Win=26883 Len=0 MSS=8961 SACK_PERM=1 TSval=16839800 TSecr=0 WS=128
  6   0.004585 54.230.119.150 -> 172.31.8.238 TCP 74 http > 44798 [SYN, ACK] Seq=0 Ack=1 Win=14480 Len=0 MSS=1460 SACK_PERM=1 TSval=1687475244 TSecr=16839800 WS=128
  7   0.004601 172.31.8.238 -> 54.230.119.150 TCP 66 44798 > http [ACK] Seq=1 Ack=1 Win=27008 Len=0 TSval=16839801 TSecr=1687475244
  8   0.004644 172.31.8.238 -> 54.230.119.150 HTTP 163 GET /10kb HTTP/1.1 
  9   0.005335 54.230.119.150 -> 172.31.8.238 TCP 66 http > 44798 [ACK] Seq=1 Ack=98 Win=14592 Len=0 TSval=1687475244 TSecr=16839801
 10   0.006668 54.230.119.150 -> 172.31.8.238 TCP 4410 [TCP segment of a reassembled PDU]
 11   0.006676 172.31.8.238 -> 54.230.119.150 TCP 66 44798 > http [ACK] Seq=98 Ack=4345 Win=35584 Len=0 TSval=16839801 TSecr=1687475244
 12   0.006785 54.230.119.150 -> 172.31.8.238 HTTP 6417 HTTP/1.1 200 OK  (application/octet-stream)
 13   0.006794 172.31.8.238 -> 54.230.119.150 TCP 66 44798 > http [ACK] Seq=98 Ack=10696 Win=48384 Len=0 TSval=16839801 TSecr=1687475244
 14   0.006919 172.31.8.238 -> 54.230.119.150 TCP 66 44798 > http [FIN, ACK] Seq=98 Ack=10696 Win=48384 Len=0 TSval=16839801 TSecr=1687475244
 15   0.007643 54.230.119.150 -> 172.31.8.238 TCP 66 http > 44798 [FIN, ACK] Seq=10696 Ack=99 Win=14592 Len=0 TSval=1687475244 TSecr=16839801
 16   0.007652 172.31.8.238 -> 54.230.119.150 TCP 66 44798 > http [ACK] Seq=99 Ack=10697 Win=48384 Len=0 TSval=16839801 TSecr=1687475244
