[Measurement for 10kb at 11:03:45 17.03.2014] 
Tshark:

  1   0.000000  192.168.1.2 -> 192.241.187.124 SSL 55 Continuation Data
  2   0.137820 192.241.187.124 -> 192.168.1.2  TCP 66 443→50709 [ACK] Seq=1 Ack=2 Win=16 Len=0 SLE=1 SRE=2
  3   0.633555  192.168.1.2 -> 54.230.97.250 TCP 66 52546→80 [SYN] Seq=0 Win=8192 Len=0 MSS=1460 WS=256 SACK_PERM=1
  4   0.690645 54.230.97.250 -> 192.168.1.2  TCP 66 80→52546 [SYN, ACK] Seq=0 Ack=1 Win=14600 Len=0 MSS=1400 SACK_PERM=1 WS=128
  5   0.690796  192.168.1.2 -> 54.230.97.250 TCP 54 52546→80 [ACK] Seq=1 Ack=1 Win=65792 Len=0
  6   0.690964  192.168.1.2 -> 54.230.97.250 HTTP 151 GET /10kb HTTP/1.1 
  7   0.720378 54.230.97.250 -> 192.168.1.2  TCP 54 80→52546 [ACK] Seq=1 Ack=98 Win=14720 Len=0
  8   0.724423 54.230.97.250 -> 192.168.1.2  TCP 1454 [TCP segment of a reassembled PDU]
  9   0.725511 54.230.97.250 -> 192.168.1.2  TCP 1454 [TCP segment of a reassembled PDU]
 10   0.725603  192.168.1.2 -> 54.230.97.250 TCP 54 52546→80 [ACK] Seq=98 Ack=2801 Win=65792 Len=0
 11   0.726610 54.230.97.250 -> 192.168.1.2  TCP 1454 [TCP segment of a reassembled PDU]
 12   0.726611 54.230.97.250 -> 192.168.1.2  TCP 1454 [TCP segment of a reassembled PDU]
 13   0.726729  192.168.1.2 -> 54.230.97.250 TCP 54 52546→80 [ACK] Seq=98 Ack=5601 Win=65792 Len=0
 14   0.727732 54.230.97.250 -> 192.168.1.2  TCP 1454 [TCP segment of a reassembled PDU]
 15   0.727734 54.230.97.250 -> 192.168.1.2  TCP 1454 [TCP segment of a reassembled PDU]
 16   0.727736 54.230.97.250 -> 192.168.1.2  TCP 1454 [TCP segment of a reassembled PDU]
 17   0.727737 54.230.97.250 -> 192.168.1.2  HTTP 949 HTTP/1.1 200 OK  (application/octet-stream)
 18   0.727854  192.168.1.2 -> 54.230.97.250 TCP 54 52546→80 [ACK] Seq=98 Ack=10696 Win=65792 Len=0
 19   0.727959  192.168.1.2 -> 54.230.97.250 TCP 54 52546→80 [FIN, ACK] Seq=98 Ack=10696 Win=65792 Len=0
 20   0.757659 54.230.97.250 -> 192.168.1.2  TCP 54 80→52546 [FIN, ACK] Seq=10696 Ack=99 Win=14720 Len=0
 21   0.757814  192.168.1.2 -> 54.230.97.250 TCP 54 52546→80 [ACK] Seq=99 Ack=10697 Win=65792 Len=0
 22   2.144956  192.168.1.2 -> 74.125.232.198 SSL 55 Continuation Data
 23   2.185277 74.125.232.198 -> 192.168.1.2  TCP 66 443→52416 [ACK] Seq=1 Ack=2 Win=1373 Len=0 SLE=1 SRE=2
