[Measurement for 1kb at 23:41:09 19.41.2014] 
Tshark:

  1   0.000000 172.31.8.238 -> 172.31.0.2   DNS 89 Standard query 0x9f69  A d1xvcg6dfvgaki.cloudfront.net
  2   0.000029 172.31.8.238 -> 172.31.0.2   DNS 89 Standard query 0x63dd  AAAA d1xvcg6dfvgaki.cloudfront.net
  3   0.000644   172.31.0.2 -> 172.31.8.238 DNS 217 Standard query response 0x9f69  A 54.230.117.37 A 54.230.117.69 A 54.230.117.157 A 54.230.119.40 A 54.230.119.91 A 54.239.132.41 A 54.230.116.72 A 54.230.116.164
  4   0.003114   172.31.0.2 -> 172.31.8.238 DNS 170 Standard query response 0x63dd 
  5   0.003859 172.31.8.238 -> 54.230.117.37 TCP 74 44466 > http [SYN] Seq=0 Win=26883 Len=0 MSS=8961 SACK_PERM=1 TSval=6024185 TSecr=0 WS=128
  6   0.004535 54.230.117.37 -> 172.31.8.238 TCP 74 http > 44466 [SYN, ACK] Seq=0 Ack=1 Win=14480 Len=0 MSS=1460 SACK_PERM=1 TSval=1682077939 TSecr=6024185 WS=128
  7   0.004548 172.31.8.238 -> 54.230.117.37 TCP 66 44466 > http [ACK] Seq=1 Ack=1 Win=27008 Len=0 TSval=6024185 TSecr=1682077939
  8   0.004588 172.31.8.238 -> 54.230.117.37 HTTP 162 GET /1kb HTTP/1.1 
  9   0.005198 54.230.117.37 -> 172.31.8.238 TCP 66 http > 44466 [ACK] Seq=1 Ack=97 Win=14592 Len=0 TSval=1682077939 TSecr=6024185
 10   0.006550 54.230.117.37 -> 172.31.8.238 HTTP 1544 HTTP/1.1 200 OK  (application/octet-stream)
 11   0.006557 172.31.8.238 -> 54.230.117.37 TCP 66 44466 > http [ACK] Seq=97 Ack=1479 Win=29952 Len=0 TSval=6024185 TSecr=1682077939
 12   0.006696 172.31.8.238 -> 54.230.117.37 TCP 66 44466 > http [FIN, ACK] Seq=97 Ack=1479 Win=29952 Len=0 TSval=6024185 TSecr=1682077939
 13   0.007290 54.230.117.37 -> 172.31.8.238 TCP 66 http > 44466 [FIN, ACK] Seq=1479 Ack=98 Win=14592 Len=0 TSval=1682077939 TSecr=6024185
 14   0.007299 172.31.8.238 -> 54.230.117.37 TCP 66 44466 > http [ACK] Seq=98 Ack=1480 Win=29952 Len=0 TSval=6024185 TSecr=1682077939
