[Measurement for 1kb at 00:41:09 20.41.2014] 
Tshark:

  1   0.000000 172.31.8.238 -> 172.31.0.2   DNS 89 Standard query 0x07b4  A d1xvcg6dfvgaki.cloudfront.net
  2   0.000030 172.31.8.238 -> 172.31.0.2   DNS 89 Standard query 0x466e  AAAA d1xvcg6dfvgaki.cloudfront.net
  3   0.000640   172.31.0.2 -> 172.31.8.238 DNS 217 Standard query response 0x07b4  A 54.230.119.189 A 54.239.132.90 A 54.239.132.103 A 54.239.132.249 A 54.230.116.73 A 54.230.116.82 A 54.230.118.239 A 54.230.119.110
  4   0.006813   172.31.0.2 -> 172.31.8.238 DNS 170 Standard query response 0x466e 
  5   0.012001 172.31.8.238 -> 54.230.119.189 TCP 74 50156 > http [SYN] Seq=0 Win=26883 Len=0 MSS=8961 SACK_PERM=1 TSval=6924220 TSecr=0 WS=128
  6   0.012771 54.230.119.189 -> 172.31.8.238 TCP 74 http > 50156 [SYN, ACK] Seq=0 Ack=1 Win=14480 Len=0 MSS=1460 SACK_PERM=1 TSval=1685498861 TSecr=6924220 WS=128
  7   0.012787 172.31.8.238 -> 54.230.119.189 TCP 66 50156 > http [ACK] Seq=1 Ack=1 Win=27008 Len=0 TSval=6924221 TSecr=1685498861
  8   0.012837 172.31.8.238 -> 54.230.119.189 HTTP 162 GET /1kb HTTP/1.1 
  9   0.013513 54.230.119.189 -> 172.31.8.238 TCP 66 http > 50156 [ACK] Seq=1 Ack=97 Win=14592 Len=0 TSval=1685498861 TSecr=6924221
 10   0.015351 54.230.119.189 -> 172.31.8.238 HTTP 1544 HTTP/1.1 200 OK  (application/octet-stream)
 11   0.015358 172.31.8.238 -> 54.230.119.189 TCP 66 50156 > http [ACK] Seq=97 Ack=1479 Win=29952 Len=0 TSval=6924221 TSecr=1685498861
 12   0.015542 172.31.8.238 -> 54.230.119.189 TCP 66 50156 > http [FIN, ACK] Seq=97 Ack=1479 Win=29952 Len=0 TSval=6924221 TSecr=1685498861
 13   0.016073 54.230.119.189 -> 172.31.8.238 TCP 66 http > 50156 [FIN, ACK] Seq=1479 Ack=98 Win=14592 Len=0 TSval=1685498862 TSecr=6924221
 14   0.016082 172.31.8.238 -> 54.230.119.189 TCP 66 50156 > http [ACK] Seq=98 Ack=1480 Win=29952 Len=0 TSval=6924221 TSecr=1685498862
