[Measurement for 1kb at 21:41:09 19.41.2014] 
Tshark:

  1   0.000000 172.31.8.238 -> 172.31.0.2   DNS 89 Standard query 0x40d4  A d1xvcg6dfvgaki.cloudfront.net
  2   0.000029 172.31.8.238 -> 172.31.0.2   DNS 89 Standard query 0xa0b6  AAAA d1xvcg6dfvgaki.cloudfront.net
  3   0.000805   172.31.0.2 -> 172.31.8.238 DNS 217 Standard query response 0x40d4  A 54.192.118.222 A 54.230.116.167 A 54.230.117.50 A 54.230.117.154 A 54.230.119.66 A 54.230.119.94 A 54.239.132.41 A 54.239.132.55
  4   0.004889   172.31.0.2 -> 172.31.8.238 DNS 170 Standard query response 0xa0b6 
  5   0.012009 172.31.8.238 -> 54.192.118.222 TCP 74 34823 > http [SYN] Seq=0 Win=26883 Len=0 MSS=8961 SACK_PERM=1 TSval=4224297 TSecr=0 WS=128
  6   0.012661 54.192.118.222 -> 172.31.8.238 TCP 74 http > 34823 [SYN, ACK] Seq=0 Ack=1 Win=14480 Len=0 MSS=1460 SACK_PERM=1 TSval=1683360485 TSecr=4224297 WS=128
  7   0.012675 172.31.8.238 -> 54.192.118.222 TCP 66 34823 > http [ACK] Seq=1 Ack=1 Win=27008 Len=0 TSval=4224297 TSecr=1683360485
  8   0.012714 172.31.8.238 -> 54.192.118.222 HTTP 162 GET /1kb HTTP/1.1 
  9   0.013620 54.192.118.222 -> 172.31.8.238 TCP 66 http > 34823 [ACK] Seq=1 Ack=97 Win=14592 Len=0 TSval=1683360485 TSecr=4224297
 10   0.014905 54.192.118.222 -> 172.31.8.238 HTTP 1544 HTTP/1.1 200 OK  (application/octet-stream)
 11   0.014913 172.31.8.238 -> 54.192.118.222 TCP 66 34823 > http [ACK] Seq=97 Ack=1479 Win=29952 Len=0 TSval=4224298 TSecr=1683360485
 12   0.015053 172.31.8.238 -> 54.192.118.222 TCP 66 34823 > http [FIN, ACK] Seq=97 Ack=1479 Win=29952 Len=0 TSval=4224298 TSecr=1683360485
 13   0.015657 54.192.118.222 -> 172.31.8.238 TCP 66 http > 34823 [FIN, ACK] Seq=1479 Ack=98 Win=14592 Len=0 TSval=1683360485 TSecr=4224298
 14   0.015664 172.31.8.238 -> 54.192.118.222 TCP 66 34823 > http [ACK] Seq=98 Ack=1480 Win=29952 Len=0 TSval=4224298 TSecr=1683360485
 15   0.478529 06:b0:37:46:8f:13 -> 06:c7:b5:04:b8:d0 ARP 60 Who has 172.31.8.238?  Tell 172.31.0.1
 16   0.478549 06:c7:b5:04:b8:d0 -> 06:b0:37:46:8f:13 ARP 42 172.31.8.238 is at 06:c7:b5:04:b8:d0
