[Measurement for 1kb at 09:41:09 20.41.2014] 
Tshark:

  1   0.000000 172.31.8.238 -> 172.31.0.2   DNS 89 Standard query 0x8b82  A d1xvcg6dfvgaki.cloudfront.net
  2   0.000030 172.31.8.238 -> 172.31.0.2   DNS 89 Standard query 0x7cf4  AAAA d1xvcg6dfvgaki.cloudfront.net
  3   0.000648   172.31.0.2 -> 172.31.8.238 DNS 217 Standard query response 0x8b82  A 54.230.117.15 A 54.230.117.45 A 54.230.117.87 A 54.230.118.143 A 54.230.119.91 A 54.230.119.125 A 54.192.118.242 A 54.230.117.10
  4   0.004593   172.31.0.2 -> 172.31.8.238 DNS 170 Standard query response 0x7cf4 
  5   0.012036 172.31.8.238 -> 54.230.117.15 TCP 74 49364 > http [SYN] Seq=0 Win=26883 Len=0 MSS=8961 SACK_PERM=1 TSval=15024289 TSecr=0 WS=128
  6   0.012908 54.230.117.15 -> 172.31.8.238 TCP 74 http > 49364 [SYN, ACK] Seq=0 Ack=1 Win=14480 Len=0 MSS=1460 SACK_PERM=1 TSval=1687533828 TSecr=15024289 WS=128
  7   0.012924 172.31.8.238 -> 54.230.117.15 TCP 66 49364 > http [ACK] Seq=1 Ack=1 Win=27008 Len=0 TSval=15024289 TSecr=1687533828
  8   0.012973 172.31.8.238 -> 54.230.117.15 HTTP 162 GET /1kb HTTP/1.1 
  9   0.013609 54.230.117.15 -> 172.31.8.238 TCP 66 http > 49364 [ACK] Seq=1 Ack=97 Win=14592 Len=0 TSval=1687533828 TSecr=15024289
 10   0.015728 54.230.117.15 -> 172.31.8.238 HTTP 1544 HTTP/1.1 200 OK  (application/octet-stream)
 11   0.015735 172.31.8.238 -> 54.230.117.15 TCP 66 49364 > http [ACK] Seq=97 Ack=1479 Win=29952 Len=0 TSval=15024290 TSecr=1687533828
 12   0.015900 172.31.8.238 -> 54.230.117.15 TCP 66 49364 > http [FIN, ACK] Seq=97 Ack=1479 Win=29952 Len=0 TSval=15024290 TSecr=1687533828
 13   0.016497 54.230.117.15 -> 172.31.8.238 TCP 66 http > 49364 [FIN, ACK] Seq=1479 Ack=98 Win=14592 Len=0 TSval=1687533828 TSecr=15024290
 14   0.016505 172.31.8.238 -> 54.230.117.15 TCP 66 49364 > http [ACK] Seq=98 Ack=1480 Win=29952 Len=0 TSval=15024290 TSecr=1687533828
