[Measurement for 1kb at 07:41:08 20.41.2014] 
Tshark:

  1   0.000000 172.31.8.238 -> 172.31.0.2   DNS 89 Standard query 0x6b2b  A d1xvcg6dfvgaki.cloudfront.net
  2   0.000028 172.31.8.238 -> 172.31.0.2   DNS 89 Standard query 0xf24c  AAAA d1xvcg6dfvgaki.cloudfront.net
  3   0.000648   172.31.0.2 -> 172.31.8.238 DNS 217 Standard query response 0x6b2b  A 54.192.118.247 A 54.230.116.73 A 54.230.116.204 A 54.230.117.21 A 54.230.117.42 A 54.230.118.248 A 54.230.119.3 A 54.192.118.220
  4   0.006348   172.31.0.2 -> 172.31.8.238 DNS 170 Standard query response 0xf24c 
  5   0.011991 172.31.8.238 -> 54.192.118.247 TCP 74 39785 > http [SYN] Seq=0 Win=26883 Len=0 MSS=8961 SACK_PERM=1 TSval=13224149 TSecr=0 WS=128
  6   0.012569 54.192.118.247 -> 172.31.8.238 TCP 74 http > 39785 [SYN, ACK] Seq=0 Ack=1 Win=14480 Len=0 MSS=1460 SACK_PERM=1 TSval=1684732163 TSecr=13224149 WS=128
  7   0.012584 172.31.8.238 -> 54.192.118.247 TCP 66 39785 > http [ACK] Seq=1 Ack=1 Win=27008 Len=0 TSval=13224149 TSecr=1684732163
  8   0.012638 172.31.8.238 -> 54.192.118.247 HTTP 162 GET /1kb HTTP/1.1 
  9   0.013300 54.192.118.247 -> 172.31.8.238 TCP 66 http > 39785 [ACK] Seq=1 Ack=97 Win=14592 Len=0 TSval=1684732163 TSecr=13224149
 10   0.014645 54.192.118.247 -> 172.31.8.238 HTTP 1544 HTTP/1.1 200 OK  (application/octet-stream)
 11   0.014654 172.31.8.238 -> 54.192.118.247 TCP 66 39785 > http [ACK] Seq=97 Ack=1479 Win=29952 Len=0 TSval=13224150 TSecr=1684732163
 12   0.014809 172.31.8.238 -> 54.192.118.247 TCP 66 39785 > http [FIN, ACK] Seq=97 Ack=1479 Win=29952 Len=0 TSval=13224150 TSecr=1684732163
 13   0.015382 54.192.118.247 -> 172.31.8.238 TCP 66 http > 39785 [FIN, ACK] Seq=1479 Ack=98 Win=14592 Len=0 TSval=1684732163 TSecr=13224150
 14   0.015391 172.31.8.238 -> 54.192.118.247 TCP 66 39785 > http [ACK] Seq=98 Ack=1480 Win=29952 Len=0 TSval=13224150 TSecr=1684732163
