[Measurement for 1kb at 06:41:09 20.41.2014] 
Tshark:

  1   0.000000 172.31.8.238 -> 172.31.0.2   DNS 89 Standard query 0x9340  A d1xvcg6dfvgaki.cloudfront.net
  2   0.000029 172.31.8.238 -> 172.31.0.2   DNS 89 Standard query 0x1377  AAAA d1xvcg6dfvgaki.cloudfront.net
  3   0.000692   172.31.0.2 -> 172.31.8.238 DNS 217 Standard query response 0x9340  A 54.239.132.86 A 54.192.118.233 A 54.192.118.236 A 54.230.116.44 A 54.230.118.239 A 54.230.118.248 A 54.230.119.55 A 54.230.119.66
  4   0.004953   172.31.0.2 -> 172.31.8.238 DNS 170 Standard query response 0x1377 
  5   0.012003 172.31.8.238 -> 54.239.132.86 TCP 74 50253 > http [SYN] Seq=0 Win=26883 Len=0 MSS=8961 SACK_PERM=1 TSval=12324244 TSecr=0 WS=128
  6   0.012764 54.239.132.86 -> 172.31.8.238 TCP 74 http > 50253 [SYN, ACK] Seq=0 Ack=1 Win=14480 Len=0 MSS=1460 SACK_PERM=1 TSval=1684715400 TSecr=12324244 WS=128
  7   0.012778 172.31.8.238 -> 54.239.132.86 TCP 66 50253 > http [ACK] Seq=1 Ack=1 Win=27008 Len=0 TSval=12324245 TSecr=1684715400
  8   0.012824 172.31.8.238 -> 54.239.132.86 HTTP 162 GET /1kb HTTP/1.1 
  9   0.013528 54.239.132.86 -> 172.31.8.238 TCP 66 http > 50253 [ACK] Seq=1 Ack=97 Win=14592 Len=0 TSval=1684715400 TSecr=12324245
 10   0.015154 54.239.132.86 -> 172.31.8.238 HTTP 1544 HTTP/1.1 200 OK  (application/octet-stream)
 11   0.015162 172.31.8.238 -> 54.239.132.86 TCP 66 50253 > http [ACK] Seq=97 Ack=1479 Win=29952 Len=0 TSval=12324245 TSecr=1684715400
 12   0.015328 172.31.8.238 -> 54.239.132.86 TCP 66 50253 > http [FIN, ACK] Seq=97 Ack=1479 Win=29952 Len=0 TSval=12324245 TSecr=1684715400
 13   0.016313 54.239.132.86 -> 172.31.8.238 TCP 66 http > 50253 [FIN, ACK] Seq=1479 Ack=98 Win=14592 Len=0 TSval=1684715400 TSecr=12324245
 14   0.016322 172.31.8.238 -> 54.239.132.86 TCP 66 50253 > http [ACK] Seq=98 Ack=1480 Win=29952 Len=0 TSval=12324245 TSecr=1684715400
