[Measurement for 1kb at 12:41:09 20.41.2014] 
Tshark:

  1   0.000000 172.31.8.238 -> 172.31.0.2   DNS 89 Standard query 0xeb2b  A d1xvcg6dfvgaki.cloudfront.net
  2   0.000028 172.31.8.238 -> 172.31.0.2   DNS 89 Standard query 0x9b3f  AAAA d1xvcg6dfvgaki.cloudfront.net
  3   0.000978   172.31.0.2 -> 172.31.8.238 DNS 217 Standard query response 0xeb2b  A 54.230.116.204 A 54.230.117.156 A 54.230.119.66 A 54.230.119.125 A 54.239.132.173 A 54.192.118.228 A 54.230.116.82 A 54.230.116.141
  4   0.009535   172.31.0.2 -> 172.31.8.238 DNS 170 Standard query response 0x9b3f 
  5   0.011974 172.31.8.238 -> 54.230.116.204 TCP 74 58252 > http [SYN] Seq=0 Win=26883 Len=0 MSS=8961 SACK_PERM=1 TSval=17724331 TSecr=0 WS=128
  6   0.012615 54.230.116.204 -> 172.31.8.238 TCP 74 http > 58252 [SYN, ACK] Seq=0 Ack=1 Win=14480 Len=0 MSS=1460 SACK_PERM=1 TSval=1685285855 TSecr=17724331 WS=128
  7   0.012630 172.31.8.238 -> 54.230.116.204 TCP 66 58252 > http [ACK] Seq=1 Ack=1 Win=27008 Len=0 TSval=17724331 TSecr=1685285855
  8   0.012674 172.31.8.238 -> 54.230.116.204 HTTP 162 GET /1kb HTTP/1.1 
  9   0.013358 54.230.116.204 -> 172.31.8.238 TCP 66 http > 58252 [ACK] Seq=1 Ack=97 Win=14592 Len=0 TSval=1685285855 TSecr=17724331
 10   0.014904 54.230.116.204 -> 172.31.8.238 HTTP 1544 HTTP/1.1 200 OK  (application/octet-stream)
 11   0.014911 172.31.8.238 -> 54.230.116.204 TCP 66 58252 > http [ACK] Seq=97 Ack=1479 Win=29952 Len=0 TSval=17724332 TSecr=1685285855
 12   0.015063 172.31.8.238 -> 54.230.116.204 TCP 66 58252 > http [FIN, ACK] Seq=97 Ack=1479 Win=29952 Len=0 TSval=17724332 TSecr=1685285855
 13   0.015657 54.230.116.204 -> 172.31.8.238 TCP 66 http > 58252 [FIN, ACK] Seq=1479 Ack=98 Win=14592 Len=0 TSval=1685285855 TSecr=17724332
 14   0.015666 172.31.8.238 -> 54.230.116.204 TCP 66 58252 > http [ACK] Seq=98 Ack=1480 Win=29952 Len=0 TSval=17724332 TSecr=1685285855
