[Measurement for 1kb at 20:37:36 19.37.2014] 
Tshark:

  1   0.000000 172.31.29.138 -> 172.31.0.2   DNS 89 Standard query 0x83c5  A d1dx94olpiqj0t.cloudfront.net
  2   0.000024 172.31.29.138 -> 172.31.0.2   DNS 89 Standard query 0x519d  AAAA d1dx94olpiqj0t.cloudfront.net
  3   0.000645   172.31.0.2 -> 172.31.29.138 DNS 217 Standard query response 0x83c5  A 54.192.157.146 A 54.192.159.173 A 54.192.159.174 A 54.230.158.80 A 54.230.158.223 A 54.230.158.246 A 54.230.159.7 A 54.192.156.109
  4   0.004544   172.31.0.2 -> 172.31.29.138 DNS 176 Standard query response 0x519d 
  5   0.012035 172.31.29.138 -> 54.192.157.146 TCP 74 59785 > http [SYN] Seq=0 Win=26883 Len=0 MSS=8961 SACK_PERM=1 TSval=3332209 TSecr=0 WS=128
  6   0.012857 54.192.157.146 -> 172.31.29.138 TCP 74 http > 59785 [SYN, ACK] Seq=0 Ack=1 Win=14480 Len=0 MSS=1460 SACK_PERM=1 TSval=830437178 TSecr=3332209 WS=128
  7   0.012870 172.31.29.138 -> 54.192.157.146 TCP 66 59785 > http [ACK] Seq=1 Ack=1 Win=27008 Len=0 TSval=3332209 TSecr=830437178
  8   0.012912 172.31.29.138 -> 54.192.157.146 HTTP 162 GET /1kb HTTP/1.1 
  9   0.013579 54.192.157.146 -> 172.31.29.138 TCP 66 http > 59785 [ACK] Seq=1 Ack=97 Win=14592 Len=0 TSval=830437178 TSecr=3332209
 10   0.016017 54.192.157.146 -> 172.31.29.138 HTTP 1544 HTTP/1.1 200 OK  (application/octet-stream)
 11   0.016024 172.31.29.138 -> 54.192.157.146 TCP 66 59785 > http [ACK] Seq=97 Ack=1479 Win=29952 Len=0 TSval=3332210 TSecr=830437179
 12   0.016178 172.31.29.138 -> 54.192.157.146 TCP 66 59785 > http [FIN, ACK] Seq=97 Ack=1479 Win=29952 Len=0 TSval=3332210 TSecr=830437179
 13   0.016747 54.192.157.146 -> 172.31.29.138 TCP 66 http > 59785 [FIN, ACK] Seq=1479 Ack=98 Win=14592 Len=0 TSval=830437179 TSecr=3332210
 14   0.016756 172.31.29.138 -> 54.192.157.146 TCP 66 59785 > http [ACK] Seq=98 Ack=1480 Win=29952 Len=0 TSval=3332210 TSecr=830437179
