[Measurement for 1kb at 02:36:38 20.36.2014] 
Tshark:

  1   0.000000 172.31.29.138 -> 172.31.0.2   DNS 89 Standard query 0x3116  A d1dx94olpiqj0t.cloudfront.net
  2   0.000024 172.31.29.138 -> 172.31.0.2   DNS 89 Standard query 0x0a30  AAAA d1dx94olpiqj0t.cloudfront.net
  3   0.000945   172.31.0.2 -> 172.31.29.138 DNS 217 Standard query response 0x3116  A 54.230.158.229 A 54.230.159.137 A 54.192.156.102 A 54.192.156.109 A 54.192.157.149 A 54.192.159.165 A 54.230.156.40 A 54.230.158.223
  4   0.004232   172.31.0.2 -> 172.31.29.138 DNS 176 Standard query response 0x0a30 
  5   0.005945 172.31.29.138 -> 54.230.158.229 TCP 74 40503 > http [SYN] Seq=0 Win=26883 Len=0 MSS=8961 SACK_PERM=1 TSval=8717703 TSecr=0 WS=128
  6   0.006596 54.230.158.229 -> 172.31.29.138 TCP 74 http > 40503 [SYN, ACK] Seq=0 Ack=1 Win=14480 Len=0 MSS=1460 SACK_PERM=1 TSval=729738092 TSecr=8717703 WS=128
  7   0.006610 172.31.29.138 -> 54.230.158.229 TCP 66 40503 > http [ACK] Seq=1 Ack=1 Win=27008 Len=0 TSval=8717703 TSecr=729738092
  8   0.006648 172.31.29.138 -> 54.230.158.229 HTTP 162 GET /1kb HTTP/1.1 
  9   0.007363 54.230.158.229 -> 172.31.29.138 TCP 66 http > 40503 [ACK] Seq=1 Ack=97 Win=14592 Len=0 TSval=729738092 TSecr=8717703
 10   0.012727 54.230.158.229 -> 172.31.29.138 HTTP 1544 HTTP/1.1 200 OK  (application/octet-stream)
 11   0.012736 172.31.29.138 -> 54.230.158.229 TCP 66 40503 > http [ACK] Seq=97 Ack=1479 Win=29952 Len=0 TSval=8717705 TSecr=729738092
 12   0.012878 172.31.29.138 -> 54.230.158.229 TCP 66 40503 > http [FIN, ACK] Seq=97 Ack=1479 Win=29952 Len=0 TSval=8717705 TSecr=729738092
 13   0.013706 54.230.158.229 -> 172.31.29.138 TCP 66 http > 40503 [FIN, ACK] Seq=1479 Ack=98 Win=14592 Len=0 TSval=729738092 TSecr=8717705
 14   0.013715 172.31.29.138 -> 54.230.158.229 TCP 66 40503 > http [ACK] Seq=98 Ack=1480 Win=29952 Len=0 TSval=8717705 TSecr=729738092
