[Measurement for 1kb at 09:36:38 20.36.2014] 
Tshark:

  1   0.000000 172.31.29.138 -> 172.31.0.2   DNS 89 Standard query 0x77b0  A d1dx94olpiqj0t.cloudfront.net
  2   0.000030 172.31.29.138 -> 172.31.0.2   DNS 89 Standard query 0x3550  AAAA d1dx94olpiqj0t.cloudfront.net
  3   0.000636   172.31.0.2 -> 172.31.29.138 DNS 217 Standard query response 0x77b0  A 54.192.159.104 A 54.192.159.171 A 54.230.158.80 A 54.230.158.190 A 54.230.158.246 A 54.230.159.124 A 54.230.159.137 A 54.192.157.145
  4   0.002489   172.31.0.2 -> 172.31.29.138 DNS 176 Standard query response 0x3550 
  5   0.003865 172.31.29.138 -> 54.192.159.104 TCP 74 45208 > http [SYN] Seq=0 Win=26883 Len=0 MSS=8961 SACK_PERM=1 TSval=15017912 TSecr=0 WS=128
  6   0.004369 54.192.159.104 -> 172.31.29.138 TCP 74 http > 45208 [SYN, ACK] Seq=0 Ack=1 Win=14480 Len=0 MSS=1460 SACK_PERM=1 TSval=732257891 TSecr=15017912 WS=128
  7   0.004384 172.31.29.138 -> 54.192.159.104 TCP 66 45208 > http [ACK] Seq=1 Ack=1 Win=27008 Len=0 TSval=15017912 TSecr=732257891
  8   0.004426 172.31.29.138 -> 54.192.159.104 HTTP 162 GET /1kb HTTP/1.1 
  9   0.004898 54.192.159.104 -> 172.31.29.138 TCP 66 http > 45208 [ACK] Seq=1 Ack=97 Win=14592 Len=0 TSval=732257891 TSecr=15017912
 10   0.007485 54.192.159.104 -> 172.31.29.138 HTTP 1544 HTTP/1.1 200 OK  (application/octet-stream)
 11   0.007495 172.31.29.138 -> 54.192.159.104 TCP 66 45208 > http [ACK] Seq=97 Ack=1479 Win=29952 Len=0 TSval=15017913 TSecr=732257892
 12   0.007648 172.31.29.138 -> 54.192.159.104 TCP 66 45208 > http [FIN, ACK] Seq=97 Ack=1479 Win=29952 Len=0 TSval=15017913 TSecr=732257892
 13   0.008218 54.192.159.104 -> 172.31.29.138 TCP 66 http > 45208 [FIN, ACK] Seq=1479 Ack=98 Win=14592 Len=0 TSval=732257892 TSecr=15017913
 14   0.008226 172.31.29.138 -> 54.192.159.104 TCP 66 45208 > http [ACK] Seq=98 Ack=1480 Win=29952 Len=0 TSval=15017913 TSecr=732257892
