[Measurement for 1kb at 07:36:39 20.36.2014] 
Tshark:

  1   0.000000 172.31.29.138 -> 172.31.0.2   DNS 89 Standard query 0x0692  A d1dx94olpiqj0t.cloudfront.net
  2   0.000028 172.31.29.138 -> 172.31.0.2   DNS 89 Standard query 0xee1a  AAAA d1dx94olpiqj0t.cloudfront.net
  3   0.000563   172.31.0.2 -> 172.31.29.138 DNS 217 Standard query response 0x0692  A 54.230.158.205 A 54.230.159.141 A 54.192.157.136 A 54.192.157.155 A 54.192.157.156 A 54.192.159.158 A 54.192.159.162 A 54.230.158.142
  4   0.002626   172.31.0.2 -> 172.31.29.138 DNS 176 Standard query response 0xee1a 
  5   0.006181 172.31.29.138 -> 54.230.158.205 TCP 74 37604 > http [SYN] Seq=0 Win=26883 Len=0 MSS=8961 SACK_PERM=1 TSval=13217950 TSecr=0 WS=128
  6   0.006791 54.230.158.205 -> 172.31.29.138 TCP 74 http > 37604 [SYN, ACK] Seq=0 Ack=1 Win=14480 Len=0 MSS=1460 SACK_PERM=1 TSval=731565705 TSecr=13217950 WS=128
  7   0.006807 172.31.29.138 -> 54.230.158.205 TCP 66 37604 > http [ACK] Seq=1 Ack=1 Win=27008 Len=0 TSval=13217950 TSecr=731565705
  8   0.006849 172.31.29.138 -> 54.230.158.205 HTTP 162 GET /1kb HTTP/1.1 
  9   0.007422 54.230.158.205 -> 172.31.29.138 TCP 66 http > 37604 [ACK] Seq=1 Ack=97 Win=14592 Len=0 TSval=731565705 TSecr=13217950
 10   0.012317 54.230.158.205 -> 172.31.29.138 HTTP 1544 HTTP/1.1 200 OK  (application/octet-stream)
 11   0.012325 172.31.29.138 -> 54.230.158.205 TCP 66 37604 > http [ACK] Seq=97 Ack=1479 Win=29952 Len=0 TSval=13217952 TSecr=731565705
 12   0.012481 172.31.29.138 -> 54.230.158.205 TCP 66 37604 > http [FIN, ACK] Seq=97 Ack=1479 Win=29952 Len=0 TSval=13217952 TSecr=731565705
 13   0.016154 54.230.158.205 -> 172.31.29.138 TCP 66 http > 37604 [FIN, ACK] Seq=1479 Ack=98 Win=14592 Len=0 TSval=731565706 TSecr=13217952
 14   0.016162 172.31.29.138 -> 54.230.158.205 TCP 66 37604 > http [ACK] Seq=98 Ack=1480 Win=29952 Len=0 TSval=13217953 TSecr=731565706
