[Measurement for 1kb at 22:36:38 19.36.2014] 
Tshark:

  1   0.000000 172.31.29.138 -> 172.31.0.2   DNS 89 Standard query 0x9627  A d1dx94olpiqj0t.cloudfront.net
  2   0.000027 172.31.29.138 -> 172.31.0.2   DNS 89 Standard query 0xd65c  AAAA d1dx94olpiqj0t.cloudfront.net
  3   0.000580   172.31.0.2 -> 172.31.29.138 DNS 217 Standard query response 0x9627  A 54.230.158.217 A 54.230.158.223 A 54.230.158.246 A 54.230.159.4 A 54.230.159.132 A 54.230.159.153 A 54.192.157.144 A 54.230.158.139
  4   0.003728   172.31.0.2 -> 172.31.29.138 DNS 176 Standard query response 0xd65c 
  5   0.011984 172.31.29.138 -> 54.230.158.217 TCP 74 41727 > http [SYN] Seq=0 Win=26883 Len=0 MSS=8961 SACK_PERM=1 TSval=5117876 TSecr=0 WS=128
  6   0.012493 54.230.158.217 -> 172.31.29.138 TCP 74 http > 41727 [SYN, ACK] Seq=0 Ack=1 Win=14480 Len=0 MSS=1460 SACK_PERM=1 TSval=839704152 TSecr=5117876 WS=128
  7   0.012508 172.31.29.138 -> 54.230.158.217 TCP 66 41727 > http [ACK] Seq=1 Ack=1 Win=27008 Len=0 TSval=5117877 TSecr=839704152
  8   0.012552 172.31.29.138 -> 54.230.158.217 HTTP 162 GET /1kb HTTP/1.1 
  9   0.013034 54.230.158.217 -> 172.31.29.138 TCP 66 http > 41727 [ACK] Seq=1 Ack=97 Win=14592 Len=0 TSval=839704152 TSecr=5117877
 10   0.015388 54.230.158.217 -> 172.31.29.138 HTTP 1544 HTTP/1.1 200 OK  (application/octet-stream)
 11   0.015396 172.31.29.138 -> 54.230.158.217 TCP 66 41727 > http [ACK] Seq=97 Ack=1479 Win=29952 Len=0 TSval=5117877 TSecr=839704152
 12   0.015538 172.31.29.138 -> 54.230.158.217 TCP 66 41727 > http [FIN, ACK] Seq=97 Ack=1479 Win=29952 Len=0 TSval=5117877 TSecr=839704152
 13   0.016108 54.230.158.217 -> 172.31.29.138 TCP 66 http > 41727 [FIN, ACK] Seq=1479 Ack=98 Win=14592 Len=0 TSval=839704153 TSecr=5117877
 14   0.016117 172.31.29.138 -> 54.230.158.217 TCP 66 41727 > http [ACK] Seq=98 Ack=1480 Win=29952 Len=0 TSval=5117877 TSecr=839704153
