[Measurement for 1kb at 13:39:05 20.39.2014] 
Tshark:

  1   0.000000 172.31.29.138 -> 172.31.0.2   DNS 89 Standard query 0x7954  A d2pcb72msibvx3.cloudfront.net
  2   0.000028 172.31.29.138 -> 172.31.0.2   DNS 89 Standard query 0x778b  AAAA d2pcb72msibvx3.cloudfront.net
  3   0.000556   172.31.0.2 -> 172.31.29.138 DNS 217 Standard query response 0x7954  A 54.192.159.104 A 54.192.159.252 A 54.230.158.101 A 54.230.158.144 A 54.230.158.149 A 54.230.158.181 A 54.230.159.4 A 54.230.159.5
  4   0.003483   172.31.0.2 -> 172.31.29.138 DNS 169 Standard query response 0x778b 
  5   0.003862 172.31.29.138 -> 54.192.159.104 TCP 74 45413 > http [SYN] Seq=0 Win=26883 Len=0 MSS=8961 SACK_PERM=1 TSval=18654493 TSecr=0 WS=128
  6   0.004621 54.192.159.104 -> 172.31.29.138 TCP 74 http > 45413 [SYN, ACK] Seq=0 Ack=1 Win=14480 Len=0 MSS=1460 SACK_PERM=1 TSval=733712534 TSecr=18654493 WS=128
  7   0.004636 172.31.29.138 -> 54.192.159.104 TCP 66 45413 > http [ACK] Seq=1 Ack=1 Win=27008 Len=0 TSval=18654493 TSecr=733712534
  8   0.004708 172.31.29.138 -> 54.192.159.104 HTTP 162 GET /1kb HTTP/1.1 
  9   0.005401 54.192.159.104 -> 172.31.29.138 TCP 66 http > 45413 [ACK] Seq=1 Ack=97 Win=14592 Len=0 TSval=733712534 TSecr=18654494
 10   0.007961 54.192.159.104 -> 172.31.29.138 HTTP 1544 HTTP/1.1 200 OK  (application/octet-stream)
 11   0.007970 172.31.29.138 -> 54.192.159.104 TCP 66 45413 > http [ACK] Seq=97 Ack=1479 Win=29952 Len=0 TSval=18654494 TSecr=733712534
 12   0.008133 172.31.29.138 -> 54.192.159.104 TCP 66 45413 > http [FIN, ACK] Seq=97 Ack=1479 Win=29952 Len=0 TSval=18654494 TSecr=733712534
 13   0.008964 54.192.159.104 -> 172.31.29.138 TCP 66 http > 45413 [FIN, ACK] Seq=1479 Ack=98 Win=14592 Len=0 TSval=733712534 TSecr=18654494
 14   0.008974 172.31.29.138 -> 54.192.159.104 TCP 66 45413 > http [ACK] Seq=98 Ack=1480 Win=29952 Len=0 TSval=18654495 TSecr=733712534
