[Measurement for 1kb at 03:39:05 20.39.2014] 
Tshark:

  1   0.000000 213.165.85.185 -> 172.31.29.138 SSH 82 Encrypted request packet len=16
  2   0.038536 172.31.29.138 -> 213.165.85.185 TCP 66 ssh > 59149 [ACK] Seq=1 Ack=17 Win=227 Len=0 TSval=9654204 TSecr=161203466
  3   0.309392 213.165.85.185 -> 172.31.29.138 SSH 118 Encrypted request packet len=52
  4   0.309414 172.31.29.138 -> 213.165.85.185 TCP 66 ssh > 59149 [ACK] Seq=1 Ack=69 Win=227 Len=0 TSval=9654271 TSecr=161203497
  5   0.309474 172.31.29.138 -> 213.165.85.185 SSH 118 Encrypted response packet len=52
  6   0.578257 213.165.85.185 -> 172.31.29.138 SSH 150 Encrypted request packet len=84
  7   0.578734 172.31.29.138 -> 172.31.0.2   DNS 87 Standard query 0xd307  PTR 185.85.165.213.in-addr.arpa
  8   0.579854   172.31.0.2 -> 172.31.29.138 DNS 133 Standard query response 0xd307  PTR s15313466.onlinehome-server.info
  9   0.579958 172.31.29.138 -> 172.31.0.2   DNS 92 Standard query 0xd8d4  A s15313466.onlinehome-server.info
 10   0.580605   172.31.0.2 -> 172.31.29.138 DNS 108 Standard query response 0xd8d4  A 213.165.85.185
 11   0.582249 172.31.29.138 -> 213.165.85.185 SSH 118 Encrypted response packet len=52
 12   0.846460 213.165.85.185 -> 172.31.29.138 TCP 74 60564 > ssh [SYN] Seq=0 Win=5840 Len=0 MSS=1460 SACK_PERM=1 TSval=161203551 TSecr=0 WS=64
 13   0.846505 172.31.29.138 -> 213.165.85.185 TCP 74 ssh > 60564 [SYN, ACK] Seq=0 Ack=1 Win=26847 Len=0 MSS=8961 SACK_PERM=1 TSval=9654405 TSecr=161203551 WS=128
 14   0.850644 213.165.85.185 -> 172.31.29.138 SSH 118 Encrypted request packet len=52
 15   0.850659 213.165.85.185 -> 172.31.29.138 TCP 66 59149 > ssh [FIN, ACK] Seq=205 Ack=105 Win=227 Len=0 TSval=161203551 TSecr=9654339
 16   0.851223 172.31.29.138 -> 172.31.0.2   DNS 92 Standard query 0xff1d  A s15313466.onlinehome-server.info
 17   0.851232 172.31.29.138 -> 172.31.0.2   DNS 92 Standard query 0xd779  AAAA s15313466.onlinehome-server.info
 18   0.851895   172.31.0.2 -> 172.31.29.138 DNS 108 Standard query response 0xff1d  A 213.165.85.185
 19   0.851917   172.31.0.2 -> 172.31.29.138 DNS 120 Standard query response 0xd779  AAAA 2001:8d8:896:9494:a6f:b50:90f8:0
 20   0.852413 172.31.29.138 -> 213.165.85.185 TCP 66 ssh > 59149 [FIN, ACK] Seq=105 Ack=206 Win=227 Len=0 TSval=9654407 TSecr=161203551
 21   1.109715 213.165.85.185 -> 172.31.29.138 TCP 66 60564 > ssh [ACK] Seq=1 Ack=1 Win=5888 Len=0 TSval=161203577 TSecr=9654405
 22   1.114224 172.31.29.138 -> 213.165.85.185 SSH 107 Server Protocol: SSH-2.0-OpenSSH_6.6.1p1 Ubuntu-2ubuntu2\r
 23   1.119949 213.165.85.185 -> 172.31.29.138 TCP 66 59149 > ssh [ACK] Seq=206 Ack=106 Win=227 Len=0 TSval=161203578 TSecr=9654407
 24   1.377843 213.165.85.185 -> 172.31.29.138 TCP 66 60564 > ssh [ACK] Seq=1 Ack=42 Win=5888 Len=0 TSval=161203604 TSecr=9654472
 25   1.377864 213.165.85.185 -> 172.31.29.138 SSH 86 Client Protocol: SSH-2.0-libssh-0.1\r
 26   1.377905 172.31.29.138 -> 213.165.85.185 TCP 66 ssh > 60564 [ACK] Seq=42 Ack=21 Win=26880 Len=0 TSval=9654538 TSecr=161203604
 27   1.378446 172.31.29.138 -> 213.165.85.185 TCP 1514 [TCP segment of a reassembled PDU]
 28   1.378455 172.31.29.138 -> 213.165.85.185 SSHv2 250 Server: Key Exchange Init
 29   1.621899 172.31.29.138 -> 172.31.0.2   DNS 89 Standard query 0x8c41  A d2pcb72msibvx3.cloudfront.net
 30   1.621923 172.31.29.138 -> 172.31.0.2   DNS 89 Standard query 0x8d83  AAAA d2pcb72msibvx3.cloudfront.net
 31   1.622425   172.31.0.2 -> 172.31.29.138 DNS 217 Standard query response 0x8c41  A 54.230.151.251 A 54.230.148.75 A 54.230.149.48 A 54.230.149.221 A 54.230.149.227 A 54.230.150.45 A 54.230.150.69 A 54.230.150.148
 32   1.625081   172.31.0.2 -> 172.31.29.138 DNS 169 Standard query response 0x8d83 
 33   1.625741 172.31.29.138 -> 54.230.151.251 TCP 74 55458 > http [SYN] Seq=0 Win=26883 Len=0 MSS=8961 SACK_PERM=1 TSval=9654600 TSecr=0 WS=128
 34   1.627205 54.230.151.251 -> 172.31.29.138 TCP 74 http > 55458 [SYN, ACK] Seq=0 Ack=1 Win=14480 Len=0 MSS=1460 SACK_PERM=1 TSval=443853298 TSecr=9654600 WS=128
 35   1.627220 172.31.29.138 -> 54.230.151.251 TCP 66 55458 > http [ACK] Seq=1 Ack=1 Win=27008 Len=0 TSval=9654601 TSecr=443853298
 36   1.627259 172.31.29.138 -> 54.230.151.251 HTTP 162 GET /1kb HTTP/1.1 
 37   1.628718 54.230.151.251 -> 172.31.29.138 TCP 66 http > 55458 [ACK] Seq=1 Ack=97 Win=14592 Len=0 TSval=443853298 TSecr=9654601
 38   1.630892 54.230.151.251 -> 172.31.29.138 HTTP 1544 HTTP/1.1 200 OK  (application/octet-stream)
 39   1.630901 172.31.29.138 -> 54.230.151.251 TCP 66 55458 > http [ACK] Seq=97 Ack=1479 Win=29952 Len=0 TSval=9654602 TSecr=443853299
 40   1.631087 172.31.29.138 -> 54.230.151.251 TCP 66 55458 > http [FIN, ACK] Seq=97 Ack=1479 Win=29952 Len=0 TSval=9654602 TSecr=443853299
 41   1.632561 54.230.151.251 -> 172.31.29.138 TCP 66 http > 55458 [FIN, ACK] Seq=1479 Ack=98 Win=14592 Len=0 TSval=443853299 TSecr=9654602
 42   1.632570 172.31.29.138 -> 54.230.151.251 TCP 66 55458 > http [ACK] Seq=98 Ack=1480 Win=29952 Len=0 TSval=9654602 TSecr=443853299
 43   1.642652 213.165.85.185 -> 172.31.29.138 TCP 66 60564 > ssh [ACK] Seq=21 Ack=1674 Win=11648 Len=0 TSval=161203631 TSecr=9654538
 44   1.642670 213.165.85.185 -> 172.31.29.138 SSHv2 218 Client: Key Exchange Init
 45   1.682551 172.31.29.138 -> 213.165.85.185 TCP 66 ssh > 60564 [ACK] Seq=1674 Ack=173 Win=28032 Len=0 TSval=9654615 TSecr=161203631
 46   1.946771 213.165.85.185 -> 172.31.29.138 SSHv2 210 Client: Diffie-Hellman Key Exchange Init
 47   1.946801 172.31.29.138 -> 213.165.85.185 TCP 66 ssh > 60564 [ACK] Seq=1674 Ack=317 Win=29056 Len=0 TSval=9654681 TSecr=161203661
 48   1.948677 172.31.29.138 -> 213.165.85.185 SSHv2 786 Server: New Keys
 49   2.214117 213.165.85.185 -> 172.31.29.138 SSHv2 82 Client: New Keys
