[Measurement for 1kb at 17:41:33 19.41.2014] 
Tshark:

  1   0.000000 172.31.29.138 -> 172.31.0.2   DNS 89 Standard query 0xc81b  A d2pcb72msibvx3.cloudfront.net
  2   0.000027 172.31.29.138 -> 172.31.0.2   DNS 89 Standard query 0x4454  AAAA d2pcb72msibvx3.cloudfront.net
  3   0.000644   172.31.0.2 -> 172.31.29.138 DNS 217 Standard query response 0xc81b  A 54.230.158.246 A 54.230.159.147 A 54.240.168.150 A 54.192.157.152 A 54.230.158.152 A 54.230.158.179 A 54.230.158.193 A 54.230.158.234
  4   0.003612   172.31.0.2 -> 172.31.29.138 DNS 169 Standard query response 0x4454 
  5   0.003871 172.31.29.138 -> 54.230.158.246 TCP 74 45537 > http [SYN] Seq=0 Win=26883 Len=0 MSS=8961 SACK_PERM=1 TSval=691659 TSecr=0 WS=128
  6   0.004623 54.230.158.246 -> 172.31.29.138 TCP 74 http > 45537 [SYN, ACK] Seq=0 Ack=1 Win=14480 Len=0 MSS=1460 SACK_PERM=1 TSval=726526252 TSecr=691659 WS=128
  7   0.004638 172.31.29.138 -> 54.230.158.246 TCP 66 45537 > http [ACK] Seq=1 Ack=1 Win=27008 Len=0 TSval=691659 TSecr=726526252
  8   0.004678 172.31.29.138 -> 54.230.158.246 HTTP 162 GET /1kb HTTP/1.1 
  9   0.005373 54.230.158.246 -> 172.31.29.138 TCP 66 http > 45537 [ACK] Seq=1 Ack=97 Win=14592 Len=0 TSval=726526252 TSecr=691659
 10   0.224612 54.230.158.246 -> 172.31.29.138 HTTP 1533 HTTP/1.1 200 OK  (application/octet-stream)
 11   0.224637 172.31.29.138 -> 54.230.158.246 TCP 66 45537 > http [ACK] Seq=97 Ack=1468 Win=29824 Len=0 TSval=691714 TSecr=726526274
 12   0.226712 172.31.29.138 -> 54.230.158.246 TCP 66 45537 > http [FIN, ACK] Seq=97 Ack=1468 Win=29824 Len=0 TSval=691715 TSecr=726526274
 13   0.227318 54.230.158.246 -> 172.31.29.138 TCP 66 http > 45537 [FIN, ACK] Seq=1468 Ack=98 Win=14592 Len=0 TSval=726526274 TSecr=691715
 14   0.227328 172.31.29.138 -> 54.230.158.246 TCP 66 45537 > http [ACK] Seq=98 Ack=1469 Win=29824 Len=0 TSval=691715 TSecr=726526274
