[Measurement for 1kb at 14:39:05 20.39.2014] 
Tshark:

  1   0.000000 86.50.146.105 -> 172.31.29.138 TCP 78 53852 > ssh [ACK] Seq=1 Ack=1 Win=5322 Len=0 TSval=17992771 TSecr=19553669 SLE=45145 SRE=45589
  2   0.000032 172.31.29.138 -> 86.50.146.105 SSH 1434 Encrypted response packet len=1368
  3   0.000044 172.31.29.138 -> 86.50.146.105 SSH 1434 Encrypted response packet len=1368
  4   0.847446 172.31.29.138 -> 172.31.0.2   DNS 89 Standard query 0xb0c9  A d2pcb72msibvx3.cloudfront.net
  5   0.847475 172.31.29.138 -> 172.31.0.2   DNS 89 Standard query 0x6274  AAAA d2pcb72msibvx3.cloudfront.net
  6   0.848046   172.31.0.2 -> 172.31.29.138 DNS 217 Standard query response 0xb0c9  A 54.230.150.107 A 54.230.150.123 A 54.230.150.154 A 54.230.149.38 A 54.230.149.97 A 54.230.150.16 A 54.230.150.29 A 54.230.150.42
  7   0.851089   172.31.0.2 -> 172.31.29.138 DNS 169 Standard query response 0x6274 
  8   0.853480 172.31.29.138 -> 54.230.150.107 TCP 74 45200 > http [SYN] Seq=0 Win=26883 Len=0 MSS=8961 SACK_PERM=1 TSval=19554617 TSecr=0 WS=128
  9   0.854817 54.230.150.107 -> 172.31.29.138 TCP 74 http > 45200 [SYN, ACK] Seq=0 Ack=1 Win=14480 Len=0 MSS=1460 SACK_PERM=1 TSval=447801031 TSecr=19554617 WS=128
 10   0.854831 172.31.29.138 -> 54.230.150.107 TCP 66 45200 > http [ACK] Seq=1 Ack=1 Win=27008 Len=0 TSval=19554618 TSecr=447801031
 11   0.854872 172.31.29.138 -> 54.230.150.107 HTTP 162 GET /1kb HTTP/1.1 
 12   0.856084 54.230.150.107 -> 172.31.29.138 TCP 66 http > 45200 [ACK] Seq=1 Ack=97 Win=14592 Len=0 TSval=447801031 TSecr=19554618
 13   0.858414 54.230.150.107 -> 172.31.29.138 HTTP 1544 HTTP/1.1 200 OK  (application/octet-stream)
 14   0.858423 172.31.29.138 -> 54.230.150.107 TCP 66 45200 > http [ACK] Seq=97 Ack=1479 Win=29952 Len=0 TSval=19554619 TSecr=447801031
 15   0.858586 172.31.29.138 -> 54.230.150.107 TCP 66 45200 > http [FIN, ACK] Seq=97 Ack=1479 Win=29952 Len=0 TSval=19554619 TSecr=447801031
 16   0.859918 54.230.150.107 -> 172.31.29.138 TCP 66 http > 45200 [FIN, ACK] Seq=1479 Ack=98 Win=14592 Len=0 TSval=447801031 TSecr=19554619
 17   0.859926 172.31.29.138 -> 54.230.150.107 TCP 66 45200 > http [ACK] Seq=98 Ack=1480 Win=29952 Len=0 TSval=19554619 TSecr=447801031
