[Measurement for 1kb at 08:39:05 20.39.2014] 
Tshark:

  1   0.000000 172.31.29.138 -> 172.31.0.2   DNS 89 Standard query 0x861c  A d2pcb72msibvx3.cloudfront.net
  2   0.000026 172.31.29.138 -> 172.31.0.2   DNS 89 Standard query 0xcc2c  AAAA d2pcb72msibvx3.cloudfront.net
  3   0.000650   172.31.0.2 -> 172.31.29.138 DNS 217 Standard query response 0x861c  A 54.230.150.54 A 54.230.150.69 A 54.230.150.109 A 54.230.151.251 A 54.230.149.215 A 54.230.149.229 A 54.230.150.12 A 54.230.150.40
  4   0.003905   172.31.0.2 -> 172.31.29.138 DNS 169 Standard query response 0xcc2c 
  5   0.011871 172.31.29.138 -> 54.230.150.54 TCP 74 32818 > http [SYN] Seq=0 Win=26883 Len=0 MSS=8961 SACK_PERM=1 TSval=14154474 TSecr=0 WS=128
  6   0.013136 54.230.150.54 -> 172.31.29.138 TCP 74 http > 32818 [SYN, ACK] Seq=0 Ack=1 Win=14480 Len=0 MSS=1460 SACK_PERM=1 TSval=1455739963 TSecr=14154474 WS=128
  7   0.013153 172.31.29.138 -> 54.230.150.54 TCP 66 32818 > http [ACK] Seq=1 Ack=1 Win=27008 Len=0 TSval=14154474 TSecr=1455739963
  8   0.013208 172.31.29.138 -> 54.230.150.54 HTTP 162 GET /1kb HTTP/1.1 
  9   0.014583 54.230.150.54 -> 172.31.29.138 TCP 66 http > 32818 [ACK] Seq=1 Ack=97 Win=14592 Len=0 TSval=1455739963 TSecr=14154474
 10   0.016417 54.230.150.54 -> 172.31.29.138 HTTP 1544 HTTP/1.1 200 OK  (application/octet-stream)
 11   0.016424 172.31.29.138 -> 54.230.150.54 TCP 66 32818 > http [ACK] Seq=97 Ack=1479 Win=29952 Len=0 TSval=14154475 TSecr=1455739963
 12   0.016603 172.31.29.138 -> 54.230.150.54 TCP 66 32818 > http [FIN, ACK] Seq=97 Ack=1479 Win=29952 Len=0 TSval=14154475 TSecr=1455739963
 13   0.018190 54.230.150.54 -> 172.31.29.138 TCP 66 http > 32818 [FIN, ACK] Seq=1479 Ack=98 Win=14592 Len=0 TSval=1455739963 TSecr=14154475
 14   0.018201 172.31.29.138 -> 54.230.150.54 TCP 66 32818 > http [ACK] Seq=98 Ack=1480 Win=29952 Len=0 TSval=14154475 TSecr=1455739963
