[Measurement for 1kb at 19:39:40 19.39.2014] 
Tshark:

  1   0.000000 172.31.29.138 -> 172.31.0.2   DNS 89 Standard query 0xd719  A d2pcb72msibvx3.cloudfront.net
  2   0.000028 172.31.29.138 -> 172.31.0.2   DNS 89 Standard query 0x644b  AAAA d2pcb72msibvx3.cloudfront.net
  3   0.000579   172.31.0.2 -> 172.31.29.138 DNS 217 Standard query response 0xd719  A 54.192.156.109 A 54.192.157.146 A 54.192.159.173 A 54.230.157.230 A 54.230.158.80 A 54.230.158.139 A 54.230.158.152 A 54.230.158.182
  4   0.068702   172.31.0.2 -> 172.31.29.138 DNS 169 Standard query response 0x644b 
  5   0.124446 172.31.29.138 -> 54.192.156.109 TCP 74 55751 > http [SYN] Seq=0 Win=26883 Len=0 MSS=8961 SACK_PERM=1 TSval=2463227 TSecr=0 WS=128
  6   0.125184 54.192.156.109 -> 172.31.29.138 TCP 74 http > 55751 [SYN, ACK] Seq=0 Ack=1 Win=14480 Len=0 MSS=1460 SACK_PERM=1 TSval=832284086 TSecr=2463227 WS=128
  7   0.125198 172.31.29.138 -> 54.192.156.109 TCP 66 55751 > http [ACK] Seq=1 Ack=1 Win=27008 Len=0 TSval=2463227 TSecr=832284086
  8   0.125244 172.31.29.138 -> 54.192.156.109 HTTP 162 GET /1kb HTTP/1.1 
  9   0.125732 54.192.156.109 -> 172.31.29.138 TCP 66 http > 55751 [ACK] Seq=1 Ack=97 Win=14592 Len=0 TSval=832284086 TSecr=2463227
 10   0.127573 54.192.156.109 -> 172.31.29.138 HTTP 1543 HTTP/1.1 200 OK  (application/octet-stream)
 11   0.127581 172.31.29.138 -> 54.192.156.109 TCP 66 55751 > http [ACK] Seq=97 Ack=1478 Win=29952 Len=0 TSval=2463228 TSecr=832284086
 12   0.127734 172.31.29.138 -> 54.192.156.109 TCP 66 55751 > http [FIN, ACK] Seq=97 Ack=1478 Win=29952 Len=0 TSval=2463228 TSecr=832284086
 13   0.128241 54.192.156.109 -> 172.31.29.138 TCP 66 http > 55751 [FIN, ACK] Seq=1478 Ack=98 Win=14592 Len=0 TSval=832284086 TSecr=2463228
 14   0.128249 172.31.29.138 -> 54.192.156.109 TCP 66 55751 > http [ACK] Seq=98 Ack=1479 Win=29952 Len=0 TSval=2463228 TSecr=832284086
